{
  "date": "2025-08-13",
  "date_of_scrape": "2025-08-29T07:03:12.072Z",
  "tool_version": "0.2.0",
  "number_of_announcements": 244,
  "announcements": [
    {
      "date": "2025-08-13",
      "id": "120713",
      "original_text": "Löschungsankündigung\nBayern Amtsgericht München HRB 263477\nSpicher Medical Consulting GmbH – München",
      "type": "Löschungsankündigung",
      "state": "Bayern",
      "amtsgericht": "Amtsgericht München",
      "registernummer": "HRB 263477",
      "registerart": "HRB",
      "company_name": "Spicher Medical Consulting GmbH",
      "company_seat": "München",
      "details": "13.08.2025 (Bekanntmachungsdatum)\n\nBayern Amtsgericht München HRB 263477\nLöschungsankündigung\n\nSpicher Medical Consulting GmbH\nGesellschaft mit beschränkter Haftung\nMünchen\n\nDas Registergericht beabsichtigt, die im Handelsregister eingetragene Gesellschaft wegen Vermögenslosigkeit von Amts wegen nach § 394 FamFG zu löschen. Die Frist zur Erhebung eines Widerspruchs ist auf drei Monate festgesetzt."
    },
    {
      "date": "2025-08-13",
      "id": "120714",
      "original_text": "Registerbekanntmachung nach dem Umwandlungsgesetz\nBayern Amtsgericht München HRB 258414\nStairway MidCo GmbH – München",
      "type": "Registerbekanntmachung nach dem Umwandlungsgesetz",
      "state": "Bayern",
      "amtsgericht": "Amtsgericht München",
      "registernummer": "HRB 258414",
      "registerart": "HRB",
      "company_name": "Stairway MidCo GmbH",
      "company_seat": "München",
      "details": "13.08.2025 (Bekanntmachungsdatum)\n\nBayern Amtsgericht München HRB 258414\nRegisterbekanntmachung nach dem Umwandlungsgesetz 12.08.2025 (Eintragungsdatum)\n\nStairway MidCo GmbH\nGesellschaft mit beschränkter Haftung\nMünchen\n\nDen Gläubigern der an der Verschmelzung beteiligten Rechtsträger ist, wenn sie binnen sechs Monaten nach dem Tag, an dem die Eintragung der Verschmelzung in das Register des Sitzes desjenigen Rechtsträgers, dessen Gläubiger sie sind, nach § 19 Abs. 3 UmwG als bekannt gemacht gilt, ihren Anspruch nach Grund und Höhe in Textform anmelden, Sicherheit zu leisten, soweit sie nicht Befriedigung verlangen können. Dieses Recht steht den Gläubigern jedoch nur zu, wenn sie glaubhaft machen, dass durch die Verschmelzung die Erfüllung ihrer Forderung gefährdet wird."
    },
    {
      "date": "2025-08-13",
      "id": "120715",
      "original_text": "Registerbekanntmachung nach dem Umwandlungsgesetz\nBayern Amtsgericht München HRB 206468\none2lead GmbH – Gräfelfing",
      "type": "Registerbekanntmachung nach dem Umwandlungsgesetz",
      "state": "Bayern",
      "amtsgericht": "Amtsgericht München",
      "registernummer": "HRB 206468",
      "registerart": "HRB",
      "company_name": "one2lead GmbH",
      "company_seat": "Gräfelfing",
      "details": "13.08.2025 (Bekanntmachungsdatum)\n\nBayern Amtsgericht München HRB 206468\nRegisterbekanntmachung nach dem Umwandlungsgesetz 12.08.2025 (Eintragungsdatum)\n\none2lead GmbH\nGesellschaft mit beschränkter Haftung\nGräfelfing\n\nDen Gläubigern der an der Verschmelzung beteiligten Rechtsträger ist, wenn sie binnen sechs Monaten nach dem Tag, an dem die Eintragung der Verschmelzung in das Register des Sitzes desjenigen Rechtsträgers, dessen Gläubiger sie sind, nach § 19 Abs. 3 UmwG als bekannt gemacht gilt, ihren Anspruch nach Grund und Höhe in Textform anmelden, Sicherheit zu leisten, soweit sie nicht Befriedigung verlangen können. Dieses Recht steht den Gläubigern jedoch nur zu, wenn sie glaubhaft machen, dass durch die Verschmelzung die Erfüllung ihrer Forderung gefährdet wird."
    },
    {
      "date": "2025-08-13",
      "id": "120716",
      "original_text": "Registerbekanntmachung nach dem Umwandlungsgesetz\nBayern Amtsgericht Memmingen HRB 21550\nAutomobile Nord GmbH – Memmingen",
      "type": "Registerbekanntmachung nach dem Umwandlungsgesetz",
      "state": "Bayern",
      "amtsgericht": "Amtsgericht Memmingen",
      "registernummer": "HRB 21550",
      "registerart": "HRB",
      "company_name": "Automobile Nord GmbH",
      "company_seat": "Memmingen",
      "details": "13.08.2025 (Bekanntmachungsdatum)\n\nBayern Amtsgericht Memmingen HRB 21550\nRegisterbekanntmachung nach dem Umwandlungsgesetz 12.08.2025 (Eintragungsdatum)\n\nAutomobile Nord GmbH\nGesellschaft mit beschränkter Haftung\nMemmingen\n\nDen Gläubigern der an der Ausgliederung beteiligten Rechtsträger ist, wenn sie binnen sechs Monaten nach dem Tag, an dem die Eintragung der Ausgliederung in das Register des Sitzes desjenigen Rechtsträgers, dessen Gläubiger sie sind, nach §§ 125, 19 Abs. 3 UmwG als bekannt gemacht gilt, ihren Anspruch nach Grund und Höhe in Textform anmelden, Sicherheit zu leisten, soweit sie nicht Befriedigung verlangen können. Dieses Recht steht den Gläubigern jedoch nur zu, wenn sie glaubhaft machen, dass durch die Ausgliederung die Erfüllung ihrer Forderung gefährdet wird."
    },
    {
      "date": "2025-08-13",
      "id": "120717",
      "original_text": "Einreichung neuer Dokumente\nBayern Amtsgericht Passau HRB 12097\nInTiCa Systems SE – Passau",
      "type": "Einreichung neuer Dokumente",
      "state": "Bayern",
      "amtsgericht": "Amtsgericht Passau",
      "registernummer": "HRB 12097",
      "registerart": "HRB",
      "company_name": "InTiCa Systems SE",
      "company_seat": "Passau",
      "details": "13.08.2025 (Bekanntmachungsdatum)\n\nBayern Amtsgericht Passau HRB 12097\nEinreichung neuer Dokumente\n\nInTiCa Systems SE\nEuropäische Aktiengesellschaft (SE)\nPassau\n\nDem Amtsgericht Passau -Registergericht- ist eine Liste der Mitglieder des Aufsichtsrats eingereicht worden, Art. 9 Abs. 1 Buchst. c (ii) SE-VO i.V.m. § 106 AktG."
    },
    {
      "date": "2025-08-13",
      "id": "120718",
      "original_text": "Registerbekanntmachung nach dem Umwandlungsgesetz\nBayern Amtsgericht München HRB 293785\nREPRO IMAGE TEAM GmbH – Kirchheim b.München",
      "type": "Registerbekanntmachung nach dem Umwandlungsgesetz",
      "state": "Bayern",
      "amtsgericht": "Amtsgericht München",
      "registernummer": "HRB 293785",
      "registerart": "HRB",
      "company_name": "REPRO IMAGE TEAM GmbH",
      "company_seat": "Kirchheim b.München",
      "details": "13.08.2025 (Bekanntmachungsdatum)\n\nBayern Amtsgericht München HRB 293785\nRegisterbekanntmachung nach dem Umwandlungsgesetz 12.08.2025 (Eintragungsdatum)\n\nREPRO IMAGE TEAM GmbH\nGesellschaft mit beschränkter Haftung\nKirchheim b.München\n\nDen Gläubigern der an der Verschmelzung beteiligten Rechtsträger ist, wenn sie binnen sechs Monaten nach dem Tag, an dem die Eintragung der Verschmelzung in das Register des Sitzes desjenigen Rechtsträgers, dessen Gläubiger sie sind, nach § 19 Abs. 3 UmwG als bekannt gemacht gilt, ihren Anspruch nach Grund und Höhe in Textform anmelden, Sicherheit zu leisten, soweit sie nicht Befriedigung verlangen können. Dieses Recht steht den Gläubigern jedoch nur zu, wenn sie glaubhaft machen, dass durch die Verschmelzung die Erfüllung ihrer Forderung gefährdet wird."
    },
    {
      "date": "2025-08-13",
      "id": "120719",
      "original_text": "Löschungsankündigung\nBayern Amtsgericht Schweinfurt HRB 8123\nEQ-Mobil GmbH – Schweinfurt",
      "type": "Löschungsankündigung",
      "state": "Bayern",
      "amtsgericht": "Amtsgericht Schweinfurt",
      "registernummer": "HRB 8123",
      "registerart": "HRB",
      "company_name": "EQ-Mobil GmbH",
      "company_seat": "Schweinfurt",
      "details": "13.08.2025 (Bekanntmachungsdatum)\n\nBayern Amtsgericht Schweinfurt HRB 8123\nLöschungsankündigung 12.08.2025 (Eintragungsdatum)\n\nEQ-Mobil GmbH\nGesellschaft mit beschränkter Haftung\nSchweinfurt\n\nDas Registergericht beabsichtigt, die im Handelsregister eingetragene Gesellschaft wegen Vermögenslosigkeit von Amts wegen nach § 394 FamFG zu löschen. Die Frist zur Erhebung eines Widerspruchs ist auf einen Monat festgesetzt."
    },
    {
      "date": "2025-08-13",
      "id": "120720",
      "original_text": "Registerbekanntmachung nach dem Umwandlungsgesetz\nBayern Amtsgericht München HRB 228028\nA. Gerstner Vermögensverwaltungs GmbH – Forstern",
      "type": "Registerbekanntmachung nach dem Umwandlungsgesetz",
      "state": "Bayern",
      "amtsgericht": "Amtsgericht München",
      "registernummer": "HRB 228028",
      "registerart": "HRB",
      "company_name": "A. Gerstner Vermögensverwaltungs GmbH",
      "company_seat": "Forstern",
      "details": "13.08.2025 (Bekanntmachungsdatum)\n\nBayern Amtsgericht München HRB 228028\nRegisterbekanntmachung nach dem Umwandlungsgesetz 12.08.2025 (Eintragungsdatum)\n\nA. Gerstner Vermögensverwaltungs GmbH\nGesellschaft mit beschränkter Haftung\nForstern\n\nDen Gläubigern der an der Verschmelzung beteiligten Rechtsträger ist, wenn sie binnen sechs Monaten nach dem Tag, an dem die Eintragung der Verschmelzung in das Register des Sitzes desjenigen Rechtsträgers, dessen Gläubiger sie sind, nach § 19 Abs. 3 UmwG als bekannt gemacht gilt, ihren Anspruch nach Grund und Höhe in Textform anmelden, Sicherheit zu leisten, soweit sie nicht Befriedigung verlangen können. Dieses Recht steht den Gläubigern jedoch nur zu, wenn sie glaubhaft machen, dass durch die Verschmelzung die Erfüllung ihrer Forderung gefährdet wird."
    },
    {
      "date": "2025-08-13",
      "id": "120721",
      "original_text": "Einreichung neuer Dokumente\nBayern Amtsgericht Hof HRB 6212\nBHS tabletop Aktiengesellschaft – Selb",
      "type": "Einreichung neuer Dokumente",
      "state": "Bayern",
      "amtsgericht": "Amtsgericht Hof",
      "registernummer": "HRB 6212",
      "registerart": "HRB",
      "company_name": "BHS tabletop Aktiengesellschaft",
      "company_seat": "Selb",
      "details": "13.08.2025 (Bekanntmachungsdatum)\n\nBayern Amtsgericht Hof HRB 6212\nEinreichung neuer Dokumente\n\nBHS tabletop Aktiengesellschaft\nAktiengesellschaft\nSelb\n\nDem Amtsgericht Hof -Registergericht- ist eine Liste der Mitglieder des Aufsichtsrats eingereicht worden, § 106 AktG."
    },
    {
      "date": "2025-08-13",
      "id": "120722",
      "original_text": "Registerbekanntmachung nach dem Umwandlungsgesetz\nBayern Amtsgericht Landshut HRB 2078\nVR-Versicherungsdienst GmbH – Landau a.d. Isar",
      "type": "Registerbekanntmachung nach dem Umwandlungsgesetz",
      "state": "Bayern",
      "amtsgericht": "Amtsgericht Landshut",
      "registernummer": "HRB 2078",
      "registerart": "HRB",
      "company_name": "VR-Versicherungsdienst GmbH",
      "company_seat": "Landau a.d. Isar",
      "details": "13.08.2025 (Bekanntmachungsdatum)\n\nBayern Amtsgericht Landshut HRB 2078\nRegisterbekanntmachung nach dem Umwandlungsgesetz 12.08.2025 (Eintragungsdatum)\n\nVR-Versicherungsdienst GmbH\nGesellschaft mit beschränkter Haftung\nLandau a.d. Isar\n\nDen Gläubigern der an der Verschmelzung beteiligten Rechtsträger ist, wenn sie binnen sechs Monaten nach dem Tag, an dem die Eintragung der Verschmelzung in das Register des Sitzes desjenigen Rechtsträgers, dessen Gläubiger sie sind, nach § 19 Abs. 3 UmwG als bekannt gemacht gilt, ihren Anspruch nach Grund und Höhe in Textform anmelden, Sicherheit zu leisten, soweit sie nicht Befriedigung verlangen können. Dieses Recht steht den Gläubigern jedoch nur zu, wenn sie glaubhaft machen, dass durch die Verschmelzung die Erfüllung ihrer Forderung gefährdet wird."
    },
    {
      "date": "2025-08-13",
      "id": "120723",
      "original_text": "Registerbekanntmachung nach dem Umwandlungsgesetz\nBayern Amtsgericht München HRB 235362\nJoyn GmbH – München",
      "type": "Registerbekanntmachung nach dem Umwandlungsgesetz",
      "state": "Bayern",
      "amtsgericht": "Amtsgericht München",
      "registernummer": "HRB 235362",
      "registerart": "HRB",
      "company_name": "Joyn GmbH",
      "company_seat": "München",
      "details": "13.08.2025 (Bekanntmachungsdatum)\n\nBayern Amtsgericht München HRB 235362\nRegisterbekanntmachung nach dem Umwandlungsgesetz 12.08.2025 (Eintragungsdatum)\n\nJoyn GmbH\nGesellschaft mit beschränkter Haftung\nMünchen\n\nDen Gläubigern der an der Verschmelzung beteiligten Rechtsträger ist, wenn sie binnen sechs Monaten nach dem Tag, an dem die Eintragung der Verschmelzung in das Register des Sitzes desjenigen Rechtsträgers, dessen Gläubiger sie sind, nach § 19 Abs. 3 UmwG als bekannt gemacht gilt, ihren Anspruch nach Grund und Höhe in Textform anmelden, Sicherheit zu leisten, soweit sie nicht Befriedigung verlangen können. Dieses Recht steht den Gläubigern jedoch nur zu, wenn sie glaubhaft machen, dass durch die Verschmelzung die Erfüllung ihrer Forderung gefährdet wird."
    },
    {
      "date": "2025-08-13",
      "id": "120724",
      "original_text": "Registerbekanntmachung nach dem Umwandlungsgesetz\nBayern Amtsgericht Würzburg HRB 3268\nEinbauküchen W. Bäuerlein GmbH. – Volkach",
      "type": "Registerbekanntmachung nach dem Umwandlungsgesetz",
      "state": "Bayern",
      "amtsgericht": "Amtsgericht Würzburg",
      "registernummer": "HRB 3268",
      "registerart": "HRB",
      "company_name": "Einbauküchen W. Bäuerlein GmbH.",
      "company_seat": "Volkach",
      "details": "13.08.2025 (Bekanntmachungsdatum)\n\nBayern Amtsgericht Würzburg HRB 3268\nRegisterbekanntmachung nach dem Umwandlungsgesetz 12.08.2025 (Eintragungsdatum)\n\nEinbauküchen W. Bäuerlein GmbH.\nGesellschaft mit beschränkter Haftung\nVolkach\n\nDen Gläubigern der an der Verschmelzung beteiligten Rechtsträger ist, wenn sie binnen sechs Monaten nach dem Tag, an dem die Eintragung der Verschmelzung in das Register des Sitzes desjenigen Rechtsträgers, dessen Gläubiger sie sind, nach § 19 Abs. 3 UmwG als bekannt gemacht gilt, ihren Anspruch nach Grund und Höhe in Textform anmelden, Sicherheit zu leisten, soweit sie nicht Befriedigung verlangen können. Dieses Recht steht den Gläubigern jedoch nur zu, wenn sie glaubhaft machen, dass durch die Verschmelzung die Erfüllung ihrer Forderung gefährdet wird."
    },
    {
      "date": "2025-08-13",
      "id": "120725",
      "original_text": "Registerbekanntmachung nach dem Umwandlungsgesetz\nBayern Amtsgericht München HRB 285374\nRegula Germany Bidco GmbH – München",
      "type": "Registerbekanntmachung nach dem Umwandlungsgesetz",
      "state": "Bayern",
      "amtsgericht": "Amtsgericht München",
      "registernummer": "HRB 285374",
      "registerart": "HRB",
      "company_name": "Regula Germany Bidco GmbH",
      "company_seat": "München",
      "details": "13.08.2025 (Bekanntmachungsdatum)\n\nBayern Amtsgericht München HRB 285374\nRegisterbekanntmachung nach dem Umwandlungsgesetz 12.08.2025 (Eintragungsdatum)\n\nRegula Germany Bidco GmbH\nGesellschaft mit beschränkter Haftung\nMünchen\n\nDen Gläubigern der an der Verschmelzung beteiligten Rechtsträger ist, wenn sie binnen sechs Monaten nach dem Tag, an dem die Eintragung der Verschmelzung in das Register des Sitzes desjenigen Rechtsträgers, dessen Gläubiger sie sind, nach § 19 Abs. 3 UmwG als bekannt gemacht gilt, ihren Anspruch nach Grund und Höhe in Textform anmelden, Sicherheit zu leisten, soweit sie nicht Befriedigung verlangen können. Dieses Recht steht den Gläubigern jedoch nur zu, wenn sie glaubhaft machen, dass durch die Verschmelzung die Erfüllung ihrer Forderung gefährdet wird."
    },
    {
      "date": "2025-08-13",
      "id": "120726",
      "original_text": "Registerbekanntmachung nach dem Umwandlungsgesetz\nBayern Amtsgericht München HRB 88308\nGeoplan Bauentwicklungs GmbH – Grünwald",
      "type": "Registerbekanntmachung nach dem Umwandlungsgesetz",
      "state": "Bayern",
      "amtsgericht": "Amtsgericht München",
      "registernummer": "HRB 88308",
      "registerart": "HRB",
      "company_name": "Geoplan Bauentwicklungs GmbH",
      "company_seat": "Grünwald",
      "details": "13.08.2025 (Bekanntmachungsdatum)\n\nBayern Amtsgericht München HRB 88308\nRegisterbekanntmachung nach dem Umwandlungsgesetz 12.08.2025 (Eintragungsdatum)\n\nGeoplan Bauentwicklungs GmbH\nGesellschaft mit beschränkter Haftung\nGrünwald\n\nDen Gläubigern der an der Verschmelzung beteiligten Rechtsträger ist, wenn sie binnen sechs Monaten nach dem Tag, an dem die Eintragung der Verschmelzung in das Register des Sitzes desjenigen Rechtsträgers, dessen Gläubiger sie sind, nach § 19 Abs. 3 UmwG als bekannt gemacht gilt, ihren Anspruch nach Grund und Höhe in Textform anmelden, Sicherheit zu leisten, soweit sie nicht Befriedigung verlangen können. Dieses Recht steht den Gläubigern jedoch nur zu, wenn sie glaubhaft machen, dass durch die Verschmelzung die Erfüllung ihrer Forderung gefährdet wird."
    },
    {
      "date": "2025-08-13",
      "id": "120727",
      "original_text": "Registerbekanntmachung nach dem Umwandlungsgesetz\nBayern Amtsgericht München HRB 253011\nTECHTEX Deutschland GmbH – München",
      "type": "Registerbekanntmachung nach dem Umwandlungsgesetz",
      "state": "Bayern",
      "amtsgericht": "Amtsgericht München",
      "registernummer": "HRB 253011",
      "registerart": "HRB",
      "company_name": "TECHTEX Deutschland GmbH",
      "company_seat": "München",
      "details": "13.08.2025 (Bekanntmachungsdatum)\n\nBayern Amtsgericht München HRB 253011\nRegisterbekanntmachung nach dem Umwandlungsgesetz 12.08.2025 (Eintragungsdatum)\n\nTECHTEX Deutschland GmbH\nGesellschaft mit beschränkter Haftung\nMünchen\n\nDen Gläubigern der an der Verschmelzung beteiligten Rechtsträger ist, wenn sie binnen sechs Monaten nach dem Tag, an dem die Eintragung der Verschmelzung in das Register des Sitzes desjenigen Rechtsträgers, dessen Gläubiger sie sind, nach § 19 Abs. 3 UmwG als bekannt gemacht gilt, ihren Anspruch nach Grund und Höhe in Textform anmelden, Sicherheit zu leisten, soweit sie nicht Befriedigung verlangen können. Dieses Recht steht den Gläubigern jedoch nur zu, wenn sie glaubhaft machen, dass durch die Verschmelzung die Erfüllung ihrer Forderung gefährdet wird."
    },
    {
      "date": "2025-08-13",
      "id": "120728",
      "original_text": "Registerbekanntmachung nach dem Umwandlungsgesetz\nBayern Amtsgericht München HRB 205565\nSCUR24 Holding GmbH – München",
      "type": "Registerbekanntmachung nach dem Umwandlungsgesetz",
      "state": "Bayern",
      "amtsgericht": "Amtsgericht München",
      "registernummer": "HRB 205565",
      "registerart": "HRB",
      "company_name": "SCUR24 Holding GmbH",
      "company_seat": "München",
      "details": "13.08.2025 (Bekanntmachungsdatum)\n\nBayern Amtsgericht München HRB 205565\nRegisterbekanntmachung nach dem Umwandlungsgesetz 12.08.2025 (Eintragungsdatum)\n\nSCUR24 Holding GmbH\nGesellschaft mit beschränkter Haftung\nMünchen\n\nDen Gläubigern #dv.auswahl(Text=\"Bitte zutreffendes auswählen:\",Eingabe=\n\n\"der an der Verschmelzung beteiligten Rechtsträger ist, wenn sie binnen sechs Monaten nach dem Tag, an dem die Eintragung der Verschmelzung in das Register des Sitzes desjenigen Rechtsträgers, dessen Gläubiger sie sind, nach § 19 Abs. 3 UmwG als bekannt gemacht gilt, ihren Anspruch nach Grund und Höhe in Textform anmelden, Sicherheit zu leisten, soweit sie nicht Befriedigung verlangen können. Dieses Recht steht den Gläubigern jedoch nur zu, wenn sie glaubhaft machen, dass durch die Verschmelzung die Erfüllung ihrer Forderung gefährdet wird.\"|\"Verschmelzung\",\n\n\"der an der Spaltung beteiligten Rechtsträger ist, wenn sie binnen sechs Monaten nach dem Tag, an dem die Eintragung der Spaltung in das Register des Sitzes desjenigen Rechtsträgers, dessen Gläubiger sie sind, nach §§ 125, 19 Abs. 3 UmwG als bekannt gemacht gilt, ihren Anspruch nach Grund und Höhe in Textform anmelden, Sicherheit zu leisten, soweit sie nicht Befriedigung verlangen können. Dieses Recht steht den Gläubigern jedoch nur zu, wenn sie glaubhaft machen, dass durch die Spaltung die Erfüllung ihrer Forderung gefährdet wird.\"|\"Spaltung\",\n\n\"des formwechselnden Rechtsträgers ist, wenn sie binnen sechs Monaten nach dem Tag, an dem die Eintragung des Formwechsels nach § 201 UmwG als bekannt gemacht gilt, ihren Anspruch nach Grund und Höhe in Textform anmelden, Sicherheit zu leisten, soweit sie nicht Befriedigung verlangen können. Dieses Recht steht den Gläubigern jedoch nur zu, wenn sie glaubhaft machen, dass durch den Formwechsel die Erfüllung ihrer Forderung gefährdet wird.\"|\"formwechselnde Umwandlung\",\n\n\"der an der Ausgliederung beteiligten Rechtsträger ist, wenn sie binnen sechs Monaten nach dem Tag, an dem die Eintragung der Ausgliederung in das Register des Sitzes desjenigen Rechtsträgers, dessen Gläubiger sie sind, nach §§ 125, 19 Abs. 3 UmwG als bekannt gemacht gilt, ihren Anspruch nach Grund und Höhe in Textform anmelden, Sicherheit zu leisten, soweit sie nicht Befriedigung verlangen können. Dieses Recht steht den Gläubigern jedoch nur zu, wenn sie glaubhaft machen, dass durch die Ausgliederung die Erfüllung ihrer Forderung gefährdet wird.\"|\"Ausgliederung\")"
    },
    {
      "date": "2025-08-13",
      "id": "120729",
      "original_text": "Registerbekanntmachung nach dem Umwandlungsgesetz\nBayern Amtsgericht Kempten (Allgäu) HRA 11731\nLarisa Vetrovetz e. K. – Oberstdorf",
      "type": "Registerbekanntmachung nach dem Umwandlungsgesetz",
      "state": "Bayern",
      "amtsgericht": "Amtsgericht Kempten (Allgäu)",
      "registernummer": "HRA 11731",
      "registerart": "HRA",
      "company_name": "Larisa Vetrovetz e. K.",
      "company_seat": "Oberstdorf",
      "details": "13.08.2025 (Bekanntmachungsdatum)\n\nBayern Amtsgericht Kempten (Allgäu) HRA 11731\nRegisterbekanntmachung nach dem Umwandlungsgesetz 12.08.2025 (Eintragungsdatum)\n\nLarisa Vetrovetz e. K.\nEinzelkaufmann / Einzelkauffrau\nOberstdorf\n\nDen Gläubigern der an der Verschmelzung beteiligten Rechtsträger ist, wenn sie binnen sechs Monaten nach dem Tag, an dem die Eintragung der Verschmelzung in das Register des Sitzes desjenigen Rechtsträgers, dessen Gläubiger sie sind, nach § 19 Abs. 3 UmwG als bekannt gemacht gilt, ihren Anspruch nach Grund und Höhe in Textform anmelden, Sicherheit zu leisten, soweit sie nicht Befriedigung verlangen können. Dieses Recht steht den Gläubigern jedoch nur zu, wenn sie glaubhaft machen, dass durch die Verschmelzung die Erfüllung ihrer Forderung gefährdet wird."
    },
    {
      "date": "2025-08-13",
      "id": "120730",
      "original_text": "Registerbekanntmachung nach dem Umwandlungsgesetz\nBayern Amtsgericht Kempten (Allgäu) HRB 16925\nBayern Profis Gebäudedienstleistungen Larisa Vetrovetz, der Service für ihre Ferienimmobilie UG (haftungsbeschränkt) – Oberstdorf",
      "type": "Registerbekanntmachung nach dem Umwandlungsgesetz",
      "state": "Bayern",
      "amtsgericht": "Amtsgericht Kempten (Allgäu)",
      "registernummer": "HRB 16925",
      "registerart": "HRB",
      "company_name": "Bayern Profis Gebäudedienstleistungen Larisa Vetrovetz, der Service für ihre Ferienimmobilie UG (haftungsbeschränkt)",
      "company_seat": "Oberstdorf",
      "details": "13.08.2025 (Bekanntmachungsdatum)\n\nBayern Amtsgericht Kempten (Allgäu) HRB 16925\nRegisterbekanntmachung nach dem Umwandlungsgesetz 12.08.2025 (Eintragungsdatum)\n\nBayern Profis Gebäudedienstleistungen Larisa Vetrovetz, der Service für ihre Ferienimmobilie UG (haftungsbeschränkt)\nGesellschaft mit beschränkter Haftung\nOberstdorf\n\nDen Gläubigern der an der Verschmelzung beteiligten Rechtsträger ist, wenn sie binnen sechs Monaten nach dem Tag, an dem die Eintragung der Verschmelzung in das Register des Sitzes desjenigen Rechtsträgers, dessen Gläubiger sie sind, nach § 19 Abs. 3 UmwG als bekannt gemacht gilt, ihren Anspruch nach Grund und Höhe in Textform anmelden, Sicherheit zu leisten, soweit sie nicht Befriedigung verlangen können. Dieses Recht steht den Gläubigern jedoch nur zu, wenn sie glaubhaft machen, dass durch die Verschmelzung die Erfüllung ihrer Forderung gefährdet wird."
    },
    {
      "date": "2025-08-13",
      "id": "120731",
      "original_text": "Einreichung neuer Dokumente\nBayern Amtsgericht Nürnberg HRB 23915\nMax Bögl International SE – Sengenthal",
      "type": "Einreichung neuer Dokumente",
      "state": "Bayern",
      "amtsgericht": "Amtsgericht Nürnberg",
      "registernummer": "HRB 23915",
      "registerart": "HRB",
      "company_name": "Max Bögl International SE",
      "company_seat": "Sengenthal",
      "details": "13.08.2025 (Bekanntmachungsdatum)\n\nBayern Amtsgericht Nürnberg HRB 23915\nEinreichung neuer Dokumente 12.08.2025 (Eintragungsdatum)\n\nMax Bögl International SE\nEuropäische Aktiengesellschaft (SE)\nSengenthal\n\nDem Amtsgericht Nürnberg -Registergericht- ist eine Liste der Mitglieder des Aufsichtsrats eingereicht worden, Art. 9 Abs. 1 Buchst. c (ii) SE-VO i.V.m. § 106 AktG."
    },
    {
      "date": "2025-08-13",
      "id": "120732",
      "original_text": "Registerbekanntmachung nach dem Umwandlungsgesetz\nBayern Amtsgericht München HRB 243719\nAR Beratung München UG (haftungsbeschränkt) – Grafing b.München",
      "type": "Registerbekanntmachung nach dem Umwandlungsgesetz",
      "state": "Bayern",
      "amtsgericht": "Amtsgericht München",
      "registernummer": "HRB 243719",
      "registerart": "HRB",
      "company_name": "AR Beratung München UG (haftungsbeschränkt)",
      "company_seat": "Grafing b.München",
      "details": "13.08.2025 (Bekanntmachungsdatum)\n\nBayern Amtsgericht München HRB 243719\nRegisterbekanntmachung nach dem Umwandlungsgesetz 12.08.2025 (Eintragungsdatum)\n\nAR Beratung München UG (haftungsbeschränkt)\nGesellschaft mit beschränkter Haftung\nGrafing b.München\n\nDen Gläubigern der an der Verschmelzung beteiligten Rechtsträger ist, wenn sie binnen sechs Monaten nach dem Tag, an dem die Eintragung der Verschmelzung in das Register des Sitzes desjenigen Rechtsträgers, dessen Gläubiger sie sind, nach § 19 Abs. 3 UmwG als bekannt gemacht gilt, ihren Anspruch nach Grund und Höhe in Textform anmelden, Sicherheit zu leisten, soweit sie nicht Befriedigung verlangen können. Dieses Recht steht den Gläubigern jedoch nur zu, wenn sie glaubhaft machen, dass durch die Verschmelzung die Erfüllung ihrer Forderung gefährdet wird."
    },
    {
      "date": "2025-08-13",
      "id": "120733",
      "original_text": "Registerbekanntmachung nach dem Umwandlungsgesetz\nBayern Amtsgericht München HRB 250199\nBabyOne Erding GmbH – Erding",
      "type": "Registerbekanntmachung nach dem Umwandlungsgesetz",
      "state": "Bayern",
      "amtsgericht": "Amtsgericht München",
      "registernummer": "HRB 250199",
      "registerart": "HRB",
      "company_name": "BabyOne Erding GmbH",
      "company_seat": "Erding",
      "details": "13.08.2025 (Bekanntmachungsdatum)\n\nBayern Amtsgericht München HRB 250199\nRegisterbekanntmachung nach dem Umwandlungsgesetz 12.08.2025 (Eintragungsdatum)\n\nBabyOne Erding GmbH\nGesellschaft mit beschränkter Haftung\nErding\n\nDen Gläubigern der an der Verschmelzung beteiligten Rechtsträger ist, wenn sie binnen sechs Monaten nach dem Tag, an dem die Eintragung der Verschmelzung in das Register des Sitzes desjenigen Rechtsträgers, dessen Gläubiger sie sind, nach § 19 Abs. 3 UmwG als bekannt gemacht gilt, ihren Anspruch nach Grund und Höhe in Textform anmelden, Sicherheit zu leisten, soweit sie nicht Befriedigung verlangen können. Dieses Recht steht den Gläubigern jedoch nur zu, wenn sie glaubhaft machen, dass durch die Verschmelzung die Erfüllung ihrer Forderung gefährdet wird."
    },
    {
      "date": "2025-08-13",
      "id": "120734",
      "original_text": "Registerbekanntmachung nach dem Umwandlungsgesetz\nBayern Amtsgericht München HRB 228348\nEP01 GmbH – München",
      "type": "Registerbekanntmachung nach dem Umwandlungsgesetz",
      "state": "Bayern",
      "amtsgericht": "Amtsgericht München",
      "registernummer": "HRB 228348",
      "registerart": "HRB",
      "company_name": "EP01 GmbH",
      "company_seat": "München",
      "details": "13.08.2025 (Bekanntmachungsdatum)\n\nBayern Amtsgericht München HRB 228348\nRegisterbekanntmachung nach dem Umwandlungsgesetz 12.08.2025 (Eintragungsdatum)\n\nEP01 GmbH\nGesellschaft mit beschränkter Haftung\nMünchen\n\nDen Gläubigern der an der Verschmelzung beteiligten Rechtsträger ist, wenn sie binnen sechs Monaten nach dem Tag, an dem die Eintragung der Verschmelzung in das Register des Sitzes desjenigen Rechtsträgers, dessen Gläubiger sie sind, nach § 19 Abs. 3 UmwG als bekannt gemacht gilt, ihren Anspruch nach Grund und Höhe in Textform anmelden, Sicherheit zu leisten, soweit sie nicht Befriedigung verlangen können. Dieses Recht steht den Gläubigern jedoch nur zu, wenn sie glaubhaft machen, dass durch die Verschmelzung die Erfüllung ihrer Forderung gefährdet wird."
    },
    {
      "date": "2025-08-13",
      "id": "120735",
      "original_text": "Einreichung neuer Dokumente\nBayern Amtsgericht München HRB 280912\nCherry SE – München",
      "type": "Einreichung neuer Dokumente",
      "state": "Bayern",
      "amtsgericht": "Amtsgericht München",
      "registernummer": "HRB 280912",
      "registerart": "HRB",
      "company_name": "Cherry SE",
      "company_seat": "München",
      "details": "13.08.2025 (Bekanntmachungsdatum)\n\nBayern Amtsgericht München HRB 280912\nEinreichung neuer Dokumente 12.08.2025 (Eintragungsdatum)\n\nCherry SE\nEuropäische Aktiengesellschaft (SE)\nMünchen\n\nDem Amtsgericht München -Registergericht- ist eine Liste der Mitglieder des Aufsichtsrats eingereicht worden, Art. 9 Abs. 1 Buchst. c (ii) SE-VO i.V.m. § 106 AktG."
    },
    {
      "date": "2025-08-13",
      "id": "120736",
      "original_text": "Sonstige Registerbekanntmachung\nBayern Amtsgericht München HRB 82381\nBMW Bank GmbH – München",
      "type": "Sonstige Registerbekanntmachung",
      "state": "Bayern",
      "amtsgericht": "Amtsgericht München",
      "registernummer": "HRB 82381",
      "registerart": "HRB",
      "company_name": "BMW Bank GmbH",
      "company_seat": "München",
      "details": "13.08.2025 (Bekanntmachungsdatum)\n\nBayern Amtsgericht München HRB 82381\nSonstige Registerbekanntmachung\n\nBMW Bank GmbH\nGesellschaft mit beschränkter Haftung\nMünchen\n\nDem Amtsgericht München -Registergericht- ist eine Liste der Mitglieder des Aufsichtsrats eingereicht worden, § 52 Abs. 3 S. 2 GmbHG."
    },
    {
      "date": "2025-08-13",
      "id": "120737",
      "original_text": "Registerbekanntmachung nach dem Umwandlungsgesetz\nBayern Amtsgericht Memmingen HRA 14250\nAutomobile Nord Klaus Freundorfer e. K. – Memmingen",
      "type": "Registerbekanntmachung nach dem Umwandlungsgesetz",
      "state": "Bayern",
      "amtsgericht": "Amtsgericht Memmingen",
      "registernummer": "HRA 14250",
      "registerart": "HRA",
      "company_name": "Automobile Nord Klaus Freundorfer e. K.",
      "company_seat": "Memmingen",
      "details": "13.08.2025 (Bekanntmachungsdatum)\n\nBayern Amtsgericht Memmingen HRA 14250\nRegisterbekanntmachung nach dem Umwandlungsgesetz 12.08.2025 (Eintragungsdatum)\n\nAutomobile Nord Klaus Freundorfer e. K.\nEinzelkaufmann / Einzelkauffrau\nMemmingen\n\nDen Gläubigern der an der Ausgliederung beteiligten Rechtsträger ist, wenn sie binnen sechs Monaten nach dem Tag, an dem die Eintragung der Ausgliederung in das Register des Sitzes desjenigen Rechtsträgers, dessen Gläubiger sie sind, nach §§ 125, 19 Abs. 3 UmwG als bekannt gemacht gilt, ihren Anspruch nach Grund und Höhe in Textform anmelden, Sicherheit zu leisten, soweit sie nicht Befriedigung verlangen können. Dieses Recht steht den Gläubigern jedoch nur zu, wenn sie glaubhaft machen, dass durch die Ausgliederung die Erfüllung ihrer Forderung gefährdet wird."
    },
    {
      "date": "2025-08-13",
      "id": "120738",
      "original_text": "Registerbekanntmachung nach dem Umwandlungsgesetz\nBayern Amtsgericht München HRB 259630\nTreysta Unternehmensgruppe GmbH – München",
      "type": "Registerbekanntmachung nach dem Umwandlungsgesetz",
      "state": "Bayern",
      "amtsgericht": "Amtsgericht München",
      "registernummer": "HRB 259630",
      "registerart": "HRB",
      "company_name": "Treysta Unternehmensgruppe GmbH",
      "company_seat": "München",
      "details": "13.08.2025 (Bekanntmachungsdatum)\n\nBayern Amtsgericht München HRB 259630\nRegisterbekanntmachung nach dem Umwandlungsgesetz 12.08.2025 (Eintragungsdatum)\n\nTreysta Unternehmensgruppe GmbH\nGesellschaft mit beschränkter Haftung\nMünchen\n\nDen Gläubigern der an der Verschmelzung beteiligten Rechtsträger ist, wenn sie binnen sechs Monaten nach dem Tag, an dem die Eintragung der Verschmelzung in das Register des Sitzes desjenigen Rechtsträgers, dessen Gläubiger sie sind, nach § 19 Abs. 3 UmwG als bekannt gemacht gilt, ihren Anspruch nach Grund und Höhe in Textform anmelden, Sicherheit zu leisten, soweit sie nicht Befriedigung verlangen können. Dieses Recht steht den Gläubigern jedoch nur zu, wenn sie glaubhaft machen, dass durch die Verschmelzung die Erfüllung ihrer Forderung gefährdet wird."
    },
    {
      "date": "2025-08-13",
      "id": "120739",
      "original_text": "Registerbekanntmachung nach dem Umwandlungsgesetz\nBayern Amtsgericht München HRB 224309\nMenzolit GmbH – Freising",
      "type": "Registerbekanntmachung nach dem Umwandlungsgesetz",
      "state": "Bayern",
      "amtsgericht": "Amtsgericht München",
      "registernummer": "HRB 224309",
      "registerart": "HRB",
      "company_name": "Menzolit GmbH",
      "company_seat": "Freising",
      "details": "13.08.2025 (Bekanntmachungsdatum)\n\nBayern Amtsgericht München HRB 224309\nRegisterbekanntmachung nach dem Umwandlungsgesetz 12.08.2025 (Eintragungsdatum)\n\nMenzolit GmbH\nGesellschaft mit beschränkter Haftung\nFreising\n\nDen Gläubigern der an der Verschmelzung beteiligten Rechtsträger ist, wenn sie binnen sechs Monaten nach dem Tag, an dem die Eintragung der Verschmelzung in das Register des Sitzes desjenigen Rechtsträgers, dessen Gläubiger sie sind, nach § 19 Abs. 3 UmwG als bekannt gemacht gilt, ihren Anspruch nach Grund und Höhe in Textform anmelden, Sicherheit zu leisten, soweit sie nicht Befriedigung verlangen können. Dieses Recht steht den Gläubigern jedoch nur zu, wenn sie glaubhaft machen, dass durch die Verschmelzung die Erfüllung ihrer Forderung gefährdet wird."
    },
    {
      "date": "2025-08-13",
      "id": "120740",
      "original_text": "Löschungsankündigung\nBayern Amtsgericht München HRB 272405\nS.T.F. Gastro UG (haftungsbeschränkt) – München",
      "type": "Löschungsankündigung",
      "state": "Bayern",
      "amtsgericht": "Amtsgericht München",
      "registernummer": "HRB 272405",
      "registerart": "HRB",
      "company_name": "S.T.F. Gastro UG (haftungsbeschränkt)",
      "company_seat": "München",
      "details": "13.08.2025 (Bekanntmachungsdatum)\n\nBayern Amtsgericht München HRB 272405\nLöschungsankündigung 12.08.2025 (Eintragungsdatum)\n\nS.T.F. Gastro UG (haftungsbeschränkt)\nGesellschaft mit beschränkter Haftung\nMünchen\n\nDas Registergericht beabsichtigt, die im Handelsregister eingetragene Gesellschaft wegen Vermögenslosigkeit von Amts wegen nach § 394 FamFG zu löschen. Die Frist zur Erhebung eines Widerspruchs ist auf drei Monate festgesetzt."
    },
    {
      "date": "2025-08-13",
      "id": "120741",
      "original_text": "Registerbekanntmachung nach dem Umwandlungsgesetz\nBayern Amtsgericht München HRB 258414\nStairway MidCo GmbH – München",
      "type": "Registerbekanntmachung nach dem Umwandlungsgesetz",
      "state": "Bayern",
      "amtsgericht": "Amtsgericht München",
      "registernummer": "HRB 258414",
      "registerart": "HRB",
      "company_name": "Stairway MidCo GmbH",
      "company_seat": "München",
      "details": "13.08.2025 (Bekanntmachungsdatum)\n\nBayern Amtsgericht München HRB 258414\nRegisterbekanntmachung nach dem Umwandlungsgesetz 12.08.2025 (Eintragungsdatum)\n\nStairway MidCo GmbH\nGesellschaft mit beschränkter Haftung\nMünchen\n\nDen Gläubigern der an der Verschmelzung beteiligten Rechtsträger ist, wenn sie binnen sechs Monaten nach dem Tag, an dem die Eintragung der Verschmelzung in das Register des Sitzes desjenigen Rechtsträgers, dessen Gläubiger sie sind, nach § 19 Abs. 3 UmwG als bekannt gemacht gilt, ihren Anspruch nach Grund und Höhe in Textform anmelden, Sicherheit zu leisten, soweit sie nicht Befriedigung verlangen können. Dieses Recht steht den Gläubigern jedoch nur zu, wenn sie glaubhaft machen, dass durch die Verschmelzung die Erfüllung ihrer Forderung gefährdet wird."
    },
    {
      "date": "2025-08-13",
      "id": "120742",
      "original_text": "Registerbekanntmachung nach dem Umwandlungsgesetz\nBayern Amtsgericht München HRB 280164\ncheckpoint.eco GmbH – Ismaning",
      "type": "Registerbekanntmachung nach dem Umwandlungsgesetz",
      "state": "Bayern",
      "amtsgericht": "Amtsgericht München",
      "registernummer": "HRB 280164",
      "registerart": "HRB",
      "company_name": "checkpoint.eco GmbH",
      "company_seat": "Ismaning",
      "details": "13.08.2025 (Bekanntmachungsdatum)\n\nBayern Amtsgericht München HRB 280164\nRegisterbekanntmachung nach dem Umwandlungsgesetz 12.08.2025 (Eintragungsdatum)\n\ncheckpoint.eco GmbH\nGesellschaft mit beschränkter Haftung\nIsmaning\n\nDen Gläubigern der an der Verschmelzung beteiligten Rechtsträger ist, wenn sie binnen sechs Monaten nach dem Tag, an dem die Eintragung der Verschmelzung in das Register des Sitzes desjenigen Rechtsträgers, dessen Gläubiger sie sind, nach § 19 Abs. 3 UmwG als bekannt gemacht gilt, ihren Anspruch nach Grund und Höhe in Textform anmelden, Sicherheit zu leisten, soweit sie nicht Befriedigung verlangen können. Dieses Recht steht den Gläubigern jedoch nur zu, wenn sie glaubhaft machen, dass durch die Verschmelzung die Erfüllung ihrer Forderung gefährdet wird."
    },
    {
      "date": "2025-08-13",
      "id": "120743",
      "original_text": "Einreichung neuer Dokumente\nBayern Amtsgericht München HRB 242437\nLear Corporation Engineering GmbH – Oberding",
      "type": "Einreichung neuer Dokumente",
      "state": "Bayern",
      "amtsgericht": "Amtsgericht München",
      "registernummer": "HRB 242437",
      "registerart": "HRB",
      "company_name": "Lear Corporation Engineering GmbH",
      "company_seat": "Oberding",
      "details": "13.08.2025 (Bekanntmachungsdatum)\n\nBayern Amtsgericht München HRB 242437\nEinreichung neuer Dokumente\n\nLear Corporation Engineering GmbH\nGesellschaft mit beschränkter Haftung\nOberding\n\nDem Amtsgericht München -Registergericht- ist eine Liste der Mitglieder des Aufsichtsrats eingereicht worden, § 52 Abs. 3 S. 2 GmbHG."
    },
    {
      "date": "2025-08-13",
      "id": "120744",
      "original_text": "Registerbekanntmachung nach dem Umwandlungsgesetz\nBayern Amtsgericht Nürnberg VR 201465\nFörderverein der Caritas-Sozialstation und Tagespflege Nürnberg-Nord e.V. – Nürnberg",
      "type": "Registerbekanntmachung nach dem Umwandlungsgesetz",
      "state": "Bayern",
      "amtsgericht": "Amtsgericht Nürnberg",
      "registernummer": "VR 201465",
      "registerart": "VR",
      "company_name": "Förderverein der Caritas-Sozialstation und Tagespflege Nürnberg-Nord e.V.",
      "company_seat": "Nürnberg",
      "details": "13.08.2025 (Bekanntmachungsdatum)\n\nBayern Amtsgericht Nürnberg VR 201465\nRegisterbekanntmachung nach dem Umwandlungsgesetz 12.08.2025 (Eintragungsdatum)\n\nFörderverein der Caritas-Sozialstation und Tagespflege Nürnberg-Nord e.V.\neingetragener Verein\nNürnberg\n\nDen Gläubigern der an der Verschmelzung beteiligten Rechtsträger ist, wenn sie binnen sechs Monaten nach dem Tag, an dem die Eintragung der Verschmelzung in das Register des Sitzes desjenigen Rechtsträgers, dessen Gläubiger sie sind, nach § 19 Abs. 3 UmwG als bekannt gemacht gilt, ihren Anspruch nach Grund und Höhe in Textform anmelden, Sicherheit zu leisten, soweit sie nicht Befriedigung verlangen können. Dieses Recht steht den Gläubigern jedoch nur zu, wenn sie glaubhaft machen, dass durch die Verschmelzung die Erfüllung ihrer Forderung gefährdet wird."
    },
    {
      "date": "2025-08-13",
      "id": "120745",
      "original_text": "Registerbekanntmachung nach dem Umwandlungsgesetz\nBayern Amtsgericht München HRB 260173\nTECHTEX Alpha GmbH – München",
      "type": "Registerbekanntmachung nach dem Umwandlungsgesetz",
      "state": "Bayern",
      "amtsgericht": "Amtsgericht München",
      "registernummer": "HRB 260173",
      "registerart": "HRB",
      "company_name": "TECHTEX Alpha GmbH",
      "company_seat": "München",
      "details": "13.08.2025 (Bekanntmachungsdatum)\n\nBayern Amtsgericht München HRB 260173\nRegisterbekanntmachung nach dem Umwandlungsgesetz 12.08.2025 (Eintragungsdatum)\n\nTECHTEX Alpha GmbH\nGesellschaft mit beschränkter Haftung\nMünchen\n\nDen Gläubigern der an der Verschmelzung beteiligten Rechtsträger ist, wenn sie binnen sechs Monaten nach dem Tag, an dem die Eintragung der Verschmelzung in das Register des Sitzes desjenigen Rechtsträgers, dessen Gläubiger sie sind, nach § 19 Abs. 3 UmwG als bekannt gemacht gilt, ihren Anspruch nach Grund und Höhe in Textform anmelden, Sicherheit zu leisten, soweit sie nicht Befriedigung verlangen können. Dieses Recht steht den Gläubigern jedoch nur zu, wenn sie glaubhaft machen, dass durch die Verschmelzung die Erfüllung ihrer Forderung gefährdet wird."
    },
    {
      "date": "2025-08-13",
      "id": "120746",
      "original_text": "Registerbekanntmachung nach dem Umwandlungsgesetz\nBayern Amtsgericht München HRB 302891\ndpmed GmbH – Germering",
      "type": "Registerbekanntmachung nach dem Umwandlungsgesetz",
      "state": "Bayern",
      "amtsgericht": "Amtsgericht München",
      "registernummer": "HRB 302891",
      "registerart": "HRB",
      "company_name": "dpmed GmbH",
      "company_seat": "Germering",
      "details": "13.08.2025 (Bekanntmachungsdatum)\n\nBayern Amtsgericht München HRB 302891\nRegisterbekanntmachung nach dem Umwandlungsgesetz 12.08.2025 (Eintragungsdatum)\n\ndpmed GmbH\nGesellschaft mit beschränkter Haftung\nGermering\n\nDen Gläubigern der an der Verschmelzung beteiligten Rechtsträger ist, wenn sie binnen sechs Monaten nach dem Tag, an dem die Eintragung der Verschmelzung in das Register des Sitzes desjenigen Rechtsträgers, dessen Gläubiger sie sind, nach § 19 Abs. 3 UmwG als bekannt gemacht gilt, ihren Anspruch nach Grund und Höhe in Textform anmelden, Sicherheit zu leisten, soweit sie nicht Befriedigung verlangen können. Dieses Recht steht den Gläubigern jedoch nur zu, wenn sie glaubhaft machen, dass durch die Verschmelzung die Erfüllung ihrer Forderung gefährdet wird."
    },
    {
      "date": "2025-08-13",
      "id": "120747",
      "original_text": "Registerbekanntmachung nach dem Umwandlungsgesetz\nBayern Amtsgericht München HRB 263795\nCETERUM-Holding GmbH – München",
      "type": "Registerbekanntmachung nach dem Umwandlungsgesetz",
      "state": "Bayern",
      "amtsgericht": "Amtsgericht München",
      "registernummer": "HRB 263795",
      "registerart": "HRB",
      "company_name": "CETERUM-Holding GmbH",
      "company_seat": "München",
      "details": "13.08.2025 (Bekanntmachungsdatum)\n\nBayern Amtsgericht München HRB 263795\nRegisterbekanntmachung nach dem Umwandlungsgesetz 12.08.2025 (Eintragungsdatum)\n\nCETERUM-Holding GmbH\nGesellschaft mit beschränkter Haftung\nMünchen\n\nDen Gläubigern der an der Verschmelzung beteiligten Rechtsträger ist, wenn sie binnen sechs Monaten nach dem Tag, an dem die Eintragung der Verschmelzung in das Register des Sitzes desjenigen Rechtsträgers, dessen Gläubiger sie sind, nach § 19 Abs. 3 UmwG als bekannt gemacht gilt, ihren Anspruch nach Grund und Höhe in Textform anmelden, Sicherheit zu leisten, soweit sie nicht Befriedigung verlangen können. Dieses Recht steht den Gläubigern jedoch nur zu, wenn sie glaubhaft machen, dass durch die Verschmelzung die Erfüllung ihrer Forderung gefährdet wird."
    },
    {
      "date": "2025-08-13",
      "id": "120748",
      "original_text": "Registerbekanntmachung nach dem Umwandlungsgesetz\nBayern Amtsgericht München HRB 88132\nHVB Export Leasing GmbH – München",
      "type": "Registerbekanntmachung nach dem Umwandlungsgesetz",
      "state": "Bayern",
      "amtsgericht": "Amtsgericht München",
      "registernummer": "HRB 88132",
      "registerart": "HRB",
      "company_name": "HVB Export Leasing GmbH",
      "company_seat": "München",
      "details": "13.08.2025 (Bekanntmachungsdatum)\n\nBayern Amtsgericht München HRB 88132\nRegisterbekanntmachung nach dem Umwandlungsgesetz 12.08.2025 (Eintragungsdatum)\n\nHVB Export Leasing GmbH\nGesellschaft mit beschränkter Haftung\nMünchen\n\nDen Gläubigern der an der Verschmelzung beteiligten Rechtsträger ist, wenn sie binnen sechs Monaten nach dem Tag, an dem die Eintragung der Verschmelzung in das Register des Sitzes desjenigen Rechtsträgers, dessen Gläubiger sie sind, nach § 19 Abs. 3 UmwG als bekannt gemacht gilt, ihren Anspruch nach Grund und Höhe in Textform anmelden, Sicherheit zu leisten, soweit sie nicht Befriedigung verlangen können. Dieses Recht steht den Gläubigern jedoch nur zu, wenn sie glaubhaft machen, dass durch die Verschmelzung die Erfüllung ihrer Forderung gefährdet wird."
    },
    {
      "date": "2025-08-13",
      "id": "120749",
      "original_text": "Registerbekanntmachung nach dem Umwandlungsgesetz\nBayern Amtsgericht München HRB 262582\nmartyn GmbH – Dachau",
      "type": "Registerbekanntmachung nach dem Umwandlungsgesetz",
      "state": "Bayern",
      "amtsgericht": "Amtsgericht München",
      "registernummer": "HRB 262582",
      "registerart": "HRB",
      "company_name": "martyn GmbH",
      "company_seat": "Dachau",
      "details": "13.08.2025 (Bekanntmachungsdatum)\n\nBayern Amtsgericht München HRB 262582\nRegisterbekanntmachung nach dem Umwandlungsgesetz 12.08.2025 (Eintragungsdatum)\n\nmartyn GmbH\nGesellschaft mit beschränkter Haftung\nDachau\n\nDen Gläubigern der an der Verschmelzung beteiligten Rechtsträger ist, wenn sie binnen sechs Monaten nach dem Tag, an dem die Eintragung der Verschmelzung in das Register des Sitzes desjenigen Rechtsträgers, dessen Gläubiger sie sind, nach § 19 Abs. 3 UmwG als bekannt gemacht gilt, ihren Anspruch nach Grund und Höhe in Textform anmelden, Sicherheit zu leisten, soweit sie nicht Befriedigung verlangen können. Dieses Recht steht den Gläubigern jedoch nur zu, wenn sie glaubhaft machen, dass durch die Verschmelzung die Erfüllung ihrer Forderung gefährdet wird."
    },
    {
      "date": "2025-08-13",
      "id": "120750",
      "original_text": "Registerbekanntmachung nach dem Umwandlungsgesetz\nBayern Amtsgericht München HRB 205375\nGEV Service GmbH – Bergkirchen",
      "type": "Registerbekanntmachung nach dem Umwandlungsgesetz",
      "state": "Bayern",
      "amtsgericht": "Amtsgericht München",
      "registernummer": "HRB 205375",
      "registerart": "HRB",
      "company_name": "GEV Service GmbH",
      "company_seat": "Bergkirchen",
      "details": "13.08.2025 (Bekanntmachungsdatum)\n\nBayern Amtsgericht München HRB 205375\nRegisterbekanntmachung nach dem Umwandlungsgesetz 12.08.2025 (Eintragungsdatum)\n\nGEV Service GmbH\nGesellschaft mit beschränkter Haftung\nBergkirchen\n\nDen Gläubigern der an der Verschmelzung beteiligten Rechtsträger ist, wenn sie binnen sechs Monaten nach dem Tag, an dem die Eintragung der Verschmelzung in das Register des Sitzes desjenigen Rechtsträgers, dessen Gläubiger sie sind, nach § 19 Abs. 3 UmwG als bekannt gemacht gilt, ihren Anspruch nach Grund und Höhe in Textform anmelden, Sicherheit zu leisten, soweit sie nicht Befriedigung verlangen können. Dieses Recht steht den Gläubigern jedoch nur zu, wenn sie glaubhaft machen, dass durch die Verschmelzung die Erfüllung ihrer Forderung gefährdet wird."
    },
    {
      "date": "2025-08-13",
      "id": "120751",
      "original_text": "Registerbekanntmachung nach dem Umwandlungsgesetz\nBayern Amtsgericht München HRA 69428\nBayerische Landesbank Immobilien-Beteiligungs- Gesellschaft mbH & Co. KG – München",
      "type": "Registerbekanntmachung nach dem Umwandlungsgesetz",
      "state": "Bayern",
      "amtsgericht": "Amtsgericht München",
      "registernummer": "HRA 69428",
      "registerart": "HRA",
      "company_name": "Bayerische Landesbank Immobilien-Beteiligungs- Gesellschaft mbH & Co. KG",
      "company_seat": "München",
      "details": "13.08.2025 (Bekanntmachungsdatum)\n\nBayern Amtsgericht München HRA 69428\nRegisterbekanntmachung nach dem Umwandlungsgesetz 12.08.2025 (Eintragungsdatum)\n\nBayerische Landesbank Immobilien-Beteiligungs- Gesellschaft mbH & Co. KG\nKommanditgesellschaft\nMünchen\n\nDen Gläubigern der an der Verschmelzung beteiligten Rechtsträger ist, wenn sie binnen sechs Monaten nach dem Tag, an dem die Eintragung der Verschmelzung in das Register des Sitzes desjenigen Rechtsträgers, dessen Gläubiger sie sind, nach § 19 Abs. 3 UmwG als bekannt gemacht gilt, ihren Anspruch nach Grund und Höhe in Textform anmelden, Sicherheit zu leisten, soweit sie nicht Befriedigung verlangen können. Dieses Recht steht den Gläubigern jedoch nur zu, wenn sie glaubhaft machen, dass durch die Verschmelzung die Erfüllung ihrer Forderung gefährdet wird."
    },
    {
      "date": "2025-08-13",
      "id": "120752",
      "original_text": "Registerbekanntmachung nach dem Umwandlungsgesetz\nBayern Amtsgericht Memmingen HRA 14193\nfinanzteam26 GmbH & Co. KG – Neu-Ulm",
      "type": "Registerbekanntmachung nach dem Umwandlungsgesetz",
      "state": "Bayern",
      "amtsgericht": "Amtsgericht Memmingen",
      "registernummer": "HRA 14193",
      "registerart": "HRA",
      "company_name": "finanzteam26 GmbH & Co. KG",
      "company_seat": "Neu-Ulm",
      "details": "13.08.2025 (Bekanntmachungsdatum)\n\nBayern Amtsgericht Memmingen HRA 14193\nRegisterbekanntmachung nach dem Umwandlungsgesetz 12.08.2025 (Eintragungsdatum)\n\nfinanzteam26 GmbH & Co. KG\nKommanditgesellschaft\nNeu-Ulm\n\nDen Gläubigern der an der Ausgliederung beteiligten Rechtsträger ist, wenn sie binnen sechs Monaten nach dem Tag, an dem die Eintragung der Ausgliederung in das Register des Sitzes desjenigen Rechtsträgers, dessen Gläubiger sie sind, nach §§ 125, 19 Abs. 3 UmwG als bekannt gemacht gilt, ihren Anspruch nach Grund und Höhe in Textform anmelden, Sicherheit zu leisten, soweit sie nicht Befriedigung verlangen können. Dieses Recht steht den Gläubigern jedoch nur zu, wenn sie glaubhaft machen, dass durch die Ausgliederung die Erfüllung ihrer Forderung gefährdet wird."
    },
    {
      "date": "2025-08-13",
      "id": "120753",
      "original_text": "Registerbekanntmachung nach dem Umwandlungsgesetz\nBayern Amtsgericht München HRB 257270\nA2MAC1 GmbH – München",
      "type": "Registerbekanntmachung nach dem Umwandlungsgesetz",
      "state": "Bayern",
      "amtsgericht": "Amtsgericht München",
      "registernummer": "HRB 257270",
      "registerart": "HRB",
      "company_name": "A2MAC1 GmbH",
      "company_seat": "München",
      "details": "13.08.2025 (Bekanntmachungsdatum)\n\nBayern Amtsgericht München HRB 257270\nRegisterbekanntmachung nach dem Umwandlungsgesetz 12.08.2025 (Eintragungsdatum)\n\nA2MAC1 GmbH\nGesellschaft mit beschränkter Haftung\nMünchen\n\nDen Gläubigern der an der Verschmelzung beteiligten Rechtsträger ist, wenn sie binnen sechs Monaten nach dem Tag, an dem die Eintragung der Verschmelzung in das Register des Sitzes desjenigen Rechtsträgers, dessen Gläubiger sie sind, nach § 19 Abs. 3 UmwG als bekannt gemacht gilt, ihren Anspruch nach Grund und Höhe in Textform anmelden, Sicherheit zu leisten, soweit sie nicht Befriedigung verlangen können. Dieses Recht steht den Gläubigern jedoch nur zu, wenn sie glaubhaft machen, dass durch die Verschmelzung die Erfüllung ihrer Forderung gefährdet wird."
    },
    {
      "date": "2025-08-13",
      "id": "120754",
      "original_text": "Registerbekanntmachung nach dem Umwandlungsgesetz\nBayern Amtsgericht München HRB 240884\nSensProtect GmbH – Höhenkirchen-Siegertsbrunn",
      "type": "Registerbekanntmachung nach dem Umwandlungsgesetz",
      "state": "Bayern",
      "amtsgericht": "Amtsgericht München",
      "registernummer": "HRB 240884",
      "registerart": "HRB",
      "company_name": "SensProtect GmbH",
      "company_seat": "Höhenkirchen-Siegertsbrunn",
      "details": "13.08.2025 (Bekanntmachungsdatum)\n\nBayern Amtsgericht München HRB 240884\nRegisterbekanntmachung nach dem Umwandlungsgesetz 12.08.2025 (Eintragungsdatum)\n\nSensProtect GmbH\nGesellschaft mit beschränkter Haftung\nHöhenkirchen-Siegertsbrunn\n\nDen Gläubigern der an der Verschmelzung beteiligten Rechtsträger ist, wenn sie binnen sechs Monaten nach dem Tag, an dem die Eintragung der Verschmelzung in das Register des Sitzes desjenigen Rechtsträgers, dessen Gläubiger sie sind, nach § 19 Abs. 3 UmwG als bekannt gemacht gilt, ihren Anspruch nach Grund und Höhe in Textform anmelden, Sicherheit zu leisten, soweit sie nicht Befriedigung verlangen können. Dieses Recht steht den Gläubigern jedoch nur zu, wenn sie glaubhaft machen, dass durch die Verschmelzung die Erfüllung ihrer Forderung gefährdet wird."
    },
    {
      "date": "2025-08-13",
      "id": "120755",
      "original_text": "Registerbekanntmachung nach dem Umwandlungsgesetz\nBayern Amtsgericht München HRB 62953\nvon Guttenberg GmbH – Aschheim",
      "type": "Registerbekanntmachung nach dem Umwandlungsgesetz",
      "state": "Bayern",
      "amtsgericht": "Amtsgericht München",
      "registernummer": "HRB 62953",
      "registerart": "HRB",
      "company_name": "von Guttenberg GmbH",
      "company_seat": "Aschheim",
      "details": "13.08.2025 (Bekanntmachungsdatum)\n\nBayern Amtsgericht München HRB 62953\nRegisterbekanntmachung nach dem Umwandlungsgesetz 12.08.2025 (Eintragungsdatum)\n\nvon Guttenberg GmbH\nGesellschaft mit beschränkter Haftung\nAschheim\n\nDen Gläubigern der an der Verschmelzung beteiligten Rechtsträger ist, wenn sie binnen sechs Monaten nach dem Tag, an dem die Eintragung der Verschmelzung in das Register des Sitzes desjenigen Rechtsträgers, dessen Gläubiger sie sind, nach § 19 Abs. 3 UmwG als bekannt gemacht gilt, ihren Anspruch nach Grund und Höhe in Textform anmelden, Sicherheit zu leisten, soweit sie nicht Befriedigung verlangen können. Dieses Recht steht den Gläubigern jedoch nur zu, wenn sie glaubhaft machen, dass durch die Verschmelzung die Erfüllung ihrer Forderung gefährdet wird."
    },
    {
      "date": "2025-08-13",
      "id": "120756",
      "original_text": "Registerbekanntmachung nach dem Umwandlungsgesetz\nBayern Amtsgericht Passau HRB 7393\nEAZY Gastronomie Betriebs-GmbH – Eppenschlag",
      "type": "Registerbekanntmachung nach dem Umwandlungsgesetz",
      "state": "Bayern",
      "amtsgericht": "Amtsgericht Passau",
      "registernummer": "HRB 7393",
      "registerart": "HRB",
      "company_name": "EAZY Gastronomie Betriebs-GmbH",
      "company_seat": "Eppenschlag",
      "details": "13.08.2025 (Bekanntmachungsdatum)\n\nBayern Amtsgericht Passau HRB 7393\nRegisterbekanntmachung nach dem Umwandlungsgesetz 12.08.2025 (Eintragungsdatum)\n\nEAZY Gastronomie Betriebs-GmbH\nGesellschaft mit beschränkter Haftung\nEppenschlag\n\nDen Gläubigern der an der Verschmelzung beteiligten Rechtsträger ist, wenn sie binnen sechs Monaten nach dem Tag, an dem die Eintragung der Verschmelzung in das Register des Sitzes desjenigen Rechtsträgers, dessen Gläubiger sie sind, nach § 19 Abs. 3 UmwG als bekannt gemacht gilt, ihren Anspruch nach Grund und Höhe in Textform anmelden, Sicherheit zu leisten, soweit sie nicht Befriedigung verlangen können. Dieses Recht steht den Gläubigern jedoch nur zu, wenn sie glaubhaft machen, dass durch die Verschmelzung die Erfüllung ihrer Forderung gefährdet wird."
    },
    {
      "date": "2025-08-13",
      "id": "120757",
      "original_text": "Registerbekanntmachung nach dem Umwandlungsgesetz\nBayern Amtsgericht München HRB 297178\nIgloo AcquiCo GmbH – München",
      "type": "Registerbekanntmachung nach dem Umwandlungsgesetz",
      "state": "Bayern",
      "amtsgericht": "Amtsgericht München",
      "registernummer": "HRB 297178",
      "registerart": "HRB",
      "company_name": "Igloo AcquiCo GmbH",
      "company_seat": "München",
      "details": "13.08.2025 (Bekanntmachungsdatum)\n\nBayern Amtsgericht München HRB 297178\nRegisterbekanntmachung nach dem Umwandlungsgesetz 12.08.2025 (Eintragungsdatum)\n\nIgloo AcquiCo GmbH\nGesellschaft mit beschränkter Haftung\nMünchen\n\nDen Gläubigern der an der Verschmelzung beteiligten Rechtsträger ist, wenn sie binnen sechs Monaten nach dem Tag, an dem die Eintragung der Verschmelzung in das Register des Sitzes desjenigen Rechtsträgers, dessen Gläubiger sie sind, nach § 19 Abs. 3 UmwG als bekannt gemacht gilt, ihren Anspruch nach Grund und Höhe in Textform anmelden, Sicherheit zu leisten, soweit sie nicht Befriedigung verlangen können. Dieses Recht steht den Gläubigern jedoch nur zu, wenn sie glaubhaft machen, dass durch die Verschmelzung die Erfüllung ihrer Forderung gefährdet wird."
    },
    {
      "date": "2025-08-13",
      "id": "120758",
      "original_text": "Einreichung neuer Dokumente\nBayern Amtsgericht Würzburg HRB 81\nStadtbau Würzburg GmbH – Würzburg",
      "type": "Einreichung neuer Dokumente",
      "state": "Bayern",
      "amtsgericht": "Amtsgericht Würzburg",
      "registernummer": "HRB 81",
      "registerart": "HRB",
      "company_name": "Stadtbau Würzburg GmbH",
      "company_seat": "Würzburg",
      "details": "13.08.2025 (Bekanntmachungsdatum)\n\nBayern Amtsgericht Würzburg HRB 81\nEinreichung neuer Dokumente 12.08.2025 (Eintragungsdatum)\n\nStadtbau Würzburg GmbH\nGesellschaft mit beschränkter Haftung\nWürzburg\n\nDem Amtsgericht Würzburg -Registergericht- ist eine Liste der Mitglieder des Aufsichtsrats eingereicht worden, § 52 Abs. 3 S. 2 GmbHG."
    },
    {
      "date": "2025-08-13",
      "id": "120759",
      "original_text": "Registerbekanntmachung nach dem Umwandlungsgesetz\nBayern Amtsgericht Hof HRB 4442\nTK Industries GmbH – Selbitz",
      "type": "Registerbekanntmachung nach dem Umwandlungsgesetz",
      "state": "Bayern",
      "amtsgericht": "Amtsgericht Hof",
      "registernummer": "HRB 4442",
      "registerart": "HRB",
      "company_name": "TK Industries GmbH",
      "company_seat": "Selbitz",
      "details": "13.08.2025 (Bekanntmachungsdatum)\n\nBayern Amtsgericht Hof HRB 4442\nRegisterbekanntmachung nach dem Umwandlungsgesetz 12.08.2025 (Eintragungsdatum)\n\nTK Industries GmbH\nGesellschaft mit beschränkter Haftung\nSelbitz\n\nDen Gläubigern der an der Verschmelzung beteiligten Rechtsträger ist, wenn sie binnen sechs Monaten nach dem Tag, an dem die Eintragung der Verschmelzung in das Register des Sitzes desjenigen Rechtsträgers, dessen Gläubiger sie sind, nach § 19 Abs. 3 UmwG als bekannt gemacht gilt, ihren Anspruch nach Grund und Höhe in Textform anmelden, Sicherheit zu leisten, soweit sie nicht Befriedigung verlangen können. Dieses Recht steht den Gläubigern jedoch nur zu, wenn sie glaubhaft machen, dass durch die Verschmelzung die Erfüllung ihrer Forderung gefährdet wird."
    },
    {
      "date": "2025-08-13",
      "id": "120760",
      "original_text": "Registerbekanntmachung nach dem Umwandlungsgesetz\nBayern Amtsgericht Memmingen HRA 14186\nfinanzteam26 Schmied e.K. – Neu-Ulm",
      "type": "Registerbekanntmachung nach dem Umwandlungsgesetz",
      "state": "Bayern",
      "amtsgericht": "Amtsgericht Memmingen",
      "registernummer": "HRA 14186",
      "registerart": "HRA",
      "company_name": "finanzteam26 Schmied e.K.",
      "company_seat": "Neu-Ulm",
      "details": "13.08.2025 (Bekanntmachungsdatum)\n\nBayern Amtsgericht Memmingen HRA 14186\nRegisterbekanntmachung nach dem Umwandlungsgesetz 12.08.2025 (Eintragungsdatum)\n\nfinanzteam26 Schmied e.K.\nEinzelkaufmann / Einzelkauffrau\nNeu-Ulm\n\nDen Gläubigern der an der Ausgliederung beteiligten Rechtsträger ist, wenn sie binnen sechs Monaten nach dem Tag, an dem die Eintragung der Ausgliederung in das Register des Sitzes desjenigen Rechtsträgers, dessen Gläubiger sie sind, nach §§ 125, 19 Abs. 3 UmwG als bekannt gemacht gilt, ihren Anspruch nach Grund und Höhe in Textform anmelden, Sicherheit zu leisten, soweit sie nicht Befriedigung verlangen können. Dieses Recht steht den Gläubigern jedoch nur zu, wenn sie glaubhaft machen, dass durch die Ausgliederung die Erfüllung ihrer Forderung gefährdet wird."
    },
    {
      "date": "2025-08-13",
      "id": "120761",
      "original_text": "Registerbekanntmachung nach dem Umwandlungsgesetz\nBayern Amtsgericht Nürnberg VR 2865\nKrankenpflegeverein St. Clemens e. V. – Nürnberg",
      "type": "Registerbekanntmachung nach dem Umwandlungsgesetz",
      "state": "Bayern",
      "amtsgericht": "Amtsgericht Nürnberg",
      "registernummer": "VR 2865",
      "registerart": "VR",
      "company_name": "Krankenpflegeverein St. Clemens e. V.",
      "company_seat": "Nürnberg",
      "details": "13.08.2025 (Bekanntmachungsdatum)\n\nBayern Amtsgericht Nürnberg VR 2865\nRegisterbekanntmachung nach dem Umwandlungsgesetz 12.08.2025 (Eintragungsdatum)\n\nKrankenpflegeverein St. Clemens e. V.\neingetragener Verein\nNürnberg\n\nDen Gläubigern der an der Verschmelzung beteiligten Rechtsträger ist, wenn sie binnen sechs Monaten nach dem Tag, an dem die Eintragung der Verschmelzung in das Register des Sitzes desjenigen Rechtsträgers, dessen Gläubiger sie sind, nach § 19 Abs. 3 UmwG als bekannt gemacht gilt, ihren Anspruch nach Grund und Höhe in Textform anmelden, Sicherheit zu leisten, soweit sie nicht Befriedigung verlangen können. Dieses Recht steht den Gläubigern jedoch nur zu, wenn sie glaubhaft machen, dass durch die Verschmelzung die Erfüllung ihrer Forderung gefährdet wird."
    },
    {
      "date": "2025-08-13",
      "id": "120762",
      "original_text": "Registerbekanntmachung nach dem Umwandlungsgesetz\nBayern Amtsgericht München HRA 121409\nCenk Ayaz e.K. – München",
      "type": "Registerbekanntmachung nach dem Umwandlungsgesetz",
      "state": "Bayern",
      "amtsgericht": "Amtsgericht München",
      "registernummer": "HRA 121409",
      "registerart": "HRA",
      "company_name": "Cenk Ayaz e.K.",
      "company_seat": "München",
      "details": "13.08.2025 (Bekanntmachungsdatum)\n\nBayern Amtsgericht München HRA 121409\nRegisterbekanntmachung nach dem Umwandlungsgesetz 12.08.2025 (Eintragungsdatum)\n\nCenk Ayaz e.K.\nEinzelkaufmann / Einzelkauffrau\nMünchen\n\nDen Gläubigern der an der Ausgliederung beteiligten Rechtsträger ist, wenn sie binnen sechs Monaten nach dem Tag, an dem die Eintragung der Ausgliederung in das Register des Sitzes desjenigen Rechtsträgers, dessen Gläubiger sie sind, nach §§ 125, 19 Abs. 3 UmwG als bekannt gemacht gilt, ihren Anspruch nach Grund und Höhe in Textform anmelden, Sicherheit zu leisten, soweit sie nicht Befriedigung verlangen können. Dieses Recht steht den Gläubigern jedoch nur zu, wenn sie glaubhaft machen, dass durch die Ausgliederung die Erfüllung ihrer Forderung gefährdet wird."
    },
    {
      "date": "2025-08-13",
      "id": "120763",
      "original_text": "Registerbekanntmachung nach dem Umwandlungsgesetz\nBerlin Amtsgericht Berlin (Charlottenburg) HRB 84960\nDKB Finance GmbH – Berlin",
      "type": "Registerbekanntmachung nach dem Umwandlungsgesetz",
      "state": "Berlin",
      "amtsgericht": "Amtsgericht Berlin (Charlottenburg)",
      "registernummer": "HRB 84960",
      "registerart": "HRB",
      "company_name": "DKB Finance GmbH",
      "company_seat": "Berlin",
      "details": "13.08.2025 (Bekanntmachungsdatum)\n\nBerlin Amtsgericht Berlin (Charlottenburg) HRB 84960\nRegisterbekanntmachung nach dem Umwandlungsgesetz 11.08.2025 (Eintragungsdatum)\n\nDKB Finance GmbH\nGesellschaft mit beschränkter Haftung\nBerlin\n\nZu Eintragungsnummer 26 vom 11.08.2025 wird als nicht eingetragen veröffentlicht: Den Gläubigern der an der Verschmelzung beteiligten Rechtsträger ist, wenn sie binnen sechs Monaten nach dem Tag, an dem die Eintragung der Verschmelzung in das Register des Sitzes desjenigen Rechtsträgers, dessen Gläubiger sie sind, als bekannt gemacht gilt, ihren Anspruch nach Grund und Höhe schriftlich anmelden, Sicherheit zu leisten, soweit sie nicht Befriedigung verlangen können. Dieses Recht steht den Gläubigern jedoch nur zu, wenn sie glaubhaft machen, dass durch die Verschmelzung die Erfüllung ihrer Forderung gefährdet wird. Das Recht, Sicherheitsleistung zu verlangen, steht Gläubigern nicht zu, die im Falle der Insolvenz ein Recht auf vorzugsweise Befriedigung aus einer Deckungsmasse haben, die nach gesetzlicher Vorschrift zu ihrem Schutz errichtet und staatlich überwacht ist."
    },
    {
      "date": "2025-08-13",
      "id": "120764",
      "original_text": "Löschungsankündigung\nMecklenburg-Vorpommern Amtsgericht Neubrandenburg HRB 21987\nER-Transport UG (haftungsbeschränkt) – Löcknitz",
      "type": "Löschungsankündigung",
      "state": "Mecklenburg-Vorpommern",
      "amtsgericht": "Amtsgericht Neubrandenburg",
      "registernummer": "HRB 21987",
      "registerart": "HRB",
      "company_name": "ER-Transport UG (haftungsbeschränkt)",
      "company_seat": "Löcknitz",
      "details": "13.08.2025 (Bekanntmachungsdatum)\n\nMecklenburg-Vorpommern Amtsgericht Neubrandenburg HRB 21987\nLöschungsankündigung 13.08.2025 (Eintragungsdatum)\n\nER-Transport UG (haftungsbeschränkt)\nGesellschaft mit beschränkter Haftung\nLöcknitz\n\nDas Registergericht beabsichtigt, die im Handelsregister eingetragene Gesellschaft von Amts wegen nach § 394 FamFG zu löschen. Die Frist zur Erhebung eines Widerspruchs gegen die beabsichtigte Löschung wird auf drei Monate festgesetzt."
    },
    {
      "date": "2025-08-13",
      "id": "120765",
      "original_text": "Registerbekanntmachung nach dem Umwandlungsgesetz\nBaden-Württemberg Amtsgericht Stuttgart HRA 741832\nPhilipp Weiser Ventures GmbH & Co. KG – Stuttgart",
      "type": "Registerbekanntmachung nach dem Umwandlungsgesetz",
      "state": "Baden-Württemberg",
      "amtsgericht": "Amtsgericht Stuttgart",
      "registernummer": "HRA 741832",
      "registerart": "HRA",
      "company_name": "Philipp Weiser Ventures GmbH & Co. KG",
      "company_seat": "Stuttgart",
      "details": "13.08.2025 (Bekanntmachungsdatum)\n\nBaden-Württemberg Amtsgericht Stuttgart HRA 741832\nRegisterbekanntmachung nach dem Umwandlungsgesetz 13.08.2025 (Eintragungsdatum)\n\nPhilipp Weiser Ventures GmbH & Co. KG\nKommanditgesellschaft\nStuttgart\n\nDen Gläubigern des an dem Formwechsel beteiligten Rechtsträgers ist, wenn sie binnen sechs Monaten nach dem Tag, an dem die Eintragung des Formwechsels in das Register des Sitzes desjenigen Rechtsträgers, dessen Gläubiger sie sind, nach § 19 Abs. 3 UmwG als bekanntgemacht gilt, ihren Anspruch nach Grund und Höhe schriftlich anmelden, Sicherheit zu leisten, soweit sie nicht Befriedigung verlangen können. Dieses Recht steht den Gläubigern jedoch nur zu, wenn sie glaubhaft machen, dass durch den Formwechsel die Erfüllung ihrer Forderung gefährdet wird."
    },
    {
      "date": "2025-08-13",
      "id": "120766",
      "original_text": "Einreichung neuer Dokumente\nSchleswig-Holstein Amtsgericht Flensburg HRB 17786\nBeyersdorf Verwaltung SE – Flensburg",
      "type": "Einreichung neuer Dokumente",
      "state": "Schleswig-Holstein",
      "amtsgericht": "Amtsgericht Flensburg",
      "registernummer": "HRB 17786",
      "registerart": "HRB",
      "company_name": "Beyersdorf Verwaltung SE",
      "company_seat": "Flensburg",
      "details": "13.08.2025 (Bekanntmachungsdatum)\n\nSchleswig-Holstein Amtsgericht Flensburg HRB 17786\nEinreichung neuer Dokumente\n\nBeyersdorf Verwaltung SE\nEuropäische Aktiengesellschaft (SE)\nFlensburg\n\nAls nicht eingetragen wird veröffentlicht: Neue Aufsichtsratsliste nach Änderung eingereicht am 01.04.2025."
    },
    {
      "date": "2025-08-13",
      "id": "120767",
      "original_text": "Löschungsankündigung\nHamburg Amtsgericht Hamburg HRA 111253\nWölbern Holding KG – Hamburg",
      "type": "Löschungsankündigung",
      "state": "Hamburg",
      "amtsgericht": "Amtsgericht Hamburg",
      "registernummer": "HRA 111253",
      "registerart": "HRA",
      "company_name": "Wölbern Holding KG",
      "company_seat": "Hamburg",
      "details": "13.08.2025 (Bekanntmachungsdatum)\n\nHamburg Amtsgericht Hamburg HRA 111253\nLöschungsankündigung\n\nWölbern Holding KG\nKommanditgesellschaft\nHamburg\n\nDas Registergericht beabsichtigt, die im Handelsregister eingetragene Firma von Amts wegen nach § 31 Abs. 2 HBG zu löschen. Die Frist zur Erhebung eines Widerspruchs gegen die beabsichtigte Löschung wird auf 3 Monate festgesetzt."
    },
    {
      "date": "2025-08-13",
      "id": "120768",
      "original_text": "Einreichung neuer Dokumente\nBaden-Württemberg Amtsgericht Stuttgart HRB 736810\nStädtische Bädergesellschaft Backnang GmbH – Backnang",
      "type": "Einreichung neuer Dokumente",
      "state": "Baden-Württemberg",
      "amtsgericht": "Amtsgericht Stuttgart",
      "registernummer": "HRB 736810",
      "registerart": "HRB",
      "company_name": "Städtische Bädergesellschaft Backnang GmbH",
      "company_seat": "Backnang",
      "details": "13.08.2025 (Bekanntmachungsdatum)\n\nBaden-Württemberg Amtsgericht Stuttgart HRB 736810\nEinreichung neuer Dokumente\n\nStädtische Bädergesellschaft Backnang GmbH\nGesellschaft mit beschränkter Haftung\nBacknang\n\nDie Gesellschaft hat am 12.08.2025 die Liste über die Zusammensetzung des Aufsichtsrats zum Handelsregister eingereicht."
    },
    {
      "date": "2025-08-13",
      "id": "120769",
      "original_text": "Einreichung neuer Dokumente\nSaarland Amtsgericht Saarbrücken HRB 103480\nEvana AG – Saarbrücken",
      "type": "Einreichung neuer Dokumente",
      "state": "Saarland",
      "amtsgericht": "Amtsgericht Saarbrücken",
      "registernummer": "HRB 103480",
      "registerart": "HRB",
      "company_name": "Evana AG",
      "company_seat": "Saarbrücken",
      "details": "13.08.2025 (Bekanntmachungsdatum)\n\nSaarland Amtsgericht Saarbrücken HRB 103480\nEinreichung neuer Dokumente\n\nEvana AG\nAktiengesellschaft\nSaarbrücken\n\nDer Vorstand der Gesellschaft hat eine Liste der Mitglieder des Aufsichtsrats zum Handelsregister eingereicht (§ 106 AktG)."
    },
    {
      "date": "2025-08-13",
      "id": "120770",
      "original_text": "Registerbekanntmachung nach dem Umwandlungsgesetz\nBaden-Württemberg Amtsgericht Mannheim HRB 718384\nNIS - Nordic Industrial Services GmbH – Heddesheim",
      "type": "Registerbekanntmachung nach dem Umwandlungsgesetz",
      "state": "Baden-Württemberg",
      "amtsgericht": "Amtsgericht Mannheim",
      "registernummer": "HRB 718384",
      "registerart": "HRB",
      "company_name": "NIS - Nordic Industrial Services GmbH",
      "company_seat": "Heddesheim",
      "details": "13.08.2025 (Bekanntmachungsdatum)\n\nBaden-Württemberg Amtsgericht Mannheim HRB 718384\nRegisterbekanntmachung nach dem Umwandlungsgesetz 13.08.2025 (Eintragungsdatum)\n\nNIS - Nordic Industrial Services GmbH\nGesellschaft mit beschränkter Haftung\nHeddesheim\n\nDen Gläubigern der an der Verschmelzung beteiligten Rechtsträger ist, wenn sie binnen sechs Monaten nach dem Tag, an dem die Eintragung der Verschmelzung in das Register des Sitzes desjenigen Rechtsträgers, dessen Gläubiger sie sind, nach § 19 Abs. 3 UmwG als bekanntgemacht gilt, ihren Anspruch nach Grund und Höhe schriftlich anmelden, Sicherheit zu leisten, soweit sie nicht Befriedigung verlangen können. Dieses Recht steht den Gläubigern jedoch nur zu, wenn sie glaubhaft machen, dass durch die Verschmelzung die Erfüllung ihrer Forderung gefährdet wird."
    },
    {
      "date": "2025-08-13",
      "id": "120771",
      "original_text": "Registerbekanntmachung nach dem Umwandlungsgesetz\nBaden-Württemberg Amtsgericht Mannheim HRB 712535\nThree Vision Warenhandels GmbH – Stutensee",
      "type": "Registerbekanntmachung nach dem Umwandlungsgesetz",
      "state": "Baden-Württemberg",
      "amtsgericht": "Amtsgericht Mannheim",
      "registernummer": "HRB 712535",
      "registerart": "HRB",
      "company_name": "Three Vision Warenhandels GmbH",
      "company_seat": "Stutensee",
      "details": "13.08.2025 (Bekanntmachungsdatum)\n\nBaden-Württemberg Amtsgericht Mannheim HRB 712535\nRegisterbekanntmachung nach dem Umwandlungsgesetz 13.08.2025 (Eintragungsdatum)\n\nThree Vision Warenhandels GmbH\nGesellschaft mit beschränkter Haftung\nStutensee\n\nDen Gläubigern der an der Verschmelzung beteiligten Rechtsträger ist, wenn sie binnen sechs Monaten nach dem Tag, an dem die Eintragung der Verschmelzung in das Register des Sitzes desjenigen Rechtsträgers, dessen Gläubiger sie sind, nach § 19 Abs. 3 UmwG als bekanntgemacht gilt, ihren Anspruch nach Grund und Höhe schriftlich anmelden, Sicherheit zu leisten, soweit sie nicht Befriedigung verlangen können. Dieses Recht steht den Gläubigern jedoch nur zu, wenn sie glaubhaft machen, dass durch die Verschmelzung die Erfüllung ihrer Forderung gefährdet wird."
    },
    {
      "date": "2025-08-13",
      "id": "120772",
      "original_text": "Registerbekanntmachung nach dem Umwandlungsgesetz\nBaden-Württemberg Amtsgericht Mannheim HRB 1705\nBilfinger Corporate Insurance Management GmbH – Mannheim",
      "type": "Registerbekanntmachung nach dem Umwandlungsgesetz",
      "state": "Baden-Württemberg",
      "amtsgericht": "Amtsgericht Mannheim",
      "registernummer": "HRB 1705",
      "registerart": "HRB",
      "company_name": "Bilfinger Corporate Insurance Management GmbH",
      "company_seat": "Mannheim",
      "details": "13.08.2025 (Bekanntmachungsdatum)\n\nBaden-Württemberg Amtsgericht Mannheim HRB 1705\nRegisterbekanntmachung nach dem Umwandlungsgesetz 13.08.2025 (Eintragungsdatum)\n\nBilfinger Corporate Insurance Management GmbH\nGesellschaft mit beschränkter Haftung\nMannheim\n\nAls nicht eingetragen wird bekanntgemacht:\nDen Gläubigern der an der Verschmelzung beteiligten Rechtsträger ist, wenn sie binnen sechs Monaten nach dem Tag, an dem die Eintragung der Verschmelzung in das Register des Sitzes desjenigen Rechtsträgers, dessen Gläubiger sie sind, nach § 19 Abs. 3 UmwG als bekanntgemacht gilt, ihren Anspruch nach Grund und Höhe schriftlich anmelden, Sicherheit zu leisten, soweit sie nicht Befriedigung verlangen können. Dieses Recht steht den Gläubigern jedoch nur zu, wenn sie glaubhaft machen, dass durch die Verschmelzung die Erfüllung ihrer Forderung gefährdet wird."
    },
    {
      "date": "2025-08-13",
      "id": "120773",
      "original_text": "Sonstige Registerbekanntmachung\nBrandenburg Amtsgericht Potsdam HRB 21435\nTechnologietrans Beteiligungs GmbH – Zossen",
      "type": "Sonstige Registerbekanntmachung",
      "state": "Brandenburg",
      "amtsgericht": "Amtsgericht Potsdam",
      "registernummer": "HRB 21435",
      "registerart": "HRB",
      "company_name": "Technologietrans Beteiligungs GmbH",
      "company_seat": "Zossen",
      "details": "13.08.2025 (Bekanntmachungsdatum)\n\nBrandenburg Amtsgericht Potsdam HRB 21435\nSonstige Registerbekanntmachung\n\nTechnologietrans Beteiligungs GmbH\nGesellschaft mit beschränkter Haftung\nZossen\n\nAls nicht eingetragen wird veröffentlicht:\nGläubigern, deren Forderungen begründet worden sind, bevor die Eintragung des Beschlusses als nach § 10 des Handelsgesetzbuches bekannt gemacht gilt, ist, wenn sie sich binnen sechs Monaten nach der Bekanntmachung zu diesem Zweck melden, Sicherheit zu leisten, soweit sie nicht Befriedigung verlangen können."
    },
    {
      "date": "2025-08-13",
      "id": "120774",
      "original_text": "Löschungsankündigung\nBerlin Amtsgericht Berlin (Charlottenburg) HRB 141739\nVe Interactive DACH GmbH – Berlin",
      "type": "Löschungsankündigung",
      "state": "Berlin",
      "amtsgericht": "Amtsgericht Berlin (Charlottenburg)",
      "registernummer": "HRB 141739",
      "registerart": "HRB",
      "company_name": "Ve Interactive DACH GmbH",
      "company_seat": "Berlin",
      "details": "13.08.2025 (Bekanntmachungsdatum)\n\nBerlin Amtsgericht Berlin (Charlottenburg) HRB 141739\nLöschungsankündigung\n\nVe Interactive DACH GmbH\nGesellschaft mit beschränkter Haftung\nBerlin\n\nBei der nachstehenden Gesellschaft wird das Amtslöschungsverfahren gemäß § 394 FamFG eingeleitet. Widerspruchsfrist 6 Wochen"
    },
    {
      "date": "2025-08-13",
      "id": "120775",
      "original_text": "Registerbekanntmachung nach dem Umwandlungsgesetz\nMecklenburg-Vorpommern Amtsgericht Neubrandenburg HRB 21408\nETL Advision Waren Steuerberatungsgesellschaft mbH – Waren (Müritz)",
      "type": "Registerbekanntmachung nach dem Umwandlungsgesetz",
      "state": "Mecklenburg-Vorpommern",
      "amtsgericht": "Amtsgericht Neubrandenburg",
      "registernummer": "HRB 21408",
      "registerart": "HRB",
      "company_name": "ETL Advision Waren Steuerberatungsgesellschaft mbH",
      "company_seat": "Waren (Müritz)",
      "details": "13.08.2025 (Bekanntmachungsdatum)\n\nMecklenburg-Vorpommern Amtsgericht Neubrandenburg HRB 21408\nRegisterbekanntmachung nach dem Umwandlungsgesetz 13.08.2025 (Eintragungsdatum)\n\nETL Advision Waren Steuerberatungsgesellschaft mbH\nGesellschaft mit beschränkter Haftung\nWaren (Müritz)\n\nAls nicht eingetragen wird veröffentlicht: Den Gläubigern der an der Verschmelzung beteiligten Rechtsträger ist, wenn sie binnen sechs Monaten nach dem Tag, an dem die Eintragung der Verschmelzung in das Register des Sitzes desjenigen Rechtsträgers, dessen Gläubiger sie sind, nach § 19 Abs. 3 UmwG als bekannt gemacht gilt,\nihren Anspruch nach Grund und Höhe in Textform anmelden, Sicherheit zu leisten, soweit sie nicht Befriedigung verlangen können. Dieses Recht steht den Gläubigern jedoch nur zu, wenn sie glaubhaft machen, dass durch die Verschmelzung die Erfüllung der Forderung gefährdet wird."
    },
    {
      "date": "2025-08-13",
      "id": "120776",
      "original_text": "Registerbekanntmachung nach dem Umwandlungsgesetz\nSchleswig-Holstein Amtsgericht Lübeck HRA 11324\nBodo Wascher Familien GmbH & Co. KG – Lübeck",
      "type": "Registerbekanntmachung nach dem Umwandlungsgesetz",
      "state": "Schleswig-Holstein",
      "amtsgericht": "Amtsgericht Lübeck",
      "registernummer": "HRA 11324",
      "registerart": "HRA",
      "company_name": "Bodo Wascher Familien GmbH & Co. KG",
      "company_seat": "Lübeck",
      "details": "13.08.2025 (Bekanntmachungsdatum)\n\nSchleswig-Holstein Amtsgericht Lübeck HRA 11324\nRegisterbekanntmachung nach dem Umwandlungsgesetz 12.08.2025 (Eintragungsdatum)\n\nBodo Wascher Familien GmbH & Co. KG\nKommanditgesellschaft\nLübeck\n\nZu Eintragungsnummer 3 vom 12.08.2025 wird als nicht eingetragen veröffentlicht:  Den Gläubigern ist, wenn sie binnen sechs Monaten nach dem Tag, an dem die Eintragung der Umwandlung als bekannt gemacht gilt, ihren Anspruch nach Grund und Höhe schriftlich anmelden, Sicherheit zu leisten, soweit sie nicht Befriedigung verlangen können. Dieses Recht steht den Gläubigern jedoch nur zu, wenn sie glaubhaft machen, dass durch die Umwandlung die Erfüllung ihrer Forderung gefährdet wird."
    },
    {
      "date": "2025-08-13",
      "id": "120777",
      "original_text": "Sonstige Registerbekanntmachung\nHamburg Amtsgericht Hamburg HRB 189155\nViromed Medical AG – Hamburg",
      "type": "Sonstige Registerbekanntmachung",
      "state": "Hamburg",
      "amtsgericht": "Amtsgericht Hamburg",
      "registernummer": "HRB 189155",
      "registerart": "HRB",
      "company_name": "Viromed Medical AG",
      "company_seat": "Hamburg",
      "details": "13.08.2025 (Bekanntmachungsdatum)\n\nHamburg Amtsgericht Hamburg HRB 189155\nSonstige Registerbekanntmachung 08.08.2025 (Eintragungsdatum)\n\nViromed Medical AG\nAktiengesellschaft\nHamburg\n\nAls nicht eingetragen wird bekannt gemacht: Liste des Aufsichtsrats wurde eingereicht."
    },
    {
      "date": "2025-08-13",
      "id": "120778",
      "original_text": "Registerbekanntmachung nach dem Umwandlungsgesetz\nBaden-Württemberg Amtsgericht Mannheim HRB 9858\nBilfinger Property and Insurance Management GmbH – Mannheim",
      "type": "Registerbekanntmachung nach dem Umwandlungsgesetz",
      "state": "Baden-Württemberg",
      "amtsgericht": "Amtsgericht Mannheim",
      "registernummer": "HRB 9858",
      "registerart": "HRB",
      "company_name": "Bilfinger Property and Insurance Management GmbH",
      "company_seat": "Mannheim",
      "details": "13.08.2025 (Bekanntmachungsdatum)\n\nBaden-Württemberg Amtsgericht Mannheim HRB 9858\nRegisterbekanntmachung nach dem Umwandlungsgesetz 13.08.2025 (Eintragungsdatum)\n\nBilfinger Property and Insurance Management GmbH\nGesellschaft mit beschränkter Haftung\nMannheim\n\nAls nicht eingetragen wird bekanntgemacht: Den Gläubigern der an der Verschmelzung beteiligten Rechtsträger ist, wenn sie binnen sechs Monaten nach dem Tag, an dem die Eintragung der Verschmelzung in das Register des Sitzes desjenigen Rechtsträgers, dessen Gläubiger sie sind, nach § 19 Abs. 3 UmwG als bekanntgemacht gilt, ihren Anspruch nach Grund und Höhe schriftlich anmelden, Sicherheit zu leisten, soweit sie nicht Befriedigung verlangen können. Dieses Recht steht den Gläubigern jedoch nur zu, wenn sie glaubhaft machen, dass durch die Verschmelzung die Erfüllung ihrer Forderung gefährdet wird."
    },
    {
      "date": "2025-08-13",
      "id": "120779",
      "original_text": "Registerbekanntmachung nach dem Umwandlungsgesetz\nMecklenburg-Vorpommern Amtsgericht Neubrandenburg HRB 21407\nETL Sann Steuerberatungsgesellschaft mbH – Waren (Müritz)",
      "type": "Registerbekanntmachung nach dem Umwandlungsgesetz",
      "state": "Mecklenburg-Vorpommern",
      "amtsgericht": "Amtsgericht Neubrandenburg",
      "registernummer": "HRB 21407",
      "registerart": "HRB",
      "company_name": "ETL Sann Steuerberatungsgesellschaft mbH",
      "company_seat": "Waren (Müritz)",
      "details": "13.08.2025 (Bekanntmachungsdatum)\n\nMecklenburg-Vorpommern Amtsgericht Neubrandenburg HRB 21407\nRegisterbekanntmachung nach dem Umwandlungsgesetz 13.08.2025 (Eintragungsdatum)\n\nETL Sann Steuerberatungsgesellschaft mbH\nGesellschaft mit beschränkter Haftung\nWaren (Müritz)\n\nAls nicht eingetragen wird veröffentlicht: Den Gläubigern der an der Verschmelzung beteiligten Rechtsträger ist, wenn sie binnen sechs Monaten nach dem Tag, an dem die Eintragung der Verschmelzung in das Register des Sitzes desjenigen Rechtsträgers, dessen Gläubiger sie sind, nach § 19 Abs. 3 UmwG als bekannt gemacht gilt,\nihren Anspruch nach Grund und Höhe in Textform anmelden, Sicherheit zu leisten, soweit sie nicht Befriedigung verlangen können. Dieses Recht steht den Gläubigern jedoch nur zu, wenn sie glaubhaft machen, dass durch die Verschmelzung die Erfüllung der Forderung gefährdet wird."
    },
    {
      "date": "2025-08-13",
      "id": "120780",
      "original_text": "Registerbekanntmachung nach dem Umwandlungsgesetz\nBerlin Amtsgericht Berlin (Charlottenburg) HRB 146744\n1DDB Germany Group GmbH – Berlin",
      "type": "Registerbekanntmachung nach dem Umwandlungsgesetz",
      "state": "Berlin",
      "amtsgericht": "Amtsgericht Berlin (Charlottenburg)",
      "registernummer": "HRB 146744",
      "registerart": "HRB",
      "company_name": "1DDB Germany Group GmbH",
      "company_seat": "Berlin",
      "details": "13.08.2025 (Bekanntmachungsdatum)\n\nBerlin Amtsgericht Berlin (Charlottenburg) HRB 146744\nRegisterbekanntmachung nach dem Umwandlungsgesetz 12.08.2025 (Eintragungsdatum)\n\n1DDB Germany Group GmbH\nGesellschaft mit beschränkter Haftung\nBerlin\n\nZu Eintragungsnummer 43 vom 12.08.2025 wird als nicht eingetragen veröffentlicht:\n\nDen Gläubigern der an der Verschmelzung beteiligten Rechtsträger ist, wenn sie binnen sechs Monaten nach dem Tag, an dem die Eintragung der Verschmelzung in das Register des Sitzes desjenigen Rechtsträgers, dessen Gläubiger sie sind, als bekannt gemacht gilt, ihren Anspruch nach Grund und Höhe schriftlich anmelden, Sicherheit zu leisten, soweit sie nicht Befriedigung verlangen können. Dieses Recht steht den Gläubigern jedoch nur zu, wenn sie glaubhaft machen, dass durch die Verschmelzung die Erfüllung ihrer Forderung gefährdet wird. Das Recht, Sicherheitsleistung zu verlangen, steht Gläubigern nicht zu, die im Falle der Insolvenz ein Recht auf vorzugsweise Befriedigung aus einer Deckungsmasse haben, die nach gesetzlicher Vorschrift zu ihrem Schutz errichtet und staatlich überwacht ist."
    },
    {
      "date": "2025-08-13",
      "id": "120781",
      "original_text": "Löschungsankündigung\nBerlin Amtsgericht Berlin (Charlottenburg) HRB 173303\nEnacra UG (haftungsbeschränkt) – Berlin",
      "type": "Löschungsankündigung",
      "state": "Berlin",
      "amtsgericht": "Amtsgericht Berlin (Charlottenburg)",
      "registernummer": "HRB 173303",
      "registerart": "HRB",
      "company_name": "Enacra UG (haftungsbeschränkt)",
      "company_seat": "Berlin",
      "details": "13.08.2025 (Bekanntmachungsdatum)\n\nBerlin Amtsgericht Berlin (Charlottenburg) HRB 173303\nLöschungsankündigung\n\nEnacra UG (haftungsbeschränkt)\nGesellschaft mit beschränkter Haftung\nBerlin\n\nBei der nachstehenden Gesellschaft wird das Amtslöschungsverfahren gemäß § 394 FamFG eingeleitet. Widerspruchsfrist 6 Wochen"
    },
    {
      "date": "2025-08-13",
      "id": "120782",
      "original_text": "Registerbekanntmachung nach dem Umwandlungsgesetz\nBerlin Amtsgericht Berlin (Charlottenburg) HRB 277774\nHypoport Financing AG – Berlin",
      "type": "Registerbekanntmachung nach dem Umwandlungsgesetz",
      "state": "Berlin",
      "amtsgericht": "Amtsgericht Berlin (Charlottenburg)",
      "registernummer": "HRB 277774",
      "registerart": "HRB",
      "company_name": "Hypoport Financing AG",
      "company_seat": "Berlin",
      "details": "13.08.2025 (Bekanntmachungsdatum)\n\nBerlin Amtsgericht Berlin (Charlottenburg) HRB 277774\nRegisterbekanntmachung nach dem Umwandlungsgesetz 04.08.2025 (Eintragungsdatum)\n\nHypoport Financing AG\nAktiengesellschaft\nBerlin\n\nZu Eintragungsnummer 1 vom 04.08.2025 wird als nicht eingetragen veröffentlicht: Den Gläubigern ist, wenn sie binnen sechs Monaten nach dem Tag, an dem die Eintragung der Umwandlung als bekannt gemacht gilt, ihren Anspruch nach Grund und Höhe schriftlich anmelden, Sicherheit zu leisten, soweit sie nicht Befriedigung verlangen können. Dieses Recht steht den Gläubigern jedoch nur zu, wenn sie glaubhaft machen, dass durch die Umwandlung die Erfüllung ihrer Forderung gefährdet wird. Das Recht, Sicherheitsleistung zu verlangen, steht Gläubigern nicht zu, die im Falle der Insolvenz ein Recht auf vorzugsweise Befriedigung aus einer Deckungsmasse haben, die nach gesetzlicher Vorschrift zu ihrem Schutz errichtet und staatlich überwacht ist."
    },
    {
      "date": "2025-08-13",
      "id": "120783",
      "original_text": "Registerbekanntmachung nach dem Umwandlungsgesetz\nBaden-Württemberg Amtsgericht Stuttgart HRB 15823\nImmoTech Steinbeis GmbH – Stuttgart",
      "type": "Registerbekanntmachung nach dem Umwandlungsgesetz",
      "state": "Baden-Württemberg",
      "amtsgericht": "Amtsgericht Stuttgart",
      "registernummer": "HRB 15823",
      "registerart": "HRB",
      "company_name": "ImmoTech Steinbeis GmbH",
      "company_seat": "Stuttgart",
      "details": "13.08.2025 (Bekanntmachungsdatum)\n\nBaden-Württemberg Amtsgericht Stuttgart HRB 15823\nRegisterbekanntmachung nach dem Umwandlungsgesetz 13.08.2025 (Eintragungsdatum)\n\nImmoTech Steinbeis GmbH\nGesellschaft mit beschränkter Haftung\nStuttgart\n\nAls nicht eingetragen wird bekanntgemacht:\nDen Gläubigern der an der Abspaltung beteiligten Rechtsträger ist, wenn sie binnen sechs Monaten nach dem Tag, an dem die Eintragung der Abspaltung in das Register des Sitzes desjenigen Rechtsträgers, dessen Gläubiger sie sind, nach § 19 Abs. 3 UmwG als bekanntgemacht gilt, ihren Anspruch nach Grund und Höhe schriftlich anmelden, Sicherheit zu leisten, soweit sie nicht Befriedigung verlangen können. Dieses Recht steht den Gläubigern jedoch nur zu, wenn sie glaubhaft machen, dass durch die Abspaltung die Erfüllung ihrer Forderung gefährdet wird."
    },
    {
      "date": "2025-08-13",
      "id": "120784",
      "original_text": "Registerbekanntmachung nach dem Umwandlungsgesetz\nBaden-Württemberg Amtsgericht Stuttgart HRB 23829\nSteinbeis Immobilien-Holding GmbH – Stuttgart",
      "type": "Registerbekanntmachung nach dem Umwandlungsgesetz",
      "state": "Baden-Württemberg",
      "amtsgericht": "Amtsgericht Stuttgart",
      "registernummer": "HRB 23829",
      "registerart": "HRB",
      "company_name": "Steinbeis Immobilien-Holding GmbH",
      "company_seat": "Stuttgart",
      "details": "13.08.2025 (Bekanntmachungsdatum)\n\nBaden-Württemberg Amtsgericht Stuttgart HRB 23829\nRegisterbekanntmachung nach dem Umwandlungsgesetz 13.08.2025 (Eintragungsdatum)\n\nSteinbeis Immobilien-Holding GmbH\nGesellschaft mit beschränkter Haftung\nStuttgart\n\nAls nicht eingetragen wird bekanntgemacht:\nDen Gläubigern der an der Abspaltung beteiligten Rechtsträger ist, wenn sie binnen sechs Monaten nach dem Tag, an dem die Eintragung der Abspaltung in das Register des Sitzes desjenigen Rechtsträgers, dessen Gläubiger sie sind, nach § 19 Abs. 3 UmwG als bekanntgemacht gilt, ihren Anspruch nach Grund und Höhe schriftlich anmelden, Sicherheit zu leisten, soweit sie nicht Befriedigung verlangen können. Dieses Recht steht den Gläubigern jedoch nur zu, wenn sie glaubhaft machen, dass durch die Abspaltung die Erfüllung ihrer Forderung gefährdet wird."
    },
    {
      "date": "2025-08-13",
      "id": "120785",
      "original_text": "Löschungsankündigung\nBrandenburg Amtsgericht Cottbus HRB 14841\nInterDeal GmbH – Schönefeld",
      "type": "Löschungsankündigung",
      "state": "Brandenburg",
      "amtsgericht": "Amtsgericht Cottbus",
      "registernummer": "HRB 14841",
      "registerart": "HRB",
      "company_name": "InterDeal GmbH",
      "company_seat": "Schönefeld",
      "details": "13.08.2025 (Bekanntmachungsdatum)\n\nBrandenburg Amtsgericht Cottbus HRB 14841\nLöschungsankündigung\n\nInterDeal GmbH\nGesellschaft mit beschränkter Haftung\nSchönefeld\n\nBei der nachstehenden Gesellschaft wird das Amtslöschungsverfahren gemäß § 394 FamFG eingeleitet."
    },
    {
      "date": "2025-08-13",
      "id": "120786",
      "original_text": "Einreichung neuer Dokumente\nHamburg Amtsgericht Hamburg HRB 14604\nEuropäisch-Iranische Handelsbank Aktiengesellschaft – Hamburg",
      "type": "Einreichung neuer Dokumente",
      "state": "Hamburg",
      "amtsgericht": "Amtsgericht Hamburg",
      "registernummer": "HRB 14604",
      "registerart": "HRB",
      "company_name": "Europäisch-Iranische Handelsbank Aktiengesellschaft",
      "company_seat": "Hamburg",
      "details": "13.08.2025 (Bekanntmachungsdatum)\n\nHamburg Amtsgericht Hamburg HRB 14604\nEinreichung neuer Dokumente\n\nEuropäisch-Iranische Handelsbank Aktiengesellschaft\nAktiengesellschaft\nHamburg\n\nAls nicht eingetragen wird bekannt gemacht: Liste des Aufsichtsrats wurde eingereicht."
    },
    {
      "date": "2025-08-13",
      "id": "120787",
      "original_text": "Löschungsankündigung\nBerlin Amtsgericht Berlin (Charlottenburg) HRB 186799\nIPS Immobilien Performance und Bauservice GmbH – Berlin",
      "type": "Löschungsankündigung",
      "state": "Berlin",
      "amtsgericht": "Amtsgericht Berlin (Charlottenburg)",
      "registernummer": "HRB 186799",
      "registerart": "HRB",
      "company_name": "IPS Immobilien Performance und Bauservice GmbH",
      "company_seat": "Berlin",
      "details": "13.08.2025 (Bekanntmachungsdatum)\n\nBerlin Amtsgericht Berlin (Charlottenburg) HRB 186799\nLöschungsankündigung\n\nIPS Immobilien Performance und Bauservice GmbH\nGesellschaft mit beschränkter Haftung\nBerlin\n\nBei der nachstehenden Gesellschaft wird das Amtslöschungsverfahren gemäß § 394 FamFG eingeleitet. Widerspruchsfrist 6 Wochen"
    },
    {
      "date": "2025-08-13",
      "id": "120788",
      "original_text": "Löschungsankündigung\nBerlin Amtsgericht Berlin (Charlottenburg) HRB 140131\nMiMa Kfz.-Betrieb GmbH – Berlin",
      "type": "Löschungsankündigung",
      "state": "Berlin",
      "amtsgericht": "Amtsgericht Berlin (Charlottenburg)",
      "registernummer": "HRB 140131",
      "registerart": "HRB",
      "company_name": "MiMa Kfz.-Betrieb GmbH",
      "company_seat": "Berlin",
      "details": "13.08.2025 (Bekanntmachungsdatum)\n\nBerlin Amtsgericht Berlin (Charlottenburg) HRB 140131\nLöschungsankündigung\n\nMiMa Kfz.-Betrieb GmbH\nGesellschaft mit beschränkter Haftung\nBerlin\n\nBei der nachstehenden Gesellschaft wird das Amtslöschungsverfahren gemäß § 394 FamFG eingeleitet. Widerspruchsfrist 6 Wochen"
    },
    {
      "date": "2025-08-13",
      "id": "120789",
      "original_text": "Löschungsankündigung\nBerlin Amtsgericht Berlin (Charlottenburg) HRB 180157\nSchwammerl Gastroservice UG (haftungsbeschränkt) – Berlin",
      "type": "Löschungsankündigung",
      "state": "Berlin",
      "amtsgericht": "Amtsgericht Berlin (Charlottenburg)",
      "registernummer": "HRB 180157",
      "registerart": "HRB",
      "company_name": "Schwammerl Gastroservice UG (haftungsbeschränkt)",
      "company_seat": "Berlin",
      "details": "13.08.2025 (Bekanntmachungsdatum)\n\nBerlin Amtsgericht Berlin (Charlottenburg) HRB 180157\nLöschungsankündigung\n\nSchwammerl Gastroservice UG (haftungsbeschränkt)\nGesellschaft mit beschränkter Haftung\nBerlin\n\nBei der nachstehenden Gesellschaft wird das Amtslöschungsverfahren gemäß § 394 FamFG eingeleitet. Widerspruchsfrist 6 Wochen"
    },
    {
      "date": "2025-08-13",
      "id": "120790",
      "original_text": "Registerbekanntmachung nach dem Umwandlungsgesetz\nBaden-Württemberg Amtsgericht Stuttgart HRB 768871\nHWS Crypto GmbH Steuerberatungsgesellschaft – Sindelfingen",
      "type": "Registerbekanntmachung nach dem Umwandlungsgesetz",
      "state": "Baden-Württemberg",
      "amtsgericht": "Amtsgericht Stuttgart",
      "registernummer": "HRB 768871",
      "registerart": "HRB",
      "company_name": "HWS Crypto GmbH Steuerberatungsgesellschaft",
      "company_seat": "Sindelfingen",
      "details": "13.08.2025 (Bekanntmachungsdatum)\n\nBaden-Württemberg Amtsgericht Stuttgart HRB 768871\nRegisterbekanntmachung nach dem Umwandlungsgesetz 13.08.2025 (Eintragungsdatum)\n\nHWS Crypto GmbH Steuerberatungsgesellschaft\nGesellschaft mit beschränkter Haftung\nSindelfingen\n\nAls nicht eingetragen wird bekanntgemacht:\nDen Gläubigern der an der Verschmelzung beteiligten Rechtsträger ist, wenn sie binnen sechs Monaten nach dem Tag, an dem die Eintragung der Verschmelzung in das Register des Sitzes desjenigen Rechtsträgers, dessen Gläubiger sie sind, nach § 19 Abs. 3 UmwG als bekanntgemacht gilt, ihren Anspruch nach Grund und Höhe schriftlich anmelden, Sicherheit zu leisten, soweit sie nicht Befriedigung verlangen können. Dieses Recht steht den Gläubigern jedoch nur zu, wenn sie glaubhaft machen, dass durch die Verschmelzung die Erfüllung ihrer Forderung gefährdet wird."
    },
    {
      "date": "2025-08-13",
      "id": "120791",
      "original_text": "Registerbekanntmachung nach dem Umwandlungsgesetz\nBrandenburg Amtsgericht Neuruppin GnR 31\nWohnungsbaugenossenschaft \"Uckermark\" Templin eG – Templin",
      "type": "Registerbekanntmachung nach dem Umwandlungsgesetz",
      "state": "Brandenburg",
      "amtsgericht": "Amtsgericht Neuruppin",
      "registernummer": "GnR 31",
      "registerart": "GnR",
      "company_name": "Wohnungsbaugenossenschaft \"Uckermark\" Templin eG",
      "company_seat": "Templin",
      "details": "13.08.2025 (Bekanntmachungsdatum)\n\nBrandenburg Amtsgericht Neuruppin GnR 31\nRegisterbekanntmachung nach dem Umwandlungsgesetz 12.08.2025 (Eintragungsdatum)\n\nWohnungsbaugenossenschaft \"Uckermark\" Templin eG\neingetragene Genossenschaft\nTemplin\n\nZu Eintragungsnummer 5 vom 12.08.2025 wird als nicht eingetragen veröffentlicht:\nDen Gläubigern der an der Verschmelzung beteiligten Rechtsträger ist, wenn sie binnen sechs Monaten nach dem Tag, an dem die Eintragung der Verschmelzung in das Register des Sitzes desjenigen Rechtsträgers, dessen Gläubiger sie sind, als bekannt gemacht gilt, ihren Anspruch nach Grund und Höhe schriftlich anmelden, Sicherheit zu leisten, soweit sie nicht Befriedigung verlangen können. Dieses Recht steht den Gläubigern jedoch nur zu, wenn sie glaubhaft machen, dass durch die Verschmelzung die Erfüllung ihrer Forderung gefährdet wird"
    },
    {
      "date": "2025-08-13",
      "id": "120792",
      "original_text": "Löschungsankündigung\nBerlin Amtsgericht Berlin (Charlottenburg) HRB 218382\nSchwarzlauer Bau GmbH – Berlin",
      "type": "Löschungsankündigung",
      "state": "Berlin",
      "amtsgericht": "Amtsgericht Berlin (Charlottenburg)",
      "registernummer": "HRB 218382",
      "registerart": "HRB",
      "company_name": "Schwarzlauer Bau GmbH",
      "company_seat": "Berlin",
      "details": "13.08.2025 (Bekanntmachungsdatum)\n\nBerlin Amtsgericht Berlin (Charlottenburg) HRB 218382\nLöschungsankündigung\n\nSchwarzlauer Bau GmbH\nGesellschaft mit beschränkter Haftung\nBerlin\n\nBei der nachstehenden Gesellschaft wird das Amtslöschungsverfahren gemäß § 394 FamFG eingeleitet. Widerspruchsfrist 6 Wochen"
    },
    {
      "date": "2025-08-13",
      "id": "120793",
      "original_text": "Registerbekanntmachung nach dem Umwandlungsgesetz\nBaden-Württemberg Amtsgericht Stuttgart HRB 780210\nbeene GmbH – Geislingen",
      "type": "Registerbekanntmachung nach dem Umwandlungsgesetz",
      "state": "Baden-Württemberg",
      "amtsgericht": "Amtsgericht Stuttgart",
      "registernummer": "HRB 780210",
      "registerart": "HRB",
      "company_name": "beene GmbH",
      "company_seat": "Geislingen",
      "details": "13.08.2025 (Bekanntmachungsdatum)\n\nBaden-Württemberg Amtsgericht Stuttgart HRB 780210\nRegisterbekanntmachung nach dem Umwandlungsgesetz 13.08.2025 (Eintragungsdatum)\n\nbeene GmbH\nGesellschaft mit beschränkter Haftung\nGeislingen\n\nDen Gläubigern der an der Verschmelzung beteiligten Rechtsträger ist, wenn sie binnen sechs Monaten nach dem Tag, an dem die Eintragung der Verschmelzung in das Register des Sitzes desjenigen Rechtsträgers, dessen Gläubiger sie sind, nach § 19 Abs. 3 UmwG als bekanntgemacht gilt, ihren Anspruch nach Grund und Höhe schriftlich anmelden, Sicherheit zu leisten, soweit sie nicht Befriedigung verlangen können. Dieses Recht steht den Gläubigern jedoch nur zu, wenn sie glaubhaft machen, dass durch die Verschmelzung die Erfüllung ihrer Forderung gefährdet wird."
    },
    {
      "date": "2025-08-13",
      "id": "120794",
      "original_text": "Löschungsankündigung\nBerlin Amtsgericht Berlin (Charlottenburg) HRA 42402\nUW Objektgesellschaft Lilienthal/Rostock GmbH & Co. KG – Berlin",
      "type": "Löschungsankündigung",
      "state": "Berlin",
      "amtsgericht": "Amtsgericht Berlin (Charlottenburg)",
      "registernummer": "HRA 42402",
      "registerart": "HRA",
      "company_name": "UW Objektgesellschaft Lilienthal/Rostock GmbH & Co. KG",
      "company_seat": "Berlin",
      "details": "13.08.2025 (Bekanntmachungsdatum)\n\nBerlin Amtsgericht Berlin (Charlottenburg) HRA 42402\nLöschungsankündigung\n\nUW Objektgesellschaft Lilienthal/Rostock GmbH & Co. KG\nKommanditgesellschaft\nBerlin\n\nBei dem nachstehenden Unternehmen / der nachstehenden Gesellschaft wird das Amtslöschungsverfahren gemäß § 31 Abs. 2 HGB eingeleitet. Widerspruchsfrist 1 Monat"
    },
    {
      "date": "2025-08-13",
      "id": "120795",
      "original_text": "Registerbekanntmachung nach dem Umwandlungsgesetz\nHamburg Amtsgericht Hamburg HRA 40841\nFrank Siedlungsbaugesellschaft mbH & Co. KG – Hamburg",
      "type": "Registerbekanntmachung nach dem Umwandlungsgesetz",
      "state": "Hamburg",
      "amtsgericht": "Amtsgericht Hamburg",
      "registernummer": "HRA 40841",
      "registerart": "HRA",
      "company_name": "Frank Siedlungsbaugesellschaft mbH & Co. KG",
      "company_seat": "Hamburg",
      "details": "13.08.2025 (Bekanntmachungsdatum)\n\nHamburg Amtsgericht Hamburg HRA 40841\nRegisterbekanntmachung nach dem Umwandlungsgesetz 13.08.2025 (Eintragungsdatum)\n\nFrank Siedlungsbaugesellschaft mbH & Co. KG\nKommanditgesellschaft\nHamburg\n\nAls nicht eingetragen wird bekannt gemacht:\nDen Gläubigern der an der Verschmelzung beteiligten Gesellschaften ist, wenn sie binnen sechs Monaten nach dem Tag, an dem die Eintragung der Verschmelzung in das Register des Sitzes desjenigen Rechtsträgers, dessen Gläubiger sie sind, nach § 19 Absatz 3 UmwG als bekannt gemacht gilt, ihren Anspruch nach Grund und Höhe schriftlich anmelden, Sicherheit zu leisten, soweit sie nicht Befriedigung verlangen können. Dieses Recht steht den Gläubigern jedoch nur zu, wenn sie glaubhaft machen, dass durch die Verschmelzung die Erfüllung ihrer Forderung gefährdet wird."
    },
    {
      "date": "2025-08-13",
      "id": "120796",
      "original_text": "Registerbekanntmachung nach dem Umwandlungsgesetz\nHamburg Amtsgericht Hamburg HRB 41140\nFrank Beteiligungsgesellschaft mbH – Hamburg",
      "type": "Registerbekanntmachung nach dem Umwandlungsgesetz",
      "state": "Hamburg",
      "amtsgericht": "Amtsgericht Hamburg",
      "registernummer": "HRB 41140",
      "registerart": "HRB",
      "company_name": "Frank Beteiligungsgesellschaft mbH",
      "company_seat": "Hamburg",
      "details": "13.08.2025 (Bekanntmachungsdatum)\n\nHamburg Amtsgericht Hamburg HRB 41140\nRegisterbekanntmachung nach dem Umwandlungsgesetz 13.08.2025 (Eintragungsdatum)\n\nFrank Beteiligungsgesellschaft mbH\nGesellschaft mit beschränkter Haftung\nHamburg\n\nAls nicht eingetragen wird bekannt gemacht:\nDen Gläubigern der an der Verschmelzung beteiligten Gesellschaften ist, wenn sie binnen sechs Monaten nach dem Tag, an dem die Eintragung der Verschmelzung in das Register des Sitzes desjenigen Rechtsträgers, dessen Gläubiger sie sind, nach § 19 Absatz 3 UmwG als bekannt gemacht gilt, ihren Anspruch nach Grund und Höhe schriftlich anmelden, Sicherheit zu leisten, soweit sie nicht Befriedigung verlangen können. Dieses Recht steht den Gläubigern jedoch nur zu, wenn sie glaubhaft machen, dass durch die Verschmelzung die Erfüllung ihrer Forderung gefährdet wird."
    },
    {
      "date": "2025-08-13",
      "id": "120797",
      "original_text": "Registerbekanntmachung nach dem Umwandlungsgesetz\nBaden-Württemberg Amtsgericht Stuttgart HRB 770508\nCF Hameln GmbH – Freudenstadt",
      "type": "Registerbekanntmachung nach dem Umwandlungsgesetz",
      "state": "Baden-Württemberg",
      "amtsgericht": "Amtsgericht Stuttgart",
      "registernummer": "HRB 770508",
      "registerart": "HRB",
      "company_name": "CF Hameln GmbH",
      "company_seat": "Freudenstadt",
      "details": "13.08.2025 (Bekanntmachungsdatum)\n\nBaden-Württemberg Amtsgericht Stuttgart HRB 770508\nRegisterbekanntmachung nach dem Umwandlungsgesetz 13.08.2025 (Eintragungsdatum)\n\nCF Hameln GmbH\nGesellschaft mit beschränkter Haftung\nFreudenstadt\n\nDen Gläubigern der an der Verschmelzung beteiligten Rechtsträger ist, wenn sie binnen sechs Monaten nach dem Tag, an dem die Eintragung der Verschmelzung in das Register des Sitzes desjenigen Rechtsträgers, dessen Gläubiger sie sind, nach § 19 Abs. 3 UmwG als bekanntgemacht gilt, ihren Anspruch nach Grund und Höhe schriftlich anmelden, Sicherheit zu leisten, soweit sie nicht Befriedigung verlangen können. Dieses Recht steht den Gläubigern jedoch nur zu, wenn sie glaubhaft machen, dass durch die Verschmelzung die Erfüllung ihrer Forderung gefährdet wird."
    },
    {
      "date": "2025-08-13",
      "id": "120798",
      "original_text": "Registerbekanntmachung nach dem Umwandlungsgesetz\nBaden-Württemberg Amtsgericht Stuttgart HRB 580833\nKratschmayer Kälte-Klima-Lüftung GmbH – Kupferzell",
      "type": "Registerbekanntmachung nach dem Umwandlungsgesetz",
      "state": "Baden-Württemberg",
      "amtsgericht": "Amtsgericht Stuttgart",
      "registernummer": "HRB 580833",
      "registerart": "HRB",
      "company_name": "Kratschmayer Kälte-Klima-Lüftung GmbH",
      "company_seat": "Kupferzell",
      "details": "13.08.2025 (Bekanntmachungsdatum)\n\nBaden-Württemberg Amtsgericht Stuttgart HRB 580833\nRegisterbekanntmachung nach dem Umwandlungsgesetz 13.08.2025 (Eintragungsdatum)\n\nKratschmayer Kälte-Klima-Lüftung GmbH\nGesellschaft mit beschränkter Haftung\nKupferzell\n\nAls nicht eingetragen wird bekanntgemacht:\nDen Gläubigern der an der Verschmelzung beteiligten Rechtsträger ist, wenn sie binnen sechs Monaten nach dem Tag, an dem die Eintragung der Verschmelzung in das Register des Sitzes desjenigen Rechtsträgers, dessen Gläubiger sie sind, nach § 19 Abs. 3 UmwG als bekanntgemacht gilt, ihren Anspruch nach Grund und Höhe schriftlich anmelden, Sicherheit zu leisten, soweit sie nicht Befriedigung verlangen können. Dieses Recht steht den Gläubigern jedoch nur zu, wenn sie glaubhaft machen, dass durch die Verschmelzung die Erfüllung ihrer Forderung gefährdet wird."
    },
    {
      "date": "2025-08-13",
      "id": "120799",
      "original_text": "Löschungsankündigung\nBerlin Amtsgericht Berlin (Charlottenburg) HRB 204309\nSelina DE GmbH – Berlin",
      "type": "Löschungsankündigung",
      "state": "Berlin",
      "amtsgericht": "Amtsgericht Berlin (Charlottenburg)",
      "registernummer": "HRB 204309",
      "registerart": "HRB",
      "company_name": "Selina DE GmbH",
      "company_seat": "Berlin",
      "details": "13.08.2025 (Bekanntmachungsdatum)\n\nBerlin Amtsgericht Berlin (Charlottenburg) HRB 204309\nLöschungsankündigung\n\nSelina DE GmbH\nGesellschaft mit beschränkter Haftung\nBerlin\n\nEs ist beabsichtigt, die Prokura von Frau Nicole Ockelmann gemäß § 395 FamFG zu löschen. Widerspruchsfrist 4 Wochen."
    },
    {
      "date": "2025-08-13",
      "id": "120800",
      "original_text": "Registerbekanntmachung nach dem Umwandlungsgesetz\nBaden-Württemberg Amtsgericht Stuttgart HRB 290765\nKratschmayer Beteiligungs-GmbH – Bietigheim-Bissingen",
      "type": "Registerbekanntmachung nach dem Umwandlungsgesetz",
      "state": "Baden-Württemberg",
      "amtsgericht": "Amtsgericht Stuttgart",
      "registernummer": "HRB 290765",
      "registerart": "HRB",
      "company_name": "Kratschmayer Beteiligungs-GmbH",
      "company_seat": "Bietigheim-Bissingen",
      "details": "13.08.2025 (Bekanntmachungsdatum)\n\nBaden-Württemberg Amtsgericht Stuttgart HRB 290765\nRegisterbekanntmachung nach dem Umwandlungsgesetz 13.08.2025 (Eintragungsdatum)\n\nKratschmayer Beteiligungs-GmbH\nGesellschaft mit beschränkter Haftung\nBietigheim-Bissingen\n\nAls nicht eingetragen wird bekanntgemacht:\nDen Gläubigern der an der Verschmelzung beteiligten Rechtsträger ist, wenn sie binnen sechs Monaten nach dem Tag, an dem die Eintragung der Verschmelzung in das Register des Sitzes desjenigen Rechtsträgers, dessen Gläubiger sie sind, nach § 19 Abs. 3 UmwG als bekanntgemacht gilt, ihren Anspruch nach Grund und Höhe schriftlich anmelden, Sicherheit zu leisten, soweit sie nicht Befriedigung verlangen können. Dieses Recht steht den Gläubigern jedoch nur zu, wenn sie glaubhaft machen, dass durch die Verschmelzung die Erfüllung ihrer Forderung gefährdet wird."
    },
    {
      "date": "2025-08-13",
      "id": "120801",
      "original_text": "Registerbekanntmachung nach dem Umwandlungsgesetz\nBaden-Württemberg Amtsgericht Stuttgart HRA 290338\nKratschmayer Stuttgart GmbH & Co. KG – Bietigheim-Bissingen",
      "type": "Registerbekanntmachung nach dem Umwandlungsgesetz",
      "state": "Baden-Württemberg",
      "amtsgericht": "Amtsgericht Stuttgart",
      "registernummer": "HRA 290338",
      "registerart": "HRA",
      "company_name": "Kratschmayer Stuttgart GmbH & Co. KG",
      "company_seat": "Bietigheim-Bissingen",
      "details": "13.08.2025 (Bekanntmachungsdatum)\n\nBaden-Württemberg Amtsgericht Stuttgart HRA 290338\nRegisterbekanntmachung nach dem Umwandlungsgesetz 13.08.2025 (Eintragungsdatum)\n\nKratschmayer Stuttgart GmbH & Co. KG\nKommanditgesellschaft\nBietigheim-Bissingen\n\nDen Gläubigern der an der Verschmelzung beteiligten Rechtsträger ist, wenn sie binnen sechs Monaten nach dem Tag, an dem die Eintragung der Verschmelzung in das Register des Sitzes desjenigen Rechtsträgers, dessen Gläubiger sie sind, nach § 19 Abs. 3 UmwG als bekanntgemacht gilt, ihren Anspruch nach Grund und Höhe schriftlich anmelden, Sicherheit zu leisten, soweit sie nicht Befriedigung verlangen können. Dieses Recht steht den Gläubigern jedoch nur zu, wenn sie glaubhaft machen, dass durch die Verschmelzung die Erfüllung ihrer Forderung gefährdet wird."
    },
    {
      "date": "2025-08-13",
      "id": "120802",
      "original_text": "Registerbekanntmachung nach dem Umwandlungsgesetz\nBaden-Württemberg Amtsgericht Freiburg HRB 710836\nBarnes Group Acquisition GmbH – Bahlingen am Kaiserstuhl",
      "type": "Registerbekanntmachung nach dem Umwandlungsgesetz",
      "state": "Baden-Württemberg",
      "amtsgericht": "Amtsgericht Freiburg",
      "registernummer": "HRB 710836",
      "registerart": "HRB",
      "company_name": "Barnes Group Acquisition GmbH",
      "company_seat": "Bahlingen am Kaiserstuhl",
      "details": "13.08.2025 (Bekanntmachungsdatum)\n\nBaden-Württemberg Amtsgericht Freiburg HRB 710836\nRegisterbekanntmachung nach dem Umwandlungsgesetz 13.08.2025 (Eintragungsdatum)\n\nBarnes Group Acquisition GmbH\nGesellschaft mit beschränkter Haftung\nBahlingen am Kaiserstuhl\n\nAls nicht eingetragen wird bekanntgemacht:\nDen Gläubigern der an der Verschmelzung beteiligten Rechtsträger ist, wenn sie binnen sechs Monaten nach dem Tag, an dem die Eintragung der Verschmelzung in das Register des Sitzes desjenigen Rechtsträgers, dessen Gläubiger sie sind, nach § 19 Abs. 3 UmwG als bekanntgemacht gilt, ihren Anspruch nach Grund und Höhe schriftlich anmelden, Sicherheit zu leisten, soweit sie nicht Befriedigung verlangen können. Dieses Recht steht den Gläubigern jedoch nur zu, wenn sie glaubhaft machen, dass durch die Verschmelzung die Erfüllung ihrer Forderung gefährdet wird."
    },
    {
      "date": "2025-08-13",
      "id": "120803",
      "original_text": "Sonstige Registerbekanntmachung\nHamburg Amtsgericht Hamburg HRB 191194\nYouco HH-D25179 Vorrats-SE – Hamburg",
      "type": "Sonstige Registerbekanntmachung",
      "state": "Hamburg",
      "amtsgericht": "Amtsgericht Hamburg",
      "registernummer": "HRB 191194",
      "registerart": "HRB",
      "company_name": "Youco HH-D25179 Vorrats-SE",
      "company_seat": "Hamburg",
      "details": "13.08.2025 (Bekanntmachungsdatum)\n\nHamburg Amtsgericht Hamburg HRB 191194\nSonstige Registerbekanntmachung\n\nYouco HH-D25179 Vorrats-SE\nEuropäische Aktiengesellschaft (SE)\nHamburg\n\nAls nicht eingetragen wird bekannt gemacht: Liste des Aufsichtsrats wurde eingereicht."
    },
    {
      "date": "2025-08-13",
      "id": "120804",
      "original_text": "Registerbekanntmachung nach dem Umwandlungsgesetz\nSchleswig-Holstein Amtsgericht Kiel HRB 266\nLBS Immobilien GmbH – Kiel",
      "type": "Registerbekanntmachung nach dem Umwandlungsgesetz",
      "state": "Schleswig-Holstein",
      "amtsgericht": "Amtsgericht Kiel",
      "registernummer": "HRB 266",
      "registerart": "HRB",
      "company_name": "LBS Immobilien GmbH",
      "company_seat": "Kiel",
      "details": "13.08.2025 (Bekanntmachungsdatum)\n\nSchleswig-Holstein Amtsgericht Kiel HRB 266\nRegisterbekanntmachung nach dem Umwandlungsgesetz 12.08.2025 (Eintragungsdatum)\n\nLBS Immobilien GmbH\nGesellschaft mit beschränkter Haftung\nKiel\n\nZu Eintragungsnummer 23 vom 12.08.2025 wird als nicht eingetragen veröffentlicht: Den Gläubigern der an der Verschmelzung beteiligten Rechtsträger ist, wenn sie binnen sechs Monaten nach dem Tag, an dem die Eintragung der Verschmelzung in das Register des Sitzes desjenigen Rechtsträgers, dessen Gläubiger sie sind, nach § 19 Abs. 3 UmwG bekannt gemacht worden ist, ihren Anspruch nach Grund und Höhe schriftlich anmelden, Sicherheit zu leisten, soweit sie nicht Befriedigung verlangen können. Dieses Recht steht den Gläubigern jedoch nur zu, wenn sie glaubhaft machen, dass durch die Verschmelzung die Erfüllung ihrer Forderung gefährdet wird."
    },
    {
      "date": "2025-08-13",
      "id": "120805",
      "original_text": "Registerbekanntmachung nach dem Umwandlungsgesetz\nBaden-Württemberg Amtsgericht Stuttgart HRB 15823\nImmoTech Steinbeis GmbH – Stuttgart",
      "type": "Registerbekanntmachung nach dem Umwandlungsgesetz",
      "state": "Baden-Württemberg",
      "amtsgericht": "Amtsgericht Stuttgart",
      "registernummer": "HRB 15823",
      "registerart": "HRB",
      "company_name": "ImmoTech Steinbeis GmbH",
      "company_seat": "Stuttgart",
      "details": "13.08.2025 (Bekanntmachungsdatum)\n\nBaden-Württemberg Amtsgericht Stuttgart HRB 15823\nRegisterbekanntmachung nach dem Umwandlungsgesetz 13.08.2025 (Eintragungsdatum)\n\nImmoTech Steinbeis GmbH\nGesellschaft mit beschränkter Haftung\nStuttgart\n\nAls nicht eingetragen wird bekanntgemacht:\nDen Gläubigern der an der Verschmelzung beteiligten Rechtsträger ist, wenn sie binnen sechs Monaten nach dem Tag, an dem die Eintragung der Verschmelzung in das Register des Sitzes desjenigen Rechtsträgers, dessen Gläubiger sie sind, nach § 19 Abs. 3 UmwG als bekanntgemacht gilt, ihren Anspruch nach Grund und Höhe schriftlich anmelden, Sicherheit zu leisten, soweit sie nicht Befriedigung verlangen können. Dieses Recht steht den Gläubigern jedoch nur zu, wenn sie glaubhaft machen, dass durch die Verschmelzung die Erfüllung ihrer Forderung gefährdet wird."
    },
    {
      "date": "2025-08-13",
      "id": "120806",
      "original_text": "Registerbekanntmachung nach dem Umwandlungsgesetz\nBaden-Württemberg Amtsgericht Stuttgart HRB 23852\nSteinbeis Dritte Immobilien GmbH – Stuttgart",
      "type": "Registerbekanntmachung nach dem Umwandlungsgesetz",
      "state": "Baden-Württemberg",
      "amtsgericht": "Amtsgericht Stuttgart",
      "registernummer": "HRB 23852",
      "registerart": "HRB",
      "company_name": "Steinbeis Dritte Immobilien GmbH",
      "company_seat": "Stuttgart",
      "details": "13.08.2025 (Bekanntmachungsdatum)\n\nBaden-Württemberg Amtsgericht Stuttgart HRB 23852\nRegisterbekanntmachung nach dem Umwandlungsgesetz 13.08.2025 (Eintragungsdatum)\n\nSteinbeis Dritte Immobilien GmbH\nGesellschaft mit beschränkter Haftung\nStuttgart\n\nDen Gläubigern der an der Verschmelzung beteiligten Rechtsträger ist, wenn sie binnen sechs Monaten nach dem Tag, an dem die Eintragung der Verschmelzung in das Register des Sitzes desjenigen Rechtsträgers, dessen Gläubiger sie sind, nach § 19 Abs. 3 UmwG als bekanntgemacht gilt, ihren Anspruch nach Grund und Höhe schriftlich anmelden, Sicherheit zu leisten, soweit sie nicht Befriedigung verlangen können. Dieses Recht steht den Gläubigern jedoch nur zu, wenn sie glaubhaft machen, dass durch die Verschmelzung die Erfüllung ihrer Forderung gefährdet wird."
    },
    {
      "date": "2025-08-13",
      "id": "120807",
      "original_text": "Löschungsankündigung\nSachsen-Anhalt Amtsgericht Stendal VR 53242\nVerein der Dauercamper des Zeltplatzes Arendsee e.V. – Arendsee",
      "type": "Löschungsankündigung",
      "state": "Sachsen-Anhalt",
      "amtsgericht": "Amtsgericht Stendal",
      "registernummer": "VR 53242",
      "registerart": "VR",
      "company_name": "Verein der Dauercamper des Zeltplatzes Arendsee e.V.",
      "company_seat": "Arendsee",
      "details": "13.08.2025 (Bekanntmachungsdatum)\n\nSachsen-Anhalt Amtsgericht Stendal VR 53242\nLöschungsankündigung\n\nVerein der Dauercamper des Zeltplatzes Arendsee e.V.\neingetragener Verein\nArendsee\n\nDas Registergericht beabsichtigt, das Registerblatt des vorstehenden im Vereinsregister eingetragenen Vereins zu schließen, da der Verein infolge Wegfall sämtlicher Mitglieder bzw. wegen Aufgabe des tatsächlicher Vereinszwecks erloschen ist.  Die Frist zu Erhebung eines Widerspruchs wird auf ein Monat festgesetzt."
    },
    {
      "date": "2025-08-13",
      "id": "120808",
      "original_text": "Registerbekanntmachung nach dem Umwandlungsgesetz\nBaden-Württemberg Amtsgericht Stuttgart HRA 742507\nZAR Jena GmbH & Co. KG – Stuttgart",
      "type": "Registerbekanntmachung nach dem Umwandlungsgesetz",
      "state": "Baden-Württemberg",
      "amtsgericht": "Amtsgericht Stuttgart",
      "registernummer": "HRA 742507",
      "registerart": "HRA",
      "company_name": "ZAR Jena GmbH & Co. KG",
      "company_seat": "Stuttgart",
      "details": "13.08.2025 (Bekanntmachungsdatum)\n\nBaden-Württemberg Amtsgericht Stuttgart HRA 742507\nRegisterbekanntmachung nach dem Umwandlungsgesetz 13.08.2025 (Eintragungsdatum)\n\nZAR Jena GmbH & Co. KG\nKommanditgesellschaft\nStuttgart\n\nDen Gläubigern des an dem Formwechsel beteiligten Rechtsträgers ist, wenn sie binnen sechs Monaten nach dem Tag, an dem die Eintragung des Formwechsels in das Register des Sitzes desjenigen Rechtsträgers, dessen Gläubiger sie sind, nach § 19 Abs. 3 UmwG als bekanntgemacht gilt, ihren Anspruch nach Grund und Höhe schriftlich anmelden, Sicherheit zu leisten, soweit sie nicht Befriedigung verlangen können. Dieses Recht steht den Gläubigern jedoch nur zu, wenn sie glaubhaft machen, dass durch den Formwechsel die Erfüllung ihrer Forderung gefährdet wird."
    },
    {
      "date": "2025-08-13",
      "id": "120809",
      "original_text": "Registerbekanntmachung nach dem Umwandlungsgesetz\nBaden-Württemberg Amtsgericht Stuttgart HRB 801161\nZAR Jena GmbH – Stuttgart",
      "type": "Registerbekanntmachung nach dem Umwandlungsgesetz",
      "state": "Baden-Württemberg",
      "amtsgericht": "Amtsgericht Stuttgart",
      "registernummer": "HRB 801161",
      "registerart": "HRB",
      "company_name": "ZAR Jena GmbH",
      "company_seat": "Stuttgart",
      "details": "13.08.2025 (Bekanntmachungsdatum)\n\nBaden-Württemberg Amtsgericht Stuttgart HRB 801161\nRegisterbekanntmachung nach dem Umwandlungsgesetz 13.08.2025 (Eintragungsdatum)\n\nZAR Jena GmbH\nGesellschaft mit beschränkter Haftung\nStuttgart\n\nDen Gläubigern des an dem Formwechsel beteiligten Rechtsträgers ist, wenn sie binnen sechs Monaten nach dem Tag, an dem die Eintragung des Formwechsels in das Register des Sitzes desjenigen Rechtsträgers, dessen Gläubiger sie sind, nach § 19 Abs. 3 UmwG als bekanntgemacht gilt, ihren Anspruch nach Grund und Höhe schriftlich anmelden, Sicherheit zu leisten, soweit sie nicht Befriedigung verlangen können. Dieses Recht steht den Gläubigern jedoch nur zu, wenn sie glaubhaft machen, dass durch den Formwechsel die Erfüllung ihrer Forderung gefährdet wird."
    },
    {
      "date": "2025-08-13",
      "id": "120810",
      "original_text": "Registerbekanntmachung nach dem Umwandlungsgesetz\nBaden-Württemberg Amtsgericht Freiburg HRB 5249\nULTRA Spedition GmbH – Glottertal",
      "type": "Registerbekanntmachung nach dem Umwandlungsgesetz",
      "state": "Baden-Württemberg",
      "amtsgericht": "Amtsgericht Freiburg",
      "registernummer": "HRB 5249",
      "registerart": "HRB",
      "company_name": "ULTRA Spedition GmbH",
      "company_seat": "Glottertal",
      "details": "13.08.2025 (Bekanntmachungsdatum)\n\nBaden-Württemberg Amtsgericht Freiburg HRB 5249\nRegisterbekanntmachung nach dem Umwandlungsgesetz 13.08.2025 (Eintragungsdatum)\n\nULTRA Spedition GmbH\nGesellschaft mit beschränkter Haftung\nGlottertal\n\nAls nicht eingetragen wird bekanntgemacht:\nDen Gläubigern der an der Verschmelzung beteiligten Rechtsträger ist, wenn sie binnen sechs Monaten nach dem Tag, an dem die Eintragung der Verschmelzung in das Register des Sitzes desjenigen Rechtsträgers, dessen Gläubiger sie sind, nach § 19 Abs. 3 UmwG als bekanntgemacht gilt, ihren Anspruch nach Grund und Höhe schriftlich anmelden, Sicherheit zu leisten, soweit sie nicht Befriedigung verlangen können. Dieses Recht steht den Gläubigern jedoch nur zu, wenn sie glaubhaft machen, dass durch die Verschmelzung die Erfüllung ihrer Forderung gefährdet wird."
    },
    {
      "date": "2025-08-13",
      "id": "120811",
      "original_text": "Einreichung neuer Dokumente\nBaden-Württemberg Amtsgericht Mannheim HRB 8674\nRhein-Neckar-Verkehr GmbH – Mannheim",
      "type": "Einreichung neuer Dokumente",
      "state": "Baden-Württemberg",
      "amtsgericht": "Amtsgericht Mannheim",
      "registernummer": "HRB 8674",
      "registerart": "HRB",
      "company_name": "Rhein-Neckar-Verkehr GmbH",
      "company_seat": "Mannheim",
      "details": "13.08.2025 (Bekanntmachungsdatum)\n\nBaden-Württemberg Amtsgericht Mannheim HRB 8674\nEinreichung neuer Dokumente\n\nRhein-Neckar-Verkehr GmbH\nGesellschaft mit beschränkter Haftung\nMannheim\n\nDie Gesellschaft hat am 12.08.2025 die Liste über die Zusammensetzung des Aufsichtsrats zum Handelsregister eingereicht."
    },
    {
      "date": "2025-08-13",
      "id": "120812",
      "original_text": "Registerbekanntmachung nach dem Umwandlungsgesetz\nBaden-Württemberg Amtsgericht Freiburg HRB 261403\nStadelmann Spedition GmbH – Teningen",
      "type": "Registerbekanntmachung nach dem Umwandlungsgesetz",
      "state": "Baden-Württemberg",
      "amtsgericht": "Amtsgericht Freiburg",
      "registernummer": "HRB 261403",
      "registerart": "HRB",
      "company_name": "Stadelmann Spedition GmbH",
      "company_seat": "Teningen",
      "details": "13.08.2025 (Bekanntmachungsdatum)\n\nBaden-Württemberg Amtsgericht Freiburg HRB 261403\nRegisterbekanntmachung nach dem Umwandlungsgesetz 13.08.2025 (Eintragungsdatum)\n\nStadelmann Spedition GmbH\nGesellschaft mit beschränkter Haftung\nTeningen\n\nDen Gläubigern der an der Verschmelzung beteiligten Rechtsträger ist, wenn sie binnen sechs Monaten nach dem Tag, an dem die Eintragung der Verschmelzung in das Register des Sitzes desjenigen Rechtsträgers, dessen Gläubiger sie sind, nach § 19 Abs. 3 UmwG als bekanntgemacht gilt, ihren Anspruch nach Grund und Höhe schriftlich anmelden, Sicherheit zu leisten, soweit sie nicht Befriedigung verlangen können. Dieses Recht steht den Gläubigern jedoch nur zu, wenn sie glaubhaft machen, dass durch die Verschmelzung die Erfüllung ihrer Forderung gefährdet wird."
    },
    {
      "date": "2025-08-13",
      "id": "120813",
      "original_text": "Registerbekanntmachung nach dem Umwandlungsgesetz\nSchleswig-Holstein Amtsgericht Kiel HRA 12794\nWOTO Tischlerei Thomas Ditsch e. K – Norderstedt",
      "type": "Registerbekanntmachung nach dem Umwandlungsgesetz",
      "state": "Schleswig-Holstein",
      "amtsgericht": "Amtsgericht Kiel",
      "registernummer": "HRA 12794",
      "registerart": "HRA",
      "company_name": "WOTO Tischlerei Thomas Ditsch e. K",
      "company_seat": "Norderstedt",
      "details": "13.08.2025 (Bekanntmachungsdatum)\n\nSchleswig-Holstein Amtsgericht Kiel HRA 12794\nRegisterbekanntmachung nach dem Umwandlungsgesetz 12.08.2025 (Eintragungsdatum)\n\nWOTO Tischlerei Thomas Ditsch e. K\nEinzelkaufmann / Einzelkauffrau\nNorderstedt\n\nZu Eintragungsnummer 1 vom 12.08.2025 wird als nicht eingetragen veröffentlicht: Den Gläubigern der an der Verschmelzung beteiligten Rechtsträger ist, wenn sie binnen sechs Monaten nach dem Tag, an dem die Eintragung der Verschmelzung in das Register des Sitzes desjenigen Rechtsträgers, dessen Gläubiger sie sind, nach § 19 Abs. 3 UmwG bekannt gemacht worden ist, ihren Anspruch nach Grund und Höhe schriftlich anmelden, Sicherheit zu leisten, soweit sie nicht Befriedigung verlangen können. Dieses Recht steht den Gläubigern jedoch nur zu, wenn sie glaubhaft machen, dass durch die Verschmelzung die Erfüllung ihrer Forderung gefährdet wird."
    },
    {
      "date": "2025-08-13",
      "id": "120814",
      "original_text": "Registerbekanntmachung nach dem Umwandlungsgesetz\nBaden-Württemberg Amtsgericht Mannheim HRB 730994\nCDK-Immobilien Holding GmbH – Heidelberg",
      "type": "Registerbekanntmachung nach dem Umwandlungsgesetz",
      "state": "Baden-Württemberg",
      "amtsgericht": "Amtsgericht Mannheim",
      "registernummer": "HRB 730994",
      "registerart": "HRB",
      "company_name": "CDK-Immobilien Holding GmbH",
      "company_seat": "Heidelberg",
      "details": "13.08.2025 (Bekanntmachungsdatum)\n\nBaden-Württemberg Amtsgericht Mannheim HRB 730994\nRegisterbekanntmachung nach dem Umwandlungsgesetz 13.08.2025 (Eintragungsdatum)\n\nCDK-Immobilien Holding GmbH\nGesellschaft mit beschränkter Haftung\nHeidelberg\n\nDen Gläubigern der an der Verschmelzung beteiligten Rechtsträger ist, wenn sie binnen sechs Monaten nach dem Tag, an dem die Eintragung der Verschmelzung in das Register des Sitzes desjenigen Rechtsträgers, dessen Gläubiger sie sind, nach § 19 Abs. 3 UmwG als bekanntgemacht gilt, ihren Anspruch nach Grund und Höhe schriftlich anmelden, Sicherheit zu leisten, soweit sie nicht Befriedigung verlangen können. Dieses Recht steht den Gläubigern jedoch nur zu, wenn sie glaubhaft machen, dass durch die Verschmelzung die Erfüllung ihrer Forderung gefährdet wird."
    },
    {
      "date": "2025-08-13",
      "id": "120815",
      "original_text": "Registerbekanntmachung nach dem Umwandlungsgesetz\nHamburg Amtsgericht Hamburg HRB 93285\nWalter Köster Beteiligungsgesellschaft mbH – Hamburg",
      "type": "Registerbekanntmachung nach dem Umwandlungsgesetz",
      "state": "Hamburg",
      "amtsgericht": "Amtsgericht Hamburg",
      "registernummer": "HRB 93285",
      "registerart": "HRB",
      "company_name": "Walter Köster Beteiligungsgesellschaft mbH",
      "company_seat": "Hamburg",
      "details": "13.08.2025 (Bekanntmachungsdatum)\n\nHamburg Amtsgericht Hamburg HRB 93285\nRegisterbekanntmachung nach dem Umwandlungsgesetz 13.08.2025 (Eintragungsdatum)\n\nWalter Köster Beteiligungsgesellschaft mbH\nGesellschaft mit beschränkter Haftung\nHamburg\n\nAls nicht eingetragen wird bekannt gemacht:\nDen Gläubigern der an der Verschmelzung beteiligten Gesellschaften ist, wenn sie binnen sechs Monaten nach dem Tag, an dem die Eintragung der Verschmelzung in das Register des Sitzes desjenigen Rechtsträgers, dessen Gläubiger sie sind, nach § 19 Absatz 3 UmwG als bekannt gemacht gilt, ihren Anspruch nach Grund und Höhe schriftlich anmelden, Sicherheit zu leisten, soweit sie nicht Befriedigung verlangen können. Dieses Recht steht den Gläubigern jedoch nur zu, wenn sie glaubhaft machen, dass durch die Verschmelzung die Erfüllung ihrer Forderung gefährdet wird."
    },
    {
      "date": "2025-08-13",
      "id": "120816",
      "original_text": "Registerbekanntmachung nach dem Umwandlungsgesetz\nBaden-Württemberg Amtsgericht Stuttgart HRB 769880\nfudim GmbH – Bühlerzell",
      "type": "Registerbekanntmachung nach dem Umwandlungsgesetz",
      "state": "Baden-Württemberg",
      "amtsgericht": "Amtsgericht Stuttgart",
      "registernummer": "HRB 769880",
      "registerart": "HRB",
      "company_name": "fudim GmbH",
      "company_seat": "Bühlerzell",
      "details": "13.08.2025 (Bekanntmachungsdatum)\n\nBaden-Württemberg Amtsgericht Stuttgart HRB 769880\nRegisterbekanntmachung nach dem Umwandlungsgesetz 13.08.2025 (Eintragungsdatum)\n\nfudim GmbH\nGesellschaft mit beschränkter Haftung\nBühlerzell\n\nAls nicht eingetragen wird bekanntgemacht:\nDen Gläubigern der an der Verschmelzung beteiligten Rechtsträger ist, wenn sie binnen sechs Monaten nach dem Tag, an dem die Eintragung der Verschmelzung in das Register des Sitzes desjenigen Rechtsträgers, dessen Gläubiger sie sind, nach § 19 Abs. 3 UmwG als bekanntgemacht gilt, ihren Anspruch nach Grund und Höhe schriftlich anmelden, Sicherheit zu leisten, soweit sie nicht Befriedigung verlangen können. Dieses Recht steht den Gläubigern jedoch nur zu, wenn sie glaubhaft machen, dass durch die Verschmelzung die Erfüllung ihrer Forderung gefährdet wird."
    },
    {
      "date": "2025-08-13",
      "id": "120817",
      "original_text": "Löschungsankündigung\nBerlin Amtsgericht Berlin (Charlottenburg) HRB 163217\nbbi economic GmbH – Berlin",
      "type": "Löschungsankündigung",
      "state": "Berlin",
      "amtsgericht": "Amtsgericht Berlin (Charlottenburg)",
      "registernummer": "HRB 163217",
      "registerart": "HRB",
      "company_name": "bbi economic GmbH",
      "company_seat": "Berlin",
      "details": "13.08.2025 (Bekanntmachungsdatum)\n\nBerlin Amtsgericht Berlin (Charlottenburg) HRB 163217\nLöschungsankündigung\n\nbbi economic GmbH\nGesellschaft mit beschränkter Haftung\nBerlin\n\nBei der nachstehenden Gesellschaft wird das Amtslöschungsverfahren gemäß § 394 FamFG eingeleitet. Widerspruchsfrist 6 Wochen"
    },
    {
      "date": "2025-08-13",
      "id": "120818",
      "original_text": "Registerbekanntmachung nach dem Umwandlungsgesetz\nBerlin Amtsgericht Berlin (Charlottenburg) HRB 198156\nFFO Verwaltungs GmbH – Berlin",
      "type": "Registerbekanntmachung nach dem Umwandlungsgesetz",
      "state": "Berlin",
      "amtsgericht": "Amtsgericht Berlin (Charlottenburg)",
      "registernummer": "HRB 198156",
      "registerart": "HRB",
      "company_name": "FFO Verwaltungs GmbH",
      "company_seat": "Berlin",
      "details": "13.08.2025 (Bekanntmachungsdatum)\n\nBerlin Amtsgericht Berlin (Charlottenburg) HRB 198156\nRegisterbekanntmachung nach dem Umwandlungsgesetz 12.08.2025 (Eintragungsdatum)\n\nFFO Verwaltungs GmbH\nGesellschaft mit beschränkter Haftung\nBerlin\n\nZu Eintragungsnummer 3 vom 12.08.2025 wird als nicht eingetragen veröffentlicht: Den Gläubigern der an der Verschmelzung beteiligten Rechtsträger ist, wenn sie binnen sechs Monaten nach dem Tag, an dem die Eintragung der Verschmelzung in das Register des Sitzes desjenigen Rechtsträgers, dessen Gläubiger sie sind, als bekannt gemacht gilt, ihren Anspruch nach Grund und Höhe schriftlich anmelden, Sicherheit zu leisten, soweit sie nicht Befriedigung verlangen können. Dieses Recht steht den Gläubigern jedoch nur zu, wenn sie glaubhaft machen, dass durch die Verschmelzung die Erfüllung ihrer Forderung gefährdet wird. Das Recht, Sicherheitsleistung zu verlangen, steht Gläubigern nicht zu, die im Falle der Insolvenz ein Recht auf vorzugsweise Befriedigung aus einer Deckungsmasse haben, die nach gesetzlicher Vorschrift zu ihrem Schutz errichtet und staatlich überwacht ist."
    },
    {
      "date": "2025-08-13",
      "id": "120819",
      "original_text": "Registerbekanntmachung nach dem Umwandlungsgesetz\nBerlin Amtsgericht Berlin (Charlottenburg) HRB 210678\nBBR Objektverwaltung GmbH – Berlin",
      "type": "Registerbekanntmachung nach dem Umwandlungsgesetz",
      "state": "Berlin",
      "amtsgericht": "Amtsgericht Berlin (Charlottenburg)",
      "registernummer": "HRB 210678",
      "registerart": "HRB",
      "company_name": "BBR Objektverwaltung GmbH",
      "company_seat": "Berlin",
      "details": "13.08.2025 (Bekanntmachungsdatum)\n\nBerlin Amtsgericht Berlin (Charlottenburg) HRB 210678\nRegisterbekanntmachung nach dem Umwandlungsgesetz 12.08.2025 (Eintragungsdatum)\n\nBBR Objektverwaltung GmbH\nGesellschaft mit beschränkter Haftung\nBerlin\n\nZu Eintragungsnummer 2 vom 12.08.2025 wird als nicht eingetragen veröffentlicht: Den Gläubigern der an der Verschmelzung beteiligten Rechtsträger ist, wenn sie binnen sechs Monaten nach dem Tag, an dem die Eintragung der Verschmelzung in das Register des Sitzes desjenigen Rechtsträgers, dessen Gläubiger sie sind, als bekannt gemacht gilt, ihren Anspruch nach Grund und Höhe schriftlich anmelden, Sicherheit zu leisten, soweit sie nicht Befriedigung verlangen können. Dieses Recht steht den Gläubigern jedoch nur zu, wenn sie glaubhaft machen, dass durch die Verschmelzung die Erfüllung ihrer Forderung gefährdet wird. Das Recht, Sicherheitsleistung zu verlangen, steht Gläubigern nicht zu, die im Falle der Insolvenz ein Recht auf vorzugsweise Befriedigung aus einer Deckungsmasse haben, die nach gesetzlicher Vorschrift zu ihrem Schutz errichtet und staatlich überwacht ist."
    },
    {
      "date": "2025-08-13",
      "id": "120820",
      "original_text": "Registerbekanntmachung nach dem Umwandlungsgesetz\nSachsen-Anhalt Amtsgericht Stendal HRB 14570\nMedia Mansfeld-Südharz GmbH – Lutherstadt Eisleben",
      "type": "Registerbekanntmachung nach dem Umwandlungsgesetz",
      "state": "Sachsen-Anhalt",
      "amtsgericht": "Amtsgericht Stendal",
      "registernummer": "HRB 14570",
      "registerart": "HRB",
      "company_name": "Media Mansfeld-Südharz GmbH",
      "company_seat": "Lutherstadt Eisleben",
      "details": "13.08.2025 (Bekanntmachungsdatum)\n\nSachsen-Anhalt Amtsgericht Stendal HRB 14570\nRegisterbekanntmachung nach dem Umwandlungsgesetz 13.08.2025 (Eintragungsdatum)\n\nMedia Mansfeld-Südharz GmbH\nGesellschaft mit beschränkter Haftung\nLutherstadt Eisleben\n\nNicht eingetragen:\nDen Gläubigern der an der Verschmelzung beteiligten Rechtsträger ist, wenn sie binnen sechs Monaten nach dem Tag, an dem die Eintragung der Verschmelzung nach § 19 Abs. 3 UmwG als bekanntgemacht gilt, ihren Anspruch nach Grund und Höhe schriftlich anmelden, Sicherheit zu leisten, soweit sie nicht Befriedigung verlangen können. Dieses Recht steht ihnen jedoch nur zu, wenn sie glaubhaft machen, dass durch die Verschmelzung die Erfüllung ihrer Forderung gefährdet wird."
    },
    {
      "date": "2025-08-13",
      "id": "120821",
      "original_text": "Registerbekanntmachung nach dem Umwandlungsgesetz\nSachsen-Anhalt Amtsgericht Stendal HRB 18971\nRedaktionsmanagement Mitteldeutschland GmbH – Halle (Saale)",
      "type": "Registerbekanntmachung nach dem Umwandlungsgesetz",
      "state": "Sachsen-Anhalt",
      "amtsgericht": "Amtsgericht Stendal",
      "registernummer": "HRB 18971",
      "registerart": "HRB",
      "company_name": "Redaktionsmanagement Mitteldeutschland GmbH",
      "company_seat": "Halle (Saale)",
      "details": "13.08.2025 (Bekanntmachungsdatum)\n\nSachsen-Anhalt Amtsgericht Stendal HRB 18971\nRegisterbekanntmachung nach dem Umwandlungsgesetz 13.08.2025 (Eintragungsdatum)\n\nRedaktionsmanagement Mitteldeutschland GmbH\nGesellschaft mit beschränkter Haftung\nHalle (Saale)\n\nNicht eingetragen:\nDen Gläubigern der an der Verschmelzung beteiligten Rechtsträger ist, wenn sie binnen sechs Monaten nach dem Tag, an dem die Eintragung der Verschmelzung nach § 19 Abs. 3 UmwG als bekanntgemacht gilt, ihren Anspruch nach Grund und Höhe schriftlich anmelden, Sicherheit zu leisten, soweit sie nicht Befriedigung verlangen können. Dieses Recht steht ihnen jedoch nur zu, wenn sie glaubhaft machen, dass durch die Verschmelzung die Erfüllung ihrer Forderung gefährdet wird."
    },
    {
      "date": "2025-08-13",
      "id": "120822",
      "original_text": "Registerbekanntmachung nach dem Umwandlungsgesetz\nSachsen-Anhalt Amtsgericht Stendal HRB 109461\nMedia Salzland GmbH – Schönebeck",
      "type": "Registerbekanntmachung nach dem Umwandlungsgesetz",
      "state": "Sachsen-Anhalt",
      "amtsgericht": "Amtsgericht Stendal",
      "registernummer": "HRB 109461",
      "registerart": "HRB",
      "company_name": "Media Salzland GmbH",
      "company_seat": "Schönebeck",
      "details": "13.08.2025 (Bekanntmachungsdatum)\n\nSachsen-Anhalt Amtsgericht Stendal HRB 109461\nRegisterbekanntmachung nach dem Umwandlungsgesetz 13.08.2025 (Eintragungsdatum)\n\nMedia Salzland GmbH\nGesellschaft mit beschränkter Haftung\nSchönebeck\n\nNicht eingetragen:\nDen Gläubigern der an der Verschmelzung beteiligten Rechtsträger ist, wenn sie binnen sechs Monaten nach dem Tag, an dem die Eintragung der Verschmelzung nach § 19 Abs. 3 UmwG als bekanntgemacht gilt, ihren Anspruch nach Grund und Höhe schriftlich anmelden, Sicherheit zu leisten, soweit sie nicht Befriedigung verlangen können. Dieses Recht steht ihnen jedoch nur zu, wenn sie glaubhaft machen, dass durch die Verschmelzung die Erfüllung ihrer Forderung gefährdet wird."
    },
    {
      "date": "2025-08-13",
      "id": "120823",
      "original_text": "Registerbekanntmachung nach dem Umwandlungsgesetz\nSachsen-Anhalt Amtsgericht Stendal HRB 2430\nMedia Burgenlandkreis GmbH – Salzwedel",
      "type": "Registerbekanntmachung nach dem Umwandlungsgesetz",
      "state": "Sachsen-Anhalt",
      "amtsgericht": "Amtsgericht Stendal",
      "registernummer": "HRB 2430",
      "registerart": "HRB",
      "company_name": "Media Burgenlandkreis GmbH",
      "company_seat": "Salzwedel",
      "details": "13.08.2025 (Bekanntmachungsdatum)\n\nSachsen-Anhalt Amtsgericht Stendal HRB 2430\nRegisterbekanntmachung nach dem Umwandlungsgesetz 13.08.2025 (Eintragungsdatum)\n\nMedia Burgenlandkreis GmbH\nGesellschaft mit beschränkter Haftung\nSalzwedel\n\nNicht eingetragen:\nDen Gläubigern der an der Verschmelzung beteiligten Rechtsträger ist, wenn sie binnen sechs Monaten nach dem Tag, an dem die Eintragung der Verschmelzung nach § 19 Abs. 3 UmwG als bekanntgemacht gilt, ihren Anspruch nach Grund und Höhe schriftlich anmelden, Sicherheit zu leisten, soweit sie nicht Befriedigung verlangen können. Dieses Recht steht ihnen jedoch nur zu, wenn sie glaubhaft machen, dass durch die Verschmelzung die Erfüllung ihrer Forderung gefährdet wird."
    },
    {
      "date": "2025-08-13",
      "id": "120824",
      "original_text": "Registerbekanntmachung nach dem Umwandlungsgesetz\nSachsen-Anhalt Amtsgericht Stendal HRB 33022\nNews Desk Halle-Saalekreis GmbH – Halle (Saale)",
      "type": "Registerbekanntmachung nach dem Umwandlungsgesetz",
      "state": "Sachsen-Anhalt",
      "amtsgericht": "Amtsgericht Stendal",
      "registernummer": "HRB 33022",
      "registerart": "HRB",
      "company_name": "News Desk Halle-Saalekreis GmbH",
      "company_seat": "Halle (Saale)",
      "details": "13.08.2025 (Bekanntmachungsdatum)\n\nSachsen-Anhalt Amtsgericht Stendal HRB 33022\nRegisterbekanntmachung nach dem Umwandlungsgesetz 13.08.2025 (Eintragungsdatum)\n\nNews Desk Halle-Saalekreis GmbH\nGesellschaft mit beschränkter Haftung\nHalle (Saale)\n\nNicht eingetragen:\nDen Gläubigern der an der Verschmelzung beteiligten Rechtsträger ist, wenn sie binnen sechs Monaten nach dem Tag, an dem die Eintragung der Verschmelzung nach § 19 Abs. 3 UmwG als bekanntgemacht gilt, ihren Anspruch nach Grund und Höhe schriftlich anmelden, Sicherheit zu leisten, soweit sie nicht Befriedigung verlangen können. Dieses Recht steht ihnen jedoch nur zu, wenn sie glaubhaft machen, dass durch die Verschmelzung die Erfüllung ihrer Forderung gefährdet wird."
    },
    {
      "date": "2025-08-13",
      "id": "120825",
      "original_text": "Registerbekanntmachung nach dem Umwandlungsgesetz\nBaden-Württemberg Amtsgericht Mannheim HRA 712747\nILOS Projects GmbH & Co. KG – Karlsruhe",
      "type": "Registerbekanntmachung nach dem Umwandlungsgesetz",
      "state": "Baden-Württemberg",
      "amtsgericht": "Amtsgericht Mannheim",
      "registernummer": "HRA 712747",
      "registerart": "HRA",
      "company_name": "ILOS Projects GmbH & Co. KG",
      "company_seat": "Karlsruhe",
      "details": "13.08.2025 (Bekanntmachungsdatum)\n\nBaden-Württemberg Amtsgericht Mannheim HRA 712747\nRegisterbekanntmachung nach dem Umwandlungsgesetz 13.08.2025 (Eintragungsdatum)\n\nILOS Projects GmbH & Co. KG\nKommanditgesellschaft\nKarlsruhe\n\nDen Gläubigern des an dem Formwechsel beteiligten Rechtsträgers ist, wenn sie binnen sechs Monaten nach dem Tag, an dem die Eintragung des Formwechsels in das Register des Sitzes desjenigen Rechtsträgers, dessen Gläubiger sie sind, nach § 19 Abs. 3 UmwG als bekanntgemacht gilt, ihren Anspruch nach Grund und Höhe schriftlich anmelden, Sicherheit zu leisten, soweit sie nicht Befriedigung verlangen können. Dieses Recht steht den Gläubigern jedoch nur zu, wenn sie glaubhaft machen, dass durch den Formwechsel die Erfüllung ihrer Forderung gefährdet wird."
    },
    {
      "date": "2025-08-13",
      "id": "120826",
      "original_text": "Registerbekanntmachung nach dem Umwandlungsgesetz\nBaden-Württemberg Amtsgericht Freiburg HRB 733738\nMeike Elektrotechnik GmbH – Denzlingen",
      "type": "Registerbekanntmachung nach dem Umwandlungsgesetz",
      "state": "Baden-Württemberg",
      "amtsgericht": "Amtsgericht Freiburg",
      "registernummer": "HRB 733738",
      "registerart": "HRB",
      "company_name": "Meike Elektrotechnik GmbH",
      "company_seat": "Denzlingen",
      "details": "13.08.2025 (Bekanntmachungsdatum)\n\nBaden-Württemberg Amtsgericht Freiburg HRB 733738\nRegisterbekanntmachung nach dem Umwandlungsgesetz 13.08.2025 (Eintragungsdatum)\n\nMeike Elektrotechnik GmbH\nGesellschaft mit beschränkter Haftung\nDenzlingen\n\nAls nicht eingetragen wird bekanntgemacht:\nDen Gläubigern des an dem Formwechsel beteiligten Rechtsträgers ist, wenn sie binnen sechs Monaten nach dem Tag, an dem die Eintragung des Formwechsels in das Register des Sitzes desjenigen Rechtsträgers, dessen Gläubiger sie sind, nach § 19 Abs. 3 UmwG als bekanntgemacht gilt, ihren Anspruch nach Grund und Höhe schriftlich anmelden, Sicherheit zu leisten, soweit sie nicht Befriedigung verlangen können. Dieses Recht steht den Gläubigern jedoch nur zu, wenn sie glaubhaft machen, dass durch den Formwechsel die Erfüllung ihrer Forderung gefährdet wird."
    },
    {
      "date": "2025-08-13",
      "id": "120827",
      "original_text": "Registerbekanntmachung nach dem Umwandlungsgesetz\nBaden-Württemberg Amtsgericht Mannheim HRB 735826\nILOS Projects GmbH – Karlsruhe",
      "type": "Registerbekanntmachung nach dem Umwandlungsgesetz",
      "state": "Baden-Württemberg",
      "amtsgericht": "Amtsgericht Mannheim",
      "registernummer": "HRB 735826",
      "registerart": "HRB",
      "company_name": "ILOS Projects GmbH",
      "company_seat": "Karlsruhe",
      "details": "13.08.2025 (Bekanntmachungsdatum)\n\nBaden-Württemberg Amtsgericht Mannheim HRB 735826\nRegisterbekanntmachung nach dem Umwandlungsgesetz 13.08.2025 (Eintragungsdatum)\n\nILOS Projects GmbH\nGesellschaft mit beschränkter Haftung\nKarlsruhe\n\nDen Gläubigern des an dem Formwechsel beteiligten Rechtsträgers ist, wenn sie binnen sechs Monaten nach dem Tag, an dem die Eintragung des Formwechsels in das Register des Sitzes desjenigen Rechtsträgers, dessen Gläubiger sie sind, nach § 19 Abs. 3 UmwG als bekanntgemacht gilt, ihren Anspruch nach Grund und Höhe schriftlich anmelden, Sicherheit zu leisten, soweit sie nicht Befriedigung verlangen können. Dieses Recht steht den Gläubigern jedoch nur zu, wenn sie glaubhaft machen, dass durch den Formwechsel die Erfüllung ihrer Forderung gefährdet wird."
    },
    {
      "date": "2025-08-13",
      "id": "120828",
      "original_text": "Registerbekanntmachung nach dem Umwandlungsgesetz\nBaden-Württemberg Amtsgericht Freiburg HRA 702910\nMeike Elektrotechnik OHG – Denzlingen",
      "type": "Registerbekanntmachung nach dem Umwandlungsgesetz",
      "state": "Baden-Württemberg",
      "amtsgericht": "Amtsgericht Freiburg",
      "registernummer": "HRA 702910",
      "registerart": "HRA",
      "company_name": "Meike Elektrotechnik OHG",
      "company_seat": "Denzlingen",
      "details": "13.08.2025 (Bekanntmachungsdatum)\n\nBaden-Württemberg Amtsgericht Freiburg HRA 702910\nRegisterbekanntmachung nach dem Umwandlungsgesetz 13.08.2025 (Eintragungsdatum)\n\nMeike Elektrotechnik OHG\nOffene Handelsgesellschaft\nDenzlingen\n\nAls nicht eingetragen wird bekanntgemacht:\nDen Gläubigern des an dem Formwechsel beteiligten Rechtsträgers ist, wenn sie binnen sechs Monaten nach dem Tag, an dem die Eintragung des Formwechsels in das Register des Sitzes desjenigen Rechtsträgers, dessen Gläubiger sie sind, nach § 19 Abs. 3 UmwG als bekanntgemacht gilt, ihren Anspruch nach Grund und Höhe schriftlich anmelden, Sicherheit zu leisten, soweit sie nicht Befriedigung verlangen können. Dieses Recht steht den Gläubigern jedoch nur zu, wenn sie glaubhaft machen, dass durch den Formwechsel die Erfüllung ihrer Forderung gefährdet wird."
    },
    {
      "date": "2025-08-13",
      "id": "120829",
      "original_text": "Einreichung neuer Dokumente\nBerlin Amtsgericht Berlin (Charlottenburg) HRB 194708\nMetis Systems Aktiengesellschaft – Berlin",
      "type": "Einreichung neuer Dokumente",
      "state": "Berlin",
      "amtsgericht": "Amtsgericht Berlin (Charlottenburg)",
      "registernummer": "HRB 194708",
      "registerart": "HRB",
      "company_name": "Metis Systems Aktiengesellschaft",
      "company_seat": "Berlin",
      "details": "13.08.2025 (Bekanntmachungsdatum)\n\nBerlin Amtsgericht Berlin (Charlottenburg) HRB 194708\nEinreichung neuer Dokumente\n\nMetis Systems Aktiengesellschaft\nAktiengesellschaft\nBerlin\n\nAls nicht eingetragen wird veröffentlicht: Es wurde eine neue Liste der Aufsichtsratsmitglieder eingereicht (§ 106 AktG)."
    },
    {
      "date": "2025-08-13",
      "id": "120830",
      "original_text": "Registerbekanntmachung nach dem Umwandlungsgesetz\nHamburg Amtsgericht Hamburg HRB 194052\nConcerts Koinzidenz GmbH – Hamburg",
      "type": "Registerbekanntmachung nach dem Umwandlungsgesetz",
      "state": "Hamburg",
      "amtsgericht": "Amtsgericht Hamburg",
      "registernummer": "HRB 194052",
      "registerart": "HRB",
      "company_name": "Concerts Koinzidenz GmbH",
      "company_seat": "Hamburg",
      "details": "13.08.2025 (Bekanntmachungsdatum)\n\nHamburg Amtsgericht Hamburg HRB 194052\nRegisterbekanntmachung nach dem Umwandlungsgesetz 13.08.2025 (Eintragungsdatum)\n\nConcerts Koinzidenz GmbH\nGesellschaft mit beschränkter Haftung\nHamburg\n\nAls nicht eingetragen wird bekannt gemacht:\nDen Gläubigern der an der Ausgliederung beteiligten Gesellschaften ist, wenn sie binnen sechs Monaten nach dem Tag, an dem die Eintragung der Ausgliederung in das Register des Sitzes desjenigen Rechtsträgers, dessen Gläubiger sie sind, nach § 19 Absatz 3 UmwG als bekannt gemacht gilt, ihren Anspruch nach Grund und Höhe schriftlich anmelden, Sicherheit zu leisten, soweit sie nicht Befriedigung verlangen können. Dieses Recht steht den Gläubigern jedoch nur zu, wenn sie glaubhaft machen, dass durch die Ausgliederung die Erfüllung ihrer Forderung gefährdet wird."
    },
    {
      "date": "2025-08-13",
      "id": "120831",
      "original_text": "Registerbekanntmachung nach dem Umwandlungsgesetz\nHamburg Amtsgericht Hamburg HRA 131694\nFestival Koinzidenz e.K. – Hamburg",
      "type": "Registerbekanntmachung nach dem Umwandlungsgesetz",
      "state": "Hamburg",
      "amtsgericht": "Amtsgericht Hamburg",
      "registernummer": "HRA 131694",
      "registerart": "HRA",
      "company_name": "Festival Koinzidenz e.K.",
      "company_seat": "Hamburg",
      "details": "13.08.2025 (Bekanntmachungsdatum)\n\nHamburg Amtsgericht Hamburg HRA 131694\nRegisterbekanntmachung nach dem Umwandlungsgesetz 13.08.2025 (Eintragungsdatum)\n\nFestival Koinzidenz e.K.\nEinzelkaufmann\nHamburg\n\nAls nicht eingetragen wird bekannt gemacht:\nDen Gläubigern der an der Ausgliederung beteiligten Gesellschaften ist, wenn sie binnen sechs Monaten nach dem Tag, an dem die Eintragung der Ausgliederung in das Register des Sitzes desjenigen Rechtsträgers, dessen Gläubiger sie sind, nach § 19 Absatz 3 UmwG als bekannt gemacht gilt, ihren Anspruch nach Grund und Höhe schriftlich anmelden, Sicherheit zu leisten, soweit sie nicht Befriedigung verlangen können. Dieses Recht steht den Gläubigern jedoch nur zu, wenn sie glaubhaft machen, dass durch die Ausgliederung die Erfüllung ihrer Forderung gefährdet wird."
    },
    {
      "date": "2025-08-13",
      "id": "120832",
      "original_text": "Löschungsankündigung\nBaden-Württemberg Amtsgericht Stuttgart HRB 737676\nHikari Consulting UG (haftungsbeschränkt) – Stuttgart",
      "type": "Löschungsankündigung",
      "state": "Baden-Württemberg",
      "amtsgericht": "Amtsgericht Stuttgart",
      "registernummer": "HRB 737676",
      "registerart": "HRB",
      "company_name": "Hikari Consulting UG (haftungsbeschränkt)",
      "company_seat": "Stuttgart",
      "details": "13.08.2025 (Bekanntmachungsdatum)\n\nBaden-Württemberg Amtsgericht Stuttgart HRB 737676\nLöschungsankündigung\n\nHikari Consulting UG (haftungsbeschränkt)\nGesellschaft mit beschränkter Haftung\nStuttgart\n\nAls nicht eingetragen wird bekanntgemacht:\nDas Gericht beabsichtigt, die Eintragung des Geschäftsführers Chi Hieu Phung, geb. 26.10.1991  wegen des Mangels einer wesentlichen Voraussetzung von Amts wegen nach § 395 FamFG als unzulässig zu löschen. Die Frist zur Geltendmachung eines Widerspruchs gegen die beabsichtigte Löschung ist auf einen Monat ab Veröffentlichung bestimmt."
    },
    {
      "date": "2025-08-13",
      "id": "120833",
      "original_text": "Registerbekanntmachung nach dem Umwandlungsgesetz\nBerlin Amtsgericht Berlin (Charlottenburg) HRB 175196\nMellifera Einundzwanzigste Beteiligungsgesellschaft mbH – Berlin",
      "type": "Registerbekanntmachung nach dem Umwandlungsgesetz",
      "state": "Berlin",
      "amtsgericht": "Amtsgericht Berlin (Charlottenburg)",
      "registernummer": "HRB 175196",
      "registerart": "HRB",
      "company_name": "Mellifera Einundzwanzigste Beteiligungsgesellschaft mbH",
      "company_seat": "Berlin",
      "details": "13.08.2025 (Bekanntmachungsdatum)\n\nBerlin Amtsgericht Berlin (Charlottenburg) HRB 175196\nRegisterbekanntmachung nach dem Umwandlungsgesetz 11.08.2025 (Eintragungsdatum)\n\nMellifera Einundzwanzigste Beteiligungsgesellschaft mbH\nGesellschaft mit beschränkter Haftung\nBerlin\n\nZu Eintragungsnummer 10 vom 11.08.2025 wird als nicht eingetragen veröffentlicht:Den Gläubigern der an der Verschmelzung beteiligten Rechtsträger ist, wenn sie binnen sechs Monaten nach dem Tag, an dem die Eintragung der Verschmelzung in das Register des Sitzes desjenigen Rechtsträgers, dessen Gläubiger sie sind, als bekannt gemacht gilt, ihren Anspruch nach Grund und Höhe schriftlich anmelden, Sicherheit zu leisten, soweit sie nicht Befriedigung verlangen können. Dieses Recht steht den Gläubigern jedoch nur zu, wenn sie glaubhaft machen, dass durch die Verschmelzung die Erfüllung ihrer Forderung gefährdet wird. Das Recht, Sicherheitsleistung zu verlangen, steht Gläubigern nicht zu, die im Falle der Insolvenz ein Recht auf vorzugsweise Befriedigung aus einer Deckungsmasse haben, die nach gesetzlicher Vorschrift zu ihrem Schutz errichtet und staatlich überwacht ist."
    },
    {
      "date": "2025-08-13",
      "id": "120834",
      "original_text": "Registerbekanntmachung nach dem Umwandlungsgesetz\nBerlin Amtsgericht Berlin (Charlottenburg) HRB 219488\nMellifera Achtzehnte Beteiligungsgesellschaft mbH – Berlin",
      "type": "Registerbekanntmachung nach dem Umwandlungsgesetz",
      "state": "Berlin",
      "amtsgericht": "Amtsgericht Berlin (Charlottenburg)",
      "registernummer": "HRB 219488",
      "registerart": "HRB",
      "company_name": "Mellifera Achtzehnte Beteiligungsgesellschaft mbH",
      "company_seat": "Berlin",
      "details": "13.08.2025 (Bekanntmachungsdatum)\n\nBerlin Amtsgericht Berlin (Charlottenburg) HRB 219488\nRegisterbekanntmachung nach dem Umwandlungsgesetz 11.08.2025 (Eintragungsdatum)\n\nMellifera Achtzehnte Beteiligungsgesellschaft mbH\nGesellschaft mit beschränkter Haftung\nBerlin\n\nZu Eintragungsnummer 3 vom 11.08.2025 wird als nicht eingetragen veröffentlicht:Den Gläubigern der an der Verschmelzung beteiligten Rechtsträger ist, wenn sie binnen sechs Monaten nach dem Tag, an dem die Eintragung der Verschmelzung in das Register des Sitzes desjenigen Rechtsträgers, dessen Gläubiger sie sind, als bekannt gemacht gilt, ihren Anspruch nach Grund und Höhe schriftlich anmelden, Sicherheit zu leisten, soweit sie nicht Befriedigung verlangen können. Dieses Recht steht den Gläubigern jedoch nur zu, wenn sie glaubhaft machen, dass durch die Verschmelzung die Erfüllung ihrer Forderung gefährdet wird. Das Recht, Sicherheitsleistung zu verlangen, steht Gläubigern nicht zu, die im Falle der Insolvenz ein Recht auf vorzugsweise Befriedigung aus einer Deckungsmasse haben, die nach gesetzlicher Vorschrift zu ihrem Schutz errichtet und staatlich überwacht ist."
    },
    {
      "date": "2025-08-13",
      "id": "120835",
      "original_text": "Registerbekanntmachung nach dem Umwandlungsgesetz\nBaden-Württemberg Amtsgericht Freiburg HRB 705572\nGST GmbH German Services & Trade – Villingen-Schwenningen",
      "type": "Registerbekanntmachung nach dem Umwandlungsgesetz",
      "state": "Baden-Württemberg",
      "amtsgericht": "Amtsgericht Freiburg",
      "registernummer": "HRB 705572",
      "registerart": "HRB",
      "company_name": "GST GmbH German Services & Trade",
      "company_seat": "Villingen-Schwenningen",
      "details": "13.08.2025 (Bekanntmachungsdatum)\n\nBaden-Württemberg Amtsgericht Freiburg HRB 705572\nRegisterbekanntmachung nach dem Umwandlungsgesetz 13.08.2025 (Eintragungsdatum)\n\nGST GmbH German Services & Trade\nGesellschaft mit beschränkter Haftung\nVillingen-Schwenningen\n\nDen Gläubigern der an der Verschmelzung beteiligten Rechtsträger ist, wenn sie binnen sechs Monaten nach dem Tag, an dem die Eintragung der Verschmelzung in das Register des Sitzes desjenigen Rechtsträgers, dessen Gläubiger sie sind, nach § 19 Abs. 3 UmwG als bekanntgemacht gilt, ihren Anspruch nach Grund und Höhe schriftlich anmelden, Sicherheit zu leisten, soweit sie nicht Befriedigung verlangen können. Dieses Recht steht den Gläubigern jedoch nur zu, wenn sie glaubhaft machen, dass durch die Verschmelzung die Erfüllung ihrer Forderung gefährdet wird."
    },
    {
      "date": "2025-08-13",
      "id": "120836",
      "original_text": "Registerbekanntmachung nach dem Umwandlungsgesetz\nBaden-Württemberg Amtsgericht Freiburg HRA 709222\nPeter Fischer German Services & Trade e.K. – Villingen-Schwenningen",
      "type": "Registerbekanntmachung nach dem Umwandlungsgesetz",
      "state": "Baden-Württemberg",
      "amtsgericht": "Amtsgericht Freiburg",
      "registernummer": "HRA 709222",
      "registerart": "HRA",
      "company_name": "Peter Fischer German Services & Trade e.K.",
      "company_seat": "Villingen-Schwenningen",
      "details": "13.08.2025 (Bekanntmachungsdatum)\n\nBaden-Württemberg Amtsgericht Freiburg HRA 709222\nRegisterbekanntmachung nach dem Umwandlungsgesetz 13.08.2025 (Eintragungsdatum)\n\nPeter Fischer German Services & Trade e.K.\nEinzelkaufmann / Einzelkauffrau\nVillingen-Schwenningen\n\nDen Gläubigern der an der Verschmelzung beteiligten Rechtsträger ist, wenn sie binnen sechs Monaten nach dem Tag, an dem die Eintragung der Verschmelzung in das Register des Sitzes desjenigen Rechtsträgers, dessen Gläubiger sie sind, nach § 19 Abs. 3 UmwG als bekanntgemacht gilt, ihren Anspruch nach Grund und Höhe schriftlich anmelden, Sicherheit zu leisten, soweit sie nicht Befriedigung verlangen können. Dieses Recht steht den Gläubigern jedoch nur zu, wenn sie glaubhaft machen, dass durch die Verschmelzung die Erfüllung ihrer Forderung gefährdet wird."
    },
    {
      "date": "2025-08-13",
      "id": "120837",
      "original_text": "Registerbekanntmachung nach dem Umwandlungsgesetz\nBaden-Württemberg Amtsgericht Stuttgart HRB 761435\nYves Rocher Retail GmbH – Stuttgart",
      "type": "Registerbekanntmachung nach dem Umwandlungsgesetz",
      "state": "Baden-Württemberg",
      "amtsgericht": "Amtsgericht Stuttgart",
      "registernummer": "HRB 761435",
      "registerart": "HRB",
      "company_name": "Yves Rocher Retail GmbH",
      "company_seat": "Stuttgart",
      "details": "13.08.2025 (Bekanntmachungsdatum)\n\nBaden-Württemberg Amtsgericht Stuttgart HRB 761435\nRegisterbekanntmachung nach dem Umwandlungsgesetz 13.08.2025 (Eintragungsdatum)\n\nYves Rocher Retail GmbH\nGesellschaft mit beschränkter Haftung\nStuttgart\n\nAls nicht eingetragen wird bekanntgemacht:\nDen Gläubigern der an der Verschmelzung beteiligten Rechtsträger ist, wenn sie binnen sechs Monaten nach dem Tag, an dem die Eintragung der Verschmelzung in das Register des Sitzes desjenigen Rechtsträgers, dessen Gläubiger sie sind, nach § 19 Abs. 3 UmwG als bekanntgemacht gilt, ihren Anspruch nach Grund und Höhe schriftlich anmelden, Sicherheit zu leisten, soweit sie nicht Befriedigung verlangen können. Dieses Recht steht den Gläubigern jedoch nur zu, wenn sie glaubhaft machen, dass durch die Verschmelzung die Erfüllung ihrer Forderung gefährdet wird."
    },
    {
      "date": "2025-08-13",
      "id": "120838",
      "original_text": "Registerbekanntmachung nach dem Umwandlungsgesetz\nBrandenburg Amtsgericht Frankfurt/Oder VR 568\nKinder der Natur e. V. – Frankfurt (Oder)",
      "type": "Registerbekanntmachung nach dem Umwandlungsgesetz",
      "state": "Brandenburg",
      "amtsgericht": "Amtsgericht Frankfurt/Oder",
      "registernummer": "VR 568",
      "registerart": "VR",
      "company_name": "Kinder der Natur e. V.",
      "company_seat": "Frankfurt (Oder)",
      "details": "13.08.2025 (Bekanntmachungsdatum)\n\nBrandenburg Amtsgericht Frankfurt/Oder VR 568\nRegisterbekanntmachung nach dem Umwandlungsgesetz 07.08.2025 (Eintragungsdatum)\n\nKinder der Natur e. V.\neingetragener Verein\nFrankfurt (Oder)\n\nZu Eintragungsnummer 4 vom 07.08.2025 wird als nicht eingetragen veröffentlicht:\nDen Gläubigern der an der Umwandlung beteiligten Rechtsträger ist, wenn sie binnen sechs Monaten nach dem Tag, an dem die Eintragung der Umwandlung in das Register des Sitzes desjenigen Rechtsträgers, dessen Gläubiger sie sind, als bekannt gemacht gilt, ihren Anspruch nach Grund und Höhe schriftlich anmelden, Sicherheit zu leisten, soweit sie nicht Befriedigung verlangen können. Dieses Recht steht den Gläubigern jedoch nur zu, wenn sie glaubhaft machen, dass durch die Umwandlung die Erfüllung ihrer Forderung gefährdet wird."
    },
    {
      "date": "2025-08-13",
      "id": "120839",
      "original_text": "Registerbekanntmachung nach dem Umwandlungsgesetz\nSchleswig-Holstein Amtsgericht Kiel HRB 4055 NO\nWOTO Modernes Einrichten Tischlerei GmbH – Norderstedt",
      "type": "Registerbekanntmachung nach dem Umwandlungsgesetz",
      "state": "Schleswig-Holstein",
      "amtsgericht": "Amtsgericht Kiel",
      "registernummer": "HRB 4055 NO",
      "registerart": "HRB",
      "company_name": "WOTO Modernes Einrichten Tischlerei GmbH",
      "company_seat": "Norderstedt",
      "details": "13.08.2025 (Bekanntmachungsdatum)\n\nSchleswig-Holstein Amtsgericht Kiel HRB 4055 NO\nRegisterbekanntmachung nach dem Umwandlungsgesetz 12.08.2025 (Eintragungsdatum)\n\nWOTO Modernes Einrichten Tischlerei GmbH\nGesellschaft mit beschränkter Haftung\nNorderstedt\n\nZu Eintragungsnummer 3 vom 12.08.2025 wird als nicht eingetragen veröffentlicht: Den Gläubigern der an der Verschmelzung beteiligten Rechtsträger ist, wenn sie binnen sechs Monaten nach dem Tag, an dem die Eintragung der Verschmelzung in das Register des Sitzes desjenigen Rechtsträgers, dessen Gläubiger sie sind, nach § 19 Abs. 3 UmwG bekannt gemacht worden ist, ihren Anspruch nach Grund und Höhe schriftlich anmelden, Sicherheit zu leisten, soweit sie nicht Befriedigung verlangen können. Dieses Recht steht den Gläubigern jedoch nur zu, wenn sie glaubhaft machen, dass durch die Verschmelzung die Erfüllung ihrer Forderung gefährdet wird."
    },
    {
      "date": "2025-08-13",
      "id": "120840",
      "original_text": "Registerbekanntmachung nach dem Umwandlungsgesetz\nBerlin Amtsgericht Berlin (Charlottenburg) HRB 128010\nHIHC Horvat Real Estate GmbH – Berlin",
      "type": "Registerbekanntmachung nach dem Umwandlungsgesetz",
      "state": "Berlin",
      "amtsgericht": "Amtsgericht Berlin (Charlottenburg)",
      "registernummer": "HRB 128010",
      "registerart": "HRB",
      "company_name": "HIHC Horvat Real Estate GmbH",
      "company_seat": "Berlin",
      "details": "13.08.2025 (Bekanntmachungsdatum)\n\nBerlin Amtsgericht Berlin (Charlottenburg) HRB 128010\nRegisterbekanntmachung nach dem Umwandlungsgesetz 11.08.2025 (Eintragungsdatum)\n\nHIHC Horvat Real Estate GmbH\nGesellschaft mit beschränkter Haftung\nBerlin\n\nZu Eintragungsnummer 6 vom 11.08.2025 wird als nicht eingetragen veröffentlicht: Den Gläubigern der an der Verschmelzung beteiligten Rechtsträger ist, wenn sie binnen sechs Monaten nach dem Tag, an dem die Eintragung der Verschmelzung in das Register des Sitzes desjenigen Rechtsträgers, dessen Gläubiger sie sind, als bekannt gemacht gilt, ihren Anspruch nach Grund und Höhe schriftlich anmelden, Sicherheit zu leisten, soweit sie nicht Befriedigung verlangen können. Dieses Recht steht den Gläubigern jedoch nur zu, wenn sie glaubhaft machen, dass durch die Verschmelzung die Erfüllung ihrer Forderung gefährdet wird. Das Recht, Sicherheitsleistung zu verlangen, steht Gläubigern nicht zu, die im Falle der Insolvenz ein Recht auf vorzugsweise Befriedigung aus einer Deckungsmasse haben, die nach gesetzlicher Vorschrift zu ihrem Schutz errichtet und staatlich überwacht ist."
    },
    {
      "date": "2025-08-13",
      "id": "120841",
      "original_text": "Registerbekanntmachung nach dem Umwandlungsgesetz\nBerlin Amtsgericht Berlin (Charlottenburg) HRB 145657\nHORVAT INTERNET SOLUTIONS UG (haftungsbeschränkt) – Berlin",
      "type": "Registerbekanntmachung nach dem Umwandlungsgesetz",
      "state": "Berlin",
      "amtsgericht": "Amtsgericht Berlin (Charlottenburg)",
      "registernummer": "HRB 145657",
      "registerart": "HRB",
      "company_name": "HORVAT INTERNET SOLUTIONS UG (haftungsbeschränkt)",
      "company_seat": "Berlin",
      "details": "13.08.2025 (Bekanntmachungsdatum)\n\nBerlin Amtsgericht Berlin (Charlottenburg) HRB 145657\nRegisterbekanntmachung nach dem Umwandlungsgesetz 11.08.2025 (Eintragungsdatum)\n\nHORVAT INTERNET SOLUTIONS UG (haftungsbeschränkt)\nGesellschaft mit beschränkter Haftung\nBerlin\n\nZu Eintragungsnummer 4 vom 11.08.2025 wird als nicht eingetragen veröffentlicht: Den Gläubigern der an der Verschmelzung beteiligten Rechtsträger ist, wenn sie binnen sechs Monaten nach dem Tag, an dem die Eintragung der Verschmelzung in das Register des Sitzes desjenigen Rechtsträgers, dessen Gläubiger sie sind, als bekannt gemacht gilt, ihren Anspruch nach Grund und Höhe schriftlich anmelden, Sicherheit zu leisten, soweit sie nicht Befriedigung verlangen können. Dieses Recht steht den Gläubigern jedoch nur zu, wenn sie glaubhaft machen, dass durch die Verschmelzung die Erfüllung ihrer Forderung gefährdet wird. Das Recht, Sicherheitsleistung zu verlangen, steht Gläubigern nicht zu, die im Falle der Insolvenz ein Recht auf vorzugsweise Befriedigung aus einer Deckungsmasse haben, die nach gesetzlicher Vorschrift zu ihrem Schutz errichtet und staatlich überwacht ist."
    },
    {
      "date": "2025-08-13",
      "id": "120842",
      "original_text": "Registerbekanntmachung nach dem Umwandlungsgesetz\nMecklenburg-Vorpommern Amtsgericht Stralsund HRB 22716\nHTM Mecklenburg GmbH – Zinnowitz",
      "type": "Registerbekanntmachung nach dem Umwandlungsgesetz",
      "state": "Mecklenburg-Vorpommern",
      "amtsgericht": "Amtsgericht Stralsund",
      "registernummer": "HRB 22716",
      "registerart": "HRB",
      "company_name": "HTM Mecklenburg GmbH",
      "company_seat": "Zinnowitz",
      "details": "13.08.2025 (Bekanntmachungsdatum)\n\nMecklenburg-Vorpommern Amtsgericht Stralsund HRB 22716\nRegisterbekanntmachung nach dem Umwandlungsgesetz 13.08.2025 (Eintragungsdatum)\n\nHTM Mecklenburg GmbH\nGesellschaft mit beschränkter Haftung\nZinnowitz\n\nAls nicht eingetragen wird veröffentlicht: Den Gläubigern der an der Verschmelzung beteiligten Rechtsträger ist, wenn sie binnen sechs Monaten nach dem Tag, an dem die Eintragung der Verschmelzung in das Register des Sitzes desjenigen Rechtsträgers, dessen Gläubiger sie sind, nach § 19 Abs. 3 UmwG als bekannt gemacht gilt,\nihren Anspruch nach Grund und Höhe in Textform anmelden, Sicherheit zu leisten, soweit sie nicht Befriedigung verlangen können. Dieses Recht steht den Gläubigern jedoch nur zu, wenn sie glaubhaft machen, dass durch die Verschmelzung die Erfüllung der Forderung gefährdet wird."
    },
    {
      "date": "2025-08-13",
      "id": "120843",
      "original_text": "Registerbekanntmachung nach dem Umwandlungsgesetz\nHamburg Amtsgericht Hamburg HRB 127041\nDatrics GmbH – Hamburg",
      "type": "Registerbekanntmachung nach dem Umwandlungsgesetz",
      "state": "Hamburg",
      "amtsgericht": "Amtsgericht Hamburg",
      "registernummer": "HRB 127041",
      "registerart": "HRB",
      "company_name": "Datrics GmbH",
      "company_seat": "Hamburg",
      "details": "13.08.2025 (Bekanntmachungsdatum)\n\nHamburg Amtsgericht Hamburg HRB 127041\nRegisterbekanntmachung nach dem Umwandlungsgesetz 13.08.2025 (Eintragungsdatum)\n\nDatrics GmbH\nGesellschaft mit beschränkter Haftung\nHamburg\n\nAls nicht eingetragen wird bekannt gemacht:\nDen Gläubigern der an der Verschmelzung beteiligten Gesellschaften ist, wenn sie binnen sechs Monaten nach dem Tag, an dem die Eintragung der Verschmelzung in das Register des Sitzes desjenigen Rechtsträgers, dessen Gläubiger sie sind, nach § 19 Absatz 3 UmwG als bekannt gemacht gilt, ihren Anspruch nach Grund und Höhe schriftlich anmelden, Sicherheit zu leisten, soweit sie nicht Befriedigung verlangen können. Dieses Recht steht den Gläubigern jedoch nur zu, wenn sie glaubhaft machen, dass durch die Verschmelzung die Erfüllung ihrer Forderung gefährdet wird."
    },
    {
      "date": "2025-08-13",
      "id": "120844",
      "original_text": "Registerbekanntmachung nach dem Umwandlungsgesetz\nHamburg Amtsgericht Hamburg HRB 194055\nDatrics Hamburg GmbH – Hamburg",
      "type": "Registerbekanntmachung nach dem Umwandlungsgesetz",
      "state": "Hamburg",
      "amtsgericht": "Amtsgericht Hamburg",
      "registernummer": "HRB 194055",
      "registerart": "HRB",
      "company_name": "Datrics Hamburg GmbH",
      "company_seat": "Hamburg",
      "details": "13.08.2025 (Bekanntmachungsdatum)\n\nHamburg Amtsgericht Hamburg HRB 194055\nRegisterbekanntmachung nach dem Umwandlungsgesetz 13.08.2025 (Eintragungsdatum)\n\nDatrics Hamburg GmbH\nGesellschaft mit beschränkter Haftung\nHamburg\n\nAls nicht eingetragen wird bekannt gemacht:\nDen Gläubigern der an der Verschmelzung beteiligten Gesellschaften ist, wenn sie binnen sechs Monaten nach dem Tag, an dem die Eintragung der Verschmelzung in das Register des Sitzes derjenigen Rechtsträger deren Gläubiger sie sind, nach § 19 Absatz 3 UmwG als bekannt gemacht gilt, ihren Anspruch nach Grund und Höhe schriftlich anmelden, Sicherheit zu leisten, soweit sie nicht Befriedigung verlangen können. Dieses Recht steht den Gläubigern jedoch nur zu, wenn sie glaubhaft machen, dass durch die Verschmelzung die Erfüllung ihrer Forderung gefährdet wird."
    },
    {
      "date": "2025-08-13",
      "id": "120845",
      "original_text": "Registerbekanntmachung nach dem Umwandlungsgesetz\nBaden-Württemberg Amtsgericht Stuttgart HRB 102901\nGARTENFRISCH Jung GmbH – Jagsthausen",
      "type": "Registerbekanntmachung nach dem Umwandlungsgesetz",
      "state": "Baden-Württemberg",
      "amtsgericht": "Amtsgericht Stuttgart",
      "registernummer": "HRB 102901",
      "registerart": "HRB",
      "company_name": "GARTENFRISCH Jung GmbH",
      "company_seat": "Jagsthausen",
      "details": "13.08.2025 (Bekanntmachungsdatum)\n\nBaden-Württemberg Amtsgericht Stuttgart HRB 102901\nRegisterbekanntmachung nach dem Umwandlungsgesetz 13.08.2025 (Eintragungsdatum)\n\nGARTENFRISCH Jung GmbH\nGesellschaft mit beschränkter Haftung\nJagsthausen\n\nAls nicht eingetragen wird bekanntgemacht:\nDen Gläubigern der an der Verschmelzung beteiligten Rechtsträger ist, wenn sie binnen sechs Monaten nach dem Tag, an dem die Eintragung der Verschmelzung in das Register des Sitzes desjenigen Rechtsträgers, dessen Gläubiger sie sind, nach § 19 Abs. 3 UmwG als bekanntgemacht gilt, ihren Anspruch nach Grund und Höhe schriftlich anmelden, Sicherheit zu leisten, soweit sie nicht Befriedigung verlangen können. Dieses Recht steht den Gläubigern jedoch nur zu, wenn sie glaubhaft machen, dass durch die Verschmelzung die Erfüllung ihrer Forderung gefährdet wird."
    },
    {
      "date": "2025-08-13",
      "id": "120846",
      "original_text": "Registerbekanntmachung nach dem Umwandlungsgesetz\nBaden-Württemberg Amtsgericht Freiburg HRB 733565\nMETALL BAUR GmbH – Radolfzell am Bodensee",
      "type": "Registerbekanntmachung nach dem Umwandlungsgesetz",
      "state": "Baden-Württemberg",
      "amtsgericht": "Amtsgericht Freiburg",
      "registernummer": "HRB 733565",
      "registerart": "HRB",
      "company_name": "METALL BAUR GmbH",
      "company_seat": "Radolfzell am Bodensee",
      "details": "13.08.2025 (Bekanntmachungsdatum)\n\nBaden-Württemberg Amtsgericht Freiburg HRB 733565\nRegisterbekanntmachung nach dem Umwandlungsgesetz 13.08.2025 (Eintragungsdatum)\n\nMETALL BAUR GmbH\nGesellschaft mit beschränkter Haftung\nRadolfzell am Bodensee\n\nAls nicht eingetragen wird bekanntgemacht:\nDen Gläubigern der an der Ausgliederung beteiligten Rechtsträger ist, wenn sie binnen sechs Monaten nach dem Tag, an dem die Eintragung der Ausgliederung in das Register des Sitzes desjenigen Rechtsträgers, dessen Gläubiger sie sind, nach § 19 Abs. 3 UmwG als bekanntgemacht gilt, ihren Anspruch nach Grund und Höhe schriftlich anmelden, Sicherheit zu leisten, soweit sie nicht Befriedigung verlangen können. Dieses Recht steht den Gläubigern jedoch nur zu, wenn sie glaubhaft machen, dass durch die Ausgliederung die Erfüllung ihrer Forderung gefährdet wird."
    },
    {
      "date": "2025-08-13",
      "id": "120847",
      "original_text": "Registerbekanntmachung nach dem Umwandlungsgesetz\nBrandenburg Amtsgericht Potsdam HRB 19867\nEMCS Energie-Management Contracting & Service GmbH – Potsdam",
      "type": "Registerbekanntmachung nach dem Umwandlungsgesetz",
      "state": "Brandenburg",
      "amtsgericht": "Amtsgericht Potsdam",
      "registernummer": "HRB 19867",
      "registerart": "HRB",
      "company_name": "EMCS Energie-Management Contracting & Service GmbH",
      "company_seat": "Potsdam",
      "details": "13.08.2025 (Bekanntmachungsdatum)\n\nBrandenburg Amtsgericht Potsdam HRB 19867\nRegisterbekanntmachung nach dem Umwandlungsgesetz 08.08.2025 (Eintragungsdatum)\n\nEMCS Energie-Management Contracting & Service GmbH\nGesellschaft mit beschränkter Haftung\nPotsdam\n\nZu Eintragungsnummer 3 vom 08.08.2025 wird als nicht eingetragen veröffentlicht:\nDen Gläubigern der an der Verschmelzung beteiligten Rechtsträger ist, wenn sie binnen sechs Monaten nach dem Tag, an dem die Eintragung der Verschmelzung in das Register des Sitzes desjenigen Rechtsträgers, dessen Gläubiger sie sind, als bekannt gemacht gilt, ihren Anspruch nach Grund und Höhe schriftlich anmelden, Sicherheit zu leisten, soweit sie nicht Befriedigung verlangen können. Dieses Recht steht den Gläubigern jedoch nur zu, wenn sie glaubhaft machen, dass durch die Verschmelzung die Erfüllung ihrer Forderung gefährdet wird"
    },
    {
      "date": "2025-08-13",
      "id": "120848",
      "original_text": "Registerbekanntmachung nach dem Umwandlungsgesetz\nBaden-Württemberg Amtsgericht Stuttgart HRB 102901\nGARTENFRISCH Jung GmbH – Jagsthausen",
      "type": "Registerbekanntmachung nach dem Umwandlungsgesetz",
      "state": "Baden-Württemberg",
      "amtsgericht": "Amtsgericht Stuttgart",
      "registernummer": "HRB 102901",
      "registerart": "HRB",
      "company_name": "GARTENFRISCH Jung GmbH",
      "company_seat": "Jagsthausen",
      "details": "13.08.2025 (Bekanntmachungsdatum)\n\nBaden-Württemberg Amtsgericht Stuttgart HRB 102901\nRegisterbekanntmachung nach dem Umwandlungsgesetz 13.08.2025 (Eintragungsdatum)\n\nGARTENFRISCH Jung GmbH\nGesellschaft mit beschränkter Haftung\nJagsthausen\n\nAls nicht eingetragen wird bekanntgemacht:\nDen Gläubigern der an der Verschmelzung beteiligten Rechtsträger ist, wenn sie binnen sechs Monaten nach dem Tag, an dem die Eintragung der Verschmelzung in das Register des Sitzes desjenigen Rechtsträgers, dessen Gläubiger sie sind, nach § 19 Abs. 3 UmwG als bekanntgemacht gilt, ihren Anspruch nach Grund und Höhe schriftlich anmelden, Sicherheit zu leisten, soweit sie nicht Befriedigung verlangen können. Dieses Recht steht den Gläubigern jedoch nur zu, wenn sie glaubhaft machen, dass durch die Verschmelzung die Erfüllung ihrer Forderung gefährdet wird."
    },
    {
      "date": "2025-08-13",
      "id": "120849",
      "original_text": "Registerbekanntmachung nach dem Umwandlungsgesetz\nBaden-Württemberg Amtsgericht Freiburg HRA 707604\nMetall Baur e. K. Inhaber Dominik Baur – Radolfzell am Bodensee",
      "type": "Registerbekanntmachung nach dem Umwandlungsgesetz",
      "state": "Baden-Württemberg",
      "amtsgericht": "Amtsgericht Freiburg",
      "registernummer": "HRA 707604",
      "registerart": "HRA",
      "company_name": "Metall Baur e. K. Inhaber Dominik Baur",
      "company_seat": "Radolfzell am Bodensee",
      "details": "13.08.2025 (Bekanntmachungsdatum)\n\nBaden-Württemberg Amtsgericht Freiburg HRA 707604\nRegisterbekanntmachung nach dem Umwandlungsgesetz 13.08.2025 (Eintragungsdatum)\n\nMetall Baur e. K. Inhaber Dominik Baur\nEinzelkaufmann / Einzelkauffrau\nRadolfzell am Bodensee\n\nDen Gläubigern der an der Ausgliederung beteiligten Rechtsträger ist, wenn sie binnen sechs Monaten nach dem Tag, an dem die Eintragung der Ausgliederung in das Register des Sitzes desjenigen Rechtsträgers, dessen Gläubiger sie sind, nach § 19 Abs. 3 UmwG als bekanntgemacht gilt, ihren Anspruch nach Grund und Höhe schriftlich anmelden, Sicherheit zu leisten, soweit sie nicht Befriedigung verlangen können. Dieses Recht steht den Gläubigern jedoch nur zu, wenn sie glaubhaft machen, dass durch die Ausgliederung die Erfüllung ihrer Forderung gefährdet wird."
    },
    {
      "date": "2025-08-13",
      "id": "120850",
      "original_text": "Sonstige Registerbekanntmachung\nBaden-Württemberg Amtsgericht Mannheim GnR 330033\nVolksbank Kurpfalz eG – Heidelberg",
      "type": "Sonstige Registerbekanntmachung",
      "state": "Baden-Württemberg",
      "amtsgericht": "Amtsgericht Mannheim",
      "registernummer": "GnR 330033",
      "registerart": "GnR",
      "company_name": "Volksbank Kurpfalz eG",
      "company_seat": "Heidelberg",
      "details": "13.08.2025 (Bekanntmachungsdatum)\n\nBaden-Württemberg Amtsgericht Mannheim GnR 330033\nSonstige Registerbekanntmachung 13.08.2025 (Eintragungsdatum)\n\nVolksbank Kurpfalz eG\neingetragene Genossenschaft\nHeidelberg\n\nDie Verpflichtung der Genossen, Nachschüsse zur Insolvenzmasse zu leisten, wurde aufgehoben. Den Gläubigern der Genossenschaft ist, wenn sie sich binnen sechs Monaten nach der Bekanntmachung bei der Genossenschaft zu diesem Zweck melden, Sicherheit zu leisten, soweit sie nicht Befriedigung verlangen können."
    },
    {
      "date": "2025-08-13",
      "id": "120851",
      "original_text": "Registerbekanntmachung nach dem Umwandlungsgesetz\nBaden-Württemberg Amtsgericht Mannheim HRB 730079\nDiagcare Germany GmbH – Mannheim",
      "type": "Registerbekanntmachung nach dem Umwandlungsgesetz",
      "state": "Baden-Württemberg",
      "amtsgericht": "Amtsgericht Mannheim",
      "registernummer": "HRB 730079",
      "registerart": "HRB",
      "company_name": "Diagcare Germany GmbH",
      "company_seat": "Mannheim",
      "details": "13.08.2025 (Bekanntmachungsdatum)\n\nBaden-Württemberg Amtsgericht Mannheim HRB 730079\nRegisterbekanntmachung nach dem Umwandlungsgesetz 13.08.2025 (Eintragungsdatum)\n\nDiagcare Germany GmbH\nGesellschaft mit beschränkter Haftung\nMannheim\n\nDen Gläubigern der an der Verschmelzung beteiligten Rechtsträger ist, wenn sie binnen sechs Monaten nach dem Tag, an dem die Eintragung der Verschmelzung in das Register des Sitzes desjenigen Rechtsträgers, dessen Gläubiger sie sind, nach § 19 Abs. 3 UmwG als bekanntgemacht gilt, ihren Anspruch nach Grund und Höhe schriftlich anmelden, Sicherheit zu leisten, soweit sie nicht Befriedigung verlangen können. Dieses Recht steht den Gläubigern jedoch nur zu, wenn sie glaubhaft machen, dass durch die Verschmelzung die Erfüllung ihrer Forderung gefährdet wird."
    },
    {
      "date": "2025-08-13",
      "id": "120852",
      "original_text": "Registerbekanntmachung nach dem Umwandlungsgesetz\nBaden-Württemberg Amtsgericht Mannheim HRB 729531\nDisbro GmbH – Mannheim",
      "type": "Registerbekanntmachung nach dem Umwandlungsgesetz",
      "state": "Baden-Württemberg",
      "amtsgericht": "Amtsgericht Mannheim",
      "registernummer": "HRB 729531",
      "registerart": "HRB",
      "company_name": "Disbro GmbH",
      "company_seat": "Mannheim",
      "details": "13.08.2025 (Bekanntmachungsdatum)\n\nBaden-Württemberg Amtsgericht Mannheim HRB 729531\nRegisterbekanntmachung nach dem Umwandlungsgesetz 13.08.2025 (Eintragungsdatum)\n\nDisbro GmbH\nGesellschaft mit beschränkter Haftung\nMannheim\n\nDen Gläubigern der an der Verschmelzung beteiligten Rechtsträger ist, wenn sie binnen sechs Monaten nach dem Tag, an dem die Eintragung der Verschmelzung in das Register des Sitzes desjenigen Rechtsträgers, dessen Gläubiger sie sind, nach § 19 Abs. 3 UmwG als bekanntgemacht gilt, ihren Anspruch nach Grund und Höhe schriftlich anmelden, Sicherheit zu leisten, soweit sie nicht Befriedigung verlangen können. Dieses Recht steht den Gläubigern jedoch nur zu, wenn sie glaubhaft machen, dass durch die Verschmelzung die Erfüllung ihrer Forderung gefährdet wird."
    },
    {
      "date": "2025-08-13",
      "id": "120853",
      "original_text": "Registerbekanntmachung nach dem Umwandlungsgesetz\nBerlin Amtsgericht Berlin (Charlottenburg) HRB 204652\nJoswig Solutions UG (haftungsbeschränkt) – Berlin",
      "type": "Registerbekanntmachung nach dem Umwandlungsgesetz",
      "state": "Berlin",
      "amtsgericht": "Amtsgericht Berlin (Charlottenburg)",
      "registernummer": "HRB 204652",
      "registerart": "HRB",
      "company_name": "Joswig Solutions UG (haftungsbeschränkt)",
      "company_seat": "Berlin",
      "details": "13.08.2025 (Bekanntmachungsdatum)\n\nBerlin Amtsgericht Berlin (Charlottenburg) HRB 204652\nRegisterbekanntmachung nach dem Umwandlungsgesetz 12.08.2025 (Eintragungsdatum)\n\nJoswig Solutions UG (haftungsbeschränkt)\nGesellschaft mit beschränkter Haftung\nBerlin\n\nZu Eintragungsnummer 2 vom 12.08.2025 wird als nicht eingetragen veröffentlicht: Den Gläubigern der an der Verschmelzung beteiligten Rechtsträger ist, wenn sie binnen sechs Monaten nach dem Tag, an dem die Eintragung der Verschmelzung in das Register des Sitzes desjenigen Rechtsträgers, dessen Gläubiger sie sind, als bekannt gemacht gilt, ihren Anspruch nach Grund und Höhe schriftlich anmelden, Sicherheit zu leisten, soweit sie nicht Befriedigung verlangen können. Dieses Recht steht den Gläubigern jedoch nur zu, wenn sie glaubhaft machen, dass durch die Verschmelzung die Erfüllung ihrer Forderung gefährdet wird. Das Recht, Sicherheitsleistung zu verlangen, steht Gläubigern nicht zu, die im Falle der Insolvenz ein Recht auf vorzugsweise Befriedigung aus einer Deckungsmasse haben, die nach gesetzlicher Vorschrift zu ihrem Schutz errichtet und staatlich überwacht ist."
    },
    {
      "date": "2025-08-13",
      "id": "120854",
      "original_text": "Registerbekanntmachung nach dem Umwandlungsgesetz\nBaden-Württemberg Amtsgericht Freiburg HRB 707688\nKönig IT-Systeme GmbH – Gottmadingen",
      "type": "Registerbekanntmachung nach dem Umwandlungsgesetz",
      "state": "Baden-Württemberg",
      "amtsgericht": "Amtsgericht Freiburg",
      "registernummer": "HRB 707688",
      "registerart": "HRB",
      "company_name": "König IT-Systeme GmbH",
      "company_seat": "Gottmadingen",
      "details": "13.08.2025 (Bekanntmachungsdatum)\n\nBaden-Württemberg Amtsgericht Freiburg HRB 707688\nRegisterbekanntmachung nach dem Umwandlungsgesetz 13.08.2025 (Eintragungsdatum)\n\nKönig IT-Systeme GmbH\nGesellschaft mit beschränkter Haftung\nGottmadingen\n\nAls nicht eingetragen wird bekanntgemacht:\nDen Gläubigern der an der Verschmelzung beteiligten Rechtsträger ist, wenn sie binnen sechs Monaten nach dem Tag, an dem die Eintragung der Verschmelzung in das Register des Sitzes desjenigen Rechtsträgers, dessen Gläubiger sie sind, nach § 19 Abs. 3 UmwG als bekanntgemacht gilt, ihren Anspruch nach Grund und Höhe schriftlich anmelden, Sicherheit zu leisten, soweit sie nicht Befriedigung verlangen können. Dieses Recht steht den Gläubigern jedoch nur zu, wenn sie glaubhaft machen, dass durch die Verschmelzung die Erfüllung ihrer Forderung gefährdet wird."
    },
    {
      "date": "2025-08-13",
      "id": "120855",
      "original_text": "Registerbekanntmachung nach dem Umwandlungsgesetz\nBaden-Württemberg Amtsgericht Freiburg HRB 542009\nKönig Gesellschaft für Image- und Dokumentenverarbeitung mbH – Gottmadingen",
      "type": "Registerbekanntmachung nach dem Umwandlungsgesetz",
      "state": "Baden-Württemberg",
      "amtsgericht": "Amtsgericht Freiburg",
      "registernummer": "HRB 542009",
      "registerart": "HRB",
      "company_name": "König Gesellschaft für Image- und Dokumentenverarbeitung mbH",
      "company_seat": "Gottmadingen",
      "details": "13.08.2025 (Bekanntmachungsdatum)\n\nBaden-Württemberg Amtsgericht Freiburg HRB 542009\nRegisterbekanntmachung nach dem Umwandlungsgesetz 13.08.2025 (Eintragungsdatum)\n\nKönig Gesellschaft für Image- und Dokumentenverarbeitung mbH\nGesellschaft mit beschränkter Haftung\nGottmadingen\n\nAls nicht eingetragen wird bekanntgemacht:\nDen Gläubigern der an der Verschmelzung beteiligten Rechtsträger ist, wenn sie binnen sechs Monaten nach dem Tag, an dem die Eintragung der Verschmelzung in das Register des Sitzes desjenigen Rechtsträgers, dessen Gläubiger sie sind, nach § 19 Abs. 3 UmwG als bekanntgemacht gilt, ihren Anspruch nach Grund und Höhe schriftlich anmelden, Sicherheit zu leisten, soweit sie nicht Befriedigung verlangen können. Dieses Recht steht den Gläubigern jedoch nur zu, wenn sie glaubhaft machen, dass durch die Verschmelzung die Erfüllung ihrer Forderung gefährdet wird."
    },
    {
      "date": "2025-08-13",
      "id": "120856",
      "original_text": "Löschungsankündigung\nBerlin Amtsgericht Berlin (Charlottenburg) HRB 106672\nBitskin Abwicklungsgesellschaft mbH – Berlin",
      "type": "Löschungsankündigung",
      "state": "Berlin",
      "amtsgericht": "Amtsgericht Berlin (Charlottenburg)",
      "registernummer": "HRB 106672",
      "registerart": "HRB",
      "company_name": "Bitskin Abwicklungsgesellschaft mbH",
      "company_seat": "Berlin",
      "details": "13.08.2025 (Bekanntmachungsdatum)\n\nBerlin Amtsgericht Berlin (Charlottenburg) HRB 106672\nLöschungsankündigung\n\nBitskin Abwicklungsgesellschaft mbH\nGesellschaft mit beschränkter Haftung\nBerlin\n\nBei der nachstehenden Gesellschaft wird das Amtslöschungsverfahren gemäß § 394 FamFG eingeleitet. Widerspruchsfrist 6 Wochen"
    },
    {
      "date": "2025-08-13",
      "id": "120857",
      "original_text": "Sonstige Registerbekanntmachung\nBaden-Württemberg Amtsgericht Stuttgart HRB 201616\nVBH Deutschland GmbH – Korntal-Münchingen",
      "type": "Sonstige Registerbekanntmachung",
      "state": "Baden-Württemberg",
      "amtsgericht": "Amtsgericht Stuttgart",
      "registernummer": "HRB 201616",
      "registerart": "HRB",
      "company_name": "VBH Deutschland GmbH",
      "company_seat": "Korntal-Münchingen",
      "details": "13.08.2025 (Bekanntmachungsdatum)\n\nBaden-Württemberg Amtsgericht Stuttgart HRB 201616\nSonstige Registerbekanntmachung 13.08.2025 (Eintragungsdatum)\n\nVBH Deutschland GmbH\nGesellschaft mit beschränkter Haftung\nKorntal-Münchingen\n\nDen Gläubigern der Gesellschaft, deren Forderungen begründet worden sind, bevor die Eintragung der Beendigung des Vertrages in das Handelsregister nach § 10 HGB als bekanntgemacht gilt, ist vom anderen Vertragsteil Sicherheit zu leisten, wenn sie sich binnen sechs Monaten nach der Bekanntmachung zu diesem Zweck bei ihm melden."
    },
    {
      "date": "2025-08-13",
      "id": "120858",
      "original_text": "Registerbekanntmachung nach dem Umwandlungsgesetz\nSachsen Amtsgericht Dresden HRA 12187\nSanitär und Heizung Mike Zeidler e.K. – Dresden",
      "type": "Registerbekanntmachung nach dem Umwandlungsgesetz",
      "state": "Sachsen",
      "amtsgericht": "Amtsgericht Dresden",
      "registernummer": "HRA 12187",
      "registerart": "HRA",
      "company_name": "Sanitär und Heizung Mike Zeidler e.K.",
      "company_seat": "Dresden",
      "details": "13.08.2025 (Bekanntmachungsdatum)\n\nSachsen Amtsgericht Dresden HRA 12187\nRegisterbekanntmachung nach dem Umwandlungsgesetz 13.08.2025 (Eintragungsdatum)\n\nSanitär und Heizung Mike Zeidler e.K.\nEinzelkaufmann / Einzelkauffrau\nDresden\n\nDen Gläubigern der an der Ausgliederung beteiligten Rechtsträger ist, wenn sie binnen sechs Monaten nach dem Tag, an dem die Eintragung der Ausgliederung in das Register des Sitzes desjenigen Rechtsträgers, dessen Gläubiger sie sind, nach § 19 Abs. 3 UmwG als bekannt gemacht gilt, ihren Anspruch nach Grund und Höhe in Textform anmelden, Sicherheit zu leisten, soweit sie nicht Befriedigung verlangen können. Dieses Recht steht den Gläubigern jedoch nur zu, wenn sie glaubhaft machen, dass durch die Ausgliederung die Erfüllung der Forderung gefährdet wird."
    },
    {
      "date": "2025-08-13",
      "id": "120859",
      "original_text": "Registerbekanntmachung nach dem Umwandlungsgesetz\nSachsen Amtsgericht Dresden HRA 12315\nIngo Bochert Eventlogistik Dresden e.K. – Dresden",
      "type": "Registerbekanntmachung nach dem Umwandlungsgesetz",
      "state": "Sachsen",
      "amtsgericht": "Amtsgericht Dresden",
      "registernummer": "HRA 12315",
      "registerart": "HRA",
      "company_name": "Ingo Bochert Eventlogistik Dresden e.K.",
      "company_seat": "Dresden",
      "details": "13.08.2025 (Bekanntmachungsdatum)\n\nSachsen Amtsgericht Dresden HRA 12315\nRegisterbekanntmachung nach dem Umwandlungsgesetz 13.08.2025 (Eintragungsdatum)\n\nIngo Bochert Eventlogistik Dresden e.K.\nEinzelkaufmann / Einzelkauffrau\nDresden\n\nDen Gläubigern der an der Ausgliederung beteiligten Rechtsträger ist, wenn sie binnen sechs Monaten nach dem Tag, an dem die Eintragung der Ausgliederung in das Register des Sitzes desjenigen Rechtsträgers, dessen Gläubiger sie sind, nach § 19 Abs. 3 UmwG als bekannt gemacht gilt, ihren Anspruch nach Grund und Höhe in Textform anmelden, Sicherheit zu leisten, soweit sie nicht Befriedigung verlangen können. Dieses Recht steht den Gläubigern jedoch nur zu, wenn sie glaubhaft machen, dass durch die Ausgliederung die Erfüllung der Forderung gefährdet wird."
    },
    {
      "date": "2025-08-13",
      "id": "120860",
      "original_text": "Registerbekanntmachung nach dem Umwandlungsgesetz\nSachsen Amtsgericht Leipzig HRB 38702\nKontron Leipzig GmbH – Leipzig",
      "type": "Registerbekanntmachung nach dem Umwandlungsgesetz",
      "state": "Sachsen",
      "amtsgericht": "Amtsgericht Leipzig",
      "registernummer": "HRB 38702",
      "registerart": "HRB",
      "company_name": "Kontron Leipzig GmbH",
      "company_seat": "Leipzig",
      "details": "13.08.2025 (Bekanntmachungsdatum)\n\nSachsen Amtsgericht Leipzig HRB 38702\nRegisterbekanntmachung nach dem Umwandlungsgesetz 13.08.2025 (Eintragungsdatum)\n\nKontron Leipzig GmbH\nGesellschaft mit beschränkter Haftung\nLeipzig\n\nDen Gläubigern der an der Verschmelzung beteiligten Rechtsträger ist, wenn sie binnen sechs Monaten nach dem Tag, an dem die Eintragung der Verschmelzung in das Register des Sitzes desjenigen Rechtsträgers, dessen Gläubiger sie sind, nach § 19 Abs. 3 UmwG als bekannt gemacht gilt, ihren Anspruch nach Grund und Höhe in Textform anmelden, Sicherheit zu leisten, soweit sie nicht Befriedigung verlangen können. Dieses Recht steht den Gläubigern jedoch nur zu, wenn sie glaubhaft machen, dass durch die Verschmelzung die Erfüllung der Forderung gefährdet wird."
    },
    {
      "date": "2025-08-13",
      "id": "120861",
      "original_text": "Registerbekanntmachung nach dem Umwandlungsgesetz\nSachsen Amtsgericht Dresden HRA 12225\nZeidler GmbH & Co. KG – Dresden",
      "type": "Registerbekanntmachung nach dem Umwandlungsgesetz",
      "state": "Sachsen",
      "amtsgericht": "Amtsgericht Dresden",
      "registernummer": "HRA 12225",
      "registerart": "HRA",
      "company_name": "Zeidler GmbH & Co. KG",
      "company_seat": "Dresden",
      "details": "13.08.2025 (Bekanntmachungsdatum)\n\nSachsen Amtsgericht Dresden HRA 12225\nRegisterbekanntmachung nach dem Umwandlungsgesetz 13.08.2025 (Eintragungsdatum)\n\nZeidler GmbH & Co. KG\nKommanditgesellschaft\nDresden\n\nDen Gläubigern der an der Ausgliederung beteiligten Rechtsträger ist, wenn sie binnen sechs Monaten nach dem Tag, an dem die Eintragung der Ausgliederung in das Register des Sitzes desjenigen Rechtsträgers, dessen Gläubiger sie sind, nach § 19 Abs. 3 UmwG als bekannt gemacht gilt, ihren Anspruch nach Grund und Höhe in Textform anmelden, Sicherheit zu leisten, soweit sie nicht Befriedigung verlangen können. Dieses Recht steht den Gläubigern jedoch nur zu, wenn sie glaubhaft machen, dass durch die Ausgliederung die Erfüllung der Forderung gefährdet wird."
    },
    {
      "date": "2025-08-13",
      "id": "120862",
      "original_text": "Registerbekanntmachung nach dem Umwandlungsgesetz\nSachsen Amtsgericht Chemnitz HRB 37623\nIhmann Dachdeckerei & Zimmerei GmbH – Mülsen",
      "type": "Registerbekanntmachung nach dem Umwandlungsgesetz",
      "state": "Sachsen",
      "amtsgericht": "Amtsgericht Chemnitz",
      "registernummer": "HRB 37623",
      "registerart": "HRB",
      "company_name": "Ihmann Dachdeckerei & Zimmerei GmbH",
      "company_seat": "Mülsen",
      "details": "13.08.2025 (Bekanntmachungsdatum)\n\nSachsen Amtsgericht Chemnitz HRB 37623\nRegisterbekanntmachung nach dem Umwandlungsgesetz 13.08.2025 (Eintragungsdatum)\n\nIhmann Dachdeckerei & Zimmerei GmbH\nGesellschaft mit beschränkter Haftung\nMülsen\n\nDen Gläubigern der an der Ausgliederung beteiligten Rechtsträger ist, wenn sie binnen sechs Monaten nach dem Tag, an dem die Eintragung der Ausgliederung in das Register des Sitzes desjenigen Rechtsträgers, dessen Gläubiger sie sind, nach § 19 Abs. 3 UmwG als bekannt gemacht gilt, ihren Anspruch nach Grund und Höhe in Textform anmelden, Sicherheit zu leisten, soweit sie nicht Befriedigung verlangen können. Dieses Recht steht den Gläubigern jedoch nur zu, wenn sie glaubhaft machen, dass durch die Ausgliederung die Erfüllung der Forderung gefährdet wird."
    },
    {
      "date": "2025-08-13",
      "id": "120863",
      "original_text": "Registerbekanntmachung nach dem Umwandlungsgesetz\nSachsen Amtsgericht Chemnitz HRA 10246\nIhmann Dachdeckerei & Zimmerei, Inh. Frank Ihmann e. K. – Mülsen",
      "type": "Registerbekanntmachung nach dem Umwandlungsgesetz",
      "state": "Sachsen",
      "amtsgericht": "Amtsgericht Chemnitz",
      "registernummer": "HRA 10246",
      "registerart": "HRA",
      "company_name": "Ihmann Dachdeckerei & Zimmerei, Inh. Frank Ihmann e. K.",
      "company_seat": "Mülsen",
      "details": "13.08.2025 (Bekanntmachungsdatum)\n\nSachsen Amtsgericht Chemnitz HRA 10246\nRegisterbekanntmachung nach dem Umwandlungsgesetz 13.08.2025 (Eintragungsdatum)\n\nIhmann Dachdeckerei & Zimmerei, Inh. Frank Ihmann e. K.\nEinzelkaufmann / Einzelkauffrau\nMülsen\n\nDen Gläubigern der an der Ausgliederung beteiligten Rechtsträger ist, wenn sie binnen sechs Monaten nach dem Tag, an dem die Eintragung der Ausgliederung in das Register des Sitzes desjenigen Rechtsträgers, dessen Gläubiger sie sind, nach § 19 Abs. 3 UmwG als bekannt gemacht gilt, ihren Anspruch nach Grund und Höhe in Textform anmelden, Sicherheit zu leisten, soweit sie nicht Befriedigung verlangen können. Dieses Recht steht den Gläubigern jedoch nur zu, wenn sie glaubhaft machen, dass durch die Ausgliederung die Erfüllung der Forderung gefährdet wird."
    },
    {
      "date": "2025-08-13",
      "id": "120864",
      "original_text": "Löschungsankündigung\nSachsen Amtsgericht Chemnitz HRB 36259\nANCHIE GLOBAL GmbH – Kurort Oberwiesenthal",
      "type": "Löschungsankündigung",
      "state": "Sachsen",
      "amtsgericht": "Amtsgericht Chemnitz",
      "registernummer": "HRB 36259",
      "registerart": "HRB",
      "company_name": "ANCHIE GLOBAL GmbH",
      "company_seat": "Kurort Oberwiesenthal",
      "details": "13.08.2025 (Bekanntmachungsdatum)\n\nSachsen Amtsgericht Chemnitz HRB 36259\nLöschungsankündigung 13.08.2025 (Eintragungsdatum)\n\nANCHIE GLOBAL GmbH\nGesellschaft mit beschränkter Haftung\nKurort Oberwiesenthal\n\nDas Registergericht beabsichtigt, die im Handelsregister eingetragene Gesellschaft von Amts wegen nach § 394 FamFG zu löschen. Die Frist zu Erhebung eines Widerspruchs gegen die beabsichtigte Löschung wird auf einen Monat festgesetzt."
    },
    {
      "date": "2025-08-13",
      "id": "120865",
      "original_text": "Löschungsankündigung\nNiedersachsen Amtsgericht Aurich HRB 205491\nSK Tec GmbH – Aurich",
      "type": "Löschungsankündigung",
      "state": "Niedersachsen",
      "amtsgericht": "Amtsgericht Aurich",
      "registernummer": "HRB 205491",
      "registerart": "HRB",
      "company_name": "SK Tec GmbH",
      "company_seat": "Aurich",
      "details": "13.08.2025 (Bekanntmachungsdatum)\n\nNiedersachsen Amtsgericht Aurich HRB 205491\nLöschungsankündigung 13.08.2025 (Eintragungsdatum)\n\nSK Tec GmbH\nGesellschaft mit beschränkter Haftung\nAurich\n\nDas Registergericht beabsichtigt, die Gesellschaft von Amts wegen nach § 394 FamFG zu löschen. Die Frist zur Erhebung eines Widerspruchs ist auf 1 Monat ab dieser Registerbekanntmachung festgesetzt."
    },
    {
      "date": "2025-08-13",
      "id": "120866",
      "original_text": "Registerbekanntmachung nach dem Umwandlungsgesetz\nNiedersachsen Amtsgericht Osnabrück HRB 21217\nMM Corporate Fashion Verwaltungs GmbH – Osnabrück",
      "type": "Registerbekanntmachung nach dem Umwandlungsgesetz",
      "state": "Niedersachsen",
      "amtsgericht": "Amtsgericht Osnabrück",
      "registernummer": "HRB 21217",
      "registerart": "HRB",
      "company_name": "MM Corporate Fashion Verwaltungs GmbH",
      "company_seat": "Osnabrück",
      "details": "13.08.2025 (Bekanntmachungsdatum)\n\nNiedersachsen Amtsgericht Osnabrück HRB 21217\nRegisterbekanntmachung nach dem Umwandlungsgesetz 13.08.2025 (Eintragungsdatum)\n\nMM Corporate Fashion Verwaltungs GmbH\nGesellschaft mit beschränkter Haftung\nOsnabrück\n\nDen Gläubigern der an der Verschmelzung beteiligten Rechtsträger ist, wenn sie binnen sechs Monaten nach dem Tag, an dem die Eintragung der Verschmelzung in das Register des Sitzes desjenigen Rechtsträgers, dessen Gläubiger sie sind, nach § 19  Abs.  3 UmwG als bekannt gemacht gilt, ihren Anspruch nach Grund und Höhe schriftlich anmelden, Sicherheit zu leisten, soweit sie nicht Befriedigung verlangen können. Dieses Recht steht den Gläubigern jedoch nur zu, wenn sie glaubhaft machen, dass durch die Verschmelzung die Erfüllung der Forderung gefährdet wird."
    },
    {
      "date": "2025-08-13",
      "id": "120867",
      "original_text": "Löschungsankündigung\nNiedersachsen Amtsgericht Aurich HRB 207205\nTechnoLive GmbH – Hinte",
      "type": "Löschungsankündigung",
      "state": "Niedersachsen",
      "amtsgericht": "Amtsgericht Aurich",
      "registernummer": "HRB 207205",
      "registerart": "HRB",
      "company_name": "TechnoLive GmbH",
      "company_seat": "Hinte",
      "details": "13.08.2025 (Bekanntmachungsdatum)\n\nNiedersachsen Amtsgericht Aurich HRB 207205\nLöschungsankündigung 13.08.2025 (Eintragungsdatum)\n\nTechnoLive GmbH\nGesellschaft mit beschränkter Haftung\nHinte\n\nDas Registergericht beabsichtigt, die Gesellschaft von Amts wegen nach § 394 FamFG zu löschen. Die Frist zur Erhebung eines Widerspruchs ist auf 1 Monat ab dieser Registerbekanntmachung festgesetzt."
    },
    {
      "date": "2025-08-13",
      "id": "120868",
      "original_text": "Registerbekanntmachung nach dem Umwandlungsgesetz\nNiedersachsen Amtsgericht Tostedt HRB 208369\nVerwaltung Egoli Beteiligungsgesellschaft mbH – Stade",
      "type": "Registerbekanntmachung nach dem Umwandlungsgesetz",
      "state": "Niedersachsen",
      "amtsgericht": "Amtsgericht Tostedt",
      "registernummer": "HRB 208369",
      "registerart": "HRB",
      "company_name": "Verwaltung Egoli Beteiligungsgesellschaft mbH",
      "company_seat": "Stade",
      "details": "13.08.2025 (Bekanntmachungsdatum)\n\nNiedersachsen Amtsgericht Tostedt HRB 208369\nRegisterbekanntmachung nach dem Umwandlungsgesetz 13.08.2025 (Eintragungsdatum)\n\nVerwaltung Egoli Beteiligungsgesellschaft mbH\nGesellschaft mit beschränkter Haftung\nStade\n\nDen Gläubigern der an der Verschmelzung beteiligten Rechtsträger ist, wenn sie binnen sechs Monaten nach dem Tag, an dem die Eintragung der Verschmelzung in das Register des Sitzes desjenigen Rechtsträgers, dessen Gläubiger sie sind, nach § 19  Abs.  3 UmwG als bekannt gemacht gilt, ihren Anspruch nach Grund und Höhe schriftlich anmelden, Sicherheit zu leisten, soweit sie nicht Befriedigung verlangen können. Dieses Recht steht den Gläubigern jedoch nur zu, wenn sie glaubhaft machen, dass durch die Verschmelzung die Erfüllung der Forderung gefährdet wird."
    },
    {
      "date": "2025-08-13",
      "id": "120869",
      "original_text": "Registerbekanntmachung nach dem Umwandlungsgesetz\nNiedersachsen Amtsgericht Walsrode HRB 120949\nBrüning GmbH – Lilienthal",
      "type": "Registerbekanntmachung nach dem Umwandlungsgesetz",
      "state": "Niedersachsen",
      "amtsgericht": "Amtsgericht Walsrode",
      "registernummer": "HRB 120949",
      "registerart": "HRB",
      "company_name": "Brüning GmbH",
      "company_seat": "Lilienthal",
      "details": "13.08.2025 (Bekanntmachungsdatum)\n\nNiedersachsen Amtsgericht Walsrode HRB 120949\nRegisterbekanntmachung nach dem Umwandlungsgesetz\n\nBrüning GmbH\nGesellschaft mit beschränkter Haftung\nLilienthal\n\nDen Gläubigern der an der Ausgliederung beteiligten Rechtsträger ist, wenn sie binnen sechs Monaten nach dem Tag, an dem die Eintragung der Ausgliederung in das Register des Sitzes desjenigen Rechtsträgers, dessen Gläubiger sie sind, nach § 19 Abs. 3 UmwG als bekannt gemacht gilt, ihren Anspruch nach Grund und Höhe schriftlich anmelden, Sicherheit zu leisten, soweit sie nicht Befriedigung verlangen können. Dieses Recht steht den Gläubigern jedoch nur zu, wenn sie glaubhaft machen, dass durch die Ausgliederung die Erfüllung der Forderung gefährdet wird."
    },
    {
      "date": "2025-08-13",
      "id": "120870",
      "original_text": "Löschungsankündigung\nNiedersachsen Amtsgericht Hildesheim HRB 205207\nHaarlounge UG (haftungsbeschränkt) – Hildesheim",
      "type": "Löschungsankündigung",
      "state": "Niedersachsen",
      "amtsgericht": "Amtsgericht Hildesheim",
      "registernummer": "HRB 205207",
      "registerart": "HRB",
      "company_name": "Haarlounge UG (haftungsbeschränkt)",
      "company_seat": "Hildesheim",
      "details": "13.08.2025 (Bekanntmachungsdatum)\n\nNiedersachsen Amtsgericht Hildesheim HRB 205207\nLöschungsankündigung 13.08.2025 (Eintragungsdatum)\n\nHaarlounge UG (haftungsbeschränkt)\nGesellschaft mit beschränkter Haftung\nHildesheim\n\nDas Registergericht beabsichtigt, die Gesellschaft von Amts wegen nach § 394 FamFG zu löschen. Die Frist zur Erhebung eines Widerspruchs ist auf 1 Monat ab dieser Registerbekanntmachung festgesetzt."
    },
    {
      "date": "2025-08-13",
      "id": "120871",
      "original_text": "Registerbekanntmachung nach dem Umwandlungsgesetz\nNiedersachsen Amtsgericht Tostedt HRB 208368\nVerwaltung Baramundi Beteiligungsgesellschaft mbH – Stade",
      "type": "Registerbekanntmachung nach dem Umwandlungsgesetz",
      "state": "Niedersachsen",
      "amtsgericht": "Amtsgericht Tostedt",
      "registernummer": "HRB 208368",
      "registerart": "HRB",
      "company_name": "Verwaltung Baramundi Beteiligungsgesellschaft mbH",
      "company_seat": "Stade",
      "details": "13.08.2025 (Bekanntmachungsdatum)\n\nNiedersachsen Amtsgericht Tostedt HRB 208368\nRegisterbekanntmachung nach dem Umwandlungsgesetz 13.08.2025 (Eintragungsdatum)\n\nVerwaltung Baramundi Beteiligungsgesellschaft mbH\nGesellschaft mit beschränkter Haftung\nStade\n\nDen Gläubigern der an der Verschmelzung beteiligten Rechtsträger ist, wenn sie binnen sechs Monaten nach dem Tag, an dem die Eintragung der Verschmelzung in das Register des Sitzes desjenigen Rechtsträgers, dessen Gläubiger sie sind, nach § 19  Abs.  3 UmwG als bekannt gemacht gilt, ihren Anspruch nach Grund und Höhe schriftlich anmelden, Sicherheit zu leisten, soweit sie nicht Befriedigung verlangen können. Dieses Recht steht den Gläubigern jedoch nur zu, wenn sie glaubhaft machen, dass durch die Verschmelzung die Erfüllung der Forderung gefährdet wird."
    },
    {
      "date": "2025-08-13",
      "id": "120872",
      "original_text": "Registerbekanntmachung nach dem Umwandlungsgesetz\nNiedersachsen Amtsgericht Tostedt HRB 211709\nPflegeteam Bonert GmbH – Buxtehude",
      "type": "Registerbekanntmachung nach dem Umwandlungsgesetz",
      "state": "Niedersachsen",
      "amtsgericht": "Amtsgericht Tostedt",
      "registernummer": "HRB 211709",
      "registerart": "HRB",
      "company_name": "Pflegeteam Bonert GmbH",
      "company_seat": "Buxtehude",
      "details": "13.08.2025 (Bekanntmachungsdatum)\n\nNiedersachsen Amtsgericht Tostedt HRB 211709\nRegisterbekanntmachung nach dem Umwandlungsgesetz 13.08.2025 (Eintragungsdatum)\n\nPflegeteam Bonert GmbH\nGesellschaft mit beschränkter Haftung\nBuxtehude\n\nDen Gläubigern der an der Ausgliederung beteiligten Rechtsträger ist, wenn sie binnen sechs Monaten nach dem Tag, an dem die Eintragung der Ausgliederung in das Register des Sitzes desjenigen Rechtsträgers, dessen Gläubiger sie sind, nach § 19 Abs. 3 UmwG als bekannt gemacht gilt, ihren Anspruch nach Grund und Höhe schriftlich anmelden, Sicherheit zu leisten, soweit sie nicht Befriedigung verlangen können. Dieses Recht steht den Gläubigern jedoch nur zu, wenn sie glaubhaft machen, dass durch die Ausgliederung die Erfüllung der Forderung gefährdet wird."
    },
    {
      "date": "2025-08-13",
      "id": "120873",
      "original_text": "Registerbekanntmachung nach dem Umwandlungsgesetz\nNiedersachsen Amtsgericht Osnabrück HRB 214208\nViVa Fitness Emsdetten GmbH – Quakenbrück",
      "type": "Registerbekanntmachung nach dem Umwandlungsgesetz",
      "state": "Niedersachsen",
      "amtsgericht": "Amtsgericht Osnabrück",
      "registernummer": "HRB 214208",
      "registerart": "HRB",
      "company_name": "ViVa Fitness Emsdetten GmbH",
      "company_seat": "Quakenbrück",
      "details": "13.08.2025 (Bekanntmachungsdatum)\n\nNiedersachsen Amtsgericht Osnabrück HRB 214208\nRegisterbekanntmachung nach dem Umwandlungsgesetz 13.08.2025 (Eintragungsdatum)\n\nViVa Fitness Emsdetten GmbH\nGesellschaft mit beschränkter Haftung\nQuakenbrück\n\nDen Gläubigern der an der Verschmelzung beteiligten Rechtsträger ist, wenn sie binnen sechs Monaten nach dem Tag, an dem die Eintragung der Verschmelzung in das Register des Sitzes desjenigen Rechtsträgers, dessen Gläubiger sie sind, nach § 19  Abs.  3 UmwG als bekannt gemacht gilt, ihren Anspruch nach Grund und Höhe schriftlich anmelden, Sicherheit zu leisten, soweit sie nicht Befriedigung verlangen können. Dieses Recht steht den Gläubigern jedoch nur zu, wenn sie glaubhaft machen, dass durch die Verschmelzung die Erfüllung der Forderung gefährdet wird."
    },
    {
      "date": "2025-08-13",
      "id": "120874",
      "original_text": "Registerbekanntmachung nach dem Umwandlungsgesetz\nNiedersachsen Amtsgericht Braunschweig HRB 209788\nWärme-Mess-Service GmbH – Salzgitter",
      "type": "Registerbekanntmachung nach dem Umwandlungsgesetz",
      "state": "Niedersachsen",
      "amtsgericht": "Amtsgericht Braunschweig",
      "registernummer": "HRB 209788",
      "registerart": "HRB",
      "company_name": "Wärme-Mess-Service GmbH",
      "company_seat": "Salzgitter",
      "details": "13.08.2025 (Bekanntmachungsdatum)\n\nNiedersachsen Amtsgericht Braunschweig HRB 209788\nRegisterbekanntmachung nach dem Umwandlungsgesetz 13.08.2025 (Eintragungsdatum)\n\nWärme-Mess-Service GmbH\nGesellschaft mit beschränkter Haftung\nSalzgitter\n\nDen Gläubigern der an der Verschmelzung beteiligten Rechtsträger ist, wenn sie binnen sechs Monaten nach dem Tag, an dem die Eintragung der Verschmelzung in das Register des Sitzes desjenigen Rechtsträgers, dessen Gläubiger sie sind, nach § 19  Abs.  3 UmwG als bekannt gemacht gilt, ihren Anspruch nach Grund und Höhe schriftlich anmelden, Sicherheit zu leisten, soweit sie nicht Befriedigung verlangen können. Dieses Recht steht den Gläubigern jedoch nur zu, wenn sie glaubhaft machen, dass durch die Verschmelzung die Erfüllung der Forderung gefährdet wird."
    },
    {
      "date": "2025-08-13",
      "id": "120875",
      "original_text": "Registerbekanntmachung nach dem Umwandlungsgesetz\nNiedersachsen Amtsgericht Tostedt HRB 203826\nO.S.T. Cuxhaven Verwaltungs GmbH – Cuxhaven",
      "type": "Registerbekanntmachung nach dem Umwandlungsgesetz",
      "state": "Niedersachsen",
      "amtsgericht": "Amtsgericht Tostedt",
      "registernummer": "HRB 203826",
      "registerart": "HRB",
      "company_name": "O.S.T. Cuxhaven Verwaltungs GmbH",
      "company_seat": "Cuxhaven",
      "details": "13.08.2025 (Bekanntmachungsdatum)\n\nNiedersachsen Amtsgericht Tostedt HRB 203826\nRegisterbekanntmachung nach dem Umwandlungsgesetz 13.08.2025 (Eintragungsdatum)\n\nO.S.T. Cuxhaven Verwaltungs GmbH\nGesellschaft mit beschränkter Haftung\nCuxhaven\n\nDen Gläubigern der an der Verschmelzung beteiligten Rechtsträger ist, wenn sie binnen sechs Monaten nach dem Tag, an dem die Eintragung der Verschmelzung in das Register des Sitzes desjenigen Rechtsträgers, dessen Gläubiger sie sind, nach § 19  Abs.  3 UmwG als bekannt gemacht gilt, ihren Anspruch nach Grund und Höhe schriftlich anmelden, Sicherheit zu leisten, soweit sie nicht Befriedigung verlangen können. Dieses Recht steht den Gläubigern jedoch nur zu, wenn sie glaubhaft machen, dass durch die Verschmelzung die Erfüllung der Forderung gefährdet wird."
    },
    {
      "date": "2025-08-13",
      "id": "120876",
      "original_text": "Registerbekanntmachung nach dem Umwandlungsgesetz\nNiedersachsen Amtsgericht Tostedt HRA 203146\nPflege Team Bonert e.K. – Buxtehude",
      "type": "Registerbekanntmachung nach dem Umwandlungsgesetz",
      "state": "Niedersachsen",
      "amtsgericht": "Amtsgericht Tostedt",
      "registernummer": "HRA 203146",
      "registerart": "HRA",
      "company_name": "Pflege Team Bonert e.K.",
      "company_seat": "Buxtehude",
      "details": "13.08.2025 (Bekanntmachungsdatum)\n\nNiedersachsen Amtsgericht Tostedt HRA 203146\nRegisterbekanntmachung nach dem Umwandlungsgesetz 13.08.2025 (Eintragungsdatum)\n\nPflege Team Bonert e.K.\nEinzelkaufmann / Einzelkauffrau\nBuxtehude\n\nDen Gläubigern der an der Ausgliederung beteiligten Rechtsträger ist, wenn sie binnen sechs Monaten nach dem Tag, an dem die Eintragung der Ausgliederung in das Register des Sitzes desjenigen Rechtsträgers, dessen Gläubiger sie sind, nach § 19 Abs. 3 UmwG als bekannt gemacht gilt, ihren Anspruch nach Grund und Höhe schriftlich anmelden, Sicherheit zu leisten, soweit sie nicht Befriedigung verlangen können. Dieses Recht steht den Gläubigern jedoch nur zu, wenn sie glaubhaft machen, dass durch die Ausgliederung die Erfüllung der Forderung gefährdet wird."
    },
    {
      "date": "2025-08-13",
      "id": "120877",
      "original_text": "Registerbekanntmachung nach dem Umwandlungsgesetz\nNiedersachsen Amtsgericht Walsrode HRB 203264\nFeldema GmbH – Ritterhude",
      "type": "Registerbekanntmachung nach dem Umwandlungsgesetz",
      "state": "Niedersachsen",
      "amtsgericht": "Amtsgericht Walsrode",
      "registernummer": "HRB 203264",
      "registerart": "HRB",
      "company_name": "Feldema GmbH",
      "company_seat": "Ritterhude",
      "details": "13.08.2025 (Bekanntmachungsdatum)\n\nNiedersachsen Amtsgericht Walsrode HRB 203264\nRegisterbekanntmachung nach dem Umwandlungsgesetz 13.08.2025 (Eintragungsdatum)\n\nFeldema GmbH\nGesellschaft mit beschränkter Haftung\nRitterhude\n\nDen Gläubigern der an der Verschmelzung beteiligten Rechtsträger ist, wenn sie binnen sechs Monaten nach dem Tag, an dem die Eintragung der Verschmelzung in das Register des Sitzes desjenigen Rechtsträgers, dessen Gläubiger sie sind, nach § 19  Abs.  3 UmwG als bekannt gemacht gilt, ihren Anspruch nach Grund und Höhe schriftlich anmelden, Sicherheit zu leisten, soweit sie nicht Befriedigung verlangen können. Dieses Recht steht den Gläubigern jedoch nur zu, wenn sie glaubhaft machen, dass durch die Verschmelzung die Erfüllung der Forderung gefährdet wird."
    },
    {
      "date": "2025-08-13",
      "id": "120878",
      "original_text": "Registerbekanntmachung nach dem Umwandlungsgesetz\nBaden-Württemberg Amtsgericht Stuttgart HRB 25169\nMidCap Finance GmbH – Stuttgart",
      "type": "Registerbekanntmachung nach dem Umwandlungsgesetz",
      "state": "Baden-Württemberg",
      "amtsgericht": "Amtsgericht Stuttgart",
      "registernummer": "HRB 25169",
      "registerart": "HRB",
      "company_name": "MidCap Finance GmbH",
      "company_seat": "Stuttgart",
      "details": "13.08.2025 (Bekanntmachungsdatum)\n\nBaden-Württemberg Amtsgericht Stuttgart HRB 25169\nRegisterbekanntmachung nach dem Umwandlungsgesetz 13.08.2025 (Eintragungsdatum)\n\nMidCap Finance GmbH\nGesellschaft mit beschränkter Haftung\nStuttgart\n\nAls nicht eingetragen wird bekanntgemacht:\nDen Gläubigern der an der Verschmelzung beteiligten Rechtsträger ist, wenn sie binnen sechs Monaten nach dem Tag, an dem die Eintragung der Verschmelzung in das Register des Sitzes desjenigen Rechtsträgers, dessen Gläubiger sie sind, nach § 19 Abs. 3 UmwG als bekanntgemacht gilt, ihren Anspruch nach Grund und Höhe schriftlich anmelden, Sicherheit zu leisten, soweit sie nicht Befriedigung verlangen können. Dieses Recht steht den Gläubigern jedoch nur zu, wenn sie glaubhaft machen, dass durch die Verschmelzung die Erfüllung ihrer Forderung gefährdet wird."
    },
    {
      "date": "2025-08-13",
      "id": "120879",
      "original_text": "Registerbekanntmachung nach dem Umwandlungsgesetz\nBrandenburg Amtsgericht Potsdam HRB 35344\nNelad Ventures UG (haftungsbeschränkt) – Potsdam",
      "type": "Registerbekanntmachung nach dem Umwandlungsgesetz",
      "state": "Brandenburg",
      "amtsgericht": "Amtsgericht Potsdam",
      "registernummer": "HRB 35344",
      "registerart": "HRB",
      "company_name": "Nelad Ventures UG (haftungsbeschränkt)",
      "company_seat": "Potsdam",
      "details": "13.08.2025 (Bekanntmachungsdatum)\n\nBrandenburg Amtsgericht Potsdam HRB 35344\nRegisterbekanntmachung nach dem Umwandlungsgesetz 31.07.2025 (Eintragungsdatum)\n\nNelad Ventures UG (haftungsbeschränkt)\nGesellschaft mit beschränkter Haftung\nPotsdam\n\nAls nicht eingetragen wird veröffentlicht:\nDen Gläubigern der an der Verschmelzung beteiligten Rechtsträger ist, wenn sie binnen sechs Monaten nach dem Tag, an dem die Eintragung der Verschmelzung in das Register des Sitzes desjenigen Rechtsträgers, dessen Gläubiger sie sind, als bekannt gemacht gilt, ihren Anspruch nach Grund und Höhe schriftlich anmelden, Sicherheit zu leisten, soweit sie nicht Befriedigung verlangen können. Dieses Recht steht den Gläubigern jedoch nur zu, wenn sie glaubhaft machen, dass durch die Verschmelzung die Erfüllung ihrer Forderung gefährdet wird"
    },
    {
      "date": "2025-08-13",
      "id": "120880",
      "original_text": "Registerbekanntmachung nach dem Umwandlungsgesetz\nRheinland-Pfalz Amtsgericht Montabaur HRA 12036\nLohmann & Rauscher GmbH & Co. KG – Neuwied",
      "type": "Registerbekanntmachung nach dem Umwandlungsgesetz",
      "state": "Rheinland-Pfalz",
      "amtsgericht": "Amtsgericht Montabaur",
      "registernummer": "HRA 12036",
      "registerart": "HRA",
      "company_name": "Lohmann & Rauscher GmbH & Co. KG",
      "company_seat": "Neuwied",
      "details": "13.08.2025 (Bekanntmachungsdatum)\n\nRheinland-Pfalz Amtsgericht Montabaur HRA 12036\nRegisterbekanntmachung nach dem Umwandlungsgesetz 13.08.2025 (Eintragungsdatum)\n\nLohmann & Rauscher GmbH & Co. KG\nKommanditgesellschaft\nNeuwied\n\nAls nicht eingetragen wird veröffentlicht: Den Gläubigern der an der Verschmelzung beteiligten Rechtsträger ist, wenn sie binnen sechs Monaten nach dem Tag, an dem die Eintragung der Verschmelzung in das Register des Sitzes desjenigen Rechtsträgers, dessen Gläubiger sie sind, nach § 19 Abs. 3 UmwG als bekannt gemacht gilt, ihren Anspruch nach Grund und Höhe schriftlich anmelden, Sicherheit zu leisten, soweit sie nicht Befriedigung verlangen können. Dieses Recht steht den Gläubigern jedoch nur zu, wenn sie glaubhaft machen, dass durch die Verschmelzung die Erfüllung der Forderung gefährdet wird."
    },
    {
      "date": "2025-08-13",
      "id": "120881",
      "original_text": "Registerbekanntmachung nach dem Umwandlungsgesetz\nRheinland-Pfalz Amtsgericht Ludwigshafen a.Rhein (Ludwigshafen) HRB 67854\nBASF Renewable Energy GmbH – Ludwigshafen am Rhein",
      "type": "Registerbekanntmachung nach dem Umwandlungsgesetz",
      "state": "Rheinland-Pfalz",
      "amtsgericht": "Amtsgericht Ludwigshafen a.Rhein (Ludwigshafen)",
      "registernummer": "HRB 67854",
      "registerart": "HRB",
      "company_name": "BASF Renewable Energy GmbH",
      "company_seat": "Ludwigshafen am Rhein",
      "details": "13.08.2025 (Bekanntmachungsdatum)\n\nRheinland-Pfalz Amtsgericht Ludwigshafen a.Rhein (Ludwigshafen) HRB 67854\nRegisterbekanntmachung nach dem Umwandlungsgesetz 11.08.2025 (Eintragungsdatum)\n\nBASF Renewable Energy GmbH\nGesellschaft mit beschränkter Haftung\nLudwigshafen am Rhein\n\nAls nicht eingetragen wird veröffentlicht: Den Gläubigern der an der Verschmelzung beteiligten Rechtsträger ist, wenn sie binnen sechs Monaten nach dem Tag, an dem die Eintragung der Verschmelzung in das Register des Sitzes desjenigen Rechtsträgers,dessen Gläubiger sie sind, nach § 19 Abs. 3 UmwG als bekannt gemacht gilt, ihren Anspruch nach Grund und Höhe schriftlich anmelden, Sicherheit zu leisten, soweit sie nicht Befriedigung verlangen können. Dieses Recht steht den Gläubigern jedoch nur zu, wenn sie glaubhaft machen, dass durch die Verschmelzung die Erfüllungd er Forderung gefährdet wird."
    },
    {
      "date": "2025-08-13",
      "id": "120882",
      "original_text": "Registerbekanntmachung nach dem Umwandlungsgesetz\nRheinland-Pfalz Amtsgericht Ludwigshafen a.Rhein (Ludwigshafen) HRB 68844\nNordlicht Investor HoldCo Management GmbH – Ludwigshafen am Rhein",
      "type": "Registerbekanntmachung nach dem Umwandlungsgesetz",
      "state": "Rheinland-Pfalz",
      "amtsgericht": "Amtsgericht Ludwigshafen a.Rhein (Ludwigshafen)",
      "registernummer": "HRB 68844",
      "registerart": "HRB",
      "company_name": "Nordlicht Investor HoldCo Management GmbH",
      "company_seat": "Ludwigshafen am Rhein",
      "details": "13.08.2025 (Bekanntmachungsdatum)\n\nRheinland-Pfalz Amtsgericht Ludwigshafen a.Rhein (Ludwigshafen) HRB 68844\nRegisterbekanntmachung nach dem Umwandlungsgesetz 11.08.2025 (Eintragungsdatum)\n\nNordlicht Investor HoldCo Management GmbH\nGesellschaft mit beschränkter Haftung\nLudwigshafen am Rhein\n\nAls nicht eingetragen wird veröffentlicht: Den Gläubigern der an der Verschmelzung beteiligten Rechtsträger ist, wenn sie binnen sechs Monaten nach dem Tag, an dem die Eintragung der Verschmelzung in das Register des Sitzes desjenigen Rechtsträgers,dessen Gläubiger sie sind, nach § 19 Abs. 3 UmwG als bekannt gemacht gilt, ihren Anspruch nach Grund und Höhe schriftlich anmelden, Sicherheit zu leisten, soweit sie nicht Befriedigung verlangen können. Dieses Recht steht den Gläubigern jedoch nur zu, wenn sie glaubhaft machen, dass durch die Verschmelzung die Erfüllungd er Forderung gefährdet wird."
    },
    {
      "date": "2025-08-13",
      "id": "120883",
      "original_text": "Registerbekanntmachung nach dem Umwandlungsgesetz\nRheinland-Pfalz Amtsgericht Ludwigshafen a.Rhein (Ludwigshafen) HRB 68839\nCo-Investor Nordlicht Investment GmbH – Ludwigshafen am Rhein",
      "type": "Registerbekanntmachung nach dem Umwandlungsgesetz",
      "state": "Rheinland-Pfalz",
      "amtsgericht": "Amtsgericht Ludwigshafen a.Rhein (Ludwigshafen)",
      "registernummer": "HRB 68839",
      "registerart": "HRB",
      "company_name": "Co-Investor Nordlicht Investment GmbH",
      "company_seat": "Ludwigshafen am Rhein",
      "details": "13.08.2025 (Bekanntmachungsdatum)\n\nRheinland-Pfalz Amtsgericht Ludwigshafen a.Rhein (Ludwigshafen) HRB 68839\nRegisterbekanntmachung nach dem Umwandlungsgesetz 11.08.2025 (Eintragungsdatum)\n\nCo-Investor Nordlicht Investment GmbH\nGesellschaft mit beschränkter Haftung\nLudwigshafen am Rhein\n\nAls nicht eingetragen wird veröffentlicht: Den Gläubigern der an der Verschmelzung beteiligten Rechtsträger ist, wenn sie binnen sechs Monaten nach dem Tag, an dem die Eintragung der Verschmelzung in das Register des Sitzes desjenigen Rechtsträgers,dessen Gläubiger sie sind, nach § 19 Abs. 3 UmwG als bekannt gemacht gilt, ihren Anspruch nach Grund und Höhe schriftlich anmelden, Sicherheit zu leisten, soweit sie nicht Befriedigung verlangen können. Dieses Recht steht den Gläubigern jedoch nur zu, wenn sie glaubhaft machen, dass durch die Verschmelzung die Erfüllungd er Forderung gefährdet wird."
    },
    {
      "date": "2025-08-13",
      "id": "120884",
      "original_text": "Registerbekanntmachung nach dem Umwandlungsgesetz\nRheinland-Pfalz Amtsgericht Ludwigshafen a.Rhein (Ludwigshafen) HRB 67854\nBASF Renewable Energy GmbH – Ludwigshafen am Rhein",
      "type": "Registerbekanntmachung nach dem Umwandlungsgesetz",
      "state": "Rheinland-Pfalz",
      "amtsgericht": "Amtsgericht Ludwigshafen a.Rhein (Ludwigshafen)",
      "registernummer": "HRB 67854",
      "registerart": "HRB",
      "company_name": "BASF Renewable Energy GmbH",
      "company_seat": "Ludwigshafen am Rhein",
      "details": "13.08.2025 (Bekanntmachungsdatum)\n\nRheinland-Pfalz Amtsgericht Ludwigshafen a.Rhein (Ludwigshafen) HRB 67854\nRegisterbekanntmachung nach dem Umwandlungsgesetz 11.08.2025 (Eintragungsdatum)\n\nBASF Renewable Energy GmbH\nGesellschaft mit beschränkter Haftung\nLudwigshafen am Rhein\n\nAls nicht eingetragen wird veröffentlicht: Den Gläubigern der an der Verschmelzung beteiligten Rechtsträger ist, wenn sie binnen sechs Monaten nach dem Tag, an dem die Eintragung der Verschmelzung in das Register des Sitzes desjenigen Rechtsträgers,dessen Gläubiger sie sind, nach § 19 Abs. 3 UmwG als bekannt gemacht gilt, ihren Anspruch nach Grund und Höhe schriftlich anmelden, Sicherheit zu leisten, soweit sie nicht Befriedigung verlangen können. Dieses Recht steht den Gläubigern jedoch nur zu, wenn sie glaubhaft machen, dass durch die Verschmelzung die Erfüllungd er Forderung gefährdet wird."
    },
    {
      "date": "2025-08-13",
      "id": "120885",
      "original_text": "Registerbekanntmachung nach dem Umwandlungsgesetz\nRheinland-Pfalz Amtsgericht Ludwigshafen a.Rhein (Ludwigshafen) HRB 68838\nBASF Nordlicht Investment GmbH – Ludwigshafen am Rhein",
      "type": "Registerbekanntmachung nach dem Umwandlungsgesetz",
      "state": "Rheinland-Pfalz",
      "amtsgericht": "Amtsgericht Ludwigshafen a.Rhein (Ludwigshafen)",
      "registernummer": "HRB 68838",
      "registerart": "HRB",
      "company_name": "BASF Nordlicht Investment GmbH",
      "company_seat": "Ludwigshafen am Rhein",
      "details": "13.08.2025 (Bekanntmachungsdatum)\n\nRheinland-Pfalz Amtsgericht Ludwigshafen a.Rhein (Ludwigshafen) HRB 68838\nRegisterbekanntmachung nach dem Umwandlungsgesetz 11.08.2025 (Eintragungsdatum)\n\nBASF Nordlicht Investment GmbH\nGesellschaft mit beschränkter Haftung\nLudwigshafen am Rhein\n\nAls nicht eingetragen wird veröffentlicht: Den Gläubigern der an der Verschmelzung beteiligten Rechtsträger ist, wenn sie binnen sechs Monaten nach dem Tag, an dem die Eintragung der Verschmelzung in das Register des Sitzes desjenigen Rechtsträgers,dessen Gläubiger sie sind, nach § 19 Abs. 3 UmwG als bekannt gemacht gilt, ihren Anspruch nach Grund und Höhe schriftlich anmelden, Sicherheit zu leisten, soweit sie nicht Befriedigung verlangen können. Dieses Recht steht den Gläubigern jedoch nur zu, wenn sie glaubhaft machen, dass durch die Verschmelzung die Erfüllungd er Forderung gefährdet wird."
    },
    {
      "date": "2025-08-13",
      "id": "120886",
      "original_text": "Registerbekanntmachung nach dem Umwandlungsgesetz\nRheinland-Pfalz Amtsgericht Ludwigshafen a.Rhein (Ludwigshafen) HRB 67854\nBASF Renewable Energy GmbH – Ludwigshafen am Rhein",
      "type": "Registerbekanntmachung nach dem Umwandlungsgesetz",
      "state": "Rheinland-Pfalz",
      "amtsgericht": "Amtsgericht Ludwigshafen a.Rhein (Ludwigshafen)",
      "registernummer": "HRB 67854",
      "registerart": "HRB",
      "company_name": "BASF Renewable Energy GmbH",
      "company_seat": "Ludwigshafen am Rhein",
      "details": "13.08.2025 (Bekanntmachungsdatum)\n\nRheinland-Pfalz Amtsgericht Ludwigshafen a.Rhein (Ludwigshafen) HRB 67854\nRegisterbekanntmachung nach dem Umwandlungsgesetz 11.08.2025 (Eintragungsdatum)\n\nBASF Renewable Energy GmbH\nGesellschaft mit beschränkter Haftung\nLudwigshafen am Rhein\n\nAls nicht eingetragen wird veröffentlicht: Den Gläubigern der an der Verschmelzung beteiligten Rechtsträger ist, wenn sie binnen sechs Monaten nach dem Tag, an dem die Eintragung der Verschmelzung in das Register des Sitzes desjenigen Rechtsträgers,dessen Gläubiger sie sind, nach § 19 Abs. 3 UmwG als bekannt gemacht gilt, ihren Anspruch nach Grund und Höhe schriftlich anmelden, Sicherheit zu leisten, soweit sie nicht Befriedigung verlangen können. Dieses Recht steht den Gläubigern jedoch nur zu, wenn sie glaubhaft machen, dass durch die Verschmelzung die Erfüllungd er Forderung gefährdet wird."
    },
    {
      "date": "2025-08-13",
      "id": "120887",
      "original_text": "Registerbekanntmachung nach dem Umwandlungsgesetz\nRheinland-Pfalz Amtsgericht Ludwigshafen a.Rhein (Ludwigshafen) HRB 66164\nKP Solutions IT Systems GmbH – Ludwigshafen",
      "type": "Registerbekanntmachung nach dem Umwandlungsgesetz",
      "state": "Rheinland-Pfalz",
      "amtsgericht": "Amtsgericht Ludwigshafen a.Rhein (Ludwigshafen)",
      "registernummer": "HRB 66164",
      "registerart": "HRB",
      "company_name": "KP Solutions IT Systems GmbH",
      "company_seat": "Ludwigshafen",
      "details": "13.08.2025 (Bekanntmachungsdatum)\n\nRheinland-Pfalz Amtsgericht Ludwigshafen a.Rhein (Ludwigshafen) HRB 66164\nRegisterbekanntmachung nach dem Umwandlungsgesetz 13.08.2025 (Eintragungsdatum)\n\nKP Solutions IT Systems GmbH\nGesellschaft mit beschränkter Haftung\nLudwigshafen\n\nAls nicht eingetragen wird veröffentlicht: Den Gläubigern der an der Ausgliederung beteiligten Rechtsträger ist, wenn sie binnen sechs Monaten nach dem Tag, an dem die Eintragung der Ausgliederung in das Register des Sitzes desjenigen Rechtsträgers,dessen Gläubiger sie sind, nach § 19 Abs. 3 UmwG als bekannt gemacht gilt, ihren Anspruch nach Grund und Höhe schriftlich anmelden, Sicherheit zu leisten, soweit sie nicht Befriedigung verlangen können. Dieses Recht steht den Gläubigern jedoch nur zu, wenn sie glaubhaft machen, dass durch die Ausgliederung die Erfüllung der Forderung gefährdet wird."
    },
    {
      "date": "2025-08-13",
      "id": "120888",
      "original_text": "Registerbekanntmachung nach dem Umwandlungsgesetz\nRheinland-Pfalz Amtsgericht Ludwigshafen a.Rhein (Ludwigshafen) HRA 62411\nKP Solutions IT e.K. Inh. Konstantinos Paleokastritis – Ludwigshafen am Rhein",
      "type": "Registerbekanntmachung nach dem Umwandlungsgesetz",
      "state": "Rheinland-Pfalz",
      "amtsgericht": "Amtsgericht Ludwigshafen a.Rhein (Ludwigshafen)",
      "registernummer": "HRA 62411",
      "registerart": "HRA",
      "company_name": "KP Solutions IT e.K. Inh. Konstantinos Paleokastritis",
      "company_seat": "Ludwigshafen am Rhein",
      "details": "13.08.2025 (Bekanntmachungsdatum)\n\nRheinland-Pfalz Amtsgericht Ludwigshafen a.Rhein (Ludwigshafen) HRA 62411\nRegisterbekanntmachung nach dem Umwandlungsgesetz 13.08.2025 (Eintragungsdatum)\n\nKP Solutions IT e.K. Inh. Konstantinos Paleokastritis\nEinzelkaufmann / Einzelkauffrau\nLudwigshafen am Rhein\n\nAls nicht eingetragen wird veröffentlicht: Den Gläubigern der an der Ausgliederung beteiligten Rechtsträger ist, wenn sie binnen sechs Monaten nach dem Tag, an dem die Eintragung der Ausgliederung in das Register des Sitzes desjenigen Rechtsträgers, dessen Gläubiger sie sind, nach § 19 Abs. 3 UmwG als bekannt gemacht gilt, ihren Anspruch nach Grund und Höhe schriftlich anmelden, Sicherheit zu leisten, soweit sie nicht Befriedigung verlangen können. Dieses Recht steht den Gläubigern jedoch nur zu, wenn sie glaubhaft machen, dass durch die Ausgliederung die Erfüllung der Forderung gefährdet wird."
    },
    {
      "date": "2025-08-13",
      "id": "120889",
      "original_text": "Löschungsankündigung\nRheinland-Pfalz Amtsgericht Montabaur HRB 27309\nHolzverarbeitung Tim Klünder GmbH – Hellenhahn-Schellenberg",
      "type": "Löschungsankündigung",
      "state": "Rheinland-Pfalz",
      "amtsgericht": "Amtsgericht Montabaur",
      "registernummer": "HRB 27309",
      "registerart": "HRB",
      "company_name": "Holzverarbeitung Tim Klünder GmbH",
      "company_seat": "Hellenhahn-Schellenberg",
      "details": "13.08.2025 (Bekanntmachungsdatum)\n\nRheinland-Pfalz Amtsgericht Montabaur HRB 27309\nLöschungsankündigung\n\nHolzverarbeitung Tim Klünder GmbH\nGesellschaft mit beschränkter Haftung\nHellenhahn-Schellenberg\n\nDas Registergericht beabsichtigt die Gesellschaft von Amts wegen nach § 394 FamFG zu löschen. Die Frist zur Erhebung eines Widerspruchs ist auf einen Monat festgesetzt."
    },
    {
      "date": "2025-08-13",
      "id": "120890",
      "original_text": "Löschungsankündigung\nBremen Amtsgericht Bremen HRB 39829\nJakic Dienstleistungs GmbH – Bremen",
      "type": "Löschungsankündigung",
      "state": "Bremen",
      "amtsgericht": "Amtsgericht Bremen",
      "registernummer": "HRB 39829",
      "registerart": "HRB",
      "company_name": "Jakic Dienstleistungs GmbH",
      "company_seat": "Bremen",
      "details": "13.08.2025 (Bekanntmachungsdatum)\n\nBremen Amtsgericht Bremen HRB 39829\nLöschungsankündigung\n\nJakic Dienstleistungs GmbH\nGesellschaft mit beschränkter Haftung\nBremen\n\nEs ist beabsichtigt die im Handelsregister eingetragene Gesellschaft von Amts wegen gemäß § 394 FamFG zu löschen. Gegen die Löschung kann beim AG Bremen schriftlich oder zu Protokoll der Geschäftsstelle Widerspruch eingelegt werden. Widerspruchsfrist 4 Wochen."
    },
    {
      "date": "2025-08-13",
      "id": "120891",
      "original_text": "Registerbekanntmachung nach dem Umwandlungsgesetz\nNordrhein-Westfalen Amtsgericht Köln HRB 124342\nLepel & Lepel GmbH – Köln",
      "type": "Registerbekanntmachung nach dem Umwandlungsgesetz",
      "state": "Nordrhein-Westfalen",
      "amtsgericht": "Amtsgericht Köln",
      "registernummer": "HRB 124342",
      "registerart": "HRB",
      "company_name": "Lepel & Lepel GmbH",
      "company_seat": "Köln",
      "details": "13.08.2025 (Bekanntmachungsdatum)\n\nNordrhein-Westfalen Amtsgericht Köln HRB 124342\nRegisterbekanntmachung nach dem Umwandlungsgesetz 13.08.2025 (Eintragungsdatum)\n\nLepel & Lepel GmbH\nGesellschaft mit beschränkter Haftung\nKöln\n\nDen Gläubigern der an der formwechselnden Umwandlung beteiligten Rechtsträger ist, wenn sie binnen sechs Monaten nach dem Tag, an dem die Eintragung der formwechselnden Umwandlung in das Register des Sitzes desjenigen Rechtsträgers, dessen Gläubiger sie sind, nach § 19 Absatz 3 UmwG als bekanntgemacht gilt, ihren Anspruch nach Grund und Höhe schriftlich anmelden, Sicherheit zu leisten, soweit sie nicht Befriedigung verlangen können. Dieses Recht steht den Gläubigern jedoch nur zu, wenn sie glaubhaft machen, dass durch die formwechselnden Umwandlung die Erfüllung ihrer Forderung gefährdet wird."
    },
    {
      "date": "2025-08-13",
      "id": "120892",
      "original_text": "Löschungsankündigung\nNordrhein-Westfalen Amtsgericht Krefeld HRB 18478\nKM Handel- und Dienstleistungs UG (haftungsbeschränkt) – Krefeld",
      "type": "Löschungsankündigung",
      "state": "Nordrhein-Westfalen",
      "amtsgericht": "Amtsgericht Krefeld",
      "registernummer": "HRB 18478",
      "registerart": "HRB",
      "company_name": "KM Handel- und Dienstleistungs UG (haftungsbeschränkt)",
      "company_seat": "Krefeld",
      "details": "13.08.2025 (Bekanntmachungsdatum)\n\nNordrhein-Westfalen Amtsgericht Krefeld HRB 18478\nLöschungsankündigung\n\nKM Handel- und Dienstleistungs UG (haftungsbeschränkt)\nGesellschaft mit beschränkter Haftung\nKrefeld\n\nDas Registergericht beabsichtigt die Gesellschaft von Amts wegen nach § 394 FamFG zu löschen. Die Frist zur Erhebung eines Widerspruchs ist auf einen Monat festgesetzt."
    },
    {
      "date": "2025-08-13",
      "id": "120893",
      "original_text": "Registerbekanntmachung nach dem Umwandlungsgesetz\nNordrhein-Westfalen Amtsgericht Krefeld VR 3408\nDeutsche Lebens-Rettungs-Gesellschaft Bezirk Krefeld e.V. – Krefeld",
      "type": "Registerbekanntmachung nach dem Umwandlungsgesetz",
      "state": "Nordrhein-Westfalen",
      "amtsgericht": "Amtsgericht Krefeld",
      "registernummer": "VR 3408",
      "registerart": "VR",
      "company_name": "Deutsche Lebens-Rettungs-Gesellschaft Bezirk Krefeld e.V.",
      "company_seat": "Krefeld",
      "details": "13.08.2025 (Bekanntmachungsdatum)\n\nNordrhein-Westfalen Amtsgericht Krefeld VR 3408\nRegisterbekanntmachung nach dem Umwandlungsgesetz 12.08.2025 (Eintragungsdatum)\n\nDeutsche Lebens-Rettungs-Gesellschaft Bezirk Krefeld e.V.\neingetragener Verein\nKrefeld\n\nDen Gläubigern der an der Verschmelzung beteiligten Rechtsträger ist, wenn sie binnen sechs Monaten nach dem Tag, an dem die Eintragung der Verschmelzung in das Register des Sitzes desjenigen Rechtsträgers, dessen Gläubiger sie sind, nach § 19 Absatz 3 UmwG als bekanntgemacht gilt, ihren Anspruch nach Grund und Höhe schriftlich anmelden, Sicherheit zu leisten, soweit sie nicht Befriedigung verlangen können. Dieses Recht steht den Gläubigern jedoch nur zu, wenn sie glaubhaft machen, dass durch die Verschmelzung die Erfüllung ihrer Forderung gefährdet wird."
    },
    {
      "date": "2025-08-13",
      "id": "120894",
      "original_text": "Registerbekanntmachung nach dem Umwandlungsgesetz\nNordrhein-Westfalen Amtsgericht Bielefeld HRB 44891\nAD Holding GmbH – Bielefeld",
      "type": "Registerbekanntmachung nach dem Umwandlungsgesetz",
      "state": "Nordrhein-Westfalen",
      "amtsgericht": "Amtsgericht Bielefeld",
      "registernummer": "HRB 44891",
      "registerart": "HRB",
      "company_name": "AD Holding GmbH",
      "company_seat": "Bielefeld",
      "details": "13.08.2025 (Bekanntmachungsdatum)\n\nNordrhein-Westfalen Amtsgericht Bielefeld HRB 44891\nRegisterbekanntmachung nach dem Umwandlungsgesetz 13.08.2025 (Eintragungsdatum)\n\nAD Holding GmbH\nGesellschaft mit beschränkter Haftung\nBielefeld\n\nDen Gläubigern der an der Verschmelzung beteiligten Rechtsträger ist, wenn sie binnen sechs Monaten nach dem Tag, an dem die Eintragung der Verschmelzung in das Register des Sitzes desjenigen Rechtsträgers, dessen Gläubiger sie sind, nach § 19 Absatz 3 UmwG als bekanntgemacht gilt, ihren Anspruch nach Grund und Höhe schriftlich anmelden, Sicherheit zu leisten, soweit sie nicht Befriedigung verlangen können. Dieses Recht steht den Gläubigern jedoch nur zu, wenn sie glaubhaft machen, dass durch die Verschmelzung die Erfüllung ihrer Forderung gefährdet wird."
    },
    {
      "date": "2025-08-13",
      "id": "120895",
      "original_text": "Einreichung neuer Dokumente\nNordrhein-Westfalen Amtsgericht Köln HRB 1418\nAntoniter Siedlungsgesellschaft mbH im Ev. Kirchenverband Köln und Region – Köln",
      "type": "Einreichung neuer Dokumente",
      "state": "Nordrhein-Westfalen",
      "amtsgericht": "Amtsgericht Köln",
      "registernummer": "HRB 1418",
      "registerart": "HRB",
      "company_name": "Antoniter Siedlungsgesellschaft mbH im Ev. Kirchenverband Köln und Region",
      "company_seat": "Köln",
      "details": "13.08.2025 (Bekanntmachungsdatum)\n\nNordrhein-Westfalen Amtsgericht Köln HRB 1418\nEinreichung neuer Dokumente\n\nAntoniter Siedlungsgesellschaft mbH im Ev. Kirchenverband Köln und Region\nGesellschaft mit beschränkter Haftung\nKöln\n\nDem Registergericht ist eine Liste der Mitglieder des Aufsichtsrates eingereicht worden."
    },
    {
      "date": "2025-08-13",
      "id": "120896",
      "original_text": "Löschungsankündigung\nNordrhein-Westfalen Amtsgericht Wuppertal HRB 28434\nprotectismundi GmbH – Solingen",
      "type": "Löschungsankündigung",
      "state": "Nordrhein-Westfalen",
      "amtsgericht": "Amtsgericht Wuppertal",
      "registernummer": "HRB 28434",
      "registerart": "HRB",
      "company_name": "protectismundi GmbH",
      "company_seat": "Solingen",
      "details": "13.08.2025 (Bekanntmachungsdatum)\n\nNordrhein-Westfalen Amtsgericht Wuppertal HRB 28434\nLöschungsankündigung\n\nprotectismundi GmbH\nGesellschaft mit beschränkter Haftung\nSolingen\n\nDas Registergericht beabsichtigt die Gesellschaft von Amts wegen nach § 394 FamFG zu löschen. Die Frist zur Erhebung eines Widerspruchs ist auf einen Monat festgesetzt."
    },
    {
      "date": "2025-08-13",
      "id": "120897",
      "original_text": "Löschungsankündigung\nNordrhein-Westfalen Amtsgericht Dortmund HRB 30453\nGSD UG (haftungsbeschränkt) – Dortmund",
      "type": "Löschungsankündigung",
      "state": "Nordrhein-Westfalen",
      "amtsgericht": "Amtsgericht Dortmund",
      "registernummer": "HRB 30453",
      "registerart": "HRB",
      "company_name": "GSD UG (haftungsbeschränkt)",
      "company_seat": "Dortmund",
      "details": "13.08.2025 (Bekanntmachungsdatum)\n\nNordrhein-Westfalen Amtsgericht Dortmund HRB 30453\nLöschungsankündigung\n\nGSD UG (haftungsbeschränkt)\nGesellschaft mit beschränkter Haftung\nDortmund\n\nDas Registergericht beabsichtigt die Gesellschaft von Amts wegen nach § 394 FamFG zu löschen. Die Frist zur Erhebung eines Widerspruchs ist auf zwei Monate festgesetzt."
    },
    {
      "date": "2025-08-13",
      "id": "120898",
      "original_text": "Registerbekanntmachung nach dem Umwandlungsgesetz\nNordrhein-Westfalen Amtsgericht Krefeld HRB 17240\nFreezingdata GmbH – Grefrath",
      "type": "Registerbekanntmachung nach dem Umwandlungsgesetz",
      "state": "Nordrhein-Westfalen",
      "amtsgericht": "Amtsgericht Krefeld",
      "registernummer": "HRB 17240",
      "registerart": "HRB",
      "company_name": "Freezingdata GmbH",
      "company_seat": "Grefrath",
      "details": "13.08.2025 (Bekanntmachungsdatum)\n\nNordrhein-Westfalen Amtsgericht Krefeld HRB 17240\nRegisterbekanntmachung nach dem Umwandlungsgesetz 13.08.2025 (Eintragungsdatum)\n\nFreezingdata GmbH\nGesellschaft mit beschränkter Haftung\nGrefrath\n\nDen Gläubigern der an der Verschmelzung beteiligten Rechtsträger ist, wenn sie binnen sechs Monaten nach dem Tag, an dem die Eintragung der Verschmelzung in das Register des Sitzes desjenigen Rechtsträgers, dessen Gläubiger sie sind, nach § 19 Absatz 3 UmwG als bekanntgemacht gilt, ihren Anspruch nach Grund und Höhe schriftlich anmelden, Sicherheit zu leisten, soweit sie nicht Befriedigung verlangen können. Dieses Recht steht den Gläubigern jedoch nur zu, wenn sie glaubhaft machen, dass durch die Verschmelzung die Erfüllung ihrer Forderung gefährdet wird."
    },
    {
      "date": "2025-08-13",
      "id": "120899",
      "original_text": "Löschungsankündigung\nNordrhein-Westfalen Amtsgericht Siegburg HRB 13110\nWVL GmbH – Troisdorf",
      "type": "Löschungsankündigung",
      "state": "Nordrhein-Westfalen",
      "amtsgericht": "Amtsgericht Siegburg",
      "registernummer": "HRB 13110",
      "registerart": "HRB",
      "company_name": "WVL GmbH",
      "company_seat": "Troisdorf",
      "details": "13.08.2025 (Bekanntmachungsdatum)\n\nNordrhein-Westfalen Amtsgericht Siegburg HRB 13110\nLöschungsankündigung\n\nWVL GmbH\nGesellschaft mit beschränkter Haftung\nTroisdorf\n\nDas Registergericht hat glaubhafte Kenntnis erlangt, dass die Gesellschaft vermögenslos geworden ist, da ein Insolvenzverfahren wegen Masseunzulänglichkeit nach § 208 ff InsO eingestellt wurde.\n\nEs ist daher beabsichtigt, die Gesellschaft nach § 394 FamFG im Handelsregister wegen Vermögenslosigkeit zu löschen.\nEinwände gegen die Löschung sind durch Widerspruch binnen einer Frist von 3 Monaten geltend zu machen, andernfalls die Löschung erfolgen wird.\n\nEinzulegen ist der Widerspruch bei dem Amtsgericht Siegburg, Neue Poststraße 16, 53721 Siegburg, und zwar entweder schriftlich in deutscher Sprache oder mündlich zur Niederschrift der Geschäftsstelle. Der Widerspruch kann auch zur Niederschrift der Geschäftsstelle eines jeden Amtsgerichts abgegeben werden. Der Widerspruch ist binnen der in der Verfügung bestimmten Frist einzulegen. Die Frist ist nur gewahrt, wenn der Widerspruch rechtzeitig bei dem Amtsgericht Siegburg eingeht, auch wenn der Widerspruch zur Niederschrift der Geschäftsstelle eines anderen Amtsgerichts abgegeben wurde. Die Frist beginnt jeweils mit der schriftlichen Bekanntgabe der Verfügung an die Beteiligten. Kann die schriftliche Bekanntgabe an einen Beteiligten nicht bewirkt werden, beginnt die Frist spätestens mit Ablauf von fünf Monaten nach Erlass der Verfügung. Die Bekanntgabe ist entweder durch Zustellung oder am dritten Tage nach Aufgabe zur Post bewirkt. Sofern die Löschung noch nicht erfolgt ist, kann der Widerspruch auch noch nach Ablauf der Frist eingelegt werden. Fällt das Ende der Frist auf einen Sonnabend, einen Sonntag oder einen allgemeinen Feiertag, endet die Frist mit Ablauf des nächsten Werktages. Der Widerspruch ist zu unterzeichnen. Eine Begründung des Widerspruchs ist nicht vorgeschrieben."
    },
    {
      "date": "2025-08-13",
      "id": "120900",
      "original_text": "Registerbekanntmachung nach dem Umwandlungsgesetz\nNordrhein-Westfalen Amtsgericht Köln HRB 121026\nStassi Holding GmbH – Köln",
      "type": "Registerbekanntmachung nach dem Umwandlungsgesetz",
      "state": "Nordrhein-Westfalen",
      "amtsgericht": "Amtsgericht Köln",
      "registernummer": "HRB 121026",
      "registerart": "HRB",
      "company_name": "Stassi Holding GmbH",
      "company_seat": "Köln",
      "details": "13.08.2025 (Bekanntmachungsdatum)\n\nNordrhein-Westfalen Amtsgericht Köln HRB 121026\nRegisterbekanntmachung nach dem Umwandlungsgesetz 13.08.2025 (Eintragungsdatum)\n\nStassi Holding GmbH\nGesellschaft mit beschränkter Haftung\nKöln\n\nDen Gläubigern der an der Verschmelzung beteiligten Rechtsträger ist, wenn sie binnen sechs Monaten nach dem Tag, an dem die Eintragung der Verschmelzung in das Register des Sitzes desjenigen Rechtsträgers, dessen Gläubiger sie sind, nach § 19 Absatz 3 UmwG als bekanntgemacht gilt, ihren Anspruch nach Grund und Höhe schriftlich anmelden, Sicherheit zu leisten, soweit sie nicht Befriedigung verlangen können. Dieses Recht steht den Gläubigern jedoch nur zu, wenn sie glaubhaft machen, dass durch die Verschmelzung die Erfüllung ihrer Forderung gefährdet wird."
    },
    {
      "date": "2025-08-13",
      "id": "120901",
      "original_text": "Löschungsankündigung\nNordrhein-Westfalen Amtsgericht Neuss HRB 19446\nKimedo GmbH – Neuss",
      "type": "Löschungsankündigung",
      "state": "Nordrhein-Westfalen",
      "amtsgericht": "Amtsgericht Neuss",
      "registernummer": "HRB 19446",
      "registerart": "HRB",
      "company_name": "Kimedo GmbH",
      "company_seat": "Neuss",
      "details": "13.08.2025 (Bekanntmachungsdatum)\n\nNordrhein-Westfalen Amtsgericht Neuss HRB 19446\nLöschungsankündigung 13.08.2025 (Eintragungsdatum)\n\nKimedo GmbH\nGesellschaft mit beschränkter Haftung\nNeuss\n\nDas Registergericht beabsichtigt die Gesellschaft von Amts wegen nach § 394 FamFG zu löschen. Die Frist zur Erhebung eines Widerspruchs ist auf einen Monat festgesetzt. Rechtsbehelfsbelehrung: Gegen diese Verfügung können Sie Widerspruch einlegen. Der Widerspruch ist bei dem Amtsgericht Neuss - Registergericht -, Breite Str. 48, 41460 Neuss schriftlich in deutscher Sprache oder zur Niederschrift der Geschäftsstelle einzulegen. Der Widerspruch kann auch zur Niederschrift der Geschäftsstelle eines jeden Amtsgerichtes abgegeben werden. Die Einlegung ist auch durch Übertragung eines elektronischen Dokuments an die elektronische Poststelle des Gerichts möglich. Das elektronische Dokument muss für die Bearbeitung durch das Gericht geeignet und mit einer qualifizierten elektronischen Signatur der verantwortenden Person versehen sein oder von der verantwortenden Person signiert und auf einem sicheren Übermittlungsweg gemäß § 130a ZPO nach näherer Maßgabe der Verordnung über die technischen Rahmenbedingungen des elektronischen Rechtsverkehrs und über das besondere elektronische Behördenpostfach (BGBl. I, S.3803) eingereicht werden. Weitere Informationen erhalten Sie auf der Internetseite www.justiz.de. Der Widerspruch muss spätestens innerhalb der gesetzten Frist nach der schriftlichen Bekanntgabe der Verfügung bei dem Amtsgericht - Registergericht - Neuss eingegangen sein. Dies gilt auch dann, wenn der Widerspruch zur Niederschrift der Geschäftsstelle eines anderen Amtsgerichtes abgegeben wurde. Die Frist beginnt mit der schriftlichen Bekanntgabe der Verfügung. Die Bekanntgabe ist entweder durch Zustellung oder am dritten Tage nach Aufgabe zur Post bewirkt. Fällt das Ende der Frist auf einen Sonntag, einen allgemeinen Feiertag oder Sonnabend, so endet die Frist mit Ablauf des nächsten Werktages. Der Widerspruch muss die Bezeichnung der angefochtenen Verfügung sowie die Erklärung enthalten, dass Widerspruch gegen diese Verfügung eingelegt wird. Er ist zu unterzeichnen und soll begründet werden."
    },
    {
      "date": "2025-08-13",
      "id": "120902",
      "original_text": "Löschungsankündigung\nNordrhein-Westfalen Amtsgericht Köln HRB 110696\nMARTEC Immobilien GmbH – Leverkusen",
      "type": "Löschungsankündigung",
      "state": "Nordrhein-Westfalen",
      "amtsgericht": "Amtsgericht Köln",
      "registernummer": "HRB 110696",
      "registerart": "HRB",
      "company_name": "MARTEC Immobilien GmbH",
      "company_seat": "Leverkusen",
      "details": "13.08.2025 (Bekanntmachungsdatum)\n\nNordrhein-Westfalen Amtsgericht Köln HRB 110696\nLöschungsankündigung\n\nMARTEC Immobilien GmbH\nGesellschaft mit beschränkter Haftung\nLeverkusen\n\nDas Registergericht beabsichtigt die Gesellschaft von Amts wegen nach § 394 FamFG zu löschen. Die Frist zur Erhebung eines Widerspruchs ist auf einen Monat festgesetzt."
    },
    {
      "date": "2025-08-13",
      "id": "120903",
      "original_text": "Registerbekanntmachung nach dem Umwandlungsgesetz\nNordrhein-Westfalen Amtsgericht Gelsenkirchen HRB 13088\nE-tat Verwaltungs- und Beratungsgesellschaft mbH – Gladbeck",
      "type": "Registerbekanntmachung nach dem Umwandlungsgesetz",
      "state": "Nordrhein-Westfalen",
      "amtsgericht": "Amtsgericht Gelsenkirchen",
      "registernummer": "HRB 13088",
      "registerart": "HRB",
      "company_name": "E-tat Verwaltungs- und Beratungsgesellschaft mbH",
      "company_seat": "Gladbeck",
      "details": "13.08.2025 (Bekanntmachungsdatum)\n\nNordrhein-Westfalen Amtsgericht Gelsenkirchen HRB 13088\nRegisterbekanntmachung nach dem Umwandlungsgesetz 13.08.2025 (Eintragungsdatum)\n\nE-tat Verwaltungs- und Beratungsgesellschaft mbH\nGesellschaft mit beschränkter Haftung\nGladbeck\n\nDen Gläubigern der an der Verschmelzung beteiligten Rechtsträger ist, wenn sie binnen sechs Monaten nach dem Tag, an dem die Eintragung der Verschmelzung in das Register des Sitzes desjenigen Rechtsträgers, dessen Gläubiger sie sind, nach § 19 Absatz 3 UmwG als bekanntgemacht gilt, ihren Anspruch nach Grund und Höhe schriftlich anmelden, Sicherheit zu leisten, soweit sie nicht Befriedigung verlangen können. Dieses Recht steht den Gläubigern jedoch nur zu, wenn sie glaubhaft machen, dass durch die Verschmelzung die Erfüllung ihrer Forderung gefährdet wird."
    },
    {
      "date": "2025-08-13",
      "id": "120904",
      "original_text": "Registerbekanntmachung nach dem Umwandlungsgesetz\nNordrhein-Westfalen Amtsgericht Gelsenkirchen HRB 12842\nE-tat Unternehmensberatung GmbH – Gladbeck",
      "type": "Registerbekanntmachung nach dem Umwandlungsgesetz",
      "state": "Nordrhein-Westfalen",
      "amtsgericht": "Amtsgericht Gelsenkirchen",
      "registernummer": "HRB 12842",
      "registerart": "HRB",
      "company_name": "E-tat Unternehmensberatung GmbH",
      "company_seat": "Gladbeck",
      "details": "13.08.2025 (Bekanntmachungsdatum)\n\nNordrhein-Westfalen Amtsgericht Gelsenkirchen HRB 12842\nRegisterbekanntmachung nach dem Umwandlungsgesetz 13.08.2025 (Eintragungsdatum)\n\nE-tat Unternehmensberatung GmbH\nGesellschaft mit beschränkter Haftung\nGladbeck\n\nDen Gläubigern der an der Verschmelzung beteiligten Rechtsträger ist, wenn sie binnen sechs Monaten nach dem Tag, an dem die Eintragung der Verschmelzung in das Register des Sitzes desjenigen Rechtsträgers, dessen Gläubiger sie sind, nach § 19 Absatz 3 UmwG als bekanntgemacht gilt, ihren Anspruch nach Grund und Höhe schriftlich anmelden, Sicherheit zu leisten, soweit sie nicht Befriedigung verlangen können. Dieses Recht steht den Gläubigern jedoch nur zu, wenn sie glaubhaft machen, dass durch die Verschmelzung die Erfüllung ihrer Forderung gefährdet wird."
    },
    {
      "date": "2025-08-13",
      "id": "120905",
      "original_text": "Löschungsankündigung\nNordrhein-Westfalen Amtsgericht Dortmund HRA 18726\nFOOTBALL CONCEPT GmbH & Co. KG – Dortmund",
      "type": "Löschungsankündigung",
      "state": "Nordrhein-Westfalen",
      "amtsgericht": "Amtsgericht Dortmund",
      "registernummer": "HRA 18726",
      "registerart": "HRA",
      "company_name": "FOOTBALL CONCEPT GmbH & Co. KG",
      "company_seat": "Dortmund",
      "details": "13.08.2025 (Bekanntmachungsdatum)\n\nNordrhein-Westfalen Amtsgericht Dortmund HRA 18726\nLöschungsankündigung\n\nFOOTBALL CONCEPT GmbH & Co. KG\nKommanditgesellschaft\nDortmund\n\nDas Registergericht beabsichtigt die Firma von Amts wegen nach §§ 31 Abs. 2 HGB, 393 FamFG zu löschen. Die Frist zur Erhebung eines Widerspruchs ist auf drei Monate festgesetzt."
    },
    {
      "date": "2025-08-13",
      "id": "120906",
      "original_text": "Registerbekanntmachung nach dem Umwandlungsgesetz\nNordrhein-Westfalen Amtsgericht Köln HRB 124351\nRunenburg GmbH – Leverkusen",
      "type": "Registerbekanntmachung nach dem Umwandlungsgesetz",
      "state": "Nordrhein-Westfalen",
      "amtsgericht": "Amtsgericht Köln",
      "registernummer": "HRB 124351",
      "registerart": "HRB",
      "company_name": "Runenburg GmbH",
      "company_seat": "Leverkusen",
      "details": "13.08.2025 (Bekanntmachungsdatum)\n\nNordrhein-Westfalen Amtsgericht Köln HRB 124351\nRegisterbekanntmachung nach dem Umwandlungsgesetz 13.08.2025 (Eintragungsdatum)\n\nRunenburg GmbH\nGesellschaft mit beschränkter Haftung\nLeverkusen\n\nDen Gläubigern der an der Ausgliederung beteiligten Rechtsträger ist, wenn sie binnen sechs Monaten nach dem Tag, an dem die Eintragung der Ausgliederung in das Register des Sitzes desjenigen Rechtsträgers, dessen Gläubiger sie sind, nach § 19 Absatz 3 UmwG als bekanntgemacht gilt, ihren Anspruch nach Grund und Höhe schriftlich anmelden, Sicherheit zu leisten, soweit sie nicht Befriedigung verlangen können. Dieses Recht steht den Gläubigern jedoch nur zu, wenn sie glaubhaft machen, dass durch die Ausgliederung die Erfüllung ihrer Forderung gefährdet wird."
    },
    {
      "date": "2025-08-13",
      "id": "120907",
      "original_text": "Registerbekanntmachung nach dem Umwandlungsgesetz\nNordrhein-Westfalen Amtsgericht Düsseldorf HRB 86980\nTHE SEARCH Sportmanagement GmbH – Düsseldorf",
      "type": "Registerbekanntmachung nach dem Umwandlungsgesetz",
      "state": "Nordrhein-Westfalen",
      "amtsgericht": "Amtsgericht Düsseldorf",
      "registernummer": "HRB 86980",
      "registerart": "HRB",
      "company_name": "THE SEARCH Sportmanagement GmbH",
      "company_seat": "Düsseldorf",
      "details": "13.08.2025 (Bekanntmachungsdatum)\n\nNordrhein-Westfalen Amtsgericht Düsseldorf HRB 86980\nRegisterbekanntmachung nach dem Umwandlungsgesetz 13.08.2025 (Eintragungsdatum)\n\nTHE SEARCH Sportmanagement GmbH\nGesellschaft mit beschränkter Haftung\nDüsseldorf\n\nDen Gläubigern der an der Verschmelzung beteiligten Rechtsträger ist, wenn sie binnen sechs Monaten nach dem Tag, an dem die Eintragung der Verschmelzung in das Register des Sitzes desjenigen Rechtsträgers, dessen Gläubiger sie sind, nach § 19 Absatz 3 UmwG als bekanntgemacht gilt, ihren Anspruch nach Grund und Höhe schriftlich anmelden, Sicherheit zu leisten, soweit sie nicht Befriedigung verlangen können. Dieses Recht steht den Gläubigern jedoch nur zu, wenn sie glaubhaft machen, dass durch die Verschmelzung die Erfüllung ihrer Forderung gefährdet wird."
    },
    {
      "date": "2025-08-13",
      "id": "120908",
      "original_text": "Löschungsankündigung\nNordrhein-Westfalen Amtsgericht Neuss HRB 23736\nKleineWeltbürger GmbH – Neuss",
      "type": "Löschungsankündigung",
      "state": "Nordrhein-Westfalen",
      "amtsgericht": "Amtsgericht Neuss",
      "registernummer": "HRB 23736",
      "registerart": "HRB",
      "company_name": "KleineWeltbürger GmbH",
      "company_seat": "Neuss",
      "details": "13.08.2025 (Bekanntmachungsdatum)\n\nNordrhein-Westfalen Amtsgericht Neuss HRB 23736\nLöschungsankündigung 12.08.2025 (Eintragungsdatum)\n\nKleineWeltbürger GmbH\nGesellschaft mit beschränkter Haftung\nNeuss\n\nDas Registergericht beabsichtigt die Gesellschaft von Amts wegen nach § 394 FamFG zu löschen. Die Frist zur Erhebung eines Widerspruchs ist auf einen Monat festgesetzt. Rechtsbehelfsbelehrung: Gegen diese Verfügung können Sie Widerspruch einlegen. Der Widerspruch ist bei dem Amtsgericht Neuss - Registergericht -, Breite Str. 48, 41460 Neuss schriftlich in deutscher Sprache oder zur Niederschrift der Geschäftsstelle einzulegen. Der Widerspruch kann auch zur Niederschrift der Geschäftsstelle eines jeden Amtsgerichtes abgegeben werden. Die Einlegung ist auch durch Übertragung eines elektronischen Dokuments an die elektronische Poststelle des Gerichts möglich. Das elektronische Dokument muss für die Bearbeitung durch das Gericht geeignet und mit einer qualifizierten elektronischen Signatur der verantwortenden Person versehen sein oder von der verantwortenden Person signiert und auf einem sicheren Übermittlungsweg gemäß § 130a ZPO nach näherer Maßgabe der Verordnung über die technischen Rahmenbedingungen des elektronischen Rechtsverkehrs und über das besondere elektronische Behördenpostfach (BGBl. I, S.3803) eingereicht werden. Weitere Informationen erhalten Sie auf der Internetseite www.justiz.de. Der Widerspruch muss spätestens innerhalb der gesetzten Frist nach der schriftlichen Bekanntgabe der Verfügung bei dem Amtsgericht - Registergericht - Neuss eingegangen sein. Dies gilt auch dann, wenn der Widerspruch zur Niederschrift der Geschäftsstelle eines anderen Amtsgerichtes abgegeben wurde. Die Frist beginnt mit der schriftlichen Bekanntgabe der Verfügung. Die Bekanntgabe ist entweder durch Zustellung oder am dritten Tage nach Aufgabe zur Post bewirkt. Fällt das Ende der Frist auf einen Sonntag, einen allgemeinen Feiertag oder Sonnabend, so endet die Frist mit Ablauf des nächsten Werktages. Der Widerspruch muss die Bezeichnung der angefochtenen Verfügung sowie die Erklärung enthalten, dass Widerspruch gegen diese Verfügung eingelegt wird. Er ist zu unterzeichnen und soll begründet werden."
    },
    {
      "date": "2025-08-13",
      "id": "120909",
      "original_text": "Registerbekanntmachung nach dem Umwandlungsgesetz\nNordrhein-Westfalen Amtsgericht Wuppertal HRB 11119\nSOLIDA-Werk Werkzeugtechnik GmbH – Remscheid",
      "type": "Registerbekanntmachung nach dem Umwandlungsgesetz",
      "state": "Nordrhein-Westfalen",
      "amtsgericht": "Amtsgericht Wuppertal",
      "registernummer": "HRB 11119",
      "registerart": "HRB",
      "company_name": "SOLIDA-Werk Werkzeugtechnik GmbH",
      "company_seat": "Remscheid",
      "details": "13.08.2025 (Bekanntmachungsdatum)\n\nNordrhein-Westfalen Amtsgericht Wuppertal HRB 11119\nRegisterbekanntmachung nach dem Umwandlungsgesetz 13.08.2025 (Eintragungsdatum)\n\nSOLIDA-Werk Werkzeugtechnik GmbH\nGesellschaft mit beschränkter Haftung\nRemscheid\n\nDen Gläubigern der an der Verschmelzung beteiligten Rechtsträger ist, wenn sie binnen sechs Monaten nach dem Tag, an dem die Eintragung der Verschmelzung in das Register des Sitzes desjenigen Rechtsträgers, dessen Gläubiger sie sind, nach § 19 Absatz 3 UmwG als bekanntgemacht gilt, ihren Anspruch nach Grund und Höhe schriftlich anmelden, Sicherheit zu leisten, soweit sie nicht Befriedigung verlangen können. Dieses Recht steht den Gläubigern jedoch nur zu, wenn sie glaubhaft machen, dass durch die Verschmelzung die Erfüllung ihrer Forderung gefährdet wird."
    },
    {
      "date": "2025-08-13",
      "id": "120910",
      "original_text": "Registerbekanntmachung nach dem Umwandlungsgesetz\nNordrhein-Westfalen Amtsgericht Köln HRB 101592\nI & U TV Produktion GmbH – Köln",
      "type": "Registerbekanntmachung nach dem Umwandlungsgesetz",
      "state": "Nordrhein-Westfalen",
      "amtsgericht": "Amtsgericht Köln",
      "registernummer": "HRB 101592",
      "registerart": "HRB",
      "company_name": "I & U TV Produktion GmbH",
      "company_seat": "Köln",
      "details": "13.08.2025 (Bekanntmachungsdatum)\n\nNordrhein-Westfalen Amtsgericht Köln HRB 101592\nRegisterbekanntmachung nach dem Umwandlungsgesetz 13.08.2025 (Eintragungsdatum)\n\nI & U TV Produktion GmbH\nGesellschaft mit beschränkter Haftung\nKöln\n\nDen Gläubigern der an der Verschmelzung beteiligten Rechtsträger ist, wenn sie binnen sechs Monaten nach dem Tag, an dem die Eintragung der Verschmelzung in das Register des Sitzes desjenigen Rechtsträgers, dessen Gläubiger sie sind, nach § 19 Absatz 3 UmwG als bekanntgemacht gilt, ihren Anspruch nach Grund und Höhe schriftlich anmelden, Sicherheit zu leisten, soweit sie nicht Befriedigung verlangen können. Dieses Recht steht den Gläubigern jedoch nur zu, wenn sie glaubhaft machen, dass durch die Verschmelzung die Erfüllung ihrer Forderung gefährdet wird."
    },
    {
      "date": "2025-08-13",
      "id": "120911",
      "original_text": "Einreichung neuer Dokumente\nNordrhein-Westfalen Amtsgericht Dortmund HRB 20663\nadesso SE – Dortmund",
      "type": "Einreichung neuer Dokumente",
      "state": "Nordrhein-Westfalen",
      "amtsgericht": "Amtsgericht Dortmund",
      "registernummer": "HRB 20663",
      "registerart": "HRB",
      "company_name": "adesso SE",
      "company_seat": "Dortmund",
      "details": "13.08.2025 (Bekanntmachungsdatum)\n\nNordrhein-Westfalen Amtsgericht Dortmund HRB 20663\nEinreichung neuer Dokumente\n\nadesso SE\nEuropäische Aktiengesellschaft (SE)\nDortmund\n\nDem Registergericht ist eine neue Liste der Mitglieder des Aufsichtsrates eingereicht worden."
    },
    {
      "date": "2025-08-13",
      "id": "120912",
      "original_text": "Löschungsankündigung\nNordrhein-Westfalen Amtsgericht Düsseldorf HRB 103302\nNaveta Distribution AG – Monheim am Rhein",
      "type": "Löschungsankündigung",
      "state": "Nordrhein-Westfalen",
      "amtsgericht": "Amtsgericht Düsseldorf",
      "registernummer": "HRB 103302",
      "registerart": "HRB",
      "company_name": "Naveta Distribution AG",
      "company_seat": "Monheim am Rhein",
      "details": "13.08.2025 (Bekanntmachungsdatum)\n\nNordrhein-Westfalen Amtsgericht Düsseldorf HRB 103302\nLöschungsankündigung\n\nNaveta Distribution AG\nAktiengesellschaft\nMonheim am Rhein\n\nDas Registergericht beabsichtigt die Gesellschaft von Amts wegen nach § 394 FamFG zu löschen. Die Frist zur Erhebung eines Widerspruchs ist auf 3 Wochen festgesetzt.\n\nRechtsbehelfsbelehrung:\nDas Widerspruchsrecht steht jedem zu, der an der Unterlassung der Löschung ein berechtigtes Interesse hat. Der Widerspruch ist bei dem Amtsgericht Düsseldorf -Registergericht-, Werdener Straße 1, 40227 Düsseldorf schriftlich in deutscher Sprache oder zur Niederschrift der Geschäftsstelle einzulegen. Der Widerspruch kann auch zur Niederschrift der Geschäftsstelle eines jeden Amtsgerichtes abgegeben werden. Die Einlegung ist auch durch Übertragung eines elektronischen Dokuments an die elektronische Poststelle des Gerichts möglich. Das elektronische Dokument muss für die Bearbeitung durch das Gericht geeignet und mit einer qualifizierten elektronischen Signatur der verantwortenden Person versehen sein oder von der verantwortenden Person signiert und auf einem sicheren Übermittlungsweg gemäß § 130a ZPO nach näherer Maßgabe der Verordnung über die technischen Rahmenbedingungen des elektronischen Rechtsverkehrs und über das besondere elektronische Behördenpostfach (BGBl. I, S.3803) eingereicht werden. Weitere Informationen erhalten Sie auf der Internetseite www.justiz.de.\nDer Widerspruch muss spätestens innerhalb der gesetzten Frist nach dem Datum der Bekanntmachung der Löschungsankündigung bei dem Amtsgericht - Registergericht - Düsseldorf eingegangen sein.  Dies gilt auch dann, wenn der Widerspruch zur Niederschrift der Geschäftsstelle eines anderen Amtsgerichtes abgegeben wurde. Die Frist beginnt mit dem Tage der Bekanntmachung der Löschungsankündigung in dem für die Bekanntmachung der Eintragungen in das Handelsregister bestimmten elektronischen Informations- und Kommunikationssystem nach § 10 des Handelsgesetzbuches. Fällt das Ende der Frist auf einen Sonntag, einen allgemeinen Feiertag oder Sonnabend, so endet die Frist mit Ablauf des nächsten Werktages.\nDer Widerspruch muss die Bezeichnung der angefochtenen Löschungsankündigung sowie die Erklärung enthalten, dass Widerspruch gegen diese Löschungsankündigung eingelegt wird. Er ist zu unterzeichnen und soll begründet werden."
    },
    {
      "date": "2025-08-13",
      "id": "120913",
      "original_text": "Registerbekanntmachung nach dem Umwandlungsgesetz\nNordrhein-Westfalen Amtsgericht Aachen HRB 20331\nTSL Green Growing Solutions GmbH – Stolberg",
      "type": "Registerbekanntmachung nach dem Umwandlungsgesetz",
      "state": "Nordrhein-Westfalen",
      "amtsgericht": "Amtsgericht Aachen",
      "registernummer": "HRB 20331",
      "registerart": "HRB",
      "company_name": "TSL Green Growing Solutions GmbH",
      "company_seat": "Stolberg",
      "details": "13.08.2025 (Bekanntmachungsdatum)\n\nNordrhein-Westfalen Amtsgericht Aachen HRB 20331\nRegisterbekanntmachung nach dem Umwandlungsgesetz 13.08.2025 (Eintragungsdatum)\n\nTSL Green Growing Solutions GmbH\nGesellschaft mit beschränkter Haftung\nStolberg\n\nDen Gläubigern der an der Verschmelzung beteiligten Rechtsträger ist, wenn sie binnen sechs Monaten nach dem Tag, an dem die Eintragung der Verschmelzung in das Register des Sitzes desjenigen Rechtsträgers, dessen Gläubiger sie sind, nach § 19 Absatz 3 UmwG als bekanntgemacht gilt, ihren Anspruch nach Grund und Höhe schriftlich anmelden, Sicherheit zu leisten, soweit sie nicht Befriedigung verlangen können. Dieses Recht steht den Gläubigern jedoch nur zu, wenn sie glaubhaft machen, dass durch die Verschmelzung die Erfüllung ihrer Forderung gefährdet wird."
    },
    {
      "date": "2025-08-13",
      "id": "120914",
      "original_text": "Registerbekanntmachung nach dem Umwandlungsgesetz\nNordrhein-Westfalen Amtsgericht Krefeld HRA 7520\nTinyTedd e.K. – Krefeld",
      "type": "Registerbekanntmachung nach dem Umwandlungsgesetz",
      "state": "Nordrhein-Westfalen",
      "amtsgericht": "Amtsgericht Krefeld",
      "registernummer": "HRA 7520",
      "registerart": "HRA",
      "company_name": "TinyTedd e.K.",
      "company_seat": "Krefeld",
      "details": "13.08.2025 (Bekanntmachungsdatum)\n\nNordrhein-Westfalen Amtsgericht Krefeld HRA 7520\nRegisterbekanntmachung nach dem Umwandlungsgesetz 13.08.2025 (Eintragungsdatum)\n\nTinyTedd e.K.\nEinzelkaufmann / Einzelkauffrau\nKrefeld\n\nDen Gläubigern der an der Ausgliederung beteiligten Rechtsträger ist, wenn sie binnen sechs Monaten nach dem Tag, an dem die Eintragung der Ausgliederung in das Register des Sitzes desjenigen Rechtsträgers, dessen Gläubiger sie sind, nach § 19 Absatz 3 UmwG als bekanntgemacht gilt, ihren Anspruch nach Grund und Höhe schriftlich anmelden, Sicherheit zu leisten, soweit sie nicht Befriedigung verlangen können. Dieses Recht steht den Gläubigern jedoch nur zu, wenn sie glaubhaft machen, dass durch die Ausgliederung die Erfüllung ihrer Forderung gefährdet wird."
    },
    {
      "date": "2025-08-13",
      "id": "120915",
      "original_text": "Registerbekanntmachung nach dem Umwandlungsgesetz\nNordrhein-Westfalen Amtsgericht Gelsenkirchen HRB 3865\nHABE Handels- und Beteiligungsgesellschaft Gladbeck mbH – Gladbeck",
      "type": "Registerbekanntmachung nach dem Umwandlungsgesetz",
      "state": "Nordrhein-Westfalen",
      "amtsgericht": "Amtsgericht Gelsenkirchen",
      "registernummer": "HRB 3865",
      "registerart": "HRB",
      "company_name": "HABE Handels- und Beteiligungsgesellschaft Gladbeck mbH",
      "company_seat": "Gladbeck",
      "details": "13.08.2025 (Bekanntmachungsdatum)\n\nNordrhein-Westfalen Amtsgericht Gelsenkirchen HRB 3865\nRegisterbekanntmachung nach dem Umwandlungsgesetz 13.08.2025 (Eintragungsdatum)\n\nHABE Handels- und Beteiligungsgesellschaft Gladbeck mbH\nGesellschaft mit beschränkter Haftung\nGladbeck\n\nDen Gläubigern der an der Verschmelzung beteiligten Rechtsträger ist, wenn sie binnen sechs Monaten nach dem Tag, an dem die Eintragung der Verschmelzung in das Register des Sitzes desjenigen Rechtsträgers, dessen Gläubiger sie sind, nach § 19 Absatz 3 UmwG als bekanntgemacht gilt, ihren Anspruch nach Grund und Höhe schriftlich anmelden, Sicherheit zu leisten, soweit sie nicht Befriedigung verlangen können. Dieses Recht steht den Gläubigern jedoch nur zu, wenn sie glaubhaft machen, dass durch die Verschmelzung die Erfüllung ihrer Forderung gefährdet wird."
    },
    {
      "date": "2025-08-13",
      "id": "120916",
      "original_text": "Registerbekanntmachung nach dem Umwandlungsgesetz\nNordrhein-Westfalen Amtsgericht Krefeld VR 4393\nDeutsche Lebens-Rettungs-Gesellschaft Ortsgruppe Krefeld 1913 e.V. – Krefeld",
      "type": "Registerbekanntmachung nach dem Umwandlungsgesetz",
      "state": "Nordrhein-Westfalen",
      "amtsgericht": "Amtsgericht Krefeld",
      "registernummer": "VR 4393",
      "registerart": "VR",
      "company_name": "Deutsche Lebens-Rettungs-Gesellschaft Ortsgruppe Krefeld 1913 e.V.",
      "company_seat": "Krefeld",
      "details": "13.08.2025 (Bekanntmachungsdatum)\n\nNordrhein-Westfalen Amtsgericht Krefeld VR 4393\nRegisterbekanntmachung nach dem Umwandlungsgesetz 12.08.2025 (Eintragungsdatum)\n\nDeutsche Lebens-Rettungs-Gesellschaft Ortsgruppe Krefeld 1913 e.V.\neingetragener Verein\nKrefeld\n\nDen Gläubigern der an der Verschmelzung beteiligten Rechtsträger ist, wenn sie binnen sechs Monaten nach dem Tag, an dem die Eintragung der Verschmelzung in das Register des Sitzes desjenigen Rechtsträgers, dessen Gläubiger sie sind, nach § 19 Absatz 3 UmwG als bekanntgemacht gilt, ihren Anspruch nach Grund und Höhe schriftlich anmelden, Sicherheit zu leisten, soweit sie nicht Befriedigung verlangen können. Dieses Recht steht den Gläubigern jedoch nur zu, wenn sie glaubhaft machen, dass durch die Verschmelzung die Erfüllung ihrer Forderung gefährdet wird."
    },
    {
      "date": "2025-08-13",
      "id": "120917",
      "original_text": "Registerbekanntmachung nach dem Umwandlungsgesetz\nNordrhein-Westfalen Amtsgericht Krefeld VR 4522\nDeutsche Lebens-Rettungs-Gesellschaft Ortsguppe Uerdingen 1927 e.V. – Krefeld",
      "type": "Registerbekanntmachung nach dem Umwandlungsgesetz",
      "state": "Nordrhein-Westfalen",
      "amtsgericht": "Amtsgericht Krefeld",
      "registernummer": "VR 4522",
      "registerart": "VR",
      "company_name": "Deutsche Lebens-Rettungs-Gesellschaft Ortsguppe Uerdingen 1927 e.V.",
      "company_seat": "Krefeld",
      "details": "13.08.2025 (Bekanntmachungsdatum)\n\nNordrhein-Westfalen Amtsgericht Krefeld VR 4522\nRegisterbekanntmachung nach dem Umwandlungsgesetz 12.08.2025 (Eintragungsdatum)\n\nDeutsche Lebens-Rettungs-Gesellschaft Ortsguppe Uerdingen 1927 e.V.\neingetragener Verein\nKrefeld\n\nDen Gläubigern der an der Verschmelzung beteiligten Rechtsträger ist, wenn sie binnen sechs Monaten nach dem Tag, an dem die Eintragung der Verschmelzung in das Register des Sitzes desjenigen Rechtsträgers, dessen Gläubiger sie sind, nach § 19 Absatz 3 UmwG als bekanntgemacht gilt, ihren Anspruch nach Grund und Höhe schriftlich anmelden, Sicherheit zu leisten, soweit sie nicht Befriedigung verlangen können. Dieses Recht steht den Gläubigern jedoch nur zu, wenn sie glaubhaft machen, dass durch die Verschmelzung die Erfüllung ihrer Forderung gefährdet wird."
    },
    {
      "date": "2025-08-13",
      "id": "120918",
      "original_text": "Registerbekanntmachung nach dem Umwandlungsgesetz\nNordrhein-Westfalen Amtsgericht Wuppertal HRB 23279\nSOLIDA Verwaltungs UG (haftungsbeschränkt) – Remscheid",
      "type": "Registerbekanntmachung nach dem Umwandlungsgesetz",
      "state": "Nordrhein-Westfalen",
      "amtsgericht": "Amtsgericht Wuppertal",
      "registernummer": "HRB 23279",
      "registerart": "HRB",
      "company_name": "SOLIDA Verwaltungs UG (haftungsbeschränkt)",
      "company_seat": "Remscheid",
      "details": "13.08.2025 (Bekanntmachungsdatum)\n\nNordrhein-Westfalen Amtsgericht Wuppertal HRB 23279\nRegisterbekanntmachung nach dem Umwandlungsgesetz 13.08.2025 (Eintragungsdatum)\n\nSOLIDA Verwaltungs UG (haftungsbeschränkt)\nGesellschaft mit beschränkter Haftung\nRemscheid\n\nDen Gläubigern der an der Verschmelzung beteiligten Rechtsträger ist, wenn sie binnen sechs Monaten nach dem Tag, an dem die Eintragung der Verschmelzung in das Register des Sitzes desjenigen Rechtsträgers, dessen Gläubiger sie sind, nach § 19 Absatz 3 UmwG als bekanntgemacht gilt, ihren Anspruch nach Grund und Höhe schriftlich anmelden, Sicherheit zu leisten, soweit sie nicht Befriedigung verlangen können. Dieses Recht steht den Gläubigern jedoch nur zu, wenn sie glaubhaft machen, dass durch die Verschmelzung die Erfüllung ihrer Forderung gefährdet wird."
    },
    {
      "date": "2025-08-13",
      "id": "120919",
      "original_text": "Registerbekanntmachung nach dem Umwandlungsgesetz\nNordrhein-Westfalen Amtsgericht Mönchengladbach HRB 1968\nReport Anzeigenblatt GmbH – Mönchengladbach",
      "type": "Registerbekanntmachung nach dem Umwandlungsgesetz",
      "state": "Nordrhein-Westfalen",
      "amtsgericht": "Amtsgericht Mönchengladbach",
      "registernummer": "HRB 1968",
      "registerart": "HRB",
      "company_name": "Report Anzeigenblatt GmbH",
      "company_seat": "Mönchengladbach",
      "details": "13.08.2025 (Bekanntmachungsdatum)\n\nNordrhein-Westfalen Amtsgericht Mönchengladbach HRB 1968\nRegisterbekanntmachung nach dem Umwandlungsgesetz 13.08.2025 (Eintragungsdatum)\n\nReport Anzeigenblatt GmbH\nGesellschaft mit beschränkter Haftung\nMönchengladbach\n\nDen Gläubigern der an der Verschmelzung beteiligten Rechtsträger ist, wenn sie binnen sechs Monaten nach dem Tag, an dem die Eintragung der Verschmelzung in das Register des Sitzes desjenigen Rechtsträgers, dessen Gläubiger sie sind, nach § 19 Absatz 3 UmwG als bekanntgemacht gilt, ihren Anspruch nach Grund und Höhe schriftlich anmelden, Sicherheit zu leisten, soweit sie nicht Befriedigung verlangen können. Dieses Recht steht den Gläubigern jedoch nur zu, wenn sie glaubhaft machen, dass durch die Verschmelzung die Erfüllung ihrer Forderung gefährdet wird."
    },
    {
      "date": "2025-08-13",
      "id": "120920",
      "original_text": "Registerbekanntmachung nach dem Umwandlungsgesetz\nNordrhein-Westfalen Amtsgericht Düsseldorf HRB 100041\nFing GmbH – Düsseldorf",
      "type": "Registerbekanntmachung nach dem Umwandlungsgesetz",
      "state": "Nordrhein-Westfalen",
      "amtsgericht": "Amtsgericht Düsseldorf",
      "registernummer": "HRB 100041",
      "registerart": "HRB",
      "company_name": "Fing GmbH",
      "company_seat": "Düsseldorf",
      "details": "13.08.2025 (Bekanntmachungsdatum)\n\nNordrhein-Westfalen Amtsgericht Düsseldorf HRB 100041\nRegisterbekanntmachung nach dem Umwandlungsgesetz 13.08.2025 (Eintragungsdatum)\n\nFing GmbH\nGesellschaft mit beschränkter Haftung\nDüsseldorf\n\nDen Gläubigern der an der Verschmelzung beteiligten Rechtsträger ist, wenn sie binnen sechs Monaten nach dem Tag, an dem die Eintragung der Verschmelzung in das Register des Sitzes desjenigen Rechtsträgers, dessen Gläubiger sie sind, nach § 19 Absatz 3 UmwG als bekanntgemacht gilt, ihren Anspruch nach Grund und Höhe schriftlich anmelden, Sicherheit zu leisten, soweit sie nicht Befriedigung verlangen können. Dieses Recht steht den Gläubigern jedoch nur zu, wenn sie glaubhaft machen, dass durch die Verschmelzung die Erfüllung ihrer Forderung gefährdet wird."
    },
    {
      "date": "2025-08-13",
      "id": "120921",
      "original_text": "Löschungsankündigung\nNordrhein-Westfalen Amtsgericht Iserlohn HRB 9879\nSigma-Six GmbH – Plettenberg",
      "type": "Löschungsankündigung",
      "state": "Nordrhein-Westfalen",
      "amtsgericht": "Amtsgericht Iserlohn",
      "registernummer": "HRB 9879",
      "registerart": "HRB",
      "company_name": "Sigma-Six GmbH",
      "company_seat": "Plettenberg",
      "details": "13.08.2025 (Bekanntmachungsdatum)\n\nNordrhein-Westfalen Amtsgericht Iserlohn HRB 9879\nLöschungsankündigung\n\nSigma-Six GmbH\nGesellschaft mit beschränkter Haftung\nPlettenberg\n\nHRB 9879\n\nSigma-Six GmbH, Plettenberg\nDas Registergericht beabsichtigt die im Handelsregister eingetragene Gesellschaft gemäß § 394 Abs. 1 FamFG wegen Vermögenslosigkeit von Amts wegen zu löschen. Gegen diese Verfügung kann Widerspruch eingelegt werden. Die Frist zur Erhebung eines Widerspruchs gegen die beabsichtigte Löschung von Amts wegen ist auf zwei Monate festgesetzt.\nRechtsbehelfsbelehrung:\nGegen diese Verfügung können Sie Widerspruch einlegen.\nDer Widerspruch ist bei dem Amtsgericht Iserlohn, Friedrichstraße 108/110, 58636 Iserlohn schriftlich in deutscher Sprache oder zur Niederschrift der Geschäftsstelle einzulegen. Der Widerspruch kann auch zur Niederschrift der Geschäftsstelle eines jeden Amtsgerichts abgegeben werden.\nDer Widerspruch muss spätestens innerhalb der gesetzten Frist bei dem Amtsgericht Iserlohn eingegangen sein. Dies gilt auch dann, wenn der Widerspruch zur Niederschrift der Geschäftsstelle eines anderen Amtsgerichtes abgegeben wurde. Die Frist beginnt mit der Veröffentlichung. Fällt das Ende der Frist auf einen Sonntag, einen allgemeinen Feiertag oder Sonnabend, so endet die Frist mit Ablauf des nächsten Werktages.\nDer Widerspruch muss die Bezeichnung der angefochtenen Verfügung sowie die Erklärung enthalten, dass Widerspruch gegen diese Verfügung eingelegt wird. Er ist zu unterzeichnen und soll begründet werden."
    },
    {
      "date": "2025-08-13",
      "id": "120922",
      "original_text": "Registerbekanntmachung nach dem Umwandlungsgesetz\nNordrhein-Westfalen Amtsgericht Duisburg HRB 26564\nALTANA New Technologies GmbH – Wesel",
      "type": "Registerbekanntmachung nach dem Umwandlungsgesetz",
      "state": "Nordrhein-Westfalen",
      "amtsgericht": "Amtsgericht Duisburg",
      "registernummer": "HRB 26564",
      "registerart": "HRB",
      "company_name": "ALTANA New Technologies GmbH",
      "company_seat": "Wesel",
      "details": "13.08.2025 (Bekanntmachungsdatum)\n\nNordrhein-Westfalen Amtsgericht Duisburg HRB 26564\nRegisterbekanntmachung nach dem Umwandlungsgesetz 13.08.2025 (Eintragungsdatum)\n\nALTANA New Technologies GmbH\nGesellschaft mit beschränkter Haftung\nWesel\n\nDie Gesellschaft hat Gläubigern, deren Forderungen vor dieser Bekanntmachung begründet worden sind, Sicherheit zu leisten, soweit sie nicht Befriedigung verlangen können, wenn sie sich binnen sechs Monaten zu diesem Zweck melden."
    },
    {
      "date": "2025-08-13",
      "id": "120923",
      "original_text": "Registerbekanntmachung nach dem Umwandlungsgesetz\nNordrhein-Westfalen Amtsgericht Bielefeld HRB 40978\nAD. engineering GmbH – Bielefeld",
      "type": "Registerbekanntmachung nach dem Umwandlungsgesetz",
      "state": "Nordrhein-Westfalen",
      "amtsgericht": "Amtsgericht Bielefeld",
      "registernummer": "HRB 40978",
      "registerart": "HRB",
      "company_name": "AD. engineering GmbH",
      "company_seat": "Bielefeld",
      "details": "13.08.2025 (Bekanntmachungsdatum)\n\nNordrhein-Westfalen Amtsgericht Bielefeld HRB 40978\nRegisterbekanntmachung nach dem Umwandlungsgesetz 13.08.2025 (Eintragungsdatum)\n\nAD. engineering GmbH\nGesellschaft mit beschränkter Haftung\nBielefeld\n\nDen Gläubigern der an der Verschmelzung beteiligten Rechtsträger ist, wenn sie binnen sechs Monaten nach dem Tag, an dem die Eintragung der Verschmelzung in das Register des Sitzes desjenigen Rechtsträgers, dessen Gläubiger sie sind, nach § 19 Absatz 3 UmwG als bekanntgemacht gilt, ihren Anspruch nach Grund und Höhe schriftlich anmelden, Sicherheit zu leisten, soweit sie nicht Befriedigung verlangen können. Dieses Recht steht den Gläubigern jedoch nur zu, wenn sie glaubhaft machen, dass durch die Verschmelzung die Erfüllung ihrer Forderung gefährdet wird."
    },
    {
      "date": "2025-08-13",
      "id": "120924",
      "original_text": "Registerbekanntmachung nach dem Umwandlungsgesetz\nNordrhein-Westfalen Amtsgericht Aachen HRB 23922\nTS Consulting UG (haftungsbeschränkt) – Stolberg",
      "type": "Registerbekanntmachung nach dem Umwandlungsgesetz",
      "state": "Nordrhein-Westfalen",
      "amtsgericht": "Amtsgericht Aachen",
      "registernummer": "HRB 23922",
      "registerart": "HRB",
      "company_name": "TS Consulting UG (haftungsbeschränkt)",
      "company_seat": "Stolberg",
      "details": "13.08.2025 (Bekanntmachungsdatum)\n\nNordrhein-Westfalen Amtsgericht Aachen HRB 23922\nRegisterbekanntmachung nach dem Umwandlungsgesetz 13.08.2025 (Eintragungsdatum)\n\nTS Consulting UG (haftungsbeschränkt)\nGesellschaft mit beschränkter Haftung\nStolberg\n\nDen Gläubigern der an der Verschmelzung beteiligten Rechtsträger ist, wenn sie binnen sechs Monaten nach dem Tag, an dem die Eintragung der Verschmelzung in das Register des Sitzes desjenigen Rechtsträgers, dessen Gläubiger sie sind, nach § 19 Absatz 3 UmwG als bekanntgemacht gilt, ihren Anspruch nach Grund und Höhe schriftlich anmelden, Sicherheit zu leisten, soweit sie nicht Befriedigung verlangen können. Dieses Recht steht den Gläubigern jedoch nur zu, wenn sie glaubhaft machen, dass durch die Verschmelzung die Erfüllung ihrer Forderung gefährdet wird."
    },
    {
      "date": "2025-08-13",
      "id": "120925",
      "original_text": "Registerbekanntmachung nach dem Umwandlungsgesetz\nNordrhein-Westfalen Amtsgericht Aachen HRB 21614\nFrauenrath Property GmbH – Heinsberg",
      "type": "Registerbekanntmachung nach dem Umwandlungsgesetz",
      "state": "Nordrhein-Westfalen",
      "amtsgericht": "Amtsgericht Aachen",
      "registernummer": "HRB 21614",
      "registerart": "HRB",
      "company_name": "Frauenrath Property GmbH",
      "company_seat": "Heinsberg",
      "details": "13.08.2025 (Bekanntmachungsdatum)\n\nNordrhein-Westfalen Amtsgericht Aachen HRB 21614\nRegisterbekanntmachung nach dem Umwandlungsgesetz 13.08.2025 (Eintragungsdatum)\n\nFrauenrath Property GmbH\nGesellschaft mit beschränkter Haftung\nHeinsberg\n\nDen Gläubigern der an der Verschmelzung beteiligten Rechtsträger ist, wenn sie binnen sechs Monaten nach dem Tag, an dem die Eintragung der Verschmelzung in das Register des Sitzes derjenigen Rechtsträger deren Gläubiger sie sind, nach § 19 Absatz 3 UmwG als bekanntgemacht gilt, ihren Anspruch nach Grund und Höhe schriftlich anmelden, Sicherheit zu leisten, soweit sie nicht Befriedigung verlangen können. Dieses Recht steht den Gläubigern jedoch nur zu, wenn sie glaubhaft machen, dass durch die Verschmelzung die Erfüllung ihrer Forderung gefährdet wird."
    },
    {
      "date": "2025-08-13",
      "id": "120926",
      "original_text": "Löschungsankündigung\nNordrhein-Westfalen Amtsgericht Dortmund HRB 16794 früher Amtsgericht Castrop-Rauxel\nFGS Handelsgesellschaft mbH – Castrop-Rauxel",
      "type": "Löschungsankündigung",
      "state": "Nordrhein-Westfalen",
      "amtsgericht": "Amtsgericht Dortmund",
      "registernummer": "HRB 16794",
      "registerart": "HRB",
      "company_name": "FGS Handelsgesellschaft mbH",
      "company_seat": "Castrop-Rauxel",
      "former_amtsgericht": "Castrop-Rauxel",
      "details": "13.08.2025 (Bekanntmachungsdatum)\n\nNordrhein-Westfalen Amtsgericht Dortmund HRB 16794 früher Amtsgericht Castrop-Rauxel\nLöschungsankündigung\n\nFGS Handelsgesellschaft mbH\nGesellschaft mit beschränkter Haftung\nCastrop-Rauxel\n\nDas Registergericht beabsichtigt die Gesellschaft von Amts wegen nach § 394 FamFG zu löschen. Die Frist zur Erhebung eines Widerspruchs ist auf zwei Monate festgesetzt."
    },
    {
      "date": "2025-08-13",
      "id": "120927",
      "original_text": "Registerbekanntmachung nach dem Umwandlungsgesetz\nNordrhein-Westfalen Amtsgericht Düsseldorf HRB 85500\nLiva Europe GmbH – Düsseldorf",
      "type": "Registerbekanntmachung nach dem Umwandlungsgesetz",
      "state": "Nordrhein-Westfalen",
      "amtsgericht": "Amtsgericht Düsseldorf",
      "registernummer": "HRB 85500",
      "registerart": "HRB",
      "company_name": "Liva Europe GmbH",
      "company_seat": "Düsseldorf",
      "details": "13.08.2025 (Bekanntmachungsdatum)\n\nNordrhein-Westfalen Amtsgericht Düsseldorf HRB 85500\nRegisterbekanntmachung nach dem Umwandlungsgesetz 13.08.2025 (Eintragungsdatum)\n\nLiva Europe GmbH\nGesellschaft mit beschränkter Haftung\nDüsseldorf\n\nDen Gläubigern der an der Verschmelzung beteiligten Rechtsträger ist, wenn sie binnen sechs Monaten nach dem Tag, an dem die Eintragung der Verschmelzung in das Register des Sitzes desjenigen Rechtsträgers, dessen Gläubiger sie sind, nach § 19 Absatz 3 UmwG als bekanntgemacht gilt, ihren Anspruch nach Grund und Höhe schriftlich anmelden, Sicherheit zu leisten, soweit sie nicht Befriedigung verlangen können. Dieses Recht steht den Gläubigern jedoch nur zu, wenn sie glaubhaft machen, dass durch die Verschmelzung die Erfüllung ihrer Forderung gefährdet wird."
    },
    {
      "date": "2025-08-13",
      "id": "120928",
      "original_text": "Registerbekanntmachung nach dem Umwandlungsgesetz\nNordrhein-Westfalen Amtsgericht Duisburg HRB 31658\nHELIOSONIC GmbH – Wesel",
      "type": "Registerbekanntmachung nach dem Umwandlungsgesetz",
      "state": "Nordrhein-Westfalen",
      "amtsgericht": "Amtsgericht Duisburg",
      "registernummer": "HRB 31658",
      "registerart": "HRB",
      "company_name": "HELIOSONIC GmbH",
      "company_seat": "Wesel",
      "details": "13.08.2025 (Bekanntmachungsdatum)\n\nNordrhein-Westfalen Amtsgericht Duisburg HRB 31658\nRegisterbekanntmachung nach dem Umwandlungsgesetz 13.08.2025 (Eintragungsdatum)\n\nHELIOSONIC GmbH\nGesellschaft mit beschränkter Haftung\nWesel\n\nDie Gesellschaft hat Gläubigern, deren Forderungen vor dieser Bekanntmachung begründet worden sind, Sicherheit zu leisten, soweit sie nicht Befriedigung verlangen können, wenn sie sich binnen sechs Monaten zu diesem Zweck melden."
    },
    {
      "date": "2025-08-13",
      "id": "120929",
      "original_text": "Registerbekanntmachung nach dem Umwandlungsgesetz\nNordrhein-Westfalen Amtsgericht Aachen HRB 14593\nFrauenrath Projektgesellschaft Erkelenz GmbH – Heinsberg",
      "type": "Registerbekanntmachung nach dem Umwandlungsgesetz",
      "state": "Nordrhein-Westfalen",
      "amtsgericht": "Amtsgericht Aachen",
      "registernummer": "HRB 14593",
      "registerart": "HRB",
      "company_name": "Frauenrath Projektgesellschaft Erkelenz GmbH",
      "company_seat": "Heinsberg",
      "details": "13.08.2025 (Bekanntmachungsdatum)\n\nNordrhein-Westfalen Amtsgericht Aachen HRB 14593\nRegisterbekanntmachung nach dem Umwandlungsgesetz 13.08.2025 (Eintragungsdatum)\n\nFrauenrath Projektgesellschaft Erkelenz GmbH\nGesellschaft mit beschränkter Haftung\nHeinsberg\n\nDen Gläubigern der an der Verschmelzung beteiligten Rechtsträger ist, wenn sie binnen sechs Monaten nach dem Tag, an dem die Eintragung der Verschmelzung in das Register des Sitzes derjenigen Rechtsträger deren Gläubiger sie sind, nach § 19 Absatz 3 UmwG als bekanntgemacht gilt, ihren Anspruch nach Grund und Höhe schriftlich anmelden, Sicherheit zu leisten, soweit sie nicht Befriedigung verlangen können. Dieses Recht steht den Gläubigern jedoch nur zu, wenn sie glaubhaft machen, dass durch die Verschmelzung die Erfüllung ihrer Forderung gefährdet wird."
    },
    {
      "date": "2025-08-13",
      "id": "120930",
      "original_text": "Registerbekanntmachung nach dem Umwandlungsgesetz\nNordrhein-Westfalen Amtsgericht Krefeld VR 4615\nDeutsche Lebens-Rettungs-Gesellschaft Ortsgruppe Linn e.V. – Krefeld",
      "type": "Registerbekanntmachung nach dem Umwandlungsgesetz",
      "state": "Nordrhein-Westfalen",
      "amtsgericht": "Amtsgericht Krefeld",
      "registernummer": "VR 4615",
      "registerart": "VR",
      "company_name": "Deutsche Lebens-Rettungs-Gesellschaft Ortsgruppe Linn e.V.",
      "company_seat": "Krefeld",
      "details": "13.08.2025 (Bekanntmachungsdatum)\n\nNordrhein-Westfalen Amtsgericht Krefeld VR 4615\nRegisterbekanntmachung nach dem Umwandlungsgesetz 12.08.2025 (Eintragungsdatum)\n\nDeutsche Lebens-Rettungs-Gesellschaft Ortsgruppe Linn e.V.\neingetragener Verein\nKrefeld\n\nDen Gläubigern der an der Verschmelzung beteiligten Rechtsträger ist, wenn sie binnen sechs Monaten nach dem Tag, an dem die Eintragung der Verschmelzung in das Register des Sitzes desjenigen Rechtsträgers, dessen Gläubiger sie sind, nach § 19 Absatz 3 UmwG als bekanntgemacht gilt, ihren Anspruch nach Grund und Höhe schriftlich anmelden, Sicherheit zu leisten, soweit sie nicht Befriedigung verlangen können. Dieses Recht steht den Gläubigern jedoch nur zu, wenn sie glaubhaft machen, dass durch die Verschmelzung die Erfüllung ihrer Forderung gefährdet wird."
    },
    {
      "date": "2025-08-13",
      "id": "120931",
      "original_text": "Registerbekanntmachung nach dem Umwandlungsgesetz\nNordrhein-Westfalen Amtsgericht Krefeld VR 3223\nDeutsche Lebens-Rettungs-Gesellschaft Ortsgruppe Bockum e.V. – Krefeld",
      "type": "Registerbekanntmachung nach dem Umwandlungsgesetz",
      "state": "Nordrhein-Westfalen",
      "amtsgericht": "Amtsgericht Krefeld",
      "registernummer": "VR 3223",
      "registerart": "VR",
      "company_name": "Deutsche Lebens-Rettungs-Gesellschaft Ortsgruppe Bockum e.V.",
      "company_seat": "Krefeld",
      "details": "13.08.2025 (Bekanntmachungsdatum)\n\nNordrhein-Westfalen Amtsgericht Krefeld VR 3223\nRegisterbekanntmachung nach dem Umwandlungsgesetz 12.08.2025 (Eintragungsdatum)\n\nDeutsche Lebens-Rettungs-Gesellschaft Ortsgruppe Bockum e.V.\neingetragener Verein\nKrefeld\n\nDen Gläubigern der an der Verschmelzung beteiligten Rechtsträger ist, wenn sie binnen sechs Monaten nach dem Tag, an dem die Eintragung der Verschmelzung in das Register des Sitzes desjenigen Rechtsträgers, dessen Gläubiger sie sind, nach § 19 Absatz 3 UmwG als bekanntgemacht gilt, ihren Anspruch nach Grund und Höhe schriftlich anmelden, Sicherheit zu leisten, soweit sie nicht Befriedigung verlangen können. Dieses Recht steht den Gläubigern jedoch nur zu, wenn sie glaubhaft machen, dass durch die Verschmelzung die Erfüllung ihrer Forderung gefährdet wird."
    },
    {
      "date": "2025-08-13",
      "id": "120932",
      "original_text": "Löschungsankündigung\nNordrhein-Westfalen Amtsgericht Düsseldorf HRB 93375\nR.L Drive GmbH – Düsseldorf",
      "type": "Löschungsankündigung",
      "state": "Nordrhein-Westfalen",
      "amtsgericht": "Amtsgericht Düsseldorf",
      "registernummer": "HRB 93375",
      "registerart": "HRB",
      "company_name": "R.L Drive GmbH",
      "company_seat": "Düsseldorf",
      "details": "13.08.2025 (Bekanntmachungsdatum)\n\nNordrhein-Westfalen Amtsgericht Düsseldorf HRB 93375\nLöschungsankündigung\n\nR.L Drive GmbH\nGesellschaft mit beschränkter Haftung\nDüsseldorf\n\nDas Registergericht beabsichtigt die Gesellschaft von Amts wegen nach § 394 FamFG zu löschen. Die Frist zur Erhebung eines Widerspruchs ist auf 3 Wochen festgesetzt.\n\nRechtsbehelfsbelehrung:\nDas Widerspruchsrecht steht jedem zu, der an der Unterlassung der Löschung ein berechtigtes Interesse hat. Der Widerspruch ist bei dem Amtsgericht Düsseldorf -Registergericht-, Werdener Straße 1, 40227 Düsseldorf schriftlich in deutscher Sprache oder zur Niederschrift der Geschäftsstelle einzulegen. Der Widerspruch kann auch zur Niederschrift der Geschäftsstelle eines jeden Amtsgerichtes abgegeben werden. Die Einlegung ist auch durch Übertragung eines elektronischen Dokuments an die elektronische Poststelle des Gerichts möglich. Das elektronische Dokument muss für die Bearbeitung durch das Gericht geeignet und mit einer qualifizierten elektronischen Signatur der verantwortenden Person versehen sein oder von der verantwortenden Person signiert und auf einem sicheren Übermittlungsweg gemäß § 130a ZPO nach näherer Maßgabe der Verordnung über die technischen Rahmenbedingungen des elektronischen Rechtsverkehrs und über das besondere elektronische Behördenpostfach (BGBl. I, S.3803) eingereicht werden. Weitere Informationen erhalten Sie auf der Internetseite www.justiz.de.\nDer Widerspruch muss spätestens innerhalb der gesetzten Frist nach dem Datum der Bekanntmachung der Löschungsankündigung bei dem Amtsgericht - Registergericht - Düsseldorf eingegangen sein.  Dies gilt auch dann, wenn der Widerspruch zur Niederschrift der Geschäftsstelle eines anderen Amtsgerichtes abgegeben wurde. Die Frist beginnt mit dem Tage der Bekanntmachung der Löschungsankündigung in dem für die Bekanntmachung der Eintragungen in das Handelsregister bestimmten elektronischen Informations- und Kommunikationssystem nach § 10 des Handelsgesetzbuches. Fällt das Ende der Frist auf einen Sonntag, einen allgemeinen Feiertag oder Sonnabend, so endet die Frist mit Ablauf des nächsten Werktages.\nDer Widerspruch muss die Bezeichnung der angefochtenen Löschungsankündigung sowie die Erklärung enthalten, dass Widerspruch gegen diese Löschungsankündigung eingelegt wird. Er ist zu unterzeichnen und soll begründet werden."
    },
    {
      "date": "2025-08-13",
      "id": "120933",
      "original_text": "Löschungsankündigung\nNordrhein-Westfalen Amtsgericht Düsseldorf HRA 20862\nVierte Artemis GmbH & Co. KG – Düsseldorf",
      "type": "Löschungsankündigung",
      "state": "Nordrhein-Westfalen",
      "amtsgericht": "Amtsgericht Düsseldorf",
      "registernummer": "HRA 20862",
      "registerart": "HRA",
      "company_name": "Vierte Artemis GmbH & Co. KG",
      "company_seat": "Düsseldorf",
      "details": "13.08.2025 (Bekanntmachungsdatum)\n\nNordrhein-Westfalen Amtsgericht Düsseldorf HRA 20862\nLöschungsankündigung\n\nVierte Artemis GmbH & Co. KG\nKommanditgesellschaft\nDüsseldorf\n\nDas Registergericht beabsichtigt die Firma wegen Vermögenslosigkeit von Amts wegen nach § 394 Abs. 4 FamFG zu löschen. Die Frist zur Erhebung eines Widerspruchs ist auf 3 Wochen festgesetzt.\n\nRechtsbehelfsbelehrung:\nDas Widerspruchsrecht steht jedem zu, der an der Unterlassung der Löschung ein berechtigtes Interesse hat. Der Widerspruch ist bei dem Amtsgericht Düsseldorf -Registergericht-, Werdener Straße 1, 40227 Düsseldorf schriftlich in deutscher Sprache oder zur Niederschrift der Geschäftsstelle einzulegen. Der Widerspruch kann auch zur Niederschrift der Geschäftsstelle eines jeden Amtsgerichtes abgegeben werden. Die Einlegung ist auch durch Übertragung eines elektronischen Dokuments an die elektronische Poststelle des Gerichts möglich. Das elektronische Dokument muss für die Bearbeitung durch das Gericht geeignet und mit einer qualifizierten elektronischen Signatur der verantwortenden Person versehen sein oder von der verantwortenden Person signiert und auf einem sicheren Übermittlungsweg gemäß § 130a ZPO nach näherer Maßgabe der Verordnung über die technischen Rahmenbedingungen des elektronischen Rechtsverkehrs und über das besondere elektronische Behördenpostfach (BGBl. I, S.3803) eingereicht werden. Weitere Informationen erhalten Sie auf der Internetseite www.justiz.de.\nDer Widerspruch muss spätestens innerhalb der gesetzten Frist nach dem Datum der Bekanntmachung der Löschungsankündigung bei dem Amtsgericht - Registergericht - Düsseldorf eingegangen sein.  Dies gilt auch dann, wenn der Widerspruch zur Niederschrift der Geschäftsstelle eines anderen Amtsgerichtes abgegeben wurde. Die Frist beginnt mit dem Tage der Bekanntmachung der Löschungsankündigung in dem für die Bekanntmachung der Eintragungen in das Handelsregister bestimmten elektronischen Informations- und Kommunikationssystem nach § 10 des Handelsgesetzbuches. Fällt das Ende der Frist auf einen Sonntag, einen allgemeinen Feiertag oder Sonnabend, so endet die Frist mit Ablauf des nächsten Werktages.\nDer Widerspruch muss die Bezeichnung der angefochtenen Löschungsankündigung sowie die Erklärung enthalten, dass Widerspruch gegen diese Löschungsankündigung eingelegt wird. Er ist zu unterzeichnen und soll begründet werden."
    },
    {
      "date": "2025-08-13",
      "id": "120934",
      "original_text": "Registerbekanntmachung nach dem Umwandlungsgesetz\nBaden-Württemberg Amtsgericht Stuttgart HRB 104224\nGross Apparatebau GmbH – Ilsfeld",
      "type": "Registerbekanntmachung nach dem Umwandlungsgesetz",
      "state": "Baden-Württemberg",
      "amtsgericht": "Amtsgericht Stuttgart",
      "registernummer": "HRB 104224",
      "registerart": "HRB",
      "company_name": "Gross Apparatebau GmbH",
      "company_seat": "Ilsfeld",
      "details": "13.08.2025 (Bekanntmachungsdatum)\n\nBaden-Württemberg Amtsgericht Stuttgart HRB 104224\nRegisterbekanntmachung nach dem Umwandlungsgesetz 13.08.2025 (Eintragungsdatum)\n\nGross Apparatebau GmbH\nGesellschaft mit beschränkter Haftung\nIlsfeld\n\nAls nicht eingetragen wird bekanntgemacht:\nDen Gläubigern der an der Verschmelzung beteiligten Rechtsträger ist, wenn sie binnen sechs Monaten nach dem Tag, an dem die Eintragung der Verschmelzung in das Register des Sitzes desjenigen Rechtsträgers, dessen Gläubiger sie sind, nach § 19 Abs. 3 UmwG als bekanntgemacht gilt, ihren Anspruch nach Grund und Höhe schriftlich anmelden, Sicherheit zu leisten, soweit sie nicht Befriedigung verlangen können. Dieses Recht steht den Gläubigern jedoch nur zu, wenn sie glaubhaft machen, dass durch die Verschmelzung die Erfüllung ihrer Forderung gefährdet wird."
    },
    {
      "date": "2025-08-13",
      "id": "120935",
      "original_text": "Löschungsankündigung\nHessen Amtsgericht Eschwege HRB 2820\nSportinternat Bad Sooden-Allendorf gemeinnützige Unternehmergesellschaft (haftungsbeschränkt) – Bad Sooden-Allendorf",
      "type": "Löschungsankündigung",
      "state": "Hessen",
      "amtsgericht": "Amtsgericht Eschwege",
      "registernummer": "HRB 2820",
      "registerart": "HRB",
      "company_name": "Sportinternat Bad Sooden-Allendorf gemeinnützige Unternehmergesellschaft (haftungsbeschränkt)",
      "company_seat": "Bad Sooden-Allendorf",
      "details": "13.08.2025 (Bekanntmachungsdatum)\n\nHessen Amtsgericht Eschwege HRB 2820\nLöschungsankündigung\n\nSportinternat Bad Sooden-Allendorf gemeinnützige Unternehmergesellschaft (haftungsbeschränkt)\nGesellschaft mit beschränkter Haftung\nBad Sooden-Allendorf\n\nDas Registergericht beabsichtigt die im Handelsregister eingetragene Gesellschaft von Amts wegen nach § 394 FamFG zu löschen. Die Frist zur Erhebung eines Widerspruchs gegen die beabsichtigte Löschung wird auf 3 Monate festgesetzt."
    },
    {
      "date": "2025-08-13",
      "id": "120936",
      "original_text": "Registerbekanntmachung nach dem Umwandlungsgesetz\nHessen Amtsgericht Darmstadt HRB 9244\nExtra-net 24 AG – Weiterstadt",
      "type": "Registerbekanntmachung nach dem Umwandlungsgesetz",
      "state": "Hessen",
      "amtsgericht": "Amtsgericht Darmstadt",
      "registernummer": "HRB 9244",
      "registerart": "HRB",
      "company_name": "Extra-net 24 AG",
      "company_seat": "Weiterstadt",
      "details": "13.08.2025 (Bekanntmachungsdatum)\n\nHessen Amtsgericht Darmstadt HRB 9244\nRegisterbekanntmachung nach dem Umwandlungsgesetz 13.08.2025 (Eintragungsdatum)\n\nExtra-net 24 AG\nAktiengesellschaft\nWeiterstadt\n\nDen Gläubigern der an der Verschmelzung beteiligten Rechtsträger ist, wenn sie binnen sechs Monaten nach dem Tag, an dem die Eintragung der Verschmelzung in das Register des Sitzes derjenigen Rechtsträger deren Gläubiger sie sind, nach § 19 Absatz 3 UmwG bekannt gemacht worden ist, ihren Anspruch nach Grund und Höhe schriftlich anmelden, Sicherheit zu leisten, soweit sie nicht Befriedigung verlangen können. Dieses Recht steht den Gläubigern jedoch nur zu, wenn sie glaubhaft machen, dass durch die Verschmelzung die Erfüllung ihrer Forderung gefährdet wird."
    },
    {
      "date": "2025-08-13",
      "id": "120937",
      "original_text": "Registerbekanntmachung nach dem Umwandlungsgesetz\nHessen Amtsgericht Frankfurt am Main HRB 127096\nTalentmark Interim Solutions GmbH – Frankfurt am Main",
      "type": "Registerbekanntmachung nach dem Umwandlungsgesetz",
      "state": "Hessen",
      "amtsgericht": "Amtsgericht Frankfurt am Main",
      "registernummer": "HRB 127096",
      "registerart": "HRB",
      "company_name": "Talentmark Interim Solutions GmbH",
      "company_seat": "Frankfurt am Main",
      "details": "13.08.2025 (Bekanntmachungsdatum)\n\nHessen Amtsgericht Frankfurt am Main HRB 127096\nRegisterbekanntmachung nach dem Umwandlungsgesetz 13.08.2025 (Eintragungsdatum)\n\nTalentmark Interim Solutions GmbH\nGesellschaft mit beschränkter Haftung\nFrankfurt am Main\n\nDen Gläubigern der an der Verschmelzung beteiligten Rechtsträger ist, wenn sie binnen sechs Monaten nach dem Tag, an dem die Eintragung der Verschmelzung in das Register des Sitzes desjenigen Rechtsträgers, dessen Gläubiger sie sind, nach § 19 Absatz 3 UmwG bekannt gemacht worden ist, ihren Anspruch nach Grund und Höhe schriftlich anmelden, Sicherheit zu leisten, soweit sie nicht Befriedigung verlangen können. Dieses Recht steht den Gläubigern jedoch nur zu, wenn sie glaubhaft machen, dass durch die Verschmelzung die Erfüllung ihrer Forderung gefährdet wird."
    },
    {
      "date": "2025-08-13",
      "id": "120938",
      "original_text": "Registerbekanntmachung nach dem Umwandlungsgesetz\nHessen Amtsgericht Darmstadt HRB 104645\nSorhea GmbH – Rüsselsheim",
      "type": "Registerbekanntmachung nach dem Umwandlungsgesetz",
      "state": "Hessen",
      "amtsgericht": "Amtsgericht Darmstadt",
      "registernummer": "HRB 104645",
      "registerart": "HRB",
      "company_name": "Sorhea GmbH",
      "company_seat": "Rüsselsheim",
      "details": "13.08.2025 (Bekanntmachungsdatum)\n\nHessen Amtsgericht Darmstadt HRB 104645\nRegisterbekanntmachung nach dem Umwandlungsgesetz 13.08.2025 (Eintragungsdatum)\n\nSorhea GmbH\nGesellschaft mit beschränkter Haftung\nRüsselsheim\n\nDen Gläubigern der an der Verschmelzung beteiligten Rechtsträger ist, wenn sie binnen sechs Monaten nach dem Tag, an dem die Eintragung der Verschmelzung in das Register des Sitzes desjenigen Rechtsträgers, dessen Gläubiger sie sind, nach § 19 Absatz 3 UmwG bekannt gemacht worden ist, ihren Anspruch nach Grund und Höhe schriftlich anmelden, Sicherheit zu leisten, soweit sie nicht Befriedigung verlangen können. Dieses Recht steht den Gläubigern jedoch nur zu, wenn sie glaubhaft machen, dass durch die Verschmelzung die Erfüllung ihrer Forderung gefährdet wird."
    },
    {
      "date": "2025-08-13",
      "id": "120939",
      "original_text": "Registerbekanntmachung nach dem Umwandlungsgesetz\nHessen Amtsgericht Kassel HRA 18397\nAlymov Besitz GmbH & Co. KG – Vellmar",
      "type": "Registerbekanntmachung nach dem Umwandlungsgesetz",
      "state": "Hessen",
      "amtsgericht": "Amtsgericht Kassel",
      "registernummer": "HRA 18397",
      "registerart": "HRA",
      "company_name": "Alymov Besitz GmbH & Co. KG",
      "company_seat": "Vellmar",
      "details": "13.08.2025 (Bekanntmachungsdatum)\n\nHessen Amtsgericht Kassel HRA 18397\nRegisterbekanntmachung nach dem Umwandlungsgesetz 13.08.2025 (Eintragungsdatum)\n\nAlymov Besitz GmbH & Co. KG\nKommanditgesellschaft\nVellmar\n\nDen Gläubigern der an der Ausgliederung beteiligten Rechtsträger ist, wenn sie binnen sechs Monaten nach dem Tag, an dem die Eintragung der Ausgliederung in das Register des Sitzes desjenigen Rechtsträgers, dessen Gläubiger sie sind, nach §§ 125, 19 Absatz 3 UmwG bekannt gemacht worden ist, ihren Anspruch nach Grund und Höhe schriftlich anmelden, Sicherheit zu leisten, soweit sie nicht Befriedigung verlangen können. Dieses Recht steht den Gläubigern jedoch nur zu, wenn sie glaubhaft machen, dass durch die Ausgliederung die Erfüllung ihrer Forderung gefährdet wird."
    },
    {
      "date": "2025-08-13",
      "id": "120940",
      "original_text": "Registerbekanntmachung nach dem Umwandlungsgesetz\nHessen Amtsgericht Gießen HRA 3724\nElis Mitte GmbH & Co. KG – Alsfeld",
      "type": "Registerbekanntmachung nach dem Umwandlungsgesetz",
      "state": "Hessen",
      "amtsgericht": "Amtsgericht Gießen",
      "registernummer": "HRA 3724",
      "registerart": "HRA",
      "company_name": "Elis Mitte GmbH & Co. KG",
      "company_seat": "Alsfeld",
      "details": "13.08.2025 (Bekanntmachungsdatum)\n\nHessen Amtsgericht Gießen HRA 3724\nRegisterbekanntmachung nach dem Umwandlungsgesetz 13.08.2025 (Eintragungsdatum)\n\nElis Mitte GmbH & Co. KG\nKommanditgesellschaft\nAlsfeld\n\nDen Gläubigern der an der formwechselnden Umwandlung beteiligten Rechtsträger ist, wenn sie binnen sechs Monaten nach dem Tag, an dem die Eintragung der formwechselnden Umwandlung in das Register des Sitzes desjenigen Rechtsträgers, dessen Gläubiger sie sind, nach § 201 UmwG bekannt gemacht worden ist, ihren Anspruch nach Grund und Höhe schriftlich anmelden, Sicherheit zu leisten, soweit sie nicht Befriedigung verlangen können. Dieses Recht steht den Gläubigern jedoch nur zu, wenn sie glaubhaft machen, dass durch die formwechselnde Umwandlung die Erfüllung ihrer Forderung gefährdet wird."
    },
    {
      "date": "2025-08-13",
      "id": "120941",
      "original_text": "Registerbekanntmachung nach dem Umwandlungsgesetz\nHessen Amtsgericht Darmstadt HRA 85194\nGEDE Türenwerk GmbH & Co. KG – Weiterstadt",
      "type": "Registerbekanntmachung nach dem Umwandlungsgesetz",
      "state": "Hessen",
      "amtsgericht": "Amtsgericht Darmstadt",
      "registernummer": "HRA 85194",
      "registerart": "HRA",
      "company_name": "GEDE Türenwerk GmbH & Co. KG",
      "company_seat": "Weiterstadt",
      "details": "13.08.2025 (Bekanntmachungsdatum)\n\nHessen Amtsgericht Darmstadt HRA 85194\nRegisterbekanntmachung nach dem Umwandlungsgesetz 13.08.2025 (Eintragungsdatum)\n\nGEDE Türenwerk GmbH & Co. KG\nKommanditgesellschaft\nWeiterstadt\n\nDen Gläubigern der an der Verschmelzung beteiligten Rechtsträger ist, wenn sie binnen sechs Monaten nach dem Tag, an dem die Eintragung der Verschmelzung in das Register des Sitzes derjenigen Rechtsträger deren Gläubiger sie sind, nach § 19 Absatz 3 UmwG bekannt gemacht worden ist, ihren Anspruch nach Grund und Höhe schriftlich anmelden, Sicherheit zu leisten, soweit sie nicht Befriedigung verlangen können. Dieses Recht steht den Gläubigern jedoch nur zu, wenn sie glaubhaft machen, dass durch die Verschmelzung die Erfüllung ihrer Forderung gefährdet wird."
    },
    {
      "date": "2025-08-13",
      "id": "120942",
      "original_text": "Registerbekanntmachung nach dem Umwandlungsgesetz\nHessen Amtsgericht Frankfurt am Main HRA 29291\nIQVIA Commercial GmbH & Co. OHG – Frankfurt am Main",
      "type": "Registerbekanntmachung nach dem Umwandlungsgesetz",
      "state": "Hessen",
      "amtsgericht": "Amtsgericht Frankfurt am Main",
      "registernummer": "HRA 29291",
      "registerart": "HRA",
      "company_name": "IQVIA Commercial GmbH & Co. OHG",
      "company_seat": "Frankfurt am Main",
      "details": "13.08.2025 (Bekanntmachungsdatum)\n\nHessen Amtsgericht Frankfurt am Main HRA 29291\nRegisterbekanntmachung nach dem Umwandlungsgesetz 13.08.2025 (Eintragungsdatum)\n\nIQVIA Commercial GmbH & Co. OHG\nOffene Handelsgesellschaft\nFrankfurt am Main\n\nDen Gläubigern der an der Verschmelzung beteiligten Rechtsträger ist, wenn sie binnen sechs Monaten nach dem Tag, an dem die Eintragung der Verschmelzung in das Register des Sitzes desjenigen Rechtsträgers, dessen Gläubiger sie sind, nach § 19 Absatz 3 UmwG bekannt gemacht worden ist, ihren Anspruch nach Grund und Höhe schriftlich anmelden, Sicherheit zu leisten, soweit sie nicht Befriedigung verlangen können. Dieses Recht steht den Gläubigern jedoch nur zu, wenn sie glaubhaft machen, dass durch die Verschmelzung die Erfüllung ihrer Forderung gefährdet wird."
    },
    {
      "date": "2025-08-13",
      "id": "120943",
      "original_text": "Registerbekanntmachung nach dem Umwandlungsgesetz\nHessen Amtsgericht Frankfurt am Main HRB 127711\nTalentmark Deutschland GmbH – Frankfurt am Main",
      "type": "Registerbekanntmachung nach dem Umwandlungsgesetz",
      "state": "Hessen",
      "amtsgericht": "Amtsgericht Frankfurt am Main",
      "registernummer": "HRB 127711",
      "registerart": "HRB",
      "company_name": "Talentmark Deutschland GmbH",
      "company_seat": "Frankfurt am Main",
      "details": "13.08.2025 (Bekanntmachungsdatum)\n\nHessen Amtsgericht Frankfurt am Main HRB 127711\nRegisterbekanntmachung nach dem Umwandlungsgesetz 13.08.2025 (Eintragungsdatum)\n\nTalentmark Deutschland GmbH\nGesellschaft mit beschränkter Haftung\nFrankfurt am Main\n\nDen Gläubigern der an der Verschmelzung beteiligten Rechtsträger ist, wenn sie binnen sechs Monaten nach dem Tag, an dem die Eintragung der Verschmelzung in das Register des Sitzes desjenigen Rechtsträgers, dessen Gläubiger sie sind, nach § 19 Absatz 3 UmwG bekannt gemacht worden ist, ihren Anspruch nach Grund und Höhe schriftlich anmelden, Sicherheit zu leisten, soweit sie nicht Befriedigung verlangen können. Dieses Recht steht den Gläubigern jedoch nur zu, wenn sie glaubhaft machen, dass durch die Verschmelzung die Erfüllung ihrer Forderung gefährdet wird."
    },
    {
      "date": "2025-08-13",
      "id": "120944",
      "original_text": "Registerbekanntmachung nach dem Umwandlungsgesetz\nHessen Amtsgericht Kassel HRA 18380\nEvgenij Alymov Softwareberatung e. Kfm. – Vellmar",
      "type": "Registerbekanntmachung nach dem Umwandlungsgesetz",
      "state": "Hessen",
      "amtsgericht": "Amtsgericht Kassel",
      "registernummer": "HRA 18380",
      "registerart": "HRA",
      "company_name": "Evgenij Alymov Softwareberatung e. Kfm.",
      "company_seat": "Vellmar",
      "details": "13.08.2025 (Bekanntmachungsdatum)\n\nHessen Amtsgericht Kassel HRA 18380\nRegisterbekanntmachung nach dem Umwandlungsgesetz 13.08.2025 (Eintragungsdatum)\n\nEvgenij Alymov Softwareberatung e. Kfm.\nEinzelkaufmann / Einzelkauffrau\nVellmar\n\nDen Gläubigern der an der Ausgliederung beteiligten Rechtsträger ist, wenn sie binnen sechs Monaten nach dem Tag, an dem die Eintragung der Ausgliederung in das Register des Sitzes desjenigen Rechtsträgers, dessen Gläubiger sie sind, nach §§ 125, 19 Absatz 3 UmwG bekannt gemacht worden ist, ihren Anspruch nach Grund und Höhe schriftlich anmelden, Sicherheit zu leisten, soweit sie nicht Befriedigung verlangen können. Dieses Recht steht den Gläubigern jedoch nur zu, wenn sie glaubhaft machen, dass durch die Ausgliederung die Erfüllung ihrer Forderung gefährdet wird."
    },
    {
      "date": "2025-08-13",
      "id": "120945",
      "original_text": "Registerbekanntmachung nach dem Umwandlungsgesetz\nHessen Amtsgericht Darmstadt HRB 105947\nnbii GmbH – Kelsterbach",
      "type": "Registerbekanntmachung nach dem Umwandlungsgesetz",
      "state": "Hessen",
      "amtsgericht": "Amtsgericht Darmstadt",
      "registernummer": "HRB 105947",
      "registerart": "HRB",
      "company_name": "nbii GmbH",
      "company_seat": "Kelsterbach",
      "details": "13.08.2025 (Bekanntmachungsdatum)\n\nHessen Amtsgericht Darmstadt HRB 105947\nRegisterbekanntmachung nach dem Umwandlungsgesetz 13.08.2025 (Eintragungsdatum)\n\nnbii GmbH\nGesellschaft mit beschränkter Haftung\nKelsterbach\n\nDen Gläubigern der an der Verschmelzung beteiligten Rechtsträger ist, wenn sie binnen sechs Monaten nach dem Tag, an dem die Eintragung der Verschmelzung in das Register des Sitzes derjenigen Rechtsträger deren Gläubiger sie sind, nach § 19 Absatz 3 UmwG bekannt gemacht worden ist, ihren Anspruch nach Grund und Höhe schriftlich anmelden, Sicherheit zu leisten, soweit sie nicht Befriedigung verlangen können. Dieses Recht steht den Gläubigern jedoch nur zu, wenn sie glaubhaft machen, dass durch die Verschmelzung die Erfüllung ihrer Forderung gefährdet wird."
    },
    {
      "date": "2025-08-13",
      "id": "120946",
      "original_text": "Sonstige Registerbekanntmachung\nHessen Amtsgericht Wiesbaden VR 5119\nFreundeskreis Uglitsch e. V. – Idstein",
      "type": "Sonstige Registerbekanntmachung",
      "state": "Hessen",
      "amtsgericht": "Amtsgericht Wiesbaden",
      "registernummer": "VR 5119",
      "registerart": "VR",
      "company_name": "Freundeskreis Uglitsch e. V.",
      "company_seat": "Idstein",
      "details": "13.08.2025 (Bekanntmachungsdatum)\n\nHessen Amtsgericht Wiesbaden VR 5119\nSonstige Registerbekanntmachung 13.08.2025 (Eintragungsdatum)\n\nFreundeskreis Uglitsch e. V.\neingetragener Verein\nIdstein\n\nDer Verein ist aufgelöst."
    },
    {
      "date": "2025-08-13",
      "id": "120947",
      "original_text": "Registerbekanntmachung nach dem Umwandlungsgesetz\nHessen Amtsgericht Hanau HRB 100662\nvon Erden Jewelry GmbH – Brachttal",
      "type": "Registerbekanntmachung nach dem Umwandlungsgesetz",
      "state": "Hessen",
      "amtsgericht": "Amtsgericht Hanau",
      "registernummer": "HRB 100662",
      "registerart": "HRB",
      "company_name": "von Erden Jewelry GmbH",
      "company_seat": "Brachttal",
      "details": "13.08.2025 (Bekanntmachungsdatum)\n\nHessen Amtsgericht Hanau HRB 100662\nRegisterbekanntmachung nach dem Umwandlungsgesetz 13.08.2025 (Eintragungsdatum)\n\nvon Erden Jewelry GmbH\nGesellschaft mit beschränkter Haftung\nBrachttal\n\nDen Gläubigern der an der formwechselnden Umwandlung beteiligten Rechtsträger ist, wenn sie binnen sechs Monaten nach dem Tag, an dem die Eintragung der formwechselnden Umwandlung in das Register des Sitzes desjenigen Rechtsträgers, dessen Gläubiger sie sind, nach § 201 UmwG bekannt gemacht worden ist, ihren Anspruch nach Grund und Höhe schriftlich anmelden, Sicherheit zu leisten, soweit sie nicht Befriedigung verlangen können. Dieses Recht steht den Gläubigern jedoch nur zu, wenn sie glaubhaft machen, dass durch die formwechselnden Umwandlung die Erfüllung ihrer Forderung gefährdet wird."
    },
    {
      "date": "2025-08-13",
      "id": "120948",
      "original_text": "Registerbekanntmachung nach dem Umwandlungsgesetz\nHessen Amtsgericht Darmstadt HRB 5075\nMarco Basso Innenausbau Gesellschaft mit beschränkter Haftung – Weiterstadt",
      "type": "Registerbekanntmachung nach dem Umwandlungsgesetz",
      "state": "Hessen",
      "amtsgericht": "Amtsgericht Darmstadt",
      "registernummer": "HRB 5075",
      "registerart": "HRB",
      "company_name": "Marco Basso Innenausbau Gesellschaft mit beschränkter Haftung",
      "company_seat": "Weiterstadt",
      "details": "13.08.2025 (Bekanntmachungsdatum)\n\nHessen Amtsgericht Darmstadt HRB 5075\nRegisterbekanntmachung nach dem Umwandlungsgesetz 13.08.2025 (Eintragungsdatum)\n\nMarco Basso Innenausbau Gesellschaft mit beschränkter Haftung\nGesellschaft mit beschränkter Haftung\nWeiterstadt\n\nDen Gläubigern der an der Verschmelzung beteiligten Rechtsträger ist, wenn sie binnen sechs Monaten nach dem Tag, an dem die Eintragung der Verschmelzung in das Register des Sitzes derjenigen Rechtsträger deren Gläubiger sie sind, nach § 19 Absatz 3 UmwG bekannt gemacht worden ist, ihren Anspruch nach Grund und Höhe schriftlich anmelden, Sicherheit zu leisten, soweit sie nicht Befriedigung verlangen können. Dieses Recht steht den Gläubigern jedoch nur zu, wenn sie glaubhaft machen, dass durch die Verschmelzung die Erfüllung ihrer Forderung gefährdet wird."
    },
    {
      "date": "2025-08-13",
      "id": "120949",
      "original_text": "Registerbekanntmachung nach dem Umwandlungsgesetz\nHessen Amtsgericht Fulda HRB 2400\nFerronordic Used Trucks GmbH – Künzell",
      "type": "Registerbekanntmachung nach dem Umwandlungsgesetz",
      "state": "Hessen",
      "amtsgericht": "Amtsgericht Fulda",
      "registernummer": "HRB 2400",
      "registerart": "HRB",
      "company_name": "Ferronordic Used Trucks GmbH",
      "company_seat": "Künzell",
      "details": "13.08.2025 (Bekanntmachungsdatum)\n\nHessen Amtsgericht Fulda HRB 2400\nRegisterbekanntmachung nach dem Umwandlungsgesetz 13.08.2025 (Eintragungsdatum)\n\nFerronordic Used Trucks GmbH\nGesellschaft mit beschränkter Haftung\nKünzell\n\nDen Gläubigern der an der Verschmelzung beteiligten Rechtsträger ist, wenn sie binnen sechs Monaten nach dem Tag, an dem die Eintragung der Verschmelzung in das Register des Sitzes desjenigen Rechtsträgers, dessen Gläubiger sie sind, nach § 19 Absatz 3 UmwG bekannt gemacht worden ist, ihren Anspruch nach Grund und Höhe schriftlich anmelden, Sicherheit zu leisten, soweit sie nicht Befriedigung verlangen können. Dieses Recht steht den Gläubigern jedoch nur zu, wenn sie glaubhaft machen, dass durch die Verschmelzung die Erfüllung ihrer Forderung gefährdet wird."
    },
    {
      "date": "2025-08-13",
      "id": "120950",
      "original_text": "Registerbekanntmachung nach dem Umwandlungsgesetz\nHessen Amtsgericht Darmstadt HRB 51831\nFORTEC Power GmbH – Riedstadt-Wolfskehlen",
      "type": "Registerbekanntmachung nach dem Umwandlungsgesetz",
      "state": "Hessen",
      "amtsgericht": "Amtsgericht Darmstadt",
      "registernummer": "HRB 51831",
      "registerart": "HRB",
      "company_name": "FORTEC Power GmbH",
      "company_seat": "Riedstadt-Wolfskehlen",
      "details": "13.08.2025 (Bekanntmachungsdatum)\n\nHessen Amtsgericht Darmstadt HRB 51831\nRegisterbekanntmachung nach dem Umwandlungsgesetz 13.08.2025 (Eintragungsdatum)\n\nFORTEC Power GmbH\nGesellschaft mit beschränkter Haftung\nRiedstadt-Wolfskehlen\n\nDen Gläubigern der an der Verschmelzung beteiligten Rechtsträger ist, wenn sie binnen sechs Monaten nach dem Tag, an dem die Eintragung der Verschmelzung in das Register des Sitzes derjenigen Rechtsträger deren Gläubiger sie sind, nach § 19 Absatz 3 UmwG bekannt gemacht worden ist, ihren Anspruch nach Grund und Höhe schriftlich anmelden, Sicherheit zu leisten, soweit sie nicht Befriedigung verlangen können. Dieses Recht steht den Gläubigern jedoch nur zu, wenn sie glaubhaft machen, dass durch die Verschmelzung die Erfüllung ihrer Forderung gefährdet wird."
    },
    {
      "date": "2025-08-13",
      "id": "120951",
      "original_text": "Registerbekanntmachung nach dem Umwandlungsgesetz\nHessen Amtsgericht Darmstadt HRB 103825\nHirsch Secure GmbH – Rüsselsheim",
      "type": "Registerbekanntmachung nach dem Umwandlungsgesetz",
      "state": "Hessen",
      "amtsgericht": "Amtsgericht Darmstadt",
      "registernummer": "HRB 103825",
      "registerart": "HRB",
      "company_name": "Hirsch Secure GmbH",
      "company_seat": "Rüsselsheim",
      "details": "13.08.2025 (Bekanntmachungsdatum)\n\nHessen Amtsgericht Darmstadt HRB 103825\nRegisterbekanntmachung nach dem Umwandlungsgesetz 13.08.2025 (Eintragungsdatum)\n\nHirsch Secure GmbH\nGesellschaft mit beschränkter Haftung\nRüsselsheim\n\nDen Gläubigern der an der Verschmelzung beteiligten Rechtsträger ist, wenn sie binnen sechs Monaten nach dem Tag, an dem die Eintragung der Verschmelzung in das Register des Sitzes desjenigen Rechtsträgers, dessen Gläubiger sie sind, nach § 19 Absatz 3 UmwG bekannt gemacht worden ist, ihren Anspruch nach Grund und Höhe schriftlich anmelden, Sicherheit zu leisten, soweit sie nicht Befriedigung verlangen können. Dieses Recht steht den Gläubigern jedoch nur zu, wenn sie glaubhaft machen, dass durch die Verschmelzung die Erfüllung ihrer Forderung gefährdet wird."
    },
    {
      "date": "2025-08-13",
      "id": "120952",
      "original_text": "Registerbekanntmachung nach dem Umwandlungsgesetz\nHessen Amtsgericht Wiesbaden HRB 24760\nMLS Safety GmbH – Wiesbaden",
      "type": "Registerbekanntmachung nach dem Umwandlungsgesetz",
      "state": "Hessen",
      "amtsgericht": "Amtsgericht Wiesbaden",
      "registernummer": "HRB 24760",
      "registerart": "HRB",
      "company_name": "MLS Safety GmbH",
      "company_seat": "Wiesbaden",
      "details": "13.08.2025 (Bekanntmachungsdatum)\n\nHessen Amtsgericht Wiesbaden HRB 24760\nRegisterbekanntmachung nach dem Umwandlungsgesetz 13.08.2025 (Eintragungsdatum)\n\nMLS Safety GmbH\nGesellschaft mit beschränkter Haftung\nWiesbaden\n\nDen Gläubigern der an der Verschmelzung beteiligten Rechtsträger ist, wenn sie binnen sechs Monaten nach dem Tag, an dem die Eintragung der Verschmelzung in das Register des Sitzes derjenigen Rechtsträger deren Gläubiger sie sind, nach § 19 Absatz 3 UmwG bekannt gemacht worden ist, ihren Anspruch nach Grund und Höhe schriftlich anmelden, Sicherheit zu leisten, soweit sie nicht Befriedigung verlangen können. Dieses Recht steht den Gläubigern jedoch nur zu, wenn sie glaubhaft machen, dass durch die Verschmelzung die Erfüllung ihrer Forderung gefährdet wird."
    },
    {
      "date": "2025-08-13",
      "id": "120953",
      "original_text": "Registerbekanntmachung nach dem Umwandlungsgesetz\nHessen Amtsgericht Darmstadt HRB 5075\nMarco Basso Innenausbau Gesellschaft mit beschränkter Haftung – Weiterstadt",
      "type": "Registerbekanntmachung nach dem Umwandlungsgesetz",
      "state": "Hessen",
      "amtsgericht": "Amtsgericht Darmstadt",
      "registernummer": "HRB 5075",
      "registerart": "HRB",
      "company_name": "Marco Basso Innenausbau Gesellschaft mit beschränkter Haftung",
      "company_seat": "Weiterstadt",
      "details": "13.08.2025 (Bekanntmachungsdatum)\n\nHessen Amtsgericht Darmstadt HRB 5075\nRegisterbekanntmachung nach dem Umwandlungsgesetz 13.08.2025 (Eintragungsdatum)\n\nMarco Basso Innenausbau Gesellschaft mit beschränkter Haftung\nGesellschaft mit beschränkter Haftung\nWeiterstadt\n\nDen Gläubigern der an der Verschmelzung beteiligten Rechtsträger ist, wenn sie binnen sechs Monaten nach dem Tag, an dem die Eintragung der Verschmelzung in das Register des Sitzes derjenigen Rechtsträger deren Gläubiger sie sind, nach § 19 Absatz 3 UmwG bekannt gemacht worden ist, ihren Anspruch nach Grund und Höhe schriftlich anmelden, Sicherheit zu leisten, soweit sie nicht Befriedigung verlangen können. Dieses Recht steht den Gläubigern jedoch nur zu, wenn sie glaubhaft machen, dass durch die Verschmelzung die Erfüllung ihrer Forderung gefährdet wird."
    },
    {
      "date": "2025-08-13",
      "id": "120954",
      "original_text": "Registerbekanntmachung nach dem Umwandlungsgesetz\nHessen Amtsgericht Darmstadt HRB 106012\nnbii GmbH – Kelsterbach",
      "type": "Registerbekanntmachung nach dem Umwandlungsgesetz",
      "state": "Hessen",
      "amtsgericht": "Amtsgericht Darmstadt",
      "registernummer": "HRB 106012",
      "registerart": "HRB",
      "company_name": "nbii GmbH",
      "company_seat": "Kelsterbach",
      "details": "13.08.2025 (Bekanntmachungsdatum)\n\nHessen Amtsgericht Darmstadt HRB 106012\nRegisterbekanntmachung nach dem Umwandlungsgesetz 13.08.2025 (Eintragungsdatum)\n\nnbii GmbH\nGesellschaft mit beschränkter Haftung\nKelsterbach\n\nDen Gläubigern der an der Verschmelzung beteiligten Rechtsträger ist, wenn sie binnen sechs Monaten nach dem Tag, an dem die Eintragung der Verschmelzung in das Register des Sitzes derjenigen Rechtsträger deren Gläubiger sie sind, nach § 19 Absatz 3 UmwG bekannt gemacht worden ist, ihren Anspruch nach Grund und Höhe schriftlich anmelden, Sicherheit zu leisten, soweit sie nicht Befriedigung verlangen können. Dieses Recht steht den Gläubigern jedoch nur zu, wenn sie glaubhaft machen, dass durch die Verschmelzung die Erfüllung ihrer Forderung gefährdet wird."
    },
    {
      "date": "2025-08-13",
      "id": "120955",
      "original_text": "Registerbekanntmachung nach dem Umwandlungsgesetz\nHessen Amtsgericht Darmstadt HRB 88215\nIP Internationale Presse direct GmbH – Mörfelden-Walldorf",
      "type": "Registerbekanntmachung nach dem Umwandlungsgesetz",
      "state": "Hessen",
      "amtsgericht": "Amtsgericht Darmstadt",
      "registernummer": "HRB 88215",
      "registerart": "HRB",
      "company_name": "IP Internationale Presse direct GmbH",
      "company_seat": "Mörfelden-Walldorf",
      "details": "13.08.2025 (Bekanntmachungsdatum)\n\nHessen Amtsgericht Darmstadt HRB 88215\nRegisterbekanntmachung nach dem Umwandlungsgesetz 13.08.2025 (Eintragungsdatum)\n\nIP Internationale Presse direct GmbH\nGesellschaft mit beschränkter Haftung\nMörfelden-Walldorf\n\nDen Gläubigern der an der Verschmelzung beteiligten Rechtsträger ist, wenn sie binnen sechs Monaten nach dem Tag, an dem die Eintragung der Verschmelzung in das Register des Sitzes desjenigen Rechtsträgers, dessen Gläubiger sie sind, nach § 19 Absatz 3 UmwG bekannt gemacht worden ist, ihren Anspruch nach Grund und Höhe schriftlich anmelden, Sicherheit zu leisten, soweit sie nicht Befriedigung verlangen können. Dieses Recht steht den Gläubigern jedoch nur zu, wenn sie glaubhaft machen, dass durch die Verschmelzung die Erfüllung ihrer Forderung gefährdet wird."
    },
    {
      "date": "2025-08-13",
      "id": "120956",
      "original_text": "Registerbekanntmachung nach dem Umwandlungsgesetz\nBaden-Württemberg Amtsgericht Stuttgart HRB 721601\nKemmler Industriebau GmbH – Tübingen",
      "type": "Registerbekanntmachung nach dem Umwandlungsgesetz",
      "state": "Baden-Württemberg",
      "amtsgericht": "Amtsgericht Stuttgart",
      "registernummer": "HRB 721601",
      "registerart": "HRB",
      "company_name": "Kemmler Industriebau GmbH",
      "company_seat": "Tübingen",
      "details": "13.08.2025 (Bekanntmachungsdatum)\n\nBaden-Württemberg Amtsgericht Stuttgart HRB 721601\nRegisterbekanntmachung nach dem Umwandlungsgesetz 13.08.2025 (Eintragungsdatum)\n\nKemmler Industriebau GmbH\nGesellschaft mit beschränkter Haftung\nTübingen\n\nAls nicht eingetragen wird bekanntgemacht:\nDen Gläubigern der an der Verschmelzung beteiligten Rechtsträger ist, wenn sie binnen sechs Monaten nach dem Tag, an dem die Eintragung der Verschmelzung in das Register des Sitzes desjenigen Rechtsträgers, dessen Gläubiger sie sind, nach § 19 Abs. 3 UmwG als bekanntgemacht gilt, ihren Anspruch nach Grund und Höhe schriftlich anmelden, Sicherheit zu leisten, soweit sie nicht Befriedigung verlangen können. Dieses Recht steht den Gläubigern jedoch nur zu, wenn sie glaubhaft machen, dass durch die Verschmelzung die Erfüllung ihrer Forderung gefährdet wird."
    }
  ]
}