{
  "date": "2025-08-31",
  "date_of_scrape": "2025-09-01T04:08:34.018Z",
  "tool_version": "0.2.0",
  "number_of_announcements": 10,
  "announcements": [
    {
      "date": "2025-08-31",
      "id": "125203",
      "original_text": "Registerbekanntmachung nach dem Umwandlungsgesetz\nSachsen Amtsgericht Dresden HRB 39212\nIONServices Dresden GmbH – Dresden",
      "type": "Registerbekanntmachung nach dem Umwandlungsgesetz",
      "state": "Sachsen",
      "amtsgericht": "Amtsgericht Dresden",
      "registernummer": "HRB 39212",
      "registerart": "HRB",
      "company_name": "IONServices Dresden GmbH",
      "company_seat": "Dresden",
      "details": "31.08.2025 (Bekanntmachungsdatum)\n\nSachsen Amtsgericht Dresden HRB 39212\nRegisterbekanntmachung nach dem Umwandlungsgesetz 31.08.2025 (Eintragungsdatum)\n\nIONServices Dresden GmbH\nGesellschaft mit beschränkter Haftung\nDresden\n\nDen Gläubigern der an der Verschmelzung beteiligten Rechtsträger ist, wenn sie binnen sechs Monaten nach dem Tag, an dem die Eintragung der Verschmelzung in das Register des Sitzes desjenigen Rechtsträgers, dessen Gläubiger sie sind, nach § 19 Abs. 3 UmwG als bekannt gemacht gilt, ihren Anspruch nach Grund und Höhe in Textform anmelden, Sicherheit zu leisten, soweit sie nicht Befriedigung verlangen können. Dieses Recht steht den Gläubigern jedoch nur zu, wenn sie glaubhaft machen, dass durch die Verschmelzung die Erfüllung der Forderung gefährdet wird."
    },
    {
      "date": "2025-08-31",
      "id": "125204",
      "original_text": "Registerbekanntmachung nach dem Umwandlungsgesetz\nSachsen Amtsgericht Dresden HRB 29914\nLIFT24 GmbH – Bretnig-Hauswalde",
      "type": "Registerbekanntmachung nach dem Umwandlungsgesetz",
      "state": "Sachsen",
      "amtsgericht": "Amtsgericht Dresden",
      "registernummer": "HRB 29914",
      "registerart": "HRB",
      "company_name": "LIFT24 GmbH",
      "company_seat": "Bretnig-Hauswalde",
      "details": "31.08.2025 (Bekanntmachungsdatum)\n\nSachsen Amtsgericht Dresden HRB 29914\nRegisterbekanntmachung nach dem Umwandlungsgesetz 31.08.2025 (Eintragungsdatum)\n\nLIFT24 GmbH\nGesellschaft mit beschränkter Haftung\nBretnig-Hauswalde\n\nDen Gläubigern der an der Verschmelzung beteiligten Rechtsträger ist, wenn sie binnen sechs Monaten nach dem Tag, an dem die Eintragung der Verschmelzung in das Register des Sitzes desjenigen Rechtsträgers, dessen Gläubiger sie sind, nach § 19 Abs. 3 UmwG als bekannt gemacht gilt, ihren Anspruch nach Grund und Höhe in Textform anmelden, Sicherheit zu leisten, soweit sie nicht Befriedigung verlangen können. Dieses Recht steht den Gläubigern jedoch nur zu, wenn sie glaubhaft machen, dass durch die Verschmelzung die Erfüllung der Forderung gefährdet wird."
    },
    {
      "date": "2025-08-31",
      "id": "125205",
      "original_text": "Registerbekanntmachung nach dem Umwandlungsgesetz\nSachsen Amtsgericht Dresden HRB 820\nAutohaus Faust Coswig GmbH – Coswig",
      "type": "Registerbekanntmachung nach dem Umwandlungsgesetz",
      "state": "Sachsen",
      "amtsgericht": "Amtsgericht Dresden",
      "registernummer": "HRB 820",
      "registerart": "HRB",
      "company_name": "Autohaus Faust Coswig GmbH",
      "company_seat": "Coswig",
      "details": "31.08.2025 (Bekanntmachungsdatum)\n\nSachsen Amtsgericht Dresden HRB 820\nRegisterbekanntmachung nach dem Umwandlungsgesetz 31.08.2025 (Eintragungsdatum)\n\nAutohaus Faust Coswig GmbH\nGesellschaft mit beschränkter Haftung\nCoswig\n\nDen Gläubigern der an der Verschmelzung beteiligten Rechtsträger ist, wenn sie binnen sechs Monaten nach dem Tag, an dem die Eintragung der Verschmelzung in das Register des Sitzes desjenigen Rechtsträgers, dessen Gläubiger sie sind, nach § 19 Abs. 3 UmwG als bekannt gemacht gilt, ihren Anspruch nach Grund und Höhe in Textform anmelden, Sicherheit zu leisten, soweit sie nicht Befriedigung verlangen können. Dieses Recht steht den Gläubigern jedoch nur zu, wenn sie glaubhaft machen, dass durch die Verschmelzung die Erfüllung der Forderung gefährdet wird."
    },
    {
      "date": "2025-08-31",
      "id": "125206",
      "original_text": "Registerbekanntmachung nach dem Umwandlungsgesetz\nSachsen Amtsgericht Dresden HRB 45531\nmibeco Mitteldeutsche Beteiligungs- und Consulting GmbH – Dresden",
      "type": "Registerbekanntmachung nach dem Umwandlungsgesetz",
      "state": "Sachsen",
      "amtsgericht": "Amtsgericht Dresden",
      "registernummer": "HRB 45531",
      "registerart": "HRB",
      "company_name": "mibeco Mitteldeutsche Beteiligungs- und Consulting GmbH",
      "company_seat": "Dresden",
      "details": "31.08.2025 (Bekanntmachungsdatum)\n\nSachsen Amtsgericht Dresden HRB 45531\nRegisterbekanntmachung nach dem Umwandlungsgesetz 31.08.2025 (Eintragungsdatum)\n\nmibeco Mitteldeutsche Beteiligungs- und Consulting GmbH\nGesellschaft mit beschränkter Haftung\nDresden\n\nDen Gläubigern der an der Verschmelzung beteiligten Rechtsträger ist, wenn sie binnen sechs Monaten nach dem Tag, an dem die Eintragung der Verschmelzung in das Register des Sitzes desjenigen Rechtsträgers, dessen Gläubiger sie sind, nach § 19 Abs. 3 UmwG als bekannt gemacht gilt, ihren Anspruch nach Grund und Höhe in Textform anmelden, Sicherheit zu leisten, soweit sie nicht Befriedigung verlangen können. Dieses Recht steht den Gläubigern jedoch nur zu, wenn sie glaubhaft machen, dass durch die Verschmelzung die Erfüllung der Forderung gefährdet wird."
    },
    {
      "date": "2025-08-31",
      "id": "125207",
      "original_text": "Registerbekanntmachung nach dem Umwandlungsgesetz\nSachsen Amtsgericht Dresden HRB 38206\nCitystellar GmbH – Dresden",
      "type": "Registerbekanntmachung nach dem Umwandlungsgesetz",
      "state": "Sachsen",
      "amtsgericht": "Amtsgericht Dresden",
      "registernummer": "HRB 38206",
      "registerart": "HRB",
      "company_name": "Citystellar GmbH",
      "company_seat": "Dresden",
      "details": "31.08.2025 (Bekanntmachungsdatum)\n\nSachsen Amtsgericht Dresden HRB 38206\nRegisterbekanntmachung nach dem Umwandlungsgesetz 31.08.2025 (Eintragungsdatum)\n\nCitystellar GmbH\nGesellschaft mit beschränkter Haftung\nDresden\n\nDen Gläubigern der an der Verschmelzung beteiligten Rechtsträger ist, wenn sie binnen sechs Monaten nach dem Tag, an dem die Eintragung der Verschmelzung in das Register des Sitzes desjenigen Rechtsträgers, dessen Gläubiger sie sind, nach § 19 Abs. 3 UmwG als bekannt gemacht gilt, ihren Anspruch nach Grund und Höhe in Textform anmelden, Sicherheit zu leisten, soweit sie nicht Befriedigung verlangen können. Dieses Recht steht den Gläubigern jedoch nur zu, wenn sie glaubhaft machen, dass durch die Verschmelzung die Erfüllung der Forderung gefährdet wird."
    },
    {
      "date": "2025-08-31",
      "id": "125208",
      "original_text": "Registerbekanntmachung nach dem Umwandlungsgesetz\nSachsen Amtsgericht Dresden HRB 20303\nAutohaus Elitzsch GmbH – Kamenz",
      "type": "Registerbekanntmachung nach dem Umwandlungsgesetz",
      "state": "Sachsen",
      "amtsgericht": "Amtsgericht Dresden",
      "registernummer": "HRB 20303",
      "registerart": "HRB",
      "company_name": "Autohaus Elitzsch GmbH",
      "company_seat": "Kamenz",
      "details": "31.08.2025 (Bekanntmachungsdatum)\n\nSachsen Amtsgericht Dresden HRB 20303\nRegisterbekanntmachung nach dem Umwandlungsgesetz 31.08.2025 (Eintragungsdatum)\n\nAutohaus Elitzsch GmbH\nGesellschaft mit beschränkter Haftung\nKamenz\n\nDen Gläubigern der an der Verschmelzung beteiligten Rechtsträger ist, wenn sie binnen sechs Monaten nach dem Tag, an dem die Eintragung der Verschmelzung in das Register des Sitzes desjenigen Rechtsträgers, dessen Gläubiger sie sind, nach § 19 Abs. 3 UmwG als bekannt gemacht gilt, ihren Anspruch nach Grund und Höhe in Textform anmelden, Sicherheit zu leisten, soweit sie nicht Befriedigung verlangen können. Dieses Recht steht den Gläubigern jedoch nur zu, wenn sie glaubhaft machen, dass durch die Verschmelzung die Erfüllung der Forderung gefährdet wird."
    },
    {
      "date": "2025-08-31",
      "id": "125209",
      "original_text": "Registerbekanntmachung nach dem Umwandlungsgesetz\nSachsen Amtsgericht Dresden HRB 489\nLIFT24 GmbH – Dresden",
      "type": "Registerbekanntmachung nach dem Umwandlungsgesetz",
      "state": "Sachsen",
      "amtsgericht": "Amtsgericht Dresden",
      "registernummer": "HRB 489",
      "registerart": "HRB",
      "company_name": "LIFT24 GmbH",
      "company_seat": "Dresden",
      "details": "31.08.2025 (Bekanntmachungsdatum)\n\nSachsen Amtsgericht Dresden HRB 489\nRegisterbekanntmachung nach dem Umwandlungsgesetz 31.08.2025 (Eintragungsdatum)\n\nLIFT24 GmbH\nGesellschaft mit beschränkter Haftung\nDresden\n\nDen Gläubigern der an der Verschmelzung beteiligten Rechtsträger ist, wenn sie binnen sechs Monaten nach dem Tag, an dem die Eintragung der Verschmelzung in das Register des Sitzes desjenigen Rechtsträgers, dessen Gläubiger sie sind, nach § 19 Abs. 3 UmwG als bekannt gemacht gilt, ihren Anspruch nach Grund und Höhe in Textform anmelden, Sicherheit zu leisten, soweit sie nicht Befriedigung verlangen können. Dieses Recht steht den Gläubigern jedoch nur zu, wenn sie glaubhaft machen, dass durch die Verschmelzung die Erfüllung der Forderung gefährdet wird."
    },
    {
      "date": "2025-08-31",
      "id": "125210",
      "original_text": "Registerbekanntmachung nach dem Umwandlungsgesetz\nSachsen Amtsgericht Dresden HRB 40204\nEngine Stellar GmbH – Dresden",
      "type": "Registerbekanntmachung nach dem Umwandlungsgesetz",
      "state": "Sachsen",
      "amtsgericht": "Amtsgericht Dresden",
      "registernummer": "HRB 40204",
      "registerart": "HRB",
      "company_name": "Engine Stellar GmbH",
      "company_seat": "Dresden",
      "details": "31.08.2025 (Bekanntmachungsdatum)\n\nSachsen Amtsgericht Dresden HRB 40204\nRegisterbekanntmachung nach dem Umwandlungsgesetz 31.08.2025 (Eintragungsdatum)\n\nEngine Stellar GmbH\nGesellschaft mit beschränkter Haftung\nDresden\n\nDen Gläubigern der an der Verschmelzung beteiligten Rechtsträger ist, wenn sie binnen sechs Monaten nach dem Tag, an dem die Eintragung der Verschmelzung in das Register des Sitzes desjenigen Rechtsträgers, dessen Gläubiger sie sind, nach § 19 Abs. 3 UmwG als bekannt gemacht gilt, ihren Anspruch nach Grund und Höhe in Textform anmelden, Sicherheit zu leisten, soweit sie nicht Befriedigung verlangen können. Dieses Recht steht den Gläubigern jedoch nur zu, wenn sie glaubhaft machen, dass durch die Verschmelzung die Erfüllung der Forderung gefährdet wird."
    },
    {
      "date": "2025-08-31",
      "id": "125211",
      "original_text": "Registerbekanntmachung nach dem Umwandlungsgesetz\nNiedersachsen Amtsgericht Lüneburg GsR 717\nAgrarservice Ahnsbeck eGbR – Ahnsbeck",
      "type": "Registerbekanntmachung nach dem Umwandlungsgesetz",
      "state": "Niedersachsen",
      "amtsgericht": "Amtsgericht Lüneburg",
      "registernummer": "GsR 717",
      "registerart": "GsR",
      "company_name": "Agrarservice Ahnsbeck eGbR",
      "company_seat": "Ahnsbeck",
      "details": "31.08.2025 (Bekanntmachungsdatum)\n\nNiedersachsen Amtsgericht Lüneburg GsR 717\nRegisterbekanntmachung nach dem Umwandlungsgesetz 31.08.2025 (Eintragungsdatum)\n\nAgrarservice Ahnsbeck eGbR\nGesellschaft bürgerlichen Rechts\nAhnsbeck\n\nDen Gläubigern der an der formwechselnden Umwandlung beteiligten Rechtsträger ist, wenn sie binnen sechs Monaten nach dem Tag, an dem die Eintragung der Umwandlung in das Register des Sitzes desjenigen Rechtsträgers, dessen Gläubiger sie sind, nach § 19 Abs. 3 UmwG als bekannt gemacht gilt, ihren Anspruch nach Grund und Höhe schriftlich anmelden, Sicherheit zu leisten, soweit sie nicht Befriedigung verlangen können. Dieses Recht steht den Gläubigern jedoch nur zu, wenn sie glaubhaft machen, dass durch die formwechselnde Umwandlung die Erfüllung der Forderung gefährdet wird."
    },
    {
      "date": "2025-08-31",
      "id": "125212",
      "original_text": "Registerbekanntmachung nach dem Umwandlungsgesetz\nNordrhein-Westfalen Amtsgericht Wuppertal HRB 32565\nDSM drive.speak.move. Service GmbH – Wülfrath",
      "type": "Registerbekanntmachung nach dem Umwandlungsgesetz",
      "state": "Nordrhein-Westfalen",
      "amtsgericht": "Amtsgericht Wuppertal",
      "registernummer": "HRB 32565",
      "registerart": "HRB",
      "company_name": "DSM drive.speak.move. Service GmbH",
      "company_seat": "Wülfrath",
      "details": "31.08.2025 (Bekanntmachungsdatum)\n\nNordrhein-Westfalen Amtsgericht Wuppertal HRB 32565\nRegisterbekanntmachung nach dem Umwandlungsgesetz 31.08.2025 (Eintragungsdatum)\n\nDSM drive.speak.move. Service GmbH\nGesellschaft mit beschränkter Haftung\nWülfrath\n\nDen Gläubigern der an der Verschmelzung beteiligten Rechtsträger ist, wenn sie binnen sechs Monaten nach dem Tag, an dem die Eintragung der Verschmelzung in das Register des Sitzes desjenigen Rechtsträgers, dessen Gläubiger sie sind, nach § 19 Absatz 3 UmwG als bekanntgemacht gilt, ihren Anspruch nach Grund und Höhe schriftlich anmelden, Sicherheit zu leisten, soweit sie nicht Befriedigung verlangen können. Dieses Recht steht den Gläubigern jedoch nur zu, wenn sie glaubhaft machen, dass durch die Verschmelzung die Erfüllung ihrer Forderung gefährdet wird."
    }
  ]
}