{
  "date": "2025-08-15",
  "date_of_scrape": "2025-08-29T07:42:15.294Z",
  "tool_version": "0.2.0",
  "number_of_announcements": 233,
  "announcements": [
    {
      "date": "2025-08-15",
      "id": "121232",
      "original_text": "Registerbekanntmachung nach dem Umwandlungsgesetz\nBayern Amtsgericht München HRB 122064\nTHORENIA Verwaltungsgesellschaft mbH – Pullach",
      "type": "Registerbekanntmachung nach dem Umwandlungsgesetz",
      "state": "Bayern",
      "amtsgericht": "Amtsgericht München",
      "registernummer": "HRB 122064",
      "registerart": "HRB",
      "company_name": "THORENIA Verwaltungsgesellschaft mbH",
      "company_seat": "Pullach",
      "details": "15.08.2025 (Bekanntmachungsdatum)\n\nBayern Amtsgericht München HRB 122064\nRegisterbekanntmachung nach dem Umwandlungsgesetz 14.08.2025 (Eintragungsdatum)\n\nTHORENIA Verwaltungsgesellschaft mbH\nGesellschaft mit beschränkter Haftung\nPullach\n\nDen Gläubigern der an der Verschmelzung beteiligten Rechtsträger ist, wenn sie binnen sechs Monaten nach dem Tag, an dem die Eintragung der Verschmelzung in das Register des Sitzes desjenigen Rechtsträgers, dessen Gläubiger sie sind, nach § 19 Abs. 3 UmwG als bekannt gemacht gilt, ihren Anspruch nach Grund und Höhe in Textform anmelden, Sicherheit zu leisten, soweit sie nicht Befriedigung verlangen können. Dieses Recht steht den Gläubigern jedoch nur zu, wenn sie glaubhaft machen, dass durch die Verschmelzung die Erfüllung ihrer Forderung gefährdet wird."
    },
    {
      "date": "2025-08-15",
      "id": "121233",
      "original_text": "Registerbekanntmachung nach dem Umwandlungsgesetz\nBayern Amtsgericht Amberg HRB 6566\nGSI Projekt GmbH – Schönsee",
      "type": "Registerbekanntmachung nach dem Umwandlungsgesetz",
      "state": "Bayern",
      "amtsgericht": "Amtsgericht Amberg",
      "registernummer": "HRB 6566",
      "registerart": "HRB",
      "company_name": "GSI Projekt GmbH",
      "company_seat": "Schönsee",
      "details": "15.08.2025 (Bekanntmachungsdatum)\n\nBayern Amtsgericht Amberg HRB 6566\nRegisterbekanntmachung nach dem Umwandlungsgesetz 14.08.2025 (Eintragungsdatum)\n\nGSI Projekt GmbH\nGesellschaft mit beschränkter Haftung\nSchönsee\n\nDen Gläubigern der an der Ausgliederung beteiligten Rechtsträger ist, wenn sie binnen sechs Monaten nach dem Tag, an dem die Eintragung der Ausgliederung in das Register des Sitzes desjenigen Rechtsträgers, dessen Gläubiger sie sind, nach §§ 125, 19 Abs. 3 UmwG als bekannt gemacht gilt, ihren Anspruch nach Grund und Höhe in Textform anmelden, Sicherheit zu leisten, soweit sie nicht Befriedigung verlangen können. Dieses Recht steht den Gläubigern jedoch nur zu, wenn sie glaubhaft machen, dass durch die Ausgliederung die Erfüllung ihrer Forderung gefährdet wird."
    },
    {
      "date": "2025-08-15",
      "id": "121234",
      "original_text": "Einreichung neuer Dokumente\nBayern Amtsgericht Regensburg HRB 18841\nVitesco Technologies GmbH – Regensburg",
      "type": "Einreichung neuer Dokumente",
      "state": "Bayern",
      "amtsgericht": "Amtsgericht Regensburg",
      "registernummer": "HRB 18841",
      "registerart": "HRB",
      "company_name": "Vitesco Technologies GmbH",
      "company_seat": "Regensburg",
      "details": "15.08.2025 (Bekanntmachungsdatum)\n\nBayern Amtsgericht Regensburg HRB 18841\nEinreichung neuer Dokumente\n\nVitesco Technologies GmbH\nGesellschaft mit beschränkter Haftung\nRegensburg\n\nDem Amtsgericht Regensburg -Registergericht- ist eine Liste der Mitglieder des Aufsichtsrats eingereicht worden, § 52 Abs. 3 S. 2 GmbHG."
    },
    {
      "date": "2025-08-15",
      "id": "121235",
      "original_text": "Registerbekanntmachung nach dem Umwandlungsgesetz\nBayern Amtsgericht Memmingen HRA 14160\nKarl-Heinz Reinold e. K. – Memmingen",
      "type": "Registerbekanntmachung nach dem Umwandlungsgesetz",
      "state": "Bayern",
      "amtsgericht": "Amtsgericht Memmingen",
      "registernummer": "HRA 14160",
      "registerart": "HRA",
      "company_name": "Karl-Heinz Reinold e. K.",
      "company_seat": "Memmingen",
      "details": "15.08.2025 (Bekanntmachungsdatum)\n\nBayern Amtsgericht Memmingen HRA 14160\nRegisterbekanntmachung nach dem Umwandlungsgesetz 14.08.2025 (Eintragungsdatum)\n\nKarl-Heinz Reinold e. K.\nEinzelkaufmann / Einzelkauffrau\nMemmingen\n\nDen Gläubigern der an der Ausgliederung beteiligten Rechtsträger ist, wenn sie binnen sechs Monaten nach dem Tag, an dem die Eintragung der Ausgliederung in das Register des Sitzes desjenigen Rechtsträgers, dessen Gläubiger sie sind, nach §§ 125, 19 Abs. 3 UmwG als bekannt gemacht gilt, ihren Anspruch nach Grund und Höhe in Textform anmelden, Sicherheit zu leisten, soweit sie nicht Befriedigung verlangen können. Dieses Recht steht den Gläubigern jedoch nur zu, wenn sie glaubhaft machen, dass durch die Ausgliederung die Erfüllung ihrer Forderung gefährdet wird."
    },
    {
      "date": "2025-08-15",
      "id": "121236",
      "original_text": "Registerbekanntmachung nach dem Umwandlungsgesetz\nBayern Amtsgericht München HRB 140149\nmsg systems AG – Ismaning",
      "type": "Registerbekanntmachung nach dem Umwandlungsgesetz",
      "state": "Bayern",
      "amtsgericht": "Amtsgericht München",
      "registernummer": "HRB 140149",
      "registerart": "HRB",
      "company_name": "msg systems AG",
      "company_seat": "Ismaning",
      "details": "15.08.2025 (Bekanntmachungsdatum)\n\nBayern Amtsgericht München HRB 140149\nRegisterbekanntmachung nach dem Umwandlungsgesetz 14.08.2025 (Eintragungsdatum)\n\nmsg systems AG\nAktiengesellschaft\nIsmaning\n\nDen Gläubigern der an der Verschmelzung beteiligten Rechtsträger ist, wenn sie binnen sechs Monaten nach dem Tag, an dem die Eintragung der Verschmelzung in das Register des Sitzes desjenigen Rechtsträgers, dessen Gläubiger sie sind, nach § 19 Abs. 3 UmwG als bekannt gemacht gilt, ihren Anspruch nach Grund und Höhe in Textform anmelden, Sicherheit zu leisten, soweit sie nicht Befriedigung verlangen können. Dieses Recht steht den Gläubigern jedoch nur zu, wenn sie glaubhaft machen, dass durch die Verschmelzung die Erfüllung ihrer Forderung gefährdet wird."
    },
    {
      "date": "2025-08-15",
      "id": "121237",
      "original_text": "Registerbekanntmachung nach dem Umwandlungsgesetz\nBayern Amtsgericht Regensburg HRB 14800\nKRo Immobilien GmbH – Regensburg",
      "type": "Registerbekanntmachung nach dem Umwandlungsgesetz",
      "state": "Bayern",
      "amtsgericht": "Amtsgericht Regensburg",
      "registernummer": "HRB 14800",
      "registerart": "HRB",
      "company_name": "KRo Immobilien GmbH",
      "company_seat": "Regensburg",
      "details": "15.08.2025 (Bekanntmachungsdatum)\n\nBayern Amtsgericht Regensburg HRB 14800\nRegisterbekanntmachung nach dem Umwandlungsgesetz 14.08.2025 (Eintragungsdatum)\n\nKRo Immobilien GmbH\nGesellschaft mit beschränkter Haftung\nRegensburg\n\nDen Gläubigern der an der Verschmelzung beteiligten Rechtsträger ist, wenn sie binnen sechs Monaten nach dem Tag, an dem die Eintragung der Verschmelzung in das Register des Sitzes desjenigen Rechtsträgers, dessen Gläubiger sie sind, nach § 19 Abs. 3 UmwG als bekannt gemacht gilt, ihren Anspruch nach Grund und Höhe in Textform anmelden, Sicherheit zu leisten, soweit sie nicht Befriedigung verlangen können. Dieses Recht steht den Gläubigern jedoch nur zu, wenn sie glaubhaft machen, dass durch die Verschmelzung die Erfüllung ihrer Forderung gefährdet wird."
    },
    {
      "date": "2025-08-15",
      "id": "121238",
      "original_text": "Registerbekanntmachung nach dem Umwandlungsgesetz\nBayern Amtsgericht Regensburg HRB 14878\nBvH2 GmbH – Regensburg",
      "type": "Registerbekanntmachung nach dem Umwandlungsgesetz",
      "state": "Bayern",
      "amtsgericht": "Amtsgericht Regensburg",
      "registernummer": "HRB 14878",
      "registerart": "HRB",
      "company_name": "BvH2 GmbH",
      "company_seat": "Regensburg",
      "details": "15.08.2025 (Bekanntmachungsdatum)\n\nBayern Amtsgericht Regensburg HRB 14878\nRegisterbekanntmachung nach dem Umwandlungsgesetz 14.08.2025 (Eintragungsdatum)\n\nBvH2 GmbH\nGesellschaft mit beschränkter Haftung\nRegensburg\n\nDen Gläubigern der an der Verschmelzung beteiligten Rechtsträger ist, wenn sie binnen sechs Monaten nach dem Tag, an dem die Eintragung der Verschmelzung in das Register des Sitzes desjenigen Rechtsträgers, dessen Gläubiger sie sind, nach § 19 Abs. 3 UmwG als bekannt gemacht gilt, ihren Anspruch nach Grund und Höhe in Textform anmelden, Sicherheit zu leisten, soweit sie nicht Befriedigung verlangen können. Dieses Recht steht den Gläubigern jedoch nur zu, wenn sie glaubhaft machen, dass durch die Verschmelzung die Erfüllung ihrer Forderung gefährdet wird."
    },
    {
      "date": "2025-08-15",
      "id": "121239",
      "original_text": "Löschungsankündigung\nBayern Amtsgericht Ansbach HRB 7914\nOrganic Garden Farm Besitz Dinkelsbühl GmbH – Dinkelsbühl",
      "type": "Löschungsankündigung",
      "state": "Bayern",
      "amtsgericht": "Amtsgericht Ansbach",
      "registernummer": "HRB 7914",
      "registerart": "HRB",
      "company_name": "Organic Garden Farm Besitz Dinkelsbühl GmbH",
      "company_seat": "Dinkelsbühl",
      "details": "15.08.2025 (Bekanntmachungsdatum)\n\nBayern Amtsgericht Ansbach HRB 7914\nLöschungsankündigung\n\nOrganic Garden Farm Besitz Dinkelsbühl GmbH\nGesellschaft mit beschränkter Haftung\nDinkelsbühl\n\nDas Registergericht beabsichtigt, die im Handelsregister eingetragene Gesellschaft wegen Vermögenslosigkeit von Amts wegen nach § 394 FamFG zu löschen. Die Frist zur Erhebung eines Widerspruchs ist auf sechs Wochen festgesetzt."
    },
    {
      "date": "2025-08-15",
      "id": "121240",
      "original_text": "Registerbekanntmachung nach dem Umwandlungsgesetz\nBayern Amtsgericht München HRB 243341\npura fooda GmbH – Starnberg",
      "type": "Registerbekanntmachung nach dem Umwandlungsgesetz",
      "state": "Bayern",
      "amtsgericht": "Amtsgericht München",
      "registernummer": "HRB 243341",
      "registerart": "HRB",
      "company_name": "pura fooda GmbH",
      "company_seat": "Starnberg",
      "details": "15.08.2025 (Bekanntmachungsdatum)\n\nBayern Amtsgericht München HRB 243341\nRegisterbekanntmachung nach dem Umwandlungsgesetz 14.08.2025 (Eintragungsdatum)\n\npura fooda GmbH\nGesellschaft mit beschränkter Haftung\nStarnberg\n\nDen Gläubigern der an der Verschmelzung beteiligten Rechtsträger ist, wenn sie binnen sechs Monaten nach dem Tag, an dem die Eintragung der Verschmelzung in das Register des Sitzes desjenigen Rechtsträgers, dessen Gläubiger sie sind, nach § 19 Abs. 3 UmwG als bekannt gemacht gilt, ihren Anspruch nach Grund und Höhe in Textform anmelden, Sicherheit zu leisten, soweit sie nicht Befriedigung verlangen können. Dieses Recht steht den Gläubigern jedoch nur zu, wenn sie glaubhaft machen, dass durch die Verschmelzung die Erfüllung ihrer Forderung gefährdet wird."
    },
    {
      "date": "2025-08-15",
      "id": "121241",
      "original_text": "Registerbekanntmachung nach dem Umwandlungsgesetz\nBayern Amtsgericht München HRB 44491\nFacit Verwaltungs GmbH – Grünwald",
      "type": "Registerbekanntmachung nach dem Umwandlungsgesetz",
      "state": "Bayern",
      "amtsgericht": "Amtsgericht München",
      "registernummer": "HRB 44491",
      "registerart": "HRB",
      "company_name": "Facit Verwaltungs GmbH",
      "company_seat": "Grünwald",
      "details": "15.08.2025 (Bekanntmachungsdatum)\n\nBayern Amtsgericht München HRB 44491\nRegisterbekanntmachung nach dem Umwandlungsgesetz 14.08.2025 (Eintragungsdatum)\n\nFacit Verwaltungs GmbH\nGesellschaft mit beschränkter Haftung\nGrünwald\n\nDen Gläubigern der an der Verschmelzung beteiligten Rechtsträger ist, wenn sie binnen sechs Monaten nach dem Tag, an dem die Eintragung der Verschmelzung in das Register des Sitzes desjenigen Rechtsträgers, dessen Gläubiger sie sind, nach § 19 Abs. 3 UmwG als bekannt gemacht gilt, ihren Anspruch nach Grund und Höhe in Textform anmelden, Sicherheit zu leisten, soweit sie nicht Befriedigung verlangen können. Dieses Recht steht den Gläubigern jedoch nur zu, wenn sie glaubhaft machen, dass durch die Verschmelzung die Erfüllung ihrer Forderung gefährdet wird."
    },
    {
      "date": "2025-08-15",
      "id": "121242",
      "original_text": "Registerbekanntmachung nach dem Umwandlungsgesetz\nBayern Amtsgericht München HRB 272032\n\"pro Task\" Consulting GmbH – München",
      "type": "Registerbekanntmachung nach dem Umwandlungsgesetz",
      "state": "Bayern",
      "amtsgericht": "Amtsgericht München",
      "registernummer": "HRB 272032",
      "registerart": "HRB",
      "company_name": "\"pro Task\" Consulting GmbH",
      "company_seat": "München",
      "details": "15.08.2025 (Bekanntmachungsdatum)\n\nBayern Amtsgericht München HRB 272032\nRegisterbekanntmachung nach dem Umwandlungsgesetz 14.08.2025 (Eintragungsdatum)\n\n\"pro Task\" Consulting GmbH\nGesellschaft mit beschränkter Haftung\nMünchen\n\nDen Gläubigern der an der Verschmelzung beteiligten Rechtsträger ist, wenn sie binnen sechs Monaten nach dem Tag, an dem die Eintragung der Verschmelzung in das Register des Sitzes desjenigen Rechtsträgers, dessen Gläubiger sie sind, nach § 19 Abs. 3 UmwG als bekannt gemacht gilt, ihren Anspruch nach Grund und Höhe in Textform anmelden, Sicherheit zu leisten, soweit sie nicht Befriedigung verlangen können. Dieses Recht steht den Gläubigern jedoch nur zu, wenn sie glaubhaft machen, dass durch die Verschmelzung die Erfüllung ihrer Forderung gefährdet wird."
    },
    {
      "date": "2025-08-15",
      "id": "121243",
      "original_text": "Einreichung neuer Dokumente\nBayern Amtsgericht Hof HRB 6404\nZukunftsEnergie Nordostbayern Wind GmbH – Wunsiedel",
      "type": "Einreichung neuer Dokumente",
      "state": "Bayern",
      "amtsgericht": "Amtsgericht Hof",
      "registernummer": "HRB 6404",
      "registerart": "HRB",
      "company_name": "ZukunftsEnergie Nordostbayern Wind GmbH",
      "company_seat": "Wunsiedel",
      "details": "15.08.2025 (Bekanntmachungsdatum)\n\nBayern Amtsgericht Hof HRB 6404\nEinreichung neuer Dokumente\n\nZukunftsEnergie Nordostbayern Wind GmbH\nGesellschaft mit beschränkter Haftung\nWunsiedel\n\nDem Amtsgericht Hof -Registergericht- ist eine Liste der Mitglieder des Aufsichtsrats eingereicht worden, § 52 Abs. 3 S. 2 GmbHG."
    },
    {
      "date": "2025-08-15",
      "id": "121244",
      "original_text": "Registerbekanntmachung nach dem Umwandlungsgesetz\nBayern Amtsgericht Amberg HRB 3491\nGSI Glastechnologie GmbH – Schönsee",
      "type": "Registerbekanntmachung nach dem Umwandlungsgesetz",
      "state": "Bayern",
      "amtsgericht": "Amtsgericht Amberg",
      "registernummer": "HRB 3491",
      "registerart": "HRB",
      "company_name": "GSI Glastechnologie GmbH",
      "company_seat": "Schönsee",
      "details": "15.08.2025 (Bekanntmachungsdatum)\n\nBayern Amtsgericht Amberg HRB 3491\nRegisterbekanntmachung nach dem Umwandlungsgesetz 14.08.2025 (Eintragungsdatum)\n\nGSI Glastechnologie GmbH\nGesellschaft mit beschränkter Haftung\nSchönsee\n\nDen Gläubigern der an der Ausgliederung beteiligten Rechtsträger ist, wenn sie binnen sechs Monaten nach dem Tag, an dem die Eintragung der Ausgliederung in das Register des Sitzes desjenigen Rechtsträgers, dessen Gläubiger sie sind, nach §§ 125, 19 Abs. 3 UmwG als bekannt gemacht gilt, ihren Anspruch nach Grund und Höhe in Textform anmelden, Sicherheit zu leisten, soweit sie nicht Befriedigung verlangen können. Dieses Recht steht den Gläubigern jedoch nur zu, wenn sie glaubhaft machen, dass durch die Ausgliederung die Erfüllung ihrer Forderung gefährdet wird."
    },
    {
      "date": "2025-08-15",
      "id": "121245",
      "original_text": "Registerbekanntmachung nach dem Umwandlungsgesetz\nBayern Amtsgericht München HRB 272386\nNomis Immobilien GmbH – Neuried",
      "type": "Registerbekanntmachung nach dem Umwandlungsgesetz",
      "state": "Bayern",
      "amtsgericht": "Amtsgericht München",
      "registernummer": "HRB 272386",
      "registerart": "HRB",
      "company_name": "Nomis Immobilien GmbH",
      "company_seat": "Neuried",
      "details": "15.08.2025 (Bekanntmachungsdatum)\n\nBayern Amtsgericht München HRB 272386\nRegisterbekanntmachung nach dem Umwandlungsgesetz 14.08.2025 (Eintragungsdatum)\n\nNomis Immobilien GmbH\nGesellschaft mit beschränkter Haftung\nNeuried\n\nDen Gläubigern der an der Verschmelzung beteiligten Rechtsträger ist, wenn sie binnen sechs Monaten nach dem Tag, an dem die Eintragung der Verschmelzung in das Register des Sitzes desjenigen Rechtsträgers, dessen Gläubiger sie sind, nach § 19 Abs. 3 UmwG als bekannt gemacht gilt, ihren Anspruch nach Grund und Höhe in Textform anmelden, Sicherheit zu leisten, soweit sie nicht Befriedigung verlangen können. Dieses Recht steht den Gläubigern jedoch nur zu, wenn sie glaubhaft machen, dass durch die Verschmelzung die Erfüllung ihrer Forderung gefährdet wird."
    },
    {
      "date": "2025-08-15",
      "id": "121246",
      "original_text": "Registerbekanntmachung nach dem Umwandlungsgesetz\nBayern Amtsgericht München HRB 145703\nnu concept Asset Management GmbH – Grünwald",
      "type": "Registerbekanntmachung nach dem Umwandlungsgesetz",
      "state": "Bayern",
      "amtsgericht": "Amtsgericht München",
      "registernummer": "HRB 145703",
      "registerart": "HRB",
      "company_name": "nu concept Asset Management GmbH",
      "company_seat": "Grünwald",
      "details": "15.08.2025 (Bekanntmachungsdatum)\n\nBayern Amtsgericht München HRB 145703\nRegisterbekanntmachung nach dem Umwandlungsgesetz 14.08.2025 (Eintragungsdatum)\n\nnu concept Asset Management GmbH\nGesellschaft mit beschränkter Haftung\nGrünwald\n\nDen Gläubigern der an der Verschmelzung beteiligten Rechtsträger ist, wenn sie binnen sechs Monaten nach dem Tag, an dem die Eintragung der Verschmelzung in das Register des Sitzes desjenigen Rechtsträgers, dessen Gläubiger sie sind, nach § 19 Abs. 3 UmwG als bekannt gemacht gilt, ihren Anspruch nach Grund und Höhe in Textform anmelden, Sicherheit zu leisten, soweit sie nicht Befriedigung verlangen können. Dieses Recht steht den Gläubigern jedoch nur zu, wenn sie glaubhaft machen, dass durch die Verschmelzung die Erfüllung ihrer Forderung gefährdet wird."
    },
    {
      "date": "2025-08-15",
      "id": "121247",
      "original_text": "Registerbekanntmachung nach dem Umwandlungsgesetz\nBayern Amtsgericht München HRB 157613\nKronos Verwaltung GmbH – Grünwald",
      "type": "Registerbekanntmachung nach dem Umwandlungsgesetz",
      "state": "Bayern",
      "amtsgericht": "Amtsgericht München",
      "registernummer": "HRB 157613",
      "registerart": "HRB",
      "company_name": "Kronos Verwaltung GmbH",
      "company_seat": "Grünwald",
      "details": "15.08.2025 (Bekanntmachungsdatum)\n\nBayern Amtsgericht München HRB 157613\nRegisterbekanntmachung nach dem Umwandlungsgesetz 14.08.2025 (Eintragungsdatum)\n\nKronos Verwaltung GmbH\nGesellschaft mit beschränkter Haftung\nGrünwald\n\nDen Gläubigern der an der Verschmelzung beteiligten Rechtsträger ist, wenn sie binnen sechs Monaten nach dem Tag, an dem die Eintragung der Verschmelzung in das Register des Sitzes desjenigen Rechtsträgers, dessen Gläubiger sie sind, nach § 19 Abs. 3 UmwG als bekannt gemacht gilt, ihren Anspruch nach Grund und Höhe in Textform anmelden, Sicherheit zu leisten, soweit sie nicht Befriedigung verlangen können. Dieses Recht steht den Gläubigern jedoch nur zu, wenn sie glaubhaft machen, dass durch die Verschmelzung die Erfüllung ihrer Forderung gefährdet wird."
    },
    {
      "date": "2025-08-15",
      "id": "121248",
      "original_text": "Registerbekanntmachung nach dem Umwandlungsgesetz\nBayern Amtsgericht Aschaffenburg VR 1230\nArbeiter-Samariter-Bund, Regionalverband Bayerischer Untermain e.V. – Aschaffenburg",
      "type": "Registerbekanntmachung nach dem Umwandlungsgesetz",
      "state": "Bayern",
      "amtsgericht": "Amtsgericht Aschaffenburg",
      "registernummer": "VR 1230",
      "registerart": "VR",
      "company_name": "Arbeiter-Samariter-Bund, Regionalverband Bayerischer Untermain e.V.",
      "company_seat": "Aschaffenburg",
      "details": "15.08.2025 (Bekanntmachungsdatum)\n\nBayern Amtsgericht Aschaffenburg VR 1230\nRegisterbekanntmachung nach dem Umwandlungsgesetz 14.08.2025 (Eintragungsdatum)\n\nArbeiter-Samariter-Bund, Regionalverband Bayerischer Untermain e.V.\neingetragener Verein\nAschaffenburg\n\nDen Gläubigern der an der Verschmelzung beteiligten Rechtsträger ist, wenn sie binnen sechs Monaten nach dem Tag, an dem die Eintragung der Verschmelzung in das Register des Sitzes desjenigen Rechtsträgers, dessen Gläubiger sie sind, nach § 19 Abs. 3 UmwG als bekannt gemacht gilt, ihren Anspruch nach Grund und Höhe in Textform anmelden, Sicherheit zu leisten, soweit sie nicht Befriedigung verlangen können. Dieses Recht steht den Gläubigern jedoch nur zu, wenn sie glaubhaft machen, dass durch die Verschmelzung die Erfüllung ihrer Forderung gefährdet wird."
    },
    {
      "date": "2025-08-15",
      "id": "121249",
      "original_text": "Registerbekanntmachung nach dem Umwandlungsgesetz\nBayern Amtsgericht München HRB 168885\nBernard Ingenieure GmbH – München",
      "type": "Registerbekanntmachung nach dem Umwandlungsgesetz",
      "state": "Bayern",
      "amtsgericht": "Amtsgericht München",
      "registernummer": "HRB 168885",
      "registerart": "HRB",
      "company_name": "Bernard Ingenieure GmbH",
      "company_seat": "München",
      "details": "15.08.2025 (Bekanntmachungsdatum)\n\nBayern Amtsgericht München HRB 168885\nRegisterbekanntmachung nach dem Umwandlungsgesetz 14.08.2025 (Eintragungsdatum)\n\nBernard Ingenieure GmbH\nGesellschaft mit beschränkter Haftung\nMünchen\n\nDen Gläubigern der an der Verschmelzung beteiligten Rechtsträger ist, wenn sie binnen sechs Monaten nach dem Tag, an dem die Eintragung der Verschmelzung in das Register des Sitzes desjenigen Rechtsträgers, dessen Gläubiger sie sind, nach § 19 Abs. 3 UmwG als bekannt gemacht gilt, ihren Anspruch nach Grund und Höhe in Textform anmelden, Sicherheit zu leisten, soweit sie nicht Befriedigung verlangen können. Dieses Recht steht den Gläubigern jedoch nur zu, wenn sie glaubhaft machen, dass durch die Verschmelzung die Erfüllung ihrer Forderung gefährdet wird."
    },
    {
      "date": "2025-08-15",
      "id": "121250",
      "original_text": "Registerbekanntmachung nach dem Umwandlungsgesetz\nBayern Amtsgericht München HRB 158981\nPaulaner Brauerei Gruppe GmbH & Co. KGaA – München",
      "type": "Registerbekanntmachung nach dem Umwandlungsgesetz",
      "state": "Bayern",
      "amtsgericht": "Amtsgericht München",
      "registernummer": "HRB 158981",
      "registerart": "HRB",
      "company_name": "Paulaner Brauerei Gruppe GmbH & Co. KGaA",
      "company_seat": "München",
      "details": "15.08.2025 (Bekanntmachungsdatum)\n\nBayern Amtsgericht München HRB 158981\nRegisterbekanntmachung nach dem Umwandlungsgesetz\n\nPaulaner Brauerei Gruppe GmbH & Co. KGaA\nKommanditgesellschaft auf Aktien\nMünchen\n\nDem Amtsgericht München -Registergericht- ist der Entwurf eines Spaltungs- und Übernahmevertrages zwischen der Gesellschaft als übernehmendem Rechtsträger und der Auerbräu GmbH, Rosenheim (Amtsgericht Traunstein HRB 19601) zur Einsichtnahme eingereicht worden."
    },
    {
      "date": "2025-08-15",
      "id": "121251",
      "original_text": "Sonstige Registerbekanntmachung\nBayern Amtsgericht München HRB 226398\nPHÖNIX-ambulante intensive Pflege GmbH – München",
      "type": "Sonstige Registerbekanntmachung",
      "state": "Bayern",
      "amtsgericht": "Amtsgericht München",
      "registernummer": "HRB 226398",
      "registerart": "HRB",
      "company_name": "PHÖNIX-ambulante intensive Pflege GmbH",
      "company_seat": "München",
      "details": "15.08.2025 (Bekanntmachungsdatum)\n\nBayern Amtsgericht München HRB 226398\nSonstige Registerbekanntmachung 14.08.2025 (Eintragungsdatum)\n\nPHÖNIX-ambulante intensive Pflege GmbH\nGesellschaft mit beschränkter Haftung\nMünchen\n\nDen Gläubigern der Gesellschaft, deren Forderungen begründet worden sind, bevor die Eintragung der Beendigung des Beherrschungsvertrages in das Handelsregister nach § 10 des Handelsgesetzbuches als bekanntgemacht gilt, hat der andere Vertragsteil Sicherheit zu leisten, wenn sie sich binnen sechs Monaten nach der Bekanntmachung der Eintragung zu diesem Zweck bei ihm melden."
    },
    {
      "date": "2025-08-15",
      "id": "121252",
      "original_text": "Sonstige Registerbekanntmachung\nBayern Amtsgericht München HRB 226398\nPHÖNIX-ambulante intensive Pflege GmbH – München",
      "type": "Sonstige Registerbekanntmachung",
      "state": "Bayern",
      "amtsgericht": "Amtsgericht München",
      "registernummer": "HRB 226398",
      "registerart": "HRB",
      "company_name": "PHÖNIX-ambulante intensive Pflege GmbH",
      "company_seat": "München",
      "details": "15.08.2025 (Bekanntmachungsdatum)\n\nBayern Amtsgericht München HRB 226398\nSonstige Registerbekanntmachung 14.08.2025 (Eintragungsdatum)\n\nPHÖNIX-ambulante intensive Pflege GmbH\nGesellschaft mit beschränkter Haftung\nMünchen\n\nDen Gläubigern der Gesellschaft, deren Forderungen begründet worden sind, bevor die Eintragung der Beendigung des Gewinnabführungsvertrages in das Handelsregister nach § 10 des Handelsgesetzbuches als bekanntgemacht gilt, hat der andere Vertragsteil Sicherheit zu leisten, wenn sie sich binnen sechs Monaten nach der Bekanntmachung der Eintragung zu diesem Zweck bei ihm melden."
    },
    {
      "date": "2025-08-15",
      "id": "121253",
      "original_text": "Registerbekanntmachung nach dem Umwandlungsgesetz\nBayern Amtsgericht Landshut HRB 14914\nSNT Invest GmbH – Kumhausen",
      "type": "Registerbekanntmachung nach dem Umwandlungsgesetz",
      "state": "Bayern",
      "amtsgericht": "Amtsgericht Landshut",
      "registernummer": "HRB 14914",
      "registerart": "HRB",
      "company_name": "SNT Invest GmbH",
      "company_seat": "Kumhausen",
      "details": "15.08.2025 (Bekanntmachungsdatum)\n\nBayern Amtsgericht Landshut HRB 14914\nRegisterbekanntmachung nach dem Umwandlungsgesetz 14.08.2025 (Eintragungsdatum)\n\nSNT Invest GmbH\nGesellschaft mit beschränkter Haftung\nKumhausen\n\nDen Gläubigern der an der Spaltung beteiligten Rechtsträger ist, wenn sie binnen sechs Monaten nach dem Tag, an dem die Eintragung der Spaltung in das Register des Sitzes desjenigen Rechtsträgers, dessen Gläubiger sie sind, nach §§ 125, 19 Abs. 3 UmwG als bekannt gemacht gilt, ihren Anspruch nach Grund und Höhe in Textform anmelden, Sicherheit zu leisten, soweit sie nicht Befriedigung verlangen können. Dieses Recht steht den Gläubigern jedoch nur zu, wenn sie glaubhaft machen, dass durch die Spaltung die Erfüllung ihrer Forderung gefährdet wird."
    },
    {
      "date": "2025-08-15",
      "id": "121254",
      "original_text": "Registerbekanntmachung nach dem Umwandlungsgesetz\nBayern Amtsgericht Landshut HRB 13500\nTHERAmove Physiotherapie SR GmbH – Pfarrkirchen",
      "type": "Registerbekanntmachung nach dem Umwandlungsgesetz",
      "state": "Bayern",
      "amtsgericht": "Amtsgericht Landshut",
      "registernummer": "HRB 13500",
      "registerart": "HRB",
      "company_name": "THERAmove Physiotherapie SR GmbH",
      "company_seat": "Pfarrkirchen",
      "details": "15.08.2025 (Bekanntmachungsdatum)\n\nBayern Amtsgericht Landshut HRB 13500\nRegisterbekanntmachung nach dem Umwandlungsgesetz 14.08.2025 (Eintragungsdatum)\n\nTHERAmove Physiotherapie SR GmbH\nGesellschaft mit beschränkter Haftung\nPfarrkirchen\n\nDen Gläubigern der an der Verschmelzung beteiligten Rechtsträger ist, wenn sie binnen sechs Monaten nach dem Tag, an dem die Eintragung der Verschmelzung in das Register des Sitzes desjenigen Rechtsträgers, dessen Gläubiger sie sind, nach § 19 Abs. 3 UmwG als bekannt gemacht gilt, ihren Anspruch nach Grund und Höhe in Textform anmelden, Sicherheit zu leisten, soweit sie nicht Befriedigung verlangen können. Dieses Recht steht den Gläubigern jedoch nur zu, wenn sie glaubhaft machen, dass durch die Verschmelzung die Erfüllung ihrer Forderung gefährdet wird."
    },
    {
      "date": "2025-08-15",
      "id": "121255",
      "original_text": "Einreichung neuer Dokumente\nBayern Amtsgericht Nürnberg HRB 1070\nStädtische Werke Nürnberg Gesellschaft mit beschränkter Haftung – Nürnberg",
      "type": "Einreichung neuer Dokumente",
      "state": "Bayern",
      "amtsgericht": "Amtsgericht Nürnberg",
      "registernummer": "HRB 1070",
      "registerart": "HRB",
      "company_name": "Städtische Werke Nürnberg Gesellschaft mit beschränkter Haftung",
      "company_seat": "Nürnberg",
      "details": "15.08.2025 (Bekanntmachungsdatum)\n\nBayern Amtsgericht Nürnberg HRB 1070\nEinreichung neuer Dokumente\n\nStädtische Werke Nürnberg Gesellschaft mit beschränkter Haftung\nGesellschaft mit beschränkter Haftung\nNürnberg\n\nDem Amtsgericht Nürnberg -Registergericht- ist eine Liste der Mitglieder des Aufsichtsrats eingereicht worden, § 52 Abs. 3 S. 2 GmbHG."
    },
    {
      "date": "2025-08-15",
      "id": "121256",
      "original_text": "Registerbekanntmachung nach dem Umwandlungsgesetz\nBayern Amtsgericht München HRB 173994\nFAVOS GmbH – München",
      "type": "Registerbekanntmachung nach dem Umwandlungsgesetz",
      "state": "Bayern",
      "amtsgericht": "Amtsgericht München",
      "registernummer": "HRB 173994",
      "registerart": "HRB",
      "company_name": "FAVOS GmbH",
      "company_seat": "München",
      "details": "15.08.2025 (Bekanntmachungsdatum)\n\nBayern Amtsgericht München HRB 173994\nRegisterbekanntmachung nach dem Umwandlungsgesetz 14.08.2025 (Eintragungsdatum)\n\nFAVOS GmbH\nGesellschaft mit beschränkter Haftung\nMünchen\n\nDen Gläubigern der an der Verschmelzung beteiligten Rechtsträger ist, wenn sie binnen sechs Monaten nach dem Tag, an dem die Eintragung der Verschmelzung in das Register des Sitzes desjenigen Rechtsträgers, dessen Gläubiger sie sind, nach § 19 Abs. 3 UmwG als bekannt gemacht gilt, ihren Anspruch nach Grund und Höhe in Textform anmelden, Sicherheit zu leisten, soweit sie nicht Befriedigung verlangen können. Dieses Recht steht den Gläubigern jedoch nur zu, wenn sie glaubhaft machen, dass durch die Verschmelzung die Erfüllung ihrer Forderung gefährdet wird."
    },
    {
      "date": "2025-08-15",
      "id": "121257",
      "original_text": "Registerbekanntmachung nach dem Umwandlungsgesetz\nBayern Amtsgericht München HRB 121363\nTUCANA Verwaltungsgesellschaft mbH – Pullach",
      "type": "Registerbekanntmachung nach dem Umwandlungsgesetz",
      "state": "Bayern",
      "amtsgericht": "Amtsgericht München",
      "registernummer": "HRB 121363",
      "registerart": "HRB",
      "company_name": "TUCANA Verwaltungsgesellschaft mbH",
      "company_seat": "Pullach",
      "details": "15.08.2025 (Bekanntmachungsdatum)\n\nBayern Amtsgericht München HRB 121363\nRegisterbekanntmachung nach dem Umwandlungsgesetz 14.08.2025 (Eintragungsdatum)\n\nTUCANA Verwaltungsgesellschaft mbH\nGesellschaft mit beschränkter Haftung\nPullach\n\nDen Gläubigern der an der Verschmelzung beteiligten Rechtsträger ist, wenn sie binnen sechs Monaten nach dem Tag, an dem die Eintragung der Verschmelzung in das Register des Sitzes desjenigen Rechtsträgers, dessen Gläubiger sie sind, nach § 19 Abs. 3 UmwG als bekannt gemacht gilt, ihren Anspruch nach Grund und Höhe in Textform anmelden, Sicherheit zu leisten, soweit sie nicht Befriedigung verlangen können. Dieses Recht steht den Gläubigern jedoch nur zu, wenn sie glaubhaft machen, dass durch die Verschmelzung die Erfüllung ihrer Forderung gefährdet wird."
    },
    {
      "date": "2025-08-15",
      "id": "121258",
      "original_text": "Registerbekanntmachung nach dem Umwandlungsgesetz\nBayern Amtsgericht München HRB 94002\nREPA Deutschland GmbH – Bergkirchen",
      "type": "Registerbekanntmachung nach dem Umwandlungsgesetz",
      "state": "Bayern",
      "amtsgericht": "Amtsgericht München",
      "registernummer": "HRB 94002",
      "registerart": "HRB",
      "company_name": "REPA Deutschland GmbH",
      "company_seat": "Bergkirchen",
      "details": "15.08.2025 (Bekanntmachungsdatum)\n\nBayern Amtsgericht München HRB 94002\nRegisterbekanntmachung nach dem Umwandlungsgesetz 14.08.2025 (Eintragungsdatum)\n\nREPA Deutschland GmbH\nGesellschaft mit beschränkter Haftung\nBergkirchen\n\nDen Gläubigern der an der Verschmelzung beteiligten Rechtsträger ist, wenn sie binnen sechs Monaten nach dem Tag, an dem die Eintragung der Verschmelzung in das Register des Sitzes desjenigen Rechtsträgers, dessen Gläubiger sie sind, nach § 19 Abs. 3 UmwG als bekannt gemacht gilt, ihren Anspruch nach Grund und Höhe in Textform anmelden, Sicherheit zu leisten, soweit sie nicht Befriedigung verlangen können. Dieses Recht steht den Gläubigern jedoch nur zu, wenn sie glaubhaft machen, dass durch die Verschmelzung die Erfüllung ihrer Forderung gefährdet wird."
    },
    {
      "date": "2025-08-15",
      "id": "121259",
      "original_text": "Registerbekanntmachung nach dem Umwandlungsgesetz\nBayern Amtsgericht Landshut HRB 13383\nTHERAmove PAN GmbH – Pfarrkirchen",
      "type": "Registerbekanntmachung nach dem Umwandlungsgesetz",
      "state": "Bayern",
      "amtsgericht": "Amtsgericht Landshut",
      "registernummer": "HRB 13383",
      "registerart": "HRB",
      "company_name": "THERAmove PAN GmbH",
      "company_seat": "Pfarrkirchen",
      "details": "15.08.2025 (Bekanntmachungsdatum)\n\nBayern Amtsgericht Landshut HRB 13383\nRegisterbekanntmachung nach dem Umwandlungsgesetz 14.08.2025 (Eintragungsdatum)\n\nTHERAmove PAN GmbH\nGesellschaft mit beschränkter Haftung\nPfarrkirchen\n\nDen Gläubigern der an der Verschmelzung beteiligten Rechtsträger ist, wenn sie binnen sechs Monaten nach dem Tag, an dem die Eintragung der Verschmelzung in das Register des Sitzes desjenigen Rechtsträgers, dessen Gläubiger sie sind, nach § 19 Abs. 3 UmwG als bekannt gemacht gilt, ihren Anspruch nach Grund und Höhe in Textform anmelden, Sicherheit zu leisten, soweit sie nicht Befriedigung verlangen können. Dieses Recht steht den Gläubigern jedoch nur zu, wenn sie glaubhaft machen, dass durch die Verschmelzung die Erfüllung ihrer Forderung gefährdet wird."
    },
    {
      "date": "2025-08-15",
      "id": "121260",
      "original_text": "Registerbekanntmachung nach dem Umwandlungsgesetz\nBayern Amtsgericht Landshut HRB 4937\nLaVita GmbH – Kumhausen",
      "type": "Registerbekanntmachung nach dem Umwandlungsgesetz",
      "state": "Bayern",
      "amtsgericht": "Amtsgericht Landshut",
      "registernummer": "HRB 4937",
      "registerart": "HRB",
      "company_name": "LaVita GmbH",
      "company_seat": "Kumhausen",
      "details": "15.08.2025 (Bekanntmachungsdatum)\n\nBayern Amtsgericht Landshut HRB 4937\nRegisterbekanntmachung nach dem Umwandlungsgesetz 14.08.2025 (Eintragungsdatum)\n\nLaVita GmbH\nGesellschaft mit beschränkter Haftung\nKumhausen\n\nDen Gläubigern der an der Spaltung beteiligten Rechtsträger ist, wenn sie binnen sechs Monaten nach dem Tag, an dem die Eintragung der Spaltung in das Register des Sitzes desjenigen Rechtsträgers, dessen Gläubiger sie sind, nach §§ 125, 19 Abs. 3 UmwG als bekannt gemacht gilt, ihren Anspruch nach Grund und Höhe in Textform anmelden, Sicherheit zu leisten, soweit sie nicht Befriedigung verlangen können. Dieses Recht steht den Gläubigern jedoch nur zu, wenn sie glaubhaft machen, dass durch die Spaltung die Erfüllung ihrer Forderung gefährdet wird."
    },
    {
      "date": "2025-08-15",
      "id": "121261",
      "original_text": "Einreichung neuer Dokumente\nBayern Amtsgericht Hof HRB 4874\nZukunftsEnergie Nordostbayern GmbH – Wunsiedel",
      "type": "Einreichung neuer Dokumente",
      "state": "Bayern",
      "amtsgericht": "Amtsgericht Hof",
      "registernummer": "HRB 4874",
      "registerart": "HRB",
      "company_name": "ZukunftsEnergie Nordostbayern GmbH",
      "company_seat": "Wunsiedel",
      "details": "15.08.2025 (Bekanntmachungsdatum)\n\nBayern Amtsgericht Hof HRB 4874\nEinreichung neuer Dokumente\n\nZukunftsEnergie Nordostbayern GmbH\nGesellschaft mit beschränkter Haftung\nWunsiedel\n\nDem Amtsgericht Hof -Registergericht- ist eine Liste der Mitglieder des Aufsichtsrats eingereicht worden, § 52 Abs. 3 S. 2 GmbHG."
    },
    {
      "date": "2025-08-15",
      "id": "121262",
      "original_text": "Registerbekanntmachung nach dem Umwandlungsgesetz\nBayern Amtsgericht Aschaffenburg HRB 9963\nLinde Material Handling GmbH – Aschaffenburg",
      "type": "Registerbekanntmachung nach dem Umwandlungsgesetz",
      "state": "Bayern",
      "amtsgericht": "Amtsgericht Aschaffenburg",
      "registernummer": "HRB 9963",
      "registerart": "HRB",
      "company_name": "Linde Material Handling GmbH",
      "company_seat": "Aschaffenburg",
      "details": "15.08.2025 (Bekanntmachungsdatum)\n\nBayern Amtsgericht Aschaffenburg HRB 9963\nRegisterbekanntmachung nach dem Umwandlungsgesetz 14.08.2025 (Eintragungsdatum)\n\nLinde Material Handling GmbH\nGesellschaft mit beschränkter Haftung\nAschaffenburg\n\nDen Gläubigern der an der Verschmelzung beteiligten Rechtsträger ist, wenn sie binnen sechs Monaten nach dem Tag, an dem die Eintragung der Verschmelzung in das Register des Sitzes desjenigen Rechtsträgers, dessen Gläubiger sie sind, nach § 19 Abs. 3 UmwG als bekannt gemacht gilt, ihren Anspruch nach Grund und Höhe in Textform anmelden, Sicherheit zu leisten, soweit sie nicht Befriedigung verlangen können. Dieses Recht steht den Gläubigern jedoch nur zu, wenn sie glaubhaft machen, dass durch die Verschmelzung die Erfüllung ihrer Forderung gefährdet wird."
    },
    {
      "date": "2025-08-15",
      "id": "121263",
      "original_text": "Registerbekanntmachung nach dem Umwandlungsgesetz\nBayern Amtsgericht München HRB 272078\nSUSTAINX GmbH – München",
      "type": "Registerbekanntmachung nach dem Umwandlungsgesetz",
      "state": "Bayern",
      "amtsgericht": "Amtsgericht München",
      "registernummer": "HRB 272078",
      "registerart": "HRB",
      "company_name": "SUSTAINX GmbH",
      "company_seat": "München",
      "details": "15.08.2025 (Bekanntmachungsdatum)\n\nBayern Amtsgericht München HRB 272078\nRegisterbekanntmachung nach dem Umwandlungsgesetz 14.08.2025 (Eintragungsdatum)\n\nSUSTAINX GmbH\nGesellschaft mit beschränkter Haftung\nMünchen\n\nDen Gläubigern der an der Verschmelzung beteiligten Rechtsträger ist, wenn sie binnen sechs Monaten nach dem Tag, an dem die Eintragung der Verschmelzung in das Register des Sitzes desjenigen Rechtsträgers, dessen Gläubiger sie sind, nach § 19 Abs. 3 UmwG als bekannt gemacht gilt, ihren Anspruch nach Grund und Höhe in Textform anmelden, Sicherheit zu leisten, soweit sie nicht Befriedigung verlangen können. Dieses Recht steht den Gläubigern jedoch nur zu, wenn sie glaubhaft machen, dass durch die Verschmelzung die Erfüllung ihrer Forderung gefährdet wird."
    },
    {
      "date": "2025-08-15",
      "id": "121264",
      "original_text": "Registerbekanntmachung nach dem Umwandlungsgesetz\nBayern Amtsgericht München HRB 243233\nTCBS Projekte GmbH – Starnberg",
      "type": "Registerbekanntmachung nach dem Umwandlungsgesetz",
      "state": "Bayern",
      "amtsgericht": "Amtsgericht München",
      "registernummer": "HRB 243233",
      "registerart": "HRB",
      "company_name": "TCBS Projekte GmbH",
      "company_seat": "Starnberg",
      "details": "15.08.2025 (Bekanntmachungsdatum)\n\nBayern Amtsgericht München HRB 243233\nRegisterbekanntmachung nach dem Umwandlungsgesetz 14.08.2025 (Eintragungsdatum)\n\nTCBS Projekte GmbH\nGesellschaft mit beschränkter Haftung\nStarnberg\n\nDen Gläubigern der an der Verschmelzung beteiligten Rechtsträger ist, wenn sie binnen sechs Monaten nach dem Tag, an dem die Eintragung der Verschmelzung in das Register des Sitzes desjenigen Rechtsträgers, dessen Gläubiger sie sind, nach § 19 Abs. 3 UmwG als bekannt gemacht gilt, ihren Anspruch nach Grund und Höhe in Textform anmelden, Sicherheit zu leisten, soweit sie nicht Befriedigung verlangen können. Dieses Recht steht den Gläubigern jedoch nur zu, wenn sie glaubhaft machen, dass durch die Verschmelzung die Erfüllung ihrer Forderung gefährdet wird."
    },
    {
      "date": "2025-08-15",
      "id": "121265",
      "original_text": "Registerbekanntmachung nach dem Umwandlungsgesetz\nBayern Amtsgericht Ingolstadt HRB 10313\nProlignis International GmbH – Ingolstadt",
      "type": "Registerbekanntmachung nach dem Umwandlungsgesetz",
      "state": "Bayern",
      "amtsgericht": "Amtsgericht Ingolstadt",
      "registernummer": "HRB 10313",
      "registerart": "HRB",
      "company_name": "Prolignis International GmbH",
      "company_seat": "Ingolstadt",
      "details": "15.08.2025 (Bekanntmachungsdatum)\n\nBayern Amtsgericht Ingolstadt HRB 10313\nRegisterbekanntmachung nach dem Umwandlungsgesetz 14.08.2025 (Eintragungsdatum)\n\nProlignis International GmbH\nGesellschaft mit beschränkter Haftung\nIngolstadt\n\nDen Gläubigern der an der Verschmelzung beteiligten Rechtsträger ist, wenn sie binnen sechs Monaten nach dem Tag, an dem die Eintragung der Verschmelzung in das Register des Sitzes desjenigen Rechtsträgers, dessen Gläubiger sie sind, nach § 19 Abs. 3 UmwG als bekannt gemacht gilt, ihren Anspruch nach Grund und Höhe in Textform anmelden, Sicherheit zu leisten, soweit sie nicht Befriedigung verlangen können. Dieses Recht steht den Gläubigern jedoch nur zu, wenn sie glaubhaft machen, dass durch die Verschmelzung die Erfüllung ihrer Forderung gefährdet wird."
    },
    {
      "date": "2025-08-15",
      "id": "121266",
      "original_text": "Registerbekanntmachung nach dem Umwandlungsgesetz\nBayern Amtsgericht Passau HRB 10358\nUmdenk-Akademie GmbH – Passau",
      "type": "Registerbekanntmachung nach dem Umwandlungsgesetz",
      "state": "Bayern",
      "amtsgericht": "Amtsgericht Passau",
      "registernummer": "HRB 10358",
      "registerart": "HRB",
      "company_name": "Umdenk-Akademie GmbH",
      "company_seat": "Passau",
      "details": "15.08.2025 (Bekanntmachungsdatum)\n\nBayern Amtsgericht Passau HRB 10358\nRegisterbekanntmachung nach dem Umwandlungsgesetz 14.08.2025 (Eintragungsdatum)\n\nUmdenk-Akademie GmbH\nGesellschaft mit beschränkter Haftung\nPassau\n\nDen Gläubigern der an der Verschmelzung beteiligten Rechtsträger ist, wenn sie binnen sechs Monaten nach dem Tag, an dem die Eintragung der Verschmelzung in das Register des Sitzes desjenigen Rechtsträgers, dessen Gläubiger sie sind, nach § 19 Abs. 3 UmwG als bekannt gemacht gilt, ihren Anspruch nach Grund und Höhe in Textform anmelden, Sicherheit zu leisten, soweit sie nicht Befriedigung verlangen können. Dieses Recht steht den Gläubigern jedoch nur zu, wenn sie glaubhaft machen, dass durch die Verschmelzung die Erfüllung ihrer Forderung gefährdet wird."
    },
    {
      "date": "2025-08-15",
      "id": "121267",
      "original_text": "Registerbekanntmachung nach dem Umwandlungsgesetz\nBayern Amtsgericht München HRB 220780\nFNT Rehaklinik-Beteiligungsgesellschaft mbH – Baierbrunn im Isartal",
      "type": "Registerbekanntmachung nach dem Umwandlungsgesetz",
      "state": "Bayern",
      "amtsgericht": "Amtsgericht München",
      "registernummer": "HRB 220780",
      "registerart": "HRB",
      "company_name": "FNT Rehaklinik-Beteiligungsgesellschaft mbH",
      "company_seat": "Baierbrunn im Isartal",
      "details": "15.08.2025 (Bekanntmachungsdatum)\n\nBayern Amtsgericht München HRB 220780\nRegisterbekanntmachung nach dem Umwandlungsgesetz 14.08.2025 (Eintragungsdatum)\n\nFNT Rehaklinik-Beteiligungsgesellschaft mbH\nGesellschaft mit beschränkter Haftung\nBaierbrunn im Isartal\n\nDen Gläubigern der an der Verschmelzung beteiligten Rechtsträger ist, wenn sie binnen sechs Monaten nach dem Tag, an dem die Eintragung der Verschmelzung in das Register des Sitzes desjenigen Rechtsträgers, dessen Gläubiger sie sind, nach § 19 Abs. 3 UmwG als bekannt gemacht gilt, ihren Anspruch nach Grund und Höhe in Textform anmelden, Sicherheit zu leisten, soweit sie nicht Befriedigung verlangen können. Dieses Recht steht den Gläubigern jedoch nur zu, wenn sie glaubhaft machen, dass durch die Verschmelzung die Erfüllung ihrer Forderung gefährdet wird."
    },
    {
      "date": "2025-08-15",
      "id": "121268",
      "original_text": "Registerbekanntmachung nach dem Umwandlungsgesetz\nBayern Amtsgericht München HRB 145703\nnu concept Asset Management GmbH – Grünwald",
      "type": "Registerbekanntmachung nach dem Umwandlungsgesetz",
      "state": "Bayern",
      "amtsgericht": "Amtsgericht München",
      "registernummer": "HRB 145703",
      "registerart": "HRB",
      "company_name": "nu concept Asset Management GmbH",
      "company_seat": "Grünwald",
      "details": "15.08.2025 (Bekanntmachungsdatum)\n\nBayern Amtsgericht München HRB 145703\nRegisterbekanntmachung nach dem Umwandlungsgesetz 14.08.2025 (Eintragungsdatum)\n\nnu concept Asset Management GmbH\nGesellschaft mit beschränkter Haftung\nGrünwald\n\nDen Gläubigern der an der Verschmelzung beteiligten Rechtsträger ist, wenn sie binnen sechs Monaten nach dem Tag, an dem die Eintragung der Verschmelzung in das Register des Sitzes desjenigen Rechtsträgers, dessen Gläubiger sie sind, nach § 19 Abs. 3 UmwG als bekannt gemacht gilt, ihren Anspruch nach Grund und Höhe in Textform anmelden, Sicherheit zu leisten, soweit sie nicht Befriedigung verlangen können. Dieses Recht steht den Gläubigern jedoch nur zu, wenn sie glaubhaft machen, dass durch die Verschmelzung die Erfüllung ihrer Forderung gefährdet wird."
    },
    {
      "date": "2025-08-15",
      "id": "121269",
      "original_text": "Registerbekanntmachung nach dem Umwandlungsgesetz\nBayern Amtsgericht Hof HRA 4975\nYeti Green Energy GmbH & Co. KG – Wunsiedel",
      "type": "Registerbekanntmachung nach dem Umwandlungsgesetz",
      "state": "Bayern",
      "amtsgericht": "Amtsgericht Hof",
      "registernummer": "HRA 4975",
      "registerart": "HRA",
      "company_name": "Yeti Green Energy GmbH & Co. KG",
      "company_seat": "Wunsiedel",
      "details": "15.08.2025 (Bekanntmachungsdatum)\n\nBayern Amtsgericht Hof HRA 4975\nRegisterbekanntmachung nach dem Umwandlungsgesetz 14.08.2025 (Eintragungsdatum)\n\nYeti Green Energy GmbH & Co. KG\nKommanditgesellschaft\nWunsiedel\n\nDen Gläubigern der an der Ausgliederung beteiligten Rechtsträger ist, wenn sie binnen sechs Monaten nach dem Tag, an dem die Eintragung der Ausgliederung in das Register des Sitzes desjenigen Rechtsträgers, dessen Gläubiger sie sind, nach §§ 125, 19 Abs. 3 UmwG als bekannt gemacht gilt, ihren Anspruch nach Grund und Höhe in Textform anmelden, Sicherheit zu leisten, soweit sie nicht Befriedigung verlangen können. Dieses Recht steht den Gläubigern jedoch nur zu, wenn sie glaubhaft machen, dass durch die Ausgliederung die Erfüllung ihrer Forderung gefährdet wird."
    },
    {
      "date": "2025-08-15",
      "id": "121270",
      "original_text": "Registerbekanntmachung nach dem Umwandlungsgesetz\nBayern Amtsgericht München HRB 242242\nRöslerhaus GmbH – Fischbachau",
      "type": "Registerbekanntmachung nach dem Umwandlungsgesetz",
      "state": "Bayern",
      "amtsgericht": "Amtsgericht München",
      "registernummer": "HRB 242242",
      "registerart": "HRB",
      "company_name": "Röslerhaus GmbH",
      "company_seat": "Fischbachau",
      "details": "15.08.2025 (Bekanntmachungsdatum)\n\nBayern Amtsgericht München HRB 242242\nRegisterbekanntmachung nach dem Umwandlungsgesetz 14.08.2025 (Eintragungsdatum)\n\nRöslerhaus GmbH\nGesellschaft mit beschränkter Haftung\nFischbachau\n\nDen Gläubigern der an der Verschmelzung beteiligten Rechtsträger ist, wenn sie binnen sechs Monaten nach dem Tag, an dem die Eintragung der Verschmelzung in das Register des Sitzes desjenigen Rechtsträgers, dessen Gläubiger sie sind, nach § 19 Abs. 3 UmwG als bekannt gemacht gilt, ihren Anspruch nach Grund und Höhe in Textform anmelden, Sicherheit zu leisten, soweit sie nicht Befriedigung verlangen können. Dieses Recht steht den Gläubigern jedoch nur zu, wenn sie glaubhaft machen, dass durch die Verschmelzung die Erfüllung ihrer Forderung gefährdet wird."
    },
    {
      "date": "2025-08-15",
      "id": "121271",
      "original_text": "Registerbekanntmachung nach dem Umwandlungsgesetz\nBayern Amtsgericht Ingolstadt HRB 7931\nProlignis AG – Ingolstadt",
      "type": "Registerbekanntmachung nach dem Umwandlungsgesetz",
      "state": "Bayern",
      "amtsgericht": "Amtsgericht Ingolstadt",
      "registernummer": "HRB 7931",
      "registerart": "HRB",
      "company_name": "Prolignis AG",
      "company_seat": "Ingolstadt",
      "details": "15.08.2025 (Bekanntmachungsdatum)\n\nBayern Amtsgericht Ingolstadt HRB 7931\nRegisterbekanntmachung nach dem Umwandlungsgesetz 14.08.2025 (Eintragungsdatum)\n\nProlignis AG\nAktiengesellschaft\nIngolstadt\n\nDen Gläubigern der an der Verschmelzung beteiligten Rechtsträger ist, wenn sie binnen sechs Monaten nach dem Tag, an dem die Eintragung der Verschmelzung in das Register des Sitzes desjenigen Rechtsträgers, dessen Gläubiger sie sind, nach § 19 Abs. 3 UmwG als bekannt gemacht gilt, ihren Anspruch nach Grund und Höhe in Textform anmelden, Sicherheit zu leisten, soweit sie nicht Befriedigung verlangen können. Dieses Recht steht den Gläubigern jedoch nur zu, wenn sie glaubhaft machen, dass durch die Verschmelzung die Erfüllung ihrer Forderung gefährdet wird."
    },
    {
      "date": "2025-08-15",
      "id": "121272",
      "original_text": "Registerbekanntmachung nach dem Umwandlungsgesetz\nBayern Amtsgericht Amberg HRB 7093\nPrelit GmbH – Fensterbach",
      "type": "Registerbekanntmachung nach dem Umwandlungsgesetz",
      "state": "Bayern",
      "amtsgericht": "Amtsgericht Amberg",
      "registernummer": "HRB 7093",
      "registerart": "HRB",
      "company_name": "Prelit GmbH",
      "company_seat": "Fensterbach",
      "details": "15.08.2025 (Bekanntmachungsdatum)\n\nBayern Amtsgericht Amberg HRB 7093\nRegisterbekanntmachung nach dem Umwandlungsgesetz 14.08.2025 (Eintragungsdatum)\n\nPrelit GmbH\nGesellschaft mit beschränkter Haftung\nFensterbach\n\nDen Gläubigern der an der Verschmelzung beteiligten Rechtsträger ist, wenn sie binnen sechs Monaten nach dem Tag, an dem die Eintragung der Verschmelzung in das Register des Sitzes desjenigen Rechtsträgers, dessen Gläubiger sie sind, nach § 19 Abs. 3 UmwG als bekannt gemacht gilt, ihren Anspruch nach Grund und Höhe in Textform anmelden, Sicherheit zu leisten, soweit sie nicht Befriedigung verlangen können. Dieses Recht steht den Gläubigern jedoch nur zu, wenn sie glaubhaft machen, dass durch die Verschmelzung die Erfüllung ihrer Forderung gefährdet wird."
    },
    {
      "date": "2025-08-15",
      "id": "121273",
      "original_text": "Registerbekanntmachung nach dem Umwandlungsgesetz\nBayern Amtsgericht Würzburg HRB 16710\n265Capital GmbH – Hettstadt",
      "type": "Registerbekanntmachung nach dem Umwandlungsgesetz",
      "state": "Bayern",
      "amtsgericht": "Amtsgericht Würzburg",
      "registernummer": "HRB 16710",
      "registerart": "HRB",
      "company_name": "265Capital GmbH",
      "company_seat": "Hettstadt",
      "details": "15.08.2025 (Bekanntmachungsdatum)\n\nBayern Amtsgericht Würzburg HRB 16710\nRegisterbekanntmachung nach dem Umwandlungsgesetz 14.08.2025 (Eintragungsdatum)\n\n265Capital GmbH\nGesellschaft mit beschränkter Haftung\nHettstadt\n\nDen Gläubigern der an der Verschmelzung beteiligten Rechtsträger ist, wenn sie binnen sechs Monaten nach dem Tag, an dem die Eintragung der Verschmelzung in das Register des Sitzes desjenigen Rechtsträgers, dessen Gläubiger sie sind, nach § 19 Abs. 3 UmwG als bekannt gemacht gilt, ihren Anspruch nach Grund und Höhe in Textform anmelden, Sicherheit zu leisten, soweit sie nicht Befriedigung verlangen können. Dieses Recht steht den Gläubigern jedoch nur zu, wenn sie glaubhaft machen, dass durch die Verschmelzung die Erfüllung ihrer Forderung gefährdet wird."
    },
    {
      "date": "2025-08-15",
      "id": "121274",
      "original_text": "Registerbekanntmachung nach dem Umwandlungsgesetz\nBayern Amtsgericht Regensburg HRB 6277\nVORN Bioenergy GmbH – Regensburg",
      "type": "Registerbekanntmachung nach dem Umwandlungsgesetz",
      "state": "Bayern",
      "amtsgericht": "Amtsgericht Regensburg",
      "registernummer": "HRB 6277",
      "registerart": "HRB",
      "company_name": "VORN Bioenergy GmbH",
      "company_seat": "Regensburg",
      "details": "15.08.2025 (Bekanntmachungsdatum)\n\nBayern Amtsgericht Regensburg HRB 6277\nRegisterbekanntmachung nach dem Umwandlungsgesetz 14.08.2025 (Eintragungsdatum)\n\nVORN Bioenergy GmbH\nGesellschaft mit beschränkter Haftung\nRegensburg\n\nDen Gläubigern der an der Verschmelzung beteiligten Rechtsträger ist, wenn sie binnen sechs Monaten nach dem Tag, an dem die Eintragung der Verschmelzung in das Register des Sitzes desjenigen Rechtsträgers, dessen Gläubiger sie sind, nach § 19 Abs. 3 UmwG als bekannt gemacht gilt, ihren Anspruch nach Grund und Höhe in Textform anmelden, Sicherheit zu leisten, soweit sie nicht Befriedigung verlangen können. Dieses Recht steht den Gläubigern jedoch nur zu, wenn sie glaubhaft machen, dass durch die Verschmelzung die Erfüllung ihrer Forderung gefährdet wird."
    },
    {
      "date": "2025-08-15",
      "id": "121275",
      "original_text": "Registerbekanntmachung nach dem Umwandlungsgesetz\nBayern Amtsgericht Würzburg HRA 6804\nBDSK Handels GmbH & Co. KG – Würzburg",
      "type": "Registerbekanntmachung nach dem Umwandlungsgesetz",
      "state": "Bayern",
      "amtsgericht": "Amtsgericht Würzburg",
      "registernummer": "HRA 6804",
      "registerart": "HRA",
      "company_name": "BDSK Handels GmbH & Co. KG",
      "company_seat": "Würzburg",
      "details": "15.08.2025 (Bekanntmachungsdatum)\n\nBayern Amtsgericht Würzburg HRA 6804\nRegisterbekanntmachung nach dem Umwandlungsgesetz 14.08.2025 (Eintragungsdatum)\n\nBDSK Handels GmbH & Co. KG\nKommanditgesellschaft\nWürzburg\n\nDen Gläubigern der an der Verschmelzung beteiligten Rechtsträger ist, wenn sie binnen sechs Monaten nach dem Tag, an dem die Eintragung der Verschmelzung in das Register des Sitzes desjenigen Rechtsträgers, dessen Gläubiger sie sind, nach § 19 Abs. 3 UmwG als bekannt gemacht gilt, ihren Anspruch nach Grund und Höhe in Textform anmelden, Sicherheit zu leisten, soweit sie nicht Befriedigung verlangen können. Dieses Recht steht den Gläubigern jedoch nur zu, wenn sie glaubhaft machen, dass durch die Verschmelzung die Erfüllung ihrer Forderung gefährdet wird."
    },
    {
      "date": "2025-08-15",
      "id": "121276",
      "original_text": "Registerbekanntmachung nach dem Umwandlungsgesetz\nBayern Amtsgericht Regensburg HRB 18022\nVORN Bioenergy Asset Holding GmbH – Regensburg",
      "type": "Registerbekanntmachung nach dem Umwandlungsgesetz",
      "state": "Bayern",
      "amtsgericht": "Amtsgericht Regensburg",
      "registernummer": "HRB 18022",
      "registerart": "HRB",
      "company_name": "VORN Bioenergy Asset Holding GmbH",
      "company_seat": "Regensburg",
      "details": "15.08.2025 (Bekanntmachungsdatum)\n\nBayern Amtsgericht Regensburg HRB 18022\nRegisterbekanntmachung nach dem Umwandlungsgesetz 14.08.2025 (Eintragungsdatum)\n\nVORN Bioenergy Asset Holding GmbH\nGesellschaft mit beschränkter Haftung\nRegensburg\n\nDen Gläubigern der an der Verschmelzung beteiligten Rechtsträger ist, wenn sie binnen sechs Monaten nach dem Tag, an dem die Eintragung der Verschmelzung in das Register des Sitzes desjenigen Rechtsträgers, dessen Gläubiger sie sind, nach § 19 Abs. 3 UmwG als bekannt gemacht gilt, ihren Anspruch nach Grund und Höhe in Textform anmelden, Sicherheit zu leisten, soweit sie nicht Befriedigung verlangen können. Dieses Recht steht den Gläubigern jedoch nur zu, wenn sie glaubhaft machen, dass durch die Verschmelzung die Erfüllung ihrer Forderung gefährdet wird."
    },
    {
      "date": "2025-08-15",
      "id": "121277",
      "original_text": "Registerbekanntmachung nach dem Umwandlungsgesetz\nBayern Amtsgericht München HRB 256067\nPP Media MidCo GmbH – München",
      "type": "Registerbekanntmachung nach dem Umwandlungsgesetz",
      "state": "Bayern",
      "amtsgericht": "Amtsgericht München",
      "registernummer": "HRB 256067",
      "registerart": "HRB",
      "company_name": "PP Media MidCo GmbH",
      "company_seat": "München",
      "details": "15.08.2025 (Bekanntmachungsdatum)\n\nBayern Amtsgericht München HRB 256067\nRegisterbekanntmachung nach dem Umwandlungsgesetz 14.08.2025 (Eintragungsdatum)\n\nPP Media MidCo GmbH\nGesellschaft mit beschränkter Haftung\nMünchen\n\nDen Gläubigern der an der Verschmelzung beteiligten Rechtsträger ist, wenn sie binnen sechs Monaten nach dem Tag, an dem die Eintragung der Verschmelzung in das Register des Sitzes desjenigen Rechtsträgers, dessen Gläubiger sie sind, nach § 19 Abs. 3 UmwG als bekannt gemacht gilt, ihren Anspruch nach Grund und Höhe in Textform anmelden, Sicherheit zu leisten, soweit sie nicht Befriedigung verlangen können. Dieses Recht steht den Gläubigern jedoch nur zu, wenn sie glaubhaft machen, dass durch die Verschmelzung die Erfüllung ihrer Forderung gefährdet wird."
    },
    {
      "date": "2025-08-15",
      "id": "121278",
      "original_text": "Registerbekanntmachung nach dem Umwandlungsgesetz\nBayern Amtsgericht München HRB 173590\nBernard Beteiligungs GmbH – München",
      "type": "Registerbekanntmachung nach dem Umwandlungsgesetz",
      "state": "Bayern",
      "amtsgericht": "Amtsgericht München",
      "registernummer": "HRB 173590",
      "registerart": "HRB",
      "company_name": "Bernard Beteiligungs GmbH",
      "company_seat": "München",
      "details": "15.08.2025 (Bekanntmachungsdatum)\n\nBayern Amtsgericht München HRB 173590\nRegisterbekanntmachung nach dem Umwandlungsgesetz 14.08.2025 (Eintragungsdatum)\n\nBernard Beteiligungs GmbH\nGesellschaft mit beschränkter Haftung\nMünchen\n\nDen Gläubigern der an der Verschmelzung beteiligten Rechtsträger ist, wenn sie binnen sechs Monaten nach dem Tag, an dem die Eintragung der Verschmelzung in das Register des Sitzes desjenigen Rechtsträgers, dessen Gläubiger sie sind, nach § 19 Abs. 3 UmwG als bekannt gemacht gilt, ihren Anspruch nach Grund und Höhe in Textform anmelden, Sicherheit zu leisten, soweit sie nicht Befriedigung verlangen können. Dieses Recht steht den Gläubigern jedoch nur zu, wenn sie glaubhaft machen, dass durch die Verschmelzung die Erfüllung ihrer Forderung gefährdet wird."
    },
    {
      "date": "2025-08-15",
      "id": "121279",
      "original_text": "Registerbekanntmachung nach dem Umwandlungsgesetz\nBayern Amtsgericht München HRB 263640\nNovales GmbH – Feldkirchen",
      "type": "Registerbekanntmachung nach dem Umwandlungsgesetz",
      "state": "Bayern",
      "amtsgericht": "Amtsgericht München",
      "registernummer": "HRB 263640",
      "registerart": "HRB",
      "company_name": "Novales GmbH",
      "company_seat": "Feldkirchen",
      "details": "15.08.2025 (Bekanntmachungsdatum)\n\nBayern Amtsgericht München HRB 263640\nRegisterbekanntmachung nach dem Umwandlungsgesetz 14.08.2025 (Eintragungsdatum)\n\nNovales GmbH\nGesellschaft mit beschränkter Haftung\nFeldkirchen\n\nDen Gläubigern der an der Verschmelzung beteiligten Rechtsträger ist, wenn sie binnen sechs Monaten nach dem Tag, an dem die Eintragung der Verschmelzung in das Register des Sitzes desjenigen Rechtsträgers, dessen Gläubiger sie sind, nach § 19 Abs. 3 UmwG als bekannt gemacht gilt, ihren Anspruch nach Grund und Höhe in Textform anmelden, Sicherheit zu leisten, soweit sie nicht Befriedigung verlangen können. Dieses Recht steht den Gläubigern jedoch nur zu, wenn sie glaubhaft machen, dass durch die Verschmelzung die Erfüllung ihrer Forderung gefährdet wird."
    },
    {
      "date": "2025-08-15",
      "id": "121280",
      "original_text": "Registerbekanntmachung nach dem Umwandlungsgesetz\nBayern Amtsgericht Ansbach HRB 1798\nRWH Franken GmbH – Dittenheim",
      "type": "Registerbekanntmachung nach dem Umwandlungsgesetz",
      "state": "Bayern",
      "amtsgericht": "Amtsgericht Ansbach",
      "registernummer": "HRB 1798",
      "registerart": "HRB",
      "company_name": "RWH Franken GmbH",
      "company_seat": "Dittenheim",
      "details": "15.08.2025 (Bekanntmachungsdatum)\n\nBayern Amtsgericht Ansbach HRB 1798\nRegisterbekanntmachung nach dem Umwandlungsgesetz 14.08.2025 (Eintragungsdatum)\n\nRWH Franken GmbH\nGesellschaft mit beschränkter Haftung\nDittenheim\n\nDen Gläubigern der an der Verschmelzung beteiligten Rechtsträger ist, wenn sie binnen sechs Monaten nach dem Tag, an dem die Eintragung der Verschmelzung in das Register des Sitzes desjenigen Rechtsträgers, dessen Gläubiger sie sind, nach § 19 Abs. 3 UmwG als bekannt gemacht gilt, ihren Anspruch nach Grund und Höhe in Textform anmelden, Sicherheit zu leisten, soweit sie nicht Befriedigung verlangen können. Dieses Recht steht den Gläubigern jedoch nur zu, wenn sie glaubhaft machen, dass durch die Verschmelzung die Erfüllung ihrer Forderung gefährdet wird."
    },
    {
      "date": "2025-08-15",
      "id": "121281",
      "original_text": "Löschungsankündigung\nBayern Amtsgericht Nürnberg HRB 35885\nMDS TRANSPORTE UG (haftungsbeschränkt) – Nürnberg",
      "type": "Löschungsankündigung",
      "state": "Bayern",
      "amtsgericht": "Amtsgericht Nürnberg",
      "registernummer": "HRB 35885",
      "registerart": "HRB",
      "company_name": "MDS TRANSPORTE UG (haftungsbeschränkt)",
      "company_seat": "Nürnberg",
      "details": "15.08.2025 (Bekanntmachungsdatum)\n\nBayern Amtsgericht Nürnberg HRB 35885\nLöschungsankündigung\n\nMDS TRANSPORTE UG (haftungsbeschränkt)\nGesellschaft mit beschränkter Haftung\nNürnberg\n\nDas Registergericht beabsichtigt, die im Handelsregister eingetragene Gesellschaft wegen Vermögenslosigkeit von Amts wegen nach § 394 FamFG zu löschen. Die Frist zur Erhebung eines Widerspruchs ist auf einen Monat festgesetzt."
    },
    {
      "date": "2025-08-15",
      "id": "121282",
      "original_text": "Registerbekanntmachung nach dem Umwandlungsgesetz\nBayern Amtsgericht München HRB 263132\nDFF Holding GmbH – Neuried",
      "type": "Registerbekanntmachung nach dem Umwandlungsgesetz",
      "state": "Bayern",
      "amtsgericht": "Amtsgericht München",
      "registernummer": "HRB 263132",
      "registerart": "HRB",
      "company_name": "DFF Holding GmbH",
      "company_seat": "Neuried",
      "details": "15.08.2025 (Bekanntmachungsdatum)\n\nBayern Amtsgericht München HRB 263132\nRegisterbekanntmachung nach dem Umwandlungsgesetz 14.08.2025 (Eintragungsdatum)\n\nDFF Holding GmbH\nGesellschaft mit beschränkter Haftung\nNeuried\n\nDen Gläubigern der an der Verschmelzung beteiligten Rechtsträger ist, wenn sie binnen sechs Monaten nach dem Tag, an dem die Eintragung der Verschmelzung in das Register des Sitzes desjenigen Rechtsträgers, dessen Gläubiger sie sind, nach § 19 Abs. 3 UmwG als bekannt gemacht gilt, ihren Anspruch nach Grund und Höhe in Textform anmelden, Sicherheit zu leisten, soweit sie nicht Befriedigung verlangen können. Dieses Recht steht den Gläubigern jedoch nur zu, wenn sie glaubhaft machen, dass durch die Verschmelzung die Erfüllung ihrer Forderung gefährdet wird."
    },
    {
      "date": "2025-08-15",
      "id": "121283",
      "original_text": "Registerbekanntmachung nach dem Umwandlungsgesetz\nBayern Amtsgericht Passau HRB 6713\nMT Cargo Assekuranzmakler GmbH – Passau",
      "type": "Registerbekanntmachung nach dem Umwandlungsgesetz",
      "state": "Bayern",
      "amtsgericht": "Amtsgericht Passau",
      "registernummer": "HRB 6713",
      "registerart": "HRB",
      "company_name": "MT Cargo Assekuranzmakler GmbH",
      "company_seat": "Passau",
      "details": "15.08.2025 (Bekanntmachungsdatum)\n\nBayern Amtsgericht Passau HRB 6713\nRegisterbekanntmachung nach dem Umwandlungsgesetz 14.08.2025 (Eintragungsdatum)\n\nMT Cargo Assekuranzmakler GmbH\nGesellschaft mit beschränkter Haftung\nPassau\n\nDen Gläubigern der an der Verschmelzung beteiligten Rechtsträger ist, wenn sie binnen sechs Monaten nach dem Tag, an dem die Eintragung der Verschmelzung in das Register des Sitzes desjenigen Rechtsträgers, dessen Gläubiger sie sind, nach § 19 Abs. 3 UmwG als bekannt gemacht gilt, ihren Anspruch nach Grund und Höhe in Textform anmelden, Sicherheit zu leisten, soweit sie nicht Befriedigung verlangen können. Dieses Recht steht den Gläubigern jedoch nur zu, wenn sie glaubhaft machen, dass durch die Verschmelzung die Erfüllung ihrer Forderung gefährdet wird."
    },
    {
      "date": "2025-08-15",
      "id": "121284",
      "original_text": "Registerbekanntmachung nach dem Umwandlungsgesetz\nBayern Amtsgericht München HRB 268646\nAras Holding UG (haftungsbeschränkt) – München",
      "type": "Registerbekanntmachung nach dem Umwandlungsgesetz",
      "state": "Bayern",
      "amtsgericht": "Amtsgericht München",
      "registernummer": "HRB 268646",
      "registerart": "HRB",
      "company_name": "Aras Holding UG (haftungsbeschränkt)",
      "company_seat": "München",
      "details": "15.08.2025 (Bekanntmachungsdatum)\n\nBayern Amtsgericht München HRB 268646\nRegisterbekanntmachung nach dem Umwandlungsgesetz 14.08.2025 (Eintragungsdatum)\n\nAras Holding UG (haftungsbeschränkt)\nGesellschaft mit beschränkter Haftung\nMünchen\n\nDen Gläubigern der an der Verschmelzung beteiligten Rechtsträger ist, wenn sie binnen sechs Monaten nach dem Tag, an dem die Eintragung der Verschmelzung in das Register des Sitzes desjenigen Rechtsträgers, dessen Gläubiger sie sind, nach § 19 Abs. 3 UmwG als bekannt gemacht gilt, ihren Anspruch nach Grund und Höhe in Textform anmelden, Sicherheit zu leisten, soweit sie nicht Befriedigung verlangen können. Dieses Recht steht den Gläubigern jedoch nur zu, wenn sie glaubhaft machen, dass durch die Verschmelzung die Erfüllung ihrer Forderung gefährdet wird."
    },
    {
      "date": "2025-08-15",
      "id": "121285",
      "original_text": "Registerbekanntmachung nach dem Umwandlungsgesetz\nBayern Amtsgericht Amberg HRB 5181\nBVS Lippert GmbH – Schmidgaden",
      "type": "Registerbekanntmachung nach dem Umwandlungsgesetz",
      "state": "Bayern",
      "amtsgericht": "Amtsgericht Amberg",
      "registernummer": "HRB 5181",
      "registerart": "HRB",
      "company_name": "BVS Lippert GmbH",
      "company_seat": "Schmidgaden",
      "details": "15.08.2025 (Bekanntmachungsdatum)\n\nBayern Amtsgericht Amberg HRB 5181\nRegisterbekanntmachung nach dem Umwandlungsgesetz 14.08.2025 (Eintragungsdatum)\n\nBVS Lippert GmbH\nGesellschaft mit beschränkter Haftung\nSchmidgaden\n\nDen Gläubigern der an der Verschmelzung beteiligten Rechtsträger ist, wenn sie binnen sechs Monaten nach dem Tag, an dem die Eintragung der Verschmelzung in das Register des Sitzes desjenigen Rechtsträgers, dessen Gläubiger sie sind, nach § 19 Abs. 3 UmwG als bekannt gemacht gilt, ihren Anspruch nach Grund und Höhe in Textform anmelden, Sicherheit zu leisten, soweit sie nicht Befriedigung verlangen können. Dieses Recht steht den Gläubigern jedoch nur zu, wenn sie glaubhaft machen, dass durch die Verschmelzung die Erfüllung ihrer Forderung gefährdet wird."
    },
    {
      "date": "2025-08-15",
      "id": "121286",
      "original_text": "Registerbekanntmachung nach dem Umwandlungsgesetz\nBayern Amtsgericht München HRA 81301\nIDP International Development Partners GmbH & Co. KG – München",
      "type": "Registerbekanntmachung nach dem Umwandlungsgesetz",
      "state": "Bayern",
      "amtsgericht": "Amtsgericht München",
      "registernummer": "HRA 81301",
      "registerart": "HRA",
      "company_name": "IDP International Development Partners GmbH & Co. KG",
      "company_seat": "München",
      "details": "15.08.2025 (Bekanntmachungsdatum)\n\nBayern Amtsgericht München HRA 81301\nRegisterbekanntmachung nach dem Umwandlungsgesetz 14.08.2025 (Eintragungsdatum)\n\nIDP International Development Partners GmbH & Co. KG\nKommanditgesellschaft\nMünchen\n\nDen Gläubigern der an der Verschmelzung beteiligten Rechtsträger ist, wenn sie binnen sechs Monaten nach dem Tag, an dem die Eintragung der Verschmelzung in das Register des Sitzes desjenigen Rechtsträgers, dessen Gläubiger sie sind, nach § 19 Abs. 3 UmwG als bekannt gemacht gilt, ihren Anspruch nach Grund und Höhe in Textform anmelden, Sicherheit zu leisten, soweit sie nicht Befriedigung verlangen können. Dieses Recht steht den Gläubigern jedoch nur zu, wenn sie glaubhaft machen, dass durch die Verschmelzung die Erfüllung ihrer Forderung gefährdet wird."
    },
    {
      "date": "2025-08-15",
      "id": "121287",
      "original_text": "Registerbekanntmachung nach dem Umwandlungsgesetz\nBayern Amtsgericht München HRB 190540\nSüd-Chemie Verwaltungs GmbH – München",
      "type": "Registerbekanntmachung nach dem Umwandlungsgesetz",
      "state": "Bayern",
      "amtsgericht": "Amtsgericht München",
      "registernummer": "HRB 190540",
      "registerart": "HRB",
      "company_name": "Süd-Chemie Verwaltungs GmbH",
      "company_seat": "München",
      "details": "15.08.2025 (Bekanntmachungsdatum)\n\nBayern Amtsgericht München HRB 190540\nRegisterbekanntmachung nach dem Umwandlungsgesetz 14.08.2025 (Eintragungsdatum)\n\nSüd-Chemie Verwaltungs GmbH\nGesellschaft mit beschränkter Haftung\nMünchen\n\nDen Gläubigern der an der Verschmelzung beteiligten Rechtsträger ist, wenn sie binnen sechs Monaten nach dem Tag, an dem die Eintragung der Verschmelzung in das Register des Sitzes desjenigen Rechtsträgers, dessen Gläubiger sie sind, nach § 19 Abs. 3 UmwG als bekannt gemacht gilt, ihren Anspruch nach Grund und Höhe in Textform anmelden, Sicherheit zu leisten, soweit sie nicht Befriedigung verlangen können. Dieses Recht steht den Gläubigern jedoch nur zu, wenn sie glaubhaft machen, dass durch die Verschmelzung die Erfüllung ihrer Forderung gefährdet wird."
    },
    {
      "date": "2025-08-15",
      "id": "121288",
      "original_text": "Registerbekanntmachung nach dem Umwandlungsgesetz\nBayern Amtsgericht Hof HRA 4586\nYeti Green Energy Jens Tiegs e. K. – Wunsiedel",
      "type": "Registerbekanntmachung nach dem Umwandlungsgesetz",
      "state": "Bayern",
      "amtsgericht": "Amtsgericht Hof",
      "registernummer": "HRA 4586",
      "registerart": "HRA",
      "company_name": "Yeti Green Energy Jens Tiegs e. K.",
      "company_seat": "Wunsiedel",
      "details": "15.08.2025 (Bekanntmachungsdatum)\n\nBayern Amtsgericht Hof HRA 4586\nRegisterbekanntmachung nach dem Umwandlungsgesetz 14.08.2025 (Eintragungsdatum)\n\nYeti Green Energy Jens Tiegs e. K.\nEinzelkaufmann / Einzelkauffrau\nWunsiedel\n\nDen Gläubigern der an der Ausgliederung beteiligten Rechtsträger ist, wenn sie binnen sechs Monaten nach dem Tag, an dem die Eintragung der Ausgliederung in das Register des Sitzes desjenigen Rechtsträgers, dessen Gläubiger sie sind, nach §§ 125, 19 Abs. 3 UmwG als bekannt gemacht gilt, ihren Anspruch nach Grund und Höhe in Textform anmelden, Sicherheit zu leisten, soweit sie nicht Befriedigung verlangen können. Dieses Recht steht den Gläubigern jedoch nur zu, wenn sie glaubhaft machen, dass durch die Ausgliederung die Erfüllung ihrer Forderung gefährdet wird."
    },
    {
      "date": "2025-08-15",
      "id": "121289",
      "original_text": "Sonstige Registerbekanntmachung\nBayern Amtsgericht München HRB 168016\nSeven.One Entertainment Group GmbH – Unterföhring",
      "type": "Sonstige Registerbekanntmachung",
      "state": "Bayern",
      "amtsgericht": "Amtsgericht München",
      "registernummer": "HRB 168016",
      "registerart": "HRB",
      "company_name": "Seven.One Entertainment Group GmbH",
      "company_seat": "Unterföhring",
      "details": "15.08.2025 (Bekanntmachungsdatum)\n\nBayern Amtsgericht München HRB 168016\nSonstige Registerbekanntmachung 14.08.2025 (Eintragungsdatum)\n\nSeven.One Entertainment Group GmbH\nGesellschaft mit beschränkter Haftung\nUnterföhring\n\nDen Gläubigern der Gesellschaft, deren Forderungen begründet worden sind, bevor die Eintragung der Beendigung des Beherrschungs- und Gewinnabführungsvertrages in das Handelsregister nach § 10 des Handelsgesetzbuches als bekanntgemacht gilt, hat der andere Vertragsteil Sicherheit zu leisten, wenn sie sich binnen sechs Monaten nach der Bekanntmachung der Eintragung zu diesem Zweck bei ihm melden."
    },
    {
      "date": "2025-08-15",
      "id": "121290",
      "original_text": "Registerbekanntmachung nach dem Umwandlungsgesetz\nBayern Amtsgericht Passau HRB 717\nKoscheinz & Partner Ingenieurgesellschaft mbH – Ruhstorf a. d. Rott",
      "type": "Registerbekanntmachung nach dem Umwandlungsgesetz",
      "state": "Bayern",
      "amtsgericht": "Amtsgericht Passau",
      "registernummer": "HRB 717",
      "registerart": "HRB",
      "company_name": "Koscheinz & Partner Ingenieurgesellschaft mbH",
      "company_seat": "Ruhstorf a. d. Rott",
      "details": "15.08.2025 (Bekanntmachungsdatum)\n\nBayern Amtsgericht Passau HRB 717\nRegisterbekanntmachung nach dem Umwandlungsgesetz 14.08.2025 (Eintragungsdatum)\n\nKoscheinz & Partner Ingenieurgesellschaft mbH\nGesellschaft mit beschränkter Haftung\nRuhstorf a. d. Rott\n\nDen Gläubigern der an der Verschmelzung beteiligten Rechtsträger ist, wenn sie binnen sechs Monaten nach dem Tag, an dem die Eintragung der Verschmelzung in das Register des Sitzes desjenigen Rechtsträgers, dessen Gläubiger sie sind, nach § 19 Abs. 3 UmwG als bekannt gemacht gilt, ihren Anspruch nach Grund und Höhe in Textform anmelden, Sicherheit zu leisten, soweit sie nicht Befriedigung verlangen können. Dieses Recht steht den Gläubigern jedoch nur zu, wenn sie glaubhaft machen, dass durch die Verschmelzung die Erfüllung ihrer Forderung gefährdet wird."
    },
    {
      "date": "2025-08-15",
      "id": "121291",
      "original_text": "Registerbekanntmachung nach dem Umwandlungsgesetz\nBaden-Württemberg Amtsgericht Stuttgart HRB 226120\nUFG Verwaltungs GmbH – Filderstadt",
      "type": "Registerbekanntmachung nach dem Umwandlungsgesetz",
      "state": "Baden-Württemberg",
      "amtsgericht": "Amtsgericht Stuttgart",
      "registernummer": "HRB 226120",
      "registerart": "HRB",
      "company_name": "UFG Verwaltungs GmbH",
      "company_seat": "Filderstadt",
      "details": "15.08.2025 (Bekanntmachungsdatum)\n\nBaden-Württemberg Amtsgericht Stuttgart HRB 226120\nRegisterbekanntmachung nach dem Umwandlungsgesetz 15.08.2025 (Eintragungsdatum)\n\nUFG Verwaltungs GmbH\nGesellschaft mit beschränkter Haftung\nFilderstadt\n\nAls nicht eingetragen wird bekanntgemacht:\nDen Gläubigern der an der Verschmelzung beteiligten Rechtsträger ist, wenn sie binnen sechs Monaten nach dem Tag, an dem die Eintragung der Verschmelzung in das Register des Sitzes desjenigen Rechtsträgers, dessen Gläubiger sie sind, nach § 19 Abs. 3 UmwG als bekanntgemacht gilt, ihren Anspruch nach Grund und Höhe schriftlich anmelden, Sicherheit zu leisten, soweit sie nicht Befriedigung verlangen können. Dieses Recht steht den Gläubigern jedoch nur zu, wenn sie glaubhaft machen, dass durch die Verschmelzung die Erfüllung ihrer Forderung gefährdet wird."
    },
    {
      "date": "2025-08-15",
      "id": "121292",
      "original_text": "Einreichung neuer Dokumente\nBerlin Amtsgericht Berlin (Charlottenburg) HRB 277774\nHypoport Financing AG – Berlin",
      "type": "Einreichung neuer Dokumente",
      "state": "Berlin",
      "amtsgericht": "Amtsgericht Berlin (Charlottenburg)",
      "registernummer": "HRB 277774",
      "registerart": "HRB",
      "company_name": "Hypoport Financing AG",
      "company_seat": "Berlin",
      "details": "15.08.2025 (Bekanntmachungsdatum)\n\nBerlin Amtsgericht Berlin (Charlottenburg) HRB 277774\nEinreichung neuer Dokumente\n\nHypoport Financing AG\nAktiengesellschaft\nBerlin\n\nAls nicht eingetragen wird veröffentlicht: Es wurde eine neue Liste der Aufsichtsratsmitglieder eingereicht (§ 106 AktG)."
    },
    {
      "date": "2025-08-15",
      "id": "121293",
      "original_text": "Registerbekanntmachung nach dem Umwandlungsgesetz\nBaden-Württemberg Amtsgericht Stuttgart HRB 725080\nYves Rocher GmbH – Stuttgart",
      "type": "Registerbekanntmachung nach dem Umwandlungsgesetz",
      "state": "Baden-Württemberg",
      "amtsgericht": "Amtsgericht Stuttgart",
      "registernummer": "HRB 725080",
      "registerart": "HRB",
      "company_name": "Yves Rocher GmbH",
      "company_seat": "Stuttgart",
      "details": "15.08.2025 (Bekanntmachungsdatum)\n\nBaden-Württemberg Amtsgericht Stuttgart HRB 725080\nRegisterbekanntmachung nach dem Umwandlungsgesetz 13.08.2025 (Eintragungsdatum)\n\nYves Rocher GmbH\nGesellschaft mit beschränkter Haftung\nStuttgart\n\nAls nicht eingetragen wird bekanntgemacht:\nDen Gläubigern der an der Verschmelzung beteiligten Rechtsträger ist, wenn sie binnen sechs Monaten nach dem Tag, an dem die Eintragung der Verschmelzung in das Register des Sitzes desjenigen Rechtsträgers, dessen Gläubiger sie sind, nach § 19 Abs. 3 UmwG als bekanntgemacht gilt, ihren Anspruch nach Grund und Höhe schriftlich anmelden, Sicherheit zu leisten, soweit sie nicht Befriedigung verlangen können. Dieses Recht steht den Gläubigern jedoch nur zu, wenn sie glaubhaft machen, dass durch die Verschmelzung die Erfüllung ihrer Forderung gefährdet wird."
    },
    {
      "date": "2025-08-15",
      "id": "121294",
      "original_text": "Registerbekanntmachung nach dem Umwandlungsgesetz\nBrandenburg Amtsgericht Frankfurt/Oder HRA 4362\nDr. Andreas Fischer e.K. – Bad Saarow",
      "type": "Registerbekanntmachung nach dem Umwandlungsgesetz",
      "state": "Brandenburg",
      "amtsgericht": "Amtsgericht Frankfurt/Oder",
      "registernummer": "HRA 4362",
      "registerart": "HRA",
      "company_name": "Dr. Andreas Fischer e.K.",
      "company_seat": "Bad Saarow",
      "details": "15.08.2025 (Bekanntmachungsdatum)\n\nBrandenburg Amtsgericht Frankfurt/Oder HRA 4362\nRegisterbekanntmachung nach dem Umwandlungsgesetz 14.08.2025 (Eintragungsdatum)\n\nDr. Andreas Fischer e.K.\nEinzelkaufmann / Einzelkauffrau\nBad Saarow\n\nZu Eintragungsnummer 2 vom 14.08.2025 wird als nicht eingetragen veröffentlicht:\nDen Gläubigern der an der Umwandlung beteiligten Rechtsträger ist, wenn sie binnen sechs Monaten nach dem Tag, an dem die Eintragung der Umwandlung in das Register des Sitzes desjenigen Rechtsträgers, dessen Gläubiger sie sind, als bekannt gemacht gilt, ihren Anspruch nach Grund und Höhe schriftlich anmelden, Sicherheit zu leisten, soweit sie nicht Befriedigung verlangen können. Dieses Recht steht den Gläubigern jedoch nur zu, wenn sie glaubhaft machen, dass durch die Umwandlung die Erfüllung ihrer Forderung gefährdet wird"
    },
    {
      "date": "2025-08-15",
      "id": "121295",
      "original_text": "Registerbekanntmachung nach dem Umwandlungsgesetz\nBerlin Amtsgericht Berlin (Charlottenburg) HRB 229745\nHans Ganter UG (haftungsbeschränkt) – Berlin",
      "type": "Registerbekanntmachung nach dem Umwandlungsgesetz",
      "state": "Berlin",
      "amtsgericht": "Amtsgericht Berlin (Charlottenburg)",
      "registernummer": "HRB 229745",
      "registerart": "HRB",
      "company_name": "Hans Ganter UG (haftungsbeschränkt)",
      "company_seat": "Berlin",
      "details": "15.08.2025 (Bekanntmachungsdatum)\n\nBerlin Amtsgericht Berlin (Charlottenburg) HRB 229745\nRegisterbekanntmachung nach dem Umwandlungsgesetz 14.08.2025 (Eintragungsdatum)\n\nHans Ganter UG (haftungsbeschränkt)\nGesellschaft mit beschränkter Haftung\nBerlin\n\nZu Eintragungsnummer 5 vom 14.08.2025 wird als nicht eingetragen veröffentlicht:Den Gläubigern der an der Verschmelzung beteiligten Rechtsträger ist, wenn sie binnen sechs Monaten nach dem Tag, an dem die Eintragung der Verschmelzung in das Register des Sitzes desjenigen Rechtsträgers, dessen Gläubiger sie sind, als bekannt gemacht gilt, ihren Anspruch nach Grund und Höhe schriftlich anmelden, Sicherheit zu leisten, soweit sie nicht Befriedigung verlangen können. Dieses Recht steht den Gläubigern jedoch nur zu, wenn sie glaubhaft machen, dass durch die Verschmelzung die Erfüllung ihrer Forderung gefährdet wird. Das Recht, Sicherheitsleistung zu verlangen, steht Gläubigern nicht zu, die im Falle der Insolvenz ein Recht auf vorzugsweise Befriedigung aus einer Deckungsmasse haben, die nach gesetzlicher Vorschrift zu ihrem Schutz errichtet und staatlich überwacht ist."
    },
    {
      "date": "2025-08-15",
      "id": "121296",
      "original_text": "Registerbekanntmachung nach dem Umwandlungsgesetz\nBaden-Württemberg Amtsgericht Mannheim HRB 755431\nTobias Müller - Natürliche Gärten GmbH – Sinsheim",
      "type": "Registerbekanntmachung nach dem Umwandlungsgesetz",
      "state": "Baden-Württemberg",
      "amtsgericht": "Amtsgericht Mannheim",
      "registernummer": "HRB 755431",
      "registerart": "HRB",
      "company_name": "Tobias Müller - Natürliche Gärten GmbH",
      "company_seat": "Sinsheim",
      "details": "15.08.2025 (Bekanntmachungsdatum)\n\nBaden-Württemberg Amtsgericht Mannheim HRB 755431\nRegisterbekanntmachung nach dem Umwandlungsgesetz 15.08.2025 (Eintragungsdatum)\n\nTobias Müller - Natürliche Gärten GmbH\nGesellschaft mit beschränkter Haftung\nSinsheim\n\nDen Gläubigern der an der Ausgliederung beteiligten Rechtsträger ist, wenn sie binnen sechs Monaten nach dem Tag, an dem die Eintragung der Ausgliederung in das Register des Sitzes desjenigen Rechtsträgers, dessen Gläubiger sie sind, nach § 19 Abs. 3 UmwG als bekanntgemacht gilt, ihren Anspruch nach Grund und Höhe schriftlich anmelden, Sicherheit zu leisten, soweit sie nicht Befriedigung verlangen können. Dieses Recht steht den Gläubigern jedoch nur zu, wenn sie glaubhaft machen, dass durch die Ausgliederung die Erfüllung ihrer Forderung gefährdet wird."
    },
    {
      "date": "2025-08-15",
      "id": "121297",
      "original_text": "Registerbekanntmachung nach dem Umwandlungsgesetz\nBaden-Württemberg Amtsgericht Stuttgart HRB 759257\nCF Hennigsdorf GmbH – Freudenstadt",
      "type": "Registerbekanntmachung nach dem Umwandlungsgesetz",
      "state": "Baden-Württemberg",
      "amtsgericht": "Amtsgericht Stuttgart",
      "registernummer": "HRB 759257",
      "registerart": "HRB",
      "company_name": "CF Hennigsdorf GmbH",
      "company_seat": "Freudenstadt",
      "details": "15.08.2025 (Bekanntmachungsdatum)\n\nBaden-Württemberg Amtsgericht Stuttgart HRB 759257\nRegisterbekanntmachung nach dem Umwandlungsgesetz 15.08.2025 (Eintragungsdatum)\n\nCF Hennigsdorf GmbH\nGesellschaft mit beschränkter Haftung\nFreudenstadt\n\nAls nicht eingetragen wird bekanntgemacht:\nDen Gläubigern der an der Verschmelzung beteiligten Rechtsträger ist, wenn sie binnen sechs Monaten nach dem Tag, an dem die Eintragung der Verschmelzung in das Register des Sitzes desjenigen Rechtsträgers, dessen Gläubiger sie sind, nach § 19 Abs. 3 UmwG als bekanntgemacht gilt, ihren Anspruch nach Grund und Höhe schriftlich anmelden, Sicherheit zu leisten, soweit sie nicht Befriedigung verlangen können. Dieses Recht steht den Gläubigern jedoch nur zu, wenn sie glaubhaft machen, dass durch die Verschmelzung die Erfüllung ihrer Forderung gefährdet wird."
    },
    {
      "date": "2025-08-15",
      "id": "121298",
      "original_text": "Registerbekanntmachung nach dem Umwandlungsgesetz\nBaden-Württemberg Amtsgericht Mannheim HRA 712707\nTobias Müller - natürliche Gärten e. K. – Sinsheim",
      "type": "Registerbekanntmachung nach dem Umwandlungsgesetz",
      "state": "Baden-Württemberg",
      "amtsgericht": "Amtsgericht Mannheim",
      "registernummer": "HRA 712707",
      "registerart": "HRA",
      "company_name": "Tobias Müller - natürliche Gärten e. K.",
      "company_seat": "Sinsheim",
      "details": "15.08.2025 (Bekanntmachungsdatum)\n\nBaden-Württemberg Amtsgericht Mannheim HRA 712707\nRegisterbekanntmachung nach dem Umwandlungsgesetz 15.08.2025 (Eintragungsdatum)\n\nTobias Müller - natürliche Gärten e. K.\nEinzelkaufmann / Einzelkauffrau\nSinsheim\n\nDen Gläubigern der an der Ausgliederung beteiligten Rechtsträger ist, wenn sie binnen sechs Monaten nach dem Tag, an dem die Eintragung der Ausgliederung in das Register des Sitzes desjenigen Rechtsträgers, dessen Gläubiger sie sind, nach § 19 Abs. 3 UmwG als bekanntgemacht gilt, ihren Anspruch nach Grund und Höhe schriftlich anmelden, Sicherheit zu leisten, soweit sie nicht Befriedigung verlangen können. Dieses Recht steht den Gläubigern jedoch nur zu, wenn sie glaubhaft machen, dass durch die Ausgliederung die Erfüllung ihrer Forderung gefährdet wird."
    },
    {
      "date": "2025-08-15",
      "id": "121299",
      "original_text": "Registerbekanntmachung nach dem Umwandlungsgesetz\nBrandenburg Amtsgericht Neuruppin HRB 13339\nIO TRADING GmbH – Hohen Neuendorf",
      "type": "Registerbekanntmachung nach dem Umwandlungsgesetz",
      "state": "Brandenburg",
      "amtsgericht": "Amtsgericht Neuruppin",
      "registernummer": "HRB 13339",
      "registerart": "HRB",
      "company_name": "IO TRADING GmbH",
      "company_seat": "Hohen Neuendorf",
      "details": "15.08.2025 (Bekanntmachungsdatum)\n\nBrandenburg Amtsgericht Neuruppin HRB 13339\nRegisterbekanntmachung nach dem Umwandlungsgesetz 14.08.2025 (Eintragungsdatum)\n\nIO TRADING GmbH\nGesellschaft mit beschränkter Haftung\nHohen Neuendorf\n\nZu Eintragungsnummer 2 vom 14.08.2025 wird als nicht eingetragen veröffentlicht:\nDen Gläubigern der an der Verschmelzung beteiligten Rechtsträger ist, wenn sie binnen sechs Monaten nach dem Tag, an dem die Eintragung der Verschmelzung in das Register des Sitzes desjenigen Rechtsträgers, dessen Gläubiger sie sind, als bekannt gemacht gilt, ihren Anspruch nach Grund und Höhe schriftlich anmelden, Sicherheit zu leisten, soweit sie nicht Befriedigung verlangen können. Dieses Recht steht den Gläubigern jedoch nur zu, wenn sie glaubhaft machen, dass durch die Verschmelzung die Erfüllung ihrer Forderung gefährdet wird"
    },
    {
      "date": "2025-08-15",
      "id": "121300",
      "original_text": "Registerbekanntmachung nach dem Umwandlungsgesetz\nBrandenburg Amtsgericht Cottbus HRA 2553\nKrieger Liegenschaften Wohnen GmbH & Co. KG – Schönefeld",
      "type": "Registerbekanntmachung nach dem Umwandlungsgesetz",
      "state": "Brandenburg",
      "amtsgericht": "Amtsgericht Cottbus",
      "registernummer": "HRA 2553",
      "registerart": "HRA",
      "company_name": "Krieger Liegenschaften Wohnen GmbH & Co. KG",
      "company_seat": "Schönefeld",
      "details": "15.08.2025 (Bekanntmachungsdatum)\n\nBrandenburg Amtsgericht Cottbus HRA 2553\nRegisterbekanntmachung nach dem Umwandlungsgesetz 14.08.2025 (Eintragungsdatum)\n\nKrieger Liegenschaften Wohnen GmbH & Co. KG\nKommanditgesellschaft\nSchönefeld\n\nDen Gläubigern der an der Verschmelzung beteiligten Rechtsträger ist, wenn sie binnen sechs Monaten nach dem Tag, an dem die Eintragung der Verschmelzung in das Register des Sitzes desjenigen Rechtsträgers, dessen Gläubiger sie sind, als bekannt gemacht gilt, ihren Anspruch nach Grund und Höhe schriftlich anmelden, Sicherheit zu leisten, soweit sie nicht Befriedigung verlangen können. Dieses Recht steht den Gläubigern jedoch nur zu, wenn sie glaubhaft machen, dass durch die Verschmelzung die Erfüllung ihrer Forderung gefährdet wird"
    },
    {
      "date": "2025-08-15",
      "id": "121301",
      "original_text": "Einreichung neuer Dokumente\nBaden-Württemberg Amtsgericht Stuttgart HRB 729908\nDZA Verwaltungs-GmbH Baden-Württemberg – Stuttgart",
      "type": "Einreichung neuer Dokumente",
      "state": "Baden-Württemberg",
      "amtsgericht": "Amtsgericht Stuttgart",
      "registernummer": "HRB 729908",
      "registerart": "HRB",
      "company_name": "DZA Verwaltungs-GmbH Baden-Württemberg",
      "company_seat": "Stuttgart",
      "details": "15.08.2025 (Bekanntmachungsdatum)\n\nBaden-Württemberg Amtsgericht Stuttgart HRB 729908\nEinreichung neuer Dokumente 15.08.2025 (Eintragungsdatum)\n\nDZA Verwaltungs-GmbH Baden-Württemberg\nGesellschaft mit beschränkter Haftung\nStuttgart\n\nAls nicht eingetragen wird bekanntgemacht:\n\nDie Gesellschaft hat am 15.08.2025 eine neue Aufsichtsratsliste eingereicht."
    },
    {
      "date": "2025-08-15",
      "id": "121302",
      "original_text": "Einreichung neuer Dokumente\nBaden-Württemberg Amtsgericht Stuttgart HRB 788535\nLight Now AG – Stuttgart",
      "type": "Einreichung neuer Dokumente",
      "state": "Baden-Württemberg",
      "amtsgericht": "Amtsgericht Stuttgart",
      "registernummer": "HRB 788535",
      "registerart": "HRB",
      "company_name": "Light Now AG",
      "company_seat": "Stuttgart",
      "details": "15.08.2025 (Bekanntmachungsdatum)\n\nBaden-Württemberg Amtsgericht Stuttgart HRB 788535\nEinreichung neuer Dokumente\n\nLight Now AG\nAktiengesellschaft\nStuttgart\n\nDie Gesellschaft hat am 14.08.2025 die Liste über die Zusammensetzung des Aufsichtsrats zum Handelsregister eingereicht."
    },
    {
      "date": "2025-08-15",
      "id": "121303",
      "original_text": "Registerbekanntmachung nach dem Umwandlungsgesetz\nBaden-Württemberg Amtsgericht Stuttgart HRB 765108\nLeo Customize UG (haftungsbeschränkt) – Rutesheim",
      "type": "Registerbekanntmachung nach dem Umwandlungsgesetz",
      "state": "Baden-Württemberg",
      "amtsgericht": "Amtsgericht Stuttgart",
      "registernummer": "HRB 765108",
      "registerart": "HRB",
      "company_name": "Leo Customize UG (haftungsbeschränkt)",
      "company_seat": "Rutesheim",
      "details": "15.08.2025 (Bekanntmachungsdatum)\n\nBaden-Württemberg Amtsgericht Stuttgart HRB 765108\nRegisterbekanntmachung nach dem Umwandlungsgesetz 15.08.2025 (Eintragungsdatum)\n\nLeo Customize UG (haftungsbeschränkt)\nGesellschaft mit beschränkter Haftung\nRutesheim\n\nDen Gläubigern der an der Verschmelzung beteiligten Rechtsträger ist, wenn sie binnen sechs Monaten nach dem Tag, an dem die Eintragung der Verschmelzung in das Register des Sitzes desjenigen Rechtsträgers, dessen Gläubiger sie sind, nach § 19 Abs. 3 UmwG als bekanntgemacht gilt, ihren Anspruch nach Grund und Höhe schriftlich anmelden, Sicherheit zu leisten, soweit sie nicht Befriedigung verlangen können. Dieses Recht steht den Gläubigern jedoch nur zu, wenn sie glaubhaft machen, dass durch die Verschmelzung die Erfüllung ihrer Forderung gefährdet wird."
    },
    {
      "date": "2025-08-15",
      "id": "121304",
      "original_text": "Registerbekanntmachung nach dem Umwandlungsgesetz\nBaden-Württemberg Amtsgericht Mannheim HRB 755116\nFunding Solutions WDG Pensions GmbH – Walldorf",
      "type": "Registerbekanntmachung nach dem Umwandlungsgesetz",
      "state": "Baden-Württemberg",
      "amtsgericht": "Amtsgericht Mannheim",
      "registernummer": "HRB 755116",
      "registerart": "HRB",
      "company_name": "Funding Solutions WDG Pensions GmbH",
      "company_seat": "Walldorf",
      "details": "15.08.2025 (Bekanntmachungsdatum)\n\nBaden-Württemberg Amtsgericht Mannheim HRB 755116\nRegisterbekanntmachung nach dem Umwandlungsgesetz 15.08.2025 (Eintragungsdatum)\n\nFunding Solutions WDG Pensions GmbH\nGesellschaft mit beschränkter Haftung\nWalldorf\n\nDen Gläubigern der an der Abspaltung beteiligten Rechtsträger ist, wenn sie binnen sechs Monaten nach dem Tag, an dem die Eintragung der Abspaltung in das Register des Sitzes desjenigen Rechtsträgers, dessen Gläubiger sie sind, nach § 19 Abs. 3 UmwG als bekanntgemacht gilt, ihren Anspruch nach Grund und Höhe schriftlich anmelden, Sicherheit zu leisten, soweit sie nicht Befriedigung verlangen können. Dieses Recht steht den Gläubigern jedoch nur zu, wenn sie glaubhaft machen, dass durch die Abspaltung die Erfüllung ihrer Forderung gefährdet wird."
    },
    {
      "date": "2025-08-15",
      "id": "121305",
      "original_text": "Registerbekanntmachung nach dem Umwandlungsgesetz\nBaden-Württemberg Amtsgericht Freiburg HRA 709169\nAchim Dürr e.K. – Bühl",
      "type": "Registerbekanntmachung nach dem Umwandlungsgesetz",
      "state": "Baden-Württemberg",
      "amtsgericht": "Amtsgericht Freiburg",
      "registernummer": "HRA 709169",
      "registerart": "HRA",
      "company_name": "Achim Dürr e.K.",
      "company_seat": "Bühl",
      "details": "15.08.2025 (Bekanntmachungsdatum)\n\nBaden-Württemberg Amtsgericht Freiburg HRA 709169\nRegisterbekanntmachung nach dem Umwandlungsgesetz 15.08.2025 (Eintragungsdatum)\n\nAchim Dürr e.K.\nEinzelkaufmann / Einzelkauffrau\nBühl\n\nDen Gläubigern der an der Ausgliederung beteiligten Rechtsträger ist, wenn sie binnen sechs Monaten nach dem Tag, an dem die Eintragung der Ausgliederung in das Register des Sitzes desjenigen Rechtsträgers, dessen Gläubiger sie sind, nach § 19 Abs. 3 UmwG als bekanntgemacht gilt, ihren Anspruch nach Grund und Höhe schriftlich anmelden, Sicherheit zu leisten, soweit sie nicht Befriedigung verlangen können. Dieses Recht steht den Gläubigern jedoch nur zu, wenn sie glaubhaft machen, dass durch die Ausgliederung die Erfüllung ihrer Forderung gefährdet wird."
    },
    {
      "date": "2025-08-15",
      "id": "121306",
      "original_text": "Registerbekanntmachung nach dem Umwandlungsgesetz\nBaden-Württemberg Amtsgericht Stuttgart HRB 420423\nHansa-Barth GmbH, Spedition und Lagerung – Hechingen",
      "type": "Registerbekanntmachung nach dem Umwandlungsgesetz",
      "state": "Baden-Württemberg",
      "amtsgericht": "Amtsgericht Stuttgart",
      "registernummer": "HRB 420423",
      "registerart": "HRB",
      "company_name": "Hansa-Barth GmbH, Spedition und Lagerung",
      "company_seat": "Hechingen",
      "details": "15.08.2025 (Bekanntmachungsdatum)\n\nBaden-Württemberg Amtsgericht Stuttgart HRB 420423\nRegisterbekanntmachung nach dem Umwandlungsgesetz 15.08.2025 (Eintragungsdatum)\n\nHansa-Barth GmbH, Spedition und Lagerung\nGesellschaft mit beschränkter Haftung\nHechingen\n\nAls nicht eingetragen wird bekanntgemacht:\nDen Gläubigern der an der Verschmelzung beteiligten Rechtsträger ist, wenn sie binnen sechs Monaten nach dem Tag, an dem die Eintragung der Verschmelzung in das Register des Sitzes desjenigen Rechtsträgers, dessen Gläubiger sie sind, nach § 19 Abs. 3 UmwG als bekanntgemacht gilt, ihren Anspruch nach Grund und Höhe schriftlich anmelden, Sicherheit zu leisten, soweit sie nicht Befriedigung verlangen können. Dieses Recht steht den Gläubigern jedoch nur zu, wenn sie glaubhaft machen, dass durch die Verschmelzung die Erfüllung ihrer Forderung gefährdet wird."
    },
    {
      "date": "2025-08-15",
      "id": "121307",
      "original_text": "Registerbekanntmachung nach dem Umwandlungsgesetz\nBerlin Amtsgericht Berlin (Charlottenburg) HRB 262673\nEuclide Bidco GmbH – Berlin",
      "type": "Registerbekanntmachung nach dem Umwandlungsgesetz",
      "state": "Berlin",
      "amtsgericht": "Amtsgericht Berlin (Charlottenburg)",
      "registernummer": "HRB 262673",
      "registerart": "HRB",
      "company_name": "Euclide Bidco GmbH",
      "company_seat": "Berlin",
      "details": "15.08.2025 (Bekanntmachungsdatum)\n\nBerlin Amtsgericht Berlin (Charlottenburg) HRB 262673\nRegisterbekanntmachung nach dem Umwandlungsgesetz 14.08.2025 (Eintragungsdatum)\n\nEuclide Bidco GmbH\nGesellschaft mit beschränkter Haftung\nBerlin\n\nZu Eintragungsnummer 4 vom 14.08.2025 wird als nicht eingetragen veröffentlicht: Den Gläubigern der an der Verschmelzung beteiligten Rechtsträger ist, wenn sie binnen sechs Monaten nach dem Tag, an dem die Eintragung der Verschmelzung in das Register des Sitzes desjenigen Rechtsträgers, dessen Gläubiger sie sind, als bekannt gemacht gilt, ihren Anspruch nach Grund und Höhe schriftlich anmelden, Sicherheit zu leisten, soweit sie nicht Befriedigung verlangen können. Dieses Recht steht den Gläubigern jedoch nur zu, wenn sie glaubhaft machen, dass durch die Verschmelzung die Erfüllung ihrer Forderung gefährdet wird. Das Recht, Sicherheitsleistung zu verlangen, steht Gläubigern nicht zu, die im Falle der Insolvenz ein Recht auf vorzugsweise Befriedigung aus einer Deckungsmasse haben, die nach gesetzlicher Vorschrift zu ihrem Schutz errichtet und staatlich überwacht ist."
    },
    {
      "date": "2025-08-15",
      "id": "121308",
      "original_text": "Registerbekanntmachung nach dem Umwandlungsgesetz\nBaden-Württemberg Amtsgericht Mannheim HRB 748115\nMAXVIS GmbH – Malsch",
      "type": "Registerbekanntmachung nach dem Umwandlungsgesetz",
      "state": "Baden-Württemberg",
      "amtsgericht": "Amtsgericht Mannheim",
      "registernummer": "HRB 748115",
      "registerart": "HRB",
      "company_name": "MAXVIS GmbH",
      "company_seat": "Malsch",
      "details": "15.08.2025 (Bekanntmachungsdatum)\n\nBaden-Württemberg Amtsgericht Mannheim HRB 748115\nRegisterbekanntmachung nach dem Umwandlungsgesetz 15.08.2025 (Eintragungsdatum)\n\nMAXVIS GmbH\nGesellschaft mit beschränkter Haftung\nMalsch\n\nAls nicht eingetragen wird bekanntgemacht:\nDen Gläubigern der an der Verschmelzung beteiligten Rechtsträger ist, wenn sie binnen sechs Monaten nach dem Tag, an dem die Eintragung der Verschmelzung in das Register des Sitzes desjenigen Rechtsträgers, dessen Gläubiger sie sind, nach § 19 Abs. 3 UmwG als bekanntgemacht gilt, ihren Anspruch nach Grund und Höhe schriftlich anmelden, Sicherheit zu leisten, soweit sie nicht Befriedigung verlangen können. Dieses Recht steht den Gläubigern jedoch nur zu, wenn sie glaubhaft machen, dass durch die Verschmelzung die Erfüllung ihrer Forderung gefährdet wird."
    },
    {
      "date": "2025-08-15",
      "id": "121309",
      "original_text": "Registerbekanntmachung nach dem Umwandlungsgesetz\nBrandenburg Amtsgericht Neuruppin HRB 8036\nVION Perleberg GmbH – Perleberg",
      "type": "Registerbekanntmachung nach dem Umwandlungsgesetz",
      "state": "Brandenburg",
      "amtsgericht": "Amtsgericht Neuruppin",
      "registernummer": "HRB 8036",
      "registerart": "HRB",
      "company_name": "VION Perleberg GmbH",
      "company_seat": "Perleberg",
      "details": "15.08.2025 (Bekanntmachungsdatum)\n\nBrandenburg Amtsgericht Neuruppin HRB 8036\nRegisterbekanntmachung nach dem Umwandlungsgesetz 14.08.2025 (Eintragungsdatum)\n\nVION Perleberg GmbH\nGesellschaft mit beschränkter Haftung\nPerleberg\n\nZu Eintragungsnummer 15 vom 14.08.2025 wird als nicht eingetragen veröffentlicht:\nDen Gläubigern der an der Umwandlung beteiligten Rechtsträger ist, wenn sie binnen sechs Monaten nach dem Tag, an dem die Eintragung der Umwandlung in das Register des Sitzes desjenigen Rechtsträgers, dessen Gläubiger sie sind, als bekannt gemacht gilt, ihren Anspruch nach Grund und Höhe schriftlich anmelden, Sicherheit zu leisten, soweit sie nicht Befriedigung verlangen können. Dieses Recht steht den Gläubigern jedoch nur zu, wenn sie glaubhaft machen, dass durch die Umwandlung die Erfüllung ihrer Forderung gefährdet wird"
    },
    {
      "date": "2025-08-15",
      "id": "121310",
      "original_text": "Registerbekanntmachung nach dem Umwandlungsgesetz\nBaden-Württemberg Amtsgericht Mannheim HRB 741325\nJOMAVIS Solar GmbH – Malsch",
      "type": "Registerbekanntmachung nach dem Umwandlungsgesetz",
      "state": "Baden-Württemberg",
      "amtsgericht": "Amtsgericht Mannheim",
      "registernummer": "HRB 741325",
      "registerart": "HRB",
      "company_name": "JOMAVIS Solar GmbH",
      "company_seat": "Malsch",
      "details": "15.08.2025 (Bekanntmachungsdatum)\n\nBaden-Württemberg Amtsgericht Mannheim HRB 741325\nRegisterbekanntmachung nach dem Umwandlungsgesetz 15.08.2025 (Eintragungsdatum)\n\nJOMAVIS Solar GmbH\nGesellschaft mit beschränkter Haftung\nMalsch\n\nAls nicht eingetragen wird bekanntgemacht:\nDen Gläubigern der an der Verschmelzung beteiligten Rechtsträger ist, wenn sie binnen sechs Monaten nach dem Tag, an dem die Eintragung der Verschmelzung in das Register des Sitzes desjenigen Rechtsträgers, dessen Gläubiger sie sind, nach § 19 Abs. 3 UmwG als bekanntgemacht gilt, ihren Anspruch nach Grund und Höhe schriftlich anmelden, Sicherheit zu leisten, soweit sie nicht Befriedigung verlangen können. Dieses Recht steht den Gläubigern jedoch nur zu, wenn sie glaubhaft machen, dass durch die Verschmelzung die Erfüllung ihrer Forderung gefährdet wird."
    },
    {
      "date": "2025-08-15",
      "id": "121311",
      "original_text": "Registerbekanntmachung nach dem Umwandlungsgesetz\nBaden-Württemberg Amtsgericht Stuttgart HRB 786119\nEnBW Solarpark Lauenhagen GmbH – Stuttgart",
      "type": "Registerbekanntmachung nach dem Umwandlungsgesetz",
      "state": "Baden-Württemberg",
      "amtsgericht": "Amtsgericht Stuttgart",
      "registernummer": "HRB 786119",
      "registerart": "HRB",
      "company_name": "EnBW Solarpark Lauenhagen GmbH",
      "company_seat": "Stuttgart",
      "details": "15.08.2025 (Bekanntmachungsdatum)\n\nBaden-Württemberg Amtsgericht Stuttgart HRB 786119\nRegisterbekanntmachung nach dem Umwandlungsgesetz 15.08.2025 (Eintragungsdatum)\n\nEnBW Solarpark Lauenhagen GmbH\nGesellschaft mit beschränkter Haftung\nStuttgart\n\nDen Gläubigern des an dem Formwechsel beteiligten Rechtsträgers ist, wenn sie binnen sechs Monaten nach dem Tag, an dem die Eintragung des Formwechsels in das Register des Sitzes desjenigen Rechtsträgers, dessen Gläubiger sie sind, nach § 19 Abs. 3 UmwG als bekanntgemacht gilt, ihren Anspruch nach Grund und Höhe schriftlich anmelden, Sicherheit zu leisten, soweit sie nicht Befriedigung verlangen können. Dieses Recht steht den Gläubigern jedoch nur zu, wenn sie glaubhaft machen, dass durch den Formwechsel die Erfüllung ihrer Forderung gefährdet wird."
    },
    {
      "date": "2025-08-15",
      "id": "121312",
      "original_text": "Registerbekanntmachung nach dem Umwandlungsgesetz\nHamburg Amtsgericht Hamburg HRB 177487\nBetriebsarztpraxis im CCB GmbH – Hamburg",
      "type": "Registerbekanntmachung nach dem Umwandlungsgesetz",
      "state": "Hamburg",
      "amtsgericht": "Amtsgericht Hamburg",
      "registernummer": "HRB 177487",
      "registerart": "HRB",
      "company_name": "Betriebsarztpraxis im CCB GmbH",
      "company_seat": "Hamburg",
      "details": "15.08.2025 (Bekanntmachungsdatum)\n\nHamburg Amtsgericht Hamburg HRB 177487\nRegisterbekanntmachung nach dem Umwandlungsgesetz 15.08.2025 (Eintragungsdatum)\n\nBetriebsarztpraxis im CCB GmbH\nGesellschaft mit beschränkter Haftung\nHamburg\n\nAls nicht eingetragen wird bekannt gemacht:\nDen Gläubigern der an der Verschmelzung beteiligten Gesellschaften ist, wenn sie binnen sechs Monaten nach dem Tag, an dem die Eintragung der Verschmelzung in das Register des Sitzes desjenigen Rechtsträgers, dessen Gläubiger sie sind, nach § 19 Absatz 3 UmwG als bekannt gemacht gilt, ihren Anspruch nach Grund und Höhe schriftlich anmelden, Sicherheit zu leisten, soweit sie nicht Befriedigung verlangen können. Dieses Recht steht den Gläubigern jedoch nur zu, wenn sie glaubhaft machen, dass durch die Verschmelzung die Erfüllung ihrer Forderung gefährdet wird."
    },
    {
      "date": "2025-08-15",
      "id": "121313",
      "original_text": "Registerbekanntmachung nach dem Umwandlungsgesetz\nHamburg Amtsgericht Hamburg HRB 117577\nMyCheck Digital GmbH – Hamburg",
      "type": "Registerbekanntmachung nach dem Umwandlungsgesetz",
      "state": "Hamburg",
      "amtsgericht": "Amtsgericht Hamburg",
      "registernummer": "HRB 117577",
      "registerart": "HRB",
      "company_name": "MyCheck Digital GmbH",
      "company_seat": "Hamburg",
      "details": "15.08.2025 (Bekanntmachungsdatum)\n\nHamburg Amtsgericht Hamburg HRB 117577\nRegisterbekanntmachung nach dem Umwandlungsgesetz 15.08.2025 (Eintragungsdatum)\n\nMyCheck Digital GmbH\nGesellschaft mit beschränkter Haftung\nHamburg\n\nAls nicht eingetragen wird bekannt gemacht:\nDen Gläubigern der an der Verschmelzung beteiligten Gesellschaften ist, wenn sie binnen sechs Monaten nach dem Tag, an dem die Eintragung der Verschmelzung in das Register des Sitzes desjenigen Rechtsträgers, dessen Gläubiger sie sind, nach § 19 Absatz 3 UmwG als bekannt gemacht gilt, ihren Anspruch nach Grund und Höhe schriftlich anmelden, Sicherheit zu leisten, soweit sie nicht Befriedigung verlangen können. Dieses Recht steht den Gläubigern jedoch nur zu, wenn sie glaubhaft machen, dass durch die Verschmelzung die Erfüllung ihrer Forderung gefährdet wird."
    },
    {
      "date": "2025-08-15",
      "id": "121314",
      "original_text": "Registerbekanntmachung nach dem Umwandlungsgesetz\nHamburg Amtsgericht Hamburg HRB 191077\nCompanyCheck Deutschland GmbH – Hamburg",
      "type": "Registerbekanntmachung nach dem Umwandlungsgesetz",
      "state": "Hamburg",
      "amtsgericht": "Amtsgericht Hamburg",
      "registernummer": "HRB 191077",
      "registerart": "HRB",
      "company_name": "CompanyCheck Deutschland GmbH",
      "company_seat": "Hamburg",
      "details": "15.08.2025 (Bekanntmachungsdatum)\n\nHamburg Amtsgericht Hamburg HRB 191077\nRegisterbekanntmachung nach dem Umwandlungsgesetz 15.08.2025 (Eintragungsdatum)\n\nCompanyCheck Deutschland GmbH\nGesellschaft mit beschränkter Haftung\nHamburg\n\nAls nicht eingetragen wird bekannt gemacht:\nDen Gläubigern der an der Verschmelzung beteiligten Gesellschaften ist, wenn sie binnen sechs Monaten nach dem Tag, an dem die Eintragung der Verschmelzung in das Register des Sitzes desjenigen Rechtsträgers, dessen Gläubiger sie sind, nach § 19 Absatz 3 UmwG als bekannt gemacht gilt, ihren Anspruch nach Grund und Höhe schriftlich anmelden, Sicherheit zu leisten, soweit sie nicht Befriedigung verlangen können. Dieses Recht steht den Gläubigern jedoch nur zu, wenn sie glaubhaft machen, dass durch die Verschmelzung die Erfüllung ihrer Forderung gefährdet wird."
    },
    {
      "date": "2025-08-15",
      "id": "121315",
      "original_text": "Registerbekanntmachung nach dem Umwandlungsgesetz\nBerlin Amtsgericht Berlin (Charlottenburg) HRB 254614\nLiquiCo CRD 202505 GmbH – Berlin",
      "type": "Registerbekanntmachung nach dem Umwandlungsgesetz",
      "state": "Berlin",
      "amtsgericht": "Amtsgericht Berlin (Charlottenburg)",
      "registernummer": "HRB 254614",
      "registerart": "HRB",
      "company_name": "LiquiCo CRD 202505 GmbH",
      "company_seat": "Berlin",
      "details": "15.08.2025 (Bekanntmachungsdatum)\n\nBerlin Amtsgericht Berlin (Charlottenburg) HRB 254614\nRegisterbekanntmachung nach dem Umwandlungsgesetz 14.08.2025 (Eintragungsdatum)\n\nLiquiCo CRD 202505 GmbH\nGesellschaft mit beschränkter Haftung\nBerlin\n\nZu Eintragungsnummer 4 vom 14.08.2025 wird als nicht eingetragen veröffentlicht: Den Gläubigern der an der Verschmelzung beteiligten Rechtsträger ist, wenn sie binnen sechs Monaten nach dem Tag, an dem die Eintragung der Verschmelzung in das Register des Sitzes desjenigen Rechtsträgers, dessen Gläubiger sie sind, als bekannt gemacht gilt, ihren Anspruch nach Grund und Höhe schriftlich anmelden, Sicherheit zu leisten, soweit sie nicht Befriedigung verlangen können. Dieses Recht steht den Gläubigern jedoch nur zu, wenn sie glaubhaft machen, dass durch die Verschmelzung die Erfüllung ihrer Forderung gefährdet wird. Das Recht, Sicherheitsleistung zu verlangen, steht Gläubigern nicht zu, die im Falle der Insolvenz ein Recht auf vorzugsweise Befriedigung aus einer Deckungsmasse haben, die nach gesetzlicher Vorschrift zu ihrem Schutz errichtet und staatlich überwacht ist."
    },
    {
      "date": "2025-08-15",
      "id": "121316",
      "original_text": "Registerbekanntmachung nach dem Umwandlungsgesetz\nBerlin Amtsgericht Berlin (Charlottenburg) HRB 227154\nAllwetter GmbH – Berlin",
      "type": "Registerbekanntmachung nach dem Umwandlungsgesetz",
      "state": "Berlin",
      "amtsgericht": "Amtsgericht Berlin (Charlottenburg)",
      "registernummer": "HRB 227154",
      "registerart": "HRB",
      "company_name": "Allwetter GmbH",
      "company_seat": "Berlin",
      "details": "15.08.2025 (Bekanntmachungsdatum)\n\nBerlin Amtsgericht Berlin (Charlottenburg) HRB 227154\nRegisterbekanntmachung nach dem Umwandlungsgesetz 14.08.2025 (Eintragungsdatum)\n\nAllwetter GmbH\nGesellschaft mit beschränkter Haftung\nBerlin\n\nZu Eintragungsnummer 3 vom 14.08.2025 wird als nicht eingetragen veröffentlicht: Den Gläubigern der an der Verschmelzung beteiligten Rechtsträger ist, wenn sie binnen sechs Monaten nach dem Tag, an dem die Eintragung der Verschmelzung in das Register des Sitzes desjenigen Rechtsträgers, dessen Gläubiger sie sind, als bekannt gemacht gilt, ihren Anspruch nach Grund und Höhe schriftlich anmelden, Sicherheit zu leisten, soweit sie nicht Befriedigung verlangen können. Dieses Recht steht den Gläubigern jedoch nur zu, wenn sie glaubhaft machen, dass durch die Verschmelzung die Erfüllung ihrer Forderung gefährdet wird. Das Recht, Sicherheitsleistung zu verlangen, steht Gläubigern nicht zu, die im Falle der Insolvenz ein Recht auf vorzugsweise Befriedigung aus einer Deckungsmasse haben, die nach gesetzlicher Vorschrift zu ihrem Schutz errichtet und staatlich überwacht ist."
    },
    {
      "date": "2025-08-15",
      "id": "121317",
      "original_text": "Registerbekanntmachung nach dem Umwandlungsgesetz\nBerlin Amtsgericht Berlin (Charlottenburg) HRB 250608\nHavit Spaces Holding GmbH – Berlin",
      "type": "Registerbekanntmachung nach dem Umwandlungsgesetz",
      "state": "Berlin",
      "amtsgericht": "Amtsgericht Berlin (Charlottenburg)",
      "registernummer": "HRB 250608",
      "registerart": "HRB",
      "company_name": "Havit Spaces Holding GmbH",
      "company_seat": "Berlin",
      "details": "15.08.2025 (Bekanntmachungsdatum)\n\nBerlin Amtsgericht Berlin (Charlottenburg) HRB 250608\nRegisterbekanntmachung nach dem Umwandlungsgesetz 14.08.2025 (Eintragungsdatum)\n\nHavit Spaces Holding GmbH\nGesellschaft mit beschränkter Haftung\nBerlin\n\nZu Eintragungsnummer 6 vom 14.08.2025 wird als nicht eingetragen veröffentlicht: Den Gläubigern der an der Verschmelzung beteiligten Rechtsträger ist, wenn sie binnen sechs Monaten nach dem Tag, an dem die Eintragung der Verschmelzung in das Register des Sitzes desjenigen Rechtsträgers, dessen Gläubiger sie sind, als bekannt gemacht gilt, ihren Anspruch nach Grund und Höhe schriftlich anmelden, Sicherheit zu leisten, soweit sie nicht Befriedigung verlangen können. Dieses Recht steht den Gläubigern jedoch nur zu, wenn sie glaubhaft machen, dass durch die Verschmelzung die Erfüllung ihrer Forderung gefährdet wird. Das Recht, Sicherheitsleistung zu verlangen, steht Gläubigern nicht zu, die im Falle der Insolvenz ein Recht auf vorzugsweise Befriedigung aus einer Deckungsmasse haben, die nach gesetzlicher Vorschrift zu ihrem Schutz errichtet und staatlich überwacht ist."
    },
    {
      "date": "2025-08-15",
      "id": "121318",
      "original_text": "Registerbekanntmachung nach dem Umwandlungsgesetz\nBerlin Amtsgericht Berlin (Charlottenburg) HRB 250597\nHavit Spaces Berlin 1 GmbH – Berlin",
      "type": "Registerbekanntmachung nach dem Umwandlungsgesetz",
      "state": "Berlin",
      "amtsgericht": "Amtsgericht Berlin (Charlottenburg)",
      "registernummer": "HRB 250597",
      "registerart": "HRB",
      "company_name": "Havit Spaces Berlin 1 GmbH",
      "company_seat": "Berlin",
      "details": "15.08.2025 (Bekanntmachungsdatum)\n\nBerlin Amtsgericht Berlin (Charlottenburg) HRB 250597\nRegisterbekanntmachung nach dem Umwandlungsgesetz 14.08.2025 (Eintragungsdatum)\n\nHavit Spaces Berlin 1 GmbH\nGesellschaft mit beschränkter Haftung\nBerlin\n\nZu Eintragungsnummer 7 vom 14.08.2025 wird als nicht eingetragen veröffentlicht: Den Gläubigern der an der Verschmelzung beteiligten Rechtsträger ist, wenn sie binnen sechs Monaten nach dem Tag, an dem die Eintragung der Verschmelzung in das Register des Sitzes desjenigen Rechtsträgers, dessen Gläubiger sie sind, als bekannt gemacht gilt, ihren Anspruch nach Grund und Höhe schriftlich anmelden, Sicherheit zu leisten, soweit sie nicht Befriedigung verlangen können. Dieses Recht steht den Gläubigern jedoch nur zu, wenn sie glaubhaft machen, dass durch die Verschmelzung die Erfüllung ihrer Forderung gefährdet wird. Das Recht, Sicherheitsleistung zu verlangen, steht Gläubigern nicht zu, die im Falle der Insolvenz ein Recht auf vorzugsweise Befriedigung aus einer Deckungsmasse haben, die nach gesetzlicher Vorschrift zu ihrem Schutz errichtet und staatlich überwacht ist."
    },
    {
      "date": "2025-08-15",
      "id": "121319",
      "original_text": "Registerbekanntmachung nach dem Umwandlungsgesetz\nBerlin Amtsgericht Berlin (Charlottenburg) HRB 198156\nFFO Verwaltungs GmbH – Berlin",
      "type": "Registerbekanntmachung nach dem Umwandlungsgesetz",
      "state": "Berlin",
      "amtsgericht": "Amtsgericht Berlin (Charlottenburg)",
      "registernummer": "HRB 198156",
      "registerart": "HRB",
      "company_name": "FFO Verwaltungs GmbH",
      "company_seat": "Berlin",
      "details": "15.08.2025 (Bekanntmachungsdatum)\n\nBerlin Amtsgericht Berlin (Charlottenburg) HRB 198156\nRegisterbekanntmachung nach dem Umwandlungsgesetz 14.08.2025 (Eintragungsdatum)\n\nFFO Verwaltungs GmbH\nGesellschaft mit beschränkter Haftung\nBerlin\n\nZu Eintragungsnummer 4 vom 14.08.2025 wird als nicht eingetragen veröffentlicht: Den Gläubigern der an der Verschmelzung beteiligten Rechtsträger ist, wenn sie binnen sechs Monaten nach dem Tag, an dem die Eintragung der Verschmelzung in das Register des Sitzes desjenigen Rechtsträgers, dessen Gläubiger sie sind, als bekannt gemacht gilt, ihren Anspruch nach Grund und Höhe schriftlich anmelden, Sicherheit zu leisten, soweit sie nicht Befriedigung verlangen können. Dieses Recht steht den Gläubigern jedoch nur zu, wenn sie glaubhaft machen, dass durch die Verschmelzung die Erfüllung ihrer Forderung gefährdet wird. Das Recht, Sicherheitsleistung zu verlangen, steht Gläubigern nicht zu, die im Falle der Insolvenz ein Recht auf vorzugsweise Befriedigung aus einer Deckungsmasse haben, die nach gesetzlicher Vorschrift zu ihrem Schutz errichtet und staatlich überwacht ist."
    },
    {
      "date": "2025-08-15",
      "id": "121320",
      "original_text": "Registerbekanntmachung nach dem Umwandlungsgesetz\nHamburg Amtsgericht Hamburg HRB 165500\nClarius.Legal Solutions GmbH – Hamburg",
      "type": "Registerbekanntmachung nach dem Umwandlungsgesetz",
      "state": "Hamburg",
      "amtsgericht": "Amtsgericht Hamburg",
      "registernummer": "HRB 165500",
      "registerart": "HRB",
      "company_name": "Clarius.Legal Solutions GmbH",
      "company_seat": "Hamburg",
      "details": "15.08.2025 (Bekanntmachungsdatum)\n\nHamburg Amtsgericht Hamburg HRB 165500\nRegisterbekanntmachung nach dem Umwandlungsgesetz 15.08.2025 (Eintragungsdatum)\n\nClarius.Legal Solutions GmbH\nGesellschaft mit beschränkter Haftung\nHamburg\n\nAls nicht eingetragen wird bekannt gemacht:\nDen Gläubigern der an der Verschmelzung beteiligten Gesellschaften ist, wenn sie binnen sechs Monaten nach dem Tag, an dem die Eintragung der Verschmelzung in das Register des Sitzes desjenigen Rechtsträgers, dessen Gläubiger sie sind, nach § 19 Absatz 3 UmwG als bekannt gemacht gilt, ihren Anspruch nach Grund und Höhe schriftlich anmelden, Sicherheit zu leisten, soweit sie nicht Befriedigung verlangen können. Dieses Recht steht den Gläubigern jedoch nur zu, wenn sie glaubhaft machen, dass durch die Verschmelzung die Erfüllung ihrer Forderung gefährdet wird."
    },
    {
      "date": "2025-08-15",
      "id": "121321",
      "original_text": "Registerbekanntmachung nach dem Umwandlungsgesetz\nHamburg Amtsgericht Hamburg HRB 117359\nAngermann RE:solutions GmbH – Hamburg",
      "type": "Registerbekanntmachung nach dem Umwandlungsgesetz",
      "state": "Hamburg",
      "amtsgericht": "Amtsgericht Hamburg",
      "registernummer": "HRB 117359",
      "registerart": "HRB",
      "company_name": "Angermann RE:solutions GmbH",
      "company_seat": "Hamburg",
      "details": "15.08.2025 (Bekanntmachungsdatum)\n\nHamburg Amtsgericht Hamburg HRB 117359\nRegisterbekanntmachung nach dem Umwandlungsgesetz 15.08.2025 (Eintragungsdatum)\n\nAngermann RE:solutions GmbH\nGesellschaft mit beschränkter Haftung\nHamburg\n\nAls nicht eingetragen wird bekannt gemacht:\nDen Gläubigern der an der Verschmelzung beteiligten Gesellschaften ist, wenn sie binnen sechs Monaten nach dem Tag, an dem die Eintragung der Verschmelzung in das Register des Sitzes desjenigen Rechtsträgers, dessen Gläubiger sie sind, nach § 19 Absatz 3 UmwG als bekannt gemacht gilt, ihren Anspruch nach Grund und Höhe schriftlich anmelden, Sicherheit zu leisten, soweit sie nicht Befriedigung verlangen können. Dieses Recht steht den Gläubigern jedoch nur zu, wenn sie glaubhaft machen, dass durch die Verschmelzung die Erfüllung ihrer Forderung gefährdet wird."
    },
    {
      "date": "2025-08-15",
      "id": "121322",
      "original_text": "Registerbekanntmachung nach dem Umwandlungsgesetz\nHamburg Amtsgericht Hamburg HRB 88491\nWAF Meyer Service Verwaltungs GmbH – Hamburg",
      "type": "Registerbekanntmachung nach dem Umwandlungsgesetz",
      "state": "Hamburg",
      "amtsgericht": "Amtsgericht Hamburg",
      "registernummer": "HRB 88491",
      "registerart": "HRB",
      "company_name": "WAF Meyer Service Verwaltungs GmbH",
      "company_seat": "Hamburg",
      "details": "15.08.2025 (Bekanntmachungsdatum)\n\nHamburg Amtsgericht Hamburg HRB 88491\nRegisterbekanntmachung nach dem Umwandlungsgesetz 15.08.2025 (Eintragungsdatum)\n\nWAF Meyer Service Verwaltungs GmbH\nGesellschaft mit beschränkter Haftung\nHamburg\n\nAls nicht eingetragen wird bekannt gemacht:\nDen Gläubigern der an der Verschmelzung beteiligten Gesellschaften ist, wenn sie binnen sechs Monaten nach dem Tag, an dem die Eintragung der Verschmelzung in das Register des Sitzes desjenigen Rechtsträgers, dessen Gläubiger sie sind, nach § 19 Absatz 3 UmwG als bekannt gemacht gilt, ihren Anspruch nach Grund und Höhe schriftlich anmelden, Sicherheit zu leisten, soweit sie nicht Befriedigung verlangen können. Dieses Recht steht den Gläubigern jedoch nur zu, wenn sie glaubhaft machen, dass durch die Verschmelzung die Erfüllung ihrer Forderung gefährdet wird."
    },
    {
      "date": "2025-08-15",
      "id": "121323",
      "original_text": "Registerbekanntmachung nach dem Umwandlungsgesetz\nHamburg Amtsgericht Hamburg HRB 180350\nClarius.Legal Rechtsanwaltsaktiengesellschaft – Hamburg",
      "type": "Registerbekanntmachung nach dem Umwandlungsgesetz",
      "state": "Hamburg",
      "amtsgericht": "Amtsgericht Hamburg",
      "registernummer": "HRB 180350",
      "registerart": "HRB",
      "company_name": "Clarius.Legal Rechtsanwaltsaktiengesellschaft",
      "company_seat": "Hamburg",
      "details": "15.08.2025 (Bekanntmachungsdatum)\n\nHamburg Amtsgericht Hamburg HRB 180350\nRegisterbekanntmachung nach dem Umwandlungsgesetz 15.08.2025 (Eintragungsdatum)\n\nClarius.Legal Rechtsanwaltsaktiengesellschaft\nAktiengesellschaft\nHamburg\n\nAls nicht eingetragen wird bekannt gemacht:\nDen Gläubigern der an der Verschmelzung beteiligten Gesellschaften ist, wenn sie binnen sechs Monaten nach dem Tag, an dem die Eintragung der Verschmelzung in das Register des Sitzes desjenigen Rechtsträgers, dessen Gläubiger sie sind, nach § 19 Absatz 3 UmwG als bekannt gemacht gilt, ihren Anspruch nach Grund und Höhe schriftlich anmelden, Sicherheit zu leisten, soweit sie nicht Befriedigung verlangen können. Dieses Recht steht den Gläubigern jedoch nur zu, wenn sie glaubhaft machen, dass durch die Verschmelzung die Erfüllung ihrer Forderung gefährdet wird."
    },
    {
      "date": "2025-08-15",
      "id": "121324",
      "original_text": "Registerbekanntmachung nach dem Umwandlungsgesetz\nHamburg Amtsgericht Hamburg HRB 41570\nWilhelm A. F. Meyer GmbH – Hamburg",
      "type": "Registerbekanntmachung nach dem Umwandlungsgesetz",
      "state": "Hamburg",
      "amtsgericht": "Amtsgericht Hamburg",
      "registernummer": "HRB 41570",
      "registerart": "HRB",
      "company_name": "Wilhelm A. F. Meyer GmbH",
      "company_seat": "Hamburg",
      "details": "15.08.2025 (Bekanntmachungsdatum)\n\nHamburg Amtsgericht Hamburg HRB 41570\nRegisterbekanntmachung nach dem Umwandlungsgesetz 15.08.2025 (Eintragungsdatum)\n\nWilhelm A. F. Meyer GmbH\nGesellschaft mit beschränkter Haftung\nHamburg\n\nAls nicht eingetragen wird bekannt gemacht:\nDen Gläubigern der an der Verschmelzung beteiligten Gesellschaften ist, wenn sie binnen sechs Monaten nach dem Tag, an dem die Eintragung der Verschmelzung in das Register des Sitzes desjenigen Rechtsträgers, dessen Gläubiger sie sind, nach § 19 Absatz 3 UmwG als bekannt gemacht gilt, ihren Anspruch nach Grund und Höhe schriftlich anmelden, Sicherheit zu leisten, soweit sie nicht Befriedigung verlangen können. Dieses Recht steht den Gläubigern jedoch nur zu, wenn sie glaubhaft machen, dass durch die Verschmelzung die Erfüllung ihrer Forderung gefährdet wird."
    },
    {
      "date": "2025-08-15",
      "id": "121325",
      "original_text": "Registerbekanntmachung nach dem Umwandlungsgesetz\nHamburg Amtsgericht Hamburg HRB 109892\nAngermann Investment Advisory AG – Hamburg",
      "type": "Registerbekanntmachung nach dem Umwandlungsgesetz",
      "state": "Hamburg",
      "amtsgericht": "Amtsgericht Hamburg",
      "registernummer": "HRB 109892",
      "registerart": "HRB",
      "company_name": "Angermann Investment Advisory AG",
      "company_seat": "Hamburg",
      "details": "15.08.2025 (Bekanntmachungsdatum)\n\nHamburg Amtsgericht Hamburg HRB 109892\nRegisterbekanntmachung nach dem Umwandlungsgesetz 15.08.2025 (Eintragungsdatum)\n\nAngermann Investment Advisory AG\nAktiengesellschaft\nHamburg\n\nAls nicht eingetragen wird bekannt gemacht:\nDen Gläubigern der an der Verschmelzung beteiligten Gesellschaften ist, wenn sie binnen sechs Monaten nach dem Tag, an dem die Eintragung der Verschmelzung in das Register des Sitzes desjenigen Rechtsträgers, dessen Gläubiger sie sind, nach § 19 Absatz 3 UmwG als bekannt gemacht gilt, ihren Anspruch nach Grund und Höhe schriftlich anmelden, Sicherheit zu leisten, soweit sie nicht Befriedigung verlangen können. Dieses Recht steht den Gläubigern jedoch nur zu, wenn sie glaubhaft machen, dass durch die Verschmelzung die Erfüllung ihrer Forderung gefährdet wird."
    },
    {
      "date": "2025-08-15",
      "id": "121326",
      "original_text": "Registerbekanntmachung nach dem Umwandlungsgesetz\nBerlin Amtsgericht Berlin (Charlottenburg) HRB 211488\nFFO Objekt Holding GmbH – Berlin",
      "type": "Registerbekanntmachung nach dem Umwandlungsgesetz",
      "state": "Berlin",
      "amtsgericht": "Amtsgericht Berlin (Charlottenburg)",
      "registernummer": "HRB 211488",
      "registerart": "HRB",
      "company_name": "FFO Objekt Holding GmbH",
      "company_seat": "Berlin",
      "details": "15.08.2025 (Bekanntmachungsdatum)\n\nBerlin Amtsgericht Berlin (Charlottenburg) HRB 211488\nRegisterbekanntmachung nach dem Umwandlungsgesetz 14.08.2025 (Eintragungsdatum)\n\nFFO Objekt Holding GmbH\nGesellschaft mit beschränkter Haftung\nBerlin\n\nZu Eintragungsnummer 4 vom 14.08.2025 wird als nicht eingetragen veröffentlicht: Den Gläubigern der an der Verschmelzung beteiligten Rechtsträger ist, wenn sie binnen sechs Monaten nach dem Tag, an dem die Eintragung der Verschmelzung in das Register des Sitzes desjenigen Rechtsträgers, dessen Gläubiger sie sind, als bekannt gemacht gilt, ihren Anspruch nach Grund und Höhe schriftlich anmelden, Sicherheit zu leisten, soweit sie nicht Befriedigung verlangen können. Dieses Recht steht den Gläubigern jedoch nur zu, wenn sie glaubhaft machen, dass durch die Verschmelzung die Erfüllung ihrer Forderung gefährdet wird. Das Recht, Sicherheitsleistung zu verlangen, steht Gläubigern nicht zu, die im Falle der Insolvenz ein Recht auf vorzugsweise Befriedigung aus einer Deckungsmasse haben, die nach gesetzlicher Vorschrift zu ihrem Schutz errichtet und staatlich überwacht ist."
    },
    {
      "date": "2025-08-15",
      "id": "121327",
      "original_text": "Löschungsankündigung\nBerlin Amtsgericht Berlin (Charlottenburg) HRB 207168\nBerg Fleisch GmbH – Berlin",
      "type": "Löschungsankündigung",
      "state": "Berlin",
      "amtsgericht": "Amtsgericht Berlin (Charlottenburg)",
      "registernummer": "HRB 207168",
      "registerart": "HRB",
      "company_name": "Berg Fleisch GmbH",
      "company_seat": "Berlin",
      "details": "15.08.2025 (Bekanntmachungsdatum)\n\nBerlin Amtsgericht Berlin (Charlottenburg) HRB 207168\nLöschungsankündigung\n\nBerg Fleisch GmbH\nGesellschaft mit beschränkter Haftung\nBerlin\n\nBei der nachstehenden Gesellschaft wird das Amtslöschungsverfahren gemäß § 394 FamFG eingeleitet. Widerspruchsfrist 6 Wochen"
    },
    {
      "date": "2025-08-15",
      "id": "121328",
      "original_text": "Registerbekanntmachung nach dem Umwandlungsgesetz\nBaden-Württemberg Amtsgericht Stuttgart HRB 434\nEugen Grill Spezialmaschinenfabrik GmbH – Stuttgart",
      "type": "Registerbekanntmachung nach dem Umwandlungsgesetz",
      "state": "Baden-Württemberg",
      "amtsgericht": "Amtsgericht Stuttgart",
      "registernummer": "HRB 434",
      "registerart": "HRB",
      "company_name": "Eugen Grill Spezialmaschinenfabrik GmbH",
      "company_seat": "Stuttgart",
      "details": "15.08.2025 (Bekanntmachungsdatum)\n\nBaden-Württemberg Amtsgericht Stuttgart HRB 434\nRegisterbekanntmachung nach dem Umwandlungsgesetz 15.08.2025 (Eintragungsdatum)\n\nEugen Grill Spezialmaschinenfabrik GmbH\nGesellschaft mit beschränkter Haftung\nStuttgart\n\nAls nicht eingetragen wird bekanntgemacht:\nDen Gläubigern der an der Verschmelzung beteiligten Rechtsträger ist, wenn sie binnen sechs Monaten nach dem Tag, an dem die Eintragung der Verschmelzung in das Register des Sitzes desjenigen Rechtsträgers, dessen Gläubiger sie sind, nach § 19 Abs. 3 UmwG als bekanntgemacht gilt, ihren Anspruch nach Grund und Höhe schriftlich anmelden, Sicherheit zu leisten, soweit sie nicht Befriedigung verlangen können. Dieses Recht steht den Gläubigern jedoch nur zu, wenn sie glaubhaft machen, dass durch die Verschmelzung die Erfüllung ihrer Forderung gefährdet wird."
    },
    {
      "date": "2025-08-15",
      "id": "121329",
      "original_text": "Registerbekanntmachung nach dem Umwandlungsgesetz\nBerlin Amtsgericht Berlin (Charlottenburg) HRB 211488\nFFO Objekt Holding GmbH – Berlin",
      "type": "Registerbekanntmachung nach dem Umwandlungsgesetz",
      "state": "Berlin",
      "amtsgericht": "Amtsgericht Berlin (Charlottenburg)",
      "registernummer": "HRB 211488",
      "registerart": "HRB",
      "company_name": "FFO Objekt Holding GmbH",
      "company_seat": "Berlin",
      "details": "15.08.2025 (Bekanntmachungsdatum)\n\nBerlin Amtsgericht Berlin (Charlottenburg) HRB 211488\nRegisterbekanntmachung nach dem Umwandlungsgesetz 13.08.2025 (Eintragungsdatum)\n\nFFO Objekt Holding GmbH\nGesellschaft mit beschränkter Haftung\nBerlin\n\nZu Eintragungsnummer 3 vom 13.08.2025 wird als nicht eingetragen veröffentlicht: Den Gläubigern der an der Verschmelzung beteiligten Rechtsträger ist, wenn sie binnen sechs Monaten nach dem Tag, an dem die Eintragung der Verschmelzung in das Register des Sitzes desjenigen Rechtsträgers, dessen Gläubiger sie sind, als bekannt gemacht gilt, ihren Anspruch nach Grund und Höhe schriftlich anmelden, Sicherheit zu leisten, soweit sie nicht Befriedigung verlangen können. Dieses Recht steht den Gläubigern jedoch nur zu, wenn sie glaubhaft machen, dass durch die Verschmelzung die Erfüllung ihrer Forderung gefährdet wird. Das Recht, Sicherheitsleistung zu verlangen, steht Gläubigern nicht zu, die im Falle der Insolvenz ein Recht auf vorzugsweise Befriedigung aus einer Deckungsmasse haben, die nach gesetzlicher Vorschrift zu ihrem Schutz errichtet und staatlich überwacht ist."
    },
    {
      "date": "2025-08-15",
      "id": "121330",
      "original_text": "Registerbekanntmachung nach dem Umwandlungsgesetz\nBerlin Amtsgericht Berlin (Charlottenburg) HRB 211488\nFFO Objekt Holding GmbH – Berlin",
      "type": "Registerbekanntmachung nach dem Umwandlungsgesetz",
      "state": "Berlin",
      "amtsgericht": "Amtsgericht Berlin (Charlottenburg)",
      "registernummer": "HRB 211488",
      "registerart": "HRB",
      "company_name": "FFO Objekt Holding GmbH",
      "company_seat": "Berlin",
      "details": "15.08.2025 (Bekanntmachungsdatum)\n\nBerlin Amtsgericht Berlin (Charlottenburg) HRB 211488\nRegisterbekanntmachung nach dem Umwandlungsgesetz 14.08.2025 (Eintragungsdatum)\n\nFFO Objekt Holding GmbH\nGesellschaft mit beschränkter Haftung\nBerlin\n\nZu Eintragungsnummer 4 vom 14.08.2025 wird als nicht eingetragen veröffentlicht: Den Gläubigern der an der Verschmelzung beteiligten Rechtsträger ist, wenn sie binnen sechs Monaten nach dem Tag, an dem die Eintragung der Verschmelzung in das Register des Sitzes desjenigen Rechtsträgers, dessen Gläubiger sie sind, als bekannt gemacht gilt, ihren Anspruch nach Grund und Höhe schriftlich anmelden, Sicherheit zu leisten, soweit sie nicht Befriedigung verlangen können. Dieses Recht steht den Gläubigern jedoch nur zu, wenn sie glaubhaft machen, dass durch die Verschmelzung die Erfüllung ihrer Forderung gefährdet wird. Das Recht, Sicherheitsleistung zu verlangen, steht Gläubigern nicht zu, die im Falle der Insolvenz ein Recht auf vorzugsweise Befriedigung aus einer Deckungsmasse haben, die nach gesetzlicher Vorschrift zu ihrem Schutz errichtet und staatlich überwacht ist."
    },
    {
      "date": "2025-08-15",
      "id": "121331",
      "original_text": "Registerbekanntmachung nach dem Umwandlungsgesetz\nBaden-Württemberg Amtsgericht Stuttgart HRB 729259\nRaumpflege GmbH – Rutesheim",
      "type": "Registerbekanntmachung nach dem Umwandlungsgesetz",
      "state": "Baden-Württemberg",
      "amtsgericht": "Amtsgericht Stuttgart",
      "registernummer": "HRB 729259",
      "registerart": "HRB",
      "company_name": "Raumpflege GmbH",
      "company_seat": "Rutesheim",
      "details": "15.08.2025 (Bekanntmachungsdatum)\n\nBaden-Württemberg Amtsgericht Stuttgart HRB 729259\nRegisterbekanntmachung nach dem Umwandlungsgesetz 15.08.2025 (Eintragungsdatum)\n\nRaumpflege GmbH\nGesellschaft mit beschränkter Haftung\nRutesheim\n\nDen Gläubigern der an der Ausgliederung beteiligten Rechtsträger ist, wenn sie binnen sechs Monaten nach dem Tag, an dem die Eintragung der Ausgliederung in das Register des Sitzes desjenigen Rechtsträgers, dessen Gläubiger sie sind, nach § 19 Abs. 3 UmwG als bekanntgemacht gilt, ihren Anspruch nach Grund und Höhe schriftlich anmelden, Sicherheit zu leisten, soweit sie nicht Befriedigung verlangen können. Dieses Recht steht den Gläubigern jedoch nur zu, wenn sie glaubhaft machen, dass durch die Ausgliederung die Erfüllung ihrer Forderung gefährdet wird."
    },
    {
      "date": "2025-08-15",
      "id": "121332",
      "original_text": "Registerbekanntmachung nach dem Umwandlungsgesetz\nBerlin Amtsgericht Berlin (Charlottenburg) HRB 212596\nFFO Hermann-Boian-Straße 14 Objekt GmbH – Berlin",
      "type": "Registerbekanntmachung nach dem Umwandlungsgesetz",
      "state": "Berlin",
      "amtsgericht": "Amtsgericht Berlin (Charlottenburg)",
      "registernummer": "HRB 212596",
      "registerart": "HRB",
      "company_name": "FFO Hermann-Boian-Straße 14 Objekt GmbH",
      "company_seat": "Berlin",
      "details": "15.08.2025 (Bekanntmachungsdatum)\n\nBerlin Amtsgericht Berlin (Charlottenburg) HRB 212596\nRegisterbekanntmachung nach dem Umwandlungsgesetz 13.08.2025 (Eintragungsdatum)\n\nFFO Hermann-Boian-Straße 14 Objekt GmbH\nGesellschaft mit beschränkter Haftung\nBerlin\n\nZu Eintragungsnummer 2 vom 13.08.2025 wird als nicht eingetragen veröffentlicht: Den Gläubigern der an der Verschmelzung beteiligten Rechtsträger ist, wenn sie binnen sechs Monaten nach dem Tag, an dem die Eintragung der Verschmelzung in das Register des Sitzes desjenigen Rechtsträgers, dessen Gläubiger sie sind, als bekannt gemacht gilt, ihren Anspruch nach Grund und Höhe schriftlich anmelden, Sicherheit zu leisten, soweit sie nicht Befriedigung verlangen können. Dieses Recht steht den Gläubigern jedoch nur zu, wenn sie glaubhaft machen, dass durch die Verschmelzung die Erfüllung ihrer Forderung gefährdet wird. Das Recht, Sicherheitsleistung zu verlangen, steht Gläubigern nicht zu, die im Falle der Insolvenz ein Recht auf vorzugsweise Befriedigung aus einer Deckungsmasse haben, die nach gesetzlicher Vorschrift zu ihrem Schutz errichtet und staatlich überwacht ist."
    },
    {
      "date": "2025-08-15",
      "id": "121333",
      "original_text": "Registerbekanntmachung nach dem Umwandlungsgesetz\nSchleswig-Holstein Amtsgericht Flensburg HRB 7431\niPAXX Nord GmbH – Aventoft",
      "type": "Registerbekanntmachung nach dem Umwandlungsgesetz",
      "state": "Schleswig-Holstein",
      "amtsgericht": "Amtsgericht Flensburg",
      "registernummer": "HRB 7431",
      "registerart": "HRB",
      "company_name": "iPAXX Nord GmbH",
      "company_seat": "Aventoft",
      "details": "15.08.2025 (Bekanntmachungsdatum)\n\nSchleswig-Holstein Amtsgericht Flensburg HRB 7431\nRegisterbekanntmachung nach dem Umwandlungsgesetz 15.08.2025 (Eintragungsdatum)\n\niPAXX Nord GmbH\nGesellschaft mit beschränkter Haftung\nAventoft\n\nZu Eintragungsnummer 6 vom 15.08.2025 wird als nicht eingetragen veröffentlicht:\nDen Gläubigern der an der Verschmelzung beteiligten Rechtsträger ist, wenn sie binnen sechs Monaten nach dem Tag, an dem die Eintragung der Verschmelzung in das Register des Sitzes desjenigen Rechtsträgers, dessen Gläubiger sie sind, als bekannt gemacht gilt, ihren Anspruch nach Grund und Höhe in Textform anmelden, Sicherheit zu leisten, soweit sie nicht Befriedigung verlangen können. Dieses Recht steht den Gläubigern jedoch nur zu, wenn sie glaubhaft machen, dass durch die Verschmelzung die Erfüllung ihrer Forderung gefährdet wird."
    },
    {
      "date": "2025-08-15",
      "id": "121334",
      "original_text": "Registerbekanntmachung nach dem Umwandlungsgesetz\nBaden-Württemberg Amtsgericht Stuttgart HRB 748349\nDr. Otto Hartmann Projekt GmbH – Vaihingen an der Enz",
      "type": "Registerbekanntmachung nach dem Umwandlungsgesetz",
      "state": "Baden-Württemberg",
      "amtsgericht": "Amtsgericht Stuttgart",
      "registernummer": "HRB 748349",
      "registerart": "HRB",
      "company_name": "Dr. Otto Hartmann Projekt GmbH",
      "company_seat": "Vaihingen an der Enz",
      "details": "15.08.2025 (Bekanntmachungsdatum)\n\nBaden-Württemberg Amtsgericht Stuttgart HRB 748349\nRegisterbekanntmachung nach dem Umwandlungsgesetz 15.08.2025 (Eintragungsdatum)\n\nDr. Otto Hartmann Projekt GmbH\nGesellschaft mit beschränkter Haftung\nVaihingen an der Enz\n\nAls nicht eingetragen wird bekanntgemacht:\nDen Gläubigern der an der Verschmelzung beteiligten Rechtsträger ist, wenn sie binnen sechs Monaten nach dem Tag, an dem die Eintragung der Verschmelzung in das Register des Sitzes desjenigen Rechtsträgers, dessen Gläubiger sie sind, nach § 19 Abs. 3 UmwG als bekanntgemacht gilt, ihren Anspruch nach Grund und Höhe schriftlich anmelden, Sicherheit zu leisten, soweit sie nicht Befriedigung verlangen können. Dieses Recht steht den Gläubigern jedoch nur zu, wenn sie glaubhaft machen, dass durch die Verschmelzung die Erfüllung ihrer Forderung gefährdet wird."
    },
    {
      "date": "2025-08-15",
      "id": "121335",
      "original_text": "Registerbekanntmachung nach dem Umwandlungsgesetz\nBrandenburg Amtsgericht Neuruppin HRB 2154\nPflanzenbau GmbH Wutike – Wutike",
      "type": "Registerbekanntmachung nach dem Umwandlungsgesetz",
      "state": "Brandenburg",
      "amtsgericht": "Amtsgericht Neuruppin",
      "registernummer": "HRB 2154",
      "registerart": "HRB",
      "company_name": "Pflanzenbau GmbH Wutike",
      "company_seat": "Wutike",
      "details": "15.08.2025 (Bekanntmachungsdatum)\n\nBrandenburg Amtsgericht Neuruppin HRB 2154\nRegisterbekanntmachung nach dem Umwandlungsgesetz 15.08.2025 (Eintragungsdatum)\n\nPflanzenbau GmbH Wutike\nGesellschaft mit beschränkter Haftung\nWutike\n\nZu Eintragungsnummer 7 vom 15.08.2025 wird als nicht eingetragen veröffentlicht:\n\nDen Gläubigern der an der Umwandlung beteiligten Rechtsträger ist, wenn sie binnen sechs Monaten nach dem Tag, an dem die Eintragung der Umwandlung in das Register des Sitzes desjenigen Rechtsträgers, dessen Gläubiger sie sind, als bekannt gemacht gilt, ihren Anspruch nach Grund und Höhe schriftlich anmelden, Sicherheit zu leisten, soweit sie nicht Befriedigung verlangen können. Dieses Recht steht den Gläubigern jedoch nur zu, wenn sie glaubhaft machen, dass durch die Umwandlung die Erfüllung ihrer Forderung gefährdet wird"
    },
    {
      "date": "2025-08-15",
      "id": "121336",
      "original_text": "Löschungsankündigung\nBrandenburg Amtsgericht Frankfurt/Oder HRB 5145\n\"DLC - Dienstleistungs-Center Eiche GmbH\" – Eiche",
      "type": "Löschungsankündigung",
      "state": "Brandenburg",
      "amtsgericht": "Amtsgericht Frankfurt/Oder",
      "registernummer": "HRB 5145",
      "registerart": "HRB",
      "company_name": "\"DLC - Dienstleistungs-Center Eiche GmbH\"",
      "company_seat": "Eiche",
      "details": "15.08.2025 (Bekanntmachungsdatum)\n\nBrandenburg Amtsgericht Frankfurt/Oder HRB 5145\nLöschungsankündigung\n\n\"DLC - Dienstleistungs-Center Eiche GmbH\"\nGesellschaft mit beschränkter Haftung\nEiche\n\nBei der nachstehenden Gesellschaft wird das Amtslöschungsverfahren gemäß § 394 Abs. 1 FamFG eingeleitet."
    },
    {
      "date": "2025-08-15",
      "id": "121337",
      "original_text": "Registerbekanntmachung nach dem Umwandlungsgesetz\nBaden-Württemberg Amtsgericht Stuttgart HRA 410817\nBerner Spedition GmbH & Co. KG – Dotternhausen",
      "type": "Registerbekanntmachung nach dem Umwandlungsgesetz",
      "state": "Baden-Württemberg",
      "amtsgericht": "Amtsgericht Stuttgart",
      "registernummer": "HRA 410817",
      "registerart": "HRA",
      "company_name": "Berner Spedition GmbH & Co. KG",
      "company_seat": "Dotternhausen",
      "details": "15.08.2025 (Bekanntmachungsdatum)\n\nBaden-Württemberg Amtsgericht Stuttgart HRA 410817\nRegisterbekanntmachung nach dem Umwandlungsgesetz 15.08.2025 (Eintragungsdatum)\n\nBerner Spedition GmbH & Co. KG\nKommanditgesellschaft\nDotternhausen\n\nDen Gläubigern der an der Verschmelzung beteiligten Rechtsträger ist, wenn sie binnen sechs Monaten nach dem Tag, an dem die Eintragung der Verschmelzung in das Register des Sitzes desjenigen Rechtsträgers, dessen Gläubiger sie sind, nach § 19 Abs. 3 UmwG als bekanntgemacht gilt, ihren Anspruch nach Grund und Höhe schriftlich anmelden, Sicherheit zu leisten, soweit sie nicht Befriedigung verlangen können. Dieses Recht steht den Gläubigern jedoch nur zu, wenn sie glaubhaft machen, dass durch die Verschmelzung die Erfüllung ihrer Forderung gefährdet wird."
    },
    {
      "date": "2025-08-15",
      "id": "121338",
      "original_text": "Registerbekanntmachung nach dem Umwandlungsgesetz\nBaden-Württemberg Amtsgericht Ulm HRB 743289\nANDRITZ Deutschland Holding GmbH – Göppingen",
      "type": "Registerbekanntmachung nach dem Umwandlungsgesetz",
      "state": "Baden-Württemberg",
      "amtsgericht": "Amtsgericht Ulm",
      "registernummer": "HRB 743289",
      "registerart": "HRB",
      "company_name": "ANDRITZ Deutschland Holding GmbH",
      "company_seat": "Göppingen",
      "details": "15.08.2025 (Bekanntmachungsdatum)\n\nBaden-Württemberg Amtsgericht Ulm HRB 743289\nRegisterbekanntmachung nach dem Umwandlungsgesetz 15.08.2025 (Eintragungsdatum)\n\nANDRITZ Deutschland Holding GmbH\nGesellschaft mit beschränkter Haftung\nGöppingen\n\nAls nicht eingetragen wird bekanntgemacht:\nDen Gläubigern der an der Verschmelzung beteiligten Rechtsträger ist, wenn sie binnen sechs Monaten nach dem Tag, an dem die Eintragung der Verschmelzung in das Register des Sitzes desjenigen Rechtsträgers, dessen Gläubiger sie sind, nach § 19 Abs. 3 UmwG als bekanntgemacht gilt, ihren Anspruch nach Grund und Höhe schriftlich anmelden, Sicherheit zu leisten, soweit sie nicht Befriedigung verlangen können. Dieses Recht steht den Gläubigern jedoch nur zu, wenn sie glaubhaft machen, dass durch die Verschmelzung die Erfüllung ihrer Forderung gefährdet wird."
    },
    {
      "date": "2025-08-15",
      "id": "121339",
      "original_text": "Löschungsankündigung\nBerlin Amtsgericht Berlin (Charlottenburg) HRB 225989\nVIDOOMY GERMAN GmbH – Berlin",
      "type": "Löschungsankündigung",
      "state": "Berlin",
      "amtsgericht": "Amtsgericht Berlin (Charlottenburg)",
      "registernummer": "HRB 225989",
      "registerart": "HRB",
      "company_name": "VIDOOMY GERMAN GmbH",
      "company_seat": "Berlin",
      "details": "15.08.2025 (Bekanntmachungsdatum)\n\nBerlin Amtsgericht Berlin (Charlottenburg) HRB 225989\nLöschungsankündigung\n\nVIDOOMY GERMAN GmbH\nGesellschaft mit beschränkter Haftung\nBerlin\n\nBei der nachstehenden Gesellschaft wird das Amtslöschungsverfahren gemäß § 394 FamFG eingeleitet. Widerspruchsfrist 6 Wochen"
    },
    {
      "date": "2025-08-15",
      "id": "121340",
      "original_text": "Registerbekanntmachung nach dem Umwandlungsgesetz\nSchleswig-Holstein Amtsgericht Lübeck HRB 4097\nDräger Safety AG & Co. KGaA – Lübeck",
      "type": "Registerbekanntmachung nach dem Umwandlungsgesetz",
      "state": "Schleswig-Holstein",
      "amtsgericht": "Amtsgericht Lübeck",
      "registernummer": "HRB 4097",
      "registerart": "HRB",
      "company_name": "Dräger Safety AG & Co. KGaA",
      "company_seat": "Lübeck",
      "details": "15.08.2025 (Bekanntmachungsdatum)\n\nSchleswig-Holstein Amtsgericht Lübeck HRB 4097\nRegisterbekanntmachung nach dem Umwandlungsgesetz 14.08.2025 (Eintragungsdatum)\n\nDräger Safety AG & Co. KGaA\nKommanditgesellschaft auf Aktien\nLübeck\n\nZu Eintragungsnummer 89 vom 14.08.2025 wird als nicht eingetragen veröffentlicht:   Den Gläubigern der an der Verschmelzung beteiligten Rechtsträger ist, wenn sie binnen sechs Monaten nach dem Tag, an dem die Eintragung der Verschmelzung in das Register des Sitzes desjenigen Rechtsträgers, dessen Gläubiger sie sind, als bekannt gemacht gilt, ihren Anspruch nach Grund und Höhe schriftlich anmelden, Sicherheit zu leisten, soweit sie nicht Befriedigung verlangen können. Dieses Recht steht den Gläubigern jedoch nur zu, wenn sie glaubhaft machen, dass durch die Verschmelzung die Erfüllung ihrer Forderung gefährdet wird."
    },
    {
      "date": "2025-08-15",
      "id": "121341",
      "original_text": "Registerbekanntmachung nach dem Umwandlungsgesetz\nBrandenburg Amtsgericht Neuruppin HRB 9477\nKolreper Agrar GmbH – Wutike",
      "type": "Registerbekanntmachung nach dem Umwandlungsgesetz",
      "state": "Brandenburg",
      "amtsgericht": "Amtsgericht Neuruppin",
      "registernummer": "HRB 9477",
      "registerart": "HRB",
      "company_name": "Kolreper Agrar GmbH",
      "company_seat": "Wutike",
      "details": "15.08.2025 (Bekanntmachungsdatum)\n\nBrandenburg Amtsgericht Neuruppin HRB 9477\nRegisterbekanntmachung nach dem Umwandlungsgesetz 15.08.2025 (Eintragungsdatum)\n\nKolreper Agrar GmbH\nGesellschaft mit beschränkter Haftung\nWutike\n\nZu Eintragungsnummer 3 vom 15.08.2025 wird als nicht eingetragen veröffentlicht:\nDen Gläubigern der an der Umwandlung beteiligten Rechtsträger ist, wenn sie binnen sechs Monaten nach dem Tag, an dem die Eintragung der Umwandlung in das Register des Sitzes desjenigen Rechtsträgers, dessen Gläubiger sie sind, als bekannt gemacht gilt, ihren Anspruch nach Grund und Höhe schriftlich anmelden, Sicherheit zu leisten, soweit sie nicht Befriedigung verlangen können. Dieses Recht steht den Gläubigern jedoch nur zu, wenn sie glaubhaft machen, dass durch die Umwandlung die Erfüllung ihrer Forderung gefährdet wird"
    },
    {
      "date": "2025-08-15",
      "id": "121342",
      "original_text": "Löschungsankündigung\nThüringen Amtsgericht Jena HRB 208462\nLange Trockenbaudesign GmbH – Bad Klosterlausnitz",
      "type": "Löschungsankündigung",
      "state": "Thüringen",
      "amtsgericht": "Amtsgericht Jena",
      "registernummer": "HRB 208462",
      "registerart": "HRB",
      "company_name": "Lange Trockenbaudesign GmbH",
      "company_seat": "Bad Klosterlausnitz",
      "details": "15.08.2025 (Bekanntmachungsdatum)\n\nThüringen Amtsgericht Jena HRB 208462\nLöschungsankündigung\n\nLange Trockenbaudesign GmbH\nGesellschaft mit beschränkter Haftung\nBad Klosterlausnitz\n\nDas Registergericht beabsichtigt, die im Handelsregister eingetragene Gesellschaft wegen Vermögenslosigkeit nach § 394 FamFG von Amts wegen zu löschen. Die Frist zur Erhebung eines Widerspruchs gegen die beabsichtigte Löschung wird auf 6 Wochen festgesetzt."
    },
    {
      "date": "2025-08-15",
      "id": "121343",
      "original_text": "Löschungsankündigung\nThüringen Amtsgericht Jena VR 231547\nJ-1013 e.V. – Jena",
      "type": "Löschungsankündigung",
      "state": "Thüringen",
      "amtsgericht": "Amtsgericht Jena",
      "registernummer": "VR 231547",
      "registerart": "VR",
      "company_name": "J-1013 e.V.",
      "company_seat": "Jena",
      "details": "15.08.2025 (Bekanntmachungsdatum)\n\nThüringen Amtsgericht Jena VR 231547\nLöschungsankündigung\n\nJ-1013 e.V.\neingetragener Verein\nJena\n\nDas Registergericht beabsichtigt, den im Vereinsregister eingetragenen Verein nach § 395 FamFG von Amts wegen zu löschen. Die Frist zur Erhebung eines Widerspruchs gegen die beabsichtigte Löschung wird auf 4 Wochen festgesetzt."
    },
    {
      "date": "2025-08-15",
      "id": "121344",
      "original_text": "Registerbekanntmachung nach dem Umwandlungsgesetz\nSchleswig-Holstein Amtsgericht Pinneberg HRA 1648 ME\nEvers & Evers GmbH & Co. KG – Meldorf",
      "type": "Registerbekanntmachung nach dem Umwandlungsgesetz",
      "state": "Schleswig-Holstein",
      "amtsgericht": "Amtsgericht Pinneberg",
      "registernummer": "HRA 1648 ME",
      "registerart": "HRA",
      "company_name": "Evers & Evers GmbH & Co. KG",
      "company_seat": "Meldorf",
      "details": "15.08.2025 (Bekanntmachungsdatum)\n\nSchleswig-Holstein Amtsgericht Pinneberg HRA 1648 ME\nRegisterbekanntmachung nach dem Umwandlungsgesetz 05.08.2025 (Eintragungsdatum)\n\nEvers & Evers GmbH & Co. KG\nKommanditgesellschaft\nMeldorf\n\nZu Eintragungsnummer 9 vom 05.08.2025 wird als nicht eingetragen veröffentlicht: Den Gläubigern der an der Verschmelzung beteiligten Rechtsträger ist, wenn sie binnen sechs Monaten nach dem Tag, an dem die Eintragung der Verschmelzung in das Register des Sitzes desjenigen Rechtsträgers, dessen Gläubiger sie sind, als bekannt gemacht gilt, ihren Anspruch nach Grund und Höhe schriftlich anmelden, Sicherheit zu leisten, soweit sie nicht Befriedigung verlangen können. Dieses Recht steht den Gläubigern jedoch nur zu, wenn sie glaubhaft machen, dass durch die Verschmelzung die Erfüllung ihrer Forderung gefährdet wird. Das Recht, Sicherheitsleistung zu verlangen, steht Gläubigern nicht zu, die im Falle der Insolvenz ein Recht auf vorzugsweise Befriedigung aus einer Deckungsmasse haben, die nach gesetzlicher Vorschrift zu ihrem Schutz errichtet und staatlich überwacht ist."
    },
    {
      "date": "2025-08-15",
      "id": "121345",
      "original_text": "Registerbekanntmachung nach dem Umwandlungsgesetz\nBaden-Württemberg Amtsgericht Mannheim HRB 460687\nHK.SYSTEMS GmbH – Buchen Odenwald",
      "type": "Registerbekanntmachung nach dem Umwandlungsgesetz",
      "state": "Baden-Württemberg",
      "amtsgericht": "Amtsgericht Mannheim",
      "registernummer": "HRB 460687",
      "registerart": "HRB",
      "company_name": "HK.SYSTEMS GmbH",
      "company_seat": "Buchen Odenwald",
      "details": "15.08.2025 (Bekanntmachungsdatum)\n\nBaden-Württemberg Amtsgericht Mannheim HRB 460687\nRegisterbekanntmachung nach dem Umwandlungsgesetz 15.08.2025 (Eintragungsdatum)\n\nHK.SYSTEMS GmbH\nGesellschaft mit beschränkter Haftung\nBuchen Odenwald\n\nDen Gläubigern des an dem Formwechsel beteiligten Rechtsträgers ist, wenn sie binnen sechs Monaten nach dem Tag, an dem die Eintragung des Formwechsels in das Register des Sitzes desjenigen Rechtsträgers, dessen Gläubiger sie sind, nach § 19 Abs. 3 UmwG als bekanntgemacht gilt, ihren Anspruch nach Grund und Höhe schriftlich anmelden, Sicherheit zu leisten, soweit sie nicht Befriedigung verlangen können. Dieses Recht steht den Gläubigern jedoch nur zu, wenn sie glaubhaft machen, dass durch den Formwechsel die Erfüllung ihrer Forderung gefährdet wird."
    },
    {
      "date": "2025-08-15",
      "id": "121346",
      "original_text": "Löschungsankündigung\nBerlin Amtsgericht Berlin (Charlottenburg) HRA 50901\nVielmetter Engineering GmbH & Co. KG – Berlin",
      "type": "Löschungsankündigung",
      "state": "Berlin",
      "amtsgericht": "Amtsgericht Berlin (Charlottenburg)",
      "registernummer": "HRA 50901",
      "registerart": "HRA",
      "company_name": "Vielmetter Engineering GmbH & Co. KG",
      "company_seat": "Berlin",
      "details": "15.08.2025 (Bekanntmachungsdatum)\n\nBerlin Amtsgericht Berlin (Charlottenburg) HRA 50901\nLöschungsankündigung\n\nVielmetter Engineering GmbH & Co. KG\nKommanditgesellschaft\nBerlin\n\nBei dem nachstehenden Unternehmen / der nachstehenden Gesellschaft wird das Amtslöschungsverfahren gemäß § 31 Abs. 2 HGB eingeleitet. Widerspruchsfrist 1 Monat"
    },
    {
      "date": "2025-08-15",
      "id": "121347",
      "original_text": "Registerbekanntmachung nach dem Umwandlungsgesetz\nBerlin Amtsgericht Berlin (Charlottenburg) HRA 63157\nAufzugsverbund Deutschland GmbH & Co. KG – Berlin",
      "type": "Registerbekanntmachung nach dem Umwandlungsgesetz",
      "state": "Berlin",
      "amtsgericht": "Amtsgericht Berlin (Charlottenburg)",
      "registernummer": "HRA 63157",
      "registerart": "HRA",
      "company_name": "Aufzugsverbund Deutschland GmbH & Co. KG",
      "company_seat": "Berlin",
      "details": "15.08.2025 (Bekanntmachungsdatum)\n\nBerlin Amtsgericht Berlin (Charlottenburg) HRA 63157\nRegisterbekanntmachung nach dem Umwandlungsgesetz 14.08.2025 (Eintragungsdatum)\n\nAufzugsverbund Deutschland GmbH & Co. KG\nKommanditgesellschaft\nBerlin\n\nZu Eintragungsnummer 22 vom 14.08.2025 wird als nicht eingetragen veröffentlicht:\nDen Gläubigern der an der Verschmelzung beteiligten Rechtsträger ist, wenn sie binnen sechs Monaten nach dem Tag, an dem die Eintragung der Verschmelzung in das Register des Sitzes desjenigen Rechtsträgers, dessen Gläubiger sie sind, als bekannt gemacht gilt, ihren Anspruch nach Grund und Höhe schriftlich anmelden, Sicherheit zu leisten, soweit sie nicht Befriedigung verlangen können. Dieses Recht steht den Gläubigern jedoch nur zu, wenn sie glaubhaft machen, dass durch die Verschmelzung die Erfüllung ihrer Forderung gefährdet wird. Das Recht, Sicherheitsleistung zu verlangen, steht Gläubigern nicht zu, die im Falle der Insolvenz ein Recht auf vorzugsweise Befriedigung aus einer Deckungsmasse haben, die nach gesetzlicher Vorschrift zu ihrem Schutz errichtet und staatlich überwacht ist."
    },
    {
      "date": "2025-08-15",
      "id": "121348",
      "original_text": "Registerbekanntmachung nach dem Umwandlungsgesetz\nBrandenburg Amtsgericht Neuruppin HRB 7542\nENERTRAG Windfeld Verwaltungsgesellschaft mbH – Schenkenberg",
      "type": "Registerbekanntmachung nach dem Umwandlungsgesetz",
      "state": "Brandenburg",
      "amtsgericht": "Amtsgericht Neuruppin",
      "registernummer": "HRB 7542",
      "registerart": "HRB",
      "company_name": "ENERTRAG Windfeld Verwaltungsgesellschaft mbH",
      "company_seat": "Schenkenberg",
      "details": "15.08.2025 (Bekanntmachungsdatum)\n\nBrandenburg Amtsgericht Neuruppin HRB 7542\nRegisterbekanntmachung nach dem Umwandlungsgesetz 15.08.2025 (Eintragungsdatum)\n\nENERTRAG Windfeld Verwaltungsgesellschaft mbH\nGesellschaft mit beschränkter Haftung\nSchenkenberg\n\nZu Eintragungsnummer 31 vom 15.08.2025 wird als nicht eingetragen veröffentlicht:\n\nDen Gläubigern der an der Umwandlung beteiligten Rechtsträger ist, wenn sie binnen sechs Monaten nach dem Tag, an dem die Eintragung der Umwandlung in das Register des Sitzes desjenigen Rechtsträgers, dessen Gläubiger sie sind, als bekannt gemacht gilt, ihren Anspruch nach Grund und Höhe schriftlich anmelden, Sicherheit zu leisten, soweit sie nicht Befriedigung verlangen können. Dieses Recht steht den Gläubigern jedoch nur zu, wenn sie glaubhaft machen, dass durch die Umwandlung die Erfüllung ihrer Forderung gefährdet wird"
    },
    {
      "date": "2025-08-15",
      "id": "121349",
      "original_text": "Löschungsankündigung\nBerlin Amtsgericht Berlin (Charlottenburg) HRB 215298\nGrunewaldturm Gastro UG (haftungsbeschränkt) – Berlin",
      "type": "Löschungsankündigung",
      "state": "Berlin",
      "amtsgericht": "Amtsgericht Berlin (Charlottenburg)",
      "registernummer": "HRB 215298",
      "registerart": "HRB",
      "company_name": "Grunewaldturm Gastro UG (haftungsbeschränkt)",
      "company_seat": "Berlin",
      "details": "15.08.2025 (Bekanntmachungsdatum)\n\nBerlin Amtsgericht Berlin (Charlottenburg) HRB 215298\nLöschungsankündigung\n\nGrunewaldturm Gastro UG (haftungsbeschränkt)\nGesellschaft mit beschränkter Haftung\nBerlin\n\nBei der nachstehenden Gesellschaft wird das Amtslöschungsverfahren gemäß § 394 FamFG eingeleitet. Widerspruchsfrist 6 Wochen"
    },
    {
      "date": "2025-08-15",
      "id": "121350",
      "original_text": "Einreichung neuer Dokumente\nBaden-Württemberg Amtsgericht Freiburg HRB 410101\nStädtische Wohnungsbaugesellschaft mit beschränkter Haftung (GmbH) – Weil am Rhein",
      "type": "Einreichung neuer Dokumente",
      "state": "Baden-Württemberg",
      "amtsgericht": "Amtsgericht Freiburg",
      "registernummer": "HRB 410101",
      "registerart": "HRB",
      "company_name": "Städtische Wohnungsbaugesellschaft mit beschränkter Haftung (GmbH)",
      "company_seat": "Weil am Rhein",
      "details": "15.08.2025 (Bekanntmachungsdatum)\n\nBaden-Württemberg Amtsgericht Freiburg HRB 410101\nEinreichung neuer Dokumente 15.08.2025 (Eintragungsdatum)\n\nStädtische Wohnungsbaugesellschaft mit beschränkter Haftung (GmbH)\nGesellschaft mit beschränkter Haftung\nWeil am Rhein\n\nDie Gesellschaft hat am 14.08.2025 die Liste über die Zusammensetzung des Aufsichtsrats zum Handelsregister eingereicht."
    },
    {
      "date": "2025-08-15",
      "id": "121351",
      "original_text": "Registerbekanntmachung nach dem Umwandlungsgesetz\nHamburg Amtsgericht Hamburg HRB 54580\nBeteiligungsgesellschaft Niko Lafrentz Grundstücksverwaltung Kolumbusstrasse mbH – Hamburg",
      "type": "Registerbekanntmachung nach dem Umwandlungsgesetz",
      "state": "Hamburg",
      "amtsgericht": "Amtsgericht Hamburg",
      "registernummer": "HRB 54580",
      "registerart": "HRB",
      "company_name": "Beteiligungsgesellschaft Niko Lafrentz Grundstücksverwaltung Kolumbusstrasse mbH",
      "company_seat": "Hamburg",
      "details": "15.08.2025 (Bekanntmachungsdatum)\n\nHamburg Amtsgericht Hamburg HRB 54580\nRegisterbekanntmachung nach dem Umwandlungsgesetz 15.08.2025 (Eintragungsdatum)\n\nBeteiligungsgesellschaft Niko Lafrentz Grundstücksverwaltung Kolumbusstrasse mbH\nGesellschaft mit beschränkter Haftung\nHamburg\n\nAls nicht eingetragen wird bekannt gemacht:\nDen Gläubigern der an der Verschmelzung beteiligten Gesellschaften ist, wenn sie binnen sechs Monaten nach dem Tag, an dem die Eintragung der Verschmelzung in das Register des Sitzes desjenigen Rechtsträgers, dessen Gläubiger sie sind, nach § 19 Absatz 3 UmwG als bekannt gemacht gilt, ihren Anspruch nach Grund und Höhe schriftlich anmelden, Sicherheit zu leisten, soweit sie nicht Befriedigung verlangen können. Dieses Recht steht den Gläubigern jedoch nur zu, wenn sie glaubhaft machen, dass durch die Verschmelzung die Erfüllung ihrer Forderung gefährdet wird."
    },
    {
      "date": "2025-08-15",
      "id": "121352",
      "original_text": "Registerbekanntmachung nach dem Umwandlungsgesetz\nHamburg Amtsgericht Hamburg HRB 120482\nNiko Lafrentz Grundstücksverwaltung Kolumbusstrasse GmbH – Hamburg",
      "type": "Registerbekanntmachung nach dem Umwandlungsgesetz",
      "state": "Hamburg",
      "amtsgericht": "Amtsgericht Hamburg",
      "registernummer": "HRB 120482",
      "registerart": "HRB",
      "company_name": "Niko Lafrentz Grundstücksverwaltung Kolumbusstrasse GmbH",
      "company_seat": "Hamburg",
      "details": "15.08.2025 (Bekanntmachungsdatum)\n\nHamburg Amtsgericht Hamburg HRB 120482\nRegisterbekanntmachung nach dem Umwandlungsgesetz 15.08.2025 (Eintragungsdatum)\n\nNiko Lafrentz Grundstücksverwaltung Kolumbusstrasse GmbH\nGesellschaft mit beschränkter Haftung\nHamburg\n\nAls nicht eingetragen wird bekannt gemacht:\nDen Gläubigern der an der Verschmelzung beteiligten Gesellschaften ist, wenn sie binnen sechs Monaten nach dem Tag, an dem die Eintragung der Verschmelzung in das Register des Sitzes desjenigen Rechtsträgers, dessen Gläubiger sie sind, nach § 19 Absatz 3 UmwG als bekannt gemacht gilt, ihren Anspruch nach Grund und Höhe schriftlich anmelden, Sicherheit zu leisten, soweit sie nicht Befriedigung verlangen können. Dieses Recht steht den Gläubigern jedoch nur zu, wenn sie glaubhaft machen, dass durch die Verschmelzung die Erfüllung ihrer Forderung gefährdet wird."
    },
    {
      "date": "2025-08-15",
      "id": "121353",
      "original_text": "Registerbekanntmachung nach dem Umwandlungsgesetz\nBrandenburg Amtsgericht Potsdam HRB 36714\nXPUB GmbH – Potsdam",
      "type": "Registerbekanntmachung nach dem Umwandlungsgesetz",
      "state": "Brandenburg",
      "amtsgericht": "Amtsgericht Potsdam",
      "registernummer": "HRB 36714",
      "registerart": "HRB",
      "company_name": "XPUB GmbH",
      "company_seat": "Potsdam",
      "details": "15.08.2025 (Bekanntmachungsdatum)\n\nBrandenburg Amtsgericht Potsdam HRB 36714\nRegisterbekanntmachung nach dem Umwandlungsgesetz 14.08.2025 (Eintragungsdatum)\n\nXPUB GmbH\nGesellschaft mit beschränkter Haftung\nPotsdam\n\nZu Eintragungsnummer 2 vom 14.08.2025 wird als nicht eingetragen veröffentlicht:\nDen Gläubigern der an der Verschmelzung beteiligten Rechtsträger ist, wenn sie binnen sechs Monaten nach dem Tag, an dem die Eintragung der Verschmelzung in das Register des Sitzes desjenigen Rechtsträgers, dessen Gläubiger sie sind, als bekannt gemacht gilt, ihren Anspruch nach Grund und Höhe schriftlich anmelden, Sicherheit zu leisten, soweit sie nicht Befriedigung verlangen können. Dieses Recht steht den Gläubigern jedoch nur zu, wenn sie glaubhaft machen, dass durch die Verschmelzung die Erfüllung ihrer Forderung gefährdet wird."
    },
    {
      "date": "2025-08-15",
      "id": "121354",
      "original_text": "Registerbekanntmachung nach dem Umwandlungsgesetz\nBrandenburg Amtsgericht Potsdam HRB 38075\nLauscherlounge GmbH – Potsdam",
      "type": "Registerbekanntmachung nach dem Umwandlungsgesetz",
      "state": "Brandenburg",
      "amtsgericht": "Amtsgericht Potsdam",
      "registernummer": "HRB 38075",
      "registerart": "HRB",
      "company_name": "Lauscherlounge GmbH",
      "company_seat": "Potsdam",
      "details": "15.08.2025 (Bekanntmachungsdatum)\n\nBrandenburg Amtsgericht Potsdam HRB 38075\nRegisterbekanntmachung nach dem Umwandlungsgesetz 14.08.2025 (Eintragungsdatum)\n\nLauscherlounge GmbH\nGesellschaft mit beschränkter Haftung\nPotsdam\n\nZu Eintragungsnummer 2 vom 14.08.2025 wird als nicht eingetragen veröffentlicht:\nDen Gläubigern der an der Verschmelzung beteiligten Rechtsträger ist, wenn sie binnen sechs Monaten nach dem Tag, an dem die Eintragung der Verschmelzung in das Register des Sitzes desjenigen Rechtsträgers, dessen Gläubiger sie sind, als bekannt gemacht gilt, ihren Anspruch nach Grund und Höhe schriftlich anmelden, Sicherheit zu leisten, soweit sie nicht Befriedigung verlangen können. Dieses Recht steht den Gläubigern jedoch nur zu, wenn sie glaubhaft machen, dass durch die Verschmelzung die Erfüllung ihrer Forderung gefährdet wird."
    },
    {
      "date": "2025-08-15",
      "id": "121355",
      "original_text": "Registerbekanntmachung nach dem Umwandlungsgesetz\nHamburg Amtsgericht Hamburg HRB 7330\nVerwaltungsgesellschaft Industria mbH – Hamburg",
      "type": "Registerbekanntmachung nach dem Umwandlungsgesetz",
      "state": "Hamburg",
      "amtsgericht": "Amtsgericht Hamburg",
      "registernummer": "HRB 7330",
      "registerart": "HRB",
      "company_name": "Verwaltungsgesellschaft Industria mbH",
      "company_seat": "Hamburg",
      "details": "15.08.2025 (Bekanntmachungsdatum)\n\nHamburg Amtsgericht Hamburg HRB 7330\nRegisterbekanntmachung nach dem Umwandlungsgesetz 15.08.2025 (Eintragungsdatum)\n\nVerwaltungsgesellschaft Industria mbH\nGesellschaft mit beschränkter Haftung\nHamburg\n\nAls nicht eingetragen wird bekannt gemacht:\nDen Gläubigern der an der Verschmelzung beteiligten Gesellschaften ist, wenn sie binnen sechs Monaten nach dem Tag, an dem die Eintragung der Verschmelzung in das Register des Sitzes desjenigen Rechtsträgers, dessen Gläubiger sie sind, nach § 19 Absatz 3 UmwG als bekannt gemacht gilt, ihren Anspruch nach Grund und Höhe schriftlich anmelden, Sicherheit zu leisten, soweit sie nicht Befriedigung verlangen können. Dieses Recht steht den Gläubigern jedoch nur zu, wenn sie glaubhaft machen, dass durch die Verschmelzung die Erfüllung ihrer Forderung gefährdet wird."
    },
    {
      "date": "2025-08-15",
      "id": "121356",
      "original_text": "Registerbekanntmachung nach dem Umwandlungsgesetz\nHamburg Amtsgericht Hamburg HRA 52274\nIndustria GmbH & Co. KG – Hamburg",
      "type": "Registerbekanntmachung nach dem Umwandlungsgesetz",
      "state": "Hamburg",
      "amtsgericht": "Amtsgericht Hamburg",
      "registernummer": "HRA 52274",
      "registerart": "HRA",
      "company_name": "Industria GmbH & Co. KG",
      "company_seat": "Hamburg",
      "details": "15.08.2025 (Bekanntmachungsdatum)\n\nHamburg Amtsgericht Hamburg HRA 52274\nRegisterbekanntmachung nach dem Umwandlungsgesetz 15.08.2025 (Eintragungsdatum)\n\nIndustria GmbH & Co. KG\nKommanditgesellschaft\nHamburg\n\nAls nicht eingetragen wird bekannt gemacht:\nDen Gläubigern der an der Verschmelzung beteiligten Gesellschaften ist, wenn sie binnen sechs Monaten nach dem Tag, an dem die Eintragung der Verschmelzung in das Register des Sitzes desjenigen Rechtsträgers, dessen Gläubiger sie sind, nach § 19 Absatz 3 UmwG als bekannt gemacht gilt, ihren Anspruch nach Grund und Höhe schriftlich anmelden, Sicherheit zu leisten, soweit sie nicht Befriedigung verlangen können. Dieses Recht steht den Gläubigern jedoch nur zu, wenn sie glaubhaft machen, dass durch die Verschmelzung die Erfüllung ihrer Forderung gefährdet wird."
    },
    {
      "date": "2025-08-15",
      "id": "121357",
      "original_text": "Registerbekanntmachung nach dem Umwandlungsgesetz\nHamburg Amtsgericht Hamburg HRB 86133\nHZP Verwaltungs GmbH – Hamburg",
      "type": "Registerbekanntmachung nach dem Umwandlungsgesetz",
      "state": "Hamburg",
      "amtsgericht": "Amtsgericht Hamburg",
      "registernummer": "HRB 86133",
      "registerart": "HRB",
      "company_name": "HZP Verwaltungs GmbH",
      "company_seat": "Hamburg",
      "details": "15.08.2025 (Bekanntmachungsdatum)\n\nHamburg Amtsgericht Hamburg HRB 86133\nRegisterbekanntmachung nach dem Umwandlungsgesetz 15.08.2025 (Eintragungsdatum)\n\nHZP Verwaltungs GmbH\nGesellschaft mit beschränkter Haftung\nHamburg\n\nAls nicht eingetragen wird bekannt gemacht:\nDen Gläubigern der an der Verschmelzung beteiligten Gesellschaften ist, wenn sie binnen sechs Monaten nach dem Tag, an dem die Eintragung der Verschmelzung in das Register des Sitzes desjenigen Rechtsträgers, dessen Gläubiger sie sind, nach § 19 Absatz 3 UmwG als bekannt gemacht gilt, ihren Anspruch nach Grund und Höhe schriftlich anmelden, Sicherheit zu leisten, soweit sie nicht Befriedigung verlangen können. Dieses Recht steht den Gläubigern jedoch nur zu, wenn sie glaubhaft machen, dass durch die Verschmelzung die Erfüllung ihrer Forderung gefährdet wird."
    },
    {
      "date": "2025-08-15",
      "id": "121358",
      "original_text": "Registerbekanntmachung nach dem Umwandlungsgesetz\nBaden-Württemberg Amtsgericht Freiburg HRB 670356\nSprintex Trainingsgeräte GmbH – Kleines Wiesental",
      "type": "Registerbekanntmachung nach dem Umwandlungsgesetz",
      "state": "Baden-Württemberg",
      "amtsgericht": "Amtsgericht Freiburg",
      "registernummer": "HRB 670356",
      "registerart": "HRB",
      "company_name": "Sprintex Trainingsgeräte GmbH",
      "company_seat": "Kleines Wiesental",
      "details": "15.08.2025 (Bekanntmachungsdatum)\n\nBaden-Württemberg Amtsgericht Freiburg HRB 670356\nRegisterbekanntmachung nach dem Umwandlungsgesetz 15.08.2025 (Eintragungsdatum)\n\nSprintex Trainingsgeräte GmbH\nGesellschaft mit beschränkter Haftung\nKleines Wiesental\n\nAls nicht eingetragen wird bekanntgemacht:\nDen Gläubigern der an der Verschmelzung beteiligten Rechtsträger ist, wenn sie binnen sechs Monaten nach dem Tag, an dem die Eintragung der Verschmelzung in das Register des Sitzes desjenigen Rechtsträgers, dessen Gläubiger sie sind, nach § 19 Abs. 3 UmwG als bekanntgemacht gilt, ihren Anspruch nach Grund und Höhe schriftlich anmelden, Sicherheit zu leisten, soweit sie nicht Befriedigung verlangen können. Dieses Recht steht den Gläubigern jedoch nur zu, wenn sie glaubhaft machen, dass durch die Verschmelzung die Erfüllung ihrer Forderung gefährdet wird."
    },
    {
      "date": "2025-08-15",
      "id": "121359",
      "original_text": "Registerbekanntmachung nach dem Umwandlungsgesetz\nMecklenburg-Vorpommern Amtsgericht Stralsund HRB 22945\nBalTrip Reiseservice GmbH – Heringsdorf",
      "type": "Registerbekanntmachung nach dem Umwandlungsgesetz",
      "state": "Mecklenburg-Vorpommern",
      "amtsgericht": "Amtsgericht Stralsund",
      "registernummer": "HRB 22945",
      "registerart": "HRB",
      "company_name": "BalTrip Reiseservice GmbH",
      "company_seat": "Heringsdorf",
      "details": "15.08.2025 (Bekanntmachungsdatum)\n\nMecklenburg-Vorpommern Amtsgericht Stralsund HRB 22945\nRegisterbekanntmachung nach dem Umwandlungsgesetz 15.08.2025 (Eintragungsdatum)\n\nBalTrip Reiseservice GmbH\nGesellschaft mit beschränkter Haftung\nHeringsdorf\n\nAls nicht eingetragen wird veröffentlicht: Den Gläubigern der an der Ausgliederung beteiligten Rechtsträger ist, wenn sie binnen sechs Monaten nach dem Tag, an dem die Eintragung der Ausgliederung in das Register des Sitzes desjenigen Rechtsträgers, dessen Gläubiger sie sind, nach § 19 Abs. 3 UmwG als bekannt gemacht gilt, ihren Anspruch nach Grund und Höhe in Textform anmelden,\nSicherheit zu leisten, soweit sie nicht Befriedigung verlangen können. Dieses Recht steht den Gläubigern jedoch nur zu, wenn sie glaubhaft machen, dass durch die Ausgliederung die Erfüllung der Forderung gefährdet wird."
    },
    {
      "date": "2025-08-15",
      "id": "121360",
      "original_text": "Löschungsankündigung\nBrandenburg Amtsgericht Frankfurt/Oder HRB 14528\nPRIMOTEC Service UG (haftungsbeschränkt) – Wandlitz",
      "type": "Löschungsankündigung",
      "state": "Brandenburg",
      "amtsgericht": "Amtsgericht Frankfurt/Oder",
      "registernummer": "HRB 14528",
      "registerart": "HRB",
      "company_name": "PRIMOTEC Service UG (haftungsbeschränkt)",
      "company_seat": "Wandlitz",
      "details": "15.08.2025 (Bekanntmachungsdatum)\n\nBrandenburg Amtsgericht Frankfurt/Oder HRB 14528\nLöschungsankündigung\n\nPRIMOTEC Service UG (haftungsbeschränkt)\nGesellschaft mit beschränkter Haftung\nWandlitz\n\nBei der nachstehenden Gesellschaft wird das Amtslöschungsverfahren gemäß § 394 FamFG eingeleitet."
    },
    {
      "date": "2025-08-15",
      "id": "121361",
      "original_text": "Sonstige Registerbekanntmachung\nSchleswig-Holstein Amtsgericht Lübeck HRB 245\nLübecker Hafen - Gesellschaft mit beschränkter Haftung – Lübeck",
      "type": "Sonstige Registerbekanntmachung",
      "state": "Schleswig-Holstein",
      "amtsgericht": "Amtsgericht Lübeck",
      "registernummer": "HRB 245",
      "registerart": "HRB",
      "company_name": "Lübecker Hafen - Gesellschaft mit beschränkter Haftung",
      "company_seat": "Lübeck",
      "details": "15.08.2025 (Bekanntmachungsdatum)\n\nSchleswig-Holstein Amtsgericht Lübeck HRB 245\nSonstige Registerbekanntmachung\n\nLübecker Hafen - Gesellschaft mit beschränkter Haftung\nGesellschaft mit beschränkter Haftung\nLübeck\n\nAls nicht eingetragen wird veröffentlicht: die Gesellschaft hat eine aktuelle Liste der Aufsichtsratsmitglieder zum Handelsregister eingereicht."
    },
    {
      "date": "2025-08-15",
      "id": "121362",
      "original_text": "Registerbekanntmachung nach dem Umwandlungsgesetz\nSchleswig-Holstein Amtsgericht Lübeck HRB 19670\nKingstreet Investors UG (haftungsbeschränkt) – Großhansdorf",
      "type": "Registerbekanntmachung nach dem Umwandlungsgesetz",
      "state": "Schleswig-Holstein",
      "amtsgericht": "Amtsgericht Lübeck",
      "registernummer": "HRB 19670",
      "registerart": "HRB",
      "company_name": "Kingstreet Investors UG (haftungsbeschränkt)",
      "company_seat": "Großhansdorf",
      "details": "15.08.2025 (Bekanntmachungsdatum)\n\nSchleswig-Holstein Amtsgericht Lübeck HRB 19670\nRegisterbekanntmachung nach dem Umwandlungsgesetz 14.08.2025 (Eintragungsdatum)\n\nKingstreet Investors UG (haftungsbeschränkt)\nGesellschaft mit beschränkter Haftung\nGroßhansdorf\n\nZu Eintragungsnummer 3 vom 14.08.2025 wird als nicht eingetragen veröffentlicht:  Den Gläubigern der an der Verschmelzung beteiligten Rechtsträger ist, wenn sie binnen sechs Monaten nach dem Tag, an dem die Eintragung der Verschmelzung in das Register des Sitzes desjenigen Rechtsträgers, dessen Gläubiger sie sind, als bekannt gemacht gilt, ihren Anspruch nach Grund und Höhe schriftlich anmelden, Sicherheit zu leisten, soweit sie nicht Befriedigung verlangen können. Dieses Recht steht den Gläubigern jedoch nur zu, wenn sie glaubhaft machen, dass durch die Verschmelzung die Erfüllung ihrer Forderung gefährdet wird."
    },
    {
      "date": "2025-08-15",
      "id": "121363",
      "original_text": "Registerbekanntmachung nach dem Umwandlungsgesetz\nBerlin Amtsgericht Berlin (Charlottenburg) HRB 246364\nideate ID UG (haftungsbeschränkt) – Berlin",
      "type": "Registerbekanntmachung nach dem Umwandlungsgesetz",
      "state": "Berlin",
      "amtsgericht": "Amtsgericht Berlin (Charlottenburg)",
      "registernummer": "HRB 246364",
      "registerart": "HRB",
      "company_name": "ideate ID UG (haftungsbeschränkt)",
      "company_seat": "Berlin",
      "details": "15.08.2025 (Bekanntmachungsdatum)\n\nBerlin Amtsgericht Berlin (Charlottenburg) HRB 246364\nRegisterbekanntmachung nach dem Umwandlungsgesetz 14.08.2025 (Eintragungsdatum)\n\nideate ID UG (haftungsbeschränkt)\nGesellschaft mit beschränkter Haftung\nBerlin\n\nZu Eintragungsnummer 2 vom 14.08.2025 wird als nicht eingetragen veröffentlicht: Den Gläubigern der an der Verschmelzung beteiligten Rechtsträger ist, wenn sie binnen sechs Monaten nach dem Tag, an dem die Eintragung der Verschmelzung in das Register des Sitzes desjenigen Rechtsträgers, dessen Gläubiger sie sind, als bekannt gemacht gilt, ihren Anspruch nach Grund und Höhe schriftlich anmelden, Sicherheit zu leisten, soweit sie nicht Befriedigung verlangen können. Dieses Recht steht den Gläubigern jedoch nur zu, wenn sie glaubhaft machen, dass durch die Verschmelzung die Erfüllung ihrer Forderung gefährdet wird. Das Recht, Sicherheitsleistung zu verlangen, steht Gläubigern nicht zu, die im Falle der Insolvenz ein Recht auf vorzugsweise Befriedigung aus einer Deckungsmasse haben, die nach gesetzlicher Vorschrift zu ihrem Schutz errichtet und staatlich überwacht ist."
    },
    {
      "date": "2025-08-15",
      "id": "121364",
      "original_text": "Registerbekanntmachung nach dem Umwandlungsgesetz\nBerlin Amtsgericht Berlin (Charlottenburg) HRB 246217\nLINDE Vermögensverwaltung UG (haftungsbeschränkt) – Berlin",
      "type": "Registerbekanntmachung nach dem Umwandlungsgesetz",
      "state": "Berlin",
      "amtsgericht": "Amtsgericht Berlin (Charlottenburg)",
      "registernummer": "HRB 246217",
      "registerart": "HRB",
      "company_name": "LINDE Vermögensverwaltung UG (haftungsbeschränkt)",
      "company_seat": "Berlin",
      "details": "15.08.2025 (Bekanntmachungsdatum)\n\nBerlin Amtsgericht Berlin (Charlottenburg) HRB 246217\nRegisterbekanntmachung nach dem Umwandlungsgesetz 14.08.2025 (Eintragungsdatum)\n\nLINDE Vermögensverwaltung UG (haftungsbeschränkt)\nGesellschaft mit beschränkter Haftung\nBerlin\n\nZu Eintragungsnummer 2 vom 14.08.2025 wird als nicht eingetragen veröffentlicht: Den Gläubigern der an der Verschmelzung beteiligten Rechtsträger ist, wenn sie binnen sechs Monaten nach dem Tag, an dem die Eintragung der Verschmelzung in das Register des Sitzes desjenigen Rechtsträgers, dessen Gläubiger sie sind, als bekannt gemacht gilt, ihren Anspruch nach Grund und Höhe schriftlich anmelden, Sicherheit zu leisten, soweit sie nicht Befriedigung verlangen können. Dieses Recht steht den Gläubigern jedoch nur zu, wenn sie glaubhaft machen, dass durch die Verschmelzung die Erfüllung ihrer Forderung gefährdet wird. Das Recht, Sicherheitsleistung zu verlangen, steht Gläubigern nicht zu, die im Falle der Insolvenz ein Recht auf vorzugsweise Befriedigung aus einer Deckungsmasse haben, die nach gesetzlicher Vorschrift zu ihrem Schutz errichtet und staatlich überwacht ist."
    },
    {
      "date": "2025-08-15",
      "id": "121365",
      "original_text": "Registerbekanntmachung nach dem Umwandlungsgesetz\nHamburg Amtsgericht Hamburg HRB 161383\nESP Gesellschaft für Unternehmensberatung mbH – Hamburg",
      "type": "Registerbekanntmachung nach dem Umwandlungsgesetz",
      "state": "Hamburg",
      "amtsgericht": "Amtsgericht Hamburg",
      "registernummer": "HRB 161383",
      "registerart": "HRB",
      "company_name": "ESP Gesellschaft für Unternehmensberatung mbH",
      "company_seat": "Hamburg",
      "details": "15.08.2025 (Bekanntmachungsdatum)\n\nHamburg Amtsgericht Hamburg HRB 161383\nRegisterbekanntmachung nach dem Umwandlungsgesetz 15.08.2025 (Eintragungsdatum)\n\nESP Gesellschaft für Unternehmensberatung mbH\nGesellschaft mit beschränkter Haftung\nHamburg\n\nAls nicht eingetragen wird bekannt gemacht:\nDen Gläubigern der an der Verschmelzung beteiligten Gesellschaften ist, wenn sie binnen sechs Monaten nach dem Tag, an dem die Eintragung der Verschmelzung in das Register des Sitzes desjenigen Rechtsträgers, dessen Gläubiger sie sind, nach § 19 Absatz 3 UmwG als bekannt gemacht gilt, ihren Anspruch nach Grund und Höhe schriftlich anmelden, Sicherheit zu leisten, soweit sie nicht Befriedigung verlangen können. Dieses Recht steht den Gläubigern jedoch nur zu, wenn sie glaubhaft machen, dass durch die Verschmelzung die Erfüllung ihrer Forderung gefährdet wird."
    },
    {
      "date": "2025-08-15",
      "id": "121366",
      "original_text": "Registerbekanntmachung nach dem Umwandlungsgesetz\nHamburg Amtsgericht Hamburg HRB 174860\nLier Capital Invest GmbH – Hamburg",
      "type": "Registerbekanntmachung nach dem Umwandlungsgesetz",
      "state": "Hamburg",
      "amtsgericht": "Amtsgericht Hamburg",
      "registernummer": "HRB 174860",
      "registerart": "HRB",
      "company_name": "Lier Capital Invest GmbH",
      "company_seat": "Hamburg",
      "details": "15.08.2025 (Bekanntmachungsdatum)\n\nHamburg Amtsgericht Hamburg HRB 174860\nRegisterbekanntmachung nach dem Umwandlungsgesetz 15.08.2025 (Eintragungsdatum)\n\nLier Capital Invest GmbH\nGesellschaft mit beschränkter Haftung\nHamburg\n\nAls nicht eingetragen wird bekannt gemacht:\nDen Gläubigern der an der Verschmelzung beteiligten Gesellschaften ist, wenn sie binnen sechs Monaten nach dem Tag, an dem die Eintragung der Verschmelzung in das Register des Sitzes desjenigen Rechtsträgers, dessen Gläubiger sie sind, nach § 19 Absatz 3 UmwG als bekannt gemacht gilt, ihren Anspruch nach Grund und Höhe schriftlich anmelden, Sicherheit zu leisten, soweit sie nicht Befriedigung verlangen können. Dieses Recht steht den Gläubigern jedoch nur zu, wenn sie glaubhaft machen, dass durch die Verschmelzung die Erfüllung ihrer Forderung gefährdet wird."
    },
    {
      "date": "2025-08-15",
      "id": "121367",
      "original_text": "Registerbekanntmachung nach dem Umwandlungsgesetz\nHamburg Amtsgericht Hamburg HRB 112433\nLacon Montronic GmbH – Hamburg",
      "type": "Registerbekanntmachung nach dem Umwandlungsgesetz",
      "state": "Hamburg",
      "amtsgericht": "Amtsgericht Hamburg",
      "registernummer": "HRB 112433",
      "registerart": "HRB",
      "company_name": "Lacon Montronic GmbH",
      "company_seat": "Hamburg",
      "details": "15.08.2025 (Bekanntmachungsdatum)\n\nHamburg Amtsgericht Hamburg HRB 112433\nRegisterbekanntmachung nach dem Umwandlungsgesetz 15.08.2025 (Eintragungsdatum)\n\nLacon Montronic GmbH\nGesellschaft mit beschränkter Haftung\nHamburg\n\nAls nicht eingetragen wird bekannt gemacht:\nDen Gläubigern der an der Verschmelzung beteiligten Gesellschaften ist, wenn sie binnen sechs Monaten nach dem Tag, an dem die Eintragung der Verschmelzung in das Register des Sitzes desjenigen Rechtsträgers, dessen Gläubiger sie sind, nach § 19 Absatz 3 UmwG als bekannt gemacht gilt, ihren Anspruch nach Grund und Höhe schriftlich anmelden, Sicherheit zu leisten, soweit sie nicht Befriedigung verlangen können. Dieses Recht steht den Gläubigern jedoch nur zu, wenn sie glaubhaft machen, dass durch die Verschmelzung die Erfüllung ihrer Forderung gefährdet wird."
    },
    {
      "date": "2025-08-15",
      "id": "121368",
      "original_text": "Registerbekanntmachung nach dem Umwandlungsgesetz\nHamburg Amtsgericht Hamburg HRB 147892\nNunique Healthcare GmbH – Hamburg",
      "type": "Registerbekanntmachung nach dem Umwandlungsgesetz",
      "state": "Hamburg",
      "amtsgericht": "Amtsgericht Hamburg",
      "registernummer": "HRB 147892",
      "registerart": "HRB",
      "company_name": "Nunique Healthcare GmbH",
      "company_seat": "Hamburg",
      "details": "15.08.2025 (Bekanntmachungsdatum)\n\nHamburg Amtsgericht Hamburg HRB 147892\nRegisterbekanntmachung nach dem Umwandlungsgesetz 15.08.2025 (Eintragungsdatum)\n\nNunique Healthcare GmbH\nGesellschaft mit beschränkter Haftung\nHamburg\n\nAls nicht eingetragen wird bekannt gemacht:\nDen Gläubigern der an der Verschmelzung beteiligten Gesellschaften ist, wenn sie binnen sechs Monaten nach dem Tag, an dem die Eintragung der Verschmelzung in das Register des Sitzes desjenigen Rechtsträgers, dessen Gläubiger sie sind, nach § 19 Absatz 3 UmwG als bekannt gemacht gilt, ihren Anspruch nach Grund und Höhe schriftlich anmelden, Sicherheit zu leisten, soweit sie nicht Befriedigung verlangen können. Dieses Recht steht den Gläubigern jedoch nur zu, wenn sie glaubhaft machen, dass durch die Verschmelzung die Erfüllung ihrer Forderung gefährdet wird."
    },
    {
      "date": "2025-08-15",
      "id": "121369",
      "original_text": "Registerbekanntmachung nach dem Umwandlungsgesetz\nHamburg Amtsgericht Hamburg HRB 146865\nEPS Projektentwicklungsgesellschaft mbH – Hamburg",
      "type": "Registerbekanntmachung nach dem Umwandlungsgesetz",
      "state": "Hamburg",
      "amtsgericht": "Amtsgericht Hamburg",
      "registernummer": "HRB 146865",
      "registerart": "HRB",
      "company_name": "EPS Projektentwicklungsgesellschaft mbH",
      "company_seat": "Hamburg",
      "details": "15.08.2025 (Bekanntmachungsdatum)\n\nHamburg Amtsgericht Hamburg HRB 146865\nRegisterbekanntmachung nach dem Umwandlungsgesetz 15.08.2025 (Eintragungsdatum)\n\nEPS Projektentwicklungsgesellschaft mbH\nGesellschaft mit beschränkter Haftung\nHamburg\n\nAls nicht eingetragen wird bekannt gemacht:\nDen Gläubigern der an der Verschmelzung beteiligten Gesellschaften ist, wenn sie binnen sechs Monaten nach dem Tag, an dem die Eintragung der Verschmelzung in das Register des Sitzes desjenigen Rechtsträgers, dessen Gläubiger sie sind, nach § 19 Absatz 3 UmwG als bekannt gemacht gilt, ihren Anspruch nach Grund und Höhe schriftlich anmelden, Sicherheit zu leisten, soweit sie nicht Befriedigung verlangen können. Dieses Recht steht den Gläubigern jedoch nur zu, wenn sie glaubhaft machen, dass durch die Verschmelzung die Erfüllung ihrer Forderung gefährdet wird."
    },
    {
      "date": "2025-08-15",
      "id": "121370",
      "original_text": "Registerbekanntmachung nach dem Umwandlungsgesetz\nSachsen Amtsgericht Chemnitz HRB 9667\nHSB Selbstbausysteme GmbH – Gornsdorf",
      "type": "Registerbekanntmachung nach dem Umwandlungsgesetz",
      "state": "Sachsen",
      "amtsgericht": "Amtsgericht Chemnitz",
      "registernummer": "HRB 9667",
      "registerart": "HRB",
      "company_name": "HSB Selbstbausysteme GmbH",
      "company_seat": "Gornsdorf",
      "details": "15.08.2025 (Bekanntmachungsdatum)\n\nSachsen Amtsgericht Chemnitz HRB 9667\nRegisterbekanntmachung nach dem Umwandlungsgesetz 15.08.2025 (Eintragungsdatum)\n\nHSB Selbstbausysteme GmbH\nGesellschaft mit beschränkter Haftung\nGornsdorf\n\nDen Gläubigern der an der Verschmelzung beteiligten Rechtsträger ist, wenn sie binnen sechs Monaten nach dem Tag, an dem die Eintragung der Verschmelzung in das Register des Sitzes desjenigen Rechtsträgers, dessen Gläubiger sie sind, nach § 19 Abs. 3 UmwG als bekannt gemacht gilt, ihren Anspruch nach Grund und Höhe in Textform anmelden, Sicherheit zu leisten, soweit sie nicht Befriedigung verlangen können. Dieses Recht steht den Gläubigern jedoch nur zu, wenn sie glaubhaft machen, dass durch die Verschmelzung die Erfüllung der Forderung gefährdet wird."
    },
    {
      "date": "2025-08-15",
      "id": "121371",
      "original_text": "Registerbekanntmachung nach dem Umwandlungsgesetz\nSachsen Amtsgericht Dresden HRB 37903\nUKA Umweltgerechte Kraftanlagen Holding GmbH – Meißen",
      "type": "Registerbekanntmachung nach dem Umwandlungsgesetz",
      "state": "Sachsen",
      "amtsgericht": "Amtsgericht Dresden",
      "registernummer": "HRB 37903",
      "registerart": "HRB",
      "company_name": "UKA Umweltgerechte Kraftanlagen Holding GmbH",
      "company_seat": "Meißen",
      "details": "15.08.2025 (Bekanntmachungsdatum)\n\nSachsen Amtsgericht Dresden HRB 37903\nRegisterbekanntmachung nach dem Umwandlungsgesetz 15.08.2025 (Eintragungsdatum)\n\nUKA Umweltgerechte Kraftanlagen Holding GmbH\nGesellschaft mit beschränkter Haftung\nMeißen\n\nDen Gläubigern der an der Verschmelzung beteiligten Rechtsträger ist, wenn sie binnen sechs Monaten nach dem Tag, an dem die Eintragung der Verschmelzung in das Register des Sitzes desjenigen Rechtsträgers, dessen Gläubiger sie sind, nach § 19 Abs. 3 UmwG als bekannt gemacht gilt, ihren Anspruch nach Grund und Höhe in Textform anmelden, Sicherheit zu leisten, soweit sie nicht Befriedigung verlangen können. Dieses Recht steht den Gläubigern jedoch nur zu, wenn sie glaubhaft machen, dass durch die Verschmelzung die Erfüllung der Forderung gefährdet wird."
    },
    {
      "date": "2025-08-15",
      "id": "121372",
      "original_text": "Registerbekanntmachung nach dem Umwandlungsgesetz\nSachsen Amtsgericht Dresden HRB 32505\nWins Media UG (haftungsbeschränkt) – Dresden",
      "type": "Registerbekanntmachung nach dem Umwandlungsgesetz",
      "state": "Sachsen",
      "amtsgericht": "Amtsgericht Dresden",
      "registernummer": "HRB 32505",
      "registerart": "HRB",
      "company_name": "Wins Media UG (haftungsbeschränkt)",
      "company_seat": "Dresden",
      "details": "15.08.2025 (Bekanntmachungsdatum)\n\nSachsen Amtsgericht Dresden HRB 32505\nRegisterbekanntmachung nach dem Umwandlungsgesetz 15.08.2025 (Eintragungsdatum)\n\nWins Media UG (haftungsbeschränkt)\nGesellschaft mit beschränkter Haftung\nDresden\n\nDen Gläubigern der an der Verschmelzung beteiligten Rechtsträger ist, wenn sie binnen sechs Monaten nach dem Tag, an dem die Eintragung der Verschmelzung in das Register des Sitzes desjenigen Rechtsträgers, dessen Gläubiger sie sind, nach § 19 Abs. 3 UmwG als bekannt gemacht gilt, ihren Anspruch nach Grund und Höhe in Textform anmelden, Sicherheit zu leisten, soweit sie nicht Befriedigung verlangen können. Dieses Recht steht den Gläubigern jedoch nur zu, wenn sie glaubhaft machen, dass durch die Verschmelzung die Erfüllung der Forderung gefährdet wird."
    },
    {
      "date": "2025-08-15",
      "id": "121373",
      "original_text": "Registerbekanntmachung nach dem Umwandlungsgesetz\nSachsen Amtsgericht Leipzig HRB 39845\nAd Fontes Musica - Projektgesellschaft mbH – Leipzig",
      "type": "Registerbekanntmachung nach dem Umwandlungsgesetz",
      "state": "Sachsen",
      "amtsgericht": "Amtsgericht Leipzig",
      "registernummer": "HRB 39845",
      "registerart": "HRB",
      "company_name": "Ad Fontes Musica - Projektgesellschaft mbH",
      "company_seat": "Leipzig",
      "details": "15.08.2025 (Bekanntmachungsdatum)\n\nSachsen Amtsgericht Leipzig HRB 39845\nRegisterbekanntmachung nach dem Umwandlungsgesetz 15.08.2025 (Eintragungsdatum)\n\nAd Fontes Musica - Projektgesellschaft mbH\nGesellschaft mit beschränkter Haftung\nLeipzig\n\nDen Gläubigern der an der Verschmelzung beteiligten Rechtsträger ist, wenn sie binnen sechs Monaten nach dem Tag, an dem die Eintragung der Verschmelzung in das Register des Sitzes desjenigen Rechtsträgers, dessen Gläubiger sie sind, nach § 19 Abs. 3 UmwG als bekannt gemacht gilt, ihren Anspruch nach Grund und Höhe in Textform anmelden, Sicherheit zu leisten, soweit sie nicht Befriedigung verlangen können. Dieses Recht steht den Gläubigern jedoch nur zu, wenn sie glaubhaft machen, dass durch die Verschmelzung die Erfüllung der Forderung gefährdet wird."
    },
    {
      "date": "2025-08-15",
      "id": "121374",
      "original_text": "Registerbekanntmachung nach dem Umwandlungsgesetz\nSachsen Amtsgericht Dresden HRB 39017\nUKA-Europa GmbH – Meißen",
      "type": "Registerbekanntmachung nach dem Umwandlungsgesetz",
      "state": "Sachsen",
      "amtsgericht": "Amtsgericht Dresden",
      "registernummer": "HRB 39017",
      "registerart": "HRB",
      "company_name": "UKA-Europa GmbH",
      "company_seat": "Meißen",
      "details": "15.08.2025 (Bekanntmachungsdatum)\n\nSachsen Amtsgericht Dresden HRB 39017\nRegisterbekanntmachung nach dem Umwandlungsgesetz 15.08.2025 (Eintragungsdatum)\n\nUKA-Europa GmbH\nGesellschaft mit beschränkter Haftung\nMeißen\n\nDen Gläubigern der an der Verschmelzung beteiligten Rechtsträger ist, wenn sie binnen sechs Monaten nach dem Tag, an dem die Eintragung der Verschmelzung in das Register des Sitzes desjenigen Rechtsträgers, dessen Gläubiger sie sind, nach § 19 Abs. 3 UmwG als bekannt gemacht gilt, ihren Anspruch nach Grund und Höhe in Textform anmelden, Sicherheit zu leisten, soweit sie nicht Befriedigung verlangen können. Dieses Recht steht den Gläubigern jedoch nur zu, wenn sie glaubhaft machen, dass durch die Verschmelzung die Erfüllung der Forderung gefährdet wird."
    },
    {
      "date": "2025-08-15",
      "id": "121375",
      "original_text": "Löschungsankündigung\nSachsen Amtsgericht Leipzig VR 30824\nLeben mit Tieren e.V. – Delitzsch",
      "type": "Löschungsankündigung",
      "state": "Sachsen",
      "amtsgericht": "Amtsgericht Leipzig",
      "registernummer": "VR 30824",
      "registerart": "VR",
      "company_name": "Leben mit Tieren e.V.",
      "company_seat": "Delitzsch",
      "details": "15.08.2025 (Bekanntmachungsdatum)\n\nSachsen Amtsgericht Leipzig VR 30824\nLöschungsankündigung\n\nLeben mit Tieren e.V.\neingetragener Verein\nDelitzsch\n\nDas Gericht beabsichtigt, gemäß § 4 Absatz 2 Ziffer 1 der Verordnung über das Vereinsregister das Registerblatt  des Vereins zu schließen, da nach Mitteilung des bisherigen Vorstandes sämtliche Mitglieder aus dem Verein ausgeschieden sind. Zur Geltendmachung eines Widerspruchs gegen die beabsichtigte Schließung wird eine Frist von einem Monat nach der Veröffentlichung bestimmt."
    },
    {
      "date": "2025-08-15",
      "id": "121376",
      "original_text": "Registerbekanntmachung nach dem Umwandlungsgesetz\nSachsen Amtsgericht Chemnitz HRB 19762\nB & P GmbH Baumanagement – Oederan",
      "type": "Registerbekanntmachung nach dem Umwandlungsgesetz",
      "state": "Sachsen",
      "amtsgericht": "Amtsgericht Chemnitz",
      "registernummer": "HRB 19762",
      "registerart": "HRB",
      "company_name": "B & P GmbH Baumanagement",
      "company_seat": "Oederan",
      "details": "15.08.2025 (Bekanntmachungsdatum)\n\nSachsen Amtsgericht Chemnitz HRB 19762\nRegisterbekanntmachung nach dem Umwandlungsgesetz 15.08.2025 (Eintragungsdatum)\n\nB & P GmbH Baumanagement\nGesellschaft mit beschränkter Haftung\nOederan\n\nDen Gläubigern der an der Verschmelzung beteiligten Rechtsträger ist, wenn sie binnen sechs Monaten nach dem Tag, an dem die Eintragung der Verschmelzung in das Register des Sitzes desjenigen Rechtsträgers, dessen Gläubiger sie sind, nach § 19 Abs. 3 UmwG als bekannt gemacht gilt, ihren Anspruch nach Grund und Höhe in Textform anmelden, Sicherheit zu leisten, soweit sie nicht Befriedigung verlangen können. Dieses Recht steht den Gläubigern jedoch nur zu, wenn sie glaubhaft machen, dass durch die Verschmelzung die Erfüllung der Forderung gefährdet wird."
    },
    {
      "date": "2025-08-15",
      "id": "121377",
      "original_text": "Registerbekanntmachung nach dem Umwandlungsgesetz\nSachsen Amtsgericht Leipzig HRB 27321\nP&I Premium Immobiliengesellschaft mbH – Leipzig",
      "type": "Registerbekanntmachung nach dem Umwandlungsgesetz",
      "state": "Sachsen",
      "amtsgericht": "Amtsgericht Leipzig",
      "registernummer": "HRB 27321",
      "registerart": "HRB",
      "company_name": "P&I Premium Immobiliengesellschaft mbH",
      "company_seat": "Leipzig",
      "details": "15.08.2025 (Bekanntmachungsdatum)\n\nSachsen Amtsgericht Leipzig HRB 27321\nRegisterbekanntmachung nach dem Umwandlungsgesetz 15.08.2025 (Eintragungsdatum)\n\nP&I Premium Immobiliengesellschaft mbH\nGesellschaft mit beschränkter Haftung\nLeipzig\n\nDen Gläubigern der an der Verschmelzung beteiligten Rechtsträger ist, wenn sie binnen sechs Monaten nach dem Tag, an dem die Eintragung der Verschmelzung in das Register des Sitzes desjenigen Rechtsträgers, dessen Gläubiger sie sind, nach § 19 Abs. 3 UmwG als bekannt gemacht gilt, ihren Anspruch nach Grund und Höhe in Textform anmelden, Sicherheit zu leisten, soweit sie nicht Befriedigung verlangen können. Dieses Recht steht den Gläubigern jedoch nur zu, wenn sie glaubhaft machen, dass durch die Verschmelzung die Erfüllung der Forderung gefährdet wird."
    },
    {
      "date": "2025-08-15",
      "id": "121378",
      "original_text": "Einreichung neuer Dokumente\nNiedersachsen Amtsgericht Osnabrück HRB 214330\nHänsch Beteiligungen GmbH – Herzlake",
      "type": "Einreichung neuer Dokumente",
      "state": "Niedersachsen",
      "amtsgericht": "Amtsgericht Osnabrück",
      "registernummer": "HRB 214330",
      "registerart": "HRB",
      "company_name": "Hänsch Beteiligungen GmbH",
      "company_seat": "Herzlake",
      "details": "15.08.2025 (Bekanntmachungsdatum)\n\nNiedersachsen Amtsgericht Osnabrück HRB 214330\nEinreichung neuer Dokumente\n\nHänsch Beteiligungen GmbH\nGesellschaft mit beschränkter Haftung\nHerzlake\n\nDie Liste der Mitglieder des Aufsichtsrats wurde beim Registergericht eingereicht."
    },
    {
      "date": "2025-08-15",
      "id": "121379",
      "original_text": "Registerbekanntmachung nach dem Umwandlungsgesetz\nNiedersachsen Amtsgericht Osnabrück HRA 209666\npreigu Ansas Meyer e.K. – Osnabrück",
      "type": "Registerbekanntmachung nach dem Umwandlungsgesetz",
      "state": "Niedersachsen",
      "amtsgericht": "Amtsgericht Osnabrück",
      "registernummer": "HRA 209666",
      "registerart": "HRA",
      "company_name": "preigu Ansas Meyer e.K.",
      "company_seat": "Osnabrück",
      "details": "15.08.2025 (Bekanntmachungsdatum)\n\nNiedersachsen Amtsgericht Osnabrück HRA 209666\nRegisterbekanntmachung nach dem Umwandlungsgesetz 15.08.2025 (Eintragungsdatum)\n\npreigu Ansas Meyer e.K.\nEinzelkaufmann / Einzelkauffrau\nOsnabrück\n\nDen Gläubigern der an der Ausgliederung beteiligten Rechtsträger ist, wenn sie binnen sechs Monaten nach dem Tag, an dem die Eintragung der Ausgliederung in das Register des Sitzes desjenigen Rechtsträgers, dessen Gläubiger sie sind, nach § 19 Abs. 3 UmwG als bekannt gemacht gilt, ihren Anspruch nach Grund und Höhe schriftlich anmelden, Sicherheit zu leisten, soweit sie nicht Befriedigung verlangen können. Dieses Recht steht den Gläubigern jedoch nur zu, wenn sie glaubhaft machen, dass durch die Ausgliederung die Erfüllung der Forderung gefährdet wird."
    },
    {
      "date": "2025-08-15",
      "id": "121380",
      "original_text": "Registerbekanntmachung nach dem Umwandlungsgesetz\nNiedersachsen Amtsgericht Hannover HRB 222938\nDaniel Ergezinger Steuerberatungsgesellschaft mbH – Hannover",
      "type": "Registerbekanntmachung nach dem Umwandlungsgesetz",
      "state": "Niedersachsen",
      "amtsgericht": "Amtsgericht Hannover",
      "registernummer": "HRB 222938",
      "registerart": "HRB",
      "company_name": "Daniel Ergezinger Steuerberatungsgesellschaft mbH",
      "company_seat": "Hannover",
      "details": "15.08.2025 (Bekanntmachungsdatum)\n\nNiedersachsen Amtsgericht Hannover HRB 222938\nRegisterbekanntmachung nach dem Umwandlungsgesetz 15.08.2025 (Eintragungsdatum)\n\nDaniel Ergezinger Steuerberatungsgesellschaft mbH\nGesellschaft mit beschränkter Haftung\nHannover\n\nDen Gläubigern der an der Verschmelzung beteiligten Rechtsträger ist, wenn sie binnen sechs Monaten nach dem Tag, an dem die Eintragung der Verschmelzung in das Register des Sitzes desjenigen Rechtsträgers, dessen Gläubiger sie sind, nach § 19  Abs.  3 UmwG als bekannt gemacht gilt, ihren Anspruch nach Grund und Höhe schriftlich anmelden, Sicherheit zu leisten, soweit sie nicht Befriedigung verlangen können. Dieses Recht steht den Gläubigern jedoch nur zu, wenn sie glaubhaft machen, dass durch die Verschmelzung die Erfüllung der Forderung gefährdet wird."
    },
    {
      "date": "2025-08-15",
      "id": "121381",
      "original_text": "Löschungsankündigung\nNiedersachsen Amtsgericht Braunschweig HRB 203454\nM+G Fitness GmbH – Wolfenbüttel",
      "type": "Löschungsankündigung",
      "state": "Niedersachsen",
      "amtsgericht": "Amtsgericht Braunschweig",
      "registernummer": "HRB 203454",
      "registerart": "HRB",
      "company_name": "M+G Fitness GmbH",
      "company_seat": "Wolfenbüttel",
      "details": "15.08.2025 (Bekanntmachungsdatum)\n\nNiedersachsen Amtsgericht Braunschweig HRB 203454\nLöschungsankündigung\n\nM+G Fitness GmbH\nGesellschaft mit beschränkter Haftung\nWolfenbüttel\n\nDas Registergericht beabsichtigt, die Gesellschaft von Amts wegen nach § 394 FamFG zu löschen. Die Frist zur Erhebung eines Widerspruchs ist auf 1 Monat ab dieser Registerbekanntmachung festgesetzt."
    },
    {
      "date": "2025-08-15",
      "id": "121382",
      "original_text": "Registerbekanntmachung nach dem Umwandlungsgesetz\nNiedersachsen Amtsgericht Tostedt GnR 200048\nSoLaWi Superschmelz auf Hof Quellen eG – Wistedt",
      "type": "Registerbekanntmachung nach dem Umwandlungsgesetz",
      "state": "Niedersachsen",
      "amtsgericht": "Amtsgericht Tostedt",
      "registernummer": "GnR 200048",
      "registerart": "GnR",
      "company_name": "SoLaWi Superschmelz auf Hof Quellen eG",
      "company_seat": "Wistedt",
      "details": "15.08.2025 (Bekanntmachungsdatum)\n\nNiedersachsen Amtsgericht Tostedt GnR 200048\nRegisterbekanntmachung nach dem Umwandlungsgesetz 15.08.2025 (Eintragungsdatum)\n\nSoLaWi Superschmelz auf Hof Quellen eG\neingetragene Genossenschaft\nWistedt\n\nDen Gläubigern der an der formwechselnden Umwandlung beteiligten Rechtsträger ist, wenn sie binnen sechs Monaten nach dem Tag, an dem die Eintragung der Umwandlung in das Register des Sitzes desjenigen Rechtsträgers, dessen Gläubiger sie sind, nach § 19 Abs. 3 UmwG als bekannt gemacht gilt, ihren Anspruch nach Grund und Höhe schriftlich anmelden, Sicherheit zu leisten, soweit sie nicht Befriedigung verlangen können. Dieses Recht steht den Gläubigern jedoch nur zu, wenn sie glaubhaft machen, dass durch die formwechselnde Umwandlung die Erfüllung der Forderung gefährdet wird."
    },
    {
      "date": "2025-08-15",
      "id": "121383",
      "original_text": "Registerbekanntmachung nach dem Umwandlungsgesetz\nNiedersachsen Amtsgericht Tostedt VR 201822\nSolawi Superschmelz e.V. – Wistedt",
      "type": "Registerbekanntmachung nach dem Umwandlungsgesetz",
      "state": "Niedersachsen",
      "amtsgericht": "Amtsgericht Tostedt",
      "registernummer": "VR 201822",
      "registerart": "VR",
      "company_name": "Solawi Superschmelz e.V.",
      "company_seat": "Wistedt",
      "details": "15.08.2025 (Bekanntmachungsdatum)\n\nNiedersachsen Amtsgericht Tostedt VR 201822\nRegisterbekanntmachung nach dem Umwandlungsgesetz 15.08.2025 (Eintragungsdatum)\n\nSolawi Superschmelz e.V.\neingetragener Verein\nWistedt\n\nDen Gläubigern der an der formwechselnden Umwandlung beteiligten Rechtsträger ist, wenn sie binnen sechs Monaten nach dem Tag, an dem die Eintragung der Umwandlung in das Register des Sitzes desjenigen Rechtsträgers, dessen Gläubiger sie sind, nach § 19 Abs. 3 UmwG als bekannt gemacht gilt, ihren Anspruch nach Grund und Höhe schriftlich anmelden, Sicherheit zu leisten, soweit sie nicht Befriedigung verlangen können. Dieses Recht steht den Gläubigern jedoch nur zu, wenn sie glaubhaft machen, dass durch die formwechselnde Umwandlung die Erfüllung der Forderung gefährdet wird."
    },
    {
      "date": "2025-08-15",
      "id": "121384",
      "original_text": "Registerbekanntmachung nach dem Umwandlungsgesetz\nNiedersachsen Amtsgericht Osnabrück HRB 206540\nND Handel GmbH – Papenburg",
      "type": "Registerbekanntmachung nach dem Umwandlungsgesetz",
      "state": "Niedersachsen",
      "amtsgericht": "Amtsgericht Osnabrück",
      "registernummer": "HRB 206540",
      "registerart": "HRB",
      "company_name": "ND Handel GmbH",
      "company_seat": "Papenburg",
      "details": "15.08.2025 (Bekanntmachungsdatum)\n\nNiedersachsen Amtsgericht Osnabrück HRB 206540\nRegisterbekanntmachung nach dem Umwandlungsgesetz 15.08.2025 (Eintragungsdatum)\n\nND Handel GmbH\nGesellschaft mit beschränkter Haftung\nPapenburg\n\nDen Gläubigern der an der Verschmelzung beteiligten Rechtsträger ist, wenn sie binnen sechs Monaten nach dem Tag, an dem die Eintragung der Verschmelzung in das Register des Sitzes desjenigen Rechtsträgers, dessen Gläubiger sie sind, nach § 19  Abs.  3 UmwG als bekannt gemacht gilt, ihren Anspruch nach Grund und Höhe schriftlich anmelden, Sicherheit zu leisten, soweit sie nicht Befriedigung verlangen können. Dieses Recht steht den Gläubigern jedoch nur zu, wenn sie glaubhaft machen, dass durch die Verschmelzung die Erfüllung der Forderung gefährdet wird."
    },
    {
      "date": "2025-08-15",
      "id": "121385",
      "original_text": "Registerbekanntmachung nach dem Umwandlungsgesetz\nNiedersachsen Amtsgericht Braunschweig VR 110183\nTurn- und Sportverein Immenrode von 1891 e.V. – Goslar",
      "type": "Registerbekanntmachung nach dem Umwandlungsgesetz",
      "state": "Niedersachsen",
      "amtsgericht": "Amtsgericht Braunschweig",
      "registernummer": "VR 110183",
      "registerart": "VR",
      "company_name": "Turn- und Sportverein Immenrode von 1891 e.V.",
      "company_seat": "Goslar",
      "details": "15.08.2025 (Bekanntmachungsdatum)\n\nNiedersachsen Amtsgericht Braunschweig VR 110183\nRegisterbekanntmachung nach dem Umwandlungsgesetz 15.08.2025 (Eintragungsdatum)\n\nTurn- und Sportverein Immenrode von 1891 e.V.\neingetragener Verein\nGoslar\n\nDen Gläubigern der an der Abspaltung beteiligten Rechtsträger ist, wenn sie binnen sechs Monaten nach dem Tag, an dem die Eintragung der Abspaltung in das Register des Sitzes desjenigen Rechtsträgers, dessen Gläubiger sie sind, nach § 19 Abs. 3 UmwG als bekannt gemacht gilt, ihren Anspruch nach Grund und Höhe schriftlich anmelden, Sicherheit zu leisten, soweit sie nicht Befriedigung verlangen können. Dieses Recht steht den Gläubigern jedoch nur zu, wenn sie glaubhaft machen, dass durch die Abspaltung die Erfüllung der Forderung gefährdet wird."
    },
    {
      "date": "2025-08-15",
      "id": "121386",
      "original_text": "Registerbekanntmachung nach dem Umwandlungsgesetz\nNiedersachsen Amtsgericht Braunschweig VR 202313\nGRILLNINJAS® e. V. – Goslar",
      "type": "Registerbekanntmachung nach dem Umwandlungsgesetz",
      "state": "Niedersachsen",
      "amtsgericht": "Amtsgericht Braunschweig",
      "registernummer": "VR 202313",
      "registerart": "VR",
      "company_name": "GRILLNINJAS® e. V.",
      "company_seat": "Goslar",
      "details": "15.08.2025 (Bekanntmachungsdatum)\n\nNiedersachsen Amtsgericht Braunschweig VR 202313\nRegisterbekanntmachung nach dem Umwandlungsgesetz 15.08.2025 (Eintragungsdatum)\n\nGRILLNINJAS® e. V.\neingetragener Verein\nGoslar\n\nDen Gläubigern der an der Abspaltung beteiligten Rechtsträger ist, wenn sie binnen sechs Monaten nach dem Tag, an dem die Eintragung der Abspaltung in das Register des Sitzes desjenigen Rechtsträgers, dessen Gläubiger sie sind, nach § 19 Abs. 3 UmwG als bekannt gemacht gilt, ihren Anspruch nach Grund und Höhe schriftlich anmelden, Sicherheit zu leisten, soweit sie nicht Befriedigung verlangen können. Dieses Recht steht den Gläubigern jedoch nur zu, wenn sie glaubhaft machen, dass durch die Abspaltung die Erfüllung der Forderung gefährdet wird."
    },
    {
      "date": "2025-08-15",
      "id": "121387",
      "original_text": "Löschungsankündigung\nBremen Amtsgericht Bremen HRB 34871\nEthicaps GmbH – Bremen",
      "type": "Löschungsankündigung",
      "state": "Bremen",
      "amtsgericht": "Amtsgericht Bremen",
      "registernummer": "HRB 34871",
      "registerart": "HRB",
      "company_name": "Ethicaps GmbH",
      "company_seat": "Bremen",
      "details": "15.08.2025 (Bekanntmachungsdatum)\n\nBremen Amtsgericht Bremen HRB 34871\nLöschungsankündigung\n\nEthicaps GmbH\nGesellschaft mit beschränkter Haftung\nBremen\n\nEs ist beabsichtigt die im Handelsregister eingetragene Gesellschaft von Amts wegen gemäß § 394 FamFG zu löschen. Gegen die Löschung kann beim AG Bremen schriftlich oder zu Protokoll der Geschäftsstelle Widerspruch eingelegt werden. Widerspruchsfrist 4 Wochen."
    },
    {
      "date": "2025-08-15",
      "id": "121388",
      "original_text": "Löschungsankündigung\nRheinland-Pfalz Amtsgericht Montabaur HRB 29253\nURAL Bau GmbH – Rennerod",
      "type": "Löschungsankündigung",
      "state": "Rheinland-Pfalz",
      "amtsgericht": "Amtsgericht Montabaur",
      "registernummer": "HRB 29253",
      "registerart": "HRB",
      "company_name": "URAL Bau GmbH",
      "company_seat": "Rennerod",
      "details": "15.08.2025 (Bekanntmachungsdatum)\n\nRheinland-Pfalz Amtsgericht Montabaur HRB 29253\nLöschungsankündigung\n\nURAL Bau GmbH\nGesellschaft mit beschränkter Haftung\nRennerod\n\nDas Registergericht beabsichtigt die Gesellschaft von Amts wegen nach § 394 FamFG zu löschen. Die Frist zur Erhebung eines Widerspruchs ist auf einen Monat festgesetzt."
    },
    {
      "date": "2025-08-15",
      "id": "121389",
      "original_text": "Registerbekanntmachung nach dem Umwandlungsgesetz\nRheinland-Pfalz Amtsgericht Mainz HRB 48522\nChemservice Beteiligungs GmbH – Worms",
      "type": "Registerbekanntmachung nach dem Umwandlungsgesetz",
      "state": "Rheinland-Pfalz",
      "amtsgericht": "Amtsgericht Mainz",
      "registernummer": "HRB 48522",
      "registerart": "HRB",
      "company_name": "Chemservice Beteiligungs GmbH",
      "company_seat": "Worms",
      "details": "15.08.2025 (Bekanntmachungsdatum)\n\nRheinland-Pfalz Amtsgericht Mainz HRB 48522\nRegisterbekanntmachung nach dem Umwandlungsgesetz 15.08.2025 (Eintragungsdatum)\n\nChemservice Beteiligungs GmbH\nGesellschaft mit beschränkter Haftung\nWorms\n\nDen Gläubigern der an der Verschmelzung beteiligten Rechtsträger ist, wenn sie binnen sechs Monaten nach dem Tag, an dem die Eintragung der Verschmelzung in das Register des Sitzes desjenigen Rechtsträgers, dessen Gläubiger sie sind, nach § 19 Abs. 3 UmwG als bekannt gemacht gilt, ihren Anspruch nach Grund und Höhe schriftlich anmelden, Sicherheit zu leisten, soweit sie nicht Befriedigung verlangen können. Dieses Recht steht den Gläubigern jedoch nur zu, wenn sie glaubhaft machen, dass durch die Verschmelzung die Erfüllung ihrer Forderung gefährdet wird."
    },
    {
      "date": "2025-08-15",
      "id": "121390",
      "original_text": "Löschungsankündigung\nRheinland-Pfalz Amtsgericht Montabaur HRB 28323\nKalypso GmbH – Neuwied",
      "type": "Löschungsankündigung",
      "state": "Rheinland-Pfalz",
      "amtsgericht": "Amtsgericht Montabaur",
      "registernummer": "HRB 28323",
      "registerart": "HRB",
      "company_name": "Kalypso GmbH",
      "company_seat": "Neuwied",
      "details": "15.08.2025 (Bekanntmachungsdatum)\n\nRheinland-Pfalz Amtsgericht Montabaur HRB 28323\nLöschungsankündigung\n\nKalypso GmbH\nGesellschaft mit beschränkter Haftung\nNeuwied\n\nDas Registergericht beabsichtigt die Gesellschaft von Amts wegen nach § 394 FamFG zu löschen. Die Frist zur Erhebung eines Widerspruchs ist auf einen Monat festgesetzt."
    },
    {
      "date": "2025-08-15",
      "id": "121391",
      "original_text": "Löschungsankündigung\nRheinland-Pfalz Amtsgericht Ludwigshafen a.Rhein (Ludwigshafen) HRB 66732\nDa Hero UG (haftungsbeschränkt) – Ludwigshafen am Rhein",
      "type": "Löschungsankündigung",
      "state": "Rheinland-Pfalz",
      "amtsgericht": "Amtsgericht Ludwigshafen a.Rhein (Ludwigshafen)",
      "registernummer": "HRB 66732",
      "registerart": "HRB",
      "company_name": "Da Hero UG (haftungsbeschränkt)",
      "company_seat": "Ludwigshafen am Rhein",
      "details": "15.08.2025 (Bekanntmachungsdatum)\n\nRheinland-Pfalz Amtsgericht Ludwigshafen a.Rhein (Ludwigshafen) HRB 66732\nLöschungsankündigung\n\nDa Hero UG (haftungsbeschränkt)\nGesellschaft mit beschränkter Haftung\nLudwigshafen am Rhein\n\nDas Registergericht beabsichtigt die Gesellschaft von Amts wegen nach § 394 FamFG zu löschen. Die Frist zur Erhebung eines Widerspruchs ist auf einen Monat festgesetzt."
    },
    {
      "date": "2025-08-15",
      "id": "121392",
      "original_text": "Löschungsankündigung\nRheinland-Pfalz Amtsgericht Zweibrücken HRB 21420\nSiema Industrieklebstoffe GmbH – Pirmasens",
      "type": "Löschungsankündigung",
      "state": "Rheinland-Pfalz",
      "amtsgericht": "Amtsgericht Zweibrücken",
      "registernummer": "HRB 21420",
      "registerart": "HRB",
      "company_name": "Siema Industrieklebstoffe GmbH",
      "company_seat": "Pirmasens",
      "details": "15.08.2025 (Bekanntmachungsdatum)\n\nRheinland-Pfalz Amtsgericht Zweibrücken HRB 21420\nLöschungsankündigung\n\nSiema Industrieklebstoffe GmbH\nGesellschaft mit beschränkter Haftung\nPirmasens\n\nDas Registergericht beabsichtigt die Gesellschaft von Amts wegen nach § 394 FamFG zu löschen. Die Frist zur Erhebung eines Widerspruchs ist auf einen Monat festgesetzt."
    },
    {
      "date": "2025-08-15",
      "id": "121393",
      "original_text": "Registerbekanntmachung nach dem Umwandlungsgesetz\nRheinland-Pfalz Amtsgericht Mainz HRB 53940\nRanoTec GmbH – Eppelsheim",
      "type": "Registerbekanntmachung nach dem Umwandlungsgesetz",
      "state": "Rheinland-Pfalz",
      "amtsgericht": "Amtsgericht Mainz",
      "registernummer": "HRB 53940",
      "registerart": "HRB",
      "company_name": "RanoTec GmbH",
      "company_seat": "Eppelsheim",
      "details": "15.08.2025 (Bekanntmachungsdatum)\n\nRheinland-Pfalz Amtsgericht Mainz HRB 53940\nRegisterbekanntmachung nach dem Umwandlungsgesetz 15.08.2025 (Eintragungsdatum)\n\nRanoTec GmbH\nGesellschaft mit beschränkter Haftung\nEppelsheim\n\nAls nicht eingetragen wird veröffentlicht:\nDen Gläubigern der an der Ausgliederung beteiligten Rechtsträger ist, wenn sie binnen sechs Monaten nach dem Tag, an dem die Eintragung der Ausgliederung in das Register des Sitzes desjenigen Rechtsträgers, dessen Gläubiger sie sind, nach § 19 Abs. 3 UmwG als bekannt gemacht gilt, ihren Anspruch nach Grund und Höhe schriftlich anmelden, Sicherheit zu leisten, soweit sie nicht Befriedigung verlangen können. Dieses Recht steht den Gläubigern jedoch nur zu, wenn sie glaubhaft machen, dass durch die Ausgliederung die Erfüllung der Forderung gefährdet wird.\"|"
    },
    {
      "date": "2025-08-15",
      "id": "121394",
      "original_text": "Sonstige Registerbekanntmachung\nRheinland-Pfalz Amtsgericht Mainz HRB 50396\nDeutsches Rotes Kreuz Medizinische Dienste Mainz-Bingen gGmbH – Mainz",
      "type": "Sonstige Registerbekanntmachung",
      "state": "Rheinland-Pfalz",
      "amtsgericht": "Amtsgericht Mainz",
      "registernummer": "HRB 50396",
      "registerart": "HRB",
      "company_name": "Deutsches Rotes Kreuz Medizinische Dienste Mainz-Bingen gGmbH",
      "company_seat": "Mainz",
      "details": "15.08.2025 (Bekanntmachungsdatum)\n\nRheinland-Pfalz Amtsgericht Mainz HRB 50396\nSonstige Registerbekanntmachung\n\nDeutsches Rotes Kreuz Medizinische Dienste Mainz-Bingen gGmbH\nGesellschaft mit beschränkter Haftung\nMainz\n\nDem Registergericht ist eine neue Liste der Mitglieder des Aufsichtsrates eingereicht worden."
    },
    {
      "date": "2025-08-15",
      "id": "121395",
      "original_text": "Registerbekanntmachung nach dem Umwandlungsgesetz\nRheinland-Pfalz Amtsgericht Mainz HRA 44197\nRanoTec Inhaber Matthias Jung e.K. – Eppelsheim",
      "type": "Registerbekanntmachung nach dem Umwandlungsgesetz",
      "state": "Rheinland-Pfalz",
      "amtsgericht": "Amtsgericht Mainz",
      "registernummer": "HRA 44197",
      "registerart": "HRA",
      "company_name": "RanoTec Inhaber Matthias Jung e.K.",
      "company_seat": "Eppelsheim",
      "details": "15.08.2025 (Bekanntmachungsdatum)\n\nRheinland-Pfalz Amtsgericht Mainz HRA 44197\nRegisterbekanntmachung nach dem Umwandlungsgesetz 15.08.2025 (Eintragungsdatum)\n\nRanoTec Inhaber Matthias Jung e.K.\nEinzelkaufmann / Einzelkauffrau\nEppelsheim\n\nAls nicht eingetragen wird veröffentlicht:\nDen Gläubigern der an der Ausgliederung beteiligten Rechtsträger ist, wenn sie binnen sechs Monaten nach dem Tag, an dem die Eintragung der Ausgliederung in das Register des Sitzes desjenigen Rechtsträgers, dessen Gläubiger sie sind, nach § 19 Abs. 3 UmwG als bekannt gemacht gilt, ihren Anspruch nach Grund und Höhe schriftlich anmelden, Sicherheit zu leisten, soweit sie nicht Befriedigung verlangen können. Dieses Recht steht den Gläubigern jedoch nur zu, wenn sie glaubhaft machen, dass durch die Ausgliederung die Erfüllung der Forderung gefährdet wird."
    },
    {
      "date": "2025-08-15",
      "id": "121396",
      "original_text": "Registerbekanntmachung nach dem Umwandlungsgesetz\nRheinland-Pfalz Amtsgericht Landau HRB 33888\nDeleon GmbH – Wörth am Rhein",
      "type": "Registerbekanntmachung nach dem Umwandlungsgesetz",
      "state": "Rheinland-Pfalz",
      "amtsgericht": "Amtsgericht Landau",
      "registernummer": "HRB 33888",
      "registerart": "HRB",
      "company_name": "Deleon GmbH",
      "company_seat": "Wörth am Rhein",
      "details": "15.08.2025 (Bekanntmachungsdatum)\n\nRheinland-Pfalz Amtsgericht Landau HRB 33888\nRegisterbekanntmachung nach dem Umwandlungsgesetz 15.08.2025 (Eintragungsdatum)\n\nDeleon GmbH\nGesellschaft mit beschränkter Haftung\nWörth am Rhein\n\nAls nicht eingetragen wird veröffentlicht: Den Gläubigern der an der Verschmelzung beteiligten Rechtsträger ist, wenn sie binnen sechs Monaten nach dem Tag, an dem die Eintragung der Verschmelzung in das Register des Sitzes desjenigen Rechtsträgers,dessen Gläubiger sie sind, nach § 19 Abs. 3 UmwG als bekannt gemacht gilt, ihren Anspruch nach Grund und Höhe schriftlich anmelden, Sicherheit zu leisten, soweit sie nicht Befriedigung verlangen können. Dieses Recht steht den Gläubigern jedoch nur zu, wenn sie glaubhaft machen, dass durch die Verschmelzung die Erfüllung der Forderung gefährdet wird."
    },
    {
      "date": "2025-08-15",
      "id": "121397",
      "original_text": "Registerbekanntmachung nach dem Umwandlungsgesetz\nRheinland-Pfalz Amtsgericht Montabaur HRB 28930\nUwe Fahl Verwaltungs GmbH – Gebhardshain",
      "type": "Registerbekanntmachung nach dem Umwandlungsgesetz",
      "state": "Rheinland-Pfalz",
      "amtsgericht": "Amtsgericht Montabaur",
      "registernummer": "HRB 28930",
      "registerart": "HRB",
      "company_name": "Uwe Fahl Verwaltungs GmbH",
      "company_seat": "Gebhardshain",
      "details": "15.08.2025 (Bekanntmachungsdatum)\n\nRheinland-Pfalz Amtsgericht Montabaur HRB 28930\nRegisterbekanntmachung nach dem Umwandlungsgesetz 15.08.2025 (Eintragungsdatum)\n\nUwe Fahl Verwaltungs GmbH\nGesellschaft mit beschränkter Haftung\nGebhardshain\n\nAls nicht eingetragen wird veröffentlicht: Den Gläubigern der an der Verschmelzung beteiligten Rechtsträger ist, wenn sie binnen sechs Monaten nach dem Tag, an dem die Eintragung der Verschmelzung in das Register des Sitzes desjenigen Rechtsträgers, dessen Gläubiger sie sind, nach § 19 Abs. 3 UmwG als bekannt gemacht gilt, ihren Anspruch nach Grund und Höhe schriftlich anmelden, Sicherheit zu leisten, soweit sie nicht Befriedigung verlangen können. Dieses Recht steht den Gläubigern jedoch nur zu, wenn sie glaubhaft machen, dass durch die Verschmelzung die Erfüllung der Forderung gefährdet wird."
    },
    {
      "date": "2025-08-15",
      "id": "121398",
      "original_text": "Registerbekanntmachung nach dem Umwandlungsgesetz\nNordrhein-Westfalen Amtsgericht Duisburg HRB 14177\nRhenus Rail Logistics GmbH – Duisburg",
      "type": "Registerbekanntmachung nach dem Umwandlungsgesetz",
      "state": "Nordrhein-Westfalen",
      "amtsgericht": "Amtsgericht Duisburg",
      "registernummer": "HRB 14177",
      "registerart": "HRB",
      "company_name": "Rhenus Rail Logistics GmbH",
      "company_seat": "Duisburg",
      "details": "15.08.2025 (Bekanntmachungsdatum)\n\nNordrhein-Westfalen Amtsgericht Duisburg HRB 14177\nRegisterbekanntmachung nach dem Umwandlungsgesetz 15.08.2025 (Eintragungsdatum)\n\nRhenus Rail Logistics GmbH\nGesellschaft mit beschränkter Haftung\nDuisburg\n\nDie Gesellschaft hat Gläubigern, deren Forderungen vor dieser Bekanntmachung begründet worden sind, Sicherheit zu leisten, soweit sie nicht Befriedigung verlangen können, wenn sie sich binnen sechs Monaten zu diesem Zweck melden."
    },
    {
      "date": "2025-08-15",
      "id": "121399",
      "original_text": "Einreichung neuer Dokumente\nNordrhein-Westfalen Amtsgericht Hagen HRB 3187\nWohnstätten Immobilien GmbH – Hagen",
      "type": "Einreichung neuer Dokumente",
      "state": "Nordrhein-Westfalen",
      "amtsgericht": "Amtsgericht Hagen",
      "registernummer": "HRB 3187",
      "registerart": "HRB",
      "company_name": "Wohnstätten Immobilien GmbH",
      "company_seat": "Hagen",
      "details": "15.08.2025 (Bekanntmachungsdatum)\n\nNordrhein-Westfalen Amtsgericht Hagen HRB 3187\nEinreichung neuer Dokumente\n\nWohnstätten Immobilien GmbH\nGesellschaft mit beschränkter Haftung\nHagen\n\nDie gesetzlichen Vertreter der Gesellschaft haben eine aktuelle Liste der Aufsichtsratsmitglieder zum Handelsregister eingereicht."
    },
    {
      "date": "2025-08-15",
      "id": "121400",
      "original_text": "Registerbekanntmachung nach dem Umwandlungsgesetz\nNordrhein-Westfalen Amtsgericht Bad Oeynhausen HRB 5918\nWildförster Formteile GmbH – Hiddenhausen",
      "type": "Registerbekanntmachung nach dem Umwandlungsgesetz",
      "state": "Nordrhein-Westfalen",
      "amtsgericht": "Amtsgericht Bad Oeynhausen",
      "registernummer": "HRB 5918",
      "registerart": "HRB",
      "company_name": "Wildförster Formteile GmbH",
      "company_seat": "Hiddenhausen",
      "details": "15.08.2025 (Bekanntmachungsdatum)\n\nNordrhein-Westfalen Amtsgericht Bad Oeynhausen HRB 5918\nRegisterbekanntmachung nach dem Umwandlungsgesetz 15.08.2025 (Eintragungsdatum)\n\nWildförster Formteile GmbH\nGesellschaft mit beschränkter Haftung\nHiddenhausen\n\nDen Gläubigern der an der Verschmelzung beteiligten Rechtsträger ist, wenn sie binnen sechs Monaten nach dem Tag, an dem die Eintragung der Verschmelzung in das Register des Sitzes derjenigen Rechtsträger deren Gläubiger sie sind, nach § 19 Absatz 3 UmwG als bekanntgemacht gilt, ihren Anspruch nach Grund und Höhe schriftlich anmelden, Sicherheit zu leisten, soweit sie nicht Befriedigung verlangen können. Dieses Recht steht den Gläubigern jedoch nur zu, wenn sie glaubhaft machen, dass durch die Verschmelzung die Erfüllung ihrer Forderung gefährdet wird."
    },
    {
      "date": "2025-08-15",
      "id": "121401",
      "original_text": "Einreichung neuer Dokumente\nNordrhein-Westfalen Amtsgericht Hagen HRB 3757\nWohnstätten Betreuungs- und Verwaltungs-GmbH – Hagen",
      "type": "Einreichung neuer Dokumente",
      "state": "Nordrhein-Westfalen",
      "amtsgericht": "Amtsgericht Hagen",
      "registernummer": "HRB 3757",
      "registerart": "HRB",
      "company_name": "Wohnstätten Betreuungs- und Verwaltungs-GmbH",
      "company_seat": "Hagen",
      "details": "15.08.2025 (Bekanntmachungsdatum)\n\nNordrhein-Westfalen Amtsgericht Hagen HRB 3757\nEinreichung neuer Dokumente\n\nWohnstätten Betreuungs- und Verwaltungs-GmbH\nGesellschaft mit beschränkter Haftung\nHagen\n\nDie gesetzlichen Vertreter der Gesellschaft haben eine aktuelle Liste der Aufsichtsratsmitglieder zum Handelsregister eingereicht."
    },
    {
      "date": "2025-08-15",
      "id": "121402",
      "original_text": "Registerbekanntmachung nach dem Umwandlungsgesetz\nNordrhein-Westfalen Amtsgericht Wuppertal HRA 25245\nsicdata Unternehmensberatung Tobias Erdmann e.K. – Solingen",
      "type": "Registerbekanntmachung nach dem Umwandlungsgesetz",
      "state": "Nordrhein-Westfalen",
      "amtsgericht": "Amtsgericht Wuppertal",
      "registernummer": "HRA 25245",
      "registerart": "HRA",
      "company_name": "sicdata Unternehmensberatung Tobias Erdmann e.K.",
      "company_seat": "Solingen",
      "details": "15.08.2025 (Bekanntmachungsdatum)\n\nNordrhein-Westfalen Amtsgericht Wuppertal HRA 25245\nRegisterbekanntmachung nach dem Umwandlungsgesetz 15.08.2025 (Eintragungsdatum)\n\nsicdata Unternehmensberatung Tobias Erdmann e.K.\nEinzelkaufmann / Einzelkauffrau\nSolingen\n\nDen Gläubigern der an der Ausgliederung beteiligten Rechtsträger ist, wenn sie binnen sechs Monaten nach dem Tag, an dem die Eintragung der Ausgliederung in das Register des Sitzes derjenigen Rechtsträger deren Gläubiger sie sind, nach § 19 Absatz 3 UmwG als bekanntgemacht gilt, ihren Anspruch nach Grund und Höhe schriftlich anmelden, Sicherheit zu leisten, soweit sie nicht Befriedigung verlangen können. Dieses Recht steht den Gläubigern jedoch nur zu, wenn sie glaubhaft machen, dass durch die Ausgliederung die Erfüllung ihrer Forderung gefährdet wird."
    },
    {
      "date": "2025-08-15",
      "id": "121403",
      "original_text": "Löschungsankündigung\nNordrhein-Westfalen Amtsgericht Bochum HRB 19559\nLIVCO BAU GmbH – Herne",
      "type": "Löschungsankündigung",
      "state": "Nordrhein-Westfalen",
      "amtsgericht": "Amtsgericht Bochum",
      "registernummer": "HRB 19559",
      "registerart": "HRB",
      "company_name": "LIVCO BAU GmbH",
      "company_seat": "Herne",
      "details": "15.08.2025 (Bekanntmachungsdatum)\n\nNordrhein-Westfalen Amtsgericht Bochum HRB 19559\nLöschungsankündigung 15.08.2025 (Eintragungsdatum)\n\nLIVCO BAU GmbH\nGesellschaft mit beschränkter Haftung\nHerne\n\nDas Registergericht beabsichtigt die Gesellschaft von Amts wegen nach § 394 FamFG zu löschen. Die Frist zur Erhebung eines Widerspruchs ist auf drei Monate festgesetzt."
    },
    {
      "date": "2025-08-15",
      "id": "121404",
      "original_text": "Registerbekanntmachung nach dem Umwandlungsgesetz\nNordrhein-Westfalen Amtsgericht Bad Oeynhausen HRB 5570\nKLW Handelsgesellschaft GmbH – Hiddenhausen",
      "type": "Registerbekanntmachung nach dem Umwandlungsgesetz",
      "state": "Nordrhein-Westfalen",
      "amtsgericht": "Amtsgericht Bad Oeynhausen",
      "registernummer": "HRB 5570",
      "registerart": "HRB",
      "company_name": "KLW Handelsgesellschaft GmbH",
      "company_seat": "Hiddenhausen",
      "details": "15.08.2025 (Bekanntmachungsdatum)\n\nNordrhein-Westfalen Amtsgericht Bad Oeynhausen HRB 5570\nRegisterbekanntmachung nach dem Umwandlungsgesetz 15.08.2025 (Eintragungsdatum)\n\nKLW Handelsgesellschaft GmbH\nGesellschaft mit beschränkter Haftung\nHiddenhausen\n\nDen Gläubigern der an der Verschmelzung beteiligten Rechtsträger ist, wenn sie binnen sechs Monaten nach dem Tag, an dem die Eintragung der Verschmelzung in das Register des Sitzes derjenigen Rechtsträger deren Gläubiger sie sind, nach § 19 Absatz 3 UmwG als bekanntgemacht gilt, ihren Anspruch nach Grund und Höhe schriftlich anmelden, Sicherheit zu leisten, soweit sie nicht Befriedigung verlangen können. Dieses Recht steht den Gläubigern jedoch nur zu, wenn sie glaubhaft machen, dass durch die Verschmelzung die Erfüllung ihrer Forderung gefährdet wird."
    },
    {
      "date": "2025-08-15",
      "id": "121405",
      "original_text": "Registerbekanntmachung nach dem Umwandlungsgesetz\nNordrhein-Westfalen Amtsgericht Essen HRB 31536\nTransfer FÜNF GmbH – Essen",
      "type": "Registerbekanntmachung nach dem Umwandlungsgesetz",
      "state": "Nordrhein-Westfalen",
      "amtsgericht": "Amtsgericht Essen",
      "registernummer": "HRB 31536",
      "registerart": "HRB",
      "company_name": "Transfer FÜNF GmbH",
      "company_seat": "Essen",
      "details": "15.08.2025 (Bekanntmachungsdatum)\n\nNordrhein-Westfalen Amtsgericht Essen HRB 31536\nRegisterbekanntmachung nach dem Umwandlungsgesetz 15.08.2025 (Eintragungsdatum)\n\nTransfer FÜNF GmbH\nGesellschaft mit beschränkter Haftung\nEssen\n\nDen Gläubigern der an der Verschmelzung beteiligten Rechtsträger ist, wenn sie binnen sechs Monaten nach dem Tag, an dem die Eintragung der Verschmelzung in das Register des Sitzes desjenigen Rechtsträgers, dessen Gläubiger sie sind, nach § 19 Absatz 3 UmwG als bekanntgemacht gilt, ihren Anspruch nach Grund und Höhe schriftlich anmelden, Sicherheit zu leisten, soweit sie nicht Befriedigung verlangen können. Dieses Recht steht den Gläubigern jedoch nur zu, wenn sie glaubhaft machen, dass durch die Verschmelzung die Erfüllung ihrer Forderung gefährdet wird."
    },
    {
      "date": "2025-08-15",
      "id": "121406",
      "original_text": "Löschungsankündigung\nNordrhein-Westfalen Amtsgericht Bochum HRB 8795 früher Amtsgericht Witten\nElektro-Vaupel GmbH – Witten",
      "type": "Löschungsankündigung",
      "state": "Nordrhein-Westfalen",
      "amtsgericht": "Amtsgericht Bochum",
      "registernummer": "HRB 8795",
      "registerart": "HRB",
      "company_name": "Elektro-Vaupel GmbH",
      "company_seat": "Witten",
      "former_amtsgericht": "Witten",
      "details": "15.08.2025 (Bekanntmachungsdatum)\n\nNordrhein-Westfalen Amtsgericht Bochum HRB 8795 früher Amtsgericht Witten\nLöschungsankündigung 15.08.2025 (Eintragungsdatum)\n\nElektro-Vaupel GmbH\nGesellschaft mit beschränkter Haftung\nWitten\n\nDas Registergericht beabsichtigt die Gesellschaft von Amts wegen nach § 394 FamFG zu löschen. Die Frist zur Erhebung eines Widerspruchs ist auf drei Monate festgesetzt."
    },
    {
      "date": "2025-08-15",
      "id": "121407",
      "original_text": "Einreichung neuer Dokumente\nNordrhein-Westfalen Amtsgericht Aachen HRB 24167\nCSB-System SE – Geilenkirchen",
      "type": "Einreichung neuer Dokumente",
      "state": "Nordrhein-Westfalen",
      "amtsgericht": "Amtsgericht Aachen",
      "registernummer": "HRB 24167",
      "registerart": "HRB",
      "company_name": "CSB-System SE",
      "company_seat": "Geilenkirchen",
      "details": "15.08.2025 (Bekanntmachungsdatum)\n\nNordrhein-Westfalen Amtsgericht Aachen HRB 24167\nEinreichung neuer Dokumente\n\nCSB-System SE\nEuropäische Aktiengesellschaft (SE)\nGeilenkirchen\n\nDem Registergericht ist eine Liste der Mitglieder des Aufsichtsrates eingereicht worden."
    },
    {
      "date": "2025-08-15",
      "id": "121408",
      "original_text": "Löschungsankündigung\nNordrhein-Westfalen Amtsgericht Mönchengladbach HRB 19083\nD. K. GmbH – Mönchengladbach",
      "type": "Löschungsankündigung",
      "state": "Nordrhein-Westfalen",
      "amtsgericht": "Amtsgericht Mönchengladbach",
      "registernummer": "HRB 19083",
      "registerart": "HRB",
      "company_name": "D. K. GmbH",
      "company_seat": "Mönchengladbach",
      "details": "15.08.2025 (Bekanntmachungsdatum)\n\nNordrhein-Westfalen Amtsgericht Mönchengladbach HRB 19083\nLöschungsankündigung\n\nD. K. GmbH\nGesellschaft mit beschränkter Haftung\nMönchengladbach\n\nDas Registergericht beabsichtigt, die im Handelsregister eingetragene Gesellschaft gemäß § 394 Absatz 1 FamFG wegen Vermögenslosigkeit von Amts wegen zu löschen. Gegen diese Verfügung kann Widerspruch eingelegt werden. Die Frist zur Erhebung eines Widerspruchs gegen die beabsichtigte Löschung von Amts wegen ist auf drei Monate festgesetzt."
    },
    {
      "date": "2025-08-15",
      "id": "121409",
      "original_text": "Einreichung neuer Dokumente\nNordrhein-Westfalen Amtsgericht Dortmund HRB 25925\nAmazon Logistik Werne GmbH – Werne",
      "type": "Einreichung neuer Dokumente",
      "state": "Nordrhein-Westfalen",
      "amtsgericht": "Amtsgericht Dortmund",
      "registernummer": "HRB 25925",
      "registerart": "HRB",
      "company_name": "Amazon Logistik Werne GmbH",
      "company_seat": "Werne",
      "details": "15.08.2025 (Bekanntmachungsdatum)\n\nNordrhein-Westfalen Amtsgericht Dortmund HRB 25925\nEinreichung neuer Dokumente\n\nAmazon Logistik Werne GmbH\nGesellschaft mit beschränkter Haftung\nWerne\n\nDem Registergericht ist eine neue Liste der Mitglieder des Aufsichtsrates eingereicht worden."
    },
    {
      "date": "2025-08-15",
      "id": "121410",
      "original_text": "Registerbekanntmachung nach dem Umwandlungsgesetz\nNordrhein-Westfalen Amtsgericht Arnsberg HRA 9300\nWhite Horse Theatre e. K. – Soest",
      "type": "Registerbekanntmachung nach dem Umwandlungsgesetz",
      "state": "Nordrhein-Westfalen",
      "amtsgericht": "Amtsgericht Arnsberg",
      "registernummer": "HRA 9300",
      "registerart": "HRA",
      "company_name": "White Horse Theatre e. K.",
      "company_seat": "Soest",
      "details": "15.08.2025 (Bekanntmachungsdatum)\n\nNordrhein-Westfalen Amtsgericht Arnsberg HRA 9300\nRegisterbekanntmachung nach dem Umwandlungsgesetz 15.08.2025 (Eintragungsdatum)\n\nWhite Horse Theatre e. K.\nEinzelkaufmann / Einzelkauffrau\nSoest\n\nDen Gläubigern der an der Ausgliederung beteiligten Rechtsträger ist, wenn sie binnen sechs Monaten nach dem Tag, an dem die Eintragung der Ausgliederung in das Register des Sitzes desjenigen Rechtsträgers, dessen Gläubiger sie sind, nach § 19 Absatz 3 UmwG als bekanntgemacht gilt, ihren Anspruch nach Grund und Höhe schriftlich anmelden, Sicherheit zu leisten, soweit sie nicht Befriedigung verlangen können. Dieses Recht steht den Gläubigern jedoch nur zu, wenn sie glaubhaft machen, dass durch die Ausgliederung die Erfüllung ihrer Forderung gefährdet wird."
    },
    {
      "date": "2025-08-15",
      "id": "121411",
      "original_text": "Registerbekanntmachung nach dem Umwandlungsgesetz\nNordrhein-Westfalen Amtsgericht Düsseldorf HRB 17720\nCity Anzeigenblatt GmbH – Düsseldorf",
      "type": "Registerbekanntmachung nach dem Umwandlungsgesetz",
      "state": "Nordrhein-Westfalen",
      "amtsgericht": "Amtsgericht Düsseldorf",
      "registernummer": "HRB 17720",
      "registerart": "HRB",
      "company_name": "City Anzeigenblatt GmbH",
      "company_seat": "Düsseldorf",
      "details": "15.08.2025 (Bekanntmachungsdatum)\n\nNordrhein-Westfalen Amtsgericht Düsseldorf HRB 17720\nRegisterbekanntmachung nach dem Umwandlungsgesetz 15.08.2025 (Eintragungsdatum)\n\nCity Anzeigenblatt GmbH\nGesellschaft mit beschränkter Haftung\nDüsseldorf\n\nDen Gläubigern der an der Verschmelzung beteiligten Rechtsträger ist, wenn sie binnen sechs Monaten nach dem Tag, an dem die Eintragung der Verschmelzung in das Register des Sitzes desjenigen Rechtsträgers, dessen Gläubiger sie sind, nach § 19 Absatz 3 UmwG als bekanntgemacht gilt, ihren Anspruch nach Grund und Höhe schriftlich anmelden, Sicherheit zu leisten, soweit sie nicht Befriedigung verlangen können. Dieses Recht steht den Gläubigern jedoch nur zu, wenn sie glaubhaft machen, dass durch die Verschmelzung die Erfüllung ihrer Forderung gefährdet wird."
    },
    {
      "date": "2025-08-15",
      "id": "121412",
      "original_text": "Registerbekanntmachung nach dem Umwandlungsgesetz\nNordrhein-Westfalen Amtsgericht Köln HRB 121164\nEST Germany GmbH – Köln",
      "type": "Registerbekanntmachung nach dem Umwandlungsgesetz",
      "state": "Nordrhein-Westfalen",
      "amtsgericht": "Amtsgericht Köln",
      "registernummer": "HRB 121164",
      "registerart": "HRB",
      "company_name": "EST Germany GmbH",
      "company_seat": "Köln",
      "details": "15.08.2025 (Bekanntmachungsdatum)\n\nNordrhein-Westfalen Amtsgericht Köln HRB 121164\nRegisterbekanntmachung nach dem Umwandlungsgesetz 15.08.2025 (Eintragungsdatum)\n\nEST Germany GmbH\nGesellschaft mit beschränkter Haftung\nKöln\n\nDen Gläubigern der an der Verschmelzung beteiligten Rechtsträger ist, wenn sie binnen sechs Monaten nach dem Tag, an dem die Eintragung der Verschmelzung in das Register des Sitzes desjenigen Rechtsträgers, dessen Gläubiger sie sind, nach § 19 Absatz 3 UmwG als bekanntgemacht gilt, ihren Anspruch nach Grund und Höhe schriftlich anmelden, Sicherheit zu leisten, soweit sie nicht Befriedigung verlangen können. Dieses Recht steht den Gläubigern jedoch nur zu, wenn sie glaubhaft machen, dass durch die Verschmelzung die Erfüllung ihrer Forderung gefährdet wird."
    },
    {
      "date": "2025-08-15",
      "id": "121413",
      "original_text": "Löschungsankündigung\nNordrhein-Westfalen Amtsgericht Düsseldorf HRB 98127\nRaum & Zeit Bauunternehmung GmbH – Düsseldorf",
      "type": "Löschungsankündigung",
      "state": "Nordrhein-Westfalen",
      "amtsgericht": "Amtsgericht Düsseldorf",
      "registernummer": "HRB 98127",
      "registerart": "HRB",
      "company_name": "Raum & Zeit Bauunternehmung GmbH",
      "company_seat": "Düsseldorf",
      "details": "15.08.2025 (Bekanntmachungsdatum)\n\nNordrhein-Westfalen Amtsgericht Düsseldorf HRB 98127\nLöschungsankündigung\n\nRaum & Zeit Bauunternehmung GmbH\nGesellschaft mit beschränkter Haftung\nDüsseldorf\n\nDas Registergericht beabsichtigt die Gesellschaft von Amts wegen nach § 394 FamFG zu löschen. Die Frist zur Erhebung eines Widerspruchs ist auf 3 Wochen festgesetzt.\n\nRechtsbehelfsbelehrung:\nDas Widerspruchsrecht steht jedem zu, der an der Unterlassung der Löschung ein berechtigtes Interesse hat. Der Widerspruch ist bei dem Amtsgericht Düsseldorf -Registergericht-, Werdener Straße 1, 40227 Düsseldorf schriftlich in deutscher Sprache oder zur Niederschrift der Geschäftsstelle einzulegen. Der Widerspruch kann auch zur Niederschrift der Geschäftsstelle eines jeden Amtsgerichtes abgegeben werden. Die Einlegung ist auch durch Übertragung eines elektronischen Dokuments an die elektronische Poststelle des Gerichts möglich. Das elektronische Dokument muss für die Bearbeitung durch das Gericht geeignet und mit einer qualifizierten elektronischen Signatur der verantwortenden Person versehen sein oder von der verantwortenden Person signiert und auf einem sicheren Übermittlungsweg gemäß § 130a ZPO nach näherer Maßgabe der Verordnung über die technischen Rahmenbedingungen des elektronischen Rechtsverkehrs und über das besondere elektronische Behördenpostfach (BGBl. I, S.3803) eingereicht werden. Weitere Informationen erhalten Sie auf der Internetseite www.justiz.de.\nDer Widerspruch muss spätestens innerhalb der gesetzten Frist nach dem Datum der Bekanntmachung der Löschungsankündigung bei dem Amtsgericht - Registergericht - Düsseldorf eingegangen sein.  Dies gilt auch dann, wenn der Widerspruch zur Niederschrift der Geschäftsstelle eines anderen Amtsgerichtes abgegeben wurde. Die Frist beginnt mit dem Tage der Bekanntmachung der Löschungsankündigung in dem für die Bekanntmachung der Eintragungen in das Handelsregister bestimmten elektronischen Informations- und Kommunikationssystem nach § 10 des Handelsgesetzbuches. Fällt das Ende der Frist auf einen Sonntag, einen allgemeinen Feiertag oder Sonnabend, so endet die Frist mit Ablauf des nächsten Werktages.\nDer Widerspruch muss die Bezeichnung der angefochtenen Löschungsankündigung sowie die Erklärung enthalten, dass Widerspruch gegen diese Löschungsankündigung eingelegt wird. Er ist zu unterzeichnen und soll begründet werden."
    },
    {
      "date": "2025-08-15",
      "id": "121414",
      "original_text": "Registerbekanntmachung nach dem Umwandlungsgesetz\nNordrhein-Westfalen Amtsgericht Düsseldorf HRB 100089\nScera Investments GmbH – Düsseldorf",
      "type": "Registerbekanntmachung nach dem Umwandlungsgesetz",
      "state": "Nordrhein-Westfalen",
      "amtsgericht": "Amtsgericht Düsseldorf",
      "registernummer": "HRB 100089",
      "registerart": "HRB",
      "company_name": "Scera Investments GmbH",
      "company_seat": "Düsseldorf",
      "details": "15.08.2025 (Bekanntmachungsdatum)\n\nNordrhein-Westfalen Amtsgericht Düsseldorf HRB 100089\nRegisterbekanntmachung nach dem Umwandlungsgesetz 15.08.2025 (Eintragungsdatum)\n\nScera Investments GmbH\nGesellschaft mit beschränkter Haftung\nDüsseldorf\n\nDen Gläubigern der an der Verschmelzung beteiligten Rechtsträger ist, wenn sie binnen sechs Monaten nach dem Tag, an dem die Eintragung der Verschmelzung in das Register des Sitzes desjenigen Rechtsträgers, dessen Gläubiger sie sind, nach § 19 Absatz 3 UmwG als bekanntgemacht gilt, ihren Anspruch nach Grund und Höhe schriftlich anmelden, Sicherheit zu leisten, soweit sie nicht Befriedigung verlangen können. Dieses Recht steht den Gläubigern jedoch nur zu, wenn sie glaubhaft machen, dass durch die Verschmelzung die Erfüllung ihrer Forderung gefährdet wird."
    },
    {
      "date": "2025-08-15",
      "id": "121415",
      "original_text": "Registerbekanntmachung nach dem Umwandlungsgesetz\nNordrhein-Westfalen Amtsgericht Essen HRB 2106\nDas Rathaus Verlagsgesellschaft mit beschränkter Haftung – Essen",
      "type": "Registerbekanntmachung nach dem Umwandlungsgesetz",
      "state": "Nordrhein-Westfalen",
      "amtsgericht": "Amtsgericht Essen",
      "registernummer": "HRB 2106",
      "registerart": "HRB",
      "company_name": "Das Rathaus Verlagsgesellschaft mit beschränkter Haftung",
      "company_seat": "Essen",
      "details": "15.08.2025 (Bekanntmachungsdatum)\n\nNordrhein-Westfalen Amtsgericht Essen HRB 2106\nRegisterbekanntmachung nach dem Umwandlungsgesetz 15.08.2025 (Eintragungsdatum)\n\nDas Rathaus Verlagsgesellschaft mit beschränkter Haftung\nGesellschaft mit beschränkter Haftung\nEssen\n\nDen Gläubigern der an der Verschmelzung beteiligten Rechtsträger ist, wenn sie binnen sechs Monaten nach dem Tag, an dem die Eintragung der Verschmelzung in das Register des Sitzes desjenigen Rechtsträgers, dessen Gläubiger sie sind, nach § 19 Absatz 3 UmwG als bekanntgemacht gilt, ihren Anspruch nach Grund und Höhe schriftlich anmelden, Sicherheit zu leisten, soweit sie nicht Befriedigung verlangen können. Dieses Recht steht den Gläubigern jedoch nur zu, wenn sie glaubhaft machen, dass durch die Verschmelzung die Erfüllung ihrer Forderung gefährdet wird."
    },
    {
      "date": "2025-08-15",
      "id": "121416",
      "original_text": "Registerbekanntmachung nach dem Umwandlungsgesetz\nNordrhein-Westfalen Amtsgericht Wuppertal HRA 26051\nAutomobile Köhnen e.K. – Solingen",
      "type": "Registerbekanntmachung nach dem Umwandlungsgesetz",
      "state": "Nordrhein-Westfalen",
      "amtsgericht": "Amtsgericht Wuppertal",
      "registernummer": "HRA 26051",
      "registerart": "HRA",
      "company_name": "Automobile Köhnen e.K.",
      "company_seat": "Solingen",
      "details": "15.08.2025 (Bekanntmachungsdatum)\n\nNordrhein-Westfalen Amtsgericht Wuppertal HRA 26051\nRegisterbekanntmachung nach dem Umwandlungsgesetz 15.08.2025 (Eintragungsdatum)\n\nAutomobile Köhnen e.K.\nEinzelkaufmann / Einzelkauffrau\nSolingen\n\nDen Gläubigern der an der Ausgliederung beteiligten Rechtsträger ist, wenn sie binnen sechs Monaten nach dem Tag, an dem die Eintragung der Ausgliederung in das Register des Sitzes derjenigen Rechtsträger deren Gläubiger sie sind, nach § 19 Absatz 3 UmwG als bekanntgemacht gilt, ihren Anspruch nach Grund und Höhe schriftlich anmelden, Sicherheit zu leisten, soweit sie nicht Befriedigung verlangen können. Dieses Recht steht den Gläubigern jedoch nur zu, wenn sie glaubhaft machen, dass durch die Ausgliederung die Erfüllung ihrer Forderung gefährdet wird."
    },
    {
      "date": "2025-08-15",
      "id": "121417",
      "original_text": "Registerbekanntmachung nach dem Umwandlungsgesetz\nNordrhein-Westfalen Amtsgericht Düsseldorf HRA 28345\nDUSInvest XXIII (Dreiundzwanzig) GmbH & Co. KG – Düsseldorf",
      "type": "Registerbekanntmachung nach dem Umwandlungsgesetz",
      "state": "Nordrhein-Westfalen",
      "amtsgericht": "Amtsgericht Düsseldorf",
      "registernummer": "HRA 28345",
      "registerart": "HRA",
      "company_name": "DUSInvest XXIII (Dreiundzwanzig) GmbH & Co. KG",
      "company_seat": "Düsseldorf",
      "details": "15.08.2025 (Bekanntmachungsdatum)\n\nNordrhein-Westfalen Amtsgericht Düsseldorf HRA 28345\nRegisterbekanntmachung nach dem Umwandlungsgesetz 15.08.2025 (Eintragungsdatum)\n\nDUSInvest XXIII (Dreiundzwanzig) GmbH & Co. KG\nKommanditgesellschaft\nDüsseldorf\n\nDen Gläubigern der an der formwechselnden Umwandlung beteiligten Rechtsträger ist, wenn sie binnen sechs Monaten nach dem Tag, an dem die Eintragung der formwechselnden Umwandlung in das Register des Sitzes desjenigen Rechtsträgers, dessen Gläubiger sie sind, nach § 19 Absatz 3 UmwG als bekanntgemacht gilt, ihren Anspruch nach Grund und Höhe schriftlich anmelden, Sicherheit zu leisten, soweit sie nicht Befriedigung verlangen können. Dieses Recht steht den Gläubigern jedoch nur zu, wenn sie glaubhaft machen, dass durch die formwechselnden Umwandlung die Erfüllung ihrer Forderung gefährdet wird."
    },
    {
      "date": "2025-08-15",
      "id": "121418",
      "original_text": "Registerbekanntmachung nach dem Umwandlungsgesetz\nNordrhein-Westfalen Amtsgericht Düsseldorf HRB 98522\nL7 Prince Holding GmbH – Düsseldorf",
      "type": "Registerbekanntmachung nach dem Umwandlungsgesetz",
      "state": "Nordrhein-Westfalen",
      "amtsgericht": "Amtsgericht Düsseldorf",
      "registernummer": "HRB 98522",
      "registerart": "HRB",
      "company_name": "L7 Prince Holding GmbH",
      "company_seat": "Düsseldorf",
      "details": "15.08.2025 (Bekanntmachungsdatum)\n\nNordrhein-Westfalen Amtsgericht Düsseldorf HRB 98522\nRegisterbekanntmachung nach dem Umwandlungsgesetz 15.08.2025 (Eintragungsdatum)\n\nL7 Prince Holding GmbH\nGesellschaft mit beschränkter Haftung\nDüsseldorf\n\nDen Gläubigern der an der Verschmelzung beteiligten Rechtsträger ist, wenn sie binnen sechs Monaten nach dem Tag, an dem die Eintragung der Verschmelzung in das Register des Sitzes desjenigen Rechtsträgers, dessen Gläubiger sie sind, nach § 19 Absatz 3 UmwG als bekanntgemacht gilt, ihren Anspruch nach Grund und Höhe schriftlich anmelden, Sicherheit zu leisten, soweit sie nicht Befriedigung verlangen können. Dieses Recht steht den Gläubigern jedoch nur zu, wenn sie glaubhaft machen, dass durch die Verschmelzung die Erfüllung ihrer Forderung gefährdet wird."
    },
    {
      "date": "2025-08-15",
      "id": "121419",
      "original_text": "Löschungsankündigung\nNordrhein-Westfalen Amtsgericht Bad Oeynhausen HRB 18172\nStalbergs Bau GmbH – Vlotho",
      "type": "Löschungsankündigung",
      "state": "Nordrhein-Westfalen",
      "amtsgericht": "Amtsgericht Bad Oeynhausen",
      "registernummer": "HRB 18172",
      "registerart": "HRB",
      "company_name": "Stalbergs Bau GmbH",
      "company_seat": "Vlotho",
      "details": "15.08.2025 (Bekanntmachungsdatum)\n\nNordrhein-Westfalen Amtsgericht Bad Oeynhausen HRB 18172\nLöschungsankündigung 15.08.2025 (Eintragungsdatum)\n\nStalbergs Bau GmbH\nGesellschaft mit beschränkter Haftung\nVlotho\n\nDas Registergericht beabsichtigt die Gesellschaft von Amts wegen nach § 394 FamFG zu löschen. Die Frist zur Erhebung eines Widerspruchs ist auf einen Monat festgesetzt."
    },
    {
      "date": "2025-08-15",
      "id": "121420",
      "original_text": "Löschungsankündigung\nNordrhein-Westfalen Amtsgericht Siegburg HRB 4649\nN.A. Energy Consulting & Marketing GmbH – Troisdorf",
      "type": "Löschungsankündigung",
      "state": "Nordrhein-Westfalen",
      "amtsgericht": "Amtsgericht Siegburg",
      "registernummer": "HRB 4649",
      "registerart": "HRB",
      "company_name": "N.A. Energy Consulting & Marketing GmbH",
      "company_seat": "Troisdorf",
      "details": "15.08.2025 (Bekanntmachungsdatum)\n\nNordrhein-Westfalen Amtsgericht Siegburg HRB 4649\nLöschungsankündigung\n\nN.A. Energy Consulting & Marketing GmbH\nGesellschaft mit beschränkter Haftung\nTroisdorf\n\nDas Registergericht hat glaubhafte Kenntnis erlangt, dass die Gesellschaft vermögenslos geworden ist, da\nein Insolvenzeröffnungsantrag mangels Masse nach § 26 InsO zurückgewiesen wurde.\n\nEs ist daher beabsichtigt, die Gesellschaft nach § 394 FamFG im Handelsregister wegen Vermögenslosigkeit zu löschen.\nEinwände gegen die Löschung sind durch Widerspruch binnen einer Frist von 3 Monaten geltend zu machen, andernfalls die Löschung erfolgen wird.\n\nEinzulegen ist der Widerspruch bei dem Amtsgericht Siegburg, Neue Poststraße 16, 53721 Siegburg, und zwar entweder schriftlich in deutscher Sprache oder mündlich zur Niederschrift der Geschäftsstelle. Der Widerspruch kann auch zur Niederschrift der Geschäftsstelle eines jeden Amtsgerichts abgegeben werden. Der Widerspruch ist binnen der in der Verfügung bestimmten Frist einzulegen. Die Frist ist nur gewahrt, wenn der Widerspruch rechtzeitig bei dem Amtsgericht Siegburg eingeht, auch wenn der Widerspruch zur Niederschrift der Geschäftsstelle eines anderen Amtsgerichts abgegeben wurde. Die Frist beginnt jeweils mit der schriftlichen Bekanntgabe der Verfügung an die Beteiligten. Kann die schriftliche Bekanntgabe an einen Beteiligten nicht bewirkt werden, beginnt die Frist spätestens mit Ablauf von fünf Monaten nach Erlass der Verfügung. Die Bekanntgabe ist entweder durch Zustellung oder am dritten Tage nach Aufgabe zur Post bewirkt. Sofern die Löschung noch nicht erfolgt ist, kann der Widerspruch auch noch nach Ablauf der Frist eingelegt werden. Fällt das Ende der Frist auf einen Sonnabend, einen Sonntag oder einen allgemeinen Feiertag, endet die Frist mit Ablauf des nächsten Werktages. Der Widerspruch ist zu unterzeichnen. Eine Begründung des Widerspruchs ist nicht vorgeschrieben."
    },
    {
      "date": "2025-08-15",
      "id": "121421",
      "original_text": "Registerbekanntmachung nach dem Umwandlungsgesetz\nNordrhein-Westfalen Amtsgericht Düsseldorf HRB 70743\nPremium Küchendesign GmbH Düsseldorf – Düsseldorf",
      "type": "Registerbekanntmachung nach dem Umwandlungsgesetz",
      "state": "Nordrhein-Westfalen",
      "amtsgericht": "Amtsgericht Düsseldorf",
      "registernummer": "HRB 70743",
      "registerart": "HRB",
      "company_name": "Premium Küchendesign GmbH Düsseldorf",
      "company_seat": "Düsseldorf",
      "details": "15.08.2025 (Bekanntmachungsdatum)\n\nNordrhein-Westfalen Amtsgericht Düsseldorf HRB 70743\nRegisterbekanntmachung nach dem Umwandlungsgesetz 15.08.2025 (Eintragungsdatum)\n\nPremium Küchendesign GmbH Düsseldorf\nGesellschaft mit beschränkter Haftung\nDüsseldorf\n\nDen Gläubigern der an der Verschmelzung beteiligten Rechtsträger ist, wenn sie binnen sechs Monaten nach dem Tag, an dem die Eintragung der Verschmelzung in das Register des Sitzes desjenigen Rechtsträgers, dessen Gläubiger sie sind, nach § 19 Absatz 3 UmwG als bekanntgemacht gilt, ihren Anspruch nach Grund und Höhe schriftlich anmelden, Sicherheit zu leisten, soweit sie nicht Befriedigung verlangen können. Dieses Recht steht den Gläubigern jedoch nur zu, wenn sie glaubhaft machen, dass durch die Verschmelzung die Erfüllung ihrer Forderung gefährdet wird."
    },
    {
      "date": "2025-08-15",
      "id": "121422",
      "original_text": "Registerbekanntmachung nach dem Umwandlungsgesetz\nNordrhein-Westfalen Amtsgericht Düsseldorf HRB 92890\nCuadus Capital & Consulting GmbH – Düsseldorf",
      "type": "Registerbekanntmachung nach dem Umwandlungsgesetz",
      "state": "Nordrhein-Westfalen",
      "amtsgericht": "Amtsgericht Düsseldorf",
      "registernummer": "HRB 92890",
      "registerart": "HRB",
      "company_name": "Cuadus Capital & Consulting GmbH",
      "company_seat": "Düsseldorf",
      "details": "15.08.2025 (Bekanntmachungsdatum)\n\nNordrhein-Westfalen Amtsgericht Düsseldorf HRB 92890\nRegisterbekanntmachung nach dem Umwandlungsgesetz 15.08.2025 (Eintragungsdatum)\n\nCuadus Capital & Consulting GmbH\nGesellschaft mit beschränkter Haftung\nDüsseldorf\n\nDen Gläubigern der an der Verschmelzung beteiligten Rechtsträger ist, wenn sie binnen sechs Monaten nach dem Tag, an dem die Eintragung der Verschmelzung in das Register des Sitzes desjenigen Rechtsträgers, dessen Gläubiger sie sind, nach § 19 Absatz 3 UmwG als bekanntgemacht gilt, ihren Anspruch nach Grund und Höhe schriftlich anmelden, Sicherheit zu leisten, soweit sie nicht Befriedigung verlangen können. Dieses Recht steht den Gläubigern jedoch nur zu, wenn sie glaubhaft machen, dass durch die Verschmelzung die Erfüllung ihrer Forderung gefährdet wird."
    },
    {
      "date": "2025-08-15",
      "id": "121423",
      "original_text": "Registerbekanntmachung nach dem Umwandlungsgesetz\nNordrhein-Westfalen Amtsgericht Duisburg HRB 39273\nRhenus Rail Logistics GmbH – Duisburg",
      "type": "Registerbekanntmachung nach dem Umwandlungsgesetz",
      "state": "Nordrhein-Westfalen",
      "amtsgericht": "Amtsgericht Duisburg",
      "registernummer": "HRB 39273",
      "registerart": "HRB",
      "company_name": "Rhenus Rail Logistics GmbH",
      "company_seat": "Duisburg",
      "details": "15.08.2025 (Bekanntmachungsdatum)\n\nNordrhein-Westfalen Amtsgericht Duisburg HRB 39273\nRegisterbekanntmachung nach dem Umwandlungsgesetz 15.08.2025 (Eintragungsdatum)\n\nRhenus Rail Logistics GmbH\nGesellschaft mit beschränkter Haftung\nDuisburg\n\nDie Gesellschaft hat Gläubigern, deren Forderungen vor dieser Bekanntmachung begründet worden sind, Sicherheit zu leisten, soweit sie nicht Befriedigung verlangen können, wenn sie sich binnen sechs Monaten zu diesem Zweck melden."
    },
    {
      "date": "2025-08-15",
      "id": "121424",
      "original_text": "Löschungsankündigung\nNordrhein-Westfalen Amtsgericht Dortmund HRB 21392\nGrundbesitz Kanalstraße GmbH – Dortmund",
      "type": "Löschungsankündigung",
      "state": "Nordrhein-Westfalen",
      "amtsgericht": "Amtsgericht Dortmund",
      "registernummer": "HRB 21392",
      "registerart": "HRB",
      "company_name": "Grundbesitz Kanalstraße GmbH",
      "company_seat": "Dortmund",
      "details": "15.08.2025 (Bekanntmachungsdatum)\n\nNordrhein-Westfalen Amtsgericht Dortmund HRB 21392\nLöschungsankündigung 15.08.2025 (Eintragungsdatum)\n\nGrundbesitz Kanalstraße GmbH\nGesellschaft mit beschränkter Haftung\nDortmund\n\nDas Registergericht beabsichtigt die Gesellschaft von Amts wegen nach § 394 FamFG zu löschen. Die Frist zur Erhebung eines Widerspruchs ist auf zwei Monate festgesetzt."
    },
    {
      "date": "2025-08-15",
      "id": "121425",
      "original_text": "Registerbekanntmachung nach dem Umwandlungsgesetz\nNordrhein-Westfalen Amtsgericht Paderborn HRB 16037\nMECOTEC Immobilien GmbH – Hövelhof",
      "type": "Registerbekanntmachung nach dem Umwandlungsgesetz",
      "state": "Nordrhein-Westfalen",
      "amtsgericht": "Amtsgericht Paderborn",
      "registernummer": "HRB 16037",
      "registerart": "HRB",
      "company_name": "MECOTEC Immobilien GmbH",
      "company_seat": "Hövelhof",
      "details": "15.08.2025 (Bekanntmachungsdatum)\n\nNordrhein-Westfalen Amtsgericht Paderborn HRB 16037\nRegisterbekanntmachung nach dem Umwandlungsgesetz 15.08.2025 (Eintragungsdatum)\n\nMECOTEC Immobilien GmbH\nGesellschaft mit beschränkter Haftung\nHövelhof\n\nDen Gläubigern der an der Verschmelzung beteiligten Rechtsträger ist, wenn sie binnen sechs Monaten nach dem Tag, an dem die Eintragung der Verschmelzung in das Register des Sitzes desjenigen Rechtsträgers, dessen Gläubiger sie sind, nach § 19 Absatz 3 UmwG als bekanntgemacht gilt, ihren Anspruch nach Grund und Höhe schriftlich anmelden, Sicherheit zu leisten, soweit sie nicht Befriedigung verlangen können. Dieses Recht steht den Gläubigern jedoch nur zu, wenn sie glaubhaft machen, dass durch die Verschmelzung die Erfüllung ihrer Forderung gefährdet wird."
    },
    {
      "date": "2025-08-15",
      "id": "121426",
      "original_text": "Löschungsankündigung\nNordrhein-Westfalen Amtsgericht Neuss HRB 21095\nBe Fashion UG (haftungsbeschränkt) – Neuss",
      "type": "Löschungsankündigung",
      "state": "Nordrhein-Westfalen",
      "amtsgericht": "Amtsgericht Neuss",
      "registernummer": "HRB 21095",
      "registerart": "HRB",
      "company_name": "Be Fashion UG (haftungsbeschränkt)",
      "company_seat": "Neuss",
      "details": "15.08.2025 (Bekanntmachungsdatum)\n\nNordrhein-Westfalen Amtsgericht Neuss HRB 21095\nLöschungsankündigung 13.08.2025 (Eintragungsdatum)\n\nBe Fashion UG (haftungsbeschränkt)\nGesellschaft mit beschränkter Haftung\nNeuss\n\nDas Registergericht beabsichtigt die Gesellschaft von Amts wegen nach § 394 FamFG zu löschen. Die Frist zur Erhebung eines Widerspruchs ist auf einen Monat festgesetzt. Rechtsbehelfsbelehrung: Gegen diese Verfügung können Sie Widerspruch einlegen. Der Widerspruch ist bei dem Amtsgericht Neuss - Registergericht -, Breite Str. 48, 41460 Neuss schriftlich in deutscher Sprache oder zur Niederschrift der Geschäftsstelle einzulegen.Der Widerspruch kann auch zur Niederschrift der Geschäftsstelle eines jeden Amtsgerichtes abgegeben werden.Die Einlegung ist auch durch Übertragung eines elektronischen Dokuments an die elektronische Poststelle des Gerichts möglich. Das elektronische Dokument muss für die Bearbeitung durch das Gericht geeignet und mit einer qualifizierten elektronischen Signatur der verantwortenden Person versehen sein oder von der verantwortenden Person signiert und auf einem sicheren Übermittlungsweg gemäß § 130a ZPO nach näherer Maßgabe der Verordnung über die technischen Rahmenbedingungen des elektronischen Rechtsverkehrs und über das besondere elektronische Behördenpostfach (BGBl. I, S.3803) eingereicht werden. Weitere Informationen erhalten Sie auf der Internetseite www.justiz.de. Der Widerspruch muss spätestens innerhalb der gesetzten Frist nach der schriftlichen Bekanntgabe der Verfügung bei dem Amtsgericht - Registergericht - Neuss eingegangen sein. Dies gilt auch dann, wenn der Widerspruch zur Niederschrift der Geschäftsstelle eines anderen Amtsgerichtes abgegeben wurde. Die Frist beginnt mit der schriftlichen Bekanntgabe der Verfügung. Die Bekanntgabe ist entweder durch Zustellung oder am dritten Tage nach Aufgabe zur Post bewirkt. Fällt das Ende der Frist auf einen Sonntag, einen allgemeinen Feiertag oder Sonnabend, so endet die Frist mit Ablauf des nächsten Werktages. Der Widerspruch muss die Bezeichnung der angefochtenen Verfügung sowie die Erklärung enthalten, dass Widerspruch gegen diese Verfügung eingelegt wird. Er ist zu unterzeichnen und soll begründet werden."
    },
    {
      "date": "2025-08-15",
      "id": "121427",
      "original_text": "Löschungsankündigung\nNordrhein-Westfalen Amtsgericht Dortmund HRB 24162\nAK Handels- und Dienstleistungsgesellschaft mbH – Dortmund",
      "type": "Löschungsankündigung",
      "state": "Nordrhein-Westfalen",
      "amtsgericht": "Amtsgericht Dortmund",
      "registernummer": "HRB 24162",
      "registerart": "HRB",
      "company_name": "AK Handels- und Dienstleistungsgesellschaft mbH",
      "company_seat": "Dortmund",
      "details": "15.08.2025 (Bekanntmachungsdatum)\n\nNordrhein-Westfalen Amtsgericht Dortmund HRB 24162\nLöschungsankündigung 15.08.2025 (Eintragungsdatum)\n\nAK Handels- und Dienstleistungsgesellschaft mbH\nGesellschaft mit beschränkter Haftung\nDortmund\n\nDas Registergericht beabsichtigt die Gesellschaft von Amts wegen nach § 394 FamFG zu löschen. Die Frist zur Erhebung eines Widerspruchs ist auf zwei Monate festgesetzt."
    },
    {
      "date": "2025-08-15",
      "id": "121428",
      "original_text": "Löschungsankündigung\nNordrhein-Westfalen Amtsgericht Wuppertal HRB 27534\nStuckateurbetrieb Mollenhauer UG (haftungsbeschränkt) – Solingen",
      "type": "Löschungsankündigung",
      "state": "Nordrhein-Westfalen",
      "amtsgericht": "Amtsgericht Wuppertal",
      "registernummer": "HRB 27534",
      "registerart": "HRB",
      "company_name": "Stuckateurbetrieb Mollenhauer UG (haftungsbeschränkt)",
      "company_seat": "Solingen",
      "details": "15.08.2025 (Bekanntmachungsdatum)\n\nNordrhein-Westfalen Amtsgericht Wuppertal HRB 27534\nLöschungsankündigung\n\nStuckateurbetrieb Mollenhauer UG (haftungsbeschränkt)\nGesellschaft mit beschränkter Haftung\nSolingen\n\nDas Registergericht beabsichtigt die Gesellschaft von Amts wegen nach § 394 FamFG zu löschen. Die Frist zur Erhebung eines Widerspruchs ist auf einen Monat festgesetzt."
    },
    {
      "date": "2025-08-15",
      "id": "121429",
      "original_text": "Einreichung neuer Dokumente\nNordrhein-Westfalen Amtsgericht Köln HRB 36688\nKHD Humboldt Wedag International AG – Köln",
      "type": "Einreichung neuer Dokumente",
      "state": "Nordrhein-Westfalen",
      "amtsgericht": "Amtsgericht Köln",
      "registernummer": "HRB 36688",
      "registerart": "HRB",
      "company_name": "KHD Humboldt Wedag International AG",
      "company_seat": "Köln",
      "details": "15.08.2025 (Bekanntmachungsdatum)\n\nNordrhein-Westfalen Amtsgericht Köln HRB 36688\nEinreichung neuer Dokumente 15.08.2025 (Eintragungsdatum)\n\nKHD Humboldt Wedag International AG\nAktiengesellschaft\nKöln\n\nDem Registergericht ist eine neue Liste der Mitglieder des Aufsichtsrates eingereicht worden."
    },
    {
      "date": "2025-08-15",
      "id": "121430",
      "original_text": "Registerbekanntmachung nach dem Umwandlungsgesetz\nNordrhein-Westfalen Amtsgericht Paderborn HRB 11617\nPollmeier Holding GmbH – Hövelhof",
      "type": "Registerbekanntmachung nach dem Umwandlungsgesetz",
      "state": "Nordrhein-Westfalen",
      "amtsgericht": "Amtsgericht Paderborn",
      "registernummer": "HRB 11617",
      "registerart": "HRB",
      "company_name": "Pollmeier Holding GmbH",
      "company_seat": "Hövelhof",
      "details": "15.08.2025 (Bekanntmachungsdatum)\n\nNordrhein-Westfalen Amtsgericht Paderborn HRB 11617\nRegisterbekanntmachung nach dem Umwandlungsgesetz 15.08.2025 (Eintragungsdatum)\n\nPollmeier Holding GmbH\nGesellschaft mit beschränkter Haftung\nHövelhof\n\nDen Gläubigern der an der Verschmelzung beteiligten Rechtsträger ist, wenn sie binnen sechs Monaten nach dem Tag, an dem die Eintragung der Verschmelzung in das Register des Sitzes desjenigen Rechtsträgers, dessen Gläubiger sie sind, nach § 19 Absatz 3 UmwG als bekanntgemacht gilt, ihren Anspruch nach Grund und Höhe schriftlich anmelden, Sicherheit zu leisten, soweit sie nicht Befriedigung verlangen können. Dieses Recht steht den Gläubigern jedoch nur zu, wenn sie glaubhaft machen, dass durch die Verschmelzung die Erfüllung ihrer Forderung gefährdet wird."
    },
    {
      "date": "2025-08-15",
      "id": "121431",
      "original_text": "Registerbekanntmachung nach dem Umwandlungsgesetz\nNordrhein-Westfalen Amtsgericht Bad Oeynhausen HRB 2145\nB + D Datentechnik GmbH – Löhne",
      "type": "Registerbekanntmachung nach dem Umwandlungsgesetz",
      "state": "Nordrhein-Westfalen",
      "amtsgericht": "Amtsgericht Bad Oeynhausen",
      "registernummer": "HRB 2145",
      "registerart": "HRB",
      "company_name": "B + D Datentechnik GmbH",
      "company_seat": "Löhne",
      "details": "15.08.2025 (Bekanntmachungsdatum)\n\nNordrhein-Westfalen Amtsgericht Bad Oeynhausen HRB 2145\nRegisterbekanntmachung nach dem Umwandlungsgesetz 15.08.2025 (Eintragungsdatum)\n\nB + D Datentechnik GmbH\nGesellschaft mit beschränkter Haftung\nLöhne\n\nDen Gläubigern der an der Verschmelzung beteiligten Rechtsträger ist, wenn sie binnen sechs Monaten nach dem Tag, an dem die Eintragung der Verschmelzung in das Register des Sitzes desjenigen Rechtsträgers, dessen Gläubiger sie sind, nach § 19 Absatz 3 UmwG als bekanntgemacht gilt, ihren Anspruch nach Grund und Höhe schriftlich anmelden, Sicherheit zu leisten, soweit sie nicht Befriedigung verlangen können. Dieses Recht steht den Gläubigern jedoch nur zu, wenn sie glaubhaft machen, dass durch die Verschmelzung die Erfüllung ihrer Forderung gefährdet wird."
    },
    {
      "date": "2025-08-15",
      "id": "121432",
      "original_text": "Registerbekanntmachung nach dem Umwandlungsgesetz\nNordrhein-Westfalen Amtsgericht Aachen GsR 676\nEhnimb+Franke Grundbesitz eGbR – Geilenkirchen",
      "type": "Registerbekanntmachung nach dem Umwandlungsgesetz",
      "state": "Nordrhein-Westfalen",
      "amtsgericht": "Amtsgericht Aachen",
      "registernummer": "GsR 676",
      "registerart": "GsR",
      "company_name": "Ehnimb+Franke Grundbesitz eGbR",
      "company_seat": "Geilenkirchen",
      "details": "15.08.2025 (Bekanntmachungsdatum)\n\nNordrhein-Westfalen Amtsgericht Aachen GsR 676\nRegisterbekanntmachung nach dem Umwandlungsgesetz 15.08.2025 (Eintragungsdatum)\n\nEhnimb+Franke Grundbesitz eGbR\nGesellschaft bürgerlichen Rechts\nGeilenkirchen\n\nDen Gläubigern der an der formwechselnden Umwandlung beteiligten Rechtsträger ist, wenn sie binnen sechs Monaten nach dem Tag, an dem die Eintragung der formwechselnden Umwandlung in das Register des Sitzes desjenigen Rechtsträgers, dessen Gläubiger sie sind, nach § 19 Absatz 3 UmwG als bekanntgemacht gilt, ihren Anspruch nach Grund und Höhe schriftlich anmelden, Sicherheit zu leisten, soweit sie nicht Befriedigung verlangen können. Dieses Recht steht den Gläubigern jedoch nur zu, wenn sie glaubhaft machen, dass durch die formwechselnden Umwandlung die Erfüllung ihrer Forderung gefährdet wird."
    },
    {
      "date": "2025-08-15",
      "id": "121433",
      "original_text": "Registerbekanntmachung nach dem Umwandlungsgesetz\nNordrhein-Westfalen Amtsgericht Neuss HRB 6252\nLWS Werbung GmbH – Kaarst",
      "type": "Registerbekanntmachung nach dem Umwandlungsgesetz",
      "state": "Nordrhein-Westfalen",
      "amtsgericht": "Amtsgericht Neuss",
      "registernummer": "HRB 6252",
      "registerart": "HRB",
      "company_name": "LWS Werbung GmbH",
      "company_seat": "Kaarst",
      "details": "15.08.2025 (Bekanntmachungsdatum)\n\nNordrhein-Westfalen Amtsgericht Neuss HRB 6252\nRegisterbekanntmachung nach dem Umwandlungsgesetz 15.08.2025 (Eintragungsdatum)\n\nLWS Werbung GmbH\nGesellschaft mit beschränkter Haftung\nKaarst\n\nDen Gläubigern der an der Verschmelzung beteiligten Rechtsträger ist, wenn sie binnen sechs Monaten nach dem Tag, an dem die Eintragung der Verschmelzung in das Register des Sitzes derjenigen Rechtsträger deren Gläubiger sie sind, nach § 19 Absatz 3 UmwG als bekanntgemacht gilt, ihren Anspruch nach Grund und Höhe schriftlich anmelden, Sicherheit zu leisten, soweit sie nicht Befriedigung verlangen können. Dieses Recht steht den Gläubigern jedoch nur zu, wenn sie glaubhaft machen, dass durch die Verschmelzung die Erfüllung ihrer Forderung gefährdet wird."
    },
    {
      "date": "2025-08-15",
      "id": "121434",
      "original_text": "Registerbekanntmachung nach dem Umwandlungsgesetz\nNordrhein-Westfalen Amtsgericht Steinfurt HRA 8442\nAlbert August Pottmeyer e.K. – Saerbeck",
      "type": "Registerbekanntmachung nach dem Umwandlungsgesetz",
      "state": "Nordrhein-Westfalen",
      "amtsgericht": "Amtsgericht Steinfurt",
      "registernummer": "HRA 8442",
      "registerart": "HRA",
      "company_name": "Albert August Pottmeyer e.K.",
      "company_seat": "Saerbeck",
      "details": "15.08.2025 (Bekanntmachungsdatum)\n\nNordrhein-Westfalen Amtsgericht Steinfurt HRA 8442\nRegisterbekanntmachung nach dem Umwandlungsgesetz 15.08.2025 (Eintragungsdatum)\n\nAlbert August Pottmeyer e.K.\nEinzelkaufmann / Einzelkauffrau\nSaerbeck\n\nDen Gläubigern der an der Ausgliederung beteiligten Rechtsträger ist, wenn sie binnen sechs Monaten nach dem Tag, an dem die Eintragung der Ausgliederung in das Register des Sitzes desjenigen Rechtsträgers, dessen Gläubiger sie sind, nach § 19 Absatz 3 UmwG als bekanntgemacht gilt, ihren Anspruch nach Grund und Höhe schriftlich anmelden, Sicherheit zu leisten, soweit sie nicht Befriedigung verlangen können. Dieses Recht steht den Gläubigern jedoch nur zu, wenn sie glaubhaft machen, dass durch die Ausgliederung die Erfüllung ihrer Forderung gefährdet wird."
    },
    {
      "date": "2025-08-15",
      "id": "121435",
      "original_text": "Registerbekanntmachung nach dem Umwandlungsgesetz\nNordrhein-Westfalen Amtsgericht Arnsberg HRA 9063\nAlba Equus GmbH & Co. KG – Soest",
      "type": "Registerbekanntmachung nach dem Umwandlungsgesetz",
      "state": "Nordrhein-Westfalen",
      "amtsgericht": "Amtsgericht Arnsberg",
      "registernummer": "HRA 9063",
      "registerart": "HRA",
      "company_name": "Alba Equus GmbH & Co. KG",
      "company_seat": "Soest",
      "details": "15.08.2025 (Bekanntmachungsdatum)\n\nNordrhein-Westfalen Amtsgericht Arnsberg HRA 9063\nRegisterbekanntmachung nach dem Umwandlungsgesetz 15.08.2025 (Eintragungsdatum)\n\nAlba Equus GmbH & Co. KG\nKommanditgesellschaft\nSoest\n\nDen Gläubigern der an der Ausgliederung beteiligten Rechtsträger ist, wenn sie binnen sechs Monaten nach dem Tag, an dem die Eintragung der Ausgliederung in das Register des Sitzes derjenigen Rechtsträger deren Gläubiger sie sind, nach § 19 Absatz 3 UmwG als bekanntgemacht gilt, ihren Anspruch nach Grund und Höhe schriftlich anmelden, Sicherheit zu leisten, soweit sie nicht Befriedigung verlangen können. Dieses Recht steht den Gläubigern jedoch nur zu, wenn sie glaubhaft machen, dass durch die Ausgliederung die Erfüllung ihrer Forderung gefährdet wird."
    },
    {
      "date": "2025-08-15",
      "id": "121436",
      "original_text": "Löschungsankündigung\nBrandenburg Amtsgericht Potsdam HRB 38595\nSPE Dienstleistungen und Services für Ihre Immobilienwirtschaft GmbH – Zossen",
      "type": "Löschungsankündigung",
      "state": "Brandenburg",
      "amtsgericht": "Amtsgericht Potsdam",
      "registernummer": "HRB 38595",
      "registerart": "HRB",
      "company_name": "SPE Dienstleistungen und Services für Ihre Immobilienwirtschaft GmbH",
      "company_seat": "Zossen",
      "details": "15.08.2025 (Bekanntmachungsdatum)\n\nBrandenburg Amtsgericht Potsdam HRB 38595\nLöschungsankündigung\n\nSPE Dienstleistungen und Services für Ihre Immobilienwirtschaft GmbH\nGesellschaft mit beschränkter Haftung\nZossen\n\nBei der nachstehenden Gesellschaft wird das Amtslöschungsverfahren gemäß § 394 FamFG eingeleitet.\nDie Widerspruchsfrist beträgt 2 Monate."
    },
    {
      "date": "2025-08-15",
      "id": "121437",
      "original_text": "Registerbekanntmachung nach dem Umwandlungsgesetz\nHessen Amtsgericht Darmstadt HRB 95137\niSi-GmbH – Darmstadt",
      "type": "Registerbekanntmachung nach dem Umwandlungsgesetz",
      "state": "Hessen",
      "amtsgericht": "Amtsgericht Darmstadt",
      "registernummer": "HRB 95137",
      "registerart": "HRB",
      "company_name": "iSi-GmbH",
      "company_seat": "Darmstadt",
      "details": "15.08.2025 (Bekanntmachungsdatum)\n\nHessen Amtsgericht Darmstadt HRB 95137\nRegisterbekanntmachung nach dem Umwandlungsgesetz 15.08.2025 (Eintragungsdatum)\n\niSi-GmbH\nGesellschaft mit beschränkter Haftung\nDarmstadt\n\nDen Gläubigern der an der Verschmelzung beteiligten Rechtsträger ist, wenn sie binnen sechs Monaten nach dem Tag, an dem die Eintragung der Verschmelzung in das Register des Sitzes derjenigen Rechtsträger deren Gläubiger sie sind, nach § 19 Absatz 3 UmwG bekannt gemacht worden ist, ihren Anspruch nach Grund und Höhe schriftlich anmelden, Sicherheit zu leisten, soweit sie nicht Befriedigung verlangen können. Dieses Recht steht den Gläubigern jedoch nur zu, wenn sie glaubhaft machen, dass durch die Verschmelzung die Erfüllung ihrer Forderung gefährdet wird."
    },
    {
      "date": "2025-08-15",
      "id": "121438",
      "original_text": "Löschungsankündigung\nHessen Amtsgericht Darmstadt HRB 89316\nTri-Star Europe GmbH – Kelsterbach",
      "type": "Löschungsankündigung",
      "state": "Hessen",
      "amtsgericht": "Amtsgericht Darmstadt",
      "registernummer": "HRB 89316",
      "registerart": "HRB",
      "company_name": "Tri-Star Europe GmbH",
      "company_seat": "Kelsterbach",
      "details": "15.08.2025 (Bekanntmachungsdatum)\n\nHessen Amtsgericht Darmstadt HRB 89316\nLöschungsankündigung\n\nTri-Star Europe GmbH\nGesellschaft mit beschränkter Haftung\nKelsterbach\n\n#insert(Text=\"Löschungsankündigung_HRB\")#insert(Text=\"Hinweis_EA_VoE\")Das Registergericht beabsichtigt die im Handelsregister eingetragene Gesellschaft von Amts wegen nach § 394 FamFG zu löschen. Die Frist zur Erhebung eines Widerspruchs gegen die beabsichtigte Löschung wird auf 3 Monate festgesetzt."
    },
    {
      "date": "2025-08-15",
      "id": "121439",
      "original_text": "Registerbekanntmachung nach dem Umwandlungsgesetz\nHessen Amtsgericht Frankfurt am Main HRB 91054\narenova GmbH – Frankfurt am Main",
      "type": "Registerbekanntmachung nach dem Umwandlungsgesetz",
      "state": "Hessen",
      "amtsgericht": "Amtsgericht Frankfurt am Main",
      "registernummer": "HRB 91054",
      "registerart": "HRB",
      "company_name": "arenova GmbH",
      "company_seat": "Frankfurt am Main",
      "details": "15.08.2025 (Bekanntmachungsdatum)\n\nHessen Amtsgericht Frankfurt am Main HRB 91054\nRegisterbekanntmachung nach dem Umwandlungsgesetz 14.08.2025 (Eintragungsdatum)\n\narenova GmbH\nGesellschaft mit beschränkter Haftung\nFrankfurt am Main\n\nDen Gläubigern der an der Verschmelzung beteiligten Rechtsträger ist, wenn sie binnen sechs Monaten nach dem Tag, an dem die Eintragung der Verschmelzung in das Register des Sitzes desjenigen Rechtsträgers, dessen Gläubiger sie sind, nach § 19 Absatz 3 UmwG bekannt gemacht worden ist, ihren Anspruch nach Grund und Höhe schriftlich anmelden, Sicherheit zu leisten, soweit sie nicht Befriedigung verlangen können. Dieses Recht steht den Gläubigern jedoch nur zu, wenn sie glaubhaft machen, dass durch die Verschmelzung die Erfüllung ihrer Forderung gefährdet wird."
    },
    {
      "date": "2025-08-15",
      "id": "121440",
      "original_text": "Registerbekanntmachung nach dem Umwandlungsgesetz\nHessen Amtsgericht Fulda HRB 5518\nRöhner Verwaltungsgesellschaft mbH – Fulda",
      "type": "Registerbekanntmachung nach dem Umwandlungsgesetz",
      "state": "Hessen",
      "amtsgericht": "Amtsgericht Fulda",
      "registernummer": "HRB 5518",
      "registerart": "HRB",
      "company_name": "Röhner Verwaltungsgesellschaft mbH",
      "company_seat": "Fulda",
      "details": "15.08.2025 (Bekanntmachungsdatum)\n\nHessen Amtsgericht Fulda HRB 5518\nRegisterbekanntmachung nach dem Umwandlungsgesetz 15.08.2025 (Eintragungsdatum)\n\nRöhner Verwaltungsgesellschaft mbH\nGesellschaft mit beschränkter Haftung\nFulda\n\nDen Gläubigern der an der Verschmelzung beteiligten Rechtsträger ist, wenn sie binnen sechs Monaten nach dem Tag, an dem die Eintragung der Verschmelzung in das Register des Sitzes desjenigen Rechtsträgers, dessen Gläubiger sie sind, nach § 19 Absatz 3 UmwG bekannt gemacht worden ist, ihren Anspruch nach Grund und Höhe schriftlich anmelden, Sicherheit zu leisten, soweit sie nicht Befriedigung verlangen können. Dieses Recht steht den Gläubigern jedoch nur zu, wenn sie glaubhaft machen, dass durch die Verschmelzung die Erfüllung ihrer Forderung gefährdet wird."
    },
    {
      "date": "2025-08-15",
      "id": "121441",
      "original_text": "Registerbekanntmachung nach dem Umwandlungsgesetz\nHessen Amtsgericht Frankfurt am Main HRB 79974\nMABA trading GmbH – Frankfurt am Main",
      "type": "Registerbekanntmachung nach dem Umwandlungsgesetz",
      "state": "Hessen",
      "amtsgericht": "Amtsgericht Frankfurt am Main",
      "registernummer": "HRB 79974",
      "registerart": "HRB",
      "company_name": "MABA trading GmbH",
      "company_seat": "Frankfurt am Main",
      "details": "15.08.2025 (Bekanntmachungsdatum)\n\nHessen Amtsgericht Frankfurt am Main HRB 79974\nRegisterbekanntmachung nach dem Umwandlungsgesetz 15.08.2025 (Eintragungsdatum)\n\nMABA trading GmbH\nGesellschaft mit beschränkter Haftung\nFrankfurt am Main\n\nDen Gläubigern der an der Verschmelzung beteiligten Rechtsträger ist, wenn sie binnen sechs Monaten nach dem Tag, an dem die Eintragung der Verschmelzung in das Register des Sitzes desjenigen Rechtsträgers, dessen Gläubiger sie sind, nach § 19 Absatz 3 UmwG bekannt gemacht worden ist, ihren Anspruch nach Grund und Höhe schriftlich anmelden, Sicherheit zu leisten, soweit sie nicht Befriedigung verlangen können. Dieses Recht steht den Gläubigern jedoch nur zu, wenn sie glaubhaft machen, dass durch die Verschmelzung die Erfüllung ihrer Forderung gefährdet wird."
    },
    {
      "date": "2025-08-15",
      "id": "121442",
      "original_text": "Registerbekanntmachung nach dem Umwandlungsgesetz\nHessen Amtsgericht Frankfurt am Main HRB 138768\nKaymakci Real Estate GmbH – Frankfurt am Main",
      "type": "Registerbekanntmachung nach dem Umwandlungsgesetz",
      "state": "Hessen",
      "amtsgericht": "Amtsgericht Frankfurt am Main",
      "registernummer": "HRB 138768",
      "registerart": "HRB",
      "company_name": "Kaymakci Real Estate GmbH",
      "company_seat": "Frankfurt am Main",
      "details": "15.08.2025 (Bekanntmachungsdatum)\n\nHessen Amtsgericht Frankfurt am Main HRB 138768\nRegisterbekanntmachung nach dem Umwandlungsgesetz 15.08.2025 (Eintragungsdatum)\n\nKaymakci Real Estate GmbH\nGesellschaft mit beschränkter Haftung\nFrankfurt am Main\n\nDen Gläubigern der an der Ausgliederung beteiligten Rechtsträger ist, wenn sie binnen sechs Monaten nach dem Tag, an dem die Eintragung der Ausgliederung in das Register des Sitzes desjenigen Rechtsträgers, dessen Gläubiger sie sind, nach §§ 125, 19 Absatz 3 UmwG bekannt gemacht worden ist, ihren Anspruch nach Grund und Höhe schriftlich anmelden, Sicherheit zu leisten, soweit sie nicht Befriedigung verlangen können. Dieses Recht steht den Gläubigern jedoch nur zu, wenn sie glaubhaft machen, dass durch die Ausgliederung die Erfüllung ihrer Forderung gefährdet wird."
    },
    {
      "date": "2025-08-15",
      "id": "121443",
      "original_text": "Registerbekanntmachung nach dem Umwandlungsgesetz\nHessen Amtsgericht Darmstadt HRA 6731\nBechtle GmbH & Co. KG – Darmstadt",
      "type": "Registerbekanntmachung nach dem Umwandlungsgesetz",
      "state": "Hessen",
      "amtsgericht": "Amtsgericht Darmstadt",
      "registernummer": "HRA 6731",
      "registerart": "HRA",
      "company_name": "Bechtle GmbH & Co. KG",
      "company_seat": "Darmstadt",
      "details": "15.08.2025 (Bekanntmachungsdatum)\n\nHessen Amtsgericht Darmstadt HRA 6731\nRegisterbekanntmachung nach dem Umwandlungsgesetz 15.08.2025 (Eintragungsdatum)\n\nBechtle GmbH & Co. KG\nKommanditgesellschaft\nDarmstadt\n\nDen Gläubigern der an der Verschmelzung beteiligten Rechtsträger ist, wenn sie binnen sechs Monaten nach dem Tag, an dem die Eintragung der Verschmelzung in das Register des Sitzes desjenigen Rechtsträgers, dessen Gläubiger sie sind, nach § 19 Absatz 3 UmwG bekannt gemacht worden ist, ihren Anspruch nach Grund und Höhe schriftlich anmelden, Sicherheit zu leisten, soweit sie nicht Befriedigung verlangen können. Dieses Recht steht den Gläubigern jedoch nur zu, wenn sie glaubhaft machen, dass durch die Verschmelzung die Erfüllung ihrer Forderung gefährdet wird."
    },
    {
      "date": "2025-08-15",
      "id": "121444",
      "original_text": "Registerbekanntmachung nach dem Umwandlungsgesetz\nHessen Amtsgericht Darmstadt HRB 105012\nE.V.A. Vertriebs- und Verwaltungs-GmbH – Darmstadt",
      "type": "Registerbekanntmachung nach dem Umwandlungsgesetz",
      "state": "Hessen",
      "amtsgericht": "Amtsgericht Darmstadt",
      "registernummer": "HRB 105012",
      "registerart": "HRB",
      "company_name": "E.V.A. Vertriebs- und Verwaltungs-GmbH",
      "company_seat": "Darmstadt",
      "details": "15.08.2025 (Bekanntmachungsdatum)\n\nHessen Amtsgericht Darmstadt HRB 105012\nRegisterbekanntmachung nach dem Umwandlungsgesetz 15.08.2025 (Eintragungsdatum)\n\nE.V.A. Vertriebs- und Verwaltungs-GmbH\nGesellschaft mit beschränkter Haftung\nDarmstadt\n\nDen Gläubigern der an der Verschmelzung beteiligten Rechtsträger ist, wenn sie binnen sechs Monaten nach dem Tag, an dem die Eintragung der Verschmelzung in das Register des Sitzes derjenigen Rechtsträger deren Gläubiger sie sind, nach § 19 Absatz 3 UmwG bekannt gemacht worden ist, ihren Anspruch nach Grund und Höhe schriftlich anmelden, Sicherheit zu leisten, soweit sie nicht Befriedigung verlangen können. Dieses Recht steht den Gläubigern jedoch nur zu, wenn sie glaubhaft machen, dass durch die Verschmelzung die Erfüllung ihrer Forderung gefährdet wird."
    },
    {
      "date": "2025-08-15",
      "id": "121445",
      "original_text": "Registerbekanntmachung nach dem Umwandlungsgesetz\nHessen Amtsgericht Fulda HRB 6498\nMR Industrie Holding GmbH – Fulda",
      "type": "Registerbekanntmachung nach dem Umwandlungsgesetz",
      "state": "Hessen",
      "amtsgericht": "Amtsgericht Fulda",
      "registernummer": "HRB 6498",
      "registerart": "HRB",
      "company_name": "MR Industrie Holding GmbH",
      "company_seat": "Fulda",
      "details": "15.08.2025 (Bekanntmachungsdatum)\n\nHessen Amtsgericht Fulda HRB 6498\nRegisterbekanntmachung nach dem Umwandlungsgesetz 15.08.2025 (Eintragungsdatum)\n\nMR Industrie Holding GmbH\nGesellschaft mit beschränkter Haftung\nFulda\n\nDen Gläubigern der an der Verschmelzung beteiligten Rechtsträger ist, wenn sie binnen sechs Monaten nach dem Tag, an dem die Eintragung der Verschmelzung in das Register des Sitzes desjenigen Rechtsträgers, dessen Gläubiger sie sind, nach § 19 Absatz 3 UmwG bekannt gemacht worden ist, ihren Anspruch nach Grund und Höhe schriftlich anmelden, Sicherheit zu leisten, soweit sie nicht Befriedigung verlangen können. Dieses Recht steht den Gläubigern jedoch nur zu, wenn sie glaubhaft machen, dass durch die Verschmelzung die Erfüllung ihrer Forderung gefährdet wird."
    },
    {
      "date": "2025-08-15",
      "id": "121446",
      "original_text": "Sonstige Registerbekanntmachung\nHessen Amtsgericht Darmstadt VR 30752\nFreundeskreis Segelfluggelände Reinheim/Odw. e.V. – Reinheim",
      "type": "Sonstige Registerbekanntmachung",
      "state": "Hessen",
      "amtsgericht": "Amtsgericht Darmstadt",
      "registernummer": "VR 30752",
      "registerart": "VR",
      "company_name": "Freundeskreis Segelfluggelände Reinheim/Odw. e.V.",
      "company_seat": "Reinheim",
      "details": "15.08.2025 (Bekanntmachungsdatum)\n\nHessen Amtsgericht Darmstadt VR 30752\nSonstige Registerbekanntmachung 15.08.2025 (Eintragungsdatum)\n\nFreundeskreis Segelfluggelände Reinheim/Odw. e.V.\neingetragener Verein\nReinheim\n\nDer Verein ist aufgelöst."
    },
    {
      "date": "2025-08-15",
      "id": "121447",
      "original_text": "Registerbekanntmachung nach dem Umwandlungsgesetz\nHessen Amtsgericht Wiesbaden HRB 29290\nHessen Kapital II GmbH – Wiesbaden",
      "type": "Registerbekanntmachung nach dem Umwandlungsgesetz",
      "state": "Hessen",
      "amtsgericht": "Amtsgericht Wiesbaden",
      "registernummer": "HRB 29290",
      "registerart": "HRB",
      "company_name": "Hessen Kapital II GmbH",
      "company_seat": "Wiesbaden",
      "details": "15.08.2025 (Bekanntmachungsdatum)\n\nHessen Amtsgericht Wiesbaden HRB 29290\nRegisterbekanntmachung nach dem Umwandlungsgesetz 15.08.2025 (Eintragungsdatum)\n\nHessen Kapital II GmbH\nGesellschaft mit beschränkter Haftung\nWiesbaden\n\nDen Gläubigern der an der Verschmelzung beteiligten Rechtsträger ist, wenn sie binnen sechs Monaten nach dem Tag, an dem die Eintragung der Verschmelzung in das Register des Sitzes desjenigen Rechtsträgers, dessen Gläubiger sie sind, nach § 19 Absatz 3 UmwG bekannt gemacht worden ist, ihren Anspruch nach Grund und Höhe schriftlich anmelden, Sicherheit zu leisten, soweit sie nicht Befriedigung verlangen können. Dieses Recht steht den Gläubigern jedoch nur zu, wenn sie glaubhaft machen, dass durch die Verschmelzung die Erfüllung ihrer Forderung gefährdet wird."
    },
    {
      "date": "2025-08-15",
      "id": "121448",
      "original_text": "Registerbekanntmachung nach dem Umwandlungsgesetz\nHessen Amtsgericht Frankfurt am Main HRA 54314\nKaymakci Real Estate & Trading e.K. – Frankfurt am Main",
      "type": "Registerbekanntmachung nach dem Umwandlungsgesetz",
      "state": "Hessen",
      "amtsgericht": "Amtsgericht Frankfurt am Main",
      "registernummer": "HRA 54314",
      "registerart": "HRA",
      "company_name": "Kaymakci Real Estate & Trading e.K.",
      "company_seat": "Frankfurt am Main",
      "details": "15.08.2025 (Bekanntmachungsdatum)\n\nHessen Amtsgericht Frankfurt am Main HRA 54314\nRegisterbekanntmachung nach dem Umwandlungsgesetz 15.08.2025 (Eintragungsdatum)\n\nKaymakci Real Estate & Trading e.K.\nEinzelkaufmann / Einzelkauffrau\nFrankfurt am Main\n\nDen Gläubigern der an der Ausgliederung beteiligten Rechtsträger ist, wenn sie binnen sechs Monaten nach dem Tag, an dem die Eintragung der Ausgliederung in das Register des Sitzes desjenigen Rechtsträgers, dessen Gläubiger sie sind, nach §§ 125, 19 Absatz 3 UmwG bekannt gemacht worden ist, ihren Anspruch nach Grund und Höhe schriftlich anmelden, Sicherheit zu leisten, soweit sie nicht Befriedigung verlangen können. Dieses Recht steht den Gläubigern jedoch nur zu, wenn sie glaubhaft machen, dass durch die Ausgliederung die Erfüllung ihrer Forderung gefährdet wird."
    },
    {
      "date": "2025-08-15",
      "id": "121449",
      "original_text": "Registerbekanntmachung nach dem Umwandlungsgesetz\nHessen Amtsgericht Gießen HRA 4983\nDemir Immobilien GmbH & Co. KG – Buseck",
      "type": "Registerbekanntmachung nach dem Umwandlungsgesetz",
      "state": "Hessen",
      "amtsgericht": "Amtsgericht Gießen",
      "registernummer": "HRA 4983",
      "registerart": "HRA",
      "company_name": "Demir Immobilien GmbH & Co. KG",
      "company_seat": "Buseck",
      "details": "15.08.2025 (Bekanntmachungsdatum)\n\nHessen Amtsgericht Gießen HRA 4983\nRegisterbekanntmachung nach dem Umwandlungsgesetz 15.08.2025 (Eintragungsdatum)\n\nDemir Immobilien GmbH & Co. KG\nKommanditgesellschaft\nBuseck\n\nDen Gläubigern der an der formwechselnden Umwandlung beteiligten Rechtsträger ist, wenn sie binnen sechs Monaten nach dem Tag, an dem die Eintragung der formwechselnden Umwandlung in das Register des Sitzes desjenigen Rechtsträgers, dessen Gläubiger sie sind, nach § 201 UmwG bekannt gemacht worden ist, ihren Anspruch nach Grund und Höhe schriftlich anmelden, Sicherheit zu leisten, soweit sie nicht Befriedigung verlangen können. Dieses Recht steht den Gläubigern jedoch nur zu, wenn sie glaubhaft machen, dass durch die formwechselnde Umwandlung die Erfüllung ihrer Forderung gefährdet wird."
    },
    {
      "date": "2025-08-15",
      "id": "121450",
      "original_text": "Einreichung neuer Dokumente\nHessen Amtsgericht Wiesbaden HRB 30486\ncomforte AG – Wiesbaden",
      "type": "Einreichung neuer Dokumente",
      "state": "Hessen",
      "amtsgericht": "Amtsgericht Wiesbaden",
      "registernummer": "HRB 30486",
      "registerart": "HRB",
      "company_name": "comforte AG",
      "company_seat": "Wiesbaden",
      "details": "15.08.2025 (Bekanntmachungsdatum)\n\nHessen Amtsgericht Wiesbaden HRB 30486\nEinreichung neuer Dokumente\n\ncomforte AG\nAktiengesellschaft\nWiesbaden\n\nDurch eine Änderung in den Personen der Aufsichtsratsmitglieder ist eine Liste der Mitglieder des Aufsichtsrates zum Handelsregister eingereicht worden."
    },
    {
      "date": "2025-08-15",
      "id": "121451",
      "original_text": "Registerbekanntmachung nach dem Umwandlungsgesetz\nHessen Amtsgericht Fulda HRB 5979\nMR Projektgesellschaft mbH – Fulda",
      "type": "Registerbekanntmachung nach dem Umwandlungsgesetz",
      "state": "Hessen",
      "amtsgericht": "Amtsgericht Fulda",
      "registernummer": "HRB 5979",
      "registerart": "HRB",
      "company_name": "MR Projektgesellschaft mbH",
      "company_seat": "Fulda",
      "details": "15.08.2025 (Bekanntmachungsdatum)\n\nHessen Amtsgericht Fulda HRB 5979\nRegisterbekanntmachung nach dem Umwandlungsgesetz 15.08.2025 (Eintragungsdatum)\n\nMR Projektgesellschaft mbH\nGesellschaft mit beschränkter Haftung\nFulda\n\nDen Gläubigern der an der Verschmelzung beteiligten Rechtsträger ist, wenn sie binnen sechs Monaten nach dem Tag, an dem die Eintragung der Verschmelzung in das Register des Sitzes desjenigen Rechtsträgers, dessen Gläubiger sie sind, nach § 19 Absatz 3 UmwG bekannt gemacht worden ist, ihren Anspruch nach Grund und Höhe schriftlich anmelden, Sicherheit zu leisten, soweit sie nicht Befriedigung verlangen können. Dieses Recht steht den Gläubigern jedoch nur zu, wenn sie glaubhaft machen, dass durch die Verschmelzung die Erfüllung ihrer Forderung gefährdet wird."
    },
    {
      "date": "2025-08-15",
      "id": "121452",
      "original_text": "Registerbekanntmachung nach dem Umwandlungsgesetz\nHessen Amtsgericht Fulda HRB 6197\nFemmi Verwaltungsgesellschaft mbH – Fulda",
      "type": "Registerbekanntmachung nach dem Umwandlungsgesetz",
      "state": "Hessen",
      "amtsgericht": "Amtsgericht Fulda",
      "registernummer": "HRB 6197",
      "registerart": "HRB",
      "company_name": "Femmi Verwaltungsgesellschaft mbH",
      "company_seat": "Fulda",
      "details": "15.08.2025 (Bekanntmachungsdatum)\n\nHessen Amtsgericht Fulda HRB 6197\nRegisterbekanntmachung nach dem Umwandlungsgesetz 15.08.2025 (Eintragungsdatum)\n\nFemmi Verwaltungsgesellschaft mbH\nGesellschaft mit beschränkter Haftung\nFulda\n\nDen Gläubigern der an der Verschmelzung beteiligten Rechtsträger ist, wenn sie binnen sechs Monaten nach dem Tag, an dem die Eintragung der Verschmelzung in das Register des Sitzes desjenigen Rechtsträgers, dessen Gläubiger sie sind, nach § 19 Absatz 3 UmwG bekannt gemacht worden ist, ihren Anspruch nach Grund und Höhe schriftlich anmelden, Sicherheit zu leisten, soweit sie nicht Befriedigung verlangen können. Dieses Recht steht den Gläubigern jedoch nur zu, wenn sie glaubhaft machen, dass durch die Verschmelzung die Erfüllung ihrer Forderung gefährdet wird."
    },
    {
      "date": "2025-08-15",
      "id": "121453",
      "original_text": "Registerbekanntmachung nach dem Umwandlungsgesetz\nHessen Amtsgericht Wiesbaden HRA 11843\nSprühen Gebäudedienste e.K. – Wiesbaden",
      "type": "Registerbekanntmachung nach dem Umwandlungsgesetz",
      "state": "Hessen",
      "amtsgericht": "Amtsgericht Wiesbaden",
      "registernummer": "HRA 11843",
      "registerart": "HRA",
      "company_name": "Sprühen Gebäudedienste e.K.",
      "company_seat": "Wiesbaden",
      "details": "15.08.2025 (Bekanntmachungsdatum)\n\nHessen Amtsgericht Wiesbaden HRA 11843\nRegisterbekanntmachung nach dem Umwandlungsgesetz 15.08.2025 (Eintragungsdatum)\n\nSprühen Gebäudedienste e.K.\nEinzelkaufmann / Einzelkauffrau\nWiesbaden\n\nDen Gläubigern der an der Ausgliederung beteiligten Rechtsträger ist, wenn sie binnen sechs Monaten nach dem Tag, an dem die Eintragung der Ausgliederung in das Register des Sitzes derjenigen Rechtsträger deren Gläubiger sie sind, nach §§ 125, 19 Absatz 3 UmwG bekannt gemacht worden ist, ihren Anspruch nach Grund und Höhe schriftlich anmelden, Sicherheit zu leisten, soweit sie nicht Befriedigung verlangen können. Dieses Recht steht den Gläubigern jedoch nur zu, wenn sie glaubhaft machen, dass durch die Ausgliederung die Erfüllung ihrer Forderung gefährdet wird."
    },
    {
      "date": "2025-08-15",
      "id": "121454",
      "original_text": "Löschungsankündigung\nHessen Amtsgericht Frankfurt am Main HRB 74180\nYoumex AG – Frankfurt am Main",
      "type": "Löschungsankündigung",
      "state": "Hessen",
      "amtsgericht": "Amtsgericht Frankfurt am Main",
      "registernummer": "HRB 74180",
      "registerart": "HRB",
      "company_name": "Youmex AG",
      "company_seat": "Frankfurt am Main",
      "details": "15.08.2025 (Bekanntmachungsdatum)\n\nHessen Amtsgericht Frankfurt am Main HRB 74180\nLöschungsankündigung 15.08.2025 (Eintragungsdatum)\n\nYoumex AG\nAktiengesellschaft\nFrankfurt am Main\n\nDas Registergericht beabsichtigt die im Handelsregister eingetragene Gesellschaft von Amts wegen nach § 394 FamFG zu löschen. Die Frist zur Erhebung eines Widerspruchs gegen die beabsichtigte Löschung wird auf 1 Monat festgesetzt."
    },
    {
      "date": "2025-08-15",
      "id": "121455",
      "original_text": "Einreichung neuer Dokumente\nHessen Amtsgericht Hanau HRB 99420\nBWMK gGmbH – Gelnhausen",
      "type": "Einreichung neuer Dokumente",
      "state": "Hessen",
      "amtsgericht": "Amtsgericht Hanau",
      "registernummer": "HRB 99420",
      "registerart": "HRB",
      "company_name": "BWMK gGmbH",
      "company_seat": "Gelnhausen",
      "details": "15.08.2025 (Bekanntmachungsdatum)\n\nHessen Amtsgericht Hanau HRB 99420\nEinreichung neuer Dokumente\n\nBWMK gGmbH\nGesellschaft mit beschränkter Haftung\nGelnhausen\n\nDurch eine Änderung in den Personen der Aufsichtsratsmitglieder ist eine Liste der Mitglieder des Aufsichtsrates zum Handelsregister eingereicht worden."
    },
    {
      "date": "2025-08-15",
      "id": "121456",
      "original_text": "Registerbekanntmachung nach dem Umwandlungsgesetz\nHessen Amtsgericht Wiesbaden HRB 36008\nSprühen Gebäudemanagement GmbH – Wiesbaden",
      "type": "Registerbekanntmachung nach dem Umwandlungsgesetz",
      "state": "Hessen",
      "amtsgericht": "Amtsgericht Wiesbaden",
      "registernummer": "HRB 36008",
      "registerart": "HRB",
      "company_name": "Sprühen Gebäudemanagement GmbH",
      "company_seat": "Wiesbaden",
      "details": "15.08.2025 (Bekanntmachungsdatum)\n\nHessen Amtsgericht Wiesbaden HRB 36008\nRegisterbekanntmachung nach dem Umwandlungsgesetz 15.08.2025 (Eintragungsdatum)\n\nSprühen Gebäudemanagement GmbH\nGesellschaft mit beschränkter Haftung\nWiesbaden\n\nDen Gläubigern der an der Ausgliederung beteiligten Rechtsträger ist, wenn sie binnen sechs Monaten nach dem Tag, an dem die Eintragung der Ausgliederung in das Register des Sitzes derjenigen Rechtsträger deren Gläubiger sie sind, nach §§ 125, 19 Absatz 3 UmwG bekannt gemacht worden ist, ihren Anspruch nach Grund und Höhe schriftlich anmelden, Sicherheit zu leisten, soweit sie nicht Befriedigung verlangen können. Dieses Recht steht den Gläubigern jedoch nur zu, wenn sie glaubhaft machen, dass durch die Ausgliederung die Erfüllung ihrer Forderung gefährdet wird."
    },
    {
      "date": "2025-08-15",
      "id": "121457",
      "original_text": "Registerbekanntmachung nach dem Umwandlungsgesetz\nHessen Amtsgericht Frankfurt am Main HRB 126820\nKinder in der Stadt - KidS Frankfurt gemeinnützige GmbH – Frankfurt am Main",
      "type": "Registerbekanntmachung nach dem Umwandlungsgesetz",
      "state": "Hessen",
      "amtsgericht": "Amtsgericht Frankfurt am Main",
      "registernummer": "HRB 126820",
      "registerart": "HRB",
      "company_name": "Kinder in der Stadt - KidS Frankfurt gemeinnützige GmbH",
      "company_seat": "Frankfurt am Main",
      "details": "15.08.2025 (Bekanntmachungsdatum)\n\nHessen Amtsgericht Frankfurt am Main HRB 126820\nRegisterbekanntmachung nach dem Umwandlungsgesetz 15.08.2025 (Eintragungsdatum)\n\nKinder in der Stadt - KidS Frankfurt gemeinnützige GmbH\nGesellschaft mit beschränkter Haftung\nFrankfurt am Main\n\nDen Gläubigern der an der Ausgliederung beteiligten Rechtsträger ist, wenn sie binnen sechs Monaten nach dem Tag, an dem die Eintragung der Ausgliederung in das Register des Sitzes desjenigen Rechtsträgers, dessen Gläubiger sie sind, nach §§ 125, 19 Absatz 3 UmwG bekannt gemacht worden ist, ihren Anspruch nach Grund und Höhe schriftlich anmelden, Sicherheit zu leisten, soweit sie nicht Befriedigung verlangen können. Dieses Recht steht den Gläubigern jedoch nur zu, wenn sie glaubhaft machen, dass durch die Ausgliederung die Erfüllung ihrer Forderung gefährdet wird."
    },
    {
      "date": "2025-08-15",
      "id": "121458",
      "original_text": "Löschungsankündigung\nHessen Amtsgericht Frankfurt am Main HRB 85324\nAl Hoceima Unternehmergesellschaft (haftungsbeschränkt) – Frankfurt am Main",
      "type": "Löschungsankündigung",
      "state": "Hessen",
      "amtsgericht": "Amtsgericht Frankfurt am Main",
      "registernummer": "HRB 85324",
      "registerart": "HRB",
      "company_name": "Al Hoceima Unternehmergesellschaft (haftungsbeschränkt)",
      "company_seat": "Frankfurt am Main",
      "details": "15.08.2025 (Bekanntmachungsdatum)\n\nHessen Amtsgericht Frankfurt am Main HRB 85324\nLöschungsankündigung\n\nAl Hoceima Unternehmergesellschaft (haftungsbeschränkt)\nGesellschaft mit beschränkter Haftung\nFrankfurt am Main\n\nDas Registergericht beabsichtigt die im Handelsregister eingetragene Gesellschaft von Amts wegen nach § 394 FamFG zu löschen. Die Frist zur Erhebung eines Widerspruchs gegen die beabsichtigte Löschung wird auf 1 Monat festgesetzt."
    },
    {
      "date": "2025-08-15",
      "id": "121459",
      "original_text": "Löschungsankündigung\nHessen Amtsgericht Darmstadt HRB 103471\nSEIDABEI Impfzentrum GmbH – Weiterstadt",
      "type": "Löschungsankündigung",
      "state": "Hessen",
      "amtsgericht": "Amtsgericht Darmstadt",
      "registernummer": "HRB 103471",
      "registerart": "HRB",
      "company_name": "SEIDABEI Impfzentrum GmbH",
      "company_seat": "Weiterstadt",
      "details": "15.08.2025 (Bekanntmachungsdatum)\n\nHessen Amtsgericht Darmstadt HRB 103471\nLöschungsankündigung 15.08.2025 (Eintragungsdatum)\n\nSEIDABEI Impfzentrum GmbH\nGesellschaft mit beschränkter Haftung\nWeiterstadt\n\nDas Registergericht beabsichtigt die im Handelsregister eingetragene Gesellschaft von Amts wegen nach § 394 FamFG zu löschen. Die Frist zur Erhebung eines Widerspruchs gegen die beabsichtigte Löschung wird auf 3 Monate festgesetzt."
    },
    {
      "date": "2025-08-15",
      "id": "121460",
      "original_text": "Löschungsankündigung\nHessen Amtsgericht Wiesbaden HRB 29967\nAGL GmbH Allgemeiner Grundstücks- und Liegenschaftsservice – Bad Schwalbach",
      "type": "Löschungsankündigung",
      "state": "Hessen",
      "amtsgericht": "Amtsgericht Wiesbaden",
      "registernummer": "HRB 29967",
      "registerart": "HRB",
      "company_name": "AGL GmbH Allgemeiner Grundstücks- und Liegenschaftsservice",
      "company_seat": "Bad Schwalbach",
      "details": "15.08.2025 (Bekanntmachungsdatum)\n\nHessen Amtsgericht Wiesbaden HRB 29967\nLöschungsankündigung\n\nAGL GmbH Allgemeiner Grundstücks- und Liegenschaftsservice\nGesellschaft mit beschränkter Haftung\nBad Schwalbach\n\nDas Registergericht beabsichtigt die im Handelsregister eingetragene Gesellschaft von Amts wegen nach § 394 FamFG zu löschen. Die Frist zur Erhebung eines Widerspruchs gegen die beabsichtigte Löschung wird auf 3 Monate festgesetzt."
    },
    {
      "date": "2025-08-15",
      "id": "121461",
      "original_text": "Registerbekanntmachung nach dem Umwandlungsgesetz\nHessen Amtsgericht Bad Homburg v.d.H. HRB 7367\nFresenius Kabi Deutschland GmbH – Bad Homburg v. d. Höhe",
      "type": "Registerbekanntmachung nach dem Umwandlungsgesetz",
      "state": "Hessen",
      "amtsgericht": "Amtsgericht Bad Homburg v.d.H.",
      "registernummer": "HRB 7367",
      "registerart": "HRB",
      "company_name": "Fresenius Kabi Deutschland GmbH",
      "company_seat": "Bad Homburg v. d. Höhe",
      "details": "15.08.2025 (Bekanntmachungsdatum)\n\nHessen Amtsgericht Bad Homburg v.d.H. HRB 7367\nRegisterbekanntmachung nach dem Umwandlungsgesetz 15.08.2025 (Eintragungsdatum)\n\nFresenius Kabi Deutschland GmbH\nGesellschaft mit beschränkter Haftung\nBad Homburg v. d. Höhe\n\nDen Gläubigern der an der Verschmelzung beteiligten Rechtsträger ist, wenn sie binnen sechs Monaten nach dem Tag, an dem die Eintragung der Verschmelzung in das Register des Sitzes desjenigen Rechtsträgers, dessen Gläubiger sie sind, nach § 19 Absatz 3 UmwG bekannt gemacht worden ist, ihren Anspruch nach Grund und Höhe schriftlich anmelden, Sicherheit zu leisten, soweit sie nicht Befriedigung verlangen können. Dieses Recht steht den Gläubigern jedoch nur zu, wenn sie glaubhaft machen, dass durch die Verschmelzung die Erfüllung ihrer Forderung gefährdet wird."
    },
    {
      "date": "2025-08-15",
      "id": "121462",
      "original_text": "Registerbekanntmachung nach dem Umwandlungsgesetz\nHessen Amtsgericht Fulda HRB 6498\nMR Industrie Holding GmbH – Fulda",
      "type": "Registerbekanntmachung nach dem Umwandlungsgesetz",
      "state": "Hessen",
      "amtsgericht": "Amtsgericht Fulda",
      "registernummer": "HRB 6498",
      "registerart": "HRB",
      "company_name": "MR Industrie Holding GmbH",
      "company_seat": "Fulda",
      "details": "15.08.2025 (Bekanntmachungsdatum)\n\nHessen Amtsgericht Fulda HRB 6498\nRegisterbekanntmachung nach dem Umwandlungsgesetz 15.08.2025 (Eintragungsdatum)\n\nMR Industrie Holding GmbH\nGesellschaft mit beschränkter Haftung\nFulda\n\nDen Gläubigern der an der Verschmelzung beteiligten Rechtsträger ist, wenn sie binnen sechs Monaten nach dem Tag, an dem die Eintragung der Verschmelzung in das Register des Sitzes desjenigen Rechtsträgers, dessen Gläubiger sie sind, nach § 19 Absatz 3 UmwG bekannt gemacht worden ist, ihren Anspruch nach Grund und Höhe schriftlich anmelden, Sicherheit zu leisten, soweit sie nicht Befriedigung verlangen können. Dieses Recht steht den Gläubigern jedoch nur zu, wenn sie glaubhaft machen, dass durch die Verschmelzung die Erfüllung ihrer Forderung gefährdet wird."
    },
    {
      "date": "2025-08-15",
      "id": "121463",
      "original_text": "Registerbekanntmachung nach dem Umwandlungsgesetz\nHessen Amtsgericht Fulda HRB 6498\nMR Industrie Holding GmbH – Fulda",
      "type": "Registerbekanntmachung nach dem Umwandlungsgesetz",
      "state": "Hessen",
      "amtsgericht": "Amtsgericht Fulda",
      "registernummer": "HRB 6498",
      "registerart": "HRB",
      "company_name": "MR Industrie Holding GmbH",
      "company_seat": "Fulda",
      "details": "15.08.2025 (Bekanntmachungsdatum)\n\nHessen Amtsgericht Fulda HRB 6498\nRegisterbekanntmachung nach dem Umwandlungsgesetz 15.08.2025 (Eintragungsdatum)\n\nMR Industrie Holding GmbH\nGesellschaft mit beschränkter Haftung\nFulda\n\nDen Gläubigern der an der Verschmelzung beteiligten Rechtsträger ist, wenn sie binnen sechs Monaten nach dem Tag, an dem die Eintragung der Verschmelzung in das Register des Sitzes desjenigen Rechtsträgers, dessen Gläubiger sie sind, nach § 19 Absatz 3 UmwG bekannt gemacht worden ist, ihren Anspruch nach Grund und Höhe schriftlich anmelden, Sicherheit zu leisten, soweit sie nicht Befriedigung verlangen können. Dieses Recht steht den Gläubigern jedoch nur zu, wenn sie glaubhaft machen, dass durch die Verschmelzung die Erfüllung ihrer Forderung gefährdet wird."
    },
    {
      "date": "2025-08-15",
      "id": "121464",
      "original_text": "Registerbekanntmachung nach dem Umwandlungsgesetz\nHessen Amtsgericht Frankfurt am Main VR 9911\nKinder in der Stadt, KIDS Frankfurt – Frankfurt am Main",
      "type": "Registerbekanntmachung nach dem Umwandlungsgesetz",
      "state": "Hessen",
      "amtsgericht": "Amtsgericht Frankfurt am Main",
      "registernummer": "VR 9911",
      "registerart": "VR",
      "company_name": "Kinder in der Stadt, KIDS Frankfurt",
      "company_seat": "Frankfurt am Main",
      "details": "15.08.2025 (Bekanntmachungsdatum)\n\nHessen Amtsgericht Frankfurt am Main VR 9911\nRegisterbekanntmachung nach dem Umwandlungsgesetz 15.08.2025 (Eintragungsdatum)\n\nKinder in der Stadt, KIDS Frankfurt\neingetragener Verein\nFrankfurt am Main\n\nDen Gläubigern der an der Ausgliederung beteiligten Rechtsträger ist, wenn sie binnen sechs Monaten nach dem Tag, an dem die Eintragung der Ausgliederung in das Register des Sitzes desjenigen Rechtsträgers, dessen Gläubiger sie sind, nach §§ 125, 19 Absatz 3 UmwG bekannt gemacht worden ist, ihren Anspruch nach Grund und Höhe schriftlich anmelden, Sicherheit zu leisten, soweit sie nicht Befriedigung verlangen können. Dieses Recht steht den Gläubigern jedoch nur zu, wenn sie glaubhaft machen, dass durch die Ausgliederung die Erfüllung ihrer Forderung gefährdet wird."
    }
  ]
}