{
  "date": "2025-08-10",
  "date_of_scrape": "2025-08-28T18:09:56.682Z",
  "tool_version": "0.2.0",
  "number_of_announcements": 2,
  "announcements": [
    {
      "date": "2025-08-10",
      "id": "120280",
      "original_text": "Registerbekanntmachung nach dem Umwandlungsgesetz\nHamburg Amtsgericht Hamburg HRA 132097\nConor Furphy UG (haftungsbeschränkt) & Challi Kanteh UG (haftungsbeschränkt) OHG – Hamburg",
      "type": "Registerbekanntmachung nach dem Umwandlungsgesetz",
      "state": "Hamburg",
      "amtsgericht": "Amtsgericht Hamburg",
      "registernummer": "HRA 132097",
      "registerart": "HRA",
      "company_name": "Conor Furphy UG (haftungsbeschränkt) & Challi Kanteh UG (haftungsbeschränkt) OHG",
      "company_seat": "Hamburg",
      "details": "10.08.2025 (Bekanntmachungsdatum)\n\nHamburg Amtsgericht Hamburg HRA 132097\nRegisterbekanntmachung nach dem Umwandlungsgesetz 10.08.2025 (Eintragungsdatum)\n\nConor Furphy UG (haftungsbeschränkt) & Challi Kanteh UG (haftungsbeschränkt) OHG\nOffene Handelsgesellschaft\nHamburg\n\nAls nicht eingetragen wird bekannt gemacht:\nDen Gläubigern der an der formwechselnden Umwandlung beteiligten Gesellschaften ist, wenn sie binnen sechs Monaten nach dem Tag, an dem die Eintragung der formwechselnden Umwandlung in das Register des Sitzes desjenigen Rechtsträgers, dessen Gläubiger sie sind, nach § 19 Absatz 3 UmwG als bekannt gemacht gilt, ihren Anspruch nach Grund und Höhe schriftlich anmelden, Sicherheit zu leisten, soweit sie nicht Befriedigung verlangen können. Dieses Recht steht den Gläubigern jedoch nur zu, wenn sie glaubhaft machen, dass durch die formwechselnde Umwandlung die Erfüllung ihrer Forderung gefährdet wird."
    },
    {
      "date": "2025-08-10",
      "id": "120281",
      "original_text": "Einreichung neuer Dokumente\nNordrhein-Westfalen Amtsgericht Paderborn HRB 16185\nSeniorat Salzkotten GmbH – Salzkotten",
      "type": "Einreichung neuer Dokumente",
      "state": "Nordrhein-Westfalen",
      "amtsgericht": "Amtsgericht Paderborn",
      "registernummer": "HRB 16185",
      "registerart": "HRB",
      "company_name": "Seniorat Salzkotten GmbH",
      "company_seat": "Salzkotten",
      "details": "10.08.2025 (Bekanntmachungsdatum)\n\nNordrhein-Westfalen Amtsgericht Paderborn HRB 16185\nEinreichung neuer Dokumente 10.08.2025 (Eintragungsdatum)\n\nSeniorat Salzkotten GmbH\nGesellschaft mit beschränkter Haftung\nSalzkotten\n\nAls nicht eingetragen wird veröffentlicht: Den Gläubigern der Gesellschaft, deren Forderungen begründet worden sind bevor die Eintragung der Beendigung des Beherrschungs- und Gewinnabführungsvertrages  in das Handelsregister nach § 10 des Handelsgesetzbuches als bekanntgemacht gilt, hat der andere Vertragsteil Sicherheit zu leisten, wenn sie sich binnen sechs Monaten nach der Bekanntmachung der Eintragung zu diesem Zweck bei ihm melden."
    }
  ]
}