{
  "date": "2024-10-24",
  "date_of_scrape": "2024-11-30T15:30:02.874Z",
  "tool_version": "0.2.0",
  "number_of_announcements": 157,
  "announcements": [
    {
      "date": "2024-10-24",
      "id": "62",
      "original_text": "Sonderregisterbekanntmachung OHNE Bezug zum elektr. Register\nSachsen-Anhalt Amtsgericht Stendal\n65 AR 99/21\nStadtgruppe der Kleingärtner im Reichsbund der Kleingärtner und Kleinsiedler Deutschlands e.V.",
      "type": "Sonderregisterbekanntmachung OHNE Bezug zum elektr. Register",
      "state": "Sachsen-Anhalt",
      "amtsgericht": "Amtsgericht Stendal",
      "company_name": "Stadtgruppe der Kleingärtner im Reichsbund der Kleingärtner und Kleinsiedler Deutschlands e.V.",
      "sonderegister_referenz": "65 AR 99/21",
      "details": "24.10.2024 (Bekanntmachungsdatum)\n\nSachsen-Anhalt Amtsgericht Stendal\n65 AR 99/21\nSonderregisterbekanntmachung OHNE Bezug zum elektr. Register\n\nStadtgruppe der Kleingärtner im Reichsbund der Kleingärtner und Kleinsiedler Deutschlands e.V.\n\n65 AR 99/21:\nStadtgruppe der Kleingärtner im Reichsbund der Kleingärtner und Kleinsiedler Deutschlands e.V.,\nDessau-Roßlau: Hinsichtlich o.g. gelöschten Vereins ist beabsichtigt, Frau Rechtsanwältin Dr. Angela Müller-Boß, Leipzig zum Nachtragsliquidator mit beschränktem Wirkungskreis zu bestellen. Der Antrag kann bei berechtigtem Interesse beim Registergericht Stendal eingesehen werden.Die Frist zu Einreichung etwaiger Stellungnahmen bzw. Erhebung eines Widerspruchs wird auf 1 Monat festgesetzt."
    },
    {
      "date": "2024-10-24",
      "id": "91466",
      "original_text": "Löschungsankündigung\nBayern Amtsgericht München HRB 217071\nY & B Service GmbH – Taufkirchen",
      "type": "Löschungsankündigung",
      "state": "Bayern",
      "amtsgericht": "Amtsgericht München",
      "registernummer": "HRB 217071",
      "registerart": "HRB",
      "company_name": "Y & B Service GmbH",
      "company_seat": "Taufkirchen",
      "details": "24.10.2024 (Bekanntmachungsdatum)\n\nBayern Amtsgericht München HRB 217071\nLöschungsankündigung\n\nY & B Service GmbH\nGesellschaft mit beschränkter Haftung\nTaufkirchen\n\nDas Registergericht beabsichtigt, die im Handelsregister eingetragene Gesellschaft wegen Vermögenslosigkeit von Amts wegen nach § 394 FamFG zu löschen. Die Frist zur Erhebung eines Widerspruchs ist auf drei Monate festgesetzt."
    },
    {
      "date": "2024-10-24",
      "id": "91467",
      "original_text": "Registerbekanntmachung nach dem Umwandlungsgesetz\nBayern Amtsgericht München HRB 285105\nBergson Kultur GmbH – München",
      "type": "Registerbekanntmachung nach dem Umwandlungsgesetz",
      "state": "Bayern",
      "amtsgericht": "Amtsgericht München",
      "registernummer": "HRB 285105",
      "registerart": "HRB",
      "company_name": "Bergson Kultur GmbH",
      "company_seat": "München",
      "details": "24.10.2024 (Bekanntmachungsdatum)\n\nBayern Amtsgericht München HRB 285105\nRegisterbekanntmachung nach dem Umwandlungsgesetz 23.10.2024 (Eintragungsdatum)\n\nBergson Kultur GmbH\nGesellschaft mit beschränkter Haftung\nMünchen\n\nDen Gläubigern der an der Ausgliederung beteiligten Rechtsträger ist, wenn sie binnen sechs Monaten nach dem Tag, an dem die Eintragung der Ausgliederung in das Register des Sitzes desjenigen Rechtsträgers, dessen Gläubiger sie sind, nach §§ 125, 19 Abs. 3 UmwG als bekannt gemacht gilt, ihren Anspruch nach Grund und Höhe schriftlich anmelden, Sicherheit zu leisten, soweit sie nicht Befriedigung verlangen können. Dieses Recht steht den Gläubigern jedoch nur zu, wenn sie glaubhaft machen, dass durch die Ausgliederung die Erfüllung ihrer Forderung gefährdet wird."
    },
    {
      "date": "2024-10-24",
      "id": "91468",
      "original_text": "Löschungsankündigung\nBayern Amtsgericht München HRB 228734\nS.G.I. Solution Gestion Info GmbH – München",
      "type": "Löschungsankündigung",
      "state": "Bayern",
      "amtsgericht": "Amtsgericht München",
      "registernummer": "HRB 228734",
      "registerart": "HRB",
      "company_name": "S.G.I. Solution Gestion Info GmbH",
      "company_seat": "München",
      "details": "24.10.2024 (Bekanntmachungsdatum)\n\nBayern Amtsgericht München HRB 228734\nLöschungsankündigung 17.10.2024 (Eintragungsdatum)\n\nS.G.I. Solution Gestion Info GmbH\nGesellschaft mit beschränkter Haftung\nMünchen\n\nDas Registergericht beabsichtigt, die im Handelsregister eingetragene Gesellschaft wegen Vermögenslosigkeit von Amts wegen nach § 394 FamFG zu löschen. Die Frist zur Erhebung eines Widerspruchs ist auf drei Monate festgesetzt."
    },
    {
      "date": "2024-10-24",
      "id": "91469",
      "original_text": "Registerbekanntmachung nach dem Umwandlungsgesetz\nBayern Amtsgericht München HRB 282603\nPNZ A23 Beteiligungs GmbH – München",
      "type": "Registerbekanntmachung nach dem Umwandlungsgesetz",
      "state": "Bayern",
      "amtsgericht": "Amtsgericht München",
      "registernummer": "HRB 282603",
      "registerart": "HRB",
      "company_name": "PNZ A23 Beteiligungs GmbH",
      "company_seat": "München",
      "details": "24.10.2024 (Bekanntmachungsdatum)\n\nBayern Amtsgericht München HRB 282603\nRegisterbekanntmachung nach dem Umwandlungsgesetz 23.10.2024 (Eintragungsdatum)\n\nPNZ A23 Beteiligungs GmbH\nGesellschaft mit beschränkter Haftung\nMünchen\n\nDen Gläubigern der an der Verschmelzung beteiligten Rechtsträger ist, wenn sie binnen sechs Monaten nach dem Tag, an dem die Eintragung der Verschmelzung in das Register des Sitzes desjenigen Rechtsträgers, dessen Gläubiger sie sind, nach § 19 Abs. 3 UmwG als bekannt gemacht gilt, ihren Anspruch nach Grund und Höhe schriftlich anmelden, Sicherheit zu leisten, soweit sie nicht Befriedigung verlangen können. Dieses Recht steht den Gläubigern jedoch nur zu, wenn sie glaubhaft machen, dass durch die Verschmelzung die Erfüllung ihrer Forderung gefährdet wird."
    },
    {
      "date": "2024-10-24",
      "id": "91470",
      "original_text": "Löschungsankündigung\nBayern Amtsgericht München HRB 213851\nXXL-Gastro GmbH – Hohenbrunn",
      "type": "Löschungsankündigung",
      "state": "Bayern",
      "amtsgericht": "Amtsgericht München",
      "registernummer": "HRB 213851",
      "registerart": "HRB",
      "company_name": "XXL-Gastro GmbH",
      "company_seat": "Hohenbrunn",
      "details": "24.10.2024 (Bekanntmachungsdatum)\n\nBayern Amtsgericht München HRB 213851\nLöschungsankündigung 23.10.2024 (Eintragungsdatum)\n\nXXL-Gastro GmbH\nGesellschaft mit beschränkter Haftung\nHohenbrunn\n\nDas Registergericht beabsichtigt, die im Handelsregister eingetragene Gesellschaft wegen Vermögenslosigkeit von Amts wegen nach § 394 FamFG zu löschen. Die Frist zur Erhebung eines Widerspruchs ist auf drei Monate festgesetzt."
    },
    {
      "date": "2024-10-24",
      "id": "91471",
      "original_text": "Registerbekanntmachung nach dem Umwandlungsgesetz\nBayern Amtsgericht Fürth HRB 16695\nPFO Development 3 GmbH – Fürth",
      "type": "Registerbekanntmachung nach dem Umwandlungsgesetz",
      "state": "Bayern",
      "amtsgericht": "Amtsgericht Fürth",
      "registernummer": "HRB 16695",
      "registerart": "HRB",
      "company_name": "PFO Development 3 GmbH",
      "company_seat": "Fürth",
      "details": "24.10.2024 (Bekanntmachungsdatum)\n\nBayern Amtsgericht Fürth HRB 16695\nRegisterbekanntmachung nach dem Umwandlungsgesetz 23.10.2024 (Eintragungsdatum)\n\nPFO Development 3 GmbH\nGesellschaft mit beschränkter Haftung\nFürth\n\nDen Gläubigern der an der Verschmelzung beteiligten Rechtsträger ist, wenn sie binnen sechs Monaten nach dem Tag, an dem die Eintragung der Verschmelzung in das Register des Sitzes desjenigen Rechtsträgers, dessen Gläubiger sie sind, nach § 19 Abs. 3 UmwG als bekannt gemacht gilt, ihren Anspruch nach Grund und Höhe schriftlich anmelden, Sicherheit zu leisten, soweit sie nicht Befriedigung verlangen können. Dieses Recht steht den Gläubigern jedoch nur zu, wenn sie glaubhaft machen, dass durch die Verschmelzung die Erfüllung ihrer Forderung gefährdet wird."
    },
    {
      "date": "2024-10-24",
      "id": "91472",
      "original_text": "Löschungsankündigung\nBayern Amtsgericht München HRB 221863\n2S Handels GmbH – München",
      "type": "Löschungsankündigung",
      "state": "Bayern",
      "amtsgericht": "Amtsgericht München",
      "registernummer": "HRB 221863",
      "registerart": "HRB",
      "company_name": "2S Handels GmbH",
      "company_seat": "München",
      "details": "24.10.2024 (Bekanntmachungsdatum)\n\nBayern Amtsgericht München HRB 221863\nLöschungsankündigung 23.10.2024 (Eintragungsdatum)\n\n2S Handels GmbH\nGesellschaft mit beschränkter Haftung\nMünchen\n\nDas Registergericht beabsichtigt, die im Handelsregister eingetragene Gesellschaft wegen Vermögenslosigkeit von Amts wegen nach § 394 FamFG zu löschen. Die Frist zur Erhebung eines Widerspruchs ist auf drei Monate festgesetzt."
    },
    {
      "date": "2024-10-24",
      "id": "91473",
      "original_text": "Registerbekanntmachung nach dem Umwandlungsgesetz\nBayern Amtsgericht Augsburg HRB 35853\nTT - Verwaltungsgesellschaft mbH – Bächingen a.d.Brenz",
      "type": "Registerbekanntmachung nach dem Umwandlungsgesetz",
      "state": "Bayern",
      "amtsgericht": "Amtsgericht Augsburg",
      "registernummer": "HRB 35853",
      "registerart": "HRB",
      "company_name": "TT - Verwaltungsgesellschaft mbH",
      "company_seat": "Bächingen a.d.Brenz",
      "details": "24.10.2024 (Bekanntmachungsdatum)\n\nBayern Amtsgericht Augsburg HRB 35853\nRegisterbekanntmachung nach dem Umwandlungsgesetz 23.10.2024 (Eintragungsdatum)\n\nTT - Verwaltungsgesellschaft mbH\nGesellschaft mit beschränkter Haftung\nBächingen a.d.Brenz\n\nDen Gläubigern der an der Verschmelzung beteiligten Rechtsträger ist, wenn sie binnen sechs Monaten nach dem Tag, an dem die Eintragung der Verschmelzung in das Register des Sitzes desjenigen Rechtsträgers, dessen Gläubiger sie sind, nach § 19 Abs. 3 UmwG als bekannt gemacht gilt, ihren Anspruch nach Grund und Höhe schriftlich anmelden, Sicherheit zu leisten, soweit sie nicht Befriedigung verlangen können. Dieses Recht steht den Gläubigern jedoch nur zu, wenn sie glaubhaft machen, dass durch die Verschmelzung die Erfüllung ihrer Forderung gefährdet wird."
    },
    {
      "date": "2024-10-24",
      "id": "91474",
      "original_text": "Registerbekanntmachung nach dem Umwandlungsgesetz\nBayern Amtsgericht München HRB 297048\nEQS Group GmbH – München",
      "type": "Registerbekanntmachung nach dem Umwandlungsgesetz",
      "state": "Bayern",
      "amtsgericht": "Amtsgericht München",
      "registernummer": "HRB 297048",
      "registerart": "HRB",
      "company_name": "EQS Group GmbH",
      "company_seat": "München",
      "details": "24.10.2024 (Bekanntmachungsdatum)\n\nBayern Amtsgericht München HRB 297048\nRegisterbekanntmachung nach dem Umwandlungsgesetz 23.10.2024 (Eintragungsdatum)\n\nEQS Group GmbH\nGesellschaft mit beschränkter Haftung\nMünchen\n\nDen Gläubigern des formwechselnden Rechtsträgers ist, wenn sie binnen sechs Monaten nach dem Tag, an dem die Eintragung des Formwechsels nach § 201 UmwG als bekannt gemacht gilt, ihren Anspruch nach Grund und Höhe schriftlich anmelden, Sicherheit zu leisten, soweit sie nicht Befriedigung verlangen können. Dieses Recht steht den Gläubigern jedoch nur zu, wenn sie glaubhaft machen, dass durch den Formwechsel die Erfüllung ihrer Forderung gefährdet wird."
    },
    {
      "date": "2024-10-24",
      "id": "91475",
      "original_text": "Löschungsankündigung\nBayern Amtsgericht München HRB 246935\nAutopflege BUGA GmbH – München",
      "type": "Löschungsankündigung",
      "state": "Bayern",
      "amtsgericht": "Amtsgericht München",
      "registernummer": "HRB 246935",
      "registerart": "HRB",
      "company_name": "Autopflege BUGA GmbH",
      "company_seat": "München",
      "details": "24.10.2024 (Bekanntmachungsdatum)\n\nBayern Amtsgericht München HRB 246935\nLöschungsankündigung 22.10.2024 (Eintragungsdatum)\n\nAutopflege BUGA GmbH\nGesellschaft mit beschränkter Haftung\nMünchen\n\nDas Registergericht beabsichtigt, die im Handelsregister eingetragene Gesellschaft wegen Vermögenslosigkeit von Amts wegen nach § 394 FamFG zu löschen. Die Frist zur Erhebung eines Widerspruchs ist auf drei Monate festgesetzt."
    },
    {
      "date": "2024-10-24",
      "id": "91476",
      "original_text": "Registerbekanntmachung nach dem Umwandlungsgesetz\nBayern Amtsgericht München HRB 131048\nEQS Group AG – München",
      "type": "Registerbekanntmachung nach dem Umwandlungsgesetz",
      "state": "Bayern",
      "amtsgericht": "Amtsgericht München",
      "registernummer": "HRB 131048",
      "registerart": "HRB",
      "company_name": "EQS Group AG",
      "company_seat": "München",
      "details": "24.10.2024 (Bekanntmachungsdatum)\n\nBayern Amtsgericht München HRB 131048\nRegisterbekanntmachung nach dem Umwandlungsgesetz 23.10.2024 (Eintragungsdatum)\n\nEQS Group AG\nAktiengesellschaft\nMünchen\n\nDen Gläubigern des formwechselnden Rechtsträgers ist, wenn sie binnen sechs Monaten nach dem Tag, an dem die Eintragung des Formwechsels nach § 201 UmwG als bekannt gemacht gilt, ihren Anspruch nach Grund und Höhe schriftlich anmelden, Sicherheit zu leisten, soweit sie nicht Befriedigung verlangen können. Dieses Recht steht den Gläubigern jedoch nur zu, wenn sie glaubhaft machen, dass durch den Formwechsel die Erfüllung ihrer Forderung gefährdet wird."
    },
    {
      "date": "2024-10-24",
      "id": "91477",
      "original_text": "Löschungsankündigung\nBayern Amtsgericht München HRB 238351\nASCORE Deutschland GmbH – München",
      "type": "Löschungsankündigung",
      "state": "Bayern",
      "amtsgericht": "Amtsgericht München",
      "registernummer": "HRB 238351",
      "registerart": "HRB",
      "company_name": "ASCORE Deutschland GmbH",
      "company_seat": "München",
      "details": "24.10.2024 (Bekanntmachungsdatum)\n\nBayern Amtsgericht München HRB 238351\nLöschungsankündigung 23.10.2024 (Eintragungsdatum)\n\nASCORE Deutschland GmbH\nGesellschaft mit beschränkter Haftung\nMünchen\n\nDas Registergericht beabsichtigt, die im Handelsregister eingetragene Gesellschaft wegen Vermögenslosigkeit von Amts wegen nach § 394 FamFG zu löschen. Die Frist zur Erhebung eines Widerspruchs ist auf drei Monate festgesetzt."
    },
    {
      "date": "2024-10-24",
      "id": "91478",
      "original_text": "Registerbekanntmachung nach dem Umwandlungsgesetz\nBayern Amtsgericht Weiden i. d. OPf. GnR 145\nBürger-Energiegenossenschaft ZENO eG – Floß",
      "type": "Registerbekanntmachung nach dem Umwandlungsgesetz",
      "state": "Bayern",
      "amtsgericht": "Amtsgericht Weiden i. d. OPf.",
      "registernummer": "GnR 145",
      "registerart": "GnR",
      "company_name": "Bürger-Energiegenossenschaft ZENO eG",
      "company_seat": "Floß",
      "details": "24.10.2024 (Bekanntmachungsdatum)\n\nBayern Amtsgericht Weiden i. d. OPf. GnR 145\nRegisterbekanntmachung nach dem Umwandlungsgesetz 23.10.2024 (Eintragungsdatum)\n\nBürger-Energiegenossenschaft ZENO eG\neingetragene Genossenschaft\nFloß\n\nDen Gläubigern der an der Verschmelzung beteiligten Rechtsträger ist, wenn sie binnen sechs Monaten nach dem Tag, an dem die Eintragung der Verschmelzung in das Register des Sitzes desjenigen Rechtsträgers, dessen Gläubiger sie sind, nach § 19 Abs. 3 UmwG als bekannt gemacht gilt, ihren Anspruch nach Grund und Höhe schriftlich anmelden, Sicherheit zu leisten, soweit sie nicht Befriedigung verlangen können. Dieses Recht steht den Gläubigern jedoch nur zu, wenn sie glaubhaft machen, dass durch die Verschmelzung die Erfüllung ihrer Forderung gefährdet wird."
    },
    {
      "date": "2024-10-24",
      "id": "91479",
      "original_text": "Registerbekanntmachung nach dem Umwandlungsgesetz\nBayern Amtsgericht Fürth HRB 12438\nP&P Bau Art GmbH Planungsgesellschaft – Fürth",
      "type": "Registerbekanntmachung nach dem Umwandlungsgesetz",
      "state": "Bayern",
      "amtsgericht": "Amtsgericht Fürth",
      "registernummer": "HRB 12438",
      "registerart": "HRB",
      "company_name": "P&P Bau Art GmbH Planungsgesellschaft",
      "company_seat": "Fürth",
      "details": "24.10.2024 (Bekanntmachungsdatum)\n\nBayern Amtsgericht Fürth HRB 12438\nRegisterbekanntmachung nach dem Umwandlungsgesetz 23.10.2024 (Eintragungsdatum)\n\nP&P Bau Art GmbH Planungsgesellschaft\nGesellschaft mit beschränkter Haftung\nFürth\n\nDen Gläubigern der an der Verschmelzung beteiligten Rechtsträger ist, wenn sie binnen sechs Monaten nach dem Tag, an dem die Eintragung der Verschmelzung in das Register des Sitzes desjenigen Rechtsträgers, dessen Gläubiger sie sind, nach § 19 Abs. 3 UmwG als bekannt gemacht gilt, ihren Anspruch nach Grund und Höhe schriftlich anmelden, Sicherheit zu leisten, soweit sie nicht Befriedigung verlangen können. Dieses Recht steht den Gläubigern jedoch nur zu, wenn sie glaubhaft machen, dass durch die Verschmelzung die Erfüllung ihrer Forderung gefährdet wird."
    },
    {
      "date": "2024-10-24",
      "id": "91480",
      "original_text": "Löschungsankündigung\nBayern Amtsgericht München HRB 226119\nAubo Robotics Technology GmbH – München",
      "type": "Löschungsankündigung",
      "state": "Bayern",
      "amtsgericht": "Amtsgericht München",
      "registernummer": "HRB 226119",
      "registerart": "HRB",
      "company_name": "Aubo Robotics Technology GmbH",
      "company_seat": "München",
      "details": "24.10.2024 (Bekanntmachungsdatum)\n\nBayern Amtsgericht München HRB 226119\nLöschungsankündigung 23.10.2024 (Eintragungsdatum)\n\nAubo Robotics Technology GmbH\nGesellschaft mit beschränkter Haftung\nMünchen\n\nDas Registergericht beabsichtigt, die im Handelsregister eingetragene Gesellschaft wegen Vermögenslosigkeit von Amts wegen nach § 394 FamFG zu löschen. Die Frist zur Erhebung eines Widerspruchs ist auf drei Monate festgesetzt."
    },
    {
      "date": "2024-10-24",
      "id": "91481",
      "original_text": "Löschungsankündigung\nBayern Amtsgericht München HRB 251515\nInores GmbH (Schweiz) Zweigniederlassung Deutschland – München",
      "type": "Löschungsankündigung",
      "state": "Bayern",
      "amtsgericht": "Amtsgericht München",
      "registernummer": "HRB 251515",
      "registerart": "HRB",
      "company_name": "Inores GmbH (Schweiz) Zweigniederlassung Deutschland",
      "company_seat": "München",
      "details": "24.10.2024 (Bekanntmachungsdatum)\n\nBayern Amtsgericht München HRB 251515\nLöschungsankündigung 23.10.2024 (Eintragungsdatum)\n\nInores GmbH (Schweiz) Zweigniederlassung Deutschland\nRechtsform ausländischen Rechts HRB\nMünchen\n\nDas Registergericht beabsichtigt, die im Handelsregister B eingetragene Löschung der Zweigniederlassung von Amts wegen nach § 395 FamFG zu löschen. Die Frist zur Erhebung eines Widerspruchs ist auf drei Monate festgesetzt."
    },
    {
      "date": "2024-10-24",
      "id": "91482",
      "original_text": "Registerbekanntmachung nach dem Umwandlungsgesetz\nBayern Amtsgericht Fürth HRB 17577\nP&P Objekt 41 GmbH – Fürth",
      "type": "Registerbekanntmachung nach dem Umwandlungsgesetz",
      "state": "Bayern",
      "amtsgericht": "Amtsgericht Fürth",
      "registernummer": "HRB 17577",
      "registerart": "HRB",
      "company_name": "P&P Objekt 41 GmbH",
      "company_seat": "Fürth",
      "details": "24.10.2024 (Bekanntmachungsdatum)\n\nBayern Amtsgericht Fürth HRB 17577\nRegisterbekanntmachung nach dem Umwandlungsgesetz 23.10.2024 (Eintragungsdatum)\n\nP&P Objekt 41 GmbH\nGesellschaft mit beschränkter Haftung\nFürth\n\nDen Gläubigern der an der Verschmelzung beteiligten Rechtsträger ist, wenn sie binnen sechs Monaten nach dem Tag, an dem die Eintragung der Verschmelzung in das Register des Sitzes desjenigen Rechtsträgers, dessen Gläubiger sie sind, nach § 19 Abs. 3 UmwG als bekannt gemacht gilt, ihren Anspruch nach Grund und Höhe schriftlich anmelden, Sicherheit zu leisten, soweit sie nicht Befriedigung verlangen können. Dieses Recht steht den Gläubigern jedoch nur zu, wenn sie glaubhaft machen, dass durch die Verschmelzung die Erfüllung ihrer Forderung gefährdet wird."
    },
    {
      "date": "2024-10-24",
      "id": "91483",
      "original_text": "Registerbekanntmachung nach dem Umwandlungsgesetz\nBayern Amtsgericht Regensburg HRB 12824\nA.I.B.-Wohngruppen GmbH – Saal/Donau",
      "type": "Registerbekanntmachung nach dem Umwandlungsgesetz",
      "state": "Bayern",
      "amtsgericht": "Amtsgericht Regensburg",
      "registernummer": "HRB 12824",
      "registerart": "HRB",
      "company_name": "A.I.B.-Wohngruppen GmbH",
      "company_seat": "Saal/Donau",
      "details": "24.10.2024 (Bekanntmachungsdatum)\n\nBayern Amtsgericht Regensburg HRB 12824\nRegisterbekanntmachung nach dem Umwandlungsgesetz 23.10.2024 (Eintragungsdatum)\n\nA.I.B.-Wohngruppen GmbH\nGesellschaft mit beschränkter Haftung\nSaal/Donau\n\nDen Gläubigern der an der Spaltung beteiligten Rechtsträger ist, wenn sie binnen sechs Monaten nach dem Tag, an dem die Eintragung der Spaltung in das Register des Sitzes desjenigen Rechtsträgers, dessen Gläubiger sie sind, nach §§ 125, 19 Abs. 3 UmwG als bekannt gemacht gilt, ihren Anspruch nach Grund und Höhe schriftlich anmelden, Sicherheit zu leisten, soweit sie nicht Befriedigung verlangen können. Dieses Recht steht den Gläubigern jedoch nur zu, wenn sie glaubhaft machen, dass durch die Spaltung die Erfüllung ihrer Forderung gefährdet wird."
    },
    {
      "date": "2024-10-24",
      "id": "91484",
      "original_text": "Einreichung neuer Dokumente\nBayern Amtsgericht München HRB 178054\nBioenergie Grafing Aktiengesellschaft – Grafing",
      "type": "Einreichung neuer Dokumente",
      "state": "Bayern",
      "amtsgericht": "Amtsgericht München",
      "registernummer": "HRB 178054",
      "registerart": "HRB",
      "company_name": "Bioenergie Grafing Aktiengesellschaft",
      "company_seat": "Grafing",
      "details": "24.10.2024 (Bekanntmachungsdatum)\n\nBayern Amtsgericht München HRB 178054\nEinreichung neuer Dokumente 23.10.2024 (Eintragungsdatum)\n\nBioenergie Grafing Aktiengesellschaft\nAktiengesellschaft\nGrafing\n\nDem Amtsgericht München -Registergericht- ist eine Liste der Mitglieder des Aufsichtsrats eingereicht worden, § 106 AktG."
    },
    {
      "date": "2024-10-24",
      "id": "91485",
      "original_text": "Registerbekanntmachung nach dem Umwandlungsgesetz\nBayern Amtsgericht Fürth HRB 16632\nP&P Objekt 26 GmbH – Fürth",
      "type": "Registerbekanntmachung nach dem Umwandlungsgesetz",
      "state": "Bayern",
      "amtsgericht": "Amtsgericht Fürth",
      "registernummer": "HRB 16632",
      "registerart": "HRB",
      "company_name": "P&P Objekt 26 GmbH",
      "company_seat": "Fürth",
      "details": "24.10.2024 (Bekanntmachungsdatum)\n\nBayern Amtsgericht Fürth HRB 16632\nRegisterbekanntmachung nach dem Umwandlungsgesetz 23.10.2024 (Eintragungsdatum)\n\nP&P Objekt 26 GmbH\nGesellschaft mit beschränkter Haftung\nFürth\n\nDen Gläubigern der an der Verschmelzung beteiligten Rechtsträger ist, wenn sie binnen sechs Monaten nach dem Tag, an dem die Eintragung der Verschmelzung in das Register des Sitzes desjenigen Rechtsträgers, dessen Gläubiger sie sind, nach § 19 Abs. 3 UmwG als bekannt gemacht gilt, ihren Anspruch nach Grund und Höhe schriftlich anmelden, Sicherheit zu leisten, soweit sie nicht Befriedigung verlangen können. Dieses Recht steht den Gläubigern jedoch nur zu, wenn sie glaubhaft machen, dass durch die Verschmelzung die Erfüllung ihrer Forderung gefährdet wird."
    },
    {
      "date": "2024-10-24",
      "id": "91486",
      "original_text": "Registerbekanntmachung nach dem Umwandlungsgesetz\nBayern Amtsgericht Fürth HRB 17578\nP&P Objekt 42 GmbH – Fürth",
      "type": "Registerbekanntmachung nach dem Umwandlungsgesetz",
      "state": "Bayern",
      "amtsgericht": "Amtsgericht Fürth",
      "registernummer": "HRB 17578",
      "registerart": "HRB",
      "company_name": "P&P Objekt 42 GmbH",
      "company_seat": "Fürth",
      "details": "24.10.2024 (Bekanntmachungsdatum)\n\nBayern Amtsgericht Fürth HRB 17578\nRegisterbekanntmachung nach dem Umwandlungsgesetz 23.10.2024 (Eintragungsdatum)\n\nP&P Objekt 42 GmbH\nGesellschaft mit beschränkter Haftung\nFürth\n\nDen Gläubigern der an der Verschmelzung beteiligten Rechtsträger ist, wenn sie binnen sechs Monaten nach dem Tag, an dem die Eintragung der Verschmelzung in das Register des Sitzes desjenigen Rechtsträgers, dessen Gläubiger sie sind, nach § 19 Abs. 3 UmwG als bekannt gemacht gilt, ihren Anspruch nach Grund und Höhe schriftlich anmelden, Sicherheit zu leisten, soweit sie nicht Befriedigung verlangen können. Dieses Recht steht den Gläubigern jedoch nur zu, wenn sie glaubhaft machen, dass durch die Verschmelzung die Erfüllung ihrer Forderung gefährdet wird."
    },
    {
      "date": "2024-10-24",
      "id": "91487",
      "original_text": "Registerbekanntmachung nach dem Umwandlungsgesetz\nBayern Amtsgericht München HRB 105005\nRauberg GmbH – Münsing, Ortsteil Degerndorf",
      "type": "Registerbekanntmachung nach dem Umwandlungsgesetz",
      "state": "Bayern",
      "amtsgericht": "Amtsgericht München",
      "registernummer": "HRB 105005",
      "registerart": "HRB",
      "company_name": "Rauberg GmbH",
      "company_seat": "Münsing, Ortsteil Degerndorf",
      "details": "24.10.2024 (Bekanntmachungsdatum)\n\nBayern Amtsgericht München HRB 105005\nRegisterbekanntmachung nach dem Umwandlungsgesetz 23.10.2024 (Eintragungsdatum)\n\nRauberg GmbH\nGesellschaft mit beschränkter Haftung\nMünsing, Ortsteil Degerndorf\n\nDen Gläubigern der an der Ausgliederung beteiligten Rechtsträger ist, wenn sie binnen sechs Monaten nach dem Tag, an dem die Eintragung der Ausgliederung in das Register des Sitzes desjenigen Rechtsträgers, dessen Gläubiger sie sind, nach §§ 125, 19 Abs. 3 UmwG als bekannt gemacht gilt, ihren Anspruch nach Grund und Höhe schriftlich anmelden, Sicherheit zu leisten, soweit sie nicht Befriedigung verlangen können. Dieses Recht steht den Gläubigern jedoch nur zu, wenn sie glaubhaft machen, dass durch die Ausgliederung die Erfüllung ihrer Forderung gefährdet wird."
    },
    {
      "date": "2024-10-24",
      "id": "91488",
      "original_text": "Registerbekanntmachung nach dem Umwandlungsgesetz\nBayern Amtsgericht Schweinfurt HRB 7479\nAutohaus Uzunkaya GmbH – Bergrheinfeld",
      "type": "Registerbekanntmachung nach dem Umwandlungsgesetz",
      "state": "Bayern",
      "amtsgericht": "Amtsgericht Schweinfurt",
      "registernummer": "HRB 7479",
      "registerart": "HRB",
      "company_name": "Autohaus Uzunkaya GmbH",
      "company_seat": "Bergrheinfeld",
      "details": "24.10.2024 (Bekanntmachungsdatum)\n\nBayern Amtsgericht Schweinfurt HRB 7479\nRegisterbekanntmachung nach dem Umwandlungsgesetz 23.10.2024 (Eintragungsdatum)\n\nAutohaus Uzunkaya GmbH\nGesellschaft mit beschränkter Haftung\nBergrheinfeld\n\nDen Gläubigern des formwechselnden Rechtsträgers ist, wenn sie binnen sechs Monaten nach dem Tag, an dem die Eintragung des Formwechsels nach § 201 UmwG als bekannt gemacht gilt, ihren Anspruch nach Grund und Höhe schriftlich anmelden, Sicherheit zu leisten, soweit sie nicht Befriedigung verlangen können. Dieses Recht steht den Gläubigern jedoch nur zu, wenn sie glaubhaft machen, dass durch den Formwechsel die Erfüllung ihrer Forderung gefährdet wird."
    },
    {
      "date": "2024-10-24",
      "id": "91489",
      "original_text": "Registerbekanntmachung nach dem Umwandlungsgesetz\nBayern Amtsgericht Schweinfurt HRA 10645\nAutohaus Uzunkaya GmbH & Co. KG – Bergrheinfeld",
      "type": "Registerbekanntmachung nach dem Umwandlungsgesetz",
      "state": "Bayern",
      "amtsgericht": "Amtsgericht Schweinfurt",
      "registernummer": "HRA 10645",
      "registerart": "HRA",
      "company_name": "Autohaus Uzunkaya GmbH & Co. KG",
      "company_seat": "Bergrheinfeld",
      "details": "24.10.2024 (Bekanntmachungsdatum)\n\nBayern Amtsgericht Schweinfurt HRA 10645\nRegisterbekanntmachung nach dem Umwandlungsgesetz 23.10.2024 (Eintragungsdatum)\n\nAutohaus Uzunkaya GmbH & Co. KG\nKommanditgesellschaft\nBergrheinfeld\n\nDen Gläubigern des formwechselnden Rechtsträgers ist, wenn sie binnen sechs Monaten nach dem Tag, an dem die Eintragung des Formwechsels nach § 201 UmwG als bekannt gemacht gilt, ihren Anspruch nach Grund und Höhe schriftlich anmelden, Sicherheit zu leisten, soweit sie nicht Befriedigung verlangen können. Dieses Recht steht den Gläubigern jedoch nur zu, wenn sie glaubhaft machen, dass durch den Formwechsel die Erfüllung ihrer Forderung gefährdet wird."
    },
    {
      "date": "2024-10-24",
      "id": "91490",
      "original_text": "Registerbekanntmachung nach dem Umwandlungsgesetz\nBayern Amtsgericht Weiden i. d. OPf. GnR 141\nBE-ON eG – Weiden",
      "type": "Registerbekanntmachung nach dem Umwandlungsgesetz",
      "state": "Bayern",
      "amtsgericht": "Amtsgericht Weiden i. d. OPf.",
      "registernummer": "GnR 141",
      "registerart": "GnR",
      "company_name": "BE-ON eG",
      "company_seat": "Weiden",
      "details": "24.10.2024 (Bekanntmachungsdatum)\n\nBayern Amtsgericht Weiden i. d. OPf. GnR 141\nRegisterbekanntmachung nach dem Umwandlungsgesetz 23.10.2024 (Eintragungsdatum)\n\nBE-ON eG\neingetragene Genossenschaft\nWeiden\n\nDen Gläubigern der an der Verschmelzung beteiligten Rechtsträger ist, wenn sie binnen sechs Monaten nach dem Tag, an dem die Eintragung der Verschmelzung in das Register des Sitzes desjenigen Rechtsträgers, dessen Gläubiger sie sind, nach § 19 Abs. 3 UmwG als bekannt gemacht gilt, ihren Anspruch nach Grund und Höhe schriftlich anmelden, Sicherheit zu leisten, soweit sie nicht Befriedigung verlangen können. Dieses Recht steht den Gläubigern jedoch nur zu, wenn sie glaubhaft machen, dass durch die Verschmelzung die Erfüllung ihrer Forderung gefährdet wird."
    },
    {
      "date": "2024-10-24",
      "id": "91491",
      "original_text": "Registerbekanntmachung nach dem Umwandlungsgesetz\nBayern Amtsgericht Weiden i. d. OPf. GnR 148\nTIR Energie eG – Tirschenreuth",
      "type": "Registerbekanntmachung nach dem Umwandlungsgesetz",
      "state": "Bayern",
      "amtsgericht": "Amtsgericht Weiden i. d. OPf.",
      "registernummer": "GnR 148",
      "registerart": "GnR",
      "company_name": "TIR Energie eG",
      "company_seat": "Tirschenreuth",
      "details": "24.10.2024 (Bekanntmachungsdatum)\n\nBayern Amtsgericht Weiden i. d. OPf. GnR 148\nRegisterbekanntmachung nach dem Umwandlungsgesetz 23.10.2024 (Eintragungsdatum)\n\nTIR Energie eG\neingetragene Genossenschaft\nTirschenreuth\n\nDen Gläubigern der an der Verschmelzung beteiligten Rechtsträger ist, wenn sie binnen sechs Monaten nach dem Tag, an dem die Eintragung der Verschmelzung in das Register des Sitzes desjenigen Rechtsträgers, dessen Gläubiger sie sind, nach § 19 Abs. 3 UmwG als bekannt gemacht gilt, ihren Anspruch nach Grund und Höhe schriftlich anmelden, Sicherheit zu leisten, soweit sie nicht Befriedigung verlangen können. Dieses Recht steht den Gläubigern jedoch nur zu, wenn sie glaubhaft machen, dass durch die Verschmelzung die Erfüllung ihrer Forderung gefährdet wird."
    },
    {
      "date": "2024-10-24",
      "id": "91492",
      "original_text": "Löschungsankündigung\nSchleswig-Holstein Amtsgericht Lübeck HRB 20266\nPrima-Bau-und-Gartenservice GmbH – Lübeck",
      "type": "Löschungsankündigung",
      "state": "Schleswig-Holstein",
      "amtsgericht": "Amtsgericht Lübeck",
      "registernummer": "HRB 20266",
      "registerart": "HRB",
      "company_name": "Prima-Bau-und-Gartenservice GmbH",
      "company_seat": "Lübeck",
      "details": "24.10.2024 (Bekanntmachungsdatum)\n\nSchleswig-Holstein Amtsgericht Lübeck HRB 20266\nLöschungsankündigung\n\nPrima-Bau-und-Gartenservice GmbH\nGesellschaft mit beschränkter Haftung\nLübeck\n\nEs ist die Löschung der nachstehenden Gesellschaft wegen Vermögenslosigkeit gemäß § 394 FamFG beabsichtigt.\nWiderspruchsfrist: 1 Monat"
    },
    {
      "date": "2024-10-24",
      "id": "91493",
      "original_text": "Sonstige Registerbekanntmachung\nSchleswig-Holstein Amtsgericht Lübeck HRB 20266\nPrima-Bau-und-Gartenservice GmbH – Lübeck",
      "type": "Sonstige Registerbekanntmachung",
      "state": "Schleswig-Holstein",
      "amtsgericht": "Amtsgericht Lübeck",
      "registernummer": "HRB 20266",
      "registerart": "HRB",
      "company_name": "Prima-Bau-und-Gartenservice GmbH",
      "company_seat": "Lübeck",
      "details": "24.10.2024 (Bekanntmachungsdatum)\n\nSchleswig-Holstein Amtsgericht Lübeck HRB 20266\nSonstige Registerbekanntmachung\n\nPrima-Bau-und-Gartenservice GmbH\nGesellschaft mit beschränkter Haftung\nLübeck\n\nAls nicht eingetragen wird veröffentlicht:\n\nIn der Handelsregistersache der\nPrima-Bau-und-Gartenservice GmbH\nergeben sich Anhaltspunkte dafür, dass die Gesellschaft, als deren Geschäftsführer Herr Marek Edward Monastyrski, Lübeck eingetragen ist, vermögenslos ist:\n\nDie Gesellschaft soll unter der Anschrift Posener Straße 22 A, Lübeck nicht mehr ansässig sein. Der Geschäftsführer ist postalisch nicht mehr erreichbar.\n\nDas Registergericht beabsichtigt daher, die Gesellschaft wegen Vermögenslosigkeit gemäß § 394 FamFG zu löschen.\n\nEs wird eine Frist von einem Monat zur Geltendmachung eines Widerspruchs gegen die Löschung gemäß § 394 Abs. 2 S. 1 FamFG bestimmt.\n\nNach Fristablauf ohne Widerspruch wird die Gesellschaft gelöscht.\n\nAmtsgericht Lübeck, Abt. 6"
    },
    {
      "date": "2024-10-24",
      "id": "91494",
      "original_text": "Einreichung neuer Dokumente\nSchleswig-Holstein Amtsgericht Kiel HRB 26481\nEhret+Klein AG – Kiel",
      "type": "Einreichung neuer Dokumente",
      "state": "Schleswig-Holstein",
      "amtsgericht": "Amtsgericht Kiel",
      "registernummer": "HRB 26481",
      "registerart": "HRB",
      "company_name": "Ehret+Klein AG",
      "company_seat": "Kiel",
      "details": "24.10.2024 (Bekanntmachungsdatum)\n\nSchleswig-Holstein Amtsgericht Kiel HRB 26481\nEinreichung neuer Dokumente\n\nEhret+Klein AG\nAktiengesellschaft\nKiel\n\nAls nicht eingetragen wird veröffentlicht: Eine neue Liste der Aufsichtsratsmitglieder ist eingereicht worden."
    },
    {
      "date": "2024-10-24",
      "id": "91495",
      "original_text": "Registerbekanntmachung nach dem Umwandlungsgesetz\nSchleswig-Holstein Amtsgericht Kiel HRB 27291\nIGB Internationale Grundwert Beteiligungs GmbH – Norderstedt",
      "type": "Registerbekanntmachung nach dem Umwandlungsgesetz",
      "state": "Schleswig-Holstein",
      "amtsgericht": "Amtsgericht Kiel",
      "registernummer": "HRB 27291",
      "registerart": "HRB",
      "company_name": "IGB Internationale Grundwert Beteiligungs GmbH",
      "company_seat": "Norderstedt",
      "details": "24.10.2024 (Bekanntmachungsdatum)\n\nSchleswig-Holstein Amtsgericht Kiel HRB 27291\nRegisterbekanntmachung nach dem Umwandlungsgesetz 23.10.2024 (Eintragungsdatum)\n\nIGB Internationale Grundwert Beteiligungs GmbH\nGesellschaft mit beschränkter Haftung\nNorderstedt\n\nZu Eintragungsnummer 7 vom 23.10.2024 wird als nicht eingetragen veröffentlicht:\nDen Gläubigern der an der Verschmelzung beteiligten Rechtsträger ist, wenn sie binnen sechs Monaten nach dem Tag, an dem die Eintragung der Verschmelzung in das Register des Sitzes desjenigen Rechtsträgers, dessen Gläubiger sie sind, nach § 19 Abs. 3 UmwG bekannt gemacht worden ist, ihren Anspruch nach Grund und Höhe schriftlich anmelden, Sicherheit zu leisten, soweit sie nicht Befriedigung verlangen können. Dieses Recht steht den Gläubigern jedoch nur zu, wenn sie glaubhaft machen, dass durch die Verschmelzung die Erfüllung ihrer Forderung gefährdet wird."
    },
    {
      "date": "2024-10-24",
      "id": "91496",
      "original_text": "Löschungsankündigung\nSchleswig-Holstein Amtsgericht Kiel HRB 1444 NM\nNovo Dens Zahntechnisches Labor GmbH – Neumünster",
      "type": "Löschungsankündigung",
      "state": "Schleswig-Holstein",
      "amtsgericht": "Amtsgericht Kiel",
      "registernummer": "HRB 1444 NM",
      "registerart": "HRB",
      "company_name": "Novo Dens Zahntechnisches Labor GmbH",
      "company_seat": "Neumünster",
      "details": "24.10.2024 (Bekanntmachungsdatum)\n\nSchleswig-Holstein Amtsgericht Kiel HRB 1444 NM\nLöschungsankündigung\n\nNovo Dens Zahntechnisches Labor GmbH\nGesellschaft mit beschränkter Haftung\nNeumünster\n\nEs ist die Löschung der nachstehenden Gesellschaft wegen Vermögenslosigkeit gemäß § 394 FamFG beabsichtigt. Widerspruchsfrist: 2 Monate."
    },
    {
      "date": "2024-10-24",
      "id": "91497",
      "original_text": "Registerbekanntmachung nach dem Umwandlungsgesetz\nSchleswig-Holstein Amtsgericht Kiel HRB 27143\nHBV Hanseatische Beteiligungs- und Verwaltungs GmbH – Norderstedt",
      "type": "Registerbekanntmachung nach dem Umwandlungsgesetz",
      "state": "Schleswig-Holstein",
      "amtsgericht": "Amtsgericht Kiel",
      "registernummer": "HRB 27143",
      "registerart": "HRB",
      "company_name": "HBV Hanseatische Beteiligungs- und Verwaltungs GmbH",
      "company_seat": "Norderstedt",
      "details": "24.10.2024 (Bekanntmachungsdatum)\n\nSchleswig-Holstein Amtsgericht Kiel HRB 27143\nRegisterbekanntmachung nach dem Umwandlungsgesetz 18.10.2024 (Eintragungsdatum)\n\nHBV Hanseatische Beteiligungs- und Verwaltungs GmbH\nGesellschaft mit beschränkter Haftung\nNorderstedt\n\nZu Eintragungsnummer 3 vom 18.10.2024 wird als nicht eingetragen veröffentlicht: Als nicht eingetragen wird veröffentlicht: Den Gläubigern der an der Verschmelzung beteiligten Rechtsträger ist, wenn sie binnen sechs Monaten nach dem Tag, an dem die Eintragung der Verschmelzung in das Register des Sitzes desjenigen Rechtsträgers, dessen Gläubiger sie sind, nach § 19 Abs. 3 UmwG bekannt gemacht worden ist, ihren Anspruch nach Grund und Höhe schriftlich anmelden, Sicherheit zu leisten, soweit sie nicht Befriedigung verlangen können. Dieses Recht steht den Gläubigern jedoch nur zu, wenn sie glaubhaft machen, dass durch die Verschmelzung die Erfüllung ihrer Forderung gefährdet wird."
    },
    {
      "date": "2024-10-24",
      "id": "91498",
      "original_text": "Registerbekanntmachung nach dem Umwandlungsgesetz\nSchleswig-Holstein Amtsgericht Kiel HRB 27226\nGebr. Müller lmmoservice GmbH – Heikendorf",
      "type": "Registerbekanntmachung nach dem Umwandlungsgesetz",
      "state": "Schleswig-Holstein",
      "amtsgericht": "Amtsgericht Kiel",
      "registernummer": "HRB 27226",
      "registerart": "HRB",
      "company_name": "Gebr. Müller lmmoservice GmbH",
      "company_seat": "Heikendorf",
      "details": "24.10.2024 (Bekanntmachungsdatum)\n\nSchleswig-Holstein Amtsgericht Kiel HRB 27226\nRegisterbekanntmachung nach dem Umwandlungsgesetz 23.10.2024 (Eintragungsdatum)\n\nGebr. Müller lmmoservice GmbH\nGesellschaft mit beschränkter Haftung\nHeikendorf\n\nZu Eintragungsnummer 2 vom 23.10.2024 wird als nicht eingetragen veröffentlicht: Den Gläubigern der an der Spaltung beteiligten Rechtsträger ist, wenn sie binnen sechs Monaten nach dem Tag, an dem die Eintragung der Spaltung in das Register des Sitzes desjenigen Rechtsträgers, dessen Gläubiger sie sind,  bekannt gemacht worden ist, ihren Anspruch nach Grund und Höhe schriftlich anmelden, Sicherheit zu leisten, soweit sie nicht Befriedigung verlangen können. Dieses Recht steht den Gläubigern jedoch nur zu, wenn sie glaubhaft machen, dass durch die Spaltung die Erfüllung ihrer Forderung gefährdet wird."
    },
    {
      "date": "2024-10-24",
      "id": "91499",
      "original_text": "Einreichung neuer Dokumente\nSchleswig-Holstein Amtsgericht Pinneberg HRB 8093\nORLEN Deutschland GmbH – Elmshorn",
      "type": "Einreichung neuer Dokumente",
      "state": "Schleswig-Holstein",
      "amtsgericht": "Amtsgericht Pinneberg",
      "registernummer": "HRB 8093",
      "registerart": "HRB",
      "company_name": "ORLEN Deutschland GmbH",
      "company_seat": "Elmshorn",
      "details": "24.10.2024 (Bekanntmachungsdatum)\n\nSchleswig-Holstein Amtsgericht Pinneberg HRB 8093\nEinreichung neuer Dokumente\n\nORLEN Deutschland GmbH\nGesellschaft mit beschränkter Haftung\nElmshorn\n\nAls nicht eingetragen wird veröffentlicht: Eine neue Liste der Aufsichtsratsmitglieder wurde gemäß § 10 HGB zum Handelsregister eingereicht."
    },
    {
      "date": "2024-10-24",
      "id": "91500",
      "original_text": "Registerbekanntmachung nach dem Umwandlungsgesetz\nBerlin Amtsgericht Berlin (Charlottenburg) HRB 179339\nBvA Real Estate GmbH – Berlin",
      "type": "Registerbekanntmachung nach dem Umwandlungsgesetz",
      "state": "Berlin",
      "amtsgericht": "Amtsgericht Berlin (Charlottenburg)",
      "registernummer": "HRB 179339",
      "registerart": "HRB",
      "company_name": "BvA Real Estate GmbH",
      "company_seat": "Berlin",
      "details": "24.10.2024 (Bekanntmachungsdatum)\n\nBerlin Amtsgericht Berlin (Charlottenburg) HRB 179339\nRegisterbekanntmachung nach dem Umwandlungsgesetz 23.10.2024 (Eintragungsdatum)\n\nBvA Real Estate GmbH\nGesellschaft mit beschränkter Haftung\nBerlin\n\nZu Eintragungsnummer 5 vom 23.10.2024 wird als nicht eingetragen veröffentlicht: Den Gläubigern der an der Verschmelzung beteiligten Rechtsträger ist, wenn sie binnen sechs Monaten nach dem Tag, an dem die Eintragung der Verschmelzung in das Register des Sitzes desjenigen Rechtsträgers, dessen Gläubiger sie sind, als bekannt gemacht gilt, ihren Anspruch nach Grund und Höhe schriftlich anmelden, Sicherheit zu leisten, soweit sie nicht Befriedigung verlangen können. Dieses Recht steht den Gläubigern jedoch nur zu, wenn sie glaubhaft machen, dass durch die Verschmelzung die Erfüllung ihrer Forderung gefährdet wird. Das Recht, Sicherheitsleistung zu verlangen, steht Gläubigern nicht zu, die im Falle der Insolvenz ein Recht auf vorzugsweise Befriedigung aus einer Deckungsmasse haben, die nach gesetzlicher Vorschrift zu ihrem Schutz errichtet und staatlich überwacht ist."
    },
    {
      "date": "2024-10-24",
      "id": "91501",
      "original_text": "Registerbekanntmachung nach dem Umwandlungsgesetz\nSchleswig-Holstein Amtsgericht Lübeck HRB 23364\nREMONDIS QR GmbH – Lübeck",
      "type": "Registerbekanntmachung nach dem Umwandlungsgesetz",
      "state": "Schleswig-Holstein",
      "amtsgericht": "Amtsgericht Lübeck",
      "registernummer": "HRB 23364",
      "registerart": "HRB",
      "company_name": "REMONDIS QR GmbH",
      "company_seat": "Lübeck",
      "details": "24.10.2024 (Bekanntmachungsdatum)\n\nSchleswig-Holstein Amtsgericht Lübeck HRB 23364\nRegisterbekanntmachung nach dem Umwandlungsgesetz 23.10.2024 (Eintragungsdatum)\n\nREMONDIS QR GmbH\nGesellschaft mit beschränkter Haftung\nLübeck\n\nZu Eintragungsnummer 2 vom 23.10.2024 wird als nicht eingetragen veröffentlicht:  Als nicht eingetragen wird veröffentlicht: Den Gläubigern der an der Verschmelzung beteiligten Rechtsträger ist, wenn sie binnen sechs Monaten nach dem Tag, an dem die Eintragung der Verschmelzung in das Register des Sitzes desjenigen Rechtsträgers, dessen Gläubiger sie sind, als bekannt gemacht gilt, ihren Anspruch nach Grund und Höhe schriftlich anmelden, Sicherheit zu leisten, soweit sie nicht Befriedigung verlangen können. Dieses Recht steht den Gläubigern jedoch nur zu, wenn sie glaubhaft machen, dass durch die Verschmelzung die Erfüllung ihrer Forderung gefährdet wird."
    },
    {
      "date": "2024-10-24",
      "id": "91502",
      "original_text": "Löschungsankündigung\nBaden-Württemberg Amtsgericht Stuttgart HRB 784284\nD-Trans Trading & Consulting GmbH – Stuttgart",
      "type": "Löschungsankündigung",
      "state": "Baden-Württemberg",
      "amtsgericht": "Amtsgericht Stuttgart",
      "registernummer": "HRB 784284",
      "registerart": "HRB",
      "company_name": "D-Trans Trading & Consulting GmbH",
      "company_seat": "Stuttgart",
      "details": "24.10.2024 (Bekanntmachungsdatum)\n\nBaden-Württemberg Amtsgericht Stuttgart HRB 784284\nLöschungsankündigung\n\nD-Trans Trading & Consulting GmbH\nGesellschaft mit beschränkter Haftung\nStuttgart\n\nAls nicht eingetragen wird bekanntgemacht:\nDas Gericht beabsichtigt, die Gesellschaft wegen Vermögenslosigkeit im Handelsregister von Amts wegen nach § 394 FamFG zu löschen. Die Frist zur Geltendmachung eines Widerspruchs gegen die beabsichtigte Löschung ist auf zwei Monate ab Veröffentlichung bestimmt."
    },
    {
      "date": "2024-10-24",
      "id": "91503",
      "original_text": "Registerbekanntmachung nach dem Umwandlungsgesetz\nBaden-Württemberg Amtsgericht Stuttgart HRB 792503\nItterheim Rentner-GmbH – Schwaikheim",
      "type": "Registerbekanntmachung nach dem Umwandlungsgesetz",
      "state": "Baden-Württemberg",
      "amtsgericht": "Amtsgericht Stuttgart",
      "registernummer": "HRB 792503",
      "registerart": "HRB",
      "company_name": "Itterheim Rentner-GmbH",
      "company_seat": "Schwaikheim",
      "details": "24.10.2024 (Bekanntmachungsdatum)\n\nBaden-Württemberg Amtsgericht Stuttgart HRB 792503\nRegisterbekanntmachung nach dem Umwandlungsgesetz 02.10.2024 (Eintragungsdatum)\n\nItterheim Rentner-GmbH\nGesellschaft mit beschränkter Haftung\nSchwaikheim\n\nDen Gläubigern der an der Ausgliederung beteiligten Rechtsträger ist, wenn sie binnen sechs Monaten nach dem Tag, an dem die Eintragung der Ausgliederung in das Register des Sitzes desjenigen Rechtsträgers, dessen Gläubiger sie sind, nach § 19 Abs. 3 UmwG als bekanntgemacht gilt, ihren Anspruch nach Grund und Höhe schriftlich anmelden, Sicherheit zu leisten, soweit sie nicht Befriedigung verlangen können. Dieses Recht steht den Gläubigern jedoch nur zu, wenn sie glaubhaft machen, dass durch die Ausgliederung die Erfüllung ihrer Forderung gefährdet wird."
    },
    {
      "date": "2024-10-24",
      "id": "91504",
      "original_text": "Einreichung neuer Dokumente\nBerlin Amtsgericht Berlin (Charlottenburg) HRB 178480\nNext Big Thing AG – Berlin",
      "type": "Einreichung neuer Dokumente",
      "state": "Berlin",
      "amtsgericht": "Amtsgericht Berlin (Charlottenburg)",
      "registernummer": "HRB 178480",
      "registerart": "HRB",
      "company_name": "Next Big Thing AG",
      "company_seat": "Berlin",
      "details": "24.10.2024 (Bekanntmachungsdatum)\n\nBerlin Amtsgericht Berlin (Charlottenburg) HRB 178480\nEinreichung neuer Dokumente\n\nNext Big Thing AG\nAktiengesellschaft\nBerlin\n\nAls nicht eingetragen wird veröffentlicht:"
    },
    {
      "date": "2024-10-24",
      "id": "91505",
      "original_text": "Registerbekanntmachung nach dem Umwandlungsgesetz\nBaden-Württemberg Amtsgericht Ulm HRB 748766\nVictoria Ocker Bar Kulisse GmbH – Ulm",
      "type": "Registerbekanntmachung nach dem Umwandlungsgesetz",
      "state": "Baden-Württemberg",
      "amtsgericht": "Amtsgericht Ulm",
      "registernummer": "HRB 748766",
      "registerart": "HRB",
      "company_name": "Victoria Ocker Bar Kulisse GmbH",
      "company_seat": "Ulm",
      "details": "24.10.2024 (Bekanntmachungsdatum)\n\nBaden-Württemberg Amtsgericht Ulm HRB 748766\nRegisterbekanntmachung nach dem Umwandlungsgesetz 24.10.2024 (Eintragungsdatum)\n\nVictoria Ocker Bar Kulisse GmbH\nGesellschaft mit beschränkter Haftung\nUlm\n\nAls nicht eingetragen wird bekanntgemacht:\nDen Gläubigern der an der Ausgliederung beteiligten Rechtsträger ist, wenn sie binnen sechs Monaten nach dem Tag, an dem die Eintragung der Ausgliederung in das Register des Sitzes desjenigen Rechtsträgers, dessen Gläubiger sie sind, nach § 19 Abs. 3 UmwG als bekanntgemacht gilt, ihren Anspruch nach Grund und Höhe schriftlich anmelden, Sicherheit zu leisten, soweit sie nicht Befriedigung verlangen können. Dieses Recht steht den Gläubigern jedoch nur zu, wenn sie glaubhaft machen, dass durch die Ausgliederung die Erfüllung ihrer Forderung gefährdet wird."
    },
    {
      "date": "2024-10-24",
      "id": "91506",
      "original_text": "Registerbekanntmachung nach dem Umwandlungsgesetz\nBaden-Württemberg Amtsgericht Ulm HRA 729255\nVictoria Ocker Bar Kulisse e.K. – Ulm",
      "type": "Registerbekanntmachung nach dem Umwandlungsgesetz",
      "state": "Baden-Württemberg",
      "amtsgericht": "Amtsgericht Ulm",
      "registernummer": "HRA 729255",
      "registerart": "HRA",
      "company_name": "Victoria Ocker Bar Kulisse e.K.",
      "company_seat": "Ulm",
      "details": "24.10.2024 (Bekanntmachungsdatum)\n\nBaden-Württemberg Amtsgericht Ulm HRA 729255\nRegisterbekanntmachung nach dem Umwandlungsgesetz 24.10.2024 (Eintragungsdatum)\n\nVictoria Ocker Bar Kulisse e.K.\nEinzelkaufmann / Einzelkauffrau\nUlm\n\nAls nicht eingetragen wird bekanntgemacht:\nDen Gläubigern der an der Ausgliederung beteiligten Rechtsträger ist, wenn sie binnen sechs Monaten nach dem Tag, an dem die Eintragung der Ausgliederung in das Register des Sitzes desjenigen Rechtsträgers, dessen Gläubiger sie sind, nach § 19 Abs. 3 UmwG als bekanntgemacht gilt, ihren Anspruch nach Grund und Höhe schriftlich anmelden, Sicherheit zu leisten, soweit sie nicht Befriedigung verlangen können. Dieses Recht steht den Gläubigern jedoch nur zu, wenn sie glaubhaft machen, dass durch die Ausgliederung die Erfüllung ihrer Forderung gefährdet wird."
    },
    {
      "date": "2024-10-24",
      "id": "91507",
      "original_text": "Einreichung neuer Dokumente\nBaden-Württemberg Amtsgericht Mannheim HRB 751478\nGabor-Janzen Familienholding AG – Heidelberg",
      "type": "Einreichung neuer Dokumente",
      "state": "Baden-Württemberg",
      "amtsgericht": "Amtsgericht Mannheim",
      "registernummer": "HRB 751478",
      "registerart": "HRB",
      "company_name": "Gabor-Janzen Familienholding AG",
      "company_seat": "Heidelberg",
      "details": "24.10.2024 (Bekanntmachungsdatum)\n\nBaden-Württemberg Amtsgericht Mannheim HRB 751478\nEinreichung neuer Dokumente\n\nGabor-Janzen Familienholding AG\nAktiengesellschaft\nHeidelberg\n\nDie Gesellschaft hat am 23.09.2024 die Liste über die Zusammensetzung des Aufsichtsrats zum Handelsregister eingereicht."
    },
    {
      "date": "2024-10-24",
      "id": "91508",
      "original_text": "Löschungsankündigung\nBrandenburg Amtsgericht Potsdam HRB 16084\nWHGe Kommunalfonds Verwaltungs GmbH – Ludwigsfelde",
      "type": "Löschungsankündigung",
      "state": "Brandenburg",
      "amtsgericht": "Amtsgericht Potsdam",
      "registernummer": "HRB 16084",
      "registerart": "HRB",
      "company_name": "WHGe Kommunalfonds Verwaltungs GmbH",
      "company_seat": "Ludwigsfelde",
      "details": "24.10.2024 (Bekanntmachungsdatum)\n\nBrandenburg Amtsgericht Potsdam HRB 16084\nLöschungsankündigung\n\nWHGe Kommunalfonds Verwaltungs GmbH\nGesellschaft mit beschränkter Haftung\nLudwigsfelde\n\nBei der nachstehenden Gesellschaft wird das Amtslöschungsverfahren gemäß § 394 FamFG eingeleitet. Widerspruchsfrist 8 Wochen."
    },
    {
      "date": "2024-10-24",
      "id": "91509",
      "original_text": "Löschungsankündigung\nBerlin Amtsgericht Berlin (Charlottenburg) HRB 138579\nANKA Tiefbau GmbH – Berlin",
      "type": "Löschungsankündigung",
      "state": "Berlin",
      "amtsgericht": "Amtsgericht Berlin (Charlottenburg)",
      "registernummer": "HRB 138579",
      "registerart": "HRB",
      "company_name": "ANKA Tiefbau GmbH",
      "company_seat": "Berlin",
      "details": "24.10.2024 (Bekanntmachungsdatum)\n\nBerlin Amtsgericht Berlin (Charlottenburg) HRB 138579\nLöschungsankündigung\n\nANKA Tiefbau GmbH\nGesellschaft mit beschränkter Haftung\nBerlin\n\nBei der nachstehenden Gesellschaft wird das Amtslöschungsverfahren gemäß § 394 FamFG eingeleitet. Widerspruchsfrist 6 Wochen"
    },
    {
      "date": "2024-10-24",
      "id": "91510",
      "original_text": "Löschungsankündigung\nBaden-Württemberg Amtsgericht Ulm HRB 740519\nFontanero GmbH – Ravensburg",
      "type": "Löschungsankündigung",
      "state": "Baden-Württemberg",
      "amtsgericht": "Amtsgericht Ulm",
      "registernummer": "HRB 740519",
      "registerart": "HRB",
      "company_name": "Fontanero GmbH",
      "company_seat": "Ravensburg",
      "details": "24.10.2024 (Bekanntmachungsdatum)\n\nBaden-Württemberg Amtsgericht Ulm HRB 740519\nLöschungsankündigung\n\nFontanero GmbH\nGesellschaft mit beschränkter Haftung\nRavensburg\n\nDas Gericht beabsichtigt, die Gesellschaft wegen Vermögenslosigkeit im Handelsregister von Amts wegen nach § 394 FamFG zu löschen. Die Frist zur Geltendmachung eines Widerspruchs gegen die beabsichtigte Löschung ist auf  einen Monat ab Veröffentlichung bestimmt."
    },
    {
      "date": "2024-10-24",
      "id": "91511",
      "original_text": "Einreichung neuer Dokumente\nBaden-Württemberg Amtsgericht Ulm HRB 510555\nStadtwerke Ellwangen GmbH – Ellwangen Jagst",
      "type": "Einreichung neuer Dokumente",
      "state": "Baden-Württemberg",
      "amtsgericht": "Amtsgericht Ulm",
      "registernummer": "HRB 510555",
      "registerart": "HRB",
      "company_name": "Stadtwerke Ellwangen GmbH",
      "company_seat": "Ellwangen Jagst",
      "details": "24.10.2024 (Bekanntmachungsdatum)\n\nBaden-Württemberg Amtsgericht Ulm HRB 510555\nEinreichung neuer Dokumente\n\nStadtwerke Ellwangen GmbH\nGesellschaft mit beschränkter Haftung\nEllwangen Jagst\n\nDie Gesellschaft hat am 22.10.2024 die Liste über die Zusammensetzung des Aufsichtsrats zum Handelsregister eingereicht."
    },
    {
      "date": "2024-10-24",
      "id": "91512",
      "original_text": "Einreichung neuer Dokumente\nBerlin Amtsgericht Berlin (Charlottenburg) HRB 170590\nplanen-bauen 4.0 - Gesellschaft zur Digitalisierung des Planens, Bauens und Betreibens mbH – Berlin",
      "type": "Einreichung neuer Dokumente",
      "state": "Berlin",
      "amtsgericht": "Amtsgericht Berlin (Charlottenburg)",
      "registernummer": "HRB 170590",
      "registerart": "HRB",
      "company_name": "planen-bauen 4.0 - Gesellschaft zur Digitalisierung des Planens, Bauens und Betreibens mbH",
      "company_seat": "Berlin",
      "details": "24.10.2024 (Bekanntmachungsdatum)\n\nBerlin Amtsgericht Berlin (Charlottenburg) HRB 170590\nEinreichung neuer Dokumente\n\nplanen-bauen 4.0 - Gesellschaft zur Digitalisierung des Planens, Bauens und Betreibens mbH\nGesellschaft mit beschränkter Haftung\nBerlin\n\nAls nicht eingetragen wird veröffentlicht: Es wurde eine neue Liste der Aufsichtsratsmitglieder eingereicht (§52 GmbHG)."
    },
    {
      "date": "2024-10-24",
      "id": "91513",
      "original_text": "Registerbekanntmachung nach dem Umwandlungsgesetz\nBaden-Württemberg Amtsgericht Ulm HRA 729281\nSchiessl Anlagen- und Energietechnik e.K. – Blaustein",
      "type": "Registerbekanntmachung nach dem Umwandlungsgesetz",
      "state": "Baden-Württemberg",
      "amtsgericht": "Amtsgericht Ulm",
      "registernummer": "HRA 729281",
      "registerart": "HRA",
      "company_name": "Schiessl Anlagen- und Energietechnik e.K.",
      "company_seat": "Blaustein",
      "details": "24.10.2024 (Bekanntmachungsdatum)\n\nBaden-Württemberg Amtsgericht Ulm HRA 729281\nRegisterbekanntmachung nach dem Umwandlungsgesetz 24.10.2024 (Eintragungsdatum)\n\nSchiessl Anlagen- und Energietechnik e.K.\nEinzelkaufmann / Einzelkauffrau\nBlaustein\n\nAls nicht eingetragen wird bekanntgemacht:\nDen Gläubigern der an der Ausgliederung beteiligten Rechtsträger ist, wenn sie binnen sechs Monaten nach dem Tag, an dem die Eintragung der Ausgliederung in das Register des Sitzes desjenigen Rechtsträgers, dessen Gläubiger sie sind, nach § 19 Abs. 3 UmwG als bekanntgemacht gilt, ihren Anspruch nach Grund und Höhe schriftlich anmelden, Sicherheit zu leisten, soweit sie nicht Befriedigung verlangen können. Dieses Recht steht den Gläubigern jedoch nur zu, wenn sie glaubhaft machen, dass durch die Ausgliederung die Erfüllung ihrer Forderung gefährdet wird."
    },
    {
      "date": "2024-10-24",
      "id": "91514",
      "original_text": "Registerbekanntmachung nach dem Umwandlungsgesetz\nBaden-Württemberg Amtsgericht Ulm HRB 748768\nRS Anlagen- und Energietechnik GmbH – Blaustein",
      "type": "Registerbekanntmachung nach dem Umwandlungsgesetz",
      "state": "Baden-Württemberg",
      "amtsgericht": "Amtsgericht Ulm",
      "registernummer": "HRB 748768",
      "registerart": "HRB",
      "company_name": "RS Anlagen- und Energietechnik GmbH",
      "company_seat": "Blaustein",
      "details": "24.10.2024 (Bekanntmachungsdatum)\n\nBaden-Württemberg Amtsgericht Ulm HRB 748768\nRegisterbekanntmachung nach dem Umwandlungsgesetz 24.10.2024 (Eintragungsdatum)\n\nRS Anlagen- und Energietechnik GmbH\nGesellschaft mit beschränkter Haftung\nBlaustein\n\nAls nicht eingetragen wird bekanntgemacht:\nDen Gläubigern der an der Ausgliederung beteiligten Rechtsträger ist, wenn sie binnen sechs Monaten nach dem Tag, an dem die Eintragung der Ausgliederung in das Register des Sitzes desjenigen Rechtsträgers, dessen Gläubiger sie sind, nach § 19 Abs. 3 UmwG als bekanntgemacht gilt, ihren Anspruch nach Grund und Höhe schriftlich anmelden, Sicherheit zu leisten, soweit sie nicht Befriedigung verlangen können. Dieses Recht steht den Gläubigern jedoch nur zu, wenn sie glaubhaft machen, dass durch die Ausgliederung die Erfüllung ihrer Forderung gefährdet wird."
    },
    {
      "date": "2024-10-24",
      "id": "91515",
      "original_text": "Einreichung neuer Dokumente\nSchleswig-Holstein Amtsgericht Flensburg HRB 517 NI\nEnergieversorgung Sylt GmbH – Westerland",
      "type": "Einreichung neuer Dokumente",
      "state": "Schleswig-Holstein",
      "amtsgericht": "Amtsgericht Flensburg",
      "registernummer": "HRB 517 NI",
      "registerart": "HRB",
      "company_name": "Energieversorgung Sylt GmbH",
      "company_seat": "Westerland",
      "details": "24.10.2024 (Bekanntmachungsdatum)\n\nSchleswig-Holstein Amtsgericht Flensburg HRB 517 NI\nEinreichung neuer Dokumente\n\nEnergieversorgung Sylt GmbH\nGesellschaft mit beschränkter Haftung\nWesterland\n\nNeue Aufsichtsratsliste nach Änderung eingereicht am 21.10.2024."
    },
    {
      "date": "2024-10-24",
      "id": "91516",
      "original_text": "Löschungsankündigung\nBaden-Württemberg Amtsgericht Freiburg HRB 707340\nTOPAMONT Stahlbau GmbH – Kehl",
      "type": "Löschungsankündigung",
      "state": "Baden-Württemberg",
      "amtsgericht": "Amtsgericht Freiburg",
      "registernummer": "HRB 707340",
      "registerart": "HRB",
      "company_name": "TOPAMONT Stahlbau GmbH",
      "company_seat": "Kehl",
      "details": "24.10.2024 (Bekanntmachungsdatum)\n\nBaden-Württemberg Amtsgericht Freiburg HRB 707340\nLöschungsankündigung 24.10.2024 (Eintragungsdatum)\n\nTOPAMONT Stahlbau GmbH\nGesellschaft mit beschränkter Haftung\nKehl\n\nAls nicht eingetragen wird bekanntgemacht:\nDas Gericht beabsichtigt, die Gesellschaft wegen Vermögenslosigkeit im Handelsregister von Amts wegen nach § 394 FamFG zu löschen. Die Frist zur Geltendmachung eines Widerspruchs gegen die beabsichtigte Löschung ist auf einen Monat ab Veröffentlichung bestimmt."
    },
    {
      "date": "2024-10-24",
      "id": "91517",
      "original_text": "Einreichung neuer Dokumente\nBerlin Amtsgericht Berlin (Charlottenburg) HRB 74180\nEduard Winter Immobilien Verwaltungs-GmbH – Berlin",
      "type": "Einreichung neuer Dokumente",
      "state": "Berlin",
      "amtsgericht": "Amtsgericht Berlin (Charlottenburg)",
      "registernummer": "HRB 74180",
      "registerart": "HRB",
      "company_name": "Eduard Winter Immobilien Verwaltungs-GmbH",
      "company_seat": "Berlin",
      "details": "24.10.2024 (Bekanntmachungsdatum)\n\nBerlin Amtsgericht Berlin (Charlottenburg) HRB 74180\nEinreichung neuer Dokumente\n\nEduard Winter Immobilien Verwaltungs-GmbH\nGesellschaft mit beschränkter Haftung\nBerlin\n\nAls nicht eingetragen wird veröffentlicht:Es wurde eine neue Liste der Beiratsmitglieder eingereicht (§52 GmbHG)."
    },
    {
      "date": "2024-10-24",
      "id": "91518",
      "original_text": "Löschungsankündigung\nBerlin Amtsgericht Berlin (Charlottenburg) HRB 170574\nCVS Projektentwicklung UG (haftungsbeschränkt) – Berlin",
      "type": "Löschungsankündigung",
      "state": "Berlin",
      "amtsgericht": "Amtsgericht Berlin (Charlottenburg)",
      "registernummer": "HRB 170574",
      "registerart": "HRB",
      "company_name": "CVS Projektentwicklung UG (haftungsbeschränkt)",
      "company_seat": "Berlin",
      "details": "24.10.2024 (Bekanntmachungsdatum)\n\nBerlin Amtsgericht Berlin (Charlottenburg) HRB 170574\nLöschungsankündigung\n\nCVS Projektentwicklung UG (haftungsbeschränkt)\nGesellschaft mit beschränkter Haftung\nBerlin\n\nBei der nachstehenden Gesellschaft wird das Amtslöschungsverfahren gemäß § 394 FamFG eingeleitet. Widerspruchsfrist 6 Wochen"
    },
    {
      "date": "2024-10-24",
      "id": "91519",
      "original_text": "Löschungsankündigung\nNordrhein-Westfalen Amtsgericht Coesfeld HRB 16293\nRoheca Industrieböden UG (haftungsbeschränkt) – Ahaus",
      "type": "Löschungsankündigung",
      "state": "Nordrhein-Westfalen",
      "amtsgericht": "Amtsgericht Coesfeld",
      "registernummer": "HRB 16293",
      "registerart": "HRB",
      "company_name": "Roheca Industrieböden UG (haftungsbeschränkt)",
      "company_seat": "Ahaus",
      "details": "24.10.2024 (Bekanntmachungsdatum)\n\nNordrhein-Westfalen Amtsgericht Coesfeld HRB 16293\nLöschungsankündigung\n\nRoheca Industrieböden UG (haftungsbeschränkt)\nGesellschaft mit beschränkter Haftung\nAhaus\n\nDas Registergericht beabsichtigt, den Rechtsträger wegen Vermögenslosigkeit gemäß § 394 FamFG von Amts wegen zu löschen.\n\nGegen diese Verfügung kann Widerspruch eingelegt werden. Die Frist zur Erhebung eines Widerspruchs gegen die beabsichtigte Löschung ist auf einen Monat ab Veröffentlichung festgesetzt."
    },
    {
      "date": "2024-10-24",
      "id": "91520",
      "original_text": "Registerbekanntmachung nach dem Umwandlungsgesetz\nSaarland Amtsgericht Saarbrücken HRB 107180\nKalodion Air Flugzeug-Betriebsgesellschaft mbH – Merzig",
      "type": "Registerbekanntmachung nach dem Umwandlungsgesetz",
      "state": "Saarland",
      "amtsgericht": "Amtsgericht Saarbrücken",
      "registernummer": "HRB 107180",
      "registerart": "HRB",
      "company_name": "Kalodion Air Flugzeug-Betriebsgesellschaft mbH",
      "company_seat": "Merzig",
      "details": "24.10.2024 (Bekanntmachungsdatum)\n\nSaarland Amtsgericht Saarbrücken HRB 107180\nRegisterbekanntmachung nach dem Umwandlungsgesetz 24.10.2024 (Eintragungsdatum)\n\nKalodion Air Flugzeug-Betriebsgesellschaft mbH\nGesellschaft mit beschränkter Haftung\nMerzig\n\nAls nicht eingetragen wird bekannt gemacht: Den Gläubigern der an der Verschmelzung beteiligten Gesellschaften ist, wenn sie binnen sechs Monaten nach dem Tag, an dem die Eintragung der Verschmelzung in das Register des Sitzes desjenigen Rechtsträgers, dessen Gläubiger sie sind, nach § 19 Absatz 3 UmwG bekannt gemacht worden ist, ihren Anspruch nach Grund und Höhe schriftlich anmelden, Sicherheit zu leisten, soweit sie nicht Befriedigung verlangen können. Dieses Recht steht den Gläubigern jedoch nur zu, wenn sie glaubhaft machen, dass durch die Verschmelzung die Erfüllung ihrer Forderung gefährdet wird."
    },
    {
      "date": "2024-10-24",
      "id": "91521",
      "original_text": "Registerbekanntmachung nach dem Umwandlungsgesetz\nBerlin Amtsgericht Berlin (Charlottenburg) HRA 41671\nAM-Grundstücksgesellschaft Berlin GmbH & Co. KG – Berlin",
      "type": "Registerbekanntmachung nach dem Umwandlungsgesetz",
      "state": "Berlin",
      "amtsgericht": "Amtsgericht Berlin (Charlottenburg)",
      "registernummer": "HRA 41671",
      "registerart": "HRA",
      "company_name": "AM-Grundstücksgesellschaft Berlin GmbH & Co. KG",
      "company_seat": "Berlin",
      "details": "24.10.2024 (Bekanntmachungsdatum)\n\nBerlin Amtsgericht Berlin (Charlottenburg) HRA 41671\nRegisterbekanntmachung nach dem Umwandlungsgesetz 23.10.2024 (Eintragungsdatum)\n\nAM-Grundstücksgesellschaft Berlin GmbH & Co. KG\nKommanditgesellschaft\nBerlin\n\nZu Eintragungsnummer 5 vom 23.10.2024 wird als nicht eingetragen veröffentlicht: Den Gläubigern der an der Verschmelzung beteiligten Rechtsträger ist, wenn sie binnen sechs Monaten nach dem Tag, an dem die Eintragung der Verschmelzung in das Register des Sitzes desjenigen Rechtsträgers, dessen Gläubiger sie sind, als bekannt gemacht gilt, ihren Anspruch nach Grund und Höhe schriftlich anmelden, Sicherheit zu leisten, soweit sie nicht Befriedigung verlangen können. Dieses Recht steht den Gläubigern jedoch nur zu, wenn sie glaubhaft machen, dass durch die Verschmelzung die Erfüllung ihrer Forderung gefährdet wird. Das Recht, Sicherheitsleistung zu verlangen, steht Gläubigern nicht zu, die im Falle der Insolvenz ein Recht auf vorzugsweise Befriedigung aus einer Deckungsmasse haben, die nach gesetzlicher Vorschrift zu ihrem Schutz errichtet und staatlich überwacht ist."
    },
    {
      "date": "2024-10-24",
      "id": "91522",
      "original_text": "Registerbekanntmachung nach dem Umwandlungsgesetz\nBaden-Württemberg Amtsgericht Freiburg HRA 706034\ngravion GmbH & Co. KG – Rheinfelden Baden",
      "type": "Registerbekanntmachung nach dem Umwandlungsgesetz",
      "state": "Baden-Württemberg",
      "amtsgericht": "Amtsgericht Freiburg",
      "registernummer": "HRA 706034",
      "registerart": "HRA",
      "company_name": "gravion GmbH & Co. KG",
      "company_seat": "Rheinfelden Baden",
      "details": "24.10.2024 (Bekanntmachungsdatum)\n\nBaden-Württemberg Amtsgericht Freiburg HRA 706034\nRegisterbekanntmachung nach dem Umwandlungsgesetz 24.10.2024 (Eintragungsdatum)\n\ngravion GmbH & Co. KG\nKommanditgesellschaft\nRheinfelden Baden\n\nAls nicht eingetragen wird bekanntgemacht:\nDen Gläubigern des an dem Formwechsel beteiligten Rechtsträgers ist, wenn sie binnen sechs Monaten nach dem Tag, an dem die Eintragung des Formwechsels in das Register des Sitzes desjenigen Rechtsträgers, dessen Gläubiger sie sind, nach § 19 Abs. 3 UmwG als bekanntgemacht gilt, ihren Anspruch nach Grund und Höhe schriftlich anmelden, Sicherheit zu leisten, soweit sie nicht Befriedigung verlangen können. Dieses Recht steht den Gläubigern jedoch nur zu, wenn sie glaubhaft machen, dass durch den Formwechsel die Erfüllung ihrer Forderung gefährdet wird."
    },
    {
      "date": "2024-10-24",
      "id": "91523",
      "original_text": "Registerbekanntmachung nach dem Umwandlungsgesetz\nBerlin Amtsgericht Berlin (Charlottenburg) HRA 34791\nAM-Grundstücksgesellschaft Potsdam GmbH & Co. KG – Berlin",
      "type": "Registerbekanntmachung nach dem Umwandlungsgesetz",
      "state": "Berlin",
      "amtsgericht": "Amtsgericht Berlin (Charlottenburg)",
      "registernummer": "HRA 34791",
      "registerart": "HRA",
      "company_name": "AM-Grundstücksgesellschaft Potsdam GmbH & Co. KG",
      "company_seat": "Berlin",
      "details": "24.10.2024 (Bekanntmachungsdatum)\n\nBerlin Amtsgericht Berlin (Charlottenburg) HRA 34791\nRegisterbekanntmachung nach dem Umwandlungsgesetz 23.10.2024 (Eintragungsdatum)\n\nAM-Grundstücksgesellschaft Potsdam GmbH & Co. KG\nKommanditgesellschaft\nBerlin\n\nZu Eintragungsnummer 5 vom 23.10.2024 wird als nicht eingetragen veröffentlicht: Den Gläubigern der an der Verschmelzung beteiligten Rechtsträger ist, wenn sie binnen sechs Monaten nach dem Tag, an dem die Eintragung der Verschmelzung in das Register des Sitzes desjenigen Rechtsträgers, dessen Gläubiger sie sind, als bekannt gemacht gilt, ihren Anspruch nach Grund und Höhe schriftlich anmelden, Sicherheit zu leisten, soweit sie nicht Befriedigung verlangen können. Dieses Recht steht den Gläubigern jedoch nur zu, wenn sie glaubhaft machen, dass durch die Verschmelzung die Erfüllung ihrer Forderung gefährdet wird. Das Recht, Sicherheitsleistung zu verlangen, steht Gläubigern nicht zu, die im Falle der Insolvenz ein Recht auf vorzugsweise Befriedigung aus einer Deckungsmasse haben, die nach gesetzlicher Vorschrift zu ihrem Schutz errichtet und staatlich überwacht ist."
    },
    {
      "date": "2024-10-24",
      "id": "91524",
      "original_text": "Einreichung neuer Dokumente\nBerlin Amtsgericht Berlin (Charlottenburg) HRB 124396\nEduard Winter Dienstleistungsgesellschaft mbH – Berlin",
      "type": "Einreichung neuer Dokumente",
      "state": "Berlin",
      "amtsgericht": "Amtsgericht Berlin (Charlottenburg)",
      "registernummer": "HRB 124396",
      "registerart": "HRB",
      "company_name": "Eduard Winter Dienstleistungsgesellschaft mbH",
      "company_seat": "Berlin",
      "details": "24.10.2024 (Bekanntmachungsdatum)\n\nBerlin Amtsgericht Berlin (Charlottenburg) HRB 124396\nEinreichung neuer Dokumente\n\nEduard Winter Dienstleistungsgesellschaft mbH\nGesellschaft mit beschränkter Haftung\nBerlin\n\nAls nicht eingetragen wird veröffentlicht: Es wurde eine neue Liste der Beiratsratsmitglieder eingereicht (§52 GmbHG)."
    },
    {
      "date": "2024-10-24",
      "id": "91525",
      "original_text": "Einreichung neuer Dokumente\nBerlin Amtsgericht Berlin (Charlottenburg) HRB 4391\nEduard Winter Verwaltungsgesellschaft mbH – Berlin",
      "type": "Einreichung neuer Dokumente",
      "state": "Berlin",
      "amtsgericht": "Amtsgericht Berlin (Charlottenburg)",
      "registernummer": "HRB 4391",
      "registerart": "HRB",
      "company_name": "Eduard Winter Verwaltungsgesellschaft mbH",
      "company_seat": "Berlin",
      "details": "24.10.2024 (Bekanntmachungsdatum)\n\nBerlin Amtsgericht Berlin (Charlottenburg) HRB 4391\nEinreichung neuer Dokumente\n\nEduard Winter Verwaltungsgesellschaft mbH\nGesellschaft mit beschränkter Haftung\nBerlin\n\nAls nicht eingetragen wird veröffentlicht: Es wurde eine neue Liste des Beirates eingereicht (§52 GmbHG)."
    },
    {
      "date": "2024-10-24",
      "id": "91526",
      "original_text": "Löschungsankündigung\nBerlin Amtsgericht Berlin (Charlottenburg) HRB 195073\nCONTRIS Abriss & Entsorgung UG (haftungsbeschränkt) – Berlin",
      "type": "Löschungsankündigung",
      "state": "Berlin",
      "amtsgericht": "Amtsgericht Berlin (Charlottenburg)",
      "registernummer": "HRB 195073",
      "registerart": "HRB",
      "company_name": "CONTRIS Abriss & Entsorgung UG (haftungsbeschränkt)",
      "company_seat": "Berlin",
      "details": "24.10.2024 (Bekanntmachungsdatum)\n\nBerlin Amtsgericht Berlin (Charlottenburg) HRB 195073\nLöschungsankündigung\n\nCONTRIS Abriss & Entsorgung UG (haftungsbeschränkt)\nGesellschaft mit beschränkter Haftung\nBerlin\n\nBei der nachstehenden Gesellschaft wird das Amtslöschungsverfahren gemäß § 394 FamFG eingeleitet. Widerspruchsfrist 6 Wochen"
    },
    {
      "date": "2024-10-24",
      "id": "91527",
      "original_text": "Sonstige Registerbekanntmachung\nBerlin Amtsgericht Berlin (Charlottenburg) GnR 1035\nkiwiko eG – Berlin",
      "type": "Sonstige Registerbekanntmachung",
      "state": "Berlin",
      "amtsgericht": "Amtsgericht Berlin (Charlottenburg)",
      "registernummer": "GnR 1035",
      "registerart": "GnR",
      "company_name": "kiwiko eG",
      "company_seat": "Berlin",
      "details": "24.10.2024 (Bekanntmachungsdatum)\n\nBerlin Amtsgericht Berlin (Charlottenburg) GnR 1035\nSonstige Registerbekanntmachung\n\nkiwiko eG\neingetragene Genossenschaft\nBerlin\n\nAls nicht eingetragen wird veröffentlicht: Durch satzungsändernden Beschluss der Generalversammlung vom 06.11.2023 sind auch der Geschäftsanteil von 10.000 Euro auf 2.500 Euro und das Beitrittsgeld von 2.500 Euro auf 625 Euro herabgesetzt worden. Den Gläubigern der Genossenschaft ist, wenn sie sich binnen sechs Monaten nach der Bekanntmachung bei der Genossenschaft zu diesem Zweck melden, Sicherheit zu leisten, sowie sie nicht Befriedigung verlangen können."
    },
    {
      "date": "2024-10-24",
      "id": "91528",
      "original_text": "Löschungsankündigung\nBaden-Württemberg Amtsgericht Freiburg HRB 720369\nCity Imbiss Konstanz GmbH – Konstanz",
      "type": "Löschungsankündigung",
      "state": "Baden-Württemberg",
      "amtsgericht": "Amtsgericht Freiburg",
      "registernummer": "HRB 720369",
      "registerart": "HRB",
      "company_name": "City Imbiss Konstanz GmbH",
      "company_seat": "Konstanz",
      "details": "24.10.2024 (Bekanntmachungsdatum)\n\nBaden-Württemberg Amtsgericht Freiburg HRB 720369\nLöschungsankündigung\n\nCity Imbiss Konstanz GmbH\nGesellschaft mit beschränkter Haftung\nKonstanz\n\nDas Gericht beabsichtigt, die Gesellschaft wegen Vermögenslosigkeit im Handelsregister von Amts wegen nach § 394 FamFG zu löschen. Die Frist zur Geltendmachung eines Widerspruchs gegen die beabsichtigte Löschung ist auf einen Monat ab Veröffentlichung bestimmt."
    },
    {
      "date": "2024-10-24",
      "id": "91529",
      "original_text": "Löschungsankündigung\nBaden-Württemberg Amtsgericht Mannheim HRB 717465\nAK Baggerbetrieb UG (haftungsbeschränkt) – Mannheim",
      "type": "Löschungsankündigung",
      "state": "Baden-Württemberg",
      "amtsgericht": "Amtsgericht Mannheim",
      "registernummer": "HRB 717465",
      "registerart": "HRB",
      "company_name": "AK Baggerbetrieb UG (haftungsbeschränkt)",
      "company_seat": "Mannheim",
      "details": "24.10.2024 (Bekanntmachungsdatum)\n\nBaden-Württemberg Amtsgericht Mannheim HRB 717465\nLöschungsankündigung\n\nAK Baggerbetrieb UG (haftungsbeschränkt)\nGesellschaft mit beschränkter Haftung\nMannheim\n\nDas Gericht beabsichtigt, die Gesellschaft wegen Vermögenslosigkeit im Handelsregister von Amts wegen nach § 394 FamFG zu löschen. Die Frist zur Geltendmachung eines Widerspruchs gegen die beabsichtigte Löschung ist auf einen Monat ab Veröffentlichung bestimmt."
    },
    {
      "date": "2024-10-24",
      "id": "91530",
      "original_text": "Löschungsankündigung\nBaden-Württemberg Amtsgericht Freiburg HRB 715390\nDERVEZ GmbH – Neuenburg am Rhein",
      "type": "Löschungsankündigung",
      "state": "Baden-Württemberg",
      "amtsgericht": "Amtsgericht Freiburg",
      "registernummer": "HRB 715390",
      "registerart": "HRB",
      "company_name": "DERVEZ GmbH",
      "company_seat": "Neuenburg am Rhein",
      "details": "24.10.2024 (Bekanntmachungsdatum)\n\nBaden-Württemberg Amtsgericht Freiburg HRB 715390\nLöschungsankündigung\n\nDERVEZ GmbH\nGesellschaft mit beschränkter Haftung\nNeuenburg am Rhein\n\nAls nicht eingetragen wird bekanntgemacht:\nDas Gericht beabsichtigt, die Gesellschaft wegen Vermögenslosigkeit im Handelsregister von Amts wegen nach § 394 FamFG zu löschen. Die Frist zur Geltendmachung eines Widerspruchs gegen die beabsichtigte Löschung ist auf einen Monat ab Veröffentlichung bestimmt."
    },
    {
      "date": "2024-10-24",
      "id": "91531",
      "original_text": "Löschungsankündigung\nSachsen-Anhalt Amtsgericht Stendal HRA 1326\nWSD-Wach-und Sicherheitsdienst Limited & Co.KG – Tangermünde",
      "type": "Löschungsankündigung",
      "state": "Sachsen-Anhalt",
      "amtsgericht": "Amtsgericht Stendal",
      "registernummer": "HRA 1326",
      "registerart": "HRA",
      "company_name": "WSD-Wach-und Sicherheitsdienst Limited & Co.KG",
      "company_seat": "Tangermünde",
      "details": "24.10.2024 (Bekanntmachungsdatum)\n\nSachsen-Anhalt Amtsgericht Stendal HRA 1326\nLöschungsankündigung\n\nWSD-Wach-und Sicherheitsdienst Limited & Co.KG\nKommanditgesellschaft\nTangermünde\n\nDas Registergericht beabsichtigt, nachfolgende im Handelregister eingetragenen Firmen von Amts wegen nach § 394 FamFG zu löschen. Die Frist zu Erhebung eines Widerspruchs wird auf drei Monate festgesetzt."
    },
    {
      "date": "2024-10-24",
      "id": "91532",
      "original_text": "Registerbekanntmachung nach dem Umwandlungsgesetz\nHamburg Amtsgericht Hamburg HRB 75555\nKnaack AG – Hamburg",
      "type": "Registerbekanntmachung nach dem Umwandlungsgesetz",
      "state": "Hamburg",
      "amtsgericht": "Amtsgericht Hamburg",
      "registernummer": "HRB 75555",
      "registerart": "HRB",
      "company_name": "Knaack AG",
      "company_seat": "Hamburg",
      "details": "24.10.2024 (Bekanntmachungsdatum)\n\nHamburg Amtsgericht Hamburg HRB 75555\nRegisterbekanntmachung nach dem Umwandlungsgesetz 24.10.2024 (Eintragungsdatum)\n\nKnaack AG\nAktiengesellschaft\nHamburg\n\nAls nicht eingetragen wird bekannt gemacht:\nDen Gläubigern der an der formwechselnden Umwandlung beteiligten Gesellschaften ist, wenn sie binnen sechs Monaten nach dem Tag, an dem die Eintragung der formwechselnden Umwandlung in das Register des Sitzes desjenigen Rechtsträgers, dessen Gläubiger sie sind, nach § 19 Absatz 3 UmwG als bekannt gemacht gilt, ihren Anspruch nach Grund und Höhe schriftlich anmelden, Sicherheit zu leisten, soweit sie nicht Befriedigung verlangen können. Dieses Recht steht den Gläubigern jedoch nur zu, wenn sie glaubhaft machen, dass durch die formwechselnde Umwandlung die Erfüllung ihrer Forderung gefährdet wird."
    },
    {
      "date": "2024-10-24",
      "id": "91533",
      "original_text": "Registerbekanntmachung nach dem Umwandlungsgesetz\nHamburg Amtsgericht Hamburg HRB 189149\nKnaack GmbH – Hamburg",
      "type": "Registerbekanntmachung nach dem Umwandlungsgesetz",
      "state": "Hamburg",
      "amtsgericht": "Amtsgericht Hamburg",
      "registernummer": "HRB 189149",
      "registerart": "HRB",
      "company_name": "Knaack GmbH",
      "company_seat": "Hamburg",
      "details": "24.10.2024 (Bekanntmachungsdatum)\n\nHamburg Amtsgericht Hamburg HRB 189149\nRegisterbekanntmachung nach dem Umwandlungsgesetz 24.10.2024 (Eintragungsdatum)\n\nKnaack GmbH\nGesellschaft mit beschränkter Haftung\nHamburg\n\nAls nicht eingetragen wird bekannt gemacht:\nDen Gläubigern der an der formwechselnden Umwandlung beteiligten Gesellschaften ist, wenn sie binnen sechs Monaten nach dem Tag, an dem die Eintragung der formwechselnden Umwandlung in das Register des Sitzes desjenigen Rechtsträgers, dessen Gläubiger sie sind, nach § 19 Absatz 3 UmwG als bekannt gemacht gilt, ihren Anspruch nach Grund und Höhe schriftlich anmelden, Sicherheit zu leisten, soweit sie nicht Befriedigung verlangen können. Dieses Recht steht den Gläubigern jedoch nur zu, wenn sie glaubhaft machen, dass durch die formwechselnde Umwandlung die Erfüllung ihrer Forderung gefährdet wird."
    },
    {
      "date": "2024-10-24",
      "id": "91534",
      "original_text": "Löschungsankündigung\nSchleswig-Holstein Amtsgericht Kiel HRA 6602\nMTF Vermarktungs GmbH & Co. KG – Norderstedt",
      "type": "Löschungsankündigung",
      "state": "Schleswig-Holstein",
      "amtsgericht": "Amtsgericht Kiel",
      "registernummer": "HRA 6602",
      "registerart": "HRA",
      "company_name": "MTF Vermarktungs GmbH & Co. KG",
      "company_seat": "Norderstedt",
      "details": "24.10.2024 (Bekanntmachungsdatum)\n\nSchleswig-Holstein Amtsgericht Kiel HRA 6602\nLöschungsankündigung\n\nMTF Vermarktungs GmbH & Co. KG\nKommanditgesellschaft\nNorderstedt\n\nEs ist die Löschung der nachstehenden Gesellschaft wegen Vermögenslosigkeit gemäß § 394 FamFG beabsichtigt. Widerspruchsfrist: 2 Monate."
    },
    {
      "date": "2024-10-24",
      "id": "91535",
      "original_text": "Registerbekanntmachung nach dem Umwandlungsgesetz\nBaden-Württemberg Amtsgericht Stuttgart HRA 103756\nLidl Dienstleistung GmbH & Co. KG – Bad Wimpfen",
      "type": "Registerbekanntmachung nach dem Umwandlungsgesetz",
      "state": "Baden-Württemberg",
      "amtsgericht": "Amtsgericht Stuttgart",
      "registernummer": "HRA 103756",
      "registerart": "HRA",
      "company_name": "Lidl Dienstleistung GmbH & Co. KG",
      "company_seat": "Bad Wimpfen",
      "details": "24.10.2024 (Bekanntmachungsdatum)\n\nBaden-Württemberg Amtsgericht Stuttgart HRA 103756\nRegisterbekanntmachung nach dem Umwandlungsgesetz 24.10.2024 (Eintragungsdatum)\n\nLidl Dienstleistung GmbH & Co. KG\nKommanditgesellschaft\nBad Wimpfen\n\nAls nicht eingetragen wird bekanntgemacht:\nDen Gläubigern der an der Abspaltung beteiligten Rechtsträger ist, wenn sie binnen sechs Monaten nach dem Tag, an dem die Eintragung der Abspaltung in das Register des Sitzes desjenigen Rechtsträgers, dessen Gläubiger sie sind, nach § 19 Abs. 3 UmwG als bekanntgemacht gilt, ihren Anspruch nach Grund und Höhe schriftlich anmelden, Sicherheit zu leisten, soweit sie nicht Befriedigung verlangen können. Dieses Recht steht den Gläubigern jedoch nur zu, wenn sie glaubhaft machen, dass durch die Abspaltung die Erfüllung ihrer Forderung gefährdet wird."
    },
    {
      "date": "2024-10-24",
      "id": "91536",
      "original_text": "Registerbekanntmachung nach dem Umwandlungsgesetz\nSchleswig-Holstein Amtsgericht Kiel HRA 12437\nGerd Müller e.K. – Heikendorf",
      "type": "Registerbekanntmachung nach dem Umwandlungsgesetz",
      "state": "Schleswig-Holstein",
      "amtsgericht": "Amtsgericht Kiel",
      "registernummer": "HRA 12437",
      "registerart": "HRA",
      "company_name": "Gerd Müller e.K.",
      "company_seat": "Heikendorf",
      "details": "24.10.2024 (Bekanntmachungsdatum)\n\nSchleswig-Holstein Amtsgericht Kiel HRA 12437\nRegisterbekanntmachung nach dem Umwandlungsgesetz 23.10.2024 (Eintragungsdatum)\n\nGerd Müller e.K.\nEinzelkaufmann / Einzelkauffrau\nHeikendorf\n\nZu Eintragungsnummer 2 vom 23.10.2024 wird als nicht eingetragen veröffentlicht: Den Gläubigern der an der Spaltung beteiligten Rechtsträger ist, wenn sie binnen sechs Monaten nach dem Tag, an dem die Eintragung der Spaltung in das Register des Sitzes desjenigen Rechtsträgers, dessen Gläubiger sie sind,  bekannt gemacht worden ist, ihren Anspruch nach Grund und Höhe schriftlich anmelden, Sicherheit zu leisten, soweit sie nicht Befriedigung verlangen können. Dieses Recht steht den Gläubigern jedoch nur zu, wenn sie glaubhaft machen, dass durch die Spaltung die Erfüllung ihrer Forderung gefährdet wird."
    },
    {
      "date": "2024-10-24",
      "id": "91537",
      "original_text": "Löschungsankündigung\nSchleswig-Holstein Amtsgericht Kiel HRB 22534\nmonati 2 komma 3 UG (haftungsbeschränkt) – Kiel",
      "type": "Löschungsankündigung",
      "state": "Schleswig-Holstein",
      "amtsgericht": "Amtsgericht Kiel",
      "registernummer": "HRB 22534",
      "registerart": "HRB",
      "company_name": "monati 2 komma 3 UG (haftungsbeschränkt)",
      "company_seat": "Kiel",
      "details": "24.10.2024 (Bekanntmachungsdatum)\n\nSchleswig-Holstein Amtsgericht Kiel HRB 22534\nLöschungsankündigung\n\nmonati 2 komma 3 UG (haftungsbeschränkt)\nGesellschaft mit beschränkter Haftung\nKiel\n\nEs ist die Löschung der nachstehenden Gesellschaft wegen Vermögenslosigkeit gemäß § 394 FamFG beabsichtigt. Widerspruchsfrist: 2 Monate."
    },
    {
      "date": "2024-10-24",
      "id": "91538",
      "original_text": "Löschungsankündigung\nBaden-Württemberg Amtsgericht Mannheim HRB 337212\nBiomit Deutschland GmbH – Heidelberg",
      "type": "Löschungsankündigung",
      "state": "Baden-Württemberg",
      "amtsgericht": "Amtsgericht Mannheim",
      "registernummer": "HRB 337212",
      "registerart": "HRB",
      "company_name": "Biomit Deutschland GmbH",
      "company_seat": "Heidelberg",
      "details": "24.10.2024 (Bekanntmachungsdatum)\n\nBaden-Württemberg Amtsgericht Mannheim HRB 337212\nLöschungsankündigung\n\nBiomit Deutschland GmbH\nGesellschaft mit beschränkter Haftung\nHeidelberg\n\nDas Gericht beabsichtigt, die Gesellschaft wegen Vermögenslosigkeit im Handelsregister von Amts wegen nach § 394 FamFG zu löschen. Die Frist zur Geltendmachung eines Widerspruchs gegen die beabsichtigte Löschung ist auf einen Monat ab Veröffentlichung bestimmt."
    },
    {
      "date": "2024-10-24",
      "id": "91539",
      "original_text": "Registerbekanntmachung nach dem Umwandlungsgesetz\nBaden-Württemberg Amtsgericht Stuttgart HRB 774832\nLang Vermögensverwaltung GmbH – Schorndorf",
      "type": "Registerbekanntmachung nach dem Umwandlungsgesetz",
      "state": "Baden-Württemberg",
      "amtsgericht": "Amtsgericht Stuttgart",
      "registernummer": "HRB 774832",
      "registerart": "HRB",
      "company_name": "Lang Vermögensverwaltung GmbH",
      "company_seat": "Schorndorf",
      "details": "24.10.2024 (Bekanntmachungsdatum)\n\nBaden-Württemberg Amtsgericht Stuttgart HRB 774832\nRegisterbekanntmachung nach dem Umwandlungsgesetz 24.10.2024 (Eintragungsdatum)\n\nLang Vermögensverwaltung GmbH\nGesellschaft mit beschränkter Haftung\nSchorndorf\n\nAls nicht eingetragen wird bekanntgemacht:\nDen Gläubigern der an der Verschmelzung beteiligten Rechtsträger ist, wenn sie binnen sechs Monaten nach dem Tag, an dem die Eintragung der Verschmelzung in das Register des Sitzes desjenigen Rechtsträgers, dessen Gläubiger sie sind, nach § 19 Abs. 3 UmwG als bekanntgemacht gilt, ihren Anspruch nach Grund und Höhe schriftlich anmelden, Sicherheit zu leisten, soweit sie nicht Befriedigung verlangen können. Dieses Recht steht den Gläubigern jedoch nur zu, wenn sie glaubhaft machen, dass durch die Verschmelzung die Erfüllung ihrer Forderung gefährdet wird."
    },
    {
      "date": "2024-10-24",
      "id": "91540",
      "original_text": "Registerbekanntmachung nach dem Umwandlungsgesetz\nBaden-Württemberg Amtsgericht Mannheim VR 704208\nObst- und Gartenbauverein Ottenau-Hörden e.V. – Gaggenau",
      "type": "Registerbekanntmachung nach dem Umwandlungsgesetz",
      "state": "Baden-Württemberg",
      "amtsgericht": "Amtsgericht Mannheim",
      "registernummer": "VR 704208",
      "registerart": "VR",
      "company_name": "Obst- und Gartenbauverein Ottenau-Hörden e.V.",
      "company_seat": "Gaggenau",
      "details": "24.10.2024 (Bekanntmachungsdatum)\n\nBaden-Württemberg Amtsgericht Mannheim VR 704208\nRegisterbekanntmachung nach dem Umwandlungsgesetz 24.10.2024 (Eintragungsdatum)\n\nObst- und Gartenbauverein Ottenau-Hörden e.V.\neingetragener Verein\nGaggenau\n\nDen Gläubigern der an der Verschmelzung beteiligten Rechtsträger ist, wenn sie binnen sechs Monaten nach dem Tag, an dem die Eintragung der Verschmelzung in das Register des Sitzes desjenigen Rechtsträgers, dessen Gläubiger sie sind, nach § 19 Abs. 3 UmwG als bekanntgemacht gilt, ihren Anspruch nach Grund und Höhe schriftlich anmelden, Sicherheit zu leisten, soweit sie nicht Befriedigung verlangen können. Dieses Recht steht den Gläubigern jedoch nur zu, wenn sie glaubhaft machen, dass durch die Verschmelzung die Erfüllung ihrer Forderung gefährdet wird."
    },
    {
      "date": "2024-10-24",
      "id": "91541",
      "original_text": "Registerbekanntmachung nach dem Umwandlungsgesetz\nBaden-Württemberg Amtsgericht Ulm HRA 501099\nCrefo Factoring Südwest GmbH & Co. KG – Aalen",
      "type": "Registerbekanntmachung nach dem Umwandlungsgesetz",
      "state": "Baden-Württemberg",
      "amtsgericht": "Amtsgericht Ulm",
      "registernummer": "HRA 501099",
      "registerart": "HRA",
      "company_name": "Crefo Factoring Südwest GmbH & Co. KG",
      "company_seat": "Aalen",
      "details": "24.10.2024 (Bekanntmachungsdatum)\n\nBaden-Württemberg Amtsgericht Ulm HRA 501099\nRegisterbekanntmachung nach dem Umwandlungsgesetz 24.10.2024 (Eintragungsdatum)\n\nCrefo Factoring Südwest GmbH & Co. KG\nKommanditgesellschaft\nAalen\n\nAls nicht eingetragen wird bekanntgemacht:\nDen Gläubigern der an der Verschmelzung beteiligten Rechtsträger ist, wenn sie binnen sechs Monaten nach dem Tag, an dem die Eintragung der Verschmelzung in das Register des Sitzes desjenigen Rechtsträgers, dessen Gläubiger sie sind, nach § 19 Abs. 3 UmwG als bekanntgemacht gilt, ihren Anspruch nach Grund und Höhe schriftlich anmelden, Sicherheit zu leisten, soweit sie nicht Befriedigung verlangen können. Dieses Recht steht den Gläubigern jedoch nur zu, wenn sie glaubhaft machen, dass durch die Verschmelzung die Erfüllung ihrer Forderung gefährdet wird."
    },
    {
      "date": "2024-10-24",
      "id": "91542",
      "original_text": "Registerbekanntmachung nach dem Umwandlungsgesetz\nBaden-Württemberg Amtsgericht Mannheim VR 520640\nObst- und Gartenbauverein Ottenau e.V. – Gaggenau",
      "type": "Registerbekanntmachung nach dem Umwandlungsgesetz",
      "state": "Baden-Württemberg",
      "amtsgericht": "Amtsgericht Mannheim",
      "registernummer": "VR 520640",
      "registerart": "VR",
      "company_name": "Obst- und Gartenbauverein Ottenau e.V.",
      "company_seat": "Gaggenau",
      "details": "24.10.2024 (Bekanntmachungsdatum)\n\nBaden-Württemberg Amtsgericht Mannheim VR 520640\nRegisterbekanntmachung nach dem Umwandlungsgesetz 24.10.2024 (Eintragungsdatum)\n\nObst- und Gartenbauverein Ottenau e.V.\neingetragener Verein\nGaggenau\n\nDen Gläubigern der an der Verschmelzung beteiligten Rechtsträger ist, wenn sie binnen sechs Monaten nach dem Tag, an dem die Eintragung der Verschmelzung in das Register des Sitzes desjenigen Rechtsträgers, dessen Gläubiger sie sind, nach § 19 Abs. 3 UmwG als bekanntgemacht gilt, ihren Anspruch nach Grund und Höhe schriftlich anmelden, Sicherheit zu leisten, soweit sie nicht Befriedigung verlangen können. Dieses Recht steht den Gläubigern jedoch nur zu, wenn sie glaubhaft machen, dass durch die Verschmelzung die Erfüllung ihrer Forderung gefährdet wird."
    },
    {
      "date": "2024-10-24",
      "id": "91543",
      "original_text": "Registerbekanntmachung nach dem Umwandlungsgesetz\nBerlin Amtsgericht Berlin (Charlottenburg) HRB 234093\nhubo UG (haftungsbeschränkt) – Berlin",
      "type": "Registerbekanntmachung nach dem Umwandlungsgesetz",
      "state": "Berlin",
      "amtsgericht": "Amtsgericht Berlin (Charlottenburg)",
      "registernummer": "HRB 234093",
      "registerart": "HRB",
      "company_name": "hubo UG (haftungsbeschränkt)",
      "company_seat": "Berlin",
      "details": "24.10.2024 (Bekanntmachungsdatum)\n\nBerlin Amtsgericht Berlin (Charlottenburg) HRB 234093\nRegisterbekanntmachung nach dem Umwandlungsgesetz 23.10.2024 (Eintragungsdatum)\n\nhubo UG (haftungsbeschränkt)\nGesellschaft mit beschränkter Haftung\nBerlin\n\nZu Eintragungsnummer 5 vom 23.10.2024 wird als nicht eingetragen veröffentlicht:\nDen Gläubigern der an der Verschmelzung beteiligten Rechtsträger ist, wenn sie binnen sechs Monaten nach dem Tag, an dem die Eintragung der Verschmelzung in das Register des Sitzes desjenigen Rechtsträgers, dessen Gläubiger sie sind, als bekannt gemacht gilt, ihren Anspruch nach Grund und Höhe schriftlich anmelden, Sicherheit zu leisten, soweit sie nicht Befriedigung verlangen können. Dieses Recht steht den Gläubigern jedoch nur zu, wenn sie glaubhaft machen, dass durch die Verschmelzung die Erfüllung ihrer Forderung gefährdet wird. Das Recht, Sicherheitsleistung zu verlangen, steht Gläubigern nicht zu, die im Falle der Insolvenz ein Recht auf vorzugsweise Befriedigung aus einer Deckungsmasse haben, die nach gesetzlicher Vorschrift zu ihrem Schutz errichtet und staatlich überwacht ist."
    },
    {
      "date": "2024-10-24",
      "id": "91544",
      "original_text": "Registerbekanntmachung nach dem Umwandlungsgesetz\nBaden-Württemberg Amtsgericht Mannheim VR 520647\nVerein für Obst- und Gartenbau Hörden e.V. – Gaggenau",
      "type": "Registerbekanntmachung nach dem Umwandlungsgesetz",
      "state": "Baden-Württemberg",
      "amtsgericht": "Amtsgericht Mannheim",
      "registernummer": "VR 520647",
      "registerart": "VR",
      "company_name": "Verein für Obst- und Gartenbau Hörden e.V.",
      "company_seat": "Gaggenau",
      "details": "24.10.2024 (Bekanntmachungsdatum)\n\nBaden-Württemberg Amtsgericht Mannheim VR 520647\nRegisterbekanntmachung nach dem Umwandlungsgesetz 24.10.2024 (Eintragungsdatum)\n\nVerein für Obst- und Gartenbau Hörden e.V.\neingetragener Verein\nGaggenau\n\nDen Gläubigern der an der Verschmelzung beteiligten Rechtsträger ist, wenn sie binnen sechs Monaten nach dem Tag, an dem die Eintragung der Verschmelzung in das Register des Sitzes desjenigen Rechtsträgers, dessen Gläubiger sie sind, nach § 19 Abs. 3 UmwG als bekanntgemacht gilt, ihren Anspruch nach Grund und Höhe schriftlich anmelden, Sicherheit zu leisten, soweit sie nicht Befriedigung verlangen können. Dieses Recht steht den Gläubigern jedoch nur zu, wenn sie glaubhaft machen, dass durch die Verschmelzung die Erfüllung ihrer Forderung gefährdet wird."
    },
    {
      "date": "2024-10-24",
      "id": "91545",
      "original_text": "Löschungsankündigung\nBaden-Württemberg Amtsgericht Stuttgart HRB 757542\nGabriel Motors GmbH – Rottenburg am Neckar",
      "type": "Löschungsankündigung",
      "state": "Baden-Württemberg",
      "amtsgericht": "Amtsgericht Stuttgart",
      "registernummer": "HRB 757542",
      "registerart": "HRB",
      "company_name": "Gabriel Motors GmbH",
      "company_seat": "Rottenburg am Neckar",
      "details": "24.10.2024 (Bekanntmachungsdatum)\n\nBaden-Württemberg Amtsgericht Stuttgart HRB 757542\nLöschungsankündigung\n\nGabriel Motors GmbH\nGesellschaft mit beschränkter Haftung\nRottenburg am Neckar\n\nDas Gericht beabsichtigt, die Gesellschaft wegen Vermögenslosigkeit im Handelsregister von Amts wegen nach § 394 FamFG zu löschen. Die Frist zur Geltendmachung eines Widerspruchs gegen die beabsichtigte Löschung ist auf zwei Monate ab Veröffentlichung bestimmt."
    },
    {
      "date": "2024-10-24",
      "id": "91546",
      "original_text": "Löschungsankündigung\nSachsen Amtsgericht Leipzig VR 6638\nMidnimo Somalia e.V. – Leipzig",
      "type": "Löschungsankündigung",
      "state": "Sachsen",
      "amtsgericht": "Amtsgericht Leipzig",
      "registernummer": "VR 6638",
      "registerart": "VR",
      "company_name": "Midnimo Somalia e.V.",
      "company_seat": "Leipzig",
      "details": "24.10.2024 (Bekanntmachungsdatum)\n\nSachsen Amtsgericht Leipzig VR 6638\nLöschungsankündigung\n\nMidnimo Somalia e.V.\neingetragener Verein\nLeipzig\n\nDas Gericht beabsichtigt, gemäß § 4 Absatz 2 Ziffer 1 der Verordnung über das Vereinsregister das Registerblatt  des Vereins zu schließen, da nach den Ermittlungen des Gerichts sämtliche Mitglieder aus dem Verein ausgeschieden sind. Zur Geltendmachung eines Widerspruchs gegen die beabsichtigte Schließung wird eine Frist von einem Monat nach der Veröffentlichung bestimmt."
    },
    {
      "date": "2024-10-24",
      "id": "91547",
      "original_text": "Registerbekanntmachung nach dem Umwandlungsgesetz\nSachsen Amtsgericht Chemnitz HRB 24950\nS-CAPE IT Solutions GmbH – Reichenbach im Vogtland",
      "type": "Registerbekanntmachung nach dem Umwandlungsgesetz",
      "state": "Sachsen",
      "amtsgericht": "Amtsgericht Chemnitz",
      "registernummer": "HRB 24950",
      "registerart": "HRB",
      "company_name": "S-CAPE IT Solutions GmbH",
      "company_seat": "Reichenbach im Vogtland",
      "details": "24.10.2024 (Bekanntmachungsdatum)\n\nSachsen Amtsgericht Chemnitz HRB 24950\nRegisterbekanntmachung nach dem Umwandlungsgesetz 24.10.2024 (Eintragungsdatum)\n\nS-CAPE IT Solutions GmbH\nGesellschaft mit beschränkter Haftung\nReichenbach im Vogtland\n\nDen Gläubigern der an der Verschmelzung beteiligten Rechtsträger ist, wenn sie binnen sechs Monaten nach dem Tag, an dem die Eintragung der Verschmelzung in das Register des Sitzes desjenigen Rechtsträgers, dessen Gläubiger sie sind, nach § 19 Abs. 3 UmwG als bekannt gemacht gilt, ihren Anspruch nach Grund und Höhe schriftlich anmelden, Sicherheit zu leisten, soweit sie nicht Befriedigung verlangen können. Dieses Recht steht den Gläubigern jedoch nur zu, wenn sie glaubhaft machen, dass durch die Verschmelzung die Erfüllung der Forderung gefährdet wird."
    },
    {
      "date": "2024-10-24",
      "id": "91548",
      "original_text": "Löschungsankündigung\nSachsen Amtsgericht Dresden HRB 41809\nRoyal Donuts Dresden GmbH – Dresden",
      "type": "Löschungsankündigung",
      "state": "Sachsen",
      "amtsgericht": "Amtsgericht Dresden",
      "registernummer": "HRB 41809",
      "registerart": "HRB",
      "company_name": "Royal Donuts Dresden GmbH",
      "company_seat": "Dresden",
      "details": "24.10.2024 (Bekanntmachungsdatum)\n\nSachsen Amtsgericht Dresden HRB 41809\nLöschungsankündigung\n\nRoyal Donuts Dresden GmbH\nGesellschaft mit beschränkter Haftung\nDresden\n\nDas Registergericht beabsichtigt, die im Handelsregister eingetragene Gesellschaft von Amts wegen nach § 394 FamFG zu löschen. Die Frist zu Erhebung eines Widerspruchs gegen die beabsichtigte Löschung wird auf einen Monat festgesetzt."
    },
    {
      "date": "2024-10-24",
      "id": "91549",
      "original_text": "Löschungsankündigung\nSachsen Amtsgericht Leipzig HRB 26604\nJentzsch Holz-, Glas- und Metalltechnik UG (haftungsbeschränkt) – Mockrehna OT Klitzschen",
      "type": "Löschungsankündigung",
      "state": "Sachsen",
      "amtsgericht": "Amtsgericht Leipzig",
      "registernummer": "HRB 26604",
      "registerart": "HRB",
      "company_name": "Jentzsch Holz-, Glas- und Metalltechnik UG (haftungsbeschränkt)",
      "company_seat": "Mockrehna OT Klitzschen",
      "details": "24.10.2024 (Bekanntmachungsdatum)\n\nSachsen Amtsgericht Leipzig HRB 26604\nLöschungsankündigung 24.10.2024 (Eintragungsdatum)\n\nJentzsch Holz-, Glas- und Metalltechnik UG (haftungsbeschränkt)\nGesellschaft mit beschränkter Haftung\nMockrehna  OT Klitzschen\n\nDas Registergericht beabsichtigt, die im Handelsregister eingetragene Gesellschaft von Amts wegen nach § 394 FamFG zu löschen. Die Frist zu Erhebung eines Widerspruchs gegen die beabsichtigte Löschung wird auf einen Monat festgesetzt."
    },
    {
      "date": "2024-10-24",
      "id": "91550",
      "original_text": "Löschungsankündigung\nNiedersachsen Amtsgericht Tostedt HRB 204255\nOil Dissolver GmbH – Breddorf",
      "type": "Löschungsankündigung",
      "state": "Niedersachsen",
      "amtsgericht": "Amtsgericht Tostedt",
      "registernummer": "HRB 204255",
      "registerart": "HRB",
      "company_name": "Oil Dissolver GmbH",
      "company_seat": "Breddorf",
      "details": "24.10.2024 (Bekanntmachungsdatum)\n\nNiedersachsen Amtsgericht Tostedt HRB 204255\nLöschungsankündigung\n\nOil Dissolver GmbH\nGesellschaft mit beschränkter Haftung\nBreddorf\n\nDas Registergericht beabsichtigt, die Gesellschaft von Amts wegen nach § 394 FamFG zu löschen. Die Frist zur Erhebung eines Widerspruchs ist auf 1 Monat ab dieser Registerbekanntmachung festgesetzt."
    },
    {
      "date": "2024-10-24",
      "id": "91551",
      "original_text": "Registerbekanntmachung nach dem Umwandlungsgesetz\nNiedersachsen Amtsgericht Lüneburg HRB 207542\nFire TopCo GmbH – Seevetal",
      "type": "Registerbekanntmachung nach dem Umwandlungsgesetz",
      "state": "Niedersachsen",
      "amtsgericht": "Amtsgericht Lüneburg",
      "registernummer": "HRB 207542",
      "registerart": "HRB",
      "company_name": "Fire TopCo GmbH",
      "company_seat": "Seevetal",
      "details": "24.10.2024 (Bekanntmachungsdatum)\n\nNiedersachsen Amtsgericht Lüneburg HRB 207542\nRegisterbekanntmachung nach dem Umwandlungsgesetz 24.10.2024 (Eintragungsdatum)\n\nFire TopCo GmbH\nGesellschaft mit beschränkter Haftung\nSeevetal\n\nDen Gläubigern der an der Abspaltung beteiligten Rechtsträger ist, wenn sie binnen sechs Monaten nach dem Tag, an dem die Eintragung der Abspaltung in das Register des Sitzes desjenigen Rechtsträgers, dessen Gläubiger sie sind, nach § 19 Abs. 3 UmwG als bekannt gemacht gilt, ihren Anspruch nach Grund und Höhe schriftlich anmelden, Sicherheit zu leisten, soweit sie nicht Befriedigung verlangen können. Dieses Recht steht den Gläubigern jedoch nur zu, wenn sie glaubhaft machen, dass durch die Abspaltung die Erfüllung der Forderung gefährdet wird."
    },
    {
      "date": "2024-10-24",
      "id": "91552",
      "original_text": "Registerbekanntmachung nach dem Umwandlungsgesetz\nNiedersachsen Amtsgericht Tostedt HRA 201045\nNAVIGATOR 3. Schiffsbeteiligungs GmbH & Co. KG – Stade",
      "type": "Registerbekanntmachung nach dem Umwandlungsgesetz",
      "state": "Niedersachsen",
      "amtsgericht": "Amtsgericht Tostedt",
      "registernummer": "HRA 201045",
      "registerart": "HRA",
      "company_name": "NAVIGATOR 3. Schiffsbeteiligungs GmbH & Co. KG",
      "company_seat": "Stade",
      "details": "24.10.2024 (Bekanntmachungsdatum)\n\nNiedersachsen Amtsgericht Tostedt HRA 201045\nRegisterbekanntmachung nach dem Umwandlungsgesetz 24.10.2024 (Eintragungsdatum)\n\nNAVIGATOR 3. Schiffsbeteiligungs GmbH & Co. KG\nKommanditgesellschaft\nStade\n\nDen Gläubigern der an der Verschmelzung beteiligten Rechtsträger ist, wenn sie binnen sechs Monaten nach dem Tag, an dem die Eintragung der Verschmelzung in das Register des Sitzes desjenigen Rechtsträgers, dessen Gläubiger sie sind, nach § 19  Abs.  3 UmwG als bekannt gemacht gilt, ihren Anspruch nach Grund und Höhe schriftlich anmelden, Sicherheit zu leisten, soweit sie nicht Befriedigung verlangen können. Dieses Recht steht den Gläubigern jedoch nur zu, wenn sie glaubhaft machen, dass durch die Verschmelzung die Erfüllung der Forderung gefährdet wird."
    },
    {
      "date": "2024-10-24",
      "id": "91553",
      "original_text": "Registerbekanntmachung nach dem Umwandlungsgesetz\nNiedersachsen Amtsgericht Göttingen HRB 207242\nMiba Industrial Bearings Germany Osterode GmbH – Osterode am Harz",
      "type": "Registerbekanntmachung nach dem Umwandlungsgesetz",
      "state": "Niedersachsen",
      "amtsgericht": "Amtsgericht Göttingen",
      "registernummer": "HRB 207242",
      "registerart": "HRB",
      "company_name": "Miba Industrial Bearings Germany Osterode GmbH",
      "company_seat": "Osterode am Harz",
      "details": "24.10.2024 (Bekanntmachungsdatum)\n\nNiedersachsen Amtsgericht Göttingen HRB 207242\nRegisterbekanntmachung nach dem Umwandlungsgesetz 24.10.2024 (Eintragungsdatum)\n\nMiba Industrial Bearings Germany Osterode GmbH\nGesellschaft mit beschränkter Haftung\nOsterode am Harz\n\nDen Gläubigern der an der Verschmelzung beteiligten Rechtsträger ist, wenn sie binnen sechs Monaten nach dem Tag, an dem die Eintragung der Verschmelzung in das Register des Sitzes desjenigen Rechtsträgers, dessen Gläubiger sie sind, nach § 19  Abs.  3 UmwG als bekannt gemacht gilt, ihren Anspruch nach Grund und Höhe schriftlich anmelden, Sicherheit zu leisten, soweit sie nicht Befriedigung verlangen können. Dieses Recht steht den Gläubigern jedoch nur zu, wenn sie glaubhaft machen, dass durch die Verschmelzung die Erfüllung der Forderung gefährdet wird."
    },
    {
      "date": "2024-10-24",
      "id": "91554",
      "original_text": "Registerbekanntmachung nach dem Umwandlungsgesetz\nNiedersachsen Amtsgericht Tostedt HRA 204473\nADW Shipping GmbH & Co. KG – Stade",
      "type": "Registerbekanntmachung nach dem Umwandlungsgesetz",
      "state": "Niedersachsen",
      "amtsgericht": "Amtsgericht Tostedt",
      "registernummer": "HRA 204473",
      "registerart": "HRA",
      "company_name": "ADW Shipping GmbH & Co. KG",
      "company_seat": "Stade",
      "details": "24.10.2024 (Bekanntmachungsdatum)\n\nNiedersachsen Amtsgericht Tostedt HRA 204473\nRegisterbekanntmachung nach dem Umwandlungsgesetz 24.10.2024 (Eintragungsdatum)\n\nADW Shipping GmbH & Co. KG\nKommanditgesellschaft\nStade\n\nDen Gläubigern der an der Verschmelzung beteiligten Rechtsträger ist, wenn sie binnen sechs Monaten nach dem Tag, an dem die Eintragung der Verschmelzung in das Register des Sitzes desjenigen Rechtsträgers, dessen Gläubiger sie sind, nach § 19  Abs.  3 UmwG als bekannt gemacht gilt, ihren Anspruch nach Grund und Höhe schriftlich anmelden, Sicherheit zu leisten, soweit sie nicht Befriedigung verlangen können. Dieses Recht steht den Gläubigern jedoch nur zu, wenn sie glaubhaft machen, dass durch die Verschmelzung die Erfüllung der Forderung gefährdet wird."
    },
    {
      "date": "2024-10-24",
      "id": "91555",
      "original_text": "Registerbekanntmachung nach dem Umwandlungsgesetz\nNiedersachsen Amtsgericht Göttingen HRA 202219\nWenig - Schirutschke OHG – Göttingen",
      "type": "Registerbekanntmachung nach dem Umwandlungsgesetz",
      "state": "Niedersachsen",
      "amtsgericht": "Amtsgericht Göttingen",
      "registernummer": "HRA 202219",
      "registerart": "HRA",
      "company_name": "Wenig - Schirutschke OHG",
      "company_seat": "Göttingen",
      "details": "24.10.2024 (Bekanntmachungsdatum)\n\nNiedersachsen Amtsgericht Göttingen HRA 202219\nRegisterbekanntmachung nach dem Umwandlungsgesetz 24.10.2024 (Eintragungsdatum)\n\nWenig - Schirutschke OHG\nOffene Handelsgesellschaft\nGöttingen\n\nDen Gläubigern der an der Ausgliederung beteiligten Rechtsträger ist, wenn sie binnen sechs Monaten nach dem Tag, an dem die Eintragung der Ausgliederung in das Register des Sitzes desjenigen Rechtsträgers, dessen Gläubiger sie sind, nach § 19 Abs. 3 UmwG als bekannt gemacht gilt, ihren Anspruch nach Grund und Höhe schriftlich anmelden, Sicherheit zu leisten, soweit sie nicht Befriedigung verlangen können. Dieses Recht steht den Gläubigern jedoch nur zu, wenn sie glaubhaft machen, dass durch die Ausgliederung die Erfüllung der Forderung gefährdet wird."
    },
    {
      "date": "2024-10-24",
      "id": "91556",
      "original_text": "Registerbekanntmachung nach dem Umwandlungsgesetz\nNiedersachsen Amtsgericht Tostedt HRA 202565\nNAVIGATOR 4. Schiffsbeteiligungs GmbH & Co. KG – Stade",
      "type": "Registerbekanntmachung nach dem Umwandlungsgesetz",
      "state": "Niedersachsen",
      "amtsgericht": "Amtsgericht Tostedt",
      "registernummer": "HRA 202565",
      "registerart": "HRA",
      "company_name": "NAVIGATOR 4. Schiffsbeteiligungs GmbH & Co. KG",
      "company_seat": "Stade",
      "details": "24.10.2024 (Bekanntmachungsdatum)\n\nNiedersachsen Amtsgericht Tostedt HRA 202565\nRegisterbekanntmachung nach dem Umwandlungsgesetz 24.10.2024 (Eintragungsdatum)\n\nNAVIGATOR 4. Schiffsbeteiligungs GmbH & Co. KG\nKommanditgesellschaft\nStade\n\nDen Gläubigern der an der Verschmelzung beteiligten Rechtsträger ist, wenn sie binnen sechs Monaten nach dem Tag, an dem die Eintragung der Verschmelzung in das Register des Sitzes desjenigen Rechtsträgers, dessen Gläubiger sie sind, nach § 19  Abs.  3 UmwG als bekannt gemacht gilt, ihren Anspruch nach Grund und Höhe schriftlich anmelden, Sicherheit zu leisten, soweit sie nicht Befriedigung verlangen können. Dieses Recht steht den Gläubigern jedoch nur zu, wenn sie glaubhaft machen, dass durch die Verschmelzung die Erfüllung der Forderung gefährdet wird."
    },
    {
      "date": "2024-10-24",
      "id": "91557",
      "original_text": "Registerbekanntmachung nach dem Umwandlungsgesetz\nNiedersachsen Amtsgericht Tostedt HRA 201045\nNAVIGATOR 3. Schiffsbeteiligungs GmbH & Co. KG – Stade",
      "type": "Registerbekanntmachung nach dem Umwandlungsgesetz",
      "state": "Niedersachsen",
      "amtsgericht": "Amtsgericht Tostedt",
      "registernummer": "HRA 201045",
      "registerart": "HRA",
      "company_name": "NAVIGATOR 3. Schiffsbeteiligungs GmbH & Co. KG",
      "company_seat": "Stade",
      "details": "24.10.2024 (Bekanntmachungsdatum)\n\nNiedersachsen Amtsgericht Tostedt HRA 201045\nRegisterbekanntmachung nach dem Umwandlungsgesetz 24.10.2024 (Eintragungsdatum)\n\nNAVIGATOR 3. Schiffsbeteiligungs GmbH & Co. KG\nKommanditgesellschaft\nStade\n\nDen Gläubigern der an der #DV.Auswahl(Text=\"Betreffende Alternative auswählen\",Eingabe=\"Verschmelzung beteiligten Rechtsträger ist, wenn sie binnen sechs Monaten nach dem Tag, an dem die Eintragung der Verschmelzung in das Register des Sitzes desjenigen Rechtsträgers, dessen Gläubiger sie sind, nach § 19  Abs.  3 UmwG als bekannt gemacht gilt, ihren Anspruch nach Grund und Höhe schriftlich anmelden, Sicherheit zu leisten, soweit sie nicht Befriedigung verlangen können. Dieses Recht steht den Gläubigern jedoch nur zu, wenn sie glaubhaft machen, dass durch die Verschmelzung die Erfüllung der Forderung gefährdet wird.\"|\"Verschmelzung\",\"Abspaltung beteiligten Rechtsträger ist, wenn sie binnen sechs Monaten nach dem Tag, an dem die Eintragung der Abspaltung in das Register des Sitzes desjenigen Rechtsträgers, dessen Gläubiger sie sind, nach § 19 Abs. 3 UmwG als bekannt gemacht gilt, ihren Anspruch nach Grund und Höhe schriftlich anmelden, Sicherheit zu leisten, soweit sie nicht Befriedigung verlangen können. Dieses Recht steht den Gläubigern jedoch nur zu, wenn sie glaubhaft machen, dass durch die Abspaltung die Erfüllung der Forderung gefährdet wird.\"|\"Abspaltung\",\"Aufspaltung beteiligten Rechtsträger ist, wenn sie binnen sechs Monaten nach dem Tag, an dem die Eintragung der Aufspaltung in das Register des Sitzes desjenigen Rechtsträgers, dessen Gläubiger sie sind, nach § 19 Abs. 3 UmwG als bekannt gemacht gilt, ihren Anspruch nach Grund und Höhe schriftlich anmelden, Sicherheit zu leisten, soweit sie nicht Befriedigung verlangen können. Dieses Recht steht den Gläubigern jedoch nur zu, wenn sie glaubhaft machen, dass durch die Aufspaltung die Erfüllung der Forderung gefährdet wird.\"|\"Aufspaltung\",\"formwechselnden Umwandlung beteiligten Rechtsträger ist, wenn sie binnen sechs Monaten nach dem Tag, an dem die Eintragung der Umwandlung in das Register des Sitzes desjenigen Rechtsträgers, dessen Gläubiger sie sind, nach § 19 Abs. 3 UmwG als bekannt gemacht gilt, ihren Anspruch nach Grund und Höhe schriftlich anmelden, Sicherheit zu leisten, soweit sie nicht Befriedigung verlangen können. Dieses Recht steht den Gläubigern jedoch nur zu, wenn sie glaubhaft machen, dass durch die formwechselnde Umwandlung die Erfüllung der Forderung gefährdet wird.\"|\"formwechselnden Umwandlung\",\"Ausgliederung beteiligten Rechtsträger ist, wenn sie binnen sechs Monaten nach dem Tag, an dem die Eintragung der Ausgliederung in das Register des Sitzes desjenigen Rechtsträgers, dessen Gläubiger sie sind, nach § 19 Abs. 3 UmwG als bekannt gemacht gilt, ihren Anspruch nach Grund und Höhe schriftlich anmelden, Sicherheit zu leisten, soweit sie nicht Befriedigung verlangen können. Dieses Recht steht den Gläubigern jedoch nur zu, wenn sie glaubhaft machen, dass durch die Ausgliederung die Erfüllung der Forderung gefährdet wird.\"|\"Ausgliederung\",\"Vermögensübertragung beteiligten Rechtsträger ist, wenn sie binnen sechs Monaten nach dem Tag, an dem die Eintragung der Spaltung in das Register des Sitzes desjenigen Rechtsträgers, dessen Gläubiger sie sind, nach § 19 Abs. 3 UmwG als bekannt gemacht gilt, ihren Anspruch nach Grund und Höhe schriftlich anmelden, Sicherheit zu leisten, soweit sie nicht Befriedigung verlangen können. Dieses Recht steht den Gläubigern jedoch nur zu, wenn sie glaubhaft machen, dass durch die Spaltung die Erfüllung der Forderung gefährdet wird.\"|\"Vermögensübertragung\")"
    },
    {
      "date": "2024-10-24",
      "id": "91558",
      "original_text": "Registerbekanntmachung nach dem Umwandlungsgesetz\nNiedersachsen Amtsgericht Tostedt HRB 4196\nDORMED Vertriebsgesellschaft für medizinische Systeme mbH Nord – Buchholz",
      "type": "Registerbekanntmachung nach dem Umwandlungsgesetz",
      "state": "Niedersachsen",
      "amtsgericht": "Amtsgericht Tostedt",
      "registernummer": "HRB 4196",
      "registerart": "HRB",
      "company_name": "DORMED Vertriebsgesellschaft für medizinische Systeme mbH Nord",
      "company_seat": "Buchholz",
      "details": "24.10.2024 (Bekanntmachungsdatum)\n\nNiedersachsen Amtsgericht Tostedt HRB 4196\nRegisterbekanntmachung nach dem Umwandlungsgesetz 24.10.2024 (Eintragungsdatum)\n\nDORMED Vertriebsgesellschaft für medizinische Systeme mbH Nord\nGesellschaft mit beschränkter Haftung\nBuchholz\n\nDen Gläubigern der an der Verschmelzung beteiligten Rechtsträger ist, wenn sie binnen sechs Monaten nach dem Tag, an dem die Eintragung der Verschmelzung in das Register des Sitzes desjenigen Rechtsträgers, dessen Gläubiger sie sind, nach § 19  Abs.  3 UmwG als bekannt gemacht gilt, ihren Anspruch nach Grund und Höhe schriftlich anmelden, Sicherheit zu leisten, soweit sie nicht Befriedigung verlangen können. Dieses Recht steht den Gläubigern jedoch nur zu, wenn sie glaubhaft machen, dass durch die Verschmelzung die Erfüllung der Forderung gefährdet wird."
    },
    {
      "date": "2024-10-24",
      "id": "91559",
      "original_text": "Registerbekanntmachung nach dem Umwandlungsgesetz\nNiedersachsen Amtsgericht Oldenburg (Oldenburg) HRA 201636\nMöhlmann Automobil-Logistik GmbH & Co. KG – Zetel-Neuenburg",
      "type": "Registerbekanntmachung nach dem Umwandlungsgesetz",
      "state": "Niedersachsen",
      "amtsgericht": "Amtsgericht Oldenburg (Oldenburg)",
      "registernummer": "HRA 201636",
      "registerart": "HRA",
      "company_name": "Möhlmann Automobil-Logistik GmbH & Co. KG",
      "company_seat": "Zetel-Neuenburg",
      "details": "24.10.2024 (Bekanntmachungsdatum)\n\nNiedersachsen Amtsgericht Oldenburg (Oldenburg) HRA 201636\nRegisterbekanntmachung nach dem Umwandlungsgesetz 24.10.2024 (Eintragungsdatum)\n\nMöhlmann Automobil-Logistik GmbH & Co. KG\nKommanditgesellschaft\nZetel-Neuenburg\n\nDen Gläubigern der an der formwechselnden Umwandlung beteiligten Rechtsträger ist, wenn sie binnen sechs Monaten nach dem Tag, an dem die Eintragung der Umwandlung in das Register des Sitzes desjenigen Rechtsträgers, dessen Gläubiger sie sind, nach § 19 Abs. 3 UmwG als bekannt gemacht gilt, ihren Anspruch nach Grund und Höhe schriftlich anmelden, Sicherheit zu leisten, soweit sie nicht Befriedigung verlangen können. Dieses Recht steht den Gläubigern jedoch nur zu, wenn sie glaubhaft machen, dass durch die formwechselnde Umwandlung die Erfüllung der Forderung gefährdet wird."
    },
    {
      "date": "2024-10-24",
      "id": "91560",
      "original_text": "Registerbekanntmachung nach dem Umwandlungsgesetz\nNiedersachsen Amtsgericht Osnabrück HRA 4607\nMeyer Entsorgung GmbH & Co. KG – Osnabrück",
      "type": "Registerbekanntmachung nach dem Umwandlungsgesetz",
      "state": "Niedersachsen",
      "amtsgericht": "Amtsgericht Osnabrück",
      "registernummer": "HRA 4607",
      "registerart": "HRA",
      "company_name": "Meyer Entsorgung GmbH & Co. KG",
      "company_seat": "Osnabrück",
      "details": "24.10.2024 (Bekanntmachungsdatum)\n\nNiedersachsen Amtsgericht Osnabrück HRA 4607\nRegisterbekanntmachung nach dem Umwandlungsgesetz 24.10.2024 (Eintragungsdatum)\n\nMeyer Entsorgung GmbH & Co. KG\nKommanditgesellschaft\nOsnabrück\n\nDen Gläubigern der an der Verschmelzung beteiligten Rechtsträger ist, wenn sie binnen sechs Monaten nach dem Tag, an dem die Eintragung der Verschmelzung in das Register des Sitzes desjenigen Rechtsträgers, dessen Gläubiger sie sind, nach § 19  Abs.  3 UmwG als bekannt gemacht gilt, ihren Anspruch nach Grund und Höhe schriftlich anmelden, Sicherheit zu leisten, soweit sie nicht Befriedigung verlangen können. Dieses Recht steht den Gläubigern jedoch nur zu, wenn sie glaubhaft machen, dass durch die Verschmelzung die Erfüllung der Forderung gefährdet wird."
    },
    {
      "date": "2024-10-24",
      "id": "91561",
      "original_text": "Registerbekanntmachung nach dem Umwandlungsgesetz\nNiedersachsen Amtsgericht Tostedt HRA 200585\nSHB 2. Beteiligungs GmbH & Co. KG – Stade",
      "type": "Registerbekanntmachung nach dem Umwandlungsgesetz",
      "state": "Niedersachsen",
      "amtsgericht": "Amtsgericht Tostedt",
      "registernummer": "HRA 200585",
      "registerart": "HRA",
      "company_name": "SHB 2. Beteiligungs GmbH & Co. KG",
      "company_seat": "Stade",
      "details": "24.10.2024 (Bekanntmachungsdatum)\n\nNiedersachsen Amtsgericht Tostedt HRA 200585\nRegisterbekanntmachung nach dem Umwandlungsgesetz 24.10.2024 (Eintragungsdatum)\n\nSHB 2. Beteiligungs GmbH & Co. KG\nKommanditgesellschaft\nStade\n\nDen Gläubigern der an der Verschmelzung beteiligten Rechtsträger ist, wenn sie binnen sechs Monaten nach dem Tag, an dem die Eintragung der Verschmelzung in das Register des Sitzes desjenigen Rechtsträgers, dessen Gläubiger sie sind, nach § 19  Abs.  3 UmwG als bekannt gemacht gilt, ihren Anspruch nach Grund und Höhe schriftlich anmelden, Sicherheit zu leisten, soweit sie nicht Befriedigung verlangen können. Dieses Recht steht den Gläubigern jedoch nur zu, wenn sie glaubhaft machen, dass durch die Verschmelzung die Erfüllung der Forderung gefährdet wird."
    },
    {
      "date": "2024-10-24",
      "id": "91562",
      "original_text": "Löschungsankündigung\nNiedersachsen Amtsgericht Aurich HRB 201375\nDENLUK Unternehmergesellschaft (haftungsbeschränkt) – Großefehn",
      "type": "Löschungsankündigung",
      "state": "Niedersachsen",
      "amtsgericht": "Amtsgericht Aurich",
      "registernummer": "HRB 201375",
      "registerart": "HRB",
      "company_name": "DENLUK Unternehmergesellschaft (haftungsbeschränkt)",
      "company_seat": "Großefehn",
      "details": "24.10.2024 (Bekanntmachungsdatum)\n\nNiedersachsen Amtsgericht Aurich HRB 201375\nLöschungsankündigung\n\nDENLUK Unternehmergesellschaft (haftungsbeschränkt)\nGesellschaft mit beschränkter Haftung\nGroßefehn\n\nDas Registergericht beabsichtigt, die Gesellschaft von Amts wegen nach § 394 FamFG zu löschen. Die Frist zur Erhebung eines Widerspruchs ist auf 1 Monat ab dieser Registerbekanntmachung festgesetzt."
    },
    {
      "date": "2024-10-24",
      "id": "91563",
      "original_text": "Einreichung neuer Dokumente\nNiedersachsen Amtsgericht Hannover HRB 62278\nGBK Beteiligungen Aktiengesellschaft – Hannover",
      "type": "Einreichung neuer Dokumente",
      "state": "Niedersachsen",
      "amtsgericht": "Amtsgericht Hannover",
      "registernummer": "HRB 62278",
      "registerart": "HRB",
      "company_name": "GBK Beteiligungen Aktiengesellschaft",
      "company_seat": "Hannover",
      "details": "24.10.2024 (Bekanntmachungsdatum)\n\nNiedersachsen Amtsgericht Hannover HRB 62278\nEinreichung neuer Dokumente\n\nGBK Beteiligungen Aktiengesellschaft\nAktiengesellschaft\nHannover\n\nDie Liste der Mitglieder des Aufsichtsrats wurde beim Registergericht eingereicht."
    },
    {
      "date": "2024-10-24",
      "id": "91564",
      "original_text": "Registerbekanntmachung nach dem Umwandlungsgesetz\nNiedersachsen Amtsgericht Lüneburg HRB 212427\nServices TopCo GmbH – Seevetal",
      "type": "Registerbekanntmachung nach dem Umwandlungsgesetz",
      "state": "Niedersachsen",
      "amtsgericht": "Amtsgericht Lüneburg",
      "registernummer": "HRB 212427",
      "registerart": "HRB",
      "company_name": "Services TopCo GmbH",
      "company_seat": "Seevetal",
      "details": "24.10.2024 (Bekanntmachungsdatum)\n\nNiedersachsen Amtsgericht Lüneburg HRB 212427\nRegisterbekanntmachung nach dem Umwandlungsgesetz 24.10.2024 (Eintragungsdatum)\n\nServices TopCo GmbH\nGesellschaft mit beschränkter Haftung\nSeevetal\n\nDen Gläubigern der an der Abspaltung beteiligten Rechtsträger ist, wenn sie binnen sechs Monaten nach dem Tag, an dem die Eintragung der Abspaltung in das Register des Sitzes desjenigen Rechtsträgers, dessen Gläubiger sie sind, nach § 19 Abs. 3 UmwG als bekannt gemacht gilt, ihren Anspruch nach Grund und Höhe schriftlich anmelden, Sicherheit zu leisten, soweit sie nicht Befriedigung verlangen können. Dieses Recht steht den Gläubigern jedoch nur zu, wenn sie glaubhaft machen, dass durch die Abspaltung die Erfüllung der Forderung gefährdet wird."
    },
    {
      "date": "2024-10-24",
      "id": "91565",
      "original_text": "Registerbekanntmachung nach dem Umwandlungsgesetz\nNiedersachsen Amtsgericht Tostedt HRA 200197\nSHB Beteiligungs GmbH & Co. KG – Stade",
      "type": "Registerbekanntmachung nach dem Umwandlungsgesetz",
      "state": "Niedersachsen",
      "amtsgericht": "Amtsgericht Tostedt",
      "registernummer": "HRA 200197",
      "registerart": "HRA",
      "company_name": "SHB Beteiligungs GmbH & Co. KG",
      "company_seat": "Stade",
      "details": "24.10.2024 (Bekanntmachungsdatum)\n\nNiedersachsen Amtsgericht Tostedt HRA 200197\nRegisterbekanntmachung nach dem Umwandlungsgesetz 24.10.2024 (Eintragungsdatum)\n\nSHB Beteiligungs GmbH & Co. KG\nKommanditgesellschaft\nStade\n\nDen Gläubigern der an der Verschmelzung beteiligten Rechtsträger ist, wenn sie binnen sechs Monaten nach dem Tag, an dem die Eintragung der Verschmelzung in das Register des Sitzes desjenigen Rechtsträgers, dessen Gläubiger sie sind, nach § 19  Abs.  3 UmwG als bekannt gemacht gilt, ihren Anspruch nach Grund und Höhe schriftlich anmelden, Sicherheit zu leisten, soweit sie nicht Befriedigung verlangen können. Dieses Recht steht den Gläubigern jedoch nur zu, wenn sie glaubhaft machen, dass durch die Verschmelzung die Erfüllung der Forderung gefährdet wird."
    },
    {
      "date": "2024-10-24",
      "id": "91566",
      "original_text": "Einreichung neuer Dokumente\nNiedersachsen Amtsgericht Hannover HRB 206826\nHannover Veranstaltungs GmbH – Hannover",
      "type": "Einreichung neuer Dokumente",
      "state": "Niedersachsen",
      "amtsgericht": "Amtsgericht Hannover",
      "registernummer": "HRB 206826",
      "registerart": "HRB",
      "company_name": "Hannover Veranstaltungs GmbH",
      "company_seat": "Hannover",
      "details": "24.10.2024 (Bekanntmachungsdatum)\n\nNiedersachsen Amtsgericht Hannover HRB 206826\nEinreichung neuer Dokumente 24.10.2024 (Eintragungsdatum)\n\nHannover Veranstaltungs GmbH\nGesellschaft mit beschränkter Haftung\nHannover\n\nDie Liste der Mitglieder des Aufsichtsrats wurde beim Registergericht eingereicht."
    },
    {
      "date": "2024-10-24",
      "id": "91567",
      "original_text": "Registerbekanntmachung nach dem Umwandlungsgesetz\nNiedersachsen Amtsgericht Aurich HRA 202552\nP&T´s Pflegeprofis e.Kfr. – Moordorf",
      "type": "Registerbekanntmachung nach dem Umwandlungsgesetz",
      "state": "Niedersachsen",
      "amtsgericht": "Amtsgericht Aurich",
      "registernummer": "HRA 202552",
      "registerart": "HRA",
      "company_name": "P&T´s Pflegeprofis e.Kfr.",
      "company_seat": "Moordorf",
      "details": "24.10.2024 (Bekanntmachungsdatum)\n\nNiedersachsen Amtsgericht Aurich HRA 202552\nRegisterbekanntmachung nach dem Umwandlungsgesetz 24.10.2024 (Eintragungsdatum)\n\nP&T´s Pflegeprofis e.Kfr.\nEinzelkaufmann / Einzelkauffrau\nMoordorf\n\nDen Gläubigern der an der Ausgliederung beteiligten Rechtsträger ist, wenn sie binnen sechs Monaten nach dem Tag, an dem die Eintragung der Ausgliederung in das Register des Sitzes desjenigen Rechtsträgers, dessen Gläubiger sie sind, nach § 19 Abs. 3 UmwG als bekannt gemacht gilt, ihren Anspruch nach Grund und Höhe schriftlich anmelden, Sicherheit zu leisten, soweit sie nicht Befriedigung verlangen können. Dieses Recht steht den Gläubigern jedoch nur zu, wenn sie glaubhaft machen, dass durch die Ausgliederung die Erfüllung der Forderung gefährdet wird."
    },
    {
      "date": "2024-10-24",
      "id": "91568",
      "original_text": "Registerbekanntmachung nach dem Umwandlungsgesetz\nNiedersachsen Amtsgericht Hildesheim HRB 202728\nISE Berufsausübungsgesellschaft UG (haftungsbeschränkt) – Wahrenholz",
      "type": "Registerbekanntmachung nach dem Umwandlungsgesetz",
      "state": "Niedersachsen",
      "amtsgericht": "Amtsgericht Hildesheim",
      "registernummer": "HRB 202728",
      "registerart": "HRB",
      "company_name": "ISE Berufsausübungsgesellschaft UG (haftungsbeschränkt)",
      "company_seat": "Wahrenholz",
      "details": "24.10.2024 (Bekanntmachungsdatum)\n\nNiedersachsen Amtsgericht Hildesheim HRB 202728\nRegisterbekanntmachung nach dem Umwandlungsgesetz 24.10.2024 (Eintragungsdatum)\n\nISE Berufsausübungsgesellschaft UG (haftungsbeschränkt)\nGesellschaft mit beschränkter Haftung\nWahrenholz\n\nDen Gläubigern der an der Verschmelzung beteiligten Rechtsträger ist, wenn sie binnen sechs Monaten nach dem Tag, an dem die Eintragung der Verschmelzung in das Register des Sitzes desjenigen Rechtsträgers, dessen Gläubiger sie sind, nach § 19  Abs.  3 UmwG als bekannt gemacht gilt, ihren Anspruch nach Grund und Höhe schriftlich anmelden, Sicherheit zu leisten, soweit sie nicht Befriedigung verlangen können. Dieses Recht steht den Gläubigern jedoch nur zu, wenn sie glaubhaft machen, dass durch die Verschmelzung die Erfüllung der Forderung gefährdet wird."
    },
    {
      "date": "2024-10-24",
      "id": "91569",
      "original_text": "Registerbekanntmachung nach dem Umwandlungsgesetz\nNiedersachsen Amtsgericht Göttingen HRA 202219\nWenig - Schirutschke OHG – Göttingen",
      "type": "Registerbekanntmachung nach dem Umwandlungsgesetz",
      "state": "Niedersachsen",
      "amtsgericht": "Amtsgericht Göttingen",
      "registernummer": "HRA 202219",
      "registerart": "HRA",
      "company_name": "Wenig - Schirutschke OHG",
      "company_seat": "Göttingen",
      "details": "24.10.2024 (Bekanntmachungsdatum)\n\nNiedersachsen Amtsgericht Göttingen HRA 202219\nRegisterbekanntmachung nach dem Umwandlungsgesetz 24.10.2024 (Eintragungsdatum)\n\nWenig - Schirutschke OHG\nOffene Handelsgesellschaft\nGöttingen\n\nDen Gläubigern der an der Ausgliederung beteiligten Rechtsträger ist, wenn sie binnen sechs Monaten nach dem Tag, an dem die Eintragung der Ausgliederung in das Register des Sitzes desjenigen Rechtsträgers, dessen Gläubiger sie sind, nach § 19 Abs. 3 UmwG als bekannt gemacht gilt, ihren Anspruch nach Grund und Höhe schriftlich anmelden, Sicherheit zu leisten, soweit sie nicht Befriedigung verlangen können. Dieses Recht steht den Gläubigern jedoch nur zu, wenn sie glaubhaft machen, dass durch die Ausgliederung die Erfüllung der Forderung gefährdet wird."
    },
    {
      "date": "2024-10-24",
      "id": "91570",
      "original_text": "Registerbekanntmachung nach dem Umwandlungsgesetz\nNiedersachsen Amtsgericht Tostedt HRA 204473\nADW Shipping GmbH & Co. KG – Stade",
      "type": "Registerbekanntmachung nach dem Umwandlungsgesetz",
      "state": "Niedersachsen",
      "amtsgericht": "Amtsgericht Tostedt",
      "registernummer": "HRA 204473",
      "registerart": "HRA",
      "company_name": "ADW Shipping GmbH & Co. KG",
      "company_seat": "Stade",
      "details": "24.10.2024 (Bekanntmachungsdatum)\n\nNiedersachsen Amtsgericht Tostedt HRA 204473\nRegisterbekanntmachung nach dem Umwandlungsgesetz 24.10.2024 (Eintragungsdatum)\n\nADW Shipping GmbH & Co. KG\nKommanditgesellschaft\nStade\n\nDen Gläubigern der an der Verschmelzung beteiligten Rechtsträger ist, wenn sie binnen sechs Monaten nach dem Tag, an dem die Eintragung der Verschmelzung in das Register des Sitzes desjenigen Rechtsträgers, dessen Gläubiger sie sind, nach § 19  Abs.  3 UmwG als bekannt gemacht gilt, ihren Anspruch nach Grund und Höhe schriftlich anmelden, Sicherheit zu leisten, soweit sie nicht Befriedigung verlangen können. Dieses Recht steht den Gläubigern jedoch nur zu, wenn sie glaubhaft machen, dass durch die Verschmelzung die Erfüllung der Forderung gefährdet wird."
    },
    {
      "date": "2024-10-24",
      "id": "91571",
      "original_text": "Registerbekanntmachung nach dem Umwandlungsgesetz\nNiedersachsen Amtsgericht Göttingen HRB 206537\nMiba Bearings Holding Germany GmbH – Osterode am Harz",
      "type": "Registerbekanntmachung nach dem Umwandlungsgesetz",
      "state": "Niedersachsen",
      "amtsgericht": "Amtsgericht Göttingen",
      "registernummer": "HRB 206537",
      "registerart": "HRB",
      "company_name": "Miba Bearings Holding Germany GmbH",
      "company_seat": "Osterode am Harz",
      "details": "24.10.2024 (Bekanntmachungsdatum)\n\nNiedersachsen Amtsgericht Göttingen HRB 206537\nRegisterbekanntmachung nach dem Umwandlungsgesetz 24.10.2024 (Eintragungsdatum)\n\nMiba Bearings Holding Germany GmbH\nGesellschaft mit beschränkter Haftung\nOsterode am Harz\n\nDen Gläubigern der an der Ausgliederung beteiligten Rechtsträger ist, wenn sie binnen sechs Monaten nach dem Tag, an dem die Eintragung der Ausgliederung in das Register des Sitzes desjenigen Rechtsträgers, dessen Gläubiger sie sind, nach § 19 Abs. 3 UmwG als bekannt gemacht gilt, ihren Anspruch nach Grund und Höhe schriftlich anmelden, Sicherheit zu leisten, soweit sie nicht Befriedigung verlangen können. Dieses Recht steht den Gläubigern jedoch nur zu, wenn sie glaubhaft machen, dass durch die Ausgliederung die Erfüllung der Forderung gefährdet wird."
    },
    {
      "date": "2024-10-24",
      "id": "91572",
      "original_text": "Registerbekanntmachung nach dem Umwandlungsgesetz\nBremen Amtsgericht Bremen HRB 26129\nHeusel Vermögensverwaltungsgesellschaft mbH – Bremen",
      "type": "Registerbekanntmachung nach dem Umwandlungsgesetz",
      "state": "Bremen",
      "amtsgericht": "Amtsgericht Bremen",
      "registernummer": "HRB 26129",
      "registerart": "HRB",
      "company_name": "Heusel Vermögensverwaltungsgesellschaft mbH",
      "company_seat": "Bremen",
      "details": "24.10.2024 (Bekanntmachungsdatum)\n\nBremen Amtsgericht Bremen HRB 26129\nRegisterbekanntmachung nach dem Umwandlungsgesetz 23.10.2024 (Eintragungsdatum)\n\nHeusel Vermögensverwaltungsgesellschaft mbH\nGesellschaft mit beschränkter Haftung\nBremen\n\nZu Eintragungsnummer 3 vom 23.10.2024 wird als nicht eingetragen veröffentlicht:\nDen Gläubigern der an der Verschmelzung beteiligten Rechtsträger ist, wenn sie binnen sechs Monaten nach dem Tag, an dem die Eintragung der Verschmelzung in das Register des Sitzes desjenigen Rechtsträgers, dessen Gläubiger sie sind, als bekannt gemacht gilt, ihren Anspruch nach Grund und Höhe schriftlich anmelden, Sicherheit zu leisten, soweit sie nicht Befriedigung verlangen können. Dieses Recht steht den Gläubigern jedoch nur zu, wenn sie glaubhaft machen, dass durch die Verschmelzung die Erfüllung ihrer Forderung gefährdet wird. Das Recht, Sicherheitsleistung zu verlangen, steht Gläubigern nicht zu, die im Falle der Insolvenz ein Recht auf vorzugsweise Befriedigung aus einer Deckungsmasse haben, die nach gesetzlicher Vorschrift zu ihrem Schutz errichtet und staatlich überwacht ist."
    },
    {
      "date": "2024-10-24",
      "id": "91573",
      "original_text": "Registerbekanntmachung nach dem Umwandlungsgesetz\nBremen Amtsgericht Bremen HRA 25602\nH + H Grundstücks GmbH & Co. KG – Bremen",
      "type": "Registerbekanntmachung nach dem Umwandlungsgesetz",
      "state": "Bremen",
      "amtsgericht": "Amtsgericht Bremen",
      "registernummer": "HRA 25602",
      "registerart": "HRA",
      "company_name": "H + H Grundstücks GmbH & Co. KG",
      "company_seat": "Bremen",
      "details": "24.10.2024 (Bekanntmachungsdatum)\n\nBremen Amtsgericht Bremen HRA 25602\nRegisterbekanntmachung nach dem Umwandlungsgesetz 23.10.2024 (Eintragungsdatum)\n\nH + H Grundstücks GmbH & Co. KG\nKommanditgesellschaft\nBremen\n\nZu Eintragungsnummer 5 vom 23.10.2024 wird als nicht eingetragen veröffentlicht:\nDen Gläubigern der an der Verschmelzung beteiligten Rechtsträger ist, wenn sie binnen sechs Monaten nach dem Tag, an dem die Eintragung der Verschmelzung in das Register des Sitzes desjenigen Rechtsträgers, dessen Gläubiger sie sind, als bekannt gemacht gilt, ihren Anspruch nach Grund und Höhe schriftlich anmelden, Sicherheit zu leisten, soweit sie nicht Befriedigung verlangen können. Dieses Recht steht den Gläubigern jedoch nur zu, wenn sie glaubhaft machen, dass durch die Verschmelzung die Erfüllung ihrer Forderung gefährdet wird. Das Recht, Sicherheitsleistung zu verlangen, steht Gläubigern nicht zu, die im Falle der Insolvenz ein Recht auf vorzugsweise Befriedigung aus einer Deckungsmasse haben, die nach gesetzlicher Vorschrift zu ihrem Schutz errichtet und staatlich überwacht ist."
    },
    {
      "date": "2024-10-24",
      "id": "91574",
      "original_text": "Löschungsankündigung\nBremen Amtsgericht Bremen HRB 38059\nCOAST Unternehmensberatung GmbH – Bremen",
      "type": "Löschungsankündigung",
      "state": "Bremen",
      "amtsgericht": "Amtsgericht Bremen",
      "registernummer": "HRB 38059",
      "registerart": "HRB",
      "company_name": "COAST Unternehmensberatung GmbH",
      "company_seat": "Bremen",
      "details": "24.10.2024 (Bekanntmachungsdatum)\n\nBremen Amtsgericht Bremen HRB 38059\nLöschungsankündigung\n\nCOAST Unternehmensberatung GmbH\nGesellschaft mit beschränkter Haftung\nBremen\n\nEs ist beabsichtigt die im Handelsregister eingetragene Gesellschaft von Amts wegen gemäß § 394 FamFG zu löschen. Gegen die Löschung kann beim AG Bremen schriftlich oder zu Protokoll der Geschäftsstelle Widerspruch eingelegt werden. Widerspruchsfrist 4 Wochen."
    },
    {
      "date": "2024-10-24",
      "id": "91575",
      "original_text": "Einreichung neuer Dokumente\nBremen Amtsgericht Bremen HRB 20780\nCSM Deutschland GmbH – Bremen",
      "type": "Einreichung neuer Dokumente",
      "state": "Bremen",
      "amtsgericht": "Amtsgericht Bremen",
      "registernummer": "HRB 20780",
      "registerart": "HRB",
      "company_name": "CSM Deutschland GmbH",
      "company_seat": "Bremen",
      "details": "24.10.2024 (Bekanntmachungsdatum)\n\nBremen Amtsgericht Bremen HRB 20780\nEinreichung neuer Dokumente\n\nCSM Deutschland GmbH\nGesellschaft mit beschränkter Haftung\nBremen\n\nAls nicht eingetragen wird bekannt gemacht: Liste des Aufsichtsrats wurde eingereicht."
    },
    {
      "date": "2024-10-24",
      "id": "91576",
      "original_text": "Registerbekanntmachung nach dem Umwandlungsgesetz\nBremen Amtsgericht Bremen HRB 20453\nbregau olt GmbH Oberflächen- und Lackier-Technik – Bremen",
      "type": "Registerbekanntmachung nach dem Umwandlungsgesetz",
      "state": "Bremen",
      "amtsgericht": "Amtsgericht Bremen",
      "registernummer": "HRB 20453",
      "registerart": "HRB",
      "company_name": "bregau olt GmbH Oberflächen- und Lackier-Technik",
      "company_seat": "Bremen",
      "details": "24.10.2024 (Bekanntmachungsdatum)\n\nBremen Amtsgericht Bremen HRB 20453\nRegisterbekanntmachung nach dem Umwandlungsgesetz 24.10.2024 (Eintragungsdatum)\n\nbregau olt GmbH Oberflächen- und Lackier-Technik\nGesellschaft mit beschränkter Haftung\nBremen\n\nZu Eintragungsnummer 7 vom 24.10.2024 wird als nicht eingetragen veröffentlicht: Den Gläubigern der an der Verschmelzung beteiligten Rechtsträger ist, wenn sie binnen sechs Monaten nach dem Tag, an dem die Eintragung der Verschmelzung in das Register des Sitzes desjenigen Rechtsträgers, dessen Gläubiger sie sind, als bekannt gemacht gilt, ihren Anspruch nach Grund und Höhe schriftlich anmelden, Sicherheit zu leisten, soweit sie nicht Befriedigung verlangen können. Dieses Recht steht den Gläubigern jedoch nur zu, wenn sie glaubhaft machen, dass durch die Verschmelzung die Erfüllung ihrer Forderung gefährdet wird. Das Recht, Sicherheitsleistung zu verlangen, steht Gläubigern nicht zu, die im Falle der Insolvenz ein Recht auf vorzugsweise Befriedigung aus einer Deckungsmasse haben, die nach gesetzlicher Vorschrift zu ihrem Schutz errichtet und staatlich überwacht ist."
    },
    {
      "date": "2024-10-24",
      "id": "91577",
      "original_text": "Registerbekanntmachung nach dem Umwandlungsgesetz\nRheinland-Pfalz Amtsgericht Koblenz VR 21264\nPfadfinderstamm Vallis Mosella e.V. – Bruttig-Fankel",
      "type": "Registerbekanntmachung nach dem Umwandlungsgesetz",
      "state": "Rheinland-Pfalz",
      "amtsgericht": "Amtsgericht Koblenz",
      "registernummer": "VR 21264",
      "registerart": "VR",
      "company_name": "Pfadfinderstamm Vallis Mosella e.V.",
      "company_seat": "Bruttig-Fankel",
      "details": "24.10.2024 (Bekanntmachungsdatum)\n\nRheinland-Pfalz Amtsgericht Koblenz VR 21264\nRegisterbekanntmachung nach dem Umwandlungsgesetz 24.10.2024 (Eintragungsdatum)\n\nPfadfinderstamm Vallis Mosella e.V.\neingetragener Verein\nBruttig-Fankel\n\nAls nicht eingetragen wird veröffentlicht: Den Gläubigern der an der Verschmelzung beteiligten Rechtsträger ist, wenn sie binnen sechs Monaten nach dem Tag, an dem die Eintragung der Verschmelzung in das Register des Sitzes desjenigen Rechtsträgers,dessen Gläubiger sie sind, nach § 19 Abs. 3 UmwG als bekannt gemacht gilt, ihren Anspruch nach Grund und Höhe schriftlich anmelden, Sicherheit zu leisten, soweit sie nicht Befriedigung verlangen können. Dieses Recht steht den Gläubigern jedoch nur zu, wenn sie glaubhaft machen, dass durch die Verschmelzung die Erfüllung der Forderung gefährdet wird."
    },
    {
      "date": "2024-10-24",
      "id": "91578",
      "original_text": "Sonstige Registerbekanntmachung\nRheinland-Pfalz Amtsgericht Koblenz HRB 24831\nVAMED Rehaklinik Bad Ems GmbH – Bad Ems",
      "type": "Sonstige Registerbekanntmachung",
      "state": "Rheinland-Pfalz",
      "amtsgericht": "Amtsgericht Koblenz",
      "registernummer": "HRB 24831",
      "registerart": "HRB",
      "company_name": "VAMED Rehaklinik Bad Ems GmbH",
      "company_seat": "Bad Ems",
      "details": "24.10.2024 (Bekanntmachungsdatum)\n\nRheinland-Pfalz Amtsgericht Koblenz HRB 24831\nSonstige Registerbekanntmachung 24.10.2024 (Eintragungsdatum)\n\nVAMED Rehaklinik Bad Ems GmbH\nGesellschaft mit beschränkter Haftung\nBad Ems\n\nDie Gesellschaft hat Gläubigern, deren Forderungen vor dieser Bekanntmachung begründet worden sind, Sicherheit zu leisten, soweit sie nicht Befriedigung verlangen können, wenn sie sich binnen sechs Monaten zu diesem Zweck melden."
    },
    {
      "date": "2024-10-24",
      "id": "91579",
      "original_text": "Registerbekanntmachung nach dem Umwandlungsgesetz\nRheinland-Pfalz Amtsgericht Montabaur HRA 20551\nImhäuser Grundstücksgesellschaft mbH & Co. KG – Niederfischbach",
      "type": "Registerbekanntmachung nach dem Umwandlungsgesetz",
      "state": "Rheinland-Pfalz",
      "amtsgericht": "Amtsgericht Montabaur",
      "registernummer": "HRA 20551",
      "registerart": "HRA",
      "company_name": "Imhäuser Grundstücksgesellschaft mbH & Co. KG",
      "company_seat": "Niederfischbach",
      "details": "24.10.2024 (Bekanntmachungsdatum)\n\nRheinland-Pfalz Amtsgericht Montabaur HRA 20551\nRegisterbekanntmachung nach dem Umwandlungsgesetz 24.10.2024 (Eintragungsdatum)\n\nImhäuser Grundstücksgesellschaft mbH & Co. KG\nKommanditgesellschaft\nNiederfischbach\n\nAls nicht eingetragen wird veröffentlicht:\nDen Gläubigern des formwechselnden Rechtsträgers ist, wenn sie binnen sechs Monaten nach dem Tag, an dem die Eintragung des Formwechsels nach § 201 UmwG als bekannt gemacht gilt, ihren Anspruch nach Grund und Höhe schriftlich anmelden, Sicherheit zu leisten, soweit sie nicht Befriedigung verlangen können. Dieses Recht steht den Gläubigern jedoch nur zu, wenn sie glaubhaft machen, dass durch den Formwechsel die Erfüllung der Forderung gefährdet wird."
    },
    {
      "date": "2024-10-24",
      "id": "91580",
      "original_text": "Registerbekanntmachung nach dem Umwandlungsgesetz\nRheinland-Pfalz Amtsgericht Koblenz VR 21178\nPfadfinderstamm Panthera Nigra Ediger-Eller e.V. – Ediger-Eller",
      "type": "Registerbekanntmachung nach dem Umwandlungsgesetz",
      "state": "Rheinland-Pfalz",
      "amtsgericht": "Amtsgericht Koblenz",
      "registernummer": "VR 21178",
      "registerart": "VR",
      "company_name": "Pfadfinderstamm Panthera Nigra Ediger-Eller e.V.",
      "company_seat": "Ediger-Eller",
      "details": "24.10.2024 (Bekanntmachungsdatum)\n\nRheinland-Pfalz Amtsgericht Koblenz VR 21178\nRegisterbekanntmachung nach dem Umwandlungsgesetz 24.10.2024 (Eintragungsdatum)\n\nPfadfinderstamm Panthera Nigra Ediger-Eller e.V.\neingetragener Verein\nEdiger-Eller\n\nAls nicht eingetragen wird veröffentlicht: Den Gläubigern der an der Verschmelzung beteiligten Rechtsträger ist, wenn sie binnen sechs Monaten nach dem Tag, an dem die Eintragung der Verschmelzung in das Register des Sitzes desjenigen Rechtsträgers,dessen Gläubiger sie sind, nach § 19 Abs. 3 UmwG als bekannt gemacht gilt, ihren Anspruch nach Grund und Höhe schriftlich anmelden, Sicherheit zu leisten, soweit sie nicht Befriedigung verlangen können. Dieses Recht steht den Gläubigern jedoch nur zu, wenn sie glaubhaft machen, dass durch die Verschmelzung die Erfüllungd er Forderung gefährdet wird."
    },
    {
      "date": "2024-10-24",
      "id": "91581",
      "original_text": "Löschungsankündigung\nRheinland-Pfalz Amtsgericht Bad Kreuznach HRB 22332\nWANG GmbH – Hoppstädten-Weiersbach",
      "type": "Löschungsankündigung",
      "state": "Rheinland-Pfalz",
      "amtsgericht": "Amtsgericht Bad Kreuznach",
      "registernummer": "HRB 22332",
      "registerart": "HRB",
      "company_name": "WANG GmbH",
      "company_seat": "Hoppstädten-Weiersbach",
      "details": "24.10.2024 (Bekanntmachungsdatum)\n\nRheinland-Pfalz Amtsgericht Bad Kreuznach HRB 22332\nLöschungsankündigung\n\nWANG GmbH\nGesellschaft mit beschränkter Haftung\nHoppstädten-Weiersbach\n\nDas Registergericht beabsichtigt die Gesellschaft wegen Vermögenslosigkeit im Handelsregister von Amts wegen nach § 394 FamFG zu löschen. Die Frist zur Erhebung eines Widerspruchs gegen die beabsichtigte Löschung ist auf einen Monat ab Veröffentlichung bestimmt."
    },
    {
      "date": "2024-10-24",
      "id": "91582",
      "original_text": "Registerbekanntmachung nach dem Umwandlungsgesetz\nRheinland-Pfalz Amtsgericht Mainz HRA 41653\nAktiv & Gesund Mainz Gonsenheim GmbH & Co. KG – Mainz",
      "type": "Registerbekanntmachung nach dem Umwandlungsgesetz",
      "state": "Rheinland-Pfalz",
      "amtsgericht": "Amtsgericht Mainz",
      "registernummer": "HRA 41653",
      "registerart": "HRA",
      "company_name": "Aktiv & Gesund Mainz Gonsenheim GmbH & Co. KG",
      "company_seat": "Mainz",
      "details": "24.10.2024 (Bekanntmachungsdatum)\n\nRheinland-Pfalz Amtsgericht Mainz HRA 41653\nRegisterbekanntmachung nach dem Umwandlungsgesetz 24.10.2024 (Eintragungsdatum)\n\nAktiv & Gesund Mainz Gonsenheim GmbH & Co. KG\nKommanditgesellschaft\nMainz\n\nAls nicht eingetragen wird veröffentlicht:\nDen Gläubigern des formwechselnden Rechtsträgers ist, wenn sie binnen sechs Monaten nach dem Tag, an dem die Eintragung des Formwechsels nach § 201 UmwG als bekannt gemacht gilt, ihren Anspruch nach Grund und Höhe schriftlich anmelden, Sicherheit zu leisten, soweit sie nicht Befriedigung verlangen können. Dieses Recht steht den Gläubigern jedoch nur zu, wenn sie glaubhaft machen, dass durch den Formwechsel die Erfüllung der Forderung gefährdet wird."
    },
    {
      "date": "2024-10-24",
      "id": "91583",
      "original_text": "Registerbekanntmachung nach dem Umwandlungsgesetz\nRheinland-Pfalz Amtsgericht Wittlich HRA 42103\nBjörn Friedmann e.K. – Trier",
      "type": "Registerbekanntmachung nach dem Umwandlungsgesetz",
      "state": "Rheinland-Pfalz",
      "amtsgericht": "Amtsgericht Wittlich",
      "registernummer": "HRA 42103",
      "registerart": "HRA",
      "company_name": "Björn Friedmann e.K.",
      "company_seat": "Trier",
      "details": "24.10.2024 (Bekanntmachungsdatum)\n\nRheinland-Pfalz Amtsgericht Wittlich HRA 42103\nRegisterbekanntmachung nach dem Umwandlungsgesetz 24.10.2024 (Eintragungsdatum)\n\nBjörn Friedmann e.K.\nEinzelkaufmann / Einzelkauffrau\nTrier\n\nAls nicht eingetragen wird veröffentlicht: Den Gläubigern der an der Ausgliederung beteiligten Rechtsträger ist, wenn sie binnen sechs Monaten nac hdem Tag, an dem die Eintragung der Ausgliederung in das Register des Sitzes desjenigen Rechtsträgers,dessen Gläubiger sie sind, nach § 19 Abs. 3 UmwG als bekannt gemacht gilt, ihren Anspruch nach Grund und Höhe schriftlich anmelden, Sicherheit zu leisten, soweit sie nicht Befriedigung verlangen können. Dieses Recht steht den Gläubigern jedoch nur zu, wenn sie glaubhaft machen, dass durch die Ausgliederung die Erfüllung der Forderung gefährdet wird."
    },
    {
      "date": "2024-10-24",
      "id": "91584",
      "original_text": "Löschungsankündigung\nRheinland-Pfalz Amtsgericht Montabaur HRA 20517\nR.M.W. 2007 Ltd. & Co. KG – Neuwied",
      "type": "Löschungsankündigung",
      "state": "Rheinland-Pfalz",
      "amtsgericht": "Amtsgericht Montabaur",
      "registernummer": "HRA 20517",
      "registerart": "HRA",
      "company_name": "R.M.W. 2007 Ltd. & Co. KG",
      "company_seat": "Neuwied",
      "details": "24.10.2024 (Bekanntmachungsdatum)\n\nRheinland-Pfalz Amtsgericht Montabaur HRA 20517\nLöschungsankündigung\n\nR.M.W. 2007 Ltd. & Co. KG\nKommanditgesellschaft\nNeuwied\n\nDas Registergericht beabsichtigt die Firma von Amts wegen nach § 394 FamFG zu löschen. Die Frist zur Erhebung eines Widerspruchs ist auf´1 Monat festgesetzt."
    },
    {
      "date": "2024-10-24",
      "id": "91585",
      "original_text": "Registerbekanntmachung nach dem Umwandlungsgesetz\nNordrhein-Westfalen Amtsgericht Duisburg HRB 27645\nR. C. Mannesmann GmbH – Duisburg",
      "type": "Registerbekanntmachung nach dem Umwandlungsgesetz",
      "state": "Nordrhein-Westfalen",
      "amtsgericht": "Amtsgericht Duisburg",
      "registernummer": "HRB 27645",
      "registerart": "HRB",
      "company_name": "R. C. Mannesmann GmbH",
      "company_seat": "Duisburg",
      "details": "24.10.2024 (Bekanntmachungsdatum)\n\nNordrhein-Westfalen Amtsgericht Duisburg HRB 27645\nRegisterbekanntmachung nach dem Umwandlungsgesetz 24.10.2024 (Eintragungsdatum)\n\nR. C. Mannesmann GmbH\nGesellschaft mit beschränkter Haftung\nDuisburg\n\nDen Gläubigern der an der Verschmelzung beteiligten Rechtsträger ist, wenn sie binnen sechs Monaten nach dem Tag, an dem die Eintragung der Verschmelzung in das Register des Sitzes desjenigen Rechtsträgers, dessen Gläubiger sie sind, nach § 19 Absatz 3 UmwG als bekanntgemacht gilt, ihren Anspruch nach Grund und Höhe schriftlich anmelden, Sicherheit zu leisten, soweit sie nicht Befriedigung verlangen können. Dieses Recht steht den Gläubigern jedoch nur zu, wenn sie glaubhaft machen, dass durch die Verschmelzung die Erfüllung ihrer Forderung gefährdet wird."
    },
    {
      "date": "2024-10-24",
      "id": "91586",
      "original_text": "Löschungsankündigung\nNordrhein-Westfalen Amtsgericht Hagen HRB 10395\nPrivileg Lounge GmbH – Hagen",
      "type": "Löschungsankündigung",
      "state": "Nordrhein-Westfalen",
      "amtsgericht": "Amtsgericht Hagen",
      "registernummer": "HRB 10395",
      "registerart": "HRB",
      "company_name": "Privileg Lounge GmbH",
      "company_seat": "Hagen",
      "details": "24.10.2024 (Bekanntmachungsdatum)\n\nNordrhein-Westfalen Amtsgericht Hagen HRB 10395\nLöschungsankündigung\n\nPrivileg Lounge GmbH\nGesellschaft mit beschränkter Haftung\nHagen\n\nEs wird bekannt gemacht:\nDas Registergericht beabsichtigt, die im Handelsregister eingetragene Gesellschaft gemäß § 394 I FamFG wegen Vermögenslosigkeit von Amts wegen zu löschen. Gegen diese Verfügung kann Widerspruch eingelegt werden. Die Frist zur Erhebung eines Widerspruchs gegen die beabsichtigte Löschung von Amts wegen ist auf drei Monate festgesetzt.\nRechtsbehelfsbelehrung:\nGegen diese Verfügung können Sie Widerspruch einlegen.\nDer Widerspruch ist bei dem Amtsgericht Hagen, Heinitzstraße 42, 58097 Hagen schriftlich in deutscher Sprache oder zur Niederschrift der Geschäftsstelle einzulegen. Der Widerspruch kann auch zur Niederschrift der Geschäftsstelle eines jeden Amtsgerichts abgegeben werden.\nDer Widerspruch muss spätestens innerhalb der gesetzten Frist bei dem Amtsgericht Hagen eingegangen sein. Dies gilt auch dann, wenn der Widerspruch zur Geschäftsstelle eines anderen Amtsgerichtes abgegeben wurde. Die Frist beginnt mit der Veröffentlichung. Fällt das Ende der Frist auf einen Sonntag, einen allgemeinen Feiertag oder Sonnabend, so endet die Frist mit Ablauf des nächsten Werktages.\nDer Widerspruch muss die Bezeichnung der angefochtenen Verfügung sowie die Erklärung erhalten, dass Widerspruch gegen diese Verfügung eingelegt wird. Er ist zu unterzeichnen und soll begründet werden."
    },
    {
      "date": "2024-10-24",
      "id": "91587",
      "original_text": "Löschungsankündigung\nNordrhein-Westfalen Amtsgericht Hagen HRA 298\nWolfgang Herres Sanitärtechnik-Gasheizungen Inh. Roland Klimkeit – Hagen",
      "type": "Löschungsankündigung",
      "state": "Nordrhein-Westfalen",
      "amtsgericht": "Amtsgericht Hagen",
      "registernummer": "HRA 298",
      "registerart": "HRA",
      "company_name": "Wolfgang Herres Sanitärtechnik-Gasheizungen Inh. Roland Klimkeit",
      "company_seat": "Hagen",
      "details": "24.10.2024 (Bekanntmachungsdatum)\n\nNordrhein-Westfalen Amtsgericht Hagen HRA 298\nLöschungsankündigung\n\nWolfgang Herres Sanitärtechnik-Gasheizungen Inh. Roland Klimkeit\nEinzelkaufmann / Einzelkauffrau\nHagen\n\nDas Gericht beabsichtigt, das einzelkaufmännische Unternehmen gemäß § 393 FamFG von Amts wegen zu löschen. Zur Geltendmachung eines eventuellen Widerspruches gegen die beabsichtigte Löschung wird gemäß § 393 FamFG eine Frist von einem Monat gesetzt, die mit dieser Veröffentlichung beginnt.\nDer Widerspruch ist bei dem Amtsgericht Hagen, Heinitzstr. 42, 58097 Hagen schriftlich in deutscher Sprache oder zur Niederschrift der Geschäftsstelle einzulegen.\nDer Widerspruch kann auch zur Niederschrift der Geschäftsstelle eines jeden Amtsgerichts abgegeben werden.\nDer Widerspruch muss spätestens innerhalb der gesetzten Frist bei dem Amtsgericht Hagen eingegangen sein. Dies gilt auch dann, wenn der Widerspruch zur Niederschrift der Geschäftsstelle eines anderen Amtsgerichts abgegeben wurde. Die Frist beginnt mit der Veröffentlichung.\nFällt das Ende der Frist auf einen Sonntag, einen allgemeinen Feiertag oder Sonnabend, so endet die Frist mit Ablauf des nächsten Werktages.\nDer Widerspruch muss die Bezeichnung der angefochtenen Verfügung sowie die Erklärung enthalten, dass Widerspruch gegen diese Verfügung eingelegt wird. Er ist zu unterzeichnen und soll begründet werden.\nAnderenfalls wird nach Ablauf der Frist das Erlöschen der Firma von Amts wegen in das hiesige Handelsregister eingetragen werden."
    },
    {
      "date": "2024-10-24",
      "id": "91588",
      "original_text": "Löschungsankündigung\nNordrhein-Westfalen Amtsgericht Bonn HRB 26901\nCasaClean UG (haftungsbeschränkt) – Bornheim",
      "type": "Löschungsankündigung",
      "state": "Nordrhein-Westfalen",
      "amtsgericht": "Amtsgericht Bonn",
      "registernummer": "HRB 26901",
      "registerart": "HRB",
      "company_name": "CasaClean UG (haftungsbeschränkt)",
      "company_seat": "Bornheim",
      "details": "24.10.2024 (Bekanntmachungsdatum)\n\nNordrhein-Westfalen Amtsgericht Bonn HRB 26901\nLöschungsankündigung\n\nCasaClean UG (haftungsbeschränkt)\nGesellschaft mit beschränkter Haftung\nBornheim\n\nDas Registergericht beabsichtigt die Gesellschaft von Amts wegen nach § 394 FamFG zu löschen. Die Frist zur Erhebung eines Widerspruchs ist auf einen Monat festgesetzt."
    },
    {
      "date": "2024-10-24",
      "id": "91589",
      "original_text": "Registerbekanntmachung nach dem Umwandlungsgesetz\nNordrhein-Westfalen Amtsgericht Hagen HRB 13089\ndreizett Plus Gevelsberg GmbH – Gevelsberg",
      "type": "Registerbekanntmachung nach dem Umwandlungsgesetz",
      "state": "Nordrhein-Westfalen",
      "amtsgericht": "Amtsgericht Hagen",
      "registernummer": "HRB 13089",
      "registerart": "HRB",
      "company_name": "dreizett Plus Gevelsberg GmbH",
      "company_seat": "Gevelsberg",
      "details": "24.10.2024 (Bekanntmachungsdatum)\n\nNordrhein-Westfalen Amtsgericht Hagen HRB 13089\nRegisterbekanntmachung nach dem Umwandlungsgesetz 21.10.2024 (Eintragungsdatum)\n\ndreizett Plus Gevelsberg GmbH\nGesellschaft mit beschränkter Haftung\nGevelsberg\n\nDen Gläubigern der an der Ausgliederung beteiligten Rechtsträger ist, wenn sie binnen sechs Monaten nach dem Tag, an dem die Eintragung der Ausgliederung in das Register des Sitzes desjenigen Rechtsträgers, dessen Gläubiger sie sind, nach § 19 Absatz 3 UmwG als bekanntgemacht gilt, ihren Anspruch nach Grund und Höhe schriftlich anmelden, Sicherheit zu leisten, soweit sie nicht Befriedigung verlangen können. Dieses Recht steht den Gläubigern jedoch nur zu, wenn sie glaubhaft machen, dass durch die Ausgliederung die Erfüllung ihrer Forderung gefährdet wird."
    },
    {
      "date": "2024-10-24",
      "id": "91590",
      "original_text": "Löschungsankündigung\nNordrhein-Westfalen Amtsgericht Paderborn HRB 15823\nSommer wie Winter GmbH – Paderborn",
      "type": "Löschungsankündigung",
      "state": "Nordrhein-Westfalen",
      "amtsgericht": "Amtsgericht Paderborn",
      "registernummer": "HRB 15823",
      "registerart": "HRB",
      "company_name": "Sommer wie Winter GmbH",
      "company_seat": "Paderborn",
      "details": "24.10.2024 (Bekanntmachungsdatum)\n\nNordrhein-Westfalen Amtsgericht Paderborn HRB 15823\nLöschungsankündigung\n\nSommer wie Winter GmbH\nGesellschaft mit beschränkter Haftung\nPaderborn\n\nDas Registergericht beabsichtigt die eingetragene Geschäftsführerin Chayka Shankova von Amts wegen nach § 395 FamFG zu löschen. Die Frist zur Erhebung eines Widerspruchs ist auf einen Monat festgesetzt."
    },
    {
      "date": "2024-10-24",
      "id": "91591",
      "original_text": "Registerbekanntmachung nach dem Umwandlungsgesetz\nNordrhein-Westfalen Amtsgericht Bielefeld HRB 38886\nstegema GmbH – Bielefeld",
      "type": "Registerbekanntmachung nach dem Umwandlungsgesetz",
      "state": "Nordrhein-Westfalen",
      "amtsgericht": "Amtsgericht Bielefeld",
      "registernummer": "HRB 38886",
      "registerart": "HRB",
      "company_name": "stegema GmbH",
      "company_seat": "Bielefeld",
      "details": "24.10.2024 (Bekanntmachungsdatum)\n\nNordrhein-Westfalen Amtsgericht Bielefeld HRB 38886\nRegisterbekanntmachung nach dem Umwandlungsgesetz 24.10.2024 (Eintragungsdatum)\n\nstegema GmbH\nGesellschaft mit beschränkter Haftung\nBielefeld\n\nDen Gläubigern der an der formwechselnden Umwandlung beteiligten Rechtsträger ist, wenn sie binnen sechs Monaten nach dem Tag, an dem die Eintragung der formwechselnden Umwandlung in das Register des Sitzes desjenigen Rechtsträgers, dessen Gläubiger sie sind, nach § 19 Absatz 3 UmwG als bekanntgemacht gilt, ihren Anspruch nach Grund und Höhe schriftlich anmelden, Sicherheit zu leisten, soweit sie nicht Befriedigung verlangen können. Dieses Recht steht den Gläubigern jedoch nur zu, wenn sie glaubhaft machen, dass durch die formwechselnden Umwandlung die Erfüllung ihrer Forderung gefährdet wird."
    },
    {
      "date": "2024-10-24",
      "id": "91592",
      "original_text": "Löschungsankündigung\nNordrhein-Westfalen Amtsgericht Krefeld HRB 17651\nFiyori Brands GmbH – Krefeld",
      "type": "Löschungsankündigung",
      "state": "Nordrhein-Westfalen",
      "amtsgericht": "Amtsgericht Krefeld",
      "registernummer": "HRB 17651",
      "registerart": "HRB",
      "company_name": "Fiyori Brands GmbH",
      "company_seat": "Krefeld",
      "details": "24.10.2024 (Bekanntmachungsdatum)\n\nNordrhein-Westfalen Amtsgericht Krefeld HRB 17651\nLöschungsankündigung\n\nFiyori Brands GmbH\nGesellschaft mit beschränkter Haftung\nKrefeld\n\nDas Registergericht beabsichtigt die Gesellschaft von Amts wegen nach § 394 FamFG zu löschen. Die Frist zur Erhebung eines Widerspruchs ist auf einen Monat festgesetzt."
    },
    {
      "date": "2024-10-24",
      "id": "91593",
      "original_text": "Einreichung neuer Dokumente\nNordrhein-Westfalen Amtsgericht Duisburg HRB 1140\nStadtwerke Duisburg Aktiengesellschaft – Duisburg",
      "type": "Einreichung neuer Dokumente",
      "state": "Nordrhein-Westfalen",
      "amtsgericht": "Amtsgericht Duisburg",
      "registernummer": "HRB 1140",
      "registerart": "HRB",
      "company_name": "Stadtwerke Duisburg Aktiengesellschaft",
      "company_seat": "Duisburg",
      "details": "24.10.2024 (Bekanntmachungsdatum)\n\nNordrhein-Westfalen Amtsgericht Duisburg HRB 1140\nEinreichung neuer Dokumente\n\nStadtwerke Duisburg Aktiengesellschaft\nAktiengesellschaft\nDuisburg\n\nDem Registergericht ist eine neue Liste der Mitglieder des Aufsichtsrates eingereicht worden."
    },
    {
      "date": "2024-10-24",
      "id": "91594",
      "original_text": "Einreichung neuer Dokumente\nNordrhein-Westfalen Amtsgericht Duisburg HRB 50\nDuisburger Verkehrsgesellschaft Aktiengesellschaft – Duisburg",
      "type": "Einreichung neuer Dokumente",
      "state": "Nordrhein-Westfalen",
      "amtsgericht": "Amtsgericht Duisburg",
      "registernummer": "HRB 50",
      "registerart": "HRB",
      "company_name": "Duisburger Verkehrsgesellschaft Aktiengesellschaft",
      "company_seat": "Duisburg",
      "details": "24.10.2024 (Bekanntmachungsdatum)\n\nNordrhein-Westfalen Amtsgericht Duisburg HRB 50\nEinreichung neuer Dokumente\n\nDuisburger Verkehrsgesellschaft Aktiengesellschaft\nAktiengesellschaft\nDuisburg\n\nDem Registergericht sind neue Listen der Mitglieder des Aufsichtsrates eingereicht worden."
    },
    {
      "date": "2024-10-24",
      "id": "91595",
      "original_text": "Löschungsankündigung\nNordrhein-Westfalen Amtsgericht Düsseldorf HRB 82693\nDYAR TAXI GmbH – Düsseldorf",
      "type": "Löschungsankündigung",
      "state": "Nordrhein-Westfalen",
      "amtsgericht": "Amtsgericht Düsseldorf",
      "registernummer": "HRB 82693",
      "registerart": "HRB",
      "company_name": "DYAR TAXI GmbH",
      "company_seat": "Düsseldorf",
      "details": "24.10.2024 (Bekanntmachungsdatum)\n\nNordrhein-Westfalen Amtsgericht Düsseldorf HRB 82693\nLöschungsankündigung\n\nDYAR TAXI GmbH\nGesellschaft mit beschränkter Haftung\nDüsseldorf\n\nDas Registergericht beabsichtigt die Gesellschaft von Amts wegen nach § 394 FamFG zu löschen. Die Frist zur Erhebung eines Widerspruchs ist auf 3 Wochen festgesetzt.\n\nRechtsbehelfsbelehrung:\nDas Widerspruchsrecht steht jedem zu, der an der Unterlassung der Löschung ein berechtigtes Interesse hat. Der Widerspruch ist bei dem Amtsgericht Düsseldorf -Registergericht-, Werdener Straße 1, 40227 Düsseldorf schriftlich in deutscher Sprache oder zur Niederschrift der Geschäftsstelle einzulegen. Der Widerspruch kann auch zur Niederschrift der Geschäftsstelle eines jeden Amtsgerichtes abgegeben werden. Die Einlegung ist auch durch Übertragung eines elektronischen Dokuments an die elektronische Poststelle des Gerichts möglich. Das elektronische Dokument muss für die Bearbeitung durch das Gericht geeignet und mit einer qualifizierten elektronischen Signatur der verantwortenden Person versehen sein oder von der verantwortenden Person signiert und auf einem sicheren Übermittlungsweg gemäß § 130a ZPO nach näherer Maßgabe der Verordnung über die technischen Rahmenbedingungen des elektronischen Rechtsverkehrs und über das besondere elektronische Behördenpostfach (BGBl. I, S.3803) eingereicht werden. Weitere Informationen erhalten Sie auf der Internetseite www.justiz.de.\nDer Widerspruch muss spätestens innerhalb der gesetzten Frist nach dem Datum der Bekanntmachung der Löschungsankündigung bei dem Amtsgericht - Registergericht - Düsseldorf eingegangen sein.  Dies gilt auch dann, wenn der Widerspruch zur Niederschrift der Geschäftsstelle eines anderen Amtsgerichtes abgegeben wurde. Die Frist beginnt mit dem Tage der Bekanntmachung der Löschungsankündigung in dem für die Bekanntmachung der Eintragungen in das Handelsregister bestimmten elektronischen Informations- und Kommunikationssystem nach § 10 des Handelsgesetzbuches. Fällt das Ende der Frist auf einen Sonntag, einen allgemeinen Feiertag oder Sonnabend, so endet die Frist mit Ablauf des nächsten Werktages.\nDer Widerspruch muss die Bezeichnung der angefochtenen Löschungsankündigung sowie die Erklärung enthalten, dass Widerspruch gegen diese Löschungsankündigung eingelegt wird. Er ist zu unterzeichnen und soll begründet werden."
    },
    {
      "date": "2024-10-24",
      "id": "91596",
      "original_text": "Registerbekanntmachung nach dem Umwandlungsgesetz\nNordrhein-Westfalen Amtsgericht Bielefeld HRA 17449\nstegema GmbH & Co. KG – Bielefeld",
      "type": "Registerbekanntmachung nach dem Umwandlungsgesetz",
      "state": "Nordrhein-Westfalen",
      "amtsgericht": "Amtsgericht Bielefeld",
      "registernummer": "HRA 17449",
      "registerart": "HRA",
      "company_name": "stegema GmbH & Co. KG",
      "company_seat": "Bielefeld",
      "details": "24.10.2024 (Bekanntmachungsdatum)\n\nNordrhein-Westfalen Amtsgericht Bielefeld HRA 17449\nRegisterbekanntmachung nach dem Umwandlungsgesetz 24.10.2024 (Eintragungsdatum)\n\nstegema GmbH & Co. KG\nKommanditgesellschaft\nBielefeld\n\nDen Gläubigern der an der formwechselnden Umwandlung beteiligten Rechtsträger ist, wenn sie binnen sechs Monaten nach dem Tag, an dem die Eintragung der formwechselnden Umwandlung in das Register des Sitzes desjenigen Rechtsträgers, dessen Gläubiger sie sind, nach § 19 Absatz 3 UmwG als bekanntgemacht gilt, ihren Anspruch nach Grund und Höhe schriftlich anmelden, Sicherheit zu leisten, soweit sie nicht Befriedigung verlangen können. Dieses Recht steht den Gläubigern jedoch nur zu, wenn sie glaubhaft machen, dass durch die formwechselnden Umwandlung die Erfüllung ihrer Forderung gefährdet wird."
    },
    {
      "date": "2024-10-24",
      "id": "91597",
      "original_text": "Einreichung neuer Dokumente\nNordrhein-Westfalen Amtsgericht Duisburg HRB 32070\nZoo Duisburg gGmbH – Duisburg",
      "type": "Einreichung neuer Dokumente",
      "state": "Nordrhein-Westfalen",
      "amtsgericht": "Amtsgericht Duisburg",
      "registernummer": "HRB 32070",
      "registerart": "HRB",
      "company_name": "Zoo Duisburg gGmbH",
      "company_seat": "Duisburg",
      "details": "24.10.2024 (Bekanntmachungsdatum)\n\nNordrhein-Westfalen Amtsgericht Duisburg HRB 32070\nEinreichung neuer Dokumente\n\nZoo Duisburg gGmbH\nGesellschaft mit beschränkter Haftung\nDuisburg\n\nDem Registergericht ist eine Liste der Mitglieder des Aufsichtsrates eingereicht worden."
    },
    {
      "date": "2024-10-24",
      "id": "91598",
      "original_text": "Löschungsankündigung\nNordrhein-Westfalen Amtsgericht Neuss HRA 6741\nHagen Baugesellschaft mbH & Co. KG – Korschenbroich",
      "type": "Löschungsankündigung",
      "state": "Nordrhein-Westfalen",
      "amtsgericht": "Amtsgericht Neuss",
      "registernummer": "HRA 6741",
      "registerart": "HRA",
      "company_name": "Hagen Baugesellschaft mbH & Co. KG",
      "company_seat": "Korschenbroich",
      "details": "24.10.2024 (Bekanntmachungsdatum)\n\nNordrhein-Westfalen Amtsgericht Neuss HRA 6741\nLöschungsankündigung 11.10.2024 (Eintragungsdatum)\n\nHagen Baugesellschaft mbH & Co. KG\nKommanditgesellschaft\nKorschenbroich\n\nAmtslöschung: Das Gericht beabsichtigt, die Gesellschaft gemäß § 31 Absatz II HGB i.V. m § 394 Absatz IV FamFG im Handelsregister zu löschen.  Gegen die Löschung kann binnen eines Monats jeder Widerspruch erheben, der an der Unterlassung der Löschung ein berechtigtes Interesse hat."
    },
    {
      "date": "2024-10-24",
      "id": "91599",
      "original_text": "Registerbekanntmachung nach dem Umwandlungsgesetz\nNordrhein-Westfalen Amtsgericht Köln HRA 37792\nKaufhof Heidelberg GmbH & Co. KG – Köln",
      "type": "Registerbekanntmachung nach dem Umwandlungsgesetz",
      "state": "Nordrhein-Westfalen",
      "amtsgericht": "Amtsgericht Köln",
      "registernummer": "HRA 37792",
      "registerart": "HRA",
      "company_name": "Kaufhof Heidelberg GmbH & Co. KG",
      "company_seat": "Köln",
      "details": "24.10.2024 (Bekanntmachungsdatum)\n\nNordrhein-Westfalen Amtsgericht Köln HRA 37792\nRegisterbekanntmachung nach dem Umwandlungsgesetz 24.10.2024 (Eintragungsdatum)\n\nKaufhof Heidelberg GmbH & Co. KG\nKommanditgesellschaft\nKöln\n\nDen Gläubigern der an der formwechselnden Umwandlung beteiligten Rechtsträger ist, wenn sie binnen sechs Monaten nach dem Tag, an dem die Eintragung der formwechselnden Umwandlung in das Register des Sitzes derjenigen Rechtsträger deren Gläubiger sie sind, nach § 19 Absatz 3 UmwG als bekanntgemacht gilt, ihren Anspruch nach Grund und Höhe schriftlich anmelden, Sicherheit zu leisten, soweit sie nicht Befriedigung verlangen können. Dieses Recht steht den Gläubigern jedoch nur zu, wenn sie glaubhaft machen, dass durch die formwechselnden Umwandlung die Erfüllung ihrer Forderung gefährdet wird."
    },
    {
      "date": "2024-10-24",
      "id": "91600",
      "original_text": "Einreichung neuer Dokumente\nNordrhein-Westfalen Amtsgericht Bonn HRB 6717\nBICC - Bonn International Centre for Conflict Studies gGmbH – Bonn",
      "type": "Einreichung neuer Dokumente",
      "state": "Nordrhein-Westfalen",
      "amtsgericht": "Amtsgericht Bonn",
      "registernummer": "HRB 6717",
      "registerart": "HRB",
      "company_name": "BICC - Bonn International Centre for Conflict Studies gGmbH",
      "company_seat": "Bonn",
      "details": "24.10.2024 (Bekanntmachungsdatum)\n\nNordrhein-Westfalen Amtsgericht Bonn HRB 6717\nEinreichung neuer Dokumente\n\nBICC - Bonn International Centre for Conflict Studies gGmbH\nGesellschaft mit beschränkter Haftung\nBonn\n\nDem Registergericht ist eine neue Liste der Mitglieder des Aufsichtsrates eingereicht worden."
    },
    {
      "date": "2024-10-24",
      "id": "91601",
      "original_text": "Löschungsankündigung\nNordrhein-Westfalen Amtsgericht Düsseldorf HRB 94148\nDBC Damasco Business Center GmbH – Düsseldorf",
      "type": "Löschungsankündigung",
      "state": "Nordrhein-Westfalen",
      "amtsgericht": "Amtsgericht Düsseldorf",
      "registernummer": "HRB 94148",
      "registerart": "HRB",
      "company_name": "DBC Damasco Business Center GmbH",
      "company_seat": "Düsseldorf",
      "details": "24.10.2024 (Bekanntmachungsdatum)\n\nNordrhein-Westfalen Amtsgericht Düsseldorf HRB 94148\nLöschungsankündigung\n\nDBC Damasco Business Center GmbH\nGesellschaft mit beschränkter Haftung\nDüsseldorf\n\nDas Registergericht beabsichtigt die Gesellschaft von Amts wegen nach § 394 FamFG zu löschen. Die Frist zur Erhebung eines Widerspruchs ist auf 3 Wochen festgesetzt.\n\nRechtsbehelfsbelehrung:\nDas Widerspruchsrecht steht jedem zu, der an der Unterlassung der Löschung ein berechtigtes Interesse hat. Der Widerspruch ist bei dem Amtsgericht Düsseldorf -Registergericht-, Werdener Straße 1, 40227 Düsseldorf schriftlich in deutscher Sprache oder zur Niederschrift der Geschäftsstelle einzulegen. Der Widerspruch kann auch zur Niederschrift der Geschäftsstelle eines jeden Amtsgerichtes abgegeben werden. Die Einlegung ist auch durch Übertragung eines elektronischen Dokuments an die elektronische Poststelle des Gerichts möglich. Das elektronische Dokument muss für die Bearbeitung durch das Gericht geeignet und mit einer qualifizierten elektronischen Signatur der verantwortenden Person versehen sein oder von der verantwortenden Person signiert und auf einem sicheren Übermittlungsweg gemäß § 130a ZPO nach näherer Maßgabe der Verordnung über die technischen Rahmenbedingungen des elektronischen Rechtsverkehrs und über das besondere elektronische Behördenpostfach (BGBl. I, S.3803) eingereicht werden. Weitere Informationen erhalten Sie auf der Internetseite www.justiz.de.\nDer Widerspruch muss spätestens innerhalb der gesetzten Frist nach dem Datum der Bekanntmachung der Löschungsankündigung bei dem Amtsgericht - Registergericht - Düsseldorf eingegangen sein.  Dies gilt auch dann, wenn der Widerspruch zur Niederschrift der Geschäftsstelle eines anderen Amtsgerichtes abgegeben wurde. Die Frist beginnt mit dem Tage der Bekanntmachung der Löschungsankündigung in dem für die Bekanntmachung der Eintragungen in das Handelsregister bestimmten elektronischen Informations- und Kommunikationssystem nach § 10 des Handelsgesetzbuches. Fällt das Ende der Frist auf einen Sonntag, einen allgemeinen Feiertag oder Sonnabend, so endet die Frist mit Ablauf des nächsten Werktages.\nDer Widerspruch muss die Bezeichnung der angefochtenen Löschungsankündigung sowie die Erklärung enthalten, dass Widerspruch gegen diese Löschungsankündigung eingelegt wird. Er ist zu unterzeichnen und soll begründet werden."
    },
    {
      "date": "2024-10-24",
      "id": "91602",
      "original_text": "Löschungsankündigung\nNordrhein-Westfalen Amtsgericht Duisburg HRB 35100\nGambit Construction GmbH – Duisburg",
      "type": "Löschungsankündigung",
      "state": "Nordrhein-Westfalen",
      "amtsgericht": "Amtsgericht Duisburg",
      "registernummer": "HRB 35100",
      "registerart": "HRB",
      "company_name": "Gambit Construction GmbH",
      "company_seat": "Duisburg",
      "details": "24.10.2024 (Bekanntmachungsdatum)\n\nNordrhein-Westfalen Amtsgericht Duisburg HRB 35100\nLöschungsankündigung\n\nGambit Construction GmbH\nGesellschaft mit beschränkter Haftung\nDuisburg\n\nHRB 35100:\nGambit Construction GmbH, Duisburg\nKarlstraße 10, 47119 Duisburg.\nDas Registergericht beabsichtigt, die im Handelsregister eingetragene Gesellschaft gemäß § 394 FamFG wegen Vermögenslosigkeit von Amts wegen zu löschen. Gegen diese Verfügung kann Widerspruch eingelegt werden. Die Frist zur Erhebung eines Widerspruchs gegen die beabsichtigte Löschung von Amts wegen ist auf drei Monate festgesetzt. Rechtsbehelfsbelehrung Der Widerspruch ist bei dem Amtsgericht Duisburg, Kardinal-Galen-Str. 124-132, 47058 Duisburg schriftlich in deutscher Sprache oder zur Niederschrift der Geschäftsstelle einzulegen. Der Widerspruch kann auch zur Niederschrift der Geschäftsstelle eines jeden Amtsgerichtes abgegeben werden. Die Einlegung ist auch durch Übertragung eines elektronischen Dokuments an die elektronische Poststelle des Gerichts möglich. Das elektronische Dokument muss für die Bearbeitung durch das Gericht geeignet und mit einer qualifizierten elektronischen Signatur der verantwortenden Person versehen sein oder von der verantwortenden Person signiert und auf einem sicheren Übermittlungsweg gemäß § 130 a ZPO nach näherer Maßgabe der Verordnung über die technischen Rahmenbedingungen des elektronischen Rechtsverkehrs und über das besondere elektronische Behördenpostfach (BGBl. I, S. 3803) eingereicht werden. Weitere Informationen erhalten Sie auf der Internetseite www.justiz.de <http://www.justiz.de>. Der Widerspruch muss spätestens innerhalb der gesetzten Frist bei dem Amtsgericht Duisburg eingegangen sein. Dies gilt auch dann, wenn der Widerspruch zur Niederschrift der Geschäftsstelle eines anderen Amtsgerichtes abgegeben wurde. Die Frist beginnt mit der Veröffentlichung. Fällt das Ende der Frist auf einen Sonntag, einen allgemeinen Feiertag oder Sonnabend, so endet die Frist mit Ablauf des nächsten Werktages. Der Widerspruch muss die Bezeichnung der angefochtenen Verfügung sowie die Erklärung enthalten, dass Widerspruch gegen diese Verfügung eingelegt wird. Er ist zu unterzeichnen und soll begründet werden."
    },
    {
      "date": "2024-10-24",
      "id": "91603",
      "original_text": "Registerbekanntmachung nach dem Umwandlungsgesetz\nNordrhein-Westfalen Amtsgericht Bonn HRB 29145\nRheinland Gebäudereinigung GmbH – Bonn",
      "type": "Registerbekanntmachung nach dem Umwandlungsgesetz",
      "state": "Nordrhein-Westfalen",
      "amtsgericht": "Amtsgericht Bonn",
      "registernummer": "HRB 29145",
      "registerart": "HRB",
      "company_name": "Rheinland Gebäudereinigung GmbH",
      "company_seat": "Bonn",
      "details": "24.10.2024 (Bekanntmachungsdatum)\n\nNordrhein-Westfalen Amtsgericht Bonn HRB 29145\nRegisterbekanntmachung nach dem Umwandlungsgesetz 24.10.2024 (Eintragungsdatum)\n\nRheinland Gebäudereinigung GmbH\nGesellschaft mit beschränkter Haftung\nBonn\n\nDen Gläubigern der an der Ausgliederung beteiligten Rechtsträger ist, wenn sie binnen sechs Monaten nach dem Tag, an dem die Eintragung der Ausgliederung in das Register des Sitzes desjenigen Rechtsträgers, dessen Gläubiger sie sind, nach § 19 Absatz 3 UmwG als bekanntgemacht gilt, ihren Anspruch nach Grund und Höhe schriftlich anmelden, Sicherheit zu leisten, soweit sie nicht Befriedigung verlangen können. Dieses Recht steht den Gläubigern jedoch nur zu, wenn sie glaubhaft machen, dass durch die Ausgliederung die Erfüllung ihrer Forderung gefährdet wird."
    },
    {
      "date": "2024-10-24",
      "id": "91604",
      "original_text": "Registerbekanntmachung nach dem Umwandlungsgesetz\nNordrhein-Westfalen Amtsgericht Köln HRB 107694\nHowden Deutschland Holding AG – Köln",
      "type": "Registerbekanntmachung nach dem Umwandlungsgesetz",
      "state": "Nordrhein-Westfalen",
      "amtsgericht": "Amtsgericht Köln",
      "registernummer": "HRB 107694",
      "registerart": "HRB",
      "company_name": "Howden Deutschland Holding AG",
      "company_seat": "Köln",
      "details": "24.10.2024 (Bekanntmachungsdatum)\n\nNordrhein-Westfalen Amtsgericht Köln HRB 107694\nRegisterbekanntmachung nach dem Umwandlungsgesetz 24.10.2024 (Eintragungsdatum)\n\nHowden Deutschland Holding AG\nAktiengesellschaft\nKöln\n\nDen Gläubigern der an der formwechselnden Umwandlung beteiligten Rechtsträger ist, wenn sie binnen sechs Monaten nach dem Tag, an dem die Eintragung der formwechselnden Umwandlung in das Register des Sitzes desjenigen Rechtsträgers, dessen Gläubiger sie sind, nach § 19 Absatz 3 UmwG als bekanntgemacht gilt, ihren Anspruch nach Grund und Höhe schriftlich anmelden, Sicherheit zu leisten, soweit sie nicht Befriedigung verlangen können. Dieses Recht steht den Gläubigern jedoch nur zu, wenn sie glaubhaft machen, dass durch die formwechselnden Umwandlung die Erfüllung ihrer Forderung gefährdet wird."
    },
    {
      "date": "2024-10-24",
      "id": "91605",
      "original_text": "Registerbekanntmachung nach dem Umwandlungsgesetz\nNordrhein-Westfalen Amtsgericht Iserlohn HRB 11087\nDominik Degenhardt GmbH – Neuenrade",
      "type": "Registerbekanntmachung nach dem Umwandlungsgesetz",
      "state": "Nordrhein-Westfalen",
      "amtsgericht": "Amtsgericht Iserlohn",
      "registernummer": "HRB 11087",
      "registerart": "HRB",
      "company_name": "Dominik Degenhardt GmbH",
      "company_seat": "Neuenrade",
      "details": "24.10.2024 (Bekanntmachungsdatum)\n\nNordrhein-Westfalen Amtsgericht Iserlohn HRB 11087\nRegisterbekanntmachung nach dem Umwandlungsgesetz 22.10.2024 (Eintragungsdatum)\n\nDominik Degenhardt GmbH\nGesellschaft mit beschränkter Haftung\nNeuenrade\n\nDen Gläubigern der an der Ausgliederung beteiligten Rechtsträger ist, wenn sie binnen sechs Monaten nach dem Tag, an dem die Eintragung der Ausgliederung in das Register des Sitzes desjenigen Rechtsträgers, dessen Gläubiger sie sind, nach § 19 Absatz 3 UmwG als bekanntgemacht gilt, ihren Anspruch nach Grund und Höhe schriftlich anmelden, Sicherheit zu leisten, soweit sie nicht Befriedigung verlangen können. Dieses Recht steht den Gläubigern jedoch nur zu, wenn sie glaubhaft machen, dass durch die Ausgliederung die Erfüllung ihrer Forderung gefährdet wird."
    },
    {
      "date": "2024-10-24",
      "id": "91606",
      "original_text": "Löschungsankündigung\nNordrhein-Westfalen Amtsgericht Essen HRB 23426\nVisionexpo GmbH – Essen",
      "type": "Löschungsankündigung",
      "state": "Nordrhein-Westfalen",
      "amtsgericht": "Amtsgericht Essen",
      "registernummer": "HRB 23426",
      "registerart": "HRB",
      "company_name": "Visionexpo GmbH",
      "company_seat": "Essen",
      "details": "24.10.2024 (Bekanntmachungsdatum)\n\nNordrhein-Westfalen Amtsgericht Essen HRB 23426\nLöschungsankündigung\n\nVisionexpo GmbH\nGesellschaft mit beschränkter Haftung\nEssen\n\nDas Registergericht beabsichtigt die Gesellschaft von Amts wegen nach § 394 FamFG zu löschen. Die Frist zur Erhebung eines Widerspruchs ist auf einen Monat festgesetzt."
    },
    {
      "date": "2024-10-24",
      "id": "91607",
      "original_text": "Registerbekanntmachung nach dem Umwandlungsgesetz\nThüringen Amtsgericht Jena HRA 506760\nImmo Tech Inh. Christa Wagner e.K. – Mühlhausen/Thüringen",
      "type": "Registerbekanntmachung nach dem Umwandlungsgesetz",
      "state": "Thüringen",
      "amtsgericht": "Amtsgericht Jena",
      "registernummer": "HRA 506760",
      "registerart": "HRA",
      "company_name": "Immo Tech Inh. Christa Wagner e.K.",
      "company_seat": "Mühlhausen/Thüringen",
      "details": "24.10.2024 (Bekanntmachungsdatum)\n\nThüringen Amtsgericht Jena HRA 506760\nRegisterbekanntmachung nach dem Umwandlungsgesetz 24.10.2024 (Eintragungsdatum)\n\nImmo Tech Inh. Christa Wagner e.K.\nEinzelkaufmann / Einzelkauffrau\nMühlhausen/Thüringen\n\nNicht eingetragen: Den Gläubigern der an der Ausgliederung beteiligten Rechtsträger, ist wenn sie binnen sechs Monaten nach dem Tag, an dem die Eintragung der Ausgliederung in das Register des Sitzes desjenigen Rechtsträgers, dessen Gläubiger sie sind, nach §§125, 19 Abs. 3 UmwG als bekanntgemacht gilt, ihren Anspruch nach Grund und Höhe schriftlich anmelden, Sicherheit zu leisten, soweit sie nicht Befriedigung verlangen können. Dieses Recht steht ihnen jedoch nur zu, wenn sie glaubhaft machen, daß durch die Ausgliederung die Erfüllung ihrer Forderung gefährdet wird."
    },
    {
      "date": "2024-10-24",
      "id": "91608",
      "original_text": "Registerbekanntmachung nach dem Umwandlungsgesetz\nThüringen Amtsgericht Jena HRB 514938\nContemporary Amperex Technology Thuringia GmbH – Arnstadt",
      "type": "Registerbekanntmachung nach dem Umwandlungsgesetz",
      "state": "Thüringen",
      "amtsgericht": "Amtsgericht Jena",
      "registernummer": "HRB 514938",
      "registerart": "HRB",
      "company_name": "Contemporary Amperex Technology Thuringia GmbH",
      "company_seat": "Arnstadt",
      "details": "24.10.2024 (Bekanntmachungsdatum)\n\nThüringen Amtsgericht Jena HRB 514938\nRegisterbekanntmachung nach dem Umwandlungsgesetz 24.10.2024 (Eintragungsdatum)\n\nContemporary Amperex Technology Thuringia GmbH\nGesellschaft mit beschränkter Haftung\nArnstadt\n\nNicht eingetragen: Den Gläubigern des formwechselnden  Rechtsträgers, ist wenn sie binnen sechs Monaten nach dem Tag, an dem die Eintragung des Formwechsels nach § 201 UmwG als bekanntgemacht gilt, ihren Anspruch nach Grund und Höhe schriftlich anmelden, Sicherheit zu leisten, soweit sie nicht Befriedigung verlangen können. Dieses Recht steht ihnen jedoch nur zu, wenn sie glaubhaft machen, daß durch den Formwechsel die Erfüllung ihrer Forderung gefährdet wird."
    },
    {
      "date": "2024-10-24",
      "id": "91609",
      "original_text": "Registerbekanntmachung nach dem Umwandlungsgesetz\nHessen Amtsgericht Frankfurt am Main HRB 119211\nFansea GmbH – Frankfurt am Main",
      "type": "Registerbekanntmachung nach dem Umwandlungsgesetz",
      "state": "Hessen",
      "amtsgericht": "Amtsgericht Frankfurt am Main",
      "registernummer": "HRB 119211",
      "registerart": "HRB",
      "company_name": "Fansea GmbH",
      "company_seat": "Frankfurt am Main",
      "details": "24.10.2024 (Bekanntmachungsdatum)\n\nHessen Amtsgericht Frankfurt am Main HRB 119211\nRegisterbekanntmachung nach dem Umwandlungsgesetz 24.10.2024 (Eintragungsdatum)\n\nFansea GmbH\nGesellschaft mit beschränkter Haftung\nFrankfurt am Main\n\nDen Gläubigern der an der Verschmelzung beteiligten Rechtsträger ist, wenn sie binnen sechs Monaten nach dem Tag, an dem die Eintragung der Verschmelzung in das Register des Sitzes desjenigen Rechtsträgers, dessen Gläubiger sie sind, nach § 19 Absatz 3 UmwG bekannt gemacht worden ist, ihren Anspruch nach Grund und Höhe schriftlich anmelden, Sicherheit zu leisten, soweit sie nicht Befriedigung verlangen können. Dieses Recht steht den Gläubigern jedoch nur zu, wenn sie glaubhaft machen, dass durch die Verschmelzung die Erfüllung ihrer Forderung gefährdet wird."
    },
    {
      "date": "2024-10-24",
      "id": "91610",
      "original_text": "Registerbekanntmachung nach dem Umwandlungsgesetz\nHessen Amtsgericht Bad Homburg v.d.H. HRB 16817\nTaunus Trust AG – Bad Homburg v. d. Höhe",
      "type": "Registerbekanntmachung nach dem Umwandlungsgesetz",
      "state": "Hessen",
      "amtsgericht": "Amtsgericht Bad Homburg v.d.H.",
      "registernummer": "HRB 16817",
      "registerart": "HRB",
      "company_name": "Taunus Trust AG",
      "company_seat": "Bad Homburg v. d. Höhe",
      "details": "24.10.2024 (Bekanntmachungsdatum)\n\nHessen Amtsgericht Bad Homburg v.d.H. HRB 16817\nRegisterbekanntmachung nach dem Umwandlungsgesetz 24.10.2024 (Eintragungsdatum)\n\nTaunus Trust AG\nAktiengesellschaft\nBad Homburg v. d. Höhe\n\nDen Gläubigern der an der formwechselnden Umwandlung beteiligten Rechtsträger ist, wenn sie binnen sechs Monaten nach dem Tag, an dem die Eintragung der formwechselnden Umwandlung in das Register des Sitzes desjenigen Rechtsträgers, dessen Gläubiger sie sind, nach § 201 UmwG bekannt gemacht worden ist, ihren Anspruch nach Grund und Höhe schriftlich anmelden, Sicherheit zu leisten, soweit sie nicht Befriedigung verlangen können. Dieses Recht steht den Gläubigern jedoch nur zu, wenn sie glaubhaft machen, dass durch die formwechselnden Umwandlung die Erfüllung ihrer Forderung gefährdet wird."
    },
    {
      "date": "2024-10-24",
      "id": "91611",
      "original_text": "Einreichung neuer Dokumente\nHessen Amtsgericht Darmstadt HRB 25800\nKreiskrankenhaus Bergstraße GmbH - eine Einrichtung des Universitätsklinikums Heidelberg – Heppenheim (Bergstraße)",
      "type": "Einreichung neuer Dokumente",
      "state": "Hessen",
      "amtsgericht": "Amtsgericht Darmstadt",
      "registernummer": "HRB 25800",
      "registerart": "HRB",
      "company_name": "Kreiskrankenhaus Bergstraße GmbH - eine Einrichtung des Universitätsklinikums Heidelberg",
      "company_seat": "Heppenheim (Bergstraße)",
      "details": "24.10.2024 (Bekanntmachungsdatum)\n\nHessen Amtsgericht Darmstadt HRB 25800\nEinreichung neuer Dokumente 24.10.2024 (Eintragungsdatum)\n\nKreiskrankenhaus Bergstraße GmbH - eine Einrichtung des Universitätsklinikums Heidelberg\nGesellschaft mit beschränkter Haftung\nHeppenheim (Bergstraße)\n\nDurch eine Änderung in den Personen der Aufsichtsratsmitglieder ist eine Liste der Mitglieder des Aufsichtsrates zum Handelsregister eingereicht worden."
    },
    {
      "date": "2024-10-24",
      "id": "91612",
      "original_text": "Löschungsankündigung\nHessen Amtsgericht Wiesbaden HRB 26996\nKlee am Park Hotelbetriebs-GmbH – Wiesbaden",
      "type": "Löschungsankündigung",
      "state": "Hessen",
      "amtsgericht": "Amtsgericht Wiesbaden",
      "registernummer": "HRB 26996",
      "registerart": "HRB",
      "company_name": "Klee am Park Hotelbetriebs-GmbH",
      "company_seat": "Wiesbaden",
      "details": "24.10.2024 (Bekanntmachungsdatum)\n\nHessen Amtsgericht Wiesbaden HRB 26996\nLöschungsankündigung\n\nKlee am Park Hotelbetriebs-GmbH\nGesellschaft mit beschränkter Haftung\nWiesbaden\n\nDas Registergericht beabsichtigt die im Handelsregister eingetragene Gesellschaft von Amts wegen nach § 394 FamFG zu löschen. Die Frist zur Erhebung eines Widerspruchs gegen die beabsichtigte Löschung wird auf 3 Monate festgesetzt."
    },
    {
      "date": "2024-10-24",
      "id": "91613",
      "original_text": "Einreichung neuer Dokumente\nHessen Amtsgericht Offenbach am Main HRB 2245\nGBO Gemeinnützige Baugesellschaft mbH Offenbach – Offenbach am Main",
      "type": "Einreichung neuer Dokumente",
      "state": "Hessen",
      "amtsgericht": "Amtsgericht Offenbach am Main",
      "registernummer": "HRB 2245",
      "registerart": "HRB",
      "company_name": "GBO Gemeinnützige Baugesellschaft mbH Offenbach",
      "company_seat": "Offenbach am Main",
      "details": "24.10.2024 (Bekanntmachungsdatum)\n\nHessen Amtsgericht Offenbach am Main HRB 2245\nEinreichung neuer Dokumente 23.10.2024 (Eintragungsdatum)\n\nGBO Gemeinnützige Baugesellschaft mbH Offenbach\nGesellschaft mit beschränkter Haftung\nOffenbach am Main\n\nDurch eine Änderung in den Personen der Aufsichtsratsmitglieder ist eine Liste der Mitglieder des Aufsichtsrates zum Handelsregister eingereicht worden."
    },
    {
      "date": "2024-10-24",
      "id": "91614",
      "original_text": "Einreichung neuer Dokumente\nHessen Amtsgericht Offenbach am Main HRB 34977\nDFS Deutsche Flugsicherung GmbH – Langen (Hessen)",
      "type": "Einreichung neuer Dokumente",
      "state": "Hessen",
      "amtsgericht": "Amtsgericht Offenbach am Main",
      "registernummer": "HRB 34977",
      "registerart": "HRB",
      "company_name": "DFS Deutsche Flugsicherung GmbH",
      "company_seat": "Langen (Hessen)",
      "details": "24.10.2024 (Bekanntmachungsdatum)\n\nHessen Amtsgericht Offenbach am Main HRB 34977\nEinreichung neuer Dokumente 24.10.2024 (Eintragungsdatum)\n\nDFS Deutsche Flugsicherung GmbH\nGesellschaft mit beschränkter Haftung\nLangen (Hessen)\n\nDurch eine Änderung in den Personen der Aufsichtsratsmitglieder ist eine Liste der Mitglieder des Aufsichtsrates zum Handelsregister eingereicht worden."
    },
    {
      "date": "2024-10-24",
      "id": "91615",
      "original_text": "Einreichung neuer Dokumente\nHessen Amtsgericht Frankfurt am Main HRB 77927\nGlobal Oil & Gas AG – Bad Vilbel",
      "type": "Einreichung neuer Dokumente",
      "state": "Hessen",
      "amtsgericht": "Amtsgericht Frankfurt am Main",
      "registernummer": "HRB 77927",
      "registerart": "HRB",
      "company_name": "Global Oil & Gas AG",
      "company_seat": "Bad Vilbel",
      "details": "24.10.2024 (Bekanntmachungsdatum)\n\nHessen Amtsgericht Frankfurt am Main HRB 77927\nEinreichung neuer Dokumente\n\nGlobal Oil & Gas AG\nAktiengesellschaft\nBad Vilbel\n\nDurch eine Änderung in den Personen der Aufsichtsratsmitglieder ist eine Liste der Mitglieder des Aufsichtsrates zum Handelsregister eingereicht worden."
    },
    {
      "date": "2024-10-24",
      "id": "91616",
      "original_text": "Löschungsankündigung\nHessen Amtsgericht Offenbach am Main HRA 9769\nUnger Grundstücksverwaltung Objekt Pferdemarkt GmbH & Co. KG – Dreieich",
      "type": "Löschungsankündigung",
      "state": "Hessen",
      "amtsgericht": "Amtsgericht Offenbach am Main",
      "registernummer": "HRA 9769",
      "registerart": "HRA",
      "company_name": "Unger Grundstücksverwaltung Objekt Pferdemarkt GmbH & Co. KG",
      "company_seat": "Dreieich",
      "details": "24.10.2024 (Bekanntmachungsdatum)\n\nHessen Amtsgericht Offenbach am Main HRA 9769\nLöschungsankündigung\n\nUnger Grundstücksverwaltung Objekt Pferdemarkt GmbH & Co. KG\nKommanditgesellschaft\nDreieich\n\nDas Registergericht beabsichtigt die im Handelsregister eingetragene Firma von Amts wegen nach § 394 FamFG zu löschen. Die Frist zur Erhebung eines Widerspruchs gegen die beabsichtigte Löschung wird auf 3 Monate festgesetzt."
    },
    {
      "date": "2024-10-24",
      "id": "91617",
      "original_text": "Sonstige Registerbekanntmachung\nHessen Amtsgericht Wiesbaden HRB 2707\nGartenbau-Versicherung VVaG – Wiesbaden",
      "type": "Sonstige Registerbekanntmachung",
      "state": "Hessen",
      "amtsgericht": "Amtsgericht Wiesbaden",
      "registernummer": "HRB 2707",
      "registerart": "HRB",
      "company_name": "Gartenbau-Versicherung VVaG",
      "company_seat": "Wiesbaden",
      "details": "24.10.2024 (Bekanntmachungsdatum)\n\nHessen Amtsgericht Wiesbaden HRB 2707\nSonstige Registerbekanntmachung 24.10.2024 (Eintragungsdatum)\n\nGartenbau-Versicherung VVaG\nVersicherungsverein auf Gegenseitigkeit\nWiesbaden\n\nDurch eine Änderung in den Personen der Aufsichtsratsmitglieder ist eine Liste der Mitglieder des Aufsichtsrates zum Handelsregister eingereicht worden."
    },
    {
      "date": "2024-10-24",
      "id": "91618",
      "original_text": "Registerbekanntmachung nach dem Umwandlungsgesetz\nHessen Amtsgericht Frankfurt am Main HRB 124828\nMy NFT Print GmbH – Frankfurt am Main",
      "type": "Registerbekanntmachung nach dem Umwandlungsgesetz",
      "state": "Hessen",
      "amtsgericht": "Amtsgericht Frankfurt am Main",
      "registernummer": "HRB 124828",
      "registerart": "HRB",
      "company_name": "My NFT Print GmbH",
      "company_seat": "Frankfurt am Main",
      "details": "24.10.2024 (Bekanntmachungsdatum)\n\nHessen Amtsgericht Frankfurt am Main HRB 124828\nRegisterbekanntmachung nach dem Umwandlungsgesetz 24.10.2024 (Eintragungsdatum)\n\nMy NFT Print GmbH\nGesellschaft mit beschränkter Haftung\nFrankfurt am Main\n\nDen Gläubigern der an der Verschmelzung beteiligten Rechtsträger ist, wenn sie binnen sechs Monaten nach dem Tag, an dem die Eintragung der Verschmelzung in das Register des Sitzes desjenigen Rechtsträgers, dessen Gläubiger sie sind, nach § 19 Absatz 3 UmwG bekannt gemacht worden ist, ihren Anspruch nach Grund und Höhe schriftlich anmelden, Sicherheit zu leisten, soweit sie nicht Befriedigung verlangen können. Dieses Recht steht den Gläubigern jedoch nur zu, wenn sie glaubhaft machen, dass durch die Verschmelzung die Erfüllung ihrer Forderung gefährdet wird."
    },
    {
      "date": "2024-10-24",
      "id": "91619",
      "original_text": "Löschungsankündigung\nHessen Amtsgericht Offenbach am Main HRB 52245\nJung & Wild GmbH – Neu-Isenburg",
      "type": "Löschungsankündigung",
      "state": "Hessen",
      "amtsgericht": "Amtsgericht Offenbach am Main",
      "registernummer": "HRB 52245",
      "registerart": "HRB",
      "company_name": "Jung & Wild GmbH",
      "company_seat": "Neu-Isenburg",
      "details": "24.10.2024 (Bekanntmachungsdatum)\n\nHessen Amtsgericht Offenbach am Main HRB 52245\nLöschungsankündigung\n\nJung & Wild GmbH\nGesellschaft mit beschränkter Haftung\nNeu-Isenburg\n\nDas Registergericht beabsichtigt die im Handelsregister eingetragene Gesellschaft von Amts wegen nach § 394 FamFG zu löschen. Die Frist zur Erhebung eines Widerspruchs gegen die beabsichtigte Löschung wird auf 3 Monate festgesetzt."
    },
    {
      "date": "2024-10-24",
      "id": "91620",
      "original_text": "Registerbekanntmachung nach dem Umwandlungsgesetz\nHessen Amtsgericht Bad Homburg v.d.H. HRB 15400\nTaunus Trust GmbH – Bad Homburg v. d. Höhe",
      "type": "Registerbekanntmachung nach dem Umwandlungsgesetz",
      "state": "Hessen",
      "amtsgericht": "Amtsgericht Bad Homburg v.d.H.",
      "registernummer": "HRB 15400",
      "registerart": "HRB",
      "company_name": "Taunus Trust GmbH",
      "company_seat": "Bad Homburg v. d. Höhe",
      "details": "24.10.2024 (Bekanntmachungsdatum)\n\nHessen Amtsgericht Bad Homburg v.d.H. HRB 15400\nRegisterbekanntmachung nach dem Umwandlungsgesetz 24.10.2024 (Eintragungsdatum)\n\nTaunus Trust GmbH\nGesellschaft mit beschränkter Haftung\nBad Homburg v. d. Höhe\n\nDen Gläubigern der an der formwechselnden Umwandlung beteiligten Rechtsträger ist, wenn sie binnen sechs Monaten nach dem Tag, an dem die Eintragung der formwechselnden Umwandlung in das Register des Sitzes desjenigen Rechtsträgers, dessen Gläubiger sie sind, nach § 201 UmwG bekannt gemacht worden ist, ihren Anspruch nach Grund und Höhe schriftlich anmelden, Sicherheit zu leisten, soweit sie nicht Befriedigung verlangen können. Dieses Recht steht den Gläubigern jedoch nur zu, wenn sie glaubhaft machen, dass durch die formwechselnden Umwandlung die Erfüllung ihrer Forderung gefährdet wird."
    },
    {
      "date": "2024-10-24",
      "id": "91621",
      "original_text": "Einreichung neuer Dokumente\nHessen Amtsgericht Frankfurt am Main HRB 128830\nNeon Equity AG – Frankfurt am Main",
      "type": "Einreichung neuer Dokumente",
      "state": "Hessen",
      "amtsgericht": "Amtsgericht Frankfurt am Main",
      "registernummer": "HRB 128830",
      "registerart": "HRB",
      "company_name": "Neon Equity AG",
      "company_seat": "Frankfurt am Main",
      "details": "24.10.2024 (Bekanntmachungsdatum)\n\nHessen Amtsgericht Frankfurt am Main HRB 128830\nEinreichung neuer Dokumente\n\nNeon Equity AG\nAktiengesellschaft\nFrankfurt am Main\n\nDurch eine Änderung in den Personen der Aufsichtsratsmitglieder ist eine Liste der Mitglieder des Aufsichtsrates zum Handelsregister eingereicht worden."
    }
  ]
}