{
  "date": "2024-10-25",
  "date_of_scrape": "2024-11-30T18:48:37.300Z",
  "tool_version": "0.2.0",
  "number_of_announcements": 143,
  "announcements": [
    {
      "date": "2024-10-25",
      "id": "91622",
      "original_text": "Einreichung neuer Dokumente\nBayern Amtsgericht München HRB 176633\nfortiss GmbH – München",
      "type": "Einreichung neuer Dokumente",
      "state": "Bayern",
      "amtsgericht": "Amtsgericht München",
      "registernummer": "HRB 176633",
      "registerart": "HRB",
      "company_name": "fortiss GmbH",
      "company_seat": "München",
      "details": "25.10.2024 (Bekanntmachungsdatum)\n\nBayern Amtsgericht München HRB 176633\nEinreichung neuer Dokumente\n\nfortiss GmbH\nGesellschaft mit beschränkter Haftung\nMünchen\n\nDem Amtsgericht München -Registergericht- ist eine Liste der Mitglieder des Aufsichtsrats eingereicht worden, § 52 Abs. 3 S. 2 GmbHG."
    },
    {
      "date": "2024-10-25",
      "id": "91623",
      "original_text": "Registerbekanntmachung nach dem Umwandlungsgesetz\nBayern Amtsgericht München HRB 237096\nCorona Gebäudedienste GmbH – Grafrath",
      "type": "Registerbekanntmachung nach dem Umwandlungsgesetz",
      "state": "Bayern",
      "amtsgericht": "Amtsgericht München",
      "registernummer": "HRB 237096",
      "registerart": "HRB",
      "company_name": "Corona Gebäudedienste GmbH",
      "company_seat": "Grafrath",
      "details": "25.10.2024 (Bekanntmachungsdatum)\n\nBayern Amtsgericht München HRB 237096\nRegisterbekanntmachung nach dem Umwandlungsgesetz 24.10.2024 (Eintragungsdatum)\n\nCorona Gebäudedienste GmbH\nGesellschaft mit beschränkter Haftung\nGrafrath\n\nDen Gläubigern der an der Verschmelzung beteiligten Rechtsträger ist, wenn sie binnen sechs Monaten nach dem Tag, an dem die Eintragung der Verschmelzung in das Register des Sitzes desjenigen Rechtsträgers, dessen Gläubiger sie sind, nach § 19 Abs. 3 UmwG als bekannt gemacht gilt, ihren Anspruch nach Grund und Höhe schriftlich anmelden, Sicherheit zu leisten, soweit sie nicht Befriedigung verlangen können. Dieses Recht steht den Gläubigern jedoch nur zu, wenn sie glaubhaft machen, dass durch die Verschmelzung die Erfüllung ihrer Forderung gefährdet wird."
    },
    {
      "date": "2024-10-25",
      "id": "91624",
      "original_text": "Löschungsankündigung\nBayern Amtsgericht München HRB 245304\nElektro Bau Montage GmbH – München",
      "type": "Löschungsankündigung",
      "state": "Bayern",
      "amtsgericht": "Amtsgericht München",
      "registernummer": "HRB 245304",
      "registerart": "HRB",
      "company_name": "Elektro Bau Montage GmbH",
      "company_seat": "München",
      "details": "25.10.2024 (Bekanntmachungsdatum)\n\nBayern Amtsgericht München HRB 245304\nLöschungsankündigung 24.10.2024 (Eintragungsdatum)\n\nElektro Bau Montage GmbH\nGesellschaft mit beschränkter Haftung\nMünchen\n\nDas Registergericht beabsichtigt, die im Handelsregister eingetragene Gesellschaft wegen Vermögenslosigkeit von Amts wegen nach § 394 FamFG zu löschen. Die Frist zur Erhebung eines Widerspruchs ist auf drei Monate festgesetzt."
    },
    {
      "date": "2024-10-25",
      "id": "91625",
      "original_text": "Sonstige Registerbekanntmachung\nBayern Amtsgericht München HRB 283042\nMorphoSys AG – München",
      "type": "Sonstige Registerbekanntmachung",
      "state": "Bayern",
      "amtsgericht": "Amtsgericht München",
      "registernummer": "HRB 283042",
      "registerart": "HRB",
      "company_name": "MorphoSys AG",
      "company_seat": "München",
      "details": "25.10.2024 (Bekanntmachungsdatum)\n\nBayern Amtsgericht München HRB 283042\nSonstige Registerbekanntmachung 24.10.2024 (Eintragungsdatum)\n\nMorphoSys AG\nAktiengesellschaft\nMünchen\n\nDem Amtsgericht München -Registergericht- ist eine Liste der Mitglieder des Aufsichtsrats eingereicht worden, § 106 AktG."
    },
    {
      "date": "2024-10-25",
      "id": "91626",
      "original_text": "Löschungsankündigung\nBayern Amtsgericht Nürnberg HRB 41651\nSPOGAU Gastrobetriebs- UG (haftungsbeschränkt) – Schwabach",
      "type": "Löschungsankündigung",
      "state": "Bayern",
      "amtsgericht": "Amtsgericht Nürnberg",
      "registernummer": "HRB 41651",
      "registerart": "HRB",
      "company_name": "SPOGAU Gastrobetriebs- UG (haftungsbeschränkt)",
      "company_seat": "Schwabach",
      "details": "25.10.2024 (Bekanntmachungsdatum)\n\nBayern Amtsgericht Nürnberg HRB 41651\nLöschungsankündigung\n\nSPOGAU Gastrobetriebs- UG (haftungsbeschränkt)\nGesellschaft mit beschränkter Haftung\nSchwabach\n\nDas Registergericht beabsichtigt, die im Handelsregister eingetragene Gesellschaft wegen Vermögenslosigkeit von Amts wegen nach § 394 FamFG zu löschen. Die Frist zur Erhebung eines Widerspruchs ist auf einen Monat festgesetzt."
    },
    {
      "date": "2024-10-25",
      "id": "91627",
      "original_text": "Registerbekanntmachung nach dem Umwandlungsgesetz\nBayern Amtsgericht München HRB 255188\nLAYA Solutions GmbH – München",
      "type": "Registerbekanntmachung nach dem Umwandlungsgesetz",
      "state": "Bayern",
      "amtsgericht": "Amtsgericht München",
      "registernummer": "HRB 255188",
      "registerart": "HRB",
      "company_name": "LAYA Solutions GmbH",
      "company_seat": "München",
      "details": "25.10.2024 (Bekanntmachungsdatum)\n\nBayern Amtsgericht München HRB 255188\nRegisterbekanntmachung nach dem Umwandlungsgesetz 24.10.2024 (Eintragungsdatum)\n\nLAYA Solutions GmbH\nGesellschaft mit beschränkter Haftung\nMünchen\n\nDen Gläubigern der an der Verschmelzung beteiligten Rechtsträger ist, wenn sie binnen sechs Monaten nach dem Tag, an dem die Eintragung der Verschmelzung in das Register des Sitzes desjenigen Rechtsträgers, dessen Gläubiger sie sind, nach § 19 Abs. 3 UmwG als bekannt gemacht gilt, ihren Anspruch nach Grund und Höhe schriftlich anmelden, Sicherheit zu leisten, soweit sie nicht Befriedigung verlangen können. Dieses Recht steht den Gläubigern jedoch nur zu, wenn sie glaubhaft machen, dass durch die Verschmelzung die Erfüllung ihrer Forderung gefährdet wird."
    },
    {
      "date": "2024-10-25",
      "id": "91628",
      "original_text": "Löschungsankündigung\nBayern Amtsgericht München HRB 69050\nGmeiner Offsetdruck GmbH – München",
      "type": "Löschungsankündigung",
      "state": "Bayern",
      "amtsgericht": "Amtsgericht München",
      "registernummer": "HRB 69050",
      "registerart": "HRB",
      "company_name": "Gmeiner Offsetdruck GmbH",
      "company_seat": "München",
      "details": "25.10.2024 (Bekanntmachungsdatum)\n\nBayern Amtsgericht München HRB 69050\nLöschungsankündigung 24.10.2024 (Eintragungsdatum)\n\nGmeiner Offsetdruck GmbH\nGesellschaft mit beschränkter Haftung\nMünchen\n\nDas Registergericht beabsichtigt, die im Handelsregister eingetragene Gesellschaft wegen Vermögenslosigkeit von Amts wegen nach § 394 FamFG zu löschen. Die Frist zur Erhebung eines Widerspruchs ist auf drei Monate festgesetzt."
    },
    {
      "date": "2024-10-25",
      "id": "91629",
      "original_text": "Löschungsankündigung\nBayern Amtsgericht München HRB 244670\nLILO Trans GmbH – München",
      "type": "Löschungsankündigung",
      "state": "Bayern",
      "amtsgericht": "Amtsgericht München",
      "registernummer": "HRB 244670",
      "registerart": "HRB",
      "company_name": "LILO Trans GmbH",
      "company_seat": "München",
      "details": "25.10.2024 (Bekanntmachungsdatum)\n\nBayern Amtsgericht München HRB 244670\nLöschungsankündigung\n\nLILO Trans GmbH\nGesellschaft mit beschränkter Haftung\nMünchen\n\nDas Registergericht beabsichtigt, die im Handelsregister eingetragene Gesellschaft wegen Vermögenslosigkeit von Amts wegen nach § 394 FamFG zu löschen. Die Frist zur Erhebung eines Widerspruchs ist auf drei Monate festgesetzt."
    },
    {
      "date": "2024-10-25",
      "id": "91630",
      "original_text": "Einreichung neuer Dokumente\nBayern Amtsgericht Ingolstadt HRB 2907\nPSW automotive engineering GmbH – Gaimersheim",
      "type": "Einreichung neuer Dokumente",
      "state": "Bayern",
      "amtsgericht": "Amtsgericht Ingolstadt",
      "registernummer": "HRB 2907",
      "registerart": "HRB",
      "company_name": "PSW automotive engineering GmbH",
      "company_seat": "Gaimersheim",
      "details": "25.10.2024 (Bekanntmachungsdatum)\n\nBayern Amtsgericht Ingolstadt HRB 2907\nEinreichung neuer Dokumente\n\nPSW automotive engineering GmbH\nGesellschaft mit beschränkter Haftung\nGaimersheim\n\nDem Amtsgericht Ingolstadt -Registergericht- ist eine Liste der Mitglieder des Aufsichtsrats eingereicht worden, § 52 Abs. 3 S. 2 GmbHG."
    },
    {
      "date": "2024-10-25",
      "id": "91631",
      "original_text": "Registerbekanntmachung nach dem Umwandlungsgesetz\nBayern Amtsgericht München HRB 269400\nDreyfield Deutschland GmbH – München",
      "type": "Registerbekanntmachung nach dem Umwandlungsgesetz",
      "state": "Bayern",
      "amtsgericht": "Amtsgericht München",
      "registernummer": "HRB 269400",
      "registerart": "HRB",
      "company_name": "Dreyfield Deutschland GmbH",
      "company_seat": "München",
      "details": "25.10.2024 (Bekanntmachungsdatum)\n\nBayern Amtsgericht München HRB 269400\nRegisterbekanntmachung nach dem Umwandlungsgesetz 24.10.2024 (Eintragungsdatum)\n\nDreyfield Deutschland GmbH\nGesellschaft mit beschränkter Haftung\nMünchen\n\nDen Gläubigern der an der Verschmelzung beteiligten Rechtsträger ist, wenn sie binnen sechs Monaten nach dem Tag, an dem die Eintragung der Verschmelzung in das Register des Sitzes desjenigen Rechtsträgers, dessen Gläubiger sie sind, nach § 19 Abs. 3 UmwG als bekannt gemacht gilt, ihren Anspruch nach Grund und Höhe schriftlich anmelden, Sicherheit zu leisten, soweit sie nicht Befriedigung verlangen können. Dieses Recht steht den Gläubigern jedoch nur zu, wenn sie glaubhaft machen, dass durch die Verschmelzung die Erfüllung ihrer Forderung gefährdet wird."
    },
    {
      "date": "2024-10-25",
      "id": "91632",
      "original_text": "Registerbekanntmachung nach dem Umwandlungsgesetz\nBayern Amtsgericht Traunstein HRB 29714\nceraworx GmbH – Kirchdorf",
      "type": "Registerbekanntmachung nach dem Umwandlungsgesetz",
      "state": "Bayern",
      "amtsgericht": "Amtsgericht Traunstein",
      "registernummer": "HRB 29714",
      "registerart": "HRB",
      "company_name": "ceraworx GmbH",
      "company_seat": "Kirchdorf",
      "details": "25.10.2024 (Bekanntmachungsdatum)\n\nBayern Amtsgericht Traunstein HRB 29714\nRegisterbekanntmachung nach dem Umwandlungsgesetz 24.10.2024 (Eintragungsdatum)\n\nceraworx GmbH\nGesellschaft mit beschränkter Haftung\nKirchdorf\n\nDen Gläubigern der an der Verschmelzung beteiligten Rechtsträger ist, wenn sie binnen sechs Monaten nach dem Tag, an dem die Eintragung der Verschmelzung in das Register des Sitzes desjenigen Rechtsträgers, dessen Gläubiger sie sind, nach § 19 Abs. 3 UmwG als bekannt gemacht gilt, ihren Anspruch nach Grund und Höhe schriftlich anmelden, Sicherheit zu leisten, soweit sie nicht Befriedigung verlangen können. Dieses Recht steht den Gläubigern jedoch nur zu, wenn sie glaubhaft machen, dass durch die Verschmelzung die Erfüllung ihrer Forderung gefährdet wird."
    },
    {
      "date": "2024-10-25",
      "id": "91633",
      "original_text": "Registerbekanntmachung nach dem Umwandlungsgesetz\nBayern Amtsgericht Nürnberg HRB 30263\nablaro. UG (haftungsbeschränkt) – Nürnberg",
      "type": "Registerbekanntmachung nach dem Umwandlungsgesetz",
      "state": "Bayern",
      "amtsgericht": "Amtsgericht Nürnberg",
      "registernummer": "HRB 30263",
      "registerart": "HRB",
      "company_name": "ablaro. UG (haftungsbeschränkt)",
      "company_seat": "Nürnberg",
      "details": "25.10.2024 (Bekanntmachungsdatum)\n\nBayern Amtsgericht Nürnberg HRB 30263\nRegisterbekanntmachung nach dem Umwandlungsgesetz 24.10.2024 (Eintragungsdatum)\n\nablaro. UG (haftungsbeschränkt)\nGesellschaft mit beschränkter Haftung\nNürnberg\n\nDen Gläubigern der an der Verschmelzung beteiligten Rechtsträger ist, wenn sie binnen sechs Monaten nach dem Tag, an dem die Eintragung der Verschmelzung in das Register des Sitzes desjenigen Rechtsträgers, dessen Gläubiger sie sind, nach § 19 Abs. 3 UmwG als bekannt gemacht gilt, ihren Anspruch nach Grund und Höhe schriftlich anmelden, Sicherheit zu leisten, soweit sie nicht Befriedigung verlangen können. Dieses Recht steht den Gläubigern jedoch nur zu, wenn sie glaubhaft machen, dass durch die Verschmelzung die Erfüllung ihrer Forderung gefährdet wird."
    },
    {
      "date": "2024-10-25",
      "id": "91634",
      "original_text": "Löschungsankündigung\nBayern Amtsgericht München HRB 252927\nBami Tal 1 GmbH – München",
      "type": "Löschungsankündigung",
      "state": "Bayern",
      "amtsgericht": "Amtsgericht München",
      "registernummer": "HRB 252927",
      "registerart": "HRB",
      "company_name": "Bami Tal 1 GmbH",
      "company_seat": "München",
      "details": "25.10.2024 (Bekanntmachungsdatum)\n\nBayern Amtsgericht München HRB 252927\nLöschungsankündigung 24.10.2024 (Eintragungsdatum)\n\nBami Tal 1 GmbH\nGesellschaft mit beschränkter Haftung\nMünchen\n\nDas Registergericht beabsichtigt, die im Handelsregister eingetragene Gesellschaft wegen Vermögenslosigkeit von Amts wegen nach § 394 FamFG zu löschen. Die Frist zur Erhebung eines Widerspruchs ist auf drei Monate festgesetzt."
    },
    {
      "date": "2024-10-25",
      "id": "91635",
      "original_text": "Löschungsankündigung\nBayern Amtsgericht Nürnberg HRB 39019\niBasic UG (haftungsbeschränkt) – Nürnberg",
      "type": "Löschungsankündigung",
      "state": "Bayern",
      "amtsgericht": "Amtsgericht Nürnberg",
      "registernummer": "HRB 39019",
      "registerart": "HRB",
      "company_name": "iBasic UG (haftungsbeschränkt)",
      "company_seat": "Nürnberg",
      "details": "25.10.2024 (Bekanntmachungsdatum)\n\nBayern Amtsgericht Nürnberg HRB 39019\nLöschungsankündigung\n\niBasic UG (haftungsbeschränkt)\nGesellschaft mit beschränkter Haftung\nNürnberg\n\nDas Registergericht beabsichtigt, die im Handelsregister eingetragene Gesellschaft wegen Vermögenslosigkeit von Amts wegen nach § 394 FamFG zu löschen. Die Frist zur Erhebung eines Widerspruchs ist auf einen Monat festgesetzt."
    },
    {
      "date": "2024-10-25",
      "id": "91636",
      "original_text": "Einreichung neuer Dokumente\nBayern Amtsgericht München HRB 293304\nATOSS Software SE – München",
      "type": "Einreichung neuer Dokumente",
      "state": "Bayern",
      "amtsgericht": "Amtsgericht München",
      "registernummer": "HRB 293304",
      "registerart": "HRB",
      "company_name": "ATOSS Software SE",
      "company_seat": "München",
      "details": "25.10.2024 (Bekanntmachungsdatum)\n\nBayern Amtsgericht München HRB 293304\nEinreichung neuer Dokumente\n\nATOSS Software SE\nEuropäische Aktiengesellschaft (SE)\nMünchen\n\nDem Amtsgericht München -Registergericht- ist eine Liste der Mitglieder des Aufsichtsrats eingereicht worden, Art. 9 Abs. 1 Buchst. c (ii) SE-VO i.V.m. § 106 AktG."
    },
    {
      "date": "2024-10-25",
      "id": "91637",
      "original_text": "Einreichung neuer Dokumente\nBayern Amtsgericht Augsburg HRB 33980\nTensor AG – Genderkingen",
      "type": "Einreichung neuer Dokumente",
      "state": "Bayern",
      "amtsgericht": "Amtsgericht Augsburg",
      "registernummer": "HRB 33980",
      "registerart": "HRB",
      "company_name": "Tensor AG",
      "company_seat": "Genderkingen",
      "details": "25.10.2024 (Bekanntmachungsdatum)\n\nBayern Amtsgericht Augsburg HRB 33980\nEinreichung neuer Dokumente\n\nTensor AG\nAktiengesellschaft\nGenderkingen\n\nDem Amtsgericht Augsburg -Registergericht- ist eine Liste der Mitglieder des Aufsichtsrats eingereicht worden, § 106 AktG."
    },
    {
      "date": "2024-10-25",
      "id": "91638",
      "original_text": "Löschungsankündigung\nBayern Amtsgericht München HRB 200066\nPrime Step UG (haftungsbeschränkt) – Baierbrunn",
      "type": "Löschungsankündigung",
      "state": "Bayern",
      "amtsgericht": "Amtsgericht München",
      "registernummer": "HRB 200066",
      "registerart": "HRB",
      "company_name": "Prime Step UG (haftungsbeschränkt)",
      "company_seat": "Baierbrunn",
      "details": "25.10.2024 (Bekanntmachungsdatum)\n\nBayern Amtsgericht München HRB 200066\nLöschungsankündigung\n\nPrime Step UG (haftungsbeschränkt)\nGesellschaft mit beschränkter Haftung\nBaierbrunn\n\nDas Registergericht beabsichtigt, die im Handelsregister eingetragene Gesellschaft wegen Vermögenslosigkeit von Amts wegen nach § 394 FamFG zu löschen. Die Frist zur Erhebung eines Widerspruchs ist auf drei Monate festgesetzt."
    },
    {
      "date": "2024-10-25",
      "id": "91639",
      "original_text": "Löschungsankündigung\nBayern Amtsgericht Nürnberg HRB 28349\nMARSAL UG (haftungsbeschränkt) – Nürnberg",
      "type": "Löschungsankündigung",
      "state": "Bayern",
      "amtsgericht": "Amtsgericht Nürnberg",
      "registernummer": "HRB 28349",
      "registerart": "HRB",
      "company_name": "MARSAL UG (haftungsbeschränkt)",
      "company_seat": "Nürnberg",
      "details": "25.10.2024 (Bekanntmachungsdatum)\n\nBayern Amtsgericht Nürnberg HRB 28349\nLöschungsankündigung\n\nMARSAL UG (haftungsbeschränkt)\nGesellschaft mit beschränkter Haftung\nNürnberg\n\nDas Registergericht beabsichtigt, die im Handelsregister eingetragene Gesellschaft wegen Vermögenslosigkeit von Amts wegen nach § 394 FamFG zu löschen. Die Frist zur Erhebung eines Widerspruchs ist auf einen Monat festgesetzt."
    },
    {
      "date": "2024-10-25",
      "id": "91640",
      "original_text": "Registerbekanntmachung nach dem Umwandlungsgesetz\nBayern Amtsgericht Nürnberg HRB 19350\nDauphin Entwicklungs- u. Beteiligungs-GmbH – Hersbruck",
      "type": "Registerbekanntmachung nach dem Umwandlungsgesetz",
      "state": "Bayern",
      "amtsgericht": "Amtsgericht Nürnberg",
      "registernummer": "HRB 19350",
      "registerart": "HRB",
      "company_name": "Dauphin Entwicklungs- u. Beteiligungs-GmbH",
      "company_seat": "Hersbruck",
      "details": "25.10.2024 (Bekanntmachungsdatum)\n\nBayern Amtsgericht Nürnberg HRB 19350\nRegisterbekanntmachung nach dem Umwandlungsgesetz 24.10.2024 (Eintragungsdatum)\n\nDauphin Entwicklungs- u. Beteiligungs-GmbH\nGesellschaft mit beschränkter Haftung\nHersbruck\n\nDen Gläubigern der an der Verschmelzung beteiligten Rechtsträger ist, wenn sie binnen sechs Monaten nach dem Tag, an dem die Eintragung der Verschmelzung in das Register des Sitzes desjenigen Rechtsträgers, dessen Gläubiger sie sind, nach § 19 Abs. 3 UmwG als bekannt gemacht gilt, ihren Anspruch nach Grund und Höhe schriftlich anmelden, Sicherheit zu leisten, soweit sie nicht Befriedigung verlangen können. Dieses Recht steht den Gläubigern jedoch nur zu, wenn sie glaubhaft machen, dass durch die Verschmelzung die Erfüllung ihrer Forderung gefährdet wird."
    },
    {
      "date": "2024-10-25",
      "id": "91641",
      "original_text": "Registerbekanntmachung nach dem Umwandlungsgesetz\nBayern Amtsgericht München HRB 189377\nDziki Investment GmbH – München",
      "type": "Registerbekanntmachung nach dem Umwandlungsgesetz",
      "state": "Bayern",
      "amtsgericht": "Amtsgericht München",
      "registernummer": "HRB 189377",
      "registerart": "HRB",
      "company_name": "Dziki Investment GmbH",
      "company_seat": "München",
      "details": "25.10.2024 (Bekanntmachungsdatum)\n\nBayern Amtsgericht München HRB 189377\nRegisterbekanntmachung nach dem Umwandlungsgesetz 24.10.2024 (Eintragungsdatum)\n\nDziki Investment GmbH\nGesellschaft mit beschränkter Haftung\nMünchen\n\nDen Gläubigern der an der Ausgliederung beteiligten Rechtsträger ist, wenn sie binnen sechs Monaten nach dem Tag, an dem die Eintragung der Ausgliederung in das Register des Sitzes desjenigen Rechtsträgers, dessen Gläubiger sie sind, nach §§ 125, 19 Abs. 3 UmwG als bekannt gemacht gilt, ihren Anspruch nach Grund und Höhe schriftlich anmelden, Sicherheit zu leisten, soweit sie nicht Befriedigung verlangen können. Dieses Recht steht den Gläubigern jedoch nur zu, wenn sie glaubhaft machen, dass durch die Ausgliederung die Erfüllung ihrer Forderung gefährdet wird."
    },
    {
      "date": "2024-10-25",
      "id": "91642",
      "original_text": "Registerbekanntmachung nach dem Umwandlungsgesetz\nBayern Amtsgericht München HRA 110830\nTechanics5 e.K. – Gmund a.Tegernsee",
      "type": "Registerbekanntmachung nach dem Umwandlungsgesetz",
      "state": "Bayern",
      "amtsgericht": "Amtsgericht München",
      "registernummer": "HRA 110830",
      "registerart": "HRA",
      "company_name": "Techanics5 e.K.",
      "company_seat": "Gmund a.Tegernsee",
      "details": "25.10.2024 (Bekanntmachungsdatum)\n\nBayern Amtsgericht München HRA 110830\nRegisterbekanntmachung nach dem Umwandlungsgesetz 24.10.2024 (Eintragungsdatum)\n\nTechanics5 e.K.\nEinzelkaufmann / Einzelkauffrau\nGmund a.Tegernsee\n\nDen Gläubigern der an der Ausgliederung beteiligten Rechtsträger ist, wenn sie binnen sechs Monaten nach dem Tag, an dem die Eintragung der Ausgliederung in das Register des Sitzes desjenigen Rechtsträgers, dessen Gläubiger sie sind, nach §§ 125, 19 Abs. 3 UmwG als bekannt gemacht gilt, ihren Anspruch nach Grund und Höhe schriftlich anmelden, Sicherheit zu leisten, soweit sie nicht Befriedigung verlangen können. Dieses Recht steht den Gläubigern jedoch nur zu, wenn sie glaubhaft machen, dass durch die Ausgliederung die Erfüllung ihrer Forderung gefährdet wird."
    },
    {
      "date": "2024-10-25",
      "id": "91643",
      "original_text": "Registerbekanntmachung nach dem Umwandlungsgesetz\nBayern Amtsgericht München HRB 108003\nBayern Card-Services GmbH -S-Finanzgruppe – München",
      "type": "Registerbekanntmachung nach dem Umwandlungsgesetz",
      "state": "Bayern",
      "amtsgericht": "Amtsgericht München",
      "registernummer": "HRB 108003",
      "registerart": "HRB",
      "company_name": "Bayern Card-Services GmbH -S-Finanzgruppe",
      "company_seat": "München",
      "details": "25.10.2024 (Bekanntmachungsdatum)\n\nBayern Amtsgericht München HRB 108003\nRegisterbekanntmachung nach dem Umwandlungsgesetz 24.10.2024 (Eintragungsdatum)\n\nBayern Card-Services GmbH -S-Finanzgruppe\nGesellschaft mit beschränkter Haftung\nMünchen\n\nDen Gläubigern der an der Verschmelzung beteiligten Rechtsträger ist, wenn sie binnen sechs Monaten nach dem Tag, an dem die Eintragung der Verschmelzung in das Register des Sitzes desjenigen Rechtsträgers, dessen Gläubiger sie sind, nach § 19 Abs. 3 UmwG als bekannt gemacht gilt, ihren Anspruch nach Grund und Höhe schriftlich anmelden, Sicherheit zu leisten, soweit sie nicht Befriedigung verlangen können. Dieses Recht steht den Gläubigern jedoch nur zu, wenn sie glaubhaft machen, dass durch die Verschmelzung die Erfüllung ihrer Forderung gefährdet wird."
    },
    {
      "date": "2024-10-25",
      "id": "91644",
      "original_text": "Sonstige Registerbekanntmachung\nBayern Amtsgericht München HRB 172642\nSustainable AG Unternehmensberatung – München",
      "type": "Sonstige Registerbekanntmachung",
      "state": "Bayern",
      "amtsgericht": "Amtsgericht München",
      "registernummer": "HRB 172642",
      "registerart": "HRB",
      "company_name": "Sustainable AG Unternehmensberatung",
      "company_seat": "München",
      "details": "25.10.2024 (Bekanntmachungsdatum)\n\nBayern Amtsgericht München HRB 172642\nSonstige Registerbekanntmachung 24.10.2024 (Eintragungsdatum)\n\nSustainable AG Unternehmensberatung\nAktiengesellschaft\nMünchen\n\nDem Amtsgericht München -Registergericht- ist eine Liste der Mitglieder des Aufsichtsrats eingereicht worden, § 106 AktG."
    },
    {
      "date": "2024-10-25",
      "id": "91645",
      "original_text": "Registerbekanntmachung nach dem Umwandlungsgesetz\nBayern Amtsgericht Deggendorf HRB 6112\nZEWO GmbH – Deggendorf",
      "type": "Registerbekanntmachung nach dem Umwandlungsgesetz",
      "state": "Bayern",
      "amtsgericht": "Amtsgericht Deggendorf",
      "registernummer": "HRB 6112",
      "registerart": "HRB",
      "company_name": "ZEWO GmbH",
      "company_seat": "Deggendorf",
      "details": "25.10.2024 (Bekanntmachungsdatum)\n\nBayern Amtsgericht Deggendorf HRB 6112\nRegisterbekanntmachung nach dem Umwandlungsgesetz 23.10.2024 (Eintragungsdatum)\n\nZEWO GmbH\nGesellschaft mit beschränkter Haftung\nDeggendorf\n\nDen Gläubigern der an der Verschmelzung beteiligten Rechtsträger ist, wenn sie binnen sechs Monaten nach dem Tag, an dem die Eintragung der Verschmelzung in das Register des Sitzes desjenigen Rechtsträgers, dessen Gläubiger sie sind, nach § 19 Abs. 3 UmwG als bekannt gemacht gilt, ihren Anspruch nach Grund und Höhe schriftlich anmelden, Sicherheit zu leisten, soweit sie nicht Befriedigung verlangen können. Dieses Recht steht den Gläubigern jedoch nur zu, wenn sie glaubhaft machen, dass durch die Verschmelzung die Erfüllung ihrer Forderung gefährdet wird."
    },
    {
      "date": "2024-10-25",
      "id": "91646",
      "original_text": "Registerbekanntmachung nach dem Umwandlungsgesetz\nBayern Amtsgericht Deggendorf HRB 5177\nZEWO GmbH – Deggendorf",
      "type": "Registerbekanntmachung nach dem Umwandlungsgesetz",
      "state": "Bayern",
      "amtsgericht": "Amtsgericht Deggendorf",
      "registernummer": "HRB 5177",
      "registerart": "HRB",
      "company_name": "ZEWO GmbH",
      "company_seat": "Deggendorf",
      "details": "25.10.2024 (Bekanntmachungsdatum)\n\nBayern Amtsgericht Deggendorf HRB 5177\nRegisterbekanntmachung nach dem Umwandlungsgesetz 23.10.2024 (Eintragungsdatum)\n\nZEWO GmbH\nGesellschaft mit beschränkter Haftung\nDeggendorf\n\nDen Gläubigern der an der Verschmelzung beteiligten Rechtsträger ist, wenn sie binnen sechs Monaten nach dem Tag, an dem die Eintragung der Verschmelzung in das Register des Sitzes desjenigen Rechtsträgers, dessen Gläubiger sie sind, nach § 19 Abs. 3 UmwG als bekannt gemacht gilt, ihren Anspruch nach Grund und Höhe schriftlich anmelden, Sicherheit zu leisten, soweit sie nicht Befriedigung verlangen können. Dieses Recht steht den Gläubigern jedoch nur zu, wenn sie glaubhaft machen, dass durch die Verschmelzung die Erfüllung ihrer Forderung gefährdet wird."
    },
    {
      "date": "2024-10-25",
      "id": "91647",
      "original_text": "Registerbekanntmachung nach dem Umwandlungsgesetz\nBayern Amtsgericht München HRB 297073\nSeokratie GmbH – München",
      "type": "Registerbekanntmachung nach dem Umwandlungsgesetz",
      "state": "Bayern",
      "amtsgericht": "Amtsgericht München",
      "registernummer": "HRB 297073",
      "registerart": "HRB",
      "company_name": "Seokratie GmbH",
      "company_seat": "München",
      "details": "25.10.2024 (Bekanntmachungsdatum)\n\nBayern Amtsgericht München HRB 297073\nRegisterbekanntmachung nach dem Umwandlungsgesetz 24.10.2024 (Eintragungsdatum)\n\nSeokratie GmbH\nGesellschaft mit beschränkter Haftung\nMünchen\n\nDen Gläubigern der an der Ausgliederung beteiligten Rechtsträger ist, wenn sie binnen sechs Monaten nach dem Tag, an dem die Eintragung der Ausgliederung in das Register des Sitzes desjenigen Rechtsträgers, dessen Gläubiger sie sind, nach §§ 125, 19 Abs. 3 UmwG als bekannt gemacht gilt, ihren Anspruch nach Grund und Höhe schriftlich anmelden, Sicherheit zu leisten, soweit sie nicht Befriedigung verlangen können. Dieses Recht steht den Gläubigern jedoch nur zu, wenn sie glaubhaft machen, dass durch die Ausgliederung die Erfüllung ihrer Forderung gefährdet wird."
    },
    {
      "date": "2024-10-25",
      "id": "91648",
      "original_text": "Löschungsankündigung\nBayern Amtsgericht Nürnberg HRB 30605\nKAANI Bau GmbH – Nürnberg",
      "type": "Löschungsankündigung",
      "state": "Bayern",
      "amtsgericht": "Amtsgericht Nürnberg",
      "registernummer": "HRB 30605",
      "registerart": "HRB",
      "company_name": "KAANI Bau GmbH",
      "company_seat": "Nürnberg",
      "details": "25.10.2024 (Bekanntmachungsdatum)\n\nBayern Amtsgericht Nürnberg HRB 30605\nLöschungsankündigung\n\nKAANI Bau GmbH\nGesellschaft mit beschränkter Haftung\nNürnberg\n\nDas Registergericht beabsichtigt, die im Handelsregister eingetragene Gesellschaft wegen Vermögenslosigkeit von Amts wegen nach § 394 FamFG zu löschen. Die Frist zur Erhebung eines Widerspruchs ist auf drei Monate festgesetzt."
    },
    {
      "date": "2024-10-25",
      "id": "91649",
      "original_text": "Löschungsankündigung\nBayern Amtsgericht München HRB 226343\nSMD Boxpromotion GmbH – München",
      "type": "Löschungsankündigung",
      "state": "Bayern",
      "amtsgericht": "Amtsgericht München",
      "registernummer": "HRB 226343",
      "registerart": "HRB",
      "company_name": "SMD Boxpromotion GmbH",
      "company_seat": "München",
      "details": "25.10.2024 (Bekanntmachungsdatum)\n\nBayern Amtsgericht München HRB 226343\nLöschungsankündigung 24.10.2024 (Eintragungsdatum)\n\nSMD Boxpromotion GmbH\nGesellschaft mit beschränkter Haftung\nMünchen\n\nDas Registergericht beabsichtigt, die im Handelsregister eingetragene Gesellschaft wegen Vermögenslosigkeit von Amts wegen nach § 394 FamFG zu löschen. Die Frist zur Erhebung eines Widerspruchs ist auf drei Monate festgesetzt."
    },
    {
      "date": "2024-10-25",
      "id": "91650",
      "original_text": "Sonstige Registerbekanntmachung\nBayern Amtsgericht München HRB 133027\nVistec AG – Olching",
      "type": "Sonstige Registerbekanntmachung",
      "state": "Bayern",
      "amtsgericht": "Amtsgericht München",
      "registernummer": "HRB 133027",
      "registerart": "HRB",
      "company_name": "Vistec AG",
      "company_seat": "Olching",
      "details": "25.10.2024 (Bekanntmachungsdatum)\n\nBayern Amtsgericht München HRB 133027\nSonstige Registerbekanntmachung 24.10.2024 (Eintragungsdatum)\n\nVistec AG\nAktiengesellschaft\nOlching\n\nDem Amtsgericht München -Registergericht- ist eine Liste der Mitglieder des Aufsichtsrats eingereicht worden, § 106 AktG."
    },
    {
      "date": "2024-10-25",
      "id": "91651",
      "original_text": "Löschungsankündigung\nBayern Amtsgericht Hof HRB 5290\nEXPRESS HAGELREPARATUR LTD Zweigniederlassung Münchberg – Münchberg",
      "type": "Löschungsankündigung",
      "state": "Bayern",
      "amtsgericht": "Amtsgericht Hof",
      "registernummer": "HRB 5290",
      "registerart": "HRB",
      "company_name": "EXPRESS HAGELREPARATUR LTD Zweigniederlassung Münchberg",
      "company_seat": "Münchberg",
      "details": "25.10.2024 (Bekanntmachungsdatum)\n\nBayern Amtsgericht Hof HRB 5290\nLöschungsankündigung\n\nEXPRESS HAGELREPARATUR LTD Zweigniederlassung Münchberg\nRechtsform ausländischen Rechts HRB\nMünchberg\n\nDas Registergericht beabsichtigt, die im Handelsregister eingetragene Gesellschaft wegen Vermögenslosigkeit von Amts wegen nach § 394 FamFG zu löschen. Die Frist zur Erhebung eines Widerspruchs ist auf sechs Wochen festgesetzt."
    },
    {
      "date": "2024-10-25",
      "id": "91652",
      "original_text": "Registerbekanntmachung nach dem Umwandlungsgesetz\nBayern Amtsgericht Schweinfurt HRB 9235\nProblembaumfällung Dertinger GmbH – Grettstadt Gt. Obereuerheim",
      "type": "Registerbekanntmachung nach dem Umwandlungsgesetz",
      "state": "Bayern",
      "amtsgericht": "Amtsgericht Schweinfurt",
      "registernummer": "HRB 9235",
      "registerart": "HRB",
      "company_name": "Problembaumfällung Dertinger GmbH",
      "company_seat": "Grettstadt Gt. Obereuerheim",
      "details": "25.10.2024 (Bekanntmachungsdatum)\n\nBayern Amtsgericht Schweinfurt HRB 9235\nRegisterbekanntmachung nach dem Umwandlungsgesetz 24.10.2024 (Eintragungsdatum)\n\nProblembaumfällung Dertinger GmbH\nGesellschaft mit beschränkter Haftung\nGrettstadt Gt. Obereuerheim\n\nDen Gläubigern des formwechselnden Rechtsträgers ist, wenn sie binnen sechs Monaten nach dem Tag, an dem die Eintragung des Formwechsels nach § 201 UmwG als bekannt gemacht gilt, ihren Anspruch nach Grund und Höhe schriftlich anmelden, Sicherheit zu leisten, soweit sie nicht Befriedigung verlangen können. Dieses Recht steht den Gläubigern jedoch nur zu, wenn sie glaubhaft machen, dass durch den Formwechsel die Erfüllung ihrer Forderung gefährdet wird."
    },
    {
      "date": "2024-10-25",
      "id": "91653",
      "original_text": "Registerbekanntmachung nach dem Umwandlungsgesetz\nBayern Amtsgericht Schweinfurt HRA 10646\nProblembaumfällung Dertinger KG – Grettstadt-Obereuerheim",
      "type": "Registerbekanntmachung nach dem Umwandlungsgesetz",
      "state": "Bayern",
      "amtsgericht": "Amtsgericht Schweinfurt",
      "registernummer": "HRA 10646",
      "registerart": "HRA",
      "company_name": "Problembaumfällung Dertinger KG",
      "company_seat": "Grettstadt-Obereuerheim",
      "details": "25.10.2024 (Bekanntmachungsdatum)\n\nBayern Amtsgericht Schweinfurt HRA 10646\nRegisterbekanntmachung nach dem Umwandlungsgesetz 24.10.2024 (Eintragungsdatum)\n\nProblembaumfällung Dertinger KG\nKommanditgesellschaft\nGrettstadt-Obereuerheim\n\nDen Gläubigern des formwechselnden Rechtsträgers ist, wenn sie binnen sechs Monaten nach dem Tag, an dem die Eintragung des Formwechsels nach § 201 UmwG als bekannt gemacht gilt, ihren Anspruch nach Grund und Höhe schriftlich anmelden, Sicherheit zu leisten, soweit sie nicht Befriedigung verlangen können. Dieses Recht steht den Gläubigern jedoch nur zu, wenn sie glaubhaft machen, dass durch den Formwechsel die Erfüllung ihrer Forderung gefährdet wird."
    },
    {
      "date": "2024-10-25",
      "id": "91654",
      "original_text": "Löschungsankündigung\nBayern Amtsgericht Augsburg HRB 17574\nMichael Burlafinger Verwaltungs-GmbH – Augsburg",
      "type": "Löschungsankündigung",
      "state": "Bayern",
      "amtsgericht": "Amtsgericht Augsburg",
      "registernummer": "HRB 17574",
      "registerart": "HRB",
      "company_name": "Michael Burlafinger Verwaltungs-GmbH",
      "company_seat": "Augsburg",
      "details": "25.10.2024 (Bekanntmachungsdatum)\n\nBayern Amtsgericht Augsburg HRB 17574\nLöschungsankündigung\n\nMichael Burlafinger Verwaltungs-GmbH\nGesellschaft mit beschränkter Haftung\nAugsburg\n\nDas Registergericht beabsichtigt, die im Handelsregister eingetragene Gesellschaft wegen Vermögenslosigkeit von Amts wegen nach § 394 FamFG zu löschen. Die Frist zur Erhebung eines Widerspruchs ist auf einen Monat festgesetzt."
    },
    {
      "date": "2024-10-25",
      "id": "91655",
      "original_text": "Registerbekanntmachung nach dem Umwandlungsgesetz\nBayern Amtsgericht Nürnberg HRB 23746\nSchuster & Walther IT-Business GmbH – Nürnberg",
      "type": "Registerbekanntmachung nach dem Umwandlungsgesetz",
      "state": "Bayern",
      "amtsgericht": "Amtsgericht Nürnberg",
      "registernummer": "HRB 23746",
      "registerart": "HRB",
      "company_name": "Schuster & Walther IT-Business GmbH",
      "company_seat": "Nürnberg",
      "details": "25.10.2024 (Bekanntmachungsdatum)\n\nBayern Amtsgericht Nürnberg HRB 23746\nRegisterbekanntmachung nach dem Umwandlungsgesetz 24.10.2024 (Eintragungsdatum)\n\nSchuster & Walther IT-Business GmbH\nGesellschaft mit beschränkter Haftung\nNürnberg\n\nDen Gläubigern der an der Verschmelzung beteiligten Rechtsträger ist, wenn sie binnen sechs Monaten nach dem Tag, an dem die Eintragung der Verschmelzung in das Register des Sitzes desjenigen Rechtsträgers, dessen Gläubiger sie sind, nach § 19 Abs. 3 UmwG als bekannt gemacht gilt, ihren Anspruch nach Grund und Höhe schriftlich anmelden, Sicherheit zu leisten, soweit sie nicht Befriedigung verlangen können. Dieses Recht steht den Gläubigern jedoch nur zu, wenn sie glaubhaft machen, dass durch die Verschmelzung die Erfüllung ihrer Forderung gefährdet wird."
    },
    {
      "date": "2024-10-25",
      "id": "91656",
      "original_text": "Registerbekanntmachung nach dem Umwandlungsgesetz\nBayern Amtsgericht Nürnberg HRB 23746\nSchuster & Walther IT-Business GmbH – Nürnberg",
      "type": "Registerbekanntmachung nach dem Umwandlungsgesetz",
      "state": "Bayern",
      "amtsgericht": "Amtsgericht Nürnberg",
      "registernummer": "HRB 23746",
      "registerart": "HRB",
      "company_name": "Schuster & Walther IT-Business GmbH",
      "company_seat": "Nürnberg",
      "details": "25.10.2024 (Bekanntmachungsdatum)\n\nBayern Amtsgericht Nürnberg HRB 23746\nRegisterbekanntmachung nach dem Umwandlungsgesetz 24.10.2024 (Eintragungsdatum)\n\nSchuster & Walther IT-Business GmbH\nGesellschaft mit beschränkter Haftung\nNürnberg\n\nDen Gläubigern der an der Verschmelzung beteiligten Rechtsträger ist, wenn sie binnen sechs Monaten nach dem Tag, an dem die Eintragung der Verschmelzung in das Register des Sitzes desjenigen Rechtsträgers, dessen Gläubiger sie sind, nach § 19 Abs. 3 UmwG als bekannt gemacht gilt, ihren Anspruch nach Grund und Höhe schriftlich anmelden, Sicherheit zu leisten, soweit sie nicht Befriedigung verlangen können. Dieses Recht steht den Gläubigern jedoch nur zu, wenn sie glaubhaft machen, dass durch die Verschmelzung die Erfüllung ihrer Forderung gefährdet wird."
    },
    {
      "date": "2024-10-25",
      "id": "91657",
      "original_text": "Registerbekanntmachung nach dem Umwandlungsgesetz\nBaden-Württemberg Amtsgericht Mannheim HRB 712541\nNephrocare Mannheim GmbH – Mannheim",
      "type": "Registerbekanntmachung nach dem Umwandlungsgesetz",
      "state": "Baden-Württemberg",
      "amtsgericht": "Amtsgericht Mannheim",
      "registernummer": "HRB 712541",
      "registerart": "HRB",
      "company_name": "Nephrocare Mannheim GmbH",
      "company_seat": "Mannheim",
      "details": "25.10.2024 (Bekanntmachungsdatum)\n\nBaden-Württemberg Amtsgericht Mannheim HRB 712541\nRegisterbekanntmachung nach dem Umwandlungsgesetz 25.10.2024 (Eintragungsdatum)\n\nNephrocare Mannheim GmbH\nGesellschaft mit beschränkter Haftung\nMannheim\n\nAls nicht eingetragen wird bekanntgemacht:Den Gläubigern der an der Verschmelzung beteiligten Rechtsträger ist, wenn sie binnen sechs Monaten nach dem Tag, an dem die Eintragung der Verschmelzung in das Register des Sitzes desjenigen Rechtsträgers, dessen Gläubiger sie sind, nach § 19 Abs. 3 UmwG als bekanntgemacht gilt, ihren Anspruch nach Grund und Höhe schriftlich anmelden, Sicherheit zu leisten, soweit sie nicht Befriedigung verlangen können. Dieses Recht steht den Gläubigern jedoch nur zu, wenn sie glaubhaft machen, dass durch die Verschmelzung die Erfüllung ihrer Forderung gefährdet wird."
    },
    {
      "date": "2024-10-25",
      "id": "91658",
      "original_text": "Registerbekanntmachung nach dem Umwandlungsgesetz\nBaden-Württemberg Amtsgericht Mannheim HRB 108630\nPATEV Holding GmbH – Karlsruhe",
      "type": "Registerbekanntmachung nach dem Umwandlungsgesetz",
      "state": "Baden-Württemberg",
      "amtsgericht": "Amtsgericht Mannheim",
      "registernummer": "HRB 108630",
      "registerart": "HRB",
      "company_name": "PATEV Holding GmbH",
      "company_seat": "Karlsruhe",
      "details": "25.10.2024 (Bekanntmachungsdatum)\n\nBaden-Württemberg Amtsgericht Mannheim HRB 108630\nRegisterbekanntmachung nach dem Umwandlungsgesetz 25.10.2024 (Eintragungsdatum)\n\nPATEV Holding GmbH\nGesellschaft mit beschränkter Haftung\nKarlsruhe\n\nDen Gläubigern der an der Verschmelzung beteiligten Rechtsträger ist, wenn sie binnen sechs Monaten nach dem Tag, an dem die Eintragung der Verschmelzung in das Register des Sitzes desjenigen Rechtsträgers, dessen Gläubiger sie sind, nach § 19 Abs. 3 UmwG als bekanntgemacht gilt, ihren Anspruch nach Grund und Höhe schriftlich anmelden, Sicherheit zu leisten, soweit sie nicht Befriedigung verlangen können. Dieses Recht steht den Gläubigern jedoch nur zu, wenn sie glaubhaft machen, dass durch die Verschmelzung die Erfüllung ihrer Forderung gefährdet wird."
    },
    {
      "date": "2024-10-25",
      "id": "91659",
      "original_text": "Einreichung neuer Dokumente\nBerlin Amtsgericht Berlin (Charlottenburg) HRB 162590\nFRIENDSHIP SYSTEMS AG – Berlin",
      "type": "Einreichung neuer Dokumente",
      "state": "Berlin",
      "amtsgericht": "Amtsgericht Berlin (Charlottenburg)",
      "registernummer": "HRB 162590",
      "registerart": "HRB",
      "company_name": "FRIENDSHIP SYSTEMS AG",
      "company_seat": "Berlin",
      "details": "25.10.2024 (Bekanntmachungsdatum)\n\nBerlin Amtsgericht Berlin (Charlottenburg) HRB 162590\nEinreichung neuer Dokumente\n\nFRIENDSHIP SYSTEMS AG\nAktiengesellschaft\nBerlin\n\nAls nicht eingetragen wird veröffentlicht: Es wurde eine neue Liste der Aufsichtsratsmitglieder eingereicht (§ 106 AktG)."
    },
    {
      "date": "2024-10-25",
      "id": "91660",
      "original_text": "Registerbekanntmachung nach dem Umwandlungsgesetz\nBrandenburg Amtsgericht Potsdam HRB 23258\nP.I.V. GmbH – Brandenburg an der Havel",
      "type": "Registerbekanntmachung nach dem Umwandlungsgesetz",
      "state": "Brandenburg",
      "amtsgericht": "Amtsgericht Potsdam",
      "registernummer": "HRB 23258",
      "registerart": "HRB",
      "company_name": "P.I.V. GmbH",
      "company_seat": "Brandenburg an der Havel",
      "details": "25.10.2024 (Bekanntmachungsdatum)\n\nBrandenburg Amtsgericht Potsdam HRB 23258\nRegisterbekanntmachung nach dem Umwandlungsgesetz 22.10.2024 (Eintragungsdatum)\n\nP.I.V. GmbH\nGesellschaft mit beschränkter Haftung\nBrandenburg an der Havel\n\nZu Eintragungsnummer 4 vom 22.10.2024 wird als nicht eingetragen veröffentlicht: Den Gläubigern der an der Verschmelzung beteiligten Rechtsträger ist, wenn sie binnen sechs Monaten nach dem Tag, an dem die Eintragung der Verschmelzung in das Register des Sitzes desjenigen Rechtsträgers, dessen Gläubiger sie sind, als bekannt gemacht gilt, ihren Anspruch nach Grund und Höhe schriftlich anmelden, Sicherheit zu leisten, soweit sie nicht Befriedigung verlangen können. Dieses Recht steht den Gläubigern jedoch nur zu, wenn sie glaubhaft machen, dass durch die Verschmelzung die Erfüllung ihrer Forderung gefährdet wird."
    },
    {
      "date": "2024-10-25",
      "id": "91661",
      "original_text": "Registerbekanntmachung nach dem Umwandlungsgesetz\nBrandenburg Amtsgericht Potsdam HRA 8489\nRainer Reinert e.K. – Brandenburg an der Havel",
      "type": "Registerbekanntmachung nach dem Umwandlungsgesetz",
      "state": "Brandenburg",
      "amtsgericht": "Amtsgericht Potsdam",
      "registernummer": "HRA 8489",
      "registerart": "HRA",
      "company_name": "Rainer Reinert e.K.",
      "company_seat": "Brandenburg an der Havel",
      "details": "25.10.2024 (Bekanntmachungsdatum)\n\nBrandenburg Amtsgericht Potsdam HRA 8489\nRegisterbekanntmachung nach dem Umwandlungsgesetz 22.10.2024 (Eintragungsdatum)\n\nRainer Reinert e.K.\nEinzelkaufmann / Einzelkauffrau\nBrandenburg an der Havel\n\nZu Eintragungsnummer 2 vom 22.10.2024 wird als nicht eingetragen veröffentlicht: Den Gläubigern der an der Verschmelzung beteiligten Rechtsträger ist, wenn sie binnen sechs Monaten nach dem Tag, an dem die Eintragung der Verschmelzung in das Register des Sitzes desjenigen Rechtsträgers, dessen Gläubiger sie sind, als bekannt gemacht gilt, ihren Anspruch nach Grund und Höhe schriftlich anmelden, Sicherheit zu leisten, soweit sie nicht Befriedigung verlangen können. Dieses Recht steht den Gläubigern jedoch nur zu, wenn sie glaubhaft machen, dass durch die Verschmelzung die Erfüllung ihrer Forderung gefährdet wird."
    },
    {
      "date": "2024-10-25",
      "id": "91662",
      "original_text": "Sonstige Registerbekanntmachung\nBrandenburg Amtsgericht Frankfurt/Oder HRB 19319\nCastomus GmbH – Biesenthal",
      "type": "Sonstige Registerbekanntmachung",
      "state": "Brandenburg",
      "amtsgericht": "Amtsgericht Frankfurt/Oder",
      "registernummer": "HRB 19319",
      "registerart": "HRB",
      "company_name": "Castomus GmbH",
      "company_seat": "Biesenthal",
      "details": "25.10.2024 (Bekanntmachungsdatum)\n\nBrandenburg Amtsgericht Frankfurt/Oder HRB 19319\nSonstige Registerbekanntmachung\n\nCastomus GmbH\nGesellschaft mit beschränkter Haftung\nBiesenthal\n\nDie Eintragung betreffend die empfangsberechtigte Person ist mangels einer wesentlichen Voraussetzung gemäß § 395 FamFG von Amts wegen gelöscht. Nicht mehr empfangsberechtigte Person: Schmidt, Halyna"
    },
    {
      "date": "2024-10-25",
      "id": "91663",
      "original_text": "Löschungsankündigung\nSchleswig-Holstein Amtsgericht Pinneberg HRB 16025\nÖZT Bau GmbH – Uetersen",
      "type": "Löschungsankündigung",
      "state": "Schleswig-Holstein",
      "amtsgericht": "Amtsgericht Pinneberg",
      "registernummer": "HRB 16025",
      "registerart": "HRB",
      "company_name": "ÖZT Bau GmbH",
      "company_seat": "Uetersen",
      "details": "25.10.2024 (Bekanntmachungsdatum)\n\nSchleswig-Holstein Amtsgericht Pinneberg HRB 16025\nLöschungsankündigung\n\nÖZT Bau GmbH\nGesellschaft mit beschränkter Haftung\nUetersen\n\nEs ist die Löschung der nachstehenden Gesellschaft wegen Vermögenslosigkeit gemäß § 394 FamFG beabsichtigt. Widerspruchsfrist: 2 Monate."
    },
    {
      "date": "2024-10-25",
      "id": "91664",
      "original_text": "Registerbekanntmachung nach dem Umwandlungsgesetz\nBrandenburg Amtsgericht Neuruppin HRB 12526\nPK Hotelbetriebs GmbH – Kyritz",
      "type": "Registerbekanntmachung nach dem Umwandlungsgesetz",
      "state": "Brandenburg",
      "amtsgericht": "Amtsgericht Neuruppin",
      "registernummer": "HRB 12526",
      "registerart": "HRB",
      "company_name": "PK Hotelbetriebs GmbH",
      "company_seat": "Kyritz",
      "details": "25.10.2024 (Bekanntmachungsdatum)\n\nBrandenburg Amtsgericht Neuruppin HRB 12526\nRegisterbekanntmachung nach dem Umwandlungsgesetz 24.10.2024 (Eintragungsdatum)\n\nPK Hotelbetriebs GmbH\nGesellschaft mit beschränkter Haftung\nKyritz\n\nZu Eintragungsnummer 9 vom 24.10.2024 wird als nicht eingetragen veröffentlicht:\nDen Gläubigern der an der Umwandlung beteiligten Rechtsträger ist, wenn sie binnen sechs Monaten nach dem Tag, an dem die Eintragung der Umwandlung in das Register des Sitzes desjenigen Rechtsträgers, dessen Gläubiger sie sind, als bekannt gemacht gilt, ihren Anspruch nach Grund und Höhe schriftlich anmelden, Sicherheit zu leisten, soweit sie nicht Befriedigung verlangen können. Dieses Recht steht den Gläubigern jedoch nur zu, wenn sie glaubhaft machen, dass durch die Umwandlung die Erfüllung ihrer Forderung gefährdet wird"
    },
    {
      "date": "2024-10-25",
      "id": "91665",
      "original_text": "Registerbekanntmachung nach dem Umwandlungsgesetz\nBerlin Amtsgericht Berlin (Charlottenburg) HRA 63496\nGLI Golden Leaf Invest GmbH & Co. OHG – Berlin",
      "type": "Registerbekanntmachung nach dem Umwandlungsgesetz",
      "state": "Berlin",
      "amtsgericht": "Amtsgericht Berlin (Charlottenburg)",
      "registernummer": "HRA 63496",
      "registerart": "HRA",
      "company_name": "GLI Golden Leaf Invest GmbH & Co. OHG",
      "company_seat": "Berlin",
      "details": "25.10.2024 (Bekanntmachungsdatum)\n\nBerlin Amtsgericht Berlin (Charlottenburg) HRA 63496\nRegisterbekanntmachung nach dem Umwandlungsgesetz 24.10.2024 (Eintragungsdatum)\n\nGLI Golden Leaf Invest GmbH & Co. OHG\nOffene Handelsgesellschaft\nBerlin\n\nZu Eintragungsnummer 1 vom 24.10.2024 wird als nicht eingetragen veröffentlicht: Den Gläubigern ist, wenn sie binnen sechs Monaten nach dem Tag, an dem die Eintragung der Umwandlung als bekannt gemacht gilt, ihren Anspruch nach Grund und Höhe schriftlich anmelden, Sicherheit zu leisten, soweit sie nicht Befriedigung verlangen können. Dieses Recht steht den Gläubigern jedoch nur zu, wenn sie glaubhaft machen, dass durch die Umwandlung die Erfüllung ihrer Forderung gefährdet wird. Das Recht, Sicherheitsleistung zu verlangen, steht Gläubigern nicht zu, die im Falle der Insolvenz ein Recht auf vorzugsweise Befriedigung aus einer Deckungsmasse haben, die nach gesetzlicher Vorschrift zu ihrem Schutz errichtet und staatlich überwacht ist."
    },
    {
      "date": "2024-10-25",
      "id": "91666",
      "original_text": "Registerbekanntmachung nach dem Umwandlungsgesetz\nBerlin Amtsgericht Berlin (Charlottenburg) HRB 138300\nGLI Golden Leaf Invest GmbH & Co. KGaA – Berlin",
      "type": "Registerbekanntmachung nach dem Umwandlungsgesetz",
      "state": "Berlin",
      "amtsgericht": "Amtsgericht Berlin (Charlottenburg)",
      "registernummer": "HRB 138300",
      "registerart": "HRB",
      "company_name": "GLI Golden Leaf Invest GmbH & Co. KGaA",
      "company_seat": "Berlin",
      "details": "25.10.2024 (Bekanntmachungsdatum)\n\nBerlin Amtsgericht Berlin (Charlottenburg) HRB 138300\nRegisterbekanntmachung nach dem Umwandlungsgesetz 24.10.2024 (Eintragungsdatum)\n\nGLI Golden Leaf Invest GmbH & Co. KGaA\nKommanditgesellschaft auf Aktien\nBerlin\n\nZu Eintragungsnummer 8 vom 24.10.2024 wird als nicht eingetragen veröffentlicht: Den Gläubigern ist, wenn sie binnen sechs Monaten nach dem Tag, an dem die Eintragung der Umwandlung als bekannt gemacht gilt, ihren Anspruch nach Grund und Höhe schriftlich anmelden, Sicherheit zu leisten, soweit sie nicht Befriedigung verlangen können. Dieses Recht steht den Gläubigern jedoch nur zu, wenn sie glaubhaft machen, dass durch die Umwandlung die Erfüllung ihrer Forderung gefährdet wird. Das Recht, Sicherheitsleistung zu verlangen, steht Gläubigern nicht zu, die im Falle der Insolvenz ein Recht auf vorzugsweise Befriedigung aus einer Deckungsmasse haben, die nach gesetzlicher Vorschrift zu ihrem Schutz errichtet und staatlich überwacht ist."
    },
    {
      "date": "2024-10-25",
      "id": "91667",
      "original_text": "Registerbekanntmachung nach dem Umwandlungsgesetz\nBaden-Württemberg Amtsgericht Stuttgart HRA 741347\nSTACKIT GmbH & Co. KG – Neckarsulm",
      "type": "Registerbekanntmachung nach dem Umwandlungsgesetz",
      "state": "Baden-Württemberg",
      "amtsgericht": "Amtsgericht Stuttgart",
      "registernummer": "HRA 741347",
      "registerart": "HRA",
      "company_name": "STACKIT GmbH & Co. KG",
      "company_seat": "Neckarsulm",
      "details": "25.10.2024 (Bekanntmachungsdatum)\n\nBaden-Württemberg Amtsgericht Stuttgart HRA 741347\nRegisterbekanntmachung nach dem Umwandlungsgesetz 25.10.2024 (Eintragungsdatum)\n\nSTACKIT GmbH & Co. KG\nKommanditgesellschaft\nNeckarsulm\n\nAls nicht eingetragen wird bekanntgemacht:\nDen Gläubigern der an der Ausgliederung beteiligten Rechtsträger ist, wenn sie binnen sechs Monaten nach dem Tag, an dem die Eintragung der Ausgliederung in das Register des Sitzes desjenigen Rechtsträgers, dessen Gläubiger sie sind, nach § 19 Abs. 3 UmwG als bekanntgemacht gilt, ihren Anspruch nach Grund und Höhe schriftlich anmelden, Sicherheit zu leisten, soweit sie nicht Befriedigung verlangen können. Dieses Recht steht den Gläubigern jedoch nur zu, wenn sie glaubhaft machen, dass durch die Ausgliederung die Erfüllung ihrer Forderung gefährdet wird."
    },
    {
      "date": "2024-10-25",
      "id": "91668",
      "original_text": "Registerbekanntmachung nach dem Umwandlungsgesetz\nBaden-Württemberg Amtsgericht Stuttgart HRA 730995\nSchwarz IT KG – Neckarsulm",
      "type": "Registerbekanntmachung nach dem Umwandlungsgesetz",
      "state": "Baden-Württemberg",
      "amtsgericht": "Amtsgericht Stuttgart",
      "registernummer": "HRA 730995",
      "registerart": "HRA",
      "company_name": "Schwarz IT KG",
      "company_seat": "Neckarsulm",
      "details": "25.10.2024 (Bekanntmachungsdatum)\n\nBaden-Württemberg Amtsgericht Stuttgart HRA 730995\nRegisterbekanntmachung nach dem Umwandlungsgesetz 25.10.2024 (Eintragungsdatum)\n\nSchwarz IT KG\nKommanditgesellschaft\nNeckarsulm\n\nDen Gläubigern der an der Ausgliederung beteiligten Rechtsträger ist, wenn sie binnen sechs Monaten nach dem Tag, an dem die Eintragung der Ausgliederung in das Register des Sitzes desjenigen Rechtsträgers, dessen Gläubiger sie sind, nach § 19 Abs. 3 UmwG als bekanntgemacht gilt, ihren Anspruch nach Grund und Höhe schriftlich anmelden, Sicherheit zu leisten, soweit sie nicht Befriedigung verlangen können. Dieses Recht steht den Gläubigern jedoch nur zu, wenn sie glaubhaft machen, dass durch die Ausgliederung die Erfüllung ihrer Forderung gefährdet wird."
    },
    {
      "date": "2024-10-25",
      "id": "91669",
      "original_text": "Einreichung neuer Dokumente\nSaarland Amtsgericht Saarbrücken HRB 25178\nTWE Technische Werke der Gemeinde Ensdorf GmbH – Ensdorf",
      "type": "Einreichung neuer Dokumente",
      "state": "Saarland",
      "amtsgericht": "Amtsgericht Saarbrücken",
      "registernummer": "HRB 25178",
      "registerart": "HRB",
      "company_name": "TWE Technische Werke der Gemeinde Ensdorf GmbH",
      "company_seat": "Ensdorf",
      "details": "25.10.2024 (Bekanntmachungsdatum)\n\nSaarland Amtsgericht Saarbrücken HRB 25178\nEinreichung neuer Dokumente\n\nTWE Technische Werke der Gemeinde Ensdorf GmbH\nGesellschaft mit beschränkter Haftung\nEnsdorf\n\nDie Geschäftsführung der Gesellschaft hat eine Liste der Mitglieder des Aufsichtsrats zum Handelsregister eingereicht (§ 52 Abs. 3 Satz 2 GmbHG)."
    },
    {
      "date": "2024-10-25",
      "id": "91670",
      "original_text": "Löschungsankündigung\nSchleswig-Holstein Amtsgericht Kiel HRB 1000 NM\nPflüger GmbH – Neumünster",
      "type": "Löschungsankündigung",
      "state": "Schleswig-Holstein",
      "amtsgericht": "Amtsgericht Kiel",
      "registernummer": "HRB 1000 NM",
      "registerart": "HRB",
      "company_name": "Pflüger GmbH",
      "company_seat": "Neumünster",
      "details": "25.10.2024 (Bekanntmachungsdatum)\n\nSchleswig-Holstein Amtsgericht Kiel HRB 1000 NM\nLöschungsankündigung\n\nPflüger GmbH\nGesellschaft mit beschränkter Haftung\nNeumünster\n\nEs ist die Löschung der nachstehenden Gesellschaft wegen Vermögenslosigkeit gemäß § 394 FamFG beabsichtigt. Widerspruchsfrist: 2 Monate."
    },
    {
      "date": "2024-10-25",
      "id": "91671",
      "original_text": "Registerbekanntmachung nach dem Umwandlungsgesetz\nBerlin Amtsgericht Berlin (Charlottenburg) HRB 138063\nStiessel Haus- und Gartenservice GmbH – Berlin",
      "type": "Registerbekanntmachung nach dem Umwandlungsgesetz",
      "state": "Berlin",
      "amtsgericht": "Amtsgericht Berlin (Charlottenburg)",
      "registernummer": "HRB 138063",
      "registerart": "HRB",
      "company_name": "Stiessel Haus- und Gartenservice GmbH",
      "company_seat": "Berlin",
      "details": "25.10.2024 (Bekanntmachungsdatum)\n\nBerlin Amtsgericht Berlin (Charlottenburg) HRB 138063\nRegisterbekanntmachung nach dem Umwandlungsgesetz 24.10.2024 (Eintragungsdatum)\n\nStiessel Haus- und Gartenservice GmbH\nGesellschaft mit beschränkter Haftung\nBerlin\n\nZu Eintragungsnummer 5 vom 24.10.2024 wird als nicht eingetragen veröffentlicht: Den Gläubigern der an der Verschmelzung beteiligten Rechtsträger ist, wenn sie binnen sechs Monaten nach dem Tag, an dem die Eintragung der Verschmelzung in das Register des Sitzes desjenigen Rechtsträgers, dessen Gläubiger sie sind, als bekannt gemacht gilt, ihren Anspruch nach Grund und Höhe schriftlich anmelden, Sicherheit zu leisten, soweit sie nicht Befriedigung verlangen können. Dieses Recht steht den Gläubigern jedoch nur zu, wenn sie glaubhaft machen, dass durch die Verschmelzung die Erfüllung ihrer Forderung gefährdet wird. Das Recht, Sicherheitsleistung zu verlangen, steht Gläubigern nicht zu, die im Falle der Insolvenz ein Recht auf vorzugsweise Befriedigung aus einer Deckungsmasse haben, die nach gesetzlicher Vorschrift zu ihrem Schutz errichtet und staatlich überwacht ist."
    },
    {
      "date": "2024-10-25",
      "id": "91672",
      "original_text": "Registerbekanntmachung nach dem Umwandlungsgesetz\nBerlin Amtsgericht Berlin (Charlottenburg) HRB 132536\nBareket GmbH – Berlin",
      "type": "Registerbekanntmachung nach dem Umwandlungsgesetz",
      "state": "Berlin",
      "amtsgericht": "Amtsgericht Berlin (Charlottenburg)",
      "registernummer": "HRB 132536",
      "registerart": "HRB",
      "company_name": "Bareket GmbH",
      "company_seat": "Berlin",
      "details": "25.10.2024 (Bekanntmachungsdatum)\n\nBerlin Amtsgericht Berlin (Charlottenburg) HRB 132536\nRegisterbekanntmachung nach dem Umwandlungsgesetz 24.10.2024 (Eintragungsdatum)\n\nBareket GmbH\nGesellschaft mit beschränkter Haftung\nBerlin\n\nZu Eintragungsnummer 8 vom 24.10.2024 wird als nicht eingetragen veröffentlicht: Den Gläubigern der an der Verschmelzung beteiligten Rechtsträger ist, wenn sie binnen sechs Monaten nach dem Tag, an dem die Eintragung der Verschmelzung in das Register des Sitzes desjenigen Rechtsträgers, dessen Gläubiger sie sind, als bekannt gemacht gilt, ihren Anspruch nach Grund und Höhe schriftlich anmelden, Sicherheit zu leisten, soweit sie nicht Befriedigung verlangen können. Dieses Recht steht den Gläubigern jedoch nur zu, wenn sie glaubhaft machen, dass durch die Verschmelzung die Erfüllung ihrer Forderung gefährdet wird. Das Recht, Sicherheitsleistung zu verlangen, steht Gläubigern nicht zu, die im Falle der Insolvenz ein Recht auf vorzugsweise Befriedigung aus einer Deckungsmasse haben, die nach gesetzlicher Vorschrift zu ihrem Schutz errichtet und staatlich überwacht ist."
    },
    {
      "date": "2024-10-25",
      "id": "91673",
      "original_text": "Registerbekanntmachung nach dem Umwandlungsgesetz\nBaden-Württemberg Amtsgericht Stuttgart HRB 223264\nINTERFRACHT AIR SERVICE GmbH – Filderstadt",
      "type": "Registerbekanntmachung nach dem Umwandlungsgesetz",
      "state": "Baden-Württemberg",
      "amtsgericht": "Amtsgericht Stuttgart",
      "registernummer": "HRB 223264",
      "registerart": "HRB",
      "company_name": "INTERFRACHT AIR SERVICE GmbH",
      "company_seat": "Filderstadt",
      "details": "25.10.2024 (Bekanntmachungsdatum)\n\nBaden-Württemberg Amtsgericht Stuttgart HRB 223264\nRegisterbekanntmachung nach dem Umwandlungsgesetz 25.10.2024 (Eintragungsdatum)\n\nINTERFRACHT AIR SERVICE GmbH\nGesellschaft mit beschränkter Haftung\nFilderstadt\n\nDen Gläubigern der an der Verschmelzung beteiligten Rechtsträger ist, wenn sie binnen sechs Monaten nach dem Tag, an dem die Eintragung der Verschmelzung in das Register des Sitzes desjenigen Rechtsträgers, dessen Gläubiger sie sind, nach § 19 Abs. 3 UmwG als bekanntgemacht gilt, ihren Anspruch nach Grund und Höhe schriftlich anmelden, Sicherheit zu leisten, soweit sie nicht Befriedigung verlangen können. Dieses Recht steht den Gläubigern jedoch nur zu, wenn sie glaubhaft machen, dass durch die Verschmelzung die Erfüllung ihrer Forderung gefährdet wird."
    },
    {
      "date": "2024-10-25",
      "id": "91674",
      "original_text": "Löschungsankündigung\nSchleswig-Holstein Amtsgericht Lübeck HRB 1861 BS\n\"Die Tischlerei\" Matthusen GmbH – Stockelsdorf",
      "type": "Löschungsankündigung",
      "state": "Schleswig-Holstein",
      "amtsgericht": "Amtsgericht Lübeck",
      "registernummer": "HRB 1861 BS",
      "registerart": "HRB",
      "company_name": "\"Die Tischlerei\" Matthusen GmbH",
      "company_seat": "Stockelsdorf",
      "details": "25.10.2024 (Bekanntmachungsdatum)\n\nSchleswig-Holstein Amtsgericht Lübeck HRB 1861 BS\nLöschungsankündigung\n\n\"Die Tischlerei\" Matthusen GmbH\nGesellschaft mit beschränkter Haftung\nStockelsdorf\n\nEs ist die Löschung der nachstehenden Gesellschaft wegen Vermögenslosigkeit gemäß § 394 FamFG beabsichtigt.\nWiderspruchsfrist: 1 Monat"
    },
    {
      "date": "2024-10-25",
      "id": "91675",
      "original_text": "Registerbekanntmachung nach dem Umwandlungsgesetz\nBaden-Württemberg Amtsgericht Mannheim HRB 752447\nAGF AG Akademie für Gesundheitsfachberufe – Mannheim",
      "type": "Registerbekanntmachung nach dem Umwandlungsgesetz",
      "state": "Baden-Württemberg",
      "amtsgericht": "Amtsgericht Mannheim",
      "registernummer": "HRB 752447",
      "registerart": "HRB",
      "company_name": "AGF AG Akademie für Gesundheitsfachberufe",
      "company_seat": "Mannheim",
      "details": "25.10.2024 (Bekanntmachungsdatum)\n\nBaden-Württemberg Amtsgericht Mannheim HRB 752447\nRegisterbekanntmachung nach dem Umwandlungsgesetz 25.10.2024 (Eintragungsdatum)\n\nAGF AG Akademie für Gesundheitsfachberufe\nAktiengesellschaft\nMannheim\n\nDen Gläubigern der an der Ausgliederung beteiligten Rechtsträger ist, wenn sie binnen sechs Monaten nach dem Tag, an dem die Eintragung der Ausgliederung in das Register des Sitzes desjenigen Rechtsträgers, dessen Gläubiger sie sind, nach § 19 Abs. 3 UmwG als bekanntgemacht gilt, ihren Anspruch nach Grund und Höhe schriftlich anmelden, Sicherheit zu leisten, soweit sie nicht Befriedigung verlangen können. Dieses Recht steht den Gläubigern jedoch nur zu, wenn sie glaubhaft machen, dass durch die Ausgliederung die Erfüllung ihrer Forderung gefährdet wird."
    },
    {
      "date": "2024-10-25",
      "id": "91676",
      "original_text": "Registerbekanntmachung nach dem Umwandlungsgesetz\nHamburg Amtsgericht Hamburg HRB 134509\nNASCO Energie & Rohstoff AG – Hamburg",
      "type": "Registerbekanntmachung nach dem Umwandlungsgesetz",
      "state": "Hamburg",
      "amtsgericht": "Amtsgericht Hamburg",
      "registernummer": "HRB 134509",
      "registerart": "HRB",
      "company_name": "NASCO Energie & Rohstoff AG",
      "company_seat": "Hamburg",
      "details": "25.10.2024 (Bekanntmachungsdatum)\n\nHamburg Amtsgericht Hamburg HRB 134509\nRegisterbekanntmachung nach dem Umwandlungsgesetz\n\nNASCO Energie & Rohstoff AG\nAktiengesellschaft\nHamburg\n\nDie Gesellschaft hat gemäß § 62 UmwG den Verschmelzungsvertrag vom 25.10.2024 bei dem Handelsregister eingereicht, mit dem die NASCO Germany GmbH mit Sitz in Hamburg (Amtsgericht Hamburg, HRB 136044) als übertragende Gesellschaft auf die NASCO Energie & Rohstoff AG mit Sitz in Hamburg (Amtsgericht Hamburg HRB 134509) als übernehmende Gesellschaft verschmolzen wird."
    },
    {
      "date": "2024-10-25",
      "id": "91677",
      "original_text": "Registerbekanntmachung nach dem Umwandlungsgesetz\nBaden-Württemberg Amtsgericht Mannheim HRB 722226\nHGMB GmbH – Mannheim",
      "type": "Registerbekanntmachung nach dem Umwandlungsgesetz",
      "state": "Baden-Württemberg",
      "amtsgericht": "Amtsgericht Mannheim",
      "registernummer": "HRB 722226",
      "registerart": "HRB",
      "company_name": "HGMB GmbH",
      "company_seat": "Mannheim",
      "details": "25.10.2024 (Bekanntmachungsdatum)\n\nBaden-Württemberg Amtsgericht Mannheim HRB 722226\nRegisterbekanntmachung nach dem Umwandlungsgesetz 25.10.2024 (Eintragungsdatum)\n\nHGMB GmbH\nGesellschaft mit beschränkter Haftung\nMannheim\n\nDen Gläubigern der an der Ausgliederung beteiligten Rechtsträger ist, wenn sie binnen sechs Monaten nach dem Tag, an dem die Eintragung der Ausgliederung in das Register des Sitzes desjenigen Rechtsträgers, dessen Gläubiger sie sind, nach § 19 Abs. 3 UmwG als bekanntgemacht gilt, ihren Anspruch nach Grund und Höhe schriftlich anmelden, Sicherheit zu leisten, soweit sie nicht Befriedigung verlangen können. Dieses Recht steht den Gläubigern jedoch nur zu, wenn sie glaubhaft machen, dass durch die Ausgliederung die Erfüllung ihrer Forderung gefährdet wird."
    },
    {
      "date": "2024-10-25",
      "id": "91678",
      "original_text": "Registerbekanntmachung nach dem Umwandlungsgesetz\nSaarland Amtsgericht Saarbrücken HRB 110640\nKalinski Gastro UG (haftungsbeschränkt) – Saarbrücken",
      "type": "Registerbekanntmachung nach dem Umwandlungsgesetz",
      "state": "Saarland",
      "amtsgericht": "Amtsgericht Saarbrücken",
      "registernummer": "HRB 110640",
      "registerart": "HRB",
      "company_name": "Kalinski Gastro UG (haftungsbeschränkt)",
      "company_seat": "Saarbrücken",
      "details": "25.10.2024 (Bekanntmachungsdatum)\n\nSaarland Amtsgericht Saarbrücken HRB 110640\nRegisterbekanntmachung nach dem Umwandlungsgesetz 25.10.2024 (Eintragungsdatum)\n\nKalinski Gastro UG (haftungsbeschränkt)\nGesellschaft mit beschränkter Haftung\nSaarbrücken\n\nAls nicht eingetragen wird bekannt gemacht: Den Gläubigern der an der Abspaltung beteiligten Gesellschaften ist, wenn sie binnen sechs Monaten nach dem Tag, an dem die Eintragung der Abspaltung in das Register des Sitzes desjenigen Rechtsträgers, dessen Gläubiger sie sind, nach § 19 Absatz 3 UmwG bekannt gemacht worden ist, ihren Anspruch nach Grund und Höhe schriftlich anmelden, Sicherheit zu leisten, soweit sie nicht Befriedigung verlangen können. Dieses Recht steht den Gläubigern jedoch nur zu, wenn sie glaubhaft machen, dass durch die Abspaltung die Erfüllung ihrer Forderung gefährdet wird."
    },
    {
      "date": "2024-10-25",
      "id": "91679",
      "original_text": "Registerbekanntmachung nach dem Umwandlungsgesetz\nSaarland Amtsgericht Saarbrücken HRB 106381\nKalinski Franchise UG (haftungsbeschränkt) – Saarbrücken",
      "type": "Registerbekanntmachung nach dem Umwandlungsgesetz",
      "state": "Saarland",
      "amtsgericht": "Amtsgericht Saarbrücken",
      "registernummer": "HRB 106381",
      "registerart": "HRB",
      "company_name": "Kalinski Franchise UG (haftungsbeschränkt)",
      "company_seat": "Saarbrücken",
      "details": "25.10.2024 (Bekanntmachungsdatum)\n\nSaarland Amtsgericht Saarbrücken HRB 106381\nRegisterbekanntmachung nach dem Umwandlungsgesetz 25.10.2024 (Eintragungsdatum)\n\nKalinski Franchise UG (haftungsbeschränkt)\nGesellschaft mit beschränkter Haftung\nSaarbrücken\n\nAls nicht eingetragen wird bekannt gemacht: Den Gläubigern der an der Abspaltung beteiligten Gesellschaften ist, wenn sie binnen sechs Monaten nach dem Tag, an dem die Eintragung der Abspaltung in das Register des Sitzes desjenigen Rechtsträgers, dessen Gläubiger sie sind, nach § 19 Absatz 3 UmwG bekannt gemacht worden ist, ihren Anspruch nach Grund und Höhe schriftlich anmelden, Sicherheit zu leisten, soweit sie nicht Befriedigung verlangen können. Dieses Recht steht den Gläubigern jedoch nur zu, wenn sie glaubhaft machen, dass durch die Abspaltung die Erfüllung ihrer Forderung gefährdet wird."
    },
    {
      "date": "2024-10-25",
      "id": "91680",
      "original_text": "Einreichung neuer Dokumente\nBaden-Württemberg Amtsgericht Stuttgart HRB 22937\nMercedes-Benz Bank AG – Stuttgart",
      "type": "Einreichung neuer Dokumente",
      "state": "Baden-Württemberg",
      "amtsgericht": "Amtsgericht Stuttgart",
      "registernummer": "HRB 22937",
      "registerart": "HRB",
      "company_name": "Mercedes-Benz Bank AG",
      "company_seat": "Stuttgart",
      "details": "25.10.2024 (Bekanntmachungsdatum)\n\nBaden-Württemberg Amtsgericht Stuttgart HRB 22937\nEinreichung neuer Dokumente 25.10.2024 (Eintragungsdatum)\n\nMercedes-Benz Bank AG\nAktiengesellschaft\nStuttgart\n\nDie Gesellschaft hat am 24.10.2024 die Liste über die Zusammensetzung des Aufsichtsrats zum Handelsregister eingereicht."
    },
    {
      "date": "2024-10-25",
      "id": "91681",
      "original_text": "Einreichung neuer Dokumente\nBaden-Württemberg Amtsgericht Stuttgart GnR 200018\nBezirksbaugenossenschaft Altwürttemberg e.G., Kornwestheim – Kornwestheim",
      "type": "Einreichung neuer Dokumente",
      "state": "Baden-Württemberg",
      "amtsgericht": "Amtsgericht Stuttgart",
      "registernummer": "GnR 200018",
      "registerart": "GnR",
      "company_name": "Bezirksbaugenossenschaft Altwürttemberg e.G., Kornwestheim",
      "company_seat": "Kornwestheim",
      "details": "25.10.2024 (Bekanntmachungsdatum)\n\nBaden-Württemberg Amtsgericht Stuttgart GnR 200018\nEinreichung neuer Dokumente\n\nBezirksbaugenossenschaft Altwürttemberg e.G., Kornwestheim\neingetragene Genossenschaft\nKornwestheim\n\nDie Gesellschaft hat am 20.10.2024 die Liste über die Zusammensetzung des Aufsichtsrats zum Handelsregister eingereicht."
    },
    {
      "date": "2024-10-25",
      "id": "91682",
      "original_text": "Löschungsankündigung\nBerlin Amtsgericht Berlin (Charlottenburg) HRA 53837\nDiener Handelsagentur UG (haftungsbeschränkt) & Co. KG – Berlin",
      "type": "Löschungsankündigung",
      "state": "Berlin",
      "amtsgericht": "Amtsgericht Berlin (Charlottenburg)",
      "registernummer": "HRA 53837",
      "registerart": "HRA",
      "company_name": "Diener Handelsagentur UG (haftungsbeschränkt) & Co. KG",
      "company_seat": "Berlin",
      "details": "25.10.2024 (Bekanntmachungsdatum)\n\nBerlin Amtsgericht Berlin (Charlottenburg) HRA 53837\nLöschungsankündigung\n\nDiener Handelsagentur UG (haftungsbeschränkt) & Co. KG\nKommanditgesellschaft\nBerlin\n\nBei dem nachstehenden Unternehmen / der nachstehenden Gesellschaft wird das Amtslöschungsverfahren gemäß § 31 Abs. 2 HGB eingeleitet. Widerspruchsfrist 1 Monat"
    },
    {
      "date": "2024-10-25",
      "id": "91683",
      "original_text": "Löschungsankündigung\nMecklenburg-Vorpommern Amtsgericht Stralsund HRB 20532\nKwestus Verwaltungs- und Beteiligungs GmbH – Rambin",
      "type": "Löschungsankündigung",
      "state": "Mecklenburg-Vorpommern",
      "amtsgericht": "Amtsgericht Stralsund",
      "registernummer": "HRB 20532",
      "registerart": "HRB",
      "company_name": "Kwestus Verwaltungs- und Beteiligungs GmbH",
      "company_seat": "Rambin",
      "details": "25.10.2024 (Bekanntmachungsdatum)\n\nMecklenburg-Vorpommern Amtsgericht Stralsund HRB 20532\nLöschungsankündigung\n\nKwestus Verwaltungs- und Beteiligungs GmbH\nGesellschaft mit beschränkter Haftung\nRambin\n\nDas Registergericht beabsichtigt, die Firma von Amts wegen nach § 394 FamFG zu löschen. Die Frist zur Erhebung eines Widerspruchs ist auf 1 Monat festgesetzt."
    },
    {
      "date": "2024-10-25",
      "id": "91684",
      "original_text": "Registerbekanntmachung nach dem Umwandlungsgesetz\nSachsen-Anhalt Amtsgericht Stendal HRB 33949\nKnuspergrill Marter GmbH – Niedere Börde OT Dahlenwarsleben",
      "type": "Registerbekanntmachung nach dem Umwandlungsgesetz",
      "state": "Sachsen-Anhalt",
      "amtsgericht": "Amtsgericht Stendal",
      "registernummer": "HRB 33949",
      "registerart": "HRB",
      "company_name": "Knuspergrill Marter GmbH",
      "company_seat": "Niedere Börde OT Dahlenwarsleben",
      "details": "25.10.2024 (Bekanntmachungsdatum)\n\nSachsen-Anhalt Amtsgericht Stendal HRB 33949\nRegisterbekanntmachung nach dem Umwandlungsgesetz 25.10.2024 (Eintragungsdatum)\n\nKnuspergrill Marter GmbH\nGesellschaft mit beschränkter Haftung\nNiedere Börde OT Dahlenwarsleben\n\nNicht eingetragen:\nDen Gläubigern der an der Ausgliederung beteiligten Rechtsträger, ist wenn sie binnen sechs Monaten nach dem Tag, an dem die Eintragung der Ausgliederung nach §§125, 19 Abs. 3 UmwG als bekanntgemacht gilt, ihren Anspruch nach Grund und Höhe schriftlich anmelden, Sicherheit zu leisten, soweit sie nicht Befriedigung verlangen können. Diese Recht steht ihnen jedoch nur zu, wenn sie glaubhaft machen, dass durch die Ausgliederung die Erfüllung ihrer Forderung gefährdet wird."
    },
    {
      "date": "2024-10-25",
      "id": "91685",
      "original_text": "Registerbekanntmachung nach dem Umwandlungsgesetz\nBaden-Württemberg Amtsgericht Stuttgart HRB 789565\nAPEX NDNE INVEST GmbH – Stuttgart",
      "type": "Registerbekanntmachung nach dem Umwandlungsgesetz",
      "state": "Baden-Württemberg",
      "amtsgericht": "Amtsgericht Stuttgart",
      "registernummer": "HRB 789565",
      "registerart": "HRB",
      "company_name": "APEX NDNE INVEST GmbH",
      "company_seat": "Stuttgart",
      "details": "25.10.2024 (Bekanntmachungsdatum)\n\nBaden-Württemberg Amtsgericht Stuttgart HRB 789565\nRegisterbekanntmachung nach dem Umwandlungsgesetz 25.10.2024 (Eintragungsdatum)\n\nAPEX NDNE INVEST GmbH\nGesellschaft mit beschränkter Haftung\nStuttgart\n\nDen Gläubigern der an der Verschmelzung beteiligten Rechtsträger ist, wenn sie binnen sechs Monaten nach dem Tag, an dem die Eintragung der Verschmelzung in das Register des Sitzes desjenigen Rechtsträgers, dessen Gläubiger sie sind, nach § 19 Abs. 3 UmwG als bekanntgemacht gilt, ihren Anspruch nach Grund und Höhe schriftlich anmelden, Sicherheit zu leisten, soweit sie nicht Befriedigung verlangen können. Dieses Recht steht den Gläubigern jedoch nur zu, wenn sie glaubhaft machen, dass durch die Verschmelzung die Erfüllung ihrer Forderung gefährdet wird."
    },
    {
      "date": "2024-10-25",
      "id": "91686",
      "original_text": "Einreichung neuer Dokumente\nBaden-Württemberg Amtsgericht Ulm HRB 726960\nRehabilitationsmedizin Ostalb GmbH – Aalen",
      "type": "Einreichung neuer Dokumente",
      "state": "Baden-Württemberg",
      "amtsgericht": "Amtsgericht Ulm",
      "registernummer": "HRB 726960",
      "registerart": "HRB",
      "company_name": "Rehabilitationsmedizin Ostalb GmbH",
      "company_seat": "Aalen",
      "details": "25.10.2024 (Bekanntmachungsdatum)\n\nBaden-Württemberg Amtsgericht Ulm HRB 726960\nEinreichung neuer Dokumente\n\nRehabilitationsmedizin Ostalb GmbH\nGesellschaft mit beschränkter Haftung\nAalen\n\nDie Gesellschaft hat am 24.10.2024 die Liste über die Zusammensetzung des Aufsichtsrats zum Handelsregister eingereicht."
    },
    {
      "date": "2024-10-25",
      "id": "91687",
      "original_text": "Registerbekanntmachung nach dem Umwandlungsgesetz\nSachsen-Anhalt Amtsgericht Stendal HRA 7516\nHähnchengrill Marter e.K. – Niedere Börde OT Dahlenwarsleben",
      "type": "Registerbekanntmachung nach dem Umwandlungsgesetz",
      "state": "Sachsen-Anhalt",
      "amtsgericht": "Amtsgericht Stendal",
      "registernummer": "HRA 7516",
      "registerart": "HRA",
      "company_name": "Hähnchengrill Marter e.K.",
      "company_seat": "Niedere Börde OT Dahlenwarsleben",
      "details": "25.10.2024 (Bekanntmachungsdatum)\n\nSachsen-Anhalt Amtsgericht Stendal HRA 7516\nRegisterbekanntmachung nach dem Umwandlungsgesetz 25.10.2024 (Eintragungsdatum)\n\nHähnchengrill Marter e.K.\nEinzelkaufmann / Einzelkauffrau\nNiedere Börde OT Dahlenwarsleben\n\nNicht eingetragen:\nDen Gläubigern der an der Ausgliederung beteiligten Rechtsträger, ist wenn sie binnen sechs Monaten nach dem Tag, an dem die Eintragung der Ausgliederung nach §§125, 19 Abs. 3 UmwG als bekanntgemacht gilt, ihren Anspruch nach Grund und Höhe schriftlich anmelden, Sicherheit zu leisten, soweit sie nicht Befriedigung verlangen können. Diese Recht steht ihnen jedoch nur zu, wenn sie glaubhaft machen, dass durch die Ausgliederung die Erfüllung ihrer Forderung gefährdet wird."
    },
    {
      "date": "2024-10-25",
      "id": "91688",
      "original_text": "Einreichung neuer Dokumente\nThüringen Amtsgericht Jena HRB 111272\nGeratherm Medical AG – Geratal",
      "type": "Einreichung neuer Dokumente",
      "state": "Thüringen",
      "amtsgericht": "Amtsgericht Jena",
      "registernummer": "HRB 111272",
      "registerart": "HRB",
      "company_name": "Geratherm Medical AG",
      "company_seat": "Geratal",
      "details": "25.10.2024 (Bekanntmachungsdatum)\n\nThüringen Amtsgericht Jena HRB 111272\nEinreichung neuer Dokumente 25.10.2024 (Eintragungsdatum)\n\nGeratherm Medical AG\nAktiengesellschaft\nGeratal\n\nNicht eingetragen: Den Gläubigern der an der Ausgliederung beteiligten Rechtsträger, ist wenn sie binnen sechs Monaten nach dem Tag, an dem die Eintragung der Ausgliederung in das Register des Sitzes desjenigen Rechtsträgers, dessen Gläubiger sie sind, nach §§125, 19 Abs. 3 UmwG als bekanntgemacht gilt, ihren Anspruch nach Grund und Höhe schriftlich anmelden, Sicherheit zu leisten, soweit sie nicht Befriedigung verlangen können. Dieses Recht steht ihnen jedoch nur zu, wenn sie glaubhaft machen, daß durch die Ausgliederung die Erfüllung ihrer Forderung gefährdet wird."
    },
    {
      "date": "2024-10-25",
      "id": "91689",
      "original_text": "Sonstige Registerbekanntmachung\nThüringen Amtsgericht Jena HRB 202419\nStadtwerke Energie Jena- Pößneck GmbH – Jena",
      "type": "Sonstige Registerbekanntmachung",
      "state": "Thüringen",
      "amtsgericht": "Amtsgericht Jena",
      "registernummer": "HRB 202419",
      "registerart": "HRB",
      "company_name": "Stadtwerke Energie Jena- Pößneck GmbH",
      "company_seat": "Jena",
      "details": "25.10.2024 (Bekanntmachungsdatum)\n\nThüringen Amtsgericht Jena HRB 202419\nSonstige Registerbekanntmachung\n\nStadtwerke Energie Jena- Pößneck GmbH\nGesellschaft mit beschränkter Haftung\nJena\n\nBekanntmachung gem. § 52 Abs. 3 Satz 2 GmbHG: Aufgrund einer Veränderung in den Personen der Aufsichtsratsmitglieder ist durch die Geschäftsführer eine neue Liste zum Handelsregister eingereicht worden."
    },
    {
      "date": "2024-10-25",
      "id": "91690",
      "original_text": "Sonstige Registerbekanntmachung\nThüringen Amtsgericht Gotha VR 141679\nTanz- und Kulturverein TSKFRC e. V. – Waltershausen",
      "type": "Sonstige Registerbekanntmachung",
      "state": "Thüringen",
      "amtsgericht": "Amtsgericht Gotha",
      "registernummer": "VR 141679",
      "registerart": "VR",
      "company_name": "Tanz- und Kulturverein TSKFRC e. V.",
      "company_seat": "Waltershausen",
      "details": "25.10.2024 (Bekanntmachungsdatum)\n\nThüringen Amtsgericht Gotha VR 141679\nSonstige Registerbekanntmachung 25.10.2024 (Eintragungsdatum)\n\nTanz- und Kulturverein TSKFRC e. V.\neingetragener Verein\nWaltershausen"
    },
    {
      "date": "2024-10-25",
      "id": "91691",
      "original_text": "Einreichung neuer Dokumente\nThüringen Amtsgericht Jena HRB 105415\nStadtwerke Arnstadt GmbH – Arnstadt",
      "type": "Einreichung neuer Dokumente",
      "state": "Thüringen",
      "amtsgericht": "Amtsgericht Jena",
      "registernummer": "HRB 105415",
      "registerart": "HRB",
      "company_name": "Stadtwerke Arnstadt GmbH",
      "company_seat": "Arnstadt",
      "details": "25.10.2024 (Bekanntmachungsdatum)\n\nThüringen Amtsgericht Jena HRB 105415\nEinreichung neuer Dokumente\n\nStadtwerke Arnstadt GmbH\nGesellschaft mit beschränkter Haftung\nArnstadt\n\nBekanntmachung gem. § 52 Abs. 3 Satz 2 GmbHG: Aufgrund einer Veränderung in den Personen der Aufsichtsratsmitglieder ist durch die Geschäftsführer eine neue Liste zum Handelsregister eingereicht worden."
    },
    {
      "date": "2024-10-25",
      "id": "91692",
      "original_text": "Registerbekanntmachung nach dem Umwandlungsgesetz\nThüringen Amtsgericht Jena HRB 110485\nGeratherm Medical GERMANY GmbH – Geratal",
      "type": "Registerbekanntmachung nach dem Umwandlungsgesetz",
      "state": "Thüringen",
      "amtsgericht": "Amtsgericht Jena",
      "registernummer": "HRB 110485",
      "registerart": "HRB",
      "company_name": "Geratherm Medical GERMANY GmbH",
      "company_seat": "Geratal",
      "details": "25.10.2024 (Bekanntmachungsdatum)\n\nThüringen Amtsgericht Jena HRB 110485\nRegisterbekanntmachung nach dem Umwandlungsgesetz 25.10.2024 (Eintragungsdatum)\n\nGeratherm Medical GERMANY GmbH\nGesellschaft mit beschränkter Haftung\nGeratal\n\nNicht eingetragen: Den Gläubigern der an der Ausgliederung beteiligten Rechtsträger, ist wenn sie binnen sechs Monaten nach dem Tag, an dem die Eintragung der Ausgliederung in das Register des Sitzes desjenigen Rechtsträgers, dessen Gläubiger sie sind, nach §§125, 19 Abs. 3 UmwG als bekanntgemacht gilt, ihren Anspruch nach Grund und Höhe schriftlich anmelden, Sicherheit zu leisten, soweit sie nicht Befriedigung verlangen können. Dieses Recht steht ihnen jedoch nur zu, wenn sie glaubhaft machen, daß durch die Ausgliederung die Erfüllung ihrer Forderung gefährdet wird."
    },
    {
      "date": "2024-10-25",
      "id": "91693",
      "original_text": "Sonstige Registerbekanntmachung\nBrandenburg Amtsgericht Potsdam HRB 27533\nLUMAX AG – Teltow",
      "type": "Sonstige Registerbekanntmachung",
      "state": "Brandenburg",
      "amtsgericht": "Amtsgericht Potsdam",
      "registernummer": "HRB 27533",
      "registerart": "HRB",
      "company_name": "LUMAX AG",
      "company_seat": "Teltow",
      "details": "25.10.2024 (Bekanntmachungsdatum)\n\nBrandenburg Amtsgericht Potsdam HRB 27533\nSonstige Registerbekanntmachung\n\nLUMAX AG\nRechtsform ausländischen Rechts HRB\nTeltow\n\nAls nicht eingetragen wird veröffentlicht: Der Beschluss vom 11.09.2024 über die Einleitung eines Amtslöschungsverfahrens der hier eingetragenen Zweigniederlassung wird gemäß § 31 Abs. 2 HGB nach nochmaliger Überprüfung mangels Vorliegens der Voraussetzungen aufgehoben."
    },
    {
      "date": "2024-10-25",
      "id": "91694",
      "original_text": "Einreichung neuer Dokumente\nBerlin Amtsgericht Berlin (Charlottenburg) HRB 45313\nBerliner Energieagentur Gesellschaft mit beschränkter Haftung – Berlin",
      "type": "Einreichung neuer Dokumente",
      "state": "Berlin",
      "amtsgericht": "Amtsgericht Berlin (Charlottenburg)",
      "registernummer": "HRB 45313",
      "registerart": "HRB",
      "company_name": "Berliner Energieagentur Gesellschaft mit beschränkter Haftung",
      "company_seat": "Berlin",
      "details": "25.10.2024 (Bekanntmachungsdatum)\n\nBerlin Amtsgericht Berlin (Charlottenburg) HRB 45313\nEinreichung neuer Dokumente\n\nBerliner Energieagentur Gesellschaft mit beschränkter Haftung\nGesellschaft mit beschränkter Haftung\nBerlin\n\nAls nicht eingetragen wird veröffentlicht:Es wurde eine neue Liste der Aufsichtsratsmitglieder eingereicht (§52 GmbHG)."
    },
    {
      "date": "2024-10-25",
      "id": "91695",
      "original_text": "Löschungsankündigung\nBrandenburg Amtsgericht Neuruppin HRB 10880\nBiogasfarm Projekt GmbH – Schwedt (Oder)",
      "type": "Löschungsankündigung",
      "state": "Brandenburg",
      "amtsgericht": "Amtsgericht Neuruppin",
      "registernummer": "HRB 10880",
      "registerart": "HRB",
      "company_name": "Biogasfarm Projekt GmbH",
      "company_seat": "Schwedt (Oder)",
      "details": "25.10.2024 (Bekanntmachungsdatum)\n\nBrandenburg Amtsgericht Neuruppin HRB 10880\nLöschungsankündigung\n\nBiogasfarm Projekt GmbH\nGesellschaft mit beschränkter Haftung\nSchwedt (Oder)\n\nBei der nachstehenden Gesellschaft wird das Amtslöschungsverfahren gemäß § 394 FamFG eingeleitet.\nWiderspruchsfrist: 1 Monat"
    },
    {
      "date": "2024-10-25",
      "id": "91696",
      "original_text": "Einreichung neuer Dokumente\nBaden-Württemberg Amtsgericht Ulm HRB 736765\nMVZ Ostalb Kliniken gGmbH – Aalen",
      "type": "Einreichung neuer Dokumente",
      "state": "Baden-Württemberg",
      "amtsgericht": "Amtsgericht Ulm",
      "registernummer": "HRB 736765",
      "registerart": "HRB",
      "company_name": "MVZ Ostalb Kliniken gGmbH",
      "company_seat": "Aalen",
      "details": "25.10.2024 (Bekanntmachungsdatum)\n\nBaden-Württemberg Amtsgericht Ulm HRB 736765\nEinreichung neuer Dokumente\n\nMVZ Ostalb Kliniken gGmbH\nGesellschaft mit beschränkter Haftung\nAalen\n\nDie Gesellschaft hat am 24.10.2024 die Liste über die Zusammensetzung des Aufsichtsrats zum Handelsregister eingereicht."
    },
    {
      "date": "2024-10-25",
      "id": "91697",
      "original_text": "Registerbekanntmachung nach dem Umwandlungsgesetz\nBaden-Württemberg Amtsgericht Freiburg HRB 630661\nFranke Deutschland Holding GmbH – Bad Säckingen",
      "type": "Registerbekanntmachung nach dem Umwandlungsgesetz",
      "state": "Baden-Württemberg",
      "amtsgericht": "Amtsgericht Freiburg",
      "registernummer": "HRB 630661",
      "registerart": "HRB",
      "company_name": "Franke Deutschland Holding GmbH",
      "company_seat": "Bad Säckingen",
      "details": "25.10.2024 (Bekanntmachungsdatum)\n\nBaden-Württemberg Amtsgericht Freiburg HRB 630661\nRegisterbekanntmachung nach dem Umwandlungsgesetz 25.10.2024 (Eintragungsdatum)\n\nFranke Deutschland Holding GmbH\nGesellschaft mit beschränkter Haftung\nBad Säckingen\n\nDie Gesellschaft hat einen Teil ihres Vermögens an die \"theway2solutions GmbH\" (Amtsgericht Potsdam, HRB 24133 P) übertragen. Den Gläubigern der an der Abspaltung beteiligten Rechtsträger ist, wenn sie binnen sechs Monaten nach dem Tag, an dem die Eintragung der Abspaltung in das Register des Sitzes desjenigen Rechtsträgers, dessen Gläubiger sie sind, nach § 19 Abs. 3 UmwG als bekanntgemacht gilt, ihren Anspruch nach Grund und Höhe schriftlich anmelden, Sicherheit zu leisten, soweit sie nicht Befriedigung verlangen können. Dieses Recht steht den Gläubigern jedoch nur zu, wenn sie glaubhaft machen, dass durch die Abspaltung die Erfüllung ihrer Forderung gefährdet wird."
    },
    {
      "date": "2024-10-25",
      "id": "91698",
      "original_text": "Löschungsankündigung\nSchleswig-Holstein Amtsgericht Lübeck HRB 5958\nEmion Interaktive Medien GmbH – Lübeck",
      "type": "Löschungsankündigung",
      "state": "Schleswig-Holstein",
      "amtsgericht": "Amtsgericht Lübeck",
      "registernummer": "HRB 5958",
      "registerart": "HRB",
      "company_name": "Emion Interaktive Medien GmbH",
      "company_seat": "Lübeck",
      "details": "25.10.2024 (Bekanntmachungsdatum)\n\nSchleswig-Holstein Amtsgericht Lübeck HRB 5958\nLöschungsankündigung\n\nEmion Interaktive Medien GmbH\nGesellschaft mit beschränkter Haftung\nLübeck\n\nEs ist die Löschung der nachstehenden Gesellschaft wegen Vermögenslosigkeit gemäß § 394 FamFG beabsichtigt.\nWiderspruchsfrist: 1 Monat."
    },
    {
      "date": "2024-10-25",
      "id": "91699",
      "original_text": "Registerbekanntmachung nach dem Umwandlungsgesetz\nBerlin Amtsgericht Berlin (Charlottenburg) HRA 63201\nJona-Meo Fiedler Verlagsdienstleistungen e.K. – Berlin",
      "type": "Registerbekanntmachung nach dem Umwandlungsgesetz",
      "state": "Berlin",
      "amtsgericht": "Amtsgericht Berlin (Charlottenburg)",
      "registernummer": "HRA 63201",
      "registerart": "HRA",
      "company_name": "Jona-Meo Fiedler Verlagsdienstleistungen e.K.",
      "company_seat": "Berlin",
      "details": "25.10.2024 (Bekanntmachungsdatum)\n\nBerlin Amtsgericht Berlin (Charlottenburg) HRA 63201\nRegisterbekanntmachung nach dem Umwandlungsgesetz 23.10.2024 (Eintragungsdatum)\n\nJona-Meo Fiedler Verlagsdienstleistungen e.K.\nEinzelkaufmann / Einzelkauffrau\nBerlin\n\nZu Eintragungsnummer 2 vom 23.10.2024 wird als nicht eingetragen veröffentlicht:Den Gläubigern der an der Spaltung beteiligten Rechtsträger ist, wenn sie binnen sechs Monaten nach dem Tag, an dem die Eintragung der Spaltung in das Register des Sitzes desjenigen Rechtsträgers, dessen Gläubiger sie sind, als bekannt gemacht gilt, ihren Anspruch nach Grund und Höhe schriftlich anmelden, Sicherheit zu leisten, soweit sie nicht Befriedigung verlangen können. Dieses Recht steht den Gläubigern jedoch nur zu, wenn sie glaubhaft machen, dass durch die Spaltung die Erfüllung ihrer Forderung gefährdet wird. Das Recht, Sicherheitsleistung zu verlangen, steht Gläubigern nicht zu, die im Falle der Insolvenz ein Recht auf vorzugsweise Befriedigung aus einer Deckungsmasse haben, die nach gesetzlicher Vorschrift zu ihrem Schutz errichtet und staatlich überwacht ist."
    },
    {
      "date": "2024-10-25",
      "id": "91700",
      "original_text": "Registerbekanntmachung nach dem Umwandlungsgesetz\nBaden-Württemberg Amtsgericht Mannheim HRB 713568\nALEX & GROSS Digital GmbH – Mannheim",
      "type": "Registerbekanntmachung nach dem Umwandlungsgesetz",
      "state": "Baden-Württemberg",
      "amtsgericht": "Amtsgericht Mannheim",
      "registernummer": "HRB 713568",
      "registerart": "HRB",
      "company_name": "ALEX & GROSS Digital GmbH",
      "company_seat": "Mannheim",
      "details": "25.10.2024 (Bekanntmachungsdatum)\n\nBaden-Württemberg Amtsgericht Mannheim HRB 713568\nRegisterbekanntmachung nach dem Umwandlungsgesetz 25.10.2024 (Eintragungsdatum)\n\nALEX & GROSS Digital GmbH\nGesellschaft mit beschränkter Haftung\nMannheim\n\nAls nicht eingetragen wird bekanntgemacht: Den Gläubigern der an der Verschmelzung beteiligten Rechtsträger ist, wenn sie binnen sechs Monaten nach dem Tag, an dem die Eintragung der Verschmelzung in das Register des Sitzes desjenigen Rechtsträgers, dessen Gläubiger sie sind, nach § 19 Abs. 3 UmwG als bekanntgemacht gilt, ihren Anspruch nach Grund und Höhe schriftlich anmelden, Sicherheit zu leisten, soweit sie nicht Befriedigung verlangen können. Dieses Recht steht den Gläubigern jedoch nur zu, wenn sie glaubhaft machen, dass durch die Verschmelzung die Erfüllung ihrer Forderung gefährdet wird."
    },
    {
      "date": "2024-10-25",
      "id": "91701",
      "original_text": "Registerbekanntmachung nach dem Umwandlungsgesetz\nBerlin Amtsgericht Berlin (Charlottenburg) HRB 210619\nBelle Époque Beteiligung GmbH – Berlin",
      "type": "Registerbekanntmachung nach dem Umwandlungsgesetz",
      "state": "Berlin",
      "amtsgericht": "Amtsgericht Berlin (Charlottenburg)",
      "registernummer": "HRB 210619",
      "registerart": "HRB",
      "company_name": "Belle Époque Beteiligung GmbH",
      "company_seat": "Berlin",
      "details": "25.10.2024 (Bekanntmachungsdatum)\n\nBerlin Amtsgericht Berlin (Charlottenburg) HRB 210619\nRegisterbekanntmachung nach dem Umwandlungsgesetz 25.10.2024 (Eintragungsdatum)\n\nBelle Époque Beteiligung GmbH\nGesellschaft mit beschränkter Haftung\nBerlin\n\nZu Eintragungsnummer 6 vom 25.10.2024 wird als nicht eingetragen veröffentlicht: Den Gläubigern der an der Verschmelzung beteiligten Rechtsträger ist, wenn sie binnen sechs Monaten nach dem Tag, an dem die Eintragung der Verschmelzung in das Register des Sitzes desjenigen Rechtsträgers, dessen Gläubiger sie sind, als bekannt gemacht gilt, ihren Anspruch nach Grund und Höhe schriftlich anmelden, Sicherheit zu leisten, soweit sie nicht Befriedigung verlangen können. Dieses Recht steht den Gläubigern jedoch nur zu, wenn sie glaubhaft machen, dass durch die Verschmelzung die Erfüllung ihrer Forderung gefährdet wird. Das Recht, Sicherheitsleistung zu verlangen, steht Gläubigern nicht zu, die im Falle der Insolvenz ein Recht auf vorzugsweise Befriedigung aus einer Deckungsmasse haben, die nach gesetzlicher Vorschrift zu ihrem Schutz errichtet und staatlich überwacht ist."
    },
    {
      "date": "2024-10-25",
      "id": "91702",
      "original_text": "Registerbekanntmachung nach dem Umwandlungsgesetz\nBerlin Amtsgericht Berlin (Charlottenburg) HRB 248125\nBE V02 UG (haftungsbeschränkt) – Berlin",
      "type": "Registerbekanntmachung nach dem Umwandlungsgesetz",
      "state": "Berlin",
      "amtsgericht": "Amtsgericht Berlin (Charlottenburg)",
      "registernummer": "HRB 248125",
      "registerart": "HRB",
      "company_name": "BE V02 UG (haftungsbeschränkt)",
      "company_seat": "Berlin",
      "details": "25.10.2024 (Bekanntmachungsdatum)\n\nBerlin Amtsgericht Berlin (Charlottenburg) HRB 248125\nRegisterbekanntmachung nach dem Umwandlungsgesetz 25.10.2024 (Eintragungsdatum)\n\nBE V02 UG (haftungsbeschränkt)\nGesellschaft mit beschränkter Haftung\nBerlin\n\nZu Eintragungsnummer 2 vom 25.10.2024 wird als nicht eingetragen veröffentlicht: Den Gläubigern der an der Verschmelzung beteiligten Rechtsträger ist, wenn sie binnen sechs Monaten nach dem Tag, an dem die Eintragung der Verschmelzung in das Register des Sitzes desjenigen Rechtsträgers, dessen Gläubiger sie sind, als bekannt gemacht gilt, ihren Anspruch nach Grund und Höhe schriftlich anmelden, Sicherheit zu leisten, soweit sie nicht Befriedigung verlangen können. Dieses Recht steht den Gläubigern jedoch nur zu, wenn sie glaubhaft machen, dass durch die Verschmelzung die Erfüllung ihrer Forderung gefährdet wird. Das Recht, Sicherheitsleistung zu verlangen, steht Gläubigern nicht zu, die im Falle der Insolvenz ein Recht auf vorzugsweise Befriedigung aus einer Deckungsmasse haben, die nach gesetzlicher Vorschrift zu ihrem Schutz errichtet und staatlich überwacht ist."
    },
    {
      "date": "2024-10-25",
      "id": "91703",
      "original_text": "Registerbekanntmachung nach dem Umwandlungsgesetz\nBerlin Amtsgericht Berlin (Charlottenburg) HRB 248069\nBE V03 UG (haftungsbeschränkt) – Berlin",
      "type": "Registerbekanntmachung nach dem Umwandlungsgesetz",
      "state": "Berlin",
      "amtsgericht": "Amtsgericht Berlin (Charlottenburg)",
      "registernummer": "HRB 248069",
      "registerart": "HRB",
      "company_name": "BE V03 UG (haftungsbeschränkt)",
      "company_seat": "Berlin",
      "details": "25.10.2024 (Bekanntmachungsdatum)\n\nBerlin Amtsgericht Berlin (Charlottenburg) HRB 248069\nRegisterbekanntmachung nach dem Umwandlungsgesetz 25.10.2024 (Eintragungsdatum)\n\nBE V03 UG (haftungsbeschränkt)\nGesellschaft mit beschränkter Haftung\nBerlin\n\nZu Eintragungsnummer 2 vom 25.10.2024 wird als nicht eingetragen veröffentlicht: Den Gläubigern der an der Verschmelzung beteiligten Rechtsträger ist, wenn sie binnen sechs Monaten nach dem Tag, an dem die Eintragung der Verschmelzung in das Register des Sitzes desjenigen Rechtsträgers, dessen Gläubiger sie sind, als bekannt gemacht gilt, ihren Anspruch nach Grund und Höhe schriftlich anmelden, Sicherheit zu leisten, soweit sie nicht Befriedigung verlangen können. Dieses Recht steht den Gläubigern jedoch nur zu, wenn sie glaubhaft machen, dass durch die Verschmelzung die Erfüllung ihrer Forderung gefährdet wird. Das Recht, Sicherheitsleistung zu verlangen, steht Gläubigern nicht zu, die im Falle der Insolvenz ein Recht auf vorzugsweise Befriedigung aus einer Deckungsmasse haben, die nach gesetzlicher Vorschrift zu ihrem Schutz errichtet und staatlich überwacht ist."
    },
    {
      "date": "2024-10-25",
      "id": "91704",
      "original_text": "Registerbekanntmachung nach dem Umwandlungsgesetz\nBerlin Amtsgericht Berlin (Charlottenburg) HRB 247549\nBE V04 UG (haftungsbeschränkt) – Berlin",
      "type": "Registerbekanntmachung nach dem Umwandlungsgesetz",
      "state": "Berlin",
      "amtsgericht": "Amtsgericht Berlin (Charlottenburg)",
      "registernummer": "HRB 247549",
      "registerart": "HRB",
      "company_name": "BE V04 UG (haftungsbeschränkt)",
      "company_seat": "Berlin",
      "details": "25.10.2024 (Bekanntmachungsdatum)\n\nBerlin Amtsgericht Berlin (Charlottenburg) HRB 247549\nRegisterbekanntmachung nach dem Umwandlungsgesetz 25.10.2024 (Eintragungsdatum)\n\nBE V04 UG (haftungsbeschränkt)\nGesellschaft mit beschränkter Haftung\nBerlin\n\nZu Eintragungsnummer 2 vom 25.10.2024 wird als nicht eingetragen veröffentlicht: Den Gläubigern der an der Verschmelzung beteiligten Rechtsträger ist, wenn sie binnen sechs Monaten nach dem Tag, an dem die Eintragung der Verschmelzung in das Register des Sitzes desjenigen Rechtsträgers, dessen Gläubiger sie sind, als bekannt gemacht gilt, ihren Anspruch nach Grund und Höhe schriftlich anmelden, Sicherheit zu leisten, soweit sie nicht Befriedigung verlangen können. Dieses Recht steht den Gläubigern jedoch nur zu, wenn sie glaubhaft machen, dass durch die Verschmelzung die Erfüllung ihrer Forderung gefährdet wird. Das Recht, Sicherheitsleistung zu verlangen, steht Gläubigern nicht zu, die im Falle der Insolvenz ein Recht auf vorzugsweise Befriedigung aus einer Deckungsmasse haben, die nach gesetzlicher Vorschrift zu ihrem Schutz errichtet und staatlich überwacht ist."
    },
    {
      "date": "2024-10-25",
      "id": "91705",
      "original_text": "Löschungsankündigung\nBerlin Amtsgericht Berlin (Charlottenburg) HRB 175906\nATT CONCEPT GmbH – Berlin",
      "type": "Löschungsankündigung",
      "state": "Berlin",
      "amtsgericht": "Amtsgericht Berlin (Charlottenburg)",
      "registernummer": "HRB 175906",
      "registerart": "HRB",
      "company_name": "ATT CONCEPT GmbH",
      "company_seat": "Berlin",
      "details": "25.10.2024 (Bekanntmachungsdatum)\n\nBerlin Amtsgericht Berlin (Charlottenburg) HRB 175906\nLöschungsankündigung\n\nATT CONCEPT GmbH\nGesellschaft mit beschränkter Haftung\nBerlin\n\nBei der nachstehenden Gesellschaft wird das Amtslöschungsverfahren gemäß § 394 FamFG eingeleitet. Widerspruchsfrist 6 Wochen"
    },
    {
      "date": "2024-10-25",
      "id": "91706",
      "original_text": "Registerbekanntmachung nach dem Umwandlungsgesetz\nBerlin Amtsgericht Berlin (Charlottenburg) HRB 247440\nBE V05 UG (haftungsbeschränkt) – Berlin",
      "type": "Registerbekanntmachung nach dem Umwandlungsgesetz",
      "state": "Berlin",
      "amtsgericht": "Amtsgericht Berlin (Charlottenburg)",
      "registernummer": "HRB 247440",
      "registerart": "HRB",
      "company_name": "BE V05 UG (haftungsbeschränkt)",
      "company_seat": "Berlin",
      "details": "25.10.2024 (Bekanntmachungsdatum)\n\nBerlin Amtsgericht Berlin (Charlottenburg) HRB 247440\nRegisterbekanntmachung nach dem Umwandlungsgesetz 25.10.2024 (Eintragungsdatum)\n\nBE V05 UG (haftungsbeschränkt)\nGesellschaft mit beschränkter Haftung\nBerlin\n\nZu Eintragungsnummer 2 vom 25.10.2024 wird als nicht eingetragen veröffentlicht: Den Gläubigern der an der Verschmelzung beteiligten Rechtsträger ist, wenn sie binnen sechs Monaten nach dem Tag, an dem die Eintragung der Verschmelzung in das Register des Sitzes desjenigen Rechtsträgers, dessen Gläubiger sie sind, als bekannt gemacht gilt, ihren Anspruch nach Grund und Höhe schriftlich anmelden, Sicherheit zu leisten, soweit sie nicht Befriedigung verlangen können. Dieses Recht steht den Gläubigern jedoch nur zu, wenn sie glaubhaft machen, dass durch die Verschmelzung die Erfüllung ihrer Forderung gefährdet wird. Das Recht, Sicherheitsleistung zu verlangen, steht Gläubigern nicht zu, die im Falle der Insolvenz ein Recht auf vorzugsweise Befriedigung aus einer Deckungsmasse haben, die nach gesetzlicher Vorschrift zu ihrem Schutz errichtet und staatlich überwacht ist."
    },
    {
      "date": "2024-10-25",
      "id": "91707",
      "original_text": "Registerbekanntmachung nach dem Umwandlungsgesetz\nBerlin Amtsgericht Berlin (Charlottenburg) HRB 210835\nBelle Époque WerkBund BER I GmbH – Berlin",
      "type": "Registerbekanntmachung nach dem Umwandlungsgesetz",
      "state": "Berlin",
      "amtsgericht": "Amtsgericht Berlin (Charlottenburg)",
      "registernummer": "HRB 210835",
      "registerart": "HRB",
      "company_name": "Belle Époque WerkBund BER I GmbH",
      "company_seat": "Berlin",
      "details": "25.10.2024 (Bekanntmachungsdatum)\n\nBerlin Amtsgericht Berlin (Charlottenburg) HRB 210835\nRegisterbekanntmachung nach dem Umwandlungsgesetz 25.10.2024 (Eintragungsdatum)\n\nBelle Époque WerkBund BER I GmbH\nGesellschaft mit beschränkter Haftung\nBerlin\n\nZu Eintragungsnummer 2 vom 25.10.2024 wird als nicht eingetragen veröffentlicht: Den Gläubigern der an der Verschmelzung beteiligten Rechtsträger ist, wenn sie binnen sechs Monaten nach dem Tag, an dem die Eintragung der Verschmelzung in das Register des Sitzes desjenigen Rechtsträgers, dessen Gläubiger sie sind, als bekannt gemacht gilt, ihren Anspruch nach Grund und Höhe schriftlich anmelden, Sicherheit zu leisten, soweit sie nicht Befriedigung verlangen können. Dieses Recht steht den Gläubigern jedoch nur zu, wenn sie glaubhaft machen, dass durch die Verschmelzung die Erfüllung ihrer Forderung gefährdet wird. Das Recht, Sicherheitsleistung zu verlangen, steht Gläubigern nicht zu, die im Falle der Insolvenz ein Recht auf vorzugsweise Befriedigung aus einer Deckungsmasse haben, die nach gesetzlicher Vorschrift zu ihrem Schutz errichtet und staatlich überwacht ist."
    },
    {
      "date": "2024-10-25",
      "id": "91708",
      "original_text": "Registerbekanntmachung nach dem Umwandlungsgesetz\nBerlin Amtsgericht Berlin (Charlottenburg) HRB 210615\nBelle Époque WerkBund BER II GmbH – Berlin",
      "type": "Registerbekanntmachung nach dem Umwandlungsgesetz",
      "state": "Berlin",
      "amtsgericht": "Amtsgericht Berlin (Charlottenburg)",
      "registernummer": "HRB 210615",
      "registerart": "HRB",
      "company_name": "Belle Époque WerkBund BER II GmbH",
      "company_seat": "Berlin",
      "details": "25.10.2024 (Bekanntmachungsdatum)\n\nBerlin Amtsgericht Berlin (Charlottenburg) HRB 210615\nRegisterbekanntmachung nach dem Umwandlungsgesetz 25.10.2024 (Eintragungsdatum)\n\nBelle Époque WerkBund BER II GmbH\nGesellschaft mit beschränkter Haftung\nBerlin\n\nZu Eintragungsnummer 2 vom 25.10.2024 wird als nicht eingetragen veröffentlicht: Den Gläubigern der an der Verschmelzung beteiligten Rechtsträger ist, wenn sie binnen sechs Monaten nach dem Tag, an dem die Eintragung der Verschmelzung in das Register des Sitzes desjenigen Rechtsträgers, dessen Gläubiger sie sind, als bekannt gemacht gilt, ihren Anspruch nach Grund und Höhe schriftlich anmelden, Sicherheit zu leisten, soweit sie nicht Befriedigung verlangen können. Dieses Recht steht den Gläubigern jedoch nur zu, wenn sie glaubhaft machen, dass durch die Verschmelzung die Erfüllung ihrer Forderung gefährdet wird. Das Recht, Sicherheitsleistung zu verlangen, steht Gläubigern nicht zu, die im Falle der Insolvenz ein Recht auf vorzugsweise Befriedigung aus einer Deckungsmasse haben, die nach gesetzlicher Vorschrift zu ihrem Schutz errichtet und staatlich überwacht ist."
    },
    {
      "date": "2024-10-25",
      "id": "91709",
      "original_text": "Registerbekanntmachung nach dem Umwandlungsgesetz\nBerlin Amtsgericht Berlin (Charlottenburg) HRB 210626\nBelle Époque WerkBund Berlin Eastside GmbH – Berlin",
      "type": "Registerbekanntmachung nach dem Umwandlungsgesetz",
      "state": "Berlin",
      "amtsgericht": "Amtsgericht Berlin (Charlottenburg)",
      "registernummer": "HRB 210626",
      "registerart": "HRB",
      "company_name": "Belle Époque WerkBund Berlin Eastside GmbH",
      "company_seat": "Berlin",
      "details": "25.10.2024 (Bekanntmachungsdatum)\n\nBerlin Amtsgericht Berlin (Charlottenburg) HRB 210626\nRegisterbekanntmachung nach dem Umwandlungsgesetz 25.10.2024 (Eintragungsdatum)\n\nBelle Époque WerkBund Berlin Eastside GmbH\nGesellschaft mit beschränkter Haftung\nBerlin\n\nZu Eintragungsnummer 2 vom 25.10.2024 wird als nicht eingetragen veröffentlicht: Den Gläubigern der an der Verschmelzung beteiligten Rechtsträger ist, wenn sie binnen sechs Monaten nach dem Tag, an dem die Eintragung der Verschmelzung in das Register des Sitzes desjenigen Rechtsträgers, dessen Gläubiger sie sind, als bekannt gemacht gilt, ihren Anspruch nach Grund und Höhe schriftlich anmelden, Sicherheit zu leisten, soweit sie nicht Befriedigung verlangen können. Dieses Recht steht den Gläubigern jedoch nur zu, wenn sie glaubhaft machen, dass durch die Verschmelzung die Erfüllung ihrer Forderung gefährdet wird. Das Recht, Sicherheitsleistung zu verlangen, steht Gläubigern nicht zu, die im Falle der Insolvenz ein Recht auf vorzugsweise Befriedigung aus einer Deckungsmasse haben, die nach gesetzlicher Vorschrift zu ihrem Schutz errichtet und staatlich überwacht ist."
    },
    {
      "date": "2024-10-25",
      "id": "91710",
      "original_text": "Einreichung neuer Dokumente\nBerlin Amtsgericht Berlin (Charlottenburg) HRB 89951\nBEHALA - Berliner Hafen- und Lagerhausgesellschaft mbH – Berlin",
      "type": "Einreichung neuer Dokumente",
      "state": "Berlin",
      "amtsgericht": "Amtsgericht Berlin (Charlottenburg)",
      "registernummer": "HRB 89951",
      "registerart": "HRB",
      "company_name": "BEHALA - Berliner Hafen- und Lagerhausgesellschaft mbH",
      "company_seat": "Berlin",
      "details": "25.10.2024 (Bekanntmachungsdatum)\n\nBerlin Amtsgericht Berlin (Charlottenburg) HRB 89951\nEinreichung neuer Dokumente\n\nBEHALA - Berliner Hafen- und Lagerhausgesellschaft mbH\nGesellschaft mit beschränkter Haftung\nBerlin\n\nAls nicht eingetragen wird veröffentlicht:Es wurde eine neue Liste der Aufsichtsratsmitglieder eingereicht (§52 GmbHG)."
    },
    {
      "date": "2024-10-25",
      "id": "91711",
      "original_text": "Registerbekanntmachung nach dem Umwandlungsgesetz\nHamburg Amtsgericht Hamburg HRA 130242\nSWV Versicherungsmakler GmbH & Co. KG – Hamburg",
      "type": "Registerbekanntmachung nach dem Umwandlungsgesetz",
      "state": "Hamburg",
      "amtsgericht": "Amtsgericht Hamburg",
      "registernummer": "HRA 130242",
      "registerart": "HRA",
      "company_name": "SWV Versicherungsmakler GmbH & Co. KG",
      "company_seat": "Hamburg",
      "details": "25.10.2024 (Bekanntmachungsdatum)\n\nHamburg Amtsgericht Hamburg HRA 130242\nRegisterbekanntmachung nach dem Umwandlungsgesetz 25.10.2024 (Eintragungsdatum)\n\nSWV Versicherungsmakler GmbH & Co. KG\nKommanditgesellschaft\nHamburg\n\nAls nicht eingetragen wird bekannt gemacht:\nDen Gläubigern der an der Verschmelzung beteiligten Gesellschaften ist, wenn sie binnen sechs Monaten nach dem Tag, an dem die Eintragung der Verschmelzung in das Register des Sitzes desjenigen Rechtsträgers, dessen Gläubiger sie sind, nach § 19 Absatz 3 UmwG als bekannt gemacht gilt, ihren Anspruch nach Grund und Höhe schriftlich anmelden, Sicherheit zu leisten, soweit sie nicht Befriedigung verlangen können. Dieses Recht steht den Gläubigern jedoch nur zu, wenn sie glaubhaft machen, dass durch die Verschmelzung die Erfüllung ihrer Forderung gefährdet wird."
    },
    {
      "date": "2024-10-25",
      "id": "91712",
      "original_text": "Registerbekanntmachung nach dem Umwandlungsgesetz\nHamburg Amtsgericht Hamburg HRA 99173\nNutzinger Zucker GmbH & Co. KG - Assekuranzmakler – Hamburg",
      "type": "Registerbekanntmachung nach dem Umwandlungsgesetz",
      "state": "Hamburg",
      "amtsgericht": "Amtsgericht Hamburg",
      "registernummer": "HRA 99173",
      "registerart": "HRA",
      "company_name": "Nutzinger Zucker GmbH & Co. KG - Assekuranzmakler",
      "company_seat": "Hamburg",
      "details": "25.10.2024 (Bekanntmachungsdatum)\n\nHamburg Amtsgericht Hamburg HRA 99173\nRegisterbekanntmachung nach dem Umwandlungsgesetz 25.10.2024 (Eintragungsdatum)\n\nNutzinger Zucker GmbH & Co. KG - Assekuranzmakler\nKommanditgesellschaft\nHamburg\n\nAls nicht eingetragen wird bekannt gemacht:\nDen Gläubigern der an der Verschmelzung beteiligten Gesellschaften ist, wenn sie binnen sechs Monaten nach dem Tag, an dem die Eintragung der Verschmelzung in das Register des Sitzes desjenigen Rechtsträgers, dessen Gläubiger sie sind, nach § 19 Absatz 3 UmwG als bekannt gemacht gilt, ihren Anspruch nach Grund und Höhe schriftlich anmelden, Sicherheit zu leisten, soweit sie nicht Befriedigung verlangen können. Dieses Recht steht den Gläubigern jedoch nur zu, wenn sie glaubhaft machen, dass durch die Verschmelzung die Erfüllung ihrer Forderung gefährdet wird."
    },
    {
      "date": "2024-10-25",
      "id": "91713",
      "original_text": "Löschungsankündigung\nBrandenburg Amtsgericht Frankfurt/Oder HRB 13630\nM & M Logo GmbH – Wandlitz",
      "type": "Löschungsankündigung",
      "state": "Brandenburg",
      "amtsgericht": "Amtsgericht Frankfurt/Oder",
      "registernummer": "HRB 13630",
      "registerart": "HRB",
      "company_name": "M & M Logo GmbH",
      "company_seat": "Wandlitz",
      "details": "25.10.2024 (Bekanntmachungsdatum)\n\nBrandenburg Amtsgericht Frankfurt/Oder HRB 13630\nLöschungsankündigung\n\nM & M Logo GmbH\nGesellschaft mit beschränkter Haftung\nWandlitz\n\nBei der nachstehenden Gesellschaft wird das Amtslöschungsverfahren gemäß § 394 FamFG eingeleitet."
    },
    {
      "date": "2024-10-25",
      "id": "91714",
      "original_text": "Löschungsankündigung\nBrandenburg Amtsgericht Frankfurt/Oder HRB 19470\nBlitztransporte GmbH – Siehdichum",
      "type": "Löschungsankündigung",
      "state": "Brandenburg",
      "amtsgericht": "Amtsgericht Frankfurt/Oder",
      "registernummer": "HRB 19470",
      "registerart": "HRB",
      "company_name": "Blitztransporte GmbH",
      "company_seat": "Siehdichum",
      "details": "25.10.2024 (Bekanntmachungsdatum)\n\nBrandenburg Amtsgericht Frankfurt/Oder HRB 19470\nLöschungsankündigung\n\nBlitztransporte GmbH\nGesellschaft mit beschränkter Haftung\nSiehdichum\n\nBei der nachstehenden Gesellschaft wird das Amtslöschungsverfahren gemäß § 394 FamFG eingeleitet."
    },
    {
      "date": "2024-10-25",
      "id": "91715",
      "original_text": "Sonstige Registerbekanntmachung\nBrandenburg Amtsgericht Frankfurt/Oder HRB 17970\nBau-Tech Krug GmbH – Hoppegarten",
      "type": "Sonstige Registerbekanntmachung",
      "state": "Brandenburg",
      "amtsgericht": "Amtsgericht Frankfurt/Oder",
      "registernummer": "HRB 17970",
      "registerart": "HRB",
      "company_name": "Bau-Tech Krug GmbH",
      "company_seat": "Hoppegarten",
      "details": "25.10.2024 (Bekanntmachungsdatum)\n\nBrandenburg Amtsgericht Frankfurt/Oder HRB 17970\nSonstige Registerbekanntmachung 26.08.2024 (Eintragungsdatum)\n\nBau-Tech Krug GmbH\nGesellschaft mit beschränkter Haftung\nHoppegarten\n\nDie vermögenslose Gesellschaft ist auf Grund des § 394 FamFG von Amts wegen gelöscht."
    },
    {
      "date": "2024-10-25",
      "id": "91716",
      "original_text": "Einreichung neuer Dokumente\nSachsen Amtsgericht Dresden HRB 8224\nVerkehrsgesellschaft Hoyerswerda mbH – Hoyerswerda",
      "type": "Einreichung neuer Dokumente",
      "state": "Sachsen",
      "amtsgericht": "Amtsgericht Dresden",
      "registernummer": "HRB 8224",
      "registerart": "HRB",
      "company_name": "Verkehrsgesellschaft Hoyerswerda mbH",
      "company_seat": "Hoyerswerda",
      "details": "25.10.2024 (Bekanntmachungsdatum)\n\nSachsen Amtsgericht Dresden HRB 8224\nEinreichung neuer Dokumente\n\nVerkehrsgesellschaft Hoyerswerda mbH\nGesellschaft mit beschränkter Haftung\nHoyerswerda\n\nAm 24.10.2024 wurde beim Handelsregister des Amtsgerichts Dresden die Liste der Mitglieder des Aufsichtsrats gemäß § 52 GmbHG eingereicht."
    },
    {
      "date": "2024-10-25",
      "id": "91717",
      "original_text": "Registerbekanntmachung nach dem Umwandlungsgesetz\nSachsen Amtsgericht Chemnitz HRA 10020\nReifenwelt Ardian Berisha e.K. – Zwickau",
      "type": "Registerbekanntmachung nach dem Umwandlungsgesetz",
      "state": "Sachsen",
      "amtsgericht": "Amtsgericht Chemnitz",
      "registernummer": "HRA 10020",
      "registerart": "HRA",
      "company_name": "Reifenwelt Ardian Berisha e.K.",
      "company_seat": "Zwickau",
      "details": "25.10.2024 (Bekanntmachungsdatum)\n\nSachsen Amtsgericht Chemnitz HRA 10020\nRegisterbekanntmachung nach dem Umwandlungsgesetz 25.10.2024 (Eintragungsdatum)\n\nReifenwelt Ardian Berisha e.K.\nEinzelkaufmann / Einzelkauffrau\nZwickau\n\nDen Gläubigern der an der Ausgliederung beteiligten Rechtsträger ist, wenn sie binnen sechs Monaten nach dem Tag, an dem die Eintragung der Ausgliederung in das Register des Sitzes desjenigen Rechtsträgers, dessen Gläubiger sie sind, nach § 19 Abs. 3 UmwG als bekannt gemacht gilt, ihren Anspruch nach Grund und Höhe schriftlich anmelden, Sicherheit zu leisten, soweit sie nicht Befriedigung verlangen können. Dieses Recht steht den Gläubigern jedoch nur zu, wenn sie glaubhaft machen, dass durch die Ausgliederung die Erfüllung der Forderung gefährdet wird."
    },
    {
      "date": "2024-10-25",
      "id": "91718",
      "original_text": "Einreichung neuer Dokumente\nSachsen Amtsgericht Dresden HRB 7068\nStadtwerke Pirna GmbH – Pirna",
      "type": "Einreichung neuer Dokumente",
      "state": "Sachsen",
      "amtsgericht": "Amtsgericht Dresden",
      "registernummer": "HRB 7068",
      "registerart": "HRB",
      "company_name": "Stadtwerke Pirna GmbH",
      "company_seat": "Pirna",
      "details": "25.10.2024 (Bekanntmachungsdatum)\n\nSachsen Amtsgericht Dresden HRB 7068\nEinreichung neuer Dokumente 25.10.2024 (Eintragungsdatum)\n\nStadtwerke Pirna GmbH\nGesellschaft mit beschränkter Haftung\nPirna\n\nAm 24.10.2024 wurde beim Handelsregister des Amtsgerichts Dresden die Liste der Mitglieder des Aufsichtsrats gemäß § 52 GmbHG eingereicht."
    },
    {
      "date": "2024-10-25",
      "id": "91719",
      "original_text": "Einreichung neuer Dokumente\nSachsen Amtsgericht Dresden HRB 3402\nSWH Städtische Wirtschaftsbetriebe Hoyerswerda GmbH – Hoyerswerda",
      "type": "Einreichung neuer Dokumente",
      "state": "Sachsen",
      "amtsgericht": "Amtsgericht Dresden",
      "registernummer": "HRB 3402",
      "registerart": "HRB",
      "company_name": "SWH Städtische Wirtschaftsbetriebe Hoyerswerda GmbH",
      "company_seat": "Hoyerswerda",
      "details": "25.10.2024 (Bekanntmachungsdatum)\n\nSachsen Amtsgericht Dresden HRB 3402\nEinreichung neuer Dokumente\n\nSWH Städtische Wirtschaftsbetriebe Hoyerswerda GmbH\nGesellschaft mit beschränkter Haftung\nHoyerswerda\n\nAm 24.10.2024 wurde beim Handelsregister des Amtsgerichts Dresden die Liste der Mitglieder des Aufsichtsrats gemäß § 52 GmbHG eingereicht."
    },
    {
      "date": "2024-10-25",
      "id": "91720",
      "original_text": "Registerbekanntmachung nach dem Umwandlungsgesetz\nNiedersachsen Amtsgericht Osnabrück GsR 567\nN&P Elektrotechnik eGbR – Lingen (Ems)",
      "type": "Registerbekanntmachung nach dem Umwandlungsgesetz",
      "state": "Niedersachsen",
      "amtsgericht": "Amtsgericht Osnabrück",
      "registernummer": "GsR 567",
      "registerart": "GsR",
      "company_name": "N&P Elektrotechnik eGbR",
      "company_seat": "Lingen (Ems)",
      "details": "25.10.2024 (Bekanntmachungsdatum)\n\nNiedersachsen Amtsgericht Osnabrück GsR 567\nRegisterbekanntmachung nach dem Umwandlungsgesetz 25.10.2024 (Eintragungsdatum)\n\nN&P Elektrotechnik eGbR\nGesellschaft bürgerlichen Rechts\nLingen (Ems)\n\nDen Gläubigern der an der formwechselnden Umwandlung beteiligten Rechtsträger ist, wenn sie binnen sechs Monaten nach dem Tag, an dem die Eintragung der Umwandlung in das Register des Sitzes desjenigen Rechtsträgers, dessen Gläubiger sie sind, nach § 19 Abs. 3 UmwG als bekannt gemacht gilt, ihren Anspruch nach Grund und Höhe schriftlich anmelden, Sicherheit zu leisten, soweit sie nicht Befriedigung verlangen können. Dieses Recht steht den Gläubigern jedoch nur zu, wenn sie glaubhaft machen, dass durch die formwechselnde Umwandlung die Erfüllung der Forderung gefährdet wird."
    },
    {
      "date": "2024-10-25",
      "id": "91721",
      "original_text": "Sonstige Registerbekanntmachung\nNiedersachsen Amtsgericht Hildesheim HRB 201273\nVAMED Rehazentrum Hildesheim GmbH – Hildesheim",
      "type": "Sonstige Registerbekanntmachung",
      "state": "Niedersachsen",
      "amtsgericht": "Amtsgericht Hildesheim",
      "registernummer": "HRB 201273",
      "registerart": "HRB",
      "company_name": "VAMED Rehazentrum Hildesheim GmbH",
      "company_seat": "Hildesheim",
      "details": "25.10.2024 (Bekanntmachungsdatum)\n\nNiedersachsen Amtsgericht Hildesheim HRB 201273\nSonstige Registerbekanntmachung 25.10.2024 (Eintragungsdatum)\n\nVAMED Rehazentrum Hildesheim GmbH\nGesellschaft mit beschränkter Haftung\nHildesheim\n\nDen Gläubigern der Gesellschaft , deren Forderungen begründet worden sind,bevor die Eintragung der Beendigung des Vertrages in das Handelsregister nach §10 HGB als bekanntgemacht gilt, hat der andere Vertragsteil Sicherheit zu leisten, wenn sie sich binnen sechs Monaten nach der Bekanntmachung der Eintragung zu diesem Zweck bei ihm melden. Der Gewinnabführungsvertrag vom 21.09.2020 der VAMED Rehazentren Deutschland GmbH, Damp, ist durch Kündigung zum Ablauf des 30.09.2024 beendet."
    },
    {
      "date": "2024-10-25",
      "id": "91722",
      "original_text": "Löschungsankündigung\nNiedersachsen Amtsgericht Oldenburg (Oldenburg) HRB 202714\nReWo UG (haftungsbeschränkt) – Wilhelmshaven",
      "type": "Löschungsankündigung",
      "state": "Niedersachsen",
      "amtsgericht": "Amtsgericht Oldenburg (Oldenburg)",
      "registernummer": "HRB 202714",
      "registerart": "HRB",
      "company_name": "ReWo UG (haftungsbeschränkt)",
      "company_seat": "Wilhelmshaven",
      "details": "25.10.2024 (Bekanntmachungsdatum)\n\nNiedersachsen Amtsgericht Oldenburg (Oldenburg) HRB 202714\nLöschungsankündigung\n\nReWo UG (haftungsbeschränkt)\nGesellschaft mit beschränkter Haftung\nWilhelmshaven\n\nDas Registergericht beabsichtigt, die Gesellschaft von Amts wegen nach § 394 FamFG zu löschen. Die Frist zur Erhebung eines Widerspruchs ist auf 1 Monat ab dieser Registerbekanntmachung festgesetzt."
    },
    {
      "date": "2024-10-25",
      "id": "91723",
      "original_text": "Einreichung neuer Dokumente\nNiedersachsen Amtsgericht Hannover HRB 4925\nNiedersächsische Staatstheater Hannover Gesellschaft mit beschränkter Haftung – Hannover",
      "type": "Einreichung neuer Dokumente",
      "state": "Niedersachsen",
      "amtsgericht": "Amtsgericht Hannover",
      "registernummer": "HRB 4925",
      "registerart": "HRB",
      "company_name": "Niedersächsische Staatstheater Hannover Gesellschaft mit beschränkter Haftung",
      "company_seat": "Hannover",
      "details": "25.10.2024 (Bekanntmachungsdatum)\n\nNiedersachsen Amtsgericht Hannover HRB 4925\nEinreichung neuer Dokumente\n\nNiedersächsische Staatstheater Hannover Gesellschaft mit beschränkter Haftung\nGesellschaft mit beschränkter Haftung\nHannover\n\nDie Liste der Mitglieder des Aufsichtsrats wurde beim Registergericht eingereicht."
    },
    {
      "date": "2024-10-25",
      "id": "91724",
      "original_text": "Registerbekanntmachung nach dem Umwandlungsgesetz\nNiedersachsen Amtsgericht Tostedt HRA 205331\nAndré Freudenberg Bauunternehmen e.K. – Beckdorf",
      "type": "Registerbekanntmachung nach dem Umwandlungsgesetz",
      "state": "Niedersachsen",
      "amtsgericht": "Amtsgericht Tostedt",
      "registernummer": "HRA 205331",
      "registerart": "HRA",
      "company_name": "André Freudenberg Bauunternehmen e.K.",
      "company_seat": "Beckdorf",
      "details": "25.10.2024 (Bekanntmachungsdatum)\n\nNiedersachsen Amtsgericht Tostedt HRA 205331\nRegisterbekanntmachung nach dem Umwandlungsgesetz 25.10.2024 (Eintragungsdatum)\n\nAndré Freudenberg Bauunternehmen e.K.\nEinzelkaufmann / Einzelkauffrau\nBeckdorf\n\nDen Gläubigern der an der Ausgliederung beteiligten Rechtsträger ist, wenn sie binnen sechs Monaten nach dem Tag, an dem die Eintragung der Ausgliederung in das Register des Sitzes desjenigen Rechtsträgers, dessen Gläubiger sie sind, nach § 19 Abs. 3 UmwG als bekannt gemacht gilt, ihren Anspruch nach Grund und Höhe schriftlich anmelden, Sicherheit zu leisten, soweit sie nicht Befriedigung verlangen können. Dieses Recht steht den Gläubigern jedoch nur zu, wenn sie glaubhaft machen, dass durch die Ausgliederung die Erfüllung der Forderung gefährdet wird."
    },
    {
      "date": "2024-10-25",
      "id": "91725",
      "original_text": "Sonstige Registerbekanntmachung\nNiedersachsen Amtsgericht Hildesheim HRB 202201\nVAMED Rehaklinik Bad Salzdetfurth GmbH – Bad Salzdetfurth",
      "type": "Sonstige Registerbekanntmachung",
      "state": "Niedersachsen",
      "amtsgericht": "Amtsgericht Hildesheim",
      "registernummer": "HRB 202201",
      "registerart": "HRB",
      "company_name": "VAMED Rehaklinik Bad Salzdetfurth GmbH",
      "company_seat": "Bad Salzdetfurth",
      "details": "25.10.2024 (Bekanntmachungsdatum)\n\nNiedersachsen Amtsgericht Hildesheim HRB 202201\nSonstige Registerbekanntmachung 25.10.2024 (Eintragungsdatum)\n\nVAMED Rehaklinik Bad Salzdetfurth GmbH\nGesellschaft mit beschränkter Haftung\nBad Salzdetfurth\n\nDen Gläubigern der Gesellschaft, deren Forderungen begründet worden sind, bevor die Eintragung der Beendigung des Vertrages in das Handelsregister nach § 10 HGB als bekanntgemacht gilt, ist vom anderen Vertragsteil Sicherheit zu leisten, wenn sie sich binnen sechs Monaten nach der Bekanntmachung zu diesem Zweck bei ihm melden.\nDer Ergebnisabführungsvertrag vom 02.03.2022 mit der VAMED Kliniken Deutschland GmbH,Damp, ist durch Kündigung mit Wirkung zum Ablauf des 30.09.2024 beendet."
    },
    {
      "date": "2024-10-25",
      "id": "91726",
      "original_text": "Registerbekanntmachung nach dem Umwandlungsgesetz\nNiedersachsen Amtsgericht Tostedt HRA 205413\nAndré Freudenberg Bauunternehmen GmbH & Co. KG – Beckdorf",
      "type": "Registerbekanntmachung nach dem Umwandlungsgesetz",
      "state": "Niedersachsen",
      "amtsgericht": "Amtsgericht Tostedt",
      "registernummer": "HRA 205413",
      "registerart": "HRA",
      "company_name": "André Freudenberg Bauunternehmen GmbH & Co. KG",
      "company_seat": "Beckdorf",
      "details": "25.10.2024 (Bekanntmachungsdatum)\n\nNiedersachsen Amtsgericht Tostedt HRA 205413\nRegisterbekanntmachung nach dem Umwandlungsgesetz 25.10.2024 (Eintragungsdatum)\n\nAndré Freudenberg Bauunternehmen GmbH & Co. KG\nKommanditgesellschaft\nBeckdorf\n\nDen Gläubigern der an der Ausgliederung beteiligten Rechtsträger ist, wenn sie binnen sechs Monaten nach dem Tag, an dem die Eintragung der Ausgliederung in das Register des Sitzes desjenigen Rechtsträgers, dessen Gläubiger sie sind, nach § 19 Abs. 3 UmwG als bekannt gemacht gilt, ihren Anspruch nach Grund und Höhe schriftlich anmelden, Sicherheit zu leisten, soweit sie nicht Befriedigung verlangen können. Dieses Recht steht den Gläubigern jedoch nur zu, wenn sie glaubhaft machen, dass durch die Ausgliederung die Erfüllung der Forderung gefährdet wird."
    },
    {
      "date": "2024-10-25",
      "id": "91727",
      "original_text": "Einreichung neuer Dokumente\nNiedersachsen Amtsgericht Braunschweig HRB 10019\nBraunschweiger Versorgungs-Verwaltungs-Aktiengesellschaft – Braunschweig",
      "type": "Einreichung neuer Dokumente",
      "state": "Niedersachsen",
      "amtsgericht": "Amtsgericht Braunschweig",
      "registernummer": "HRB 10019",
      "registerart": "HRB",
      "company_name": "Braunschweiger Versorgungs-Verwaltungs-Aktiengesellschaft",
      "company_seat": "Braunschweig",
      "details": "25.10.2024 (Bekanntmachungsdatum)\n\nNiedersachsen Amtsgericht Braunschweig HRB 10019\nEinreichung neuer Dokumente 25.10.2024 (Eintragungsdatum)\n\nBraunschweiger Versorgungs-Verwaltungs-Aktiengesellschaft\nAktiengesellschaft\nBraunschweig\n\nDie Liste der Mitglieder des Aufsichtsrats wurde beim Registergericht eingereicht."
    },
    {
      "date": "2024-10-25",
      "id": "91728",
      "original_text": "Löschungsankündigung\nNiedersachsen Amtsgericht Aurich HRB 204066\nAS Fahrzeughandel UG (haftungsbeschränkt) – Friedeburg/Wiesedemeer",
      "type": "Löschungsankündigung",
      "state": "Niedersachsen",
      "amtsgericht": "Amtsgericht Aurich",
      "registernummer": "HRB 204066",
      "registerart": "HRB",
      "company_name": "AS Fahrzeughandel UG (haftungsbeschränkt)",
      "company_seat": "Friedeburg/Wiesedemeer",
      "details": "25.10.2024 (Bekanntmachungsdatum)\n\nNiedersachsen Amtsgericht Aurich HRB 204066\nLöschungsankündigung 25.10.2024 (Eintragungsdatum)\n\nAS Fahrzeughandel UG (haftungsbeschränkt)\nGesellschaft mit beschränkter Haftung\nFriedeburg/Wiesedemeer\n\nDas Registergericht beabsichtigt, die Gesellschaft von Amts wegen nach § 394 FamFG zu löschen. Die Frist zur Erhebung eines Widerspruchs ist auf 1 Monat ab dieser Registerbekanntmachung festgesetzt."
    },
    {
      "date": "2024-10-25",
      "id": "91729",
      "original_text": "Löschungsankündigung\nBremen Amtsgericht Bremen HRB 26619\nBernhard Twietmeyer GmbH – Bremen",
      "type": "Löschungsankündigung",
      "state": "Bremen",
      "amtsgericht": "Amtsgericht Bremen",
      "registernummer": "HRB 26619",
      "registerart": "HRB",
      "company_name": "Bernhard Twietmeyer GmbH",
      "company_seat": "Bremen",
      "details": "25.10.2024 (Bekanntmachungsdatum)\n\nBremen Amtsgericht Bremen HRB 26619\nLöschungsankündigung\n\nBernhard Twietmeyer GmbH\nGesellschaft mit beschränkter Haftung\nBremen\n\nEs ist beabsichtigt die im Handelsregister eingetragene Gesellschaft von Amts wegen gemäß § 394 FamFG zu löschen. Gegen die Löschung kann beim AG Bremen schriftlich oder zu Protokoll der Geschäftsstelle Widerspruch eingelegt werden. Widerspruchsfrist 4 Wochen."
    },
    {
      "date": "2024-10-25",
      "id": "91730",
      "original_text": "Registerbekanntmachung nach dem Umwandlungsgesetz\nBremen Amtsgericht Bremen HRB 38236\nbregau ics GmbH (international consulting services) – Bremen",
      "type": "Registerbekanntmachung nach dem Umwandlungsgesetz",
      "state": "Bremen",
      "amtsgericht": "Amtsgericht Bremen",
      "registernummer": "HRB 38236",
      "registerart": "HRB",
      "company_name": "bregau ics GmbH (international consulting services)",
      "company_seat": "Bremen",
      "details": "25.10.2024 (Bekanntmachungsdatum)\n\nBremen Amtsgericht Bremen HRB 38236\nRegisterbekanntmachung nach dem Umwandlungsgesetz 24.10.2024 (Eintragungsdatum)\n\nbregau ics GmbH (international consulting services)\nGesellschaft mit beschränkter Haftung\nBremen\n\nZu Eintragungsnummer 2 vom 24.10.2024 wird als nicht eingetragen veröffentlicht:\nDen Gläubigern der an der Verschmelzung beteiligten Rechtsträger ist, wenn sie binnen sechs Monaten nach dem Tag, an dem die Eintragung der Verschmelzung in das Register des Sitzes desjenigen Rechtsträgers, dessen Gläubiger sie sind, als bekannt gemacht gilt, ihren Anspruch nach Grund und Höhe schriftlich anmelden, Sicherheit zu leisten, soweit sie nicht Befriedigung verlangen können. Dieses Recht steht den Gläubigern jedoch nur zu, wenn sie glaubhaft machen, dass durch die Verschmelzung die Erfüllung ihrer Forderung gefährdet wird. Das Recht, Sicherheitsleistung zu verlangen, steht Gläubigern nicht zu, die im Falle der Insolvenz ein Recht auf vorzugsweise Befriedigung aus einer Deckungsmasse haben, die nach gesetzlicher Vorschrift zu ihrem Schutz errichtet und staatlich überwacht ist."
    },
    {
      "date": "2024-10-25",
      "id": "91731",
      "original_text": "Registerbekanntmachung nach dem Umwandlungsgesetz\nRheinland-Pfalz Amtsgericht Koblenz HRB 30644\nChristliches Klinikum Paderborn gGmbH – Koblenz",
      "type": "Registerbekanntmachung nach dem Umwandlungsgesetz",
      "state": "Rheinland-Pfalz",
      "amtsgericht": "Amtsgericht Koblenz",
      "registernummer": "HRB 30644",
      "registerart": "HRB",
      "company_name": "Christliches Klinikum Paderborn gGmbH",
      "company_seat": "Koblenz",
      "details": "25.10.2024 (Bekanntmachungsdatum)\n\nRheinland-Pfalz Amtsgericht Koblenz HRB 30644\nRegisterbekanntmachung nach dem Umwandlungsgesetz 25.10.2024 (Eintragungsdatum)\n\nChristliches Klinikum Paderborn gGmbH\nGesellschaft mit beschränkter Haftung\nKoblenz\n\nAls nicht eingetragen wird veröffentlicht: Den Gläubigern der an der Ausgliederung beteiligten Rechtsträger ist, wenn sie binnen sechs Monaten nac hdem Tag, an dem die Eintragung der Ausgliederung in das Register des Sitzes desjenigen Rechtsträgers,dessen Gläubiger sie sind, nach § 19 Abs. 3 UmwG als bekannt gemacht gilt, ihren Anspruch nach Grund und Höhe schriftlich anmelden, Sicherheit zu leisten, soweit sie nicht Befriedigung verlangen können. Dieses Recht steht den Gläubigern jedoch nur zu, wenn sie glaubhaft machen, dass durch die Ausgliederung die Erfüllung der Forderung gefährdet wird."
    },
    {
      "date": "2024-10-25",
      "id": "91732",
      "original_text": "Registerbekanntmachung nach dem Umwandlungsgesetz\nRheinland-Pfalz Amtsgericht Koblenz HRB 23072\nSHD Erste Beteiligungsgesellschaft mbH – Andernach",
      "type": "Registerbekanntmachung nach dem Umwandlungsgesetz",
      "state": "Rheinland-Pfalz",
      "amtsgericht": "Amtsgericht Koblenz",
      "registernummer": "HRB 23072",
      "registerart": "HRB",
      "company_name": "SHD Erste Beteiligungsgesellschaft mbH",
      "company_seat": "Andernach",
      "details": "25.10.2024 (Bekanntmachungsdatum)\n\nRheinland-Pfalz Amtsgericht Koblenz HRB 23072\nRegisterbekanntmachung nach dem Umwandlungsgesetz 01.10.2024 (Eintragungsdatum)\n\nSHD Erste Beteiligungsgesellschaft mbH\nGesellschaft mit beschränkter Haftung\nAndernach\n\nGläubigern der an der Verschmelzung beteiligten Rechtsträger ist unter den Voraussetzungen des § 22 UmwG Sicherheit zu leisten.Als nicht eingetragen wird veröffentlicht: Den Gläubigern der an der Verschmelzung beteiligten Rechtsträger ist, wenn sie binnen sechs Monaten nach dem Tag, an dem die Eintragung der Verschmelzung in das Register des Sitzes desjenigen Rechtsträgers,dessen Gläubiger sie sind, nach § 19 Abs. 3 UmwG als bekannt gemacht gilt, ihren Anspruch nach Grund und Höhe schriftlich anmelden, Sicherheit zu leisten, soweit sie nicht Befriedigung verlangen können. Dieses Recht steht den Gläubigern jedoch nur zu, wenn sie glaubhaft machen, dass durch die Verschmelzung die Erfüllungd er Forderung gefährdet wird."
    },
    {
      "date": "2024-10-25",
      "id": "91733",
      "original_text": "Registerbekanntmachung nach dem Umwandlungsgesetz\nRheinland-Pfalz Amtsgericht Koblenz HRB 30585\nBBT Region Paderborn-Marsberg gGmbH – Koblenz",
      "type": "Registerbekanntmachung nach dem Umwandlungsgesetz",
      "state": "Rheinland-Pfalz",
      "amtsgericht": "Amtsgericht Koblenz",
      "registernummer": "HRB 30585",
      "registerart": "HRB",
      "company_name": "BBT Region Paderborn-Marsberg gGmbH",
      "company_seat": "Koblenz",
      "details": "25.10.2024 (Bekanntmachungsdatum)\n\nRheinland-Pfalz Amtsgericht Koblenz HRB 30585\nRegisterbekanntmachung nach dem Umwandlungsgesetz 25.10.2024 (Eintragungsdatum)\n\nBBT Region Paderborn-Marsberg gGmbH\nGesellschaft mit beschränkter Haftung\nKoblenz\n\nAls nicht eingetragen wird veröffentlicht: Den Gläubigern der an der Ausgliederung beteiligten Rechtsträger ist, wenn sie binnen sechs Monaten nac hdem Tag, an dem die Eintragung der Ausgliederung in das Register des Sitzes desjenigen Rechtsträgers,dessen Gläubiger sie sind, nach § 19 Abs. 3 UmwG als bekannt gemacht gilt, ihren Anspruch nach Grund und Höhe schriftlich anmelden, Sicherheit zu leisten, soweit sie nicht Befriedigung verlangen können. Dieses Recht steht den Gläubigern jedoch nur zu, wenn sie glaubhaft machen, dass durch die Ausgliederung die Erfüllung der Forderung gefährdet wird."
    },
    {
      "date": "2024-10-25",
      "id": "91734",
      "original_text": "Einreichung neuer Dokumente\nNordrhein-Westfalen Amtsgericht Essen HRB 24298\nVier Gas Services Management GmbH – Essen",
      "type": "Einreichung neuer Dokumente",
      "state": "Nordrhein-Westfalen",
      "amtsgericht": "Amtsgericht Essen",
      "registernummer": "HRB 24298",
      "registerart": "HRB",
      "company_name": "Vier Gas Services Management GmbH",
      "company_seat": "Essen",
      "details": "25.10.2024 (Bekanntmachungsdatum)\n\nNordrhein-Westfalen Amtsgericht Essen HRB 24298\nEinreichung neuer Dokumente\n\nVier Gas Services Management GmbH\nGesellschaft mit beschränkter Haftung\nEssen\n\nDem Registergericht ist eine neue Liste der Mitglieder des Aufsichtsrates eingereicht worden."
    },
    {
      "date": "2024-10-25",
      "id": "91735",
      "original_text": "Registerbekanntmachung nach dem Umwandlungsgesetz\nNordrhein-Westfalen Amtsgericht Paderborn HRB 14811\nHannes Camper Westfalen GmbH – Büren",
      "type": "Registerbekanntmachung nach dem Umwandlungsgesetz",
      "state": "Nordrhein-Westfalen",
      "amtsgericht": "Amtsgericht Paderborn",
      "registernummer": "HRB 14811",
      "registerart": "HRB",
      "company_name": "Hannes Camper Westfalen GmbH",
      "company_seat": "Büren",
      "details": "25.10.2024 (Bekanntmachungsdatum)\n\nNordrhein-Westfalen Amtsgericht Paderborn HRB 14811\nRegisterbekanntmachung nach dem Umwandlungsgesetz 25.10.2024 (Eintragungsdatum)\n\nHannes Camper Westfalen GmbH\nGesellschaft mit beschränkter Haftung\nBüren\n\nDen Gläubigern der an der Verschmelzung beteiligten Rechtsträger ist, wenn sie binnen sechs Monaten nach dem Tag, an dem die Eintragung der Verschmelzung in das Register des Sitzes desjenigen Rechtsträgers, dessen Gläubiger sie sind, nach § 19 Absatz 3 UmwG als bekanntgemacht gilt, ihren Anspruch nach Grund und Höhe schriftlich anmelden, Sicherheit zu leisten, soweit sie nicht Befriedigung verlangen können. Dieses Recht steht den Gläubigern jedoch nur zu, wenn sie glaubhaft machen, dass durch die Verschmelzung die Erfüllung ihrer Forderung gefährdet wird."
    },
    {
      "date": "2024-10-25",
      "id": "91736",
      "original_text": "Löschungsankündigung\nNordrhein-Westfalen Amtsgericht Bonn HRA 6474\nMachold Management UG (haftungsbeschränkt) & Co. KG – Bonn",
      "type": "Löschungsankündigung",
      "state": "Nordrhein-Westfalen",
      "amtsgericht": "Amtsgericht Bonn",
      "registernummer": "HRA 6474",
      "registerart": "HRA",
      "company_name": "Machold Management UG (haftungsbeschränkt) & Co. KG",
      "company_seat": "Bonn",
      "details": "25.10.2024 (Bekanntmachungsdatum)\n\nNordrhein-Westfalen Amtsgericht Bonn HRA 6474\nLöschungsankündigung\n\nMachold Management UG (haftungsbeschränkt) & Co. KG\nKommanditgesellschaft\nBonn\n\nDas Registergericht beabsichtigt die Firma Machold Management UG (haftungsbeschränkt) & Co. KG mit Sitz in Bonn, Amtsgericht Bonn HRA 6474 von Amts wegen nach § 394 FamFG zu löschen. Die Frist zur Erhebung eines Widerspruchs ist auf einen Monat festgesetzt."
    },
    {
      "date": "2024-10-25",
      "id": "91737",
      "original_text": "Registerbekanntmachung nach dem Umwandlungsgesetz\nNordrhein-Westfalen Amtsgericht Köln HRA 36973\nBlack Screen Records e. K. – Köln",
      "type": "Registerbekanntmachung nach dem Umwandlungsgesetz",
      "state": "Nordrhein-Westfalen",
      "amtsgericht": "Amtsgericht Köln",
      "registernummer": "HRA 36973",
      "registerart": "HRA",
      "company_name": "Black Screen Records e. K.",
      "company_seat": "Köln",
      "details": "25.10.2024 (Bekanntmachungsdatum)\n\nNordrhein-Westfalen Amtsgericht Köln HRA 36973\nRegisterbekanntmachung nach dem Umwandlungsgesetz 25.10.2024 (Eintragungsdatum)\n\nBlack Screen Records e. K.\nEinzelkaufmann / Einzelkauffrau\nKöln\n\nDen Gläubigern der an der Ausgliederung beteiligten Rechtsträger ist, wenn sie binnen sechs Monaten nach dem Tag, an dem die Eintragung der Ausgliederung in das Register des Sitzes desjenigen Rechtsträgers, dessen Gläubiger sie sind, nach § 19 Absatz 3 UmwG als bekanntgemacht gilt, ihren Anspruch nach Grund und Höhe schriftlich anmelden, Sicherheit zu leisten, soweit sie nicht Befriedigung verlangen können. Dieses Recht steht den Gläubigern jedoch nur zu, wenn sie glaubhaft machen, dass durch die Ausgliederung die Erfüllung ihrer Forderung gefährdet wird."
    },
    {
      "date": "2024-10-25",
      "id": "91738",
      "original_text": "Löschungsankündigung\nNordrhein-Westfalen Amtsgericht Köln HRB 117876\nDB Projektentwicklung GmbH – Köln",
      "type": "Löschungsankündigung",
      "state": "Nordrhein-Westfalen",
      "amtsgericht": "Amtsgericht Köln",
      "registernummer": "HRB 117876",
      "registerart": "HRB",
      "company_name": "DB Projektentwicklung GmbH",
      "company_seat": "Köln",
      "details": "25.10.2024 (Bekanntmachungsdatum)\n\nNordrhein-Westfalen Amtsgericht Köln HRB 117876\nLöschungsankündigung\n\nDB Projektentwicklung GmbH\nGesellschaft mit beschränkter Haftung\nKöln\n\nDas Registergericht beabsichtigt die Gesellschaft von Amts wegen nach § 394 FamFG zu löschen. Die Frist zur Erhebung eines Widerspruchs ist auf einen Monat festgesetzt."
    },
    {
      "date": "2024-10-25",
      "id": "91739",
      "original_text": "Löschungsankündigung\nNordrhein-Westfalen Amtsgericht Siegburg HRB 16185\nProjektbüro Colloseus Unternehmergesellschaft (haftungsbeschränkt) – Sankt Augustin",
      "type": "Löschungsankündigung",
      "state": "Nordrhein-Westfalen",
      "amtsgericht": "Amtsgericht Siegburg",
      "registernummer": "HRB 16185",
      "registerart": "HRB",
      "company_name": "Projektbüro Colloseus Unternehmergesellschaft (haftungsbeschränkt)",
      "company_seat": "Sankt Augustin",
      "details": "25.10.2024 (Bekanntmachungsdatum)\n\nNordrhein-Westfalen Amtsgericht Siegburg HRB 16185\nLöschungsankündigung\n\nProjektbüro Colloseus Unternehmergesellschaft (haftungsbeschränkt)\nGesellschaft mit beschränkter Haftung\nSankt Augustin\n\nDas Registergericht hat glaubhafte Kenntnis erlangt, dass die Gesellschaft vermögenslos geworden ist, da Zwangsvollstreckungsmaßnahmen des Finanzamtes Sankt Augustin erfolglos geblieben sind.\nEs ist daher beabsichtigt, die Gesellschaft nach § 394 FamFG im Handelsregister wegen Vermögenslosigkeit zu löschen.\nEinwände gegen die Löschung sind durch Widerspruch binnen einer Frist von 3 Monaten geltend zu machen, andernfalls die Löschung erfolgen wird.\nEinzulegen ist der Widerspruch bei dem Amtsgericht Siegburg, Neue Poststraße 16, 53721 Siegburg, und zwar entweder schriftlich in deutscher Sprache oder mündlich zur Niederschrift der Geschäftsstelle. Der Widerspruch kann auch zur Niederschrift der Geschäftsstelle eines jeden Amtsgerichts abgegeben werden. Der Widerspruch ist binnen der in der Verfügung bestimmten Frist einzulegen. Die Frist ist nur gewahrt, wenn der Widerspruch rechtzeitig bei dem Amtsgericht Siegburg eingeht, auch wenn der Widerspruch zur Niederschrift der Geschäftsstelle eines anderen Amtsgerichts abgegeben wurde. Die Frist beginnt jeweils mit der schriftlichen Bekanntgabe der Verfügung an die Beteiligten. Kann die schriftliche Bekanntgabe an einen Beteiligten nicht bewirkt werden, beginnt die Frist spätestens mit Ablauf von fünf Monaten nach Erlass der Verfügung. Die Bekanntgabe ist entweder durch Zustellung oder am dritten Tage nach Aufgabe zur Post bewirkt.\nSofern die Löschung noch nicht erfolgt ist, kann der Widerspruch auch noch nach Ablauf der Frist eingelegt werden. Fällt das Ende der Frist auf einen Sonnabend, einen Sonntag oder einen allgemeinen Feiertag, endet die Frist mit Ablauf des nächsten Werktages. Der Widerspruch ist zu unterzeichnen. Eine Begründung des Widerspruchs ist nicht vorgeschrieben."
    },
    {
      "date": "2024-10-25",
      "id": "91740",
      "original_text": "Löschungsankündigung\nNordrhein-Westfalen Amtsgericht Mönchengladbach HRB 13387\n3G DSL Media GmbH – Mönchengladbach",
      "type": "Löschungsankündigung",
      "state": "Nordrhein-Westfalen",
      "amtsgericht": "Amtsgericht Mönchengladbach",
      "registernummer": "HRB 13387",
      "registerart": "HRB",
      "company_name": "3G DSL Media GmbH",
      "company_seat": "Mönchengladbach",
      "details": "25.10.2024 (Bekanntmachungsdatum)\n\nNordrhein-Westfalen Amtsgericht Mönchengladbach HRB 13387\nLöschungsankündigung\n\n3G DSL Media GmbH\nGesellschaft mit beschränkter Haftung\nMönchengladbach\n\n3G DSL Media GmbH, Mönchengladbach (Amtsgericht Mönchengladbach HRB 13387).\nDas Registergericht beabsichtigt, die im Handelsregister eingetragene Gesellschaft gemäß § 394 Absatz 1 FamFG wegen Vermögenslosigkeit von Amts wegen zu löschen. Gegen diese Verfügung kann Widerspruch eingelegt werden. Die Frist zur Erhebung eines Widerspruchs gegen die beabsichtigte Löschung von Amts wegen ist auf zwei Monate festgesetzt."
    },
    {
      "date": "2024-10-25",
      "id": "91741",
      "original_text": "Löschungsankündigung\nNordrhein-Westfalen Amtsgericht Düsseldorf HRB 85997\nRehoboth La Prospérité GmbH – Düsseldorf",
      "type": "Löschungsankündigung",
      "state": "Nordrhein-Westfalen",
      "amtsgericht": "Amtsgericht Düsseldorf",
      "registernummer": "HRB 85997",
      "registerart": "HRB",
      "company_name": "Rehoboth La Prospérité GmbH",
      "company_seat": "Düsseldorf",
      "details": "25.10.2024 (Bekanntmachungsdatum)\n\nNordrhein-Westfalen Amtsgericht Düsseldorf HRB 85997\nLöschungsankündigung\n\nRehoboth La Prospérité GmbH\nGesellschaft mit beschränkter Haftung\nDüsseldorf\n\nDas Registergericht beabsichtigt die Gesellschaft von Amts wegen nach § 394 FamFG zu löschen. Die Frist zur Erhebung eines Widerspruchs ist auf 3 Wochen festgesetzt.\n\nRechtsbehelfsbelehrung:\nDas Widerspruchsrecht steht jedem zu, der an der Unterlassung der Löschung ein berechtigtes Interesse hat. Der Widerspruch ist bei dem Amtsgericht Düsseldorf -Registergericht-, Werdener Straße 1, 40227 Düsseldorf schriftlich in deutscher Sprache oder zur Niederschrift der Geschäftsstelle einzulegen. Der Widerspruch kann auch zur Niederschrift der Geschäftsstelle eines jeden Amtsgerichtes abgegeben werden. Die Einlegung ist auch durch Übertragung eines elektronischen Dokuments an die elektronische Poststelle des Gerichts möglich. Das elektronische Dokument muss für die Bearbeitung durch das Gericht geeignet und mit einer qualifizierten elektronischen Signatur der verantwortenden Person versehen sein oder von der verantwortenden Person signiert und auf einem sicheren Übermittlungsweg gemäß § 130a ZPO nach näherer Maßgabe der Verordnung über die technischen Rahmenbedingungen des elektronischen Rechtsverkehrs und über das besondere elektronische Behördenpostfach (BGBl. I, S.3803) eingereicht werden. Weitere Informationen erhalten Sie auf der Internetseite www.justiz.de.\nDer Widerspruch muss spätestens innerhalb der gesetzten Frist nach dem Datum der Bekanntmachung der Löschungsankündigung bei dem Amtsgericht - Registergericht - Düsseldorf eingegangen sein.  Dies gilt auch dann, wenn der Widerspruch zur Niederschrift der Geschäftsstelle eines anderen Amtsgerichtes abgegeben wurde. Die Frist beginnt mit dem Tage der Bekanntmachung der Löschungsankündigung in dem für die Bekanntmachung der Eintragungen in das Handelsregister bestimmten elektronischen Informations- und Kommunikationssystem nach § 10 des Handelsgesetzbuches. Fällt das Ende der Frist auf einen Sonntag, einen allgemeinen Feiertag oder Sonnabend, so endet die Frist mit Ablauf des nächsten Werktages.\nDer Widerspruch muss die Bezeichnung der angefochtenen Löschungsankündigung sowie die Erklärung enthalten, dass Widerspruch gegen diese Löschungsankündigung eingelegt wird. Er ist zu unterzeichnen und soll begründet werden."
    },
    {
      "date": "2024-10-25",
      "id": "91742",
      "original_text": "Registerbekanntmachung nach dem Umwandlungsgesetz\nNordrhein-Westfalen Amtsgericht Dortmund HRA 13546\nKramer Beteiligung GmbH + Co KG – Dortmund",
      "type": "Registerbekanntmachung nach dem Umwandlungsgesetz",
      "state": "Nordrhein-Westfalen",
      "amtsgericht": "Amtsgericht Dortmund",
      "registernummer": "HRA 13546",
      "registerart": "HRA",
      "company_name": "Kramer Beteiligung GmbH + Co KG",
      "company_seat": "Dortmund",
      "details": "25.10.2024 (Bekanntmachungsdatum)\n\nNordrhein-Westfalen Amtsgericht Dortmund HRA 13546\nRegisterbekanntmachung nach dem Umwandlungsgesetz 24.10.2024 (Eintragungsdatum)\n\nKramer Beteiligung GmbH + Co KG\nKommanditgesellschaft\nDortmund\n\nDen Gläubigern der an der Abspaltung beteiligten Rechtsträger ist, wenn sie binnen sechs Monaten nach dem Tag, an dem die Eintragung der Abspaltung desjenigen Rechtsträgers, dessen Gläubiger sie sind, nach § 19 Absatz 3 UmwG als bekanntgemacht gilt, ihren Anspruch nach Grund und Höhe schriftlich anmelden, Sicherheit zu leisten, soweit sie nicht Befriedigung verlangen können. Dieses Recht steht den Gläubigern jedoch nur zu, wenn sie glaubhaft machen, dass durch die Abspaltung die Erfüllung ihrer Forderung gefährdet wird."
    },
    {
      "date": "2024-10-25",
      "id": "91743",
      "original_text": "Registerbekanntmachung nach dem Umwandlungsgesetz\nNordrhein-Westfalen Amtsgericht Wuppertal HRB 12482\nATD Aufzüge Dasberg GmbH – Wuppertal",
      "type": "Registerbekanntmachung nach dem Umwandlungsgesetz",
      "state": "Nordrhein-Westfalen",
      "amtsgericht": "Amtsgericht Wuppertal",
      "registernummer": "HRB 12482",
      "registerart": "HRB",
      "company_name": "ATD Aufzüge Dasberg GmbH",
      "company_seat": "Wuppertal",
      "details": "25.10.2024 (Bekanntmachungsdatum)\n\nNordrhein-Westfalen Amtsgericht Wuppertal HRB 12482\nRegisterbekanntmachung nach dem Umwandlungsgesetz 25.10.2024 (Eintragungsdatum)\n\nATD Aufzüge Dasberg GmbH\nGesellschaft mit beschränkter Haftung\nWuppertal\n\nDen Gläubigern der an der Verschmelzung beteiligten Rechtsträger ist, wenn sie binnen sechs Monaten nach dem Tag, an dem die Eintragung der Verschmelzung in das Register des Sitzes derjenigen Rechtsträger deren Gläubiger sie sind, nach § 19 Absatz 3 UmwG als bekanntgemacht gilt, ihren Anspruch nach Grund und Höhe schriftlich anmelden, Sicherheit zu leisten, soweit sie nicht Befriedigung verlangen können. Dieses Recht steht den Gläubigern jedoch nur zu, wenn sie glaubhaft machen, dass durch die Verschmelzung die Erfüllung ihrer Forderung gefährdet wird."
    },
    {
      "date": "2024-10-25",
      "id": "91744",
      "original_text": "Löschungsankündigung\nNordrhein-Westfalen Amtsgericht Gelsenkirchen HRB 14694\nESS BAR Catering UG (haftungsbeschränkt) – Dorsten",
      "type": "Löschungsankündigung",
      "state": "Nordrhein-Westfalen",
      "amtsgericht": "Amtsgericht Gelsenkirchen",
      "registernummer": "HRB 14694",
      "registerart": "HRB",
      "company_name": "ESS BAR Catering UG (haftungsbeschränkt)",
      "company_seat": "Dorsten",
      "details": "25.10.2024 (Bekanntmachungsdatum)\n\nNordrhein-Westfalen Amtsgericht Gelsenkirchen HRB 14694\nLöschungsankündigung\n\nESS BAR Catering UG (haftungsbeschränkt)\nGesellschaft mit beschränkter Haftung\nDorsten\n\nDas Gericht beabsichtigt, die Gesellschaft ESS BAR Catering UG (haftungsbeschränkt) mit Sitz in Dorsten, HRB 14694 Amtsgericht Gelsenkirchen, wegen Vermögenslosigkeit zu löschen.\n\nHiermit wird denjenigen, die an der Unterlassung der Löschung ein berechtigtes Interesse haben, gem. § 394 Abs. 2 FamFG Gelegenheit gegeben, gegen dieses Vorhaben binnen eines Monats nach dieser Bekanntmachung Widerspruch einzulegen. Der Widerspruch kann schriftlich oder zu Protokoll der Geschäftsstelle erhoben werden."
    },
    {
      "date": "2024-10-25",
      "id": "91745",
      "original_text": "Einreichung neuer Dokumente\nNordrhein-Westfalen Amtsgericht Bonn HRB 92\nDeutscher Beamtenwirtschaftsbund (BWB) Gesellschaft mit beschränkter Haftung – Bonn",
      "type": "Einreichung neuer Dokumente",
      "state": "Nordrhein-Westfalen",
      "amtsgericht": "Amtsgericht Bonn",
      "registernummer": "HRB 92",
      "registerart": "HRB",
      "company_name": "Deutscher Beamtenwirtschaftsbund (BWB) Gesellschaft mit beschränkter Haftung",
      "company_seat": "Bonn",
      "details": "25.10.2024 (Bekanntmachungsdatum)\n\nNordrhein-Westfalen Amtsgericht Bonn HRB 92\nEinreichung neuer Dokumente\n\nDeutscher Beamtenwirtschaftsbund (BWB) Gesellschaft mit beschränkter Haftung\nGesellschaft mit beschränkter Haftung\nBonn\n\nDem Registergericht ist eine neue Liste der Mitglieder des Aufsichtsrates eingereicht worden."
    },
    {
      "date": "2024-10-25",
      "id": "91746",
      "original_text": "Registerbekanntmachung nach dem Umwandlungsgesetz\nNordrhein-Westfalen Amtsgericht Wuppertal HRB 21927\nProcar Automobile GmbH – Wuppertal",
      "type": "Registerbekanntmachung nach dem Umwandlungsgesetz",
      "state": "Nordrhein-Westfalen",
      "amtsgericht": "Amtsgericht Wuppertal",
      "registernummer": "HRB 21927",
      "registerart": "HRB",
      "company_name": "Procar Automobile GmbH",
      "company_seat": "Wuppertal",
      "details": "25.10.2024 (Bekanntmachungsdatum)\n\nNordrhein-Westfalen Amtsgericht Wuppertal HRB 21927\nRegisterbekanntmachung nach dem Umwandlungsgesetz 25.10.2024 (Eintragungsdatum)\n\nProcar Automobile GmbH\nGesellschaft mit beschränkter Haftung\nWuppertal\n\nDen Gläubigern der an der formwechselnden Umwandlung beteiligten Rechtsträger ist, wenn sie binnen sechs Monaten nach dem Tag, an dem die Eintragung der formwechselnden Umwandlung in das Register des Sitzes derjenigen Rechtsträger deren Gläubiger sie sind, nach § 19 Absatz 3 UmwG als bekanntgemacht gilt, ihren Anspruch nach Grund und Höhe schriftlich anmelden, Sicherheit zu leisten, soweit sie nicht Befriedigung verlangen können. Dieses Recht steht den Gläubigern jedoch nur zu, wenn sie glaubhaft machen, dass durch die formwechselnden Umwandlung die Erfüllung ihrer Forderung gefährdet wird."
    },
    {
      "date": "2024-10-25",
      "id": "91747",
      "original_text": "Löschungsankündigung\nNordrhein-Westfalen Amtsgericht Neuss HRB 14972\nSEL GmbH – Neuss",
      "type": "Löschungsankündigung",
      "state": "Nordrhein-Westfalen",
      "amtsgericht": "Amtsgericht Neuss",
      "registernummer": "HRB 14972",
      "registerart": "HRB",
      "company_name": "SEL GmbH",
      "company_seat": "Neuss",
      "details": "25.10.2024 (Bekanntmachungsdatum)\n\nNordrhein-Westfalen Amtsgericht Neuss HRB 14972\nLöschungsankündigung\n\nSEL GmbH\nGesellschaft mit beschränkter Haftung\nNeuss\n\nEs ist beabsichtigt, die Gesellschaft wegen Vermögenslosigkeit aufgrund des § 394 Abs. 1 FamFG zu löschen. Frist zur Geltendmachung eines Widerspruchs: 1 Monat.\n\nRechtsbehelfsbelehrung:\nGegen diese Verfügung können Sie Widerspruch einlegen.\nDer Widerspruch ist bei dem Amtsgericht Neuss - Registergericht -, Breite Str. 48, 41460 Neuss schriftlich in deutscher Sprache oder zur Niederschrift der Geschäftsstelle einzulegen.\nDer Widerspruch kann auch zur Niederschrift der Geschäftsstelle eines jeden Amtsgerichtes abgegeben werden.\nDie Einlegung ist auch durch Übertragung eines elektronischen Dokuments an die elektronische Poststelle des Gerichts möglich. Das elektronische Dokument muss für die Bearbeitung durch das Gericht geeignet und mit einer qualifizierten elektronischen Signatur der verantwortenden Person versehen sein oder von der verantwortenden Person signiert und auf einem sicheren Übermittlungsweg gemäß § 130a ZPO nach näherer Maßgabe der Verordnung über die technischen Rahmenbedingungen des elektronischen Rechtsverkehrs und über das besondere elektronische Behördenpostfach (BGBl. I, S.3803) eingereicht werden. Weitere Informationen erhalten Sie auf der Internetseite www.justiz.de.\nDer Widerspruch muss spätestens innerhalb der gesetzten Frist nach der schriftlichen Bekanntgabe der Verfügung bei dem Amtsgericht - Registergericht - Neuss eingegangen sein. Dies gilt auch dann, wenn der Widerspruch zur Niederschrift der Geschäftsstelle eines anderen Amtsgerichtes abgegeben wurde. Die Frist beginnt mit der schriftlichen Bekanntgabe der Verfügung. Die Bekanntgabe ist entweder durch Zustellung oder am dritten Tage nach Aufgabe zur Post bewirkt. Fällt das Ende der Frist auf einen Sonntag, einen allgemeinen Feiertag oder Sonnabend, so endet die Frist mit Ablauf des nächsten Werktages.\n\nDer Widerspruch muss die Bezeichnung der angefochtenen Verfügung sowie die Erklärung enthalten, dass Widerspruch gegen diese Verfügung eingelegt wird. Er ist zu unterzeichnen und soll begründet werden."
    },
    {
      "date": "2024-10-25",
      "id": "91748",
      "original_text": "Registerbekanntmachung nach dem Umwandlungsgesetz\nNordrhein-Westfalen Amtsgericht Neuss HRB 21597\nSNB Abbruch GmbH – Neuss",
      "type": "Registerbekanntmachung nach dem Umwandlungsgesetz",
      "state": "Nordrhein-Westfalen",
      "amtsgericht": "Amtsgericht Neuss",
      "registernummer": "HRB 21597",
      "registerart": "HRB",
      "company_name": "SNB Abbruch GmbH",
      "company_seat": "Neuss",
      "details": "25.10.2024 (Bekanntmachungsdatum)\n\nNordrhein-Westfalen Amtsgericht Neuss HRB 21597\nRegisterbekanntmachung nach dem Umwandlungsgesetz 25.10.2024 (Eintragungsdatum)\n\nSNB Abbruch GmbH\nGesellschaft mit beschränkter Haftung\nNeuss\n\nDen Gläubigern der an der Verschmelzung beteiligten Rechtsträger ist, wenn sie binnen sechs Monaten nach dem Tag, an dem die Eintragung der Verschmelzung in das Register des Sitzes desjenigen Rechtsträgers, dessen Gläubiger sie sind, nach § 19 Absatz 3 UmwG als bekanntgemacht gilt, ihren Anspruch nach Grund und Höhe schriftlich anmelden, Sicherheit zu leisten, soweit sie nicht Befriedigung verlangen können. Dieses Recht steht den Gläubigern jedoch nur zu, wenn sie glaubhaft machen, dass durch die Verschmelzung die Erfüllung ihrer Forderung gefährdet wird."
    },
    {
      "date": "2024-10-25",
      "id": "91749",
      "original_text": "Einreichung neuer Dokumente\nNordrhein-Westfalen Amtsgericht Hamm HRB 3045\nAluminiumwerk Unna Aktiengesellschaft – Unna",
      "type": "Einreichung neuer Dokumente",
      "state": "Nordrhein-Westfalen",
      "amtsgericht": "Amtsgericht Hamm",
      "registernummer": "HRB 3045",
      "registerart": "HRB",
      "company_name": "Aluminiumwerk Unna Aktiengesellschaft",
      "company_seat": "Unna",
      "details": "25.10.2024 (Bekanntmachungsdatum)\n\nNordrhein-Westfalen Amtsgericht Hamm HRB 3045\nEinreichung neuer Dokumente 25.10.2024 (Eintragungsdatum)\n\nAluminiumwerk Unna Aktiengesellschaft\nAktiengesellschaft\nUnna\n\nDem Registergericht ist eine neue Liste der Mitglieder des Aufsichtsrates eingereicht worden."
    },
    {
      "date": "2024-10-25",
      "id": "91750",
      "original_text": "Registerbekanntmachung nach dem Umwandlungsgesetz\nNordrhein-Westfalen Amtsgericht Paderborn HRB 13257\nBS-Vermietung GmbH – Salzkotten",
      "type": "Registerbekanntmachung nach dem Umwandlungsgesetz",
      "state": "Nordrhein-Westfalen",
      "amtsgericht": "Amtsgericht Paderborn",
      "registernummer": "HRB 13257",
      "registerart": "HRB",
      "company_name": "BS-Vermietung GmbH",
      "company_seat": "Salzkotten",
      "details": "25.10.2024 (Bekanntmachungsdatum)\n\nNordrhein-Westfalen Amtsgericht Paderborn HRB 13257\nRegisterbekanntmachung nach dem Umwandlungsgesetz 25.10.2024 (Eintragungsdatum)\n\nBS-Vermietung GmbH\nGesellschaft mit beschränkter Haftung\nSalzkotten\n\nDen Gläubigern der an der Verschmelzung beteiligten Rechtsträger ist, wenn sie binnen sechs Monaten nach dem Tag, an dem die Eintragung der Verschmelzung in das Register des Sitzes desjenigen Rechtsträgers, dessen Gläubiger sie sind, nach § 19 Absatz 3 UmwG als bekanntgemacht gilt, ihren Anspruch nach Grund und Höhe schriftlich anmelden, Sicherheit zu leisten, soweit sie nicht Befriedigung verlangen können. Dieses Recht steht den Gläubigern jedoch nur zu, wenn sie glaubhaft machen, dass durch die Verschmelzung die Erfüllung ihrer Forderung gefährdet wird."
    },
    {
      "date": "2024-10-25",
      "id": "91751",
      "original_text": "Registerbekanntmachung nach dem Umwandlungsgesetz\nNordrhein-Westfalen Amtsgericht Dortmund VR 20447 früher Amtsgericht Lünen\nTHERAPIE - SPORTVEREIN Lünen e. V. – Lünen",
      "type": "Registerbekanntmachung nach dem Umwandlungsgesetz",
      "state": "Nordrhein-Westfalen",
      "amtsgericht": "Amtsgericht Dortmund",
      "registernummer": "VR 20447",
      "registerart": "VR",
      "company_name": "THERAPIE - SPORTVEREIN Lünen e. V.",
      "company_seat": "Lünen",
      "former_amtsgericht": "Lünen",
      "details": "25.10.2024 (Bekanntmachungsdatum)\n\nNordrhein-Westfalen Amtsgericht Dortmund VR 20447 früher Amtsgericht Lünen\nRegisterbekanntmachung nach dem Umwandlungsgesetz 25.10.2024 (Eintragungsdatum)\n\nTHERAPIE - SPORTVEREIN Lünen e. V.\neingetragener Verein\nLünen\n\nDen Gläubigern der an der Verschmelzung beteiligten Rechtsträger ist, wenn sie binnen sechs Monaten nach dem Tag, an dem die Eintragung der Verschmelzung in das Register des Sitzes desjenigen Rechtsträgers, dessen Gläubiger sie sind, nach § 19 Absatz 3 UmwG als bekanntgemacht gilt, ihren Anspruch nach Grund und Höhe schriftlich anmelden, Sicherheit zu leisten, soweit sie nicht Befriedigung verlangen können. Dieses Recht steht den Gläubigern jedoch nur zu, wenn sie glaubhaft machen, dass durch die Verschmelzung die Erfüllung ihrer Forderung gefährdet wird."
    },
    {
      "date": "2024-10-25",
      "id": "91752",
      "original_text": "Einreichung neuer Dokumente\nNordrhein-Westfalen Amtsgericht Duisburg HRB 10516\nDachziegelwerke Nelskamp GmbH – Schermbeck",
      "type": "Einreichung neuer Dokumente",
      "state": "Nordrhein-Westfalen",
      "amtsgericht": "Amtsgericht Duisburg",
      "registernummer": "HRB 10516",
      "registerart": "HRB",
      "company_name": "Dachziegelwerke Nelskamp GmbH",
      "company_seat": "Schermbeck",
      "details": "25.10.2024 (Bekanntmachungsdatum)\n\nNordrhein-Westfalen Amtsgericht Duisburg HRB 10516\nEinreichung neuer Dokumente\n\nDachziegelwerke Nelskamp GmbH\nGesellschaft mit beschränkter Haftung\nSchermbeck\n\nDem Registergericht ist eine Liste der Mitglieder des Aufsichtsrates eingereicht worden."
    },
    {
      "date": "2024-10-25",
      "id": "91753",
      "original_text": "Löschungsankündigung\nNordrhein-Westfalen Amtsgericht Siegburg HRB 12606\nYilmazkaya GmbH – Hennef",
      "type": "Löschungsankündigung",
      "state": "Nordrhein-Westfalen",
      "amtsgericht": "Amtsgericht Siegburg",
      "registernummer": "HRB 12606",
      "registerart": "HRB",
      "company_name": "Yilmazkaya GmbH",
      "company_seat": "Hennef",
      "details": "25.10.2024 (Bekanntmachungsdatum)\n\nNordrhein-Westfalen Amtsgericht Siegburg HRB 12606\nLöschungsankündigung\n\nYilmazkaya GmbH\nGesellschaft mit beschränkter Haftung\nHennef\n\nDas Registergericht hat glaubhafte Kenntnis erlangt, dass die Gesellschaft vermögenslos geworden ist, da ein Insolvenzverfahren durchgeführt und nach § 200 InsO aufgehoben wurde.\nEs ist daher beabsichtigt, die Gesellschaft nach § 394 FamFG im Handelsregister wegen Vermögenslosigkeit zu löschen.\nEinwände gegen die Löschung sind durch Widerspruch binnen einer Frist von 3 Monaten geltend zu machen, andernfalls die Löschung erfolgen wird.\nEinzulegen ist der Widerspruch bei dem Amtsgericht Siegburg, Neue Poststraße 16, 53721 Siegburg, und zwar entweder schriftlich in deutscher Sprache oder mündlich zur Niederschrift der Geschäftsstelle. Der Widerspruch kann auch zur Niederschrift der Geschäftsstelle eines jeden Amtsgerichts abgegeben werden. Der Widerspruch ist binnen der in der Verfügung bestimmten Frist einzulegen. Die Frist ist nur gewahrt, wenn der Widerspruch rechtzeitig bei dem Amtsgericht Siegburg eingeht, auch wenn der Widerspruch zur Niederschrift der Geschäftsstelle eines anderen Amtsgerichts abgegeben wurde. Die Frist beginnt jeweils mit der schriftlichen Bekanntgabe der Verfügung an die Beteiligten. Kann die schriftliche Bekanntgabe an einen Beteiligten nicht bewirkt werden, beginnt die Frist spätestens mit Ablauf von fünf Monaten nach Erlass der Verfügung. Die Bekanntgabe ist entweder durch Zustellung oder am dritten Tage nach Aufgabe zur Post bewirkt.\nSofern die Löschung noch nicht erfolgt ist, kann der Widerspruch auch noch nach Ablauf der Frist eingelegt werden. Fällt das Ende der Frist auf einen Sonnabend, einen Sonntag oder einen allgemeinen Feiertag, endet die Frist mit Ablauf des nächsten Werktages. Der Widerspruch ist zu unterzeichnen. Eine Begründung des Widerspruchs ist nicht vorgeschrieben."
    },
    {
      "date": "2024-10-25",
      "id": "91754",
      "original_text": "Registerbekanntmachung nach dem Umwandlungsgesetz\nNordrhein-Westfalen Amtsgericht Dortmund VR 20749 früher Amtsgericht Lünen\nSportverein Preußen Lünen e. V. – Lünen",
      "type": "Registerbekanntmachung nach dem Umwandlungsgesetz",
      "state": "Nordrhein-Westfalen",
      "amtsgericht": "Amtsgericht Dortmund",
      "registernummer": "VR 20749",
      "registerart": "VR",
      "company_name": "Sportverein Preußen Lünen e. V.",
      "company_seat": "Lünen",
      "former_amtsgericht": "Lünen",
      "details": "25.10.2024 (Bekanntmachungsdatum)\n\nNordrhein-Westfalen Amtsgericht Dortmund VR 20749 früher Amtsgericht Lünen\nRegisterbekanntmachung nach dem Umwandlungsgesetz 25.10.2024 (Eintragungsdatum)\n\nSportverein Preußen Lünen e. V.\neingetragener Verein\nLünen\n\nDen Gläubigern der an der Verschmelzung beteiligten Rechtsträger ist, wenn sie binnen sechs Monaten nach dem Tag, an dem die Eintragung der Verschmelzung in das Register des Sitzes desjenigen Rechtsträgers, dessen Gläubiger sie sind, nach § 19 Absatz 3 UmwG als bekanntgemacht gilt, ihren Anspruch nach Grund und Höhe schriftlich anmelden, Sicherheit zu leisten, soweit sie nicht Befriedigung verlangen können. Dieses Recht steht den Gläubigern jedoch nur zu, wenn sie glaubhaft machen, dass durch die Verschmelzung die Erfüllung ihrer Forderung gefährdet wird."
    },
    {
      "date": "2024-10-25",
      "id": "91755",
      "original_text": "Einreichung neuer Dokumente\nThüringen Amtsgericht Jena HRB 503312\nTrägerwerk Soziale Dienste gAG – Weimar",
      "type": "Einreichung neuer Dokumente",
      "state": "Thüringen",
      "amtsgericht": "Amtsgericht Jena",
      "registernummer": "HRB 503312",
      "registerart": "HRB",
      "company_name": "Trägerwerk Soziale Dienste gAG",
      "company_seat": "Weimar",
      "details": "25.10.2024 (Bekanntmachungsdatum)\n\nThüringen Amtsgericht Jena HRB 503312\nEinreichung neuer Dokumente\n\nTrägerwerk Soziale Dienste gAG\nAktiengesellschaft\nWeimar\n\nBekanntmachung gem. § 106 AktG: Aufgrund einer Veränderung in den Personen der Aufsichtsratsmitglieder ist durch den Vorstand eine neue Liste zum Handelsregister eingereicht worden."
    },
    {
      "date": "2024-10-25",
      "id": "91756",
      "original_text": "Löschungsankündigung\nHessen Amtsgericht Gießen HRB 8168\nsolar.sdp. UG (haftungsbeschränkt) – Grebenhain",
      "type": "Löschungsankündigung",
      "state": "Hessen",
      "amtsgericht": "Amtsgericht Gießen",
      "registernummer": "HRB 8168",
      "registerart": "HRB",
      "company_name": "solar.sdp. UG (haftungsbeschränkt)",
      "company_seat": "Grebenhain",
      "details": "25.10.2024 (Bekanntmachungsdatum)\n\nHessen Amtsgericht Gießen HRB 8168\nLöschungsankündigung\n\nsolar.sdp. UG (haftungsbeschränkt)\nGesellschaft mit beschränkter Haftung\nGrebenhain\n\nEs ist beabsichtigt, die Gesellschaft wegen Vermögenslosigkeit gemäß § 394 FamFG von Amts wegen zu löschen. Hiergegen kann innerhalb von drei Monaten nach dieser Veröffentlichung Widerspruch beim Amtsgericht Gießen eingelegt werden. Sollte Widerspruch eingelegt werden, dürfte dies nur mit Begründung erfolgversprechend sein. Insbesondere sollte vorhandenes Vermögen der Gesellschaft innerhalb der genannten Frist nachgewiesen werden."
    },
    {
      "date": "2024-10-25",
      "id": "91757",
      "original_text": "Sonstige Registerbekanntmachung\nHessen Amtsgericht Frankfurt am Main HRB 86576\nGenerali Pensionsfonds AG – Frankfurt am Main",
      "type": "Sonstige Registerbekanntmachung",
      "state": "Hessen",
      "amtsgericht": "Amtsgericht Frankfurt am Main",
      "registernummer": "HRB 86576",
      "registerart": "HRB",
      "company_name": "Generali Pensionsfonds AG",
      "company_seat": "Frankfurt am Main",
      "details": "25.10.2024 (Bekanntmachungsdatum)\n\nHessen Amtsgericht Frankfurt am Main HRB 86576\nSonstige Registerbekanntmachung 25.10.2024 (Eintragungsdatum)\n\nGenerali Pensionsfonds AG\nAktiengesellschaft\nFrankfurt am Main\n\nDurch eine Änderung in den Personen der Aufsichtsratsmitglieder ist eine Liste der Mitglieder des Aufsichtsrates zum Handelsregister eingereicht worden."
    },
    {
      "date": "2024-10-25",
      "id": "91758",
      "original_text": "Löschungsankündigung\nHessen Amtsgericht Darmstadt HRB 61126\nRochla-Holzelementmontage GmbH – Bürstadt",
      "type": "Löschungsankündigung",
      "state": "Hessen",
      "amtsgericht": "Amtsgericht Darmstadt",
      "registernummer": "HRB 61126",
      "registerart": "HRB",
      "company_name": "Rochla-Holzelementmontage GmbH",
      "company_seat": "Bürstadt",
      "details": "25.10.2024 (Bekanntmachungsdatum)\n\nHessen Amtsgericht Darmstadt HRB 61126\nLöschungsankündigung\n\nRochla-Holzelementmontage GmbH\nGesellschaft mit beschränkter Haftung\nBürstadt\n\nDas Registergericht beabsichtigt die im Handelsregister eingetragene Gesellschaft von Amts wegen nach § 394 FamFG zu löschen. Die Frist zur Erhebung eines Widerspruchs gegen die beabsichtigte Löschung wird auf 3 Monate festgesetzt."
    },
    {
      "date": "2024-10-25",
      "id": "91759",
      "original_text": "Registerbekanntmachung nach dem Umwandlungsgesetz\nHessen Amtsgericht Frankfurt am Main HRB 98023\nRFR Berlin Beteiligung GmbH – Frankfurt am Main",
      "type": "Registerbekanntmachung nach dem Umwandlungsgesetz",
      "state": "Hessen",
      "amtsgericht": "Amtsgericht Frankfurt am Main",
      "registernummer": "HRB 98023",
      "registerart": "HRB",
      "company_name": "RFR Berlin Beteiligung GmbH",
      "company_seat": "Frankfurt am Main",
      "details": "25.10.2024 (Bekanntmachungsdatum)\n\nHessen Amtsgericht Frankfurt am Main HRB 98023\nRegisterbekanntmachung nach dem Umwandlungsgesetz 25.10.2024 (Eintragungsdatum)\n\nRFR Berlin Beteiligung GmbH\nGesellschaft mit beschränkter Haftung\nFrankfurt am Main\n\nDen Gläubigern der an der Verschmelzung beteiligten Rechtsträger ist, wenn sie binnen sechs Monaten nach dem Tag, an dem die Eintragung der Verschmelzung in das Register des Sitzes desjenigen Rechtsträgers, dessen Gläubiger sie sind, nach § 19 Absatz 3 UmwG bekannt gemacht worden ist, ihren Anspruch nach Grund und Höhe schriftlich anmelden, Sicherheit zu leisten, soweit sie nicht Befriedigung verlangen können. Dieses Recht steht den Gläubigern jedoch nur zu, wenn sie glaubhaft machen, dass durch die Verschmelzung die Erfüllung ihrer Forderung gefährdet wird."
    },
    {
      "date": "2024-10-25",
      "id": "91760",
      "original_text": "Einreichung neuer Dokumente\nHessen Amtsgericht Darmstadt HRB 52491\nSEAT Deutschland GmbH – Weiterstadt",
      "type": "Einreichung neuer Dokumente",
      "state": "Hessen",
      "amtsgericht": "Amtsgericht Darmstadt",
      "registernummer": "HRB 52491",
      "registerart": "HRB",
      "company_name": "SEAT Deutschland GmbH",
      "company_seat": "Weiterstadt",
      "details": "25.10.2024 (Bekanntmachungsdatum)\n\nHessen Amtsgericht Darmstadt HRB 52491\nEinreichung neuer Dokumente\n\nSEAT Deutschland GmbH\nGesellschaft mit beschränkter Haftung\nWeiterstadt\n\nDurch eine Änderung in den Personen der Beiratsmitglieder ist eine Liste der Mitglieder des Beirates zum Handelsregister eingereicht worden."
    },
    {
      "date": "2024-10-25",
      "id": "91761",
      "original_text": "Einreichung neuer Dokumente\nHessen Amtsgericht Frankfurt am Main HRB 72567\nFLG-Automation Aktiengesellschaft – Karben",
      "type": "Einreichung neuer Dokumente",
      "state": "Hessen",
      "amtsgericht": "Amtsgericht Frankfurt am Main",
      "registernummer": "HRB 72567",
      "registerart": "HRB",
      "company_name": "FLG-Automation Aktiengesellschaft",
      "company_seat": "Karben",
      "details": "25.10.2024 (Bekanntmachungsdatum)\n\nHessen Amtsgericht Frankfurt am Main HRB 72567\nEinreichung neuer Dokumente\n\nFLG-Automation Aktiengesellschaft\nAktiengesellschaft\nKarben\n\nDurch eine Änderung in den Personen der Aufsichtsratsmitglieder ist eine Liste der Mitglieder des Aufsichtsrates zum Handelsregister eingereicht worden."
    },
    {
      "date": "2024-10-25",
      "id": "91762",
      "original_text": "Löschungsankündigung\nHessen Amtsgericht Frankfurt am Main HRB 116436\nB & D Montage Service GmbH – Frankfurt am Main",
      "type": "Löschungsankündigung",
      "state": "Hessen",
      "amtsgericht": "Amtsgericht Frankfurt am Main",
      "registernummer": "HRB 116436",
      "registerart": "HRB",
      "company_name": "B & D Montage Service GmbH",
      "company_seat": "Frankfurt am Main",
      "details": "25.10.2024 (Bekanntmachungsdatum)\n\nHessen Amtsgericht Frankfurt am Main HRB 116436\nLöschungsankündigung\n\nB & D Montage Service GmbH\nGesellschaft mit beschränkter Haftung\nFrankfurt am Main\n\nDas Registergericht beabsichtigt die im Handelsregister eingetragene Gesellschaft von Amts wegen nach § 394 FamFG zu löschen. Hiergegen kann innerhalb eines Monats nach dieser Veröffentlichung Widerspruch bei dem Amtsgericht Frankfurt am Main eingelegt werden."
    },
    {
      "date": "2024-10-25",
      "id": "91763",
      "original_text": "Sonstige Registerbekanntmachung\nHessen Amtsgericht Fritzlar VR 3955\nWaberner Dressur Club e.V. – Wabern",
      "type": "Sonstige Registerbekanntmachung",
      "state": "Hessen",
      "amtsgericht": "Amtsgericht Fritzlar",
      "registernummer": "VR 3955",
      "registerart": "VR",
      "company_name": "Waberner Dressur Club e.V.",
      "company_seat": "Wabern",
      "details": "25.10.2024 (Bekanntmachungsdatum)\n\nHessen Amtsgericht Fritzlar VR 3955\nSonstige Registerbekanntmachung 24.10.2024 (Eintragungsdatum)\n\nWaberner Dressur Club e.V.\neingetragener Verein\nWabern\n\nDurch rechtskräftigen Beschluss des Amtsgerichts Fritzlar vom 06.08.2024 ist dem Verein gemäß § 73 BGB die Rechtsfähigkeit entzogen worden."
    },
    {
      "date": "2024-10-25",
      "id": "91764",
      "original_text": "Registerbekanntmachung nach dem Umwandlungsgesetz\nHessen Amtsgericht Frankfurt am Main HRB 75354\nRFR Holding GmbH – Frankfurt am Main",
      "type": "Registerbekanntmachung nach dem Umwandlungsgesetz",
      "state": "Hessen",
      "amtsgericht": "Amtsgericht Frankfurt am Main",
      "registernummer": "HRB 75354",
      "registerart": "HRB",
      "company_name": "RFR Holding GmbH",
      "company_seat": "Frankfurt am Main",
      "details": "25.10.2024 (Bekanntmachungsdatum)\n\nHessen Amtsgericht Frankfurt am Main HRB 75354\nRegisterbekanntmachung nach dem Umwandlungsgesetz 25.10.2024 (Eintragungsdatum)\n\nRFR Holding GmbH\nGesellschaft mit beschränkter Haftung\nFrankfurt am Main\n\nDen Gläubigern der an der Verschmelzung beteiligten Rechtsträger ist, wenn sie binnen sechs Monaten nach dem Tag, an dem die Eintragung der Verschmelzung in das Register des Sitzes desjenigen Rechtsträgers, dessen Gläubiger sie sind, nach § 19 Absatz 3 UmwG bekannt gemacht worden ist, ihren Anspruch nach Grund und Höhe schriftlich anmelden, Sicherheit zu leisten, soweit sie nicht Befriedigung verlangen können. Dieses Recht steht den Gläubigern jedoch nur zu, wenn sie glaubhaft machen, dass durch die Verschmelzung die Erfüllung ihrer Forderung gefährdet wird."
    }
  ]
}