{
  "date": "2024-10-14",
  "date_of_scrape": "2024-11-27T07:21:11.256Z",
  "tool_version": "0.1.0",
  "number_of_announcements": 141,
  "announcements": [
    {
      "date": "2024-10-14",
      "original_text": "Löschungsankündigung\nHessen Amtsgericht Limburg HRB 7001\nA&C GmbH – Brechen",
      "type": "Löschungsankündigung",
      "state": "Hessen",
      "amtsgericht": "Amtsgericht Limburg",
      "registernummer": "HRB 7001",
      "registerart": "HRB",
      "company_name": "A&C GmbH",
      "company_seat": "Brechen",
      "details": "14.10.2024 (Bekanntmachungsdatum)\n\nHessen Amtsgericht Limburg HRB 7001\nLöschungsankündigung\n\nA&C GmbH\nGesellschaft mit beschränkter Haftung\nBrechen\n\nDas Registergericht beabsichtigt die im Handelsregister eingetragene Gesellschaft von Amts wegen nach § 394 FamFG zu löschen. Die Frist zur Erhebung eines Widerspruchs gegen die beabsichtigte Löschung wird auf 1 Monat festgesetzt."
    },
    {
      "date": "2024-10-14",
      "original_text": "Registerbekanntmachung nach dem Umwandlungsgesetz\nSchleswig-Holstein Amtsgericht Lübeck HRB 3274 RE\nABE Energietechnik GmbH – Barsbüttel",
      "type": "Registerbekanntmachung nach dem Umwandlungsgesetz",
      "state": "Schleswig-Holstein",
      "amtsgericht": "Amtsgericht Lübeck",
      "registernummer": "HRB 3274 RE",
      "registerart": "HRB",
      "company_name": "ABE Energietechnik GmbH",
      "company_seat": "Barsbüttel",
      "details": "14.10.2024 (Bekanntmachungsdatum)\n\nSchleswig-Holstein Amtsgericht Lübeck HRB 3274 RE\nRegisterbekanntmachung nach dem Umwandlungsgesetz 12.10.2024 (Eintragungsdatum)\n\nABE Energietechnik GmbH\nGesellschaft mit beschränkter Haftung\nBarsbüttel\n\nZu Eintragungsnummer 6 vom 12.10.2024 wird als nicht eingetragen veröffentlicht:\nDen Gläubigern der an der Verschmelzung beteiligten Rechtsträger ist, wenn sie binnen sechs Monaten nach dem Tag, an dem die Eintragung der Verschmelzung in das Register des Sitzes desjenigen Rechtsträgers, dessen Gläubiger sie sind, als bekannt gemacht gilt, ihren Anspruch nach Grund und Höhe schriftlich anmelden, Sicherheit zu leisten, soweit sie nicht Befriedigung verlangen können. Dieses Recht steht den Gläubigern jedoch nur zu, wenn sie glaubhaft machen, dass durch die Verschmelzung die Erfüllung ihrer Forderung gefährdet wird."
    },
    {
      "date": "2024-10-14",
      "original_text": "Registerbekanntmachung nach dem Umwandlungsgesetz\nSchleswig-Holstein Amtsgericht Lübeck HRB 3274 RE\nABE Energietechnik GmbH – Barsbüttel",
      "type": "Registerbekanntmachung nach dem Umwandlungsgesetz",
      "state": "Schleswig-Holstein",
      "amtsgericht": "Amtsgericht Lübeck",
      "registernummer": "HRB 3274 RE",
      "registerart": "HRB",
      "company_name": "ABE Energietechnik GmbH",
      "company_seat": "Barsbüttel",
      "details": "14.10.2024 (Bekanntmachungsdatum)\n\nSchleswig-Holstein Amtsgericht Lübeck HRB 3274 RE\nRegisterbekanntmachung nach dem Umwandlungsgesetz 12.10.2024 (Eintragungsdatum)\n\nABE Energietechnik GmbH\nGesellschaft mit beschränkter Haftung\nBarsbüttel\n\nZu Eintragungsnummer 7 vom 12.10.2024 wird als nicht eingetragen veröffentlicht:\nDen Gläubigern der an der Verschmelzung beteiligten Rechtsträger ist, wenn sie binnen sechs Monaten nach dem Tag, an dem die Eintragung der Verschmelzung in das Register des Sitzes desjenigen Rechtsträgers, dessen Gläubiger sie sind, als bekannt gemacht gilt, ihren Anspruch nach Grund und Höhe schriftlich anmelden, Sicherheit zu leisten, soweit sie nicht Befriedigung verlangen können. Dieses Recht steht den Gläubigern jedoch nur zu, wenn sie glaubhaft machen, dass durch die Verschmelzung die Erfüllung ihrer Forderung gefährdet wird."
    },
    {
      "date": "2024-10-14",
      "original_text": "Löschungsankündigung\nNordrhein-Westfalen Amtsgericht Köln HRB 116146\nANSON Baumanagement GmbH – Köln",
      "type": "Löschungsankündigung",
      "state": "Nordrhein-Westfalen",
      "amtsgericht": "Amtsgericht Köln",
      "registernummer": "HRB 116146",
      "registerart": "HRB",
      "company_name": "ANSON Baumanagement GmbH",
      "company_seat": "Köln",
      "details": "14.10.2024 (Bekanntmachungsdatum)\n\nNordrhein-Westfalen Amtsgericht Köln HRB 116146\nLöschungsankündigung\n\nANSON Baumanagement GmbH\nGesellschaft mit beschränkter Haftung\nKöln\n\nDas Registergericht beabsichtigt die Gesellschaft von Amts wegen nach § 394 FamFG zu löschen. Die Frist zur Erhebung eines Widerspruchs ist auf einen Monat festgesetzt."
    },
    {
      "date": "2024-10-14",
      "original_text": "Löschungsankündigung\nNordrhein-Westfalen Amtsgericht Köln HRB 94792\nAlolez GmbH – Köln",
      "type": "Löschungsankündigung",
      "state": "Nordrhein-Westfalen",
      "amtsgericht": "Amtsgericht Köln",
      "registernummer": "HRB 94792",
      "registerart": "HRB",
      "company_name": "Alolez GmbH",
      "company_seat": "Köln",
      "details": "14.10.2024 (Bekanntmachungsdatum)\n\nNordrhein-Westfalen Amtsgericht Köln HRB 94792\nLöschungsankündigung\n\nAlolez GmbH\nGesellschaft mit beschränkter Haftung\nKöln\n\nDas Registergericht beabsichtigt die Gesellschaft von Amts wegen nach § 394 FamFG zu löschen. Die Frist zur Erhebung eines Widerspruchs ist auf einen Monat festgesetzt."
    },
    {
      "date": "2024-10-14",
      "original_text": "Löschungsankündigung\nSachsen Amtsgericht Chemnitz HRB 35326\nAmmonitez GmbH – Chemnitz",
      "type": "Löschungsankündigung",
      "state": "Sachsen",
      "amtsgericht": "Amtsgericht Chemnitz",
      "registernummer": "HRB 35326",
      "registerart": "HRB",
      "company_name": "Ammonitez GmbH",
      "company_seat": "Chemnitz",
      "details": "14.10.2024 (Bekanntmachungsdatum)\n\nSachsen Amtsgericht Chemnitz HRB 35326\nLöschungsankündigung\n\nAmmonitez GmbH\nGesellschaft mit beschränkter Haftung\nChemnitz\n\nDas Registergericht beabsichtigt, die im Handelsregister eingetragene Gesellschaft von Amts wegen nach § 394 FamFG zu löschen. Die Frist zu Erhebung eines Widerspruchs gegen die beabsichtigte Löschung wird auf einen Monat festgesetzt."
    },
    {
      "date": "2024-10-14",
      "original_text": "Registerbekanntmachung nach dem Umwandlungsgesetz\nSachsen Amtsgericht Leipzig HRA 19547\nAndre Börngen Dienstleistungen e.K. – Leipzig",
      "type": "Registerbekanntmachung nach dem Umwandlungsgesetz",
      "state": "Sachsen",
      "amtsgericht": "Amtsgericht Leipzig",
      "registernummer": "HRA 19547",
      "registerart": "HRA",
      "company_name": "Andre Börngen Dienstleistungen e.K.",
      "company_seat": "Leipzig",
      "details": "14.10.2024 (Bekanntmachungsdatum)\n\nSachsen Amtsgericht Leipzig HRA 19547\nRegisterbekanntmachung nach dem Umwandlungsgesetz 14.10.2024 (Eintragungsdatum)\n\nAndre Börngen Dienstleistungen e.K.\nEinzelkaufmann / Einzelkauffrau\nLeipzig\n\nDen Gläubigern der an der Ausgliederung beteiligten Rechtsträger ist, wenn sie binnen sechs Monaten nach dem Tag, an dem die Eintragung der Ausgliederung in das Register des Sitzes desjenigen Rechtsträgers, dessen Gläubiger sie sind, nach § 19 Abs. 3 UmwG als bekannt gemacht gilt, ihren Anspruch nach Grund und Höhe schriftlich anmelden, Sicherheit zu leisten, soweit sie nicht Befriedigung verlangen können. Dieses Recht steht den Gläubigern jedoch nur zu, wenn sie glaubhaft machen, dass durch die Ausgliederung die Erfüllung der Forderung gefährdet wird."
    },
    {
      "date": "2024-10-14",
      "original_text": "Registerbekanntmachung nach dem Umwandlungsgesetz\nBrandenburg Amtsgericht Neuruppin HRB 14852\nAndré & Jens Hubert Immobilien GmbH – Prenzlau",
      "type": "Registerbekanntmachung nach dem Umwandlungsgesetz",
      "state": "Brandenburg",
      "amtsgericht": "Amtsgericht Neuruppin",
      "registernummer": "HRB 14852",
      "registerart": "HRB",
      "company_name": "André & Jens Hubert Immobilien GmbH",
      "company_seat": "Prenzlau",
      "details": "14.10.2024 (Bekanntmachungsdatum)\n\nBrandenburg Amtsgericht Neuruppin HRB 14852\nRegisterbekanntmachung nach dem Umwandlungsgesetz 07.10.2024 (Eintragungsdatum)\n\nAndré & Jens Hubert Immobilien GmbH\nGesellschaft mit beschränkter Haftung\nPrenzlau\n\nZu Eintragungsnummer 1 vom 07.10.2024 wird als nicht eingetragen veröffentlicht:\nDen Gläubigern der an der Umwandlung beteiligten Rechtsträger ist, wenn sie binnen sechs Monaten nach dem Tag, an dem die Eintragung der Umwandlung in das Register des Sitzes desjenigen Rechtsträgers, dessen Gläubiger sie sind, als bekannt gemacht gilt, ihren Anspruch nach Grund und Höhe schriftlich anmelden, Sicherheit zu leisten, soweit sie nicht Befriedigung verlangen können. Dieses Recht steht den Gläubigern jedoch nur zu, wenn sie glaubhaft machen, dass durch die Umwandlung die Erfüllung ihrer Forderung gefährdet wird"
    },
    {
      "date": "2024-10-14",
      "original_text": "Registerbekanntmachung nach dem Umwandlungsgesetz\nBrandenburg Amtsgericht Neuruppin GsR 129\nAndré & Jens Hubert Immobilien eGbR – Prenzlau",
      "type": "Registerbekanntmachung nach dem Umwandlungsgesetz",
      "state": "Brandenburg",
      "amtsgericht": "Amtsgericht Neuruppin",
      "registernummer": "GsR 129",
      "registerart": "GsR",
      "company_name": "André & Jens Hubert Immobilien eGbR",
      "company_seat": "Prenzlau",
      "details": "14.10.2024 (Bekanntmachungsdatum)\n\nBrandenburg Amtsgericht Neuruppin GsR 129\nRegisterbekanntmachung nach dem Umwandlungsgesetz 07.10.2024 (Eintragungsdatum)\n\nAndré & Jens Hubert Immobilien eGbR\nGesellschaft bürgerlichen Rechts\nPrenzlau\n\nZu Eintragungsnummer 2 vom 07.10.2024 wird als nicht eingetragen veröffentlicht:\nDen Gläubigern der an der Umwandlung beteiligten Rechtsträger ist, wenn sie binnen sechs Monaten nach dem Tag, an dem die Eintragung der Umwandlung in das Register des Sitzes desjenigen Rechtsträgers, dessen Gläubiger sie sind, als bekannt gemacht gilt, ihren Anspruch nach Grund und Höhe schriftlich anmelden, Sicherheit zu leisten, soweit sie nicht Befriedigung verlangen können. Dieses Recht steht den Gläubigern jedoch nur zu, wenn sie glaubhaft machen, dass durch die Umwandlung die Erfüllung ihrer Forderung gefährdet wird"
    },
    {
      "date": "2024-10-14",
      "original_text": "Einreichung neuer Dokumente\nSaarland Amtsgericht Saarbrücken HRB 11391\nAssVerm Assekuranz-Vermittlungs- Aktiengesellschaft – Saarbrücken",
      "type": "Einreichung neuer Dokumente",
      "state": "Saarland",
      "amtsgericht": "Amtsgericht Saarbrücken",
      "registernummer": "HRB 11391",
      "registerart": "HRB",
      "company_name": "AssVerm Assekuranz-Vermittlungs- Aktiengesellschaft",
      "company_seat": "Saarbrücken",
      "details": "14.10.2024 (Bekanntmachungsdatum)\n\nSaarland Amtsgericht Saarbrücken HRB 11391\nEinreichung neuer Dokumente\n\nAssVerm Assekuranz-Vermittlungs- Aktiengesellschaft\nAktiengesellschaft\nSaarbrücken\n\nDer Vorstand der Gesellschaft hat eine Liste der Mitglieder des Aufsichtsrats zum Handelsregister eingereicht (§ 106 AktG)."
    },
    {
      "date": "2024-10-14",
      "original_text": "Registerbekanntmachung nach dem Umwandlungsgesetz\nNiedersachsen Amtsgericht Osnabrück HRB 218371\nAutumn Holding GmbH – Melle",
      "type": "Registerbekanntmachung nach dem Umwandlungsgesetz",
      "state": "Niedersachsen",
      "amtsgericht": "Amtsgericht Osnabrück",
      "registernummer": "HRB 218371",
      "registerart": "HRB",
      "company_name": "Autumn Holding GmbH",
      "company_seat": "Melle",
      "details": "14.10.2024 (Bekanntmachungsdatum)\n\nNiedersachsen Amtsgericht Osnabrück HRB 218371\nRegisterbekanntmachung nach dem Umwandlungsgesetz 14.10.2024 (Eintragungsdatum)\n\nAutumn Holding GmbH\nGesellschaft mit beschränkter Haftung\nMelle\n\nDen Gläubigern der an der Verschmelzung beteiligten Rechtsträger ist, wenn sie binnen sechs Monaten nach dem Tag, an dem die Eintragung der Verschmelzung in das Register des Sitzes desjenigen Rechtsträgers, dessen Gläubiger sie sind, nach § 19  Abs.  3 UmwG als bekannt gemacht gilt, ihren Anspruch nach Grund und Höhe schriftlich anmelden, Sicherheit zu leisten, soweit sie nicht Befriedigung verlangen können. Dieses Recht steht den Gläubigern jedoch nur zu, wenn sie glaubhaft machen, dass durch die Verschmelzung die Erfüllung der Forderung gefährdet wird."
    },
    {
      "date": "2024-10-14",
      "original_text": "Löschungsankündigung\nBrandenburg Amtsgericht Frankfurt/Oder HRB 19847\nB & B Service UG (haftungsbeschränkt) – Rüdersdorf bei Berlin",
      "type": "Löschungsankündigung",
      "state": "Brandenburg",
      "amtsgericht": "Amtsgericht Frankfurt/Oder",
      "registernummer": "HRB 19847",
      "registerart": "HRB",
      "company_name": "B & B Service UG (haftungsbeschränkt)",
      "company_seat": "Rüdersdorf bei Berlin",
      "details": "14.10.2024 (Bekanntmachungsdatum)\n\nBrandenburg Amtsgericht Frankfurt/Oder HRB 19847\nLöschungsankündigung\n\nB & B Service UG (haftungsbeschränkt)\nGesellschaft mit beschränkter Haftung\nRüdersdorf bei Berlin\n\nBei der nachstehenden Gesellschaft wird das Amtslöschungsverfahren gemäß § 394 Abs. 1 FamFG eingeleitet."
    },
    {
      "date": "2024-10-14",
      "original_text": "Einreichung neuer Dokumente\nBaden-Württemberg Amtsgericht Mannheim HRB 362767\nBWG Systemhaus Gruppe Aktiengesellschaft – Ettlingen",
      "type": "Einreichung neuer Dokumente",
      "state": "Baden-Württemberg",
      "amtsgericht": "Amtsgericht Mannheim",
      "registernummer": "HRB 362767",
      "registerart": "HRB",
      "company_name": "BWG Systemhaus Gruppe Aktiengesellschaft",
      "company_seat": "Ettlingen",
      "details": "14.10.2024 (Bekanntmachungsdatum)\n\nBaden-Württemberg Amtsgericht Mannheim HRB 362767\nEinreichung neuer Dokumente\n\nBWG Systemhaus Gruppe Aktiengesellschaft\nAktiengesellschaft\nEttlingen\n\nDie Gesellschaft hat am 10.10.2024 die Liste über die Zusammensetzung des Aufsichtsrats zum Handelsregister eingereicht."
    },
    {
      "date": "2024-10-14",
      "original_text": "Registerbekanntmachung nach dem Umwandlungsgesetz\nSaarland Amtsgericht Saarbrücken HRB 101496\nBauunternehmung Laux GmbH – Losheim am See",
      "type": "Registerbekanntmachung nach dem Umwandlungsgesetz",
      "state": "Saarland",
      "amtsgericht": "Amtsgericht Saarbrücken",
      "registernummer": "HRB 101496",
      "registerart": "HRB",
      "company_name": "Bauunternehmung Laux GmbH",
      "company_seat": "Losheim am See",
      "details": "14.10.2024 (Bekanntmachungsdatum)\n\nSaarland Amtsgericht Saarbrücken HRB 101496\nRegisterbekanntmachung nach dem Umwandlungsgesetz 14.10.2024 (Eintragungsdatum)\n\nBauunternehmung Laux GmbH\nGesellschaft mit beschränkter Haftung\nLosheim am See\n\nAls nicht eingetragen wird bekannt gemacht: Den Gläubigern der an der Verschmelzung beteiligten Gesellschaften ist, wenn sie binnen sechs Monaten nach dem Tag, an dem die Eintragung der Verschmelzung in das Register des Sitzes desjenigen Rechtsträgers, dessen Gläubiger sie sind, nach § 19 Absatz 3 UmwG bekannt gemacht worden ist, ihren Anspruch nach Grund und Höhe schriftlich anmelden, Sicherheit zu leisten, soweit sie nicht Befriedigung verlangen können. Dieses Recht steht den Gläubigern jedoch nur zu, wenn sie glaubhaft machen, dass durch die Verschmelzung die Erfüllung ihrer Forderung gefährdet wird."
    },
    {
      "date": "2024-10-14",
      "original_text": "Registerbekanntmachung nach dem Umwandlungsgesetz\nBaden-Württemberg Amtsgericht Stuttgart HRA 740312\nBerna Iri e.K. – Stuttgart",
      "type": "Registerbekanntmachung nach dem Umwandlungsgesetz",
      "state": "Baden-Württemberg",
      "amtsgericht": "Amtsgericht Stuttgart",
      "registernummer": "HRA 740312",
      "registerart": "HRA",
      "company_name": "Berna Iri e.K.",
      "company_seat": "Stuttgart",
      "details": "14.10.2024 (Bekanntmachungsdatum)\n\nBaden-Württemberg Amtsgericht Stuttgart HRA 740312\nRegisterbekanntmachung nach dem Umwandlungsgesetz 14.10.2024 (Eintragungsdatum)\n\nBerna Iri e.K.\nEinzelkaufmann / Einzelkauffrau\nStuttgart\n\nAls nicht eingetragen wird bekanntgemacht:\nDen Gläubigern der an der Ausgliederung beteiligten Rechtsträger ist, wenn sie binnen sechs Monaten nach dem Tag, an dem die Eintragung der Ausgliederung in das Register des Sitzes desjenigen Rechtsträgers, dessen Gläubiger sie sind, nach § 19 Abs. 3 UmwG als bekanntgemacht gilt, ihren Anspruch nach Grund und Höhe schriftlich anmelden, Sicherheit zu leisten, soweit sie nicht Befriedigung verlangen können. Dieses Recht steht den Gläubigern jedoch nur zu, wenn sie glaubhaft machen, dass durch die Ausgliederung die Erfüllung ihrer Forderung gefährdet wird."
    },
    {
      "date": "2024-10-14",
      "original_text": "Registerbekanntmachung nach dem Umwandlungsgesetz\nHessen Amtsgericht Fritzlar HRB 11002\nBernecker Immobilien GmbH – Melsungen",
      "type": "Registerbekanntmachung nach dem Umwandlungsgesetz",
      "state": "Hessen",
      "amtsgericht": "Amtsgericht Fritzlar",
      "registernummer": "HRB 11002",
      "registerart": "HRB",
      "company_name": "Bernecker Immobilien GmbH",
      "company_seat": "Melsungen",
      "details": "14.10.2024 (Bekanntmachungsdatum)\n\nHessen Amtsgericht Fritzlar HRB 11002\nRegisterbekanntmachung nach dem Umwandlungsgesetz 14.10.2024 (Eintragungsdatum)\n\nBernecker Immobilien GmbH\nGesellschaft mit beschränkter Haftung\nMelsungen\n\nDen Gläubigern der an der Verschmelzung beteiligten Rechtsträger ist, wenn sie binnen sechs Monaten nach dem Tag, an dem die Eintragung der Verschmelzung in das Register des Sitzes desjenigen Rechtsträgers, dessen Gläubiger sie sind, nach § 19 Absatz 3 UmwG bekannt gemacht worden ist, ihren Anspruch nach Grund und Höhe schriftlich anmelden, Sicherheit zu leisten, soweit sie nicht Befriedigung verlangen können. Dieses Recht steht den Gläubigern jedoch nur zu, wenn sie glaubhaft machen, dass durch die Verschmelzung die Erfüllung ihrer Forderung gefährdet wird."
    },
    {
      "date": "2024-10-14",
      "original_text": "Einreichung neuer Dokumente\nSaarland Amtsgericht Saarbrücken HRB 64527\nBeteiligungsgesellschaft Wadern mit beschränkter Haftung – Wadern",
      "type": "Einreichung neuer Dokumente",
      "state": "Saarland",
      "amtsgericht": "Amtsgericht Saarbrücken",
      "registernummer": "HRB 64527",
      "registerart": "HRB",
      "company_name": "Beteiligungsgesellschaft Wadern mit beschränkter Haftung",
      "company_seat": "Wadern",
      "details": "14.10.2024 (Bekanntmachungsdatum)\n\nSaarland Amtsgericht Saarbrücken HRB 64527\nEinreichung neuer Dokumente\n\nBeteiligungsgesellschaft Wadern mit beschränkter Haftung\nGesellschaft mit beschränkter Haftung\nWadern\n\nDie Geschäftsführung der Gesellschaft hat eine Liste der Mitglieder des Aufsichtsrats zum Handelsregister eingereicht (§ 52 Abs. 3 Satz 2 GmbHG)."
    },
    {
      "date": "2024-10-14",
      "original_text": "Registerbekanntmachung nach dem Umwandlungsgesetz\nBaden-Württemberg Amtsgericht Mannheim HRB 336670\nBilfinger Engineering & Maintenance GmbH – Heidelberg",
      "type": "Registerbekanntmachung nach dem Umwandlungsgesetz",
      "state": "Baden-Württemberg",
      "amtsgericht": "Amtsgericht Mannheim",
      "registernummer": "HRB 336670",
      "registerart": "HRB",
      "company_name": "Bilfinger Engineering & Maintenance GmbH",
      "company_seat": "Heidelberg",
      "details": "14.10.2024 (Bekanntmachungsdatum)\n\nBaden-Württemberg Amtsgericht Mannheim HRB 336670\nRegisterbekanntmachung nach dem Umwandlungsgesetz 14.10.2024 (Eintragungsdatum)\n\nBilfinger Engineering & Maintenance GmbH\nGesellschaft mit beschränkter Haftung\nHeidelberg\n\nDen Gläubigern der an der Verschmelzung beteiligten Rechtsträger ist, wenn sie binnen sechs Monaten nach dem Tag, an dem die Eintragung der Verschmelzung in das Register des Sitzes desjenigen Rechtsträgers, dessen Gläubiger sie sind, nach § 19 Abs. 3 UmwG als bekanntgemacht gilt, ihren Anspruch nach Grund und Höhe schriftlich anmelden, Sicherheit zu leisten, soweit sie nicht Befriedigung verlangen können. Dieses Recht steht den Gläubigern jedoch nur zu, wenn sie glaubhaft machen, dass durch die Verschmelzung die Erfüllung ihrer Forderung gefährdet wird."
    },
    {
      "date": "2024-10-14",
      "original_text": "Einreichung neuer Dokumente\nNordrhein-Westfalen Amtsgericht Gelsenkirchen HRB 168\nBochum-Gelsenkirchener Bahngesellschaft mit beschränkter Haftung – Gelsenkirchen",
      "type": "Einreichung neuer Dokumente",
      "state": "Nordrhein-Westfalen",
      "amtsgericht": "Amtsgericht Gelsenkirchen",
      "registernummer": "HRB 168",
      "registerart": "HRB",
      "company_name": "Bochum-Gelsenkirchener Bahngesellschaft mit beschränkter Haftung",
      "company_seat": "Gelsenkirchen",
      "details": "14.10.2024 (Bekanntmachungsdatum)\n\nNordrhein-Westfalen Amtsgericht Gelsenkirchen HRB 168\nEinreichung neuer Dokumente 14.10.2024 (Eintragungsdatum)\n\nBochum-Gelsenkirchener Bahngesellschaft mit beschränkter Haftung\nGesellschaft mit beschränkter Haftung\nGelsenkirchen\n\nDem Registergericht ist eine neue Liste der Mitglieder des Aufsichtsrates eingereicht worden."
    },
    {
      "date": "2024-10-14",
      "original_text": "Löschungsankündigung\nBaden-Württemberg Amtsgericht Freiburg HRB 371408\nC 4 GmbH Diamant-Werkzeuge Herstellung und Vertrieb – Kehl",
      "type": "Löschungsankündigung",
      "state": "Baden-Württemberg",
      "amtsgericht": "Amtsgericht Freiburg",
      "registernummer": "HRB 371408",
      "registerart": "HRB",
      "company_name": "C 4 GmbH Diamant-Werkzeuge Herstellung und Vertrieb",
      "company_seat": "Kehl",
      "details": "14.10.2024 (Bekanntmachungsdatum)\n\nBaden-Württemberg Amtsgericht Freiburg HRB 371408\nLöschungsankündigung 14.10.2024 (Eintragungsdatum)\n\nC 4 GmbH Diamant-Werkzeuge Herstellung und Vertrieb\nGesellschaft mit beschränkter Haftung\nKehl\n\nAls nicht eingetragen wird bekanntgemacht:\nDas Gericht beabsichtigt, die Gesellschaft wegen Vermögenslosigkeit im Handelsregister von Amts wegen nach § 394 FamFG zu löschen. Die Frist zur Geltendmachung eines Widerspruchs gegen die beabsichtigte Löschung ist auf einen Monat ab Veröffentlichung bestimmt."
    },
    {
      "date": "2024-10-14",
      "original_text": "Sonstige Registerbekanntmachung\nHessen Amtsgericht Frankfurt am Main HRB 109044\nCBRE Capital Advisors GmbH – Frankfurt am Main",
      "type": "Sonstige Registerbekanntmachung",
      "state": "Hessen",
      "amtsgericht": "Amtsgericht Frankfurt am Main",
      "registernummer": "HRB 109044",
      "registerart": "HRB",
      "company_name": "CBRE Capital Advisors GmbH",
      "company_seat": "Frankfurt am Main",
      "details": "14.10.2024 (Bekanntmachungsdatum)\n\nHessen Amtsgericht Frankfurt am Main HRB 109044\nSonstige Registerbekanntmachung 14.10.2024 (Eintragungsdatum)\n\nCBRE Capital Advisors GmbH\nGesellschaft mit beschränkter Haftung\nFrankfurt am Main\n\nDen Gläubigern der Gesellschaft, deren Forderungen begründet worden sind, bevor die Eintragung der Beendigung des Vertrags in das Handelsregister nach § 10 HGB bekannt gemacht worden ist, ist vom anderen Vertragsteil Sicherheit zu leisten, wenn sie sich binnen sechs Monaten nach dieser Bekanntmachung zu diesem Zweck bei ihm melden."
    },
    {
      "date": "2024-10-14",
      "original_text": "Löschungsankündigung\nBerlin Amtsgericht Berlin (Charlottenburg) HRA 31586\nDBM Holding GmbH & Co. Bürobauten KG – Berlin",
      "type": "Löschungsankündigung",
      "state": "Berlin",
      "amtsgericht": "Amtsgericht Berlin (Charlottenburg)",
      "registernummer": "HRA 31586",
      "registerart": "HRA",
      "company_name": "DBM Holding GmbH & Co. Bürobauten KG",
      "company_seat": "Berlin",
      "details": "14.10.2024 (Bekanntmachungsdatum)\n\nBerlin Amtsgericht Berlin (Charlottenburg) HRA 31586\nLöschungsankündigung\n\nDBM Holding GmbH & Co. Bürobauten KG\nKommanditgesellschaft\nBerlin\n\nBei dem nachstehenden Unternehmen / der nachstehenden Gesellschaft wird das Amtslöschungsverfahren gemäß § 31 Abs. 2 HGB eingeleitet. Widerspruchsfrist 1 Monat"
    },
    {
      "date": "2024-10-14",
      "original_text": "Löschungsankündigung\nHessen Amtsgericht Kassel HRA 16676\nDas Spracheninstitut DSI, Inhaber Ali Dogan, e.K. – Kassel",
      "type": "Löschungsankündigung",
      "state": "Hessen",
      "amtsgericht": "Amtsgericht Kassel",
      "registernummer": "HRA 16676",
      "registerart": "HRA",
      "company_name": "Das Spracheninstitut DSI, Inhaber Ali Dogan, e.K.",
      "company_seat": "Kassel",
      "details": "14.10.2024 (Bekanntmachungsdatum)\n\nHessen Amtsgericht Kassel HRA 16676\nLöschungsankündigung\n\nDas Spracheninstitut DSI, Inhaber Ali Dogan, e.K.\nEinzelkaufmann / Einzelkauffrau\nKassel\n\nDas Registergericht bebsichtigt, die im Handelsregister eingetragene Firma von Amts wegen nach § 31 Abs. 2 HGB zu löschen. Die Firma des Einzelkaufmannes ist erloschen, weil ein Handelsgewerbe nicht mehr betrieben wird. Die Frist zur Erhebung eines Widerspruchs gegen die beabsichtigte Löschung wird auf 1 Monat festgesetzt. Dieser kann schriftilch oder zu Protokoll der Geschäftsstelle beim Registergericht des Amtsgerichts Kassel Friedrichsstraße 32-34, 34117 Kassel innerhalb von 1 Monat ab Veröffentlichung dieser Bekanntmachung erhoben werden."
    },
    {
      "date": "2024-10-14",
      "original_text": "Registerbekanntmachung nach dem Umwandlungsgesetz\nSchleswig-Holstein Amtsgericht Lübeck VR 336 OL\nDeutsches Rotes Kreuz Ortsverein Burg a.F. – Burg auf Fehmarn",
      "type": "Registerbekanntmachung nach dem Umwandlungsgesetz",
      "state": "Schleswig-Holstein",
      "amtsgericht": "Amtsgericht Lübeck",
      "registernummer": "VR 336 OL",
      "registerart": "VR",
      "company_name": "Deutsches Rotes Kreuz Ortsverein Burg a.F.",
      "company_seat": "Burg auf Fehmarn",
      "details": "14.10.2024 (Bekanntmachungsdatum)\n\nSchleswig-Holstein Amtsgericht Lübeck VR 336 OL\nRegisterbekanntmachung nach dem Umwandlungsgesetz 14.10.2024 (Eintragungsdatum)\n\nDeutsches Rotes Kreuz Ortsverein Burg a.F.\neingetragener Verein\nBurg auf Fehmarn\n\nZu Eintragungsnummer 9 vom 14.10.2024 wird als nicht eingetragen veröffentlicht: Den Gläubigern der an der Verschmelzung beteiligten Rechtsträger ist, wenn sie binnen sechs Monaten nach dem Tag, an dem die Eintragung der Verschmelzung in das Register des Sitzes desjenigen Rechtsträgers, dessen Gläubiger sie sind, als bekannt gemacht gilt, ihren Anspruch nach Grund und Höhe schriftlich anmelden, Sicherheit zu leisten, soweit sie nicht Befriedigung verlangen können. Dieses Recht steht den Gläubigern jedoch nur zu, wenn sie glaubhaft machen, dass durch die Verschmelzung die Erfüllung ihrer Forderung gefährdet wird."
    },
    {
      "date": "2024-10-14",
      "original_text": "Registerbekanntmachung nach dem Umwandlungsgesetz\nHessen Amtsgericht Offenbach am Main HRA 43452\nDirk Rönz Messedienstleistungen GmbH & Co. KG – Langen (Hessen)",
      "type": "Registerbekanntmachung nach dem Umwandlungsgesetz",
      "state": "Hessen",
      "amtsgericht": "Amtsgericht Offenbach am Main",
      "registernummer": "HRA 43452",
      "registerart": "HRA",
      "company_name": "Dirk Rönz Messedienstleistungen GmbH & Co. KG",
      "company_seat": "Langen (Hessen)",
      "details": "14.10.2024 (Bekanntmachungsdatum)\n\nHessen Amtsgericht Offenbach am Main HRA 43452\nRegisterbekanntmachung nach dem Umwandlungsgesetz 14.10.2024 (Eintragungsdatum)\n\nDirk Rönz Messedienstleistungen GmbH & Co. KG\nKommanditgesellschaft\nLangen (Hessen)\n\nDen Gläubigern der an der Ausgliederung beteiligten Rechtsträger ist, wenn sie binnen sechs Monaten nach dem Tag, an dem die Eintragung der Ausgliederung in das Register des Sitzes desjenigen Rechtsträgers, dessen Gläubiger sie sind, nach §§ 125, 19 Absatz 3 UmwG bekannt gemacht worden ist, ihren Anspruch nach Grund und Höhe schriftlich anmelden, Sicherheit zu leisten, soweit sie nicht Befriedigung verlangen können. Dieses Recht steht den Gläubigern jedoch nur zu, wenn sie glaubhaft machen, dass durch die Ausgliederung die Erfüllung ihrer Forderung gefährdet wird."
    },
    {
      "date": "2024-10-14",
      "original_text": "Registerbekanntmachung nach dem Umwandlungsgesetz\nNordrhein-Westfalen Amtsgericht Dortmund HRA 19751\nDr. Schüttert tierärztliche Hausapotheke e.K. – Dortmund",
      "type": "Registerbekanntmachung nach dem Umwandlungsgesetz",
      "state": "Nordrhein-Westfalen",
      "amtsgericht": "Amtsgericht Dortmund",
      "registernummer": "HRA 19751",
      "registerart": "HRA",
      "company_name": "Dr. Schüttert tierärztliche Hausapotheke e.K.",
      "company_seat": "Dortmund",
      "details": "14.10.2024 (Bekanntmachungsdatum)\n\nNordrhein-Westfalen Amtsgericht Dortmund HRA 19751\nRegisterbekanntmachung nach dem Umwandlungsgesetz 14.10.2024 (Eintragungsdatum)\n\nDr. Schüttert tierärztliche Hausapotheke e.K.\nEinzelkaufmann / Einzelkauffrau\nDortmund\n\nDen Gläubigern der an der Ausgliederung beteiligten Rechtsträger ist, wenn sie binnen sechs Monaten nach dem Tag, an dem die Eintragung der Ausgliederung in das Register des Sitzes derjenigen Rechtsträger deren Gläubiger sie sind, nach § 19 Absatz 3 UmwG als bekanntgemacht gilt, ihren Anspruch nach Grund und Höhe schriftlich anmelden, Sicherheit zu leisten, soweit sie nicht Befriedigung verlangen können. Dieses Recht steht den Gläubigern jedoch nur zu, wenn sie glaubhaft machen, dass durch die Ausgliederung die Erfüllung ihrer Forderung gefährdet wird."
    },
    {
      "date": "2024-10-14",
      "original_text": "Registerbekanntmachung nach dem Umwandlungsgesetz\nHamburg Amtsgericht Hamburg HRB 188913\nE&P Evers Stadtplanungsgesellschaft mbH – Hamburg",
      "type": "Registerbekanntmachung nach dem Umwandlungsgesetz",
      "state": "Hamburg",
      "amtsgericht": "Amtsgericht Hamburg",
      "registernummer": "HRB 188913",
      "registerart": "HRB",
      "company_name": "E&P Evers Stadtplanungsgesellschaft mbH",
      "company_seat": "Hamburg",
      "details": "14.10.2024 (Bekanntmachungsdatum)\n\nHamburg Amtsgericht Hamburg HRB 188913\nRegisterbekanntmachung nach dem Umwandlungsgesetz 08.10.2024 (Eintragungsdatum)\n\nE&P Evers Stadtplanungsgesellschaft mbH\nGesellschaft mit beschränkter Haftung\nHamburg\n\nAls nicht eingetragen wird bekannt gemacht:\nDen Gläubigern der an der formwechselnden Umwandlung beteiligten Gesellschaften ist, wenn sie binnen sechs Monaten nach dem Tag, an dem die Eintragung der formwechselnden Umwandlung in das Register des Sitzes desjenigen Rechtsträgers, dessen Gläubiger sie sind, nach § 19 Absatz 3 UmwG als bekannt gemacht gilt, ihren Anspruch nach Grund und Höhe schriftlich anmelden, Sicherheit zu leisten, soweit sie nicht Befriedigung verlangen können. Dieses Recht steht den Gläubigern jedoch nur zu, wenn sie glaubhaft machen, dass durch die formwechselnde Umwandlung die Erfüllung ihrer Forderung gefährdet wird."
    },
    {
      "date": "2024-10-14",
      "original_text": "Löschungsankündigung\nNordrhein-Westfalen Amtsgericht Mönchengladbach HRB 10131\nE.S.T. Energiespar- und Sicherheitstechnologien GmbH – Viersen",
      "type": "Löschungsankündigung",
      "state": "Nordrhein-Westfalen",
      "amtsgericht": "Amtsgericht Mönchengladbach",
      "registernummer": "HRB 10131",
      "registerart": "HRB",
      "company_name": "E.S.T. Energiespar- und Sicherheitstechnologien GmbH",
      "company_seat": "Viersen",
      "details": "14.10.2024 (Bekanntmachungsdatum)\n\nNordrhein-Westfalen Amtsgericht Mönchengladbach HRB 10131\nLöschungsankündigung\n\nE.S.T. Energiespar- und Sicherheitstechnologien GmbH\nGesellschaft mit beschränkter Haftung\nViersen\n\nDas Registergericht beabsichtigt, die im Handelsregister eingetragene Gesellschaft gemäß § 394 Absatz 1 FamFG wegen Vermögenslosigkeit von Amts wegen zu löschen. Gegen diese Verfügung kann Widerspruch eingelegt werden. Die Frist zur Erhebung eines Widerspruchs gegen die beabsichtigte Löschung von Amts wegen ist auf drei Monate festgesetzt."
    },
    {
      "date": "2024-10-14",
      "original_text": "Registerbekanntmachung nach dem Umwandlungsgesetz\nBaden-Württemberg Amtsgericht Stuttgart HRB 796693\nElektroschmiede GmbH – St. Johann",
      "type": "Registerbekanntmachung nach dem Umwandlungsgesetz",
      "state": "Baden-Württemberg",
      "amtsgericht": "Amtsgericht Stuttgart",
      "registernummer": "HRB 796693",
      "registerart": "HRB",
      "company_name": "Elektroschmiede GmbH",
      "company_seat": "St. Johann",
      "details": "14.10.2024 (Bekanntmachungsdatum)\n\nBaden-Württemberg Amtsgericht Stuttgart HRB 796693\nRegisterbekanntmachung nach dem Umwandlungsgesetz 14.10.2024 (Eintragungsdatum)\n\nElektroschmiede GmbH\nGesellschaft mit beschränkter Haftung\nSt. Johann\n\nAls nicht eingetragen wird bekanntgemacht:\nDen Gläubigern des an dem Formwechsel beteiligten Rechtsträgers ist, wenn sie binnen sechs Monaten nach dem Tag, an dem die Eintragung des Formwechsels in das Register des Sitzes desjenigen Rechtsträgers, dessen Gläubiger sie sind, nach § 19 Abs. 3 UmwG als bekanntgemacht gilt, ihren Anspruch nach Grund und Höhe schriftlich anmelden, Sicherheit zu leisten, soweit sie nicht Befriedigung verlangen können. Dieses Recht steht den Gläubigern jedoch nur zu, wenn sie glaubhaft machen, dass durch den Formwechsel die Erfüllung ihrer Forderung gefährdet wird."
    },
    {
      "date": "2024-10-14",
      "original_text": "Registerbekanntmachung nach dem Umwandlungsgesetz\nBaden-Württemberg Amtsgericht Stuttgart HRA 731136\nElektroschmiede GmbH & Co. KG – St. Johann",
      "type": "Registerbekanntmachung nach dem Umwandlungsgesetz",
      "state": "Baden-Württemberg",
      "amtsgericht": "Amtsgericht Stuttgart",
      "registernummer": "HRA 731136",
      "registerart": "HRA",
      "company_name": "Elektroschmiede GmbH & Co. KG",
      "company_seat": "St. Johann",
      "details": "14.10.2024 (Bekanntmachungsdatum)\n\nBaden-Württemberg Amtsgericht Stuttgart HRA 731136\nRegisterbekanntmachung nach dem Umwandlungsgesetz 14.10.2024 (Eintragungsdatum)\n\nElektroschmiede GmbH & Co. KG\nKommanditgesellschaft\nSt. Johann\n\nAls nicht eingetragen wird bekanntgemacht:\nDen Gläubigern des an dem Formwechsel beteiligten Rechtsträgers ist, wenn sie binnen sechs Monaten nach dem Tag, an dem die Eintragung des Formwechsels in das Register des Sitzes desjenigen Rechtsträgers, dessen Gläubiger sie sind, nach § 19 Abs. 3 UmwG als bekanntgemacht gilt, ihren Anspruch nach Grund und Höhe schriftlich anmelden, Sicherheit zu leisten, soweit sie nicht Befriedigung verlangen können. Dieses Recht steht den Gläubigern jedoch nur zu, wenn sie glaubhaft machen, dass durch den Formwechsel die Erfüllung ihrer Forderung gefährdet wird."
    },
    {
      "date": "2024-10-14",
      "original_text": "Löschungsankündigung\nRheinland-Pfalz Amtsgericht Montabaur HRB 25203\nEmanuel Trockenbau GmbH – Alsdorf",
      "type": "Löschungsankündigung",
      "state": "Rheinland-Pfalz",
      "amtsgericht": "Amtsgericht Montabaur",
      "registernummer": "HRB 25203",
      "registerart": "HRB",
      "company_name": "Emanuel Trockenbau GmbH",
      "company_seat": "Alsdorf",
      "details": "14.10.2024 (Bekanntmachungsdatum)\n\nRheinland-Pfalz Amtsgericht Montabaur HRB 25203\nLöschungsankündigung\n\nEmanuel Trockenbau GmbH\nGesellschaft mit beschränkter Haftung\nAlsdorf\n\nDas Registergericht beabsichtigt die Gesellschaft von Amts wegen nach § 394 FamFG zu löschen. Die Frist zur Erhebung eines Widerspruchs ist auf einen Monat festgesetzt."
    },
    {
      "date": "2024-10-14",
      "original_text": "Löschungsankündigung\nHessen Amtsgericht Frankfurt am Main HRB 98227\nFast Mondial Transporte GmbH – Frankfurt am Main",
      "type": "Löschungsankündigung",
      "state": "Hessen",
      "amtsgericht": "Amtsgericht Frankfurt am Main",
      "registernummer": "HRB 98227",
      "registerart": "HRB",
      "company_name": "Fast Mondial Transporte GmbH",
      "company_seat": "Frankfurt am Main",
      "details": "14.10.2024 (Bekanntmachungsdatum)\n\nHessen Amtsgericht Frankfurt am Main HRB 98227\nLöschungsankündigung\n\nFast Mondial Transporte GmbH\nGesellschaft mit beschränkter Haftung\nFrankfurt am Main\n\nEs ist beabsichtigt die Gesellschaft wegen Vermögenslosigkeit gemäß § 394 FamFG von Amts wegen zu löschen. Hiergegen kann innerhalb eines Monats nach dieser Veröffentlichung Widerspruch bei dem Amtsgericht Frankfurt am Main eingelegt werden."
    },
    {
      "date": "2024-10-14",
      "original_text": "Löschungsankündigung\nSachsen Amtsgericht Chemnitz HRB 19019\nFlorentina Stickereigesellschaft mbH – Plauen",
      "type": "Löschungsankündigung",
      "state": "Sachsen",
      "amtsgericht": "Amtsgericht Chemnitz",
      "registernummer": "HRB 19019",
      "registerart": "HRB",
      "company_name": "Florentina Stickereigesellschaft mbH",
      "company_seat": "Plauen",
      "details": "14.10.2024 (Bekanntmachungsdatum)\n\nSachsen Amtsgericht Chemnitz HRB 19019\nLöschungsankündigung\n\nFlorentina Stickereigesellschaft mbH\nGesellschaft mit beschränkter Haftung\nPlauen\n\nDas Registergericht beabsichtigt, die im Handelsregister eingetragene Gesellschaft von Amts wegen nach § 394 FamFG zu löschen. Die Frist zu Erhebung eines Widerspruchs gegen die beabsichtigte Löschung wird auf einen Monat festgesetzt."
    },
    {
      "date": "2024-10-14",
      "original_text": "Registerbekanntmachung nach dem Umwandlungsgesetz\nSchleswig-Holstein Amtsgericht Pinneberg HRB 15447\nForschungsdock Akademie GmbH – Schenefeld/ Krs. Pinneberg",
      "type": "Registerbekanntmachung nach dem Umwandlungsgesetz",
      "state": "Schleswig-Holstein",
      "amtsgericht": "Amtsgericht Pinneberg",
      "registernummer": "HRB 15447",
      "registerart": "HRB",
      "company_name": "Forschungsdock Akademie GmbH",
      "company_seat": "Schenefeld/ Krs. Pinneberg",
      "details": "14.10.2024 (Bekanntmachungsdatum)\n\nSchleswig-Holstein Amtsgericht Pinneberg HRB 15447\nRegisterbekanntmachung nach dem Umwandlungsgesetz 19.09.2024 (Eintragungsdatum)\n\nForschungsdock Akademie GmbH\nGesellschaft mit beschränkter Haftung\nSchenefeld/ Krs. Pinneberg\n\nAls nicht eingetragen wird veröffentlicht: Den Gläubigern der an der Verschmelzung beteiligten Rechtsträger ist, wenn sie binnen sechs Monaten nach dem Tag, an dem die Eintragung der Verschmelzung in das Register des Sitzes desjenigen Rechtsträgers, dessen Gläubiger sie sind, als bekannt gemacht gilt, ihren Anspruch nach Grund und Höhe schriftlich anmelden, Sicherheit zu leisten, soweit sie nicht Befriedigung verlangen können. Dieses Recht steht den Gläubigern jedoch nur zu, wenn sie glaubhaft machen, dass durch die Verschmelzung die Erfüllung ihrer Forderung gefährdet wird. Das Recht, Sicherheitsleistung zu verlangen, steht Gläubigern nicht zu, die im Falle der Insolvenz ein Recht auf vorzugsweise Befriedigung aus einer Deckungsmasse haben, die nach gesetzlicher Vorschrift zu ihrem Schutz errichtet und staatlich überwacht ist."
    },
    {
      "date": "2024-10-14",
      "original_text": "Registerbekanntmachung nach dem Umwandlungsgesetz\nHessen Amtsgericht Frankfurt am Main HRB 32376\nFreie Arzt- und Medizinkasse der Angehörigen der Berufsfeuerwehr und der Polizei VVaG – Frankfurt am Main",
      "type": "Registerbekanntmachung nach dem Umwandlungsgesetz",
      "state": "Hessen",
      "amtsgericht": "Amtsgericht Frankfurt am Main",
      "registernummer": "HRB 32376",
      "registerart": "HRB",
      "company_name": "Freie Arzt- und Medizinkasse der Angehörigen der Berufsfeuerwehr und der Polizei VVaG",
      "company_seat": "Frankfurt am Main",
      "details": "14.10.2024 (Bekanntmachungsdatum)\n\nHessen Amtsgericht Frankfurt am Main HRB 32376\nRegisterbekanntmachung nach dem Umwandlungsgesetz 13.10.2024 (Eintragungsdatum)\n\nFreie Arzt- und Medizinkasse der Angehörigen der Berufsfeuerwehr und der Polizei VVaG\nVersicherungsverein auf Gegenseitigkeit\nFrankfurt am Main\n\nDen Gläubigern der an der Vermögensübertragung beteiligten Rechtsträger ist, wenn sie binnen sechs Monaten nach dem Tag, an dem die Eintragung der Vermögensübertragung in das Register des Sitzes desjenigen Rechtsträgers, dessen Gläubiger sie sind, nach §§ 125, 19 Absatz 3 UmwG bekannt gemacht worden ist, ihren Anspruch nach Grund und Höhe schriftlich anmelden, Sicherheit zu leisten, soweit sie nicht Befriedigung verlangen können. Dieses Recht steht den Gläubigern jedoch nur zu, wenn sie glaubhaft machen, dass durch die Vermögensübertragung die Erfüllung ihrer Forderung gefährdet wird."
    },
    {
      "date": "2024-10-14",
      "original_text": "Registerbekanntmachung nach dem Umwandlungsgesetz\nBaden-Württemberg Amtsgericht Mannheim HRB 736340\nFreudenberg FST GmbH – Weinheim",
      "type": "Registerbekanntmachung nach dem Umwandlungsgesetz",
      "state": "Baden-Württemberg",
      "amtsgericht": "Amtsgericht Mannheim",
      "registernummer": "HRB 736340",
      "registerart": "HRB",
      "company_name": "Freudenberg FST GmbH",
      "company_seat": "Weinheim",
      "details": "14.10.2024 (Bekanntmachungsdatum)\n\nBaden-Württemberg Amtsgericht Mannheim HRB 736340\nRegisterbekanntmachung nach dem Umwandlungsgesetz 14.10.2024 (Eintragungsdatum)\n\nFreudenberg FST GmbH\nGesellschaft mit beschränkter Haftung\nWeinheim\n\nDen Gläubigern der an der Verschmelzung beteiligten Rechtsträger ist, wenn sie binnen sechs Monaten nach dem Tag, an dem die Eintragung der Verschmelzung in das Register des Sitzes desjenigen Rechtsträgers, dessen Gläubiger sie sind, nach § 19 Abs. 3 UmwG als bekanntgemacht gilt, ihren Anspruch nach Grund und Höhe schriftlich anmelden, Sicherheit zu leisten, soweit sie nicht Befriedigung verlangen können. Dieses Recht steht den Gläubigern jedoch nur zu, wenn sie glaubhaft machen, dass durch die Verschmelzung die Erfüllung ihrer Forderung gefährdet wird."
    },
    {
      "date": "2024-10-14",
      "original_text": "Löschungsankündigung\nNordrhein-Westfalen Amtsgericht Mönchengladbach HRB 18445\nG.J. - Support GmbH – Viersen",
      "type": "Löschungsankündigung",
      "state": "Nordrhein-Westfalen",
      "amtsgericht": "Amtsgericht Mönchengladbach",
      "registernummer": "HRB 18445",
      "registerart": "HRB",
      "company_name": "G.J. - Support GmbH",
      "company_seat": "Viersen",
      "details": "14.10.2024 (Bekanntmachungsdatum)\n\nNordrhein-Westfalen Amtsgericht Mönchengladbach HRB 18445\nLöschungsankündigung\n\nG.J. - Support GmbH\nGesellschaft mit beschränkter Haftung\nViersen\n\nG.J. - Support GmbH, Viersen (Amtsgericht Mönchengladbach, HRB 18445)\nDas Registergericht beabsichtigt, die im Handelsregister eingetragene Gesellschaft gemäß § 394 Absatz 1 FamFG wegen Vermögenslosigkeit von Amts wegen zu löschen. Gegen diese Verfügung kann Widerspruch eingelegt werden. Die Frist zur Erhebung eines Widerspruchs gegen die beabsichtigte Löschung von Amts wegen ist auf drei Monate festgesetzt."
    },
    {
      "date": "2024-10-14",
      "original_text": "Löschungsankündigung\nRheinland-Pfalz Amtsgericht Mainz HRB 3197\nGAWIHS GmbH – Mainz",
      "type": "Löschungsankündigung",
      "state": "Rheinland-Pfalz",
      "amtsgericht": "Amtsgericht Mainz",
      "registernummer": "HRB 3197",
      "registerart": "HRB",
      "company_name": "GAWIHS GmbH",
      "company_seat": "Mainz",
      "details": "14.10.2024 (Bekanntmachungsdatum)\n\nRheinland-Pfalz Amtsgericht Mainz HRB 3197\nLöschungsankündigung 14.10.2024 (Eintragungsdatum)\n\nGAWIHS GmbH\nGesellschaft mit beschränkter Haftung\nMainz\n\nDas Registergericht beabsichtigt die Gesellschaft von Amts wegen nach § 394 FamFG zu löschen. Die Frist zur Erhebung eines Widerspruchs ist auf einen Monat festgesetzt."
    },
    {
      "date": "2024-10-14",
      "original_text": "Löschungsankündigung\nMecklenburg-Vorpommern Amtsgericht Rostock HRB 12616\nGEPAV Verwaltungs UG (haftungsbeschränkt) – Langhagen",
      "type": "Löschungsankündigung",
      "state": "Mecklenburg-Vorpommern",
      "amtsgericht": "Amtsgericht Rostock",
      "registernummer": "HRB 12616",
      "registerart": "HRB",
      "company_name": "GEPAV Verwaltungs UG (haftungsbeschränkt)",
      "company_seat": "Langhagen",
      "details": "14.10.2024 (Bekanntmachungsdatum)\n\nMecklenburg-Vorpommern Amtsgericht Rostock HRB 12616\nLöschungsankündigung\n\nGEPAV Verwaltungs UG (haftungsbeschränkt)\nGesellschaft mit beschränkter Haftung\nLanghagen\n\nDas Registergericht beabsichtigt, die im Handelsregister eingetragene Gesellschaft von Amts wegen nach § 394 FamFG zu löschen. Die Frist zur Erhebung eines Widerspruchs gegen die beabsichtigte Löschung wird auf einen Monat festgesetzt."
    },
    {
      "date": "2024-10-14",
      "original_text": "Löschungsankündigung\nBaden-Württemberg Amtsgericht Stuttgart HRB 721261\nGEWA 5 to 1 Komplementär GmbH – Esslingen am Neckar",
      "type": "Löschungsankündigung",
      "state": "Baden-Württemberg",
      "amtsgericht": "Amtsgericht Stuttgart",
      "registernummer": "HRB 721261",
      "registerart": "HRB",
      "company_name": "GEWA 5 to 1 Komplementär GmbH",
      "company_seat": "Esslingen am Neckar",
      "details": "14.10.2024 (Bekanntmachungsdatum)\n\nBaden-Württemberg Amtsgericht Stuttgart HRB 721261\nLöschungsankündigung\n\nGEWA 5 to 1 Komplementär GmbH\nGesellschaft mit beschränkter Haftung\nEsslingen am Neckar\n\nAls nicht eingetragen wird bekanntgemacht:\nDas Gericht beabsichtigt, die Gesellschaft wegen Vermögenslosigkeit im Handelsregister von Amts wegen nach § 394 FamFG zu löschen. Die Frist zur Geltendmachung eines Widerspruchs gegen die beabsichtigte Löschung ist auf zwei Monate ab Veröffentlichung bestimmt."
    },
    {
      "date": "2024-10-14",
      "original_text": "Löschungsankündigung\nNordrhein-Westfalen Amtsgericht Dortmund HRB 14765\nGIG Göge Immobiliengesellschaft mit beschränkter Haftung – Dortmund",
      "type": "Löschungsankündigung",
      "state": "Nordrhein-Westfalen",
      "amtsgericht": "Amtsgericht Dortmund",
      "registernummer": "HRB 14765",
      "registerart": "HRB",
      "company_name": "GIG Göge Immobiliengesellschaft mit beschränkter Haftung",
      "company_seat": "Dortmund",
      "details": "14.10.2024 (Bekanntmachungsdatum)\n\nNordrhein-Westfalen Amtsgericht Dortmund HRB 14765\nLöschungsankündigung\n\nGIG Göge Immobiliengesellschaft mit beschränkter Haftung\nGesellschaft mit beschränkter Haftung\nDortmund\n\nDas Registergericht beabsichtigt die Gesellschaft von Amts wegen nach § 394 FamFG zu löschen. Die Frist zur Erhebung eines Widerspruchs ist auf zwei Monate festgesetzt."
    },
    {
      "date": "2024-10-14",
      "original_text": "Löschungsankündigung\nBerlin Amtsgericht Berlin (Charlottenburg) HRB 231530\nGasteiner Immobilien GmbH – Berlin",
      "type": "Löschungsankündigung",
      "state": "Berlin",
      "amtsgericht": "Amtsgericht Berlin (Charlottenburg)",
      "registernummer": "HRB 231530",
      "registerart": "HRB",
      "company_name": "Gasteiner Immobilien GmbH",
      "company_seat": "Berlin",
      "details": "14.10.2024 (Bekanntmachungsdatum)\n\nBerlin Amtsgericht Berlin (Charlottenburg) HRB 231530\nLöschungsankündigung\n\nGasteiner Immobilien GmbH\nGesellschaft mit beschränkter Haftung\nBerlin\n\nBei der nachstehenden Gesellschaft wird das Amtslöschungsverfahren gemäß § 394 FamFG eingeleitet. Widerspruchsfrist 6 Wochen"
    },
    {
      "date": "2024-10-14",
      "original_text": "Einreichung neuer Dokumente\nBaden-Württemberg Amtsgericht Stuttgart HRB 245982\nGebhardt Sourcing Solutions AG – Stuttgart",
      "type": "Einreichung neuer Dokumente",
      "state": "Baden-Württemberg",
      "amtsgericht": "Amtsgericht Stuttgart",
      "registernummer": "HRB 245982",
      "registerart": "HRB",
      "company_name": "Gebhardt Sourcing Solutions AG",
      "company_seat": "Stuttgart",
      "details": "14.10.2024 (Bekanntmachungsdatum)\n\nBaden-Württemberg Amtsgericht Stuttgart HRB 245982\nEinreichung neuer Dokumente\n\nGebhardt Sourcing Solutions AG\nAktiengesellschaft\nStuttgart\n\nDie Gesellschaft hat am 11.10.2024 die Liste über die Zusammensetzung des Aufsichtsrats zum Handelsregister eingereicht."
    },
    {
      "date": "2024-10-14",
      "original_text": "Registerbekanntmachung nach dem Umwandlungsgesetz\nSchleswig-Holstein Amtsgericht Kiel HRA 7266\nGiovanni L. Produktions- und Handelsgesellschaft mbH und Co. KG – Kiel",
      "type": "Registerbekanntmachung nach dem Umwandlungsgesetz",
      "state": "Schleswig-Holstein",
      "amtsgericht": "Amtsgericht Kiel",
      "registernummer": "HRA 7266",
      "registerart": "HRA",
      "company_name": "Giovanni L. Produktions- und Handelsgesellschaft mbH und Co. KG",
      "company_seat": "Kiel",
      "details": "14.10.2024 (Bekanntmachungsdatum)\n\nSchleswig-Holstein Amtsgericht Kiel HRA 7266\nRegisterbekanntmachung nach dem Umwandlungsgesetz 11.10.2024 (Eintragungsdatum)\n\nGiovanni L. Produktions- und Handelsgesellschaft mbH und Co. KG\nKommanditgesellschaft\nKiel\n\nZu Eintragungsnummer 9 vom 11.10.2024 wird als nicht eingetragen veröffentlicht: Den Gläubigern der an der Verschmelzung beteiligten Rechtsträger ist, wenn sie binnen sechs Monaten nach dem Tag, an dem die Eintragung der Verschmelzung in das Register des Sitzes desjenigen Rechtsträgers, dessen Gläubiger sie sind, nach § 19 Abs. 3 UmwG bekannt gemacht worden ist, ihren Anspruch nach Grund und Höhe schriftlich anmelden, Sicherheit zu leisten, soweit sie nicht Befriedigung verlangen können. Dieses Recht steht den Gläubigern jedoch nur zu, wenn sie glaubhaft machen, dass durch die Verschmelzung die Erfüllung ihrer Forderung gefährdet wird."
    },
    {
      "date": "2024-10-14",
      "original_text": "Registerbekanntmachung nach dem Umwandlungsgesetz\nSchleswig-Holstein Amtsgericht Kiel HRA 7266\nGiovanni L. Produktions- und Handelsgesellschaft mbH und Co. KG – Kiel",
      "type": "Registerbekanntmachung nach dem Umwandlungsgesetz",
      "state": "Schleswig-Holstein",
      "amtsgericht": "Amtsgericht Kiel",
      "registernummer": "HRA 7266",
      "registerart": "HRA",
      "company_name": "Giovanni L. Produktions- und Handelsgesellschaft mbH und Co. KG",
      "company_seat": "Kiel",
      "details": "14.10.2024 (Bekanntmachungsdatum)\n\nSchleswig-Holstein Amtsgericht Kiel HRA 7266\nRegisterbekanntmachung nach dem Umwandlungsgesetz 11.10.2024 (Eintragungsdatum)\n\nGiovanni L. Produktions- und Handelsgesellschaft mbH und Co. KG\nKommanditgesellschaft\nKiel\n\nZu Eintragungsnummer 11 vom 11.10.2024 wird als nicht eingetragen veröffentlicht: Den Gläubigern der an der Verschmelzung beteiligten Rechtsträger ist, wenn sie binnen sechs Monaten nach dem Tag, an dem die Eintragung der Verschmelzung in das Register des Sitzes desjenigen Rechtsträgers, dessen Gläubiger sie sind, nach § 19 Abs. 3 UmwG bekannt gemacht worden ist, ihren Anspruch nach Grund und Höhe schriftlich anmelden, Sicherheit zu leisten, soweit sie nicht Befriedigung verlangen können. Dieses Recht steht den Gläubigern jedoch nur zu, wenn sie glaubhaft machen, dass durch die Verschmelzung die Erfüllung ihrer Forderung gefährdet wird."
    },
    {
      "date": "2024-10-14",
      "original_text": "Registerbekanntmachung nach dem Umwandlungsgesetz\nSchleswig-Holstein Amtsgericht Kiel HRA 7266\nGiovanni L. Produktions- und Handelsgesellschaft mbH und Co. KG – Kiel",
      "type": "Registerbekanntmachung nach dem Umwandlungsgesetz",
      "state": "Schleswig-Holstein",
      "amtsgericht": "Amtsgericht Kiel",
      "registernummer": "HRA 7266",
      "registerart": "HRA",
      "company_name": "Giovanni L. Produktions- und Handelsgesellschaft mbH und Co. KG",
      "company_seat": "Kiel",
      "details": "14.10.2024 (Bekanntmachungsdatum)\n\nSchleswig-Holstein Amtsgericht Kiel HRA 7266\nRegisterbekanntmachung nach dem Umwandlungsgesetz 11.10.2024 (Eintragungsdatum)\n\nGiovanni L. Produktions- und Handelsgesellschaft mbH und Co. KG\nKommanditgesellschaft\nKiel\n\nZu Eintragungsnummer 11 vom 11.10.2024 wird als nicht eingetragen veröffentlicht: Den Gläubigern der an der Verschmelzung beteiligten Rechtsträger ist, wenn sie binnen sechs Monaten nach dem Tag, an dem die Eintragung der Verschmelzung in das Register des Sitzes desjenigen Rechtsträgers, dessen Gläubiger sie sind, nach § 19 Abs. 3 UmwG bekannt gemacht worden ist, ihren Anspruch nach Grund und Höhe schriftlich anmelden, Sicherheit zu leisten, soweit sie nicht Befriedigung verlangen können. Dieses Recht steht den Gläubigern jedoch nur zu, wenn sie glaubhaft machen, dass durch die Verschmelzung die Erfüllung ihrer Forderung gefährdet wird."
    },
    {
      "date": "2024-10-14",
      "original_text": "Löschungsankündigung\nBerlin Amtsgericht Berlin (Charlottenburg) HRB 195738\nH & S Bausanierung GmbH – Berlin",
      "type": "Löschungsankündigung",
      "state": "Berlin",
      "amtsgericht": "Amtsgericht Berlin (Charlottenburg)",
      "registernummer": "HRB 195738",
      "registerart": "HRB",
      "company_name": "H & S Bausanierung GmbH",
      "company_seat": "Berlin",
      "details": "14.10.2024 (Bekanntmachungsdatum)\n\nBerlin Amtsgericht Berlin (Charlottenburg) HRB 195738\nLöschungsankündigung\n\nH & S Bausanierung GmbH\nGesellschaft mit beschränkter Haftung\nBerlin\n\nBei der nachstehenden Gesellschaft wird das Amtslöschungsverfahren gemäß § 394 FamFG eingeleitet. Widerspruchsfrist 6 Wochen"
    },
    {
      "date": "2024-10-14",
      "original_text": "Löschungsankündigung\nNordrhein-Westfalen Amtsgericht Wuppertal HRB 25651\nH&M Güterkraftverkehr GmbH – Remscheid",
      "type": "Löschungsankündigung",
      "state": "Nordrhein-Westfalen",
      "amtsgericht": "Amtsgericht Wuppertal",
      "registernummer": "HRB 25651",
      "registerart": "HRB",
      "company_name": "H&M Güterkraftverkehr GmbH",
      "company_seat": "Remscheid",
      "details": "14.10.2024 (Bekanntmachungsdatum)\n\nNordrhein-Westfalen Amtsgericht Wuppertal HRB 25651\nLöschungsankündigung 11.10.2024 (Eintragungsdatum)\n\nH&M Güterkraftverkehr GmbH\nGesellschaft mit beschränkter Haftung\nRemscheid\n\nDas Registergericht beabsichtigt die Gesellschaft von Amts wegen nach § 394 FamFG zu löschen. Die Frist zur Erhebung eines Widerspruchs ist auf einen Monat festgesetzt."
    },
    {
      "date": "2024-10-14",
      "original_text": "Löschungsankündigung\nNordrhein-Westfalen Amtsgericht Köln HRB 106132\nHAH Dienstleistung GmbH – Burscheid",
      "type": "Löschungsankündigung",
      "state": "Nordrhein-Westfalen",
      "amtsgericht": "Amtsgericht Köln",
      "registernummer": "HRB 106132",
      "registerart": "HRB",
      "company_name": "HAH Dienstleistung GmbH",
      "company_seat": "Burscheid",
      "details": "14.10.2024 (Bekanntmachungsdatum)\n\nNordrhein-Westfalen Amtsgericht Köln HRB 106132\nLöschungsankündigung\n\nHAH Dienstleistung GmbH\nGesellschaft mit beschränkter Haftung\nBurscheid\n\nDas Registergericht beabsichtigt die Gesellschaft von Amts wegen nach § 394 FamFG zu löschen. Die Frist zur Erhebung eines Widerspruchs ist auf einen Monat festgesetzt."
    },
    {
      "date": "2024-10-14",
      "original_text": "Löschungsankündigung\nHessen Amtsgericht Darmstadt HRB 94997\nHC GmbH – Trebur",
      "type": "Löschungsankündigung",
      "state": "Hessen",
      "amtsgericht": "Amtsgericht Darmstadt",
      "registernummer": "HRB 94997",
      "registerart": "HRB",
      "company_name": "HC GmbH",
      "company_seat": "Trebur",
      "details": "14.10.2024 (Bekanntmachungsdatum)\n\nHessen Amtsgericht Darmstadt HRB 94997\nLöschungsankündigung\n\nHC GmbH\nGesellschaft mit beschränkter Haftung\nTrebur\n\nDas Registergericht beabsichtigt die im Handelsregister eingetragene Gesellschaft von Amts wegen nach § 394 FamFG zu löschen. Die Frist zur Erhebung eines Widerspruchs gegen die beabsichtigte Löschung wird auf 3 Monate festgesetzt."
    },
    {
      "date": "2024-10-14",
      "original_text": "Löschungsankündigung\nNordrhein-Westfalen Amtsgericht Wuppertal HRB 25148\nHSM Concepte UG (haftungsbeschränkt) – Wuppertal",
      "type": "Löschungsankündigung",
      "state": "Nordrhein-Westfalen",
      "amtsgericht": "Amtsgericht Wuppertal",
      "registernummer": "HRB 25148",
      "registerart": "HRB",
      "company_name": "HSM Concepte UG (haftungsbeschränkt)",
      "company_seat": "Wuppertal",
      "details": "14.10.2024 (Bekanntmachungsdatum)\n\nNordrhein-Westfalen Amtsgericht Wuppertal HRB 25148\nLöschungsankündigung 11.10.2024 (Eintragungsdatum)\n\nHSM Concepte UG (haftungsbeschränkt)\nGesellschaft mit beschränkter Haftung\nWuppertal\n\nDas Registergericht beabsichtigt die Gesellschaft von Amts wegen nach § 394 FamFG zu löschen. Die Frist zur Erhebung eines Widerspruchs ist auf einen Monat festgesetzt."
    },
    {
      "date": "2024-10-14",
      "original_text": "Löschungsankündigung\nNordrhein-Westfalen Amtsgericht Krefeld HRB 18271\nHansa Cab GmbH – Krefeld",
      "type": "Löschungsankündigung",
      "state": "Nordrhein-Westfalen",
      "amtsgericht": "Amtsgericht Krefeld",
      "registernummer": "HRB 18271",
      "registerart": "HRB",
      "company_name": "Hansa Cab GmbH",
      "company_seat": "Krefeld",
      "details": "14.10.2024 (Bekanntmachungsdatum)\n\nNordrhein-Westfalen Amtsgericht Krefeld HRB 18271\nLöschungsankündigung\n\nHansa Cab GmbH\nGesellschaft mit beschränkter Haftung\nKrefeld\n\nDas Registergericht beabsichtigt die Gesellschaft von Amts wegen nach § 394 FamFG zu löschen. Die Frist zur Erhebung eines Widerspruchs ist auf einen Monat festgesetzt."
    },
    {
      "date": "2024-10-14",
      "original_text": "Registerbekanntmachung nach dem Umwandlungsgesetz\nBaden-Württemberg Amtsgericht Ulm HRA 724790\nHeim Solar Wintersdorf GmbH & Co. KG – Ulm",
      "type": "Registerbekanntmachung nach dem Umwandlungsgesetz",
      "state": "Baden-Württemberg",
      "amtsgericht": "Amtsgericht Ulm",
      "registernummer": "HRA 724790",
      "registerart": "HRA",
      "company_name": "Heim Solar Wintersdorf GmbH & Co. KG",
      "company_seat": "Ulm",
      "details": "14.10.2024 (Bekanntmachungsdatum)\n\nBaden-Württemberg Amtsgericht Ulm HRA 724790\nRegisterbekanntmachung nach dem Umwandlungsgesetz 14.10.2024 (Eintragungsdatum)\n\nHeim Solar Wintersdorf GmbH & Co. KG\nKommanditgesellschaft\nUlm\n\nDen Gläubigern der an der Verschmelzung beteiligten Rechtsträger ist, wenn sie binnen sechs Monaten nach dem Tag, an dem die Eintragung der Verschmelzung in das Register des Sitzes desjenigen Rechtsträgers, dessen Gläubiger sie sind, nach § 19 Abs. 3 UmwG als bekanntgemacht gilt, ihren Anspruch nach Grund und Höhe schriftlich anmelden, Sicherheit zu leisten, soweit sie nicht Befriedigung verlangen können. Dieses Recht steht den Gläubigern jedoch nur zu, wenn sie glaubhaft machen, dass durch die Verschmelzung die Erfüllung ihrer Forderung gefährdet wird."
    },
    {
      "date": "2024-10-14",
      "original_text": "Registerbekanntmachung nach dem Umwandlungsgesetz\nSchleswig-Holstein Amtsgericht Kiel HRA 9875\nHolzLand Greve GmbH & Co. KG – Neumünster",
      "type": "Registerbekanntmachung nach dem Umwandlungsgesetz",
      "state": "Schleswig-Holstein",
      "amtsgericht": "Amtsgericht Kiel",
      "registernummer": "HRA 9875",
      "registerart": "HRA",
      "company_name": "HolzLand Greve GmbH & Co. KG",
      "company_seat": "Neumünster",
      "details": "14.10.2024 (Bekanntmachungsdatum)\n\nSchleswig-Holstein Amtsgericht Kiel HRA 9875\nRegisterbekanntmachung nach dem Umwandlungsgesetz 11.10.2024 (Eintragungsdatum)\n\nHolzLand Greve GmbH & Co. KG\nKommanditgesellschaft\nNeumünster\n\nZu Eintragungsnummer 2 vom 11.10.2024 wird als nicht eingetragen veröffentlicht: Den Gläubigern der an der Verschmelzung beteiligten Rechtsträger ist, wenn sie binnen sechs Monaten nach dem Tag, an dem die Eintragung der Verschmelzung in das Register des Sitzes desjenigen Rechtsträgers, dessen Gläubiger sie sind, nach § 19 Abs. 3 UmwG bekannt gemacht worden ist, ihren Anspruch nach Grund und Höhe schriftlich anmelden, Sicherheit zu leisten, soweit sie nicht Befriedigung verlangen können. Dieses Recht steht den Gläubigern jedoch nur zu, wenn sie glaubhaft machen, dass durch die Verschmelzung die Erfüllung ihrer Forderung gefährdet wird."
    },
    {
      "date": "2024-10-14",
      "original_text": "Registerbekanntmachung nach dem Umwandlungsgesetz\nNiedersachsen Amtsgericht Walsrode HRB 121479\nHugo Kuss Verwaltungs GmbH – Achim",
      "type": "Registerbekanntmachung nach dem Umwandlungsgesetz",
      "state": "Niedersachsen",
      "amtsgericht": "Amtsgericht Walsrode",
      "registernummer": "HRB 121479",
      "registerart": "HRB",
      "company_name": "Hugo Kuss Verwaltungs GmbH",
      "company_seat": "Achim",
      "details": "14.10.2024 (Bekanntmachungsdatum)\n\nNiedersachsen Amtsgericht Walsrode HRB 121479\nRegisterbekanntmachung nach dem Umwandlungsgesetz 14.10.2024 (Eintragungsdatum)\n\nHugo Kuss Verwaltungs GmbH\nGesellschaft mit beschränkter Haftung\nAchim\n\nDen Gläubigern der an der Verschmelzung beteiligten Rechtsträger ist, wenn sie binnen sechs Monaten nach dem Tag, an dem die Eintragung der Verschmelzung in das Register des Sitzes desjenigen Rechtsträgers, dessen Gläubiger sie sind, nach § 19  Abs.  3 UmwG als bekannt gemacht gilt, ihren Anspruch nach Grund und Höhe schriftlich anmelden, Sicherheit zu leisten, soweit sie nicht Befriedigung verlangen können. Dieses Recht steht den Gläubigern jedoch nur zu, wenn sie glaubhaft machen, dass durch die Verschmelzung die Erfüllung der Forderung gefährdet wird."
    },
    {
      "date": "2024-10-14",
      "original_text": "Einreichung neuer Dokumente\nBaden-Württemberg Amtsgericht Stuttgart HRB 14562\nIBM Deutschland GmbH – Ehningen",
      "type": "Einreichung neuer Dokumente",
      "state": "Baden-Württemberg",
      "amtsgericht": "Amtsgericht Stuttgart",
      "registernummer": "HRB 14562",
      "registerart": "HRB",
      "company_name": "IBM Deutschland GmbH",
      "company_seat": "Ehningen",
      "details": "14.10.2024 (Bekanntmachungsdatum)\n\nBaden-Württemberg Amtsgericht Stuttgart HRB 14562\nEinreichung neuer Dokumente\n\nIBM Deutschland GmbH\nGesellschaft mit beschränkter Haftung\nEhningen\n\nDie Gesellschaft hat am 09.10.2024 die Liste über die Zusammensetzung des Aufsichtsrats zum Handelsregister eingereicht."
    },
    {
      "date": "2024-10-14",
      "original_text": "Löschungsankündigung\nSaarland Amtsgericht Saarbrücken HRB 11363\nIWESA Präzisionstechnik GmbH – Saarbrücken",
      "type": "Löschungsankündigung",
      "state": "Saarland",
      "amtsgericht": "Amtsgericht Saarbrücken",
      "registernummer": "HRB 11363",
      "registerart": "HRB",
      "company_name": "IWESA Präzisionstechnik GmbH",
      "company_seat": "Saarbrücken",
      "details": "14.10.2024 (Bekanntmachungsdatum)\n\nSaarland Amtsgericht Saarbrücken HRB 11363\nLöschungsankündigung\n\nIWESA Präzisionstechnik GmbH\nGesellschaft mit beschränkter Haftung\nSaarbrücken\n\nEs ist beabsichtigt, die Gesellschaft von Amts wegen gemäß § 394 FamFG wegen Vermögenslosigkeit zu löschen. Gegen die Löschung von Amts wegen ist das Rechtsmittel des Widerspruchs statthaft. Der Widerspruch ist binnen einer Frist von 2 Monaten beginnend mit dem Tag dieser Veröffentlichung durch Einreichen eines Widerspruchsschreibens -schriftlich oder zur Niederschrift der Geschäftsstelle- beim Amtsgericht Saarbrücken, -zentrales Handelsregister-, Mainzerstr.178, 66121 Saarbrücken einzulegen. Der Widerspruch muss die Bezeichnung der angefochtenen Löschungsankündigung enthalten sowie die Erklärung, dass Widerspruch eingelegt wird. Er ist vom Widerspruchsführer oder seinem Bevollmächtigten zu unterzeichnen."
    },
    {
      "date": "2024-10-14",
      "original_text": "Registerbekanntmachung nach dem Umwandlungsgesetz\nHessen Amtsgericht Frankfurt am Main HRB 132091\nInternational Chemical Investors X GmbH – Frankfurt am Main",
      "type": "Registerbekanntmachung nach dem Umwandlungsgesetz",
      "state": "Hessen",
      "amtsgericht": "Amtsgericht Frankfurt am Main",
      "registernummer": "HRB 132091",
      "registerart": "HRB",
      "company_name": "International Chemical Investors X GmbH",
      "company_seat": "Frankfurt am Main",
      "details": "14.10.2024 (Bekanntmachungsdatum)\n\nHessen Amtsgericht Frankfurt am Main HRB 132091\nRegisterbekanntmachung nach dem Umwandlungsgesetz\n\nInternational Chemical Investors X GmbH\nGesellschaft mit beschränkter Haftung\nFrankfurt am Main\n\nDem Registergericht ist ein Verschmelzungsplan über die geplante grenzüberschreitende Verschmelzung der International Chemical Investors X GmbH mit Sitz in Frankfurt am Main (Gesellschaft mit beschränkter Haftung, eingetragen beim Amtsgericht Frankfurt am Main unter der HRB  132091) als übernehmender Rechtsträger mit der  International Chemical Investors II S.à r.l., eine Gesellschaft mit beschränkter Haftung (Société à responsabilité limitée) nach luxemburgischem Recht mit dem Sitz in Luxemburg/Großherzogtum Luxemburg, eingetragen im Handels- und Gesellschaftsregister Luxemburgs (Registre de Commerce et des Sociétés du Luxembourg - das RCS) unter der Nummer B89013.\na) Ein Hinweis auf die Modalitäten für die Ausübung der Rechte von Minderheitsgesellschaftern ist nicht bekannt zu machen, da es sich um die Verschmelzung einer 100-prozentigen Tochtergesellschaft auf ihre Muttergesellschaft handelt, bei der außenstehende Minderheitsgesellschafter nicht vorhanden sind.\nb) Die Rechte der Gläubiger der übernehmenden deutschen International Chemical Investors X GmbH ergeben sich aus § 305 Abs. 2 UmwG i.V.m. § 22 UmwG. Danach ist den Gläubigern der International Chemical Investors X GmbH Sicherheit zu leisten, wenn sie binnen sechs Monaten nach dem Tag, an dem die Eintragung der Verschmelzung in das Register des Sitzes der International Chemical Investors X GmbH (Frankfurt am Main) nach § 305 Abs. 2 i.V.m. § 19 Abs. 3 UmwG als bekannt gemacht gilt, ihren Anspruch nach Grund und Höhe schriftlich anmelden. Dieses Recht steht den Gläubigern jedoch nur zu, wenn sie glaubhaft machen, dass durch die Verschmelzung die Erfüllung ihrer Forderungen gefährdet wird. Die Gläubiger sind in der Bekanntmachung der Eintragung der Verschmelzung bei der International Chemical Investors X GmbH gemäß § 305 Abs. 2 i.V.m. § 22 Abs. 1 Satz 3 UmwG auf dieses Recht hinzuweisen.\nDas Recht, Sicherheitsleistung zu verlangen, steht Gläubigern nicht zu, die im Falle der Insolvenz ein Recht auf vorzugsweise Befriedigung aus einer Deckungsmasse haben, die nach gesetzlicher Vorschrift zu ihrem Schutz errichtet und staatlich überwacht ist.\nHinsichtlich des Anspruchs der Gläubiger ist unerheblich, ob dieser Anspruch auf Vertrag oder Gesetz beruht. Sicherheitsleistungen können aber nur Gläubiger eines sogenannten obligatorischen Anspruchs verlangen. § 305 Abs. 2 UmwG i.V.m. § 22 UmwG erfasst keine dinglichen Ansprüche, insoweit stellt schon der Gegenstand des dinglichen Rechts die Sicherheit dar. Der Inhalt der Forderung ist nur insoweit von Bedeutung, als diese einen Vermögenswert darstellen muss. Der zu sichernde Anspruch muss deshalb nicht notwendig unmittelbar auf Geld gerichtet sein, vielmehr besteht etwa auch bei einem Anspruch auf Lieferung von Sachen oder sonstigen Leistungen ein Sicherheitsbedürfnis hinsichtlich eines später eventuell daraus resultierenden Schadensersatzanspruches.\nDer Anspruch ist unmittelbar gegenüber der International Chemical Investors X GmbH unter deren Geschäftsanschrift Goetheplatz 5-7, 60313 Frankfurt am Main geltend zu machen. Hierzu ist eine genaue Beschreibung der dem Anspruch zu Grunde liegenden Forderung dergestalt erforderlich, dass eine Individualisierung ohne weitere Nachforschungen möglich ist. Es wird ausdrücklich darauf hingewiesen, dass die Sicherheitsleistung spätestens sechs Monate nach Bekanntmachung der Eintragung der Verschmelzung in das Handelsregister der International Chemical Investors X GmbH gefordert werden muss.\nUnter der vorgenannten Anschrift können im Übrigen vollständige Auskünfte über die Modalitäten für die Ausübung der Rechte der Gläubiger und der Minderheitsgesellschafter eingeholt werden.\nc) Gläubiger der International Chemical Investors II S.à r.l. können nach Artikel 1021-9 des Luxemburger Gesetzes über Handelsgesellschaften vom 10. August 1915 einen Anspruch auf Leistung einer Sicherheit für ihre Forderungen, die vor dem Datum der Veröffentlichung der außerordentlichen Beschlüsse der Alleingesellschafter der an der Verschmelzung beteiligten Gesellschaften entstanden sind, gegen die International Chemical Investors II S.à r.l. geltend machen, wenn sie sich innerhalb von zwei Monaten nach dem Tag der Veröffentlichung in Luxemburg, einen Antrag bei dem Richter stellen, der der Kammer des Tribunal d'Arrondissement vorsteht, die für Handelssachen in dem Bezirk zuständig ist, in dem sich der eingetragene Sitz der International Chemical Investors II S.à r.l. befindet und die wie in Eilverfahren tagt. Dieses Recht steht den Gläubigern jedoch nur zu, wenn sie glaubhaft machen, dass durch die Verschmelzung die Erfüllung ihrer Forderungen gefährdet wird und von der International Chemical Investors II S.à r.l. keine angemessene Sicherung erhalten wurde. Der Gerichtspräsident lehnt den Antrag ab, wenn der Gläubiger bereits über angemessene Sicherheiten verfügt oder wenn solche Sicherheiten in Anbetracht der finanziellen Lage der betreffenden Gesellschaft nach der Verschmelzung nicht erforderlich sind. Die Schuldnergesellschaft kann die Ablehnung des Antrags durch Zahlung an den Gläubiger herbeiführen, auch wenn es sich um ein Dauerschuldverhältnis handelt.\nUnter folgender Anschrift können Gläubiger der International Chemical Investors II S.à r.l. kostenlos vollständige Auskünfte über die Modalitäten der Ausübung ihrer Rechte einholen: 2A, Rue des Capucins, L-1313 Luxemburg, Großherzogtum Luxemburg.\nDie International Chemical Investors II S.à r.l. hat keine Minderheitsgesellschafter, sodass die Angaben über die Ausübung der Rechte der Minderheitsgesellschafter entfallen.\n\nDie Anteilsinhaber, die Gläubiger sowie die zuständigen Betriebsräte der an der grenzüberschreitenden Verschmelzung beteiligten Gesellschaften oder, soweit es keinen Betriebsrat gibt, die Arbeitnehmer der an der grenzüberschreitenden Verschmelzung beteiligten Gesellschaften, können der jeweiligen Gesellschaft spätestens fünf Arbeitstage vor dem Tag der Beurkundung Bemerkungen zum Verschmelzungsplan übermitteln (§ 308 Abs 1 Nr. 4 UmwG)."
    },
    {
      "date": "2024-10-14",
      "original_text": "Registerbekanntmachung nach dem Umwandlungsgesetz\nNordrhein-Westfalen Amtsgericht Siegen HRB 9193\nKFI Surf & Turf GmbH – Siegen",
      "type": "Registerbekanntmachung nach dem Umwandlungsgesetz",
      "state": "Nordrhein-Westfalen",
      "amtsgericht": "Amtsgericht Siegen",
      "registernummer": "HRB 9193",
      "registerart": "HRB",
      "company_name": "KFI Surf & Turf GmbH",
      "company_seat": "Siegen",
      "details": "14.10.2024 (Bekanntmachungsdatum)\n\nNordrhein-Westfalen Amtsgericht Siegen HRB 9193\nRegisterbekanntmachung nach dem Umwandlungsgesetz 14.10.2024 (Eintragungsdatum)\n\nKFI Surf & Turf GmbH\nGesellschaft mit beschränkter Haftung\nSiegen\n\nDen Gläubigern der an der Verschmelzung beteiligten Rechtsträger ist, wenn sie binnen sechs Monaten nach dem Tag, an dem die Eintragung der Verschmelzung in das Register des Sitzes desjenigen Rechtsträgers, dessen Gläubiger sie sind, nach § 19 Absatz 3 UmwG als bekanntgemacht gilt, ihren Anspruch nach Grund und Höhe schriftlich anmelden, Sicherheit zu leisten, soweit sie nicht Befriedigung verlangen können. Dieses Recht steht den Gläubigern jedoch nur zu, wenn sie glaubhaft machen, dass durch die Verschmelzung die Erfüllung ihrer Forderung gefährdet wird."
    },
    {
      "date": "2024-10-14",
      "original_text": "Registerbekanntmachung nach dem Umwandlungsgesetz\nNordrhein-Westfalen Amtsgericht Krefeld HRA 7342\nKSU Klaus Schumeckers Umweltservice e.K. – Kempen",
      "type": "Registerbekanntmachung nach dem Umwandlungsgesetz",
      "state": "Nordrhein-Westfalen",
      "amtsgericht": "Amtsgericht Krefeld",
      "registernummer": "HRA 7342",
      "registerart": "HRA",
      "company_name": "KSU Klaus Schumeckers Umweltservice e.K.",
      "company_seat": "Kempen",
      "details": "14.10.2024 (Bekanntmachungsdatum)\n\nNordrhein-Westfalen Amtsgericht Krefeld HRA 7342\nRegisterbekanntmachung nach dem Umwandlungsgesetz 14.10.2024 (Eintragungsdatum)\n\nKSU Klaus Schumeckers Umweltservice e.K.\nEinzelkaufmann / Einzelkauffrau\nKempen\n\nDen Gläubigern der an der Ausgliederung beteiligten Rechtsträger ist, wenn sie binnen sechs Monaten nach dem Tag, an dem die Eintragung der Ausgliederung in das Register des Sitzes desjenigen Rechtsträgers, dessen Gläubiger sie sind, nach § 19 Absatz 3 UmwG als bekanntgemacht gilt, ihren Anspruch nach Grund und Höhe schriftlich anmelden, Sicherheit zu leisten, soweit sie nicht Befriedigung verlangen können. Dieses Recht steht den Gläubigern jedoch nur zu, wenn sie glaubhaft machen, dass durch die Ausgliederung die Erfüllung ihrer Forderung gefährdet wird."
    },
    {
      "date": "2024-10-14",
      "original_text": "Löschungsankündigung\nBerlin Amtsgericht Berlin (Charlottenburg) HRA 23906\nKarhausen Immobilien-Auktionen Organisationsgesellschaft mbH & Co. – Berlin",
      "type": "Löschungsankündigung",
      "state": "Berlin",
      "amtsgericht": "Amtsgericht Berlin (Charlottenburg)",
      "registernummer": "HRA 23906",
      "registerart": "HRA",
      "company_name": "Karhausen Immobilien-Auktionen Organisationsgesellschaft mbH & Co.",
      "company_seat": "Berlin",
      "details": "14.10.2024 (Bekanntmachungsdatum)\n\nBerlin Amtsgericht Berlin (Charlottenburg) HRA 23906\nLöschungsankündigung\n\nKarhausen Immobilien-Auktionen Organisationsgesellschaft mbH & Co.\nKommanditgesellschaft\nBerlin\n\nBei dem nachstehenden Unternehmen / der nachstehenden Gesellschaft wird das Amtslöschungsverfahren gemäß § 31 Abs. 2 HGB eingeleitet. Widerspruchsfrist 1 Monat"
    },
    {
      "date": "2024-10-14",
      "original_text": "Registerbekanntmachung nach dem Umwandlungsgesetz\nHessen Amtsgericht Frankfurt am Main HRB 86785\nKaseya International Deutschland GmbH – Frankfurt am Main",
      "type": "Registerbekanntmachung nach dem Umwandlungsgesetz",
      "state": "Hessen",
      "amtsgericht": "Amtsgericht Frankfurt am Main",
      "registernummer": "HRB 86785",
      "registerart": "HRB",
      "company_name": "Kaseya International Deutschland GmbH",
      "company_seat": "Frankfurt am Main",
      "details": "14.10.2024 (Bekanntmachungsdatum)\n\nHessen Amtsgericht Frankfurt am Main HRB 86785\nRegisterbekanntmachung nach dem Umwandlungsgesetz 14.10.2024 (Eintragungsdatum)\n\nKaseya International Deutschland GmbH\nGesellschaft mit beschränkter Haftung\nFrankfurt am Main\n\nDen Gläubigern der an der Verschmelzung beteiligten Rechtsträger ist, wenn sie binnen sechs Monaten nach dem Tag, an dem die Eintragung der Verschmelzung in das Register des Sitzes desjenigen Rechtsträgers, dessen Gläubiger sie sind, nach § 19 Absatz 3 UmwG bekannt gemacht worden ist, ihren Anspruch nach Grund und Höhe schriftlich anmelden, Sicherheit zu leisten, soweit sie nicht Befriedigung verlangen können. Dieses Recht steht den Gläubigern jedoch nur zu, wenn sie glaubhaft machen, dass durch die Verschmelzung die Erfüllung ihrer Forderung gefährdet wird."
    },
    {
      "date": "2024-10-14",
      "original_text": "Registerbekanntmachung nach dem Umwandlungsgesetz\nSachsen-Anhalt Amtsgericht Stendal HRB 114795\nKera-Bau GmbH – Oebisfelde",
      "type": "Registerbekanntmachung nach dem Umwandlungsgesetz",
      "state": "Sachsen-Anhalt",
      "amtsgericht": "Amtsgericht Stendal",
      "registernummer": "HRB 114795",
      "registerart": "HRB",
      "company_name": "Kera-Bau GmbH",
      "company_seat": "Oebisfelde",
      "details": "14.10.2024 (Bekanntmachungsdatum)\n\nSachsen-Anhalt Amtsgericht Stendal HRB 114795\nRegisterbekanntmachung nach dem Umwandlungsgesetz 14.10.2024 (Eintragungsdatum)\n\nKera-Bau GmbH\nGesellschaft mit beschränkter Haftung\nOebisfelde\n\nNicht eingetragen:\nDen Gläubigern der an der Verschmelzung beteiligten Rechtsträger ist, wenn sie binnen sechs Monaten nach dem Tag, an dem die Eintragung der Verschmelzung nach § 19 Abs. 3 UmwG als bekanntgemacht gilt, ihren Anspruch nach Grund und Höhe schriftlich anmelden, Sicherheit zu leisten, soweit sie nicht Befriedigung verlangen können. Dieses Recht steht ihnen jedoch nur zu, wenn sie glaubhaft machen, dass durch die Verschmelzung die Erfüllung ihrer Forderung gefährdet wird."
    },
    {
      "date": "2024-10-14",
      "original_text": "Registerbekanntmachung nach dem Umwandlungsgesetz\nNordrhein-Westfalen Amtsgericht Iserlohn HRA 5572\nKlaus Frerichmann Vermietung e. K. – Iserlohn",
      "type": "Registerbekanntmachung nach dem Umwandlungsgesetz",
      "state": "Nordrhein-Westfalen",
      "amtsgericht": "Amtsgericht Iserlohn",
      "registernummer": "HRA 5572",
      "registerart": "HRA",
      "company_name": "Klaus Frerichmann Vermietung e. K.",
      "company_seat": "Iserlohn",
      "details": "14.10.2024 (Bekanntmachungsdatum)\n\nNordrhein-Westfalen Amtsgericht Iserlohn HRA 5572\nRegisterbekanntmachung nach dem Umwandlungsgesetz 09.10.2024 (Eintragungsdatum)\n\nKlaus Frerichmann Vermietung e. K.\nEinzelkaufmann / Einzelkauffrau\nIserlohn\n\nDen Gläubigern der an der Ausgliederung beteiligten Rechtsträger ist, wenn sie binnen sechs Monaten nach dem Tag, an dem die Eintragung der Ausgliederung in das Register des Sitzes desjenigen Rechtsträgers, dessen Gläubiger sie sind, nach § 19 Absatz 3 UmwG als bekanntgemacht gilt, ihren Anspruch nach Grund und Höhe schriftlich anmelden, Sicherheit zu leisten, soweit sie nicht Befriedigung verlangen können. Dieses Recht steht den Gläubigern jedoch nur zu, wenn sie glaubhaft machen, dass durch die Ausgliederung die Erfüllung ihrer Forderung gefährdet wird."
    },
    {
      "date": "2024-10-14",
      "original_text": "Registerbekanntmachung nach dem Umwandlungsgesetz\nSchleswig-Holstein Amtsgericht Kiel HRA 10275\nKletkamp Immobilien GmbH & Co. KG – Kletkamp",
      "type": "Registerbekanntmachung nach dem Umwandlungsgesetz",
      "state": "Schleswig-Holstein",
      "amtsgericht": "Amtsgericht Kiel",
      "registernummer": "HRA 10275",
      "registerart": "HRA",
      "company_name": "Kletkamp Immobilien GmbH & Co. KG",
      "company_seat": "Kletkamp",
      "details": "14.10.2024 (Bekanntmachungsdatum)\n\nSchleswig-Holstein Amtsgericht Kiel HRA 10275\nRegisterbekanntmachung nach dem Umwandlungsgesetz 02.10.2024 (Eintragungsdatum)\n\nKletkamp Immobilien GmbH & Co. KG\nKommanditgesellschaft\nKletkamp\n\nZu Eintragungsnummer 5 vom 02.10.2024 wird als nicht eingetragen veröffentlicht: Den Gläubigern ist, wenn sie binnen sechs Monaten nach dem Tag, an dem die Eintragung der Umwandlung bekannt gemacht worden ist, ihren Anspruch nach Grund und Höhe schriftlich anmelden, Sicherheit zu leisten, soweit sie nicht Befriedigung verlangen können. Dieses Recht steht den Gläubigern jedoch nur zu, wenn sie glaubhaft machen, dass durch die Umwandlung die Erfüllung ihrer Forderung gefährdet wird."
    },
    {
      "date": "2024-10-14",
      "original_text": "Registerbekanntmachung nach dem Umwandlungsgesetz\nNordrhein-Westfalen Amtsgericht Arnsberg HRA 7882\nKloppies KG – Arnsberg",
      "type": "Registerbekanntmachung nach dem Umwandlungsgesetz",
      "state": "Nordrhein-Westfalen",
      "amtsgericht": "Amtsgericht Arnsberg",
      "registernummer": "HRA 7882",
      "registerart": "HRA",
      "company_name": "Kloppies KG",
      "company_seat": "Arnsberg",
      "details": "14.10.2024 (Bekanntmachungsdatum)\n\nNordrhein-Westfalen Amtsgericht Arnsberg HRA 7882\nRegisterbekanntmachung nach dem Umwandlungsgesetz 14.10.2024 (Eintragungsdatum)\n\nKloppies KG\nKommanditgesellschaft\nArnsberg\n\nDen Gläubigern der an der Verschmelzung beteiligten Rechtsträger ist, wenn sie binnen sechs Monaten nach dem Tag, an dem die Eintragung der Verschmelzung in das Register des Sitzes desjenigen Rechtsträgers, dessen Gläubiger sie sind, nach § 19 Absatz 3 UmwG als bekanntgemacht gilt, ihren Anspruch nach Grund und Höhe schriftlich anmelden, Sicherheit zu leisten, soweit sie nicht Befriedigung verlangen können. Dieses Recht steht den Gläubigern jedoch nur zu, wenn sie glaubhaft machen, dass durch die Verschmelzung die Erfüllung ihrer Forderung gefährdet wird."
    },
    {
      "date": "2024-10-14",
      "original_text": "Registerbekanntmachung nach dem Umwandlungsgesetz\nNordrhein-Westfalen Amtsgericht Arnsberg HRB 1919\nKloppies Verwaltungs GmbH – Arnsberg",
      "type": "Registerbekanntmachung nach dem Umwandlungsgesetz",
      "state": "Nordrhein-Westfalen",
      "amtsgericht": "Amtsgericht Arnsberg",
      "registernummer": "HRB 1919",
      "registerart": "HRB",
      "company_name": "Kloppies Verwaltungs GmbH",
      "company_seat": "Arnsberg",
      "details": "14.10.2024 (Bekanntmachungsdatum)\n\nNordrhein-Westfalen Amtsgericht Arnsberg HRB 1919\nRegisterbekanntmachung nach dem Umwandlungsgesetz 14.10.2024 (Eintragungsdatum)\n\nKloppies Verwaltungs GmbH\nGesellschaft mit beschränkter Haftung\nArnsberg\n\nDen Gläubigern der an der Verschmelzung beteiligten Rechtsträger ist, wenn sie binnen sechs Monaten nach dem Tag, an dem die Eintragung der Verschmelzung in das Register des Sitzes desjenigen Rechtsträgers, dessen Gläubiger sie sind, nach § 19 Absatz 3 UmwG als bekanntgemacht gilt, ihren Anspruch nach Grund und Höhe schriftlich anmelden, Sicherheit zu leisten, soweit sie nicht Befriedigung verlangen können. Dieses Recht steht den Gläubigern jedoch nur zu, wenn sie glaubhaft machen, dass durch die Verschmelzung die Erfüllung ihrer Forderung gefährdet wird."
    },
    {
      "date": "2024-10-14",
      "original_text": "Löschungsankündigung\nNordrhein-Westfalen Amtsgericht Mönchengladbach HRB 18265\nKurzSoft UG (haftungsbeschränkt) – Mönchengladbach",
      "type": "Löschungsankündigung",
      "state": "Nordrhein-Westfalen",
      "amtsgericht": "Amtsgericht Mönchengladbach",
      "registernummer": "HRB 18265",
      "registerart": "HRB",
      "company_name": "KurzSoft UG (haftungsbeschränkt)",
      "company_seat": "Mönchengladbach",
      "details": "14.10.2024 (Bekanntmachungsdatum)\n\nNordrhein-Westfalen Amtsgericht Mönchengladbach HRB 18265\nLöschungsankündigung\n\nKurzSoft UG (haftungsbeschränkt)\nGesellschaft mit beschränkter Haftung\nMönchengladbach\n\nKurzSoft UG (haftungsbeschränkt), Mönchengladbach (Amtsgericht Mönchengladbach, HRB 18265)\nDas Registergericht beabsichtigt, die im Handelsregister eingetragene Gesellschaft gemäß § 394 Absatz 1 FamFG wegen Vermögenslosigkeit von Amts wegen zu löschen. Gegen diese Verfügung kann Widerspruch eingelegt werden. Die Frist zur Erhebung eines Widerspruchs gegen die beabsichtigte Löschung von Amts wegen ist auf drei Monate festgesetzt."
    },
    {
      "date": "2024-10-14",
      "original_text": "Registerbekanntmachung nach dem Umwandlungsgesetz\nNiedersachsen Amtsgericht Walsrode HRB 204132\nKuss Vermögensverwaltungs GmbH – Achim",
      "type": "Registerbekanntmachung nach dem Umwandlungsgesetz",
      "state": "Niedersachsen",
      "amtsgericht": "Amtsgericht Walsrode",
      "registernummer": "HRB 204132",
      "registerart": "HRB",
      "company_name": "Kuss Vermögensverwaltungs GmbH",
      "company_seat": "Achim",
      "details": "14.10.2024 (Bekanntmachungsdatum)\n\nNiedersachsen Amtsgericht Walsrode HRB 204132\nRegisterbekanntmachung nach dem Umwandlungsgesetz 14.10.2024 (Eintragungsdatum)\n\nKuss Vermögensverwaltungs GmbH\nGesellschaft mit beschränkter Haftung\nAchim\n\nDen Gläubigern der an der Verschmelzung beteiligten Rechtsträger ist, wenn sie binnen sechs Monaten nach dem Tag, an dem die Eintragung der Verschmelzung in das Register des Sitzes desjenigen Rechtsträgers, dessen Gläubiger sie sind, nach § 19  Abs.  3 UmwG als bekannt gemacht gilt, ihren Anspruch nach Grund und Höhe schriftlich anmelden, Sicherheit zu leisten, soweit sie nicht Befriedigung verlangen können. Dieses Recht steht den Gläubigern jedoch nur zu, wenn sie glaubhaft machen, dass durch die Verschmelzung die Erfüllung der Forderung gefährdet wird."
    },
    {
      "date": "2024-10-14",
      "original_text": "Einreichung neuer Dokumente\nNiedersachsen Amtsgericht Hannover HRB 6317\nLAND-DATA Beteiligungs GmbH – Hannover",
      "type": "Einreichung neuer Dokumente",
      "state": "Niedersachsen",
      "amtsgericht": "Amtsgericht Hannover",
      "registernummer": "HRB 6317",
      "registerart": "HRB",
      "company_name": "LAND-DATA Beteiligungs GmbH",
      "company_seat": "Hannover",
      "details": "14.10.2024 (Bekanntmachungsdatum)\n\nNiedersachsen Amtsgericht Hannover HRB 6317\nEinreichung neuer Dokumente\n\nLAND-DATA Beteiligungs GmbH\nGesellschaft mit beschränkter Haftung\nHannover\n\nDie Liste der Mitglieder des Aufsichtsrats wurde beim Registergericht eingereicht."
    },
    {
      "date": "2024-10-14",
      "original_text": "Registerbekanntmachung nach dem Umwandlungsgesetz\nSachsen Amtsgericht Leipzig HRB 40636\nLEB Energy Beteiligung GmbH – Leipzig",
      "type": "Registerbekanntmachung nach dem Umwandlungsgesetz",
      "state": "Sachsen",
      "amtsgericht": "Amtsgericht Leipzig",
      "registernummer": "HRB 40636",
      "registerart": "HRB",
      "company_name": "LEB Energy Beteiligung GmbH",
      "company_seat": "Leipzig",
      "details": "14.10.2024 (Bekanntmachungsdatum)\n\nSachsen Amtsgericht Leipzig HRB 40636\nRegisterbekanntmachung nach dem Umwandlungsgesetz 14.10.2024 (Eintragungsdatum)\n\nLEB Energy Beteiligung GmbH\nGesellschaft mit beschränkter Haftung\nLeipzig\n\nDen Gläubigern der an der Verschmelzung beteiligten Rechtsträger ist, wenn sie binnen sechs Monaten nach dem Tag, an dem die Eintragung der Verschmelzung in das Register des Sitzes desjenigen Rechtsträgers, dessen Gläubiger sie sind, nach § 19 Abs. 3 UmwG als bekannt gemacht gilt, ihren Anspruch nach Grund und Höhe schriftlich anmelden, Sicherheit zu leisten, soweit sie nicht Befriedigung verlangen können. Dieses Recht steht den Gläubigern jedoch nur zu, wenn sie glaubhaft machen, dass durch die Verschmelzung die Erfüllung der Forderung gefährdet wird."
    },
    {
      "date": "2024-10-14",
      "original_text": "Registerbekanntmachung nach dem Umwandlungsgesetz\nSachsen Amtsgericht Leipzig HRB 40634\nLEB Selection 10 GmbH – Leipzig",
      "type": "Registerbekanntmachung nach dem Umwandlungsgesetz",
      "state": "Sachsen",
      "amtsgericht": "Amtsgericht Leipzig",
      "registernummer": "HRB 40634",
      "registerart": "HRB",
      "company_name": "LEB Selection 10 GmbH",
      "company_seat": "Leipzig",
      "details": "14.10.2024 (Bekanntmachungsdatum)\n\nSachsen Amtsgericht Leipzig HRB 40634\nRegisterbekanntmachung nach dem Umwandlungsgesetz 14.10.2024 (Eintragungsdatum)\n\nLEB Selection 10 GmbH\nGesellschaft mit beschränkter Haftung\nLeipzig\n\nDen Gläubigern der an der Verschmelzung beteiligten Rechtsträger ist, wenn sie binnen sechs Monaten nach dem Tag, an dem die Eintragung der Verschmelzung in das Register des Sitzes desjenigen Rechtsträgers, dessen Gläubiger sie sind, nach § 19 Abs. 3 UmwG als bekannt gemacht gilt, ihren Anspruch nach Grund und Höhe schriftlich anmelden, Sicherheit zu leisten, soweit sie nicht Befriedigung verlangen können. Dieses Recht steht den Gläubigern jedoch nur zu, wenn sie glaubhaft machen, dass durch die Verschmelzung die Erfüllung der Forderung gefährdet wird."
    },
    {
      "date": "2024-10-14",
      "original_text": "Registerbekanntmachung nach dem Umwandlungsgesetz\nSaarland Amtsgericht Saarbrücken HRB 17894\nLM Verwaltungs-GmbH – Blieskastel",
      "type": "Registerbekanntmachung nach dem Umwandlungsgesetz",
      "state": "Saarland",
      "amtsgericht": "Amtsgericht Saarbrücken",
      "registernummer": "HRB 17894",
      "registerart": "HRB",
      "company_name": "LM Verwaltungs-GmbH",
      "company_seat": "Blieskastel",
      "details": "14.10.2024 (Bekanntmachungsdatum)\n\nSaarland Amtsgericht Saarbrücken HRB 17894\nRegisterbekanntmachung nach dem Umwandlungsgesetz\n\nLM Verwaltungs-GmbH\nGesellschaft mit beschränkter Haftung\nBlieskastel\n\nAls bekannt zu machende Angaben wird mitgeteilt:\n\nFür den geplanten grenzüberschreitenden Formwechsel durch Verlegung ihres satzungsmäßigen Sitzes nach Österreich und den identitätswahrenden Wechsel in eine Gesellschaft österreichischen Rechts mit beschränkter Haftung mit der Firma LM Verwaltungs-GmbH Österreich LM Pharma, mit satzungsmäßigem Sitz in Salzburg/Österreich und einem Stammkapital von 25.000,00 EUR  werden gemäß § 336 UmwG i.V.m. § 308 UmwG i.V.m.§  § 10 HGB folgende Angaben bekannt gemacht:\n\n1. Der Formwechselplan vom 29.07.2024, abgeändert und ergänzt am 04.09.2024 und am 01.10.2024, wurde beim Handelsregister am 29.07.2024 bzw. am 08.09.2024 und am 07.10.2024 eingereicht.\n\n2. Die  LM Verwaltungs-GmbH ist eine Gesellschaft mit beschränkter Haftung nach dem Recht der Bundesrepublik Deutschlands. Sie hat ihren Sitz in 66440 Blieskastel, Bliesgaustr. 85 a und ist im Handelsregister des Amtsgerichts Saarbrücken unter HRB 17894 eingetragen.\n\n4. Es wird folgender Hinweis an die Anteilsinhaber und Gläubiger sowie - mangels Bestehens eines Betriebsrats - an die Arbeitnehmer der an dem grenzüberschreitenden Formwechsel beteiligten Gesellschaft, bekannt gemacht und zwar, dass sie der jeweiligen Gesellschaft spätestens fünf Arbeitstage vor dem Tag der Gesellschafterversammlung (bzw. dem Tag der Beurkundung) Bemerkungen zum Formwechselplan übermitteln können.\n\nBemerkungen können postalisch an folgende Adresse gerichtet werden:  66440 Blieskastel, Bliesgaustr. 85 a"
    },
    {
      "date": "2024-10-14",
      "original_text": "Registerbekanntmachung nach dem Umwandlungsgesetz\nSachsen Amtsgericht Leipzig HRB 36347\nLSV Europe GmbH – Leipzig",
      "type": "Registerbekanntmachung nach dem Umwandlungsgesetz",
      "state": "Sachsen",
      "amtsgericht": "Amtsgericht Leipzig",
      "registernummer": "HRB 36347",
      "registerart": "HRB",
      "company_name": "LSV Europe GmbH",
      "company_seat": "Leipzig",
      "details": "14.10.2024 (Bekanntmachungsdatum)\n\nSachsen Amtsgericht Leipzig HRB 36347\nRegisterbekanntmachung nach dem Umwandlungsgesetz 14.10.2024 (Eintragungsdatum)\n\nLSV Europe GmbH\nGesellschaft mit beschränkter Haftung\nLeipzig\n\nDen Gläubigern der an der Ausgliederung beteiligten Rechtsträger ist, wenn sie binnen sechs Monaten nach dem Tag, an dem die Eintragung der Ausgliederung in das Register des Sitzes desjenigen Rechtsträgers, dessen Gläubiger sie sind, nach § 19 Abs. 3 UmwG als bekannt gemacht gilt, ihren Anspruch nach Grund und Höhe schriftlich anmelden, Sicherheit zu leisten, soweit sie nicht Befriedigung verlangen können. Dieses Recht steht den Gläubigern jedoch nur zu, wenn sie glaubhaft machen, dass durch die Ausgliederung die Erfüllung der Forderung gefährdet wird."
    },
    {
      "date": "2024-10-14",
      "original_text": "Registerbekanntmachung nach dem Umwandlungsgesetz\nSaarland Amtsgericht Saarbrücken HRB 64185\nLaux Betonfertigteile GmbH – Losheim am See",
      "type": "Registerbekanntmachung nach dem Umwandlungsgesetz",
      "state": "Saarland",
      "amtsgericht": "Amtsgericht Saarbrücken",
      "registernummer": "HRB 64185",
      "registerart": "HRB",
      "company_name": "Laux Betonfertigteile GmbH",
      "company_seat": "Losheim am See",
      "details": "14.10.2024 (Bekanntmachungsdatum)\n\nSaarland Amtsgericht Saarbrücken HRB 64185\nRegisterbekanntmachung nach dem Umwandlungsgesetz 14.10.2024 (Eintragungsdatum)\n\nLaux Betonfertigteile GmbH\nGesellschaft mit beschränkter Haftung\nLosheim am See\n\nAls nicht eingetragen wird bekannt gemacht: Den Gläubigern der an der Verschmelzung beteiligten Gesellschaften ist, wenn sie binnen sechs Monaten nach dem Tag, an dem die Eintragung der Verschmelzung in das Register des Sitzes desjenigen Rechtsträgers, dessen Gläubiger sie sind, nach § 19 Absatz 3 UmwG bekannt gemacht worden ist, ihren Anspruch nach Grund und Höhe schriftlich anmelden, Sicherheit zu leisten, soweit sie nicht Befriedigung verlangen können. Dieses Recht steht den Gläubigern jedoch nur zu, wenn sie glaubhaft machen, dass durch die Verschmelzung die Erfüllung ihrer Forderung gefährdet wird."
    },
    {
      "date": "2024-10-14",
      "original_text": "Registerbekanntmachung nach dem Umwandlungsgesetz\nBerlin Amtsgericht Berlin (Charlottenburg) HRB 231902\nLeipziger Zinshaus GmbH – Berlin",
      "type": "Registerbekanntmachung nach dem Umwandlungsgesetz",
      "state": "Berlin",
      "amtsgericht": "Amtsgericht Berlin (Charlottenburg)",
      "registernummer": "HRB 231902",
      "registerart": "HRB",
      "company_name": "Leipziger Zinshaus GmbH",
      "company_seat": "Berlin",
      "details": "14.10.2024 (Bekanntmachungsdatum)\n\nBerlin Amtsgericht Berlin (Charlottenburg) HRB 231902\nRegisterbekanntmachung nach dem Umwandlungsgesetz 11.10.2024 (Eintragungsdatum)\n\nLeipziger Zinshaus GmbH\nGesellschaft mit beschränkter Haftung\nBerlin\n\nZu Eintragungsnummer 3 vom 11.10.2024 wird als nicht eingetragen veröffentlicht:Den Gläubigern der an der Verschmelzung beteiligten Rechtsträger ist, wenn sie binnen sechs Monaten nach dem Tag, an dem die Eintragung der Verschmelzung in das Register des Sitzes desjenigen Rechtsträgers, dessen Gläubiger sie sind, als bekannt gemacht gilt, ihren Anspruch nach Grund und Höhe schriftlich anmelden, Sicherheit zu leisten, soweit sie nicht Befriedigung verlangen können. Dieses Recht steht den Gläubigern jedoch nur zu, wenn sie glaubhaft machen, dass durch die Verschmelzung die Erfüllung ihrer Forderung gefährdet wird. Das Recht, Sicherheitsleistung zu verlangen, steht Gläubigern nicht zu, die im Falle der Insolvenz ein Recht auf vorzugsweise Befriedigung aus einer Deckungsmasse haben, die nach gesetzlicher Vorschrift zu ihrem Schutz errichtet und staatlich überwacht ist."
    },
    {
      "date": "2024-10-14",
      "original_text": "Löschungsankündigung\nBremen Amtsgericht Bremen HRB 36923\nMALIN FLOORS GERMANY GmbH – Bremen",
      "type": "Löschungsankündigung",
      "state": "Bremen",
      "amtsgericht": "Amtsgericht Bremen",
      "registernummer": "HRB 36923",
      "registerart": "HRB",
      "company_name": "MALIN FLOORS GERMANY GmbH",
      "company_seat": "Bremen",
      "details": "14.10.2024 (Bekanntmachungsdatum)\n\nBremen Amtsgericht Bremen HRB 36923\nLöschungsankündigung\n\nMALIN FLOORS GERMANY GmbH\nGesellschaft mit beschränkter Haftung\nBremen\n\nEs ist beabsichtigt die im Handelsregister eingetragene Gesellschaft von Amts wegen gemäß § 394 FamFG zu löschen. Gegen die Löschung kann beim AG Bremen schriftlich oder zu Protokoll der Geschäftsstelle Widerspruch eingelegt werden. Widerspruchsfrist 4 Wochen."
    },
    {
      "date": "2024-10-14",
      "original_text": "Löschungsankündigung\nBrandenburg Amtsgericht Potsdam HRB 31629\nMaia - Tea - Kubish GmbH – Falkensee",
      "type": "Löschungsankündigung",
      "state": "Brandenburg",
      "amtsgericht": "Amtsgericht Potsdam",
      "registernummer": "HRB 31629",
      "registerart": "HRB",
      "company_name": "Maia - Tea - Kubish GmbH",
      "company_seat": "Falkensee",
      "details": "14.10.2024 (Bekanntmachungsdatum)\n\nBrandenburg Amtsgericht Potsdam HRB 31629\nLöschungsankündigung\n\nMaia - Tea - Kubish GmbH\nGesellschaft mit beschränkter Haftung\nFalkensee\n\nBei der nachstehenden Gesellschaft wird das Amtslöschungsverfahren gemäß § 394 FamFG eingeleitet. Widerspruchsfrist 8 Wochen."
    },
    {
      "date": "2024-10-14",
      "original_text": "Registerbekanntmachung nach dem Umwandlungsgesetz\nHessen Amtsgericht Offenbach am Main HRB 56915\nMainhatten Automobile GmbH – Offenbach am Main",
      "type": "Registerbekanntmachung nach dem Umwandlungsgesetz",
      "state": "Hessen",
      "amtsgericht": "Amtsgericht Offenbach am Main",
      "registernummer": "HRB 56915",
      "registerart": "HRB",
      "company_name": "Mainhatten Automobile GmbH",
      "company_seat": "Offenbach am Main",
      "details": "14.10.2024 (Bekanntmachungsdatum)\n\nHessen Amtsgericht Offenbach am Main HRB 56915\nRegisterbekanntmachung nach dem Umwandlungsgesetz 14.10.2024 (Eintragungsdatum)\n\nMainhatten Automobile GmbH\nGesellschaft mit beschränkter Haftung\nOffenbach am Main\n\nDen Gläubigern der an der Ausgliederung beteiligten Rechtsträger ist, wenn sie binnen sechs Monaten nach dem Tag, an dem die Eintragung der Ausgliederung in das Register des Sitzes desjenigen Rechtsträgers, dessen Gläubiger sie sind, nach §§ 125, 19 Absatz 3 UmwG bekannt gemacht worden ist, ihren Anspruch nach Grund und Höhe schriftlich anmelden, Sicherheit zu leisten, soweit sie nicht Befriedigung verlangen können. Dieses Recht steht den Gläubigern jedoch nur zu, wenn sie glaubhaft machen, dass durch die Ausgliederung die Erfüllung ihrer Forderung gefährdet wird."
    },
    {
      "date": "2024-10-14",
      "original_text": "Einreichung neuer Dokumente\nBaden-Württemberg Amtsgericht Mannheim HRB 7501\nMannheimer Versicherung Aktiengesellschaft – Mannheim",
      "type": "Einreichung neuer Dokumente",
      "state": "Baden-Württemberg",
      "amtsgericht": "Amtsgericht Mannheim",
      "registernummer": "HRB 7501",
      "registerart": "HRB",
      "company_name": "Mannheimer Versicherung Aktiengesellschaft",
      "company_seat": "Mannheim",
      "details": "14.10.2024 (Bekanntmachungsdatum)\n\nBaden-Württemberg Amtsgericht Mannheim HRB 7501\nEinreichung neuer Dokumente\n\nMannheimer Versicherung Aktiengesellschaft\nAktiengesellschaft\nMannheim\n\nDie Gesellschaft hat am 11.10.2024 die Liste über die Zusammensetzung des Aufsichtsrats zum Handelsregister eingereicht."
    },
    {
      "date": "2024-10-14",
      "original_text": "Registerbekanntmachung nach dem Umwandlungsgesetz\nNordrhein-Westfalen Amtsgericht Lemgo HRB 11412\nMarliani Naturdärme GmbH – Detmold",
      "type": "Registerbekanntmachung nach dem Umwandlungsgesetz",
      "state": "Nordrhein-Westfalen",
      "amtsgericht": "Amtsgericht Lemgo",
      "registernummer": "HRB 11412",
      "registerart": "HRB",
      "company_name": "Marliani Naturdärme GmbH",
      "company_seat": "Detmold",
      "details": "14.10.2024 (Bekanntmachungsdatum)\n\nNordrhein-Westfalen Amtsgericht Lemgo HRB 11412\nRegisterbekanntmachung nach dem Umwandlungsgesetz 14.10.2024 (Eintragungsdatum)\n\nMarliani Naturdärme GmbH\nGesellschaft mit beschränkter Haftung\nDetmold\n\nDen Gläubigern der an der Verschmelzung beteiligten Rechtsträger ist, wenn sie binnen sechs Monaten nach dem Tag, an dem die Eintragung der Verschmelzung in das Register des Sitzes desjenigen Rechtsträgers, dessen Gläubiger sie sind, nach § 19 Absatz 3 UmwG als bekanntgemacht gilt, ihren Anspruch nach Grund und Höhe schriftlich anmelden, Sicherheit zu leisten, soweit sie nicht Befriedigung verlangen können. Dieses Recht steht den Gläubigern jedoch nur zu, wenn sie glaubhaft machen, dass durch die Verschmelzung die Erfüllung ihrer Forderung gefährdet wird."
    },
    {
      "date": "2024-10-14",
      "original_text": "Registerbekanntmachung nach dem Umwandlungsgesetz\nHamburg Amtsgericht Hamburg HRB 119653\nMartens Deutsche Telekabel GmbH – Hamburg",
      "type": "Registerbekanntmachung nach dem Umwandlungsgesetz",
      "state": "Hamburg",
      "amtsgericht": "Amtsgericht Hamburg",
      "registernummer": "HRB 119653",
      "registerart": "HRB",
      "company_name": "Martens Deutsche Telekabel GmbH",
      "company_seat": "Hamburg",
      "details": "14.10.2024 (Bekanntmachungsdatum)\n\nHamburg Amtsgericht Hamburg HRB 119653\nRegisterbekanntmachung nach dem Umwandlungsgesetz 14.10.2024 (Eintragungsdatum)\n\nMartens Deutsche Telekabel GmbH\nGesellschaft mit beschränkter Haftung\nHamburg\n\nAls nicht eingetragen wird bekannt gemacht:\nDen Gläubigern der an der Verschmelzung beteiligten Gesellschaften ist, wenn sie binnen sechs Monaten nach dem Tag, an dem die Eintragung der Verschmelzung in das Register des Sitzes derjenigen Rechtsträger deren Gläubiger sie sind, nach § 19 Absatz 3 UmwG als bekannt gemacht gilt, ihren Anspruch nach Grund und Höhe schriftlich anmelden, Sicherheit zu leisten, soweit sie nicht Befriedigung verlangen können. Dieses Recht steht den Gläubigern jedoch nur zu, wenn sie glaubhaft machen, dass durch die Verschmelzung die Erfüllung ihrer Forderung gefährdet wird."
    },
    {
      "date": "2024-10-14",
      "original_text": "Registerbekanntmachung nach dem Umwandlungsgesetz\nBaden-Württemberg Amtsgericht Stuttgart HRA 740310\nMarvin Lehmann e.K. – Stuttgart",
      "type": "Registerbekanntmachung nach dem Umwandlungsgesetz",
      "state": "Baden-Württemberg",
      "amtsgericht": "Amtsgericht Stuttgart",
      "registernummer": "HRA 740310",
      "registerart": "HRA",
      "company_name": "Marvin Lehmann e.K.",
      "company_seat": "Stuttgart",
      "details": "14.10.2024 (Bekanntmachungsdatum)\n\nBaden-Württemberg Amtsgericht Stuttgart HRA 740310\nRegisterbekanntmachung nach dem Umwandlungsgesetz 14.10.2024 (Eintragungsdatum)\n\nMarvin Lehmann e.K.\nEinzelkaufmann / Einzelkauffrau\nStuttgart\n\nDen Gläubigern der an der Ausgliederung beteiligten Rechtsträger ist, wenn sie binnen sechs Monaten nach dem Tag, an dem die Eintragung der Ausgliederung in das Register des Sitzes desjenigen Rechtsträgers, dessen Gläubiger sie sind, nach § 19 Abs. 3 UmwG als bekanntgemacht gilt, ihren Anspruch nach Grund und Höhe schriftlich anmelden, Sicherheit zu leisten, soweit sie nicht Befriedigung verlangen können. Dieses Recht steht den Gläubigern jedoch nur zu, wenn sie glaubhaft machen, dass durch die Ausgliederung die Erfüllung ihrer Forderung gefährdet wird."
    },
    {
      "date": "2024-10-14",
      "original_text": "Registerbekanntmachung nach dem Umwandlungsgesetz\nBrandenburg Amtsgericht Cottbus HRB 13915\nMediaCargo UG (haftungsbeschränkt) – Halbe",
      "type": "Registerbekanntmachung nach dem Umwandlungsgesetz",
      "state": "Brandenburg",
      "amtsgericht": "Amtsgericht Cottbus",
      "registernummer": "HRB 13915",
      "registerart": "HRB",
      "company_name": "MediaCargo UG (haftungsbeschränkt)",
      "company_seat": "Halbe",
      "details": "14.10.2024 (Bekanntmachungsdatum)\n\nBrandenburg Amtsgericht Cottbus HRB 13915\nRegisterbekanntmachung nach dem Umwandlungsgesetz 11.10.2024 (Eintragungsdatum)\n\nMediaCargo UG (haftungsbeschränkt)\nGesellschaft mit beschränkter Haftung\nHalbe\n\nZu Eintragungsnummer 3 vom 11.10.2024 wird als nicht eingetragen veröffentlicht:\nAls nicht eingetragen wird veröffentlicht:\nDen Gläubigern der an der Verschmelzung beteiligten Rechtsträger ist, wenn sie binnen sechs Monaten nach dem Tag, an dem die Eintragung der Verschmelzung in das Register des Sitzes desjenigen Rechtsträgers, dessen Gläubiger sie sind, als bekannt gemacht gilt, ihren Anspruch nach Grund und Höhe schriftlich anmelden, Sicherheit zu leisten, soweit sie nicht Befriedigung verlangen können. Dieses Recht steht den Gläubigern jedoch nur zu, wenn sie glaubhaft machen, dass durch die Verschmelzung die Erfüllung ihrer Forderung gefährdet wird"
    },
    {
      "date": "2024-10-14",
      "original_text": "Registerbekanntmachung nach dem Umwandlungsgesetz\nBerlin Amtsgericht Berlin (Charlottenburg) HRA 62626\nMeidinger Portfolio e. K. – Berlin",
      "type": "Registerbekanntmachung nach dem Umwandlungsgesetz",
      "state": "Berlin",
      "amtsgericht": "Amtsgericht Berlin (Charlottenburg)",
      "registernummer": "HRA 62626",
      "registerart": "HRA",
      "company_name": "Meidinger Portfolio e. K.",
      "company_seat": "Berlin",
      "details": "14.10.2024 (Bekanntmachungsdatum)\n\nBerlin Amtsgericht Berlin (Charlottenburg) HRA 62626\nRegisterbekanntmachung nach dem Umwandlungsgesetz 11.10.2024 (Eintragungsdatum)\n\nMeidinger Portfolio e. K.\nEinzelkaufmann / Einzelkauffrau\nBerlin\n\nZu Eintragungsnummer 3 vom 11.10.2024 wird als nicht eingetragen veröffentlicht: Den Gläubigern der an der Verschmelzung beteiligten Rechtsträger ist, wenn sie binnen sechs Monaten nach dem Tag, an dem die Eintragung der Verschmelzung in das Register des Sitzes desjenigen Rechtsträgers, dessen Gläubiger sie sind, als bekannt gemacht gilt, ihren Anspruch nach Grund und Höhe schriftlich anmelden, Sicherheit zu leisten, soweit sie nicht Befriedigung verlangen können. Dieses Recht steht den Gläubigern jedoch nur zu, wenn sie glaubhaft machen, dass durch die Verschmelzung die Erfüllung ihrer Forderung gefährdet wird. Das Recht, Sicherheitsleistung zu verlangen, steht Gläubigern nicht zu, die im Falle der Insolvenz ein Recht auf vorzugsweise Befriedigung aus einer Deckungsmasse haben, die nach gesetzlicher Vorschrift zu ihrem Schutz errichtet und staatlich überwacht ist."
    },
    {
      "date": "2024-10-14",
      "original_text": "Sonstige Registerbekanntmachung\nHamburg Amtsgericht Hamburg HRB 69206\nNIT Northern Institute of Technology Management gGmbH – Hamburg",
      "type": "Sonstige Registerbekanntmachung",
      "state": "Hamburg",
      "amtsgericht": "Amtsgericht Hamburg",
      "registernummer": "HRB 69206",
      "registerart": "HRB",
      "company_name": "NIT Northern Institute of Technology Management gGmbH",
      "company_seat": "Hamburg",
      "details": "14.10.2024 (Bekanntmachungsdatum)\n\nHamburg Amtsgericht Hamburg HRB 69206\nSonstige Registerbekanntmachung\n\nNIT Northern Institute of Technology Management gGmbH\nGesellschaft mit beschränkter Haftung\nHamburg\n\nAls nicht eingetragen wird bekannt gemacht: Liste des Aufsichtsrats wurde eingereicht."
    },
    {
      "date": "2024-10-14",
      "original_text": "Löschungsankündigung\nSachsen Amtsgericht Dresden GnR 415\nNOVUM - Wohnbau- und Immobiliengenossenschaft eG – Kamenz",
      "type": "Löschungsankündigung",
      "state": "Sachsen",
      "amtsgericht": "Amtsgericht Dresden",
      "registernummer": "GnR 415",
      "registerart": "GnR",
      "company_name": "NOVUM - Wohnbau- und Immobiliengenossenschaft eG",
      "company_seat": "Kamenz",
      "details": "14.10.2024 (Bekanntmachungsdatum)\n\nSachsen Amtsgericht Dresden GnR 415\nLöschungsankündigung\n\nNOVUM - Wohnbau- und Immobiliengenossenschaft eG\neingetragene Genossenschaft\nKamenz\n\nDas Registergericht beabsichtigt, die im Genossenschaftsregister eingetragene Genossenschaft von Amts wegen nach § 394 FamFG zu löschen. Die Frist zu Erhebung eines Widerspruchs gegen die beabsichtigte Löschung wird auf einen Monat festgesetzt."
    },
    {
      "date": "2024-10-14",
      "original_text": "Registerbekanntmachung nach dem Umwandlungsgesetz\nBaden-Württemberg Amtsgericht Stuttgart HRA 741630\nObsidian Real Estate Immobilienmakler - Noah Mayer e. K. – Asperg",
      "type": "Registerbekanntmachung nach dem Umwandlungsgesetz",
      "state": "Baden-Württemberg",
      "amtsgericht": "Amtsgericht Stuttgart",
      "registernummer": "HRA 741630",
      "registerart": "HRA",
      "company_name": "Obsidian Real Estate Immobilienmakler - Noah Mayer e. K.",
      "company_seat": "Asperg",
      "details": "14.10.2024 (Bekanntmachungsdatum)\n\nBaden-Württemberg Amtsgericht Stuttgart HRA 741630\nRegisterbekanntmachung nach dem Umwandlungsgesetz 14.10.2024 (Eintragungsdatum)\n\nObsidian Real Estate Immobilienmakler - Noah Mayer e. K.\nEinzelkaufmann / Einzelkauffrau\nAsperg\n\nDen Gläubigern der an der Ausgliederung beteiligten Rechtsträger ist, wenn sie binnen sechs Monaten nach dem Tag, an dem die Eintragung der Ausgliederung in das Register des Sitzes desjenigen Rechtsträgers, dessen Gläubiger sie sind, nach § 19 Abs. 3 UmwG als bekanntgemacht gilt, ihren Anspruch nach Grund und Höhe schriftlich anmelden, Sicherheit zu leisten, soweit sie nicht Befriedigung verlangen können. Dieses Recht steht den Gläubigern jedoch nur zu, wenn sie glaubhaft machen, dass durch die Ausgliederung die Erfüllung ihrer Forderung gefährdet wird."
    },
    {
      "date": "2024-10-14",
      "original_text": "Registerbekanntmachung nach dem Umwandlungsgesetz\nBerlin Amtsgericht Berlin (Charlottenburg) HRB 255242\nPSI Software SE – Berlin",
      "type": "Registerbekanntmachung nach dem Umwandlungsgesetz",
      "state": "Berlin",
      "amtsgericht": "Amtsgericht Berlin (Charlottenburg)",
      "registernummer": "HRB 255242",
      "registerart": "HRB",
      "company_name": "PSI Software SE",
      "company_seat": "Berlin",
      "details": "14.10.2024 (Bekanntmachungsdatum)\n\nBerlin Amtsgericht Berlin (Charlottenburg) HRB 255242\nRegisterbekanntmachung nach dem Umwandlungsgesetz 07.10.2024 (Eintragungsdatum)\n\nPSI Software SE\nEuropäische Aktiengesellschaft (SE)\nBerlin\n\nZu Eintragungsnummer 15 vom 07.10.2024 wird als nicht eingetragen veröffentlicht: Den Gläubigern der an der Verschmelzung beteiligten Rechtsträger ist, wenn sie binnen sechs Monaten nach dem Tag, an dem die Eintragung der Verschmelzung in das Register des Sitzes desjenigen Rechtsträgers, dessen Gläubiger sie sind, als bekannt gemacht gilt, ihren Anspruch nach Grund und Höhe schriftlich anmelden, Sicherheit zu leisten, soweit sie nicht Befriedigung verlangen können. Dieses Recht steht den Gläubigern jedoch nur zu, wenn sie glaubhaft machen, dass durch die Verschmelzung die Erfüllung ihrer Forderung gefährdet wird. Das Recht, Sicherheitsleistung zu verlangen, steht Gläubigern nicht zu, die im Falle der Insolvenz ein Recht auf vorzugsweise Befriedigung aus einer Deckungsmasse haben, die nach gesetzlicher Vorschrift zu ihrem Schutz errichtet und staatlich überwacht ist."
    },
    {
      "date": "2024-10-14",
      "original_text": "Registerbekanntmachung nach dem Umwandlungsgesetz\nBerlin Amtsgericht Berlin (Charlottenburg) HRB 255242\nPSI Software SE – Berlin",
      "type": "Registerbekanntmachung nach dem Umwandlungsgesetz",
      "state": "Berlin",
      "amtsgericht": "Amtsgericht Berlin (Charlottenburg)",
      "registernummer": "HRB 255242",
      "registerart": "HRB",
      "company_name": "PSI Software SE",
      "company_seat": "Berlin",
      "details": "14.10.2024 (Bekanntmachungsdatum)\n\nBerlin Amtsgericht Berlin (Charlottenburg) HRB 255242\nRegisterbekanntmachung nach dem Umwandlungsgesetz 11.10.2024 (Eintragungsdatum)\n\nPSI Software SE\nEuropäische Aktiengesellschaft (SE)\nBerlin\n\nZu Eintragungsnummer 16 vom 11.10.2024 wird als nicht eingetragen veröffentlicht: Den Gläubigern der an der Verschmelzung beteiligten Rechtsträger ist, wenn sie binnen sechs Monaten nach dem Tag, an dem die Eintragung der Verschmelzung in das Register des Sitzes desjenigen Rechtsträgers, dessen Gläubiger sie sind, als bekannt gemacht gilt, ihren Anspruch nach Grund und Höhe schriftlich anmelden, Sicherheit zu leisten, soweit sie nicht Befriedigung verlangen können. Dieses Recht steht den Gläubigern jedoch nur zu, wenn sie glaubhaft machen, dass durch die Verschmelzung die Erfüllung ihrer Forderung gefährdet wird. Das Recht, Sicherheitsleistung zu verlangen, steht Gläubigern nicht zu, die im Falle der Insolvenz ein Recht auf vorzugsweise Befriedigung aus einer Deckungsmasse haben, die nach gesetzlicher Vorschrift zu ihrem Schutz errichtet und staatlich überwacht ist."
    },
    {
      "date": "2024-10-14",
      "original_text": "Registerbekanntmachung nach dem Umwandlungsgesetz\nNordrhein-Westfalen Amtsgericht Lemgo HRB 4629\nPeter Marliani Verwaltungsgesellschaft mbH – Detmold",
      "type": "Registerbekanntmachung nach dem Umwandlungsgesetz",
      "state": "Nordrhein-Westfalen",
      "amtsgericht": "Amtsgericht Lemgo",
      "registernummer": "HRB 4629",
      "registerart": "HRB",
      "company_name": "Peter Marliani Verwaltungsgesellschaft mbH",
      "company_seat": "Detmold",
      "details": "14.10.2024 (Bekanntmachungsdatum)\n\nNordrhein-Westfalen Amtsgericht Lemgo HRB 4629\nRegisterbekanntmachung nach dem Umwandlungsgesetz 14.10.2024 (Eintragungsdatum)\n\nPeter Marliani Verwaltungsgesellschaft mbH\nGesellschaft mit beschränkter Haftung\nDetmold\n\nDen Gläubigern der an der Verschmelzung beteiligten Rechtsträger ist, wenn sie binnen sechs Monaten nach dem Tag, an dem die Eintragung der Verschmelzung in das Register des Sitzes desjenigen Rechtsträgers, dessen Gläubiger sie sind, nach § 19 Absatz 3 UmwG als bekanntgemacht gilt, ihren Anspruch nach Grund und Höhe schriftlich anmelden, Sicherheit zu leisten, soweit sie nicht Befriedigung verlangen können. Dieses Recht steht den Gläubigern jedoch nur zu, wenn sie glaubhaft machen, dass durch die Verschmelzung die Erfüllung ihrer Forderung gefährdet wird."
    },
    {
      "date": "2024-10-14",
      "original_text": "Registerbekanntmachung nach dem Umwandlungsgesetz\nNordrhein-Westfalen Amtsgericht Dortmund HRB 36410\nPferdepraxis Am Waldhügel GmbH – Dortmund",
      "type": "Registerbekanntmachung nach dem Umwandlungsgesetz",
      "state": "Nordrhein-Westfalen",
      "amtsgericht": "Amtsgericht Dortmund",
      "registernummer": "HRB 36410",
      "registerart": "HRB",
      "company_name": "Pferdepraxis Am Waldhügel GmbH",
      "company_seat": "Dortmund",
      "details": "14.10.2024 (Bekanntmachungsdatum)\n\nNordrhein-Westfalen Amtsgericht Dortmund HRB 36410\nRegisterbekanntmachung nach dem Umwandlungsgesetz 14.10.2024 (Eintragungsdatum)\n\nPferdepraxis Am Waldhügel GmbH\nGesellschaft mit beschränkter Haftung\nDortmund\n\nDen Gläubigern der an der Ausgliederung beteiligten Rechtsträger ist, wenn sie binnen sechs Monaten nach dem Tag, an dem die Eintragung der Ausgliederung in das Register des Sitzes desjenigen Rechtsträgers, dessen Gläubiger sie sind, nach § 19 Absatz 3 UmwG als bekanntgemacht gilt, ihren Anspruch nach Grund und Höhe schriftlich anmelden, Sicherheit zu leisten, soweit sie nicht Befriedigung verlangen können. Dieses Recht steht den Gläubigern jedoch nur zu, wenn sie glaubhaft machen, dass durch die Ausgliederung die Erfüllung ihrer Forderung gefährdet wird."
    },
    {
      "date": "2024-10-14",
      "original_text": "Registerbekanntmachung nach dem Umwandlungsgesetz\nNordrhein-Westfalen Amtsgericht Düsseldorf HRB 88244\nProjektgesellschaft Bickendorf mbH – Düsseldorf",
      "type": "Registerbekanntmachung nach dem Umwandlungsgesetz",
      "state": "Nordrhein-Westfalen",
      "amtsgericht": "Amtsgericht Düsseldorf",
      "registernummer": "HRB 88244",
      "registerart": "HRB",
      "company_name": "Projektgesellschaft Bickendorf mbH",
      "company_seat": "Düsseldorf",
      "details": "14.10.2024 (Bekanntmachungsdatum)\n\nNordrhein-Westfalen Amtsgericht Düsseldorf HRB 88244\nRegisterbekanntmachung nach dem Umwandlungsgesetz 14.10.2024 (Eintragungsdatum)\n\nProjektgesellschaft Bickendorf mbH\nGesellschaft mit beschränkter Haftung\nDüsseldorf\n\nDen Gläubigern der an der formwechselnden Umwandlung beteiligten Rechtsträger ist, wenn sie binnen sechs Monaten nach dem Tag, an dem die Eintragung der formwechselnden Umwandlung in das Register des Sitzes desjenigen Rechtsträgers, dessen Gläubiger sie sind, nach § 19 Absatz 3 UmwG als bekanntgemacht gilt, ihren Anspruch nach Grund und Höhe schriftlich anmelden, Sicherheit zu leisten, soweit sie nicht Befriedigung verlangen können. Dieses Recht steht den Gläubigern jedoch nur zu, wenn sie glaubhaft machen, dass durch die formwechselnden Umwandlung die Erfüllung ihrer Forderung gefährdet wird."
    },
    {
      "date": "2024-10-14",
      "original_text": "Löschungsankündigung\nSachsen Amtsgericht Dresden HRA 6124\nProjektgesellschaft Wohnen am Alaunpark GmbH & Co.KG – Dresden",
      "type": "Löschungsankündigung",
      "state": "Sachsen",
      "amtsgericht": "Amtsgericht Dresden",
      "registernummer": "HRA 6124",
      "registerart": "HRA",
      "company_name": "Projektgesellschaft Wohnen am Alaunpark GmbH & Co.KG",
      "company_seat": "Dresden",
      "details": "14.10.2024 (Bekanntmachungsdatum)\n\nSachsen Amtsgericht Dresden HRA 6124\nLöschungsankündigung\n\nProjektgesellschaft Wohnen am Alaunpark GmbH & Co.KG\nKommanditgesellschaft\nDresden\n\nDas Registergericht beabsichtigt, die im Handelsregister eingetragene Gesellschaft von Amts wegen nach § 394 FamFG zu löschen. Die Frist zu Erhebung eines Widerspruchs gegen die beabsichtigte Löschung wird auf einen Monat festgesetzt."
    },
    {
      "date": "2024-10-14",
      "original_text": "Löschungsankündigung\nRheinland-Pfalz Amtsgericht Ludwigshafen a.Rhein (Ludwigshafen) HRB 68451\nQuintessenz Dienstleistungen UG (haftungsbeschränkt) – Haßloch",
      "type": "Löschungsankündigung",
      "state": "Rheinland-Pfalz",
      "amtsgericht": "Amtsgericht Ludwigshafen a.Rhein (Ludwigshafen)",
      "registernummer": "HRB 68451",
      "registerart": "HRB",
      "company_name": "Quintessenz Dienstleistungen UG (haftungsbeschränkt)",
      "company_seat": "Haßloch",
      "details": "14.10.2024 (Bekanntmachungsdatum)\n\nRheinland-Pfalz Amtsgericht Ludwigshafen a.Rhein (Ludwigshafen) HRB 68451\nLöschungsankündigung\n\nQuintessenz Dienstleistungen UG (haftungsbeschränkt)\nGesellschaft mit beschränkter Haftung\nHaßloch\n\nDas Registergericht beabsichtigt die Gesellschaft von Amts wegen nach § 394 FamFG zu löschen. Die Frist zur Erhebung eines Widerspruchs ist auf einen Monat festgesetzt."
    },
    {
      "date": "2024-10-14",
      "original_text": "Löschungsankündigung\nSachsen Amtsgericht Dresden HRB 22865\nREPROCAR GmbH – Bannewitz",
      "type": "Löschungsankündigung",
      "state": "Sachsen",
      "amtsgericht": "Amtsgericht Dresden",
      "registernummer": "HRB 22865",
      "registerart": "HRB",
      "company_name": "REPROCAR GmbH",
      "company_seat": "Bannewitz",
      "details": "14.10.2024 (Bekanntmachungsdatum)\n\nSachsen Amtsgericht Dresden HRB 22865\nLöschungsankündigung\n\nREPROCAR GmbH\nGesellschaft mit beschränkter Haftung\nBannewitz\n\nDas Registergericht beabsichtigt, die im Handelsregister eingetragene Gesellschaft von Amts wegen nach § 394 FamFG zu löschen. Die Frist zu Erhebung eines Widerspruchs gegen die beabsichtigte Löschung wird auf einen Monat festgesetzt."
    },
    {
      "date": "2024-10-14",
      "original_text": "Löschungsankündigung\nNordrhein-Westfalen Amtsgericht Neuss HRB 22886\nRSB Tele UG (haftungsbeschränkt) – Neuss",
      "type": "Löschungsankündigung",
      "state": "Nordrhein-Westfalen",
      "amtsgericht": "Amtsgericht Neuss",
      "registernummer": "HRB 22886",
      "registerart": "HRB",
      "company_name": "RSB Tele UG (haftungsbeschränkt)",
      "company_seat": "Neuss",
      "details": "14.10.2024 (Bekanntmachungsdatum)\n\nNordrhein-Westfalen Amtsgericht Neuss HRB 22886\nLöschungsankündigung 11.10.2024 (Eintragungsdatum)\n\nRSB Tele UG (haftungsbeschränkt)\nGesellschaft mit beschränkter Haftung\nNeuss\n\nDas Registergericht beabsichtigt die Gesellschaft von Amts wegen nach § 394 FamFG zu löschen. Die Frist zur Erhebung eines Widerspruchs ist auf einen Monat festgesetzt. Rechtsbehelfsbelehrung: Gegen diese Verfügung können Sie Widerspruch einlegen. Der Widerspruch ist bei dem Amtsgericht Neuss - Registergericht -, Breite Str. 48, 41460 Neuss schriftlich in deutscher Sprache oder zur Niederschrift der Geschäftsstelle einzulegen. Der Widerspruch kann auch zur Niederschrift der Geschäftsstelle eines jeden Amtsgerichtes abgegeben werden. Die Einlegung ist auch durch Übertragung eines elektronischen Dokuments an die elektronische Poststelle des Gerichts möglich. Das elektronische Dokument muss für die Bearbeitung durch das Gericht geeignet und mit einer qualifizierten elektronischen Signatur der verantwortenden Person versehen sein oder von der verantwortenden Person signiert und auf einem sicheren Übermittlungsweg gemäß § 130a ZPO nach näherer Maßgabe der Verordnung über die technischen Rahmenbedingungen des elektronischen Rechtsverkehrs und über das besondere elektronische Behördenpostfach (BGBl. I, S.3803) eingereicht werden. Weitere Informationen erhalten Sie auf der Internetseite www.justiz.de. Der Widerspruch muss spätestens innerhalb der gesetzten Frist nach der schriftlichen Bekanntgabe der Verfügung bei dem Amtsgericht - Registergericht - Neuss eingegangen sein. Dies gilt auch dann, wenn der Widerspruch zur Niederschrift der Geschäftsstelle eines anderen Amtsgerichtes abgegeben wurde. Die Frist beginnt mit der schriftlichen Bekanntgabe der Verfügung. Die Bekanntgabe ist entweder durch Zustellung oder am dritten Tage nach Aufgabe zur Post bewirkt. Fällt das Ende der Frist auf einen Sonntag, einen allgemeinen Feiertag oder Sonnabend, so endet die Frist mit Ablauf des nächsten Werktages. Der Widerspruch muss die Bezeichnung der angefochtenen Verfügung sowie die Erklärung enthalten, dass Widerspruch gegen diese Verfügung eingelegt wird. Er ist zu unterzeichnen und soll begründet werden."
    },
    {
      "date": "2024-10-14",
      "original_text": "Löschungsankündigung\nNordrhein-Westfalen Amtsgericht Köln HRB 87993\nRUKAV Limited Zweigniederlassung Deutschland – Köln",
      "type": "Löschungsankündigung",
      "state": "Nordrhein-Westfalen",
      "amtsgericht": "Amtsgericht Köln",
      "registernummer": "HRB 87993",
      "registerart": "HRB",
      "company_name": "RUKAV Limited Zweigniederlassung Deutschland",
      "company_seat": "Köln",
      "details": "14.10.2024 (Bekanntmachungsdatum)\n\nNordrhein-Westfalen Amtsgericht Köln HRB 87993\nLöschungsankündigung\n\nRUKAV Limited Zweigniederlassung Deutschland\nRechtsform ausländischen Rechts HRB\nKöln\n\nDas Registergericht beabsichtigt die Zweigniederlassung von Amts wegen nach § 395 FamFG zu löschen. Die Frist zur Erhebung eines Widerspruchs ist auf einen Monat festgesetzt."
    },
    {
      "date": "2024-10-14",
      "original_text": "Löschungsankündigung\nSchleswig-Holstein Amtsgericht Pinneberg HRB 15007\nRaumgestaltung Hildebrandt UG (haftungsbeschränkt) – Quickborn/Krs. Pinneberg",
      "type": "Löschungsankündigung",
      "state": "Schleswig-Holstein",
      "amtsgericht": "Amtsgericht Pinneberg",
      "registernummer": "HRB 15007",
      "registerart": "HRB",
      "company_name": "Raumgestaltung Hildebrandt UG (haftungsbeschränkt)",
      "company_seat": "Quickborn/Krs. Pinneberg",
      "details": "14.10.2024 (Bekanntmachungsdatum)\n\nSchleswig-Holstein Amtsgericht Pinneberg HRB 15007\nLöschungsankündigung\n\nRaumgestaltung Hildebrandt UG (haftungsbeschränkt)\nGesellschaft mit beschränkter Haftung\nQuickborn/Krs. Pinneberg\n\nEs ist die Löschung der nachstehenden Gesellschaft wegen Vermögenslosigkeit gemäß § 394 FamFG beabsichtigt. Widerspruchsfrist: 2 Monate."
    },
    {
      "date": "2024-10-14",
      "original_text": "Registerbekanntmachung nach dem Umwandlungsgesetz\nBerlin Amtsgericht Berlin (Charlottenburg) HRB 208264\nRumford GmbH – Berlin",
      "type": "Registerbekanntmachung nach dem Umwandlungsgesetz",
      "state": "Berlin",
      "amtsgericht": "Amtsgericht Berlin (Charlottenburg)",
      "registernummer": "HRB 208264",
      "registerart": "HRB",
      "company_name": "Rumford GmbH",
      "company_seat": "Berlin",
      "details": "14.10.2024 (Bekanntmachungsdatum)\n\nBerlin Amtsgericht Berlin (Charlottenburg) HRB 208264\nRegisterbekanntmachung nach dem Umwandlungsgesetz 11.10.2024 (Eintragungsdatum)\n\nRumford GmbH\nGesellschaft mit beschränkter Haftung\nBerlin\n\nZu Eintragungsnummer 6 vom 11.10.2024 wird als nicht eingetragen veröffentlicht:Den Gläubigern der an der Verschmelzung beteiligten Rechtsträger ist, wenn sie binnen sechs Monaten nach dem Tag, an dem die Eintragung der Verschmelzung in das Register des Sitzes desjenigen Rechtsträgers, dessen Gläubiger sie sind, als bekannt gemacht gilt, ihren Anspruch nach Grund und Höhe schriftlich anmelden, Sicherheit zu leisten, soweit sie nicht Befriedigung verlangen können. Dieses Recht steht den Gläubigern jedoch nur zu, wenn sie glaubhaft machen, dass durch die Verschmelzung die Erfüllung ihrer Forderung gefährdet wird. Das Recht, Sicherheitsleistung zu verlangen, steht Gläubigern nicht zu, die im Falle der Insolvenz ein Recht auf vorzugsweise Befriedigung aus einer Deckungsmasse haben, die nach gesetzlicher Vorschrift zu ihrem Schutz errichtet und staatlich überwacht ist."
    },
    {
      "date": "2024-10-14",
      "original_text": "Löschungsankündigung\nHessen Amtsgericht Frankfurt am Main HRB 89054\nSAN Trade GmbH – Eschborn",
      "type": "Löschungsankündigung",
      "state": "Hessen",
      "amtsgericht": "Amtsgericht Frankfurt am Main",
      "registernummer": "HRB 89054",
      "registerart": "HRB",
      "company_name": "SAN Trade GmbH",
      "company_seat": "Eschborn",
      "details": "14.10.2024 (Bekanntmachungsdatum)\n\nHessen Amtsgericht Frankfurt am Main HRB 89054\nLöschungsankündigung\n\nSAN Trade GmbH\nGesellschaft mit beschränkter Haftung\nEschborn\n\nEs ist beabsichtigt, die Gesellschaft wegen Vermögenslosigkeit gemäß § 394 FamFG von Amts wegen im Handelsregister zu löschen. Hiergegen kann innerhalb eines Monats nach dieser Veröffentlichung Widerspruch bei dem Amtsgericht Frankfurt am Main eingelegt werden."
    },
    {
      "date": "2024-10-14",
      "original_text": "Sonstige Registerbekanntmachung\nHessen Amtsgericht Fritzlar VR 3405\nSCHÜTZENVEREIN \"NORDECK\" ELFERSHAUSEN – Elfershausen",
      "type": "Sonstige Registerbekanntmachung",
      "state": "Hessen",
      "amtsgericht": "Amtsgericht Fritzlar",
      "registernummer": "VR 3405",
      "registerart": "VR",
      "company_name": "SCHÜTZENVEREIN \"NORDECK\" ELFERSHAUSEN",
      "company_seat": "Elfershausen",
      "details": "14.10.2024 (Bekanntmachungsdatum)\n\nHessen Amtsgericht Fritzlar VR 3405\nSonstige Registerbekanntmachung 14.10.2024 (Eintragungsdatum)\n\nSCHÜTZENVEREIN \"NORDECK\" ELFERSHAUSEN\neingetragener Verein\nElfershausen\n\nDer Verein ist aufgelöst."
    },
    {
      "date": "2024-10-14",
      "original_text": "Registerbekanntmachung nach dem Umwandlungsgesetz\nSachsen Amtsgericht Dresden HRB 19513\nSYNCWORK Aktiengesellschaft – Dresden",
      "type": "Registerbekanntmachung nach dem Umwandlungsgesetz",
      "state": "Sachsen",
      "amtsgericht": "Amtsgericht Dresden",
      "registernummer": "HRB 19513",
      "registerart": "HRB",
      "company_name": "SYNCWORK Aktiengesellschaft",
      "company_seat": "Dresden",
      "details": "14.10.2024 (Bekanntmachungsdatum)\n\nSachsen Amtsgericht Dresden HRB 19513\nRegisterbekanntmachung nach dem Umwandlungsgesetz 14.10.2024 (Eintragungsdatum)\n\nSYNCWORK Aktiengesellschaft\nAktiengesellschaft\nDresden\n\nDen Gläubigern der an der Verschmelzung beteiligten Rechtsträger ist, wenn sie binnen sechs Monaten nach dem Tag, an dem die Eintragung der Verschmelzung in das Register des Sitzes desjenigen Rechtsträgers, dessen Gläubiger sie sind, nach § 19 Abs. 3 UmwG als bekannt gemacht gilt, ihren Anspruch nach Grund und Höhe schriftlich anmelden, Sicherheit zu leisten, soweit sie nicht Befriedigung verlangen können. Dieses Recht steht den Gläubigern jedoch nur zu, wenn sie glaubhaft machen, dass durch die Verschmelzung die Erfüllung der Forderung gefährdet wird."
    },
    {
      "date": "2024-10-14",
      "original_text": "Löschungsankündigung\nBerlin Amtsgericht Berlin (Charlottenburg) HRB 185489\nSanata Bau GmbH – Berlin",
      "type": "Löschungsankündigung",
      "state": "Berlin",
      "amtsgericht": "Amtsgericht Berlin (Charlottenburg)",
      "registernummer": "HRB 185489",
      "registerart": "HRB",
      "company_name": "Sanata Bau GmbH",
      "company_seat": "Berlin",
      "details": "14.10.2024 (Bekanntmachungsdatum)\n\nBerlin Amtsgericht Berlin (Charlottenburg) HRB 185489\nLöschungsankündigung\n\nSanata Bau GmbH\nGesellschaft mit beschränkter Haftung\nBerlin\n\nBei der nachstehenden Gesellschaft wird das Amtslöschungsverfahren gemäß § 394 FamFG eingeleitet. Widerspruchsfrist 6 Wochen"
    },
    {
      "date": "2024-10-14",
      "original_text": "Löschungsankündigung\nSachsen Amtsgericht Dresden HRB 34209\nSecundant Dienstleistung & Service GmbH – Dresden",
      "type": "Löschungsankündigung",
      "state": "Sachsen",
      "amtsgericht": "Amtsgericht Dresden",
      "registernummer": "HRB 34209",
      "registerart": "HRB",
      "company_name": "Secundant Dienstleistung & Service GmbH",
      "company_seat": "Dresden",
      "details": "14.10.2024 (Bekanntmachungsdatum)\n\nSachsen Amtsgericht Dresden HRB 34209\nLöschungsankündigung\n\nSecundant Dienstleistung & Service GmbH\nGesellschaft mit beschränkter Haftung\nDresden\n\nDas Registergericht beabsichtigt, die im Handelsregister eingetragene Gesellschaft von Amts wegen nach § 394 FamFG zu löschen. Die Frist zu Erhebung eines Widerspruchs gegen die beabsichtigte Löschung wird auf einen Monat festgesetzt."
    },
    {
      "date": "2024-10-14",
      "original_text": "Löschungsankündigung\nBremen Amtsgericht Bremen HRB 31340\nShangrila Gastronomie GmbH – Bremen",
      "type": "Löschungsankündigung",
      "state": "Bremen",
      "amtsgericht": "Amtsgericht Bremen",
      "registernummer": "HRB 31340",
      "registerart": "HRB",
      "company_name": "Shangrila Gastronomie GmbH",
      "company_seat": "Bremen",
      "details": "14.10.2024 (Bekanntmachungsdatum)\n\nBremen Amtsgericht Bremen HRB 31340\nLöschungsankündigung\n\nShangrila Gastronomie GmbH\nGesellschaft mit beschränkter Haftung\nBremen\n\nEs ist beabsichtigt die im Handelsregister eingetragene Gesellschaft von Amts wegen gemäß § 394 FamFG zu löschen. Gegen die Löschung kann beim AG Bremen schriftlich oder zu Protokoll der Geschäftsstelle Widerspruch eingelegt werden. Widerspruchsfrist 4 Wochen."
    },
    {
      "date": "2024-10-14",
      "original_text": "Löschungsankündigung\nHessen Amtsgericht Frankfurt am Main HRB 121486\nSpezial Ventures GmbH – Frankfurt am Main",
      "type": "Löschungsankündigung",
      "state": "Hessen",
      "amtsgericht": "Amtsgericht Frankfurt am Main",
      "registernummer": "HRB 121486",
      "registerart": "HRB",
      "company_name": "Spezial Ventures GmbH",
      "company_seat": "Frankfurt am Main",
      "details": "14.10.2024 (Bekanntmachungsdatum)\n\nHessen Amtsgericht Frankfurt am Main HRB 121486\nLöschungsankündigung\n\nSpezial Ventures GmbH\nGesellschaft mit beschränkter Haftung\nFrankfurt am Main\n\nDas Registergericht beabsichtigt die im Handelsregister eingetragene Gesellschaft von Amts wegen nach § 395 FamFG zu löschen. Die Frist zur Erhebung eines Widerspruchs gegen die beabsichtigte Löschung wird auf 1 Monat festgesetzt."
    },
    {
      "date": "2024-10-14",
      "original_text": "Einreichung neuer Dokumente\nBaden-Württemberg Amtsgericht Stuttgart HRB 460821\nStadtwerke Trossingen GmbH – Trossingen",
      "type": "Einreichung neuer Dokumente",
      "state": "Baden-Württemberg",
      "amtsgericht": "Amtsgericht Stuttgart",
      "registernummer": "HRB 460821",
      "registerart": "HRB",
      "company_name": "Stadtwerke Trossingen GmbH",
      "company_seat": "Trossingen",
      "details": "14.10.2024 (Bekanntmachungsdatum)\n\nBaden-Württemberg Amtsgericht Stuttgart HRB 460821\nEinreichung neuer Dokumente\n\nStadtwerke Trossingen GmbH\nGesellschaft mit beschränkter Haftung\nTrossingen\n\nDie Gesellschaft hat am 09.10.2024 die Liste über die Zusammensetzung des Aufsichtsrats zum Handelsregister eingereicht."
    },
    {
      "date": "2024-10-14",
      "original_text": "Löschungsankündigung\nNordrhein-Westfalen Amtsgericht Dortmund HRB 5308\nStallmann Verwaltungsgesellschaft mit beschränkter Haftung – Dortmund",
      "type": "Löschungsankündigung",
      "state": "Nordrhein-Westfalen",
      "amtsgericht": "Amtsgericht Dortmund",
      "registernummer": "HRB 5308",
      "registerart": "HRB",
      "company_name": "Stallmann Verwaltungsgesellschaft mit beschränkter Haftung",
      "company_seat": "Dortmund",
      "details": "14.10.2024 (Bekanntmachungsdatum)\n\nNordrhein-Westfalen Amtsgericht Dortmund HRB 5308\nLöschungsankündigung\n\nStallmann Verwaltungsgesellschaft mit beschränkter Haftung\nGesellschaft mit beschränkter Haftung\nDortmund\n\nDas Registergericht beabsichtigt die Gesellschaft von Amts wegen nach § 394 FamFG zu löschen. Die Frist zur Erhebung eines Widerspruchs ist auf zwei Monate festgesetzt."
    },
    {
      "date": "2024-10-14",
      "original_text": "Einreichung neuer Dokumente\nNordrhein-Westfalen Amtsgericht Bielefeld HRB 45365\nStockmeier Holding SE – Bielefeld",
      "type": "Einreichung neuer Dokumente",
      "state": "Nordrhein-Westfalen",
      "amtsgericht": "Amtsgericht Bielefeld",
      "registernummer": "HRB 45365",
      "registerart": "HRB",
      "company_name": "Stockmeier Holding SE",
      "company_seat": "Bielefeld",
      "details": "14.10.2024 (Bekanntmachungsdatum)\n\nNordrhein-Westfalen Amtsgericht Bielefeld HRB 45365\nEinreichung neuer Dokumente\n\nStockmeier Holding SE\nEuropäische Aktiengesellschaft (SE)\nBielefeld\n\nDem Registergericht ist eine Liste der Mitglieder des Verwaltungsrates eingereicht worden."
    },
    {
      "date": "2024-10-14",
      "original_text": "Löschungsankündigung\nNordrhein-Westfalen Amtsgericht Gelsenkirchen HRB 15863\nTA Consulting GmbH – Marl",
      "type": "Löschungsankündigung",
      "state": "Nordrhein-Westfalen",
      "amtsgericht": "Amtsgericht Gelsenkirchen",
      "registernummer": "HRB 15863",
      "registerart": "HRB",
      "company_name": "TA Consulting GmbH",
      "company_seat": "Marl",
      "details": "14.10.2024 (Bekanntmachungsdatum)\n\nNordrhein-Westfalen Amtsgericht Gelsenkirchen HRB 15863\nLöschungsankündigung\n\nTA Consulting GmbH\nGesellschaft mit beschränkter Haftung\nMarl\n\nDas Gericht beabsichtigt, die Gesellschaft TA Consulting GmbH mit Sitz in Marl, HRB 15863 Amtsgericht Gelsenkirchen, wegen Vermögenslosigkeit zu löschen.\n\nHiermit wird denjenigen, die an der Unterlassung der Löschung ein berechtigtes Interesse haben, gem. § 394 Abs. 2 FamFG Gelegenheit gegeben, gegen dieses Vorhaben binnen eines Monats nach dieser Bekanntmachung Widerspruch einzulegen. Der Widerspruch kann schriftlich oder zu Protokoll der Geschäftsstelle erhoben werden."
    },
    {
      "date": "2024-10-14",
      "original_text": "Einreichung neuer Dokumente\nSchleswig-Holstein Amtsgericht Pinneberg HRB 9672\nTAM AG – Rellingen",
      "type": "Einreichung neuer Dokumente",
      "state": "Schleswig-Holstein",
      "amtsgericht": "Amtsgericht Pinneberg",
      "registernummer": "HRB 9672",
      "registerart": "HRB",
      "company_name": "TAM AG",
      "company_seat": "Rellingen",
      "details": "14.10.2024 (Bekanntmachungsdatum)\n\nSchleswig-Holstein Amtsgericht Pinneberg HRB 9672\nEinreichung neuer Dokumente\n\nTAM AG\nAktiengesellschaft\nRellingen\n\nAls nicht eingetragen wird veröffentlicht: Es ist eine neue Liste der Aufsichtsratsmitglieder gemäß § 52 Abs. 3 2 Hs. GmbHG i.V.m. § 10 HGB zum Handelsregister eingereicht worden."
    },
    {
      "date": "2024-10-14",
      "original_text": "Registerbekanntmachung nach dem Umwandlungsgesetz\nBerlin Amtsgericht Berlin (Charlottenburg) HRB 79641\nTEAMPLAN Ingenieure GmbH – Berlin",
      "type": "Registerbekanntmachung nach dem Umwandlungsgesetz",
      "state": "Berlin",
      "amtsgericht": "Amtsgericht Berlin (Charlottenburg)",
      "registernummer": "HRB 79641",
      "registerart": "HRB",
      "company_name": "TEAMPLAN Ingenieure GmbH",
      "company_seat": "Berlin",
      "details": "14.10.2024 (Bekanntmachungsdatum)\n\nBerlin Amtsgericht Berlin (Charlottenburg) HRB 79641\nRegisterbekanntmachung nach dem Umwandlungsgesetz 11.10.2024 (Eintragungsdatum)\n\nTEAMPLAN Ingenieure GmbH\nGesellschaft mit beschränkter Haftung\nBerlin\n\nZu Eintragungsnummer 9 vom 11.10.2024 wird als nicht eingetragen veröffentlicht: Den Gläubigern der an der Verschmelzung beteiligten Rechtsträger ist, wenn sie binnen sechs Monaten nach dem Tag, an dem die Eintragung der Verschmelzung in das Register des Sitzes desjenigen Rechtsträgers, dessen Gläubiger sie sind, als bekannt gemacht gilt, ihren Anspruch nach Grund und Höhe schriftlich anmelden, Sicherheit zu leisten, soweit sie nicht Befriedigung verlangen können. Dieses Recht steht den Gläubigern jedoch nur zu, wenn sie glaubhaft machen, dass durch die Verschmelzung die Erfüllung ihrer Forderung gefährdet wird. Das Recht, Sicherheitsleistung zu verlangen, steht Gläubigern nicht zu, die im Falle der Insolvenz ein Recht auf vorzugsweise Befriedigung aus einer Deckungsmasse haben, die nach gesetzlicher Vorschrift zu ihrem Schutz errichtet und staatlich überwacht ist."
    },
    {
      "date": "2024-10-14",
      "original_text": "Einreichung neuer Dokumente\nBaden-Württemberg Amtsgericht Stuttgart HRB 382393\nTETEC Tissue Engineering Technologies AG – Kusterdingen",
      "type": "Einreichung neuer Dokumente",
      "state": "Baden-Württemberg",
      "amtsgericht": "Amtsgericht Stuttgart",
      "registernummer": "HRB 382393",
      "registerart": "HRB",
      "company_name": "TETEC Tissue Engineering Technologies AG",
      "company_seat": "Kusterdingen",
      "details": "14.10.2024 (Bekanntmachungsdatum)\n\nBaden-Württemberg Amtsgericht Stuttgart HRB 382393\nEinreichung neuer Dokumente\n\nTETEC Tissue Engineering Technologies AG\nAktiengesellschaft\nKusterdingen\n\nDie Gesellschaft hat am 09.10.2024 die Liste über die Zusammensetzung des Aufsichtsrats zum Handelsregister eingereicht."
    },
    {
      "date": "2024-10-14",
      "original_text": "Registerbekanntmachung nach dem Umwandlungsgesetz\nSchleswig-Holstein Amtsgericht Lübeck HRB 3626 RE\nTMS Energietechnik GmbH – Barsbüttel",
      "type": "Registerbekanntmachung nach dem Umwandlungsgesetz",
      "state": "Schleswig-Holstein",
      "amtsgericht": "Amtsgericht Lübeck",
      "registernummer": "HRB 3626 RE",
      "registerart": "HRB",
      "company_name": "TMS Energietechnik GmbH",
      "company_seat": "Barsbüttel",
      "details": "14.10.2024 (Bekanntmachungsdatum)\n\nSchleswig-Holstein Amtsgericht Lübeck HRB 3626 RE\nRegisterbekanntmachung nach dem Umwandlungsgesetz 12.10.2024 (Eintragungsdatum)\n\nTMS Energietechnik GmbH\nGesellschaft mit beschränkter Haftung\nBarsbüttel\n\nZu Eintragungsnummer 15 vom 12.10.2024 wird als nicht eingetragen veröffentlicht: Den Gläubigern der an der Verschmelzung beteiligten Rechtsträger ist, wenn sie binnen sechs Monaten nach dem Tag, an dem die Eintragung der Verschmelzung in das Register des Sitzes desjenigen Rechtsträgers, dessen Gläubiger sie sind, als bekannt gemacht gilt, ihren Anspruch nach Grund und Höhe schriftlich anmelden, Sicherheit zu leisten, soweit sie nicht Befriedigung verlangen können. Dieses Recht steht den Gläubigern jedoch nur zu, wenn sie glaubhaft machen, dass durch die Verschmelzung die Erfüllung ihrer Forderung gefährdet wird."
    },
    {
      "date": "2024-10-14",
      "original_text": "Registerbekanntmachung nach dem Umwandlungsgesetz\nNordrhein-Westfalen Amtsgericht Dortmund HRA 19743\nTSR Deutschland GmbH & Co. KG – Lünen",
      "type": "Registerbekanntmachung nach dem Umwandlungsgesetz",
      "state": "Nordrhein-Westfalen",
      "amtsgericht": "Amtsgericht Dortmund",
      "registernummer": "HRA 19743",
      "registerart": "HRA",
      "company_name": "TSR Deutschland GmbH & Co. KG",
      "company_seat": "Lünen",
      "details": "14.10.2024 (Bekanntmachungsdatum)\n\nNordrhein-Westfalen Amtsgericht Dortmund HRA 19743\nRegisterbekanntmachung nach dem Umwandlungsgesetz 14.10.2024 (Eintragungsdatum)\n\nTSR Deutschland GmbH & Co. KG\nKommanditgesellschaft\nLünen\n\nDen Gläubigern der an der Ausgliederung beteiligten Rechtsträger ist, wenn sie binnen sechs Monaten nach dem Tag, an dem die Eintragung der Ausgliederung in das Register des Sitzes desjenigen Rechtsträgers, dessen Gläubiger sie sind, nach § 19 Absatz 3 UmwG als bekanntgemacht gilt, ihren Anspruch nach Grund und Höhe schriftlich anmelden, Sicherheit zu leisten, soweit sie nicht Befriedigung verlangen können. Dieses Recht steht den Gläubigern jedoch nur zu, wenn sie glaubhaft machen, dass durch die Ausgliederung die Erfüllung ihrer Forderung gefährdet wird."
    },
    {
      "date": "2024-10-14",
      "original_text": "Registerbekanntmachung nach dem Umwandlungsgesetz\nNordrhein-Westfalen Amtsgericht Dortmund HRA 18511\nTSR Recycling GmbH & Co. KG – Lünen",
      "type": "Registerbekanntmachung nach dem Umwandlungsgesetz",
      "state": "Nordrhein-Westfalen",
      "amtsgericht": "Amtsgericht Dortmund",
      "registernummer": "HRA 18511",
      "registerart": "HRA",
      "company_name": "TSR Recycling GmbH & Co. KG",
      "company_seat": "Lünen",
      "details": "14.10.2024 (Bekanntmachungsdatum)\n\nNordrhein-Westfalen Amtsgericht Dortmund HRA 18511\nRegisterbekanntmachung nach dem Umwandlungsgesetz 14.10.2024 (Eintragungsdatum)\n\nTSR Recycling GmbH & Co. KG\nKommanditgesellschaft\nLünen\n\nDen Gläubigern der an der Ausgliederung beteiligten Rechtsträger ist, wenn sie binnen sechs Monaten nach dem Tag, an dem die Eintragung der Ausgliederung in das Register des Sitzes derjenigen Rechtsträger deren Gläubiger sie sind, nach § 19 Absatz 3 UmwG als bekanntgemacht gilt, ihren Anspruch nach Grund und Höhe schriftlich anmelden, Sicherheit zu leisten, soweit sie nicht Befriedigung verlangen können. Dieses Recht steht den Gläubigern jedoch nur zu, wenn sie glaubhaft machen, dass durch die Ausgliederung die Erfüllung ihrer Forderung gefährdet wird."
    },
    {
      "date": "2024-10-14",
      "original_text": "Registerbekanntmachung nach dem Umwandlungsgesetz\nBaden-Württemberg Amtsgericht Stuttgart HRB 244226\nTemption GmbH funktionale Zeitmessgeräte – Herrenberg",
      "type": "Registerbekanntmachung nach dem Umwandlungsgesetz",
      "state": "Baden-Württemberg",
      "amtsgericht": "Amtsgericht Stuttgart",
      "registernummer": "HRB 244226",
      "registerart": "HRB",
      "company_name": "Temption GmbH funktionale Zeitmessgeräte",
      "company_seat": "Herrenberg",
      "details": "14.10.2024 (Bekanntmachungsdatum)\n\nBaden-Württemberg Amtsgericht Stuttgart HRB 244226\nRegisterbekanntmachung nach dem Umwandlungsgesetz 14.10.2024 (Eintragungsdatum)\n\nTemption GmbH funktionale Zeitmessgeräte\nGesellschaft mit beschränkter Haftung\nHerrenberg\n\nAls nicht eingetragen wird bekanntgemacht:\nDen Gläubigern der an der Verschmelzung beteiligten Rechtsträger ist, wenn sie binnen sechs Monaten nach dem Tag, an dem die Eintragung der Verschmelzung in das Register des Sitzes desjenigen Rechtsträgers, dessen Gläubiger sie sind, nach § 19 Abs. 3 UmwG als bekanntgemacht gilt, ihren Anspruch nach Grund und Höhe schriftlich anmelden, Sicherheit zu leisten, soweit sie nicht Befriedigung verlangen können. Dieses Recht steht den Gläubigern jedoch nur zu, wenn sie glaubhaft machen, dass durch die Verschmelzung die Erfüllung ihrer Forderung gefährdet wird."
    },
    {
      "date": "2024-10-14",
      "original_text": "Registerbekanntmachung nach dem Umwandlungsgesetz\nBrandenburg Amtsgericht Cottbus HRA 4350\nTorsten Müller e.K. – Wildau",
      "type": "Registerbekanntmachung nach dem Umwandlungsgesetz",
      "state": "Brandenburg",
      "amtsgericht": "Amtsgericht Cottbus",
      "registernummer": "HRA 4350",
      "registerart": "HRA",
      "company_name": "Torsten Müller e.K.",
      "company_seat": "Wildau",
      "details": "14.10.2024 (Bekanntmachungsdatum)\n\nBrandenburg Amtsgericht Cottbus HRA 4350\nRegisterbekanntmachung nach dem Umwandlungsgesetz 11.10.2024 (Eintragungsdatum)\n\nTorsten Müller e.K.\nEinzelkaufmann / Einzelkauffrau\nWildau\n\nZu Eintragungsnummer 2 vom 11.10.2024 wird als nicht eingetragen veröffentlicht:\nDen Gläubigern der an der Ausgliederung beteiligten Rechtsträger ist, wenn sie binnen sechs Monaten nach dem Tag, an dem die Eintragung der Ausgliederung in das Register des Sitzes desjenigen Rechtsträgers, dessen Gläubiger sie sind, als bekannt gemacht gilt, ihren Anspruch nach Grund und Höhe schriftlich anmelden, Sicherheit zu leisten, soweit sie nicht Befriedigung verlangen können. Dieses Recht steht den Gläubigern jedoch nur zu, wenn sie glaubhaft machen, dass durch die Ausgliederung die Erfüllung ihrer Forderung gefährdet wird"
    },
    {
      "date": "2024-10-14",
      "original_text": "Einreichung neuer Dokumente\nHessen Amtsgericht Darmstadt HRB 4915\nTÜV Technische Überwachung Hessen GmbH – Darmstadt",
      "type": "Einreichung neuer Dokumente",
      "state": "Hessen",
      "amtsgericht": "Amtsgericht Darmstadt",
      "registernummer": "HRB 4915",
      "registerart": "HRB",
      "company_name": "TÜV Technische Überwachung Hessen GmbH",
      "company_seat": "Darmstadt",
      "details": "14.10.2024 (Bekanntmachungsdatum)\n\nHessen Amtsgericht Darmstadt HRB 4915\nEinreichung neuer Dokumente 11.10.2024 (Eintragungsdatum)\n\nTÜV Technische Überwachung Hessen GmbH\nGesellschaft mit beschränkter Haftung\nDarmstadt\n\nDurch eine Änderung in den Personen der Aufsichtsratsmitglieder ist eine Liste der Mitglieder des Aufsichtsrates zum Handelsregister eingereicht worden."
    },
    {
      "date": "2024-10-14",
      "original_text": "Einreichung neuer Dokumente\nNiedersachsen Amtsgericht Lüneburg HRB 120469 früher Amtsgericht Dannenberg (Elbe)\nUelzener Allgemeine Versicherungs-Gesellschaft a.G. – Uelzen",
      "type": "Einreichung neuer Dokumente",
      "state": "Niedersachsen",
      "amtsgericht": "Amtsgericht Lüneburg",
      "registernummer": "HRB 120469",
      "registerart": "HRB",
      "company_name": "Uelzener Allgemeine Versicherungs-Gesellschaft a.G.",
      "company_seat": "Uelzen",
      "former_amtsgericht": "Dannenberg (Elbe)",
      "details": "14.10.2024 (Bekanntmachungsdatum)\n\nNiedersachsen Amtsgericht Lüneburg HRB 120469 früher Amtsgericht Dannenberg (Elbe)\nEinreichung neuer Dokumente\n\nUelzener Allgemeine Versicherungs-Gesellschaft a.G.\nVersicherungsverein auf Gegenseitigkeit\nUelzen\n\nEine aktuelle Liste der Mitglieder des Aufsichtsrats wurde beim Registergericht eingereicht."
    },
    {
      "date": "2024-10-14",
      "original_text": "Löschungsankündigung\nMecklenburg-Vorpommern Amtsgericht Rostock HRB 6523\nUplegger Verwaltungs GmbH – Neubukow",
      "type": "Löschungsankündigung",
      "state": "Mecklenburg-Vorpommern",
      "amtsgericht": "Amtsgericht Rostock",
      "registernummer": "HRB 6523",
      "registerart": "HRB",
      "company_name": "Uplegger Verwaltungs GmbH",
      "company_seat": "Neubukow",
      "details": "14.10.2024 (Bekanntmachungsdatum)\n\nMecklenburg-Vorpommern Amtsgericht Rostock HRB 6523\nLöschungsankündigung\n\nUplegger Verwaltungs GmbH\nGesellschaft mit beschränkter Haftung\nNeubukow\n\nDas Registergericht beabsichtigt, die im Handelsregister eingetragene Gesellschaft von Amts wegen nach § 394 FamFG zu löschen. Die Frist zur Erhebung eines Widerspruchs gegen die beabsichtigte Löschung wird auf einen Monat festgesetzt."
    },
    {
      "date": "2024-10-14",
      "original_text": "Löschungsankündigung\nBerlin Amtsgericht Berlin (Charlottenburg) HRB 162418\nVIA B2B Consulting + Services UG (haftungsbeschränkt) – Berlin",
      "type": "Löschungsankündigung",
      "state": "Berlin",
      "amtsgericht": "Amtsgericht Berlin (Charlottenburg)",
      "registernummer": "HRB 162418",
      "registerart": "HRB",
      "company_name": "VIA B2B Consulting + Services UG (haftungsbeschränkt)",
      "company_seat": "Berlin",
      "details": "14.10.2024 (Bekanntmachungsdatum)\n\nBerlin Amtsgericht Berlin (Charlottenburg) HRB 162418\nLöschungsankündigung\n\nVIA B2B Consulting + Services UG (haftungsbeschränkt)\nGesellschaft mit beschränkter Haftung\nBerlin\n\nBei der nachstehenden Gesellschaft wird das Amtslöschungsverfahren gemäß § 394 FamFG eingeleitet. Widerspruchsfrist: 6 Wochen."
    },
    {
      "date": "2024-10-14",
      "original_text": "Registerbekanntmachung nach dem Umwandlungsgesetz\nBerlin Amtsgericht Berlin (Charlottenburg) HRB 87968\nVRB Vorratsgesellschaften GmbH – Berlin",
      "type": "Registerbekanntmachung nach dem Umwandlungsgesetz",
      "state": "Berlin",
      "amtsgericht": "Amtsgericht Berlin (Charlottenburg)",
      "registernummer": "HRB 87968",
      "registerart": "HRB",
      "company_name": "VRB Vorratsgesellschaften GmbH",
      "company_seat": "Berlin",
      "details": "14.10.2024 (Bekanntmachungsdatum)\n\nBerlin Amtsgericht Berlin (Charlottenburg) HRB 87968\nRegisterbekanntmachung nach dem Umwandlungsgesetz 11.10.2024 (Eintragungsdatum)\n\nVRB Vorratsgesellschaften GmbH\nGesellschaft mit beschränkter Haftung\nBerlin\n\nZu Eintragungsnummer 10 vom 11.10.2024 wird als nicht eingetragen veröffentlicht: Den Gläubigern der an der Verschmelzung beteiligten Rechtsträger ist, wenn sie binnen sechs Monaten nach dem Tag, an dem die Eintragung der Verschmelzung in das Register des Sitzes desjenigen Rechtsträgers, dessen Gläubiger sie sind, als bekannt gemacht gilt, ihren Anspruch nach Grund und Höhe schriftlich anmelden, Sicherheit zu leisten, soweit sie nicht Befriedigung verlangen können. Dieses Recht steht den Gläubigern jedoch nur zu, wenn sie glaubhaft machen, dass durch die Verschmelzung die Erfüllung ihrer Forderung gefährdet wird. Das Recht, Sicherheitsleistung zu verlangen, steht Gläubigern nicht zu, die im Falle der Insolvenz ein Recht auf vorzugsweise Befriedigung aus einer Deckungsmasse haben, die nach gesetzlicher Vorschrift zu ihrem Schutz errichtet und staatlich überwacht ist."
    },
    {
      "date": "2024-10-14",
      "original_text": "Löschungsankündigung\nHessen Amtsgericht Friedberg HRB 9699\nValley Automatenaufstellung GmbH – Butzbach",
      "type": "Löschungsankündigung",
      "state": "Hessen",
      "amtsgericht": "Amtsgericht Friedberg",
      "registernummer": "HRB 9699",
      "registerart": "HRB",
      "company_name": "Valley Automatenaufstellung GmbH",
      "company_seat": "Butzbach",
      "details": "14.10.2024 (Bekanntmachungsdatum)\n\nHessen Amtsgericht Friedberg HRB 9699\nLöschungsankündigung\n\nValley Automatenaufstellung GmbH\nGesellschaft mit beschränkter Haftung\nButzbach\n\nDas Registergericht beabsichtigt die im Handelsregister eingetragene Gesellschaft von Amts wegen nach § 394 FamFG zu löschen. Die Frist zur Erhebung eines Widerspruchs gegen die beabsichtigte Löschung wird auf 3 Monate festgesetzt."
    },
    {
      "date": "2024-10-14",
      "original_text": "Registerbekanntmachung nach dem Umwandlungsgesetz\nNordrhein-Westfalen Amtsgericht Siegen HRA 8574\nVermögensverwaltungsgesellschaft Kichtaler Weg UG (haftungsbeschränkt) u. Co. KG – Siegen",
      "type": "Registerbekanntmachung nach dem Umwandlungsgesetz",
      "state": "Nordrhein-Westfalen",
      "amtsgericht": "Amtsgericht Siegen",
      "registernummer": "HRA 8574",
      "registerart": "HRA",
      "company_name": "Vermögensverwaltungsgesellschaft Kichtaler Weg UG (haftungsbeschränkt) u. Co. KG",
      "company_seat": "Siegen",
      "details": "14.10.2024 (Bekanntmachungsdatum)\n\nNordrhein-Westfalen Amtsgericht Siegen HRA 8574\nRegisterbekanntmachung nach dem Umwandlungsgesetz 14.10.2024 (Eintragungsdatum)\n\nVermögensverwaltungsgesellschaft Kichtaler Weg UG (haftungsbeschränkt) u. Co. KG\nKommanditgesellschaft\nSiegen\n\nDen Gläubigern der an der Verschmelzung beteiligten Rechtsträger ist, wenn sie binnen sechs Monaten nach dem Tag, an dem die Eintragung der Verschmelzung in das Register des Sitzes desjenigen Rechtsträgers, dessen Gläubiger sie sind, nach § 19 Absatz 3 UmwG als bekanntgemacht gilt, ihren Anspruch nach Grund und Höhe schriftlich anmelden, Sicherheit zu leisten, soweit sie nicht Befriedigung verlangen können. Dieses Recht steht den Gläubigern jedoch nur zu, wenn sie glaubhaft machen, dass durch die Verschmelzung die Erfüllung ihrer Forderung gefährdet wird."
    },
    {
      "date": "2024-10-14",
      "original_text": "Einreichung neuer Dokumente\nNordrhein-Westfalen Amtsgericht Siegburg HRB 479\nWalterscheid GmbH – Lohmar",
      "type": "Einreichung neuer Dokumente",
      "state": "Nordrhein-Westfalen",
      "amtsgericht": "Amtsgericht Siegburg",
      "registernummer": "HRB 479",
      "registerart": "HRB",
      "company_name": "Walterscheid GmbH",
      "company_seat": "Lohmar",
      "details": "14.10.2024 (Bekanntmachungsdatum)\n\nNordrhein-Westfalen Amtsgericht Siegburg HRB 479\nEinreichung neuer Dokumente\n\nWalterscheid GmbH\nGesellschaft mit beschränkter Haftung\nLohmar\n\nDem Registergericht ist eine neue Liste der Mitglieder des Aufsichtsrates eingereicht worden."
    },
    {
      "date": "2024-10-14",
      "original_text": "Registerbekanntmachung nach dem Umwandlungsgesetz\nBaden-Württemberg Amtsgericht Stuttgart HRB 201251\nWerner Mitschele GmbH – Pleidelsheim",
      "type": "Registerbekanntmachung nach dem Umwandlungsgesetz",
      "state": "Baden-Württemberg",
      "amtsgericht": "Amtsgericht Stuttgart",
      "registernummer": "HRB 201251",
      "registerart": "HRB",
      "company_name": "Werner Mitschele GmbH",
      "company_seat": "Pleidelsheim",
      "details": "14.10.2024 (Bekanntmachungsdatum)\n\nBaden-Württemberg Amtsgericht Stuttgart HRB 201251\nRegisterbekanntmachung nach dem Umwandlungsgesetz 14.10.2024 (Eintragungsdatum)\n\nWerner Mitschele GmbH\nGesellschaft mit beschränkter Haftung\nPleidelsheim\n\nAls nicht eingetragen wird bekanntgemacht:\nDen Gläubigern der an der Verschmelzung beteiligten Rechtsträger ist, wenn sie binnen sechs Monaten nach dem Tag, an dem die Eintragung der Verschmelzung in das Register des Sitzes desjenigen Rechtsträgers, dessen Gläubiger sie sind, nach § 19 Abs. 3 UmwG als bekanntgemacht gilt, ihren Anspruch nach Grund und Höhe schriftlich anmelden, Sicherheit zu leisten, soweit sie nicht Befriedigung verlangen können. Dieses Recht steht den Gläubigern jedoch nur zu, wenn sie glaubhaft machen, dass durch die Verschmelzung die Erfüllung ihrer Forderung gefährdet wird."
    },
    {
      "date": "2024-10-14",
      "original_text": "Sonstige Registerbekanntmachung\nSachsen-Anhalt Amtsgericht Stendal HRB 10372\nWohnungs- und Baugesellschaft Wolfen mbH – Bitterfeld-Wolfen",
      "type": "Sonstige Registerbekanntmachung",
      "state": "Sachsen-Anhalt",
      "amtsgericht": "Amtsgericht Stendal",
      "registernummer": "HRB 10372",
      "registerart": "HRB",
      "company_name": "Wohnungs- und Baugesellschaft Wolfen mbH",
      "company_seat": "Bitterfeld-Wolfen",
      "details": "14.10.2024 (Bekanntmachungsdatum)\n\nSachsen-Anhalt Amtsgericht Stendal HRB 10372\nSonstige Registerbekanntmachung\n\nWohnungs- und Baugesellschaft Wolfen mbH\nGesellschaft mit beschränkter Haftung\nBitterfeld-Wolfen\n\nEine Liste der Mitglieder des Aufsichtsrates wurde zum Handelsregister eingereicht."
    },
    {
      "date": "2024-10-14",
      "original_text": "Einreichung neuer Dokumente\nSachsen Amtsgericht Dresden HRB 3346\nWohnungsgesellschaft mbH Hoyerswerda – Hoyerswerda",
      "type": "Einreichung neuer Dokumente",
      "state": "Sachsen",
      "amtsgericht": "Amtsgericht Dresden",
      "registernummer": "HRB 3346",
      "registerart": "HRB",
      "company_name": "Wohnungsgesellschaft mbH Hoyerswerda",
      "company_seat": "Hoyerswerda",
      "details": "14.10.2024 (Bekanntmachungsdatum)\n\nSachsen Amtsgericht Dresden HRB 3346\nEinreichung neuer Dokumente\n\nWohnungsgesellschaft mbH Hoyerswerda\nGesellschaft mit beschränkter Haftung\nHoyerswerda\n\nAm 11.10.2024 wurde beim Handelsregister des Amtsgerichts Dresden die Liste der Mitglieder des Aufsichtsrats gemäß § 52 GmbHG eingereicht."
    },
    {
      "date": "2024-10-14",
      "original_text": "Registerbekanntmachung nach dem Umwandlungsgesetz\nNordrhein-Westfalen Amtsgericht Duisburg HRB 14315\nWolf-Beteiligungsgesellschaft mit beschränkter Haftung – Mülheim an der Ruhr",
      "type": "Registerbekanntmachung nach dem Umwandlungsgesetz",
      "state": "Nordrhein-Westfalen",
      "amtsgericht": "Amtsgericht Duisburg",
      "registernummer": "HRB 14315",
      "registerart": "HRB",
      "company_name": "Wolf-Beteiligungsgesellschaft mit beschränkter Haftung",
      "company_seat": "Mülheim an der Ruhr",
      "details": "14.10.2024 (Bekanntmachungsdatum)\n\nNordrhein-Westfalen Amtsgericht Duisburg HRB 14315\nRegisterbekanntmachung nach dem Umwandlungsgesetz 14.10.2024 (Eintragungsdatum)\n\nWolf-Beteiligungsgesellschaft mit beschränkter Haftung\nGesellschaft mit beschränkter Haftung\nMülheim an der Ruhr\n\nDen Gläubigern der an der Verschmelzung beteiligten Rechtsträger ist, wenn sie binnen sechs Monaten nach dem Tag, an dem die Eintragung der Verschmelzung in das Register des Sitzes desjenigen Rechtsträgers, dessen Gläubiger sie sind, nach § 19 Absatz 3 UmwG als bekanntgemacht gilt, ihren Anspruch nach Grund und Höhe schriftlich anmelden, Sicherheit zu leisten, soweit sie nicht Befriedigung verlangen können. Dieses Recht steht den Gläubigern jedoch nur zu, wenn sie glaubhaft machen, dass durch die Verschmelzung die Erfüllung ihrer Forderung gefährdet wird."
    },
    {
      "date": "2024-10-14",
      "original_text": "Einreichung neuer Dokumente\nMecklenburg-Vorpommern Amtsgericht Neubrandenburg HRB 4176\nZentrum für Ernährung und Lebensmitteltechnologie ( ZELT ) gemeinnützige Gesellschaft mit beschränkter Haftung – Neubrandenburg",
      "type": "Einreichung neuer Dokumente",
      "state": "Mecklenburg-Vorpommern",
      "amtsgericht": "Amtsgericht Neubrandenburg",
      "registernummer": "HRB 4176",
      "registerart": "HRB",
      "company_name": "Zentrum für Ernährung und Lebensmitteltechnologie ( ZELT ) gemeinnützige Gesellschaft mit beschränkter Haftung",
      "company_seat": "Neubrandenburg",
      "details": "14.10.2024 (Bekanntmachungsdatum)\n\nMecklenburg-Vorpommern Amtsgericht Neubrandenburg HRB 4176\nEinreichung neuer Dokumente 14.10.2024 (Eintragungsdatum)\n\nZentrum für Ernährung und Lebensmitteltechnologie ( ZELT ) gemeinnützige Gesellschaft mit beschränkter Haftung\nGesellschaft mit beschränkter Haftung\nNeubrandenburg\n\nEine Liste der Mitglieder des Aufsichtsrats ist zum Handelsregister eingereicht worden."
    },
    {
      "date": "2024-10-14",
      "original_text": "Registerbekanntmachung nach dem Umwandlungsgesetz\nBerlin Amtsgericht Berlin (Charlottenburg) HRB 128182\nalma Vermögensverwaltung GmbH – Berlin",
      "type": "Registerbekanntmachung nach dem Umwandlungsgesetz",
      "state": "Berlin",
      "amtsgericht": "Amtsgericht Berlin (Charlottenburg)",
      "registernummer": "HRB 128182",
      "registerart": "HRB",
      "company_name": "alma Vermögensverwaltung GmbH",
      "company_seat": "Berlin",
      "details": "14.10.2024 (Bekanntmachungsdatum)\n\nBerlin Amtsgericht Berlin (Charlottenburg) HRB 128182\nRegisterbekanntmachung nach dem Umwandlungsgesetz 11.10.2024 (Eintragungsdatum)\n\nalma Vermögensverwaltung GmbH\nGesellschaft mit beschränkter Haftung\nBerlin\n\nZu Eintragungsnummer 7 vom 11.10.2024 wird als nicht eingetragen veröffentlicht:Den Gläubigern der an der Verschmelzung beteiligten Rechtsträger ist, wenn sie binnen sechs Monaten nach dem Tag, an dem die Eintragung der Verschmelzung in das Register des Sitzes desjenigen Rechtsträgers, dessen Gläubiger sie sind, als bekannt gemacht gilt, ihren Anspruch nach Grund und Höhe schriftlich anmelden, Sicherheit zu leisten, soweit sie nicht Befriedigung verlangen können. Dieses Recht steht den Gläubigern jedoch nur zu, wenn sie glaubhaft machen, dass durch die Verschmelzung die Erfüllung ihrer Forderung gefährdet wird. Das Recht, Sicherheitsleistung zu verlangen, steht Gläubigern nicht zu, die im Falle der Insolvenz ein Recht auf vorzugsweise Befriedigung aus einer Deckungsmasse haben, die nach gesetzlicher Vorschrift zu ihrem Schutz errichtet und staatlich überwacht ist."
    },
    {
      "date": "2024-10-14",
      "original_text": "Sonstige Registerbekanntmachung\nBrandenburg Amtsgericht Cottbus HRB 16289\nhafcom UG (haftungsbeschränkt) – Cottbus",
      "type": "Sonstige Registerbekanntmachung",
      "state": "Brandenburg",
      "amtsgericht": "Amtsgericht Cottbus",
      "registernummer": "HRB 16289",
      "registerart": "HRB",
      "company_name": "hafcom UG (haftungsbeschränkt)",
      "company_seat": "Cottbus",
      "details": "14.10.2024 (Bekanntmachungsdatum)\n\nBrandenburg Amtsgericht Cottbus HRB 16289\nSonstige Registerbekanntmachung\n\nhafcom UG (haftungsbeschränkt)\nGesellschaft mit beschränkter Haftung\nCottbus\n\nDie Gesellschaft ist durch Abweisung der Eröffnung des Insolvenzverfahrens mangels Masse aufgelöst."
    },
    {
      "date": "2024-10-14",
      "original_text": "Löschungsankündigung\nNordrhein-Westfalen Amtsgericht Paderborn HRB 1734\nhetra - sanitär - Produkte GmbH – Salzkotten",
      "type": "Löschungsankündigung",
      "state": "Nordrhein-Westfalen",
      "amtsgericht": "Amtsgericht Paderborn",
      "registernummer": "HRB 1734",
      "registerart": "HRB",
      "company_name": "hetra - sanitär - Produkte GmbH",
      "company_seat": "Salzkotten",
      "details": "14.10.2024 (Bekanntmachungsdatum)\n\nNordrhein-Westfalen Amtsgericht Paderborn HRB 1734\nLöschungsankündigung\n\nhetra - sanitär - Produkte GmbH\nGesellschaft mit beschränkter Haftung\nSalzkotten\n\nDas Registergericht beabsichtigt die Gesellschaft von Amts wegen nach § 394 FamFG zu löschen. Die Frist zur Erhebung eines Widerspruchs ist auf einen Monat festgesetzt."
    },
    {
      "date": "2024-10-14",
      "original_text": "Registerbekanntmachung nach dem Umwandlungsgesetz\nBaden-Württemberg Amtsgericht Stuttgart HRB 789939\nheyhey. Management GmbH – Stuttgart",
      "type": "Registerbekanntmachung nach dem Umwandlungsgesetz",
      "state": "Baden-Württemberg",
      "amtsgericht": "Amtsgericht Stuttgart",
      "registernummer": "HRB 789939",
      "registerart": "HRB",
      "company_name": "heyhey. Management GmbH",
      "company_seat": "Stuttgart",
      "details": "14.10.2024 (Bekanntmachungsdatum)\n\nBaden-Württemberg Amtsgericht Stuttgart HRB 789939\nRegisterbekanntmachung nach dem Umwandlungsgesetz 14.10.2024 (Eintragungsdatum)\n\nheyhey. Management GmbH\nGesellschaft mit beschränkter Haftung\nStuttgart\n\nAls nicht eingetragen wird bekanntgemacht:\nDen Gläubigern der an der Ausgliederung beteiligten Rechtsträger ist, wenn sie binnen sechs Monaten nach dem Tag, an dem die Eintragung der Ausgliederung in das Register des Sitzes desjenigen Rechtsträgers, dessen Gläubiger sie sind, nach § 19 Abs. 3 UmwG als bekanntgemacht gilt, ihren Anspruch nach Grund und Höhe schriftlich anmelden, Sicherheit zu leisten, soweit sie nicht Befriedigung verlangen können. Dieses Recht steht den Gläubigern jedoch nur zu, wenn sie glaubhaft machen, dass durch die Ausgliederung die Erfüllung ihrer Forderung gefährdet wird."
    },
    {
      "date": "2024-10-14",
      "original_text": "Registerbekanntmachung nach dem Umwandlungsgesetz\nBaden-Württemberg Amtsgericht Stuttgart HRB 789939\nheyhey. Management GmbH – Stuttgart",
      "type": "Registerbekanntmachung nach dem Umwandlungsgesetz",
      "state": "Baden-Württemberg",
      "amtsgericht": "Amtsgericht Stuttgart",
      "registernummer": "HRB 789939",
      "registerart": "HRB",
      "company_name": "heyhey. Management GmbH",
      "company_seat": "Stuttgart",
      "details": "14.10.2024 (Bekanntmachungsdatum)\n\nBaden-Württemberg Amtsgericht Stuttgart HRB 789939\nRegisterbekanntmachung nach dem Umwandlungsgesetz 14.10.2024 (Eintragungsdatum)\n\nheyhey. Management GmbH\nGesellschaft mit beschränkter Haftung\nStuttgart\n\nAls nicht eingetragen wird bekanntgemacht:\nDen Gläubigern der an der Ausgliederung beteiligten Rechtsträger ist, wenn sie binnen sechs Monaten nach dem Tag, an dem die Eintragung der Ausgliederung in das Register des Sitzes desjenigen Rechtsträgers, dessen Gläubiger sie sind, nach § 19 Abs. 3 UmwG als bekanntgemacht gilt, ihren Anspruch nach Grund und Höhe schriftlich anmelden, Sicherheit zu leisten, soweit sie nicht Befriedigung verlangen können. Dieses Recht steht den Gläubigern jedoch nur zu, wenn sie glaubhaft machen, dass durch die Ausgliederung die Erfüllung ihrer Forderung gefährdet wird."
    },
    {
      "date": "2024-10-14",
      "original_text": "Registerbekanntmachung nach dem Umwandlungsgesetz\nNordrhein-Westfalen Amtsgericht Köln HRB 120780\nthe small stuff Mathieson GmbH – Leverkusen",
      "type": "Registerbekanntmachung nach dem Umwandlungsgesetz",
      "state": "Nordrhein-Westfalen",
      "amtsgericht": "Amtsgericht Köln",
      "registernummer": "HRB 120780",
      "registerart": "HRB",
      "company_name": "the small stuff Mathieson GmbH",
      "company_seat": "Leverkusen",
      "details": "14.10.2024 (Bekanntmachungsdatum)\n\nNordrhein-Westfalen Amtsgericht Köln HRB 120780\nRegisterbekanntmachung nach dem Umwandlungsgesetz 14.10.2024 (Eintragungsdatum)\n\nthe small stuff Mathieson GmbH\nGesellschaft mit beschränkter Haftung\nLeverkusen\n\nDen Gläubigern der an der Ausgliederung beteiligten Rechtsträger ist, wenn sie binnen sechs Monaten nach dem Tag, an dem die Eintragung der Ausgliederung in das Register des Sitzes desjenigen Rechtsträgers, dessen Gläubiger sie sind, nach § 19 Absatz 3 UmwG als bekanntgemacht gilt, ihren Anspruch nach Grund und Höhe schriftlich anmelden, Sicherheit zu leisten, soweit sie nicht Befriedigung verlangen können. Dieses Recht steht den Gläubigern jedoch nur zu, wenn sie glaubhaft machen, dass durch die Ausgliederung die Erfüllung ihrer Forderung gefährdet wird."
    },
    {
      "date": "2024-10-14",
      "original_text": "Registerbekanntmachung nach dem Umwandlungsgesetz\nNordrhein-Westfalen Amtsgericht Siegen HRB 14024\nvan Riesen GmbH – Kreuztal",
      "type": "Registerbekanntmachung nach dem Umwandlungsgesetz",
      "state": "Nordrhein-Westfalen",
      "amtsgericht": "Amtsgericht Siegen",
      "registernummer": "HRB 14024",
      "registerart": "HRB",
      "company_name": "van Riesen GmbH",
      "company_seat": "Kreuztal",
      "details": "14.10.2024 (Bekanntmachungsdatum)\n\nNordrhein-Westfalen Amtsgericht Siegen HRB 14024\nRegisterbekanntmachung nach dem Umwandlungsgesetz 14.10.2024 (Eintragungsdatum)\n\nvan Riesen GmbH\nGesellschaft mit beschränkter Haftung\nKreuztal\n\nDen Gläubigern der an der Ausgliederung beteiligten Rechtsträger ist, wenn sie binnen sechs Monaten nach dem Tag, an dem die Eintragung der Ausgliederung in das Register des Sitzes desjenigen Rechtsträgers, dessen Gläubiger sie sind, nach § 19 Absatz 3 UmwG als bekanntgemacht gilt, ihren Anspruch nach Grund und Höhe schriftlich anmelden, Sicherheit zu leisten, soweit sie nicht Befriedigung verlangen können. Dieses Recht steht den Gläubigern jedoch nur zu, wenn sie glaubhaft machen, dass durch die Ausgliederung die Erfüllung ihrer Forderung gefährdet wird."
    },
    {
      "date": "2024-10-14",
      "original_text": "Registerbekanntmachung nach dem Umwandlungsgesetz\nNordrhein-Westfalen Amtsgericht Siegen HRA 9988\nvan Riesen ambulante Pflege e.K. – Kreuztal",
      "type": "Registerbekanntmachung nach dem Umwandlungsgesetz",
      "state": "Nordrhein-Westfalen",
      "amtsgericht": "Amtsgericht Siegen",
      "registernummer": "HRA 9988",
      "registerart": "HRA",
      "company_name": "van Riesen ambulante Pflege e.K.",
      "company_seat": "Kreuztal",
      "details": "14.10.2024 (Bekanntmachungsdatum)\n\nNordrhein-Westfalen Amtsgericht Siegen HRA 9988\nRegisterbekanntmachung nach dem Umwandlungsgesetz 14.10.2024 (Eintragungsdatum)\n\nvan Riesen ambulante Pflege e.K.\nEinzelkaufmann / Einzelkauffrau\nKreuztal\n\nDen Gläubigern der an der Ausgliederung beteiligten Rechtsträger ist, wenn sie binnen sechs Monaten nach dem Tag, an dem die Eintragung der Ausgliederung in das Register des Sitzes desjenigen Rechtsträgers, dessen Gläubiger sie sind, nach § 19 Absatz 3 UmwG als bekanntgemacht gilt, ihren Anspruch nach Grund und Höhe schriftlich anmelden, Sicherheit zu leisten, soweit sie nicht Befriedigung verlangen können. Dieses Recht steht den Gläubigern jedoch nur zu, wenn sie glaubhaft machen, dass durch die Ausgliederung die Erfüllung ihrer Forderung gefährdet wird."
    },
    {
      "date": "2024-10-14",
      "original_text": "Registerbekanntmachung nach dem Umwandlungsgesetz\nSchleswig-Holstein Amtsgericht Kiel GnR 278 SE\nÄrztegenossenschaft Nord eG – Bad Segeberg",
      "type": "Registerbekanntmachung nach dem Umwandlungsgesetz",
      "state": "Schleswig-Holstein",
      "amtsgericht": "Amtsgericht Kiel",
      "registernummer": "GnR 278 SE",
      "registerart": "GnR",
      "company_name": "Ärztegenossenschaft Nord eG",
      "company_seat": "Bad Segeberg",
      "details": "14.10.2024 (Bekanntmachungsdatum)\n\nSchleswig-Holstein Amtsgericht Kiel GnR 278 SE\nRegisterbekanntmachung nach dem Umwandlungsgesetz 08.10.2024 (Eintragungsdatum)\n\nÄrztegenossenschaft Nord eG\neingetragene Genossenschaft\nBad Segeberg\n\nZu Eintragungsnummer 15 vom 08.10.2024 wird als nicht eingetragen veröffentlicht:  Als nicht eingetragen wird veröffentlicht: Den Gläubigern der an der Verschmelzung beteiligten Rechtsträger ist, wenn sie binnen sechs Monaten nach dem Tag, an dem die Eintragung der Verschmelzung in das Register des Sitzes desjenigen Rechtsträgers, dessen Gläubiger sie sind, nach § 19 Abs. 3 UmwG bekannt gemacht worden ist, ihren Anspruch nach Grund und Höhe schriftlich anmelden, Sicherheit zu leisten, soweit sie nicht Befriedigung verlangen können. Dieses Recht steht den Gläubigern jedoch nur zu, wenn sie glaubhaft machen, dass durch die Verschmelzung die Erfüllung ihrer Forderung gefährdet wird."
    }
  ]
}