{
  "date": "2024-10-09",
  "date_of_scrape": "2024-11-26T11:00:59.298Z",
  "tool_version": "0.1.0",
  "number_of_announcements": 214,
  "announcements": [
    {
      "date": "2024-10-09",
      "original_text": "Registerbekanntmachung nach dem Umwandlungsgesetz\nBayern Amtsgericht Augsburg HRB 10503\n\" Der Andruck \" Offset Andruck GmbH – Augsburg",
      "type": "Registerbekanntmachung nach dem Umwandlungsgesetz",
      "state": "Bayern",
      "amtsgericht": "Amtsgericht Augsburg",
      "registernummer": "HRB 10503",
      "registerart": "HRB",
      "company_name": "\" Der Andruck \" Offset Andruck GmbH",
      "company_seat": "Augsburg",
      "details": "09.10.2024 (Bekanntmachungsdatum)\n\nBayern Amtsgericht Augsburg HRB 10503\nRegisterbekanntmachung nach dem Umwandlungsgesetz 08.10.2024 (Eintragungsdatum)\n\n\" Der Andruck \" Offset Andruck GmbH\nGesellschaft mit beschränkter Haftung\nAugsburg\n\nDen Gläubigern der an der Verschmelzung beteiligten Rechtsträger ist, wenn sie binnen sechs Monaten nach dem Tag, an dem die Eintragung der Verschmelzung in das Register des Sitzes desjenigen Rechtsträgers, dessen Gläubiger sie sind, nach § 19 Abs. 3 UmwG als bekannt gemacht gilt, ihren Anspruch nach Grund und Höhe schriftlich anmelden, Sicherheit zu leisten, soweit sie nicht Befriedigung verlangen können. Dieses Recht steht den Gläubigern jedoch nur zu, wenn sie glaubhaft machen, dass durch die Verschmelzung die Erfüllung ihrer Forderung gefährdet wird."
    },
    {
      "date": "2024-10-09",
      "original_text": "Registerbekanntmachung nach dem Umwandlungsgesetz\nNiedersachsen Amtsgericht Tostedt HRB 120477 früher Amtsgericht Buxtehude\nA & A Logistik-Equipment Verwaltungs GmbH – Heidenau",
      "type": "Registerbekanntmachung nach dem Umwandlungsgesetz",
      "state": "Niedersachsen",
      "amtsgericht": "Amtsgericht Tostedt",
      "registernummer": "HRB 120477",
      "registerart": "HRB",
      "company_name": "A & A Logistik-Equipment Verwaltungs GmbH",
      "company_seat": "Heidenau",
      "former_amtsgericht": "Buxtehude",
      "details": "09.10.2024 (Bekanntmachungsdatum)\n\nNiedersachsen Amtsgericht Tostedt HRB 120477 früher Amtsgericht Buxtehude\nRegisterbekanntmachung nach dem Umwandlungsgesetz 09.10.2024 (Eintragungsdatum)\n\nA & A Logistik-Equipment Verwaltungs GmbH\nGesellschaft mit beschränkter Haftung\nHeidenau\n\nDen Gläubigern der an der Verschmelzung beteiligten Rechtsträger ist, wenn sie binnen sechs Monaten nach dem Tag, an dem die Eintragung der Verschmelzung in das Register des Sitzes desjenigen Rechtsträgers, dessen Gläubiger sie sind, nach § 19  Abs.  3 UmwG als bekannt gemacht gilt, ihren Anspruch nach Grund und Höhe schriftlich anmelden, Sicherheit zu leisten, soweit sie nicht Befriedigung verlangen können. Dieses Recht steht den Gläubigern jedoch nur zu, wenn sie glaubhaft machen, dass durch die Verschmelzung die Erfüllung der Forderung gefährdet wird."
    },
    {
      "date": "2024-10-09",
      "original_text": "Löschungsankündigung\nBerlin Amtsgericht Berlin (Charlottenburg) HRB 147134\nADIPE Bauunternehmung GmbH – Berlin",
      "type": "Löschungsankündigung",
      "state": "Berlin",
      "amtsgericht": "Amtsgericht Berlin (Charlottenburg)",
      "registernummer": "HRB 147134",
      "registerart": "HRB",
      "company_name": "ADIPE Bauunternehmung GmbH",
      "company_seat": "Berlin",
      "details": "09.10.2024 (Bekanntmachungsdatum)\n\nBerlin Amtsgericht Berlin (Charlottenburg) HRB 147134\nLöschungsankündigung\n\nADIPE Bauunternehmung GmbH\nGesellschaft mit beschränkter Haftung\nBerlin\n\nBei der nachstehenden Gesellschaft wird das Amtslöschungsverfahren gemäß § 394 FamFG eingeleitet. Widerspruchsfrist 6 Wochen"
    },
    {
      "date": "2024-10-09",
      "original_text": "Registerbekanntmachung nach dem Umwandlungsgesetz\nBayern Amtsgericht München HRB 209198\nAKAD Holding GmbH – Grünwald",
      "type": "Registerbekanntmachung nach dem Umwandlungsgesetz",
      "state": "Bayern",
      "amtsgericht": "Amtsgericht München",
      "registernummer": "HRB 209198",
      "registerart": "HRB",
      "company_name": "AKAD Holding GmbH",
      "company_seat": "Grünwald",
      "details": "09.10.2024 (Bekanntmachungsdatum)\n\nBayern Amtsgericht München HRB 209198\nRegisterbekanntmachung nach dem Umwandlungsgesetz 08.10.2024 (Eintragungsdatum)\n\nAKAD Holding GmbH\nGesellschaft mit beschränkter Haftung\nGrünwald\n\nDen Gläubigern der an der Verschmelzung beteiligten Rechtsträger ist, wenn sie binnen sechs Monaten nach dem Tag, an dem die Eintragung der Verschmelzung in das Register des Sitzes desjenigen Rechtsträgers, dessen Gläubiger sie sind, nach § 19 Abs. 3 UmwG als bekannt gemacht gilt, ihren Anspruch nach Grund und Höhe schriftlich anmelden, Sicherheit zu leisten, soweit sie nicht Befriedigung verlangen können. Dieses Recht steht den Gläubigern jedoch nur zu, wenn sie glaubhaft machen, dass durch die Verschmelzung die Erfüllung ihrer Forderung gefährdet wird."
    },
    {
      "date": "2024-10-09",
      "original_text": "Registerbekanntmachung nach dem Umwandlungsgesetz\nNordrhein-Westfalen Amtsgericht Essen HRA 11832\nALEX KFZ Meisterbetrieb e.K. – Essen",
      "type": "Registerbekanntmachung nach dem Umwandlungsgesetz",
      "state": "Nordrhein-Westfalen",
      "amtsgericht": "Amtsgericht Essen",
      "registernummer": "HRA 11832",
      "registerart": "HRA",
      "company_name": "ALEX KFZ Meisterbetrieb e.K.",
      "company_seat": "Essen",
      "details": "09.10.2024 (Bekanntmachungsdatum)\n\nNordrhein-Westfalen Amtsgericht Essen HRA 11832\nRegisterbekanntmachung nach dem Umwandlungsgesetz 09.10.2024 (Eintragungsdatum)\n\nALEX KFZ Meisterbetrieb e.K.\nEinzelkaufmann / Einzelkauffrau\nEssen\n\nDen Gläubigern der an der Ausgliederung beteiligten Rechtsträger ist, wenn sie binnen sechs Monaten nach dem Tag, an dem die Eintragung der Ausgliederung in das Register des Sitzes desjenigen Rechtsträgers, dessen Gläubiger sie sind, nach § 19 Absatz 3 UmwG als bekanntgemacht gilt, ihren Anspruch nach Grund und Höhe schriftlich anmelden, Sicherheit zu leisten, soweit sie nicht Befriedigung verlangen können. Dieses Recht steht den Gläubigern jedoch nur zu, wenn sie glaubhaft machen, dass durch die Ausgliederung die Erfüllung ihrer Forderung gefährdet wird."
    },
    {
      "date": "2024-10-09",
      "original_text": "Registerbekanntmachung nach dem Umwandlungsgesetz\nBayern Amtsgericht Kempten (Allgäu) GnR 295\nALLGÄUER VOLKSBANK EG KEMPTEN - SONTHOFEN – Kempten (Allgäu)",
      "type": "Registerbekanntmachung nach dem Umwandlungsgesetz",
      "state": "Bayern",
      "amtsgericht": "Amtsgericht Kempten (Allgäu)",
      "registernummer": "GnR 295",
      "registerart": "GnR",
      "company_name": "ALLGÄUER VOLKSBANK EG KEMPTEN - SONTHOFEN",
      "company_seat": "Kempten (Allgäu)",
      "details": "09.10.2024 (Bekanntmachungsdatum)\n\nBayern Amtsgericht Kempten (Allgäu) GnR 295\nRegisterbekanntmachung nach dem Umwandlungsgesetz 08.10.2024 (Eintragungsdatum)\n\nALLGÄUER VOLKSBANK EG KEMPTEN - SONTHOFEN\neingetragene Genossenschaft\nKempten (Allgäu)\n\nDen Gläubigern der an der Verschmelzung beteiligten Rechtsträger ist, wenn sie binnen sechs Monaten nach dem Tag, an dem die Eintragung der Verschmelzung in das Register des Sitzes desjenigen Rechtsträgers, dessen Gläubiger sie sind, nach § 19 Abs. 3 UmwG als bekannt gemacht gilt, ihren Anspruch nach Grund und Höhe schriftlich anmelden, Sicherheit zu leisten, soweit sie nicht Befriedigung verlangen können. Dieses Recht steht den Gläubigern jedoch nur zu, wenn sie glaubhaft machen, dass durch die Verschmelzung die Erfüllung ihrer Forderung gefährdet wird."
    },
    {
      "date": "2024-10-09",
      "original_text": "Registerbekanntmachung nach dem Umwandlungsgesetz\nHessen Amtsgericht Bad Homburg v.d.H. HRB 14616\nASTO Invest GmbH – Bad Homburg v. d. Höhe",
      "type": "Registerbekanntmachung nach dem Umwandlungsgesetz",
      "state": "Hessen",
      "amtsgericht": "Amtsgericht Bad Homburg v.d.H.",
      "registernummer": "HRB 14616",
      "registerart": "HRB",
      "company_name": "ASTO Invest GmbH",
      "company_seat": "Bad Homburg v. d. Höhe",
      "details": "09.10.2024 (Bekanntmachungsdatum)\n\nHessen Amtsgericht Bad Homburg v.d.H. HRB 14616\nRegisterbekanntmachung nach dem Umwandlungsgesetz 09.10.2024 (Eintragungsdatum)\n\nASTO Invest GmbH\nGesellschaft mit beschränkter Haftung\nBad Homburg v. d. Höhe\n\nDen Gläubigern der an der Verschmelzung beteiligten Rechtsträger ist, wenn sie binnen sechs Monaten nach dem Tag, an dem die Eintragung der Verschmelzung in das Register des Sitzes desjenigen Rechtsträgers, dessen Gläubiger sie sind, nach § 19 Absatz 3 UmwG bekannt gemacht worden ist, ihren Anspruch nach Grund und Höhe schriftlich anmelden, Sicherheit zu leisten, soweit sie nicht Befriedigung verlangen können. Dieses Recht steht den Gläubigern jedoch nur zu, wenn sie glaubhaft machen, dass durch die Verschmelzung die Erfüllung ihrer Forderung gefährdet wird."
    },
    {
      "date": "2024-10-09",
      "original_text": "Registerbekanntmachung nach dem Umwandlungsgesetz\nHessen Amtsgericht Bad Homburg v.d.H. HRB 14949\nASTO Invest and Management GmbH – Bad Homburg v. d. Höhe",
      "type": "Registerbekanntmachung nach dem Umwandlungsgesetz",
      "state": "Hessen",
      "amtsgericht": "Amtsgericht Bad Homburg v.d.H.",
      "registernummer": "HRB 14949",
      "registerart": "HRB",
      "company_name": "ASTO Invest and Management GmbH",
      "company_seat": "Bad Homburg v. d. Höhe",
      "details": "09.10.2024 (Bekanntmachungsdatum)\n\nHessen Amtsgericht Bad Homburg v.d.H. HRB 14949\nRegisterbekanntmachung nach dem Umwandlungsgesetz 09.10.2024 (Eintragungsdatum)\n\nASTO Invest and Management GmbH\nGesellschaft mit beschränkter Haftung\nBad Homburg v. d. Höhe\n\nDen Gläubigern der an der Verschmelzung beteiligten Rechtsträger ist, wenn sie binnen sechs Monaten nach dem Tag, an dem die Eintragung der Verschmelzung in das Register des Sitzes desjenigen Rechtsträgers, dessen Gläubiger sie sind, nach § 19 Absatz 3 UmwG bekannt gemacht worden ist, ihren Anspruch nach Grund und Höhe schriftlich anmelden, Sicherheit zu leisten, soweit sie nicht Befriedigung verlangen können. Dieses Recht steht den Gläubigern jedoch nur zu, wenn sie glaubhaft machen, dass durch die Verschmelzung die Erfüllung ihrer Forderung gefährdet wird."
    },
    {
      "date": "2024-10-09",
      "original_text": "Registerbekanntmachung nach dem Umwandlungsgesetz\nBremen Amtsgericht Bremen HRB 21570\nATLAS ELEKTRONIK GmbH – Bremen",
      "type": "Registerbekanntmachung nach dem Umwandlungsgesetz",
      "state": "Bremen",
      "amtsgericht": "Amtsgericht Bremen",
      "registernummer": "HRB 21570",
      "registerart": "HRB",
      "company_name": "ATLAS ELEKTRONIK GmbH",
      "company_seat": "Bremen",
      "details": "09.10.2024 (Bekanntmachungsdatum)\n\nBremen Amtsgericht Bremen HRB 21570\nRegisterbekanntmachung nach dem Umwandlungsgesetz 08.10.2024 (Eintragungsdatum)\n\nATLAS ELEKTRONIK GmbH\nGesellschaft mit beschränkter Haftung\nBremen\n\nZu Eintragungsnummer 77 vom 08.10.2024 wird als nicht eingetragen veröffentlicht: Gläubigern, deren Forderungen begründet worden sind, bevor die Eintragung des Beschlusses als nach § 10 des Handelsgesetzbuches bekannt gemacht gilt, ist, wenn sie sich binnen sechs Monaten nach der Bekanntmachung zu diesem Zweck melden, Sicherheit zu leisten, soweit sie nicht Befriedigung verlangen können. Dieses Recht steht den Gläubigern nicht zu, die im Fall des Insolvenzverfahrens ein Recht auf vorzugsweise Befriedigung aus der Deckungsmasse haben, die nach gesetzlicher Vorschrift zu ihrem Schutz errichtet und staatlich überwacht ist."
    },
    {
      "date": "2024-10-09",
      "original_text": "Registerbekanntmachung nach dem Umwandlungsgesetz\nMecklenburg-Vorpommern Amtsgericht Neubrandenburg GnR 359\nAgrargenossenschaft eG Hohen Demzin – Moltzow",
      "type": "Registerbekanntmachung nach dem Umwandlungsgesetz",
      "state": "Mecklenburg-Vorpommern",
      "amtsgericht": "Amtsgericht Neubrandenburg",
      "registernummer": "GnR 359",
      "registerart": "GnR",
      "company_name": "Agrargenossenschaft eG Hohen Demzin",
      "company_seat": "Moltzow",
      "details": "09.10.2024 (Bekanntmachungsdatum)\n\nMecklenburg-Vorpommern Amtsgericht Neubrandenburg GnR 359\nRegisterbekanntmachung nach dem Umwandlungsgesetz 09.10.2024 (Eintragungsdatum)\n\nAgrargenossenschaft eG Hohen Demzin\neingetragene Genossenschaft\nMoltzow\n\nAls nicht eingetragen wird veröffentlicht: Den Gläubigern der an der Umwandlung beteiligten Rechtsträger ist, wenn sie binnen sechs\nMonaten nach dem Tag, an dem die Eintragung der Umwandlung in das Register des Sitzes desjenigen Rechtsträgers, dessen Gläubiger sie sind, nach § 19 Abs. 3 UmwG als bekannt gemacht gilt, ihren Anspruch nach Grund und Höhe schriftlich anmelden, Sicherheit zu leisten, soweit sie nicht Befriedigung verlangen können. Dieses Recht steht den Gläubigern jedoch nur zu, wenn sie glaubhaft machen, dass durch die Umwandlung die Erfüllung der Forderung gefährdet wird."
    },
    {
      "date": "2024-10-09",
      "original_text": "Registerbekanntmachung nach dem Umwandlungsgesetz\nBerlin Amtsgericht Berlin (Charlottenburg) HRA 57672\nAlex Sneakerstore e. K. – Berlin",
      "type": "Registerbekanntmachung nach dem Umwandlungsgesetz",
      "state": "Berlin",
      "amtsgericht": "Amtsgericht Berlin (Charlottenburg)",
      "registernummer": "HRA 57672",
      "registerart": "HRA",
      "company_name": "Alex Sneakerstore e. K.",
      "company_seat": "Berlin",
      "details": "09.10.2024 (Bekanntmachungsdatum)\n\nBerlin Amtsgericht Berlin (Charlottenburg) HRA 57672\nRegisterbekanntmachung nach dem Umwandlungsgesetz 08.10.2024 (Eintragungsdatum)\n\nAlex Sneakerstore e. K.\nEinzelkaufmann / Einzelkauffrau\nBerlin\n\nZu Eintragungsnummer 4 vom 08.10.2024 wird als nicht eingetragen veröffentlicht: Den Gläubigern der an der Spaltung beteiligten Rechtsträger ist, wenn sie binnen sechs Monaten nach dem Tag, an dem die Eintragung der Spaltung in das Register des Sitzes desjenigen Rechtsträgers, dessen Gläubiger sie sind, als bekannt gemacht gilt, ihren Anspruch nach Grund und Höhe schriftlich anmelden, Sicherheit zu leisten, soweit sie nicht Befriedigung verlangen können. Dieses Recht steht den Gläubigern jedoch nur zu, wenn sie glaubhaft machen, dass durch die Spaltung die Erfüllung ihrer Forderung gefährdet wird. Das Recht, Sicherheitsleistung zu verlangen, steht Gläubigern nicht zu, die im Falle der Insolvenz ein Recht auf vorzugsweise Befriedigung aus einer Deckungsmasse haben, die nach gesetzlicher Vorschrift zu ihrem Schutz errichtet und staatlich überwacht ist."
    },
    {
      "date": "2024-10-09",
      "original_text": "Einreichung neuer Dokumente\nRheinland-Pfalz Amtsgericht Koblenz HRB 14052\nAndernach.net, Gesellschaft für Stadtmarketing, Wirtschaft und Tourismus mbH – Andernach",
      "type": "Einreichung neuer Dokumente",
      "state": "Rheinland-Pfalz",
      "amtsgericht": "Amtsgericht Koblenz",
      "registernummer": "HRB 14052",
      "registerart": "HRB",
      "company_name": "Andernach.net, Gesellschaft für Stadtmarketing, Wirtschaft und Tourismus mbH",
      "company_seat": "Andernach",
      "details": "09.10.2024 (Bekanntmachungsdatum)\n\nRheinland-Pfalz Amtsgericht Koblenz HRB 14052\nEinreichung neuer Dokumente\n\nAndernach.net, Gesellschaft für Stadtmarketing, Wirtschaft und Tourismus mbH\nGesellschaft mit beschränkter Haftung\nAndernach\n\nDem Registergericht ist eine neue Liste der Mitglieder des Aufsichtsrates eingereicht worden."
    },
    {
      "date": "2024-10-09",
      "original_text": "Registerbekanntmachung nach dem Umwandlungsgesetz\nBaden-Württemberg Amtsgericht Ulm HRB 748248\nAniCura Kleintierzentrum Reutlingen GmbH – Ravensburg",
      "type": "Registerbekanntmachung nach dem Umwandlungsgesetz",
      "state": "Baden-Württemberg",
      "amtsgericht": "Amtsgericht Ulm",
      "registernummer": "HRB 748248",
      "registerart": "HRB",
      "company_name": "AniCura Kleintierzentrum Reutlingen GmbH",
      "company_seat": "Ravensburg",
      "details": "09.10.2024 (Bekanntmachungsdatum)\n\nBaden-Württemberg Amtsgericht Ulm HRB 748248\nRegisterbekanntmachung nach dem Umwandlungsgesetz 09.10.2024 (Eintragungsdatum)\n\nAniCura Kleintierzentrum Reutlingen GmbH\nGesellschaft mit beschränkter Haftung\nRavensburg\n\nAls nicht eingetragen wird bekanntgemacht:\nDen Gläubigern der an der Verschmelzung beteiligten Rechtsträger ist, wenn sie binnen sechs Monaten nach dem Tag, an dem die Eintragung der Verschmelzung in das Register des Sitzes desjenigen Rechtsträgers, dessen Gläubiger sie sind, nach § 19 Abs. 3 UmwG als bekanntgemacht gilt, ihren Anspruch nach Grund und Höhe schriftlich anmelden, Sicherheit zu leisten, soweit sie nicht Befriedigung verlangen können. Dieses Recht steht den Gläubigern jedoch nur zu, wenn sie glaubhaft machen, dass durch die Verschmelzung die Erfüllung ihrer Forderung gefährdet wird."
    },
    {
      "date": "2024-10-09",
      "original_text": "Registerbekanntmachung nach dem Umwandlungsgesetz\nBaden-Württemberg Amtsgericht Ulm HRB 748252\nAniCura Recklinghausen GmbH – Ravensburg",
      "type": "Registerbekanntmachung nach dem Umwandlungsgesetz",
      "state": "Baden-Württemberg",
      "amtsgericht": "Amtsgericht Ulm",
      "registernummer": "HRB 748252",
      "registerart": "HRB",
      "company_name": "AniCura Recklinghausen GmbH",
      "company_seat": "Ravensburg",
      "details": "09.10.2024 (Bekanntmachungsdatum)\n\nBaden-Württemberg Amtsgericht Ulm HRB 748252\nRegisterbekanntmachung nach dem Umwandlungsgesetz 09.10.2024 (Eintragungsdatum)\n\nAniCura Recklinghausen GmbH\nGesellschaft mit beschränkter Haftung\nRavensburg\n\nAls nicht eingetragen wird bekanntgemacht:\nDen Gläubigern der an der Verschmelzung beteiligten Rechtsträger ist, wenn sie binnen sechs Monaten nach dem Tag, an dem die Eintragung der Verschmelzung in das Register des Sitzes desjenigen Rechtsträgers, dessen Gläubiger sie sind, nach § 19 Abs. 3 UmwG als bekanntgemacht gilt, ihren Anspruch nach Grund und Höhe schriftlich anmelden, Sicherheit zu leisten, soweit sie nicht Befriedigung verlangen können. Dieses Recht steht den Gläubigern jedoch nur zu, wenn sie glaubhaft machen, dass durch die Verschmelzung die Erfüllung ihrer Forderung gefährdet wird."
    },
    {
      "date": "2024-10-09",
      "original_text": "Löschungsankündigung\nHessen Amtsgericht Königstein HRB 9511\nArealPlan UG (haftungsbeschränkt) – Kelkheim (Taunus)",
      "type": "Löschungsankündigung",
      "state": "Hessen",
      "amtsgericht": "Amtsgericht Königstein",
      "registernummer": "HRB 9511",
      "registerart": "HRB",
      "company_name": "ArealPlan UG (haftungsbeschränkt)",
      "company_seat": "Kelkheim (Taunus)",
      "details": "09.10.2024 (Bekanntmachungsdatum)\n\nHessen Amtsgericht Königstein HRB 9511\nLöschungsankündigung 09.10.2024 (Eintragungsdatum)\n\nArealPlan UG (haftungsbeschränkt)\nGesellschaft mit beschränkter Haftung\nKelkheim (Taunus)\n\nDas Registergericht beabsichtigt die im Handelsregister eingetragene Gesellschaft von Amts wegen nach § 394 FamFG zu löschen. Die Frist zur Erhebung eines Widerspruchs gegen die beabsichtigte Löschung wird auf 1 Monat festgesetzt."
    },
    {
      "date": "2024-10-09",
      "original_text": "Registerbekanntmachung nach dem Umwandlungsgesetz\nRheinland-Pfalz Amtsgericht Wittlich HRB 41728\nAusonius Projektentwicklungsgesellschaft mbH & Co. KGaA – Traben-Trarbach",
      "type": "Registerbekanntmachung nach dem Umwandlungsgesetz",
      "state": "Rheinland-Pfalz",
      "amtsgericht": "Amtsgericht Wittlich",
      "registernummer": "HRB 41728",
      "registerart": "HRB",
      "company_name": "Ausonius Projektentwicklungsgesellschaft mbH & Co. KGaA",
      "company_seat": "Traben-Trarbach",
      "details": "09.10.2024 (Bekanntmachungsdatum)\n\nRheinland-Pfalz Amtsgericht Wittlich HRB 41728\nRegisterbekanntmachung nach dem Umwandlungsgesetz 09.10.2024 (Eintragungsdatum)\n\nAusonius Projektentwicklungsgesellschaft mbH & Co. KGaA\nKommanditgesellschaft auf Aktien\nTraben-Trarbach\n\nAls nicht eingetragen wird veröffentlicht: Den Gläubigern der an der Umwandlungbeteiligten Rechtsträger ist, wenn sie binnen sechs Monaten nach dem Tag, an dem die Eintragung der Umwandlung in das Register des Sitzes desjenigen Rechtsträgers, dessen Gläubiger sie sind, nach § 19 Abs. 3 UmwG als bekannt gemacht gilt, ihren Anspruch nach Grund und Höhe schriftlich anmelden, Sicherheit zu leisten, soweit sie nicht Befriedigung verlangen können. Dieses Recht steht den Gläubigern jedoch nur zu, wenn sie glaubhaft machen, dass durch die Umwandlung die Erfüllung der Forderung gefährdet wird."
    },
    {
      "date": "2024-10-09",
      "original_text": "Registerbekanntmachung nach dem Umwandlungsgesetz\nHamburg Amtsgericht Hamburg HRB 111732\nBDJ Assekuradeur GmbH – Hamburg",
      "type": "Registerbekanntmachung nach dem Umwandlungsgesetz",
      "state": "Hamburg",
      "amtsgericht": "Amtsgericht Hamburg",
      "registernummer": "HRB 111732",
      "registerart": "HRB",
      "company_name": "BDJ Assekuradeur GmbH",
      "company_seat": "Hamburg",
      "details": "09.10.2024 (Bekanntmachungsdatum)\n\nHamburg Amtsgericht Hamburg HRB 111732\nRegisterbekanntmachung nach dem Umwandlungsgesetz 08.10.2024 (Eintragungsdatum)\n\nBDJ Assekuradeur GmbH\nGesellschaft mit beschränkter Haftung\nHamburg\n\nAls nicht eingetragen wird bekannt gemacht:\nDen Gläubigern der an der Aufspaltung beteiligten Gesellschaften ist, wenn sie binnen sechs Monaten nach dem Tag, an dem die Eintragung der Aufspaltung in das Register des Sitzes desjenigen Rechtsträgers, dessen Gläubiger sie sind, nach § 19 Absatz 3 UmwG als bekannt gemacht gilt, ihren Anspruch nach Grund und Höhe schriftlich anmelden, Sicherheit zu leisten, soweit sie nicht Befriedigung verlangen können. Dieses Recht steht den Gläubigern jedoch nur zu, wenn sie glaubhaft machen, dass durch die Aufspaltung die Erfüllung ihrer Forderung gefährdet wird."
    },
    {
      "date": "2024-10-09",
      "original_text": "Registerbekanntmachung nach dem Umwandlungsgesetz\nBayern Amtsgericht Deggendorf HRA 3618\nBJ Vermögensverwaltung GmbH & Co. KG – Hengersberg",
      "type": "Registerbekanntmachung nach dem Umwandlungsgesetz",
      "state": "Bayern",
      "amtsgericht": "Amtsgericht Deggendorf",
      "registernummer": "HRA 3618",
      "registerart": "HRA",
      "company_name": "BJ Vermögensverwaltung GmbH & Co. KG",
      "company_seat": "Hengersberg",
      "details": "09.10.2024 (Bekanntmachungsdatum)\n\nBayern Amtsgericht Deggendorf HRA 3618\nRegisterbekanntmachung nach dem Umwandlungsgesetz 08.10.2024 (Eintragungsdatum)\n\nBJ Vermögensverwaltung GmbH & Co. KG\nKommanditgesellschaft\nHengersberg\n\nDen Gläubigern der an der Ausgliederung beteiligten Rechtsträger ist, wenn sie binnen sechs Monaten nach dem Tag, an dem die Eintragung der Ausgliederung in das Register des Sitzes desjenigen Rechtsträgers, dessen Gläubiger sie sind, nach §§ 125, 19 Abs. 3 UmwG als bekannt gemacht gilt, ihren Anspruch nach Grund und Höhe schriftlich anmelden, Sicherheit zu leisten, soweit sie nicht Befriedigung verlangen können. Dieses Recht steht den Gläubigern jedoch nur zu, wenn sie glaubhaft machen, dass durch die Ausgliederung die Erfüllung ihrer Forderung gefährdet wird."
    },
    {
      "date": "2024-10-09",
      "original_text": "Registerbekanntmachung nach dem Umwandlungsgesetz\nBayern Amtsgericht Memmingen HRA 14147\nBaumert Andre e.K. – Senden",
      "type": "Registerbekanntmachung nach dem Umwandlungsgesetz",
      "state": "Bayern",
      "amtsgericht": "Amtsgericht Memmingen",
      "registernummer": "HRA 14147",
      "registerart": "HRA",
      "company_name": "Baumert Andre e.K.",
      "company_seat": "Senden",
      "details": "09.10.2024 (Bekanntmachungsdatum)\n\nBayern Amtsgericht Memmingen HRA 14147\nRegisterbekanntmachung nach dem Umwandlungsgesetz 08.10.2024 (Eintragungsdatum)\n\nBaumert Andre e.K.\nEinzelkaufmann / Einzelkauffrau\nSenden\n\nDen Gläubigern der an der Ausgliederung beteiligten Rechtsträger ist, wenn sie binnen sechs Monaten nach dem Tag, an dem die Eintragung der Ausgliederung in das Register des Sitzes desjenigen Rechtsträgers, dessen Gläubiger sie sind, nach §§ 125, 19 Abs. 3 UmwG als bekannt gemacht gilt, ihren Anspruch nach Grund und Höhe schriftlich anmelden, Sicherheit zu leisten, soweit sie nicht Befriedigung verlangen können. Dieses Recht steht den Gläubigern jedoch nur zu, wenn sie glaubhaft machen, dass durch die Ausgliederung die Erfüllung ihrer Forderung gefährdet wird."
    },
    {
      "date": "2024-10-09",
      "original_text": "Registerbekanntmachung nach dem Umwandlungsgesetz\nBayern Amtsgericht Memmingen HRB 21184\nBaumert Gerüstbautechnik GmbH – Senden",
      "type": "Registerbekanntmachung nach dem Umwandlungsgesetz",
      "state": "Bayern",
      "amtsgericht": "Amtsgericht Memmingen",
      "registernummer": "HRB 21184",
      "registerart": "HRB",
      "company_name": "Baumert Gerüstbautechnik GmbH",
      "company_seat": "Senden",
      "details": "09.10.2024 (Bekanntmachungsdatum)\n\nBayern Amtsgericht Memmingen HRB 21184\nRegisterbekanntmachung nach dem Umwandlungsgesetz 08.10.2024 (Eintragungsdatum)\n\nBaumert Gerüstbautechnik GmbH\nGesellschaft mit beschränkter Haftung\nSenden\n\nDen Gläubigern der an der Ausgliederung beteiligten Rechtsträger ist, wenn sie binnen sechs Monaten nach dem Tag, an dem die Eintragung der Ausgliederung in das Register des Sitzes desjenigen Rechtsträgers, dessen Gläubiger sie sind, nach §§ 125, 19 Abs. 3 UmwG als bekannt gemacht gilt, ihren Anspruch nach Grund und Höhe schriftlich anmelden, Sicherheit zu leisten, soweit sie nicht Befriedigung verlangen können. Dieses Recht steht den Gläubigern jedoch nur zu, wenn sie glaubhaft machen, dass durch die Ausgliederung die Erfüllung ihrer Forderung gefährdet wird."
    },
    {
      "date": "2024-10-09",
      "original_text": "Einreichung neuer Dokumente\nNordrhein-Westfalen Amtsgericht Köln HRB 48466\nBayer Gastronomie GmbH – Leverkusen",
      "type": "Einreichung neuer Dokumente",
      "state": "Nordrhein-Westfalen",
      "amtsgericht": "Amtsgericht Köln",
      "registernummer": "HRB 48466",
      "registerart": "HRB",
      "company_name": "Bayer Gastronomie GmbH",
      "company_seat": "Leverkusen",
      "details": "09.10.2024 (Bekanntmachungsdatum)\n\nNordrhein-Westfalen Amtsgericht Köln HRB 48466\nEinreichung neuer Dokumente\n\nBayer Gastronomie GmbH\nGesellschaft mit beschränkter Haftung\nLeverkusen\n\nDem Registergericht ist eine Liste der Mitglieder des Aufsichtsrates eingereicht worden."
    },
    {
      "date": "2024-10-09",
      "original_text": "Einreichung neuer Dokumente\nNordrhein-Westfalen Amtsgericht Paderborn HRB 7565\nBeihilfe-Partner AG – Büren",
      "type": "Einreichung neuer Dokumente",
      "state": "Nordrhein-Westfalen",
      "amtsgericht": "Amtsgericht Paderborn",
      "registernummer": "HRB 7565",
      "registerart": "HRB",
      "company_name": "Beihilfe-Partner AG",
      "company_seat": "Büren",
      "details": "09.10.2024 (Bekanntmachungsdatum)\n\nNordrhein-Westfalen Amtsgericht Paderborn HRB 7565\nEinreichung neuer Dokumente\n\nBeihilfe-Partner AG\nAktiengesellschaft\nBüren\n\nDem Registergericht ist eine Liste der Mitglieder des Aufsichtsrates eingereicht worden."
    },
    {
      "date": "2024-10-09",
      "original_text": "Registerbekanntmachung nach dem Umwandlungsgesetz\nBayern Amtsgericht Deggendorf HRA 3645\nBernhard Wirth Elektromeister e.K. – Hengersberg",
      "type": "Registerbekanntmachung nach dem Umwandlungsgesetz",
      "state": "Bayern",
      "amtsgericht": "Amtsgericht Deggendorf",
      "registernummer": "HRA 3645",
      "registerart": "HRA",
      "company_name": "Bernhard Wirth Elektromeister e.K.",
      "company_seat": "Hengersberg",
      "details": "09.10.2024 (Bekanntmachungsdatum)\n\nBayern Amtsgericht Deggendorf HRA 3645\nRegisterbekanntmachung nach dem Umwandlungsgesetz 08.10.2024 (Eintragungsdatum)\n\nBernhard Wirth Elektromeister e.K.\nEinzelkaufmann / Einzelkauffrau\nHengersberg\n\nDen Gläubigern der an der Ausgliederung beteiligten Rechtsträger ist, wenn sie binnen sechs Monaten nach dem Tag, an dem die Eintragung der Ausgliederung in das Register des Sitzes desjenigen Rechtsträgers, dessen Gläubiger sie sind, nach §§ 125, 19 Abs. 3 UmwG als bekannt gemacht gilt, ihren Anspruch nach Grund und Höhe schriftlich anmelden, Sicherheit zu leisten, soweit sie nicht Befriedigung verlangen können. Dieses Recht steht den Gläubigern jedoch nur zu, wenn sie glaubhaft machen, dass durch die Ausgliederung die Erfüllung ihrer Forderung gefährdet wird."
    },
    {
      "date": "2024-10-09",
      "original_text": "Löschungsankündigung\nBremen Amtsgericht Bremen HRA 26939\nBetreibergesellschaft H1618A GmbH & Co. KG – Bremen",
      "type": "Löschungsankündigung",
      "state": "Bremen",
      "amtsgericht": "Amtsgericht Bremen",
      "registernummer": "HRA 26939",
      "registerart": "HRA",
      "company_name": "Betreibergesellschaft H1618A GmbH & Co. KG",
      "company_seat": "Bremen",
      "details": "09.10.2024 (Bekanntmachungsdatum)\n\nBremen Amtsgericht Bremen HRA 26939\nLöschungsankündigung\n\nBetreibergesellschaft H1618A GmbH & Co. KG\nKommanditgesellschaft\nBremen\n\nEs ist beabsichtigt die im Handelsregister eingetragene Gesellschaft von Amts wegen gemäß § 394 FamFG zu löschen. Gegen die Löschung kann beim AG Bremen schriftlich oder zu Protokoll der Geschäftsstelle Widerspruch eingelegt werden. Widerspruchsfrist 4 Wochen."
    },
    {
      "date": "2024-10-09",
      "original_text": "Sonstige Registerbekanntmachung\nHamburg Amtsgericht Hamburg HRB 103320\nBlohm + Voss Shipyards & Services GmbH – Hamburg",
      "type": "Sonstige Registerbekanntmachung",
      "state": "Hamburg",
      "amtsgericht": "Amtsgericht Hamburg",
      "registernummer": "HRB 103320",
      "registerart": "HRB",
      "company_name": "Blohm + Voss Shipyards & Services GmbH",
      "company_seat": "Hamburg",
      "details": "09.10.2024 (Bekanntmachungsdatum)\n\nHamburg Amtsgericht Hamburg HRB 103320\nSonstige Registerbekanntmachung 09.10.2024 (Eintragungsdatum)\n\nBlohm + Voss Shipyards & Services GmbH\nGesellschaft mit beschränkter Haftung\nHamburg\n\nAls nicht eingetragen wird bekannt gemacht:  Den Gläubigern der Gesellschaft, deren Forderungen begründet worden sind, bevor die Eintragung der Vertragsbeendigung in das Handelsregister nach § 10 HGB als bekannt gemacht gilt, ist vom anderen Vertragsteil Sicherheit zu leisten, wenn sie sich binnen 6 Monaten nach Bekanntmachung der Eintragung zu diesem Zweck bei ihm melden."
    },
    {
      "date": "2024-10-09",
      "original_text": "Registerbekanntmachung nach dem Umwandlungsgesetz\nRheinland-Pfalz Amtsgericht Bad Kreuznach HRB 22120\nBlum GmbH – Idar-Oberstein",
      "type": "Registerbekanntmachung nach dem Umwandlungsgesetz",
      "state": "Rheinland-Pfalz",
      "amtsgericht": "Amtsgericht Bad Kreuznach",
      "registernummer": "HRB 22120",
      "registerart": "HRB",
      "company_name": "Blum GmbH",
      "company_seat": "Idar-Oberstein",
      "details": "09.10.2024 (Bekanntmachungsdatum)\n\nRheinland-Pfalz Amtsgericht Bad Kreuznach HRB 22120\nRegisterbekanntmachung nach dem Umwandlungsgesetz 09.10.2024 (Eintragungsdatum)\n\nBlum GmbH\nGesellschaft mit beschränkter Haftung\nIdar-Oberstein\n\nAls nicht eingetragen wird veröffentlicht: Den Gläubigern der an der Verschmelzung beteiligten Rechtsträger ist, wenn sie binnen sechs Monaten nach dem Tag, an dem die Eintragung der Verschmelzung in das Register des Sitzes desjenigen Rechtsträgers, dessen Gläubiger sie sind, nach § 19 Abs. 3 UmwG als bekannt gemacht gilt, ihren Anspruch nach Grund und Höhe schriftlich anmelden, Sicherheit zu leisten, soweit sie nicht Befriedigung verlangen können. Dieses Recht steht den Gläubigern jedoch nur zu, wenn sie glaubhaft machen, dass durch die Verschmelzung die Erfüllung der Forderung gefährdet wird."
    },
    {
      "date": "2024-10-09",
      "original_text": "Registerbekanntmachung nach dem Umwandlungsgesetz\nRheinland-Pfalz Amtsgericht Bad Kreuznach HRB 10937\nBlum Sanierung GmbH – Idar-Oberstein",
      "type": "Registerbekanntmachung nach dem Umwandlungsgesetz",
      "state": "Rheinland-Pfalz",
      "amtsgericht": "Amtsgericht Bad Kreuznach",
      "registernummer": "HRB 10937",
      "registerart": "HRB",
      "company_name": "Blum Sanierung GmbH",
      "company_seat": "Idar-Oberstein",
      "details": "09.10.2024 (Bekanntmachungsdatum)\n\nRheinland-Pfalz Amtsgericht Bad Kreuznach HRB 10937\nRegisterbekanntmachung nach dem Umwandlungsgesetz 09.10.2024 (Eintragungsdatum)\n\nBlum Sanierung GmbH\nGesellschaft mit beschränkter Haftung\nIdar-Oberstein\n\nAls nicht eingetragen wird veröffentlicht: Den Gläubigern der an der Verschmelzung beteiligten Rechtsträger ist, wenn sie binnen sechs Monaten nach dem Tag, an dem die Eintragung der Verschmelzung in das Register des Sitzes desjenigen Rechtsträgers, dessen Gläubiger sie sind, nach § 19 Abs. 3 UmwG als bekannt gemacht gilt, ihren Anspruch nach Grund und Höhe schriftlich anmelden, Sicherheit zu leisten, soweit sie nicht Befriedigung verlangen können. Dieses Recht steht den Gläubigern jedoch nur zu, wenn sie glaubhaft machen, dass durch die Verschmelzung die Erfüllung der Forderung gefährdet wird."
    },
    {
      "date": "2024-10-09",
      "original_text": "Registerbekanntmachung nach dem Umwandlungsgesetz\nBayern Amtsgericht Nürnberg GsR 252\nBucher Physiotherapie Geiger Horndasch Sutter eGbR – Nürnberg",
      "type": "Registerbekanntmachung nach dem Umwandlungsgesetz",
      "state": "Bayern",
      "amtsgericht": "Amtsgericht Nürnberg",
      "registernummer": "GsR 252",
      "registerart": "GsR",
      "company_name": "Bucher Physiotherapie Geiger Horndasch Sutter eGbR",
      "company_seat": "Nürnberg",
      "details": "09.10.2024 (Bekanntmachungsdatum)\n\nBayern Amtsgericht Nürnberg GsR 252\nRegisterbekanntmachung nach dem Umwandlungsgesetz 08.10.2024 (Eintragungsdatum)\n\nBucher Physiotherapie Geiger Horndasch Sutter eGbR\nGesellschaft bürgerlichen Rechts\nNürnberg\n\nDen Gläubigern des formwechselnden Rechtsträgers ist, wenn sie binnen sechs Monaten nach dem Tag, an dem die Eintragung des Formwechsels nach § 201 UmwG als bekannt gemacht gilt, ihren Anspruch nach Grund und Höhe schriftlich anmelden, Sicherheit zu leisten, soweit sie nicht Befriedigung verlangen können. Dieses Recht steht den Gläubigern jedoch nur zu, wenn sie glaubhaft machen, dass durch den Formwechsel die Erfüllung ihrer Forderung gefährdet wird."
    },
    {
      "date": "2024-10-09",
      "original_text": "Registerbekanntmachung nach dem Umwandlungsgesetz\nBaden-Württemberg Amtsgericht Mannheim HRB 745678\nBuckow Group - Gesundheit und Wellness Holding GmbH – Karlsruhe",
      "type": "Registerbekanntmachung nach dem Umwandlungsgesetz",
      "state": "Baden-Württemberg",
      "amtsgericht": "Amtsgericht Mannheim",
      "registernummer": "HRB 745678",
      "registerart": "HRB",
      "company_name": "Buckow Group - Gesundheit und Wellness Holding GmbH",
      "company_seat": "Karlsruhe",
      "details": "09.10.2024 (Bekanntmachungsdatum)\n\nBaden-Württemberg Amtsgericht Mannheim HRB 745678\nRegisterbekanntmachung nach dem Umwandlungsgesetz 09.10.2024 (Eintragungsdatum)\n\nBuckow Group - Gesundheit und Wellness Holding GmbH\nGesellschaft mit beschränkter Haftung\nKarlsruhe\n\nAls nicht eingetragen wird bekanntgemacht: Den Gläubigern der an der Verschmelzung beteiligten Rechtsträger ist, wenn sie binnen sechs Monaten nach dem Tag, an dem die Eintragung der Verschmelzung in das Register des Sitzes desjenigen Rechtsträgers, dessen Gläubiger sie sind, nach § 19 Abs. 3 UmwG als bekanntgemacht gilt, ihren Anspruch nach Grund und Höhe schriftlich anmelden, Sicherheit zu leisten, soweit sie nicht Befriedigung verlangen können. Dieses Recht steht den Gläubigern jedoch nur zu, wenn sie glaubhaft machen, dass durch die Verschmelzung die Erfüllung ihrer Forderung gefährdet wird."
    },
    {
      "date": "2024-10-09",
      "original_text": "Einreichung neuer Dokumente\nNordrhein-Westfalen Amtsgericht Köln HRB 63521\nCAM Alternatives GmbH – Köln",
      "type": "Einreichung neuer Dokumente",
      "state": "Nordrhein-Westfalen",
      "amtsgericht": "Amtsgericht Köln",
      "registernummer": "HRB 63521",
      "registerart": "HRB",
      "company_name": "CAM Alternatives GmbH",
      "company_seat": "Köln",
      "details": "09.10.2024 (Bekanntmachungsdatum)\n\nNordrhein-Westfalen Amtsgericht Köln HRB 63521\nEinreichung neuer Dokumente\n\nCAM Alternatives GmbH\nGesellschaft mit beschränkter Haftung\nKöln\n\nDem Registergericht ist eine Liste der Mitglieder des Aufsichtsrates eingereicht worden."
    },
    {
      "date": "2024-10-09",
      "original_text": "Registerbekanntmachung nach dem Umwandlungsgesetz\nBerlin Amtsgericht Berlin (Charlottenburg) HRA 54494\nCF Fitness Berlin-Pankow e.K. – Berlin",
      "type": "Registerbekanntmachung nach dem Umwandlungsgesetz",
      "state": "Berlin",
      "amtsgericht": "Amtsgericht Berlin (Charlottenburg)",
      "registernummer": "HRA 54494",
      "registerart": "HRA",
      "company_name": "CF Fitness Berlin-Pankow e.K.",
      "company_seat": "Berlin",
      "details": "09.10.2024 (Bekanntmachungsdatum)\n\nBerlin Amtsgericht Berlin (Charlottenburg) HRA 54494\nRegisterbekanntmachung nach dem Umwandlungsgesetz 08.10.2024 (Eintragungsdatum)\n\nCF Fitness Berlin-Pankow e.K.\nEinzelkaufmann / Einzelkauffrau\nBerlin\n\nZu Eintragungsnummer 2 vom 08.10.2024 wird als nicht eingetragen veröffentlicht: Den Gläubigern der an der Ausgliederung beteiligten Rechtsträger ist, wenn sie binnen sechs Monaten nach dem Tag, an dem die Eintragung der Ausgliederung in das Register des Sitzes desjenigen Rechtsträgers, dessen Gläubiger sie sind, als bekannt gemacht gilt, ihren Anspruch nach Grund und Höhe schriftlich anmelden, Sicherheit zu leisten, soweit sie nicht Befriedigung verlangen können. Dieses Recht steht den Gläubigern jedoch nur zu, wenn sie glaubhaft machen, dass durch die Ausgliederung die Erfüllung ihrer Forderung gefährdet wird. Das Recht, Sicherheitsleistung zu verlangen, steht Gläubigern nicht zu, die im Falle der Insolvenz ein Recht auf vorzugsweise Befriedigung aus einer Deckungsmasse haben, die nach gesetzlicher Vorschrift zu ihrem Schutz errichtet und staatlich überwacht ist."
    },
    {
      "date": "2024-10-09",
      "original_text": "Löschungsankündigung\nBrandenburg Amtsgericht Frankfurt/Oder HRB 17449\nCLICKHERO GmbH – Eberswalde",
      "type": "Löschungsankündigung",
      "state": "Brandenburg",
      "amtsgericht": "Amtsgericht Frankfurt/Oder",
      "registernummer": "HRB 17449",
      "registerart": "HRB",
      "company_name": "CLICKHERO GmbH",
      "company_seat": "Eberswalde",
      "details": "09.10.2024 (Bekanntmachungsdatum)\n\nBrandenburg Amtsgericht Frankfurt/Oder HRB 17449\nLöschungsankündigung\n\nCLICKHERO GmbH\nGesellschaft mit beschränkter Haftung\nEberswalde\n\nBei der nachstehenden Gesellschaft wird das Amtslöschungsverfahren gemäß § 394 FamFG eingeleitet."
    },
    {
      "date": "2024-10-09",
      "original_text": "Registerbekanntmachung nach dem Umwandlungsgesetz\nBayern Amtsgericht Nürnberg HRB 32432\nCR Beteiligungs GmbH – Lauf a.d.Pegnitz",
      "type": "Registerbekanntmachung nach dem Umwandlungsgesetz",
      "state": "Bayern",
      "amtsgericht": "Amtsgericht Nürnberg",
      "registernummer": "HRB 32432",
      "registerart": "HRB",
      "company_name": "CR Beteiligungs GmbH",
      "company_seat": "Lauf a.d.Pegnitz",
      "details": "09.10.2024 (Bekanntmachungsdatum)\n\nBayern Amtsgericht Nürnberg HRB 32432\nRegisterbekanntmachung nach dem Umwandlungsgesetz 08.10.2024 (Eintragungsdatum)\n\nCR Beteiligungs GmbH\nGesellschaft mit beschränkter Haftung\nLauf a.d.Pegnitz\n\nDen Gläubigern der an der Verschmelzung beteiligten Rechtsträger ist, wenn sie binnen sechs Monaten nach dem Tag, an dem die Eintragung der Verschmelzung in das Register des Sitzes desjenigen Rechtsträgers, dessen Gläubiger sie sind, nach § 19 Abs. 3 UmwG als bekannt gemacht gilt, ihren Anspruch nach Grund und Höhe schriftlich anmelden, Sicherheit zu leisten, soweit sie nicht Befriedigung verlangen können. Dieses Recht steht den Gläubigern jedoch nur zu, wenn sie glaubhaft machen, dass durch die Verschmelzung die Erfüllung ihrer Forderung gefährdet wird."
    },
    {
      "date": "2024-10-09",
      "original_text": "Registerbekanntmachung nach dem Umwandlungsgesetz\nSachsen-Anhalt Amtsgericht Stendal HRB 34511\nCS Holding GmbH – Magdeburg",
      "type": "Registerbekanntmachung nach dem Umwandlungsgesetz",
      "state": "Sachsen-Anhalt",
      "amtsgericht": "Amtsgericht Stendal",
      "registernummer": "HRB 34511",
      "registerart": "HRB",
      "company_name": "CS Holding GmbH",
      "company_seat": "Magdeburg",
      "details": "09.10.2024 (Bekanntmachungsdatum)\n\nSachsen-Anhalt Amtsgericht Stendal HRB 34511\nRegisterbekanntmachung nach dem Umwandlungsgesetz 09.10.2024 (Eintragungsdatum)\n\nCS Holding GmbH\nGesellschaft mit beschränkter Haftung\nMagdeburg\n\nNicht eingetragen:\nDen Gläubigern der an der Verschmelzung beteiligten Rechtsträger ist, wenn sie binnen sechs Monaten nach dem Tag, an dem die Eintragung der Verschmelzung nach § 19 Abs. 3 UmwG als bekanntgemacht gilt, ihren Anspruch nach Grund und Höhe schriftlich anmelden, Sicherheit zu leisten, soweit sie nicht Befriedigung verlangen können. Dieses Recht steht ihnen jedoch nur zu, wenn sie glaubhaft machen, dass durch die Verschmelzung die Erfüllung ihrer Forderung gefährdet wird."
    },
    {
      "date": "2024-10-09",
      "original_text": "Sonstige Registerbekanntmachung\nBerlin Amtsgericht Berlin (Charlottenburg) HRA 50638\nCar-Transferlogistik GmbH & Co. KG – Berlin",
      "type": "Sonstige Registerbekanntmachung",
      "state": "Berlin",
      "amtsgericht": "Amtsgericht Berlin (Charlottenburg)",
      "registernummer": "HRA 50638",
      "registerart": "HRA",
      "company_name": "Car-Transferlogistik GmbH & Co. KG",
      "company_seat": "Berlin",
      "details": "09.10.2024 (Bekanntmachungsdatum)\n\nBerlin Amtsgericht Berlin (Charlottenburg) HRA 50638\nSonstige Registerbekanntmachung\n\nCar-Transferlogistik GmbH & Co. KG\nKommanditgesellschaft\nBerlin\n\nAls nicht eingetragen wird veröffentlicht:\nWird der Beschluss vom 04.07.2024 aufgehoben und das Amtslöschungsverfahren eingestellt."
    },
    {
      "date": "2024-10-09",
      "original_text": "Löschungsankündigung\nNordrhein-Westfalen Amtsgericht Siegburg HRB 12586\nCasa Gastro GmbH – Siegburg",
      "type": "Löschungsankündigung",
      "state": "Nordrhein-Westfalen",
      "amtsgericht": "Amtsgericht Siegburg",
      "registernummer": "HRB 12586",
      "registerart": "HRB",
      "company_name": "Casa Gastro GmbH",
      "company_seat": "Siegburg",
      "details": "09.10.2024 (Bekanntmachungsdatum)\n\nNordrhein-Westfalen Amtsgericht Siegburg HRB 12586\nLöschungsankündigung\n\nCasa Gastro GmbH\nGesellschaft mit beschränkter Haftung\nSiegburg\n\nDas Registergericht hat glaubhafte Kenntnis erlangt, dass die Gesellschaft vermögenslos geworden ist, da ein Insolvenzverfahren durchgeführt und nach § 200 InsO aufgehoben wurde. Es ist daher beabsichtigt, die Gesellschaft nach § 394 FamFG im Handelsregister wegen Vermögenslosigkeit zu löschen. Einwände gegen die Löschung sind durch Widerspruch binnen einer Frist von 3 Monaten geltend zu machen, andernfalls die Löschung erfolgen wird. Einzulegen ist der Widerspruch bei dem Amtsgericht Siegburg, Neue Poststraße 16, 53721 Siegburg, und zwar entweder schriftlich in deutscher Sprache oder mündlich zur Niederschrift der Geschäftsstelle. Der Widerspruch kann auch zur Niederschrift der Geschäftsstelle eines jeden Amtsgerichts abgegeben werden. Der Widerspruch ist binnen der in der Verfügung bestimmten Frist einzulegen. Die Frist ist nur gewahrt, wenn der Widerspruch rechtzeitig bei dem Amtsgericht Siegburg eingeht, auch wenn der Widerspruch zur Niederschrift der Geschäftsstelle eines anderen Amtsgerichts abgegeben wurde. Die Frist beginnt jeweils mit der schriftlichen Bekanntgabe der Verfügung an die Beteiligten. Kann die schriftliche Bekanntgabe an einen Beteiligten nicht bewirkt werden, beginnt die Frist spätestens mit Ablauf von fünf Monaten nach Erlass der Verfügung. Die Bekanntgabe ist entweder durch Zustellung oder am dritten Tage nach Aufgabe zur Post bewirkt. Sofern die Löschung noch nicht erfolgt ist, kann der Widerspruch auch noch nach Ablauf der Frist eingelegt werden. Fällt das Ende der Frist auf einen Sonnabend, einen Sonntag oder einen allgemeinen Feiertag, endet die Frist mit Ablauf des nächsten Werktages. Der Widerspruch ist zu unterzeichnen. Eine Begründung des Widerspruchs ist nicht vorgeschrieben."
    },
    {
      "date": "2024-10-09",
      "original_text": "Registerbekanntmachung nach dem Umwandlungsgesetz\nBayern Amtsgericht Bamberg HRA 13267\nCodec Software e.K. – Bamberg",
      "type": "Registerbekanntmachung nach dem Umwandlungsgesetz",
      "state": "Bayern",
      "amtsgericht": "Amtsgericht Bamberg",
      "registernummer": "HRA 13267",
      "registerart": "HRA",
      "company_name": "Codec Software e.K.",
      "company_seat": "Bamberg",
      "details": "09.10.2024 (Bekanntmachungsdatum)\n\nBayern Amtsgericht Bamberg HRA 13267\nRegisterbekanntmachung nach dem Umwandlungsgesetz 08.10.2024 (Eintragungsdatum)\n\nCodec Software e.K.\nEinzelkaufmann / Einzelkauffrau\nBamberg\n\nDen Gläubigern der an der Verschmelzung beteiligten Rechtsträger ist, wenn sie binnen sechs Monaten nach dem Tag, an dem die Eintragung der Verschmelzung in das Register des Sitzes desjenigen Rechtsträgers, dessen Gläubiger sie sind, nach § 19 Abs. 3 UmwG als bekannt gemacht gilt, ihren Anspruch nach Grund und Höhe schriftlich anmelden, Sicherheit zu leisten, soweit sie nicht Befriedigung verlangen können. Dieses Recht steht den Gläubigern jedoch nur zu, wenn sie glaubhaft machen, dass durch die Verschmelzung die Erfüllung ihrer Forderung gefährdet wird."
    },
    {
      "date": "2024-10-09",
      "original_text": "Löschungsankündigung\nNordrhein-Westfalen Amtsgericht Mönchengladbach HRB 21321\nDIDA Unternehmergesellschaft (haftungsbeschränkt) – Mönchengladbach",
      "type": "Löschungsankündigung",
      "state": "Nordrhein-Westfalen",
      "amtsgericht": "Amtsgericht Mönchengladbach",
      "registernummer": "HRB 21321",
      "registerart": "HRB",
      "company_name": "DIDA Unternehmergesellschaft (haftungsbeschränkt)",
      "company_seat": "Mönchengladbach",
      "details": "09.10.2024 (Bekanntmachungsdatum)\n\nNordrhein-Westfalen Amtsgericht Mönchengladbach HRB 21321\nLöschungsankündigung\n\nDIDA Unternehmergesellschaft (haftungsbeschränkt)\nGesellschaft mit beschränkter Haftung\nMönchengladbach\n\nDas Registergericht beabsichtigt, die im Handelsregister eingetragene Gesellschaft gemäß § 394 Absatz 1 FamFG wegen Vermögenslosigkeit von Amts wegen zu löschen. Gegen diese Verfügung kann Widerspruch eingelegt werden. Die Frist zur Erhebung eines Widerspruchs gegen die beabsichtigte Löschung von Amts wegen ist auf drei Monate festgesetzt."
    },
    {
      "date": "2024-10-09",
      "original_text": "Registerbekanntmachung nach dem Umwandlungsgesetz\nNordrhein-Westfalen Amtsgericht Duisburg HRA 9990\nDP World Logistics Germany B.V. & Co. KG – Duisburg",
      "type": "Registerbekanntmachung nach dem Umwandlungsgesetz",
      "state": "Nordrhein-Westfalen",
      "amtsgericht": "Amtsgericht Duisburg",
      "registernummer": "HRA 9990",
      "registerart": "HRA",
      "company_name": "DP World Logistics Germany B.V. & Co. KG",
      "company_seat": "Duisburg",
      "details": "09.10.2024 (Bekanntmachungsdatum)\n\nNordrhein-Westfalen Amtsgericht Duisburg HRA 9990\nRegisterbekanntmachung nach dem Umwandlungsgesetz 04.10.2024 (Eintragungsdatum)\n\nDP World Logistics Germany B.V. & Co. KG\nKommanditgesellschaft\nDuisburg\n\nDie Gesellschaft hat Gläubigern, deren Forderungen vor dieser Bekanntmachung begründet worden sind, Sicherheit zu leisten, soweit sie nicht Befriedigung verlangen können, wenn sie sich binnen sechs Monaten zu diesem Zweck melden."
    },
    {
      "date": "2024-10-09",
      "original_text": "Registerbekanntmachung nach dem Umwandlungsgesetz\nBayern Amtsgericht München HRB 203230\nDatto GmbH – München",
      "type": "Registerbekanntmachung nach dem Umwandlungsgesetz",
      "state": "Bayern",
      "amtsgericht": "Amtsgericht München",
      "registernummer": "HRB 203230",
      "registerart": "HRB",
      "company_name": "Datto GmbH",
      "company_seat": "München",
      "details": "09.10.2024 (Bekanntmachungsdatum)\n\nBayern Amtsgericht München HRB 203230\nRegisterbekanntmachung nach dem Umwandlungsgesetz 08.10.2024 (Eintragungsdatum)\n\nDatto GmbH\nGesellschaft mit beschränkter Haftung\nMünchen\n\nDen Gläubigern der an der Verschmelzung beteiligten Rechtsträger ist, wenn sie binnen sechs Monaten nach dem Tag, an dem die Eintragung der Verschmelzung in das Register des Sitzes desjenigen Rechtsträgers, dessen Gläubiger sie sind, nach § 19 Abs. 3 UmwG als bekannt gemacht gilt, ihren Anspruch nach Grund und Höhe schriftlich anmelden, Sicherheit zu leisten, soweit sie nicht Befriedigung verlangen können. Dieses Recht steht den Gläubigern jedoch nur zu, wenn sie glaubhaft machen, dass durch die Verschmelzung die Erfüllung ihrer Forderung gefährdet wird."
    },
    {
      "date": "2024-10-09",
      "original_text": "Registerbekanntmachung nach dem Umwandlungsgesetz\nHessen Amtsgericht Marburg HRA 5493\nDentallabor Friedrich Schütz e.K. – Ebsdorfergrund",
      "type": "Registerbekanntmachung nach dem Umwandlungsgesetz",
      "state": "Hessen",
      "amtsgericht": "Amtsgericht Marburg",
      "registernummer": "HRA 5493",
      "registerart": "HRA",
      "company_name": "Dentallabor Friedrich Schütz e.K.",
      "company_seat": "Ebsdorfergrund",
      "details": "09.10.2024 (Bekanntmachungsdatum)\n\nHessen Amtsgericht Marburg HRA 5493\nRegisterbekanntmachung nach dem Umwandlungsgesetz 09.10.2024 (Eintragungsdatum)\n\nDentallabor Friedrich Schütz e.K.\nEinzelkaufmann / Einzelkauffrau\nEbsdorfergrund\n\nDen Gläubigern der an der Ausgliederung beteiligten Rechtsträger ist, wenn sie binnen sechs Monaten nach dem Tag, an dem die Eintragung der Ausgliederung in das Register des Sitzes desjenigen Rechtsträgers, dessen Gläubiger sie sind, nach §§ 125, 19 Absatz 3 UmwG bekannt gemacht worden ist, ihren Anspruch nach Grund und Höhe schriftlich anmelden, Sicherheit zu leisten, soweit sie nicht Befriedigung verlangen können. Dieses Recht steht den Gläubigern jedoch nur zu, wenn sie glaubhaft machen, dass durch die Ausgliederung die Erfüllung ihrer Forderung gefährdet wird."
    },
    {
      "date": "2024-10-09",
      "original_text": "Registerbekanntmachung nach dem Umwandlungsgesetz\nHessen Amtsgericht Marburg HRB 8465\nDentallabor Schütz GmbH – Ebsdorfergrund",
      "type": "Registerbekanntmachung nach dem Umwandlungsgesetz",
      "state": "Hessen",
      "amtsgericht": "Amtsgericht Marburg",
      "registernummer": "HRB 8465",
      "registerart": "HRB",
      "company_name": "Dentallabor Schütz GmbH",
      "company_seat": "Ebsdorfergrund",
      "details": "09.10.2024 (Bekanntmachungsdatum)\n\nHessen Amtsgericht Marburg HRB 8465\nRegisterbekanntmachung nach dem Umwandlungsgesetz 09.10.2024 (Eintragungsdatum)\n\nDentallabor Schütz GmbH\nGesellschaft mit beschränkter Haftung\nEbsdorfergrund\n\nDen Gläubigern der an der Ausgliederung beteiligten Rechtsträger ist, wenn sie binnen sechs Monaten nach dem Tag, an dem die Eintragung der Ausgliederung in das Register des Sitzes desjenigen Rechtsträgers, dessen Gläubiger sie sind, nach §§ 125, 19 Absatz 3 UmwG bekannt gemacht worden ist, ihren Anspruch nach Grund und Höhe schriftlich anmelden, Sicherheit zu leisten, soweit sie nicht Befriedigung verlangen können. Dieses Recht steht den Gläubigern jedoch nur zu, wenn sie glaubhaft machen, dass durch die Ausgliederung die Erfüllung ihrer Forderung gefährdet wird."
    },
    {
      "date": "2024-10-09",
      "original_text": "Löschungsankündigung\nBayern Amtsgericht Kempten (Allgäu) HRB 12437\nDesignfolierung Schmidt GmbH – Kempten (Allgäu)",
      "type": "Löschungsankündigung",
      "state": "Bayern",
      "amtsgericht": "Amtsgericht Kempten (Allgäu)",
      "registernummer": "HRB 12437",
      "registerart": "HRB",
      "company_name": "Designfolierung Schmidt GmbH",
      "company_seat": "Kempten (Allgäu)",
      "details": "09.10.2024 (Bekanntmachungsdatum)\n\nBayern Amtsgericht Kempten (Allgäu) HRB 12437\nLöschungsankündigung\n\nDesignfolierung Schmidt GmbH\nGesellschaft mit beschränkter Haftung\nKempten (Allgäu)\n\nDas Registergericht beabsichtigt, die im Handelsregister eingetragene Gesellschaft wegen Vermögenslosigkeit von Amts wegen nach § 394 FamFG zu löschen. Die Frist zur Erhebung eines Widerspruchs ist auf einen Monat festgesetzt."
    },
    {
      "date": "2024-10-09",
      "original_text": "Registerbekanntmachung nach dem Umwandlungsgesetz\nSchleswig-Holstein Amtsgericht Kiel HRA 12194\nDetlef Schoof Immobilien GmbH & Co. KG – Kiel",
      "type": "Registerbekanntmachung nach dem Umwandlungsgesetz",
      "state": "Schleswig-Holstein",
      "amtsgericht": "Amtsgericht Kiel",
      "registernummer": "HRA 12194",
      "registerart": "HRA",
      "company_name": "Detlef Schoof Immobilien GmbH & Co. KG",
      "company_seat": "Kiel",
      "details": "09.10.2024 (Bekanntmachungsdatum)\n\nSchleswig-Holstein Amtsgericht Kiel HRA 12194\nRegisterbekanntmachung nach dem Umwandlungsgesetz 02.10.2024 (Eintragungsdatum)\n\nDetlef Schoof Immobilien GmbH & Co. KG\nKommanditgesellschaft\nKiel\n\nZu Eintragungsnummer 2 vom 02.10.2024 wird als nicht eingetragen veröffentlicht:  Als nicht eingetragen wird veröffentlicht: Den Gläubigern der an der Spaltung beteiligten Rechtsträger ist, wenn sie binnen sechs Monaten nach dem Tag, an dem die Eintragung der Spaltung in das Register des Sitzes desjenigen Rechtsträgers, dessen Gläubiger sie sind,  bekannt gemacht worden ist, ihren Anspruch nach Grund und Höhe schriftlich anmelden, Sicherheit zu leisten, soweit sie nicht Befriedigung verlangen können. Dieses Recht steht den Gläubigern jedoch nur zu, wenn sie glaubhaft machen, dass durch die Spaltung die Erfüllung ihrer Forderung gefährdet wird."
    },
    {
      "date": "2024-10-09",
      "original_text": "Einreichung neuer Dokumente\nRheinland-Pfalz Amtsgericht Koblenz HRB 29786\nDeutsches Rotes Kreuz Fahrdienste Koblenz gGmbH – Koblenz",
      "type": "Einreichung neuer Dokumente",
      "state": "Rheinland-Pfalz",
      "amtsgericht": "Amtsgericht Koblenz",
      "registernummer": "HRB 29786",
      "registerart": "HRB",
      "company_name": "Deutsches Rotes Kreuz Fahrdienste Koblenz gGmbH",
      "company_seat": "Koblenz",
      "details": "09.10.2024 (Bekanntmachungsdatum)\n\nRheinland-Pfalz Amtsgericht Koblenz HRB 29786\nEinreichung neuer Dokumente\n\nDeutsches Rotes Kreuz Fahrdienste Koblenz gGmbH\nGesellschaft mit beschränkter Haftung\nKoblenz\n\nDem Registergericht ist eine Liste der Mitglieder des Aufsichtsrates eingereicht worden."
    },
    {
      "date": "2024-10-09",
      "original_text": "Registerbekanntmachung nach dem Umwandlungsgesetz\nBaden-Württemberg Amtsgericht Stuttgart HRB 310969\nDias GmbH – Leonberg",
      "type": "Registerbekanntmachung nach dem Umwandlungsgesetz",
      "state": "Baden-Württemberg",
      "amtsgericht": "Amtsgericht Stuttgart",
      "registernummer": "HRB 310969",
      "registerart": "HRB",
      "company_name": "Dias GmbH",
      "company_seat": "Leonberg",
      "details": "09.10.2024 (Bekanntmachungsdatum)\n\nBaden-Württemberg Amtsgericht Stuttgart HRB 310969\nRegisterbekanntmachung nach dem Umwandlungsgesetz 09.10.2024 (Eintragungsdatum)\n\nDias GmbH\nGesellschaft mit beschränkter Haftung\nLeonberg\n\nDen Gläubigern der an der Verschmelzung beteiligten Rechtsträger ist, wenn sie binnen sechs Monaten nach dem Tag, an dem die Eintragung der Verschmelzung in das Register des Sitzes desjenigen Rechtsträgers, dessen Gläubiger sie sind, nach § 19 Abs. 3 UmwG als bekanntgemacht gilt, ihren Anspruch nach Grund und Höhe schriftlich anmelden, Sicherheit zu leisten, soweit sie nicht Befriedigung verlangen können. Dieses Recht steht den Gläubigern jedoch nur zu, wenn sie glaubhaft machen, dass durch die Verschmelzung die Erfüllung ihrer Forderung gefährdet wird."
    },
    {
      "date": "2024-10-09",
      "original_text": "Registerbekanntmachung nach dem Umwandlungsgesetz\nNordrhein-Westfalen Amtsgericht Bad Oeynhausen HRA 6167\nDiomex Software GmbH & Co. KG – Bad Oeynhausen",
      "type": "Registerbekanntmachung nach dem Umwandlungsgesetz",
      "state": "Nordrhein-Westfalen",
      "amtsgericht": "Amtsgericht Bad Oeynhausen",
      "registernummer": "HRA 6167",
      "registerart": "HRA",
      "company_name": "Diomex Software GmbH & Co. KG",
      "company_seat": "Bad Oeynhausen",
      "details": "09.10.2024 (Bekanntmachungsdatum)\n\nNordrhein-Westfalen Amtsgericht Bad Oeynhausen HRA 6167\nRegisterbekanntmachung nach dem Umwandlungsgesetz 09.10.2024 (Eintragungsdatum)\n\nDiomex Software GmbH & Co. KG\nKommanditgesellschaft\nBad Oeynhausen\n\nDen Gläubigern der an der formwechselnden Umwandlung beteiligten Rechtsträger ist, wenn sie binnen sechs Monaten nach dem Tag, an dem die Eintragung der formwechselnden Umwandlung in das Register des Sitzes desjenigen Rechtsträgers, dessen Gläubiger sie sind, nach § 19 Absatz 3 UmwG als bekanntgemacht gilt, ihren Anspruch nach Grund und Höhe schriftlich anmelden, Sicherheit zu leisten, soweit sie nicht Befriedigung verlangen können. Dieses Recht steht den Gläubigern jedoch nur zu, wenn sie glaubhaft machen, dass durch die formwechselnden Umwandlung die Erfüllung ihrer Forderung gefährdet wird."
    },
    {
      "date": "2024-10-09",
      "original_text": "Registerbekanntmachung nach dem Umwandlungsgesetz\nNiedersachsen Amtsgericht Oldenburg (Oldenburg) HRB 216829\nEFS Technik GmbH – Berne",
      "type": "Registerbekanntmachung nach dem Umwandlungsgesetz",
      "state": "Niedersachsen",
      "amtsgericht": "Amtsgericht Oldenburg (Oldenburg)",
      "registernummer": "HRB 216829",
      "registerart": "HRB",
      "company_name": "EFS Technik GmbH",
      "company_seat": "Berne",
      "details": "09.10.2024 (Bekanntmachungsdatum)\n\nNiedersachsen Amtsgericht Oldenburg (Oldenburg) HRB 216829\nRegisterbekanntmachung nach dem Umwandlungsgesetz 09.10.2024 (Eintragungsdatum)\n\nEFS Technik GmbH\nGesellschaft mit beschränkter Haftung\nBerne\n\nDen Gläubigern der an der Verschmelzung beteiligten Rechtsträger ist, wenn sie binnen sechs Monaten nach dem Tag, an dem die Eintragung der Verschmelzung in das Register des Sitzes desjenigen Rechtsträgers, dessen Gläubiger sie sind, nach § 19  Abs.  3 UmwG als bekannt gemacht gilt, ihren Anspruch nach Grund und Höhe schriftlich anmelden, Sicherheit zu leisten, soweit sie nicht Befriedigung verlangen können. Dieses Recht steht den Gläubigern jedoch nur zu, wenn sie glaubhaft machen, dass durch die Verschmelzung die Erfüllung der Forderung gefährdet wird."
    },
    {
      "date": "2024-10-09",
      "original_text": "Löschungsankündigung\nBayern Amtsgericht Traunstein HRB 31678\nEGEM UG (haftungsbeschränkt) – Maitenbeth",
      "type": "Löschungsankündigung",
      "state": "Bayern",
      "amtsgericht": "Amtsgericht Traunstein",
      "registernummer": "HRB 31678",
      "registerart": "HRB",
      "company_name": "EGEM UG (haftungsbeschränkt)",
      "company_seat": "Maitenbeth",
      "details": "09.10.2024 (Bekanntmachungsdatum)\n\nBayern Amtsgericht Traunstein HRB 31678\nLöschungsankündigung\n\nEGEM UG (haftungsbeschränkt)\nGesellschaft mit beschränkter Haftung\nMaitenbeth\n\nDas Registergericht beabsichtigt, die im Handelsregister eingetragene Gesellschaft wegen Vermögenslosigkeit von Amts wegen nach § 394 FamFG zu löschen. Die Frist zur Erhebung eines Widerspruchs ist auf einen Monat festgesetzt."
    },
    {
      "date": "2024-10-09",
      "original_text": "Registerbekanntmachung nach dem Umwandlungsgesetz\nNiedersachsen Amtsgericht Aurich HRB 202277\nEHS Vermögensverwaltung GmbH – Jemgum/Ditzum",
      "type": "Registerbekanntmachung nach dem Umwandlungsgesetz",
      "state": "Niedersachsen",
      "amtsgericht": "Amtsgericht Aurich",
      "registernummer": "HRB 202277",
      "registerart": "HRB",
      "company_name": "EHS Vermögensverwaltung GmbH",
      "company_seat": "Jemgum/Ditzum",
      "details": "09.10.2024 (Bekanntmachungsdatum)\n\nNiedersachsen Amtsgericht Aurich HRB 202277\nRegisterbekanntmachung nach dem Umwandlungsgesetz 09.10.2024 (Eintragungsdatum)\n\nEHS Vermögensverwaltung GmbH\nGesellschaft mit beschränkter Haftung\nJemgum/Ditzum\n\nDen Gläubigern der an der Verschmelzung beteiligten Rechtsträger ist, wenn sie binnen sechs Monaten nach dem Tag, an dem die Eintragung der Verschmelzung in das Register des Sitzes desjenigen Rechtsträgers, dessen Gläubiger sie sind, nach § 19  Abs.  3 UmwG als bekannt gemacht gilt, ihren Anspruch nach Grund und Höhe schriftlich anmelden, Sicherheit zu leisten, soweit sie nicht Befriedigung verlangen können. Dieses Recht steht den Gläubigern jedoch nur zu, wenn sie glaubhaft machen, dass durch die Verschmelzung die Erfüllung der Forderung gefährdet wird."
    },
    {
      "date": "2024-10-09",
      "original_text": "Löschungsankündigung\nNiedersachsen Amtsgericht Göttingen HRB 131030 früher Amtsgericht Northeim\nEINBECKER DRUCKGUSS Gesellschaft mit beschränkter Haftung – Einbeck",
      "type": "Löschungsankündigung",
      "state": "Niedersachsen",
      "amtsgericht": "Amtsgericht Göttingen",
      "registernummer": "HRB 131030",
      "registerart": "HRB",
      "company_name": "EINBECKER DRUCKGUSS Gesellschaft mit beschränkter Haftung",
      "company_seat": "Einbeck",
      "former_amtsgericht": "Northeim",
      "details": "09.10.2024 (Bekanntmachungsdatum)\n\nNiedersachsen Amtsgericht Göttingen HRB 131030 früher Amtsgericht Northeim\nLöschungsankündigung\n\nEINBECKER DRUCKGUSS Gesellschaft mit beschränkter Haftung\nGesellschaft mit beschränkter Haftung\nEinbeck\n\nDas Registergericht beabsichtigt, die im Handelsregister eingetragene Gesellschaft wegen Vermögenslosigkeit von Amts wegen nach § 394 FamFG zu löschen. Die Frist zur Erhebung eines Widerspruchs gegen die beabsichtigte Löschung wird auf einen Monat festgesetzt."
    },
    {
      "date": "2024-10-09",
      "original_text": "Löschungsankündigung\nThüringen Amtsgericht Jena HRB 306745\nELIOG Technologie AG – Erfurt",
      "type": "Löschungsankündigung",
      "state": "Thüringen",
      "amtsgericht": "Amtsgericht Jena",
      "registernummer": "HRB 306745",
      "registerart": "HRB",
      "company_name": "ELIOG Technologie AG",
      "company_seat": "Erfurt",
      "details": "09.10.2024 (Bekanntmachungsdatum)\n\nThüringen Amtsgericht Jena HRB 306745\nLöschungsankündigung\n\nELIOG Technologie AG\nAktiengesellschaft\nErfurt\n\nDas Registergericht beabsichtigt, den im Handelsregister eingetragenen Vorstand Axel Engels-Graf von Brühl wegen unzulässiger Eintragung nach § 395 FamFG von Amts wegen zu löschen. Die Frist zur Erhebung eines Widerspruchs gegen die beabsichtigte Löschung wird auf einen Monat festgesetzt."
    },
    {
      "date": "2024-10-09",
      "original_text": "Löschungsankündigung\nNordrhein-Westfalen Amtsgericht Düsseldorf HRB 95234\nEMPIRE CAR GERMANY UG (haftungsbeschränkt) – Düsseldorf",
      "type": "Löschungsankündigung",
      "state": "Nordrhein-Westfalen",
      "amtsgericht": "Amtsgericht Düsseldorf",
      "registernummer": "HRB 95234",
      "registerart": "HRB",
      "company_name": "EMPIRE CAR GERMANY UG (haftungsbeschränkt)",
      "company_seat": "Düsseldorf",
      "details": "09.10.2024 (Bekanntmachungsdatum)\n\nNordrhein-Westfalen Amtsgericht Düsseldorf HRB 95234\nLöschungsankündigung\n\nEMPIRE CAR GERMANY UG (haftungsbeschränkt)\nGesellschaft mit beschränkter Haftung\nDüsseldorf\n\nDas Registergericht beabsichtigt die Gesellschaft von Amts wegen nach § 394 FamFG zu löschen. Die Frist zur Erhebung eines Widerspruchs ist auf 3 Wochen festgesetzt.\n\nRechtsbehelfsbelehrung:\nDas Widerspruchsrecht steht jedem zu, der an der Unterlassung der Löschung ein berechtigtes Interesse hat. Der Widerspruch ist bei dem Amtsgericht Düsseldorf -Registergericht-, Werdener Straße 1, 40227 Düsseldorf schriftlich in deutscher Sprache oder zur Niederschrift der Geschäftsstelle einzulegen. Der Widerspruch kann auch zur Niederschrift der Geschäftsstelle eines jeden Amtsgerichtes abgegeben werden. Die Einlegung ist auch durch Übertragung eines elektronischen Dokuments an die elektronische Poststelle des Gerichts möglich. Das elektronische Dokument muss für die Bearbeitung durch das Gericht geeignet und mit einer qualifizierten elektronischen Signatur der verantwortenden Person versehen sein oder von der verantwortenden Person signiert und auf einem sicheren Übermittlungsweg gemäß § 130a ZPO nach näherer Maßgabe der Verordnung über die technischen Rahmenbedingungen des elektronischen Rechtsverkehrs und über das besondere elektronische Behördenpostfach (BGBl. I, S.3803) eingereicht werden. Weitere Informationen erhalten Sie auf der Internetseite www.justiz.de.\nDer Widerspruch muss spätestens innerhalb der gesetzten Frist nach dem Datum der Bekanntmachung der Löschungsankündigung bei dem Amtsgericht - Registergericht - Düsseldorf eingegangen sein.  Dies gilt auch dann, wenn der Widerspruch zur Niederschrift der Geschäftsstelle eines anderen Amtsgerichtes abgegeben wurde. Die Frist beginnt mit dem Tage der Bekanntmachung der Löschungsankündigung in dem für die Bekanntmachung der Eintragungen in das Handelsregister bestimmten elektronischen Informations- und Kommunikationssystem nach § 10 des Handelsgesetzbuches. Fällt das Ende der Frist auf einen Sonntag, einen allgemeinen Feiertag oder Sonnabend, so endet die Frist mit Ablauf des nächsten Werktages.\nDer Widerspruch muss die Bezeichnung der angefochtenen Löschungsankündigung sowie die Erklärung enthalten, dass Widerspruch gegen diese Löschungsankündigung eingelegt wird. Er ist zu unterzeichnen und soll begründet werden."
    },
    {
      "date": "2024-10-09",
      "original_text": "Sonstige Registerbekanntmachung\nHamburg Amtsgericht Hamburg HRB 80762\nEUROPA-CENTER AG – Hamburg",
      "type": "Sonstige Registerbekanntmachung",
      "state": "Hamburg",
      "amtsgericht": "Amtsgericht Hamburg",
      "registernummer": "HRB 80762",
      "registerart": "HRB",
      "company_name": "EUROPA-CENTER AG",
      "company_seat": "Hamburg",
      "details": "09.10.2024 (Bekanntmachungsdatum)\n\nHamburg Amtsgericht Hamburg HRB 80762\nSonstige Registerbekanntmachung\n\nEUROPA-CENTER AG\nAktiengesellschaft\nHamburg\n\nAls nicht eingetragen wird bekannt gemacht: Liste des Aufsichtsrats wurde eingereicht."
    },
    {
      "date": "2024-10-09",
      "original_text": "Einreichung neuer Dokumente\nHessen Amtsgericht Frankfurt am Main HRB 119629\nEW Discover GmbH – Frankfurt am Main",
      "type": "Einreichung neuer Dokumente",
      "state": "Hessen",
      "amtsgericht": "Amtsgericht Frankfurt am Main",
      "registernummer": "HRB 119629",
      "registerart": "HRB",
      "company_name": "EW Discover GmbH",
      "company_seat": "Frankfurt am Main",
      "details": "09.10.2024 (Bekanntmachungsdatum)\n\nHessen Amtsgericht Frankfurt am Main HRB 119629\nEinreichung neuer Dokumente\n\nEW Discover GmbH\nGesellschaft mit beschränkter Haftung\nFrankfurt am Main\n\nDurch eine Änderung in den Personen der Aufsichtsratsmitglieder ist eine Liste der Mitglieder des Aufsichtsrates zum Handelsregister eingereicht worden."
    },
    {
      "date": "2024-10-09",
      "original_text": "Registerbekanntmachung nach dem Umwandlungsgesetz\nNordrhein-Westfalen Amtsgericht Siegburg HRA 7187\nEiscafé Garibaldi e.K. – Siegburg",
      "type": "Registerbekanntmachung nach dem Umwandlungsgesetz",
      "state": "Nordrhein-Westfalen",
      "amtsgericht": "Amtsgericht Siegburg",
      "registernummer": "HRA 7187",
      "registerart": "HRA",
      "company_name": "Eiscafé Garibaldi e.K.",
      "company_seat": "Siegburg",
      "details": "09.10.2024 (Bekanntmachungsdatum)\n\nNordrhein-Westfalen Amtsgericht Siegburg HRA 7187\nRegisterbekanntmachung nach dem Umwandlungsgesetz 09.10.2024 (Eintragungsdatum)\n\nEiscafé Garibaldi e.K.\nEinzelkaufmann / Einzelkauffrau\nSiegburg\n\nDen Gläubigern der an der Ausgliederung beteiligten Rechtsträger ist, wenn sie binnen sechs Monaten nach dem Tag, an dem die Eintragung der Ausgliederung in das Register des Sitzes desjenigen Rechtsträgers, dessen Gläubiger sie sind, nach § 19 Absatz 3 UmwG als bekanntgemacht gilt, ihren Anspruch nach Grund und Höhe schriftlich anmelden, Sicherheit zu leisten, soweit sie nicht Befriedigung verlangen können. Dieses Recht steht den Gläubigern jedoch nur zu, wenn sie glaubhaft machen, dass durch die Ausgliederung die Erfüllung ihrer Forderung gefährdet wird."
    },
    {
      "date": "2024-10-09",
      "original_text": "Einreichung neuer Dokumente\nRheinland-Pfalz Amtsgericht Koblenz HRB 17\nEnergieversorgung Mittelrhein AG – Koblenz",
      "type": "Einreichung neuer Dokumente",
      "state": "Rheinland-Pfalz",
      "amtsgericht": "Amtsgericht Koblenz",
      "registernummer": "HRB 17",
      "registerart": "HRB",
      "company_name": "Energieversorgung Mittelrhein AG",
      "company_seat": "Koblenz",
      "details": "09.10.2024 (Bekanntmachungsdatum)\n\nRheinland-Pfalz Amtsgericht Koblenz HRB 17\nEinreichung neuer Dokumente\n\nEnergieversorgung Mittelrhein AG\nAktiengesellschaft\nKoblenz\n\nDem Registergericht ist eine Liste der Mitglieder des Aufsichtsrates eingereicht worden."
    },
    {
      "date": "2024-10-09",
      "original_text": "Registerbekanntmachung nach dem Umwandlungsgesetz\nNordrhein-Westfalen Amtsgericht Bochum HRA 8042\nEnes Elmas e.K. – Herne",
      "type": "Registerbekanntmachung nach dem Umwandlungsgesetz",
      "state": "Nordrhein-Westfalen",
      "amtsgericht": "Amtsgericht Bochum",
      "registernummer": "HRA 8042",
      "registerart": "HRA",
      "company_name": "Enes Elmas e.K.",
      "company_seat": "Herne",
      "details": "09.10.2024 (Bekanntmachungsdatum)\n\nNordrhein-Westfalen Amtsgericht Bochum HRA 8042\nRegisterbekanntmachung nach dem Umwandlungsgesetz 08.10.2024 (Eintragungsdatum)\n\nEnes Elmas e.K.\nEinzelkaufmann / Einzelkauffrau\nHerne\n\nDen Gläubigern der an der Ausgliederung beteiligten Rechtsträger ist, wenn sie binnen sechs Monaten nach dem Tag, an dem die Eintragung der Ausgliederung in das Register des Sitzes desjenigen Rechtsträgers, dessen Gläubiger sie sind, nach § 19 Absatz 3 UmwG als bekanntgemacht gilt, ihren Anspruch nach Grund und Höhe schriftlich anmelden, Sicherheit zu leisten, soweit sie nicht Befriedigung verlangen können. Dieses Recht steht den Gläubigern jedoch nur zu, wenn sie glaubhaft machen, dass durch die Ausgliederung die Erfüllung ihrer Forderung gefährdet wird."
    },
    {
      "date": "2024-10-09",
      "original_text": "Einreichung neuer Dokumente\nBayern Amtsgericht Memmingen HRB 18095\nEntwicklungsgesellschaft Neu-Ulm GmbH – Neu-Ulm",
      "type": "Einreichung neuer Dokumente",
      "state": "Bayern",
      "amtsgericht": "Amtsgericht Memmingen",
      "registernummer": "HRB 18095",
      "registerart": "HRB",
      "company_name": "Entwicklungsgesellschaft Neu-Ulm GmbH",
      "company_seat": "Neu-Ulm",
      "details": "09.10.2024 (Bekanntmachungsdatum)\n\nBayern Amtsgericht Memmingen HRB 18095\nEinreichung neuer Dokumente\n\nEntwicklungsgesellschaft Neu-Ulm GmbH\nGesellschaft mit beschränkter Haftung\nNeu-Ulm\n\nDem Amtsgericht Memmingen -Registergericht- ist eine Liste der Mitglieder des Aufsichtsrats eingereicht worden, § 52 Abs. 3 S. 2 GmbHG."
    },
    {
      "date": "2024-10-09",
      "original_text": "Löschungsankündigung\nBrandenburg Amtsgericht Potsdam HRB 38544\nEpigee GmbH – Potsdam",
      "type": "Löschungsankündigung",
      "state": "Brandenburg",
      "amtsgericht": "Amtsgericht Potsdam",
      "registernummer": "HRB 38544",
      "registerart": "HRB",
      "company_name": "Epigee GmbH",
      "company_seat": "Potsdam",
      "details": "09.10.2024 (Bekanntmachungsdatum)\n\nBrandenburg Amtsgericht Potsdam HRB 38544\nLöschungsankündigung\n\nEpigee GmbH\nGesellschaft mit beschränkter Haftung\nPotsdam\n\nBei der nachstehenden Gesellschaft wird das Amtslöschungsverfahren gemäß § 394 FamFG eingeleitet. Widerspruchsfrist: 8 Wochen"
    },
    {
      "date": "2024-10-09",
      "original_text": "Einreichung neuer Dokumente\nSachsen Amtsgericht Chemnitz HRB 11896\nErzgebirge Trinkwasser GmbH \"ETW\" – Annaberg-Buchholz",
      "type": "Einreichung neuer Dokumente",
      "state": "Sachsen",
      "amtsgericht": "Amtsgericht Chemnitz",
      "registernummer": "HRB 11896",
      "registerart": "HRB",
      "company_name": "Erzgebirge Trinkwasser GmbH \"ETW\"",
      "company_seat": "Annaberg-Buchholz",
      "details": "09.10.2024 (Bekanntmachungsdatum)\n\nSachsen Amtsgericht Chemnitz HRB 11896\nEinreichung neuer Dokumente\n\nErzgebirge Trinkwasser GmbH \"ETW\"\nGesellschaft mit beschränkter Haftung\nAnnaberg-Buchholz\n\nAm 07.10.2024 wurde beim Handelsregister des Amtsgerichts Chemnitz die Liste der Mitglieder des Aufsichtsrats gemäß § 52 GmbHG eingereicht."
    },
    {
      "date": "2024-10-09",
      "original_text": "Einreichung neuer Dokumente\nBaden-Württemberg Amtsgericht Stuttgart HRB 722731\nEvangelische Heimstiftung GmbH – Stuttgart",
      "type": "Einreichung neuer Dokumente",
      "state": "Baden-Württemberg",
      "amtsgericht": "Amtsgericht Stuttgart",
      "registernummer": "HRB 722731",
      "registerart": "HRB",
      "company_name": "Evangelische Heimstiftung GmbH",
      "company_seat": "Stuttgart",
      "details": "09.10.2024 (Bekanntmachungsdatum)\n\nBaden-Württemberg Amtsgericht Stuttgart HRB 722731\nEinreichung neuer Dokumente\n\nEvangelische Heimstiftung GmbH\nGesellschaft mit beschränkter Haftung\nStuttgart\n\nDie Gesellschaft hat am 04.10.2024 die Liste über die Zusammensetzung des Aufsichtsrats zum Handelsregister eingereicht."
    },
    {
      "date": "2024-10-09",
      "original_text": "Löschungsankündigung\nHessen Amtsgericht Frankfurt am Main HRB 123322\nFAS Schalungstechnik GmbH – Frankfurt am Main",
      "type": "Löschungsankündigung",
      "state": "Hessen",
      "amtsgericht": "Amtsgericht Frankfurt am Main",
      "registernummer": "HRB 123322",
      "registerart": "HRB",
      "company_name": "FAS Schalungstechnik GmbH",
      "company_seat": "Frankfurt am Main",
      "details": "09.10.2024 (Bekanntmachungsdatum)\n\nHessen Amtsgericht Frankfurt am Main HRB 123322\nLöschungsankündigung 09.10.2024 (Eintragungsdatum)\n\nFAS Schalungstechnik GmbH\nGesellschaft mit beschränkter Haftung\nFrankfurt am Main\n\nDas Registergericht beabsichtigt die im Handelsregister eingetragene Gesellschaft von Amts wegen nach § 394 FamFG zu löschen. Die Frist zur Erhebung eines Widerspruchs gegen die beabsichtigte Löschung wird auf 1 Monat festgesetzt."
    },
    {
      "date": "2024-10-09",
      "original_text": "Registerbekanntmachung nach dem Umwandlungsgesetz\nHessen Amtsgericht Fulda HRB 6085\nFFT GmbH & Co. KGaA – Fulda",
      "type": "Registerbekanntmachung nach dem Umwandlungsgesetz",
      "state": "Hessen",
      "amtsgericht": "Amtsgericht Fulda",
      "registernummer": "HRB 6085",
      "registerart": "HRB",
      "company_name": "FFT GmbH & Co. KGaA",
      "company_seat": "Fulda",
      "details": "09.10.2024 (Bekanntmachungsdatum)\n\nHessen Amtsgericht Fulda HRB 6085\nRegisterbekanntmachung nach dem Umwandlungsgesetz 09.10.2024 (Eintragungsdatum)\n\nFFT GmbH & Co. KGaA\nKommanditgesellschaft auf Aktien\nFulda\n\nDen Gläubigern der an der formwechselnden Umwandlung beteiligten Rechtsträger ist, wenn sie binnen sechs Monaten nach dem Tag, an dem die Eintragung der formwechselnden Umwandlung in das Register des Sitzes desjenigen Rechtsträgers, dessen Gläubiger sie sind, nach § 201 UmwG bekannt gemacht worden ist, ihren Anspruch nach Grund und Höhe schriftlich anmelden, Sicherheit zu leisten, soweit sie nicht Befriedigung verlangen können. Dieses Recht steht den Gläubigern jedoch nur zu, wenn sie glaubhaft machen, dass durch die formwechselnden Umwandlung die Erfüllung ihrer Forderung gefährdet wird."
    },
    {
      "date": "2024-10-09",
      "original_text": "Löschungsankündigung\nBaden-Württemberg Amtsgericht Mannheim HRB 522441\nFLUITEC Abfülltechnik GmbH – Rastatt",
      "type": "Löschungsankündigung",
      "state": "Baden-Württemberg",
      "amtsgericht": "Amtsgericht Mannheim",
      "registernummer": "HRB 522441",
      "registerart": "HRB",
      "company_name": "FLUITEC Abfülltechnik GmbH",
      "company_seat": "Rastatt",
      "details": "09.10.2024 (Bekanntmachungsdatum)\n\nBaden-Württemberg Amtsgericht Mannheim HRB 522441\nLöschungsankündigung\n\nFLUITEC Abfülltechnik GmbH\nGesellschaft mit beschränkter Haftung\nRastatt\n\nAls nicht eingetragen wird bekanntgemacht: Das Gericht beabsichtigt, die Gesellschaft wegen Vermögenslosigkeit im Handelsregister von Amts wegen nach § 394 FamFG zu löschen. Die Frist zur Geltendmachung eines Widerspruchs gegen die beabsichtigte Löschung ist auf einen Monat ab Veröffentlichung bestimmt."
    },
    {
      "date": "2024-10-09",
      "original_text": "Registerbekanntmachung nach dem Umwandlungsgesetz\nNordrhein-Westfalen Amtsgericht Düsseldorf HRB 106021\nFUJIFILM Healthcare Deutschland GmbH – Ratingen",
      "type": "Registerbekanntmachung nach dem Umwandlungsgesetz",
      "state": "Nordrhein-Westfalen",
      "amtsgericht": "Amtsgericht Düsseldorf",
      "registernummer": "HRB 106021",
      "registerart": "HRB",
      "company_name": "FUJIFILM Healthcare Deutschland GmbH",
      "company_seat": "Ratingen",
      "details": "09.10.2024 (Bekanntmachungsdatum)\n\nNordrhein-Westfalen Amtsgericht Düsseldorf HRB 106021\nRegisterbekanntmachung nach dem Umwandlungsgesetz 09.10.2024 (Eintragungsdatum)\n\nFUJIFILM Healthcare Deutschland GmbH\nGesellschaft mit beschränkter Haftung\nRatingen\n\nDen Gläubigern der an der Abspaltung beteiligten Rechtsträger ist, wenn sie binnen sechs Monaten nach dem Tag, an dem die Eintragung der Abspaltung in das Register des Sitzes desjenigen Rechtsträgers, dessen Gläubiger sie sind, nach § 19 Absatz 3 UmwG als bekanntgemacht gilt, ihren Anspruch nach Grund und Höhe schriftlich anmelden, Sicherheit zu leisten, soweit sie nicht Befriedigung verlangen können. Dieses Recht steht den Gläubigern jedoch nur zu, wenn sie glaubhaft machen, dass durch die Abspaltung die Erfüllung ihrer Forderung gefährdet wird."
    },
    {
      "date": "2024-10-09",
      "original_text": "Löschungsankündigung\nBayern Amtsgericht Augsburg HRB 25991\nFarbenhaus Friedberg GmbH – Friedberg",
      "type": "Löschungsankündigung",
      "state": "Bayern",
      "amtsgericht": "Amtsgericht Augsburg",
      "registernummer": "HRB 25991",
      "registerart": "HRB",
      "company_name": "Farbenhaus Friedberg GmbH",
      "company_seat": "Friedberg",
      "details": "09.10.2024 (Bekanntmachungsdatum)\n\nBayern Amtsgericht Augsburg HRB 25991\nLöschungsankündigung\n\nFarbenhaus Friedberg GmbH\nGesellschaft mit beschränkter Haftung\nFriedberg\n\nDas Registergericht beabsichtigt, die im Handelsregister eingetragene Gesellschaft wegen Vermögenslosigkeit von Amts wegen nach § 394 FamFG zu löschen. Die Frist zur Erhebung eines Widerspruchs ist auf einen Monat festgesetzt."
    },
    {
      "date": "2024-10-09",
      "original_text": "Registerbekanntmachung nach dem Umwandlungsgesetz\nBaden-Württemberg Amtsgericht Stuttgart HRA 741571\nFarrenbräu GmbH & Co. KG – Immendingen",
      "type": "Registerbekanntmachung nach dem Umwandlungsgesetz",
      "state": "Baden-Württemberg",
      "amtsgericht": "Amtsgericht Stuttgart",
      "registernummer": "HRA 741571",
      "registerart": "HRA",
      "company_name": "Farrenbräu GmbH & Co. KG",
      "company_seat": "Immendingen",
      "details": "09.10.2024 (Bekanntmachungsdatum)\n\nBaden-Württemberg Amtsgericht Stuttgart HRA 741571\nRegisterbekanntmachung nach dem Umwandlungsgesetz 09.10.2024 (Eintragungsdatum)\n\nFarrenbräu GmbH & Co. KG\nKommanditgesellschaft\nImmendingen\n\nDen Gläubigern der an der Ausgliederung beteiligten Rechtsträger ist, wenn sie binnen sechs Monaten nach dem Tag, an dem die Eintragung der Ausgliederung in das Register des Sitzes desjenigen Rechtsträgers, dessen Gläubiger sie sind, nach § 19 Abs. 3 UmwG als bekanntgemacht gilt, ihren Anspruch nach Grund und Höhe schriftlich anmelden, Sicherheit zu leisten, soweit sie nicht Befriedigung verlangen können. Dieses Recht steht den Gläubigern jedoch nur zu, wenn sie glaubhaft machen, dass durch die Ausgliederung die Erfüllung ihrer Forderung gefährdet wird."
    },
    {
      "date": "2024-10-09",
      "original_text": "Registerbekanntmachung nach dem Umwandlungsgesetz\nNiedersachsen Amtsgericht Oldenburg (Oldenburg) HRB 100059 früher Amtsgericht Brake\nFischer & Plath GmbH – Berne-Ganspe",
      "type": "Registerbekanntmachung nach dem Umwandlungsgesetz",
      "state": "Niedersachsen",
      "amtsgericht": "Amtsgericht Oldenburg (Oldenburg)",
      "registernummer": "HRB 100059",
      "registerart": "HRB",
      "company_name": "Fischer & Plath GmbH",
      "company_seat": "Berne-Ganspe",
      "former_amtsgericht": "Brake",
      "details": "09.10.2024 (Bekanntmachungsdatum)\n\nNiedersachsen Amtsgericht Oldenburg (Oldenburg) HRB 100059 früher Amtsgericht Brake\nRegisterbekanntmachung nach dem Umwandlungsgesetz 09.10.2024 (Eintragungsdatum)\n\nFischer & Plath GmbH\nGesellschaft mit beschränkter Haftung\nBerne-Ganspe\n\nDen Gläubigern der an der Verschmelzung beteiligten Rechtsträger ist, wenn sie binnen sechs Monaten nach dem Tag, an dem die Eintragung der Verschmelzung in das Register des Sitzes desjenigen Rechtsträgers, dessen Gläubiger sie sind, nach § 19  Abs.  3 UmwG als bekannt gemacht gilt, ihren Anspruch nach Grund und Höhe schriftlich anmelden, Sicherheit zu leisten, soweit sie nicht Befriedigung verlangen können. Dieses Recht steht den Gläubigern jedoch nur zu, wenn sie glaubhaft machen, dass durch die Verschmelzung die Erfüllung der Forderung gefährdet wird."
    },
    {
      "date": "2024-10-09",
      "original_text": "Löschungsankündigung\nBayern Amtsgericht Coburg HRA 3852\nFloßanger GmbH & Co. KG – Coburg",
      "type": "Löschungsankündigung",
      "state": "Bayern",
      "amtsgericht": "Amtsgericht Coburg",
      "registernummer": "HRA 3852",
      "registerart": "HRA",
      "company_name": "Floßanger GmbH & Co. KG",
      "company_seat": "Coburg",
      "details": "09.10.2024 (Bekanntmachungsdatum)\n\nBayern Amtsgericht Coburg HRA 3852\nLöschungsankündigung 08.10.2024 (Eintragungsdatum)\n\nFloßanger GmbH & Co. KG\nKommanditgesellschaft\nCoburg\n\nDas Registergericht beabsichtigt, die im Handelsregister eingetragene Firma wegen Vermögenslosigkeit von Amts wegen nach § 394 FamFG zu löschen. Die Frist zur Erhebung eines Widerspruchs ist auf einen Monat festgesetzt."
    },
    {
      "date": "2024-10-09",
      "original_text": "Einreichung neuer Dokumente\nSachsen-Anhalt Amtsgericht Stendal HRB 102106\nFlughafen Magdeburg GmbH – Magdeburg",
      "type": "Einreichung neuer Dokumente",
      "state": "Sachsen-Anhalt",
      "amtsgericht": "Amtsgericht Stendal",
      "registernummer": "HRB 102106",
      "registerart": "HRB",
      "company_name": "Flughafen Magdeburg GmbH",
      "company_seat": "Magdeburg",
      "details": "09.10.2024 (Bekanntmachungsdatum)\n\nSachsen-Anhalt Amtsgericht Stendal HRB 102106\nEinreichung neuer Dokumente\n\nFlughafen Magdeburg GmbH\nGesellschaft mit beschränkter Haftung\nMagdeburg\n\nEine Liste der Mitglieder des Aufsichtsrates wurde zum Handelsregister eingereicht."
    },
    {
      "date": "2024-10-09",
      "original_text": "Einreichung neuer Dokumente\nHessen Amtsgericht Bad Homburg v.d.H. HRB 16514\nFrankfurter Pensionskasse AG – Bad Homburg v. d. Höhe",
      "type": "Einreichung neuer Dokumente",
      "state": "Hessen",
      "amtsgericht": "Amtsgericht Bad Homburg v.d.H.",
      "registernummer": "HRB 16514",
      "registerart": "HRB",
      "company_name": "Frankfurter Pensionskasse AG",
      "company_seat": "Bad Homburg v. d. Höhe",
      "details": "09.10.2024 (Bekanntmachungsdatum)\n\nHessen Amtsgericht Bad Homburg v.d.H. HRB 16514\nEinreichung neuer Dokumente\n\nFrankfurter Pensionskasse AG\nAktiengesellschaft\nBad Homburg v. d. Höhe\n\nDurch eine Änderung in den Personen der Aufsichtsratsmitglieder ist eine Liste der Mitglieder des Aufsichtsrates zum Handelsregister eingereicht worden."
    },
    {
      "date": "2024-10-09",
      "original_text": "Löschungsankündigung\nBayern Amtsgericht Coburg HRB 6881\nFranz Müller Trading GmbH – Lichtenfels",
      "type": "Löschungsankündigung",
      "state": "Bayern",
      "amtsgericht": "Amtsgericht Coburg",
      "registernummer": "HRB 6881",
      "registerart": "HRB",
      "company_name": "Franz Müller Trading GmbH",
      "company_seat": "Lichtenfels",
      "details": "09.10.2024 (Bekanntmachungsdatum)\n\nBayern Amtsgericht Coburg HRB 6881\nLöschungsankündigung\n\nFranz Müller Trading GmbH\nGesellschaft mit beschränkter Haftung\nLichtenfels\n\nDas Registergericht beabsichtigt, die im Handelsregister eingetragene Gesellschaft wegen Vermögenslosigkeit von Amts wegen nach § 394 FamFG zu löschen. Die Frist zur Erhebung eines Widerspruchs ist auf sechs Wochen festgesetzt."
    },
    {
      "date": "2024-10-09",
      "original_text": "Sonstige Registerbekanntmachung\nBayern Amtsgericht München HRB 130261\nFujitsu Germany GmbH – München",
      "type": "Sonstige Registerbekanntmachung",
      "state": "Bayern",
      "amtsgericht": "Amtsgericht München",
      "registernummer": "HRB 130261",
      "registerart": "HRB",
      "company_name": "Fujitsu Germany GmbH",
      "company_seat": "München",
      "details": "09.10.2024 (Bekanntmachungsdatum)\n\nBayern Amtsgericht München HRB 130261\nSonstige Registerbekanntmachung 08.10.2024 (Eintragungsdatum)\n\nFujitsu Germany GmbH\nGesellschaft mit beschränkter Haftung\nMünchen\n\nDen Gläubigern der Gesellschaft, deren Forderungen begründet worden sind, bevor die Eintragung der Beendigung des Beherrschungs- und Gewinnabführungsvertrages in das Handelsregister nach § 10 des Handelsgesetzbuches als bekanntgemacht gilt, hat der andere Vertragsteil Sicherheit zu leisten, wenn sie sich binnen sechs Monaten nach der Bekanntmachung der Eintragung zu diesem Zweck bei ihm melden."
    },
    {
      "date": "2024-10-09",
      "original_text": "Löschungsankündigung\nHessen Amtsgericht Kassel VR 1766\nFörderverein der Katholischen Arbeitnehmer-Bewegung – Kassel",
      "type": "Löschungsankündigung",
      "state": "Hessen",
      "amtsgericht": "Amtsgericht Kassel",
      "registernummer": "VR 1766",
      "registerart": "VR",
      "company_name": "Förderverein der Katholischen Arbeitnehmer-Bewegung",
      "company_seat": "Kassel",
      "details": "09.10.2024 (Bekanntmachungsdatum)\n\nHessen Amtsgericht Kassel VR 1766\nLöschungsankündigung\n\nFörderverein der Katholischen Arbeitnehmer-Bewegung\neingetragener Verein\nKassel\n\nDas Registergericht geht davon aus, dass der Verein durch Wegfall sämtlicher Mitglieder erloschen ist. Es ist daher beabsichtigt, den Verein von Amts wegen im Vereinsregister zu löschen.\nEs wird Gelegenheit gegeben, der beabsichtigten Löschung binnen 2 Monaten zu widersprechen. Dies kann schriftlich oder zu Protokoll der Geschäftsstelle bei dem Registergericht des Amtsgerichts Kassel, Friedrichsstraße 32-34, 34117 Kassel innerhalb von 2 Monaten ab Veröffentlichung dieser Löschungsankündigung geschehen."
    },
    {
      "date": "2024-10-09",
      "original_text": "Registerbekanntmachung nach dem Umwandlungsgesetz\nBayern Amtsgericht Augsburg HRA 21744\nGELTERMAIR DRUCK-SERVICE-IT e.K. – Augsburg",
      "type": "Registerbekanntmachung nach dem Umwandlungsgesetz",
      "state": "Bayern",
      "amtsgericht": "Amtsgericht Augsburg",
      "registernummer": "HRA 21744",
      "registerart": "HRA",
      "company_name": "GELTERMAIR DRUCK-SERVICE-IT e.K.",
      "company_seat": "Augsburg",
      "details": "09.10.2024 (Bekanntmachungsdatum)\n\nBayern Amtsgericht Augsburg HRA 21744\nRegisterbekanntmachung nach dem Umwandlungsgesetz 08.10.2024 (Eintragungsdatum)\n\nGELTERMAIR DRUCK-SERVICE-IT e.K.\nEinzelkaufmann / Einzelkauffrau\nAugsburg\n\nDen Gläubigern der an der Verschmelzung beteiligten Rechtsträger ist, wenn sie binnen sechs Monaten nach dem Tag, an dem die Eintragung der Verschmelzung in das Register des Sitzes desjenigen Rechtsträgers, dessen Gläubiger sie sind, nach § 19 Abs. 3 UmwG als bekannt gemacht gilt, ihren Anspruch nach Grund und Höhe schriftlich anmelden, Sicherheit zu leisten, soweit sie nicht Befriedigung verlangen können. Dieses Recht steht den Gläubigern jedoch nur zu, wenn sie glaubhaft machen, dass durch die Verschmelzung die Erfüllung ihrer Forderung gefährdet wird."
    },
    {
      "date": "2024-10-09",
      "original_text": "Registerbekanntmachung nach dem Umwandlungsgesetz\nBayern Amtsgericht Augsburg HRA 21744\nGELTERMAIR DRUCK-SERVICE-IT e.K. – Augsburg",
      "type": "Registerbekanntmachung nach dem Umwandlungsgesetz",
      "state": "Bayern",
      "amtsgericht": "Amtsgericht Augsburg",
      "registernummer": "HRA 21744",
      "registerart": "HRA",
      "company_name": "GELTERMAIR DRUCK-SERVICE-IT e.K.",
      "company_seat": "Augsburg",
      "details": "09.10.2024 (Bekanntmachungsdatum)\n\nBayern Amtsgericht Augsburg HRA 21744\nRegisterbekanntmachung nach dem Umwandlungsgesetz 08.10.2024 (Eintragungsdatum)\n\nGELTERMAIR DRUCK-SERVICE-IT e.K.\nEinzelkaufmann / Einzelkauffrau\nAugsburg\n\nDen Gläubigern der an der Verschmelzung beteiligten Rechtsträger ist, wenn sie binnen sechs Monaten nach dem Tag, an dem die Eintragung der Verschmelzung in das Register des Sitzes desjenigen Rechtsträgers, dessen Gläubiger sie sind, nach § 19 Abs. 3 UmwG als bekannt gemacht gilt, ihren Anspruch nach Grund und Höhe schriftlich anmelden, Sicherheit zu leisten, soweit sie nicht Befriedigung verlangen können. Dieses Recht steht den Gläubigern jedoch nur zu, wenn sie glaubhaft machen, dass durch die Verschmelzung die Erfüllung ihrer Forderung gefährdet wird."
    },
    {
      "date": "2024-10-09",
      "original_text": "Registerbekanntmachung nach dem Umwandlungsgesetz\nBayern Amtsgericht Nürnberg HRB 43622\nGHS Physio GmbH – Nürnberg",
      "type": "Registerbekanntmachung nach dem Umwandlungsgesetz",
      "state": "Bayern",
      "amtsgericht": "Amtsgericht Nürnberg",
      "registernummer": "HRB 43622",
      "registerart": "HRB",
      "company_name": "GHS Physio GmbH",
      "company_seat": "Nürnberg",
      "details": "09.10.2024 (Bekanntmachungsdatum)\n\nBayern Amtsgericht Nürnberg HRB 43622\nRegisterbekanntmachung nach dem Umwandlungsgesetz 08.10.2024 (Eintragungsdatum)\n\nGHS Physio GmbH\nGesellschaft mit beschränkter Haftung\nNürnberg\n\nDen Gläubigern des formwechselnden Rechtsträgers ist, wenn sie binnen sechs Monaten nach dem Tag, an dem die Eintragung des Formwechsels nach § 201 UmwG als bekannt gemacht gilt, ihren Anspruch nach Grund und Höhe schriftlich anmelden, Sicherheit zu leisten, soweit sie nicht Befriedigung verlangen können. Dieses Recht steht den Gläubigern jedoch nur zu, wenn sie glaubhaft machen, dass durch den Formwechsel die Erfüllung ihrer Forderung gefährdet wird."
    },
    {
      "date": "2024-10-09",
      "original_text": "Einreichung neuer Dokumente\nHamburg Amtsgericht Hamburg HRB 38053\nGMH Gebäudemanagement Hamburg GmbH – Hamburg",
      "type": "Einreichung neuer Dokumente",
      "state": "Hamburg",
      "amtsgericht": "Amtsgericht Hamburg",
      "registernummer": "HRB 38053",
      "registerart": "HRB",
      "company_name": "GMH Gebäudemanagement Hamburg GmbH",
      "company_seat": "Hamburg",
      "details": "09.10.2024 (Bekanntmachungsdatum)\n\nHamburg Amtsgericht Hamburg HRB 38053\nEinreichung neuer Dokumente\n\nGMH Gebäudemanagement Hamburg GmbH\nGesellschaft mit beschränkter Haftung\nHamburg\n\nAls nicht eingetragen wird bekannt gemacht: Liste des Aufsichtsrats wurde eingereicht."
    },
    {
      "date": "2024-10-09",
      "original_text": "Löschungsankündigung\nHessen Amtsgericht Frankfurt am Main HRB 117418\nGWB Consulting GmbH – Frankfurt am Main",
      "type": "Löschungsankündigung",
      "state": "Hessen",
      "amtsgericht": "Amtsgericht Frankfurt am Main",
      "registernummer": "HRB 117418",
      "registerart": "HRB",
      "company_name": "GWB Consulting GmbH",
      "company_seat": "Frankfurt am Main",
      "details": "09.10.2024 (Bekanntmachungsdatum)\n\nHessen Amtsgericht Frankfurt am Main HRB 117418\nLöschungsankündigung\n\nGWB Consulting GmbH\nGesellschaft mit beschränkter Haftung\nFrankfurt am Main\n\nDas Registergericht beabsichtigt die im Handelsregister eingetragene Gesellschaft von Amts wegen nach § 394 FamFG zu löschen. Die Frist zur Erhebung eines Widerspruchs gegen die beabsichtigte Löschung wird auf 1 Monat festgesetzt."
    },
    {
      "date": "2024-10-09",
      "original_text": "Registerbekanntmachung nach dem Umwandlungsgesetz\nNordrhein-Westfalen Amtsgericht Siegburg HRA 7115\nGaribaldi 1 Siegburg GmbH & Co. KG – Siegburg",
      "type": "Registerbekanntmachung nach dem Umwandlungsgesetz",
      "state": "Nordrhein-Westfalen",
      "amtsgericht": "Amtsgericht Siegburg",
      "registernummer": "HRA 7115",
      "registerart": "HRA",
      "company_name": "Garibaldi 1 Siegburg GmbH & Co. KG",
      "company_seat": "Siegburg",
      "details": "09.10.2024 (Bekanntmachungsdatum)\n\nNordrhein-Westfalen Amtsgericht Siegburg HRA 7115\nRegisterbekanntmachung nach dem Umwandlungsgesetz 09.10.2024 (Eintragungsdatum)\n\nGaribaldi 1 Siegburg GmbH & Co. KG\nKommanditgesellschaft\nSiegburg\n\nDen Gläubigern der an der #DV.UmF(Text=\"Bitte wählen Sie die zutreffende Art nach UmwG aus!\",Eingabe=\"Verschmelzung\",\"Aufspaltung\",\"Abspaltung\",\"Ausgliederung\",\"Vermögensübertragung\",\"formwechselnden Umwandlung\") beteiligten Rechtsträger ist, wenn sie binnen sechs Monaten nach dem Tag, an dem die Eintragung der #DV.UmF in das Register des Sitzes #DV.RTr(Text=\"Bitte wählen Sie aus, ob ein oder mehrere andere Rechtsträger betroffen sind!\",Eingabe=\"desjenigen Rechtsträgers, dessen Gläubiger\",\"derjenigen Rechtsträger deren Gläubiger\") sie sind, nach § 19 Absatz 3 UmwG als bekanntgemacht gilt, ihren Anspruch nach Grund und Höhe schriftlich anmelden, Sicherheit zu leisten, soweit sie nicht Befriedigung verlangen können. Dieses Recht steht den Gläubigern jedoch nur zu, wenn sie glaubhaft machen, dass durch die #DV.UmF die Erfüllung ihrer Forderung gefährdet wird."
    },
    {
      "date": "2024-10-09",
      "original_text": "Einreichung neuer Dokumente\nRheinland-Pfalz Amtsgericht Zweibrücken HRB 1015\nGeWoBau GmbH Zweibrücken, Gesellschaft für Wohnen und Bauen – Zweibrücken",
      "type": "Einreichung neuer Dokumente",
      "state": "Rheinland-Pfalz",
      "amtsgericht": "Amtsgericht Zweibrücken",
      "registernummer": "HRB 1015",
      "registerart": "HRB",
      "company_name": "GeWoBau GmbH Zweibrücken, Gesellschaft für Wohnen und Bauen",
      "company_seat": "Zweibrücken",
      "details": "09.10.2024 (Bekanntmachungsdatum)\n\nRheinland-Pfalz Amtsgericht Zweibrücken HRB 1015\nEinreichung neuer Dokumente\n\nGeWoBau GmbH Zweibrücken, Gesellschaft für Wohnen und Bauen\nGesellschaft mit beschränkter Haftung\nZweibrücken\n\nDem Registergericht ist eine neue Liste der Mitglieder des Aufsichtsrates eingereicht worden."
    },
    {
      "date": "2024-10-09",
      "original_text": "Einreichung neuer Dokumente\nSachsen Amtsgericht Chemnitz HRB 25542\nGemeinnützige Wohn- und Pflegezentrum Annaberg-Buchholz GmbH – Annaberg-Buchholz",
      "type": "Einreichung neuer Dokumente",
      "state": "Sachsen",
      "amtsgericht": "Amtsgericht Chemnitz",
      "registernummer": "HRB 25542",
      "registerart": "HRB",
      "company_name": "Gemeinnützige Wohn- und Pflegezentrum Annaberg-Buchholz GmbH",
      "company_seat": "Annaberg-Buchholz",
      "details": "09.10.2024 (Bekanntmachungsdatum)\n\nSachsen Amtsgericht Chemnitz HRB 25542\nEinreichung neuer Dokumente\n\nGemeinnützige Wohn- und Pflegezentrum Annaberg-Buchholz GmbH\nGesellschaft mit beschränkter Haftung\nAnnaberg-Buchholz\n\nAm 07.10.2024 wurde beim Handelsregister des Amtsgerichts Chemnitz die Liste der Mitglieder des Aufsichtsrats gemäß § 52 GmbHG eingereicht."
    },
    {
      "date": "2024-10-09",
      "original_text": "Einreichung neuer Dokumente\nBayern Amtsgericht Coburg HRB 3942\nGerresheimer Tettau GmbH – Tettau (Oberfranken)",
      "type": "Einreichung neuer Dokumente",
      "state": "Bayern",
      "amtsgericht": "Amtsgericht Coburg",
      "registernummer": "HRB 3942",
      "registerart": "HRB",
      "company_name": "Gerresheimer Tettau GmbH",
      "company_seat": "Tettau (Oberfranken)",
      "details": "09.10.2024 (Bekanntmachungsdatum)\n\nBayern Amtsgericht Coburg HRB 3942\nEinreichung neuer Dokumente 08.10.2024 (Eintragungsdatum)\n\nGerresheimer Tettau GmbH\nGesellschaft mit beschränkter Haftung\nTettau (Oberfranken)\n\nDem Amtsgericht Coburg -Registergericht- ist eine Liste der Mitglieder des Aufsichtsrats eingereicht worden, § 52 Abs. 3 S. 2 GmbHG."
    },
    {
      "date": "2024-10-09",
      "original_text": "Registerbekanntmachung nach dem Umwandlungsgesetz\nBrandenburg Amtsgericht Potsdam HRB 29704\nGeschwister Pape GmbH – Brandenburg an der Havel",
      "type": "Registerbekanntmachung nach dem Umwandlungsgesetz",
      "state": "Brandenburg",
      "amtsgericht": "Amtsgericht Potsdam",
      "registernummer": "HRB 29704",
      "registerart": "HRB",
      "company_name": "Geschwister Pape GmbH",
      "company_seat": "Brandenburg an der Havel",
      "details": "09.10.2024 (Bekanntmachungsdatum)\n\nBrandenburg Amtsgericht Potsdam HRB 29704\nRegisterbekanntmachung nach dem Umwandlungsgesetz 27.09.2024 (Eintragungsdatum)\n\nGeschwister Pape GmbH\nGesellschaft mit beschränkter Haftung\nBrandenburg an der Havel\n\nZu Eintragungsnummer 2 vom 27.09.2024 wird als nicht eingetragen veröffentlicht: Den Gläubigern der an der Verschmelzung beteiligten Rechtsträger ist, wenn sie binnen sechs Monaten nach dem Tag, an dem die Eintragung der Verschmelzung in das Register des Sitzes desjenigen Rechtsträgers, dessen Gläubiger sie sind, als bekannt gemacht gilt, ihren Anspruch nach Grund und Höhe schriftlich anmelden, Sicherheit zu leisten, soweit sie nicht Befriedigung verlangen können. Dieses Recht steht den Gläubigern jedoch nur zu, wenn sie glaubhaft machen, dass durch die Verschmelzung die Erfüllung ihrer Forderung gefährdet wird"
    },
    {
      "date": "2024-10-09",
      "original_text": "Sonstige Registerbekanntmachung\nHessen Amtsgericht Fritzlar VR 2301\nGewässergruppe Edersee – Edertal-Affoldern",
      "type": "Sonstige Registerbekanntmachung",
      "state": "Hessen",
      "amtsgericht": "Amtsgericht Fritzlar",
      "registernummer": "VR 2301",
      "registerart": "VR",
      "company_name": "Gewässergruppe Edersee",
      "company_seat": "Edertal-Affoldern",
      "details": "09.10.2024 (Bekanntmachungsdatum)\n\nHessen Amtsgericht Fritzlar VR 2301\nSonstige Registerbekanntmachung 09.10.2024 (Eintragungsdatum)\n\nGewässergruppe Edersee\neingetragener Verein\nEdertal-Affoldern\n\nDer Verein ist aufgelöst."
    },
    {
      "date": "2024-10-09",
      "original_text": "Registerbekanntmachung nach dem Umwandlungsgesetz\nSchleswig-Holstein Amtsgericht Kiel HRA 7264\nGiovanni L. Holstentörn Kiel GmbH & Co. KG – Kiel",
      "type": "Registerbekanntmachung nach dem Umwandlungsgesetz",
      "state": "Schleswig-Holstein",
      "amtsgericht": "Amtsgericht Kiel",
      "registernummer": "HRA 7264",
      "registerart": "HRA",
      "company_name": "Giovanni L. Holstentörn Kiel GmbH & Co. KG",
      "company_seat": "Kiel",
      "details": "09.10.2024 (Bekanntmachungsdatum)\n\nSchleswig-Holstein Amtsgericht Kiel HRA 7264\nRegisterbekanntmachung nach dem Umwandlungsgesetz 04.10.2024 (Eintragungsdatum)\n\nGiovanni L. Holstentörn Kiel GmbH & Co. KG\nKommanditgesellschaft\nKiel\n\nZu Eintragungsnummer 5 vom 04.10.2024 wird als nicht eingetragen veröffentlicht:  Als nicht eingetragen wird veröffentlicht: Den Gläubigern der an der Verschmelzung beteiligten Rechtsträger ist, wenn sie binnen sechs Monaten nach dem Tag, an dem die Eintragung der Verschmelzung in das Register des Sitzes desjenigen Rechtsträgers, dessen Gläubiger sie sind, nach § 19 Abs. 3 UmwG bekannt gemacht worden ist, ihren Anspruch nach Grund und Höhe schriftlich anmelden, Sicherheit zu leisten, soweit sie nicht Befriedigung verlangen können. Dieses Recht steht den Gläubigern jedoch nur zu, wenn sie glaubhaft machen, dass durch die Verschmelzung die Erfüllung ihrer Forderung gefährdet wird."
    },
    {
      "date": "2024-10-09",
      "original_text": "Registerbekanntmachung nach dem Umwandlungsgesetz\nBayern Amtsgericht Augsburg HRB 40334\nGlanz & Bohne GmbH – Tapfheim",
      "type": "Registerbekanntmachung nach dem Umwandlungsgesetz",
      "state": "Bayern",
      "amtsgericht": "Amtsgericht Augsburg",
      "registernummer": "HRB 40334",
      "registerart": "HRB",
      "company_name": "Glanz & Bohne GmbH",
      "company_seat": "Tapfheim",
      "details": "09.10.2024 (Bekanntmachungsdatum)\n\nBayern Amtsgericht Augsburg HRB 40334\nRegisterbekanntmachung nach dem Umwandlungsgesetz 08.10.2024 (Eintragungsdatum)\n\nGlanz & Bohne GmbH\nGesellschaft mit beschränkter Haftung\nTapfheim\n\nDen Gläubigern der an der Ausgliederung beteiligten Rechtsträger ist, wenn sie binnen sechs Monaten nach dem Tag, an dem die Eintragung der Ausgliederung in das Register des Sitzes desjenigen Rechtsträgers, dessen Gläubiger sie sind, nach §§ 125, 19 Abs. 3 UmwG als bekannt gemacht gilt, ihren Anspruch nach Grund und Höhe schriftlich anmelden, Sicherheit zu leisten, soweit sie nicht Befriedigung verlangen können. Dieses Recht steht den Gläubigern jedoch nur zu, wenn sie glaubhaft machen, dass durch die Ausgliederung die Erfüllung ihrer Forderung gefährdet wird."
    },
    {
      "date": "2024-10-09",
      "original_text": "Registerbekanntmachung nach dem Umwandlungsgesetz\nHessen Amtsgericht Darmstadt HRB 98807\nGrass Valley Germany GmbH – Weiterstadt",
      "type": "Registerbekanntmachung nach dem Umwandlungsgesetz",
      "state": "Hessen",
      "amtsgericht": "Amtsgericht Darmstadt",
      "registernummer": "HRB 98807",
      "registerart": "HRB",
      "company_name": "Grass Valley Germany GmbH",
      "company_seat": "Weiterstadt",
      "details": "09.10.2024 (Bekanntmachungsdatum)\n\nHessen Amtsgericht Darmstadt HRB 98807\nRegisterbekanntmachung nach dem Umwandlungsgesetz 09.10.2024 (Eintragungsdatum)\n\nGrass Valley Germany GmbH\nGesellschaft mit beschränkter Haftung\nWeiterstadt\n\nDen Gläubigern der an der Verschmelzung beteiligten Rechtsträger ist, wenn sie binnen sechs Monaten nach dem Tag, an dem die Eintragung der Verschmelzung in das Register des Sitzes desjenigen Rechtsträgers, dessen Gläubiger sie sind, nach § 19 Absatz 3 UmwG bekannt gemacht worden ist, ihren Anspruch nach Grund und Höhe schriftlich anmelden, Sicherheit zu leisten, soweit sie nicht Befriedigung verlangen können. Dieses Recht steht den Gläubigern jedoch nur zu, wenn sie glaubhaft machen, dass durch die Verschmelzung die Erfüllung ihrer Forderung gefährdet wird."
    },
    {
      "date": "2024-10-09",
      "original_text": "Sonstige Registerbekanntmachung\nNordrhein-Westfalen Amtsgericht Gütersloh HRB 11257\nGründer und Tönjes Holding GmbH – Rheda-Wiedenbrück",
      "type": "Sonstige Registerbekanntmachung",
      "state": "Nordrhein-Westfalen",
      "amtsgericht": "Amtsgericht Gütersloh",
      "registernummer": "HRB 11257",
      "registerart": "HRB",
      "company_name": "Gründer und Tönjes Holding GmbH",
      "company_seat": "Rheda-Wiedenbrück",
      "details": "09.10.2024 (Bekanntmachungsdatum)\n\nNordrhein-Westfalen Amtsgericht Gütersloh HRB 11257\nSonstige Registerbekanntmachung\n\nGründer und Tönjes Holding GmbH\nGesellschaft mit beschränkter Haftung\nRheda-Wiedenbrück\n\nIn der Handelsregistersache Gründer und Tönjes Holding GmbH ist beabsichtigt, den im Handelsregister HRB 11257 eingetragenen Geschäftsführer gem. § 395 FamFG unter Hinweis auf die am 26.05.2023 erfolgte Gewerbeuntersagung zu löschen. Es besteht Gelegenheit zur Stellungnahme binnen 2 Wochen."
    },
    {
      "date": "2024-10-09",
      "original_text": "Sonstige Registerbekanntmachung\nNordrhein-Westfalen Amtsgericht Gütersloh HRB 11203\nGründer und Tönjes Invest GmbH – Rheda-Wiedenbrück",
      "type": "Sonstige Registerbekanntmachung",
      "state": "Nordrhein-Westfalen",
      "amtsgericht": "Amtsgericht Gütersloh",
      "registernummer": "HRB 11203",
      "registerart": "HRB",
      "company_name": "Gründer und Tönjes Invest GmbH",
      "company_seat": "Rheda-Wiedenbrück",
      "details": "09.10.2024 (Bekanntmachungsdatum)\n\nNordrhein-Westfalen Amtsgericht Gütersloh HRB 11203\nSonstige Registerbekanntmachung\n\nGründer und Tönjes Invest GmbH\nGesellschaft mit beschränkter Haftung\nRheda-Wiedenbrück\n\nIn der Handelregistersache Gründer und Tönjes Invest GmbH ist beabsichtigt, den im Handelsregister HRB 11203 eingetragenen Geschäftsführer gem. § 395 FamFG unter Hinweis auf die am 26.05.2023 erfolgte Gewerbeuntersagung zu löschen. Es besteht Gelegenheit zur Stellungnahme binnen 2 Wochen."
    },
    {
      "date": "2024-10-09",
      "original_text": "Löschungsankündigung\nNordrhein-Westfalen Amtsgericht Essen HRB 35182\nHBA Höhere Bildungsakademie Essen gGmbH – Essen",
      "type": "Löschungsankündigung",
      "state": "Nordrhein-Westfalen",
      "amtsgericht": "Amtsgericht Essen",
      "registernummer": "HRB 35182",
      "registerart": "HRB",
      "company_name": "HBA Höhere Bildungsakademie Essen gGmbH",
      "company_seat": "Essen",
      "details": "09.10.2024 (Bekanntmachungsdatum)\n\nNordrhein-Westfalen Amtsgericht Essen HRB 35182\nLöschungsankündigung 09.10.2024 (Eintragungsdatum)\n\nHBA Höhere Bildungsakademie Essen gGmbH\nGesellschaft mit beschränkter Haftung\nEssen\n\nDen Gläubigern der an der Verschmelzung beteiligten Rechtsträger ist, wenn sie binnen sechs Monaten nach dem Tag, an dem die Eintragung der Verschmelzung in das Register des Sitzes desjenigen Rechtsträgers, dessen Gläubiger sie sind, nach § 19 Absatz 3 UmwG als bekanntgemacht gilt, ihren Anspruch nach Grund und Höhe schriftlich anmelden, Sicherheit zu leisten, soweit sie nicht Befriedigung verlangen können. Dieses Recht steht den Gläubigern jedoch nur zu, wenn sie glaubhaft machen, dass durch die Verschmelzung die Erfüllung ihrer Forderung gefährdet wird."
    },
    {
      "date": "2024-10-09",
      "original_text": "Löschungsankündigung\nHessen Amtsgericht Offenbach am Main HRB 46388\nHaaf Service GmbH – Offenbach am Main",
      "type": "Löschungsankündigung",
      "state": "Hessen",
      "amtsgericht": "Amtsgericht Offenbach am Main",
      "registernummer": "HRB 46388",
      "registerart": "HRB",
      "company_name": "Haaf Service GmbH",
      "company_seat": "Offenbach am Main",
      "details": "09.10.2024 (Bekanntmachungsdatum)\n\nHessen Amtsgericht Offenbach am Main HRB 46388\nLöschungsankündigung\n\nHaaf Service GmbH\nGesellschaft mit beschränkter Haftung\nOffenbach am Main\n\nDas Registergericht beabsichtigt die im Handelsregister eingetragene Gesellschaft von Amts wegen nach § 394 FamFG zu löschen. Die Frist zur Erhebung eines Widerspruchs gegen die beabsichtigte Löschung wird auf 3 Monate festgesetzt"
    },
    {
      "date": "2024-10-09",
      "original_text": "Löschungsankündigung\nNordrhein-Westfalen Amtsgericht Essen HRB 21415\nHausmeisterservice Schott Unternehmergesellschaft (haftungsbeschränkt) – Essen",
      "type": "Löschungsankündigung",
      "state": "Nordrhein-Westfalen",
      "amtsgericht": "Amtsgericht Essen",
      "registernummer": "HRB 21415",
      "registerart": "HRB",
      "company_name": "Hausmeisterservice Schott Unternehmergesellschaft (haftungsbeschränkt)",
      "company_seat": "Essen",
      "details": "09.10.2024 (Bekanntmachungsdatum)\n\nNordrhein-Westfalen Amtsgericht Essen HRB 21415\nLöschungsankündigung\n\nHausmeisterservice Schott Unternehmergesellschaft (haftungsbeschränkt)\nGesellschaft mit beschränkter Haftung\nEssen\n\nDas Registergericht beabsichtigt die Gesellschaft von Amts wegen nach § 394 FamFG zu löschen. Die Frist zur Erhebung eines Widerspruchs ist auf einen Monat festgesetzt."
    },
    {
      "date": "2024-10-09",
      "original_text": "Registerbekanntmachung nach dem Umwandlungsgesetz\nNordrhein-Westfalen Amtsgericht Lemgo HRB 10269\nHenneberg UG (haftungsbeschränkt) – Lage",
      "type": "Registerbekanntmachung nach dem Umwandlungsgesetz",
      "state": "Nordrhein-Westfalen",
      "amtsgericht": "Amtsgericht Lemgo",
      "registernummer": "HRB 10269",
      "registerart": "HRB",
      "company_name": "Henneberg UG (haftungsbeschränkt)",
      "company_seat": "Lage",
      "details": "09.10.2024 (Bekanntmachungsdatum)\n\nNordrhein-Westfalen Amtsgericht Lemgo HRB 10269\nRegisterbekanntmachung nach dem Umwandlungsgesetz 09.10.2024 (Eintragungsdatum)\n\nHenneberg UG (haftungsbeschränkt)\nGesellschaft mit beschränkter Haftung\nLage\n\nDen Gläubigern der an der formwechselnden Umwandlung beteiligten Rechtsträger ist, wenn sie binnen sechs Monaten nach dem Tag, an dem die Eintragung der formwechselnden Umwandlung in das Register des Sitzes desjenigen Rechtsträgers, dessen Gläubiger sie sind, nach § 19 Absatz 3 UmwG als bekanntgemacht gilt, ihren Anspruch nach Grund und Höhe schriftlich anmelden, Sicherheit zu leisten, soweit sie nicht Befriedigung verlangen können. Dieses Recht steht den Gläubigern jedoch nur zu, wenn sie glaubhaft machen, dass durch die formwechselnden Umwandlung die Erfüllung ihrer Forderung gefährdet wird."
    },
    {
      "date": "2024-10-09",
      "original_text": "Registerbekanntmachung nach dem Umwandlungsgesetz\nNordrhein-Westfalen Amtsgericht Lemgo HRA 6423\nHennebergs Hautpflege OHG – Lage",
      "type": "Registerbekanntmachung nach dem Umwandlungsgesetz",
      "state": "Nordrhein-Westfalen",
      "amtsgericht": "Amtsgericht Lemgo",
      "registernummer": "HRA 6423",
      "registerart": "HRA",
      "company_name": "Hennebergs Hautpflege OHG",
      "company_seat": "Lage",
      "details": "09.10.2024 (Bekanntmachungsdatum)\n\nNordrhein-Westfalen Amtsgericht Lemgo HRA 6423\nRegisterbekanntmachung nach dem Umwandlungsgesetz 09.10.2024 (Eintragungsdatum)\n\nHennebergs Hautpflege OHG\nOffene Handelsgesellschaft\nLage\n\nDen Gläubigern der an der formwechselnden Umwandlung beteiligten Rechtsträger ist, wenn sie binnen sechs Monaten nach dem Tag, an dem die Eintragung der formwechselnden Umwandlung in das Register des Sitzes desjenigen Rechtsträgers, dessen Gläubiger sie sind, nach § 19 Absatz 3 UmwG als bekanntgemacht gilt, ihren Anspruch nach Grund und Höhe schriftlich anmelden, Sicherheit zu leisten, soweit sie nicht Befriedigung verlangen können. Dieses Recht steht den Gläubigern jedoch nur zu, wenn sie glaubhaft machen, dass durch die formwechselnden Umwandlung die Erfüllung ihrer Forderung gefährdet wird."
    },
    {
      "date": "2024-10-09",
      "original_text": "Registerbekanntmachung nach dem Umwandlungsgesetz\nRheinland-Pfalz Amtsgericht Ludwigshafen a.Rhein (Ludwigshafen) HRB 69001\nICM GmbH – Wachenheim",
      "type": "Registerbekanntmachung nach dem Umwandlungsgesetz",
      "state": "Rheinland-Pfalz",
      "amtsgericht": "Amtsgericht Ludwigshafen a.Rhein (Ludwigshafen)",
      "registernummer": "HRB 69001",
      "registerart": "HRB",
      "company_name": "ICM GmbH",
      "company_seat": "Wachenheim",
      "details": "09.10.2024 (Bekanntmachungsdatum)\n\nRheinland-Pfalz Amtsgericht Ludwigshafen a.Rhein (Ludwigshafen) HRB 69001\nRegisterbekanntmachung nach dem Umwandlungsgesetz 02.10.2024 (Eintragungsdatum)\n\nICM GmbH\nGesellschaft mit beschränkter Haftung\nWachenheim\n\nAls nicht eingetragen wird veröffentlicht: Den Gläubigern der an der Ausgliederung beteiligten Rechtsträger ist, wenn sie binnen sechs Monaten nac hdem Tag, an dem die Eintragung der Ausgliederung in das Register des Sitzes desjenigen Rechtsträgers,dessen Gläubiger sie sind, nach § 19 Abs. 3 UmwG als bekannt gemacht gilt, ihren Anspruch nach Grund und Höhe schriftlich anmelden, Sicherheit zu leisten, soweit sie nicht Befriedigung verlangen können. Dieses Recht steht den Gläubigern jedoch nur zu, wenn sie glaubhaft machen, dass durch die Ausgliederung die Erfüllung der Forderung gefährdet wird."
    },
    {
      "date": "2024-10-09",
      "original_text": "Registerbekanntmachung nach dem Umwandlungsgesetz\nSchleswig-Holstein Amtsgericht Kiel HRB 27004\nIT-mo GmbH – Kaltenkirchen",
      "type": "Registerbekanntmachung nach dem Umwandlungsgesetz",
      "state": "Schleswig-Holstein",
      "amtsgericht": "Amtsgericht Kiel",
      "registernummer": "HRB 27004",
      "registerart": "HRB",
      "company_name": "IT-mo GmbH",
      "company_seat": "Kaltenkirchen",
      "details": "09.10.2024 (Bekanntmachungsdatum)\n\nSchleswig-Holstein Amtsgericht Kiel HRB 27004\nRegisterbekanntmachung nach dem Umwandlungsgesetz 08.10.2024 (Eintragungsdatum)\n\nIT-mo GmbH\nGesellschaft mit beschränkter Haftung\nKaltenkirchen\n\nZu Eintragungsnummer 2 vom 08.10.2024 wird als nicht eingetragen veröffentlicht: Als nicht eingetragen wird veröffentlicht: Den Gläubigern der an der Spaltung beteiligten Rechtsträger ist, wenn sie binnen sechs Monaten nach dem Tag, an dem die Eintragung der Spaltung in das Register des Sitzes desjenigen Rechtsträgers, dessen Gläubiger sie sind,  bekannt gemacht worden ist, ihren Anspruch nach Grund und Höhe schriftlich anmelden, Sicherheit zu leisten, soweit sie nicht Befriedigung verlangen können. Dieses Recht steht den Gläubigern jedoch nur zu, wenn sie glaubhaft machen, dass durch die Spaltung die Erfüllung ihrer Forderung gefährdet wird."
    },
    {
      "date": "2024-10-09",
      "original_text": "Registerbekanntmachung nach dem Umwandlungsgesetz\nSchleswig-Holstein Amtsgericht Kiel HRA 12280\nIT-mo Timo Schöttler e.K. – Kaltenkirchen",
      "type": "Registerbekanntmachung nach dem Umwandlungsgesetz",
      "state": "Schleswig-Holstein",
      "amtsgericht": "Amtsgericht Kiel",
      "registernummer": "HRA 12280",
      "registerart": "HRA",
      "company_name": "IT-mo Timo Schöttler e.K.",
      "company_seat": "Kaltenkirchen",
      "details": "09.10.2024 (Bekanntmachungsdatum)\n\nSchleswig-Holstein Amtsgericht Kiel HRA 12280\nRegisterbekanntmachung nach dem Umwandlungsgesetz 08.10.2024 (Eintragungsdatum)\n\nIT-mo Timo Schöttler e.K.\nEinzelkaufmann / Einzelkauffrau\nKaltenkirchen\n\nZu Eintragungsnummer 2 vom 08.10.2024 wird als nicht eingetragen veröffentlicht: Den Gläubigern der an der Spaltung beteiligten Rechtsträger ist, wenn sie binnen sechs Monaten nach dem Tag, an dem die Eintragung der Spaltung in das Register des Sitzes desjenigen Rechtsträgers, dessen Gläubiger sie sind,  bekannt gemacht worden ist, ihren Anspruch nach Grund und Höhe schriftlich anmelden, Sicherheit zu leisten, soweit sie nicht Befriedigung verlangen können. Dieses Recht steht den Gläubigern jedoch nur zu, wenn sie glaubhaft machen, dass durch die Spaltung die Erfüllung ihrer Forderung gefährdet wird."
    },
    {
      "date": "2024-10-09",
      "original_text": "Registerbekanntmachung nach dem Umwandlungsgesetz\nNordrhein-Westfalen Amtsgericht Iserlohn HRA 4838\nIhmertsche Liegenschaften GmbH & Co. KG – Hemer",
      "type": "Registerbekanntmachung nach dem Umwandlungsgesetz",
      "state": "Nordrhein-Westfalen",
      "amtsgericht": "Amtsgericht Iserlohn",
      "registernummer": "HRA 4838",
      "registerart": "HRA",
      "company_name": "Ihmertsche Liegenschaften GmbH & Co. KG",
      "company_seat": "Hemer",
      "details": "09.10.2024 (Bekanntmachungsdatum)\n\nNordrhein-Westfalen Amtsgericht Iserlohn HRA 4838\nRegisterbekanntmachung nach dem Umwandlungsgesetz 02.10.2024 (Eintragungsdatum)\n\nIhmertsche Liegenschaften GmbH & Co. KG\nKommanditgesellschaft\nHemer\n\nDen Gläubigern der an der formwechselnden Umwandlung beteiligten Rechtsträger ist, wenn sie binnen sechs Monaten nach dem Tag, an dem die Eintragung der formwechselnden Umwandlung in das Register des Sitzes desjenigen Rechtsträgers, dessen Gläubiger sie sind, nach § 19 Absatz 3 UmwG als bekanntgemacht gilt, ihren Anspruch nach Grund und Höhe schriftlich anmelden, Sicherheit zu leisten, soweit sie nicht Befriedigung verlangen können. Dieses Recht steht den Gläubigern jedoch nur zu, wenn sie glaubhaft machen, dass durch die formwechselnden Umwandlung die Erfüllung ihrer Forderung gefährdet wird."
    },
    {
      "date": "2024-10-09",
      "original_text": "Löschungsankündigung\nNordrhein-Westfalen Amtsgericht Wuppertal HRA 24978\nIsaform UG & Co. KG – Wuppertal",
      "type": "Löschungsankündigung",
      "state": "Nordrhein-Westfalen",
      "amtsgericht": "Amtsgericht Wuppertal",
      "registernummer": "HRA 24978",
      "registerart": "HRA",
      "company_name": "Isaform UG & Co. KG",
      "company_seat": "Wuppertal",
      "details": "09.10.2024 (Bekanntmachungsdatum)\n\nNordrhein-Westfalen Amtsgericht Wuppertal HRA 24978\nLöschungsankündigung 09.10.2024 (Eintragungsdatum)\n\nIsaform UG & Co. KG\nKommanditgesellschaft\nWuppertal\n\nDas Registergericht beabsichtigt die Firma von Amts wegen nach § 394 FamFG zu löschen. Die Frist zur Erhebung eines Widerspruchs ist auf drei Monate festgesetzt."
    },
    {
      "date": "2024-10-09",
      "original_text": "Löschungsankündigung\nNordrhein-Westfalen Amtsgericht Düsseldorf HRB 27728\nIsenbeck Deutsche Immobilien Aktiengesellschaft – Düsseldorf",
      "type": "Löschungsankündigung",
      "state": "Nordrhein-Westfalen",
      "amtsgericht": "Amtsgericht Düsseldorf",
      "registernummer": "HRB 27728",
      "registerart": "HRB",
      "company_name": "Isenbeck Deutsche Immobilien Aktiengesellschaft",
      "company_seat": "Düsseldorf",
      "details": "09.10.2024 (Bekanntmachungsdatum)\n\nNordrhein-Westfalen Amtsgericht Düsseldorf HRB 27728\nLöschungsankündigung\n\nIsenbeck Deutsche Immobilien Aktiengesellschaft\nAktiengesellschaft\nDüsseldorf\n\nDas Registergericht beabsichtigt die Gesellschaft von Amts wegen nach § 394 FamFG zu löschen. Die Frist zur Erhebung eines Widerspruchs ist auf 3 Wochen festgesetzt.\n\nRechtsbehelfsbelehrung:\nDas Widerspruchsrecht steht jedem zu, der an der Unterlassung der Löschung ein berechtigtes Interesse hat. Der Widerspruch ist bei dem Amtsgericht Düsseldorf -Registergericht-, Werdener Straße 1, 40227 Düsseldorf schriftlich in deutscher Sprache oder zur Niederschrift der Geschäftsstelle einzulegen. Der Widerspruch kann auch zur Niederschrift der Geschäftsstelle eines jeden Amtsgerichtes abgegeben werden. Die Einlegung ist auch durch Übertragung eines elektronischen Dokuments an die elektronische Poststelle des Gerichts möglich. Das elektronische Dokument muss für die Bearbeitung durch das Gericht geeignet und mit einer qualifizierten elektronischen Signatur der verantwortenden Person versehen sein oder von der verantwortenden Person signiert und auf einem sicheren Übermittlungsweg gemäß § 130a ZPO nach näherer Maßgabe der Verordnung über die technischen Rahmenbedingungen des elektronischen Rechtsverkehrs und über das besondere elektronische Behördenpostfach (BGBl. I, S.3803) eingereicht werden. Weitere Informationen erhalten Sie auf der Internetseite www.justiz.de.\nDer Widerspruch muss spätestens innerhalb der gesetzten Frist nach dem Datum der Bekanntmachung der Löschungsankündigung bei dem Amtsgericht - Registergericht - Düsseldorf eingegangen sein.  Dies gilt auch dann, wenn der Widerspruch zur Niederschrift der Geschäftsstelle eines anderen Amtsgerichtes abgegeben wurde. Die Frist beginnt mit dem Tage der Bekanntmachung der Löschungsankündigung in dem für die Bekanntmachung der Eintragungen in das Handelsregister bestimmten elektronischen Informations- und Kommunikationssystem nach § 10 des Handelsgesetzbuches. Fällt das Ende der Frist auf einen Sonntag, einen allgemeinen Feiertag oder Sonnabend, so endet die Frist mit Ablauf des nächsten Werktages.\nDer Widerspruch muss die Bezeichnung der angefochtenen Löschungsankündigung sowie die Erklärung enthalten, dass Widerspruch gegen diese Löschungsankündigung eingelegt wird. Er ist zu unterzeichnen und soll begründet werden."
    },
    {
      "date": "2024-10-09",
      "original_text": "Einreichung neuer Dokumente\nNordrhein-Westfalen Amtsgericht Düren HRB 4349\nJEN Jülicher Entsorgungsgesellschaft für Nuklearanlagen mbH – Jülich",
      "type": "Einreichung neuer Dokumente",
      "state": "Nordrhein-Westfalen",
      "amtsgericht": "Amtsgericht Düren",
      "registernummer": "HRB 4349",
      "registerart": "HRB",
      "company_name": "JEN Jülicher Entsorgungsgesellschaft für Nuklearanlagen mbH",
      "company_seat": "Jülich",
      "details": "09.10.2024 (Bekanntmachungsdatum)\n\nNordrhein-Westfalen Amtsgericht Düren HRB 4349\nEinreichung neuer Dokumente 09.10.2024 (Eintragungsdatum)\n\nJEN Jülicher Entsorgungsgesellschaft für Nuklearanlagen mbH\nGesellschaft mit beschränkter Haftung\nJülich\n\nDem Registergericht ist eine neue Liste der Mitglieder des Aufsichtsrates eingereicht worden."
    },
    {
      "date": "2024-10-09",
      "original_text": "Löschungsankündigung\nRheinland-Pfalz Amtsgericht Mainz HRB 50082\nJanjic Bau UG (haftungsbeschränkt) – Mainz",
      "type": "Löschungsankündigung",
      "state": "Rheinland-Pfalz",
      "amtsgericht": "Amtsgericht Mainz",
      "registernummer": "HRB 50082",
      "registerart": "HRB",
      "company_name": "Janjic Bau UG (haftungsbeschränkt)",
      "company_seat": "Mainz",
      "details": "09.10.2024 (Bekanntmachungsdatum)\n\nRheinland-Pfalz Amtsgericht Mainz HRB 50082\nLöschungsankündigung 09.10.2024 (Eintragungsdatum)\n\nJanjic Bau UG (haftungsbeschränkt)\nGesellschaft mit beschränkter Haftung\nMainz\n\nDas Registergericht beabsichtigt die Gesellschaft von Amts wegen nach § 394 FamFG zu löschen. Die Frist zur Erhebung eines Widerspruchs ist auf einen Monat festgesetzt."
    },
    {
      "date": "2024-10-09",
      "original_text": "Löschungsankündigung\nBerlin Amtsgericht Berlin (Charlottenburg) HRB 224197\nJiggy Bau GmbH – Berlin",
      "type": "Löschungsankündigung",
      "state": "Berlin",
      "amtsgericht": "Amtsgericht Berlin (Charlottenburg)",
      "registernummer": "HRB 224197",
      "registerart": "HRB",
      "company_name": "Jiggy Bau GmbH",
      "company_seat": "Berlin",
      "details": "09.10.2024 (Bekanntmachungsdatum)\n\nBerlin Amtsgericht Berlin (Charlottenburg) HRB 224197\nLöschungsankündigung\n\nJiggy Bau GmbH\nGesellschaft mit beschränkter Haftung\nBerlin\n\nBei der nachstehenden Gesellschaft wird das Amtslöschungsverfahren gemäß § 394 FamFG eingeleitet. Widerspruchsfrist 6 Wochen"
    },
    {
      "date": "2024-10-09",
      "original_text": "Registerbekanntmachung nach dem Umwandlungsgesetz\nSchleswig-Holstein Amtsgericht Kiel HRA 11983\nJohannsen Beteiligungs UG (haftungsbeschränkt) & Co. KG – Neumünster",
      "type": "Registerbekanntmachung nach dem Umwandlungsgesetz",
      "state": "Schleswig-Holstein",
      "amtsgericht": "Amtsgericht Kiel",
      "registernummer": "HRA 11983",
      "registerart": "HRA",
      "company_name": "Johannsen Beteiligungs UG (haftungsbeschränkt) & Co. KG",
      "company_seat": "Neumünster",
      "details": "09.10.2024 (Bekanntmachungsdatum)\n\nSchleswig-Holstein Amtsgericht Kiel HRA 11983\nRegisterbekanntmachung nach dem Umwandlungsgesetz 08.10.2024 (Eintragungsdatum)\n\nJohannsen Beteiligungs UG (haftungsbeschränkt) & Co. KG\nKommanditgesellschaft\nNeumünster\n\nAls nicht eingetragen wird veröffentlicht: Den Gläubigern der an der Spaltung beteiligten Rechtsträger ist, wenn sie binnen sechs Monaten nach dem Tag, an dem die Eintragung der Spaltung in das Register des Sitzes desjenigen Rechtsträgers, dessen Gläubiger sie sind,  bekannt gemacht worden ist, ihren Anspruch nach Grund und Höhe schriftlich anmelden, Sicherheit zu leisten, soweit sie nicht Befriedigung verlangen können. Dieses Recht steht den Gläubigern jedoch nur zu, wenn sie glaubhaft machen, dass durch die Spaltung die Erfüllung ihrer Forderung gefährdet wird."
    },
    {
      "date": "2024-10-09",
      "original_text": "Einreichung neuer Dokumente\nBayern Amtsgericht Aschaffenburg HRB 14574\nJoyson Safety Systems Germany GmbH – Aschaffenburg",
      "type": "Einreichung neuer Dokumente",
      "state": "Bayern",
      "amtsgericht": "Amtsgericht Aschaffenburg",
      "registernummer": "HRB 14574",
      "registerart": "HRB",
      "company_name": "Joyson Safety Systems Germany GmbH",
      "company_seat": "Aschaffenburg",
      "details": "09.10.2024 (Bekanntmachungsdatum)\n\nBayern Amtsgericht Aschaffenburg HRB 14574\nEinreichung neuer Dokumente\n\nJoyson Safety Systems Germany GmbH\nGesellschaft mit beschränkter Haftung\nAschaffenburg\n\nDem Amtsgericht Aschaffenburg -Registergericht- ist eine Liste der Mitglieder des Aufsichtsrats eingereicht worden, § 52 Abs. 3 S. 2 GmbHG."
    },
    {
      "date": "2024-10-09",
      "original_text": "Registerbekanntmachung nach dem Umwandlungsgesetz\nNiedersachsen Amtsgericht Tostedt HRB 206844\nK. Hartwall GmbH – Heidenau",
      "type": "Registerbekanntmachung nach dem Umwandlungsgesetz",
      "state": "Niedersachsen",
      "amtsgericht": "Amtsgericht Tostedt",
      "registernummer": "HRB 206844",
      "registerart": "HRB",
      "company_name": "K. Hartwall GmbH",
      "company_seat": "Heidenau",
      "details": "09.10.2024 (Bekanntmachungsdatum)\n\nNiedersachsen Amtsgericht Tostedt HRB 206844\nRegisterbekanntmachung nach dem Umwandlungsgesetz 09.10.2024 (Eintragungsdatum)\n\nK. Hartwall GmbH\nGesellschaft mit beschränkter Haftung\nHeidenau\n\nDen Gläubigern der an der Verschmelzung beteiligten Rechtsträger ist, wenn sie binnen sechs Monaten nach dem Tag, an dem die Eintragung der Verschmelzung in das Register des Sitzes desjenigen Rechtsträgers, dessen Gläubiger sie sind, nach § 19  Abs.  3 UmwG als bekannt gemacht gilt, ihren Anspruch nach Grund und Höhe schriftlich anmelden, Sicherheit zu leisten, soweit sie nicht Befriedigung verlangen können. Dieses Recht steht den Gläubigern jedoch nur zu, wenn sie glaubhaft machen, dass durch die Verschmelzung die Erfüllung der Forderung gefährdet wird."
    },
    {
      "date": "2024-10-09",
      "original_text": "Registerbekanntmachung nach dem Umwandlungsgesetz\nNordrhein-Westfalen Amtsgericht Iserlohn HRA 4806\nKOSTAL Industriegrundbesitz GmbH & Co. KG – Lüdenscheid",
      "type": "Registerbekanntmachung nach dem Umwandlungsgesetz",
      "state": "Nordrhein-Westfalen",
      "amtsgericht": "Amtsgericht Iserlohn",
      "registernummer": "HRA 4806",
      "registerart": "HRA",
      "company_name": "KOSTAL Industriegrundbesitz GmbH & Co. KG",
      "company_seat": "Lüdenscheid",
      "details": "09.10.2024 (Bekanntmachungsdatum)\n\nNordrhein-Westfalen Amtsgericht Iserlohn HRA 4806\nRegisterbekanntmachung nach dem Umwandlungsgesetz 09.10.2024 (Eintragungsdatum)\n\nKOSTAL Industriegrundbesitz GmbH & Co. KG\nKommanditgesellschaft\nLüdenscheid\n\nDen Gläubigern der an der Ausgliederung beteiligten Rechtsträger ist, wenn sie binnen sechs Monaten nach dem Tag, an dem die Eintragung der Ausgliederung in das Register des Sitzes desjenigen Rechtsträgers, dessen Gläubiger sie sind, nach § 19 Absatz 3 UmwG als bekanntgemacht gilt, ihren Anspruch nach Grund und Höhe schriftlich anmelden, Sicherheit zu leisten, soweit sie nicht Befriedigung verlangen können. Dieses Recht steht den Gläubigern jedoch nur zu, wenn sie glaubhaft machen, dass durch die Ausgliederung die Erfüllung ihrer Forderung gefährdet wird."
    },
    {
      "date": "2024-10-09",
      "original_text": "Löschungsankündigung\nSaarland Amtsgericht Saarbrücken HRB 104427\nKarcher Umzugslogistik GmbH – Saarbrücken",
      "type": "Löschungsankündigung",
      "state": "Saarland",
      "amtsgericht": "Amtsgericht Saarbrücken",
      "registernummer": "HRB 104427",
      "registerart": "HRB",
      "company_name": "Karcher Umzugslogistik GmbH",
      "company_seat": "Saarbrücken",
      "details": "09.10.2024 (Bekanntmachungsdatum)\n\nSaarland Amtsgericht Saarbrücken HRB 104427\nLöschungsankündigung\n\nKarcher Umzugslogistik GmbH\nGesellschaft mit beschränkter Haftung\nSaarbrücken\n\nEs ist beabsichtigt, die Gesellschaft von Amts wegen gemäß § 394 FamFG wegen Vermögenslosigkeit zu löschen. Gegen die Löschung von Amts wegen ist das Rechtsmittel des Widerspruchs statthaft. Der Widerspruch ist binnen einer Frist von 3 Monaten beginnend mit dem Tag dieser Veröffentlichung durch Einreichen eines Widerspruchsschreibens -schriftlich oder zur Niederschrift der Geschäftsstelle- beim Amtsgericht Saarbrücken, -zentrales Handelsregister-, Mainzerstr.178, 66121 Saarbrücken einzulegen. Der Widerspruch muss die Bezeichnung der angefochtenen Löschungsankündigung enthalten sowie die Erklärung, dass Widerspruch eingelegt wird. Er ist vom Widerspruchsführer oder seinem Bevollmächtigten zu unterzeichnen."
    },
    {
      "date": "2024-10-09",
      "original_text": "Löschungsankündigung\nNordrhein-Westfalen Amtsgericht Düsseldorf HRB 39592\nKaufring Werbeagentur GmbH – Düsseldorf",
      "type": "Löschungsankündigung",
      "state": "Nordrhein-Westfalen",
      "amtsgericht": "Amtsgericht Düsseldorf",
      "registernummer": "HRB 39592",
      "registerart": "HRB",
      "company_name": "Kaufring Werbeagentur GmbH",
      "company_seat": "Düsseldorf",
      "details": "09.10.2024 (Bekanntmachungsdatum)\n\nNordrhein-Westfalen Amtsgericht Düsseldorf HRB 39592\nLöschungsankündigung\n\nKaufring Werbeagentur GmbH\nGesellschaft mit beschränkter Haftung\nDüsseldorf\n\nDas Registergericht beabsichtigt die Gesellschaft von Amts wegen nach § 394 FamFG zu löschen. Die Frist zur Erhebung eines Widerspruchs ist auf 3 Wochen festgesetzt.\n\nRechtsbehelfsbelehrung:\nDas Widerspruchsrecht steht jedem zu, der an der Unterlassung der Löschung ein berechtigtes Interesse hat. Der Widerspruch ist bei dem Amtsgericht Düsseldorf -Registergericht-, Werdener Straße 1, 40227 Düsseldorf schriftlich in deutscher Sprache oder zur Niederschrift der Geschäftsstelle einzulegen. Der Widerspruch kann auch zur Niederschrift der Geschäftsstelle eines jeden Amtsgerichtes abgegeben werden. Die Einlegung ist auch durch Übertragung eines elektronischen Dokuments an die elektronische Poststelle des Gerichts möglich. Das elektronische Dokument muss für die Bearbeitung durch das Gericht geeignet und mit einer qualifizierten elektronischen Signatur der verantwortenden Person versehen sein oder von der verantwortenden Person signiert und auf einem sicheren Übermittlungsweg gemäß § 130a ZPO nach näherer Maßgabe der Verordnung über die technischen Rahmenbedingungen des elektronischen Rechtsverkehrs und über das besondere elektronische Behördenpostfach (BGBl. I, S.3803) eingereicht werden. Weitere Informationen erhalten Sie auf der Internetseite www.justiz.de.\nDer Widerspruch muss spätestens innerhalb der gesetzten Frist nach dem Datum der Bekanntmachung der Löschungsankündigung bei dem Amtsgericht - Registergericht - Düsseldorf eingegangen sein.  Dies gilt auch dann, wenn der Widerspruch zur Niederschrift der Geschäftsstelle eines anderen Amtsgerichtes abgegeben wurde. Die Frist beginnt mit dem Tage der Bekanntmachung der Löschungsankündigung in dem für die Bekanntmachung der Eintragungen in das Handelsregister bestimmten elektronischen Informations- und Kommunikationssystem nach § 10 des Handelsgesetzbuches. Fällt das Ende der Frist auf einen Sonntag, einen allgemeinen Feiertag oder Sonnabend, so endet die Frist mit Ablauf des nächsten Werktages.\nDer Widerspruch muss die Bezeichnung der angefochtenen Löschungsankündigung sowie die Erklärung enthalten, dass Widerspruch gegen diese Löschungsankündigung eingelegt wird. Er ist zu unterzeichnen und soll begründet werden."
    },
    {
      "date": "2024-10-09",
      "original_text": "Registerbekanntmachung nach dem Umwandlungsgesetz\nHessen Amtsgericht Fulda HRA 6625\nKevin Schuch e.K. , Inhaber Kevin Schuch – Tann (Rhön)",
      "type": "Registerbekanntmachung nach dem Umwandlungsgesetz",
      "state": "Hessen",
      "amtsgericht": "Amtsgericht Fulda",
      "registernummer": "HRA 6625",
      "registerart": "HRA",
      "company_name": "Kevin Schuch e.K. , Inhaber Kevin Schuch",
      "company_seat": "Tann (Rhön)",
      "details": "09.10.2024 (Bekanntmachungsdatum)\n\nHessen Amtsgericht Fulda HRA 6625\nRegisterbekanntmachung nach dem Umwandlungsgesetz 09.10.2024 (Eintragungsdatum)\n\nKevin Schuch e.K. , Inhaber Kevin Schuch\nEinzelkaufmann / Einzelkauffrau\nTann (Rhön)\n\nDen Gläubigern der an der Ausgliederung beteiligten Rechtsträger ist, wenn sie binnen sechs Monaten nach dem Tag, an dem die Eintragung der Ausgliederung in das Register des Sitzes desjenigen Rechtsträgers, dessen Gläubiger sie sind, nach §§ 125, 19 Absatz 3 UmwG bekannt gemacht worden ist, ihren Anspruch nach Grund und Höhe schriftlich anmelden, Sicherheit zu leisten, soweit sie nicht Befriedigung verlangen können. Dieses Recht steht den Gläubigern jedoch nur zu, wenn sie glaubhaft machen, dass durch die Ausgliederung die Erfüllung ihrer Forderung gefährdet wird."
    },
    {
      "date": "2024-10-09",
      "original_text": "Registerbekanntmachung nach dem Umwandlungsgesetz\nBayern Amtsgericht Nürnberg HRB 42718\nKilian 3 GmbH – Nürnberg",
      "type": "Registerbekanntmachung nach dem Umwandlungsgesetz",
      "state": "Bayern",
      "amtsgericht": "Amtsgericht Nürnberg",
      "registernummer": "HRB 42718",
      "registerart": "HRB",
      "company_name": "Kilian 3 GmbH",
      "company_seat": "Nürnberg",
      "details": "09.10.2024 (Bekanntmachungsdatum)\n\nBayern Amtsgericht Nürnberg HRB 42718\nRegisterbekanntmachung nach dem Umwandlungsgesetz 08.10.2024 (Eintragungsdatum)\n\nKilian 3 GmbH\nGesellschaft mit beschränkter Haftung\nNürnberg\n\nDen Gläubigern des formwechselnden Rechtsträgers ist, wenn sie binnen sechs Monaten nach dem Tag, an dem die Eintragung des Formwechsels nach § 201 UmwG als bekannt gemacht gilt, ihren Anspruch nach Grund und Höhe schriftlich anmelden, Sicherheit zu leisten, soweit sie nicht Befriedigung verlangen können. Dieses Recht steht den Gläubigern jedoch nur zu, wenn sie glaubhaft machen, dass durch den Formwechsel die Erfüllung ihrer Forderung gefährdet wird."
    },
    {
      "date": "2024-10-09",
      "original_text": "Registerbekanntmachung nach dem Umwandlungsgesetz\nNordrhein-Westfalen Amtsgericht Iserlohn HRA 5475\nKlaus Frerichmann Vermietungs GmbH & Co. KG – Iserlohn",
      "type": "Registerbekanntmachung nach dem Umwandlungsgesetz",
      "state": "Nordrhein-Westfalen",
      "amtsgericht": "Amtsgericht Iserlohn",
      "registernummer": "HRA 5475",
      "registerart": "HRA",
      "company_name": "Klaus Frerichmann Vermietungs GmbH & Co. KG",
      "company_seat": "Iserlohn",
      "details": "09.10.2024 (Bekanntmachungsdatum)\n\nNordrhein-Westfalen Amtsgericht Iserlohn HRA 5475\nRegisterbekanntmachung nach dem Umwandlungsgesetz 09.10.2024 (Eintragungsdatum)\n\nKlaus Frerichmann Vermietungs GmbH & Co. KG\nKommanditgesellschaft\nIserlohn\n\nDen Gläubigern der an der Verschmelzung beteiligten Rechtsträger ist, wenn sie binnen sechs Monaten nach dem Tag, an dem die Eintragung der Verschmelzung in das Register des Sitzes desjenigen Rechtsträgers, dessen Gläubiger sie sind, nach § 19 Absatz 3 UmwG als bekanntgemacht gilt, ihren Anspruch nach Grund und Höhe schriftlich anmelden, Sicherheit zu leisten, soweit sie nicht Befriedigung verlangen können. Dieses Recht steht den Gläubigern jedoch nur zu, wenn sie glaubhaft machen, dass durch die Verschmelzung die Erfüllung ihrer Forderung gefährdet wird."
    },
    {
      "date": "2024-10-09",
      "original_text": "Registerbekanntmachung nach dem Umwandlungsgesetz\nBayern Amtsgericht München HRB 215239\nLMnext DE GmbH – München",
      "type": "Registerbekanntmachung nach dem Umwandlungsgesetz",
      "state": "Bayern",
      "amtsgericht": "Amtsgericht München",
      "registernummer": "HRB 215239",
      "registerart": "HRB",
      "company_name": "LMnext DE GmbH",
      "company_seat": "München",
      "details": "09.10.2024 (Bekanntmachungsdatum)\n\nBayern Amtsgericht München HRB 215239\nRegisterbekanntmachung nach dem Umwandlungsgesetz 08.10.2024 (Eintragungsdatum)\n\nLMnext DE GmbH\nGesellschaft mit beschränkter Haftung\nMünchen\n\nDen Gläubigern der an der Verschmelzung beteiligten Rechtsträger ist, wenn sie binnen sechs Monaten nach dem Tag, an dem die Eintragung der Verschmelzung in das Register des Sitzes desjenigen Rechtsträgers, dessen Gläubiger sie sind, nach § 19 Abs. 3 UmwG als bekannt gemacht gilt, ihren Anspruch nach Grund und Höhe schriftlich anmelden, Sicherheit zu leisten, soweit sie nicht Befriedigung verlangen können. Dieses Recht steht den Gläubigern jedoch nur zu, wenn sie glaubhaft machen, dass durch die Verschmelzung die Erfüllung ihrer Forderung gefährdet wird."
    },
    {
      "date": "2024-10-09",
      "original_text": "Registerbekanntmachung nach dem Umwandlungsgesetz\nNiedersachsen Amtsgericht Walsrode HRB 51\nLSH Vermittlungs-GmbH – Bad Fallingbostel",
      "type": "Registerbekanntmachung nach dem Umwandlungsgesetz",
      "state": "Niedersachsen",
      "amtsgericht": "Amtsgericht Walsrode",
      "registernummer": "HRB 51",
      "registerart": "HRB",
      "company_name": "LSH Vermittlungs-GmbH",
      "company_seat": "Bad Fallingbostel",
      "details": "09.10.2024 (Bekanntmachungsdatum)\n\nNiedersachsen Amtsgericht Walsrode HRB 51\nRegisterbekanntmachung nach dem Umwandlungsgesetz 09.10.2024 (Eintragungsdatum)\n\nLSH Vermittlungs-GmbH\nGesellschaft mit beschränkter Haftung\nBad Fallingbostel\n\nDen Gläubigern der an der Abspaltung beteiligten Rechtsträger ist, wenn sie binnen sechs Monaten nach dem Tag, an dem die Eintragung der Abspaltung in das Register des Sitzes desjenigen Rechtsträgers, dessen Gläubiger sie sind, nach § 19 Abs. 3 UmwG als bekannt gemacht gilt, ihren Anspruch nach Grund und Höhe schriftlich anmelden, Sicherheit zu leisten, soweit sie nicht Befriedigung verlangen können. Dieses Recht steht den Gläubigern jedoch nur zu, wenn sie glaubhaft machen, dass durch die Abspaltung die Erfüllung der Forderung gefährdet wird."
    },
    {
      "date": "2024-10-09",
      "original_text": "Registerbekanntmachung nach dem Umwandlungsgesetz\nBremen Amtsgericht Bremen HRB 40767\nLiftkontor lmmobilien GmbH – Bremen",
      "type": "Registerbekanntmachung nach dem Umwandlungsgesetz",
      "state": "Bremen",
      "amtsgericht": "Amtsgericht Bremen",
      "registernummer": "HRB 40767",
      "registerart": "HRB",
      "company_name": "Liftkontor lmmobilien GmbH",
      "company_seat": "Bremen",
      "details": "09.10.2024 (Bekanntmachungsdatum)\n\nBremen Amtsgericht Bremen HRB 40767\nRegisterbekanntmachung nach dem Umwandlungsgesetz 08.10.2024 (Eintragungsdatum)\n\nLiftkontor lmmobilien GmbH\nGesellschaft mit beschränkter Haftung\nBremen\n\nZu Eintragungsnummer 1 vom 08.10.2024 wird als nicht eingetragen veröffentlicht: Den Gläubigern ist, wenn sie binnen sechs Monaten nach dem Tag, an dem die Eintragung der Umwandlung als bekannt gemacht gilt, ihren Anspruch nach Grund und Höhe schriftlich anmelden, Sicherheit zu leisten, soweit sie nicht Befriedigung verlangen können. Dieses Recht steht den Gläubigern jedoch nur zu, wenn sie glaubhaft machen, dass durch die Umwandlung die Erfüllung ihrer Forderung gefährdet wird. Das Recht, Sicherheitsleistung zu verlangen, steht Gläubigern nicht zu, die im Falle der Insolvenz ein Recht auf vorzugsweise Befriedigung aus einer Deckungsmasse haben, die nach gesetzlicher Vorschrift zu ihrem Schutz errichtet und staatlich überwacht ist."
    },
    {
      "date": "2024-10-09",
      "original_text": "Registerbekanntmachung nach dem Umwandlungsgesetz\nBremen Amtsgericht Bremen HRA 29435\nLuneWerk Projekt GmbH & Co. KG – Bremen",
      "type": "Registerbekanntmachung nach dem Umwandlungsgesetz",
      "state": "Bremen",
      "amtsgericht": "Amtsgericht Bremen",
      "registernummer": "HRA 29435",
      "registerart": "HRA",
      "company_name": "LuneWerk Projekt GmbH & Co. KG",
      "company_seat": "Bremen",
      "details": "09.10.2024 (Bekanntmachungsdatum)\n\nBremen Amtsgericht Bremen HRA 29435\nRegisterbekanntmachung nach dem Umwandlungsgesetz 08.10.2024 (Eintragungsdatum)\n\nLuneWerk Projekt GmbH & Co. KG\nKommanditgesellschaft\nBremen\n\nZu Eintragungsnummer 4 vom 08.10.2024 wird als nicht eingetragen veröffentlicht: Den Gläubigern ist, wenn sie binnen sechs Monaten nach dem Tag, an dem die Eintragung der Umwandlung als bekannt gemacht gilt, ihren Anspruch nach Grund und Höhe schriftlich anmelden, Sicherheit zu leisten, soweit sie nicht Befriedigung verlangen können. Dieses Recht steht den Gläubigern jedoch nur zu, wenn sie glaubhaft machen, dass durch die Umwandlung die Erfüllung ihrer Forderung gefährdet wird. Das Recht, Sicherheitsleistung zu verlangen, steht Gläubigern nicht zu, die im Falle der Insolvenz ein Recht auf vorzugsweise Befriedigung aus einer Deckungsmasse haben, die nach gesetzlicher Vorschrift zu ihrem Schutz errichtet und staatlich überwacht ist."
    },
    {
      "date": "2024-10-09",
      "original_text": "Registerbekanntmachung nach dem Umwandlungsgesetz\nBayern Amtsgericht München HRB 175829\nM.a.n.z. GmbH – München",
      "type": "Registerbekanntmachung nach dem Umwandlungsgesetz",
      "state": "Bayern",
      "amtsgericht": "Amtsgericht München",
      "registernummer": "HRB 175829",
      "registerart": "HRB",
      "company_name": "M.a.n.z. GmbH",
      "company_seat": "München",
      "details": "09.10.2024 (Bekanntmachungsdatum)\n\nBayern Amtsgericht München HRB 175829\nRegisterbekanntmachung nach dem Umwandlungsgesetz 08.10.2024 (Eintragungsdatum)\n\nM.a.n.z. GmbH\nGesellschaft mit beschränkter Haftung\nMünchen\n\nDen Gläubigern der an der Verschmelzung beteiligten Rechtsträger ist, wenn sie binnen sechs Monaten nach dem Tag, an dem die Eintragung der Verschmelzung in das Register des Sitzes desjenigen Rechtsträgers, dessen Gläubiger sie sind, nach § 19 Abs. 3 UmwG als bekannt gemacht gilt, ihren Anspruch nach Grund und Höhe schriftlich anmelden, Sicherheit zu leisten, soweit sie nicht Befriedigung verlangen können. Dieses Recht steht den Gläubigern jedoch nur zu, wenn sie glaubhaft machen, dass durch die Verschmelzung die Erfüllung ihrer Forderung gefährdet wird."
    },
    {
      "date": "2024-10-09",
      "original_text": "Löschungsankündigung\nRheinland-Pfalz Amtsgericht Mainz HRB 49310\nMC Dienstleistungen UG (haftungsbeschränkt) – Ingelheim",
      "type": "Löschungsankündigung",
      "state": "Rheinland-Pfalz",
      "amtsgericht": "Amtsgericht Mainz",
      "registernummer": "HRB 49310",
      "registerart": "HRB",
      "company_name": "MC Dienstleistungen UG (haftungsbeschränkt)",
      "company_seat": "Ingelheim",
      "details": "09.10.2024 (Bekanntmachungsdatum)\n\nRheinland-Pfalz Amtsgericht Mainz HRB 49310\nLöschungsankündigung\n\nMC Dienstleistungen UG (haftungsbeschränkt)\nGesellschaft mit beschränkter Haftung\nIngelheim\n\nDas Registergericht beabsichtigt die Gesellschaft von Amts wegen nach § 394 FamFG zu löschen. Die Frist zur Erhebung eines Widerspruchs ist auf einen Monat festgesetzt."
    },
    {
      "date": "2024-10-09",
      "original_text": "Registerbekanntmachung nach dem Umwandlungsgesetz\nBaden-Württemberg Amtsgericht Stuttgart HRB 401278\nMCT International Holding GmbH – Albstadt",
      "type": "Registerbekanntmachung nach dem Umwandlungsgesetz",
      "state": "Baden-Württemberg",
      "amtsgericht": "Amtsgericht Stuttgart",
      "registernummer": "HRB 401278",
      "registerart": "HRB",
      "company_name": "MCT International Holding GmbH",
      "company_seat": "Albstadt",
      "details": "09.10.2024 (Bekanntmachungsdatum)\n\nBaden-Württemberg Amtsgericht Stuttgart HRB 401278\nRegisterbekanntmachung nach dem Umwandlungsgesetz 09.10.2024 (Eintragungsdatum)\n\nMCT International Holding GmbH\nGesellschaft mit beschränkter Haftung\nAlbstadt\n\nAls nicht eingetragen wird bekanntgemacht:\nDen Gläubigern der an der Verschmelzung beteiligten Rechtsträger ist, wenn sie binnen sechs Monaten nach dem Tag, an dem die Eintragung der Verschmelzung in das Register des Sitzes desjenigen Rechtsträgers, dessen Gläubiger sie sind, nach § 19 Abs. 3 UmwG als bekanntgemacht gilt, ihren Anspruch nach Grund und Höhe schriftlich anmelden, Sicherheit zu leisten, soweit sie nicht Befriedigung verlangen können. Dieses Recht steht den Gläubigern jedoch nur zu, wenn sie glaubhaft machen, dass durch die Verschmelzung die Erfüllung ihrer Forderung gefährdet wird."
    },
    {
      "date": "2024-10-09",
      "original_text": "Registerbekanntmachung nach dem Umwandlungsgesetz\nHessen Amtsgericht Darmstadt HRB 90337\nMGroup-Engineering GmbH – Raunheim",
      "type": "Registerbekanntmachung nach dem Umwandlungsgesetz",
      "state": "Hessen",
      "amtsgericht": "Amtsgericht Darmstadt",
      "registernummer": "HRB 90337",
      "registerart": "HRB",
      "company_name": "MGroup-Engineering GmbH",
      "company_seat": "Raunheim",
      "details": "09.10.2024 (Bekanntmachungsdatum)\n\nHessen Amtsgericht Darmstadt HRB 90337\nRegisterbekanntmachung nach dem Umwandlungsgesetz 09.10.2024 (Eintragungsdatum)\n\nMGroup-Engineering GmbH\nGesellschaft mit beschränkter Haftung\nRaunheim\n\nDen Gläubigern der an der Verschmelzung beteiligten Rechtsträger ist, wenn sie binnen sechs Monaten nach dem Tag, an dem die Eintragung der Verschmelzung in das Register des Sitzes derjenigen Rechtsträger deren Gläubiger sie sind, nach § 19 Absatz 3 UmwG bekannt gemacht worden ist, ihren Anspruch nach Grund und Höhe schriftlich anmelden, Sicherheit zu leisten, soweit sie nicht Befriedigung verlangen können. Dieses Recht steht den Gläubigern jedoch nur zu, wenn sie glaubhaft machen, dass durch die Verschmelzung die Erfüllung ihrer Forderung gefährdet wird."
    },
    {
      "date": "2024-10-09",
      "original_text": "Löschungsankündigung\nBayern Amtsgericht Kempten (Allgäu) HRB 12685\nMM Montagebau GmbH – Weitnau-Seltmans",
      "type": "Löschungsankündigung",
      "state": "Bayern",
      "amtsgericht": "Amtsgericht Kempten (Allgäu)",
      "registernummer": "HRB 12685",
      "registerart": "HRB",
      "company_name": "MM Montagebau GmbH",
      "company_seat": "Weitnau-Seltmans",
      "details": "09.10.2024 (Bekanntmachungsdatum)\n\nBayern Amtsgericht Kempten (Allgäu) HRB 12685\nLöschungsankündigung\n\nMM Montagebau GmbH\nGesellschaft mit beschränkter Haftung\nWeitnau-Seltmans\n\nDas Registergericht beabsichtigt, die im Handelsregister eingetragene Gesellschaft wegen Vermögenslosigkeit von Amts wegen nach § 394 FamFG zu löschen. Die Frist zur Erhebung eines Widerspruchs ist auf einen Monat festgesetzt."
    },
    {
      "date": "2024-10-09",
      "original_text": "Registerbekanntmachung nach dem Umwandlungsgesetz\nNordrhein-Westfalen Amtsgericht Köln HRB 76840\nMMC Movies Köln GmbH – Köln",
      "type": "Registerbekanntmachung nach dem Umwandlungsgesetz",
      "state": "Nordrhein-Westfalen",
      "amtsgericht": "Amtsgericht Köln",
      "registernummer": "HRB 76840",
      "registerart": "HRB",
      "company_name": "MMC Movies Köln GmbH",
      "company_seat": "Köln",
      "details": "09.10.2024 (Bekanntmachungsdatum)\n\nNordrhein-Westfalen Amtsgericht Köln HRB 76840\nRegisterbekanntmachung nach dem Umwandlungsgesetz 09.10.2024 (Eintragungsdatum)\n\nMMC Movies Köln GmbH\nGesellschaft mit beschränkter Haftung\nKöln\n\nDen Gläubigern der an der Verschmelzung beteiligten Rechtsträger ist, wenn sie binnen sechs Monaten nach dem Tag, an dem die Eintragung der Verschmelzung in das Register des Sitzes desjenigen Rechtsträgers, dessen Gläubiger sie sind, nach § 19 Absatz 3 UmwG als bekanntgemacht gilt, ihren Anspruch nach Grund und Höhe schriftlich anmelden, Sicherheit zu leisten, soweit sie nicht Befriedigung verlangen können. Dieses Recht steht den Gläubigern jedoch nur zu, wenn sie glaubhaft machen, dass durch die Verschmelzung die Erfüllung ihrer Forderung gefährdet wird."
    },
    {
      "date": "2024-10-09",
      "original_text": "Registerbekanntmachung nach dem Umwandlungsgesetz\nNordrhein-Westfalen Amtsgericht Köln HRB 114537\nMMC Movies Production GmbH – Köln",
      "type": "Registerbekanntmachung nach dem Umwandlungsgesetz",
      "state": "Nordrhein-Westfalen",
      "amtsgericht": "Amtsgericht Köln",
      "registernummer": "HRB 114537",
      "registerart": "HRB",
      "company_name": "MMC Movies Production GmbH",
      "company_seat": "Köln",
      "details": "09.10.2024 (Bekanntmachungsdatum)\n\nNordrhein-Westfalen Amtsgericht Köln HRB 114537\nRegisterbekanntmachung nach dem Umwandlungsgesetz 09.10.2024 (Eintragungsdatum)\n\nMMC Movies Production GmbH\nGesellschaft mit beschränkter Haftung\nKöln\n\nDen Gläubigern der an der Verschmelzung beteiligten Rechtsträger ist, wenn sie binnen sechs Monaten nach dem Tag, an dem die Eintragung der Verschmelzung in das Register des Sitzes desjenigen Rechtsträgers, dessen Gläubiger sie sind, nach § 19 Absatz 3 UmwG als bekanntgemacht gilt, ihren Anspruch nach Grund und Höhe schriftlich anmelden, Sicherheit zu leisten, soweit sie nicht Befriedigung verlangen können. Dieses Recht steht den Gläubigern jedoch nur zu, wenn sie glaubhaft machen, dass durch die Verschmelzung die Erfüllung ihrer Forderung gefährdet wird."
    },
    {
      "date": "2024-10-09",
      "original_text": "Löschungsankündigung\nSachsen Amtsgericht Dresden HRB 42558\nMPS Bau UG (haftungsbeschränkt) – Dresden",
      "type": "Löschungsankündigung",
      "state": "Sachsen",
      "amtsgericht": "Amtsgericht Dresden",
      "registernummer": "HRB 42558",
      "registerart": "HRB",
      "company_name": "MPS Bau UG (haftungsbeschränkt)",
      "company_seat": "Dresden",
      "details": "09.10.2024 (Bekanntmachungsdatum)\n\nSachsen Amtsgericht Dresden HRB 42558\nLöschungsankündigung\n\nMPS Bau UG (haftungsbeschränkt)\nGesellschaft mit beschränkter Haftung\nDresden\n\nDas Registergericht beabsichtigt, die im Handelsregister eingetragene Gesellschaft von Amts wegen nach § 394 FamFG zu löschen. Die Frist zu Erhebung eines Widerspruchs gegen die beabsichtigte Löschung wird auf einen Monat festgesetzt."
    },
    {
      "date": "2024-10-09",
      "original_text": "Löschungsankündigung\nBayern Amtsgericht Coburg HRB 5149\nMacroSystem Digital Video GmbH – Kronach",
      "type": "Löschungsankündigung",
      "state": "Bayern",
      "amtsgericht": "Amtsgericht Coburg",
      "registernummer": "HRB 5149",
      "registerart": "HRB",
      "company_name": "MacroSystem Digital Video GmbH",
      "company_seat": "Kronach",
      "details": "09.10.2024 (Bekanntmachungsdatum)\n\nBayern Amtsgericht Coburg HRB 5149\nLöschungsankündigung\n\nMacroSystem Digital Video GmbH\nGesellschaft mit beschränkter Haftung\nKronach\n\nDas Registergericht beabsichtigt, die im Handelsregister eingetragene Gesellschaft wegen Vermögenslosigkeit von Amts wegen nach § 394 FamFG zu löschen. Die Frist zur Erhebung eines Widerspruchs ist auf sechs Wochen festgesetzt."
    },
    {
      "date": "2024-10-09",
      "original_text": "Registerbekanntmachung nach dem Umwandlungsgesetz\nSchleswig-Holstein Amtsgericht Kiel HRA 12192\nMarcus Bönning Forstbetrieb e.K. – Tangstedt",
      "type": "Registerbekanntmachung nach dem Umwandlungsgesetz",
      "state": "Schleswig-Holstein",
      "amtsgericht": "Amtsgericht Kiel",
      "registernummer": "HRA 12192",
      "registerart": "HRA",
      "company_name": "Marcus Bönning Forstbetrieb e.K.",
      "company_seat": "Tangstedt",
      "details": "09.10.2024 (Bekanntmachungsdatum)\n\nSchleswig-Holstein Amtsgericht Kiel HRA 12192\nRegisterbekanntmachung nach dem Umwandlungsgesetz 08.10.2024 (Eintragungsdatum)\n\nMarcus Bönning Forstbetrieb e.K.\nEinzelkaufmann / Einzelkauffrau\nTangstedt\n\nZu Eintragungsnummer 2 vom 08.10.2024 wird als nicht eingetragen veröffentlicht:  Als nicht eingetragen wird veröffentlicht: Den Gläubigern der an der Spaltung beteiligten Rechtsträger ist, wenn sie binnen sechs Monaten nach dem Tag, an dem die Eintragung der Spaltung in das Register des Sitzes desjenigen Rechtsträgers, dessen Gläubiger sie sind,  bekannt gemacht worden ist, ihren Anspruch nach Grund und Höhe schriftlich anmelden, Sicherheit zu leisten, soweit sie nicht Befriedigung verlangen können. Dieses Recht steht den Gläubigern jedoch nur zu, wenn sie glaubhaft machen, dass durch die Spaltung die Erfüllung ihrer Forderung gefährdet wird."
    },
    {
      "date": "2024-10-09",
      "original_text": "Registerbekanntmachung nach dem Umwandlungsgesetz\nBerlin Amtsgericht Berlin (Charlottenburg) HRB 265087\nMarius & Alexander GmbH – Berlin",
      "type": "Registerbekanntmachung nach dem Umwandlungsgesetz",
      "state": "Berlin",
      "amtsgericht": "Amtsgericht Berlin (Charlottenburg)",
      "registernummer": "HRB 265087",
      "registerart": "HRB",
      "company_name": "Marius & Alexander GmbH",
      "company_seat": "Berlin",
      "details": "09.10.2024 (Bekanntmachungsdatum)\n\nBerlin Amtsgericht Berlin (Charlottenburg) HRB 265087\nRegisterbekanntmachung nach dem Umwandlungsgesetz 08.10.2024 (Eintragungsdatum)\n\nMarius & Alexander GmbH\nGesellschaft mit beschränkter Haftung\nBerlin\n\nZu Eintragungsnummer 2 vom 08.10.2024 wird als nicht eingetragen veröffentlicht: Den Gläubigern der an der Spaltung beteiligten Rechtsträger ist, wenn sie binnen sechs Monaten nach dem Tag, an dem die Eintragung der Spaltung in das Register des Sitzes desjenigen Rechtsträgers, dessen Gläubiger sie sind, als bekannt gemacht gilt, ihren Anspruch nach Grund und Höhe schriftlich anmelden, Sicherheit zu leisten, soweit sie nicht Befriedigung verlangen können. Dieses Recht steht den Gläubigern jedoch nur zu, wenn sie glaubhaft machen, dass durch die Spaltung die Erfüllung ihrer Forderung gefährdet wird. Das Recht, Sicherheitsleistung zu verlangen, steht Gläubigern nicht zu, die im Falle der Insolvenz ein Recht auf vorzugsweise Befriedigung aus einer Deckungsmasse haben, die nach gesetzlicher Vorschrift zu ihrem Schutz errichtet und staatlich überwacht ist."
    },
    {
      "date": "2024-10-09",
      "original_text": "Registerbekanntmachung nach dem Umwandlungsgesetz\nBayern Amtsgericht Augsburg HRA 20132\nMartin Failer Schmuckmanufaktur und Café e. K. – Tapfheim",
      "type": "Registerbekanntmachung nach dem Umwandlungsgesetz",
      "state": "Bayern",
      "amtsgericht": "Amtsgericht Augsburg",
      "registernummer": "HRA 20132",
      "registerart": "HRA",
      "company_name": "Martin Failer Schmuckmanufaktur und Café e. K.",
      "company_seat": "Tapfheim",
      "details": "09.10.2024 (Bekanntmachungsdatum)\n\nBayern Amtsgericht Augsburg HRA 20132\nRegisterbekanntmachung nach dem Umwandlungsgesetz 08.10.2024 (Eintragungsdatum)\n\nMartin Failer Schmuckmanufaktur und Café e. K.\nEinzelkaufmann / Einzelkauffrau\nTapfheim\n\nDen Gläubigern der an der Ausgliederung beteiligten Rechtsträger ist, wenn sie binnen sechs Monaten nach dem Tag, an dem die Eintragung der Ausgliederung in das Register des Sitzes desjenigen Rechtsträgers, dessen Gläubiger sie sind, nach §§ 125, 19 Abs. 3 UmwG als bekannt gemacht gilt, ihren Anspruch nach Grund und Höhe schriftlich anmelden, Sicherheit zu leisten, soweit sie nicht Befriedigung verlangen können. Dieses Recht steht den Gläubigern jedoch nur zu, wenn sie glaubhaft machen, dass durch die Ausgliederung die Erfüllung ihrer Forderung gefährdet wird."
    },
    {
      "date": "2024-10-09",
      "original_text": "Löschungsankündigung\nHessen Amtsgericht Wiesbaden HRB 30388\nMaseko Germany GmbH – Hochheim am Main",
      "type": "Löschungsankündigung",
      "state": "Hessen",
      "amtsgericht": "Amtsgericht Wiesbaden",
      "registernummer": "HRB 30388",
      "registerart": "HRB",
      "company_name": "Maseko Germany GmbH",
      "company_seat": "Hochheim am Main",
      "details": "09.10.2024 (Bekanntmachungsdatum)\n\nHessen Amtsgericht Wiesbaden HRB 30388\nLöschungsankündigung\n\nMaseko Germany GmbH\nGesellschaft mit beschränkter Haftung\nHochheim am Main\n\nDas Registergericht beabsichtigt die im Handelsregister eingetragene Gesellschaft von Amts wegen nach § 394 FamFG zu löschen. Die Frist zur Erhebung eines Widerspruchs gegen die beabsichtigte Löschung wird auf 3 Monate festgesetzt."
    },
    {
      "date": "2024-10-09",
      "original_text": "Registerbekanntmachung nach dem Umwandlungsgesetz\nBaden-Württemberg Amtsgericht Stuttgart HRB 723227\nMax Häfele GmbH – Winnenden",
      "type": "Registerbekanntmachung nach dem Umwandlungsgesetz",
      "state": "Baden-Württemberg",
      "amtsgericht": "Amtsgericht Stuttgart",
      "registernummer": "HRB 723227",
      "registerart": "HRB",
      "company_name": "Max Häfele GmbH",
      "company_seat": "Winnenden",
      "details": "09.10.2024 (Bekanntmachungsdatum)\n\nBaden-Württemberg Amtsgericht Stuttgart HRB 723227\nRegisterbekanntmachung nach dem Umwandlungsgesetz 09.10.2024 (Eintragungsdatum)\n\nMax Häfele GmbH\nGesellschaft mit beschränkter Haftung\nWinnenden\n\nDen Gläubigern der an der Verschmelzung beteiligten Rechtsträger ist, wenn sie binnen sechs Monaten nach dem Tag, an dem die Eintragung der Verschmelzung in das Register des Sitzes desjenigen Rechtsträgers, dessen Gläubiger sie sind, nach § 19 Abs. 3 UmwG als bekanntgemacht gilt, ihren Anspruch nach Grund und Höhe schriftlich anmelden, Sicherheit zu leisten, soweit sie nicht Befriedigung verlangen können. Dieses Recht steht den Gläubigern jedoch nur zu, wenn sie glaubhaft machen, dass durch die Verschmelzung die Erfüllung ihrer Forderung gefährdet wird."
    },
    {
      "date": "2024-10-09",
      "original_text": "Registerbekanntmachung nach dem Umwandlungsgesetz\nRheinland-Pfalz Amtsgericht Ludwigshafen a.Rhein (Ludwigshafen) HRA 62330\nMaximilian Schuster e.K. – Wachenheim",
      "type": "Registerbekanntmachung nach dem Umwandlungsgesetz",
      "state": "Rheinland-Pfalz",
      "amtsgericht": "Amtsgericht Ludwigshafen a.Rhein (Ludwigshafen)",
      "registernummer": "HRA 62330",
      "registerart": "HRA",
      "company_name": "Maximilian Schuster e.K.",
      "company_seat": "Wachenheim",
      "details": "09.10.2024 (Bekanntmachungsdatum)\n\nRheinland-Pfalz Amtsgericht Ludwigshafen a.Rhein (Ludwigshafen) HRA 62330\nRegisterbekanntmachung nach dem Umwandlungsgesetz 02.10.2024 (Eintragungsdatum)\n\nMaximilian Schuster e.K.\nEinzelkaufmann / Einzelkauffrau\nWachenheim\n\nAls nicht eingetragen wird veröffentlicht: Den Gläubigern der an der Ausgliederung beteiligten Rechtsträger ist, wenn sie binnen sechs Monaten nac hdem Tag, an dem die Eintragung der Ausgliederung in das Register des Sitzes desjenigen Rechtsträgers,dessen Gläubiger sie sind, nach § 19 Abs. 3 UmwG als bekannt gemacht gilt, ihren Anspruch nach Grund und Höhe schriftlich anmelden, Sicherheit zu leisten, soweit sie nicht Befriedigung verlangen können. Dieses Recht steht den Gläubigern jedoch nur zu, wenn sie glaubhaft machen, dass durch die Ausgliederung die Erfüllung der Forderung gefährdet wird."
    },
    {
      "date": "2024-10-09",
      "original_text": "Einreichung neuer Dokumente\nNordrhein-Westfalen Amtsgericht Bad Oeynhausen HRB 9171\nMerkur.com AG – Espelkamp",
      "type": "Einreichung neuer Dokumente",
      "state": "Nordrhein-Westfalen",
      "amtsgericht": "Amtsgericht Bad Oeynhausen",
      "registernummer": "HRB 9171",
      "registerart": "HRB",
      "company_name": "Merkur.com AG",
      "company_seat": "Espelkamp",
      "details": "09.10.2024 (Bekanntmachungsdatum)\n\nNordrhein-Westfalen Amtsgericht Bad Oeynhausen HRB 9171\nEinreichung neuer Dokumente 09.10.2024 (Eintragungsdatum)\n\nMerkur.com AG\nAktiengesellschaft\nEspelkamp\n\nDem Registergericht ist eine neue Liste der Mitglieder des Aufsichtsrates eingereicht worden."
    },
    {
      "date": "2024-10-09",
      "original_text": "Registerbekanntmachung nach dem Umwandlungsgesetz\nBayern Amtsgericht Nürnberg HRB 14943\nMetaldyne Nürnberg GmbH – Nürnberg",
      "type": "Registerbekanntmachung nach dem Umwandlungsgesetz",
      "state": "Bayern",
      "amtsgericht": "Amtsgericht Nürnberg",
      "registernummer": "HRB 14943",
      "registerart": "HRB",
      "company_name": "Metaldyne Nürnberg GmbH",
      "company_seat": "Nürnberg",
      "details": "09.10.2024 (Bekanntmachungsdatum)\n\nBayern Amtsgericht Nürnberg HRB 14943\nRegisterbekanntmachung nach dem Umwandlungsgesetz 08.10.2024 (Eintragungsdatum)\n\nMetaldyne Nürnberg GmbH\nGesellschaft mit beschränkter Haftung\nNürnberg\n\nDen Gläubigern der an der Verschmelzung beteiligten Rechtsträger ist, wenn sie binnen sechs Monaten nach dem Tag, an dem die Eintragung der Verschmelzung in das Register des Sitzes desjenigen Rechtsträgers, dessen Gläubiger sie sind, nach § 19 Abs. 3 UmwG als bekannt gemacht gilt, ihren Anspruch nach Grund und Höhe schriftlich anmelden, Sicherheit zu leisten, soweit sie nicht Befriedigung verlangen können. Dieses Recht steht den Gläubigern jedoch nur zu, wenn sie glaubhaft machen, dass durch die Verschmelzung die Erfüllung ihrer Forderung gefährdet wird."
    },
    {
      "date": "2024-10-09",
      "original_text": "Registerbekanntmachung nach dem Umwandlungsgesetz\nBaden-Württemberg Amtsgericht Mannheim HRB 743949\nMountX Concept GmbH – Karlsruhe",
      "type": "Registerbekanntmachung nach dem Umwandlungsgesetz",
      "state": "Baden-Württemberg",
      "amtsgericht": "Amtsgericht Mannheim",
      "registernummer": "HRB 743949",
      "registerart": "HRB",
      "company_name": "MountX Concept GmbH",
      "company_seat": "Karlsruhe",
      "details": "09.10.2024 (Bekanntmachungsdatum)\n\nBaden-Württemberg Amtsgericht Mannheim HRB 743949\nRegisterbekanntmachung nach dem Umwandlungsgesetz 09.10.2024 (Eintragungsdatum)\n\nMountX Concept GmbH\nGesellschaft mit beschränkter Haftung\nKarlsruhe\n\nAls nicht eingetragen wird bekanntgemacht:\nDen Gläubigern der an der Verschmelzung beteiligten Rechtsträger ist, wenn sie binnen sechs Monaten nach dem Tag, an dem die Eintragung der Verschmelzung in das Register des Sitzes desjenigen Rechtsträgers, dessen Gläubiger sie sind, nach § 19 Abs. 3 UmwG als bekanntgemacht gilt, ihren Anspruch nach Grund und Höhe schriftlich anmelden, Sicherheit zu leisten, soweit sie nicht Befriedigung verlangen können. Dieses Recht steht den Gläubigern jedoch nur zu, wenn sie glaubhaft machen, dass durch die Verschmelzung die Erfüllung ihrer Forderung gefährdet wird."
    },
    {
      "date": "2024-10-09",
      "original_text": "Löschungsankündigung\nBerlin Amtsgericht Berlin (Charlottenburg) HRB 159342\nMulticon Solar AG – Berlin",
      "type": "Löschungsankündigung",
      "state": "Berlin",
      "amtsgericht": "Amtsgericht Berlin (Charlottenburg)",
      "registernummer": "HRB 159342",
      "registerart": "HRB",
      "company_name": "Multicon Solar AG",
      "company_seat": "Berlin",
      "details": "09.10.2024 (Bekanntmachungsdatum)\n\nBerlin Amtsgericht Berlin (Charlottenburg) HRB 159342\nLöschungsankündigung\n\nMulticon Solar AG\nAktiengesellschaft\nBerlin\n\nBei der nachstehenden Gesellschaft wird das Amtslöschungsverfahren gemäß § 394 FamFG eingeleitet. Widerspruchsfrist 6 Wochen"
    },
    {
      "date": "2024-10-09",
      "original_text": "Registerbekanntmachung nach dem Umwandlungsgesetz\nBaden-Württemberg Amtsgericht Mannheim HRB 734608\nMönchhofstraße 35 UG (haftungsbeschränkt) – Heidelberg",
      "type": "Registerbekanntmachung nach dem Umwandlungsgesetz",
      "state": "Baden-Württemberg",
      "amtsgericht": "Amtsgericht Mannheim",
      "registernummer": "HRB 734608",
      "registerart": "HRB",
      "company_name": "Mönchhofstraße 35 UG (haftungsbeschränkt)",
      "company_seat": "Heidelberg",
      "details": "09.10.2024 (Bekanntmachungsdatum)\n\nBaden-Württemberg Amtsgericht Mannheim HRB 734608\nRegisterbekanntmachung nach dem Umwandlungsgesetz 09.10.2024 (Eintragungsdatum)\n\nMönchhofstraße 35 UG (haftungsbeschränkt)\nGesellschaft mit beschränkter Haftung\nHeidelberg\n\nDen Gläubigern der an der Verschmelzung beteiligten Rechtsträger ist, wenn sie binnen sechs Monaten nach dem Tag, an dem die Eintragung der Verschmelzung in das Register des Sitzes desjenigen Rechtsträgers, dessen Gläubiger sie sind, nach § 19 Abs. 3 UmwG als bekanntgemacht gilt, ihren Anspruch nach Grund und Höhe schriftlich anmelden, Sicherheit zu leisten, soweit sie nicht Befriedigung verlangen können. Dieses Recht steht den Gläubigern jedoch nur zu, wenn sie glaubhaft machen, dass durch die Verschmelzung die Erfüllung ihrer Forderung gefährdet wird."
    },
    {
      "date": "2024-10-09",
      "original_text": "Registerbekanntmachung nach dem Umwandlungsgesetz\nBaden-Württemberg Amtsgericht Mannheim HRB 734608\nMönchhofstraße 35 UG (haftungsbeschränkt) – Heidelberg",
      "type": "Registerbekanntmachung nach dem Umwandlungsgesetz",
      "state": "Baden-Württemberg",
      "amtsgericht": "Amtsgericht Mannheim",
      "registernummer": "HRB 734608",
      "registerart": "HRB",
      "company_name": "Mönchhofstraße 35 UG (haftungsbeschränkt)",
      "company_seat": "Heidelberg",
      "details": "09.10.2024 (Bekanntmachungsdatum)\n\nBaden-Württemberg Amtsgericht Mannheim HRB 734608\nRegisterbekanntmachung nach dem Umwandlungsgesetz 09.10.2024 (Eintragungsdatum)\n\nMönchhofstraße 35 UG (haftungsbeschränkt)\nGesellschaft mit beschränkter Haftung\nHeidelberg\n\nDen Gläubigern der an der Verschmelzung beteiligten Rechtsträger ist, wenn sie binnen sechs Monaten nach dem Tag, an dem die Eintragung der Verschmelzung in das Register des Sitzes desjenigen Rechtsträgers, dessen Gläubiger sie sind, nach § 19 Abs. 3 UmwG als bekanntgemacht gilt, ihren Anspruch nach Grund und Höhe schriftlich anmelden, Sicherheit zu leisten, soweit sie nicht Befriedigung verlangen können. Dieses Recht steht den Gläubigern jedoch nur zu, wenn sie glaubhaft machen, dass durch die Verschmelzung die Erfüllung ihrer Forderung gefährdet wird."
    },
    {
      "date": "2024-10-09",
      "original_text": "Registerbekanntmachung nach dem Umwandlungsgesetz\nNiedersachsen Amtsgericht Tostedt HRB 203838\nN D F Norddeutsche Flächenheizsysteme GmbH – Nottensdorf",
      "type": "Registerbekanntmachung nach dem Umwandlungsgesetz",
      "state": "Niedersachsen",
      "amtsgericht": "Amtsgericht Tostedt",
      "registernummer": "HRB 203838",
      "registerart": "HRB",
      "company_name": "N D F Norddeutsche Flächenheizsysteme GmbH",
      "company_seat": "Nottensdorf",
      "details": "09.10.2024 (Bekanntmachungsdatum)\n\nNiedersachsen Amtsgericht Tostedt HRB 203838\nRegisterbekanntmachung nach dem Umwandlungsgesetz 09.10.2024 (Eintragungsdatum)\n\nN D F Norddeutsche Flächenheizsysteme GmbH\nGesellschaft mit beschränkter Haftung\nNottensdorf\n\nDen Gläubigern der an der Verschmelzung beteiligten Rechtsträger ist, wenn sie binnen sechs Monaten nach dem Tag, an dem die Eintragung der Verschmelzung in das Register des Sitzes desjenigen Rechtsträgers, dessen Gläubiger sie sind, nach § 19  Abs.  3 UmwG als bekannt gemacht gilt, ihren Anspruch nach Grund und Höhe schriftlich anmelden, Sicherheit zu leisten, soweit sie nicht Befriedigung verlangen können. Dieses Recht steht den Gläubigern jedoch nur zu, wenn sie glaubhaft machen, dass durch die Verschmelzung die Erfüllung der Forderung gefährdet wird."
    },
    {
      "date": "2024-10-09",
      "original_text": "Registerbekanntmachung nach dem Umwandlungsgesetz\nBayern Amtsgericht München HRB 166986\nNCAB Group Germany GmbH – München",
      "type": "Registerbekanntmachung nach dem Umwandlungsgesetz",
      "state": "Bayern",
      "amtsgericht": "Amtsgericht München",
      "registernummer": "HRB 166986",
      "registerart": "HRB",
      "company_name": "NCAB Group Germany GmbH",
      "company_seat": "München",
      "details": "09.10.2024 (Bekanntmachungsdatum)\n\nBayern Amtsgericht München HRB 166986\nRegisterbekanntmachung nach dem Umwandlungsgesetz 08.10.2024 (Eintragungsdatum)\n\nNCAB Group Germany GmbH\nGesellschaft mit beschränkter Haftung\nMünchen\n\nDen Gläubigern der an der Verschmelzung beteiligten Rechtsträger ist, wenn sie binnen sechs Monaten nach dem Tag, an dem die Eintragung der Verschmelzung in das Register des Sitzes desjenigen Rechtsträgers, dessen Gläubiger sie sind, nach § 19 Abs. 3 UmwG als bekannt gemacht gilt, ihren Anspruch nach Grund und Höhe schriftlich anmelden, Sicherheit zu leisten, soweit sie nicht Befriedigung verlangen können. Dieses Recht steht den Gläubigern jedoch nur zu, wenn sie glaubhaft machen, dass durch die Verschmelzung die Erfüllung ihrer Forderung gefährdet wird."
    },
    {
      "date": "2024-10-09",
      "original_text": "Sonstige Registerbekanntmachung\nBayern Amtsgericht München HRB 234740\nNOVENTI Health SE – München",
      "type": "Sonstige Registerbekanntmachung",
      "state": "Bayern",
      "amtsgericht": "Amtsgericht München",
      "registernummer": "HRB 234740",
      "registerart": "HRB",
      "company_name": "NOVENTI Health SE",
      "company_seat": "München",
      "details": "09.10.2024 (Bekanntmachungsdatum)\n\nBayern Amtsgericht München HRB 234740\nSonstige Registerbekanntmachung 01.10.2024 (Eintragungsdatum)\n\nNOVENTI Health SE\nEuropäische Aktiengesellschaft (SE)\nMünchen\n\nDem Amtsgericht München -Registergericht- ist eine Liste der Mitglieder des Aufsichtsrats eingereicht worden, Art. 9 Abs. 1 Buchst. c (ii) SE-VO i.V.m. § 106 AktG."
    },
    {
      "date": "2024-10-09",
      "original_text": "Löschungsankündigung\nNordrhein-Westfalen Amtsgericht Essen HRB 27909\nNashwan Haarstudio GmbH – Essen",
      "type": "Löschungsankündigung",
      "state": "Nordrhein-Westfalen",
      "amtsgericht": "Amtsgericht Essen",
      "registernummer": "HRB 27909",
      "registerart": "HRB",
      "company_name": "Nashwan Haarstudio GmbH",
      "company_seat": "Essen",
      "details": "09.10.2024 (Bekanntmachungsdatum)\n\nNordrhein-Westfalen Amtsgericht Essen HRB 27909\nLöschungsankündigung\n\nNashwan Haarstudio GmbH\nGesellschaft mit beschränkter Haftung\nEssen\n\nDas Registergericht beabsichtigt die Gesellschaft von Amts wegen nach § 394 FamFG zu löschen. Die Frist zur Erhebung eines Widerspruchs ist auf einen Monat festgesetzt."
    },
    {
      "date": "2024-10-09",
      "original_text": "Sonstige Registerbekanntmachung\nHamburg Amtsgericht Hamburg HRB 72273\nNetBid Industrie-Auktionen AG – Hamburg",
      "type": "Sonstige Registerbekanntmachung",
      "state": "Hamburg",
      "amtsgericht": "Amtsgericht Hamburg",
      "registernummer": "HRB 72273",
      "registerart": "HRB",
      "company_name": "NetBid Industrie-Auktionen AG",
      "company_seat": "Hamburg",
      "details": "09.10.2024 (Bekanntmachungsdatum)\n\nHamburg Amtsgericht Hamburg HRB 72273\nSonstige Registerbekanntmachung 09.10.2024 (Eintragungsdatum)\n\nNetBid Industrie-Auktionen AG\nAktiengesellschaft\nHamburg\n\nAls nicht eingetragen wird bekannt gemacht: Liste des Aufsichtsrats wurde eingereicht."
    },
    {
      "date": "2024-10-09",
      "original_text": "Registerbekanntmachung nach dem Umwandlungsgesetz\nNiedersachsen Amtsgericht Tostedt HRA 205378\nNitaCare Melzer & Köhler oHG – Stade",
      "type": "Registerbekanntmachung nach dem Umwandlungsgesetz",
      "state": "Niedersachsen",
      "amtsgericht": "Amtsgericht Tostedt",
      "registernummer": "HRA 205378",
      "registerart": "HRA",
      "company_name": "NitaCare Melzer & Köhler oHG",
      "company_seat": "Stade",
      "details": "09.10.2024 (Bekanntmachungsdatum)\n\nNiedersachsen Amtsgericht Tostedt HRA 205378\nRegisterbekanntmachung nach dem Umwandlungsgesetz 09.10.2024 (Eintragungsdatum)\n\nNitaCare Melzer & Köhler oHG\nOffene Handelsgesellschaft\nStade\n\nDen Gläubigern der an der formwechselnden Umwandlung beteiligten Rechtsträger ist, wenn sie binnen sechs Monaten nach dem Tag, an dem die Eintragung der Umwandlung in das Register des Sitzes desjenigen Rechtsträgers, dessen Gläubiger sie sind, nach § 19 Abs. 3 UmwG als bekannt gemacht gilt, ihren Anspruch nach Grund und Höhe schriftlich anmelden, Sicherheit zu leisten, soweit sie nicht Befriedigung verlangen können. Dieses Recht steht den Gläubigern jedoch nur zu, wenn sie glaubhaft machen, dass durch die formwechselnde Umwandlung die Erfüllung der Forderung gefährdet wird."
    },
    {
      "date": "2024-10-09",
      "original_text": "Registerbekanntmachung nach dem Umwandlungsgesetz\nSchleswig-Holstein Amtsgericht Kiel HRB 24994\nNord Energie GmbH – Struvenhütten",
      "type": "Registerbekanntmachung nach dem Umwandlungsgesetz",
      "state": "Schleswig-Holstein",
      "amtsgericht": "Amtsgericht Kiel",
      "registernummer": "HRB 24994",
      "registerart": "HRB",
      "company_name": "Nord Energie GmbH",
      "company_seat": "Struvenhütten",
      "details": "09.10.2024 (Bekanntmachungsdatum)\n\nSchleswig-Holstein Amtsgericht Kiel HRB 24994\nRegisterbekanntmachung nach dem Umwandlungsgesetz 08.10.2024 (Eintragungsdatum)\n\nNord Energie GmbH\nGesellschaft mit beschränkter Haftung\nStruvenhütten\n\nZu Eintragungsnummer 7 vom 08.10.2024 wird als nicht eingetragen veröffentlicht: Als nicht eingetragen wird veröffentlicht: Den Gläubigern der an der Verschmelzung beteiligten Rechtsträger ist, wenn sie binnen sechs Monaten nach dem Tag, an dem die Eintragung der Verschmelzung in das Register des Sitzes desjenigen Rechtsträgers, dessen Gläubiger sie sind, nach § 19 Abs. 3 UmwG bekannt gemacht worden ist, ihren Anspruch nach Grund und Höhe schriftlich anmelden, Sicherheit zu leisten, soweit sie nicht Befriedigung verlangen können. Dieses Recht steht den Gläubigern jedoch nur zu, wenn sie glaubhaft machen, dass durch die Verschmelzung die Erfüllung ihrer Forderung gefährdet wird."
    },
    {
      "date": "2024-10-09",
      "original_text": "Registerbekanntmachung nach dem Umwandlungsgesetz\nBayern Amtsgericht München HRB 293922\nOTKraus GmbH – Raisting",
      "type": "Registerbekanntmachung nach dem Umwandlungsgesetz",
      "state": "Bayern",
      "amtsgericht": "Amtsgericht München",
      "registernummer": "HRB 293922",
      "registerart": "HRB",
      "company_name": "OTKraus GmbH",
      "company_seat": "Raisting",
      "details": "09.10.2024 (Bekanntmachungsdatum)\n\nBayern Amtsgericht München HRB 293922\nRegisterbekanntmachung nach dem Umwandlungsgesetz 08.10.2024 (Eintragungsdatum)\n\nOTKraus GmbH\nGesellschaft mit beschränkter Haftung\nRaisting\n\nDen Gläubigern der an der Ausgliederung beteiligten Rechtsträger ist, wenn sie binnen sechs Monaten nach dem Tag, an dem die Eintragung der Ausgliederung in das Register des Sitzes desjenigen Rechtsträgers, dessen Gläubiger sie sind, nach §§ 125, 19 Abs. 3 UmwG als bekannt gemacht gilt, ihren Anspruch nach Grund und Höhe schriftlich anmelden, Sicherheit zu leisten, soweit sie nicht Befriedigung verlangen können. Dieses Recht steht den Gläubigern jedoch nur zu, wenn sie glaubhaft machen, dass durch die Ausgliederung die Erfüllung ihrer Forderung gefährdet wird."
    },
    {
      "date": "2024-10-09",
      "original_text": "Registerbekanntmachung nach dem Umwandlungsgesetz\nBaden-Württemberg Amtsgericht Mannheim HRB 742198\nOutdoor Flow GmbH – Karlsruhe",
      "type": "Registerbekanntmachung nach dem Umwandlungsgesetz",
      "state": "Baden-Württemberg",
      "amtsgericht": "Amtsgericht Mannheim",
      "registernummer": "HRB 742198",
      "registerart": "HRB",
      "company_name": "Outdoor Flow GmbH",
      "company_seat": "Karlsruhe",
      "details": "09.10.2024 (Bekanntmachungsdatum)\n\nBaden-Württemberg Amtsgericht Mannheim HRB 742198\nRegisterbekanntmachung nach dem Umwandlungsgesetz 09.10.2024 (Eintragungsdatum)\n\nOutdoor Flow GmbH\nGesellschaft mit beschränkter Haftung\nKarlsruhe\n\nAls nicht eingetragen wird bekanntgemacht:\nDen Gläubigern der an der Verschmelzung beteiligten Rechtsträger ist, wenn sie binnen sechs Monaten nach dem Tag, an dem die Eintragung der Verschmelzung in das Register des Sitzes desjenigen Rechtsträgers, dessen Gläubiger sie sind, nach § 19 Abs. 3 UmwG als bekanntgemacht gilt, ihren Anspruch nach Grund und Höhe schriftlich anmelden, Sicherheit zu leisten, soweit sie nicht Befriedigung verlangen können. Dieses Recht steht den Gläubigern jedoch nur zu, wenn sie glaubhaft machen, dass durch die Verschmelzung die Erfüllung ihrer Forderung gefährdet wird."
    },
    {
      "date": "2024-10-09",
      "original_text": "Registerbekanntmachung nach dem Umwandlungsgesetz\nSachsen-Anhalt Amtsgericht Stendal HRB 30656\nP1 Invest GmbH – Magdeburg",
      "type": "Registerbekanntmachung nach dem Umwandlungsgesetz",
      "state": "Sachsen-Anhalt",
      "amtsgericht": "Amtsgericht Stendal",
      "registernummer": "HRB 30656",
      "registerart": "HRB",
      "company_name": "P1 Invest GmbH",
      "company_seat": "Magdeburg",
      "details": "09.10.2024 (Bekanntmachungsdatum)\n\nSachsen-Anhalt Amtsgericht Stendal HRB 30656\nRegisterbekanntmachung nach dem Umwandlungsgesetz 09.10.2024 (Eintragungsdatum)\n\nP1 Invest GmbH\nGesellschaft mit beschränkter Haftung\nMagdeburg\n\nNicht eingetragen:\nDen Gläubigern der an der Verschmelzung beteiligten Rechtsträger ist, wenn sie binnen sechs Monaten nach dem Tag, an dem die Eintragung der Verschmelzung nach § 19 Abs. 3 UmwG als bekanntgemacht gilt, ihren Anspruch nach Grund und Höhe schriftlich anmelden, Sicherheit zu leisten, soweit sie nicht Befriedigung verlangen können. Dieses Recht steht ihnen jedoch nur zu, wenn sie glaubhaft machen, dass durch die Verschmelzung die Erfüllung ihrer Forderung gefährdet wird."
    },
    {
      "date": "2024-10-09",
      "original_text": "Registerbekanntmachung nach dem Umwandlungsgesetz\nBrandenburg Amtsgericht Potsdam HRB 36370\nPAPE Pflegegemeinschaft GmbH – Brandenburg an der Havel",
      "type": "Registerbekanntmachung nach dem Umwandlungsgesetz",
      "state": "Brandenburg",
      "amtsgericht": "Amtsgericht Potsdam",
      "registernummer": "HRB 36370",
      "registerart": "HRB",
      "company_name": "PAPE Pflegegemeinschaft GmbH",
      "company_seat": "Brandenburg an der Havel",
      "details": "09.10.2024 (Bekanntmachungsdatum)\n\nBrandenburg Amtsgericht Potsdam HRB 36370\nRegisterbekanntmachung nach dem Umwandlungsgesetz 27.09.2024 (Eintragungsdatum)\n\nPAPE Pflegegemeinschaft GmbH\nGesellschaft mit beschränkter Haftung\nBrandenburg an der Havel\n\nZu Eintragungsnummer 3 vom 27.09.2024 wird als nicht eingetragen veröffentlicht: Den Gläubigern der an der Verschmelzung beteiligten Rechtsträger ist, wenn sie binnen sechs Monaten nach dem Tag, an dem die Eintragung der Verschmelzung in das Register des Sitzes desjenigen Rechtsträgers, dessen Gläubiger sie sind, als bekannt gemacht gilt, ihren Anspruch nach Grund und Höhe schriftlich anmelden, Sicherheit zu leisten, soweit sie nicht Befriedigung verlangen können. Dieses Recht steht den Gläubigern jedoch nur zu, wenn sie glaubhaft machen, dass durch die Verschmelzung die Erfüllung ihrer Forderung gefährdet wird."
    },
    {
      "date": "2024-10-09",
      "original_text": "Löschungsankündigung\nBayern Amtsgericht München HRA 107456\nPRIMUS Concept Grundbesitz Ansbach Hauptstraße 7, 9 GmbH & Co. KG – Markt Indersdorf",
      "type": "Löschungsankündigung",
      "state": "Bayern",
      "amtsgericht": "Amtsgericht München",
      "registernummer": "HRA 107456",
      "registerart": "HRA",
      "company_name": "PRIMUS Concept Grundbesitz Ansbach Hauptstraße 7, 9 GmbH & Co. KG",
      "company_seat": "Markt Indersdorf",
      "details": "09.10.2024 (Bekanntmachungsdatum)\n\nBayern Amtsgericht München HRA 107456\nLöschungsankündigung 08.10.2024 (Eintragungsdatum)\n\nPRIMUS Concept Grundbesitz Ansbach Hauptstraße 7, 9 GmbH & Co. KG\nKommanditgesellschaft\nMarkt Indersdorf\n\nDas Registergericht beabsichtigt, die im Handelsregister eingetragene Firma wegen Vermögenslosigkeit von Amts wegen nach § 394 FamFG zu löschen. Die Frist zur Erhebung eines Widerspruchs ist auf drei Monate festgesetzt."
    },
    {
      "date": "2024-10-09",
      "original_text": "Registerbekanntmachung nach dem Umwandlungsgesetz\nThüringen Amtsgericht Jena HRB 515867\nPS 2 GmbH – Erfurt",
      "type": "Registerbekanntmachung nach dem Umwandlungsgesetz",
      "state": "Thüringen",
      "amtsgericht": "Amtsgericht Jena",
      "registernummer": "HRB 515867",
      "registerart": "HRB",
      "company_name": "PS 2 GmbH",
      "company_seat": "Erfurt",
      "details": "09.10.2024 (Bekanntmachungsdatum)\n\nThüringen Amtsgericht Jena HRB 515867\nRegisterbekanntmachung nach dem Umwandlungsgesetz 09.10.2024 (Eintragungsdatum)\n\nPS 2 GmbH\nGesellschaft mit beschränkter Haftung\nErfurt\n\nNicht eingetragen: Den Gläubigern der an der Ausgliederung beteiligten Rechtsträger, ist wenn sie binnen sechs Monaten nach dem Tag, an dem die Eintragung der Ausgliederung in das Register des Sitzes desjenigen Rechtsträgers, dessen Gläubiger sie sind, nach §§125, 19 Abs. 3 UmwG als bekanntgemacht gilt, ihren Anspruch nach Grund und Höhe schriftlich anmelden, Sicherheit zu leisten, soweit sie nicht Befriedigung verlangen können. Dieses Recht steht ihnen jedoch nur zu, wenn sie glaubhaft machen, daß durch die Ausgliederung die Erfüllung ihrer Forderung gefährdet wird."
    },
    {
      "date": "2024-10-09",
      "original_text": "Einreichung neuer Dokumente\nBayern Amtsgericht München HRB 295601\nParTec Al-Factory AG – Grünwald",
      "type": "Einreichung neuer Dokumente",
      "state": "Bayern",
      "amtsgericht": "Amtsgericht München",
      "registernummer": "HRB 295601",
      "registerart": "HRB",
      "company_name": "ParTec Al-Factory AG",
      "company_seat": "Grünwald",
      "details": "09.10.2024 (Bekanntmachungsdatum)\n\nBayern Amtsgericht München HRB 295601\nEinreichung neuer Dokumente 08.10.2024 (Eintragungsdatum)\n\nParTec Al-Factory AG\nAktiengesellschaft\nGrünwald\n\nDem Amtsgericht München -Registergericht- ist eine Liste der Mitglieder des Aufsichtsrats eingereicht worden, § 106 AktG."
    },
    {
      "date": "2024-10-09",
      "original_text": "Sonstige Registerbekanntmachung\nBaden-Württemberg Amtsgericht Stuttgart HRB 723743\nPeter Hahn Beteiligungs GmbH – Winterbach",
      "type": "Sonstige Registerbekanntmachung",
      "state": "Baden-Württemberg",
      "amtsgericht": "Amtsgericht Stuttgart",
      "registernummer": "HRB 723743",
      "registerart": "HRB",
      "company_name": "Peter Hahn Beteiligungs GmbH",
      "company_seat": "Winterbach",
      "details": "09.10.2024 (Bekanntmachungsdatum)\n\nBaden-Württemberg Amtsgericht Stuttgart HRB 723743\nSonstige Registerbekanntmachung 09.10.2024 (Eintragungsdatum)\n\nPeter Hahn Beteiligungs GmbH\nGesellschaft mit beschränkter Haftung\nWinterbach\n\nAls nicht eingetragen wird bekanntgemacht:\nDen Gläubigern der Gesellschaft, deren Forderungen begründet worden sind, bevor die Eintragung der Beendigung des Vertrages in das Handelsregister nach § 10 HGB als bekanntgemacht gilt, ist vom anderen Vertragsteil Sicherheit zu leisten, wenn sie sich binnen sechs Monaten nach der Bekanntmachung zu diesem Zweck bei ihm melden."
    },
    {
      "date": "2024-10-09",
      "original_text": "Registerbekanntmachung nach dem Umwandlungsgesetz\nSachsen Amtsgericht Dresden HRA 12097\nPflegedienst Uhlig e.Kfr. – Dresden",
      "type": "Registerbekanntmachung nach dem Umwandlungsgesetz",
      "state": "Sachsen",
      "amtsgericht": "Amtsgericht Dresden",
      "registernummer": "HRA 12097",
      "registerart": "HRA",
      "company_name": "Pflegedienst Uhlig e.Kfr.",
      "company_seat": "Dresden",
      "details": "09.10.2024 (Bekanntmachungsdatum)\n\nSachsen Amtsgericht Dresden HRA 12097\nRegisterbekanntmachung nach dem Umwandlungsgesetz 09.10.2024 (Eintragungsdatum)\n\nPflegedienst Uhlig e.Kfr.\nEinzelkaufmann / Einzelkauffrau\nDresden\n\nDen Gläubigern der an der Ausgliederung beteiligten Rechtsträger ist, wenn sie binnen sechs Monaten nach dem Tag, an dem die Eintragung der Ausgliederung in das Register des Sitzes desjenigen Rechtsträgers, dessen Gläubiger sie sind, nach § 19 Abs. 3 UmwG als bekannt gemacht gilt, ihren Anspruch nach Grund und Höhe schriftlich anmelden, Sicherheit zu leisten, soweit sie nicht Befriedigung verlangen können. Dieses Recht steht den Gläubigern jedoch nur zu, wenn sie glaubhaft machen, dass durch die Ausgliederung die Erfüllung der Forderung gefährdet wird."
    },
    {
      "date": "2024-10-09",
      "original_text": "Registerbekanntmachung nach dem Umwandlungsgesetz\nThüringen Amtsgericht Jena HRA 506825\nPizzaschmiede e.K. – Erfurt",
      "type": "Registerbekanntmachung nach dem Umwandlungsgesetz",
      "state": "Thüringen",
      "amtsgericht": "Amtsgericht Jena",
      "registernummer": "HRA 506825",
      "registerart": "HRA",
      "company_name": "Pizzaschmiede e.K.",
      "company_seat": "Erfurt",
      "details": "09.10.2024 (Bekanntmachungsdatum)\n\nThüringen Amtsgericht Jena HRA 506825\nRegisterbekanntmachung nach dem Umwandlungsgesetz 09.10.2024 (Eintragungsdatum)\n\nPizzaschmiede e.K.\nEinzelkaufmann / Einzelkauffrau\nErfurt\n\nNicht eingetragen: Den Gläubigern der an der Ausgliederung beteiligten Rechtsträger, ist wenn sie binnen sechs Monaten nach dem Tag, an dem die Eintragung der Ausgliederung in das Register des Sitzes desjenigen Rechtsträgers, dessen Gläubiger sie sind, nach §§125, 19 Abs. 3 UmwG als bekanntgemacht gilt, ihren Anspruch nach Grund und Höhe schriftlich anmelden, Sicherheit zu leisten, soweit sie nicht Befriedigung verlangen können. Dieses Recht steht ihnen jedoch nur zu, wenn sie glaubhaft machen, daß durch die Ausgliederung die Erfüllung ihrer Forderung gefährdet wird."
    },
    {
      "date": "2024-10-09",
      "original_text": "Löschungsankündigung\nHessen Amtsgericht Gießen HRB 10713\nQualität-Bau GmbH – Grünberg",
      "type": "Löschungsankündigung",
      "state": "Hessen",
      "amtsgericht": "Amtsgericht Gießen",
      "registernummer": "HRB 10713",
      "registerart": "HRB",
      "company_name": "Qualität-Bau GmbH",
      "company_seat": "Grünberg",
      "details": "09.10.2024 (Bekanntmachungsdatum)\n\nHessen Amtsgericht Gießen HRB 10713\nLöschungsankündigung\n\nQualität-Bau GmbH\nGesellschaft mit beschränkter Haftung\nGrünberg\n\nAuf Antrag des Finanzamts ist beabsichtigt, die Gesellschaft wegen Vermögenslosigkeit gemäß § 394 FamFG von Amts wegen zu löschen. Hiergegen kann innerhalb von drei Monaten nach dieser Veröffentlichung Widerspruch beim Amtsgericht Gießen eingelegt werden. Sollte Widerspruch eingelegt werden, dürfte dies nur mit Begründung erfolgversprechend sein. Insbesondere sollte vorhandenes Vermögen der Gesellschaft innerhalb der genannten Frist nachgewiesen werden."
    },
    {
      "date": "2024-10-09",
      "original_text": "Registerbekanntmachung nach dem Umwandlungsgesetz\nNiedersachsen Amtsgericht Osnabrück HRB 110732 früher Amtsgericht Bad Iburg\nRHR Verwaltungs GmbH – Georgsmarienhütte",
      "type": "Registerbekanntmachung nach dem Umwandlungsgesetz",
      "state": "Niedersachsen",
      "amtsgericht": "Amtsgericht Osnabrück",
      "registernummer": "HRB 110732",
      "registerart": "HRB",
      "company_name": "RHR Verwaltungs GmbH",
      "company_seat": "Georgsmarienhütte",
      "former_amtsgericht": "Bad Iburg",
      "details": "09.10.2024 (Bekanntmachungsdatum)\n\nNiedersachsen Amtsgericht Osnabrück HRB 110732 früher Amtsgericht Bad Iburg\nRegisterbekanntmachung nach dem Umwandlungsgesetz 09.10.2024 (Eintragungsdatum)\n\nRHR Verwaltungs GmbH\nGesellschaft mit beschränkter Haftung\nGeorgsmarienhütte\n\nDen Gläubigern der an der Ausgliederung beteiligten Rechtsträger ist, wenn sie binnen sechs Monaten nach dem Tag, an dem die Eintragung der Ausgliederung in das Register des Sitzes desjenigen Rechtsträgers, dessen Gläubiger sie sind, nach § 19 Abs. 3 UmwG als bekannt gemacht gilt, ihren Anspruch nach Grund und Höhe schriftlich anmelden, Sicherheit zu leisten, soweit sie nicht Befriedigung verlangen können. Dieses Recht steht den Gläubigern jedoch nur zu, wenn sie glaubhaft machen, dass durch die Ausgliederung die Erfüllung der Forderung gefährdet wird."
    },
    {
      "date": "2024-10-09",
      "original_text": "Löschungsankündigung\nBayern Amtsgericht Coburg HRB 665\nRK TEXTILE RAUMKUNST GMBH – Lichtenfels",
      "type": "Löschungsankündigung",
      "state": "Bayern",
      "amtsgericht": "Amtsgericht Coburg",
      "registernummer": "HRB 665",
      "registerart": "HRB",
      "company_name": "RK TEXTILE RAUMKUNST GMBH",
      "company_seat": "Lichtenfels",
      "details": "09.10.2024 (Bekanntmachungsdatum)\n\nBayern Amtsgericht Coburg HRB 665\nLöschungsankündigung\n\nRK TEXTILE RAUMKUNST GMBH\nGesellschaft mit beschränkter Haftung\nLichtenfels\n\nDas Registergericht beabsichtigt, die im Handelsregister eingetragene Gesellschaft wegen Vermögenslosigkeit von Amts wegen nach § 394 FamFG zu löschen. Die Frist zur Erhebung eines Widerspruchs ist auf sechs Wochen festgesetzt."
    },
    {
      "date": "2024-10-09",
      "original_text": "Registerbekanntmachung nach dem Umwandlungsgesetz\nNordrhein-Westfalen Amtsgericht Duisburg HRB 38144\nRST Gesellschaft für Wasserspartechnik mbH – Duisburg",
      "type": "Registerbekanntmachung nach dem Umwandlungsgesetz",
      "state": "Nordrhein-Westfalen",
      "amtsgericht": "Amtsgericht Duisburg",
      "registernummer": "HRB 38144",
      "registerart": "HRB",
      "company_name": "RST Gesellschaft für Wasserspartechnik mbH",
      "company_seat": "Duisburg",
      "details": "09.10.2024 (Bekanntmachungsdatum)\n\nNordrhein-Westfalen Amtsgericht Duisburg HRB 38144\nRegisterbekanntmachung nach dem Umwandlungsgesetz 09.10.2024 (Eintragungsdatum)\n\nRST Gesellschaft für Wasserspartechnik mbH\nGesellschaft mit beschränkter Haftung\nDuisburg\n\nDen Gläubigern der an der Verschmelzung beteiligten Rechtsträger ist, wenn sie binnen sechs Monaten nach dem Tag, an dem die Eintragung der Verschmelzung in das Register des Sitzes desjenigen Rechtsträgers, dessen Gläubiger sie sind, nach § 19 Absatz 3 UmwG als bekanntgemacht gilt, ihren Anspruch nach Grund und Höhe schriftlich anmelden, Sicherheit zu leisten, soweit sie nicht Befriedigung verlangen können. Dieses Recht steht den Gläubigern jedoch nur zu, wenn sie glaubhaft machen, dass durch die Verschmelzung die Erfüllung ihrer Forderung gefährdet wird."
    },
    {
      "date": "2024-10-09",
      "original_text": "Registerbekanntmachung nach dem Umwandlungsgesetz\nBayern Amtsgericht Kempten (Allgäu) GnR 857\nRaiffeisenbank Kempten-Oberallgäu eG – Sonthofen/Allgäu",
      "type": "Registerbekanntmachung nach dem Umwandlungsgesetz",
      "state": "Bayern",
      "amtsgericht": "Amtsgericht Kempten (Allgäu)",
      "registernummer": "GnR 857",
      "registerart": "GnR",
      "company_name": "Raiffeisenbank Kempten-Oberallgäu eG",
      "company_seat": "Sonthofen/Allgäu",
      "details": "09.10.2024 (Bekanntmachungsdatum)\n\nBayern Amtsgericht Kempten (Allgäu) GnR 857\nRegisterbekanntmachung nach dem Umwandlungsgesetz 08.10.2024 (Eintragungsdatum)\n\nRaiffeisenbank Kempten-Oberallgäu eG\neingetragene Genossenschaft\nSonthofen/Allgäu\n\nDen Gläubigern der an der Verschmelzung beteiligten Rechtsträger ist, wenn sie binnen sechs Monaten nach dem Tag, an dem die Eintragung der Verschmelzung in das Register des Sitzes desjenigen Rechtsträgers, dessen Gläubiger sie sind, nach § 19 Abs. 3 UmwG als bekannt gemacht gilt, ihren Anspruch nach Grund und Höhe schriftlich anmelden, Sicherheit zu leisten, soweit sie nicht Befriedigung verlangen können. Dieses Recht steht den Gläubigern jedoch nur zu, wenn sie glaubhaft machen, dass durch die Verschmelzung die Erfüllung ihrer Forderung gefährdet wird."
    },
    {
      "date": "2024-10-09",
      "original_text": "Löschungsankündigung\nSchleswig-Holstein Amtsgericht Lübeck HRB 1469 RZ\nRattay Mineralöle GmbH – Ratzeburg",
      "type": "Löschungsankündigung",
      "state": "Schleswig-Holstein",
      "amtsgericht": "Amtsgericht Lübeck",
      "registernummer": "HRB 1469 RZ",
      "registerart": "HRB",
      "company_name": "Rattay Mineralöle GmbH",
      "company_seat": "Ratzeburg",
      "details": "09.10.2024 (Bekanntmachungsdatum)\n\nSchleswig-Holstein Amtsgericht Lübeck HRB 1469 RZ\nLöschungsankündigung\n\nRattay Mineralöle GmbH\nGesellschaft mit beschränkter Haftung\nRatzeburg\n\nEs ist die Löschung der nachstehenden Gesellschaft wegen Vermögenslosigkeit gemäß § 394 FamFG beabsichtigt.\nWiderspruchsfrist: 1 Monat"
    },
    {
      "date": "2024-10-09",
      "original_text": "Löschungsankündigung\nNordrhein-Westfalen Amtsgericht Düsseldorf HRB 58645\nRomano Acampora GmbH – Düsseldorf",
      "type": "Löschungsankündigung",
      "state": "Nordrhein-Westfalen",
      "amtsgericht": "Amtsgericht Düsseldorf",
      "registernummer": "HRB 58645",
      "registerart": "HRB",
      "company_name": "Romano Acampora GmbH",
      "company_seat": "Düsseldorf",
      "details": "09.10.2024 (Bekanntmachungsdatum)\n\nNordrhein-Westfalen Amtsgericht Düsseldorf HRB 58645\nLöschungsankündigung\n\nRomano Acampora GmbH\nGesellschaft mit beschränkter Haftung\nDüsseldorf\n\nBetr.: Romano Acampora GmbH, Kappeler Str. 126, 40599 Düsseldorf\n\nDas Registergericht beabsichtigt die Gesellschaft von Amts wegen nach § 394 Abs. 1 FamFG zu löschen. Die Frist zur Erhebung eines Widerspruchs ist auf 3 Wochen festgesetzt.\n\nRechtsbehelfsbelehrung:\n\nDas Widerspruchsrecht steht jedem zu, der an der Unterlassung der Löschung ein berechtigtes Interesse hat. Der Widerspruch ist bei dem Amtsgericht Düsseldorf -Registergericht-, Werdener Straße 1, 40227 Düsseldorf schriftlich in deutscher Sprache oder zur Niederschrift der Geschäftsstelle einzulegen. Der Widerspruch kann auch zur Niederschrift der Geschäftsstelle eines jeden Amtsgerichtes abgegeben werden. Die Einlegung ist auch durch Übertragung eines elektronischen Dokuments an die elektronische Poststelle des Gerichts möglich. Das elektronische Dokument muss für die Bearbeitung durch das Gericht geeignet und mit einer qualifizierten elektronischen Signatur der verantwortenden Person versehen sein oder von der verantwortenden Person signiert und auf einem sicheren Übermittlungsweg gemäß § 130a ZPO nach näherer Maßgabe der Verordnung über die technischen Rahmenbedingungen des elektronischen Rechtsverkehrs und über das besondere elektronische Behördenpostfach (BGBl. I, S.3803) eingereicht werden. Weitere Informationen erhalten Sie auf der Internetseite www.justiz.de.\nDer Widerspruch muss spätestens innerhalb der gesetzten Frist nach dem Datum der Bekanntmachung der Löschungsankündigung bei dem Amtsgericht - Registergericht - Düsseldorf eingegangen sein.  Dies gilt auch dann, wenn der Widerspruch zur Niederschrift der Geschäftsstelle eines anderen Amtsgerichtes abgegeben wurde. Die Frist beginnt mit dem Tage der Bekanntmachung der Löschungsankündigung in dem für die Bekanntmachung der Eintragungen in das Handelsregister bestimmten elektronischen Informations- und Kommunikationssystem nach § 10 des Handelsgesetzbuches. Fällt das Ende der Frist auf einen Sonntag, einen allgemeinen Feiertag oder Sonnabend, so endet die Frist mit Ablauf des nächsten Werktages.\nDer Widerspruch muss die Bezeichnung der angefochtenen Löschungsankündigung sowie die Erklärung enthalten, dass Widerspruch gegen diese Löschungsankündigung eingelegt wird. Er ist zu unterzeichnen und soll begründet werden."
    },
    {
      "date": "2024-10-09",
      "original_text": "Registerbekanntmachung nach dem Umwandlungsgesetz\nSchleswig-Holstein Amtsgericht Lübeck HRB 888 EU\nRonny Adelsberger Beteiligungsgesellschaft mit beschränkter Haftung – Ahrensbök",
      "type": "Registerbekanntmachung nach dem Umwandlungsgesetz",
      "state": "Schleswig-Holstein",
      "amtsgericht": "Amtsgericht Lübeck",
      "registernummer": "HRB 888 EU",
      "registerart": "HRB",
      "company_name": "Ronny Adelsberger Beteiligungsgesellschaft mit beschränkter Haftung",
      "company_seat": "Ahrensbök",
      "details": "09.10.2024 (Bekanntmachungsdatum)\n\nSchleswig-Holstein Amtsgericht Lübeck HRB 888 EU\nRegisterbekanntmachung nach dem Umwandlungsgesetz 09.10.2024 (Eintragungsdatum)\n\nRonny Adelsberger Beteiligungsgesellschaft mit beschränkter Haftung\nGesellschaft mit beschränkter Haftung\nAhrensbök\n\nZu Eintragungsnummer 4 vom 09.10.2024 wird als nicht eingetragen veröffentlicht: Den Gläubigern der an der Verschmelzung beteiligten Rechtsträger ist, wenn sie binnen sechs Monaten nach dem Tag, an dem die Eintragung der Verschmelzung in das Register des Sitzes desjenigen Rechtsträgers, dessen Gläubiger sie sind, als bekannt gemacht gilt, ihren Anspruch nach Grund und Höhe schriftlich anmelden, Sicherheit zu leisten, soweit sie nicht Befriedigung verlangen können. Dieses Recht steht den Gläubigern jedoch nur zu, wenn sie glaubhaft machen, dass durch die Verschmelzung die Erfüllung ihrer Forderung gefährdet wird."
    },
    {
      "date": "2024-10-09",
      "original_text": "Registerbekanntmachung nach dem Umwandlungsgesetz\nBayern Amtsgericht Nürnberg HRB 30939\nRüstig Immobilien Beteiligungs GmbH – Lauf an der Pegnitz",
      "type": "Registerbekanntmachung nach dem Umwandlungsgesetz",
      "state": "Bayern",
      "amtsgericht": "Amtsgericht Nürnberg",
      "registernummer": "HRB 30939",
      "registerart": "HRB",
      "company_name": "Rüstig Immobilien Beteiligungs GmbH",
      "company_seat": "Lauf an der Pegnitz",
      "details": "09.10.2024 (Bekanntmachungsdatum)\n\nBayern Amtsgericht Nürnberg HRB 30939\nRegisterbekanntmachung nach dem Umwandlungsgesetz 08.10.2024 (Eintragungsdatum)\n\nRüstig Immobilien Beteiligungs GmbH\nGesellschaft mit beschränkter Haftung\nLauf an der Pegnitz\n\nDen Gläubigern der an der Verschmelzung beteiligten Rechtsträger ist, wenn sie binnen sechs Monaten nach dem Tag, an dem die Eintragung der Verschmelzung in das Register des Sitzes desjenigen Rechtsträgers, dessen Gläubiger sie sind, nach § 19 Abs. 3 UmwG als bekannt gemacht gilt, ihren Anspruch nach Grund und Höhe schriftlich anmelden, Sicherheit zu leisten, soweit sie nicht Befriedigung verlangen können. Dieses Recht steht den Gläubigern jedoch nur zu, wenn sie glaubhaft machen, dass durch die Verschmelzung die Erfüllung ihrer Forderung gefährdet wird."
    },
    {
      "date": "2024-10-09",
      "original_text": "Einreichung neuer Dokumente\nBayern Amtsgericht Augsburg HRB 33923\nSEWOBE AG – Augsburg",
      "type": "Einreichung neuer Dokumente",
      "state": "Bayern",
      "amtsgericht": "Amtsgericht Augsburg",
      "registernummer": "HRB 33923",
      "registerart": "HRB",
      "company_name": "SEWOBE AG",
      "company_seat": "Augsburg",
      "details": "09.10.2024 (Bekanntmachungsdatum)\n\nBayern Amtsgericht Augsburg HRB 33923\nEinreichung neuer Dokumente 08.10.2024 (Eintragungsdatum)\n\nSEWOBE AG\nAktiengesellschaft\nAugsburg\n\nDem Amtsgericht Augsburg -Registergericht- ist eine Liste der Mitglieder des Aufsichtsrats eingereicht worden, § 106 AktG.Dem Amtsgericht Augsburg -Registergericht- ist eine Liste der Mitglieder des Aufsichtsrats eingereicht worden, § 106 AktG."
    },
    {
      "date": "2024-10-09",
      "original_text": "Registerbekanntmachung nach dem Umwandlungsgesetz\nBerlin Amtsgericht Berlin (Charlottenburg) HRB 266558\nSH Fit Berlin-Pankow GmbH – Berlin",
      "type": "Registerbekanntmachung nach dem Umwandlungsgesetz",
      "state": "Berlin",
      "amtsgericht": "Amtsgericht Berlin (Charlottenburg)",
      "registernummer": "HRB 266558",
      "registerart": "HRB",
      "company_name": "SH Fit Berlin-Pankow GmbH",
      "company_seat": "Berlin",
      "details": "09.10.2024 (Bekanntmachungsdatum)\n\nBerlin Amtsgericht Berlin (Charlottenburg) HRB 266558\nRegisterbekanntmachung nach dem Umwandlungsgesetz 08.10.2024 (Eintragungsdatum)\n\nSH Fit Berlin-Pankow GmbH\nGesellschaft mit beschränkter Haftung\nBerlin\n\nZu Eintragungsnummer 2 vom 08.10.2024 wird als nicht eingetragen veröffentlicht: Den Gläubigern der an der Ausgliederung beteiligten Rechtsträger ist, wenn sie binnen sechs Monaten nach dem Tag, an dem die Eintragung der Ausgliederung in das Register des Sitzes desjenigen Rechtsträgers, dessen Gläubiger sie sind, als bekannt gemacht gilt, ihren Anspruch nach Grund und Höhe schriftlich anmelden, Sicherheit zu leisten, soweit sie nicht Befriedigung verlangen können. Dieses Recht steht den Gläubigern jedoch nur zu, wenn sie glaubhaft machen, dass durch die Ausgliederung die Erfüllung ihrer Forderung gefährdet wird. Das Recht, Sicherheitsleistung zu verlangen, steht Gläubigern nicht zu, die im Falle der Insolvenz ein Recht auf vorzugsweise Befriedigung aus einer Deckungsmasse haben, die nach gesetzlicher Vorschrift zu ihrem Schutz errichtet und staatlich überwacht ist."
    },
    {
      "date": "2024-10-09",
      "original_text": "Löschungsankündigung\nHessen Amtsgericht Frankfurt am Main HRB 112618\nSigma Bau GmbH – Frankfurt am Main",
      "type": "Löschungsankündigung",
      "state": "Hessen",
      "amtsgericht": "Amtsgericht Frankfurt am Main",
      "registernummer": "HRB 112618",
      "registerart": "HRB",
      "company_name": "Sigma Bau GmbH",
      "company_seat": "Frankfurt am Main",
      "details": "09.10.2024 (Bekanntmachungsdatum)\n\nHessen Amtsgericht Frankfurt am Main HRB 112618\nLöschungsankündigung\n\nSigma Bau GmbH\nGesellschaft mit beschränkter Haftung\nFrankfurt am Main\n\nDas Registergericht beabsichtigt die im Handelsregister eingetragene Gesellschaft von Amts wegen nach § 394 FamFG zu löschen. Die Frist zur Erhebung eines Widerspruchs gegen die beabsichtigte Löschung wird auf 1 Monat festgesetzt."
    },
    {
      "date": "2024-10-09",
      "original_text": "Registerbekanntmachung nach dem Umwandlungsgesetz\nBayern Amtsgericht Deggendorf HRB 3975\nSolarfokus UG (haftungsbeschränkt) – Regen",
      "type": "Registerbekanntmachung nach dem Umwandlungsgesetz",
      "state": "Bayern",
      "amtsgericht": "Amtsgericht Deggendorf",
      "registernummer": "HRB 3975",
      "registerart": "HRB",
      "company_name": "Solarfokus UG (haftungsbeschränkt)",
      "company_seat": "Regen",
      "details": "09.10.2024 (Bekanntmachungsdatum)\n\nBayern Amtsgericht Deggendorf HRB 3975\nRegisterbekanntmachung nach dem Umwandlungsgesetz 05.10.2024 (Eintragungsdatum)\n\nSolarfokus UG (haftungsbeschränkt)\nGesellschaft mit beschränkter Haftung\nRegen\n\nDen Gläubigern der an der Verschmelzung beteiligten Rechtsträger ist, wenn sie binnen sechs Monaten nach dem Tag, an dem die Eintragung der Verschmelzung in das Register des Sitzes desjenigen Rechtsträgers, dessen Gläubiger sie sind, nach § 19 Abs. 3 UmwG als bekannt gemacht gilt, ihren Anspruch nach Grund und Höhe schriftlich anmelden, Sicherheit zu leisten, soweit sie nicht Befriedigung verlangen können. Dieses Recht steht den Gläubigern jedoch nur zu, wenn sie glaubhaft machen, dass durch die Verschmelzung die Erfüllung ihrer Forderung gefährdet wird."
    },
    {
      "date": "2024-10-09",
      "original_text": "Registerbekanntmachung nach dem Umwandlungsgesetz\nNiedersachsen Amtsgericht Oldenburg (Oldenburg) HRB 209867\nSport Duwe Vertriebs GmbH – Oldenburg",
      "type": "Registerbekanntmachung nach dem Umwandlungsgesetz",
      "state": "Niedersachsen",
      "amtsgericht": "Amtsgericht Oldenburg (Oldenburg)",
      "registernummer": "HRB 209867",
      "registerart": "HRB",
      "company_name": "Sport Duwe Vertriebs GmbH",
      "company_seat": "Oldenburg",
      "details": "09.10.2024 (Bekanntmachungsdatum)\n\nNiedersachsen Amtsgericht Oldenburg (Oldenburg) HRB 209867\nRegisterbekanntmachung nach dem Umwandlungsgesetz 08.10.2024 (Eintragungsdatum)\n\nSport Duwe Vertriebs GmbH\nGesellschaft mit beschränkter Haftung\nOldenburg\n\nDen Gläubigern der an der Verschmelzung beteiligten Rechtsträger ist, wenn sie binnen sechs Monaten nach dem Tag, an dem die Eintragung der Verschmelzung in das Register des Sitzes desjenigen Rechtsträgers, dessen Gläubiger sie sind, nach § 19  Abs.  3 UmwG als bekannt gemacht gilt, ihren Anspruch nach Grund und Höhe schriftlich anmelden, Sicherheit zu leisten, soweit sie nicht Befriedigung verlangen können. Dieses Recht steht den Gläubigern jedoch nur zu, wenn sie glaubhaft machen, dass durch die Verschmelzung die Erfüllung der Forderung gefährdet wird."
    },
    {
      "date": "2024-10-09",
      "original_text": "Löschungsankündigung\nBaden-Württemberg Amtsgericht Ulm VR 710665\nSportfischerfreunde Freudenweiler 1995 – Neufra",
      "type": "Löschungsankündigung",
      "state": "Baden-Württemberg",
      "amtsgericht": "Amtsgericht Ulm",
      "registernummer": "VR 710665",
      "registerart": "VR",
      "company_name": "Sportfischerfreunde Freudenweiler 1995",
      "company_seat": "Neufra",
      "details": "09.10.2024 (Bekanntmachungsdatum)\n\nBaden-Württemberg Amtsgericht Ulm VR 710665\nLöschungsankündigung\n\nSportfischerfreunde Freudenweiler 1995\neingetragener Verein\nNeufra\n\nDas Gericht beabsichtigt, die Eintragung des Vereins im Vereinsregister wegen des Mangels einer wesentlichen Voraussetzung von Amts wegen nach § 395 FamFG als unzulässig zu löschen. Die Frist zur Geltendmachung eines Widerspruchs gegen die beabsichtigte Löschung ist auf einen Monat ab Veröffentlichung bestimmt."
    },
    {
      "date": "2024-10-09",
      "original_text": "Einreichung neuer Dokumente\nBaden-Württemberg Amtsgericht Mannheim HRB 360231\nStadtbau Ettlingen GmbH – Ettlingen",
      "type": "Einreichung neuer Dokumente",
      "state": "Baden-Württemberg",
      "amtsgericht": "Amtsgericht Mannheim",
      "registernummer": "HRB 360231",
      "registerart": "HRB",
      "company_name": "Stadtbau Ettlingen GmbH",
      "company_seat": "Ettlingen",
      "details": "09.10.2024 (Bekanntmachungsdatum)\n\nBaden-Württemberg Amtsgericht Mannheim HRB 360231\nEinreichung neuer Dokumente\n\nStadtbau Ettlingen GmbH\nGesellschaft mit beschränkter Haftung\nEttlingen\n\nDie Gesellschaft hat am 09.10.2024 die Liste über die Zusammensetzung des Aufsichtsrats zum Handelsregister eingereicht."
    },
    {
      "date": "2024-10-09",
      "original_text": "Einreichung neuer Dokumente\nSachsen-Anhalt Amtsgericht Stendal HRB 11008\nStadtwerke Bernburg GmbH – Bernburg (Saale)",
      "type": "Einreichung neuer Dokumente",
      "state": "Sachsen-Anhalt",
      "amtsgericht": "Amtsgericht Stendal",
      "registernummer": "HRB 11008",
      "registerart": "HRB",
      "company_name": "Stadtwerke Bernburg GmbH",
      "company_seat": "Bernburg (Saale)",
      "details": "09.10.2024 (Bekanntmachungsdatum)\n\nSachsen-Anhalt Amtsgericht Stendal HRB 11008\nEinreichung neuer Dokumente 09.10.2024 (Eintragungsdatum)\n\nStadtwerke Bernburg GmbH\nGesellschaft mit beschränkter Haftung\nBernburg (Saale)\n\nZwei Listen der Mitglieder des Aufsichtsrates wurde zum Handelsregister eingereicht."
    },
    {
      "date": "2024-10-09",
      "original_text": "Sonstige Registerbekanntmachung\nThüringen Amtsgericht Jena HRB 402701\nStadtwerke Leinefelde-Worbis GmbH – Leinefelde-Worbis",
      "type": "Sonstige Registerbekanntmachung",
      "state": "Thüringen",
      "amtsgericht": "Amtsgericht Jena",
      "registernummer": "HRB 402701",
      "registerart": "HRB",
      "company_name": "Stadtwerke Leinefelde-Worbis GmbH",
      "company_seat": "Leinefelde-Worbis",
      "details": "09.10.2024 (Bekanntmachungsdatum)\n\nThüringen Amtsgericht Jena HRB 402701\nSonstige Registerbekanntmachung\n\nStadtwerke Leinefelde-Worbis GmbH\nGesellschaft mit beschränkter Haftung\nLeinefelde-Worbis\n\nBekanntmachung gem. § 52 Abs. 3 Satz 2 GmbHG: Aufgrund einer Veränderung in den Personen der Aufsichtsratsmitglieder ist durch die Geschäftsführer eine neue Liste zum Handelsregister eingereicht worden."
    },
    {
      "date": "2024-10-09",
      "original_text": "Einreichung neuer Dokumente\nSachsen Amtsgericht Chemnitz HRB 36810\nStaffbase SE – Chemnitz",
      "type": "Einreichung neuer Dokumente",
      "state": "Sachsen",
      "amtsgericht": "Amtsgericht Chemnitz",
      "registernummer": "HRB 36810",
      "registerart": "HRB",
      "company_name": "Staffbase SE",
      "company_seat": "Chemnitz",
      "details": "09.10.2024 (Bekanntmachungsdatum)\n\nSachsen Amtsgericht Chemnitz HRB 36810\nEinreichung neuer Dokumente 26.09.2024 (Eintragungsdatum)\n\nStaffbase SE\nEuropäische Aktiengesellschaft (SE)\nChemnitz\n\nAm 26.09.2024 wurde beim Handelsregister des Amtsgerichts Chemnitz die Liste der Mitglieder des Aufsichtsrats gemäß § 106 AktG eingereicht."
    },
    {
      "date": "2024-10-09",
      "original_text": "Registerbekanntmachung nach dem Umwandlungsgesetz\nBaden-Württemberg Amtsgericht Stuttgart HRA 725022\nStars Casino GmbH & Co. KG – Leonberg",
      "type": "Registerbekanntmachung nach dem Umwandlungsgesetz",
      "state": "Baden-Württemberg",
      "amtsgericht": "Amtsgericht Stuttgart",
      "registernummer": "HRA 725022",
      "registerart": "HRA",
      "company_name": "Stars Casino GmbH & Co. KG",
      "company_seat": "Leonberg",
      "details": "09.10.2024 (Bekanntmachungsdatum)\n\nBaden-Württemberg Amtsgericht Stuttgart HRA 725022\nRegisterbekanntmachung nach dem Umwandlungsgesetz 09.10.2024 (Eintragungsdatum)\n\nStars Casino GmbH & Co. KG\nKommanditgesellschaft\nLeonberg\n\nAls nicht eingetragen wird bekanntgemacht:\nDen Gläubigern der an der Verschmelzung beteiligten Rechtsträger ist, wenn sie binnen sechs Monaten nach dem Tag, an dem die Eintragung der Verschmelzung in das Register des Sitzes desjenigen Rechtsträgers, dessen Gläubiger sie sind, nach § 19 Abs. 3 UmwG als bekanntgemacht gilt, ihren Anspruch nach Grund und Höhe schriftlich anmelden, Sicherheit zu leisten, soweit sie nicht Befriedigung verlangen können. Dieses Recht steht den Gläubigern jedoch nur zu, wenn sie glaubhaft machen, dass durch die Verschmelzung die Erfüllung ihrer Forderung gefährdet wird."
    },
    {
      "date": "2024-10-09",
      "original_text": "Registerbekanntmachung nach dem Umwandlungsgesetz\nBaden-Württemberg Amtsgericht Stuttgart HRA 736342\nSteinacker Hausverwaltung e.K. – Reutlingen",
      "type": "Registerbekanntmachung nach dem Umwandlungsgesetz",
      "state": "Baden-Württemberg",
      "amtsgericht": "Amtsgericht Stuttgart",
      "registernummer": "HRA 736342",
      "registerart": "HRA",
      "company_name": "Steinacker Hausverwaltung e.K.",
      "company_seat": "Reutlingen",
      "details": "09.10.2024 (Bekanntmachungsdatum)\n\nBaden-Württemberg Amtsgericht Stuttgart HRA 736342\nRegisterbekanntmachung nach dem Umwandlungsgesetz 09.10.2024 (Eintragungsdatum)\n\nSteinacker Hausverwaltung e.K.\nEinzelkaufmann / Einzelkauffrau\nReutlingen\n\nAls nicht eingetragen wird bekanntgemacht: Den Gläubigern der an der Ausgliederung beteiligten Rechtsträger ist, wenn sie binnen sechs Monaten nach dem Tag, an dem die Eintragung der Ausgliederung in das Register des Sitzes desjenigen Rechtsträgers, dessen Gläubiger sie sind, nach § 19 Abs. 3 UmwG als bekanntgemacht gilt, ihren Anspruch nach Grund und Höhe schriftlich anmelden, Sicherheit zu leisten, soweit sie nicht Befriedigung verlangen können. Dieses Recht steht den Gläubigern jedoch nur zu, wenn sie glaubhaft machen, dass durch die Ausgliederung die Erfüllung ihrer Forderung gefährdet wird."
    },
    {
      "date": "2024-10-09",
      "original_text": "Registerbekanntmachung nach dem Umwandlungsgesetz\nBaden-Württemberg Amtsgericht Stuttgart HRB 796639\nSteinacker Immobilienverwaltung GmbH – Reutlingen",
      "type": "Registerbekanntmachung nach dem Umwandlungsgesetz",
      "state": "Baden-Württemberg",
      "amtsgericht": "Amtsgericht Stuttgart",
      "registernummer": "HRB 796639",
      "registerart": "HRB",
      "company_name": "Steinacker Immobilienverwaltung GmbH",
      "company_seat": "Reutlingen",
      "details": "09.10.2024 (Bekanntmachungsdatum)\n\nBaden-Württemberg Amtsgericht Stuttgart HRB 796639\nRegisterbekanntmachung nach dem Umwandlungsgesetz 09.10.2024 (Eintragungsdatum)\n\nSteinacker Immobilienverwaltung GmbH\nGesellschaft mit beschränkter Haftung\nReutlingen\n\nAls nicht eingetragen wird bekanntgemacht:\nDen Gläubigern der an der Ausgliederung beteiligten Rechtsträger ist, wenn sie binnen sechs Monaten nach dem Tag, an dem die Eintragung der Ausgliederung in das Register des Sitzes desjenigen Rechtsträgers, dessen Gläubiger sie sind, nach § 19 Abs. 3 UmwG als bekanntgemacht gilt, ihren Anspruch nach Grund und Höhe schriftlich anmelden, Sicherheit zu leisten, soweit sie nicht Befriedigung verlangen können. Dieses Recht steht den Gläubigern jedoch nur zu, wenn sie glaubhaft machen, dass durch die Ausgliederung die Erfüllung ihrer Forderung gefährdet wird."
    },
    {
      "date": "2024-10-09",
      "original_text": "Registerbekanntmachung nach dem Umwandlungsgesetz\nSchleswig-Holstein Amtsgericht Kiel HRB 27386\nStimulus Consulting GmbH – Kiel",
      "type": "Registerbekanntmachung nach dem Umwandlungsgesetz",
      "state": "Schleswig-Holstein",
      "amtsgericht": "Amtsgericht Kiel",
      "registernummer": "HRB 27386",
      "registerart": "HRB",
      "company_name": "Stimulus Consulting GmbH",
      "company_seat": "Kiel",
      "details": "09.10.2024 (Bekanntmachungsdatum)\n\nSchleswig-Holstein Amtsgericht Kiel HRB 27386\nRegisterbekanntmachung nach dem Umwandlungsgesetz 08.10.2024 (Eintragungsdatum)\n\nStimulus Consulting GmbH\nGesellschaft mit beschränkter Haftung\nKiel\n\nZu Eintragungsnummer 1 vom 08.10.2024 wird als nicht eingetragen veröffentlicht: Den Gläubigern ist, wenn sie binnen sechs Monaten nach dem Tag, an dem die Eintragung der Umwandlung bekannt gemacht worden ist, ihren Anspruch nach Grund und Höhe schriftlich anmelden, Sicherheit zu leisten, soweit sie nicht Befriedigung verlangen können. Dieses Recht steht den Gläubigern jedoch nur zu, wenn sie glaubhaft machen, dass durch die Umwandlung die Erfüllung ihrer Forderung gefährdet wird."
    },
    {
      "date": "2024-10-09",
      "original_text": "Einreichung neuer Dokumente\nSachsen Amtsgericht Chemnitz HRB 4665\nStädtische Wohnungsbau- und Verwaltungsgesellschaft Meerane mit beschränkter Haftung – Meerane",
      "type": "Einreichung neuer Dokumente",
      "state": "Sachsen",
      "amtsgericht": "Amtsgericht Chemnitz",
      "registernummer": "HRB 4665",
      "registerart": "HRB",
      "company_name": "Städtische Wohnungsbau- und Verwaltungsgesellschaft Meerane mit beschränkter Haftung",
      "company_seat": "Meerane",
      "details": "09.10.2024 (Bekanntmachungsdatum)\n\nSachsen Amtsgericht Chemnitz HRB 4665\nEinreichung neuer Dokumente\n\nStädtische Wohnungsbau- und Verwaltungsgesellschaft Meerane mit beschränkter Haftung\nGesellschaft mit beschränkter Haftung\nMeerane\n\nAm 07.10.2024 wurde beim Handelsregister des Amtsgerichts Chemnitz die Liste der Mitglieder des Aufsichtsrats gemäß § 52 GmbHG eingereicht."
    },
    {
      "date": "2024-10-09",
      "original_text": "Sonstige Registerbekanntmachung\nThüringen Amtsgericht Jena HRB 203261\nStädtische Wohnungsgesellschaft Altenburg mbH – Altenburg",
      "type": "Sonstige Registerbekanntmachung",
      "state": "Thüringen",
      "amtsgericht": "Amtsgericht Jena",
      "registernummer": "HRB 203261",
      "registerart": "HRB",
      "company_name": "Städtische Wohnungsgesellschaft Altenburg mbH",
      "company_seat": "Altenburg",
      "details": "09.10.2024 (Bekanntmachungsdatum)\n\nThüringen Amtsgericht Jena HRB 203261\nSonstige Registerbekanntmachung\n\nStädtische Wohnungsgesellschaft Altenburg mbH\nGesellschaft mit beschränkter Haftung\nAltenburg\n\nBekanntmachung gem. § 52 Abs. 3 Satz 2 GmbHG: Aufgrund einer Veränderung in den Personen der Aufsichtsratsmitglieder ist durch die Geschäftsführer eine neue Liste zum Handelsregister eingereicht worden."
    },
    {
      "date": "2024-10-09",
      "original_text": "Registerbekanntmachung nach dem Umwandlungsgesetz\nBerlin Amtsgericht Berlin (Charlottenburg) HRB 264164\nTD Business Advisory GmbH – Berlin",
      "type": "Registerbekanntmachung nach dem Umwandlungsgesetz",
      "state": "Berlin",
      "amtsgericht": "Amtsgericht Berlin (Charlottenburg)",
      "registernummer": "HRB 264164",
      "registerart": "HRB",
      "company_name": "TD Business Advisory GmbH",
      "company_seat": "Berlin",
      "details": "09.10.2024 (Bekanntmachungsdatum)\n\nBerlin Amtsgericht Berlin (Charlottenburg) HRB 264164\nRegisterbekanntmachung nach dem Umwandlungsgesetz 08.10.2024 (Eintragungsdatum)\n\nTD Business Advisory GmbH\nGesellschaft mit beschränkter Haftung\nBerlin\n\nZu Eintragungsnummer 2 vom 08.10.2024 wird als nicht eingetragen veröffentlicht: Den Gläubigern der an der Spaltung beteiligten Rechtsträger ist, wenn sie binnen sechs Monaten nach dem Tag, an dem die Eintragung der Spaltung in das Register des Sitzes desjenigen Rechtsträgers, dessen Gläubiger sie sind, als bekannt gemacht gilt, ihren Anspruch nach Grund und Höhe schriftlich anmelden, Sicherheit zu leisten, soweit sie nicht Befriedigung verlangen können. Dieses Recht steht den Gläubigern jedoch nur zu, wenn sie glaubhaft machen, dass durch die Spaltung die Erfüllung ihrer Forderung gefährdet wird. Das Recht, Sicherheitsleistung zu verlangen, steht Gläubigern nicht zu, die im Falle der Insolvenz ein Recht auf vorzugsweise Befriedigung aus einer Deckungsmasse haben, die nach gesetzlicher Vorschrift zu ihrem Schutz errichtet und staatlich überwacht ist."
    },
    {
      "date": "2024-10-09",
      "original_text": "Registerbekanntmachung nach dem Umwandlungsgesetz\nBerlin Amtsgericht Berlin (Charlottenburg) HRA 63335\nTD Unternehmensberatung e.K. – Berlin",
      "type": "Registerbekanntmachung nach dem Umwandlungsgesetz",
      "state": "Berlin",
      "amtsgericht": "Amtsgericht Berlin (Charlottenburg)",
      "registernummer": "HRA 63335",
      "registerart": "HRA",
      "company_name": "TD Unternehmensberatung e.K.",
      "company_seat": "Berlin",
      "details": "09.10.2024 (Bekanntmachungsdatum)\n\nBerlin Amtsgericht Berlin (Charlottenburg) HRA 63335\nRegisterbekanntmachung nach dem Umwandlungsgesetz 08.10.2024 (Eintragungsdatum)\n\nTD Unternehmensberatung e.K.\nEinzelkaufmann / Einzelkauffrau\nBerlin\n\nZu Eintragungsnummer 2 vom 08.10.2024 wird als nicht eingetragen veröffentlicht: Den Gläubigern der an der Ausgliederung beteiligten Rechtsträger ist, wenn sie binnen sechs Monaten nach dem Tag, an dem die Eintragung der Ausgliederung in das Register des Sitzes desjenigen Rechtsträgers, dessen Gläubiger sie sind, als bekannt gemacht gilt, ihren Anspruch nach Grund und Höhe schriftlich anmelden, Sicherheit zu leisten, soweit sie nicht Befriedigung verlangen können. Dieses Recht steht den Gläubigern jedoch nur zu, wenn sie glaubhaft machen, dass durch die Ausgliederung die Erfüllung ihrer Forderung gefährdet wird. Das Recht, Sicherheitsleistung zu verlangen, steht Gläubigern nicht zu, die im Falle der Insolvenz ein Recht auf vorzugsweise Befriedigung aus einer Deckungsmasse haben, die nach gesetzlicher Vorschrift zu ihrem Schutz errichtet und staatlich überwacht ist."
    },
    {
      "date": "2024-10-09",
      "original_text": "Registerbekanntmachung nach dem Umwandlungsgesetz\nBaden-Württemberg Amtsgericht Stuttgart HRB 726454\nTRIPLE-ING. GMBH – Stuttgart",
      "type": "Registerbekanntmachung nach dem Umwandlungsgesetz",
      "state": "Baden-Württemberg",
      "amtsgericht": "Amtsgericht Stuttgart",
      "registernummer": "HRB 726454",
      "registerart": "HRB",
      "company_name": "TRIPLE-ING. GMBH",
      "company_seat": "Stuttgart",
      "details": "09.10.2024 (Bekanntmachungsdatum)\n\nBaden-Württemberg Amtsgericht Stuttgart HRB 726454\nRegisterbekanntmachung nach dem Umwandlungsgesetz 09.10.2024 (Eintragungsdatum)\n\nTRIPLE-ING. GMBH\nGesellschaft mit beschränkter Haftung\nStuttgart\n\nAls nicht eingetragen wird bekanntgemacht:\nDen Gläubigern der an der Verschmelzung beteiligten Rechtsträger ist, wenn sie binnen sechs Monaten nach dem Tag, an dem die Eintragung der Verschmelzung in das Register des Sitzes desjenigen Rechtsträgers, dessen Gläubiger sie sind, nach § 19 Abs. 3 UmwG als bekanntgemacht gilt, ihren Anspruch nach Grund und Höhe schriftlich anmelden, Sicherheit zu leisten, soweit sie nicht Befriedigung verlangen können. Dieses Recht steht den Gläubigern jedoch nur zu, wenn sie glaubhaft machen, dass durch die Verschmelzung die Erfüllung ihrer Forderung gefährdet wird."
    },
    {
      "date": "2024-10-09",
      "original_text": "Registerbekanntmachung nach dem Umwandlungsgesetz\nHamburg Amtsgericht Hamburg HRA 131487\nTZW Frühförderzentrum e.K. – Hamburg",
      "type": "Registerbekanntmachung nach dem Umwandlungsgesetz",
      "state": "Hamburg",
      "amtsgericht": "Amtsgericht Hamburg",
      "registernummer": "HRA 131487",
      "registerart": "HRA",
      "company_name": "TZW Frühförderzentrum e.K.",
      "company_seat": "Hamburg",
      "details": "09.10.2024 (Bekanntmachungsdatum)\n\nHamburg Amtsgericht Hamburg HRA 131487\nRegisterbekanntmachung nach dem Umwandlungsgesetz 09.10.2024 (Eintragungsdatum)\n\nTZW Frühförderzentrum e.K.\nEinzelkaufmann\nHamburg\n\nAls nicht eingetragen wird bekannt gemacht:\nDen Gläubigern der an der Ausgliederung beteiligten Rechtsträger ist, wenn sie binnen sechs Monaten nach dem Tag, an dem die Eintragung der Ausgliederung in das Register des Sitzes desjenigen Rechtsträgers, dessen Gläubiger sie sind, nach § 19 Absatz 3 UmwG als bekannt gemacht gilt, ihren Anspruch nach Grund und Höhe schriftlich anmelden, Sicherheit zu leisten, soweit sie nicht Befriedigung verlangen können. Dieses Recht steht den Gläubigern jedoch nur zu, wenn sie glaubhaft machen, dass durch die Ausgliederung die Erfüllung ihrer Forderung gefährdet wird."
    },
    {
      "date": "2024-10-09",
      "original_text": "Registerbekanntmachung nach dem Umwandlungsgesetz\nHamburg Amtsgericht Hamburg HRB 184621\nTZW Weigel Gesundheitsgesellschaft mbH – Hamburg",
      "type": "Registerbekanntmachung nach dem Umwandlungsgesetz",
      "state": "Hamburg",
      "amtsgericht": "Amtsgericht Hamburg",
      "registernummer": "HRB 184621",
      "registerart": "HRB",
      "company_name": "TZW Weigel Gesundheitsgesellschaft mbH",
      "company_seat": "Hamburg",
      "details": "09.10.2024 (Bekanntmachungsdatum)\n\nHamburg Amtsgericht Hamburg HRB 184621\nRegisterbekanntmachung nach dem Umwandlungsgesetz 09.10.2024 (Eintragungsdatum)\n\nTZW Weigel Gesundheitsgesellschaft mbH\nGesellschaft mit beschränkter Haftung\nHamburg\n\nAls nicht eingetragen wird bekannt gemacht:\nDen Gläubigern der an der Ausgliederung beteiligten Gesellschaften ist, wenn sie binnen sechs Monaten nach dem Tag, an dem die Eintragung der Ausgliederung in das Register des Sitzes desjenigen Rechtsträgers, dessen Gläubiger sie sind, nach § 19 Absatz 3 UmwG als bekannt gemacht gilt, ihren Anspruch nach Grund und Höhe schriftlich anmelden, Sicherheit zu leisten, soweit sie nicht Befriedigung verlangen können. Dieses Recht steht den Gläubigern jedoch nur zu, wenn sie glaubhaft machen, dass durch die Ausgliederung die Erfüllung ihrer Forderung gefährdet wird."
    },
    {
      "date": "2024-10-09",
      "original_text": "Einreichung neuer Dokumente\nBayern Amtsgericht München HRB 200081\nTeam Internet AG – München",
      "type": "Einreichung neuer Dokumente",
      "state": "Bayern",
      "amtsgericht": "Amtsgericht München",
      "registernummer": "HRB 200081",
      "registerart": "HRB",
      "company_name": "Team Internet AG",
      "company_seat": "München",
      "details": "09.10.2024 (Bekanntmachungsdatum)\n\nBayern Amtsgericht München HRB 200081\nEinreichung neuer Dokumente\n\nTeam Internet AG\nAktiengesellschaft\nMünchen\n\nDem Amtsgericht München -Registergericht- ist eine Liste der Mitglieder des Aufsichtsrats eingereicht worden, § 106 AktG."
    },
    {
      "date": "2024-10-09",
      "original_text": "Registerbekanntmachung nach dem Umwandlungsgesetz\nSchleswig-Holstein Amtsgericht Kiel HRB 1444 RD\nTheede Bauelemente GmbH – Osterrönfeld",
      "type": "Registerbekanntmachung nach dem Umwandlungsgesetz",
      "state": "Schleswig-Holstein",
      "amtsgericht": "Amtsgericht Kiel",
      "registernummer": "HRB 1444 RD",
      "registerart": "HRB",
      "company_name": "Theede Bauelemente GmbH",
      "company_seat": "Osterrönfeld",
      "details": "09.10.2024 (Bekanntmachungsdatum)\n\nSchleswig-Holstein Amtsgericht Kiel HRB 1444 RD\nRegisterbekanntmachung nach dem Umwandlungsgesetz 08.10.2024 (Eintragungsdatum)\n\nTheede Bauelemente GmbH\nGesellschaft mit beschränkter Haftung\nOsterrönfeld\n\nZu Eintragungsnummer 5 vom 08.10.2024 wird als nicht eingetragen veröffentlicht: Als nicht eingetragen wird veröffentlicht: Den Gläubigern der an der Verschmelzung beteiligten Rechtsträger ist, wenn sie binnen sechs Monaten nach dem Tag, an dem die Eintragung der Verschmelzung in das Register des Sitzes desjenigen Rechtsträgers, dessen Gläubiger sie sind, nach § 19 Abs. 3 UmwG bekannt gemacht worden ist, ihren Anspruch nach Grund und Höhe schriftlich anmelden, Sicherheit zu leisten, soweit sie nicht Befriedigung verlangen können. Dieses Recht steht den Gläubigern jedoch nur zu, wenn sie glaubhaft machen, dass durch die Verschmelzung die Erfüllung ihrer Forderung gefährdet wird."
    },
    {
      "date": "2024-10-09",
      "original_text": "Registerbekanntmachung nach dem Umwandlungsgesetz\nNordrhein-Westfalen Amtsgericht Iserlohn HRA 2782\nToppräsente Krugmann GmbH & Co. KG – Meinerzhagen",
      "type": "Registerbekanntmachung nach dem Umwandlungsgesetz",
      "state": "Nordrhein-Westfalen",
      "amtsgericht": "Amtsgericht Iserlohn",
      "registernummer": "HRA 2782",
      "registerart": "HRA",
      "company_name": "Toppräsente Krugmann GmbH & Co. KG",
      "company_seat": "Meinerzhagen",
      "details": "09.10.2024 (Bekanntmachungsdatum)\n\nNordrhein-Westfalen Amtsgericht Iserlohn HRA 2782\nRegisterbekanntmachung nach dem Umwandlungsgesetz 09.10.2024 (Eintragungsdatum)\n\nToppräsente Krugmann GmbH & Co. KG\nKommanditgesellschaft\nMeinerzhagen\n\nDen Gläubigern der an der Verschmelzung beteiligten Rechtsträger ist, wenn sie binnen sechs Monaten nach dem Tag, an dem die Eintragung der Verschmelzung in das Register des Sitzes desjenigen Rechtsträgers, dessen Gläubiger sie sind, nach § 19 Absatz 3 UmwG als bekanntgemacht gilt, ihren Anspruch nach Grund und Höhe schriftlich anmelden, Sicherheit zu leisten, soweit sie nicht Befriedigung verlangen können. Dieses Recht steht den Gläubigern jedoch nur zu, wenn sie glaubhaft machen, dass durch die Verschmelzung die Erfüllung ihrer Forderung gefährdet wird."
    },
    {
      "date": "2024-10-09",
      "original_text": "Registerbekanntmachung nach dem Umwandlungsgesetz\nBerlin Amtsgericht Berlin (Charlottenburg) HRA 58174\nUNIVERSAL COMPUTER SERVICE GmbH & Co. KG – Berlin",
      "type": "Registerbekanntmachung nach dem Umwandlungsgesetz",
      "state": "Berlin",
      "amtsgericht": "Amtsgericht Berlin (Charlottenburg)",
      "registernummer": "HRA 58174",
      "registerart": "HRA",
      "company_name": "UNIVERSAL COMPUTER SERVICE GmbH & Co. KG",
      "company_seat": "Berlin",
      "details": "09.10.2024 (Bekanntmachungsdatum)\n\nBerlin Amtsgericht Berlin (Charlottenburg) HRA 58174\nRegisterbekanntmachung nach dem Umwandlungsgesetz 08.10.2024 (Eintragungsdatum)\n\nUNIVERSAL COMPUTER SERVICE GmbH & Co. KG\nKommanditgesellschaft\nBerlin\n\nZu Eintragungsnummer 5 vom 08.10.2024 wird als nicht eingetragen veröffentlicht: Den Gläubigern der an der Verschmelzung beteiligten Rechtsträger ist, wenn sie binnen sechs Monaten nach dem Tag, an dem die Eintragung der Verschmelzung in das Register des Sitzes desjenigen Rechtsträgers, dessen Gläubiger sie sind, als bekannt gemacht gilt, ihren Anspruch nach Grund und Höhe schriftlich anmelden, Sicherheit zu leisten, soweit sie nicht Befriedigung verlangen können. Dieses Recht steht den Gläubigern jedoch nur zu, wenn sie glaubhaft machen, dass durch die Verschmelzung die Erfüllung ihrer Forderung gefährdet wird. Das Recht, Sicherheitsleistung zu verlangen, steht Gläubigern nicht zu, die im Falle der Insolvenz ein Recht auf vorzugsweise Befriedigung aus einer Deckungsmasse haben, die nach gesetzlicher Vorschrift zu ihrem Schutz errichtet und staatlich überwacht ist."
    },
    {
      "date": "2024-10-09",
      "original_text": "Registerbekanntmachung nach dem Umwandlungsgesetz\nNiedersachsen Amtsgericht Osnabrück HRA 100205 früher Amtsgericht Lingen (Ems)\nVACU-FORM Wischemann GmbH & Co.KG, – Salzbergen",
      "type": "Registerbekanntmachung nach dem Umwandlungsgesetz",
      "state": "Niedersachsen",
      "amtsgericht": "Amtsgericht Osnabrück",
      "registernummer": "HRA 100205",
      "registerart": "HRA",
      "company_name": "VACU-FORM Wischemann GmbH & Co.KG,",
      "company_seat": "Salzbergen",
      "former_amtsgericht": "Lingen (Ems)",
      "details": "09.10.2024 (Bekanntmachungsdatum)\n\nNiedersachsen Amtsgericht Osnabrück HRA 100205 früher Amtsgericht Lingen (Ems)\nRegisterbekanntmachung nach dem Umwandlungsgesetz 09.10.2024 (Eintragungsdatum)\n\nVACU-FORM Wischemann GmbH & Co.KG,\nKommanditgesellschaft\nSalzbergen\n\nDen Gläubigern der an der Ausgliederung beteiligten Rechtsträger ist, wenn sie binnen sechs Monaten nach dem Tag, an dem die Eintragung der Ausgliederung in das Register des Sitzes desjenigen Rechtsträgers, dessen Gläubiger sie sind, nach § 19 Abs. 3 UmwG als bekannt gemacht gilt, ihren Anspruch nach Grund und Höhe schriftlich anmelden, Sicherheit zu leisten, soweit sie nicht Befriedigung verlangen können. Dieses Recht steht den Gläubigern jedoch nur zu, wenn sie glaubhaft machen, dass durch die Ausgliederung die Erfüllung der Forderung gefährdet wird."
    },
    {
      "date": "2024-10-09",
      "original_text": "Registerbekanntmachung nach dem Umwandlungsgesetz\nRheinland-Pfalz Amtsgericht Wittlich HRB 42359\nVR Saar-Mosel GmbH – Föhren",
      "type": "Registerbekanntmachung nach dem Umwandlungsgesetz",
      "state": "Rheinland-Pfalz",
      "amtsgericht": "Amtsgericht Wittlich",
      "registernummer": "HRB 42359",
      "registerart": "HRB",
      "company_name": "VR Saar-Mosel GmbH",
      "company_seat": "Föhren",
      "details": "09.10.2024 (Bekanntmachungsdatum)\n\nRheinland-Pfalz Amtsgericht Wittlich HRB 42359\nRegisterbekanntmachung nach dem Umwandlungsgesetz 09.10.2024 (Eintragungsdatum)\n\nVR Saar-Mosel GmbH\nGesellschaft mit beschränkter Haftung\nFöhren\n\nDen Gläubigern der an der Verschmelzung beteiligten Rechtsträgern ist, wenn sie binnen sechs Monaten nach dem Tag, an dem die Eintragung der Verschmelzung in das Register des Sitzes desjenigen Rechtsträgers, dessen Gläubiger sie sind, nach § 19 Absatz 3 UmwG als bekanntgemacht gilt, ihren Anspruch nach Grund und Höhe schriftlich anmelden, Sicherheit zu leisten, soweit sie nicht Befriedigung verlangen können.\nDieses Recht steht den Gläubigern jedoch nur zu, wenn sie glaubhaft machen, dass durch die Verschmelzung die Erfüllung ihrer Forderung gefährdet wird."
    },
    {
      "date": "2024-10-09",
      "original_text": "Löschungsankündigung\nNordrhein-Westfalen Amtsgericht Dortmund HRB 13399\nVierhaus Verwaltungsgesellschaft mbH – Dortmund",
      "type": "Löschungsankündigung",
      "state": "Nordrhein-Westfalen",
      "amtsgericht": "Amtsgericht Dortmund",
      "registernummer": "HRB 13399",
      "registerart": "HRB",
      "company_name": "Vierhaus Verwaltungsgesellschaft mbH",
      "company_seat": "Dortmund",
      "details": "09.10.2024 (Bekanntmachungsdatum)\n\nNordrhein-Westfalen Amtsgericht Dortmund HRB 13399\nLöschungsankündigung\n\nVierhaus Verwaltungsgesellschaft mbH\nGesellschaft mit beschränkter Haftung\nDortmund\n\nDas Registergericht beabsichtigt die Gesellschaft von Amts wegen nach § 394 FamFG zu löschen. Die Frist zur Erhebung eines Widerspruchs ist auf zwei Monate festgesetzt."
    },
    {
      "date": "2024-10-09",
      "original_text": "Registerbekanntmachung nach dem Umwandlungsgesetz\nNiedersachsen Amtsgericht Walsrode HRB 205143\nWeser InvEst GmbH – Bad Fallingbostel",
      "type": "Registerbekanntmachung nach dem Umwandlungsgesetz",
      "state": "Niedersachsen",
      "amtsgericht": "Amtsgericht Walsrode",
      "registernummer": "HRB 205143",
      "registerart": "HRB",
      "company_name": "Weser InvEst GmbH",
      "company_seat": "Bad Fallingbostel",
      "details": "09.10.2024 (Bekanntmachungsdatum)\n\nNiedersachsen Amtsgericht Walsrode HRB 205143\nRegisterbekanntmachung nach dem Umwandlungsgesetz 09.10.2024 (Eintragungsdatum)\n\nWeser InvEst GmbH\nGesellschaft mit beschränkter Haftung\nBad Fallingbostel\n\nDen Gläubigern der an der Abspaltung beteiligten Rechtsträger ist, wenn sie binnen sechs Monaten nach dem Tag, an dem die Eintragung der Abspaltung in das Register des Sitzes desjenigen Rechtsträgers, dessen Gläubiger sie sind, nach § 19 Abs. 3 UmwG als bekannt gemacht gilt, ihren Anspruch nach Grund und Höhe schriftlich anmelden, Sicherheit zu leisten, soweit sie nicht Befriedigung verlangen können. Dieses Recht steht den Gläubigern jedoch nur zu, wenn sie glaubhaft machen, dass durch die Abspaltung die Erfüllung der Forderung gefährdet wird."
    },
    {
      "date": "2024-10-09",
      "original_text": "Löschungsankündigung\nBaden-Württemberg Amtsgericht Mannheim HRB 8884\nWinkler Malerbetrieb GmbH – Mannheim",
      "type": "Löschungsankündigung",
      "state": "Baden-Württemberg",
      "amtsgericht": "Amtsgericht Mannheim",
      "registernummer": "HRB 8884",
      "registerart": "HRB",
      "company_name": "Winkler Malerbetrieb GmbH",
      "company_seat": "Mannheim",
      "details": "09.10.2024 (Bekanntmachungsdatum)\n\nBaden-Württemberg Amtsgericht Mannheim HRB 8884\nLöschungsankündigung\n\nWinkler Malerbetrieb GmbH\nGesellschaft mit beschränkter Haftung\nMannheim\n\nDas Gericht beabsichtigt, die Gesellschaft wegen Vermögenslosigkeit im Handelsregister von Amts wegen nach § 394 FamFG zu löschen. Die Frist zur Geltendmachung eines Widerspruchs gegen die beabsichtigte Löschung ist auf einen Monat ab Veröffentlichung bestimmt."
    },
    {
      "date": "2024-10-09",
      "original_text": "Sonstige Registerbekanntmachung\nNiedersachsen Amtsgericht Hannover HRB 3502\nWohnungsbau Niedersachsen Gesellschaft mit beschränkter Haftung – Hannover",
      "type": "Sonstige Registerbekanntmachung",
      "state": "Niedersachsen",
      "amtsgericht": "Amtsgericht Hannover",
      "registernummer": "HRB 3502",
      "registerart": "HRB",
      "company_name": "Wohnungsbau Niedersachsen Gesellschaft mit beschränkter Haftung",
      "company_seat": "Hannover",
      "details": "09.10.2024 (Bekanntmachungsdatum)\n\nNiedersachsen Amtsgericht Hannover HRB 3502\nSonstige Registerbekanntmachung\n\nWohnungsbau Niedersachsen Gesellschaft mit beschränkter Haftung\nGesellschaft mit beschränkter Haftung\nHannover\n\nDie Liste der Mitglieder des Aufsichtsrats wurde beim Registergericht eingereicht."
    },
    {
      "date": "2024-10-09",
      "original_text": "Sonstige Registerbekanntmachung\nMecklenburg-Vorpommern Amtsgericht Schwerin HRB 1501\nWohnungsbau- und Wohnungsverwaltungsgesellschaft mbH Neustadt-Glewe – Neustadt-Glewe",
      "type": "Sonstige Registerbekanntmachung",
      "state": "Mecklenburg-Vorpommern",
      "amtsgericht": "Amtsgericht Schwerin",
      "registernummer": "HRB 1501",
      "registerart": "HRB",
      "company_name": "Wohnungsbau- und Wohnungsverwaltungsgesellschaft mbH Neustadt-Glewe",
      "company_seat": "Neustadt-Glewe",
      "details": "09.10.2024 (Bekanntmachungsdatum)\n\nMecklenburg-Vorpommern Amtsgericht Schwerin HRB 1501\nSonstige Registerbekanntmachung 09.10.2024 (Eintragungsdatum)\n\nWohnungsbau- und Wohnungsverwaltungsgesellschaft mbH Neustadt-Glewe\nGesellschaft mit beschränkter Haftung\nNeustadt-Glewe\n\nEine Liste der Mitglieder des Aufsichtsrats ist zum Handelsregister eingereicht worden."
    },
    {
      "date": "2024-10-09",
      "original_text": "Löschungsankündigung\nNordrhein-Westfalen Amtsgericht Hagen HRB 11277\nWünschkraft UG (haftungsbeschränkt) – Schwerte",
      "type": "Löschungsankündigung",
      "state": "Nordrhein-Westfalen",
      "amtsgericht": "Amtsgericht Hagen",
      "registernummer": "HRB 11277",
      "registerart": "HRB",
      "company_name": "Wünschkraft UG (haftungsbeschränkt)",
      "company_seat": "Schwerte",
      "details": "09.10.2024 (Bekanntmachungsdatum)\n\nNordrhein-Westfalen Amtsgericht Hagen HRB 11277\nLöschungsankündigung\n\nWünschkraft UG (haftungsbeschränkt)\nGesellschaft mit beschränkter Haftung\nSchwerte\n\nIn obiger Handelsregistersache wird bekannt gemacht:\nDas Registergericht beabsichtigt, die im Handelsregister eingetragene Gesellschaft gemäß § 394 I FamFG wegen Vermögenslosigkeit von Amts wegen zu löschen. Gegen diese Verfügung kann Widerspruch eingelegt werden. Die Frist zur Erhebung eines Widerspruchs gegen die beabsichtigte Löschung von Amts wegen ist auf drei Monate festgesetzt.\n\nRechtsbehelfsbelehrung:\nGegen diese Verfügung können Sie Widerspruch einlegen.\n\nDer Widerspruch ist bei dem Amtsgericht Hagen, Heinitzstraße 42, 58097 Hagen schriftlich in deutscher Sprache oder zur Niederschrift der Geschäftsstelle einzulegen. Der Widerspruch kann auch zur Niederschrift der Geschäftsstelle eines jeden Amtsgerichts abgegeben werden.\n\nDer Widerspruch muss spätestens innerhalb der gesetzten Frist bei dem Amtsgericht Hagen eingegangen sein. Dies gilt auch dann, wenn der Widerspruch zur Geschäftsstelle eines anderen Amtsgerichtes abgegeben wurde. Die Frist beginnt mit der Veröffentlichung. Fällt das Ende der Frist auf einen Sonntag, einen allgemeinen Feiertag oder Sonnabend, so endet die Frist mit Ablauf des nächsten Werktages.\n\nDer Widerspruch muss die Bezeichnung der angefochtenen Verfügung sowie die Erklärung erhalten, dass Widerspruch gegen diese Verfügung eingelegt wird. Er ist zu unterzeichnen und soll begründet werden."
    },
    {
      "date": "2024-10-09",
      "original_text": "Registerbekanntmachung nach dem Umwandlungsgesetz\nBayern Amtsgericht Augsburg HRB 16731\nXWORK Druckvorstufe GmbH – Augsburg",
      "type": "Registerbekanntmachung nach dem Umwandlungsgesetz",
      "state": "Bayern",
      "amtsgericht": "Amtsgericht Augsburg",
      "registernummer": "HRB 16731",
      "registerart": "HRB",
      "company_name": "XWORK Druckvorstufe GmbH",
      "company_seat": "Augsburg",
      "details": "09.10.2024 (Bekanntmachungsdatum)\n\nBayern Amtsgericht Augsburg HRB 16731\nRegisterbekanntmachung nach dem Umwandlungsgesetz 08.10.2024 (Eintragungsdatum)\n\nXWORK Druckvorstufe GmbH\nGesellschaft mit beschränkter Haftung\nAugsburg\n\nDen Gläubigern der an der Verschmelzung beteiligten Rechtsträger ist, wenn sie binnen sechs Monaten nach dem Tag, an dem die Eintragung der Verschmelzung in das Register des Sitzes desjenigen Rechtsträgers, dessen Gläubiger sie sind, nach § 19 Abs. 3 UmwG als bekannt gemacht gilt, ihren Anspruch nach Grund und Höhe schriftlich anmelden, Sicherheit zu leisten, soweit sie nicht Befriedigung verlangen können. Dieses Recht steht den Gläubigern jedoch nur zu, wenn sie glaubhaft machen, dass durch die Verschmelzung die Erfüllung ihrer Forderung gefährdet wird."
    },
    {
      "date": "2024-10-09",
      "original_text": "Sonstige Registerbekanntmachung\nBaden-Württemberg Amtsgericht Ulm HRB 630206\nZF Friedrichshafen AG – Friedrichshafen",
      "type": "Sonstige Registerbekanntmachung",
      "state": "Baden-Württemberg",
      "amtsgericht": "Amtsgericht Ulm",
      "registernummer": "HRB 630206",
      "registerart": "HRB",
      "company_name": "ZF Friedrichshafen AG",
      "company_seat": "Friedrichshafen",
      "details": "09.10.2024 (Bekanntmachungsdatum)\n\nBaden-Württemberg Amtsgericht Ulm HRB 630206\nSonstige Registerbekanntmachung 09.10.2024 (Eintragungsdatum)\n\nZF Friedrichshafen AG\nAktiengesellschaft\nFriedrichshafen\n\nDie Gesellschaft hat am 07.10.2024 die Liste über die Zusammensetzung des Aufsichtsrats zum Handelsregister eingereicht."
    },
    {
      "date": "2024-10-09",
      "original_text": "Registerbekanntmachung nach dem Umwandlungsgesetz\nBayern Amtsgericht Kempten (Allgäu) HRB 14367\nZappe Fliesen GmbH – Kaufbeuren",
      "type": "Registerbekanntmachung nach dem Umwandlungsgesetz",
      "state": "Bayern",
      "amtsgericht": "Amtsgericht Kempten (Allgäu)",
      "registernummer": "HRB 14367",
      "registerart": "HRB",
      "company_name": "Zappe Fliesen GmbH",
      "company_seat": "Kaufbeuren",
      "details": "09.10.2024 (Bekanntmachungsdatum)\n\nBayern Amtsgericht Kempten (Allgäu) HRB 14367\nRegisterbekanntmachung nach dem Umwandlungsgesetz 08.10.2024 (Eintragungsdatum)\n\nZappe Fliesen GmbH\nGesellschaft mit beschränkter Haftung\nKaufbeuren\n\nDen Gläubigern der an der Verschmelzung beteiligten Rechtsträger ist, wenn sie binnen sechs Monaten nach dem Tag, an dem die Eintragung der Verschmelzung in das Register des Sitzes desjenigen Rechtsträgers, dessen Gläubiger sie sind, nach § 19 Abs. 3 UmwG als bekannt gemacht gilt, ihren Anspruch nach Grund und Höhe schriftlich anmelden, Sicherheit zu leisten, soweit sie nicht Befriedigung verlangen können. Dieses Recht steht den Gläubigern jedoch nur zu, wenn sie glaubhaft machen, dass durch die Verschmelzung die Erfüllung ihrer Forderung gefährdet wird."
    },
    {
      "date": "2024-10-09",
      "original_text": "Registerbekanntmachung nach dem Umwandlungsgesetz\nBayern Amtsgericht Kempten (Allgäu) HRB 13757\nZappe GmbH – Kaufbeuren",
      "type": "Registerbekanntmachung nach dem Umwandlungsgesetz",
      "state": "Bayern",
      "amtsgericht": "Amtsgericht Kempten (Allgäu)",
      "registernummer": "HRB 13757",
      "registerart": "HRB",
      "company_name": "Zappe GmbH",
      "company_seat": "Kaufbeuren",
      "details": "09.10.2024 (Bekanntmachungsdatum)\n\nBayern Amtsgericht Kempten (Allgäu) HRB 13757\nRegisterbekanntmachung nach dem Umwandlungsgesetz 08.10.2024 (Eintragungsdatum)\n\nZappe GmbH\nGesellschaft mit beschränkter Haftung\nKaufbeuren\n\nDen Gläubigern der an der Verschmelzung beteiligten Rechtsträger ist, wenn sie binnen sechs Monaten nach dem Tag, an dem die Eintragung der Verschmelzung in das Register des Sitzes desjenigen Rechtsträgers, dessen Gläubiger sie sind, nach § 19 Abs. 3 UmwG als bekannt gemacht gilt, ihren Anspruch nach Grund und Höhe schriftlich anmelden, Sicherheit zu leisten, soweit sie nicht Befriedigung verlangen können. Dieses Recht steht den Gläubigern jedoch nur zu, wenn sie glaubhaft machen, dass durch die Verschmelzung die Erfüllung ihrer Forderung gefährdet wird."
    },
    {
      "date": "2024-10-09",
      "original_text": "Löschungsankündigung\nNiedersachsen Amtsgericht Hildesheim HRB 205959\nbegeistert Konzeptagentur UG (haftungsbeschränkt) – Boffzen",
      "type": "Löschungsankündigung",
      "state": "Niedersachsen",
      "amtsgericht": "Amtsgericht Hildesheim",
      "registernummer": "HRB 205959",
      "registerart": "HRB",
      "company_name": "begeistert Konzeptagentur UG (haftungsbeschränkt)",
      "company_seat": "Boffzen",
      "details": "09.10.2024 (Bekanntmachungsdatum)\n\nNiedersachsen Amtsgericht Hildesheim HRB 205959\nLöschungsankündigung\n\nbegeistert Konzeptagentur UG (haftungsbeschränkt)\nGesellschaft mit beschränkter Haftung\nBoffzen\n\nDas Registergericht beabsichtigt, die Gesellschaft von Amts wegen nach § 395 FamFG zu löschen. Die Frist zur Erhebung eines Widerspruchs ist auf 1 Monat ab dieser Registerbekanntmachung festgesetzt."
    },
    {
      "date": "2024-10-09",
      "original_text": "Sonstige Registerbekanntmachung\nHessen Amtsgericht Fritzlar HRB 10142\nblue point Umschlag u. Logistik GmbH – Homberg (Efze)",
      "type": "Sonstige Registerbekanntmachung",
      "state": "Hessen",
      "amtsgericht": "Amtsgericht Fritzlar",
      "registernummer": "HRB 10142",
      "registerart": "HRB",
      "company_name": "blue point Umschlag u. Logistik GmbH",
      "company_seat": "Homberg (Efze)",
      "details": "09.10.2024 (Bekanntmachungsdatum)\n\nHessen Amtsgericht Fritzlar HRB 10142\nSonstige Registerbekanntmachung 09.10.2024 (Eintragungsdatum)\n\nblue point Umschlag u. Logistik GmbH\nGesellschaft mit beschränkter Haftung\nHomberg (Efze)\n\nDen Gläubigern der Gesellschaft, deren Forderungen begründet worden sind, bevor die Eintragung der Beendigung des Vertrags in das Handelsregister nach § 10 HGB bekannt gemacht worden ist, ist vom anderen Vertragsteil Sicherheit zu leisten, wenn sie sich binnen sechs Monaten nach dieser Bekanntmachung zu diesem Zweck bei ihm melden."
    },
    {
      "date": "2024-10-09",
      "original_text": "Einreichung neuer Dokumente\nBerlin Amtsgericht Berlin (Charlottenburg) HRB 76400\ncapiton AG – Berlin",
      "type": "Einreichung neuer Dokumente",
      "state": "Berlin",
      "amtsgericht": "Amtsgericht Berlin (Charlottenburg)",
      "registernummer": "HRB 76400",
      "registerart": "HRB",
      "company_name": "capiton AG",
      "company_seat": "Berlin",
      "details": "09.10.2024 (Bekanntmachungsdatum)\n\nBerlin Amtsgericht Berlin (Charlottenburg) HRB 76400\nEinreichung neuer Dokumente\n\ncapiton AG\nAktiengesellschaft\nBerlin\n\nAls nicht eingetragen wird veröffentlicht: Es wurde eine neue Liste der Aufsichtsratsmitglieder eingereicht (§ 106 AktG)."
    },
    {
      "date": "2024-10-09",
      "original_text": "Löschungsankündigung\nNordrhein-Westfalen Amtsgericht Siegburg HRB 13416\ndinnolab UG (haftungsbeschränkt) – Königswinter",
      "type": "Löschungsankündigung",
      "state": "Nordrhein-Westfalen",
      "amtsgericht": "Amtsgericht Siegburg",
      "registernummer": "HRB 13416",
      "registerart": "HRB",
      "company_name": "dinnolab UG (haftungsbeschränkt)",
      "company_seat": "Königswinter",
      "details": "09.10.2024 (Bekanntmachungsdatum)\n\nNordrhein-Westfalen Amtsgericht Siegburg HRB 13416\nLöschungsankündigung\n\ndinnolab UG (haftungsbeschränkt)\nGesellschaft mit beschränkter Haftung\nKönigswinter\n\nDas Registergericht hat glaubhafte Kenntnis erlangt, dass die Gesellschaft vermögenslos geworden ist. Es ist daher beabsichtigt, die Gesellschaft nach § 394 FamFG im Handelsregister wegen Vermögenslosigkeit zu löschen.\nEinwände gegen die Löschung sind durch Widerspruch binnen einer Frist von 3 Monaten geltend zu machen, andernfalls die Löschung erfolgen wird.\nEinzulegen ist der Widerspruch bei dem Amtsgericht Siegburg, Neue Poststraße 16, 53721 Siegburg, und zwar entweder schriftlich in deutscher Sprache oder mündlich zur Niederschrift der Geschäftsstelle. Der Widerspruch kann auch zur Niederschrift der Geschäftsstelle eines jeden Amtsgerichts abgegeben werden. Der Widerspruch ist binnen der in der Verfügung bestimmten Frist einzulegen. Die Frist ist nur gewahrt, wenn der Widerspruch rechtzeitig bei dem Amtsgericht Siegburg eingeht, auch wenn der Widerspruch zur Niederschrift der Geschäftsstelle eines anderen Amtsgerichts abgegeben wurde. Die Frist beginnt jeweils mit der schriftlichen Bekanntgabe der Verfügung an die Beteiligten. Kann die schriftliche Bekanntgabe an einen Beteiligten nicht bewirkt werden, beginnt die Frist spätestens mit Ablauf von fünf Monaten nach Erlass der Verfügung. Die Bekanntgabe ist entweder durch Zustellung oder am dritten Tage nach Aufgabe zur Post bewirkt.\nSofern die Löschung noch nicht erfolgt ist, kann der Widerspruch auch noch nach Ablauf der Frist eingelegt werden. Fällt das Ende der Frist auf einen Sonnabend, einen Sonntag oder einen allgemeinen Feiertag, endet die Frist mit Ablauf des nächsten Werktages. Der Widerspruch ist zu unterzeichnen. Eine Begründung des Widerspruchs ist nicht vorgeschrieben."
    },
    {
      "date": "2024-10-09",
      "original_text": "Registerbekanntmachung nach dem Umwandlungsgesetz\nHessen Amtsgericht Fulda HRA 6638\nelectriKS GmbH & Co. KG – Tann (Rhön)",
      "type": "Registerbekanntmachung nach dem Umwandlungsgesetz",
      "state": "Hessen",
      "amtsgericht": "Amtsgericht Fulda",
      "registernummer": "HRA 6638",
      "registerart": "HRA",
      "company_name": "electriKS GmbH & Co. KG",
      "company_seat": "Tann (Rhön)",
      "details": "09.10.2024 (Bekanntmachungsdatum)\n\nHessen Amtsgericht Fulda HRA 6638\nRegisterbekanntmachung nach dem Umwandlungsgesetz 09.10.2024 (Eintragungsdatum)\n\nelectriKS GmbH & Co. KG\nKommanditgesellschaft\nTann (Rhön)\n\nDen Gläubigern der an der Ausgliederung beteiligten Rechtsträger ist, wenn sie binnen sechs Monaten nach dem Tag, an dem die Eintragung der Ausgliederung in das Register des Sitzes desjenigen Rechtsträgers, dessen Gläubiger sie sind, nach §§ 125, 19 Absatz 3 UmwG bekannt gemacht worden ist, ihren Anspruch nach Grund und Höhe schriftlich anmelden, Sicherheit zu leisten, soweit sie nicht Befriedigung verlangen können. Dieses Recht steht den Gläubigern jedoch nur zu, wenn sie glaubhaft machen, dass durch die Ausgliederung die Erfüllung ihrer Forderung gefährdet wird."
    },
    {
      "date": "2024-10-09",
      "original_text": "Registerbekanntmachung nach dem Umwandlungsgesetz\nNordrhein-Westfalen Amtsgericht Bad Oeynhausen HRA 7910\nhoch 5 GmbH & Co. KG – Bünde",
      "type": "Registerbekanntmachung nach dem Umwandlungsgesetz",
      "state": "Nordrhein-Westfalen",
      "amtsgericht": "Amtsgericht Bad Oeynhausen",
      "registernummer": "HRA 7910",
      "registerart": "HRA",
      "company_name": "hoch 5 GmbH & Co. KG",
      "company_seat": "Bünde",
      "details": "09.10.2024 (Bekanntmachungsdatum)\n\nNordrhein-Westfalen Amtsgericht Bad Oeynhausen HRA 7910\nRegisterbekanntmachung nach dem Umwandlungsgesetz 09.10.2024 (Eintragungsdatum)\n\nhoch 5 GmbH & Co. KG\nKommanditgesellschaft\nBünde\n\nDen Gläubigern der an der Verschmelzung beteiligten Rechtsträger ist, wenn sie binnen sechs Monaten nach dem Tag, an dem die Eintragung der Verschmelzung in das Register des Sitzes desjenigen Rechtsträgers, dessen Gläubiger sie sind, nach § 19 Absatz 3 UmwG als bekanntgemacht gilt, ihren Anspruch nach Grund und Höhe schriftlich anmelden, Sicherheit zu leisten, soweit sie nicht Befriedigung verlangen können. Dieses Recht steht den Gläubigern jedoch nur zu, wenn sie glaubhaft machen, dass durch die Verschmelzung die Erfüllung ihrer Forderung gefährdet wird."
    },
    {
      "date": "2024-10-09",
      "original_text": "Einreichung neuer Dokumente\nBayern Amtsgericht Traunstein HRB 12329\nisar 1 Aktiengesellschaft für Planung + Design + Management – Rosenheim",
      "type": "Einreichung neuer Dokumente",
      "state": "Bayern",
      "amtsgericht": "Amtsgericht Traunstein",
      "registernummer": "HRB 12329",
      "registerart": "HRB",
      "company_name": "isar 1 Aktiengesellschaft für Planung + Design + Management",
      "company_seat": "Rosenheim",
      "details": "09.10.2024 (Bekanntmachungsdatum)\n\nBayern Amtsgericht Traunstein HRB 12329\nEinreichung neuer Dokumente\n\nisar 1 Aktiengesellschaft für Planung + Design + Management\nAktiengesellschaft\nRosenheim\n\nDem Amtsgericht Traunstein -Registergericht- ist eine Liste der Mitglieder des Aufsichtsrats eingereicht worden, § 106 AktG."
    },
    {
      "date": "2024-10-09",
      "original_text": "Registerbekanntmachung nach dem Umwandlungsgesetz\nBerlin Amtsgericht Berlin (Charlottenburg) HRA 62028\nit-structures GmbH & Co. KG – Berlin",
      "type": "Registerbekanntmachung nach dem Umwandlungsgesetz",
      "state": "Berlin",
      "amtsgericht": "Amtsgericht Berlin (Charlottenburg)",
      "registernummer": "HRA 62028",
      "registerart": "HRA",
      "company_name": "it-structures GmbH & Co. KG",
      "company_seat": "Berlin",
      "details": "09.10.2024 (Bekanntmachungsdatum)\n\nBerlin Amtsgericht Berlin (Charlottenburg) HRA 62028\nRegisterbekanntmachung nach dem Umwandlungsgesetz 08.10.2024 (Eintragungsdatum)\n\nit-structures GmbH & Co. KG\nKommanditgesellschaft\nBerlin\n\nZu Eintragungsnummer 5 vom 08.10.2024 wird als nicht eingetragen veröffentlicht: Den Gläubigern der an der Verschmelzung beteiligten Rechtsträger ist, wenn sie binnen sechs Monaten nach dem Tag, an dem die Eintragung der Verschmelzung in das Register des Sitzes desjenigen Rechtsträgers, dessen Gläubiger sie sind, als bekannt gemacht gilt, ihren Anspruch nach Grund und Höhe schriftlich anmelden, Sicherheit zu leisten, soweit sie nicht Befriedigung verlangen können. Dieses Recht steht den Gläubigern jedoch nur zu, wenn sie glaubhaft machen, dass durch die Verschmelzung die Erfüllung ihrer Forderung gefährdet wird. Das Recht, Sicherheitsleistung zu verlangen, steht Gläubigern nicht zu, die im Falle der Insolvenz ein Recht auf vorzugsweise Befriedigung aus einer Deckungsmasse haben, die nach gesetzlicher Vorschrift zu ihrem Schutz errichtet und staatlich überwacht ist."
    },
    {
      "date": "2024-10-09",
      "original_text": "Löschungsankündigung\nBaden-Württemberg Amtsgericht Ulm HRA 721909\nleo-solar GmbH & Co. KG – Ulm",
      "type": "Löschungsankündigung",
      "state": "Baden-Württemberg",
      "amtsgericht": "Amtsgericht Ulm",
      "registernummer": "HRA 721909",
      "registerart": "HRA",
      "company_name": "leo-solar GmbH & Co. KG",
      "company_seat": "Ulm",
      "details": "09.10.2024 (Bekanntmachungsdatum)\n\nBaden-Württemberg Amtsgericht Ulm HRA 721909\nLöschungsankündigung\n\nleo-solar GmbH & Co. KG\nKommanditgesellschaft\nUlm\n\nDas Gericht beabsichtigt, die Gesellschaft wegen Vermögenslosigkeit im Handelsregister von Amts wegen nach § 394 FamFG zu löschen. Die Frist zur Geltendmachung eines Widerspruchs gegen die beabsichtigte Löschung ist auf  einen Monat ab Veröffentlichung bestimmt."
    },
    {
      "date": "2024-10-09",
      "original_text": "Einreichung neuer Dokumente\nBayern Amtsgericht München HRB 90720\nmetafinanz Informationssysteme GmbH – München",
      "type": "Einreichung neuer Dokumente",
      "state": "Bayern",
      "amtsgericht": "Amtsgericht München",
      "registernummer": "HRB 90720",
      "registerart": "HRB",
      "company_name": "metafinanz Informationssysteme GmbH",
      "company_seat": "München",
      "details": "09.10.2024 (Bekanntmachungsdatum)\n\nBayern Amtsgericht München HRB 90720\nEinreichung neuer Dokumente 08.10.2024 (Eintragungsdatum)\n\nmetafinanz Informationssysteme GmbH\nGesellschaft mit beschränkter Haftung\nMünchen\n\nDem Amtsgericht München -Registergericht- ist eine Liste der Mitglieder des Aufsichtsrats eingereicht worden, § 52 Abs. 3 S. 2 GmbHG."
    },
    {
      "date": "2024-10-09",
      "original_text": "Sonstige Registerbekanntmachung\nBayern Amtsgericht München HRB 104337\nsonnenklar Reisebüro GmbH – München",
      "type": "Sonstige Registerbekanntmachung",
      "state": "Bayern",
      "amtsgericht": "Amtsgericht München",
      "registernummer": "HRB 104337",
      "registerart": "HRB",
      "company_name": "sonnenklar Reisebüro GmbH",
      "company_seat": "München",
      "details": "09.10.2024 (Bekanntmachungsdatum)\n\nBayern Amtsgericht München HRB 104337\nSonstige Registerbekanntmachung 08.10.2024 (Eintragungsdatum)\n\nsonnenklar Reisebüro GmbH\nGesellschaft mit beschränkter Haftung\nMünchen\n\nDen Gläubigern der Gesellschaft, deren Forderungen begründet worden sind, bevor die Eintragung der Beendigung des Beherrschungs- und Gewinnabführungsvertrages in das Handelsregister nach § 10 des Handelsgesetzbuches als bekanntgemacht gilt, hat der andere Vertragsteil Sicherheit zu leisten, wenn sie sich binnen sechs Monaten nach der Bekanntmachung der Eintragung zu diesem Zweck bei ihm melden."
    },
    {
      "date": "2024-10-09",
      "original_text": "Einreichung neuer Dokumente\nNiedersachsen Amtsgericht Hannover HRB 3791\nÜSTRA Hannoversche Verkehrsbetriebe Aktiengesellschaft – Hannover",
      "type": "Einreichung neuer Dokumente",
      "state": "Niedersachsen",
      "amtsgericht": "Amtsgericht Hannover",
      "registernummer": "HRB 3791",
      "registerart": "HRB",
      "company_name": "ÜSTRA Hannoversche Verkehrsbetriebe Aktiengesellschaft",
      "company_seat": "Hannover",
      "details": "09.10.2024 (Bekanntmachungsdatum)\n\nNiedersachsen Amtsgericht Hannover HRB 3791\nEinreichung neuer Dokumente 09.10.2024 (Eintragungsdatum)\n\nÜSTRA Hannoversche Verkehrsbetriebe Aktiengesellschaft\nAktiengesellschaft\nHannover\n\nDie Liste der Mitglieder des Aufsichtsrats wurde beim Registergericht eingereicht."
    }
  ]
}