{
  "date": "2024-10-30",
  "date_of_scrape": "2024-12-01T08:25:20.405Z",
  "tool_version": "0.2.0",
  "number_of_announcements": 146,
  "announcements": [
    {
      "date": "2024-10-30",
      "id": "92034",
      "original_text": "Löschungsankündigung\nBayern Amtsgericht München HRA 108560\nK.I.M. Wohnbau Perlacher Forst GmbH & Co. KG – Grünwald",
      "type": "Löschungsankündigung",
      "state": "Bayern",
      "amtsgericht": "Amtsgericht München",
      "registernummer": "HRA 108560",
      "registerart": "HRA",
      "company_name": "K.I.M. Wohnbau Perlacher Forst GmbH & Co. KG",
      "company_seat": "Grünwald",
      "details": "30.10.2024 (Bekanntmachungsdatum)\n\nBayern Amtsgericht München HRA 108560\nLöschungsankündigung 29.10.2024 (Eintragungsdatum)\n\nK.I.M. Wohnbau Perlacher Forst GmbH & Co. KG\nKommanditgesellschaft\nGrünwald\n\nDas Registergericht beabsichtigt, die im Handelsregister eingetragene Firma von Amts wegen nach § 31 Abs. 2 HGB zu löschen. Die Frist zur Erhebung eines Widerspruchs ist auf zwei Monate festgesetzt."
    },
    {
      "date": "2024-10-30",
      "id": "92035",
      "original_text": "Registerbekanntmachung nach dem Umwandlungsgesetz\nBayern Amtsgericht Nürnberg HRB 27496\nOWP Ost-West-Partner GmbH – Nürnberg",
      "type": "Registerbekanntmachung nach dem Umwandlungsgesetz",
      "state": "Bayern",
      "amtsgericht": "Amtsgericht Nürnberg",
      "registernummer": "HRB 27496",
      "registerart": "HRB",
      "company_name": "OWP Ost-West-Partner GmbH",
      "company_seat": "Nürnberg",
      "details": "30.10.2024 (Bekanntmachungsdatum)\n\nBayern Amtsgericht Nürnberg HRB 27496\nRegisterbekanntmachung nach dem Umwandlungsgesetz 29.10.2024 (Eintragungsdatum)\n\nOWP Ost-West-Partner GmbH\nGesellschaft mit beschränkter Haftung\nNürnberg\n\nDen Gläubigern der an der Verschmelzung beteiligten Rechtsträger ist, wenn sie binnen sechs Monaten nach dem Tag, an dem die Eintragung der Verschmelzung in das Register des Sitzes desjenigen Rechtsträgers, dessen Gläubiger sie sind, nach § 19 Abs. 3 UmwG als bekannt gemacht gilt, ihren Anspruch nach Grund und Höhe schriftlich anmelden, Sicherheit zu leisten, soweit sie nicht Befriedigung verlangen können. Dieses Recht steht den Gläubigern jedoch nur zu, wenn sie glaubhaft machen, dass durch die Verschmelzung die Erfüllung ihrer Forderung gefährdet wird."
    },
    {
      "date": "2024-10-30",
      "id": "92036",
      "original_text": "Registerbekanntmachung nach dem Umwandlungsgesetz\nBayern Amtsgericht München HRB 190912\nVTC BS Group GmbH – Grünwald",
      "type": "Registerbekanntmachung nach dem Umwandlungsgesetz",
      "state": "Bayern",
      "amtsgericht": "Amtsgericht München",
      "registernummer": "HRB 190912",
      "registerart": "HRB",
      "company_name": "VTC BS Group GmbH",
      "company_seat": "Grünwald",
      "details": "30.10.2024 (Bekanntmachungsdatum)\n\nBayern Amtsgericht München HRB 190912\nRegisterbekanntmachung nach dem Umwandlungsgesetz 29.10.2024 (Eintragungsdatum)\n\nVTC BS Group GmbH\nGesellschaft mit beschränkter Haftung\nGrünwald\n\nDen Gläubigern der an der Verschmelzung beteiligten Rechtsträger ist, wenn sie binnen sechs Monaten nach dem Tag, an dem die Eintragung der Verschmelzung in das Register des Sitzes desjenigen Rechtsträgers, dessen Gläubiger sie sind, nach § 19 Abs. 3 UmwG als bekannt gemacht gilt, ihren Anspruch nach Grund und Höhe schriftlich anmelden, Sicherheit zu leisten, soweit sie nicht Befriedigung verlangen können. Dieses Recht steht den Gläubigern jedoch nur zu, wenn sie glaubhaft machen, dass durch die Verschmelzung die Erfüllung ihrer Forderung gefährdet wird."
    },
    {
      "date": "2024-10-30",
      "id": "92037",
      "original_text": "Registerbekanntmachung nach dem Umwandlungsgesetz\nBayern Amtsgericht München HRB 273108\nGME Ventures GmbH – Unterhaching",
      "type": "Registerbekanntmachung nach dem Umwandlungsgesetz",
      "state": "Bayern",
      "amtsgericht": "Amtsgericht München",
      "registernummer": "HRB 273108",
      "registerart": "HRB",
      "company_name": "GME Ventures GmbH",
      "company_seat": "Unterhaching",
      "details": "30.10.2024 (Bekanntmachungsdatum)\n\nBayern Amtsgericht München HRB 273108\nRegisterbekanntmachung nach dem Umwandlungsgesetz 29.10.2024 (Eintragungsdatum)\n\nGME Ventures GmbH\nGesellschaft mit beschränkter Haftung\nUnterhaching\n\nDen Gläubigern des formwechselnden Rechtsträgers ist, wenn sie binnen sechs Monaten nach dem Tag, an dem die Eintragung des Formwechsels nach § 201 UmwG als bekannt gemacht gilt, ihren Anspruch nach Grund und Höhe schriftlich anmelden, Sicherheit zu leisten, soweit sie nicht Befriedigung verlangen können. Dieses Recht steht den Gläubigern jedoch nur zu, wenn sie glaubhaft machen, dass durch den Formwechsel die Erfüllung ihrer Forderung gefährdet wird."
    },
    {
      "date": "2024-10-30",
      "id": "92038",
      "original_text": "Löschungsankündigung\nBayern Amtsgericht München HRB 232601\nFleming-Residenz GmbH – Grünwald",
      "type": "Löschungsankündigung",
      "state": "Bayern",
      "amtsgericht": "Amtsgericht München",
      "registernummer": "HRB 232601",
      "registerart": "HRB",
      "company_name": "Fleming-Residenz GmbH",
      "company_seat": "Grünwald",
      "details": "30.10.2024 (Bekanntmachungsdatum)\n\nBayern Amtsgericht München HRB 232601\nLöschungsankündigung 29.10.2024 (Eintragungsdatum)\n\nFleming-Residenz GmbH\nGesellschaft mit beschränkter Haftung\nGrünwald\n\nDas Registergericht beabsichtigt, die im Handelsregister eingetragene Gesellschaft wegen Vermögenslosigkeit von Amts wegen nach § 394 FamFG zu löschen. Die Frist zur Erhebung eines Widerspruchs ist auf drei Monate festgesetzt."
    },
    {
      "date": "2024-10-30",
      "id": "92039",
      "original_text": "Registerbekanntmachung nach dem Umwandlungsgesetz\nBayern Amtsgericht Nürnberg HRB 28327\nGemeindewerke Wendelstein Bürgerkraftwerk GmbH – Wendelstein",
      "type": "Registerbekanntmachung nach dem Umwandlungsgesetz",
      "state": "Bayern",
      "amtsgericht": "Amtsgericht Nürnberg",
      "registernummer": "HRB 28327",
      "registerart": "HRB",
      "company_name": "Gemeindewerke Wendelstein Bürgerkraftwerk GmbH",
      "company_seat": "Wendelstein",
      "details": "30.10.2024 (Bekanntmachungsdatum)\n\nBayern Amtsgericht Nürnberg HRB 28327\nRegisterbekanntmachung nach dem Umwandlungsgesetz 29.10.2024 (Eintragungsdatum)\n\nGemeindewerke Wendelstein Bürgerkraftwerk GmbH\nGesellschaft mit beschränkter Haftung\nWendelstein\n\nDen Gläubigern der an der Verschmelzung beteiligten Rechtsträger ist, wenn sie binnen sechs Monaten nach dem Tag, an dem die Eintragung der Verschmelzung in das Register des Sitzes desjenigen Rechtsträgers, dessen Gläubiger sie sind, nach § 19 Abs. 3 UmwG als bekannt gemacht gilt, ihren Anspruch nach Grund und Höhe schriftlich anmelden, Sicherheit zu leisten, soweit sie nicht Befriedigung verlangen können. Dieses Recht steht den Gläubigern jedoch nur zu, wenn sie glaubhaft machen, dass durch die Verschmelzung die Erfüllung ihrer Forderung gefährdet wird."
    },
    {
      "date": "2024-10-30",
      "id": "92040",
      "original_text": "Registerbekanntmachung nach dem Umwandlungsgesetz\nBayern Amtsgericht Memmingen HRA 14163\nWelsch Bausanierung e.K. – Neu-Ulm",
      "type": "Registerbekanntmachung nach dem Umwandlungsgesetz",
      "state": "Bayern",
      "amtsgericht": "Amtsgericht Memmingen",
      "registernummer": "HRA 14163",
      "registerart": "HRA",
      "company_name": "Welsch Bausanierung e.K.",
      "company_seat": "Neu-Ulm",
      "details": "30.10.2024 (Bekanntmachungsdatum)\n\nBayern Amtsgericht Memmingen HRA 14163\nRegisterbekanntmachung nach dem Umwandlungsgesetz 29.10.2024 (Eintragungsdatum)\n\nWelsch Bausanierung e.K.\nEinzelkaufmann / Einzelkauffrau\nNeu-Ulm\n\nDen Gläubigern der an der Ausgliederung beteiligten Rechtsträger ist, wenn sie binnen sechs Monaten nach dem Tag, an dem die Eintragung der Ausgliederung in das Register des Sitzes desjenigen Rechtsträgers, dessen Gläubiger sie sind, nach §§ 125, 19 Abs. 3 UmwG als bekannt gemacht gilt, ihren Anspruch nach Grund und Höhe schriftlich anmelden, Sicherheit zu leisten, soweit sie nicht Befriedigung verlangen können. Dieses Recht steht den Gläubigern jedoch nur zu, wenn sie glaubhaft machen, dass durch die Ausgliederung die Erfüllung ihrer Forderung gefährdet wird."
    },
    {
      "date": "2024-10-30",
      "id": "92041",
      "original_text": "Löschungsankündigung\nBayern Amtsgericht Landshut HRB 13476\nMarosi Bau und Erdbau GmbH – Landshut",
      "type": "Löschungsankündigung",
      "state": "Bayern",
      "amtsgericht": "Amtsgericht Landshut",
      "registernummer": "HRB 13476",
      "registerart": "HRB",
      "company_name": "Marosi Bau und Erdbau GmbH",
      "company_seat": "Landshut",
      "details": "30.10.2024 (Bekanntmachungsdatum)\n\nBayern Amtsgericht Landshut HRB 13476\nLöschungsankündigung\n\nMarosi Bau und Erdbau GmbH\nGesellschaft mit beschränkter Haftung\nLandshut\n\nDas Registergericht beabsichtigt, die im Handelsregister eingetragene Gesellschaft wegen Vermögenslosigkeit von Amts wegen nach § 394 FamFG zu löschen. #insert(Text=\"zztb_V_Widerspruchsfrist\")"
    },
    {
      "date": "2024-10-30",
      "id": "92042",
      "original_text": "Registerbekanntmachung nach dem Umwandlungsgesetz\nBayern Amtsgericht Nürnberg HRB 31507\nEMPOREX GmbH – Schwabach",
      "type": "Registerbekanntmachung nach dem Umwandlungsgesetz",
      "state": "Bayern",
      "amtsgericht": "Amtsgericht Nürnberg",
      "registernummer": "HRB 31507",
      "registerart": "HRB",
      "company_name": "EMPOREX GmbH",
      "company_seat": "Schwabach",
      "details": "30.10.2024 (Bekanntmachungsdatum)\n\nBayern Amtsgericht Nürnberg HRB 31507\nRegisterbekanntmachung nach dem Umwandlungsgesetz 29.10.2024 (Eintragungsdatum)\n\nEMPOREX GmbH\nGesellschaft mit beschränkter Haftung\nSchwabach\n\nDen Gläubigern der an der Verschmelzung beteiligten Rechtsträger ist, wenn sie binnen sechs Monaten nach dem Tag, an dem die Eintragung der Verschmelzung in das Register des Sitzes desjenigen Rechtsträgers, dessen Gläubiger sie sind, nach § 19 Abs. 3 UmwG als bekannt gemacht gilt, ihren Anspruch nach Grund und Höhe schriftlich anmelden, Sicherheit zu leisten, soweit sie nicht Befriedigung verlangen können. Dieses Recht steht den Gläubigern jedoch nur zu, wenn sie glaubhaft machen, dass durch die Verschmelzung die Erfüllung ihrer Forderung gefährdet wird."
    },
    {
      "date": "2024-10-30",
      "id": "92043",
      "original_text": "Registerbekanntmachung nach dem Umwandlungsgesetz\nBayern Amtsgericht Kempten (Allgäu) HRB 17799\nalmapharm GmbH – Wildpoldsried",
      "type": "Registerbekanntmachung nach dem Umwandlungsgesetz",
      "state": "Bayern",
      "amtsgericht": "Amtsgericht Kempten (Allgäu)",
      "registernummer": "HRB 17799",
      "registerart": "HRB",
      "company_name": "almapharm GmbH",
      "company_seat": "Wildpoldsried",
      "details": "30.10.2024 (Bekanntmachungsdatum)\n\nBayern Amtsgericht Kempten (Allgäu) HRB 17799\nRegisterbekanntmachung nach dem Umwandlungsgesetz 29.10.2024 (Eintragungsdatum)\n\nalmapharm GmbH\nGesellschaft mit beschränkter Haftung\nWildpoldsried\n\nDen Gläubigern der an der Verschmelzung beteiligten Rechtsträger ist, wenn sie binnen sechs Monaten nach dem Tag, an dem die Eintragung der Verschmelzung in das Register des Sitzes desjenigen Rechtsträgers, dessen Gläubiger sie sind, nach § 19 Abs. 3 UmwG als bekannt gemacht gilt, ihren Anspruch nach Grund und Höhe schriftlich anmelden, Sicherheit zu leisten, soweit sie nicht Befriedigung verlangen können. Dieses Recht steht den Gläubigern jedoch nur zu, wenn sie glaubhaft machen, dass durch die Verschmelzung die Erfüllung ihrer Forderung gefährdet wird."
    },
    {
      "date": "2024-10-30",
      "id": "92044",
      "original_text": "Registerbekanntmachung nach dem Umwandlungsgesetz\nBayern Amtsgericht Nürnberg HRB 28926\nCortex Korkvertriebs GmbH – Nürnberg",
      "type": "Registerbekanntmachung nach dem Umwandlungsgesetz",
      "state": "Bayern",
      "amtsgericht": "Amtsgericht Nürnberg",
      "registernummer": "HRB 28926",
      "registerart": "HRB",
      "company_name": "Cortex Korkvertriebs GmbH",
      "company_seat": "Nürnberg",
      "details": "30.10.2024 (Bekanntmachungsdatum)\n\nBayern Amtsgericht Nürnberg HRB 28926\nRegisterbekanntmachung nach dem Umwandlungsgesetz 29.10.2024 (Eintragungsdatum)\n\nCortex Korkvertriebs GmbH\nGesellschaft mit beschränkter Haftung\nNürnberg\n\nDen Gläubigern der an der Verschmelzung beteiligten Rechtsträger ist, wenn sie binnen sechs Monaten nach dem Tag, an dem die Eintragung der Verschmelzung in das Register des Sitzes desjenigen Rechtsträgers, dessen Gläubiger sie sind, nach § 19 Abs. 3 UmwG als bekannt gemacht gilt, ihren Anspruch nach Grund und Höhe schriftlich anmelden, Sicherheit zu leisten, soweit sie nicht Befriedigung verlangen können. Dieses Recht steht den Gläubigern jedoch nur zu, wenn sie glaubhaft machen, dass durch die Verschmelzung die Erfüllung ihrer Forderung gefährdet wird."
    },
    {
      "date": "2024-10-30",
      "id": "92045",
      "original_text": "Registerbekanntmachung nach dem Umwandlungsgesetz\nBayern Amtsgericht Kempten (Allgäu) HRB 17672\nborica Zwei GmbH – Wildpoldsried",
      "type": "Registerbekanntmachung nach dem Umwandlungsgesetz",
      "state": "Bayern",
      "amtsgericht": "Amtsgericht Kempten (Allgäu)",
      "registernummer": "HRB 17672",
      "registerart": "HRB",
      "company_name": "borica Zwei GmbH",
      "company_seat": "Wildpoldsried",
      "details": "30.10.2024 (Bekanntmachungsdatum)\n\nBayern Amtsgericht Kempten (Allgäu) HRB 17672\nRegisterbekanntmachung nach dem Umwandlungsgesetz 29.10.2024 (Eintragungsdatum)\n\nborica Zwei GmbH\nGesellschaft mit beschränkter Haftung\nWildpoldsried\n\nDen Gläubigern der an der Verschmelzung beteiligten Rechtsträger ist, wenn sie binnen sechs Monaten nach dem Tag, an dem die Eintragung der Verschmelzung in das Register des Sitzes desjenigen Rechtsträgers, dessen Gläubiger sie sind, nach § 19 Abs. 3 UmwG als bekannt gemacht gilt, ihren Anspruch nach Grund und Höhe schriftlich anmelden, Sicherheit zu leisten, soweit sie nicht Befriedigung verlangen können. Dieses Recht steht den Gläubigern jedoch nur zu, wenn sie glaubhaft machen, dass durch die Verschmelzung die Erfüllung ihrer Forderung gefährdet wird."
    },
    {
      "date": "2024-10-30",
      "id": "92046",
      "original_text": "Registerbekanntmachung nach dem Umwandlungsgesetz\nBayern Amtsgericht Augsburg HRA 20577\nTT-Waffenhandels- und Präzisionsfertigung GmbH & Co. KG – Bächingen a.d.Brenz",
      "type": "Registerbekanntmachung nach dem Umwandlungsgesetz",
      "state": "Bayern",
      "amtsgericht": "Amtsgericht Augsburg",
      "registernummer": "HRA 20577",
      "registerart": "HRA",
      "company_name": "TT-Waffenhandels- und Präzisionsfertigung GmbH & Co. KG",
      "company_seat": "Bächingen a.d.Brenz",
      "details": "30.10.2024 (Bekanntmachungsdatum)\n\nBayern Amtsgericht Augsburg HRA 20577\nRegisterbekanntmachung nach dem Umwandlungsgesetz 29.10.2024 (Eintragungsdatum)\n\nTT-Waffenhandels- und Präzisionsfertigung GmbH & Co. KG\nKommanditgesellschaft\nBächingen a.d.Brenz\n\nDen Gläubigern der an der Verschmelzung beteiligten Rechtsträger ist, wenn sie binnen sechs Monaten nach dem Tag, an dem die Eintragung der Verschmelzung in das Register des Sitzes desjenigen Rechtsträgers, dessen Gläubiger sie sind, nach § 19 Abs. 3 UmwG als bekannt gemacht gilt, ihren Anspruch nach Grund und Höhe schriftlich anmelden, Sicherheit zu leisten, soweit sie nicht Befriedigung verlangen können. Dieses Recht steht den Gläubigern jedoch nur zu, wenn sie glaubhaft machen, dass durch die Verschmelzung die Erfüllung ihrer Forderung gefährdet wird."
    },
    {
      "date": "2024-10-30",
      "id": "92047",
      "original_text": "Registerbekanntmachung nach dem Umwandlungsgesetz\nBayern Amtsgericht München HRB 91203\nMKV Verlagsgesellschaft mbH – München",
      "type": "Registerbekanntmachung nach dem Umwandlungsgesetz",
      "state": "Bayern",
      "amtsgericht": "Amtsgericht München",
      "registernummer": "HRB 91203",
      "registerart": "HRB",
      "company_name": "MKV Verlagsgesellschaft mbH",
      "company_seat": "München",
      "details": "30.10.2024 (Bekanntmachungsdatum)\n\nBayern Amtsgericht München HRB 91203\nRegisterbekanntmachung nach dem Umwandlungsgesetz 29.10.2024 (Eintragungsdatum)\n\nMKV Verlagsgesellschaft mbH\nGesellschaft mit beschränkter Haftung\nMünchen\n\nDen Gläubigern der an der Verschmelzung beteiligten Rechtsträger ist, wenn sie binnen sechs Monaten nach dem Tag, an dem die Eintragung der Verschmelzung in das Register des Sitzes desjenigen Rechtsträgers, dessen Gläubiger sie sind, nach § 19 Abs. 3 UmwG als bekannt gemacht gilt, ihren Anspruch nach Grund und Höhe schriftlich anmelden, Sicherheit zu leisten, soweit sie nicht Befriedigung verlangen können. Dieses Recht steht den Gläubigern jedoch nur zu, wenn sie glaubhaft machen, dass durch die Verschmelzung die Erfüllung ihrer Forderung gefährdet wird."
    },
    {
      "date": "2024-10-30",
      "id": "92048",
      "original_text": "Sonstige Registerbekanntmachung\nBayern Amtsgericht München HRB 205688\nCHETRA Dichtungstechnik AG – Kirchheim b.München",
      "type": "Sonstige Registerbekanntmachung",
      "state": "Bayern",
      "amtsgericht": "Amtsgericht München",
      "registernummer": "HRB 205688",
      "registerart": "HRB",
      "company_name": "CHETRA Dichtungstechnik AG",
      "company_seat": "Kirchheim b.München",
      "details": "30.10.2024 (Bekanntmachungsdatum)\n\nBayern Amtsgericht München HRB 205688\nSonstige Registerbekanntmachung\n\nCHETRA Dichtungstechnik AG\nAktiengesellschaft\nKirchheim b.München\n\nDen Gläubigern der Gesellschaft, deren Forderungen begründet worden sind, bevor die Eintragung der Beendigung des Teilgewinnabführungsvertrages in das Handelsregister nach § 10 des Handelsgesetzbuches als bekanntgemacht gilt, hat der andere Vertragsteil Sicherheit zu leisten, wenn sie sich binnen sechs Monaten nach der Bekanntmachung der Eintragung zu diesem Zweck bei ihm melden."
    },
    {
      "date": "2024-10-30",
      "id": "92049",
      "original_text": "Registerbekanntmachung nach dem Umwandlungsgesetz\nBayern Amtsgericht München HRB 290684\nBlitz 24-2 GmbH – München",
      "type": "Registerbekanntmachung nach dem Umwandlungsgesetz",
      "state": "Bayern",
      "amtsgericht": "Amtsgericht München",
      "registernummer": "HRB 290684",
      "registerart": "HRB",
      "company_name": "Blitz 24-2 GmbH",
      "company_seat": "München",
      "details": "30.10.2024 (Bekanntmachungsdatum)\n\nBayern Amtsgericht München HRB 290684\nRegisterbekanntmachung nach dem Umwandlungsgesetz 29.10.2024 (Eintragungsdatum)\n\nBlitz 24-2 GmbH\nGesellschaft mit beschränkter Haftung\nMünchen\n\nDen Gläubigern der an der Verschmelzung beteiligten Rechtsträger ist, wenn sie binnen sechs Monaten nach dem Tag, an dem die Eintragung der Verschmelzung in das Register des Sitzes desjenigen Rechtsträgers, dessen Gläubiger sie sind, nach § 19 Abs. 3 UmwG als bekannt gemacht gilt, ihren Anspruch nach Grund und Höhe schriftlich anmelden, Sicherheit zu leisten, soweit sie nicht Befriedigung verlangen können. Dieses Recht steht den Gläubigern jedoch nur zu, wenn sie glaubhaft machen, dass durch die Verschmelzung die Erfüllung ihrer Forderung gefährdet wird."
    },
    {
      "date": "2024-10-30",
      "id": "92050",
      "original_text": "Registerbekanntmachung nach dem Umwandlungsgesetz\nBayern Amtsgericht Fürth HRA 12308\nschraff.net e.K. – Seukendorf",
      "type": "Registerbekanntmachung nach dem Umwandlungsgesetz",
      "state": "Bayern",
      "amtsgericht": "Amtsgericht Fürth",
      "registernummer": "HRA 12308",
      "registerart": "HRA",
      "company_name": "schraff.net e.K.",
      "company_seat": "Seukendorf",
      "details": "30.10.2024 (Bekanntmachungsdatum)\n\nBayern Amtsgericht Fürth HRA 12308\nRegisterbekanntmachung nach dem Umwandlungsgesetz 29.10.2024 (Eintragungsdatum)\n\nschraff.net e.K.\nEinzelkaufmann / Einzelkauffrau\nSeukendorf\n\nDen Gläubigern der an der Ausgliederung beteiligten Rechtsträger ist, wenn sie binnen sechs Monaten nach dem Tag, an dem die Eintragung der Ausgliederung in das Register des Sitzes desjenigen Rechtsträgers, dessen Gläubiger sie sind, nach §§ 125, 19 Abs. 3 UmwG als bekannt gemacht gilt, ihren Anspruch nach Grund und Höhe schriftlich anmelden, Sicherheit zu leisten, soweit sie nicht Befriedigung verlangen können. Dieses Recht steht den Gläubigern jedoch nur zu, wenn sie glaubhaft machen, dass durch die Ausgliederung die Erfüllung ihrer Forderung gefährdet wird."
    },
    {
      "date": "2024-10-30",
      "id": "92051",
      "original_text": "Registerbekanntmachung nach dem Umwandlungsgesetz\nBayern Amtsgericht Bamberg HRA 9854\nRobert Neudeck GmbH & Co. KG – Bischberg, GT Trosdorf",
      "type": "Registerbekanntmachung nach dem Umwandlungsgesetz",
      "state": "Bayern",
      "amtsgericht": "Amtsgericht Bamberg",
      "registernummer": "HRA 9854",
      "registerart": "HRA",
      "company_name": "Robert Neudeck GmbH & Co. KG",
      "company_seat": "Bischberg, GT Trosdorf",
      "details": "30.10.2024 (Bekanntmachungsdatum)\n\nBayern Amtsgericht Bamberg HRA 9854\nRegisterbekanntmachung nach dem Umwandlungsgesetz 29.10.2024 (Eintragungsdatum)\n\nRobert Neudeck GmbH & Co. KG\nKommanditgesellschaft\nBischberg, GT Trosdorf\n\nDen Gläubigern der an der Verschmelzung beteiligten Rechtsträger ist, wenn sie binnen sechs Monaten nach dem Tag, an dem die Eintragung der Verschmelzung in das Register des Sitzes desjenigen Rechtsträgers, dessen Gläubiger sie sind, nach § 19 Abs. 3 UmwG als bekannt gemacht gilt, ihren Anspruch nach Grund und Höhe schriftlich anmelden, Sicherheit zu leisten, soweit sie nicht Befriedigung verlangen können. Dieses Recht steht den Gläubigern jedoch nur zu, wenn sie glaubhaft machen, dass durch die Verschmelzung die Erfüllung ihrer Forderung gefährdet wird."
    },
    {
      "date": "2024-10-30",
      "id": "92052",
      "original_text": "Registerbekanntmachung nach dem Umwandlungsgesetz\nBayern Amtsgericht München HRB 202183\nH.F.S. Immobilienfonds Deutschland 8 Komplementär GmbH – München",
      "type": "Registerbekanntmachung nach dem Umwandlungsgesetz",
      "state": "Bayern",
      "amtsgericht": "Amtsgericht München",
      "registernummer": "HRB 202183",
      "registerart": "HRB",
      "company_name": "H.F.S. Immobilienfonds Deutschland 8 Komplementär GmbH",
      "company_seat": "München",
      "details": "30.10.2024 (Bekanntmachungsdatum)\n\nBayern Amtsgericht München HRB 202183\nRegisterbekanntmachung nach dem Umwandlungsgesetz 29.10.2024 (Eintragungsdatum)\n\nH.F.S. Immobilienfonds Deutschland 8 Komplementär GmbH\nGesellschaft mit beschränkter Haftung\nMünchen\n\nDen Gläubigern der an der Verschmelzung beteiligten Rechtsträger ist, wenn sie binnen sechs Monaten nach dem Tag, an dem die Eintragung der Verschmelzung in das Register des Sitzes desjenigen Rechtsträgers, dessen Gläubiger sie sind, nach § 19 Abs. 3 UmwG als bekannt gemacht gilt, ihren Anspruch nach Grund und Höhe schriftlich anmelden, Sicherheit zu leisten, soweit sie nicht Befriedigung verlangen können. Dieses Recht steht den Gläubigern jedoch nur zu, wenn sie glaubhaft machen, dass durch die Verschmelzung die Erfüllung ihrer Forderung gefährdet wird."
    },
    {
      "date": "2024-10-30",
      "id": "92053",
      "original_text": "Registerbekanntmachung nach dem Umwandlungsgesetz\nBaden-Württemberg Amtsgericht Stuttgart HRB 765190\nB & R Vermögens Verwaltung GmbH – Reutlingen",
      "type": "Registerbekanntmachung nach dem Umwandlungsgesetz",
      "state": "Baden-Württemberg",
      "amtsgericht": "Amtsgericht Stuttgart",
      "registernummer": "HRB 765190",
      "registerart": "HRB",
      "company_name": "B & R Vermögens Verwaltung GmbH",
      "company_seat": "Reutlingen",
      "details": "30.10.2024 (Bekanntmachungsdatum)\n\nBaden-Württemberg Amtsgericht Stuttgart HRB 765190\nRegisterbekanntmachung nach dem Umwandlungsgesetz 30.10.2024 (Eintragungsdatum)\n\nB & R Vermögens Verwaltung GmbH\nGesellschaft mit beschränkter Haftung\nReutlingen\n\nAls nicht eingetragen wird bekanntgemacht:\nDen Gläubigern der an der Verschmelzung beteiligten Rechtsträger ist, wenn sie binnen sechs Monaten nach dem Tag, an dem die Eintragung der Verschmelzung in das Register des Sitzes desjenigen Rechtsträgers, dessen Gläubiger sie sind, nach § 19 Abs. 3 UmwG als bekanntgemacht gilt, ihren Anspruch nach Grund und Höhe schriftlich anmelden, Sicherheit zu leisten, soweit sie nicht Befriedigung verlangen können. Dieses Recht steht den Gläubigern jedoch nur zu, wenn sie glaubhaft machen, dass durch die Verschmelzung die Erfüllung ihrer Forderung gefährdet wird."
    },
    {
      "date": "2024-10-30",
      "id": "92054",
      "original_text": "Einreichung neuer Dokumente\nSaarland Amtsgericht Saarbrücken HRB 16708\nGWBS Netzgesellschaft mbH – Bous",
      "type": "Einreichung neuer Dokumente",
      "state": "Saarland",
      "amtsgericht": "Amtsgericht Saarbrücken",
      "registernummer": "HRB 16708",
      "registerart": "HRB",
      "company_name": "GWBS Netzgesellschaft mbH",
      "company_seat": "Bous",
      "details": "30.10.2024 (Bekanntmachungsdatum)\n\nSaarland Amtsgericht Saarbrücken HRB 16708\nEinreichung neuer Dokumente\n\nGWBS Netzgesellschaft mbH\nGesellschaft mit beschränkter Haftung\nBous\n\nDie Geschäftsführung der Gesellschaft hat eine Liste der Mitglieder des Aufsichtsrats zum Handelsregister eingereicht (§ 52 Abs. 3 Satz 2 GmbHG)."
    },
    {
      "date": "2024-10-30",
      "id": "92055",
      "original_text": "Löschungsankündigung\nBerlin Amtsgericht Berlin (Charlottenburg) HRB 204055\nC.B. Facility Management GmbH – Berlin",
      "type": "Löschungsankündigung",
      "state": "Berlin",
      "amtsgericht": "Amtsgericht Berlin (Charlottenburg)",
      "registernummer": "HRB 204055",
      "registerart": "HRB",
      "company_name": "C.B. Facility Management GmbH",
      "company_seat": "Berlin",
      "details": "30.10.2024 (Bekanntmachungsdatum)\n\nBerlin Amtsgericht Berlin (Charlottenburg) HRB 204055\nLöschungsankündigung\n\nC.B. Facility Management GmbH\nGesellschaft mit beschränkter Haftung\nBerlin\n\nBei der nachstehenden Gesellschaft wird das Amtslöschungsverfahren gemäß § 394 FamFG eingeleitet. Widerspruchsfrist 6 Wochen"
    },
    {
      "date": "2024-10-30",
      "id": "92056",
      "original_text": "Einreichung neuer Dokumente\nBaden-Württemberg Amtsgericht Stuttgart HRB 790576\nDATABAU Holding SE – Stuttgart",
      "type": "Einreichung neuer Dokumente",
      "state": "Baden-Württemberg",
      "amtsgericht": "Amtsgericht Stuttgart",
      "registernummer": "HRB 790576",
      "registerart": "HRB",
      "company_name": "DATABAU Holding SE",
      "company_seat": "Stuttgart",
      "details": "30.10.2024 (Bekanntmachungsdatum)\n\nBaden-Württemberg Amtsgericht Stuttgart HRB 790576\nEinreichung neuer Dokumente\n\nDATABAU Holding SE\nEuropäische Aktiengesellschaft (SE)\nStuttgart\n\nDie Gesellschaft hat am 29.10.2024 die Liste über die Zusammensetzung des Aufsichtsrats zum Handelsregister eingereicht."
    },
    {
      "date": "2024-10-30",
      "id": "92057",
      "original_text": "Einreichung neuer Dokumente\nBaden-Württemberg Amtsgericht Ulm HRB 700098\nStädtische Wohnbau - Gesellschaft mbH Heubach – Heubach",
      "type": "Einreichung neuer Dokumente",
      "state": "Baden-Württemberg",
      "amtsgericht": "Amtsgericht Ulm",
      "registernummer": "HRB 700098",
      "registerart": "HRB",
      "company_name": "Städtische Wohnbau - Gesellschaft mbH Heubach",
      "company_seat": "Heubach",
      "details": "30.10.2024 (Bekanntmachungsdatum)\n\nBaden-Württemberg Amtsgericht Ulm HRB 700098\nEinreichung neuer Dokumente\n\nStädtische Wohnbau - Gesellschaft mbH Heubach\nGesellschaft mit beschränkter Haftung\nHeubach\n\nDie Gesellschaft hat am 08.10.2024 die Liste über die Zusammensetzung des Aufsichtsrats zum Handelsregister eingereicht."
    },
    {
      "date": "2024-10-30",
      "id": "92058",
      "original_text": "Registerbekanntmachung nach dem Umwandlungsgesetz\nBaden-Württemberg Amtsgericht Mannheim HRB 742993\nPraevida Medical UG (haftungsbeschränkt) – Heidelberg",
      "type": "Registerbekanntmachung nach dem Umwandlungsgesetz",
      "state": "Baden-Württemberg",
      "amtsgericht": "Amtsgericht Mannheim",
      "registernummer": "HRB 742993",
      "registerart": "HRB",
      "company_name": "Praevida Medical UG (haftungsbeschränkt)",
      "company_seat": "Heidelberg",
      "details": "30.10.2024 (Bekanntmachungsdatum)\n\nBaden-Württemberg Amtsgericht Mannheim HRB 742993\nRegisterbekanntmachung nach dem Umwandlungsgesetz 04.09.2024 (Eintragungsdatum)\n\nPraevida Medical UG (haftungsbeschränkt)\nGesellschaft mit beschränkter Haftung\nHeidelberg\n\nAls nicht eingetragen wird bekanntgemacht:\nDen Gläubigern der an der Verschmelzung beteiligten Rechtsträger ist, wenn sie binnen sechs Monaten nach dem Tag, an dem die Eintragung der Verschmelzung in das Register des Sitzes desjenigen Rechtsträgers, dessen Gläubiger sie sind, nach § 19 Abs. 3 UmwG als bekanntgemacht gilt, ihren Anspruch nach Grund und Höhe schriftlich anmelden, Sicherheit zu leisten, soweit sie nicht Befriedigung verlangen können. Dieses Recht steht den Gläubigern jedoch nur zu, wenn sie glaubhaft machen, dass durch die Verschmelzung die Erfüllung ihrer Forderung gefährdet wird."
    },
    {
      "date": "2024-10-30",
      "id": "92059",
      "original_text": "Registerbekanntmachung nach dem Umwandlungsgesetz\nBaden-Württemberg Amtsgericht Mannheim HRB 713564\nSVF Sachwert AG – Eppelheim",
      "type": "Registerbekanntmachung nach dem Umwandlungsgesetz",
      "state": "Baden-Württemberg",
      "amtsgericht": "Amtsgericht Mannheim",
      "registernummer": "HRB 713564",
      "registerart": "HRB",
      "company_name": "SVF Sachwert AG",
      "company_seat": "Eppelheim",
      "details": "30.10.2024 (Bekanntmachungsdatum)\n\nBaden-Württemberg Amtsgericht Mannheim HRB 713564\nRegisterbekanntmachung nach dem Umwandlungsgesetz 30.10.2024 (Eintragungsdatum)\n\nSVF Sachwert AG\nAktiengesellschaft\nEppelheim\n\nDen Gläubigern der an der Verschmelzung beteiligten Rechtsträger ist, wenn sie binnen sechs Monaten nach dem Tag, an dem die Eintragung der Verschmelzung in das Register des Sitzes desjenigen Rechtsträgers, dessen Gläubiger sie sind, nach § 19 Abs. 3 UmwG als bekanntgemacht gilt, ihren Anspruch nach Grund und Höhe schriftlich anmelden, Sicherheit zu leisten, soweit sie nicht Befriedigung verlangen können. Dieses Recht steht den Gläubigern jedoch nur zu, wenn sie glaubhaft machen, dass durch die Verschmelzung die Erfüllung ihrer Forderung gefährdet wird."
    },
    {
      "date": "2024-10-30",
      "id": "92060",
      "original_text": "Registerbekanntmachung nach dem Umwandlungsgesetz\nBaden-Württemberg Amtsgericht Mannheim HRB 336209\nSVF AG Finanzmarkt-Emissionen – Eppelheim",
      "type": "Registerbekanntmachung nach dem Umwandlungsgesetz",
      "state": "Baden-Württemberg",
      "amtsgericht": "Amtsgericht Mannheim",
      "registernummer": "HRB 336209",
      "registerart": "HRB",
      "company_name": "SVF AG Finanzmarkt-Emissionen",
      "company_seat": "Eppelheim",
      "details": "30.10.2024 (Bekanntmachungsdatum)\n\nBaden-Württemberg Amtsgericht Mannheim HRB 336209\nRegisterbekanntmachung nach dem Umwandlungsgesetz 30.10.2024 (Eintragungsdatum)\n\nSVF AG Finanzmarkt-Emissionen\nAktiengesellschaft\nEppelheim\n\nAls nicht eingetragen wird bekanntgemacht: Den Gläubigern der an der Verschmelzung beteiligten Rechtsträger ist, wenn sie binnen sechs Monaten nach dem Tag, an dem die Eintragung der Verschmelzung in das Register des Sitzes desjenigen Rechtsträgers, dessen Gläubiger sie sind, nach § 19 Abs. 3 UmwG als bekanntgemacht gilt, ihren Anspruch nach Grund und Höhe schriftlich anmelden, Sicherheit zu leisten, soweit sie nicht Befriedigung verlangen können. Dieses Recht steht den Gläubigern jedoch nur zu, wenn sie glaubhaft machen, dass durch die Verschmelzung die Erfüllung ihrer Forderung gefährdet wird."
    },
    {
      "date": "2024-10-30",
      "id": "92061",
      "original_text": "Einreichung neuer Dokumente\nBaden-Württemberg Amtsgericht Stuttgart HRB 766310\ndatendrang AG – Plochingen",
      "type": "Einreichung neuer Dokumente",
      "state": "Baden-Württemberg",
      "amtsgericht": "Amtsgericht Stuttgart",
      "registernummer": "HRB 766310",
      "registerart": "HRB",
      "company_name": "datendrang AG",
      "company_seat": "Plochingen",
      "details": "30.10.2024 (Bekanntmachungsdatum)\n\nBaden-Württemberg Amtsgericht Stuttgart HRB 766310\nEinreichung neuer Dokumente\n\ndatendrang AG\nAktiengesellschaft\nPlochingen\n\nDie Gesellschaft hat am 24.10.2024 die Liste über die Zusammensetzung des Aufsichtsrats zum Handelsregister eingereicht."
    },
    {
      "date": "2024-10-30",
      "id": "92062",
      "original_text": "Registerbekanntmachung nach dem Umwandlungsgesetz\nSachsen-Anhalt Amtsgericht Stendal HRA 7925\nHTW Elektro- und Gebäudesystemtechnik Inh. Tino Wagner e.K. – Merseburg",
      "type": "Registerbekanntmachung nach dem Umwandlungsgesetz",
      "state": "Sachsen-Anhalt",
      "amtsgericht": "Amtsgericht Stendal",
      "registernummer": "HRA 7925",
      "registerart": "HRA",
      "company_name": "HTW Elektro- und Gebäudesystemtechnik Inh. Tino Wagner e.K.",
      "company_seat": "Merseburg",
      "details": "30.10.2024 (Bekanntmachungsdatum)\n\nSachsen-Anhalt Amtsgericht Stendal HRA 7925\nRegisterbekanntmachung nach dem Umwandlungsgesetz 30.10.2024 (Eintragungsdatum)\n\nHTW Elektro- und Gebäudesystemtechnik Inh. Tino Wagner e.K.\nEinzelkaufmann / Einzelkauffrau\nMerseburg\n\nNicht eingetragen:\nDen Gläubigern der an der Ausgliederung beteiligten Rechtsträger, ist wenn sie binnen sechs Monaten nach dem Tag, an dem die Eintragung der Ausgliederung nach §§125, 19 Abs. 3 UmwG als bekanntgemacht gilt, ihren Anspruch nach Grund und Höhe schriftlich anmelden, Sicherheit zu leisten, soweit sie nicht Befriedigung verlangen können. Diese Recht steht ihnen jedoch nur zu, wenn sie glaubhaft machen, dass durch die Ausgliederung die Erfüllung ihrer Forderung gefährdet wird."
    },
    {
      "date": "2024-10-30",
      "id": "92063",
      "original_text": "Registerbekanntmachung nach dem Umwandlungsgesetz\nSachsen-Anhalt Amtsgericht Stendal HRB 20760\nHTW Elektrotechnik & Gebäudesystemtechnik GmbH – Merseburg",
      "type": "Registerbekanntmachung nach dem Umwandlungsgesetz",
      "state": "Sachsen-Anhalt",
      "amtsgericht": "Amtsgericht Stendal",
      "registernummer": "HRB 20760",
      "registerart": "HRB",
      "company_name": "HTW Elektrotechnik & Gebäudesystemtechnik GmbH",
      "company_seat": "Merseburg",
      "details": "30.10.2024 (Bekanntmachungsdatum)\n\nSachsen-Anhalt Amtsgericht Stendal HRB 20760\nRegisterbekanntmachung nach dem Umwandlungsgesetz 30.10.2024 (Eintragungsdatum)\n\nHTW Elektrotechnik & Gebäudesystemtechnik GmbH\nGesellschaft mit beschränkter Haftung\nMerseburg\n\nNicht eingetragen:\nDen Gläubigern der an der Ausgliederung beteiligten Rechtsträger, ist wenn sie binnen sechs Monaten nach dem Tag, an dem die Eintragung der Ausgliederung nach §§125, 19 Abs. 3 UmwG als bekanntgemacht gilt, ihren Anspruch nach Grund und Höhe schriftlich anmelden, Sicherheit zu leisten, soweit sie nicht Befriedigung verlangen können. Diese Recht steht ihnen jedoch nur zu, wenn sie glaubhaft machen, dass durch die Ausgliederung die Erfüllung ihrer Forderung gefährdet wird."
    },
    {
      "date": "2024-10-30",
      "id": "92064",
      "original_text": "Registerbekanntmachung nach dem Umwandlungsgesetz\nBrandenburg Amtsgericht Neuruppin HRA 3626\nStefan Appetz e.K. – Angermünde OT Bölkendorf",
      "type": "Registerbekanntmachung nach dem Umwandlungsgesetz",
      "state": "Brandenburg",
      "amtsgericht": "Amtsgericht Neuruppin",
      "registernummer": "HRA 3626",
      "registerart": "HRA",
      "company_name": "Stefan Appetz e.K.",
      "company_seat": "Angermünde OT Bölkendorf",
      "details": "30.10.2024 (Bekanntmachungsdatum)\n\nBrandenburg Amtsgericht Neuruppin HRA 3626\nRegisterbekanntmachung nach dem Umwandlungsgesetz 28.10.2024 (Eintragungsdatum)\n\nStefan Appetz e.K.\nEinzelkaufmann / Einzelkauffrau\nAngermünde OT Bölkendorf\n\nZu Eintragungsnummer 2 vom 28.10.2024 wird als nicht eingetragen veröffentlicht:\nDen Gläubigern der an der Umwandlung beteiligten Rechtsträger ist, wenn sie binnen sechs Monaten nach dem Tag, an dem die Eintragung der Umwandlung in das Register des Sitzes desjenigen Rechtsträgers, dessen Gläubiger sie sind, als bekannt gemacht gilt, ihren Anspruch nach Grund und Höhe schriftlich anmelden, Sicherheit zu leisten, soweit sie nicht Befriedigung verlangen können. Dieses Recht steht den Gläubigern jedoch nur zu, wenn sie glaubhaft machen, dass durch die Umwandlung die Erfüllung ihrer Forderung gefährdet wird"
    },
    {
      "date": "2024-10-30",
      "id": "92065",
      "original_text": "Registerbekanntmachung nach dem Umwandlungsgesetz\nSachsen-Anhalt Amtsgericht Stendal HRA 5985\nPB Verwaltung und Vermögens GmbH & Co. KG – Ilsenburg",
      "type": "Registerbekanntmachung nach dem Umwandlungsgesetz",
      "state": "Sachsen-Anhalt",
      "amtsgericht": "Amtsgericht Stendal",
      "registernummer": "HRA 5985",
      "registerart": "HRA",
      "company_name": "PB Verwaltung und Vermögens GmbH & Co. KG",
      "company_seat": "Ilsenburg",
      "details": "30.10.2024 (Bekanntmachungsdatum)\n\nSachsen-Anhalt Amtsgericht Stendal HRA 5985\nRegisterbekanntmachung nach dem Umwandlungsgesetz 30.10.2024 (Eintragungsdatum)\n\nPB Verwaltung und Vermögens GmbH & Co. KG\nKommanditgesellschaft\nIlsenburg\n\nNicht eingetragen:\nDen Gläubigern des formwechselnden  Rechtsträgers ist, wenn sie binnen sechs Monaten nach dem Tag, an dem die Eintragung der Formwechsels nach § 201 UmwG als bekanntgemacht gilt, ihren Anspruch nach Grund und Höhe schriftlich anmelden, Sicherheit zu leisten, soweit sie nicht Befriedigung verlangen können. Dieses Recht steht ihnen jedoch nur zu, wenn sie glaubhaft machen, dass durch den Formwechsel die Erfüllung ihrer Forderung gefährdet wird."
    },
    {
      "date": "2024-10-30",
      "id": "92066",
      "original_text": "Einreichung neuer Dokumente\nBaden-Württemberg Amtsgericht Stuttgart HRB 13677\nDürr Aktiengesellschaft – Stuttgart",
      "type": "Einreichung neuer Dokumente",
      "state": "Baden-Württemberg",
      "amtsgericht": "Amtsgericht Stuttgart",
      "registernummer": "HRB 13677",
      "registerart": "HRB",
      "company_name": "Dürr Aktiengesellschaft",
      "company_seat": "Stuttgart",
      "details": "30.10.2024 (Bekanntmachungsdatum)\n\nBaden-Württemberg Amtsgericht Stuttgart HRB 13677\nEinreichung neuer Dokumente\n\nDürr Aktiengesellschaft\nAktiengesellschaft\nStuttgart\n\nDie Gesellschaft hat am 23.09.2024 die Liste über die Zusammensetzung des Aufsichtsrats zum Handelsregister eingereicht."
    },
    {
      "date": "2024-10-30",
      "id": "92067",
      "original_text": "Registerbekanntmachung nach dem Umwandlungsgesetz\nSchleswig-Holstein Amtsgericht Lübeck HRA 11165\nAtlantic Land Kajüten GmbH & Co. KG – Timmendorfer Strand",
      "type": "Registerbekanntmachung nach dem Umwandlungsgesetz",
      "state": "Schleswig-Holstein",
      "amtsgericht": "Amtsgericht Lübeck",
      "registernummer": "HRA 11165",
      "registerart": "HRA",
      "company_name": "Atlantic Land Kajüten GmbH & Co. KG",
      "company_seat": "Timmendorfer Strand",
      "details": "30.10.2024 (Bekanntmachungsdatum)\n\nSchleswig-Holstein Amtsgericht Lübeck HRA 11165\nRegisterbekanntmachung nach dem Umwandlungsgesetz 29.10.2024 (Eintragungsdatum)\n\nAtlantic Land Kajüten GmbH & Co. KG\nKommanditgesellschaft\nTimmendorfer Strand\n\nZu Eintragungsnummer 2 vom 29.10.2024 wird als nicht eingetragen veröffentlicht:\nAls nicht eingetragen wird veröffentlicht: Den Gläubigern ist, wenn sie binnen sechs Monaten nach dem Tag, an dem die Eintragung der Ausgliederung als bekannt gemacht gilt, ihren Anspruch nach Grund und Höhe schriftlich anmelden, Sicherheit zu leisten, soweit sie nicht Befriedigung verlangen können. Dieses Recht steht den Gläubigern jedoch nur zu, wenn sie glaubhaft machen, dass durch die Ausgliederung die Erfüllung ihrer Forderung gefährdet wird."
    },
    {
      "date": "2024-10-30",
      "id": "92068",
      "original_text": "Sonstige Registerbekanntmachung\nBerlin Amtsgericht Berlin (Charlottenburg) HRB 170573\nASSECOR VENTURE GmbH – Berlin",
      "type": "Sonstige Registerbekanntmachung",
      "state": "Berlin",
      "amtsgericht": "Amtsgericht Berlin (Charlottenburg)",
      "registernummer": "HRB 170573",
      "registerart": "HRB",
      "company_name": "ASSECOR VENTURE GmbH",
      "company_seat": "Berlin",
      "details": "30.10.2024 (Bekanntmachungsdatum)\n\nBerlin Amtsgericht Berlin (Charlottenburg) HRB 170573\nSonstige Registerbekanntmachung\n\nASSECOR VENTURE GmbH\nGesellschaft mit beschränkter Haftung\nBerlin\n\nAls nicht eingetragen wird veröffentlicht: Den Gläubigern der an der Verschmelzung beteiligten Rechtsträger ist, wenn sie binnen sechs Monaten nach dem Tag, an dem die Eintragung der Verschmelzung in das Register des Sitzes desjenigen Rechtsträgers, dessen Gläubiger sie sind, als bekannt gemacht gilt, ihren Anspruch nach Grund und Höhe schriftlich anmelden, Sicherheit zu leisten, soweit sie nicht Befriedigung verlangen können. Dieses Recht steht den Gläubigern jedoch nur zu, wenn sie glaubhaft machen, dass durch die Verschmelzung die Erfüllung ihrer Forderung gefährdet wird. Das Recht, Sicherheitsleistung zu verlangen, steht Gläubigern nicht zu, die im Falle der Insolvenz ein Recht auf vorzugsweise Befriedigung aus einer Deckungsmasse haben, die nach gesetzlicher Vorschrift zu ihrem Schutz errichtet und staatlich überwacht ist."
    },
    {
      "date": "2024-10-30",
      "id": "92069",
      "original_text": "Sonstige Registerbekanntmachung\nBerlin Amtsgericht Berlin (Charlottenburg) HRB 260878\nSKD SE – Berlin",
      "type": "Sonstige Registerbekanntmachung",
      "state": "Berlin",
      "amtsgericht": "Amtsgericht Berlin (Charlottenburg)",
      "registernummer": "HRB 260878",
      "registerart": "HRB",
      "company_name": "SKD SE",
      "company_seat": "Berlin",
      "details": "30.10.2024 (Bekanntmachungsdatum)\n\nBerlin Amtsgericht Berlin (Charlottenburg) HRB 260878\nSonstige Registerbekanntmachung\n\nSKD SE\nEuropäische Aktiengesellschaft (SE)\nBerlin\n\nAls nicht eingetragen wird veröffentlicht:\nEs wurde eine neue Liste der Aufsichtsratsmitglieder eingereicht (§ 106 AktG)."
    },
    {
      "date": "2024-10-30",
      "id": "92070",
      "original_text": "Sonstige Registerbekanntmachung\nBerlin Amtsgericht Berlin (Charlottenburg) HRB 212975\nKeemova GmbH – Berlin",
      "type": "Sonstige Registerbekanntmachung",
      "state": "Berlin",
      "amtsgericht": "Amtsgericht Berlin (Charlottenburg)",
      "registernummer": "HRB 212975",
      "registerart": "HRB",
      "company_name": "Keemova GmbH",
      "company_seat": "Berlin",
      "details": "30.10.2024 (Bekanntmachungsdatum)\n\nBerlin Amtsgericht Berlin (Charlottenburg) HRB 212975\nSonstige Registerbekanntmachung 29.10.2024 (Eintragungsdatum)\n\nKeemova GmbH\nGesellschaft mit beschränkter Haftung\nBerlin\n\nAls nicht eingetragen wird veröffentlicht: Den Gläubigern der an der Verschmelzung beteiligten Rechtsträger ist, wenn sie binnen sechs Monaten nach dem Tag, an dem die Eintragung der Verschmelzung in das Register des Sitzes desjenigen Rechtsträgers, dessen Gläubiger sie sind, als bekannt gemacht gilt, ihren Anspruch nach Grund und Höhe schriftlich anmelden, Sicherheit zu leisten, soweit sie nicht Befriedigung verlangen können. Dieses Recht steht den Gläubigern jedoch nur zu, wenn sie glaubhaft machen, dass durch die Verschmelzung die Erfüllung ihrer Forderung gefährdet wird. Das Recht, Sicherheitsleistung zu verlangen, steht Gläubigern nicht zu, die im Falle der Insolvenz ein Recht auf vorzugsweise Befriedigung aus einer Deckungsmasse haben, die nach gesetzlicher Vorschrift zu ihrem Schutz errichtet und staatlich überwacht ist."
    },
    {
      "date": "2024-10-30",
      "id": "92071",
      "original_text": "Löschungsankündigung\nBerlin Amtsgericht Berlin (Charlottenburg) HRB 197071\nCryptonator1337 GmbH – Berlin",
      "type": "Löschungsankündigung",
      "state": "Berlin",
      "amtsgericht": "Amtsgericht Berlin (Charlottenburg)",
      "registernummer": "HRB 197071",
      "registerart": "HRB",
      "company_name": "Cryptonator1337 GmbH",
      "company_seat": "Berlin",
      "details": "30.10.2024 (Bekanntmachungsdatum)\n\nBerlin Amtsgericht Berlin (Charlottenburg) HRB 197071\nLöschungsankündigung\n\nCryptonator1337 GmbH\nGesellschaft mit beschränkter Haftung\nBerlin\n\nBei der nachstehenden Gesellschaft wird das Amtslöschungsverfahren gemäß § 394 FamFG eingeleitet. Widerspruchsfrist 6 Wochen"
    },
    {
      "date": "2024-10-30",
      "id": "92072",
      "original_text": "Registerbekanntmachung nach dem Umwandlungsgesetz\nBaden-Württemberg Amtsgericht Mannheim HRB 10135\nHorizon Therapeutics GmbH – Mannheim",
      "type": "Registerbekanntmachung nach dem Umwandlungsgesetz",
      "state": "Baden-Württemberg",
      "amtsgericht": "Amtsgericht Mannheim",
      "registernummer": "HRB 10135",
      "registerart": "HRB",
      "company_name": "Horizon Therapeutics GmbH",
      "company_seat": "Mannheim",
      "details": "30.10.2024 (Bekanntmachungsdatum)\n\nBaden-Württemberg Amtsgericht Mannheim HRB 10135\nRegisterbekanntmachung nach dem Umwandlungsgesetz 30.10.2024 (Eintragungsdatum)\n\nHorizon Therapeutics GmbH\nGesellschaft mit beschränkter Haftung\nMannheim\n\nDen Gläubigern der an der Verschmelzung beteiligten Rechtsträger ist, wenn sie binnen sechs Monaten nach dem Tag, an dem die Eintragung der Verschmelzung in das Register des Sitzes desjenigen Rechtsträgers, dessen Gläubiger sie sind, nach § 19 Abs. 3 UmwG als bekanntgemacht gilt, ihren Anspruch nach Grund und Höhe schriftlich anmelden, Sicherheit zu leisten, soweit sie nicht Befriedigung verlangen können. Dieses Recht steht den Gläubigern jedoch nur zu, wenn sie glaubhaft machen, dass durch die Verschmelzung die Erfüllung ihrer Forderung gefährdet wird."
    },
    {
      "date": "2024-10-30",
      "id": "92073",
      "original_text": "Sonstige Registerbekanntmachung\nSachsen-Anhalt Amtsgericht Stendal HRB 200820\nHallesche Verkehrs-Aktiengesellschaft – Halle (Saale)",
      "type": "Sonstige Registerbekanntmachung",
      "state": "Sachsen-Anhalt",
      "amtsgericht": "Amtsgericht Stendal",
      "registernummer": "HRB 200820",
      "registerart": "HRB",
      "company_name": "Hallesche Verkehrs-Aktiengesellschaft",
      "company_seat": "Halle (Saale)",
      "details": "30.10.2024 (Bekanntmachungsdatum)\n\nSachsen-Anhalt Amtsgericht Stendal HRB 200820\nSonstige Registerbekanntmachung\n\nHallesche Verkehrs-Aktiengesellschaft\nAktiengesellschaft\nHalle (Saale)\n\nEine Liste der Mitglieder des Aufsichtsrates wurde zum Handelsregister eingereicht."
    },
    {
      "date": "2024-10-30",
      "id": "92074",
      "original_text": "Sonstige Registerbekanntmachung\nBerlin Amtsgericht Berlin (Charlottenburg) HRB 78064\nDussmann Stiftung & Co. Kommanditgesellschaft auf Aktien – Berlin",
      "type": "Sonstige Registerbekanntmachung",
      "state": "Berlin",
      "amtsgericht": "Amtsgericht Berlin (Charlottenburg)",
      "registernummer": "HRB 78064",
      "registerart": "HRB",
      "company_name": "Dussmann Stiftung & Co. Kommanditgesellschaft auf Aktien",
      "company_seat": "Berlin",
      "details": "30.10.2024 (Bekanntmachungsdatum)\n\nBerlin Amtsgericht Berlin (Charlottenburg) HRB 78064\nSonstige Registerbekanntmachung\n\nDussmann Stiftung & Co. Kommanditgesellschaft auf Aktien\nKommanditgesellschaft auf Aktien\nBerlin\n\nAls nicht eingetragen wird veröffentlicht: Es wurde eine neue Liste der Aufsichtsratsmitglieder eingereicht (§ 106 AktG)."
    },
    {
      "date": "2024-10-30",
      "id": "92075",
      "original_text": "Löschungsankündigung\nSchleswig-Holstein Amtsgericht Lübeck HRB 3945 AH\nOtto Müller GmbH Verwaltungsgesellschaft – Ahrensburg",
      "type": "Löschungsankündigung",
      "state": "Schleswig-Holstein",
      "amtsgericht": "Amtsgericht Lübeck",
      "registernummer": "HRB 3945 AH",
      "registerart": "HRB",
      "company_name": "Otto Müller GmbH Verwaltungsgesellschaft",
      "company_seat": "Ahrensburg",
      "details": "30.10.2024 (Bekanntmachungsdatum)\n\nSchleswig-Holstein Amtsgericht Lübeck HRB 3945 AH\nLöschungsankündigung\n\nOtto Müller GmbH Verwaltungsgesellschaft\nGesellschaft mit beschränkter Haftung\nAhrensburg\n\nEs ist die Löschung der nachstehenden Gesellschaft wegen Vermögenslosigkeit gemäß § 394 FamFG beabsichtigt. Widerspruchsfrist: 1 Monat."
    },
    {
      "date": "2024-10-30",
      "id": "92076",
      "original_text": "Registerbekanntmachung nach dem Umwandlungsgesetz\nBaden-Württemberg Amtsgericht Freiburg HRA 708696\nJOCHUM Formenbau GmbH & Co KG – Eimeldingen",
      "type": "Registerbekanntmachung nach dem Umwandlungsgesetz",
      "state": "Baden-Württemberg",
      "amtsgericht": "Amtsgericht Freiburg",
      "registernummer": "HRA 708696",
      "registerart": "HRA",
      "company_name": "JOCHUM Formenbau GmbH & Co KG",
      "company_seat": "Eimeldingen",
      "details": "30.10.2024 (Bekanntmachungsdatum)\n\nBaden-Württemberg Amtsgericht Freiburg HRA 708696\nRegisterbekanntmachung nach dem Umwandlungsgesetz 30.10.2024 (Eintragungsdatum)\n\nJOCHUM Formenbau GmbH & Co KG\nKommanditgesellschaft\nEimeldingen\n\nAls nicht eingetragen wird bekanntgemacht:\nDen Gläubigern der an der Ausgliederung beteiligten Rechtsträger ist, wenn sie binnen sechs Monaten nach dem Tag, an dem die Eintragung der Ausgliederung in das Register des Sitzes desjenigen Rechtsträgers, dessen Gläubiger sie sind, nach § 19 Abs. 3 UmwG als bekanntgemacht gilt, ihren Anspruch nach Grund und Höhe schriftlich anmelden, Sicherheit zu leisten, soweit sie nicht Befriedigung verlangen können. Dieses Recht steht den Gläubigern jedoch nur zu, wenn sie glaubhaft machen, dass durch die Ausgliederung die Erfüllung ihrer Forderung gefährdet wird."
    },
    {
      "date": "2024-10-30",
      "id": "92077",
      "original_text": "Registerbekanntmachung nach dem Umwandlungsgesetz\nThüringen Amtsgericht Jena HRA 502857\nHeim Solar Nobitz GmbH & Co. KG – Nobitz",
      "type": "Registerbekanntmachung nach dem Umwandlungsgesetz",
      "state": "Thüringen",
      "amtsgericht": "Amtsgericht Jena",
      "registernummer": "HRA 502857",
      "registerart": "HRA",
      "company_name": "Heim Solar Nobitz GmbH & Co. KG",
      "company_seat": "Nobitz",
      "details": "30.10.2024 (Bekanntmachungsdatum)\n\nThüringen Amtsgericht Jena HRA 502857\nRegisterbekanntmachung nach dem Umwandlungsgesetz 30.10.2024 (Eintragungsdatum)\n\nHeim Solar Nobitz GmbH & Co. KG\nKommanditgesellschaft\nNobitz\n\nNicht eingetragen: Den Gläubigern der an der Verschmelzung beteiligten Rechtsträger, ist wenn sie binnen sechs Monaten nach dem Tag, an dem die Eintragung der Verschmelzung in das Register des Sitzes desjenigen Rechtsträgers, dessen Gläubiger sie sind,  nach § 19 Abs. 3 UmwG als bekanntgemacht gilt, ihren Anspruch nach Grund und Höhe schriftlich anmelden, Sicherheit zu leisten, soweit sie nicht Befriedigung verlangen können. Dieses Recht steht ihnen jedoch nur zu, wenn sie glaubhaft machen, daß durch die Verschmelzung die Erfüllung ihrer Forderung gefährdet wird."
    },
    {
      "date": "2024-10-30",
      "id": "92078",
      "original_text": "Löschungsankündigung\nThüringen Amtsgericht Jena HRB 507976\nAS Industrie Fußboden GmbH – Greiz",
      "type": "Löschungsankündigung",
      "state": "Thüringen",
      "amtsgericht": "Amtsgericht Jena",
      "registernummer": "HRB 507976",
      "registerart": "HRB",
      "company_name": "AS Industrie Fußboden GmbH",
      "company_seat": "Greiz",
      "details": "30.10.2024 (Bekanntmachungsdatum)\n\nThüringen Amtsgericht Jena HRB 507976\nLöschungsankündigung\n\nAS Industrie Fußboden GmbH\nGesellschaft mit beschränkter Haftung\nGreiz\n\nDas Registergericht beabsichtigt, die im Handelsregister eingetragene Gesellschaft wegen Vermögenslosigkeit nach § 394 FamFG von Amts wegen zu löschen. Die Frist zur Erhebung eines Widerspruchs gegen die beabsichtigte Löschung wird auf 6 Wochen festgesetzt."
    },
    {
      "date": "2024-10-30",
      "id": "92079",
      "original_text": "Registerbekanntmachung nach dem Umwandlungsgesetz\nThüringen Amtsgericht Jena HRB 202422\nEnergieversorgung Rudolstadt GmbH – Rudolstadt",
      "type": "Registerbekanntmachung nach dem Umwandlungsgesetz",
      "state": "Thüringen",
      "amtsgericht": "Amtsgericht Jena",
      "registernummer": "HRB 202422",
      "registerart": "HRB",
      "company_name": "Energieversorgung Rudolstadt GmbH",
      "company_seat": "Rudolstadt",
      "details": "30.10.2024 (Bekanntmachungsdatum)\n\nThüringen Amtsgericht Jena HRB 202422\nRegisterbekanntmachung nach dem Umwandlungsgesetz 30.10.2024 (Eintragungsdatum)\n\nEnergieversorgung Rudolstadt GmbH\nGesellschaft mit beschränkter Haftung\nRudolstadt\n\nNicht eingetragen: Den Gläubigern der an der Ausgliederung beteiligten Rechtsträger, ist wenn sie binnen sechs Monaten nach dem Tag, an dem die Eintragung der Ausgliederung in das Register des Sitzes desjenigen Rechtsträgers, dessen Gläubiger sie sind, nach §§125, 19 Abs. 3 UmwG als bekanntgemacht gilt, ihren Anspruch nach Grund und Höhe schriftlich anmelden, Sicherheit zu leisten, soweit sie nicht Befriedigung verlangen können. Dieses Recht steht ihnen jedoch nur zu, wenn sie glaubhaft machen, daß durch die Ausgliederung die Erfüllung ihrer Forderung gefährdet wird."
    },
    {
      "date": "2024-10-30",
      "id": "92080",
      "original_text": "Registerbekanntmachung nach dem Umwandlungsgesetz\nThüringen Amtsgericht Jena GsR 337\nWasserkraftanlage Mühle Tiefurt eGbR – Weimar",
      "type": "Registerbekanntmachung nach dem Umwandlungsgesetz",
      "state": "Thüringen",
      "amtsgericht": "Amtsgericht Jena",
      "registernummer": "GsR 337",
      "registerart": "GsR",
      "company_name": "Wasserkraftanlage Mühle Tiefurt eGbR",
      "company_seat": "Weimar",
      "details": "30.10.2024 (Bekanntmachungsdatum)\n\nThüringen Amtsgericht Jena GsR 337\nRegisterbekanntmachung nach dem Umwandlungsgesetz 30.10.2024 (Eintragungsdatum)\n\nWasserkraftanlage Mühle Tiefurt eGbR\nGesellschaft bürgerlichen Rechts\nWeimar\n\nNicht eingetragen: Den Gläubigern des formwechselnden  Rechtsträgers, ist wenn sie binnen sechs Monaten nach dem Tag, an dem die Eintragung des Formwechsels nach § 201 UmwG als bekanntgemacht gilt, ihren Anspruch nach Grund und Höhe schriftlich anmelden, Sicherheit zu leisten, soweit sie nicht Befriedigung verlangen können. Dieses Recht steht ihnen jedoch nur zu, wenn sie glaubhaft machen, daß durch den Formwechsel die Erfüllung ihrer Forderung gefährdet wird."
    },
    {
      "date": "2024-10-30",
      "id": "92081",
      "original_text": "Registerbekanntmachung nach dem Umwandlungsgesetz\nThüringen Amtsgericht Jena HRB 113570\nEnR Energienetze Rudolstadt GmbH – Rudolstadt",
      "type": "Registerbekanntmachung nach dem Umwandlungsgesetz",
      "state": "Thüringen",
      "amtsgericht": "Amtsgericht Jena",
      "registernummer": "HRB 113570",
      "registerart": "HRB",
      "company_name": "EnR Energienetze Rudolstadt GmbH",
      "company_seat": "Rudolstadt",
      "details": "30.10.2024 (Bekanntmachungsdatum)\n\nThüringen Amtsgericht Jena HRB 113570\nRegisterbekanntmachung nach dem Umwandlungsgesetz 30.10.2024 (Eintragungsdatum)\n\nEnR Energienetze Rudolstadt GmbH\nGesellschaft mit beschränkter Haftung\nRudolstadt\n\nNicht eingetragen: Den Gläubigern der an der Ausgliederung beteiligten Rechtsträger, ist wenn sie binnen sechs Monaten nach dem Tag, an dem die Eintragung der Ausgliederung in das Register des Sitzes desjenigen Rechtsträgers, dessen Gläubiger sie sind, nach §§125, 19 Abs. 3 UmwG als bekanntgemacht gilt, ihren Anspruch nach Grund und Höhe schriftlich anmelden, Sicherheit zu leisten, soweit sie nicht Befriedigung verlangen können. Dieses Recht steht ihnen jedoch nur zu, wenn sie glaubhaft machen, daß durch die Ausgliederung die Erfüllung ihrer Forderung gefährdet wird."
    },
    {
      "date": "2024-10-30",
      "id": "92082",
      "original_text": "Löschungsankündigung\nBaden-Württemberg Amtsgericht Mannheim HRB 713385\nPrestige GmbH – Wiesloch",
      "type": "Löschungsankündigung",
      "state": "Baden-Württemberg",
      "amtsgericht": "Amtsgericht Mannheim",
      "registernummer": "HRB 713385",
      "registerart": "HRB",
      "company_name": "Prestige GmbH",
      "company_seat": "Wiesloch",
      "details": "30.10.2024 (Bekanntmachungsdatum)\n\nBaden-Württemberg Amtsgericht Mannheim HRB 713385\nLöschungsankündigung\n\nPrestige GmbH\nGesellschaft mit beschränkter Haftung\nWiesloch\n\nDas Gericht beabsichtigt, die Gesellschaft wegen Vermögenslosigkeit im Handelsregister von Amts wegen nach § 394 FamFG zu löschen. Die Frist zur Geltendmachung eines Widerspruchs gegen die beabsichtigte Löschung ist auf einen Monat ab Veröffentlichung bestimmt."
    },
    {
      "date": "2024-10-30",
      "id": "92083",
      "original_text": "Einreichung neuer Dokumente\nBerlin Amtsgericht Berlin (Charlottenburg) HRB 106640\nNobody's Bizzness GmbH – Berlin",
      "type": "Einreichung neuer Dokumente",
      "state": "Berlin",
      "amtsgericht": "Amtsgericht Berlin (Charlottenburg)",
      "registernummer": "HRB 106640",
      "registerart": "HRB",
      "company_name": "Nobody's Bizzness GmbH",
      "company_seat": "Berlin",
      "details": "30.10.2024 (Bekanntmachungsdatum)\n\nBerlin Amtsgericht Berlin (Charlottenburg) HRB 106640\nEinreichung neuer Dokumente\n\nNobody's Bizzness GmbH\nGesellschaft mit beschränkter Haftung\nBerlin\n\nAls nicht eingetragen wird veröffentlicht: Es wurde eine neue Liste der Aufsichtsratsmitglieder eingereicht (§52 GmbHG)."
    },
    {
      "date": "2024-10-30",
      "id": "92084",
      "original_text": "Registerbekanntmachung nach dem Umwandlungsgesetz\nBaden-Württemberg Amtsgericht Freiburg HRA 708574\nVolker Jochum Formenbau e. K. – Eimeldingen",
      "type": "Registerbekanntmachung nach dem Umwandlungsgesetz",
      "state": "Baden-Württemberg",
      "amtsgericht": "Amtsgericht Freiburg",
      "registernummer": "HRA 708574",
      "registerart": "HRA",
      "company_name": "Volker Jochum Formenbau e. K.",
      "company_seat": "Eimeldingen",
      "details": "30.10.2024 (Bekanntmachungsdatum)\n\nBaden-Württemberg Amtsgericht Freiburg HRA 708574\nRegisterbekanntmachung nach dem Umwandlungsgesetz 30.10.2024 (Eintragungsdatum)\n\nVolker Jochum Formenbau e. K.\nEinzelkaufmann / Einzelkauffrau\nEimeldingen\n\nAls nicht eingetragen wird bekanntgemacht:\nDen Gläubigern der an der Ausgliederung beteiligten Rechtsträger ist, wenn sie binnen sechs Monaten nach dem Tag, an dem die Eintragung der Ausgliederung in das Register des Sitzes desjenigen Rechtsträgers, dessen Gläubiger sie sind, nach § 19 Abs. 3 UmwG als bekanntgemacht gilt, ihren Anspruch nach Grund und Höhe schriftlich anmelden, Sicherheit zu leisten, soweit sie nicht Befriedigung verlangen können. Dieses Recht steht den Gläubigern jedoch nur zu, wenn sie glaubhaft machen, dass durch die Ausgliederung die Erfüllung ihrer Forderung gefährdet wird."
    },
    {
      "date": "2024-10-30",
      "id": "92085",
      "original_text": "Löschungsankündigung\nBerlin Amtsgericht Berlin (Charlottenburg) HRB 141418\nPhitea GmbH – Berlin",
      "type": "Löschungsankündigung",
      "state": "Berlin",
      "amtsgericht": "Amtsgericht Berlin (Charlottenburg)",
      "registernummer": "HRB 141418",
      "registerart": "HRB",
      "company_name": "Phitea GmbH",
      "company_seat": "Berlin",
      "details": "30.10.2024 (Bekanntmachungsdatum)\n\nBerlin Amtsgericht Berlin (Charlottenburg) HRB 141418\nLöschungsankündigung\n\nPhitea GmbH\nGesellschaft mit beschränkter Haftung\nBerlin\n\nBei der nachstehenden Gesellschaft wird das Amtslöschungsverfahren gemäß § 394 FamFG eingeleitet. Widerspruchsfrist: 6 Wochen."
    },
    {
      "date": "2024-10-30",
      "id": "92086",
      "original_text": "Registerbekanntmachung nach dem Umwandlungsgesetz\nBaden-Württemberg Amtsgericht Stuttgart HRB 783992\nFK Verwaltungs GmbH – Stuttgart",
      "type": "Registerbekanntmachung nach dem Umwandlungsgesetz",
      "state": "Baden-Württemberg",
      "amtsgericht": "Amtsgericht Stuttgart",
      "registernummer": "HRB 783992",
      "registerart": "HRB",
      "company_name": "FK Verwaltungs GmbH",
      "company_seat": "Stuttgart",
      "details": "30.10.2024 (Bekanntmachungsdatum)\n\nBaden-Württemberg Amtsgericht Stuttgart HRB 783992\nRegisterbekanntmachung nach dem Umwandlungsgesetz 30.10.2024 (Eintragungsdatum)\n\nFK Verwaltungs GmbH\nGesellschaft mit beschränkter Haftung\nStuttgart\n\nAls nicht eingetragen wird bekanntgemacht:\nDen Gläubigern der an der Verschmelzung beteiligten Rechtsträger ist, wenn sie binnen sechs Monaten nach dem Tag, an dem die Eintragung der Verschmelzung in das Register des Sitzes desjenigen Rechtsträgers, dessen Gläubiger sie sind, nach § 19 Abs. 3 UmwG als bekanntgemacht gilt, ihren Anspruch nach Grund und Höhe schriftlich anmelden, Sicherheit zu leisten, soweit sie nicht Befriedigung verlangen können. Dieses Recht steht den Gläubigern jedoch nur zu, wenn sie glaubhaft machen, dass durch die Verschmelzung die Erfüllung ihrer Forderung gefährdet wird."
    },
    {
      "date": "2024-10-30",
      "id": "92087",
      "original_text": "Registerbekanntmachung nach dem Umwandlungsgesetz\nBaden-Württemberg Amtsgericht Stuttgart HRB 16387\nKlumpp Coatings GmbH – Stuttgart",
      "type": "Registerbekanntmachung nach dem Umwandlungsgesetz",
      "state": "Baden-Württemberg",
      "amtsgericht": "Amtsgericht Stuttgart",
      "registernummer": "HRB 16387",
      "registerart": "HRB",
      "company_name": "Klumpp Coatings GmbH",
      "company_seat": "Stuttgart",
      "details": "30.10.2024 (Bekanntmachungsdatum)\n\nBaden-Württemberg Amtsgericht Stuttgart HRB 16387\nRegisterbekanntmachung nach dem Umwandlungsgesetz 30.10.2024 (Eintragungsdatum)\n\nKlumpp Coatings GmbH\nGesellschaft mit beschränkter Haftung\nStuttgart\n\nAls nicht eingetragen wird bekanntgemacht:\nDen Gläubigern der an der Verschmelzung beteiligten Rechtsträger ist, wenn sie binnen sechs Monaten nach dem Tag, an dem die Eintragung der Verschmelzung in das Register des Sitzes desjenigen Rechtsträgers, dessen Gläubiger sie sind, nach § 19 Abs. 3 UmwG als bekanntgemacht gilt, ihren Anspruch nach Grund und Höhe schriftlich anmelden, Sicherheit zu leisten, soweit sie nicht Befriedigung verlangen können. Dieses Recht steht den Gläubigern jedoch nur zu, wenn sie glaubhaft machen, dass durch die Verschmelzung die Erfüllung ihrer Forderung gefährdet wird."
    },
    {
      "date": "2024-10-30",
      "id": "92088",
      "original_text": "Registerbekanntmachung nach dem Umwandlungsgesetz\nHamburg Amtsgericht Hamburg HRB 23838\nRoba Music Verlag GmbH – Hamburg",
      "type": "Registerbekanntmachung nach dem Umwandlungsgesetz",
      "state": "Hamburg",
      "amtsgericht": "Amtsgericht Hamburg",
      "registernummer": "HRB 23838",
      "registerart": "HRB",
      "company_name": "Roba Music Verlag GmbH",
      "company_seat": "Hamburg",
      "details": "30.10.2024 (Bekanntmachungsdatum)\n\nHamburg Amtsgericht Hamburg HRB 23838\nRegisterbekanntmachung nach dem Umwandlungsgesetz 30.10.2024 (Eintragungsdatum)\n\nRoba Music Verlag GmbH\nGesellschaft mit beschränkter Haftung\nHamburg\n\nAls nicht eingetragen wird bekannt gemacht:\nDen Gläubigern der an der Verschmelzung beteiligten Gesellschaften ist, wenn sie binnen sechs Monaten nach dem Tag, an dem die Eintragung der Verschmelzung in das Register des Sitzes desjenigen Rechtsträgers, dessen Gläubiger sie sind, nach § 19 Absatz 3 UmwG als bekannt gemacht gilt, ihren Anspruch nach Grund und Höhe schriftlich anmelden, Sicherheit zu leisten, soweit sie nicht Befriedigung verlangen können. Dieses Recht steht den Gläubigern jedoch nur zu, wenn sie glaubhaft machen, dass durch die Verschmelzung die Erfüllung ihrer Forderung gefährdet wird."
    },
    {
      "date": "2024-10-30",
      "id": "92089",
      "original_text": "Löschungsankündigung\nBerlin Amtsgericht Berlin (Charlottenburg) HRB 156930\nLa Premiata Ditta GmbH – Berlin",
      "type": "Löschungsankündigung",
      "state": "Berlin",
      "amtsgericht": "Amtsgericht Berlin (Charlottenburg)",
      "registernummer": "HRB 156930",
      "registerart": "HRB",
      "company_name": "La Premiata Ditta GmbH",
      "company_seat": "Berlin",
      "details": "30.10.2024 (Bekanntmachungsdatum)\n\nBerlin Amtsgericht Berlin (Charlottenburg) HRB 156930\nLöschungsankündigung\n\nLa Premiata Ditta GmbH\nGesellschaft mit beschränkter Haftung\nBerlin\n\nBei der nachstehenden Gesellschaft wird das Amtslöschungsverfahren gemäß § 394 FamFG eingeleitet. Widerspruchsfrist 6 Wochen"
    },
    {
      "date": "2024-10-30",
      "id": "92090",
      "original_text": "Löschungsankündigung\nMecklenburg-Vorpommern Amtsgericht Schwerin HRB 2876\nSchlachthof Parchim GmbH – Parchim",
      "type": "Löschungsankündigung",
      "state": "Mecklenburg-Vorpommern",
      "amtsgericht": "Amtsgericht Schwerin",
      "registernummer": "HRB 2876",
      "registerart": "HRB",
      "company_name": "Schlachthof Parchim GmbH",
      "company_seat": "Parchim",
      "details": "30.10.2024 (Bekanntmachungsdatum)\n\nMecklenburg-Vorpommern Amtsgericht Schwerin HRB 2876\nLöschungsankündigung\n\nSchlachthof Parchim GmbH\nGesellschaft mit beschränkter Haftung\nParchim\n\nDas Registergericht beabsichtigt, die im Handelsregister eingetragene Gesellschaft von Amts wegen nach § 394 FamFG zu löschen. Die Frist zur Erhebung eines Widerspruchs gegen die beabsichtigte Löschung wird auf 1 Monat festgesetzt."
    },
    {
      "date": "2024-10-30",
      "id": "92091",
      "original_text": "Sonstige Registerbekanntmachung\nBaden-Württemberg Amtsgericht Ulm HRB 728471\nBäderbetriebe Schwäbisch Gmünd GmbH – Schwäbisch Gmünd",
      "type": "Sonstige Registerbekanntmachung",
      "state": "Baden-Württemberg",
      "amtsgericht": "Amtsgericht Ulm",
      "registernummer": "HRB 728471",
      "registerart": "HRB",
      "company_name": "Bäderbetriebe Schwäbisch Gmünd GmbH",
      "company_seat": "Schwäbisch Gmünd",
      "details": "30.10.2024 (Bekanntmachungsdatum)\n\nBaden-Württemberg Amtsgericht Ulm HRB 728471\nSonstige Registerbekanntmachung 30.10.2024 (Eintragungsdatum)\n\nBäderbetriebe Schwäbisch Gmünd GmbH\nGesellschaft mit beschränkter Haftung\nSchwäbisch Gmünd\n\nDie Gesellschaft hat am 29.10.2024 die Liste über die Zusammensetzung des Aufsichtsrats zum Handelsregister eingereicht."
    },
    {
      "date": "2024-10-30",
      "id": "92092",
      "original_text": "Registerbekanntmachung nach dem Umwandlungsgesetz\nBaden-Württemberg Amtsgericht Stuttgart HRA 741774\nExport + Einlagerungen Andreas Schilling e.K. – Waiblingen",
      "type": "Registerbekanntmachung nach dem Umwandlungsgesetz",
      "state": "Baden-Württemberg",
      "amtsgericht": "Amtsgericht Stuttgart",
      "registernummer": "HRA 741774",
      "registerart": "HRA",
      "company_name": "Export + Einlagerungen Andreas Schilling e.K.",
      "company_seat": "Waiblingen",
      "details": "30.10.2024 (Bekanntmachungsdatum)\n\nBaden-Württemberg Amtsgericht Stuttgart HRA 741774\nRegisterbekanntmachung nach dem Umwandlungsgesetz 30.10.2024 (Eintragungsdatum)\n\nExport + Einlagerungen Andreas Schilling e.K.\nEinzelkaufmann / Einzelkauffrau\nWaiblingen\n\nAls nicht eingetragen wird bekanntgemacht:\nDen Gläubigern der an der Verschmelzung beteiligten Rechtsträger ist, wenn sie binnen sechs Monaten nach dem Tag, an dem die Eintragung der Verschmelzung in das Register des Sitzes desjenigen Rechtsträgers, dessen Gläubiger sie sind, nach § 19 Abs. 3 UmwG als bekanntgemacht gilt, ihren Anspruch nach Grund und Höhe schriftlich anmelden, Sicherheit zu leisten, soweit sie nicht Befriedigung verlangen können. Dieses Recht steht den Gläubigern jedoch nur zu, wenn sie glaubhaft machen, dass durch die Verschmelzung die Erfüllung ihrer Forderung gefährdet wird."
    },
    {
      "date": "2024-10-30",
      "id": "92093",
      "original_text": "Sonstige Registerbekanntmachung\nHamburg Amtsgericht Hamburg HRB 117672\nAlna-Holding AG – Hamburg",
      "type": "Sonstige Registerbekanntmachung",
      "state": "Hamburg",
      "amtsgericht": "Amtsgericht Hamburg",
      "registernummer": "HRB 117672",
      "registerart": "HRB",
      "company_name": "Alna-Holding AG",
      "company_seat": "Hamburg",
      "details": "30.10.2024 (Bekanntmachungsdatum)\n\nHamburg Amtsgericht Hamburg HRB 117672\nSonstige Registerbekanntmachung 25.10.2024 (Eintragungsdatum)\n\nAlna-Holding AG\nAktiengesellschaft\nHamburg\n\nDie Gesellschaft hat Gläubigern, deren Forderungen vor dieser Bekanntmachung begründet worden sind, Sicherheit zu leisten, soweit sie nicht Befriedigung verlangen können, wenn sie sich binnen sechs Monaten zu diesem Zweck melden."
    },
    {
      "date": "2024-10-30",
      "id": "92094",
      "original_text": "Registerbekanntmachung nach dem Umwandlungsgesetz\nBaden-Württemberg Amtsgericht Stuttgart HRB 738781\nEEK Export + Einlagerungen Kernen UG (haftungsbeschränkt) – Kernen im Remstal",
      "type": "Registerbekanntmachung nach dem Umwandlungsgesetz",
      "state": "Baden-Württemberg",
      "amtsgericht": "Amtsgericht Stuttgart",
      "registernummer": "HRB 738781",
      "registerart": "HRB",
      "company_name": "EEK Export + Einlagerungen Kernen UG (haftungsbeschränkt)",
      "company_seat": "Kernen im Remstal",
      "details": "30.10.2024 (Bekanntmachungsdatum)\n\nBaden-Württemberg Amtsgericht Stuttgart HRB 738781\nRegisterbekanntmachung nach dem Umwandlungsgesetz 30.10.2024 (Eintragungsdatum)\n\nEEK Export + Einlagerungen Kernen UG (haftungsbeschränkt)\nGesellschaft mit beschränkter Haftung\nKernen im Remstal\n\nDen Gläubigern der an der Verschmelzung beteiligten Rechtsträger ist, wenn sie binnen sechs Monaten nach dem Tag, an dem die Eintragung der Verschmelzung in das Register des Sitzes desjenigen Rechtsträgers, dessen Gläubiger sie sind, nach § 19 Abs. 3 UmwG als bekanntgemacht gilt, ihren Anspruch nach Grund und Höhe schriftlich anmelden, Sicherheit zu leisten, soweit sie nicht Befriedigung verlangen können. Dieses Recht steht den Gläubigern jedoch nur zu, wenn sie glaubhaft machen, dass durch die Verschmelzung die Erfüllung ihrer Forderung gefährdet wird."
    },
    {
      "date": "2024-10-30",
      "id": "92095",
      "original_text": "Löschungsankündigung\nBerlin Amtsgericht Berlin (Charlottenburg) HRB 91818\nDELI am Litfaßplatz GMBH – Berlin",
      "type": "Löschungsankündigung",
      "state": "Berlin",
      "amtsgericht": "Amtsgericht Berlin (Charlottenburg)",
      "registernummer": "HRB 91818",
      "registerart": "HRB",
      "company_name": "DELI am Litfaßplatz GMBH",
      "company_seat": "Berlin",
      "details": "30.10.2024 (Bekanntmachungsdatum)\n\nBerlin Amtsgericht Berlin (Charlottenburg) HRB 91818\nLöschungsankündigung\n\nDELI am Litfaßplatz GMBH\nGesellschaft mit beschränkter Haftung\nBerlin\n\nBei der nachstehenden Gesellschaft wird das Amtslöschungsverfahren gemäß § 394 FamFG eingeleitet. Widerspruchsfrist 6 Wochen"
    },
    {
      "date": "2024-10-30",
      "id": "92096",
      "original_text": "Löschungsankündigung\nMecklenburg-Vorpommern Amtsgericht Schwerin HRB 11193\nWork4You GmbH – Schwerin",
      "type": "Löschungsankündigung",
      "state": "Mecklenburg-Vorpommern",
      "amtsgericht": "Amtsgericht Schwerin",
      "registernummer": "HRB 11193",
      "registerart": "HRB",
      "company_name": "Work4You GmbH",
      "company_seat": "Schwerin",
      "details": "30.10.2024 (Bekanntmachungsdatum)\n\nMecklenburg-Vorpommern Amtsgericht Schwerin HRB 11193\nLöschungsankündigung\n\nWork4You GmbH\nGesellschaft mit beschränkter Haftung\nSchwerin\n\nDas Registergericht beabsichtigt, die im Handelsregister eingetragene Gesellschaft von Amts wegen nach § 394 FamFG zu löschen. Die Frist zur Erhebung eines Widerspruchs gegen die beabsichtigte Löschung wird auf 1 Monat festgesetzt."
    },
    {
      "date": "2024-10-30",
      "id": "92097",
      "original_text": "Einreichung neuer Dokumente\nBerlin Amtsgericht Berlin (Charlottenburg) HRB 66263\nHouse of Finance and Tech Berlin Gesellschaft mit beschränkter Haftung (HoFT Berlin GmbH) – Berlin",
      "type": "Einreichung neuer Dokumente",
      "state": "Berlin",
      "amtsgericht": "Amtsgericht Berlin (Charlottenburg)",
      "registernummer": "HRB 66263",
      "registerart": "HRB",
      "company_name": "House of Finance and Tech Berlin Gesellschaft mit beschränkter Haftung (HoFT Berlin GmbH)",
      "company_seat": "Berlin",
      "details": "30.10.2024 (Bekanntmachungsdatum)\n\nBerlin Amtsgericht Berlin (Charlottenburg) HRB 66263\nEinreichung neuer Dokumente\n\nHouse of Finance and Tech Berlin Gesellschaft mit beschränkter Haftung (HoFT Berlin GmbH)\nGesellschaft mit beschränkter Haftung\nBerlin\n\nAls nicht eingetragen wird veröffentlicht:Es wurde eine neue Liste der Aufsichtsratsmitglieder eingereicht (§52 GmbHG)."
    },
    {
      "date": "2024-10-30",
      "id": "92098",
      "original_text": "Löschungsankündigung\nBaden-Württemberg Amtsgericht Stuttgart HRB 740886\nBeinschrodt Haustechnik GmbH – Schorndorf",
      "type": "Löschungsankündigung",
      "state": "Baden-Württemberg",
      "amtsgericht": "Amtsgericht Stuttgart",
      "registernummer": "HRB 740886",
      "registerart": "HRB",
      "company_name": "Beinschrodt Haustechnik GmbH",
      "company_seat": "Schorndorf",
      "details": "30.10.2024 (Bekanntmachungsdatum)\n\nBaden-Württemberg Amtsgericht Stuttgart HRB 740886\nLöschungsankündigung\n\nBeinschrodt Haustechnik GmbH\nGesellschaft mit beschränkter Haftung\nSchorndorf\n\nAls nicht eingetragen wird bekanntgemacht:\nDas Gericht beabsichtigt, die Gesellschaft wegen Vermögenslosigkeit im Handelsregister von Amts wegen nach § 394 FamFG zu löschen. Die Frist zur Geltendmachung eines Widerspruchs gegen die beabsichtigte Löschung ist auf zwei Monate ab Veröffentlichung bestimmt."
    },
    {
      "date": "2024-10-30",
      "id": "92099",
      "original_text": "Registerbekanntmachung nach dem Umwandlungsgesetz\nHamburg Amtsgericht Hamburg HRB 125740\nBauer Media Audio Holding GmbH – Hamburg",
      "type": "Registerbekanntmachung nach dem Umwandlungsgesetz",
      "state": "Hamburg",
      "amtsgericht": "Amtsgericht Hamburg",
      "registernummer": "HRB 125740",
      "registerart": "HRB",
      "company_name": "Bauer Media Audio Holding GmbH",
      "company_seat": "Hamburg",
      "details": "30.10.2024 (Bekanntmachungsdatum)\n\nHamburg Amtsgericht Hamburg HRB 125740\nRegisterbekanntmachung nach dem Umwandlungsgesetz\n\nBauer Media Audio Holding GmbH\nGesellschaft mit beschränkter Haftung\nHamburg\n\nAls nicht eingetragen wird bekanntgemacht:\nEs wird darauf hingewiesen, dass ein Verschmelzungsplan oder sein Entwurf über eine grenzüberschreitende Verschmelzung zur Aufnahme mit der Siteridge Limited mit Sitz in Dublin/Irland (The Companies Registration Office 324025) (Private Company Limited by Shares - Gesellschaft mit beschränkter Haftung nach irischem Recht) beim Handelsregister eingereicht worden ist.\nDie Anteilsinhaber, die Gläubiger sowie die zuständigen Betriebsräte der an der grenzüberschreitenden Verschmelzung beteiligten Gesellschaften oder, soweit es keinen Betriebsrat gibt, die Arbeitnehmer der an der grenzüberschreitenden Verschmelzung beteiligten Gesellschaften, können der jeweiligen Gesellschaft spätestens fünf Arbeitstage vor dem Tag der Gesellschafterversammlung Bemerkungen zum Verschmelzungsplan übermitteln."
    },
    {
      "date": "2024-10-30",
      "id": "92100",
      "original_text": "Registerbekanntmachung nach dem Umwandlungsgesetz\nSchleswig-Holstein Amtsgericht Lübeck HRB 22827\nPrimagena Verlag UG (haftungsbeschränkt) – Kabelhorst",
      "type": "Registerbekanntmachung nach dem Umwandlungsgesetz",
      "state": "Schleswig-Holstein",
      "amtsgericht": "Amtsgericht Lübeck",
      "registernummer": "HRB 22827",
      "registerart": "HRB",
      "company_name": "Primagena Verlag UG (haftungsbeschränkt)",
      "company_seat": "Kabelhorst",
      "details": "30.10.2024 (Bekanntmachungsdatum)\n\nSchleswig-Holstein Amtsgericht Lübeck HRB 22827\nRegisterbekanntmachung nach dem Umwandlungsgesetz 29.10.2024 (Eintragungsdatum)\n\nPrimagena Verlag UG (haftungsbeschränkt)\nGesellschaft mit beschränkter Haftung\nKabelhorst\n\nZu Eintragungsnummer 2 vom 29.10.2024 wird als nicht eingetragen veröffentlicht: Den Gläubigern der an der Verschmelzung beteiligten Rechtsträger ist, wenn sie binnen sechs Monaten nach dem Tag, an dem die Eintragung der Verschmelzung in das Register des Sitzes desjenigen Rechtsträgers, dessen Gläubiger sie sind, als bekannt gemacht gilt, ihren Anspruch nach Grund und Höhe schriftlich anmelden, Sicherheit zu leisten, soweit sie nicht Befriedigung verlangen können. Dieses Recht steht den Gläubigern jedoch nur zu, wenn sie glaubhaft machen, dass durch die Verschmelzung die Erfüllung ihrer Forderung gefährdet wird."
    },
    {
      "date": "2024-10-30",
      "id": "92101",
      "original_text": "Sonstige Registerbekanntmachung\nBrandenburg Amtsgericht Neuruppin HRB 250\nGebäude- und Wohnungswirtschaft Gesellschaft mit beschränkter Haftung Zehdenick – Zehdenick",
      "type": "Sonstige Registerbekanntmachung",
      "state": "Brandenburg",
      "amtsgericht": "Amtsgericht Neuruppin",
      "registernummer": "HRB 250",
      "registerart": "HRB",
      "company_name": "Gebäude- und Wohnungswirtschaft Gesellschaft mit beschränkter Haftung Zehdenick",
      "company_seat": "Zehdenick",
      "details": "30.10.2024 (Bekanntmachungsdatum)\n\nBrandenburg Amtsgericht Neuruppin HRB 250\nSonstige Registerbekanntmachung\n\nGebäude- und Wohnungswirtschaft Gesellschaft mit beschränkter Haftung Zehdenick\nGesellschaft mit beschränkter Haftung\nZehdenick\n\nAls nicht eingetragen wird veröffentlicht: Eine Liste der Mitglieder des Aufsichtsrates wurde zum Handelsregister eingereicht."
    },
    {
      "date": "2024-10-30",
      "id": "92102",
      "original_text": "Registerbekanntmachung nach dem Umwandlungsgesetz\nBaden-Württemberg Amtsgericht Mannheim VR 704214\nMusikkapelle St. Leon-Rot e.V. – St. Leon-Rot",
      "type": "Registerbekanntmachung nach dem Umwandlungsgesetz",
      "state": "Baden-Württemberg",
      "amtsgericht": "Amtsgericht Mannheim",
      "registernummer": "VR 704214",
      "registerart": "VR",
      "company_name": "Musikkapelle St. Leon-Rot e.V.",
      "company_seat": "St. Leon-Rot",
      "details": "30.10.2024 (Bekanntmachungsdatum)\n\nBaden-Württemberg Amtsgericht Mannheim VR 704214\nRegisterbekanntmachung nach dem Umwandlungsgesetz 30.10.2024 (Eintragungsdatum)\n\nMusikkapelle St. Leon-Rot e.V.\neingetragener Verein\nSt. Leon-Rot\n\nDen Gläubigern der an der Verschmelzung beteiligten Rechtsträger ist, wenn sie binnen sechs Monaten nach dem Tag, an dem die Eintragung der Verschmelzung in das Register des Sitzes desjenigen Rechtsträgers, dessen Gläubiger sie sind, nach § 19 Abs. 3 UmwG als bekanntgemacht gilt, ihren Anspruch nach Grund und Höhe schriftlich anmelden, Sicherheit zu leisten, soweit sie nicht Befriedigung verlangen können. Dieses Recht steht den Gläubigern jedoch nur zu, wenn sie glaubhaft machen, dass durch die Verschmelzung die Erfüllung ihrer Forderung gefährdet wird."
    },
    {
      "date": "2024-10-30",
      "id": "92103",
      "original_text": "Registerbekanntmachung nach dem Umwandlungsgesetz\nBaden-Württemberg Amtsgericht Mannheim VR 350258\nMusikverein 1921 Rot e.V. – St. Leon-Rot",
      "type": "Registerbekanntmachung nach dem Umwandlungsgesetz",
      "state": "Baden-Württemberg",
      "amtsgericht": "Amtsgericht Mannheim",
      "registernummer": "VR 350258",
      "registerart": "VR",
      "company_name": "Musikverein 1921 Rot e.V.",
      "company_seat": "St. Leon-Rot",
      "details": "30.10.2024 (Bekanntmachungsdatum)\n\nBaden-Württemberg Amtsgericht Mannheim VR 350258\nRegisterbekanntmachung nach dem Umwandlungsgesetz 30.10.2024 (Eintragungsdatum)\n\nMusikverein 1921 Rot e.V.\neingetragener Verein\nSt. Leon-Rot\n\nDen Gläubigern der an der Verschmelzung beteiligten Rechtsträger ist, wenn sie binnen sechs Monaten nach dem Tag, an dem die Eintragung der Verschmelzung in das Register des Sitzes desjenigen Rechtsträgers, dessen Gläubiger sie sind, nach § 19 Abs. 3 UmwG als bekanntgemacht gilt, ihren Anspruch nach Grund und Höhe schriftlich anmelden, Sicherheit zu leisten, soweit sie nicht Befriedigung verlangen können. Dieses Recht steht den Gläubigern jedoch nur zu, wenn sie glaubhaft machen, dass durch die Verschmelzung die Erfüllung ihrer Forderung gefährdet wird."
    },
    {
      "date": "2024-10-30",
      "id": "92104",
      "original_text": "Löschungsankündigung\nMecklenburg-Vorpommern Amtsgericht Schwerin HRB 10393\nWERIMO Schweiß- und Anlagentechnik GmbH – Neukloster",
      "type": "Löschungsankündigung",
      "state": "Mecklenburg-Vorpommern",
      "amtsgericht": "Amtsgericht Schwerin",
      "registernummer": "HRB 10393",
      "registerart": "HRB",
      "company_name": "WERIMO Schweiß- und Anlagentechnik GmbH",
      "company_seat": "Neukloster",
      "details": "30.10.2024 (Bekanntmachungsdatum)\n\nMecklenburg-Vorpommern Amtsgericht Schwerin HRB 10393\nLöschungsankündigung\n\nWERIMO Schweiß- und Anlagentechnik GmbH\nGesellschaft mit beschränkter Haftung\nNeukloster\n\nDas Registergericht beabsichtigt, die im Handelsregister eingetragene Gesellschaft von Amts wegen nach § 394 FamFG zu löschen. Die Frist zur Erhebung eines Widerspruchs gegen die beabsichtigte Löschung wird auf 1 Monat festgesetzt."
    },
    {
      "date": "2024-10-30",
      "id": "92105",
      "original_text": "Löschungsankündigung\nMecklenburg-Vorpommern Amtsgericht Rostock HRB 13223\nBM Eventagentur UG (haftungsbeschränkt) – Dummerstorf",
      "type": "Löschungsankündigung",
      "state": "Mecklenburg-Vorpommern",
      "amtsgericht": "Amtsgericht Rostock",
      "registernummer": "HRB 13223",
      "registerart": "HRB",
      "company_name": "BM Eventagentur UG (haftungsbeschränkt)",
      "company_seat": "Dummerstorf",
      "details": "30.10.2024 (Bekanntmachungsdatum)\n\nMecklenburg-Vorpommern Amtsgericht Rostock HRB 13223\nLöschungsankündigung\n\nBM Eventagentur UG (haftungsbeschränkt)\nGesellschaft mit beschränkter Haftung\nDummerstorf\n\nDas Registergericht beabsichtigt, die im Handelsregister eingetragene Gesellschaft von Amts wegen nach § 394 FamFG zu löschen. Die Frist zur Erhebung eines Widerspruchs gegen die beabsichtigte Löschung wird auf einen Monat festgesetzt."
    },
    {
      "date": "2024-10-30",
      "id": "92106",
      "original_text": "Löschungsankündigung\nSchleswig-Holstein Amtsgericht Lübeck HRB 18728\nService Point Nord UG (haftungsbeschränkt) – Ahrensbök",
      "type": "Löschungsankündigung",
      "state": "Schleswig-Holstein",
      "amtsgericht": "Amtsgericht Lübeck",
      "registernummer": "HRB 18728",
      "registerart": "HRB",
      "company_name": "Service Point Nord UG (haftungsbeschränkt)",
      "company_seat": "Ahrensbök",
      "details": "30.10.2024 (Bekanntmachungsdatum)\n\nSchleswig-Holstein Amtsgericht Lübeck HRB 18728\nLöschungsankündigung\n\nService Point Nord UG (haftungsbeschränkt)\nGesellschaft mit beschränkter Haftung\nAhrensbök\n\nEs ist die Löschung der nachstehenden Gesellschaft wegen Vermögenslosigkeit gemäß § 394 FamFG beabsichtigt.\nWiderspruchsfrist: 1 Monat"
    },
    {
      "date": "2024-10-30",
      "id": "92107",
      "original_text": "Sonstige Registerbekanntmachung\nHamburg Amtsgericht Hamburg HRB 112428\nGerman Marine Systems GmbH – Hamburg",
      "type": "Sonstige Registerbekanntmachung",
      "state": "Hamburg",
      "amtsgericht": "Amtsgericht Hamburg",
      "registernummer": "HRB 112428",
      "registerart": "HRB",
      "company_name": "German Marine Systems GmbH",
      "company_seat": "Hamburg",
      "details": "30.10.2024 (Bekanntmachungsdatum)\n\nHamburg Amtsgericht Hamburg HRB 112428\nSonstige Registerbekanntmachung 30.10.2024 (Eintragungsdatum)\n\nGerman Marine Systems GmbH\nGesellschaft mit beschränkter Haftung\nHamburg\n\nAls nicht eingetragen wird bekannt gemacht:  Den Gläubigern der Gesellschaft, deren Forderungen begründet worden sind, bevor die Eintragung der Vertragsbeendigung in das Handelsregister nach § 10 HGB als bekannt gemacht gilt, ist vom anderen Vertragsteil Sicherheit zu leisten, wenn sie sich binnen 6 Monaten nach Bekanntmachung der Eintragung zu diesem Zweck bei ihm melden."
    },
    {
      "date": "2024-10-30",
      "id": "92108",
      "original_text": "Sonstige Registerbekanntmachung\nMecklenburg-Vorpommern Amtsgericht Rostock HRB 13159\nNordwasser GmbH – Rostock",
      "type": "Sonstige Registerbekanntmachung",
      "state": "Mecklenburg-Vorpommern",
      "amtsgericht": "Amtsgericht Rostock",
      "registernummer": "HRB 13159",
      "registerart": "HRB",
      "company_name": "Nordwasser GmbH",
      "company_seat": "Rostock",
      "details": "30.10.2024 (Bekanntmachungsdatum)\n\nMecklenburg-Vorpommern Amtsgericht Rostock HRB 13159\nSonstige Registerbekanntmachung 30.10.2024 (Eintragungsdatum)\n\nNordwasser GmbH\nGesellschaft mit beschränkter Haftung\nRostock\n\nEine Liste der Mitglieder des Aufsichtsrats ist zum Handelsregister eingereicht worden."
    },
    {
      "date": "2024-10-30",
      "id": "92109",
      "original_text": "Registerbekanntmachung nach dem Umwandlungsgesetz\nSchleswig-Holstein Amtsgericht Lübeck HRB 22675\nTL VV GmbH – Kabelhorst",
      "type": "Registerbekanntmachung nach dem Umwandlungsgesetz",
      "state": "Schleswig-Holstein",
      "amtsgericht": "Amtsgericht Lübeck",
      "registernummer": "HRB 22675",
      "registerart": "HRB",
      "company_name": "TL VV GmbH",
      "company_seat": "Kabelhorst",
      "details": "30.10.2024 (Bekanntmachungsdatum)\n\nSchleswig-Holstein Amtsgericht Lübeck HRB 22675\nRegisterbekanntmachung nach dem Umwandlungsgesetz 29.10.2024 (Eintragungsdatum)\n\nTL VV GmbH\nGesellschaft mit beschränkter Haftung\nKabelhorst\n\nZu Eintragungsnummer 2 vom 29.10.2024 wird als nicht eingetragen veröffentlicht: Den Gläubigern der an der Verschmelzung beteiligten Rechtsträger ist, wenn sie binnen sechs Monaten nach dem Tag, an dem die Eintragung der Verschmelzung in das Register des Sitzes desjenigen Rechtsträgers, dessen Gläubiger sie sind, als bekannt gemacht gilt, ihren Anspruch nach Grund und Höhe schriftlich anmelden, Sicherheit zu leisten, soweit sie nicht Befriedigung verlangen können. Dieses Recht steht den Gläubigern jedoch nur zu, wenn sie glaubhaft machen, dass durch die Verschmelzung die Erfüllung ihrer Forderung gefährdet wird."
    },
    {
      "date": "2024-10-30",
      "id": "92110",
      "original_text": "Registerbekanntmachung nach dem Umwandlungsgesetz\nBaden-Württemberg Amtsgericht Ulm HRB 736837\nHeimatküche Bechingen GmbH – Riedlingen",
      "type": "Registerbekanntmachung nach dem Umwandlungsgesetz",
      "state": "Baden-Württemberg",
      "amtsgericht": "Amtsgericht Ulm",
      "registernummer": "HRB 736837",
      "registerart": "HRB",
      "company_name": "Heimatküche Bechingen GmbH",
      "company_seat": "Riedlingen",
      "details": "30.10.2024 (Bekanntmachungsdatum)\n\nBaden-Württemberg Amtsgericht Ulm HRB 736837\nRegisterbekanntmachung nach dem Umwandlungsgesetz 30.10.2024 (Eintragungsdatum)\n\nHeimatküche Bechingen GmbH\nGesellschaft mit beschränkter Haftung\nRiedlingen\n\nAls nicht eingetragen wird bekanntgemacht:\nDen Gläubigern der an der Verschmelzung beteiligten Rechtsträger ist, wenn sie binnen sechs Monaten nach dem Tag, an dem die Eintragung der Verschmelzung in das Register des Sitzes desjenigen Rechtsträgers, dessen Gläubiger sie sind, nach § 19 Abs. 3 UmwG als bekanntgemacht gilt, ihren Anspruch nach Grund und Höhe schriftlich anmelden, Sicherheit zu leisten, soweit sie nicht Befriedigung verlangen können. Dieses Recht steht den Gläubigern jedoch nur zu, wenn sie glaubhaft machen, dass durch die Verschmelzung die Erfüllung ihrer Forderung gefährdet wird."
    },
    {
      "date": "2024-10-30",
      "id": "92111",
      "original_text": "Sonstige Registerbekanntmachung\nMecklenburg-Vorpommern Amtsgericht Rostock HRB 10139\nGIG Güstrower Immobilien- und Gebäudemanagement Gesellschaft mit beschränkter Haftung – Güstrow",
      "type": "Sonstige Registerbekanntmachung",
      "state": "Mecklenburg-Vorpommern",
      "amtsgericht": "Amtsgericht Rostock",
      "registernummer": "HRB 10139",
      "registerart": "HRB",
      "company_name": "GIG Güstrower Immobilien- und Gebäudemanagement Gesellschaft mit beschränkter Haftung",
      "company_seat": "Güstrow",
      "details": "30.10.2024 (Bekanntmachungsdatum)\n\nMecklenburg-Vorpommern Amtsgericht Rostock HRB 10139\nSonstige Registerbekanntmachung 30.10.2024 (Eintragungsdatum)\n\nGIG Güstrower Immobilien- und Gebäudemanagement Gesellschaft mit beschränkter Haftung\nGesellschaft mit beschränkter Haftung\nGüstrow\n\nEine Liste der Mitglieder des Aufsichtsrats ist zum Handelsregister eingereicht worden."
    },
    {
      "date": "2024-10-30",
      "id": "92112",
      "original_text": "Einreichung neuer Dokumente\nSachsen Amtsgericht Dresden HRB 6811\nLausitzhalle Hoyerswerda GmbH – Hoyerswerda",
      "type": "Einreichung neuer Dokumente",
      "state": "Sachsen",
      "amtsgericht": "Amtsgericht Dresden",
      "registernummer": "HRB 6811",
      "registerart": "HRB",
      "company_name": "Lausitzhalle Hoyerswerda GmbH",
      "company_seat": "Hoyerswerda",
      "details": "30.10.2024 (Bekanntmachungsdatum)\n\nSachsen Amtsgericht Dresden HRB 6811\nEinreichung neuer Dokumente\n\nLausitzhalle Hoyerswerda GmbH\nGesellschaft mit beschränkter Haftung\nHoyerswerda\n\nAm 29.10.2024 wurde beim Handelsregister des Amtsgerichts Dresden die Liste der Mitglieder des Aufsichtsrats gemäß § 52 GmbHG eingereicht."
    },
    {
      "date": "2024-10-30",
      "id": "92113",
      "original_text": "Löschungsankündigung\nSachsen Amtsgericht Chemnitz HRB 24862\nBST Forging GmbH – Brand-Erbisdorf",
      "type": "Löschungsankündigung",
      "state": "Sachsen",
      "amtsgericht": "Amtsgericht Chemnitz",
      "registernummer": "HRB 24862",
      "registerart": "HRB",
      "company_name": "BST Forging GmbH",
      "company_seat": "Brand-Erbisdorf",
      "details": "30.10.2024 (Bekanntmachungsdatum)\n\nSachsen Amtsgericht Chemnitz HRB 24862\nLöschungsankündigung\n\nBST Forging GmbH\nGesellschaft mit beschränkter Haftung\nBrand-Erbisdorf\n\nDas Registergericht beabsichtigt, die im Handelsregister eingetragene Gesellschaft von Amts wegen nach § 394 FamFG zu löschen. Die Frist zu Erhebung eines Widerspruchs gegen die beabsichtigte Löschung wird auf einen Monat festgesetzt."
    },
    {
      "date": "2024-10-30",
      "id": "92114",
      "original_text": "Registerbekanntmachung nach dem Umwandlungsgesetz\nSachsen Amtsgericht Leipzig HRB 43340\nMaklerbüro Schmedicke GmbH – Leipzig",
      "type": "Registerbekanntmachung nach dem Umwandlungsgesetz",
      "state": "Sachsen",
      "amtsgericht": "Amtsgericht Leipzig",
      "registernummer": "HRB 43340",
      "registerart": "HRB",
      "company_name": "Maklerbüro Schmedicke GmbH",
      "company_seat": "Leipzig",
      "details": "30.10.2024 (Bekanntmachungsdatum)\n\nSachsen Amtsgericht Leipzig HRB 43340\nRegisterbekanntmachung nach dem Umwandlungsgesetz 30.10.2024 (Eintragungsdatum)\n\nMaklerbüro Schmedicke GmbH\nGesellschaft mit beschränkter Haftung\nLeipzig\n\nDen Gläubigern der an der Ausgliederung beteiligten Rechtsträger ist, wenn sie binnen sechs Monaten nach dem Tag, an dem die Eintragung der Ausgliederung in das Register des Sitzes desjenigen Rechtsträgers, dessen Gläubiger sie sind, nach § 19 Abs. 3 UmwG als bekannt gemacht gilt, ihren Anspruch nach Grund und Höhe schriftlich anmelden, Sicherheit zu leisten, soweit sie nicht Befriedigung verlangen können. Dieses Recht steht den Gläubigern jedoch nur zu, wenn sie glaubhaft machen, dass durch die Ausgliederung die Erfüllung der Forderung gefährdet wird."
    },
    {
      "date": "2024-10-30",
      "id": "92115",
      "original_text": "Einreichung neuer Dokumente\nSachsen Amtsgericht Dresden HRB 4066\nStadtwerke Löbau GmbH – Löbau",
      "type": "Einreichung neuer Dokumente",
      "state": "Sachsen",
      "amtsgericht": "Amtsgericht Dresden",
      "registernummer": "HRB 4066",
      "registerart": "HRB",
      "company_name": "Stadtwerke Löbau GmbH",
      "company_seat": "Löbau",
      "details": "30.10.2024 (Bekanntmachungsdatum)\n\nSachsen Amtsgericht Dresden HRB 4066\nEinreichung neuer Dokumente\n\nStadtwerke Löbau GmbH\nGesellschaft mit beschränkter Haftung\nLöbau\n\nAm 29.10.2024 wurde beim Handelsregister des Amtsgerichts Dresden die Liste der Mitglieder des Aufsichtsrats gemäß § 52 GmbHG eingereicht."
    },
    {
      "date": "2024-10-30",
      "id": "92116",
      "original_text": "Einreichung neuer Dokumente\nSachsen Amtsgericht Dresden HRB 2626\nDREWAG - Stadtwerke Dresden GmbH – Dresden",
      "type": "Einreichung neuer Dokumente",
      "state": "Sachsen",
      "amtsgericht": "Amtsgericht Dresden",
      "registernummer": "HRB 2626",
      "registerart": "HRB",
      "company_name": "DREWAG - Stadtwerke Dresden GmbH",
      "company_seat": "Dresden",
      "details": "30.10.2024 (Bekanntmachungsdatum)\n\nSachsen Amtsgericht Dresden HRB 2626\nEinreichung neuer Dokumente\n\nDREWAG - Stadtwerke Dresden GmbH\nGesellschaft mit beschränkter Haftung\nDresden\n\nAm 29.10.2024 wurde beim Handelsregister des Amtsgerichts Dresden die Liste der Mitglieder des Aufsichtsrats gemäß § 52 GmbHG eingereicht."
    },
    {
      "date": "2024-10-30",
      "id": "92117",
      "original_text": "Registerbekanntmachung nach dem Umwandlungsgesetz\nSachsen Amtsgericht Leipzig HRA 19254\nSteffen Schmedicke e.K. – Leipzig",
      "type": "Registerbekanntmachung nach dem Umwandlungsgesetz",
      "state": "Sachsen",
      "amtsgericht": "Amtsgericht Leipzig",
      "registernummer": "HRA 19254",
      "registerart": "HRA",
      "company_name": "Steffen Schmedicke e.K.",
      "company_seat": "Leipzig",
      "details": "30.10.2024 (Bekanntmachungsdatum)\n\nSachsen Amtsgericht Leipzig HRA 19254\nRegisterbekanntmachung nach dem Umwandlungsgesetz 30.10.2024 (Eintragungsdatum)\n\nSteffen Schmedicke e.K.\nEinzelkaufmann / Einzelkauffrau\nLeipzig\n\nDen Gläubigern der an der Ausgliederung beteiligten Rechtsträger ist, wenn sie binnen sechs Monaten nach dem Tag, an dem die Eintragung der Ausgliederung in das Register des Sitzes desjenigen Rechtsträgers, dessen Gläubiger sie sind, nach § 19 Abs. 3 UmwG als bekannt gemacht gilt, ihren Anspruch nach Grund und Höhe schriftlich anmelden, Sicherheit zu leisten, soweit sie nicht Befriedigung verlangen können. Dieses Recht steht den Gläubigern jedoch nur zu, wenn sie glaubhaft machen, dass durch die Ausgliederung die Erfüllung der Forderung gefährdet wird."
    },
    {
      "date": "2024-10-30",
      "id": "92118",
      "original_text": "Registerbekanntmachung nach dem Umwandlungsgesetz\nNiedersachsen Amtsgericht Osnabrück HRB 20863\nWilhelm Renzenbrink Metallbau Gesellschaft mit beschränkter Haftung – Bramsche",
      "type": "Registerbekanntmachung nach dem Umwandlungsgesetz",
      "state": "Niedersachsen",
      "amtsgericht": "Amtsgericht Osnabrück",
      "registernummer": "HRB 20863",
      "registerart": "HRB",
      "company_name": "Wilhelm Renzenbrink Metallbau Gesellschaft mit beschränkter Haftung",
      "company_seat": "Bramsche",
      "details": "30.10.2024 (Bekanntmachungsdatum)\n\nNiedersachsen Amtsgericht Osnabrück HRB 20863\nRegisterbekanntmachung nach dem Umwandlungsgesetz 30.10.2024 (Eintragungsdatum)\n\nWilhelm Renzenbrink Metallbau Gesellschaft mit beschränkter Haftung\nGesellschaft mit beschränkter Haftung\nBramsche\n\nDen Gläubigern der an der Verschmelzung beteiligten Rechtsträger ist, wenn sie binnen sechs Monaten nach dem Tag, an dem die Eintragung der Verschmelzung in das Register des Sitzes desjenigen Rechtsträgers, dessen Gläubiger sie sind, nach § 19  Abs.  3 UmwG als bekannt gemacht gilt, ihren Anspruch nach Grund und Höhe schriftlich anmelden, Sicherheit zu leisten, soweit sie nicht Befriedigung verlangen können. Dieses Recht steht den Gläubigern jedoch nur zu, wenn sie glaubhaft machen, dass durch die Verschmelzung die Erfüllung der Forderung gefährdet wird."
    },
    {
      "date": "2024-10-30",
      "id": "92119",
      "original_text": "Löschungsankündigung\nNiedersachsen Amtsgericht Osnabrück HRB 213987\nLeft Hand Sourcing UG (haftungsbeschränkt) – Bersenbrück",
      "type": "Löschungsankündigung",
      "state": "Niedersachsen",
      "amtsgericht": "Amtsgericht Osnabrück",
      "registernummer": "HRB 213987",
      "registerart": "HRB",
      "company_name": "Left Hand Sourcing UG (haftungsbeschränkt)",
      "company_seat": "Bersenbrück",
      "details": "30.10.2024 (Bekanntmachungsdatum)\n\nNiedersachsen Amtsgericht Osnabrück HRB 213987\nLöschungsankündigung\n\nLeft Hand Sourcing UG (haftungsbeschränkt)\nGesellschaft mit beschränkter Haftung\nBersenbrück\n\nDas Registergericht beabsichtigt, die Gesellschaft von Amts wegen nach § 394 FamFG wegen Vermögenslosigkeit zu löschen. Die Frist zur Erhebung eines Widerspruchs ist auf 1 Monat ab dieser Registerbekanntmachung festgesetzt."
    },
    {
      "date": "2024-10-30",
      "id": "92120",
      "original_text": "Registerbekanntmachung nach dem Umwandlungsgesetz\nNiedersachsen Amtsgericht Osnabrück HRA 209227\nThomas Gerdes e.K. – Nordhorn",
      "type": "Registerbekanntmachung nach dem Umwandlungsgesetz",
      "state": "Niedersachsen",
      "amtsgericht": "Amtsgericht Osnabrück",
      "registernummer": "HRA 209227",
      "registerart": "HRA",
      "company_name": "Thomas Gerdes e.K.",
      "company_seat": "Nordhorn",
      "details": "30.10.2024 (Bekanntmachungsdatum)\n\nNiedersachsen Amtsgericht Osnabrück HRA 209227\nRegisterbekanntmachung nach dem Umwandlungsgesetz 30.10.2024 (Eintragungsdatum)\n\nThomas Gerdes e.K.\nEinzelkaufmann / Einzelkauffrau\nNordhorn\n\nDen Gläubigern der an der Ausgliederung beteiligten Rechtsträger ist, wenn sie binnen sechs Monaten nach dem Tag, an dem die Eintragung der Ausgliederung in das Register des Sitzes desjenigen Rechtsträgers, dessen Gläubiger sie sind, nach § 19 Abs. 3 UmwG als bekannt gemacht gilt, ihren Anspruch nach Grund und Höhe schriftlich anmelden, Sicherheit zu leisten, soweit sie nicht Befriedigung verlangen können. Dieses Recht steht den Gläubigern jedoch nur zu, wenn sie glaubhaft machen, dass durch die Ausgliederung die Erfüllung der Forderung gefährdet wird."
    },
    {
      "date": "2024-10-30",
      "id": "92121",
      "original_text": "Registerbekanntmachung nach dem Umwandlungsgesetz\nNiedersachsen Amtsgericht Hildesheim HRB 209679\nHeiTec ROHSTOFFE GmbH – Delligsen",
      "type": "Registerbekanntmachung nach dem Umwandlungsgesetz",
      "state": "Niedersachsen",
      "amtsgericht": "Amtsgericht Hildesheim",
      "registernummer": "HRB 209679",
      "registerart": "HRB",
      "company_name": "HeiTec ROHSTOFFE GmbH",
      "company_seat": "Delligsen",
      "details": "30.10.2024 (Bekanntmachungsdatum)\n\nNiedersachsen Amtsgericht Hildesheim HRB 209679\nRegisterbekanntmachung nach dem Umwandlungsgesetz 30.10.2024 (Eintragungsdatum)\n\nHeiTec ROHSTOFFE GmbH\nGesellschaft mit beschränkter Haftung\nDelligsen\n\nDen Gläubigern der an der Ausgliederung beteiligten Rechtsträger ist, wenn sie binnen sechs Monaten nach dem Tag, an dem die Eintragung der Ausgliederung in das Register des Sitzes desjenigen Rechtsträgers, dessen Gläubiger sie sind, nach § 19 Abs. 3 UmwG als bekannt gemacht gilt, ihren Anspruch nach Grund und Höhe schriftlich anmelden, Sicherheit zu leisten, soweit sie nicht Befriedigung verlangen können. Dieses Recht steht den Gläubigern jedoch nur zu, wenn sie glaubhaft machen, dass durch die Ausgliederung die Erfüllung der Forderung gefährdet wird."
    },
    {
      "date": "2024-10-30",
      "id": "92122",
      "original_text": "Registerbekanntmachung nach dem Umwandlungsgesetz\nNiedersachsen Amtsgericht Osnabrück HRB 122369\nGSV - Gesellschaft für Seuchenvorsorge Emsland-Grafschaft Bentheim GmbH – Meppen",
      "type": "Registerbekanntmachung nach dem Umwandlungsgesetz",
      "state": "Niedersachsen",
      "amtsgericht": "Amtsgericht Osnabrück",
      "registernummer": "HRB 122369",
      "registerart": "HRB",
      "company_name": "GSV - Gesellschaft für Seuchenvorsorge Emsland-Grafschaft Bentheim GmbH",
      "company_seat": "Meppen",
      "details": "30.10.2024 (Bekanntmachungsdatum)\n\nNiedersachsen Amtsgericht Osnabrück HRB 122369\nRegisterbekanntmachung nach dem Umwandlungsgesetz 30.10.2024 (Eintragungsdatum)\n\nGSV - Gesellschaft für Seuchenvorsorge Emsland-Grafschaft Bentheim GmbH\nGesellschaft mit beschränkter Haftung\nMeppen\n\nDen Gläubigern der an der Ausgliederung beteiligten Rechtsträger ist, wenn sie binnen sechs Monaten nach dem Tag, an dem die Eintragung der Ausgliederung in das Register des Sitzes desjenigen Rechtsträgers, dessen Gläubiger sie sind, nach § 19 Abs. 3 UmwG als bekannt gemacht gilt, ihren Anspruch nach Grund und Höhe schriftlich anmelden, Sicherheit zu leisten, soweit sie nicht Befriedigung verlangen können. Dieses Recht steht den Gläubigern jedoch nur zu, wenn sie glaubhaft machen, dass durch die Ausgliederung die Erfüllung der Forderung gefährdet wird."
    },
    {
      "date": "2024-10-30",
      "id": "92123",
      "original_text": "Löschungsankündigung\nNiedersachsen Amtsgericht Hannover HRA 202801\nDolphin Capital 208. Projekt GmbH & Co. KG – Langenhagen",
      "type": "Löschungsankündigung",
      "state": "Niedersachsen",
      "amtsgericht": "Amtsgericht Hannover",
      "registernummer": "HRA 202801",
      "registerart": "HRA",
      "company_name": "Dolphin Capital 208. Projekt GmbH & Co. KG",
      "company_seat": "Langenhagen",
      "details": "30.10.2024 (Bekanntmachungsdatum)\n\nNiedersachsen Amtsgericht Hannover HRA 202801\nLöschungsankündigung\n\nDolphin Capital 208. Projekt GmbH & Co. KG\nKommanditgesellschaft\nLangenhagen\n\nDas Registergericht beabsichtigt, die Firma von Amts wegen nach § 394 FamFG zu löschen. Die Frist zur Erhebung eines Widerspruchs ist auf 1 Monat ab dieser Registerbekanntmachung festgesetzt."
    },
    {
      "date": "2024-10-30",
      "id": "92124",
      "original_text": "Löschungsankündigung\nNiedersachsen Amtsgericht Braunschweig HRB 100634 früher Amtsgericht Wolfsburg\nAGENTUR ASMEDIC Vermittlung und Vertrieb medizinischer und zahnmedizinischer Ausstattungen GmbH – Helmstedt",
      "type": "Löschungsankündigung",
      "state": "Niedersachsen",
      "amtsgericht": "Amtsgericht Braunschweig",
      "registernummer": "HRB 100634",
      "registerart": "HRB",
      "company_name": "AGENTUR ASMEDIC Vermittlung und Vertrieb medizinischer und zahnmedizinischer Ausstattungen GmbH",
      "company_seat": "Helmstedt",
      "former_amtsgericht": "Wolfsburg",
      "details": "30.10.2024 (Bekanntmachungsdatum)\n\nNiedersachsen Amtsgericht Braunschweig HRB 100634 früher Amtsgericht Wolfsburg\nLöschungsankündigung\n\nAGENTUR ASMEDIC Vermittlung und Vertrieb medizinischer und zahnmedizinischer Ausstattungen GmbH\nGesellschaft mit beschränkter Haftung\nHelmstedt\n\nDas Registergericht beabsichtigt, die Gesellschaft von Amts wegen nach § 394 FamFG zu löschen. Die Frist zur Erhebung eines Widerspruchs ist auf 1 Monat ab dieser Registerbekanntmachung festgesetzt."
    },
    {
      "date": "2024-10-30",
      "id": "92125",
      "original_text": "Registerbekanntmachung nach dem Umwandlungsgesetz\nNiedersachsen Amtsgericht Stadthagen HRB 202092\nWB Qualitätswohnbau GmbH – Stadthagen",
      "type": "Registerbekanntmachung nach dem Umwandlungsgesetz",
      "state": "Niedersachsen",
      "amtsgericht": "Amtsgericht Stadthagen",
      "registernummer": "HRB 202092",
      "registerart": "HRB",
      "company_name": "WB Qualitätswohnbau GmbH",
      "company_seat": "Stadthagen",
      "details": "30.10.2024 (Bekanntmachungsdatum)\n\nNiedersachsen Amtsgericht Stadthagen HRB 202092\nRegisterbekanntmachung nach dem Umwandlungsgesetz 29.10.2024 (Eintragungsdatum)\n\nWB Qualitätswohnbau GmbH\nGesellschaft mit beschränkter Haftung\nStadthagen\n\nDen Gläubigern der an der Verschmelzung beteiligten Rechtsträger ist, wenn sie binnen sechs Monaten nach dem Tag, an dem die Eintragung der Verschmelzung in das Register des Sitzes desjenigen Rechtsträgers, dessen Gläubiger sie sind, nach § 19  Abs.  3 UmwG als bekannt gemacht gilt, ihren Anspruch nach Grund und Höhe schriftlich anmelden, Sicherheit zu leisten, soweit sie nicht Befriedigung verlangen können. Dieses Recht steht den Gläubigern jedoch nur zu, wenn sie glaubhaft machen, dass durch die Verschmelzung die Erfüllung der Forderung gefährdet wird."
    },
    {
      "date": "2024-10-30",
      "id": "92126",
      "original_text": "Einreichung neuer Dokumente\nNiedersachsen Amtsgericht Hannover HRB 204239\nContinental Reifen Deutschland GmbH – Hannover",
      "type": "Einreichung neuer Dokumente",
      "state": "Niedersachsen",
      "amtsgericht": "Amtsgericht Hannover",
      "registernummer": "HRB 204239",
      "registerart": "HRB",
      "company_name": "Continental Reifen Deutschland GmbH",
      "company_seat": "Hannover",
      "details": "30.10.2024 (Bekanntmachungsdatum)\n\nNiedersachsen Amtsgericht Hannover HRB 204239\nEinreichung neuer Dokumente\n\nContinental Reifen Deutschland GmbH\nGesellschaft mit beschränkter Haftung\nHannover\n\nDie Liste der Mitglieder des Aufsichtsrats wurde beim Registergericht eingereicht."
    },
    {
      "date": "2024-10-30",
      "id": "92127",
      "original_text": "Registerbekanntmachung nach dem Umwandlungsgesetz\nNiedersachsen Amtsgericht Hildesheim HRB 201226\nHeiTec INDUSTRIES GmbH – Delligsen",
      "type": "Registerbekanntmachung nach dem Umwandlungsgesetz",
      "state": "Niedersachsen",
      "amtsgericht": "Amtsgericht Hildesheim",
      "registernummer": "HRB 201226",
      "registerart": "HRB",
      "company_name": "HeiTec INDUSTRIES GmbH",
      "company_seat": "Delligsen",
      "details": "30.10.2024 (Bekanntmachungsdatum)\n\nNiedersachsen Amtsgericht Hildesheim HRB 201226\nRegisterbekanntmachung nach dem Umwandlungsgesetz 30.10.2024 (Eintragungsdatum)\n\nHeiTec INDUSTRIES GmbH\nGesellschaft mit beschränkter Haftung\nDelligsen\n\nDen Gläubigern der an der Ausgliederung beteiligten Rechtsträger ist, wenn sie binnen sechs Monaten nach dem Tag, an dem die Eintragung der Ausgliederung in das Register des Sitzes desjenigen Rechtsträgers, dessen Gläubiger sie sind, nach § 19 Abs. 3 UmwG als bekannt gemacht gilt, ihren Anspruch nach Grund und Höhe schriftlich anmelden, Sicherheit zu leisten, soweit sie nicht Befriedigung verlangen können. Dieses Recht steht den Gläubigern jedoch nur zu, wenn sie glaubhaft machen, dass durch die Ausgliederung die Erfüllung der Forderung gefährdet wird."
    },
    {
      "date": "2024-10-30",
      "id": "92128",
      "original_text": "Registerbekanntmachung nach dem Umwandlungsgesetz\nNiedersachsen Amtsgericht Oldenburg (Oldenburg) HRB 217117\nFoodCon 1.L GmbH – Dötlingen",
      "type": "Registerbekanntmachung nach dem Umwandlungsgesetz",
      "state": "Niedersachsen",
      "amtsgericht": "Amtsgericht Oldenburg (Oldenburg)",
      "registernummer": "HRB 217117",
      "registerart": "HRB",
      "company_name": "FoodCon 1.L GmbH",
      "company_seat": "Dötlingen",
      "details": "30.10.2024 (Bekanntmachungsdatum)\n\nNiedersachsen Amtsgericht Oldenburg (Oldenburg) HRB 217117\nRegisterbekanntmachung nach dem Umwandlungsgesetz 10.09.2024 (Eintragungsdatum)\n\nFoodCon 1.L GmbH\nGesellschaft mit beschränkter Haftung\nDötlingen\n\nDen Gläubigern der an der Verschmelzung beteiligten Rechtsträger ist, wenn sie binnen sechs Monaten nach dem Tag, an dem die Eintragung der Verschmelzung in das Register des Sitzes desjenigen Rechtsträgers, dessen Gläubiger sie sind, nach § 19  Abs.  3 UmwG als bekannt gemacht gilt, ihren Anspruch nach Grund und Höhe schriftlich anmelden, Sicherheit zu leisten, soweit sie nicht Befriedigung verlangen können. Dieses Recht steht den Gläubigern jedoch nur zu, wenn sie glaubhaft machen, dass durch die Verschmelzung die Erfüllung der Forderung gefährdet wird."
    },
    {
      "date": "2024-10-30",
      "id": "92129",
      "original_text": "Einreichung neuer Dokumente\nNiedersachsen Amtsgericht Hannover HRB 4061\nDeutsche Messe Aktiengesellschaft – Hannover",
      "type": "Einreichung neuer Dokumente",
      "state": "Niedersachsen",
      "amtsgericht": "Amtsgericht Hannover",
      "registernummer": "HRB 4061",
      "registerart": "HRB",
      "company_name": "Deutsche Messe Aktiengesellschaft",
      "company_seat": "Hannover",
      "details": "30.10.2024 (Bekanntmachungsdatum)\n\nNiedersachsen Amtsgericht Hannover HRB 4061\nEinreichung neuer Dokumente\n\nDeutsche Messe Aktiengesellschaft\nAktiengesellschaft\nHannover\n\nDie Liste der Mitglieder des Aufsichtsrats wurde beim Registergericht eingereicht."
    },
    {
      "date": "2024-10-30",
      "id": "92130",
      "original_text": "Einreichung neuer Dokumente\nBremen Amtsgericht Bremen HRB 3604\nHST Hanseatische Straßen- und Tiefbaugesellschaft m.b.H. – Bremen",
      "type": "Einreichung neuer Dokumente",
      "state": "Bremen",
      "amtsgericht": "Amtsgericht Bremen",
      "registernummer": "HRB 3604",
      "registerart": "HRB",
      "company_name": "HST Hanseatische Straßen- und Tiefbaugesellschaft m.b.H.",
      "company_seat": "Bremen",
      "details": "30.10.2024 (Bekanntmachungsdatum)\n\nBremen Amtsgericht Bremen HRB 3604\nEinreichung neuer Dokumente\n\nHST Hanseatische Straßen- und Tiefbaugesellschaft m.b.H.\nGesellschaft mit beschränkter Haftung\nBremen\n\nAls nicht eingetragen wird bekannt gemacht: Liste des Aufsichtsrats wurde eingereicht."
    },
    {
      "date": "2024-10-30",
      "id": "92131",
      "original_text": "Einreichung neuer Dokumente\nBremen Amtsgericht Bremen HRB 9659\nRheinmetall Electronics GmbH – Bremen",
      "type": "Einreichung neuer Dokumente",
      "state": "Bremen",
      "amtsgericht": "Amtsgericht Bremen",
      "registernummer": "HRB 9659",
      "registerart": "HRB",
      "company_name": "Rheinmetall Electronics GmbH",
      "company_seat": "Bremen",
      "details": "30.10.2024 (Bekanntmachungsdatum)\n\nBremen Amtsgericht Bremen HRB 9659\nEinreichung neuer Dokumente\n\nRheinmetall Electronics GmbH\nGesellschaft mit beschränkter Haftung\nBremen\n\nAls nicht eingetragen wird bekannt gemacht: Liste des Aufsichtsrats wurde eingereicht."
    },
    {
      "date": "2024-10-30",
      "id": "92132",
      "original_text": "Löschungsankündigung\nRheinland-Pfalz Amtsgericht Ludwigshafen a.Rhein (Ludwigshafen) HRB 61897\nGuhmann Agrarhandels GmbH – Maxdorf",
      "type": "Löschungsankündigung",
      "state": "Rheinland-Pfalz",
      "amtsgericht": "Amtsgericht Ludwigshafen a.Rhein (Ludwigshafen)",
      "registernummer": "HRB 61897",
      "registerart": "HRB",
      "company_name": "Guhmann Agrarhandels GmbH",
      "company_seat": "Maxdorf",
      "details": "30.10.2024 (Bekanntmachungsdatum)\n\nRheinland-Pfalz Amtsgericht Ludwigshafen a.Rhein (Ludwigshafen) HRB 61897\nLöschungsankündigung\n\nGuhmann Agrarhandels GmbH\nGesellschaft mit beschränkter Haftung\nMaxdorf\n\nDas Registergericht beabsichtigt die Gesellschaft von Amts wegen nach § 394 FamFG zu löschen. Die Frist zur Erhebung eines Widerspruchs ist auf einen Monat festgesetzt."
    },
    {
      "date": "2024-10-30",
      "id": "92133",
      "original_text": "Sonstige Registerbekanntmachung\nRheinland-Pfalz Amtsgericht Koblenz HRB 23465\nmps public solutions gmbh – Koblenz",
      "type": "Sonstige Registerbekanntmachung",
      "state": "Rheinland-Pfalz",
      "amtsgericht": "Amtsgericht Koblenz",
      "registernummer": "HRB 23465",
      "registerart": "HRB",
      "company_name": "mps public solutions gmbh",
      "company_seat": "Koblenz",
      "details": "30.10.2024 (Bekanntmachungsdatum)\n\nRheinland-Pfalz Amtsgericht Koblenz HRB 23465\nSonstige Registerbekanntmachung 30.10.2024 (Eintragungsdatum)\n\nmps public solutions gmbh\nGesellschaft mit beschränkter Haftung\nKoblenz\n\nAls nicht eingetragen wird veröffentlicht: Den Gläubigern der Gesellschaft, deren Forderungen begründet worden sind, bevor die Eintragung der Beendigung des Gewinnabführungsvertrages in das Handelsregister nach § 10 des Handelsgesetzbuches als bekanntgemacht gilt, hat der andere Vertragsteil Sicherheit zu leisten, wenn sie sich binnen sechs Monaten nach der Bekanntmachung der Eintragung zu diesem Zweck bei ihm melden."
    },
    {
      "date": "2024-10-30",
      "id": "92134",
      "original_text": "Löschungsankündigung\nRheinland-Pfalz Amtsgericht Ludwigshafen a.Rhein (Ludwigshafen) HRB 68037\nTestfleck UG (haftungsbeschränkt) – Ludwigshafen am Rhein",
      "type": "Löschungsankündigung",
      "state": "Rheinland-Pfalz",
      "amtsgericht": "Amtsgericht Ludwigshafen a.Rhein (Ludwigshafen)",
      "registernummer": "HRB 68037",
      "registerart": "HRB",
      "company_name": "Testfleck UG (haftungsbeschränkt)",
      "company_seat": "Ludwigshafen am Rhein",
      "details": "30.10.2024 (Bekanntmachungsdatum)\n\nRheinland-Pfalz Amtsgericht Ludwigshafen a.Rhein (Ludwigshafen) HRB 68037\nLöschungsankündigung\n\nTestfleck UG (haftungsbeschränkt)\nGesellschaft mit beschränkter Haftung\nLudwigshafen am Rhein\n\nDas Registergericht beabsichtigt die Gesellschaft von Amts wegen nach § 394 FamFG zu löschen. Die Frist zur Erhebung eines Widerspruchs ist auf einen Monat festgesetzt."
    },
    {
      "date": "2024-10-30",
      "id": "92135",
      "original_text": "Einreichung neuer Dokumente\nRheinland-Pfalz Amtsgericht Landau HRB 11037\nWohnbau Germersheim Gesellschaft mit beschränkter Haftung – Germersheim",
      "type": "Einreichung neuer Dokumente",
      "state": "Rheinland-Pfalz",
      "amtsgericht": "Amtsgericht Landau",
      "registernummer": "HRB 11037",
      "registerart": "HRB",
      "company_name": "Wohnbau Germersheim Gesellschaft mit beschränkter Haftung",
      "company_seat": "Germersheim",
      "details": "30.10.2024 (Bekanntmachungsdatum)\n\nRheinland-Pfalz Amtsgericht Landau HRB 11037\nEinreichung neuer Dokumente 30.10.2024 (Eintragungsdatum)\n\nWohnbau Germersheim Gesellschaft mit beschränkter Haftung\nGesellschaft mit beschränkter Haftung\nGermersheim\n\nDem Registergericht ist eine neue Liste der Mitglieder des Aufsichtsrates eingereicht worden."
    },
    {
      "date": "2024-10-30",
      "id": "92136",
      "original_text": "Registerbekanntmachung nach dem Umwandlungsgesetz\nRheinland-Pfalz Amtsgericht Montabaur HRB 24812\nBW Converting GmbH – Neuwied",
      "type": "Registerbekanntmachung nach dem Umwandlungsgesetz",
      "state": "Rheinland-Pfalz",
      "amtsgericht": "Amtsgericht Montabaur",
      "registernummer": "HRB 24812",
      "registerart": "HRB",
      "company_name": "BW Converting GmbH",
      "company_seat": "Neuwied",
      "details": "30.10.2024 (Bekanntmachungsdatum)\n\nRheinland-Pfalz Amtsgericht Montabaur HRB 24812\nRegisterbekanntmachung nach dem Umwandlungsgesetz 30.10.2024 (Eintragungsdatum)\n\nBW Converting GmbH\nGesellschaft mit beschränkter Haftung\nNeuwied\n\nAls nicht eingetragen wird veröffentlicht: Den Gläubigern der an der Verschmelzung beteiligten Rechtsträger ist, wenn sie binnen sechs Monaten nach dem Tag, an dem die Eintragung der Verschmelzung in das Register des Sitzes desjenigen Rechtsträgers, dessen Gläubiger sie sind, nach § 19 Abs. 3 UmwG als bekannt gemacht gilt, ihren Anspruch nach Grund und Höhe schriftlich anmelden, Sicherheit zu leisten, soweit sie nicht Befriedigung verlangen können. Dieses Recht steht den Gläubigern jedoch nur zu, wenn sie glaubhaft machen, dass durch die Verschmelzung die Erfüllung der Forderung gefährdet wird."
    },
    {
      "date": "2024-10-30",
      "id": "92137",
      "original_text": "Registerbekanntmachung nach dem Umwandlungsgesetz\nRheinland-Pfalz Amtsgericht Koblenz HRB 25747\nSHD Group Holding GmbH – Andernach",
      "type": "Registerbekanntmachung nach dem Umwandlungsgesetz",
      "state": "Rheinland-Pfalz",
      "amtsgericht": "Amtsgericht Koblenz",
      "registernummer": "HRB 25747",
      "registerart": "HRB",
      "company_name": "SHD Group Holding GmbH",
      "company_seat": "Andernach",
      "details": "30.10.2024 (Bekanntmachungsdatum)\n\nRheinland-Pfalz Amtsgericht Koblenz HRB 25747\nRegisterbekanntmachung nach dem Umwandlungsgesetz 30.10.2024 (Eintragungsdatum)\n\nSHD Group Holding GmbH\nGesellschaft mit beschränkter Haftung\nAndernach\n\nAls nicht eingetragen wird veröffentlicht: Den Gläubigern der an der Verschmelzung beteiligten Rechtsträger ist, wenn sie binnen sechs Monaten nach dem Tag, an dem die Eintragung der Verschmelzung in das Register des Sitzes desjenigen Rechtsträgers,dessen Gläubiger sie sind, nach § 19 Abs. 3 UmwG als bekannt gemacht gilt, ihren Anspruch nach Grund und Höhe schriftlich anmelden, Sicherheit zu leisten, soweit sie nicht Befriedigung verlangen können. Dieses Recht steht den Gläubigern jedoch nur zu, wenn sie glaubhaft machen, dass durch die Verschmelzung die Erfüllungd er Forderung gefährdet wird."
    },
    {
      "date": "2024-10-30",
      "id": "92138",
      "original_text": "Löschungsankündigung\nNordrhein-Westfalen Amtsgericht Wuppertal HRA 25278\ndigitaler herzschlag e.K. – Haan",
      "type": "Löschungsankündigung",
      "state": "Nordrhein-Westfalen",
      "amtsgericht": "Amtsgericht Wuppertal",
      "registernummer": "HRA 25278",
      "registerart": "HRA",
      "company_name": "digitaler herzschlag e.K.",
      "company_seat": "Haan",
      "details": "30.10.2024 (Bekanntmachungsdatum)\n\nNordrhein-Westfalen Amtsgericht Wuppertal HRA 25278\nLöschungsankündigung\n\ndigitaler herzschlag e.K.\nEinzelkaufmann / Einzelkauffrau\nHaan\n\nDas Registergericht beabsichtigt die Firma von Amts wegen nach § 31 Abs. 2 HGB, § 393 FamFG zu löschen. Die Frist zur Erhebung eines Widerspruchs ist auf drei Monate festgesetzt."
    },
    {
      "date": "2024-10-30",
      "id": "92139",
      "original_text": "Registerbekanntmachung nach dem Umwandlungsgesetz\nNordrhein-Westfalen Amtsgericht Krefeld HRB 16216\nPlus Advise Admedio Krefeld GmbH Steuerberatungsgesellschaft – Krefeld",
      "type": "Registerbekanntmachung nach dem Umwandlungsgesetz",
      "state": "Nordrhein-Westfalen",
      "amtsgericht": "Amtsgericht Krefeld",
      "registernummer": "HRB 16216",
      "registerart": "HRB",
      "company_name": "Plus Advise Admedio Krefeld GmbH Steuerberatungsgesellschaft",
      "company_seat": "Krefeld",
      "details": "30.10.2024 (Bekanntmachungsdatum)\n\nNordrhein-Westfalen Amtsgericht Krefeld HRB 16216\nRegisterbekanntmachung nach dem Umwandlungsgesetz 30.10.2024 (Eintragungsdatum)\n\nPlus Advise Admedio Krefeld GmbH Steuerberatungsgesellschaft\nGesellschaft mit beschränkter Haftung\nKrefeld\n\nDen Gläubigern der an der Verschmelzung beteiligten Rechtsträger ist, wenn sie binnen sechs Monaten nach dem Tag, an dem die Eintragung der Verschmelzung in das Register des Sitzes desjenigen Rechtsträgers, dessen Gläubiger sie sind, nach § 19 Absatz 3 UmwG als bekanntgemacht gilt, ihren Anspruch nach Grund und Höhe schriftlich anmelden, Sicherheit zu leisten, soweit sie nicht Befriedigung verlangen können. Dieses Recht steht den Gläubigern jedoch nur zu, wenn sie glaubhaft machen, dass durch die Verschmelzung die Erfüllung ihrer Forderung gefährdet wird."
    },
    {
      "date": "2024-10-30",
      "id": "92140",
      "original_text": "Löschungsankündigung\nNordrhein-Westfalen Amtsgericht Essen HRB 32732\nSEYMA energy GmbH – Essen",
      "type": "Löschungsankündigung",
      "state": "Nordrhein-Westfalen",
      "amtsgericht": "Amtsgericht Essen",
      "registernummer": "HRB 32732",
      "registerart": "HRB",
      "company_name": "SEYMA energy GmbH",
      "company_seat": "Essen",
      "details": "30.10.2024 (Bekanntmachungsdatum)\n\nNordrhein-Westfalen Amtsgericht Essen HRB 32732\nLöschungsankündigung\n\nSEYMA energy GmbH\nGesellschaft mit beschränkter Haftung\nEssen\n\nDas Registergericht beabsichtigt die Gesellschaft von Amts wegen nach § 394 FamFG zu löschen. Die Frist zur Erhebung eines Widerspruchs ist auf einen Monat festgesetzt."
    },
    {
      "date": "2024-10-30",
      "id": "92141",
      "original_text": "Registerbekanntmachung nach dem Umwandlungsgesetz\nNordrhein-Westfalen Amtsgericht Paderborn HRA 8706\nMWV GmbH & Co. KG – Paderborn",
      "type": "Registerbekanntmachung nach dem Umwandlungsgesetz",
      "state": "Nordrhein-Westfalen",
      "amtsgericht": "Amtsgericht Paderborn",
      "registernummer": "HRA 8706",
      "registerart": "HRA",
      "company_name": "MWV GmbH & Co. KG",
      "company_seat": "Paderborn",
      "details": "30.10.2024 (Bekanntmachungsdatum)\n\nNordrhein-Westfalen Amtsgericht Paderborn HRA 8706\nRegisterbekanntmachung nach dem Umwandlungsgesetz 30.10.2024 (Eintragungsdatum)\n\nMWV GmbH & Co. KG\nKommanditgesellschaft\nPaderborn\n\nDen Gläubigern der an der Ausgliederung beteiligten Rechtsträger ist, wenn sie binnen sechs Monaten nach dem Tag, an dem die Eintragung der Ausgliederung in das Register des Sitzes desjenigen Rechtsträgers, dessen Gläubiger sie sind, nach § 19 Absatz 3 UmwG als bekanntgemacht gilt, ihren Anspruch nach Grund und Höhe schriftlich anmelden, Sicherheit zu leisten, soweit sie nicht Befriedigung verlangen können. Dieses Recht steht den Gläubigern jedoch nur zu, wenn sie glaubhaft machen, dass durch die Ausgliederung die Erfüllung ihrer Forderung gefährdet wird."
    },
    {
      "date": "2024-10-30",
      "id": "92142",
      "original_text": "Löschungsankündigung\nNordrhein-Westfalen Amtsgericht Neuss HRB 20618\nArtisan Foods GmbH – Neuss",
      "type": "Löschungsankündigung",
      "state": "Nordrhein-Westfalen",
      "amtsgericht": "Amtsgericht Neuss",
      "registernummer": "HRB 20618",
      "registerart": "HRB",
      "company_name": "Artisan Foods GmbH",
      "company_seat": "Neuss",
      "details": "30.10.2024 (Bekanntmachungsdatum)\n\nNordrhein-Westfalen Amtsgericht Neuss HRB 20618\nLöschungsankündigung\n\nArtisan Foods GmbH\nGesellschaft mit beschränkter Haftung\nNeuss\n\nHandelsregistersache Artisan Foods GmbH\nes ist beabsichtigt, die im Handelsregister eingetragene Gesellschaft gemäß § 394 Absatz 1 FamFG wegen Vermögenslosigkeit von Amts wegen zu löschen.\nFrist zur Geltendmachung eines Widerspruchs: 1 Monat\nRechtsbehelfsbelehrung:\nGegen diese Verfügung können Sie Widerspruch einlegen. Der Widerspruch ist bei dem Amtsgericht Neuss, Breite Straße 48, 41460 Neuss schriftlich in deutscher Sprache oder zur Niederschrift der Geschäftsstelle einzulegen. Der Widerspruch kann auch zur Niederschrift der Geschäftsstelle eines jeden Amtsgerichtes abgegeben werden. Die Einlegung ist auch durch Übertragung eines elektronischen Dokuments an die elektronische Poststelle des Gerichts möglich. Das elektronische Dokument muss für die Bearbeitung durch das Gericht geeignet und mit einer qualifizierten elektronischen Signatur der verantwortenden Person versehen sein oder von der verantwortenden Person signiert und auf einem sicheren Übermittlungsweg gemäß § 130a ZPO nach näherer Maßgabe der Verordnung über die technischen Rahmenbedingungen des elektronischen Rechtsverkehrs und über das besondere elektronische Behördenpostfach (BGBl. I, S.3803) eingereicht werden. Weitere Informationen erhalten Sie auf der Internetseite www.justiz.de.\nDer Widerspruch muss spätestens innerhalb der gesetzten Frist bei dem Amtsgericht Neuss eingegangen sein. Dies gilt auch dann, wenn der Widerspruch zur Niederschrift der Geschäftsstelle eines anderen Amtsgerichtes abgegeben wurde. Die Frist beginnt mit der Veröffentlichung. Fällt das Ende der Frist auf einen Sonntag, einen allgemeinen Feiertag oder Sonnabend, so endet die Frist mit Ablauf des nächsten Werktages. Der Widerspruch muss die Bezeichnung der angefochtenen Verfügung sowie die Erklärung enthalten, dass Widerspruch gegen diese Verfügung eingelegt wird. Er ist zu unterzeichnen und soll begründet werden."
    },
    {
      "date": "2024-10-30",
      "id": "92143",
      "original_text": "Einreichung neuer Dokumente\nNordrhein-Westfalen Amtsgericht Duisburg HRB 38241\nProjektgesellschaft Technologiezentrum Wedau mbH – Duisburg",
      "type": "Einreichung neuer Dokumente",
      "state": "Nordrhein-Westfalen",
      "amtsgericht": "Amtsgericht Duisburg",
      "registernummer": "HRB 38241",
      "registerart": "HRB",
      "company_name": "Projektgesellschaft Technologiezentrum Wedau mbH",
      "company_seat": "Duisburg",
      "details": "30.10.2024 (Bekanntmachungsdatum)\n\nNordrhein-Westfalen Amtsgericht Duisburg HRB 38241\nEinreichung neuer Dokumente\n\nProjektgesellschaft Technologiezentrum Wedau mbH\nGesellschaft mit beschränkter Haftung\nDuisburg\n\nDem Registergericht ist eine Liste der Mitglieder des Aufsichtsrates eingereicht worden."
    },
    {
      "date": "2024-10-30",
      "id": "92144",
      "original_text": "Registerbekanntmachung nach dem Umwandlungsgesetz\nNordrhein-Westfalen Amtsgericht Gelsenkirchen HRB 8624\nAgenda gemeinnützige Dienstleistungsgesellschaft mbH – Gelsenkirchen",
      "type": "Registerbekanntmachung nach dem Umwandlungsgesetz",
      "state": "Nordrhein-Westfalen",
      "amtsgericht": "Amtsgericht Gelsenkirchen",
      "registernummer": "HRB 8624",
      "registerart": "HRB",
      "company_name": "Agenda gemeinnützige Dienstleistungsgesellschaft mbH",
      "company_seat": "Gelsenkirchen",
      "details": "30.10.2024 (Bekanntmachungsdatum)\n\nNordrhein-Westfalen Amtsgericht Gelsenkirchen HRB 8624\nRegisterbekanntmachung nach dem Umwandlungsgesetz 30.10.2024 (Eintragungsdatum)\n\nAgenda gemeinnützige Dienstleistungsgesellschaft mbH\nGesellschaft mit beschränkter Haftung\nGelsenkirchen\n\nDen Gläubigern der an der Verschmelzung beteiligten Rechtsträger ist, wenn sie binnen sechs Monaten nach dem Tag, an dem die Eintragung der Verschmelzung in das Register des Sitzes desjenigen Rechtsträgers, dessen Gläubiger sie sind, nach § 19 Absatz 3 UmwG als bekanntgemacht gilt, ihren Anspruch nach Grund und Höhe schriftlich anmelden, Sicherheit zu leisten, soweit sie nicht Befriedigung verlangen können. Dieses Recht steht den Gläubigern jedoch nur zu, wenn sie glaubhaft machen, dass durch die Verschmelzung die Erfüllung ihrer Forderung gefährdet wird."
    },
    {
      "date": "2024-10-30",
      "id": "92145",
      "original_text": "Registerbekanntmachung nach dem Umwandlungsgesetz\nNordrhein-Westfalen Amtsgericht Bad Oeynhausen HRB 18137\nEqin Deutschland GmbH – Bad Oeynhausen",
      "type": "Registerbekanntmachung nach dem Umwandlungsgesetz",
      "state": "Nordrhein-Westfalen",
      "amtsgericht": "Amtsgericht Bad Oeynhausen",
      "registernummer": "HRB 18137",
      "registerart": "HRB",
      "company_name": "Eqin Deutschland GmbH",
      "company_seat": "Bad Oeynhausen",
      "details": "30.10.2024 (Bekanntmachungsdatum)\n\nNordrhein-Westfalen Amtsgericht Bad Oeynhausen HRB 18137\nRegisterbekanntmachung nach dem Umwandlungsgesetz 30.10.2024 (Eintragungsdatum)\n\nEqin Deutschland GmbH\nGesellschaft mit beschränkter Haftung\nBad Oeynhausen\n\nDen Gläubigern der an der Verschmelzung beteiligten Rechtsträger ist, wenn sie binnen sechs Monaten nach dem Tag, an dem die Eintragung der Verschmelzung in das Register des Sitzes desjenigen Rechtsträgers, dessen Gläubiger sie sind, nach § 19 Absatz 3 UmwG als bekanntgemacht gilt, ihren Anspruch nach Grund und Höhe schriftlich anmelden, Sicherheit zu leisten, soweit sie nicht Befriedigung verlangen können. Dieses Recht steht den Gläubigern jedoch nur zu, wenn sie glaubhaft machen, dass durch die Verschmelzung die Erfüllung ihrer Forderung gefährdet wird."
    },
    {
      "date": "2024-10-30",
      "id": "92146",
      "original_text": "Löschungsankündigung\nNordrhein-Westfalen Amtsgericht Düren HRB 6839\nFS UG (haftungsbeschränkt) – Düren",
      "type": "Löschungsankündigung",
      "state": "Nordrhein-Westfalen",
      "amtsgericht": "Amtsgericht Düren",
      "registernummer": "HRB 6839",
      "registerart": "HRB",
      "company_name": "FS UG (haftungsbeschränkt)",
      "company_seat": "Düren",
      "details": "30.10.2024 (Bekanntmachungsdatum)\n\nNordrhein-Westfalen Amtsgericht Düren HRB 6839\nLöschungsankündigung 30.10.2024 (Eintragungsdatum)\n\nFS UG (haftungsbeschränkt)\nGesellschaft mit beschränkter Haftung\nDüren\n\nDas Registergericht beabsichtigt die Gesellschaft von Amts wegen nach § 394 FamFG zu löschen. Die Frist zur Erhebung eines Widerspruchs ist auf drei Monate festgesetzt."
    },
    {
      "date": "2024-10-30",
      "id": "92147",
      "original_text": "Löschungsankündigung\nNordrhein-Westfalen Amtsgericht Düsseldorf HRB 82033\nThe Ground Coffee GmbH – Düsseldorf",
      "type": "Löschungsankündigung",
      "state": "Nordrhein-Westfalen",
      "amtsgericht": "Amtsgericht Düsseldorf",
      "registernummer": "HRB 82033",
      "registerart": "HRB",
      "company_name": "The Ground Coffee GmbH",
      "company_seat": "Düsseldorf",
      "details": "30.10.2024 (Bekanntmachungsdatum)\n\nNordrhein-Westfalen Amtsgericht Düsseldorf HRB 82033\nLöschungsankündigung\n\nThe Ground Coffee GmbH\nGesellschaft mit beschränkter Haftung\nDüsseldorf\n\nDas Registergericht beabsichtigt die Gesellschaft von Amts wegen nach § 394 FamFG zu löschen. Die Frist zur Erhebung eines Widerspruchs ist auf 3 Wochen festgesetzt.\n\nRechtsbehelfsbelehrung:\nDas Widerspruchsrecht steht jedem zu, der an der Unterlassung der Löschung ein berechtigtes Interesse hat. Der Widerspruch ist bei dem Amtsgericht Düsseldorf -Registergericht-, Werdener Straße 1, 40227 Düsseldorf schriftlich in deutscher Sprache oder zur Niederschrift der Geschäftsstelle einzulegen. Der Widerspruch kann auch zur Niederschrift der Geschäftsstelle eines jeden Amtsgerichtes abgegeben werden. Die Einlegung ist auch durch Übertragung eines elektronischen Dokuments an die elektronische Poststelle des Gerichts möglich. Das elektronische Dokument muss für die Bearbeitung durch das Gericht geeignet und mit einer qualifizierten elektronischen Signatur der verantwortenden Person versehen sein oder von der verantwortenden Person signiert und auf einem sicheren Übermittlungsweg gemäß § 130a ZPO nach näherer Maßgabe der Verordnung über die technischen Rahmenbedingungen des elektronischen Rechtsverkehrs und über das besondere elektronische Behördenpostfach (BGBl. I, S.3803) eingereicht werden. Weitere Informationen erhalten Sie auf der Internetseite www.justiz.de.\nDer Widerspruch muss spätestens innerhalb der gesetzten Frist nach dem Datum der Bekanntmachung der Löschungsankündigung bei dem Amtsgericht - Registergericht - Düsseldorf eingegangen sein.  Dies gilt auch dann, wenn der Widerspruch zur Niederschrift der Geschäftsstelle eines anderen Amtsgerichtes abgegeben wurde. Die Frist beginnt mit dem Tage der Bekanntmachung der Löschungsankündigung in dem für die Bekanntmachung der Eintragungen in das Handelsregister bestimmten elektronischen Informations- und Kommunikationssystem nach § 10 des Handelsgesetzbuches. Fällt das Ende der Frist auf einen Sonntag, einen allgemeinen Feiertag oder Sonnabend, so endet die Frist mit Ablauf des nächsten Werktages.\nDer Widerspruch muss die Bezeichnung der angefochtenen Löschungsankündigung sowie die Erklärung enthalten, dass Widerspruch gegen diese Löschungsankündigung eingelegt wird. Er ist zu unterzeichnen und soll begründet werden."
    },
    {
      "date": "2024-10-30",
      "id": "92148",
      "original_text": "Registerbekanntmachung nach dem Umwandlungsgesetz\nNordrhein-Westfalen Amtsgericht Krefeld HRB 10248\nPlus Advise GmbH Steuerberatungsgesellschaft – Krefeld",
      "type": "Registerbekanntmachung nach dem Umwandlungsgesetz",
      "state": "Nordrhein-Westfalen",
      "amtsgericht": "Amtsgericht Krefeld",
      "registernummer": "HRB 10248",
      "registerart": "HRB",
      "company_name": "Plus Advise GmbH Steuerberatungsgesellschaft",
      "company_seat": "Krefeld",
      "details": "30.10.2024 (Bekanntmachungsdatum)\n\nNordrhein-Westfalen Amtsgericht Krefeld HRB 10248\nRegisterbekanntmachung nach dem Umwandlungsgesetz 30.10.2024 (Eintragungsdatum)\n\nPlus Advise GmbH Steuerberatungsgesellschaft\nGesellschaft mit beschränkter Haftung\nKrefeld\n\nDen Gläubigern der an der Verschmelzung beteiligten Rechtsträger ist, wenn sie binnen sechs Monaten nach dem Tag, an dem die Eintragung der Verschmelzung in das Register des Sitzes desjenigen Rechtsträgers, dessen Gläubiger sie sind, nach § 19 Absatz 3 UmwG als bekanntgemacht gilt, ihren Anspruch nach Grund und Höhe schriftlich anmelden, Sicherheit zu leisten, soweit sie nicht Befriedigung verlangen können. Dieses Recht steht den Gläubigern jedoch nur zu, wenn sie glaubhaft machen, dass durch die Verschmelzung die Erfüllung ihrer Forderung gefährdet wird."
    },
    {
      "date": "2024-10-30",
      "id": "92149",
      "original_text": "Registerbekanntmachung nach dem Umwandlungsgesetz\nNordrhein-Westfalen Amtsgericht Bielefeld HRB 42225\nhive 01 GmbH – Bielefeld",
      "type": "Registerbekanntmachung nach dem Umwandlungsgesetz",
      "state": "Nordrhein-Westfalen",
      "amtsgericht": "Amtsgericht Bielefeld",
      "registernummer": "HRB 42225",
      "registerart": "HRB",
      "company_name": "hive 01 GmbH",
      "company_seat": "Bielefeld",
      "details": "30.10.2024 (Bekanntmachungsdatum)\n\nNordrhein-Westfalen Amtsgericht Bielefeld HRB 42225\nRegisterbekanntmachung nach dem Umwandlungsgesetz 30.10.2024 (Eintragungsdatum)\n\nhive 01 GmbH\nGesellschaft mit beschränkter Haftung\nBielefeld\n\nDen Gläubigern der an der Verschmelzung beteiligten Rechtsträger ist, wenn sie binnen sechs Monaten nach dem Tag, an dem die Eintragung der Verschmelzung in das Register des Sitzes desjenigen Rechtsträgers, dessen Gläubiger sie sind, nach § 19 Absatz 3 UmwG als bekanntgemacht gilt, ihren Anspruch nach Grund und Höhe schriftlich anmelden, Sicherheit zu leisten, soweit sie nicht Befriedigung verlangen können. Dieses Recht steht den Gläubigern jedoch nur zu, wenn sie glaubhaft machen, dass durch die Verschmelzung die Erfüllung ihrer Forderung gefährdet wird."
    },
    {
      "date": "2024-10-30",
      "id": "92150",
      "original_text": "Einreichung neuer Dokumente\nNordrhein-Westfalen Amtsgericht Bonn HRB 5919\nTelekom Deutschland GmbH – Bonn",
      "type": "Einreichung neuer Dokumente",
      "state": "Nordrhein-Westfalen",
      "amtsgericht": "Amtsgericht Bonn",
      "registernummer": "HRB 5919",
      "registerart": "HRB",
      "company_name": "Telekom Deutschland GmbH",
      "company_seat": "Bonn",
      "details": "30.10.2024 (Bekanntmachungsdatum)\n\nNordrhein-Westfalen Amtsgericht Bonn HRB 5919\nEinreichung neuer Dokumente\n\nTelekom Deutschland GmbH\nGesellschaft mit beschränkter Haftung\nBonn\n\nDem Registergericht ist eine Liste der Mitglieder des Aufsichtsrates eingereicht worden."
    },
    {
      "date": "2024-10-30",
      "id": "92151",
      "original_text": "Löschungsankündigung\nNordrhein-Westfalen Amtsgericht Köln HRB 91200\nA.ZZA UG (haftungsbeschränkt) – Köln",
      "type": "Löschungsankündigung",
      "state": "Nordrhein-Westfalen",
      "amtsgericht": "Amtsgericht Köln",
      "registernummer": "HRB 91200",
      "registerart": "HRB",
      "company_name": "A.ZZA UG (haftungsbeschränkt)",
      "company_seat": "Köln",
      "details": "30.10.2024 (Bekanntmachungsdatum)\n\nNordrhein-Westfalen Amtsgericht Köln HRB 91200\nLöschungsankündigung\n\nA.ZZA UG (haftungsbeschränkt)\nGesellschaft mit beschränkter Haftung\nKöln\n\nDas Registergericht beabsichtigt die Gesellschaft von Amts wegen nach § 394 FamFG zu löschen. Die Frist zur Erhebung eines Widerspruchs ist auf einen Monat festgesetzt."
    },
    {
      "date": "2024-10-30",
      "id": "92152",
      "original_text": "Registerbekanntmachung nach dem Umwandlungsgesetz\nNordrhein-Westfalen Amtsgericht Iserlohn HRB 11080\nKOSTAL Industriegrundbesitz Zwei GmbH – Lüdenscheid",
      "type": "Registerbekanntmachung nach dem Umwandlungsgesetz",
      "state": "Nordrhein-Westfalen",
      "amtsgericht": "Amtsgericht Iserlohn",
      "registernummer": "HRB 11080",
      "registerart": "HRB",
      "company_name": "KOSTAL Industriegrundbesitz Zwei GmbH",
      "company_seat": "Lüdenscheid",
      "details": "30.10.2024 (Bekanntmachungsdatum)\n\nNordrhein-Westfalen Amtsgericht Iserlohn HRB 11080\nRegisterbekanntmachung nach dem Umwandlungsgesetz 22.10.2024 (Eintragungsdatum)\n\nKOSTAL Industriegrundbesitz Zwei GmbH\nGesellschaft mit beschränkter Haftung\nLüdenscheid\n\nDen Gläubigern der an der Ausgliederung beteiligten Rechtsträger ist, wenn sie binnen sechs Monaten nach dem Tag, an dem die Eintragung der Ausgliederung in das Register des Sitzes desjenigen Rechtsträgers, dessen Gläubiger sie sind, nach § 19 Absatz 3 UmwG als bekanntgemacht gilt, ihren Anspruch nach Grund und Höhe schriftlich anmelden, Sicherheit zu leisten, soweit sie nicht Befriedigung verlangen können. Dieses Recht steht den Gläubigern jedoch nur zu, wenn sie glaubhaft machen, dass durch die Ausgliederung die Erfüllung ihrer Forderung gefährdet wird."
    },
    {
      "date": "2024-10-30",
      "id": "92153",
      "original_text": "Löschungsankündigung\nNordrhein-Westfalen Amtsgericht Recklinghausen HRB 8741\nTüren & Tor UG (haftungsbeschränkt) – Herten",
      "type": "Löschungsankündigung",
      "state": "Nordrhein-Westfalen",
      "amtsgericht": "Amtsgericht Recklinghausen",
      "registernummer": "HRB 8741",
      "registerart": "HRB",
      "company_name": "Türen & Tor UG (haftungsbeschränkt)",
      "company_seat": "Herten",
      "details": "30.10.2024 (Bekanntmachungsdatum)\n\nNordrhein-Westfalen Amtsgericht Recklinghausen HRB 8741\nLöschungsankündigung\n\nTüren & Tor UG (haftungsbeschränkt)\nGesellschaft mit beschränkter Haftung\nHerten\n\nDas Registergericht beabsichtigt die Gesellschaft von Amts wegen nach § 394 FamFG zu löschen. Die Frist zur Erhebung eines Widerspruchs ist auf drei Monate festgesetzt."
    },
    {
      "date": "2024-10-30",
      "id": "92154",
      "original_text": "Löschungsankündigung\nNordrhein-Westfalen Amtsgericht Iserlohn HRB 7441\nMA-WA Baukoordination & Immobilien GmbH – Iserlohn",
      "type": "Löschungsankündigung",
      "state": "Nordrhein-Westfalen",
      "amtsgericht": "Amtsgericht Iserlohn",
      "registernummer": "HRB 7441",
      "registerart": "HRB",
      "company_name": "MA-WA Baukoordination & Immobilien GmbH",
      "company_seat": "Iserlohn",
      "details": "30.10.2024 (Bekanntmachungsdatum)\n\nNordrhein-Westfalen Amtsgericht Iserlohn HRB 7441\nLöschungsankündigung 18.10.2024 (Eintragungsdatum)\n\nMA-WA Baukoordination & Immobilien GmbH\nGesellschaft mit beschränkter Haftung\nIserlohn\n\nDas Registergericht beabsichtigt, die im Handelsregister eingetragene Gesellschaft gemäß § 394 Absatz 1 FamFG wegen Vermögenslosigkeit von Amts wegen zu löschen. Gegen diese Verfügung kann Widerspruch eingelegt werden. Die Frist zur Erhebung eines Widerspruchs gegen die beabsichtigte Löschung von Amts wegen ist auf zwei Monate festgesetzt.\n\nRechtsbehelfsbelehrung:\n\nGegen diese Verfügung können Sie Widerspruch einlegen.\n\nDer Widerspruch ist bei dem Amtsgericht Iserlohn, Friedrichstraße 108-110, 58636 Iserlohn schriftlich in deutscher Sprache oder zur Niederschrift der Geschäftsstelle einzulegen. Der Widerspruch kann auch zur Niederschrift der Geschäftsstelle eines jeden Amtsgerichtes abgegeben werden.\n\nDer Widerspruch muss spätestens innerhalb der gesetzten Frist bei dem Amtsgericht Iserlohn eingegangen sein. Dies gilt auch dann, wenn der Widerspruch zur Niederschrift der Geschäftsstelle eines anderen Amtsgerichtes abgegeben wurde. Die Frist beginnt mit der Veröffentlichung. Fällt das Ende der Frist auf einen Sonntag, einen allgemeinen Feiertag oder Sonnabend, so endet die Frist mit Ablauf des nächsten Werktages.\n\nDer Widerspruch muss die Bezeichnung der angefochtenen Verfügung sowie die Erklärung enthalten, dass Widerspruch gegen diese Verfügung eingelegt wird. Er ist zu unterzeichnen und soll begründet werden."
    },
    {
      "date": "2024-10-30",
      "id": "92155",
      "original_text": "Registerbekanntmachung nach dem Umwandlungsgesetz\nNordrhein-Westfalen Amtsgericht Iserlohn HRB 9770\nDornbracht Management AG – Iserlohn",
      "type": "Registerbekanntmachung nach dem Umwandlungsgesetz",
      "state": "Nordrhein-Westfalen",
      "amtsgericht": "Amtsgericht Iserlohn",
      "registernummer": "HRB 9770",
      "registerart": "HRB",
      "company_name": "Dornbracht Management AG",
      "company_seat": "Iserlohn",
      "details": "30.10.2024 (Bekanntmachungsdatum)\n\nNordrhein-Westfalen Amtsgericht Iserlohn HRB 9770\nRegisterbekanntmachung nach dem Umwandlungsgesetz 23.10.2024 (Eintragungsdatum)\n\nDornbracht Management AG\nAktiengesellschaft\nIserlohn\n\nDen Gläubigern der an der formwechselnden Umwandlung beteiligten Rechtsträger ist, wenn sie binnen sechs Monaten nach dem Tag, an dem die Eintragung der formwechselnden Umwandlung in das Register des Sitzes desjenigen Rechtsträgers, dessen Gläubiger sie sind, nach § 19 Absatz 3 UmwG als bekanntgemacht gilt, ihren Anspruch nach Grund und Höhe schriftlich anmelden, Sicherheit zu leisten, soweit sie nicht Befriedigung verlangen können. Dieses Recht steht den Gläubigern jedoch nur zu, wenn sie glaubhaft machen, dass durch die formwechselnden Umwandlung die Erfüllung ihrer Forderung gefährdet wird."
    },
    {
      "date": "2024-10-30",
      "id": "92156",
      "original_text": "Registerbekanntmachung nach dem Umwandlungsgesetz\nNordrhein-Westfalen Amtsgericht Essen PR 5456\nPhysioForLife Sport & Reha Partnerschaft – Dortmund",
      "type": "Registerbekanntmachung nach dem Umwandlungsgesetz",
      "state": "Nordrhein-Westfalen",
      "amtsgericht": "Amtsgericht Essen",
      "registernummer": "PR 5456",
      "registerart": "PR",
      "company_name": "PhysioForLife Sport & Reha Partnerschaft",
      "company_seat": "Dortmund",
      "details": "30.10.2024 (Bekanntmachungsdatum)\n\nNordrhein-Westfalen Amtsgericht Essen PR 5456\nRegisterbekanntmachung nach dem Umwandlungsgesetz 30.10.2024 (Eintragungsdatum)\n\nPhysioForLife Sport & Reha Partnerschaft\nPartnerschaftsgesellschaft\nDortmund\n\nDen Gläubigern der an der formwechselnden Umwandlung beteiligten Rechtsträger ist, wenn sie binnen sechs Monaten nach dem Tag, an dem die Eintragung der formwechselnden Umwandlung in das Register des Sitzes desjenigen Rechtsträgers, dessen Gläubiger sie sind, nach § 19 Absatz 3 UmwG als bekanntgemacht gilt, ihren Anspruch nach Grund und Höhe schriftlich anmelden, Sicherheit zu leisten, soweit sie nicht Befriedigung verlangen können. Dieses Recht steht den Gläubigern jedoch nur zu, wenn sie glaubhaft machen, dass durch die formwechselnden Umwandlung die Erfüllung ihrer Forderung gefährdet wird."
    },
    {
      "date": "2024-10-30",
      "id": "92157",
      "original_text": "Registerbekanntmachung nach dem Umwandlungsgesetz\nNordrhein-Westfalen Amtsgericht Iserlohn HRB 11062\nBOSICOM GmbH – Halver",
      "type": "Registerbekanntmachung nach dem Umwandlungsgesetz",
      "state": "Nordrhein-Westfalen",
      "amtsgericht": "Amtsgericht Iserlohn",
      "registernummer": "HRB 11062",
      "registerart": "HRB",
      "company_name": "BOSICOM GmbH",
      "company_seat": "Halver",
      "details": "30.10.2024 (Bekanntmachungsdatum)\n\nNordrhein-Westfalen Amtsgericht Iserlohn HRB 11062\nRegisterbekanntmachung nach dem Umwandlungsgesetz 18.10.2024 (Eintragungsdatum)\n\nBOSICOM GmbH\nGesellschaft mit beschränkter Haftung\nHalver\n\nDen Gläubigern der an der Ausgliederung beteiligten Rechtsträger ist, wenn sie binnen sechs Monaten nach dem Tag, an dem die Eintragung der Ausgliederung in das Register des Sitzes desjenigen Rechtsträgers, dessen Gläubiger sie sind, nach § 19 Absatz 3 UmwG als bekanntgemacht gilt, ihren Anspruch nach Grund und Höhe schriftlich anmelden, Sicherheit zu leisten, soweit sie nicht Befriedigung verlangen können. Dieses Recht steht den Gläubigern jedoch nur zu, wenn sie glaubhaft machen, dass durch die Ausgliederung die Erfüllung ihrer Forderung gefährdet wird."
    },
    {
      "date": "2024-10-30",
      "id": "92158",
      "original_text": "Registerbekanntmachung nach dem Umwandlungsgesetz\nNordrhein-Westfalen Amtsgericht Bad Oeynhausen VR 21912 früher Amtsgericht Herford\nChancenreich-Herford e.V. – Herford",
      "type": "Registerbekanntmachung nach dem Umwandlungsgesetz",
      "state": "Nordrhein-Westfalen",
      "amtsgericht": "Amtsgericht Bad Oeynhausen",
      "registernummer": "VR 21912",
      "registerart": "VR",
      "company_name": "Chancenreich-Herford e.V.",
      "company_seat": "Herford",
      "former_amtsgericht": "Herford",
      "details": "30.10.2024 (Bekanntmachungsdatum)\n\nNordrhein-Westfalen Amtsgericht Bad Oeynhausen VR 21912 früher Amtsgericht Herford\nRegisterbekanntmachung nach dem Umwandlungsgesetz 30.10.2024 (Eintragungsdatum)\n\nChancenreich-Herford e.V.\neingetragener Verein\nHerford\n\nDen Gläubigern der an der formwechselnden Umwandlung beteiligten Rechtsträger ist, wenn sie binnen sechs Monaten nach dem Tag, an dem die Eintragung der formwechselnden Umwandlung in das Register des Sitzes desjenigen Rechtsträgers, dessen Gläubiger sie sind, nach § 19 Absatz 3 UmwG als bekanntgemacht gilt, ihren Anspruch nach Grund und Höhe schriftlich anmelden, Sicherheit zu leisten, soweit sie nicht Befriedigung verlangen können. Dieses Recht steht den Gläubigern jedoch nur zu, wenn sie glaubhaft machen, dass durch die formwechselnden Umwandlung die Erfüllung ihrer Forderung gefährdet wird."
    },
    {
      "date": "2024-10-30",
      "id": "92159",
      "original_text": "Löschungsankündigung\nNordrhein-Westfalen Amtsgericht Dortmund HRB 27410\nCafé Time V & S GmbH – Dortmund",
      "type": "Löschungsankündigung",
      "state": "Nordrhein-Westfalen",
      "amtsgericht": "Amtsgericht Dortmund",
      "registernummer": "HRB 27410",
      "registerart": "HRB",
      "company_name": "Café Time V & S GmbH",
      "company_seat": "Dortmund",
      "details": "30.10.2024 (Bekanntmachungsdatum)\n\nNordrhein-Westfalen Amtsgericht Dortmund HRB 27410\nLöschungsankündigung\n\nCafé Time V & S GmbH\nGesellschaft mit beschränkter Haftung\nDortmund\n\nDas Registergericht beabsichtigt die Gesellschaft von Amts wegen nach § 394 FamFG zu löschen. Die Frist zur Erhebung eines Widerspruchs ist auf zwei Monate festgesetzt."
    },
    {
      "date": "2024-10-30",
      "id": "92160",
      "original_text": "Registerbekanntmachung nach dem Umwandlungsgesetz\nNordrhein-Westfalen Amtsgericht Bielefeld HRB 40719\nPLING GmbH – Bielefeld",
      "type": "Registerbekanntmachung nach dem Umwandlungsgesetz",
      "state": "Nordrhein-Westfalen",
      "amtsgericht": "Amtsgericht Bielefeld",
      "registernummer": "HRB 40719",
      "registerart": "HRB",
      "company_name": "PLING GmbH",
      "company_seat": "Bielefeld",
      "details": "30.10.2024 (Bekanntmachungsdatum)\n\nNordrhein-Westfalen Amtsgericht Bielefeld HRB 40719\nRegisterbekanntmachung nach dem Umwandlungsgesetz 30.10.2024 (Eintragungsdatum)\n\nPLING GmbH\nGesellschaft mit beschränkter Haftung\nBielefeld\n\nDen Gläubigern der an der Verschmelzung beteiligten Rechtsträger ist, wenn sie binnen sechs Monaten nach dem Tag, an dem die Eintragung der Verschmelzung in das Register des Sitzes desjenigen Rechtsträgers, dessen Gläubiger sie sind, nach § 19 Absatz 3 UmwG als bekanntgemacht gilt, ihren Anspruch nach Grund und Höhe schriftlich anmelden, Sicherheit zu leisten, soweit sie nicht Befriedigung verlangen können. Dieses Recht steht den Gläubigern jedoch nur zu, wenn sie glaubhaft machen, dass durch die Verschmelzung die Erfüllung ihrer Forderung gefährdet wird."
    },
    {
      "date": "2024-10-30",
      "id": "92161",
      "original_text": "Registerbekanntmachung nach dem Umwandlungsgesetz\nNordrhein-Westfalen Amtsgericht Köln HRA 35452\nBVI Objekt Zülpich - Chlodwigstraße II GmbH & Co. KG – Köln",
      "type": "Registerbekanntmachung nach dem Umwandlungsgesetz",
      "state": "Nordrhein-Westfalen",
      "amtsgericht": "Amtsgericht Köln",
      "registernummer": "HRA 35452",
      "registerart": "HRA",
      "company_name": "BVI Objekt Zülpich - Chlodwigstraße II GmbH & Co. KG",
      "company_seat": "Köln",
      "details": "30.10.2024 (Bekanntmachungsdatum)\n\nNordrhein-Westfalen Amtsgericht Köln HRA 35452\nRegisterbekanntmachung nach dem Umwandlungsgesetz 30.10.2024 (Eintragungsdatum)\n\nBVI Objekt Zülpich - Chlodwigstraße II GmbH & Co. KG\nKommanditgesellschaft\nKöln\n\nDen Gläubigern der an der Verschmelzung beteiligten Rechtsträger ist, wenn sie binnen sechs Monaten nach dem Tag, an dem die Eintragung der Verschmelzung in das Register des Sitzes desjenigen Rechtsträgers, dessen Gläubiger sie sind, nach § 19 Absatz 3 UmwG als bekanntgemacht gilt, ihren Anspruch nach Grund und Höhe schriftlich anmelden, Sicherheit zu leisten, soweit sie nicht Befriedigung verlangen können. Dieses Recht steht den Gläubigern jedoch nur zu, wenn sie glaubhaft machen, dass durch die Verschmelzung die Erfüllung ihrer Forderung gefährdet wird."
    },
    {
      "date": "2024-10-30",
      "id": "92162",
      "original_text": "Löschungsankündigung\nNordrhein-Westfalen Amtsgericht Mönchengladbach HRB 7149\nMBM GmbH – Viersen",
      "type": "Löschungsankündigung",
      "state": "Nordrhein-Westfalen",
      "amtsgericht": "Amtsgericht Mönchengladbach",
      "registernummer": "HRB 7149",
      "registerart": "HRB",
      "company_name": "MBM GmbH",
      "company_seat": "Viersen",
      "details": "30.10.2024 (Bekanntmachungsdatum)\n\nNordrhein-Westfalen Amtsgericht Mönchengladbach HRB 7149\nLöschungsankündigung\n\nMBM GmbH\nGesellschaft mit beschränkter Haftung\nViersen\n\nDas Registergericht beabsichtigt die Gesellschaft von Amts wegen nach § 394 FamFG zu löschen. Die Frist zur Erhebung eines Widerspruchs ist auf drei Monate festgesetzt."
    },
    {
      "date": "2024-10-30",
      "id": "92163",
      "original_text": "Registerbekanntmachung nach dem Umwandlungsgesetz\nNordrhein-Westfalen Amtsgericht Gelsenkirchen HRB 3348\nGelsenkirchener Werkstätten für angepaßte Arbeit - gemeinnützige Gesellschaft mit beschränkter Haftung. – Gelsenkirchen",
      "type": "Registerbekanntmachung nach dem Umwandlungsgesetz",
      "state": "Nordrhein-Westfalen",
      "amtsgericht": "Amtsgericht Gelsenkirchen",
      "registernummer": "HRB 3348",
      "registerart": "HRB",
      "company_name": "Gelsenkirchener Werkstätten für angepaßte Arbeit - gemeinnützige Gesellschaft mit beschränkter Haftung.",
      "company_seat": "Gelsenkirchen",
      "details": "30.10.2024 (Bekanntmachungsdatum)\n\nNordrhein-Westfalen Amtsgericht Gelsenkirchen HRB 3348\nRegisterbekanntmachung nach dem Umwandlungsgesetz 30.10.2024 (Eintragungsdatum)\n\nGelsenkirchener Werkstätten für angepaßte Arbeit - gemeinnützige Gesellschaft mit beschränkter Haftung.\nGesellschaft mit beschränkter Haftung\nGelsenkirchen\n\nDen Gläubigern der an der Verschmelzung beteiligten Rechtsträger ist, wenn sie binnen sechs Monaten nach dem Tag, an dem die Eintragung der Verschmelzung in das Register des Sitzes desjenigen Rechtsträgers, dessen Gläubiger sie sind, nach § 19 Absatz 3 UmwG als bekanntgemacht gilt, ihren Anspruch nach Grund und Höhe schriftlich anmelden, Sicherheit zu leisten, soweit sie nicht Befriedigung verlangen können. Dieses Recht steht den Gläubigern jedoch nur zu, wenn sie glaubhaft machen, dass durch die Verschmelzung die Erfüllung ihrer Forderung gefährdet wird."
    },
    {
      "date": "2024-10-30",
      "id": "92164",
      "original_text": "Registerbekanntmachung nach dem Umwandlungsgesetz\nBaden-Württemberg Amtsgericht Stuttgart HRA 740456\nHetzel, Lechner, Pfeiffer GmbH & Co. OHG – Forchtenberg",
      "type": "Registerbekanntmachung nach dem Umwandlungsgesetz",
      "state": "Baden-Württemberg",
      "amtsgericht": "Amtsgericht Stuttgart",
      "registernummer": "HRA 740456",
      "registerart": "HRA",
      "company_name": "Hetzel, Lechner, Pfeiffer GmbH & Co. OHG",
      "company_seat": "Forchtenberg",
      "details": "30.10.2024 (Bekanntmachungsdatum)\n\nBaden-Württemberg Amtsgericht Stuttgart HRA 740456\nRegisterbekanntmachung nach dem Umwandlungsgesetz 30.10.2024 (Eintragungsdatum)\n\nHetzel, Lechner, Pfeiffer GmbH & Co. OHG\nOffene Handelsgesellschaft\nForchtenberg\n\nAls nicht eingetragen wird bekanntgemacht:\nDen Gläubigern des an dem Formwechsel beteiligten Rechtsträgers ist, wenn sie binnen sechs Monaten nach dem Tag, an dem die Eintragung des Formwechsels in das Register des Sitzes desjenigen Rechtsträgers, dessen Gläubiger sie sind, nach § 19 Abs. 3 UmwG als bekanntgemacht gilt, ihren Anspruch nach Grund und Höhe schriftlich anmelden, Sicherheit zu leisten, soweit sie nicht Befriedigung verlangen können. Dieses Recht steht den Gläubigern jedoch nur zu, wenn sie glaubhaft machen, dass durch den Formwechsel die Erfüllung ihrer Forderung gefährdet wird."
    },
    {
      "date": "2024-10-30",
      "id": "92165",
      "original_text": "Sonstige Registerbekanntmachung\nThüringen Amtsgericht Jena HRB 502119\nMEDINOS Kliniken des Landkreises Sonneberg GmbH – Sonneberg",
      "type": "Sonstige Registerbekanntmachung",
      "state": "Thüringen",
      "amtsgericht": "Amtsgericht Jena",
      "registernummer": "HRB 502119",
      "registerart": "HRB",
      "company_name": "MEDINOS Kliniken des Landkreises Sonneberg GmbH",
      "company_seat": "Sonneberg",
      "details": "30.10.2024 (Bekanntmachungsdatum)\n\nThüringen Amtsgericht Jena HRB 502119\nSonstige Registerbekanntmachung 30.10.2024 (Eintragungsdatum)\n\nMEDINOS Kliniken des Landkreises Sonneberg GmbH\nGesellschaft mit beschränkter Haftung\nSonneberg\n\nNicht eingetragen: Den Gläubigern der Gesellschaft ist, wenn sie binnen sechs Monaten nach dieser Bekanntmachung ihren Anspruch nach Grund und Höhe schriftlich anmelden, Sicherheit zu leisten, soweit sie nicht Befriedigung verlangen können. Dieses Recht steht ihnen jedoch nicht zu, wenn sie im Falle des Insolvenzverfahrens ein Recht auf vorzugsweise Befriedigung aus einer Deckungsmasse haben, die nach gesetzlicher Vorschrift zu ihrem Schutz errichtet und staatlich überwacht ist."
    },
    {
      "date": "2024-10-30",
      "id": "92166",
      "original_text": "Einreichung neuer Dokumente\nThüringen Amtsgericht Jena HRB 113190\nKEBT Kommunale Energie Beteiligungsgesellschaft Thüringen Aktiengesellschaft – Erfurt",
      "type": "Einreichung neuer Dokumente",
      "state": "Thüringen",
      "amtsgericht": "Amtsgericht Jena",
      "registernummer": "HRB 113190",
      "registerart": "HRB",
      "company_name": "KEBT Kommunale Energie Beteiligungsgesellschaft Thüringen Aktiengesellschaft",
      "company_seat": "Erfurt",
      "details": "30.10.2024 (Bekanntmachungsdatum)\n\nThüringen Amtsgericht Jena HRB 113190\nEinreichung neuer Dokumente 26.09.2024 (Eintragungsdatum)\n\nKEBT Kommunale Energie Beteiligungsgesellschaft Thüringen Aktiengesellschaft\nAktiengesellschaft\nErfurt\n\nBekanntmachung gem. § 106 AktG: Aufgrund einer Veränderung in den Personen der Aufsichtsratsmitglieder ist durch den Vorstand eine neue Liste zum Handelsregister eingereicht worden."
    },
    {
      "date": "2024-10-30",
      "id": "92167",
      "original_text": "Sonstige Registerbekanntmachung\nThüringen Amtsgericht Jena HRB 502144\nHenneberg-Kliniken-Betriebsgesellschaft mbH – Hildburghausen",
      "type": "Sonstige Registerbekanntmachung",
      "state": "Thüringen",
      "amtsgericht": "Amtsgericht Jena",
      "registernummer": "HRB 502144",
      "registerart": "HRB",
      "company_name": "Henneberg-Kliniken-Betriebsgesellschaft mbH",
      "company_seat": "Hildburghausen",
      "details": "30.10.2024 (Bekanntmachungsdatum)\n\nThüringen Amtsgericht Jena HRB 502144\nSonstige Registerbekanntmachung 30.10.2024 (Eintragungsdatum)\n\nHenneberg-Kliniken-Betriebsgesellschaft mbH\nGesellschaft mit beschränkter Haftung\nHildburghausen\n\nNicht eingetragen: Den Gläubigern der Gesellschaft ist, wenn sie binnen sechs Monaten nach dieser Bekanntmachung ihren Anspruch nach Grund und Höhe schriftlich anmelden, Sicherheit zu leisten, soweit sie nicht Befriedigung verlangen können. Dieses Recht steht ihnen jedoch nicht zu, wenn sie im Falle des Insolvenzverfahrens ein Recht auf vorzugsweise Befriedigung aus einer Deckungsmasse haben, die nach gesetzlicher Vorschrift zu ihrem Schutz errichtet und staatlich überwacht ist."
    },
    {
      "date": "2024-10-30",
      "id": "92168",
      "original_text": "Löschungsankündigung\nHessen Amtsgericht Offenbach am Main HRB 45319\nKippenbrock & Wollnik GmbH – Neu-Isenburg",
      "type": "Löschungsankündigung",
      "state": "Hessen",
      "amtsgericht": "Amtsgericht Offenbach am Main",
      "registernummer": "HRB 45319",
      "registerart": "HRB",
      "company_name": "Kippenbrock & Wollnik GmbH",
      "company_seat": "Neu-Isenburg",
      "details": "30.10.2024 (Bekanntmachungsdatum)\n\nHessen Amtsgericht Offenbach am Main HRB 45319\nLöschungsankündigung\n\nKippenbrock & Wollnik GmbH\nGesellschaft mit beschränkter Haftung\nNeu-Isenburg\n\nDas Registergericht beabsichtigt die im Handelsregister eingetragene Gesellschaft von Amts wegen nach § 394 FamFG zu löschen. Die Frist zur Erhebung eines Widerspruchs gegen die beabsichtigte Löschung wird auf 3 Monate festgesetzt."
    },
    {
      "date": "2024-10-30",
      "id": "92169",
      "original_text": "Registerbekanntmachung nach dem Umwandlungsgesetz\nHessen Amtsgericht Wetzlar HRA 8141\nStark Gerüstbau Yildiz e. K. – Solms",
      "type": "Registerbekanntmachung nach dem Umwandlungsgesetz",
      "state": "Hessen",
      "amtsgericht": "Amtsgericht Wetzlar",
      "registernummer": "HRA 8141",
      "registerart": "HRA",
      "company_name": "Stark Gerüstbau Yildiz e. K.",
      "company_seat": "Solms",
      "details": "30.10.2024 (Bekanntmachungsdatum)\n\nHessen Amtsgericht Wetzlar HRA 8141\nRegisterbekanntmachung nach dem Umwandlungsgesetz 30.10.2024 (Eintragungsdatum)\n\nStark Gerüstbau Yildiz e. K.\nEinzelkaufmann / Einzelkauffrau\nSolms\n\nDen Gläubigern der an der Ausgliederung beteiligten Rechtsträger ist, wenn sie binnen sechs Monaten nach dem Tag, an dem die Eintragung der Ausgliederung in das Register des Sitzes desjenigen Rechtsträgers, dessen Gläubiger sie sind, nach §§ 125, 19 Absatz 3 UmwG bekannt gemacht worden ist, ihren Anspruch nach Grund und Höhe schriftlich anmelden, Sicherheit zu leisten, soweit sie nicht Befriedigung verlangen können. Dieses Recht steht den Gläubigern jedoch nur zu, wenn sie glaubhaft machen, dass durch die Ausgliederung die Erfüllung ihrer Forderung gefährdet wird."
    },
    {
      "date": "2024-10-30",
      "id": "92170",
      "original_text": "Registerbekanntmachung nach dem Umwandlungsgesetz\nHessen Amtsgericht Wetzlar HRB 9163\nStark Gerüstbau GmbH – Solms",
      "type": "Registerbekanntmachung nach dem Umwandlungsgesetz",
      "state": "Hessen",
      "amtsgericht": "Amtsgericht Wetzlar",
      "registernummer": "HRB 9163",
      "registerart": "HRB",
      "company_name": "Stark Gerüstbau GmbH",
      "company_seat": "Solms",
      "details": "30.10.2024 (Bekanntmachungsdatum)\n\nHessen Amtsgericht Wetzlar HRB 9163\nRegisterbekanntmachung nach dem Umwandlungsgesetz 30.10.2024 (Eintragungsdatum)\n\nStark Gerüstbau GmbH\nGesellschaft mit beschränkter Haftung\nSolms\n\nDen Gläubigern der an der Ausgliederung beteiligten Rechtsträger ist, wenn sie binnen sechs Monaten nach dem Tag, an dem die Eintragung der Ausgliederung in das Register des Sitzes desjenigen Rechtsträgers, dessen Gläubiger sie sind, nach §§ 125, 19 Absatz 3 UmwG bekannt gemacht worden ist, ihren Anspruch nach Grund und Höhe schriftlich anmelden, Sicherheit zu leisten, soweit sie nicht Befriedigung verlangen können. Dieses Recht steht den Gläubigern jedoch nur zu, wenn sie glaubhaft machen, dass durch die Ausgliederung die Erfüllung ihrer Forderung gefährdet wird."
    },
    {
      "date": "2024-10-30",
      "id": "92171",
      "original_text": "Löschungsankündigung\nHessen Amtsgericht Offenbach am Main HRB 49796\nLarai Piano Germany UG (haftungsbeschränkt) – Offenbach am Main",
      "type": "Löschungsankündigung",
      "state": "Hessen",
      "amtsgericht": "Amtsgericht Offenbach am Main",
      "registernummer": "HRB 49796",
      "registerart": "HRB",
      "company_name": "Larai Piano Germany UG (haftungsbeschränkt)",
      "company_seat": "Offenbach am Main",
      "details": "30.10.2024 (Bekanntmachungsdatum)\n\nHessen Amtsgericht Offenbach am Main HRB 49796\nLöschungsankündigung\n\nLarai Piano Germany UG (haftungsbeschränkt)\nGesellschaft mit beschränkter Haftung\nOffenbach am Main\n\nDas Registergericht beabsichtigt die im Handelsregister eingetragene Gesellschaft von Amts wegen nach § 394 FamFG zu löschen. Die Frist zur Erhebung eines Widerspruchs gegen die beabsichtigte Löschung wird auf 3 Monate festgesetzt."
    },
    {
      "date": "2024-10-30",
      "id": "92172",
      "original_text": "Einreichung neuer Dokumente\nHessen Amtsgericht Frankfurt am Main HRB 94942\n.bieker AG – Frankfurt am Main",
      "type": "Einreichung neuer Dokumente",
      "state": "Hessen",
      "amtsgericht": "Amtsgericht Frankfurt am Main",
      "registernummer": "HRB 94942",
      "registerart": "HRB",
      "company_name": ".bieker AG",
      "company_seat": "Frankfurt am Main",
      "details": "30.10.2024 (Bekanntmachungsdatum)\n\nHessen Amtsgericht Frankfurt am Main HRB 94942\nEinreichung neuer Dokumente\n\n.bieker AG\nAktiengesellschaft\nFrankfurt am Main\n\nDurch eine Änderung in den Personen der Aufsichtsratsmitglieder ist eine Liste der Mitglieder des Aufsichtsrates zum Handelsregister eingereicht worden."
    },
    {
      "date": "2024-10-30",
      "id": "92173",
      "original_text": "Löschungsankündigung\nHessen Amtsgericht Offenbach am Main HRB 53633\nBB Immobilien Bau GmbH – Rodgau",
      "type": "Löschungsankündigung",
      "state": "Hessen",
      "amtsgericht": "Amtsgericht Offenbach am Main",
      "registernummer": "HRB 53633",
      "registerart": "HRB",
      "company_name": "BB Immobilien Bau GmbH",
      "company_seat": "Rodgau",
      "details": "30.10.2024 (Bekanntmachungsdatum)\n\nHessen Amtsgericht Offenbach am Main HRB 53633\nLöschungsankündigung\n\nBB Immobilien Bau GmbH\nGesellschaft mit beschränkter Haftung\nRodgau\n\nDas Registergericht beabsichtigt die im Handelsregister eingetragene Gesellschaft von Amts wegen nach § 394 FamFG zu löschen. Die Frist zur Erhebung eines Widerspruchs gegen die beabsichtigte Löschung wird auf 3 Monate festgesetzt."
    },
    {
      "date": "2024-10-30",
      "id": "92174",
      "original_text": "Löschungsankündigung\nHessen Amtsgericht Darmstadt HRB 101046\nGK-Plus GmbH – Biebesheim",
      "type": "Löschungsankündigung",
      "state": "Hessen",
      "amtsgericht": "Amtsgericht Darmstadt",
      "registernummer": "HRB 101046",
      "registerart": "HRB",
      "company_name": "GK-Plus GmbH",
      "company_seat": "Biebesheim",
      "details": "30.10.2024 (Bekanntmachungsdatum)\n\nHessen Amtsgericht Darmstadt HRB 101046\nLöschungsankündigung 30.10.2024 (Eintragungsdatum)\n\nGK-Plus GmbH\nGesellschaft mit beschränkter Haftung\nBiebesheim\n\nDas Registergericht beabsichtigt die im Handelsregister eingetragene Gesellschaft von Amts wegen nach § 394 FamFG zu löschen. Die Frist zur Erhebung eines Widerspruchs gegen die beabsichtigte Löschung wird auf 3 Monate festgesetzt."
    },
    {
      "date": "2024-10-30",
      "id": "92175",
      "original_text": "Registerbekanntmachung nach dem Umwandlungsgesetz\nHessen Amtsgericht Offenbach am Main HRB 47693\nMEDSER Medical Services GmbH – Heusenstamm",
      "type": "Registerbekanntmachung nach dem Umwandlungsgesetz",
      "state": "Hessen",
      "amtsgericht": "Amtsgericht Offenbach am Main",
      "registernummer": "HRB 47693",
      "registerart": "HRB",
      "company_name": "MEDSER Medical Services GmbH",
      "company_seat": "Heusenstamm",
      "details": "30.10.2024 (Bekanntmachungsdatum)\n\nHessen Amtsgericht Offenbach am Main HRB 47693\nRegisterbekanntmachung nach dem Umwandlungsgesetz 09.10.2024 (Eintragungsdatum)\n\nMEDSER Medical Services GmbH\nGesellschaft mit beschränkter Haftung\nHeusenstamm\n\nDen Gläubigern der an der Verschmelzung beteiligten Rechtsträger ist, wenn sie binnen sechs Monaten nach dem Tag, an dem die Eintragung der Verschmelzung in das Register des Sitzes desjenigen Rechtsträgers, dessen Gläubiger sie sind, nach § 19 Absatz 3 UmwG bekannt gemacht worden ist, ihren Anspruch nach Grund und Höhe schriftlich anmelden, Sicherheit zu leisten, soweit sie nicht Befriedigung verlangen können. Dieses Recht steht den Gläubigern jedoch nur zu, wenn sie glaubhaft machen, dass durch die Verschmelzung die Erfüllung ihrer Forderung gefährdet wird."
    },
    {
      "date": "2024-10-30",
      "id": "92176",
      "original_text": "Löschungsankündigung\nHessen Amtsgericht Offenbach am Main HRB 51554\nAßmann UG (haftungsbeschränkt) – Dreieich",
      "type": "Löschungsankündigung",
      "state": "Hessen",
      "amtsgericht": "Amtsgericht Offenbach am Main",
      "registernummer": "HRB 51554",
      "registerart": "HRB",
      "company_name": "Aßmann UG (haftungsbeschränkt)",
      "company_seat": "Dreieich",
      "details": "30.10.2024 (Bekanntmachungsdatum)\n\nHessen Amtsgericht Offenbach am Main HRB 51554\nLöschungsankündigung\n\nAßmann UG (haftungsbeschränkt)\nGesellschaft mit beschränkter Haftung\nDreieich\n\nDas Registergericht beabsichtigt die im Handelsregister eingetragene Gesellschaft von Ams wegen nach § 394 FamFG zu löschen. Die Frist zur Erhebung eines Widerspruchs gegen die beabsichtigte Löschung wird auf 3 Monate festgesetzt."
    },
    {
      "date": "2024-10-30",
      "id": "92177",
      "original_text": "Löschungsankündigung\nHessen Amtsgericht Fritzlar HRA 13003\nAutohaus Karl Ulrich e.K. – Homberg (Efze)",
      "type": "Löschungsankündigung",
      "state": "Hessen",
      "amtsgericht": "Amtsgericht Fritzlar",
      "registernummer": "HRA 13003",
      "registerart": "HRA",
      "company_name": "Autohaus Karl Ulrich e.K.",
      "company_seat": "Homberg (Efze)",
      "details": "30.10.2024 (Bekanntmachungsdatum)\n\nHessen Amtsgericht Fritzlar HRA 13003\nLöschungsankündigung 30.10.2024 (Eintragungsdatum)\n\nAutohaus Karl Ulrich e.K.\nEinzelkaufmann / Einzelkauffrau\nHomberg (Efze)\n\nDas Registergericht beabsichtigt die im Handelsregister eingetragene Firma von Amts wegen nach § 31 Abs. 2 HGB zu löschen. Die Frist zur Erhebung eines Widerspruchs gegen die beabsichtigte Löschung wird auf 3 Monate festgesetzt."
    },
    {
      "date": "2024-10-30",
      "id": "92178",
      "original_text": "Einreichung neuer Dokumente\nHessen Amtsgericht Offenbach am Main HRB 54134\nHeidelberger Lebensversicherung AG – Neu-Isenburg",
      "type": "Einreichung neuer Dokumente",
      "state": "Hessen",
      "amtsgericht": "Amtsgericht Offenbach am Main",
      "registernummer": "HRB 54134",
      "registerart": "HRB",
      "company_name": "Heidelberger Lebensversicherung AG",
      "company_seat": "Neu-Isenburg",
      "details": "30.10.2024 (Bekanntmachungsdatum)\n\nHessen Amtsgericht Offenbach am Main HRB 54134\nEinreichung neuer Dokumente\n\nHeidelberger Lebensversicherung AG\nAktiengesellschaft\nNeu-Isenburg\n\nDurch eine Änderung in den Personen der Aufsichtsratsmitglieder ist eine Liste der Mitglieder des Aufsichtsrates zum Handelsregister eingereicht worden."
    },
    {
      "date": "2024-10-30",
      "id": "92179",
      "original_text": "Registerbekanntmachung nach dem Umwandlungsgesetz\nHessen Amtsgericht Offenbach am Main HRA 42012\nMEDSER MEDICAL Services GmbH & Co. KG – Heusenstamm",
      "type": "Registerbekanntmachung nach dem Umwandlungsgesetz",
      "state": "Hessen",
      "amtsgericht": "Amtsgericht Offenbach am Main",
      "registernummer": "HRA 42012",
      "registerart": "HRA",
      "company_name": "MEDSER MEDICAL Services GmbH & Co. KG",
      "company_seat": "Heusenstamm",
      "details": "30.10.2024 (Bekanntmachungsdatum)\n\nHessen Amtsgericht Offenbach am Main HRA 42012\nRegisterbekanntmachung nach dem Umwandlungsgesetz 09.10.2024 (Eintragungsdatum)\n\nMEDSER MEDICAL Services GmbH & Co. KG\nKommanditgesellschaft\nHeusenstamm\n\nDen Gläubigern der an der Verschmelzung beteiligten Rechtsträger ist, wenn sie binnen sechs Monaten nach dem Tag, an dem die Eintragung der Verschmelzung in das Register des Sitzes desjenigen Rechtsträgers, dessen Gläubiger sie sind, nach § 19 Absatz 3 UmwG bekannt gemacht worden ist, ihren Anspruch nach Grund und Höhe schriftlich anmelden, Sicherheit zu leisten, soweit sie nicht Befriedigung verlangen können. Dieses Recht steht den Gläubigern jedoch nur zu, wenn sie glaubhaft machen, dass durch die Verschmelzung die Erfüllung ihrer Forderung gefährdet wird."
    }
  ]
}