{
  "date": "2024-10-08",
  "date_of_scrape": "2024-11-30T12:27:38.501Z",
  "tool_version": "0.2.0",
  "number_of_announcements": 203,
  "announcements": [
    {
      "date": "2024-10-08",
      "id": "89563",
      "original_text": "Löschungsankündigung\nNiedersachsen Amtsgericht Lüneburg HRB 204998\nAB ProPlan Baulogistik GmbH – Tespe",
      "type": "Löschungsankündigung",
      "state": "Niedersachsen",
      "amtsgericht": "Amtsgericht Lüneburg",
      "registernummer": "HRB 204998",
      "registerart": "HRB",
      "company_name": "AB ProPlan Baulogistik GmbH",
      "company_seat": "Tespe",
      "details": "08.10.2024 (Bekanntmachungsdatum)\n\nNiedersachsen Amtsgericht Lüneburg HRB 204998\nLöschungsankündigung\n\nAB ProPlan Baulogistik GmbH\nGesellschaft mit beschränkter Haftung\nTespe\n\nDas Registergericht beabsichtigt, die Gesellschaft von Amts wegen nach § 394 FamFG zu löschen. Die Frist zur Erhebung eines Widerspruchs ist auf 1 Monat ab dieser Registerbekanntmachung festgesetzt."
    },
    {
      "date": "2024-10-08",
      "id": "89569",
      "original_text": "Löschungsankündigung\nRheinland-Pfalz Amtsgericht Landau HRB 33040\nACA-Immo UG (haftungsbeschränkt) – Burrweiler",
      "type": "Löschungsankündigung",
      "state": "Rheinland-Pfalz",
      "amtsgericht": "Amtsgericht Landau",
      "registernummer": "HRB 33040",
      "registerart": "HRB",
      "company_name": "ACA-Immo UG (haftungsbeschränkt)",
      "company_seat": "Burrweiler",
      "details": "08.10.2024 (Bekanntmachungsdatum)\n\nRheinland-Pfalz Amtsgericht Landau HRB 33040\nLöschungsankündigung\n\nACA-Immo UG (haftungsbeschränkt)\nGesellschaft mit beschränkter Haftung\nBurrweiler\n\nDas Registergericht beabsichtigt die Gesellschaft von Amts wegen nach § 394 FamFG zu löschen. Die Frist zur Erhebung eines Widerspruchs ist auf einen Monat festgesetzt."
    },
    {
      "date": "2024-10-08",
      "id": "89618",
      "original_text": "Sonstige Registerbekanntmachung\nHessen Amtsgericht Frankfurt am Main HRB 107682\nAGF Videoforschung GmbH – Frankfurt am Main",
      "type": "Sonstige Registerbekanntmachung",
      "state": "Hessen",
      "amtsgericht": "Amtsgericht Frankfurt am Main",
      "registernummer": "HRB 107682",
      "registerart": "HRB",
      "company_name": "AGF Videoforschung GmbH",
      "company_seat": "Frankfurt am Main",
      "details": "08.10.2024 (Bekanntmachungsdatum)\n\nHessen Amtsgericht Frankfurt am Main HRB 107682\nSonstige Registerbekanntmachung 08.10.2024 (Eintragungsdatum)\n\nAGF Videoforschung GmbH\nGesellschaft mit beschränkter Haftung\nFrankfurt am Main\n\nDurch eine Änderung in den Personen der Aufsichtsratsmitglieder ist eine Liste der Mitglieder des Aufsichtsrates zum Handelsregister eingereicht worden."
    },
    {
      "date": "2024-10-08",
      "id": "89500",
      "original_text": "Einreichung neuer Dokumente\nBaden-Württemberg Amtsgericht Freiburg HRB 680621\nATEMAG Aggregatetechnologie und Manufaktur AG – Hofstetten",
      "type": "Einreichung neuer Dokumente",
      "state": "Baden-Württemberg",
      "amtsgericht": "Amtsgericht Freiburg",
      "registernummer": "HRB 680621",
      "registerart": "HRB",
      "company_name": "ATEMAG Aggregatetechnologie und Manufaktur AG",
      "company_seat": "Hofstetten",
      "details": "08.10.2024 (Bekanntmachungsdatum)\n\nBaden-Württemberg Amtsgericht Freiburg HRB 680621\nEinreichung neuer Dokumente 08.10.2024 (Eintragungsdatum)\n\nATEMAG Aggregatetechnologie und Manufaktur AG\nAktiengesellschaft\nHofstetten\n\nAls nicht eingetragen wird bekanntgemacht:\nDie Gesellschaft hat am 26.09.2024 die Liste über die Zusammensetzung des Aufsichtsrats zum Handelsregister eingereicht."
    },
    {
      "date": "2024-10-08",
      "id": "89531",
      "original_text": "Einreichung neuer Dokumente\nBaden-Württemberg Amtsgericht Stuttgart HRB 790529\nAVERDION SE – Stuttgart",
      "type": "Einreichung neuer Dokumente",
      "state": "Baden-Württemberg",
      "amtsgericht": "Amtsgericht Stuttgart",
      "registernummer": "HRB 790529",
      "registerart": "HRB",
      "company_name": "AVERDION SE",
      "company_seat": "Stuttgart",
      "details": "08.10.2024 (Bekanntmachungsdatum)\n\nBaden-Württemberg Amtsgericht Stuttgart HRB 790529\nEinreichung neuer Dokumente\n\nAVERDION SE\nEuropäische Aktiengesellschaft (SE)\nStuttgart\n\nDie Gesellschaft hat am 24.09.2024 die Liste über die Zusammensetzung des Aufsichtsrats zum Handelsregister eingereicht."
    },
    {
      "date": "2024-10-08",
      "id": "89487",
      "original_text": "Löschungsankündigung\nBerlin Amtsgericht Berlin (Charlottenburg) HRB 82361\nAVRORA Travel GmbH – Berlin",
      "type": "Löschungsankündigung",
      "state": "Berlin",
      "amtsgericht": "Amtsgericht Berlin (Charlottenburg)",
      "registernummer": "HRB 82361",
      "registerart": "HRB",
      "company_name": "AVRORA Travel GmbH",
      "company_seat": "Berlin",
      "details": "08.10.2024 (Bekanntmachungsdatum)\n\nBerlin Amtsgericht Berlin (Charlottenburg) HRB 82361\nLöschungsankündigung\n\nAVRORA Travel GmbH\nGesellschaft mit beschränkter Haftung\nBerlin\n\nBei der nachstehenden Gesellschaft wird das Amtslöschungsverfahren gemäß § 394 FamFG eingeleitet. Widerspruchsfrist 6 Wochen"
    },
    {
      "date": "2024-10-08",
      "id": "89456",
      "original_text": "Registerbekanntmachung nach dem Umwandlungsgesetz\nBayern Amtsgericht München HRB 70247\nAllguth GmbH – Gräfelfing",
      "type": "Registerbekanntmachung nach dem Umwandlungsgesetz",
      "state": "Bayern",
      "amtsgericht": "Amtsgericht München",
      "registernummer": "HRB 70247",
      "registerart": "HRB",
      "company_name": "Allguth GmbH",
      "company_seat": "Gräfelfing",
      "details": "08.10.2024 (Bekanntmachungsdatum)\n\nBayern Amtsgericht München HRB 70247\nRegisterbekanntmachung nach dem Umwandlungsgesetz 07.10.2024 (Eintragungsdatum)\n\nAllguth GmbH\nGesellschaft mit beschränkter Haftung\nGräfelfing\n\nDen Gläubigern der an der Verschmelzung beteiligten Rechtsträger ist, wenn sie binnen sechs Monaten nach dem Tag, an dem die Eintragung der Verschmelzung in das Register des Sitzes desjenigen Rechtsträgers, dessen Gläubiger sie sind, nach § 19 Abs. 3 UmwG als bekannt gemacht gilt, ihren Anspruch nach Grund und Höhe schriftlich anmelden, Sicherheit zu leisten, soweit sie nicht Befriedigung verlangen können. Dieses Recht steht den Gläubigern jedoch nur zu, wenn sie glaubhaft machen, dass durch die Verschmelzung die Erfüllung ihrer Forderung gefährdet wird."
    },
    {
      "date": "2024-10-08",
      "id": "89445",
      "original_text": "Registerbekanntmachung nach dem Umwandlungsgesetz\nBayern Amtsgericht München HRB 214286\nAmmer Personalberatung GmbH – Taufkirchen (Vils)",
      "type": "Registerbekanntmachung nach dem Umwandlungsgesetz",
      "state": "Bayern",
      "amtsgericht": "Amtsgericht München",
      "registernummer": "HRB 214286",
      "registerart": "HRB",
      "company_name": "Ammer Personalberatung GmbH",
      "company_seat": "Taufkirchen (Vils)",
      "details": "08.10.2024 (Bekanntmachungsdatum)\n\nBayern Amtsgericht München HRB 214286\nRegisterbekanntmachung nach dem Umwandlungsgesetz 07.10.2024 (Eintragungsdatum)\n\nAmmer Personalberatung GmbH\nGesellschaft mit beschränkter Haftung\nTaufkirchen (Vils)\n\nDen Gläubigern der an der Verschmelzung beteiligten Rechtsträger ist, wenn sie binnen sechs Monaten nach dem Tag, an dem die Eintragung der Verschmelzung in das Register des Sitzes desjenigen Rechtsträgers, dessen Gläubiger sie sind, nach § 19 Abs. 3 UmwG als bekannt gemacht gilt, ihren Anspruch nach Grund und Höhe schriftlich anmelden, Sicherheit zu leisten, soweit sie nicht Befriedigung verlangen können. Dieses Recht steht den Gläubigern jedoch nur zu, wenn sie glaubhaft machen, dass durch die Verschmelzung die Erfüllung ihrer Forderung gefährdet wird."
    },
    {
      "date": "2024-10-08",
      "id": "89425",
      "original_text": "Registerbekanntmachung nach dem Umwandlungsgesetz\nBayern Amtsgericht München HRB 296508\nAnlagenbau Oberland GmbH – Oberhausen",
      "type": "Registerbekanntmachung nach dem Umwandlungsgesetz",
      "state": "Bayern",
      "amtsgericht": "Amtsgericht München",
      "registernummer": "HRB 296508",
      "registerart": "HRB",
      "company_name": "Anlagenbau Oberland GmbH",
      "company_seat": "Oberhausen",
      "details": "08.10.2024 (Bekanntmachungsdatum)\n\nBayern Amtsgericht München HRB 296508\nRegisterbekanntmachung nach dem Umwandlungsgesetz 07.10.2024 (Eintragungsdatum)\n\nAnlagenbau Oberland GmbH\nGesellschaft mit beschränkter Haftung\nOberhausen\n\nDen Gläubigern des formwechselnden Rechtsträgers ist, wenn sie binnen sechs Monaten nach dem Tag, an dem die Eintragung des Formwechsels nach § 201 UmwG als bekannt gemacht gilt, ihren Anspruch nach Grund und Höhe schriftlich anmelden, Sicherheit zu leisten, soweit sie nicht Befriedigung verlangen können. Dieses Recht steht den Gläubigern jedoch nur zu, wenn sie glaubhaft machen, dass durch den Formwechsel die Erfüllung ihrer Forderung gefährdet wird."
    },
    {
      "date": "2024-10-08",
      "id": "89510",
      "original_text": "Registerbekanntmachung nach dem Umwandlungsgesetz\nThüringen Amtsgericht Jena HRB 522118\nAsgard GmbH – Nobitz",
      "type": "Registerbekanntmachung nach dem Umwandlungsgesetz",
      "state": "Thüringen",
      "amtsgericht": "Amtsgericht Jena",
      "registernummer": "HRB 522118",
      "registerart": "HRB",
      "company_name": "Asgard GmbH",
      "company_seat": "Nobitz",
      "details": "08.10.2024 (Bekanntmachungsdatum)\n\nThüringen Amtsgericht Jena HRB 522118\nRegisterbekanntmachung nach dem Umwandlungsgesetz 08.10.2024 (Eintragungsdatum)\n\nAsgard GmbH\nGesellschaft mit beschränkter Haftung\nNobitz\n\nNicht eingetragen: Den Gläubigern der an der Verschmelzung beteiligten Rechtsträger, ist wenn sie binnen sechs Monaten nach dem Tag, an dem die Eintragung der Verschmelzung in das Register des Sitzes desjenigen Rechtsträgers, dessen Gläubiger sie sind,  nach § 19 Abs. 3 UmwG als bekanntgemacht gilt, ihren Anspruch nach Grund und Höhe schriftlich anmelden, Sicherheit zu leisten, soweit sie nicht Befriedigung verlangen können. Dieses Recht steht ihnen jedoch nur zu, wenn sie glaubhaft machen, daß durch die Verschmelzung die Erfüllung ihrer Forderung gefährdet wird."
    },
    {
      "date": "2024-10-08",
      "id": "89547",
      "original_text": "Löschungsankündigung\nBrandenburg Amtsgericht Neuruppin HRB 9924\nAutomobilgesellschaft Weilbacher mbH – Schwedt/Oder",
      "type": "Löschungsankündigung",
      "state": "Brandenburg",
      "amtsgericht": "Amtsgericht Neuruppin",
      "registernummer": "HRB 9924",
      "registerart": "HRB",
      "company_name": "Automobilgesellschaft Weilbacher mbH",
      "company_seat": "Schwedt/Oder",
      "details": "08.10.2024 (Bekanntmachungsdatum)\n\nBrandenburg Amtsgericht Neuruppin HRB 9924\nLöschungsankündigung\n\nAutomobilgesellschaft Weilbacher mbH\nGesellschaft mit beschränkter Haftung\nSchwedt/Oder\n\nBei der nachstehenden Gesellschaft wird das Amtslöschungsverfahren gemäß § 394 FamFG eingeleitet.\nWiderspruchsfrist: 1 Monat"
    },
    {
      "date": "2024-10-08",
      "id": "89620",
      "original_text": "Sonstige Registerbekanntmachung\nHessen Amtsgericht Fritzlar HRB 11000\nB. Braun Melsungen Aktiengesellschaft – Melsungen",
      "type": "Sonstige Registerbekanntmachung",
      "state": "Hessen",
      "amtsgericht": "Amtsgericht Fritzlar",
      "registernummer": "HRB 11000",
      "registerart": "HRB",
      "company_name": "B. Braun Melsungen Aktiengesellschaft",
      "company_seat": "Melsungen",
      "details": "08.10.2024 (Bekanntmachungsdatum)\n\nHessen Amtsgericht Fritzlar HRB 11000\nSonstige Registerbekanntmachung 07.07.2005 (Eintragungsdatum)\n\nB. Braun Melsungen Aktiengesellschaft\nAktiengesellschaft\nMelsungen\n\nDurch eine Änderung in den Personen der Aufsichtsratsmitglieder ist eine Liste der Mitglieder des Aufsichtsrates zum Handelsregister eingereicht worden."
    },
    {
      "date": "2024-10-08",
      "id": "89427",
      "original_text": "Einreichung neuer Dokumente\nBayern Amtsgericht Ingolstadt HRB 101375\nBAUER Aktiengesellschaft – Schrobenhausen",
      "type": "Einreichung neuer Dokumente",
      "state": "Bayern",
      "amtsgericht": "Amtsgericht Ingolstadt",
      "registernummer": "HRB 101375",
      "registerart": "HRB",
      "company_name": "BAUER Aktiengesellschaft",
      "company_seat": "Schrobenhausen",
      "details": "08.10.2024 (Bekanntmachungsdatum)\n\nBayern Amtsgericht Ingolstadt HRB 101375\nEinreichung neuer Dokumente\n\nBAUER Aktiengesellschaft\nAktiengesellschaft\nSchrobenhausen\n\nDem #Re.Name ist eine Liste der Mitglieder des Aufsichtsrats eingereicht worden, § 106 AktG."
    },
    {
      "date": "2024-10-08",
      "id": "89444",
      "original_text": "Registerbekanntmachung nach dem Umwandlungsgesetz\nBayern Amtsgericht Ingolstadt HRB 44\nBBI Bürgerliches Brauhaus Immobilien Aktiengesellschaft – Ingolstadt",
      "type": "Registerbekanntmachung nach dem Umwandlungsgesetz",
      "state": "Bayern",
      "amtsgericht": "Amtsgericht Ingolstadt",
      "registernummer": "HRB 44",
      "registerart": "HRB",
      "company_name": "BBI Bürgerliches Brauhaus Immobilien Aktiengesellschaft",
      "company_seat": "Ingolstadt",
      "details": "08.10.2024 (Bekanntmachungsdatum)\n\nBayern Amtsgericht Ingolstadt HRB 44\nRegisterbekanntmachung nach dem Umwandlungsgesetz 07.10.2024 (Eintragungsdatum)\n\nBBI Bürgerliches Brauhaus Immobilien Aktiengesellschaft\nAktiengesellschaft\nIngolstadt\n\nDen Gläubigern der an der Verschmelzung beteiligten Rechtsträger ist, wenn sie binnen sechs Monaten nach dem Tag, an dem die Eintragung der Verschmelzung in das Register des Sitzes desjenigen Rechtsträgers, dessen Gläubiger sie sind, nach § 19 Abs. 3 UmwG als bekannt gemacht gilt, ihren Anspruch nach Grund und Höhe schriftlich anmelden, Sicherheit zu leisten, soweit sie nicht Befriedigung verlangen können. Dieses Recht steht den Gläubigern jedoch nur zu, wenn sie glaubhaft machen, dass durch die Verschmelzung die Erfüllung ihrer Forderung gefährdet wird."
    },
    {
      "date": "2024-10-08",
      "id": "89489",
      "original_text": "Einreichung neuer Dokumente\nBerlin Amtsgericht Berlin (Charlottenburg) HRB 228627\nBBR Project 3 Landsberger Tor GmbH – Berlin",
      "type": "Einreichung neuer Dokumente",
      "state": "Berlin",
      "amtsgericht": "Amtsgericht Berlin (Charlottenburg)",
      "registernummer": "HRB 228627",
      "registerart": "HRB",
      "company_name": "BBR Project 3 Landsberger Tor GmbH",
      "company_seat": "Berlin",
      "details": "08.10.2024 (Bekanntmachungsdatum)\n\nBerlin Amtsgericht Berlin (Charlottenburg) HRB 228627\nEinreichung neuer Dokumente\n\nBBR Project 3 Landsberger Tor GmbH\nGesellschaft mit beschränkter Haftung\nBerlin\n\nAls nicht eingetragen wird veröffentlicht:\n\nDie Gesellschaft hat einen notariell beurkundeten Formwechselplan vom 30.09.2024 betreffend den grenzüberschreitenden, identitätswahrenden Formwechsel unter gleichzeitiger Verlegung des Satzungssitzes der Gesellschaft nach Luxemburg gemäß §§ 333 ff. UmwG zum Handelsregister des Amtsgerichts Charlottenburg eingereicht.\n\nAngaben nach §§ 336, 308 ABS. 1 S. 2 Nr. 1 - 4 UmwG S. Nr. Angaben nach §§ 336, 308 ABS. - UmwG\nIm Hinblick auf den Inhalt der Bekanntmachung sowie §§ 336, 308 Abs. 1 S. 2 Nr. 1 - 4 UmwG werden folgende Angaben gemacht:\nIm Hinblick auf den Inhalt der Bekanntmachung sowie §§ 336, 308 Abs. UmwG werden folgende Angaben gemacht:\n\n1. Formwechselplan\nDer notariell beurkundete Formwechselplan wurde elektronisch zum Handelsregister eingereicht.\n\n2. Rechtsform, Firma und Sitz der formwechselnden Gesellschaft\nDie Gesellschaft ist eine deutsche Gesellschaft mit beschränkter Haftung unter der Firma BBR Project 3 Landsberger Tor GmbH, errichtet und bestehend nach deutschem Recht, mit Sitz in Berlin, Deutschland, eingetragen im Handelsregister des Amtsgerichts Charlottenburg unter HRB 228627 B.\n\nDie Gesellschaft soll durch grenzüberschreitenden, identitätswahrenden Formwechsel aufgrund eines Formwechselbeschlusses unter gleichzeitiger Verlegung des Satzungssitzes in eine Gesellschaft mit beschränkter Haftung nach dem Recht des Großherzogtums Luxemburg (société à responsabilité limitée) mit Sitz in Luxemburg, Großherzogtum Luxemburg, umgewandelt werden. Die Gesellschaft wird die Firma BBR Project 3 Landsberger Tor S.à r.l. führen.\nLandsberger Tor S.ä r.l. führen.\n\n3. Register der formwechselnden Gesellschaft\nDie an dem grenzüberschreitenden Formwechsel beteiligte Gesellschaft HRB 228627 B im Handelsregister des Amtsgerichts Charlottenburg eingetragen.\n\n4. Hinweis an die Anteilsinhaber und Gläubiger\nDem Gesellschafter und den Gläubigern der Gesellschaft wird mitgeteilt, dass sie der Gesellschaft spätestens fünf Tage vor dem Tag der Gesellschafterversammlung Bemerkungen zu dem beim Handelsregister eingereichten Formwechselplan übermitdem beim Handelsregister eingereichten Formwechselplan übermitteln können.\n\n5. Hinweis an die zuständigen Betriebsräte und Arbeitnehmer der Gesellschaft\nDie Gesellschaft hat keine Arbeitnehmer und verfügt über keinen Betriebsrat oder eine sonstige Arbeitnehmervertretung.\n\n6. Gläubiger der Gesellschaft\nDie Rechte der Gläubiger der formwechselnden Gesellschaft ergeben sich aus §§ 341, 314 UmwG. Danach ist den Gläubigern der formwechselnden Gesellschaft Sicherheit zu leisten, soweit sie nicht Befriedigung verlangen können, wenn die neue Rechtsform nicht dem deutschen Recht unterliegt. Dieses Recht steht den Gläubigern jedoch nur zu, wenn sie binnen drei Monaten nach dem Tag, an dem der Formwechselplan (oder sein Entwurf) bekannt gemacht worden ist, ihre Ansprüche gerichtlich geltend machen. Dieses Recht auf Sicherheitsleistung steht Gläubigern nur im Hinblick auf solche Forderungen zu, die vor der Bekanntmachung des Formwechselplans oder seines Entwurfs entstanden, aber im Zeitpunkt der Bekanntmachung noch nicht fällig geworden sind, und deren Erfüllung durch den Formwechsel gefährdet wird."
    },
    {
      "date": "2024-10-08",
      "id": "89598",
      "original_text": "Registerbekanntmachung nach dem Umwandlungsgesetz\nNordrhein-Westfalen Amtsgericht Iserlohn HRA 5650\nBOSICOM Telekom Exklusiv Partner Shop Inhaber Stavros Bozilidis e. K. – Halver",
      "type": "Registerbekanntmachung nach dem Umwandlungsgesetz",
      "state": "Nordrhein-Westfalen",
      "amtsgericht": "Amtsgericht Iserlohn",
      "registernummer": "HRA 5650",
      "registerart": "HRA",
      "company_name": "BOSICOM Telekom Exklusiv Partner Shop Inhaber Stavros Bozilidis e. K.",
      "company_seat": "Halver",
      "details": "08.10.2024 (Bekanntmachungsdatum)\n\nNordrhein-Westfalen Amtsgericht Iserlohn HRA 5650\nRegisterbekanntmachung nach dem Umwandlungsgesetz 08.10.2024 (Eintragungsdatum)\n\nBOSICOM Telekom Exklusiv Partner Shop Inhaber Stavros Bozilidis e. K.\nEinzelkaufmann / Einzelkauffrau\nHalver\n\nDen Gläubigern der an der Ausgliederung beteiligten Rechtsträger ist, wenn sie binnen sechs Monaten nach dem Tag, an dem die Eintragung der Ausgliederung in das Register des Sitzes desjenigen Rechtsträgers, dessen Gläubiger sie sind, nach § 19 Absatz 3 UmwG als bekanntgemacht gilt, ihren Anspruch nach Grund und Höhe schriftlich anmelden, Sicherheit zu leisten, soweit sie nicht Befriedigung verlangen können. Dieses Recht steht den Gläubigern jedoch nur zu, wenn sie glaubhaft machen, dass durch die Ausgliederung die Erfüllung ihrer Forderung gefährdet wird."
    },
    {
      "date": "2024-10-08",
      "id": "89546",
      "original_text": "Sonstige Registerbekanntmachung\nBerlin Amtsgericht Berlin (Charlottenburg) HRB 181615\nBSAG Bueroservice24 AG – Berlin",
      "type": "Sonstige Registerbekanntmachung",
      "state": "Berlin",
      "amtsgericht": "Amtsgericht Berlin (Charlottenburg)",
      "registernummer": "HRB 181615",
      "registerart": "HRB",
      "company_name": "BSAG Bueroservice24 AG",
      "company_seat": "Berlin",
      "details": "08.10.2024 (Bekanntmachungsdatum)\n\nBerlin Amtsgericht Berlin (Charlottenburg) HRB 181615\nSonstige Registerbekanntmachung\n\nBSAG Bueroservice24 AG\nAktiengesellschaft\nBerlin\n\nAls nicht eingetragen wird veröffentlicht: Es wurde eine neue Liste der Aufsichtsratsmitglieder eingereicht (§ 106 AktG)."
    },
    {
      "date": "2024-10-08",
      "id": "89438",
      "original_text": "Registerbekanntmachung nach dem Umwandlungsgesetz\nBayern Amtsgericht Ingolstadt HRB 9586\nBULLLED GmbH – Ingolstadt",
      "type": "Registerbekanntmachung nach dem Umwandlungsgesetz",
      "state": "Bayern",
      "amtsgericht": "Amtsgericht Ingolstadt",
      "registernummer": "HRB 9586",
      "registerart": "HRB",
      "company_name": "BULLLED GmbH",
      "company_seat": "Ingolstadt",
      "details": "08.10.2024 (Bekanntmachungsdatum)\n\nBayern Amtsgericht Ingolstadt HRB 9586\nRegisterbekanntmachung nach dem Umwandlungsgesetz 07.10.2024 (Eintragungsdatum)\n\nBULLLED GmbH\nGesellschaft mit beschränkter Haftung\nIngolstadt\n\nDen Gläubigern der an der Verschmelzung beteiligten Rechtsträger ist, wenn sie binnen sechs Monaten nach dem Tag, an dem die Eintragung der Verschmelzung in das Register des Sitzes desjenigen Rechtsträgers, dessen Gläubiger sie sind, nach § 19 Abs. 3 UmwG als bekannt gemacht gilt, ihren Anspruch nach Grund und Höhe schriftlich anmelden, Sicherheit zu leisten, soweit sie nicht Befriedigung verlangen können. Dieses Recht steht den Gläubigern jedoch nur zu, wenn sie glaubhaft machen, dass durch die Verschmelzung die Erfüllung ihrer Forderung gefährdet wird."
    },
    {
      "date": "2024-10-08",
      "id": "89497",
      "original_text": "Löschungsankündigung\nBerlin Amtsgericht Berlin (Charlottenburg) HRB 170885\nBerliner 999 Umzüge UG (haftungsbeschränkt) – Berlin",
      "type": "Löschungsankündigung",
      "state": "Berlin",
      "amtsgericht": "Amtsgericht Berlin (Charlottenburg)",
      "registernummer": "HRB 170885",
      "registerart": "HRB",
      "company_name": "Berliner 999 Umzüge UG (haftungsbeschränkt)",
      "company_seat": "Berlin",
      "details": "08.10.2024 (Bekanntmachungsdatum)\n\nBerlin Amtsgericht Berlin (Charlottenburg) HRB 170885\nLöschungsankündigung\n\nBerliner 999 Umzüge UG (haftungsbeschränkt)\nGesellschaft mit beschränkter Haftung\nBerlin\n\nBei der nachstehenden Gesellschaft wird das Amtslöschungsverfahren gemäß § 394 FamFG eingeleitet. Widerspruchsfrist 6 Wochen"
    },
    {
      "date": "2024-10-08",
      "id": "89591",
      "original_text": "Registerbekanntmachung nach dem Umwandlungsgesetz\nNordrhein-Westfalen Amtsgericht Gelsenkirchen HRB 14651\nBleistahl Gelsenkirchen Verwaltungs GmbH – Gelsenkirchen",
      "type": "Registerbekanntmachung nach dem Umwandlungsgesetz",
      "state": "Nordrhein-Westfalen",
      "amtsgericht": "Amtsgericht Gelsenkirchen",
      "registernummer": "HRB 14651",
      "registerart": "HRB",
      "company_name": "Bleistahl Gelsenkirchen Verwaltungs GmbH",
      "company_seat": "Gelsenkirchen",
      "details": "08.10.2024 (Bekanntmachungsdatum)\n\nNordrhein-Westfalen Amtsgericht Gelsenkirchen HRB 14651\nRegisterbekanntmachung nach dem Umwandlungsgesetz 01.10.2024 (Eintragungsdatum)\n\nBleistahl Gelsenkirchen Verwaltungs GmbH\nGesellschaft mit beschränkter Haftung\nGelsenkirchen\n\nDen Gläubigern der an der Verschmelzung beteiligten Rechtsträger ist, wenn sie binnen sechs Monaten nach dem Tag, an dem die Eintragung der Verschmelzung in das Register des Sitzes desjenigen Rechtsträgers, dessen Gläubiger sie sind, nach § 19 Absatz 3 UmwG als bekanntgemacht gilt, ihren Anspruch nach Grund und Höhe schriftlich anmelden, Sicherheit zu leisten, soweit sie nicht Befriedigung verlangen können. Dieses Recht steht den Gläubigern jedoch nur zu, wenn sie glaubhaft machen, dass durch die Verschmelzung die Erfüllung ihrer Forderung gefährdet wird."
    },
    {
      "date": "2024-10-08",
      "id": "89545",
      "original_text": "Löschungsankündigung\nBrandenburg Amtsgericht Neuruppin HRB 14277\nBlue Window UG (haftungsbeschränkt) – Oranienburg",
      "type": "Löschungsankündigung",
      "state": "Brandenburg",
      "amtsgericht": "Amtsgericht Neuruppin",
      "registernummer": "HRB 14277",
      "registerart": "HRB",
      "company_name": "Blue Window UG (haftungsbeschränkt)",
      "company_seat": "Oranienburg",
      "details": "08.10.2024 (Bekanntmachungsdatum)\n\nBrandenburg Amtsgericht Neuruppin HRB 14277\nLöschungsankündigung\n\nBlue Window UG (haftungsbeschränkt)\nGesellschaft mit beschränkter Haftung\nOranienburg\n\nBei der nachstehenden Gesellschaft wird das Amtslöschungsverfahren gemäß § 394 FamFG eingeleitet.\nWiderspruchsfrist: 1 Monat"
    },
    {
      "date": "2024-10-08",
      "id": "89600",
      "original_text": "Sonstige Registerbekanntmachung\nNordrhein-Westfalen Amtsgericht Köln HRB 87400\nBolis Pharma sp. z o.o., Zweigniederlassung Deutschland – Leverkusen",
      "type": "Sonstige Registerbekanntmachung",
      "state": "Nordrhein-Westfalen",
      "amtsgericht": "Amtsgericht Köln",
      "registernummer": "HRB 87400",
      "registerart": "HRB",
      "company_name": "Bolis Pharma sp. z o.o., Zweigniederlassung Deutschland",
      "company_seat": "Leverkusen",
      "details": "08.10.2024 (Bekanntmachungsdatum)\n\nNordrhein-Westfalen Amtsgericht Köln HRB 87400\nSonstige Registerbekanntmachung\n\nBolis Pharma sp. z o.o., Zweigniederlassung Deutschland\nRechtsform ausländischen Rechts HRB\nLeverkusen\n\nDas Registergericht beabsichtigt die Zweigniederlassung von Amts wegen nach § 395 FamFG zu löschen. Die Frist zur Erhebung eines Widerspruchs ist auf einen Monat festgesetzt."
    },
    {
      "date": "2024-10-08",
      "id": "89541",
      "original_text": "Löschungsankündigung\nBerlin Amtsgericht Berlin (Charlottenburg) HRB 93135\nBrands United GmbH – Berlin",
      "type": "Löschungsankündigung",
      "state": "Berlin",
      "amtsgericht": "Amtsgericht Berlin (Charlottenburg)",
      "registernummer": "HRB 93135",
      "registerart": "HRB",
      "company_name": "Brands United GmbH",
      "company_seat": "Berlin",
      "details": "08.10.2024 (Bekanntmachungsdatum)\n\nBerlin Amtsgericht Berlin (Charlottenburg) HRB 93135\nLöschungsankündigung\n\nBrands United GmbH\nGesellschaft mit beschränkter Haftung\nBerlin\n\nBei der nachstehenden Gesellschaft wird das Amtslöschungsverfahren gemäß § 394 FamFG eingeleitet. Widerspruchsfrist 6 Wochen"
    },
    {
      "date": "2024-10-08",
      "id": "89426",
      "original_text": "Registerbekanntmachung nach dem Umwandlungsgesetz\nBayern Amtsgericht München HRB 164088\nBucher Properties GmbH – München",
      "type": "Registerbekanntmachung nach dem Umwandlungsgesetz",
      "state": "Bayern",
      "amtsgericht": "Amtsgericht München",
      "registernummer": "HRB 164088",
      "registerart": "HRB",
      "company_name": "Bucher Properties GmbH",
      "company_seat": "München",
      "details": "08.10.2024 (Bekanntmachungsdatum)\n\nBayern Amtsgericht München HRB 164088\nRegisterbekanntmachung nach dem Umwandlungsgesetz 07.10.2024 (Eintragungsdatum)\n\nBucher Properties GmbH\nGesellschaft mit beschränkter Haftung\nMünchen\n\nDen Gläubigern der an der Verschmelzung beteiligten Rechtsträger ist, wenn sie binnen sechs Monaten nach dem Tag, an dem die Eintragung der Verschmelzung in das Register des Sitzes desjenigen Rechtsträgers, dessen Gläubiger sie sind, nach § 19 Abs. 3 UmwG als bekannt gemacht gilt, ihren Anspruch nach Grund und Höhe schriftlich anmelden, Sicherheit zu leisten, soweit sie nicht Befriedigung verlangen können. Dieses Recht steht den Gläubigern jedoch nur zu, wenn sie glaubhaft machen, dass durch die Verschmelzung die Erfüllung ihrer Forderung gefährdet wird."
    },
    {
      "date": "2024-10-08",
      "id": "89555",
      "original_text": "Einreichung neuer Dokumente\nSachsen Amtsgericht Chemnitz HRB 26776\nBürgerheim Meerane gGmbH – Meerane",
      "type": "Einreichung neuer Dokumente",
      "state": "Sachsen",
      "amtsgericht": "Amtsgericht Chemnitz",
      "registernummer": "HRB 26776",
      "registerart": "HRB",
      "company_name": "Bürgerheim Meerane gGmbH",
      "company_seat": "Meerane",
      "details": "08.10.2024 (Bekanntmachungsdatum)\n\nSachsen Amtsgericht Chemnitz HRB 26776\nEinreichung neuer Dokumente\n\nBürgerheim Meerane gGmbH\nGesellschaft mit beschränkter Haftung\nMeerane\n\nAm 07.10.2024 wurde beim Handelsregister des Amtsgerichts Chemnitz die Liste der Mitglieder des Aufsichtsrats gemäß § 52 GmbHG eingereicht."
    },
    {
      "date": "2024-10-08",
      "id": "89446",
      "original_text": "Registerbekanntmachung nach dem Umwandlungsgesetz\nBayern Amtsgericht München HRB 153945\nCAMPUS Institut für Personalentwicklung und Finanzwirtschaft AG – Oberhaching",
      "type": "Registerbekanntmachung nach dem Umwandlungsgesetz",
      "state": "Bayern",
      "amtsgericht": "Amtsgericht München",
      "registernummer": "HRB 153945",
      "registerart": "HRB",
      "company_name": "CAMPUS Institut für Personalentwicklung und Finanzwirtschaft AG",
      "company_seat": "Oberhaching",
      "details": "08.10.2024 (Bekanntmachungsdatum)\n\nBayern Amtsgericht München HRB 153945\nRegisterbekanntmachung nach dem Umwandlungsgesetz 07.10.2024 (Eintragungsdatum)\n\nCAMPUS Institut für Personalentwicklung und Finanzwirtschaft AG\nAktiengesellschaft\nOberhaching\n\nDen Gläubigern des formwechselnden Rechtsträgers ist, wenn sie binnen sechs Monaten nach dem Tag, an dem die Eintragung des Formwechsels nach § 201 UmwG als bekannt gemacht gilt, ihren Anspruch nach Grund und Höhe schriftlich anmelden, Sicherheit zu leisten, soweit sie nicht Befriedigung verlangen können. Dieses Recht steht den Gläubigern jedoch nur zu, wenn sie glaubhaft machen, dass durch den Formwechsel die Erfüllung ihrer Forderung gefährdet wird."
    },
    {
      "date": "2024-10-08",
      "id": "89428",
      "original_text": "Löschungsankündigung\nBayern Amtsgericht Nürnberg HRB 26993\nCENTACON Lebenswelten GmbH – Nürnberg",
      "type": "Löschungsankündigung",
      "state": "Bayern",
      "amtsgericht": "Amtsgericht Nürnberg",
      "registernummer": "HRB 26993",
      "registerart": "HRB",
      "company_name": "CENTACON Lebenswelten GmbH",
      "company_seat": "Nürnberg",
      "details": "08.10.2024 (Bekanntmachungsdatum)\n\nBayern Amtsgericht Nürnberg HRB 26993\nLöschungsankündigung\n\nCENTACON Lebenswelten GmbH\nGesellschaft mit beschränkter Haftung\nNürnberg\n\nDas Registergericht beabsichtigt, die im Handelsregister eingetragene Gesellschaft wegen Vermögenslosigkeit von Amts wegen nach § 394 FamFG zu löschen. Die Frist zur Erhebung eines Widerspruchs ist auf einen Monat festgesetzt."
    },
    {
      "date": "2024-10-08",
      "id": "89548",
      "original_text": "Registerbekanntmachung nach dem Umwandlungsgesetz\nBrandenburg Amtsgericht Neuruppin HRB 14601\nCRF-Beteiligungs-GmbH – Liebenwalde OT Kreuzbruch",
      "type": "Registerbekanntmachung nach dem Umwandlungsgesetz",
      "state": "Brandenburg",
      "amtsgericht": "Amtsgericht Neuruppin",
      "registernummer": "HRB 14601",
      "registerart": "HRB",
      "company_name": "CRF-Beteiligungs-GmbH",
      "company_seat": "Liebenwalde OT Kreuzbruch",
      "details": "08.10.2024 (Bekanntmachungsdatum)\n\nBrandenburg Amtsgericht Neuruppin HRB 14601\nRegisterbekanntmachung nach dem Umwandlungsgesetz 02.10.2024 (Eintragungsdatum)\n\nCRF-Beteiligungs-GmbH\nGesellschaft mit beschränkter Haftung\nLiebenwalde OT Kreuzbruch\n\nZu Eintragungsnummer 4 vom 02.10.2024 wird als nicht eingetragen veröffentlicht:\nDen Gläubigern der an der Umwandlung beteiligten Rechtsträger ist, wenn sie binnen sechs Monaten nach dem Tag, an dem die Eintragung der Umwandlung in das Register des Sitzes desjenigen Rechtsträgers, dessen Gläubiger sie sind, als bekannt gemacht gilt, ihren Anspruch nach Grund und Höhe schriftlich anmelden, Sicherheit zu leisten, soweit sie nicht Befriedigung verlangen können. Dieses Recht steht den Gläubigern jedoch nur zu, wenn sie glaubhaft machen, dass durch die Umwandlung die Erfüllung ihrer Forderung gefährdet wird"
    },
    {
      "date": "2024-10-08",
      "id": "89567",
      "original_text": "Löschungsankündigung\nRheinland-Pfalz Amtsgericht Zweibrücken HRB 32180\nCar TechV10 Chiptuning und Autoglas GmbH – Pirmasens",
      "type": "Löschungsankündigung",
      "state": "Rheinland-Pfalz",
      "amtsgericht": "Amtsgericht Zweibrücken",
      "registernummer": "HRB 32180",
      "registerart": "HRB",
      "company_name": "Car TechV10 Chiptuning und Autoglas GmbH",
      "company_seat": "Pirmasens",
      "details": "08.10.2024 (Bekanntmachungsdatum)\n\nRheinland-Pfalz Amtsgericht Zweibrücken HRB 32180\nLöschungsankündigung\n\nCar TechV10 Chiptuning und Autoglas GmbH\nGesellschaft mit beschränkter Haftung\nPirmasens\n\nDas Registergericht beabsichtigt die Gesellschaft von Amts wegen nach § 394 FamFG zu löschen. Die Frist zur Erhebung eines Widerspruchs ist auf einen Monat festgesetzt."
    },
    {
      "date": "2024-10-08",
      "id": "89625",
      "original_text": "Registerbekanntmachung nach dem Umwandlungsgesetz\nHessen Amtsgericht Frankfurt am Main VR 10863\nCaritasverband Main-Taunus e.V. – Hofheim am Taunus",
      "type": "Registerbekanntmachung nach dem Umwandlungsgesetz",
      "state": "Hessen",
      "amtsgericht": "Amtsgericht Frankfurt am Main",
      "registernummer": "VR 10863",
      "registerart": "VR",
      "company_name": "Caritasverband Main-Taunus e.V.",
      "company_seat": "Hofheim am Taunus",
      "details": "08.10.2024 (Bekanntmachungsdatum)\n\nHessen Amtsgericht Frankfurt am Main VR 10863\nRegisterbekanntmachung nach dem Umwandlungsgesetz 08.10.2024 (Eintragungsdatum)\n\nCaritasverband Main-Taunus e.V.\neingetragener Verein\nHofheim am Taunus\n\nDen Gläubigern der an der Verschmelzung beteiligten Rechtsträger ist, wenn sie binnen sechs Monaten nach dem Tag, an dem die Eintragung der Verschmelzung in das Register des Sitzes desjenigen Rechtsträgers, dessen Gläubiger sie sind, nach § 19 Absatz 3 UmwG bekannt gemacht worden ist, ihren Anspruch nach Grund und Höhe schriftlich anmelden, Sicherheit zu leisten, soweit sie nicht Befriedigung verlangen können. Dieses Recht steht den Gläubigern jedoch nur zu, wenn sie glaubhaft machen, dass durch die Verschmelzung die Erfüllung ihrer Forderung gefährdet wird."
    },
    {
      "date": "2024-10-08",
      "id": "89530",
      "original_text": "Registerbekanntmachung nach dem Umwandlungsgesetz\nBaden-Württemberg Amtsgericht Ulm HRA 729270\nChristine Wilhelm e.K. – Achstetten",
      "type": "Registerbekanntmachung nach dem Umwandlungsgesetz",
      "state": "Baden-Württemberg",
      "amtsgericht": "Amtsgericht Ulm",
      "registernummer": "HRA 729270",
      "registerart": "HRA",
      "company_name": "Christine Wilhelm e.K.",
      "company_seat": "Achstetten",
      "details": "08.10.2024 (Bekanntmachungsdatum)\n\nBaden-Württemberg Amtsgericht Ulm HRA 729270\nRegisterbekanntmachung nach dem Umwandlungsgesetz 08.10.2024 (Eintragungsdatum)\n\nChristine Wilhelm e.K.\nEinzelkaufmann / Einzelkauffrau\nAchstetten\n\nDen Gläubigern der an der Ausgliederung beteiligten Rechtsträger ist, wenn sie binnen sechs Monaten nach dem Tag, an dem die Eintragung der Ausgliederung in das Register des Sitzes desjenigen Rechtsträgers, dessen Gläubiger sie sind, nach § 19 Abs. 3 UmwG als bekanntgemacht gilt, ihren Anspruch nach Grund und Höhe schriftlich anmelden, Sicherheit zu leisten, soweit sie nicht Befriedigung verlangen können. Dieses Recht steht den Gläubigern jedoch nur zu, wenn sie glaubhaft machen, dass durch die Ausgliederung die Erfüllung ihrer Forderung gefährdet wird."
    },
    {
      "date": "2024-10-08",
      "id": "89520",
      "original_text": "Registerbekanntmachung nach dem Umwandlungsgesetz\nSchleswig-Holstein Amtsgericht Kiel HRB 5699\nCorrente AG – Kiel",
      "type": "Registerbekanntmachung nach dem Umwandlungsgesetz",
      "state": "Schleswig-Holstein",
      "amtsgericht": "Amtsgericht Kiel",
      "registernummer": "HRB 5699",
      "registerart": "HRB",
      "company_name": "Corrente AG",
      "company_seat": "Kiel",
      "details": "08.10.2024 (Bekanntmachungsdatum)\n\nSchleswig-Holstein Amtsgericht Kiel HRB 5699\nRegisterbekanntmachung nach dem Umwandlungsgesetz 08.10.2024 (Eintragungsdatum)\n\nCorrente AG\nAktiengesellschaft\nKiel\n\nZu Eintragungsnummer 13 vom 08.10.2024 wird als nicht eingetragen veröffentlicht: Den Gläubigern ist, wenn sie binnen sechs Monaten nach dem Tag, an dem die Eintragung der Umwandlung bekannt gemacht worden ist, ihren Anspruch nach Grund und Höhe schriftlich anmelden, Sicherheit zu leisten, soweit sie nicht Befriedigung verlangen können. Dieses Recht steht den Gläubigern jedoch nur zu, wenn sie glaubhaft machen, dass durch die Umwandlung die Erfüllung ihrer Forderung gefährdet wird."
    },
    {
      "date": "2024-10-08",
      "id": "89605",
      "original_text": "Registerbekanntmachung nach dem Umwandlungsgesetz\nNordrhein-Westfalen Amtsgericht Bonn HRB 12146\nCrefo-Factoring Rheinland GmbH – Bonn",
      "type": "Registerbekanntmachung nach dem Umwandlungsgesetz",
      "state": "Nordrhein-Westfalen",
      "amtsgericht": "Amtsgericht Bonn",
      "registernummer": "HRB 12146",
      "registerart": "HRB",
      "company_name": "Crefo-Factoring Rheinland GmbH",
      "company_seat": "Bonn",
      "details": "08.10.2024 (Bekanntmachungsdatum)\n\nNordrhein-Westfalen Amtsgericht Bonn HRB 12146\nRegisterbekanntmachung nach dem Umwandlungsgesetz 08.10.2024 (Eintragungsdatum)\n\nCrefo-Factoring Rheinland GmbH\nGesellschaft mit beschränkter Haftung\nBonn\n\nDen Gläubigern der an der Verschmelzung beteiligten Rechtsträger ist, wenn sie binnen sechs Monaten nach dem Tag, an dem die Eintragung der Verschmelzung in das Register des Sitzes desjenigen Rechtsträgers, dessen Gläubiger sie sind, nach § 19 Absatz 3 UmwG als bekanntgemacht gilt, ihren Anspruch nach Grund und Höhe schriftlich anmelden, Sicherheit zu leisten, soweit sie nicht Befriedigung verlangen können. Dieses Recht steht den Gläubigern jedoch nur zu, wenn sie glaubhaft machen, dass durch die Verschmelzung die Erfüllung ihrer Forderung gefährdet wird."
    },
    {
      "date": "2024-10-08",
      "id": "89597",
      "original_text": "Sonstige Registerbekanntmachung\nNordrhein-Westfalen Amtsgericht Köln HRB 36041\nDEVK Pensionsfonds Aktiengesellschaft – Köln",
      "type": "Sonstige Registerbekanntmachung",
      "state": "Nordrhein-Westfalen",
      "amtsgericht": "Amtsgericht Köln",
      "registernummer": "HRB 36041",
      "registerart": "HRB",
      "company_name": "DEVK Pensionsfonds Aktiengesellschaft",
      "company_seat": "Köln",
      "details": "08.10.2024 (Bekanntmachungsdatum)\n\nNordrhein-Westfalen Amtsgericht Köln HRB 36041\nSonstige Registerbekanntmachung\n\nDEVK Pensionsfonds Aktiengesellschaft\nAktiengesellschaft\nKöln\n\nDem Registergericht ist eine Liste der Mitglieder des Aufsichtsrates eingereicht worden."
    },
    {
      "date": "2024-10-08",
      "id": "89514",
      "original_text": "Einreichung neuer Dokumente\nBaden-Württemberg Amtsgericht Stuttgart HRB 17316\nDaimler Buses GmbH – Stuttgart",
      "type": "Einreichung neuer Dokumente",
      "state": "Baden-Württemberg",
      "amtsgericht": "Amtsgericht Stuttgart",
      "registernummer": "HRB 17316",
      "registerart": "HRB",
      "company_name": "Daimler Buses GmbH",
      "company_seat": "Stuttgart",
      "details": "08.10.2024 (Bekanntmachungsdatum)\n\nBaden-Württemberg Amtsgericht Stuttgart HRB 17316\nEinreichung neuer Dokumente\n\nDaimler Buses GmbH\nGesellschaft mit beschränkter Haftung\nStuttgart\n\nDie Gesellschaft hat am 07.10.2024 die Liste über die Zusammensetzung des Aufsichtsrats zum Handelsregister eingereicht."
    },
    {
      "date": "2024-10-08",
      "id": "89506",
      "original_text": "Löschungsankündigung\nSchleswig-Holstein Amtsgericht Lübeck HRB 21459\nDasDach.com GmbH – Reinbek",
      "type": "Löschungsankündigung",
      "state": "Schleswig-Holstein",
      "amtsgericht": "Amtsgericht Lübeck",
      "registernummer": "HRB 21459",
      "registerart": "HRB",
      "company_name": "DasDach.com GmbH",
      "company_seat": "Reinbek",
      "details": "08.10.2024 (Bekanntmachungsdatum)\n\nSchleswig-Holstein Amtsgericht Lübeck HRB 21459\nLöschungsankündigung\n\nDasDach.com GmbH\nGesellschaft mit beschränkter Haftung\nReinbek\n\nEs ist die Löschung der nachstehenden Gesellschaft wegen Vermögenslosigkeit gemäß § 394 FamFG beabsichtigt."
    },
    {
      "date": "2024-10-08",
      "id": "89508",
      "original_text": "Sonstige Registerbekanntmachung\nSchleswig-Holstein Amtsgericht Lübeck HRB 21459\nDasDach.com GmbH – Reinbek",
      "type": "Sonstige Registerbekanntmachung",
      "state": "Schleswig-Holstein",
      "amtsgericht": "Amtsgericht Lübeck",
      "registernummer": "HRB 21459",
      "registerart": "HRB",
      "company_name": "DasDach.com GmbH",
      "company_seat": "Reinbek",
      "details": "08.10.2024 (Bekanntmachungsdatum)\n\nSchleswig-Holstein Amtsgericht Lübeck HRB 21459\nSonstige Registerbekanntmachung\n\nDasDach.com GmbH\nGesellschaft mit beschränkter Haftung\nReinbek\n\nAls nicht eingetragen wird folgendes Schreiben an die Geschäftsführerin Nele Scharphuis, zuletzt wohnhaft Heckenweg 5, 21465 Reinbek (aktuell wohnhaft in der Schweiz, Adresse unbekannt) veröffentlicht:\n\nSehr geehrte Frau Scharphuis,\nin der Handelsregistersache DasDach.com GmbH\nergeben sich aus den mir vorliegenden Unterlagen Anhaltspunkte dafür, dass die Gesellschaft, als deren Geschäftsführerin Sie noch eingetragen sind, vermögenslos ist:\n\nSchreiben des Finanzamts Stormarn vom 26.09.2024\n\nIch beabsichtige daher, die Gesellschaft wegen Vermögenslosigkeit gemäß § 394 FamFG zu löschen.\nIch bestimme eine Frist von einem Monat zur Geltendmachung eines Widerspruchs gegen die Löschung, § 394 Abs. 2 S. 1 FamFG.\nWeiter bitte ich Sie, mir binnen derselben Frist mitzuteilen, ob die genannte Gesellschaft noch Vermögen hat, ggf. welche Vermögensgegenstände sie besitzt, ob die Gesellschaft noch Partei eines noch nicht rechtskräftig abgeschlossenen Rechtsstreits ist oder ob sonst noch eine Abwicklung stattfindet.\nNach Fristablauf ohne Widerspruch von Ihnen oder anderer Seite wird die Gesellschaft gelöscht.\n\nMit freundlichen Grüßen\nAmtsgericht Lübeck, Abt. 6"
    },
    {
      "date": "2024-10-08",
      "id": "89603",
      "original_text": "Registerbekanntmachung nach dem Umwandlungsgesetz\nNordrhein-Westfalen Amtsgericht Iserlohn HRA 5693\nDominik Degenhardt e. K. – Neuenrade",
      "type": "Registerbekanntmachung nach dem Umwandlungsgesetz",
      "state": "Nordrhein-Westfalen",
      "amtsgericht": "Amtsgericht Iserlohn",
      "registernummer": "HRA 5693",
      "registerart": "HRA",
      "company_name": "Dominik Degenhardt e. K.",
      "company_seat": "Neuenrade",
      "details": "08.10.2024 (Bekanntmachungsdatum)\n\nNordrhein-Westfalen Amtsgericht Iserlohn HRA 5693\nRegisterbekanntmachung nach dem Umwandlungsgesetz 08.10.2024 (Eintragungsdatum)\n\nDominik Degenhardt e. K.\nEinzelkaufmann / Einzelkauffrau\nNeuenrade\n\nDen Gläubigern der an der Ausgliederung beteiligten Rechtsträger ist, wenn sie binnen sechs Monaten nach dem Tag, an dem die Eintragung der Ausgliederung in das Register des Sitzes desjenigen Rechtsträgers, dessen Gläubiger sie sind, nach § 19 Absatz 3 UmwG als bekanntgemacht gilt, ihren Anspruch nach Grund und Höhe schriftlich anmelden, Sicherheit zu leisten, soweit sie nicht Befriedigung verlangen können. Dieses Recht steht den Gläubigern jedoch nur zu, wenn sie glaubhaft machen, dass durch die Ausgliederung die Erfüllung ihrer Forderung gefährdet wird."
    },
    {
      "date": "2024-10-08",
      "id": "89431",
      "original_text": "Löschungsankündigung\nBayern Amtsgericht Nürnberg HRB 15969\nENTRAK Energie- und Antriebstechnik Verwaltungs- GmbH – Wendelstein",
      "type": "Löschungsankündigung",
      "state": "Bayern",
      "amtsgericht": "Amtsgericht Nürnberg",
      "registernummer": "HRB 15969",
      "registerart": "HRB",
      "company_name": "ENTRAK Energie- und Antriebstechnik Verwaltungs- GmbH",
      "company_seat": "Wendelstein",
      "details": "08.10.2024 (Bekanntmachungsdatum)\n\nBayern Amtsgericht Nürnberg HRB 15969\nLöschungsankündigung\n\nENTRAK Energie- und Antriebstechnik Verwaltungs- GmbH\nGesellschaft mit beschränkter Haftung\nWendelstein\n\nDas Registergericht beabsichtigt, die im Handelsregister eingetragene Gesellschaft wegen Vermögenslosigkeit von Amts wegen nach § 394 FamFG zu löschen. Die Frist zur Erhebung eines Widerspruchs ist auf einen Monat festgesetzt."
    },
    {
      "date": "2024-10-08",
      "id": "89447",
      "original_text": "Registerbekanntmachung nach dem Umwandlungsgesetz\nBayern Amtsgericht Fürth HRB 9176\nET Treuhand GmbH – Erlangen",
      "type": "Registerbekanntmachung nach dem Umwandlungsgesetz",
      "state": "Bayern",
      "amtsgericht": "Amtsgericht Fürth",
      "registernummer": "HRB 9176",
      "registerart": "HRB",
      "company_name": "ET Treuhand GmbH",
      "company_seat": "Erlangen",
      "details": "08.10.2024 (Bekanntmachungsdatum)\n\nBayern Amtsgericht Fürth HRB 9176\nRegisterbekanntmachung nach dem Umwandlungsgesetz 07.10.2024 (Eintragungsdatum)\n\nET Treuhand GmbH\nGesellschaft mit beschränkter Haftung\nErlangen\n\nDen Gläubigern der an der Verschmelzung beteiligten Rechtsträger ist, wenn sie binnen sechs Monaten nach dem Tag, an dem die Eintragung der Verschmelzung in das Register des Sitzes desjenigen Rechtsträgers, dessen Gläubiger sie sind, nach § 19 Abs. 3 UmwG als bekannt gemacht gilt, ihren Anspruch nach Grund und Höhe schriftlich anmelden, Sicherheit zu leisten, soweit sie nicht Befriedigung verlangen können. Dieses Recht steht den Gläubigern jedoch nur zu, wenn sie glaubhaft machen, dass durch die Verschmelzung die Erfüllung ihrer Forderung gefährdet wird."
    },
    {
      "date": "2024-10-08",
      "id": "89464",
      "original_text": "Registerbekanntmachung nach dem Umwandlungsgesetz\nBayern Amtsgericht Fürth HRB 6940\nET Unternehmensberatung GmbH – Erlangen",
      "type": "Registerbekanntmachung nach dem Umwandlungsgesetz",
      "state": "Bayern",
      "amtsgericht": "Amtsgericht Fürth",
      "registernummer": "HRB 6940",
      "registerart": "HRB",
      "company_name": "ET Unternehmensberatung GmbH",
      "company_seat": "Erlangen",
      "details": "08.10.2024 (Bekanntmachungsdatum)\n\nBayern Amtsgericht Fürth HRB 6940\nRegisterbekanntmachung nach dem Umwandlungsgesetz 07.10.2024 (Eintragungsdatum)\n\nET Unternehmensberatung GmbH\nGesellschaft mit beschränkter Haftung\nErlangen\n\nDen Gläubigern der an der Verschmelzung beteiligten Rechtsträger ist, wenn sie binnen sechs Monaten nach dem Tag, an dem die Eintragung der Verschmelzung in das Register des Sitzes desjenigen Rechtsträgers, dessen Gläubiger sie sind, nach § 19 Abs. 3 UmwG als bekannt gemacht gilt, ihren Anspruch nach Grund und Höhe schriftlich anmelden, Sicherheit zu leisten, soweit sie nicht Befriedigung verlangen können. Dieses Recht steht den Gläubigern jedoch nur zu, wenn sie glaubhaft machen, dass durch die Verschmelzung die Erfüllung ihrer Forderung gefährdet wird."
    },
    {
      "date": "2024-10-08",
      "id": "89540",
      "original_text": "Einreichung neuer Dokumente\nBaden-Württemberg Amtsgericht Mannheim HRB 360131\nETTLIN AKTIENGESELLSCHAFT – Ettlingen",
      "type": "Einreichung neuer Dokumente",
      "state": "Baden-Württemberg",
      "amtsgericht": "Amtsgericht Mannheim",
      "registernummer": "HRB 360131",
      "registerart": "HRB",
      "company_name": "ETTLIN AKTIENGESELLSCHAFT",
      "company_seat": "Ettlingen",
      "details": "08.10.2024 (Bekanntmachungsdatum)\n\nBaden-Württemberg Amtsgericht Mannheim HRB 360131\nEinreichung neuer Dokumente\n\nETTLIN AKTIENGESELLSCHAFT\nAktiengesellschaft\nEttlingen\n\nDie Gesellschaft hat am 27.09.2024 die Liste über die Zusammensetzung des Aufsichtsrats zum Handelsregister eingereicht."
    },
    {
      "date": "2024-10-08",
      "id": "89594",
      "original_text": "Registerbekanntmachung nach dem Umwandlungsgesetz\nNordrhein-Westfalen Amtsgericht Bochum HRB 21704\nElmers Gesellschaft mbH – Herne",
      "type": "Registerbekanntmachung nach dem Umwandlungsgesetz",
      "state": "Nordrhein-Westfalen",
      "amtsgericht": "Amtsgericht Bochum",
      "registernummer": "HRB 21704",
      "registerart": "HRB",
      "company_name": "Elmers Gesellschaft mbH",
      "company_seat": "Herne",
      "details": "08.10.2024 (Bekanntmachungsdatum)\n\nNordrhein-Westfalen Amtsgericht Bochum HRB 21704\nRegisterbekanntmachung nach dem Umwandlungsgesetz 04.10.2024 (Eintragungsdatum)\n\nElmers Gesellschaft mbH\nGesellschaft mit beschränkter Haftung\nHerne\n\nDen Gläubigern der an der Ausgliederung beteiligten Rechtsträger ist, wenn sie binnen sechs Monaten nach dem Tag, an dem die Eintragung der Ausgliederung in das Register des Sitzes desjenigen Rechtsträgers, dessen Gläubiger sie sind, nach § 19 Absatz 3 UmwG als bekanntgemacht gilt, ihren Anspruch nach Grund und Höhe schriftlich anmelden, Sicherheit zu leisten, soweit sie nicht Befriedigung verlangen können. Dieses Recht steht den Gläubigern jedoch nur zu, wenn sie glaubhaft machen, dass durch die Ausgliederung die Erfüllung ihrer Forderung gefährdet wird."
    },
    {
      "date": "2024-10-08",
      "id": "89468",
      "original_text": "Löschungsankündigung\nBaden-Württemberg Amtsgericht Mannheim HRB 708275\nElvicom GmbH – Leimen",
      "type": "Löschungsankündigung",
      "state": "Baden-Württemberg",
      "amtsgericht": "Amtsgericht Mannheim",
      "registernummer": "HRB 708275",
      "registerart": "HRB",
      "company_name": "Elvicom GmbH",
      "company_seat": "Leimen",
      "details": "08.10.2024 (Bekanntmachungsdatum)\n\nBaden-Württemberg Amtsgericht Mannheim HRB 708275\nLöschungsankündigung\n\nElvicom GmbH\nGesellschaft mit beschränkter Haftung\nLeimen\n\nDas Gericht beabsichtigt, die Gesellschaft wegen Vermögenslosigkeit im Handelsregister von Amts wegen nach § 394 FamFG zu löschen. Die Frist zur Geltendmachung eines Widerspruchs gegen die beabsichtigte Löschung ist auf einen Monat ab Veröffentlichung bestimmt."
    },
    {
      "date": "2024-10-08",
      "id": "89515",
      "original_text": "Registerbekanntmachung nach dem Umwandlungsgesetz\nHamburg Amtsgericht Hamburg PR 1133\nEvers & Partner Stadtplaner PartGmbB – Hamburg",
      "type": "Registerbekanntmachung nach dem Umwandlungsgesetz",
      "state": "Hamburg",
      "amtsgericht": "Amtsgericht Hamburg",
      "registernummer": "PR 1133",
      "registerart": "PR",
      "company_name": "Evers & Partner Stadtplaner PartGmbB",
      "company_seat": "Hamburg",
      "details": "08.10.2024 (Bekanntmachungsdatum)\n\nHamburg Amtsgericht Hamburg PR 1133\nRegisterbekanntmachung nach dem Umwandlungsgesetz 08.10.2024 (Eintragungsdatum)\n\nEvers & Partner Stadtplaner PartGmbB\nPartnerschaft\nHamburg\n\nAls nicht eingetragen wird bekannt gemacht:\nDen Gläubigern der an der formwechselnden Umwandlung beteiligten Gesellschaften ist, wenn sie binnen sechs Monaten nach dem Tag, an dem die Eintragung der formwechselnden Umwandlung in das Register des Sitzes desjenigen Rechtsträgers, dessen Gläubiger sie sind, nach § 19 Absatz 3 UmwG als bekannt gemacht gilt, ihren Anspruch nach Grund und Höhe schriftlich anmelden, Sicherheit zu leisten, soweit sie nicht Befriedigung verlangen können. Dieses Recht steht den Gläubigern jedoch nur zu, wenn sie glaubhaft machen, dass durch die formwechselnde Umwandlung die Erfüllung ihrer Forderung gefährdet wird."
    },
    {
      "date": "2024-10-08",
      "id": "89451",
      "original_text": "Sonstige Registerbekanntmachung\nBayern Amtsgericht München HRB 221358\nFTI Services Holding GmbH – München",
      "type": "Sonstige Registerbekanntmachung",
      "state": "Bayern",
      "amtsgericht": "Amtsgericht München",
      "registernummer": "HRB 221358",
      "registerart": "HRB",
      "company_name": "FTI Services Holding GmbH",
      "company_seat": "München",
      "details": "08.10.2024 (Bekanntmachungsdatum)\n\nBayern Amtsgericht München HRB 221358\nSonstige Registerbekanntmachung 07.10.2024 (Eintragungsdatum)\n\nFTI Services Holding GmbH\nGesellschaft mit beschränkter Haftung\nMünchen\n\nDen Gläubigern der Gesellschaft, deren Forderungen begründet worden sind, bevor die Eintragung der Beendigung des Beherrschungs- und Gewinnabführungsvertrages in das Handelsregister nach § 10 des Handelsgesetzbuches als bekanntgemacht gilt, hat der andere Vertragsteil Sicherheit zu leisten, wenn sie sich binnen sechs Monaten nach der Bekanntmachung der Eintragung zu diesem Zweck bei ihm melden."
    },
    {
      "date": "2024-10-08",
      "id": "89449",
      "original_text": "Sonstige Registerbekanntmachung\nBayern Amtsgericht München HRB 116055\nFTI Ticketshop GmbH – München",
      "type": "Sonstige Registerbekanntmachung",
      "state": "Bayern",
      "amtsgericht": "Amtsgericht München",
      "registernummer": "HRB 116055",
      "registerart": "HRB",
      "company_name": "FTI Ticketshop GmbH",
      "company_seat": "München",
      "details": "08.10.2024 (Bekanntmachungsdatum)\n\nBayern Amtsgericht München HRB 116055\nSonstige Registerbekanntmachung 07.10.2024 (Eintragungsdatum)\n\nFTI Ticketshop GmbH\nGesellschaft mit beschränkter Haftung\nMünchen\n\nDen Gläubigern der Gesellschaft, deren Forderungen begründet worden sind, bevor die Eintragung der Beendigung des Beherrschungs- und Gewinnabführungsvertrages in das Handelsregister nach § 10 des Handelsgesetzbuches als bekanntgemacht gilt, hat der andere Vertragsteil Sicherheit zu leisten, wenn sie sich binnen sechs Monaten nach der Bekanntmachung der Eintragung zu diesem Zweck bei ihm melden."
    },
    {
      "date": "2024-10-08",
      "id": "89499",
      "original_text": "Registerbekanntmachung nach dem Umwandlungsgesetz\nBaden-Württemberg Amtsgericht Ulm HRB 748689\nFabian Fliesenleger GmbH – Wangen im Allgäu",
      "type": "Registerbekanntmachung nach dem Umwandlungsgesetz",
      "state": "Baden-Württemberg",
      "amtsgericht": "Amtsgericht Ulm",
      "registernummer": "HRB 748689",
      "registerart": "HRB",
      "company_name": "Fabian Fliesenleger GmbH",
      "company_seat": "Wangen im Allgäu",
      "details": "08.10.2024 (Bekanntmachungsdatum)\n\nBaden-Württemberg Amtsgericht Ulm HRB 748689\nRegisterbekanntmachung nach dem Umwandlungsgesetz 08.10.2024 (Eintragungsdatum)\n\nFabian Fliesenleger GmbH\nGesellschaft mit beschränkter Haftung\nWangen im Allgäu\n\nAls nicht eingetragen wird bekanntgemacht:\nDen Gläubigern der an der Ausgliederung beteiligten Rechtsträger ist, wenn sie binnen sechs Monaten nach dem Tag, an dem die Eintragung der Ausgliederung in das Register des Sitzes desjenigen Rechtsträgers, dessen Gläubiger sie sind, nach § 19 Abs. 3 UmwG als bekanntgemacht gilt, ihren Anspruch nach Grund und Höhe schriftlich anmelden, Sicherheit zu leisten, soweit sie nicht Befriedigung verlangen können. Dieses Recht steht den Gläubigern jedoch nur zu, wenn sie glaubhaft machen, dass durch die Ausgliederung die Erfüllung ihrer Forderung gefährdet wird."
    },
    {
      "date": "2024-10-08",
      "id": "89503",
      "original_text": "Registerbekanntmachung nach dem Umwandlungsgesetz\nBaden-Württemberg Amtsgericht Ulm HRA 729232\nFabian Septimiu e. K. – Wangen im Allgäu",
      "type": "Registerbekanntmachung nach dem Umwandlungsgesetz",
      "state": "Baden-Württemberg",
      "amtsgericht": "Amtsgericht Ulm",
      "registernummer": "HRA 729232",
      "registerart": "HRA",
      "company_name": "Fabian Septimiu e. K.",
      "company_seat": "Wangen im Allgäu",
      "details": "08.10.2024 (Bekanntmachungsdatum)\n\nBaden-Württemberg Amtsgericht Ulm HRA 729232\nRegisterbekanntmachung nach dem Umwandlungsgesetz 08.10.2024 (Eintragungsdatum)\n\nFabian Septimiu e. K.\nEinzelkaufmann / Einzelkauffrau\nWangen im Allgäu\n\nAls nicht eingetragen wird bekanntgemacht:\nDen Gläubigern der an der Ausgliederung beteiligten Rechtsträger ist, wenn sie binnen sechs Monaten nach dem Tag, an dem die Eintragung der Ausgliederung in das Register des Sitzes desjenigen Rechtsträgers, dessen Gläubiger sie sind, nach § 19 Abs. 3 UmwG als bekanntgemacht gilt, ihren Anspruch nach Grund und Höhe schriftlich anmelden, Sicherheit zu leisten, soweit sie nicht Befriedigung verlangen können. Dieses Recht steht den Gläubigern jedoch nur zu, wenn sie glaubhaft machen, dass durch die Ausgliederung die Erfüllung ihrer Forderung gefährdet wird."
    },
    {
      "date": "2024-10-08",
      "id": "89536",
      "original_text": "Löschungsankündigung\nSchleswig-Holstein Amtsgericht Flensburg HRB 15314\nFewopal GmbH – Sankt Peter-Ording",
      "type": "Löschungsankündigung",
      "state": "Schleswig-Holstein",
      "amtsgericht": "Amtsgericht Flensburg",
      "registernummer": "HRB 15314",
      "registerart": "HRB",
      "company_name": "Fewopal GmbH",
      "company_seat": "Sankt Peter-Ording",
      "details": "08.10.2024 (Bekanntmachungsdatum)\n\nSchleswig-Holstein Amtsgericht Flensburg HRB 15314\nLöschungsankündigung\n\nFewopal GmbH\nGesellschaft mit beschränkter Haftung\nSankt Peter-Ording\n\nEs ist die Löschung der nachstehenden Gesellschaft wegen Vermögenslosigkeit gemäß § 394 FamFG beabsichtigt.\nWiderspruchsfrist: 2 Monate."
    },
    {
      "date": "2024-10-08",
      "id": "89538",
      "original_text": "Registerbekanntmachung nach dem Umwandlungsgesetz\nBrandenburg Amtsgericht Potsdam HRB 28824\nFinanzCheckpoint GmbH – Wusterwitz",
      "type": "Registerbekanntmachung nach dem Umwandlungsgesetz",
      "state": "Brandenburg",
      "amtsgericht": "Amtsgericht Potsdam",
      "registernummer": "HRB 28824",
      "registerart": "HRB",
      "company_name": "FinanzCheckpoint GmbH",
      "company_seat": "Wusterwitz",
      "details": "08.10.2024 (Bekanntmachungsdatum)\n\nBrandenburg Amtsgericht Potsdam HRB 28824\nRegisterbekanntmachung nach dem Umwandlungsgesetz 07.10.2024 (Eintragungsdatum)\n\nFinanzCheckpoint GmbH\nGesellschaft mit beschränkter Haftung\nWusterwitz\n\nZu Eintragungsnummer 5 vom 07.10.2024 wird als nicht eingetragen veröffentlicht: Den Gläubigern der an der Verschmelzung beteiligten Rechtsträger ist, wenn sie binnen sechs Monaten nach dem Tag, an dem die Eintragung der Verschmelzung in das Register des Sitzes desjenigen Rechtsträgers, dessen Gläubiger sie sind, als bekannt gemacht gilt, ihren Anspruch nach Grund und Höhe schriftlich anmelden, Sicherheit zu leisten, soweit sie nicht Befriedigung verlangen können. Dieses Recht steht den Gläubigern jedoch nur zu, wenn sie glaubhaft machen, dass durch die Verschmelzung die Erfüllung ihrer Forderung gefährdet wird."
    },
    {
      "date": "2024-10-08",
      "id": "89501",
      "original_text": "Löschungsankündigung\nBerlin Amtsgericht Berlin (Charlottenburg) HRB 185899\nFirst Class Service GmbH – Berlin",
      "type": "Löschungsankündigung",
      "state": "Berlin",
      "amtsgericht": "Amtsgericht Berlin (Charlottenburg)",
      "registernummer": "HRB 185899",
      "registerart": "HRB",
      "company_name": "First Class Service GmbH",
      "company_seat": "Berlin",
      "details": "08.10.2024 (Bekanntmachungsdatum)\n\nBerlin Amtsgericht Berlin (Charlottenburg) HRB 185899\nLöschungsankündigung\n\nFirst Class Service GmbH\nGesellschaft mit beschränkter Haftung\nBerlin\n\nBei der nachstehenden Gesellschaft wird das Amtslöschungsverfahren gemäß § 394 FamFG eingeleitet. Widerspruchsfrist 6 Wochen"
    },
    {
      "date": "2024-10-08",
      "id": "89480",
      "original_text": "Löschungsankündigung\nSchleswig-Holstein Amtsgericht Flensburg HRB 11222\nFlensburger Handels Compagnie UG (haftungsbeschränkt) – Flensburg",
      "type": "Löschungsankündigung",
      "state": "Schleswig-Holstein",
      "amtsgericht": "Amtsgericht Flensburg",
      "registernummer": "HRB 11222",
      "registerart": "HRB",
      "company_name": "Flensburger Handels Compagnie UG (haftungsbeschränkt)",
      "company_seat": "Flensburg",
      "details": "08.10.2024 (Bekanntmachungsdatum)\n\nSchleswig-Holstein Amtsgericht Flensburg HRB 11222\nLöschungsankündigung\n\nFlensburger Handels Compagnie UG (haftungsbeschränkt)\nGesellschaft mit beschränkter Haftung\nFlensburg\n\nEs ist die Löschung der nachstehenden Gesellschaft wegen Vermögenslosigkeit gemäß § 394 FamFG beabsichtigt.\nWiderspruchsfrist: 2 Monate."
    },
    {
      "date": "2024-10-08",
      "id": "89627",
      "original_text": "Einreichung neuer Dokumente\nHessen Amtsgericht Frankfurt am Main HRB 126925\nFraport Facility Services GmbH – Frankfurt am Main",
      "type": "Einreichung neuer Dokumente",
      "state": "Hessen",
      "amtsgericht": "Amtsgericht Frankfurt am Main",
      "registernummer": "HRB 126925",
      "registerart": "HRB",
      "company_name": "Fraport Facility Services GmbH",
      "company_seat": "Frankfurt am Main",
      "details": "08.10.2024 (Bekanntmachungsdatum)\n\nHessen Amtsgericht Frankfurt am Main HRB 126925\nEinreichung neuer Dokumente\n\nFraport Facility Services GmbH\nGesellschaft mit beschränkter Haftung\nFrankfurt am Main\n\nDurch eine Änderung in den Personen der Aufsichtsratsmitglieder ist eine Liste der Mitglieder des Aufsichtsrates zum Handelsregister eingereicht worden."
    },
    {
      "date": "2024-10-08",
      "id": "89610",
      "original_text": "Registerbekanntmachung nach dem Umwandlungsgesetz\nThüringen Amtsgericht Jena HRB 510208\nGAT Automobiltechnologie Holding GmbH – Rudolstadt",
      "type": "Registerbekanntmachung nach dem Umwandlungsgesetz",
      "state": "Thüringen",
      "amtsgericht": "Amtsgericht Jena",
      "registernummer": "HRB 510208",
      "registerart": "HRB",
      "company_name": "GAT Automobiltechnologie Holding GmbH",
      "company_seat": "Rudolstadt",
      "details": "08.10.2024 (Bekanntmachungsdatum)\n\nThüringen Amtsgericht Jena HRB 510208\nRegisterbekanntmachung nach dem Umwandlungsgesetz 08.10.2024 (Eintragungsdatum)\n\nGAT Automobiltechnologie Holding GmbH\nGesellschaft mit beschränkter Haftung\nRudolstadt\n\nNicht eingetragen: Den Gläubigern der an der Verschmelzung beteiligten Rechtsträger, ist wenn sie binnen sechs Monaten nach dem Tag, an dem die Eintragung der Verschmelzung in das Register des Sitzes desjenigen Rechtsträgers, dessen Gläubiger sie sind,  nach § 19 Abs. 3 UmwG als bekanntgemacht gilt, ihren Anspruch nach Grund und Höhe schriftlich anmelden, Sicherheit zu leisten, soweit sie nicht Befriedigung verlangen können. Dieses Recht steht ihnen jedoch nur zu, wenn sie glaubhaft machen, daß durch die Verschmelzung die Erfüllung ihrer Forderung gefährdet wird."
    },
    {
      "date": "2024-10-08",
      "id": "89616",
      "original_text": "Registerbekanntmachung nach dem Umwandlungsgesetz\nThüringen Amtsgericht Jena HRB 521418\nGAT Gesellschaft für Kraftstoff- und Automobiltechnologie mbH – Uhlstädt-Kirchhasel",
      "type": "Registerbekanntmachung nach dem Umwandlungsgesetz",
      "state": "Thüringen",
      "amtsgericht": "Amtsgericht Jena",
      "registernummer": "HRB 521418",
      "registerart": "HRB",
      "company_name": "GAT Gesellschaft für Kraftstoff- und Automobiltechnologie mbH",
      "company_seat": "Uhlstädt-Kirchhasel",
      "details": "08.10.2024 (Bekanntmachungsdatum)\n\nThüringen Amtsgericht Jena HRB 521418\nRegisterbekanntmachung nach dem Umwandlungsgesetz 08.10.2024 (Eintragungsdatum)\n\nGAT Gesellschaft für Kraftstoff- und Automobiltechnologie mbH\nGesellschaft mit beschränkter Haftung\nUhlstädt-Kirchhasel\n\nNicht eingetragen: Den Gläubigern der an der Verschmelzung beteiligten Rechtsträger, ist wenn sie binnen sechs Monaten nach dem Tag, an dem die Eintragung der Verschmelzung in das Register des Sitzes desjenigen Rechtsträgers, dessen Gläubiger sie sind,  nach § 19 Abs. 3 UmwG als bekanntgemacht gilt, ihren Anspruch nach Grund und Höhe schriftlich anmelden, Sicherheit zu leisten, soweit sie nicht Befriedigung verlangen können. Dieses Recht steht ihnen jedoch nur zu, wenn sie glaubhaft machen, daß durch die Verschmelzung die Erfüllung ihrer Forderung gefährdet wird."
    },
    {
      "date": "2024-10-08",
      "id": "89433",
      "original_text": "Löschungsankündigung\nBayern Amtsgericht München HRB 249892\nGG Full Metal Engineering GmbH – München",
      "type": "Löschungsankündigung",
      "state": "Bayern",
      "amtsgericht": "Amtsgericht München",
      "registernummer": "HRB 249892",
      "registerart": "HRB",
      "company_name": "GG Full Metal Engineering GmbH",
      "company_seat": "München",
      "details": "08.10.2024 (Bekanntmachungsdatum)\n\nBayern Amtsgericht München HRB 249892\nLöschungsankündigung\n\nGG Full Metal Engineering GmbH\nGesellschaft mit beschränkter Haftung\nMünchen\n\nDas Registergericht beabsichtigt, die im Handelsregister eingetragene Gesellschaft wegen Vermögenslosigkeit von Amts wegen nach § 394 FamFG zu löschen. Die Frist zur Erhebung eines Widerspruchs ist auf drei Monate festgesetzt."
    },
    {
      "date": "2024-10-08",
      "id": "89443",
      "original_text": "Registerbekanntmachung nach dem Umwandlungsgesetz\nBayern Amtsgericht Traunstein VR 10048\nGemeinnütziger Verein zur Förderung des Wohnbaues und Vermietung von Altenwohnungen in Altötting e.V. – Altötting",
      "type": "Registerbekanntmachung nach dem Umwandlungsgesetz",
      "state": "Bayern",
      "amtsgericht": "Amtsgericht Traunstein",
      "registernummer": "VR 10048",
      "registerart": "VR",
      "company_name": "Gemeinnütziger Verein zur Förderung des Wohnbaues und Vermietung von Altenwohnungen in Altötting e.V.",
      "company_seat": "Altötting",
      "details": "08.10.2024 (Bekanntmachungsdatum)\n\nBayern Amtsgericht Traunstein VR 10048\nRegisterbekanntmachung nach dem Umwandlungsgesetz 07.10.2024 (Eintragungsdatum)\n\nGemeinnütziger Verein zur Förderung des Wohnbaues und Vermietung von Altenwohnungen in Altötting e.V.\neingetragener Verein\nAltötting\n\nDen Gläubigern des formwechselnden Rechtsträgers ist, wenn sie binnen sechs Monaten nach dem Tag, an dem die Eintragung des Formwechsels nach § 201 UmwG als bekannt gemacht gilt, ihren Anspruch nach Grund und Höhe schriftlich anmelden, Sicherheit zu leisten, soweit sie nicht Befriedigung verlangen können. Dieses Recht steht den Gläubigern jedoch nur zu, wenn sie glaubhaft machen, dass durch den Formwechsel die Erfüllung ihrer Forderung gefährdet wird."
    },
    {
      "date": "2024-10-08",
      "id": "89621",
      "original_text": "Sonstige Registerbekanntmachung\nHessen Amtsgericht Fritzlar VR 3453\nGesundheits-Sport-Verein Melsungen (GSV Melsungen) – Melsungen",
      "type": "Sonstige Registerbekanntmachung",
      "state": "Hessen",
      "amtsgericht": "Amtsgericht Fritzlar",
      "registernummer": "VR 3453",
      "registerart": "VR",
      "company_name": "Gesundheits-Sport-Verein Melsungen (GSV Melsungen)",
      "company_seat": "Melsungen",
      "details": "08.10.2024 (Bekanntmachungsdatum)\n\nHessen Amtsgericht Fritzlar VR 3453\nSonstige Registerbekanntmachung 08.10.2024 (Eintragungsdatum)\n\nGesundheits-Sport-Verein Melsungen (GSV Melsungen)\neingetragener Verein\nMelsungen\n\nDer Verein ist aufgelöst."
    },
    {
      "date": "2024-10-08",
      "id": "89589",
      "original_text": "Registerbekanntmachung nach dem Umwandlungsgesetz\nNordrhein-Westfalen Amtsgericht Köln HRA 37777\nGriesemann Gruppe GmbH & Co. KG – Wesseling",
      "type": "Registerbekanntmachung nach dem Umwandlungsgesetz",
      "state": "Nordrhein-Westfalen",
      "amtsgericht": "Amtsgericht Köln",
      "registernummer": "HRA 37777",
      "registerart": "HRA",
      "company_name": "Griesemann Gruppe GmbH & Co. KG",
      "company_seat": "Wesseling",
      "details": "08.10.2024 (Bekanntmachungsdatum)\n\nNordrhein-Westfalen Amtsgericht Köln HRA 37777\nRegisterbekanntmachung nach dem Umwandlungsgesetz 08.10.2024 (Eintragungsdatum)\n\nGriesemann Gruppe GmbH & Co. KG\nKommanditgesellschaft\nWesseling\n\nDen Gläubigern der an der formwechselnden Umwandlung beteiligten Rechtsträger ist, wenn sie binnen sechs Monaten nach dem Tag, an dem die Eintragung der formwechselnden Umwandlung in das Register des Sitzes desjenigen Rechtsträgers, dessen Gläubiger sie sind, nach § 19 Absatz 3 UmwG als bekanntgemacht gilt, ihren Anspruch nach Grund und Höhe schriftlich anmelden, Sicherheit zu leisten, soweit sie nicht Befriedigung verlangen können. Dieses Recht steht den Gläubigern jedoch nur zu, wenn sie glaubhaft machen, dass durch die formwechselnden Umwandlung die Erfüllung ihrer Forderung gefährdet wird."
    },
    {
      "date": "2024-10-08",
      "id": "89486",
      "original_text": "Registerbekanntmachung nach dem Umwandlungsgesetz\nHamburg Amtsgericht Hamburg HRB 131148\nGrundstücksgesellschaft Martinistraße 83 mbH – Hamburg",
      "type": "Registerbekanntmachung nach dem Umwandlungsgesetz",
      "state": "Hamburg",
      "amtsgericht": "Amtsgericht Hamburg",
      "registernummer": "HRB 131148",
      "registerart": "HRB",
      "company_name": "Grundstücksgesellschaft Martinistraße 83 mbH",
      "company_seat": "Hamburg",
      "details": "08.10.2024 (Bekanntmachungsdatum)\n\nHamburg Amtsgericht Hamburg HRB 131148\nRegisterbekanntmachung nach dem Umwandlungsgesetz 08.10.2024 (Eintragungsdatum)\n\nGrundstücksgesellschaft Martinistraße 83 mbH\nGesellschaft mit beschränkter Haftung\nHamburg\n\nAls nicht eingetragen wird bekannt gemacht:\nDen Gläubigern der an der Verschmelzung beteiligten Gesellschaften ist, wenn sie binnen sechs Monaten nach dem Tag, an dem die Eintragung der Verschmelzung in das Register des Sitzes desjenigen Rechtsträgers, dessen Gläubiger sie sind, nach § 19 Absatz 3 UmwG als bekannt gemacht gilt, ihren Anspruch nach Grund und Höhe schriftlich anmelden, Sicherheit zu leisten, soweit sie nicht Befriedigung verlangen können. Dieses Recht steht den Gläubigern jedoch nur zu, wenn sie glaubhaft machen, dass durch die Verschmelzung die Erfüllung ihrer Forderung gefährdet wird."
    },
    {
      "date": "2024-10-08",
      "id": "89557",
      "original_text": "Löschungsankündigung\nSachsen Amtsgericht Dresden HRB 23710\nHWC Verwaltung GmbH – Dresden",
      "type": "Löschungsankündigung",
      "state": "Sachsen",
      "amtsgericht": "Amtsgericht Dresden",
      "registernummer": "HRB 23710",
      "registerart": "HRB",
      "company_name": "HWC Verwaltung GmbH",
      "company_seat": "Dresden",
      "details": "08.10.2024 (Bekanntmachungsdatum)\n\nSachsen Amtsgericht Dresden HRB 23710\nLöschungsankündigung\n\nHWC Verwaltung GmbH\nGesellschaft mit beschränkter Haftung\nDresden\n\nDas Registergericht beabsichtigt, die im Handelsregister eingetragene Gesellschaft von Amts wegen nach § 394 FamFG zu löschen. Die Frist zu Erhebung eines Widerspruchs gegen die beabsichtigte Löschung wird auf einen Monat festgesetzt."
    },
    {
      "date": "2024-10-08",
      "id": "89572",
      "original_text": "Registerbekanntmachung nach dem Umwandlungsgesetz\nNordrhein-Westfalen Amtsgericht Essen HRA 11337\nHaustechnik Stöbener e.K. – Essen",
      "type": "Registerbekanntmachung nach dem Umwandlungsgesetz",
      "state": "Nordrhein-Westfalen",
      "amtsgericht": "Amtsgericht Essen",
      "registernummer": "HRA 11337",
      "registerart": "HRA",
      "company_name": "Haustechnik Stöbener e.K.",
      "company_seat": "Essen",
      "details": "08.10.2024 (Bekanntmachungsdatum)\n\nNordrhein-Westfalen Amtsgericht Essen HRA 11337\nRegisterbekanntmachung nach dem Umwandlungsgesetz 08.10.2024 (Eintragungsdatum)\n\nHaustechnik Stöbener e.K.\nEinzelkaufmann / Einzelkauffrau\nEssen\n\nDie Gesellschaft hat Gläubigern, deren Forderungen vor dieser Bekanntmachung begründet worden sind, Sicherheit zu leisten, soweit sie nicht Befriedigung verlangen können, wenn sie sich binnen sechs Monaten zu diesem Zweck melden.Den Gläubigern der an der Ausgliederung beteiligten Rechtsträger ist, wenn sie binnen sechs Monaten nach dem Tag, an dem die Eintragung der Ausgliederung in das Register des Sitzes desjenigen Rechtsträgers, dessen Gläubiger sie sind, nach § 19 Absatz 3 UmwG als bekanntgemacht gilt, ihren Anspruch nach Grund und Höhe schriftlich anmelden, Sicherheit zu leisten, soweit sie nicht Befriedigung verlangen können. Dieses Recht steht den Gläubigern jedoch nur zu, wenn sie glaubhaft machen, dass durch die Ausgliederung die Erfüllung ihrer Forderung gefährdet wird."
    },
    {
      "date": "2024-10-08",
      "id": "89573",
      "original_text": "Registerbekanntmachung nach dem Umwandlungsgesetz\nNordrhein-Westfalen Amtsgericht Essen HRA 11337\nHaustechnik Stöbener e.K. – Essen",
      "type": "Registerbekanntmachung nach dem Umwandlungsgesetz",
      "state": "Nordrhein-Westfalen",
      "amtsgericht": "Amtsgericht Essen",
      "registernummer": "HRA 11337",
      "registerart": "HRA",
      "company_name": "Haustechnik Stöbener e.K.",
      "company_seat": "Essen",
      "details": "08.10.2024 (Bekanntmachungsdatum)\n\nNordrhein-Westfalen Amtsgericht Essen HRA 11337\nRegisterbekanntmachung nach dem Umwandlungsgesetz 08.10.2024 (Eintragungsdatum)\n\nHaustechnik Stöbener e.K.\nEinzelkaufmann / Einzelkauffrau\nEssen\n\nDen Gläubigern der an der Ausgliederung beteiligten Rechtsträger ist, wenn sie binnen sechs Monaten nach dem Tag, an dem die Eintragung der Ausgliederung in das Register des Sitzes desjenigen Rechtsträgers, dessen Gläubiger sie sind, nach § 19 Absatz 3 UmwG als bekanntgemacht gilt, ihren Anspruch nach Grund und Höhe schriftlich anmelden, Sicherheit zu leisten, soweit sie nicht Befriedigung verlangen können. Dieses Recht steht den Gläubigern jedoch nur zu, wenn sie glaubhaft machen, dass durch die Ausgliederung die Erfüllung ihrer Forderung gefährdet wird."
    },
    {
      "date": "2024-10-08",
      "id": "89609",
      "original_text": "Sonstige Registerbekanntmachung\nNordrhein-Westfalen Amtsgericht Köln HRB 35879\nHayuno AG – Köln",
      "type": "Sonstige Registerbekanntmachung",
      "state": "Nordrhein-Westfalen",
      "amtsgericht": "Amtsgericht Köln",
      "registernummer": "HRB 35879",
      "registerart": "HRB",
      "company_name": "Hayuno AG",
      "company_seat": "Köln",
      "details": "08.10.2024 (Bekanntmachungsdatum)\n\nNordrhein-Westfalen Amtsgericht Köln HRB 35879\nSonstige Registerbekanntmachung\n\nHayuno AG\nAktiengesellschaft\nKöln\n\nDem Registergericht ist eine Liste der Mitglieder des Aufsichtsrates eingereicht worden."
    },
    {
      "date": "2024-10-08",
      "id": "89504",
      "original_text": "Registerbekanntmachung nach dem Umwandlungsgesetz\nBaden-Württemberg Amtsgericht Mannheim HRB 715912\nHelmut Klingel Beteiligungs GmbH – Pforzheim",
      "type": "Registerbekanntmachung nach dem Umwandlungsgesetz",
      "state": "Baden-Württemberg",
      "amtsgericht": "Amtsgericht Mannheim",
      "registernummer": "HRB 715912",
      "registerart": "HRB",
      "company_name": "Helmut Klingel Beteiligungs GmbH",
      "company_seat": "Pforzheim",
      "details": "08.10.2024 (Bekanntmachungsdatum)\n\nBaden-Württemberg Amtsgericht Mannheim HRB 715912\nRegisterbekanntmachung nach dem Umwandlungsgesetz 08.10.2024 (Eintragungsdatum)\n\nHelmut Klingel Beteiligungs GmbH\nGesellschaft mit beschränkter Haftung\nPforzheim\n\nDen Gläubigern der an der Verschmelzung beteiligten Rechtsträger ist, wenn sie binnen sechs Monaten nach dem Tag, an dem die Eintragung der Verschmelzung in das Register des Sitzes desjenigen Rechtsträgers, dessen Gläubiger sie sind, nach § 19 Abs. 3 UmwG als bekanntgemacht gilt, ihren Anspruch nach Grund und Höhe schriftlich anmelden, Sicherheit zu leisten, soweit sie nicht Befriedigung verlangen können. Dieses Recht steht den Gläubigern jedoch nur zu, wenn sie glaubhaft machen, dass durch die Verschmelzung die Erfüllung ihrer Forderung gefährdet wird."
    },
    {
      "date": "2024-10-08",
      "id": "89439",
      "original_text": "Registerbekanntmachung nach dem Umwandlungsgesetz\nBayern Amtsgericht München HRA 120007\nHenrike Scharnhorst e.K. – München",
      "type": "Registerbekanntmachung nach dem Umwandlungsgesetz",
      "state": "Bayern",
      "amtsgericht": "Amtsgericht München",
      "registernummer": "HRA 120007",
      "registerart": "HRA",
      "company_name": "Henrike Scharnhorst e.K.",
      "company_seat": "München",
      "details": "08.10.2024 (Bekanntmachungsdatum)\n\nBayern Amtsgericht München HRA 120007\nRegisterbekanntmachung nach dem Umwandlungsgesetz 07.10.2024 (Eintragungsdatum)\n\nHenrike Scharnhorst e.K.\nEinzelkaufmann / Einzelkauffrau\nMünchen\n\nDen Gläubigern der an der Verschmelzung beteiligten Rechtsträger ist, wenn sie binnen sechs Monaten nach dem Tag, an dem die Eintragung der Verschmelzung in das Register des Sitzes desjenigen Rechtsträgers, dessen Gläubiger sie sind, nach § 19 Abs. 3 UmwG als bekannt gemacht gilt, ihren Anspruch nach Grund und Höhe schriftlich anmelden, Sicherheit zu leisten, soweit sie nicht Befriedigung verlangen können. Dieses Recht steht den Gläubigern jedoch nur zu, wenn sie glaubhaft machen, dass durch die Verschmelzung die Erfüllung ihrer Forderung gefährdet wird."
    },
    {
      "date": "2024-10-08",
      "id": "89565",
      "original_text": "Löschungsankündigung\nNiedersachsen Amtsgericht Aurich HRB 202590\nHeureka Beteiligungs UG (haftungsbeschränkt) – Emden",
      "type": "Löschungsankündigung",
      "state": "Niedersachsen",
      "amtsgericht": "Amtsgericht Aurich",
      "registernummer": "HRB 202590",
      "registerart": "HRB",
      "company_name": "Heureka Beteiligungs UG (haftungsbeschränkt)",
      "company_seat": "Emden",
      "details": "08.10.2024 (Bekanntmachungsdatum)\n\nNiedersachsen Amtsgericht Aurich HRB 202590\nLöschungsankündigung 08.10.2024 (Eintragungsdatum)\n\nHeureka Beteiligungs UG (haftungsbeschränkt)\nGesellschaft mit beschränkter Haftung\nEmden\n\nDas Registergericht beabsichtigt, die Gesellschaft von Amts wegen nach § 394 FamFG zu löschen. Die Frist zur Erhebung eines Widerspruchs ist auf 3 Monaten ab dieser Registerbekanntmachung festgesetzt."
    },
    {
      "date": "2024-10-08",
      "id": "89458",
      "original_text": "Registerbekanntmachung nach dem Umwandlungsgesetz\nBayern Amtsgericht München HRB 296535\nHinterholzer Elektrotechnik GmbH – Unterschleißheim",
      "type": "Registerbekanntmachung nach dem Umwandlungsgesetz",
      "state": "Bayern",
      "amtsgericht": "Amtsgericht München",
      "registernummer": "HRB 296535",
      "registerart": "HRB",
      "company_name": "Hinterholzer Elektrotechnik GmbH",
      "company_seat": "Unterschleißheim",
      "details": "08.10.2024 (Bekanntmachungsdatum)\n\nBayern Amtsgericht München HRB 296535\nRegisterbekanntmachung nach dem Umwandlungsgesetz 07.10.2024 (Eintragungsdatum)\n\nHinterholzer Elektrotechnik GmbH\nGesellschaft mit beschränkter Haftung\nUnterschleißheim\n\nDen Gläubigern der an der Ausgliederung beteiligten Rechtsträger ist, wenn sie binnen sechs Monaten nach dem Tag, an dem die Eintragung der Ausgliederung in das Register des Sitzes desjenigen Rechtsträgers, dessen Gläubiger sie sind, nach §§ 125, 19 Abs. 3 UmwG als bekannt gemacht gilt, ihren Anspruch nach Grund und Höhe schriftlich anmelden, Sicherheit zu leisten, soweit sie nicht Befriedigung verlangen können. Dieses Recht steht den Gläubigern jedoch nur zu, wenn sie glaubhaft machen, dass durch die Ausgliederung die Erfüllung ihrer Forderung gefährdet wird."
    },
    {
      "date": "2024-10-08",
      "id": "89454",
      "original_text": "Registerbekanntmachung nach dem Umwandlungsgesetz\nBayern Amtsgericht München HRB 296534\nHinterholzer Industrieservice GmbH – Unterschleißheim",
      "type": "Registerbekanntmachung nach dem Umwandlungsgesetz",
      "state": "Bayern",
      "amtsgericht": "Amtsgericht München",
      "registernummer": "HRB 296534",
      "registerart": "HRB",
      "company_name": "Hinterholzer Industrieservice GmbH",
      "company_seat": "Unterschleißheim",
      "details": "08.10.2024 (Bekanntmachungsdatum)\n\nBayern Amtsgericht München HRB 296534\nRegisterbekanntmachung nach dem Umwandlungsgesetz 07.10.2024 (Eintragungsdatum)\n\nHinterholzer Industrieservice GmbH\nGesellschaft mit beschränkter Haftung\nUnterschleißheim\n\nDen Gläubigern der an der Ausgliederung beteiligten Rechtsträger ist, wenn sie binnen sechs Monaten nach dem Tag, an dem die Eintragung der Ausgliederung in das Register des Sitzes desjenigen Rechtsträgers, dessen Gläubiger sie sind, nach §§ 125, 19 Abs. 3 UmwG als bekannt gemacht gilt, ihren Anspruch nach Grund und Höhe schriftlich anmelden, Sicherheit zu leisten, soweit sie nicht Befriedigung verlangen können. Dieses Recht steht den Gläubigern jedoch nur zu, wenn sie glaubhaft machen, dass durch die Ausgliederung die Erfüllung ihrer Forderung gefährdet wird."
    },
    {
      "date": "2024-10-08",
      "id": "89477",
      "original_text": "Registerbekanntmachung nach dem Umwandlungsgesetz\nBaden-Württemberg Amtsgericht Ulm HRB 748687\nHolzbau Rösch GmbH – Amstetten",
      "type": "Registerbekanntmachung nach dem Umwandlungsgesetz",
      "state": "Baden-Württemberg",
      "amtsgericht": "Amtsgericht Ulm",
      "registernummer": "HRB 748687",
      "registerart": "HRB",
      "company_name": "Holzbau Rösch GmbH",
      "company_seat": "Amstetten",
      "details": "08.10.2024 (Bekanntmachungsdatum)\n\nBaden-Württemberg Amtsgericht Ulm HRB 748687\nRegisterbekanntmachung nach dem Umwandlungsgesetz 08.10.2024 (Eintragungsdatum)\n\nHolzbau Rösch GmbH\nGesellschaft mit beschränkter Haftung\nAmstetten\n\nAls nicht eingetragen wird bekanntgemacht:\nDen Gläubigern der an der Ausgliederung beteiligten Rechtsträger ist, wenn sie binnen sechs Monaten nach dem Tag, an dem die Eintragung der Ausgliederung in das Register des Sitzes desjenigen Rechtsträgers, dessen Gläubiger sie sind, nach § 19 Abs. 3 UmwG als bekanntgemacht gilt, ihren Anspruch nach Grund und Höhe schriftlich anmelden, Sicherheit zu leisten, soweit sie nicht Befriedigung verlangen können. Dieses Recht steht den Gläubigern jedoch nur zu, wenn sie glaubhaft machen, dass durch die Ausgliederung die Erfüllung ihrer Forderung gefährdet wird."
    },
    {
      "date": "2024-10-08",
      "id": "89517",
      "original_text": "Löschungsankündigung\nBerlin Amtsgericht Berlin (Charlottenburg) HRB 246701\nHudak UG (haftungsbeschränkt) – Berlin",
      "type": "Löschungsankündigung",
      "state": "Berlin",
      "amtsgericht": "Amtsgericht Berlin (Charlottenburg)",
      "registernummer": "HRB 246701",
      "registerart": "HRB",
      "company_name": "Hudak UG (haftungsbeschränkt)",
      "company_seat": "Berlin",
      "details": "08.10.2024 (Bekanntmachungsdatum)\n\nBerlin Amtsgericht Berlin (Charlottenburg) HRB 246701\nLöschungsankündigung\n\nHudak UG (haftungsbeschränkt)\nGesellschaft mit beschränkter Haftung\nBerlin\n\nBei der nachstehenden Gesellschaft wird das Amtslöschungsverfahren gemäß § 394 FamFG eingeleitet. Widerspruchsfrist 6 Wochen"
    },
    {
      "date": "2024-10-08",
      "id": "89441",
      "original_text": "Löschungsankündigung\nBayern Amtsgericht Nürnberg HRB 24079\nHänel Verwaltungs GmbH – Röthenbach a.d. Pegnitz",
      "type": "Löschungsankündigung",
      "state": "Bayern",
      "amtsgericht": "Amtsgericht Nürnberg",
      "registernummer": "HRB 24079",
      "registerart": "HRB",
      "company_name": "Hänel Verwaltungs GmbH",
      "company_seat": "Röthenbach a.d. Pegnitz",
      "details": "08.10.2024 (Bekanntmachungsdatum)\n\nBayern Amtsgericht Nürnberg HRB 24079\nLöschungsankündigung\n\nHänel Verwaltungs GmbH\nGesellschaft mit beschränkter Haftung\nRöthenbach a.d. Pegnitz\n\nDas Registergericht beabsichtigt, die im Handelsregister eingetragene Gesellschaft wegen Vermögenslosigkeit von Amts wegen nach § 394 FamFG zu löschen. Die Frist zur Erhebung eines Widerspruchs ist auf einen Monat festgesetzt."
    },
    {
      "date": "2024-10-08",
      "id": "89495",
      "original_text": "Löschungsankündigung\nBerlin Amtsgericht Berlin (Charlottenburg) HRB 233328\nIMG Lichtenberg UG (haftungsbeschränkt) – Berlin",
      "type": "Löschungsankündigung",
      "state": "Berlin",
      "amtsgericht": "Amtsgericht Berlin (Charlottenburg)",
      "registernummer": "HRB 233328",
      "registerart": "HRB",
      "company_name": "IMG Lichtenberg UG (haftungsbeschränkt)",
      "company_seat": "Berlin",
      "details": "08.10.2024 (Bekanntmachungsdatum)\n\nBerlin Amtsgericht Berlin (Charlottenburg) HRB 233328\nLöschungsankündigung\n\nIMG Lichtenberg UG (haftungsbeschränkt)\nGesellschaft mit beschränkter Haftung\nBerlin\n\nBei der nachstehenden Gesellschaft wird das Amtslöschungsverfahren gemäß § 394 FamFG eingeleitet. Widerspruchsfrist 6 Wochen"
    },
    {
      "date": "2024-10-08",
      "id": "89607",
      "original_text": "Registerbekanntmachung nach dem Umwandlungsgesetz\nNordrhein-Westfalen Amtsgericht Köln HRB 96916\nINDUREST Planungsgesellschaft für Industrieanlagenbau m.b.H. – Wesseling",
      "type": "Registerbekanntmachung nach dem Umwandlungsgesetz",
      "state": "Nordrhein-Westfalen",
      "amtsgericht": "Amtsgericht Köln",
      "registernummer": "HRB 96916",
      "registerart": "HRB",
      "company_name": "INDUREST Planungsgesellschaft für Industrieanlagenbau m.b.H.",
      "company_seat": "Wesseling",
      "details": "08.10.2024 (Bekanntmachungsdatum)\n\nNordrhein-Westfalen Amtsgericht Köln HRB 96916\nRegisterbekanntmachung nach dem Umwandlungsgesetz 08.10.2024 (Eintragungsdatum)\n\nINDUREST Planungsgesellschaft für Industrieanlagenbau m.b.H.\nGesellschaft mit beschränkter Haftung\nWesseling\n\nDen Gläubigern der an der formwechselnden Umwandlung beteiligten Rechtsträger ist, wenn sie binnen sechs Monaten nach dem Tag, an dem die Eintragung der formwechselnden Umwandlung in das Register des Sitzes desjenigen Rechtsträgers, dessen Gläubiger sie sind, nach § 19 Absatz 3 UmwG als bekanntgemacht gilt, ihren Anspruch nach Grund und Höhe schriftlich anmelden, Sicherheit zu leisten, soweit sie nicht Befriedigung verlangen können. Dieses Recht steht den Gläubigern jedoch nur zu, wenn sie glaubhaft machen, dass durch die formwechselnden Umwandlung die Erfüllung ihrer Forderung gefährdet wird."
    },
    {
      "date": "2024-10-08",
      "id": "89623",
      "original_text": "Löschungsankündigung\nHessen Amtsgericht Eschwege HRB 3536\nINVT Consulting GmbH – Eschwege",
      "type": "Löschungsankündigung",
      "state": "Hessen",
      "amtsgericht": "Amtsgericht Eschwege",
      "registernummer": "HRB 3536",
      "registerart": "HRB",
      "company_name": "INVT Consulting GmbH",
      "company_seat": "Eschwege",
      "details": "08.10.2024 (Bekanntmachungsdatum)\n\nHessen Amtsgericht Eschwege HRB 3536\nLöschungsankündigung\n\nINVT Consulting GmbH\nGesellschaft mit beschränkter Haftung\nEschwege\n\nDas Registergericht beabsichtigt die im Handelsregister eingetragene Gesellschaft von Amts wegen nach § 394 FamFG zu löschen. Die Frist zur Erhebung eines Widerspruchs gegen die beabsichtigte Löschung wird auf 3 Monate festgesetzt."
    },
    {
      "date": "2024-10-08",
      "id": "89554",
      "original_text": "Löschungsankündigung\nSachsen Amtsgericht Dresden HRB 43043\nISOJUS GmbH – Zittau",
      "type": "Löschungsankündigung",
      "state": "Sachsen",
      "amtsgericht": "Amtsgericht Dresden",
      "registernummer": "HRB 43043",
      "registerart": "HRB",
      "company_name": "ISOJUS GmbH",
      "company_seat": "Zittau",
      "details": "08.10.2024 (Bekanntmachungsdatum)\n\nSachsen Amtsgericht Dresden HRB 43043\nLöschungsankündigung\n\nISOJUS GmbH\nGesellschaft mit beschränkter Haftung\nZittau\n\nDas Registergericht beabsichtigt, die im Handelsregister eingetragene Gesellschaft von Amts wegen nach § 394 FamFG zu löschen. Die Frist zu Erhebung eines Widerspruchs gegen die beabsichtigte Löschung wird auf einen Monat festgesetzt."
    },
    {
      "date": "2024-10-08",
      "id": "89613",
      "original_text": "Registerbekanntmachung nach dem Umwandlungsgesetz\nThüringen Amtsgericht Jena HRA 506848\nIndustriemontage Werner e.K. – Remptendorf",
      "type": "Registerbekanntmachung nach dem Umwandlungsgesetz",
      "state": "Thüringen",
      "amtsgericht": "Amtsgericht Jena",
      "registernummer": "HRA 506848",
      "registerart": "HRA",
      "company_name": "Industriemontage Werner e.K.",
      "company_seat": "Remptendorf",
      "details": "08.10.2024 (Bekanntmachungsdatum)\n\nThüringen Amtsgericht Jena HRA 506848\nRegisterbekanntmachung nach dem Umwandlungsgesetz 08.10.2024 (Eintragungsdatum)\n\nIndustriemontage Werner e.K.\nEinzelkaufmann / Einzelkauffrau\nRemptendorf\n\nNicht eingetragen: Den Gläubigern der an der Ausgliederung beteiligten Rechtsträger, ist wenn sie binnen sechs Monaten nach dem Tag, an dem die Eintragung der Ausgliederung in das Register des Sitzes desjenigen Rechtsträgers, dessen Gläubiger sie sind, nach §§125, 19 Abs. 3 UmwG als bekanntgemacht gilt, ihren Anspruch nach Grund und Höhe schriftlich anmelden, Sicherheit zu leisten, soweit sie nicht Befriedigung verlangen können. Dieses Recht steht ihnen jedoch nur zu, wenn sie glaubhaft machen, daß durch die Ausgliederung die Erfüllung ihrer Forderung gefährdet wird."
    },
    {
      "date": "2024-10-08",
      "id": "89619",
      "original_text": "Registerbekanntmachung nach dem Umwandlungsgesetz\nHessen Amtsgericht Offenbach am Main HRB 54500\nIngenieurbüro Donath GmbH – Neu-Isenburg",
      "type": "Registerbekanntmachung nach dem Umwandlungsgesetz",
      "state": "Hessen",
      "amtsgericht": "Amtsgericht Offenbach am Main",
      "registernummer": "HRB 54500",
      "registerart": "HRB",
      "company_name": "Ingenieurbüro Donath GmbH",
      "company_seat": "Neu-Isenburg",
      "details": "08.10.2024 (Bekanntmachungsdatum)\n\nHessen Amtsgericht Offenbach am Main HRB 54500\nRegisterbekanntmachung nach dem Umwandlungsgesetz 08.10.2024 (Eintragungsdatum)\n\nIngenieurbüro Donath GmbH\nGesellschaft mit beschränkter Haftung\nNeu-Isenburg\n\nDen Gläubigern der an der Verschmelzung beteiligten Rechtsträger ist, wenn sie binnen sechs Monaten nach dem Tag, an dem die Eintragung der Verschmelzung in das Register des Sitzes desjenigen Rechtsträgers, dessen Gläubiger sie sind, nach § 19 Absatz 3 UmwG bekannt gemacht worden ist, ihren Anspruch nach Grund und Höhe schriftlich anmelden, Sicherheit zu leisten, soweit sie nicht Befriedigung verlangen können. Dieses Recht steht den Gläubigern jedoch nur zu, wenn sie glaubhaft machen, dass durch die Verschmelzung die Erfüllung ihrer Forderung gefährdet wird."
    },
    {
      "date": "2024-10-08",
      "id": "89469",
      "original_text": "Registerbekanntmachung nach dem Umwandlungsgesetz\nMecklenburg-Vorpommern Amtsgericht Schwerin VR 3215\nInstitut für Polymer- und Produktionstechnologien e.V. – Wismar",
      "type": "Registerbekanntmachung nach dem Umwandlungsgesetz",
      "state": "Mecklenburg-Vorpommern",
      "amtsgericht": "Amtsgericht Schwerin",
      "registernummer": "VR 3215",
      "registerart": "VR",
      "company_name": "Institut für Polymer- und Produktionstechnologien e.V.",
      "company_seat": "Wismar",
      "details": "08.10.2024 (Bekanntmachungsdatum)\n\nMecklenburg-Vorpommern Amtsgericht Schwerin VR 3215\nRegisterbekanntmachung nach dem Umwandlungsgesetz 30.09.2024 (Eintragungsdatum)\n\nInstitut für Polymer- und Produktionstechnologien e.V.\neingetragener Verein\nWismar\n\nAls nicht eingetragen wird veröffentlicht: Den Gläubigern der an dem Formwechsel beteiligten Rechtsträger ist, wenn sie binnen sechs Monaten nach dem Tag, an dem die Eintragung des Formwechsels in das Register des Sitzes desjenigen Rechtsträgers, dessen Gläubiger sie sind, nach § 19 Abs. 3 UmwG als bekannt gemacht gilt,\nihren Anspruch nach Grund und Höhe schriftlich anmelden, Sicherheit zu leisten, soweit sie nicht Befriedigung verlangen können. Dieses Recht steht den Gläubigern jedoch nur zu, wenn sie glaubhaft machen, dass durch den Formwechsel die Erfüllung der Forderung gefährdet wird."
    },
    {
      "date": "2024-10-08",
      "id": "89537",
      "original_text": "Löschungsankündigung\nBerlin Amtsgericht Berlin (Charlottenburg) HRB 173418\nIoT CONNCTD GmbH – Berlin",
      "type": "Löschungsankündigung",
      "state": "Berlin",
      "amtsgericht": "Amtsgericht Berlin (Charlottenburg)",
      "registernummer": "HRB 173418",
      "registerart": "HRB",
      "company_name": "IoT CONNCTD GmbH",
      "company_seat": "Berlin",
      "details": "08.10.2024 (Bekanntmachungsdatum)\n\nBerlin Amtsgericht Berlin (Charlottenburg) HRB 173418\nLöschungsankündigung\n\nIoT CONNCTD GmbH\nGesellschaft mit beschränkter Haftung\nBerlin\n\nBei der nachstehenden Gesellschaft wird das Amtslöschungsverfahren gemäß § 394 FamFG eingeleitet. Widerspruchsfrist: 6 Wochen."
    },
    {
      "date": "2024-10-08",
      "id": "89436",
      "original_text": "Löschungsankündigung\nBayern Amtsgericht Nürnberg HRB 31018\nJ.L Dienstleistungsbetrieb UG (haftungsbeschränkt) – Nürnberg",
      "type": "Löschungsankündigung",
      "state": "Bayern",
      "amtsgericht": "Amtsgericht Nürnberg",
      "registernummer": "HRB 31018",
      "registerart": "HRB",
      "company_name": "J.L Dienstleistungsbetrieb UG (haftungsbeschränkt)",
      "company_seat": "Nürnberg",
      "details": "08.10.2024 (Bekanntmachungsdatum)\n\nBayern Amtsgericht Nürnberg HRB 31018\nLöschungsankündigung\n\nJ.L Dienstleistungsbetrieb UG (haftungsbeschränkt)\nGesellschaft mit beschränkter Haftung\nNürnberg\n\nDas Registergericht beabsichtigt, die im Handelsregister eingetragene Gesellschaft wegen Vermögenslosigkeit von Amts wegen nach § 394 FamFG zu löschen. Die Frist zur Erhebung eines Widerspruchs ist auf einen Monat festgesetzt."
    },
    {
      "date": "2024-10-08",
      "id": "89587",
      "original_text": "Löschungsankündigung\nNordrhein-Westfalen Amtsgericht Mönchengladbach HRB 6157\nJETV-SMART GmbH – Mönchengladbach",
      "type": "Löschungsankündigung",
      "state": "Nordrhein-Westfalen",
      "amtsgericht": "Amtsgericht Mönchengladbach",
      "registernummer": "HRB 6157",
      "registerart": "HRB",
      "company_name": "JETV-SMART GmbH",
      "company_seat": "Mönchengladbach",
      "details": "08.10.2024 (Bekanntmachungsdatum)\n\nNordrhein-Westfalen Amtsgericht Mönchengladbach HRB 6157\nLöschungsankündigung\n\nJETV-SMART GmbH\nGesellschaft mit beschränkter Haftung\nMönchengladbach\n\nJETV-SMART GmbH, Kyritzer Weg 5, 17329 Krackow, (Amtsgericht Mönchengladbach, HRB 6157).\nDas Registergericht beabsichtigt, die im Handelsregister eingetragene Gesellschaft gemäß § 394 Absatz 1 FamFG wegen Vermögenslosigkeit von Amts wegen zu löschen. Gegen diese Verfügung kann Widerspruch eingelegt werden. Die Frist zur Erhebung eines Widerspruchs gegen die beabsichtigte Löschung von Amts wegen ist auf drei Monate festgesetzt."
    },
    {
      "date": "2024-10-08",
      "id": "89455",
      "original_text": "Registerbekanntmachung nach dem Umwandlungsgesetz\nBayern Amtsgericht München HRA 57332\nJosef Keller GmbH & Co. Verlags-KG – München",
      "type": "Registerbekanntmachung nach dem Umwandlungsgesetz",
      "state": "Bayern",
      "amtsgericht": "Amtsgericht München",
      "registernummer": "HRA 57332",
      "registerart": "HRA",
      "company_name": "Josef Keller GmbH & Co. Verlags-KG",
      "company_seat": "München",
      "details": "08.10.2024 (Bekanntmachungsdatum)\n\nBayern Amtsgericht München HRA 57332\nRegisterbekanntmachung nach dem Umwandlungsgesetz 07.10.2024 (Eintragungsdatum)\n\nJosef Keller GmbH & Co. Verlags-KG\nKommanditgesellschaft\nMünchen\n\nDen Gläubigern der an der Verschmelzung beteiligten Rechtsträger ist, wenn sie binnen sechs Monaten nach dem Tag, an dem die Eintragung der Verschmelzung in das Register des Sitzes desjenigen Rechtsträgers, dessen Gläubiger sie sind, nach § 19 Abs. 3 UmwG als bekannt gemacht gilt, ihren Anspruch nach Grund und Höhe schriftlich anmelden, Sicherheit zu leisten, soweit sie nicht Befriedigung verlangen können. Dieses Recht steht den Gläubigern jedoch nur zu, wenn sie glaubhaft machen, dass durch die Verschmelzung die Erfüllung ihrer Forderung gefährdet wird."
    },
    {
      "date": "2024-10-08",
      "id": "89570",
      "original_text": "Registerbekanntmachung nach dem Umwandlungsgesetz\nNordrhein-Westfalen Amtsgericht Siegburg HRB 18420\nK2 Capital GmbH – Siegburg",
      "type": "Registerbekanntmachung nach dem Umwandlungsgesetz",
      "state": "Nordrhein-Westfalen",
      "amtsgericht": "Amtsgericht Siegburg",
      "registernummer": "HRB 18420",
      "registerart": "HRB",
      "company_name": "K2 Capital GmbH",
      "company_seat": "Siegburg",
      "details": "08.10.2024 (Bekanntmachungsdatum)\n\nNordrhein-Westfalen Amtsgericht Siegburg HRB 18420\nRegisterbekanntmachung nach dem Umwandlungsgesetz 08.10.2024 (Eintragungsdatum)\n\nK2 Capital GmbH\nGesellschaft mit beschränkter Haftung\nSiegburg\n\nDen Gläubigern der an der Ausgliederung beteiligten Rechtsträger ist, wenn sie binnen sechs Monaten nach dem Tag, an dem die Eintragung der Ausgliederung in das Register des Sitzes desjenigen Rechtsträgers, dessen Gläubiger sie sind, nach § 19 Absatz 3 UmwG als bekanntgemacht gilt, ihren Anspruch nach Grund und Höhe schriftlich anmelden, Sicherheit zu leisten, soweit sie nicht Befriedigung verlangen können. Dieses Recht steht den Gläubigern jedoch nur zu, wenn sie glaubhaft machen, dass durch die Ausgliederung die Erfüllung ihrer Forderung gefährdet wird."
    },
    {
      "date": "2024-10-08",
      "id": "89516",
      "original_text": "Löschungsankündigung\nBerlin Amtsgericht Berlin (Charlottenburg) HRB 146671\nKARKI GmbH – Berlin",
      "type": "Löschungsankündigung",
      "state": "Berlin",
      "amtsgericht": "Amtsgericht Berlin (Charlottenburg)",
      "registernummer": "HRB 146671",
      "registerart": "HRB",
      "company_name": "KARKI GmbH",
      "company_seat": "Berlin",
      "details": "08.10.2024 (Bekanntmachungsdatum)\n\nBerlin Amtsgericht Berlin (Charlottenburg) HRB 146671\nLöschungsankündigung\n\nKARKI GmbH\nGesellschaft mit beschränkter Haftung\nBerlin\n\nBei der nachstehenden Gesellschaft wird das Amtslöschungsverfahren gemäß § 394 FamFG eingeleitet. Widerspruchsfrist 6 Wochen"
    },
    {
      "date": "2024-10-08",
      "id": "89430",
      "original_text": "Löschungsankündigung\nBayern Amtsgericht Nürnberg HRB 33437\nKLASSERVICE GmbH – Schwabach",
      "type": "Löschungsankündigung",
      "state": "Bayern",
      "amtsgericht": "Amtsgericht Nürnberg",
      "registernummer": "HRB 33437",
      "registerart": "HRB",
      "company_name": "KLASSERVICE GmbH",
      "company_seat": "Schwabach",
      "details": "08.10.2024 (Bekanntmachungsdatum)\n\nBayern Amtsgericht Nürnberg HRB 33437\nLöschungsankündigung\n\nKLASSERVICE GmbH\nGesellschaft mit beschränkter Haftung\nSchwabach\n\nDas Registergericht beabsichtigt, die im Handelsregister eingetragene Gesellschaft wegen Vermögenslosigkeit von Amts wegen nach § 394 FamFG zu löschen. Die Frist zur Erhebung eines Widerspruchs ist auf einen Monat festgesetzt."
    },
    {
      "date": "2024-10-08",
      "id": "89479",
      "original_text": "Löschungsankündigung\nBaden-Württemberg Amtsgericht Mannheim HRB 8254\nKaufmann Schlosserei und Metallbau GmbH – Mannheim",
      "type": "Löschungsankündigung",
      "state": "Baden-Württemberg",
      "amtsgericht": "Amtsgericht Mannheim",
      "registernummer": "HRB 8254",
      "registerart": "HRB",
      "company_name": "Kaufmann Schlosserei und Metallbau GmbH",
      "company_seat": "Mannheim",
      "details": "08.10.2024 (Bekanntmachungsdatum)\n\nBaden-Württemberg Amtsgericht Mannheim HRB 8254\nLöschungsankündigung 08.10.2024 (Eintragungsdatum)\n\nKaufmann Schlosserei und Metallbau GmbH\nGesellschaft mit beschränkter Haftung\nMannheim\n\nDas Gericht beabsichtigt, die Gesellschaft wegen Vermögenslosigkeit im Handelsregister von Amts wegen nach § 394 FamFG zu löschen. Die Frist zur Geltendmachung eines Widerspruchs gegen die beabsichtigte Löschung ist auf einen Monat ab Veröffentlichung bestimmt."
    },
    {
      "date": "2024-10-08",
      "id": "89574",
      "original_text": "Registerbekanntmachung nach dem Umwandlungsgesetz\nNordrhein-Westfalen Amtsgericht Aachen HRA 9759\nKemper Mobility e.K. – Eschweiler",
      "type": "Registerbekanntmachung nach dem Umwandlungsgesetz",
      "state": "Nordrhein-Westfalen",
      "amtsgericht": "Amtsgericht Aachen",
      "registernummer": "HRA 9759",
      "registerart": "HRA",
      "company_name": "Kemper Mobility e.K.",
      "company_seat": "Eschweiler",
      "details": "08.10.2024 (Bekanntmachungsdatum)\n\nNordrhein-Westfalen Amtsgericht Aachen HRA 9759\nRegisterbekanntmachung nach dem Umwandlungsgesetz 08.10.2024 (Eintragungsdatum)\n\nKemper Mobility e.K.\nEinzelkaufmann / Einzelkauffrau\nEschweiler\n\nDen Gläubigern der an der Ausgliederung beteiligten Rechtsträger ist, wenn sie binnen sechs Monaten nach dem Tag, an dem die Eintragung der Ausgliederung in das Register des Sitzes desjenigen Rechtsträgers, dessen Gläubiger sie sind, nach § 19 Absatz 3 UmwG als bekanntgemacht gilt, ihren Anspruch nach Grund und Höhe schriftlich anmelden, Sicherheit zu leisten, soweit sie nicht Befriedigung verlangen können. Dieses Recht steht den Gläubigern jedoch nur zu, wenn sie glaubhaft machen, dass durch die Ausgliederung die Erfüllung ihrer Forderung gefährdet wird."
    },
    {
      "date": "2024-10-08",
      "id": "89549",
      "original_text": "Sonstige Registerbekanntmachung\nSachsen Amtsgericht Leipzig HRB 3775\nKommunale Wasserwerke Leipzig GmbH – Leipzig",
      "type": "Sonstige Registerbekanntmachung",
      "state": "Sachsen",
      "amtsgericht": "Amtsgericht Leipzig",
      "registernummer": "HRB 3775",
      "registerart": "HRB",
      "company_name": "Kommunale Wasserwerke Leipzig GmbH",
      "company_seat": "Leipzig",
      "details": "08.10.2024 (Bekanntmachungsdatum)\n\nSachsen Amtsgericht Leipzig HRB 3775\nSonstige Registerbekanntmachung\n\nKommunale Wasserwerke Leipzig GmbH\nGesellschaft mit beschränkter Haftung\nLeipzig\n\nAm 04.10.2024 wurde beim Handelsregister des Amtsgerichts Leipzig die Liste der Mitglieder des Aufsichtsrats gemäß § 52 GmbHG eingereicht."
    },
    {
      "date": "2024-10-08",
      "id": "89437",
      "original_text": "Einreichung neuer Dokumente\nBayern Amtsgericht Landshut HRB 8036\nKrtek13 AG – Landshut",
      "type": "Einreichung neuer Dokumente",
      "state": "Bayern",
      "amtsgericht": "Amtsgericht Landshut",
      "registernummer": "HRB 8036",
      "registerart": "HRB",
      "company_name": "Krtek13 AG",
      "company_seat": "Landshut",
      "details": "08.10.2024 (Bekanntmachungsdatum)\n\nBayern Amtsgericht Landshut HRB 8036\nEinreichung neuer Dokumente\n\nKrtek13 AG\nAktiengesellschaft\nLandshut\n\nDem Amtsgericht Landshut -Registergericht- ist eine Liste der Mitglieder des Aufsichtsrats eingereicht worden, § 106 AktG."
    },
    {
      "date": "2024-10-08",
      "id": "89488",
      "original_text": "Registerbekanntmachung nach dem Umwandlungsgesetz\nBrandenburg Amtsgericht Frankfurt/Oder HRB 3274\nKrüger Wasserhochdrucktechnik GmbH – Neuenhagen bei Berlin",
      "type": "Registerbekanntmachung nach dem Umwandlungsgesetz",
      "state": "Brandenburg",
      "amtsgericht": "Amtsgericht Frankfurt/Oder",
      "registernummer": "HRB 3274",
      "registerart": "HRB",
      "company_name": "Krüger Wasserhochdrucktechnik GmbH",
      "company_seat": "Neuenhagen bei Berlin",
      "details": "08.10.2024 (Bekanntmachungsdatum)\n\nBrandenburg Amtsgericht Frankfurt/Oder HRB 3274\nRegisterbekanntmachung nach dem Umwandlungsgesetz 07.10.2024 (Eintragungsdatum)\n\nKrüger Wasserhochdrucktechnik GmbH\nGesellschaft mit beschränkter Haftung\nNeuenhagen bei Berlin\n\nZu Eintragungsnummer 5 vom 07.10.2024 wird als nicht eingetragen veröffentlicht: Als nicht eingetragen wird veröffentlicht:\nDen Gläubigern der an der Verschmelzung beteiligten Rechtsträger ist, wenn sie binnen sechs Monaten nach dem Tag, an dem die Eintragung der Verschmelzung in das Register des Sitzes desjenigen Rechtsträgers, dessen Gläubiger sie sind, als bekannt gemacht gilt, ihren Anspruch nach Grund und Höhe schriftlich anmelden, Sicherheit zu leisten, soweit sie nicht Befriedigung verlangen können. Dieses Recht steht den Gläubigern jedoch nur zu, wenn sie glaubhaft machen, dass durch die Verschmelzung die Erfüllung ihrer Forderung gefährdet wird"
    },
    {
      "date": "2024-10-08",
      "id": "89507",
      "original_text": "Registerbekanntmachung nach dem Umwandlungsgesetz\nHamburg Amtsgericht Hamburg HRB 141606\nKörber Technologies GmbH – Hamburg",
      "type": "Registerbekanntmachung nach dem Umwandlungsgesetz",
      "state": "Hamburg",
      "amtsgericht": "Amtsgericht Hamburg",
      "registernummer": "HRB 141606",
      "registerart": "HRB",
      "company_name": "Körber Technologies GmbH",
      "company_seat": "Hamburg",
      "details": "08.10.2024 (Bekanntmachungsdatum)\n\nHamburg Amtsgericht Hamburg HRB 141606\nRegisterbekanntmachung nach dem Umwandlungsgesetz 25.09.2024 (Eintragungsdatum)\n\nKörber Technologies GmbH\nGesellschaft mit beschränkter Haftung\nHamburg\n\nAls nicht eingetragen wird bekannt gemacht:\nDen Gläubigern der an der Abspaltung beteiligten Gesellschaften ist, wenn sie binnen sechs Monaten nach dem Tag, an dem die Eintragung der Abspaltung in das Register des Sitzes derjenigen Rechtsträger deren Gläubiger sie sind, nach § 19 Absatz 3 UmwG als bekannt gemacht gilt, ihren Anspruch nach Grund und Höhe schriftlich anmelden, Sicherheit zu leisten, soweit sie nicht Befriedigung verlangen können. Dieses Recht steht den Gläubigern jedoch nur zu, wenn sie glaubhaft machen, dass durch die Abspaltung die Erfüllung ihrer Forderung gefährdet wird."
    },
    {
      "date": "2024-10-08",
      "id": "89533",
      "original_text": "Registerbekanntmachung nach dem Umwandlungsgesetz\nBrandenburg Amtsgericht Frankfurt/Oder HRB 607\nLINPAC Packaging Rigid GmbH – Beeskow",
      "type": "Registerbekanntmachung nach dem Umwandlungsgesetz",
      "state": "Brandenburg",
      "amtsgericht": "Amtsgericht Frankfurt/Oder",
      "registernummer": "HRB 607",
      "registerart": "HRB",
      "company_name": "LINPAC Packaging Rigid GmbH",
      "company_seat": "Beeskow",
      "details": "08.10.2024 (Bekanntmachungsdatum)\n\nBrandenburg Amtsgericht Frankfurt/Oder HRB 607\nRegisterbekanntmachung nach dem Umwandlungsgesetz 07.10.2024 (Eintragungsdatum)\n\nLINPAC Packaging Rigid GmbH\nGesellschaft mit beschränkter Haftung\nBeeskow\n\nZu Eintragungsnummer 23 vom 07.10.2024 wird als nicht eingetragen veröffentlicht:\nDen Gläubigern der an der Verschmelzung beteiligten Rechtsträger ist, wenn sie binnen sechs Monaten nach dem Tag, an dem die Eintragung der Verschmelzung in das Register des Sitzes desjenigen Rechtsträgers, dessen Gläubiger sie sind, als bekannt gemacht gilt, ihren Anspruch nach Grund und Höhe schriftlich anmelden, Sicherheit zu leisten, soweit sie nicht Befriedigung verlangen können. Dieses Recht steht den Gläubigern jedoch nur zu, wenn sie glaubhaft machen, dass durch die Verschmelzung die Erfüllung ihrer Forderung gefährdet wird."
    },
    {
      "date": "2024-10-08",
      "id": "89539",
      "original_text": "Registerbekanntmachung nach dem Umwandlungsgesetz\nBrandenburg Amtsgericht Potsdam HRB 27663\nLWV LebensWerk Versicherungsmakler UG (haftungsbeschränkt) – Wusterwitz",
      "type": "Registerbekanntmachung nach dem Umwandlungsgesetz",
      "state": "Brandenburg",
      "amtsgericht": "Amtsgericht Potsdam",
      "registernummer": "HRB 27663",
      "registerart": "HRB",
      "company_name": "LWV LebensWerk Versicherungsmakler UG (haftungsbeschränkt)",
      "company_seat": "Wusterwitz",
      "details": "08.10.2024 (Bekanntmachungsdatum)\n\nBrandenburg Amtsgericht Potsdam HRB 27663\nRegisterbekanntmachung nach dem Umwandlungsgesetz 07.10.2024 (Eintragungsdatum)\n\nLWV LebensWerk Versicherungsmakler UG (haftungsbeschränkt)\nGesellschaft mit beschränkter Haftung\nWusterwitz\n\nZu Eintragungsnummer 3 vom 07.10.2024 wird als nicht eingetragen veröffentlicht: Den Gläubigern der an der Verschmelzung beteiligten Rechtsträger ist, wenn sie binnen sechs Monaten nach dem Tag, an dem die Eintragung der Verschmelzung in das Register des Sitzes desjenigen Rechtsträgers, dessen Gläubiger sie sind, als bekannt gemacht gilt, ihren Anspruch nach Grund und Höhe schriftlich anmelden, Sicherheit zu leisten, soweit sie nicht Befriedigung verlangen können. Dieses Recht steht den Gläubigern jedoch nur zu, wenn sie glaubhaft machen, dass durch die Verschmelzung die Erfüllung ihrer Forderung gefährdet wird."
    },
    {
      "date": "2024-10-08",
      "id": "89606",
      "original_text": "Löschungsankündigung\nNordrhein-Westfalen Amtsgericht Gelsenkirchen HRB 4456\nLanfermann Security Service GmbH – Bottrop",
      "type": "Löschungsankündigung",
      "state": "Nordrhein-Westfalen",
      "amtsgericht": "Amtsgericht Gelsenkirchen",
      "registernummer": "HRB 4456",
      "registerart": "HRB",
      "company_name": "Lanfermann Security Service GmbH",
      "company_seat": "Bottrop",
      "details": "08.10.2024 (Bekanntmachungsdatum)\n\nNordrhein-Westfalen Amtsgericht Gelsenkirchen HRB 4456\nLöschungsankündigung\n\nLanfermann Security Service GmbH\nGesellschaft mit beschränkter Haftung\nBottrop\n\nDas Gericht beabsichtigt, die Lanfermann Security Service GmbH mit Sitz in Bottrop, HRB 4456, Amtsgericht Gelsenkirchen, wegen Vermögenslosigkeit zu löschen.\nHiermit wird denjenigen, die an der Unterlassung der Löschung ein berechtigtes Interesse haben, gem. § 394 Abs. 2 FamFG Gelegenheit gegeben, gegen dieses Vorhaben binnen eines Monats nach dieser Bekanntmachung Widerspruch einzulegen. Der Widerspruch kann schriftlich oder zu Protokoll der Geschäftsstelle erhoben werden."
    },
    {
      "date": "2024-10-08",
      "id": "89556",
      "original_text": "Einreichung neuer Dokumente\nSachsen Amtsgericht Dresden HRB 4815\nLausitzer Werkstätten gGmbH – Hoyerswerda",
      "type": "Einreichung neuer Dokumente",
      "state": "Sachsen",
      "amtsgericht": "Amtsgericht Dresden",
      "registernummer": "HRB 4815",
      "registerart": "HRB",
      "company_name": "Lausitzer Werkstätten gGmbH",
      "company_seat": "Hoyerswerda",
      "details": "08.10.2024 (Bekanntmachungsdatum)\n\nSachsen Amtsgericht Dresden HRB 4815\nEinreichung neuer Dokumente\n\nLausitzer Werkstätten gGmbH\nGesellschaft mit beschränkter Haftung\nHoyerswerda\n\nAm 07.10.2024 wurde beim Handelsregister des Amtsgerichts Dresden die Liste der Mitglieder des Aufsichtsrats gemäß § 52 GmbHG eingereicht."
    },
    {
      "date": "2024-10-08",
      "id": "89575",
      "original_text": "Löschungsankündigung\nNordrhein-Westfalen Amtsgericht Düsseldorf HRB 75864\nLionstarter GmbH – Düsseldorf",
      "type": "Löschungsankündigung",
      "state": "Nordrhein-Westfalen",
      "amtsgericht": "Amtsgericht Düsseldorf",
      "registernummer": "HRB 75864",
      "registerart": "HRB",
      "company_name": "Lionstarter GmbH",
      "company_seat": "Düsseldorf",
      "details": "08.10.2024 (Bekanntmachungsdatum)\n\nNordrhein-Westfalen Amtsgericht Düsseldorf HRB 75864\nLöschungsankündigung\n\nLionstarter GmbH\nGesellschaft mit beschränkter Haftung\nDüsseldorf\n\nDas Registergericht beabsichtigt die Gesellschaft von Amts wegen nach § 394 FamFG zu löschen. Die Frist zur Erhebung eines Widerspruchs ist auf 3 Wochen festgesetzt.\n\nRechtsbehelfsbelehrung:\nDas Widerspruchsrecht steht jedem zu, der an der Unterlassung der Löschung ein berechtigtes Interesse hat. Der Widerspruch ist bei dem Amtsgericht Düsseldorf -Registergericht-, Werdener Straße 1, 40227 Düsseldorf schriftlich in deutscher Sprache oder zur Niederschrift der Geschäftsstelle einzulegen. Der Widerspruch kann auch zur Niederschrift der Geschäftsstelle eines jeden Amtsgerichtes abgegeben werden. Die Einlegung ist auch durch Übertragung eines elektronischen Dokuments an die elektronische Poststelle des Gerichts möglich. Das elektronische Dokument muss für die Bearbeitung durch das Gericht geeignet und mit einer qualifizierten elektronischen Signatur der verantwortenden Person versehen sein oder von der verantwortenden Person signiert und auf einem sicheren Übermittlungsweg gemäß § 130a ZPO nach näherer Maßgabe der Verordnung über die technischen Rahmenbedingungen des elektronischen Rechtsverkehrs und über das besondere elektronische Behördenpostfach (BGBl. I, S.3803) eingereicht werden. Weitere Informationen erhalten Sie auf der Internetseite www.justiz.de.\nDer Widerspruch muss spätestens innerhalb der gesetzten Frist nach dem Datum der Bekanntmachung der Löschungsankündigung bei dem Amtsgericht - Registergericht - Düsseldorf eingegangen sein.  Dies gilt auch dann, wenn der Widerspruch zur Niederschrift der Geschäftsstelle eines anderen Amtsgerichtes abgegeben wurde. Die Frist beginnt mit dem Tage der Bekanntmachung der Löschungsankündigung in dem für die Bekanntmachung der Eintragungen in das Handelsregister bestimmten elektronischen Informations- und Kommunikationssystem nach § 10 des Handelsgesetzbuches. Fällt das Ende der Frist auf einen Sonntag, einen allgemeinen Feiertag oder Sonnabend, so endet die Frist mit Ablauf des nächsten Werktages.\nDer Widerspruch muss die Bezeichnung der angefochtenen Löschungsankündigung sowie die Erklärung enthalten, dass Widerspruch gegen diese Löschungsankündigung eingelegt wird. Er ist zu unterzeichnen und soll begründet werden."
    },
    {
      "date": "2024-10-08",
      "id": "89511",
      "original_text": "Registerbekanntmachung nach dem Umwandlungsgesetz\nThüringen Amtsgericht Jena HRB 517225\nLuminez GmbH – Saalfeld/Saale",
      "type": "Registerbekanntmachung nach dem Umwandlungsgesetz",
      "state": "Thüringen",
      "amtsgericht": "Amtsgericht Jena",
      "registernummer": "HRB 517225",
      "registerart": "HRB",
      "company_name": "Luminez GmbH",
      "company_seat": "Saalfeld/Saale",
      "details": "08.10.2024 (Bekanntmachungsdatum)\n\nThüringen Amtsgericht Jena HRB 517225\nRegisterbekanntmachung nach dem Umwandlungsgesetz 08.10.2024 (Eintragungsdatum)\n\nLuminez GmbH\nGesellschaft mit beschränkter Haftung\nSaalfeld/Saale\n\nNicht eingetragen: Den Gläubigern der an der Verschmelzung beteiligten Rechtsträger, ist wenn sie binnen sechs Monaten nach dem Tag, an dem die Eintragung der Verschmelzung in das Register des Sitzes desjenigen Rechtsträgers, dessen Gläubiger sie sind,  nach § 19 Abs. 3 UmwG als bekanntgemacht gilt, ihren Anspruch nach Grund und Höhe schriftlich anmelden, Sicherheit zu leisten, soweit sie nicht Befriedigung verlangen können. Dieses Recht steht ihnen jedoch nur zu, wenn sie glaubhaft machen, daß durch die Verschmelzung die Erfüllung ihrer Forderung gefährdet wird."
    },
    {
      "date": "2024-10-08",
      "id": "89608",
      "original_text": "Löschungsankündigung\nNordrhein-Westfalen Amtsgericht Siegburg HRB 13098\nMC-Bau GmbH – Hennef (Sieg)",
      "type": "Löschungsankündigung",
      "state": "Nordrhein-Westfalen",
      "amtsgericht": "Amtsgericht Siegburg",
      "registernummer": "HRB 13098",
      "registerart": "HRB",
      "company_name": "MC-Bau GmbH",
      "company_seat": "Hennef (Sieg)",
      "details": "08.10.2024 (Bekanntmachungsdatum)\n\nNordrhein-Westfalen Amtsgericht Siegburg HRB 13098\nLöschungsankündigung\n\nMC-Bau GmbH\nGesellschaft mit beschränkter Haftung\nHennef (Sieg)\n\nDas Registergericht hat glaubhafte Kenntnis erlangt, dass die Gesellschaft vermögenslos geworden ist, da ein Insolvenzverfahren durchgeführt und nach § 200 InsO aufgehoben wurde.\n\nEs ist daher beabsichtigt, die Gesellschaft nach § 394 FamFG im Handelsregister wegen Vermögenslosigkeit zu löschen.\nEinwände gegen die Löschung sind durch Widerspruch binnen einer Frist von 3 Monaten geltend zu machen, andernfalls die Löschung erfolgen wird.\n\nEinzulegen ist der Widerspruch bei dem Amtsgericht Siegburg, Neue Poststraße 16, 53721 Siegburg, und zwar entweder schriftlich in deutscher Sprache oder mündlich zur Niederschrift der Geschäftsstelle. Der Widerspruch kann auch zur Niederschrift der Geschäftsstelle eines jeden Amtsgerichts abgegeben werden. Der Widerspruch ist binnen der in der Verfügung bestimmten Frist einzulegen. Die Frist ist nur gewahrt, wenn der Widerspruch rechtzeitig bei dem Amtsgericht Siegburg eingeht, auch wenn der Widerspruch zur Niederschrift der Geschäftsstelle eines anderen Amtsgerichts abgegeben wurde. Die Frist beginnt jeweils mit der schriftlichen Bekanntgabe der Verfügung an die Beteiligten. Kann die schriftliche Bekanntgabe an einen Beteiligten nicht bewirkt werden, beginnt die Frist spätestens mit Ablauf von fünf Monaten nach Erlass der Verfügung. Die Bekanntgabe ist entweder durch Zustellung oder am dritten Tage nach Aufgabe zur Post bewirkt. Sofern die Löschung noch nicht erfolgt ist, kann der Widerspruch auch noch nach Ablauf der Frist eingelegt werden. Fällt das Ende der Frist auf einen Sonnabend, einen Sonntag oder einen allgemeinen Feiertag, endet die Frist mit Ablauf des nächsten Werktages. Der Widerspruch ist zu unterzeichnen. Eine Begründung des Widerspruchs ist nicht vorgeschrieben."
    },
    {
      "date": "2024-10-08",
      "id": "89586",
      "original_text": "Registerbekanntmachung nach dem Umwandlungsgesetz\nNordrhein-Westfalen Amtsgericht Köln HRB 76840\nMMC Movies Köln GmbH – Köln",
      "type": "Registerbekanntmachung nach dem Umwandlungsgesetz",
      "state": "Nordrhein-Westfalen",
      "amtsgericht": "Amtsgericht Köln",
      "registernummer": "HRB 76840",
      "registerart": "HRB",
      "company_name": "MMC Movies Köln GmbH",
      "company_seat": "Köln",
      "details": "08.10.2024 (Bekanntmachungsdatum)\n\nNordrhein-Westfalen Amtsgericht Köln HRB 76840\nRegisterbekanntmachung nach dem Umwandlungsgesetz 08.10.2024 (Eintragungsdatum)\n\nMMC Movies Köln GmbH\nGesellschaft mit beschränkter Haftung\nKöln\n\nDen Gläubigern der an der Verschmelzung beteiligten Rechtsträger ist, wenn sie binnen sechs Monaten nach dem Tag, an dem die Eintragung der Verschmelzung in das Register des Sitzes desjenigen Rechtsträgers, dessen Gläubiger sie sind, nach § 19 Absatz 3 UmwG als bekanntgemacht gilt, ihren Anspruch nach Grund und Höhe schriftlich anmelden, Sicherheit zu leisten, soweit sie nicht Befriedigung verlangen können. Dieses Recht steht den Gläubigern jedoch nur zu, wenn sie glaubhaft machen, dass durch die Verschmelzung die Erfüllung ihrer Forderung gefährdet wird."
    },
    {
      "date": "2024-10-08",
      "id": "89595",
      "original_text": "Registerbekanntmachung nach dem Umwandlungsgesetz\nNordrhein-Westfalen Amtsgericht Köln HRB 76840\nMMC Movies Köln GmbH – Köln",
      "type": "Registerbekanntmachung nach dem Umwandlungsgesetz",
      "state": "Nordrhein-Westfalen",
      "amtsgericht": "Amtsgericht Köln",
      "registernummer": "HRB 76840",
      "registerart": "HRB",
      "company_name": "MMC Movies Köln GmbH",
      "company_seat": "Köln",
      "details": "08.10.2024 (Bekanntmachungsdatum)\n\nNordrhein-Westfalen Amtsgericht Köln HRB 76840\nRegisterbekanntmachung nach dem Umwandlungsgesetz 08.10.2024 (Eintragungsdatum)\n\nMMC Movies Köln GmbH\nGesellschaft mit beschränkter Haftung\nKöln\n\nDen Gläubigern der an der Verschmelzung beteiligten Rechtsträger ist, wenn sie binnen sechs Monaten nach dem Tag, an dem die Eintragung der Verschmelzung in das Register des Sitzes desjenigen Rechtsträgers, dessen Gläubiger sie sind, nach § 19 Absatz 3 UmwG als bekanntgemacht gilt, ihren Anspruch nach Grund und Höhe schriftlich anmelden, Sicherheit zu leisten, soweit sie nicht Befriedigung verlangen können. Dieses Recht steht den Gläubigern jedoch nur zu, wenn sie glaubhaft machen, dass durch die Verschmelzung die Erfüllung ihrer Forderung gefährdet wird."
    },
    {
      "date": "2024-10-08",
      "id": "89590",
      "original_text": "Registerbekanntmachung nach dem Umwandlungsgesetz\nNordrhein-Westfalen Amtsgericht Köln HRB 108176\nMMC Production 2 GmbH – Köln",
      "type": "Registerbekanntmachung nach dem Umwandlungsgesetz",
      "state": "Nordrhein-Westfalen",
      "amtsgericht": "Amtsgericht Köln",
      "registernummer": "HRB 108176",
      "registerart": "HRB",
      "company_name": "MMC Production 2 GmbH",
      "company_seat": "Köln",
      "details": "08.10.2024 (Bekanntmachungsdatum)\n\nNordrhein-Westfalen Amtsgericht Köln HRB 108176\nRegisterbekanntmachung nach dem Umwandlungsgesetz 08.10.2024 (Eintragungsdatum)\n\nMMC Production 2 GmbH\nGesellschaft mit beschränkter Haftung\nKöln\n\nDen Gläubigern der an der Verschmelzung beteiligten Rechtsträger ist, wenn sie binnen sechs Monaten nach dem Tag, an dem die Eintragung der Verschmelzung in das Register des Sitzes desjenigen Rechtsträgers, dessen Gläubiger sie sind, nach § 19 Absatz 3 UmwG als bekanntgemacht gilt, ihren Anspruch nach Grund und Höhe schriftlich anmelden, Sicherheit zu leisten, soweit sie nicht Befriedigung verlangen können. Dieses Recht steht den Gläubigern jedoch nur zu, wenn sie glaubhaft machen, dass durch die Verschmelzung die Erfüllung ihrer Forderung gefährdet wird."
    },
    {
      "date": "2024-10-08",
      "id": "89580",
      "original_text": "Registerbekanntmachung nach dem Umwandlungsgesetz\nNordrhein-Westfalen Amtsgericht Köln HRB 108296\nMMC Production 3 GmbH – Köln",
      "type": "Registerbekanntmachung nach dem Umwandlungsgesetz",
      "state": "Nordrhein-Westfalen",
      "amtsgericht": "Amtsgericht Köln",
      "registernummer": "HRB 108296",
      "registerart": "HRB",
      "company_name": "MMC Production 3 GmbH",
      "company_seat": "Köln",
      "details": "08.10.2024 (Bekanntmachungsdatum)\n\nNordrhein-Westfalen Amtsgericht Köln HRB 108296\nRegisterbekanntmachung nach dem Umwandlungsgesetz 08.10.2024 (Eintragungsdatum)\n\nMMC Production 3 GmbH\nGesellschaft mit beschränkter Haftung\nKöln\n\nDen Gläubigern der an der Verschmelzung beteiligten Rechtsträger ist, wenn sie binnen sechs Monaten nach dem Tag, an dem die Eintragung der Verschmelzung in das Register des Sitzes desjenigen Rechtsträgers, dessen Gläubiger sie sind, nach § 19 Absatz 3 UmwG als bekanntgemacht gilt, ihren Anspruch nach Grund und Höhe schriftlich anmelden, Sicherheit zu leisten, soweit sie nicht Befriedigung verlangen können. Dieses Recht steht den Gläubigern jedoch nur zu, wenn sie glaubhaft machen, dass durch die Verschmelzung die Erfüllung ihrer Forderung gefährdet wird."
    },
    {
      "date": "2024-10-08",
      "id": "89492",
      "original_text": "Löschungsankündigung\nSchleswig-Holstein Amtsgericht Flensburg HRA 10924\nMR Personaldienstleistung UG (haftungsbeschränkkt) & Co. KG – Sylt",
      "type": "Löschungsankündigung",
      "state": "Schleswig-Holstein",
      "amtsgericht": "Amtsgericht Flensburg",
      "registernummer": "HRA 10924",
      "registerart": "HRA",
      "company_name": "MR Personaldienstleistung UG (haftungsbeschränkkt) & Co. KG",
      "company_seat": "Sylt",
      "details": "08.10.2024 (Bekanntmachungsdatum)\n\nSchleswig-Holstein Amtsgericht Flensburg HRA 10924\nLöschungsankündigung\n\nMR Personaldienstleistung UG (haftungsbeschränkkt) & Co. KG\nKommanditgesellschaft\nSylt\n\nBei der nachstehenden Firma wird das Amtslöschungsverfahren gemäß § 31 Abs. 2 HGB eingeleitet.\nWiderspruchsfrist: 3 Monate."
    },
    {
      "date": "2024-10-08",
      "id": "89460",
      "original_text": "Sonstige Registerbekanntmachung\nBayern Amtsgericht München HRB 269727\nMVZ Dermatologie Südbayern GmbH – München",
      "type": "Sonstige Registerbekanntmachung",
      "state": "Bayern",
      "amtsgericht": "Amtsgericht München",
      "registernummer": "HRB 269727",
      "registerart": "HRB",
      "company_name": "MVZ Dermatologie Südbayern GmbH",
      "company_seat": "München",
      "details": "08.10.2024 (Bekanntmachungsdatum)\n\nBayern Amtsgericht München HRB 269727\nSonstige Registerbekanntmachung 07.10.2024 (Eintragungsdatum)\n\nMVZ Dermatologie Südbayern GmbH\nGesellschaft mit beschränkter Haftung\nMünchen\n\nDen Gläubigern der Gesellschaft, deren Forderungen begründet worden sind, bevor die Eintragung der Beendigung des Gewinnabführungsvertrages in das Handelsregister nach § 10 des Handelsgesetzbuches als bekanntgemacht gilt, hat der andere Vertragsteil Sicherheit zu leisten, wenn sie sich binnen sechs Monaten nach der Bekanntmachung der Eintragung zu diesem Zweck bei ihm melden."
    },
    {
      "date": "2024-10-08",
      "id": "89465",
      "original_text": "Registerbekanntmachung nach dem Umwandlungsgesetz\nBaden-Württemberg Amtsgericht Stuttgart HRB 761189\nMarelli Stuttgart (Germany) GmbH – Stuttgart",
      "type": "Registerbekanntmachung nach dem Umwandlungsgesetz",
      "state": "Baden-Württemberg",
      "amtsgericht": "Amtsgericht Stuttgart",
      "registernummer": "HRB 761189",
      "registerart": "HRB",
      "company_name": "Marelli Stuttgart (Germany) GmbH",
      "company_seat": "Stuttgart",
      "details": "08.10.2024 (Bekanntmachungsdatum)\n\nBaden-Württemberg Amtsgericht Stuttgart HRB 761189\nRegisterbekanntmachung nach dem Umwandlungsgesetz 08.10.2024 (Eintragungsdatum)\n\nMarelli Stuttgart (Germany) GmbH\nGesellschaft mit beschränkter Haftung\nStuttgart\n\nAls nicht eingetragen wird bekanntgemacht:\nDen Gläubigern der an der Verschmelzung beteiligten Rechtsträger ist, wenn sie binnen sechs Monaten nach dem Tag, an dem die Eintragung der Verschmelzung in das Register des Sitzes desjenigen Rechtsträgers, dessen Gläubiger sie sind, nach § 19 Abs. 3 UmwG als bekanntgemacht gilt, ihren Anspruch nach Grund und Höhe schriftlich anmelden, Sicherheit zu leisten, soweit sie nicht Befriedigung verlangen können. Dieses Recht steht den Gläubigern jedoch nur zu, wenn sie glaubhaft machen, dass durch die Verschmelzung die Erfüllung ihrer Forderung gefährdet wird."
    },
    {
      "date": "2024-10-08",
      "id": "89450",
      "original_text": "Sonstige Registerbekanntmachung\nBayern Amtsgericht München HRB 85433\nMeeting Point International GmbH – München",
      "type": "Sonstige Registerbekanntmachung",
      "state": "Bayern",
      "amtsgericht": "Amtsgericht München",
      "registernummer": "HRB 85433",
      "registerart": "HRB",
      "company_name": "Meeting Point International GmbH",
      "company_seat": "München",
      "details": "08.10.2024 (Bekanntmachungsdatum)\n\nBayern Amtsgericht München HRB 85433\nSonstige Registerbekanntmachung 07.10.2024 (Eintragungsdatum)\n\nMeeting Point International GmbH\nGesellschaft mit beschränkter Haftung\nMünchen\n\nDen Gläubigern der Gesellschaft, deren Forderungen begründet worden sind, bevor die Eintragung der Beendigung des Beherrschungs- und Gewinnabführungsvertrages in das Handelsregister nach § 10 des Handelsgesetzbuches als bekanntgemacht gilt, hat der andere Vertragsteil Sicherheit zu leisten, wenn sie sich binnen sechs Monaten nach der Bekanntmachung der Eintragung zu diesem Zweck bei ihm melden."
    },
    {
      "date": "2024-10-08",
      "id": "89521",
      "original_text": "Sonstige Registerbekanntmachung\nBaden-Württemberg Amtsgericht Stuttgart HRB 759603\nMercedes-Benz High Power Charging Overseas GmbH – Stuttgart",
      "type": "Sonstige Registerbekanntmachung",
      "state": "Baden-Württemberg",
      "amtsgericht": "Amtsgericht Stuttgart",
      "registernummer": "HRB 759603",
      "registerart": "HRB",
      "company_name": "Mercedes-Benz High Power Charging Overseas GmbH",
      "company_seat": "Stuttgart",
      "details": "08.10.2024 (Bekanntmachungsdatum)\n\nBaden-Württemberg Amtsgericht Stuttgart HRB 759603\nSonstige Registerbekanntmachung 08.10.2024 (Eintragungsdatum)\n\nMercedes-Benz High Power Charging Overseas GmbH\nGesellschaft mit beschränkter Haftung\nStuttgart\n\nAls nicht eingetragen wird bekanntgemacht:\nDen Gläubigern der Gesellschaft, deren Forderungen begründet worden sind, bevor die Eintragung der Beendigung des Vertrages in das Handelsregister nach § 10 HGB als bekanntgemacht gilt, ist vom anderen Vertragsteil Sicherheit zu leisten, wenn sie sich binnen sechs Monaten nach der Bekanntmachung zu diesem Zweck bei ihm melden."
    },
    {
      "date": "2024-10-08",
      "id": "89551",
      "original_text": "Löschungsankündigung\nSachsen Amtsgericht Dresden HRB 3116\nMetall- und Fahrzeugbau Haser GmbH – Riesa",
      "type": "Löschungsankündigung",
      "state": "Sachsen",
      "amtsgericht": "Amtsgericht Dresden",
      "registernummer": "HRB 3116",
      "registerart": "HRB",
      "company_name": "Metall- und Fahrzeugbau Haser GmbH",
      "company_seat": "Riesa",
      "details": "08.10.2024 (Bekanntmachungsdatum)\n\nSachsen Amtsgericht Dresden HRB 3116\nLöschungsankündigung\n\nMetall- und Fahrzeugbau Haser GmbH\nGesellschaft mit beschränkter Haftung\nRiesa\n\nDas Registergericht beabsichtigt, die im Handelsregister eingetragene Gesellschaft von Amts wegen nach § 394 FamFG zu löschen. Die Frist zu Erhebung eines Widerspruchs gegen die beabsichtigte Löschung wird auf einen Monat festgesetzt."
    },
    {
      "date": "2024-10-08",
      "id": "89519",
      "original_text": "Löschungsankündigung\nBerlin Amtsgericht Berlin (Charlottenburg) HRB 118814\nMission Berlin Real Estate GmbH – Berlin",
      "type": "Löschungsankündigung",
      "state": "Berlin",
      "amtsgericht": "Amtsgericht Berlin (Charlottenburg)",
      "registernummer": "HRB 118814",
      "registerart": "HRB",
      "company_name": "Mission Berlin Real Estate GmbH",
      "company_seat": "Berlin",
      "details": "08.10.2024 (Bekanntmachungsdatum)\n\nBerlin Amtsgericht Berlin (Charlottenburg) HRB 118814\nLöschungsankündigung\n\nMission Berlin Real Estate GmbH\nGesellschaft mit beschränkter Haftung\nBerlin\n\nBei der nachstehenden Gesellschaft wird das Amtslöschungsverfahren gemäß § 394 FamFG eingeleitet. Widerspruchsfrist 6 Wochen"
    },
    {
      "date": "2024-10-08",
      "id": "89523",
      "original_text": "Einreichung neuer Dokumente\nSachsen-Anhalt Amtsgericht Stendal HRB 114723\nMitteldeutsche Capital Management Aktiengesellschaft – Magdeburg",
      "type": "Einreichung neuer Dokumente",
      "state": "Sachsen-Anhalt",
      "amtsgericht": "Amtsgericht Stendal",
      "registernummer": "HRB 114723",
      "registerart": "HRB",
      "company_name": "Mitteldeutsche Capital Management Aktiengesellschaft",
      "company_seat": "Magdeburg",
      "details": "08.10.2024 (Bekanntmachungsdatum)\n\nSachsen-Anhalt Amtsgericht Stendal HRB 114723\nEinreichung neuer Dokumente\n\nMitteldeutsche Capital Management Aktiengesellschaft\nAktiengesellschaft\nMagdeburg\n\nEine Liste der Mitglieder des Aufsichtsrates wurde zum Handelsregister eingereicht."
    },
    {
      "date": "2024-10-08",
      "id": "89592",
      "original_text": "Registerbekanntmachung nach dem Umwandlungsgesetz\nNordrhein-Westfalen Amtsgericht Siegburg HRB 18053\nMohallik Dach GmbH – Hennef",
      "type": "Registerbekanntmachung nach dem Umwandlungsgesetz",
      "state": "Nordrhein-Westfalen",
      "amtsgericht": "Amtsgericht Siegburg",
      "registernummer": "HRB 18053",
      "registerart": "HRB",
      "company_name": "Mohallik Dach GmbH",
      "company_seat": "Hennef",
      "details": "08.10.2024 (Bekanntmachungsdatum)\n\nNordrhein-Westfalen Amtsgericht Siegburg HRB 18053\nRegisterbekanntmachung nach dem Umwandlungsgesetz 08.10.2024 (Eintragungsdatum)\n\nMohallik Dach GmbH\nGesellschaft mit beschränkter Haftung\nHennef\n\nDen Gläubigern der an der Ausgliederung beteiligten Rechtsträger ist, wenn sie binnen sechs Monaten nach dem Tag, an dem die Eintragung der Ausgliederung in das Register des Sitzes desjenigen Rechtsträgers, dessen Gläubiger sie sind, nach § 19 Absatz 3 UmwG als bekanntgemacht gilt, ihren Anspruch nach Grund und Höhe schriftlich anmelden, Sicherheit zu leisten, soweit sie nicht Befriedigung verlangen können. Dieses Recht steht den Gläubigern jedoch nur zu, wenn sie glaubhaft machen, dass durch die Ausgliederung die Erfüllung ihrer Forderung gefährdet wird."
    },
    {
      "date": "2024-10-08",
      "id": "89559",
      "original_text": "Registerbekanntmachung nach dem Umwandlungsgesetz\nNiedersachsen Amtsgericht Stadthagen HRB 201839\nMühlenresidenz GmbH – Rinteln",
      "type": "Registerbekanntmachung nach dem Umwandlungsgesetz",
      "state": "Niedersachsen",
      "amtsgericht": "Amtsgericht Stadthagen",
      "registernummer": "HRB 201839",
      "registerart": "HRB",
      "company_name": "Mühlenresidenz GmbH",
      "company_seat": "Rinteln",
      "details": "08.10.2024 (Bekanntmachungsdatum)\n\nNiedersachsen Amtsgericht Stadthagen HRB 201839\nRegisterbekanntmachung nach dem Umwandlungsgesetz 07.10.2024 (Eintragungsdatum)\n\nMühlenresidenz GmbH\nGesellschaft mit beschränkter Haftung\nRinteln\n\nDen Gläubigern der an der Verschmelzung beteiligten Rechtsträger ist, wenn sie binnen sechs Monaten nach dem Tag, an dem die Eintragung der Verschmelzung in das Register des Sitzes desjenigen Rechtsträgers, dessen Gläubiger sie sind, nach § 19  Abs.  3 UmwG als bekannt gemacht gilt, ihren Anspruch nach Grund und Höhe schriftlich anmelden, Sicherheit zu leisten, soweit sie nicht Befriedigung verlangen können. Dieses Recht steht den Gläubigern jedoch nur zu, wenn sie glaubhaft machen, dass durch die Verschmelzung die Erfüllung der Forderung gefährdet wird."
    },
    {
      "date": "2024-10-08",
      "id": "89452",
      "original_text": "Einreichung neuer Dokumente\nBayern Amtsgericht München HRB 193028\nNIXDORF Kapital AG – München",
      "type": "Einreichung neuer Dokumente",
      "state": "Bayern",
      "amtsgericht": "Amtsgericht München",
      "registernummer": "HRB 193028",
      "registerart": "HRB",
      "company_name": "NIXDORF Kapital AG",
      "company_seat": "München",
      "details": "08.10.2024 (Bekanntmachungsdatum)\n\nBayern Amtsgericht München HRB 193028\nEinreichung neuer Dokumente 07.10.2024 (Eintragungsdatum)\n\nNIXDORF Kapital AG\nAktiengesellschaft\nMünchen\n\nDem Amtsgericht München -Registergericht- ist eine Liste der Mitglieder des Aufsichtsrats eingereicht worden, § 106 AktG."
    },
    {
      "date": "2024-10-08",
      "id": "89578",
      "original_text": "Löschungsankündigung\nNordrhein-Westfalen Amtsgericht Wuppertal HRB 29534\nNT Logistic GmbH – Remscheid",
      "type": "Löschungsankündigung",
      "state": "Nordrhein-Westfalen",
      "amtsgericht": "Amtsgericht Wuppertal",
      "registernummer": "HRB 29534",
      "registerart": "HRB",
      "company_name": "NT Logistic GmbH",
      "company_seat": "Remscheid",
      "details": "08.10.2024 (Bekanntmachungsdatum)\n\nNordrhein-Westfalen Amtsgericht Wuppertal HRB 29534\nLöschungsankündigung\n\nNT Logistic GmbH\nGesellschaft mit beschränkter Haftung\nRemscheid\n\nDas Registergericht beabsichtigt die Gesellschaft von Amts wegen nach § 394 FamFG zu löschen. Die Frist zur Erhebung eines Widerspruchs ist auf einen Monat festgesetzt."
    },
    {
      "date": "2024-10-08",
      "id": "89564",
      "original_text": "Registerbekanntmachung nach dem Umwandlungsgesetz\nNiedersachsen Amtsgericht Oldenburg (Oldenburg) HRA 207913\nNord. Izci & Meinert Industrial Consulting oHG – Oldenburg",
      "type": "Registerbekanntmachung nach dem Umwandlungsgesetz",
      "state": "Niedersachsen",
      "amtsgericht": "Amtsgericht Oldenburg (Oldenburg)",
      "registernummer": "HRA 207913",
      "registerart": "HRA",
      "company_name": "Nord. Izci & Meinert Industrial Consulting oHG",
      "company_seat": "Oldenburg",
      "details": "08.10.2024 (Bekanntmachungsdatum)\n\nNiedersachsen Amtsgericht Oldenburg (Oldenburg) HRA 207913\nRegisterbekanntmachung nach dem Umwandlungsgesetz 08.10.2024 (Eintragungsdatum)\n\nNord. Izci & Meinert Industrial Consulting oHG\nOffene Handelsgesellschaft\nOldenburg\n\nDen Gläubigern der an der formwechselnden Umwandlung beteiligten Rechtsträger ist, wenn sie binnen sechs Monaten nach dem Tag, an dem die Eintragung der Umwandlung in das Register des Sitzes desjenigen Rechtsträgers, dessen Gläubiger sie sind, nach § 19 Abs. 3 UmwG als bekannt gemacht gilt, ihren Anspruch nach Grund und Höhe schriftlich anmelden, Sicherheit zu leisten, soweit sie nicht Befriedigung verlangen können. Dieses Recht steht den Gläubigern jedoch nur zu, wenn sie glaubhaft machen, dass durch die formwechselnde Umwandlung die Erfüllung der Forderung gefährdet wird."
    },
    {
      "date": "2024-10-08",
      "id": "89494",
      "original_text": "Registerbekanntmachung nach dem Umwandlungsgesetz\nBaden-Württemberg Amtsgericht Mannheim HRB 9888\nNordic Beteiligungs GmbH – Mannheim",
      "type": "Registerbekanntmachung nach dem Umwandlungsgesetz",
      "state": "Baden-Württemberg",
      "amtsgericht": "Amtsgericht Mannheim",
      "registernummer": "HRB 9888",
      "registerart": "HRB",
      "company_name": "Nordic Beteiligungs GmbH",
      "company_seat": "Mannheim",
      "details": "08.10.2024 (Bekanntmachungsdatum)\n\nBaden-Württemberg Amtsgericht Mannheim HRB 9888\nRegisterbekanntmachung nach dem Umwandlungsgesetz 08.10.2024 (Eintragungsdatum)\n\nNordic Beteiligungs GmbH\nGesellschaft mit beschränkter Haftung\nMannheim\n\nAls nicht eingetragen wird bekanntgemacht:\nDen Gläubigern der an der Verschmelzung beteiligten Rechtsträger ist, wenn sie binnen sechs Monaten nach dem Tag, an dem die Eintragung der Verschmelzung in das Register des Sitzes desjenigen Rechtsträgers, dessen Gläubiger sie sind, nach § 19 Abs. 3 UmwG als bekanntgemacht gilt, ihren Anspruch nach Grund und Höhe schriftlich anmelden, Sicherheit zu leisten, soweit sie nicht Befriedigung verlangen können. Dieses Recht steht den Gläubigern jedoch nur zu, wenn sie glaubhaft machen, dass durch die Verschmelzung die Erfüllung ihrer Forderung gefährdet wird."
    },
    {
      "date": "2024-10-08",
      "id": "89496",
      "original_text": "Löschungsankündigung\nBaden-Württemberg Amtsgericht Stuttgart HRB 282116\nOMNILAS GmbH – Plüderhausen",
      "type": "Löschungsankündigung",
      "state": "Baden-Württemberg",
      "amtsgericht": "Amtsgericht Stuttgart",
      "registernummer": "HRB 282116",
      "registerart": "HRB",
      "company_name": "OMNILAS GmbH",
      "company_seat": "Plüderhausen",
      "details": "08.10.2024 (Bekanntmachungsdatum)\n\nBaden-Württemberg Amtsgericht Stuttgart HRB 282116\nLöschungsankündigung\n\nOMNILAS GmbH\nGesellschaft mit beschränkter Haftung\nPlüderhausen\n\nAls nicht eingetragen wird bekanntgemacht:\nDas Gericht beabsichtigt, die Gesellschaft wegen Vermögenslosigkeit im Handelsregister von Amts wegen nach § 394 FamFG zu löschen. Die Frist zur Geltendmachung eines Widerspruchs gegen die beabsichtigte Löschung ist auf zwei Monate ab Veröffentlichung bestimmt."
    },
    {
      "date": "2024-10-08",
      "id": "89526",
      "original_text": "Registerbekanntmachung nach dem Umwandlungsgesetz\nBerlin Amtsgericht Berlin (Charlottenburg) HRA 63291\nOZ Skin Matter e.K. – Berlin",
      "type": "Registerbekanntmachung nach dem Umwandlungsgesetz",
      "state": "Berlin",
      "amtsgericht": "Amtsgericht Berlin (Charlottenburg)",
      "registernummer": "HRA 63291",
      "registerart": "HRA",
      "company_name": "OZ Skin Matter e.K.",
      "company_seat": "Berlin",
      "details": "08.10.2024 (Bekanntmachungsdatum)\n\nBerlin Amtsgericht Berlin (Charlottenburg) HRA 63291\nRegisterbekanntmachung nach dem Umwandlungsgesetz 07.10.2024 (Eintragungsdatum)\n\nOZ Skin Matter e.K.\nEinzelkaufmann / Einzelkauffrau\nBerlin\n\nZu Eintragungsnummer 2 vom 07.10.2024 wird als nicht eingetragen veröffentlicht:Den Gläubigern der an der Verschmelzung beteiligten Rechtsträger ist, wenn sie binnen sechs Monaten nach dem Tag, an dem die Eintragung der Verschmelzung in das Register des Sitzes desjenigen Rechtsträgers, dessen Gläubiger sie sind, als bekannt gemacht gilt, ihren Anspruch nach Grund und Höhe schriftlich anmelden, Sicherheit zu leisten, soweit sie nicht Befriedigung verlangen können. Dieses Recht steht den Gläubigern jedoch nur zu, wenn sie glaubhaft machen, dass durch die Verschmelzung die Erfüllung ihrer Forderung gefährdet wird. Das Recht, Sicherheitsleistung zu verlangen, steht Gläubigern nicht zu, die im Falle der Insolvenz ein Recht auf vorzugsweise Befriedigung aus einer Deckungsmasse haben, die nach gesetzlicher Vorschrift zu ihrem Schutz errichtet und staatlich überwacht ist."
    },
    {
      "date": "2024-10-08",
      "id": "89493",
      "original_text": "Registerbekanntmachung nach dem Umwandlungsgesetz\nBaden-Württemberg Amtsgericht Mannheim HRB 6884\nPHOENIX International Holdings GmbH – Mannheim",
      "type": "Registerbekanntmachung nach dem Umwandlungsgesetz",
      "state": "Baden-Württemberg",
      "amtsgericht": "Amtsgericht Mannheim",
      "registernummer": "HRB 6884",
      "registerart": "HRB",
      "company_name": "PHOENIX International Holdings GmbH",
      "company_seat": "Mannheim",
      "details": "08.10.2024 (Bekanntmachungsdatum)\n\nBaden-Württemberg Amtsgericht Mannheim HRB 6884\nRegisterbekanntmachung nach dem Umwandlungsgesetz 08.10.2024 (Eintragungsdatum)\n\nPHOENIX International Holdings GmbH\nGesellschaft mit beschränkter Haftung\nMannheim\n\nDen Gläubigern der an der Verschmelzung beteiligten Rechtsträger ist, wenn sie binnen sechs Monaten nach dem Tag, an dem die Eintragung der Verschmelzung in das Register des Sitzes desjenigen Rechtsträgers, dessen Gläubiger sie sind, nach § 19 Abs. 3 UmwG als bekanntgemacht gilt, ihren Anspruch nach Grund und Höhe schriftlich anmelden, Sicherheit zu leisten, soweit sie nicht Befriedigung verlangen können. Dieses Recht steht den Gläubigern jedoch nur zu, wenn sie glaubhaft machen, dass durch die Verschmelzung die Erfüllung ihrer Forderung gefährdet wird."
    },
    {
      "date": "2024-10-08",
      "id": "89582",
      "original_text": "Registerbekanntmachung nach dem Umwandlungsgesetz\nNordrhein-Westfalen Amtsgericht Düsseldorf HRB 86880\nPK Holding GmbH – Monheim am Rhein",
      "type": "Registerbekanntmachung nach dem Umwandlungsgesetz",
      "state": "Nordrhein-Westfalen",
      "amtsgericht": "Amtsgericht Düsseldorf",
      "registernummer": "HRB 86880",
      "registerart": "HRB",
      "company_name": "PK Holding GmbH",
      "company_seat": "Monheim am Rhein",
      "details": "08.10.2024 (Bekanntmachungsdatum)\n\nNordrhein-Westfalen Amtsgericht Düsseldorf HRB 86880\nRegisterbekanntmachung nach dem Umwandlungsgesetz 08.10.2024 (Eintragungsdatum)\n\nPK Holding GmbH\nGesellschaft mit beschränkter Haftung\nMonheim am Rhein\n\nDen Gläubigern der an der Verschmelzung beteiligten Rechtsträger ist, wenn sie binnen sechs Monaten nach dem Tag, an dem die Eintragung der Verschmelzung in das Register des Sitzes desjenigen Rechtsträgers, dessen Gläubiger sie sind, nach § 19 Absatz 3 UmwG als bekanntgemacht gilt, ihren Anspruch nach Grund und Höhe schriftlich anmelden, Sicherheit zu leisten, soweit sie nicht Befriedigung verlangen können. Dieses Recht steht den Gläubigern jedoch nur zu, wenn sie glaubhaft machen, dass durch die Verschmelzung die Erfüllung ihrer Forderung gefährdet wird."
    },
    {
      "date": "2024-10-08",
      "id": "89518",
      "original_text": "Registerbekanntmachung nach dem Umwandlungsgesetz\nHamburg Amtsgericht Hamburg HRB 151710\nPanasonic Business Support Europe GmbH – Hamburg",
      "type": "Registerbekanntmachung nach dem Umwandlungsgesetz",
      "state": "Hamburg",
      "amtsgericht": "Amtsgericht Hamburg",
      "registernummer": "HRB 151710",
      "registerart": "HRB",
      "company_name": "Panasonic Business Support Europe GmbH",
      "company_seat": "Hamburg",
      "details": "08.10.2024 (Bekanntmachungsdatum)\n\nHamburg Amtsgericht Hamburg HRB 151710\nRegisterbekanntmachung nach dem Umwandlungsgesetz 04.09.2024 (Eintragungsdatum)\n\nPanasonic Business Support Europe GmbH\nGesellschaft mit beschränkter Haftung\nHamburg\n\nAls nicht eingetragen wird bekannt gemacht:\nDen Gläubigern der an der grenzüberschreitenden Verschmelzung beteiligten übernehmenden Rechtsträger ist, wenn sie binnen sechs Monaten nach dem Tag, an dem die Eintragung der Verschmelzung in das Register des Sitzes desjenigen Rechtsträgers, dessen Gläubiger sie sind, nach § 19 Absatz 3 UmwG als bekanntgemacht gilt, ihren Anspruch nach Grund und Höhe schriftlich anmelden, Sicherheit zu leisten, soweit sie nicht Befriedigung verlangen können.\nDieses Recht steht den Gläubigern jedoch nur zu, wenn sie glaubhaft machen, dass durch die Verschmelzung die Erfüllung ihrer Forderung gefährdet wird."
    },
    {
      "date": "2024-10-08",
      "id": "89542",
      "original_text": "Löschungsankündigung\nBaden-Württemberg Amtsgericht Stuttgart HRB 730217\nPersonell-Service GmbH Heilbronn – Heilbronn",
      "type": "Löschungsankündigung",
      "state": "Baden-Württemberg",
      "amtsgericht": "Amtsgericht Stuttgart",
      "registernummer": "HRB 730217",
      "registerart": "HRB",
      "company_name": "Personell-Service GmbH Heilbronn",
      "company_seat": "Heilbronn",
      "details": "08.10.2024 (Bekanntmachungsdatum)\n\nBaden-Württemberg Amtsgericht Stuttgart HRB 730217\nLöschungsankündigung\n\nPersonell-Service GmbH Heilbronn\nGesellschaft mit beschränkter Haftung\nHeilbronn\n\nDas Gericht beabsichtigt, die Gesellschaft wegen Vermögenslosigkeit im Handelsregister von Amts wegen nach § 394 FamFG zu löschen. Die Frist zur Geltendmachung eines Widerspruchs gegen die beabsichtigte Löschung ist auf zwei Monate ab Veröffentlichung bestimmt."
    },
    {
      "date": "2024-10-08",
      "id": "89560",
      "original_text": "Registerbekanntmachung nach dem Umwandlungsgesetz\nNiedersachsen Amtsgericht Osnabrück HRA 209109\nPhysioAktiv, Inh. Tanja Sudowe e.K. – Georgsmarienhütte",
      "type": "Registerbekanntmachung nach dem Umwandlungsgesetz",
      "state": "Niedersachsen",
      "amtsgericht": "Amtsgericht Osnabrück",
      "registernummer": "HRA 209109",
      "registerart": "HRA",
      "company_name": "PhysioAktiv, Inh. Tanja Sudowe e.K.",
      "company_seat": "Georgsmarienhütte",
      "details": "08.10.2024 (Bekanntmachungsdatum)\n\nNiedersachsen Amtsgericht Osnabrück HRA 209109\nRegisterbekanntmachung nach dem Umwandlungsgesetz 08.10.2024 (Eintragungsdatum)\n\nPhysioAktiv, Inh. Tanja Sudowe e.K.\nEinzelkaufmann / Einzelkauffrau\nGeorgsmarienhütte\n\nDen Gläubigern der an der Ausgliederung beteiligten Rechtsträger ist, wenn sie binnen sechs Monaten nach dem Tag, an dem die Eintragung der Ausgliederung in das Register des Sitzes desjenigen Rechtsträgers, dessen Gläubiger sie sind, nach § 19 Abs. 3 UmwG als bekannt gemacht gilt, ihren Anspruch nach Grund und Höhe schriftlich anmelden, Sicherheit zu leisten, soweit sie nicht Befriedigung verlangen können. Dieses Recht steht den Gläubigern jedoch nur zu, wenn sie glaubhaft machen, dass durch die Ausgliederung die Erfüllung der Forderung gefährdet wird."
    },
    {
      "date": "2024-10-08",
      "id": "89617",
      "original_text": "Registerbekanntmachung nach dem Umwandlungsgesetz\nHessen Amtsgericht Frankfurt am Main HRB 104965\nPixel Wall And Teahouse UG (haftungsbeschränkt) – Frankfurt am Main",
      "type": "Registerbekanntmachung nach dem Umwandlungsgesetz",
      "state": "Hessen",
      "amtsgericht": "Amtsgericht Frankfurt am Main",
      "registernummer": "HRB 104965",
      "registerart": "HRB",
      "company_name": "Pixel Wall And Teahouse UG (haftungsbeschränkt)",
      "company_seat": "Frankfurt am Main",
      "details": "08.10.2024 (Bekanntmachungsdatum)\n\nHessen Amtsgericht Frankfurt am Main HRB 104965\nRegisterbekanntmachung nach dem Umwandlungsgesetz 08.10.2024 (Eintragungsdatum)\n\nPixel Wall And Teahouse UG (haftungsbeschränkt)\nGesellschaft mit beschränkter Haftung\nFrankfurt am Main\n\nDen Gläubigern der an der Verschmelzung beteiligten Rechtsträger ist, wenn sie binnen sechs Monaten nach dem Tag, an dem die Eintragung der Verschmelzung in das Register des Sitzes desjenigen Rechtsträgers, dessen Gläubiger sie sind, nach § 19 Absatz 3 UmwG bekannt gemacht worden ist, ihren Anspruch nach Grund und Höhe schriftlich anmelden, Sicherheit zu leisten, soweit sie nicht Befriedigung verlangen können. Dieses Recht steht den Gläubigern jedoch nur zu, wenn sie glaubhaft machen, dass durch die Verschmelzung die Erfüllung ihrer Forderung gefährdet wird."
    },
    {
      "date": "2024-10-08",
      "id": "89596",
      "original_text": "Löschungsankündigung\nNordrhein-Westfalen Amtsgericht Mönchengladbach HRB 9641\nPlanitia Hose Trading GmbH – Schwalmtal",
      "type": "Löschungsankündigung",
      "state": "Nordrhein-Westfalen",
      "amtsgericht": "Amtsgericht Mönchengladbach",
      "registernummer": "HRB 9641",
      "registerart": "HRB",
      "company_name": "Planitia Hose Trading GmbH",
      "company_seat": "Schwalmtal",
      "details": "08.10.2024 (Bekanntmachungsdatum)\n\nNordrhein-Westfalen Amtsgericht Mönchengladbach HRB 9641\nLöschungsankündigung\n\nPlanitia Hose Trading GmbH\nGesellschaft mit beschränkter Haftung\nSchwalmtal\n\nDas Registergericht beabsichtigt die Gesellschaft von Amts wegen nach § 394 FamFG zu löschen. Die Frist zur Erhebung eines Widerspruchs ist auf drei Monate festgesetzt."
    },
    {
      "date": "2024-10-08",
      "id": "89579",
      "original_text": "Löschungsankündigung\nNordrhein-Westfalen Amtsgericht Düren HRB 7152\nPozitif GmbH – Düren",
      "type": "Löschungsankündigung",
      "state": "Nordrhein-Westfalen",
      "amtsgericht": "Amtsgericht Düren",
      "registernummer": "HRB 7152",
      "registerart": "HRB",
      "company_name": "Pozitif GmbH",
      "company_seat": "Düren",
      "details": "08.10.2024 (Bekanntmachungsdatum)\n\nNordrhein-Westfalen Amtsgericht Düren HRB 7152\nLöschungsankündigung\n\nPozitif GmbH\nGesellschaft mit beschränkter Haftung\nDüren\n\nDas Registergericht beabsichtigt die Gesellschaft von Amts wegen nach § 394 FamFG zu löschen. Die Frist zur Erhebung eines Widerspruchs ist auf drei Monate festgesetzt."
    },
    {
      "date": "2024-10-08",
      "id": "89543",
      "original_text": "Einreichung neuer Dokumente\nSchleswig-Holstein Amtsgericht Kiel HRB 5705\nProvinzial NordWest Lebensversicherung Aktiengesellschaft – Kiel",
      "type": "Einreichung neuer Dokumente",
      "state": "Schleswig-Holstein",
      "amtsgericht": "Amtsgericht Kiel",
      "registernummer": "HRB 5705",
      "registerart": "HRB",
      "company_name": "Provinzial NordWest Lebensversicherung Aktiengesellschaft",
      "company_seat": "Kiel",
      "details": "08.10.2024 (Bekanntmachungsdatum)\n\nSchleswig-Holstein Amtsgericht Kiel HRB 5705\nEinreichung neuer Dokumente\n\nProvinzial NordWest Lebensversicherung Aktiengesellschaft\nAktiengesellschaft\nKiel\n\nAls nicht eingetragen wird veröffentlicht: Eine neue Liste der Aufsichtsratsmitglieder ist eingereicht worden."
    },
    {
      "date": "2024-10-08",
      "id": "89534",
      "original_text": "Registerbekanntmachung nach dem Umwandlungsgesetz\nSchleswig-Holstein Amtsgericht Kiel HRB 1287 SE\nQ-Pharm AG – Bad Segeberg",
      "type": "Registerbekanntmachung nach dem Umwandlungsgesetz",
      "state": "Schleswig-Holstein",
      "amtsgericht": "Amtsgericht Kiel",
      "registernummer": "HRB 1287 SE",
      "registerart": "HRB",
      "company_name": "Q-Pharm AG",
      "company_seat": "Bad Segeberg",
      "details": "08.10.2024 (Bekanntmachungsdatum)\n\nSchleswig-Holstein Amtsgericht Kiel HRB 1287 SE\nRegisterbekanntmachung nach dem Umwandlungsgesetz 08.10.2024 (Eintragungsdatum)\n\nQ-Pharm AG\nAktiengesellschaft\nBad Segeberg\n\nZu Eintragungsnummer 9 vom 08.10.2024 wird als nicht eingetragen veröffentlicht: Den Gläubigern der an der Verschmelzung beteiligten Rechtsträger ist, wenn sie binnen sechs Monaten nach dem Tag, an dem die Eintragung der Verschmelzung in das Register des Sitzes desjenigen Rechtsträgers, dessen Gläubiger sie sind, nach § 19 Abs. 3 UmwG bekannt gemacht worden ist, ihren Anspruch nach Grund und Höhe schriftlich anmelden, Sicherheit zu leisten, soweit sie nicht Befriedigung verlangen können. Dieses Recht steht den Gläubigern jedoch nur zu, wenn sie glaubhaft machen, dass durch die Verschmelzung die Erfüllung ihrer Forderung gefährdet wird."
    },
    {
      "date": "2024-10-08",
      "id": "89624",
      "original_text": "Löschungsankündigung\nHessen Amtsgericht Offenbach am Main HRB 47117\nRAUM + FORM UG (haftungsbeschränkt) – Langen (Hessen)",
      "type": "Löschungsankündigung",
      "state": "Hessen",
      "amtsgericht": "Amtsgericht Offenbach am Main",
      "registernummer": "HRB 47117",
      "registerart": "HRB",
      "company_name": "RAUM + FORM UG (haftungsbeschränkt)",
      "company_seat": "Langen (Hessen)",
      "details": "08.10.2024 (Bekanntmachungsdatum)\n\nHessen Amtsgericht Offenbach am Main HRB 47117\nLöschungsankündigung\n\nRAUM + FORM UG (haftungsbeschränkt)\nGesellschaft mit beschränkter Haftung\nLangen (Hessen)\n\nDas Registergericht beabsichtigt die im Handelsregister eingetragene Gesellschaft von Amts wegen nach § 394 FamFG zu löschen. Die Frist zur Erhebung eines Widerspruchs gegen die beabsichtigte Löschung wird auf 3 Monate festgesetzt."
    },
    {
      "date": "2024-10-08",
      "id": "89484",
      "original_text": "Registerbekanntmachung nach dem Umwandlungsgesetz\nHamburg Amtsgericht Hamburg HRB 167310\nREA Blankenburger Weg Hamburg Verwaltung GmbH – Hamburg",
      "type": "Registerbekanntmachung nach dem Umwandlungsgesetz",
      "state": "Hamburg",
      "amtsgericht": "Amtsgericht Hamburg",
      "registernummer": "HRB 167310",
      "registerart": "HRB",
      "company_name": "REA Blankenburger Weg Hamburg Verwaltung GmbH",
      "company_seat": "Hamburg",
      "details": "08.10.2024 (Bekanntmachungsdatum)\n\nHamburg Amtsgericht Hamburg HRB 167310\nRegisterbekanntmachung nach dem Umwandlungsgesetz 08.10.2024 (Eintragungsdatum)\n\nREA Blankenburger Weg Hamburg Verwaltung GmbH\nGesellschaft mit beschränkter Haftung\nHamburg\n\nAls nicht eingetragen wird bekannt gemacht:\nDen Gläubigern der an der Verschmelzung beteiligten Gesellschaften ist, wenn sie binnen sechs Monaten nach dem Tag, an dem die Eintragung der Verschmelzung in das Register des Sitzes desjenigen Rechtsträgers, dessen Gläubiger sie sind, nach § 19 Absatz 3 UmwG als bekannt gemacht gilt, ihren Anspruch nach Grund und Höhe schriftlich anmelden, Sicherheit zu leisten, soweit sie nicht Befriedigung verlangen können. Dieses Recht steht den Gläubigern jedoch nur zu, wenn sie glaubhaft machen, dass durch die Verschmelzung die Erfüllung ihrer Forderung gefährdet wird."
    },
    {
      "date": "2024-10-08",
      "id": "89483",
      "original_text": "Registerbekanntmachung nach dem Umwandlungsgesetz\nHamburg Amtsgericht Hamburg HRB 172923\nREA Lokstedt 70 Verwaltungs GmbH – Hamburg",
      "type": "Registerbekanntmachung nach dem Umwandlungsgesetz",
      "state": "Hamburg",
      "amtsgericht": "Amtsgericht Hamburg",
      "registernummer": "HRB 172923",
      "registerart": "HRB",
      "company_name": "REA Lokstedt 70 Verwaltungs GmbH",
      "company_seat": "Hamburg",
      "details": "08.10.2024 (Bekanntmachungsdatum)\n\nHamburg Amtsgericht Hamburg HRB 172923\nRegisterbekanntmachung nach dem Umwandlungsgesetz 08.10.2024 (Eintragungsdatum)\n\nREA Lokstedt 70 Verwaltungs GmbH\nGesellschaft mit beschränkter Haftung\nHamburg\n\nAls nicht eingetragen wird bekannt gemacht:\nDen Gläubigern der an der Verschmelzung beteiligten Gesellschaften ist, wenn sie binnen sechs Monaten nach dem Tag, an dem die Eintragung der Verschmelzung in das Register des Sitzes desjenigen Rechtsträgers, dessen Gläubiger sie sind, nach § 19 Absatz 3 UmwG als bekannt gemacht gilt, ihren Anspruch nach Grund und Höhe schriftlich anmelden, Sicherheit zu leisten, soweit sie nicht Befriedigung verlangen können. Dieses Recht steht den Gläubigern jedoch nur zu, wenn sie glaubhaft machen, dass durch die Verschmelzung die Erfüllung ihrer Forderung gefährdet wird."
    },
    {
      "date": "2024-10-08",
      "id": "89481",
      "original_text": "Registerbekanntmachung nach dem Umwandlungsgesetz\nHamburg Amtsgericht Hamburg HRB 140787\nREA Projekte I Verwaltung GmbH – Hamburg",
      "type": "Registerbekanntmachung nach dem Umwandlungsgesetz",
      "state": "Hamburg",
      "amtsgericht": "Amtsgericht Hamburg",
      "registernummer": "HRB 140787",
      "registerart": "HRB",
      "company_name": "REA Projekte I Verwaltung GmbH",
      "company_seat": "Hamburg",
      "details": "08.10.2024 (Bekanntmachungsdatum)\n\nHamburg Amtsgericht Hamburg HRB 140787\nRegisterbekanntmachung nach dem Umwandlungsgesetz 08.10.2024 (Eintragungsdatum)\n\nREA Projekte I Verwaltung GmbH\nGesellschaft mit beschränkter Haftung\nHamburg\n\nAls nicht eingetragen wird bekannt gemacht:\nDen Gläubigern der an der Verschmelzung beteiligten Gesellschaften ist, wenn sie binnen sechs Monaten nach dem Tag, an dem die Eintragung der Verschmelzung in das Register des Sitzes derjenigen Rechtsträger deren Gläubiger sie sind, nach § 19 Absatz 3 UmwG als bekannt gemacht gilt, ihren Anspruch nach Grund und Höhe schriftlich anmelden, Sicherheit zu leisten, soweit sie nicht Befriedigung verlangen können. Dieses Recht steht den Gläubigern jedoch nur zu, wenn sie glaubhaft machen, dass durch die Verschmelzung die Erfüllung ihrer Forderung gefährdet wird."
    },
    {
      "date": "2024-10-08",
      "id": "89482",
      "original_text": "Registerbekanntmachung nach dem Umwandlungsgesetz\nHamburg Amtsgericht Hamburg HRB 173691\nREA Rissen 32 Verwaltung GmbH – Hamburg",
      "type": "Registerbekanntmachung nach dem Umwandlungsgesetz",
      "state": "Hamburg",
      "amtsgericht": "Amtsgericht Hamburg",
      "registernummer": "HRB 173691",
      "registerart": "HRB",
      "company_name": "REA Rissen 32 Verwaltung GmbH",
      "company_seat": "Hamburg",
      "details": "08.10.2024 (Bekanntmachungsdatum)\n\nHamburg Amtsgericht Hamburg HRB 173691\nRegisterbekanntmachung nach dem Umwandlungsgesetz 08.10.2024 (Eintragungsdatum)\n\nREA Rissen 32 Verwaltung GmbH\nGesellschaft mit beschränkter Haftung\nHamburg\n\nAls nicht eingetragen wird bekannt gemacht:\nDen Gläubigern der an der Verschmelzung beteiligten Gesellschaften ist, wenn sie binnen sechs Monaten nach dem Tag, an dem die Eintragung der Verschmelzung in das Register des Sitzes desjenigen Rechtsträgers, dessen Gläubiger sie sind, nach § 19 Absatz 3 UmwG als bekannt gemacht gilt, ihren Anspruch nach Grund und Höhe schriftlich anmelden, Sicherheit zu leisten, soweit sie nicht Befriedigung verlangen können. Dieses Recht steht den Gläubigern jedoch nur zu, wenn sie glaubhaft machen, dass durch die Verschmelzung die Erfüllung ihrer Forderung gefährdet wird."
    },
    {
      "date": "2024-10-08",
      "id": "89473",
      "original_text": "Registerbekanntmachung nach dem Umwandlungsgesetz\nHamburg Amtsgericht Hamburg HRB 138366\nREABIZ Crowd Capital GmbH – Hamburg",
      "type": "Registerbekanntmachung nach dem Umwandlungsgesetz",
      "state": "Hamburg",
      "amtsgericht": "Amtsgericht Hamburg",
      "registernummer": "HRB 138366",
      "registerart": "HRB",
      "company_name": "REABIZ Crowd Capital GmbH",
      "company_seat": "Hamburg",
      "details": "08.10.2024 (Bekanntmachungsdatum)\n\nHamburg Amtsgericht Hamburg HRB 138366\nRegisterbekanntmachung nach dem Umwandlungsgesetz 08.10.2024 (Eintragungsdatum)\n\nREABIZ Crowd Capital GmbH\nGesellschaft mit beschränkter Haftung\nHamburg\n\nAls nicht eingetragen wird bekannt gemacht:\nDen Gläubigern der an der Verschmelzung beteiligten Gesellschaften ist, wenn sie binnen sechs Monaten nach dem Tag, an dem die Eintragung der Verschmelzung in das Register des Sitzes desjenigen Rechtsträgers, dessen Gläubiger sie sind, nach § 19 Absatz 3 UmwG als bekannt gemacht gilt, ihren Anspruch nach Grund und Höhe schriftlich anmelden, Sicherheit zu leisten, soweit sie nicht Befriedigung verlangen können. Dieses Recht steht den Gläubigern jedoch nur zu, wenn sie glaubhaft machen, dass durch die Verschmelzung die Erfüllung ihrer Forderung gefährdet wird."
    },
    {
      "date": "2024-10-08",
      "id": "89472",
      "original_text": "Registerbekanntmachung nach dem Umwandlungsgesetz\nHamburg Amtsgericht Hamburg HRB 124819\nREABIZ Investment Capital GmbH – Hamburg",
      "type": "Registerbekanntmachung nach dem Umwandlungsgesetz",
      "state": "Hamburg",
      "amtsgericht": "Amtsgericht Hamburg",
      "registernummer": "HRB 124819",
      "registerart": "HRB",
      "company_name": "REABIZ Investment Capital GmbH",
      "company_seat": "Hamburg",
      "details": "08.10.2024 (Bekanntmachungsdatum)\n\nHamburg Amtsgericht Hamburg HRB 124819\nRegisterbekanntmachung nach dem Umwandlungsgesetz 08.10.2024 (Eintragungsdatum)\n\nREABIZ Investment Capital GmbH\nGesellschaft mit beschränkter Haftung\nHamburg\n\nAls nicht eingetragen wird bekannt gemacht:\nDen Gläubigern der an der Verschmelzung beteiligten Gesellschaften ist, wenn sie binnen sechs Monaten nach dem Tag, an dem die Eintragung der Verschmelzung in das Register des Sitzes desjenigen Rechtsträgers, dessen Gläubiger sie sind, nach § 19 Absatz 3 UmwG als bekannt gemacht gilt, ihren Anspruch nach Grund und Höhe schriftlich anmelden, Sicherheit zu leisten, soweit sie nicht Befriedigung verlangen können. Dieses Recht steht den Gläubigern jedoch nur zu, wenn sie glaubhaft machen, dass durch die Verschmelzung die Erfüllung ihrer Forderung gefährdet wird."
    },
    {
      "date": "2024-10-08",
      "id": "89476",
      "original_text": "Registerbekanntmachung nach dem Umwandlungsgesetz\nHamburg Amtsgericht Hamburg HRB 124819\nREABIZ Investment Capital GmbH – Hamburg",
      "type": "Registerbekanntmachung nach dem Umwandlungsgesetz",
      "state": "Hamburg",
      "amtsgericht": "Amtsgericht Hamburg",
      "registernummer": "HRB 124819",
      "registerart": "HRB",
      "company_name": "REABIZ Investment Capital GmbH",
      "company_seat": "Hamburg",
      "details": "08.10.2024 (Bekanntmachungsdatum)\n\nHamburg Amtsgericht Hamburg HRB 124819\nRegisterbekanntmachung nach dem Umwandlungsgesetz 08.10.2024 (Eintragungsdatum)\n\nREABIZ Investment Capital GmbH\nGesellschaft mit beschränkter Haftung\nHamburg\n\nAls nicht eingetragen wird bekannt gemacht:\nDen Gläubigern der an der Verschmelzung beteiligten Gesellschaften ist, wenn sie binnen sechs Monaten nach dem Tag, an dem die Eintragung der Verschmelzung in das Register des Sitzes desjenigen Rechtsträgers, dessen Gläubiger sie sind, nach § 19 Absatz 3 UmwG als bekannt gemacht gilt, ihren Anspruch nach Grund und Höhe schriftlich anmelden, Sicherheit zu leisten, soweit sie nicht Befriedigung verlangen können. Dieses Recht steht den Gläubigern jedoch nur zu, wenn sie glaubhaft machen, dass durch die Verschmelzung die Erfüllung ihrer Forderung gefährdet wird."
    },
    {
      "date": "2024-10-08",
      "id": "89475",
      "original_text": "Registerbekanntmachung nach dem Umwandlungsgesetz\nHamburg Amtsgericht Hamburg HRB 115918\nREAFINA AG – Hamburg",
      "type": "Registerbekanntmachung nach dem Umwandlungsgesetz",
      "state": "Hamburg",
      "amtsgericht": "Amtsgericht Hamburg",
      "registernummer": "HRB 115918",
      "registerart": "HRB",
      "company_name": "REAFINA AG",
      "company_seat": "Hamburg",
      "details": "08.10.2024 (Bekanntmachungsdatum)\n\nHamburg Amtsgericht Hamburg HRB 115918\nRegisterbekanntmachung nach dem Umwandlungsgesetz 08.10.2024 (Eintragungsdatum)\n\nREAFINA AG\nAktiengesellschaft\nHamburg\n\nAls nicht eingetragen wird bekannt gemacht:\nDen Gläubigern der an der Verschmelzung beteiligten Gesellschaften ist, wenn sie binnen sechs Monaten nach dem Tag, an dem die Eintragung der Verschmelzung in das Register des Sitzes desjenigen Rechtsträgers, dessen Gläubiger sie sind, nach § 19 Absatz 3 UmwG als bekannt gemacht gilt, ihren Anspruch nach Grund und Höhe schriftlich anmelden, Sicherheit zu leisten, soweit sie nicht Befriedigung verlangen können. Dieses Recht steht den Gläubigern jedoch nur zu, wenn sie glaubhaft machen, dass durch die Verschmelzung die Erfüllung ihrer Forderung gefährdet wird."
    },
    {
      "date": "2024-10-08",
      "id": "89552",
      "original_text": "Sonstige Registerbekanntmachung\nSachsen Amtsgericht Dresden HRB 26529\nRadeberger Reinraumtechnik GmbH – Radeberg",
      "type": "Sonstige Registerbekanntmachung",
      "state": "Sachsen",
      "amtsgericht": "Amtsgericht Dresden",
      "registernummer": "HRB 26529",
      "registerart": "HRB",
      "company_name": "Radeberger Reinraumtechnik GmbH",
      "company_seat": "Radeberg",
      "details": "08.10.2024 (Bekanntmachungsdatum)\n\nSachsen Amtsgericht Dresden HRB 26529\nSonstige Registerbekanntmachung 08.10.2024 (Eintragungsdatum)\n\nRadeberger Reinraumtechnik GmbH\nGesellschaft mit beschränkter Haftung\nRadeberg\n\nDen Gläubigern der Gesellschaft, deren Forderungen begründet worden sind bevor die Eintragung der Beendigung des Beherrschungs- und Gewinnabführungsvertrages in das Handelsregister nach § 10 des Handelsgesetzbuches als bekanntgemacht gilt, hat der andere Vertragsteil Sicherheit zu leisten, wenn sie sich binnen sechs Monaten nach der Bekanntmachung der Eintragung zu diesem Zweck bei ihm melden."
    },
    {
      "date": "2024-10-08",
      "id": "89490",
      "original_text": "Einreichung neuer Dokumente\nBaden-Württemberg Amtsgericht Freiburg HRB 6236\nReSys Aktiengesellschaft – Freiburg im Breisgau",
      "type": "Einreichung neuer Dokumente",
      "state": "Baden-Württemberg",
      "amtsgericht": "Amtsgericht Freiburg",
      "registernummer": "HRB 6236",
      "registerart": "HRB",
      "company_name": "ReSys Aktiengesellschaft",
      "company_seat": "Freiburg im Breisgau",
      "details": "08.10.2024 (Bekanntmachungsdatum)\n\nBaden-Württemberg Amtsgericht Freiburg HRB 6236\nEinreichung neuer Dokumente\n\nReSys Aktiengesellschaft\nAktiengesellschaft\nFreiburg im Breisgau\n\nDie Gesellschaft hat am 07.10.2024 die Liste über die Zusammensetzung der Aufsichtsräte für Zeitraum der Jahre 2000 bis 08.06.2024 zum Handelsregister eingereicht."
    },
    {
      "date": "2024-10-08",
      "id": "89553",
      "original_text": "Einreichung neuer Dokumente\nSachsen Amtsgericht Chemnitz HRB 7010\nRegionalverkehr Erzgebirge GmbH – Annaberg-Buchholz",
      "type": "Einreichung neuer Dokumente",
      "state": "Sachsen",
      "amtsgericht": "Amtsgericht Chemnitz",
      "registernummer": "HRB 7010",
      "registerart": "HRB",
      "company_name": "Regionalverkehr Erzgebirge GmbH",
      "company_seat": "Annaberg-Buchholz",
      "details": "08.10.2024 (Bekanntmachungsdatum)\n\nSachsen Amtsgericht Chemnitz HRB 7010\nEinreichung neuer Dokumente 07.10.2024 (Eintragungsdatum)\n\nRegionalverkehr Erzgebirge GmbH\nGesellschaft mit beschränkter Haftung\nAnnaberg-Buchholz\n\nAm 07.10.2024 wurde beim Handelsregister des Amtsgerichts Chemnitz die Liste der Mitglieder des Aufsichtsrats gemäß § 52 GmbHG eingereicht."
    },
    {
      "date": "2024-10-08",
      "id": "89583",
      "original_text": "Einreichung neuer Dokumente\nNordrhein-Westfalen Amtsgericht Hamm HRB 8133\nRhenus Verwaltungs SE – Holzwickede",
      "type": "Einreichung neuer Dokumente",
      "state": "Nordrhein-Westfalen",
      "amtsgericht": "Amtsgericht Hamm",
      "registernummer": "HRB 8133",
      "registerart": "HRB",
      "company_name": "Rhenus Verwaltungs SE",
      "company_seat": "Holzwickede",
      "details": "08.10.2024 (Bekanntmachungsdatum)\n\nNordrhein-Westfalen Amtsgericht Hamm HRB 8133\nEinreichung neuer Dokumente 08.10.2024 (Eintragungsdatum)\n\nRhenus Verwaltungs SE\nEuropäische Aktiengesellschaft (SE)\nHolzwickede\n\nDem Registergericht ist eine neue Liste der Mitglieder des Aufsichtsrates eingereicht worden."
    },
    {
      "date": "2024-10-08",
      "id": "89568",
      "original_text": "Registerbekanntmachung nach dem Umwandlungsgesetz\nRheinland-Pfalz Amtsgericht Wittlich HRB 44964\nRigodulum GmbH – Riol",
      "type": "Registerbekanntmachung nach dem Umwandlungsgesetz",
      "state": "Rheinland-Pfalz",
      "amtsgericht": "Amtsgericht Wittlich",
      "registernummer": "HRB 44964",
      "registerart": "HRB",
      "company_name": "Rigodulum GmbH",
      "company_seat": "Riol",
      "details": "08.10.2024 (Bekanntmachungsdatum)\n\nRheinland-Pfalz Amtsgericht Wittlich HRB 44964\nRegisterbekanntmachung nach dem Umwandlungsgesetz 08.10.2024 (Eintragungsdatum)\n\nRigodulum GmbH\nGesellschaft mit beschränkter Haftung\nRiol\n\nDen Gläubigern der an der grenzüberschreitenden Verschmelzung beteiligten Rechtsträgern ist, wenn sie binnen sechs Monaten nach dem Tag, an dem die Eintragung der Verschmelzung in das Register des Sitzes desjenigen Rechtsträgers, dessen Gläubiger sie sind, nach § 19 Absatz 3 UmwG als bekanntgemacht gilt, ihren Anspruch nach Grund und Höhe schriftlich anmelden, Sicherheit zu leisten, soweit sie nicht Befriedigung verlangen können.\nDieses Recht steht den Gläubigern jedoch nur zu, wenn sie glaubhaft machen, dass durch die Verschmelzung die Erfüllung ihrer Forderung gefährdet wird."
    },
    {
      "date": "2024-10-08",
      "id": "89453",
      "original_text": "Einreichung neuer Dokumente\nBayern Amtsgericht Fürth HRB 13995\nRudolf Messner Umwelttechnik AG – Adelsdorf",
      "type": "Einreichung neuer Dokumente",
      "state": "Bayern",
      "amtsgericht": "Amtsgericht Fürth",
      "registernummer": "HRB 13995",
      "registerart": "HRB",
      "company_name": "Rudolf Messner Umwelttechnik AG",
      "company_seat": "Adelsdorf",
      "details": "08.10.2024 (Bekanntmachungsdatum)\n\nBayern Amtsgericht Fürth HRB 13995\nEinreichung neuer Dokumente\n\nRudolf Messner Umwelttechnik AG\nAktiengesellschaft\nAdelsdorf\n\nDem Amtsgericht Fürth -Registergericht- ist eine Liste der Mitglieder des Aufsichtsrats eingereicht worden, § 106 AktG."
    },
    {
      "date": "2024-10-08",
      "id": "89478",
      "original_text": "Registerbekanntmachung nach dem Umwandlungsgesetz\nBaden-Württemberg Amtsgericht Ulm HRA 729245\nRösch Holzbau e.K. – Amstetten",
      "type": "Registerbekanntmachung nach dem Umwandlungsgesetz",
      "state": "Baden-Württemberg",
      "amtsgericht": "Amtsgericht Ulm",
      "registernummer": "HRA 729245",
      "registerart": "HRA",
      "company_name": "Rösch Holzbau e.K.",
      "company_seat": "Amstetten",
      "details": "08.10.2024 (Bekanntmachungsdatum)\n\nBaden-Württemberg Amtsgericht Ulm HRA 729245\nRegisterbekanntmachung nach dem Umwandlungsgesetz 08.10.2024 (Eintragungsdatum)\n\nRösch Holzbau e.K.\nEinzelkaufmann / Einzelkauffrau\nAmstetten\n\nAls nicht eingetragen wird bekanntgemacht:\nDen Gläubigern der an der Ausgliederung beteiligten Rechtsträger ist, wenn sie binnen sechs Monaten nach dem Tag, an dem die Eintragung der Ausgliederung in das Register des Sitzes desjenigen Rechtsträgers, dessen Gläubiger sie sind, nach § 19 Abs. 3 UmwG als bekanntgemacht gilt, ihren Anspruch nach Grund und Höhe schriftlich anmelden, Sicherheit zu leisten, soweit sie nicht Befriedigung verlangen können. Dieses Recht steht den Gläubigern jedoch nur zu, wenn sie glaubhaft machen, dass durch die Ausgliederung die Erfüllung ihrer Forderung gefährdet wird."
    },
    {
      "date": "2024-10-08",
      "id": "89535",
      "original_text": "Registerbekanntmachung nach dem Umwandlungsgesetz\nSaarland Amtsgericht Saarbrücken HRB 110111\nSAG Aris GmbH – Saarbrücken",
      "type": "Registerbekanntmachung nach dem Umwandlungsgesetz",
      "state": "Saarland",
      "amtsgericht": "Amtsgericht Saarbrücken",
      "registernummer": "HRB 110111",
      "registerart": "HRB",
      "company_name": "SAG Aris GmbH",
      "company_seat": "Saarbrücken",
      "details": "08.10.2024 (Bekanntmachungsdatum)\n\nSaarland Amtsgericht Saarbrücken HRB 110111\nRegisterbekanntmachung nach dem Umwandlungsgesetz 08.10.2024 (Eintragungsdatum)\n\nSAG Aris GmbH\nGesellschaft mit beschränkter Haftung\nSaarbrücken\n\nAls nicht eingetragen wird bekannt gemacht: Den Gläubigern der an der Abspaltung beteiligten Gesellschaften ist, wenn sie binnen sechs Monaten nach dem Tag, an dem die Eintragung der Abspaltung in das Register des Sitzes derjenigen Rechtsträger deren Gläubiger sie sind, nach § 19 Absatz 3 UmwG bekannt gemacht worden ist, ihren Anspruch nach Grund und Höhe schriftlich anmelden, Sicherheit zu leisten, soweit sie nicht Befriedigung verlangen können. Dieses Recht steht den Gläubigern jedoch nur zu, wenn sie glaubhaft machen, dass durch die Abspaltung die Erfüllung ihrer Forderung gefährdet wird."
    },
    {
      "date": "2024-10-08",
      "id": "89550",
      "original_text": "Löschungsankündigung\nSachsen Amtsgericht Dresden HRB 41549\nSEMI Tones records UG (haftungsbeschränkt) – Dresden",
      "type": "Löschungsankündigung",
      "state": "Sachsen",
      "amtsgericht": "Amtsgericht Dresden",
      "registernummer": "HRB 41549",
      "registerart": "HRB",
      "company_name": "SEMI Tones records UG (haftungsbeschränkt)",
      "company_seat": "Dresden",
      "details": "08.10.2024 (Bekanntmachungsdatum)\n\nSachsen Amtsgericht Dresden HRB 41549\nLöschungsankündigung\n\nSEMI Tones records UG (haftungsbeschränkt)\nGesellschaft mit beschränkter Haftung\nDresden\n\nDas Registergericht beabsichtigt, die im Handelsregister eingetragene Gesellschaft von Amts wegen nach § 394 FamFG zu löschen. Die Frist zu Erhebung eines Widerspruchs gegen die beabsichtigte Löschung wird auf einen Monat festgesetzt."
    },
    {
      "date": "2024-10-08",
      "id": "89498",
      "original_text": "Registerbekanntmachung nach dem Umwandlungsgesetz\nBaden-Württemberg Amtsgericht Stuttgart HRB 796365\nST 77 Beteiligungs GmbH – Stuttgart",
      "type": "Registerbekanntmachung nach dem Umwandlungsgesetz",
      "state": "Baden-Württemberg",
      "amtsgericht": "Amtsgericht Stuttgart",
      "registernummer": "HRB 796365",
      "registerart": "HRB",
      "company_name": "ST 77 Beteiligungs GmbH",
      "company_seat": "Stuttgart",
      "details": "08.10.2024 (Bekanntmachungsdatum)\n\nBaden-Württemberg Amtsgericht Stuttgart HRB 796365\nRegisterbekanntmachung nach dem Umwandlungsgesetz 08.10.2024 (Eintragungsdatum)\n\nST 77 Beteiligungs GmbH\nGesellschaft mit beschränkter Haftung\nStuttgart\n\nAls nicht eingetragen wird bekanntgemacht:\nDen Gläubigern der an der Abspaltung beteiligten Rechtsträger ist, wenn sie binnen sechs Monaten nach dem Tag, an dem die Eintragung der Abspaltung in das Register des Sitzes desjenigen Rechtsträgers, dessen Gläubiger sie sind, nach § 19 Abs. 3 UmwG als bekanntgemacht gilt, ihren Anspruch nach Grund und Höhe schriftlich anmelden, Sicherheit zu leisten, soweit sie nicht Befriedigung verlangen können. Dieses Recht steht den Gläubigern jedoch nur zu, wenn sie glaubhaft machen, dass durch die Abspaltung die Erfüllung ihrer Forderung gefährdet wird."
    },
    {
      "date": "2024-10-08",
      "id": "89466",
      "original_text": "Registerbekanntmachung nach dem Umwandlungsgesetz\nBerlin Amtsgericht Berlin (Charlottenburg) HRB 108385\nSTORY HOUSE Pictures GmbH – Berlin",
      "type": "Registerbekanntmachung nach dem Umwandlungsgesetz",
      "state": "Berlin",
      "amtsgericht": "Amtsgericht Berlin (Charlottenburg)",
      "registernummer": "HRB 108385",
      "registerart": "HRB",
      "company_name": "STORY HOUSE Pictures GmbH",
      "company_seat": "Berlin",
      "details": "08.10.2024 (Bekanntmachungsdatum)\n\nBerlin Amtsgericht Berlin (Charlottenburg) HRB 108385\nRegisterbekanntmachung nach dem Umwandlungsgesetz 07.10.2024 (Eintragungsdatum)\n\nSTORY HOUSE Pictures GmbH\nGesellschaft mit beschränkter Haftung\nBerlin\n\nZu Eintragungsnummer 12 vom 07.10.2024 wird als nicht eingetragen veröffentlicht: Den Gläubigern der an der Verschmelzung beteiligten Rechtsträger ist, wenn sie binnen sechs Monaten nach dem Tag, an dem die Eintragung der Verschmelzung in das Register des Sitzes desjenigen Rechtsträgers, dessen Gläubiger sie sind, als bekannt gemacht gilt, ihren Anspruch nach Grund und Höhe schriftlich anmelden, Sicherheit zu leisten, soweit sie nicht Befriedigung verlangen können. Dieses Recht steht den Gläubigern jedoch nur zu, wenn sie glaubhaft machen, dass durch die Verschmelzung die Erfüllung ihrer Forderung gefährdet wird. Das Recht, Sicherheitsleistung zu verlangen, steht Gläubigern nicht zu, die im Falle der Insolvenz ein Recht auf vorzugsweise Befriedigung aus einer Deckungsmasse haben, die nach gesetzlicher Vorschrift zu ihrem Schutz errichtet und staatlich überwacht ist."
    },
    {
      "date": "2024-10-08",
      "id": "89558",
      "original_text": "Registerbekanntmachung nach dem Umwandlungsgesetz\nNiedersachsen Amtsgericht Tostedt HRA 205320\nSTS GmbH & Co. KG – Bremervörde",
      "type": "Registerbekanntmachung nach dem Umwandlungsgesetz",
      "state": "Niedersachsen",
      "amtsgericht": "Amtsgericht Tostedt",
      "registernummer": "HRA 205320",
      "registerart": "HRA",
      "company_name": "STS GmbH & Co. KG",
      "company_seat": "Bremervörde",
      "details": "08.10.2024 (Bekanntmachungsdatum)\n\nNiedersachsen Amtsgericht Tostedt HRA 205320\nRegisterbekanntmachung nach dem Umwandlungsgesetz 08.10.2024 (Eintragungsdatum)\n\nSTS GmbH & Co. KG\nKommanditgesellschaft\nBremervörde\n\nDen Gläubigern der an der Ausgliederung beteiligten Rechtsträger ist, wenn sie binnen sechs Monaten nach dem Tag, an dem die Eintragung der Ausgliederung in das Register des Sitzes desjenigen Rechtsträgers, dessen Gläubiger sie sind, nach § 19 Abs. 3 UmwG als bekannt gemacht gilt, ihren Anspruch nach Grund und Höhe schriftlich anmelden, Sicherheit zu leisten, soweit sie nicht Befriedigung verlangen können. Dieses Recht steht den Gläubigern jedoch nur zu, wenn sie glaubhaft machen, dass durch die Ausgliederung die Erfüllung der Forderung gefährdet wird."
    },
    {
      "date": "2024-10-08",
      "id": "89432",
      "original_text": "Registerbekanntmachung nach dem Umwandlungsgesetz\nBayern Amtsgericht Ingolstadt HRB 10022\nSager GmbH – Ingolstadt",
      "type": "Registerbekanntmachung nach dem Umwandlungsgesetz",
      "state": "Bayern",
      "amtsgericht": "Amtsgericht Ingolstadt",
      "registernummer": "HRB 10022",
      "registerart": "HRB",
      "company_name": "Sager GmbH",
      "company_seat": "Ingolstadt",
      "details": "08.10.2024 (Bekanntmachungsdatum)\n\nBayern Amtsgericht Ingolstadt HRB 10022\nRegisterbekanntmachung nach dem Umwandlungsgesetz 07.10.2024 (Eintragungsdatum)\n\nSager GmbH\nGesellschaft mit beschränkter Haftung\nIngolstadt\n\nDen Gläubigern der an der Verschmelzung beteiligten Rechtsträger ist, wenn sie binnen sechs Monaten nach dem Tag, an dem die Eintragung der Verschmelzung in das Register des Sitzes desjenigen Rechtsträgers, dessen Gläubiger sie sind, nach § 19 Abs. 3 UmwG als bekannt gemacht gilt, ihren Anspruch nach Grund und Höhe schriftlich anmelden, Sicherheit zu leisten, soweit sie nicht Befriedigung verlangen können. Dieses Recht steht den Gläubigern jedoch nur zu, wenn sie glaubhaft machen, dass durch die Verschmelzung die Erfüllung ihrer Forderung gefährdet wird."
    },
    {
      "date": "2024-10-08",
      "id": "89528",
      "original_text": "Registerbekanntmachung nach dem Umwandlungsgesetz\nNordrhein-Westfalen Amtsgericht Coesfeld HRA 9987\nSchöttler Holz Bau Werk GmbH & Co. KG – 46342 Velen",
      "type": "Registerbekanntmachung nach dem Umwandlungsgesetz",
      "state": "Nordrhein-Westfalen",
      "amtsgericht": "Amtsgericht Coesfeld",
      "registernummer": "HRA 9987",
      "registerart": "HRA",
      "company_name": "Schöttler Holz Bau Werk GmbH & Co. KG",
      "company_seat": "46342 Velen",
      "details": "08.10.2024 (Bekanntmachungsdatum)\n\nNordrhein-Westfalen Amtsgericht Coesfeld HRA 9987\nRegisterbekanntmachung nach dem Umwandlungsgesetz 08.10.2024 (Eintragungsdatum)\n\nSchöttler Holz Bau Werk GmbH & Co. KG\nKommanditgesellschaft\n46342 Velen\n\nAls nicht eingetragen wird bekanntgemacht: Den Gläubigern der an der Ausgliederung beteiligten Rechtsträger ist, wenn sie binnen sechs Monaten nach dem Tag, an dem die Eintragung der Ausgliederung in das Register des Sitzes desjenigen Rechtsträgers, dessen Gläubiger sie sind, nach § 19 Absatz 3 UmwG als bekanntgemacht gilt, ihren Anspruch nach Grund und Höhe schriftlich anmelden, Sicherheit zu leisten, soweit sie nicht Befriedigung verlangen können. Dieses Recht steht den Gläubigern jedoch nur zu, wenn sie glaubhaft machen, dass durch die Ausgliederung die Erfüllung ihrer Forderung gefährdet wird. Das Recht, Sicherheitsleistung zu verlangen, steht Gläubigern nicht zu, die im Fall des Insolvenzverfahrens ein Recht auf vorzugsweise Befriedigung aus einer Deckungsmasse haben, die nach gesetzlicher Vorschrift zu ihrem Schutz errichtet und staatlich überwacht ist."
    },
    {
      "date": "2024-10-08",
      "id": "89440",
      "original_text": "Registerbekanntmachung nach dem Umwandlungsgesetz\nBayern Amtsgericht München HRA 119823\nSmartCAE GmbH & Co. KG – München",
      "type": "Registerbekanntmachung nach dem Umwandlungsgesetz",
      "state": "Bayern",
      "amtsgericht": "Amtsgericht München",
      "registernummer": "HRA 119823",
      "registerart": "HRA",
      "company_name": "SmartCAE GmbH & Co. KG",
      "company_seat": "München",
      "details": "08.10.2024 (Bekanntmachungsdatum)\n\nBayern Amtsgericht München HRA 119823\nRegisterbekanntmachung nach dem Umwandlungsgesetz 07.10.2024 (Eintragungsdatum)\n\nSmartCAE GmbH & Co. KG\nKommanditgesellschaft\nMünchen\n\nDen Gläubigern der an der Ausgliederung beteiligten Rechtsträger ist, wenn sie binnen sechs Monaten nach dem Tag, an dem die Eintragung der Ausgliederung in das Register des Sitzes desjenigen Rechtsträgers, dessen Gläubiger sie sind, nach §§ 125, 19 Abs. 3 UmwG als bekannt gemacht gilt, ihren Anspruch nach Grund und Höhe schriftlich anmelden, Sicherheit zu leisten, soweit sie nicht Befriedigung verlangen können. Dieses Recht steht den Gläubigern jedoch nur zu, wenn sie glaubhaft machen, dass durch die Ausgliederung die Erfüllung ihrer Forderung gefährdet wird."
    },
    {
      "date": "2024-10-08",
      "id": "89463",
      "original_text": "Registerbekanntmachung nach dem Umwandlungsgesetz\nBayern Amtsgericht München HRA 119639\nSmartCAE Stefan Braun e.K. – München",
      "type": "Registerbekanntmachung nach dem Umwandlungsgesetz",
      "state": "Bayern",
      "amtsgericht": "Amtsgericht München",
      "registernummer": "HRA 119639",
      "registerart": "HRA",
      "company_name": "SmartCAE Stefan Braun e.K.",
      "company_seat": "München",
      "details": "08.10.2024 (Bekanntmachungsdatum)\n\nBayern Amtsgericht München HRA 119639\nRegisterbekanntmachung nach dem Umwandlungsgesetz 07.10.2024 (Eintragungsdatum)\n\nSmartCAE Stefan Braun e.K.\nEinzelkaufmann / Einzelkauffrau\nMünchen\n\nDen Gläubigern der an der Ausgliederung beteiligten Rechtsträger ist, wenn sie binnen sechs Monaten nach dem Tag, an dem die Eintragung der Ausgliederung in das Register des Sitzes desjenigen Rechtsträgers, dessen Gläubiger sie sind, nach §§ 125, 19 Abs. 3 UmwG als bekannt gemacht gilt, ihren Anspruch nach Grund und Höhe schriftlich anmelden, Sicherheit zu leisten, soweit sie nicht Befriedigung verlangen können. Dieses Recht steht den Gläubigern jedoch nur zu, wenn sie glaubhaft machen, dass durch die Ausgliederung die Erfüllung ihrer Forderung gefährdet wird."
    },
    {
      "date": "2024-10-08",
      "id": "89459",
      "original_text": "Registerbekanntmachung nach dem Umwandlungsgesetz\nBayern Amtsgericht München HRB 248017\nSocietas Leonina VIII GmbH – Oberhaching",
      "type": "Registerbekanntmachung nach dem Umwandlungsgesetz",
      "state": "Bayern",
      "amtsgericht": "Amtsgericht München",
      "registernummer": "HRB 248017",
      "registerart": "HRB",
      "company_name": "Societas Leonina VIII GmbH",
      "company_seat": "Oberhaching",
      "details": "08.10.2024 (Bekanntmachungsdatum)\n\nBayern Amtsgericht München HRB 248017\nRegisterbekanntmachung nach dem Umwandlungsgesetz 07.10.2024 (Eintragungsdatum)\n\nSocietas Leonina VIII GmbH\nGesellschaft mit beschränkter Haftung\nOberhaching\n\nDen Gläubigern der an der Verschmelzung beteiligten Rechtsträger ist, wenn sie binnen sechs Monaten nach dem Tag, an dem die Eintragung der Verschmelzung in das Register des Sitzes desjenigen Rechtsträgers, dessen Gläubiger sie sind, nach § 19 Abs. 3 UmwG als bekannt gemacht gilt, ihren Anspruch nach Grund und Höhe schriftlich anmelden, Sicherheit zu leisten, soweit sie nicht Befriedigung verlangen können. Dieses Recht steht den Gläubigern jedoch nur zu, wenn sie glaubhaft machen, dass durch die Verschmelzung die Erfüllung ihrer Forderung gefährdet wird."
    },
    {
      "date": "2024-10-08",
      "id": "89491",
      "original_text": "Registerbekanntmachung nach dem Umwandlungsgesetz\nSchleswig-Holstein Amtsgericht Flensburg HRB 15869\nSolarkonzept Nord-Süd UG (haftungsbeschränkt) – Niebüll",
      "type": "Registerbekanntmachung nach dem Umwandlungsgesetz",
      "state": "Schleswig-Holstein",
      "amtsgericht": "Amtsgericht Flensburg",
      "registernummer": "HRB 15869",
      "registerart": "HRB",
      "company_name": "Solarkonzept Nord-Süd UG (haftungsbeschränkt)",
      "company_seat": "Niebüll",
      "details": "08.10.2024 (Bekanntmachungsdatum)\n\nSchleswig-Holstein Amtsgericht Flensburg HRB 15869\nRegisterbekanntmachung nach dem Umwandlungsgesetz 08.10.2024 (Eintragungsdatum)\n\nSolarkonzept Nord-Süd UG (haftungsbeschränkt)\nGesellschaft mit beschränkter Haftung\nNiebüll\n\nZu Eintragungsnummer 2 vom 08.10.2024 wird als nicht eingetragen veröffentlicht: Den Gläubigern der an der Verschmelzung beteiligten Rechtsträger ist, wenn sie binnen sechs Monaten nach dem Tag, an dem die Eintragung der Verschmelzung in das Register des Sitzes desjenigen Rechtsträgers, dessen Gläubiger sie sind, als bekannt gemacht gilt, ihren Anspruch nach Grund und Höhe schriftlich anmelden, Sicherheit zu leisten, soweit sie nicht Befriedigung verlangen können. Dieses Recht steht den Gläubigern jedoch nur zu, wenn sie glaubhaft machen, dass durch die Verschmelzung die Erfüllung ihrer Forderung gefährdet wird."
    },
    {
      "date": "2024-10-08",
      "id": "89544",
      "original_text": "Registerbekanntmachung nach dem Umwandlungsgesetz\nSchleswig-Holstein Amtsgericht Kiel HRA 12485\nSprint Transport + Logistik GmbH & Co. KG – Neumünster",
      "type": "Registerbekanntmachung nach dem Umwandlungsgesetz",
      "state": "Schleswig-Holstein",
      "amtsgericht": "Amtsgericht Kiel",
      "registernummer": "HRA 12485",
      "registerart": "HRA",
      "company_name": "Sprint Transport + Logistik GmbH & Co. KG",
      "company_seat": "Neumünster",
      "details": "08.10.2024 (Bekanntmachungsdatum)\n\nSchleswig-Holstein Amtsgericht Kiel HRA 12485\nRegisterbekanntmachung nach dem Umwandlungsgesetz 04.10.2024 (Eintragungsdatum)\n\nSprint Transport + Logistik GmbH & Co. KG\nKommanditgesellschaft\nNeumünster\n\nZu Eintragungsnummer 1 vom 04.10.2024 wird als nicht eingetragen veröffentlicht: Den Gläubigern ist, wenn sie binnen sechs Monaten nach dem Tag, an dem die Eintragung der Umwandlung bekannt gemacht worden ist, ihren Anspruch nach Grund und Höhe schriftlich anmelden, Sicherheit zu leisten, soweit sie nicht Befriedigung verlangen können. Dieses Recht steht den Gläubigern jedoch nur zu, wenn sie glaubhaft machen, dass durch die Umwandlung die Erfüllung ihrer Forderung gefährdet wird."
    },
    {
      "date": "2024-10-08",
      "id": "89566",
      "original_text": "Einreichung neuer Dokumente\nRheinland-Pfalz Amtsgericht Montabaur HRB 10570\nStadtwerke Neuwied GmbH – Neuwied",
      "type": "Einreichung neuer Dokumente",
      "state": "Rheinland-Pfalz",
      "amtsgericht": "Amtsgericht Montabaur",
      "registernummer": "HRB 10570",
      "registerart": "HRB",
      "company_name": "Stadtwerke Neuwied GmbH",
      "company_seat": "Neuwied",
      "details": "08.10.2024 (Bekanntmachungsdatum)\n\nRheinland-Pfalz Amtsgericht Montabaur HRB 10570\nEinreichung neuer Dokumente 08.10.2024 (Eintragungsdatum)\n\nStadtwerke Neuwied GmbH\nGesellschaft mit beschränkter Haftung\nNeuwied\n\nDem Registergericht ist eine neue Liste der Mitglieder des Aufsichtsrates eingereicht worden."
    },
    {
      "date": "2024-10-08",
      "id": "89470",
      "original_text": "Registerbekanntmachung nach dem Umwandlungsgesetz\nBaden-Württemberg Amtsgericht Stuttgart HRB 370319\nStiefel Verwaltungs GmbH – Trochtelfingen",
      "type": "Registerbekanntmachung nach dem Umwandlungsgesetz",
      "state": "Baden-Württemberg",
      "amtsgericht": "Amtsgericht Stuttgart",
      "registernummer": "HRB 370319",
      "registerart": "HRB",
      "company_name": "Stiefel Verwaltungs GmbH",
      "company_seat": "Trochtelfingen",
      "details": "08.10.2024 (Bekanntmachungsdatum)\n\nBaden-Württemberg Amtsgericht Stuttgart HRB 370319\nRegisterbekanntmachung nach dem Umwandlungsgesetz 08.10.2024 (Eintragungsdatum)\n\nStiefel Verwaltungs GmbH\nGesellschaft mit beschränkter Haftung\nTrochtelfingen\n\nAls nicht eingetragen wird bekanntgemacht:\nDen Gläubigern der an der Verschmelzung beteiligten Rechtsträger ist, wenn sie binnen sechs Monaten nach dem Tag, an dem die Eintragung der Verschmelzung in das Register des Sitzes desjenigen Rechtsträgers, dessen Gläubiger sie sind, nach § 19 Abs. 3 UmwG als bekanntgemacht gilt, ihren Anspruch nach Grund und Höhe schriftlich anmelden, Sicherheit zu leisten, soweit sie nicht Befriedigung verlangen können. Dieses Recht steht den Gläubigern jedoch nur zu, wenn sie glaubhaft machen, dass durch die Verschmelzung die Erfüllung ihrer Forderung gefährdet wird."
    },
    {
      "date": "2024-10-08",
      "id": "89577",
      "original_text": "Registerbekanntmachung nach dem Umwandlungsgesetz\nNordrhein-Westfalen Amtsgericht Dortmund HRB 24417\nStrahlentherapie am St. Johannes-Hospital - MVZ GmbH – Dortmund",
      "type": "Registerbekanntmachung nach dem Umwandlungsgesetz",
      "state": "Nordrhein-Westfalen",
      "amtsgericht": "Amtsgericht Dortmund",
      "registernummer": "HRB 24417",
      "registerart": "HRB",
      "company_name": "Strahlentherapie am St. Johannes-Hospital - MVZ GmbH",
      "company_seat": "Dortmund",
      "details": "08.10.2024 (Bekanntmachungsdatum)\n\nNordrhein-Westfalen Amtsgericht Dortmund HRB 24417\nRegisterbekanntmachung nach dem Umwandlungsgesetz 07.10.2024 (Eintragungsdatum)\n\nStrahlentherapie am St. Johannes-Hospital - MVZ GmbH\nGesellschaft mit beschränkter Haftung\nDortmund\n\nDie Gesellschaft hat Gläubigern, deren Forderungen vor dieser Bekanntmachung begründet worden sind, Sicherheit zu leisten, soweit sie nicht Befriedigung verlangen können, wenn sie sich binnen sechs Monaten zu diesem Zweck melden."
    },
    {
      "date": "2024-10-08",
      "id": "89561",
      "original_text": "Registerbekanntmachung nach dem Umwandlungsgesetz\nNiedersachsen Amtsgericht Tostedt HRA 205372\nStrelski Transport Service e. K. – Oerel",
      "type": "Registerbekanntmachung nach dem Umwandlungsgesetz",
      "state": "Niedersachsen",
      "amtsgericht": "Amtsgericht Tostedt",
      "registernummer": "HRA 205372",
      "registerart": "HRA",
      "company_name": "Strelski Transport Service e. K.",
      "company_seat": "Oerel",
      "details": "08.10.2024 (Bekanntmachungsdatum)\n\nNiedersachsen Amtsgericht Tostedt HRA 205372\nRegisterbekanntmachung nach dem Umwandlungsgesetz 08.10.2024 (Eintragungsdatum)\n\nStrelski Transport Service e. K.\nEinzelkaufmann / Einzelkauffrau\nOerel\n\nDen Gläubigern der an der Ausgliederung beteiligten Rechtsträger ist, wenn sie binnen sechs Monaten nach dem Tag, an dem die Eintragung der Ausgliederung in das Register des Sitzes desjenigen Rechtsträgers, dessen Gläubiger sie sind, nach § 19 Abs. 3 UmwG als bekannt gemacht gilt, ihren Anspruch nach Grund und Höhe schriftlich anmelden, Sicherheit zu leisten, soweit sie nicht Befriedigung verlangen können. Dieses Recht steht den Gläubigern jedoch nur zu, wenn sie glaubhaft machen, dass durch die Ausgliederung die Erfüllung der Forderung gefährdet wird."
    },
    {
      "date": "2024-10-08",
      "id": "89612",
      "original_text": "Einreichung neuer Dokumente\nThüringen Amtsgericht Jena HRB 502044\nTEAG Thüringer Energie AG – Erfurt",
      "type": "Einreichung neuer Dokumente",
      "state": "Thüringen",
      "amtsgericht": "Amtsgericht Jena",
      "registernummer": "HRB 502044",
      "registerart": "HRB",
      "company_name": "TEAG Thüringer Energie AG",
      "company_seat": "Erfurt",
      "details": "08.10.2024 (Bekanntmachungsdatum)\n\nThüringen Amtsgericht Jena HRB 502044\nEinreichung neuer Dokumente 08.10.2024 (Eintragungsdatum)\n\nTEAG Thüringer Energie AG\nAktiengesellschaft\nErfurt\n\nBekanntmachung gem. § 106 AktG: Aufgrund einer Veränderung in den Personen der Aufsichtsratsmitglieder ist durch den Vorstand eine neue Liste zum Handelsregister eingereicht worden."
    },
    {
      "date": "2024-10-08",
      "id": "89448",
      "original_text": "Registerbekanntmachung nach dem Umwandlungsgesetz\nBayern Amtsgericht München HRB 245441\nTKN Telekabel - Nord GmbH – Unterföhring",
      "type": "Registerbekanntmachung nach dem Umwandlungsgesetz",
      "state": "Bayern",
      "amtsgericht": "Amtsgericht München",
      "registernummer": "HRB 245441",
      "registerart": "HRB",
      "company_name": "TKN Telekabel - Nord GmbH",
      "company_seat": "Unterföhring",
      "details": "08.10.2024 (Bekanntmachungsdatum)\n\nBayern Amtsgericht München HRB 245441\nRegisterbekanntmachung nach dem Umwandlungsgesetz 07.10.2024 (Eintragungsdatum)\n\nTKN Telekabel - Nord GmbH\nGesellschaft mit beschränkter Haftung\nUnterföhring\n\nDen Gläubigern der an der Verschmelzung beteiligten Rechtsträger ist, wenn sie binnen sechs Monaten nach dem Tag, an dem die Eintragung der Verschmelzung in das Register des Sitzes desjenigen Rechtsträgers, dessen Gläubiger sie sind, nach § 19 Abs. 3 UmwG als bekannt gemacht gilt, ihren Anspruch nach Grund und Höhe schriftlich anmelden, Sicherheit zu leisten, soweit sie nicht Befriedigung verlangen können. Dieses Recht steht den Gläubigern jedoch nur zu, wenn sie glaubhaft machen, dass durch die Verschmelzung die Erfüllung ihrer Forderung gefährdet wird."
    },
    {
      "date": "2024-10-08",
      "id": "89622",
      "original_text": "Einreichung neuer Dokumente\nHessen Amtsgericht Frankfurt am Main HRB 120599\nThe Payments Group Holding GmbH & Co. KGaA – Frankfurt am Main",
      "type": "Einreichung neuer Dokumente",
      "state": "Hessen",
      "amtsgericht": "Amtsgericht Frankfurt am Main",
      "registernummer": "HRB 120599",
      "registerart": "HRB",
      "company_name": "The Payments Group Holding GmbH & Co. KGaA",
      "company_seat": "Frankfurt am Main",
      "details": "08.10.2024 (Bekanntmachungsdatum)\n\nHessen Amtsgericht Frankfurt am Main HRB 120599\nEinreichung neuer Dokumente 17.09.2024 (Eintragungsdatum)\n\nThe Payments Group Holding GmbH & Co. KGaA\nKommanditgesellschaft auf Aktien\nFrankfurt am Main\n\nDurch eine Änderung in den Personen der Aufsichtsratsmitglieder ist eine Liste der Mitglieder des Aufsichtsrates zum Handelsregister eingereicht worden."
    },
    {
      "date": "2024-10-08",
      "id": "89429",
      "original_text": "Registerbekanntmachung nach dem Umwandlungsgesetz\nBayern Amtsgericht Traunstein HRB 15419\nThermomess Wärmemessdienst AG – Wasserburg a.Inn",
      "type": "Registerbekanntmachung nach dem Umwandlungsgesetz",
      "state": "Bayern",
      "amtsgericht": "Amtsgericht Traunstein",
      "registernummer": "HRB 15419",
      "registerart": "HRB",
      "company_name": "Thermomess Wärmemessdienst AG",
      "company_seat": "Wasserburg a.Inn",
      "details": "08.10.2024 (Bekanntmachungsdatum)\n\nBayern Amtsgericht Traunstein HRB 15419\nRegisterbekanntmachung nach dem Umwandlungsgesetz 07.10.2024 (Eintragungsdatum)\n\nThermomess Wärmemessdienst AG\nAktiengesellschaft\nWasserburg a.Inn\n\nDen Gläubigern des formwechselnden Rechtsträgers ist, wenn sie binnen sechs Monaten nach dem Tag, an dem die Eintragung des Formwechsels nach § 201 UmwG als bekannt gemacht gilt, ihren Anspruch nach Grund und Höhe schriftlich anmelden, Sicherheit zu leisten, soweit sie nicht Befriedigung verlangen können. Dieses Recht steht den Gläubigern jedoch nur zu, wenn sie glaubhaft machen, dass durch den Formwechsel die Erfüllung ihrer Forderung gefährdet wird."
    },
    {
      "date": "2024-10-08",
      "id": "89527",
      "original_text": "Registerbekanntmachung nach dem Umwandlungsgesetz\nBerlin Amtsgericht Berlin (Charlottenburg) HRB 216181\nThis is Skin Matter UG (haftungsbeschränkt) – Berlin",
      "type": "Registerbekanntmachung nach dem Umwandlungsgesetz",
      "state": "Berlin",
      "amtsgericht": "Amtsgericht Berlin (Charlottenburg)",
      "registernummer": "HRB 216181",
      "registerart": "HRB",
      "company_name": "This is Skin Matter UG (haftungsbeschränkt)",
      "company_seat": "Berlin",
      "details": "08.10.2024 (Bekanntmachungsdatum)\n\nBerlin Amtsgericht Berlin (Charlottenburg) HRB 216181\nRegisterbekanntmachung nach dem Umwandlungsgesetz 07.10.2024 (Eintragungsdatum)\n\nThis is Skin Matter UG (haftungsbeschränkt)\nGesellschaft mit beschränkter Haftung\nBerlin\n\nZu Eintragungsnummer 2 vom 07.10.2024 wird als nicht eingetragen veröffentlicht:Den Gläubigern der an der Verschmelzung beteiligten Rechtsträger ist, wenn sie binnen sechs Monaten nach dem Tag, an dem die Eintragung der Verschmelzung in das Register des Sitzes desjenigen Rechtsträgers, dessen Gläubiger sie sind, als bekannt gemacht gilt, ihren Anspruch nach Grund und Höhe schriftlich anmelden, Sicherheit zu leisten, soweit sie nicht Befriedigung verlangen können. Dieses Recht steht den Gläubigern jedoch nur zu, wenn sie glaubhaft machen, dass durch die Verschmelzung die Erfüllung ihrer Forderung gefährdet wird. Das Recht, Sicherheitsleistung zu verlangen, steht Gläubigern nicht zu, die im Falle der Insolvenz ein Recht auf vorzugsweise Befriedigung aus einer Deckungsmasse haben, die nach gesetzlicher Vorschrift zu ihrem Schutz errichtet und staatlich überwacht ist."
    },
    {
      "date": "2024-10-08",
      "id": "89529",
      "original_text": "Löschungsankündigung\nMecklenburg-Vorpommern Amtsgericht Rostock HRB 13078\nTransport und KFZ-Dienstleistung Nord UG (haftungsbeschränkt) – Dummerstorf",
      "type": "Löschungsankündigung",
      "state": "Mecklenburg-Vorpommern",
      "amtsgericht": "Amtsgericht Rostock",
      "registernummer": "HRB 13078",
      "registerart": "HRB",
      "company_name": "Transport und KFZ-Dienstleistung Nord UG (haftungsbeschränkt)",
      "company_seat": "Dummerstorf",
      "details": "08.10.2024 (Bekanntmachungsdatum)\n\nMecklenburg-Vorpommern Amtsgericht Rostock HRB 13078\nLöschungsankündigung\n\nTransport und KFZ-Dienstleistung Nord UG (haftungsbeschränkt)\nGesellschaft mit beschränkter Haftung\nDummerstorf\n\nDas Registergericht beabsichtigt, die im Handelsregister eingetragene Gesellschaft von Amts wegen nach § 394 FamFG zu löschen. Die Frist zur Erhebung eines Widerspruchs gegen die beabsichtigte Löschung wird auf 1 Monat festgesetzt."
    },
    {
      "date": "2024-10-08",
      "id": "89434",
      "original_text": "Registerbekanntmachung nach dem Umwandlungsgesetz\nBayern Amtsgericht München HRB 182162\nUH INVEST GmbH – Grünwald",
      "type": "Registerbekanntmachung nach dem Umwandlungsgesetz",
      "state": "Bayern",
      "amtsgericht": "Amtsgericht München",
      "registernummer": "HRB 182162",
      "registerart": "HRB",
      "company_name": "UH INVEST GmbH",
      "company_seat": "Grünwald",
      "details": "08.10.2024 (Bekanntmachungsdatum)\n\nBayern Amtsgericht München HRB 182162\nRegisterbekanntmachung nach dem Umwandlungsgesetz 07.10.2024 (Eintragungsdatum)\n\nUH INVEST GmbH\nGesellschaft mit beschränkter Haftung\nGrünwald\n\nDen Gläubigern der an der Verschmelzung beteiligten Rechtsträger ist, wenn sie binnen sechs Monaten nach dem Tag, an dem die Eintragung der Verschmelzung in das Register des Sitzes desjenigen Rechtsträgers, dessen Gläubiger sie sind, nach § 19 Abs. 3 UmwG als bekannt gemacht gilt, ihren Anspruch nach Grund und Höhe schriftlich anmelden, Sicherheit zu leisten, soweit sie nicht Befriedigung verlangen können. Dieses Recht steht den Gläubigern jedoch nur zu, wenn sie glaubhaft machen, dass durch die Verschmelzung die Erfüllung ihrer Forderung gefährdet wird."
    },
    {
      "date": "2024-10-08",
      "id": "89615",
      "original_text": "Registerbekanntmachung nach dem Umwandlungsgesetz\nThüringen Amtsgericht Jena HRB 506655\nUV Systec GmbH – Saalfeld/Saale",
      "type": "Registerbekanntmachung nach dem Umwandlungsgesetz",
      "state": "Thüringen",
      "amtsgericht": "Amtsgericht Jena",
      "registernummer": "HRB 506655",
      "registerart": "HRB",
      "company_name": "UV Systec GmbH",
      "company_seat": "Saalfeld/Saale",
      "details": "08.10.2024 (Bekanntmachungsdatum)\n\nThüringen Amtsgericht Jena HRB 506655\nRegisterbekanntmachung nach dem Umwandlungsgesetz 08.10.2024 (Eintragungsdatum)\n\nUV Systec GmbH\nGesellschaft mit beschränkter Haftung\nSaalfeld/Saale\n\nNicht eingetragen: Den Gläubigern der an der Verschmelzung beteiligten Rechtsträger, ist wenn sie binnen sechs Monaten nach dem Tag, an dem die Eintragung der Verschmelzung in das Register des Sitzes desjenigen Rechtsträgers, dessen Gläubiger sie sind,  nach § 19 Abs. 3 UmwG als bekanntgemacht gilt, ihren Anspruch nach Grund und Höhe schriftlich anmelden, Sicherheit zu leisten, soweit sie nicht Befriedigung verlangen können. Dieses Recht steht ihnen jedoch nur zu, wenn sie glaubhaft machen, daß durch die Verschmelzung die Erfüllung ihrer Forderung gefährdet wird."
    },
    {
      "date": "2024-10-08",
      "id": "89471",
      "original_text": "Löschungsankündigung\nBrandenburg Amtsgericht Potsdam HRB 34996\nUltra Transport GmbH – Blankenfelde-Mahlow",
      "type": "Löschungsankündigung",
      "state": "Brandenburg",
      "amtsgericht": "Amtsgericht Potsdam",
      "registernummer": "HRB 34996",
      "registerart": "HRB",
      "company_name": "Ultra Transport GmbH",
      "company_seat": "Blankenfelde-Mahlow",
      "details": "08.10.2024 (Bekanntmachungsdatum)\n\nBrandenburg Amtsgericht Potsdam HRB 34996\nLöschungsankündigung\n\nUltra Transport GmbH\nGesellschaft mit beschränkter Haftung\nBlankenfelde-Mahlow\n\nBei der nachstehenden Gesellschaft wird das Amtslöschungsverfahren gemäß § 394 FamFG eingeleitet. Widerspruchsfrist: 8 Wochen"
    },
    {
      "date": "2024-10-08",
      "id": "89502",
      "original_text": "Löschungsankündigung\nBaden-Württemberg Amtsgericht Mannheim HRB 704468\nUmzugs- und Gebäudemanagement Die Dienstleister GmbH – Pforzheim",
      "type": "Löschungsankündigung",
      "state": "Baden-Württemberg",
      "amtsgericht": "Amtsgericht Mannheim",
      "registernummer": "HRB 704468",
      "registerart": "HRB",
      "company_name": "Umzugs- und Gebäudemanagement Die Dienstleister GmbH",
      "company_seat": "Pforzheim",
      "details": "08.10.2024 (Bekanntmachungsdatum)\n\nBaden-Württemberg Amtsgericht Mannheim HRB 704468\nLöschungsankündigung\n\nUmzugs- und Gebäudemanagement Die Dienstleister GmbH\nGesellschaft mit beschränkter Haftung\nPforzheim\n\nAls nicht eingetragen wird bekanntgemacht: Das Gericht beabsichtigt, die Gesellschaft wegen Vermögenslosigkeit im Handelsregister von Amts wegen nach § 394 FamFG zu löschen. Die Frist zur Geltendmachung eines Widerspruchs gegen die beabsichtigte Löschung ist auf einen Monat ab Veröffentlichung bestimmt."
    },
    {
      "date": "2024-10-08",
      "id": "89461",
      "original_text": "Registerbekanntmachung nach dem Umwandlungsgesetz\nBayern Amtsgericht Ingolstadt HRB 101699\nVIB Vermögen AG – Neuburg a.d.Donau",
      "type": "Registerbekanntmachung nach dem Umwandlungsgesetz",
      "state": "Bayern",
      "amtsgericht": "Amtsgericht Ingolstadt",
      "registernummer": "HRB 101699",
      "registerart": "HRB",
      "company_name": "VIB Vermögen AG",
      "company_seat": "Neuburg a.d.Donau",
      "details": "08.10.2024 (Bekanntmachungsdatum)\n\nBayern Amtsgericht Ingolstadt HRB 101699\nRegisterbekanntmachung nach dem Umwandlungsgesetz 07.10.2024 (Eintragungsdatum)\n\nVIB Vermögen AG\nAktiengesellschaft\nNeuburg a.d.Donau\n\nDen Gläubigern der an der Verschmelzung beteiligten Rechtsträger ist, wenn sie binnen sechs Monaten nach dem Tag, an dem die Eintragung der Verschmelzung in das Register des Sitzes desjenigen Rechtsträgers, dessen Gläubiger sie sind, nach § 19 Abs. 3 UmwG als bekannt gemacht gilt, ihren Anspruch nach Grund und Höhe schriftlich anmelden, Sicherheit zu leisten, soweit sie nicht Befriedigung verlangen können. Dieses Recht steht den Gläubigern jedoch nur zu, wenn sie glaubhaft machen, dass durch die Verschmelzung die Erfüllung ihrer Forderung gefährdet wird."
    },
    {
      "date": "2024-10-08",
      "id": "89602",
      "original_text": "Löschungsankündigung\nNordrhein-Westfalen Amtsgericht Iserlohn HRB 3264\nVM Edelstahltechnik GmbH – Plettenberg",
      "type": "Löschungsankündigung",
      "state": "Nordrhein-Westfalen",
      "amtsgericht": "Amtsgericht Iserlohn",
      "registernummer": "HRB 3264",
      "registerart": "HRB",
      "company_name": "VM Edelstahltechnik GmbH",
      "company_seat": "Plettenberg",
      "details": "08.10.2024 (Bekanntmachungsdatum)\n\nNordrhein-Westfalen Amtsgericht Iserlohn HRB 3264\nLöschungsankündigung\n\nVM Edelstahltechnik GmbH\nGesellschaft mit beschränkter Haftung\nPlettenberg\n\nDas Registergericht beabsichtigt, die im Handelsregister eingetragene  Gesellschaft gemäß § 394 Absatz 1 FamFG wegen Vermögenslosigkeit von Amts wegen zu löschen. Gegen diese Verfügung kann Widerspruch eingelegt werden. Die Frist zur Erhebung eines Widerspruchs gegen die beabsichtigte Löschung von Amts wegen ist auf zwei Monate festgesetzt.\n\nRechtsbehelfsbelehrung:\nGegen diese Verfügung können Sie Widerspruch einlegen.\n\nDer Widerspruch ist bei dem Amtsgericht Iserlohn, Friedrichstraße 108 - 110, 58636 Iserlohn schriftlich in deutscher Sprache oder zur Niederschrift der Geschäftsstelle einzulegen. Der Widerspruch kann auch zur Niederschrift der Geschäftsstelle eines jeden Amtsgerichtes abgegeben werden.\n\nDer Widerspruch muss spätestens innerhalb der gesetzten Frist bei dem Amtsgericht Iserlohn eingegangen sein. Dies gilt auch dann, wenn der Widerspruch zur Niederschrift der Geschäftsstelle eines anderen Amtsgerichtes abgegeben wurde. Die Frist beginnt mit der Veröffentlichung. Fällt das Ende der Frist auf einen Sonntag, einen allgemeinen Feiertag oder Sonnabend, so endet die Frist mit Ablauf des nächsten Werktages.\n\nDer Widerspruch muss die Bezeichnung der angefochtenen Verfügung sowie die Erklärung enthalten, dass Widerspruch gegen diese Verfügung eingelegt wird. Er ist zu unterzeichnen und soll begründet werden."
    },
    {
      "date": "2024-10-08",
      "id": "89522",
      "original_text": "Einreichung neuer Dokumente\nBerlin Amtsgericht Berlin (Charlottenburg) HRB 260254\nValue AG the valuation group – Berlin",
      "type": "Einreichung neuer Dokumente",
      "state": "Berlin",
      "amtsgericht": "Amtsgericht Berlin (Charlottenburg)",
      "registernummer": "HRB 260254",
      "registerart": "HRB",
      "company_name": "Value AG the valuation group",
      "company_seat": "Berlin",
      "details": "08.10.2024 (Bekanntmachungsdatum)\n\nBerlin Amtsgericht Berlin (Charlottenburg) HRB 260254\nEinreichung neuer Dokumente\n\nValue AG the valuation group\nAktiengesellschaft\nBerlin\n\nAls nicht eingetragen wird veröffentlicht:Es wurde eine neue Liste der Aufsichtsratsmitglieder eingereicht (§ 106 AktG)."
    },
    {
      "date": "2024-10-08",
      "id": "89485",
      "original_text": "Registerbekanntmachung nach dem Umwandlungsgesetz\nHamburg Amtsgericht Hamburg HRB 166315\nVerwaltungsgesellschaft Fürstengarten Lauenburg GmbH – Hamburg",
      "type": "Registerbekanntmachung nach dem Umwandlungsgesetz",
      "state": "Hamburg",
      "amtsgericht": "Amtsgericht Hamburg",
      "registernummer": "HRB 166315",
      "registerart": "HRB",
      "company_name": "Verwaltungsgesellschaft Fürstengarten Lauenburg GmbH",
      "company_seat": "Hamburg",
      "details": "08.10.2024 (Bekanntmachungsdatum)\n\nHamburg Amtsgericht Hamburg HRB 166315\nRegisterbekanntmachung nach dem Umwandlungsgesetz 08.10.2024 (Eintragungsdatum)\n\nVerwaltungsgesellschaft Fürstengarten Lauenburg GmbH\nGesellschaft mit beschränkter Haftung\nHamburg\n\nAls nicht eingetragen wird bekannt gemacht:\nDen Gläubigern der an der Verschmelzung beteiligten Gesellschaften ist, wenn sie binnen sechs Monaten nach dem Tag, an dem die Eintragung der Verschmelzung in das Register des Sitzes desjenigen Rechtsträgers, dessen Gläubiger sie sind, nach § 19 Absatz 3 UmwG als bekannt gemacht gilt, ihren Anspruch nach Grund und Höhe schriftlich anmelden, Sicherheit zu leisten, soweit sie nicht Befriedigung verlangen können. Dieses Recht steht den Gläubigern jedoch nur zu, wenn sie glaubhaft machen, dass durch die Verschmelzung die Erfüllung ihrer Forderung gefährdet wird."
    },
    {
      "date": "2024-10-08",
      "id": "89571",
      "original_text": "Sonstige Registerbekanntmachung\nNordrhein-Westfalen Amtsgericht Recklinghausen HRB 5569\nVestische Caritas-Altenhilfe GmbH – Datteln",
      "type": "Sonstige Registerbekanntmachung",
      "state": "Nordrhein-Westfalen",
      "amtsgericht": "Amtsgericht Recklinghausen",
      "registernummer": "HRB 5569",
      "registerart": "HRB",
      "company_name": "Vestische Caritas-Altenhilfe GmbH",
      "company_seat": "Datteln",
      "details": "08.10.2024 (Bekanntmachungsdatum)\n\nNordrhein-Westfalen Amtsgericht Recklinghausen HRB 5569\nSonstige Registerbekanntmachung 08.10.2024 (Eintragungsdatum)\n\nVestische Caritas-Altenhilfe GmbH\nGesellschaft mit beschränkter Haftung\nDatteln\n\nDem Registergericht ist eine neue Liste der Mitglieder des Aufsichtsrates eingereicht worden."
    },
    {
      "date": "2024-10-08",
      "id": "89562",
      "original_text": "Registerbekanntmachung nach dem Umwandlungsgesetz\nNiedersachsen Amtsgericht Oldenburg (Oldenburg) GnR 150013 früher Amtsgericht Cloppenburg\nViehvermarktung Löningen und Umgebung eG Erzeugergemeinschaft für Schlacht- und Nutzvieh – Löningen",
      "type": "Registerbekanntmachung nach dem Umwandlungsgesetz",
      "state": "Niedersachsen",
      "amtsgericht": "Amtsgericht Oldenburg (Oldenburg)",
      "registernummer": "GnR 150013",
      "registerart": "GnR",
      "company_name": "Viehvermarktung Löningen und Umgebung eG Erzeugergemeinschaft für Schlacht- und Nutzvieh",
      "company_seat": "Löningen",
      "former_amtsgericht": "Cloppenburg",
      "details": "08.10.2024 (Bekanntmachungsdatum)\n\nNiedersachsen Amtsgericht Oldenburg (Oldenburg) GnR 150013 früher Amtsgericht Cloppenburg\nRegisterbekanntmachung nach dem Umwandlungsgesetz 08.10.2024 (Eintragungsdatum)\n\nViehvermarktung Löningen und Umgebung eG Erzeugergemeinschaft für Schlacht- und Nutzvieh\neingetragene Genossenschaft\nLöningen\n\nDen Gläubigern der an der Verschmelzung beteiligten Rechtsträger ist, wenn sie binnen sechs Monaten nach dem Tag, an dem die Eintragung der Verschmelzung in das Register des Sitzes desjenigen Rechtsträgers, dessen Gläubiger sie sind, nach § 19  Abs.  3 UmwG als bekannt gemacht gilt, ihren Anspruch nach Grund und Höhe schriftlich anmelden, Sicherheit zu leisten, soweit sie nicht Befriedigung verlangen können. Dieses Recht steht den Gläubigern jedoch nur zu, wenn sie glaubhaft machen, dass durch die Verschmelzung die Erfüllung der Forderung gefährdet wird."
    },
    {
      "date": "2024-10-08",
      "id": "89462",
      "original_text": "Registerbekanntmachung nach dem Umwandlungsgesetz\nBayern Amtsgericht München HRB 193814\nViniport GmbH – Garmisch-Partenkirchen",
      "type": "Registerbekanntmachung nach dem Umwandlungsgesetz",
      "state": "Bayern",
      "amtsgericht": "Amtsgericht München",
      "registernummer": "HRB 193814",
      "registerart": "HRB",
      "company_name": "Viniport GmbH",
      "company_seat": "Garmisch-Partenkirchen",
      "details": "08.10.2024 (Bekanntmachungsdatum)\n\nBayern Amtsgericht München HRB 193814\nRegisterbekanntmachung nach dem Umwandlungsgesetz 07.10.2024 (Eintragungsdatum)\n\nViniport GmbH\nGesellschaft mit beschränkter Haftung\nGarmisch-Partenkirchen\n\nDen Gläubigern der an der Verschmelzung beteiligten Rechtsträger ist, wenn sie binnen sechs Monaten nach dem Tag, an dem die Eintragung der Verschmelzung in das Register des Sitzes desjenigen Rechtsträgers, dessen Gläubiger sie sind, nach § 19 Abs. 3 UmwG als bekannt gemacht gilt, ihren Anspruch nach Grund und Höhe schriftlich anmelden, Sicherheit zu leisten, soweit sie nicht Befriedigung verlangen können. Dieses Recht steht den Gläubigern jedoch nur zu, wenn sie glaubhaft machen, dass durch die Verschmelzung die Erfüllung ihrer Forderung gefährdet wird."
    },
    {
      "date": "2024-10-08",
      "id": "89509",
      "original_text": "Registerbekanntmachung nach dem Umwandlungsgesetz\nBaden-Württemberg Amtsgericht Mannheim HRB 736018\nVulcan Energie Ressourcen GmbH – Karlsruhe",
      "type": "Registerbekanntmachung nach dem Umwandlungsgesetz",
      "state": "Baden-Württemberg",
      "amtsgericht": "Amtsgericht Mannheim",
      "registernummer": "HRB 736018",
      "registerart": "HRB",
      "company_name": "Vulcan Energie Ressourcen GmbH",
      "company_seat": "Karlsruhe",
      "details": "08.10.2024 (Bekanntmachungsdatum)\n\nBaden-Württemberg Amtsgericht Mannheim HRB 736018\nRegisterbekanntmachung nach dem Umwandlungsgesetz 08.10.2024 (Eintragungsdatum)\n\nVulcan Energie Ressourcen GmbH\nGesellschaft mit beschränkter Haftung\nKarlsruhe\n\nDen Gläubigern der an der Verschmelzung beteiligten Rechtsträger ist, wenn sie binnen sechs Monaten nach dem Tag, an dem die Eintragung der Verschmelzung in das Register des Sitzes desjenigen Rechtsträgers, dessen Gläubiger sie sind, nach § 19 Abs. 3 UmwG als bekanntgemacht gilt, ihren Anspruch nach Grund und Höhe schriftlich anmelden, Sicherheit zu leisten, soweit sie nicht Befriedigung verlangen können. Dieses Recht steht den Gläubigern jedoch nur zu, wenn sie glaubhaft machen, dass durch die Verschmelzung die Erfüllung ihrer Forderung gefährdet wird."
    },
    {
      "date": "2024-10-08",
      "id": "89505",
      "original_text": "Registerbekanntmachung nach dem Umwandlungsgesetz\nBaden-Württemberg Amtsgericht Mannheim HRB 110969\nVulcan Energy Subsurface Solutions GmbH – Karlsruhe",
      "type": "Registerbekanntmachung nach dem Umwandlungsgesetz",
      "state": "Baden-Württemberg",
      "amtsgericht": "Amtsgericht Mannheim",
      "registernummer": "HRB 110969",
      "registerart": "HRB",
      "company_name": "Vulcan Energy Subsurface Solutions GmbH",
      "company_seat": "Karlsruhe",
      "details": "08.10.2024 (Bekanntmachungsdatum)\n\nBaden-Württemberg Amtsgericht Mannheim HRB 110969\nRegisterbekanntmachung nach dem Umwandlungsgesetz 08.10.2024 (Eintragungsdatum)\n\nVulcan Energy Subsurface Solutions GmbH\nGesellschaft mit beschränkter Haftung\nKarlsruhe\n\nDen Gläubigern der an der Verschmelzung beteiligten Rechtsträger ist, wenn sie binnen sechs Monaten nach dem Tag, an dem die Eintragung der Verschmelzung in das Register des Sitzes desjenigen Rechtsträgers, dessen Gläubiger sie sind, nach § 19 Abs. 3 UmwG als bekanntgemacht gilt, ihren Anspruch nach Grund und Höhe schriftlich anmelden, Sicherheit zu leisten, soweit sie nicht Befriedigung verlangen können. Dieses Recht steht den Gläubigern jedoch nur zu, wenn sie glaubhaft machen, dass durch die Verschmelzung die Erfüllung ihrer Forderung gefährdet wird."
    },
    {
      "date": "2024-10-08",
      "id": "89524",
      "original_text": "Registerbekanntmachung nach dem Umwandlungsgesetz\nHamburg Amtsgericht Hamburg HRB 173362\nWECOYA MARINE Underwriting GmbH – Hamburg",
      "type": "Registerbekanntmachung nach dem Umwandlungsgesetz",
      "state": "Hamburg",
      "amtsgericht": "Amtsgericht Hamburg",
      "registernummer": "HRB 173362",
      "registerart": "HRB",
      "company_name": "WECOYA MARINE Underwriting GmbH",
      "company_seat": "Hamburg",
      "details": "08.10.2024 (Bekanntmachungsdatum)\n\nHamburg Amtsgericht Hamburg HRB 173362\nRegisterbekanntmachung nach dem Umwandlungsgesetz 08.10.2024 (Eintragungsdatum)\n\nWECOYA MARINE Underwriting GmbH\nGesellschaft mit beschränkter Haftung\nHamburg\n\nAls nicht eingetragen wird bekannt gemacht:\nDen Gläubigern der an der Aufspaltung beteiligten Gesellschaften ist, wenn sie binnen sechs Monaten nach dem Tag, an dem die Eintragung der Aufspaltung in das Register des Sitzes desjenigen Rechtsträgers, dessen Gläubiger sie sind, nach § 19 Absatz 3 UmwG als bekannt gemacht gilt, ihren Anspruch nach Grund und Höhe schriftlich anmelden, Sicherheit zu leisten, soweit sie nicht Befriedigung verlangen können. Dieses Recht steht den Gläubigern jedoch nur zu, wenn sie glaubhaft machen, dass durch die Aufspaltung die Erfüllung ihrer Forderung gefährdet wird."
    },
    {
      "date": "2024-10-08",
      "id": "89525",
      "original_text": "Registerbekanntmachung nach dem Umwandlungsgesetz\nHamburg Amtsgericht Hamburg HRB 177200\nWECOYA SPECIALTY Underwriting GmbH – Hamburg",
      "type": "Registerbekanntmachung nach dem Umwandlungsgesetz",
      "state": "Hamburg",
      "amtsgericht": "Amtsgericht Hamburg",
      "registernummer": "HRB 177200",
      "registerart": "HRB",
      "company_name": "WECOYA SPECIALTY Underwriting GmbH",
      "company_seat": "Hamburg",
      "details": "08.10.2024 (Bekanntmachungsdatum)\n\nHamburg Amtsgericht Hamburg HRB 177200\nRegisterbekanntmachung nach dem Umwandlungsgesetz 08.10.2024 (Eintragungsdatum)\n\nWECOYA SPECIALTY Underwriting GmbH\nGesellschaft mit beschränkter Haftung\nHamburg\n\nAls nicht eingetragen wird bekannt gemacht:\nDen Gläubigern der an der Aufspaltung beteiligten Gesellschaften ist, wenn sie binnen sechs Monaten nach dem Tag, an dem die Eintragung der Aufspaltung in das Register des Sitzes desjenigen Rechtsträgers, dessen Gläubiger sie sind, nach § 19 Absatz 3 UmwG als bekannt gemacht gilt, ihren Anspruch nach Grund und Höhe schriftlich anmelden, Sicherheit zu leisten, soweit sie nicht Befriedigung verlangen können. Dieses Recht steht den Gläubigern jedoch nur zu, wenn sie glaubhaft machen, dass durch die Aufspaltung die Erfüllung ihrer Forderung gefährdet wird."
    },
    {
      "date": "2024-10-08",
      "id": "89604",
      "original_text": "Einreichung neuer Dokumente\nNordrhein-Westfalen Amtsgericht Paderborn HRB 3507\nWINCOR NIXDORF International GmbH – Paderborn",
      "type": "Einreichung neuer Dokumente",
      "state": "Nordrhein-Westfalen",
      "amtsgericht": "Amtsgericht Paderborn",
      "registernummer": "HRB 3507",
      "registerart": "HRB",
      "company_name": "WINCOR NIXDORF International GmbH",
      "company_seat": "Paderborn",
      "details": "08.10.2024 (Bekanntmachungsdatum)\n\nNordrhein-Westfalen Amtsgericht Paderborn HRB 3507\nEinreichung neuer Dokumente\n\nWINCOR NIXDORF International GmbH\nGesellschaft mit beschränkter Haftung\nPaderborn\n\nDem Registergericht ist eine neue Liste der Mitglieder des Aufsichtsrates eingereicht worden."
    },
    {
      "date": "2024-10-08",
      "id": "89614",
      "original_text": "Registerbekanntmachung nach dem Umwandlungsgesetz\nThüringen Amtsgericht Jena HRB 508323\nWITEC Handels GmbH – Laasdorf",
      "type": "Registerbekanntmachung nach dem Umwandlungsgesetz",
      "state": "Thüringen",
      "amtsgericht": "Amtsgericht Jena",
      "registernummer": "HRB 508323",
      "registerart": "HRB",
      "company_name": "WITEC Handels GmbH",
      "company_seat": "Laasdorf",
      "details": "08.10.2024 (Bekanntmachungsdatum)\n\nThüringen Amtsgericht Jena HRB 508323\nRegisterbekanntmachung nach dem Umwandlungsgesetz 08.10.2024 (Eintragungsdatum)\n\nWITEC Handels GmbH\nGesellschaft mit beschränkter Haftung\nLaasdorf\n\nNicht eingetragen: Den Gläubigern der an der Verschmelzung beteiligten Rechtsträger, ist wenn sie binnen sechs Monaten nach dem Tag, an dem die Eintragung der Verschmelzung in das Register des Sitzes desjenigen Rechtsträgers, dessen Gläubiger sie sind,  nach § 19 Abs. 3 UmwG als bekanntgemacht gilt, ihren Anspruch nach Grund und Höhe schriftlich anmelden, Sicherheit zu leisten, soweit sie nicht Befriedigung verlangen können. Dieses Recht steht ihnen jedoch nur zu, wenn sie glaubhaft machen, daß durch die Verschmelzung die Erfüllung ihrer Forderung gefährdet wird."
    },
    {
      "date": "2024-10-08",
      "id": "89611",
      "original_text": "Registerbekanntmachung nach dem Umwandlungsgesetz\nThüringen Amtsgericht Jena HRB 210308\nWITEC Holding GmbH – Laasdorf",
      "type": "Registerbekanntmachung nach dem Umwandlungsgesetz",
      "state": "Thüringen",
      "amtsgericht": "Amtsgericht Jena",
      "registernummer": "HRB 210308",
      "registerart": "HRB",
      "company_name": "WITEC Holding GmbH",
      "company_seat": "Laasdorf",
      "details": "08.10.2024 (Bekanntmachungsdatum)\n\nThüringen Amtsgericht Jena HRB 210308\nRegisterbekanntmachung nach dem Umwandlungsgesetz 08.10.2024 (Eintragungsdatum)\n\nWITEC Holding GmbH\nGesellschaft mit beschränkter Haftung\nLaasdorf\n\nNicht eingetragen: Den Gläubigern der an der Verschmelzung beteiligten Rechtsträger, ist wenn sie binnen sechs Monaten nach dem Tag, an dem die Eintragung der Verschmelzung in das Register des Sitzes desjenigen Rechtsträgers, dessen Gläubiger sie sind,  nach § 19 Abs. 3 UmwG als bekanntgemacht gilt, ihren Anspruch nach Grund und Höhe schriftlich anmelden, Sicherheit zu leisten, soweit sie nicht Befriedigung verlangen können. Dieses Recht steht ihnen jedoch nur zu, wenn sie glaubhaft machen, daß durch die Verschmelzung die Erfüllung ihrer Forderung gefährdet wird."
    },
    {
      "date": "2024-10-08",
      "id": "89532",
      "original_text": "Registerbekanntmachung nach dem Umwandlungsgesetz\nBaden-Württemberg Amtsgericht Ulm HRB 748513\nWilhelm Vermögens- und Verpachtungs GmbH – Achstetten",
      "type": "Registerbekanntmachung nach dem Umwandlungsgesetz",
      "state": "Baden-Württemberg",
      "amtsgericht": "Amtsgericht Ulm",
      "registernummer": "HRB 748513",
      "registerart": "HRB",
      "company_name": "Wilhelm Vermögens- und Verpachtungs GmbH",
      "company_seat": "Achstetten",
      "details": "08.10.2024 (Bekanntmachungsdatum)\n\nBaden-Württemberg Amtsgericht Ulm HRB 748513\nRegisterbekanntmachung nach dem Umwandlungsgesetz 08.10.2024 (Eintragungsdatum)\n\nWilhelm Vermögens- und Verpachtungs GmbH\nGesellschaft mit beschränkter Haftung\nAchstetten\n\nAls nicht eingetragen wird bekanntgemacht:\nDen Gläubigern der an der Ausgliederung beteiligten Rechtsträger ist, wenn sie binnen sechs Monaten nach dem Tag, an dem die Eintragung der Ausgliederung in das Register des Sitzes desjenigen Rechtsträgers, dessen Gläubiger sie sind, nach § 19 Abs. 3 UmwG als bekanntgemacht gilt, ihren Anspruch nach Grund und Höhe schriftlich anmelden, Sicherheit zu leisten, soweit sie nicht Befriedigung verlangen können. Dieses Recht steht den Gläubigern jedoch nur zu, wenn sie glaubhaft machen, dass durch die Ausgliederung die Erfüllung ihrer Forderung gefährdet wird."
    },
    {
      "date": "2024-10-08",
      "id": "89457",
      "original_text": "Registerbekanntmachung nach dem Umwandlungsgesetz\nBayern Amtsgericht München HRB 239038\nZOU BIZOU GmbH – München",
      "type": "Registerbekanntmachung nach dem Umwandlungsgesetz",
      "state": "Bayern",
      "amtsgericht": "Amtsgericht München",
      "registernummer": "HRB 239038",
      "registerart": "HRB",
      "company_name": "ZOU BIZOU GmbH",
      "company_seat": "München",
      "details": "08.10.2024 (Bekanntmachungsdatum)\n\nBayern Amtsgericht München HRB 239038\nRegisterbekanntmachung nach dem Umwandlungsgesetz 07.10.2024 (Eintragungsdatum)\n\nZOU BIZOU GmbH\nGesellschaft mit beschränkter Haftung\nMünchen\n\nDen Gläubigern der an der Verschmelzung beteiligten Rechtsträger ist, wenn sie binnen sechs Monaten nach dem Tag, an dem die Eintragung der Verschmelzung in das Register des Sitzes desjenigen Rechtsträgers, dessen Gläubiger sie sind, nach § 19 Abs. 3 UmwG als bekannt gemacht gilt, ihren Anspruch nach Grund und Höhe schriftlich anmelden, Sicherheit zu leisten, soweit sie nicht Befriedigung verlangen können. Dieses Recht steht den Gläubigern jedoch nur zu, wenn sie glaubhaft machen, dass durch die Verschmelzung die Erfüllung ihrer Forderung gefährdet wird."
    },
    {
      "date": "2024-10-08",
      "id": "89474",
      "original_text": "Registerbekanntmachung nach dem Umwandlungsgesetz\nHamburg Amtsgericht Hamburg HRB 153897\nfinztep GmbH – Hamburg",
      "type": "Registerbekanntmachung nach dem Umwandlungsgesetz",
      "state": "Hamburg",
      "amtsgericht": "Amtsgericht Hamburg",
      "registernummer": "HRB 153897",
      "registerart": "HRB",
      "company_name": "finztep GmbH",
      "company_seat": "Hamburg",
      "details": "08.10.2024 (Bekanntmachungsdatum)\n\nHamburg Amtsgericht Hamburg HRB 153897\nRegisterbekanntmachung nach dem Umwandlungsgesetz 08.10.2024 (Eintragungsdatum)\n\nfinztep GmbH\nGesellschaft mit beschränkter Haftung\nHamburg\n\nAls nicht eingetragen wird bekannt gemacht:\nDen Gläubigern der an der Verschmelzung beteiligten Gesellschaften ist, wenn sie binnen sechs Monaten nach dem Tag, an dem die Eintragung der Verschmelzung in das Register des Sitzes desjenigen Rechtsträgers, dessen Gläubiger sie sind, nach § 19 Absatz 3 UmwG als bekannt gemacht gilt, ihren Anspruch nach Grund und Höhe schriftlich anmelden, Sicherheit zu leisten, soweit sie nicht Befriedigung verlangen können. Dieses Recht steht den Gläubigern jedoch nur zu, wenn sie glaubhaft machen, dass durch die Verschmelzung die Erfüllung ihrer Forderung gefährdet wird."
    },
    {
      "date": "2024-10-08",
      "id": "89576",
      "original_text": "Registerbekanntmachung nach dem Umwandlungsgesetz\nNordrhein-Westfalen Amtsgericht Lemgo HRB 7603\nhouse of pet design GmbH – Lage",
      "type": "Registerbekanntmachung nach dem Umwandlungsgesetz",
      "state": "Nordrhein-Westfalen",
      "amtsgericht": "Amtsgericht Lemgo",
      "registernummer": "HRB 7603",
      "registerart": "HRB",
      "company_name": "house of pet design GmbH",
      "company_seat": "Lage",
      "details": "08.10.2024 (Bekanntmachungsdatum)\n\nNordrhein-Westfalen Amtsgericht Lemgo HRB 7603\nRegisterbekanntmachung nach dem Umwandlungsgesetz 08.10.2024 (Eintragungsdatum)\n\nhouse of pet design GmbH\nGesellschaft mit beschränkter Haftung\nLage\n\nDen Gläubigern der an der Verschmelzung beteiligten Rechtsträger ist, wenn sie binnen sechs Monaten nach dem Tag, an dem die Eintragung der Verschmelzung in das Register des Sitzes desjenigen Rechtsträgers, dessen Gläubiger sie sind, nach § 19 Absatz 3 UmwG als bekanntgemacht gilt, ihren Anspruch nach Grund und Höhe schriftlich anmelden, Sicherheit zu leisten, soweit sie nicht Befriedigung verlangen können. Dieses Recht steht den Gläubigern jedoch nur zu, wenn sie glaubhaft machen, dass durch die Verschmelzung die Erfüllung ihrer Forderung gefährdet wird."
    },
    {
      "date": "2024-10-08",
      "id": "89581",
      "original_text": "Registerbekanntmachung nach dem Umwandlungsgesetz\nNordrhein-Westfalen Amtsgericht Aachen HRA 10259\nistechnik Deng automation e.K. – Aachen",
      "type": "Registerbekanntmachung nach dem Umwandlungsgesetz",
      "state": "Nordrhein-Westfalen",
      "amtsgericht": "Amtsgericht Aachen",
      "registernummer": "HRA 10259",
      "registerart": "HRA",
      "company_name": "istechnik Deng automation e.K.",
      "company_seat": "Aachen",
      "details": "08.10.2024 (Bekanntmachungsdatum)\n\nNordrhein-Westfalen Amtsgericht Aachen HRA 10259\nRegisterbekanntmachung nach dem Umwandlungsgesetz 08.10.2024 (Eintragungsdatum)\n\nistechnik Deng automation e.K.\nEinzelkaufmann / Einzelkauffrau\nAachen\n\nDen Gläubigern der an der Vermögensübertragung beteiligten Rechtsträger ist, wenn sie binnen sechs Monaten nach dem Tag, an dem die Eintragung der Vermögensübertragung in das Register des Sitzes derjenigen Rechtsträger deren Gläubiger sie sind, nach § 19 Absatz 3 UmwG als bekanntgemacht gilt, ihren Anspruch nach Grund und Höhe schriftlich anmelden, Sicherheit zu leisten, soweit sie nicht Befriedigung verlangen können. Dieses Recht steht den Gläubigern jedoch nur zu, wenn sie glaubhaft machen, dass durch die Vermögensübertragung die Erfüllung ihrer Forderung gefährdet wird."
    },
    {
      "date": "2024-10-08",
      "id": "89593",
      "original_text": "Registerbekanntmachung nach dem Umwandlungsgesetz\nNordrhein-Westfalen Amtsgericht Wuppertal HRB 26924\nmal-anders UG (haftungsbeschränkt) – Wuppertal",
      "type": "Registerbekanntmachung nach dem Umwandlungsgesetz",
      "state": "Nordrhein-Westfalen",
      "amtsgericht": "Amtsgericht Wuppertal",
      "registernummer": "HRB 26924",
      "registerart": "HRB",
      "company_name": "mal-anders UG (haftungsbeschränkt)",
      "company_seat": "Wuppertal",
      "details": "08.10.2024 (Bekanntmachungsdatum)\n\nNordrhein-Westfalen Amtsgericht Wuppertal HRB 26924\nRegisterbekanntmachung nach dem Umwandlungsgesetz 08.10.2024 (Eintragungsdatum)\n\nmal-anders UG (haftungsbeschränkt)\nGesellschaft mit beschränkter Haftung\nWuppertal\n\nDen Gläubigern der an der Verschmelzung beteiligten Rechtsträger ist, wenn sie binnen sechs Monaten nach dem Tag, an dem die Eintragung der Verschmelzung in das Register des Sitzes desjenigen Rechtsträgers, dessen Gläubiger sie sind, nach § 19 Absatz 3 UmwG als bekanntgemacht gilt, ihren Anspruch nach Grund und Höhe schriftlich anmelden, Sicherheit zu leisten, soweit sie nicht Befriedigung verlangen können. Dieses Recht steht den Gläubigern jedoch nur zu, wenn sie glaubhaft machen, dass durch die Verschmelzung die Erfüllung ihrer Forderung gefährdet wird."
    },
    {
      "date": "2024-10-08",
      "id": "89601",
      "original_text": "Registerbekanntmachung nach dem Umwandlungsgesetz\nNordrhein-Westfalen Amtsgericht Wuppertal HRA 25933\nmal-anders e.K. – Wuppertal",
      "type": "Registerbekanntmachung nach dem Umwandlungsgesetz",
      "state": "Nordrhein-Westfalen",
      "amtsgericht": "Amtsgericht Wuppertal",
      "registernummer": "HRA 25933",
      "registerart": "HRA",
      "company_name": "mal-anders e.K.",
      "company_seat": "Wuppertal",
      "details": "08.10.2024 (Bekanntmachungsdatum)\n\nNordrhein-Westfalen Amtsgericht Wuppertal HRA 25933\nRegisterbekanntmachung nach dem Umwandlungsgesetz 08.10.2024 (Eintragungsdatum)\n\nmal-anders e.K.\nEinzelkaufmann / Einzelkauffrau\nWuppertal\n\nDen Gläubigern der an der Verschmelzung beteiligten Rechtsträger ist, wenn sie binnen sechs Monaten nach dem Tag, an dem die Eintragung der Verschmelzung in das Register des Sitzes desjenigen Rechtsträgers, dessen Gläubiger sie sind, nach § 19 Absatz 3 UmwG als bekanntgemacht gilt, ihren Anspruch nach Grund und Höhe schriftlich anmelden, Sicherheit zu leisten, soweit sie nicht Befriedigung verlangen können. Dieses Recht steht den Gläubigern jedoch nur zu, wenn sie glaubhaft machen, dass durch die Verschmelzung die Erfüllung ihrer Forderung gefährdet wird."
    },
    {
      "date": "2024-10-08",
      "id": "89442",
      "original_text": "Einreichung neuer Dokumente\nBayern Amtsgericht Passau HRB 11421\nmymuesli AG – Passau",
      "type": "Einreichung neuer Dokumente",
      "state": "Bayern",
      "amtsgericht": "Amtsgericht Passau",
      "registernummer": "HRB 11421",
      "registerart": "HRB",
      "company_name": "mymuesli AG",
      "company_seat": "Passau",
      "details": "08.10.2024 (Bekanntmachungsdatum)\n\nBayern Amtsgericht Passau HRB 11421\nEinreichung neuer Dokumente 07.10.2024 (Eintragungsdatum)\n\nmymuesli AG\nAktiengesellschaft\nPassau\n\nDem Amtsgericht Passau -Registergericht- ist eine Liste der Mitglieder des Aufsichtsrats eingereicht worden, § 106 AktG."
    },
    {
      "date": "2024-10-08",
      "id": "89626",
      "original_text": "Registerbekanntmachung nach dem Umwandlungsgesetz\nHessen Amtsgericht Gießen HRB 2937\none medialis GmbH – Gießen",
      "type": "Registerbekanntmachung nach dem Umwandlungsgesetz",
      "state": "Hessen",
      "amtsgericht": "Amtsgericht Gießen",
      "registernummer": "HRB 2937",
      "registerart": "HRB",
      "company_name": "one medialis GmbH",
      "company_seat": "Gießen",
      "details": "08.10.2024 (Bekanntmachungsdatum)\n\nHessen Amtsgericht Gießen HRB 2937\nRegisterbekanntmachung nach dem Umwandlungsgesetz 08.10.2024 (Eintragungsdatum)\n\none medialis GmbH\nGesellschaft mit beschränkter Haftung\nGießen\n\nDen Gläubigern der an der Ausgliederung beteiligten Rechtsträger ist, wenn sie binnen sechs Monaten nach dem Tag, an dem die Eintragung der Ausgliederung in das Register des Sitzes desjenigen Rechtsträgers, dessen Gläubiger sie sind, nach §§ 125, 19 Absatz 3 UmwG bekannt gemacht worden ist, ihren Anspruch nach Grund und Höhe schriftlich anmelden, Sicherheit zu leisten, soweit sie nicht Befriedigung verlangen können. Dieses Recht steht den Gläubigern jedoch nur zu, wenn sie glaubhaft machen, dass durch die Ausgliederung die Erfüllung ihrer Forderung gefährdet wird."
    },
    {
      "date": "2024-10-08",
      "id": "89584",
      "original_text": "Registerbekanntmachung nach dem Umwandlungsgesetz\nNordrhein-Westfalen Amtsgericht Köln HRB 70486\npantera Sales Services GmbH – Köln",
      "type": "Registerbekanntmachung nach dem Umwandlungsgesetz",
      "state": "Nordrhein-Westfalen",
      "amtsgericht": "Amtsgericht Köln",
      "registernummer": "HRB 70486",
      "registerart": "HRB",
      "company_name": "pantera Sales Services GmbH",
      "company_seat": "Köln",
      "details": "08.10.2024 (Bekanntmachungsdatum)\n\nNordrhein-Westfalen Amtsgericht Köln HRB 70486\nRegisterbekanntmachung nach dem Umwandlungsgesetz 08.10.2024 (Eintragungsdatum)\n\npantera Sales Services GmbH\nGesellschaft mit beschränkter Haftung\nKöln\n\nDen Gläubigern der an der Verschmelzung beteiligten Rechtsträger ist, wenn sie binnen sechs Monaten nach dem Tag, an dem die Eintragung der Verschmelzung in das Register des Sitzes desjenigen Rechtsträgers, dessen Gläubiger sie sind, nach § 19 Absatz 3 UmwG als bekanntgemacht gilt, ihren Anspruch nach Grund und Höhe schriftlich anmelden, Sicherheit zu leisten, soweit sie nicht Befriedigung verlangen können. Dieses Recht steht den Gläubigern jedoch nur zu, wenn sie glaubhaft machen, dass durch die Verschmelzung die Erfüllung ihrer Forderung gefährdet wird."
    },
    {
      "date": "2024-10-08",
      "id": "89585",
      "original_text": "Registerbekanntmachung nach dem Umwandlungsgesetz\nNordrhein-Westfalen Amtsgericht Köln HRB 76760\npantera development GmbH – Köln",
      "type": "Registerbekanntmachung nach dem Umwandlungsgesetz",
      "state": "Nordrhein-Westfalen",
      "amtsgericht": "Amtsgericht Köln",
      "registernummer": "HRB 76760",
      "registerart": "HRB",
      "company_name": "pantera development GmbH",
      "company_seat": "Köln",
      "details": "08.10.2024 (Bekanntmachungsdatum)\n\nNordrhein-Westfalen Amtsgericht Köln HRB 76760\nRegisterbekanntmachung nach dem Umwandlungsgesetz 08.10.2024 (Eintragungsdatum)\n\npantera development GmbH\nGesellschaft mit beschränkter Haftung\nKöln\n\nDen Gläubigern der an der Verschmelzung beteiligten Rechtsträger ist, wenn sie binnen sechs Monaten nach dem Tag, an dem die Eintragung der Verschmelzung in das Register des Sitzes desjenigen Rechtsträgers, dessen Gläubiger sie sind, nach § 19 Absatz 3 UmwG als bekanntgemacht gilt, ihren Anspruch nach Grund und Höhe schriftlich anmelden, Sicherheit zu leisten, soweit sie nicht Befriedigung verlangen können. Dieses Recht steht den Gläubigern jedoch nur zu, wenn sie glaubhaft machen, dass durch die Verschmelzung die Erfüllung ihrer Forderung gefährdet wird."
    },
    {
      "date": "2024-10-08",
      "id": "89588",
      "original_text": "Registerbekanntmachung nach dem Umwandlungsgesetz\nNordrhein-Westfalen Amtsgericht Köln HRB 76760\npantera development GmbH – Köln",
      "type": "Registerbekanntmachung nach dem Umwandlungsgesetz",
      "state": "Nordrhein-Westfalen",
      "amtsgericht": "Amtsgericht Köln",
      "registernummer": "HRB 76760",
      "registerart": "HRB",
      "company_name": "pantera development GmbH",
      "company_seat": "Köln",
      "details": "08.10.2024 (Bekanntmachungsdatum)\n\nNordrhein-Westfalen Amtsgericht Köln HRB 76760\nRegisterbekanntmachung nach dem Umwandlungsgesetz 08.10.2024 (Eintragungsdatum)\n\npantera development GmbH\nGesellschaft mit beschränkter Haftung\nKöln\n\nDen Gläubigern der an der Verschmelzung beteiligten Rechtsträger ist, wenn sie binnen sechs Monaten nach dem Tag, an dem die Eintragung der Verschmelzung in das Register des Sitzes desjenigen Rechtsträgers, dessen Gläubiger sie sind, nach § 19 Absatz 3 UmwG als bekanntgemacht gilt, ihren Anspruch nach Grund und Höhe schriftlich anmelden, Sicherheit zu leisten, soweit sie nicht Befriedigung verlangen können. Dieses Recht steht den Gläubigern jedoch nur zu, wenn sie glaubhaft machen, dass durch die Verschmelzung die Erfüllung ihrer Forderung gefährdet wird."
    },
    {
      "date": "2024-10-08",
      "id": "89435",
      "original_text": "Registerbekanntmachung nach dem Umwandlungsgesetz\nBayern Amtsgericht Ingolstadt HRB 9594\nplayeah GmbH – Ingolstadt",
      "type": "Registerbekanntmachung nach dem Umwandlungsgesetz",
      "state": "Bayern",
      "amtsgericht": "Amtsgericht Ingolstadt",
      "registernummer": "HRB 9594",
      "registerart": "HRB",
      "company_name": "playeah GmbH",
      "company_seat": "Ingolstadt",
      "details": "08.10.2024 (Bekanntmachungsdatum)\n\nBayern Amtsgericht Ingolstadt HRB 9594\nRegisterbekanntmachung nach dem Umwandlungsgesetz 07.10.2024 (Eintragungsdatum)\n\nplayeah GmbH\nGesellschaft mit beschränkter Haftung\nIngolstadt\n\nDen Gläubigern der an der Verschmelzung beteiligten Rechtsträger ist, wenn sie binnen sechs Monaten nach dem Tag, an dem die Eintragung der Verschmelzung in das Register des Sitzes desjenigen Rechtsträgers, dessen Gläubiger sie sind, nach § 19 Abs. 3 UmwG als bekannt gemacht gilt, ihren Anspruch nach Grund und Höhe schriftlich anmelden, Sicherheit zu leisten, soweit sie nicht Befriedigung verlangen können. Dieses Recht steht den Gläubigern jedoch nur zu, wenn sie glaubhaft machen, dass durch die Verschmelzung die Erfüllung ihrer Forderung gefährdet wird."
    },
    {
      "date": "2024-10-08",
      "id": "89599",
      "original_text": "Einreichung neuer Dokumente\nNordrhein-Westfalen Amtsgericht Siegburg HRB 10327\nscapos AG – Sankt Augustin",
      "type": "Einreichung neuer Dokumente",
      "state": "Nordrhein-Westfalen",
      "amtsgericht": "Amtsgericht Siegburg",
      "registernummer": "HRB 10327",
      "registerart": "HRB",
      "company_name": "scapos AG",
      "company_seat": "Sankt Augustin",
      "details": "08.10.2024 (Bekanntmachungsdatum)\n\nNordrhein-Westfalen Amtsgericht Siegburg HRB 10327\nEinreichung neuer Dokumente\n\nscapos AG\nAktiengesellschaft\nSankt Augustin\n\nDem Registergericht ist eine neue Liste der Mitglieder des Aufsichtsrates eingereicht worden."
    },
    {
      "date": "2024-10-08",
      "id": "89512",
      "original_text": "Registerbekanntmachung nach dem Umwandlungsgesetz\nThüringen Amtsgericht Jena HRB 514182\nsecumed Finanzdienstleistungsgesellschaft mbH – Jena",
      "type": "Registerbekanntmachung nach dem Umwandlungsgesetz",
      "state": "Thüringen",
      "amtsgericht": "Amtsgericht Jena",
      "registernummer": "HRB 514182",
      "registerart": "HRB",
      "company_name": "secumed Finanzdienstleistungsgesellschaft mbH",
      "company_seat": "Jena",
      "details": "08.10.2024 (Bekanntmachungsdatum)\n\nThüringen Amtsgericht Jena HRB 514182\nRegisterbekanntmachung nach dem Umwandlungsgesetz 08.10.2024 (Eintragungsdatum)\n\nsecumed Finanzdienstleistungsgesellschaft mbH\nGesellschaft mit beschränkter Haftung\nJena\n\nNicht eingetragen: Den Gläubigern der an der Verschmelzung beteiligten Rechtsträger, ist wenn sie binnen sechs Monaten nach dem Tag, an dem die Eintragung der Verschmelzung in das Register des Sitzes desjenigen Rechtsträgers, dessen Gläubiger sie sind,  nach § 19 Abs. 3 UmwG als bekanntgemacht gilt, ihren Anspruch nach Grund und Höhe schriftlich anmelden, Sicherheit zu leisten, soweit sie nicht Befriedigung verlangen können. Dieses Recht steht ihnen jedoch nur zu, wenn sie glaubhaft machen, daß durch die Verschmelzung die Erfüllung ihrer Forderung gefährdet wird."
    },
    {
      "date": "2024-10-08",
      "id": "89513",
      "original_text": "Registerbekanntmachung nach dem Umwandlungsgesetz\nThüringen Amtsgericht Jena HRB 503419\nsecumed Service GmbH für Finanzdienstleistungen – Jena",
      "type": "Registerbekanntmachung nach dem Umwandlungsgesetz",
      "state": "Thüringen",
      "amtsgericht": "Amtsgericht Jena",
      "registernummer": "HRB 503419",
      "registerart": "HRB",
      "company_name": "secumed Service GmbH für Finanzdienstleistungen",
      "company_seat": "Jena",
      "details": "08.10.2024 (Bekanntmachungsdatum)\n\nThüringen Amtsgericht Jena HRB 503419\nRegisterbekanntmachung nach dem Umwandlungsgesetz 08.10.2024 (Eintragungsdatum)\n\nsecumed Service GmbH für Finanzdienstleistungen\nGesellschaft mit beschränkter Haftung\nJena\n\nNicht eingetragen: Den Gläubigern der an der Verschmelzung beteiligten Rechtsträger, ist wenn sie binnen sechs Monaten nach dem Tag, an dem die Eintragung der Verschmelzung in das Register des Sitzes desjenigen Rechtsträgers, dessen Gläubiger sie sind,  nach § 19 Abs. 3 UmwG als bekanntgemacht gilt, ihren Anspruch nach Grund und Höhe schriftlich anmelden, Sicherheit zu leisten, soweit sie nicht Befriedigung verlangen können. Dieses Recht steht ihnen jedoch nur zu, wenn sie glaubhaft machen, daß durch die Verschmelzung die Erfüllung ihrer Forderung gefährdet wird."
    },
    {
      "date": "2024-10-08",
      "id": "89467",
      "original_text": "Einreichung neuer Dokumente\nBerlin Amtsgericht Berlin (Charlottenburg) HRB 255946\ntwentyrising - Aktiengesellschaft – Berlin",
      "type": "Einreichung neuer Dokumente",
      "state": "Berlin",
      "amtsgericht": "Amtsgericht Berlin (Charlottenburg)",
      "registernummer": "HRB 255946",
      "registerart": "HRB",
      "company_name": "twentyrising - Aktiengesellschaft",
      "company_seat": "Berlin",
      "details": "08.10.2024 (Bekanntmachungsdatum)\n\nBerlin Amtsgericht Berlin (Charlottenburg) HRB 255946\nEinreichung neuer Dokumente\n\ntwentyrising - Aktiengesellschaft\nAktiengesellschaft\nBerlin\n\nAls nicht eingetragen wird veröffentlicht:\n\nEs wurde eine neue Liste der Aufsichtsratsmitglieder eingereicht (§ 106 AktG)."
    }
  ]
}