{
  "date": "2024-10-01",
  "date_of_scrape": "2024-11-23T16:27:21.047Z",
  "tool_version": "0.1.0",
  "announcements": [
    {
      "date": "2024-10-01",
      "original_text": "Registerbekanntmachung nach dem Umwandlungsgesetz\nSachsen Amtsgericht Chemnitz HRA 9941\n\"Hygieneservice Voigt\" Meisterbetrieb für Schädlingsbekämpfung/Holz- und Bautenschutz/Schimmelpilzsanierung Inhaber Silke Voigt e.Kfr. – Schwarzenberg/Erzgeb.",
      "type": "Registerbekanntmachung nach dem Umwandlungsgesetz",
      "state": "Sachsen",
      "amtsgericht": "Amtsgericht Chemnitz",
      "registernummer": "HRA 9941",
      "registerart": "HRA",
      "company_name": "\"Hygieneservice Voigt\" Meisterbetrieb für Schädlingsbekämpfung/Holz- und Bautenschutz/Schimmelpilzsanierung Inhaber Silke Voigt e.Kfr.",
      "company_seat": "Schwarzenberg/Erzgeb.",
      "details": "01.10.2024 (Bekanntmachungsdatum)\n\nSachsen Amtsgericht Chemnitz HRA 9941\nRegisterbekanntmachung nach dem Umwandlungsgesetz 01.10.2024 (Eintragungsdatum)\n\n\"Hygieneservice Voigt\" Meisterbetrieb für Schädlingsbekämpfung/Holz- und Bautenschutz/Schimmelpilzsanierung Inhaber Silke Voigt e.Kfr.\nEinzelkaufmann / Einzelkauffrau\nSchwarzenberg/Erzgeb.\n\nDen Gläubigern der an der Ausgliederung beteiligten Rechtsträger ist, wenn sie binnen sechs Monaten nach dem Tag, an dem die Eintragung der Ausgliederung in das Register des Sitzes desjenigen Rechtsträgers, dessen Gläubiger sie sind, nach § 19 Abs. 3 UmwG als bekannt gemacht gilt, ihren Anspruch nach Grund und Höhe schriftlich anmelden, Sicherheit zu leisten, soweit sie nicht Befriedigung verlangen können. Dieses Recht steht den Gläubigern jedoch nur zu, wenn sie glaubhaft machen, dass durch die Ausgliederung die Erfüllung der Forderung gefährdet wird."
    },
    {
      "date": "2024-10-01",
      "original_text": "Löschungsankündigung\nBaden-Württemberg Amtsgericht Stuttgart HRA 738801\n2011 Security e.K. – Neckarsulm",
      "type": "Löschungsankündigung",
      "state": "Baden-Württemberg",
      "amtsgericht": "Amtsgericht Stuttgart",
      "registernummer": "HRA 738801",
      "registerart": "HRA",
      "company_name": "2011 Security e.K.",
      "company_seat": "Neckarsulm",
      "details": "01.10.2024 (Bekanntmachungsdatum)\n\nBaden-Württemberg Amtsgericht Stuttgart HRA 738801\nLöschungsankündigung\n\n2011 Security e.K.\nEinzelkaufmann / Einzelkauffrau\nNeckarsulm\n\nAls nicht eingetragen wird bekanntgemacht:\nDas Registergericht beabsichtigt, die Firma im Handelsregister von Amts wegen nach § 31 Abs. 2 HGB zu löschen. Die Frist zur Geltendmachung eines Widerspruchs gegen die beabsichtigte Löschung ist auf einen Monat ab Veröffentlichung bestimmt."
    },
    {
      "date": "2024-10-01",
      "original_text": "Löschungsankündigung\nBrandenburg Amtsgericht Neuruppin HRB 12174\nACG-Auto Center Gransee GmbH – Gransee",
      "type": "Löschungsankündigung",
      "state": "Brandenburg",
      "amtsgericht": "Amtsgericht Neuruppin",
      "registernummer": "HRB 12174",
      "registerart": "HRB",
      "company_name": "ACG-Auto Center Gransee GmbH",
      "company_seat": "Gransee",
      "details": "01.10.2024 (Bekanntmachungsdatum)\n\nBrandenburg Amtsgericht Neuruppin HRB 12174\nLöschungsankündigung\n\nACG-Auto Center Gransee GmbH\nGesellschaft mit beschränkter Haftung\nGransee\n\nBei der nachstehenden Gesellschaft wird das Amtslöschungsverfahren gemäß § 394 FamFG eingeleitet.\nWiderspruchsfrist: 1 Monat"
    },
    {
      "date": "2024-10-01",
      "original_text": "Registerbekanntmachung nach dem Umwandlungsgesetz\nRheinland-Pfalz Amtsgericht Montabaur HRA 3906\nADARTIS e.K. – Hübingen",
      "type": "Registerbekanntmachung nach dem Umwandlungsgesetz",
      "state": "Rheinland-Pfalz",
      "amtsgericht": "Amtsgericht Montabaur",
      "registernummer": "HRA 3906",
      "registerart": "HRA",
      "company_name": "ADARTIS e.K.",
      "company_seat": "Hübingen",
      "details": "01.10.2024 (Bekanntmachungsdatum)\n\nRheinland-Pfalz Amtsgericht Montabaur HRA 3906\nRegisterbekanntmachung nach dem Umwandlungsgesetz 01.10.2024 (Eintragungsdatum)\n\nADARTIS e.K.\nEinzelkaufmann / Einzelkauffrau\nHübingen\n\nAls nicht eingetragen wird veröffentlicht: Den Gläubigern der an der Ausgliederung beteiligten Rechtsträger ist, wenn sie binnen sechs Monaten nach dem Tag, an dem die Eintragung der Ausgliederung in das Register des Sitzes desjenigen Rechtsträgers, dessen Gläubiger sie sind, nach § 19 Abs. 3 UmwG als bekannt gemacht gilt, ihren Anspruch nach Grund und Höhe schriftlich anmelden, Sicherheit zu leisten, soweit sie nicht Befriedigung verlangen können. Dieses Recht steht den Gläubigern jedoch nur zu, wenn sie glaubhaft machen, dass durch die Ausgliederung die Erfüllung der Forderung gefährdet wird."
    },
    {
      "date": "2024-10-01",
      "original_text": "Sonstige Registerbekanntmachung\nBayern Amtsgericht Kempten (Allgäu) HRB 10327\nAGCO GmbH – Marktoberdorf",
      "type": "Sonstige Registerbekanntmachung",
      "state": "Bayern",
      "amtsgericht": "Amtsgericht Kempten (Allgäu)",
      "registernummer": "HRB 10327",
      "registerart": "HRB",
      "company_name": "AGCO GmbH",
      "company_seat": "Marktoberdorf",
      "details": "01.10.2024 (Bekanntmachungsdatum)\n\nBayern Amtsgericht Kempten (Allgäu) HRB 10327\nSonstige Registerbekanntmachung 30.09.2024 (Eintragungsdatum)\n\nAGCO GmbH\nGesellschaft mit beschränkter Haftung\nMarktoberdorf\n\nDem Amtsgericht Kempten (Allgäu) -Registergericht- ist eine Liste der Mitglieder des Aufsichtsrats eingereicht worden, § 52 Abs. 3 S. 2 GmbHG."
    },
    {
      "date": "2024-10-01",
      "original_text": "Einreichung neuer Dokumente\nBayern Amtsgericht München HRB 139673\nARRI AG – München",
      "type": "Einreichung neuer Dokumente",
      "state": "Bayern",
      "amtsgericht": "Amtsgericht München",
      "registernummer": "HRB 139673",
      "registerart": "HRB",
      "company_name": "ARRI AG",
      "company_seat": "München",
      "details": "01.10.2024 (Bekanntmachungsdatum)\n\nBayern Amtsgericht München HRB 139673\nEinreichung neuer Dokumente\n\nARRI AG\nAktiengesellschaft\nMünchen\n\nDem Amtsgericht München -Registergericht- ist eine Liste der Mitglieder des Aufsichtsrats eingereicht worden, § 106 AktG."
    },
    {
      "date": "2024-10-01",
      "original_text": "Registerbekanntmachung nach dem Umwandlungsgesetz\nSaarland Amtsgericht Saarbrücken HRB 101290\nATS Aviation Technik Saar GmbH – Saarbrücken",
      "type": "Registerbekanntmachung nach dem Umwandlungsgesetz",
      "state": "Saarland",
      "amtsgericht": "Amtsgericht Saarbrücken",
      "registernummer": "HRB 101290",
      "registerart": "HRB",
      "company_name": "ATS Aviation Technik Saar GmbH",
      "company_seat": "Saarbrücken",
      "details": "01.10.2024 (Bekanntmachungsdatum)\n\nSaarland Amtsgericht Saarbrücken HRB 101290\nRegisterbekanntmachung nach dem Umwandlungsgesetz 01.10.2024 (Eintragungsdatum)\n\nATS Aviation Technik Saar GmbH\nGesellschaft mit beschränkter Haftung\nSaarbrücken\n\nAls nicht eingetragen wird bekannt gemacht: Den Gläubigern der an der Verschmelzung beteiligten Gesellschaften ist, wenn sie binnen sechs Monaten nach dem Tag, an dem die Eintragung der Verschmelzung in das Register des Sitzes desjenigen Rechtsträgers, dessen Gläubiger sie sind, nach § 19 Absatz 3 UmwG bekannt gemacht worden ist, ihren Anspruch nach Grund und Höhe schriftlich anmelden, Sicherheit zu leisten, soweit sie nicht Befriedigung verlangen können. Dieses Recht steht den Gläubigern jedoch nur zu, wenn sie glaubhaft machen, dass durch die Verschmelzung die Erfüllung ihrer Forderung gefährdet wird."
    },
    {
      "date": "2024-10-01",
      "original_text": "Löschungsankündigung\nSaarland Amtsgericht Saarbrücken HRB 101597\nAZ Bausanierung und Planung GmbH – Saarbrücken",
      "type": "Löschungsankündigung",
      "state": "Saarland",
      "amtsgericht": "Amtsgericht Saarbrücken",
      "registernummer": "HRB 101597",
      "registerart": "HRB",
      "company_name": "AZ Bausanierung und Planung GmbH",
      "company_seat": "Saarbrücken",
      "details": "01.10.2024 (Bekanntmachungsdatum)\n\nSaarland Amtsgericht Saarbrücken HRB 101597\nLöschungsankündigung\n\nAZ Bausanierung und Planung GmbH\nGesellschaft mit beschränkter Haftung\nSaarbrücken\n\nEs ist beabsichtigt, die Gesellschaft von Amts wegen gemäß § 394 FamFG wegen Vermögenslosigkeit zu löschen. Gegen die Löschung von Amts wegen ist das Rechtsmittel des Widerspruchs statthaft. Der Widerspruch ist binnen einer Frist von 3 Monaten beginnend mit dem Tag dieser Veröffentlichung durch Einreichen eines Widerspruchsschreibens -schriftlich oder zur Niederschrift der Geschäftsstelle- beim Amtsgericht Saarbrücken, -zentrales Handelsregister-, Mainzerstr.178, 66121 Saarbrücken einzulegen. Der Widerspruch muss die Bezeichnung der angefochtenen Löschungsankündigung enthalten sowie die Erklärung, dass Widerspruch eingelegt wird. Er ist vom Widerspruchsführer oder seinem Bevollmächtigten zu unterzeichnen."
    },
    {
      "date": "2024-10-01",
      "original_text": "Registerbekanntmachung nach dem Umwandlungsgesetz\nNordrhein-Westfalen Amtsgericht Krefeld HRB 16341\nAbbelen GmbH – Tönisvorst",
      "type": "Registerbekanntmachung nach dem Umwandlungsgesetz",
      "state": "Nordrhein-Westfalen",
      "amtsgericht": "Amtsgericht Krefeld",
      "registernummer": "HRB 16341",
      "registerart": "HRB",
      "company_name": "Abbelen GmbH",
      "company_seat": "Tönisvorst",
      "details": "01.10.2024 (Bekanntmachungsdatum)\n\nNordrhein-Westfalen Amtsgericht Krefeld HRB 16341\nRegisterbekanntmachung nach dem Umwandlungsgesetz 01.10.2024 (Eintragungsdatum)\n\nAbbelen GmbH\nGesellschaft mit beschränkter Haftung\nTönisvorst\n\nDen Gläubigern der an der Verschmelzung beteiligten Rechtsträger ist, wenn sie binnen sechs Monaten nach dem Tag, an dem die Eintragung der Verschmelzung in das Register des Sitzes desjenigen Rechtsträgers, dessen Gläubiger sie sind, nach § 19 Absatz 3 UmwG als bekanntgemacht gilt, ihren Anspruch nach Grund und Höhe schriftlich anmelden, Sicherheit zu leisten, soweit sie nicht Befriedigung verlangen können. Dieses Recht steht den Gläubigern jedoch nur zu, wenn sie glaubhaft machen, dass durch die Verschmelzung die Erfüllung ihrer Forderung gefährdet wird."
    },
    {
      "date": "2024-10-01",
      "original_text": "Registerbekanntmachung nach dem Umwandlungsgesetz\nNordrhein-Westfalen Amtsgericht Krefeld HRB 14787\nAbbelen GmbH – Tönisvorst",
      "type": "Registerbekanntmachung nach dem Umwandlungsgesetz",
      "state": "Nordrhein-Westfalen",
      "amtsgericht": "Amtsgericht Krefeld",
      "registernummer": "HRB 14787",
      "registerart": "HRB",
      "company_name": "Abbelen GmbH",
      "company_seat": "Tönisvorst",
      "details": "01.10.2024 (Bekanntmachungsdatum)\n\nNordrhein-Westfalen Amtsgericht Krefeld HRB 14787\nRegisterbekanntmachung nach dem Umwandlungsgesetz 01.10.2024 (Eintragungsdatum)\n\nAbbelen GmbH\nGesellschaft mit beschränkter Haftung\nTönisvorst\n\nDen Gläubigern der an der Verschmelzung beteiligten Rechtsträger ist, wenn sie binnen sechs Monaten nach dem Tag, an dem die Eintragung der Verschmelzung in das Register des Sitzes desjenigen Rechtsträgers, dessen Gläubiger sie sind, nach § 19 Absatz 3 UmwG als bekanntgemacht gilt, ihren Anspruch nach Grund und Höhe schriftlich anmelden, Sicherheit zu leisten, soweit sie nicht Befriedigung verlangen können. Dieses Recht steht den Gläubigern jedoch nur zu, wenn sie glaubhaft machen, dass durch die Verschmelzung die Erfüllung ihrer Forderung gefährdet wird."
    },
    {
      "date": "2024-10-01",
      "original_text": "Löschungsankündigung\nNordrhein-Westfalen Amtsgericht Düsseldorf HRB 82292\nAffengeil GmbH – Düsseldorf",
      "type": "Löschungsankündigung",
      "state": "Nordrhein-Westfalen",
      "amtsgericht": "Amtsgericht Düsseldorf",
      "registernummer": "HRB 82292",
      "registerart": "HRB",
      "company_name": "Affengeil GmbH",
      "company_seat": "Düsseldorf",
      "details": "01.10.2024 (Bekanntmachungsdatum)\n\nNordrhein-Westfalen Amtsgericht Düsseldorf HRB 82292\nLöschungsankündigung\n\nAffengeil GmbH\nGesellschaft mit beschränkter Haftung\nDüsseldorf\n\nDas Registergericht beabsichtigt die Gesellschaft von Amts wegen nach § 394 FamFG zu löschen. Die Frist zur Erhebung eines Widerspruchs ist auf 3 Wochen festgesetzt.\n\nRechtsbehelfsbelehrung:\nDas Widerspruchsrecht steht jedem zu, der an der Unterlassung der Löschung ein berechtigtes Interesse hat. Der Widerspruch ist bei dem Amtsgericht Düsseldorf -Registergericht-, Werdener Straße 1, 40227 Düsseldorf schriftlich in deutscher Sprache oder zur Niederschrift der Geschäftsstelle einzulegen. Der Widerspruch kann auch zur Niederschrift der Geschäftsstelle eines jeden Amtsgerichtes abgegeben werden. Die Einlegung ist auch durch Übertragung eines elektronischen Dokuments an die elektronische Poststelle des Gerichts möglich. Das elektronische Dokument muss für die Bearbeitung durch das Gericht geeignet und mit einer qualifizierten elektronischen Signatur der verantwortenden Person versehen sein oder von der verantwortenden Person signiert und auf einem sicheren Übermittlungsweg gemäß § 130a ZPO nach näherer Maßgabe der Verordnung über die technischen Rahmenbedingungen des elektronischen Rechtsverkehrs und über das besondere elektronische Behördenpostfach (BGBl. I, S.3803) eingereicht werden. Weitere Informationen erhalten Sie auf der Internetseite www.justiz.de.\nDer Widerspruch muss spätestens innerhalb der gesetzten Frist nach dem Datum der Bekanntmachung der Löschungsankündigung bei dem Amtsgericht - Registergericht - Düsseldorf eingegangen sein.  Dies gilt auch dann, wenn der Widerspruch zur Niederschrift der Geschäftsstelle eines anderen Amtsgerichtes abgegeben wurde. Die Frist beginnt mit dem Tage der Bekanntmachung der Löschungsankündigung in dem für die Bekanntmachung der Eintragungen in das Handelsregister bestimmten elektronischen Informations- und Kommunikationssystem nach § 10 des Handelsgesetzbuches. Fällt das Ende der Frist auf einen Sonntag, einen allgemeinen Feiertag oder Sonnabend, so endet die Frist mit Ablauf des nächsten Werktages.\nDer Widerspruch muss die Bezeichnung der angefochtenen Löschungsankündigung sowie die Erklärung enthalten, dass Widerspruch gegen diese Löschungsankündigung eingelegt wird. Er ist zu unterzeichnen und soll begründet werden."
    },
    {
      "date": "2024-10-01",
      "original_text": "Einreichung neuer Dokumente\nBaden-Württemberg Amtsgericht Stuttgart HRB 401197\nAlbstadtwerke GmbH – Albstadt",
      "type": "Einreichung neuer Dokumente",
      "state": "Baden-Württemberg",
      "amtsgericht": "Amtsgericht Stuttgart",
      "registernummer": "HRB 401197",
      "registerart": "HRB",
      "company_name": "Albstadtwerke GmbH",
      "company_seat": "Albstadt",
      "details": "01.10.2024 (Bekanntmachungsdatum)\n\nBaden-Württemberg Amtsgericht Stuttgart HRB 401197\nEinreichung neuer Dokumente\n\nAlbstadtwerke GmbH\nGesellschaft mit beschränkter Haftung\nAlbstadt\n\nDie Gesellschaft hat am 23.09.2024 die Liste über die Zusammensetzung des Aufsichtsrats zum Handelsregister eingereicht."
    },
    {
      "date": "2024-10-01",
      "original_text": "Registerbekanntmachung nach dem Umwandlungsgesetz\nBaden-Württemberg Amtsgericht Mannheim HRB 728763\nArca-Leasing GmbH – Rastatt",
      "type": "Registerbekanntmachung nach dem Umwandlungsgesetz",
      "state": "Baden-Württemberg",
      "amtsgericht": "Amtsgericht Mannheim",
      "registernummer": "HRB 728763",
      "registerart": "HRB",
      "company_name": "Arca-Leasing GmbH",
      "company_seat": "Rastatt",
      "details": "01.10.2024 (Bekanntmachungsdatum)\n\nBaden-Württemberg Amtsgericht Mannheim HRB 728763\nRegisterbekanntmachung nach dem Umwandlungsgesetz 10.09.2024 (Eintragungsdatum)\n\nArca-Leasing GmbH\nGesellschaft mit beschränkter Haftung\nRastatt\n\nAls nicht eingetragen wird bekanntgemacht:\nDen Gläubigern der an der Verschmelzung beteiligten Rechtsträger ist, wenn sie binnen sechs Monaten nach dem Tag, an dem die Eintragung der Verschmelzung in das Register des Sitzes desjenigen Rechtsträgers, dessen Gläubiger sie sind, nach § 19 Abs. 3 UmwG als bekanntgemacht gilt, ihren Anspruch nach Grund und Höhe schriftlich anmelden, Sicherheit zu leisten, soweit sie nicht Befriedigung verlangen können. Dieses Recht steht den Gläubigern jedoch nur zu, wenn sie glaubhaft machen, dass durch die Verschmelzung die Erfüllung ihrer Forderung gefährdet wird."
    },
    {
      "date": "2024-10-01",
      "original_text": "Registerbekanntmachung nach dem Umwandlungsgesetz\nSachsen Amtsgericht Chemnitz HRB 33075\nArtemis Verwaltungs-GmbH – Hartmannsdorf",
      "type": "Registerbekanntmachung nach dem Umwandlungsgesetz",
      "state": "Sachsen",
      "amtsgericht": "Amtsgericht Chemnitz",
      "registernummer": "HRB 33075",
      "registerart": "HRB",
      "company_name": "Artemis Verwaltungs-GmbH",
      "company_seat": "Hartmannsdorf",
      "details": "01.10.2024 (Bekanntmachungsdatum)\n\nSachsen Amtsgericht Chemnitz HRB 33075\nRegisterbekanntmachung nach dem Umwandlungsgesetz 01.10.2024 (Eintragungsdatum)\n\nArtemis Verwaltungs-GmbH\nGesellschaft mit beschränkter Haftung\nHartmannsdorf\n\nDen Gläubigern der an der Verschmelzung beteiligten Rechtsträger ist, wenn sie binnen sechs Monaten nach dem Tag, an dem die Eintragung der Verschmelzung in das Register des Sitzes desjenigen Rechtsträgers, dessen Gläubiger sie sind, nach § 19 Abs. 3 UmwG als bekannt gemacht gilt, ihren Anspruch nach Grund und Höhe schriftlich anmelden, Sicherheit zu leisten, soweit sie nicht Befriedigung verlangen können. Dieses Recht steht den Gläubigern jedoch nur zu, wenn sie glaubhaft machen, dass durch die Verschmelzung die Erfüllung der Forderung gefährdet wird."
    },
    {
      "date": "2024-10-01",
      "original_text": "Löschungsankündigung\nBayern Amtsgericht Kempten (Allgäu) HRB 13823\nArtrolux GmbH – Kempten (Allgäu)",
      "type": "Löschungsankündigung",
      "state": "Bayern",
      "amtsgericht": "Amtsgericht Kempten (Allgäu)",
      "registernummer": "HRB 13823",
      "registerart": "HRB",
      "company_name": "Artrolux GmbH",
      "company_seat": "Kempten (Allgäu)",
      "details": "01.10.2024 (Bekanntmachungsdatum)\n\nBayern Amtsgericht Kempten (Allgäu) HRB 13823\nLöschungsankündigung\n\nArtrolux GmbH\nGesellschaft mit beschränkter Haftung\nKempten (Allgäu)\n\nDas Registergericht beabsichtigt, die im Handelsregister eingetragene Gesellschaft wegen Vermögenslosigkeit von Amts wegen nach § 394 FamFG zu löschen. Die Frist zur Erhebung eines Widerspruchs ist auf einen Monat festgesetzt."
    },
    {
      "date": "2024-10-01",
      "original_text": "Einreichung neuer Dokumente\nSachsen Amtsgericht Chemnitz HRB 8031\nAutobus GmbH Sachsen - Regionalverkehr – Limbach-Oberfrohna",
      "type": "Einreichung neuer Dokumente",
      "state": "Sachsen",
      "amtsgericht": "Amtsgericht Chemnitz",
      "registernummer": "HRB 8031",
      "registerart": "HRB",
      "company_name": "Autobus GmbH Sachsen - Regionalverkehr",
      "company_seat": "Limbach-Oberfrohna",
      "details": "01.10.2024 (Bekanntmachungsdatum)\n\nSachsen Amtsgericht Chemnitz HRB 8031\nEinreichung neuer Dokumente\n\nAutobus GmbH Sachsen - Regionalverkehr\nGesellschaft mit beschränkter Haftung\nLimbach-Oberfrohna\n\nAm 30.09.2024 wurde beim Handelsregister des Amtsgerichts Chemnitz die Liste der Mitglieder des Aufsichtsrats gemäß § 52 GmbHG eingereicht."
    },
    {
      "date": "2024-10-01",
      "original_text": "Registerbekanntmachung nach dem Umwandlungsgesetz\nBaden-Württemberg Amtsgericht Mannheim HRB 752272\nB+O ambulanter Pflegedienst Brühl GmbH – Brühl",
      "type": "Registerbekanntmachung nach dem Umwandlungsgesetz",
      "state": "Baden-Württemberg",
      "amtsgericht": "Amtsgericht Mannheim",
      "registernummer": "HRB 752272",
      "registerart": "HRB",
      "company_name": "B+O ambulanter Pflegedienst Brühl GmbH",
      "company_seat": "Brühl",
      "details": "01.10.2024 (Bekanntmachungsdatum)\n\nBaden-Württemberg Amtsgericht Mannheim HRB 752272\nRegisterbekanntmachung nach dem Umwandlungsgesetz 01.10.2024 (Eintragungsdatum)\n\nB+O ambulanter Pflegedienst Brühl GmbH\nGesellschaft mit beschränkter Haftung\nBrühl\n\nDen Gläubigern des an dem Formwechsel beteiligten Rechtsträgers ist, wenn sie binnen sechs Monaten nach dem Tag, an dem die Eintragung des Formwechsels in das Register des Sitzes desjenigen Rechtsträgers, dessen Gläubiger sie sind, nach § 19 Abs. 3 UmwG als bekanntgemacht gilt, ihren Anspruch nach Grund und Höhe schriftlich anmelden, Sicherheit zu leisten, soweit sie nicht Befriedigung verlangen können. Dieses Recht steht den Gläubigern jedoch nur zu, wenn sie glaubhaft machen, dass durch den Formwechsel die Erfüllung ihrer Forderung gefährdet wird."
    },
    {
      "date": "2024-10-01",
      "original_text": "Registerbekanntmachung nach dem Umwandlungsgesetz\nBaden-Württemberg Amtsgericht Mannheim HRA 711879\nB+O ambulanter Pflegedienst Brühl OHG – Brühl",
      "type": "Registerbekanntmachung nach dem Umwandlungsgesetz",
      "state": "Baden-Württemberg",
      "amtsgericht": "Amtsgericht Mannheim",
      "registernummer": "HRA 711879",
      "registerart": "HRA",
      "company_name": "B+O ambulanter Pflegedienst Brühl OHG",
      "company_seat": "Brühl",
      "details": "01.10.2024 (Bekanntmachungsdatum)\n\nBaden-Württemberg Amtsgericht Mannheim HRA 711879\nRegisterbekanntmachung nach dem Umwandlungsgesetz 01.10.2024 (Eintragungsdatum)\n\nB+O ambulanter Pflegedienst Brühl OHG\nOffene Handelsgesellschaft\nBrühl\n\nDen Gläubigern des an dem Formwechsel beteiligten Rechtsträgers ist, wenn sie binnen sechs Monaten nach dem Tag, an dem die Eintragung des Formwechsels in das Register des Sitzes desjenigen Rechtsträgers, dessen Gläubiger sie sind, nach § 19 Abs. 3 UmwG als bekanntgemacht gilt, ihren Anspruch nach Grund und Höhe schriftlich anmelden, Sicherheit zu leisten, soweit sie nicht Befriedigung verlangen können. Dieses Recht steht den Gläubigern jedoch nur zu, wenn sie glaubhaft machen, dass durch den Formwechsel die Erfüllung ihrer Forderung gefährdet wird."
    },
    {
      "date": "2024-10-01",
      "original_text": "Einreichung neuer Dokumente\nBrandenburg Amtsgericht Cottbus HRB 687\nBASF Schwarzheide GmbH – Schwarzheide",
      "type": "Einreichung neuer Dokumente",
      "state": "Brandenburg",
      "amtsgericht": "Amtsgericht Cottbus",
      "registernummer": "HRB 687",
      "registerart": "HRB",
      "company_name": "BASF Schwarzheide GmbH",
      "company_seat": "Schwarzheide",
      "details": "01.10.2024 (Bekanntmachungsdatum)\n\nBrandenburg Amtsgericht Cottbus HRB 687\nEinreichung neuer Dokumente\n\nBASF Schwarzheide GmbH\nGesellschaft mit beschränkter Haftung\nSchwarzheide\n\nAls nicht eingetragen wird veröffentlicht: Die aktuelle Liste der Aufsichtsratsmitglieder wurde zum Handelsregister gem. § 52 Abs. 3 GmbHG eingereicht."
    },
    {
      "date": "2024-10-01",
      "original_text": "Löschungsankündigung\nBerlin Amtsgericht Berlin (Charlottenburg) HRB 159167\nBGM Grund & Stein GmbH – Berlin",
      "type": "Löschungsankündigung",
      "state": "Berlin",
      "amtsgericht": "Amtsgericht Berlin (Charlottenburg)",
      "registernummer": "HRB 159167",
      "registerart": "HRB",
      "company_name": "BGM Grund & Stein GmbH",
      "company_seat": "Berlin",
      "details": "01.10.2024 (Bekanntmachungsdatum)\n\nBerlin Amtsgericht Berlin (Charlottenburg) HRB 159167\nLöschungsankündigung\n\nBGM Grund & Stein GmbH\nGesellschaft mit beschränkter Haftung\nBerlin\n\nBei der nachstehenden Gesellschaft wird das Amtslöschungsverfahren gemäß § 394 FamFG eingeleitet. Widerspruchsfrist 6 Wochen"
    },
    {
      "date": "2024-10-01",
      "original_text": "Löschungsankündigung\nBremen Amtsgericht Bremen HRA 27586\nBOH Bremen Gastro e.K. – Bremen",
      "type": "Löschungsankündigung",
      "state": "Bremen",
      "amtsgericht": "Amtsgericht Bremen",
      "registernummer": "HRA 27586",
      "registerart": "HRA",
      "company_name": "BOH Bremen Gastro e.K.",
      "company_seat": "Bremen",
      "details": "01.10.2024 (Bekanntmachungsdatum)\n\nBremen Amtsgericht Bremen HRA 27586\nLöschungsankündigung\n\nBOH Bremen Gastro e.K.\nEinzelkaufmann / Einzelkauffrau\nBremen\n\nEs ist beabsichtigt die im Handelsregister eingetragene Firma von Amts wegen gemäß § 31 Abs.2 HGB zu löschen. Gegen die Löschung kann beim AG Bremen schriftlich oder zu Protokoll der Geschäftsstelle Widerspruch eingelegt werden. Widerspruchsfrist 4 Wochen."
    },
    {
      "date": "2024-10-01",
      "original_text": "Registerbekanntmachung nach dem Umwandlungsgesetz\nHessen Amtsgericht Kassel HRB 19943\nBRAUN-SCHMIDT Energie GmbH – Zierenberg",
      "type": "Registerbekanntmachung nach dem Umwandlungsgesetz",
      "state": "Hessen",
      "amtsgericht": "Amtsgericht Kassel",
      "registernummer": "HRB 19943",
      "registerart": "HRB",
      "company_name": "BRAUN-SCHMIDT Energie GmbH",
      "company_seat": "Zierenberg",
      "details": "01.10.2024 (Bekanntmachungsdatum)\n\nHessen Amtsgericht Kassel HRB 19943\nRegisterbekanntmachung nach dem Umwandlungsgesetz 01.10.2024 (Eintragungsdatum)\n\nBRAUN-SCHMIDT Energie GmbH\nGesellschaft mit beschränkter Haftung\nZierenberg\n\nDen Gläubigern der an der formwechselnden Umwandlung beteiligten Rechtsträger ist, wenn sie binnen sechs Monaten nach dem Tag, an dem die Eintragung der formwechselnden Umwandlung in das Register des Sitzes derjenigen Rechtsträger deren Gläubiger sie sind, nach § 201 UmwG bekannt gemacht worden ist, ihren Anspruch nach Grund und Höhe schriftlich anmelden, Sicherheit zu leisten, soweit sie nicht Befriedigung verlangen können. Dieses Recht steht den Gläubigern jedoch nur zu, wenn sie glaubhaft machen, dass durch die formwechselnden Umwandlung die Erfüllung ihrer Forderung gefährdet wird."
    },
    {
      "date": "2024-10-01",
      "original_text": "Registerbekanntmachung nach dem Umwandlungsgesetz\nHessen Amtsgericht Kassel GsR 104\nBRAUN-SCHMIDT Energie eGbR – Zierenberg",
      "type": "Registerbekanntmachung nach dem Umwandlungsgesetz",
      "state": "Hessen",
      "amtsgericht": "Amtsgericht Kassel",
      "registernummer": "GsR 104",
      "registerart": "GsR",
      "company_name": "BRAUN-SCHMIDT Energie eGbR",
      "company_seat": "Zierenberg",
      "details": "01.10.2024 (Bekanntmachungsdatum)\n\nHessen Amtsgericht Kassel GsR 104\nRegisterbekanntmachung nach dem Umwandlungsgesetz 01.10.2024 (Eintragungsdatum)\n\nBRAUN-SCHMIDT Energie eGbR\nGesellschaft bürgerlichen Rechts\nZierenberg\n\nDen Gläubigern der an der formwechselnden Umwandlung beteiligten Rechtsträger ist, wenn sie binnen sechs Monaten nach dem Tag, an dem die Eintragung der formwechselnden Umwandlung in das Register des Sitzes desjenigen Rechtsträgers, dessen Gläubiger sie sind, nach § 201 UmwG bekannt gemacht worden ist, ihren Anspruch nach Grund und Höhe schriftlich anmelden, Sicherheit zu leisten, soweit sie nicht Befriedigung verlangen können. Dieses Recht steht den Gläubigern jedoch nur zu, wenn sie glaubhaft machen, dass durch die formwechselnden Umwandlung die Erfüllung ihrer Forderung gefährdet wird."
    },
    {
      "date": "2024-10-01",
      "original_text": "Registerbekanntmachung nach dem Umwandlungsgesetz\nHessen Amtsgericht Kassel HRB 19945\nBRAUN-SCHMIDT Fuhrpark GmbH – Zierenberg",
      "type": "Registerbekanntmachung nach dem Umwandlungsgesetz",
      "state": "Hessen",
      "amtsgericht": "Amtsgericht Kassel",
      "registernummer": "HRB 19945",
      "registerart": "HRB",
      "company_name": "BRAUN-SCHMIDT Fuhrpark GmbH",
      "company_seat": "Zierenberg",
      "details": "01.10.2024 (Bekanntmachungsdatum)\n\nHessen Amtsgericht Kassel HRB 19945\nRegisterbekanntmachung nach dem Umwandlungsgesetz 01.10.2024 (Eintragungsdatum)\n\nBRAUN-SCHMIDT Fuhrpark GmbH\nGesellschaft mit beschränkter Haftung\nZierenberg\n\nDen Gläubigern der an der formwechselnden Umwandlung beteiligten Rechtsträger ist, wenn sie binnen sechs Monaten nach dem Tag, an dem die Eintragung der formwechselnden Umwandlung in das Register des Sitzes desjenigen Rechtsträgers, dessen Gläubiger sie sind, nach § 201 UmwG bekannt gemacht worden ist, ihren Anspruch nach Grund und Höhe schriftlich anmelden, Sicherheit zu leisten, soweit sie nicht Befriedigung verlangen können. Dieses Recht steht den Gläubigern jedoch nur zu, wenn sie glaubhaft machen, dass durch die formwechselnden Umwandlung die Erfüllung ihrer Forderung gefährdet wird."
    },
    {
      "date": "2024-10-01",
      "original_text": "Registerbekanntmachung nach dem Umwandlungsgesetz\nHessen Amtsgericht Kassel GsR 105\nBRAUN-SCHMIDT Fuhrpark eGbR – Zierenberg",
      "type": "Registerbekanntmachung nach dem Umwandlungsgesetz",
      "state": "Hessen",
      "amtsgericht": "Amtsgericht Kassel",
      "registernummer": "GsR 105",
      "registerart": "GsR",
      "company_name": "BRAUN-SCHMIDT Fuhrpark eGbR",
      "company_seat": "Zierenberg",
      "details": "01.10.2024 (Bekanntmachungsdatum)\n\nHessen Amtsgericht Kassel GsR 105\nRegisterbekanntmachung nach dem Umwandlungsgesetz 01.10.2024 (Eintragungsdatum)\n\nBRAUN-SCHMIDT Fuhrpark eGbR\nGesellschaft bürgerlichen Rechts\nZierenberg\n\nDen Gläubigern der an der formwechselnden Umwandlung beteiligten Rechtsträger ist, wenn sie binnen sechs Monaten nach dem Tag, an dem die Eintragung der formwechselnden Umwandlung in das Register des Sitzes desjenigen Rechtsträgers, dessen Gläubiger sie sind, nach § 201 UmwG bekannt gemacht worden ist, ihren Anspruch nach Grund und Höhe schriftlich anmelden, Sicherheit zu leisten, soweit sie nicht Befriedigung verlangen können. Dieses Recht steht den Gläubigern jedoch nur zu, wenn sie glaubhaft machen, dass durch die formwechselnden Umwandlung die Erfüllung ihrer Forderung gefährdet wird."
    },
    {
      "date": "2024-10-01",
      "original_text": "Registerbekanntmachung nach dem Umwandlungsgesetz\nHessen Amtsgericht Kassel HRB 19947\nBRAUN-SCHMIDT Grundstücks GmbH – Zierenberg",
      "type": "Registerbekanntmachung nach dem Umwandlungsgesetz",
      "state": "Hessen",
      "amtsgericht": "Amtsgericht Kassel",
      "registernummer": "HRB 19947",
      "registerart": "HRB",
      "company_name": "BRAUN-SCHMIDT Grundstücks GmbH",
      "company_seat": "Zierenberg",
      "details": "01.10.2024 (Bekanntmachungsdatum)\n\nHessen Amtsgericht Kassel HRB 19947\nRegisterbekanntmachung nach dem Umwandlungsgesetz 01.10.2024 (Eintragungsdatum)\n\nBRAUN-SCHMIDT Grundstücks GmbH\nGesellschaft mit beschränkter Haftung\nZierenberg\n\nDen Gläubigern der an der formwechselnden Umwandlung beteiligten Rechtsträger ist, wenn sie binnen sechs Monaten nach dem Tag, an dem die Eintragung der formwechselnden Umwandlung in das Register des Sitzes desjenigen Rechtsträgers, dessen Gläubiger sie sind, nach § 201 UmwG bekannt gemacht worden ist, ihren Anspruch nach Grund und Höhe schriftlich anmelden, Sicherheit zu leisten, soweit sie nicht Befriedigung verlangen können. Dieses Recht steht den Gläubigern jedoch nur zu, wenn sie glaubhaft machen, dass durch die formwechselnden Umwandlung die Erfüllung ihrer Forderung gefährdet wird."
    },
    {
      "date": "2024-10-01",
      "original_text": "Registerbekanntmachung nach dem Umwandlungsgesetz\nHessen Amtsgericht Kassel GsR 100\nBRAUN-SCHMIDT Grundstücks-eGbR – Zierenberg",
      "type": "Registerbekanntmachung nach dem Umwandlungsgesetz",
      "state": "Hessen",
      "amtsgericht": "Amtsgericht Kassel",
      "registernummer": "GsR 100",
      "registerart": "GsR",
      "company_name": "BRAUN-SCHMIDT Grundstücks-eGbR",
      "company_seat": "Zierenberg",
      "details": "01.10.2024 (Bekanntmachungsdatum)\n\nHessen Amtsgericht Kassel GsR 100\nRegisterbekanntmachung nach dem Umwandlungsgesetz 01.10.2024 (Eintragungsdatum)\n\nBRAUN-SCHMIDT Grundstücks-eGbR\nGesellschaft bürgerlichen Rechts\nZierenberg\n\nDen Gläubigern der an der formwechselnden Umwandlung beteiligten Rechtsträger ist, wenn sie binnen sechs Monaten nach dem Tag, an dem die Eintragung der formwechselnden Umwandlung in das Register des Sitzes desjenigen Rechtsträgers, dessen Gläubiger sie sind, nach § 201 UmwG bekannt gemacht worden ist, ihren Anspruch nach Grund und Höhe schriftlich anmelden, Sicherheit zu leisten, soweit sie nicht Befriedigung verlangen können. Dieses Recht steht den Gläubigern jedoch nur zu, wenn sie glaubhaft machen, dass durch die formwechselnden Umwandlung die Erfüllung ihrer Forderung gefährdet wird."
    },
    {
      "date": "2024-10-01",
      "original_text": "Registerbekanntmachung nach dem Umwandlungsgesetz\nHessen Amtsgericht Kassel HRB 19946\nBRAUN-SCHMIDT Planungs GmbH – Zierenberg",
      "type": "Registerbekanntmachung nach dem Umwandlungsgesetz",
      "state": "Hessen",
      "amtsgericht": "Amtsgericht Kassel",
      "registernummer": "HRB 19946",
      "registerart": "HRB",
      "company_name": "BRAUN-SCHMIDT Planungs GmbH",
      "company_seat": "Zierenberg",
      "details": "01.10.2024 (Bekanntmachungsdatum)\n\nHessen Amtsgericht Kassel HRB 19946\nRegisterbekanntmachung nach dem Umwandlungsgesetz 01.10.2024 (Eintragungsdatum)\n\nBRAUN-SCHMIDT Planungs GmbH\nGesellschaft mit beschränkter Haftung\nZierenberg\n\nDen Gläubigern der an der formwechselnden Umwandlung beteiligten Rechtsträger ist, wenn sie binnen sechs Monaten nach dem Tag, an dem die Eintragung der formwechselnden Umwandlung in das Register des Sitzes desjenigen Rechtsträgers, dessen Gläubiger sie sind, nach § 201 UmwG bekannt gemacht worden ist, ihren Anspruch nach Grund und Höhe schriftlich anmelden, Sicherheit zu leisten, soweit sie nicht Befriedigung verlangen können. Dieses Recht steht den Gläubigern jedoch nur zu, wenn sie glaubhaft machen, dass durch die formwechselnden Umwandlung die Erfüllung ihrer Forderung gefährdet wird."
    },
    {
      "date": "2024-10-01",
      "original_text": "Registerbekanntmachung nach dem Umwandlungsgesetz\nRheinland-Pfalz Amtsgericht Bad Kreuznach HRB 22522\nBamodi GmbH – Idar-Oberstein",
      "type": "Registerbekanntmachung nach dem Umwandlungsgesetz",
      "state": "Rheinland-Pfalz",
      "amtsgericht": "Amtsgericht Bad Kreuznach",
      "registernummer": "HRB 22522",
      "registerart": "HRB",
      "company_name": "Bamodi GmbH",
      "company_seat": "Idar-Oberstein",
      "details": "01.10.2024 (Bekanntmachungsdatum)\n\nRheinland-Pfalz Amtsgericht Bad Kreuznach HRB 22522\nRegisterbekanntmachung nach dem Umwandlungsgesetz 01.10.2024 (Eintragungsdatum)\n\nBamodi GmbH\nGesellschaft mit beschränkter Haftung\nIdar-Oberstein\n\nAls nicht eingetragen wird veröffentlicht: Den Gläubigern der an der Verschmelzung beteiligten Rechtsträger ist, wenn sie binnen sechs Monaten nach dem Tag, an dem die Eintragung der Verschmelzung in das Register des Sitzes desjenigen Rechtsträgers, dessen Gläubiger sie sind, nach § 19 Abs. 3 UmwG als bekannt gemacht gilt, ihren Anspruch nach Grund und Höhe schriftlich anmelden, Sicherheit zu leisten, soweit sie nicht Befriedigung verlangen können. Dieses Recht steht den Gläubigern jedoch nur zu, wenn sie glaubhaft machen, dass durch die Verschmelzung die Erfüllung der Forderung gefährdet wird."
    },
    {
      "date": "2024-10-01",
      "original_text": "Löschungsankündigung\nBayern Amtsgericht Kempten (Allgäu) HRB 11035\nBausch HR-Management GmbH – Kempten (Allgäu)",
      "type": "Löschungsankündigung",
      "state": "Bayern",
      "amtsgericht": "Amtsgericht Kempten (Allgäu)",
      "registernummer": "HRB 11035",
      "registerart": "HRB",
      "company_name": "Bausch HR-Management GmbH",
      "company_seat": "Kempten (Allgäu)",
      "details": "01.10.2024 (Bekanntmachungsdatum)\n\nBayern Amtsgericht Kempten (Allgäu) HRB 11035\nLöschungsankündigung\n\nBausch HR-Management GmbH\nGesellschaft mit beschränkter Haftung\nKempten (Allgäu)\n\nDas Registergericht beabsichtigt, die im Handelsregister eingetragene Gesellschaft wegen Vermögenslosigkeit von Amts wegen nach § 394 FamFG zu löschen. Die Frist zur Erhebung eines Widerspruchs ist auf einen Monat festgesetzt."
    },
    {
      "date": "2024-10-01",
      "original_text": "Registerbekanntmachung nach dem Umwandlungsgesetz\nBayern Amtsgericht Traunstein HRB 32127\nBet 3000 Entertainment GmbH – Waldkraiburg",
      "type": "Registerbekanntmachung nach dem Umwandlungsgesetz",
      "state": "Bayern",
      "amtsgericht": "Amtsgericht Traunstein",
      "registernummer": "HRB 32127",
      "registerart": "HRB",
      "company_name": "Bet 3000 Entertainment GmbH",
      "company_seat": "Waldkraiburg",
      "details": "01.10.2024 (Bekanntmachungsdatum)\n\nBayern Amtsgericht Traunstein HRB 32127\nRegisterbekanntmachung nach dem Umwandlungsgesetz 30.09.2024 (Eintragungsdatum)\n\nBet 3000 Entertainment GmbH\nGesellschaft mit beschränkter Haftung\nWaldkraiburg\n\nDen Gläubigern der an der Spaltung beteiligten Rechtsträger ist, wenn sie binnen sechs Monaten nach dem Tag, an dem die Eintragung der Spaltung in das Register des Sitzes desjenigen Rechtsträgers, dessen Gläubiger sie sind, nach §§ 125, 19 Abs. 3 UmwG als bekannt gemacht gilt, ihren Anspruch nach Grund und Höhe schriftlich anmelden, Sicherheit zu leisten, soweit sie nicht Befriedigung verlangen können. Dieses Recht steht den Gläubigern jedoch nur zu, wenn sie glaubhaft machen, dass durch die Spaltung die Erfüllung ihrer Forderung gefährdet wird."
    },
    {
      "date": "2024-10-01",
      "original_text": "Registerbekanntmachung nach dem Umwandlungsgesetz\nNordrhein-Westfalen Amtsgericht Hagen HRB 5115\nBleiStahl Produktions und Verwaltungs GmbH – Wetter",
      "type": "Registerbekanntmachung nach dem Umwandlungsgesetz",
      "state": "Nordrhein-Westfalen",
      "amtsgericht": "Amtsgericht Hagen",
      "registernummer": "HRB 5115",
      "registerart": "HRB",
      "company_name": "BleiStahl Produktions und Verwaltungs GmbH",
      "company_seat": "Wetter",
      "details": "01.10.2024 (Bekanntmachungsdatum)\n\nNordrhein-Westfalen Amtsgericht Hagen HRB 5115\nRegisterbekanntmachung nach dem Umwandlungsgesetz 01.10.2024 (Eintragungsdatum)\n\nBleiStahl Produktions und Verwaltungs GmbH\nGesellschaft mit beschränkter Haftung\nWetter\n\nDen Gläubigern der an der Verschmelzung beteiligten Rechtsträger ist, wenn sie binnen sechs Monaten nach dem Tag, an dem die Eintragung der Verschmelzung in das Register des Sitzes desjenigen Rechtsträgers, dessen Gläubiger sie sind, nach § 19 Absatz 3 UmwG als bekanntgemacht gilt, ihren Anspruch nach Grund und Höhe schriftlich anmelden, Sicherheit zu leisten, soweit sie nicht Befriedigung verlangen können. Dieses Recht steht den Gläubigern jedoch nur zu, wenn sie glaubhaft machen, dass durch die Verschmelzung die Erfüllung ihrer Forderung gefährdet wird."
    },
    {
      "date": "2024-10-01",
      "original_text": "Registerbekanntmachung nach dem Umwandlungsgesetz\nSachsen Amtsgericht Leipzig HRB 37307\nBloc Construction GmbH – Leipzig",
      "type": "Registerbekanntmachung nach dem Umwandlungsgesetz",
      "state": "Sachsen",
      "amtsgericht": "Amtsgericht Leipzig",
      "registernummer": "HRB 37307",
      "registerart": "HRB",
      "company_name": "Bloc Construction GmbH",
      "company_seat": "Leipzig",
      "details": "01.10.2024 (Bekanntmachungsdatum)\n\nSachsen Amtsgericht Leipzig HRB 37307\nRegisterbekanntmachung nach dem Umwandlungsgesetz 01.10.2024 (Eintragungsdatum)\n\nBloc Construction GmbH\nGesellschaft mit beschränkter Haftung\nLeipzig\n\nDen Gläubigern der an der Verschmelzung beteiligten Rechtsträger ist, wenn sie binnen sechs Monaten nach dem Tag, an dem die Eintragung der Verschmelzung in das Register des Sitzes desjenigen Rechtsträgers, dessen Gläubiger sie sind, nach § 19 Abs. 3 UmwG als bekannt gemacht gilt, ihren Anspruch nach Grund und Höhe schriftlich anmelden, Sicherheit zu leisten, soweit sie nicht Befriedigung verlangen können. Dieses Recht steht den Gläubigern jedoch nur zu, wenn sie glaubhaft machen, dass durch die Verschmelzung die Erfüllung der Forderung gefährdet wird."
    },
    {
      "date": "2024-10-01",
      "original_text": "Registerbekanntmachung nach dem Umwandlungsgesetz\nSachsen Amtsgericht Leipzig HRB 31899\nBloc Properties GmbH – Leipzig",
      "type": "Registerbekanntmachung nach dem Umwandlungsgesetz",
      "state": "Sachsen",
      "amtsgericht": "Amtsgericht Leipzig",
      "registernummer": "HRB 31899",
      "registerart": "HRB",
      "company_name": "Bloc Properties GmbH",
      "company_seat": "Leipzig",
      "details": "01.10.2024 (Bekanntmachungsdatum)\n\nSachsen Amtsgericht Leipzig HRB 31899\nRegisterbekanntmachung nach dem Umwandlungsgesetz 01.10.2024 (Eintragungsdatum)\n\nBloc Properties GmbH\nGesellschaft mit beschränkter Haftung\nLeipzig\n\nDen Gläubigern der an der Verschmelzung beteiligten Rechtsträger ist, wenn sie binnen sechs Monaten nach dem Tag, an dem die Eintragung der Verschmelzung in das Register des Sitzes desjenigen Rechtsträgers, dessen Gläubiger sie sind, nach § 19 Abs. 3 UmwG als bekannt gemacht gilt, ihren Anspruch nach Grund und Höhe schriftlich anmelden, Sicherheit zu leisten, soweit sie nicht Befriedigung verlangen können. Dieses Recht steht den Gläubigern jedoch nur zu, wenn sie glaubhaft machen, dass durch die Verschmelzung die Erfüllung der Forderung gefährdet wird."
    },
    {
      "date": "2024-10-01",
      "original_text": "Registerbekanntmachung nach dem Umwandlungsgesetz\nHessen Amtsgericht Kassel GsR 101\nBraun-Schmidt Planungs eGbR – Zierenberg",
      "type": "Registerbekanntmachung nach dem Umwandlungsgesetz",
      "state": "Hessen",
      "amtsgericht": "Amtsgericht Kassel",
      "registernummer": "GsR 101",
      "registerart": "GsR",
      "company_name": "Braun-Schmidt Planungs eGbR",
      "company_seat": "Zierenberg",
      "details": "01.10.2024 (Bekanntmachungsdatum)\n\nHessen Amtsgericht Kassel GsR 101\nRegisterbekanntmachung nach dem Umwandlungsgesetz 01.10.2024 (Eintragungsdatum)\n\nBraun-Schmidt Planungs eGbR\nGesellschaft bürgerlichen Rechts\nZierenberg\n\nDen Gläubigern der an der formwechselnden Umwandlung beteiligten Rechtsträger ist, wenn sie binnen sechs Monaten nach dem Tag, an dem die Eintragung der formwechselnden Umwandlung in das Register des Sitzes desjenigen Rechtsträgers, dessen Gläubiger sie sind, nach § 201 UmwG bekannt gemacht worden ist, ihren Anspruch nach Grund und Höhe schriftlich anmelden, Sicherheit zu leisten, soweit sie nicht Befriedigung verlangen können. Dieses Recht steht den Gläubigern jedoch nur zu, wenn sie glaubhaft machen, dass durch die formwechselnden Umwandlung die Erfüllung ihrer Forderung gefährdet wird."
    },
    {
      "date": "2024-10-01",
      "original_text": "Registerbekanntmachung nach dem Umwandlungsgesetz\nRheinland-Pfalz Amtsgericht Montabaur HRB 29901\nBright Solutions GmbH – Welschneudorf",
      "type": "Registerbekanntmachung nach dem Umwandlungsgesetz",
      "state": "Rheinland-Pfalz",
      "amtsgericht": "Amtsgericht Montabaur",
      "registernummer": "HRB 29901",
      "registerart": "HRB",
      "company_name": "Bright Solutions GmbH",
      "company_seat": "Welschneudorf",
      "details": "01.10.2024 (Bekanntmachungsdatum)\n\nRheinland-Pfalz Amtsgericht Montabaur HRB 29901\nRegisterbekanntmachung nach dem Umwandlungsgesetz 01.10.2024 (Eintragungsdatum)\n\nBright Solutions GmbH\nGesellschaft mit beschränkter Haftung\nWelschneudorf\n\nAls nicht eingetragen wird veröffentlicht: Den Gläubigern der an der Verschmelzung beteiligten Rechtsträger ist, wenn sie binnen sechs Monaten nach dem Tag, an dem die Eintragung der Verschmelzung in das Register des Sitzes desjenigen Rechtsträgers, dessen Gläubiger sie sind, nach § 19 Abs. 3 UmwG als bekannt gemacht gilt, ihren Anspruch nach Grund und Höhe schriftlich anmelden, Sicherheit zu leisten, soweit sie nicht Befriedigung verlangen können. Dieses Recht steht den Gläubigern jedoch nur zu, wenn sie glaubhaft machen, dass durch die Verschmelzung die Erfüllung der Forderung gefährdet wird."
    },
    {
      "date": "2024-10-01",
      "original_text": "Registerbekanntmachung nach dem Umwandlungsgesetz\nHessen Amtsgericht Darmstadt HRB 89941\nBuchPartner GmbH – Darmstadt",
      "type": "Registerbekanntmachung nach dem Umwandlungsgesetz",
      "state": "Hessen",
      "amtsgericht": "Amtsgericht Darmstadt",
      "registernummer": "HRB 89941",
      "registerart": "HRB",
      "company_name": "BuchPartner GmbH",
      "company_seat": "Darmstadt",
      "details": "01.10.2024 (Bekanntmachungsdatum)\n\nHessen Amtsgericht Darmstadt HRB 89941\nRegisterbekanntmachung nach dem Umwandlungsgesetz 01.10.2024 (Eintragungsdatum)\n\nBuchPartner GmbH\nGesellschaft mit beschränkter Haftung\nDarmstadt\n\nDen Gläubigern der an der Verschmelzung beteiligten Rechtsträger ist, wenn sie binnen sechs Monaten nach dem Tag, an dem die Eintragung der Verschmelzung in das Register des Sitzes derjenigen Rechtsträger deren Gläubiger sie sind, nach § 19 Absatz 3 UmwG bekannt gemacht worden ist, ihren Anspruch nach Grund und Höhe schriftlich anmelden, Sicherheit zu leisten, soweit sie nicht Befriedigung verlangen können. Dieses Recht steht den Gläubigern jedoch nur zu, wenn sie glaubhaft machen, dass durch die Verschmelzung die Erfüllung ihrer Forderung gefährdet wird."
    },
    {
      "date": "2024-10-01",
      "original_text": "Sonstige Registerbekanntmachung\nBayern Amtsgericht Traunstein HRB 15508\nBusiness 2 Express AG – Bad Aibling",
      "type": "Sonstige Registerbekanntmachung",
      "state": "Bayern",
      "amtsgericht": "Amtsgericht Traunstein",
      "registernummer": "HRB 15508",
      "registerart": "HRB",
      "company_name": "Business 2 Express AG",
      "company_seat": "Bad Aibling",
      "details": "01.10.2024 (Bekanntmachungsdatum)\n\nBayern Amtsgericht Traunstein HRB 15508\nSonstige Registerbekanntmachung\n\nBusiness 2 Express AG\nAktiengesellschaft\nBad Aibling\n\nDem #Re.Name ist eine Liste der Mitglieder des Aufsichtsrats eingereicht worden, § 106 AktG."
    },
    {
      "date": "2024-10-01",
      "original_text": "Einreichung neuer Dokumente\nBayern Amtsgericht Traunstein HRB 15508\nBusiness 2 Express AG – Bad Aibling",
      "type": "Einreichung neuer Dokumente",
      "state": "Bayern",
      "amtsgericht": "Amtsgericht Traunstein",
      "registernummer": "HRB 15508",
      "registerart": "HRB",
      "company_name": "Business 2 Express AG",
      "company_seat": "Bad Aibling",
      "details": "01.10.2024 (Bekanntmachungsdatum)\n\nBayern Amtsgericht Traunstein HRB 15508\nEinreichung neuer Dokumente\n\nBusiness 2 Express AG\nAktiengesellschaft\nBad Aibling\n\nDem Amtsgericht Traunstein -Registergericht- ist eine Liste der Mitglieder des Aufsichtsrats eingereicht worden, § 106 AktG."
    },
    {
      "date": "2024-10-01",
      "original_text": "Registerbekanntmachung nach dem Umwandlungsgesetz\nBaden-Württemberg Amtsgericht Mannheim HRA 712123\nCJS Schmitt e.K. – Ahorn",
      "type": "Registerbekanntmachung nach dem Umwandlungsgesetz",
      "state": "Baden-Württemberg",
      "amtsgericht": "Amtsgericht Mannheim",
      "registernummer": "HRA 712123",
      "registerart": "HRA",
      "company_name": "CJS Schmitt e.K.",
      "company_seat": "Ahorn",
      "details": "01.10.2024 (Bekanntmachungsdatum)\n\nBaden-Württemberg Amtsgericht Mannheim HRA 712123\nRegisterbekanntmachung nach dem Umwandlungsgesetz 01.10.2024 (Eintragungsdatum)\n\nCJS Schmitt e.K.\nEinzelkaufmann / Einzelkauffrau\nAhorn\n\nDen Gläubigern der an der Ausgliederung beteiligten Rechtsträger ist, wenn sie binnen sechs Monaten nach dem Tag, an dem die Eintragung der Ausgliederung in das Register des Sitzes desjenigen Rechtsträgers, dessen Gläubiger sie sind, nach § 19 Abs. 3 UmwG als bekanntgemacht gilt, ihren Anspruch nach Grund und Höhe schriftlich anmelden, Sicherheit zu leisten, soweit sie nicht Befriedigung verlangen können. Dieses Recht steht den Gläubigern jedoch nur zu, wenn sie glaubhaft machen, dass durch die Ausgliederung die Erfüllung ihrer Forderung gefährdet wird."
    },
    {
      "date": "2024-10-01",
      "original_text": "Löschungsankündigung\nSaarland Amtsgericht Saarbrücken HRB 11392\nCMT Kulturfabrik in der Neufang Brauerei Geschäftsführungsgesellschaft mit beschränkter Haftung – Saarbrücken",
      "type": "Löschungsankündigung",
      "state": "Saarland",
      "amtsgericht": "Amtsgericht Saarbrücken",
      "registernummer": "HRB 11392",
      "registerart": "HRB",
      "company_name": "CMT Kulturfabrik in der Neufang Brauerei Geschäftsführungsgesellschaft mit beschränkter Haftung",
      "company_seat": "Saarbrücken",
      "details": "01.10.2024 (Bekanntmachungsdatum)\n\nSaarland Amtsgericht Saarbrücken HRB 11392\nLöschungsankündigung\n\nCMT Kulturfabrik in der Neufang Brauerei Geschäftsführungsgesellschaft mit beschränkter Haftung\nGesellschaft mit beschränkter Haftung\nSaarbrücken\n\nEs ist beabsichtigt, die Gesellschaft von Amts wegen gemäß § 394 FamFG wegen Vermögenslosigkeit zu löschen. Gegen die Löschung von Amts wegen ist das Rechtsmittel des Widerspruchs statthaft. Der Widerspruch ist binnen einer Frist von 3 Monaten beginnend mit dem Tag dieser Veröffentlichung durch Einreichen eines Widerspruchsschreibens -schriftlich oder zur Niederschrift der Geschäftsstelle- beim Amtsgericht Saarbrücken, -zentrales Handelsregister-, Mainzerstr.178, 66121 Saarbrücken einzulegen. Der Widerspruch muss die Bezeichnung der angefochtenen Löschungsankündigung enthalten sowie die Erklärung, dass Widerspruch eingelegt wird. Er ist vom Widerspruchsführer oder seinem Bevollmächtigten zu unterzeichnen.\nDas Widerspruchsschreiben kann auch in der Form eines elektronischen Dokumentes eingereicht werden, das mit einer qualifizierten elektronischen Signatur nach dem Signaturgesetz versehen sein muss (§§ 14 Abs. 2 FamFG, 130a, 298 ZPO)."
    },
    {
      "date": "2024-10-01",
      "original_text": "Löschungsankündigung\nNordrhein-Westfalen Amtsgericht Essen HRB 31944\nCO Care GmbH – Essen",
      "type": "Löschungsankündigung",
      "state": "Nordrhein-Westfalen",
      "amtsgericht": "Amtsgericht Essen",
      "registernummer": "HRB 31944",
      "registerart": "HRB",
      "company_name": "CO Care GmbH",
      "company_seat": "Essen",
      "details": "01.10.2024 (Bekanntmachungsdatum)\n\nNordrhein-Westfalen Amtsgericht Essen HRB 31944\nLöschungsankündigung\n\nCO Care GmbH\nGesellschaft mit beschränkter Haftung\nEssen\n\nDas Registergericht beabsichtigt die Gesellschaft von Amts wegen nach § 394 FamFG zu löschen. Die Frist zur Erhebung eines Widerspruchs ist auf einen Monat festgesetzt."
    },
    {
      "date": "2024-10-01",
      "original_text": "Löschungsankündigung\nBerlin Amtsgericht Berlin (Charlottenburg) HRB 217555\nCONSTRUKT BAU GmbH – Berlin",
      "type": "Löschungsankündigung",
      "state": "Berlin",
      "amtsgericht": "Amtsgericht Berlin (Charlottenburg)",
      "registernummer": "HRB 217555",
      "registerart": "HRB",
      "company_name": "CONSTRUKT BAU GmbH",
      "company_seat": "Berlin",
      "details": "01.10.2024 (Bekanntmachungsdatum)\n\nBerlin Amtsgericht Berlin (Charlottenburg) HRB 217555\nLöschungsankündigung\n\nCONSTRUKT BAU GmbH\nGesellschaft mit beschränkter Haftung\nBerlin\n\nBei der nachstehenden Gesellschaft wird das Amtslöschungsverfahren gemäß § 394 FamFG eingeleitet. Widerspruchsfrist 6 Wochen"
    },
    {
      "date": "2024-10-01",
      "original_text": "Löschungsankündigung\nBaden-Württemberg Amtsgericht Freiburg HRB 728657\nCORIAN Bau GmbH – Freiburg im Breisgau",
      "type": "Löschungsankündigung",
      "state": "Baden-Württemberg",
      "amtsgericht": "Amtsgericht Freiburg",
      "registernummer": "HRB 728657",
      "registerart": "HRB",
      "company_name": "CORIAN Bau GmbH",
      "company_seat": "Freiburg im Breisgau",
      "details": "01.10.2024 (Bekanntmachungsdatum)\n\nBaden-Württemberg Amtsgericht Freiburg HRB 728657\nLöschungsankündigung\n\nCORIAN Bau GmbH\nGesellschaft mit beschränkter Haftung\nFreiburg im Breisgau\n\nAls nicht eingetragen wird bekanntgemacht:\nDas Gericht beabsichtigt, die Gesellschaft wegen Vermögenslosigkeit im Handelsregister von Amts wegen nach § 394 FamFG zu löschen. Die Frist zur Geltendmachung eines Widerspruchs gegen die beabsichtigte Löschung ist auf einen Monat ab Veröffentlichung bestimmt."
    },
    {
      "date": "2024-10-01",
      "original_text": "Registerbekanntmachung nach dem Umwandlungsgesetz\nBerlin Amtsgericht Berlin (Charlottenburg) HRB 266033\nCOSMO CONSULT SE – Berlin",
      "type": "Registerbekanntmachung nach dem Umwandlungsgesetz",
      "state": "Berlin",
      "amtsgericht": "Amtsgericht Berlin (Charlottenburg)",
      "registernummer": "HRB 266033",
      "registerart": "HRB",
      "company_name": "COSMO CONSULT SE",
      "company_seat": "Berlin",
      "details": "01.10.2024 (Bekanntmachungsdatum)\n\nBerlin Amtsgericht Berlin (Charlottenburg) HRB 266033\nRegisterbekanntmachung nach dem Umwandlungsgesetz 30.09.2024 (Eintragungsdatum)\n\nCOSMO CONSULT SE\nEuropäische Aktiengesellschaft (SE)\nBerlin\n\nZu Eintragungsnummer 4 vom 30.09.2024 wird als nicht eingetragen veröffentlicht:Den Gläubigern der an der Verschmelzung beteiligten Rechtsträger ist, wenn sie binnen sechs Monaten nach dem Tag, an dem die Eintragung der Verschmelzung in das Register des Sitzes desjenigen Rechtsträgers, dessen Gläubiger sie sind, als bekannt gemacht gilt, ihren Anspruch nach Grund und Höhe schriftlich anmelden, Sicherheit zu leisten, soweit sie nicht Befriedigung verlangen können. Dieses Recht steht den Gläubigern jedoch nur zu, wenn sie glaubhaft machen, dass durch die Verschmelzung die Erfüllung ihrer Forderung gefährdet wird. Das Recht, Sicherheitsleistung zu verlangen, steht Gläubigern nicht zu, die im Falle der Insolvenz ein Recht auf vorzugsweise Befriedigung aus einer Deckungsmasse haben, die nach gesetzlicher Vorschrift zu ihrem Schutz errichtet und staatlich überwacht ist."
    },
    {
      "date": "2024-10-01",
      "original_text": "Registerbekanntmachung nach dem Umwandlungsgesetz\nBaden-Württemberg Amtsgericht Freiburg HRB 702771\nCura Consilium GmbH – Teningen",
      "type": "Registerbekanntmachung nach dem Umwandlungsgesetz",
      "state": "Baden-Württemberg",
      "amtsgericht": "Amtsgericht Freiburg",
      "registernummer": "HRB 702771",
      "registerart": "HRB",
      "company_name": "Cura Consilium GmbH",
      "company_seat": "Teningen",
      "details": "01.10.2024 (Bekanntmachungsdatum)\n\nBaden-Württemberg Amtsgericht Freiburg HRB 702771\nRegisterbekanntmachung nach dem Umwandlungsgesetz 01.10.2024 (Eintragungsdatum)\n\nCura Consilium GmbH\nGesellschaft mit beschränkter Haftung\nTeningen\n\nAls nicht eingetragen wird bekanntgemacht:\nDen Gläubigern der an der Verschmelzung beteiligten Rechtsträger ist, wenn sie binnen sechs Monaten nach dem Tag, an dem die Eintragung der Verschmelzung in das Register des Sitzes desjenigen Rechtsträgers, dessen Gläubiger sie sind, nach § 19 Abs. 3 UmwG als bekanntgemacht gilt, ihren Anspruch nach Grund und Höhe schriftlich anmelden, Sicherheit zu leisten, soweit sie nicht Befriedigung verlangen können. Dieses Recht steht den Gläubigern jedoch nur zu, wenn sie glaubhaft machen, dass durch die Verschmelzung die Erfüllung ihrer Forderung gefährdet wird."
    },
    {
      "date": "2024-10-01",
      "original_text": "Löschungsankündigung\nSachsen Amtsgericht Chemnitz HRB 32740\nDBR Dienstleistungen und Beratungen Reichenbach UG (haftungsbeschränkt) – Reichenbach im Vogtland",
      "type": "Löschungsankündigung",
      "state": "Sachsen",
      "amtsgericht": "Amtsgericht Chemnitz",
      "registernummer": "HRB 32740",
      "registerart": "HRB",
      "company_name": "DBR Dienstleistungen und Beratungen Reichenbach UG (haftungsbeschränkt)",
      "company_seat": "Reichenbach im Vogtland",
      "details": "01.10.2024 (Bekanntmachungsdatum)\n\nSachsen Amtsgericht Chemnitz HRB 32740\nLöschungsankündigung\n\nDBR Dienstleistungen und Beratungen Reichenbach UG (haftungsbeschränkt)\nGesellschaft mit beschränkter Haftung\nReichenbach im Vogtland\n\nDas Registergericht beabsichtigt, die im Handelsregister eingetragene Gesellschaft von Amts wegen nach § 394 FamFG zu löschen. Die Frist zu Erhebung eines Widerspruchs gegen die beabsichtigte Löschung wird auf einen Monat festgesetzt."
    },
    {
      "date": "2024-10-01",
      "original_text": "Registerbekanntmachung nach dem Umwandlungsgesetz\nHessen Amtsgericht Frankfurt am Main HRB 29748\nDEGECEDO Grundstücksverwaltungsgesellschaft mbH – Eschborn",
      "type": "Registerbekanntmachung nach dem Umwandlungsgesetz",
      "state": "Hessen",
      "amtsgericht": "Amtsgericht Frankfurt am Main",
      "registernummer": "HRB 29748",
      "registerart": "HRB",
      "company_name": "DEGECEDO Grundstücksverwaltungsgesellschaft mbH",
      "company_seat": "Eschborn",
      "details": "01.10.2024 (Bekanntmachungsdatum)\n\nHessen Amtsgericht Frankfurt am Main HRB 29748\nRegisterbekanntmachung nach dem Umwandlungsgesetz 01.10.2024 (Eintragungsdatum)\n\nDEGECEDO Grundstücksverwaltungsgesellschaft mbH\nGesellschaft mit beschränkter Haftung\nEschborn\n\nDen Gläubigern der an der Verschmelzung beteiligten Rechtsträger ist, wenn sie binnen sechs Monaten nach dem Tag, an dem die Eintragung der Verschmelzung in das Register des Sitzes derjenigen Rechtsträger deren Gläubiger sie sind, nach § 19 Absatz 3 UmwG bekannt gemacht worden ist, ihren Anspruch nach Grund und Höhe schriftlich anmelden, Sicherheit zu leisten, soweit sie nicht Befriedigung verlangen können. Dieses Recht steht den Gläubigern jedoch nur zu, wenn sie glaubhaft machen, dass durch die Verschmelzung die Erfüllung ihrer Forderung gefährdet wird."
    },
    {
      "date": "2024-10-01",
      "original_text": "Registerbekanntmachung nach dem Umwandlungsgesetz\nHessen Amtsgericht Frankfurt am Main HRB 34947\nDEGEMOX Grundstücksverwaltungsgesellschaft mbH – Eschborn",
      "type": "Registerbekanntmachung nach dem Umwandlungsgesetz",
      "state": "Hessen",
      "amtsgericht": "Amtsgericht Frankfurt am Main",
      "registernummer": "HRB 34947",
      "registerart": "HRB",
      "company_name": "DEGEMOX Grundstücksverwaltungsgesellschaft mbH",
      "company_seat": "Eschborn",
      "details": "01.10.2024 (Bekanntmachungsdatum)\n\nHessen Amtsgericht Frankfurt am Main HRB 34947\nRegisterbekanntmachung nach dem Umwandlungsgesetz 01.10.2024 (Eintragungsdatum)\n\nDEGEMOX Grundstücksverwaltungsgesellschaft mbH\nGesellschaft mit beschränkter Haftung\nEschborn\n\nDen Gläubigern der an der Verschmelzung beteiligten Rechtsträger ist, wenn sie binnen sechs Monaten nach dem Tag, an dem die Eintragung der Verschmelzung in das Register des Sitzes derjenigen Rechtsträger deren Gläubiger sie sind, nach § 19 Absatz 3 UmwG bekannt gemacht worden ist, ihren Anspruch nach Grund und Höhe schriftlich anmelden, Sicherheit zu leisten, soweit sie nicht Befriedigung verlangen können. Dieses Recht steht den Gläubigern jedoch nur zu, wenn sie glaubhaft machen, dass durch die Verschmelzung die Erfüllung ihrer Forderung gefährdet wird."
    },
    {
      "date": "2024-10-01",
      "original_text": "Registerbekanntmachung nach dem Umwandlungsgesetz\nHessen Amtsgericht Frankfurt am Main HRB 22009\nDURO Grundstücksverwaltungsgesellschaft mbH – Eschborn",
      "type": "Registerbekanntmachung nach dem Umwandlungsgesetz",
      "state": "Hessen",
      "amtsgericht": "Amtsgericht Frankfurt am Main",
      "registernummer": "HRB 22009",
      "registerart": "HRB",
      "company_name": "DURO Grundstücksverwaltungsgesellschaft mbH",
      "company_seat": "Eschborn",
      "details": "01.10.2024 (Bekanntmachungsdatum)\n\nHessen Amtsgericht Frankfurt am Main HRB 22009\nRegisterbekanntmachung nach dem Umwandlungsgesetz 01.10.2024 (Eintragungsdatum)\n\nDURO Grundstücksverwaltungsgesellschaft mbH\nGesellschaft mit beschränkter Haftung\nEschborn\n\nDen Gläubigern der an der Verschmelzung beteiligten Rechtsträger ist, wenn sie binnen sechs Monaten nach dem Tag, an dem die Eintragung der Verschmelzung in das Register des Sitzes derjenigen Rechtsträger deren Gläubiger sie sind, nach § 19 Absatz 3 UmwG bekannt gemacht worden ist, ihren Anspruch nach Grund und Höhe schriftlich anmelden, Sicherheit zu leisten, soweit sie nicht Befriedigung verlangen können. Dieses Recht steht den Gläubigern jedoch nur zu, wenn sie glaubhaft machen, dass durch die Verschmelzung die Erfüllung ihrer Forderung gefährdet wird."
    },
    {
      "date": "2024-10-01",
      "original_text": "Löschungsankündigung\nBrandenburg Amtsgericht Neuruppin HRB 14442\nDa.Be.Wo. Bau GmbH – Templin",
      "type": "Löschungsankündigung",
      "state": "Brandenburg",
      "amtsgericht": "Amtsgericht Neuruppin",
      "registernummer": "HRB 14442",
      "registerart": "HRB",
      "company_name": "Da.Be.Wo. Bau GmbH",
      "company_seat": "Templin",
      "details": "01.10.2024 (Bekanntmachungsdatum)\n\nBrandenburg Amtsgericht Neuruppin HRB 14442\nLöschungsankündigung\n\nDa.Be.Wo. Bau GmbH\nGesellschaft mit beschränkter Haftung\nTemplin\n\nBei der nachstehenden Gesellschaft wird das Amtslöschungsverfahren gemäß § 394 FamFG eingeleitet.\nWiderspruchsfrist: 1 Monat"
    },
    {
      "date": "2024-10-01",
      "original_text": "Registerbekanntmachung nach dem Umwandlungsgesetz\nBaden-Württemberg Amtsgericht Ulm GsR 805\nDanube eGbR – Staig",
      "type": "Registerbekanntmachung nach dem Umwandlungsgesetz",
      "state": "Baden-Württemberg",
      "amtsgericht": "Amtsgericht Ulm",
      "registernummer": "GsR 805",
      "registerart": "GsR",
      "company_name": "Danube eGbR",
      "company_seat": "Staig",
      "details": "01.10.2024 (Bekanntmachungsdatum)\n\nBaden-Württemberg Amtsgericht Ulm GsR 805\nRegisterbekanntmachung nach dem Umwandlungsgesetz 01.10.2024 (Eintragungsdatum)\n\nDanube eGbR\nGesellschaft bürgerlichen Rechts\nStaig\n\nAls nicht eingetragen wird bekanntgemacht:\nDen Gläubigern des an dem Formwechsel beteiligten Rechtsträgers ist, wenn sie binnen sechs Monaten nach dem Tag, an dem die Eintragung des Formwechsels in das Register des Sitzes desjenigen Rechtsträgers, dessen Gläubiger sie sind, nach § 19 Abs. 3 UmwG als bekanntgemacht gilt, ihren Anspruch nach Grund und Höhe schriftlich anmelden, Sicherheit zu leisten, soweit sie nicht Befriedigung verlangen können. Dieses Recht steht den Gläubigern jedoch nur zu, wenn sie glaubhaft machen, dass durch den Formwechsel die Erfüllung ihrer Forderung gefährdet wird."
    },
    {
      "date": "2024-10-01",
      "original_text": "Sonstige Registerbekanntmachung\nHessen Amtsgericht Kassel VR 2208\nDeutsch-Türkischer Kulturverein – Kassel",
      "type": "Sonstige Registerbekanntmachung",
      "state": "Hessen",
      "amtsgericht": "Amtsgericht Kassel",
      "registernummer": "VR 2208",
      "registerart": "VR",
      "company_name": "Deutsch-Türkischer Kulturverein",
      "company_seat": "Kassel",
      "details": "01.10.2024 (Bekanntmachungsdatum)\n\nHessen Amtsgericht Kassel VR 2208\nSonstige Registerbekanntmachung 01.10.2024 (Eintragungsdatum)\n\nDeutsch-Türkischer Kulturverein\neingetragener Verein\nKassel\n\nDer Verein ist aufgelöst."
    },
    {
      "date": "2024-10-01",
      "original_text": "Registerbekanntmachung nach dem Umwandlungsgesetz\nSchleswig-Holstein Amtsgericht Lübeck HRB 10381\nDeutsche Immobilien GmbH Lübeck – Lübeck",
      "type": "Registerbekanntmachung nach dem Umwandlungsgesetz",
      "state": "Schleswig-Holstein",
      "amtsgericht": "Amtsgericht Lübeck",
      "registernummer": "HRB 10381",
      "registerart": "HRB",
      "company_name": "Deutsche Immobilien GmbH Lübeck",
      "company_seat": "Lübeck",
      "details": "01.10.2024 (Bekanntmachungsdatum)\n\nSchleswig-Holstein Amtsgericht Lübeck HRB 10381\nRegisterbekanntmachung nach dem Umwandlungsgesetz 30.09.2024 (Eintragungsdatum)\n\nDeutsche Immobilien GmbH Lübeck\nGesellschaft mit beschränkter Haftung\nLübeck\n\nZu Eintragungsnummer 6 vom 30.09.2024 wird als nicht eingetragen veröffentlicht: Den Gläubigern der an der Verschmelzung beteiligten Rechtsträger ist, wenn sie binnen sechs Monaten nach dem Tag, an dem die Eintragung der Verschmelzung in das Register des Sitzes desjenigen Rechtsträgers, dessen Gläubiger sie sind, als bekannt gemacht gilt, ihren Anspruch nach Grund und Höhe schriftlich anmelden, Sicherheit zu leisten, soweit sie nicht Befriedigung verlangen können. Dieses Recht steht den Gläubigern jedoch nur zu, wenn sie glaubhaft machen, dass durch die Verschmelzung die Erfüllung ihrer Forderung gefährdet wird."
    },
    {
      "date": "2024-10-01",
      "original_text": "Registerbekanntmachung nach dem Umwandlungsgesetz\nThüringen Amtsgericht Jena HRB 503565\nDiako Personal und Service GmbH – Eisenach",
      "type": "Registerbekanntmachung nach dem Umwandlungsgesetz",
      "state": "Thüringen",
      "amtsgericht": "Amtsgericht Jena",
      "registernummer": "HRB 503565",
      "registerart": "HRB",
      "company_name": "Diako Personal und Service GmbH",
      "company_seat": "Eisenach",
      "details": "01.10.2024 (Bekanntmachungsdatum)\n\nThüringen Amtsgericht Jena HRB 503565\nRegisterbekanntmachung nach dem Umwandlungsgesetz 01.10.2024 (Eintragungsdatum)\n\nDiako Personal und Service GmbH\nGesellschaft mit beschränkter Haftung\nEisenach\n\nNicht eingetragen: Den Gläubigern der an der Verschmelzung beteiligten Rechtsträger, ist wenn sie binnen sechs Monaten nach dem Tag, an dem die Eintragung der Verschmelzung in das Register des Sitzes desjenigen Rechtsträgers, dessen Gläubiger sie sind,  nach § 19 Abs. 3 UmwG als bekanntgemacht gilt, ihren Anspruch nach Grund und Höhe schriftlich anmelden, Sicherheit zu leisten, soweit sie nicht Befriedigung verlangen können. Dieses Recht steht ihnen jedoch nur zu, wenn sie glaubhaft machen, daß durch die Verschmelzung die Erfüllung ihrer Forderung gefährdet wird."
    },
    {
      "date": "2024-10-01",
      "original_text": "Registerbekanntmachung nach dem Umwandlungsgesetz\nThüringen Amtsgericht Jena HRB 500014\nDiako Thüringen gemeinnützige GmbH – Eisenach",
      "type": "Registerbekanntmachung nach dem Umwandlungsgesetz",
      "state": "Thüringen",
      "amtsgericht": "Amtsgericht Jena",
      "registernummer": "HRB 500014",
      "registerart": "HRB",
      "company_name": "Diako Thüringen gemeinnützige GmbH",
      "company_seat": "Eisenach",
      "details": "01.10.2024 (Bekanntmachungsdatum)\n\nThüringen Amtsgericht Jena HRB 500014\nRegisterbekanntmachung nach dem Umwandlungsgesetz 01.10.2024 (Eintragungsdatum)\n\nDiako Thüringen gemeinnützige GmbH\nGesellschaft mit beschränkter Haftung\nEisenach\n\nNicht eingetragen: Den Gläubigern der an der Verschmelzung beteiligten Rechtsträger, ist wenn sie binnen sechs Monaten nach dem Tag, an dem die Eintragung der Verschmelzung in das Register des Sitzes desjenigen Rechtsträgers, dessen Gläubiger sie sind,  nach § 19 Abs. 3 UmwG als bekanntgemacht gilt, ihren Anspruch nach Grund und Höhe schriftlich anmelden, Sicherheit zu leisten, soweit sie nicht Befriedigung verlangen können. Dieses Recht steht ihnen jedoch nur zu, wenn sie glaubhaft machen, daß durch die Verschmelzung die Erfüllung ihrer Forderung gefährdet wird."
    },
    {
      "date": "2024-10-01",
      "original_text": "Registerbekanntmachung nach dem Umwandlungsgesetz\nNiedersachsen Amtsgericht Hannover HRB 227823\nDietlind Heins GmbH – Seelze",
      "type": "Registerbekanntmachung nach dem Umwandlungsgesetz",
      "state": "Niedersachsen",
      "amtsgericht": "Amtsgericht Hannover",
      "registernummer": "HRB 227823",
      "registerart": "HRB",
      "company_name": "Dietlind Heins GmbH",
      "company_seat": "Seelze",
      "details": "01.10.2024 (Bekanntmachungsdatum)\n\nNiedersachsen Amtsgericht Hannover HRB 227823\nRegisterbekanntmachung nach dem Umwandlungsgesetz 01.10.2024 (Eintragungsdatum)\n\nDietlind Heins GmbH\nGesellschaft mit beschränkter Haftung\nSeelze\n\nDen Gläubigern der an der Ausgliederung beteiligten Rechtsträger ist, wenn sie binnen sechs Monaten nach dem Tag, an dem die Eintragung der Ausgliederung in das Register des Sitzes desjenigen Rechtsträgers, dessen Gläubiger sie sind, nach § 19 Abs. 3 UmwG als bekannt gemacht gilt, ihren Anspruch nach Grund und Höhe schriftlich anmelden, Sicherheit zu leisten, soweit sie nicht Befriedigung verlangen können. Dieses Recht steht den Gläubigern jedoch nur zu, wenn sie glaubhaft machen, dass durch die Ausgliederung die Erfüllung der Forderung gefährdet wird."
    },
    {
      "date": "2024-10-01",
      "original_text": "Registerbekanntmachung nach dem Umwandlungsgesetz\nNiedersachsen Amtsgericht Hannover HRA 206379\nDietlind Heins e.K. – Seelze",
      "type": "Registerbekanntmachung nach dem Umwandlungsgesetz",
      "state": "Niedersachsen",
      "amtsgericht": "Amtsgericht Hannover",
      "registernummer": "HRA 206379",
      "registerart": "HRA",
      "company_name": "Dietlind Heins e.K.",
      "company_seat": "Seelze",
      "details": "01.10.2024 (Bekanntmachungsdatum)\n\nNiedersachsen Amtsgericht Hannover HRA 206379\nRegisterbekanntmachung nach dem Umwandlungsgesetz 01.10.2024 (Eintragungsdatum)\n\nDietlind Heins e.K.\nEinzelkaufmann / Einzelkauffrau\nSeelze\n\nDen Gläubigern der an der Ausgliederung beteiligten Rechtsträger ist, wenn sie binnen sechs Monaten nach dem Tag, an dem die Eintragung der Ausgliederung in das Register des Sitzes desjenigen Rechtsträgers, dessen Gläubiger sie sind, nach § 19 Abs. 3 UmwG als bekannt gemacht gilt, ihren Anspruch nach Grund und Höhe schriftlich anmelden, Sicherheit zu leisten, soweit sie nicht Befriedigung verlangen können. Dieses Recht steht den Gläubigern jedoch nur zu, wenn sie glaubhaft machen, dass durch die Ausgliederung die Erfüllung der Forderung gefährdet wird."
    },
    {
      "date": "2024-10-01",
      "original_text": "Registerbekanntmachung nach dem Umwandlungsgesetz\nNordrhein-Westfalen Amtsgericht Siegen HRB 13798\nDornseiff Autokrane & Schwertransporte GmbH – Burbach",
      "type": "Registerbekanntmachung nach dem Umwandlungsgesetz",
      "state": "Nordrhein-Westfalen",
      "amtsgericht": "Amtsgericht Siegen",
      "registernummer": "HRB 13798",
      "registerart": "HRB",
      "company_name": "Dornseiff Autokrane & Schwertransporte GmbH",
      "company_seat": "Burbach",
      "details": "01.10.2024 (Bekanntmachungsdatum)\n\nNordrhein-Westfalen Amtsgericht Siegen HRB 13798\nRegisterbekanntmachung nach dem Umwandlungsgesetz 01.10.2024 (Eintragungsdatum)\n\nDornseiff Autokrane & Schwertransporte GmbH\nGesellschaft mit beschränkter Haftung\nBurbach\n\nDen Gläubigern der an der Verschmelzung beteiligten Rechtsträger ist, wenn sie binnen sechs Monaten nach dem Tag, an dem die Eintragung der Verschmelzung in das Register des Sitzes derjenigen Rechtsträger deren Gläubiger sie sind, nach § 19 Absatz 3 UmwG als bekanntgemacht gilt, ihren Anspruch nach Grund und Höhe schriftlich anmelden, Sicherheit zu leisten, soweit sie nicht Befriedigung verlangen können. Dieses Recht steht den Gläubigern jedoch nur zu, wenn sie glaubhaft machen, dass durch die Verschmelzung die Erfüllung ihrer Forderung gefährdet wird."
    },
    {
      "date": "2024-10-01",
      "original_text": "Registerbekanntmachung nach dem Umwandlungsgesetz\nNordrhein-Westfalen Amtsgericht Siegen HRB 7106\nDornseiff GmbH – Olpe",
      "type": "Registerbekanntmachung nach dem Umwandlungsgesetz",
      "state": "Nordrhein-Westfalen",
      "amtsgericht": "Amtsgericht Siegen",
      "registernummer": "HRB 7106",
      "registerart": "HRB",
      "company_name": "Dornseiff GmbH",
      "company_seat": "Olpe",
      "details": "01.10.2024 (Bekanntmachungsdatum)\n\nNordrhein-Westfalen Amtsgericht Siegen HRB 7106\nRegisterbekanntmachung nach dem Umwandlungsgesetz 01.10.2024 (Eintragungsdatum)\n\nDornseiff GmbH\nGesellschaft mit beschränkter Haftung\nOlpe\n\nDen Gläubigern der an der Verschmelzung beteiligten Rechtsträger ist, wenn sie binnen sechs Monaten nach dem Tag, an dem die Eintragung der Verschmelzung in das Register des Sitzes desjenigen Rechtsträgers, dessen Gläubiger sie sind, nach § 19 Absatz 3 UmwG als bekanntgemacht gilt, ihren Anspruch nach Grund und Höhe schriftlich anmelden, Sicherheit zu leisten, soweit sie nicht Befriedigung verlangen können. Dieses Recht steht den Gläubigern jedoch nur zu, wenn sie glaubhaft machen, dass durch die Verschmelzung die Erfüllung ihrer Forderung gefährdet wird."
    },
    {
      "date": "2024-10-01",
      "original_text": "Registerbekanntmachung nach dem Umwandlungsgesetz\nHessen Amtsgericht Frankfurt am Main HRB 19110\nEPI Grundstücksverwaltungsgesellschaft mbH – Eschborn",
      "type": "Registerbekanntmachung nach dem Umwandlungsgesetz",
      "state": "Hessen",
      "amtsgericht": "Amtsgericht Frankfurt am Main",
      "registernummer": "HRB 19110",
      "registerart": "HRB",
      "company_name": "EPI Grundstücksverwaltungsgesellschaft mbH",
      "company_seat": "Eschborn",
      "details": "01.10.2024 (Bekanntmachungsdatum)\n\nHessen Amtsgericht Frankfurt am Main HRB 19110\nRegisterbekanntmachung nach dem Umwandlungsgesetz 01.10.2024 (Eintragungsdatum)\n\nEPI Grundstücksverwaltungsgesellschaft mbH\nGesellschaft mit beschränkter Haftung\nEschborn\n\nDen Gläubigern der an der Verschmelzung beteiligten Rechtsträger ist, wenn sie binnen sechs Monaten nach dem Tag, an dem die Eintragung der Verschmelzung in das Register des Sitzes derjenigen Rechtsträger deren Gläubiger sie sind, nach § 19 Absatz 3 UmwG bekannt gemacht worden ist, ihren Anspruch nach Grund und Höhe schriftlich anmelden, Sicherheit zu leisten, soweit sie nicht Befriedigung verlangen können. Dieses Recht steht den Gläubigern jedoch nur zu, wenn sie glaubhaft machen, dass durch die Verschmelzung die Erfüllung ihrer Forderung gefährdet wird."
    },
    {
      "date": "2024-10-01",
      "original_text": "Registerbekanntmachung nach dem Umwandlungsgesetz\nBaden-Württemberg Amtsgericht Mannheim HRB 726471\nEPPLEZWEI Alpha GmbH – Baden-Baden",
      "type": "Registerbekanntmachung nach dem Umwandlungsgesetz",
      "state": "Baden-Württemberg",
      "amtsgericht": "Amtsgericht Mannheim",
      "registernummer": "HRB 726471",
      "registerart": "HRB",
      "company_name": "EPPLEZWEI Alpha GmbH",
      "company_seat": "Baden-Baden",
      "details": "01.10.2024 (Bekanntmachungsdatum)\n\nBaden-Württemberg Amtsgericht Mannheim HRB 726471\nRegisterbekanntmachung nach dem Umwandlungsgesetz 01.10.2024 (Eintragungsdatum)\n\nEPPLEZWEI Alpha GmbH\nGesellschaft mit beschränkter Haftung\nBaden-Baden\n\nDen Gläubigern der an der Verschmelzung beteiligten Rechtsträger ist, wenn sie binnen sechs Monaten nach dem Tag, an dem die Eintragung der Verschmelzung in das Register des Sitzes desjenigen Rechtsträgers, dessen Gläubiger sie sind, nach § 19 Abs. 3 UmwG als bekanntgemacht gilt, ihren Anspruch nach Grund und Höhe schriftlich anmelden, Sicherheit zu leisten, soweit sie nicht Befriedigung verlangen können. Dieses Recht steht den Gläubigern jedoch nur zu, wenn sie glaubhaft machen, dass durch die Verschmelzung die Erfüllung ihrer Forderung gefährdet wird."
    },
    {
      "date": "2024-10-01",
      "original_text": "Registerbekanntmachung nach dem Umwandlungsgesetz\nNordrhein-Westfalen Amtsgericht Siegen HRB 14008\nEgon Esmeyer HSS GmbH – Siegen",
      "type": "Registerbekanntmachung nach dem Umwandlungsgesetz",
      "state": "Nordrhein-Westfalen",
      "amtsgericht": "Amtsgericht Siegen",
      "registernummer": "HRB 14008",
      "registerart": "HRB",
      "company_name": "Egon Esmeyer HSS GmbH",
      "company_seat": "Siegen",
      "details": "01.10.2024 (Bekanntmachungsdatum)\n\nNordrhein-Westfalen Amtsgericht Siegen HRB 14008\nRegisterbekanntmachung nach dem Umwandlungsgesetz 01.10.2024 (Eintragungsdatum)\n\nEgon Esmeyer HSS GmbH\nGesellschaft mit beschränkter Haftung\nSiegen\n\nDen Gläubigern der an der Ausgliederung beteiligten Rechtsträger ist, wenn sie binnen sechs Monaten nach dem Tag, an dem die Eintragung der Ausgliederung in das Register des Sitzes desjenigen Rechtsträgers, dessen Gläubiger sie sind, nach § 19 Absatz 3 UmwG als bekanntgemacht gilt, ihren Anspruch nach Grund und Höhe schriftlich anmelden, Sicherheit zu leisten, soweit sie nicht Befriedigung verlangen können. Dieses Recht steht den Gläubigern jedoch nur zu, wenn sie glaubhaft machen, dass durch die Ausgliederung die Erfüllung ihrer Forderung gefährdet wird."
    },
    {
      "date": "2024-10-01",
      "original_text": "Registerbekanntmachung nach dem Umwandlungsgesetz\nNordrhein-Westfalen Amtsgericht Siegen HRA 9963\nEgon Esmeyer e.K. – Siegen",
      "type": "Registerbekanntmachung nach dem Umwandlungsgesetz",
      "state": "Nordrhein-Westfalen",
      "amtsgericht": "Amtsgericht Siegen",
      "registernummer": "HRA 9963",
      "registerart": "HRA",
      "company_name": "Egon Esmeyer e.K.",
      "company_seat": "Siegen",
      "details": "01.10.2024 (Bekanntmachungsdatum)\n\nNordrhein-Westfalen Amtsgericht Siegen HRA 9963\nRegisterbekanntmachung nach dem Umwandlungsgesetz 01.10.2024 (Eintragungsdatum)\n\nEgon Esmeyer e.K.\nEinzelkaufmann / Einzelkauffrau\nSiegen\n\nDen Gläubigern der an der Ausgliederung beteiligten Rechtsträger ist, wenn sie binnen sechs Monaten nach dem Tag, an dem die Eintragung der Ausgliederung in das Register des Sitzes desjenigen Rechtsträgers, dessen Gläubiger sie sind, nach § 19 Absatz 3 UmwG als bekanntgemacht gilt, ihren Anspruch nach Grund und Höhe schriftlich anmelden, Sicherheit zu leisten, soweit sie nicht Befriedigung verlangen können. Dieses Recht steht den Gläubigern jedoch nur zu, wenn sie glaubhaft machen, dass durch die Ausgliederung die Erfüllung ihrer Forderung gefährdet wird."
    },
    {
      "date": "2024-10-01",
      "original_text": "Registerbekanntmachung nach dem Umwandlungsgesetz\nHamburg Amtsgericht Hamburg HRB 136119\nEinundzwanzigste PMB Management GmbH – Hamburg",
      "type": "Registerbekanntmachung nach dem Umwandlungsgesetz",
      "state": "Hamburg",
      "amtsgericht": "Amtsgericht Hamburg",
      "registernummer": "HRB 136119",
      "registerart": "HRB",
      "company_name": "Einundzwanzigste PMB Management GmbH",
      "company_seat": "Hamburg",
      "details": "01.10.2024 (Bekanntmachungsdatum)\n\nHamburg Amtsgericht Hamburg HRB 136119\nRegisterbekanntmachung nach dem Umwandlungsgesetz 01.10.2024 (Eintragungsdatum)\n\nEinundzwanzigste PMB Management GmbH\nGesellschaft mit beschränkter Haftung\nHamburg\n\nAls nicht eingetragen wird bekannt gemacht:\nDen Gläubigern der an der Verschmelzung beteiligten Gesellschaften ist, wenn sie binnen sechs Monaten nach dem Tag, an dem die Eintragung der Verschmelzung in das Register des Sitzes desjenigen Rechtsträgers, dessen Gläubiger sie sind, nach § 19 Absatz 3 UmwG als bekannt gemacht gilt, ihren Anspruch nach Grund und Höhe schriftlich anmelden, Sicherheit zu leisten, soweit sie nicht Befriedigung verlangen können. Dieses Recht steht den Gläubigern jedoch nur zu, wenn sie glaubhaft machen, dass durch die Verschmelzung die Erfüllung ihrer Forderung gefährdet wird."
    },
    {
      "date": "2024-10-01",
      "original_text": "Registerbekanntmachung nach dem Umwandlungsgesetz\nNiedersachsen Amtsgericht Braunschweig HRB 211297\nEisbrenner BS GmbH – Braunschweig",
      "type": "Registerbekanntmachung nach dem Umwandlungsgesetz",
      "state": "Niedersachsen",
      "amtsgericht": "Amtsgericht Braunschweig",
      "registernummer": "HRB 211297",
      "registerart": "HRB",
      "company_name": "Eisbrenner BS GmbH",
      "company_seat": "Braunschweig",
      "details": "01.10.2024 (Bekanntmachungsdatum)\n\nNiedersachsen Amtsgericht Braunschweig HRB 211297\nRegisterbekanntmachung nach dem Umwandlungsgesetz 01.10.2024 (Eintragungsdatum)\n\nEisbrenner BS GmbH\nGesellschaft mit beschränkter Haftung\nBraunschweig\n\nDen Gläubigern der an der Verschmelzung beteiligten Rechtsträger ist, wenn sie binnen sechs Monaten nach dem Tag, an dem die Eintragung der Verschmelzung in das Register des Sitzes desjenigen Rechtsträgers, dessen Gläubiger sie sind, nach § 19  Abs.  3 UmwG als bekannt gemacht gilt, ihren Anspruch nach Grund und Höhe schriftlich anmelden, Sicherheit zu leisten, soweit sie nicht Befriedigung verlangen können. Dieses Recht steht den Gläubigern jedoch nur zu, wenn sie glaubhaft machen, dass durch die Verschmelzung die Erfüllung der Forderung gefährdet wird."
    },
    {
      "date": "2024-10-01",
      "original_text": "Registerbekanntmachung nach dem Umwandlungsgesetz\nNordrhein-Westfalen Amtsgericht Bad Oeynhausen HRB 3896\nEnergieservice Westfalen Weser GmbH – Kirchlengern",
      "type": "Registerbekanntmachung nach dem Umwandlungsgesetz",
      "state": "Nordrhein-Westfalen",
      "amtsgericht": "Amtsgericht Bad Oeynhausen",
      "registernummer": "HRB 3896",
      "registerart": "HRB",
      "company_name": "Energieservice Westfalen Weser GmbH",
      "company_seat": "Kirchlengern",
      "details": "01.10.2024 (Bekanntmachungsdatum)\n\nNordrhein-Westfalen Amtsgericht Bad Oeynhausen HRB 3896\nRegisterbekanntmachung nach dem Umwandlungsgesetz 01.10.2024 (Eintragungsdatum)\n\nEnergieservice Westfalen Weser GmbH\nGesellschaft mit beschränkter Haftung\nKirchlengern\n\nDen Gläubigern der an der Abspaltung beteiligten Rechtsträger ist, wenn sie binnen sechs Monaten nach dem Tag, an dem die Eintragung der Abspaltung in das Register des Sitzes desjenigen Rechtsträgers, dessen Gläubiger sie sind, nach § 19 Absatz 3 UmwG als bekanntgemacht gilt, ihren Anspruch nach Grund und Höhe schriftlich anmelden, Sicherheit zu leisten, soweit sie nicht Befriedigung verlangen können. Dieses Recht steht den Gläubigern jedoch nur zu, wenn sie glaubhaft machen, dass durch die Abspaltung die Erfüllung ihrer Forderung gefährdet wird."
    },
    {
      "date": "2024-10-01",
      "original_text": "Registerbekanntmachung nach dem Umwandlungsgesetz\nBayern Amtsgericht Fürth HRB 8629\nErwin H. Schütz Dentallabor GmbH – Erlangen",
      "type": "Registerbekanntmachung nach dem Umwandlungsgesetz",
      "state": "Bayern",
      "amtsgericht": "Amtsgericht Fürth",
      "registernummer": "HRB 8629",
      "registerart": "HRB",
      "company_name": "Erwin H. Schütz Dentallabor GmbH",
      "company_seat": "Erlangen",
      "details": "01.10.2024 (Bekanntmachungsdatum)\n\nBayern Amtsgericht Fürth HRB 8629\nRegisterbekanntmachung nach dem Umwandlungsgesetz 27.09.2024 (Eintragungsdatum)\n\nErwin H. Schütz Dentallabor GmbH\nGesellschaft mit beschränkter Haftung\nErlangen\n\nDen Gläubigern der an der Verschmelzung beteiligten Rechtsträger ist, wenn sie binnen sechs Monaten nach dem Tag, an dem die Eintragung der Verschmelzung in das Register des Sitzes desjenigen Rechtsträgers, dessen Gläubiger sie sind, nach § 19 Abs. 3 UmwG als bekannt gemacht gilt, ihren Anspruch nach Grund und Höhe schriftlich anmelden, Sicherheit zu leisten, soweit sie nicht Befriedigung verlangen können. Dieses Recht steht den Gläubigern jedoch nur zu, wenn sie glaubhaft machen, dass durch die Verschmelzung die Erfüllung ihrer Forderung gefährdet wird."
    },
    {
      "date": "2024-10-01",
      "original_text": "Registerbekanntmachung nach dem Umwandlungsgesetz\nNordrhein-Westfalen Amtsgericht Düsseldorf HRB 22930\nEssenceMediacom Germany GmbH – Düsseldorf",
      "type": "Registerbekanntmachung nach dem Umwandlungsgesetz",
      "state": "Nordrhein-Westfalen",
      "amtsgericht": "Amtsgericht Düsseldorf",
      "registernummer": "HRB 22930",
      "registerart": "HRB",
      "company_name": "EssenceMediacom Germany GmbH",
      "company_seat": "Düsseldorf",
      "details": "01.10.2024 (Bekanntmachungsdatum)\n\nNordrhein-Westfalen Amtsgericht Düsseldorf HRB 22930\nRegisterbekanntmachung nach dem Umwandlungsgesetz 01.10.2024 (Eintragungsdatum)\n\nEssenceMediacom Germany GmbH\nGesellschaft mit beschränkter Haftung\nDüsseldorf\n\nDen Gläubigern der an der Verschmelzung beteiligten Rechtsträger ist, wenn sie binnen sechs Monaten nach dem Tag, an dem die Eintragung der Verschmelzung in das Register des Sitzes desjenigen Rechtsträgers, dessen Gläubiger sie sind, nach § 19 Absatz 3 UmwG als bekanntgemacht gilt, ihren Anspruch nach Grund und Höhe schriftlich anmelden, Sicherheit zu leisten, soweit sie nicht Befriedigung verlangen können. Dieses Recht steht den Gläubigern jedoch nur zu, wenn sie glaubhaft machen, dass durch die Verschmelzung die Erfüllung ihrer Forderung gefährdet wird."
    },
    {
      "date": "2024-10-01",
      "original_text": "Registerbekanntmachung nach dem Umwandlungsgesetz\nBerlin Amtsgericht Berlin (Charlottenburg) HRA 62963\nEugen Schiller, KRAFT Runners e.K. – Berlin",
      "type": "Registerbekanntmachung nach dem Umwandlungsgesetz",
      "state": "Berlin",
      "amtsgericht": "Amtsgericht Berlin (Charlottenburg)",
      "registernummer": "HRA 62963",
      "registerart": "HRA",
      "company_name": "Eugen Schiller, KRAFT Runners e.K.",
      "company_seat": "Berlin",
      "details": "01.10.2024 (Bekanntmachungsdatum)\n\nBerlin Amtsgericht Berlin (Charlottenburg) HRA 62963\nRegisterbekanntmachung nach dem Umwandlungsgesetz 30.09.2024 (Eintragungsdatum)\n\nEugen Schiller, KRAFT Runners e.K.\nEinzelkaufmann / Einzelkauffrau\nBerlin\n\nZu Eintragungsnummer 2 vom 30.09.2024 wird als nicht eingetragen veröffentlicht: Den Gläubigern der an der Spaltung beteiligten Rechtsträger ist, wenn sie binnen sechs Monaten nach dem Tag, an dem die Eintragung der Spaltung in das Register des Sitzes desjenigen Rechtsträgers, dessen Gläubiger sie sind, als bekannt gemacht gilt, ihren Anspruch nach Grund und Höhe schriftlich anmelden, Sicherheit zu leisten, soweit sie nicht Befriedigung verlangen können. Dieses Recht steht den Gläubigern jedoch nur zu, wenn sie glaubhaft machen, dass durch die Spaltung die Erfüllung ihrer Forderung gefährdet wird. Das Recht, Sicherheitsleistung zu verlangen, steht Gläubigern nicht zu, die im Falle der Insolvenz ein Recht auf vorzugsweise Befriedigung aus einer Deckungsmasse haben, die nach gesetzlicher Vorschrift zu ihrem Schutz errichtet und staatlich überwacht ist."
    },
    {
      "date": "2024-10-01",
      "original_text": "Registerbekanntmachung nach dem Umwandlungsgesetz\nNordrhein-Westfalen Amtsgericht Düsseldorf HRB 64052\nEurogroup Deutschland GmbH – Langenfeld",
      "type": "Registerbekanntmachung nach dem Umwandlungsgesetz",
      "state": "Nordrhein-Westfalen",
      "amtsgericht": "Amtsgericht Düsseldorf",
      "registernummer": "HRB 64052",
      "registerart": "HRB",
      "company_name": "Eurogroup Deutschland GmbH",
      "company_seat": "Langenfeld",
      "details": "01.10.2024 (Bekanntmachungsdatum)\n\nNordrhein-Westfalen Amtsgericht Düsseldorf HRB 64052\nRegisterbekanntmachung nach dem Umwandlungsgesetz 01.10.2024 (Eintragungsdatum)\n\nEurogroup Deutschland GmbH\nGesellschaft mit beschränkter Haftung\nLangenfeld\n\nDen Gläubigern der an der Verschmelzung beteiligten Rechtsträger ist, wenn sie binnen sechs Monaten nach dem Tag, an dem die Eintragung der Verschmelzung in das Register des Sitzes desjenigen Rechtsträgers, dessen Gläubiger sie sind, nach § 19 Absatz 3 UmwG als bekanntgemacht gilt, ihren Anspruch nach Grund und Höhe schriftlich anmelden, Sicherheit zu leisten, soweit sie nicht Befriedigung verlangen können. Dieses Recht steht den Gläubigern jedoch nur zu, wenn sie glaubhaft machen, dass durch die Verschmelzung die Erfüllung ihrer Forderung gefährdet wird."
    },
    {
      "date": "2024-10-01",
      "original_text": "Registerbekanntmachung nach dem Umwandlungsgesetz\nHessen Amtsgericht Darmstadt HRB 92891\nFF Headwear Europe GmbH – Ober-Ramstadt",
      "type": "Registerbekanntmachung nach dem Umwandlungsgesetz",
      "state": "Hessen",
      "amtsgericht": "Amtsgericht Darmstadt",
      "registernummer": "HRB 92891",
      "registerart": "HRB",
      "company_name": "FF Headwear Europe GmbH",
      "company_seat": "Ober-Ramstadt",
      "details": "01.10.2024 (Bekanntmachungsdatum)\n\nHessen Amtsgericht Darmstadt HRB 92891\nRegisterbekanntmachung nach dem Umwandlungsgesetz 01.10.2024 (Eintragungsdatum)\n\nFF Headwear Europe GmbH\nGesellschaft mit beschränkter Haftung\nOber-Ramstadt\n\nDen Gläubigern der an der Verschmelzung beteiligten Rechtsträger ist, wenn sie binnen sechs Monaten nach dem Tag, an dem die Eintragung der Verschmelzung in das Register des Sitzes desjenigen Rechtsträgers, dessen Gläubiger sie sind, nach § 19 Absatz 3 UmwG bekannt gemacht worden ist, ihren Anspruch nach Grund und Höhe schriftlich anmelden, Sicherheit zu leisten, soweit sie nicht Befriedigung verlangen können. Dieses Recht steht den Gläubigern jedoch nur zu, wenn sie glaubhaft machen, dass durch die Verschmelzung die Erfüllung ihrer Forderung gefährdet wird."
    },
    {
      "date": "2024-10-01",
      "original_text": "Registerbekanntmachung nach dem Umwandlungsgesetz\nNordrhein-Westfalen Amtsgericht Düsseldorf HRB 102769\nFMA3 GmbH – Düsseldorf",
      "type": "Registerbekanntmachung nach dem Umwandlungsgesetz",
      "state": "Nordrhein-Westfalen",
      "amtsgericht": "Amtsgericht Düsseldorf",
      "registernummer": "HRB 102769",
      "registerart": "HRB",
      "company_name": "FMA3 GmbH",
      "company_seat": "Düsseldorf",
      "details": "01.10.2024 (Bekanntmachungsdatum)\n\nNordrhein-Westfalen Amtsgericht Düsseldorf HRB 102769\nRegisterbekanntmachung nach dem Umwandlungsgesetz 01.10.2024 (Eintragungsdatum)\n\nFMA3 GmbH\nGesellschaft mit beschränkter Haftung\nDüsseldorf\n\nDen Gläubigern der an der formwechselnden Umwandlung beteiligten Rechtsträger ist, wenn sie binnen sechs Monaten nach dem Tag, an dem die Eintragung der formwechselnden Umwandlung in das Register des Sitzes desjenigen Rechtsträgers, dessen Gläubiger sie sind, nach § 19 Absatz 3 UmwG als bekanntgemacht gilt, ihren Anspruch nach Grund und Höhe schriftlich anmelden, Sicherheit zu leisten, soweit sie nicht Befriedigung verlangen können. Dieses Recht steht den Gläubigern jedoch nur zu, wenn sie glaubhaft machen, dass durch die formwechselnden Umwandlung die Erfüllung ihrer Forderung gefährdet wird."
    },
    {
      "date": "2024-10-01",
      "original_text": "Registerbekanntmachung nach dem Umwandlungsgesetz\nNiedersachsen Amtsgericht Walsrode HRB 212244\nFelicitas Krankenpflege GmbH – Stuhr",
      "type": "Registerbekanntmachung nach dem Umwandlungsgesetz",
      "state": "Niedersachsen",
      "amtsgericht": "Amtsgericht Walsrode",
      "registernummer": "HRB 212244",
      "registerart": "HRB",
      "company_name": "Felicitas Krankenpflege GmbH",
      "company_seat": "Stuhr",
      "details": "01.10.2024 (Bekanntmachungsdatum)\n\nNiedersachsen Amtsgericht Walsrode HRB 212244\nRegisterbekanntmachung nach dem Umwandlungsgesetz 01.10.2024 (Eintragungsdatum)\n\nFelicitas Krankenpflege GmbH\nGesellschaft mit beschränkter Haftung\nStuhr\n\nDen Gläubigern der an der Ausgliederung beteiligten Rechtsträger ist, wenn sie binnen sechs Monaten nach dem Tag, an dem die Eintragung der Ausgliederung in das Register des Sitzes desjenigen Rechtsträgers, dessen Gläubiger sie sind, nach § 19 Abs. 3 UmwG als bekannt gemacht gilt, ihren Anspruch nach Grund und Höhe schriftlich anmelden, Sicherheit zu leisten, soweit sie nicht Befriedigung verlangen können. Dieses Recht steht den Gläubigern jedoch nur zu, wenn sie glaubhaft machen, dass durch die Ausgliederung die Erfüllung der Forderung gefährdet wird."
    },
    {
      "date": "2024-10-01",
      "original_text": "Registerbekanntmachung nach dem Umwandlungsgesetz\nNiedersachsen Amtsgericht Walsrode HRA 205430\nFelicitas Pflege e.K. – Stuhr",
      "type": "Registerbekanntmachung nach dem Umwandlungsgesetz",
      "state": "Niedersachsen",
      "amtsgericht": "Amtsgericht Walsrode",
      "registernummer": "HRA 205430",
      "registerart": "HRA",
      "company_name": "Felicitas Pflege e.K.",
      "company_seat": "Stuhr",
      "details": "01.10.2024 (Bekanntmachungsdatum)\n\nNiedersachsen Amtsgericht Walsrode HRA 205430\nRegisterbekanntmachung nach dem Umwandlungsgesetz 01.10.2024 (Eintragungsdatum)\n\nFelicitas Pflege e.K.\nEinzelkaufmann / Einzelkauffrau\nStuhr\n\nDen Gläubigern der an der Ausgliederung beteiligten Rechtsträger ist, wenn sie binnen sechs Monaten nach dem Tag, an dem die Eintragung der Ausgliederung in das Register des Sitzes desjenigen Rechtsträgers, dessen Gläubiger sie sind, nach § 19 Abs. 3 UmwG als bekannt gemacht gilt, ihren Anspruch nach Grund und Höhe schriftlich anmelden, Sicherheit zu leisten, soweit sie nicht Befriedigung verlangen können. Dieses Recht steht den Gläubigern jedoch nur zu, wenn sie glaubhaft machen, dass durch die Ausgliederung die Erfüllung der Forderung gefährdet wird."
    },
    {
      "date": "2024-10-01",
      "original_text": "Einreichung neuer Dokumente\nSaarland Amtsgericht Saarbrücken HRB 23260\nFlugplatz Düren - Untere Saar - Betriebsgesellschaft mit beschränkter Haftung – Wallerfangen",
      "type": "Einreichung neuer Dokumente",
      "state": "Saarland",
      "amtsgericht": "Amtsgericht Saarbrücken",
      "registernummer": "HRB 23260",
      "registerart": "HRB",
      "company_name": "Flugplatz Düren - Untere Saar - Betriebsgesellschaft mit beschränkter Haftung",
      "company_seat": "Wallerfangen",
      "details": "01.10.2024 (Bekanntmachungsdatum)\n\nSaarland Amtsgericht Saarbrücken HRB 23260\nEinreichung neuer Dokumente\n\nFlugplatz Düren - Untere Saar - Betriebsgesellschaft mit beschränkter Haftung\nGesellschaft mit beschränkter Haftung\nWallerfangen\n\nDie Geschäftsführung der Gesellschaft hat eine Liste der Mitglieder des Aufsichtsrats zum Handelsregister eingereicht (§ 52 Abs. 3 Satz 2 GmbHG)."
    },
    {
      "date": "2024-10-01",
      "original_text": "Einreichung neuer Dokumente\nBrandenburg Amtsgericht Cottbus HRB 1516\nFlugplatzgesellschaft Cottbus/Neuhausen m.b.H. – Neuhausen/Spree",
      "type": "Einreichung neuer Dokumente",
      "state": "Brandenburg",
      "amtsgericht": "Amtsgericht Cottbus",
      "registernummer": "HRB 1516",
      "registerart": "HRB",
      "company_name": "Flugplatzgesellschaft Cottbus/Neuhausen m.b.H.",
      "company_seat": "Neuhausen/Spree",
      "details": "01.10.2024 (Bekanntmachungsdatum)\n\nBrandenburg Amtsgericht Cottbus HRB 1516\nEinreichung neuer Dokumente\n\nFlugplatzgesellschaft Cottbus/Neuhausen m.b.H.\nGesellschaft mit beschränkter Haftung\nNeuhausen/Spree\n\nDie aktuelle Liste der Aufsichtsratsmitglieder wurde zum Handelsregister gem. § 52 Abs. 3 GmbHG eingereicht."
    },
    {
      "date": "2024-10-01",
      "original_text": "Einreichung neuer Dokumente\nBrandenburg Amtsgericht Potsdam HRB 16258\nFlächenagentur Brandenburg GmbH – Brandenburg an der Havel",
      "type": "Einreichung neuer Dokumente",
      "state": "Brandenburg",
      "amtsgericht": "Amtsgericht Potsdam",
      "registernummer": "HRB 16258",
      "registerart": "HRB",
      "company_name": "Flächenagentur Brandenburg GmbH",
      "company_seat": "Brandenburg an der Havel",
      "details": "01.10.2024 (Bekanntmachungsdatum)\n\nBrandenburg Amtsgericht Potsdam HRB 16258\nEinreichung neuer Dokumente\n\nFlächenagentur Brandenburg GmbH\nGesellschaft mit beschränkter Haftung\nBrandenburg an der Havel\n\nAls nicht eingetragen wird veröffentlicht: Eine Liste der Mitglieder des Aufsichtsrates wurde zum Handelsregister eingereicht."
    },
    {
      "date": "2024-10-01",
      "original_text": "Registerbekanntmachung nach dem Umwandlungsgesetz\nSachsen Amtsgericht Chemnitz VR 3880\nFreiberg zeigt Herz e.V. – Freiberg",
      "type": "Registerbekanntmachung nach dem Umwandlungsgesetz",
      "state": "Sachsen",
      "amtsgericht": "Amtsgericht Chemnitz",
      "registernummer": "VR 3880",
      "registerart": "VR",
      "company_name": "Freiberg zeigt Herz e.V.",
      "company_seat": "Freiberg",
      "details": "01.10.2024 (Bekanntmachungsdatum)\n\nSachsen Amtsgericht Chemnitz VR 3880\nRegisterbekanntmachung nach dem Umwandlungsgesetz 01.10.2024 (Eintragungsdatum)\n\nFreiberg zeigt Herz e.V.\neingetragener Verein\nFreiberg\n\nDen Gläubigern der an der Verschmelzung beteiligten Rechtsträger ist, wenn sie binnen sechs Monaten nach dem Tag, an dem die Eintragung der Verschmelzung in das Register des Sitzes desjenigen Rechtsträgers, dessen Gläubiger sie sind, nach § 19 Abs. 3 UmwG als bekannt gemacht gilt, ihren Anspruch nach Grund und Höhe schriftlich anmelden, Sicherheit zu leisten, soweit sie nicht Befriedigung verlangen können. Dieses Recht steht den Gläubigern jedoch nur zu, wenn sie glaubhaft machen, dass durch die Verschmelzung die Erfüllung der Forderung gefährdet wird."
    },
    {
      "date": "2024-10-01",
      "original_text": "Registerbekanntmachung nach dem Umwandlungsgesetz\nBayern Amtsgericht München HRB 242699\nFutrue Group Services GmbH – Gräfelfing",
      "type": "Registerbekanntmachung nach dem Umwandlungsgesetz",
      "state": "Bayern",
      "amtsgericht": "Amtsgericht München",
      "registernummer": "HRB 242699",
      "registerart": "HRB",
      "company_name": "Futrue Group Services GmbH",
      "company_seat": "Gräfelfing",
      "details": "01.10.2024 (Bekanntmachungsdatum)\n\nBayern Amtsgericht München HRB 242699\nRegisterbekanntmachung nach dem Umwandlungsgesetz 30.09.2024 (Eintragungsdatum)\n\nFutrue Group Services GmbH\nGesellschaft mit beschränkter Haftung\nGräfelfing\n\nDen Gläubigern der an der Verschmelzung beteiligten Rechtsträger ist, wenn sie binnen sechs Monaten nach dem Tag, an dem die Eintragung der Verschmelzung in das Register des Sitzes desjenigen Rechtsträgers, dessen Gläubiger sie sind, nach § 19 Abs. 3 UmwG als bekannt gemacht gilt, ihren Anspruch nach Grund und Höhe schriftlich anmelden, Sicherheit zu leisten, soweit sie nicht Befriedigung verlangen können. Dieses Recht steht den Gläubigern jedoch nur zu, wenn sie glaubhaft machen, dass durch die Verschmelzung die Erfüllung ihrer Forderung gefährdet wird."
    },
    {
      "date": "2024-10-01",
      "original_text": "Registerbekanntmachung nach dem Umwandlungsgesetz\nSchleswig-Holstein Amtsgericht Kiel HRB 24248\nFöSK Immobilien GmbH – Kiel",
      "type": "Registerbekanntmachung nach dem Umwandlungsgesetz",
      "state": "Schleswig-Holstein",
      "amtsgericht": "Amtsgericht Kiel",
      "registernummer": "HRB 24248",
      "registerart": "HRB",
      "company_name": "FöSK Immobilien GmbH",
      "company_seat": "Kiel",
      "details": "01.10.2024 (Bekanntmachungsdatum)\n\nSchleswig-Holstein Amtsgericht Kiel HRB 24248\nRegisterbekanntmachung nach dem Umwandlungsgesetz 09.09.2024 (Eintragungsdatum)\n\nFöSK Immobilien GmbH\nGesellschaft mit beschränkter Haftung\nKiel\n\nZu Eintragungsnummer 2 vom 09.09.2024 wird als nicht eingetragen veröffentlicht: Den Gläubigern der an der Verschmelzung beteiligten Rechtsträger ist, wenn sie binnen sechs Monaten nach dem Tag, an dem die Eintragung der Verschmelzung in das Register des Sitzes desjenigen Rechtsträgers, dessen Gläubiger sie sind, nach § 19 Abs. 3 UmwG bekannt gemacht worden ist, ihren Anspruch nach Grund und Höhe schriftlich anmelden, Sicherheit zu leisten, soweit sie nicht Befriedigung verlangen können. Dieses Recht steht den Gläubigern jedoch nur zu, wenn sie glaubhaft machen, dass durch die Verschmelzung die Erfüllung ihrer Forderung gefährdet wird."
    },
    {
      "date": "2024-10-01",
      "original_text": "Sonstige Registerbekanntmachung\nHessen Amtsgericht Fritzlar VR 2305\nFörderverein Inner Wheel Club Bad Wildungen-Fritzlar – Bad Wildungen",
      "type": "Sonstige Registerbekanntmachung",
      "state": "Hessen",
      "amtsgericht": "Amtsgericht Fritzlar",
      "registernummer": "VR 2305",
      "registerart": "VR",
      "company_name": "Förderverein Inner Wheel Club Bad Wildungen-Fritzlar",
      "company_seat": "Bad Wildungen",
      "details": "01.10.2024 (Bekanntmachungsdatum)\n\nHessen Amtsgericht Fritzlar VR 2305\nSonstige Registerbekanntmachung 01.10.2024 (Eintragungsdatum)\n\nFörderverein Inner Wheel Club Bad Wildungen-Fritzlar\neingetragener Verein\nBad Wildungen\n\nDer Verein ist aufgelöst."
    },
    {
      "date": "2024-10-01",
      "original_text": "Löschungsankündigung\nNordrhein-Westfalen Amtsgericht Mönchengladbach HRA 339\nGebr. Berger GmbH & Co. KG – Mönchengladbach",
      "type": "Löschungsankündigung",
      "state": "Nordrhein-Westfalen",
      "amtsgericht": "Amtsgericht Mönchengladbach",
      "registernummer": "HRA 339",
      "registerart": "HRA",
      "company_name": "Gebr. Berger GmbH & Co. KG",
      "company_seat": "Mönchengladbach",
      "details": "01.10.2024 (Bekanntmachungsdatum)\n\nNordrhein-Westfalen Amtsgericht Mönchengladbach HRA 339\nLöschungsankündigung\n\nGebr. Berger GmbH & Co. KG\nKommanditgesellschaft\nMönchengladbach\n\nIn der Handelsregistersache Gebr. Berger GmbH & Co. KG, Krefelder Straße 436, 41066 Mönchengladbach (Amtsgericht Mönchengladbach, HRA 339) beabsichtigt das Registergericht, die Gesellschaft von Amts wegen aus dem Handelsregister zu löschen, da keine Anhaltspunkte vorhanden sind, dass die Gesellschaft nach dem Ende des Insolvenzverfahrens kein Vermögen mehr hat, § 394 Abs. 1, 3 FamFG.\nEs wird hiermit eine Frist von 3 Monaten eingeräumt, um einen Widerspruch gegen die beabsichtigte Löschung geltend zu machen."
    },
    {
      "date": "2024-10-01",
      "original_text": "Registerbekanntmachung nach dem Umwandlungsgesetz\nHamburg Amtsgericht Hamburg HRA 15017\nGebr. Heinemann SE & Co. KG – Hamburg",
      "type": "Registerbekanntmachung nach dem Umwandlungsgesetz",
      "state": "Hamburg",
      "amtsgericht": "Amtsgericht Hamburg",
      "registernummer": "HRA 15017",
      "registerart": "HRA",
      "company_name": "Gebr. Heinemann SE & Co. KG",
      "company_seat": "Hamburg",
      "details": "01.10.2024 (Bekanntmachungsdatum)\n\nHamburg Amtsgericht Hamburg HRA 15017\nRegisterbekanntmachung nach dem Umwandlungsgesetz 01.10.2024 (Eintragungsdatum)\n\nGebr. Heinemann SE & Co. KG\nKommanditgesellschaft\nHamburg\n\nAls nicht eingetragen wird bekannt gemacht:\nDen Gläubigern der an der Verschmelzung beteiligten Gesellschaften ist, wenn sie binnen sechs Monaten nach dem Tag, an dem die Eintragung der Verschmelzung in das Register des Sitzes desjenigen Rechtsträgers, dessen Gläubiger sie sind, nach § 19 Absatz 3 UmwG als bekannt gemacht gilt, ihren Anspruch nach Grund und Höhe schriftlich anmelden, Sicherheit zu leisten, soweit sie nicht Befriedigung verlangen können. Dieses Recht steht den Gläubigern jedoch nur zu, wenn sie glaubhaft machen, dass durch die Verschmelzung die Erfüllung ihrer Forderung gefährdet wird."
    },
    {
      "date": "2024-10-01",
      "original_text": "Einreichung neuer Dokumente\nSaarland Amtsgericht Saarbrücken HRB 13962\nGesellschaft für Bildung und Kultur im Landkreis Saarlouis - Gemeinnützige Gesellschaft mit beschränkter Haftung – Saarlouis",
      "type": "Einreichung neuer Dokumente",
      "state": "Saarland",
      "amtsgericht": "Amtsgericht Saarbrücken",
      "registernummer": "HRB 13962",
      "registerart": "HRB",
      "company_name": "Gesellschaft für Bildung und Kultur im Landkreis Saarlouis - Gemeinnützige Gesellschaft mit beschränkter Haftung",
      "company_seat": "Saarlouis",
      "details": "01.10.2024 (Bekanntmachungsdatum)\n\nSaarland Amtsgericht Saarbrücken HRB 13962\nEinreichung neuer Dokumente\n\nGesellschaft für Bildung und Kultur im Landkreis Saarlouis - Gemeinnützige Gesellschaft mit beschränkter Haftung\nGesellschaft mit beschränkter Haftung\nSaarlouis\n\nDie Geschäftsführung der Gesellschaft hat eine Liste der Mitglieder des Aufsichtsrats zum Handelsregister eingereicht (§ 52 Abs. 3 Satz 2 GmbHG)."
    },
    {
      "date": "2024-10-01",
      "original_text": "Löschungsankündigung\nBrandenburg Amtsgericht Potsdam HRB 39389\nGoldener Services UG (haftungsbeschränkt) – Potsdam",
      "type": "Löschungsankündigung",
      "state": "Brandenburg",
      "amtsgericht": "Amtsgericht Potsdam",
      "registernummer": "HRB 39389",
      "registerart": "HRB",
      "company_name": "Goldener Services UG (haftungsbeschränkt)",
      "company_seat": "Potsdam",
      "details": "01.10.2024 (Bekanntmachungsdatum)\n\nBrandenburg Amtsgericht Potsdam HRB 39389\nLöschungsankündigung\n\nGoldener Services UG (haftungsbeschränkt)\nGesellschaft mit beschränkter Haftung\nPotsdam\n\nBei der nachstehenden Gesellschaft wird das Amtslöschungsverfahren gemäß § 394 FamFG eingeleitet. Widerspruchsfrist 8 Wochen."
    },
    {
      "date": "2024-10-01",
      "original_text": "Registerbekanntmachung nach dem Umwandlungsgesetz\nNordrhein-Westfalen Amtsgericht Düsseldorf HRB 76816\nGroupM Competence Center GmbH – Düsseldorf",
      "type": "Registerbekanntmachung nach dem Umwandlungsgesetz",
      "state": "Nordrhein-Westfalen",
      "amtsgericht": "Amtsgericht Düsseldorf",
      "registernummer": "HRB 76816",
      "registerart": "HRB",
      "company_name": "GroupM Competence Center GmbH",
      "company_seat": "Düsseldorf",
      "details": "01.10.2024 (Bekanntmachungsdatum)\n\nNordrhein-Westfalen Amtsgericht Düsseldorf HRB 76816\nRegisterbekanntmachung nach dem Umwandlungsgesetz 01.10.2024 (Eintragungsdatum)\n\nGroupM Competence Center GmbH\nGesellschaft mit beschränkter Haftung\nDüsseldorf\n\nDen Gläubigern der an der Verschmelzung beteiligten Rechtsträger ist, wenn sie binnen sechs Monaten nach dem Tag, an dem die Eintragung der Verschmelzung in das Register des Sitzes desjenigen Rechtsträgers, dessen Gläubiger sie sind, nach § 19 Absatz 3 UmwG als bekanntgemacht gilt, ihren Anspruch nach Grund und Höhe schriftlich anmelden, Sicherheit zu leisten, soweit sie nicht Befriedigung verlangen können. Dieses Recht steht den Gläubigern jedoch nur zu, wenn sie glaubhaft machen, dass durch die Verschmelzung die Erfüllung ihrer Forderung gefährdet wird."
    },
    {
      "date": "2024-10-01",
      "original_text": "Löschungsankündigung\nMecklenburg-Vorpommern Amtsgericht Rostock HRB 13302\nGrundmann & Co. Generalbauübernehmer GmbH – Rostock",
      "type": "Löschungsankündigung",
      "state": "Mecklenburg-Vorpommern",
      "amtsgericht": "Amtsgericht Rostock",
      "registernummer": "HRB 13302",
      "registerart": "HRB",
      "company_name": "Grundmann & Co. Generalbauübernehmer GmbH",
      "company_seat": "Rostock",
      "details": "01.10.2024 (Bekanntmachungsdatum)\n\nMecklenburg-Vorpommern Amtsgericht Rostock HRB 13302\nLöschungsankündigung\n\nGrundmann & Co. Generalbauübernehmer GmbH\nGesellschaft mit beschränkter Haftung\nRostock\n\nDas Registergericht beabsichtigt, die im Handelsregister eingetragene Gesellschaft von Amts wegen nach § 394 FamFG zu löschen. Die Frist zur Erhebung eines Widerspruchs gegen die beabsichtigte Löschung wird auf einen Monat festgesetzt."
    },
    {
      "date": "2024-10-01",
      "original_text": "Registerbekanntmachung nach dem Umwandlungsgesetz\nBaden-Württemberg Amtsgericht Mannheim HRA 521228\nGrötz GmbH & Co. KG – Gaggenau",
      "type": "Registerbekanntmachung nach dem Umwandlungsgesetz",
      "state": "Baden-Württemberg",
      "amtsgericht": "Amtsgericht Mannheim",
      "registernummer": "HRA 521228",
      "registerart": "HRA",
      "company_name": "Grötz GmbH & Co. KG",
      "company_seat": "Gaggenau",
      "details": "01.10.2024 (Bekanntmachungsdatum)\n\nBaden-Württemberg Amtsgericht Mannheim HRA 521228\nRegisterbekanntmachung nach dem Umwandlungsgesetz 01.10.2024 (Eintragungsdatum)\n\nGrötz GmbH & Co. KG\nKommanditgesellschaft\nGaggenau\n\nDen Gläubigern der an der Verschmelzung beteiligten Rechtsträger ist, wenn sie binnen sechs Monaten nach dem Tag, an dem die Eintragung der Verschmelzung in das Register des Sitzes desjenigen Rechtsträgers, dessen Gläubiger sie sind, nach § 19 Abs. 3 UmwG als bekanntgemacht gilt, ihren Anspruch nach Grund und Höhe schriftlich anmelden, Sicherheit zu leisten, soweit sie nicht Befriedigung verlangen können. Dieses Recht steht den Gläubigern jedoch nur zu, wenn sie glaubhaft machen, dass durch die Verschmelzung die Erfüllung ihrer Forderung gefährdet wird."
    },
    {
      "date": "2024-10-01",
      "original_text": "Registerbekanntmachung nach dem Umwandlungsgesetz\nBremen Amtsgericht Bremen HRB 18033\nH. Marahrens Beteiligungen GmbH – Bremen",
      "type": "Registerbekanntmachung nach dem Umwandlungsgesetz",
      "state": "Bremen",
      "amtsgericht": "Amtsgericht Bremen",
      "registernummer": "HRB 18033",
      "registerart": "HRB",
      "company_name": "H. Marahrens Beteiligungen GmbH",
      "company_seat": "Bremen",
      "details": "01.10.2024 (Bekanntmachungsdatum)\n\nBremen Amtsgericht Bremen HRB 18033\nRegisterbekanntmachung nach dem Umwandlungsgesetz 30.09.2024 (Eintragungsdatum)\n\nH. Marahrens Beteiligungen GmbH\nGesellschaft mit beschränkter Haftung\nBremen\n\nZu Eintragungsnummer 6 vom 30.09.2024 wird als nicht eingetragen veröffentlicht:\nDen Gläubigern der an der Ausgliederung beteiligten Rechtsträger ist, wenn sie binnen sechs Monaten nach dem Tag, an dem die Eintragung der Ausgliederung in das Register des Sitzes desjenigen Rechtsträgers, dessen Gläubiger sie sind, als bekannt gemacht gilt, ihren Anspruch nach Grund und Höhe schriftlich anmelden, Sicherheit zu leisten, soweit sie nicht Befriedigung verlangen können. Dieses Recht steht den Gläubigern jedoch nur zu, wenn sie glaubhaft machen, dass durch die Ausgliederung die Erfüllung ihrer Forderung gefährdet wird. Das Recht, Sicherheitsleistung zu verlangen, steht Gläubigern nicht zu, die im Falle der Insolvenz ein Recht auf vorzugsweise Befriedigung aus einer Deckungsmasse haben, die nach gesetzlicher Vorschrift zu ihrem Schutz errichtet und staatlich überwacht ist."
    },
    {
      "date": "2024-10-01",
      "original_text": "Registerbekanntmachung nach dem Umwandlungsgesetz\nBremen Amtsgericht Bremen HRB 40754\nH. Marahrens Schilderwerk GmbH – Bremen",
      "type": "Registerbekanntmachung nach dem Umwandlungsgesetz",
      "state": "Bremen",
      "amtsgericht": "Amtsgericht Bremen",
      "registernummer": "HRB 40754",
      "registerart": "HRB",
      "company_name": "H. Marahrens Schilderwerk GmbH",
      "company_seat": "Bremen",
      "details": "01.10.2024 (Bekanntmachungsdatum)\n\nBremen Amtsgericht Bremen HRB 40754\nRegisterbekanntmachung nach dem Umwandlungsgesetz 30.09.2024 (Eintragungsdatum)\n\nH. Marahrens Schilderwerk GmbH\nGesellschaft mit beschränkter Haftung\nBremen\n\nZu Eintragungsnummer 1 vom 30.09.2024 wird als nicht eingetragen veröffentlicht:\nDen Gläubigern der an der Spaltung beteiligten Rechtsträger ist, wenn sie binnen sechs Monaten nach dem Tag, an dem die Eintragung der Spaltung in das Register des Sitzes desjenigen Rechtsträgers, dessen Gläubiger sie sind, als bekannt gemacht gilt, ihren Anspruch nach Grund und Höhe schriftlich anmelden, Sicherheit zu leisten, soweit sie nicht Befriedigung verlangen können. Dieses Recht steht den Gläubigern jedoch nur zu, wenn sie glaubhaft machen, dass durch die Spaltung die Erfüllung ihrer Forderung gefährdet wird. Das Recht, Sicherheitsleistung zu verlangen, steht Gläubigern nicht zu, die im Falle der Insolvenz ein Recht auf vorzugsweise Befriedigung aus einer Deckungsmasse haben, die nach gesetzlicher Vorschrift zu ihrem Schutz errichtet und staatlich überwacht ist."
    },
    {
      "date": "2024-10-01",
      "original_text": "Registerbekanntmachung nach dem Umwandlungsgesetz\nSchleswig-Holstein Amtsgericht Pinneberg HRA 9748\nHFC Ihre IT-Abteilung. GmbH & Co. KG – Itzehoe",
      "type": "Registerbekanntmachung nach dem Umwandlungsgesetz",
      "state": "Schleswig-Holstein",
      "amtsgericht": "Amtsgericht Pinneberg",
      "registernummer": "HRA 9748",
      "registerart": "HRA",
      "company_name": "HFC Ihre IT-Abteilung. GmbH & Co. KG",
      "company_seat": "Itzehoe",
      "details": "01.10.2024 (Bekanntmachungsdatum)\n\nSchleswig-Holstein Amtsgericht Pinneberg HRA 9748\nRegisterbekanntmachung nach dem Umwandlungsgesetz 17.09.2024 (Eintragungsdatum)\n\nHFC Ihre IT-Abteilung. GmbH & Co. KG\nKommanditgesellschaft\nItzehoe\n\nAls nicht eingetragen wird veröffentlicht: Den Gläubigern der an der Spaltung beteiligten Rechtsträger ist, wenn sie binnen sechs Monaten nach dem Tag, an dem die Eintragung der Spaltung in das Register des Sitzes desjenigen Rechtsträgers, dessen Gläubiger sie sind, als bekannt gemacht gilt, ihren Anspruch nach Grund und Höhe schriftlich anmelden, Sicherheit zu leisten, soweit sie nicht Befriedigung verlangen können. Dieses Recht steht den Gläubigern jedoch nur zu, wenn sie glaubhaft machen, dass durch die Spaltung die Erfüllung ihrer Forderung gefährdet wird. Das Recht, Sicherheitsleistung zu verlangen, steht Gläubigern nicht zu, die im Falle der Insolvenz ein Recht auf vorzugsweise Befriedigung aus einer Deckungsmasse haben, die nach gesetzlicher Vorschrift zu ihrem Schutz errichtet und staatlich überwacht ist."
    },
    {
      "date": "2024-10-01",
      "original_text": "Löschungsankündigung\nHessen Amtsgericht Offenbach am Main HRB 52533\nHPK International UG (haftungsbeschränkt) – Dietzenbach",
      "type": "Löschungsankündigung",
      "state": "Hessen",
      "amtsgericht": "Amtsgericht Offenbach am Main",
      "registernummer": "HRB 52533",
      "registerart": "HRB",
      "company_name": "HPK International UG (haftungsbeschränkt)",
      "company_seat": "Dietzenbach",
      "details": "01.10.2024 (Bekanntmachungsdatum)\n\nHessen Amtsgericht Offenbach am Main HRB 52533\nLöschungsankündigung\n\nHPK International UG (haftungsbeschränkt)\nGesellschaft mit beschränkter Haftung\nDietzenbach\n\nDas Registergericht beabsichtigt die im Handelsregister eingetragene Gesellschaft von Amts wegen nach § 394 FamFG zu löschen. Die Frist zur Erhebung eines Widerspruchs gegen die beabsichtigte Löschung wird auf 3 Monate festgesetzt."
    },
    {
      "date": "2024-10-01",
      "original_text": "Registerbekanntmachung nach dem Umwandlungsgesetz\nNordrhein-Westfalen Amtsgericht Gelsenkirchen HRA 3399\nHaus Management Christine Schmitz e.K. – Marl",
      "type": "Registerbekanntmachung nach dem Umwandlungsgesetz",
      "state": "Nordrhein-Westfalen",
      "amtsgericht": "Amtsgericht Gelsenkirchen",
      "registernummer": "HRA 3399",
      "registerart": "HRA",
      "company_name": "Haus Management Christine Schmitz e.K.",
      "company_seat": "Marl",
      "details": "01.10.2024 (Bekanntmachungsdatum)\n\nNordrhein-Westfalen Amtsgericht Gelsenkirchen HRA 3399\nRegisterbekanntmachung nach dem Umwandlungsgesetz 01.10.2024 (Eintragungsdatum)\n\nHaus Management Christine Schmitz e.K.\nEinzelkaufmann / Einzelkauffrau\nMarl\n\nDen Gläubigern der an der Ausgliederung beteiligten Rechtsträger ist, wenn sie binnen sechs Monaten nach dem Tag, an dem die Eintragung der Ausgliederung in das Register des Sitzes desjenigen Rechtsträgers, dessen Gläubiger sie sind, nach § 19 Absatz 3 UmwG als bekanntgemacht gilt, ihren Anspruch nach Grund und Höhe schriftlich anmelden, Sicherheit zu leisten, soweit sie nicht Befriedigung verlangen können. Dieses Recht steht den Gläubigern jedoch nur zu, wenn sie glaubhaft machen, dass durch die Ausgliederung die Erfüllung ihrer Forderung gefährdet wird."
    },
    {
      "date": "2024-10-01",
      "original_text": "Registerbekanntmachung nach dem Umwandlungsgesetz\nHamburg Amtsgericht Hamburg HRB 177587\nHogarth Worldwide GmbH – Hamburg",
      "type": "Registerbekanntmachung nach dem Umwandlungsgesetz",
      "state": "Hamburg",
      "amtsgericht": "Amtsgericht Hamburg",
      "registernummer": "HRB 177587",
      "registerart": "HRB",
      "company_name": "Hogarth Worldwide GmbH",
      "company_seat": "Hamburg",
      "details": "01.10.2024 (Bekanntmachungsdatum)\n\nHamburg Amtsgericht Hamburg HRB 177587\nRegisterbekanntmachung nach dem Umwandlungsgesetz 01.10.2024 (Eintragungsdatum)\n\nHogarth Worldwide GmbH\nGesellschaft mit beschränkter Haftung\nHamburg\n\nAls nicht eingetragen wird bekannt gemacht:\nDen Gläubigern der an der Verschmelzung beteiligten Gesellschaften ist, wenn sie binnen sechs Monaten nach dem Tag, an dem die Eintragung der Verschmelzung in das Register des Sitzes desjenigen Rechtsträgers, dessen Gläubiger sie sind, nach § 19 Absatz 3 UmwG als bekannt gemacht gilt, ihren Anspruch nach Grund und Höhe schriftlich anmelden, Sicherheit zu leisten, soweit sie nicht Befriedigung verlangen können. Dieses Recht steht den Gläubigern jedoch nur zu, wenn sie glaubhaft machen, dass durch die Verschmelzung die Erfüllung ihrer Forderung gefährdet wird."
    },
    {
      "date": "2024-10-01",
      "original_text": "Registerbekanntmachung nach dem Umwandlungsgesetz\nNordrhein-Westfalen Amtsgericht Siegen HRB 1499\nHomuth Industrial Ctrl GmbH – Siegen",
      "type": "Registerbekanntmachung nach dem Umwandlungsgesetz",
      "state": "Nordrhein-Westfalen",
      "amtsgericht": "Amtsgericht Siegen",
      "registernummer": "HRB 1499",
      "registerart": "HRB",
      "company_name": "Homuth Industrial Ctrl GmbH",
      "company_seat": "Siegen",
      "details": "01.10.2024 (Bekanntmachungsdatum)\n\nNordrhein-Westfalen Amtsgericht Siegen HRB 1499\nRegisterbekanntmachung nach dem Umwandlungsgesetz 01.10.2024 (Eintragungsdatum)\n\nHomuth Industrial Ctrl GmbH\nGesellschaft mit beschränkter Haftung\nSiegen\n\nDen Gläubigern der an der Ausgliederung beteiligten Rechtsträger ist, wenn sie binnen sechs Monaten nach dem Tag, an dem die Eintragung der Ausgliederung in das Register des Sitzes desjenigen Rechtsträgers, dessen Gläubiger sie sind, nach § 19 Absatz 3 UmwG als bekanntgemacht gilt, ihren Anspruch nach Grund und Höhe schriftlich anmelden, Sicherheit zu leisten, soweit sie nicht Befriedigung verlangen können. Dieses Recht steht den Gläubigern jedoch nur zu, wenn sie glaubhaft machen, dass durch die Ausgliederung die Erfüllung ihrer Forderung gefährdet wird."
    },
    {
      "date": "2024-10-01",
      "original_text": "Registerbekanntmachung nach dem Umwandlungsgesetz\nBayern Amtsgericht Passau HRA 13899\nHotel Gasthof Johann Kreuzhuber e.K. – Neuburg am Inn",
      "type": "Registerbekanntmachung nach dem Umwandlungsgesetz",
      "state": "Bayern",
      "amtsgericht": "Amtsgericht Passau",
      "registernummer": "HRA 13899",
      "registerart": "HRA",
      "company_name": "Hotel Gasthof Johann Kreuzhuber e.K.",
      "company_seat": "Neuburg am Inn",
      "details": "01.10.2024 (Bekanntmachungsdatum)\n\nBayern Amtsgericht Passau HRA 13899\nRegisterbekanntmachung nach dem Umwandlungsgesetz 30.09.2024 (Eintragungsdatum)\n\nHotel Gasthof Johann Kreuzhuber e.K.\nEinzelkaufmann / Einzelkauffrau\nNeuburg am Inn\n\nDen Gläubigern der an der Ausgliederung beteiligten Rechtsträger ist, wenn sie binnen sechs Monaten nach dem Tag, an dem die Eintragung der Ausgliederung in das Register des Sitzes desjenigen Rechtsträgers, dessen Gläubiger sie sind, nach §§ 125, 19 Abs. 3 UmwG als bekannt gemacht gilt, ihren Anspruch nach Grund und Höhe schriftlich anmelden, Sicherheit zu leisten, soweit sie nicht Befriedigung verlangen können. Dieses Recht steht den Gläubigern jedoch nur zu, wenn sie glaubhaft machen, dass durch die Ausgliederung die Erfüllung ihrer Forderung gefährdet wird."
    },
    {
      "date": "2024-10-01",
      "original_text": "Registerbekanntmachung nach dem Umwandlungsgesetz\nBayern Amtsgericht Passau HRA 13903\nHotel Gasthof Kreuzhuber GmbH & Co. KG – Neuburg am Inn",
      "type": "Registerbekanntmachung nach dem Umwandlungsgesetz",
      "state": "Bayern",
      "amtsgericht": "Amtsgericht Passau",
      "registernummer": "HRA 13903",
      "registerart": "HRA",
      "company_name": "Hotel Gasthof Kreuzhuber GmbH & Co. KG",
      "company_seat": "Neuburg am Inn",
      "details": "01.10.2024 (Bekanntmachungsdatum)\n\nBayern Amtsgericht Passau HRA 13903\nRegisterbekanntmachung nach dem Umwandlungsgesetz 30.09.2024 (Eintragungsdatum)\n\nHotel Gasthof Kreuzhuber GmbH & Co. KG\nKommanditgesellschaft\nNeuburg am Inn\n\nDen Gläubigern der an der Ausgliederung beteiligten Rechtsträger ist, wenn sie binnen sechs Monaten nach dem Tag, an dem die Eintragung der Ausgliederung in das Register des Sitzes desjenigen Rechtsträgers, dessen Gläubiger sie sind, nach §§ 125, 19 Abs. 3 UmwG als bekannt gemacht gilt, ihren Anspruch nach Grund und Höhe schriftlich anmelden, Sicherheit zu leisten, soweit sie nicht Befriedigung verlangen können. Dieses Recht steht den Gläubigern jedoch nur zu, wenn sie glaubhaft machen, dass durch die Ausgliederung die Erfüllung ihrer Forderung gefährdet wird."
    },
    {
      "date": "2024-10-01",
      "original_text": "Registerbekanntmachung nach dem Umwandlungsgesetz\nNordrhein-Westfalen Amtsgericht Gelsenkirchen HRB 18384\nHsM Haus Management GmbH – Marl",
      "type": "Registerbekanntmachung nach dem Umwandlungsgesetz",
      "state": "Nordrhein-Westfalen",
      "amtsgericht": "Amtsgericht Gelsenkirchen",
      "registernummer": "HRB 18384",
      "registerart": "HRB",
      "company_name": "HsM Haus Management GmbH",
      "company_seat": "Marl",
      "details": "01.10.2024 (Bekanntmachungsdatum)\n\nNordrhein-Westfalen Amtsgericht Gelsenkirchen HRB 18384\nRegisterbekanntmachung nach dem Umwandlungsgesetz 01.10.2024 (Eintragungsdatum)\n\nHsM Haus Management GmbH\nGesellschaft mit beschränkter Haftung\nMarl\n\nDen Gläubigern der an der Ausgliederung beteiligten Rechtsträger ist, wenn sie binnen sechs Monaten nach dem Tag, an dem die Eintragung der Ausgliederung in das Register des Sitzes desjenigen Rechtsträgers, dessen Gläubiger sie sind, nach § 19 Absatz 3 UmwG als bekanntgemacht gilt, ihren Anspruch nach Grund und Höhe schriftlich anmelden, Sicherheit zu leisten, soweit sie nicht Befriedigung verlangen können. Dieses Recht steht den Gläubigern jedoch nur zu, wenn sie glaubhaft machen, dass durch die Ausgliederung die Erfüllung ihrer Forderung gefährdet wird."
    },
    {
      "date": "2024-10-01",
      "original_text": "Registerbekanntmachung nach dem Umwandlungsgesetz\nSachsen Amtsgericht Chemnitz HRA 9942\nHygieneservice Voigt GmbH & Co. KG – Schwarzenberg/Erzgeb.",
      "type": "Registerbekanntmachung nach dem Umwandlungsgesetz",
      "state": "Sachsen",
      "amtsgericht": "Amtsgericht Chemnitz",
      "registernummer": "HRA 9942",
      "registerart": "HRA",
      "company_name": "Hygieneservice Voigt GmbH & Co. KG",
      "company_seat": "Schwarzenberg/Erzgeb.",
      "details": "01.10.2024 (Bekanntmachungsdatum)\n\nSachsen Amtsgericht Chemnitz HRA 9942\nRegisterbekanntmachung nach dem Umwandlungsgesetz 01.10.2024 (Eintragungsdatum)\n\nHygieneservice Voigt GmbH & Co. KG\nKommanditgesellschaft\nSchwarzenberg/Erzgeb.\n\nDen Gläubigern der an der Ausgliederung beteiligten Rechtsträger ist, wenn sie binnen sechs Monaten nach dem Tag, an dem die Eintragung der Ausgliederung in das Register des Sitzes desjenigen Rechtsträgers, dessen Gläubiger sie sind, nach § 19 Abs. 3 UmwG als bekannt gemacht gilt, ihren Anspruch nach Grund und Höhe schriftlich anmelden, Sicherheit zu leisten, soweit sie nicht Befriedigung verlangen können. Dieses Recht steht den Gläubigern jedoch nur zu, wenn sie glaubhaft machen, dass durch die Ausgliederung die Erfüllung der Forderung gefährdet wird."
    },
    {
      "date": "2024-10-01",
      "original_text": "Registerbekanntmachung nach dem Umwandlungsgesetz\nBaden-Württemberg Amtsgericht Freiburg HRB 731276\nHübschle Hairartist GmbH – Stockach",
      "type": "Registerbekanntmachung nach dem Umwandlungsgesetz",
      "state": "Baden-Württemberg",
      "amtsgericht": "Amtsgericht Freiburg",
      "registernummer": "HRB 731276",
      "registerart": "HRB",
      "company_name": "Hübschle Hairartist GmbH",
      "company_seat": "Stockach",
      "details": "01.10.2024 (Bekanntmachungsdatum)\n\nBaden-Württemberg Amtsgericht Freiburg HRB 731276\nRegisterbekanntmachung nach dem Umwandlungsgesetz 01.10.2024 (Eintragungsdatum)\n\nHübschle Hairartist GmbH\nGesellschaft mit beschränkter Haftung\nStockach\n\nDen Gläubigern der an der Ausgliederung beteiligten Rechtsträger ist, wenn sie binnen sechs Monaten nach dem Tag, an dem die Eintragung der Ausgliederung in das Register des Sitzes desjenigen Rechtsträgers, dessen Gläubiger sie sind, nach § 19 Abs. 3 UmwG als bekanntgemacht gilt, ihren Anspruch nach Grund und Höhe schriftlich anmelden, Sicherheit zu leisten, soweit sie nicht Befriedigung verlangen können. Dieses Recht steht den Gläubigern jedoch nur zu, wenn sie glaubhaft machen, dass durch die Ausgliederung die Erfüllung ihrer Forderung gefährdet wird."
    },
    {
      "date": "2024-10-01",
      "original_text": "Löschungsankündigung\nHessen Amtsgericht Frankfurt am Main HRB 122953\nIBS UG (haftungsbeschränkt) – Eschborn",
      "type": "Löschungsankündigung",
      "state": "Hessen",
      "amtsgericht": "Amtsgericht Frankfurt am Main",
      "registernummer": "HRB 122953",
      "registerart": "HRB",
      "company_name": "IBS UG (haftungsbeschränkt)",
      "company_seat": "Eschborn",
      "details": "01.10.2024 (Bekanntmachungsdatum)\n\nHessen Amtsgericht Frankfurt am Main HRB 122953\nLöschungsankündigung\n\nIBS UG (haftungsbeschränkt)\nGesellschaft mit beschränkter Haftung\nEschborn\n\nEs ist beabsichtigt, die Gesellschaft wegen Vermögenslosigkeit gemäß § 394 FamFG von Amts wegen im Handelsregister zu löschen. Hiergegen kann innerhalb eines Monats nach dieser Veröffentlichung Widerspruch bei dem Amtsgericht Frankfurt am Main eingelegt werden."
    },
    {
      "date": "2024-10-01",
      "original_text": "Registerbekanntmachung nach dem Umwandlungsgesetz\nSchleswig-Holstein Amtsgericht Lübeck HRB 14685\nImmobilien-Service-Objektbetreuungs-GmbH-Ostholstein – Scharbeutz OT Pönitz",
      "type": "Registerbekanntmachung nach dem Umwandlungsgesetz",
      "state": "Schleswig-Holstein",
      "amtsgericht": "Amtsgericht Lübeck",
      "registernummer": "HRB 14685",
      "registerart": "HRB",
      "company_name": "Immobilien-Service-Objektbetreuungs-GmbH-Ostholstein",
      "company_seat": "Scharbeutz OT Pönitz",
      "details": "01.10.2024 (Bekanntmachungsdatum)\n\nSchleswig-Holstein Amtsgericht Lübeck HRB 14685\nRegisterbekanntmachung nach dem Umwandlungsgesetz 30.09.2024 (Eintragungsdatum)\n\nImmobilien-Service-Objektbetreuungs-GmbH-Ostholstein\nGesellschaft mit beschränkter Haftung\nScharbeutz OT Pönitz\n\nZu Eintragungsnummer 3 vom 30.09.2024 wird als nicht eingetragen veröffentlicht: Den Gläubigern der an der Verschmelzung beteiligten Rechtsträger ist, wenn sie binnen sechs Monaten nach dem Tag, an dem die Eintragung der Verschmelzung in das Register des Sitzes desjenigen Rechtsträgers, dessen Gläubiger sie sind, als bekannt gemacht gilt, ihren Anspruch nach Grund und Höhe schriftlich anmelden, Sicherheit zu leisten, soweit sie nicht Befriedigung verlangen können. Dieses Recht steht den Gläubigern jedoch nur zu, wenn sie glaubhaft machen, dass durch die Verschmelzung die Erfüllung ihrer Forderung gefährdet wird."
    },
    {
      "date": "2024-10-01",
      "original_text": "Löschungsankündigung\nMecklenburg-Vorpommern Amtsgericht Rostock HRB 8127\nImo Plan Contract Gesellschaft für Projektentwicklung und Baubetreuung mbH – Rostock",
      "type": "Löschungsankündigung",
      "state": "Mecklenburg-Vorpommern",
      "amtsgericht": "Amtsgericht Rostock",
      "registernummer": "HRB 8127",
      "registerart": "HRB",
      "company_name": "Imo Plan Contract Gesellschaft für Projektentwicklung und Baubetreuung mbH",
      "company_seat": "Rostock",
      "details": "01.10.2024 (Bekanntmachungsdatum)\n\nMecklenburg-Vorpommern Amtsgericht Rostock HRB 8127\nLöschungsankündigung\n\nImo Plan Contract Gesellschaft für Projektentwicklung und Baubetreuung mbH\nGesellschaft mit beschränkter Haftung\nRostock\n\nDas Registergericht beabsichtigt, die im Handelsregister eingetragene Gesellschaft von Amts wegen nach § 394 FamFG zu löschen. Die Frist zur Erhebung eines Widerspruchs gegen die beabsichtigte Löschung wird auf einen Monat festgesetzt."
    },
    {
      "date": "2024-10-01",
      "original_text": "Registerbekanntmachung nach dem Umwandlungsgesetz\nBayern Amtsgericht Fürth HRB 12335\nIndividual Solutions GmbH – Erlangen",
      "type": "Registerbekanntmachung nach dem Umwandlungsgesetz",
      "state": "Bayern",
      "amtsgericht": "Amtsgericht Fürth",
      "registernummer": "HRB 12335",
      "registerart": "HRB",
      "company_name": "Individual Solutions GmbH",
      "company_seat": "Erlangen",
      "details": "01.10.2024 (Bekanntmachungsdatum)\n\nBayern Amtsgericht Fürth HRB 12335\nRegisterbekanntmachung nach dem Umwandlungsgesetz 27.09.2024 (Eintragungsdatum)\n\nIndividual Solutions GmbH\nGesellschaft mit beschränkter Haftung\nErlangen\n\nDen Gläubigern der an der Verschmelzung beteiligten Rechtsträger ist, wenn sie binnen sechs Monaten nach dem Tag, an dem die Eintragung der Verschmelzung in das Register des Sitzes desjenigen Rechtsträgers, dessen Gläubiger sie sind, nach § 19 Abs. 3 UmwG als bekannt gemacht gilt, ihren Anspruch nach Grund und Höhe schriftlich anmelden, Sicherheit zu leisten, soweit sie nicht Befriedigung verlangen können. Dieses Recht steht den Gläubigern jedoch nur zu, wenn sie glaubhaft machen, dass durch die Verschmelzung die Erfüllung ihrer Forderung gefährdet wird."
    },
    {
      "date": "2024-10-01",
      "original_text": "Registerbekanntmachung nach dem Umwandlungsgesetz\nNordrhein-Westfalen Amtsgericht Siegen HRB 14007\nIndustrie-Elektrik Homuth Betriebsgesellschaft mbH – Siegen",
      "type": "Registerbekanntmachung nach dem Umwandlungsgesetz",
      "state": "Nordrhein-Westfalen",
      "amtsgericht": "Amtsgericht Siegen",
      "registernummer": "HRB 14007",
      "registerart": "HRB",
      "company_name": "Industrie-Elektrik Homuth Betriebsgesellschaft mbH",
      "company_seat": "Siegen",
      "details": "01.10.2024 (Bekanntmachungsdatum)\n\nNordrhein-Westfalen Amtsgericht Siegen HRB 14007\nRegisterbekanntmachung nach dem Umwandlungsgesetz 01.10.2024 (Eintragungsdatum)\n\nIndustrie-Elektrik Homuth Betriebsgesellschaft mbH\nGesellschaft mit beschränkter Haftung\nSiegen\n\nDen Gläubigern der an der Ausgliederung beteiligten Rechtsträger ist, wenn sie binnen sechs Monaten nach dem Tag, an dem die Eintragung der Ausgliederung in das Register des Sitzes desjenigen Rechtsträgers, dessen Gläubiger sie sind, nach § 19 Absatz 3 UmwG als bekanntgemacht gilt, ihren Anspruch nach Grund und Höhe schriftlich anmelden, Sicherheit zu leisten, soweit sie nicht Befriedigung verlangen können. Dieses Recht steht den Gläubigern jedoch nur zu, wenn sie glaubhaft machen, dass durch die Ausgliederung die Erfüllung ihrer Forderung gefährdet wird."
    },
    {
      "date": "2024-10-01",
      "original_text": "Registerbekanntmachung nach dem Umwandlungsgesetz\nBayern Amtsgericht München HRB 190996\nInfinigate Deutschland GmbH – Haar",
      "type": "Registerbekanntmachung nach dem Umwandlungsgesetz",
      "state": "Bayern",
      "amtsgericht": "Amtsgericht München",
      "registernummer": "HRB 190996",
      "registerart": "HRB",
      "company_name": "Infinigate Deutschland GmbH",
      "company_seat": "Haar",
      "details": "01.10.2024 (Bekanntmachungsdatum)\n\nBayern Amtsgericht München HRB 190996\nRegisterbekanntmachung nach dem Umwandlungsgesetz 30.09.2024 (Eintragungsdatum)\n\nInfinigate Deutschland GmbH\nGesellschaft mit beschränkter Haftung\nHaar\n\nDen Gläubigern der an der Verschmelzung beteiligten Rechtsträger ist, wenn sie binnen sechs Monaten nach dem Tag, an dem die Eintragung der Verschmelzung in das Register des Sitzes desjenigen Rechtsträgers, dessen Gläubiger sie sind, nach § 19 Abs. 3 UmwG als bekannt gemacht gilt, ihren Anspruch nach Grund und Höhe schriftlich anmelden, Sicherheit zu leisten, soweit sie nicht Befriedigung verlangen können. Dieses Recht steht den Gläubigern jedoch nur zu, wenn sie glaubhaft machen, dass durch die Verschmelzung die Erfüllung ihrer Forderung gefährdet wird."
    },
    {
      "date": "2024-10-01",
      "original_text": "Registerbekanntmachung nach dem Umwandlungsgesetz\nBaden-Württemberg Amtsgericht Stuttgart HRB 783567\nInfratech/comcross Holding GmbH – Leonberg",
      "type": "Registerbekanntmachung nach dem Umwandlungsgesetz",
      "state": "Baden-Württemberg",
      "amtsgericht": "Amtsgericht Stuttgart",
      "registernummer": "HRB 783567",
      "registerart": "HRB",
      "company_name": "Infratech/comcross Holding GmbH",
      "company_seat": "Leonberg",
      "details": "01.10.2024 (Bekanntmachungsdatum)\n\nBaden-Württemberg Amtsgericht Stuttgart HRB 783567\nRegisterbekanntmachung nach dem Umwandlungsgesetz 01.10.2024 (Eintragungsdatum)\n\nInfratech/comcross Holding GmbH\nGesellschaft mit beschränkter Haftung\nLeonberg\n\nAls nicht eingetragen wird bekanntgemacht:\nDen Gläubigern der an der Verschmelzung beteiligten Rechtsträger ist, wenn sie binnen sechs Monaten nach dem Tag, an dem die Eintragung der Verschmelzung in das Register des Sitzes desjenigen Rechtsträgers, dessen Gläubiger sie sind, nach § 19 Abs. 3 UmwG als bekanntgemacht gilt, ihren Anspruch nach Grund und Höhe schriftlich anmelden, Sicherheit zu leisten, soweit sie nicht Befriedigung verlangen können. Dieses Recht steht den Gläubigern jedoch nur zu, wenn sie glaubhaft machen, dass durch die Verschmelzung die Erfüllung ihrer Forderung gefährdet wird."
    },
    {
      "date": "2024-10-01",
      "original_text": "Registerbekanntmachung nach dem Umwandlungsgesetz\nNordrhein-Westfalen Amtsgericht Essen HRA 11834\nIngenieurgesellschaft Dornemann & TGA-Essen GmbH & Co. KG – Essen",
      "type": "Registerbekanntmachung nach dem Umwandlungsgesetz",
      "state": "Nordrhein-Westfalen",
      "amtsgericht": "Amtsgericht Essen",
      "registernummer": "HRA 11834",
      "registerart": "HRA",
      "company_name": "Ingenieurgesellschaft Dornemann & TGA-Essen GmbH & Co. KG",
      "company_seat": "Essen",
      "details": "01.10.2024 (Bekanntmachungsdatum)\n\nNordrhein-Westfalen Amtsgericht Essen HRA 11834\nRegisterbekanntmachung nach dem Umwandlungsgesetz 01.10.2024 (Eintragungsdatum)\n\nIngenieurgesellschaft Dornemann & TGA-Essen GmbH & Co. KG\nKommanditgesellschaft\nEssen\n\nAls nicht eingetragen wird bekannt gemacht: Den Gläubigern der an der Ausgliederung beteiligten Gesellschaften ist, wenn sie binnen sechs Monaten nach dem Tag, an dem die Eintragung der Ausgliederung in das Register des Sitzes desjenigen Rechtsträgers, dessen Gläubiger sie sind, nach § 19 Absatz 3 UmwG als bekanntgemacht gilt, ihren Anspruch nach Grund und Höhe schriftlich anmelden, Sicherheit zu leisten, soweit sie nicht Befriedigung verlangen können. Dieses Recht steht den Gläubigern jedoch nur zu, wenn sie glaubhaft machen, dass durch die Ausgliederung die Erfüllung ihrer Forderung gefährdet wird."
    },
    {
      "date": "2024-10-01",
      "original_text": "Einreichung neuer Dokumente\nBaden-Württemberg Amtsgericht Ulm HRB 737231\nJ.M. Voith Management SE – Heidenheim an der Brenz",
      "type": "Einreichung neuer Dokumente",
      "state": "Baden-Württemberg",
      "amtsgericht": "Amtsgericht Ulm",
      "registernummer": "HRB 737231",
      "registerart": "HRB",
      "company_name": "J.M. Voith Management SE",
      "company_seat": "Heidenheim an der Brenz",
      "details": "01.10.2024 (Bekanntmachungsdatum)\n\nBaden-Württemberg Amtsgericht Ulm HRB 737231\nEinreichung neuer Dokumente\n\nJ.M. Voith Management SE\nEuropäische Aktiengesellschaft (SE)\nHeidenheim an der Brenz\n\nDie Gesellschaft hat am 30.09.2024 die Liste über die Zusammensetzung des Aufsichtsrats zum Handelsregister eingereicht."
    },
    {
      "date": "2024-10-01",
      "original_text": "Einreichung neuer Dokumente\nBremen Amtsgericht Bremen HRB 30464\nJACOBS DOUWE EGBERTS DE GmbH – Bremen",
      "type": "Einreichung neuer Dokumente",
      "state": "Bremen",
      "amtsgericht": "Amtsgericht Bremen",
      "registernummer": "HRB 30464",
      "registerart": "HRB",
      "company_name": "JACOBS DOUWE EGBERTS DE GmbH",
      "company_seat": "Bremen",
      "details": "01.10.2024 (Bekanntmachungsdatum)\n\nBremen Amtsgericht Bremen HRB 30464\nEinreichung neuer Dokumente\n\nJACOBS DOUWE EGBERTS DE GmbH\nGesellschaft mit beschränkter Haftung\nBremen\n\nAls nicht eingetragen wird veröffentlicht: Liste des Aufsichtsrats wurde eingereicht."
    },
    {
      "date": "2024-10-01",
      "original_text": "Registerbekanntmachung nach dem Umwandlungsgesetz\nNordrhein-Westfalen Amtsgericht Steinfurt HRB 12245\nJJ CAD-Design GmbH – Greven",
      "type": "Registerbekanntmachung nach dem Umwandlungsgesetz",
      "state": "Nordrhein-Westfalen",
      "amtsgericht": "Amtsgericht Steinfurt",
      "registernummer": "HRB 12245",
      "registerart": "HRB",
      "company_name": "JJ CAD-Design GmbH",
      "company_seat": "Greven",
      "details": "01.10.2024 (Bekanntmachungsdatum)\n\nNordrhein-Westfalen Amtsgericht Steinfurt HRB 12245\nRegisterbekanntmachung nach dem Umwandlungsgesetz 01.10.2024 (Eintragungsdatum)\n\nJJ CAD-Design GmbH\nGesellschaft mit beschränkter Haftung\nGreven\n\nDen Gläubigern der an der Verschmelzung beteiligten Rechtsträger ist, wenn sie binnen sechs Monaten nach dem Tag, an dem die Eintragung der Verschmelzung in das Register des Sitzes desjenigen Rechtsträgers, dessen Gläubiger sie sind, nach § 19 Absatz 3 UmwG als bekanntgemacht gilt, ihren Anspruch nach Grund und Höhe schriftlich anmelden, Sicherheit zu leisten, soweit sie nicht Befriedigung verlangen können. Dieses Recht steht den Gläubigern jedoch nur zu, wenn sie glaubhaft machen, dass durch die Verschmelzung die Erfüllung ihrer Forderung gefährdet wird."
    },
    {
      "date": "2024-10-01",
      "original_text": "Löschungsankündigung\nHessen Amtsgericht Offenbach am Main HRB 46443\nJade Hoch- und Tiefbau GmbH – Offenbach am Main",
      "type": "Löschungsankündigung",
      "state": "Hessen",
      "amtsgericht": "Amtsgericht Offenbach am Main",
      "registernummer": "HRB 46443",
      "registerart": "HRB",
      "company_name": "Jade Hoch- und Tiefbau GmbH",
      "company_seat": "Offenbach am Main",
      "details": "01.10.2024 (Bekanntmachungsdatum)\n\nHessen Amtsgericht Offenbach am Main HRB 46443\nLöschungsankündigung\n\nJade Hoch- und Tiefbau GmbH\nGesellschaft mit beschränkter Haftung\nOffenbach am Main\n\nDas Registergericht beabsichtigt die im Handelsregister eingetragene Gesellschaft von Amts wegen nach § 394 FamFG zu löschen. Die Frist zur Erhebung eines Widerspruchs gegen die beabsichtigte Löschung wird auf 3 Monate festgesetzt."
    },
    {
      "date": "2024-10-01",
      "original_text": "Registerbekanntmachung nach dem Umwandlungsgesetz\nNordrhein-Westfalen Amtsgericht Paderborn HRA 8740\nJan Müller Management e. K. – Paderborn",
      "type": "Registerbekanntmachung nach dem Umwandlungsgesetz",
      "state": "Nordrhein-Westfalen",
      "amtsgericht": "Amtsgericht Paderborn",
      "registernummer": "HRA 8740",
      "registerart": "HRA",
      "company_name": "Jan Müller Management e. K.",
      "company_seat": "Paderborn",
      "details": "01.10.2024 (Bekanntmachungsdatum)\n\nNordrhein-Westfalen Amtsgericht Paderborn HRA 8740\nRegisterbekanntmachung nach dem Umwandlungsgesetz 01.10.2024 (Eintragungsdatum)\n\nJan Müller Management e. K.\nEinzelkaufmann / Einzelkauffrau\nPaderborn\n\nDen Gläubigern der an der Verschmelzung beteiligten Rechtsträger ist, wenn sie binnen sechs Monaten nach dem Tag, an dem die Eintragung der Verschmelzung in das Register des Sitzes desjenigen Rechtsträgers, dessen Gläubiger sie sind, nach § 19 Absatz 3 UmwG als bekanntgemacht gilt, ihren Anspruch nach Grund und Höhe schriftlich anmelden, Sicherheit zu leisten, soweit sie nicht Befriedigung verlangen können. Dieses Recht steht den Gläubigern jedoch nur zu, wenn sie glaubhaft machen, dass durch die Verschmelzung die Erfüllung ihrer Forderung gefährdet wird."
    },
    {
      "date": "2024-10-01",
      "original_text": "Registerbekanntmachung nach dem Umwandlungsgesetz\nNiedersachsen Amtsgericht Osnabrück HRB 19222\nJens Bormann und Karsten Wulf Capital Management GmbH – Osnabrück",
      "type": "Registerbekanntmachung nach dem Umwandlungsgesetz",
      "state": "Niedersachsen",
      "amtsgericht": "Amtsgericht Osnabrück",
      "registernummer": "HRB 19222",
      "registerart": "HRB",
      "company_name": "Jens Bormann und Karsten Wulf Capital Management GmbH",
      "company_seat": "Osnabrück",
      "details": "01.10.2024 (Bekanntmachungsdatum)\n\nNiedersachsen Amtsgericht Osnabrück HRB 19222\nRegisterbekanntmachung nach dem Umwandlungsgesetz 01.10.2024 (Eintragungsdatum)\n\nJens Bormann und Karsten Wulf Capital Management GmbH\nGesellschaft mit beschränkter Haftung\nOsnabrück\n\nDen Gläubigern der an der Verschmelzung beteiligten Rechtsträger ist, wenn sie binnen sechs Monaten nach dem Tag, an dem die Eintragung der Verschmelzung in das Register des Sitzes desjenigen Rechtsträgers, dessen Gläubiger sie sind, nach § 19  Abs.  3 UmwG als bekannt gemacht gilt, ihren Anspruch nach Grund und Höhe schriftlich anmelden, Sicherheit zu leisten, soweit sie nicht Befriedigung verlangen können. Dieses Recht steht den Gläubigern jedoch nur zu, wenn sie glaubhaft machen, dass durch die Verschmelzung die Erfüllung der Forderung gefährdet wird."
    },
    {
      "date": "2024-10-01",
      "original_text": "Löschungsankündigung\nNordrhein-Westfalen Amtsgericht Krefeld HRB 16899\nJewe GmbH – Krefeld",
      "type": "Löschungsankündigung",
      "state": "Nordrhein-Westfalen",
      "amtsgericht": "Amtsgericht Krefeld",
      "registernummer": "HRB 16899",
      "registerart": "HRB",
      "company_name": "Jewe GmbH",
      "company_seat": "Krefeld",
      "details": "01.10.2024 (Bekanntmachungsdatum)\n\nNordrhein-Westfalen Amtsgericht Krefeld HRB 16899\nLöschungsankündigung\n\nJewe GmbH\nGesellschaft mit beschränkter Haftung\nKrefeld\n\nDas Registergericht beabsichtigt die Gesellschaft von Amts wegen nach § 394 FamFG zu löschen. Die Frist zur Erhebung eines Widerspruchs ist auf einen Monat festgesetzt."
    },
    {
      "date": "2024-10-01",
      "original_text": "Registerbekanntmachung nach dem Umwandlungsgesetz\nBaden-Württemberg Amtsgericht Freiburg HRB 261112\nKLB Kuri Verwaltungs- und Beteiligungs GmbH – Teningen",
      "type": "Registerbekanntmachung nach dem Umwandlungsgesetz",
      "state": "Baden-Württemberg",
      "amtsgericht": "Amtsgericht Freiburg",
      "registernummer": "HRB 261112",
      "registerart": "HRB",
      "company_name": "KLB Kuri Verwaltungs- und Beteiligungs GmbH",
      "company_seat": "Teningen",
      "details": "01.10.2024 (Bekanntmachungsdatum)\n\nBaden-Württemberg Amtsgericht Freiburg HRB 261112\nRegisterbekanntmachung nach dem Umwandlungsgesetz 01.10.2024 (Eintragungsdatum)\n\nKLB Kuri Verwaltungs- und Beteiligungs GmbH\nGesellschaft mit beschränkter Haftung\nTeningen\n\nAls nicht eingetragen wird bekanntgemacht:\nDen Gläubigern der an der Verschmelzung beteiligten Rechtsträger ist, wenn sie binnen sechs Monaten nach dem Tag, an dem die Eintragung der Verschmelzung in das Register des Sitzes desjenigen Rechtsträgers, dessen Gläubiger sie sind, nach § 19 Abs. 3 UmwG als bekanntgemacht gilt, ihren Anspruch nach Grund und Höhe schriftlich anmelden, Sicherheit zu leisten, soweit sie nicht Befriedigung verlangen können. Dieses Recht steht den Gläubigern jedoch nur zu, wenn sie glaubhaft machen, dass durch die Verschmelzung die Erfüllung ihrer Forderung gefährdet wird."
    },
    {
      "date": "2024-10-01",
      "original_text": "Registerbekanntmachung nach dem Umwandlungsgesetz\nBerlin Amtsgericht Berlin (Charlottenburg) HRB 268039\nKRAFT creative studio GmbH – Berlin",
      "type": "Registerbekanntmachung nach dem Umwandlungsgesetz",
      "state": "Berlin",
      "amtsgericht": "Amtsgericht Berlin (Charlottenburg)",
      "registernummer": "HRB 268039",
      "registerart": "HRB",
      "company_name": "KRAFT creative studio GmbH",
      "company_seat": "Berlin",
      "details": "01.10.2024 (Bekanntmachungsdatum)\n\nBerlin Amtsgericht Berlin (Charlottenburg) HRB 268039\nRegisterbekanntmachung nach dem Umwandlungsgesetz 30.09.2024 (Eintragungsdatum)\n\nKRAFT creative studio GmbH\nGesellschaft mit beschränkter Haftung\nBerlin\n\nZu Eintragungsnummer 1 vom 30.09.2024 wird als nicht eingetragen veröffentlicht: Den Gläubigern der an der Spaltung beteiligten Rechtsträger ist, wenn sie binnen sechs Monaten nach dem Tag, an dem die Eintragung der Spaltung in das Register des Sitzes desjenigen Rechtsträgers, dessen Gläubiger sie sind, als bekannt gemacht gilt, ihren Anspruch nach Grund und Höhe schriftlich anmelden, Sicherheit zu leisten, soweit sie nicht Befriedigung verlangen können. Dieses Recht steht den Gläubigern jedoch nur zu, wenn sie glaubhaft machen, dass durch die Spaltung die Erfüllung ihrer Forderung gefährdet wird. Das Recht, Sicherheitsleistung zu verlangen, steht Gläubigern nicht zu, die im Falle der Insolvenz ein Recht auf vorzugsweise Befriedigung aus einer Deckungsmasse haben, die nach gesetzlicher Vorschrift zu ihrem Schutz errichtet und staatlich überwacht ist."
    },
    {
      "date": "2024-10-01",
      "original_text": "Löschungsankündigung\nHessen Amtsgericht Frankfurt am Main HRB 99504\nKUP Handels GmbH – Frankfurt am Main",
      "type": "Löschungsankündigung",
      "state": "Hessen",
      "amtsgericht": "Amtsgericht Frankfurt am Main",
      "registernummer": "HRB 99504",
      "registerart": "HRB",
      "company_name": "KUP Handels GmbH",
      "company_seat": "Frankfurt am Main",
      "details": "01.10.2024 (Bekanntmachungsdatum)\n\nHessen Amtsgericht Frankfurt am Main HRB 99504\nLöschungsankündigung\n\nKUP Handels GmbH\nGesellschaft mit beschränkter Haftung\nFrankfurt am Main\n\nDas Registergericht beabsichtigt die im Handelsregister eingetragene Gesellschaft von Amts wegen nach § 394 FamFG zu löschen. Die Frist zur Erhebung eines Widerspruchs gegen die beabsichtigte Löschung wird auf 1 Monat festgesetzt."
    },
    {
      "date": "2024-10-01",
      "original_text": "Registerbekanntmachung nach dem Umwandlungsgesetz\nHessen Amtsgericht Frankfurt am Main HRB 86556\nKai Zhong Development GmbH – Frankfurt am Main",
      "type": "Registerbekanntmachung nach dem Umwandlungsgesetz",
      "state": "Hessen",
      "amtsgericht": "Amtsgericht Frankfurt am Main",
      "registernummer": "HRB 86556",
      "registerart": "HRB",
      "company_name": "Kai Zhong Development GmbH",
      "company_seat": "Frankfurt am Main",
      "details": "01.10.2024 (Bekanntmachungsdatum)\n\nHessen Amtsgericht Frankfurt am Main HRB 86556\nRegisterbekanntmachung nach dem Umwandlungsgesetz 01.10.2024 (Eintragungsdatum)\n\nKai Zhong Development GmbH\nGesellschaft mit beschränkter Haftung\nFrankfurt am Main\n\nDen Gläubigern der an der Verschmelzung beteiligten Rechtsträger ist, wenn sie binnen sechs Monaten nach dem Tag, an dem die Eintragung der Verschmelzung in das Register des Sitzes desjenigen Rechtsträgers, dessen Gläubiger sie sind, nach § 19 Absatz 3 UmwG bekannt gemacht worden ist, ihren Anspruch nach Grund und Höhe schriftlich anmelden, Sicherheit zu leisten, soweit sie nicht Befriedigung verlangen können. Dieses Recht steht den Gläubigern jedoch nur zu, wenn sie glaubhaft machen, dass durch die Verschmelzung die Erfüllung ihrer Forderung gefährdet wird."
    },
    {
      "date": "2024-10-01",
      "original_text": "Registerbekanntmachung nach dem Umwandlungsgesetz\nBerlin Amtsgericht Berlin (Charlottenburg) HRB 206946\nKalodion GmbH – Berlin",
      "type": "Registerbekanntmachung nach dem Umwandlungsgesetz",
      "state": "Berlin",
      "amtsgericht": "Amtsgericht Berlin (Charlottenburg)",
      "registernummer": "HRB 206946",
      "registerart": "HRB",
      "company_name": "Kalodion GmbH",
      "company_seat": "Berlin",
      "details": "01.10.2024 (Bekanntmachungsdatum)\n\nBerlin Amtsgericht Berlin (Charlottenburg) HRB 206946\nRegisterbekanntmachung nach dem Umwandlungsgesetz 30.09.2024 (Eintragungsdatum)\n\nKalodion GmbH\nGesellschaft mit beschränkter Haftung\nBerlin\n\nZu Eintragungsnummer 6 vom 30.09.2024 wird als nicht eingetragen veröffentlicht:\n\nDen Gläubigern der an der Verschmelzung beteiligten Rechtsträger ist, wenn sie binnen sechs Monaten nach dem Tag, an dem die Eintragung der Verschmelzung in das Register des Sitzes desjenigen Rechtsträgers, dessen Gläubiger sie sind, als bekannt gemacht gilt, ihren Anspruch nach Grund und Höhe schriftlich anmelden, Sicherheit zu leisten, soweit sie nicht Befriedigung verlangen können. Dieses Recht steht den Gläubigern jedoch nur zu, wenn sie glaubhaft machen, dass durch die Verschmelzung die Erfüllung ihrer Forderung gefährdet wird. Das Recht, Sicherheitsleistung zu verlangen, steht Gläubigern nicht zu, die im Falle der Insolvenz ein Recht auf vorzugsweise Befriedigung aus einer Deckungsmasse haben, die nach gesetzlicher Vorschrift zu ihrem Schutz errichtet und staatlich überwacht ist."
    },
    {
      "date": "2024-10-01",
      "original_text": "Registerbekanntmachung nach dem Umwandlungsgesetz\nBayern Amtsgericht Augsburg HRA 13832\nKarl G. Miller Holding GmbH & Co. KG – Oettingen",
      "type": "Registerbekanntmachung nach dem Umwandlungsgesetz",
      "state": "Bayern",
      "amtsgericht": "Amtsgericht Augsburg",
      "registernummer": "HRA 13832",
      "registerart": "HRA",
      "company_name": "Karl G. Miller Holding GmbH & Co. KG",
      "company_seat": "Oettingen",
      "details": "01.10.2024 (Bekanntmachungsdatum)\n\nBayern Amtsgericht Augsburg HRA 13832\nRegisterbekanntmachung nach dem Umwandlungsgesetz 30.09.2024 (Eintragungsdatum)\n\nKarl G. Miller Holding GmbH & Co. KG\nKommanditgesellschaft\nOettingen\n\nDen Gläubigern der an der Spaltung beteiligten Rechtsträger ist, wenn sie binnen sechs Monaten nach dem Tag, an dem die Eintragung der Spaltung in das Register des Sitzes desjenigen Rechtsträgers, dessen Gläubiger sie sind, nach §§ 125, 19 Abs. 3 UmwG als bekannt gemacht gilt, ihren Anspruch nach Grund und Höhe schriftlich anmelden, Sicherheit zu leisten, soweit sie nicht Befriedigung verlangen können. Dieses Recht steht den Gläubigern jedoch nur zu, wenn sie glaubhaft machen, dass durch die Spaltung die Erfüllung ihrer Forderung gefährdet wird."
    },
    {
      "date": "2024-10-01",
      "original_text": "Registerbekanntmachung nach dem Umwandlungsgesetz\nSchleswig-Holstein Amtsgericht Lübeck HRB 7022\nKendrion Kuhnke Automotive GmbH – Bad Malente",
      "type": "Registerbekanntmachung nach dem Umwandlungsgesetz",
      "state": "Schleswig-Holstein",
      "amtsgericht": "Amtsgericht Lübeck",
      "registernummer": "HRB 7022",
      "registerart": "HRB",
      "company_name": "Kendrion Kuhnke Automotive GmbH",
      "company_seat": "Bad Malente",
      "details": "01.10.2024 (Bekanntmachungsdatum)\n\nSchleswig-Holstein Amtsgericht Lübeck HRB 7022\nRegisterbekanntmachung nach dem Umwandlungsgesetz 30.09.2024 (Eintragungsdatum)\n\nKendrion Kuhnke Automotive GmbH\nGesellschaft mit beschränkter Haftung\nBad Malente\n\nZu Eintragungsnummer 24 vom 30.09.2024 wird als nicht eingetragen veröffentlicht: Den Gläubigern der an der Ausglliederung beteiligten Rechtsträger ist, wenn sie binnen sechs Monaten nach dem Tag, an dem die Eintragung der Ausgliederung in das Register des Sitzes desjenigen Rechtsträgers, dessen Gläubiger sie sind, als bekannt gemacht gilt, ihren Anspruch nach Grund und Höhe schriftlich anmelden, Sicherheit zu leisten, soweit sie nicht Befriedigung verlangen können. Dieses Recht steht den Gläubigern jedoch nur zu, wenn sie glaubhaft machen, dass durch die Ausgliederung die Erfüllung ihrer Forderung gefährdet wird."
    },
    {
      "date": "2024-10-01",
      "original_text": "Registerbekanntmachung nach dem Umwandlungsgesetz\nSachsen Amtsgericht Dresden HRB 30161\nKleintransporte Baron UG (haftungsbeschränkt) – Dresden",
      "type": "Registerbekanntmachung nach dem Umwandlungsgesetz",
      "state": "Sachsen",
      "amtsgericht": "Amtsgericht Dresden",
      "registernummer": "HRB 30161",
      "registerart": "HRB",
      "company_name": "Kleintransporte Baron UG (haftungsbeschränkt)",
      "company_seat": "Dresden",
      "details": "01.10.2024 (Bekanntmachungsdatum)\n\nSachsen Amtsgericht Dresden HRB 30161\nRegisterbekanntmachung nach dem Umwandlungsgesetz 01.10.2024 (Eintragungsdatum)\n\nKleintransporte Baron UG (haftungsbeschränkt)\nGesellschaft mit beschränkter Haftung\nDresden\n\nDen Gläubigern der an der Verschmelzung beteiligten Rechtsträger ist, wenn sie binnen sechs Monaten nach dem Tag, an dem die Eintragung der Verschmelzung in das Register des Sitzes desjenigen Rechtsträgers, dessen Gläubiger sie sind, nach § 19 Abs. 3 UmwG als bekannt gemacht gilt, ihren Anspruch nach Grund und Höhe schriftlich anmelden, Sicherheit zu leisten, soweit sie nicht Befriedigung verlangen können. Dieses Recht steht den Gläubigern jedoch nur zu, wenn sie glaubhaft machen, dass durch die Verschmelzung die Erfüllung der Forderung gefährdet wird."
    },
    {
      "date": "2024-10-01",
      "original_text": "Registerbekanntmachung nach dem Umwandlungsgesetz\nNordrhein-Westfalen Amtsgericht Paderborn HRB 17326\nKnothe Immobilien Service GmbH – Geseke",
      "type": "Registerbekanntmachung nach dem Umwandlungsgesetz",
      "state": "Nordrhein-Westfalen",
      "amtsgericht": "Amtsgericht Paderborn",
      "registernummer": "HRB 17326",
      "registerart": "HRB",
      "company_name": "Knothe Immobilien Service GmbH",
      "company_seat": "Geseke",
      "details": "01.10.2024 (Bekanntmachungsdatum)\n\nNordrhein-Westfalen Amtsgericht Paderborn HRB 17326\nRegisterbekanntmachung nach dem Umwandlungsgesetz 01.10.2024 (Eintragungsdatum)\n\nKnothe Immobilien Service GmbH\nGesellschaft mit beschränkter Haftung\nGeseke\n\nDen Gläubigern der an der Ausgliederung beteiligten Rechtsträger ist, wenn sie binnen sechs Monaten nach dem Tag, an dem die Eintragung der Ausgliederung in das Register des Sitzes desjenigen Rechtsträgers, dessen Gläubiger sie sind, nach § 19 Absatz 3 UmwG als bekanntgemacht gilt, ihren Anspruch nach Grund und Höhe schriftlich anmelden, Sicherheit zu leisten, soweit sie nicht Befriedigung verlangen können. Dieses Recht steht den Gläubigern jedoch nur zu, wenn sie glaubhaft machen, dass durch die Ausgliederung die Erfüllung ihrer Forderung gefährdet wird."
    },
    {
      "date": "2024-10-01",
      "original_text": "Registerbekanntmachung nach dem Umwandlungsgesetz\nHessen Amtsgericht Darmstadt HRB 90453\nKolibri Services GmbH – Darmstadt",
      "type": "Registerbekanntmachung nach dem Umwandlungsgesetz",
      "state": "Hessen",
      "amtsgericht": "Amtsgericht Darmstadt",
      "registernummer": "HRB 90453",
      "registerart": "HRB",
      "company_name": "Kolibri Services GmbH",
      "company_seat": "Darmstadt",
      "details": "01.10.2024 (Bekanntmachungsdatum)\n\nHessen Amtsgericht Darmstadt HRB 90453\nRegisterbekanntmachung nach dem Umwandlungsgesetz 01.10.2024 (Eintragungsdatum)\n\nKolibri Services GmbH\nGesellschaft mit beschränkter Haftung\nDarmstadt\n\nDen Gläubigern der an der Verschmelzung beteiligten Rechtsträger ist, wenn sie binnen sechs Monaten nach dem Tag, an dem die Eintragung der Verschmelzung in das Register des Sitzes derjenigen Rechtsträger deren Gläubiger sie sind, nach § 19 Absatz 3 UmwG bekannt gemacht worden ist, ihren Anspruch nach Grund und Höhe schriftlich anmelden, Sicherheit zu leisten, soweit sie nicht Befriedigung verlangen können. Dieses Recht steht den Gläubigern jedoch nur zu, wenn sie glaubhaft machen, dass durch die Verschmelzung die Erfüllung ihrer Forderung gefährdet wird."
    },
    {
      "date": "2024-10-01",
      "original_text": "Registerbekanntmachung nach dem Umwandlungsgesetz\nBerlin Amtsgericht Berlin (Charlottenburg) HRA 63403\nKostka e.K., Inhaber Nitya Peter Kostka – Berlin",
      "type": "Registerbekanntmachung nach dem Umwandlungsgesetz",
      "state": "Berlin",
      "amtsgericht": "Amtsgericht Berlin (Charlottenburg)",
      "registernummer": "HRA 63403",
      "registerart": "HRA",
      "company_name": "Kostka e.K., Inhaber Nitya Peter Kostka",
      "company_seat": "Berlin",
      "details": "01.10.2024 (Bekanntmachungsdatum)\n\nBerlin Amtsgericht Berlin (Charlottenburg) HRA 63403\nRegisterbekanntmachung nach dem Umwandlungsgesetz 30.09.2024 (Eintragungsdatum)\n\nKostka e.K., Inhaber Nitya Peter Kostka\nEinzelkaufmann / Einzelkauffrau\nBerlin\n\nZu Eintragungsnummer 1 vom 30.09.2024 wird als nicht eingetragen veröffentlicht:Den Gläubigern der an der Verschmelzung beteiligten Rechtsträger ist, wenn sie binnen sechs Monaten nach dem Tag, an dem die Eintragung der Verschmelzung in das Register des Sitzes desjenigen Rechtsträgers, dessen Gläubiger sie sind, als bekannt gemacht gilt, ihren Anspruch nach Grund und Höhe schriftlich anmelden, Sicherheit zu leisten, soweit sie nicht Befriedigung verlangen können. Dieses Recht steht den Gläubigern jedoch nur zu, wenn sie glaubhaft machen, dass durch die Verschmelzung die Erfüllung ihrer Forderung gefährdet wird. Das Recht, Sicherheitsleistung zu verlangen, steht Gläubigern nicht zu, die im Falle der Insolvenz ein Recht auf vorzugsweise Befriedigung aus einer Deckungsmasse haben, die nach gesetzlicher Vorschrift zu ihrem Schutz errichtet und staatlich überwacht ist."
    },
    {
      "date": "2024-10-01",
      "original_text": "Löschungsankündigung\nNiedersachsen Amtsgericht Hannover HRB 218234\nLB Baudienstleistung GmbH – Hannover",
      "type": "Löschungsankündigung",
      "state": "Niedersachsen",
      "amtsgericht": "Amtsgericht Hannover",
      "registernummer": "HRB 218234",
      "registerart": "HRB",
      "company_name": "LB Baudienstleistung GmbH",
      "company_seat": "Hannover",
      "details": "01.10.2024 (Bekanntmachungsdatum)\n\nNiedersachsen Amtsgericht Hannover HRB 218234\nLöschungsankündigung\n\nLB Baudienstleistung GmbH\nGesellschaft mit beschränkter Haftung\nHannover\n\nDas Registergericht beabsichtigt, die Gesellschaft von Amts wegen nach § 394 FamFG zu löschen. Die Frist zur Erhebung eines Widerspruchs ist auf 1 Monat ab dieser Registerbekanntmachung festgesetzt."
    },
    {
      "date": "2024-10-01",
      "original_text": "Einreichung neuer Dokumente\nHamburg Amtsgericht Hamburg HRB 16709\nLOTTO Hamburg GmbH – Hamburg",
      "type": "Einreichung neuer Dokumente",
      "state": "Hamburg",
      "amtsgericht": "Amtsgericht Hamburg",
      "registernummer": "HRB 16709",
      "registerart": "HRB",
      "company_name": "LOTTO Hamburg GmbH",
      "company_seat": "Hamburg",
      "details": "01.10.2024 (Bekanntmachungsdatum)\n\nHamburg Amtsgericht Hamburg HRB 16709\nEinreichung neuer Dokumente\n\nLOTTO Hamburg GmbH\nGesellschaft mit beschränkter Haftung\nHamburg\n\nAls nicht eingetragen wird bekannt gemacht: Liste des Aufsichtsrats wurde eingereicht."
    },
    {
      "date": "2024-10-01",
      "original_text": "Registerbekanntmachung nach dem Umwandlungsgesetz\nBaden-Württemberg Amtsgericht Stuttgart HRA 741492\nLUISA CERANO GmbH & Co. KG – Nürtingen",
      "type": "Registerbekanntmachung nach dem Umwandlungsgesetz",
      "state": "Baden-Württemberg",
      "amtsgericht": "Amtsgericht Stuttgart",
      "registernummer": "HRA 741492",
      "registerart": "HRA",
      "company_name": "LUISA CERANO GmbH & Co. KG",
      "company_seat": "Nürtingen",
      "details": "01.10.2024 (Bekanntmachungsdatum)\n\nBaden-Württemberg Amtsgericht Stuttgart HRA 741492\nRegisterbekanntmachung nach dem Umwandlungsgesetz 01.10.2024 (Eintragungsdatum)\n\nLUISA CERANO GmbH & Co. KG\nKommanditgesellschaft\nNürtingen\n\nAls nicht eingetragen wird bekanntgemacht:\nDen Gläubigern der an der Ausgliederung beteiligten Rechtsträger ist, wenn sie binnen sechs Monaten nach dem Tag, an dem die Eintragung der Ausgliederung in das Register des Sitzes desjenigen Rechtsträgers, dessen Gläubiger sie sind, nach § 19 Abs. 3 UmwG als bekanntgemacht gilt, ihren Anspruch nach Grund und Höhe schriftlich anmelden, Sicherheit zu leisten, soweit sie nicht Befriedigung verlangen können. Dieses Recht steht den Gläubigern jedoch nur zu, wenn sie glaubhaft machen, dass durch die Ausgliederung die Erfüllung ihrer Forderung gefährdet wird."
    },
    {
      "date": "2024-10-01",
      "original_text": "Sonstige Registerbekanntmachung\nBaden-Württemberg Amtsgericht Mannheim HRB 710076\nMA micro automation GmbH – St. Leon-Rot",
      "type": "Sonstige Registerbekanntmachung",
      "state": "Baden-Württemberg",
      "amtsgericht": "Amtsgericht Mannheim",
      "registernummer": "HRB 710076",
      "registerart": "HRB",
      "company_name": "MA micro automation GmbH",
      "company_seat": "St. Leon-Rot",
      "details": "01.10.2024 (Bekanntmachungsdatum)\n\nBaden-Württemberg Amtsgericht Mannheim HRB 710076\nSonstige Registerbekanntmachung 01.10.2024 (Eintragungsdatum)\n\nMA micro automation GmbH\nGesellschaft mit beschränkter Haftung\nSt. Leon-Rot\n\nAls nicht eingetragen wird bekanntgemacht:\nDen Gläubigern der Gesellschaft, deren Forderungen begründet worden sind, bevor die Eintragung der Beendigung des Vertrages in das Handelsregister nach § 10 HGB als bekanntgemacht gilt, ist vom anderen Vertragsteil Sicherheit zu leisten, wenn sie sich binnen sechs Monaten nach der Bekanntmachung zu diesem Zweck bei ihm melden."
    },
    {
      "date": "2024-10-01",
      "original_text": "Registerbekanntmachung nach dem Umwandlungsgesetz\nMecklenburg-Vorpommern Amtsgericht Schwerin GnR 125\nMARKTFRUCHT eG Lützow – Lützow",
      "type": "Registerbekanntmachung nach dem Umwandlungsgesetz",
      "state": "Mecklenburg-Vorpommern",
      "amtsgericht": "Amtsgericht Schwerin",
      "registernummer": "GnR 125",
      "registerart": "GnR",
      "company_name": "MARKTFRUCHT eG Lützow",
      "company_seat": "Lützow",
      "details": "01.10.2024 (Bekanntmachungsdatum)\n\nMecklenburg-Vorpommern Amtsgericht Schwerin GnR 125\nRegisterbekanntmachung nach dem Umwandlungsgesetz 01.10.2024 (Eintragungsdatum)\n\nMARKTFRUCHT eG Lützow\neingetragene Genossenschaft\nLützow\n\nAls nicht eingetragen wird veröffentlicht: Den Gläubigern der an dem Formwechsel beteiligten Rechtsträger ist, wenn sie binnen sechs Monaten nach dem Tag, an dem die Eintragung des Formwechsels in das Register des Sitzes desjenigen Rechtsträgers, dessen Gläubiger sie sind, nach § 19 Abs. 3 UmwG als bekannt gemacht gilt,\nihren Anspruch nach Grund und Höhe schriftlich anmelden, Sicherheit zu leisten, soweit sie nicht Befriedigung verlangen können. Dieses Recht steht den Gläubigern jedoch nur zu, wenn sie glaubhaft machen, dass durch den Formwechsel\ndie Erfüllung der Forderung gefährdet wird.\""
    },
    {
      "date": "2024-10-01",
      "original_text": "Registerbekanntmachung nach dem Umwandlungsgesetz\nBayern Amtsgericht Augsburg HRA 21710\nMICOO GmbH & Co. KG – Oettingen i.Bay.",
      "type": "Registerbekanntmachung nach dem Umwandlungsgesetz",
      "state": "Bayern",
      "amtsgericht": "Amtsgericht Augsburg",
      "registernummer": "HRA 21710",
      "registerart": "HRA",
      "company_name": "MICOO GmbH & Co. KG",
      "company_seat": "Oettingen i.Bay.",
      "details": "01.10.2024 (Bekanntmachungsdatum)\n\nBayern Amtsgericht Augsburg HRA 21710\nRegisterbekanntmachung nach dem Umwandlungsgesetz 30.09.2024 (Eintragungsdatum)\n\nMICOO GmbH & Co. KG\nKommanditgesellschaft\nOettingen i.Bay.\n\nDen Gläubigern der an der Spaltung beteiligten Rechtsträger ist, wenn sie binnen sechs Monaten nach dem Tag, an dem die Eintragung der Spaltung in das Register des Sitzes desjenigen Rechtsträgers, dessen Gläubiger sie sind, nach §§ 125, 19 Abs. 3 UmwG als bekannt gemacht gilt, ihren Anspruch nach Grund und Höhe schriftlich anmelden, Sicherheit zu leisten, soweit sie nicht Befriedigung verlangen können. Dieses Recht steht den Gläubigern jedoch nur zu, wenn sie glaubhaft machen, dass durch die Spaltung die Erfüllung ihrer Forderung gefährdet wird."
    },
    {
      "date": "2024-10-01",
      "original_text": "Registerbekanntmachung nach dem Umwandlungsgesetz\nBayern Amtsgericht Regensburg HRB 9780\nMOSER Trachten GmbH – Regensburg",
      "type": "Registerbekanntmachung nach dem Umwandlungsgesetz",
      "state": "Bayern",
      "amtsgericht": "Amtsgericht Regensburg",
      "registernummer": "HRB 9780",
      "registerart": "HRB",
      "company_name": "MOSER Trachten GmbH",
      "company_seat": "Regensburg",
      "details": "01.10.2024 (Bekanntmachungsdatum)\n\nBayern Amtsgericht Regensburg HRB 9780\nRegisterbekanntmachung nach dem Umwandlungsgesetz 27.09.2024 (Eintragungsdatum)\n\nMOSER Trachten GmbH\nGesellschaft mit beschränkter Haftung\nRegensburg\n\nDen Gläubigern der an der Verschmelzung beteiligten Rechtsträger ist, wenn sie binnen sechs Monaten nach dem Tag, an dem die Eintragung der Verschmelzung in das Register des Sitzes desjenigen Rechtsträgers, dessen Gläubiger sie sind, nach § 19 Abs. 3 UmwG als bekannt gemacht gilt, ihren Anspruch nach Grund und Höhe schriftlich anmelden, Sicherheit zu leisten, soweit sie nicht Befriedigung verlangen können. Dieses Recht steht den Gläubigern jedoch nur zu, wenn sie glaubhaft machen, dass durch die Verschmelzung die Erfüllung ihrer Forderung gefährdet wird."
    },
    {
      "date": "2024-10-01",
      "original_text": "Registerbekanntmachung nach dem Umwandlungsgesetz\nBaden-Württemberg Amtsgericht Mannheim HRA 712002\nMSK - Motoren Service Klee e.K. – Oftersheim",
      "type": "Registerbekanntmachung nach dem Umwandlungsgesetz",
      "state": "Baden-Württemberg",
      "amtsgericht": "Amtsgericht Mannheim",
      "registernummer": "HRA 712002",
      "registerart": "HRA",
      "company_name": "MSK - Motoren Service Klee e.K.",
      "company_seat": "Oftersheim",
      "details": "01.10.2024 (Bekanntmachungsdatum)\n\nBaden-Württemberg Amtsgericht Mannheim HRA 712002\nRegisterbekanntmachung nach dem Umwandlungsgesetz 01.10.2024 (Eintragungsdatum)\n\nMSK - Motoren Service Klee e.K.\nEinzelkaufmann / Einzelkauffrau\nOftersheim\n\nAls nicht eingetragen wird bekanntgemacht:\nDen Gläubigern der an der Ausgliederung beteiligten Rechtsträger ist, wenn sie binnen sechs Monaten nach dem Tag, an dem die Eintragung der Ausgliederung in das Register des Sitzes desjenigen Rechtsträgers, dessen Gläubiger sie sind, nach § 19 Abs. 3 UmwG als bekanntgemacht gilt, ihren Anspruch nach Grund und Höhe schriftlich anmelden, Sicherheit zu leisten, soweit sie nicht Befriedigung verlangen können. Dieses Recht steht den Gläubigern jedoch nur zu, wenn sie glaubhaft machen, dass durch die Ausgliederung die Erfüllung ihrer Forderung gefährdet wird."
    },
    {
      "date": "2024-10-01",
      "original_text": "Registerbekanntmachung nach dem Umwandlungsgesetz\nBaden-Württemberg Amtsgericht Mannheim HRB 751103\nMSK Energie GmbH – Oftersheim",
      "type": "Registerbekanntmachung nach dem Umwandlungsgesetz",
      "state": "Baden-Württemberg",
      "amtsgericht": "Amtsgericht Mannheim",
      "registernummer": "HRB 751103",
      "registerart": "HRB",
      "company_name": "MSK Energie GmbH",
      "company_seat": "Oftersheim",
      "details": "01.10.2024 (Bekanntmachungsdatum)\n\nBaden-Württemberg Amtsgericht Mannheim HRB 751103\nRegisterbekanntmachung nach dem Umwandlungsgesetz 01.10.2024 (Eintragungsdatum)\n\nMSK Energie GmbH\nGesellschaft mit beschränkter Haftung\nOftersheim\n\nAls nicht eingetragen wird bekanntgemacht:\nDen Gläubigern der an der Ausgliederung beteiligten Rechtsträger ist, wenn sie binnen sechs Monaten nach dem Tag, an dem die Eintragung der Ausgliederung in das Register des Sitzes desjenigen Rechtsträgers, dessen Gläubiger sie sind, nach § 19 Abs. 3 UmwG als bekanntgemacht gilt, ihren Anspruch nach Grund und Höhe schriftlich anmelden, Sicherheit zu leisten, soweit sie nicht Befriedigung verlangen können. Dieses Recht steht den Gläubigern jedoch nur zu, wenn sie glaubhaft machen, dass durch die Ausgliederung die Erfüllung ihrer Forderung gefährdet wird."
    },
    {
      "date": "2024-10-01",
      "original_text": "Löschungsankündigung\nBrandenburg Amtsgericht Potsdam HRB 14718\nMSM Märkische Spielwarenmanufaktur GmbH – Brandenburg an der Havel",
      "type": "Löschungsankündigung",
      "state": "Brandenburg",
      "amtsgericht": "Amtsgericht Potsdam",
      "registernummer": "HRB 14718",
      "registerart": "HRB",
      "company_name": "MSM Märkische Spielwarenmanufaktur GmbH",
      "company_seat": "Brandenburg an der Havel",
      "details": "01.10.2024 (Bekanntmachungsdatum)\n\nBrandenburg Amtsgericht Potsdam HRB 14718\nLöschungsankündigung\n\nMSM Märkische Spielwarenmanufaktur GmbH\nGesellschaft mit beschränkter Haftung\nBrandenburg an der Havel\n\nBei der nachstehenden Gesellschaft wird das Amtslöschungsverfahren gemäß § 394 FamFG eingeleitet. Widerspruchsfrist: 8 Wochen"
    },
    {
      "date": "2024-10-01",
      "original_text": "Registerbekanntmachung nach dem Umwandlungsgesetz\nNordrhein-Westfalen Amtsgericht Bielefeld HRB 37010\nMalerfachbetrieb Bernert GmbH – Bielefeld",
      "type": "Registerbekanntmachung nach dem Umwandlungsgesetz",
      "state": "Nordrhein-Westfalen",
      "amtsgericht": "Amtsgericht Bielefeld",
      "registernummer": "HRB 37010",
      "registerart": "HRB",
      "company_name": "Malerfachbetrieb Bernert GmbH",
      "company_seat": "Bielefeld",
      "details": "01.10.2024 (Bekanntmachungsdatum)\n\nNordrhein-Westfalen Amtsgericht Bielefeld HRB 37010\nRegisterbekanntmachung nach dem Umwandlungsgesetz 01.10.2024 (Eintragungsdatum)\n\nMalerfachbetrieb Bernert GmbH\nGesellschaft mit beschränkter Haftung\nBielefeld\n\nDen Gläubigern der an der Verschmelzung beteiligten Rechtsträger ist, wenn sie binnen sechs Monaten nach dem Tag, an dem die Eintragung der Verschmelzung in das Register des Sitzes desjenigen Rechtsträgers, dessen Gläubiger sie sind, nach § 19 Absatz 3 UmwG als bekanntgemacht gilt, ihren Anspruch nach Grund und Höhe schriftlich anmelden, Sicherheit zu leisten, soweit sie nicht Befriedigung verlangen können. Dieses Recht steht den Gläubigern jedoch nur zu, wenn sie glaubhaft machen, dass durch die Verschmelzung die Erfüllung ihrer Forderung gefährdet wird."
    },
    {
      "date": "2024-10-01",
      "original_text": "Registerbekanntmachung nach dem Umwandlungsgesetz\nRheinland-Pfalz Amtsgericht Bad Kreuznach HRB 4384\nMarco Susenburger GmbH – Kisselbach",
      "type": "Registerbekanntmachung nach dem Umwandlungsgesetz",
      "state": "Rheinland-Pfalz",
      "amtsgericht": "Amtsgericht Bad Kreuznach",
      "registernummer": "HRB 4384",
      "registerart": "HRB",
      "company_name": "Marco Susenburger GmbH",
      "company_seat": "Kisselbach",
      "details": "01.10.2024 (Bekanntmachungsdatum)\n\nRheinland-Pfalz Amtsgericht Bad Kreuznach HRB 4384\nRegisterbekanntmachung nach dem Umwandlungsgesetz 01.10.2024 (Eintragungsdatum)\n\nMarco Susenburger GmbH\nGesellschaft mit beschränkter Haftung\nKisselbach\n\nAls nicht eingetragen wird veröffentlicht: Den Gläubigern der an der Verschmelzung beteiligten Rechtsträger ist, wenn sie binnen sechs Monaten nach dem Tag, an dem die Eintragung der Verschmelzung in das Register des Sitzes desjenigen Rechtsträgers, dessen Gläubiger sie sind, nach § 19 Abs. 3 UmwG als bekannt gemacht gilt, ihren Anspruch nach Grund und Höhe schriftlich anmelden, Sicherheit zu leisten, soweit sie nicht Befriedigung verlangen können. Dieses Recht steht den Gläubigern jedoch nur zu, wenn sie glaubhaft machen, dass durch die Verschmelzung die Erfüllung der Forderung gefährdet wird."
    },
    {
      "date": "2024-10-01",
      "original_text": "Registerbekanntmachung nach dem Umwandlungsgesetz\nBaden-Württemberg Amtsgericht Stuttgart HRB 353544\nMarelli Automotive Lighting Reutlingen (Germany) GmbH – Reutlingen",
      "type": "Registerbekanntmachung nach dem Umwandlungsgesetz",
      "state": "Baden-Württemberg",
      "amtsgericht": "Amtsgericht Stuttgart",
      "registernummer": "HRB 353544",
      "registerart": "HRB",
      "company_name": "Marelli Automotive Lighting Reutlingen (Germany) GmbH",
      "company_seat": "Reutlingen",
      "details": "01.10.2024 (Bekanntmachungsdatum)\n\nBaden-Württemberg Amtsgericht Stuttgart HRB 353544\nRegisterbekanntmachung nach dem Umwandlungsgesetz 01.10.2024 (Eintragungsdatum)\n\nMarelli Automotive Lighting Reutlingen (Germany) GmbH\nGesellschaft mit beschränkter Haftung\nReutlingen\n\nAls nicht eingetragen wird bekanntgemacht:\nDen Gläubigern der an der Verschmelzung beteiligten Rechtsträger ist, wenn sie binnen sechs Monaten nach dem Tag, an dem die Eintragung der Verschmelzung in das Register des Sitzes desjenigen Rechtsträgers, dessen Gläubiger sie sind, nach § 19 Abs. 3 UmwG als bekanntgemacht gilt, ihren Anspruch nach Grund und Höhe schriftlich anmelden, Sicherheit zu leisten, soweit sie nicht Befriedigung verlangen können. Dieses Recht steht den Gläubigern jedoch nur zu, wenn sie glaubhaft machen, dass durch die Verschmelzung die Erfüllung ihrer Forderung gefährdet wird."
    },
    {
      "date": "2024-10-01",
      "original_text": "Sonstige Registerbekanntmachung\nMecklenburg-Vorpommern Amtsgericht Rostock HRB 2571\nMarieneher Umweltschutz & Recycling GmbH – Rostock",
      "type": "Sonstige Registerbekanntmachung",
      "state": "Mecklenburg-Vorpommern",
      "amtsgericht": "Amtsgericht Rostock",
      "registernummer": "HRB 2571",
      "registerart": "HRB",
      "company_name": "Marieneher Umweltschutz & Recycling GmbH",
      "company_seat": "Rostock",
      "details": "01.10.2024 (Bekanntmachungsdatum)\n\nMecklenburg-Vorpommern Amtsgericht Rostock HRB 2571\nSonstige Registerbekanntmachung\n\nMarieneher Umweltschutz & Recycling GmbH\nGesellschaft mit beschränkter Haftung\nRostock\n\nEine Liste der Mitglieder des Aufsichtsrats ist zum Handelsregister eingereicht worden."
    },
    {
      "date": "2024-10-01",
      "original_text": "Registerbekanntmachung nach dem Umwandlungsgesetz\nBayern Amtsgericht Regensburg HRB 17496\nMax Holding GmbH – Regenstauf",
      "type": "Registerbekanntmachung nach dem Umwandlungsgesetz",
      "state": "Bayern",
      "amtsgericht": "Amtsgericht Regensburg",
      "registernummer": "HRB 17496",
      "registerart": "HRB",
      "company_name": "Max Holding GmbH",
      "company_seat": "Regenstauf",
      "details": "01.10.2024 (Bekanntmachungsdatum)\n\nBayern Amtsgericht Regensburg HRB 17496\nRegisterbekanntmachung nach dem Umwandlungsgesetz 27.09.2024 (Eintragungsdatum)\n\nMax Holding GmbH\nGesellschaft mit beschränkter Haftung\nRegenstauf\n\nDen Gläubigern der an der Verschmelzung beteiligten Rechtsträger ist, wenn sie binnen sechs Monaten nach dem Tag, an dem die Eintragung der Verschmelzung in das Register des Sitzes desjenigen Rechtsträgers, dessen Gläubiger sie sind, nach § 19 Abs. 3 UmwG als bekannt gemacht gilt, ihren Anspruch nach Grund und Höhe schriftlich anmelden, Sicherheit zu leisten, soweit sie nicht Befriedigung verlangen können. Dieses Recht steht den Gläubigern jedoch nur zu, wenn sie glaubhaft machen, dass durch die Verschmelzung die Erfüllung ihrer Forderung gefährdet wird."
    },
    {
      "date": "2024-10-01",
      "original_text": "Löschungsankündigung\nBayern Amtsgericht Augsburg HRB 34596\nMayer GmbH – Pöttmes",
      "type": "Löschungsankündigung",
      "state": "Bayern",
      "amtsgericht": "Amtsgericht Augsburg",
      "registernummer": "HRB 34596",
      "registerart": "HRB",
      "company_name": "Mayer GmbH",
      "company_seat": "Pöttmes",
      "details": "01.10.2024 (Bekanntmachungsdatum)\n\nBayern Amtsgericht Augsburg HRB 34596\nLöschungsankündigung\n\nMayer GmbH\nGesellschaft mit beschränkter Haftung\nPöttmes\n\nDas Registergericht beabsichtigt, die im Handelsregister eingetragene Gesellschaft wegen Vermögenslosigkeit von Amts wegen nach § 394 FamFG zu löschen. Die Frist zur Erhebung eines Widerspruchs ist auf einen Monat festgesetzt."
    },
    {
      "date": "2024-10-01",
      "original_text": "Registerbekanntmachung nach dem Umwandlungsgesetz\nBayern Amtsgericht Augsburg HRB 27086\nMedewo GmbH – Augsburg",
      "type": "Registerbekanntmachung nach dem Umwandlungsgesetz",
      "state": "Bayern",
      "amtsgericht": "Amtsgericht Augsburg",
      "registernummer": "HRB 27086",
      "registerart": "HRB",
      "company_name": "Medewo GmbH",
      "company_seat": "Augsburg",
      "details": "01.10.2024 (Bekanntmachungsdatum)\n\nBayern Amtsgericht Augsburg HRB 27086\nRegisterbekanntmachung nach dem Umwandlungsgesetz 30.09.2024 (Eintragungsdatum)\n\nMedewo GmbH\nGesellschaft mit beschränkter Haftung\nAugsburg\n\nDen Gläubigern der an der Verschmelzung beteiligten Rechtsträger ist, wenn sie binnen sechs Monaten nach dem Tag, an dem die Eintragung der Verschmelzung in das Register des Sitzes desjenigen Rechtsträgers, dessen Gläubiger sie sind, nach § 19 Abs. 3 UmwG als bekannt gemacht gilt, ihren Anspruch nach Grund und Höhe schriftlich anmelden, Sicherheit zu leisten, soweit sie nicht Befriedigung verlangen können. Dieses Recht steht den Gläubigern jedoch nur zu, wenn sie glaubhaft machen, dass durch die Verschmelzung die Erfüllung ihrer Forderung gefährdet wird."
    },
    {
      "date": "2024-10-01",
      "original_text": "Registerbekanntmachung nach dem Umwandlungsgesetz\nNiedersachsen Amtsgericht Tostedt HRB 211113\nMenke Industrieverpackungen GmbH – Rosengarten",
      "type": "Registerbekanntmachung nach dem Umwandlungsgesetz",
      "state": "Niedersachsen",
      "amtsgericht": "Amtsgericht Tostedt",
      "registernummer": "HRB 211113",
      "registerart": "HRB",
      "company_name": "Menke Industrieverpackungen GmbH",
      "company_seat": "Rosengarten",
      "details": "01.10.2024 (Bekanntmachungsdatum)\n\nNiedersachsen Amtsgericht Tostedt HRB 211113\nRegisterbekanntmachung nach dem Umwandlungsgesetz 01.10.2024 (Eintragungsdatum)\n\nMenke Industrieverpackungen GmbH\nGesellschaft mit beschränkter Haftung\nRosengarten\n\nDen Gläubigern der an der formwechselnden Umwandlung beteiligten Rechtsträger ist, wenn sie binnen sechs Monaten nach dem Tag, an dem die Eintragung der Umwandlung in das Register des Sitzes desjenigen Rechtsträgers, dessen Gläubiger sie sind, nach § 19 Abs. 3 UmwG als bekannt gemacht gilt, ihren Anspruch nach Grund und Höhe schriftlich anmelden, Sicherheit zu leisten, soweit sie nicht Befriedigung verlangen können. Dieses Recht steht den Gläubigern jedoch nur zu, wenn sie glaubhaft machen, dass durch die formwechselnde Umwandlung die Erfüllung der Forderung gefährdet wird."
    },
    {
      "date": "2024-10-01",
      "original_text": "Registerbekanntmachung nach dem Umwandlungsgesetz\nNiedersachsen Amtsgericht Tostedt HRA 200105\nMenke Industrieverpackungen GmbH & Co. KG – Rosengarten",
      "type": "Registerbekanntmachung nach dem Umwandlungsgesetz",
      "state": "Niedersachsen",
      "amtsgericht": "Amtsgericht Tostedt",
      "registernummer": "HRA 200105",
      "registerart": "HRA",
      "company_name": "Menke Industrieverpackungen GmbH & Co. KG",
      "company_seat": "Rosengarten",
      "details": "01.10.2024 (Bekanntmachungsdatum)\n\nNiedersachsen Amtsgericht Tostedt HRA 200105\nRegisterbekanntmachung nach dem Umwandlungsgesetz 01.10.2024 (Eintragungsdatum)\n\nMenke Industrieverpackungen GmbH & Co. KG\nKommanditgesellschaft\nRosengarten\n\nDen Gläubigern der an der formwechselnden Umwandlung beteiligten Rechtsträger ist, wenn sie binnen sechs Monaten nach dem Tag, an dem die Eintragung der Umwandlung in das Register des Sitzes desjenigen Rechtsträgers, dessen Gläubiger sie sind, nach § 19 Abs. 3 UmwG als bekannt gemacht gilt, ihren Anspruch nach Grund und Höhe schriftlich anmelden, Sicherheit zu leisten, soweit sie nicht Befriedigung verlangen können. Dieses Recht steht den Gläubigern jedoch nur zu, wenn sie glaubhaft machen, dass durch die formwechselnde Umwandlung die Erfüllung der Forderung gefährdet wird."
    },
    {
      "date": "2024-10-01",
      "original_text": "Registerbekanntmachung nach dem Umwandlungsgesetz\nNordrhein-Westfalen Amtsgericht Bonn HRB 28149\nMetallbau Engels GmbH – Weilerswist",
      "type": "Registerbekanntmachung nach dem Umwandlungsgesetz",
      "state": "Nordrhein-Westfalen",
      "amtsgericht": "Amtsgericht Bonn",
      "registernummer": "HRB 28149",
      "registerart": "HRB",
      "company_name": "Metallbau Engels GmbH",
      "company_seat": "Weilerswist",
      "details": "01.10.2024 (Bekanntmachungsdatum)\n\nNordrhein-Westfalen Amtsgericht Bonn HRB 28149\nRegisterbekanntmachung nach dem Umwandlungsgesetz 01.10.2024 (Eintragungsdatum)\n\nMetallbau Engels GmbH\nGesellschaft mit beschränkter Haftung\nWeilerswist\n\nDen Gläubigern der an der Ausgliederung beteiligten Rechtsträger ist, wenn sie binnen sechs Monaten nach dem Tag, an dem die Eintragung der Ausgliederung in das Register des Sitzes derjenigen Rechtsträger deren Gläubiger sie sind, nach § 19 Absatz 3 UmwG als bekanntgemacht gilt, ihren Anspruch nach Grund und Höhe schriftlich anmelden, Sicherheit zu leisten, soweit sie nicht Befriedigung verlangen können. Dieses Recht steht den Gläubigern jedoch nur zu, wenn sie glaubhaft machen, dass durch die Ausgliederung die Erfüllung ihrer Forderung gefährdet wird."
    },
    {
      "date": "2024-10-01",
      "original_text": "Registerbekanntmachung nach dem Umwandlungsgesetz\nNordrhein-Westfalen Amtsgericht Bonn HRA 10200\nMichael Wilczek e. K. – Alfter",
      "type": "Registerbekanntmachung nach dem Umwandlungsgesetz",
      "state": "Nordrhein-Westfalen",
      "amtsgericht": "Amtsgericht Bonn",
      "registernummer": "HRA 10200",
      "registerart": "HRA",
      "company_name": "Michael Wilczek e. K.",
      "company_seat": "Alfter",
      "details": "01.10.2024 (Bekanntmachungsdatum)\n\nNordrhein-Westfalen Amtsgericht Bonn HRA 10200\nRegisterbekanntmachung nach dem Umwandlungsgesetz 01.10.2024 (Eintragungsdatum)\n\nMichael Wilczek e. K.\nEinzelkaufmann / Einzelkauffrau\nAlfter\n\nDen Gläubigern der an der Ausgliederung beteiligten Rechtsträger ist, wenn sie binnen sechs Monaten nach dem Tag, an dem die Eintragung der Ausgliederung in das Register des Sitzes desjenigen Rechtsträgers, dessen Gläubiger sie sind, nach § 19 Absatz 3 UmwG als bekanntgemacht gilt, ihren Anspruch nach Grund und Höhe schriftlich anmelden, Sicherheit zu leisten, soweit sie nicht Befriedigung verlangen können. Dieses Recht steht den Gläubigern jedoch nur zu, wenn sie glaubhaft machen, dass durch die Ausgliederung die Erfüllung ihrer Forderung gefährdet wird."
    },
    {
      "date": "2024-10-01",
      "original_text": "Registerbekanntmachung nach dem Umwandlungsgesetz\nHamburg Amtsgericht Hamburg HRB 166972\nN D F Norddeutsche Fußbodentechnik GmbH – Hamburg",
      "type": "Registerbekanntmachung nach dem Umwandlungsgesetz",
      "state": "Hamburg",
      "amtsgericht": "Amtsgericht Hamburg",
      "registernummer": "HRB 166972",
      "registerart": "HRB",
      "company_name": "N D F Norddeutsche Fußbodentechnik GmbH",
      "company_seat": "Hamburg",
      "details": "01.10.2024 (Bekanntmachungsdatum)\n\nHamburg Amtsgericht Hamburg HRB 166972\nRegisterbekanntmachung nach dem Umwandlungsgesetz 01.10.2024 (Eintragungsdatum)\n\nN D F Norddeutsche Fußbodentechnik GmbH\nGesellschaft mit beschränkter Haftung\nHamburg\n\nAls nicht eingetragen wird bekannt gemacht:\nDen Gläubigern der an der Verschmelzung beteiligten Gesellschaften ist, wenn sie binnen sechs Monaten nach dem Tag, an dem die Eintragung der Verschmelzung in das Register des Sitzes desjenigen Rechtsträgers, dessen Gläubiger sie sind, nach § 19 Absatz 3 UmwG als bekannt gemacht gilt, ihren Anspruch nach Grund und Höhe schriftlich anmelden, Sicherheit zu leisten, soweit sie nicht Befriedigung verlangen können. Dieses Recht steht den Gläubigern jedoch nur zu, wenn sie glaubhaft machen, dass durch die Verschmelzung die Erfüllung ihrer Forderung gefährdet wird."
    },
    {
      "date": "2024-10-01",
      "original_text": "Registerbekanntmachung nach dem Umwandlungsgesetz\nSaarland Amtsgericht Saarbrücken HRB 110659\nNEUTUNA Finanzdienstleistungen GmbH – Nalbach",
      "type": "Registerbekanntmachung nach dem Umwandlungsgesetz",
      "state": "Saarland",
      "amtsgericht": "Amtsgericht Saarbrücken",
      "registernummer": "HRB 110659",
      "registerart": "HRB",
      "company_name": "NEUTUNA Finanzdienstleistungen GmbH",
      "company_seat": "Nalbach",
      "details": "01.10.2024 (Bekanntmachungsdatum)\n\nSaarland Amtsgericht Saarbrücken HRB 110659\nRegisterbekanntmachung nach dem Umwandlungsgesetz 01.10.2024 (Eintragungsdatum)\n\nNEUTUNA Finanzdienstleistungen GmbH\nGesellschaft mit beschränkter Haftung\nNalbach\n\nAls nicht eingetragen wird bekannt gemacht: Den Gläubigern der an der Verschmelzung beteiligten Gesellschaften ist, wenn sie binnen sechs Monaten nach dem Tag, an dem die Eintragung der Verschmelzung in das Register des Sitzes desjenigen Rechtsträgers, dessen Gläubiger sie sind, nach § 19 Absatz 3 UmwG bekannt gemacht worden ist, ihren Anspruch nach Grund und Höhe schriftlich anmelden, Sicherheit zu leisten, soweit sie nicht Befriedigung verlangen können. Dieses Recht steht den Gläubigern jedoch nur zu, wenn sie glaubhaft machen, dass durch die Verschmelzung die Erfüllung ihrer Forderung gefährdet wird."
    },
    {
      "date": "2024-10-01",
      "original_text": "Löschungsankündigung\nBerlin Amtsgericht Berlin (Charlottenburg) HRA 57104\nNKU Real Estate Experts GmbH & Co. KG – Berlin",
      "type": "Löschungsankündigung",
      "state": "Berlin",
      "amtsgericht": "Amtsgericht Berlin (Charlottenburg)",
      "registernummer": "HRA 57104",
      "registerart": "HRA",
      "company_name": "NKU Real Estate Experts GmbH & Co. KG",
      "company_seat": "Berlin",
      "details": "01.10.2024 (Bekanntmachungsdatum)\n\nBerlin Amtsgericht Berlin (Charlottenburg) HRA 57104\nLöschungsankündigung\n\nNKU Real Estate Experts GmbH & Co. KG\nKommanditgesellschaft\nBerlin\n\nBei dem nachstehenden Unternehmen / der nachstehenden Gesellschaft wird das Amtslöschungsverfahren gemäß § 31 Abs. 2 HGB eingeleitet. Widerspruchsfrist 3 Wochen"
    },
    {
      "date": "2024-10-01",
      "original_text": "Registerbekanntmachung nach dem Umwandlungsgesetz\nBaden-Württemberg Amtsgericht Ulm HRB 729503\nNadine Himstedt Hairdesign UG (haftungsbeschränkt) – Friedrichshafen",
      "type": "Registerbekanntmachung nach dem Umwandlungsgesetz",
      "state": "Baden-Württemberg",
      "amtsgericht": "Amtsgericht Ulm",
      "registernummer": "HRB 729503",
      "registerart": "HRB",
      "company_name": "Nadine Himstedt Hairdesign UG (haftungsbeschränkt)",
      "company_seat": "Friedrichshafen",
      "details": "01.10.2024 (Bekanntmachungsdatum)\n\nBaden-Württemberg Amtsgericht Ulm HRB 729503\nRegisterbekanntmachung nach dem Umwandlungsgesetz 01.10.2024 (Eintragungsdatum)\n\nNadine Himstedt Hairdesign UG (haftungsbeschränkt)\nGesellschaft mit beschränkter Haftung\nFriedrichshafen\n\nAls nicht eingetragen wird bekanntgemacht:\nDen Gläubigern der an der Verschmelzung beteiligten Rechtsträger ist, wenn sie binnen sechs Monaten nach dem Tag, an dem die Eintragung der Verschmelzung in das Register des Sitzes desjenigen Rechtsträgers, dessen Gläubiger sie sind, nach § 19 Abs. 3 UmwG als bekanntgemacht gilt, ihren Anspruch nach Grund und Höhe schriftlich anmelden, Sicherheit zu leisten, soweit sie nicht Befriedigung verlangen können. Dieses Recht steht den Gläubigern jedoch nur zu, wenn sie glaubhaft machen, dass durch die Verschmelzung die Erfüllung ihrer Forderung gefährdet wird."
    },
    {
      "date": "2024-10-01",
      "original_text": "Registerbekanntmachung nach dem Umwandlungsgesetz\nBaden-Württemberg Amtsgericht Stuttgart HRB 740601\nNeo Verlag GmbH – Bönnigheim",
      "type": "Registerbekanntmachung nach dem Umwandlungsgesetz",
      "state": "Baden-Württemberg",
      "amtsgericht": "Amtsgericht Stuttgart",
      "registernummer": "HRB 740601",
      "registerart": "HRB",
      "company_name": "Neo Verlag GmbH",
      "company_seat": "Bönnigheim",
      "details": "01.10.2024 (Bekanntmachungsdatum)\n\nBaden-Württemberg Amtsgericht Stuttgart HRB 740601\nRegisterbekanntmachung nach dem Umwandlungsgesetz 01.10.2024 (Eintragungsdatum)\n\nNeo Verlag GmbH\nGesellschaft mit beschränkter Haftung\nBönnigheim\n\nAls nicht eingetragen wird bekanntgemacht:\nDen Gläubigern der an der Verschmelzung beteiligten Rechtsträger ist, wenn sie binnen sechs Monaten nach dem Tag, an dem die Eintragung der Verschmelzung in das Register des Sitzes desjenigen Rechtsträgers, dessen Gläubiger sie sind, nach § 19 Abs. 3 UmwG als bekanntgemacht gilt, ihren Anspruch nach Grund und Höhe schriftlich anmelden, Sicherheit zu leisten, soweit sie nicht Befriedigung verlangen können. Dieses Recht steht den Gläubigern jedoch nur zu, wenn sie glaubhaft machen, dass durch die Verschmelzung die Erfüllung ihrer Forderung gefährdet wird."
    },
    {
      "date": "2024-10-01",
      "original_text": "Löschungsankündigung\nBayern Amtsgericht München HRA 86660\nNiederalt GmbH & Co. KG – München",
      "type": "Löschungsankündigung",
      "state": "Bayern",
      "amtsgericht": "Amtsgericht München",
      "registernummer": "HRA 86660",
      "registerart": "HRA",
      "company_name": "Niederalt GmbH & Co. KG",
      "company_seat": "München",
      "details": "01.10.2024 (Bekanntmachungsdatum)\n\nBayern Amtsgericht München HRA 86660\nLöschungsankündigung 30.09.2024 (Eintragungsdatum)\n\nNiederalt GmbH & Co. KG\nKommanditgesellschaft\nMünchen\n\nDas Registergericht beabsichtigt, die im Handelsregister eingetragene Firma von Amts wegen nach § 31 Abs. 2 HGB zu löschen. Die Frist zur Erhebung eines Widerspruchs ist auf zwei Monate festgesetzt."
    },
    {
      "date": "2024-10-01",
      "original_text": "Registerbekanntmachung nach dem Umwandlungsgesetz\nNordrhein-Westfalen Amtsgericht Köln HRB 61266\nPANDION Real Estate GmbH – Köln",
      "type": "Registerbekanntmachung nach dem Umwandlungsgesetz",
      "state": "Nordrhein-Westfalen",
      "amtsgericht": "Amtsgericht Köln",
      "registernummer": "HRB 61266",
      "registerart": "HRB",
      "company_name": "PANDION Real Estate GmbH",
      "company_seat": "Köln",
      "details": "01.10.2024 (Bekanntmachungsdatum)\n\nNordrhein-Westfalen Amtsgericht Köln HRB 61266\nRegisterbekanntmachung nach dem Umwandlungsgesetz 01.10.2024 (Eintragungsdatum)\n\nPANDION Real Estate GmbH\nGesellschaft mit beschränkter Haftung\nKöln\n\nDen Gläubigern der an der Verschmelzung beteiligten Rechtsträger ist, wenn sie binnen sechs Monaten nach dem Tag, an dem die Eintragung der Verschmelzung in das Register des Sitzes desjenigen Rechtsträgers, dessen Gläubiger sie sind, nach § 19 Absatz 3 UmwG als bekanntgemacht gilt, ihren Anspruch nach Grund und Höhe schriftlich anmelden, Sicherheit zu leisten, soweit sie nicht Befriedigung verlangen können. Dieses Recht steht den Gläubigern jedoch nur zu, wenn sie glaubhaft machen, dass durch die Verschmelzung die Erfüllung ihrer Forderung gefährdet wird."
    },
    {
      "date": "2024-10-01",
      "original_text": "Löschungsankündigung\nHessen Amtsgericht Frankfurt am Main HRB 101438\nPD Transaction GmbH – Frankfurt am Main",
      "type": "Löschungsankündigung",
      "state": "Hessen",
      "amtsgericht": "Amtsgericht Frankfurt am Main",
      "registernummer": "HRB 101438",
      "registerart": "HRB",
      "company_name": "PD Transaction GmbH",
      "company_seat": "Frankfurt am Main",
      "details": "01.10.2024 (Bekanntmachungsdatum)\n\nHessen Amtsgericht Frankfurt am Main HRB 101438\nLöschungsankündigung\n\nPD Transaction GmbH\nGesellschaft mit beschränkter Haftung\nFrankfurt am Main\n\nEs ist beabsichtigt die Gesellschaft wegen Vermögenslosigkeit gemäß § 394 FamFG von Amts wegen zu löschen. Hiergegen kann innerhalb eines Monats nach dieser Veröffentlichung Widerspruch bei dem Amtsgericht Frankfurt am Main eingelegt werden."
    },
    {
      "date": "2024-10-01",
      "original_text": "Löschungsankündigung\nSachsen Amtsgericht Dresden HRB 17162\nPROTEC GmbH – Neustadt i. Sa.",
      "type": "Löschungsankündigung",
      "state": "Sachsen",
      "amtsgericht": "Amtsgericht Dresden",
      "registernummer": "HRB 17162",
      "registerart": "HRB",
      "company_name": "PROTEC GmbH",
      "company_seat": "Neustadt i. Sa.",
      "details": "01.10.2024 (Bekanntmachungsdatum)\n\nSachsen Amtsgericht Dresden HRB 17162\nLöschungsankündigung\n\nPROTEC GmbH\nGesellschaft mit beschränkter Haftung\nNeustadt i. Sa.\n\nDas Registergericht beabsichtigt, die im Handelsregister eingetragene Gesellschaft von Amts wegen nach § 394 FamFG zu löschen. Die Frist zu Erhebung eines Widerspruchs gegen die beabsichtigte Löschung wird auf einen Monat festgesetzt."
    },
    {
      "date": "2024-10-01",
      "original_text": "Registerbekanntmachung nach dem Umwandlungsgesetz\nHessen Amtsgericht Marburg HRB 6609\nPURUSIL Gebäudereinigung GmbH – Frankenberg",
      "type": "Registerbekanntmachung nach dem Umwandlungsgesetz",
      "state": "Hessen",
      "amtsgericht": "Amtsgericht Marburg",
      "registernummer": "HRB 6609",
      "registerart": "HRB",
      "company_name": "PURUSIL Gebäudereinigung GmbH",
      "company_seat": "Frankenberg",
      "details": "01.10.2024 (Bekanntmachungsdatum)\n\nHessen Amtsgericht Marburg HRB 6609\nRegisterbekanntmachung nach dem Umwandlungsgesetz 01.10.2024 (Eintragungsdatum)\n\nPURUSIL Gebäudereinigung GmbH\nGesellschaft mit beschränkter Haftung\nFrankenberg\n\nDen Gläubigern der an der Verschmelzung beteiligten Rechtsträger ist, wenn sie binnen sechs Monaten nach dem Tag, an dem die Eintragung der Verschmelzung in das Register des Sitzes desjenigen Rechtsträgers, dessen Gläubiger sie sind, nach § 19 Absatz 3 UmwG bekannt gemacht worden ist, ihren Anspruch nach Grund und Höhe schriftlich anmelden, Sicherheit zu leisten, soweit sie nicht Befriedigung verlangen können. Dieses Recht steht den Gläubigern jedoch nur zu, wenn sie glaubhaft machen, dass durch die Verschmelzung die Erfüllung ihrer Forderung gefährdet wird."
    },
    {
      "date": "2024-10-01",
      "original_text": "Löschungsankündigung\nSachsen Amtsgericht Dresden HRB 18156\nPVG Vertriebsgesellschaft mbH – Kamenz",
      "type": "Löschungsankündigung",
      "state": "Sachsen",
      "amtsgericht": "Amtsgericht Dresden",
      "registernummer": "HRB 18156",
      "registerart": "HRB",
      "company_name": "PVG Vertriebsgesellschaft mbH",
      "company_seat": "Kamenz",
      "details": "01.10.2024 (Bekanntmachungsdatum)\n\nSachsen Amtsgericht Dresden HRB 18156\nLöschungsankündigung\n\nPVG Vertriebsgesellschaft mbH\nGesellschaft mit beschränkter Haftung\nKamenz\n\nDas Registergericht beabsichtigt, die im Handelsregister eingetragene Gesellschaft von Amts wegen nach § 394 FamFG zu löschen. Die Frist zu Erhebung eines Widerspruchs gegen die beabsichtigte Löschung wird auf einen Monat festgesetzt."
    },
    {
      "date": "2024-10-01",
      "original_text": "Registerbekanntmachung nach dem Umwandlungsgesetz\nBerlin Amtsgericht Berlin (Charlottenburg) HRA 63007\nPeace Gyros e.K. – Berlin",
      "type": "Registerbekanntmachung nach dem Umwandlungsgesetz",
      "state": "Berlin",
      "amtsgericht": "Amtsgericht Berlin (Charlottenburg)",
      "registernummer": "HRA 63007",
      "registerart": "HRA",
      "company_name": "Peace Gyros e.K.",
      "company_seat": "Berlin",
      "details": "01.10.2024 (Bekanntmachungsdatum)\n\nBerlin Amtsgericht Berlin (Charlottenburg) HRA 63007\nRegisterbekanntmachung nach dem Umwandlungsgesetz 30.09.2024 (Eintragungsdatum)\n\nPeace Gyros e.K.\nEinzelkaufmann / Einzelkauffrau\nBerlin\n\nZu Eintragungsnummer 2 vom 30.09.2024 wird als nicht eingetragen veröffentlicht:Den Gläubigern der an der Spaltung beteiligten Rechtsträger ist, wenn sie binnen sechs Monaten nach dem Tag, an dem die Eintragung der Spaltung in das Register des Sitzes desjenigen Rechtsträgers, dessen Gläubiger sie sind, als bekannt gemacht gilt, ihren Anspruch nach Grund und Höhe schriftlich anmelden, Sicherheit zu leisten, soweit sie nicht Befriedigung verlangen können. Dieses Recht steht den Gläubigern jedoch nur zu, wenn sie glaubhaft machen, dass durch die Spaltung die Erfüllung ihrer Forderung gefährdet wird. Das Recht, Sicherheitsleistung zu verlangen, steht Gläubigern nicht zu, die im Falle der Insolvenz ein Recht auf vorzugsweise Befriedigung aus einer Deckungsmasse haben, die nach gesetzlicher Vorschrift zu ihrem Schutz errichtet und staatlich überwacht ist."
    },
    {
      "date": "2024-10-01",
      "original_text": "Registerbekanntmachung nach dem Umwandlungsgesetz\nSchleswig-Holstein Amtsgericht Lübeck HRB 23007\nPflegezentrum Pansdorf GmbH – Ratekau",
      "type": "Registerbekanntmachung nach dem Umwandlungsgesetz",
      "state": "Schleswig-Holstein",
      "amtsgericht": "Amtsgericht Lübeck",
      "registernummer": "HRB 23007",
      "registerart": "HRB",
      "company_name": "Pflegezentrum Pansdorf GmbH",
      "company_seat": "Ratekau",
      "details": "01.10.2024 (Bekanntmachungsdatum)\n\nSchleswig-Holstein Amtsgericht Lübeck HRB 23007\nRegisterbekanntmachung nach dem Umwandlungsgesetz 30.09.2024 (Eintragungsdatum)\n\nPflegezentrum Pansdorf GmbH\nGesellschaft mit beschränkter Haftung\nRatekau\n\nZu Eintragungsnummer 4 vom 30.09.2024 wird als nicht eingetragen veröffentlicht: Den Gläubigern der an der Verschmelzung beteiligten Rechtsträger ist, wenn sie binnen sechs Monaten nach dem Tag, an dem die Eintragung der Verschmelzung in das Register des Sitzes desjenigen Rechtsträgers, dessen Gläubiger sie sind, als bekannt gemacht gilt, ihren Anspruch nach Grund und Höhe schriftlich anmelden, Sicherheit zu leisten, soweit sie nicht Befriedigung verlangen können. Dieses Recht steht den Gläubigern jedoch nur zu, wenn sie glaubhaft machen, dass durch die Verschmelzung die Erfüllung ihrer Forderung gefährdet wird."
    },
    {
      "date": "2024-10-01",
      "original_text": "Registerbekanntmachung nach dem Umwandlungsgesetz\nSchleswig-Holstein Amtsgericht Lübeck HRB 395 BS\nPflegezentrum Pansdorf GmbH – Pansdorf",
      "type": "Registerbekanntmachung nach dem Umwandlungsgesetz",
      "state": "Schleswig-Holstein",
      "amtsgericht": "Amtsgericht Lübeck",
      "registernummer": "HRB 395 BS",
      "registerart": "HRB",
      "company_name": "Pflegezentrum Pansdorf GmbH",
      "company_seat": "Pansdorf",
      "details": "01.10.2024 (Bekanntmachungsdatum)\n\nSchleswig-Holstein Amtsgericht Lübeck HRB 395 BS\nRegisterbekanntmachung nach dem Umwandlungsgesetz 30.09.2024 (Eintragungsdatum)\n\nPflegezentrum Pansdorf GmbH\nGesellschaft mit beschränkter Haftung\nPansdorf\n\nZu Eintragungsnummer 8 vom 30.09.2024 wird als nicht eingetragen veröffentlicht: Den Gläubigern der an der Verschmelzung beteiligten Rechtsträger ist, wenn sie binnen sechs Monaten nach dem Tag, an dem die Eintragung der Verschmelzung in das Register des Sitzes desjenigen Rechtsträgers, dessen Gläubiger sie sind, als bekannt gemacht gilt, ihren Anspruch nach Grund und Höhe schriftlich anmelden, Sicherheit zu leisten, soweit sie nicht Befriedigung verlangen können. Dieses Recht steht den Gläubigern jedoch nur zu, wenn sie glaubhaft machen, dass durch die Verschmelzung die Erfüllung ihrer Forderung gefährdet wird."
    },
    {
      "date": "2024-10-01",
      "original_text": "Registerbekanntmachung nach dem Umwandlungsgesetz\nSaarland Amtsgericht Saarbrücken HRA 13178\nPhilipp Müller e.K. – Nalbach",
      "type": "Registerbekanntmachung nach dem Umwandlungsgesetz",
      "state": "Saarland",
      "amtsgericht": "Amtsgericht Saarbrücken",
      "registernummer": "HRA 13178",
      "registerart": "HRA",
      "company_name": "Philipp Müller e.K.",
      "company_seat": "Nalbach",
      "details": "01.10.2024 (Bekanntmachungsdatum)\n\nSaarland Amtsgericht Saarbrücken HRA 13178\nRegisterbekanntmachung nach dem Umwandlungsgesetz 01.10.2024 (Eintragungsdatum)\n\nPhilipp Müller e.K.\nEinzelkaufmann / Einzelkauffrau\nNalbach\n\nAls nicht eingetragen wird bekannt gemacht: Den Gläubigern der an der Verschmelzung beteiligten Gesellschaften ist, wenn sie binnen sechs Monaten nach dem Tag, an dem die Eintragung der Verschmelzung in das Register des Sitzes desjenigen Rechtsträgers, dessen Gläubiger sie sind, nach § 19 Absatz 3 UmwG bekannt gemacht worden ist, ihren Anspruch nach Grund und Höhe schriftlich anmelden, Sicherheit zu leisten, soweit sie nicht Befriedigung verlangen können. Dieses Recht steht den Gläubigern jedoch nur zu, wenn sie glaubhaft machen, dass durch die Verschmelzung die Erfüllung ihrer Forderung gefährdet wird."
    },
    {
      "date": "2024-10-01",
      "original_text": "Löschungsankündigung\nSaarland Amtsgericht Saarbrücken HRB 101661\nPhoenix Edelmetalle GmbH – Saarbrücken",
      "type": "Löschungsankündigung",
      "state": "Saarland",
      "amtsgericht": "Amtsgericht Saarbrücken",
      "registernummer": "HRB 101661",
      "registerart": "HRB",
      "company_name": "Phoenix Edelmetalle GmbH",
      "company_seat": "Saarbrücken",
      "details": "01.10.2024 (Bekanntmachungsdatum)\n\nSaarland Amtsgericht Saarbrücken HRB 101661\nLöschungsankündigung\n\nPhoenix Edelmetalle GmbH\nGesellschaft mit beschränkter Haftung\nSaarbrücken\n\nEs ist beabsichtigt, die Gesellschaft von Amts wegen gemäß § 394 FamFG wegen Vermögenslosigkeit zu löschen.\nGegen die Löschung von Amts wegen ist das Rechtsmittel des Widerspruchs statthaft. Der Widerspruch ist binnen einer Frist zwei Monaten beginnend mit dem Tag dieser Veröffentlichung durch Einreichen eines Widerspruchsschreibens -schriftlich oder zur Niederschrift der Geschäftsstelle beim Amtsgericht Saarbrücken, -zentrales Handelsregister-, Mainzerstr.178, 66121 Saarbrücken einzulegen.\nDer Widerspruch muss die Bezeichnung der angefochtenen Löschungsankündigung enthalten sowie die Erklärung, dass Widerspruch eingelegt wird. Er ist vom Widerspruchsführer oder seinem Bevollmächtigten zu unterzeichnen.\nDas Widerspruchsschreiben kann auch in der Form eines elektronischen Dokumentes eingereicht werden, das mit einer qualifizierten elektronischen Signatur nach dem Signaturgesetz versehen sein muss (§§ 14 Abs. 2 FamFG, 130a, 298 ZPO)."
    },
    {
      "date": "2024-10-01",
      "original_text": "Registerbekanntmachung nach dem Umwandlungsgesetz\nBerlin Amtsgericht Berlin (Charlottenburg) HRB 240202\nPikes Peak Ventures UG (haftungsbeschränkt) – Berlin",
      "type": "Registerbekanntmachung nach dem Umwandlungsgesetz",
      "state": "Berlin",
      "amtsgericht": "Amtsgericht Berlin (Charlottenburg)",
      "registernummer": "HRB 240202",
      "registerart": "HRB",
      "company_name": "Pikes Peak Ventures UG (haftungsbeschränkt)",
      "company_seat": "Berlin",
      "details": "01.10.2024 (Bekanntmachungsdatum)\n\nBerlin Amtsgericht Berlin (Charlottenburg) HRB 240202\nRegisterbekanntmachung nach dem Umwandlungsgesetz 30.09.2024 (Eintragungsdatum)\n\nPikes Peak Ventures UG (haftungsbeschränkt)\nGesellschaft mit beschränkter Haftung\nBerlin\n\nZu Eintragungsnummer 2 vom 30.09.2024 wird als nicht eingetragen veröffentlicht:Den Gläubigern der an der Verschmelzung beteiligten Rechtsträger ist, wenn sie binnen sechs Monaten nach dem Tag, an dem die Eintragung der Verschmelzung in das Register des Sitzes desjenigen Rechtsträgers, dessen Gläubiger sie sind, als bekannt gemacht gilt, ihren Anspruch nach Grund und Höhe schriftlich anmelden, Sicherheit zu leisten, soweit sie nicht Befriedigung verlangen können. Dieses Recht steht den Gläubigern jedoch nur zu, wenn sie glaubhaft machen, dass durch die Verschmelzung die Erfüllung ihrer Forderung gefährdet wird. Das Recht, Sicherheitsleistung zu verlangen, steht Gläubigern nicht zu, die im Falle der Insolvenz ein Recht auf vorzugsweise Befriedigung aus einer Deckungsmasse haben, die nach gesetzlicher Vorschrift zu ihrem Schutz errichtet und staatlich überwacht ist."
    },
    {
      "date": "2024-10-01",
      "original_text": "Registerbekanntmachung nach dem Umwandlungsgesetz\nSachsen Amtsgericht Leipzig HRB 29927\nPrimaCom Berlin GmbH – Leipzig",
      "type": "Registerbekanntmachung nach dem Umwandlungsgesetz",
      "state": "Sachsen",
      "amtsgericht": "Amtsgericht Leipzig",
      "registernummer": "HRB 29927",
      "registerart": "HRB",
      "company_name": "PrimaCom Berlin GmbH",
      "company_seat": "Leipzig",
      "details": "01.10.2024 (Bekanntmachungsdatum)\n\nSachsen Amtsgericht Leipzig HRB 29927\nRegisterbekanntmachung nach dem Umwandlungsgesetz 01.10.2024 (Eintragungsdatum)\n\nPrimaCom Berlin GmbH\nGesellschaft mit beschränkter Haftung\nLeipzig\n\nDen Gläubigern der an der Verschmelzung beteiligten Rechtsträger ist, wenn sie binnen sechs Monaten nach dem Tag, an dem die Eintragung der Verschmelzung in das Register des Sitzes desjenigen Rechtsträgers, dessen Gläubiger sie sind, nach § 19 Abs. 3 UmwG als bekannt gemacht gilt, ihren Anspruch nach Grund und Höhe schriftlich anmelden, Sicherheit zu leisten, soweit sie nicht Befriedigung verlangen können. Dieses Recht steht den Gläubigern jedoch nur zu, wenn sie glaubhaft machen, dass durch die Verschmelzung die Erfüllung der Forderung gefährdet wird."
    },
    {
      "date": "2024-10-01",
      "original_text": "Registerbekanntmachung nach dem Umwandlungsgesetz\nSachsen Amtsgericht Leipzig HRB 28071\nPrimaCom Holding GmbH – Leipzig",
      "type": "Registerbekanntmachung nach dem Umwandlungsgesetz",
      "state": "Sachsen",
      "amtsgericht": "Amtsgericht Leipzig",
      "registernummer": "HRB 28071",
      "registerart": "HRB",
      "company_name": "PrimaCom Holding GmbH",
      "company_seat": "Leipzig",
      "details": "01.10.2024 (Bekanntmachungsdatum)\n\nSachsen Amtsgericht Leipzig HRB 28071\nRegisterbekanntmachung nach dem Umwandlungsgesetz 01.10.2024 (Eintragungsdatum)\n\nPrimaCom Holding GmbH\nGesellschaft mit beschränkter Haftung\nLeipzig\n\nDen Gläubigern der an der Verschmelzung beteiligten Rechtsträger ist, wenn sie binnen sechs Monaten nach dem Tag, an dem die Eintragung der Verschmelzung in das Register des Sitzes desjenigen Rechtsträgers, dessen Gläubiger sie sind, nach § 19 Abs. 3 UmwG als bekannt gemacht gilt, ihren Anspruch nach Grund und Höhe schriftlich anmelden, Sicherheit zu leisten, soweit sie nicht Befriedigung verlangen können. Dieses Recht steht den Gläubigern jedoch nur zu, wenn sie glaubhaft machen, dass durch die Verschmelzung die Erfüllung der Forderung gefährdet wird."
    },
    {
      "date": "2024-10-01",
      "original_text": "Löschungsankündigung\nHessen Amtsgericht Frankfurt am Main HRB 130637\nProLog Cargo Service GmbH – Kriftel",
      "type": "Löschungsankündigung",
      "state": "Hessen",
      "amtsgericht": "Amtsgericht Frankfurt am Main",
      "registernummer": "HRB 130637",
      "registerart": "HRB",
      "company_name": "ProLog Cargo Service GmbH",
      "company_seat": "Kriftel",
      "details": "01.10.2024 (Bekanntmachungsdatum)\n\nHessen Amtsgericht Frankfurt am Main HRB 130637\nLöschungsankündigung\n\nProLog Cargo Service GmbH\nGesellschaft mit beschränkter Haftung\nKriftel\n\nEs ist beabsichtigt die Gesellschaft wegen Vermögenslosigkeit gemäß § 394 FamFG von Amts wegen zu löschen. Hiergegen kann innerhalb eines Monats nach dieser Veröffentlichung Widerspruch bei dem Amtsgericht Frankfurt am Main eingelegt werden."
    },
    {
      "date": "2024-10-01",
      "original_text": "Löschungsankündigung\nRheinland-Pfalz Amtsgericht Landau HRB 32559\nQueichtal-Kartonagen UG (haftungsbeschränkt) – Landau in der Pfalz",
      "type": "Löschungsankündigung",
      "state": "Rheinland-Pfalz",
      "amtsgericht": "Amtsgericht Landau",
      "registernummer": "HRB 32559",
      "registerart": "HRB",
      "company_name": "Queichtal-Kartonagen UG (haftungsbeschränkt)",
      "company_seat": "Landau in der Pfalz",
      "details": "01.10.2024 (Bekanntmachungsdatum)\n\nRheinland-Pfalz Amtsgericht Landau HRB 32559\nLöschungsankündigung\n\nQueichtal-Kartonagen UG (haftungsbeschränkt)\nGesellschaft mit beschränkter Haftung\nLandau in der Pfalz\n\nDas Registergericht beabsichtigt die Gesellschaft von Amts wegen nach § 394 FamFG zu löschen. Die Frist zur Erhebung eines Widerspruchs ist auf einen Monat festgesetzt."
    },
    {
      "date": "2024-10-01",
      "original_text": "Registerbekanntmachung nach dem Umwandlungsgesetz\nHessen Amtsgericht Gießen HRA 5489\nR. & M. Will Bauunternehmen GmbH & Co. KG – Staufenberg",
      "type": "Registerbekanntmachung nach dem Umwandlungsgesetz",
      "state": "Hessen",
      "amtsgericht": "Amtsgericht Gießen",
      "registernummer": "HRA 5489",
      "registerart": "HRA",
      "company_name": "R. & M. Will Bauunternehmen GmbH & Co. KG",
      "company_seat": "Staufenberg",
      "details": "01.10.2024 (Bekanntmachungsdatum)\n\nHessen Amtsgericht Gießen HRA 5489\nRegisterbekanntmachung nach dem Umwandlungsgesetz 01.10.2024 (Eintragungsdatum)\n\nR. & M. Will Bauunternehmen GmbH & Co. KG\nKommanditgesellschaft\nStaufenberg\n\nDen Gläubigern der an der Ausgliederung beteiligten Rechtsträger ist, wenn sie binnen sechs Monaten nach dem Tag, an dem die Eintragung der Ausgliederung in das Register des Sitzes desjenigen Rechtsträgers, dessen Gläubiger sie sind, nach §§ 125, 19 Absatz 3 UmwG bekannt gemacht worden ist, ihren Anspruch nach Grund und Höhe schriftlich anmelden, Sicherheit zu leisten, soweit sie nicht Befriedigung verlangen können. Dieses Recht steht den Gläubigern jedoch nur zu, wenn sie glaubhaft machen, dass durch die Ausgliederung die Erfüllung ihrer Forderung gefährdet wird."
    },
    {
      "date": "2024-10-01",
      "original_text": "Registerbekanntmachung nach dem Umwandlungsgesetz\nHessen Amtsgericht Gießen HRA 2266\nR. & M. Will Bauunternehmen, Nachf. Matthias Will e. K. – Staufenberg",
      "type": "Registerbekanntmachung nach dem Umwandlungsgesetz",
      "state": "Hessen",
      "amtsgericht": "Amtsgericht Gießen",
      "registernummer": "HRA 2266",
      "registerart": "HRA",
      "company_name": "R. & M. Will Bauunternehmen, Nachf. Matthias Will e. K.",
      "company_seat": "Staufenberg",
      "details": "01.10.2024 (Bekanntmachungsdatum)\n\nHessen Amtsgericht Gießen HRA 2266\nRegisterbekanntmachung nach dem Umwandlungsgesetz 01.10.2024 (Eintragungsdatum)\n\nR. & M. Will Bauunternehmen, Nachf. Matthias Will e. K.\nEinzelkaufmann / Einzelkauffrau\nStaufenberg\n\nDen Gläubigern der an der Ausgliederung beteiligten Rechtsträger ist, wenn sie binnen sechs Monaten nach dem Tag, an dem die Eintragung der Ausgliederung in das Register des Sitzes desjenigen Rechtsträgers, dessen Gläubiger sie sind, nach §§ 125, 19 Absatz 3 UmwG bekannt gemacht worden ist, ihren Anspruch nach Grund und Höhe schriftlich anmelden, Sicherheit zu leisten, soweit sie nicht Befriedigung verlangen können. Dieses Recht steht den Gläubigern jedoch nur zu, wenn sie glaubhaft machen, dass durch die Ausgliederung die Erfüllung ihrer Forderung gefährdet wird."
    },
    {
      "date": "2024-10-01",
      "original_text": "Löschungsankündigung\nNordrhein-Westfalen Amtsgericht Wuppertal HRB 12458\nR. C. Mannesmann Armaturentechnik GmbH – Remscheid",
      "type": "Löschungsankündigung",
      "state": "Nordrhein-Westfalen",
      "amtsgericht": "Amtsgericht Wuppertal",
      "registernummer": "HRB 12458",
      "registerart": "HRB",
      "company_name": "R. C. Mannesmann Armaturentechnik GmbH",
      "company_seat": "Remscheid",
      "details": "01.10.2024 (Bekanntmachungsdatum)\n\nNordrhein-Westfalen Amtsgericht Wuppertal HRB 12458\nLöschungsankündigung 30.09.2024 (Eintragungsdatum)\n\nR. C. Mannesmann Armaturentechnik GmbH\nGesellschaft mit beschränkter Haftung\nRemscheid\n\nDas Registergericht beabsichtigt die Gesellschaft von Amts wegen nach § 394 FamFG zu löschen. Die Frist zur Erhebung eines Widerspruchs ist auf einen Monat festgesetzt."
    },
    {
      "date": "2024-10-01",
      "original_text": "Löschungsankündigung\nNordrhein-Westfalen Amtsgericht Neuss HRB 19206\nRD Management GmbH – Kaarst",
      "type": "Löschungsankündigung",
      "state": "Nordrhein-Westfalen",
      "amtsgericht": "Amtsgericht Neuss",
      "registernummer": "HRB 19206",
      "registerart": "HRB",
      "company_name": "RD Management GmbH",
      "company_seat": "Kaarst",
      "details": "01.10.2024 (Bekanntmachungsdatum)\n\nNordrhein-Westfalen Amtsgericht Neuss HRB 19206\nLöschungsankündigung 17.09.2024 (Eintragungsdatum)\n\nRD Management GmbH\nGesellschaft mit beschränkter Haftung\nKaarst\n\nDas Registergericht beabsichtigt die Gesellschaft von Amts wegen nach § 394 FamFG zu löschen. Die Frist zur Erhebung eines Widerspruchs ist auf einen Monat festgesetzt. Rechtsbehelfsbelehrung: Gegen diese Verfügung können Sie Widerspruch einlegen. Der Widerspruch ist bei dem Amtsgericht Neuss - Registergericht -, Breite Str. 48, 41460 Neuss schriftlich in deutscher Sprache oder zur Niederschrift der Geschäftsstelle einzulegen.Der Widerspruch kann auch zur Niederschrift der Geschäftsstelle eines jeden Amtsgerichtes abgegeben werden. Die Einlegung ist auch durch Übertragung eines elektronischen Dokuments an die elektronische Poststelle des Gerichts möglich. Das elektronische Dokument muss für die Bearbeitung durch das Gericht geeignet und mit einer qualifizierten elektronischen Signatur der verantwortenden Person versehen sein oder von der verantwortenden Person signiert und auf einem sicheren Übermittlungsweg gemäß § 130a ZPO nach näherer Maßgabe der Verordnung über die technischen Rahmenbedingungen des elektronischen Rechtsverkehrs und über das besondere elektronische Behördenpostfach (BGBl. I, S.3803) eingereicht werden. Weitere Informationen erhalten Sie auf der Internetseite www.justiz.de. Der Widerspruch muss spätestens innerhalb der gesetzten Frist nach der schriftlichen Bekanntgabe der Verfügung bei dem Amtsgericht - Registergericht - Neuss eingegangen sein. Dies gilt auch dann, wenn der Widerspruch zur Niederschrift der Geschäftsstelle eines anderen Amtsgerichtes abgegeben wurde. Die Frist beginnt mit der schriftlichen Bekanntgabe der Verfügung. Die Bekanntgabe ist entweder durch Zustellung oder am dritten Tage nach Aufgabe zur Post bewirkt. Fällt das Ende der Frist auf einen Sonntag, einen allgemeinen Feiertag oder Sonnabend, so endet die Frist mit Ablauf des nächsten Werktages. Der Widerspruch muss die Bezeichnung der angefochtenen Verfügung sowie die Erklärung enthalten, dass Widerspruch gegen diese Verfügung eingelegt wird. Er ist zu unterzeichnen und soll begründet werden."
    },
    {
      "date": "2024-10-01",
      "original_text": "Löschungsankündigung\nSachsen Amtsgericht Chemnitz HRB 32460\nREAL ESTATE 24 PRO GmbH – Oelsnitz/Vogtl.",
      "type": "Löschungsankündigung",
      "state": "Sachsen",
      "amtsgericht": "Amtsgericht Chemnitz",
      "registernummer": "HRB 32460",
      "registerart": "HRB",
      "company_name": "REAL ESTATE 24 PRO GmbH",
      "company_seat": "Oelsnitz/Vogtl.",
      "details": "01.10.2024 (Bekanntmachungsdatum)\n\nSachsen Amtsgericht Chemnitz HRB 32460\nLöschungsankündigung 01.10.2024 (Eintragungsdatum)\n\nREAL ESTATE 24 PRO GmbH\nGesellschaft mit beschränkter Haftung\nOelsnitz/Vogtl.\n\nDas Registergericht beabsichtigt, die im Handelsregister eingetragene Gesellschaft von Amts wegen nach § 394 FamFG zu löschen. Die Frist zu Erhebung eines Widerspruchs gegen die beabsichtigte Löschung wird auf einen Monat festgesetzt."
    },
    {
      "date": "2024-10-01",
      "original_text": "Löschungsankündigung\nSachsen Amtsgericht Dresden HRB 42824\nRM Bau GmbH – Dresden",
      "type": "Löschungsankündigung",
      "state": "Sachsen",
      "amtsgericht": "Amtsgericht Dresden",
      "registernummer": "HRB 42824",
      "registerart": "HRB",
      "company_name": "RM Bau GmbH",
      "company_seat": "Dresden",
      "details": "01.10.2024 (Bekanntmachungsdatum)\n\nSachsen Amtsgericht Dresden HRB 42824\nLöschungsankündigung\n\nRM Bau GmbH\nGesellschaft mit beschränkter Haftung\nDresden\n\nDas Registergericht beabsichtigt, die im Handelsregister eingetragene Gesellschaft von Amts wegen nach § 394 FamFG zu löschen. Die Frist zu Erhebung eines Widerspruchs gegen die beabsichtigte Löschung wird auf einen Monat festgesetzt."
    },
    {
      "date": "2024-10-01",
      "original_text": "Löschungsankündigung\nBrandenburg Amtsgericht Neuruppin HRB 14432\nRPS Steinbau GmbH Berlin – Templin",
      "type": "Löschungsankündigung",
      "state": "Brandenburg",
      "amtsgericht": "Amtsgericht Neuruppin",
      "registernummer": "HRB 14432",
      "registerart": "HRB",
      "company_name": "RPS Steinbau GmbH Berlin",
      "company_seat": "Templin",
      "details": "01.10.2024 (Bekanntmachungsdatum)\n\nBrandenburg Amtsgericht Neuruppin HRB 14432\nLöschungsankündigung\n\nRPS Steinbau GmbH Berlin\nGesellschaft mit beschränkter Haftung\nTemplin\n\nBei der nachstehenden Gesellschaft wird das Amtslöschungsverfahren gemäß § 394 FamFG eingeleitet.\nWiderspruchsfrist: 1 Monat"
    },
    {
      "date": "2024-10-01",
      "original_text": "Registerbekanntmachung nach dem Umwandlungsgesetz\nBayern Amtsgericht Augsburg HRB 7543\nRausch Verpackung GmbH – Augsburg",
      "type": "Registerbekanntmachung nach dem Umwandlungsgesetz",
      "state": "Bayern",
      "amtsgericht": "Amtsgericht Augsburg",
      "registernummer": "HRB 7543",
      "registerart": "HRB",
      "company_name": "Rausch Verpackung GmbH",
      "company_seat": "Augsburg",
      "details": "01.10.2024 (Bekanntmachungsdatum)\n\nBayern Amtsgericht Augsburg HRB 7543\nRegisterbekanntmachung nach dem Umwandlungsgesetz 30.09.2024 (Eintragungsdatum)\n\nRausch Verpackung GmbH\nGesellschaft mit beschränkter Haftung\nAugsburg\n\nDen Gläubigern der an der Verschmelzung beteiligten Rechtsträger ist, wenn sie binnen sechs Monaten nach dem Tag, an dem die Eintragung der Verschmelzung in das Register des Sitzes desjenigen Rechtsträgers, dessen Gläubiger sie sind, nach § 19 Abs. 3 UmwG als bekannt gemacht gilt, ihren Anspruch nach Grund und Höhe schriftlich anmelden, Sicherheit zu leisten, soweit sie nicht Befriedigung verlangen können. Dieses Recht steht den Gläubigern jedoch nur zu, wenn sie glaubhaft machen, dass durch die Verschmelzung die Erfüllung ihrer Forderung gefährdet wird."
    },
    {
      "date": "2024-10-01",
      "original_text": "Registerbekanntmachung nach dem Umwandlungsgesetz\nHessen Amtsgericht Wiesbaden HRB 32005\nRearden G Holdings Eins GmbH – Wiesbaden",
      "type": "Registerbekanntmachung nach dem Umwandlungsgesetz",
      "state": "Hessen",
      "amtsgericht": "Amtsgericht Wiesbaden",
      "registernummer": "HRB 32005",
      "registerart": "HRB",
      "company_name": "Rearden G Holdings Eins GmbH",
      "company_seat": "Wiesbaden",
      "details": "01.10.2024 (Bekanntmachungsdatum)\n\nHessen Amtsgericht Wiesbaden HRB 32005\nRegisterbekanntmachung nach dem Umwandlungsgesetz 01.10.2024 (Eintragungsdatum)\n\nRearden G Holdings Eins GmbH\nGesellschaft mit beschränkter Haftung\nWiesbaden\n\nDen Gläubigern der an der Verschmelzung beteiligten Rechtsträger ist, wenn sie binnen sechs Monaten nach dem Tag, an dem die Eintragung der Verschmelzung in das Register des Sitzes derjenigen Rechtsträger deren Gläubiger sie sind, nach § 19 Absatz 3 UmwG bekannt gemacht worden ist, ihren Anspruch nach Grund und Höhe schriftlich anmelden, Sicherheit zu leisten, soweit sie nicht Befriedigung verlangen können. Dieses Recht steht den Gläubigern jedoch nur zu, wenn sie glaubhaft machen, dass durch die Verschmelzung die Erfüllung ihrer Forderung gefährdet wird."
    },
    {
      "date": "2024-10-01",
      "original_text": "Registerbekanntmachung nach dem Umwandlungsgesetz\nNordrhein-Westfalen Amtsgericht Paderborn HRA 8726\nReisebüro Musshoff e.K. – Lippstadt",
      "type": "Registerbekanntmachung nach dem Umwandlungsgesetz",
      "state": "Nordrhein-Westfalen",
      "amtsgericht": "Amtsgericht Paderborn",
      "registernummer": "HRA 8726",
      "registerart": "HRA",
      "company_name": "Reisebüro Musshoff e.K.",
      "company_seat": "Lippstadt",
      "details": "01.10.2024 (Bekanntmachungsdatum)\n\nNordrhein-Westfalen Amtsgericht Paderborn HRA 8726\nRegisterbekanntmachung nach dem Umwandlungsgesetz 01.10.2024 (Eintragungsdatum)\n\nReisebüro Musshoff e.K.\nEinzelkaufmann / Einzelkauffrau\nLippstadt\n\nDen Gläubigern der an der Verschmelzung beteiligten Rechtsträger ist, wenn sie binnen sechs Monaten nach dem Tag, an dem die Eintragung der Verschmelzung in das Register des Sitzes desjenigen Rechtsträgers, dessen Gläubiger sie sind, nach § 19 Absatz 3 UmwG als bekanntgemacht gilt, ihren Anspruch nach Grund und Höhe schriftlich anmelden, Sicherheit zu leisten, soweit sie nicht Befriedigung verlangen können. Dieses Recht steht den Gläubigern jedoch nur zu, wenn sie glaubhaft machen, dass durch die Verschmelzung die Erfüllung ihrer Forderung gefährdet wird."
    },
    {
      "date": "2024-10-01",
      "original_text": "Registerbekanntmachung nach dem Umwandlungsgesetz\nBayern Amtsgericht Fürth HRB 8212\nRichard Köstner AG – Neustadt a.d.Aisch",
      "type": "Registerbekanntmachung nach dem Umwandlungsgesetz",
      "state": "Bayern",
      "amtsgericht": "Amtsgericht Fürth",
      "registernummer": "HRB 8212",
      "registerart": "HRB",
      "company_name": "Richard Köstner AG",
      "company_seat": "Neustadt a.d.Aisch",
      "details": "01.10.2024 (Bekanntmachungsdatum)\n\nBayern Amtsgericht Fürth HRB 8212\nRegisterbekanntmachung nach dem Umwandlungsgesetz 30.09.2024 (Eintragungsdatum)\n\nRichard Köstner AG\nAktiengesellschaft\nNeustadt a.d.Aisch\n\nDen Gläubigern der an der Ausgliederung beteiligten Rechtsträger ist, wenn sie binnen sechs Monaten nach dem Tag, an dem die Eintragung der Ausgliederung in das Register des Sitzes desjenigen Rechtsträgers, dessen Gläubiger sie sind, nach §§ 125, 19 Abs. 3 UmwG als bekannt gemacht gilt, ihren Anspruch nach Grund und Höhe schriftlich anmelden, Sicherheit zu leisten, soweit sie nicht Befriedigung verlangen können. Dieses Recht steht den Gläubigern jedoch nur zu, wenn sie glaubhaft machen, dass durch die Ausgliederung die Erfüllung ihrer Forderung gefährdet wird."
    },
    {
      "date": "2024-10-01",
      "original_text": "Registerbekanntmachung nach dem Umwandlungsgesetz\nBaden-Württemberg Amtsgericht Freiburg HRA 708655\nRomana Hübschle Hairartist e.Kfr. – Stockach",
      "type": "Registerbekanntmachung nach dem Umwandlungsgesetz",
      "state": "Baden-Württemberg",
      "amtsgericht": "Amtsgericht Freiburg",
      "registernummer": "HRA 708655",
      "registerart": "HRA",
      "company_name": "Romana Hübschle Hairartist e.Kfr.",
      "company_seat": "Stockach",
      "details": "01.10.2024 (Bekanntmachungsdatum)\n\nBaden-Württemberg Amtsgericht Freiburg HRA 708655\nRegisterbekanntmachung nach dem Umwandlungsgesetz 01.10.2024 (Eintragungsdatum)\n\nRomana Hübschle Hairartist e.Kfr.\nEinzelkaufmann / Einzelkauffrau\nStockach\n\nAls nicht eingetragen wird bekanntgemacht:\nDen Gläubigern der an der Ausgliederung beteiligten Rechtsträger ist, wenn sie binnen sechs Monaten nach dem Tag, an dem die Eintragung der Ausgliederung in das Register des Sitzes desjenigen Rechtsträgers, dessen Gläubiger sie sind, nach § 19 Abs. 3 UmwG als bekanntgemacht gilt, ihren Anspruch nach Grund und Höhe schriftlich anmelden, Sicherheit zu leisten, soweit sie nicht Befriedigung verlangen können. Dieses Recht steht den Gläubigern jedoch nur zu, wenn sie glaubhaft machen, dass durch die Ausgliederung die Erfüllung ihrer Forderung gefährdet wird."
    },
    {
      "date": "2024-10-01",
      "original_text": "Registerbekanntmachung nach dem Umwandlungsgesetz\nBerlin Amtsgericht Berlin (Charlottenburg) HRB 240270\nRome Medien GmbH – Berlin",
      "type": "Registerbekanntmachung nach dem Umwandlungsgesetz",
      "state": "Berlin",
      "amtsgericht": "Amtsgericht Berlin (Charlottenburg)",
      "registernummer": "HRB 240270",
      "registerart": "HRB",
      "company_name": "Rome Medien GmbH",
      "company_seat": "Berlin",
      "details": "01.10.2024 (Bekanntmachungsdatum)\n\nBerlin Amtsgericht Berlin (Charlottenburg) HRB 240270\nRegisterbekanntmachung nach dem Umwandlungsgesetz 27.09.2024 (Eintragungsdatum)\n\nRome Medien GmbH\nGesellschaft mit beschränkter Haftung\nBerlin\n\nZu Eintragungsnummer 4 vom 27.09.2024 wird als nicht eingetragen veröffentlicht: Den Gläubigern der an der Verschmelzung beteiligten Rechtsträger ist, wenn sie binnen sechs Monaten nach dem Tag, an dem die Eintragung der Verschmelzung in das Register des Sitzes desjenigen Rechtsträgers, dessen Gläubiger sie sind, als bekannt gemacht gilt, ihren Anspruch nach Grund und Höhe schriftlich anmelden, Sicherheit zu leisten, soweit sie nicht Befriedigung verlangen können. Dieses Recht steht den Gläubigern jedoch nur zu, wenn sie glaubhaft machen, dass durch die Verschmelzung die Erfüllung ihrer Forderung gefährdet wird. Das Recht, Sicherheitsleistung zu verlangen, steht Gläubigern nicht zu, die im Falle der Insolvenz ein Recht auf vorzugsweise Befriedigung aus einer Deckungsmasse haben, die nach gesetzlicher Vorschrift zu ihrem Schutz errichtet und staatlich überwacht ist."
    },
    {
      "date": "2024-10-01",
      "original_text": "Registerbekanntmachung nach dem Umwandlungsgesetz\nNordrhein-Westfalen Amtsgericht Köln HRB 118809\nSHS Sanierung und Handwerk GmbH – Wermelskirchen",
      "type": "Registerbekanntmachung nach dem Umwandlungsgesetz",
      "state": "Nordrhein-Westfalen",
      "amtsgericht": "Amtsgericht Köln",
      "registernummer": "HRB 118809",
      "registerart": "HRB",
      "company_name": "SHS Sanierung und Handwerk GmbH",
      "company_seat": "Wermelskirchen",
      "details": "01.10.2024 (Bekanntmachungsdatum)\n\nNordrhein-Westfalen Amtsgericht Köln HRB 118809\nRegisterbekanntmachung nach dem Umwandlungsgesetz 01.10.2024 (Eintragungsdatum)\n\nSHS Sanierung und Handwerk GmbH\nGesellschaft mit beschränkter Haftung\nWermelskirchen\n\nDen Gläubigern der an der Ausgliederung beteiligten Rechtsträger ist, wenn sie binnen sechs Monaten nach dem Tag, an dem die Eintragung der Ausgliederung in das Register des Sitzes derjenigen Rechtsträger deren Gläubiger sie sind, nach § 19 Absatz 3 UmwG als bekanntgemacht gilt, ihren Anspruch nach Grund und Höhe schriftlich anmelden, Sicherheit zu leisten, soweit sie nicht Befriedigung verlangen können. Dieses Recht steht den Gläubigern jedoch nur zu, wenn sie glaubhaft machen, dass durch die Ausgliederung die Erfüllung ihrer Forderung gefährdet wird."
    },
    {
      "date": "2024-10-01",
      "original_text": "Registerbekanntmachung nach dem Umwandlungsgesetz\nBaden-Württemberg Amtsgericht Stuttgart HRB 796557\nSN Wärme und Sanitärtechnik GmbH – Aspach",
      "type": "Registerbekanntmachung nach dem Umwandlungsgesetz",
      "state": "Baden-Württemberg",
      "amtsgericht": "Amtsgericht Stuttgart",
      "registernummer": "HRB 796557",
      "registerart": "HRB",
      "company_name": "SN Wärme und Sanitärtechnik GmbH",
      "company_seat": "Aspach",
      "details": "01.10.2024 (Bekanntmachungsdatum)\n\nBaden-Württemberg Amtsgericht Stuttgart HRB 796557\nRegisterbekanntmachung nach dem Umwandlungsgesetz 01.10.2024 (Eintragungsdatum)\n\nSN Wärme und Sanitärtechnik GmbH\nGesellschaft mit beschränkter Haftung\nAspach\n\nDen Gläubigern der an der Ausgliederung beteiligten Rechtsträger ist, wenn sie binnen sechs Monaten nach dem Tag, an dem die Eintragung der Ausgliederung in das Register des Sitzes desjenigen Rechtsträgers, dessen Gläubiger sie sind, nach § 19 Abs. 3 UmwG als bekanntgemacht gilt, ihren Anspruch nach Grund und Höhe schriftlich anmelden, Sicherheit zu leisten, soweit sie nicht Befriedigung verlangen können. Dieses Recht steht den Gläubigern jedoch nur zu, wenn sie glaubhaft machen, dass durch die Ausgliederung die Erfüllung ihrer Forderung gefährdet wird."
    },
    {
      "date": "2024-10-01",
      "original_text": "Registerbekanntmachung nach dem Umwandlungsgesetz\nBaden-Württemberg Amtsgericht Stuttgart HRA 741663\nSN Wärme und Sanitärtechnik e.K. – Aspach",
      "type": "Registerbekanntmachung nach dem Umwandlungsgesetz",
      "state": "Baden-Württemberg",
      "amtsgericht": "Amtsgericht Stuttgart",
      "registernummer": "HRA 741663",
      "registerart": "HRA",
      "company_name": "SN Wärme und Sanitärtechnik e.K.",
      "company_seat": "Aspach",
      "details": "01.10.2024 (Bekanntmachungsdatum)\n\nBaden-Württemberg Amtsgericht Stuttgart HRA 741663\nRegisterbekanntmachung nach dem Umwandlungsgesetz 01.10.2024 (Eintragungsdatum)\n\nSN Wärme und Sanitärtechnik e.K.\nEinzelkaufmann / Einzelkauffrau\nAspach\n\nDen Gläubigern der an der Ausgliederung beteiligten Rechtsträger ist, wenn sie binnen sechs Monaten nach dem Tag, an dem die Eintragung der Ausgliederung in das Register des Sitzes desjenigen Rechtsträgers, dessen Gläubiger sie sind, nach § 19 Abs. 3 UmwG als bekanntgemacht gilt, ihren Anspruch nach Grund und Höhe schriftlich anmelden, Sicherheit zu leisten, soweit sie nicht Befriedigung verlangen können. Dieses Recht steht den Gläubigern jedoch nur zu, wenn sie glaubhaft machen, dass durch die Ausgliederung die Erfüllung ihrer Forderung gefährdet wird."
    },
    {
      "date": "2024-10-01",
      "original_text": "Löschungsankündigung\nNordrhein-Westfalen Amtsgericht Neuss HRB 19175\nSP eCommerce GmbH – Neuss",
      "type": "Löschungsankündigung",
      "state": "Nordrhein-Westfalen",
      "amtsgericht": "Amtsgericht Neuss",
      "registernummer": "HRB 19175",
      "registerart": "HRB",
      "company_name": "SP eCommerce GmbH",
      "company_seat": "Neuss",
      "details": "01.10.2024 (Bekanntmachungsdatum)\n\nNordrhein-Westfalen Amtsgericht Neuss HRB 19175\nLöschungsankündigung 16.09.2024 (Eintragungsdatum)\n\nSP eCommerce GmbH\nGesellschaft mit beschränkter Haftung\nNeuss\n\nDas Registergericht beabsichtigt die Gesellschaft von Amts wegen nach § 394 FamFG zu löschen. Die Frist zur Erhebung eines Widerspruchs ist auf einen Monat festgesetzt. Rechtsbehelfsbelehrung: Gegen diese Verfügung können Sie Widerspruch einlegen. Der Widerspruch ist bei dem Amtsgericht Neuss - Registergericht -, Breite Str. 48, 41460 Neuss schriftlich in deutscher Sprache oder zur Niederschrift der Geschäftsstelle einzulegen. Der Widerspruch kann auch zur Niederschrift der Geschäftsstelle eines jeden Amtsgerichtes abgegeben werden. Die Einlegung ist auch durch Übertragung eines elektronischen Dokuments an die elektronische Poststelle des Gerichts möglich. Das elektronische Dokument muss für die Bearbeitung durch das Gericht geeignet und mit einer qualifizierten elektronischen Signatur der verantwortenden Person versehen sein oder von der verantwortenden Person signiert und auf einem sicheren Übermittlungsweg gemäß § 130a ZPO nach näherer Maßgabe der Verordnung über die technischen Rahmenbedingungen des elektronischen Rechtsverkehrs und über das besondere elektronische Behördenpostfach (BGBl. I, S.3803) eingereicht werden. Weitere Informationen erhalten Sie auf der Internetseite www.justiz.de. Der Widerspruch muss spätestens innerhalb der gesetzten Frist nach der schriftlichen Bekanntgabe der Verfügung bei dem Amtsgericht - Registergericht - Neuss eingegangen sein. Dies gilt auch dann, wenn der Widerspruch zur Niederschrift der Geschäftsstelle eines anderen Amtsgerichtes abgegeben wurde. Die Frist beginnt mit der schriftlichen Bekanntgabe der Verfügung. Die Bekanntgabe ist entweder durch Zustellung oder am dritten Tage nach Aufgabe zur Post bewirkt. Fällt das Ende der Frist auf einen Sonntag, einen allgemeinen Feiertag oder Sonnabend, so endet die Frist mit Ablauf des nächsten Werktages. Der Widerspruch muss die Bezeichnung der angefochtenen Verfügung sowie die Erklärung enthalten, dass Widerspruch gegen diese Verfügung eingelegt wird. Er ist zu unterzeichnen und soll begründet werden."
    },
    {
      "date": "2024-10-01",
      "original_text": "Registerbekanntmachung nach dem Umwandlungsgesetz\nNiedersachsen Amtsgericht Osnabrück HRB 215181\nSPIE OSMO GmbH – Georgsmarienhütte",
      "type": "Registerbekanntmachung nach dem Umwandlungsgesetz",
      "state": "Niedersachsen",
      "amtsgericht": "Amtsgericht Osnabrück",
      "registernummer": "HRB 215181",
      "registerart": "HRB",
      "company_name": "SPIE OSMO GmbH",
      "company_seat": "Georgsmarienhütte",
      "details": "01.10.2024 (Bekanntmachungsdatum)\n\nNiedersachsen Amtsgericht Osnabrück HRB 215181\nRegisterbekanntmachung nach dem Umwandlungsgesetz 01.10.2024 (Eintragungsdatum)\n\nSPIE OSMO GmbH\nGesellschaft mit beschränkter Haftung\nGeorgsmarienhütte\n\nDen Gläubigern der an der Verschmelzung beteiligten Rechtsträger ist, wenn sie binnen sechs Monaten nach dem Tag, an dem die Eintragung der Verschmelzung in das Register des Sitzes desjenigen Rechtsträgers, dessen Gläubiger sie sind, nach § 19  Abs.  3 UmwG als bekannt gemacht gilt, ihren Anspruch nach Grund und Höhe schriftlich anmelden, Sicherheit zu leisten, soweit sie nicht Befriedigung verlangen können. Dieses Recht steht den Gläubigern jedoch nur zu, wenn sie glaubhaft machen, dass durch die Verschmelzung die Erfüllung der Forderung gefährdet wird."
    },
    {
      "date": "2024-10-01",
      "original_text": "Einreichung neuer Dokumente\nRheinland-Pfalz Amtsgericht Kaiserslautern HRB 2627\nSWK Stadtwerke Kaiserslautern GmbH – Kaiserslautern",
      "type": "Einreichung neuer Dokumente",
      "state": "Rheinland-Pfalz",
      "amtsgericht": "Amtsgericht Kaiserslautern",
      "registernummer": "HRB 2627",
      "registerart": "HRB",
      "company_name": "SWK Stadtwerke Kaiserslautern GmbH",
      "company_seat": "Kaiserslautern",
      "details": "01.10.2024 (Bekanntmachungsdatum)\n\nRheinland-Pfalz Amtsgericht Kaiserslautern HRB 2627\nEinreichung neuer Dokumente\n\nSWK Stadtwerke Kaiserslautern GmbH\nGesellschaft mit beschränkter Haftung\nKaiserslautern\n\nDem Registergericht ist eine neue Liste der Mitglieder des Aufsichtsrates eingereicht worden."
    },
    {
      "date": "2024-10-01",
      "original_text": "Einreichung neuer Dokumente\nRheinland-Pfalz Amtsgericht Kaiserslautern HRB 2628\nSWK Stadtwerke Kaiserslautern Verkehrs-AG – Kaiserslautern",
      "type": "Einreichung neuer Dokumente",
      "state": "Rheinland-Pfalz",
      "amtsgericht": "Amtsgericht Kaiserslautern",
      "registernummer": "HRB 2628",
      "registerart": "HRB",
      "company_name": "SWK Stadtwerke Kaiserslautern Verkehrs-AG",
      "company_seat": "Kaiserslautern",
      "details": "01.10.2024 (Bekanntmachungsdatum)\n\nRheinland-Pfalz Amtsgericht Kaiserslautern HRB 2628\nEinreichung neuer Dokumente 01.10.2024 (Eintragungsdatum)\n\nSWK Stadtwerke Kaiserslautern Verkehrs-AG\nAktiengesellschaft\nKaiserslautern\n\nDem Registergericht ist eine neue Liste der Mitglieder des Aufsichtsrates eingereicht worden."
    },
    {
      "date": "2024-10-01",
      "original_text": "Löschungsankündigung\nBerlin Amtsgericht Berlin (Charlottenburg) HRB 203567\nSafran & Lucky GmbH – Berlin",
      "type": "Löschungsankündigung",
      "state": "Berlin",
      "amtsgericht": "Amtsgericht Berlin (Charlottenburg)",
      "registernummer": "HRB 203567",
      "registerart": "HRB",
      "company_name": "Safran & Lucky GmbH",
      "company_seat": "Berlin",
      "details": "01.10.2024 (Bekanntmachungsdatum)\n\nBerlin Amtsgericht Berlin (Charlottenburg) HRB 203567\nLöschungsankündigung\n\nSafran & Lucky GmbH\nGesellschaft mit beschränkter Haftung\nBerlin\n\nBei der nachstehenden Gesellschaft wird das Amtslöschungsverfahren gemäß § 394 FamFG eingeleitet. Widerspruchsfrist 6 Wochen"
    },
    {
      "date": "2024-10-01",
      "original_text": "Einreichung neuer Dokumente\nNordrhein-Westfalen Amtsgericht Steinfurt HRB 3009\nSchmitz Cargobull Aktiengesellschaft – Altenberge",
      "type": "Einreichung neuer Dokumente",
      "state": "Nordrhein-Westfalen",
      "amtsgericht": "Amtsgericht Steinfurt",
      "registernummer": "HRB 3009",
      "registerart": "HRB",
      "company_name": "Schmitz Cargobull Aktiengesellschaft",
      "company_seat": "Altenberge",
      "details": "01.10.2024 (Bekanntmachungsdatum)\n\nNordrhein-Westfalen Amtsgericht Steinfurt HRB 3009\nEinreichung neuer Dokumente 01.10.2024 (Eintragungsdatum)\n\nSchmitz Cargobull Aktiengesellschaft\nAktiengesellschaft\nAltenberge\n\nDem Registergericht ist eine neue Liste der Mitglieder des Aufsichtsrates eingereicht worden."
    },
    {
      "date": "2024-10-01",
      "original_text": "Registerbekanntmachung nach dem Umwandlungsgesetz\nBaden-Württemberg Amtsgericht Stuttgart HRA 741725\nSigmaVentures Investments GmbH & Co. KG – St. Johann",
      "type": "Registerbekanntmachung nach dem Umwandlungsgesetz",
      "state": "Baden-Württemberg",
      "amtsgericht": "Amtsgericht Stuttgart",
      "registernummer": "HRA 741725",
      "registerart": "HRA",
      "company_name": "SigmaVentures Investments GmbH & Co. KG",
      "company_seat": "St. Johann",
      "details": "01.10.2024 (Bekanntmachungsdatum)\n\nBaden-Württemberg Amtsgericht Stuttgart HRA 741725\nRegisterbekanntmachung nach dem Umwandlungsgesetz 01.10.2024 (Eintragungsdatum)\n\nSigmaVentures Investments GmbH & Co. KG\nKommanditgesellschaft\nSt. Johann\n\nAls nicht eingetragen wird bekanntgemacht:\nDen Gläubigern der an der Abspaltung beteiligten Rechtsträger ist, wenn sie binnen sechs Monaten nach dem Tag, an dem die Eintragung der Abspaltung in das Register des Sitzes desjenigen Rechtsträgers, dessen Gläubiger sie sind, nach § 19 Abs. 3 UmwG als bekanntgemacht gilt, ihren Anspruch nach Grund und Höhe schriftlich anmelden, Sicherheit zu leisten, soweit sie nicht Befriedigung verlangen können. Dieses Recht steht den Gläubigern jedoch nur zu, wenn sie glaubhaft machen, dass durch die Abspaltung die Erfüllung ihrer Forderung gefährdet wird."
    },
    {
      "date": "2024-10-01",
      "original_text": "Löschungsankündigung\nHessen Amtsgericht Frankfurt am Main HRB 127139\nSinobad Marketing GmbH – Frankfurt am Main",
      "type": "Löschungsankündigung",
      "state": "Hessen",
      "amtsgericht": "Amtsgericht Frankfurt am Main",
      "registernummer": "HRB 127139",
      "registerart": "HRB",
      "company_name": "Sinobad Marketing GmbH",
      "company_seat": "Frankfurt am Main",
      "details": "01.10.2024 (Bekanntmachungsdatum)\n\nHessen Amtsgericht Frankfurt am Main HRB 127139\nLöschungsankündigung\n\nSinobad Marketing GmbH\nGesellschaft mit beschränkter Haftung\nFrankfurt am Main\n\nEs ist beabsichtigt die Gesellschaft wegen Vermögenslosigkeit gemäß § 394 FamFG von Amts wegen zu löschen. Hiergegen kann innerhalb eines Monats nach dieser Veröffentlichung Widerspruch bei dem Amtsgericht Frankfurt am Main eingelegt werden."
    },
    {
      "date": "2024-10-01",
      "original_text": "Registerbekanntmachung nach dem Umwandlungsgesetz\nNordrhein-Westfalen Amtsgericht Aachen HRB 560\nStadtwerke Aachen Aktiengesellschaft – Aachen",
      "type": "Registerbekanntmachung nach dem Umwandlungsgesetz",
      "state": "Nordrhein-Westfalen",
      "amtsgericht": "Amtsgericht Aachen",
      "registernummer": "HRB 560",
      "registerart": "HRB",
      "company_name": "Stadtwerke Aachen Aktiengesellschaft",
      "company_seat": "Aachen",
      "details": "01.10.2024 (Bekanntmachungsdatum)\n\nNordrhein-Westfalen Amtsgericht Aachen HRB 560\nRegisterbekanntmachung nach dem Umwandlungsgesetz 01.10.2024 (Eintragungsdatum)\n\nStadtwerke Aachen Aktiengesellschaft\nAktiengesellschaft\nAachen\n\nDen Gläubigern der an der Ausgliederung beteiligten Rechtsträger ist, wenn sie binnen sechs Monaten nach dem Tag, an dem die Eintragung der Ausgliederung in das Register des Sitzes desjenigen Rechtsträgers, dessen Gläubiger sie sind, nach § 19 Absatz 3 UmwG als bekanntgemacht gilt, ihren Anspruch nach Grund und Höhe schriftlich anmelden, Sicherheit zu leisten, soweit sie nicht Befriedigung verlangen können. Dieses Recht steht den Gläubigern jedoch nur zu, wenn sie glaubhaft machen, dass durch die Ausgliederung die Erfüllung ihrer Forderung gefährdet wird."
    },
    {
      "date": "2024-10-01",
      "original_text": "Registerbekanntmachung nach dem Umwandlungsgesetz\nNordrhein-Westfalen Amtsgericht Düsseldorf HRA 27812\nStatkraft WP 2 GmbH & Co. KG – Düsseldorf",
      "type": "Registerbekanntmachung nach dem Umwandlungsgesetz",
      "state": "Nordrhein-Westfalen",
      "amtsgericht": "Amtsgericht Düsseldorf",
      "registernummer": "HRA 27812",
      "registerart": "HRA",
      "company_name": "Statkraft WP 2 GmbH & Co. KG",
      "company_seat": "Düsseldorf",
      "details": "01.10.2024 (Bekanntmachungsdatum)\n\nNordrhein-Westfalen Amtsgericht Düsseldorf HRA 27812\nRegisterbekanntmachung nach dem Umwandlungsgesetz 01.10.2024 (Eintragungsdatum)\n\nStatkraft WP 2 GmbH & Co. KG\nKommanditgesellschaft\nDüsseldorf\n\nDen Gläubigern der an der Abspaltung beteiligten Rechtsträger ist, wenn sie binnen sechs Monaten nach dem Tag, an dem die Eintragung der Abspaltung in das Register des Sitzes desjenigen Rechtsträgers, dessen Gläubiger sie sind, nach § 19 Absatz 3 UmwG als bekanntgemacht gilt, ihren Anspruch nach Grund und Höhe schriftlich anmelden, Sicherheit zu leisten, soweit sie nicht Befriedigung verlangen können. Dieses Recht steht den Gläubigern jedoch nur zu, wenn sie glaubhaft machen, dass durch die Abspaltung die Erfüllung ihrer Forderung gefährdet wird."
    },
    {
      "date": "2024-10-01",
      "original_text": "Registerbekanntmachung nach dem Umwandlungsgesetz\nNordrhein-Westfalen Amtsgericht Düsseldorf HRA 27812\nStatkraft WP 2 GmbH & Co. KG – Düsseldorf",
      "type": "Registerbekanntmachung nach dem Umwandlungsgesetz",
      "state": "Nordrhein-Westfalen",
      "amtsgericht": "Amtsgericht Düsseldorf",
      "registernummer": "HRA 27812",
      "registerart": "HRA",
      "company_name": "Statkraft WP 2 GmbH & Co. KG",
      "company_seat": "Düsseldorf",
      "details": "01.10.2024 (Bekanntmachungsdatum)\n\nNordrhein-Westfalen Amtsgericht Düsseldorf HRA 27812\nRegisterbekanntmachung nach dem Umwandlungsgesetz 01.10.2024 (Eintragungsdatum)\n\nStatkraft WP 2 GmbH & Co. KG\nKommanditgesellschaft\nDüsseldorf\n\nDen Gläubigern der an der Abspaltung beteiligten Rechtsträger ist, wenn sie binnen sechs Monaten nach dem Tag, an dem die Eintragung der Abspaltung in das Register des Sitzes desjenigen Rechtsträgers, dessen Gläubiger sie sind, nach § 19 Absatz 3 UmwG als bekanntgemacht gilt, ihren Anspruch nach Grund und Höhe schriftlich anmelden, Sicherheit zu leisten, soweit sie nicht Befriedigung verlangen können. Dieses Recht steht den Gläubigern jedoch nur zu, wenn sie glaubhaft machen, dass durch die Abspaltung die Erfüllung ihrer Forderung gefährdet wird."
    },
    {
      "date": "2024-10-01",
      "original_text": "Registerbekanntmachung nach dem Umwandlungsgesetz\nNordrhein-Westfalen Amtsgericht Köln HRA 34575\nStinn Spezialtransporte e.K. – Overath",
      "type": "Registerbekanntmachung nach dem Umwandlungsgesetz",
      "state": "Nordrhein-Westfalen",
      "amtsgericht": "Amtsgericht Köln",
      "registernummer": "HRA 34575",
      "registerart": "HRA",
      "company_name": "Stinn Spezialtransporte e.K.",
      "company_seat": "Overath",
      "details": "01.10.2024 (Bekanntmachungsdatum)\n\nNordrhein-Westfalen Amtsgericht Köln HRA 34575\nRegisterbekanntmachung nach dem Umwandlungsgesetz 01.10.2024 (Eintragungsdatum)\n\nStinn Spezialtransporte e.K.\nEinzelkaufmann / Einzelkauffrau\nOverath\n\nDen Gläubigern der an der Ausgliederung beteiligten Rechtsträger ist, wenn sie binnen sechs Monaten nach dem Tag, an dem die Eintragung der Ausgliederung in das Register des Sitzes derjenigen Rechtsträger deren Gläubiger sie sind, nach § 19 Absatz 3 UmwG als bekanntgemacht gilt, ihren Anspruch nach Grund und Höhe schriftlich anmelden, Sicherheit zu leisten, soweit sie nicht Befriedigung verlangen können. Dieses Recht steht den Gläubigern jedoch nur zu, wenn sie glaubhaft machen, dass durch die Ausgliederung die Erfüllung ihrer Forderung gefährdet wird."
    },
    {
      "date": "2024-10-01",
      "original_text": "Registerbekanntmachung nach dem Umwandlungsgesetz\nNordrhein-Westfalen Amtsgericht Bonn HRB 13963\nSulzer Flow Germany GmbH – Bonn",
      "type": "Registerbekanntmachung nach dem Umwandlungsgesetz",
      "state": "Nordrhein-Westfalen",
      "amtsgericht": "Amtsgericht Bonn",
      "registernummer": "HRB 13963",
      "registerart": "HRB",
      "company_name": "Sulzer Flow Germany GmbH",
      "company_seat": "Bonn",
      "details": "01.10.2024 (Bekanntmachungsdatum)\n\nNordrhein-Westfalen Amtsgericht Bonn HRB 13963\nRegisterbekanntmachung nach dem Umwandlungsgesetz 01.10.2024 (Eintragungsdatum)\n\nSulzer Flow Germany GmbH\nGesellschaft mit beschränkter Haftung\nBonn\n\nDen Gläubigern der an der Verschmelzung beteiligten Rechtsträger ist, wenn sie binnen sechs Monaten nach dem Tag, an dem die Eintragung der Verschmelzung in das Register des Sitzes desjenigen Rechtsträgers, dessen Gläubiger sie sind, nach § 19 Absatz 3 UmwG als bekanntgemacht gilt, ihren Anspruch nach Grund und Höhe schriftlich anmelden, Sicherheit zu leisten, soweit sie nicht Befriedigung verlangen können. Dieses Recht steht den Gläubigern jedoch nur zu, wenn sie glaubhaft machen, dass durch die Verschmelzung die Erfüllung ihrer Forderung gefährdet wird."
    },
    {
      "date": "2024-10-01",
      "original_text": "Löschungsankündigung\nSachsen Amtsgericht Chemnitz HRB 18054\nTB Hotelbetriebsgesellschaft mbH – Chemnitz",
      "type": "Löschungsankündigung",
      "state": "Sachsen",
      "amtsgericht": "Amtsgericht Chemnitz",
      "registernummer": "HRB 18054",
      "registerart": "HRB",
      "company_name": "TB Hotelbetriebsgesellschaft mbH",
      "company_seat": "Chemnitz",
      "details": "01.10.2024 (Bekanntmachungsdatum)\n\nSachsen Amtsgericht Chemnitz HRB 18054\nLöschungsankündigung\n\nTB Hotelbetriebsgesellschaft mbH\nGesellschaft mit beschränkter Haftung\nChemnitz\n\nDas Registergericht beabsichtigt, die im Handelsregister eingetragene Gesellschaft von Amts wegen nach § 394 FamFG zu löschen. Die Frist zu Erhebung eines Widerspruchs gegen die beabsichtigte Löschung wird auf einen Monat festgesetzt."
    },
    {
      "date": "2024-10-01",
      "original_text": "Registerbekanntmachung nach dem Umwandlungsgesetz\nHessen Amtsgericht Darmstadt HRB 9330\nTB INTERNATIONAL GmbH – Ober-Ramstadt",
      "type": "Registerbekanntmachung nach dem Umwandlungsgesetz",
      "state": "Hessen",
      "amtsgericht": "Amtsgericht Darmstadt",
      "registernummer": "HRB 9330",
      "registerart": "HRB",
      "company_name": "TB INTERNATIONAL GmbH",
      "company_seat": "Ober-Ramstadt",
      "details": "01.10.2024 (Bekanntmachungsdatum)\n\nHessen Amtsgericht Darmstadt HRB 9330\nRegisterbekanntmachung nach dem Umwandlungsgesetz 01.10.2024 (Eintragungsdatum)\n\nTB INTERNATIONAL GmbH\nGesellschaft mit beschränkter Haftung\nOber-Ramstadt\n\nDen Gläubigern der an der Verschmelzung beteiligten Rechtsträger ist, wenn sie binnen sechs Monaten nach dem Tag, an dem die Eintragung der Verschmelzung in das Register des Sitzes desjenigen Rechtsträgers, dessen Gläubiger sie sind, nach § 19 Absatz 3 UmwG bekannt gemacht worden ist, ihren Anspruch nach Grund und Höhe schriftlich anmelden, Sicherheit zu leisten, soweit sie nicht Befriedigung verlangen können. Dieses Recht steht den Gläubigern jedoch nur zu, wenn sie glaubhaft machen, dass durch die Verschmelzung die Erfüllung ihrer Forderung gefährdet wird."
    },
    {
      "date": "2024-10-01",
      "original_text": "Registerbekanntmachung nach dem Umwandlungsgesetz\nRheinland-Pfalz Amtsgericht Ludwigshafen a.Rhein (Ludwigshafen) HRB 64299\nTWL Vertrieb GmbH – Ludwigshafen",
      "type": "Registerbekanntmachung nach dem Umwandlungsgesetz",
      "state": "Rheinland-Pfalz",
      "amtsgericht": "Amtsgericht Ludwigshafen a.Rhein (Ludwigshafen)",
      "registernummer": "HRB 64299",
      "registerart": "HRB",
      "company_name": "TWL Vertrieb GmbH",
      "company_seat": "Ludwigshafen",
      "details": "01.10.2024 (Bekanntmachungsdatum)\n\nRheinland-Pfalz Amtsgericht Ludwigshafen a.Rhein (Ludwigshafen) HRB 64299\nRegisterbekanntmachung nach dem Umwandlungsgesetz 01.10.2024 (Eintragungsdatum)\n\nTWL Vertrieb GmbH\nGesellschaft mit beschränkter Haftung\nLudwigshafen\n\nAls nicht eingetragen wird veröffentlicht: Den Gläubigern der an der Verschmelzung beteiligten Rechtsträger ist, wenn sie binnen sechs Monaten nach dem Tag, an dem die Eintragung der Verschmelzung in das Register des Sitzes desjenigen Rechtsträgers, dessen Gläubiger sie sind, nach § 19 Abs. 3 UmwG als bekannt gemacht gilt, ihren Anspruch nach Grund und Höhe schriftlich anmelden, Sicherheit zu leisten, soweit sie nicht Befriedigung verlangen können. Dieses Recht steht den Gläubigern jedoch nur zu, wenn sie glaubhaft machen, dass durch die Verschmelzung die Erfüllung der Forderung gefährdet wird."
    },
    {
      "date": "2024-10-01",
      "original_text": "Registerbekanntmachung nach dem Umwandlungsgesetz\nRheinland-Pfalz Amtsgericht Ludwigshafen a.Rhein (Ludwigshafen) HRB 1562\nTechnische Werke Ludwigshafen am Rhein Aktiengesellschaft – Ludwigshafen a. Rh.",
      "type": "Registerbekanntmachung nach dem Umwandlungsgesetz",
      "state": "Rheinland-Pfalz",
      "amtsgericht": "Amtsgericht Ludwigshafen a.Rhein (Ludwigshafen)",
      "registernummer": "HRB 1562",
      "registerart": "HRB",
      "company_name": "Technische Werke Ludwigshafen am Rhein Aktiengesellschaft",
      "company_seat": "Ludwigshafen a. Rh.",
      "details": "01.10.2024 (Bekanntmachungsdatum)\n\nRheinland-Pfalz Amtsgericht Ludwigshafen a.Rhein (Ludwigshafen) HRB 1562\nRegisterbekanntmachung nach dem Umwandlungsgesetz 01.10.2024 (Eintragungsdatum)\n\nTechnische Werke Ludwigshafen am Rhein Aktiengesellschaft\nAktiengesellschaft\nLudwigshafen a. Rh.\n\nAls nicht eingetragen wird veröffentlicht: Den Gläubigern der an der Verschmelzung beteiligten Rechtsträger ist, wenn sie binnen sechs Monaten nach dem Tag, an dem die Eintragung der Verschmelzung in das Register des Sitzes desjenigen Rechtsträgers, dessen Gläubiger sie sind, nach § 19 Abs. 3 UmwG als bekannt gemacht gilt, ihren Anspruch nach Grund und Höhe schriftlich anmelden, Sicherheit zu leisten, soweit sie nicht Befriedigung verlangen können. Dieses Recht steht den Gläubigern jedoch nur zu, wenn sie glaubhaft machen, dass durch die Verschmelzung die Erfüllung der Forderung gefährdet wird."
    },
    {
      "date": "2024-10-01",
      "original_text": "Löschungsankündigung\nBayern Amtsgericht Coburg HRB 6744\nTerrasol-Energy GmbH – Lichtenfels",
      "type": "Löschungsankündigung",
      "state": "Bayern",
      "amtsgericht": "Amtsgericht Coburg",
      "registernummer": "HRB 6744",
      "registerart": "HRB",
      "company_name": "Terrasol-Energy GmbH",
      "company_seat": "Lichtenfels",
      "details": "01.10.2024 (Bekanntmachungsdatum)\n\nBayern Amtsgericht Coburg HRB 6744\nLöschungsankündigung 30.09.2024 (Eintragungsdatum)\n\nTerrasol-Energy GmbH\nGesellschaft mit beschränkter Haftung\nLichtenfels\n\nDas Registergericht beabsichtigt, die im Handelsregister eingetragene Gesellschaft wegen Vermögenslosigkeit von Amts wegen nach § 394 FamFG zu löschen. Die Frist zur Erhebung eines Widerspruchs ist auf sechs Wochen festgesetzt."
    },
    {
      "date": "2024-10-01",
      "original_text": "Sonstige Registerbekanntmachung\nBaden-Württemberg Amtsgericht Stuttgart HRB 763158\nTriStyle Brands GmbH – Winterbach",
      "type": "Sonstige Registerbekanntmachung",
      "state": "Baden-Württemberg",
      "amtsgericht": "Amtsgericht Stuttgart",
      "registernummer": "HRB 763158",
      "registerart": "HRB",
      "company_name": "TriStyle Brands GmbH",
      "company_seat": "Winterbach",
      "details": "01.10.2024 (Bekanntmachungsdatum)\n\nBaden-Württemberg Amtsgericht Stuttgart HRB 763158\nSonstige Registerbekanntmachung 01.10.2024 (Eintragungsdatum)\n\nTriStyle Brands GmbH\nGesellschaft mit beschränkter Haftung\nWinterbach\n\nDen Gläubigern der Gesellschaft, deren Forderungen begründet worden sind, bevor die Eintragung der Beendigung des Vertrages in das Handelsregister nach § 10 HGB als bekanntgemacht gilt, ist vom anderen Vertragsteil Sicherheit zu leisten, wenn sie sich binnen sechs Monaten nach der Bekanntmachung zu diesem Zweck bei ihm melden."
    },
    {
      "date": "2024-10-01",
      "original_text": "Registerbekanntmachung nach dem Umwandlungsgesetz\nSachsen Amtsgericht Chemnitz VR 5843\nUnser Freiberg e.V. – Freiberg",
      "type": "Registerbekanntmachung nach dem Umwandlungsgesetz",
      "state": "Sachsen",
      "amtsgericht": "Amtsgericht Chemnitz",
      "registernummer": "VR 5843",
      "registerart": "VR",
      "company_name": "Unser Freiberg e.V.",
      "company_seat": "Freiberg",
      "details": "01.10.2024 (Bekanntmachungsdatum)\n\nSachsen Amtsgericht Chemnitz VR 5843\nRegisterbekanntmachung nach dem Umwandlungsgesetz 01.10.2024 (Eintragungsdatum)\n\nUnser Freiberg e.V.\neingetragener Verein\nFreiberg\n\nDen Gläubigern der an der Verschmelzung beteiligten Rechtsträger ist, wenn sie binnen sechs Monaten nach dem Tag, an dem die Eintragung der Verschmelzung in das Register des Sitzes desjenigen Rechtsträgers, dessen Gläubiger sie sind, nach § 19 Abs. 3 UmwG als bekannt gemacht gilt, ihren Anspruch nach Grund und Höhe schriftlich anmelden, Sicherheit zu leisten, soweit sie nicht Befriedigung verlangen können. Dieses Recht steht den Gläubigern jedoch nur zu, wenn sie glaubhaft machen, dass durch die Verschmelzung die Erfüllung der Forderung gefährdet wird."
    },
    {
      "date": "2024-10-01",
      "original_text": "Registerbekanntmachung nach dem Umwandlungsgesetz\nBerlin Amtsgericht Berlin (Charlottenburg) HRB 247426\nVIUS SE & Co. KGaA – Berlin",
      "type": "Registerbekanntmachung nach dem Umwandlungsgesetz",
      "state": "Berlin",
      "amtsgericht": "Amtsgericht Berlin (Charlottenburg)",
      "registernummer": "HRB 247426",
      "registerart": "HRB",
      "company_name": "VIUS SE & Co. KGaA",
      "company_seat": "Berlin",
      "details": "01.10.2024 (Bekanntmachungsdatum)\n\nBerlin Amtsgericht Berlin (Charlottenburg) HRB 247426\nRegisterbekanntmachung nach dem Umwandlungsgesetz 27.09.2024 (Eintragungsdatum)\n\nVIUS SE & Co. KGaA\nKommanditgesellschaft auf Aktien\nBerlin\n\nZu Eintragungsnummer 6 vom 27.09.2024 wird als nicht eingetragen veröffentlicht: Den Gläubigern der an der Verschmelzung beteiligten Rechtsträger ist, wenn sie binnen sechs Monaten nach dem Tag, an dem die Eintragung der Verschmelzung in das Register des Sitzes desjenigen Rechtsträgers, dessen Gläubiger sie sind, als bekannt gemacht gilt, ihren Anspruch nach Grund und Höhe schriftlich anmelden, Sicherheit zu leisten, soweit sie nicht Befriedigung verlangen können. Dieses Recht steht den Gläubigern jedoch nur zu, wenn sie glaubhaft machen, dass durch die Verschmelzung die Erfüllung ihrer Forderung gefährdet wird. Das Recht, Sicherheitsleistung zu verlangen, steht Gläubigern nicht zu, die im Falle der Insolvenz ein Recht auf vorzugsweise Befriedigung aus einer Deckungsmasse haben, die nach gesetzlicher Vorschrift zu ihrem Schutz errichtet und staatlich überwacht ist."
    },
    {
      "date": "2024-10-01",
      "original_text": "Registerbekanntmachung nach dem Umwandlungsgesetz\nHessen Amtsgericht Frankfurt am Main HRB 80969\nVR-LEASING AMETRIN GmbH – Eschborn",
      "type": "Registerbekanntmachung nach dem Umwandlungsgesetz",
      "state": "Hessen",
      "amtsgericht": "Amtsgericht Frankfurt am Main",
      "registernummer": "HRB 80969",
      "registerart": "HRB",
      "company_name": "VR-LEASING AMETRIN GmbH",
      "company_seat": "Eschborn",
      "details": "01.10.2024 (Bekanntmachungsdatum)\n\nHessen Amtsgericht Frankfurt am Main HRB 80969\nRegisterbekanntmachung nach dem Umwandlungsgesetz 01.10.2024 (Eintragungsdatum)\n\nVR-LEASING AMETRIN GmbH\nGesellschaft mit beschränkter Haftung\nEschborn\n\nDen Gläubigern der an der Verschmelzung beteiligten Rechtsträger ist, wenn sie binnen sechs Monaten nach dem Tag, an dem die Eintragung der Verschmelzung in das Register des Sitzes derjenigen Rechtsträger deren Gläubiger sie sind, nach § 19 Absatz 3 UmwG bekannt gemacht worden ist, ihren Anspruch nach Grund und Höhe schriftlich anmelden, Sicherheit zu leisten, soweit sie nicht Befriedigung verlangen können. Dieses Recht steht den Gläubigern jedoch nur zu, wenn sie glaubhaft machen, dass durch die Verschmelzung die Erfüllung ihrer Forderung gefährdet wird."
    },
    {
      "date": "2024-10-01",
      "original_text": "Registerbekanntmachung nach dem Umwandlungsgesetz\nNiedersachsen Amtsgericht Oldenburg (Oldenburg) HRB 210021\nVRG Akademie GmbH – Oldenburg",
      "type": "Registerbekanntmachung nach dem Umwandlungsgesetz",
      "state": "Niedersachsen",
      "amtsgericht": "Amtsgericht Oldenburg (Oldenburg)",
      "registernummer": "HRB 210021",
      "registerart": "HRB",
      "company_name": "VRG Akademie GmbH",
      "company_seat": "Oldenburg",
      "details": "01.10.2024 (Bekanntmachungsdatum)\n\nNiedersachsen Amtsgericht Oldenburg (Oldenburg) HRB 210021\nRegisterbekanntmachung nach dem Umwandlungsgesetz 01.10.2024 (Eintragungsdatum)\n\nVRG Akademie GmbH\nGesellschaft mit beschränkter Haftung\nOldenburg\n\nDen Gläubigern der an der Verschmelzung beteiligten Rechtsträger ist, wenn sie binnen sechs Monaten nach dem Tag, an dem die Eintragung der Verschmelzung in das Register des Sitzes desjenigen Rechtsträgers, dessen Gläubiger sie sind, nach § 19  Abs.  3 UmwG als bekannt gemacht gilt, ihren Anspruch nach Grund und Höhe schriftlich anmelden, Sicherheit zu leisten, soweit sie nicht Befriedigung verlangen können. Dieses Recht steht den Gläubigern jedoch nur zu, wenn sie glaubhaft machen, dass durch die Verschmelzung die Erfüllung der Forderung gefährdet wird."
    },
    {
      "date": "2024-10-01",
      "original_text": "Registerbekanntmachung nach dem Umwandlungsgesetz\nNiedersachsen Amtsgericht Oldenburg (Oldenburg) HRB 808\nVRG CURAMUS GmbH – Oldenburg",
      "type": "Registerbekanntmachung nach dem Umwandlungsgesetz",
      "state": "Niedersachsen",
      "amtsgericht": "Amtsgericht Oldenburg (Oldenburg)",
      "registernummer": "HRB 808",
      "registerart": "HRB",
      "company_name": "VRG CURAMUS GmbH",
      "company_seat": "Oldenburg",
      "details": "01.10.2024 (Bekanntmachungsdatum)\n\nNiedersachsen Amtsgericht Oldenburg (Oldenburg) HRB 808\nRegisterbekanntmachung nach dem Umwandlungsgesetz 01.10.2024 (Eintragungsdatum)\n\nVRG CURAMUS GmbH\nGesellschaft mit beschränkter Haftung\nOldenburg\n\nDen Gläubigern der an der Verschmelzung beteiligten Rechtsträger ist, wenn sie binnen sechs Monaten nach dem Tag, an dem die Eintragung der Verschmelzung in das Register des Sitzes desjenigen Rechtsträgers, dessen Gläubiger sie sind, nach § 19  Abs.  3 UmwG als bekannt gemacht gilt, ihren Anspruch nach Grund und Höhe schriftlich anmelden, Sicherheit zu leisten, soweit sie nicht Befriedigung verlangen können. Dieses Recht steht den Gläubigern jedoch nur zu, wenn sie glaubhaft machen, dass durch die Verschmelzung die Erfüllung der Forderung gefährdet wird."
    },
    {
      "date": "2024-10-01",
      "original_text": "Registerbekanntmachung nach dem Umwandlungsgesetz\nNiedersachsen Amtsgericht Oldenburg (Oldenburg) HRB 702\nVRG GmbH – Oldenburg",
      "type": "Registerbekanntmachung nach dem Umwandlungsgesetz",
      "state": "Niedersachsen",
      "amtsgericht": "Amtsgericht Oldenburg (Oldenburg)",
      "registernummer": "HRB 702",
      "registerart": "HRB",
      "company_name": "VRG GmbH",
      "company_seat": "Oldenburg",
      "details": "01.10.2024 (Bekanntmachungsdatum)\n\nNiedersachsen Amtsgericht Oldenburg (Oldenburg) HRB 702\nRegisterbekanntmachung nach dem Umwandlungsgesetz 01.10.2024 (Eintragungsdatum)\n\nVRG GmbH\nGesellschaft mit beschränkter Haftung\nOldenburg\n\nDen Gläubigern der an der Verschmelzung beteiligten Rechtsträger ist, wenn sie binnen sechs Monaten nach dem Tag, an dem die Eintragung der Verschmelzung in das Register des Sitzes desjenigen Rechtsträgers, dessen Gläubiger sie sind, nach § 19  Abs.  3 UmwG als bekannt gemacht gilt, ihren Anspruch nach Grund und Höhe schriftlich anmelden, Sicherheit zu leisten, soweit sie nicht Befriedigung verlangen können. Dieses Recht steht den Gläubigern jedoch nur zu, wenn sie glaubhaft machen, dass durch die Verschmelzung die Erfüllung der Forderung gefährdet wird."
    },
    {
      "date": "2024-10-01",
      "original_text": "Registerbekanntmachung nach dem Umwandlungsgesetz\nNiedersachsen Amtsgericht Oldenburg (Oldenburg) HRB 702\nVRG GmbH – Oldenburg",
      "type": "Registerbekanntmachung nach dem Umwandlungsgesetz",
      "state": "Niedersachsen",
      "amtsgericht": "Amtsgericht Oldenburg (Oldenburg)",
      "registernummer": "HRB 702",
      "registerart": "HRB",
      "company_name": "VRG GmbH",
      "company_seat": "Oldenburg",
      "details": "01.10.2024 (Bekanntmachungsdatum)\n\nNiedersachsen Amtsgericht Oldenburg (Oldenburg) HRB 702\nRegisterbekanntmachung nach dem Umwandlungsgesetz 01.10.2024 (Eintragungsdatum)\n\nVRG GmbH\nGesellschaft mit beschränkter Haftung\nOldenburg\n\nDen Gläubigern der an der Verschmelzung beteiligten Rechtsträger ist, wenn sie binnen sechs Monaten nach dem Tag, an dem die Eintragung der Verschmelzung in das Register des Sitzes desjenigen Rechtsträgers, dessen Gläubiger sie sind, nach § 19  Abs.  3 UmwG als bekannt gemacht gilt, ihren Anspruch nach Grund und Höhe schriftlich anmelden, Sicherheit zu leisten, soweit sie nicht Befriedigung verlangen können. Dieses Recht steht den Gläubigern jedoch nur zu, wenn sie glaubhaft machen, dass durch die Verschmelzung die Erfüllung der Forderung gefährdet wird."
    },
    {
      "date": "2024-10-01",
      "original_text": "Registerbekanntmachung nach dem Umwandlungsgesetz\nNiedersachsen Amtsgericht Oldenburg (Oldenburg) HRB 702\nVRG GmbH – Oldenburg",
      "type": "Registerbekanntmachung nach dem Umwandlungsgesetz",
      "state": "Niedersachsen",
      "amtsgericht": "Amtsgericht Oldenburg (Oldenburg)",
      "registernummer": "HRB 702",
      "registerart": "HRB",
      "company_name": "VRG GmbH",
      "company_seat": "Oldenburg",
      "details": "01.10.2024 (Bekanntmachungsdatum)\n\nNiedersachsen Amtsgericht Oldenburg (Oldenburg) HRB 702\nRegisterbekanntmachung nach dem Umwandlungsgesetz 01.10.2024 (Eintragungsdatum)\n\nVRG GmbH\nGesellschaft mit beschränkter Haftung\nOldenburg\n\nDen Gläubigern der an der Verschmelzung beteiligten Rechtsträger ist, wenn sie binnen sechs Monaten nach dem Tag, an dem die Eintragung der Verschmelzung in das Register des Sitzes desjenigen Rechtsträgers, dessen Gläubiger sie sind, nach § 19  Abs.  3 UmwG als bekannt gemacht gilt, ihren Anspruch nach Grund und Höhe schriftlich anmelden, Sicherheit zu leisten, soweit sie nicht Befriedigung verlangen können. Dieses Recht steht den Gläubigern jedoch nur zu, wenn sie glaubhaft machen, dass durch die Verschmelzung die Erfüllung der Forderung gefährdet wird."
    },
    {
      "date": "2024-10-01",
      "original_text": "Registerbekanntmachung nach dem Umwandlungsgesetz\nNiedersachsen Amtsgericht Oldenburg (Oldenburg) HRB 702\nVRG GmbH – Oldenburg",
      "type": "Registerbekanntmachung nach dem Umwandlungsgesetz",
      "state": "Niedersachsen",
      "amtsgericht": "Amtsgericht Oldenburg (Oldenburg)",
      "registernummer": "HRB 702",
      "registerart": "HRB",
      "company_name": "VRG GmbH",
      "company_seat": "Oldenburg",
      "details": "01.10.2024 (Bekanntmachungsdatum)\n\nNiedersachsen Amtsgericht Oldenburg (Oldenburg) HRB 702\nRegisterbekanntmachung nach dem Umwandlungsgesetz 01.10.2024 (Eintragungsdatum)\n\nVRG GmbH\nGesellschaft mit beschränkter Haftung\nOldenburg\n\nDen Gläubigern der an der Verschmelzung beteiligten Rechtsträger ist, wenn sie binnen sechs Monaten nach dem Tag, an dem die Eintragung der Verschmelzung in das Register des Sitzes desjenigen Rechtsträgers, dessen Gläubiger sie sind, nach § 19  Abs.  3 UmwG als bekannt gemacht gilt, ihren Anspruch nach Grund und Höhe schriftlich anmelden, Sicherheit zu leisten, soweit sie nicht Befriedigung verlangen können. Dieses Recht steht den Gläubigern jedoch nur zu, wenn sie glaubhaft machen, dass durch die Verschmelzung die Erfüllung der Forderung gefährdet wird."
    },
    {
      "date": "2024-10-01",
      "original_text": "Registerbekanntmachung nach dem Umwandlungsgesetz\nNiedersachsen Amtsgericht Oldenburg (Oldenburg) HRB 702\nVRG GmbH – Oldenburg",
      "type": "Registerbekanntmachung nach dem Umwandlungsgesetz",
      "state": "Niedersachsen",
      "amtsgericht": "Amtsgericht Oldenburg (Oldenburg)",
      "registernummer": "HRB 702",
      "registerart": "HRB",
      "company_name": "VRG GmbH",
      "company_seat": "Oldenburg",
      "details": "01.10.2024 (Bekanntmachungsdatum)\n\nNiedersachsen Amtsgericht Oldenburg (Oldenburg) HRB 702\nRegisterbekanntmachung nach dem Umwandlungsgesetz 01.10.2024 (Eintragungsdatum)\n\nVRG GmbH\nGesellschaft mit beschränkter Haftung\nOldenburg\n\nDen Gläubigern der an der Verschmelzung beteiligten Rechtsträger ist, wenn sie binnen sechs Monaten nach dem Tag, an dem die Eintragung der Verschmelzung in das Register des Sitzes desjenigen Rechtsträgers, dessen Gläubiger sie sind, nach § 19  Abs.  3 UmwG als bekannt gemacht gilt, ihren Anspruch nach Grund und Höhe schriftlich anmelden, Sicherheit zu leisten, soweit sie nicht Befriedigung verlangen können. Dieses Recht steht den Gläubigern jedoch nur zu, wenn sie glaubhaft machen, dass durch die Verschmelzung die Erfüllung der Forderung gefährdet wird."
    },
    {
      "date": "2024-10-01",
      "original_text": "Registerbekanntmachung nach dem Umwandlungsgesetz\nNiedersachsen Amtsgericht Oldenburg (Oldenburg) HRB 702\nVRG GmbH – Oldenburg",
      "type": "Registerbekanntmachung nach dem Umwandlungsgesetz",
      "state": "Niedersachsen",
      "amtsgericht": "Amtsgericht Oldenburg (Oldenburg)",
      "registernummer": "HRB 702",
      "registerart": "HRB",
      "company_name": "VRG GmbH",
      "company_seat": "Oldenburg",
      "details": "01.10.2024 (Bekanntmachungsdatum)\n\nNiedersachsen Amtsgericht Oldenburg (Oldenburg) HRB 702\nRegisterbekanntmachung nach dem Umwandlungsgesetz 01.10.2024 (Eintragungsdatum)\n\nVRG GmbH\nGesellschaft mit beschränkter Haftung\nOldenburg\n\nDen Gläubigern der an der Verschmelzung beteiligten Rechtsträger ist, wenn sie binnen sechs Monaten nach dem Tag, an dem die Eintragung der Verschmelzung in das Register des Sitzes desjenigen Rechtsträgers, dessen Gläubiger sie sind, nach § 19  Abs.  3 UmwG als bekannt gemacht gilt, ihren Anspruch nach Grund und Höhe schriftlich anmelden, Sicherheit zu leisten, soweit sie nicht Befriedigung verlangen können. Dieses Recht steht den Gläubigern jedoch nur zu, wenn sie glaubhaft machen, dass durch die Verschmelzung die Erfüllung der Forderung gefährdet wird."
    },
    {
      "date": "2024-10-01",
      "original_text": "Registerbekanntmachung nach dem Umwandlungsgesetz\nNiedersachsen Amtsgericht Oldenburg (Oldenburg) HRB 200052\nVRG HR GmbH – Oldenburg ( Oldb)",
      "type": "Registerbekanntmachung nach dem Umwandlungsgesetz",
      "state": "Niedersachsen",
      "amtsgericht": "Amtsgericht Oldenburg (Oldenburg)",
      "registernummer": "HRB 200052",
      "registerart": "HRB",
      "company_name": "VRG HR GmbH",
      "company_seat": "Oldenburg ( Oldb)",
      "details": "01.10.2024 (Bekanntmachungsdatum)\n\nNiedersachsen Amtsgericht Oldenburg (Oldenburg) HRB 200052\nRegisterbekanntmachung nach dem Umwandlungsgesetz 01.10.2024 (Eintragungsdatum)\n\nVRG HR GmbH\nGesellschaft mit beschränkter Haftung\nOldenburg ( Oldb)\n\nDen Gläubigern der an der Verschmelzung beteiligten Rechtsträger ist, wenn sie binnen sechs Monaten nach dem Tag, an dem die Eintragung der Verschmelzung in das Register des Sitzes desjenigen Rechtsträgers, dessen Gläubiger sie sind, nach § 19  Abs.  3 UmwG als bekannt gemacht gilt, ihren Anspruch nach Grund und Höhe schriftlich anmelden, Sicherheit zu leisten, soweit sie nicht Befriedigung verlangen können. Dieses Recht steht den Gläubigern jedoch nur zu, wenn sie glaubhaft machen, dass durch die Verschmelzung die Erfüllung der Forderung gefährdet wird."
    },
    {
      "date": "2024-10-01",
      "original_text": "Registerbekanntmachung nach dem Umwandlungsgesetz\nNiedersachsen Amtsgericht Oldenburg (Oldenburg) HRB 208511\nVRG IT GmbH – Oldenburg",
      "type": "Registerbekanntmachung nach dem Umwandlungsgesetz",
      "state": "Niedersachsen",
      "amtsgericht": "Amtsgericht Oldenburg (Oldenburg)",
      "registernummer": "HRB 208511",
      "registerart": "HRB",
      "company_name": "VRG IT GmbH",
      "company_seat": "Oldenburg",
      "details": "01.10.2024 (Bekanntmachungsdatum)\n\nNiedersachsen Amtsgericht Oldenburg (Oldenburg) HRB 208511\nRegisterbekanntmachung nach dem Umwandlungsgesetz 01.10.2024 (Eintragungsdatum)\n\nVRG IT GmbH\nGesellschaft mit beschränkter Haftung\nOldenburg\n\nDen Gläubigern der an der Verschmelzung beteiligten Rechtsträger ist, wenn sie binnen sechs Monaten nach dem Tag, an dem die Eintragung der Verschmelzung in das Register des Sitzes desjenigen Rechtsträgers, dessen Gläubiger sie sind, nach § 19  Abs.  3 UmwG als bekannt gemacht gilt, ihren Anspruch nach Grund und Höhe schriftlich anmelden, Sicherheit zu leisten, soweit sie nicht Befriedigung verlangen können. Dieses Recht steht den Gläubigern jedoch nur zu, wenn sie glaubhaft machen, dass durch die Verschmelzung die Erfüllung der Forderung gefährdet wird."
    },
    {
      "date": "2024-10-01",
      "original_text": "Registerbekanntmachung nach dem Umwandlungsgesetz\nNiedersachsen Amtsgericht Oldenburg (Oldenburg) HRB 1610\nVRG MICOS GmbH – Oldenburg",
      "type": "Registerbekanntmachung nach dem Umwandlungsgesetz",
      "state": "Niedersachsen",
      "amtsgericht": "Amtsgericht Oldenburg (Oldenburg)",
      "registernummer": "HRB 1610",
      "registerart": "HRB",
      "company_name": "VRG MICOS GmbH",
      "company_seat": "Oldenburg",
      "details": "01.10.2024 (Bekanntmachungsdatum)\n\nNiedersachsen Amtsgericht Oldenburg (Oldenburg) HRB 1610\nRegisterbekanntmachung nach dem Umwandlungsgesetz 01.10.2024 (Eintragungsdatum)\n\nVRG MICOS GmbH\nGesellschaft mit beschränkter Haftung\nOldenburg\n\nDen Gläubigern der an der Verschmelzung beteiligten Rechtsträger ist, wenn sie binnen sechs Monaten nach dem Tag, an dem die Eintragung der Verschmelzung in das Register des Sitzes desjenigen Rechtsträgers, dessen Gläubiger sie sind, nach § 19  Abs.  3 UmwG als bekannt gemacht gilt, ihren Anspruch nach Grund und Höhe schriftlich anmelden, Sicherheit zu leisten, soweit sie nicht Befriedigung verlangen können. Dieses Recht steht den Gläubigern jedoch nur zu, wenn sie glaubhaft machen, dass durch die Verschmelzung die Erfüllung der Forderung gefährdet wird."
    },
    {
      "date": "2024-10-01",
      "original_text": "Registerbekanntmachung nach dem Umwandlungsgesetz\nNiedersachsen Amtsgericht Oldenburg (Oldenburg) HRB 217297\nVRG SYS GmbH – Oldenburg",
      "type": "Registerbekanntmachung nach dem Umwandlungsgesetz",
      "state": "Niedersachsen",
      "amtsgericht": "Amtsgericht Oldenburg (Oldenburg)",
      "registernummer": "HRB 217297",
      "registerart": "HRB",
      "company_name": "VRG SYS GmbH",
      "company_seat": "Oldenburg",
      "details": "01.10.2024 (Bekanntmachungsdatum)\n\nNiedersachsen Amtsgericht Oldenburg (Oldenburg) HRB 217297\nRegisterbekanntmachung nach dem Umwandlungsgesetz 01.10.2024 (Eintragungsdatum)\n\nVRG SYS GmbH\nGesellschaft mit beschränkter Haftung\nOldenburg\n\nDen Gläubigern der an der Verschmelzung beteiligten Rechtsträger ist, wenn sie binnen sechs Monaten nach dem Tag, an dem die Eintragung der Verschmelzung in das Register des Sitzes desjenigen Rechtsträgers, dessen Gläubiger sie sind, nach § 19  Abs.  3 UmwG als bekannt gemacht gilt, ihren Anspruch nach Grund und Höhe schriftlich anmelden, Sicherheit zu leisten, soweit sie nicht Befriedigung verlangen können. Dieses Recht steht den Gläubigern jedoch nur zu, wenn sie glaubhaft machen, dass durch die Verschmelzung die Erfüllung der Forderung gefährdet wird."
    },
    {
      "date": "2024-10-01",
      "original_text": "Löschungsankündigung\nHessen Amtsgericht Friedberg VR 1666\nVerein zur Förderung sozialer Projekte e.V. – Altenstadt-Heegheim",
      "type": "Löschungsankündigung",
      "state": "Hessen",
      "amtsgericht": "Amtsgericht Friedberg",
      "registernummer": "VR 1666",
      "registerart": "VR",
      "company_name": "Verein zur Förderung sozialer Projekte e.V.",
      "company_seat": "Altenstadt-Heegheim",
      "details": "01.10.2024 (Bekanntmachungsdatum)\n\nHessen Amtsgericht Friedberg VR 1666\nLöschungsankündigung\n\nVerein zur Förderung sozialer Projekte e.V.\neingetragener Verein\nAltenstadt-Heegheim\n\nDas Registergericht beabsichtigt den im Vereinsregister eingetragenen Verein von Amts wegen nach § 395 FamFG zu löschen. Die Frist zur Erhebung eines Widerspruchs gegen die beabsichtigte Löschung wird auf 3 Monate festgesetzt."
    },
    {
      "date": "2024-10-01",
      "original_text": "Löschungsankündigung\nBremen Amtsgericht Bremen HRB 37599\nVerwaltungsgesellschaft The 8 mbH – Bremen",
      "type": "Löschungsankündigung",
      "state": "Bremen",
      "amtsgericht": "Amtsgericht Bremen",
      "registernummer": "HRB 37599",
      "registerart": "HRB",
      "company_name": "Verwaltungsgesellschaft The 8 mbH",
      "company_seat": "Bremen",
      "details": "01.10.2024 (Bekanntmachungsdatum)\n\nBremen Amtsgericht Bremen HRB 37599\nLöschungsankündigung\n\nVerwaltungsgesellschaft The 8 mbH\nGesellschaft mit beschränkter Haftung\nBremen\n\nEs ist beabsichtigt die im Handelsregister eingetragene Gesellschaft von Amts wegen gemäß § 394 FamFG zu löschen. Gegen die Löschung kann beim AG Bremen schriftlich oder zu Protokoll der Geschäftsstelle Widerspruch eingelegt werden. Widerspruchsfrist 4 Wochen."
    },
    {
      "date": "2024-10-01",
      "original_text": "Registerbekanntmachung nach dem Umwandlungsgesetz\nNordrhein-Westfalen Amtsgericht Iserlohn HRB 7767\nVier Jahreszeiten UG (haftungsbeschränkt) – Werdohl",
      "type": "Registerbekanntmachung nach dem Umwandlungsgesetz",
      "state": "Nordrhein-Westfalen",
      "amtsgericht": "Amtsgericht Iserlohn",
      "registernummer": "HRB 7767",
      "registerart": "HRB",
      "company_name": "Vier Jahreszeiten UG (haftungsbeschränkt)",
      "company_seat": "Werdohl",
      "details": "01.10.2024 (Bekanntmachungsdatum)\n\nNordrhein-Westfalen Amtsgericht Iserlohn HRB 7767\nRegisterbekanntmachung nach dem Umwandlungsgesetz 24.09.2024 (Eintragungsdatum)\n\nVier Jahreszeiten UG (haftungsbeschränkt)\nGesellschaft mit beschränkter Haftung\nWerdohl\n\nDen Gläubigern der an der Verschmelzung beteiligten Rechtsträger ist, wenn sie binnen sechs Monaten nach dem Tag, an dem die Eintragung der Verschmelzung in das Register des Sitzes desjenigen Rechtsträgers, dessen Gläubiger sie sind, nach § 19 Absatz 3 UmwG als bekanntgemacht gilt, ihren Anspruch nach Grund und Höhe schriftlich anmelden, Sicherheit zu leisten, soweit sie nicht Befriedigung verlangen können. Dieses Recht steht den Gläubigern jedoch nur zu, wenn sie glaubhaft machen, dass durch die Verschmelzung die Erfüllung ihrer Forderung gefährdet wird."
    },
    {
      "date": "2024-10-01",
      "original_text": "Registerbekanntmachung nach dem Umwandlungsgesetz\nBayern Amtsgericht Augsburg HRA 18616\nVolkmar Hagen Reifengrosshandel e.K. – Aichach",
      "type": "Registerbekanntmachung nach dem Umwandlungsgesetz",
      "state": "Bayern",
      "amtsgericht": "Amtsgericht Augsburg",
      "registernummer": "HRA 18616",
      "registerart": "HRA",
      "company_name": "Volkmar Hagen Reifengrosshandel e.K.",
      "company_seat": "Aichach",
      "details": "01.10.2024 (Bekanntmachungsdatum)\n\nBayern Amtsgericht Augsburg HRA 18616\nRegisterbekanntmachung nach dem Umwandlungsgesetz 30.09.2024 (Eintragungsdatum)\n\nVolkmar Hagen Reifengrosshandel e.K.\nEinzelkaufmann / Einzelkauffrau\nAichach\n\nDen Gläubigern der an der Ausgliederung beteiligten Rechtsträger ist, wenn sie binnen sechs Monaten nach dem Tag, an dem die Eintragung der Ausgliederung in das Register des Sitzes desjenigen Rechtsträgers, dessen Gläubiger sie sind, nach §§ 125, 19 Abs. 3 UmwG als bekannt gemacht gilt, ihren Anspruch nach Grund und Höhe schriftlich anmelden, Sicherheit zu leisten, soweit sie nicht Befriedigung verlangen können. Dieses Recht steht den Gläubigern jedoch nur zu, wenn sie glaubhaft machen, dass durch die Ausgliederung die Erfüllung ihrer Forderung gefährdet wird."
    },
    {
      "date": "2024-10-01",
      "original_text": "Registerbekanntmachung nach dem Umwandlungsgesetz\nBaden-Württemberg Amtsgericht Ulm GnR 710098\nVolksbank Meßkirch eG Raiffeisenbank – Meßkirch",
      "type": "Registerbekanntmachung nach dem Umwandlungsgesetz",
      "state": "Baden-Württemberg",
      "amtsgericht": "Amtsgericht Ulm",
      "registernummer": "GnR 710098",
      "registerart": "GnR",
      "company_name": "Volksbank Meßkirch eG Raiffeisenbank",
      "company_seat": "Meßkirch",
      "details": "01.10.2024 (Bekanntmachungsdatum)\n\nBaden-Württemberg Amtsgericht Ulm GnR 710098\nRegisterbekanntmachung nach dem Umwandlungsgesetz 01.10.2024 (Eintragungsdatum)\n\nVolksbank Meßkirch eG Raiffeisenbank\neingetragene Genossenschaft\nMeßkirch\n\nAls nicht eingetragen wird bekanntgemacht:\nDen Gläubigern der an der Verschmelzung beteiligten Rechtsträger ist, wenn sie binnen sechs Monaten nach dem Tag, an dem die Eintragung der Verschmelzung in das Register des Sitzes desjenigen Rechtsträgers, dessen Gläubiger sie sind, nach § 19 Abs. 3 UmwG als bekanntgemacht gilt, ihren Anspruch nach Grund und Höhe schriftlich anmelden, Sicherheit zu leisten, soweit sie nicht Befriedigung verlangen können. Dieses Recht steht den Gläubigern jedoch nur zu, wenn sie glaubhaft machen, dass durch die Verschmelzung die Erfüllung ihrer Forderung gefährdet wird."
    },
    {
      "date": "2024-10-01",
      "original_text": "Registerbekanntmachung nach dem Umwandlungsgesetz\nNordrhein-Westfalen Amtsgericht Köln HRB 57879\nWelpdruck GmbH – Wiehl",
      "type": "Registerbekanntmachung nach dem Umwandlungsgesetz",
      "state": "Nordrhein-Westfalen",
      "amtsgericht": "Amtsgericht Köln",
      "registernummer": "HRB 57879",
      "registerart": "HRB",
      "company_name": "Welpdruck GmbH",
      "company_seat": "Wiehl",
      "details": "01.10.2024 (Bekanntmachungsdatum)\n\nNordrhein-Westfalen Amtsgericht Köln HRB 57879\nRegisterbekanntmachung nach dem Umwandlungsgesetz 01.10.2024 (Eintragungsdatum)\n\nWelpdruck GmbH\nGesellschaft mit beschränkter Haftung\nWiehl\n\nDen Gläubigern der an der Verschmelzung beteiligten Rechtsträger ist, wenn sie binnen sechs Monaten nach dem Tag, an dem die Eintragung der Verschmelzung in das Register des Sitzes derjenigen Rechtsträger deren Gläubiger sie sind, nach § 19 Absatz 3 UmwG als bekanntgemacht gilt, ihren Anspruch nach Grund und Höhe schriftlich anmelden, Sicherheit zu leisten, soweit sie nicht Befriedigung verlangen können. Dieses Recht steht den Gläubigern jedoch nur zu, wenn sie glaubhaft machen, dass durch die Verschmelzung die Erfüllung ihrer Forderung gefährdet wird."
    },
    {
      "date": "2024-10-01",
      "original_text": "Registerbekanntmachung nach dem Umwandlungsgesetz\nNordrhein-Westfalen Amtsgericht Köln HRA 37769\nWelpdruck e.K. – Wiehl",
      "type": "Registerbekanntmachung nach dem Umwandlungsgesetz",
      "state": "Nordrhein-Westfalen",
      "amtsgericht": "Amtsgericht Köln",
      "registernummer": "HRA 37769",
      "registerart": "HRA",
      "company_name": "Welpdruck e.K.",
      "company_seat": "Wiehl",
      "details": "01.10.2024 (Bekanntmachungsdatum)\n\nNordrhein-Westfalen Amtsgericht Köln HRA 37769\nRegisterbekanntmachung nach dem Umwandlungsgesetz 01.10.2024 (Eintragungsdatum)\n\nWelpdruck e.K.\nEinzelkaufmann / Einzelkauffrau\nWiehl\n\nDen Gläubigern der an der Verschmelzung beteiligten Rechtsträger ist, wenn sie binnen sechs Monaten nach dem Tag, an dem die Eintragung der Verschmelzung in das Register des Sitzes desjenigen Rechtsträgers, dessen Gläubiger sie sind, nach § 19 Absatz 3 UmwG als bekanntgemacht gilt, ihren Anspruch nach Grund und Höhe schriftlich anmelden, Sicherheit zu leisten, soweit sie nicht Befriedigung verlangen können. Dieses Recht steht den Gläubigern jedoch nur zu, wenn sie glaubhaft machen, dass durch die Verschmelzung die Erfüllung ihrer Forderung gefährdet wird."
    },
    {
      "date": "2024-10-01",
      "original_text": "Registerbekanntmachung nach dem Umwandlungsgesetz\nRheinland-Pfalz Amtsgericht Koblenz VR 10871\nWerbegemeinschaft Ahrweiler e.V. – Bad Neuenahr-Ahrweiler",
      "type": "Registerbekanntmachung nach dem Umwandlungsgesetz",
      "state": "Rheinland-Pfalz",
      "amtsgericht": "Amtsgericht Koblenz",
      "registernummer": "VR 10871",
      "registerart": "VR",
      "company_name": "Werbegemeinschaft Ahrweiler e.V.",
      "company_seat": "Bad Neuenahr-Ahrweiler",
      "details": "01.10.2024 (Bekanntmachungsdatum)\n\nRheinland-Pfalz Amtsgericht Koblenz VR 10871\nRegisterbekanntmachung nach dem Umwandlungsgesetz 01.10.2024 (Eintragungsdatum)\n\nWerbegemeinschaft Ahrweiler e.V.\neingetragener Verein\nBad Neuenahr-Ahrweiler\n\nAls nicht eingetragen wird veröffentlicht: Den Gläubigern der an der Verschmelzung beteiligten Rechtsträger ist, wenn sie binnen sechs Monaten nach dem Tag, an dem die Eintragung der Verschmelzung in das Register des Sitzes desjenigen Rechtsträgers,dessen Gläubiger sie sind, nach § 19 Abs. 3 UmwG als bekannt gemacht gilt, ihren Anspruch nach Grund und Höhe schriftlich anmelden, Sicherheit zu leisten, soweit sie nicht Befriedigung verlangen können. Dieses Recht steht den Gläubigern jedoch nur zu, wenn sie glaubhaft machen, dass durch die Verschmelzung die Erfüllung der Forderung gefährdet wird."
    },
    {
      "date": "2024-10-01",
      "original_text": "Registerbekanntmachung nach dem Umwandlungsgesetz\nNordrhein-Westfalen Amtsgericht Bielefeld HRB 33345\nWilhelm Nattkemper GmbH – Bielefeld",
      "type": "Registerbekanntmachung nach dem Umwandlungsgesetz",
      "state": "Nordrhein-Westfalen",
      "amtsgericht": "Amtsgericht Bielefeld",
      "registernummer": "HRB 33345",
      "registerart": "HRB",
      "company_name": "Wilhelm Nattkemper GmbH",
      "company_seat": "Bielefeld",
      "details": "01.10.2024 (Bekanntmachungsdatum)\n\nNordrhein-Westfalen Amtsgericht Bielefeld HRB 33345\nRegisterbekanntmachung nach dem Umwandlungsgesetz 01.10.2024 (Eintragungsdatum)\n\nWilhelm Nattkemper GmbH\nGesellschaft mit beschränkter Haftung\nBielefeld\n\nDen Gläubigern der an der Verschmelzung beteiligten Rechtsträger ist, wenn sie binnen sechs Monaten nach dem Tag, an dem die Eintragung der Verschmelzung in das Register des Sitzes desjenigen Rechtsträgers, dessen Gläubiger sie sind, nach § 19 Absatz 3 UmwG als bekanntgemacht gilt, ihren Anspruch nach Grund und Höhe schriftlich anmelden, Sicherheit zu leisten, soweit sie nicht Befriedigung verlangen können. Dieses Recht steht den Gläubigern jedoch nur zu, wenn sie glaubhaft machen, dass durch die Verschmelzung die Erfüllung ihrer Forderung gefährdet wird."
    },
    {
      "date": "2024-10-01",
      "original_text": "Einreichung neuer Dokumente\nSachsen Amtsgericht Chemnitz HRB 5176\nWohnungsgesellschaft Hohenstein-Ernstthal mbH – Hohenstein-Ernstthal",
      "type": "Einreichung neuer Dokumente",
      "state": "Sachsen",
      "amtsgericht": "Amtsgericht Chemnitz",
      "registernummer": "HRB 5176",
      "registerart": "HRB",
      "company_name": "Wohnungsgesellschaft Hohenstein-Ernstthal mbH",
      "company_seat": "Hohenstein-Ernstthal",
      "details": "01.10.2024 (Bekanntmachungsdatum)\n\nSachsen Amtsgericht Chemnitz HRB 5176\nEinreichung neuer Dokumente\n\nWohnungsgesellschaft Hohenstein-Ernstthal mbH\nGesellschaft mit beschränkter Haftung\nHohenstein-Ernstthal\n\nAm 27.09.2024 wurde beim Handelsregister des Amtsgerichts Chemnitz die Liste der Mitglieder des Aufsichtsrats gemäß § 52 GmbHG eingereicht."
    },
    {
      "date": "2024-10-01",
      "original_text": "Registerbekanntmachung nach dem Umwandlungsgesetz\nNordrhein-Westfalen Amtsgericht Düsseldorf HRB 106671\nZGS Infrastruktur AG – Düsseldorf",
      "type": "Registerbekanntmachung nach dem Umwandlungsgesetz",
      "state": "Nordrhein-Westfalen",
      "amtsgericht": "Amtsgericht Düsseldorf",
      "registernummer": "HRB 106671",
      "registerart": "HRB",
      "company_name": "ZGS Infrastruktur AG",
      "company_seat": "Düsseldorf",
      "details": "01.10.2024 (Bekanntmachungsdatum)\n\nNordrhein-Westfalen Amtsgericht Düsseldorf HRB 106671\nRegisterbekanntmachung nach dem Umwandlungsgesetz 01.10.2024 (Eintragungsdatum)\n\nZGS Infrastruktur AG\nAktiengesellschaft\nDüsseldorf\n\nDen Gläubigern der an der formwechselnden Umwandlung beteiligten Rechtsträger ist, wenn sie binnen sechs Monaten nach dem Tag, an dem die Eintragung der formwechselnden Umwandlung in das Register des Sitzes desjenigen Rechtsträgers, dessen Gläubiger sie sind, nach § 19 Absatz 3 UmwG als bekanntgemacht gilt, ihren Anspruch nach Grund und Höhe schriftlich anmelden, Sicherheit zu leisten, soweit sie nicht Befriedigung verlangen können. Dieses Recht steht den Gläubigern jedoch nur zu, wenn sie glaubhaft machen, dass durch die formwechselnden Umwandlung die Erfüllung ihrer Forderung gefährdet wird."
    },
    {
      "date": "2024-10-01",
      "original_text": "Sonstige Registerbekanntmachung\nNordrhein-Westfalen Amtsgericht Dortmund HRB 30885\nalphazoo AG – Dortmund",
      "type": "Sonstige Registerbekanntmachung",
      "state": "Nordrhein-Westfalen",
      "amtsgericht": "Amtsgericht Dortmund",
      "registernummer": "HRB 30885",
      "registerart": "HRB",
      "company_name": "alphazoo AG",
      "company_seat": "Dortmund",
      "details": "01.10.2024 (Bekanntmachungsdatum)\n\nNordrhein-Westfalen Amtsgericht Dortmund HRB 30885\nSonstige Registerbekanntmachung\n\nalphazoo AG\nAktiengesellschaft\nDortmund\n\nDem Registergericht ist eine neue Liste der Mitglieder des Aufsichtsrates eingereicht worden."
    },
    {
      "date": "2024-10-01",
      "original_text": "Löschungsankündigung\nHessen Amtsgericht Eschwege HRB 1564\nbch büropartner handels GmbH – Eschwege",
      "type": "Löschungsankündigung",
      "state": "Hessen",
      "amtsgericht": "Amtsgericht Eschwege",
      "registernummer": "HRB 1564",
      "registerart": "HRB",
      "company_name": "bch büropartner handels GmbH",
      "company_seat": "Eschwege",
      "details": "01.10.2024 (Bekanntmachungsdatum)\n\nHessen Amtsgericht Eschwege HRB 1564\nLöschungsankündigung\n\nbch büropartner handels GmbH\nGesellschaft mit beschränkter Haftung\nEschwege\n\nDas Registergericht beabsichtigt die im Handelsregister eingetragene Gesellschaft von Amts wegen nach § 394 FamFG zu löschen. Die Frist zur Erhebung eines Widerspruchs gegen die beabsichtigte Löschung wird auf 3 Monate festgesetzt."
    },
    {
      "date": "2024-10-01",
      "original_text": "Registerbekanntmachung nach dem Umwandlungsgesetz\nNordrhein-Westfalen Amtsgericht Aachen HRB 971\nenwor - energie & wasser vor ort GmbH – Herzogenrath",
      "type": "Registerbekanntmachung nach dem Umwandlungsgesetz",
      "state": "Nordrhein-Westfalen",
      "amtsgericht": "Amtsgericht Aachen",
      "registernummer": "HRB 971",
      "registerart": "HRB",
      "company_name": "enwor - energie & wasser vor ort GmbH",
      "company_seat": "Herzogenrath",
      "details": "01.10.2024 (Bekanntmachungsdatum)\n\nNordrhein-Westfalen Amtsgericht Aachen HRB 971\nRegisterbekanntmachung nach dem Umwandlungsgesetz 01.10.2024 (Eintragungsdatum)\n\nenwor - energie & wasser vor ort GmbH\nGesellschaft mit beschränkter Haftung\nHerzogenrath\n\nDen Gläubigern der an der Ausgliederung beteiligten Rechtsträger ist, wenn sie binnen sechs Monaten nach dem Tag, an dem die Eintragung der Ausgliederung in das Register des Sitzes desjenigen Rechtsträgers, dessen Gläubiger sie sind, nach § 19 Absatz 3 UmwG als bekanntgemacht gilt, ihren Anspruch nach Grund und Höhe schriftlich anmelden, Sicherheit zu leisten, soweit sie nicht Befriedigung verlangen können. Dieses Recht steht den Gläubigern jedoch nur zu, wenn sie glaubhaft machen, dass durch die Ausgliederung die Erfüllung ihrer Forderung gefährdet wird."
    },
    {
      "date": "2024-10-01",
      "original_text": "Löschungsankündigung\nBrandenburg Amtsgericht Neuruppin HRB 14205\nequus Stallservice UG (haftungsbeschränkt) – Hennigsdorf",
      "type": "Löschungsankündigung",
      "state": "Brandenburg",
      "amtsgericht": "Amtsgericht Neuruppin",
      "registernummer": "HRB 14205",
      "registerart": "HRB",
      "company_name": "equus Stallservice UG (haftungsbeschränkt)",
      "company_seat": "Hennigsdorf",
      "details": "01.10.2024 (Bekanntmachungsdatum)\n\nBrandenburg Amtsgericht Neuruppin HRB 14205\nLöschungsankündigung\n\nequus Stallservice UG (haftungsbeschränkt)\nGesellschaft mit beschränkter Haftung\nHennigsdorf\n\nBei der nachstehenden Gesellschaft wird das Amtslöschungsverfahren gemäß § 394 FamFG eingeleitet.\nWiderspruchsfrist: 1 Monat."
    },
    {
      "date": "2024-10-01",
      "original_text": "Registerbekanntmachung nach dem Umwandlungsgesetz\nThüringen Amtsgericht Jena HRB 201252\njenawohnen GmbH – Jena",
      "type": "Registerbekanntmachung nach dem Umwandlungsgesetz",
      "state": "Thüringen",
      "amtsgericht": "Amtsgericht Jena",
      "registernummer": "HRB 201252",
      "registerart": "HRB",
      "company_name": "jenawohnen GmbH",
      "company_seat": "Jena",
      "details": "01.10.2024 (Bekanntmachungsdatum)\n\nThüringen Amtsgericht Jena HRB 201252\nRegisterbekanntmachung nach dem Umwandlungsgesetz 01.10.2024 (Eintragungsdatum)\n\njenawohnen GmbH\nGesellschaft mit beschränkter Haftung\nJena\n\nNicht eingetragen: Den Gläubigern der an der Ausgliederung beteiligten Rechtsträger, ist wenn sie binnen sechs Monaten nach dem Tag, an dem die Eintragung der Ausgliederung in das Register des Sitzes desjenigen Rechtsträgers, dessen Gläubiger sie sind, nach §§125, 19 Abs. 3 UmwG als bekanntgemacht gilt, ihren Anspruch nach Grund und Höhe schriftlich anmelden, Sicherheit zu leisten, soweit sie nicht Befriedigung verlangen können. Dieses Recht steht ihnen jedoch nur zu, wenn sie glaubhaft machen, daß durch die Ausgliederung die Erfüllung ihrer Forderung gefährdet wird."
    },
    {
      "date": "2024-10-01",
      "original_text": "Einreichung neuer Dokumente\nBerlin Amtsgericht Berlin (Charlottenburg) HRB 149204\nlabforward GmbH – Berlin",
      "type": "Einreichung neuer Dokumente",
      "state": "Berlin",
      "amtsgericht": "Amtsgericht Berlin (Charlottenburg)",
      "registernummer": "HRB 149204",
      "registerart": "HRB",
      "company_name": "labforward GmbH",
      "company_seat": "Berlin",
      "details": "01.10.2024 (Bekanntmachungsdatum)\n\nBerlin Amtsgericht Berlin (Charlottenburg) HRB 149204\nEinreichung neuer Dokumente\n\nlabforward GmbH\nGesellschaft mit beschränkter Haftung\nBerlin\n\nAls nicht eingetragen wird veröffentlicht:Es wurde eine neue Liste der Beiratsmitglieder eingereicht (§52 GmbHG)."
    },
    {
      "date": "2024-10-01",
      "original_text": "Registerbekanntmachung nach dem Umwandlungsgesetz\nHamburg Amtsgericht Hamburg HRB 104715\nloved gmbh – Hamburg",
      "type": "Registerbekanntmachung nach dem Umwandlungsgesetz",
      "state": "Hamburg",
      "amtsgericht": "Amtsgericht Hamburg",
      "registernummer": "HRB 104715",
      "registerart": "HRB",
      "company_name": "loved gmbh",
      "company_seat": "Hamburg",
      "details": "01.10.2024 (Bekanntmachungsdatum)\n\nHamburg Amtsgericht Hamburg HRB 104715\nRegisterbekanntmachung nach dem Umwandlungsgesetz 01.10.2024 (Eintragungsdatum)\n\nloved gmbh\nGesellschaft mit beschränkter Haftung\nHamburg\n\nAls nicht eingetragen wird bekannt gemacht:\nDen Gläubigern der an der Verschmelzung beteiligten Gesellschaften ist, wenn sie binnen sechs Monaten nach dem Tag, an dem die Eintragung der Verschmelzung in das Register des Sitzes desjenigen Rechtsträgers, dessen Gläubiger sie sind, nach § 19 Absatz 3 UmwG als bekannt gemacht gilt, ihren Anspruch nach Grund und Höhe schriftlich anmelden, Sicherheit zu leisten, soweit sie nicht Befriedigung verlangen können. Dieses Recht steht den Gläubigern jedoch nur zu, wenn sie glaubhaft machen, dass durch die Verschmelzung die Erfüllung ihrer Forderung gefährdet wird."
    },
    {
      "date": "2024-10-01",
      "original_text": "Registerbekanntmachung nach dem Umwandlungsgesetz\nHessen Amtsgericht Frankfurt am Main HRB 136255\no&m Offices & more GmbH – Frankfurt am Main",
      "type": "Registerbekanntmachung nach dem Umwandlungsgesetz",
      "state": "Hessen",
      "amtsgericht": "Amtsgericht Frankfurt am Main",
      "registernummer": "HRB 136255",
      "registerart": "HRB",
      "company_name": "o&m Offices & more GmbH",
      "company_seat": "Frankfurt am Main",
      "details": "01.10.2024 (Bekanntmachungsdatum)\n\nHessen Amtsgericht Frankfurt am Main HRB 136255\nRegisterbekanntmachung nach dem Umwandlungsgesetz 01.10.2024 (Eintragungsdatum)\n\no&m Offices & more GmbH\nGesellschaft mit beschränkter Haftung\nFrankfurt am Main\n\nDen Gläubigern der an der formwechselnden Umwandlung beteiligten Rechtsträger ist, wenn sie binnen sechs Monaten nach dem Tag, an dem die Eintragung der formwechselnden Umwandlung in das Register des Sitzes desjenigen Rechtsträgers, dessen Gläubiger sie sind, nach § 201 UmwG bekannt gemacht worden ist, ihren Anspruch nach Grund und Höhe schriftlich anmelden, Sicherheit zu leisten, soweit sie nicht Befriedigung verlangen können. Dieses Recht steht den Gläubigern jedoch nur zu, wenn sie glaubhaft machen, dass durch die formwechselnden Umwandlung die Erfüllung ihrer Forderung gefährdet wird."
    },
    {
      "date": "2024-10-01",
      "original_text": "Registerbekanntmachung nach dem Umwandlungsgesetz\nHessen Amtsgericht Frankfurt am Main HRA 29268\no&m Offices & more GmbH & Co. KG – Frankfurt am Main",
      "type": "Registerbekanntmachung nach dem Umwandlungsgesetz",
      "state": "Hessen",
      "amtsgericht": "Amtsgericht Frankfurt am Main",
      "registernummer": "HRA 29268",
      "registerart": "HRA",
      "company_name": "o&m Offices & more GmbH & Co. KG",
      "company_seat": "Frankfurt am Main",
      "details": "01.10.2024 (Bekanntmachungsdatum)\n\nHessen Amtsgericht Frankfurt am Main HRA 29268\nRegisterbekanntmachung nach dem Umwandlungsgesetz 01.10.2024 (Eintragungsdatum)\n\no&m Offices & more GmbH & Co. KG\nKommanditgesellschaft\nFrankfurt am Main\n\nDen Gläubigern der an der formwechselnden Umwandlung beteiligten Rechtsträger ist, wenn sie binnen sechs Monaten nach dem Tag, an dem die Eintragung der formwechselnden Umwandlung in das Register des Sitzes desjenigen Rechtsträgers, dessen Gläubiger sie sind, nach § 201 UmwG bekannt gemacht worden ist, ihren Anspruch nach Grund und Höhe schriftlich anmelden, Sicherheit zu leisten, soweit sie nicht Befriedigung verlangen können. Dieses Recht steht den Gläubigern jedoch nur zu, wenn sie glaubhaft machen, dass durch die formwechselnden Umwandlung die Erfüllung ihrer Forderung gefährdet wird."
    },
    {
      "date": "2024-10-01",
      "original_text": "Registerbekanntmachung nach dem Umwandlungsgesetz\nHamburg Amtsgericht Hamburg HRB 139047\nthjnk Germany GmbH – Hamburg",
      "type": "Registerbekanntmachung nach dem Umwandlungsgesetz",
      "state": "Hamburg",
      "amtsgericht": "Amtsgericht Hamburg",
      "registernummer": "HRB 139047",
      "registerart": "HRB",
      "company_name": "thjnk Germany GmbH",
      "company_seat": "Hamburg",
      "details": "01.10.2024 (Bekanntmachungsdatum)\n\nHamburg Amtsgericht Hamburg HRB 139047\nRegisterbekanntmachung nach dem Umwandlungsgesetz 01.10.2024 (Eintragungsdatum)\n\nthjnk Germany GmbH\nGesellschaft mit beschränkter Haftung\nHamburg\n\nAls nicht eingetragen wird bekannt gemacht:\nDen Gläubigern der an der Verschmelzung beteiligten Gesellschaften ist, wenn sie binnen sechs Monaten nach dem Tag, an dem die Eintragung der Verschmelzung in das Register des Sitzes desjenigen Rechtsträgers, dessen Gläubiger sie sind, nach § 19 Absatz 3 UmwG als bekannt gemacht gilt, ihren Anspruch nach Grund und Höhe schriftlich anmelden, Sicherheit zu leisten, soweit sie nicht Befriedigung verlangen können. Dieses Recht steht den Gläubigern jedoch nur zu, wenn sie glaubhaft machen, dass durch die Verschmelzung die Erfüllung ihrer Forderung gefährdet wird."
    },
    {
      "date": "2024-10-01",
      "original_text": "Registerbekanntmachung nach dem Umwandlungsgesetz\nThüringen Amtsgericht Jena HRB 210313\nwohndienstjena GmbH – Jena",
      "type": "Registerbekanntmachung nach dem Umwandlungsgesetz",
      "state": "Thüringen",
      "amtsgericht": "Amtsgericht Jena",
      "registernummer": "HRB 210313",
      "registerart": "HRB",
      "company_name": "wohndienstjena GmbH",
      "company_seat": "Jena",
      "details": "01.10.2024 (Bekanntmachungsdatum)\n\nThüringen Amtsgericht Jena HRB 210313\nRegisterbekanntmachung nach dem Umwandlungsgesetz 01.10.2024 (Eintragungsdatum)\n\nwohndienstjena GmbH\nGesellschaft mit beschränkter Haftung\nJena\n\nNicht eingetragen: Den Gläubigern der an der Ausgliederung beteiligten Rechtsträger, ist wenn sie binnen sechs Monaten nach dem Tag, an dem die Eintragung der Ausgliederung in das Register des Sitzes desjenigen Rechtsträgers, dessen Gläubiger sie sind, nach §§125, 19 Abs. 3 UmwG als bekanntgemacht gilt, ihren Anspruch nach Grund und Höhe schriftlich anmelden, Sicherheit zu leisten, soweit sie nicht Befriedigung verlangen können. Dieses Recht steht ihnen jedoch nur zu, wenn sie glaubhaft machen, daß durch die Ausgliederung die Erfüllung ihrer Forderung gefährdet wird."
    },
    {
      "date": "2024-10-01",
      "original_text": "Sonstige Registerbekanntmachung\nHessen Amtsgericht Frankfurt am Main HRB 125846\nwohnvoll AG – Frankfurt am Main",
      "type": "Sonstige Registerbekanntmachung",
      "state": "Hessen",
      "amtsgericht": "Amtsgericht Frankfurt am Main",
      "registernummer": "HRB 125846",
      "registerart": "HRB",
      "company_name": "wohnvoll AG",
      "company_seat": "Frankfurt am Main",
      "details": "01.10.2024 (Bekanntmachungsdatum)\n\nHessen Amtsgericht Frankfurt am Main HRB 125846\nSonstige Registerbekanntmachung 01.10.2024 (Eintragungsdatum)\n\nwohnvoll AG\nAktiengesellschaft\nFrankfurt am Main\n\nDurch eine Änderung in den Personen der Aufsichtsratsmitglieder ist eine Liste der Mitglieder des Aufsichtsrates zum Handelsregister eingereicht worden."
    }
  ]
}