{
  "date": "2024-10-26",
  "date_of_scrape": "2024-11-30T19:18:02.111Z",
  "tool_version": "0.2.0",
  "number_of_announcements": 29,
  "announcements": [
    {
      "date": "2024-10-26",
      "id": "91765",
      "original_text": "Einreichung neuer Dokumente\nBayern Amtsgericht Nürnberg HRB 28204\nMartha-Maria Altenhilfe gemeinnützige GmbH – Nürnberg",
      "type": "Einreichung neuer Dokumente",
      "state": "Bayern",
      "amtsgericht": "Amtsgericht Nürnberg",
      "registernummer": "HRB 28204",
      "registerart": "HRB",
      "company_name": "Martha-Maria Altenhilfe gemeinnützige GmbH",
      "company_seat": "Nürnberg",
      "details": "26.10.2024 (Bekanntmachungsdatum)\n\nBayern Amtsgericht Nürnberg HRB 28204\nEinreichung neuer Dokumente 25.10.2024 (Eintragungsdatum)\n\nMartha-Maria Altenhilfe gemeinnützige GmbH\nGesellschaft mit beschränkter Haftung\nNürnberg\n\nDem Amtsgericht Nürnberg -Registergericht- ist eine Liste der Mitglieder des Aufsichtsrats eingereicht worden, § 52 Abs. 3 S. 2 GmbHG."
    },
    {
      "date": "2024-10-26",
      "id": "91766",
      "original_text": "Löschungsankündigung\nBayern Amtsgericht München HRB 276648\nelfam GmbH – München",
      "type": "Löschungsankündigung",
      "state": "Bayern",
      "amtsgericht": "Amtsgericht München",
      "registernummer": "HRB 276648",
      "registerart": "HRB",
      "company_name": "elfam GmbH",
      "company_seat": "München",
      "details": "26.10.2024 (Bekanntmachungsdatum)\n\nBayern Amtsgericht München HRB 276648\nLöschungsankündigung 25.10.2024 (Eintragungsdatum)\n\nelfam GmbH\nGesellschaft mit beschränkter Haftung\nMünchen\n\nDas Registergericht beabsichtigt, den im Handelsregister eingetragenen Geschäftsführer Mohammed, Malek Mohammadi Memar, 02.05.1979 wegen fehlender Eignung nach § 395 FamFG zu löschen. Die Frist zur Erhebung eines Widerspruchs ist auf drei Monate festgesetzt."
    },
    {
      "date": "2024-10-26",
      "id": "91767",
      "original_text": "Registerbekanntmachung nach dem Umwandlungsgesetz\nBayern Amtsgericht München GsR 1302\nScensations eGbR – Krailling",
      "type": "Registerbekanntmachung nach dem Umwandlungsgesetz",
      "state": "Bayern",
      "amtsgericht": "Amtsgericht München",
      "registernummer": "GsR 1302",
      "registerart": "GsR",
      "company_name": "Scensations eGbR",
      "company_seat": "Krailling",
      "details": "26.10.2024 (Bekanntmachungsdatum)\n\nBayern Amtsgericht München GsR 1302\nRegisterbekanntmachung nach dem Umwandlungsgesetz 25.10.2024 (Eintragungsdatum)\n\nScensations eGbR\nGesellschaft bürgerlichen Rechts\nKrailling\n\nZur Umwandlung der Scensations GmbH mit Sitz in Krailling , eingetragen beim Amtsgericht München unter HRB 273805 in die Scensations eGbR mit Sitz in Krailling unter GsR 1302 : Den Gläubigern des formwechselnden Rechtsträgers ist, wenn sie binnen sechs Monaten nach dem Tag, an dem die Eintragung des Formwechsels nach § 201 UmwG als bekannt gemacht gilt, ihren Anspruch nach Grund und Höhe schriftlich anmelden, Sicherheit zu leisten, soweit sie nicht Befriedigung verlangen können. Dieses Recht steht den Gläubigern jedoch nur zu, wenn sie glaubhaft machen, dass durch den Formwechsel die Erfüllung ihrer Forderung gefährdet wird."
    },
    {
      "date": "2024-10-26",
      "id": "91768",
      "original_text": "Registerbekanntmachung nach dem Umwandlungsgesetz\nBayern Amtsgericht München HRB 81493\nKraft Baustoffe GmbH – München",
      "type": "Registerbekanntmachung nach dem Umwandlungsgesetz",
      "state": "Bayern",
      "amtsgericht": "Amtsgericht München",
      "registernummer": "HRB 81493",
      "registerart": "HRB",
      "company_name": "Kraft Baustoffe GmbH",
      "company_seat": "München",
      "details": "26.10.2024 (Bekanntmachungsdatum)\n\nBayern Amtsgericht München HRB 81493\nRegisterbekanntmachung nach dem Umwandlungsgesetz 25.10.2024 (Eintragungsdatum)\n\nKraft Baustoffe GmbH\nGesellschaft mit beschränkter Haftung\nMünchen\n\nDen Gläubigern der an der Spaltung beteiligten Rechtsträger ist, wenn sie binnen sechs Monaten nach dem Tag, an dem die Eintragung der Spaltung in das Register des Sitzes desjenigen Rechtsträgers, dessen Gläubiger sie sind, nach §§ 125, 19 Abs. 3 UmwG als bekannt gemacht gilt, ihren Anspruch nach Grund und Höhe schriftlich anmelden, Sicherheit zu leisten, soweit sie nicht Befriedigung verlangen können. Dieses Recht steht den Gläubigern jedoch nur zu, wenn sie glaubhaft machen, dass durch die Spaltung die Erfüllung ihrer Forderung gefährdet wird."
    },
    {
      "date": "2024-10-26",
      "id": "91769",
      "original_text": "Einreichung neuer Dokumente\nBayern Amtsgericht München HRB 62355\nMAN Truck & Bus Deutschland GmbH – München",
      "type": "Einreichung neuer Dokumente",
      "state": "Bayern",
      "amtsgericht": "Amtsgericht München",
      "registernummer": "HRB 62355",
      "registerart": "HRB",
      "company_name": "MAN Truck & Bus Deutschland GmbH",
      "company_seat": "München",
      "details": "26.10.2024 (Bekanntmachungsdatum)\n\nBayern Amtsgericht München HRB 62355\nEinreichung neuer Dokumente 25.10.2024 (Eintragungsdatum)\n\nMAN Truck & Bus Deutschland GmbH\nGesellschaft mit beschränkter Haftung\nMünchen\n\nDem Amtsgericht München -Registergericht- ist eine Liste der Mitglieder des Aufsichtsrats eingereicht worden, § 52 Abs. 3 S. 2 GmbHG."
    },
    {
      "date": "2024-10-26",
      "id": "91770",
      "original_text": "Registerbekanntmachung nach dem Umwandlungsgesetz\nBayern Amtsgericht Nürnberg HRB 43695\nMraz Metallbau GmbH – Neumarkt i.d.OPf.",
      "type": "Registerbekanntmachung nach dem Umwandlungsgesetz",
      "state": "Bayern",
      "amtsgericht": "Amtsgericht Nürnberg",
      "registernummer": "HRB 43695",
      "registerart": "HRB",
      "company_name": "Mraz Metallbau GmbH",
      "company_seat": "Neumarkt i.d.OPf.",
      "details": "26.10.2024 (Bekanntmachungsdatum)\n\nBayern Amtsgericht Nürnberg HRB 43695\nRegisterbekanntmachung nach dem Umwandlungsgesetz 25.10.2024 (Eintragungsdatum)\n\nMraz Metallbau GmbH\nGesellschaft mit beschränkter Haftung\nNeumarkt i.d.OPf.\n\nDen Gläubigern der an der Ausgliederung beteiligten Rechtsträger ist, wenn sie binnen sechs Monaten nach dem Tag, an dem die Eintragung der Ausgliederung in das Register des Sitzes desjenigen Rechtsträgers, dessen Gläubiger sie sind, nach §§ 125, 19 Abs. 3 UmwG als bekannt gemacht gilt, ihren Anspruch nach Grund und Höhe schriftlich anmelden, Sicherheit zu leisten, soweit sie nicht Befriedigung verlangen können. Dieses Recht steht den Gläubigern jedoch nur zu, wenn sie glaubhaft machen, dass durch die Ausgliederung die Erfüllung ihrer Forderung gefährdet wird."
    },
    {
      "date": "2024-10-26",
      "id": "91771",
      "original_text": "Registerbekanntmachung nach dem Umwandlungsgesetz\nBayern Amtsgericht Weiden i. d. OPf. VR 114\nKEB Neustadt-Weiden - Katholische Erwachsenenbildung Kreis Neustadt und Stadt Weiden e.V. – Weiden i.d.OPf.",
      "type": "Registerbekanntmachung nach dem Umwandlungsgesetz",
      "state": "Bayern",
      "amtsgericht": "Amtsgericht Weiden i. d. OPf.",
      "registernummer": "VR 114",
      "registerart": "VR",
      "company_name": "KEB Neustadt-Weiden - Katholische Erwachsenenbildung Kreis Neustadt und Stadt Weiden e.V.",
      "company_seat": "Weiden i.d.OPf.",
      "details": "26.10.2024 (Bekanntmachungsdatum)\n\nBayern Amtsgericht Weiden i. d. OPf. VR 114\nRegisterbekanntmachung nach dem Umwandlungsgesetz 02.08.2024 (Eintragungsdatum)\n\nKEB Neustadt-Weiden - Katholische Erwachsenenbildung Kreis Neustadt und Stadt Weiden e.V.\neingetragener Verein\nWeiden i.d.OPf.\n\nDen Gläubigern der an der Verschmelzung beteiligten Rechtsträger ist, wenn sie binnen sechs Monaten nach dem Tag, an dem die Eintragung der Verschmelzung in das Register des Sitzes desjenigen Rechtsträgers, dessen Gläubiger sie sind, nach § 19 Abs. 3 UmwG als bekannt gemacht gilt, ihren Anspruch nach Grund und Höhe schriftlich anmelden, Sicherheit zu leisten, soweit sie nicht Befriedigung verlangen können. Dieses Recht steht den Gläubigern jedoch nur zu, wenn sie glaubhaft machen, dass durch die Verschmelzung die Erfüllung ihrer Forderung gefährdet wird."
    },
    {
      "date": "2024-10-26",
      "id": "91772",
      "original_text": "Einreichung neuer Dokumente\nBayern Amtsgericht München HRB 40824\nBayerische Zugspitzbahn Bergbahn Aktiengesellschaft Garmisch-Partenkirchen – Garmisch-Partenkirchen",
      "type": "Einreichung neuer Dokumente",
      "state": "Bayern",
      "amtsgericht": "Amtsgericht München",
      "registernummer": "HRB 40824",
      "registerart": "HRB",
      "company_name": "Bayerische Zugspitzbahn Bergbahn Aktiengesellschaft Garmisch-Partenkirchen",
      "company_seat": "Garmisch-Partenkirchen",
      "details": "26.10.2024 (Bekanntmachungsdatum)\n\nBayern Amtsgericht München HRB 40824\nEinreichung neuer Dokumente 25.10.2024 (Eintragungsdatum)\n\nBayerische Zugspitzbahn Bergbahn Aktiengesellschaft Garmisch-Partenkirchen\nAktiengesellschaft\nGarmisch-Partenkirchen\n\nDem Amtsgericht München -Registergericht- ist eine Liste der Mitglieder des Aufsichtsrats eingereicht worden, § 106 AktG."
    },
    {
      "date": "2024-10-26",
      "id": "91773",
      "original_text": "Registerbekanntmachung nach dem Umwandlungsgesetz\nBayern Amtsgericht Bamberg HRB 4361\nGK Estrichbau GmbH – Altendorf, OT Seußling",
      "type": "Registerbekanntmachung nach dem Umwandlungsgesetz",
      "state": "Bayern",
      "amtsgericht": "Amtsgericht Bamberg",
      "registernummer": "HRB 4361",
      "registerart": "HRB",
      "company_name": "GK Estrichbau GmbH",
      "company_seat": "Altendorf, OT Seußling",
      "details": "26.10.2024 (Bekanntmachungsdatum)\n\nBayern Amtsgericht Bamberg HRB 4361\nRegisterbekanntmachung nach dem Umwandlungsgesetz 25.10.2024 (Eintragungsdatum)\n\nGK Estrichbau GmbH\nGesellschaft mit beschränkter Haftung\nAltendorf, OT Seußling\n\nDen Gläubigern der an der Verschmelzung beteiligten Rechtsträger ist, wenn sie binnen sechs Monaten nach dem Tag, an dem die Eintragung der Verschmelzung in das Register des Sitzes desjenigen Rechtsträgers, dessen Gläubiger sie sind, nach § 19 Abs. 3 UmwG als bekannt gemacht gilt, ihren Anspruch nach Grund und Höhe schriftlich anmelden, Sicherheit zu leisten, soweit sie nicht Befriedigung verlangen können. Dieses Recht steht den Gläubigern jedoch nur zu, wenn sie glaubhaft machen, dass durch die Verschmelzung die Erfüllung ihrer Forderung gefährdet wird."
    },
    {
      "date": "2024-10-26",
      "id": "91774",
      "original_text": "Registerbekanntmachung nach dem Umwandlungsgesetz\nBayern Amtsgericht Hof HRB 1526\nBlindenwerkstätte Wunsiedel GmbH – Wunsiedel",
      "type": "Registerbekanntmachung nach dem Umwandlungsgesetz",
      "state": "Bayern",
      "amtsgericht": "Amtsgericht Hof",
      "registernummer": "HRB 1526",
      "registerart": "HRB",
      "company_name": "Blindenwerkstätte Wunsiedel GmbH",
      "company_seat": "Wunsiedel",
      "details": "26.10.2024 (Bekanntmachungsdatum)\n\nBayern Amtsgericht Hof HRB 1526\nRegisterbekanntmachung nach dem Umwandlungsgesetz 25.10.2024 (Eintragungsdatum)\n\nBlindenwerkstätte Wunsiedel GmbH\nGesellschaft mit beschränkter Haftung\nWunsiedel\n\nDen Gläubigern der an der Verschmelzung beteiligten Rechtsträger ist, wenn sie binnen sechs Monaten nach dem Tag, an dem die Eintragung der Verschmelzung in das Register des Sitzes desjenigen Rechtsträgers, dessen Gläubiger sie sind, nach § 19 Abs. 3 UmwG als bekannt gemacht gilt, ihren Anspruch nach Grund und Höhe schriftlich anmelden, Sicherheit zu leisten, soweit sie nicht Befriedigung verlangen können. Dieses Recht steht den Gläubigern jedoch nur zu, wenn sie glaubhaft machen, dass durch die Verschmelzung die Erfüllung ihrer Forderung gefährdet wird."
    },
    {
      "date": "2024-10-26",
      "id": "91775",
      "original_text": "Einreichung neuer Dokumente\nBayern Amtsgericht München HRB 104421\nMRG Münchner Raumentwicklungsgesellschaft mbH – München",
      "type": "Einreichung neuer Dokumente",
      "state": "Bayern",
      "amtsgericht": "Amtsgericht München",
      "registernummer": "HRB 104421",
      "registerart": "HRB",
      "company_name": "MRG Münchner Raumentwicklungsgesellschaft mbH",
      "company_seat": "München",
      "details": "26.10.2024 (Bekanntmachungsdatum)\n\nBayern Amtsgericht München HRB 104421\nEinreichung neuer Dokumente 25.10.2024 (Eintragungsdatum)\n\nMRG Münchner Raumentwicklungsgesellschaft mbH\nGesellschaft mit beschränkter Haftung\nMünchen\n\nDem Amtsgericht München -Registergericht- ist eine Liste der Mitglieder des Aufsichtsrats eingereicht worden, § 52 Abs. 3 S. 2 GmbHG."
    },
    {
      "date": "2024-10-26",
      "id": "91776",
      "original_text": "Löschungsankündigung\nBayern Amtsgericht Augsburg HRB 31622\nBilly GmbH – Gersthofen",
      "type": "Löschungsankündigung",
      "state": "Bayern",
      "amtsgericht": "Amtsgericht Augsburg",
      "registernummer": "HRB 31622",
      "registerart": "HRB",
      "company_name": "Billy GmbH",
      "company_seat": "Gersthofen",
      "details": "26.10.2024 (Bekanntmachungsdatum)\n\nBayern Amtsgericht Augsburg HRB 31622\nLöschungsankündigung\n\nBilly GmbH\nGesellschaft mit beschränkter Haftung\nGersthofen\n\nDas Registergericht beabsichtigt, die im Handelsregister eingetragene Gesellschaft wegen Vermögenslosigkeit von Amts wegen nach § 394 FamFG zu löschen. Die Frist zur Erhebung eines Widerspruchs ist auf einen Monat festgesetzt."
    },
    {
      "date": "2024-10-26",
      "id": "91777",
      "original_text": "Registerbekanntmachung nach dem Umwandlungsgesetz\nBayern Amtsgericht Memmingen HRB 14002\nIHG Industrie- Handel- Gewerbe- Leasing GmbH – Memmingen",
      "type": "Registerbekanntmachung nach dem Umwandlungsgesetz",
      "state": "Bayern",
      "amtsgericht": "Amtsgericht Memmingen",
      "registernummer": "HRB 14002",
      "registerart": "HRB",
      "company_name": "IHG Industrie- Handel- Gewerbe- Leasing GmbH",
      "company_seat": "Memmingen",
      "details": "26.10.2024 (Bekanntmachungsdatum)\n\nBayern Amtsgericht Memmingen HRB 14002\nRegisterbekanntmachung nach dem Umwandlungsgesetz 25.10.2024 (Eintragungsdatum)\n\nIHG Industrie- Handel- Gewerbe- Leasing GmbH\nGesellschaft mit beschränkter Haftung\nMemmingen\n\nDen Gläubigern der an der Verschmelzung beteiligten Rechtsträger ist, wenn sie binnen sechs Monaten nach dem Tag, an dem die Eintragung der Verschmelzung in das Register des Sitzes desjenigen Rechtsträgers, dessen Gläubiger sie sind, nach § 19 Abs. 3 UmwG als bekannt gemacht gilt, ihren Anspruch nach Grund und Höhe schriftlich anmelden, Sicherheit zu leisten, soweit sie nicht Befriedigung verlangen können. Dieses Recht steht den Gläubigern jedoch nur zu, wenn sie glaubhaft machen, dass durch die Verschmelzung die Erfüllung ihrer Forderung gefährdet wird."
    },
    {
      "date": "2024-10-26",
      "id": "91778",
      "original_text": "Registerbekanntmachung nach dem Umwandlungsgesetz\nBayern Amtsgericht Fürth HRB 17577\nP&P Objekt 41 GmbH – Fürth",
      "type": "Registerbekanntmachung nach dem Umwandlungsgesetz",
      "state": "Bayern",
      "amtsgericht": "Amtsgericht Fürth",
      "registernummer": "HRB 17577",
      "registerart": "HRB",
      "company_name": "P&P Objekt 41 GmbH",
      "company_seat": "Fürth",
      "details": "26.10.2024 (Bekanntmachungsdatum)\n\nBayern Amtsgericht Fürth HRB 17577\nRegisterbekanntmachung nach dem Umwandlungsgesetz\n\nP&P Objekt 41 GmbH\nGesellschaft mit beschränkter Haftung\nFürth\n\nDen Gläubigern der an der Verschmelzung beteiligten Rechtsträger ist, wenn sie binnen sechs Monaten nach dem Tag, an dem die Eintragung der Verschmelzung in das Register des Sitzes desjenigen Rechtsträgers, dessen Gläubiger sie sind, nach § 19 Abs. 3 UmwG als bekannt gemacht gilt, ihren Anspruch nach Grund und Höhe schriftlich anmelden, Sicherheit zu leisten, soweit sie nicht Befriedigung verlangen können. Dieses Recht steht den Gläubigern jedoch nur zu, wenn sie glaubhaft machen, dass durch die Verschmelzung die Erfüllung ihrer Forderung gefährdet wird."
    },
    {
      "date": "2024-10-26",
      "id": "91779",
      "original_text": "Registerbekanntmachung nach dem Umwandlungsgesetz\nBayern Amtsgericht München HRB 297099\nKraft Immobilien Holding GmbH – München",
      "type": "Registerbekanntmachung nach dem Umwandlungsgesetz",
      "state": "Bayern",
      "amtsgericht": "Amtsgericht München",
      "registernummer": "HRB 297099",
      "registerart": "HRB",
      "company_name": "Kraft Immobilien Holding GmbH",
      "company_seat": "München",
      "details": "26.10.2024 (Bekanntmachungsdatum)\n\nBayern Amtsgericht München HRB 297099\nRegisterbekanntmachung nach dem Umwandlungsgesetz 25.10.2024 (Eintragungsdatum)\n\nKraft Immobilien Holding GmbH\nGesellschaft mit beschränkter Haftung\nMünchen\n\nDen Gläubigern der an der Spaltung beteiligten Rechtsträger ist, wenn sie binnen sechs Monaten nach dem Tag, an dem die Eintragung der Spaltung in das Register des Sitzes desjenigen Rechtsträgers, dessen Gläubiger sie sind, nach §§ 125, 19 Abs. 3 UmwG als bekannt gemacht gilt, ihren Anspruch nach Grund und Höhe schriftlich anmelden, Sicherheit zu leisten, soweit sie nicht Befriedigung verlangen können. Dieses Recht steht den Gläubigern jedoch nur zu, wenn sie glaubhaft machen, dass durch die Spaltung die Erfüllung ihrer Forderung gefährdet wird."
    },
    {
      "date": "2024-10-26",
      "id": "91780",
      "original_text": "Registerbekanntmachung nach dem Umwandlungsgesetz\nBayern Amtsgericht Fürth HRB 16654\nPFO Development Holding GmbH – Fürth",
      "type": "Registerbekanntmachung nach dem Umwandlungsgesetz",
      "state": "Bayern",
      "amtsgericht": "Amtsgericht Fürth",
      "registernummer": "HRB 16654",
      "registerart": "HRB",
      "company_name": "PFO Development Holding GmbH",
      "company_seat": "Fürth",
      "details": "26.10.2024 (Bekanntmachungsdatum)\n\nBayern Amtsgericht Fürth HRB 16654\nRegisterbekanntmachung nach dem Umwandlungsgesetz 25.10.2024 (Eintragungsdatum)\n\nPFO Development Holding GmbH\nGesellschaft mit beschränkter Haftung\nFürth\n\nDen Gläubigern der an der Verschmelzung beteiligten Rechtsträger ist, wenn sie binnen sechs Monaten nach dem Tag, an dem die Eintragung der Verschmelzung in das Register des Sitzes desjenigen Rechtsträgers, dessen Gläubiger sie sind, nach § 19 Abs. 3 UmwG als bekannt gemacht gilt, ihren Anspruch nach Grund und Höhe schriftlich anmelden, Sicherheit zu leisten, soweit sie nicht Befriedigung verlangen können. Dieses Recht steht den Gläubigern jedoch nur zu, wenn sie glaubhaft machen, dass durch die Verschmelzung die Erfüllung ihrer Forderung gefährdet wird."
    },
    {
      "date": "2024-10-26",
      "id": "91781",
      "original_text": "Registerbekanntmachung nach dem Umwandlungsgesetz\nBayern Amtsgericht Memmingen HRB 10864\nTrendmatec GmbH – Memmingen",
      "type": "Registerbekanntmachung nach dem Umwandlungsgesetz",
      "state": "Bayern",
      "amtsgericht": "Amtsgericht Memmingen",
      "registernummer": "HRB 10864",
      "registerart": "HRB",
      "company_name": "Trendmatec GmbH",
      "company_seat": "Memmingen",
      "details": "26.10.2024 (Bekanntmachungsdatum)\n\nBayern Amtsgericht Memmingen HRB 10864\nRegisterbekanntmachung nach dem Umwandlungsgesetz 25.10.2024 (Eintragungsdatum)\n\nTrendmatec GmbH\nGesellschaft mit beschränkter Haftung\nMemmingen\n\nDen Gläubigern der an der Verschmelzung beteiligten Rechtsträger ist, wenn sie binnen sechs Monaten nach dem Tag, an dem die Eintragung der Verschmelzung in das Register des Sitzes desjenigen Rechtsträgers, dessen Gläubiger sie sind, nach § 19 Abs. 3 UmwG als bekannt gemacht gilt, ihren Anspruch nach Grund und Höhe schriftlich anmelden, Sicherheit zu leisten, soweit sie nicht Befriedigung verlangen können. Dieses Recht steht den Gläubigern jedoch nur zu, wenn sie glaubhaft machen, dass durch die Verschmelzung die Erfüllung ihrer Forderung gefährdet wird."
    },
    {
      "date": "2024-10-26",
      "id": "91782",
      "original_text": "Registerbekanntmachung nach dem Umwandlungsgesetz\nBayern Amtsgericht Fürth HRB 20432\nMountain30 UG (haftungsbeschränkt) – Langenzenn",
      "type": "Registerbekanntmachung nach dem Umwandlungsgesetz",
      "state": "Bayern",
      "amtsgericht": "Amtsgericht Fürth",
      "registernummer": "HRB 20432",
      "registerart": "HRB",
      "company_name": "Mountain30 UG (haftungsbeschränkt)",
      "company_seat": "Langenzenn",
      "details": "26.10.2024 (Bekanntmachungsdatum)\n\nBayern Amtsgericht Fürth HRB 20432\nRegisterbekanntmachung nach dem Umwandlungsgesetz 25.10.2024 (Eintragungsdatum)\n\nMountain30 UG (haftungsbeschränkt)\nGesellschaft mit beschränkter Haftung\nLangenzenn\n\nDen Gläubigern der an der Spaltung beteiligten Rechtsträger ist, wenn sie binnen sechs Monaten nach dem Tag, an dem die Eintragung der Spaltung in das Register des Sitzes desjenigen Rechtsträgers, dessen Gläubiger sie sind, nach §§ 125, 19 Abs. 3 UmwG als bekannt gemacht gilt, ihren Anspruch nach Grund und Höhe schriftlich anmelden, Sicherheit zu leisten, soweit sie nicht Befriedigung verlangen können. Dieses Recht steht den Gläubigern jedoch nur zu, wenn sie glaubhaft machen, dass durch die Spaltung die Erfüllung ihrer Forderung gefährdet wird."
    },
    {
      "date": "2024-10-26",
      "id": "91783",
      "original_text": "Registerbekanntmachung nach dem Umwandlungsgesetz\nBayern Amtsgericht Kempten (Allgäu) HRB 15770\nTReinke Capital Trading GmbH – Obergünzburg",
      "type": "Registerbekanntmachung nach dem Umwandlungsgesetz",
      "state": "Bayern",
      "amtsgericht": "Amtsgericht Kempten (Allgäu)",
      "registernummer": "HRB 15770",
      "registerart": "HRB",
      "company_name": "TReinke Capital Trading GmbH",
      "company_seat": "Obergünzburg",
      "details": "26.10.2024 (Bekanntmachungsdatum)\n\nBayern Amtsgericht Kempten (Allgäu) HRB 15770\nRegisterbekanntmachung nach dem Umwandlungsgesetz 25.10.2024 (Eintragungsdatum)\n\nTReinke Capital Trading GmbH\nGesellschaft mit beschränkter Haftung\nObergünzburg\n\nDen Gläubigern der an der Verschmelzung beteiligten Rechtsträger ist, wenn sie binnen sechs Monaten nach dem Tag, an dem die Eintragung der Verschmelzung in das Register des Sitzes desjenigen Rechtsträgers, dessen Gläubiger sie sind, nach § 19 Abs. 3 UmwG als bekannt gemacht gilt, ihren Anspruch nach Grund und Höhe schriftlich anmelden, Sicherheit zu leisten, soweit sie nicht Befriedigung verlangen können. Dieses Recht steht den Gläubigern jedoch nur zu, wenn sie glaubhaft machen, dass durch die Verschmelzung die Erfüllung ihrer Forderung gefährdet wird."
    },
    {
      "date": "2024-10-26",
      "id": "91784",
      "original_text": "Registerbekanntmachung nach dem Umwandlungsgesetz\nBayern Amtsgericht Weiden i. d. OPf. VR 20052\nKEB Tirschenreuth - Katholische Erwachsenenbildung im Landkreis Tirschenreuth e.V, – Tirschenreuth",
      "type": "Registerbekanntmachung nach dem Umwandlungsgesetz",
      "state": "Bayern",
      "amtsgericht": "Amtsgericht Weiden i. d. OPf.",
      "registernummer": "VR 20052",
      "registerart": "VR",
      "company_name": "KEB Tirschenreuth - Katholische Erwachsenenbildung im Landkreis Tirschenreuth e.V,",
      "company_seat": "Tirschenreuth",
      "details": "26.10.2024 (Bekanntmachungsdatum)\n\nBayern Amtsgericht Weiden i. d. OPf. VR 20052\nRegisterbekanntmachung nach dem Umwandlungsgesetz 20.08.2024 (Eintragungsdatum)\n\nKEB Tirschenreuth - Katholische Erwachsenenbildung im Landkreis Tirschenreuth e.V,\neingetragener Verein\nTirschenreuth\n\nDen Gläubigern der an der Verschmelzung beteiligten Rechtsträger ist, wenn sie binnen sechs Monaten nach dem Tag, an dem die Eintragung der Verschmelzung in das Register des Sitzes desjenigen Rechtsträgers, dessen Gläubiger sie sind, nach § 19 Abs. 3 UmwG als bekannt gemacht gilt, ihren Anspruch nach Grund und Höhe schriftlich anmelden, Sicherheit zu leisten, soweit sie nicht Befriedigung verlangen können. Dieses Recht steht den Gläubigern jedoch nur zu, wenn sie glaubhaft machen, dass durch die Verschmelzung die Erfüllung ihrer Forderung gefährdet wird."
    },
    {
      "date": "2024-10-26",
      "id": "91785",
      "original_text": "Löschungsankündigung\nBayern Amtsgericht München HRB 191023\nQuattro Group GmbH – München",
      "type": "Löschungsankündigung",
      "state": "Bayern",
      "amtsgericht": "Amtsgericht München",
      "registernummer": "HRB 191023",
      "registerart": "HRB",
      "company_name": "Quattro Group GmbH",
      "company_seat": "München",
      "details": "26.10.2024 (Bekanntmachungsdatum)\n\nBayern Amtsgericht München HRB 191023\nLöschungsankündigung 25.10.2024 (Eintragungsdatum)\n\nQuattro Group GmbH\nGesellschaft mit beschränkter Haftung\nMünchen\n\nDas Registergericht beabsichtigt, die im Handelsregister eingetragene Gesellschaft wegen Vermögenslosigkeit von Amts wegen nach § 394 FamFG zu löschen. Die Frist zur Erhebung eines Widerspruchs ist auf drei Monate festgesetzt."
    },
    {
      "date": "2024-10-26",
      "id": "91786",
      "original_text": "Einreichung neuer Dokumente\nBayern Amtsgericht München HRB 162346\nDEMA Electronic AG – München",
      "type": "Einreichung neuer Dokumente",
      "state": "Bayern",
      "amtsgericht": "Amtsgericht München",
      "registernummer": "HRB 162346",
      "registerart": "HRB",
      "company_name": "DEMA Electronic AG",
      "company_seat": "München",
      "details": "26.10.2024 (Bekanntmachungsdatum)\n\nBayern Amtsgericht München HRB 162346\nEinreichung neuer Dokumente\n\nDEMA Electronic AG\nAktiengesellschaft\nMünchen\n\nDem Amtsgericht München -Registergericht- ist eine Liste der Mitglieder des Aufsichtsrats eingereicht worden, § 106 AktG."
    },
    {
      "date": "2024-10-26",
      "id": "91787",
      "original_text": "Registerbekanntmachung nach dem Umwandlungsgesetz\nBayern Amtsgericht München HRB 265521\nLAYA Data GmbH – München",
      "type": "Registerbekanntmachung nach dem Umwandlungsgesetz",
      "state": "Bayern",
      "amtsgericht": "Amtsgericht München",
      "registernummer": "HRB 265521",
      "registerart": "HRB",
      "company_name": "LAYA Data GmbH",
      "company_seat": "München",
      "details": "26.10.2024 (Bekanntmachungsdatum)\n\nBayern Amtsgericht München HRB 265521\nRegisterbekanntmachung nach dem Umwandlungsgesetz 25.10.2024 (Eintragungsdatum)\n\nLAYA Data GmbH\nGesellschaft mit beschränkter Haftung\nMünchen\n\nDen Gläubigern der an der Verschmelzung beteiligten Rechtsträger ist, wenn sie binnen sechs Monaten nach dem Tag, an dem die Eintragung der Verschmelzung in das Register des Sitzes desjenigen Rechtsträgers, dessen Gläubiger sie sind, nach § 19 Abs. 3 UmwG als bekannt gemacht gilt, ihren Anspruch nach Grund und Höhe schriftlich anmelden, Sicherheit zu leisten, soweit sie nicht Befriedigung verlangen können. Dieses Recht steht den Gläubigern jedoch nur zu, wenn sie glaubhaft machen, dass durch die Verschmelzung die Erfüllung ihrer Forderung gefährdet wird."
    },
    {
      "date": "2024-10-26",
      "id": "91788",
      "original_text": "Registerbekanntmachung nach dem Umwandlungsgesetz\nBayern Amtsgericht Fürth HRB 19335\nStauder Gebäudereinigung GmbH – Fürth",
      "type": "Registerbekanntmachung nach dem Umwandlungsgesetz",
      "state": "Bayern",
      "amtsgericht": "Amtsgericht Fürth",
      "registernummer": "HRB 19335",
      "registerart": "HRB",
      "company_name": "Stauder Gebäudereinigung GmbH",
      "company_seat": "Fürth",
      "details": "26.10.2024 (Bekanntmachungsdatum)\n\nBayern Amtsgericht Fürth HRB 19335\nRegisterbekanntmachung nach dem Umwandlungsgesetz 25.10.2024 (Eintragungsdatum)\n\nStauder Gebäudereinigung GmbH\nGesellschaft mit beschränkter Haftung\nFürth\n\nDen Gläubigern der an der Verschmelzung beteiligten Rechtsträger ist, wenn sie binnen sechs Monaten nach dem Tag, an dem die Eintragung der Verschmelzung in das Register des Sitzes desjenigen Rechtsträgers, dessen Gläubiger sie sind, nach § 19 Abs. 3 UmwG als bekannt gemacht gilt, ihren Anspruch nach Grund und Höhe schriftlich anmelden, Sicherheit zu leisten, soweit sie nicht Befriedigung verlangen können. Dieses Recht steht den Gläubigern jedoch nur zu, wenn sie glaubhaft machen, dass durch die Verschmelzung die Erfüllung ihrer Forderung gefährdet wird."
    },
    {
      "date": "2024-10-26",
      "id": "91789",
      "original_text": "Registerbekanntmachung nach dem Umwandlungsgesetz\nBayern Amtsgericht Fürth GnR 294\nStauder eG – Zirndorf",
      "type": "Registerbekanntmachung nach dem Umwandlungsgesetz",
      "state": "Bayern",
      "amtsgericht": "Amtsgericht Fürth",
      "registernummer": "GnR 294",
      "registerart": "GnR",
      "company_name": "Stauder eG",
      "company_seat": "Zirndorf",
      "details": "26.10.2024 (Bekanntmachungsdatum)\n\nBayern Amtsgericht Fürth GnR 294\nRegisterbekanntmachung nach dem Umwandlungsgesetz 25.10.2024 (Eintragungsdatum)\n\nStauder eG\neingetragene Genossenschaft\nZirndorf\n\nDen Gläubigern der Genossenschaft ist gemäß §§Den Gläubigern der an der Ausgliederung beteiligten Rechtsträger ist, wenn sie binnen sechs Monaten nach dem Tag, an dem die Eintragung der Ausgliederung in das Register des Sitzes desjenigen Rechtsträgers, dessen Gläubiger sie sind, nach §§ 125, 19 Abs. 3 UmwG als bekannt gemacht gilt, ihren Anspruch nach Grund und Höhe schriftlich anmelden, Sicherheit zu leisten, soweit sie nicht Befriedigung verlangen können. Dieses Recht steht den Gläubigern jedoch nur zu, wenn sie glaubhaft machen, dass durch die Ausgliederung die Erfüllung ihrer Forderung gefährdet wird. 22a i.V.m. 22 GenG, wenn sie sich binnen sechs Monaten nach der Bekanntmachung bei der Genossenschaft zu diesem Zweck melden, Sicherheit zu leisten, soweit sie nicht Befriedigung verlangen können.  Den Gläubigern der Genossenschaft ist gemäß § 22 GenG, wenn sie sich binnen sechs Monaten nach der Bekanntmachung bei der Genossenschaft zu diesem Zweck melden, Sicherheit zu leisten, soweit sie nicht Befriedigung verlangen können."
    },
    {
      "date": "2024-10-26",
      "id": "91790",
      "original_text": "Einreichung neuer Dokumente\nBayern Amtsgericht Fürth HRB 19239\nZBI Fondsmanagement GmbH – Erlangen",
      "type": "Einreichung neuer Dokumente",
      "state": "Bayern",
      "amtsgericht": "Amtsgericht Fürth",
      "registernummer": "HRB 19239",
      "registerart": "HRB",
      "company_name": "ZBI Fondsmanagement GmbH",
      "company_seat": "Erlangen",
      "details": "26.10.2024 (Bekanntmachungsdatum)\n\nBayern Amtsgericht Fürth HRB 19239\nEinreichung neuer Dokumente\n\nZBI Fondsmanagement GmbH\nGesellschaft mit beschränkter Haftung\nErlangen\n\nDem Amtsgericht Fürth -Registergericht- ist eine Liste der Mitglieder des Aufsichtsrats eingereicht worden, § 52 Abs. 3 S. 2 GmbHG."
    },
    {
      "date": "2024-10-26",
      "id": "91791",
      "original_text": "Registerbekanntmachung nach dem Umwandlungsgesetz\nBayern Amtsgericht Nürnberg HRA 20077\nMraz Metallbau, Inhaber Dominik Mraz e.K. – Neumarkt i.d.OPf.",
      "type": "Registerbekanntmachung nach dem Umwandlungsgesetz",
      "state": "Bayern",
      "amtsgericht": "Amtsgericht Nürnberg",
      "registernummer": "HRA 20077",
      "registerart": "HRA",
      "company_name": "Mraz Metallbau, Inhaber Dominik Mraz e.K.",
      "company_seat": "Neumarkt i.d.OPf.",
      "details": "26.10.2024 (Bekanntmachungsdatum)\n\nBayern Amtsgericht Nürnberg HRA 20077\nRegisterbekanntmachung nach dem Umwandlungsgesetz 25.10.2024 (Eintragungsdatum)\n\nMraz Metallbau, Inhaber Dominik Mraz e.K.\nEinzelkaufmann / Einzelkauffrau\nNeumarkt i.d.OPf.\n\nDen Gläubigern der an der Ausgliederung beteiligten Rechtsträger ist, wenn sie binnen sechs Monaten nach dem Tag, an dem die Eintragung der Ausgliederung in das Register des Sitzes desjenigen Rechtsträgers, dessen Gläubiger sie sind, nach §§ 125, 19 Abs. 3 UmwG als bekannt gemacht gilt, ihren Anspruch nach Grund und Höhe schriftlich anmelden, Sicherheit zu leisten, soweit sie nicht Befriedigung verlangen können. Dieses Recht steht den Gläubigern jedoch nur zu, wenn sie glaubhaft machen, dass durch die Ausgliederung die Erfüllung ihrer Forderung gefährdet wird."
    },
    {
      "date": "2024-10-26",
      "id": "91792",
      "original_text": "Einreichung neuer Dokumente\nBayern Amtsgericht München HRB 125089\nP.E.G. - Servicegesellschaft mbH – München",
      "type": "Einreichung neuer Dokumente",
      "state": "Bayern",
      "amtsgericht": "Amtsgericht München",
      "registernummer": "HRB 125089",
      "registerart": "HRB",
      "company_name": "P.E.G. - Servicegesellschaft mbH",
      "company_seat": "München",
      "details": "26.10.2024 (Bekanntmachungsdatum)\n\nBayern Amtsgericht München HRB 125089\nEinreichung neuer Dokumente\n\nP.E.G. - Servicegesellschaft mbH\nGesellschaft mit beschränkter Haftung\nMünchen\n\nDem #Re.Name ist eine Liste der Mitglieder des Aufsichtsrats eingereicht worden, § 52 Abs. 3 S. 2 GmbHG."
    },
    {
      "date": "2024-10-26",
      "id": "91793",
      "original_text": "Löschungsankündigung\nBaden-Württemberg Amtsgericht Freiburg HRB 720679\nBuci Montage GmbH – Bad Säckingen",
      "type": "Löschungsankündigung",
      "state": "Baden-Württemberg",
      "amtsgericht": "Amtsgericht Freiburg",
      "registernummer": "HRB 720679",
      "registerart": "HRB",
      "company_name": "Buci Montage GmbH",
      "company_seat": "Bad Säckingen",
      "details": "26.10.2024 (Bekanntmachungsdatum)\n\nBaden-Württemberg Amtsgericht Freiburg HRB 720679\nLöschungsankündigung\n\nBuci Montage GmbH\nGesellschaft mit beschränkter Haftung\nBad Säckingen\n\nAls nicht eingetragen wird bekanntgemacht:\nDas Gericht beabsichtigt, die Gesellschaft wegen Vermögenslosigkeit im Handelsregister von Amts wegen nach § 394 FamFG zu löschen. Die Frist zur Geltendmachung eines Widerspruchs gegen die beabsichtigte Löschung ist auf einen Monat ab Veröffentlichung bestimmt."
    }
  ]
}