{
  "date": "2024-10-05",
  "date_of_scrape": "2024-11-30T12:28:11.217Z",
  "tool_version": "0.2.0",
  "number_of_announcements": 21,
  "announcements": [
    {
      "date": "2024-10-05",
      "id": "89272",
      "original_text": "Löschungsankündigung\nBayern Amtsgericht Kempten (Allgäu) HRA 9884\nBürgerwind Ruderatshofen GmbH & Co. KG – Marktoberdorf",
      "type": "Löschungsankündigung",
      "state": "Bayern",
      "amtsgericht": "Amtsgericht Kempten (Allgäu)",
      "registernummer": "HRA 9884",
      "registerart": "HRA",
      "company_name": "Bürgerwind Ruderatshofen GmbH & Co. KG",
      "company_seat": "Marktoberdorf",
      "details": "05.10.2024 (Bekanntmachungsdatum)\n\nBayern Amtsgericht Kempten (Allgäu) HRA 9884\nLöschungsankündigung\n\nBürgerwind Ruderatshofen GmbH & Co. KG\nKommanditgesellschaft\nMarktoberdorf\n\nDas Registergericht beabsichtigt, die im Handelsregister eingetragene Gesellschaft wegen Vermögenslosigkeit von Amts wegen nach § 394 FamFG zu löschen. Die Frist zur Erhebung eines Widerspruchs ist auf acht Wochen festgesetzt."
    },
    {
      "date": "2024-10-05",
      "id": "89283",
      "original_text": "Einreichung neuer Dokumente\nBayern Amtsgericht Nürnberg HRB 35802\nCurameo AG – Reichenschwand",
      "type": "Einreichung neuer Dokumente",
      "state": "Bayern",
      "amtsgericht": "Amtsgericht Nürnberg",
      "registernummer": "HRB 35802",
      "registerart": "HRB",
      "company_name": "Curameo AG",
      "company_seat": "Reichenschwand",
      "details": "05.10.2024 (Bekanntmachungsdatum)\n\nBayern Amtsgericht Nürnberg HRB 35802\nEinreichung neuer Dokumente 04.10.2024 (Eintragungsdatum)\n\nCurameo AG\nAktiengesellschaft\nReichenschwand\n\nDem Amtsgericht Nürnberg -Registergericht- ist eine Liste der Mitglieder des Aufsichtsrats eingereicht worden, § 106 AktG."
    },
    {
      "date": "2024-10-05",
      "id": "89287",
      "original_text": "Löschungsankündigung\nRheinland-Pfalz Amtsgericht Kaiserslautern HRB 33110\nDK Bauservice GmbH – Göllheim",
      "type": "Löschungsankündigung",
      "state": "Rheinland-Pfalz",
      "amtsgericht": "Amtsgericht Kaiserslautern",
      "registernummer": "HRB 33110",
      "registerart": "HRB",
      "company_name": "DK Bauservice GmbH",
      "company_seat": "Göllheim",
      "details": "05.10.2024 (Bekanntmachungsdatum)\n\nRheinland-Pfalz Amtsgericht Kaiserslautern HRB 33110\nLöschungsankündigung\n\nDK Bauservice GmbH\nGesellschaft mit beschränkter Haftung\nGöllheim\n\nDas Registergericht beabsichtigt die vorgenannte Firma gemäß § 394 FamFG wegen Vermögenslosigkeit von Amts wegen zu löschen. Widerspruch gegen die Löschung kann nur binnen 3 Monaten ab Veröffentlichung dieser Verfügung eingelegt werden."
    },
    {
      "date": "2024-10-05",
      "id": "89286",
      "original_text": "Löschungsankündigung\nBayern Amtsgericht München HRB 226845\nDeTech Solution GmbH – Erding",
      "type": "Löschungsankündigung",
      "state": "Bayern",
      "amtsgericht": "Amtsgericht München",
      "registernummer": "HRB 226845",
      "registerart": "HRB",
      "company_name": "DeTech Solution GmbH",
      "company_seat": "Erding",
      "details": "05.10.2024 (Bekanntmachungsdatum)\n\nBayern Amtsgericht München HRB 226845\nLöschungsankündigung 04.10.2024 (Eintragungsdatum)\n\nDeTech Solution GmbH\nGesellschaft mit beschränkter Haftung\nErding\n\nDas Registergericht beabsichtigt, die im Handelsregister eingetragene Gesellschaft wegen Vermögenslosigkeit von Amts wegen nach § 394 FamFG zu löschen. Die Frist zur Erhebung eines Widerspruchs ist auf drei Monate festgesetzt."
    },
    {
      "date": "2024-10-05",
      "id": "89285",
      "original_text": "Einreichung neuer Dokumente\nBayern Amtsgericht München HRB 216106\nEDAG Engineering Holding GmbH – München",
      "type": "Einreichung neuer Dokumente",
      "state": "Bayern",
      "amtsgericht": "Amtsgericht München",
      "registernummer": "HRB 216106",
      "registerart": "HRB",
      "company_name": "EDAG Engineering Holding GmbH",
      "company_seat": "München",
      "details": "05.10.2024 (Bekanntmachungsdatum)\n\nBayern Amtsgericht München HRB 216106\nEinreichung neuer Dokumente\n\nEDAG Engineering Holding GmbH\nGesellschaft mit beschränkter Haftung\nMünchen\n\nDem Handelsregister HRB 216106 beim Amtsgericht München ist eine Liste der Mitglieder des Aufsichtsrats eingereicht worden, § 52 Abs. 3 S. 2 GmbHG."
    },
    {
      "date": "2024-10-05",
      "id": "89269",
      "original_text": "Registerbekanntmachung nach dem Umwandlungsgesetz\nBayern Amtsgericht Würzburg HRA 8864\nErfrischungs-Service-Kus e. K. – Kitzingen",
      "type": "Registerbekanntmachung nach dem Umwandlungsgesetz",
      "state": "Bayern",
      "amtsgericht": "Amtsgericht Würzburg",
      "registernummer": "HRA 8864",
      "registerart": "HRA",
      "company_name": "Erfrischungs-Service-Kus e. K.",
      "company_seat": "Kitzingen",
      "details": "05.10.2024 (Bekanntmachungsdatum)\n\nBayern Amtsgericht Würzburg HRA 8864\nRegisterbekanntmachung nach dem Umwandlungsgesetz 04.10.2024 (Eintragungsdatum)\n\nErfrischungs-Service-Kus e. K.\nEinzelkaufmann / Einzelkauffrau\nKitzingen\n\nDen Gläubigern der an der Ausgliederung beteiligten Rechtsträger ist, wenn sie binnen sechs Monaten nach dem Tag, an dem die Eintragung der Ausgliederung in das Register des Sitzes desjenigen Rechtsträgers, dessen Gläubiger sie sind, nach §§ 125, 19 Abs. 3 UmwG als bekannt gemacht gilt, ihren Anspruch nach Grund und Höhe schriftlich anmelden, Sicherheit zu leisten, soweit sie nicht Befriedigung verlangen können. Dieses Recht steht den Gläubigern jedoch nur zu, wenn sie glaubhaft machen, dass durch die Ausgliederung die Erfüllung ihrer Forderung gefährdet wird."
    },
    {
      "date": "2024-10-05",
      "id": "89268",
      "original_text": "Löschungsankündigung\nBayern Amtsgericht Ansbach HRA 2303\nFachfirma Dürr Turmuhren - Glocken - Läutemaschinen GmbH & Co. KG – Rothenburg ob der Tauber",
      "type": "Löschungsankündigung",
      "state": "Bayern",
      "amtsgericht": "Amtsgericht Ansbach",
      "registernummer": "HRA 2303",
      "registerart": "HRA",
      "company_name": "Fachfirma Dürr Turmuhren - Glocken - Läutemaschinen GmbH & Co. KG",
      "company_seat": "Rothenburg ob der Tauber",
      "details": "05.10.2024 (Bekanntmachungsdatum)\n\nBayern Amtsgericht Ansbach HRA 2303\nLöschungsankündigung\n\nFachfirma Dürr Turmuhren - Glocken - Läutemaschinen GmbH & Co. KG\nKommanditgesellschaft\nRothenburg ob der Tauber\n\nDas Registergericht beabsichtigt, die im Handelsregister eingetragene Firma wegen Vermögenslosigkeit von Amts wegen nach § 394 FamFG zu löschen. Die Frist zur Erhebung eines Widerspruchs ist auf einen Monat festgesetzt."
    },
    {
      "date": "2024-10-05",
      "id": "89276",
      "original_text": "Registerbekanntmachung nach dem Umwandlungsgesetz\nBayern Amtsgericht Augsburg HRB 39669\nH&F Teleservice GmbH – Augsburg",
      "type": "Registerbekanntmachung nach dem Umwandlungsgesetz",
      "state": "Bayern",
      "amtsgericht": "Amtsgericht Augsburg",
      "registernummer": "HRB 39669",
      "registerart": "HRB",
      "company_name": "H&F Teleservice GmbH",
      "company_seat": "Augsburg",
      "details": "05.10.2024 (Bekanntmachungsdatum)\n\nBayern Amtsgericht Augsburg HRB 39669\nRegisterbekanntmachung nach dem Umwandlungsgesetz 04.10.2024 (Eintragungsdatum)\n\nH&F Teleservice GmbH\nGesellschaft mit beschränkter Haftung\nAugsburg\n\nDen Gläubigern der an der Ausgliederung beteiligten Rechtsträger ist, wenn sie binnen sechs Monaten nach dem Tag, an dem die Eintragung der Ausgliederung in das Register des Sitzes desjenigen Rechtsträgers, dessen Gläubiger sie sind, nach §§ 125, 19 Abs. 3 UmwG als bekannt gemacht gilt, ihren Anspruch nach Grund und Höhe schriftlich anmelden, Sicherheit zu leisten, soweit sie nicht Befriedigung verlangen können. Dieses Recht steht den Gläubigern jedoch nur zu, wenn sie glaubhaft machen, dass durch die Ausgliederung die Erfüllung ihrer Forderung gefährdet wird."
    },
    {
      "date": "2024-10-05",
      "id": "89273",
      "original_text": "Registerbekanntmachung nach dem Umwandlungsgesetz\nBayern Amtsgericht München HRB 202185\nH.F.S. Immobilienfonds Deutschland 4 Komplementär GmbH – München",
      "type": "Registerbekanntmachung nach dem Umwandlungsgesetz",
      "state": "Bayern",
      "amtsgericht": "Amtsgericht München",
      "registernummer": "HRB 202185",
      "registerart": "HRB",
      "company_name": "H.F.S. Immobilienfonds Deutschland 4 Komplementär GmbH",
      "company_seat": "München",
      "details": "05.10.2024 (Bekanntmachungsdatum)\n\nBayern Amtsgericht München HRB 202185\nRegisterbekanntmachung nach dem Umwandlungsgesetz 04.10.2024 (Eintragungsdatum)\n\nH.F.S. Immobilienfonds Deutschland 4 Komplementär GmbH\nGesellschaft mit beschränkter Haftung\nMünchen\n\nDen Gläubigern der an der Verschmelzung beteiligten Rechtsträger ist, wenn sie binnen sechs Monaten nach dem Tag, an dem die Eintragung der Verschmelzung in das Register des Sitzes desjenigen Rechtsträgers, dessen Gläubiger sie sind, nach § 19 Abs. 3 UmwG als bekannt gemacht gilt, ihren Anspruch nach Grund und Höhe schriftlich anmelden, Sicherheit zu leisten, soweit sie nicht Befriedigung verlangen können. Dieses Recht steht den Gläubigern jedoch nur zu, wenn sie glaubhaft machen, dass durch die Verschmelzung die Erfüllung ihrer Forderung gefährdet wird."
    },
    {
      "date": "2024-10-05",
      "id": "89277",
      "original_text": "Registerbekanntmachung nach dem Umwandlungsgesetz\nBayern Amtsgericht Augsburg HRA 21592\nHadasch O2-Partnershop e.K. – Augsburg",
      "type": "Registerbekanntmachung nach dem Umwandlungsgesetz",
      "state": "Bayern",
      "amtsgericht": "Amtsgericht Augsburg",
      "registernummer": "HRA 21592",
      "registerart": "HRA",
      "company_name": "Hadasch O2-Partnershop e.K.",
      "company_seat": "Augsburg",
      "details": "05.10.2024 (Bekanntmachungsdatum)\n\nBayern Amtsgericht Augsburg HRA 21592\nRegisterbekanntmachung nach dem Umwandlungsgesetz 04.10.2024 (Eintragungsdatum)\n\nHadasch O2-Partnershop e.K.\nEinzelkaufmann / Einzelkauffrau\nAugsburg\n\nDen Gläubigern der an der Ausgliederung beteiligten Rechtsträger ist, wenn sie binnen sechs Monaten nach dem Tag, an dem die Eintragung der Ausgliederung in das Register des Sitzes desjenigen Rechtsträgers, dessen Gläubiger sie sind, nach §§ 125, 19 Abs. 3 UmwG als bekannt gemacht gilt, ihren Anspruch nach Grund und Höhe schriftlich anmelden, Sicherheit zu leisten, soweit sie nicht Befriedigung verlangen können. Dieses Recht steht den Gläubigern jedoch nur zu, wenn sie glaubhaft machen, dass durch die Ausgliederung die Erfüllung ihrer Forderung gefährdet wird."
    },
    {
      "date": "2024-10-05",
      "id": "89270",
      "original_text": "Registerbekanntmachung nach dem Umwandlungsgesetz\nBayern Amtsgericht Würzburg HRB 16049\nKuS Kälte und Service GmbH – Kitzingen",
      "type": "Registerbekanntmachung nach dem Umwandlungsgesetz",
      "state": "Bayern",
      "amtsgericht": "Amtsgericht Würzburg",
      "registernummer": "HRB 16049",
      "registerart": "HRB",
      "company_name": "KuS Kälte und Service GmbH",
      "company_seat": "Kitzingen",
      "details": "05.10.2024 (Bekanntmachungsdatum)\n\nBayern Amtsgericht Würzburg HRB 16049\nRegisterbekanntmachung nach dem Umwandlungsgesetz 04.10.2024 (Eintragungsdatum)\n\nKuS Kälte und Service GmbH\nGesellschaft mit beschränkter Haftung\nKitzingen\n\nDen Gläubigern der an der Ausgliederung beteiligten Rechtsträger ist, wenn sie binnen sechs Monaten nach dem Tag, an dem die Eintragung der Ausgliederung in das Register des Sitzes desjenigen Rechtsträgers, dessen Gläubiger sie sind, nach §§ 125, 19 Abs. 3 UmwG als bekannt gemacht gilt, ihren Anspruch nach Grund und Höhe schriftlich anmelden, Sicherheit zu leisten, soweit sie nicht Befriedigung verlangen können. Dieses Recht steht den Gläubigern jedoch nur zu, wenn sie glaubhaft machen, dass durch die Ausgliederung die Erfüllung ihrer Forderung gefährdet wird."
    },
    {
      "date": "2024-10-05",
      "id": "89278",
      "original_text": "Registerbekanntmachung nach dem Umwandlungsgesetz\nBayern Amtsgericht Fürth HRB 20511\nKöstner Fachzentrum GmbH – Neustadt a.d. Aisch",
      "type": "Registerbekanntmachung nach dem Umwandlungsgesetz",
      "state": "Bayern",
      "amtsgericht": "Amtsgericht Fürth",
      "registernummer": "HRB 20511",
      "registerart": "HRB",
      "company_name": "Köstner Fachzentrum GmbH",
      "company_seat": "Neustadt a.d. Aisch",
      "details": "05.10.2024 (Bekanntmachungsdatum)\n\nBayern Amtsgericht Fürth HRB 20511\nRegisterbekanntmachung nach dem Umwandlungsgesetz 30.09.2024 (Eintragungsdatum)\n\nKöstner Fachzentrum GmbH\nGesellschaft mit beschränkter Haftung\nNeustadt a.d. Aisch\n\nDen Gläubigern der an der Ausgliederung beteiligten Rechtsträger ist, wenn sie binnen sechs Monaten nach dem Tag, an dem die Eintragung der Ausgliederung in das Register des Sitzes desjenigen Rechtsträgers, dessen Gläubiger sie sind, nach §§ 125, 19 Abs. 3 UmwG als bekannt gemacht gilt, ihren Anspruch nach Grund und Höhe schriftlich anmelden, Sicherheit zu leisten, soweit sie nicht Befriedigung verlangen können. Dieses Recht steht den Gläubigern jedoch nur zu, wenn sie glaubhaft machen, dass durch die Ausgliederung die Erfüllung ihrer Forderung gefährdet wird."
    },
    {
      "date": "2024-10-05",
      "id": "89280",
      "original_text": "Registerbekanntmachung nach dem Umwandlungsgesetz\nBayern Amtsgericht München HRB 278481\nLiterArte Verlags- und Werbeagentur GmbH – München",
      "type": "Registerbekanntmachung nach dem Umwandlungsgesetz",
      "state": "Bayern",
      "amtsgericht": "Amtsgericht München",
      "registernummer": "HRB 278481",
      "registerart": "HRB",
      "company_name": "LiterArte Verlags- und Werbeagentur GmbH",
      "company_seat": "München",
      "details": "05.10.2024 (Bekanntmachungsdatum)\n\nBayern Amtsgericht München HRB 278481\nRegisterbekanntmachung nach dem Umwandlungsgesetz 04.10.2024 (Eintragungsdatum)\n\nLiterArte Verlags- und Werbeagentur GmbH\nGesellschaft mit beschränkter Haftung\nMünchen\n\nDen Gläubigern der an der Verschmelzung beteiligten Rechtsträger ist, wenn sie binnen sechs Monaten nach dem Tag, an dem die Eintragung der Verschmelzung in das Register des Sitzes desjenigen Rechtsträgers, dessen Gläubiger sie sind, nach § 19 Abs. 3 UmwG als bekannt gemacht gilt, ihren Anspruch nach Grund und Höhe schriftlich anmelden, Sicherheit zu leisten, soweit sie nicht Befriedigung verlangen können. Dieses Recht steht den Gläubigern jedoch nur zu, wenn sie glaubhaft machen, dass durch die Verschmelzung die Erfüllung ihrer Forderung gefährdet wird."
    },
    {
      "date": "2024-10-05",
      "id": "89284",
      "original_text": "Löschungsankündigung\nBayern Amtsgericht Ansbach HRA 3912\nMack Maler und Stuckateure KG – Dinkelsbühl",
      "type": "Löschungsankündigung",
      "state": "Bayern",
      "amtsgericht": "Amtsgericht Ansbach",
      "registernummer": "HRA 3912",
      "registerart": "HRA",
      "company_name": "Mack Maler und Stuckateure KG",
      "company_seat": "Dinkelsbühl",
      "details": "05.10.2024 (Bekanntmachungsdatum)\n\nBayern Amtsgericht Ansbach HRA 3912\nLöschungsankündigung\n\nMack Maler und Stuckateure KG\nKommanditgesellschaft\nDinkelsbühl\n\nDas Registergericht beabsichtigt, die im Handelsregister eingetragene Firma wegen Vermögenslosigkeit von Amts wegen nach § 394 FamFG zu löschen. Die Frist zur Erhebung eines Widerspruchs ist auf einen Monat festgesetzt."
    },
    {
      "date": "2024-10-05",
      "id": "89281",
      "original_text": "Registerbekanntmachung nach dem Umwandlungsgesetz\nBayern Amtsgericht München HRB 282603\nPNZ A23 Beteiligungs GmbH – München",
      "type": "Registerbekanntmachung nach dem Umwandlungsgesetz",
      "state": "Bayern",
      "amtsgericht": "Amtsgericht München",
      "registernummer": "HRB 282603",
      "registerart": "HRB",
      "company_name": "PNZ A23 Beteiligungs GmbH",
      "company_seat": "München",
      "details": "05.10.2024 (Bekanntmachungsdatum)\n\nBayern Amtsgericht München HRB 282603\nRegisterbekanntmachung nach dem Umwandlungsgesetz 04.10.2024 (Eintragungsdatum)\n\nPNZ A23 Beteiligungs GmbH\nGesellschaft mit beschränkter Haftung\nMünchen\n\nDen Gläubigern #dv.auswahl(Text=\"Bitte zutreffendes auswählen:\",Eingabe=\n\n\"der an der Verschmelzung beteiligten Rechtsträger ist, wenn sie binnen sechs Monaten nach dem Tag, an dem die Eintragung der Verschmelzung in das Register des Sitzes desjenigen Rechtsträgers, dessen Gläubiger sie sind, nach § 19 Abs. 3 UmwG als bekannt gemacht gilt, ihren Anspruch nach Grund und Höhe schriftlich anmelden, Sicherheit zu leisten, soweit sie nicht Befriedigung verlangen können. Dieses Recht steht den Gläubigern jedoch nur zu, wenn sie glaubhaft machen, dass durch die Verschmelzung die Erfüllung ihrer Forderung gefährdet wird.\"|\"Verschmelzung\",\n\n\"der an der Spaltung beteiligten Rechtsträger ist, wenn sie binnen sechs Monaten nach dem Tag, an dem die Eintragung der Spaltung in das Register des Sitzes desjenigen Rechtsträgers, dessen Gläubiger sie sind, nach §§ 125, 19 Abs. 3 UmwG als bekannt gemacht gilt, ihren Anspruch nach Grund und Höhe schriftlich anmelden, Sicherheit zu leisten, soweit sie nicht Befriedigung verlangen können. Dieses Recht steht den Gläubigern jedoch nur zu, wenn sie glaubhaft machen, dass durch die Spaltung die Erfüllung ihrer Forderung gefährdet wird.\"|\"Spaltung\",\n\n\"des formwechselnden Rechtsträgers ist, wenn sie binnen sechs Monaten nach dem Tag, an dem die Eintragung des Formwechsels nach § 201 UmwG als bekannt gemacht gilt, ihren Anspruch nach Grund und Höhe schriftlich anmelden, Sicherheit zu leisten, soweit sie nicht Befriedigung verlangen können. Dieses Recht steht den Gläubigern jedoch nur zu, wenn sie glaubhaft machen, dass durch den Formwechsel die Erfüllung ihrer Forderung gefährdet wird.\"|\"formwechselnde Umwandlung\",\n\n\"der an der Ausgliederung beteiligten Rechtsträger ist, wenn sie binnen sechs Monaten nach dem Tag, an dem die Eintragung der Ausgliederung in das Register des Sitzes desjenigen Rechtsträgers, dessen Gläubiger sie sind, nach §§ 125, 19 Abs. 3 UmwG als bekannt gemacht gilt, ihren Anspruch nach Grund und Höhe schriftlich anmelden, Sicherheit zu leisten, soweit sie nicht Befriedigung verlangen können. Dieses Recht steht den Gläubigern jedoch nur zu, wenn sie glaubhaft machen, dass durch die Ausgliederung die Erfüllung ihrer Forderung gefährdet wird.\"|\"Ausgliederung\")"
    },
    {
      "date": "2024-10-05",
      "id": "89282",
      "original_text": "Registerbekanntmachung nach dem Umwandlungsgesetz\nBayern Amtsgericht München HRB 282603\nPNZ A23 Beteiligungs GmbH – München",
      "type": "Registerbekanntmachung nach dem Umwandlungsgesetz",
      "state": "Bayern",
      "amtsgericht": "Amtsgericht München",
      "registernummer": "HRB 282603",
      "registerart": "HRB",
      "company_name": "PNZ A23 Beteiligungs GmbH",
      "company_seat": "München",
      "details": "05.10.2024 (Bekanntmachungsdatum)\n\nBayern Amtsgericht München HRB 282603\nRegisterbekanntmachung nach dem Umwandlungsgesetz 04.10.2024 (Eintragungsdatum)\n\nPNZ A23 Beteiligungs GmbH\nGesellschaft mit beschränkter Haftung\nMünchen\n\nDen Gläubigern der an der Verschmelzung beteiligten Rechtsträger ist, wenn sie binnen sechs Monaten nach dem Tag, an dem die Eintragung der Verschmelzung in das Register des Sitzes desjenigen Rechtsträgers, dessen Gläubiger sie sind, nach § 19 Abs. 3 UmwG als bekannt gemacht gilt, ihren Anspruch nach Grund und Höhe schriftlich anmelden, Sicherheit zu leisten, soweit sie nicht Befriedigung verlangen können. Dieses Recht steht den Gläubigern jedoch nur zu, wenn sie glaubhaft machen, dass durch die Verschmelzung die Erfüllung ihrer Forderung gefährdet wird."
    },
    {
      "date": "2024-10-05",
      "id": "89267",
      "original_text": "Registerbekanntmachung nach dem Umwandlungsgesetz\nBayern Amtsgericht München HRB 179622\nPrestele Group Services GmbH – Gräfelfing",
      "type": "Registerbekanntmachung nach dem Umwandlungsgesetz",
      "state": "Bayern",
      "amtsgericht": "Amtsgericht München",
      "registernummer": "HRB 179622",
      "registerart": "HRB",
      "company_name": "Prestele Group Services GmbH",
      "company_seat": "Gräfelfing",
      "details": "05.10.2024 (Bekanntmachungsdatum)\n\nBayern Amtsgericht München HRB 179622\nRegisterbekanntmachung nach dem Umwandlungsgesetz 04.10.2024 (Eintragungsdatum)\n\nPrestele Group Services GmbH\nGesellschaft mit beschränkter Haftung\nGräfelfing\n\nDen Gläubigern der an der Verschmelzung beteiligten Rechtsträger ist, wenn sie binnen sechs Monaten nach dem Tag, an dem die Eintragung der Verschmelzung in das Register des Sitzes desjenigen Rechtsträgers, dessen Gläubiger sie sind, nach § 19 Abs. 3 UmwG als bekannt gemacht gilt, ihren Anspruch nach Grund und Höhe schriftlich anmelden, Sicherheit zu leisten, soweit sie nicht Befriedigung verlangen können. Dieses Recht steht den Gläubigern jedoch nur zu, wenn sie glaubhaft machen, dass durch die Verschmelzung die Erfüllung ihrer Forderung gefährdet wird."
    },
    {
      "date": "2024-10-05",
      "id": "89279",
      "original_text": "Registerbekanntmachung nach dem Umwandlungsgesetz\nBayern Amtsgericht Fürth HRB 20091\nSchultheiß Software AG – Erlangen",
      "type": "Registerbekanntmachung nach dem Umwandlungsgesetz",
      "state": "Bayern",
      "amtsgericht": "Amtsgericht Fürth",
      "registernummer": "HRB 20091",
      "registerart": "HRB",
      "company_name": "Schultheiß Software AG",
      "company_seat": "Erlangen",
      "details": "05.10.2024 (Bekanntmachungsdatum)\n\nBayern Amtsgericht Fürth HRB 20091\nRegisterbekanntmachung nach dem Umwandlungsgesetz 04.10.2024 (Eintragungsdatum)\n\nSchultheiß Software AG\nAktiengesellschaft\nErlangen\n\nDen Gläubigern der an der Verschmelzung beteiligten Rechtsträger ist, wenn sie binnen sechs Monaten nach dem Tag, an dem die Eintragung der Verschmelzung in das Register des Sitzes desjenigen Rechtsträgers, dessen Gläubiger sie sind, nach § 19 Abs. 3 UmwG als bekannt gemacht gilt, ihren Anspruch nach Grund und Höhe schriftlich anmelden, Sicherheit zu leisten, soweit sie nicht Befriedigung verlangen können. Dieses Recht steht den Gläubigern jedoch nur zu, wenn sie glaubhaft machen, dass durch die Verschmelzung die Erfüllung ihrer Forderung gefährdet wird."
    },
    {
      "date": "2024-10-05",
      "id": "89274",
      "original_text": "Einreichung neuer Dokumente\nBayern Amtsgericht München HRB 109326\nTÜV SÜD Aktiengesellschaft – München",
      "type": "Einreichung neuer Dokumente",
      "state": "Bayern",
      "amtsgericht": "Amtsgericht München",
      "registernummer": "HRB 109326",
      "registerart": "HRB",
      "company_name": "TÜV SÜD Aktiengesellschaft",
      "company_seat": "München",
      "details": "05.10.2024 (Bekanntmachungsdatum)\n\nBayern Amtsgericht München HRB 109326\nEinreichung neuer Dokumente 04.10.2024 (Eintragungsdatum)\n\nTÜV SÜD Aktiengesellschaft\nAktiengesellschaft\nMünchen\n\nDem Amtsgericht München -Registergericht- ist eine Liste der Mitglieder des Aufsichtsrats eingereicht worden, § 106 AktG."
    },
    {
      "date": "2024-10-05",
      "id": "89275",
      "original_text": "Einreichung neuer Dokumente\nBayern Amtsgericht München HRB 275610\nVIRIDIS - GREEN-TECH INVESTMENT AG – München",
      "type": "Einreichung neuer Dokumente",
      "state": "Bayern",
      "amtsgericht": "Amtsgericht München",
      "registernummer": "HRB 275610",
      "registerart": "HRB",
      "company_name": "VIRIDIS - GREEN-TECH INVESTMENT AG",
      "company_seat": "München",
      "details": "05.10.2024 (Bekanntmachungsdatum)\n\nBayern Amtsgericht München HRB 275610\nEinreichung neuer Dokumente\n\nVIRIDIS - GREEN-TECH INVESTMENT AG\nAktiengesellschaft\nMünchen\n\nDem #Re.Name ist eine Liste der Mitglieder des Aufsichtsrats eingereicht worden, § 106 AktG."
    },
    {
      "date": "2024-10-05",
      "id": "89271",
      "original_text": "Löschungsankündigung\nBayern Amtsgericht München HRA 110047\nlight2square solutions GmbH & Co. KG – München",
      "type": "Löschungsankündigung",
      "state": "Bayern",
      "amtsgericht": "Amtsgericht München",
      "registernummer": "HRA 110047",
      "registerart": "HRA",
      "company_name": "light2square solutions GmbH & Co. KG",
      "company_seat": "München",
      "details": "05.10.2024 (Bekanntmachungsdatum)\n\nBayern Amtsgericht München HRA 110047\nLöschungsankündigung 04.10.2024 (Eintragungsdatum)\n\nlight2square solutions GmbH & Co. KG\nKommanditgesellschaft\nMünchen\n\nDas Registergericht beabsichtigt, die im Handelsregister eingetragene Firma wegen Vermögenslosigkeit von Amts wegen nach § 394 FamFG zu löschen. Die Frist zur Erhebung eines Widerspruchs ist auf drei Monate festgesetzt."
    }
  ]
}