{
  "date": "2024-10-15",
  "date_of_scrape": "2024-11-30T12:23:47.901Z",
  "tool_version": "0.2.0",
  "number_of_announcements": 207,
  "announcements": [
    {
      "date": "2024-10-15",
      "id": "90367",
      "original_text": "Registerbekanntmachung nach dem Umwandlungsgesetz\nBayern Amtsgericht Würzburg HRA 8562\n\"Hof Bau\" GmbH & Co. KG – Würzburg",
      "type": "Registerbekanntmachung nach dem Umwandlungsgesetz",
      "state": "Bayern",
      "amtsgericht": "Amtsgericht Würzburg",
      "registernummer": "HRA 8562",
      "registerart": "HRA",
      "company_name": "\"Hof Bau\" GmbH & Co. KG",
      "company_seat": "Würzburg",
      "details": "15.10.2024 (Bekanntmachungsdatum)\n\nBayern Amtsgericht Würzburg HRA 8562\nRegisterbekanntmachung nach dem Umwandlungsgesetz 14.10.2024 (Eintragungsdatum)\n\n\"Hof Bau\" GmbH & Co. KG\nKommanditgesellschaft\nWürzburg\n\nDen Gläubigern der an der Verschmelzung beteiligten Rechtsträger ist, wenn sie binnen sechs Monaten nach dem Tag, an dem die Eintragung der Verschmelzung in das Register des Sitzes desjenigen Rechtsträgers, dessen Gläubiger sie sind, nach § 19 Abs. 3 UmwG als bekannt gemacht gilt, ihren Anspruch nach Grund und Höhe schriftlich anmelden, Sicherheit zu leisten, soweit sie nicht Befriedigung verlangen können. Dieses Recht steht den Gläubigern jedoch nur zu, wenn sie glaubhaft machen, dass durch die Verschmelzung die Erfüllung ihrer Forderung gefährdet wird."
    },
    {
      "date": "2024-10-15",
      "id": "90438",
      "original_text": "Registerbekanntmachung nach dem Umwandlungsgesetz\nBaden-Württemberg Amtsgericht Stuttgart HRB 769486\n24passion GmbH – Stuttgart",
      "type": "Registerbekanntmachung nach dem Umwandlungsgesetz",
      "state": "Baden-Württemberg",
      "amtsgericht": "Amtsgericht Stuttgart",
      "registernummer": "HRB 769486",
      "registerart": "HRB",
      "company_name": "24passion GmbH",
      "company_seat": "Stuttgart",
      "details": "15.10.2024 (Bekanntmachungsdatum)\n\nBaden-Württemberg Amtsgericht Stuttgart HRB 769486\nRegisterbekanntmachung nach dem Umwandlungsgesetz 15.10.2024 (Eintragungsdatum)\n\n24passion GmbH\nGesellschaft mit beschränkter Haftung\nStuttgart\n\nAls nicht eingetragen wird bekanntgemacht:\nDen Gläubigern des an dem Formwechsel beteiligten Rechtsträgers ist, wenn sie binnen sechs Monaten nach dem Tag, an dem die Eintragung des Formwechsels in das Register des Sitzes desjenigen Rechtsträgers, dessen Gläubiger sie sind, nach § 19 Abs. 3 UmwG als bekanntgemacht gilt, ihren Anspruch nach Grund und Höhe schriftlich anmelden, Sicherheit zu leisten, soweit sie nicht Befriedigung verlangen können. Dieses Recht steht den Gläubigern jedoch nur zu, wenn sie glaubhaft machen, dass durch den Formwechsel die Erfüllung ihrer Forderung gefährdet wird."
    },
    {
      "date": "2024-10-15",
      "id": "90461",
      "original_text": "Löschungsankündigung\nNiedersachsen Amtsgericht Braunschweig HRB 209151\nA&O Bau GmbH – Schladen",
      "type": "Löschungsankündigung",
      "state": "Niedersachsen",
      "amtsgericht": "Amtsgericht Braunschweig",
      "registernummer": "HRB 209151",
      "registerart": "HRB",
      "company_name": "A&O Bau GmbH",
      "company_seat": "Schladen",
      "details": "15.10.2024 (Bekanntmachungsdatum)\n\nNiedersachsen Amtsgericht Braunschweig HRB 209151\nLöschungsankündigung 15.10.2024 (Eintragungsdatum)\n\nA&O Bau GmbH\nGesellschaft mit beschränkter Haftung\nSchladen\n\nDas Registergericht beabsichtigt, die Gesellschaft von Amts wegen nach § 394 FamFG zu löschen. Die Frist zur Erhebung eines Widerspruchs ist auf 1 Monat ab dieser Registerbekanntmachung festgesetzt."
    },
    {
      "date": "2024-10-15",
      "id": "90421",
      "original_text": "Löschungsankündigung\nHamburg Amtsgericht Hamburg HRB 152587\nA.R. Capital GmbH – Hamburg",
      "type": "Löschungsankündigung",
      "state": "Hamburg",
      "amtsgericht": "Amtsgericht Hamburg",
      "registernummer": "HRB 152587",
      "registerart": "HRB",
      "company_name": "A.R. Capital GmbH",
      "company_seat": "Hamburg",
      "details": "15.10.2024 (Bekanntmachungsdatum)\n\nHamburg Amtsgericht Hamburg HRB 152587\nLöschungsankündigung\n\nA.R. Capital GmbH\nGesellschaft mit beschränkter Haftung\nHamburg\n\nDas Registergericht beabsichtigt, die im Handelsregister eingetragene Gesellschaft von Amts wegen nach § 394 FamFG zu löschen. Die Frist zur Erhebung eines Widerspruchs gegen die beabsichtigte Löschung wird auf 3 Monate festgesetzt."
    },
    {
      "date": "2024-10-15",
      "id": "90392",
      "original_text": "Einreichung neuer Dokumente\nBerlin Amtsgericht Berlin (Charlottenburg) HRB 125990\nALDB GmbH – Berlin",
      "type": "Einreichung neuer Dokumente",
      "state": "Berlin",
      "amtsgericht": "Amtsgericht Berlin (Charlottenburg)",
      "registernummer": "HRB 125990",
      "registerart": "HRB",
      "company_name": "ALDB GmbH",
      "company_seat": "Berlin",
      "details": "15.10.2024 (Bekanntmachungsdatum)\n\nBerlin Amtsgericht Berlin (Charlottenburg) HRB 125990\nEinreichung neuer Dokumente\n\nALDB GmbH\nGesellschaft mit beschränkter Haftung\nBerlin\n\nAls nicht eingetragen wird veröffentlicht: Es wurde eine neue Liste der Aufsichtsratsmitglieder eingereicht (§52 GmbHG)."
    },
    {
      "date": "2024-10-15",
      "id": "90502",
      "original_text": "Löschungsankündigung\nNordrhein-Westfalen Amtsgericht Kleve HRB 2315\nALL-IN GmbH – Kleve",
      "type": "Löschungsankündigung",
      "state": "Nordrhein-Westfalen",
      "amtsgericht": "Amtsgericht Kleve",
      "registernummer": "HRB 2315",
      "registerart": "HRB",
      "company_name": "ALL-IN GmbH",
      "company_seat": "Kleve",
      "details": "15.10.2024 (Bekanntmachungsdatum)\n\nNordrhein-Westfalen Amtsgericht Kleve HRB 2315\nLöschungsankündigung\n\nALL-IN GmbH\nGesellschaft mit beschränkter Haftung\nKleve\n\nDas Registergericht beabsichtigt die Gesellschaft von Amts wegen nach § 394 FamFG zu löschen. Die Frist zur Erhebung eines Widerspruchs ist auf einen Monat festgesetzt."
    },
    {
      "date": "2024-10-15",
      "id": "90459",
      "original_text": "Registerbekanntmachung nach dem Umwandlungsgesetz\nNiedersachsen Amtsgericht Osnabrück HRA 208917\nAS Sachs Trockenbau e. K. – Schüttorf",
      "type": "Registerbekanntmachung nach dem Umwandlungsgesetz",
      "state": "Niedersachsen",
      "amtsgericht": "Amtsgericht Osnabrück",
      "registernummer": "HRA 208917",
      "registerart": "HRA",
      "company_name": "AS Sachs Trockenbau e. K.",
      "company_seat": "Schüttorf",
      "details": "15.10.2024 (Bekanntmachungsdatum)\n\nNiedersachsen Amtsgericht Osnabrück HRA 208917\nRegisterbekanntmachung nach dem Umwandlungsgesetz 15.10.2024 (Eintragungsdatum)\n\nAS Sachs Trockenbau e. K.\nEinzelkaufmann / Einzelkauffrau\nSchüttorf\n\nDen Gläubigern der an der Ausgliederung beteiligten Rechtsträger ist, wenn sie binnen sechs Monaten nach dem Tag, an dem die Eintragung der Ausgliederung in das Register des Sitzes desjenigen Rechtsträgers, dessen Gläubiger sie sind, nach § 19 Abs. 3 UmwG als bekannt gemacht gilt, ihren Anspruch nach Grund und Höhe schriftlich anmelden, Sicherheit zu leisten, soweit sie nicht Befriedigung verlangen können. Dieses Recht steht den Gläubigern jedoch nur zu, wenn sie glaubhaft machen, dass durch die Ausgliederung die Erfüllung der Forderung gefährdet wird."
    },
    {
      "date": "2024-10-15",
      "id": "90473",
      "original_text": "Löschungsankündigung\nBremen Amtsgericht Bremen HRB 5216 BHV\nASEL GmbH – Bremerhaven",
      "type": "Löschungsankündigung",
      "state": "Bremen",
      "amtsgericht": "Amtsgericht Bremen",
      "registernummer": "HRB 5216 BHV",
      "registerart": "HRB",
      "company_name": "ASEL GmbH",
      "company_seat": "Bremerhaven",
      "details": "15.10.2024 (Bekanntmachungsdatum)\n\nBremen Amtsgericht Bremen HRB 5216 BHV\nLöschungsankündigung\n\nASEL GmbH\nGesellschaft mit beschränkter Haftung\nBremerhaven\n\nEs ist beabsichtigt die im Handelsregister eingetragene Gesellschaft von Amts wegen gemäß § 394 FamFG zu löschen. Gegen die Löschung kann beim AG Bremen schriftlich oder zu Protokoll der Geschäftsstelle Widerspruch eingelegt werden. Widerspruchsfrist 4 Wochen."
    },
    {
      "date": "2024-10-15",
      "id": "90370",
      "original_text": "Löschungsankündigung\nBerlin Amtsgericht Berlin (Charlottenburg) HRB 187431\nAZER Taxi GmbH – Berlin",
      "type": "Löschungsankündigung",
      "state": "Berlin",
      "amtsgericht": "Amtsgericht Berlin (Charlottenburg)",
      "registernummer": "HRB 187431",
      "registerart": "HRB",
      "company_name": "AZER Taxi GmbH",
      "company_seat": "Berlin",
      "details": "15.10.2024 (Bekanntmachungsdatum)\n\nBerlin Amtsgericht Berlin (Charlottenburg) HRB 187431\nLöschungsankündigung\n\nAZER Taxi GmbH\nGesellschaft mit beschränkter Haftung\nBerlin\n\nBei der nachstehenden Gesellschaft wird das Amtslöschungsverfahren gemäß § 394 FamFG eingeleitet. Widerspruchsfrist: 6 Wochen."
    },
    {
      "date": "2024-10-15",
      "id": "90406",
      "original_text": "Einreichung neuer Dokumente\nBaden-Württemberg Amtsgericht Mannheim HRB 740361\nAgosi AG – Pforzheim",
      "type": "Einreichung neuer Dokumente",
      "state": "Baden-Württemberg",
      "amtsgericht": "Amtsgericht Mannheim",
      "registernummer": "HRB 740361",
      "registerart": "HRB",
      "company_name": "Agosi AG",
      "company_seat": "Pforzheim",
      "details": "15.10.2024 (Bekanntmachungsdatum)\n\nBaden-Württemberg Amtsgericht Mannheim HRB 740361\nEinreichung neuer Dokumente\n\nAgosi AG\nAktiengesellschaft\nPforzheim\n\nDie Gesellschaft hat am 15.10.2024 die Liste über die Zusammensetzung des Aufsichtsrats zum Handelsregister eingereicht."
    },
    {
      "date": "2024-10-15",
      "id": "90471",
      "original_text": "Registerbekanntmachung nach dem Umwandlungsgesetz\nNiedersachsen Amtsgericht Lüneburg HRB 210191\nAmT Leitungsbau GmbH – Wietzendorf",
      "type": "Registerbekanntmachung nach dem Umwandlungsgesetz",
      "state": "Niedersachsen",
      "amtsgericht": "Amtsgericht Lüneburg",
      "registernummer": "HRB 210191",
      "registerart": "HRB",
      "company_name": "AmT Leitungsbau GmbH",
      "company_seat": "Wietzendorf",
      "details": "15.10.2024 (Bekanntmachungsdatum)\n\nNiedersachsen Amtsgericht Lüneburg HRB 210191\nRegisterbekanntmachung nach dem Umwandlungsgesetz 15.10.2024 (Eintragungsdatum)\n\nAmT Leitungsbau GmbH\nGesellschaft mit beschränkter Haftung\nWietzendorf\n\nDen Gläubigern der an der Ausgliederung beteiligten Rechtsträger ist, wenn sie binnen sechs Monaten nach dem Tag, an dem die Eintragung der Ausgliederung in das Register des Sitzes desjenigen Rechtsträgers, dessen Gläubiger sie sind, nach § 19 Abs. 3 UmwG als bekannt gemacht gilt, ihren Anspruch nach Grund und Höhe schriftlich anmelden, Sicherheit zu leisten, soweit sie nicht Befriedigung verlangen können. Dieses Recht steht den Gläubigern jedoch nur zu, wenn sie glaubhaft machen, dass durch die Ausgliederung die Erfüllung der Forderung gefährdet wird."
    },
    {
      "date": "2024-10-15",
      "id": "90408",
      "original_text": "Löschungsankündigung\nBerlin Amtsgericht Berlin (Charlottenburg) HRB 241142\nAmperand Germany GmbH – Berlin",
      "type": "Löschungsankündigung",
      "state": "Berlin",
      "amtsgericht": "Amtsgericht Berlin (Charlottenburg)",
      "registernummer": "HRB 241142",
      "registerart": "HRB",
      "company_name": "Amperand Germany GmbH",
      "company_seat": "Berlin",
      "details": "15.10.2024 (Bekanntmachungsdatum)\n\nBerlin Amtsgericht Berlin (Charlottenburg) HRB 241142\nLöschungsankündigung\n\nAmperand Germany GmbH\nGesellschaft mit beschränkter Haftung\nBerlin\n\nBei der nachstehenden Gesellschaft wird das Amtslöschungsverfahren gemäß § 394 FamFG eingeleitet. Widerspruchsfrist 6 Wochen"
    },
    {
      "date": "2024-10-15",
      "id": "90443",
      "original_text": "Einreichung neuer Dokumente\nBaden-Württemberg Amtsgericht Stuttgart HRB 206721\nAnixter Deutschland GmbH – Korntal-Münchingen",
      "type": "Einreichung neuer Dokumente",
      "state": "Baden-Württemberg",
      "amtsgericht": "Amtsgericht Stuttgart",
      "registernummer": "HRB 206721",
      "registerart": "HRB",
      "company_name": "Anixter Deutschland GmbH",
      "company_seat": "Korntal-Münchingen",
      "details": "15.10.2024 (Bekanntmachungsdatum)\n\nBaden-Württemberg Amtsgericht Stuttgart HRB 206721\nEinreichung neuer Dokumente\n\nAnixter Deutschland GmbH\nGesellschaft mit beschränkter Haftung\nKorntal-Münchingen\n\nDie Gesellschaft hat am 02.10.2024 die Liste über die Zusammensetzung des Aufsichtsrats zum Handelsregister eingereicht."
    },
    {
      "date": "2024-10-15",
      "id": "90368",
      "original_text": "Registerbekanntmachung nach dem Umwandlungsgesetz\nBayern Amtsgericht München HRB 200661\nAnlagenbau Oberland Verwaltungs GmbH – Oberhausen",
      "type": "Registerbekanntmachung nach dem Umwandlungsgesetz",
      "state": "Bayern",
      "amtsgericht": "Amtsgericht München",
      "registernummer": "HRB 200661",
      "registerart": "HRB",
      "company_name": "Anlagenbau Oberland Verwaltungs GmbH",
      "company_seat": "Oberhausen",
      "details": "15.10.2024 (Bekanntmachungsdatum)\n\nBayern Amtsgericht München HRB 200661\nRegisterbekanntmachung nach dem Umwandlungsgesetz 14.10.2024 (Eintragungsdatum)\n\nAnlagenbau Oberland Verwaltungs GmbH\nGesellschaft mit beschränkter Haftung\nOberhausen\n\nDen Gläubigern der an der Verschmelzung beteiligten Rechtsträger ist, wenn sie binnen sechs Monaten nach dem Tag, an dem die Eintragung der Verschmelzung in das Register des Sitzes desjenigen Rechtsträgers, dessen Gläubiger sie sind, nach § 19 Abs. 3 UmwG als bekannt gemacht gilt, ihren Anspruch nach Grund und Höhe schriftlich anmelden, Sicherheit zu leisten, soweit sie nicht Befriedigung verlangen können. Dieses Recht steht den Gläubigern jedoch nur zu, wenn sie glaubhaft machen, dass durch die Verschmelzung die Erfüllung ihrer Forderung gefährdet wird."
    },
    {
      "date": "2024-10-15",
      "id": "90486",
      "original_text": "Löschungsankündigung\nNordrhein-Westfalen Amtsgericht Köln HRB 14812\nAspides GmbH – Bergheim",
      "type": "Löschungsankündigung",
      "state": "Nordrhein-Westfalen",
      "amtsgericht": "Amtsgericht Köln",
      "registernummer": "HRB 14812",
      "registerart": "HRB",
      "company_name": "Aspides GmbH",
      "company_seat": "Bergheim",
      "details": "15.10.2024 (Bekanntmachungsdatum)\n\nNordrhein-Westfalen Amtsgericht Köln HRB 14812\nLöschungsankündigung\n\nAspides GmbH\nGesellschaft mit beschränkter Haftung\nBergheim\n\nDas Registergericht beabsichtigt die Gesellschaft von Amts wegen nach § 394 FamFG zu löschen. Die Frist zur Erhebung eines Widerspruchs ist auf einen Monat festgesetzt."
    },
    {
      "date": "2024-10-15",
      "id": "90417",
      "original_text": "Löschungsankündigung\nHamburg Amtsgericht Hamburg HRB 164399\nAtlantic Dienstleistungs GmbH – Hamburg",
      "type": "Löschungsankündigung",
      "state": "Hamburg",
      "amtsgericht": "Amtsgericht Hamburg",
      "registernummer": "HRB 164399",
      "registerart": "HRB",
      "company_name": "Atlantic Dienstleistungs GmbH",
      "company_seat": "Hamburg",
      "details": "15.10.2024 (Bekanntmachungsdatum)\n\nHamburg Amtsgericht Hamburg HRB 164399\nLöschungsankündigung\n\nAtlantic Dienstleistungs GmbH\nGesellschaft mit beschränkter Haftung\nHamburg\n\nDas Registergericht beabsichtigt, die im Handelsregister eingetragene Gesellschaft von Amts wegen nach § 394 FamFG zu löschen. Die Frist zur Erhebung eines Widerspruchs gegen die beabsichtigte Löschung wird auf 3 Monate festgesetzt."
    },
    {
      "date": "2024-10-15",
      "id": "90520",
      "original_text": "Löschungsankündigung\nHessen Amtsgericht Offenbach am Main HRB 4971\nAutohaus Nocht Gesellschaft mit beschränkter Haftung – Heusenstamm",
      "type": "Löschungsankündigung",
      "state": "Hessen",
      "amtsgericht": "Amtsgericht Offenbach am Main",
      "registernummer": "HRB 4971",
      "registerart": "HRB",
      "company_name": "Autohaus Nocht Gesellschaft mit beschränkter Haftung",
      "company_seat": "Heusenstamm",
      "details": "15.10.2024 (Bekanntmachungsdatum)\n\nHessen Amtsgericht Offenbach am Main HRB 4971\nLöschungsankündigung\n\nAutohaus Nocht Gesellschaft mit beschränkter Haftung\nGesellschaft mit beschränkter Haftung\nHeusenstamm\n\nDas Registergericht beabsichtigt die im Handelsregister eingetragene Gesellschaft von Amts wegen nach § 394 FamFG zu löschen. Die Frist zur Erhebung eines Widerspruchs gegen die beabsichtigte Löschung wird auf 3 Monate festgesetzt."
    },
    {
      "date": "2024-10-15",
      "id": "90352",
      "original_text": "Löschungsankündigung\nBayern Amtsgericht München HRB 244374\nB&D Technologie- und Vermögensverwaltungsgesellschaft UG (haftungsbeschränkt) – München",
      "type": "Löschungsankündigung",
      "state": "Bayern",
      "amtsgericht": "Amtsgericht München",
      "registernummer": "HRB 244374",
      "registerart": "HRB",
      "company_name": "B&D Technologie- und Vermögensverwaltungsgesellschaft UG (haftungsbeschränkt)",
      "company_seat": "München",
      "details": "15.10.2024 (Bekanntmachungsdatum)\n\nBayern Amtsgericht München HRB 244374\nLöschungsankündigung\n\nB&D Technologie- und Vermögensverwaltungsgesellschaft UG (haftungsbeschränkt)\nGesellschaft mit beschränkter Haftung\nMünchen\n\nDas Registergericht beabsichtigt, die im Handelsregister eingetragene Gesellschaft wegen Vermögenslosigkeit von Amts wegen nach § 394 FamFG zu löschen. #insert(Text=\"zztb_V_Widerspruchsfrist\")"
    },
    {
      "date": "2024-10-15",
      "id": "90369",
      "original_text": "Registerbekanntmachung nach dem Umwandlungsgesetz\nBayern Amtsgericht Bamberg HRA 13260\nBAURCONSULT Architekten Ingenieure AG & Co. KG – Haßfurt",
      "type": "Registerbekanntmachung nach dem Umwandlungsgesetz",
      "state": "Bayern",
      "amtsgericht": "Amtsgericht Bamberg",
      "registernummer": "HRA 13260",
      "registerart": "HRA",
      "company_name": "BAURCONSULT Architekten Ingenieure AG & Co. KG",
      "company_seat": "Haßfurt",
      "details": "15.10.2024 (Bekanntmachungsdatum)\n\nBayern Amtsgericht Bamberg HRA 13260\nRegisterbekanntmachung nach dem Umwandlungsgesetz 14.10.2024 (Eintragungsdatum)\n\nBAURCONSULT Architekten Ingenieure AG & Co. KG\nKommanditgesellschaft\nHaßfurt\n\nDen Gläubigern der an der Verschmelzung beteiligten Rechtsträger ist, wenn sie binnen sechs Monaten nach dem Tag, an dem die Eintragung der Verschmelzung in das Register des Sitzes desjenigen Rechtsträgers, dessen Gläubiger sie sind, nach § 19 Abs. 3 UmwG als bekannt gemacht gilt, ihren Anspruch nach Grund und Höhe schriftlich anmelden, Sicherheit zu leisten, soweit sie nicht Befriedigung verlangen können. Dieses Recht steht den Gläubigern jedoch nur zu, wenn sie glaubhaft machen, dass durch die Verschmelzung die Erfüllung ihrer Forderung gefährdet wird."
    },
    {
      "date": "2024-10-15",
      "id": "90343",
      "original_text": "Registerbekanntmachung nach dem Umwandlungsgesetz\nBayern Amtsgericht Bamberg GsR 125\nBC Strom eGbR – Haßfurt",
      "type": "Registerbekanntmachung nach dem Umwandlungsgesetz",
      "state": "Bayern",
      "amtsgericht": "Amtsgericht Bamberg",
      "registernummer": "GsR 125",
      "registerart": "GsR",
      "company_name": "BC Strom eGbR",
      "company_seat": "Haßfurt",
      "details": "15.10.2024 (Bekanntmachungsdatum)\n\nBayern Amtsgericht Bamberg GsR 125\nRegisterbekanntmachung nach dem Umwandlungsgesetz 14.10.2024 (Eintragungsdatum)\n\nBC Strom eGbR\nGesellschaft bürgerlichen Rechts\nHaßfurt\n\nDen Gläubigern der an der Verschmelzung beteiligten Rechtsträger ist, wenn sie binnen sechs Monaten nach dem Tag, an dem die Eintragung der Verschmelzung in das Register des Sitzes desjenigen Rechtsträgers, dessen Gläubiger sie sind, nach § 19 Abs. 3 UmwG als bekannt gemacht gilt, ihren Anspruch nach Grund und Höhe schriftlich anmelden, Sicherheit zu leisten, soweit sie nicht Befriedigung verlangen können. Dieses Recht steht den Gläubigern jedoch nur zu, wenn sie glaubhaft machen, dass durch die Verschmelzung die Erfüllung ihrer Forderung gefährdet wird."
    },
    {
      "date": "2024-10-15",
      "id": "90414",
      "original_text": "Löschungsankündigung\nHamburg Amtsgericht Hamburg HRB 146536\nBK Bauservice Nord GmbH – Hamburg",
      "type": "Löschungsankündigung",
      "state": "Hamburg",
      "amtsgericht": "Amtsgericht Hamburg",
      "registernummer": "HRB 146536",
      "registerart": "HRB",
      "company_name": "BK Bauservice Nord GmbH",
      "company_seat": "Hamburg",
      "details": "15.10.2024 (Bekanntmachungsdatum)\n\nHamburg Amtsgericht Hamburg HRB 146536\nLöschungsankündigung\n\nBK Bauservice Nord GmbH\nGesellschaft mit beschränkter Haftung\nHamburg\n\nDas Registergericht beabsichtigt, die im Handelsregister eingetragene Gesellschaft von Amts wegen nach § 394 FamFG zu löschen. Die Frist zur Erhebung eines Widerspruchs gegen die beabsichtigte Löschung wird auf 3 Monate festgesetzt."
    },
    {
      "date": "2024-10-15",
      "id": "90458",
      "original_text": "Löschungsankündigung\nSachsen Amtsgericht Leipzig HRB 20132\nBLLT International Trade GmbH – Leipzig",
      "type": "Löschungsankündigung",
      "state": "Sachsen",
      "amtsgericht": "Amtsgericht Leipzig",
      "registernummer": "HRB 20132",
      "registerart": "HRB",
      "company_name": "BLLT International Trade GmbH",
      "company_seat": "Leipzig",
      "details": "15.10.2024 (Bekanntmachungsdatum)\n\nSachsen Amtsgericht Leipzig HRB 20132\nLöschungsankündigung\n\nBLLT International Trade GmbH\nGesellschaft mit beschränkter Haftung\nLeipzig\n\nDas Registergericht beabsichtigt, die im Handelsregister eingetragene Gesellschaft von Amts wegen nach § 394 FamFG zu löschen. Die Frist zu Erhebung eines Widerspruchs gegen die beabsichtigte Löschung wird auf einen Monat festgesetzt."
    },
    {
      "date": "2024-10-15",
      "id": "90439",
      "original_text": "Löschungsankündigung\nBerlin Amtsgericht Berlin (Charlottenburg) HRA 33505\nBOS Berlin Oberspree Sondermaschinenbau GmbH & Co. Engeneering und Service KG – Berlin",
      "type": "Löschungsankündigung",
      "state": "Berlin",
      "amtsgericht": "Amtsgericht Berlin (Charlottenburg)",
      "registernummer": "HRA 33505",
      "registerart": "HRA",
      "company_name": "BOS Berlin Oberspree Sondermaschinenbau GmbH & Co. Engeneering und Service KG",
      "company_seat": "Berlin",
      "details": "15.10.2024 (Bekanntmachungsdatum)\n\nBerlin Amtsgericht Berlin (Charlottenburg) HRA 33505\nLöschungsankündigung\n\nBOS Berlin Oberspree Sondermaschinenbau GmbH & Co. Engeneering und Service KG\nKommanditgesellschaft\nBerlin\n\nBei dem nachstehenden Unternehmen / der nachstehenden Gesellschaft wird das Amtslöschungsverfahren gemäß § 31 Abs. 2 HGB eingeleitet. Widerspruchsfrist 1 Monat"
    },
    {
      "date": "2024-10-15",
      "id": "90512",
      "original_text": "Löschungsankündigung\nHessen Amtsgericht Offenbach am Main HRB 48456\nBTL Transport mit Bauleistungen GmbH – Rodgau",
      "type": "Löschungsankündigung",
      "state": "Hessen",
      "amtsgericht": "Amtsgericht Offenbach am Main",
      "registernummer": "HRB 48456",
      "registerart": "HRB",
      "company_name": "BTL Transport mit Bauleistungen GmbH",
      "company_seat": "Rodgau",
      "details": "15.10.2024 (Bekanntmachungsdatum)\n\nHessen Amtsgericht Offenbach am Main HRB 48456\nLöschungsankündigung\n\nBTL Transport mit Bauleistungen GmbH\nGesellschaft mit beschränkter Haftung\nRodgau\n\nDas Registergericht beabsichtigt die im Handelsregister eingetragene Gesellschaft von Amts wegen nach § 394 FamFG zu löschen. Die Frist zur Erhebung eines Widerspruchs gegen die beabsichtigte Löschung wird auf 3 Monate festgesetzt."
    },
    {
      "date": "2024-10-15",
      "id": "90412",
      "original_text": "Löschungsankündigung\nHamburg Amtsgericht Hamburg HRB 86699\nBWE Bauwerkserhaltung AG – Hamburg",
      "type": "Löschungsankündigung",
      "state": "Hamburg",
      "amtsgericht": "Amtsgericht Hamburg",
      "registernummer": "HRB 86699",
      "registerart": "HRB",
      "company_name": "BWE Bauwerkserhaltung AG",
      "company_seat": "Hamburg",
      "details": "15.10.2024 (Bekanntmachungsdatum)\n\nHamburg Amtsgericht Hamburg HRB 86699\nLöschungsankündigung\n\nBWE Bauwerkserhaltung AG\nAktiengesellschaft\nHamburg\n\nDas Registergericht beabsichtigt, die im Handelsregister eingetragene Gesellschaft von Amts wegen nach § 394 FamFG zu löschen. Die Frist zur Erhebung eines Widerspruchs gegen die beabsichtigte Löschung wird auf 3 Monate festgesetzt."
    },
    {
      "date": "2024-10-15",
      "id": "90490",
      "original_text": "Sonstige Registerbekanntmachung\nNordrhein-Westfalen Amtsgericht Köln HRB 45129\nBasell Polyolefine GmbH – Wesseling",
      "type": "Sonstige Registerbekanntmachung",
      "state": "Nordrhein-Westfalen",
      "amtsgericht": "Amtsgericht Köln",
      "registernummer": "HRB 45129",
      "registerart": "HRB",
      "company_name": "Basell Polyolefine GmbH",
      "company_seat": "Wesseling",
      "details": "15.10.2024 (Bekanntmachungsdatum)\n\nNordrhein-Westfalen Amtsgericht Köln HRB 45129\nSonstige Registerbekanntmachung\n\nBasell Polyolefine GmbH\nGesellschaft mit beschränkter Haftung\nWesseling\n\nDem Registergericht ist eine Liste der Mitglieder des Aufsichtsrates eingereicht worden."
    },
    {
      "date": "2024-10-15",
      "id": "90426",
      "original_text": "Löschungsankündigung\nHamburg Amtsgericht Hamburg HRB 173425\nBenjamins Raumausstattung und Bau GmbH – Hamburg",
      "type": "Löschungsankündigung",
      "state": "Hamburg",
      "amtsgericht": "Amtsgericht Hamburg",
      "registernummer": "HRB 173425",
      "registerart": "HRB",
      "company_name": "Benjamins Raumausstattung und Bau GmbH",
      "company_seat": "Hamburg",
      "details": "15.10.2024 (Bekanntmachungsdatum)\n\nHamburg Amtsgericht Hamburg HRB 173425\nLöschungsankündigung\n\nBenjamins Raumausstattung und Bau GmbH\nGesellschaft mit beschränkter Haftung\nHamburg\n\nDas Registergericht beabsichtigt, die im Handelsregister eingetragene Gesellschaft von Amts wegen nach § 394 FamFG zu löschen. Die Frist zur Erhebung eines Widerspruchs gegen die beabsichtigte Löschung wird auf 3 Monate festgesetzt."
    },
    {
      "date": "2024-10-15",
      "id": "90349",
      "original_text": "Registerbekanntmachung nach dem Umwandlungsgesetz\nBayern Amtsgericht Traunstein HRB 21310\nBluberries GmbH – Amerang",
      "type": "Registerbekanntmachung nach dem Umwandlungsgesetz",
      "state": "Bayern",
      "amtsgericht": "Amtsgericht Traunstein",
      "registernummer": "HRB 21310",
      "registerart": "HRB",
      "company_name": "Bluberries GmbH",
      "company_seat": "Amerang",
      "details": "15.10.2024 (Bekanntmachungsdatum)\n\nBayern Amtsgericht Traunstein HRB 21310\nRegisterbekanntmachung nach dem Umwandlungsgesetz 14.10.2024 (Eintragungsdatum)\n\nBluberries GmbH\nGesellschaft mit beschränkter Haftung\nAmerang\n\nDen Gläubigern der an der Verschmelzung beteiligten Rechtsträger ist, wenn sie binnen sechs Monaten nach dem Tag, an dem die Eintragung der Verschmelzung in das Register des Sitzes desjenigen Rechtsträgers, dessen Gläubiger sie sind, nach § 19 Abs. 3 UmwG als bekannt gemacht gilt, ihren Anspruch nach Grund und Höhe schriftlich anmelden, Sicherheit zu leisten, soweit sie nicht Befriedigung verlangen können. Dieses Recht steht den Gläubigern jedoch nur zu, wenn sie glaubhaft machen, dass durch die Verschmelzung die Erfüllung ihrer Forderung gefährdet wird."
    },
    {
      "date": "2024-10-15",
      "id": "90442",
      "original_text": "Registerbekanntmachung nach dem Umwandlungsgesetz\nBaden-Württemberg Amtsgericht Stuttgart HRB 300507\nBär GmbH – Bietigheim-Bissingen",
      "type": "Registerbekanntmachung nach dem Umwandlungsgesetz",
      "state": "Baden-Württemberg",
      "amtsgericht": "Amtsgericht Stuttgart",
      "registernummer": "HRB 300507",
      "registerart": "HRB",
      "company_name": "Bär GmbH",
      "company_seat": "Bietigheim-Bissingen",
      "details": "15.10.2024 (Bekanntmachungsdatum)\n\nBaden-Württemberg Amtsgericht Stuttgart HRB 300507\nRegisterbekanntmachung nach dem Umwandlungsgesetz 15.10.2024 (Eintragungsdatum)\n\nBär GmbH\nGesellschaft mit beschränkter Haftung\nBietigheim-Bissingen\n\nAls nicht eingetragen wird bekanntgemacht:\nDen Gläubigern der an der Abspaltung beteiligten Rechtsträger ist, wenn sie binnen sechs Monaten nach dem Tag, an dem die Eintragung der Abspaltung in das Register des Sitzes desjenigen Rechtsträgers, dessen Gläubiger sie sind, nach § 19 Abs. 3 UmwG als bekanntgemacht gilt, ihren Anspruch nach Grund und Höhe schriftlich anmelden, Sicherheit zu leisten, soweit sie nicht Befriedigung verlangen können. Dieses Recht steht den Gläubigern jedoch nur zu, wenn sie glaubhaft machen, dass durch die Abspaltung die Erfüllung ihrer Forderung gefährdet wird."
    },
    {
      "date": "2024-10-15",
      "id": "90455",
      "original_text": "Einreichung neuer Dokumente\nBaden-Württemberg Amtsgericht Stuttgart HRB 779139\nBühlerHealthCare AG – Fellbach",
      "type": "Einreichung neuer Dokumente",
      "state": "Baden-Württemberg",
      "amtsgericht": "Amtsgericht Stuttgart",
      "registernummer": "HRB 779139",
      "registerart": "HRB",
      "company_name": "BühlerHealthCare AG",
      "company_seat": "Fellbach",
      "details": "15.10.2024 (Bekanntmachungsdatum)\n\nBaden-Württemberg Amtsgericht Stuttgart HRB 779139\nEinreichung neuer Dokumente 15.10.2024 (Eintragungsdatum)\n\nBühlerHealthCare AG\nAktiengesellschaft\nFellbach\n\nDie Gesellschaft hat am 14.10.2024 die Liste über die Zusammensetzung des Aufsichtsrats zum Handelsregister eingereicht."
    },
    {
      "date": "2024-10-15",
      "id": "90355",
      "original_text": "Registerbekanntmachung nach dem Umwandlungsgesetz\nBayern Amtsgericht München HRB 155696\nCOMVEL GmbH – München",
      "type": "Registerbekanntmachung nach dem Umwandlungsgesetz",
      "state": "Bayern",
      "amtsgericht": "Amtsgericht München",
      "registernummer": "HRB 155696",
      "registerart": "HRB",
      "company_name": "COMVEL GmbH",
      "company_seat": "München",
      "details": "15.10.2024 (Bekanntmachungsdatum)\n\nBayern Amtsgericht München HRB 155696\nRegisterbekanntmachung nach dem Umwandlungsgesetz 14.10.2024 (Eintragungsdatum)\n\nCOMVEL GmbH\nGesellschaft mit beschränkter Haftung\nMünchen\n\nDen Gläubigern der an der Verschmelzung beteiligten Rechtsträger ist, wenn sie binnen sechs Monaten nach dem Tag, an dem die Eintragung der Verschmelzung in das Register des Sitzes desjenigen Rechtsträgers, dessen Gläubiger sie sind, nach § 19 Abs. 3 UmwG als bekannt gemacht gilt, ihren Anspruch nach Grund und Höhe schriftlich anmelden, Sicherheit zu leisten, soweit sie nicht Befriedigung verlangen können. Dieses Recht steht den Gläubigern jedoch nur zu, wenn sie glaubhaft machen, dass durch die Verschmelzung die Erfüllung ihrer Forderung gefährdet wird."
    },
    {
      "date": "2024-10-15",
      "id": "90360",
      "original_text": "Einreichung neuer Dokumente\nBayern Amtsgericht München HRB 222809\nCRX Markets AG – München",
      "type": "Einreichung neuer Dokumente",
      "state": "Bayern",
      "amtsgericht": "Amtsgericht München",
      "registernummer": "HRB 222809",
      "registerart": "HRB",
      "company_name": "CRX Markets AG",
      "company_seat": "München",
      "details": "15.10.2024 (Bekanntmachungsdatum)\n\nBayern Amtsgericht München HRB 222809\nEinreichung neuer Dokumente\n\nCRX Markets AG\nAktiengesellschaft\nMünchen\n\nDem #Re.Name ist eine Liste der Mitglieder des Aufsichtsrats eingereicht worden, § 106 AktG."
    },
    {
      "date": "2024-10-15",
      "id": "90532",
      "original_text": "Löschungsankündigung\nHessen Amtsgericht Offenbach am Main HRB 50300\nCS Construction Solutions GmbH – Rodgau",
      "type": "Löschungsankündigung",
      "state": "Hessen",
      "amtsgericht": "Amtsgericht Offenbach am Main",
      "registernummer": "HRB 50300",
      "registerart": "HRB",
      "company_name": "CS Construction Solutions GmbH",
      "company_seat": "Rodgau",
      "details": "15.10.2024 (Bekanntmachungsdatum)\n\nHessen Amtsgericht Offenbach am Main HRB 50300\nLöschungsankündigung\n\nCS Construction Solutions GmbH\nGesellschaft mit beschränkter Haftung\nRodgau\n\nDas Registergericht beabsichtigt die im Handelsregister eingetragene Gesellschaft von Amts wegen nach § 394 FamFG zu löschen. Die Frist zur Erhebung eines Widerspruchs gegen die beabsichtigte Löschung wird auf 3 Monate festgesetzt."
    },
    {
      "date": "2024-10-15",
      "id": "90457",
      "original_text": "Einreichung neuer Dokumente\nSachsen Amtsgericht Chemnitz HRB 651\nChemnitzer Verkehrs-Aktiengesellschaft – Chemnitz",
      "type": "Einreichung neuer Dokumente",
      "state": "Sachsen",
      "amtsgericht": "Amtsgericht Chemnitz",
      "registernummer": "HRB 651",
      "registerart": "HRB",
      "company_name": "Chemnitzer Verkehrs-Aktiengesellschaft",
      "company_seat": "Chemnitz",
      "details": "15.10.2024 (Bekanntmachungsdatum)\n\nSachsen Amtsgericht Chemnitz HRB 651\nEinreichung neuer Dokumente\n\nChemnitzer Verkehrs-Aktiengesellschaft\nAktiengesellschaft\nChemnitz\n\nAm 14.10.2024 wurde beim Handelsregister des Amtsgerichts Chemnitz die Liste der Mitglieder des Aufsichtsrats gemäß § 106 AktG eingereicht."
    },
    {
      "date": "2024-10-15",
      "id": "90491",
      "original_text": "Registerbekanntmachung nach dem Umwandlungsgesetz\nNordrhein-Westfalen Amtsgericht Düsseldorf HRB 61333\nConvalid GmbH – Düsseldorf",
      "type": "Registerbekanntmachung nach dem Umwandlungsgesetz",
      "state": "Nordrhein-Westfalen",
      "amtsgericht": "Amtsgericht Düsseldorf",
      "registernummer": "HRB 61333",
      "registerart": "HRB",
      "company_name": "Convalid GmbH",
      "company_seat": "Düsseldorf",
      "details": "15.10.2024 (Bekanntmachungsdatum)\n\nNordrhein-Westfalen Amtsgericht Düsseldorf HRB 61333\nRegisterbekanntmachung nach dem Umwandlungsgesetz 15.10.2024 (Eintragungsdatum)\n\nConvalid GmbH\nGesellschaft mit beschränkter Haftung\nDüsseldorf\n\nDen Gläubigern der an der Verschmelzung beteiligten Rechtsträger ist, wenn sie binnen sechs Monaten nach dem Tag, an dem die Eintragung der Verschmelzung in das Register des Sitzes desjenigen Rechtsträgers, dessen Gläubiger sie sind, nach § 19 Absatz 3 UmwG als bekanntgemacht gilt, ihren Anspruch nach Grund und Höhe schriftlich anmelden, Sicherheit zu leisten, soweit sie nicht Befriedigung verlangen können. Dieses Recht steht den Gläubigern jedoch nur zu, wenn sie glaubhaft machen, dass durch die Verschmelzung die Erfüllung ihrer Forderung gefährdet wird."
    },
    {
      "date": "2024-10-15",
      "id": "90337",
      "original_text": "Registerbekanntmachung nach dem Umwandlungsgesetz\nBayern Amtsgericht Augsburg HRB 37274\nCreative Crowd GmbH – Gersthofen",
      "type": "Registerbekanntmachung nach dem Umwandlungsgesetz",
      "state": "Bayern",
      "amtsgericht": "Amtsgericht Augsburg",
      "registernummer": "HRB 37274",
      "registerart": "HRB",
      "company_name": "Creative Crowd GmbH",
      "company_seat": "Gersthofen",
      "details": "15.10.2024 (Bekanntmachungsdatum)\n\nBayern Amtsgericht Augsburg HRB 37274\nRegisterbekanntmachung nach dem Umwandlungsgesetz 14.10.2024 (Eintragungsdatum)\n\nCreative Crowd GmbH\nGesellschaft mit beschränkter Haftung\nGersthofen\n\nDen Gläubigern der an der Verschmelzung beteiligten Rechtsträger ist, wenn sie binnen sechs Monaten nach dem Tag, an dem die Eintragung der Verschmelzung in das Register des Sitzes desjenigen Rechtsträgers, dessen Gläubiger sie sind, nach § 19 Abs. 3 UmwG als bekannt gemacht gilt, ihren Anspruch nach Grund und Höhe schriftlich anmelden, Sicherheit zu leisten, soweit sie nicht Befriedigung verlangen können. Dieses Recht steht den Gläubigern jedoch nur zu, wenn sie glaubhaft machen, dass durch die Verschmelzung die Erfüllung ihrer Forderung gefährdet wird."
    },
    {
      "date": "2024-10-15",
      "id": "90433",
      "original_text": "Löschungsankündigung\nHamburg Amtsgericht Hamburg HRB 174487\nD+S Hamburg GmbH – Hamburg",
      "type": "Löschungsankündigung",
      "state": "Hamburg",
      "amtsgericht": "Amtsgericht Hamburg",
      "registernummer": "HRB 174487",
      "registerart": "HRB",
      "company_name": "D+S Hamburg GmbH",
      "company_seat": "Hamburg",
      "details": "15.10.2024 (Bekanntmachungsdatum)\n\nHamburg Amtsgericht Hamburg HRB 174487\nLöschungsankündigung\n\nD+S Hamburg GmbH\nGesellschaft mit beschränkter Haftung\nHamburg\n\nDas Registergericht beabsichtigt, die im Handelsregister eingetragene Gesellschaft von Amts wegen nach § 394 FamFG zu löschen. Die Frist zur Erhebung eines Widerspruchs gegen die beabsichtigte Löschung wird auf 3 Monate festgesetzt."
    },
    {
      "date": "2024-10-15",
      "id": "90393",
      "original_text": "Löschungsankündigung\nBerlin Amtsgericht Berlin (Charlottenburg) HRB 174900\nD.M.E. GmbH - Deutsche Maschinen und Ersatzteillieferung GmbH – Berlin",
      "type": "Löschungsankündigung",
      "state": "Berlin",
      "amtsgericht": "Amtsgericht Berlin (Charlottenburg)",
      "registernummer": "HRB 174900",
      "registerart": "HRB",
      "company_name": "D.M.E. GmbH - Deutsche Maschinen und Ersatzteillieferung GmbH",
      "company_seat": "Berlin",
      "details": "15.10.2024 (Bekanntmachungsdatum)\n\nBerlin Amtsgericht Berlin (Charlottenburg) HRB 174900\nLöschungsankündigung\n\nD.M.E. GmbH - Deutsche Maschinen und Ersatzteillieferung GmbH\nGesellschaft mit beschränkter Haftung\nBerlin\n\nBei der nachstehenden Gesellschaft wird das Amtslöschungsverfahren gemäß § 394 FamFG eingeleitet. Widerspruchsfrist 6 Wochen"
    },
    {
      "date": "2024-10-15",
      "id": "90505",
      "original_text": "Löschungsankündigung\nNordrhein-Westfalen Amtsgericht Wuppertal HRB 32858\nDAG Logistik GmbH – Wuppertal",
      "type": "Löschungsankündigung",
      "state": "Nordrhein-Westfalen",
      "amtsgericht": "Amtsgericht Wuppertal",
      "registernummer": "HRB 32858",
      "registerart": "HRB",
      "company_name": "DAG Logistik GmbH",
      "company_seat": "Wuppertal",
      "details": "15.10.2024 (Bekanntmachungsdatum)\n\nNordrhein-Westfalen Amtsgericht Wuppertal HRB 32858\nLöschungsankündigung 14.10.2024 (Eintragungsdatum)\n\nDAG Logistik GmbH\nGesellschaft mit beschränkter Haftung\nWuppertal\n\nDas Registergericht beabsichtigt die Gesellschaft von Amts wegen nach § 394 FamFG zu löschen. Die Frist zur Erhebung eines Widerspruchs ist auf einen Monat festgesetzt."
    },
    {
      "date": "2024-10-15",
      "id": "90449",
      "original_text": "Löschungsankündigung\nMecklenburg-Vorpommern Amtsgericht Rostock HRB 7163\nDARA Bauträger GmbH – Rostock",
      "type": "Löschungsankündigung",
      "state": "Mecklenburg-Vorpommern",
      "amtsgericht": "Amtsgericht Rostock",
      "registernummer": "HRB 7163",
      "registerart": "HRB",
      "company_name": "DARA Bauträger GmbH",
      "company_seat": "Rostock",
      "details": "15.10.2024 (Bekanntmachungsdatum)\n\nMecklenburg-Vorpommern Amtsgericht Rostock HRB 7163\nLöschungsankündigung\n\nDARA Bauträger GmbH\nGesellschaft mit beschränkter Haftung\nRostock\n\nDas Registergericht beabsichtigt, die im Handelsregister eingetragene Gesellschaft von Amts wegen nach § 394 FamFG zu löschen. Die Frist zur Erhebung eines Widerspruchs gegen die beabsichtigte Löschung wird auf einen Monat festgesetzt."
    },
    {
      "date": "2024-10-15",
      "id": "90432",
      "original_text": "Löschungsankündigung\nHamburg Amtsgericht Hamburg HRB 167941\nDHXOMI Unterbeteiligungs UG (haftungsbeschränkt) – Hamburg",
      "type": "Löschungsankündigung",
      "state": "Hamburg",
      "amtsgericht": "Amtsgericht Hamburg",
      "registernummer": "HRB 167941",
      "registerart": "HRB",
      "company_name": "DHXOMI Unterbeteiligungs UG (haftungsbeschränkt)",
      "company_seat": "Hamburg",
      "details": "15.10.2024 (Bekanntmachungsdatum)\n\nHamburg Amtsgericht Hamburg HRB 167941\nLöschungsankündigung\n\nDHXOMI Unterbeteiligungs UG (haftungsbeschränkt)\nGesellschaft mit beschränkter Haftung\nHamburg\n\nDas Registergericht beabsichtigt, die im Handelsregister eingetragene Gesellschaft von Amts wegen nach § 394 FamFG zu löschen. Die Frist zur Erhebung eines Widerspruchs gegen die beabsichtigte Löschung wird auf 3 Monate festgesetzt."
    },
    {
      "date": "2024-10-15",
      "id": "90507",
      "original_text": "Löschungsankündigung\nNordrhein-Westfalen Amtsgericht Köln HRB 101863\nDalma Bau GmbH – Köln",
      "type": "Löschungsankündigung",
      "state": "Nordrhein-Westfalen",
      "amtsgericht": "Amtsgericht Köln",
      "registernummer": "HRB 101863",
      "registerart": "HRB",
      "company_name": "Dalma Bau GmbH",
      "company_seat": "Köln",
      "details": "15.10.2024 (Bekanntmachungsdatum)\n\nNordrhein-Westfalen Amtsgericht Köln HRB 101863\nLöschungsankündigung\n\nDalma Bau GmbH\nGesellschaft mit beschränkter Haftung\nKöln\n\nDas Registergericht beabsichtigt die Gesellschaft von Amts wegen nach § 394 FamFG zu löschen. Die Frist zur Erhebung eines Widerspruchs ist auf einen Monat festgesetzt."
    },
    {
      "date": "2024-10-15",
      "id": "90469",
      "original_text": "Registerbekanntmachung nach dem Umwandlungsgesetz\nNiedersachsen Amtsgericht Oldenburg (Oldenburg) HRA 208543\nDennis Menkens Besitzunternehmen e. K. – Oldenburg",
      "type": "Registerbekanntmachung nach dem Umwandlungsgesetz",
      "state": "Niedersachsen",
      "amtsgericht": "Amtsgericht Oldenburg (Oldenburg)",
      "registernummer": "HRA 208543",
      "registerart": "HRA",
      "company_name": "Dennis Menkens Besitzunternehmen e. K.",
      "company_seat": "Oldenburg",
      "details": "15.10.2024 (Bekanntmachungsdatum)\n\nNiedersachsen Amtsgericht Oldenburg (Oldenburg) HRA 208543\nRegisterbekanntmachung nach dem Umwandlungsgesetz 15.10.2024 (Eintragungsdatum)\n\nDennis Menkens Besitzunternehmen e. K.\nEinzelkaufmann / Einzelkauffrau\nOldenburg\n\nDen Gläubigern der an der Ausgliederung beteiligten Rechtsträger ist, wenn sie binnen sechs Monaten nach dem Tag, an dem die Eintragung der Ausgliederung in das Register des Sitzes desjenigen Rechtsträgers, dessen Gläubiger sie sind, nach § 19 Abs. 3 UmwG als bekannt gemacht gilt, ihren Anspruch nach Grund und Höhe schriftlich anmelden, Sicherheit zu leisten, soweit sie nicht Befriedigung verlangen können. Dieses Recht steht den Gläubigern jedoch nur zu, wenn sie glaubhaft machen, dass durch die Ausgliederung die Erfüllung der Forderung gefährdet wird."
    },
    {
      "date": "2024-10-15",
      "id": "90437",
      "original_text": "Löschungsankündigung\nHamburg Amtsgericht Hamburg HRA 129631\nDesign Thinking Center GmbH & Co. KG – Hamburg",
      "type": "Löschungsankündigung",
      "state": "Hamburg",
      "amtsgericht": "Amtsgericht Hamburg",
      "registernummer": "HRA 129631",
      "registerart": "HRA",
      "company_name": "Design Thinking Center GmbH & Co. KG",
      "company_seat": "Hamburg",
      "details": "15.10.2024 (Bekanntmachungsdatum)\n\nHamburg Amtsgericht Hamburg HRA 129631\nLöschungsankündigung\n\nDesign Thinking Center GmbH & Co. KG\nKommanditgesellschaft\nHamburg\n\nDas Registergericht beabsichtigt, die im Handelsregister eingetragene Firma von Amts wegen nach § 31 Abs. 2 HGB zu löschen. Die Frist zur Erhebung eines Widerspruchs gegen die beabsichtigte Löschung wird auf 3 Monate festgesetzt."
    },
    {
      "date": "2024-10-15",
      "id": "90389",
      "original_text": "Registerbekanntmachung nach dem Umwandlungsgesetz\nBerlin Amtsgericht Berlin (Charlottenburg) HRB 259093\nDie Gesellschaft für eine gute Zukunft DG mbH – Berlin",
      "type": "Registerbekanntmachung nach dem Umwandlungsgesetz",
      "state": "Berlin",
      "amtsgericht": "Amtsgericht Berlin (Charlottenburg)",
      "registernummer": "HRB 259093",
      "registerart": "HRB",
      "company_name": "Die Gesellschaft für eine gute Zukunft DG mbH",
      "company_seat": "Berlin",
      "details": "15.10.2024 (Bekanntmachungsdatum)\n\nBerlin Amtsgericht Berlin (Charlottenburg) HRB 259093\nRegisterbekanntmachung nach dem Umwandlungsgesetz 14.10.2024 (Eintragungsdatum)\n\nDie Gesellschaft für eine gute Zukunft DG mbH\nGesellschaft mit beschränkter Haftung\nBerlin\n\nZu Eintragungsnummer 3 vom 14.10.2024 wird als nicht eingetragen veröffentlicht: Den Gläubigern der an der Spaltung beteiligten Rechtsträger ist, wenn sie binnen sechs Monaten nach dem Tag, an dem die Eintragung der Spaltung in das Register des Sitzes desjenigen Rechtsträgers, dessen Gläubiger sie sind, als bekannt gemacht gilt, ihren Anspruch nach Grund und Höhe schriftlich anmelden, Sicherheit zu leisten, soweit sie nicht Befriedigung verlangen können. Dieses Recht steht den Gläubigern jedoch nur zu, wenn sie glaubhaft machen, dass durch die Spaltung die Erfüllung ihrer Forderung gefährdet wird. Das Recht, Sicherheitsleistung zu verlangen, steht Gläubigern nicht zu, die im Falle der Insolvenz ein Recht auf vorzugsweise Befriedigung aus einer Deckungsmasse haben, die nach gesetzlicher Vorschrift zu ihrem Schutz errichtet und staatlich überwacht ist."
    },
    {
      "date": "2024-10-15",
      "id": "90345",
      "original_text": "Registerbekanntmachung nach dem Umwandlungsgesetz\nBayern Amtsgericht Nürnberg HRA 19964\nDie Reisegalerie Travel Designer OHG – Roth",
      "type": "Registerbekanntmachung nach dem Umwandlungsgesetz",
      "state": "Bayern",
      "amtsgericht": "Amtsgericht Nürnberg",
      "registernummer": "HRA 19964",
      "registerart": "HRA",
      "company_name": "Die Reisegalerie Travel Designer OHG",
      "company_seat": "Roth",
      "details": "15.10.2024 (Bekanntmachungsdatum)\n\nBayern Amtsgericht Nürnberg HRA 19964\nRegisterbekanntmachung nach dem Umwandlungsgesetz 14.10.2024 (Eintragungsdatum)\n\nDie Reisegalerie Travel Designer OHG\nOffene Handelsgesellschaft\nRoth\n\nDen Gläubigern des formwechselnden Rechtsträgers ist, wenn sie binnen sechs Monaten nach dem Tag, an dem die Eintragung des Formwechsels nach § 201 UmwG als bekannt gemacht gilt, ihren Anspruch nach Grund und Höhe schriftlich anmelden, Sicherheit zu leisten, soweit sie nicht Befriedigung verlangen können. Dieses Recht steht den Gläubigern jedoch nur zu, wenn sie glaubhaft machen, dass durch den Formwechsel die Erfüllung ihrer Forderung gefährdet wird."
    },
    {
      "date": "2024-10-15",
      "id": "90508",
      "original_text": "Registerbekanntmachung nach dem Umwandlungsgesetz\nNordrhein-Westfalen Amtsgericht Coesfeld HRA 9791\nDieter Beuting GmbH & Co. KG – Vreden",
      "type": "Registerbekanntmachung nach dem Umwandlungsgesetz",
      "state": "Nordrhein-Westfalen",
      "amtsgericht": "Amtsgericht Coesfeld",
      "registernummer": "HRA 9791",
      "registerart": "HRA",
      "company_name": "Dieter Beuting GmbH & Co. KG",
      "company_seat": "Vreden",
      "details": "15.10.2024 (Bekanntmachungsdatum)\n\nNordrhein-Westfalen Amtsgericht Coesfeld HRA 9791\nRegisterbekanntmachung nach dem Umwandlungsgesetz 15.10.2024 (Eintragungsdatum)\n\nDieter Beuting GmbH & Co. KG\nKommanditgesellschaft\nVreden\n\nDen Gläubigern der an der Ausgliederung beteiligten Rechtsträger ist, wenn sie binnen sechs Monaten nach dem Tag, an dem die Eintragung der Ausgliederung in das Register des Sitzes desjenigen Rechtsträgers, dessen Gläubiger sie sind, nach § 19 Absatz 3 UmwG als bekannt gemacht gilt, ihren Anspruch nach Grund und Höhe schriftlich anmelden, Sicherheit zu leisten, soweit sie nicht Befriedigung verlangen können. Dieses Recht steht den Gläubigern jedoch nur zu, wenn sie glaubhaft machen, dass durch die Ausgliederung die Erfüllung ihrer Forderung gefährdet wird."
    },
    {
      "date": "2024-10-15",
      "id": "90497",
      "original_text": "Registerbekanntmachung nach dem Umwandlungsgesetz\nNordrhein-Westfalen Amtsgericht Köln HRA 37692\nDobroshi & Dobroshi OHG – Köln",
      "type": "Registerbekanntmachung nach dem Umwandlungsgesetz",
      "state": "Nordrhein-Westfalen",
      "amtsgericht": "Amtsgericht Köln",
      "registernummer": "HRA 37692",
      "registerart": "HRA",
      "company_name": "Dobroshi & Dobroshi OHG",
      "company_seat": "Köln",
      "details": "15.10.2024 (Bekanntmachungsdatum)\n\nNordrhein-Westfalen Amtsgericht Köln HRA 37692\nRegisterbekanntmachung nach dem Umwandlungsgesetz 15.10.2024 (Eintragungsdatum)\n\nDobroshi & Dobroshi OHG\nOffene Handelsgesellschaft\nKöln\n\nDen Gläubigern der an der Verschmelzung beteiligten Rechtsträger ist, wenn sie binnen sechs Monaten nach dem Tag, an dem die Eintragung der Verschmelzung in das Register des Sitzes derjenigen Rechtsträger deren Gläubiger sie sind, nach § 19 Absatz 3 UmwG als bekanntgemacht gilt, ihren Anspruch nach Grund und Höhe schriftlich anmelden, Sicherheit zu leisten, soweit sie nicht Befriedigung verlangen können. Dieses Recht steht den Gläubigern jedoch nur zu, wenn sie glaubhaft machen, dass durch die Verschmelzung die Erfüllung ihrer Forderung gefährdet wird."
    },
    {
      "date": "2024-10-15",
      "id": "90510",
      "original_text": "Registerbekanntmachung nach dem Umwandlungsgesetz\nThüringen Amtsgericht Jena HRB 510750\nDomal Grundstücksgesellschaft mbH – Stadtilm",
      "type": "Registerbekanntmachung nach dem Umwandlungsgesetz",
      "state": "Thüringen",
      "amtsgericht": "Amtsgericht Jena",
      "registernummer": "HRB 510750",
      "registerart": "HRB",
      "company_name": "Domal Grundstücksgesellschaft mbH",
      "company_seat": "Stadtilm",
      "details": "15.10.2024 (Bekanntmachungsdatum)\n\nThüringen Amtsgericht Jena HRB 510750\nRegisterbekanntmachung nach dem Umwandlungsgesetz 15.10.2024 (Eintragungsdatum)\n\nDomal Grundstücksgesellschaft mbH\nGesellschaft mit beschränkter Haftung\nStadtilm\n\nNicht eingetragen: Den Gläubigern der an der Verschmelzung beteiligten Rechtsträger, ist wenn sie binnen sechs Monaten nach dem Tag, an dem die Eintragung der Verschmelzung in das Register des Sitzes desjenigen Rechtsträgers, dessen Gläubiger sie sind,  nach § 19 Abs. 3 UmwG als bekanntgemacht gilt, ihren Anspruch nach Grund und Höhe schriftlich anmelden, Sicherheit zu leisten, soweit sie nicht Befriedigung verlangen können. Dieses Recht steht ihnen jedoch nur zu, wenn sie glaubhaft machen, daß durch die Verschmelzung die Erfüllung ihrer Forderung gefährdet wird."
    },
    {
      "date": "2024-10-15",
      "id": "90529",
      "original_text": "Löschungsankündigung\nHessen Amtsgericht Offenbach am Main HRB 54464\nE & B GmbH – Egelsbach",
      "type": "Löschungsankündigung",
      "state": "Hessen",
      "amtsgericht": "Amtsgericht Offenbach am Main",
      "registernummer": "HRB 54464",
      "registerart": "HRB",
      "company_name": "E & B GmbH",
      "company_seat": "Egelsbach",
      "details": "15.10.2024 (Bekanntmachungsdatum)\n\nHessen Amtsgericht Offenbach am Main HRB 54464\nLöschungsankündigung\n\nE & B GmbH\nGesellschaft mit beschränkter Haftung\nEgelsbach\n\nDas Registergericht beabsichtigt die im Handelsregister eingetragene Gesellschaft von Amts wegen nach § 394 FamFG zu löschen. Die Frist zur Erhebung eines Widerspruchs gegen die beabsichtigte Löschung wird auf 3 Monate festgesetzt."
    },
    {
      "date": "2024-10-15",
      "id": "90517",
      "original_text": "Löschungsankündigung\nHessen Amtsgericht Offenbach am Main HRB 42600\nEBFS European Brokerage & Financial Solutions AG – Heusenstamm",
      "type": "Löschungsankündigung",
      "state": "Hessen",
      "amtsgericht": "Amtsgericht Offenbach am Main",
      "registernummer": "HRB 42600",
      "registerart": "HRB",
      "company_name": "EBFS European Brokerage & Financial Solutions AG",
      "company_seat": "Heusenstamm",
      "details": "15.10.2024 (Bekanntmachungsdatum)\n\nHessen Amtsgericht Offenbach am Main HRB 42600\nLöschungsankündigung\n\nEBFS European Brokerage & Financial Solutions AG\nAktiengesellschaft\nHeusenstamm\n\nDas Registergericht beabsichtigt die im Handelsregister eingetragene Gesellschaft von Amts wegen nach § 394 FamFG zu löschen. Die Frist zur Erhebung eines Widerspruchs gegen die beabsichtigte Löschung wird auf 3 Monate festgesetzt."
    },
    {
      "date": "2024-10-15",
      "id": "90409",
      "original_text": "Registerbekanntmachung nach dem Umwandlungsgesetz\nSchleswig-Holstein Amtsgericht Pinneberg HRA 5492\nEHB Vierte Grundbesitzverwaltung GmbH & Co. KG – Kollmar",
      "type": "Registerbekanntmachung nach dem Umwandlungsgesetz",
      "state": "Schleswig-Holstein",
      "amtsgericht": "Amtsgericht Pinneberg",
      "registernummer": "HRA 5492",
      "registerart": "HRA",
      "company_name": "EHB Vierte Grundbesitzverwaltung GmbH & Co. KG",
      "company_seat": "Kollmar",
      "details": "15.10.2024 (Bekanntmachungsdatum)\n\nSchleswig-Holstein Amtsgericht Pinneberg HRA 5492\nRegisterbekanntmachung nach dem Umwandlungsgesetz 09.10.2024 (Eintragungsdatum)\n\nEHB Vierte Grundbesitzverwaltung GmbH & Co. KG\nKommanditgesellschaft\nKollmar\n\nZu Eintragungsnummer 6 vom 09.10.2024 wird als nicht eingetragen veröffentlicht:  Als nicht eingetragen wird veröffentlicht: Den Gläubigern ist, wenn sie binnen sechs Monaten nach dem Tag, an dem die Eintragung der Umwandlung als bekannt gemacht gilt, ihren Anspruch nach Grund und Höhe schriftlich anmelden, Sicherheit zu leisten, soweit sie nicht Befriedigung verlangen können. Dieses Recht steht den Gläubigern jedoch nur zu, wenn sie glaubhaft machen, dass durch die Umwandlung die Erfüllung ihrer Forderung gefährdet wird. Das Recht, Sicherheitsleistung zu verlangen, steht Gläubigern nicht zu, die im Falle der Insolvenz ein Recht auf vorzugsweise Befriedigung aus einer Deckungsmasse haben, die nach gesetzlicher Vorschrift zu ihrem Schutz errichtet und staatlich überwacht ist."
    },
    {
      "date": "2024-10-15",
      "id": "90536",
      "original_text": "Löschungsankündigung\nHessen Amtsgericht Offenbach am Main HRB 45570\nESA Projekte und Gerüste GmbH – Langen (Hessen)",
      "type": "Löschungsankündigung",
      "state": "Hessen",
      "amtsgericht": "Amtsgericht Offenbach am Main",
      "registernummer": "HRB 45570",
      "registerart": "HRB",
      "company_name": "ESA Projekte und Gerüste GmbH",
      "company_seat": "Langen (Hessen)",
      "details": "15.10.2024 (Bekanntmachungsdatum)\n\nHessen Amtsgericht Offenbach am Main HRB 45570\nLöschungsankündigung\n\nESA Projekte und Gerüste GmbH\nGesellschaft mit beschränkter Haftung\nLangen (Hessen)\n\nDas Registergericht beabsichtigt die im Handelsregister eingetragene Gesellschaft von Amts wegen nach § 394 FamFG zu löschen. Die Frist zur Erhebung eines Widerspruchs gegen die beabsichtigte Löschung wird auf 3 Monate festgesetzt."
    },
    {
      "date": "2024-10-15",
      "id": "90354",
      "original_text": "Registerbekanntmachung nach dem Umwandlungsgesetz\nBayern Amtsgericht Nürnberg HRB 43665\nESM-ACADEMY GmbH – Nürnberg",
      "type": "Registerbekanntmachung nach dem Umwandlungsgesetz",
      "state": "Bayern",
      "amtsgericht": "Amtsgericht Nürnberg",
      "registernummer": "HRB 43665",
      "registerart": "HRB",
      "company_name": "ESM-ACADEMY GmbH",
      "company_seat": "Nürnberg",
      "details": "15.10.2024 (Bekanntmachungsdatum)\n\nBayern Amtsgericht Nürnberg HRB 43665\nRegisterbekanntmachung nach dem Umwandlungsgesetz 14.10.2024 (Eintragungsdatum)\n\nESM-ACADEMY GmbH\nGesellschaft mit beschränkter Haftung\nNürnberg\n\nDen Gläubigern des formwechselnden Rechtsträgers ist, wenn sie binnen sechs Monaten nach dem Tag, an dem die Eintragung des Formwechsels nach § 201 UmwG als bekannt gemacht gilt, ihren Anspruch nach Grund und Höhe schriftlich anmelden, Sicherheit zu leisten, soweit sie nicht Befriedigung verlangen können. Dieses Recht steht den Gläubigern jedoch nur zu, wenn sie glaubhaft machen, dass durch den Formwechsel die Erfüllung ihrer Forderung gefährdet wird."
    },
    {
      "date": "2024-10-15",
      "id": "90341",
      "original_text": "Registerbekanntmachung nach dem Umwandlungsgesetz\nBayern Amtsgericht Nürnberg HRA 20137\nESM-ACADEMY e.K – Nürnberg",
      "type": "Registerbekanntmachung nach dem Umwandlungsgesetz",
      "state": "Bayern",
      "amtsgericht": "Amtsgericht Nürnberg",
      "registernummer": "HRA 20137",
      "registerart": "HRA",
      "company_name": "ESM-ACADEMY e.K",
      "company_seat": "Nürnberg",
      "details": "15.10.2024 (Bekanntmachungsdatum)\n\nBayern Amtsgericht Nürnberg HRA 20137\nRegisterbekanntmachung nach dem Umwandlungsgesetz 14.10.2024 (Eintragungsdatum)\n\nESM-ACADEMY e.K\nEinzelkaufmann / Einzelkauffrau\nNürnberg\n\nDen Gläubigern der an der Ausgliederung beteiligten Rechtsträger ist, wenn sie binnen sechs Monaten nach dem Tag, an dem die Eintragung der Ausgliederung in das Register des Sitzes desjenigen Rechtsträgers, dessen Gläubiger sie sind, nach §§ 125, 19 Abs. 3 UmwG als bekannt gemacht gilt, ihren Anspruch nach Grund und Höhe schriftlich anmelden, Sicherheit zu leisten, soweit sie nicht Befriedigung verlangen können. Dieses Recht steht den Gläubigern jedoch nur zu, wenn sie glaubhaft machen, dass durch die Ausgliederung die Erfüllung ihrer Forderung gefährdet wird."
    },
    {
      "date": "2024-10-15",
      "id": "90401",
      "original_text": "Löschungsankündigung\nMecklenburg-Vorpommern Amtsgericht Neubrandenburg HRB 20539\nEisenbahn-Historie & Touristik gGmbH – Pasewalk",
      "type": "Löschungsankündigung",
      "state": "Mecklenburg-Vorpommern",
      "amtsgericht": "Amtsgericht Neubrandenburg",
      "registernummer": "HRB 20539",
      "registerart": "HRB",
      "company_name": "Eisenbahn-Historie & Touristik gGmbH",
      "company_seat": "Pasewalk",
      "details": "15.10.2024 (Bekanntmachungsdatum)\n\nMecklenburg-Vorpommern Amtsgericht Neubrandenburg HRB 20539\nLöschungsankündigung\n\nEisenbahn-Historie & Touristik gGmbH\nGesellschaft mit beschränkter Haftung\nPasewalk\n\nDas Registergericht beabsichtigt die Eintragung  vom 28.4.2022 bezüglich der konkreten Vertretungsbefugnis des Geschäftsführers Marian Thomas\t\tvon Amts wegen nach § 395 / § 398 FamFG zu löschen. Die Frist zur Erhebung\neines Widerspruchs ist auf 1 Monat festgesetzt."
    },
    {
      "date": "2024-10-15",
      "id": "90419",
      "original_text": "Löschungsankündigung\nHamburg Amtsgericht Hamburg HRB 132846\nElwing International GmbH – Hamburg",
      "type": "Löschungsankündigung",
      "state": "Hamburg",
      "amtsgericht": "Amtsgericht Hamburg",
      "registernummer": "HRB 132846",
      "registerart": "HRB",
      "company_name": "Elwing International GmbH",
      "company_seat": "Hamburg",
      "details": "15.10.2024 (Bekanntmachungsdatum)\n\nHamburg Amtsgericht Hamburg HRB 132846\nLöschungsankündigung\n\nElwing International GmbH\nGesellschaft mit beschränkter Haftung\nHamburg\n\nDas Registergericht beabsichtigt, die im Handelsregister eingetragene Gesellschaft von Amts wegen nach § 394 FamFG zu löschen. Die Frist zur Erhebung eines Widerspruchs gegen die beabsichtigte Löschung wird auf 3 Monate festgesetzt."
    },
    {
      "date": "2024-10-15",
      "id": "90356",
      "original_text": "Registerbekanntmachung nach dem Umwandlungsgesetz\nBayern Amtsgericht München VR 30126\nFC Markt Schwaben e.V. – Markt Schwaben",
      "type": "Registerbekanntmachung nach dem Umwandlungsgesetz",
      "state": "Bayern",
      "amtsgericht": "Amtsgericht München",
      "registernummer": "VR 30126",
      "registerart": "VR",
      "company_name": "FC Markt Schwaben e.V.",
      "company_seat": "Markt Schwaben",
      "details": "15.10.2024 (Bekanntmachungsdatum)\n\nBayern Amtsgericht München VR 30126\nRegisterbekanntmachung nach dem Umwandlungsgesetz 14.10.2024 (Eintragungsdatum)\n\nFC Markt Schwaben e.V.\neingetragener Verein\nMarkt Schwaben\n\nDen Gläubigern der an der Verschmelzung beteiligten Rechtsträger ist, wenn sie binnen sechs Monaten nach dem Tag, an dem die Eintragung der Verschmelzung in das Register des Sitzes desjenigen Rechtsträgers, dessen Gläubiger sie sind, nach § 19 Abs. 3 UmwG als bekannt gemacht gilt, ihren Anspruch nach Grund und Höhe schriftlich anmelden, Sicherheit zu leisten, soweit sie nicht Befriedigung verlangen können. Dieses Recht steht den Gläubigern jedoch nur zu, wenn sie glaubhaft machen, dass durch die Verschmelzung die Erfüllung ihrer Forderung gefährdet wird."
    },
    {
      "date": "2024-10-15",
      "id": "90364",
      "original_text": "Einreichung neuer Dokumente\nBayern Amtsgericht München HRB 113308\nFujitsu Technology Solutions GmbH – München",
      "type": "Einreichung neuer Dokumente",
      "state": "Bayern",
      "amtsgericht": "Amtsgericht München",
      "registernummer": "HRB 113308",
      "registerart": "HRB",
      "company_name": "Fujitsu Technology Solutions GmbH",
      "company_seat": "München",
      "details": "15.10.2024 (Bekanntmachungsdatum)\n\nBayern Amtsgericht München HRB 113308\nEinreichung neuer Dokumente\n\nFujitsu Technology Solutions GmbH\nGesellschaft mit beschränkter Haftung\nMünchen\n\nDem Amtsgericht München -Registergericht- ist eine Liste der Mitglieder des Aufsichtsrats eingereicht worden, § 52 Abs. 3 S. 2 GmbHG."
    },
    {
      "date": "2024-10-15",
      "id": "90538",
      "original_text": "Sonstige Registerbekanntmachung\nHessen Amtsgericht Kassel VR 4964\nGBS-Kassel e.V. - im Förderkreis der Giordano Bruno Stiftung – Kassel",
      "type": "Sonstige Registerbekanntmachung",
      "state": "Hessen",
      "amtsgericht": "Amtsgericht Kassel",
      "registernummer": "VR 4964",
      "registerart": "VR",
      "company_name": "GBS-Kassel e.V. - im Förderkreis der Giordano Bruno Stiftung",
      "company_seat": "Kassel",
      "details": "15.10.2024 (Bekanntmachungsdatum)\n\nHessen Amtsgericht Kassel VR 4964\nSonstige Registerbekanntmachung 15.10.2024 (Eintragungsdatum)\n\nGBS-Kassel e.V. - im Förderkreis der Giordano Bruno Stiftung\neingetragener Verein\nKassel\n\nDer Verein ist aufgelöst."
    },
    {
      "date": "2024-10-15",
      "id": "90513",
      "original_text": "Einreichung neuer Dokumente\nHessen Amtsgericht Offenbach am Main HRB 2171\nGKN Driveline Deutschland GmbH – Offenbach am Main",
      "type": "Einreichung neuer Dokumente",
      "state": "Hessen",
      "amtsgericht": "Amtsgericht Offenbach am Main",
      "registernummer": "HRB 2171",
      "registerart": "HRB",
      "company_name": "GKN Driveline Deutschland GmbH",
      "company_seat": "Offenbach am Main",
      "details": "15.10.2024 (Bekanntmachungsdatum)\n\nHessen Amtsgericht Offenbach am Main HRB 2171\nEinreichung neuer Dokumente 15.10.2024 (Eintragungsdatum)\n\nGKN Driveline Deutschland GmbH\nGesellschaft mit beschränkter Haftung\nOffenbach am Main\n\nDurch eine Änderung in den Personen der Aufsichtsratsmitglieder ist eine Liste der Mitglieder des Aufsichtsrates zum Handelsregister eingereicht worden."
    },
    {
      "date": "2024-10-15",
      "id": "90405",
      "original_text": "Löschungsankündigung\nSchleswig-Holstein Amtsgericht Pinneberg HRB 8594\nGPC Marketing Service Limited – Elmshorn",
      "type": "Löschungsankündigung",
      "state": "Schleswig-Holstein",
      "amtsgericht": "Amtsgericht Pinneberg",
      "registernummer": "HRB 8594",
      "registerart": "HRB",
      "company_name": "GPC Marketing Service Limited",
      "company_seat": "Elmshorn",
      "details": "15.10.2024 (Bekanntmachungsdatum)\n\nSchleswig-Holstein Amtsgericht Pinneberg HRB 8594\nLöschungsankündigung\n\nGPC Marketing Service Limited\nRechtsform ausländischen Rechts HRB\nElmshorn\n\nBei der nachstehenden Gesellschaft wird das Amtslöschungsverfahren gemäß § 395 FamFG eingeleitet. Widerspruchsfrist: 2 Monate."
    },
    {
      "date": "2024-10-15",
      "id": "90446",
      "original_text": "Registerbekanntmachung nach dem Umwandlungsgesetz\nSachsen-Anhalt Amtsgericht Stendal HRA 7635\nGT Gebäudetechnik Dr. Hans-Georg Wölfer e.K. – Sülzetal",
      "type": "Registerbekanntmachung nach dem Umwandlungsgesetz",
      "state": "Sachsen-Anhalt",
      "amtsgericht": "Amtsgericht Stendal",
      "registernummer": "HRA 7635",
      "registerart": "HRA",
      "company_name": "GT Gebäudetechnik Dr. Hans-Georg Wölfer e.K.",
      "company_seat": "Sülzetal",
      "details": "15.10.2024 (Bekanntmachungsdatum)\n\nSachsen-Anhalt Amtsgericht Stendal HRA 7635\nRegisterbekanntmachung nach dem Umwandlungsgesetz 15.10.2024 (Eintragungsdatum)\n\nGT Gebäudetechnik Dr. Hans-Georg Wölfer e.K.\nEinzelkaufmann / Einzelkauffrau\nSülzetal\n\nNicht eingetragen:\nDen Gläubigern der an der Ausgliederung beteiligten Rechtsträger, ist wenn sie binnen sechs Monaten nach dem Tag, an dem die Eintragung der Ausgliederung nach §§125, 19 Abs. 3 UmwG als bekanntgemacht gilt, ihren Anspruch nach Grund und Höhe schriftlich anmelden, Sicherheit zu leisten, soweit sie nicht Befriedigung verlangen können. Diese Recht steht ihnen jedoch nur zu, wenn sie glaubhaft machen, dass durch die Ausgliederung die Erfüllung ihrer Forderung gefährdet wird."
    },
    {
      "date": "2024-10-15",
      "id": "90489",
      "original_text": "Registerbekanntmachung nach dem Umwandlungsgesetz\nNordrhein-Westfalen Amtsgericht Hagen HRA 6542\nGabriele Landolfo Pflegedienst Gevelsberg e.K. – Gevelsberg",
      "type": "Registerbekanntmachung nach dem Umwandlungsgesetz",
      "state": "Nordrhein-Westfalen",
      "amtsgericht": "Amtsgericht Hagen",
      "registernummer": "HRA 6542",
      "registerart": "HRA",
      "company_name": "Gabriele Landolfo Pflegedienst Gevelsberg e.K.",
      "company_seat": "Gevelsberg",
      "details": "15.10.2024 (Bekanntmachungsdatum)\n\nNordrhein-Westfalen Amtsgericht Hagen HRA 6542\nRegisterbekanntmachung nach dem Umwandlungsgesetz 15.10.2024 (Eintragungsdatum)\n\nGabriele Landolfo Pflegedienst Gevelsberg e.K.\nEinzelkaufmann / Einzelkauffrau\nGevelsberg\n\nDen Gläubigern der an der Ausgliederung beteiligten Rechtsträger ist, wenn sie binnen sechs Monaten nach dem Tag, an dem die Eintragung der Ausgliederung in das Register des Sitzes derjenigen Rechtsträger deren Gläubiger sie sind, nach § 19 Absatz 3 UmwG als bekanntgemacht gilt, ihren Anspruch nach Grund und Höhe schriftlich anmelden, Sicherheit zu leisten, soweit sie nicht Befriedigung verlangen können. Dieses Recht steht den Gläubigern jedoch nur zu, wenn sie glaubhaft machen, dass durch die Ausgliederung die Erfüllung ihrer Forderung gefährdet wird."
    },
    {
      "date": "2024-10-15",
      "id": "90441",
      "original_text": "Löschungsankündigung\nBerlin Amtsgericht Berlin (Charlottenburg) HRB 131924\nGalaxy Tel GmbH – Berlin",
      "type": "Löschungsankündigung",
      "state": "Berlin",
      "amtsgericht": "Amtsgericht Berlin (Charlottenburg)",
      "registernummer": "HRB 131924",
      "registerart": "HRB",
      "company_name": "Galaxy Tel GmbH",
      "company_seat": "Berlin",
      "details": "15.10.2024 (Bekanntmachungsdatum)\n\nBerlin Amtsgericht Berlin (Charlottenburg) HRB 131924\nLöschungsankündigung\n\nGalaxy Tel GmbH\nGesellschaft mit beschränkter Haftung\nBerlin\n\nBei der nachstehenden Gesellschaft wird das Amtslöschungsverfahren gemäß § 394 FamFG eingeleitet. Widerspruchsfrist 6 Wochen"
    },
    {
      "date": "2024-10-15",
      "id": "90525",
      "original_text": "Löschungsankündigung\nHessen Amtsgericht Offenbach am Main HRA 5780\nGebr. Tschatsch GmbH & Co KG – Offenbach am Main",
      "type": "Löschungsankündigung",
      "state": "Hessen",
      "amtsgericht": "Amtsgericht Offenbach am Main",
      "registernummer": "HRA 5780",
      "registerart": "HRA",
      "company_name": "Gebr. Tschatsch GmbH & Co KG",
      "company_seat": "Offenbach am Main",
      "details": "15.10.2024 (Bekanntmachungsdatum)\n\nHessen Amtsgericht Offenbach am Main HRA 5780\nLöschungsankündigung\n\nGebr. Tschatsch GmbH & Co KG\nKommanditgesellschaft\nOffenbach am Main\n\nDas Registergericht beabsichtigt die im Handelsregister eingetragene Firma von Amts wegen nach § 394 FamFG zu löschen. Die Frist zur Erhebung eines Widerspruchs gegen die beabsichtigte Löschung wird auf 3 Monate festgesetzt."
    },
    {
      "date": "2024-10-15",
      "id": "90384",
      "original_text": "Sonstige Registerbekanntmachung\nBrandenburg Amtsgericht Frankfurt/Oder HRB 2751\nGewerbe- und Industriepark Lindenstraße GmbH – Fürstenwalde/Spree",
      "type": "Sonstige Registerbekanntmachung",
      "state": "Brandenburg",
      "amtsgericht": "Amtsgericht Frankfurt/Oder",
      "registernummer": "HRB 2751",
      "registerart": "HRB",
      "company_name": "Gewerbe- und Industriepark Lindenstraße GmbH",
      "company_seat": "Fürstenwalde/Spree",
      "details": "15.10.2024 (Bekanntmachungsdatum)\n\nBrandenburg Amtsgericht Frankfurt/Oder HRB 2751\nSonstige Registerbekanntmachung\n\nGewerbe- und Industriepark Lindenstraße GmbH\nGesellschaft mit beschränkter Haftung\nFürstenwalde/Spree\n\nAls nicht eingetragen wird veröffentlicht:  Die Gesellschaft hat Änderungen im Aufsichtsrat angezeigt."
    },
    {
      "date": "2024-10-15",
      "id": "90418",
      "original_text": "Löschungsankündigung\nHamburg Amtsgericht Hamburg HRB 108774\nGimkon, Grundbesitz-Immobilien-Konzepte GmbH – Hamburg",
      "type": "Löschungsankündigung",
      "state": "Hamburg",
      "amtsgericht": "Amtsgericht Hamburg",
      "registernummer": "HRB 108774",
      "registerart": "HRB",
      "company_name": "Gimkon, Grundbesitz-Immobilien-Konzepte GmbH",
      "company_seat": "Hamburg",
      "details": "15.10.2024 (Bekanntmachungsdatum)\n\nHamburg Amtsgericht Hamburg HRB 108774\nLöschungsankündigung\n\nGimkon, Grundbesitz-Immobilien-Konzepte GmbH\nGesellschaft mit beschränkter Haftung\nHamburg\n\nDas Registergericht beabsichtigt, die im Handelsregister eingetragene Gesellschaft von Amts wegen nach § 394 FamFG zu löschen. Die Frist zur Erhebung eines Widerspruchs gegen die beabsichtigte Löschung wird auf 3 Monate festgesetzt."
    },
    {
      "date": "2024-10-15",
      "id": "90398",
      "original_text": "Einreichung neuer Dokumente\nBerlin Amtsgericht Berlin (Charlottenburg) HRB 237635\nGrover Holding SE – Berlin",
      "type": "Einreichung neuer Dokumente",
      "state": "Berlin",
      "amtsgericht": "Amtsgericht Berlin (Charlottenburg)",
      "registernummer": "HRB 237635",
      "registerart": "HRB",
      "company_name": "Grover Holding SE",
      "company_seat": "Berlin",
      "details": "15.10.2024 (Bekanntmachungsdatum)\n\nBerlin Amtsgericht Berlin (Charlottenburg) HRB 237635\nEinreichung neuer Dokumente\n\nGrover Holding SE\nEuropäische Aktiengesellschaft (SE)\nBerlin\n\nAls nicht eingetragen wird veröffentlicht: Es wurde eine neue Liste der Aufsichtsratsmitglieder eingereicht (§ 106 AktG)."
    },
    {
      "date": "2024-10-15",
      "id": "90531",
      "original_text": "Löschungsankündigung\nHessen Amtsgericht Frankfurt am Main HRB 119733\nGuadArt UG (haftungsbeschränkt) – Bad Vilbel",
      "type": "Löschungsankündigung",
      "state": "Hessen",
      "amtsgericht": "Amtsgericht Frankfurt am Main",
      "registernummer": "HRB 119733",
      "registerart": "HRB",
      "company_name": "GuadArt UG (haftungsbeschränkt)",
      "company_seat": "Bad Vilbel",
      "details": "15.10.2024 (Bekanntmachungsdatum)\n\nHessen Amtsgericht Frankfurt am Main HRB 119733\nLöschungsankündigung\n\nGuadArt UG (haftungsbeschränkt)\nGesellschaft mit beschränkter Haftung\nBad Vilbel\n\nEs ist beabsichtigt die Gesellschaft wegen Vermögenslosigkeit gemäß § 394 FamFG von Amts wegen zu löschen. Hiergegen kann innerhalb eines Monats nach dieser Veröffentlichung Widerspruch bei dem Amtsgericht Frankfurt am Main eingelegt werden."
    },
    {
      "date": "2024-10-15",
      "id": "90539",
      "original_text": "Löschungsankündigung\nHessen Amtsgericht Offenbach am Main HRB 50211\nH & K Dienstleistungen GmbH – Neu-Isenburg",
      "type": "Löschungsankündigung",
      "state": "Hessen",
      "amtsgericht": "Amtsgericht Offenbach am Main",
      "registernummer": "HRB 50211",
      "registerart": "HRB",
      "company_name": "H & K Dienstleistungen GmbH",
      "company_seat": "Neu-Isenburg",
      "details": "15.10.2024 (Bekanntmachungsdatum)\n\nHessen Amtsgericht Offenbach am Main HRB 50211\nLöschungsankündigung\n\nH & K Dienstleistungen GmbH\nGesellschaft mit beschränkter Haftung\nNeu-Isenburg\n\nDas Registergericht beabsichtigt die im Handelsregister eingetragene Gesellschaft von Amts wegen nach § 394 FamFG zu löschen. Die Frist zur Erhebung eines Widerspruchs gegen die beabsichtigte Löschung wird auf 3 Monate festgesetzt."
    },
    {
      "date": "2024-10-15",
      "id": "90477",
      "original_text": "Löschungsankündigung\nBremen Amtsgericht Bremen HRB 38562\nH & N Industrieservice GmbH – Bremerhaven",
      "type": "Löschungsankündigung",
      "state": "Bremen",
      "amtsgericht": "Amtsgericht Bremen",
      "registernummer": "HRB 38562",
      "registerart": "HRB",
      "company_name": "H & N Industrieservice GmbH",
      "company_seat": "Bremerhaven",
      "details": "15.10.2024 (Bekanntmachungsdatum)\n\nBremen Amtsgericht Bremen HRB 38562\nLöschungsankündigung\n\nH & N Industrieservice GmbH\nGesellschaft mit beschränkter Haftung\nBremerhaven\n\nEs ist beabsichtigt die im Handelsregister eingetragene Gesellschaft von Amts wegen gemäß § 394 FamFG zu löschen. Gegen die Löschung kann beim AG Bremen schriftlich oder zu Protokoll der Geschäftsstelle Widerspruch eingelegt werden. Widerspruchsfrist 4 Wochen."
    },
    {
      "date": "2024-10-15",
      "id": "90493",
      "original_text": "Einreichung neuer Dokumente\nNordrhein-Westfalen Amtsgericht Mönchengladbach HRB 18021\nHAUSHELD AG – Mönchengladbach",
      "type": "Einreichung neuer Dokumente",
      "state": "Nordrhein-Westfalen",
      "amtsgericht": "Amtsgericht Mönchengladbach",
      "registernummer": "HRB 18021",
      "registerart": "HRB",
      "company_name": "HAUSHELD AG",
      "company_seat": "Mönchengladbach",
      "details": "15.10.2024 (Bekanntmachungsdatum)\n\nNordrhein-Westfalen Amtsgericht Mönchengladbach HRB 18021\nEinreichung neuer Dokumente\n\nHAUSHELD AG\nAktiengesellschaft\nMönchengladbach\n\nDem Registergericht ist eine neue Liste der Mitglieder des Aufsichtsrates eingereicht worden."
    },
    {
      "date": "2024-10-15",
      "id": "90528",
      "original_text": "Löschungsankündigung\nHessen Amtsgericht Offenbach am Main HRB 48490\nHBI GmbH – Offenbach am Main",
      "type": "Löschungsankündigung",
      "state": "Hessen",
      "amtsgericht": "Amtsgericht Offenbach am Main",
      "registernummer": "HRB 48490",
      "registerart": "HRB",
      "company_name": "HBI GmbH",
      "company_seat": "Offenbach am Main",
      "details": "15.10.2024 (Bekanntmachungsdatum)\n\nHessen Amtsgericht Offenbach am Main HRB 48490\nLöschungsankündigung\n\nHBI GmbH\nGesellschaft mit beschränkter Haftung\nOffenbach am Main\n\nDas Registergericht beabsichtigt die im Handelsregister eingetragene Gesellschaft von Amts wegen nach § 394 FamFG zu löschen. Die Frist zur Erhebung eines Widerspruchs gegen die beabsichtigte Löschung wird auf 3 Monate festgesetzt."
    },
    {
      "date": "2024-10-15",
      "id": "90450",
      "original_text": "Löschungsankündigung\nBrandenburg Amtsgericht Frankfurt/Oder HRB 12548\nHGS Handelsgesellschaft und Versorgung mbH – Grünheide (Mark)",
      "type": "Löschungsankündigung",
      "state": "Brandenburg",
      "amtsgericht": "Amtsgericht Frankfurt/Oder",
      "registernummer": "HRB 12548",
      "registerart": "HRB",
      "company_name": "HGS Handelsgesellschaft und Versorgung mbH",
      "company_seat": "Grünheide (Mark)",
      "details": "15.10.2024 (Bekanntmachungsdatum)\n\nBrandenburg Amtsgericht Frankfurt/Oder HRB 12548\nLöschungsankündigung\n\nHGS Handelsgesellschaft und Versorgung mbH\nGesellschaft mit beschränkter Haftung\nGrünheide (Mark)\n\nBei der nachstehenden Gesellschaft wird das Amtslöschungsverfahren gemäß § 394 FamFG eingeleitet."
    },
    {
      "date": "2024-10-15",
      "id": "90347",
      "original_text": "Registerbekanntmachung nach dem Umwandlungsgesetz\nBayern Amtsgericht Kempten (Allgäu) HRB 16791\nHPC 2 Invest GmbH – Kempten (Allgäu)",
      "type": "Registerbekanntmachung nach dem Umwandlungsgesetz",
      "state": "Bayern",
      "amtsgericht": "Amtsgericht Kempten (Allgäu)",
      "registernummer": "HRB 16791",
      "registerart": "HRB",
      "company_name": "HPC 2 Invest GmbH",
      "company_seat": "Kempten (Allgäu)",
      "details": "15.10.2024 (Bekanntmachungsdatum)\n\nBayern Amtsgericht Kempten (Allgäu) HRB 16791\nRegisterbekanntmachung nach dem Umwandlungsgesetz 14.10.2024 (Eintragungsdatum)\n\nHPC 2 Invest GmbH\nGesellschaft mit beschränkter Haftung\nKempten (Allgäu)\n\nDen Gläubigern der an der Verschmelzung beteiligten Rechtsträger ist, wenn sie binnen sechs Monaten nach dem Tag, an dem die Eintragung der Verschmelzung in das Register des Sitzes desjenigen Rechtsträgers, dessen Gläubiger sie sind, nach § 19 Abs. 3 UmwG als bekannt gemacht gilt, ihren Anspruch nach Grund und Höhe schriftlich anmelden, Sicherheit zu leisten, soweit sie nicht Befriedigung verlangen können. Dieses Recht steht den Gläubigern jedoch nur zu, wenn sie glaubhaft machen, dass durch die Verschmelzung die Erfüllung ihrer Forderung gefährdet wird."
    },
    {
      "date": "2024-10-15",
      "id": "90423",
      "original_text": "Löschungsankündigung\nHamburg Amtsgericht Hamburg HRB 163487\nHR Personalservice UG (haftungsbeschränkt) – Hamburg",
      "type": "Löschungsankündigung",
      "state": "Hamburg",
      "amtsgericht": "Amtsgericht Hamburg",
      "registernummer": "HRB 163487",
      "registerart": "HRB",
      "company_name": "HR Personalservice UG (haftungsbeschränkt)",
      "company_seat": "Hamburg",
      "details": "15.10.2024 (Bekanntmachungsdatum)\n\nHamburg Amtsgericht Hamburg HRB 163487\nLöschungsankündigung\n\nHR Personalservice UG (haftungsbeschränkt)\nGesellschaft mit beschränkter Haftung\nHamburg\n\nDas Registergericht beabsichtigt, die im Handelsregister eingetragene Gesellschaft von Amts wegen nach § 394 FamFG zu löschen. Die Frist zur Erhebung eines Widerspruchs gegen die beabsichtigte Löschung wird auf 3 Monate festgesetzt."
    },
    {
      "date": "2024-10-15",
      "id": "90524",
      "original_text": "Löschungsankündigung\nHessen Amtsgericht Offenbach am Main HRB 43046\nHS Facility Management GmbH – Mühlheim am Main",
      "type": "Löschungsankündigung",
      "state": "Hessen",
      "amtsgericht": "Amtsgericht Offenbach am Main",
      "registernummer": "HRB 43046",
      "registerart": "HRB",
      "company_name": "HS Facility Management GmbH",
      "company_seat": "Mühlheim am Main",
      "details": "15.10.2024 (Bekanntmachungsdatum)\n\nHessen Amtsgericht Offenbach am Main HRB 43046\nLöschungsankündigung\n\nHS Facility Management GmbH\nGesellschaft mit beschränkter Haftung\nMühlheim am Main\n\nDas Registergericht beabsichtigt die im Handelsregister eingetragene Gesellschaft von Amts wegen nach § 394 FamFG zu löschen. Die Frist zur Erhebung eines Widerspruchs gegen die beabsichtigte Löschung wird auf 3 Monate festgesetzt."
    },
    {
      "date": "2024-10-15",
      "id": "90403",
      "original_text": "Registerbekanntmachung nach dem Umwandlungsgesetz\nSchleswig-Holstein Amtsgericht Pinneberg HRB 2487 EL\nHellermannTyton Services GmbH – Tornesch",
      "type": "Registerbekanntmachung nach dem Umwandlungsgesetz",
      "state": "Schleswig-Holstein",
      "amtsgericht": "Amtsgericht Pinneberg",
      "registernummer": "HRB 2487 EL",
      "registerart": "HRB",
      "company_name": "HellermannTyton Services GmbH",
      "company_seat": "Tornesch",
      "details": "15.10.2024 (Bekanntmachungsdatum)\n\nSchleswig-Holstein Amtsgericht Pinneberg HRB 2487 EL\nRegisterbekanntmachung nach dem Umwandlungsgesetz 08.10.2024 (Eintragungsdatum)\n\nHellermannTyton Services GmbH\nGesellschaft mit beschränkter Haftung\nTornesch\n\nZu Eintragungsnummer 11 vom 08.10.2024 wird als nicht eingetragen veröffentlicht:  Als nicht eingetragen wird veröffentlicht: Den Gläubigern der an der Verschmelzung beteiligten Rechtsträger ist, wenn sie binnen sechs Monaten nach dem Tag, an dem die Eintragung der Verschmelzung in das Register des Sitzes desjenigen Rechtsträgers, dessen Gläubiger sie sind, als bekannt gemacht gilt, ihren Anspruch nach Grund und Höhe schriftlich anmelden, Sicherheit zu leisten, soweit sie nicht Befriedigung verlangen können. Dieses Recht steht den Gläubigern jedoch nur zu, wenn sie glaubhaft machen, dass durch die Verschmelzung die Erfüllung ihrer Forderung gefährdet wird. Das Recht, Sicherheitsleistung zu verlangen, steht Gläubigern nicht zu, die im Falle der Insolvenz ein Recht auf vorzugsweise Befriedigung aus einer Deckungsmasse haben, die nach gesetzlicher Vorschrift zu ihrem Schutz errichtet und staatlich überwacht ist."
    },
    {
      "date": "2024-10-15",
      "id": "90395",
      "original_text": "Registerbekanntmachung nach dem Umwandlungsgesetz\nSchleswig-Holstein Amtsgericht Pinneberg HRB 18406\nHellermannTyton Verwaltungs GmbH – Tornesch",
      "type": "Registerbekanntmachung nach dem Umwandlungsgesetz",
      "state": "Schleswig-Holstein",
      "amtsgericht": "Amtsgericht Pinneberg",
      "registernummer": "HRB 18406",
      "registerart": "HRB",
      "company_name": "HellermannTyton Verwaltungs GmbH",
      "company_seat": "Tornesch",
      "details": "15.10.2024 (Bekanntmachungsdatum)\n\nSchleswig-Holstein Amtsgericht Pinneberg HRB 18406\nRegisterbekanntmachung nach dem Umwandlungsgesetz 08.10.2024 (Eintragungsdatum)\n\nHellermannTyton Verwaltungs GmbH\nGesellschaft mit beschränkter Haftung\nTornesch\n\nZu Eintragungsnummer 3 vom 08.10.2024 wird als nicht eingetragen veröffentlicht: Den Gläubigern der an der Verschmelzung beteiligten Rechtsträger ist, wenn sie binnen sechs Monaten nach dem Tag, an dem die Eintragung der Verschmelzung in das Register des Sitzes desjenigen Rechtsträgers, dessen Gläubiger sie sind, als bekannt gemacht gilt, ihren Anspruch nach Grund und Höhe schriftlich anmelden, Sicherheit zu leisten, soweit sie nicht Befriedigung verlangen können. Dieses Recht steht den Gläubigern jedoch nur zu, wenn sie glaubhaft machen, dass durch die Verschmelzung die Erfüllung ihrer Forderung gefährdet wird. Das Recht, Sicherheitsleistung zu verlangen, steht Gläubigern nicht zu, die im Falle der Insolvenz ein Recht auf vorzugsweise Befriedigung aus einer Deckungsmasse haben, die nach gesetzlicher Vorschrift zu ihrem Schutz errichtet und staatlich überwacht ist."
    },
    {
      "date": "2024-10-15",
      "id": "90460",
      "original_text": "Registerbekanntmachung nach dem Umwandlungsgesetz\nNiedersachsen Amtsgericht Oldenburg (Oldenburg) HRB 131542 früher Amtsgericht Wilhelmshaven\nHolger Hechler GmbH – Sande",
      "type": "Registerbekanntmachung nach dem Umwandlungsgesetz",
      "state": "Niedersachsen",
      "amtsgericht": "Amtsgericht Oldenburg (Oldenburg)",
      "registernummer": "HRB 131542",
      "registerart": "HRB",
      "company_name": "Holger Hechler GmbH",
      "company_seat": "Sande",
      "former_amtsgericht": "Wilhelmshaven",
      "details": "15.10.2024 (Bekanntmachungsdatum)\n\nNiedersachsen Amtsgericht Oldenburg (Oldenburg) HRB 131542 früher Amtsgericht Wilhelmshaven\nRegisterbekanntmachung nach dem Umwandlungsgesetz 15.10.2024 (Eintragungsdatum)\n\nHolger Hechler GmbH\nGesellschaft mit beschränkter Haftung\nSande\n\nDen Gläubigern der an der Ausgliederung beteiligten Rechtsträger ist, wenn sie binnen sechs Monaten nach dem Tag, an dem die Eintragung der Ausgliederung in das Register des Sitzes desjenigen Rechtsträgers, dessen Gläubiger sie sind, nach § 19 Abs. 3 UmwG als bekannt gemacht gilt, ihren Anspruch nach Grund und Höhe schriftlich anmelden, Sicherheit zu leisten, soweit sie nicht Befriedigung verlangen können. Dieses Recht steht den Gläubigern jedoch nur zu, wenn sie glaubhaft machen, dass durch die Ausgliederung die Erfüllung der Forderung gefährdet wird."
    },
    {
      "date": "2024-10-15",
      "id": "90465",
      "original_text": "Registerbekanntmachung nach dem Umwandlungsgesetz\nNiedersachsen Amtsgericht Oldenburg (Oldenburg) HRA 208444\nHolger Hechler Hausmeister e.K. – Sande",
      "type": "Registerbekanntmachung nach dem Umwandlungsgesetz",
      "state": "Niedersachsen",
      "amtsgericht": "Amtsgericht Oldenburg (Oldenburg)",
      "registernummer": "HRA 208444",
      "registerart": "HRA",
      "company_name": "Holger Hechler Hausmeister e.K.",
      "company_seat": "Sande",
      "details": "15.10.2024 (Bekanntmachungsdatum)\n\nNiedersachsen Amtsgericht Oldenburg (Oldenburg) HRA 208444\nRegisterbekanntmachung nach dem Umwandlungsgesetz 15.10.2024 (Eintragungsdatum)\n\nHolger Hechler Hausmeister e.K.\nEinzelkaufmann / Einzelkauffrau\nSande\n\nDen Gläubigern der an der Ausgliederung beteiligten Rechtsträger ist, wenn sie binnen sechs Monaten nach dem Tag, an dem die Eintragung der Ausgliederung in das Register des Sitzes desjenigen Rechtsträgers, dessen Gläubiger sie sind, nach § 19 Abs. 3 UmwG als bekannt gemacht gilt, ihren Anspruch nach Grund und Höhe schriftlich anmelden, Sicherheit zu leisten, soweit sie nicht Befriedigung verlangen können. Dieses Recht steht den Gläubigern jedoch nur zu, wenn sie glaubhaft machen, dass durch die Ausgliederung die Erfüllung der Forderung gefährdet wird."
    },
    {
      "date": "2024-10-15",
      "id": "90346",
      "original_text": "Registerbekanntmachung nach dem Umwandlungsgesetz\nBayern Amtsgericht München HRB 85949\nHornik & Partner Marketing GmbH – Aschheim",
      "type": "Registerbekanntmachung nach dem Umwandlungsgesetz",
      "state": "Bayern",
      "amtsgericht": "Amtsgericht München",
      "registernummer": "HRB 85949",
      "registerart": "HRB",
      "company_name": "Hornik & Partner Marketing GmbH",
      "company_seat": "Aschheim",
      "details": "15.10.2024 (Bekanntmachungsdatum)\n\nBayern Amtsgericht München HRB 85949\nRegisterbekanntmachung nach dem Umwandlungsgesetz 14.10.2024 (Eintragungsdatum)\n\nHornik & Partner Marketing GmbH\nGesellschaft mit beschränkter Haftung\nAschheim\n\nDen Gläubigern der an der Verschmelzung beteiligten Rechtsträger ist, wenn sie binnen sechs Monaten nach dem Tag, an dem die Eintragung der Verschmelzung in das Register des Sitzes desjenigen Rechtsträgers, dessen Gläubiger sie sind, nach § 19 Abs. 3 UmwG als bekannt gemacht gilt, ihren Anspruch nach Grund und Höhe schriftlich anmelden, Sicherheit zu leisten, soweit sie nicht Befriedigung verlangen können. Dieses Recht steht den Gläubigern jedoch nur zu, wenn sie glaubhaft machen, dass durch die Verschmelzung die Erfüllung ihrer Forderung gefährdet wird."
    },
    {
      "date": "2024-10-15",
      "id": "90487",
      "original_text": "Registerbekanntmachung nach dem Umwandlungsgesetz\nNordrhein-Westfalen Amtsgericht Essen HRB 12213\nHörsysteme Ansgar Wessling GmbH – Essen",
      "type": "Registerbekanntmachung nach dem Umwandlungsgesetz",
      "state": "Nordrhein-Westfalen",
      "amtsgericht": "Amtsgericht Essen",
      "registernummer": "HRB 12213",
      "registerart": "HRB",
      "company_name": "Hörsysteme Ansgar Wessling GmbH",
      "company_seat": "Essen",
      "details": "15.10.2024 (Bekanntmachungsdatum)\n\nNordrhein-Westfalen Amtsgericht Essen HRB 12213\nRegisterbekanntmachung nach dem Umwandlungsgesetz 15.10.2024 (Eintragungsdatum)\n\nHörsysteme Ansgar Wessling GmbH\nGesellschaft mit beschränkter Haftung\nEssen\n\nDen Gläubigern der an der Verschmelzung beteiligten Rechtsträger ist, wenn sie binnen sechs Monaten nach dem Tag, an dem die Eintragung der Verschmelzung in das Register des Sitzes desjenigen Rechtsträgers, dessen Gläubiger sie sind, nach § 19 Absatz 3 UmwG als bekanntgemacht gilt, ihren Anspruch nach Grund und Höhe schriftlich anmelden, Sicherheit zu leisten, soweit sie nicht Befriedigung verlangen können. Dieses Recht steht den Gläubigern jedoch nur zu, wenn sie glaubhaft machen, dass durch die Verschmelzung die Erfüllung ihrer Forderung gefährdet wird."
    },
    {
      "date": "2024-10-15",
      "id": "90385",
      "original_text": "Löschungsankündigung\nBerlin Amtsgericht Berlin (Charlottenburg) HRB 159940\nIARIN GmbH – Berlin",
      "type": "Löschungsankündigung",
      "state": "Berlin",
      "amtsgericht": "Amtsgericht Berlin (Charlottenburg)",
      "registernummer": "HRB 159940",
      "registerart": "HRB",
      "company_name": "IARIN GmbH",
      "company_seat": "Berlin",
      "details": "15.10.2024 (Bekanntmachungsdatum)\n\nBerlin Amtsgericht Berlin (Charlottenburg) HRB 159940\nLöschungsankündigung\n\nIARIN GmbH\nGesellschaft mit beschränkter Haftung\nBerlin\n\nBei der nachstehenden Gesellschaft wird das Amtslöschungsverfahren gemäß § 394 FamFG eingeleitet. Widerspruchsfrist 6 Wochen"
    },
    {
      "date": "2024-10-15",
      "id": "90480",
      "original_text": "Registerbekanntmachung nach dem Umwandlungsgesetz\nRheinland-Pfalz Amtsgericht Ludwigshafen a.Rhein (Ludwigshafen) HRB 63187\nIDD Inklusionsdienst Rhein Neckar Pfalz UG (haftungsbeschränkt) – Bad Dürkheim",
      "type": "Registerbekanntmachung nach dem Umwandlungsgesetz",
      "state": "Rheinland-Pfalz",
      "amtsgericht": "Amtsgericht Ludwigshafen a.Rhein (Ludwigshafen)",
      "registernummer": "HRB 63187",
      "registerart": "HRB",
      "company_name": "IDD Inklusionsdienst Rhein Neckar Pfalz UG (haftungsbeschränkt)",
      "company_seat": "Bad Dürkheim",
      "details": "15.10.2024 (Bekanntmachungsdatum)\n\nRheinland-Pfalz Amtsgericht Ludwigshafen a.Rhein (Ludwigshafen) HRB 63187\nRegisterbekanntmachung nach dem Umwandlungsgesetz 15.10.2024 (Eintragungsdatum)\n\nIDD Inklusionsdienst Rhein Neckar Pfalz UG (haftungsbeschränkt)\nGesellschaft mit beschränkter Haftung\nBad Dürkheim\n\nAls nicht eingetragen wird veröffentlicht: Den Gläubigern der an der Verschmelzung beteiligten Rechtsträger ist, wenn sie binnen sechs Monaten nach dem Tag, an dem die Eintragung der Verschmelzung in das Register des Sitzes desjenigen Rechtsträgers,dessen Gläubiger sie sind, nach § 19 Abs. 3 UmwG als bekannt gemacht gilt, ihren Anspruch nach Grund und Höhe schriftlich anmelden, Sicherheit zu leisten, soweit sie nicht Befriedigung verlangen können. Dieses Recht steht den Gläubigern jedoch nur zu, wenn sie glaubhaft machen, dass durch die Verschmelzung die Erfüllung der Forderung gefährdet wird.Gläubigern der an der Verschmelzung beteiligten Rechtsträger ist unter den Voraussetzungen des § 22 UmwG Sicherheit zu leisten."
    },
    {
      "date": "2024-10-15",
      "id": "90399",
      "original_text": "Löschungsankündigung\nBaden-Württemberg Amtsgericht Stuttgart HRB 766442\nIMM Industrie Montage Martin UG (haftungsbeschränkt) – Stuttgart",
      "type": "Löschungsankündigung",
      "state": "Baden-Württemberg",
      "amtsgericht": "Amtsgericht Stuttgart",
      "registernummer": "HRB 766442",
      "registerart": "HRB",
      "company_name": "IMM Industrie Montage Martin UG (haftungsbeschränkt)",
      "company_seat": "Stuttgart",
      "details": "15.10.2024 (Bekanntmachungsdatum)\n\nBaden-Württemberg Amtsgericht Stuttgart HRB 766442\nLöschungsankündigung\n\nIMM Industrie Montage Martin UG (haftungsbeschränkt)\nGesellschaft mit beschränkter Haftung\nStuttgart\n\nDas Gericht beabsichtigt, die Gesellschaft wegen Vermögenslosigkeit im Handelsregister von Amts wegen nach § 394 FamFG zu löschen. Die Frist zur Geltendmachung eines Widerspruchs gegen die beabsichtigte Löschung ist auf zwei Monate ab Veröffentlichung bestimmt."
    },
    {
      "date": "2024-10-15",
      "id": "90448",
      "original_text": "Sonstige Registerbekanntmachung\nBrandenburg Amtsgericht Frankfurt/Oder HRB 14998\nIRM Technology GmbH – Frankfurt (Oder)",
      "type": "Sonstige Registerbekanntmachung",
      "state": "Brandenburg",
      "amtsgericht": "Amtsgericht Frankfurt/Oder",
      "registernummer": "HRB 14998",
      "registerart": "HRB",
      "company_name": "IRM Technology GmbH",
      "company_seat": "Frankfurt (Oder)",
      "details": "15.10.2024 (Bekanntmachungsdatum)\n\nBrandenburg Amtsgericht Frankfurt/Oder HRB 14998\nSonstige Registerbekanntmachung\n\nIRM Technology GmbH\nGesellschaft mit beschränkter Haftung\nFrankfurt (Oder)\n\nDie vermögenslose Gesellschaft ist auf Grund des § 394 FamFG von Amts wegen gelöscht"
    },
    {
      "date": "2024-10-15",
      "id": "90376",
      "original_text": "Registerbekanntmachung nach dem Umwandlungsgesetz\nSchleswig-Holstein Amtsgericht Lübeck HRA 5869\nISG Intermed Service GmbH & Co. KG – Geesthacht",
      "type": "Registerbekanntmachung nach dem Umwandlungsgesetz",
      "state": "Schleswig-Holstein",
      "amtsgericht": "Amtsgericht Lübeck",
      "registernummer": "HRA 5869",
      "registerart": "HRA",
      "company_name": "ISG Intermed Service GmbH & Co. KG",
      "company_seat": "Geesthacht",
      "details": "15.10.2024 (Bekanntmachungsdatum)\n\nSchleswig-Holstein Amtsgericht Lübeck HRA 5869\nRegisterbekanntmachung nach dem Umwandlungsgesetz 14.10.2024 (Eintragungsdatum)\n\nISG Intermed  Service GmbH & Co. KG\nKommanditgesellschaft\nGeesthacht\n\nZu Eintragungsnummer 17 vom 14.10.2024 wird als nicht eingetragen veröffentlicht: Den Gläubigern der an der Verschmelzung beteiligten Rechtsträger ist, wenn sie binnen sechs Monaten nach dem Tag, an dem die Eintragung der Verschmelzung in das Register des Sitzes desjenigen Rechtsträgers, dessen Gläubiger sie sind, als bekannt gemacht gilt, ihren Anspruch nach Grund und Höhe schriftlich anmelden, Sicherheit zu leisten, soweit sie nicht Befriedigung verlangen können. Dieses Recht steht den Gläubigern jedoch nur zu, wenn sie glaubhaft machen, dass durch die Verschmelzung die Erfüllung ihrer Forderung gefährdet wird."
    },
    {
      "date": "2024-10-15",
      "id": "90340",
      "original_text": "Registerbekanntmachung nach dem Umwandlungsgesetz\nBayern Amtsgericht Augsburg HRB 37214\nIYC GmbH – Gersthofen",
      "type": "Registerbekanntmachung nach dem Umwandlungsgesetz",
      "state": "Bayern",
      "amtsgericht": "Amtsgericht Augsburg",
      "registernummer": "HRB 37214",
      "registerart": "HRB",
      "company_name": "IYC GmbH",
      "company_seat": "Gersthofen",
      "details": "15.10.2024 (Bekanntmachungsdatum)\n\nBayern Amtsgericht Augsburg HRB 37214\nRegisterbekanntmachung nach dem Umwandlungsgesetz 14.10.2024 (Eintragungsdatum)\n\nIYC GmbH\nGesellschaft mit beschränkter Haftung\nGersthofen\n\nDen Gläubigern der an der Verschmelzung beteiligten Rechtsträger ist, wenn sie binnen sechs Monaten nach dem Tag, an dem die Eintragung der Verschmelzung in das Register des Sitzes desjenigen Rechtsträgers, dessen Gläubiger sie sind, nach § 19 Abs. 3 UmwG als bekannt gemacht gilt, ihren Anspruch nach Grund und Höhe schriftlich anmelden, Sicherheit zu leisten, soweit sie nicht Befriedigung verlangen können. Dieses Recht steht den Gläubigern jedoch nur zu, wenn sie glaubhaft machen, dass durch die Verschmelzung die Erfüllung ihrer Forderung gefährdet wird."
    },
    {
      "date": "2024-10-15",
      "id": "90402",
      "original_text": "Löschungsankündigung\nBaden-Württemberg Amtsgericht Freiburg HRB 602588\nInServ Datentechnik GmbH – Villingen-Schwenningen",
      "type": "Löschungsankündigung",
      "state": "Baden-Württemberg",
      "amtsgericht": "Amtsgericht Freiburg",
      "registernummer": "HRB 602588",
      "registerart": "HRB",
      "company_name": "InServ Datentechnik GmbH",
      "company_seat": "Villingen-Schwenningen",
      "details": "15.10.2024 (Bekanntmachungsdatum)\n\nBaden-Württemberg Amtsgericht Freiburg HRB 602588\nLöschungsankündigung 15.10.2024 (Eintragungsdatum)\n\nInServ Datentechnik GmbH\nGesellschaft mit beschränkter Haftung\nVillingen-Schwenningen\n\nDas Gericht beabsichtigt, die Gesellschaft wegen Vermögenslosigkeit im Handelsregister von Amts wegen nach § 394 FamFG zu löschen. Die Frist zur Geltendmachung eines Widerspruchs gegen die beabsichtigte Löschung ist auf einen Monat ab Veröffentlichung bestimmt."
    },
    {
      "date": "2024-10-15",
      "id": "90506",
      "original_text": "Registerbekanntmachung nach dem Umwandlungsgesetz\nNordrhein-Westfalen Amtsgericht Paderborn HRB 3857\nIndend GmbH – Paderborn",
      "type": "Registerbekanntmachung nach dem Umwandlungsgesetz",
      "state": "Nordrhein-Westfalen",
      "amtsgericht": "Amtsgericht Paderborn",
      "registernummer": "HRB 3857",
      "registerart": "HRB",
      "company_name": "Indend GmbH",
      "company_seat": "Paderborn",
      "details": "15.10.2024 (Bekanntmachungsdatum)\n\nNordrhein-Westfalen Amtsgericht Paderborn HRB 3857\nRegisterbekanntmachung nach dem Umwandlungsgesetz 15.10.2024 (Eintragungsdatum)\n\nIndend GmbH\nGesellschaft mit beschränkter Haftung\nPaderborn\n\nDen Gläubigern der an der Verschmelzung beteiligten Rechtsträger ist, wenn sie binnen sechs Monaten nach dem Tag, an dem die Eintragung der Verschmelzung in das Register des Sitzes desjenigen Rechtsträgers, dessen Gläubiger sie sind, nach § 19 Absatz 3 UmwG als bekanntgemacht gilt, ihren Anspruch nach Grund und Höhe schriftlich anmelden, Sicherheit zu leisten, soweit sie nicht Befriedigung verlangen können. Dieses Recht steht den Gläubigern jedoch nur zu, wenn sie glaubhaft machen, dass durch die Verschmelzung die Erfüllung ihrer Forderung gefährdet wird."
    },
    {
      "date": "2024-10-15",
      "id": "90488",
      "original_text": "Registerbekanntmachung nach dem Umwandlungsgesetz\nNordrhein-Westfalen Amtsgericht Düsseldorf HRA 27813\nIngenieurbüro Hamacher - Sebastian Hamacher e.K. – Ratingen",
      "type": "Registerbekanntmachung nach dem Umwandlungsgesetz",
      "state": "Nordrhein-Westfalen",
      "amtsgericht": "Amtsgericht Düsseldorf",
      "registernummer": "HRA 27813",
      "registerart": "HRA",
      "company_name": "Ingenieurbüro Hamacher - Sebastian Hamacher e.K.",
      "company_seat": "Ratingen",
      "details": "15.10.2024 (Bekanntmachungsdatum)\n\nNordrhein-Westfalen Amtsgericht Düsseldorf HRA 27813\nRegisterbekanntmachung nach dem Umwandlungsgesetz 15.10.2024 (Eintragungsdatum)\n\nIngenieurbüro Hamacher - Sebastian Hamacher e.K.\nEinzelkaufmann / Einzelkauffrau\nRatingen\n\nDen Gläubigern der an der Ausgliederung beteiligten Rechtsträger ist, wenn sie binnen sechs Monaten nach dem Tag, an dem die Eintragung der Ausgliederung in das Register des Sitzes desjenigen Rechtsträgers, dessen Gläubiger sie sind, nach § 19 Absatz 3 UmwG als bekanntgemacht gilt, ihren Anspruch nach Grund und Höhe schriftlich anmelden, Sicherheit zu leisten, soweit sie nicht Befriedigung verlangen können. Dieses Recht steht den Gläubigern jedoch nur zu, wenn sie glaubhaft machen, dass durch die Ausgliederung die Erfüllung ihrer Forderung gefährdet wird."
    },
    {
      "date": "2024-10-15",
      "id": "90428",
      "original_text": "Löschungsankündigung\nHamburg Amtsgericht Hamburg HRB 179525\nJ+F Beteiligungsgesellschaft mbH – Hamburg",
      "type": "Löschungsankündigung",
      "state": "Hamburg",
      "amtsgericht": "Amtsgericht Hamburg",
      "registernummer": "HRB 179525",
      "registerart": "HRB",
      "company_name": "J+F Beteiligungsgesellschaft mbH",
      "company_seat": "Hamburg",
      "details": "15.10.2024 (Bekanntmachungsdatum)\n\nHamburg Amtsgericht Hamburg HRB 179525\nLöschungsankündigung\n\nJ+F Beteiligungsgesellschaft mbH\nGesellschaft mit beschränkter Haftung\nHamburg\n\nDas Registergericht beabsichtigt, die im Handelsregister eingetragene Gesellschaft von Amts wegen nach § 394 FamFG zu löschen. Die Frist zur Erhebung eines Widerspruchs gegen die beabsichtigte Löschung wird auf 3 Monate festgesetzt."
    },
    {
      "date": "2024-10-15",
      "id": "90482",
      "original_text": "Registerbekanntmachung nach dem Umwandlungsgesetz\nRheinland-Pfalz Amtsgericht Bad Kreuznach HRB 2981\nJ. Herrmann GmbH – Simmern",
      "type": "Registerbekanntmachung nach dem Umwandlungsgesetz",
      "state": "Rheinland-Pfalz",
      "amtsgericht": "Amtsgericht Bad Kreuznach",
      "registernummer": "HRB 2981",
      "registerart": "HRB",
      "company_name": "J. Herrmann GmbH",
      "company_seat": "Simmern",
      "details": "15.10.2024 (Bekanntmachungsdatum)\n\nRheinland-Pfalz Amtsgericht Bad Kreuznach HRB 2981\nRegisterbekanntmachung nach dem Umwandlungsgesetz 15.10.2024 (Eintragungsdatum)\n\nJ. Herrmann GmbH\nGesellschaft mit beschränkter Haftung\nSimmern\n\nAls nicht eingetragen wird veröffentlicht: Den Gläubigern der an der Verschmelzung beteiligten Rechtsträger ist, wenn sie binnen sechs Monaten nach dem Tag, an dem die Eintragung der Verschmelzung in das Register des Sitzes desjenigen Rechtsträgers, dessen Gläubiger sie sind, nach § 19 Abs. 3 UmwG als bekannt gemacht gilt, ihren Anspruch nach Grund und Höhe schriftlich anmelden, Sicherheit zu leisten, soweit sie nicht Befriedigung verlangen können. Dieses Recht steht den Gläubigern jedoch nur zu, wenn sie glaubhaft machen, dass durch die Verschmelzung die Erfüllung der Forderung gefährdet wird."
    },
    {
      "date": "2024-10-15",
      "id": "90391",
      "original_text": "Registerbekanntmachung nach dem Umwandlungsgesetz\nBerlin Amtsgericht Berlin (Charlottenburg) HRB 268445\nJade Palast 1 GmbH – Berlin",
      "type": "Registerbekanntmachung nach dem Umwandlungsgesetz",
      "state": "Berlin",
      "amtsgericht": "Amtsgericht Berlin (Charlottenburg)",
      "registernummer": "HRB 268445",
      "registerart": "HRB",
      "company_name": "Jade Palast 1 GmbH",
      "company_seat": "Berlin",
      "details": "15.10.2024 (Bekanntmachungsdatum)\n\nBerlin Amtsgericht Berlin (Charlottenburg) HRB 268445\nRegisterbekanntmachung nach dem Umwandlungsgesetz 14.10.2024 (Eintragungsdatum)\n\nJade Palast 1 GmbH\nGesellschaft mit beschränkter Haftung\nBerlin\n\nZu Eintragungsnummer 1 vom 14.10.2024 wird als nicht eingetragen veröffentlicht: Den Gläubigern der an der Spaltung beteiligten Rechtsträger ist, wenn sie binnen sechs Monaten nach dem Tag, an dem die Eintragung der Spaltung in das Register des Sitzes desjenigen Rechtsträgers, dessen Gläubiger sie sind, als bekannt gemacht gilt, ihren Anspruch nach Grund und Höhe schriftlich anmelden, Sicherheit zu leisten, soweit sie nicht Befriedigung verlangen können. Dieses Recht steht den Gläubigern jedoch nur zu, wenn sie glaubhaft machen, dass durch die Spaltung die Erfüllung ihrer Forderung gefährdet wird. Das Recht, Sicherheitsleistung zu verlangen, steht Gläubigern nicht zu, die im Falle der Insolvenz ein Recht auf vorzugsweise Befriedigung aus einer Deckungsmasse haben, die nach gesetzlicher Vorschrift zu ihrem Schutz errichtet und staatlich überwacht ist."
    },
    {
      "date": "2024-10-15",
      "id": "90444",
      "original_text": "Registerbekanntmachung nach dem Umwandlungsgesetz\nBaden-Württemberg Amtsgericht Stuttgart HRB 794908\nJoe Nimble GmbH – Ludwigsburg",
      "type": "Registerbekanntmachung nach dem Umwandlungsgesetz",
      "state": "Baden-Württemberg",
      "amtsgericht": "Amtsgericht Stuttgart",
      "registernummer": "HRB 794908",
      "registerart": "HRB",
      "company_name": "Joe Nimble GmbH",
      "company_seat": "Ludwigsburg",
      "details": "15.10.2024 (Bekanntmachungsdatum)\n\nBaden-Württemberg Amtsgericht Stuttgart HRB 794908\nRegisterbekanntmachung nach dem Umwandlungsgesetz 15.10.2024 (Eintragungsdatum)\n\nJoe Nimble GmbH\nGesellschaft mit beschränkter Haftung\nLudwigsburg\n\nDen Gläubigern der an der Abspaltung beteiligten Rechtsträger ist, wenn sie binnen sechs Monaten nach dem Tag, an dem die Eintragung der Abspaltung in das Register des Sitzes desjenigen Rechtsträgers, dessen Gläubiger sie sind, nach § 19 Abs. 3 UmwG als bekanntgemacht gilt, ihren Anspruch nach Grund und Höhe schriftlich anmelden, Sicherheit zu leisten, soweit sie nicht Befriedigung verlangen können. Dieses Recht steht den Gläubigern jedoch nur zu, wenn sie glaubhaft machen, dass durch die Abspaltung die Erfüllung ihrer Forderung gefährdet wird."
    },
    {
      "date": "2024-10-15",
      "id": "90526",
      "original_text": "Löschungsankündigung\nHessen Amtsgericht Gießen HRA 4699\nJutta Schäfer Bauträger GmbH & Co. KG – Gießen",
      "type": "Löschungsankündigung",
      "state": "Hessen",
      "amtsgericht": "Amtsgericht Gießen",
      "registernummer": "HRA 4699",
      "registerart": "HRA",
      "company_name": "Jutta Schäfer Bauträger GmbH & Co. KG",
      "company_seat": "Gießen",
      "details": "15.10.2024 (Bekanntmachungsdatum)\n\nHessen Amtsgericht Gießen HRA 4699\nLöschungsankündigung\n\nJutta Schäfer Bauträger GmbH & Co. KG\nKommanditgesellschaft\nGießen\n\nEs ist beabsichtigt, die Gesellschaft wegen Vermögenslosigkeit gemäß § 394 FamFG von Amts wegen zu löschen. Hiergegen kann innerhalb von drei Monaten nach dieser Veröffentlichung Widerspruch beim Amtsgericht Gießen eingelegt werden. Sollte Widerspruch eingelegt werden, dürfte dies nur mit Begründung erfolgversprechend sein. Insbesondere sollte vorhandenes Vermögen der Gesellschaft innerhalb der genannten Frist nachgewiesen werden."
    },
    {
      "date": "2024-10-15",
      "id": "90503",
      "original_text": "Löschungsankündigung\nNordrhein-Westfalen Amtsgericht Dortmund HRB 28150\nK+P Beteiligungs GmbH – Dortmund",
      "type": "Löschungsankündigung",
      "state": "Nordrhein-Westfalen",
      "amtsgericht": "Amtsgericht Dortmund",
      "registernummer": "HRB 28150",
      "registerart": "HRB",
      "company_name": "K+P Beteiligungs GmbH",
      "company_seat": "Dortmund",
      "details": "15.10.2024 (Bekanntmachungsdatum)\n\nNordrhein-Westfalen Amtsgericht Dortmund HRB 28150\nLöschungsankündigung\n\nK+P Beteiligungs GmbH\nGesellschaft mit beschränkter Haftung\nDortmund\n\nDas Registergericht beabsichtigt die Gesellschaft von Amts wegen nach § 394 FamFG zu löschen. Die Frist zur Erhebung eines Widerspruchs ist auf zwei Monate festgesetzt."
    },
    {
      "date": "2024-10-15",
      "id": "90440",
      "original_text": "Löschungsankündigung\nHamburg Amtsgericht Hamburg VR 11593\nKONZERTANTE OPER (Trägerverein,Sitz: Hamburg) e.V. – Hamburg",
      "type": "Löschungsankündigung",
      "state": "Hamburg",
      "amtsgericht": "Amtsgericht Hamburg",
      "registernummer": "VR 11593",
      "registerart": "VR",
      "company_name": "KONZERTANTE OPER (Trägerverein,Sitz: Hamburg) e.V.",
      "company_seat": "Hamburg",
      "details": "15.10.2024 (Bekanntmachungsdatum)\n\nHamburg Amtsgericht Hamburg VR 11593\nLöschungsankündigung\n\nKONZERTANTE OPER (Trägerverein,Sitz: Hamburg) e.V.\neingetragener Verein\nHamburg\n\nDas Registergericht beabsichtigt, den im Vereinsregister eingetragenen Verein von Amts wegen nach § 395 FamFG zu löschen, da nach den angestellten Ermittlungen dieser Verein offenbar nicht mehr besteht. Die Frist zur Erhebung eines Widerspruchs gegen die beabsichtigte Löschung wird auf 3 Monate festgesetzt."
    },
    {
      "date": "2024-10-15",
      "id": "90498",
      "original_text": "Registerbekanntmachung nach dem Umwandlungsgesetz\nNordrhein-Westfalen Amtsgericht Iserlohn HRB 10781\nKOSTAL Beteiligungen AG – Lüdenscheid",
      "type": "Registerbekanntmachung nach dem Umwandlungsgesetz",
      "state": "Nordrhein-Westfalen",
      "amtsgericht": "Amtsgericht Iserlohn",
      "registernummer": "HRB 10781",
      "registerart": "HRB",
      "company_name": "KOSTAL Beteiligungen AG",
      "company_seat": "Lüdenscheid",
      "details": "15.10.2024 (Bekanntmachungsdatum)\n\nNordrhein-Westfalen Amtsgericht Iserlohn HRB 10781\nRegisterbekanntmachung nach dem Umwandlungsgesetz 11.10.2024 (Eintragungsdatum)\n\nKOSTAL Beteiligungen AG\nAktiengesellschaft\nLüdenscheid\n\nDen Gläubigern der an der formwechselnden Umwandlung beteiligten Rechtsträger ist, wenn sie binnen sechs Monaten nach dem Tag, an dem die Eintragung der formwechselnden Umwandlung in das Register des Sitzes desjenigen Rechtsträgers, dessen Gläubiger sie sind, nach § 19 Absatz 3 UmwG als bekanntgemacht gilt, ihren Anspruch nach Grund und Höhe schriftlich anmelden, Sicherheit zu leisten, soweit sie nicht Befriedigung verlangen können. Dieses Recht steht den Gläubigern jedoch nur zu, wenn sie glaubhaft machen, dass durch die formwechselnden Umwandlung die Erfüllung ihrer Forderung gefährdet wird."
    },
    {
      "date": "2024-10-15",
      "id": "90381",
      "original_text": "Registerbekanntmachung nach dem Umwandlungsgesetz\nBaden-Württemberg Amtsgericht Stuttgart HRB 724837\nKaufland International Erste GmbH – Neckarsulm",
      "type": "Registerbekanntmachung nach dem Umwandlungsgesetz",
      "state": "Baden-Württemberg",
      "amtsgericht": "Amtsgericht Stuttgart",
      "registernummer": "HRB 724837",
      "registerart": "HRB",
      "company_name": "Kaufland International Erste GmbH",
      "company_seat": "Neckarsulm",
      "details": "15.10.2024 (Bekanntmachungsdatum)\n\nBaden-Württemberg Amtsgericht Stuttgart HRB 724837\nRegisterbekanntmachung nach dem Umwandlungsgesetz 15.10.2024 (Eintragungsdatum)\n\nKaufland International Erste GmbH\nGesellschaft mit beschränkter Haftung\nNeckarsulm\n\nAls nicht eingetragen wird bekanntgemacht:\nDen Gläubigern der an der Verschmelzung beteiligten Rechtsträger ist, wenn sie binnen sechs Monaten nach dem Tag, an dem die Eintragung der Verschmelzung in das Register des Sitzes desjenigen Rechtsträgers, dessen Gläubiger sie sind, nach § 19 Abs. 3 UmwG als bekanntgemacht gilt, ihren Anspruch nach Grund und Höhe schriftlich anmelden, Sicherheit zu leisten, soweit sie nicht Befriedigung verlangen können. Dieses Recht steht den Gläubigern jedoch nur zu, wenn sie glaubhaft machen, dass durch die Verschmelzung die Erfüllung ihrer Forderung gefährdet wird."
    },
    {
      "date": "2024-10-15",
      "id": "90382",
      "original_text": "Registerbekanntmachung nach dem Umwandlungsgesetz\nBaden-Württemberg Amtsgericht Stuttgart HRB 107851\nKaufland Kroatien Warenhandel GmbH – Neckarsulm",
      "type": "Registerbekanntmachung nach dem Umwandlungsgesetz",
      "state": "Baden-Württemberg",
      "amtsgericht": "Amtsgericht Stuttgart",
      "registernummer": "HRB 107851",
      "registerart": "HRB",
      "company_name": "Kaufland Kroatien Warenhandel GmbH",
      "company_seat": "Neckarsulm",
      "details": "15.10.2024 (Bekanntmachungsdatum)\n\nBaden-Württemberg Amtsgericht Stuttgart HRB 107851\nRegisterbekanntmachung nach dem Umwandlungsgesetz 15.10.2024 (Eintragungsdatum)\n\nKaufland Kroatien Warenhandel GmbH\nGesellschaft mit beschränkter Haftung\nNeckarsulm\n\nDen Gläubigern der an der Verschmelzung beteiligten Rechtsträger ist, wenn sie binnen sechs Monaten nach dem Tag, an dem die Eintragung der Verschmelzung in das Register des Sitzes desjenigen Rechtsträgers, dessen Gläubiger sie sind, nach § 19 Abs. 3 UmwG als bekanntgemacht gilt, ihren Anspruch nach Grund und Höhe schriftlich anmelden, Sicherheit zu leisten, soweit sie nicht Befriedigung verlangen können. Dieses Recht steht den Gläubigern jedoch nur zu, wenn sie glaubhaft machen, dass durch die Verschmelzung die Erfüllung ihrer Forderung gefährdet wird."
    },
    {
      "date": "2024-10-15",
      "id": "90357",
      "original_text": "Registerbekanntmachung nach dem Umwandlungsgesetz\nBayern Amtsgericht Memmingen HRA 14059\nKlenk & Barras Grundstücks OHG – Weißenhorn",
      "type": "Registerbekanntmachung nach dem Umwandlungsgesetz",
      "state": "Bayern",
      "amtsgericht": "Amtsgericht Memmingen",
      "registernummer": "HRA 14059",
      "registerart": "HRA",
      "company_name": "Klenk & Barras Grundstücks OHG",
      "company_seat": "Weißenhorn",
      "details": "15.10.2024 (Bekanntmachungsdatum)\n\nBayern Amtsgericht Memmingen HRA 14059\nRegisterbekanntmachung nach dem Umwandlungsgesetz 14.10.2024 (Eintragungsdatum)\n\nKlenk & Barras Grundstücks OHG\nOffene Handelsgesellschaft\nWeißenhorn\n\nDen Gläubigern des formwechselnden Rechtsträgers ist, wenn sie binnen sechs Monaten nach dem Tag, an dem die Eintragung des Formwechsels nach § 201 UmwG als bekannt gemacht gilt, ihren Anspruch nach Grund und Höhe schriftlich anmelden, Sicherheit zu leisten, soweit sie nicht Befriedigung verlangen können. Dieses Recht steht den Gläubigern jedoch nur zu, wenn sie glaubhaft machen, dass durch den Formwechsel die Erfüllung ihrer Forderung gefährdet wird."
    },
    {
      "date": "2024-10-15",
      "id": "90501",
      "original_text": "Registerbekanntmachung nach dem Umwandlungsgesetz\nNordrhein-Westfalen Amtsgericht Dortmund HRB 36588\nKlöpper-Therm GmbH – Dortmund",
      "type": "Registerbekanntmachung nach dem Umwandlungsgesetz",
      "state": "Nordrhein-Westfalen",
      "amtsgericht": "Amtsgericht Dortmund",
      "registernummer": "HRB 36588",
      "registerart": "HRB",
      "company_name": "Klöpper-Therm GmbH",
      "company_seat": "Dortmund",
      "details": "15.10.2024 (Bekanntmachungsdatum)\n\nNordrhein-Westfalen Amtsgericht Dortmund HRB 36588\nRegisterbekanntmachung nach dem Umwandlungsgesetz 15.10.2024 (Eintragungsdatum)\n\nKlöpper-Therm GmbH\nGesellschaft mit beschränkter Haftung\nDortmund\n\nDen Gläubigern der an der #DV.UmF(Text=\"Bitte wählen Sie die zutreffende Art nach UmwG aus!\",Eingabe=\"Verschmelzung\",\"Aufspaltung\",\"Abspaltung\",\"Ausgliederung\",\"Vermögensübertragung\",\"formwechselnden Umwandlung\") beteiligten Rechtsträger ist, wenn sie binnen sechs Monaten nach dem Tag, an dem die Eintragung der #DV.UmF in das Register des Sitzes #DV.RTr(Text=\"Bitte wählen Sie aus, ob ein oder mehrere andere Rechtsträger betroffen sind!\",Eingabe=\"desjenigen Rechtsträgers, dessen Gläubiger\",\"derjenigen Rechtsträger deren Gläubiger\") sie sind, nach § 19 Absatz 3 UmwG als bekanntgemacht gilt, ihren Anspruch nach Grund und Höhe schriftlich anmelden, Sicherheit zu leisten, soweit sie nicht Befriedigung verlangen können. Dieses Recht steht den Gläubigern jedoch nur zu, wenn sie glaubhaft machen, dass durch die #DV.UmF die Erfüllung ihrer Forderung gefährdet wird."
    },
    {
      "date": "2024-10-15",
      "id": "90453",
      "original_text": "Registerbekanntmachung nach dem Umwandlungsgesetz\nBrandenburg Amtsgericht Potsdam HRB 39915\nKolibri Beteiligung GmbH – Kleinmachnow",
      "type": "Registerbekanntmachung nach dem Umwandlungsgesetz",
      "state": "Brandenburg",
      "amtsgericht": "Amtsgericht Potsdam",
      "registernummer": "HRB 39915",
      "registerart": "HRB",
      "company_name": "Kolibri Beteiligung GmbH",
      "company_seat": "Kleinmachnow",
      "details": "15.10.2024 (Bekanntmachungsdatum)\n\nBrandenburg Amtsgericht Potsdam HRB 39915\nRegisterbekanntmachung nach dem Umwandlungsgesetz 15.10.2024 (Eintragungsdatum)\n\nKolibri Beteiligung GmbH\nGesellschaft mit beschränkter Haftung\nKleinmachnow\n\nZu Eintragungsnummer 1 vom 15.10.2024 wird als nicht eingetragen veröffentlicht:\nDen Gläubigern der an der Umwandlung beteiligten Rechtsträger ist, wenn sie binnen sechs Monaten nach dem Tag, an dem die Eintragung der Umwandlung in das Register des Sitzes desjenigen Rechtsträgers, dessen Gläubiger sie sind, als bekannt gemacht gilt, ihren Anspruch nach Grund und Höhe schriftlich anmelden, Sicherheit zu leisten, soweit sie nicht Befriedigung verlangen können. Dieses Recht steht den Gläubigern jedoch nur zu, wenn sie glaubhaft machen, dass durch die Umwandlung die Erfüllung ihrer Forderung gefährdet wird."
    },
    {
      "date": "2024-10-15",
      "id": "90377",
      "original_text": "Einreichung neuer Dokumente\nSachsen-Anhalt Amtsgericht Stendal HRB 215095\nKommunale Bädergesellschaft Sangerhausen mbH – Sangerhausen",
      "type": "Einreichung neuer Dokumente",
      "state": "Sachsen-Anhalt",
      "amtsgericht": "Amtsgericht Stendal",
      "registernummer": "HRB 215095",
      "registerart": "HRB",
      "company_name": "Kommunale Bädergesellschaft Sangerhausen mbH",
      "company_seat": "Sangerhausen",
      "details": "15.10.2024 (Bekanntmachungsdatum)\n\nSachsen-Anhalt Amtsgericht Stendal HRB 215095\nEinreichung neuer Dokumente 15.10.2024 (Eintragungsdatum)\n\nKommunale Bädergesellschaft Sangerhausen mbH\nGesellschaft mit beschränkter Haftung\nSangerhausen\n\nEine Liste der Mitglieder des Aufsichtsrates wurde zum Handelsregister eingereicht."
    },
    {
      "date": "2024-10-15",
      "id": "90390",
      "original_text": "Registerbekanntmachung nach dem Umwandlungsgesetz\nBerlin Amtsgericht Berlin (Charlottenburg) HRB 122404\nKooperative Berlin Medienproduktion KBM GmbH – Berlin",
      "type": "Registerbekanntmachung nach dem Umwandlungsgesetz",
      "state": "Berlin",
      "amtsgericht": "Amtsgericht Berlin (Charlottenburg)",
      "registernummer": "HRB 122404",
      "registerart": "HRB",
      "company_name": "Kooperative Berlin Medienproduktion KBM GmbH",
      "company_seat": "Berlin",
      "details": "15.10.2024 (Bekanntmachungsdatum)\n\nBerlin Amtsgericht Berlin (Charlottenburg) HRB 122404\nRegisterbekanntmachung nach dem Umwandlungsgesetz 14.10.2024 (Eintragungsdatum)\n\nKooperative Berlin Medienproduktion KBM GmbH\nGesellschaft mit beschränkter Haftung\nBerlin\n\nZu Eintragungsnummer 7 vom 14.10.2024 wird als nicht eingetragen veröffentlicht: Den Gläubigern der an der Spaltung beteiligten Rechtsträger ist, wenn sie binnen sechs Monaten nach dem Tag, an dem die Eintragung der Spaltung in das Register des Sitzes desjenigen Rechtsträgers, dessen Gläubiger sie sind, als bekannt gemacht gilt, ihren Anspruch nach Grund und Höhe schriftlich anmelden, Sicherheit zu leisten, soweit sie nicht Befriedigung verlangen können. Dieses Recht steht den Gläubigern jedoch nur zu, wenn sie glaubhaft machen, dass durch die Spaltung die Erfüllung ihrer Forderung gefährdet wird. Das Recht, Sicherheitsleistung zu verlangen, steht Gläubigern nicht zu, die im Falle der Insolvenz ein Recht auf vorzugsweise Befriedigung aus einer Deckungsmasse haben, die nach gesetzlicher Vorschrift zu ihrem Schutz errichtet und staatlich überwacht ist."
    },
    {
      "date": "2024-10-15",
      "id": "90509",
      "original_text": "Löschungsankündigung\nThüringen Amtsgericht Jena HRB 210645\nKrüger-Trans-GmbH – Triptis",
      "type": "Löschungsankündigung",
      "state": "Thüringen",
      "amtsgericht": "Amtsgericht Jena",
      "registernummer": "HRB 210645",
      "registerart": "HRB",
      "company_name": "Krüger-Trans-GmbH",
      "company_seat": "Triptis",
      "details": "15.10.2024 (Bekanntmachungsdatum)\n\nThüringen Amtsgericht Jena HRB 210645\nLöschungsankündigung\n\nKrüger-Trans-GmbH\nGesellschaft mit beschränkter Haftung\nTriptis\n\nDas Registergericht beabsichtigt, die im Handelsregister eingetragene Gesellschaft wegen Vermögenslosigkeit nach § 394 FamFG von Amts wegen zu löschen. Die Frist zur Erhebung eines Widerspruchs gegen die beabsichtigte Löschung wird auf 6 Wochen festgesetzt."
    },
    {
      "date": "2024-10-15",
      "id": "90470",
      "original_text": "Registerbekanntmachung nach dem Umwandlungsgesetz\nNiedersachsen Amtsgericht Aurich HRB 111576\nLVD Ländlicher Versicherungsdienst GmbH – Aurich",
      "type": "Registerbekanntmachung nach dem Umwandlungsgesetz",
      "state": "Niedersachsen",
      "amtsgericht": "Amtsgericht Aurich",
      "registernummer": "HRB 111576",
      "registerart": "HRB",
      "company_name": "LVD Ländlicher Versicherungsdienst GmbH",
      "company_seat": "Aurich",
      "details": "15.10.2024 (Bekanntmachungsdatum)\n\nNiedersachsen Amtsgericht Aurich HRB 111576\nRegisterbekanntmachung nach dem Umwandlungsgesetz 26.09.2024 (Eintragungsdatum)\n\nLVD Ländlicher Versicherungsdienst GmbH\nGesellschaft mit beschränkter Haftung\nAurich\n\nDen Gläubigern der an der Verschmelzung beteiligten Rechtsträger ist, wenn sie binnen sechs Monaten nach dem Tag, an dem die Eintragung der Verschmelzung in das Register des Sitzes desjenigen Rechtsträgers, dessen Gläubiger sie sind, nach § 19  Abs.  3 UmwG als bekannt gemacht gilt, ihren Anspruch nach Grund und Höhe schriftlich anmelden, Sicherheit zu leisten, soweit sie nicht Befriedigung verlangen können. Dieses Recht steht den Gläubigern jedoch nur zu, wenn sie glaubhaft machen, dass durch die Verschmelzung die Erfüllung der Forderung gefährdet wird."
    },
    {
      "date": "2024-10-15",
      "id": "90380",
      "original_text": "Löschungsankündigung\nBerlin Amtsgericht Berlin (Charlottenburg) HRB 166290\nLYFEBOX UG (haftungsbeschränkt) – Berlin",
      "type": "Löschungsankündigung",
      "state": "Berlin",
      "amtsgericht": "Amtsgericht Berlin (Charlottenburg)",
      "registernummer": "HRB 166290",
      "registerart": "HRB",
      "company_name": "LYFEBOX UG (haftungsbeschränkt)",
      "company_seat": "Berlin",
      "details": "15.10.2024 (Bekanntmachungsdatum)\n\nBerlin Amtsgericht Berlin (Charlottenburg) HRB 166290\nLöschungsankündigung\n\nLYFEBOX UG (haftungsbeschränkt)\nGesellschaft mit beschränkter Haftung\nBerlin\n\nEs ist beabsichtigt, die Eintragung wegen Mangels einer wesentlichen Voraussetzung gemäß § 395 FamFG von Amts wegen zu löschen. Widerspruchsfrist 6 Wochen"
    },
    {
      "date": "2024-10-15",
      "id": "90483",
      "original_text": "Registerbekanntmachung nach dem Umwandlungsgesetz\nNordrhein-Westfalen Amtsgericht Köln HRB 105152\nLena Terlutter GmbH – Köln",
      "type": "Registerbekanntmachung nach dem Umwandlungsgesetz",
      "state": "Nordrhein-Westfalen",
      "amtsgericht": "Amtsgericht Köln",
      "registernummer": "HRB 105152",
      "registerart": "HRB",
      "company_name": "Lena Terlutter GmbH",
      "company_seat": "Köln",
      "details": "15.10.2024 (Bekanntmachungsdatum)\n\nNordrhein-Westfalen Amtsgericht Köln HRB 105152\nRegisterbekanntmachung nach dem Umwandlungsgesetz 15.10.2024 (Eintragungsdatum)\n\nLena Terlutter GmbH\nGesellschaft mit beschränkter Haftung\nKöln\n\nDen Gläubigern der an der Verschmelzung beteiligten Rechtsträger ist, wenn sie binnen sechs Monaten nach dem Tag, an dem die Eintragung der Verschmelzung in das Register des Sitzes desjenigen Rechtsträgers, dessen Gläubiger sie sind, nach § 19 Absatz 3 UmwG als bekanntgemacht gilt, ihren Anspruch nach Grund und Höhe schriftlich anmelden, Sicherheit zu leisten, soweit sie nicht Befriedigung verlangen können. Dieses Recht steht den Gläubigern jedoch nur zu, wenn sie glaubhaft machen, dass durch die Verschmelzung die Erfüllung ihrer Forderung gefährdet wird."
    },
    {
      "date": "2024-10-15",
      "id": "90454",
      "original_text": "Löschungsankündigung\nBerlin Amtsgericht Berlin (Charlottenburg) HRB 164622\nLiftmont UG (haftungsbeschränkt) – Berlin",
      "type": "Löschungsankündigung",
      "state": "Berlin",
      "amtsgericht": "Amtsgericht Berlin (Charlottenburg)",
      "registernummer": "HRB 164622",
      "registerart": "HRB",
      "company_name": "Liftmont UG (haftungsbeschränkt)",
      "company_seat": "Berlin",
      "details": "15.10.2024 (Bekanntmachungsdatum)\n\nBerlin Amtsgericht Berlin (Charlottenburg) HRB 164622\nLöschungsankündigung\n\nLiftmont UG (haftungsbeschränkt)\nGesellschaft mit beschränkter Haftung\nBerlin\n\nBei der nachstehenden Gesellschaft wird das Amtslöschungsverfahren gemäß § 394 FamFG eingeleitet. Widerspruchsfrist 6 Wochen"
    },
    {
      "date": "2024-10-15",
      "id": "90371",
      "original_text": "Löschungsankündigung\nBerlin Amtsgericht Berlin (Charlottenburg) HRB 177336\nM.Y. Family GmbH – Berlin",
      "type": "Löschungsankündigung",
      "state": "Berlin",
      "amtsgericht": "Amtsgericht Berlin (Charlottenburg)",
      "registernummer": "HRB 177336",
      "registerart": "HRB",
      "company_name": "M.Y. Family GmbH",
      "company_seat": "Berlin",
      "details": "15.10.2024 (Bekanntmachungsdatum)\n\nBerlin Amtsgericht Berlin (Charlottenburg) HRB 177336\nLöschungsankündigung\n\nM.Y. Family GmbH\nGesellschaft mit beschränkter Haftung\nBerlin\n\nBei der nachstehenden Gesellschaft wird das Amtslöschungsverfahren gemäß § 394 FamFG eingeleitet. Widerspruchsfrist 6 Wochen"
    },
    {
      "date": "2024-10-15",
      "id": "90386",
      "original_text": "Registerbekanntmachung nach dem Umwandlungsgesetz\nBaden-Württemberg Amtsgericht Stuttgart HRB 750130\nMANN + HUMMEL Verwaltungs GmbH – Ludwigsburg",
      "type": "Registerbekanntmachung nach dem Umwandlungsgesetz",
      "state": "Baden-Württemberg",
      "amtsgericht": "Amtsgericht Stuttgart",
      "registernummer": "HRB 750130",
      "registerart": "HRB",
      "company_name": "MANN + HUMMEL Verwaltungs GmbH",
      "company_seat": "Ludwigsburg",
      "details": "15.10.2024 (Bekanntmachungsdatum)\n\nBaden-Württemberg Amtsgericht Stuttgart HRB 750130\nRegisterbekanntmachung nach dem Umwandlungsgesetz 15.10.2024 (Eintragungsdatum)\n\nMANN + HUMMEL Verwaltungs GmbH\nGesellschaft mit beschränkter Haftung\nLudwigsburg\n\nDen Gläubigern der an der Verschmelzung beteiligten Rechtsträger ist, wenn sie binnen sechs Monaten nach dem Tag, an dem die Eintragung der Verschmelzung in das Register des Sitzes desjenigen Rechtsträgers, dessen Gläubiger sie sind, nach § 19 Abs. 3 UmwG als bekanntgemacht gilt, ihren Anspruch nach Grund und Höhe schriftlich anmelden, Sicherheit zu leisten, soweit sie nicht Befriedigung verlangen können. Dieses Recht steht den Gläubigern jedoch nur zu, wenn sie glaubhaft machen, dass durch die Verschmelzung die Erfüllung ihrer Forderung gefährdet wird."
    },
    {
      "date": "2024-10-15",
      "id": "90451",
      "original_text": "Registerbekanntmachung nach dem Umwandlungsgesetz\nSchleswig-Holstein Amtsgericht Pinneberg HRB 4468\nMEBA Bau- und Immobiliengesellschaft mbH – Halstenbek",
      "type": "Registerbekanntmachung nach dem Umwandlungsgesetz",
      "state": "Schleswig-Holstein",
      "amtsgericht": "Amtsgericht Pinneberg",
      "registernummer": "HRB 4468",
      "registerart": "HRB",
      "company_name": "MEBA Bau- und Immobiliengesellschaft mbH",
      "company_seat": "Halstenbek",
      "details": "15.10.2024 (Bekanntmachungsdatum)\n\nSchleswig-Holstein Amtsgericht Pinneberg HRB 4468\nRegisterbekanntmachung nach dem Umwandlungsgesetz 15.10.2024 (Eintragungsdatum)\n\nMEBA Bau- und Immobiliengesellschaft mbH\nGesellschaft mit beschränkter Haftung\nHalstenbek\n\nZu Eintragungsnummer 7 vom 15.10.2024 wird als nicht eingetragen veröffentlicht: Als nicht eingetragen wird veröffentlicht: Den Gläubigern der an der Verschmelzung beteiligten Rechtsträger ist, wenn sie binnen sechs Monaten nach dem Tag, an dem die Eintragung der Verschmelzung in das Register des Sitzes desjenigen Rechtsträgers, dessen Gläubiger sie sind, als bekannt gemacht gilt, ihren Anspruch nach Grund und Höhe schriftlich anmelden, Sicherheit zu leisten, soweit sie nicht Befriedigung verlangen können. Dieses Recht steht den Gläubigern jedoch nur zu, wenn sie glaubhaft machen, dass durch die Verschmelzung die Erfüllung ihrer Forderung gefährdet wird. Das Recht, Sicherheitsleistung zu verlangen, steht Gläubigern nicht zu, die im Falle der Insolvenz ein Recht auf vorzugsweise Befriedigung aus einer Deckungsmasse haben, die nach gesetzlicher Vorschrift zu ihrem Schutz errichtet und staatlich überwacht ist."
    },
    {
      "date": "2024-10-15",
      "id": "90463",
      "original_text": "Einreichung neuer Dokumente\nNiedersachsen Amtsgericht Hannover HRB 58877\nMODULAT LEASING AG – Hannover",
      "type": "Einreichung neuer Dokumente",
      "state": "Niedersachsen",
      "amtsgericht": "Amtsgericht Hannover",
      "registernummer": "HRB 58877",
      "registerart": "HRB",
      "company_name": "MODULAT LEASING AG",
      "company_seat": "Hannover",
      "details": "15.10.2024 (Bekanntmachungsdatum)\n\nNiedersachsen Amtsgericht Hannover HRB 58877\nEinreichung neuer Dokumente\n\nMODULAT LEASING AG\nAktiengesellschaft\nHannover\n\nDie Liste der Mitglieder des Aufsichtsrats wurde beim Registergericht eingereicht."
    },
    {
      "date": "2024-10-15",
      "id": "90339",
      "original_text": "Einreichung neuer Dokumente\nBayern Amtsgericht Ingolstadt HRB 3944\nMR Beratungs- und Dienstleistungs GmbH – Neuburg a.d. Donau",
      "type": "Einreichung neuer Dokumente",
      "state": "Bayern",
      "amtsgericht": "Amtsgericht Ingolstadt",
      "registernummer": "HRB 3944",
      "registerart": "HRB",
      "company_name": "MR Beratungs- und Dienstleistungs GmbH",
      "company_seat": "Neuburg a.d. Donau",
      "details": "15.10.2024 (Bekanntmachungsdatum)\n\nBayern Amtsgericht Ingolstadt HRB 3944\nEinreichung neuer Dokumente\n\nMR Beratungs- und Dienstleistungs GmbH\nGesellschaft mit beschränkter Haftung\nNeuburg a.d. Donau\n\nDem Amtsgericht Ingolstadt -Registergericht- ist eine Liste der Mitglieder des Aufsichtsrats eingereicht worden, § 52 Abs. 3 S. 2 GmbHG."
    },
    {
      "date": "2024-10-15",
      "id": "90396",
      "original_text": "Löschungsankündigung\nSaarland Amtsgericht Saarbrücken HRB 103363\nMRL Malerfachbetrieb UG (haftungsbeschränkt) – Wadgassen",
      "type": "Löschungsankündigung",
      "state": "Saarland",
      "amtsgericht": "Amtsgericht Saarbrücken",
      "registernummer": "HRB 103363",
      "registerart": "HRB",
      "company_name": "MRL Malerfachbetrieb UG (haftungsbeschränkt)",
      "company_seat": "Wadgassen",
      "details": "15.10.2024 (Bekanntmachungsdatum)\n\nSaarland Amtsgericht Saarbrücken HRB 103363\nLöschungsankündigung\n\nMRL Malerfachbetrieb UG (haftungsbeschränkt)\nGesellschaft mit beschränkter Haftung\nWadgassen\n\nEs ist beabsichtigt, die Gesellschaft von Amts wegen gemäß § 394 FamFG wegen Vermögenslosigkeit zu löschen. Gegen die Löschung von Amts wegen ist das Rechtsmittel des Widerspruchs statthaft. Der Widerspruch ist binnen einer Frist von 2 Monaten beginnend mit dem Tag dieser Veröffentlichung durch Einreichen eines Widerspruchsschreibens -schriftlich oder zur Niederschrift der Geschäftsstelle- beim Amtsgericht Saarbrücken, -zentrales Handelsregister-, Mainzerstr.178, 66121 Saarbrücken einzulegen. Der Widerspruch muss die Bezeichnung der angefochtenen Löschungsankündigung enthalten sowie die Erklärung, dass Widerspruch eingelegt wird. Er ist vom Widerspruchsführer oder seinem Bevollmächtigten zu unterzeichnen."
    },
    {
      "date": "2024-10-15",
      "id": "90362",
      "original_text": "Registerbekanntmachung nach dem Umwandlungsgesetz\nBayern Amtsgericht Würzburg HRA 7877\nMain Immobilien Service GmbH & Co. KG – Würzburg",
      "type": "Registerbekanntmachung nach dem Umwandlungsgesetz",
      "state": "Bayern",
      "amtsgericht": "Amtsgericht Würzburg",
      "registernummer": "HRA 7877",
      "registerart": "HRA",
      "company_name": "Main Immobilien Service GmbH & Co. KG",
      "company_seat": "Würzburg",
      "details": "15.10.2024 (Bekanntmachungsdatum)\n\nBayern Amtsgericht Würzburg HRA 7877\nRegisterbekanntmachung nach dem Umwandlungsgesetz 14.10.2024 (Eintragungsdatum)\n\nMain Immobilien Service GmbH & Co. KG\nKommanditgesellschaft\nWürzburg\n\nDen Gläubigern der an der Verschmelzung beteiligten Rechtsträger ist, wenn sie binnen sechs Monaten nach dem Tag, an dem die Eintragung der Verschmelzung in das Register des Sitzes desjenigen Rechtsträgers, dessen Gläubiger sie sind, nach § 19 Abs. 3 UmwG als bekannt gemacht gilt, ihren Anspruch nach Grund und Höhe schriftlich anmelden, Sicherheit zu leisten, soweit sie nicht Befriedigung verlangen können. Dieses Recht steht den Gläubigern jedoch nur zu, wenn sie glaubhaft machen, dass durch die Verschmelzung die Erfüllung ihrer Forderung gefährdet wird."
    },
    {
      "date": "2024-10-15",
      "id": "90464",
      "original_text": "Registerbekanntmachung nach dem Umwandlungsgesetz\nNiedersachsen Amtsgericht Lüneburg HRA 203922\nMaksuti Garten- und Landschaftsbau e.K. – Wietzendorf",
      "type": "Registerbekanntmachung nach dem Umwandlungsgesetz",
      "state": "Niedersachsen",
      "amtsgericht": "Amtsgericht Lüneburg",
      "registernummer": "HRA 203922",
      "registerart": "HRA",
      "company_name": "Maksuti Garten- und Landschaftsbau e.K.",
      "company_seat": "Wietzendorf",
      "details": "15.10.2024 (Bekanntmachungsdatum)\n\nNiedersachsen Amtsgericht Lüneburg HRA 203922\nRegisterbekanntmachung nach dem Umwandlungsgesetz 15.10.2024 (Eintragungsdatum)\n\nMaksuti Garten- und Landschaftsbau e.K.\nEinzelkaufmann / Einzelkauffrau\nWietzendorf\n\nDen Gläubigern der an der Ausgliederung beteiligten Rechtsträger ist, wenn sie binnen sechs Monaten nach dem Tag, an dem die Eintragung der Ausgliederung in das Register des Sitzes desjenigen Rechtsträgers, dessen Gläubiger sie sind, nach § 19 Abs. 3 UmwG als bekannt gemacht gilt, ihren Anspruch nach Grund und Höhe schriftlich anmelden, Sicherheit zu leisten, soweit sie nicht Befriedigung verlangen können. Dieses Recht steht den Gläubigern jedoch nur zu, wenn sie glaubhaft machen, dass durch die Ausgliederung die Erfüllung der Forderung gefährdet wird."
    },
    {
      "date": "2024-10-15",
      "id": "90452",
      "original_text": "Löschungsankündigung\nBerlin Amtsgericht Berlin (Charlottenburg) HRB 139641\nMekan GmbH – Berlin",
      "type": "Löschungsankündigung",
      "state": "Berlin",
      "amtsgericht": "Amtsgericht Berlin (Charlottenburg)",
      "registernummer": "HRB 139641",
      "registerart": "HRB",
      "company_name": "Mekan GmbH",
      "company_seat": "Berlin",
      "details": "15.10.2024 (Bekanntmachungsdatum)\n\nBerlin Amtsgericht Berlin (Charlottenburg) HRB 139641\nLöschungsankündigung\n\nMekan GmbH\nGesellschaft mit beschränkter Haftung\nBerlin\n\nBei der nachstehenden Gesellschaft wird das Amtslöschungsverfahren gemäß § 394 FamFG eingeleitet. Widerspruchsfrist 6 Wochen"
    },
    {
      "date": "2024-10-15",
      "id": "90445",
      "original_text": "Einreichung neuer Dokumente\nSaarland Amtsgericht Saarbrücken HRB 64151\nMerziger Bäder-Gesellschaft mit beschränkter Haftung – Merzig",
      "type": "Einreichung neuer Dokumente",
      "state": "Saarland",
      "amtsgericht": "Amtsgericht Saarbrücken",
      "registernummer": "HRB 64151",
      "registerart": "HRB",
      "company_name": "Merziger Bäder-Gesellschaft mit beschränkter Haftung",
      "company_seat": "Merzig",
      "details": "15.10.2024 (Bekanntmachungsdatum)\n\nSaarland Amtsgericht Saarbrücken HRB 64151\nEinreichung neuer Dokumente\n\nMerziger Bäder-Gesellschaft mit beschränkter Haftung\nGesellschaft mit beschränkter Haftung\nMerzig\n\nDie Geschäftsführung der Gesellschaft hat eine Liste der Mitglieder des Aufsichtsrats zum Handelsregister eingereicht (§ 52 Abs. 3 Satz 2 GmbHG)."
    },
    {
      "date": "2024-10-15",
      "id": "90434",
      "original_text": "Löschungsankündigung\nHamburg Amtsgericht Hamburg HRB 178023\nMietdeinauto Franchise GmbH – Hamburg",
      "type": "Löschungsankündigung",
      "state": "Hamburg",
      "amtsgericht": "Amtsgericht Hamburg",
      "registernummer": "HRB 178023",
      "registerart": "HRB",
      "company_name": "Mietdeinauto Franchise GmbH",
      "company_seat": "Hamburg",
      "details": "15.10.2024 (Bekanntmachungsdatum)\n\nHamburg Amtsgericht Hamburg HRB 178023\nLöschungsankündigung\n\nMietdeinauto Franchise GmbH\nGesellschaft mit beschränkter Haftung\nHamburg\n\nDas Registergericht beabsichtigt, die im Handelsregister eingetragene Gesellschaft von Amts wegen nach § 394 FamFG zu löschen. Die Frist zur Erhebung eines Widerspruchs gegen die beabsichtigte Löschung wird auf 3 Monate festgesetzt."
    },
    {
      "date": "2024-10-15",
      "id": "90365",
      "original_text": "Registerbekanntmachung nach dem Umwandlungsgesetz\nBayern Amtsgericht München HRB 121023\nMorphoSys AG – Planegg",
      "type": "Registerbekanntmachung nach dem Umwandlungsgesetz",
      "state": "Bayern",
      "amtsgericht": "Amtsgericht München",
      "registernummer": "HRB 121023",
      "registerart": "HRB",
      "company_name": "MorphoSys AG",
      "company_seat": "Planegg",
      "details": "15.10.2024 (Bekanntmachungsdatum)\n\nBayern Amtsgericht München HRB 121023\nRegisterbekanntmachung nach dem Umwandlungsgesetz 14.10.2024 (Eintragungsdatum)\n\nMorphoSys AG\nAktiengesellschaft\nPlanegg\n\nDen Gläubigern der an der Verschmelzung beteiligten Rechtsträger ist, wenn sie binnen sechs Monaten nach dem Tag, an dem die Eintragung der Verschmelzung in das Register des Sitzes desjenigen Rechtsträgers, dessen Gläubiger sie sind, nach § 19 Abs. 3 UmwG als bekannt gemacht gilt, ihren Anspruch nach Grund und Höhe schriftlich anmelden, Sicherheit zu leisten, soweit sie nicht Befriedigung verlangen können. Dieses Recht steht den Gläubigern jedoch nur zu, wenn sie glaubhaft machen, dass durch die Verschmelzung die Erfüllung ihrer Forderung gefährdet wird."
    },
    {
      "date": "2024-10-15",
      "id": "90338",
      "original_text": "Löschungsankündigung\nBayern Amtsgericht Bayreuth VR 200451\nMärchenzauber Fleckl e.V. – Warmensteinach OT Fleckl",
      "type": "Löschungsankündigung",
      "state": "Bayern",
      "amtsgericht": "Amtsgericht Bayreuth",
      "registernummer": "VR 200451",
      "registerart": "VR",
      "company_name": "Märchenzauber Fleckl e.V.",
      "company_seat": "Warmensteinach OT Fleckl",
      "details": "15.10.2024 (Bekanntmachungsdatum)\n\nBayern Amtsgericht Bayreuth VR 200451\nLöschungsankündigung\n\nMärchenzauber Fleckl e.V.\neingetragener Verein\nWarmensteinach OT Fleckl\n\nDas Registergericht beabsichtigt, den im Vereinsregister eingetragenen Verein von Amts wegen nach 395 FamFG zu löschen. Die Frist zur Erhebung eines Widerspruchs ist auf einen Monat festgesetzt."
    },
    {
      "date": "2024-10-15",
      "id": "90466",
      "original_text": "Registerbekanntmachung nach dem Umwandlungsgesetz\nNiedersachsen Amtsgericht Oldenburg (Oldenburg) HRB 216804\nNB Food GmbH – Essen-Addrup",
      "type": "Registerbekanntmachung nach dem Umwandlungsgesetz",
      "state": "Niedersachsen",
      "amtsgericht": "Amtsgericht Oldenburg (Oldenburg)",
      "registernummer": "HRB 216804",
      "registerart": "HRB",
      "company_name": "NB Food GmbH",
      "company_seat": "Essen-Addrup",
      "details": "15.10.2024 (Bekanntmachungsdatum)\n\nNiedersachsen Amtsgericht Oldenburg (Oldenburg) HRB 216804\nRegisterbekanntmachung nach dem Umwandlungsgesetz 15.10.2024 (Eintragungsdatum)\n\nNB Food GmbH\nGesellschaft mit beschränkter Haftung\nEssen-Addrup\n\nDen Gläubigern der an der Verschmelzung beteiligten Rechtsträger ist, wenn sie binnen sechs Monaten nach dem Tag, an dem die Eintragung der Verschmelzung in das Register des Sitzes desjenigen Rechtsträgers, dessen Gläubiger sie sind, nach § 19  Abs.  3 UmwG als bekannt gemacht gilt, ihren Anspruch nach Grund und Höhe schriftlich anmelden, Sicherheit zu leisten, soweit sie nicht Befriedigung verlangen können. Dieses Recht steht den Gläubigern jedoch nur zu, wenn sie glaubhaft machen, dass durch die Verschmelzung die Erfüllung der Forderung gefährdet wird."
    },
    {
      "date": "2024-10-15",
      "id": "90420",
      "original_text": "Löschungsankündigung\nHamburg Amtsgericht Hamburg HRB 143470\nNada Technologies UG (haftungsbeschränkt) – Hamburg",
      "type": "Löschungsankündigung",
      "state": "Hamburg",
      "amtsgericht": "Amtsgericht Hamburg",
      "registernummer": "HRB 143470",
      "registerart": "HRB",
      "company_name": "Nada Technologies UG (haftungsbeschränkt)",
      "company_seat": "Hamburg",
      "details": "15.10.2024 (Bekanntmachungsdatum)\n\nHamburg Amtsgericht Hamburg HRB 143470\nLöschungsankündigung\n\nNada Technologies UG (haftungsbeschränkt)\nGesellschaft mit beschränkter Haftung\nHamburg\n\nDas Registergericht beabsichtigt, die im Handelsregister eingetragene Gesellschaft von Amts wegen nach § 394 FamFG zu löschen. Die Frist zur Erhebung eines Widerspruchs gegen die beabsichtigte Löschung wird auf 3 Monate festgesetzt."
    },
    {
      "date": "2024-10-15",
      "id": "90485",
      "original_text": "Registerbekanntmachung nach dem Umwandlungsgesetz\nNordrhein-Westfalen Amtsgericht Düren HRB 5940\nNeapco Europe GmbH – Düren",
      "type": "Registerbekanntmachung nach dem Umwandlungsgesetz",
      "state": "Nordrhein-Westfalen",
      "amtsgericht": "Amtsgericht Düren",
      "registernummer": "HRB 5940",
      "registerart": "HRB",
      "company_name": "Neapco Europe GmbH",
      "company_seat": "Düren",
      "details": "15.10.2024 (Bekanntmachungsdatum)\n\nNordrhein-Westfalen Amtsgericht Düren HRB 5940\nRegisterbekanntmachung nach dem Umwandlungsgesetz 15.10.2024 (Eintragungsdatum)\n\nNeapco Europe GmbH\nGesellschaft mit beschränkter Haftung\nDüren\n\nDen Gläubigern der an der Verschmelzung beteiligten Rechtsträger ist, wenn sie binnen sechs Monaten nach dem Tag, an dem die Eintragung der Verschmelzung in das Register des Sitzes desjenigen Rechtsträgers, dessen Gläubiger sie sind, nach § 19 Absatz 3 UmwG als bekanntgemacht gilt, ihren Anspruch nach Grund und Höhe schriftlich anmelden, Sicherheit zu leisten, soweit sie nicht Befriedigung verlangen können. Dieses Recht steht den Gläubigern jedoch nur zu, wenn sie glaubhaft machen, dass durch die Verschmelzung die Erfüllung ihrer Forderung gefährdet wird."
    },
    {
      "date": "2024-10-15",
      "id": "90519",
      "original_text": "Löschungsankündigung\nHessen Amtsgericht Offenbach am Main HRB 49712\nNeximp UG (haftungsbeschränkt) – Offenbach am Main",
      "type": "Löschungsankündigung",
      "state": "Hessen",
      "amtsgericht": "Amtsgericht Offenbach am Main",
      "registernummer": "HRB 49712",
      "registerart": "HRB",
      "company_name": "Neximp UG (haftungsbeschränkt)",
      "company_seat": "Offenbach am Main",
      "details": "15.10.2024 (Bekanntmachungsdatum)\n\nHessen Amtsgericht Offenbach am Main HRB 49712\nLöschungsankündigung\n\nNeximp UG (haftungsbeschränkt)\nGesellschaft mit beschränkter Haftung\nOffenbach am Main\n\nDas Registergericht beabsichtigt die im Handelsregister eingetragene Gesellschaft von Amts wegen nach § 394 FamFG zu löschen. Die Frist zur Erhebung eines Widerspruchs gegen die beabsichtigte Löschung wird auf 3 Monate festgesetzt."
    },
    {
      "date": "2024-10-15",
      "id": "90416",
      "original_text": "Löschungsankündigung\nHamburg Amtsgericht Hamburg HRB 167866\nNussketiere GmbH – Hamburg",
      "type": "Löschungsankündigung",
      "state": "Hamburg",
      "amtsgericht": "Amtsgericht Hamburg",
      "registernummer": "HRB 167866",
      "registerart": "HRB",
      "company_name": "Nussketiere GmbH",
      "company_seat": "Hamburg",
      "details": "15.10.2024 (Bekanntmachungsdatum)\n\nHamburg Amtsgericht Hamburg HRB 167866\nLöschungsankündigung\n\nNussketiere GmbH\nGesellschaft mit beschränkter Haftung\nHamburg\n\nDas Registergericht beabsichtigt, die im Handelsregister eingetragene Gesellschaft von Amts wegen nach § 394 FamFG zu löschen. Die Frist zur Erhebung eines Widerspruchs gegen die beabsichtigte Löschung wird auf 3 Monate festgesetzt."
    },
    {
      "date": "2024-10-15",
      "id": "90429",
      "original_text": "Löschungsankündigung\nHamburg Amtsgericht Hamburg HRB 182238\nOdesa GmbH – Hamburg",
      "type": "Löschungsankündigung",
      "state": "Hamburg",
      "amtsgericht": "Amtsgericht Hamburg",
      "registernummer": "HRB 182238",
      "registerart": "HRB",
      "company_name": "Odesa GmbH",
      "company_seat": "Hamburg",
      "details": "15.10.2024 (Bekanntmachungsdatum)\n\nHamburg Amtsgericht Hamburg HRB 182238\nLöschungsankündigung\n\nOdesa GmbH\nGesellschaft mit beschränkter Haftung\nHamburg\n\nDas Registergericht beabsichtigt, die im Handelsregister eingetragene Gesellschaft von Amts wegen nach § 394 FamFG zu löschen. Die Frist zur Erhebung eines Widerspruchs gegen die beabsichtigte Löschung wird auf 3 Monate festgesetzt."
    },
    {
      "date": "2024-10-15",
      "id": "90427",
      "original_text": "Löschungsankündigung\nHamburg Amtsgericht Hamburg HRB 174988\nOliser International GmbH – Hamburg",
      "type": "Löschungsankündigung",
      "state": "Hamburg",
      "amtsgericht": "Amtsgericht Hamburg",
      "registernummer": "HRB 174988",
      "registerart": "HRB",
      "company_name": "Oliser International GmbH",
      "company_seat": "Hamburg",
      "details": "15.10.2024 (Bekanntmachungsdatum)\n\nHamburg Amtsgericht Hamburg HRB 174988\nLöschungsankündigung\n\nOliser International GmbH\nGesellschaft mit beschränkter Haftung\nHamburg\n\nDas Registergericht beabsichtigt, die im Handelsregister eingetragene Gesellschaft von Amts wegen nach § 394 FamFG zu löschen. Die Frist zur Erhebung eines Widerspruchs gegen die beabsichtigte Löschung wird auf 3 Monate festgesetzt."
    },
    {
      "date": "2024-10-15",
      "id": "90400",
      "original_text": "Registerbekanntmachung nach dem Umwandlungsgesetz\nBaden-Württemberg Amtsgericht Mannheim HRA 711679\nOliver Brach, e.K. – Mannheim",
      "type": "Registerbekanntmachung nach dem Umwandlungsgesetz",
      "state": "Baden-Württemberg",
      "amtsgericht": "Amtsgericht Mannheim",
      "registernummer": "HRA 711679",
      "registerart": "HRA",
      "company_name": "Oliver Brach, e.K.",
      "company_seat": "Mannheim",
      "details": "15.10.2024 (Bekanntmachungsdatum)\n\nBaden-Württemberg Amtsgericht Mannheim HRA 711679\nRegisterbekanntmachung nach dem Umwandlungsgesetz 15.10.2024 (Eintragungsdatum)\n\nOliver Brach, e.K.\nEinzelkaufmann / Einzelkauffrau\nMannheim\n\nDen Gläubigern der an der Ausgliederung beteiligten Rechtsträger ist, wenn sie binnen sechs Monaten nach dem Tag, an dem die Eintragung der Ausgliederung in das Register des Sitzes desjenigen Rechtsträgers, dessen Gläubiger sie sind, nach § 19 Abs. 3 UmwG als bekanntgemacht gilt, ihren Anspruch nach Grund und Höhe schriftlich anmelden, Sicherheit zu leisten, soweit sie nicht Befriedigung verlangen können. Dieses Recht steht den Gläubigern jedoch nur zu, wenn sie glaubhaft machen, dass durch die Ausgliederung die Erfüllung ihrer Forderung gefährdet wird."
    },
    {
      "date": "2024-10-15",
      "id": "90495",
      "original_text": "Registerbekanntmachung nach dem Umwandlungsgesetz\nNordrhein-Westfalen Amtsgericht Duisburg HRB 30181\nOptipharm Plus GmbH – Oberhausen",
      "type": "Registerbekanntmachung nach dem Umwandlungsgesetz",
      "state": "Nordrhein-Westfalen",
      "amtsgericht": "Amtsgericht Duisburg",
      "registernummer": "HRB 30181",
      "registerart": "HRB",
      "company_name": "Optipharm Plus GmbH",
      "company_seat": "Oberhausen",
      "details": "15.10.2024 (Bekanntmachungsdatum)\n\nNordrhein-Westfalen Amtsgericht Duisburg HRB 30181\nRegisterbekanntmachung nach dem Umwandlungsgesetz 11.10.2024 (Eintragungsdatum)\n\nOptipharm Plus GmbH\nGesellschaft mit beschränkter Haftung\nOberhausen\n\nDen Gläubigern der an der Verschmelzung beteiligten Rechtsträger ist, wenn sie binnen sechs Monaten nach dem Tag, an dem die Eintragung der Verschmelzung in das Register des Sitzes desjenigen Rechtsträgers, dessen Gläubiger sie sind, nach § 19 Absatz 3 UmwG als bekanntgemacht gilt, ihren Anspruch nach Grund und Höhe schriftlich anmelden, Sicherheit zu leisten, soweit sie nicht Befriedigung verlangen können. Dieses Recht steht den Gläubigern jedoch nur zu, wenn sie glaubhaft machen, dass durch die Verschmelzung die Erfüllung ihrer Forderung gefährdet wird."
    },
    {
      "date": "2024-10-15",
      "id": "90373",
      "original_text": "Einreichung neuer Dokumente\nBrandenburg Amtsgericht Neuruppin HRB 1668\nPAE Agrarproduktions- und Verwaltungs-Aktiengesellschaft Putlitz – Putlitz",
      "type": "Einreichung neuer Dokumente",
      "state": "Brandenburg",
      "amtsgericht": "Amtsgericht Neuruppin",
      "registernummer": "HRB 1668",
      "registerart": "HRB",
      "company_name": "PAE Agrarproduktions- und Verwaltungs-Aktiengesellschaft Putlitz",
      "company_seat": "Putlitz",
      "details": "15.10.2024 (Bekanntmachungsdatum)\n\nBrandenburg Amtsgericht Neuruppin HRB 1668\nEinreichung neuer Dokumente\n\nPAE Agrarproduktions- und Verwaltungs-Aktiengesellschaft Putlitz\nAktiengesellschaft\nPutlitz\n\nAls nicht eingetragen wird veröffentlicht: Eine Liste der Mitglieder des Aufsichtsrates wurde zum Handelsregister eingereicht."
    },
    {
      "date": "2024-10-15",
      "id": "90462",
      "original_text": "Löschungsankündigung\nNiedersachsen Amtsgericht Hildesheim HRB 205135\nPHP-Peiner Hausbau- und Projektierungsgesellschaft mbH – Peine",
      "type": "Löschungsankündigung",
      "state": "Niedersachsen",
      "amtsgericht": "Amtsgericht Hildesheim",
      "registernummer": "HRB 205135",
      "registerart": "HRB",
      "company_name": "PHP-Peiner Hausbau- und Projektierungsgesellschaft mbH",
      "company_seat": "Peine",
      "details": "15.10.2024 (Bekanntmachungsdatum)\n\nNiedersachsen Amtsgericht Hildesheim HRB 205135\nLöschungsankündigung\n\nPHP-Peiner Hausbau- und Projektierungsgesellschaft mbH\nGesellschaft mit beschränkter Haftung\nPeine\n\nDas Registergericht beabsichtigt, die Gesellschaft von Amts wegen nach § 394 FamFG zu löschen. Die Frist zur Erhebung eines Widerspruchs ist auf 1 Monat ab dieser Registerbekanntmachung festgesetzt."
    },
    {
      "date": "2024-10-15",
      "id": "90537",
      "original_text": "Löschungsankündigung\nHessen Amtsgericht Offenbach am Main HRB 45731\nPP Haustechnik GmbH – Offenbach am Main",
      "type": "Löschungsankündigung",
      "state": "Hessen",
      "amtsgericht": "Amtsgericht Offenbach am Main",
      "registernummer": "HRB 45731",
      "registerart": "HRB",
      "company_name": "PP Haustechnik GmbH",
      "company_seat": "Offenbach am Main",
      "details": "15.10.2024 (Bekanntmachungsdatum)\n\nHessen Amtsgericht Offenbach am Main HRB 45731\nLöschungsankündigung\n\nPP Haustechnik GmbH\nGesellschaft mit beschränkter Haftung\nOffenbach am Main\n\nDas Registergericht beabsichtigt die im Handelsregister eingetragene Gesellschaft von Amts wegen nach § 394 FamFG zu löschen. Die Frist zur Erhebung eines Widerspruchs gegen die beabsichtigte Löschung wird auf 3 Monate festgesetzt."
    },
    {
      "date": "2024-10-15",
      "id": "90467",
      "original_text": "Löschungsankündigung\nNiedersachsen Amtsgericht Hannover HRB 209549\nPQK Verwaltungs GmbH – Ronnenberg",
      "type": "Löschungsankündigung",
      "state": "Niedersachsen",
      "amtsgericht": "Amtsgericht Hannover",
      "registernummer": "HRB 209549",
      "registerart": "HRB",
      "company_name": "PQK Verwaltungs GmbH",
      "company_seat": "Ronnenberg",
      "details": "15.10.2024 (Bekanntmachungsdatum)\n\nNiedersachsen Amtsgericht Hannover HRB 209549\nLöschungsankündigung\n\nPQK Verwaltungs GmbH\nGesellschaft mit beschränkter Haftung\nRonnenberg\n\nPQK Verwaltungs GmbH, Ronnenberg (Amtsgericht Hannover HRB 209549)\n\nDas Registergericht beabsichtigt, die Gesellschaft von Amts wegen nach § 394 FamFG zu löschen. Die Frist zur Erhebung eines Widerspruchs ist auf 1 Monat ab dieser Registerbekanntmachung festgesetzt."
    },
    {
      "date": "2024-10-15",
      "id": "90481",
      "original_text": "Registerbekanntmachung nach dem Umwandlungsgesetz\nRheinland-Pfalz Amtsgericht Zweibrücken PR 30198\nPeter & Partner mbB Steuerberater – Bad Dürkheim",
      "type": "Registerbekanntmachung nach dem Umwandlungsgesetz",
      "state": "Rheinland-Pfalz",
      "amtsgericht": "Amtsgericht Zweibrücken",
      "registernummer": "PR 30198",
      "registerart": "PR",
      "company_name": "Peter & Partner mbB Steuerberater",
      "company_seat": "Bad Dürkheim",
      "details": "15.10.2024 (Bekanntmachungsdatum)\n\nRheinland-Pfalz Amtsgericht Zweibrücken PR 30198\nRegisterbekanntmachung nach dem Umwandlungsgesetz 14.10.2024 (Eintragungsdatum)\n\nPeter & Partner mbB Steuerberater\nPartnerschaftsgesellschaft\nBad Dürkheim\n\nAls nicht eingetragen wird veröffentlicht: Den Gläubigern der an der Verschmelzung beteiligten Rechtsträger ist, wenn sie binnen sechs Monaten nach dem Tag, an dem die Eintragung der Verschmelzung in das Register des Sitzes desjenigen Rechtsträgers,dessen Gläubiger sie sind, nach § 19 Abs. 3 UmwG als bekannt gemacht gilt, ihren Anspruch nach Grund und Höhe schriftlich anmelden, Sicherheit zu leisten, soweit sie nicht Befriedigung verlangen können. Dieses Recht steht den Gläubigern jedoch nur zu, wenn sie glaubhaft machen, dass durch die Verschmelzung die Erfüllung der Forderung gefährdet wird."
    },
    {
      "date": "2024-10-15",
      "id": "90535",
      "original_text": "Löschungsankündigung\nHessen Amtsgericht Offenbach am Main HRB 42956\nPetrovic Heizung und Sanitär GmbH – Offenbach am Main",
      "type": "Löschungsankündigung",
      "state": "Hessen",
      "amtsgericht": "Amtsgericht Offenbach am Main",
      "registernummer": "HRB 42956",
      "registerart": "HRB",
      "company_name": "Petrovic Heizung und Sanitär GmbH",
      "company_seat": "Offenbach am Main",
      "details": "15.10.2024 (Bekanntmachungsdatum)\n\nHessen Amtsgericht Offenbach am Main HRB 42956\nLöschungsankündigung\n\nPetrovic Heizung und Sanitär GmbH\nGesellschaft mit beschränkter Haftung\nOffenbach am Main\n\nDas Registergericht beabsichtigt die im Handelsregister eingetragene Gesellschaft von Amts wegen nach § 394 FamFG zu löschen. Die Frist zur Erhebung eines Widerspruchs gegen die beabsichtigte Löschung wird auf 3 Monate festgesetzt."
    },
    {
      "date": "2024-10-15",
      "id": "90435",
      "original_text": "Löschungsankündigung\nHamburg Amtsgericht Hamburg HRB 180394\nQuadriga Unternehmensberatung GmbH – Hamburg",
      "type": "Löschungsankündigung",
      "state": "Hamburg",
      "amtsgericht": "Amtsgericht Hamburg",
      "registernummer": "HRB 180394",
      "registerart": "HRB",
      "company_name": "Quadriga Unternehmensberatung GmbH",
      "company_seat": "Hamburg",
      "details": "15.10.2024 (Bekanntmachungsdatum)\n\nHamburg Amtsgericht Hamburg HRB 180394\nLöschungsankündigung\n\nQuadriga Unternehmensberatung GmbH\nGesellschaft mit beschränkter Haftung\nHamburg\n\nDas Registergericht beabsichtigt, die im Handelsregister eingetragene Gesellschaft von Amts wegen nach § 394 FamFG zu löschen. Die Frist zur Erhebung eines Widerspruchs gegen die beabsichtigte Löschung wird auf 3 Monate festgesetzt."
    },
    {
      "date": "2024-10-15",
      "id": "90374",
      "original_text": "Löschungsankündigung\nBrandenburg Amtsgericht Potsdam HRB 34168\nR&R Hausverwaltung GmbH – Brandenburg an der Havel",
      "type": "Löschungsankündigung",
      "state": "Brandenburg",
      "amtsgericht": "Amtsgericht Potsdam",
      "registernummer": "HRB 34168",
      "registerart": "HRB",
      "company_name": "R&R Hausverwaltung GmbH",
      "company_seat": "Brandenburg an der Havel",
      "details": "15.10.2024 (Bekanntmachungsdatum)\n\nBrandenburg Amtsgericht Potsdam HRB 34168\nLöschungsankündigung\n\nR&R Hausverwaltung GmbH\nGesellschaft mit beschränkter Haftung\nBrandenburg an der Havel\n\nBei der nachstehenden Gesellschaft wird das Amtslöschungsverfahren gemäß § 394 FamFG eingeleitet. Widerspruchsfrist: 8 Wochen"
    },
    {
      "date": "2024-10-15",
      "id": "90394",
      "original_text": "Einreichung neuer Dokumente\nSachsen-Anhalt Amtsgericht Stendal HRB 200937\nRES Recycling und Entsorgungs-Service Sangerhausen GmbH – Sangerhausen",
      "type": "Einreichung neuer Dokumente",
      "state": "Sachsen-Anhalt",
      "amtsgericht": "Amtsgericht Stendal",
      "registernummer": "HRB 200937",
      "registerart": "HRB",
      "company_name": "RES Recycling und Entsorgungs-Service Sangerhausen GmbH",
      "company_seat": "Sangerhausen",
      "details": "15.10.2024 (Bekanntmachungsdatum)\n\nSachsen-Anhalt Amtsgericht Stendal HRB 200937\nEinreichung neuer Dokumente\n\nRES Recycling und Entsorgungs-Service Sangerhausen GmbH\nGesellschaft mit beschränkter Haftung\nSangerhausen\n\nEine Liste der Mitglieder des Aufsichtsrates wurde zum Handelsregister eingereicht."
    },
    {
      "date": "2024-10-15",
      "id": "90366",
      "original_text": "Sonstige Registerbekanntmachung\nBayern Amtsgericht München HRB 117628\nRISICOM Rückversicherung Aktiengesellschaft – Grünwald",
      "type": "Sonstige Registerbekanntmachung",
      "state": "Bayern",
      "amtsgericht": "Amtsgericht München",
      "registernummer": "HRB 117628",
      "registerart": "HRB",
      "company_name": "RISICOM Rückversicherung Aktiengesellschaft",
      "company_seat": "Grünwald",
      "details": "15.10.2024 (Bekanntmachungsdatum)\n\nBayern Amtsgericht München HRB 117628\nSonstige Registerbekanntmachung 14.10.2024 (Eintragungsdatum)\n\nRISICOM Rückversicherung Aktiengesellschaft\nAktiengesellschaft\nGrünwald\n\nDem Amtsgericht München -Registergericht- ist eine Liste der Mitglieder des Aufsichtsrats eingereicht worden, § 106 AktG."
    },
    {
      "date": "2024-10-15",
      "id": "90415",
      "original_text": "Löschungsankündigung\nHamburg Amtsgericht Hamburg HRB 158849\nRaptis Electric GmbH – Hamburg",
      "type": "Löschungsankündigung",
      "state": "Hamburg",
      "amtsgericht": "Amtsgericht Hamburg",
      "registernummer": "HRB 158849",
      "registerart": "HRB",
      "company_name": "Raptis Electric GmbH",
      "company_seat": "Hamburg",
      "details": "15.10.2024 (Bekanntmachungsdatum)\n\nHamburg Amtsgericht Hamburg HRB 158849\nLöschungsankündigung\n\nRaptis Electric GmbH\nGesellschaft mit beschränkter Haftung\nHamburg\n\nDas Registergericht beabsichtigt, die im Handelsregister eingetragene Gesellschaft von Amts wegen nach § 394 FamFG zu löschen. Die Frist zur Erhebung eines Widerspruchs gegen die beabsichtigte Löschung wird auf 3 Monate festgesetzt."
    },
    {
      "date": "2024-10-15",
      "id": "90361",
      "original_text": "Einreichung neuer Dokumente\nBayern Amtsgericht München HRB 231657\nRay Sono AG – München",
      "type": "Einreichung neuer Dokumente",
      "state": "Bayern",
      "amtsgericht": "Amtsgericht München",
      "registernummer": "HRB 231657",
      "registerart": "HRB",
      "company_name": "Ray Sono AG",
      "company_seat": "München",
      "details": "15.10.2024 (Bekanntmachungsdatum)\n\nBayern Amtsgericht München HRB 231657\nEinreichung neuer Dokumente\n\nRay Sono AG\nAktiengesellschaft\nMünchen\n\nDem Amtsgericht München -Registergericht- ist eine Liste der Mitglieder des Aufsichtsrats eingereicht worden, § 106 AktG."
    },
    {
      "date": "2024-10-15",
      "id": "90514",
      "original_text": "Löschungsankündigung\nHessen Amtsgericht Offenbach am Main HRB 54264\nRe-Pro Bau UG (haftungsbeschränkt) – Offenbach am Main",
      "type": "Löschungsankündigung",
      "state": "Hessen",
      "amtsgericht": "Amtsgericht Offenbach am Main",
      "registernummer": "HRB 54264",
      "registerart": "HRB",
      "company_name": "Re-Pro Bau UG (haftungsbeschränkt)",
      "company_seat": "Offenbach am Main",
      "details": "15.10.2024 (Bekanntmachungsdatum)\n\nHessen Amtsgericht Offenbach am Main HRB 54264\nLöschungsankündigung\n\nRe-Pro Bau UG (haftungsbeschränkt)\nGesellschaft mit beschränkter Haftung\nOffenbach am Main\n\nDas Registergericht beabsichtigt die im Handelsregister eingetragene Gesellschaft von Amts wegen nach § 394 FamFG zu löschen. Die Frist zur Erhebung eines Widerspruchs gegen die beabsichtigte Löschung wird auf 3 Monate festgesetzt."
    },
    {
      "date": "2024-10-15",
      "id": "90353",
      "original_text": "Löschungsankündigung\nBayern Amtsgericht Bayreuth VR 200703\nRescue Hands e. V. – Himmelkron",
      "type": "Löschungsankündigung",
      "state": "Bayern",
      "amtsgericht": "Amtsgericht Bayreuth",
      "registernummer": "VR 200703",
      "registerart": "VR",
      "company_name": "Rescue Hands e. V.",
      "company_seat": "Himmelkron",
      "details": "15.10.2024 (Bekanntmachungsdatum)\n\nBayern Amtsgericht Bayreuth VR 200703\nLöschungsankündigung\n\nRescue Hands e. V.\neingetragener Verein\nHimmelkron\n\nDas Registergericht beabsichtigt, den im Vereinsregister eingetragenen Verein von Amts wegen nach 395 FamFG zu löschen. Die Frist zur Erhebung eines Widerspruchs ist auf einen Monat festgesetzt."
    },
    {
      "date": "2024-10-15",
      "id": "90518",
      "original_text": "Registerbekanntmachung nach dem Umwandlungsgesetz\nHessen Amtsgericht Offenbach am Main HRB 56397\nRoSch Kälte- und Klimatechnik GmbH – Neu-Isenburg",
      "type": "Registerbekanntmachung nach dem Umwandlungsgesetz",
      "state": "Hessen",
      "amtsgericht": "Amtsgericht Offenbach am Main",
      "registernummer": "HRB 56397",
      "registerart": "HRB",
      "company_name": "RoSch Kälte- und Klimatechnik GmbH",
      "company_seat": "Neu-Isenburg",
      "details": "15.10.2024 (Bekanntmachungsdatum)\n\nHessen Amtsgericht Offenbach am Main HRB 56397\nRegisterbekanntmachung nach dem Umwandlungsgesetz 15.10.2024 (Eintragungsdatum)\n\nRoSch Kälte- und Klimatechnik GmbH\nGesellschaft mit beschränkter Haftung\nNeu-Isenburg\n\nDen Gläubigern der an der Ausgliederung beteiligten Rechtsträger ist, wenn sie binnen sechs Monaten nach dem Tag, an dem die Eintragung der Ausgliederung in das Register des Sitzes desjenigen Rechtsträgers, dessen Gläubiger sie sind, nach §§ 125, 19 Absatz 3 UmwG bekannt gemacht worden ist, ihren Anspruch nach Grund und Höhe schriftlich anmelden, Sicherheit zu leisten, soweit sie nicht Befriedigung verlangen können. Dieses Recht steht den Gläubigern jedoch nur zu, wenn sie glaubhaft machen, dass durch die Ausgliederung die Erfüllung ihrer Forderung gefährdet wird."
    },
    {
      "date": "2024-10-15",
      "id": "90387",
      "original_text": "Registerbekanntmachung nach dem Umwandlungsgesetz\nBaden-Württemberg Amtsgericht Stuttgart HRB 14000\nRobert Bosch Gesellschaft mit beschränkter Haftung – Stuttgart",
      "type": "Registerbekanntmachung nach dem Umwandlungsgesetz",
      "state": "Baden-Württemberg",
      "amtsgericht": "Amtsgericht Stuttgart",
      "registernummer": "HRB 14000",
      "registerart": "HRB",
      "company_name": "Robert Bosch Gesellschaft mit beschränkter Haftung",
      "company_seat": "Stuttgart",
      "details": "15.10.2024 (Bekanntmachungsdatum)\n\nBaden-Württemberg Amtsgericht Stuttgart HRB 14000\nRegisterbekanntmachung nach dem Umwandlungsgesetz 15.10.2024 (Eintragungsdatum)\n\nRobert Bosch Gesellschaft mit beschränkter Haftung\nGesellschaft mit beschränkter Haftung\nStuttgart\n\nDen Gläubigern der an der Verschmelzung beteiligten Rechtsträger ist, wenn sie binnen sechs Monaten nach dem Tag, an dem die Eintragung der Verschmelzung in das Register des Sitzes desjenigen Rechtsträgers, dessen Gläubiger sie sind, nach § 19 Abs. 3 UmwG als bekanntgemacht gilt, ihren Anspruch nach Grund und Höhe schriftlich anmelden, Sicherheit zu leisten, soweit sie nicht Befriedigung verlangen können. Dieses Recht steht den Gläubigern jedoch nur zu, wenn sie glaubhaft machen, dass durch die Verschmelzung die Erfüllung ihrer Forderung gefährdet wird."
    },
    {
      "date": "2024-10-15",
      "id": "90540",
      "original_text": "Registerbekanntmachung nach dem Umwandlungsgesetz\nHessen Amtsgericht Offenbach am Main HRA 43347\nRobin Schrankel e. K. – Neu-Isenburg",
      "type": "Registerbekanntmachung nach dem Umwandlungsgesetz",
      "state": "Hessen",
      "amtsgericht": "Amtsgericht Offenbach am Main",
      "registernummer": "HRA 43347",
      "registerart": "HRA",
      "company_name": "Robin Schrankel e. K.",
      "company_seat": "Neu-Isenburg",
      "details": "15.10.2024 (Bekanntmachungsdatum)\n\nHessen Amtsgericht Offenbach am Main HRA 43347\nRegisterbekanntmachung nach dem Umwandlungsgesetz 15.10.2024 (Eintragungsdatum)\n\nRobin Schrankel e. K.\nEinzelkaufmann / Einzelkauffrau\nNeu-Isenburg\n\nDen Gläubigern der an der Ausgliederung beteiligten Rechtsträger ist, wenn sie binnen sechs Monaten nach dem Tag, an dem die Eintragung der Ausgliederung in das Register des Sitzes desjenigen Rechtsträgers, dessen Gläubiger sie sind, nach §§ 125, 19 Absatz 3 UmwG bekannt gemacht worden ist, ihren Anspruch nach Grund und Höhe schriftlich anmelden, Sicherheit zu leisten, soweit sie nicht Befriedigung verlangen können. Dieses Recht steht den Gläubigern jedoch nur zu, wenn sie glaubhaft machen, dass durch die Ausgliederung die Erfüllung ihrer Forderung gefährdet wird."
    },
    {
      "date": "2024-10-15",
      "id": "90527",
      "original_text": "Löschungsankündigung\nHessen Amtsgericht Offenbach am Main HRB 10464\nRohland & more Mediengesellschaft mbH – Offenbach am Main",
      "type": "Löschungsankündigung",
      "state": "Hessen",
      "amtsgericht": "Amtsgericht Offenbach am Main",
      "registernummer": "HRB 10464",
      "registerart": "HRB",
      "company_name": "Rohland & more Mediengesellschaft mbH",
      "company_seat": "Offenbach am Main",
      "details": "15.10.2024 (Bekanntmachungsdatum)\n\nHessen Amtsgericht Offenbach am Main HRB 10464\nLöschungsankündigung\n\nRohland & more Mediengesellschaft mbH\nGesellschaft mit beschränkter Haftung\nOffenbach am Main\n\nDas Registergericht beabsichtigt die im Handelsregister eingetragene Gesellschaft von Amts wegen nach § 394 FamFG zu löschen. Die Frist zur Erhebung eines Widerspruchs gegen die beabsichtigte Löschung wird auf 3 Monate festgesetzt."
    },
    {
      "date": "2024-10-15",
      "id": "90504",
      "original_text": "Registerbekanntmachung nach dem Umwandlungsgesetz\nNordrhein-Westfalen Amtsgericht Münster HRA 5421\nRotthowe Immobilien-Verwaltungs GmbH & Co. KG – Münster",
      "type": "Registerbekanntmachung nach dem Umwandlungsgesetz",
      "state": "Nordrhein-Westfalen",
      "amtsgericht": "Amtsgericht Münster",
      "registernummer": "HRA 5421",
      "registerart": "HRA",
      "company_name": "Rotthowe Immobilien-Verwaltungs GmbH & Co. KG",
      "company_seat": "Münster",
      "details": "15.10.2024 (Bekanntmachungsdatum)\n\nNordrhein-Westfalen Amtsgericht Münster HRA 5421\nRegisterbekanntmachung nach dem Umwandlungsgesetz 15.10.2024 (Eintragungsdatum)\n\nRotthowe Immobilien-Verwaltungs GmbH & Co. KG\nKommanditgesellschaft\nMünster\n\nDen Gläubigern der an der formwechselnden Umwandlung beteiligten Rechtsträger ist, wenn sie binnen sechs Monaten nach dem Tag, an dem die Eintragung der formwechselnden Umwandlung in das Register des Sitzes desjenigen Rechtsträgers, dessen Gläubiger sie sind, nach § 19 Absatz 3 UmwG als bekanntgemacht gilt, ihren Anspruch nach Grund und Höhe schriftlich anmelden, Sicherheit zu leisten, soweit sie nicht Befriedigung verlangen können. Dieses Recht steht den Gläubigern jedoch nur zu, wenn sie glaubhaft machen, dass durch die formwechselnden Umwandlung die Erfüllung ihrer Forderung gefährdet wird."
    },
    {
      "date": "2024-10-15",
      "id": "90335",
      "original_text": "Registerbekanntmachung nach dem Umwandlungsgesetz\nBayern Amtsgericht Fürth HRB 14862\nRusso Baumanagement GmbH – Cadolzburg",
      "type": "Registerbekanntmachung nach dem Umwandlungsgesetz",
      "state": "Bayern",
      "amtsgericht": "Amtsgericht Fürth",
      "registernummer": "HRB 14862",
      "registerart": "HRB",
      "company_name": "Russo Baumanagement GmbH",
      "company_seat": "Cadolzburg",
      "details": "15.10.2024 (Bekanntmachungsdatum)\n\nBayern Amtsgericht Fürth HRB 14862\nRegisterbekanntmachung nach dem Umwandlungsgesetz 14.10.2024 (Eintragungsdatum)\n\nRusso Baumanagement GmbH\nGesellschaft mit beschränkter Haftung\nCadolzburg\n\nDen Gläubigern der an der Verschmelzung beteiligten Rechtsträger ist, wenn sie binnen sechs Monaten nach dem Tag, an dem die Eintragung der Verschmelzung in das Register des Sitzes desjenigen Rechtsträgers, dessen Gläubiger sie sind, nach § 19 Abs. 3 UmwG als bekannt gemacht gilt, ihren Anspruch nach Grund und Höhe schriftlich anmelden, Sicherheit zu leisten, soweit sie nicht Befriedigung verlangen können. Dieses Recht steht den Gläubigern jedoch nur zu, wenn sie glaubhaft machen, dass durch die Verschmelzung die Erfüllung ihrer Forderung gefährdet wird."
    },
    {
      "date": "2024-10-15",
      "id": "90344",
      "original_text": "Registerbekanntmachung nach dem Umwandlungsgesetz\nBayern Amtsgericht Fürth HRB 16100\nRusso Verwaltungs-GmbH – Cadolzburg",
      "type": "Registerbekanntmachung nach dem Umwandlungsgesetz",
      "state": "Bayern",
      "amtsgericht": "Amtsgericht Fürth",
      "registernummer": "HRB 16100",
      "registerart": "HRB",
      "company_name": "Russo Verwaltungs-GmbH",
      "company_seat": "Cadolzburg",
      "details": "15.10.2024 (Bekanntmachungsdatum)\n\nBayern Amtsgericht Fürth HRB 16100\nRegisterbekanntmachung nach dem Umwandlungsgesetz 14.10.2024 (Eintragungsdatum)\n\nRusso Verwaltungs-GmbH\nGesellschaft mit beschränkter Haftung\nCadolzburg\n\nDen Gläubigern der an der Verschmelzung beteiligten Rechtsträger ist, wenn sie binnen sechs Monaten nach dem Tag, an dem die Eintragung der Verschmelzung in das Register des Sitzes desjenigen Rechtsträgers, dessen Gläubiger sie sind, nach § 19 Abs. 3 UmwG als bekannt gemacht gilt, ihren Anspruch nach Grund und Höhe schriftlich anmelden, Sicherheit zu leisten, soweit sie nicht Befriedigung verlangen können. Dieses Recht steht den Gläubigern jedoch nur zu, wenn sie glaubhaft machen, dass durch die Verschmelzung die Erfüllung ihrer Forderung gefährdet wird."
    },
    {
      "date": "2024-10-15",
      "id": "90410",
      "original_text": "Einreichung neuer Dokumente\nBaden-Württemberg Amtsgericht Mannheim HRB 503663\nRutronik Elektronische Bauelemente GmbH – Ispringen",
      "type": "Einreichung neuer Dokumente",
      "state": "Baden-Württemberg",
      "amtsgericht": "Amtsgericht Mannheim",
      "registernummer": "HRB 503663",
      "registerart": "HRB",
      "company_name": "Rutronik Elektronische Bauelemente GmbH",
      "company_seat": "Ispringen",
      "details": "15.10.2024 (Bekanntmachungsdatum)\n\nBaden-Württemberg Amtsgericht Mannheim HRB 503663\nEinreichung neuer Dokumente 15.10.2024 (Eintragungsdatum)\n\nRutronik Elektronische Bauelemente GmbH\nGesellschaft mit beschränkter Haftung\nIspringen\n\nDie Gesellschaft hat am 14.10.2024 die Liste über die Zusammensetzung des Aufsichtsrats zum Handelsregister eingereicht."
    },
    {
      "date": "2024-10-15",
      "id": "90422",
      "original_text": "Löschungsankündigung\nHamburg Amtsgericht Hamburg HRB 163476\nSKY-Nord Lagerlogistik GmbH – Hamburg",
      "type": "Löschungsankündigung",
      "state": "Hamburg",
      "amtsgericht": "Amtsgericht Hamburg",
      "registernummer": "HRB 163476",
      "registerart": "HRB",
      "company_name": "SKY-Nord Lagerlogistik GmbH",
      "company_seat": "Hamburg",
      "details": "15.10.2024 (Bekanntmachungsdatum)\n\nHamburg Amtsgericht Hamburg HRB 163476\nLöschungsankündigung\n\nSKY-Nord Lagerlogistik GmbH\nGesellschaft mit beschränkter Haftung\nHamburg\n\nDas Registergericht beabsichtigt, die im Handelsregister eingetragene Gesellschaft von Amts wegen nach § 394 FamFG zu löschen. Die Frist zur Erhebung eines Widerspruchs gegen die beabsichtigte Löschung wird auf 3 Monate festgesetzt."
    },
    {
      "date": "2024-10-15",
      "id": "90342",
      "original_text": "Löschungsankündigung\nBayern Amtsgericht Ingolstadt HRB 10744\nSLG Transport GmbH – Ingolstadt",
      "type": "Löschungsankündigung",
      "state": "Bayern",
      "amtsgericht": "Amtsgericht Ingolstadt",
      "registernummer": "HRB 10744",
      "registerart": "HRB",
      "company_name": "SLG Transport GmbH",
      "company_seat": "Ingolstadt",
      "details": "15.10.2024 (Bekanntmachungsdatum)\n\nBayern Amtsgericht Ingolstadt HRB 10744\nLöschungsankündigung\n\nSLG Transport GmbH\nGesellschaft mit beschränkter Haftung\nIngolstadt\n\nDas Registergericht beabsichtigt, die im Handelsregister eingetragene Gesellschaft wegen Vermögenslosigkeit von Amts wegen nach § 394 FamFG zu löschen. Die Frist zur Erhebung eines Widerspruchs ist auf einen Monat festgesetzt."
    },
    {
      "date": "2024-10-15",
      "id": "90499",
      "original_text": "Registerbekanntmachung nach dem Umwandlungsgesetz\nNordrhein-Westfalen Amtsgericht Düsseldorf HRB 100863\nSMP GmbH – Düsseldorf",
      "type": "Registerbekanntmachung nach dem Umwandlungsgesetz",
      "state": "Nordrhein-Westfalen",
      "amtsgericht": "Amtsgericht Düsseldorf",
      "registernummer": "HRB 100863",
      "registerart": "HRB",
      "company_name": "SMP GmbH",
      "company_seat": "Düsseldorf",
      "details": "15.10.2024 (Bekanntmachungsdatum)\n\nNordrhein-Westfalen Amtsgericht Düsseldorf HRB 100863\nRegisterbekanntmachung nach dem Umwandlungsgesetz 15.10.2024 (Eintragungsdatum)\n\nSMP GmbH\nGesellschaft mit beschränkter Haftung\nDüsseldorf\n\nDen Gläubigern der an der Verschmelzung beteiligten Rechtsträger ist, wenn sie binnen sechs Monaten nach dem Tag, an dem die Eintragung der Verschmelzung in das Register des Sitzes desjenigen Rechtsträgers, dessen Gläubiger sie sind, nach § 19 Absatz 3 UmwG als bekanntgemacht gilt, ihren Anspruch nach Grund und Höhe schriftlich anmelden, Sicherheit zu leisten, soweit sie nicht Befriedigung verlangen können. Dieses Recht steht den Gläubigern jedoch nur zu, wenn sie glaubhaft machen, dass durch die Verschmelzung die Erfüllung ihrer Forderung gefährdet wird."
    },
    {
      "date": "2024-10-15",
      "id": "90521",
      "original_text": "Registerbekanntmachung nach dem Umwandlungsgesetz\nHessen Amtsgericht Gießen HRB 5565\nSTI Grebenhain Display + Verpackung GmbH – Lauterbach (Hessen)",
      "type": "Registerbekanntmachung nach dem Umwandlungsgesetz",
      "state": "Hessen",
      "amtsgericht": "Amtsgericht Gießen",
      "registernummer": "HRB 5565",
      "registerart": "HRB",
      "company_name": "STI Grebenhain Display + Verpackung GmbH",
      "company_seat": "Lauterbach (Hessen)",
      "details": "15.10.2024 (Bekanntmachungsdatum)\n\nHessen Amtsgericht Gießen HRB 5565\nRegisterbekanntmachung nach dem Umwandlungsgesetz 15.10.2024 (Eintragungsdatum)\n\nSTI Grebenhain Display + Verpackung GmbH\nGesellschaft mit beschränkter Haftung\nLauterbach (Hessen)\n\nDen Gläubigern der an der Verschmelzung beteiligten Rechtsträger ist, wenn sie binnen sechs Monaten nach dem Tag, an dem die Eintragung der Verschmelzung in das Register des Sitzes desjenigen Rechtsträgers, dessen Gläubiger sie sind, nach § 19 Absatz 3 UmwG bekannt gemacht worden ist, ihren Anspruch nach Grund und Höhe schriftlich anmelden, Sicherheit zu leisten, soweit sie nicht Befriedigung verlangen können. Dieses Recht steht den Gläubigern jedoch nur zu, wenn sie glaubhaft machen, dass durch die Verschmelzung die Erfüllung ihrer Forderung gefährdet wird."
    },
    {
      "date": "2024-10-15",
      "id": "90516",
      "original_text": "Registerbekanntmachung nach dem Umwandlungsgesetz\nHessen Amtsgericht Gießen HRB 5564\nSTI Lauterbach Verpackung GmbH – Lauterbach (Hessen)",
      "type": "Registerbekanntmachung nach dem Umwandlungsgesetz",
      "state": "Hessen",
      "amtsgericht": "Amtsgericht Gießen",
      "registernummer": "HRB 5564",
      "registerart": "HRB",
      "company_name": "STI Lauterbach Verpackung GmbH",
      "company_seat": "Lauterbach (Hessen)",
      "details": "15.10.2024 (Bekanntmachungsdatum)\n\nHessen Amtsgericht Gießen HRB 5564\nRegisterbekanntmachung nach dem Umwandlungsgesetz 15.10.2024 (Eintragungsdatum)\n\nSTI Lauterbach Verpackung GmbH\nGesellschaft mit beschränkter Haftung\nLauterbach (Hessen)\n\nDen Gläubigern der an der Verschmelzung beteiligten Rechtsträger ist, wenn sie binnen sechs Monaten nach dem Tag, an dem die Eintragung der Verschmelzung in das Register des Sitzes desjenigen Rechtsträgers, dessen Gläubiger sie sind, nach § 19 Absatz 3 UmwG bekannt gemacht worden ist, ihren Anspruch nach Grund und Höhe schriftlich anmelden, Sicherheit zu leisten, soweit sie nicht Befriedigung verlangen können. Dieses Recht steht den Gläubigern jedoch nur zu, wenn sie glaubhaft machen, dass durch die Verschmelzung die Erfüllung ihrer Forderung gefährdet wird."
    },
    {
      "date": "2024-10-15",
      "id": "90522",
      "original_text": "Registerbekanntmachung nach dem Umwandlungsgesetz\nHessen Amtsgericht Gießen HRB 5564\nSTI Lauterbach Verpackung GmbH – Lauterbach (Hessen)",
      "type": "Registerbekanntmachung nach dem Umwandlungsgesetz",
      "state": "Hessen",
      "amtsgericht": "Amtsgericht Gießen",
      "registernummer": "HRB 5564",
      "registerart": "HRB",
      "company_name": "STI Lauterbach Verpackung GmbH",
      "company_seat": "Lauterbach (Hessen)",
      "details": "15.10.2024 (Bekanntmachungsdatum)\n\nHessen Amtsgericht Gießen HRB 5564\nRegisterbekanntmachung nach dem Umwandlungsgesetz 15.10.2024 (Eintragungsdatum)\n\nSTI Lauterbach Verpackung GmbH\nGesellschaft mit beschränkter Haftung\nLauterbach (Hessen)\n\nDen Gläubigern der an der Verschmelzung beteiligten Rechtsträger ist, wenn sie binnen sechs Monaten nach dem Tag, an dem die Eintragung der Verschmelzung in das Register des Sitzes desjenigen Rechtsträgers, dessen Gläubiger sie sind, nach § 19 Absatz 3 UmwG bekannt gemacht worden ist, ihren Anspruch nach Grund und Höhe schriftlich anmelden, Sicherheit zu leisten, soweit sie nicht Befriedigung verlangen können. Dieses Recht steht den Gläubigern jedoch nur zu, wenn sie glaubhaft machen, dass durch die Verschmelzung die Erfüllung ihrer Forderung gefährdet wird."
    },
    {
      "date": "2024-10-15",
      "id": "90530",
      "original_text": "Registerbekanntmachung nach dem Umwandlungsgesetz\nHessen Amtsgericht Gießen HRB 9770\nSTI POS Solutions GmbH – Lauterbach (Hessen)",
      "type": "Registerbekanntmachung nach dem Umwandlungsgesetz",
      "state": "Hessen",
      "amtsgericht": "Amtsgericht Gießen",
      "registernummer": "HRB 9770",
      "registerart": "HRB",
      "company_name": "STI POS Solutions GmbH",
      "company_seat": "Lauterbach (Hessen)",
      "details": "15.10.2024 (Bekanntmachungsdatum)\n\nHessen Amtsgericht Gießen HRB 9770\nRegisterbekanntmachung nach dem Umwandlungsgesetz 15.10.2024 (Eintragungsdatum)\n\nSTI POS Solutions GmbH\nGesellschaft mit beschränkter Haftung\nLauterbach (Hessen)\n\nDen Gläubigern der an der Verschmelzung beteiligten Rechtsträger ist, wenn sie binnen sechs Monaten nach dem Tag, an dem die Eintragung der Verschmelzung in das Register des Sitzes desjenigen Rechtsträgers, dessen Gläubiger sie sind, nach § 19 Absatz 3 UmwG bekannt gemacht worden ist, ihren Anspruch nach Grund und Höhe schriftlich anmelden, Sicherheit zu leisten, soweit sie nicht Befriedigung verlangen können. Dieses Recht steht den Gläubigern jedoch nur zu, wenn sie glaubhaft machen, dass durch die Verschmelzung die Erfüllung ihrer Forderung gefährdet wird."
    },
    {
      "date": "2024-10-15",
      "id": "90515",
      "original_text": "Löschungsankündigung\nHessen Amtsgericht Offenbach am Main HRB 45574\nSZABO & RUFF Sanitäts- und Gesundheitshaus für Intensiv- und Beatmungspflege GmbH – Offenbach am Main",
      "type": "Löschungsankündigung",
      "state": "Hessen",
      "amtsgericht": "Amtsgericht Offenbach am Main",
      "registernummer": "HRB 45574",
      "registerart": "HRB",
      "company_name": "SZABO & RUFF Sanitäts- und Gesundheitshaus für Intensiv- und Beatmungspflege GmbH",
      "company_seat": "Offenbach am Main",
      "details": "15.10.2024 (Bekanntmachungsdatum)\n\nHessen Amtsgericht Offenbach am Main HRB 45574\nLöschungsankündigung\n\nSZABO & RUFF Sanitäts- und Gesundheitshaus für Intensiv- und Beatmungspflege GmbH\nGesellschaft mit beschränkter Haftung\nOffenbach am Main\n\nDas Registergericht beabsichtigt die im Handelsregister eingetragene Gesellschaft von Amts wegen nach § 394 FamFG zu löschen. Die Frist zur Erhebung eines Widerspruchs gegen die beabsichtigte Löschung wird auf 3 Monate festgesetzt."
    },
    {
      "date": "2024-10-15",
      "id": "90372",
      "original_text": "Einreichung neuer Dokumente\nSaarland Amtsgericht Saarbrücken HRB 15250\nSaarländische Nahverkehrs-Service GmbH, abgekürzt: SNS GmbH – Völklingen",
      "type": "Einreichung neuer Dokumente",
      "state": "Saarland",
      "amtsgericht": "Amtsgericht Saarbrücken",
      "registernummer": "HRB 15250",
      "registerart": "HRB",
      "company_name": "Saarländische Nahverkehrs-Service GmbH, abgekürzt: SNS GmbH",
      "company_seat": "Völklingen",
      "details": "15.10.2024 (Bekanntmachungsdatum)\n\nSaarland Amtsgericht Saarbrücken HRB 15250\nEinreichung neuer Dokumente\n\nSaarländische Nahverkehrs-Service GmbH, abgekürzt: SNS GmbH\nGesellschaft mit beschränkter Haftung\nVölklingen\n\nDie Geschäftsführung der Gesellschaft hat eine Liste der Mitglieder des Aufsichtsrats zum Handelsregister eingereicht (§ 52 Abs. 3 Satz 2 GmbHG)."
    },
    {
      "date": "2024-10-15",
      "id": "90468",
      "original_text": "Registerbekanntmachung nach dem Umwandlungsgesetz\nNiedersachsen Amtsgericht Osnabrück HRA 208746\nSachs Trockenbau GmbH & Co. KG – Schüttorf",
      "type": "Registerbekanntmachung nach dem Umwandlungsgesetz",
      "state": "Niedersachsen",
      "amtsgericht": "Amtsgericht Osnabrück",
      "registernummer": "HRA 208746",
      "registerart": "HRA",
      "company_name": "Sachs Trockenbau GmbH & Co. KG",
      "company_seat": "Schüttorf",
      "details": "15.10.2024 (Bekanntmachungsdatum)\n\nNiedersachsen Amtsgericht Osnabrück HRA 208746\nRegisterbekanntmachung nach dem Umwandlungsgesetz 15.10.2024 (Eintragungsdatum)\n\nSachs Trockenbau GmbH & Co. KG\nKommanditgesellschaft\nSchüttorf\n\nDen Gläubigern der an der Ausgliederung beteiligten Rechtsträger ist, wenn sie binnen sechs Monaten nach dem Tag, an dem die Eintragung der Ausgliederung in das Register des Sitzes desjenigen Rechtsträgers, dessen Gläubiger sie sind, nach § 19 Abs. 3 UmwG als bekannt gemacht gilt, ihren Anspruch nach Grund und Höhe schriftlich anmelden, Sicherheit zu leisten, soweit sie nicht Befriedigung verlangen können. Dieses Recht steht den Gläubigern jedoch nur zu, wenn sie glaubhaft machen, dass durch die Ausgliederung die Erfüllung der Forderung gefährdet wird."
    },
    {
      "date": "2024-10-15",
      "id": "90474",
      "original_text": "Löschungsankündigung\nBremen Amtsgericht Bremen HRB 23167\nScale Ventures GmbH – Bremen",
      "type": "Löschungsankündigung",
      "state": "Bremen",
      "amtsgericht": "Amtsgericht Bremen",
      "registernummer": "HRB 23167",
      "registerart": "HRB",
      "company_name": "Scale Ventures GmbH",
      "company_seat": "Bremen",
      "details": "15.10.2024 (Bekanntmachungsdatum)\n\nBremen Amtsgericht Bremen HRB 23167\nLöschungsankündigung\n\nScale Ventures GmbH\nGesellschaft mit beschränkter Haftung\nBremen\n\nEs ist beabsichtigt die im Handelsregister eingetragene Gesellschaft von Amts wegen gemäß § 394 FamFG zu löschen. Gegen die Löschung kann beim AG Bremen schriftlich oder zu Protokoll der Geschäftsstelle Widerspruch eingelegt werden. Widerspruchsfrist 4 Wochen."
    },
    {
      "date": "2024-10-15",
      "id": "90479",
      "original_text": "Registerbekanntmachung nach dem Umwandlungsgesetz\nRheinland-Pfalz Amtsgericht Zweibrücken PR 30149\nSchäfer & Peter PartG mbB Steuerberater – Bad Dürkheim",
      "type": "Registerbekanntmachung nach dem Umwandlungsgesetz",
      "state": "Rheinland-Pfalz",
      "amtsgericht": "Amtsgericht Zweibrücken",
      "registernummer": "PR 30149",
      "registerart": "PR",
      "company_name": "Schäfer & Peter PartG mbB Steuerberater",
      "company_seat": "Bad Dürkheim",
      "details": "15.10.2024 (Bekanntmachungsdatum)\n\nRheinland-Pfalz Amtsgericht Zweibrücken PR 30149\nRegisterbekanntmachung nach dem Umwandlungsgesetz 14.10.2024 (Eintragungsdatum)\n\nSchäfer & Peter PartG mbB Steuerberater\nPartnerschaftsgesellschaft\nBad Dürkheim\n\nAls nicht eingetragen wird veröffentlicht: Den Gläubigern der an der Verschmelzung beteiligten Rechtsträger ist, wenn sie binnen sechs Monaten nach dem Tag, an dem die Eintragung der Verschmelzung in das Register des Sitzes desjenigen Rechtsträgers,dessen Gläubiger sie sind, nach § 19 Abs. 3 UmwG als bekannt gemacht gilt, ihren Anspruch nach Grund und Höhe schriftlich anmelden, Sicherheit zu leisten, soweit sie nicht Befriedigung verlangen können. Dieses Recht steht den Gläubigern jedoch nur zu, wenn sie glaubhaft machen, dass durch die Verschmelzung die Erfüllungd er Forderung gefährdet wird."
    },
    {
      "date": "2024-10-15",
      "id": "90475",
      "original_text": "Löschungsankündigung\nBremen Amtsgericht Bremen HRB 39161\nSekerusta GmbH – Bremerhaven",
      "type": "Löschungsankündigung",
      "state": "Bremen",
      "amtsgericht": "Amtsgericht Bremen",
      "registernummer": "HRB 39161",
      "registerart": "HRB",
      "company_name": "Sekerusta GmbH",
      "company_seat": "Bremerhaven",
      "details": "15.10.2024 (Bekanntmachungsdatum)\n\nBremen Amtsgericht Bremen HRB 39161\nLöschungsankündigung\n\nSekerusta GmbH\nGesellschaft mit beschränkter Haftung\nBremerhaven\n\nEs ist beabsichtigt die im Handelsregister eingetragene Gesellschaft von Amts wegen gemäß § 394 FamFG zu löschen. Gegen die Löschung kann beim AG Bremen schriftlich oder zu Protokoll der Geschäftsstelle Widerspruch eingelegt werden. Widerspruchsfrist 4 Wochen."
    },
    {
      "date": "2024-10-15",
      "id": "90456",
      "original_text": "Registerbekanntmachung nach dem Umwandlungsgesetz\nBrandenburg Amtsgericht Cottbus HRB 8212\nSpiderbeam GmbH – Spremberg",
      "type": "Registerbekanntmachung nach dem Umwandlungsgesetz",
      "state": "Brandenburg",
      "amtsgericht": "Amtsgericht Cottbus",
      "registernummer": "HRB 8212",
      "registerart": "HRB",
      "company_name": "Spiderbeam GmbH",
      "company_seat": "Spremberg",
      "details": "15.10.2024 (Bekanntmachungsdatum)\n\nBrandenburg Amtsgericht Cottbus HRB 8212\nRegisterbekanntmachung nach dem Umwandlungsgesetz 15.10.2024 (Eintragungsdatum)\n\nSpiderbeam GmbH\nGesellschaft mit beschränkter Haftung\nSpremberg\n\nZu Eintragungsnummer 3 vom 15.10.2024 wird als nicht eingetragen veröffentlicht:\nDen Gläubigern der an der Verschmelzung beteiligten Rechtsträger ist, wenn sie binnen sechs Monaten nach dem Tag, an dem die Eintragung der Verschmelzung in das Register des Sitzes desjenigen Rechtsträgers, dessen Gläubiger sie sind, als bekannt gemacht gilt, ihren Anspruch nach Grund und Höhe schriftlich anmelden, Sicherheit zu leisten, soweit sie nicht Befriedigung verlangen können. Dieses Recht steht den Gläubigern jedoch nur zu, wenn sie glaubhaft machen, dass durch die Verschmelzung die Erfüllung ihrer Forderung gefährdet wird"
    },
    {
      "date": "2024-10-15",
      "id": "90363",
      "original_text": "Registerbekanntmachung nach dem Umwandlungsgesetz\nBayern Amtsgericht Nürnberg HRB 19428\nSt. Theresien-Krankenhaus Nürnberg, Gemeinnützige GmbH – Nürnberg",
      "type": "Registerbekanntmachung nach dem Umwandlungsgesetz",
      "state": "Bayern",
      "amtsgericht": "Amtsgericht Nürnberg",
      "registernummer": "HRB 19428",
      "registerart": "HRB",
      "company_name": "St. Theresien-Krankenhaus Nürnberg, Gemeinnützige GmbH",
      "company_seat": "Nürnberg",
      "details": "15.10.2024 (Bekanntmachungsdatum)\n\nBayern Amtsgericht Nürnberg HRB 19428\nRegisterbekanntmachung nach dem Umwandlungsgesetz 14.10.2024 (Eintragungsdatum)\n\nSt. Theresien-Krankenhaus Nürnberg, Gemeinnützige GmbH\nGesellschaft mit beschränkter Haftung\nNürnberg\n\nDen Gläubigern der an der Verschmelzung beteiligten Rechtsträger ist, wenn sie binnen sechs Monaten nach dem Tag, an dem die Eintragung der Verschmelzung in das Register des Sitzes desjenigen Rechtsträgers, dessen Gläubiger sie sind, nach § 19 Abs. 3 UmwG als bekannt gemacht gilt, ihren Anspruch nach Grund und Höhe schriftlich anmelden, Sicherheit zu leisten, soweit sie nicht Befriedigung verlangen können. Dieses Recht steht den Gläubigern jedoch nur zu, wenn sie glaubhaft machen, dass durch die Verschmelzung die Erfüllung ihrer Forderung gefährdet wird."
    },
    {
      "date": "2024-10-15",
      "id": "90359",
      "original_text": "Registerbekanntmachung nach dem Umwandlungsgesetz\nBayern Amtsgericht Augsburg HRA 17194\nStadtbäckerei Scharold OHG – Friedberg",
      "type": "Registerbekanntmachung nach dem Umwandlungsgesetz",
      "state": "Bayern",
      "amtsgericht": "Amtsgericht Augsburg",
      "registernummer": "HRA 17194",
      "registerart": "HRA",
      "company_name": "Stadtbäckerei Scharold OHG",
      "company_seat": "Friedberg",
      "details": "15.10.2024 (Bekanntmachungsdatum)\n\nBayern Amtsgericht Augsburg HRA 17194\nRegisterbekanntmachung nach dem Umwandlungsgesetz 14.10.2024 (Eintragungsdatum)\n\nStadtbäckerei Scharold OHG\nOffene Handelsgesellschaft\nFriedberg\n\nDen Gläubigern des formwechselnden Rechtsträgers ist, wenn sie binnen sechs Monaten nach dem Tag, an dem die Eintragung des Formwechsels nach § 201 UmwG als bekannt gemacht gilt, ihren Anspruch nach Grund und Höhe schriftlich anmelden, Sicherheit zu leisten, soweit sie nicht Befriedigung verlangen können. Dieses Recht steht den Gläubigern jedoch nur zu, wenn sie glaubhaft machen, dass durch den Formwechsel die Erfüllung ihrer Forderung gefährdet wird."
    },
    {
      "date": "2024-10-15",
      "id": "90484",
      "original_text": "Einreichung neuer Dokumente\nNordrhein-Westfalen Amtsgericht Köln HRB 80300\nStadtentwicklungsgesellschaft Wesseling mbH – Wesseling",
      "type": "Einreichung neuer Dokumente",
      "state": "Nordrhein-Westfalen",
      "amtsgericht": "Amtsgericht Köln",
      "registernummer": "HRB 80300",
      "registerart": "HRB",
      "company_name": "Stadtentwicklungsgesellschaft Wesseling mbH",
      "company_seat": "Wesseling",
      "details": "15.10.2024 (Bekanntmachungsdatum)\n\nNordrhein-Westfalen Amtsgericht Köln HRB 80300\nEinreichung neuer Dokumente 15.10.2024 (Eintragungsdatum)\n\nStadtentwicklungsgesellschaft Wesseling mbH\nGesellschaft mit beschränkter Haftung\nWesseling\n\nDem Registergericht ist eine neue Liste der Mitglieder des Aufsichtsrates eingereicht worden."
    },
    {
      "date": "2024-10-15",
      "id": "90375",
      "original_text": "Einreichung neuer Dokumente\nBrandenburg Amtsgericht Neuruppin HRB 1683\nStadtwerke Velten GmbH – Velten",
      "type": "Einreichung neuer Dokumente",
      "state": "Brandenburg",
      "amtsgericht": "Amtsgericht Neuruppin",
      "registernummer": "HRB 1683",
      "registerart": "HRB",
      "company_name": "Stadtwerke Velten GmbH",
      "company_seat": "Velten",
      "details": "15.10.2024 (Bekanntmachungsdatum)\n\nBrandenburg Amtsgericht Neuruppin HRB 1683\nEinreichung neuer Dokumente\n\nStadtwerke Velten GmbH\nGesellschaft mit beschränkter Haftung\nVelten\n\nAls nicht eingetragen wird veröffentlicht: Eine Liste der Mitglieder des Aufsichtsrates wurde zum Handelsregister eingereicht."
    },
    {
      "date": "2024-10-15",
      "id": "90511",
      "original_text": "Registerbekanntmachung nach dem Umwandlungsgesetz\nThüringen Amtsgericht Jena HRB 208383\nStilvoll speisen Ellen Pieger GmbH – Neustadt an der Orla",
      "type": "Registerbekanntmachung nach dem Umwandlungsgesetz",
      "state": "Thüringen",
      "amtsgericht": "Amtsgericht Jena",
      "registernummer": "HRB 208383",
      "registerart": "HRB",
      "company_name": "Stilvoll speisen Ellen Pieger GmbH",
      "company_seat": "Neustadt an der Orla",
      "details": "15.10.2024 (Bekanntmachungsdatum)\n\nThüringen Amtsgericht Jena HRB 208383\nRegisterbekanntmachung nach dem Umwandlungsgesetz 15.10.2024 (Eintragungsdatum)\n\nStilvoll speisen Ellen Pieger GmbH\nGesellschaft mit beschränkter Haftung\nNeustadt an der Orla\n\nNicht eingetragen: Den Gläubigern der an der Verschmelzung beteiligten Rechtsträger, ist wenn sie binnen sechs Monaten nach dem Tag, an dem die Eintragung der Verschmelzung in das Register des Sitzes desjenigen Rechtsträgers, dessen Gläubiger sie sind,  nach § 19 Abs. 3 UmwG als bekanntgemacht gilt, ihren Anspruch nach Grund und Höhe schriftlich anmelden, Sicherheit zu leisten, soweit sie nicht Befriedigung verlangen können. Dieses Recht steht ihnen jedoch nur zu, wenn sie glaubhaft machen, daß durch die Verschmelzung die Erfüllung ihrer Forderung gefährdet wird."
    },
    {
      "date": "2024-10-15",
      "id": "90425",
      "original_text": "Löschungsankündigung\nBrandenburg Amtsgericht Neuruppin HRB 13117\nStrabane Residential GmbH – Hohen Neuendorf",
      "type": "Löschungsankündigung",
      "state": "Brandenburg",
      "amtsgericht": "Amtsgericht Neuruppin",
      "registernummer": "HRB 13117",
      "registerart": "HRB",
      "company_name": "Strabane Residential GmbH",
      "company_seat": "Hohen Neuendorf",
      "details": "15.10.2024 (Bekanntmachungsdatum)\n\nBrandenburg Amtsgericht Neuruppin HRB 13117\nLöschungsankündigung\n\nStrabane Residential GmbH\nGesellschaft mit beschränkter Haftung\nHohen Neuendorf\n\nBei der nachstehenden Gesellschaft wird das Amtslöschungsverfahren gemäß § 394 FamFG eingeleitet.\nWiderspruchsfrist: 1 Monat"
    },
    {
      "date": "2024-10-15",
      "id": "90388",
      "original_text": "Registerbekanntmachung nach dem Umwandlungsgesetz\nBerlin Amtsgericht Berlin (Charlottenburg) HRB 258148\nSupa Stories GmbH – Berlin",
      "type": "Registerbekanntmachung nach dem Umwandlungsgesetz",
      "state": "Berlin",
      "amtsgericht": "Amtsgericht Berlin (Charlottenburg)",
      "registernummer": "HRB 258148",
      "registerart": "HRB",
      "company_name": "Supa Stories GmbH",
      "company_seat": "Berlin",
      "details": "15.10.2024 (Bekanntmachungsdatum)\n\nBerlin Amtsgericht Berlin (Charlottenburg) HRB 258148\nRegisterbekanntmachung nach dem Umwandlungsgesetz 14.10.2024 (Eintragungsdatum)\n\nSupa Stories GmbH\nGesellschaft mit beschränkter Haftung\nBerlin\n\nZu Eintragungsnummer 3 vom 14.10.2024 wird als nicht eingetragen veröffentlicht: Den Gläubigern der an der Spaltung beteiligten Rechtsträger ist, wenn sie binnen sechs Monaten nach dem Tag, an dem die Eintragung der Spaltung in das Register des Sitzes desjenigen Rechtsträgers, dessen Gläubiger sie sind, als bekannt gemacht gilt, ihren Anspruch nach Grund und Höhe schriftlich anmelden, Sicherheit zu leisten, soweit sie nicht Befriedigung verlangen können. Dieses Recht steht den Gläubigern jedoch nur zu, wenn sie glaubhaft machen, dass durch die Spaltung die Erfüllung ihrer Forderung gefährdet wird. Das Recht, Sicherheitsleistung zu verlangen, steht Gläubigern nicht zu, die im Falle der Insolvenz ein Recht auf vorzugsweise Befriedigung aus einer Deckungsmasse haben, die nach gesetzlicher Vorschrift zu ihrem Schutz errichtet und staatlich überwacht ist."
    },
    {
      "date": "2024-10-15",
      "id": "90492",
      "original_text": "Registerbekanntmachung nach dem Umwandlungsgesetz\nNordrhein-Westfalen Amtsgericht Düsseldorf HRB 104154\nSynthetica Fluorplastics GmbH – Düsseldorf",
      "type": "Registerbekanntmachung nach dem Umwandlungsgesetz",
      "state": "Nordrhein-Westfalen",
      "amtsgericht": "Amtsgericht Düsseldorf",
      "registernummer": "HRB 104154",
      "registerart": "HRB",
      "company_name": "Synthetica Fluorplastics GmbH",
      "company_seat": "Düsseldorf",
      "details": "15.10.2024 (Bekanntmachungsdatum)\n\nNordrhein-Westfalen Amtsgericht Düsseldorf HRB 104154\nRegisterbekanntmachung nach dem Umwandlungsgesetz 15.10.2024 (Eintragungsdatum)\n\nSynthetica Fluorplastics GmbH\nGesellschaft mit beschränkter Haftung\nDüsseldorf\n\nDen Gläubigern der an der Verschmelzung beteiligten Rechtsträger ist, wenn sie binnen sechs Monaten nach dem Tag, an dem die Eintragung der Verschmelzung in das Register des Sitzes desjenigen Rechtsträgers, dessen Gläubiger sie sind, nach § 19 Absatz 3 UmwG als bekanntgemacht gilt, ihren Anspruch nach Grund und Höhe schriftlich anmelden, Sicherheit zu leisten, soweit sie nicht Befriedigung verlangen können. Dieses Recht steht den Gläubigern jedoch nur zu, wenn sie glaubhaft machen, dass durch die Verschmelzung die Erfüllung ihrer Forderung gefährdet wird."
    },
    {
      "date": "2024-10-15",
      "id": "90496",
      "original_text": "Registerbekanntmachung nach dem Umwandlungsgesetz\nNordrhein-Westfalen Amtsgericht Iserlohn HRB 2685\nSynthetica Fluorplastics GmbH – Iserlohn",
      "type": "Registerbekanntmachung nach dem Umwandlungsgesetz",
      "state": "Nordrhein-Westfalen",
      "amtsgericht": "Amtsgericht Iserlohn",
      "registernummer": "HRB 2685",
      "registerart": "HRB",
      "company_name": "Synthetica Fluorplastics GmbH",
      "company_seat": "Iserlohn",
      "details": "15.10.2024 (Bekanntmachungsdatum)\n\nNordrhein-Westfalen Amtsgericht Iserlohn HRB 2685\nRegisterbekanntmachung nach dem Umwandlungsgesetz 08.10.2024 (Eintragungsdatum)\n\nSynthetica Fluorplastics GmbH\nGesellschaft mit beschränkter Haftung\nIserlohn\n\nDen Gläubigern der an der Verschmelzung beteiligten Rechtsträger ist, wenn sie binnen sechs Monaten nach dem Tag, an dem die Eintragung der Verschmelzung in das Register des Sitzes desjenigen Rechtsträgers, dessen Gläubiger sie sind, nach § 19 Absatz 3 UmwG als bekanntgemacht gilt, ihren Anspruch nach Grund und Höhe schriftlich anmelden, Sicherheit zu leisten, soweit sie nicht Befriedigung verlangen können. Dieses Recht steht den Gläubigern jedoch nur zu, wenn sie glaubhaft machen, dass durch die Verschmelzung die Erfüllung ihrer Forderung gefährdet wird."
    },
    {
      "date": "2024-10-15",
      "id": "90379",
      "original_text": "Einreichung neuer Dokumente\nBaden-Württemberg Amtsgericht Freiburg HRB 5230\nTAXI Freiburg 55 55 55 GmbH – Freiburg im Breisgau",
      "type": "Einreichung neuer Dokumente",
      "state": "Baden-Württemberg",
      "amtsgericht": "Amtsgericht Freiburg",
      "registernummer": "HRB 5230",
      "registerart": "HRB",
      "company_name": "TAXI Freiburg 55 55 55 GmbH",
      "company_seat": "Freiburg im Breisgau",
      "details": "15.10.2024 (Bekanntmachungsdatum)\n\nBaden-Württemberg Amtsgericht Freiburg HRB 5230\nEinreichung neuer Dokumente 15.10.2024 (Eintragungsdatum)\n\nTAXI Freiburg 55 55 55 GmbH\nGesellschaft mit beschränkter Haftung\nFreiburg im Breisgau\n\nDie Gesellschaft hat am 14.10.2024 die Liste über die Zusammensetzung des Aufsichtsrats zum Handelsregister eingereicht."
    },
    {
      "date": "2024-10-15",
      "id": "90378",
      "original_text": "Einreichung neuer Dokumente\nSachsen-Anhalt Amtsgericht Stendal HRB 12929\nTGZ Technologie- und Gründerzentrum Bitterfeld-Wolfen GmbH – Bitterfeld-Wolfen",
      "type": "Einreichung neuer Dokumente",
      "state": "Sachsen-Anhalt",
      "amtsgericht": "Amtsgericht Stendal",
      "registernummer": "HRB 12929",
      "registerart": "HRB",
      "company_name": "TGZ Technologie- und Gründerzentrum Bitterfeld-Wolfen GmbH",
      "company_seat": "Bitterfeld-Wolfen",
      "details": "15.10.2024 (Bekanntmachungsdatum)\n\nSachsen-Anhalt Amtsgericht Stendal HRB 12929\nEinreichung neuer Dokumente\n\nTGZ Technologie- und Gründerzentrum Bitterfeld-Wolfen GmbH\nGesellschaft mit beschränkter Haftung\nBitterfeld-Wolfen\n\nEine Liste der Mitglieder des Aufsichtsrates wurde zum Handelsregister eingereicht."
    },
    {
      "date": "2024-10-15",
      "id": "90447",
      "original_text": "Registerbekanntmachung nach dem Umwandlungsgesetz\nBerlin Amtsgericht Berlin (Charlottenburg) HRB 147229\nThird Step GmbH – Berlin",
      "type": "Registerbekanntmachung nach dem Umwandlungsgesetz",
      "state": "Berlin",
      "amtsgericht": "Amtsgericht Berlin (Charlottenburg)",
      "registernummer": "HRB 147229",
      "registerart": "HRB",
      "company_name": "Third Step GmbH",
      "company_seat": "Berlin",
      "details": "15.10.2024 (Bekanntmachungsdatum)\n\nBerlin Amtsgericht Berlin (Charlottenburg) HRB 147229\nRegisterbekanntmachung nach dem Umwandlungsgesetz 08.10.2024 (Eintragungsdatum)\n\nThird Step GmbH\nGesellschaft mit beschränkter Haftung\nBerlin\n\nZu Eintragungsnummer 4 vom 08.10.2024 wird als nicht eingetragen veröffentlicht:Den Gläubigern ist, wenn sie binnen sechs Monaten nach dem Tag, an dem die Eintragung der Umwandlung als bekannt gemacht gilt, ihren Anspruch nach Grund und Höhe schriftlich anmelden, Sicherheit zu leisten, soweit sie nicht Befriedigung verlangen können. Dieses Recht steht den Gläubigern jedoch nur zu, wenn sie glaubhaft machen, dass durch die Umwandlung die Erfüllung ihrer Forderung gefährdet wird. Das Recht, Sicherheitsleistung zu verlangen, steht Gläubigern nicht zu, die im Falle der Insolvenz ein Recht auf vorzugsweise Befriedigung aus einer Deckungsmasse haben, die nach gesetzlicher Vorschrift zu ihrem Schutz errichtet und staatlich überwacht ist."
    },
    {
      "date": "2024-10-15",
      "id": "90478",
      "original_text": "Löschungsankündigung\nBremen Amtsgericht Bremen HRB 37678\nTrading Center GmbH – Bremen",
      "type": "Löschungsankündigung",
      "state": "Bremen",
      "amtsgericht": "Amtsgericht Bremen",
      "registernummer": "HRB 37678",
      "registerart": "HRB",
      "company_name": "Trading Center GmbH",
      "company_seat": "Bremen",
      "details": "15.10.2024 (Bekanntmachungsdatum)\n\nBremen Amtsgericht Bremen HRB 37678\nLöschungsankündigung\n\nTrading Center GmbH\nGesellschaft mit beschränkter Haftung\nBremen\n\nEs ist beabsichtigt die im Handelsregister eingetragene Gesellschaft von Amts wegen gemäß § 394 FamFG zu löschen. Gegen die Löschung kann beim AG Bremen schriftlich oder zu Protokoll der Geschäftsstelle Widerspruch eingelegt werden. Widerspruchsfrist 4 Wochen."
    },
    {
      "date": "2024-10-15",
      "id": "90533",
      "original_text": "Löschungsankündigung\nHessen Amtsgericht Offenbach am Main HRB 3911\nULMI Ulicz & Michel, Gesellschaft mit beschränkter Haftung – Offenbach am Main",
      "type": "Löschungsankündigung",
      "state": "Hessen",
      "amtsgericht": "Amtsgericht Offenbach am Main",
      "registernummer": "HRB 3911",
      "registerart": "HRB",
      "company_name": "ULMI Ulicz & Michel, Gesellschaft mit beschränkter Haftung",
      "company_seat": "Offenbach am Main",
      "details": "15.10.2024 (Bekanntmachungsdatum)\n\nHessen Amtsgericht Offenbach am Main HRB 3911\nLöschungsankündigung\n\nULMI Ulicz & Michel, Gesellschaft mit beschränkter Haftung\nGesellschaft mit beschränkter Haftung\nOffenbach am Main\n\nDas Registergericht beabsichtigt die im Handelsregister eingetragene Gesellschaft von Amts wegen nach § 394 FamFG zu löschen. Die Frist zur Erhebung eines Widerspruchs gegen die beabsichtigte Löschung wird auf 3 Monate festgesetzt."
    },
    {
      "date": "2024-10-15",
      "id": "90407",
      "original_text": "Registerbekanntmachung nach dem Umwandlungsgesetz\nSchleswig-Holstein Amtsgericht Lübeck HRB 16894\nVerwaltungsgesellschaft Worlée-Chemie mbH – Lauenburg/Elbe",
      "type": "Registerbekanntmachung nach dem Umwandlungsgesetz",
      "state": "Schleswig-Holstein",
      "amtsgericht": "Amtsgericht Lübeck",
      "registernummer": "HRB 16894",
      "registerart": "HRB",
      "company_name": "Verwaltungsgesellschaft Worlée-Chemie mbH",
      "company_seat": "Lauenburg/Elbe",
      "details": "15.10.2024 (Bekanntmachungsdatum)\n\nSchleswig-Holstein Amtsgericht Lübeck HRB 16894\nRegisterbekanntmachung nach dem Umwandlungsgesetz 15.10.2024 (Eintragungsdatum)\n\nVerwaltungsgesellschaft Worlée-Chemie mbH\nGesellschaft mit beschränkter Haftung\nLauenburg/Elbe\n\nZu Eintragungsnummer 3 vom 15.10.2024 wird als nicht eingetragen veröffentlicht: Den Gläubigern der an der Verschmelzung beteiligten Rechtsträger ist, wenn sie binnen sechs Monaten nach dem Tag, an dem die Eintragung der Verschmelzung in das Register des Sitzes desjenigen Rechtsträgers, dessen Gläubiger sie sind, als bekannt gemacht gilt, ihren Anspruch nach Grund und Höhe schriftlich anmelden, Sicherheit zu leisten, soweit sie nicht Befriedigung verlangen können. Dieses Recht steht den Gläubigern jedoch nur zu, wenn sie glaubhaft machen, dass durch die Verschmelzung die Erfüllung ihrer Forderung gefährdet wird."
    },
    {
      "date": "2024-10-15",
      "id": "90336",
      "original_text": "Löschungsankündigung\nBayern Amtsgericht München HRB 194752\nVeselovskiy GmbH – München",
      "type": "Löschungsankündigung",
      "state": "Bayern",
      "amtsgericht": "Amtsgericht München",
      "registernummer": "HRB 194752",
      "registerart": "HRB",
      "company_name": "Veselovskiy GmbH",
      "company_seat": "München",
      "details": "15.10.2024 (Bekanntmachungsdatum)\n\nBayern Amtsgericht München HRB 194752\nLöschungsankündigung 14.10.2024 (Eintragungsdatum)\n\nVeselovskiy GmbH\nGesellschaft mit beschränkter Haftung\nMünchen\n\nDas Registergericht beabsichtigt, die im Handelsregister eingetragene Gesellschaft wegen Vermögenslosigkeit von Amts wegen nach § 394 FamFG zu löschen. Die Frist zur Erhebung eines Widerspruchs ist auf drei Monate festgesetzt."
    },
    {
      "date": "2024-10-15",
      "id": "90436",
      "original_text": "Löschungsankündigung\nHamburg Amtsgericht Hamburg HRA 101000\nVierte SATEMI Grundstücksverwaltungs GmbH & Co. KG – Hamburg",
      "type": "Löschungsankündigung",
      "state": "Hamburg",
      "amtsgericht": "Amtsgericht Hamburg",
      "registernummer": "HRA 101000",
      "registerart": "HRA",
      "company_name": "Vierte SATEMI Grundstücksverwaltungs GmbH & Co. KG",
      "company_seat": "Hamburg",
      "details": "15.10.2024 (Bekanntmachungsdatum)\n\nHamburg Amtsgericht Hamburg HRA 101000\nLöschungsankündigung\n\nVierte SATEMI Grundstücksverwaltungs GmbH & Co. KG\nKommanditgesellschaft\nHamburg\n\nDas Registergericht beabsichtigt, die im Handelsregister eingetragene Gesellschaft von Amts wegen nach § 394 FamFG zu löschen. Die Frist zur Erhebung eines Widerspruchs gegen die beabsichtigte Löschung wird auf 3 Monate festgesetzt."
    },
    {
      "date": "2024-10-15",
      "id": "90430",
      "original_text": "Löschungsankündigung\nHamburg Amtsgericht Hamburg HRA 79186\nWaldfried Hartig Heizungsbedarf e.K. – Hamburg",
      "type": "Löschungsankündigung",
      "state": "Hamburg",
      "amtsgericht": "Amtsgericht Hamburg",
      "registernummer": "HRA 79186",
      "registerart": "HRA",
      "company_name": "Waldfried Hartig Heizungsbedarf e.K.",
      "company_seat": "Hamburg",
      "details": "15.10.2024 (Bekanntmachungsdatum)\n\nHamburg Amtsgericht Hamburg HRA 79186\nLöschungsankündigung\n\nWaldfried Hartig Heizungsbedarf e.K.\nEinzelkaufmann\nHamburg\n\nDas Registergericht beabsichtigt, die im Handelsregister eingetragene Firma von Amts wegen nach § 31 Abs. 2 HGB zu löschen. Die Frist zur Erhebung eines Widerspruchs gegen die beabsichtigte Löschung wird auf 3 Monate festgesetzt."
    },
    {
      "date": "2024-10-15",
      "id": "90523",
      "original_text": "Löschungsankündigung\nHessen Amtsgericht Offenbach am Main HRB 48064\nWerde GmbH – Offenbach am Main",
      "type": "Löschungsankündigung",
      "state": "Hessen",
      "amtsgericht": "Amtsgericht Offenbach am Main",
      "registernummer": "HRB 48064",
      "registerart": "HRB",
      "company_name": "Werde GmbH",
      "company_seat": "Offenbach am Main",
      "details": "15.10.2024 (Bekanntmachungsdatum)\n\nHessen Amtsgericht Offenbach am Main HRB 48064\nLöschungsankündigung\n\nWerde GmbH\nGesellschaft mit beschränkter Haftung\nOffenbach am Main\n\nDas Registergericht beabsichtigt die im Handelsregister eingetragene Gesellschaft von Amts wegen nach § 394 FamFG zu löschen. Die Frist zur Erhebung eines Widerspruchs gegen die beabsichtigte Löschung wird auf 3 Monate festgesetzt."
    },
    {
      "date": "2024-10-15",
      "id": "90404",
      "original_text": "Löschungsankündigung\nHamburg Amtsgericht Hamburg HRB 18234\nWittchow Bau CBM GmbH – Hamburg",
      "type": "Löschungsankündigung",
      "state": "Hamburg",
      "amtsgericht": "Amtsgericht Hamburg",
      "registernummer": "HRB 18234",
      "registerart": "HRB",
      "company_name": "Wittchow Bau CBM GmbH",
      "company_seat": "Hamburg",
      "details": "15.10.2024 (Bekanntmachungsdatum)\n\nHamburg Amtsgericht Hamburg HRB 18234\nLöschungsankündigung\n\nWittchow Bau CBM GmbH\nGesellschaft mit beschränkter Haftung\nHamburg\n\nNach Mitteilung des Bezirksamtes Altona vom 22.08.2024 wurde Ihnen durch Bescheid vom 08.07.2024, bestandskräftig seit dem 14.08.2024 (Gesch.Nr. 1113/736.00-05), der Betrieb eines Gewerbes der Wittchow Bau CBM GmbH  sowie jeden Gewerbes, für das § 35 Gewerbeordnung (GewO) gilt, sowie Ihnen auch die Tätigkeit als mit der Leitung eines Gewerbebetriebes und als Vertretungsberechtigter eines Gewerbetreibenden untersagt.\n\nGemäß § 6 Abs. 2 S. 2 Nr. 2 des Gesetzes betreffend die Gesellschaften mit beschränkter Haftung (GmbHG) können Sie infolgedessen kein Geschäftsführer der Wittchow Bau CBM GmbH mehr sein.\n\nDie Eintragung des Herrn Alexander Lamprecht als Geschäftsführer ist damit wegen des Mangels einer wesentlichen Voraussetzung unzulässig geworden.\n\nDas Registergericht beabsichtigt daher, die Eintragung des Geschäftsführer gemäß § 395 des Gesetzes über das Verfahren in Familiensachen und in Angelegenheiten der freiwilligen Gerichtsbarkeit (FamFG) von Amts wegen aus dem Handelsregister zu löschen.\n\nGegen die beabsichtigte Löschung kann innerhalb eines Monats seit dieser Bekanntmachung Widerspruch beim\n\nAmtsgericht Hamburg - Registergericht -, Caffamacherreihe 20, 20355 Hamburg,\n\nschriftlich oder zur Niederschrift der Geschäftsstelle oder des Rechtspflegers einzulegen.\nDer Widerspruch kann auch zu Protokoll der Geschäftsstelle eines anderen Amtsgerichtes erfolgen. In diesem Falle ist die Frist nur dann gewahrt, wenn das den Widerspruch enthaltende Protokoll innerhalb der Frist bei dem Registergericht eingeht.\n\nSofern hier binnen der genannten Frist kein Widerspruch eingeht, wird das Gericht die genannten Eintragungen von Amts wegen löschen."
    },
    {
      "date": "2024-10-15",
      "id": "90383",
      "original_text": "Einreichung neuer Dokumente\nBaden-Württemberg Amtsgericht Mannheim HRB 737678\nY1 Digital AG – Karlsruhe",
      "type": "Einreichung neuer Dokumente",
      "state": "Baden-Württemberg",
      "amtsgericht": "Amtsgericht Mannheim",
      "registernummer": "HRB 737678",
      "registerart": "HRB",
      "company_name": "Y1 Digital AG",
      "company_seat": "Karlsruhe",
      "details": "15.10.2024 (Bekanntmachungsdatum)\n\nBaden-Württemberg Amtsgericht Mannheim HRB 737678\nEinreichung neuer Dokumente 15.10.2024 (Eintragungsdatum)\n\nY1 Digital AG\nAktiengesellschaft\nKarlsruhe\n\nDie Gesellschaft hat am 01.10.2024 die Liste über die Zusammensetzung des Aufsichtsrats zum Handelsregister eingereicht."
    },
    {
      "date": "2024-10-15",
      "id": "90334",
      "original_text": "Registerbekanntmachung nach dem Umwandlungsgesetz\nBayern Amtsgericht Nürnberg HRB 38754\nZander L9 GmbH – Nürnberg",
      "type": "Registerbekanntmachung nach dem Umwandlungsgesetz",
      "state": "Bayern",
      "amtsgericht": "Amtsgericht Nürnberg",
      "registernummer": "HRB 38754",
      "registerart": "HRB",
      "company_name": "Zander L9 GmbH",
      "company_seat": "Nürnberg",
      "details": "15.10.2024 (Bekanntmachungsdatum)\n\nBayern Amtsgericht Nürnberg HRB 38754\nRegisterbekanntmachung nach dem Umwandlungsgesetz 14.10.2024 (Eintragungsdatum)\n\nZander L9 GmbH\nGesellschaft mit beschränkter Haftung\nNürnberg\n\nDen Gläubigern des formwechselnden Rechtsträgers ist, wenn sie binnen sechs Monaten nach dem Tag, an dem die Eintragung des Formwechsels nach § 201 UmwG als bekannt gemacht gilt, ihren Anspruch nach Grund und Höhe schriftlich anmelden, Sicherheit zu leisten, soweit sie nicht Befriedigung verlangen können. Dieses Recht steht den Gläubigern jedoch nur zu, wenn sie glaubhaft machen, dass durch den Formwechsel die Erfüllung ihrer Forderung gefährdet wird."
    },
    {
      "date": "2024-10-15",
      "id": "90534",
      "original_text": "Löschungsankündigung\nHessen Amtsgericht Offenbach am Main HRB 6451\nZang & Bahmer GmbH Holzleimwerk und Holzbearbeitung – Offenbach am Main",
      "type": "Löschungsankündigung",
      "state": "Hessen",
      "amtsgericht": "Amtsgericht Offenbach am Main",
      "registernummer": "HRB 6451",
      "registerart": "HRB",
      "company_name": "Zang & Bahmer GmbH Holzleimwerk und Holzbearbeitung",
      "company_seat": "Offenbach am Main",
      "details": "15.10.2024 (Bekanntmachungsdatum)\n\nHessen Amtsgericht Offenbach am Main HRB 6451\nLöschungsankündigung\n\nZang & Bahmer GmbH Holzleimwerk und Holzbearbeitung\nGesellschaft mit beschränkter Haftung\nOffenbach am Main\n\nDas Registergericht beabsichtigt die im Handelsregister eingetragene Gesellschaft von Amts wegen nach § 394 FamFG zu löschen. Die Frist zur Erhebung eines Widerspruchs gegen die beabsichtigte Löschung wird auf 3 Monate festgesetzt."
    },
    {
      "date": "2024-10-15",
      "id": "90424",
      "original_text": "Registerbekanntmachung nach dem Umwandlungsgesetz\nBaden-Württemberg Amtsgericht Stuttgart GsR 1958\nZimmermann eingetragene Gesellschaft des bürgerlichen Rechts – Stuttgart",
      "type": "Registerbekanntmachung nach dem Umwandlungsgesetz",
      "state": "Baden-Württemberg",
      "amtsgericht": "Amtsgericht Stuttgart",
      "registernummer": "GsR 1958",
      "registerart": "GsR",
      "company_name": "Zimmermann eingetragene Gesellschaft des bürgerlichen Rechts",
      "company_seat": "Stuttgart",
      "details": "15.10.2024 (Bekanntmachungsdatum)\n\nBaden-Württemberg Amtsgericht Stuttgart GsR 1958\nRegisterbekanntmachung nach dem Umwandlungsgesetz 15.10.2024 (Eintragungsdatum)\n\nZimmermann eingetragene Gesellschaft des bürgerlichen Rechts\nGesellschaft bürgerlichen Rechts\nStuttgart\n\nAls nicht eingetragen wird bekanntgemacht:\nDen Gläubigern des an dem Formwechsel beteiligten Rechtsträgers ist, wenn sie binnen sechs Monaten nach dem Tag, an dem die Eintragung des Formwechsels in das Register des Sitzes desjenigen Rechtsträgers, dessen Gläubiger sie sind, nach § 19 Abs. 3 UmwG als bekanntgemacht gilt, ihren Anspruch nach Grund und Höhe schriftlich anmelden, Sicherheit zu leisten, soweit sie nicht Befriedigung verlangen können. Dieses Recht steht den Gläubigern jedoch nur zu, wenn sie glaubhaft machen, dass durch den Formwechsel die Erfüllung ihrer Forderung gefährdet wird."
    },
    {
      "date": "2024-10-15",
      "id": "90500",
      "original_text": "Registerbekanntmachung nach dem Umwandlungsgesetz\nNordrhein-Westfalen Amtsgericht Neuss HRB 22534\nZorc Finance Holding GmbH – Neuss",
      "type": "Registerbekanntmachung nach dem Umwandlungsgesetz",
      "state": "Nordrhein-Westfalen",
      "amtsgericht": "Amtsgericht Neuss",
      "registernummer": "HRB 22534",
      "registerart": "HRB",
      "company_name": "Zorc Finance Holding GmbH",
      "company_seat": "Neuss",
      "details": "15.10.2024 (Bekanntmachungsdatum)\n\nNordrhein-Westfalen Amtsgericht Neuss HRB 22534\nRegisterbekanntmachung nach dem Umwandlungsgesetz 15.10.2024 (Eintragungsdatum)\n\nZorc Finance Holding GmbH\nGesellschaft mit beschränkter Haftung\nNeuss\n\nDen Gläubigern der an der Verschmelzung beteiligten Rechtsträger ist, wenn sie binnen sechs Monaten nach dem Tag, an dem die Eintragung der Verschmelzung in das Register des Sitzes derjenigen Rechtsträger deren Gläubiger sie sind, nach § 19 Absatz 3 UmwG als bekanntgemacht gilt, ihren Anspruch nach Grund und Höhe schriftlich anmelden, Sicherheit zu leisten, soweit sie nicht Befriedigung verlangen können. Dieses Recht steht den Gläubigern jedoch nur zu, wenn sie glaubhaft machen, dass durch die Verschmelzung die Erfüllung ihrer Forderung gefährdet wird."
    },
    {
      "date": "2024-10-15",
      "id": "90358",
      "original_text": "Einreichung neuer Dokumente\nBayern Amtsgericht Nürnberg HRB 41603\namity AG – Nürnberg",
      "type": "Einreichung neuer Dokumente",
      "state": "Bayern",
      "amtsgericht": "Amtsgericht Nürnberg",
      "registernummer": "HRB 41603",
      "registerart": "HRB",
      "company_name": "amity AG",
      "company_seat": "Nürnberg",
      "details": "15.10.2024 (Bekanntmachungsdatum)\n\nBayern Amtsgericht Nürnberg HRB 41603\nEinreichung neuer Dokumente 14.10.2024 (Eintragungsdatum)\n\namity AG\nAktiengesellschaft\nNürnberg\n\nDem Amtsgericht Nürnberg -Registergericht- ist eine Liste der Mitglieder des Aufsichtsrats eingereicht worden, § 106 AktG."
    },
    {
      "date": "2024-10-15",
      "id": "90397",
      "original_text": "Registerbekanntmachung nach dem Umwandlungsgesetz\nSchleswig-Holstein Amtsgericht Lübeck HRB 24314\ncathaMed Gesellschaft für den Handel mit pharmazeutischem und medizinischem Bedarf mit beschränkter Haftung – Geesthacht",
      "type": "Registerbekanntmachung nach dem Umwandlungsgesetz",
      "state": "Schleswig-Holstein",
      "amtsgericht": "Amtsgericht Lübeck",
      "registernummer": "HRB 24314",
      "registerart": "HRB",
      "company_name": "cathaMed Gesellschaft für den Handel mit pharmazeutischem und medizinischem Bedarf mit beschränkter Haftung",
      "company_seat": "Geesthacht",
      "details": "15.10.2024 (Bekanntmachungsdatum)\n\nSchleswig-Holstein Amtsgericht Lübeck HRB 24314\nRegisterbekanntmachung nach dem Umwandlungsgesetz 14.10.2024 (Eintragungsdatum)\n\ncathaMed Gesellschaft für den Handel mit pharmazeutischem und medizinischem Bedarf mit beschränkter Haftung\nGesellschaft mit beschränkter Haftung\nGeesthacht\n\nZu Eintragungsnummer 3 vom 14.10.2024 wird als nicht eingetragen veröffentlicht:\nDen Gläubigern der an der Verschmelzung beteiligten Rechtsträger ist, wenn sie binnen sechs Monaten nach dem Tag, an dem die Eintragung der Verschmelzung in das Register des Sitzes desjenigen Rechtsträgers, dessen Gläubiger sie sind, als bekannt gemacht gilt, ihren Anspruch nach Grund und Höhe schriftlich anmelden, Sicherheit zu leisten, soweit sie nicht Befriedigung verlangen können. Dieses Recht steht den Gläubigern jedoch nur zu, wenn sie glaubhaft machen, dass durch die Verschmelzung die Erfüllung ihrer Forderung gefährdet wird."
    },
    {
      "date": "2024-10-15",
      "id": "90413",
      "original_text": "Löschungsankündigung\nHamburg Amtsgericht Hamburg HRB 125213\ndukaPC GmbH – Hamburg",
      "type": "Löschungsankündigung",
      "state": "Hamburg",
      "amtsgericht": "Amtsgericht Hamburg",
      "registernummer": "HRB 125213",
      "registerart": "HRB",
      "company_name": "dukaPC GmbH",
      "company_seat": "Hamburg",
      "details": "15.10.2024 (Bekanntmachungsdatum)\n\nHamburg Amtsgericht Hamburg HRB 125213\nLöschungsankündigung\n\ndukaPC GmbH\nGesellschaft mit beschränkter Haftung\nHamburg\n\nDas Registergericht beabsichtigt, die im Handelsregister eingetragene Gesellschaft von Amts wegen nach § 394 FamFG zu löschen. Die Frist zur Erhebung eines Widerspruchs gegen die beabsichtigte Löschung wird auf 3 Monate festgesetzt."
    },
    {
      "date": "2024-10-15",
      "id": "90351",
      "original_text": "Registerbekanntmachung nach dem Umwandlungsgesetz\nBayern Amtsgericht Fürth HRB 16274\neesy-ic GmbH – Erlangen",
      "type": "Registerbekanntmachung nach dem Umwandlungsgesetz",
      "state": "Bayern",
      "amtsgericht": "Amtsgericht Fürth",
      "registernummer": "HRB 16274",
      "registerart": "HRB",
      "company_name": "eesy-ic GmbH",
      "company_seat": "Erlangen",
      "details": "15.10.2024 (Bekanntmachungsdatum)\n\nBayern Amtsgericht Fürth HRB 16274\nRegisterbekanntmachung nach dem Umwandlungsgesetz 14.10.2024 (Eintragungsdatum)\n\neesy-ic GmbH\nGesellschaft mit beschränkter Haftung\nErlangen\n\nDen Gläubigern der an der Verschmelzung beteiligten Rechtsträger ist, wenn sie binnen sechs Monaten nach dem Tag, an dem die Eintragung der Verschmelzung in das Register des Sitzes desjenigen Rechtsträgers, dessen Gläubiger sie sind, nach § 19 Abs. 3 UmwG als bekannt gemacht gilt, ihren Anspruch nach Grund und Höhe schriftlich anmelden, Sicherheit zu leisten, soweit sie nicht Befriedigung verlangen können. Dieses Recht steht den Gläubigern jedoch nur zu, wenn sie glaubhaft machen, dass durch die Verschmelzung die Erfüllung ihrer Forderung gefährdet wird."
    },
    {
      "date": "2024-10-15",
      "id": "90431",
      "original_text": "Löschungsankündigung\nHamburg Amtsgericht Hamburg HRA 112932\neos new media GmbH & Co. KG – Hamburg",
      "type": "Löschungsankündigung",
      "state": "Hamburg",
      "amtsgericht": "Amtsgericht Hamburg",
      "registernummer": "HRA 112932",
      "registerart": "HRA",
      "company_name": "eos new media GmbH & Co. KG",
      "company_seat": "Hamburg",
      "details": "15.10.2024 (Bekanntmachungsdatum)\n\nHamburg Amtsgericht Hamburg HRA 112932\nLöschungsankündigung\n\neos new media GmbH & Co. KG\nKommanditgesellschaft\nHamburg\n\nDas Registergericht beabsichtigt, die im Handelsregister eingetragene Firma von Amts wegen nach § 31 Abs. 2 HGB zu löschen. Die Frist zur Erhebung eines Widerspruchs gegen die beabsichtigte Löschung wird auf 3 Monate festgesetzt."
    },
    {
      "date": "2024-10-15",
      "id": "90350",
      "original_text": "Einreichung neuer Dokumente\nBayern Amtsgericht München HRB 253548\nneoshare AG – München",
      "type": "Einreichung neuer Dokumente",
      "state": "Bayern",
      "amtsgericht": "Amtsgericht München",
      "registernummer": "HRB 253548",
      "registerart": "HRB",
      "company_name": "neoshare AG",
      "company_seat": "München",
      "details": "15.10.2024 (Bekanntmachungsdatum)\n\nBayern Amtsgericht München HRB 253548\nEinreichung neuer Dokumente\n\nneoshare AG\nAktiengesellschaft\nMünchen\n\nDem Amtsgericht München -Registergericht- ist eine Liste der Mitglieder des Aufsichtsrats eingereicht worden, § 106 AktG."
    },
    {
      "date": "2024-10-15",
      "id": "90348",
      "original_text": "Löschungsankündigung\nBayern Amtsgericht München HRB 168948\npeilort sportconcepts GmbH – München",
      "type": "Löschungsankündigung",
      "state": "Bayern",
      "amtsgericht": "Amtsgericht München",
      "registernummer": "HRB 168948",
      "registerart": "HRB",
      "company_name": "peilort sportconcepts GmbH",
      "company_seat": "München",
      "details": "15.10.2024 (Bekanntmachungsdatum)\n\nBayern Amtsgericht München HRB 168948\nLöschungsankündigung 14.10.2024 (Eintragungsdatum)\n\npeilort sportconcepts GmbH\nGesellschaft mit beschränkter Haftung\nMünchen\n\nDas Registergericht beabsichtigt, die im Handelsregister eingetragene Gesellschaft wegen Vermögenslosigkeit von Amts wegen nach § 394 FamFG zu löschen. Die Frist zur Erhebung eines Widerspruchs ist auf drei Monate festgesetzt."
    },
    {
      "date": "2024-10-15",
      "id": "90494",
      "original_text": "Einreichung neuer Dokumente\nNordrhein-Westfalen Amtsgericht Mönchengladbach HRB 11998\npro multis gemeinnützige GmbH – Mönchengladbach",
      "type": "Einreichung neuer Dokumente",
      "state": "Nordrhein-Westfalen",
      "amtsgericht": "Amtsgericht Mönchengladbach",
      "registernummer": "HRB 11998",
      "registerart": "HRB",
      "company_name": "pro multis gemeinnützige GmbH",
      "company_seat": "Mönchengladbach",
      "details": "15.10.2024 (Bekanntmachungsdatum)\n\nNordrhein-Westfalen Amtsgericht Mönchengladbach HRB 11998\nEinreichung neuer Dokumente\n\npro multis gemeinnützige GmbH\nGesellschaft mit beschränkter Haftung\nMönchengladbach\n\nDem Registergericht ist eine neue Liste der Mitglieder des Aufsichtsrates eingereicht worden."
    },
    {
      "date": "2024-10-15",
      "id": "90472",
      "original_text": "Einreichung neuer Dokumente\nBremen Amtsgericht Bremen HRB 4428\nswb AG – Bremen",
      "type": "Einreichung neuer Dokumente",
      "state": "Bremen",
      "amtsgericht": "Amtsgericht Bremen",
      "registernummer": "HRB 4428",
      "registerart": "HRB",
      "company_name": "swb AG",
      "company_seat": "Bremen",
      "details": "15.10.2024 (Bekanntmachungsdatum)\n\nBremen Amtsgericht Bremen HRB 4428\nEinreichung neuer Dokumente\n\nswb AG\nAktiengesellschaft\nBremen\n\nAls nicht eingetragen wird bekannt gemacht: Liste des Aufsichtsrats wurde eingereicht."
    },
    {
      "date": "2024-10-15",
      "id": "90411",
      "original_text": "Löschungsankündigung\nBaden-Württemberg Amtsgericht Mannheim HRB 711595\nx-skin UG (haftungsbeschränkt) – Ettlingen",
      "type": "Löschungsankündigung",
      "state": "Baden-Württemberg",
      "amtsgericht": "Amtsgericht Mannheim",
      "registernummer": "HRB 711595",
      "registerart": "HRB",
      "company_name": "x-skin UG (haftungsbeschränkt)",
      "company_seat": "Ettlingen",
      "details": "15.10.2024 (Bekanntmachungsdatum)\n\nBaden-Württemberg Amtsgericht Mannheim HRB 711595\nLöschungsankündigung\n\nx-skin UG (haftungsbeschränkt)\nGesellschaft mit beschränkter Haftung\nEttlingen\n\nAls nicht eingetragen wird bekanntgemacht:\nDas Gericht beabsichtigt, die Gesellschaft wegen Vermögenslosigkeit im Handelsregister von Amts wegen nach § 394 FamFG zu löschen. Die Frist zur Geltendmachung eines Widerspruchs gegen die beabsichtigte Löschung ist auf einen Monat ab Veröffentlichung bestimmt."
    },
    {
      "date": "2024-10-15",
      "id": "90476",
      "original_text": "Löschungsankündigung\nBremen Amtsgericht Bremen HRB 26924\nÜzbe Automaten-Betriebs GmbH – Bremen",
      "type": "Löschungsankündigung",
      "state": "Bremen",
      "amtsgericht": "Amtsgericht Bremen",
      "registernummer": "HRB 26924",
      "registerart": "HRB",
      "company_name": "Üzbe Automaten-Betriebs GmbH",
      "company_seat": "Bremen",
      "details": "15.10.2024 (Bekanntmachungsdatum)\n\nBremen Amtsgericht Bremen HRB 26924\nLöschungsankündigung\n\nÜzbe Automaten-Betriebs GmbH\nGesellschaft mit beschränkter Haftung\nBremen\n\nEs ist beabsichtigt die im Handelsregister eingetragene Gesellschaft von Amts wegen gemäß § 394 FamFG zu löschen. Gegen die Löschung kann beim AG Bremen schriftlich oder zu Protokoll der Geschäftsstelle Widerspruch eingelegt werden. Widerspruchsfrist 4 Wochen."
    }
  ]
}