{
  "date": "2024-10-22",
  "date_of_scrape": "2024-11-30T14:35:51.670Z",
  "tool_version": "0.2.0",
  "number_of_announcements": 153,
  "announcements": [
    {
      "date": "2024-10-22",
      "id": "91169",
      "original_text": "Löschungsankündigung\nBayern Amtsgericht Amberg HRB 3611\nSchraml GmbH – Kastl",
      "type": "Löschungsankündigung",
      "state": "Bayern",
      "amtsgericht": "Amtsgericht Amberg",
      "registernummer": "HRB 3611",
      "registerart": "HRB",
      "company_name": "Schraml GmbH",
      "company_seat": "Kastl",
      "details": "22.10.2024 (Bekanntmachungsdatum)\n\nBayern Amtsgericht Amberg HRB 3611\nLöschungsankündigung\n\nSchraml GmbH\nGesellschaft mit beschränkter Haftung\nKastl\n\nDas Registergericht beabsichtigt, die im Handelsregister eingetragene Gesellschaft wegen Vermögenslosigkeit von Amts wegen nach § 394 FamFG zu löschen. Die Frist zur Erhebung eines Widerspruchs ist auf einen Monat festgesetzt."
    },
    {
      "date": "2024-10-22",
      "id": "91170",
      "original_text": "Sonstige Registerbekanntmachung\nBayern Amtsgericht Memmingen HRB 13507\nallgäu resort GmbH – Bad Grönenbach",
      "type": "Sonstige Registerbekanntmachung",
      "state": "Bayern",
      "amtsgericht": "Amtsgericht Memmingen",
      "registernummer": "HRB 13507",
      "registerart": "HRB",
      "company_name": "allgäu resort GmbH",
      "company_seat": "Bad Grönenbach",
      "details": "22.10.2024 (Bekanntmachungsdatum)\n\nBayern Amtsgericht Memmingen HRB 13507\nSonstige Registerbekanntmachung 21.10.2024 (Eintragungsdatum)\n\nallgäu resort GmbH\nGesellschaft mit beschränkter Haftung\nBad Grönenbach\n\nDen Gläubigern der Gesellschaft, deren Forderungen begründet worden sind, bevor die Eintragung der Beendigung des Gewinnabführungsvertrages in das Handelsregister nach § 10 des Handelsgesetzbuches als bekanntgemacht gilt, hat der andere Vertragsteil Sicherheit zu leisten, wenn sie sich binnen sechs Monaten nach der Bekanntmachung der Eintragung zu diesem Zweck bei ihm melden."
    },
    {
      "date": "2024-10-22",
      "id": "91171",
      "original_text": "Löschungsankündigung\nBayern Amtsgericht München HRB 216013\nPOWER ONE GmbH – München",
      "type": "Löschungsankündigung",
      "state": "Bayern",
      "amtsgericht": "Amtsgericht München",
      "registernummer": "HRB 216013",
      "registerart": "HRB",
      "company_name": "POWER ONE GmbH",
      "company_seat": "München",
      "details": "22.10.2024 (Bekanntmachungsdatum)\n\nBayern Amtsgericht München HRB 216013\nLöschungsankündigung 21.10.2024 (Eintragungsdatum)\n\nPOWER ONE GmbH\nGesellschaft mit beschränkter Haftung\nMünchen\n\nDas Registergericht beabsichtigt, die im Handelsregister eingetragene Gesellschaft wegen Vermögenslosigkeit von Amts wegen nach § 394 FamFG zu löschen. Die Frist zur Erhebung eines Widerspruchs ist auf drei Monate festgesetzt."
    },
    {
      "date": "2024-10-22",
      "id": "91172",
      "original_text": "Registerbekanntmachung nach dem Umwandlungsgesetz\nBayern Amtsgericht München HRB 296978\nGECCO GmbH – München",
      "type": "Registerbekanntmachung nach dem Umwandlungsgesetz",
      "state": "Bayern",
      "amtsgericht": "Amtsgericht München",
      "registernummer": "HRB 296978",
      "registerart": "HRB",
      "company_name": "GECCO GmbH",
      "company_seat": "München",
      "details": "22.10.2024 (Bekanntmachungsdatum)\n\nBayern Amtsgericht München HRB 296978\nRegisterbekanntmachung nach dem Umwandlungsgesetz 21.10.2024 (Eintragungsdatum)\n\nGECCO GmbH\nGesellschaft mit beschränkter Haftung\nMünchen\n\nDen Gläubigern des formwechselnden Rechtsträgers ist, wenn sie binnen sechs Monaten nach dem Tag, an dem die Eintragung des Formwechsels nach § 201 UmwG als bekannt gemacht gilt, ihren Anspruch nach Grund und Höhe schriftlich anmelden, Sicherheit zu leisten, soweit sie nicht Befriedigung verlangen können. Dieses Recht steht den Gläubigern jedoch nur zu, wenn sie glaubhaft machen, dass durch den Formwechsel die Erfüllung ihrer Forderung gefährdet wird."
    },
    {
      "date": "2024-10-22",
      "id": "91173",
      "original_text": "Registerbekanntmachung nach dem Umwandlungsgesetz\nBayern Amtsgericht München HRB 235969\nGECCO AG – München",
      "type": "Registerbekanntmachung nach dem Umwandlungsgesetz",
      "state": "Bayern",
      "amtsgericht": "Amtsgericht München",
      "registernummer": "HRB 235969",
      "registerart": "HRB",
      "company_name": "GECCO AG",
      "company_seat": "München",
      "details": "22.10.2024 (Bekanntmachungsdatum)\n\nBayern Amtsgericht München HRB 235969\nRegisterbekanntmachung nach dem Umwandlungsgesetz 21.10.2024 (Eintragungsdatum)\n\nGECCO AG\nAktiengesellschaft\nMünchen\n\nDen Gläubigern des formwechselnden Rechtsträgers ist, wenn sie binnen sechs Monaten nach dem Tag, an dem die Eintragung des Formwechsels nach § 201 UmwG als bekannt gemacht gilt, ihren Anspruch nach Grund und Höhe schriftlich anmelden, Sicherheit zu leisten, soweit sie nicht Befriedigung verlangen können. Dieses Recht steht den Gläubigern jedoch nur zu, wenn sie glaubhaft machen, dass durch den Formwechsel die Erfüllung ihrer Forderung gefährdet wird."
    },
    {
      "date": "2024-10-22",
      "id": "91174",
      "original_text": "Registerbekanntmachung nach dem Umwandlungsgesetz\nBayern Amtsgericht Deggendorf HRB 5891\nHöttl GmbH – Deggendorf",
      "type": "Registerbekanntmachung nach dem Umwandlungsgesetz",
      "state": "Bayern",
      "amtsgericht": "Amtsgericht Deggendorf",
      "registernummer": "HRB 5891",
      "registerart": "HRB",
      "company_name": "Höttl GmbH",
      "company_seat": "Deggendorf",
      "details": "22.10.2024 (Bekanntmachungsdatum)\n\nBayern Amtsgericht Deggendorf HRB 5891\nRegisterbekanntmachung nach dem Umwandlungsgesetz 30.09.2024 (Eintragungsdatum)\n\nHöttl GmbH\nGesellschaft mit beschränkter Haftung\nDeggendorf\n\nDen Gläubigern der an der Verschmelzung beteiligten Rechtsträger ist, wenn sie binnen sechs Monaten nach dem Tag, an dem die Eintragung der Verschmelzung in das Register des Sitzes desjenigen Rechtsträgers, dessen Gläubiger sie sind, nach § 19 Abs. 3 UmwG als bekannt gemacht gilt, ihren Anspruch nach Grund und Höhe schriftlich anmelden, Sicherheit zu leisten, soweit sie nicht Befriedigung verlangen können. Dieses Recht steht den Gläubigern jedoch nur zu, wenn sie glaubhaft machen, dass durch die Verschmelzung die Erfüllung ihrer Forderung gefährdet wird."
    },
    {
      "date": "2024-10-22",
      "id": "91175",
      "original_text": "Registerbekanntmachung nach dem Umwandlungsgesetz\nBayern Amtsgericht Ansbach HRA 3118\nQuad Stadel Schwab e.K. – Burgoberbach",
      "type": "Registerbekanntmachung nach dem Umwandlungsgesetz",
      "state": "Bayern",
      "amtsgericht": "Amtsgericht Ansbach",
      "registernummer": "HRA 3118",
      "registerart": "HRA",
      "company_name": "Quad Stadel Schwab e.K.",
      "company_seat": "Burgoberbach",
      "details": "22.10.2024 (Bekanntmachungsdatum)\n\nBayern Amtsgericht Ansbach HRA 3118\nRegisterbekanntmachung nach dem Umwandlungsgesetz 21.10.2024 (Eintragungsdatum)\n\nQuad Stadel Schwab e.K.\nEinzelkaufmann / Einzelkauffrau\nBurgoberbach\n\nDen Gläubigern der an der Ausgliederung beteiligten Rechtsträger ist, wenn sie binnen sechs Monaten nach dem Tag, an dem die Eintragung der Ausgliederung in das Register des Sitzes desjenigen Rechtsträgers, dessen Gläubiger sie sind, nach §§ 125, 19 Abs. 3 UmwG als bekannt gemacht gilt, ihren Anspruch nach Grund und Höhe schriftlich anmelden, Sicherheit zu leisten, soweit sie nicht Befriedigung verlangen können. Dieses Recht steht den Gläubigern jedoch nur zu, wenn sie glaubhaft machen, dass durch die Ausgliederung die Erfüllung ihrer Forderung gefährdet wird."
    },
    {
      "date": "2024-10-22",
      "id": "91176",
      "original_text": "Registerbekanntmachung nach dem Umwandlungsgesetz\nBayern Amtsgericht Ansbach HRB 8535\nQuad Stadel Schwab GmbH – Burgoberbach",
      "type": "Registerbekanntmachung nach dem Umwandlungsgesetz",
      "state": "Bayern",
      "amtsgericht": "Amtsgericht Ansbach",
      "registernummer": "HRB 8535",
      "registerart": "HRB",
      "company_name": "Quad Stadel Schwab GmbH",
      "company_seat": "Burgoberbach",
      "details": "22.10.2024 (Bekanntmachungsdatum)\n\nBayern Amtsgericht Ansbach HRB 8535\nRegisterbekanntmachung nach dem Umwandlungsgesetz 21.10.2024 (Eintragungsdatum)\n\nQuad Stadel Schwab GmbH\nGesellschaft mit beschränkter Haftung\nBurgoberbach\n\nDen Gläubigern der an der Ausgliederung beteiligten Rechtsträger ist, wenn sie binnen sechs Monaten nach dem Tag, an dem die Eintragung der Ausgliederung in das Register des Sitzes desjenigen Rechtsträgers, dessen Gläubiger sie sind, nach §§ 125, 19 Abs. 3 UmwG als bekannt gemacht gilt, ihren Anspruch nach Grund und Höhe schriftlich anmelden, Sicherheit zu leisten, soweit sie nicht Befriedigung verlangen können. Dieses Recht steht den Gläubigern jedoch nur zu, wenn sie glaubhaft machen, dass durch die Ausgliederung die Erfüllung ihrer Forderung gefährdet wird."
    },
    {
      "date": "2024-10-22",
      "id": "91177",
      "original_text": "Löschungsankündigung\nBayern Amtsgericht Nürnberg HRA 8657\nJohann Katz Fachberatung und Auftragsvermittlungen e.K. – Rednitzhembach",
      "type": "Löschungsankündigung",
      "state": "Bayern",
      "amtsgericht": "Amtsgericht Nürnberg",
      "registernummer": "HRA 8657",
      "registerart": "HRA",
      "company_name": "Johann Katz Fachberatung und Auftragsvermittlungen e.K.",
      "company_seat": "Rednitzhembach",
      "details": "22.10.2024 (Bekanntmachungsdatum)\n\nBayern Amtsgericht Nürnberg HRA 8657\nLöschungsankündigung\n\nJohann Katz Fachberatung und Auftragsvermittlungen e.K.\nEinzelkaufmann / Einzelkauffrau\nRednitzhembach\n\nDas Registergericht beabsichtigt, die im Handelsregister eingetragene Firma von Amts wegen nach § 31 Abs. 2 HGB zu löschen. Die Frist zur Erhebung eines Widerspruchs ist auf einen Monat festgesetzt."
    },
    {
      "date": "2024-10-22",
      "id": "91178",
      "original_text": "Löschungsankündigung\nBayern Amtsgericht Nürnberg HRA 8657\nJohann Katz Fachberatung und Auftragsvermittlungen e.K. – Rednitzhembach",
      "type": "Löschungsankündigung",
      "state": "Bayern",
      "amtsgericht": "Amtsgericht Nürnberg",
      "registernummer": "HRA 8657",
      "registerart": "HRA",
      "company_name": "Johann Katz Fachberatung und Auftragsvermittlungen e.K.",
      "company_seat": "Rednitzhembach",
      "details": "22.10.2024 (Bekanntmachungsdatum)\n\nBayern Amtsgericht Nürnberg HRA 8657\nLöschungsankündigung\n\nJohann Katz Fachberatung und Auftragsvermittlungen e.K.\nEinzelkaufmann / Einzelkauffrau\nRednitzhembach\n\nDas Registergericht beabsichtigt, die im Handelsregister eingetragene Firma von Amts wegen nach § 31 Abs. 2 HGB zu löschen. Die Frist zur Erhebung eines Widerspruchs ist auf einen Monat festgesetzt."
    },
    {
      "date": "2024-10-22",
      "id": "91179",
      "original_text": "Einreichung neuer Dokumente\nBayern Amtsgericht München HRB 212326\nKorian Management AG – München",
      "type": "Einreichung neuer Dokumente",
      "state": "Bayern",
      "amtsgericht": "Amtsgericht München",
      "registernummer": "HRB 212326",
      "registerart": "HRB",
      "company_name": "Korian Management AG",
      "company_seat": "München",
      "details": "22.10.2024 (Bekanntmachungsdatum)\n\nBayern Amtsgericht München HRB 212326\nEinreichung neuer Dokumente 21.10.2024 (Eintragungsdatum)\n\nKorian Management AG\nAktiengesellschaft\nMünchen\n\nDem Amtsgericht München -Registergericht- ist eine Liste der Mitglieder des Aufsichtsrats eingereicht worden, § 106 AktG."
    },
    {
      "date": "2024-10-22",
      "id": "91180",
      "original_text": "Registerbekanntmachung nach dem Umwandlungsgesetz\nBayern Amtsgericht Deggendorf HRA 3198\nLZDW DEG UG (haftungsbeschränkt) & Co. KG – Deggendorf",
      "type": "Registerbekanntmachung nach dem Umwandlungsgesetz",
      "state": "Bayern",
      "amtsgericht": "Amtsgericht Deggendorf",
      "registernummer": "HRA 3198",
      "registerart": "HRA",
      "company_name": "LZDW DEG UG (haftungsbeschränkt) & Co. KG",
      "company_seat": "Deggendorf",
      "details": "22.10.2024 (Bekanntmachungsdatum)\n\nBayern Amtsgericht Deggendorf HRA 3198\nRegisterbekanntmachung nach dem Umwandlungsgesetz 28.08.2024 (Eintragungsdatum)\n\nLZDW DEG UG (haftungsbeschränkt) & Co. KG\nKommanditgesellschaft\nDeggendorf\n\nDen Gläubigern der an der Verschmelzung beteiligten Rechtsträger ist, wenn sie binnen sechs Monaten nach dem Tag, an dem die Eintragung der Verschmelzung in das Register des Sitzes desjenigen Rechtsträgers, dessen Gläubiger sie sind, nach § 19 Abs. 3 UmwG als bekannt gemacht gilt, ihren Anspruch nach Grund und Höhe schriftlich anmelden, Sicherheit zu leisten, soweit sie nicht Befriedigung verlangen können. Dieses Recht steht den Gläubigern jedoch nur zu, wenn sie glaubhaft machen, dass durch die Verschmelzung die Erfüllung ihrer Forderung gefährdet wird."
    },
    {
      "date": "2024-10-22",
      "id": "91181",
      "original_text": "Registerbekanntmachung nach dem Umwandlungsgesetz\nBayern Amtsgericht Deggendorf HRA 2959\nHSN Projektentwicklung GmbH & Co. KG – Deggendorf",
      "type": "Registerbekanntmachung nach dem Umwandlungsgesetz",
      "state": "Bayern",
      "amtsgericht": "Amtsgericht Deggendorf",
      "registernummer": "HRA 2959",
      "registerart": "HRA",
      "company_name": "HSN Projektentwicklung GmbH & Co. KG",
      "company_seat": "Deggendorf",
      "details": "22.10.2024 (Bekanntmachungsdatum)\n\nBayern Amtsgericht Deggendorf HRA 2959\nRegisterbekanntmachung nach dem Umwandlungsgesetz 09.10.2024 (Eintragungsdatum)\n\nHSN Projektentwicklung GmbH & Co. KG\nKommanditgesellschaft\nDeggendorf\n\nDen Gläubigern der an der Verschmelzung beteiligten Rechtsträger ist, wenn sie binnen sechs Monaten nach dem Tag, an dem die Eintragung der Verschmelzung in das Register des Sitzes desjenigen Rechtsträgers, dessen Gläubiger sie sind, nach § 19 Abs. 3 UmwG als bekannt gemacht gilt, ihren Anspruch nach Grund und Höhe schriftlich anmelden, Sicherheit zu leisten, soweit sie nicht Befriedigung verlangen können. Dieses Recht steht den Gläubigern jedoch nur zu, wenn sie glaubhaft machen, dass durch die Verschmelzung die Erfüllung ihrer Forderung gefährdet wird."
    },
    {
      "date": "2024-10-22",
      "id": "91182",
      "original_text": "Registerbekanntmachung nach dem Umwandlungsgesetz\nBayern Amtsgericht Deggendorf HRA 3075\nLZDW GmbH & Co. KG – Viechtach",
      "type": "Registerbekanntmachung nach dem Umwandlungsgesetz",
      "state": "Bayern",
      "amtsgericht": "Amtsgericht Deggendorf",
      "registernummer": "HRA 3075",
      "registerart": "HRA",
      "company_name": "LZDW GmbH & Co. KG",
      "company_seat": "Viechtach",
      "details": "22.10.2024 (Bekanntmachungsdatum)\n\nBayern Amtsgericht Deggendorf HRA 3075\nRegisterbekanntmachung nach dem Umwandlungsgesetz 28.08.2024 (Eintragungsdatum)\n\nLZDW GmbH & Co. KG\nKommanditgesellschaft\nViechtach\n\nDen Gläubigern der an der Verschmelzung beteiligten Rechtsträger ist, wenn sie binnen sechs Monaten nach dem Tag, an dem die Eintragung der Verschmelzung in das Register des Sitzes desjenigen Rechtsträgers, dessen Gläubiger sie sind, nach § 19 Abs. 3 UmwG als bekannt gemacht gilt, ihren Anspruch nach Grund und Höhe schriftlich anmelden, Sicherheit zu leisten, soweit sie nicht Befriedigung verlangen können. Dieses Recht steht den Gläubigern jedoch nur zu, wenn sie glaubhaft machen, dass durch die Verschmelzung die Erfüllung ihrer Forderung gefährdet wird."
    },
    {
      "date": "2024-10-22",
      "id": "91183",
      "original_text": "Registerbekanntmachung nach dem Umwandlungsgesetz\nBayern Amtsgericht Deggendorf HRB 4399\nRILE Logistics Consulting & Services GmbH – Deggendorf",
      "type": "Registerbekanntmachung nach dem Umwandlungsgesetz",
      "state": "Bayern",
      "amtsgericht": "Amtsgericht Deggendorf",
      "registernummer": "HRB 4399",
      "registerart": "HRB",
      "company_name": "RILE Logistics Consulting & Services GmbH",
      "company_seat": "Deggendorf",
      "details": "22.10.2024 (Bekanntmachungsdatum)\n\nBayern Amtsgericht Deggendorf HRB 4399\nRegisterbekanntmachung nach dem Umwandlungsgesetz 05.10.2024 (Eintragungsdatum)\n\nRILE Logistics Consulting & Services GmbH\nGesellschaft mit beschränkter Haftung\nDeggendorf\n\nDen Gläubigern der an der Verschmelzung beteiligten Rechtsträger ist, wenn sie binnen sechs Monaten nach dem Tag, an dem die Eintragung der Verschmelzung in das Register des Sitzes desjenigen Rechtsträgers, dessen Gläubiger sie sind, nach § 19 Abs. 3 UmwG als bekannt gemacht gilt, ihren Anspruch nach Grund und Höhe schriftlich anmelden, Sicherheit zu leisten, soweit sie nicht Befriedigung verlangen können. Dieses Recht steht den Gläubigern jedoch nur zu, wenn sie glaubhaft machen, dass durch die Verschmelzung die Erfüllung ihrer Forderung gefährdet wird."
    },
    {
      "date": "2024-10-22",
      "id": "91184",
      "original_text": "Löschungsankündigung\nBayern Amtsgericht München HRB 249575\nStaffing Match GmbH – München",
      "type": "Löschungsankündigung",
      "state": "Bayern",
      "amtsgericht": "Amtsgericht München",
      "registernummer": "HRB 249575",
      "registerart": "HRB",
      "company_name": "Staffing Match GmbH",
      "company_seat": "München",
      "details": "22.10.2024 (Bekanntmachungsdatum)\n\nBayern Amtsgericht München HRB 249575\nLöschungsankündigung 21.10.2024 (Eintragungsdatum)\n\nStaffing Match GmbH\nGesellschaft mit beschränkter Haftung\nMünchen\n\nDas Registergericht beabsichtigt, die im Handelsregister eingetragene Gesellschaft wegen Vermögenslosigkeit von Amts wegen nach § 394 FamFG zu löschen. Die Frist zur Erhebung eines Widerspruchs ist auf drei Monate festgesetzt."
    },
    {
      "date": "2024-10-22",
      "id": "91185",
      "original_text": "Registerbekanntmachung nach dem Umwandlungsgesetz\nBayern Amtsgericht München HRB 293347\nEOS Akquisition GmbH – Oberhaching",
      "type": "Registerbekanntmachung nach dem Umwandlungsgesetz",
      "state": "Bayern",
      "amtsgericht": "Amtsgericht München",
      "registernummer": "HRB 293347",
      "registerart": "HRB",
      "company_name": "EOS Akquisition GmbH",
      "company_seat": "Oberhaching",
      "details": "22.10.2024 (Bekanntmachungsdatum)\n\nBayern Amtsgericht München HRB 293347\nRegisterbekanntmachung nach dem Umwandlungsgesetz 21.10.2024 (Eintragungsdatum)\n\nEOS Akquisition GmbH\nGesellschaft mit beschränkter Haftung\nOberhaching\n\nDen Gläubigern der an der Verschmelzung beteiligten Rechtsträger ist, wenn sie binnen sechs Monaten nach dem Tag, an dem die Eintragung der Verschmelzung in das Register des Sitzes desjenigen Rechtsträgers, dessen Gläubiger sie sind, nach § 19 Abs. 3 UmwG als bekannt gemacht gilt, ihren Anspruch nach Grund und Höhe schriftlich anmelden, Sicherheit zu leisten, soweit sie nicht Befriedigung verlangen können. Dieses Recht steht den Gläubigern jedoch nur zu, wenn sie glaubhaft machen, dass durch die Verschmelzung die Erfüllung ihrer Forderung gefährdet wird."
    },
    {
      "date": "2024-10-22",
      "id": "91186",
      "original_text": "Registerbekanntmachung nach dem Umwandlungsgesetz\nBayern Amtsgericht München HRB 273805\nScensations GmbH – Krailling",
      "type": "Registerbekanntmachung nach dem Umwandlungsgesetz",
      "state": "Bayern",
      "amtsgericht": "Amtsgericht München",
      "registernummer": "HRB 273805",
      "registerart": "HRB",
      "company_name": "Scensations GmbH",
      "company_seat": "Krailling",
      "details": "22.10.2024 (Bekanntmachungsdatum)\n\nBayern Amtsgericht München HRB 273805\nRegisterbekanntmachung nach dem Umwandlungsgesetz 21.10.2024 (Eintragungsdatum)\n\nScensations GmbH\nGesellschaft mit beschränkter Haftung\nKrailling\n\nDen Gläubigern des formwechselnden Rechtsträgers ist, wenn sie binnen sechs Monaten nach dem Tag, an dem die Eintragung des Formwechsels nach § 201 UmwG als bekannt gemacht gilt, ihren Anspruch nach Grund und Höhe schriftlich anmelden, Sicherheit zu leisten, soweit sie nicht Befriedigung verlangen können. Dieses Recht steht den Gläubigern jedoch nur zu, wenn sie glaubhaft machen, dass durch den Formwechsel die Erfüllung ihrer Forderung gefährdet wird."
    },
    {
      "date": "2024-10-22",
      "id": "91187",
      "original_text": "Registerbekanntmachung nach dem Umwandlungsgesetz\nBayern Amtsgericht Fürth HRB 12317\nLegrand Systems GmbH – Baiersdorf",
      "type": "Registerbekanntmachung nach dem Umwandlungsgesetz",
      "state": "Bayern",
      "amtsgericht": "Amtsgericht Fürth",
      "registernummer": "HRB 12317",
      "registerart": "HRB",
      "company_name": "Legrand Systems GmbH",
      "company_seat": "Baiersdorf",
      "details": "22.10.2024 (Bekanntmachungsdatum)\n\nBayern Amtsgericht Fürth HRB 12317\nRegisterbekanntmachung nach dem Umwandlungsgesetz 21.10.2024 (Eintragungsdatum)\n\nLegrand Systems GmbH\nGesellschaft mit beschränkter Haftung\nBaiersdorf\n\nDen Gläubigern der an der Verschmelzung beteiligten Rechtsträger ist, wenn sie binnen sechs Monaten nach dem Tag, an dem die Eintragung der Verschmelzung in das Register des Sitzes desjenigen Rechtsträgers, dessen Gläubiger sie sind, nach § 19 Abs. 3 UmwG als bekannt gemacht gilt, ihren Anspruch nach Grund und Höhe schriftlich anmelden, Sicherheit zu leisten, soweit sie nicht Befriedigung verlangen können. Dieses Recht steht den Gläubigern jedoch nur zu, wenn sie glaubhaft machen, dass durch die Verschmelzung die Erfüllung ihrer Forderung gefährdet wird."
    },
    {
      "date": "2024-10-22",
      "id": "91188",
      "original_text": "Registerbekanntmachung nach dem Umwandlungsgesetz\nBayern Amtsgericht Deggendorf HRB 3612\nGasthof Höttl Beteiligungs GmbH – Deggendorf",
      "type": "Registerbekanntmachung nach dem Umwandlungsgesetz",
      "state": "Bayern",
      "amtsgericht": "Amtsgericht Deggendorf",
      "registernummer": "HRB 3612",
      "registerart": "HRB",
      "company_name": "Gasthof Höttl Beteiligungs GmbH",
      "company_seat": "Deggendorf",
      "details": "22.10.2024 (Bekanntmachungsdatum)\n\nBayern Amtsgericht Deggendorf HRB 3612\nRegisterbekanntmachung nach dem Umwandlungsgesetz 30.09.2024 (Eintragungsdatum)\n\nGasthof Höttl Beteiligungs GmbH\nGesellschaft mit beschränkter Haftung\nDeggendorf\n\nDen Gläubigern der an der Verschmelzung beteiligten Rechtsträger ist, wenn sie binnen sechs Monaten nach dem Tag, an dem die Eintragung der Verschmelzung in das Register des Sitzes desjenigen Rechtsträgers, dessen Gläubiger sie sind, nach § 19 Abs. 3 UmwG als bekannt gemacht gilt, ihren Anspruch nach Grund und Höhe schriftlich anmelden, Sicherheit zu leisten, soweit sie nicht Befriedigung verlangen können. Dieses Recht steht den Gläubigern jedoch nur zu, wenn sie glaubhaft machen, dass durch die Verschmelzung die Erfüllung ihrer Forderung gefährdet wird."
    },
    {
      "date": "2024-10-22",
      "id": "91189",
      "original_text": "Einreichung neuer Dokumente\nBayern Amtsgericht München HRB 41054\nDeutsche Pfandbriefbank AG – München",
      "type": "Einreichung neuer Dokumente",
      "state": "Bayern",
      "amtsgericht": "Amtsgericht München",
      "registernummer": "HRB 41054",
      "registerart": "HRB",
      "company_name": "Deutsche Pfandbriefbank AG",
      "company_seat": "München",
      "details": "22.10.2024 (Bekanntmachungsdatum)\n\nBayern Amtsgericht München HRB 41054\nEinreichung neuer Dokumente\n\nDeutsche Pfandbriefbank AG\nAktiengesellschaft\nMünchen\n\nDem Amtsgericht München -Registergericht- ist eine Liste der Mitglieder des Aufsichtsrats eingereicht worden, § 106 AktG."
    },
    {
      "date": "2024-10-22",
      "id": "91190",
      "original_text": "Registerbekanntmachung nach dem Umwandlungsgesetz\nBayern Amtsgericht Deggendorf HRB 4915\nRSD Grundstücks GmbH – Deggendorf",
      "type": "Registerbekanntmachung nach dem Umwandlungsgesetz",
      "state": "Bayern",
      "amtsgericht": "Amtsgericht Deggendorf",
      "registernummer": "HRB 4915",
      "registerart": "HRB",
      "company_name": "RSD Grundstücks GmbH",
      "company_seat": "Deggendorf",
      "details": "22.10.2024 (Bekanntmachungsdatum)\n\nBayern Amtsgericht Deggendorf HRB 4915\nRegisterbekanntmachung nach dem Umwandlungsgesetz 09.10.2024 (Eintragungsdatum)\n\nRSD Grundstücks GmbH\nGesellschaft mit beschränkter Haftung\nDeggendorf\n\nDen Gläubigern der an der Verschmelzung beteiligten Rechtsträger ist, wenn sie binnen sechs Monaten nach dem Tag, an dem die Eintragung der Verschmelzung in das Register des Sitzes desjenigen Rechtsträgers, dessen Gläubiger sie sind, nach § 19 Abs. 3 UmwG als bekannt gemacht gilt, ihren Anspruch nach Grund und Höhe schriftlich anmelden, Sicherheit zu leisten, soweit sie nicht Befriedigung verlangen können. Dieses Recht steht den Gläubigern jedoch nur zu, wenn sie glaubhaft machen, dass durch die Verschmelzung die Erfüllung ihrer Forderung gefährdet wird."
    },
    {
      "date": "2024-10-22",
      "id": "91191",
      "original_text": "Registerbekanntmachung nach dem Umwandlungsgesetz\nBayern Amtsgericht Deggendorf HRB 5182\nRILE Drive UG (haftungsbeschränkt) – Deggendorf",
      "type": "Registerbekanntmachung nach dem Umwandlungsgesetz",
      "state": "Bayern",
      "amtsgericht": "Amtsgericht Deggendorf",
      "registernummer": "HRB 5182",
      "registerart": "HRB",
      "company_name": "RILE Drive UG (haftungsbeschränkt)",
      "company_seat": "Deggendorf",
      "details": "22.10.2024 (Bekanntmachungsdatum)\n\nBayern Amtsgericht Deggendorf HRB 5182\nRegisterbekanntmachung nach dem Umwandlungsgesetz 05.10.2024 (Eintragungsdatum)\n\nRILE Drive UG (haftungsbeschränkt)\nGesellschaft mit beschränkter Haftung\nDeggendorf\n\nDen Gläubigern der an der Verschmelzung beteiligten Rechtsträger ist, wenn sie binnen sechs Monaten nach dem Tag, an dem die Eintragung der Verschmelzung in das Register des Sitzes desjenigen Rechtsträgers, dessen Gläubiger sie sind, nach § 19 Abs. 3 UmwG als bekannt gemacht gilt, ihren Anspruch nach Grund und Höhe schriftlich anmelden, Sicherheit zu leisten, soweit sie nicht Befriedigung verlangen können. Dieses Recht steht den Gläubigern jedoch nur zu, wenn sie glaubhaft machen, dass durch die Verschmelzung die Erfüllung ihrer Forderung gefährdet wird."
    },
    {
      "date": "2024-10-22",
      "id": "91192",
      "original_text": "Löschungsankündigung\nBerlin Amtsgericht Berlin (Charlottenburg) HRB 187404\nFix Fensterbau UG (haftungsbeschränkt) – Berlin",
      "type": "Löschungsankündigung",
      "state": "Berlin",
      "amtsgericht": "Amtsgericht Berlin (Charlottenburg)",
      "registernummer": "HRB 187404",
      "registerart": "HRB",
      "company_name": "Fix Fensterbau UG (haftungsbeschränkt)",
      "company_seat": "Berlin",
      "details": "22.10.2024 (Bekanntmachungsdatum)\n\nBerlin Amtsgericht Berlin (Charlottenburg) HRB 187404\nLöschungsankündigung\n\nFix Fensterbau UG (haftungsbeschränkt)\nGesellschaft mit beschränkter Haftung\nBerlin\n\nBei der nachstehenden Gesellschaft wird das Amtslöschungsverfahren gemäß § 394 FamFG eingeleitet. Widerspruchsfrist: 6 Wochen."
    },
    {
      "date": "2024-10-22",
      "id": "91193",
      "original_text": "Registerbekanntmachung nach dem Umwandlungsgesetz\nBerlin Amtsgericht Berlin (Charlottenburg) HRB 183620\nJJ Berlin Facility Management GmbH – Berlin",
      "type": "Registerbekanntmachung nach dem Umwandlungsgesetz",
      "state": "Berlin",
      "amtsgericht": "Amtsgericht Berlin (Charlottenburg)",
      "registernummer": "HRB 183620",
      "registerart": "HRB",
      "company_name": "JJ Berlin Facility Management GmbH",
      "company_seat": "Berlin",
      "details": "22.10.2024 (Bekanntmachungsdatum)\n\nBerlin Amtsgericht Berlin (Charlottenburg) HRB 183620\nRegisterbekanntmachung nach dem Umwandlungsgesetz 21.10.2024 (Eintragungsdatum)\n\nJJ Berlin Facility Management GmbH\nGesellschaft mit beschränkter Haftung\nBerlin\n\nZu Eintragungsnummer 4 vom 21.10.2024 wird als nicht eingetragen veröffentlicht: Den Gläubigern der an der Verschmelzung beteiligten Rechtsträger ist, wenn sie binnen sechs Monaten nach dem Tag, an dem die Eintragung der Verschmelzung in das Register des Sitzes desjenigen Rechtsträgers, dessen Gläubiger sie sind, als bekannt gemacht gilt, ihren Anspruch nach Grund und Höhe schriftlich anmelden, Sicherheit zu leisten, soweit sie nicht Befriedigung verlangen können. Dieses Recht steht den Gläubigern jedoch nur zu, wenn sie glaubhaft machen, dass durch die Verschmelzung die Erfüllung ihrer Forderung gefährdet wird. Das Recht, Sicherheitsleistung zu verlangen, steht Gläubigern nicht zu, die im Falle der Insolvenz ein Recht auf vorzugsweise Befriedigung aus einer Deckungsmasse haben, die nach gesetzlicher Vorschrift zu ihrem Schutz errichtet und staatlich überwacht ist."
    },
    {
      "date": "2024-10-22",
      "id": "91194",
      "original_text": "Registerbekanntmachung nach dem Umwandlungsgesetz\nBerlin Amtsgericht Berlin (Charlottenburg) HRB 170550\nJundef & Co. GmbH – Berlin",
      "type": "Registerbekanntmachung nach dem Umwandlungsgesetz",
      "state": "Berlin",
      "amtsgericht": "Amtsgericht Berlin (Charlottenburg)",
      "registernummer": "HRB 170550",
      "registerart": "HRB",
      "company_name": "Jundef & Co. GmbH",
      "company_seat": "Berlin",
      "details": "22.10.2024 (Bekanntmachungsdatum)\n\nBerlin Amtsgericht Berlin (Charlottenburg) HRB 170550\nRegisterbekanntmachung nach dem Umwandlungsgesetz 21.10.2024 (Eintragungsdatum)\n\nJundef & Co. GmbH\nGesellschaft mit beschränkter Haftung\nBerlin\n\nZu Eintragungsnummer 3 vom 21.10.2024 wird als nicht eingetragen veröffentlicht: Den Gläubigern der an der Verschmelzung beteiligten Rechtsträger ist, wenn sie binnen sechs Monaten nach dem Tag, an dem die Eintragung der Verschmelzung in das Register des Sitzes desjenigen Rechtsträgers, dessen Gläubiger sie sind, als bekannt gemacht gilt, ihren Anspruch nach Grund und Höhe schriftlich anmelden, Sicherheit zu leisten, soweit sie nicht Befriedigung verlangen können. Dieses Recht steht den Gläubigern jedoch nur zu, wenn sie glaubhaft machen, dass durch die Verschmelzung die Erfüllung ihrer Forderung gefährdet wird. Das Recht, Sicherheitsleistung zu verlangen, steht Gläubigern nicht zu, die im Falle der Insolvenz ein Recht auf vorzugsweise Befriedigung aus einer Deckungsmasse haben, die nach gesetzlicher Vorschrift zu ihrem Schutz errichtet und staatlich überwacht ist."
    },
    {
      "date": "2024-10-22",
      "id": "91195",
      "original_text": "Einreichung neuer Dokumente\nBerlin Amtsgericht Berlin (Charlottenburg) HRB 167633\nFuturium gGmbH – Berlin",
      "type": "Einreichung neuer Dokumente",
      "state": "Berlin",
      "amtsgericht": "Amtsgericht Berlin (Charlottenburg)",
      "registernummer": "HRB 167633",
      "registerart": "HRB",
      "company_name": "Futurium gGmbH",
      "company_seat": "Berlin",
      "details": "22.10.2024 (Bekanntmachungsdatum)\n\nBerlin Amtsgericht Berlin (Charlottenburg) HRB 167633\nEinreichung neuer Dokumente\n\nFuturium gGmbH\nGesellschaft mit beschränkter Haftung\nBerlin\n\nAls nicht eingetragen wird veröffentlicht: Es wurde eine neue Liste der Aufsichtsratsmitglieder eingereicht (§52 GmbHG)."
    },
    {
      "date": "2024-10-22",
      "id": "91196",
      "original_text": "Einreichung neuer Dokumente\nBerlin Amtsgericht Berlin (Charlottenburg) HRB 167633\nFuturium gGmbH – Berlin",
      "type": "Einreichung neuer Dokumente",
      "state": "Berlin",
      "amtsgericht": "Amtsgericht Berlin (Charlottenburg)",
      "registernummer": "HRB 167633",
      "registerart": "HRB",
      "company_name": "Futurium gGmbH",
      "company_seat": "Berlin",
      "details": "22.10.2024 (Bekanntmachungsdatum)\n\nBerlin Amtsgericht Berlin (Charlottenburg) HRB 167633\nEinreichung neuer Dokumente\n\nFuturium gGmbH\nGesellschaft mit beschränkter Haftung\nBerlin\n\nAls nicht eingetragen wird veröffentlicht: Es wurde eine neue Liste der Aufsichtsratsmitglieder eingereicht (§52 GmbHG)."
    },
    {
      "date": "2024-10-22",
      "id": "91197",
      "original_text": "Einreichung neuer Dokumente\nBerlin Amtsgericht Berlin (Charlottenburg) HRB 167633\nFuturium gGmbH – Berlin",
      "type": "Einreichung neuer Dokumente",
      "state": "Berlin",
      "amtsgericht": "Amtsgericht Berlin (Charlottenburg)",
      "registernummer": "HRB 167633",
      "registerart": "HRB",
      "company_name": "Futurium gGmbH",
      "company_seat": "Berlin",
      "details": "22.10.2024 (Bekanntmachungsdatum)\n\nBerlin Amtsgericht Berlin (Charlottenburg) HRB 167633\nEinreichung neuer Dokumente\n\nFuturium gGmbH\nGesellschaft mit beschränkter Haftung\nBerlin\n\nAls nicht eingetragen wird veröffentlicht: Es wurde eine neue Liste der Aufsichtsratsmitglieder eingereicht (§52 GmbHG)."
    },
    {
      "date": "2024-10-22",
      "id": "91198",
      "original_text": "Einreichung neuer Dokumente\nBerlin Amtsgericht Berlin (Charlottenburg) HRB 167633\nFuturium gGmbH – Berlin",
      "type": "Einreichung neuer Dokumente",
      "state": "Berlin",
      "amtsgericht": "Amtsgericht Berlin (Charlottenburg)",
      "registernummer": "HRB 167633",
      "registerart": "HRB",
      "company_name": "Futurium gGmbH",
      "company_seat": "Berlin",
      "details": "22.10.2024 (Bekanntmachungsdatum)\n\nBerlin Amtsgericht Berlin (Charlottenburg) HRB 167633\nEinreichung neuer Dokumente\n\nFuturium gGmbH\nGesellschaft mit beschränkter Haftung\nBerlin\n\nAls nicht eingetragen wird veröffentlicht: Es wurde eine neue Liste der Aufsichtsratsmitglieder eingereicht (§52 GmbHG)."
    },
    {
      "date": "2024-10-22",
      "id": "91199",
      "original_text": "Einreichung neuer Dokumente\nBerlin Amtsgericht Berlin (Charlottenburg) HRB 167633\nFuturium gGmbH – Berlin",
      "type": "Einreichung neuer Dokumente",
      "state": "Berlin",
      "amtsgericht": "Amtsgericht Berlin (Charlottenburg)",
      "registernummer": "HRB 167633",
      "registerart": "HRB",
      "company_name": "Futurium gGmbH",
      "company_seat": "Berlin",
      "details": "22.10.2024 (Bekanntmachungsdatum)\n\nBerlin Amtsgericht Berlin (Charlottenburg) HRB 167633\nEinreichung neuer Dokumente\n\nFuturium gGmbH\nGesellschaft mit beschränkter Haftung\nBerlin\n\nAls nicht eingetragen wird veröffentlicht: Es wurde eine neue Liste der Aufsichtsratsmitglieder eingereicht (§52 GmbHG)."
    },
    {
      "date": "2024-10-22",
      "id": "91200",
      "original_text": "Registerbekanntmachung nach dem Umwandlungsgesetz\nBerlin Amtsgericht Berlin (Charlottenburg) HRB 117458\nX-MOVE GmbH – Berlin",
      "type": "Registerbekanntmachung nach dem Umwandlungsgesetz",
      "state": "Berlin",
      "amtsgericht": "Amtsgericht Berlin (Charlottenburg)",
      "registernummer": "HRB 117458",
      "registerart": "HRB",
      "company_name": "X-MOVE GmbH",
      "company_seat": "Berlin",
      "details": "22.10.2024 (Bekanntmachungsdatum)\n\nBerlin Amtsgericht Berlin (Charlottenburg) HRB 117458\nRegisterbekanntmachung nach dem Umwandlungsgesetz 21.10.2024 (Eintragungsdatum)\n\nX-MOVE GmbH\nGesellschaft mit beschränkter Haftung\nBerlin\n\nZu Eintragungsnummer 4 vom 21.10.2024 wird als nicht eingetragen veröffentlicht:\nDen Gläubigern der an der Verschmelzung beteiligten Rechtsträger ist, wenn sie binnen sechs Monaten nach dem Tag, an dem die Eintragung der Verschmelzung in das Register des Sitzes desjenigen Rechtsträgers, dessen Gläubiger sie sind, als bekannt gemacht gilt, ihren Anspruch nach Grund und Höhe schriftlich anmelden, Sicherheit zu leisten, soweit sie nicht Befriedigung verlangen können. Dieses Recht steht den Gläubigern jedoch nur zu, wenn sie glaubhaft machen, dass durch die Verschmelzung die Erfüllung ihrer Forderung gefährdet wird. Das Recht, Sicherheitsleistung zu verlangen, steht Gläubigern nicht zu, die im Falle der Insolvenz ein Recht auf vorzugsweise Befriedigung aus einer Deckungsmasse haben, die nach gesetzlicher Vorschrift zu ihrem Schutz errichtet und staatlich überwacht ist."
    },
    {
      "date": "2024-10-22",
      "id": "91201",
      "original_text": "Löschungsankündigung\nBerlin Amtsgericht Berlin (Charlottenburg) HRB 199922\nGolden Horn Berlin GmbH – Berlin",
      "type": "Löschungsankündigung",
      "state": "Berlin",
      "amtsgericht": "Amtsgericht Berlin (Charlottenburg)",
      "registernummer": "HRB 199922",
      "registerart": "HRB",
      "company_name": "Golden Horn Berlin GmbH",
      "company_seat": "Berlin",
      "details": "22.10.2024 (Bekanntmachungsdatum)\n\nBerlin Amtsgericht Berlin (Charlottenburg) HRB 199922\nLöschungsankündigung\n\nGolden Horn Berlin GmbH\nGesellschaft mit beschränkter Haftung\nBerlin\n\nBei der nachstehenden Gesellschaft wird das Amtslöschungsverfahren gemäß § 394 FamFG eingeleitet. Widerspruchsfrist 6 Wochen"
    },
    {
      "date": "2024-10-22",
      "id": "91202",
      "original_text": "Registerbekanntmachung nach dem Umwandlungsgesetz\nBerlin Amtsgericht Berlin (Charlottenburg) HRB 187237\nManuCo GmbH – Berlin",
      "type": "Registerbekanntmachung nach dem Umwandlungsgesetz",
      "state": "Berlin",
      "amtsgericht": "Amtsgericht Berlin (Charlottenburg)",
      "registernummer": "HRB 187237",
      "registerart": "HRB",
      "company_name": "ManuCo GmbH",
      "company_seat": "Berlin",
      "details": "22.10.2024 (Bekanntmachungsdatum)\n\nBerlin Amtsgericht Berlin (Charlottenburg) HRB 187237\nRegisterbekanntmachung nach dem Umwandlungsgesetz 17.10.2024 (Eintragungsdatum)\n\nManuCo GmbH\nGesellschaft mit beschränkter Haftung\nBerlin\n\nZu Eintragungsnummer 11 vom 17.10.2024 wird als nicht eingetragen veröffentlicht:Den Gläubigern der an der Verschmelzung beteiligten Rechtsträger ist, wenn sie binnen sechs Monaten nach dem Tag, an dem die Eintragung der Verschmelzung in das Register des Sitzes desjenigen Rechtsträgers, dessen Gläubiger sie sind, als bekannt gemacht gilt, ihren Anspruch nach Grund und Höhe schriftlich anmelden, Sicherheit zu leisten, soweit sie nicht Befriedigung verlangen können. Dieses Recht steht den Gläubigern jedoch nur zu, wenn sie glaubhaft machen, dass durch die Verschmelzung die Erfüllung ihrer Forderung gefährdet wird. Das Recht, Sicherheitsleistung zu verlangen, steht Gläubigern nicht zu, die im Falle der Insolvenz ein Recht auf vorzugsweise Befriedigung aus einer Deckungsmasse haben, die nach gesetzlicher Vorschrift zu ihrem Schutz errichtet und staatlich überwacht ist."
    },
    {
      "date": "2024-10-22",
      "id": "91203",
      "original_text": "Einreichung neuer Dokumente\nSachsen-Anhalt Amtsgericht Stendal HRB 102726\nGebäude-und Wohnungsbaugesellschaft Wernigerode mbH – Wernigerode",
      "type": "Einreichung neuer Dokumente",
      "state": "Sachsen-Anhalt",
      "amtsgericht": "Amtsgericht Stendal",
      "registernummer": "HRB 102726",
      "registerart": "HRB",
      "company_name": "Gebäude-und Wohnungsbaugesellschaft Wernigerode mbH",
      "company_seat": "Wernigerode",
      "details": "22.10.2024 (Bekanntmachungsdatum)\n\nSachsen-Anhalt Amtsgericht Stendal HRB 102726\nEinreichung neuer Dokumente\n\nGebäude-und Wohnungsbaugesellschaft Wernigerode mbH\nGesellschaft mit beschränkter Haftung\nWernigerode\n\nEine Liste der Mitglieder des Aufsichtsrates wurde zum Handelsregister eingereicht."
    },
    {
      "date": "2024-10-22",
      "id": "91204",
      "original_text": "Einreichung neuer Dokumente\nBerlin Amtsgericht Berlin (Charlottenburg) HRB 117588\nEWN Vermögensanlagen und -beteiligungen Verwaltungsgesellschaft mbH – Berlin",
      "type": "Einreichung neuer Dokumente",
      "state": "Berlin",
      "amtsgericht": "Amtsgericht Berlin (Charlottenburg)",
      "registernummer": "HRB 117588",
      "registerart": "HRB",
      "company_name": "EWN Vermögensanlagen und -beteiligungen Verwaltungsgesellschaft mbH",
      "company_seat": "Berlin",
      "details": "22.10.2024 (Bekanntmachungsdatum)\n\nBerlin Amtsgericht Berlin (Charlottenburg) HRB 117588\nEinreichung neuer Dokumente\n\nEWN Vermögensanlagen und -beteiligungen Verwaltungsgesellschaft mbH\nGesellschaft mit beschränkter Haftung\nBerlin\n\nAls nicht eingetragen wird veröffentlicht: Es wurde eine neue Liste der Beiratsmitglieder eingereicht (§52 GmbHG)."
    },
    {
      "date": "2024-10-22",
      "id": "91205",
      "original_text": "Registerbekanntmachung nach dem Umwandlungsgesetz\nBrandenburg Amtsgericht Cottbus HRB 16494\nNox Capital Holding GmbH – Schönefeld",
      "type": "Registerbekanntmachung nach dem Umwandlungsgesetz",
      "state": "Brandenburg",
      "amtsgericht": "Amtsgericht Cottbus",
      "registernummer": "HRB 16494",
      "registerart": "HRB",
      "company_name": "Nox Capital Holding GmbH",
      "company_seat": "Schönefeld",
      "details": "22.10.2024 (Bekanntmachungsdatum)\n\nBrandenburg Amtsgericht Cottbus HRB 16494\nRegisterbekanntmachung nach dem Umwandlungsgesetz 22.10.2024 (Eintragungsdatum)\n\nNox Capital Holding GmbH\nGesellschaft mit beschränkter Haftung\nSchönefeld\n\nAls nicht eingetragen wird veröffentlicht:\nDen Gläubigern der an der Verschmelzung beteiligten Rechtsträger ist, wenn sie binnen sechs Monaten nach dem Tag, an dem die Eintragung der Verschmelzung in das Register des Sitzes desjenigen Rechtsträgers, dessen Gläubiger sie sind, als bekannt gemacht gilt, ihren Anspruch nach Grund und Höhe schriftlich anmelden, Sicherheit zu leisten, soweit sie nicht Befriedigung verlangen können. Dieses Recht steht den Gläubigern jedoch nur zu, wenn sie glaubhaft machen, dass durch die Verschmelzung die Erfüllung ihrer Forderung gefährdet wird"
    },
    {
      "date": "2024-10-22",
      "id": "91206",
      "original_text": "Sonstige Registerbekanntmachung\nSchleswig-Holstein Amtsgericht Lübeck HRB 22583\nBAADER Holding SE – Lübeck",
      "type": "Sonstige Registerbekanntmachung",
      "state": "Schleswig-Holstein",
      "amtsgericht": "Amtsgericht Lübeck",
      "registernummer": "HRB 22583",
      "registerart": "HRB",
      "company_name": "BAADER Holding SE",
      "company_seat": "Lübeck",
      "details": "22.10.2024 (Bekanntmachungsdatum)\n\nSchleswig-Holstein Amtsgericht Lübeck HRB 22583\nSonstige Registerbekanntmachung\n\nBAADER Holding SE\nEuropäische Aktiengesellschaft (SE)\nLübeck\n\nAls nicht eingetragen wird veröffentlicht: Die Gesellschaft hat eine aktuelle Liste der Verwaltungsratsmitglieder zum Handelsregister eingereicht."
    },
    {
      "date": "2024-10-22",
      "id": "91207",
      "original_text": "Registerbekanntmachung nach dem Umwandlungsgesetz\nBerlin Amtsgericht Berlin (Charlottenburg) HRB 71545\nALLCARGO GmbH – Berlin",
      "type": "Registerbekanntmachung nach dem Umwandlungsgesetz",
      "state": "Berlin",
      "amtsgericht": "Amtsgericht Berlin (Charlottenburg)",
      "registernummer": "HRB 71545",
      "registerart": "HRB",
      "company_name": "ALLCARGO GmbH",
      "company_seat": "Berlin",
      "details": "22.10.2024 (Bekanntmachungsdatum)\n\nBerlin Amtsgericht Berlin (Charlottenburg) HRB 71545\nRegisterbekanntmachung nach dem Umwandlungsgesetz 21.10.2024 (Eintragungsdatum)\n\nALLCARGO GmbH\nGesellschaft mit beschränkter Haftung\nBerlin\n\nZu Eintragungsnummer 5 vom 21.10.2024 wird als nicht eingetragen veröffentlicht: Den Gläubigern der an der Verschmelzung beteiligten Rechtsträger ist, wenn sie binnen sechs Monaten nach dem Tag, an dem die Eintragung der Verschmelzung in das Register des Sitzes desjenigen Rechtsträgers, dessen Gläubiger sie sind, als bekannt gemacht gilt, ihren Anspruch nach Grund und Höhe schriftlich anmelden, Sicherheit zu leisten, soweit sie nicht Befriedigung verlangen können. Dieses Recht steht den Gläubigern jedoch nur zu, wenn sie glaubhaft machen, dass durch die Verschmelzung die Erfüllung ihrer Forderung gefährdet wird. Das Recht, Sicherheitsleistung zu verlangen, steht Gläubigern nicht zu, die im Falle der Insolvenz ein Recht auf vorzugsweise Befriedigung aus einer Deckungsmasse haben, die nach gesetzlicher Vorschrift zu ihrem Schutz errichtet und staatlich überwacht ist."
    },
    {
      "date": "2024-10-22",
      "id": "91208",
      "original_text": "Löschungsankündigung\nSchleswig-Holstein Amtsgericht Kiel HRB 19650\nBTC BUSINESS TRAVEL CLOUD GmbH – Norderstedt",
      "type": "Löschungsankündigung",
      "state": "Schleswig-Holstein",
      "amtsgericht": "Amtsgericht Kiel",
      "registernummer": "HRB 19650",
      "registerart": "HRB",
      "company_name": "BTC BUSINESS TRAVEL CLOUD GmbH",
      "company_seat": "Norderstedt",
      "details": "22.10.2024 (Bekanntmachungsdatum)\n\nSchleswig-Holstein Amtsgericht Kiel HRB 19650\nLöschungsankündigung\n\nBTC BUSINESS TRAVEL CLOUD GmbH\nGesellschaft mit beschränkter Haftung\nNorderstedt\n\nEs ist die Löschung der nachstehenden Gesellschaft wegen Vermögenslosigkeit gemäß § 394 FamFG beabsichtigt. Widerspruchsfrist: 2 Monate."
    },
    {
      "date": "2024-10-22",
      "id": "91209",
      "original_text": "Registerbekanntmachung nach dem Umwandlungsgesetz\nSchleswig-Holstein Amtsgericht Lübeck HRB 20971\nMEG Schmidt Beteiligungsggesellschaft mbH – Ammersbek",
      "type": "Registerbekanntmachung nach dem Umwandlungsgesetz",
      "state": "Schleswig-Holstein",
      "amtsgericht": "Amtsgericht Lübeck",
      "registernummer": "HRB 20971",
      "registerart": "HRB",
      "company_name": "MEG Schmidt Beteiligungsggesellschaft mbH",
      "company_seat": "Ammersbek",
      "details": "22.10.2024 (Bekanntmachungsdatum)\n\nSchleswig-Holstein Amtsgericht Lübeck HRB 20971\nRegisterbekanntmachung nach dem Umwandlungsgesetz 21.10.2024 (Eintragungsdatum)\n\nMEG Schmidt Beteiligungsggesellschaft mbH\nGesellschaft mit beschränkter Haftung\nAmmersbek\n\nZu Eintragungsnummer 2 vom 21.10.2024 wird als nicht eingetragen veröffentlicht:\nDen Gläubigern der an der Verschmelzung beteiligten Rechtsträger ist, wenn sie binnen sechs Monaten nach dem Tag, an dem die Eintragung der Verschmelzung in das Register des Sitzes desjenigen Rechtsträgers, dessen Gläubiger sie sind, als bekannt gemacht gilt, ihren Anspruch nach Grund und Höhe schriftlich anmelden, Sicherheit zu leisten, soweit sie nicht Befriedigung verlangen können. Dieses Recht steht den Gläubigern jedoch nur zu, wenn sie glaubhaft machen, dass durch die Verschmelzung die Erfüllung ihrer Forderung gefährdet wird."
    },
    {
      "date": "2024-10-22",
      "id": "91210",
      "original_text": "Einreichung neuer Dokumente\nBaden-Württemberg Amtsgericht Freiburg HRB 70\nSchluchseewerk Aktiengesellschaft – Laufenburg Baden",
      "type": "Einreichung neuer Dokumente",
      "state": "Baden-Württemberg",
      "amtsgericht": "Amtsgericht Freiburg",
      "registernummer": "HRB 70",
      "registerart": "HRB",
      "company_name": "Schluchseewerk Aktiengesellschaft",
      "company_seat": "Laufenburg Baden",
      "details": "22.10.2024 (Bekanntmachungsdatum)\n\nBaden-Württemberg Amtsgericht Freiburg HRB 70\nEinreichung neuer Dokumente\n\nSchluchseewerk Aktiengesellschaft\nAktiengesellschaft\nLaufenburg Baden\n\nDie Gesellschaft hat am 21.10.2024 die Liste über die Zusammensetzung des Aufsichtsrats zum Handelsregister eingereicht."
    },
    {
      "date": "2024-10-22",
      "id": "91211",
      "original_text": "Registerbekanntmachung nach dem Umwandlungsgesetz\nHamburg Amtsgericht Hamburg HRA 131283\nHHanse Kfz-Technik e.K. – Hamburg",
      "type": "Registerbekanntmachung nach dem Umwandlungsgesetz",
      "state": "Hamburg",
      "amtsgericht": "Amtsgericht Hamburg",
      "registernummer": "HRA 131283",
      "registerart": "HRA",
      "company_name": "HHanse Kfz-Technik e.K.",
      "company_seat": "Hamburg",
      "details": "22.10.2024 (Bekanntmachungsdatum)\n\nHamburg Amtsgericht Hamburg HRA 131283\nRegisterbekanntmachung nach dem Umwandlungsgesetz 22.10.2024 (Eintragungsdatum)\n\nHHanse Kfz-Technik e.K.\nEinzelkaufmann\nHamburg\n\nAls nicht eingetragen wird bekannt gemacht:\nDen Gläubigern der an der Ausgliederung beteiligten Gesellschaften ist, wenn sie binnen sechs Monaten nach dem Tag, an dem die Eintragung der Ausgliederung in das Register des Sitzes desjenigen Rechtsträgers, dessen Gläubiger sie sind, nach § 19 Absatz 3 UmwG als bekannt gemacht gilt, ihren Anspruch nach Grund und Höhe schriftlich anmelden, Sicherheit zu leisten, soweit sie nicht Befriedigung verlangen können. Dieses Recht steht den Gläubigern jedoch nur zu, wenn sie glaubhaft machen, dass durch die Ausgliederung die Erfüllung ihrer Forderung gefährdet wird."
    },
    {
      "date": "2024-10-22",
      "id": "91212",
      "original_text": "Löschungsankündigung\nBrandenburg Amtsgericht Potsdam HRB 26530\nabp Teltow GmbH -Ambulante Beatmungs- und Palliativ-Pflege- – Teltow",
      "type": "Löschungsankündigung",
      "state": "Brandenburg",
      "amtsgericht": "Amtsgericht Potsdam",
      "registernummer": "HRB 26530",
      "registerart": "HRB",
      "company_name": "abp Teltow GmbH -Ambulante Beatmungs- und Palliativ-Pflege-",
      "company_seat": "Teltow",
      "details": "22.10.2024 (Bekanntmachungsdatum)\n\nBrandenburg Amtsgericht Potsdam HRB 26530\nLöschungsankündigung\n\nabp Teltow GmbH -Ambulante Beatmungs- und Palliativ-Pflege-\nGesellschaft mit beschränkter Haftung\nTeltow\n\nBei der nachstehenden Gesellschaft wird das Amtslöschungsverfahren gemäß § 394 FamFG eingeleitet. Widerspruchsfrist: 8 Wochen."
    },
    {
      "date": "2024-10-22",
      "id": "91213",
      "original_text": "Löschungsankündigung\nBrandenburg Amtsgericht Potsdam HRB 25120\nDining-Table GmbH – Potsdam",
      "type": "Löschungsankündigung",
      "state": "Brandenburg",
      "amtsgericht": "Amtsgericht Potsdam",
      "registernummer": "HRB 25120",
      "registerart": "HRB",
      "company_name": "Dining-Table GmbH",
      "company_seat": "Potsdam",
      "details": "22.10.2024 (Bekanntmachungsdatum)\n\nBrandenburg Amtsgericht Potsdam HRB 25120\nLöschungsankündigung\n\nDining-Table GmbH\nGesellschaft mit beschränkter Haftung\nPotsdam\n\nBei der nachstehenden Gesellschaft wird das Amtslöschungsverfahren gemäß § 394 FamFG eingeleitet. Widerspruchsfrist: 8 Wochen."
    },
    {
      "date": "2024-10-22",
      "id": "91214",
      "original_text": "Registerbekanntmachung nach dem Umwandlungsgesetz\nSchleswig-Holstein Amtsgericht Lübeck HRB 20849\nLecker Luke GmbH – Ammersbek",
      "type": "Registerbekanntmachung nach dem Umwandlungsgesetz",
      "state": "Schleswig-Holstein",
      "amtsgericht": "Amtsgericht Lübeck",
      "registernummer": "HRB 20849",
      "registerart": "HRB",
      "company_name": "Lecker Luke GmbH",
      "company_seat": "Ammersbek",
      "details": "22.10.2024 (Bekanntmachungsdatum)\n\nSchleswig-Holstein Amtsgericht Lübeck HRB 20849\nRegisterbekanntmachung nach dem Umwandlungsgesetz 21.10.2024 (Eintragungsdatum)\n\nLecker Luke GmbH\nGesellschaft mit beschränkter Haftung\nAmmersbek\n\nZu Eintragungsnummer 2 vom 21.10.2024 wird als nicht eingetragen veröffentlicht:  Den Gläubigern der an der Verschmelzung beteiligten Rechtsträger ist, wenn sie binnen sechs Monaten nach dem Tag, an dem die Eintragung der Verschmelzung in das Register des Sitzes desjenigen Rechtsträgers, dessen Gläubiger sie sind, als bekannt gemacht gilt, ihren Anspruch nach Grund und Höhe schriftlich anmelden, Sicherheit zu leisten, soweit sie nicht Befriedigung verlangen können. Dieses Recht steht den Gläubigern jedoch nur zu, wenn sie glaubhaft machen, dass durch die Verschmelzung die Erfüllung ihrer Forderung gefährdet wird."
    },
    {
      "date": "2024-10-22",
      "id": "91215",
      "original_text": "Einreichung neuer Dokumente\nBrandenburg Amtsgericht Cottbus HRB 8327\nLausitz Energie Kraftwerke AG – Cottbus",
      "type": "Einreichung neuer Dokumente",
      "state": "Brandenburg",
      "amtsgericht": "Amtsgericht Cottbus",
      "registernummer": "HRB 8327",
      "registerart": "HRB",
      "company_name": "Lausitz Energie Kraftwerke AG",
      "company_seat": "Cottbus",
      "details": "22.10.2024 (Bekanntmachungsdatum)\n\nBrandenburg Amtsgericht Cottbus HRB 8327\nEinreichung neuer Dokumente\n\nLausitz Energie Kraftwerke AG\nAktiengesellschaft\nCottbus\n\nDie aktuelle Liste der Aufsichtsratsmitglieder wurde zum Handelsregister gem. § 106 AktG eingereicht."
    },
    {
      "date": "2024-10-22",
      "id": "91216",
      "original_text": "Löschungsankündigung\nBrandenburg Amtsgericht Potsdam HRB 24641\nPorta Helena GmbH – Werder (Havel)",
      "type": "Löschungsankündigung",
      "state": "Brandenburg",
      "amtsgericht": "Amtsgericht Potsdam",
      "registernummer": "HRB 24641",
      "registerart": "HRB",
      "company_name": "Porta Helena GmbH",
      "company_seat": "Werder (Havel)",
      "details": "22.10.2024 (Bekanntmachungsdatum)\n\nBrandenburg Amtsgericht Potsdam HRB 24641\nLöschungsankündigung\n\nPorta Helena GmbH\nGesellschaft mit beschränkter Haftung\nWerder (Havel)\n\nBei der nachstehenden Gesellschaft wird das Amtslöschungsverfahren gemäß § 394 FamFG eingeleitet. Widerspruchsfrist: 8 Wochen"
    },
    {
      "date": "2024-10-22",
      "id": "91217",
      "original_text": "Registerbekanntmachung nach dem Umwandlungsgesetz\nBaden-Württemberg Amtsgericht Mannheim HRB 745773\nALEX & GROSS Performance Mannheim GmbH – Mannheim",
      "type": "Registerbekanntmachung nach dem Umwandlungsgesetz",
      "state": "Baden-Württemberg",
      "amtsgericht": "Amtsgericht Mannheim",
      "registernummer": "HRB 745773",
      "registerart": "HRB",
      "company_name": "ALEX & GROSS Performance Mannheim GmbH",
      "company_seat": "Mannheim",
      "details": "22.10.2024 (Bekanntmachungsdatum)\n\nBaden-Württemberg Amtsgericht Mannheim HRB 745773\nRegisterbekanntmachung nach dem Umwandlungsgesetz 17.10.2024 (Eintragungsdatum)\n\nALEX & GROSS Performance Mannheim GmbH\nGesellschaft mit beschränkter Haftung\nMannheim\n\nAls nicht eingetragen wird bekanntgemacht:\nDen Gläubigern der an der Verschmelzung beteiligten Rechtsträger ist, wenn sie binnen sechs Monaten nach dem Tag, an dem die Eintragung der Verschmelzung in das Register des Sitzes desjenigen Rechtsträgers, dessen Gläubiger sie sind, nach § 19 Abs. 3 UmwG als bekanntgemacht gilt, ihren Anspruch nach Grund und Höhe schriftlich anmelden, Sicherheit zu leisten, soweit sie nicht Befriedigung verlangen können. Dieses Recht steht den Gläubigern jedoch nur zu, wenn sie glaubhaft machen, dass durch die Verschmelzung die Erfüllung ihrer Forderung gefährdet wird."
    },
    {
      "date": "2024-10-22",
      "id": "91218",
      "original_text": "Registerbekanntmachung nach dem Umwandlungsgesetz\nNordrhein-Westfalen Amtsgericht Coesfeld HRA 9989\nGetränkedienstleistungen Beuting e. K. – Vreden",
      "type": "Registerbekanntmachung nach dem Umwandlungsgesetz",
      "state": "Nordrhein-Westfalen",
      "amtsgericht": "Amtsgericht Coesfeld",
      "registernummer": "HRA 9989",
      "registerart": "HRA",
      "company_name": "Getränkedienstleistungen Beuting e. K.",
      "company_seat": "Vreden",
      "details": "22.10.2024 (Bekanntmachungsdatum)\n\nNordrhein-Westfalen Amtsgericht Coesfeld HRA 9989\nRegisterbekanntmachung nach dem Umwandlungsgesetz 22.10.2024 (Eintragungsdatum)\n\nGetränkedienstleistungen Beuting e. K.\nEinzelkaufmann\nVreden\n\nDen Gläubigern der an der Ausgliederung beteiligten Rechtsträger ist, wenn sie binnen sechs Monaten nach dem Tag, an dem die Eintragung der Ausgliederung in das Register des Sitzes desjenigen Rechtsträgers, dessen Gläubiger sie sind, nach § 19 Absatz 3 UmwG als bekanntgemacht gilt, ihren Anspruch nach Grund und Höhe schriftlich anmelden, Sicherheit zu leisten, soweit sie nicht Befriedigung verlangen können. Dieses Recht steht den Gläubigern jedoch nur zu, wenn sie glaubhaft machen, dass durch die Erfüllung ihrer Forderung gefährdet wird."
    },
    {
      "date": "2024-10-22",
      "id": "91219",
      "original_text": "Löschungsankündigung\nBrandenburg Amtsgericht Potsdam HRB 380\nPotsdamer Chemiehandelsgesellschaft mbH – Potsdam",
      "type": "Löschungsankündigung",
      "state": "Brandenburg",
      "amtsgericht": "Amtsgericht Potsdam",
      "registernummer": "HRB 380",
      "registerart": "HRB",
      "company_name": "Potsdamer Chemiehandelsgesellschaft mbH",
      "company_seat": "Potsdam",
      "details": "22.10.2024 (Bekanntmachungsdatum)\n\nBrandenburg Amtsgericht Potsdam HRB 380\nLöschungsankündigung\n\nPotsdamer Chemiehandelsgesellschaft mbH\nGesellschaft mit beschränkter Haftung\nPotsdam\n\nBei der nachstehenden Gesellschaft wird das Amtslöschungsverfahren gemäß § 394 FamFG eingeleitet. Widerspruchsfrist: 8 Wochen."
    },
    {
      "date": "2024-10-22",
      "id": "91220",
      "original_text": "Einreichung neuer Dokumente\nBrandenburg Amtsgericht Potsdam HRB 24473\nTranscom Essen GmbH – Potsdam",
      "type": "Einreichung neuer Dokumente",
      "state": "Brandenburg",
      "amtsgericht": "Amtsgericht Potsdam",
      "registernummer": "HRB 24473",
      "registerart": "HRB",
      "company_name": "Transcom Essen GmbH",
      "company_seat": "Potsdam",
      "details": "22.10.2024 (Bekanntmachungsdatum)\n\nBrandenburg Amtsgericht Potsdam HRB 24473\nEinreichung neuer Dokumente\n\nTranscom Essen GmbH\nGesellschaft mit beschränkter Haftung\nPotsdam\n\nAls nicht eingetragen wird veröffentlicht: Eine Liste der Mitglieder des Aufsichtsrates wurde zum Handelsregister eingereicht."
    },
    {
      "date": "2024-10-22",
      "id": "91221",
      "original_text": "Löschungsankündigung\nHamburg Amtsgericht Hamburg VR 7628\nSchulverein Friedrich-Manshardt e.V. – Hamburg",
      "type": "Löschungsankündigung",
      "state": "Hamburg",
      "amtsgericht": "Amtsgericht Hamburg",
      "registernummer": "VR 7628",
      "registerart": "VR",
      "company_name": "Schulverein Friedrich-Manshardt e.V.",
      "company_seat": "Hamburg",
      "details": "22.10.2024 (Bekanntmachungsdatum)\n\nHamburg Amtsgericht Hamburg VR 7628\nLöschungsankündigung\n\nSchulverein Friedrich-Manshardt e.V.\neingetragener Verein\nHamburg\n\nDas Registergericht beabsichtigt, den im Vereinsregister eingetragenen Verein von Amts wegen nach § 395 FamFG zu löschen, da nach den angestellten Ermittlungen dieser Verein offenbar nicht mehr besteht. Die Frist zur Erhebung eines Widerspruchs gegen die beabsichtigte Löschung wird auf 3 Monate festgesetzt."
    },
    {
      "date": "2024-10-22",
      "id": "91222",
      "original_text": "Einreichung neuer Dokumente\nThüringen Amtsgericht Jena HRB 105037\n\"Stadtwerke Weimar Stadtversorgungs-GmbH\" – Weimar",
      "type": "Einreichung neuer Dokumente",
      "state": "Thüringen",
      "amtsgericht": "Amtsgericht Jena",
      "registernummer": "HRB 105037",
      "registerart": "HRB",
      "company_name": "\"Stadtwerke Weimar Stadtversorgungs-GmbH\"",
      "company_seat": "Weimar",
      "details": "22.10.2024 (Bekanntmachungsdatum)\n\nThüringen Amtsgericht Jena HRB 105037\nEinreichung neuer Dokumente\n\n\"Stadtwerke Weimar Stadtversorgungs-GmbH\"\nGesellschaft mit beschränkter Haftung\nWeimar\n\nBekanntmachung gem. § 52 Abs. 3 Satz 2 GmbHG: Aufgrund einer Veränderung in den Personen der Aufsichtsratsmitglieder ist durch die Geschäftsführer eine neue Liste zum Handelsregister eingereicht worden."
    },
    {
      "date": "2024-10-22",
      "id": "91223",
      "original_text": "Einreichung neuer Dokumente\nBerlin Amtsgericht Berlin (Charlottenburg) HRB 264843\nZentiva AG – Berlin",
      "type": "Einreichung neuer Dokumente",
      "state": "Berlin",
      "amtsgericht": "Amtsgericht Berlin (Charlottenburg)",
      "registernummer": "HRB 264843",
      "registerart": "HRB",
      "company_name": "Zentiva AG",
      "company_seat": "Berlin",
      "details": "22.10.2024 (Bekanntmachungsdatum)\n\nBerlin Amtsgericht Berlin (Charlottenburg) HRB 264843\nEinreichung neuer Dokumente\n\nZentiva AG\nAktiengesellschaft\nBerlin\n\nAls nicht eingetragen wird veröffentlicht:\nEs wurde eine neue Liste der Aufsichtsratsmitglieder eingereicht (§ 106 AktG)."
    },
    {
      "date": "2024-10-22",
      "id": "91224",
      "original_text": "Einreichung neuer Dokumente\nBaden-Württemberg Amtsgericht Freiburg HRB 704231\nModerne Kommunikationstechnologie Hohentengen Gesellschaft mit beschränkter Haftung – Hohentengen am Hochrhein",
      "type": "Einreichung neuer Dokumente",
      "state": "Baden-Württemberg",
      "amtsgericht": "Amtsgericht Freiburg",
      "registernummer": "HRB 704231",
      "registerart": "HRB",
      "company_name": "Moderne Kommunikationstechnologie Hohentengen Gesellschaft mit beschränkter Haftung",
      "company_seat": "Hohentengen am Hochrhein",
      "details": "22.10.2024 (Bekanntmachungsdatum)\n\nBaden-Württemberg Amtsgericht Freiburg HRB 704231\nEinreichung neuer Dokumente\n\nModerne Kommunikationstechnologie Hohentengen Gesellschaft mit beschränkter Haftung\nGesellschaft mit beschränkter Haftung\nHohentengen am Hochrhein\n\nDie Gesellschaft hat am 16.10.2024 die Liste über die Zusammensetzung des Aufsichtsrats zum Handelsregister eingereicht."
    },
    {
      "date": "2024-10-22",
      "id": "91225",
      "original_text": "Einreichung neuer Dokumente\nSchleswig-Holstein Amtsgericht Pinneberg HRB 37 IZ\nItzehoer Versicherung/Brandgilde von 1691 Versicherungsverein auf Gegenseitigkeit – Itzehoe",
      "type": "Einreichung neuer Dokumente",
      "state": "Schleswig-Holstein",
      "amtsgericht": "Amtsgericht Pinneberg",
      "registernummer": "HRB 37 IZ",
      "registerart": "HRB",
      "company_name": "Itzehoer Versicherung/Brandgilde von 1691 Versicherungsverein auf Gegenseitigkeit",
      "company_seat": "Itzehoe",
      "details": "22.10.2024 (Bekanntmachungsdatum)\n\nSchleswig-Holstein Amtsgericht Pinneberg HRB 37 IZ\nEinreichung neuer Dokumente\n\nItzehoer Versicherung/Brandgilde von 1691 Versicherungsverein auf Gegenseitigkeit\nVersicherungsverein auf Gegenseitigkeit\nItzehoe\n\nAls nicht eingetragen wird veröffentlicht: Es wurde eine neue Liste der Aufsichtsratsmitglieder gem. § 106 AktG zum Handelsregister eingereicht."
    },
    {
      "date": "2024-10-22",
      "id": "91226",
      "original_text": "Registerbekanntmachung nach dem Umwandlungsgesetz\nHamburg Amtsgericht Hamburg HRB 182345\nJaMoin Consulting GmbH – Hamburg",
      "type": "Registerbekanntmachung nach dem Umwandlungsgesetz",
      "state": "Hamburg",
      "amtsgericht": "Amtsgericht Hamburg",
      "registernummer": "HRB 182345",
      "registerart": "HRB",
      "company_name": "JaMoin Consulting GmbH",
      "company_seat": "Hamburg",
      "details": "22.10.2024 (Bekanntmachungsdatum)\n\nHamburg Amtsgericht Hamburg HRB 182345\nRegisterbekanntmachung nach dem Umwandlungsgesetz 22.10.2024 (Eintragungsdatum)\n\nJaMoin Consulting GmbH\nGesellschaft mit beschränkter Haftung\nHamburg\n\nAls nicht eingetragen wird bekannt gemacht:\nDen Gläubigern der an der Verschmelzung beteiligten Gesellschaften ist, wenn sie binnen sechs Monaten nach dem Tag, an dem die Eintragung der Verschmelzung in das Register des Sitzes desjenigen Rechtsträgers, dessen Gläubiger sie sind, nach § 19 Absatz 3 UmwG als bekannt gemacht gilt, ihren Anspruch nach Grund und Höhe schriftlich anmelden, Sicherheit zu leisten, soweit sie nicht Befriedigung verlangen können. Dieses Recht steht den Gläubigern jedoch nur zu, wenn sie glaubhaft machen, dass durch die Verschmelzung die Erfüllung ihrer Forderung gefährdet wird."
    },
    {
      "date": "2024-10-22",
      "id": "91227",
      "original_text": "Registerbekanntmachung nach dem Umwandlungsgesetz\nHamburg Amtsgericht Hamburg HRB 180624\nCorymbia GmbH – Hamburg",
      "type": "Registerbekanntmachung nach dem Umwandlungsgesetz",
      "state": "Hamburg",
      "amtsgericht": "Amtsgericht Hamburg",
      "registernummer": "HRB 180624",
      "registerart": "HRB",
      "company_name": "Corymbia GmbH",
      "company_seat": "Hamburg",
      "details": "22.10.2024 (Bekanntmachungsdatum)\n\nHamburg Amtsgericht Hamburg HRB 180624\nRegisterbekanntmachung nach dem Umwandlungsgesetz 22.10.2024 (Eintragungsdatum)\n\nCorymbia GmbH\nGesellschaft mit beschränkter Haftung\nHamburg\n\nAls nicht eingetragen wird bekannt gemacht:\nDen Gläubigern der an der Verschmelzung beteiligten Gesellschaften ist, wenn sie binnen sechs Monaten nach dem Tag, an dem die Eintragung der Verschmelzung in das Register des Sitzes desjenigen Rechtsträgers, dessen Gläubiger sie sind, nach § 19 Absatz 3 UmwG als bekannt gemacht gilt, ihren Anspruch nach Grund und Höhe schriftlich anmelden, Sicherheit zu leisten, soweit sie nicht Befriedigung verlangen können. Dieses Recht steht den Gläubigern jedoch nur zu, wenn sie glaubhaft machen, dass durch die Verschmelzung die Erfüllung ihrer Forderung gefährdet wird."
    },
    {
      "date": "2024-10-22",
      "id": "91228",
      "original_text": "Registerbekanntmachung nach dem Umwandlungsgesetz\nBrandenburg Amtsgericht Frankfurt/Oder HRB 14261\nHELIOS Hausservice Mitte-Nord GmbH – Bad Saarow",
      "type": "Registerbekanntmachung nach dem Umwandlungsgesetz",
      "state": "Brandenburg",
      "amtsgericht": "Amtsgericht Frankfurt/Oder",
      "registernummer": "HRB 14261",
      "registerart": "HRB",
      "company_name": "HELIOS Hausservice Mitte-Nord GmbH",
      "company_seat": "Bad Saarow",
      "details": "22.10.2024 (Bekanntmachungsdatum)\n\nBrandenburg Amtsgericht Frankfurt/Oder HRB 14261\nRegisterbekanntmachung nach dem Umwandlungsgesetz 21.10.2024 (Eintragungsdatum)\n\nHELIOS Hausservice Mitte-Nord GmbH\nGesellschaft mit beschränkter Haftung\nBad Saarow\n\nZu Eintragungsnummer 6 vom 21.10.2024 wird als nicht eingetragen veröffentlicht:\nDen Gläubigern der an der Verschmelzung beteiligten Rechtsträger ist, wenn sie binnen sechs Monaten nach dem Tag, an dem die Eintragung der Verschmelzung in das Register des Sitzes desjenigen Rechtsträgers, dessen Gläubiger sie sind, als bekannt gemacht gilt, ihren Anspruch nach Grund und Höhe schriftlich anmelden, Sicherheit zu leisten, soweit sie nicht Befriedigung verlangen können. Dieses Recht steht den Gläubigern jedoch nur zu, wenn sie glaubhaft machen, dass durch die Verschmelzung die Erfüllung ihrer Forderung gefährdet wird"
    },
    {
      "date": "2024-10-22",
      "id": "91229",
      "original_text": "Löschungsankündigung\nSachsen-Anhalt Amtsgericht Stendal HRA 21177\nStadtteilkaufhaus Lübecker Straße GmbH & Co.KG – Magdeburg",
      "type": "Löschungsankündigung",
      "state": "Sachsen-Anhalt",
      "amtsgericht": "Amtsgericht Stendal",
      "registernummer": "HRA 21177",
      "registerart": "HRA",
      "company_name": "Stadtteilkaufhaus Lübecker Straße GmbH & Co.KG",
      "company_seat": "Magdeburg",
      "details": "22.10.2024 (Bekanntmachungsdatum)\n\nSachsen-Anhalt Amtsgericht Stendal HRA 21177\nLöschungsankündigung 19.09.2024 (Eintragungsdatum)\n\nStadtteilkaufhaus Lübecker Straße GmbH & Co.KG\nKommanditgesellschaft\nMagdeburg\n\nDas Registergericht beabsichtigt, nachfolgende im Handelregister eingetragene Gesellschaft von Amts wegen nach § 394 FamFG zu löschen. Die Frist zu Erhebung eines Widerspruchs wird auf drei Monate festgesetzt."
    },
    {
      "date": "2024-10-22",
      "id": "91230",
      "original_text": "Löschungsankündigung\nBerlin Amtsgericht Berlin (Charlottenburg) HRB 175486\nPelmeni Ventures UG (haftungsbeschränkt) – Berlin",
      "type": "Löschungsankündigung",
      "state": "Berlin",
      "amtsgericht": "Amtsgericht Berlin (Charlottenburg)",
      "registernummer": "HRB 175486",
      "registerart": "HRB",
      "company_name": "Pelmeni Ventures UG (haftungsbeschränkt)",
      "company_seat": "Berlin",
      "details": "22.10.2024 (Bekanntmachungsdatum)\n\nBerlin Amtsgericht Berlin (Charlottenburg) HRB 175486\nLöschungsankündigung\n\nPelmeni Ventures UG (haftungsbeschränkt)\nGesellschaft mit beschränkter Haftung\nBerlin\n\nBei der nachstehenden Gesellschaft wird das Amtslöschungsverfahren gemäß § 394 FamFG eingeleitet. Widerspruchsfrist 6 Wochen"
    },
    {
      "date": "2024-10-22",
      "id": "91231",
      "original_text": "Löschungsankündigung\nBrandenburg Amtsgericht Potsdam HRB 23813\nRENETEC GmbH – Trebbin",
      "type": "Löschungsankündigung",
      "state": "Brandenburg",
      "amtsgericht": "Amtsgericht Potsdam",
      "registernummer": "HRB 23813",
      "registerart": "HRB",
      "company_name": "RENETEC GmbH",
      "company_seat": "Trebbin",
      "details": "22.10.2024 (Bekanntmachungsdatum)\n\nBrandenburg Amtsgericht Potsdam HRB 23813\nLöschungsankündigung\n\nRENETEC GmbH\nGesellschaft mit beschränkter Haftung\nTrebbin\n\nBei der nachstehenden Gesellschaft wird das Amtslöschungsverfahren gemäß § 394 FamFG eingeleitet. Widerspruchsfrist: 8 Wochen."
    },
    {
      "date": "2024-10-22",
      "id": "91232",
      "original_text": "Sonstige Registerbekanntmachung\nBerlin Amtsgericht Berlin (Charlottenburg) HRB 196998\nCobalt Temporary Solutions GmbH – Berlin",
      "type": "Sonstige Registerbekanntmachung",
      "state": "Berlin",
      "amtsgericht": "Amtsgericht Berlin (Charlottenburg)",
      "registernummer": "HRB 196998",
      "registerart": "HRB",
      "company_name": "Cobalt Temporary Solutions GmbH",
      "company_seat": "Berlin",
      "details": "22.10.2024 (Bekanntmachungsdatum)\n\nBerlin Amtsgericht Berlin (Charlottenburg) HRB 196998\nSonstige Registerbekanntmachung\n\nCobalt Temporary Solutions GmbH\nGesellschaft mit beschränkter Haftung\nBerlin\n\nAls nicht eingetragen wird veröffentlicht: Der andere Vertragsteil hat den Gläubigern dieses Rechtsträgers, deren Forderungen begründet worden sind, bevor die Eintragung der Beendigung dieses Vertrages in das Handelsregister nach § 10 des Handelsgesetzbuches als bekannt gemacht gilt, Sicherheit zu leisten, wenn sie sich binnen sechs Monaten nach der Bekanntmachung der Eintragung zu diesem Zweck bei ihm melden. Dieses Recht steht den Gläubigern nicht zu, die im Fall des Insolvenzverfahrens ein Recht auf vorzugsweise Befriedigung aus der Deckungsmasse haben, die nach gesetzlicher Vorschrift zu ihrem Schutz errichtet und staatlich überwacht ist."
    },
    {
      "date": "2024-10-22",
      "id": "91233",
      "original_text": "Einreichung neuer Dokumente\nBerlin Amtsgericht Berlin (Charlottenburg) HRB 175497\neClear Aktiengesellschaft – Berlin",
      "type": "Einreichung neuer Dokumente",
      "state": "Berlin",
      "amtsgericht": "Amtsgericht Berlin (Charlottenburg)",
      "registernummer": "HRB 175497",
      "registerart": "HRB",
      "company_name": "eClear Aktiengesellschaft",
      "company_seat": "Berlin",
      "details": "22.10.2024 (Bekanntmachungsdatum)\n\nBerlin Amtsgericht Berlin (Charlottenburg) HRB 175497\nEinreichung neuer Dokumente\n\neClear Aktiengesellschaft\nAktiengesellschaft\nBerlin\n\nAls nicht eingetragen wird veröffentlicht:"
    },
    {
      "date": "2024-10-22",
      "id": "91234",
      "original_text": "Löschungsankündigung\nBerlin Amtsgericht Berlin (Charlottenburg) HRB 216340\nI.B. Konstrukt GmbH – Berlin",
      "type": "Löschungsankündigung",
      "state": "Berlin",
      "amtsgericht": "Amtsgericht Berlin (Charlottenburg)",
      "registernummer": "HRB 216340",
      "registerart": "HRB",
      "company_name": "I.B. Konstrukt GmbH",
      "company_seat": "Berlin",
      "details": "22.10.2024 (Bekanntmachungsdatum)\n\nBerlin Amtsgericht Berlin (Charlottenburg) HRB 216340\nLöschungsankündigung\n\nI.B. Konstrukt GmbH\nGesellschaft mit beschränkter Haftung\nBerlin\n\nBei der nachstehenden Gesellschaft wird das Amtslöschungsverfahren gemäß § 394 FamFG eingeleitet. Widerspruchsfrist: 6 Wochen."
    },
    {
      "date": "2024-10-22",
      "id": "91235",
      "original_text": "Registerbekanntmachung nach dem Umwandlungsgesetz\nBerlin Amtsgericht Berlin (Charlottenburg) HRB 221201\nBETTER DAYS GmbH – Berlin",
      "type": "Registerbekanntmachung nach dem Umwandlungsgesetz",
      "state": "Berlin",
      "amtsgericht": "Amtsgericht Berlin (Charlottenburg)",
      "registernummer": "HRB 221201",
      "registerart": "HRB",
      "company_name": "BETTER DAYS GmbH",
      "company_seat": "Berlin",
      "details": "22.10.2024 (Bekanntmachungsdatum)\n\nBerlin Amtsgericht Berlin (Charlottenburg) HRB 221201\nRegisterbekanntmachung nach dem Umwandlungsgesetz 18.10.2024 (Eintragungsdatum)\n\nBETTER DAYS GmbH\nGesellschaft mit beschränkter Haftung\nBerlin\n\nZu Eintragungsnummer 3 vom 18.10.2024 wird als nicht eingetragen veröffentlicht:Den Gläubigern der an der Verschmelzung beteiligten Rechtsträger ist, wenn sie binnen sechs Monaten nach dem Tag, an dem die Eintragung der Verschmelzung in das Register des Sitzes desjenigen Rechtsträgers, dessen Gläubiger sie sind, als bekannt gemacht gilt, ihren Anspruch nach Grund und Höhe schriftlich anmelden, Sicherheit zu leisten, soweit sie nicht Befriedigung verlangen können. Dieses Recht steht den Gläubigern jedoch nur zu, wenn sie glaubhaft machen, dass durch die Verschmelzung die Erfüllung ihrer Forderung gefährdet wird. Das Recht, Sicherheitsleistung zu verlangen, steht Gläubigern nicht zu, die im Falle der Insolvenz ein Recht auf vorzugsweise Befriedigung aus einer Deckungsmasse haben, die nach gesetzlicher Vorschrift zu ihrem Schutz errichtet und staatlich überwacht ist."
    },
    {
      "date": "2024-10-22",
      "id": "91236",
      "original_text": "Registerbekanntmachung nach dem Umwandlungsgesetz\nBerlin Amtsgericht Berlin (Charlottenburg) HRB 220233\nLANGE MTECH GmbH – Berlin",
      "type": "Registerbekanntmachung nach dem Umwandlungsgesetz",
      "state": "Berlin",
      "amtsgericht": "Amtsgericht Berlin (Charlottenburg)",
      "registernummer": "HRB 220233",
      "registerart": "HRB",
      "company_name": "LANGE MTECH GmbH",
      "company_seat": "Berlin",
      "details": "22.10.2024 (Bekanntmachungsdatum)\n\nBerlin Amtsgericht Berlin (Charlottenburg) HRB 220233\nRegisterbekanntmachung nach dem Umwandlungsgesetz 18.10.2024 (Eintragungsdatum)\n\nLANGE MTECH GmbH\nGesellschaft mit beschränkter Haftung\nBerlin\n\nZu Eintragungsnummer 2 vom 18.10.2024 wird als nicht eingetragen veröffentlicht:Den Gläubigern der an der Verschmelzung beteiligten Rechtsträger ist, wenn sie binnen sechs Monaten nach dem Tag, an dem die Eintragung der Verschmelzung in das Register des Sitzes desjenigen Rechtsträgers, dessen Gläubiger sie sind, als bekannt gemacht gilt, ihren Anspruch nach Grund und Höhe schriftlich anmelden, Sicherheit zu leisten, soweit sie nicht Befriedigung verlangen können. Dieses Recht steht den Gläubigern jedoch nur zu, wenn sie glaubhaft machen, dass durch die Verschmelzung die Erfüllung ihrer Forderung gefährdet wird. Das Recht, Sicherheitsleistung zu verlangen, steht Gläubigern nicht zu, die im Falle der Insolvenz ein Recht auf vorzugsweise Befriedigung aus einer Deckungsmasse haben, die nach gesetzlicher Vorschrift zu ihrem Schutz errichtet und staatlich überwacht ist."
    },
    {
      "date": "2024-10-22",
      "id": "91237",
      "original_text": "Einreichung neuer Dokumente\nMecklenburg-Vorpommern Amtsgericht Stralsund HRB 2934\nWohnungsgesellschaft Sagard GmbH – Sagard",
      "type": "Einreichung neuer Dokumente",
      "state": "Mecklenburg-Vorpommern",
      "amtsgericht": "Amtsgericht Stralsund",
      "registernummer": "HRB 2934",
      "registerart": "HRB",
      "company_name": "Wohnungsgesellschaft Sagard GmbH",
      "company_seat": "Sagard",
      "details": "22.10.2024 (Bekanntmachungsdatum)\n\nMecklenburg-Vorpommern Amtsgericht Stralsund HRB 2934\nEinreichung neuer Dokumente\n\nWohnungsgesellschaft Sagard GmbH\nGesellschaft mit beschränkter Haftung\nSagard\n\nEine Liste der Mitglieder des Aufsichtsrats ist zum Handelsregister eingereicht worden."
    },
    {
      "date": "2024-10-22",
      "id": "91238",
      "original_text": "Registerbekanntmachung nach dem Umwandlungsgesetz\nBaden-Württemberg Amtsgericht Mannheim HRB 752407\nj&s-soft AG – Heidelberg",
      "type": "Registerbekanntmachung nach dem Umwandlungsgesetz",
      "state": "Baden-Württemberg",
      "amtsgericht": "Amtsgericht Mannheim",
      "registernummer": "HRB 752407",
      "registerart": "HRB",
      "company_name": "j&s-soft AG",
      "company_seat": "Heidelberg",
      "details": "22.10.2024 (Bekanntmachungsdatum)\n\nBaden-Württemberg Amtsgericht Mannheim HRB 752407\nRegisterbekanntmachung nach dem Umwandlungsgesetz 22.10.2024 (Eintragungsdatum)\n\nj&s-soft AG\nAktiengesellschaft\nHeidelberg\n\nDen Gläubigern des an dem Formwechsel beteiligten Rechtsträgers ist, wenn sie binnen sechs Monaten nach dem Tag, an dem die Eintragung des Formwechsels in das Register des Sitzes desjenigen Rechtsträgers, dessen Gläubiger sie sind, nach § 19 Abs. 3 UmwG als bekanntgemacht gilt, ihren Anspruch nach Grund und Höhe schriftlich anmelden, Sicherheit zu leisten, soweit sie nicht Befriedigung verlangen können. Dieses Recht steht den Gläubigern jedoch nur zu, wenn sie glaubhaft machen, dass durch den Formwechsel die Erfüllung ihrer Forderung gefährdet wird."
    },
    {
      "date": "2024-10-22",
      "id": "91239",
      "original_text": "Registerbekanntmachung nach dem Umwandlungsgesetz\nBaden-Württemberg Amtsgericht Mannheim HRB 337601\nj&s-soft GmbH – Heidelberg",
      "type": "Registerbekanntmachung nach dem Umwandlungsgesetz",
      "state": "Baden-Württemberg",
      "amtsgericht": "Amtsgericht Mannheim",
      "registernummer": "HRB 337601",
      "registerart": "HRB",
      "company_name": "j&s-soft GmbH",
      "company_seat": "Heidelberg",
      "details": "22.10.2024 (Bekanntmachungsdatum)\n\nBaden-Württemberg Amtsgericht Mannheim HRB 337601\nRegisterbekanntmachung nach dem Umwandlungsgesetz 22.10.2024 (Eintragungsdatum)\n\nj&s-soft GmbH\nGesellschaft mit beschränkter Haftung\nHeidelberg\n\nDen Gläubigern des an dem Formwechsel beteiligten Rechtsträgers ist, wenn sie binnen sechs Monaten nach dem Tag, an dem die Eintragung des Formwechsels in das Register des Sitzes desjenigen Rechtsträgers, dessen Gläubiger sie sind, nach § 19 Abs. 3 UmwG als bekanntgemacht gilt, ihren Anspruch nach Grund und Höhe schriftlich anmelden, Sicherheit zu leisten, soweit sie nicht Befriedigung verlangen können. Dieses Recht steht den Gläubigern jedoch nur zu, wenn sie glaubhaft machen, dass durch den Formwechsel die Erfüllung ihrer Forderung gefährdet wird."
    },
    {
      "date": "2024-10-22",
      "id": "91240",
      "original_text": "Einreichung neuer Dokumente\nBerlin Amtsgericht Berlin (Charlottenburg) HRB 97140\nBASF Services Europe GmbH – Berlin",
      "type": "Einreichung neuer Dokumente",
      "state": "Berlin",
      "amtsgericht": "Amtsgericht Berlin (Charlottenburg)",
      "registernummer": "HRB 97140",
      "registerart": "HRB",
      "company_name": "BASF Services Europe GmbH",
      "company_seat": "Berlin",
      "details": "22.10.2024 (Bekanntmachungsdatum)\n\nBerlin Amtsgericht Berlin (Charlottenburg) HRB 97140\nEinreichung neuer Dokumente\n\nBASF Services Europe GmbH\nGesellschaft mit beschränkter Haftung\nBerlin\n\nAls nicht eingetragen wird veröffentlicht: Es wurde eine neue Liste der Aufsichtsratsmitglieder eingereicht (§52 GmbHG)."
    },
    {
      "date": "2024-10-22",
      "id": "91241",
      "original_text": "Sonstige Registerbekanntmachung\nBerlin Amtsgericht Berlin (Charlottenburg) HRB 101380\neGroup Technologies AG – Berlin",
      "type": "Sonstige Registerbekanntmachung",
      "state": "Berlin",
      "amtsgericht": "Amtsgericht Berlin (Charlottenburg)",
      "registernummer": "HRB 101380",
      "registerart": "HRB",
      "company_name": "eGroup Technologies AG",
      "company_seat": "Berlin",
      "details": "22.10.2024 (Bekanntmachungsdatum)\n\nBerlin Amtsgericht Berlin (Charlottenburg) HRB 101380\nSonstige Registerbekanntmachung\n\neGroup Technologies AG\nAktiengesellschaft\nBerlin\n\nAls nicht eingetragen wird veröffentlicht: Es wurde eine neue Liste der Aufsichtsratsmitglieder eingereicht (§ 106 AktG)."
    },
    {
      "date": "2024-10-22",
      "id": "91242",
      "original_text": "Einreichung neuer Dokumente\nBaden-Württemberg Amtsgericht Stuttgart HRB 8533\nSozialunternehmen Neue Arbeit gGmbH – Stuttgart",
      "type": "Einreichung neuer Dokumente",
      "state": "Baden-Württemberg",
      "amtsgericht": "Amtsgericht Stuttgart",
      "registernummer": "HRB 8533",
      "registerart": "HRB",
      "company_name": "Sozialunternehmen Neue Arbeit gGmbH",
      "company_seat": "Stuttgart",
      "details": "22.10.2024 (Bekanntmachungsdatum)\n\nBaden-Württemberg Amtsgericht Stuttgart HRB 8533\nEinreichung neuer Dokumente 22.10.2024 (Eintragungsdatum)\n\nSozialunternehmen Neue Arbeit gGmbH\nGesellschaft mit beschränkter Haftung\nStuttgart\n\nDie Gesellschaft hat am 22.10.2024 die Liste über die Zusammensetzung des Aufsichtsrats zum Handelsregister eingereicht."
    },
    {
      "date": "2024-10-22",
      "id": "91243",
      "original_text": "Registerbekanntmachung nach dem Umwandlungsgesetz\nBaden-Württemberg Amtsgericht Stuttgart HRB 20901\nISBE GmbH – Stuttgart",
      "type": "Registerbekanntmachung nach dem Umwandlungsgesetz",
      "state": "Baden-Württemberg",
      "amtsgericht": "Amtsgericht Stuttgart",
      "registernummer": "HRB 20901",
      "registerart": "HRB",
      "company_name": "ISBE GmbH",
      "company_seat": "Stuttgart",
      "details": "22.10.2024 (Bekanntmachungsdatum)\n\nBaden-Württemberg Amtsgericht Stuttgart HRB 20901\nRegisterbekanntmachung nach dem Umwandlungsgesetz 22.10.2024 (Eintragungsdatum)\n\nISBE GmbH\nGesellschaft mit beschränkter Haftung\nStuttgart\n\nAls nicht eingetragen wird bekanntgemacht:\nDen Gläubigern der an der Ausgliederung beteiligten Rechtsträger ist, wenn sie binnen sechs Monaten nach dem Tag, an dem die Eintragung der Ausgliederung in das Register des Sitzes desjenigen Rechtsträgers, dessen Gläubiger sie sind, nach § 19 Abs. 3 UmwG als bekanntgemacht gilt, ihren Anspruch nach Grund und Höhe schriftlich anmelden, Sicherheit zu leisten, soweit sie nicht Befriedigung verlangen können. Dieses Recht steht den Gläubigern jedoch nur zu, wenn sie glaubhaft machen, dass durch die Ausgliederung die Erfüllung ihrer Forderung gefährdet wird."
    },
    {
      "date": "2024-10-22",
      "id": "91244",
      "original_text": "Einreichung neuer Dokumente\nBaden-Württemberg Amtsgericht Ulm HRB 500995\nHENSOLDT Optronics GmbH – Oberkochen",
      "type": "Einreichung neuer Dokumente",
      "state": "Baden-Württemberg",
      "amtsgericht": "Amtsgericht Ulm",
      "registernummer": "HRB 500995",
      "registerart": "HRB",
      "company_name": "HENSOLDT Optronics GmbH",
      "company_seat": "Oberkochen",
      "details": "22.10.2024 (Bekanntmachungsdatum)\n\nBaden-Württemberg Amtsgericht Ulm HRB 500995\nEinreichung neuer Dokumente 22.10.2024 (Eintragungsdatum)\n\nHENSOLDT Optronics GmbH\nGesellschaft mit beschränkter Haftung\nOberkochen\n\nDie Gesellschaft hat am 22.10.2024 die Liste über die Zusammensetzung des Aufsichtsrats zum Handelsregister eingereicht."
    },
    {
      "date": "2024-10-22",
      "id": "91245",
      "original_text": "Registerbekanntmachung nach dem Umwandlungsgesetz\nBaden-Württemberg Amtsgericht Mannheim HRB 733185\nShondilo UG (haftungsbeschränkt) – Dielheim",
      "type": "Registerbekanntmachung nach dem Umwandlungsgesetz",
      "state": "Baden-Württemberg",
      "amtsgericht": "Amtsgericht Mannheim",
      "registernummer": "HRB 733185",
      "registerart": "HRB",
      "company_name": "Shondilo UG (haftungsbeschränkt)",
      "company_seat": "Dielheim",
      "details": "22.10.2024 (Bekanntmachungsdatum)\n\nBaden-Württemberg Amtsgericht Mannheim HRB 733185\nRegisterbekanntmachung nach dem Umwandlungsgesetz 22.10.2024 (Eintragungsdatum)\n\nShondilo UG (haftungsbeschränkt)\nGesellschaft mit beschränkter Haftung\nDielheim\n\nDen Gläubigern der an der Verschmelzung beteiligten Rechtsträger ist, wenn sie binnen sechs Monaten nach dem Tag, an dem die Eintragung der Verschmelzung in das Register des Sitzes desjenigen Rechtsträgers, dessen Gläubiger sie sind, nach § 19 Abs. 3 UmwG als bekanntgemacht gilt, ihren Anspruch nach Grund und Höhe schriftlich anmelden, Sicherheit zu leisten, soweit sie nicht Befriedigung verlangen können. Dieses Recht steht den Gläubigern jedoch nur zu, wenn sie glaubhaft machen, dass durch die Verschmelzung die Erfüllung ihrer Forderung gefährdet wird."
    },
    {
      "date": "2024-10-22",
      "id": "91246",
      "original_text": "Löschungsankündigung\nSchleswig-Holstein Amtsgericht Lübeck HRB 20407\nG8C Real Invest GmbH – Reinbek",
      "type": "Löschungsankündigung",
      "state": "Schleswig-Holstein",
      "amtsgericht": "Amtsgericht Lübeck",
      "registernummer": "HRB 20407",
      "registerart": "HRB",
      "company_name": "G8C Real Invest GmbH",
      "company_seat": "Reinbek",
      "details": "22.10.2024 (Bekanntmachungsdatum)\n\nSchleswig-Holstein Amtsgericht Lübeck HRB 20407\nLöschungsankündigung\n\nG8C Real Invest GmbH\nGesellschaft mit beschränkter Haftung\nReinbek\n\nEs ist die Löschung der nachstehenden Gesellschaft wegen Vermögenslosigkeit gemäß § 394 FamFG beabsichtigt.\nWiderspruchsfrist: 1 Monat"
    },
    {
      "date": "2024-10-22",
      "id": "91247",
      "original_text": "Registerbekanntmachung nach dem Umwandlungsgesetz\nBaden-Württemberg Amtsgericht Mannheim HRB 738038\nmyfacelite UG (haftungsbeschränkt) – Mannheim",
      "type": "Registerbekanntmachung nach dem Umwandlungsgesetz",
      "state": "Baden-Württemberg",
      "amtsgericht": "Amtsgericht Mannheim",
      "registernummer": "HRB 738038",
      "registerart": "HRB",
      "company_name": "myfacelite UG (haftungsbeschränkt)",
      "company_seat": "Mannheim",
      "details": "22.10.2024 (Bekanntmachungsdatum)\n\nBaden-Württemberg Amtsgericht Mannheim HRB 738038\nRegisterbekanntmachung nach dem Umwandlungsgesetz 22.10.2024 (Eintragungsdatum)\n\nmyfacelite UG (haftungsbeschränkt)\nGesellschaft mit beschränkter Haftung\nMannheim\n\nAls nicht eingetragen wird bekanntgemacht: Den Gläubigern der an der Verschmelzung beteiligten Rechtsträger ist, wenn sie binnen sechs Monaten nach dem Tag, an dem die Eintragung der Verschmelzung in das Register des Sitzes desjenigen Rechtsträgers, dessen Gläubiger sie sind, nach § 19 Abs. 3 UmwG als bekanntgemacht gilt, ihren Anspruch nach Grund und Höhe schriftlich anmelden, Sicherheit zu leisten, soweit sie nicht Befriedigung verlangen können. Dieses Recht steht den Gläubigern jedoch nur zu, wenn sie glaubhaft machen, dass durch die Verschmelzung die Erfüllung ihrer Forderung gefährdet wird."
    },
    {
      "date": "2024-10-22",
      "id": "91248",
      "original_text": "Registerbekanntmachung nach dem Umwandlungsgesetz\nMecklenburg-Vorpommern Amtsgericht Stralsund HRB 8402\nFMK Aufzüge GmbH Groß Lüdershagen – Wendorf",
      "type": "Registerbekanntmachung nach dem Umwandlungsgesetz",
      "state": "Mecklenburg-Vorpommern",
      "amtsgericht": "Amtsgericht Stralsund",
      "registernummer": "HRB 8402",
      "registerart": "HRB",
      "company_name": "FMK Aufzüge GmbH Groß Lüdershagen",
      "company_seat": "Wendorf",
      "details": "22.10.2024 (Bekanntmachungsdatum)\n\nMecklenburg-Vorpommern Amtsgericht Stralsund HRB 8402\nRegisterbekanntmachung nach dem Umwandlungsgesetz 22.10.2024 (Eintragungsdatum)\n\nFMK Aufzüge GmbH Groß Lüdershagen\nGesellschaft mit beschränkter Haftung\nWendorf\n\nAls nicht eingetragen wird veröffentlicht: Den Gläubigern der an der Verschmelzung beteiligten Rechtsträger ist, wenn sie binnen sechs Monaten nach dem Tag, an dem die Eintragung der Verschmelzung in das Register des Sitzes desjenigen Rechtsträgers, dessen Gläubiger sie sind, nach § 19 Abs. 3 UmwG als bekannt gemacht gilt,\nihren Anspruch nach Grund und Höhe schriftlich anmelden, Sicherheit zu leisten, soweit sie nicht Befriedigung verlangen können. Dieses Recht steht den Gläubigern jedoch nur zu, wenn sie glaubhaft machen, dass durch die Verschmelzung die Erfüllung der Forderung gefährdet wird."
    },
    {
      "date": "2024-10-22",
      "id": "91249",
      "original_text": "Sonstige Registerbekanntmachung\nBrandenburg Amtsgericht Frankfurt/Oder HRB 2673\nFWA Frankfurter Wasser- und Abwassergesellschaft mbH – Frankfurt (Oder)",
      "type": "Sonstige Registerbekanntmachung",
      "state": "Brandenburg",
      "amtsgericht": "Amtsgericht Frankfurt/Oder",
      "registernummer": "HRB 2673",
      "registerart": "HRB",
      "company_name": "FWA Frankfurter Wasser- und Abwassergesellschaft mbH",
      "company_seat": "Frankfurt (Oder)",
      "details": "22.10.2024 (Bekanntmachungsdatum)\n\nBrandenburg Amtsgericht Frankfurt/Oder HRB 2673\nSonstige Registerbekanntmachung\n\nFWA Frankfurter Wasser- und Abwassergesellschaft mbH\nGesellschaft mit beschränkter Haftung\nFrankfurt (Oder)\n\nAls nicht eingetragen wird veröffentlicht: Die Gesellschaft hat Änderungen im Aufsichtsrat angezeigt"
    },
    {
      "date": "2024-10-22",
      "id": "91250",
      "original_text": "Löschungsankündigung\nSachsen Amtsgericht Dresden HRB 28569\nMad Max Management GmbH – Wilsdruff",
      "type": "Löschungsankündigung",
      "state": "Sachsen",
      "amtsgericht": "Amtsgericht Dresden",
      "registernummer": "HRB 28569",
      "registerart": "HRB",
      "company_name": "Mad Max Management GmbH",
      "company_seat": "Wilsdruff",
      "details": "22.10.2024 (Bekanntmachungsdatum)\n\nSachsen Amtsgericht Dresden HRB 28569\nLöschungsankündigung\n\nMad Max Management GmbH\nGesellschaft mit beschränkter Haftung\nWilsdruff\n\nDas Registergericht beabsichtigt, die im Handelsregister eingetragene Gesellschaft von Amts wegen nach § 394 FamFG zu löschen. Die Frist zu Erhebung eines Widerspruchs gegen die beabsichtigte Löschung wird auf einen Monat festgesetzt."
    },
    {
      "date": "2024-10-22",
      "id": "91251",
      "original_text": "Löschungsankündigung\nSachsen Amtsgericht Dresden HRB 19155\nWerkzeugbau Behla Verwaltungs-GmbH – Ebersbach",
      "type": "Löschungsankündigung",
      "state": "Sachsen",
      "amtsgericht": "Amtsgericht Dresden",
      "registernummer": "HRB 19155",
      "registerart": "HRB",
      "company_name": "Werkzeugbau Behla Verwaltungs-GmbH",
      "company_seat": "Ebersbach",
      "details": "22.10.2024 (Bekanntmachungsdatum)\n\nSachsen Amtsgericht Dresden HRB 19155\nLöschungsankündigung\n\nWerkzeugbau Behla Verwaltungs-GmbH\nGesellschaft mit beschränkter Haftung\nEbersbach\n\nDas Registergericht beabsichtigt, die im Handelsregister eingetragene Gesellschaft von Amts wegen nach § 394 FamFG zu löschen. Die Frist zu Erhebung eines Widerspruchs gegen die beabsichtigte Löschung wird auf einen Monat festgesetzt."
    },
    {
      "date": "2024-10-22",
      "id": "91252",
      "original_text": "Löschungsankündigung\nSachsen Amtsgericht Dresden HRA 4656\nTreppenbau-Müller GmbH & Co. KG – Riesa",
      "type": "Löschungsankündigung",
      "state": "Sachsen",
      "amtsgericht": "Amtsgericht Dresden",
      "registernummer": "HRA 4656",
      "registerart": "HRA",
      "company_name": "Treppenbau-Müller GmbH & Co. KG",
      "company_seat": "Riesa",
      "details": "22.10.2024 (Bekanntmachungsdatum)\n\nSachsen Amtsgericht Dresden HRA 4656\nLöschungsankündigung\n\nTreppenbau-Müller GmbH & Co. KG\nKommanditgesellschaft\nRiesa\n\nDas Registergericht beabsichtigt, die im Handelsregister eingetragene Gesellschaft von Amts wegen nach § 394 FamFG zu löschen. Die Frist zu Erhebung eines Widerspruchs gegen die beabsichtigte Löschung wird auf einen Monat festgesetzt."
    },
    {
      "date": "2024-10-22",
      "id": "91253",
      "original_text": "Registerbekanntmachung nach dem Umwandlungsgesetz\nSachsen Amtsgericht Leipzig HRB 43311\nMichels Sachsenklinik SE – Leipzig",
      "type": "Registerbekanntmachung nach dem Umwandlungsgesetz",
      "state": "Sachsen",
      "amtsgericht": "Amtsgericht Leipzig",
      "registernummer": "HRB 43311",
      "registerart": "HRB",
      "company_name": "Michels Sachsenklinik SE",
      "company_seat": "Leipzig",
      "details": "22.10.2024 (Bekanntmachungsdatum)\n\nSachsen Amtsgericht Leipzig HRB 43311\nRegisterbekanntmachung nach dem Umwandlungsgesetz 22.10.2024 (Eintragungsdatum)\n\nMichels Sachsenklinik SE\nEuropäische Aktiengesellschaft (SE)\nLeipzig\n\nDen Gläubigern der an der Verschmelzung beteiligten Rechtsträger ist, wenn sie binnen sechs Monaten nach dem Tag, an dem die Eintragung der Verschmelzung in das Register des Sitzes desjenigen Rechtsträgers, dessen Gläubiger sie sind, nach § 19 Abs. 3 UmwG als bekannt gemacht gilt, ihren Anspruch nach Grund und Höhe schriftlich anmelden, Sicherheit zu leisten, soweit sie nicht Befriedigung verlangen können. Dieses Recht steht den Gläubigern jedoch nur zu, wenn sie glaubhaft machen, dass durch die Verschmelzung die Erfüllung der Forderung gefährdet wird."
    },
    {
      "date": "2024-10-22",
      "id": "91254",
      "original_text": "Registerbekanntmachung nach dem Umwandlungsgesetz\nSachsen Amtsgericht Leipzig HRB 42889\nSachsenklinik AG – Leipzig",
      "type": "Registerbekanntmachung nach dem Umwandlungsgesetz",
      "state": "Sachsen",
      "amtsgericht": "Amtsgericht Leipzig",
      "registernummer": "HRB 42889",
      "registerart": "HRB",
      "company_name": "Sachsenklinik AG",
      "company_seat": "Leipzig",
      "details": "22.10.2024 (Bekanntmachungsdatum)\n\nSachsen Amtsgericht Leipzig HRB 42889\nRegisterbekanntmachung nach dem Umwandlungsgesetz 22.10.2024 (Eintragungsdatum)\n\nSachsenklinik AG\nGesellschaft mit beschränkter Haftung\nLeipzig\n\nDen Gläubigern der an der Verschmelzung beteiligten Rechtsträger ist, wenn sie binnen sechs Monaten nach dem Tag, an dem die Eintragung der Verschmelzung in das Register des Sitzes desjenigen Rechtsträgers, dessen Gläubiger sie sind, nach § 19 Abs. 3 UmwG als bekannt gemacht gilt, ihren Anspruch nach Grund und Höhe schriftlich anmelden, Sicherheit zu leisten, soweit sie nicht Befriedigung verlangen können. Dieses Recht steht den Gläubigern jedoch nur zu, wenn sie glaubhaft machen, dass durch die Verschmelzung die Erfüllung der Forderung gefährdet wird."
    },
    {
      "date": "2024-10-22",
      "id": "91255",
      "original_text": "Löschungsankündigung\nSachsen Amtsgericht Dresden HRB 40413\nM.T.O. SERVICES GmbH – Dresden",
      "type": "Löschungsankündigung",
      "state": "Sachsen",
      "amtsgericht": "Amtsgericht Dresden",
      "registernummer": "HRB 40413",
      "registerart": "HRB",
      "company_name": "M.T.O. SERVICES GmbH",
      "company_seat": "Dresden",
      "details": "22.10.2024 (Bekanntmachungsdatum)\n\nSachsen Amtsgericht Dresden HRB 40413\nLöschungsankündigung\n\nM.T.O. SERVICES GmbH\nGesellschaft mit beschränkter Haftung\nDresden\n\nDas Registergericht beabsichtigt, die im Handelsregister eingetragene Gesellschaft von Amts wegen nach § 394 FamFG zu löschen. Die Frist zu Erhebung eines Widerspruchs gegen die beabsichtigte Löschung wird auf einen Monat festgesetzt."
    },
    {
      "date": "2024-10-22",
      "id": "91256",
      "original_text": "Einreichung neuer Dokumente\nSachsen Amtsgericht Chemnitz HRB 28519\nSenioren- und Pflegezentrum Aue - Eichert gemeinnützige GmbH – Aue-Bad Schlema",
      "type": "Einreichung neuer Dokumente",
      "state": "Sachsen",
      "amtsgericht": "Amtsgericht Chemnitz",
      "registernummer": "HRB 28519",
      "registerart": "HRB",
      "company_name": "Senioren- und Pflegezentrum Aue - Eichert gemeinnützige GmbH",
      "company_seat": "Aue-Bad Schlema",
      "details": "22.10.2024 (Bekanntmachungsdatum)\n\nSachsen Amtsgericht Chemnitz HRB 28519\nEinreichung neuer Dokumente\n\nSenioren- und Pflegezentrum Aue - Eichert gemeinnützige GmbH\nGesellschaft mit beschränkter Haftung\nAue-Bad Schlema\n\nAm 21.10.2024 wurde beim Handelsregister des Amtsgerichts Chemnitz die Liste der Mitglieder des Aufsichtsrats gemäß § 52 GmbHG eingereicht."
    },
    {
      "date": "2024-10-22",
      "id": "91257",
      "original_text": "Registerbekanntmachung nach dem Umwandlungsgesetz\nSachsen Amtsgericht Leipzig HRA 19583\nIngenieurbüro für Schall- und Schwingungstechnik Matthias Barth e.K. – Leipzig",
      "type": "Registerbekanntmachung nach dem Umwandlungsgesetz",
      "state": "Sachsen",
      "amtsgericht": "Amtsgericht Leipzig",
      "registernummer": "HRA 19583",
      "registerart": "HRA",
      "company_name": "Ingenieurbüro für Schall- und Schwingungstechnik Matthias Barth e.K.",
      "company_seat": "Leipzig",
      "details": "22.10.2024 (Bekanntmachungsdatum)\n\nSachsen Amtsgericht Leipzig HRA 19583\nRegisterbekanntmachung nach dem Umwandlungsgesetz 22.10.2024 (Eintragungsdatum)\n\nIngenieurbüro für Schall- und Schwingungstechnik Matthias Barth e.K.\nEinzelkaufmann / Einzelkauffrau\nLeipzig\n\nDen Gläubigern der an der Ausgliederung beteiligten Rechtsträger ist, wenn sie binnen sechs Monaten nach dem Tag, an dem die Eintragung der Ausgliederung in das Register des Sitzes desjenigen Rechtsträgers, dessen Gläubiger sie sind, nach § 19 Abs. 3 UmwG als bekannt gemacht gilt, ihren Anspruch nach Grund und Höhe schriftlich anmelden, Sicherheit zu leisten, soweit sie nicht Befriedigung verlangen können. Dieses Recht steht den Gläubigern jedoch nur zu, wenn sie glaubhaft machen, dass durch die Ausgliederung die Erfüllung der Forderung gefährdet wird."
    },
    {
      "date": "2024-10-22",
      "id": "91258",
      "original_text": "Löschungsankündigung\nNiedersachsen Amtsgericht Lüneburg HRB 100470 früher Amtsgericht Celle\nDVG Geschaftsführungsgesellschaft mbH – Celle",
      "type": "Löschungsankündigung",
      "state": "Niedersachsen",
      "amtsgericht": "Amtsgericht Lüneburg",
      "registernummer": "HRB 100470",
      "registerart": "HRB",
      "company_name": "DVG Geschaftsführungsgesellschaft mbH",
      "company_seat": "Celle",
      "former_amtsgericht": "Celle",
      "details": "22.10.2024 (Bekanntmachungsdatum)\n\nNiedersachsen Amtsgericht Lüneburg HRB 100470 früher Amtsgericht Celle\nLöschungsankündigung\n\nDVG Geschaftsführungsgesellschaft mbH\nGesellschaft mit beschränkter Haftung\nCelle\n\nDas Registergericht beabsichtigt, vorstehende Gesellschaft von Amts wegen nach § 394 FamFG zu löschen. Die Frist zur Erhebung eines Widerspruchs ist auf 1 Monat ab Veröffentlichung festgesetzt."
    },
    {
      "date": "2024-10-22",
      "id": "91259",
      "original_text": "Löschungsankündigung\nNiedersachsen Amtsgericht Hildesheim HRB 207227\nBramer & Szewczyk UG (haftungsbeschränkt) – Sarstedt",
      "type": "Löschungsankündigung",
      "state": "Niedersachsen",
      "amtsgericht": "Amtsgericht Hildesheim",
      "registernummer": "HRB 207227",
      "registerart": "HRB",
      "company_name": "Bramer & Szewczyk UG (haftungsbeschränkt)",
      "company_seat": "Sarstedt",
      "details": "22.10.2024 (Bekanntmachungsdatum)\n\nNiedersachsen Amtsgericht Hildesheim HRB 207227\nLöschungsankündigung\n\nBramer & Szewczyk UG (haftungsbeschränkt)\nGesellschaft mit beschränkter Haftung\nSarstedt\n\nDas Registergericht beabsichtigt, die Gesellschaft von Amts wegen nach § 394 FamFG zu löschen. Die Frist zur Erhebung eines Widerspruchs ist auf 1 Monat ab dieser Registerbekanntmachung festgesetzt."
    },
    {
      "date": "2024-10-22",
      "id": "91260",
      "original_text": "Registerbekanntmachung nach dem Umwandlungsgesetz\nNiedersachsen Amtsgericht Osnabrück HRB 220211\nRöchling Industrial Beteiligungs SE – Haren (Ems)",
      "type": "Registerbekanntmachung nach dem Umwandlungsgesetz",
      "state": "Niedersachsen",
      "amtsgericht": "Amtsgericht Osnabrück",
      "registernummer": "HRB 220211",
      "registerart": "HRB",
      "company_name": "Röchling Industrial Beteiligungs SE",
      "company_seat": "Haren (Ems)",
      "details": "22.10.2024 (Bekanntmachungsdatum)\n\nNiedersachsen Amtsgericht Osnabrück HRB 220211\nRegisterbekanntmachung nach dem Umwandlungsgesetz 09.10.2024 (Eintragungsdatum)\n\nRöchling Industrial Beteiligungs SE\nEuropäische Aktiengesellschaft (SE)\nHaren (Ems)\n\nDen Gläubigern der an der grenzüberschreitenden Verschmelzung beteiligten übernehmenden Rechtsträger ist, wenn sie binnen sechs Monaten nach dem Tag, an dem die Eintragung der Verschmelzung in das Register des Sitzes desjenigen Rechtsträgers, dessen Gläubiger sie sind, nach § 19 Absatz 3 UmwG als bekanntgemacht gilt, ihren Anspruch nach Grund und Höhe schriftlich anmelden, Sicherheit zu leisten, soweit sie nicht Befriedigung verlangen können.\n\nDieses Recht steht den Gläubigern jedoch nur zu, wenn sie glaubhaft machen, dass durch die Verschmelzung die Erfüllung ihrer Forderung gefährdet wird."
    },
    {
      "date": "2024-10-22",
      "id": "91261",
      "original_text": "Löschungsankündigung\nNiedersachsen Amtsgericht Göttingen HRB 201237\nFXI Technologie GmbH – Gleichen",
      "type": "Löschungsankündigung",
      "state": "Niedersachsen",
      "amtsgericht": "Amtsgericht Göttingen",
      "registernummer": "HRB 201237",
      "registerart": "HRB",
      "company_name": "FXI Technologie GmbH",
      "company_seat": "Gleichen",
      "details": "22.10.2024 (Bekanntmachungsdatum)\n\nNiedersachsen Amtsgericht Göttingen HRB 201237\nLöschungsankündigung\n\nFXI Technologie GmbH\nGesellschaft mit beschränkter Haftung\nGleichen\n\nDas Registergericht beabsichtigt, die Gesellschaft von Amts wegen nach § 394 FamFG zu löschen. Die Frist zur Erhebung eines Widerspruchs ist auf 1 Monat ab dieser Registerbekanntmachung festgesetzt."
    },
    {
      "date": "2024-10-22",
      "id": "91262",
      "original_text": "Registerbekanntmachung nach dem Umwandlungsgesetz\nNiedersachsen Amtsgericht Oldenburg (Oldenburg) HRB 202347\nMG Verwertungs GmbH – Oldenburg",
      "type": "Registerbekanntmachung nach dem Umwandlungsgesetz",
      "state": "Niedersachsen",
      "amtsgericht": "Amtsgericht Oldenburg (Oldenburg)",
      "registernummer": "HRB 202347",
      "registerart": "HRB",
      "company_name": "MG Verwertungs GmbH",
      "company_seat": "Oldenburg",
      "details": "22.10.2024 (Bekanntmachungsdatum)\n\nNiedersachsen Amtsgericht Oldenburg (Oldenburg) HRB 202347\nRegisterbekanntmachung nach dem Umwandlungsgesetz 22.10.2024 (Eintragungsdatum)\n\nMG Verwertungs GmbH\nGesellschaft mit beschränkter Haftung\nOldenburg\n\nDen Gläubigern der an der Verschmelzung beteiligten Rechtsträger ist, wenn sie binnen sechs Monaten nach dem Tag, an dem die Eintragung der Verschmelzung in das Register des Sitzes desjenigen Rechtsträgers, dessen Gläubiger sie sind, nach § 19  Abs.  3 UmwG als bekannt gemacht gilt, ihren Anspruch nach Grund und Höhe schriftlich anmelden, Sicherheit zu leisten, soweit sie nicht Befriedigung verlangen können. Dieses Recht steht den Gläubigern jedoch nur zu, wenn sie glaubhaft machen, dass durch die Verschmelzung die Erfüllung der Forderung gefährdet wird."
    },
    {
      "date": "2024-10-22",
      "id": "91263",
      "original_text": "Registerbekanntmachung nach dem Umwandlungsgesetz\nNiedersachsen Amtsgericht Hannover HRB 53559\n\"Toschi\" Gesellschaft mit beschränkter Haftung – Hannover",
      "type": "Registerbekanntmachung nach dem Umwandlungsgesetz",
      "state": "Niedersachsen",
      "amtsgericht": "Amtsgericht Hannover",
      "registernummer": "HRB 53559",
      "registerart": "HRB",
      "company_name": "\"Toschi\" Gesellschaft mit beschränkter Haftung",
      "company_seat": "Hannover",
      "details": "22.10.2024 (Bekanntmachungsdatum)\n\nNiedersachsen Amtsgericht Hannover HRB 53559\nRegisterbekanntmachung nach dem Umwandlungsgesetz 22.10.2024 (Eintragungsdatum)\n\n\"Toschi\" Gesellschaft mit beschränkter Haftung\nGesellschaft mit beschränkter Haftung\nHannover\n\nDen Gläubigern der an der Verschmelzung beteiligten Rechtsträger ist, wenn sie binnen sechs Monaten nach dem Tag, an dem die Eintragung der Verschmelzung in das Register des Sitzes desjenigen Rechtsträgers, dessen Gläubiger sie sind, nach § 19  Abs.  3 UmwG als bekannt gemacht gilt, ihren Anspruch nach Grund und Höhe schriftlich anmelden, Sicherheit zu leisten, soweit sie nicht Befriedigung verlangen können. Dieses Recht steht den Gläubigern jedoch nur zu, wenn sie glaubhaft machen, dass durch die Verschmelzung die Erfüllung der Forderung gefährdet wird."
    },
    {
      "date": "2024-10-22",
      "id": "91264",
      "original_text": "Registerbekanntmachung nach dem Umwandlungsgesetz\nNiedersachsen Amtsgericht Hannover HRB 59068\nGP Günter Papenburg Aktiengesellschaft – Hannover",
      "type": "Registerbekanntmachung nach dem Umwandlungsgesetz",
      "state": "Niedersachsen",
      "amtsgericht": "Amtsgericht Hannover",
      "registernummer": "HRB 59068",
      "registerart": "HRB",
      "company_name": "GP Günter Papenburg Aktiengesellschaft",
      "company_seat": "Hannover",
      "details": "22.10.2024 (Bekanntmachungsdatum)\n\nNiedersachsen Amtsgericht Hannover HRB 59068\nRegisterbekanntmachung nach dem Umwandlungsgesetz 22.10.2024 (Eintragungsdatum)\n\nGP Günter Papenburg Aktiengesellschaft\nAktiengesellschaft\nHannover\n\nDen Gläubigern der an der Verschmelzung beteiligten Rechtsträger ist, wenn sie binnen sechs Monaten nach dem Tag, an dem die Eintragung der Verschmelzung in das Register des Sitzes desjenigen Rechtsträgers, dessen Gläubiger sie sind, nach § 19  Abs.  3 UmwG als bekannt gemacht gilt, ihren Anspruch nach Grund und Höhe schriftlich anmelden, Sicherheit zu leisten, soweit sie nicht Befriedigung verlangen können. Dieses Recht steht den Gläubigern jedoch nur zu, wenn sie glaubhaft machen, dass durch die Verschmelzung die Erfüllung der Forderung gefährdet wird."
    },
    {
      "date": "2024-10-22",
      "id": "91265",
      "original_text": "Einreichung neuer Dokumente\nNiedersachsen Amtsgericht Braunschweig HRB 210842\nVolkswagen Financial Services AG – Braunschweig",
      "type": "Einreichung neuer Dokumente",
      "state": "Niedersachsen",
      "amtsgericht": "Amtsgericht Braunschweig",
      "registernummer": "HRB 210842",
      "registerart": "HRB",
      "company_name": "Volkswagen Financial Services AG",
      "company_seat": "Braunschweig",
      "details": "22.10.2024 (Bekanntmachungsdatum)\n\nNiedersachsen Amtsgericht Braunschweig HRB 210842\nEinreichung neuer Dokumente\n\nVolkswagen Financial Services AG\nAktiengesellschaft\nBraunschweig\n\nDie Liste der Mitglieder des Aufsichtsrats wurde beim Registergericht eingereicht."
    },
    {
      "date": "2024-10-22",
      "id": "91266",
      "original_text": "Registerbekanntmachung nach dem Umwandlungsgesetz\nNiedersachsen Amtsgericht Aurich HRA 201622\nKüchen Ruberg u. Hoppe GmbH & Co. KG – Emden",
      "type": "Registerbekanntmachung nach dem Umwandlungsgesetz",
      "state": "Niedersachsen",
      "amtsgericht": "Amtsgericht Aurich",
      "registernummer": "HRA 201622",
      "registerart": "HRA",
      "company_name": "Küchen Ruberg u. Hoppe GmbH & Co. KG",
      "company_seat": "Emden",
      "details": "22.10.2024 (Bekanntmachungsdatum)\n\nNiedersachsen Amtsgericht Aurich HRA 201622\nRegisterbekanntmachung nach dem Umwandlungsgesetz 22.10.2024 (Eintragungsdatum)\n\nKüchen Ruberg u. Hoppe GmbH & Co. KG\nKommanditgesellschaft\nEmden\n\nDen Gläubigern der an der Verschmelzung beteiligten Rechtsträger ist, wenn sie binnen sechs Monaten nach dem Tag, an dem die Eintragung der Verschmelzung in das Register des Sitzes desjenigen Rechtsträgers, dessen Gläubiger sie sind, nach § 19  Abs.  3 UmwG als bekannt gemacht gilt, ihren Anspruch nach Grund und Höhe schriftlich anmelden, Sicherheit zu leisten, soweit sie nicht Befriedigung verlangen können. Dieses Recht steht den Gläubigern jedoch nur zu, wenn sie glaubhaft machen, dass durch die Verschmelzung die Erfüllung der Forderung gefährdet wird."
    },
    {
      "date": "2024-10-22",
      "id": "91267",
      "original_text": "Registerbekanntmachung nach dem Umwandlungsgesetz\nNiedersachsen Amtsgericht Oldenburg (Oldenburg) HRB 204139\nL & K Sachwerte Verwaltungs- und Beteiligungs GmbH – Oldenburg",
      "type": "Registerbekanntmachung nach dem Umwandlungsgesetz",
      "state": "Niedersachsen",
      "amtsgericht": "Amtsgericht Oldenburg (Oldenburg)",
      "registernummer": "HRB 204139",
      "registerart": "HRB",
      "company_name": "L & K Sachwerte Verwaltungs- und Beteiligungs GmbH",
      "company_seat": "Oldenburg",
      "details": "22.10.2024 (Bekanntmachungsdatum)\n\nNiedersachsen Amtsgericht Oldenburg (Oldenburg) HRB 204139\nRegisterbekanntmachung nach dem Umwandlungsgesetz 22.10.2024 (Eintragungsdatum)\n\nL & K Sachwerte Verwaltungs- und Beteiligungs GmbH\nGesellschaft mit beschränkter Haftung\nOldenburg\n\nDen Gläubigern der an der Verschmelzung beteiligten Rechtsträger ist, wenn sie binnen sechs Monaten nach dem Tag, an dem die Eintragung der Verschmelzung in das Register des Sitzes desjenigen Rechtsträgers, dessen Gläubiger sie sind, nach § 19  Abs.  3 UmwG als bekannt gemacht gilt, ihren Anspruch nach Grund und Höhe schriftlich anmelden, Sicherheit zu leisten, soweit sie nicht Befriedigung verlangen können. Dieses Recht steht den Gläubigern jedoch nur zu, wenn sie glaubhaft machen, dass durch die Verschmelzung die Erfüllung der Forderung gefährdet wird."
    },
    {
      "date": "2024-10-22",
      "id": "91268",
      "original_text": "Einreichung neuer Dokumente\nNiedersachsen Amtsgericht Oldenburg (Oldenburg) HRB 5236\nEWE NETZ GmbH – Oldenburg",
      "type": "Einreichung neuer Dokumente",
      "state": "Niedersachsen",
      "amtsgericht": "Amtsgericht Oldenburg (Oldenburg)",
      "registernummer": "HRB 5236",
      "registerart": "HRB",
      "company_name": "EWE NETZ GmbH",
      "company_seat": "Oldenburg",
      "details": "22.10.2024 (Bekanntmachungsdatum)\n\nNiedersachsen Amtsgericht Oldenburg (Oldenburg) HRB 5236\nEinreichung neuer Dokumente\n\nEWE NETZ GmbH\nGesellschaft mit beschränkter Haftung\nOldenburg\n\nDie Liste der Mitglieder des Aufsichtsrats wurde beim Registergericht eingereicht."
    },
    {
      "date": "2024-10-22",
      "id": "91269",
      "original_text": "Registerbekanntmachung nach dem Umwandlungsgesetz\nNiedersachsen Amtsgericht Oldenburg (Oldenburg) HRB 204139\nL & K Sachwerte Verwaltungs- und Beteiligungs GmbH – Oldenburg",
      "type": "Registerbekanntmachung nach dem Umwandlungsgesetz",
      "state": "Niedersachsen",
      "amtsgericht": "Amtsgericht Oldenburg (Oldenburg)",
      "registernummer": "HRB 204139",
      "registerart": "HRB",
      "company_name": "L & K Sachwerte Verwaltungs- und Beteiligungs GmbH",
      "company_seat": "Oldenburg",
      "details": "22.10.2024 (Bekanntmachungsdatum)\n\nNiedersachsen Amtsgericht Oldenburg (Oldenburg) HRB 204139\nRegisterbekanntmachung nach dem Umwandlungsgesetz 22.10.2024 (Eintragungsdatum)\n\nL & K Sachwerte Verwaltungs- und Beteiligungs GmbH\nGesellschaft mit beschränkter Haftung\nOldenburg\n\nDen Gläubigern der an der Verschmelzung beteiligten Rechtsträger ist, wenn sie binnen sechs Monaten nach dem Tag, an dem die Eintragung der Verschmelzung in das Register des Sitzes desjenigen Rechtsträgers, dessen Gläubiger sie sind, nach § 19  Abs.  3 UmwG als bekannt gemacht gilt, ihren Anspruch nach Grund und Höhe schriftlich anmelden, Sicherheit zu leisten, soweit sie nicht Befriedigung verlangen können. Dieses Recht steht den Gläubigern jedoch nur zu, wenn sie glaubhaft machen, dass durch die Verschmelzung die Erfüllung der Forderung gefährdet wird."
    },
    {
      "date": "2024-10-22",
      "id": "91270",
      "original_text": "Registerbekanntmachung nach dem Umwandlungsgesetz\nNiedersachsen Amtsgericht Aurich HRB 110380 früher Amtsgericht Leer (Ostfriesland) (Leer)\nHoppe Küchen-Technik GmbH – Leer",
      "type": "Registerbekanntmachung nach dem Umwandlungsgesetz",
      "state": "Niedersachsen",
      "amtsgericht": "Amtsgericht Aurich",
      "registernummer": "HRB 110380",
      "registerart": "HRB",
      "company_name": "Hoppe Küchen-Technik GmbH",
      "company_seat": "Leer",
      "former_amtsgericht": "Leer (Ostfriesland) (Leer)",
      "details": "22.10.2024 (Bekanntmachungsdatum)\n\nNiedersachsen Amtsgericht Aurich HRB 110380 früher Amtsgericht Leer (Ostfriesland) (Leer)\nRegisterbekanntmachung nach dem Umwandlungsgesetz 22.10.2024 (Eintragungsdatum)\n\nHoppe Küchen-Technik GmbH\nGesellschaft mit beschränkter Haftung\nLeer\n\nDen Gläubigern der an der Verschmelzung beteiligten Rechtsträger ist, wenn sie binnen sechs Monaten nach dem Tag, an dem die Eintragung der Verschmelzung in das Register des Sitzes desjenigen Rechtsträgers, dessen Gläubiger sie sind, nach § 19  Abs.  3 UmwG als bekannt gemacht gilt, ihren Anspruch nach Grund und Höhe schriftlich anmelden, Sicherheit zu leisten, soweit sie nicht Befriedigung verlangen können. Dieses Recht steht den Gläubigern jedoch nur zu, wenn sie glaubhaft machen, dass durch die Verschmelzung die Erfüllung der Forderung gefährdet wird."
    },
    {
      "date": "2024-10-22",
      "id": "91271",
      "original_text": "Sonstige Registerbekanntmachung\nNiedersachsen Amtsgericht Stadthagen HRB 202276\nMawacon Holding SE – Lauenau",
      "type": "Sonstige Registerbekanntmachung",
      "state": "Niedersachsen",
      "amtsgericht": "Amtsgericht Stadthagen",
      "registernummer": "HRB 202276",
      "registerart": "HRB",
      "company_name": "Mawacon Holding SE",
      "company_seat": "Lauenau",
      "details": "22.10.2024 (Bekanntmachungsdatum)\n\nNiedersachsen Amtsgericht Stadthagen HRB 202276\nSonstige Registerbekanntmachung 21.10.2024 (Eintragungsdatum)\n\nMawacon Holding SE\nEuropäische Aktiengesellschaft (SE)\nLauenau\n\nDie Liste der Mitglieder des Verwaltungsrats wurde beim Registergericht eingereicht."
    },
    {
      "date": "2024-10-22",
      "id": "91272",
      "original_text": "Löschungsankündigung\nNiedersachsen Amtsgericht Göttingen HRB 204122\nCEP Clean Energy Project GmbH – Bovenden",
      "type": "Löschungsankündigung",
      "state": "Niedersachsen",
      "amtsgericht": "Amtsgericht Göttingen",
      "registernummer": "HRB 204122",
      "registerart": "HRB",
      "company_name": "CEP Clean Energy Project GmbH",
      "company_seat": "Bovenden",
      "details": "22.10.2024 (Bekanntmachungsdatum)\n\nNiedersachsen Amtsgericht Göttingen HRB 204122\nLöschungsankündigung\n\nCEP Clean Energy Project GmbH\nGesellschaft mit beschränkter Haftung\nBovenden\n\nDas Registergericht beabsichtigt, die Gesellschaft von Amts wegen nach § 394 FamFG zu löschen. Die Frist zur Erhebung eines Widerspruchs ist auf 1 Monat ab dieser Registerbekanntmachung festgesetzt."
    },
    {
      "date": "2024-10-22",
      "id": "91273",
      "original_text": "Registerbekanntmachung nach dem Umwandlungsgesetz\nNiedersachsen Amtsgericht Hannover HRB 205937\nwellyou Langenhagen GmbH – Langenhagen",
      "type": "Registerbekanntmachung nach dem Umwandlungsgesetz",
      "state": "Niedersachsen",
      "amtsgericht": "Amtsgericht Hannover",
      "registernummer": "HRB 205937",
      "registerart": "HRB",
      "company_name": "wellyou Langenhagen GmbH",
      "company_seat": "Langenhagen",
      "details": "22.10.2024 (Bekanntmachungsdatum)\n\nNiedersachsen Amtsgericht Hannover HRB 205937\nRegisterbekanntmachung nach dem Umwandlungsgesetz 22.10.2024 (Eintragungsdatum)\n\nwellyou Langenhagen GmbH\nGesellschaft mit beschränkter Haftung\nLangenhagen\n\nDen Gläubigern der an der Verschmelzung beteiligten Rechtsträger ist, wenn sie binnen sechs Monaten nach dem Tag, an dem die Eintragung der Verschmelzung in das Register des Sitzes desjenigen Rechtsträgers, dessen Gläubiger sie sind, nach § 19  Abs.  3 UmwG als bekannt gemacht gilt, ihren Anspruch nach Grund und Höhe schriftlich anmelden, Sicherheit zu leisten, soweit sie nicht Befriedigung verlangen können. Dieses Recht steht den Gläubigern jedoch nur zu, wenn sie glaubhaft machen, dass durch die Verschmelzung die Erfüllung der Forderung gefährdet wird."
    },
    {
      "date": "2024-10-22",
      "id": "91274",
      "original_text": "Löschungsankündigung\nNiedersachsen Amtsgericht Oldenburg (Oldenburg) HRB 211080\nJHD MVZ gGmbH – Delmenhorst",
      "type": "Löschungsankündigung",
      "state": "Niedersachsen",
      "amtsgericht": "Amtsgericht Oldenburg (Oldenburg)",
      "registernummer": "HRB 211080",
      "registerart": "HRB",
      "company_name": "JHD MVZ gGmbH",
      "company_seat": "Delmenhorst",
      "details": "22.10.2024 (Bekanntmachungsdatum)\n\nNiedersachsen Amtsgericht Oldenburg (Oldenburg) HRB 211080\nLöschungsankündigung\n\nJHD MVZ gGmbH\nGesellschaft mit beschränkter Haftung\nDelmenhorst\n\nDas Registergericht beabsichtigt, die Gesellschaft von Amts wegen nach § 394 FamFG zu löschen. Die Frist zur Erhebung eines Widerspruchs ist auf 1 Monat ab dieser Registerbekanntmachung festgesetzt."
    },
    {
      "date": "2024-10-22",
      "id": "91275",
      "original_text": "Löschungsankündigung\nNiedersachsen Amtsgericht Lüneburg HRB 203292\nDGAC Immobilien GmbH – Winsen",
      "type": "Löschungsankündigung",
      "state": "Niedersachsen",
      "amtsgericht": "Amtsgericht Lüneburg",
      "registernummer": "HRB 203292",
      "registerart": "HRB",
      "company_name": "DGAC Immobilien GmbH",
      "company_seat": "Winsen",
      "details": "22.10.2024 (Bekanntmachungsdatum)\n\nNiedersachsen Amtsgericht Lüneburg HRB 203292\nLöschungsankündigung\n\nDGAC Immobilien GmbH\nGesellschaft mit beschränkter Haftung\nWinsen\n\nDas Registergericht beabsichtigt, die Gesellschaft von Amts wegen nach § 394 FamFG zu löschen. Die Frist zur Erhebung eines Widerspruchs ist auf 1 Monat ab dieser Registerbekanntmachung festgesetzt."
    },
    {
      "date": "2024-10-22",
      "id": "91276",
      "original_text": "Löschungsankündigung\nRheinland-Pfalz Amtsgericht Bad Kreuznach HRB 22090\nKai Tong International Trade GmbH – Hoppstädten-Weiersbach",
      "type": "Löschungsankündigung",
      "state": "Rheinland-Pfalz",
      "amtsgericht": "Amtsgericht Bad Kreuznach",
      "registernummer": "HRB 22090",
      "registerart": "HRB",
      "company_name": "Kai Tong International Trade GmbH",
      "company_seat": "Hoppstädten-Weiersbach",
      "details": "22.10.2024 (Bekanntmachungsdatum)\n\nRheinland-Pfalz Amtsgericht Bad Kreuznach HRB 22090\nLöschungsankündigung\n\nKai Tong International Trade GmbH\nGesellschaft mit beschränkter Haftung\nHoppstädten-Weiersbach\n\nDas Registergericht beabsichtigt die Gesellschaft wegen Vermögenslosigkeit im Handelsregister von Amts wegen nach § 394 FamFG zu löschen. Die Frist zur Erhebung eines Widerspruchs gegen die beabsichtigte Löschung ist auf einen Monat ab Veröffentlichung bestimmt."
    },
    {
      "date": "2024-10-22",
      "id": "91277",
      "original_text": "Registerbekanntmachung nach dem Umwandlungsgesetz\nRheinland-Pfalz Amtsgericht Koblenz GsR 256\nWallebohr eGbR – Ulmen",
      "type": "Registerbekanntmachung nach dem Umwandlungsgesetz",
      "state": "Rheinland-Pfalz",
      "amtsgericht": "Amtsgericht Koblenz",
      "registernummer": "GsR 256",
      "registerart": "GsR",
      "company_name": "Wallebohr eGbR",
      "company_seat": "Ulmen",
      "details": "22.10.2024 (Bekanntmachungsdatum)\n\nRheinland-Pfalz Amtsgericht Koblenz GsR 256\nRegisterbekanntmachung nach dem Umwandlungsgesetz 22.10.2024 (Eintragungsdatum)\n\nWallebohr eGbR\nGesellschaft bürgerlichen Rechts\nUlmen\n\nAls nicht eingetragen wird veröffentlicht: Den Gläubigern der an der Umwandlungbeteiligten Rechtsträger ist, wenn sie binnen sechs Monaten nach dem Tag, an dem die Eintragung der Umwandlung in das Register des Sitzes desjenigen Rechtsträgers, dessen Gläubiger sie sind, nach § 19 Abs. 3 UmwG als bekannt gemacht gilt, ihren Anspruch nach Grund und Höhe schriftlich anmelden, Sicherheit zu leisten, soweit sie nicht Befriedigung verlangen können. Dieses Recht steht den Gläubigern jedoch nur zu, wenn sie glaubhaft machen, dass durch die Umwandlung die Erfüllung der Forderung gefährdet wird."
    },
    {
      "date": "2024-10-22",
      "id": "91278",
      "original_text": "Löschungsankündigung\nRheinland-Pfalz Amtsgericht Bad Kreuznach HRB 23059\nDeRay International GmbH – Hoppstädten-Weiersbach",
      "type": "Löschungsankündigung",
      "state": "Rheinland-Pfalz",
      "amtsgericht": "Amtsgericht Bad Kreuznach",
      "registernummer": "HRB 23059",
      "registerart": "HRB",
      "company_name": "DeRay International GmbH",
      "company_seat": "Hoppstädten-Weiersbach",
      "details": "22.10.2024 (Bekanntmachungsdatum)\n\nRheinland-Pfalz Amtsgericht Bad Kreuznach HRB 23059\nLöschungsankündigung\n\nDeRay International GmbH\nGesellschaft mit beschränkter Haftung\nHoppstädten-Weiersbach\n\nDas Registergericht beabsichtigt die Gesellschaft wegen Vermögenslosigkeit im Handelsregister von Amts wegen nach § 394 FamFG zu löschen. Die Frist zur Erhebung eines Widerspruchs gegen die beabsichtigte Löschung ist auf einen Monat ab Veröffentlichung bestimmt."
    },
    {
      "date": "2024-10-22",
      "id": "91279",
      "original_text": "Registerbekanntmachung nach dem Umwandlungsgesetz\nRheinland-Pfalz Amtsgericht Koblenz HRB 30640\nWallebohr Holding GmbH – Ulmen",
      "type": "Registerbekanntmachung nach dem Umwandlungsgesetz",
      "state": "Rheinland-Pfalz",
      "amtsgericht": "Amtsgericht Koblenz",
      "registernummer": "HRB 30640",
      "registerart": "HRB",
      "company_name": "Wallebohr Holding GmbH",
      "company_seat": "Ulmen",
      "details": "22.10.2024 (Bekanntmachungsdatum)\n\nRheinland-Pfalz Amtsgericht Koblenz HRB 30640\nRegisterbekanntmachung nach dem Umwandlungsgesetz 22.10.2024 (Eintragungsdatum)\n\nWallebohr Holding GmbH\nGesellschaft mit beschränkter Haftung\nUlmen\n\nAls nicht eingetragen wird veröffentlicht:\nDen Gläubigern des formwechselnden Rechtsträgers ist, wenn sie binnen sechs Monaten nach dem Tag, an dem die Eintragung des Formwechsels nach § 201 UmwG als bekannt gemacht gilt, ihren Anspruch nach Grund und Höhe schriftlich anmelden, Sicherheit zu leisten, soweit sie nicht Befriedigung verlangen können. Dieses Recht steht den Gläubigern jedoch nur zu, wenn sie glaubhaft machen, dass durch den Formwechsel die Erfüllung der Forderung gefährdet wird."
    },
    {
      "date": "2024-10-22",
      "id": "91280",
      "original_text": "Registerbekanntmachung nach dem Umwandlungsgesetz\nRheinland-Pfalz Amtsgericht Koblenz HRA 23112\nWeinhandel Böhm Inh. Susanne Ende-Böhm e.K. – Grafschaft",
      "type": "Registerbekanntmachung nach dem Umwandlungsgesetz",
      "state": "Rheinland-Pfalz",
      "amtsgericht": "Amtsgericht Koblenz",
      "registernummer": "HRA 23112",
      "registerart": "HRA",
      "company_name": "Weinhandel Böhm Inh. Susanne Ende-Böhm e.K.",
      "company_seat": "Grafschaft",
      "details": "22.10.2024 (Bekanntmachungsdatum)\n\nRheinland-Pfalz Amtsgericht Koblenz HRA 23112\nRegisterbekanntmachung nach dem Umwandlungsgesetz 22.10.2024 (Eintragungsdatum)\n\nWeinhandel Böhm Inh. Susanne Ende-Böhm e.K.\nEinzelkaufmann / Einzelkauffrau\nGrafschaft\n\nAls nicht eingetragen wird veröffentlicht: Den Gläubigern der an der Ausgliederung beteiligten Rechtsträger ist, wenn sie binnen sechs Monaten nach dem Tag, an dem die Eintragung der Ausgliederung in das Register des Sitzes desjenigen Rechtsträgers,dessen Gläubiger sie sind, nach § 19 Abs. 3 UmwG als bekannt gemacht gilt, ihren Anspruch nach Grund und Höhe schriftlich anmelden, Sicherheit zu leisten, soweit sie nicht Befriedigung verlangen können. Dieses Recht steht den Gläubigern jedoch nur zu, wenn sie glaubhaft machen, dass durch die Ausgliederung die Erfüllung der Forderung gefährdet wird."
    },
    {
      "date": "2024-10-22",
      "id": "91281",
      "original_text": "Registerbekanntmachung nach dem Umwandlungsgesetz\nRheinland-Pfalz Amtsgericht Koblenz HRB 30019\nSHD GmbH – Andernach",
      "type": "Registerbekanntmachung nach dem Umwandlungsgesetz",
      "state": "Rheinland-Pfalz",
      "amtsgericht": "Amtsgericht Koblenz",
      "registernummer": "HRB 30019",
      "registerart": "HRB",
      "company_name": "SHD GmbH",
      "company_seat": "Andernach",
      "details": "22.10.2024 (Bekanntmachungsdatum)\n\nRheinland-Pfalz Amtsgericht Koblenz HRB 30019\nRegisterbekanntmachung nach dem Umwandlungsgesetz 22.10.2024 (Eintragungsdatum)\n\nSHD GmbH\nGesellschaft mit beschränkter Haftung\nAndernach\n\nAls nicht eingetragen wird veröffentlicht: Den Gläubigern der an der Verschmelzung beteiligten Rechtsträger ist, wenn sie binnen sechs Monaten nach dem Tag, an dem die Eintragung der Verschmelzung in das Register des Sitzes desjenigen Rechtsträgers,dessen Gläubiger sie sind, nach § 19 Abs. 3 UmwG als bekannt gemacht gilt, ihren Anspruch nach Grund und Höhe schriftlich anmelden, Sicherheit zu leisten, soweit sie nicht Befriedigung verlangen können. Dieses Recht steht den Gläubigern jedoch nur zu, wenn sie glaubhaft machen, dass durch die Verschmelzung die Erfüllungd er Forderung gefährdet wird."
    },
    {
      "date": "2024-10-22",
      "id": "91282",
      "original_text": "Registerbekanntmachung nach dem Umwandlungsgesetz\nRheinland-Pfalz Amtsgericht Wittlich HRB 47056\nFriedmann Immobilien GmbH – Trier",
      "type": "Registerbekanntmachung nach dem Umwandlungsgesetz",
      "state": "Rheinland-Pfalz",
      "amtsgericht": "Amtsgericht Wittlich",
      "registernummer": "HRB 47056",
      "registerart": "HRB",
      "company_name": "Friedmann Immobilien GmbH",
      "company_seat": "Trier",
      "details": "22.10.2024 (Bekanntmachungsdatum)\n\nRheinland-Pfalz Amtsgericht Wittlich HRB 47056\nRegisterbekanntmachung nach dem Umwandlungsgesetz 22.10.2024 (Eintragungsdatum)\n\nFriedmann Immobilien GmbH\nGesellschaft mit beschränkter Haftung\nTrier\n\nAls nicht eingetragen wird veröffentlicht: Den Gläubigern der an der Ausgliederung beteiligten Rechtsträger ist, wenn sie binnen sechs Monaten nac hdem Tag, an dem die Eintragung der Ausgliederung in das Register des Sitzes desjenigen Rechtsträgers,dessen Gläubiger sie sind, nach § 19 Abs. 3 UmwG als bekannt gemacht gilt, ihren Anspruch nach Grund und Höhe schriftlich anmelden, Sicherheit zu leisten, soweit sie nicht Befriedigung verlangen können. Dieses Recht steht den Gläubigern jedoch nur zu, wenn sie glaubhaft machen, dass durch die Ausgliederung die Erfüllung der Forderung gefährdet wird."
    },
    {
      "date": "2024-10-22",
      "id": "91283",
      "original_text": "Registerbekanntmachung nach dem Umwandlungsgesetz\nNordrhein-Westfalen Amtsgericht Münster HRB 22037\nProvinzial Next GmbH – Münster",
      "type": "Registerbekanntmachung nach dem Umwandlungsgesetz",
      "state": "Nordrhein-Westfalen",
      "amtsgericht": "Amtsgericht Münster",
      "registernummer": "HRB 22037",
      "registerart": "HRB",
      "company_name": "Provinzial Next GmbH",
      "company_seat": "Münster",
      "details": "22.10.2024 (Bekanntmachungsdatum)\n\nNordrhein-Westfalen Amtsgericht Münster HRB 22037\nRegisterbekanntmachung nach dem Umwandlungsgesetz 22.10.2024 (Eintragungsdatum)\n\nProvinzial Next GmbH\nGesellschaft mit beschränkter Haftung\nMünster\n\nDen Gläubigern der an der formwechselnden Umwandlung beteiligten Rechtsträger ist, wenn sie binnen sechs Monaten nach dem Tag, an dem die Eintragung der formwechselnden Umwandlung in das Register des Sitzes desjenigen Rechtsträgers, dessen Gläubiger sie sind, nach § 19 Absatz 3 UmwG als bekanntgemacht gilt, ihren Anspruch nach Grund und Höhe schriftlich anmelden, Sicherheit zu leisten, soweit sie nicht Befriedigung verlangen können. Dieses Recht steht den Gläubigern jedoch nur zu, wenn sie glaubhaft machen, dass durch die formwechselnden Umwandlung die Erfüllung ihrer Forderung gefährdet wird."
    },
    {
      "date": "2024-10-22",
      "id": "91284",
      "original_text": "Löschungsankündigung\nNordrhein-Westfalen Amtsgericht Düsseldorf HRB 103741\nAP Innenausbau UG (haftungsbeschränkt) – Ratingen",
      "type": "Löschungsankündigung",
      "state": "Nordrhein-Westfalen",
      "amtsgericht": "Amtsgericht Düsseldorf",
      "registernummer": "HRB 103741",
      "registerart": "HRB",
      "company_name": "AP Innenausbau UG (haftungsbeschränkt)",
      "company_seat": "Ratingen",
      "details": "22.10.2024 (Bekanntmachungsdatum)\n\nNordrhein-Westfalen Amtsgericht Düsseldorf HRB 103741\nLöschungsankündigung\n\nAP Innenausbau UG (haftungsbeschränkt)\nGesellschaft mit beschränkter Haftung\nRatingen\n\nDas Registergericht beabsichtigt die Gesellschaft von Amts wegen nach § 394 FamFG zu löschen. Die Frist zur Erhebung eines Widerspruchs ist auf 3 Wochen festgesetzt.\n\nRechtsbehelfsbelehrung:\nDas Widerspruchsrecht steht jedem zu, der an der Unterlassung der Löschung ein berechtigtes Interesse hat. Der Widerspruch ist bei dem Amtsgericht Düsseldorf -Registergericht-, Werdener Straße 1, 40227 Düsseldorf schriftlich in deutscher Sprache oder zur Niederschrift der Geschäftsstelle einzulegen. Der Widerspruch kann auch zur Niederschrift der Geschäftsstelle eines jeden Amtsgerichtes abgegeben werden. Die Einlegung ist auch durch Übertragung eines elektronischen Dokuments an die elektronische Poststelle des Gerichts möglich. Das elektronische Dokument muss für die Bearbeitung durch das Gericht geeignet und mit einer qualifizierten elektronischen Signatur der verantwortenden Person versehen sein oder von der verantwortenden Person signiert und auf einem sicheren Übermittlungsweg gemäß § 130a ZPO nach näherer Maßgabe der Verordnung über die technischen Rahmenbedingungen des elektronischen Rechtsverkehrs und über das besondere elektronische Behördenpostfach (BGBl. I, S.3803) eingereicht werden. Weitere Informationen erhalten Sie auf der Internetseite www.justiz.de.\nDer Widerspruch muss spätestens innerhalb der gesetzten Frist nach dem Datum der Bekanntmachung der Löschungsankündigung bei dem Amtsgericht - Registergericht - Düsseldorf eingegangen sein.  Dies gilt auch dann, wenn der Widerspruch zur Niederschrift der Geschäftsstelle eines anderen Amtsgerichtes abgegeben wurde. Die Frist beginnt mit dem Tage der Bekanntmachung der Löschungsankündigung in dem für die Bekanntmachung der Eintragungen in das Handelsregister bestimmten elektronischen Informations- und Kommunikationssystem nach § 10 des Handelsgesetzbuches. Fällt das Ende der Frist auf einen Sonntag, einen allgemeinen Feiertag oder Sonnabend, so endet die Frist mit Ablauf des nächsten Werktages.\nDer Widerspruch muss die Bezeichnung der angefochtenen Löschungsankündigung sowie die Erklärung enthalten, dass Widerspruch gegen diese Löschungsankündigung eingelegt wird. Er ist zu unterzeichnen und soll begründet werden."
    },
    {
      "date": "2024-10-22",
      "id": "91285",
      "original_text": "Registerbekanntmachung nach dem Umwandlungsgesetz\nNordrhein-Westfalen Amtsgericht Gelsenkirchen HRB 9330\nUnited Rentals GmbH – Dorsten",
      "type": "Registerbekanntmachung nach dem Umwandlungsgesetz",
      "state": "Nordrhein-Westfalen",
      "amtsgericht": "Amtsgericht Gelsenkirchen",
      "registernummer": "HRB 9330",
      "registerart": "HRB",
      "company_name": "United Rentals GmbH",
      "company_seat": "Dorsten",
      "details": "22.10.2024 (Bekanntmachungsdatum)\n\nNordrhein-Westfalen Amtsgericht Gelsenkirchen HRB 9330\nRegisterbekanntmachung nach dem Umwandlungsgesetz 22.10.2024 (Eintragungsdatum)\n\nUnited Rentals GmbH\nGesellschaft mit beschränkter Haftung\nDorsten\n\nDen Gläubigern der an der Verschmelzung beteiligten Rechtsträger ist, wenn sie binnen sechs Monaten nach dem Tag, an dem die Eintragung der Verschmelzung in das Register des Sitzes desjenigen Rechtsträgers, dessen Gläubiger sie sind, nach § 19 Absatz 3 UmwG als bekanntgemacht gilt, ihren Anspruch nach Grund und Höhe schriftlich anmelden, Sicherheit zu leisten, soweit sie nicht Befriedigung verlangen können. Dieses Recht steht den Gläubigern jedoch nur zu, wenn sie glaubhaft machen, dass durch die Verschmelzung die Erfüllung ihrer Forderung gefährdet wird."
    },
    {
      "date": "2024-10-22",
      "id": "91286",
      "original_text": "Registerbekanntmachung nach dem Umwandlungsgesetz\nNordrhein-Westfalen Amtsgericht Münster HRB 22125\nProvinzial Next Aktiengesellschaft – Münster",
      "type": "Registerbekanntmachung nach dem Umwandlungsgesetz",
      "state": "Nordrhein-Westfalen",
      "amtsgericht": "Amtsgericht Münster",
      "registernummer": "HRB 22125",
      "registerart": "HRB",
      "company_name": "Provinzial Next Aktiengesellschaft",
      "company_seat": "Münster",
      "details": "22.10.2024 (Bekanntmachungsdatum)\n\nNordrhein-Westfalen Amtsgericht Münster HRB 22125\nRegisterbekanntmachung nach dem Umwandlungsgesetz 22.10.2024 (Eintragungsdatum)\n\nProvinzial Next Aktiengesellschaft\nAktiengesellschaft\nMünster\n\nDen Gläubigern der an der formwechselnden Umwandlung beteiligten Rechtsträger ist, wenn sie binnen sechs Monaten nach dem Tag, an dem die Eintragung der formwechselnden Umwandlung in das Register des Sitzes desjenigen Rechtsträgers, dessen Gläubiger sie sind, nach § 19 Absatz 3 UmwG als bekanntgemacht gilt, ihren Anspruch nach Grund und Höhe schriftlich anmelden, Sicherheit zu leisten, soweit sie nicht Befriedigung verlangen können. Dieses Recht steht den Gläubigern jedoch nur zu, wenn sie glaubhaft machen, dass durch die formwechselnden Umwandlung die Erfüllung ihrer Forderung gefährdet wird.Den Gläubigern der an der formwechselnden Umwandlung beteiligten Rechtsträger ist, wenn sie binnen sechs Monaten nach dem Tag, an dem die Eintragung der formwechselnden Umwandlung in das Register des Sitzes desjenigen Rechtsträgers, dessen Gläubiger sie sind, nach § 19 Absatz 3 UmwG als bekanntgemacht gilt, ihren Anspruch nach Grund und Höhe schriftlich anmelden, Sicherheit zu leisten, soweit sie nicht Befriedigung verlangen können. Dieses Recht steht den Gläubigern jedoch nur zu, wenn sie glaubhaft machen, dass durch die formwechselnden Umwandlung die Erfüllung ihrer Forderung gefährdet wird."
    },
    {
      "date": "2024-10-22",
      "id": "91287",
      "original_text": "Registerbekanntmachung nach dem Umwandlungsgesetz\nNordrhein-Westfalen Amtsgericht Münster HRB 15649\nQIMA Monasterium GmbH – Münster",
      "type": "Registerbekanntmachung nach dem Umwandlungsgesetz",
      "state": "Nordrhein-Westfalen",
      "amtsgericht": "Amtsgericht Münster",
      "registernummer": "HRB 15649",
      "registerart": "HRB",
      "company_name": "QIMA Monasterium GmbH",
      "company_seat": "Münster",
      "details": "22.10.2024 (Bekanntmachungsdatum)\n\nNordrhein-Westfalen Amtsgericht Münster HRB 15649\nRegisterbekanntmachung nach dem Umwandlungsgesetz 22.10.2024 (Eintragungsdatum)\n\nQIMA Monasterium GmbH\nGesellschaft mit beschränkter Haftung\nMünster\n\nDen Gläubigern der an der Verschmelzung beteiligten Rechtsträger ist, wenn sie binnen sechs Monaten nach dem Tag, an dem die Eintragung der Verschmelzung in das Register des Sitzes desjenigen Rechtsträgers, dessen Gläubiger sie sind, nach § 19 Absatz 3 UmwG als bekanntgemacht gilt, ihren Anspruch nach Grund und Höhe schriftlich anmelden, Sicherheit zu leisten, soweit sie nicht Befriedigung verlangen können. Dieses Recht steht den Gläubigern jedoch nur zu, wenn sie glaubhaft machen, dass durch die Verschmelzung die Erfüllung ihrer Forderung gefährdet wird."
    },
    {
      "date": "2024-10-22",
      "id": "91288",
      "original_text": "Registerbekanntmachung nach dem Umwandlungsgesetz\nNordrhein-Westfalen Amtsgericht Siegburg HRB 5404\nGasCom-Equipment GmbH – Troisdorf",
      "type": "Registerbekanntmachung nach dem Umwandlungsgesetz",
      "state": "Nordrhein-Westfalen",
      "amtsgericht": "Amtsgericht Siegburg",
      "registernummer": "HRB 5404",
      "registerart": "HRB",
      "company_name": "GasCom-Equipment GmbH",
      "company_seat": "Troisdorf",
      "details": "22.10.2024 (Bekanntmachungsdatum)\n\nNordrhein-Westfalen Amtsgericht Siegburg HRB 5404\nRegisterbekanntmachung nach dem Umwandlungsgesetz 22.10.2024 (Eintragungsdatum)\n\nGasCom-Equipment GmbH\nGesellschaft mit beschränkter Haftung\nTroisdorf\n\nDen Gläubigern der an der Verschmelzung beteiligten Rechtsträger ist, wenn sie binnen sechs Monaten nach dem Tag, an dem die Eintragung der Verschmelzung in das Register des Sitzes desjenigen Rechtsträgers, dessen Gläubiger sie sind, nach § 19 Absatz 3 UmwG als bekanntgemacht gilt, ihren Anspruch nach Grund und Höhe schriftlich anmelden, Sicherheit zu leisten, soweit sie nicht Befriedigung verlangen können. Dieses Recht steht den Gläubigern jedoch nur zu, wenn sie glaubhaft machen, dass durch die Verschmelzung die Erfüllung ihrer Forderung gefährdet wird."
    },
    {
      "date": "2024-10-22",
      "id": "91289",
      "original_text": "Registerbekanntmachung nach dem Umwandlungsgesetz\nNordrhein-Westfalen Amtsgericht Siegburg HRA 6684\nGasTec GmbH & Co. KG – Troisdorf",
      "type": "Registerbekanntmachung nach dem Umwandlungsgesetz",
      "state": "Nordrhein-Westfalen",
      "amtsgericht": "Amtsgericht Siegburg",
      "registernummer": "HRA 6684",
      "registerart": "HRA",
      "company_name": "GasTec GmbH & Co. KG",
      "company_seat": "Troisdorf",
      "details": "22.10.2024 (Bekanntmachungsdatum)\n\nNordrhein-Westfalen Amtsgericht Siegburg HRA 6684\nRegisterbekanntmachung nach dem Umwandlungsgesetz 22.10.2024 (Eintragungsdatum)\n\nGasTec GmbH & Co. KG\nKommanditgesellschaft\nTroisdorf\n\nDen Gläubigern der an der #DV.UmF(Text=\"Bitte wählen Sie die zutreffende Art nach UmwG aus!\",Eingabe=\"Verschmelzung\",\"Aufspaltung\",\"Abspaltung\",\"Ausgliederung\",\"Vermögensübertragung\",\"formwechselnden Umwandlung\") beteiligten Rechtsträger ist, wenn sie binnen sechs Monaten nach dem Tag, an dem die Eintragung der #DV.UmF in das Register des Sitzes #DV.RTr(Text=\"Bitte wählen Sie aus, ob ein oder mehrere andere Rechtsträger betroffen sind!\",Eingabe=\"desjenigen Rechtsträgers, dessen Gläubiger\",\"derjenigen Rechtsträger deren Gläubiger\") sie sind, nach § 19 Absatz 3 UmwG als bekanntgemacht gilt, ihren Anspruch nach Grund und Höhe schriftlich anmelden, Sicherheit zu leisten, soweit sie nicht Befriedigung verlangen können. Dieses Recht steht den Gläubigern jedoch nur zu, wenn sie glaubhaft machen, dass durch die #DV.UmF die Erfüllung ihrer Forderung gefährdet wird."
    },
    {
      "date": "2024-10-22",
      "id": "91290",
      "original_text": "Löschungsankündigung\nNordrhein-Westfalen Amtsgericht Mönchengladbach HRB 16142\nHeko Versandhandel UG (haftungsbeschränkt) – Mönchengladbach",
      "type": "Löschungsankündigung",
      "state": "Nordrhein-Westfalen",
      "amtsgericht": "Amtsgericht Mönchengladbach",
      "registernummer": "HRB 16142",
      "registerart": "HRB",
      "company_name": "Heko Versandhandel UG (haftungsbeschränkt)",
      "company_seat": "Mönchengladbach",
      "details": "22.10.2024 (Bekanntmachungsdatum)\n\nNordrhein-Westfalen Amtsgericht Mönchengladbach HRB 16142\nLöschungsankündigung\n\nHeko Versandhandel UG (haftungsbeschränkt)\nGesellschaft mit beschränkter Haftung\nMönchengladbach\n\nHeko Versandhandel UG (haftungsbeschränkt), Mönchengladbach (Amtsgericht Mönchengladbach, HRB 16142)\nDas Registergericht beabsichtigt, die im Handelsregister eingetragene Gesellschaft gemäß § 394 Absatz 1 FamFG wegen Vermögenslosigkeit von Amts wegen zu löschen. Gegen diese Verfügung kann Widerspruch eingelegt werden. Die Frist zur Erhebung eines Widerspruchs gegen die beabsichtigte Löschung von Amts wegen ist auf drei Monate festgesetzt."
    },
    {
      "date": "2024-10-22",
      "id": "91291",
      "original_text": "Löschungsankündigung\nNordrhein-Westfalen Amtsgericht Mönchengladbach HRB 20001\nYANIS Trockenbau GmbH – Mönchengladbach",
      "type": "Löschungsankündigung",
      "state": "Nordrhein-Westfalen",
      "amtsgericht": "Amtsgericht Mönchengladbach",
      "registernummer": "HRB 20001",
      "registerart": "HRB",
      "company_name": "YANIS Trockenbau GmbH",
      "company_seat": "Mönchengladbach",
      "details": "22.10.2024 (Bekanntmachungsdatum)\n\nNordrhein-Westfalen Amtsgericht Mönchengladbach HRB 20001\nLöschungsankündigung\n\nYANIS Trockenbau GmbH\nGesellschaft mit beschränkter Haftung\nMönchengladbach\n\nDas Registergericht beabsichtigt die Gesellschaft von Amts wegen nach § 394 FamFG zu löschen. Die Frist zur Erhebung eines Widerspruchs ist auf zwei Monate festgesetzt."
    },
    {
      "date": "2024-10-22",
      "id": "91292",
      "original_text": "Löschungsankündigung\nNordrhein-Westfalen Amtsgericht Mönchengladbach HRB 19991\nMDS Bau UG (haftungsbeschränkt) – Hückelhoven",
      "type": "Löschungsankündigung",
      "state": "Nordrhein-Westfalen",
      "amtsgericht": "Amtsgericht Mönchengladbach",
      "registernummer": "HRB 19991",
      "registerart": "HRB",
      "company_name": "MDS Bau UG (haftungsbeschränkt)",
      "company_seat": "Hückelhoven",
      "details": "22.10.2024 (Bekanntmachungsdatum)\n\nNordrhein-Westfalen Amtsgericht Mönchengladbach HRB 19991\nLöschungsankündigung\n\nMDS Bau UG (haftungsbeschränkt)\nGesellschaft mit beschränkter Haftung\nHückelhoven\n\nDas Registergericht beabsichtigt die Gesellschaft von Amts wegen nach § 394 FamFG zu löschen. Die Frist zur Erhebung eines Widerspruchs ist auf drei Monate festgesetzt."
    },
    {
      "date": "2024-10-22",
      "id": "91293",
      "original_text": "Löschungsankündigung\nNordrhein-Westfalen Amtsgericht Dortmund HRB 33275\nA & M Service GmbH – Dortmund",
      "type": "Löschungsankündigung",
      "state": "Nordrhein-Westfalen",
      "amtsgericht": "Amtsgericht Dortmund",
      "registernummer": "HRB 33275",
      "registerart": "HRB",
      "company_name": "A & M Service GmbH",
      "company_seat": "Dortmund",
      "details": "22.10.2024 (Bekanntmachungsdatum)\n\nNordrhein-Westfalen Amtsgericht Dortmund HRB 33275\nLöschungsankündigung\n\nA & M Service GmbH\nGesellschaft mit beschränkter Haftung\nDortmund\n\nDas Registergericht beabsichtigt die Gesellschaft von Amts wegen nach § 394 FamFG zu löschen. Die Frist zur Erhebung eines Widerspruchs ist auf zwei Monate festgesetzt."
    },
    {
      "date": "2024-10-22",
      "id": "91294",
      "original_text": "Löschungsankündigung\nNordrhein-Westfalen Amtsgericht Siegburg HRB 7954\nP O L O G R A P H I C Gesellschaft für digitale Bildbearbeitung mbH – Reichshof",
      "type": "Löschungsankündigung",
      "state": "Nordrhein-Westfalen",
      "amtsgericht": "Amtsgericht Siegburg",
      "registernummer": "HRB 7954",
      "registerart": "HRB",
      "company_name": "P O L O G R A P H I C Gesellschaft für digitale Bildbearbeitung mbH",
      "company_seat": "Reichshof",
      "details": "22.10.2024 (Bekanntmachungsdatum)\n\nNordrhein-Westfalen Amtsgericht Siegburg HRB 7954\nLöschungsankündigung\n\nP O L O G R A P H I C Gesellschaft für digitale Bildbearbeitung mbH\nGesellschaft mit beschränkter Haftung\nReichshof\n\nDas Registergericht hat glaubhafte Kenntnis erlangt, dass die Gesellschaft vermögenslos geworden ist. Es ist daher beabsichtigt, die Gesellschaft nach § 394 FamFG im Handelsregister wegen Vermögenslosigkeit zu löschen.\nEinwände gegen die Löschung sind durch Widerspruch binnen einer Frist von 3 Monaten geltend zu machen, andernfalls die Löschung erfolgen wird.\nEinzulegen ist der Widerspruch bei dem Amtsgericht Siegburg, Neue Poststraße 16, 53721 Siegburg, und zwar entweder schriftlich in deutscher Sprache oder mündlich zur Niederschrift der Geschäftsstelle. Der Widerspruch kann auch zur Niederschrift der Geschäftsstelle eines jeden Amtsgerichts abgegeben werden. Der Widerspruch ist binnen der in der Verfügung bestimmten Frist einzulegen. Die Frist ist nur gewahrt, wenn der Widerspruch rechtzeitig bei dem Amtsgericht Siegburg eingeht, auch wenn der Widerspruch zur Niederschrift der Geschäftsstelle eines anderen Amtsgerichts abgegeben wurde. Die Frist beginnt jeweils mit der schriftlichen Bekanntgabe der Verfügung an die Beteiligten. Kann die schriftliche Bekanntgabe an einen Beteiligten nicht bewirkt werden, beginnt die Frist spätestens mit Ablauf von fünf Monaten nach Erlass der Verfügung. Die Bekanntgabe ist entweder durch Zustellung oder am dritten Tage nach Aufgabe zur Post bewirkt.\nSofern die Löschung noch nicht erfolgt ist, kann der Widerspruch auch noch nach Ablauf der Frist eingelegt werden. Fällt das Ende der Frist auf einen Sonnabend, einen Sonntag oder einen allgemeinen Feiertag, endet die Frist mit Ablauf des nächsten Werktages. Der Widerspruch ist zu unterzeichnen. Eine Begründung des Widerspruchs ist nicht vorgeschrieben."
    },
    {
      "date": "2024-10-22",
      "id": "91295",
      "original_text": "Registerbekanntmachung nach dem Umwandlungsgesetz\nNordrhein-Westfalen Amtsgericht Hamm HRB 4337\nDormed medizinische Systeme GmbH – Holzwickede",
      "type": "Registerbekanntmachung nach dem Umwandlungsgesetz",
      "state": "Nordrhein-Westfalen",
      "amtsgericht": "Amtsgericht Hamm",
      "registernummer": "HRB 4337",
      "registerart": "HRB",
      "company_name": "Dormed medizinische Systeme GmbH",
      "company_seat": "Holzwickede",
      "details": "22.10.2024 (Bekanntmachungsdatum)\n\nNordrhein-Westfalen Amtsgericht Hamm HRB 4337\nRegisterbekanntmachung nach dem Umwandlungsgesetz 22.10.2024 (Eintragungsdatum)\n\nDormed medizinische Systeme GmbH\nGesellschaft mit beschränkter Haftung\nHolzwickede\n\nDen Gläubigern der an der Verschmelzung beteiligten Rechtsträger ist, wenn sie binnen sechs Monaten nach dem Tag, an dem die Eintragung der Verschmelzung in das Register des Sitzes derjenigen Rechtsträger deren Gläubiger sie sind, nach § 19 Absatz 3 UmwG als bekanntgemacht gilt, ihren Anspruch nach Grund und Höhe schriftlich anmelden, Sicherheit zu leisten, soweit sie nicht Befriedigung verlangen können. Dieses Recht steht den Gläubigern jedoch nur zu, wenn sie glaubhaft machen, dass durch die Verschmelzung die Erfüllung ihrer Forderung gefährdet wird."
    },
    {
      "date": "2024-10-22",
      "id": "91296",
      "original_text": "Löschungsankündigung\nNordrhein-Westfalen Amtsgericht Siegburg HRB 13565\nAnette Vianden GmbH – Sankt Augustin",
      "type": "Löschungsankündigung",
      "state": "Nordrhein-Westfalen",
      "amtsgericht": "Amtsgericht Siegburg",
      "registernummer": "HRB 13565",
      "registerart": "HRB",
      "company_name": "Anette Vianden GmbH",
      "company_seat": "Sankt Augustin",
      "details": "22.10.2024 (Bekanntmachungsdatum)\n\nNordrhein-Westfalen Amtsgericht Siegburg HRB 13565\nLöschungsankündigung\n\nAnette Vianden GmbH\nGesellschaft mit beschränkter Haftung\nSankt Augustin\n\nDas Registergericht hat glaubhafte Kenntnis erlangt, dass die Gesellschaft vermögenslos geworden ist, da ein Insolvenzverfahren wegen Masseunzulänglichkeit nach § 208 ff InsO eingestellt wurde.\nEs ist daher beabsichtigt, die Gesellschaft nach § 394 FamFG im Handelsregister wegen Vermögenslosigkeit zu löschen.\nEinwände gegen die Löschung sind durch Widerspruch binnen einer Frist von 3 Monaten geltend zu machen, andernfalls die Löschung erfolgen wird.\nEinzulegen ist der Widerspruch bei dem Amtsgericht Siegburg, Neue Poststraße 16, 53721 Siegburg, und zwar entweder schriftlich in deutscher Sprache oder mündlich zur Niederschrift der Geschäftsstelle. Der Widerspruch kann auch zur Niederschrift der Geschäftsstelle eines jeden Amtsgerichts abgegeben werden. Der Widerspruch ist binnen der in der Verfügung bestimmten Frist einzulegen. Die Frist ist nur gewahrt, wenn der Widerspruch rechtzeitig bei dem Amtsgericht Siegburg eingeht, auch wenn der Widerspruch zur Niederschrift der Geschäftsstelle eines anderen Amtsgerichts abgegeben wurde. Die Frist beginnt jeweils mit der schriftlichen Bekanntgabe der Verfügung an die Beteiligten. Kann die schriftliche Bekanntgabe an einen Beteiligten nicht bewirkt werden, beginnt die Frist spätestens mit Ablauf von fünf Monaten nach Erlass der Verfügung. Die Bekanntgabe ist entweder durch Zustellung oder am dritten Tage nach Aufgabe zur Post bewirkt.\nSofern die Löschung noch nicht erfolgt ist, kann der Widerspruch auch noch nach Ablauf der Frist eingelegt werden. Fällt das Ende der Frist auf einen Sonnabend, einen Sonntag oder einen allgemeinen Feiertag, endet die Frist mit Ablauf des nächsten Werktages. Der Widerspruch ist zu unterzeichnen. Eine Begründung des Widerspruchs ist nicht vorgeschrieben."
    },
    {
      "date": "2024-10-22",
      "id": "91297",
      "original_text": "Registerbekanntmachung nach dem Umwandlungsgesetz\nNordrhein-Westfalen Amtsgericht Dortmund HRB 36188\nESKO Dortmund GmbH – Dortmund",
      "type": "Registerbekanntmachung nach dem Umwandlungsgesetz",
      "state": "Nordrhein-Westfalen",
      "amtsgericht": "Amtsgericht Dortmund",
      "registernummer": "HRB 36188",
      "registerart": "HRB",
      "company_name": "ESKO Dortmund GmbH",
      "company_seat": "Dortmund",
      "details": "22.10.2024 (Bekanntmachungsdatum)\n\nNordrhein-Westfalen Amtsgericht Dortmund HRB 36188\nRegisterbekanntmachung nach dem Umwandlungsgesetz 22.10.2024 (Eintragungsdatum)\n\nESKO Dortmund GmbH\nGesellschaft mit beschränkter Haftung\nDortmund\n\nDen Gläubigern der an der Ausgliederung beteiligten Rechtsträger ist, wenn sie binnen sechs Monaten nach dem Tag, an dem die Eintragung der Ausgliederung in das Register des Sitzes desjenigen Rechtsträgers, dessen Gläubiger sie sind, nach § 19 Absatz 3 UmwG als bekanntgemacht gilt, ihren Anspruch nach Grund und Höhe schriftlich anmelden, Sicherheit zu leisten, soweit sie nicht Befriedigung verlangen können. Dieses Recht steht den Gläubigern jedoch nur zu, wenn sie glaubhaft machen, dass durch die Ausgliederung die Erfüllung ihrer Forderung gefährdet wird."
    },
    {
      "date": "2024-10-22",
      "id": "91298",
      "original_text": "Löschungsankündigung\nNordrhein-Westfalen Amtsgericht Dortmund HRB 34330\nBarberush UG (haftungsbeschränkt) – Lünen",
      "type": "Löschungsankündigung",
      "state": "Nordrhein-Westfalen",
      "amtsgericht": "Amtsgericht Dortmund",
      "registernummer": "HRB 34330",
      "registerart": "HRB",
      "company_name": "Barberush UG (haftungsbeschränkt)",
      "company_seat": "Lünen",
      "details": "22.10.2024 (Bekanntmachungsdatum)\n\nNordrhein-Westfalen Amtsgericht Dortmund HRB 34330\nLöschungsankündigung\n\nBarberush UG (haftungsbeschränkt)\nGesellschaft mit beschränkter Haftung\nLünen\n\nDas Registergericht beabsichtigt die Gesellschaft von Amts wegen nach § 394 FamFG zu löschen. Die Frist zur Erhebung eines Widerspruchs ist auf zwei Monate festgesetzt."
    },
    {
      "date": "2024-10-22",
      "id": "91299",
      "original_text": "Registerbekanntmachung nach dem Umwandlungsgesetz\nNordrhein-Westfalen Amtsgericht Köln HRB 32397\nGlobal Assekuranz-Versicherungsmakler GmbH – Köln",
      "type": "Registerbekanntmachung nach dem Umwandlungsgesetz",
      "state": "Nordrhein-Westfalen",
      "amtsgericht": "Amtsgericht Köln",
      "registernummer": "HRB 32397",
      "registerart": "HRB",
      "company_name": "Global Assekuranz-Versicherungsmakler GmbH",
      "company_seat": "Köln",
      "details": "22.10.2024 (Bekanntmachungsdatum)\n\nNordrhein-Westfalen Amtsgericht Köln HRB 32397\nRegisterbekanntmachung nach dem Umwandlungsgesetz 22.10.2024 (Eintragungsdatum)\n\nGlobal Assekuranz-Versicherungsmakler GmbH\nGesellschaft mit beschränkter Haftung\nKöln\n\nDen Gläubigern der an der Verschmelzung beteiligten Rechtsträger ist, wenn sie binnen sechs Monaten nach dem Tag, an dem die Eintragung der Verschmelzung in das Register des Sitzes desjenigen Rechtsträgers, dessen Gläubiger sie sind, nach § 19 Absatz 3 UmwG als bekanntgemacht gilt, ihren Anspruch nach Grund und Höhe schriftlich anmelden, Sicherheit zu leisten, soweit sie nicht Befriedigung verlangen können. Dieses Recht steht den Gläubigern jedoch nur zu, wenn sie glaubhaft machen, dass durch die Verschmelzung die Erfüllung ihrer Forderung gefährdet wird."
    },
    {
      "date": "2024-10-22",
      "id": "91300",
      "original_text": "Einreichung neuer Dokumente\nNordrhein-Westfalen Amtsgericht Münster HRB 14034\nCOMPO EXPERT GmbH – Münster",
      "type": "Einreichung neuer Dokumente",
      "state": "Nordrhein-Westfalen",
      "amtsgericht": "Amtsgericht Münster",
      "registernummer": "HRB 14034",
      "registerart": "HRB",
      "company_name": "COMPO EXPERT GmbH",
      "company_seat": "Münster",
      "details": "22.10.2024 (Bekanntmachungsdatum)\n\nNordrhein-Westfalen Amtsgericht Münster HRB 14034\nEinreichung neuer Dokumente\n\nCOMPO EXPERT GmbH\nGesellschaft mit beschränkter Haftung\nMünster\n\nDem Registergericht ist eine neue Liste der Mitglieder des Aufsichtsrates eingereicht worden."
    },
    {
      "date": "2024-10-22",
      "id": "91301",
      "original_text": "Registerbekanntmachung nach dem Umwandlungsgesetz\nNordrhein-Westfalen Amtsgericht Hagen HRB 8499\nTT Vermögensverwaltung GmbH – Schwerte",
      "type": "Registerbekanntmachung nach dem Umwandlungsgesetz",
      "state": "Nordrhein-Westfalen",
      "amtsgericht": "Amtsgericht Hagen",
      "registernummer": "HRB 8499",
      "registerart": "HRB",
      "company_name": "TT Vermögensverwaltung GmbH",
      "company_seat": "Schwerte",
      "details": "22.10.2024 (Bekanntmachungsdatum)\n\nNordrhein-Westfalen Amtsgericht Hagen HRB 8499\nRegisterbekanntmachung nach dem Umwandlungsgesetz 21.10.2024 (Eintragungsdatum)\n\nTT Vermögensverwaltung GmbH\nGesellschaft mit beschränkter Haftung\nSchwerte\n\nDen Gläubigern der an der Verschmelzung beteiligten Rechtsträger ist, wenn sie binnen sechs Monaten nach dem Tag, an dem die Eintragung der Verschmelzung in das Register des Sitzes desjenigen Rechtsträgers, dessen Gläubiger sie sind, nach § 19 Absatz 3 UmwG als bekanntgemacht gilt, ihren Anspruch nach Grund und Höhe schriftlich anmelden, Sicherheit zu leisten, soweit sie nicht Befriedigung verlangen können. Dieses Recht steht den Gläubigern jedoch nur zu, wenn sie glaubhaft machen, dass durch die Verschmelzung die Erfüllung ihrer Forderung gefährdet wird."
    },
    {
      "date": "2024-10-22",
      "id": "91302",
      "original_text": "Sonstige Registerbekanntmachung\nNordrhein-Westfalen Amtsgericht Bonn HRB 23562\nAdventure- & Sportmotorcycle Rheinland GmbH – Bonn",
      "type": "Sonstige Registerbekanntmachung",
      "state": "Nordrhein-Westfalen",
      "amtsgericht": "Amtsgericht Bonn",
      "registernummer": "HRB 23562",
      "registerart": "HRB",
      "company_name": "Adventure- & Sportmotorcycle Rheinland GmbH",
      "company_seat": "Bonn",
      "details": "22.10.2024 (Bekanntmachungsdatum)\n\nNordrhein-Westfalen Amtsgericht Bonn HRB 23562\nSonstige Registerbekanntmachung 22.10.2024 (Eintragungsdatum)\n\nAdventure- & Sportmotorcycle Rheinland GmbH\nGesellschaft mit beschränkter Haftung\nBonn\n\nAls nicht eingetragen wird veröffentlicht: Den Gläubigern der Gesellschaft, deren Forderungen begründet worden sind bevor die Eintragung der Beendigung des Gewinnabführungsvertrages  in das Handelsregister nach § 10 des Handelsgesetzbuches als bekanntgemacht gilt, hat der andere Vertragsteil Sicherheit zu leisten, wenn sie sich binnen sechs Monaten nach der Bekanntmachung der Eintragung zu diesem Zweck bei ihm melden."
    },
    {
      "date": "2024-10-22",
      "id": "91303",
      "original_text": "Löschungsankündigung\nNordrhein-Westfalen Amtsgericht Mönchengladbach HRB 19368\nDrecap UG (haftungsbeschränkt) – Grevenbroich",
      "type": "Löschungsankündigung",
      "state": "Nordrhein-Westfalen",
      "amtsgericht": "Amtsgericht Mönchengladbach",
      "registernummer": "HRB 19368",
      "registerart": "HRB",
      "company_name": "Drecap UG (haftungsbeschränkt)",
      "company_seat": "Grevenbroich",
      "details": "22.10.2024 (Bekanntmachungsdatum)\n\nNordrhein-Westfalen Amtsgericht Mönchengladbach HRB 19368\nLöschungsankündigung\n\nDrecap UG (haftungsbeschränkt)\nGesellschaft mit beschränkter Haftung\nGrevenbroich\n\nDrecap UG (haftungsbeschränkt), Grevenbroich (Amtsgericht Mönchengladbach, HRB 19368)\nDas Registergericht hat das Verfahren zu Löschung der im Handelsregister eingetragenen Gesellschaft (§ 394 Absatz 1 FamFG) wegen Vermögenslosigkeit eingestellt. Die Löschung ist nicht mehr beabsichtigt."
    },
    {
      "date": "2024-10-22",
      "id": "91304",
      "original_text": "Einreichung neuer Dokumente\nNordrhein-Westfalen Amtsgericht Münster HRB 14044\nA.S.I. Wirtschaftsberatung AG – Münster",
      "type": "Einreichung neuer Dokumente",
      "state": "Nordrhein-Westfalen",
      "amtsgericht": "Amtsgericht Münster",
      "registernummer": "HRB 14044",
      "registerart": "HRB",
      "company_name": "A.S.I. Wirtschaftsberatung AG",
      "company_seat": "Münster",
      "details": "22.10.2024 (Bekanntmachungsdatum)\n\nNordrhein-Westfalen Amtsgericht Münster HRB 14044\nEinreichung neuer Dokumente\n\nA.S.I. Wirtschaftsberatung AG\nAktiengesellschaft\nMünster\n\nDem Registergericht ist eine neue Liste der Mitglieder des Aufsichtsrates eingereicht worden."
    },
    {
      "date": "2024-10-22",
      "id": "91305",
      "original_text": "Registerbekanntmachung nach dem Umwandlungsgesetz\nNordrhein-Westfalen Amtsgericht Düsseldorf HRB 61285\nI.T. Vermögensverwaltung GmbH – Düsseldorf",
      "type": "Registerbekanntmachung nach dem Umwandlungsgesetz",
      "state": "Nordrhein-Westfalen",
      "amtsgericht": "Amtsgericht Düsseldorf",
      "registernummer": "HRB 61285",
      "registerart": "HRB",
      "company_name": "I.T. Vermögensverwaltung GmbH",
      "company_seat": "Düsseldorf",
      "details": "22.10.2024 (Bekanntmachungsdatum)\n\nNordrhein-Westfalen Amtsgericht Düsseldorf HRB 61285\nRegisterbekanntmachung nach dem Umwandlungsgesetz 22.10.2024 (Eintragungsdatum)\n\nI.T. Vermögensverwaltung GmbH\nGesellschaft mit beschränkter Haftung\nDüsseldorf\n\nDen Gläubigern der an der Verschmelzung beteiligten Rechtsträger ist, wenn sie binnen sechs Monaten nach dem Tag, an dem die Eintragung der Verschmelzung in das Register des Sitzes desjenigen Rechtsträgers, dessen Gläubiger sie sind, nach § 19 Absatz 3 UmwG als bekanntgemacht gilt, ihren Anspruch nach Grund und Höhe schriftlich anmelden, Sicherheit zu leisten, soweit sie nicht Befriedigung verlangen können. Dieses Recht steht den Gläubigern jedoch nur zu, wenn sie glaubhaft machen, dass durch die Verschmelzung die Erfüllung ihrer Forderung gefährdet wird."
    },
    {
      "date": "2024-10-22",
      "id": "91306",
      "original_text": "Registerbekanntmachung nach dem Umwandlungsgesetz\nNordrhein-Westfalen Amtsgericht Dortmund HRA 19761\nESKO Reifendienst und Kfz-Fachbetrieb e.K. – Dortmund",
      "type": "Registerbekanntmachung nach dem Umwandlungsgesetz",
      "state": "Nordrhein-Westfalen",
      "amtsgericht": "Amtsgericht Dortmund",
      "registernummer": "HRA 19761",
      "registerart": "HRA",
      "company_name": "ESKO Reifendienst und Kfz-Fachbetrieb e.K.",
      "company_seat": "Dortmund",
      "details": "22.10.2024 (Bekanntmachungsdatum)\n\nNordrhein-Westfalen Amtsgericht Dortmund HRA 19761\nRegisterbekanntmachung nach dem Umwandlungsgesetz 22.10.2024 (Eintragungsdatum)\n\nESKO Reifendienst und Kfz-Fachbetrieb e.K.\nEinzelkaufmann / Einzelkauffrau\nDortmund\n\nDen Gläubigern der an der Ausgliederung beteiligten Rechtsträger ist, wenn sie binnen sechs Monaten nach dem Tag, an dem die Eintragung der Ausgliederung in das Register des Sitzes desjenigen Rechtsträgers, dessen Gläubiger sie sind, nach § 19 Absatz 3 UmwG als bekanntgemacht gilt, ihren Anspruch nach Grund und Höhe schriftlich anmelden, Sicherheit zu leisten, soweit sie nicht Befriedigung verlangen können. Dieses Recht steht den Gläubigern jedoch nur zu, wenn sie glaubhaft machen, dass durch die Ausgliederung die Erfüllung ihrer Forderung gefährdet wird."
    },
    {
      "date": "2024-10-22",
      "id": "91307",
      "original_text": "Einreichung neuer Dokumente\nThüringen Amtsgericht Jena HRB 400910\nWippertal Wohnungsbau- und Grundstücksgesellschaft mbH – Sondershausen",
      "type": "Einreichung neuer Dokumente",
      "state": "Thüringen",
      "amtsgericht": "Amtsgericht Jena",
      "registernummer": "HRB 400910",
      "registerart": "HRB",
      "company_name": "Wippertal Wohnungsbau- und Grundstücksgesellschaft mbH",
      "company_seat": "Sondershausen",
      "details": "22.10.2024 (Bekanntmachungsdatum)\n\nThüringen Amtsgericht Jena HRB 400910\nEinreichung neuer Dokumente\n\nWippertal Wohnungsbau- und Grundstücksgesellschaft mbH\nGesellschaft mit beschränkter Haftung\nSondershausen\n\nBekanntmachung gem. § 52 Abs. 3 Satz 2 GmbHG: Aufgrund einer Veränderung in den Personen der Aufsichtsratsmitglieder ist durch die Geschäftsführer eine neue Liste zum Handelsregister eingereicht worden."
    },
    {
      "date": "2024-10-22",
      "id": "91308",
      "original_text": "Registerbekanntmachung nach dem Umwandlungsgesetz\nThüringen Amtsgericht Jena HRB 509164\nKrankenpflege Ellen Pieger GmbH – Neustadt an der Orla",
      "type": "Registerbekanntmachung nach dem Umwandlungsgesetz",
      "state": "Thüringen",
      "amtsgericht": "Amtsgericht Jena",
      "registernummer": "HRB 509164",
      "registerart": "HRB",
      "company_name": "Krankenpflege Ellen Pieger GmbH",
      "company_seat": "Neustadt an der Orla",
      "details": "22.10.2024 (Bekanntmachungsdatum)\n\nThüringen Amtsgericht Jena HRB 509164\nRegisterbekanntmachung nach dem Umwandlungsgesetz 15.10.2024 (Eintragungsdatum)\n\nKrankenpflege Ellen Pieger GmbH\nGesellschaft mit beschränkter Haftung\nNeustadt an der Orla\n\nNicht eingetragen: Den Gläubigern der an der Verschmelzung beteiligten Rechtsträger, ist wenn sie binnen sechs Monaten nach dem Tag, an dem die Eintragung der Verschmelzung in das Register des Sitzes desjenigen Rechtsträgers, dessen Gläubiger sie sind,  nach § 19 Abs. 3 UmwG als bekanntgemacht gilt, ihren Anspruch nach Grund und Höhe schriftlich anmelden, Sicherheit zu leisten, soweit sie nicht Befriedigung verlangen können. Dieses Recht steht ihnen jedoch nur zu, wenn sie glaubhaft machen, daß durch die Verschmelzung die Erfüllung ihrer Forderung gefährdet wird."
    },
    {
      "date": "2024-10-22",
      "id": "91309",
      "original_text": "Einreichung neuer Dokumente\nThüringen Amtsgericht Jena HRB 402436\nBadehaus Nordhausen GmbH – Nordhausen",
      "type": "Einreichung neuer Dokumente",
      "state": "Thüringen",
      "amtsgericht": "Amtsgericht Jena",
      "registernummer": "HRB 402436",
      "registerart": "HRB",
      "company_name": "Badehaus Nordhausen GmbH",
      "company_seat": "Nordhausen",
      "details": "22.10.2024 (Bekanntmachungsdatum)\n\nThüringen Amtsgericht Jena HRB 402436\nEinreichung neuer Dokumente\n\nBadehaus Nordhausen GmbH\nGesellschaft mit beschränkter Haftung\nNordhausen\n\nBekanntmachung gem. § 52 Abs. 3 Satz 2 GmbHG: Aufgrund einer Veränderung in den Personen der Aufsichtsratsmitglieder ist durch die Geschäftsführer eine neue Liste zum Handelsregister eingereicht worden."
    },
    {
      "date": "2024-10-22",
      "id": "91310",
      "original_text": "Registerbekanntmachung nach dem Umwandlungsgesetz\nRheinland-Pfalz Amtsgericht Ludwigshafen a.Rhein (Ludwigshafen) HRB 69156\nSOFTTECH GmbH – Neustadt an der Weinstraße",
      "type": "Registerbekanntmachung nach dem Umwandlungsgesetz",
      "state": "Rheinland-Pfalz",
      "amtsgericht": "Amtsgericht Ludwigshafen a.Rhein (Ludwigshafen)",
      "registernummer": "HRB 69156",
      "registerart": "HRB",
      "company_name": "SOFTTECH GmbH",
      "company_seat": "Neustadt an der Weinstraße",
      "details": "22.10.2024 (Bekanntmachungsdatum)\n\nRheinland-Pfalz Amtsgericht Ludwigshafen a.Rhein (Ludwigshafen) HRB 69156\nRegisterbekanntmachung nach dem Umwandlungsgesetz 22.10.2024 (Eintragungsdatum)\n\nSOFTTECH GmbH\nGesellschaft mit beschränkter Haftung\nNeustadt an der Weinstraße\n\nAls nicht eingetragen wird veröffentlicht: Den Gläubigern der an der Verschmelzung beteiligten Rechtsträger ist, wenn sie binnen sechs Monaten nach dem Tag, an dem die Eintragung der Verschmelzung in das Register des Sitzes desjenigen Rechtsträgers, dessen Gläubiger sie sind, nach § 19 Abs. 3 UmwG als bekannt gemacht gilt, ihren Anspruch nach Grund und Höhe schriftlich anmelden, Sicherheit zu leisten, soweit sie nicht Befriedigung verlangen können. Dieses Recht steht den Gläubigern jedoch nur zu, wenn sie glaubhaft machen, dass durch die Verschmelzung die Erfüllung der Forderung gefährdet wird."
    },
    {
      "date": "2024-10-22",
      "id": "91311",
      "original_text": "Registerbekanntmachung nach dem Umwandlungsgesetz\nRheinland-Pfalz Amtsgericht Ludwigshafen a.Rhein (Ludwigshafen) HRB 62924\neinsteinConcept GmbH – Neustadt",
      "type": "Registerbekanntmachung nach dem Umwandlungsgesetz",
      "state": "Rheinland-Pfalz",
      "amtsgericht": "Amtsgericht Ludwigshafen a.Rhein (Ludwigshafen)",
      "registernummer": "HRB 62924",
      "registerart": "HRB",
      "company_name": "einsteinConcept GmbH",
      "company_seat": "Neustadt",
      "details": "22.10.2024 (Bekanntmachungsdatum)\n\nRheinland-Pfalz Amtsgericht Ludwigshafen a.Rhein (Ludwigshafen) HRB 62924\nRegisterbekanntmachung nach dem Umwandlungsgesetz 22.10.2024 (Eintragungsdatum)\n\neinsteinConcept GmbH\nGesellschaft mit beschränkter Haftung\nNeustadt\n\nAls nicht eingetragen wird veröffentlicht: Den Gläubigern der an der Verschmelzung beteiligten Rechtsträger ist, wenn sie binnen sechs Monaten nach dem Tag, an dem die Eintragung der Verschmelzung in das Register des Sitzes desjenigen Rechtsträgers, dessen Gläubiger sie sind, nach § 19 Abs. 3 UmwG als bekannt gemacht gilt, ihren Anspruch nach Grund und Höhe schriftlich anmelden, Sicherheit zu leisten, soweit sie nicht Befriedigung verlangen können. Dieses Recht steht den Gläubigern jedoch nur zu, wenn sie glaubhaft machen, dass durch die Verschmelzung die Erfüllung der Forderung gefährdet wird."
    },
    {
      "date": "2024-10-22",
      "id": "91312",
      "original_text": "Registerbekanntmachung nach dem Umwandlungsgesetz\nHessen Amtsgericht Wiesbaden VR 1410\nCaritasverband Wiesbaden-Rheingau-Taunus e.V. – Wiesbaden",
      "type": "Registerbekanntmachung nach dem Umwandlungsgesetz",
      "state": "Hessen",
      "amtsgericht": "Amtsgericht Wiesbaden",
      "registernummer": "VR 1410",
      "registerart": "VR",
      "company_name": "Caritasverband Wiesbaden-Rheingau-Taunus e.V.",
      "company_seat": "Wiesbaden",
      "details": "22.10.2024 (Bekanntmachungsdatum)\n\nHessen Amtsgericht Wiesbaden VR 1410\nRegisterbekanntmachung nach dem Umwandlungsgesetz 22.10.2024 (Eintragungsdatum)\n\nCaritasverband Wiesbaden-Rheingau-Taunus e.V.\neingetragener Verein\nWiesbaden\n\nDen Gläubigern der an der Verschmelzung beteiligten Rechtsträger ist, wenn sie binnen sechs Monaten nach dem Tag, an dem die Eintragung der Verschmelzung in das Register des Sitzes derjenigen Rechtsträger deren Gläubiger sie sind, nach § 201 UmwG bekannt gemacht worden ist, ihren Anspruch nach Grund und Höhe schriftlich anmelden, Sicherheit zu leisten, soweit sie nicht Befriedigung verlangen können. Dieses Recht steht den Gläubigern jedoch nur zu, wenn sie glaubhaft machen, dass durch die Verschmelzung die Erfüllung ihrer Forderung gefährdet wird."
    },
    {
      "date": "2024-10-22",
      "id": "91313",
      "original_text": "Löschungsankündigung\nHessen Amtsgericht Frankfurt am Main HRB 89310\nCantine Paolo Dettori GmbH – Frankfurt am Main",
      "type": "Löschungsankündigung",
      "state": "Hessen",
      "amtsgericht": "Amtsgericht Frankfurt am Main",
      "registernummer": "HRB 89310",
      "registerart": "HRB",
      "company_name": "Cantine Paolo Dettori GmbH",
      "company_seat": "Frankfurt am Main",
      "details": "22.10.2024 (Bekanntmachungsdatum)\n\nHessen Amtsgericht Frankfurt am Main HRB 89310\nLöschungsankündigung\n\nCantine Paolo Dettori GmbH\nGesellschaft mit beschränkter Haftung\nFrankfurt am Main\n\nDas Registergericht beabsichtigt die im Handelsregister eingetragene Gesellschaft von Amts wegen nach § 394 FamFG zu löschen. Die Frist zur Erhebung eines Widerspruchs gegen die beabsichtigte Löschung wird auf 1 Monat festgesetzt."
    },
    {
      "date": "2024-10-22",
      "id": "91314",
      "original_text": "Löschungsankündigung\nHessen Amtsgericht Bad Hersfeld HRB 2148\nBZH Vertriebsgesellschaft mbH Wildeck – Wildeck",
      "type": "Löschungsankündigung",
      "state": "Hessen",
      "amtsgericht": "Amtsgericht Bad Hersfeld",
      "registernummer": "HRB 2148",
      "registerart": "HRB",
      "company_name": "BZH Vertriebsgesellschaft mbH Wildeck",
      "company_seat": "Wildeck",
      "details": "22.10.2024 (Bekanntmachungsdatum)\n\nHessen Amtsgericht Bad Hersfeld HRB 2148\nLöschungsankündigung 22.10.2024 (Eintragungsdatum)\n\nBZH Vertriebsgesellschaft mbH Wildeck\nGesellschaft mit beschränkter Haftung\nWildeck\n\nDas Registergericht beabsichtigt die im Handelsregister eingetragene Gesellschaft von Amts wegen nach § 394 FamFG zu löschen. Die Frist zur Erhebung eines Widerspruchs gegen die beabsichtigte Löschung wird auf 6 Wochen festgesetzt."
    },
    {
      "date": "2024-10-22",
      "id": "91315",
      "original_text": "Sonstige Registerbekanntmachung\nHessen Amtsgericht Fritzlar VR 3909\nBromsberg e.V. – Spangenberg",
      "type": "Sonstige Registerbekanntmachung",
      "state": "Hessen",
      "amtsgericht": "Amtsgericht Fritzlar",
      "registernummer": "VR 3909",
      "registerart": "VR",
      "company_name": "Bromsberg e.V.",
      "company_seat": "Spangenberg",
      "details": "22.10.2024 (Bekanntmachungsdatum)\n\nHessen Amtsgericht Fritzlar VR 3909\nSonstige Registerbekanntmachung 22.10.2024 (Eintragungsdatum)\n\nBromsberg e.V.\neingetragener Verein\nSpangenberg\n\nDer Verein ist aufgelöst."
    },
    {
      "date": "2024-10-22",
      "id": "91316",
      "original_text": "Einreichung neuer Dokumente\nHessen Amtsgericht Wiesbaden HRB 8139\nFederal-Mogul Holding Deutschland GmbH – Wiesbaden",
      "type": "Einreichung neuer Dokumente",
      "state": "Hessen",
      "amtsgericht": "Amtsgericht Wiesbaden",
      "registernummer": "HRB 8139",
      "registerart": "HRB",
      "company_name": "Federal-Mogul Holding Deutschland GmbH",
      "company_seat": "Wiesbaden",
      "details": "22.10.2024 (Bekanntmachungsdatum)\n\nHessen Amtsgericht Wiesbaden HRB 8139\nEinreichung neuer Dokumente 22.10.2024 (Eintragungsdatum)\n\nFederal-Mogul Holding Deutschland GmbH\nGesellschaft mit beschränkter Haftung\nWiesbaden\n\nDurch eine Änderung in den Personen der Aufsichtsratsmitglieder ist eine Liste der Mitglieder des Aufsichtsrates zum Handelsregister eingereicht worden."
    },
    {
      "date": "2024-10-22",
      "id": "91317",
      "original_text": "Löschungsankündigung\nHessen Amtsgericht Darmstadt HRB 97678\nHTM GmbH – Lampertheim",
      "type": "Löschungsankündigung",
      "state": "Hessen",
      "amtsgericht": "Amtsgericht Darmstadt",
      "registernummer": "HRB 97678",
      "registerart": "HRB",
      "company_name": "HTM GmbH",
      "company_seat": "Lampertheim",
      "details": "22.10.2024 (Bekanntmachungsdatum)\n\nHessen Amtsgericht Darmstadt HRB 97678\nLöschungsankündigung\n\nHTM GmbH\nGesellschaft mit beschränkter Haftung\nLampertheim\n\nDas Registergericht beabsichtigt die im Handelsregister eingetragene Gesellschaft von Amts wegen nach § 394 FamFG zu löschen. Die Frist zur Erhebung eines Widerspruchs gegen die beabsichtigte Löschung wird auf 3 Monate festgesetzt."
    },
    {
      "date": "2024-10-22",
      "id": "91318",
      "original_text": "Registerbekanntmachung nach dem Umwandlungsgesetz\nHessen Amtsgericht Wiesbaden HRB 8405\nCaritas Altenwohn- und Pflegegesellschaft mbH (CAP) – Wiesbaden",
      "type": "Registerbekanntmachung nach dem Umwandlungsgesetz",
      "state": "Hessen",
      "amtsgericht": "Amtsgericht Wiesbaden",
      "registernummer": "HRB 8405",
      "registerart": "HRB",
      "company_name": "Caritas Altenwohn- und Pflegegesellschaft mbH (CAP)",
      "company_seat": "Wiesbaden",
      "details": "22.10.2024 (Bekanntmachungsdatum)\n\nHessen Amtsgericht Wiesbaden HRB 8405\nRegisterbekanntmachung nach dem Umwandlungsgesetz 22.10.2024 (Eintragungsdatum)\n\nCaritas Altenwohn- und Pflegegesellschaft mbH (CAP)\nGesellschaft mit beschränkter Haftung\nWiesbaden\n\nDen Gläubigern der an der Ausgliederung beteiligten Rechtsträger ist, wenn sie binnen sechs Monaten nach dem Tag, an dem die Eintragung der Ausgliederung in das Register des Sitzes derjenigen Rechtsträger deren Gläubiger sie sind, nach §§ 125, 19 Absatz 3 UmwG bekannt gemacht worden ist, ihren Anspruch nach Grund und Höhe schriftlich anmelden, Sicherheit zu leisten, soweit sie nicht Befriedigung verlangen können. Dieses Recht steht den Gläubigern jedoch nur zu, wenn sie glaubhaft machen, dass durch die Ausgliederung die Erfüllung ihrer Forderung gefährdet wird."
    },
    {
      "date": "2024-10-22",
      "id": "91319",
      "original_text": "Löschungsankündigung\nHessen Amtsgericht Frankfurt am Main HRB 73940\nHalf-Light Produktions GmbH – Frankfurt am Main",
      "type": "Löschungsankündigung",
      "state": "Hessen",
      "amtsgericht": "Amtsgericht Frankfurt am Main",
      "registernummer": "HRB 73940",
      "registerart": "HRB",
      "company_name": "Half-Light Produktions GmbH",
      "company_seat": "Frankfurt am Main",
      "details": "22.10.2024 (Bekanntmachungsdatum)\n\nHessen Amtsgericht Frankfurt am Main HRB 73940\nLöschungsankündigung 22.10.2024 (Eintragungsdatum)\n\nHalf-Light Produktions GmbH\nGesellschaft mit beschränkter Haftung\nFrankfurt am Main\n\nDas Registergericht beabsichtigt die im Handelsregister eingetragene Gesellschaft von Amts wegen nach § 394 FamFG zu löschen. Die Frist zur Erhebung eines Widerspruchs gegen die beabsichtigte Löschung wird auf 1 Monat festgesetzt."
    },
    {
      "date": "2024-10-22",
      "id": "91320",
      "original_text": "Registerbekanntmachung nach dem Umwandlungsgesetz\nRheinland-Pfalz Amtsgericht Ludwigshafen a.Rhein (Ludwigshafen) HRA 21428\nFrankenthaler Pressevertrieb GmbH & Co. KG – Frankenthal",
      "type": "Registerbekanntmachung nach dem Umwandlungsgesetz",
      "state": "Rheinland-Pfalz",
      "amtsgericht": "Amtsgericht Ludwigshafen a.Rhein (Ludwigshafen)",
      "registernummer": "HRA 21428",
      "registerart": "HRA",
      "company_name": "Frankenthaler Pressevertrieb GmbH & Co. KG",
      "company_seat": "Frankenthal",
      "details": "22.10.2024 (Bekanntmachungsdatum)\n\nRheinland-Pfalz Amtsgericht Ludwigshafen a.Rhein (Ludwigshafen) HRA 21428\nRegisterbekanntmachung nach dem Umwandlungsgesetz 22.10.2024 (Eintragungsdatum)\n\nFrankenthaler Pressevertrieb GmbH & Co. KG\nKommanditgesellschaft\nFrankenthal\n\nAls nicht eingetragen wird veröffentlicht: Den Gläubigern der an der Ausgliederung beteiligten Rechtsträger ist, wenn sie binnen sechs Monaten nach dem Tag, an dem die Eintragung der Ausgliederung in das Register des Sitzes desjenigen Rechtsträgers,dessen Gläubiger sie sind, nach § 19 Abs. 3 UmwG als bekannt gemacht gilt, ihren Anspruch nach Grund und Höhe schriftlich anmelden, Sicherheit zu leisten, soweit sie nicht Befriedigung verlangen können. Dieses Recht steht den Gläubigern jedoch nur zu, wenn sie glaubhaft machen, dass durch die Ausgliederung die Erfüllung der Forderung gefährdet wird."
    },
    {
      "date": "2024-10-22",
      "id": "91321",
      "original_text": "Registerbekanntmachung nach dem Umwandlungsgesetz\nBaden-Württemberg Amtsgericht Stuttgart HRA 360418\nSÜDWEST PRESSE Neckar-Alb GmbH & Co. KG – Metzingen",
      "type": "Registerbekanntmachung nach dem Umwandlungsgesetz",
      "state": "Baden-Württemberg",
      "amtsgericht": "Amtsgericht Stuttgart",
      "registernummer": "HRA 360418",
      "registerart": "HRA",
      "company_name": "SÜDWEST PRESSE Neckar-Alb GmbH & Co. KG",
      "company_seat": "Metzingen",
      "details": "22.10.2024 (Bekanntmachungsdatum)\n\nBaden-Württemberg Amtsgericht Stuttgart HRA 360418\nRegisterbekanntmachung nach dem Umwandlungsgesetz 22.10.2024 (Eintragungsdatum)\n\nSÜDWEST PRESSE Neckar-Alb GmbH & Co. KG\nKommanditgesellschaft\nMetzingen\n\nAls nicht eingetragen wird bekanntgemacht:\nDen Gläubigern der an der Verschmelzung beteiligten Rechtsträger ist, wenn sie binnen sechs Monaten nach dem Tag, an dem die Eintragung der Verschmelzung in das Register des Sitzes desjenigen Rechtsträgers, dessen Gläubiger sie sind, nach § 19 Abs. 3 UmwG als bekanntgemacht gilt, ihren Anspruch nach Grund und Höhe schriftlich anmelden, Sicherheit zu leisten, soweit sie nicht Befriedigung verlangen können. Dieses Recht steht den Gläubigern jedoch nur zu, wenn sie glaubhaft machen, dass durch die Verschmelzung die Erfüllung ihrer Forderung gefährdet wird."
    }
  ]
}