{
  "date": "2024-10-21",
  "date_of_scrape": "2024-11-30T14:08:22.558Z",
  "tool_version": "0.2.0",
  "number_of_announcements": 176,
  "announcements": [
    {
      "date": "2024-10-21",
      "id": "61",
      "original_text": "Sonderregisterbekanntmachung OHNE Bezug zum elektr. Register\nBerlin Amtsgericht Berlin (Charlottenburg)\nHRB 17289 B (gelöscht 1996)\nE.V.C. Immobilien GMBH",
      "type": "Sonderregisterbekanntmachung OHNE Bezug zum elektr. Register",
      "state": "Berlin",
      "amtsgericht": "Amtsgericht Berlin (Charlottenburg)",
      "company_name": "E.V.C. Immobilien GMBH",
      "sonderegister_referenz": "HRB 17289 B (gelöscht 1996)",
      "details": "21.10.2024 (Bekanntmachungsdatum)\n\nBerlin Amtsgericht Berlin (Charlottenburg)\nHRB 17289 B (gelöscht 1996)\nSonderregisterbekanntmachung OHNE Bezug zum elektr. Register\n\nE.V.C. Immobilien GMBH\n\nDurch das Amtsgericht Charlottenburg wurde am 21.10.2024 der nachfolgende Beschluss erlassen:\n\nIn dem unternehmensrechtlichen Verfahren\n\nHRB 17289 B\n\nder am 19.02.1996 wegen Vermögenslosigkeit gelöschten E.V.C. Immobilien GMBH\n\nwird auf den Antrag vom 20.02.2023 des\nHerrn Dr. Volkhard Erwin Philipp Misch,\ngeb. am 15.02.1950,\nwhft. in Aachen,\n\nim Verfahren vertreten durch den Notar\nHerrn Dr. Malte Diesselhorst,\ngeschäftsansässig Ludwigkirchstraße 9\n10719 Berlin\n\nHerr Rechtsanwalt\nMoritz Simon Volkenborn,\ngeb. am 11.10.1979,\ngeschäftsansässig Ludwigkirchstraße 9\n10719 Berlin\n\nzum  N a c h t r a g s l i q u i d a t o r  bestellt.\n\nDer Wirkungskreis des Nachtragsliquidators ist beschränkt auf die Vertretung und Wahrnehmung der Rechte und Pflichten der gelöschten Gesellschaft hinsichtlich der im beim Amtsgericht Charlottenburg geführten Wohnungsgrundbuch von Berlin-Wilmersdorf, Blatt 13394, in Abteilung III zur lfd. Nr. 4 eingetragenen Brief-Grundschuld, dabei insbesondere die Prüfung, ob die dieser Grundschuld ursprünglich zugrunde gelegten Forderung beglichen ist, sowie die anschließende Bewirkung der Löschung des Rechts, mittels Abgabe der entsprechenden Löschungsbewilligung.\nAus der Bestellung können Ansprüche gegen das Land Berlin auf Vergütung oder Auslagenerstattung nicht geltend gemacht werden.\n\nDer Geschäftswert wird auf 3.000,00 EUR bestimmt.\n\nRechtsbehelfsbelehrung:\n\nGegen diesen Beschluss ist die Beschwerde statthaft. Die Beschwerde ist durch Einreichung einer Beschwerdeschrift beim Amtsgericht Charlottenburg (Hardenbergstraße 31, 10623 Berlin) oder zur Niederschrift der Geschäftsstelle (Rechtsantragsstelle Amtsgericht Charlottenburg, Amtsgerichtsplatz 1, 14057 Berlin) einzulegen.\nWird die Beschwerde durch einen Rechtsanwalt, einen Notar, eine Behörde oder eine juristische Person des öffentlichen Rechts einschließlich der von ihr zu r Erfüllung ihrer öffentlichen Aufgaben gebildeten Zusammenschlüsse eingelegt, ist diese als elektronisches Dokument zu übersenden.\nDie Beschwerdefrist beträgt einen Monat und beginnt mit der Bekanntgabe dieses Beschlusses. Die Beschwerde muss die Bezeichnung des angefochtenen Beschlusses sowie die Erklärung enthalten, dass Beschwerde gegen diesen Beschluss eingelegt wird. Die Beschwerde soll begründet sein."
    },
    {
      "date": "2024-10-21",
      "id": "90994",
      "original_text": "Löschungsankündigung\nBerlin Amtsgericht Berlin (Charlottenburg) HRB 189375\nCMST Berlin UG (haftungsbeschränkt) – Berlin",
      "type": "Löschungsankündigung",
      "state": "Berlin",
      "amtsgericht": "Amtsgericht Berlin (Charlottenburg)",
      "registernummer": "HRB 189375",
      "registerart": "HRB",
      "company_name": "CMST Berlin UG (haftungsbeschränkt)",
      "company_seat": "Berlin",
      "details": "21.10.2024 (Bekanntmachungsdatum)\n\nBerlin Amtsgericht Berlin (Charlottenburg) HRB 189375\nLöschungsankündigung\n\nCMST Berlin UG (haftungsbeschränkt)\nGesellschaft mit beschränkter Haftung\nBerlin\n\nBei der nachstehenden Gesellschaft wird das Amtslöschungsverfahren gemäß § 394 FamFG eingeleitet. Widerspruchsfrist 6 Wochen"
    },
    {
      "date": "2024-10-21",
      "id": "90995",
      "original_text": "Löschungsankündigung\nBerlin Amtsgericht Berlin (Charlottenburg) HRB 247377\nDS Regalmontage GmbH – Berlin",
      "type": "Löschungsankündigung",
      "state": "Berlin",
      "amtsgericht": "Amtsgericht Berlin (Charlottenburg)",
      "registernummer": "HRB 247377",
      "registerart": "HRB",
      "company_name": "DS Regalmontage GmbH",
      "company_seat": "Berlin",
      "details": "21.10.2024 (Bekanntmachungsdatum)\n\nBerlin Amtsgericht Berlin (Charlottenburg) HRB 247377\nLöschungsankündigung\n\nDS Regalmontage GmbH\nGesellschaft mit beschränkter Haftung\nBerlin\n\nBei der nachstehenden Gesellschaft wird das Amtslöschungsverfahren gemäß § 394 FamFG eingeleitet. Widerspruchsfrist 6 Wochen"
    },
    {
      "date": "2024-10-21",
      "id": "90996",
      "original_text": "Einreichung neuer Dokumente\nSaarland Amtsgericht Saarbrücken HRB 102685\nIB-Lenhardt AG – St. Ingbert",
      "type": "Einreichung neuer Dokumente",
      "state": "Saarland",
      "amtsgericht": "Amtsgericht Saarbrücken",
      "registernummer": "HRB 102685",
      "registerart": "HRB",
      "company_name": "IB-Lenhardt AG",
      "company_seat": "St. Ingbert",
      "details": "21.10.2024 (Bekanntmachungsdatum)\n\nSaarland Amtsgericht Saarbrücken HRB 102685\nEinreichung neuer Dokumente\n\nIB-Lenhardt AG\nAktiengesellschaft\nSt. Ingbert\n\nDer Vorstand der Gesellschaft hat eine Liste der Mitglieder des Aufsichtsrats zum Handelsregister eingereicht (§ 106 AktG)."
    },
    {
      "date": "2024-10-21",
      "id": "90997",
      "original_text": "Sonstige Registerbekanntmachung\nBaden-Württemberg Amtsgericht Mannheim HRB 5582\nm:con - mannheim:congress GmbH – Mannheim",
      "type": "Sonstige Registerbekanntmachung",
      "state": "Baden-Württemberg",
      "amtsgericht": "Amtsgericht Mannheim",
      "registernummer": "HRB 5582",
      "registerart": "HRB",
      "company_name": "m:con - mannheim:congress GmbH",
      "company_seat": "Mannheim",
      "details": "21.10.2024 (Bekanntmachungsdatum)\n\nBaden-Württemberg Amtsgericht Mannheim HRB 5582\nSonstige Registerbekanntmachung\n\nm:con - mannheim:congress GmbH\nGesellschaft mit beschränkter Haftung\nMannheim\n\nDie Gesellschaft hat am 18.10.2024 die Liste über die Zusammensetzung des Aufsichtsrats zum Handelsregister eingereicht."
    },
    {
      "date": "2024-10-21",
      "id": "90998",
      "original_text": "Registerbekanntmachung nach dem Umwandlungsgesetz\nMecklenburg-Vorpommern Amtsgericht Schwerin HRB 12459\nWismar Pellets GmbH – Wismar",
      "type": "Registerbekanntmachung nach dem Umwandlungsgesetz",
      "state": "Mecklenburg-Vorpommern",
      "amtsgericht": "Amtsgericht Schwerin",
      "registernummer": "HRB 12459",
      "registerart": "HRB",
      "company_name": "Wismar Pellets GmbH",
      "company_seat": "Wismar",
      "details": "21.10.2024 (Bekanntmachungsdatum)\n\nMecklenburg-Vorpommern Amtsgericht Schwerin HRB 12459\nRegisterbekanntmachung nach dem Umwandlungsgesetz 21.10.2024 (Eintragungsdatum)\n\nWismar Pellets GmbH\nGesellschaft mit beschränkter Haftung\nWismar\n\nDen Gläubigern der an der Verschmelzung beteiligten Gesellschaften ist, wenn sie binnen sechs Monaten nach dem Tag, an dem die Eintragung der Verschmelzungen in das Register des Sitzes desjenigen Rechtsträgers, dessen Gläubiger sie sind, nach § 19 Absatz 3 UmwG als bekanntgemacht gilt, ihren Anspruch nach Grund und Höhe schriftlich anmelden, Sicherheit zu leisten, soweit sie nicht Befriedigung verlangen können. Dieses Recht steht den Gläubigern jedoch nur zu, wenn sie glaubhaft machen, dass durch die Verschmelzung die Erfüllung ihrer Forderung gefährdet wird."
    },
    {
      "date": "2024-10-21",
      "id": "90999",
      "original_text": "Löschungsankündigung\nBerlin Amtsgericht Berlin (Charlottenburg) HRB 126460\nTextilpflege 35 UG (haftungsbeschränkt) – Berlin",
      "type": "Löschungsankündigung",
      "state": "Berlin",
      "amtsgericht": "Amtsgericht Berlin (Charlottenburg)",
      "registernummer": "HRB 126460",
      "registerart": "HRB",
      "company_name": "Textilpflege 35 UG (haftungsbeschränkt)",
      "company_seat": "Berlin",
      "details": "21.10.2024 (Bekanntmachungsdatum)\n\nBerlin Amtsgericht Berlin (Charlottenburg) HRB 126460\nLöschungsankündigung\n\nTextilpflege 35 UG (haftungsbeschränkt)\nGesellschaft mit beschränkter Haftung\nBerlin\n\nBei der nachstehenden Gesellschaft wird das Amtslöschungsverfahren gemäß § 394 FamFG eingeleitet. Widerspruchsfrist 6 Wochen"
    },
    {
      "date": "2024-10-21",
      "id": "91000",
      "original_text": "Löschungsankündigung\nBrandenburg Amtsgericht Frankfurt/Oder HRB 20472\nSpedition TurnOver UG (haftungsbeschränkt) – Bad Freienwalde (Oder)",
      "type": "Löschungsankündigung",
      "state": "Brandenburg",
      "amtsgericht": "Amtsgericht Frankfurt/Oder",
      "registernummer": "HRB 20472",
      "registerart": "HRB",
      "company_name": "Spedition TurnOver UG (haftungsbeschränkt)",
      "company_seat": "Bad Freienwalde (Oder)",
      "details": "21.10.2024 (Bekanntmachungsdatum)\n\nBrandenburg Amtsgericht Frankfurt/Oder HRB 20472\nLöschungsankündigung\n\nSpedition TurnOver UG (haftungsbeschränkt)\nGesellschaft mit beschränkter Haftung\nBad Freienwalde (Oder)\n\nBei der nachstehenden Gesellschaft wird das Amtslöschungsverfahren gemäß § 394 FamFG eingeleitet."
    },
    {
      "date": "2024-10-21",
      "id": "91001",
      "original_text": "Löschungsankündigung\nSaarland Amtsgericht Saarbrücken HRB 101245\nKoch Handling & Mechanics GmbH – Püttlingen",
      "type": "Löschungsankündigung",
      "state": "Saarland",
      "amtsgericht": "Amtsgericht Saarbrücken",
      "registernummer": "HRB 101245",
      "registerart": "HRB",
      "company_name": "Koch Handling & Mechanics GmbH",
      "company_seat": "Püttlingen",
      "details": "21.10.2024 (Bekanntmachungsdatum)\n\nSaarland Amtsgericht Saarbrücken HRB 101245\nLöschungsankündigung\n\nKoch Handling & Mechanics GmbH\nGesellschaft mit beschränkter Haftung\nPüttlingen\n\nEs ist beabsichtigt, die Gesellschaft von Amts wegen gemäß § 394 FamFG wegen Vermögenslosigkeit zu löschen.\nGegen die Löschung von Amts wegen ist das Rechtsmittel des Widerspruchs statthaft. Der Widerspruch ist binnen einer Frist zwei Monaten beginnend mit dem Tag dieser Veröffentlichung durch Einreichen eines Widerspruchsschreibens -schriftlich oder zur Niederschrift der Geschäftsstelle beim Amtsgericht Saarbrücken, -zentrales Handelsregister-, Mainzerstr.178, 66121 Saarbrücken einzulegen.\nDer Widerspruch muss die Bezeichnung der angefochtenen Löschungsankündigung enthalten sowie die Erklärung, dass Widerspruch eingelegt wird. Er ist vom Widerspruchsführer oder seinem Bevollmächtigten zu unterzeichnen.\nDas Widerspruchsschreiben kann auch in der Form eines elektronischen Dokumentes eingereicht werden, das mit einer qualifizierten elektronischen Signatur nach dem Signaturgesetz versehen sein muss (§§ 14 Abs. 2 FamFG, 130a, 298 ZPO)."
    },
    {
      "date": "2024-10-21",
      "id": "91002",
      "original_text": "Löschungsankündigung\nBaden-Württemberg Amtsgericht Mannheim HRB 709696\nwanke marketing + management 2 UG (haftungsbeschränkt) – Haßmersheim",
      "type": "Löschungsankündigung",
      "state": "Baden-Württemberg",
      "amtsgericht": "Amtsgericht Mannheim",
      "registernummer": "HRB 709696",
      "registerart": "HRB",
      "company_name": "wanke marketing + management 2 UG (haftungsbeschränkt)",
      "company_seat": "Haßmersheim",
      "details": "21.10.2024 (Bekanntmachungsdatum)\n\nBaden-Württemberg Amtsgericht Mannheim HRB 709696\nLöschungsankündigung\n\nwanke marketing + management 2 UG (haftungsbeschränkt)\nGesellschaft mit beschränkter Haftung\nHaßmersheim\n\nDas Gericht beabsichtigt, die Gesellschaft wegen Vermögenslosigkeit im Handelsregister von Amts wegen nach § 394 FamFG zu löschen. Die Frist zur Geltendmachung eines Widerspruchs gegen die beabsichtigte Löschung ist auf einen Monat ab Veröffentlichung bestimmt."
    },
    {
      "date": "2024-10-21",
      "id": "91003",
      "original_text": "Einreichung neuer Dokumente\nSachsen-Anhalt Amtsgericht Stendal HRB 32754\nASG Energie AG – Köthen (Anhalt)",
      "type": "Einreichung neuer Dokumente",
      "state": "Sachsen-Anhalt",
      "amtsgericht": "Amtsgericht Stendal",
      "registernummer": "HRB 32754",
      "registerart": "HRB",
      "company_name": "ASG Energie AG",
      "company_seat": "Köthen (Anhalt)",
      "details": "21.10.2024 (Bekanntmachungsdatum)\n\nSachsen-Anhalt Amtsgericht Stendal HRB 32754\nEinreichung neuer Dokumente\n\nASG Energie AG\nAktiengesellschaft\nKöthen (Anhalt)\n\nEine Liste der Mitglieder des Aufsichtsrates wurde zum Handelsregister eingereicht."
    },
    {
      "date": "2024-10-21",
      "id": "91004",
      "original_text": "Einreichung neuer Dokumente\nBerlin Amtsgericht Berlin (Charlottenburg) HRB 37967\nGeschäftszentrum Kurfürstendamm 106 Verwaltungs-GmbH – Berlin",
      "type": "Einreichung neuer Dokumente",
      "state": "Berlin",
      "amtsgericht": "Amtsgericht Berlin (Charlottenburg)",
      "registernummer": "HRB 37967",
      "registerart": "HRB",
      "company_name": "Geschäftszentrum Kurfürstendamm 106 Verwaltungs-GmbH",
      "company_seat": "Berlin",
      "details": "21.10.2024 (Bekanntmachungsdatum)\n\nBerlin Amtsgericht Berlin (Charlottenburg) HRB 37967\nEinreichung neuer Dokumente\n\nGeschäftszentrum Kurfürstendamm 106 Verwaltungs-GmbH\nGesellschaft mit beschränkter Haftung\nBerlin\n\nAls nicht eingetragen wird veröffentlicht:\n\nEs wurde eine neue Liste der Beiratsmitglieder eingereicht (§52 GmbHG)."
    },
    {
      "date": "2024-10-21",
      "id": "91005",
      "original_text": "Einreichung neuer Dokumente\nBaden-Württemberg Amtsgericht Mannheim HRB 100003\nMVK Versicherung VVaG – Karlsruhe",
      "type": "Einreichung neuer Dokumente",
      "state": "Baden-Württemberg",
      "amtsgericht": "Amtsgericht Mannheim",
      "registernummer": "HRB 100003",
      "registerart": "HRB",
      "company_name": "MVK Versicherung VVaG",
      "company_seat": "Karlsruhe",
      "details": "21.10.2024 (Bekanntmachungsdatum)\n\nBaden-Württemberg Amtsgericht Mannheim HRB 100003\nEinreichung neuer Dokumente 21.10.2024 (Eintragungsdatum)\n\nMVK Versicherung VVaG\nVersicherungsverein auf Gegenseitigkeit\nKarlsruhe\n\nDie Gesellschaft hat am 20.08.2024 die Liste über die Zusammensetzung des Aufsichtsrats zum Handelsregister eingereicht."
    },
    {
      "date": "2024-10-21",
      "id": "91006",
      "original_text": "Registerbekanntmachung nach dem Umwandlungsgesetz\nMecklenburg-Vorpommern Amtsgericht Schwerin HRB 14940\nFahrschule Fritz GmbH – Schwerin",
      "type": "Registerbekanntmachung nach dem Umwandlungsgesetz",
      "state": "Mecklenburg-Vorpommern",
      "amtsgericht": "Amtsgericht Schwerin",
      "registernummer": "HRB 14940",
      "registerart": "HRB",
      "company_name": "Fahrschule Fritz GmbH",
      "company_seat": "Schwerin",
      "details": "21.10.2024 (Bekanntmachungsdatum)\n\nMecklenburg-Vorpommern Amtsgericht Schwerin HRB 14940\nRegisterbekanntmachung nach dem Umwandlungsgesetz 21.10.2024 (Eintragungsdatum)\n\nFahrschule Fritz GmbH\nGesellschaft mit beschränkter Haftung\nSchwerin\n\nDen Gläubigern der an der Ausgliederung beteiligten Rechtsträger ist, wenn sie binnen 6 Monaten nach dem Tag, an dem die Eintragung der Ausgliederung in das Register desjenigen Rechtsträgers, dessen Gläubiger sie sind, nach § 19 Abs. 3 UmwG als bekannt gemacht gilt, ihren Anspruch nach Grund und Höhe schriftlich anmelden, Sicherheit zu leisten, soweit sie nicht Befriedigung verlangen können. Dieses Recht steht ihnen jedoch nur zu, wenn sie glaubhaft machen, dass durch die Ausgliederung die Erfüllung ihrer Forderung gefährdet wird."
    },
    {
      "date": "2024-10-21",
      "id": "91007",
      "original_text": "Registerbekanntmachung nach dem Umwandlungsgesetz\nHamburg Amtsgericht Hamburg HRB 80235\nBioCycling GmbH – Hamburg",
      "type": "Registerbekanntmachung nach dem Umwandlungsgesetz",
      "state": "Hamburg",
      "amtsgericht": "Amtsgericht Hamburg",
      "registernummer": "HRB 80235",
      "registerart": "HRB",
      "company_name": "BioCycling GmbH",
      "company_seat": "Hamburg",
      "details": "21.10.2024 (Bekanntmachungsdatum)\n\nHamburg Amtsgericht Hamburg HRB 80235\nRegisterbekanntmachung nach dem Umwandlungsgesetz 21.10.2024 (Eintragungsdatum)\n\nBioCycling GmbH\nGesellschaft mit beschränkter Haftung\nHamburg\n\nAls nicht eingetragen wird bekannt gemacht:\nDen Gläubigern der an der Verschmelzung beteiligten Gesellschaften ist, wenn sie binnen sechs Monaten nach dem Tag, an dem die Eintragung der Verschmelzung in das Register des Sitzes desjenigen Rechtsträgers, dessen Gläubiger sie sind, nach § 19 Absatz 3 UmwG als bekannt gemacht gilt, ihren Anspruch nach Grund und Höhe schriftlich anmelden, Sicherheit zu leisten, soweit sie nicht Befriedigung verlangen können. Dieses Recht steht den Gläubigern jedoch nur zu, wenn sie glaubhaft machen, dass durch die Verschmelzung die Erfüllung ihrer Forderung gefährdet wird."
    },
    {
      "date": "2024-10-21",
      "id": "91008",
      "original_text": "Registerbekanntmachung nach dem Umwandlungsgesetz\nSchleswig-Holstein Amtsgericht Flensburg HRB 13827\nSchlei Hotel und Verwaltungs GmbH – Kappeln",
      "type": "Registerbekanntmachung nach dem Umwandlungsgesetz",
      "state": "Schleswig-Holstein",
      "amtsgericht": "Amtsgericht Flensburg",
      "registernummer": "HRB 13827",
      "registerart": "HRB",
      "company_name": "Schlei Hotel und Verwaltungs GmbH",
      "company_seat": "Kappeln",
      "details": "21.10.2024 (Bekanntmachungsdatum)\n\nSchleswig-Holstein Amtsgericht Flensburg HRB 13827\nRegisterbekanntmachung nach dem Umwandlungsgesetz 15.10.2024 (Eintragungsdatum)\n\nSchlei Hotel und Verwaltungs GmbH\nGesellschaft mit beschränkter Haftung\nKappeln\n\nAls nicht eingetragen wird veröffentlicht: Den Gläubigern ist, wenn sie binnen sechs Monaten nach dem Tag, an dem die Eintragung der Umwandlung als bekannt gemacht gilt, ihren Anspruch nach Grund und Höhe schriftlich anmelden, Sicherheit zu leisten, soweit sie nicht Befriedigung verlangen können. Dieses Recht steht den Gläubigern jedoch nur zu, wenn sie glaubhaft machen, dass durch die Umwandlung die Erfüllung ihrer Forderung gefährdet wird."
    },
    {
      "date": "2024-10-21",
      "id": "91009",
      "original_text": "Löschungsankündigung\nBerlin Amtsgericht Berlin (Charlottenburg) HRB 160956\nBeger Vertriebs GmbH – Berlin",
      "type": "Löschungsankündigung",
      "state": "Berlin",
      "amtsgericht": "Amtsgericht Berlin (Charlottenburg)",
      "registernummer": "HRB 160956",
      "registerart": "HRB",
      "company_name": "Beger Vertriebs GmbH",
      "company_seat": "Berlin",
      "details": "21.10.2024 (Bekanntmachungsdatum)\n\nBerlin Amtsgericht Berlin (Charlottenburg) HRB 160956\nLöschungsankündigung\n\nBeger Vertriebs GmbH\nGesellschaft mit beschränkter Haftung\nBerlin\n\nBei der nachstehenden Gesellschaft wird das Amtslöschungsverfahren gemäß § 394 FamFG eingeleitet. Widerspruchsfrist 6 Wochen"
    },
    {
      "date": "2024-10-21",
      "id": "91010",
      "original_text": "Löschungsankündigung\nBaden-Württemberg Amtsgericht Mannheim HRB 341397\nGLW Gaststättenbetriebsgesellschaft mbH – Sinsheim",
      "type": "Löschungsankündigung",
      "state": "Baden-Württemberg",
      "amtsgericht": "Amtsgericht Mannheim",
      "registernummer": "HRB 341397",
      "registerart": "HRB",
      "company_name": "GLW Gaststättenbetriebsgesellschaft mbH",
      "company_seat": "Sinsheim",
      "details": "21.10.2024 (Bekanntmachungsdatum)\n\nBaden-Württemberg Amtsgericht Mannheim HRB 341397\nLöschungsankündigung\n\nGLW Gaststättenbetriebsgesellschaft mbH\nGesellschaft mit beschränkter Haftung\nSinsheim\n\nDas Gericht beabsichtigt, die Gesellschaft wegen Vermögenslosigkeit im Handelsregister von Amts wegen nach § 394 FamFG zu löschen. Die Frist zur Geltendmachung eines Widerspruchs gegen die beabsichtigte Löschung ist auf einen Monat ab Veröffentlichung bestimmt."
    },
    {
      "date": "2024-10-21",
      "id": "91011",
      "original_text": "Einreichung neuer Dokumente\nBrandenburg Amtsgericht Potsdam HRB 6659\nStadtwerke Premnitz GmbH – Premnitz",
      "type": "Einreichung neuer Dokumente",
      "state": "Brandenburg",
      "amtsgericht": "Amtsgericht Potsdam",
      "registernummer": "HRB 6659",
      "registerart": "HRB",
      "company_name": "Stadtwerke Premnitz GmbH",
      "company_seat": "Premnitz",
      "details": "21.10.2024 (Bekanntmachungsdatum)\n\nBrandenburg Amtsgericht Potsdam HRB 6659\nEinreichung neuer Dokumente\n\nStadtwerke Premnitz GmbH\nGesellschaft mit beschränkter Haftung\nPremnitz\n\nAls nicht eingetragen wird veröffentlicht: Eine Liste der Mitglieder des Aufsichtsrates wurde zum Handelsregister eingereicht."
    },
    {
      "date": "2024-10-21",
      "id": "91012",
      "original_text": "Löschungsankündigung\nBaden-Württemberg Amtsgericht Freiburg HRB 720032\nMandelbluete UG (haftungsbeschränkt) – Konstanz",
      "type": "Löschungsankündigung",
      "state": "Baden-Württemberg",
      "amtsgericht": "Amtsgericht Freiburg",
      "registernummer": "HRB 720032",
      "registerart": "HRB",
      "company_name": "Mandelbluete UG (haftungsbeschränkt)",
      "company_seat": "Konstanz",
      "details": "21.10.2024 (Bekanntmachungsdatum)\n\nBaden-Württemberg Amtsgericht Freiburg HRB 720032\nLöschungsankündigung\n\nMandelbluete UG (haftungsbeschränkt)\nGesellschaft mit beschränkter Haftung\nKonstanz\n\nAls nicht eingetragen wird bekanntgemacht:\nDas Gericht beabsichtigt, die Gesellschaft wegen Vermögenslosigkeit im Handelsregister von Amts wegen nach § 394 FamFG zu löschen. Die Frist zur Geltendmachung eines Widerspruchs gegen die beabsichtigte Löschung ist auf einen Monat ab Veröffentlichung bestimmt."
    },
    {
      "date": "2024-10-21",
      "id": "91013",
      "original_text": "Löschungsankündigung\nBerlin Amtsgericht Berlin (Charlottenburg) HRB 146888\nECURA International GmbH – Berlin",
      "type": "Löschungsankündigung",
      "state": "Berlin",
      "amtsgericht": "Amtsgericht Berlin (Charlottenburg)",
      "registernummer": "HRB 146888",
      "registerart": "HRB",
      "company_name": "ECURA International GmbH",
      "company_seat": "Berlin",
      "details": "21.10.2024 (Bekanntmachungsdatum)\n\nBerlin Amtsgericht Berlin (Charlottenburg) HRB 146888\nLöschungsankündigung\n\nECURA International GmbH\nGesellschaft mit beschränkter Haftung\nBerlin\n\nBei der nachstehenden Gesellschaft wird das Amtslöschungsverfahren gemäß § 394 FamFG eingeleitet. Widerspruchsfrist 6 Wochen"
    },
    {
      "date": "2024-10-21",
      "id": "91014",
      "original_text": "Registerbekanntmachung nach dem Umwandlungsgesetz\nHamburg Amtsgericht Hamburg HRB 151026\nHey Digitalities GmbH – Hamburg",
      "type": "Registerbekanntmachung nach dem Umwandlungsgesetz",
      "state": "Hamburg",
      "amtsgericht": "Amtsgericht Hamburg",
      "registernummer": "HRB 151026",
      "registerart": "HRB",
      "company_name": "Hey Digitalities GmbH",
      "company_seat": "Hamburg",
      "details": "21.10.2024 (Bekanntmachungsdatum)\n\nHamburg Amtsgericht Hamburg HRB 151026\nRegisterbekanntmachung nach dem Umwandlungsgesetz 21.10.2024 (Eintragungsdatum)\n\nHey Digitalities GmbH\nGesellschaft mit beschränkter Haftung\nHamburg\n\nAls nicht eingetragen wird bekannt gemacht:\nDen Gläubigern der an der Verschmelzung beteiligten Gesellschaften ist, wenn sie binnen sechs Monaten nach dem Tag, an dem die Eintragung der Verschmelzung in das Register des Sitzes desjenigen Rechtsträgers, dessen Gläubiger sie sind, nach § 19 Absatz 3 UmwG als bekannt gemacht gilt, ihren Anspruch nach Grund und Höhe schriftlich anmelden, Sicherheit zu leisten, soweit sie nicht Befriedigung verlangen können. Dieses Recht steht den Gläubigern jedoch nur zu, wenn sie glaubhaft machen, dass durch die Verschmelzung die Erfüllung ihrer Forderung gefährdet wird."
    },
    {
      "date": "2024-10-21",
      "id": "91015",
      "original_text": "Registerbekanntmachung nach dem Umwandlungsgesetz\nHamburg Amtsgericht Hamburg HRB 170644\nHey Digital Entertainment UG (haftungsbeschränkt) – Hamburg",
      "type": "Registerbekanntmachung nach dem Umwandlungsgesetz",
      "state": "Hamburg",
      "amtsgericht": "Amtsgericht Hamburg",
      "registernummer": "HRB 170644",
      "registerart": "HRB",
      "company_name": "Hey Digital Entertainment UG (haftungsbeschränkt)",
      "company_seat": "Hamburg",
      "details": "21.10.2024 (Bekanntmachungsdatum)\n\nHamburg Amtsgericht Hamburg HRB 170644\nRegisterbekanntmachung nach dem Umwandlungsgesetz 21.10.2024 (Eintragungsdatum)\n\nHey Digital Entertainment UG (haftungsbeschränkt)\nGesellschaft mit beschränkter Haftung\nHamburg\n\nAls nicht eingetragen wird bekannt gemacht:\nDen Gläubigern der an der Verschmelzung beteiligten Gesellschaften ist, wenn sie binnen sechs Monaten nach dem Tag, an dem die Eintragung der Verschmelzung in das Register des Sitzes desjenigen Rechtsträgers, dessen Gläubiger sie sind, nach § 19 Absatz 3 UmwG als bekannt gemacht gilt, ihren Anspruch nach Grund und Höhe schriftlich anmelden, Sicherheit zu leisten, soweit sie nicht Befriedigung verlangen können. Dieses Recht steht den Gläubigern jedoch nur zu, wenn sie glaubhaft machen, dass durch die Verschmelzung die Erfüllung ihrer Forderung gefährdet wird."
    },
    {
      "date": "2024-10-21",
      "id": "91016",
      "original_text": "Registerbekanntmachung nach dem Umwandlungsgesetz\nBaden-Württemberg Amtsgericht Stuttgart HRB 796802\nMarquardt Landtechnik GmbH – Tuttlingen",
      "type": "Registerbekanntmachung nach dem Umwandlungsgesetz",
      "state": "Baden-Württemberg",
      "amtsgericht": "Amtsgericht Stuttgart",
      "registernummer": "HRB 796802",
      "registerart": "HRB",
      "company_name": "Marquardt Landtechnik GmbH",
      "company_seat": "Tuttlingen",
      "details": "21.10.2024 (Bekanntmachungsdatum)\n\nBaden-Württemberg Amtsgericht Stuttgart HRB 796802\nRegisterbekanntmachung nach dem Umwandlungsgesetz 21.10.2024 (Eintragungsdatum)\n\nMarquardt Landtechnik GmbH\nGesellschaft mit beschränkter Haftung\nTuttlingen\n\nDen Gläubigern der an der Aufspaltung beteiligten Rechtsträger ist, wenn sie binnen sechs Monaten nach dem Tag, an dem die Eintragung der Aufspaltung in das Register des Sitzes desjenigen Rechtsträgers, dessen Gläubiger sie sind, nach § 19 Abs. 3 UmwG als bekanntgemacht gilt, ihren Anspruch nach Grund und Höhe schriftlich anmelden, Sicherheit zu leisten, soweit sie nicht Befriedigung verlangen können. Dieses Recht steht den Gläubigern jedoch nur zu, wenn sie glaubhaft machen, dass durch die Aufspaltung die Erfüllung ihrer Forderung gefährdet wird."
    },
    {
      "date": "2024-10-21",
      "id": "91017",
      "original_text": "Löschungsankündigung\nBerlin Amtsgericht Berlin (Charlottenburg) HRB 204732\nParos Real Estate GmbH – Berlin",
      "type": "Löschungsankündigung",
      "state": "Berlin",
      "amtsgericht": "Amtsgericht Berlin (Charlottenburg)",
      "registernummer": "HRB 204732",
      "registerart": "HRB",
      "company_name": "Paros Real Estate GmbH",
      "company_seat": "Berlin",
      "details": "21.10.2024 (Bekanntmachungsdatum)\n\nBerlin Amtsgericht Berlin (Charlottenburg) HRB 204732\nLöschungsankündigung\n\nParos Real Estate GmbH\nGesellschaft mit beschränkter Haftung\nBerlin\n\nBei der nachstehenden Gesellschaft wird das Amtslöschungsverfahren gemäß § 394 FamFG eingeleitet. Widerspruchsfrist 6 Wochen"
    },
    {
      "date": "2024-10-21",
      "id": "91018",
      "original_text": "Registerbekanntmachung nach dem Umwandlungsgesetz\nBerlin Amtsgericht Berlin (Charlottenburg) HRA 63157\nAufzugsverbund Deutschland GmbH & Co. KG – Berlin",
      "type": "Registerbekanntmachung nach dem Umwandlungsgesetz",
      "state": "Berlin",
      "amtsgericht": "Amtsgericht Berlin (Charlottenburg)",
      "registernummer": "HRA 63157",
      "registerart": "HRA",
      "company_name": "Aufzugsverbund Deutschland GmbH & Co. KG",
      "company_seat": "Berlin",
      "details": "21.10.2024 (Bekanntmachungsdatum)\n\nBerlin Amtsgericht Berlin (Charlottenburg) HRA 63157\nRegisterbekanntmachung nach dem Umwandlungsgesetz 18.10.2024 (Eintragungsdatum)\n\nAufzugsverbund Deutschland GmbH & Co. KG\nKommanditgesellschaft\nBerlin\n\nZu Eintragungsnummer 3 vom 18.10.2024 wird als nicht eingetragen veröffentlicht: Den Gläubigern der an der Verschmelzung beteiligten Rechtsträger ist, wenn sie binnen sechs Monaten nach dem Tag, an dem die Eintragung der Verschmelzung in das Register des Sitzes desjenigen Rechtsträgers, dessen Gläubiger sie sind, als bekannt gemacht gilt, ihren Anspruch nach Grund und Höhe schriftlich anmelden, Sicherheit zu leisten, soweit sie nicht Befriedigung verlangen können. Dieses Recht steht den Gläubigern jedoch nur zu, wenn sie glaubhaft machen, dass durch die Verschmelzung die Erfüllung ihrer Forderung gefährdet wird. Das Recht, Sicherheitsleistung zu verlangen, steht Gläubigern nicht zu, die im Falle der Insolvenz ein Recht auf vorzugsweise Befriedigung aus einer Deckungsmasse haben, die nach gesetzlicher Vorschrift zu ihrem Schutz errichtet und staatlich überwacht ist."
    },
    {
      "date": "2024-10-21",
      "id": "91019",
      "original_text": "Registerbekanntmachung nach dem Umwandlungsgesetz\nSchleswig-Holstein Amtsgericht Lübeck HRA 4854\nVierte Kinoabspielstätten GmbH & Co. KG – Lübeck",
      "type": "Registerbekanntmachung nach dem Umwandlungsgesetz",
      "state": "Schleswig-Holstein",
      "amtsgericht": "Amtsgericht Lübeck",
      "registernummer": "HRA 4854",
      "registerart": "HRA",
      "company_name": "Vierte Kinoabspielstätten GmbH & Co. KG",
      "company_seat": "Lübeck",
      "details": "21.10.2024 (Bekanntmachungsdatum)\n\nSchleswig-Holstein Amtsgericht Lübeck HRA 4854\nRegisterbekanntmachung nach dem Umwandlungsgesetz 18.10.2024 (Eintragungsdatum)\n\nVierte Kinoabspielstätten GmbH & Co. KG\nKommanditgesellschaft\nLübeck\n\nZu Eintragungsnummer 5 vom 18.10.2024 wird als nicht eingetragen veröffentlicht:  Als nicht eingetragen wird veröffentlicht: Den Gläubigern der an der Verschmelzung beteiligten Rechtsträger ist, wenn sie binnen sechs Monaten nach dem Tag, an dem die Eintragung der Verschmelzung in das Register des Sitzes desjenigen Rechtsträgers, dessen Gläubiger sie sind, als bekannt gemacht gilt, ihren Anspruch nach Grund und Höhe schriftlich anmelden, Sicherheit zu leisten, soweit sie nicht Befriedigung verlangen können. Dieses Recht steht den Gläubigern jedoch nur zu, wenn sie glaubhaft machen, dass durch die Verschmelzung die Erfüllung ihrer Forderung gefährdet wird."
    },
    {
      "date": "2024-10-21",
      "id": "91020",
      "original_text": "Registerbekanntmachung nach dem Umwandlungsgesetz\nBerlin Amtsgericht Berlin (Charlottenburg) HRA 63157\nAufzugsverbund Deutschland GmbH & Co. KG – Berlin",
      "type": "Registerbekanntmachung nach dem Umwandlungsgesetz",
      "state": "Berlin",
      "amtsgericht": "Amtsgericht Berlin (Charlottenburg)",
      "registernummer": "HRA 63157",
      "registerart": "HRA",
      "company_name": "Aufzugsverbund Deutschland GmbH & Co. KG",
      "company_seat": "Berlin",
      "details": "21.10.2024 (Bekanntmachungsdatum)\n\nBerlin Amtsgericht Berlin (Charlottenburg) HRA 63157\nRegisterbekanntmachung nach dem Umwandlungsgesetz 18.10.2024 (Eintragungsdatum)\n\nAufzugsverbund Deutschland GmbH & Co. KG\nKommanditgesellschaft\nBerlin\n\nZu Eintragungsnummer 4 vom 18.10.2024 wird als nicht eingetragen veröffentlicht: Den Gläubigern der an der Verschmelzung beteiligten Rechtsträger ist, wenn sie binnen sechs Monaten nach dem Tag, an dem die Eintragung der Verschmelzung in das Register des Sitzes desjenigen Rechtsträgers, dessen Gläubiger sie sind, als bekannt gemacht gilt, ihren Anspruch nach Grund und Höhe schriftlich anmelden, Sicherheit zu leisten, soweit sie nicht Befriedigung verlangen können. Dieses Recht steht den Gläubigern jedoch nur zu, wenn sie glaubhaft machen, dass durch die Verschmelzung die Erfüllung ihrer Forderung gefährdet wird. Das Recht, Sicherheitsleistung zu verlangen, steht Gläubigern nicht zu, die im Falle der Insolvenz ein Recht auf vorzugsweise Befriedigung aus einer Deckungsmasse haben, die nach gesetzlicher Vorschrift zu ihrem Schutz errichtet und staatlich überwacht ist."
    },
    {
      "date": "2024-10-21",
      "id": "91021",
      "original_text": "Registerbekanntmachung nach dem Umwandlungsgesetz\nSchleswig-Holstein Amtsgericht Kiel HRB 27286\nSauber Gebäudereinigung Klement GmbH – Holtsee",
      "type": "Registerbekanntmachung nach dem Umwandlungsgesetz",
      "state": "Schleswig-Holstein",
      "amtsgericht": "Amtsgericht Kiel",
      "registernummer": "HRB 27286",
      "registerart": "HRB",
      "company_name": "Sauber Gebäudereinigung Klement GmbH",
      "company_seat": "Holtsee",
      "details": "21.10.2024 (Bekanntmachungsdatum)\n\nSchleswig-Holstein Amtsgericht Kiel HRB 27286\nRegisterbekanntmachung nach dem Umwandlungsgesetz 18.10.2024 (Eintragungsdatum)\n\nSauber Gebäudereinigung Klement GmbH\nGesellschaft mit beschränkter Haftung\nHoltsee\n\nZu Eintragungsnummer 2 vom 18.10.2024 wird als nicht eingetragen veröffentlicht: Den Gläubigern der an der Spaltung beteiligten Rechtsträger ist, wenn sie binnen sechs Monaten nach dem Tag, an dem die Eintragung der Spaltung in das Register des Sitzes desjenigen Rechtsträgers, dessen Gläubiger sie sind,  bekannt gemacht worden ist, ihren Anspruch nach Grund und Höhe schriftlich anmelden, Sicherheit zu leisten, soweit sie nicht Befriedigung verlangen können. Dieses Recht steht den Gläubigern jedoch nur zu, wenn sie glaubhaft machen, dass durch die Spaltung die Erfüllung ihrer Forderung gefährdet wird."
    },
    {
      "date": "2024-10-21",
      "id": "91022",
      "original_text": "Registerbekanntmachung nach dem Umwandlungsgesetz\nBaden-Württemberg Amtsgericht Stuttgart HRB 796803\nMarquardt Metall GmbH – Tuttlingen",
      "type": "Registerbekanntmachung nach dem Umwandlungsgesetz",
      "state": "Baden-Württemberg",
      "amtsgericht": "Amtsgericht Stuttgart",
      "registernummer": "HRB 796803",
      "registerart": "HRB",
      "company_name": "Marquardt Metall GmbH",
      "company_seat": "Tuttlingen",
      "details": "21.10.2024 (Bekanntmachungsdatum)\n\nBaden-Württemberg Amtsgericht Stuttgart HRB 796803\nRegisterbekanntmachung nach dem Umwandlungsgesetz 21.10.2024 (Eintragungsdatum)\n\nMarquardt Metall GmbH\nGesellschaft mit beschränkter Haftung\nTuttlingen\n\nAls nicht eingetragen wird bekanntgemacht:\nDen Gläubigern der an der Aufspaltung beteiligten Rechtsträger ist, wenn sie binnen sechs Monaten nach dem Tag, an dem die Eintragung der Aufspaltung in das Register des Sitzes desjenigen Rechtsträgers, dessen Gläubiger sie sind, nach § 19 Abs. 3 UmwG als bekanntgemacht gilt, ihren Anspruch nach Grund und Höhe schriftlich anmelden, Sicherheit zu leisten, soweit sie nicht Befriedigung verlangen können. Dieses Recht steht den Gläubigern jedoch nur zu, wenn sie glaubhaft machen, dass durch die Aufspaltung die Erfüllung ihrer Forderung gefährdet wird."
    },
    {
      "date": "2024-10-21",
      "id": "91023",
      "original_text": "Registerbekanntmachung nach dem Umwandlungsgesetz\nBaden-Württemberg Amtsgericht Stuttgart HRB 759637\ntechnikkonzepte GmbH for visual solutions – Owen",
      "type": "Registerbekanntmachung nach dem Umwandlungsgesetz",
      "state": "Baden-Württemberg",
      "amtsgericht": "Amtsgericht Stuttgart",
      "registernummer": "HRB 759637",
      "registerart": "HRB",
      "company_name": "technikkonzepte GmbH for visual solutions",
      "company_seat": "Owen",
      "details": "21.10.2024 (Bekanntmachungsdatum)\n\nBaden-Württemberg Amtsgericht Stuttgart HRB 759637\nRegisterbekanntmachung nach dem Umwandlungsgesetz 21.10.2024 (Eintragungsdatum)\n\ntechnikkonzepte GmbH for visual solutions\nGesellschaft mit beschränkter Haftung\nOwen\n\nDen Gläubigern der an der Verschmelzung beteiligten Rechtsträger ist, wenn sie binnen sechs Monaten nach dem Tag, an dem die Eintragung der Verschmelzung in das Register des Sitzes desjenigen Rechtsträgers, dessen Gläubiger sie sind, nach § 19 Abs. 3 UmwG als bekanntgemacht gilt, ihren Anspruch nach Grund und Höhe schriftlich anmelden, Sicherheit zu leisten, soweit sie nicht Befriedigung verlangen können. Dieses Recht steht den Gläubigern jedoch nur zu, wenn sie glaubhaft machen, dass durch die Verschmelzung die Erfüllung ihrer Forderung gefährdet wird."
    },
    {
      "date": "2024-10-21",
      "id": "91024",
      "original_text": "Registerbekanntmachung nach dem Umwandlungsgesetz\nBaden-Württemberg Amtsgericht Stuttgart HRB 450864\nMarquardt Metallwaren GmbH – Tuttlingen",
      "type": "Registerbekanntmachung nach dem Umwandlungsgesetz",
      "state": "Baden-Württemberg",
      "amtsgericht": "Amtsgericht Stuttgart",
      "registernummer": "HRB 450864",
      "registerart": "HRB",
      "company_name": "Marquardt Metallwaren GmbH",
      "company_seat": "Tuttlingen",
      "details": "21.10.2024 (Bekanntmachungsdatum)\n\nBaden-Württemberg Amtsgericht Stuttgart HRB 450864\nRegisterbekanntmachung nach dem Umwandlungsgesetz 21.10.2024 (Eintragungsdatum)\n\nMarquardt Metallwaren GmbH\nGesellschaft mit beschränkter Haftung\nTuttlingen\n\nDen Gläubigern der an der Aufspaltung beteiligten Rechtsträger ist, wenn sie binnen sechs Monaten nach dem Tag, an dem die Eintragung der Aufspaltung in das Register des Sitzes desjenigen Rechtsträgers, dessen Gläubiger sie sind, nach § 19 Abs. 3 UmwG als bekanntgemacht gilt, ihren Anspruch nach Grund und Höhe schriftlich anmelden, Sicherheit zu leisten, soweit sie nicht Befriedigung verlangen können. Dieses Recht steht den Gläubigern jedoch nur zu, wenn sie glaubhaft machen, dass durch die Aufspaltung die Erfüllung ihrer Forderung gefährdet wird."
    },
    {
      "date": "2024-10-21",
      "id": "91025",
      "original_text": "Registerbekanntmachung nach dem Umwandlungsgesetz\nBerlin Amtsgericht Berlin (Charlottenburg) HRA 63157\nAufzugsverbund Deutschland GmbH & Co. KG – Berlin",
      "type": "Registerbekanntmachung nach dem Umwandlungsgesetz",
      "state": "Berlin",
      "amtsgericht": "Amtsgericht Berlin (Charlottenburg)",
      "registernummer": "HRA 63157",
      "registerart": "HRA",
      "company_name": "Aufzugsverbund Deutschland GmbH & Co. KG",
      "company_seat": "Berlin",
      "details": "21.10.2024 (Bekanntmachungsdatum)\n\nBerlin Amtsgericht Berlin (Charlottenburg) HRA 63157\nRegisterbekanntmachung nach dem Umwandlungsgesetz 18.10.2024 (Eintragungsdatum)\n\nAufzugsverbund Deutschland GmbH & Co. KG\nKommanditgesellschaft\nBerlin\n\nZu Eintragungsnummer 5 vom 18.10.2024 wird als nicht eingetragen veröffentlicht: Den Gläubigern der an der Verschmelzung beteiligten Rechtsträger ist, wenn sie binnen sechs Monaten nach dem Tag, an dem die Eintragung der Verschmelzung in das Register des Sitzes desjenigen Rechtsträgers, dessen Gläubiger sie sind, als bekannt gemacht gilt, ihren Anspruch nach Grund und Höhe schriftlich anmelden, Sicherheit zu leisten, soweit sie nicht Befriedigung verlangen können. Dieses Recht steht den Gläubigern jedoch nur zu, wenn sie glaubhaft machen, dass durch die Verschmelzung die Erfüllung ihrer Forderung gefährdet wird. Das Recht, Sicherheitsleistung zu verlangen, steht Gläubigern nicht zu, die im Falle der Insolvenz ein Recht auf vorzugsweise Befriedigung aus einer Deckungsmasse haben, die nach gesetzlicher Vorschrift zu ihrem Schutz errichtet und staatlich überwacht ist."
    },
    {
      "date": "2024-10-21",
      "id": "91026",
      "original_text": "Registerbekanntmachung nach dem Umwandlungsgesetz\nBerlin Amtsgericht Berlin (Charlottenburg) HRA 63157\nAufzugsverbund Deutschland GmbH & Co. KG – Berlin",
      "type": "Registerbekanntmachung nach dem Umwandlungsgesetz",
      "state": "Berlin",
      "amtsgericht": "Amtsgericht Berlin (Charlottenburg)",
      "registernummer": "HRA 63157",
      "registerart": "HRA",
      "company_name": "Aufzugsverbund Deutschland GmbH & Co. KG",
      "company_seat": "Berlin",
      "details": "21.10.2024 (Bekanntmachungsdatum)\n\nBerlin Amtsgericht Berlin (Charlottenburg) HRA 63157\nRegisterbekanntmachung nach dem Umwandlungsgesetz 18.10.2024 (Eintragungsdatum)\n\nAufzugsverbund Deutschland GmbH & Co. KG\nKommanditgesellschaft\nBerlin\n\nZu Eintragungsnummer 6 vom 18.10.2024 wird als nicht eingetragen veröffentlicht: Den Gläubigern der an der Verschmelzung beteiligten Rechtsträger ist, wenn sie binnen sechs Monaten nach dem Tag, an dem die Eintragung der Verschmelzung in das Register des Sitzes desjenigen Rechtsträgers, dessen Gläubiger sie sind, als bekannt gemacht gilt, ihren Anspruch nach Grund und Höhe schriftlich anmelden, Sicherheit zu leisten, soweit sie nicht Befriedigung verlangen können. Dieses Recht steht den Gläubigern jedoch nur zu, wenn sie glaubhaft machen, dass durch die Verschmelzung die Erfüllung ihrer Forderung gefährdet wird. Das Recht, Sicherheitsleistung zu verlangen, steht Gläubigern nicht zu, die im Falle der Insolvenz ein Recht auf vorzugsweise Befriedigung aus einer Deckungsmasse haben, die nach gesetzlicher Vorschrift zu ihrem Schutz errichtet und staatlich überwacht ist."
    },
    {
      "date": "2024-10-21",
      "id": "91027",
      "original_text": "Registerbekanntmachung nach dem Umwandlungsgesetz\nBerlin Amtsgericht Berlin (Charlottenburg) HRB 234032\nPatient 21 SE – Berlin",
      "type": "Registerbekanntmachung nach dem Umwandlungsgesetz",
      "state": "Berlin",
      "amtsgericht": "Amtsgericht Berlin (Charlottenburg)",
      "registernummer": "HRB 234032",
      "registerart": "HRB",
      "company_name": "Patient 21 SE",
      "company_seat": "Berlin",
      "details": "21.10.2024 (Bekanntmachungsdatum)\n\nBerlin Amtsgericht Berlin (Charlottenburg) HRB 234032\nRegisterbekanntmachung nach dem Umwandlungsgesetz 19.10.2024 (Eintragungsdatum)\n\nPatient 21 SE\nEuropäische Aktiengesellschaft (SE)\nBerlin\n\nZu Eintragungsnummer 15 vom 19.10.2024 wird als nicht eingetragen veröffentlicht: Den Gläubigern der an der Verschmelzung beteiligten Rechtsträger ist, wenn sie binnen sechs Monaten nach dem Tag, an dem die Eintragung der Verschmelzung in das Register des Sitzes desjenigen Rechtsträgers, dessen Gläubiger sie sind, als bekannt gemacht gilt, ihren Anspruch nach Grund und Höhe schriftlich anmelden, Sicherheit zu leisten, soweit sie nicht Befriedigung verlangen können. Dieses Recht steht den Gläubigern jedoch nur zu, wenn sie glaubhaft machen, dass durch die Verschmelzung die Erfüllung ihrer Forderung gefährdet wird. Das Recht, Sicherheitsleistung zu verlangen, steht Gläubigern nicht zu, die im Falle der Insolvenz ein Recht auf vorzugsweise Befriedigung aus einer Deckungsmasse haben, die nach gesetzlicher Vorschrift zu ihrem Schutz errichtet und staatlich überwacht ist."
    },
    {
      "date": "2024-10-21",
      "id": "91028",
      "original_text": "Löschungsankündigung\nBaden-Württemberg Amtsgericht Mannheim HRB 712440\nMaxBooking.com Verwaltungsunternehmergesellschaft (haftungsbeschränkt) – Königsbach-Stein",
      "type": "Löschungsankündigung",
      "state": "Baden-Württemberg",
      "amtsgericht": "Amtsgericht Mannheim",
      "registernummer": "HRB 712440",
      "registerart": "HRB",
      "company_name": "MaxBooking.com Verwaltungsunternehmergesellschaft (haftungsbeschränkt)",
      "company_seat": "Königsbach-Stein",
      "details": "21.10.2024 (Bekanntmachungsdatum)\n\nBaden-Württemberg Amtsgericht Mannheim HRB 712440\nLöschungsankündigung\n\nMaxBooking.com Verwaltungsunternehmergesellschaft (haftungsbeschränkt)\nGesellschaft mit beschränkter Haftung\nKönigsbach-Stein\n\nDas Gericht beabsichtigt, die Gesellschaft wegen Vermögenslosigkeit im Handelsregister von Amts wegen nach § 394 FamFG zu löschen. Die Frist zur Geltendmachung eines Widerspruchs gegen die beabsichtigte Löschung ist auf einen Monat ab Veröffentlichung bestimmt."
    },
    {
      "date": "2024-10-21",
      "id": "91029",
      "original_text": "Registerbekanntmachung nach dem Umwandlungsgesetz\nBerlin Amtsgericht Berlin (Charlottenburg) HRB 78691\nRIWA Aufzüge GmbH – Berlin",
      "type": "Registerbekanntmachung nach dem Umwandlungsgesetz",
      "state": "Berlin",
      "amtsgericht": "Amtsgericht Berlin (Charlottenburg)",
      "registernummer": "HRB 78691",
      "registerart": "HRB",
      "company_name": "RIWA Aufzüge GmbH",
      "company_seat": "Berlin",
      "details": "21.10.2024 (Bekanntmachungsdatum)\n\nBerlin Amtsgericht Berlin (Charlottenburg) HRB 78691\nRegisterbekanntmachung nach dem Umwandlungsgesetz 18.10.2024 (Eintragungsdatum)\n\nRIWA Aufzüge GmbH\nGesellschaft mit beschränkter Haftung\nBerlin\n\nZu Eintragungsnummer 14 vom 18.10.2024 wird als nicht eingetragen veröffentlicht: Den Gläubigern der an der Verschmelzung beteiligten Rechtsträger ist, wenn sie binnen sechs Monaten nach dem Tag, an dem die Eintragung der Verschmelzung in das Register des Sitzes desjenigen Rechtsträgers, dessen Gläubiger sie sind, als bekannt gemacht gilt, ihren Anspruch nach Grund und Höhe schriftlich anmelden, Sicherheit zu leisten, soweit sie nicht Befriedigung verlangen können. Dieses Recht steht den Gläubigern jedoch nur zu, wenn sie glaubhaft machen, dass durch die Verschmelzung die Erfüllung ihrer Forderung gefährdet wird. Das Recht, Sicherheitsleistung zu verlangen, steht Gläubigern nicht zu, die im Falle der Insolvenz ein Recht auf vorzugsweise Befriedigung aus einer Deckungsmasse haben, die nach gesetzlicher Vorschrift zu ihrem Schutz errichtet und staatlich überwacht ist."
    },
    {
      "date": "2024-10-21",
      "id": "91030",
      "original_text": "Einreichung neuer Dokumente\nMecklenburg-Vorpommern Amtsgericht Stralsund HRB 613 früher Amtsgericht Rostock\nStadtwerke Greifswald Gesellschaft mit beschränkter Haftung – Greifswald",
      "type": "Einreichung neuer Dokumente",
      "state": "Mecklenburg-Vorpommern",
      "amtsgericht": "Amtsgericht Stralsund",
      "registernummer": "HRB 613",
      "registerart": "HRB",
      "company_name": "Stadtwerke Greifswald Gesellschaft mit beschränkter Haftung",
      "company_seat": "Greifswald",
      "former_amtsgericht": "Rostock",
      "details": "21.10.2024 (Bekanntmachungsdatum)\n\nMecklenburg-Vorpommern Amtsgericht Stralsund HRB 613 früher Amtsgericht Rostock\nEinreichung neuer Dokumente\n\nStadtwerke Greifswald Gesellschaft mit beschränkter Haftung\nGesellschaft mit beschränkter Haftung\nGreifswald\n\nEine Liste der Mitglieder des Aufsichtsrats ist zum Handelsregister eingereicht worden."
    },
    {
      "date": "2024-10-21",
      "id": "91031",
      "original_text": "Löschungsankündigung\nBerlin Amtsgericht Berlin (Charlottenburg) HRB 166839\nEren Zaza Bau GmbH – Berlin",
      "type": "Löschungsankündigung",
      "state": "Berlin",
      "amtsgericht": "Amtsgericht Berlin (Charlottenburg)",
      "registernummer": "HRB 166839",
      "registerart": "HRB",
      "company_name": "Eren Zaza Bau GmbH",
      "company_seat": "Berlin",
      "details": "21.10.2024 (Bekanntmachungsdatum)\n\nBerlin Amtsgericht Berlin (Charlottenburg) HRB 166839\nLöschungsankündigung\n\nEren Zaza Bau GmbH\nGesellschaft mit beschränkter Haftung\nBerlin\n\nBei der nachstehenden Gesellschaft wird das Amtslöschungsverfahren gemäß § 394 FamFG eingeleitet. Widerspruchsfrist 6 Wochen"
    },
    {
      "date": "2024-10-21",
      "id": "91032",
      "original_text": "Löschungsankündigung\nBerlin Amtsgericht Berlin (Charlottenburg) HRB 221864\nIMB Projektbau GmbH – Berlin",
      "type": "Löschungsankündigung",
      "state": "Berlin",
      "amtsgericht": "Amtsgericht Berlin (Charlottenburg)",
      "registernummer": "HRB 221864",
      "registerart": "HRB",
      "company_name": "IMB Projektbau GmbH",
      "company_seat": "Berlin",
      "details": "21.10.2024 (Bekanntmachungsdatum)\n\nBerlin Amtsgericht Berlin (Charlottenburg) HRB 221864\nLöschungsankündigung\n\nIMB Projektbau GmbH\nGesellschaft mit beschränkter Haftung\nBerlin\n\nBei der nachstehenden Gesellschaft wird das Amtslöschungsverfahren gemäß § 394 FamFG eingeleitet. Widerspruchsfrist 6 Wochen"
    },
    {
      "date": "2024-10-21",
      "id": "91033",
      "original_text": "Registerbekanntmachung nach dem Umwandlungsgesetz\nBerlin Amtsgericht Berlin (Charlottenburg) HRA 58649\nFinanzNerd e.K. – Berlin",
      "type": "Registerbekanntmachung nach dem Umwandlungsgesetz",
      "state": "Berlin",
      "amtsgericht": "Amtsgericht Berlin (Charlottenburg)",
      "registernummer": "HRA 58649",
      "registerart": "HRA",
      "company_name": "FinanzNerd e.K.",
      "company_seat": "Berlin",
      "details": "21.10.2024 (Bekanntmachungsdatum)\n\nBerlin Amtsgericht Berlin (Charlottenburg) HRA 58649\nRegisterbekanntmachung nach dem Umwandlungsgesetz 18.10.2024 (Eintragungsdatum)\n\nFinanzNerd e.K.\nEinzelkaufmann / Einzelkauffrau\nBerlin\n\nZu Eintragungsnummer 4 vom 18.10.2024 wird als nicht eingetragen veröffentlicht: Den Gläubigern der an der Spaltung beteiligten Rechtsträger ist, wenn sie binnen sechs Monaten nach dem Tag, an dem die Eintragung der Spaltung in das Register des Sitzes desjenigen Rechtsträgers, dessen Gläubiger sie sind, als bekannt gemacht gilt, ihren Anspruch nach Grund und Höhe schriftlich anmelden, Sicherheit zu leisten, soweit sie nicht Befriedigung verlangen können. Dieses Recht steht den Gläubigern jedoch nur zu, wenn sie glaubhaft machen, dass durch die Spaltung die Erfüllung ihrer Forderung gefährdet wird. Das Recht, Sicherheitsleistung zu verlangen, steht Gläubigern nicht zu, die im Falle der Insolvenz ein Recht auf vorzugsweise Befriedigung aus einer Deckungsmasse haben, die nach gesetzlicher Vorschrift zu ihrem Schutz errichtet und staatlich überwacht ist."
    },
    {
      "date": "2024-10-21",
      "id": "91034",
      "original_text": "Sonstige Registerbekanntmachung\nBaden-Württemberg Amtsgericht Ulm HRB 641626\nKässbohrer Geländefahrzeug Aktiengesellschaft – Laupheim",
      "type": "Sonstige Registerbekanntmachung",
      "state": "Baden-Württemberg",
      "amtsgericht": "Amtsgericht Ulm",
      "registernummer": "HRB 641626",
      "registerart": "HRB",
      "company_name": "Kässbohrer Geländefahrzeug Aktiengesellschaft",
      "company_seat": "Laupheim",
      "details": "21.10.2024 (Bekanntmachungsdatum)\n\nBaden-Württemberg Amtsgericht Ulm HRB 641626\nSonstige Registerbekanntmachung\n\nKässbohrer Geländefahrzeug Aktiengesellschaft\nAktiengesellschaft\nLaupheim\n\nDie Gesellschaft hat am 18.10.2024 die Liste über die Zusammensetzung des Aufsichtsrats zum Handelsregister eingereicht."
    },
    {
      "date": "2024-10-21",
      "id": "91035",
      "original_text": "Registerbekanntmachung nach dem Umwandlungsgesetz\nBrandenburg Amtsgericht Frankfurt/Oder HRB 18331\nMIB - Märkische Investitions- und Beratungs- UG (haftungsbeschränkt) – Frankfurt (Oder)",
      "type": "Registerbekanntmachung nach dem Umwandlungsgesetz",
      "state": "Brandenburg",
      "amtsgericht": "Amtsgericht Frankfurt/Oder",
      "registernummer": "HRB 18331",
      "registerart": "HRB",
      "company_name": "MIB - Märkische Investitions- und Beratungs- UG (haftungsbeschränkt)",
      "company_seat": "Frankfurt (Oder)",
      "details": "21.10.2024 (Bekanntmachungsdatum)\n\nBrandenburg Amtsgericht Frankfurt/Oder HRB 18331\nRegisterbekanntmachung nach dem Umwandlungsgesetz 16.10.2024 (Eintragungsdatum)\n\nMIB - Märkische Investitions- und Beratungs- UG (haftungsbeschränkt)\nGesellschaft mit beschränkter Haftung\nFrankfurt (Oder)\n\nZu Eintragungsnummer 3 vom 16.10.2024 wird als nicht eingetragen veröffentlicht:\nDen Gläubigern der an der Verschmelzung beteiligten Rechtsträger ist, wenn sie binnen sechs Monaten nach dem Tag, an dem die Eintragung der Verschmelzung in das Register des Sitzes desjenigen Rechtsträgers, dessen Gläubiger sie sind, als bekannt gemacht gilt, ihren Anspruch nach Grund und Höhe schriftlich anmelden, Sicherheit zu leisten, soweit sie nicht Befriedigung verlangen können. Dieses Recht steht den Gläubigern jedoch nur zu, wenn sie glaubhaft machen, dass durch die Verschmelzung die Erfüllung ihrer Forderung gefährdet wird"
    },
    {
      "date": "2024-10-21",
      "id": "91036",
      "original_text": "Registerbekanntmachung nach dem Umwandlungsgesetz\nBerlin Amtsgericht Berlin (Charlottenburg) HRB 268657\nFinanzNerd GmbH – Berlin",
      "type": "Registerbekanntmachung nach dem Umwandlungsgesetz",
      "state": "Berlin",
      "amtsgericht": "Amtsgericht Berlin (Charlottenburg)",
      "registernummer": "HRB 268657",
      "registerart": "HRB",
      "company_name": "FinanzNerd GmbH",
      "company_seat": "Berlin",
      "details": "21.10.2024 (Bekanntmachungsdatum)\n\nBerlin Amtsgericht Berlin (Charlottenburg) HRB 268657\nRegisterbekanntmachung nach dem Umwandlungsgesetz 18.10.2024 (Eintragungsdatum)\n\nFinanzNerd GmbH\nGesellschaft mit beschränkter Haftung\nBerlin\n\nZu Eintragungsnummer 1 vom 18.10.2024 wird als nicht eingetragen veröffentlicht: Den Gläubigern der an der Spaltung beteiligten Rechtsträger ist, wenn sie binnen sechs Monaten nach dem Tag, an dem die Eintragung der Spaltung in das Register des Sitzes desjenigen Rechtsträgers, dessen Gläubiger sie sind, als bekannt gemacht gilt, ihren Anspruch nach Grund und Höhe schriftlich anmelden, Sicherheit zu leisten, soweit sie nicht Befriedigung verlangen können. Dieses Recht steht den Gläubigern jedoch nur zu, wenn sie glaubhaft machen, dass durch die Spaltung die Erfüllung ihrer Forderung gefährdet wird. Das Recht, Sicherheitsleistung zu verlangen, steht Gläubigern nicht zu, die im Falle der Insolvenz ein Recht auf vorzugsweise Befriedigung aus einer Deckungsmasse haben, die nach gesetzlicher Vorschrift zu ihrem Schutz errichtet und staatlich überwacht ist."
    },
    {
      "date": "2024-10-21",
      "id": "91037",
      "original_text": "Registerbekanntmachung nach dem Umwandlungsgesetz\nBaden-Württemberg Amtsgericht Stuttgart HRB 765190\nB & R Vermögens Verwaltung GmbH – Reutlingen",
      "type": "Registerbekanntmachung nach dem Umwandlungsgesetz",
      "state": "Baden-Württemberg",
      "amtsgericht": "Amtsgericht Stuttgart",
      "registernummer": "HRB 765190",
      "registerart": "HRB",
      "company_name": "B & R Vermögens Verwaltung GmbH",
      "company_seat": "Reutlingen",
      "details": "21.10.2024 (Bekanntmachungsdatum)\n\nBaden-Württemberg Amtsgericht Stuttgart HRB 765190\nRegisterbekanntmachung nach dem Umwandlungsgesetz 21.10.2024 (Eintragungsdatum)\n\nB & R Vermögens Verwaltung GmbH\nGesellschaft mit beschränkter Haftung\nReutlingen\n\nAls nicht eingetragen wird bekanntgemacht:\nDen Gläubigern der an der Verschmelzung beteiligten Rechtsträger ist, wenn sie binnen sechs Monaten nach dem Tag, an dem die Eintragung der Verschmelzung in das Register des Sitzes desjenigen Rechtsträgers, dessen Gläubiger sie sind, nach § 19 Abs. 3 UmwG als bekanntgemacht gilt, ihren Anspruch nach Grund und Höhe schriftlich anmelden, Sicherheit zu leisten, soweit sie nicht Befriedigung verlangen können. Dieses Recht steht den Gläubigern jedoch nur zu, wenn sie glaubhaft machen, dass durch die Verschmelzung die Erfüllung ihrer Forderung gefährdet wird."
    },
    {
      "date": "2024-10-21",
      "id": "91038",
      "original_text": "Einreichung neuer Dokumente\nBaden-Württemberg Amtsgericht Stuttgart HRB 787394\ncurrily AG – Stuttgart",
      "type": "Einreichung neuer Dokumente",
      "state": "Baden-Württemberg",
      "amtsgericht": "Amtsgericht Stuttgart",
      "registernummer": "HRB 787394",
      "registerart": "HRB",
      "company_name": "currily AG",
      "company_seat": "Stuttgart",
      "details": "21.10.2024 (Bekanntmachungsdatum)\n\nBaden-Württemberg Amtsgericht Stuttgart HRB 787394\nEinreichung neuer Dokumente\n\ncurrily AG\nAktiengesellschaft\nStuttgart\n\nDie Gesellschaft hat am 17.10.2024 die Liste über die Zusammensetzung des Aufsichtsrats zum Handelsregister eingereicht."
    },
    {
      "date": "2024-10-21",
      "id": "91039",
      "original_text": "Registerbekanntmachung nach dem Umwandlungsgesetz\nThüringen Amtsgericht Jena HRB 513718\nKirsch-Verwaltungsgesellschaft mbH – Berga-Wünschendorf",
      "type": "Registerbekanntmachung nach dem Umwandlungsgesetz",
      "state": "Thüringen",
      "amtsgericht": "Amtsgericht Jena",
      "registernummer": "HRB 513718",
      "registerart": "HRB",
      "company_name": "Kirsch-Verwaltungsgesellschaft mbH",
      "company_seat": "Berga-Wünschendorf",
      "details": "21.10.2024 (Bekanntmachungsdatum)\n\nThüringen Amtsgericht Jena HRB 513718\nRegisterbekanntmachung nach dem Umwandlungsgesetz 21.10.2024 (Eintragungsdatum)\n\nKirsch-Verwaltungsgesellschaft mbH\nGesellschaft mit beschränkter Haftung\nBerga-Wünschendorf\n\nNicht eingetragen: Den Gläubigern der an der Verschmelzung beteiligten Rechtsträger, ist wenn sie binnen sechs Monaten nach dem Tag, an dem die Eintragung der Verschmelzung in das Register des Sitzes desjenigen Rechtsträgers, dessen Gläubiger sie sind,  nach § 19 Abs. 3 UmwG als bekanntgemacht gilt, ihren Anspruch nach Grund und Höhe schriftlich anmelden, Sicherheit zu leisten, soweit sie nicht Befriedigung verlangen können. Dieses Recht steht ihnen jedoch nur zu, wenn sie glaubhaft machen, daß durch die Verschmelzung die Erfüllung ihrer Forderung gefährdet wird."
    },
    {
      "date": "2024-10-21",
      "id": "91040",
      "original_text": "Registerbekanntmachung nach dem Umwandlungsgesetz\nBaden-Württemberg Amtsgericht Stuttgart HRB 223264\nINTERFRACHT AIR SERVICE GmbH – Filderstadt",
      "type": "Registerbekanntmachung nach dem Umwandlungsgesetz",
      "state": "Baden-Württemberg",
      "amtsgericht": "Amtsgericht Stuttgart",
      "registernummer": "HRB 223264",
      "registerart": "HRB",
      "company_name": "INTERFRACHT AIR SERVICE GmbH",
      "company_seat": "Filderstadt",
      "details": "21.10.2024 (Bekanntmachungsdatum)\n\nBaden-Württemberg Amtsgericht Stuttgart HRB 223264\nRegisterbekanntmachung nach dem Umwandlungsgesetz 21.10.2024 (Eintragungsdatum)\n\nINTERFRACHT AIR SERVICE GmbH\nGesellschaft mit beschränkter Haftung\nFilderstadt\n\nDen Gläubigern der an der Verschmelzung beteiligten Rechtsträger ist, wenn sie binnen sechs Monaten nach dem Tag, an dem die Eintragung der Verschmelzung in das Register des Sitzes desjenigen Rechtsträgers, dessen Gläubiger sie sind, nach § 19 Abs. 3 UmwG als bekanntgemacht gilt, ihren Anspruch nach Grund und Höhe schriftlich anmelden, Sicherheit zu leisten, soweit sie nicht Befriedigung verlangen können. Dieses Recht steht den Gläubigern jedoch nur zu, wenn sie glaubhaft machen, dass durch die Verschmelzung die Erfüllung ihrer Forderung gefährdet wird."
    },
    {
      "date": "2024-10-21",
      "id": "91041",
      "original_text": "Einreichung neuer Dokumente\nBaden-Württemberg Amtsgericht Freiburg HRB 490502\nStadtwerke Oberkirch GmbH – Oberkirch",
      "type": "Einreichung neuer Dokumente",
      "state": "Baden-Württemberg",
      "amtsgericht": "Amtsgericht Freiburg",
      "registernummer": "HRB 490502",
      "registerart": "HRB",
      "company_name": "Stadtwerke Oberkirch GmbH",
      "company_seat": "Oberkirch",
      "details": "21.10.2024 (Bekanntmachungsdatum)\n\nBaden-Württemberg Amtsgericht Freiburg HRB 490502\nEinreichung neuer Dokumente\n\nStadtwerke Oberkirch GmbH\nGesellschaft mit beschränkter Haftung\nOberkirch\n\nDie Gesellschaft hat am 16.10.2024 die Liste über die Zusammensetzung des Aufsichtsrats zum Handelsregister eingereicht."
    },
    {
      "date": "2024-10-21",
      "id": "91042",
      "original_text": "Löschungsankündigung\nBrandenburg Amtsgericht Potsdam HRB 21542\nMounting Systems Abwicklungsgesellschaft mbH – Rangsdorf",
      "type": "Löschungsankündigung",
      "state": "Brandenburg",
      "amtsgericht": "Amtsgericht Potsdam",
      "registernummer": "HRB 21542",
      "registerart": "HRB",
      "company_name": "Mounting Systems Abwicklungsgesellschaft mbH",
      "company_seat": "Rangsdorf",
      "details": "21.10.2024 (Bekanntmachungsdatum)\n\nBrandenburg Amtsgericht Potsdam HRB 21542\nLöschungsankündigung\n\nMounting Systems Abwicklungsgesellschaft mbH\nGesellschaft mit beschränkter Haftung\nRangsdorf\n\nBei der nachstehenden Gesellschaft wird das Amtslöschungsverfahren gemäß § 394 FamFG eingeleitet. Widerspruchsfrist 8 Wochen."
    },
    {
      "date": "2024-10-21",
      "id": "91043",
      "original_text": "Registerbekanntmachung nach dem Umwandlungsgesetz\nBerlin Amtsgericht Berlin (Charlottenburg) HRA 63471\nYummy OHG – Berlin",
      "type": "Registerbekanntmachung nach dem Umwandlungsgesetz",
      "state": "Berlin",
      "amtsgericht": "Amtsgericht Berlin (Charlottenburg)",
      "registernummer": "HRA 63471",
      "registerart": "HRA",
      "company_name": "Yummy OHG",
      "company_seat": "Berlin",
      "details": "21.10.2024 (Bekanntmachungsdatum)\n\nBerlin Amtsgericht Berlin (Charlottenburg) HRA 63471\nRegisterbekanntmachung nach dem Umwandlungsgesetz 18.10.2024 (Eintragungsdatum)\n\nYummy OHG\nOffene Handelsgesellschaft\nBerlin\n\nZu Eintragungsnummer 2 vom 18.10.2024 wird als nicht eingetragen veröffentlicht: Den Gläubigern ist, wenn sie binnen sechs Monaten nach dem Tag, an dem die Eintragung der Umwandlung als bekannt gemacht gilt, ihren Anspruch nach Grund und Höhe schriftlich anmelden, Sicherheit zu leisten, soweit sie nicht Befriedigung verlangen können. Dieses Recht steht den Gläubigern jedoch nur zu, wenn sie glaubhaft machen, dass durch die Umwandlung die Erfüllung ihrer Forderung gefährdet wird. Das Recht, Sicherheitsleistung zu verlangen, steht Gläubigern nicht zu, die im Falle der Insolvenz ein Recht auf vorzugsweise Befriedigung aus einer Deckungsmasse haben, die nach gesetzlicher Vorschrift zu ihrem Schutz errichtet und staatlich überwacht ist."
    },
    {
      "date": "2024-10-21",
      "id": "91044",
      "original_text": "Registerbekanntmachung nach dem Umwandlungsgesetz\nSchleswig-Holstein Amtsgericht Lübeck HRB 10179\nHCK Verwaltungs GmbH – Ahrensburg",
      "type": "Registerbekanntmachung nach dem Umwandlungsgesetz",
      "state": "Schleswig-Holstein",
      "amtsgericht": "Amtsgericht Lübeck",
      "registernummer": "HRB 10179",
      "registerart": "HRB",
      "company_name": "HCK Verwaltungs GmbH",
      "company_seat": "Ahrensburg",
      "details": "21.10.2024 (Bekanntmachungsdatum)\n\nSchleswig-Holstein Amtsgericht Lübeck HRB 10179\nRegisterbekanntmachung nach dem Umwandlungsgesetz 18.10.2024 (Eintragungsdatum)\n\nHCK Verwaltungs GmbH\nGesellschaft mit beschränkter Haftung\nAhrensburg\n\nZu Eintragungsnummer 3 vom 18.10.2024 wird als nicht eingetragen veröffentlicht:\nDen Gläubigern der an der Verschmelzung beteiligten Rechtsträger ist, wenn sie binnen sechs Monaten nach dem Tag, an dem die Eintragung der Verschmelzung in das Register des Sitzes desjenigen Rechtsträgers, dessen Gläubiger sie sind, als bekannt gemacht gilt, ihren Anspruch nach Grund und Höhe schriftlich anmelden, Sicherheit zu leisten, soweit sie nicht Befriedigung verlangen können. Dieses Recht steht den Gläubigern jedoch nur zu, wenn sie glaubhaft machen, dass durch die Verschmelzung die Erfüllung ihrer Forderung gefährdet wird."
    },
    {
      "date": "2024-10-21",
      "id": "91045",
      "original_text": "Löschungsankündigung\nBerlin Amtsgericht Berlin (Charlottenburg) HRB 96009\nReal Zwanzigste Verwaltungsgesellschaft mbH – Berlin",
      "type": "Löschungsankündigung",
      "state": "Berlin",
      "amtsgericht": "Amtsgericht Berlin (Charlottenburg)",
      "registernummer": "HRB 96009",
      "registerart": "HRB",
      "company_name": "Real Zwanzigste Verwaltungsgesellschaft mbH",
      "company_seat": "Berlin",
      "details": "21.10.2024 (Bekanntmachungsdatum)\n\nBerlin Amtsgericht Berlin (Charlottenburg) HRB 96009\nLöschungsankündigung\n\nReal Zwanzigste Verwaltungsgesellschaft mbH\nGesellschaft mit beschränkter Haftung\nBerlin\n\nBei der nachstehenden Gesellschaft wird das Amtslöschungsverfahren gemäß § 394 FamFG eingeleitet. Widerspruchsfrist 6 Wochen"
    },
    {
      "date": "2024-10-21",
      "id": "91046",
      "original_text": "Sonstige Registerbekanntmachung\nBrandenburg Amtsgericht Frankfurt/Oder HRB 2619\nTeGeCe Technologie- und Gewerbecenter Frankfurt (Oder) GmbH – Frankfurt (Oder)",
      "type": "Sonstige Registerbekanntmachung",
      "state": "Brandenburg",
      "amtsgericht": "Amtsgericht Frankfurt/Oder",
      "registernummer": "HRB 2619",
      "registerart": "HRB",
      "company_name": "TeGeCe Technologie- und Gewerbecenter Frankfurt (Oder) GmbH",
      "company_seat": "Frankfurt (Oder)",
      "details": "21.10.2024 (Bekanntmachungsdatum)\n\nBrandenburg Amtsgericht Frankfurt/Oder HRB 2619\nSonstige Registerbekanntmachung\n\nTeGeCe Technologie- und Gewerbecenter Frankfurt (Oder) GmbH\nGesellschaft mit beschränkter Haftung\nFrankfurt (Oder)\n\nAls nicht eingetragen wird veröffentlicht: Die Liste der Aufsichtsratsmitglieder vom 09.10.2024 ist zum Handelsregister eingereicht worden"
    },
    {
      "date": "2024-10-21",
      "id": "91047",
      "original_text": "Löschungsankündigung\nBrandenburg Amtsgericht Potsdam HRB 37331\nbackstage brothers GmbH – Schwielowsee",
      "type": "Löschungsankündigung",
      "state": "Brandenburg",
      "amtsgericht": "Amtsgericht Potsdam",
      "registernummer": "HRB 37331",
      "registerart": "HRB",
      "company_name": "backstage brothers GmbH",
      "company_seat": "Schwielowsee",
      "details": "21.10.2024 (Bekanntmachungsdatum)\n\nBrandenburg Amtsgericht Potsdam HRB 37331\nLöschungsankündigung\n\nbackstage brothers GmbH\nGesellschaft mit beschränkter Haftung\nSchwielowsee\n\nBei der nachstehenden Gesellschaft wird das Amtslöschungsverfahren gemäß § 394 FamFG eingeleitet. Widerspruchsfrist: 8 Wochen"
    },
    {
      "date": "2024-10-21",
      "id": "91048",
      "original_text": "Registerbekanntmachung nach dem Umwandlungsgesetz\nSachsen-Anhalt Amtsgericht Stendal HRB 33571\nTransmedial GmbH – Zeitz",
      "type": "Registerbekanntmachung nach dem Umwandlungsgesetz",
      "state": "Sachsen-Anhalt",
      "amtsgericht": "Amtsgericht Stendal",
      "registernummer": "HRB 33571",
      "registerart": "HRB",
      "company_name": "Transmedial GmbH",
      "company_seat": "Zeitz",
      "details": "21.10.2024 (Bekanntmachungsdatum)\n\nSachsen-Anhalt Amtsgericht Stendal HRB 33571\nRegisterbekanntmachung nach dem Umwandlungsgesetz 21.10.2024 (Eintragungsdatum)\n\nTransmedial GmbH\nGesellschaft mit beschränkter Haftung\nZeitz\n\nNicht eingetragen:\nDen Gläubigern der an der Ausgliederung beteiligten Rechtsträger, ist wenn sie binnen sechs Monaten nach dem Tag, an dem die Eintragung der Ausgliederung nach §§125, 19 Abs. 3 UmwG als bekanntgemacht gilt, ihren Anspruch nach Grund und Höhe schriftlich anmelden, Sicherheit zu leisten, soweit sie nicht Befriedigung verlangen können. Diese Recht steht ihnen jedoch nur zu, wenn sie glaubhaft machen, dass durch die Ausgliederung die Erfüllung ihrer Forderung gefährdet wird."
    },
    {
      "date": "2024-10-21",
      "id": "91049",
      "original_text": "Löschungsankündigung\nSchleswig-Holstein Amtsgericht Kiel HRA 9149\nMN Bauservice Katharina Wende e. Kfr. – Kiel",
      "type": "Löschungsankündigung",
      "state": "Schleswig-Holstein",
      "amtsgericht": "Amtsgericht Kiel",
      "registernummer": "HRA 9149",
      "registerart": "HRA",
      "company_name": "MN Bauservice Katharina Wende e. Kfr.",
      "company_seat": "Kiel",
      "details": "21.10.2024 (Bekanntmachungsdatum)\n\nSchleswig-Holstein Amtsgericht Kiel HRA 9149\nLöschungsankündigung\n\nMN Bauservice Katharina Wende e. Kfr.\nEinzelkaufmann / Einzelkauffrau\nKiel\n\nBei der nachstehenden Firma wird das Amtslöschungsverfahren gemäß § 31 Abs. 2 HGB eingeleitet. Widerspruchsfrist: 2 Monate."
    },
    {
      "date": "2024-10-21",
      "id": "91050",
      "original_text": "Registerbekanntmachung nach dem Umwandlungsgesetz\nBerlin Amtsgericht Berlin (Charlottenburg) HRA 63153\nCheers KTV Bar Senlei Ye e.K. – Berlin",
      "type": "Registerbekanntmachung nach dem Umwandlungsgesetz",
      "state": "Berlin",
      "amtsgericht": "Amtsgericht Berlin (Charlottenburg)",
      "registernummer": "HRA 63153",
      "registerart": "HRA",
      "company_name": "Cheers KTV Bar Senlei Ye e.K.",
      "company_seat": "Berlin",
      "details": "21.10.2024 (Bekanntmachungsdatum)\n\nBerlin Amtsgericht Berlin (Charlottenburg) HRA 63153\nRegisterbekanntmachung nach dem Umwandlungsgesetz 18.10.2024 (Eintragungsdatum)\n\nCheers KTV Bar Senlei Ye e.K.\nEinzelkaufmann / Einzelkauffrau\nBerlin\n\nZu Eintragungsnummer 2 vom 18.10.2024 wird als nicht eingetragen veröffentlicht: Den Gläubigern der an der Spaltung beteiligten Rechtsträger ist, wenn sie binnen sechs Monaten nach dem Tag, an dem die Eintragung der Spaltung in das Register des Sitzes desjenigen Rechtsträgers, dessen Gläubiger sie sind, als bekannt gemacht gilt, ihren Anspruch nach Grund und Höhe schriftlich anmelden, Sicherheit zu leisten, soweit sie nicht Befriedigung verlangen können. Dieses Recht steht den Gläubigern jedoch nur zu, wenn sie glaubhaft machen, dass durch die Spaltung die Erfüllung ihrer Forderung gefährdet wird. Das Recht, Sicherheitsleistung zu verlangen, steht Gläubigern nicht zu, die im Falle der Insolvenz ein Recht auf vorzugsweise Befriedigung aus einer Deckungsmasse haben, die nach gesetzlicher Vorschrift zu ihrem Schutz errichtet und staatlich überwacht ist."
    },
    {
      "date": "2024-10-21",
      "id": "91051",
      "original_text": "Löschungsankündigung\nBaden-Württemberg Amtsgericht Freiburg HRB 722304\nOleoestepa-Deutschland GmbH – Konstanz",
      "type": "Löschungsankündigung",
      "state": "Baden-Württemberg",
      "amtsgericht": "Amtsgericht Freiburg",
      "registernummer": "HRB 722304",
      "registerart": "HRB",
      "company_name": "Oleoestepa-Deutschland GmbH",
      "company_seat": "Konstanz",
      "details": "21.10.2024 (Bekanntmachungsdatum)\n\nBaden-Württemberg Amtsgericht Freiburg HRB 722304\nLöschungsankündigung\n\nOleoestepa-Deutschland GmbH\nGesellschaft mit beschränkter Haftung\nKonstanz\n\nDas Gericht beabsichtigt, die Gesellschaft wegen Vermögenslosigkeit im Handelsregister von Amts wegen nach § 394 FamFG zu löschen. Die Frist zur Geltendmachung eines Widerspruchs gegen die beabsichtigte Löschung ist auf einen Monat ab Veröffentlichung bestimmt."
    },
    {
      "date": "2024-10-21",
      "id": "91052",
      "original_text": "Registerbekanntmachung nach dem Umwandlungsgesetz\nBerlin Amtsgericht Berlin (Charlottenburg) HRB 268659\nCheers KTV Bar GmbH – Berlin",
      "type": "Registerbekanntmachung nach dem Umwandlungsgesetz",
      "state": "Berlin",
      "amtsgericht": "Amtsgericht Berlin (Charlottenburg)",
      "registernummer": "HRB 268659",
      "registerart": "HRB",
      "company_name": "Cheers KTV Bar GmbH",
      "company_seat": "Berlin",
      "details": "21.10.2024 (Bekanntmachungsdatum)\n\nBerlin Amtsgericht Berlin (Charlottenburg) HRB 268659\nRegisterbekanntmachung nach dem Umwandlungsgesetz 18.10.2024 (Eintragungsdatum)\n\nCheers KTV Bar GmbH\nGesellschaft mit beschränkter Haftung\nBerlin\n\nZu Eintragungsnummer 1 vom 18.10.2024 wird als nicht eingetragen veröffentlicht: Den Gläubigern der an der Spaltung beteiligten Rechtsträger ist, wenn sie binnen sechs Monaten nach dem Tag, an dem die Eintragung der Spaltung in das Register des Sitzes desjenigen Rechtsträgers, dessen Gläubiger sie sind, als bekannt gemacht gilt, ihren Anspruch nach Grund und Höhe schriftlich anmelden, Sicherheit zu leisten, soweit sie nicht Befriedigung verlangen können. Dieses Recht steht den Gläubigern jedoch nur zu, wenn sie glaubhaft machen, dass durch die Spaltung die Erfüllung ihrer Forderung gefährdet wird. Das Recht, Sicherheitsleistung zu verlangen, steht Gläubigern nicht zu, die im Falle der Insolvenz ein Recht auf vorzugsweise Befriedigung aus einer Deckungsmasse haben, die nach gesetzlicher Vorschrift zu ihrem Schutz errichtet und staatlich überwacht ist."
    },
    {
      "date": "2024-10-21",
      "id": "91053",
      "original_text": "Registerbekanntmachung nach dem Umwandlungsgesetz\nSchleswig-Holstein Amtsgericht Lübeck HRB 19541\nMultiplex Cinemas Bremen GmbH – Lübeck",
      "type": "Registerbekanntmachung nach dem Umwandlungsgesetz",
      "state": "Schleswig-Holstein",
      "amtsgericht": "Amtsgericht Lübeck",
      "registernummer": "HRB 19541",
      "registerart": "HRB",
      "company_name": "Multiplex Cinemas Bremen GmbH",
      "company_seat": "Lübeck",
      "details": "21.10.2024 (Bekanntmachungsdatum)\n\nSchleswig-Holstein Amtsgericht Lübeck HRB 19541\nRegisterbekanntmachung nach dem Umwandlungsgesetz 18.10.2024 (Eintragungsdatum)\n\nMultiplex Cinemas Bremen GmbH\nGesellschaft mit beschränkter Haftung\nLübeck\n\nZu Eintragungsnummer 4 vom 18.10.2024 wird als nicht eingetragen veröffentlicht:  Als nicht eingetragen wird veröffentlicht: Den Gläubigern der an der Verschmelzung beteiligten Rechtsträger ist, wenn sie binnen sechs Monaten nach dem Tag, an dem die Eintragung der Verschmelzung in das Register des Sitzes desjenigen Rechtsträgers, dessen Gläubiger sie sind, als bekannt gemacht gilt, ihren Anspruch nach Grund und Höhe schriftlich anmelden, Sicherheit zu leisten, soweit sie nicht Befriedigung verlangen können. Dieses Recht steht den Gläubigern jedoch nur zu, wenn sie glaubhaft machen, dass durch die Verschmelzung die Erfüllung ihrer Forderung gefährdet wird."
    },
    {
      "date": "2024-10-21",
      "id": "91054",
      "original_text": "Registerbekanntmachung nach dem Umwandlungsgesetz\nNordrhein-Westfalen Amtsgericht Coesfeld HRA 7693\nMolkerei Wiegert GmbH & Co. KG – Velen",
      "type": "Registerbekanntmachung nach dem Umwandlungsgesetz",
      "state": "Nordrhein-Westfalen",
      "amtsgericht": "Amtsgericht Coesfeld",
      "registernummer": "HRA 7693",
      "registerart": "HRA",
      "company_name": "Molkerei Wiegert GmbH & Co. KG",
      "company_seat": "Velen",
      "details": "21.10.2024 (Bekanntmachungsdatum)\n\nNordrhein-Westfalen Amtsgericht Coesfeld HRA 7693\nRegisterbekanntmachung nach dem Umwandlungsgesetz 21.10.2024 (Eintragungsdatum)\n\nMolkerei Wiegert GmbH & Co. KG\nKommanditgesellschaft\nVelen\n\nDen Gläubigern der an der Verschmelzung beteiligten Rechtsträger ist, wenn sie binnen sechs Monaten nach dem Tag, an dem die Eintragung der Verschmelzung in das Register des Sitzes desjenigen Rechtsträgers, dessen Gläubiger sie sind, nach § 19 Absatz 3 UmwG als bekanntgemacht gilt, ihren Anspruch nach Grund und Höhe schriftlich anmelden, Sicherheit zu leisten, soweit sie nicht Befriedigung verlangen können. Dieses Recht steht den Gläubigern jedoch nur zu, wenn sie glaubhaft machen, dass durch die Verschmelzung die Erfüllung ihrer Forderung gefährdet wird."
    },
    {
      "date": "2024-10-21",
      "id": "91055",
      "original_text": "Löschungsankündigung\nBerlin Amtsgericht Berlin (Charlottenburg) HRB 221540\nORAL Bau GmbH – Berlin",
      "type": "Löschungsankündigung",
      "state": "Berlin",
      "amtsgericht": "Amtsgericht Berlin (Charlottenburg)",
      "registernummer": "HRB 221540",
      "registerart": "HRB",
      "company_name": "ORAL Bau GmbH",
      "company_seat": "Berlin",
      "details": "21.10.2024 (Bekanntmachungsdatum)\n\nBerlin Amtsgericht Berlin (Charlottenburg) HRB 221540\nLöschungsankündigung\n\nORAL Bau GmbH\nGesellschaft mit beschränkter Haftung\nBerlin\n\nBei der nachstehenden Gesellschaft wird das Amtslöschungsverfahren gemäß § 394 FamFG eingeleitet. Widerspruchsfrist 6 Wochen"
    },
    {
      "date": "2024-10-21",
      "id": "91056",
      "original_text": "Registerbekanntmachung nach dem Umwandlungsgesetz\nSachsen-Anhalt Amtsgericht Stendal HRB 5992\nStadtwerke Weißenfels Energienetze GmbH – Weißenfels",
      "type": "Registerbekanntmachung nach dem Umwandlungsgesetz",
      "state": "Sachsen-Anhalt",
      "amtsgericht": "Amtsgericht Stendal",
      "registernummer": "HRB 5992",
      "registerart": "HRB",
      "company_name": "Stadtwerke Weißenfels Energienetze GmbH",
      "company_seat": "Weißenfels",
      "details": "21.10.2024 (Bekanntmachungsdatum)\n\nSachsen-Anhalt Amtsgericht Stendal HRB 5992\nRegisterbekanntmachung nach dem Umwandlungsgesetz 21.10.2024 (Eintragungsdatum)\n\nStadtwerke Weißenfels Energienetze GmbH\nGesellschaft mit beschränkter Haftung\nWeißenfels\n\nNicht eingetragen:\nDen Gläubigern der an der Spaltung beteiligten Rechtsträger, ist wenn sie binnen sechs Monaten nach dem Tag, an dem die Eintragung der Spaltung nach §§ 125, 19 Abs. 3 UmwG als bekanntgemacht gilt, ihren Anspruch nach Grund und Höhe schriftlich anmelden, Sicherheit zu leisten, soweit sie nicht Befriedigung verlangen können. Dieses Recht steht ihnen jedoch nur zu, wenn sie glaubhaft machen, daß durch die Spaltung die Erfüllung ihrer Forderung gefährdet wird."
    },
    {
      "date": "2024-10-21",
      "id": "91057",
      "original_text": "Registerbekanntmachung nach dem Umwandlungsgesetz\nSachsen-Anhalt Amtsgericht Stendal HRB 202315\nKurbetriebsgesellschaft Naumburg/Bad Kösen mit beschränkter Haftung – Naumburg (Saale)",
      "type": "Registerbekanntmachung nach dem Umwandlungsgesetz",
      "state": "Sachsen-Anhalt",
      "amtsgericht": "Amtsgericht Stendal",
      "registernummer": "HRB 202315",
      "registerart": "HRB",
      "company_name": "Kurbetriebsgesellschaft Naumburg/Bad Kösen mit beschränkter Haftung",
      "company_seat": "Naumburg (Saale)",
      "details": "21.10.2024 (Bekanntmachungsdatum)\n\nSachsen-Anhalt Amtsgericht Stendal HRB 202315\nRegisterbekanntmachung nach dem Umwandlungsgesetz 21.10.2024 (Eintragungsdatum)\n\nKurbetriebsgesellschaft Naumburg/Bad Kösen mit beschränkter Haftung\nGesellschaft mit beschränkter Haftung\nNaumburg (Saale)\n\nNicht eingetragen:\nDen Gläubigern der an der Spaltung (Vermögensteilübertragung) beteiligten Rechtsträger, ist wenn sie binnen sechs Monaten nach dem Tag, an dem die Eintragung der Spaltung nach §§ 125, 19 Abs. 3 UmwG als bekanntgemacht gilt, ihren Anspruch nach Grund und Höhe schriftlich anmelden, Sicherheit zu leisten, soweit sie nicht Befriedigung verlangen können. Dieses Recht steht ihnen jedoch nur zu, wenn sie glaubhaft machen, daß durch die Spaltung die Erfüllung ihrer Forderung gefährdet wird."
    },
    {
      "date": "2024-10-21",
      "id": "91058",
      "original_text": "Registerbekanntmachung nach dem Umwandlungsgesetz\nSachsen-Anhalt Amtsgericht Stendal HRB 202850\nStadtwerke Weißenfels GmbH – Weißenfels",
      "type": "Registerbekanntmachung nach dem Umwandlungsgesetz",
      "state": "Sachsen-Anhalt",
      "amtsgericht": "Amtsgericht Stendal",
      "registernummer": "HRB 202850",
      "registerart": "HRB",
      "company_name": "Stadtwerke Weißenfels GmbH",
      "company_seat": "Weißenfels",
      "details": "21.10.2024 (Bekanntmachungsdatum)\n\nSachsen-Anhalt Amtsgericht Stendal HRB 202850\nRegisterbekanntmachung nach dem Umwandlungsgesetz 21.10.2024 (Eintragungsdatum)\n\nStadtwerke Weißenfels GmbH\nGesellschaft mit beschränkter Haftung\nWeißenfels\n\nNicht eingetragen:\nDen Gläubigern der an der Spaltung beteiligten Rechtsträger, ist wenn sie binnen sechs Monaten nach dem Tag, an dem die Eintragung der Spaltung nach §§ 125, 19 Abs. 3 UmwG als bekanntgemacht gilt, ihren Anspruch nach Grund und Höhe schriftlich anmelden, Sicherheit zu leisten, soweit sie nicht Befriedigung verlangen können. Dieses Recht steht ihnen jedoch nur zu, wenn sie glaubhaft machen, daß durch die Spaltung die Erfüllung ihrer Forderung gefährdet wird."
    },
    {
      "date": "2024-10-21",
      "id": "91059",
      "original_text": "Registerbekanntmachung nach dem Umwandlungsgesetz\nBerlin Amtsgericht Berlin (Charlottenburg) HRB 204485\nRNS Berlin UG (haftungsbeschränkt) – Berlin",
      "type": "Registerbekanntmachung nach dem Umwandlungsgesetz",
      "state": "Berlin",
      "amtsgericht": "Amtsgericht Berlin (Charlottenburg)",
      "registernummer": "HRB 204485",
      "registerart": "HRB",
      "company_name": "RNS Berlin UG (haftungsbeschränkt)",
      "company_seat": "Berlin",
      "details": "21.10.2024 (Bekanntmachungsdatum)\n\nBerlin Amtsgericht Berlin (Charlottenburg) HRB 204485\nRegisterbekanntmachung nach dem Umwandlungsgesetz 18.10.2024 (Eintragungsdatum)\n\nRNS Berlin UG (haftungsbeschränkt)\nGesellschaft mit beschränkter Haftung\nBerlin\n\nZu Eintragungsnummer 2 vom 18.10.2024 wird als nicht eingetragen veröffentlicht:  Den Gläubigern der an der Verschmelzung beteiligten Rechtsträger ist, wenn sie binnen sechs Monaten nach dem Tag, an dem die Eintragung der Verschmelzung in das Register des Sitzes desjenigen Rechtsträgers, dessen Gläubiger sie sind, als bekannt gemacht gilt, ihren Anspruch nach Grund und Höhe schriftlich anmelden, Sicherheit zu leisten, soweit sie nicht Befriedigung verlangen können. Dieses Recht steht den Gläubigern jedoch nur zu, wenn sie glaubhaft machen, dass durch die Verschmelzung die Erfüllung ihrer Forderung gefährdet wird. Das Recht, Sicherheitsleistung zu verlangen, steht Gläubigern nicht zu, die im Falle der Insolvenz ein Recht auf vorzugsweise Befriedigung aus einer Deckungsmasse haben, die nach gesetzlicher Vorschrift zu ihrem Schutz errichtet und staatlich überwacht ist."
    },
    {
      "date": "2024-10-21",
      "id": "91060",
      "original_text": "Registerbekanntmachung nach dem Umwandlungsgesetz\nBaden-Württemberg Amtsgericht Stuttgart GnR 720228\nHausverwaltung Anton Schneider eG – Öhringen",
      "type": "Registerbekanntmachung nach dem Umwandlungsgesetz",
      "state": "Baden-Württemberg",
      "amtsgericht": "Amtsgericht Stuttgart",
      "registernummer": "GnR 720228",
      "registerart": "GnR",
      "company_name": "Hausverwaltung Anton Schneider eG",
      "company_seat": "Öhringen",
      "details": "21.10.2024 (Bekanntmachungsdatum)\n\nBaden-Württemberg Amtsgericht Stuttgart GnR 720228\nRegisterbekanntmachung nach dem Umwandlungsgesetz 21.10.2024 (Eintragungsdatum)\n\nHausverwaltung Anton Schneider eG\neingetragene Genossenschaft\nÖhringen\n\nDen Gläubigern der an der Ausgliederung beteiligten Rechtsträger ist, wenn sie binnen sechs Monaten nach dem Tag, an dem die Eintragung der Ausgliederung in das Register des Sitzes desjenigen Rechtsträgers, dessen Gläubiger sie sind, nach § 19 Abs. 3 UmwG als bekanntgemacht gilt, ihren Anspruch nach Grund und Höhe schriftlich anmelden, Sicherheit zu leisten, soweit sie nicht Befriedigung verlangen können. Dieses Recht steht den Gläubigern jedoch nur zu, wenn sie glaubhaft machen, dass durch die Ausgliederung die Erfüllung ihrer Forderung gefährdet wird."
    },
    {
      "date": "2024-10-21",
      "id": "91061",
      "original_text": "Registerbekanntmachung nach dem Umwandlungsgesetz\nBaden-Württemberg Amtsgericht Stuttgart HRA 741504\nKLmedia e.K. – Gärtringen",
      "type": "Registerbekanntmachung nach dem Umwandlungsgesetz",
      "state": "Baden-Württemberg",
      "amtsgericht": "Amtsgericht Stuttgart",
      "registernummer": "HRA 741504",
      "registerart": "HRA",
      "company_name": "KLmedia e.K.",
      "company_seat": "Gärtringen",
      "details": "21.10.2024 (Bekanntmachungsdatum)\n\nBaden-Württemberg Amtsgericht Stuttgart HRA 741504\nRegisterbekanntmachung nach dem Umwandlungsgesetz 21.10.2024 (Eintragungsdatum)\n\nKLmedia e.K.\nEinzelkaufmann / Einzelkauffrau\nGärtringen\n\nDen Gläubigern der an der Ausgliederung beteiligten Rechtsträger ist, wenn sie binnen sechs Monaten nach dem Tag, an dem die Eintragung der Ausgliederung in das Register des Sitzes desjenigen Rechtsträgers, dessen Gläubiger sie sind, nach § 19 Abs. 3 UmwG als bekanntgemacht gilt, ihren Anspruch nach Grund und Höhe schriftlich anmelden, Sicherheit zu leisten, soweit sie nicht Befriedigung verlangen können. Dieses Recht steht den Gläubigern jedoch nur zu, wenn sie glaubhaft machen, dass durch die Ausgliederung die Erfüllung ihrer Forderung gefährdet wird."
    },
    {
      "date": "2024-10-21",
      "id": "91062",
      "original_text": "Registerbekanntmachung nach dem Umwandlungsgesetz\nBrandenburg Amtsgericht Neuruppin HRA 3859\nRobert Hörster Vermögensberatung eK – Kremmen",
      "type": "Registerbekanntmachung nach dem Umwandlungsgesetz",
      "state": "Brandenburg",
      "amtsgericht": "Amtsgericht Neuruppin",
      "registernummer": "HRA 3859",
      "registerart": "HRA",
      "company_name": "Robert Hörster Vermögensberatung eK",
      "company_seat": "Kremmen",
      "details": "21.10.2024 (Bekanntmachungsdatum)\n\nBrandenburg Amtsgericht Neuruppin HRA 3859\nRegisterbekanntmachung nach dem Umwandlungsgesetz 21.10.2024 (Eintragungsdatum)\n\nRobert Hörster Vermögensberatung eK\nEinzelkaufmann / Einzelkauffrau\nKremmen\n\nZu Eintragungsnummer 2 vom 21.10.2024 wird als nicht eingetragen veröffentlicht:\nDen Gläubigern der an der Umwandlung beteiligten Rechtsträger ist, wenn sie binnen sechs Monaten nach dem Tag, an dem die Eintragung der Umwandlung in das Register des Sitzes desjenigen Rechtsträgers, dessen Gläubiger sie sind, als bekannt gemacht gilt, ihren Anspruch nach Grund und Höhe schriftlich anmelden, Sicherheit zu leisten, soweit sie nicht Befriedigung verlangen können. Dieses Recht steht den Gläubigern jedoch nur zu, wenn sie glaubhaft machen, dass durch die Umwandlung die Erfüllung ihrer Forderung gefährdet wird"
    },
    {
      "date": "2024-10-21",
      "id": "91063",
      "original_text": "Löschungsankündigung\nBerlin Amtsgericht Berlin (Charlottenburg) HRB 126014\nAtromont GmbH – Berlin",
      "type": "Löschungsankündigung",
      "state": "Berlin",
      "amtsgericht": "Amtsgericht Berlin (Charlottenburg)",
      "registernummer": "HRB 126014",
      "registerart": "HRB",
      "company_name": "Atromont GmbH",
      "company_seat": "Berlin",
      "details": "21.10.2024 (Bekanntmachungsdatum)\n\nBerlin Amtsgericht Berlin (Charlottenburg) HRB 126014\nLöschungsankündigung\n\nAtromont GmbH\nGesellschaft mit beschränkter Haftung\nBerlin\n\nBei der nachstehenden Gesellschaft wird das Amtslöschungsverfahren gemäß § 394 FamFG eingeleitet. Widerspruchsfrist 6 Wochen"
    },
    {
      "date": "2024-10-21",
      "id": "91064",
      "original_text": "Registerbekanntmachung nach dem Umwandlungsgesetz\nBaden-Württemberg Amtsgericht Stuttgart HRA 740524\nNautilus AS Immobilien e.K. – Öhringen",
      "type": "Registerbekanntmachung nach dem Umwandlungsgesetz",
      "state": "Baden-Württemberg",
      "amtsgericht": "Amtsgericht Stuttgart",
      "registernummer": "HRA 740524",
      "registerart": "HRA",
      "company_name": "Nautilus AS Immobilien e.K.",
      "company_seat": "Öhringen",
      "details": "21.10.2024 (Bekanntmachungsdatum)\n\nBaden-Württemberg Amtsgericht Stuttgart HRA 740524\nRegisterbekanntmachung nach dem Umwandlungsgesetz 21.10.2024 (Eintragungsdatum)\n\nNautilus AS Immobilien e.K.\nEinzelkaufmann / Einzelkauffrau\nÖhringen\n\nAls nicht eingetragen wird bekanntgemacht:\nDen Gläubigern der an der Ausgliederung beteiligten Rechtsträger ist, wenn sie binnen sechs Monaten nach dem Tag, an dem die Eintragung der Ausgliederung in das Register des Sitzes desjenigen Rechtsträgers, dessen Gläubiger sie sind, nach § 19 Abs. 3 UmwG als bekanntgemacht gilt, ihren Anspruch nach Grund und Höhe schriftlich anmelden, Sicherheit zu leisten, soweit sie nicht Befriedigung verlangen können. Dieses Recht steht den Gläubigern jedoch nur zu, wenn sie glaubhaft machen, dass durch die Ausgliederung die Erfüllung ihrer Forderung gefährdet wird."
    },
    {
      "date": "2024-10-21",
      "id": "91065",
      "original_text": "Registerbekanntmachung nach dem Umwandlungsgesetz\nBrandenburg Amtsgericht Potsdam HRA 8357\nMobile Hauskrankenpflege Pusch e.K. – Brandenburg an der Havel",
      "type": "Registerbekanntmachung nach dem Umwandlungsgesetz",
      "state": "Brandenburg",
      "amtsgericht": "Amtsgericht Potsdam",
      "registernummer": "HRA 8357",
      "registerart": "HRA",
      "company_name": "Mobile Hauskrankenpflege Pusch e.K.",
      "company_seat": "Brandenburg an der Havel",
      "details": "21.10.2024 (Bekanntmachungsdatum)\n\nBrandenburg Amtsgericht Potsdam HRA 8357\nRegisterbekanntmachung nach dem Umwandlungsgesetz 16.10.2024 (Eintragungsdatum)\n\nMobile Hauskrankenpflege Pusch e.K.\nEinzelkaufmann / Einzelkauffrau\nBrandenburg an der Havel\n\nZu Eintragungsnummer 2 vom 16.10.2024 wird als nicht eingetragen veröffentlicht: Den Gläubigern der an der Verschmelzung beteiligten Rechtsträger ist, wenn sie binnen sechs Monaten nach dem Tag, an dem die Eintragung der Verschmelzung in das Register des Sitzes desjenigen Rechtsträgers, dessen Gläubiger sie sind, als bekannt gemacht gilt, ihren Anspruch nach Grund und Höhe schriftlich anmelden, Sicherheit zu leisten, soweit sie nicht Befriedigung verlangen können. Dieses Recht steht den Gläubigern jedoch nur zu, wenn sie glaubhaft machen, dass durch die Verschmelzung die Erfüllung ihrer Forderung gefährdet wird."
    },
    {
      "date": "2024-10-21",
      "id": "91066",
      "original_text": "Einreichung neuer Dokumente\nBerlin Amtsgericht Berlin (Charlottenburg) HRB 123774\nGeschäftshaus Franklinstraße 22/23 Verwaltungsgesellschaft mbH – Berlin",
      "type": "Einreichung neuer Dokumente",
      "state": "Berlin",
      "amtsgericht": "Amtsgericht Berlin (Charlottenburg)",
      "registernummer": "HRB 123774",
      "registerart": "HRB",
      "company_name": "Geschäftshaus Franklinstraße 22/23 Verwaltungsgesellschaft mbH",
      "company_seat": "Berlin",
      "details": "21.10.2024 (Bekanntmachungsdatum)\n\nBerlin Amtsgericht Berlin (Charlottenburg) HRB 123774\nEinreichung neuer Dokumente\n\nGeschäftshaus Franklinstraße 22/23 Verwaltungsgesellschaft mbH\nGesellschaft mit beschränkter Haftung\nBerlin\n\nAls nicht eingetragen wird veröffentlicht: Es wurde eine neue Liste der Beiratsmitglieder eingereicht (§52 GmbHG)."
    },
    {
      "date": "2024-10-21",
      "id": "91067",
      "original_text": "Löschungsankündigung\nBrandenburg Amtsgericht Potsdam HRB 38171\nWavedropz UG (haftungsbeschränkt) – Ludwigsfelde",
      "type": "Löschungsankündigung",
      "state": "Brandenburg",
      "amtsgericht": "Amtsgericht Potsdam",
      "registernummer": "HRB 38171",
      "registerart": "HRB",
      "company_name": "Wavedropz UG (haftungsbeschränkt)",
      "company_seat": "Ludwigsfelde",
      "details": "21.10.2024 (Bekanntmachungsdatum)\n\nBrandenburg Amtsgericht Potsdam HRB 38171\nLöschungsankündigung\n\nWavedropz UG (haftungsbeschränkt)\nGesellschaft mit beschränkter Haftung\nLudwigsfelde\n\nBei der nachstehenden Gesellschaft wird das Amtslöschungsverfahren gemäß § 394 FamFG eingeleitet. Widerspruchsfrist: 4 Wochen"
    },
    {
      "date": "2024-10-21",
      "id": "91068",
      "original_text": "Registerbekanntmachung nach dem Umwandlungsgesetz\nBrandenburg Amtsgericht Potsdam HRB 31314\nMobile Hauskrankenpflege Pusch GmbH – Brandenburg an der Havel",
      "type": "Registerbekanntmachung nach dem Umwandlungsgesetz",
      "state": "Brandenburg",
      "amtsgericht": "Amtsgericht Potsdam",
      "registernummer": "HRB 31314",
      "registerart": "HRB",
      "company_name": "Mobile Hauskrankenpflege Pusch GmbH",
      "company_seat": "Brandenburg an der Havel",
      "details": "21.10.2024 (Bekanntmachungsdatum)\n\nBrandenburg Amtsgericht Potsdam HRB 31314\nRegisterbekanntmachung nach dem Umwandlungsgesetz 16.10.2024 (Eintragungsdatum)\n\nMobile Hauskrankenpflege Pusch GmbH\nGesellschaft mit beschränkter Haftung\nBrandenburg an der Havel\n\nZu Eintragungsnummer 2 vom 16.10.2024 wird als nicht eingetragen veröffentlicht: Den Gläubigern der an der Verschmelzung beteiligten Rechtsträger ist, wenn sie binnen sechs Monaten nach dem Tag, an dem die Eintragung der Verschmelzung in das Register des Sitzes desjenigen Rechtsträgers, dessen Gläubiger sie sind, als bekannt gemacht gilt, ihren Anspruch nach Grund und Höhe schriftlich anmelden, Sicherheit zu leisten, soweit sie nicht Befriedigung verlangen können. Dieses Recht steht den Gläubigern jedoch nur zu, wenn sie glaubhaft machen, dass durch die Verschmelzung die Erfüllung ihrer Forderung gefährdet wird."
    },
    {
      "date": "2024-10-21",
      "id": "91069",
      "original_text": "Löschungsankündigung\nSchleswig-Holstein Amtsgericht Pinneberg HRB 16113\nB & B LOGISTIK GmbH – Schenefeld/Krs. Pinneberg",
      "type": "Löschungsankündigung",
      "state": "Schleswig-Holstein",
      "amtsgericht": "Amtsgericht Pinneberg",
      "registernummer": "HRB 16113",
      "registerart": "HRB",
      "company_name": "B & B LOGISTIK GmbH",
      "company_seat": "Schenefeld/Krs. Pinneberg",
      "details": "21.10.2024 (Bekanntmachungsdatum)\n\nSchleswig-Holstein Amtsgericht Pinneberg HRB 16113\nLöschungsankündigung\n\nB & B LOGISTIK GmbH\nGesellschaft mit beschränkter Haftung\nSchenefeld/Krs. Pinneberg\n\nEs ist die Löschung der nachstehenden Gesellschaft wegen Vermögenslosigkeit gemäß § 394 FamFG beabsichtigt. Widerspruchsfrist: 2 Monate."
    },
    {
      "date": "2024-10-21",
      "id": "91070",
      "original_text": "Registerbekanntmachung nach dem Umwandlungsgesetz\nHamburg Amtsgericht Hamburg HRB 178259\nMVIA MidCo 1 GmbH – Hamburg",
      "type": "Registerbekanntmachung nach dem Umwandlungsgesetz",
      "state": "Hamburg",
      "amtsgericht": "Amtsgericht Hamburg",
      "registernummer": "HRB 178259",
      "registerart": "HRB",
      "company_name": "MVIA MidCo 1 GmbH",
      "company_seat": "Hamburg",
      "details": "21.10.2024 (Bekanntmachungsdatum)\n\nHamburg Amtsgericht Hamburg HRB 178259\nRegisterbekanntmachung nach dem Umwandlungsgesetz\n\nMVIA MidCo 1 GmbH\nGesellschaft mit beschränkter Haftung\nHamburg\n\nAls nicht eingetragen wird bekanntgemacht:\nEs wird darauf hingewiesen, dass gem. § 308 UmwG ein Verschmelzungsplan oder sein Entwurf über eine grenzüberschreitende Verschmelzung zur Aufnahme mit der Senior Living Holding S.à r.l. mit Sitz in Luxemburg/Großherzogtum Luxemburg (Registre de commerce et des sociétés B217466) (Société à responsabilité limitée - Gesellschaft mit beschränkter Haftung nach luxemburgischem Recht) beim Handelsregister eingereicht worden ist.\nDie Anteilsinhaber, die Gläubiger sowie die zuständigen Betriebsräte der an der grenzüberschreitenden Verschmelzung beteiligten Gesellschaften oder, soweit es keinen Betriebsrat gibt, die Arbeitnehmer der an der grenzüberschreitenden Verschmelzung beteiligten Gesellschaften, können der jeweiligen Gesellschaft spätestens fünf Arbeitstage vor dem Tag der Gesellschafterversammlung Bemerkungen zum Verschmelzungsplan übermitteln."
    },
    {
      "date": "2024-10-21",
      "id": "91071",
      "original_text": "Registerbekanntmachung nach dem Umwandlungsgesetz\nBaden-Württemberg Amtsgericht Mannheim HRB 751162\nGiebel + Ebeling GmbH – Leimen",
      "type": "Registerbekanntmachung nach dem Umwandlungsgesetz",
      "state": "Baden-Württemberg",
      "amtsgericht": "Amtsgericht Mannheim",
      "registernummer": "HRB 751162",
      "registerart": "HRB",
      "company_name": "Giebel + Ebeling GmbH",
      "company_seat": "Leimen",
      "details": "21.10.2024 (Bekanntmachungsdatum)\n\nBaden-Württemberg Amtsgericht Mannheim HRB 751162\nRegisterbekanntmachung nach dem Umwandlungsgesetz 21.10.2024 (Eintragungsdatum)\n\nGiebel + Ebeling GmbH\nGesellschaft mit beschränkter Haftung\nLeimen\n\nDen Gläubigern der an der Verschmelzung beteiligten Rechtsträger ist, wenn sie binnen sechs Monaten nach dem Tag, an dem die Eintragung der Verschmelzung in das Register des Sitzes desjenigen Rechtsträgers, dessen Gläubiger sie sind, nach § 19 Abs. 3 UmwG als bekanntgemacht gilt, ihren Anspruch nach Grund und Höhe schriftlich anmelden, Sicherheit zu leisten, soweit sie nicht Befriedigung verlangen können. Dieses Recht steht den Gläubigern jedoch nur zu, wenn sie glaubhaft machen, dass durch die Verschmelzung die Erfüllung ihrer Forderung gefährdet wird."
    },
    {
      "date": "2024-10-21",
      "id": "91072",
      "original_text": "Registerbekanntmachung nach dem Umwandlungsgesetz\nBaden-Württemberg Amtsgericht Mannheim HRA 333350\nGiebel OHG – Leimen",
      "type": "Registerbekanntmachung nach dem Umwandlungsgesetz",
      "state": "Baden-Württemberg",
      "amtsgericht": "Amtsgericht Mannheim",
      "registernummer": "HRA 333350",
      "registerart": "HRA",
      "company_name": "Giebel OHG",
      "company_seat": "Leimen",
      "details": "21.10.2024 (Bekanntmachungsdatum)\n\nBaden-Württemberg Amtsgericht Mannheim HRA 333350\nRegisterbekanntmachung nach dem Umwandlungsgesetz 21.10.2024 (Eintragungsdatum)\n\nGiebel OHG\nOffene Handelsgesellschaft\nLeimen\n\nDen Gläubigern der an der Verschmelzung beteiligten Rechtsträger ist, wenn sie binnen sechs Monaten nach dem Tag, an dem die Eintragung der Verschmelzung in das Register des Sitzes desjenigen Rechtsträgers, dessen Gläubiger sie sind, nach § 19 Abs. 3 UmwG als bekanntgemacht gilt, ihren Anspruch nach Grund und Höhe schriftlich anmelden, Sicherheit zu leisten, soweit sie nicht Befriedigung verlangen können. Dieses Recht steht den Gläubigern jedoch nur zu, wenn sie glaubhaft machen, dass durch die Verschmelzung die Erfüllung ihrer Forderung gefährdet wird."
    },
    {
      "date": "2024-10-21",
      "id": "91073",
      "original_text": "Sonstige Registerbekanntmachung\nBaden-Württemberg Amtsgericht Ulm HRB 641626\nKässbohrer Geländefahrzeug Aktiengesellschaft – Laupheim",
      "type": "Sonstige Registerbekanntmachung",
      "state": "Baden-Württemberg",
      "amtsgericht": "Amtsgericht Ulm",
      "registernummer": "HRB 641626",
      "registerart": "HRB",
      "company_name": "Kässbohrer Geländefahrzeug Aktiengesellschaft",
      "company_seat": "Laupheim",
      "details": "21.10.2024 (Bekanntmachungsdatum)\n\nBaden-Württemberg Amtsgericht Ulm HRB 641626\nSonstige Registerbekanntmachung 21.10.2024 (Eintragungsdatum)\n\nKässbohrer Geländefahrzeug Aktiengesellschaft\nAktiengesellschaft\nLaupheim\n\nAls nicht eingetragen wird bekanntgemacht:\nDen Gläubigern der Gesellschaft, deren Forderungen begründet worden sind, bevor die Eintragung der Beendigung des Vertrages in das Handelsregister nach § 10 HGB als bekanntgemacht gilt, ist vom anderen Vertragsteil Sicherheit zu leisten, wenn sie sich binnen sechs Monaten nach der Bekanntmachung zu diesem Zweck bei ihm melden."
    },
    {
      "date": "2024-10-21",
      "id": "91074",
      "original_text": "Löschungsankündigung\nBrandenburg Amtsgericht Frankfurt/Oder VR 5728\nVerein für selbstbestimmtes Wohnen und Arbeiten im Alter e. V. (VSWA) – Fürstenwalde/Spree",
      "type": "Löschungsankündigung",
      "state": "Brandenburg",
      "amtsgericht": "Amtsgericht Frankfurt/Oder",
      "registernummer": "VR 5728",
      "registerart": "VR",
      "company_name": "Verein für selbstbestimmtes Wohnen und Arbeiten im Alter e. V. (VSWA)",
      "company_seat": "Fürstenwalde/Spree",
      "details": "21.10.2024 (Bekanntmachungsdatum)\n\nBrandenburg Amtsgericht Frankfurt/Oder VR 5728\nLöschungsankündigung\n\nVerein für selbstbestimmtes Wohnen und Arbeiten im Alter e. V. (VSWA)\neingetragener Verein\nFürstenwalde/Spree\n\nIm Vereinsregister des Amtsgerichts Frankfurt (Oder) sind unter dem Aktenzeichen VR 5728 FF des Vereins \"Verein für selbstbestimmtes Wohnen und Arbeiten im Alter e.V. (VSWA)\" Dr. Alfred Orlowski, Birgit Schröder und Petra Funke als vertretungsberechtigte Vorstandsmitglieder eingetragen. Es ist beabsichtigt diese genannten Vorstandsmitglieder von Amts wegen gemäß § 395 FamFG im Vereinsregister zu löschen, da diese ihr Vorstandsamt bereits niedergelegt haben und eine notarielle Anmeldung durch die übrigen vertretungsberechtigten Vorstandsmitglieder nicht beigebracht wurde. Sofern hiergegen Widerspruch erhoben werden soll bzw. dem entgegenstehende Tatsachen bekannt sind, wird zur Einreichung einer diesbezüglichen Mitteilung eine Frist von 4 Wochen gewährt"
    },
    {
      "date": "2024-10-21",
      "id": "91075",
      "original_text": "Registerbekanntmachung nach dem Umwandlungsgesetz\nSchleswig-Holstein Amtsgericht Kiel HRB 27141\nJactus Beteiligungs GmbH – Norderstedt",
      "type": "Registerbekanntmachung nach dem Umwandlungsgesetz",
      "state": "Schleswig-Holstein",
      "amtsgericht": "Amtsgericht Kiel",
      "registernummer": "HRB 27141",
      "registerart": "HRB",
      "company_name": "Jactus Beteiligungs GmbH",
      "company_seat": "Norderstedt",
      "details": "21.10.2024 (Bekanntmachungsdatum)\n\nSchleswig-Holstein Amtsgericht Kiel HRB 27141\nRegisterbekanntmachung nach dem Umwandlungsgesetz 17.10.2024 (Eintragungsdatum)\n\nJactus Beteiligungs GmbH\nGesellschaft mit beschränkter Haftung\nNorderstedt\n\nZu Eintragungsnummer 3 vom 17.10.2024 wird als nicht eingetragen veröffentlicht: Den Gläubigern der an der Verschmelzung beteiligten Rechtsträger ist, wenn sie binnen sechs Monaten nach dem Tag, an dem die Eintragung der Verschmelzung in das Register des Sitzes desjenigen Rechtsträgers, dessen Gläubiger sie sind, nach § 19 Abs. 3 UmwG bekannt gemacht worden ist, ihren Anspruch nach Grund und Höhe schriftlich anmelden, Sicherheit zu leisten, soweit sie nicht Befriedigung verlangen können. Dieses Recht steht den Gläubigern jedoch nur zu, wenn sie glaubhaft machen, dass durch die Verschmelzung die Erfüllung ihrer Forderung gefährdet wird."
    },
    {
      "date": "2024-10-21",
      "id": "91076",
      "original_text": "Registerbekanntmachung nach dem Umwandlungsgesetz\nBerlin Amtsgericht Berlin (Charlottenburg) HRB 163159\nNetzpiloten Magazin GmbH – Berlin",
      "type": "Registerbekanntmachung nach dem Umwandlungsgesetz",
      "state": "Berlin",
      "amtsgericht": "Amtsgericht Berlin (Charlottenburg)",
      "registernummer": "HRB 163159",
      "registerart": "HRB",
      "company_name": "Netzpiloten Magazin GmbH",
      "company_seat": "Berlin",
      "details": "21.10.2024 (Bekanntmachungsdatum)\n\nBerlin Amtsgericht Berlin (Charlottenburg) HRB 163159\nRegisterbekanntmachung nach dem Umwandlungsgesetz 18.10.2024 (Eintragungsdatum)\n\nNetzpiloten Magazin GmbH\nGesellschaft mit beschränkter Haftung\nBerlin\n\nZu Eintragungsnummer 3 vom 18.10.2024 wird als nicht eingetragen veröffentlicht: Den Gläubigern der an der Verschmelzung beteiligten Rechtsträger ist, wenn sie binnen sechs Monaten nach dem Tag, an dem die Eintragung der Verschmelzung in das Register des Sitzes desjenigen Rechtsträgers, dessen Gläubiger sie sind, als bekannt gemacht gilt, ihren Anspruch nach Grund und Höhe schriftlich anmelden, Sicherheit zu leisten, soweit sie nicht Befriedigung verlangen können. Dieses Recht steht den Gläubigern jedoch nur zu, wenn sie glaubhaft machen, dass durch die Verschmelzung die Erfüllung ihrer Forderung gefährdet wird. Das Recht, Sicherheitsleistung zu verlangen, steht Gläubigern nicht zu, die im Falle der Insolvenz ein Recht auf vorzugsweise Befriedigung aus einer Deckungsmasse haben, die nach gesetzlicher Vorschrift zu ihrem Schutz errichtet und staatlich überwacht ist."
    },
    {
      "date": "2024-10-21",
      "id": "91077",
      "original_text": "Registerbekanntmachung nach dem Umwandlungsgesetz\nBaden-Württemberg Amtsgericht Ulm HRA 729193\nImmobilienhaus Weissenberger e. K – Steinheim am Albuch",
      "type": "Registerbekanntmachung nach dem Umwandlungsgesetz",
      "state": "Baden-Württemberg",
      "amtsgericht": "Amtsgericht Ulm",
      "registernummer": "HRA 729193",
      "registerart": "HRA",
      "company_name": "Immobilienhaus Weissenberger e. K",
      "company_seat": "Steinheim am Albuch",
      "details": "21.10.2024 (Bekanntmachungsdatum)\n\nBaden-Württemberg Amtsgericht Ulm HRA 729193\nRegisterbekanntmachung nach dem Umwandlungsgesetz 21.10.2024 (Eintragungsdatum)\n\nImmobilienhaus Weissenberger e. K\nEinzelkaufmann / Einzelkauffrau\nSteinheim am Albuch\n\nAls nicht eingetragen wird bekanntgemacht:\nDen Gläubigern der an der Ausgliederung beteiligten Rechtsträger ist, wenn sie binnen sechs Monaten nach dem Tag, an dem die Eintragung der Ausgliederung in das Register des Sitzes desjenigen Rechtsträgers, dessen Gläubiger sie sind, nach § 19 Abs. 3 UmwG als bekanntgemacht gilt, ihren Anspruch nach Grund und Höhe schriftlich anmelden, Sicherheit zu leisten, soweit sie nicht Befriedigung verlangen können. Dieses Recht steht den Gläubigern jedoch nur zu, wenn sie glaubhaft machen, dass durch die Ausgliederung die Erfüllung ihrer Forderung gefährdet wird."
    },
    {
      "date": "2024-10-21",
      "id": "91078",
      "original_text": "Registerbekanntmachung nach dem Umwandlungsgesetz\nBaden-Württemberg Amtsgericht Ulm HRB 748337\nWeissenberger Immobilien GmbH – Steinheim am Albuch",
      "type": "Registerbekanntmachung nach dem Umwandlungsgesetz",
      "state": "Baden-Württemberg",
      "amtsgericht": "Amtsgericht Ulm",
      "registernummer": "HRB 748337",
      "registerart": "HRB",
      "company_name": "Weissenberger Immobilien GmbH",
      "company_seat": "Steinheim am Albuch",
      "details": "21.10.2024 (Bekanntmachungsdatum)\n\nBaden-Württemberg Amtsgericht Ulm HRB 748337\nRegisterbekanntmachung nach dem Umwandlungsgesetz 21.10.2024 (Eintragungsdatum)\n\nWeissenberger Immobilien GmbH\nGesellschaft mit beschränkter Haftung\nSteinheim am Albuch\n\nAls nicht eingetragen wird bekanntgemacht:\nDen Gläubigern der an der Ausgliederung beteiligten Rechtsträger ist, wenn sie binnen sechs Monaten nach dem Tag, an dem die Eintragung der Ausgliederung in das Register des Sitzes desjenigen Rechtsträgers, dessen Gläubiger sie sind, nach § 19 Abs. 3 UmwG als bekanntgemacht gilt, ihren Anspruch nach Grund und Höhe schriftlich anmelden, Sicherheit zu leisten, soweit sie nicht Befriedigung verlangen können. Dieses Recht steht den Gläubigern jedoch nur zu, wenn sie glaubhaft machen, dass durch die Ausgliederung die Erfüllung ihrer Forderung gefährdet wird."
    },
    {
      "date": "2024-10-21",
      "id": "91079",
      "original_text": "Registerbekanntmachung nach dem Umwandlungsgesetz\nBaden-Württemberg Amtsgericht Mannheim PR 700656\nRadiologische Facharztpraxis Dr. med. Joachim Techert Facharzt für Diagnostische Radiologie Dr. med. Thomas Paul Facharzt für Diagnostische Radiologie und Nuklearmedizin Partnerschaft von Ärzten – Pforzheim",
      "type": "Registerbekanntmachung nach dem Umwandlungsgesetz",
      "state": "Baden-Württemberg",
      "amtsgericht": "Amtsgericht Mannheim",
      "registernummer": "PR 700656",
      "registerart": "PR",
      "company_name": "Radiologische Facharztpraxis Dr. med. Joachim Techert Facharzt für Diagnostische Radiologie Dr. med. Thomas Paul Facharzt für Diagnostische Radiologie und Nuklearmedizin Partnerschaft von Ärzten",
      "company_seat": "Pforzheim",
      "details": "21.10.2024 (Bekanntmachungsdatum)\n\nBaden-Württemberg Amtsgericht Mannheim PR 700656\nRegisterbekanntmachung nach dem Umwandlungsgesetz 21.10.2024 (Eintragungsdatum)\n\nRadiologische Facharztpraxis Dr. med. Joachim Techert Facharzt für Diagnostische Radiologie Dr. med. Thomas Paul Facharzt für Diagnostische Radiologie und Nuklearmedizin Partnerschaft von Ärzten\nPartnerschaftsgesellschaft\nPforzheim\n\nDen Gläubigern der an der Verschmelzung beteiligten Rechtsträger ist, wenn sie binnen sechs Monaten nach dem Tag, an dem die Eintragung der Verschmelzung in das Register des Sitzes desjenigen Rechtsträgers, dessen Gläubiger sie sind, nach § 19 Abs. 3 UmwG als bekanntgemacht gilt, ihren Anspruch nach Grund und Höhe schriftlich anmelden, Sicherheit zu leisten, soweit sie nicht Befriedigung verlangen können. Dieses Recht steht den Gläubigern jedoch nur zu, wenn sie glaubhaft machen, dass durch die Verschmelzung die Erfüllung ihrer Forderung gefährdet wird."
    },
    {
      "date": "2024-10-21",
      "id": "91080",
      "original_text": "Registerbekanntmachung nach dem Umwandlungsgesetz\nHamburg Amtsgericht Hamburg HRB 154000\nENERPARC Solar Invest 155 GmbH – Hamburg",
      "type": "Registerbekanntmachung nach dem Umwandlungsgesetz",
      "state": "Hamburg",
      "amtsgericht": "Amtsgericht Hamburg",
      "registernummer": "HRB 154000",
      "registerart": "HRB",
      "company_name": "ENERPARC Solar Invest 155 GmbH",
      "company_seat": "Hamburg",
      "details": "21.10.2024 (Bekanntmachungsdatum)\n\nHamburg Amtsgericht Hamburg HRB 154000\nRegisterbekanntmachung nach dem Umwandlungsgesetz 21.10.2024 (Eintragungsdatum)\n\nENERPARC Solar Invest 155 GmbH\nGesellschaft mit beschränkter Haftung\nHamburg\n\nAls nicht eingetragen wird bekannt gemacht:\nDen Gläubigern der an der Verschmelzung beteiligten Gesellschaften ist, wenn sie binnen sechs Monaten nach dem Tag, an dem die Eintragung der Verschmelzung in das Register des Sitzes desjenigen Rechtsträgers, dessen Gläubiger sie sind, nach § 19 Absatz 3 UmwG als bekannt gemacht gilt, ihren Anspruch nach Grund und Höhe schriftlich anmelden, Sicherheit zu leisten, soweit sie nicht Befriedigung verlangen können. Dieses Recht steht den Gläubigern jedoch nur zu, wenn sie glaubhaft machen, dass durch die Verschmelzung die Erfüllung ihrer Forderung gefährdet wird."
    },
    {
      "date": "2024-10-21",
      "id": "91081",
      "original_text": "Registerbekanntmachung nach dem Umwandlungsgesetz\nHamburg Amtsgericht Hamburg HRB 189068\nSolarpark Brahlstorf GmbH – Hamburg",
      "type": "Registerbekanntmachung nach dem Umwandlungsgesetz",
      "state": "Hamburg",
      "amtsgericht": "Amtsgericht Hamburg",
      "registernummer": "HRB 189068",
      "registerart": "HRB",
      "company_name": "Solarpark Brahlstorf GmbH",
      "company_seat": "Hamburg",
      "details": "21.10.2024 (Bekanntmachungsdatum)\n\nHamburg Amtsgericht Hamburg HRB 189068\nRegisterbekanntmachung nach dem Umwandlungsgesetz 21.10.2024 (Eintragungsdatum)\n\nSolarpark Brahlstorf GmbH\nGesellschaft mit beschränkter Haftung\nHamburg\n\nAls nicht eingetragen wird bekannt gemacht:\nDen Gläubigern der an der Verschmelzung beteiligten Gesellschaften ist, wenn sie binnen sechs Monaten nach dem Tag, an dem die Eintragung der Verschmelzung in das Register des Sitzes desjenigen Rechtsträgers, dessen Gläubiger sie sind, nach § 19 Absatz 3 UmwG als bekannt gemacht gilt, ihren Anspruch nach Grund und Höhe schriftlich anmelden, Sicherheit zu leisten, soweit sie nicht Befriedigung verlangen können. Dieses Recht steht den Gläubigern jedoch nur zu, wenn sie glaubhaft machen, dass durch die Verschmelzung die Erfüllung ihrer Forderung gefährdet wird."
    },
    {
      "date": "2024-10-21",
      "id": "91082",
      "original_text": "Registerbekanntmachung nach dem Umwandlungsgesetz\nBaden-Württemberg Amtsgericht Mannheim HRB 744762\nMVZ Radiologisches Centrum Pforzheim GmbH – Pforzheim",
      "type": "Registerbekanntmachung nach dem Umwandlungsgesetz",
      "state": "Baden-Württemberg",
      "amtsgericht": "Amtsgericht Mannheim",
      "registernummer": "HRB 744762",
      "registerart": "HRB",
      "company_name": "MVZ Radiologisches Centrum Pforzheim GmbH",
      "company_seat": "Pforzheim",
      "details": "21.10.2024 (Bekanntmachungsdatum)\n\nBaden-Württemberg Amtsgericht Mannheim HRB 744762\nRegisterbekanntmachung nach dem Umwandlungsgesetz 21.10.2024 (Eintragungsdatum)\n\nMVZ Radiologisches Centrum Pforzheim GmbH\nGesellschaft mit beschränkter Haftung\nPforzheim\n\nDen Gläubigern der an der Verschmelzung beteiligten Rechtsträger ist, wenn sie binnen sechs Monaten nach dem Tag, an dem die Eintragung der Verschmelzung in das Register des Sitzes desjenigen Rechtsträgers, dessen Gläubiger sie sind, nach § 19 Abs. 3 UmwG als bekanntgemacht gilt, ihren Anspruch nach Grund und Höhe schriftlich anmelden, Sicherheit zu leisten, soweit sie nicht Befriedigung verlangen können. Dieses Recht steht den Gläubigern jedoch nur zu, wenn sie glaubhaft machen, dass durch die Verschmelzung die Erfüllung ihrer Forderung gefährdet wird."
    },
    {
      "date": "2024-10-21",
      "id": "91083",
      "original_text": "Registerbekanntmachung nach dem Umwandlungsgesetz\nHamburg Amtsgericht Hamburg HRA 118010\nServiceplan Design Hamburg GmbH & Co. KG – Hamburg",
      "type": "Registerbekanntmachung nach dem Umwandlungsgesetz",
      "state": "Hamburg",
      "amtsgericht": "Amtsgericht Hamburg",
      "registernummer": "HRA 118010",
      "registerart": "HRA",
      "company_name": "Serviceplan Design Hamburg GmbH & Co. KG",
      "company_seat": "Hamburg",
      "details": "21.10.2024 (Bekanntmachungsdatum)\n\nHamburg Amtsgericht Hamburg HRA 118010\nRegisterbekanntmachung nach dem Umwandlungsgesetz 21.10.2024 (Eintragungsdatum)\n\nServiceplan Design Hamburg GmbH & Co. KG\nKommanditgesellschaft\nHamburg\n\nAls nicht eingetragen wird bekannt gemacht:\nDen Gläubigern der an der Verschmelzung beteiligten Gesellschaften ist, wenn sie binnen sechs Monaten nach dem Tag, an dem die Eintragung der Verschmelzung in das Register des Sitzes desjenigen Rechtsträgers, dessen Gläubiger sie sind, nach § 19 Absatz 3 UmwG als bekannt gemacht gilt, ihren Anspruch nach Grund und Höhe schriftlich anmelden, Sicherheit zu leisten, soweit sie nicht Befriedigung verlangen können. Dieses Recht steht den Gläubigern jedoch nur zu, wenn sie glaubhaft machen, dass durch die Verschmelzung die Erfüllung ihrer Forderung gefährdet wird."
    },
    {
      "date": "2024-10-21",
      "id": "91084",
      "original_text": "Registerbekanntmachung nach dem Umwandlungsgesetz\nHamburg Amtsgericht Hamburg HRA 104135\nServiceplan Hamburg GmbH & Co. KG – Hamburg",
      "type": "Registerbekanntmachung nach dem Umwandlungsgesetz",
      "state": "Hamburg",
      "amtsgericht": "Amtsgericht Hamburg",
      "registernummer": "HRA 104135",
      "registerart": "HRA",
      "company_name": "Serviceplan Hamburg GmbH & Co. KG",
      "company_seat": "Hamburg",
      "details": "21.10.2024 (Bekanntmachungsdatum)\n\nHamburg Amtsgericht Hamburg HRA 104135\nRegisterbekanntmachung nach dem Umwandlungsgesetz 21.10.2024 (Eintragungsdatum)\n\nServiceplan Hamburg GmbH & Co. KG\nKommanditgesellschaft\nHamburg\n\nAls nicht eingetragen wird bekannt gemacht:\nDen Gläubigern der an der Verschmelzung beteiligten Gesellschaften ist, wenn sie binnen sechs Monaten nach dem Tag, an dem die Eintragung der Verschmelzung in das Register des Sitzes desjenigen Rechtsträgers, dessen Gläubiger sie sind, nach § 19 Absatz 3 UmwG als bekannt gemacht gilt, ihren Anspruch nach Grund und Höhe schriftlich anmelden, Sicherheit zu leisten, soweit sie nicht Befriedigung verlangen können. Dieses Recht steht den Gläubigern jedoch nur zu, wenn sie glaubhaft machen, dass durch die Verschmelzung die Erfüllung ihrer Forderung gefährdet wird."
    },
    {
      "date": "2024-10-21",
      "id": "91085",
      "original_text": "Registerbekanntmachung nach dem Umwandlungsgesetz\nSaarland Amtsgericht Saarbrücken HRB 110177\nSektor Heimat Kulturkollektiv UG (haftungsbeschränkt) – Saarbrücken",
      "type": "Registerbekanntmachung nach dem Umwandlungsgesetz",
      "state": "Saarland",
      "amtsgericht": "Amtsgericht Saarbrücken",
      "registernummer": "HRB 110177",
      "registerart": "HRB",
      "company_name": "Sektor Heimat Kulturkollektiv UG (haftungsbeschränkt)",
      "company_seat": "Saarbrücken",
      "details": "21.10.2024 (Bekanntmachungsdatum)\n\nSaarland Amtsgericht Saarbrücken HRB 110177\nRegisterbekanntmachung nach dem Umwandlungsgesetz 21.10.2024 (Eintragungsdatum)\n\nSektor Heimat Kulturkollektiv UG (haftungsbeschränkt)\nGesellschaft mit beschränkter Haftung\nSaarbrücken\n\nAls nicht eingetragen wird bekannt gemacht: Den Gläubigern der an der Ausgliederung beteiligten Rechtsträgern ist, wenn sie binnen sechs Monaten nach dem Tag, an dem die Eintragung der Ausgliederung in das Register des Sitzes desjenigen Rechtsträgers, dessen Gläubiger sie sind, nach § 19 Absatz 3 UmwG bekannt gemacht worden ist, ihren Anspruch nach Grund und Höhe schriftlich anmelden, Sicherheit zu leisten, soweit sie nicht Befriedigung verlangen können. Dieses Recht steht den Gläubigern jedoch nur zu, wenn sie glaubhaft machen, dass durch die Ausgliederung die Erfüllung ihrer Forderung gefährdet wird."
    },
    {
      "date": "2024-10-21",
      "id": "91086",
      "original_text": "Registerbekanntmachung nach dem Umwandlungsgesetz\nSaarland Amtsgericht Saarbrücken VR 5559\nSEKTOR HEIMAT-Institut für urbane Gestaltung e.V. – Saarbrücken",
      "type": "Registerbekanntmachung nach dem Umwandlungsgesetz",
      "state": "Saarland",
      "amtsgericht": "Amtsgericht Saarbrücken",
      "registernummer": "VR 5559",
      "registerart": "VR",
      "company_name": "SEKTOR HEIMAT-Institut für urbane Gestaltung e.V.",
      "company_seat": "Saarbrücken",
      "details": "21.10.2024 (Bekanntmachungsdatum)\n\nSaarland Amtsgericht Saarbrücken VR 5559\nRegisterbekanntmachung nach dem Umwandlungsgesetz 21.10.2024 (Eintragungsdatum)\n\nSEKTOR HEIMAT-Institut für urbane Gestaltung e.V.\neingetragener Verein\nSaarbrücken\n\nAls nicht eingetragen wird bekannt gemacht: Den Gläubigern der an der Ausgliederung beteiligten Rechtsträgern ist, wenn sie binnen sechs Monaten nach dem Tag, an dem die Eintragung der Ausgliederung in das Register des Sitzes desjenigen Rechtsträgers, dessen Gläubiger sie sind, nach § 19 Absatz 3 UmwG bekannt gemacht worden ist, ihren Anspruch nach Grund und Höhe schriftlich anmelden, Sicherheit zu leisten, soweit sie nicht Befriedigung verlangen können. Dieses Recht steht den Gläubigern jedoch nur zu, wenn sie glaubhaft machen, dass durch die Ausgliederung die Erfüllung ihrer Forderung gefährdet wird."
    },
    {
      "date": "2024-10-21",
      "id": "91087",
      "original_text": "Löschungsankündigung\nSchleswig-Holstein Amtsgericht Lübeck HRB 1167\nGauger. Metallbau G.m.b.H. – Lübeck",
      "type": "Löschungsankündigung",
      "state": "Schleswig-Holstein",
      "amtsgericht": "Amtsgericht Lübeck",
      "registernummer": "HRB 1167",
      "registerart": "HRB",
      "company_name": "Gauger. Metallbau G.m.b.H.",
      "company_seat": "Lübeck",
      "details": "21.10.2024 (Bekanntmachungsdatum)\n\nSchleswig-Holstein Amtsgericht Lübeck HRB 1167\nLöschungsankündigung\n\nGauger. Metallbau G.m.b.H.\nGesellschaft mit beschränkter Haftung\nLübeck\n\nIn der Handelsregistersache der\n\nGauger. Metallbau G.m.b.H.\n\nist nach dem hier vorliegenden Beschluss des Insolvenzgerichts Lübeck vom 27.05.2024 das Insolvenzverfahren über das Vermögen der Gesellschaft beendet. Dies legt die Annahme nahe, dass die Gesellschaft über kein verwertbares Vermögen mehr verfügt.\nDas Gericht beabsichtigt daher, die Gesellschaft wegen Vermögenslosigkeit gemäß § 394 FamFG von Amts wegen zu löschen\n\nHiermit wird gemäß § 394 Abs. 2 FamFG Gelegenheit gegeben, binnen eines Monats gegen dieses Vorhaben Widerspruch einzulegen. Der Widerspruch kann schriftlich oder zu Protokoll der Geschäftsstelle erhoben werden.\n\nNach Fristablauf ohne Widerspruch wird die Gesellschaft gelöscht.\n\nGärtner\nDipl.-Rechtspflegerin (FH)"
    },
    {
      "date": "2024-10-21",
      "id": "91088",
      "original_text": "Sonstige Registerbekanntmachung\nBrandenburg Amtsgericht Frankfurt/Oder HRB 14344\nTeGeCe Infrastruktur und Logistik GmbH – Frankfurt (Oder)",
      "type": "Sonstige Registerbekanntmachung",
      "state": "Brandenburg",
      "amtsgericht": "Amtsgericht Frankfurt/Oder",
      "registernummer": "HRB 14344",
      "registerart": "HRB",
      "company_name": "TeGeCe Infrastruktur und Logistik GmbH",
      "company_seat": "Frankfurt (Oder)",
      "details": "21.10.2024 (Bekanntmachungsdatum)\n\nBrandenburg Amtsgericht Frankfurt/Oder HRB 14344\nSonstige Registerbekanntmachung\n\nTeGeCe Infrastruktur und Logistik GmbH\nGesellschaft mit beschränkter Haftung\nFrankfurt (Oder)\n\nAls nicht eingetragen wird veröffentlicht: Die Gesellschaft hat Änderungen im Aufsichtsrat angezeigt."
    },
    {
      "date": "2024-10-21",
      "id": "91089",
      "original_text": "Sonstige Registerbekanntmachung\nSachsen Amtsgericht Leipzig HRB 9594\nWurzener Gebäude- und Wohnungsgesellschaft mbH – Wurzen",
      "type": "Sonstige Registerbekanntmachung",
      "state": "Sachsen",
      "amtsgericht": "Amtsgericht Leipzig",
      "registernummer": "HRB 9594",
      "registerart": "HRB",
      "company_name": "Wurzener Gebäude- und Wohnungsgesellschaft mbH",
      "company_seat": "Wurzen",
      "details": "21.10.2024 (Bekanntmachungsdatum)\n\nSachsen Amtsgericht Leipzig HRB 9594\nSonstige Registerbekanntmachung\n\nWurzener Gebäude- und Wohnungsgesellschaft mbH\nGesellschaft mit beschränkter Haftung\nWurzen\n\nAm 17.10.2024 wurde beim Handelsregister des Amtsgerichts Leipzig die Liste der Mitglieder des Aufsichtsrats gemäß § 52 GmbHG eingereicht."
    },
    {
      "date": "2024-10-21",
      "id": "91090",
      "original_text": "Einreichung neuer Dokumente\nSachsen Amtsgericht Dresden HRB 17185\nLausitzbad Hoyerswerda GmbH – Hoyerswerda",
      "type": "Einreichung neuer Dokumente",
      "state": "Sachsen",
      "amtsgericht": "Amtsgericht Dresden",
      "registernummer": "HRB 17185",
      "registerart": "HRB",
      "company_name": "Lausitzbad Hoyerswerda GmbH",
      "company_seat": "Hoyerswerda",
      "details": "21.10.2024 (Bekanntmachungsdatum)\n\nSachsen Amtsgericht Dresden HRB 17185\nEinreichung neuer Dokumente\n\nLausitzbad Hoyerswerda GmbH\nGesellschaft mit beschränkter Haftung\nHoyerswerda\n\nAm 17.10.2024 wurde beim Handelsregister des Amtsgerichts Dresden die Liste der Mitglieder des Aufsichtsrats gemäß § 52 GmbHG eingereicht."
    },
    {
      "date": "2024-10-21",
      "id": "91091",
      "original_text": "Sonstige Registerbekanntmachung\nSachsen Amtsgericht Leipzig HRB 8198\nBBK Bad Lausicker Bauorganisations-, Betriebs- und Kur GmbH – Bad Lausick",
      "type": "Sonstige Registerbekanntmachung",
      "state": "Sachsen",
      "amtsgericht": "Amtsgericht Leipzig",
      "registernummer": "HRB 8198",
      "registerart": "HRB",
      "company_name": "BBK Bad Lausicker Bauorganisations-, Betriebs- und Kur GmbH",
      "company_seat": "Bad Lausick",
      "details": "21.10.2024 (Bekanntmachungsdatum)\n\nSachsen Amtsgericht Leipzig HRB 8198\nSonstige Registerbekanntmachung\n\nBBK Bad Lausicker Bauorganisations-, Betriebs- und Kur GmbH\nGesellschaft mit beschränkter Haftung\nBad Lausick\n\nAm 17.10.2024 wurde beim Handelsregister des Amtsgerichts Leipzig die Liste der Mitglieder des Aufsichtsrats gemäß § 52 GmbHG eingereicht."
    },
    {
      "date": "2024-10-21",
      "id": "91092",
      "original_text": "Löschungsankündigung\nSachsen Amtsgericht Chemnitz HRB 30077\nB & B Back und Brau Feste GmbH – Chemnitz",
      "type": "Löschungsankündigung",
      "state": "Sachsen",
      "amtsgericht": "Amtsgericht Chemnitz",
      "registernummer": "HRB 30077",
      "registerart": "HRB",
      "company_name": "B & B Back und Brau Feste GmbH",
      "company_seat": "Chemnitz",
      "details": "21.10.2024 (Bekanntmachungsdatum)\n\nSachsen Amtsgericht Chemnitz HRB 30077\nLöschungsankündigung\n\nB & B Back und Brau Feste GmbH\nGesellschaft mit beschränkter Haftung\nChemnitz\n\nDas Registergericht beabsichtigt, die im Handelsregister eingetragene Gesellschaft von Amts wegen nach § 394 FamFG zu löschen. Die Frist zu Erhebung eines Widerspruchs gegen die beabsichtigte Löschung wird auf einen Monat festgesetzt."
    },
    {
      "date": "2024-10-21",
      "id": "91093",
      "original_text": "Löschungsankündigung\nSachsen Amtsgericht Chemnitz HRB 15635\nZentralheizungs- und Lüftungsbau Rehfeld GmbH – Zwickau",
      "type": "Löschungsankündigung",
      "state": "Sachsen",
      "amtsgericht": "Amtsgericht Chemnitz",
      "registernummer": "HRB 15635",
      "registerart": "HRB",
      "company_name": "Zentralheizungs- und Lüftungsbau Rehfeld GmbH",
      "company_seat": "Zwickau",
      "details": "21.10.2024 (Bekanntmachungsdatum)\n\nSachsen Amtsgericht Chemnitz HRB 15635\nLöschungsankündigung\n\nZentralheizungs- und Lüftungsbau Rehfeld GmbH\nGesellschaft mit beschränkter Haftung\nZwickau\n\nDas Registergericht beabsichtigt, die im Handelsregister eingetragene Gesellschaft von Amts wegen nach § 394 FamFG zu löschen. Die Frist zu Erhebung eines Widerspruchs gegen die beabsichtigte Löschung wird auf einen Monat festgesetzt."
    },
    {
      "date": "2024-10-21",
      "id": "91094",
      "original_text": "Registerbekanntmachung nach dem Umwandlungsgesetz\nNiedersachsen Amtsgericht Osnabrück GsR 567\nN&P Elektrotechnik eGbR – Lingen (Ems)",
      "type": "Registerbekanntmachung nach dem Umwandlungsgesetz",
      "state": "Niedersachsen",
      "amtsgericht": "Amtsgericht Osnabrück",
      "registernummer": "GsR 567",
      "registerart": "GsR",
      "company_name": "N&P Elektrotechnik eGbR",
      "company_seat": "Lingen (Ems)",
      "details": "21.10.2024 (Bekanntmachungsdatum)\n\nNiedersachsen Amtsgericht Osnabrück GsR 567\nRegisterbekanntmachung nach dem Umwandlungsgesetz 21.10.2024 (Eintragungsdatum)\n\nN&P Elektrotechnik eGbR\nGesellschaft bürgerlichen Rechts\nLingen (Ems)\n\nDen Gläubigern der an der Ausgliederung beteiligten Rechtsträger ist, wenn sie binnen sechs Monaten nach dem Tag, an dem die Eintragung der Ausgliederung in das Register des Sitzes desjenigen Rechtsträgers, dessen Gläubiger sie sind, nach § 19 Abs. 3 UmwG als bekannt gemacht gilt, ihren Anspruch nach Grund und Höhe schriftlich anmelden, Sicherheit zu leisten, soweit sie nicht Befriedigung verlangen können. Dieses Recht steht den Gläubigern jedoch nur zu, wenn sie glaubhaft machen, dass durch die Ausgliederung die Erfüllung der Forderung gefährdet wird."
    },
    {
      "date": "2024-10-21",
      "id": "91095",
      "original_text": "Löschungsankündigung\nNiedersachsen Amtsgericht Aurich HRA 201393\nproturbine GmbH & Co. KG – Wittmund",
      "type": "Löschungsankündigung",
      "state": "Niedersachsen",
      "amtsgericht": "Amtsgericht Aurich",
      "registernummer": "HRA 201393",
      "registerart": "HRA",
      "company_name": "proturbine GmbH & Co. KG",
      "company_seat": "Wittmund",
      "details": "21.10.2024 (Bekanntmachungsdatum)\n\nNiedersachsen Amtsgericht Aurich HRA 201393\nLöschungsankündigung 21.10.2024 (Eintragungsdatum)\n\nproturbine GmbH & Co. KG\nKommanditgesellschaft\nWittmund\n\nDas Registergericht beabsichtigt, die Firma von Amts wegen nach § 394 FamFG zu löschen. Die Frist zur Erhebung eines Widerspruchs ist auf 1 Monat ab dieser Registerbekanntmachung festgesetzt."
    },
    {
      "date": "2024-10-21",
      "id": "91096",
      "original_text": "Registerbekanntmachung nach dem Umwandlungsgesetz\nNiedersachsen Amtsgericht Osnabrück HRA 209245\nElektrotechnik Haar e.K. – Haren (Ems)",
      "type": "Registerbekanntmachung nach dem Umwandlungsgesetz",
      "state": "Niedersachsen",
      "amtsgericht": "Amtsgericht Osnabrück",
      "registernummer": "HRA 209245",
      "registerart": "HRA",
      "company_name": "Elektrotechnik Haar e.K.",
      "company_seat": "Haren (Ems)",
      "details": "21.10.2024 (Bekanntmachungsdatum)\n\nNiedersachsen Amtsgericht Osnabrück HRA 209245\nRegisterbekanntmachung nach dem Umwandlungsgesetz 21.10.2024 (Eintragungsdatum)\n\nElektrotechnik Haar e.K.\nEinzelkaufmann / Einzelkauffrau\nHaren (Ems)\n\nDen Gläubigern der an der Ausgliederung beteiligten Rechtsträger ist, wenn sie binnen sechs Monaten nach dem Tag, an dem die Eintragung der Ausgliederung in das Register des Sitzes desjenigen Rechtsträgers, dessen Gläubiger sie sind, nach § 19 Abs. 3 UmwG als bekannt gemacht gilt, ihren Anspruch nach Grund und Höhe schriftlich anmelden, Sicherheit zu leisten, soweit sie nicht Befriedigung verlangen können. Dieses Recht steht den Gläubigern jedoch nur zu, wenn sie glaubhaft machen, dass durch die Ausgliederung die Erfüllung der Forderung gefährdet wird."
    },
    {
      "date": "2024-10-21",
      "id": "91097",
      "original_text": "Registerbekanntmachung nach dem Umwandlungsgesetz\nNiedersachsen Amtsgericht Lüneburg HRB 210758\nDGR Property GmbH – Egestorf",
      "type": "Registerbekanntmachung nach dem Umwandlungsgesetz",
      "state": "Niedersachsen",
      "amtsgericht": "Amtsgericht Lüneburg",
      "registernummer": "HRB 210758",
      "registerart": "HRB",
      "company_name": "DGR Property GmbH",
      "company_seat": "Egestorf",
      "details": "21.10.2024 (Bekanntmachungsdatum)\n\nNiedersachsen Amtsgericht Lüneburg HRB 210758\nRegisterbekanntmachung nach dem Umwandlungsgesetz 21.10.2024 (Eintragungsdatum)\n\nDGR Property GmbH\nGesellschaft mit beschränkter Haftung\nEgestorf\n\nDen Gläubigern der an der Verschmelzung beteiligten Rechtsträger ist, wenn sie binnen sechs Monaten nach dem Tag, an dem die Eintragung der Verschmelzung in das Register des Sitzes desjenigen Rechtsträgers, dessen Gläubiger sie sind, nach § 19  Abs.  3 UmwG als bekannt gemacht gilt, ihren Anspruch nach Grund und Höhe schriftlich anmelden, Sicherheit zu leisten, soweit sie nicht Befriedigung verlangen können. Dieses Recht steht den Gläubigern jedoch nur zu, wenn sie glaubhaft machen, dass durch die Verschmelzung die Erfüllung der Forderung gefährdet wird."
    },
    {
      "date": "2024-10-21",
      "id": "91098",
      "original_text": "Registerbekanntmachung nach dem Umwandlungsgesetz\nNiedersachsen Amtsgericht Aurich HRA 204007\nJo Thomes GmbH & Co. KG – Marienhafe",
      "type": "Registerbekanntmachung nach dem Umwandlungsgesetz",
      "state": "Niedersachsen",
      "amtsgericht": "Amtsgericht Aurich",
      "registernummer": "HRA 204007",
      "registerart": "HRA",
      "company_name": "Jo Thomes GmbH & Co. KG",
      "company_seat": "Marienhafe",
      "details": "21.10.2024 (Bekanntmachungsdatum)\n\nNiedersachsen Amtsgericht Aurich HRA 204007\nRegisterbekanntmachung nach dem Umwandlungsgesetz 21.10.2024 (Eintragungsdatum)\n\nJo Thomes GmbH & Co. KG\nKommanditgesellschaft\nMarienhafe\n\nDen Gläubigern der an der Ausgliederung beteiligten Rechtsträger ist, wenn sie binnen sechs Monaten nach dem Tag, an dem die Eintragung der Ausgliederung in das Register des Sitzes desjenigen Rechtsträgers, dessen Gläubiger sie sind, nach § 19 Abs. 3 UmwG als bekannt gemacht gilt, ihren Anspruch nach Grund und Höhe schriftlich anmelden, Sicherheit zu leisten, soweit sie nicht Befriedigung verlangen können. Dieses Recht steht den Gläubigern jedoch nur zu, wenn sie glaubhaft machen, dass durch die Ausgliederung die Erfüllung der Forderung gefährdet wird."
    },
    {
      "date": "2024-10-21",
      "id": "91099",
      "original_text": "Registerbekanntmachung nach dem Umwandlungsgesetz\nNiedersachsen Amtsgericht Walsrode HRB 212279\nBein & Bergmann GmbH – Wietzen",
      "type": "Registerbekanntmachung nach dem Umwandlungsgesetz",
      "state": "Niedersachsen",
      "amtsgericht": "Amtsgericht Walsrode",
      "registernummer": "HRB 212279",
      "registerart": "HRB",
      "company_name": "Bein & Bergmann GmbH",
      "company_seat": "Wietzen",
      "details": "21.10.2024 (Bekanntmachungsdatum)\n\nNiedersachsen Amtsgericht Walsrode HRB 212279\nRegisterbekanntmachung nach dem Umwandlungsgesetz 21.10.2024 (Eintragungsdatum)\n\nBein & Bergmann GmbH\nGesellschaft mit beschränkter Haftung\nWietzen\n\nDen Gläubigern der an der formwechselnden Umwandlung beteiligten Rechtsträger ist, wenn sie binnen sechs Monaten nach dem Tag, an dem die Eintragung der Umwandlung in das Register des Sitzes desjenigen Rechtsträgers, dessen Gläubiger sie sind, nach § 19 Abs. 3 UmwG als bekannt gemacht gilt, ihren Anspruch nach Grund und Höhe schriftlich anmelden, Sicherheit zu leisten, soweit sie nicht Befriedigung verlangen können. Dieses Recht steht den Gläubigern jedoch nur zu, wenn sie glaubhaft machen, dass durch die formwechselnde Umwandlung die Erfüllung der Forderung gefährdet wird."
    },
    {
      "date": "2024-10-21",
      "id": "91100",
      "original_text": "Registerbekanntmachung nach dem Umwandlungsgesetz\nNiedersachsen Amtsgericht Walsrode HRA 203424\nBein & Bergmann OHG – Wietzen OT Holte",
      "type": "Registerbekanntmachung nach dem Umwandlungsgesetz",
      "state": "Niedersachsen",
      "amtsgericht": "Amtsgericht Walsrode",
      "registernummer": "HRA 203424",
      "registerart": "HRA",
      "company_name": "Bein & Bergmann OHG",
      "company_seat": "Wietzen OT Holte",
      "details": "21.10.2024 (Bekanntmachungsdatum)\n\nNiedersachsen Amtsgericht Walsrode HRA 203424\nRegisterbekanntmachung nach dem Umwandlungsgesetz 21.10.2024 (Eintragungsdatum)\n\nBein & Bergmann OHG\nOffene Handelsgesellschaft\nWietzen OT Holte\n\nDen Gläubigern der an der formwechselnden Umwandlung beteiligten Rechtsträger ist, wenn sie binnen sechs Monaten nach dem Tag, an dem die Eintragung der Umwandlung in das Register des Sitzes desjenigen Rechtsträgers, dessen Gläubiger sie sind, nach § 19 Abs. 3 UmwG als bekannt gemacht gilt, ihren Anspruch nach Grund und Höhe schriftlich anmelden, Sicherheit zu leisten, soweit sie nicht Befriedigung verlangen können. Dieses Recht steht den Gläubigern jedoch nur zu, wenn sie glaubhaft machen, dass durch die formwechselnde Umwandlung die Erfüllung der Forderung gefährdet wird."
    },
    {
      "date": "2024-10-21",
      "id": "91101",
      "original_text": "Löschungsankündigung\nNiedersachsen Amtsgericht Braunschweig VR 150104\nSchützenklub Linden von 1926 e. V. – Wolfenbüttel",
      "type": "Löschungsankündigung",
      "state": "Niedersachsen",
      "amtsgericht": "Amtsgericht Braunschweig",
      "registernummer": "VR 150104",
      "registerart": "VR",
      "company_name": "Schützenklub Linden von 1926 e. V.",
      "company_seat": "Wolfenbüttel",
      "details": "21.10.2024 (Bekanntmachungsdatum)\n\nNiedersachsen Amtsgericht Braunschweig VR 150104\nLöschungsankündigung\n\nSchützenklub Linden von 1926 e. V.\neingetragener Verein\nWolfenbüttel\n\nDas Registergericht beabsichtigt, das Registerblatt gemäß § 4 VRV zu schließen. Die Frist zur Erhebung eines Widerspruchs ist auf 1 Monat ab dieser Registerbekanntmachung festgesetzt."
    },
    {
      "date": "2024-10-21",
      "id": "91102",
      "original_text": "Registerbekanntmachung nach dem Umwandlungsgesetz\nNiedersachsen Amtsgericht Hildesheim GsR 192\nGGG Grundstücksgesellschaft eGbR – Gifhorn",
      "type": "Registerbekanntmachung nach dem Umwandlungsgesetz",
      "state": "Niedersachsen",
      "amtsgericht": "Amtsgericht Hildesheim",
      "registernummer": "GsR 192",
      "registerart": "GsR",
      "company_name": "GGG Grundstücksgesellschaft eGbR",
      "company_seat": "Gifhorn",
      "details": "21.10.2024 (Bekanntmachungsdatum)\n\nNiedersachsen Amtsgericht Hildesheim GsR 192\nRegisterbekanntmachung nach dem Umwandlungsgesetz 21.10.2024 (Eintragungsdatum)\n\nGGG Grundstücksgesellschaft eGbR\nGesellschaft bürgerlichen Rechts\nGifhorn\n\nDen Gläubigern der an der formwechselnden Umwandlung beteiligten Rechtsträger ist, wenn sie binnen sechs Monaten nach dem Tag, an dem die Eintragung der Umwandlung in das Register des Sitzes desjenigen Rechtsträgers, dessen Gläubiger sie sind, nach § 19 Abs. 3 UmwG als bekannt gemacht gilt, ihren Anspruch nach Grund und Höhe schriftlich anmelden, Sicherheit zu leisten, soweit sie nicht Befriedigung verlangen können. Dieses Recht steht den Gläubigern jedoch nur zu, wenn sie glaubhaft machen, dass durch die formwechselnde Umwandlung die Erfüllung der Forderung gefährdet wird."
    },
    {
      "date": "2024-10-21",
      "id": "91103",
      "original_text": "Registerbekanntmachung nach dem Umwandlungsgesetz\nNiedersachsen Amtsgericht Lüneburg HRA 110603 früher Amtsgericht Winsen\nDAGSR Vermögensbeteiligungs GmbH + Co. KG – Egestorf",
      "type": "Registerbekanntmachung nach dem Umwandlungsgesetz",
      "state": "Niedersachsen",
      "amtsgericht": "Amtsgericht Lüneburg",
      "registernummer": "HRA 110603",
      "registerart": "HRA",
      "company_name": "DAGSR Vermögensbeteiligungs GmbH + Co. KG",
      "company_seat": "Egestorf",
      "former_amtsgericht": "Winsen",
      "details": "21.10.2024 (Bekanntmachungsdatum)\n\nNiedersachsen Amtsgericht Lüneburg HRA 110603 früher Amtsgericht Winsen\nRegisterbekanntmachung nach dem Umwandlungsgesetz 21.10.2024 (Eintragungsdatum)\n\nDAGSR Vermögensbeteiligungs GmbH + Co. KG\nKommanditgesellschaft\nEgestorf\n\nDen Gläubigern der an der Verschmelzung beteiligten Rechtsträger ist, wenn sie binnen sechs Monaten nach dem Tag, an dem die Eintragung der Verschmelzung in das Register des Sitzes desjenigen Rechtsträgers, dessen Gläubiger sie sind, nach § 19  Abs.  3 UmwG als bekannt gemacht gilt, ihren Anspruch nach Grund und Höhe schriftlich anmelden, Sicherheit zu leisten, soweit sie nicht Befriedigung verlangen können. Dieses Recht steht den Gläubigern jedoch nur zu, wenn sie glaubhaft machen, dass durch die Verschmelzung die Erfüllung der Forderung gefährdet wird."
    },
    {
      "date": "2024-10-21",
      "id": "91104",
      "original_text": "Registerbekanntmachung nach dem Umwandlungsgesetz\nNiedersachsen Amtsgericht Lüneburg HRA 110603 früher Amtsgericht Winsen\nDAGSR Vermögensbeteiligungs GmbH + Co. KG – Egestorf",
      "type": "Registerbekanntmachung nach dem Umwandlungsgesetz",
      "state": "Niedersachsen",
      "amtsgericht": "Amtsgericht Lüneburg",
      "registernummer": "HRA 110603",
      "registerart": "HRA",
      "company_name": "DAGSR Vermögensbeteiligungs GmbH + Co. KG",
      "company_seat": "Egestorf",
      "former_amtsgericht": "Winsen",
      "details": "21.10.2024 (Bekanntmachungsdatum)\n\nNiedersachsen Amtsgericht Lüneburg HRA 110603 früher Amtsgericht Winsen\nRegisterbekanntmachung nach dem Umwandlungsgesetz 21.10.2024 (Eintragungsdatum)\n\nDAGSR Vermögensbeteiligungs GmbH + Co. KG\nKommanditgesellschaft\nEgestorf\n\nDen Gläubigern der an der Verschmelzung beteiligten Rechtsträger ist, wenn sie binnen sechs Monaten nach dem Tag, an dem die Eintragung der Verschmelzung in das Register des Sitzes desjenigen Rechtsträgers, dessen Gläubiger sie sind, nach § 19  Abs.  3 UmwG als bekannt gemacht gilt, ihren Anspruch nach Grund und Höhe schriftlich anmelden, Sicherheit zu leisten, soweit sie nicht Befriedigung verlangen können. Dieses Recht steht den Gläubigern jedoch nur zu, wenn sie glaubhaft machen, dass durch die Verschmelzung die Erfüllung der Forderung gefährdet wird."
    },
    {
      "date": "2024-10-21",
      "id": "91105",
      "original_text": "Registerbekanntmachung nach dem Umwandlungsgesetz\nNiedersachsen Amtsgericht Aurich HRA 203982\nJo. Thomes Heizung-Sanitär-Solar-Klima e.K. – Marienhafe",
      "type": "Registerbekanntmachung nach dem Umwandlungsgesetz",
      "state": "Niedersachsen",
      "amtsgericht": "Amtsgericht Aurich",
      "registernummer": "HRA 203982",
      "registerart": "HRA",
      "company_name": "Jo. Thomes Heizung-Sanitär-Solar-Klima e.K.",
      "company_seat": "Marienhafe",
      "details": "21.10.2024 (Bekanntmachungsdatum)\n\nNiedersachsen Amtsgericht Aurich HRA 203982\nRegisterbekanntmachung nach dem Umwandlungsgesetz 21.10.2024 (Eintragungsdatum)\n\nJo. Thomes Heizung-Sanitär-Solar-Klima e.K.\nEinzelkaufmann / Einzelkauffrau\nMarienhafe\n\nDen Gläubigern der an der Ausgliederung beteiligten Rechtsträger ist, wenn sie binnen sechs Monaten nach dem Tag, an dem die Eintragung der Ausgliederung in das Register des Sitzes desjenigen Rechtsträgers, dessen Gläubiger sie sind, nach § 19 Abs. 3 UmwG als bekannt gemacht gilt, ihren Anspruch nach Grund und Höhe schriftlich anmelden, Sicherheit zu leisten, soweit sie nicht Befriedigung verlangen können. Dieses Recht steht den Gläubigern jedoch nur zu, wenn sie glaubhaft machen, dass durch die Ausgliederung die Erfüllung der Forderung gefährdet wird."
    },
    {
      "date": "2024-10-21",
      "id": "91106",
      "original_text": "Registerbekanntmachung nach dem Umwandlungsgesetz\nNiedersachsen Amtsgericht Tostedt HRB 4196\nDORMED Vertriebsgesellschaft für medizinische Systeme mbH Nord – Buchholz",
      "type": "Registerbekanntmachung nach dem Umwandlungsgesetz",
      "state": "Niedersachsen",
      "amtsgericht": "Amtsgericht Tostedt",
      "registernummer": "HRB 4196",
      "registerart": "HRB",
      "company_name": "DORMED Vertriebsgesellschaft für medizinische Systeme mbH Nord",
      "company_seat": "Buchholz",
      "details": "21.10.2024 (Bekanntmachungsdatum)\n\nNiedersachsen Amtsgericht Tostedt HRB 4196\nRegisterbekanntmachung nach dem Umwandlungsgesetz 21.10.2024 (Eintragungsdatum)\n\nDORMED Vertriebsgesellschaft für medizinische Systeme mbH Nord\nGesellschaft mit beschränkter Haftung\nBuchholz\n\nDen Gläubigern der an der Verschmelzung beteiligten Rechtsträger ist, wenn sie binnen sechs Monaten nach dem Tag, an dem die Eintragung der Verschmelzung in das Register des Sitzes desjenigen Rechtsträgers, dessen Gläubiger sie sind, nach § 19  Abs.  3 UmwG als bekannt gemacht gilt, ihren Anspruch nach Grund und Höhe schriftlich anmelden, Sicherheit zu leisten, soweit sie nicht Befriedigung verlangen können. Dieses Recht steht den Gläubigern jedoch nur zu, wenn sie glaubhaft machen, dass durch die Verschmelzung die Erfüllung der Forderung gefährdet wird."
    },
    {
      "date": "2024-10-21",
      "id": "91107",
      "original_text": "Registerbekanntmachung nach dem Umwandlungsgesetz\nNiedersachsen Amtsgericht Braunschweig HRB 210180\nPactolus GmbH – Süpplingenburg",
      "type": "Registerbekanntmachung nach dem Umwandlungsgesetz",
      "state": "Niedersachsen",
      "amtsgericht": "Amtsgericht Braunschweig",
      "registernummer": "HRB 210180",
      "registerart": "HRB",
      "company_name": "Pactolus GmbH",
      "company_seat": "Süpplingenburg",
      "details": "21.10.2024 (Bekanntmachungsdatum)\n\nNiedersachsen Amtsgericht Braunschweig HRB 210180\nRegisterbekanntmachung nach dem Umwandlungsgesetz 21.10.2024 (Eintragungsdatum)\n\nPactolus GmbH\nGesellschaft mit beschränkter Haftung\nSüpplingenburg\n\nDen Gläubigern der an der Verschmelzung beteiligten Rechtsträger ist, wenn sie binnen sechs Monaten nach dem Tag, an dem die Eintragung der Verschmelzung in das Register des Sitzes desjenigen Rechtsträgers, dessen Gläubiger sie sind, nach § 19  Abs.  3 UmwG als bekannt gemacht gilt, ihren Anspruch nach Grund und Höhe schriftlich anmelden, Sicherheit zu leisten, soweit sie nicht Befriedigung verlangen können. Dieses Recht steht den Gläubigern jedoch nur zu, wenn sie glaubhaft machen, dass durch die Verschmelzung die Erfüllung der Forderung gefährdet wird."
    },
    {
      "date": "2024-10-21",
      "id": "91108",
      "original_text": "Registerbekanntmachung nach dem Umwandlungsgesetz\nNiedersachsen Amtsgericht Oldenburg (Oldenburg) HRB 219152\nTSM Solar- und Metalltechnik GmbH – Goldenstedt",
      "type": "Registerbekanntmachung nach dem Umwandlungsgesetz",
      "state": "Niedersachsen",
      "amtsgericht": "Amtsgericht Oldenburg (Oldenburg)",
      "registernummer": "HRB 219152",
      "registerart": "HRB",
      "company_name": "TSM Solar- und Metalltechnik GmbH",
      "company_seat": "Goldenstedt",
      "details": "21.10.2024 (Bekanntmachungsdatum)\n\nNiedersachsen Amtsgericht Oldenburg (Oldenburg) HRB 219152\nRegisterbekanntmachung nach dem Umwandlungsgesetz\n\nTSM Solar- und Metalltechnik GmbH\nGesellschaft mit beschränkter Haftung\nGoldenstedt\n\nDas Registergericht beabsichtigt, die Gesellschaft von Amts wegen nach § 394 FamFG zu löschen. Die Frist zur Erhebung eines Widerspruchs ist auf 1 Monat ab dieser Registerbekanntmachung festgesetzt."
    },
    {
      "date": "2024-10-21",
      "id": "91109",
      "original_text": "Löschungsankündigung\nNiedersachsen Amtsgericht Hildesheim HRB 204001\nRET AG Rosner Engineering and Trading Aktiengesellschaft – Dielmissen",
      "type": "Löschungsankündigung",
      "state": "Niedersachsen",
      "amtsgericht": "Amtsgericht Hildesheim",
      "registernummer": "HRB 204001",
      "registerart": "HRB",
      "company_name": "RET AG Rosner Engineering and Trading Aktiengesellschaft",
      "company_seat": "Dielmissen",
      "details": "21.10.2024 (Bekanntmachungsdatum)\n\nNiedersachsen Amtsgericht Hildesheim HRB 204001\nLöschungsankündigung\n\nRET AG Rosner Engineering and Trading Aktiengesellschaft\nAktiengesellschaft\nDielmissen\n\nDas Registergericht beabsichtigt, die Gesellschaft von Amts wegen nach § 394 FamFG zu löschen. Die Frist zur Erhebung eines Widerspruchs ist auf 1 Monat ab dieser Registerbekanntmachung festgesetzt."
    },
    {
      "date": "2024-10-21",
      "id": "91110",
      "original_text": "Löschungsankündigung\nNiedersachsen Amtsgericht Hannover HRB 225364\nV.K. International Group GmbH – Langenhagen",
      "type": "Löschungsankündigung",
      "state": "Niedersachsen",
      "amtsgericht": "Amtsgericht Hannover",
      "registernummer": "HRB 225364",
      "registerart": "HRB",
      "company_name": "V.K. International Group GmbH",
      "company_seat": "Langenhagen",
      "details": "21.10.2024 (Bekanntmachungsdatum)\n\nNiedersachsen Amtsgericht Hannover HRB 225364\nLöschungsankündigung\n\nV.K. International Group GmbH\nGesellschaft mit beschränkter Haftung\nLangenhagen\n\nDas Registergericht beabsichtigt, die Gesellschaft von Amts wegen nach § 394 FamFG zu löschen. Die Frist zur Erhebung eines Widerspruchs ist auf 1 Monat ab dieser Registerbekanntmachung festgesetzt."
    },
    {
      "date": "2024-10-21",
      "id": "91111",
      "original_text": "Löschungsankündigung\nNiedersachsen Amtsgericht Aurich HRB 1627\nUhren und Schmuck Schiefelbein GmbH – Esens",
      "type": "Löschungsankündigung",
      "state": "Niedersachsen",
      "amtsgericht": "Amtsgericht Aurich",
      "registernummer": "HRB 1627",
      "registerart": "HRB",
      "company_name": "Uhren und Schmuck Schiefelbein GmbH",
      "company_seat": "Esens",
      "details": "21.10.2024 (Bekanntmachungsdatum)\n\nNiedersachsen Amtsgericht Aurich HRB 1627\nLöschungsankündigung\n\nUhren und Schmuck Schiefelbein GmbH\nGesellschaft mit beschränkter Haftung\nEsens\n\nDas Registergericht beabsichtigt, die Gesellschaft von Amts wegen nach § 394 FamFG zu löschen. Die Frist zur Erhebung eines Widerspruchs ist auf 1 Monat ab dieser Registerbekanntmachung festgesetzt."
    },
    {
      "date": "2024-10-21",
      "id": "91112",
      "original_text": "Registerbekanntmachung nach dem Umwandlungsgesetz\nNiedersachsen Amtsgericht Lüneburg HRB 210711\nAGSR Property GmbH – Egestorf",
      "type": "Registerbekanntmachung nach dem Umwandlungsgesetz",
      "state": "Niedersachsen",
      "amtsgericht": "Amtsgericht Lüneburg",
      "registernummer": "HRB 210711",
      "registerart": "HRB",
      "company_name": "AGSR Property GmbH",
      "company_seat": "Egestorf",
      "details": "21.10.2024 (Bekanntmachungsdatum)\n\nNiedersachsen Amtsgericht Lüneburg HRB 210711\nRegisterbekanntmachung nach dem Umwandlungsgesetz 21.10.2024 (Eintragungsdatum)\n\nAGSR Property GmbH\nGesellschaft mit beschränkter Haftung\nEgestorf\n\nDen Gläubigern der an der Verschmelzung beteiligten Rechtsträger ist, wenn sie binnen sechs Monaten nach dem Tag, an dem die Eintragung der Verschmelzung in das Register des Sitzes desjenigen Rechtsträgers, dessen Gläubiger sie sind, nach § 19  Abs.  3 UmwG als bekannt gemacht gilt, ihren Anspruch nach Grund und Höhe schriftlich anmelden, Sicherheit zu leisten, soweit sie nicht Befriedigung verlangen können. Dieses Recht steht den Gläubigern jedoch nur zu, wenn sie glaubhaft machen, dass durch die Verschmelzung die Erfüllung der Forderung gefährdet wird."
    },
    {
      "date": "2024-10-21",
      "id": "91113",
      "original_text": "Registerbekanntmachung nach dem Umwandlungsgesetz\nNiedersachsen Amtsgericht Hildesheim HRB 209660\n3G Erste Grundstücksgesellschaft mbH – Gifhorn",
      "type": "Registerbekanntmachung nach dem Umwandlungsgesetz",
      "state": "Niedersachsen",
      "amtsgericht": "Amtsgericht Hildesheim",
      "registernummer": "HRB 209660",
      "registerart": "HRB",
      "company_name": "3G Erste Grundstücksgesellschaft mbH",
      "company_seat": "Gifhorn",
      "details": "21.10.2024 (Bekanntmachungsdatum)\n\nNiedersachsen Amtsgericht Hildesheim HRB 209660\nRegisterbekanntmachung nach dem Umwandlungsgesetz 21.10.2024 (Eintragungsdatum)\n\n3G Erste Grundstücksgesellschaft mbH\nGesellschaft mit beschränkter Haftung\nGifhorn\n\nDen Gläubigern der an der formwechselnden Umwandlung beteiligten Rechtsträger ist, wenn sie binnen sechs Monaten nach dem Tag, an dem die Eintragung der Umwandlung in das Register des Sitzes desjenigen Rechtsträgers, dessen Gläubiger sie sind, nach § 19 Abs. 3 UmwG als bekannt gemacht gilt, ihren Anspruch nach Grund und Höhe schriftlich anmelden, Sicherheit zu leisten, soweit sie nicht Befriedigung verlangen können. Dieses Recht steht den Gläubigern jedoch nur zu, wenn sie glaubhaft machen, dass durch die formwechselnde Umwandlung die Erfüllung der Forderung gefährdet wird."
    },
    {
      "date": "2024-10-21",
      "id": "91114",
      "original_text": "Registerbekanntmachung nach dem Umwandlungsgesetz\nRheinland-Pfalz Amtsgericht Ludwigshafen a.Rhein (Ludwigshafen) HRB 3036\nPlanotec Planungsgesellschaft für Anlagen-, Maschinen- und Rohrleitungsbau mbH – Dannstadt-Schauernheim",
      "type": "Registerbekanntmachung nach dem Umwandlungsgesetz",
      "state": "Rheinland-Pfalz",
      "amtsgericht": "Amtsgericht Ludwigshafen a.Rhein (Ludwigshafen)",
      "registernummer": "HRB 3036",
      "registerart": "HRB",
      "company_name": "Planotec Planungsgesellschaft für Anlagen-, Maschinen- und Rohrleitungsbau mbH",
      "company_seat": "Dannstadt-Schauernheim",
      "details": "21.10.2024 (Bekanntmachungsdatum)\n\nRheinland-Pfalz Amtsgericht Ludwigshafen a.Rhein (Ludwigshafen) HRB 3036\nRegisterbekanntmachung nach dem Umwandlungsgesetz 21.10.2024 (Eintragungsdatum)\n\nPlanotec Planungsgesellschaft für Anlagen-, Maschinen- und Rohrleitungsbau mbH\nGesellschaft mit beschränkter Haftung\nDannstadt-Schauernheim\n\nAls nicht eingetragen wird veröffentlicht: Den Gläubigern der an der Verschmelzung beteiligten Rechtsträger ist, wenn sie binnen sechs Monaten nach dem Tag, an dem die Eintragung der Verschmelzung in das Register des Sitzes desjenigen Rechtsträgers,dessen Gläubiger sie sind, nach § 19 Abs. 3 UmwG als bekannt gemacht gilt, ihren Anspruch nach Grund und Höhe schriftlich anmelden, Sicherheit zu leisten, soweit sie nicht Befriedigung verlangen können. Dieses Recht steht den Gläubigern jedoch nur zu, wenn sie glaubhaft machen, dass durch die Verschmelzung die Erfüllung der Forderung gefährdet wird."
    },
    {
      "date": "2024-10-21",
      "id": "91115",
      "original_text": "Registerbekanntmachung nach dem Umwandlungsgesetz\nRheinland-Pfalz Amtsgericht Ludwigshafen a.Rhein (Ludwigshafen) HRB 2878\nRotan Rohrleitungs-Tanksanierungs-Anlagenbau GmbH – Dannstadt",
      "type": "Registerbekanntmachung nach dem Umwandlungsgesetz",
      "state": "Rheinland-Pfalz",
      "amtsgericht": "Amtsgericht Ludwigshafen a.Rhein (Ludwigshafen)",
      "registernummer": "HRB 2878",
      "registerart": "HRB",
      "company_name": "Rotan Rohrleitungs-Tanksanierungs-Anlagenbau GmbH",
      "company_seat": "Dannstadt",
      "details": "21.10.2024 (Bekanntmachungsdatum)\n\nRheinland-Pfalz Amtsgericht Ludwigshafen a.Rhein (Ludwigshafen) HRB 2878\nRegisterbekanntmachung nach dem Umwandlungsgesetz 21.10.2024 (Eintragungsdatum)\n\nRotan Rohrleitungs-Tanksanierungs-Anlagenbau GmbH\nGesellschaft mit beschränkter Haftung\nDannstadt\n\nAls nicht eingetragen wird veröffentlicht: Den Gläubigern der an der Verschmelzung beteiligten Rechtsträger ist, wenn sie binnen sechs Monaten nach dem Tag, an dem die Eintragung der Verschmelzung in das Register des Sitzes desjenigen Rechtsträgers,dessen Gläubiger sie sind, nach § 19 Abs. 3 UmwG als bekannt gemacht gilt, ihren Anspruch nach Grund und Höhe schriftlich anmelden, Sicherheit zu leisten, soweit sie nicht Befriedigung verlangen können. Dieses Recht steht den Gläubigern jedoch nur zu, wenn sie glaubhaft machen, dass durch die Verschmelzung die Erfüllung der Forderung gefährdet wird."
    },
    {
      "date": "2024-10-21",
      "id": "91116",
      "original_text": "Registerbekanntmachung nach dem Umwandlungsgesetz\nRheinland-Pfalz Amtsgericht Montabaur HRA 22948\nLM Straßensanierung e.K. – Straßenhaus",
      "type": "Registerbekanntmachung nach dem Umwandlungsgesetz",
      "state": "Rheinland-Pfalz",
      "amtsgericht": "Amtsgericht Montabaur",
      "registernummer": "HRA 22948",
      "registerart": "HRA",
      "company_name": "LM Straßensanierung e.K.",
      "company_seat": "Straßenhaus",
      "details": "21.10.2024 (Bekanntmachungsdatum)\n\nRheinland-Pfalz Amtsgericht Montabaur HRA 22948\nRegisterbekanntmachung nach dem Umwandlungsgesetz 21.10.2024 (Eintragungsdatum)\n\nLM Straßensanierung e.K.\nEinzelkaufmann / Einzelkauffrau\nStraßenhaus\n\nAls nicht eingetragen wird veröffentlicht: Den Gläubigern der an der Ausgliederung beteiligten Rechtsträger ist, wenn sie binnen sechs Monaten nach dem Tag, an dem die Eintragung der Ausgliederung in das Register des Sitzes desjenigen Rechtsträgers,dessen Gläubiger sie sind, nach § 19 Abs. 3 UmwG als bekannt gemacht gilt, ihren Anspruch nach Grund und Höhe schriftlich anmelden, Sicherheit zu leisten, soweit sie nicht Befriedigung verlangen können. Dieses Recht steht den Gläubigern jedoch nur zu, wenn sie glaubhaft machen, dass durch die Ausgliederung die Erfüllung der Forderung gefährdet wird."
    },
    {
      "date": "2024-10-21",
      "id": "91117",
      "original_text": "Einreichung neuer Dokumente\nRheinland-Pfalz Amtsgericht Landau HRB 2370\nStadtholding Landau in der Pfalz GmbH – Landau in der Pfalz",
      "type": "Einreichung neuer Dokumente",
      "state": "Rheinland-Pfalz",
      "amtsgericht": "Amtsgericht Landau",
      "registernummer": "HRB 2370",
      "registerart": "HRB",
      "company_name": "Stadtholding Landau in der Pfalz GmbH",
      "company_seat": "Landau in der Pfalz",
      "details": "21.10.2024 (Bekanntmachungsdatum)\n\nRheinland-Pfalz Amtsgericht Landau HRB 2370\nEinreichung neuer Dokumente 21.10.2024 (Eintragungsdatum)\n\nStadtholding Landau in der Pfalz GmbH\nGesellschaft mit beschränkter Haftung\nLandau in der Pfalz\n\nDem Registergericht ist eine neue Liste der Mitglieder des Aufsichtsrates eingereicht worden."
    },
    {
      "date": "2024-10-21",
      "id": "91118",
      "original_text": "Registerbekanntmachung nach dem Umwandlungsgesetz\nRheinland-Pfalz Amtsgericht Koblenz HRB 13725\nSHD Holding GmbH. – Andernach",
      "type": "Registerbekanntmachung nach dem Umwandlungsgesetz",
      "state": "Rheinland-Pfalz",
      "amtsgericht": "Amtsgericht Koblenz",
      "registernummer": "HRB 13725",
      "registerart": "HRB",
      "company_name": "SHD Holding GmbH.",
      "company_seat": "Andernach",
      "details": "21.10.2024 (Bekanntmachungsdatum)\n\nRheinland-Pfalz Amtsgericht Koblenz HRB 13725\nRegisterbekanntmachung nach dem Umwandlungsgesetz 21.10.2024 (Eintragungsdatum)\n\nSHD Holding GmbH.\nGesellschaft mit beschränkter Haftung\nAndernach\n\nAls nicht eingetragen wird veröffentlicht: Den Gläubigern der an der Verschmelzung beteiligten Rechtsträger ist, wenn sie binnen sechs Monaten nach dem Tag, an dem die Eintragung der Verschmelzung in das Register des Sitzes desjenigen Rechtsträgers,dessen Gläubiger sie sind, nach § 19 Abs. 3 UmwG als bekannt gemacht gilt, ihren Anspruch nach Grund und Höhe schriftlich anmelden, Sicherheit zu leisten, soweit sie nicht Befriedigung verlangen können. Dieses Recht steht den Gläubigern jedoch nur zu, wenn sie glaubhaft machen, dass durch die Verschmelzung die Erfüllungd er Forderung gefährdet wird."
    },
    {
      "date": "2024-10-21",
      "id": "91119",
      "original_text": "Registerbekanntmachung nach dem Umwandlungsgesetz\nNordrhein-Westfalen Amtsgericht Münster HRB 1375\nMaka Wohnmöbel GmbH – Münster",
      "type": "Registerbekanntmachung nach dem Umwandlungsgesetz",
      "state": "Nordrhein-Westfalen",
      "amtsgericht": "Amtsgericht Münster",
      "registernummer": "HRB 1375",
      "registerart": "HRB",
      "company_name": "Maka Wohnmöbel GmbH",
      "company_seat": "Münster",
      "details": "21.10.2024 (Bekanntmachungsdatum)\n\nNordrhein-Westfalen Amtsgericht Münster HRB 1375\nRegisterbekanntmachung nach dem Umwandlungsgesetz 21.10.2024 (Eintragungsdatum)\n\nMaka Wohnmöbel GmbH\nGesellschaft mit beschränkter Haftung\nMünster\n\nDen Gläubigern der an der Verschmelzung beteiligten Rechtsträger ist, wenn sie binnen sechs Monaten nach dem Tag, an dem die Eintragung der Verschmelzung in das Register des Sitzes desjenigen Rechtsträgers, dessen Gläubiger sie sind, nach § 19 Absatz 3 UmwG als bekanntgemacht gilt, ihren Anspruch nach Grund und Höhe schriftlich anmelden, Sicherheit zu leisten, soweit sie nicht Befriedigung verlangen können. Dieses Recht steht den Gläubigern jedoch nur zu, wenn sie glaubhaft machen, dass durch die Verschmelzung die Erfüllung ihrer Forderung gefährdet wird."
    },
    {
      "date": "2024-10-21",
      "id": "91120",
      "original_text": "Löschungsankündigung\nNordrhein-Westfalen Amtsgericht Dortmund HRB 31285\nMorawski Dienstleistungsgesellschaft mbH – Dortmund",
      "type": "Löschungsankündigung",
      "state": "Nordrhein-Westfalen",
      "amtsgericht": "Amtsgericht Dortmund",
      "registernummer": "HRB 31285",
      "registerart": "HRB",
      "company_name": "Morawski Dienstleistungsgesellschaft mbH",
      "company_seat": "Dortmund",
      "details": "21.10.2024 (Bekanntmachungsdatum)\n\nNordrhein-Westfalen Amtsgericht Dortmund HRB 31285\nLöschungsankündigung\n\nMorawski Dienstleistungsgesellschaft mbH\nGesellschaft mit beschränkter Haftung\nDortmund\n\nDas Registergericht beabsichtigt die Gesellschaft von Amts wegen nach § 394 FamFG zu löschen. Die Frist zur Erhebung eines Widerspruchs ist auf zwei Monate festgesetzt."
    },
    {
      "date": "2024-10-21",
      "id": "91121",
      "original_text": "Löschungsankündigung\nNordrhein-Westfalen Amtsgericht Wuppertal HRB 20856\nJuwelier Tat GmbH – Wuppertal",
      "type": "Löschungsankündigung",
      "state": "Nordrhein-Westfalen",
      "amtsgericht": "Amtsgericht Wuppertal",
      "registernummer": "HRB 20856",
      "registerart": "HRB",
      "company_name": "Juwelier Tat GmbH",
      "company_seat": "Wuppertal",
      "details": "21.10.2024 (Bekanntmachungsdatum)\n\nNordrhein-Westfalen Amtsgericht Wuppertal HRB 20856\nLöschungsankündigung\n\nJuwelier Tat GmbH\nGesellschaft mit beschränkter Haftung\nWuppertal\n\nDas Registergericht beabsichtigt die Gesellschaft von Amts wegen nach § 394 FamFG zu löschen. Die Frist zur Erhebung eines Widerspruchs ist auf einen Monat festgesetzt."
    },
    {
      "date": "2024-10-21",
      "id": "91122",
      "original_text": "Registerbekanntmachung nach dem Umwandlungsgesetz\nNordrhein-Westfalen Amtsgericht Paderborn HRA 8708\nPBS Pipper Brandschutz Service GmbH & Co. KG – Bad Wünnenberg",
      "type": "Registerbekanntmachung nach dem Umwandlungsgesetz",
      "state": "Nordrhein-Westfalen",
      "amtsgericht": "Amtsgericht Paderborn",
      "registernummer": "HRA 8708",
      "registerart": "HRA",
      "company_name": "PBS Pipper Brandschutz Service GmbH & Co. KG",
      "company_seat": "Bad Wünnenberg",
      "details": "21.10.2024 (Bekanntmachungsdatum)\n\nNordrhein-Westfalen Amtsgericht Paderborn HRA 8708\nRegisterbekanntmachung nach dem Umwandlungsgesetz 21.10.2024 (Eintragungsdatum)\n\nPBS Pipper Brandschutz Service GmbH & Co. KG\nKommanditgesellschaft\nBad Wünnenberg\n\nDen Gläubigern der an der Ausgliederung beteiligten Rechtsträger ist, wenn sie binnen sechs Monaten nach dem Tag, an dem die Eintragung der Ausgliederung in das Register des Sitzes desjenigen Rechtsträgers, dessen Gläubiger sie sind, nach § 19 Absatz 3 UmwG als bekanntgemacht gilt, ihren Anspruch nach Grund und Höhe schriftlich anmelden, Sicherheit zu leisten, soweit sie nicht Befriedigung verlangen können. Dieses Recht steht den Gläubigern jedoch nur zu, wenn sie glaubhaft machen, dass durch die Ausgliederung die Erfüllung ihrer Forderung gefährdet wird."
    },
    {
      "date": "2024-10-21",
      "id": "91123",
      "original_text": "Registerbekanntmachung nach dem Umwandlungsgesetz\nNordrhein-Westfalen Amtsgericht Hagen HRA 6543\nGabriele Landolfo Pflegedienst Hagen e.K. – Hagen",
      "type": "Registerbekanntmachung nach dem Umwandlungsgesetz",
      "state": "Nordrhein-Westfalen",
      "amtsgericht": "Amtsgericht Hagen",
      "registernummer": "HRA 6543",
      "registerart": "HRA",
      "company_name": "Gabriele Landolfo Pflegedienst Hagen e.K.",
      "company_seat": "Hagen",
      "details": "21.10.2024 (Bekanntmachungsdatum)\n\nNordrhein-Westfalen Amtsgericht Hagen HRA 6543\nRegisterbekanntmachung nach dem Umwandlungsgesetz 21.10.2024 (Eintragungsdatum)\n\nGabriele Landolfo Pflegedienst Hagen e.K.\nEinzelkaufmann / Einzelkauffrau\nHagen\n\nDen Gläubigern der an der Ausgliederung beteiligten Rechtsträger ist, wenn sie binnen sechs Monaten nach dem Tag, an dem die Eintragung der Ausgliederung in das Register des Sitzes desjenigen Rechtsträgers, dessen Gläubiger sie sind, nach § 19 Absatz 3 UmwG als bekanntgemacht gilt, ihren Anspruch nach Grund und Höhe schriftlich anmelden, Sicherheit zu leisten, soweit sie nicht Befriedigung verlangen können. Dieses Recht steht den Gläubigern jedoch nur zu, wenn sie glaubhaft machen, dass durch die Ausgliederung die Erfüllung ihrer Forderung gefährdet wird."
    },
    {
      "date": "2024-10-21",
      "id": "91124",
      "original_text": "Registerbekanntmachung nach dem Umwandlungsgesetz\nNordrhein-Westfalen Amtsgericht Düsseldorf HRB 41741\nProvinzial Rheinland Lebensversicherung Aktiengesellschaft – Düsseldorf",
      "type": "Registerbekanntmachung nach dem Umwandlungsgesetz",
      "state": "Nordrhein-Westfalen",
      "amtsgericht": "Amtsgericht Düsseldorf",
      "registernummer": "HRB 41741",
      "registerart": "HRB",
      "company_name": "Provinzial Rheinland Lebensversicherung Aktiengesellschaft",
      "company_seat": "Düsseldorf",
      "details": "21.10.2024 (Bekanntmachungsdatum)\n\nNordrhein-Westfalen Amtsgericht Düsseldorf HRB 41741\nRegisterbekanntmachung nach dem Umwandlungsgesetz 21.10.2024 (Eintragungsdatum)\n\nProvinzial Rheinland Lebensversicherung Aktiengesellschaft\nAktiengesellschaft\nDüsseldorf\n\nDen Gläubigern der an der Verschmelzung beteiligten Rechtsträger ist, wenn sie binnen sechs Monaten nach dem Tag, an dem die Eintragung der Verschmelzung in das Register des Sitzes desjenigen Rechtsträgers, dessen Gläubiger sie sind, nach § 19 Absatz 3 UmwG als bekanntgemacht gilt, ihren Anspruch nach Grund und Höhe schriftlich anmelden, Sicherheit zu leisten, soweit sie nicht Befriedigung verlangen können. Dieses Recht steht den Gläubigern jedoch nur zu, wenn sie glaubhaft machen, dass durch die Verschmelzung die Erfüllung ihrer Forderung gefährdet wird."
    },
    {
      "date": "2024-10-21",
      "id": "91125",
      "original_text": "Löschungsankündigung\nNordrhein-Westfalen Amtsgericht Wuppertal HRB 24445\nRahn Bautec UG (haftungsbeschränkt) – Wuppertal",
      "type": "Löschungsankündigung",
      "state": "Nordrhein-Westfalen",
      "amtsgericht": "Amtsgericht Wuppertal",
      "registernummer": "HRB 24445",
      "registerart": "HRB",
      "company_name": "Rahn Bautec UG (haftungsbeschränkt)",
      "company_seat": "Wuppertal",
      "details": "21.10.2024 (Bekanntmachungsdatum)\n\nNordrhein-Westfalen Amtsgericht Wuppertal HRB 24445\nLöschungsankündigung\n\nRahn Bautec UG (haftungsbeschränkt)\nGesellschaft mit beschränkter Haftung\nWuppertal\n\nDas Registergericht beabsichtigt die Gesellschaft von Amts wegen nach § 394 FamFG zu löschen. Die Frist zur Erhebung eines Widerspruchs ist auf einen Monat festgesetzt."
    },
    {
      "date": "2024-10-21",
      "id": "91126",
      "original_text": "Registerbekanntmachung nach dem Umwandlungsgesetz\nNordrhein-Westfalen Amtsgericht Paderborn HRB 7784\nD&L Robotik GmbH – Bad Wünnenberg",
      "type": "Registerbekanntmachung nach dem Umwandlungsgesetz",
      "state": "Nordrhein-Westfalen",
      "amtsgericht": "Amtsgericht Paderborn",
      "registernummer": "HRB 7784",
      "registerart": "HRB",
      "company_name": "D&L Robotik GmbH",
      "company_seat": "Bad Wünnenberg",
      "details": "21.10.2024 (Bekanntmachungsdatum)\n\nNordrhein-Westfalen Amtsgericht Paderborn HRB 7784\nRegisterbekanntmachung nach dem Umwandlungsgesetz 21.10.2024 (Eintragungsdatum)\n\nD&L Robotik GmbH\nGesellschaft mit beschränkter Haftung\nBad Wünnenberg\n\nDie Gesellschaft hat Gläubigern, deren Forderungen vor dieser Bekanntmachung begründet worden sind, Sicherheit zu leisten, soweit sie nicht Befriedigung verlangen können, wenn sie sich binnen sechs Monaten zu diesem Zweck melden.Den Gläubigern der an der Verschmelzung beteiligten Rechtsträger ist, wenn sie binnen sechs Monaten nach dem Tag, an dem die Eintragung der Verschmelzung in das Register des Sitzes desjenigen Rechtsträgers, dessen Gläubiger sie sind, nach § 19 Absatz 3 UmwG als bekanntgemacht gilt, ihren Anspruch nach Grund und Höhe schriftlich anmelden, Sicherheit zu leisten, soweit sie nicht Befriedigung verlangen können. Dieses Recht steht den Gläubigern jedoch nur zu, wenn sie glaubhaft machen, dass durch die Verschmelzung die Erfüllung ihrer Forderung gefährdet wird."
    },
    {
      "date": "2024-10-21",
      "id": "91127",
      "original_text": "Registerbekanntmachung nach dem Umwandlungsgesetz\nNordrhein-Westfalen Amtsgericht Köln HRB 101847\nFinch Properties Investment Partners GmbH – Köln",
      "type": "Registerbekanntmachung nach dem Umwandlungsgesetz",
      "state": "Nordrhein-Westfalen",
      "amtsgericht": "Amtsgericht Köln",
      "registernummer": "HRB 101847",
      "registerart": "HRB",
      "company_name": "Finch Properties Investment Partners GmbH",
      "company_seat": "Köln",
      "details": "21.10.2024 (Bekanntmachungsdatum)\n\nNordrhein-Westfalen Amtsgericht Köln HRB 101847\nRegisterbekanntmachung nach dem Umwandlungsgesetz 21.10.2024 (Eintragungsdatum)\n\nFinch Properties Investment Partners GmbH\nGesellschaft mit beschränkter Haftung\nKöln\n\nDen Gläubigern der an der Verschmelzung beteiligten Rechtsträger ist, wenn sie binnen sechs Monaten nach dem Tag, an dem die Eintragung der Verschmelzung in das Register des Sitzes desjenigen Rechtsträgers, dessen Gläubiger sie sind, nach § 19 Absatz 3 UmwG als bekanntgemacht gilt, ihren Anspruch nach Grund und Höhe schriftlich anmelden, Sicherheit zu leisten, soweit sie nicht Befriedigung verlangen können. Dieses Recht steht den Gläubigern jedoch nur zu, wenn sie glaubhaft machen, dass durch die Verschmelzung die Erfüllung ihrer Forderung gefährdet wird."
    },
    {
      "date": "2024-10-21",
      "id": "91128",
      "original_text": "Löschungsankündigung\nNordrhein-Westfalen Amtsgericht Hagen HRB 10026\nMietwagen Schwelm GmbH – Schwelm",
      "type": "Löschungsankündigung",
      "state": "Nordrhein-Westfalen",
      "amtsgericht": "Amtsgericht Hagen",
      "registernummer": "HRB 10026",
      "registerart": "HRB",
      "company_name": "Mietwagen Schwelm GmbH",
      "company_seat": "Schwelm",
      "details": "21.10.2024 (Bekanntmachungsdatum)\n\nNordrhein-Westfalen Amtsgericht Hagen HRB 10026\nLöschungsankündigung\n\nMietwagen Schwelm GmbH\nGesellschaft mit beschränkter Haftung\nSchwelm\n\nIn obiger Handelsregistersache\nwird bekannt gemacht:\nDas Registergericht beabsichtigt, die im Handelsregister eingetragene Gesellschaft gemäß § 394 I FamFG wegen Vermögenslosigkeit von Amts wegen zu löschen. Gegen diese Verfügung kann Widerspruch eingelegt werden. Die Frist zur Erhebung eines Widerspruchs gegen die beabsichtigte Löschung von Amts wegen ist auf drei Monate festgesetzt.\n\nRechtsbehelfsbelehrung:\nGegen diese Verfügung können Sie Widerspruch einlegen.\n\nDer Widerspruch ist bei dem Amtsgericht Hagen, Heinitzstraße 42, 58097 Hagen schriftlich in deutscher Sprache oder zur Niederschrift der Geschäftsstelle einzulegen. Der Widerspruch kann auch zur Niederschrift der Geschäftsstelle eines jeden Amtsgerichts abgegeben werden.\n\nDer Widerspruch muss spätestens innerhalb der gesetzten Frist bei dem Amtsgericht Hagen eingegangen sein. Dies gilt auch dann, wenn der Widerspruch zur Geschäftsstelle eines anderen Amtsgerichtes abgegeben wurde. Die Frist beginnt mit der Veröffentlichung. Fällt das Ende der Frist auf einen Sonntag, einen allgemeinen Feiertag oder Sonnabend, so endet die Frist mit Ablauf des nächsten Werktages.\n\nDer Widerspruch muss die Bezeichnung der angefochtenen Verfügung sowie die Erklärung erhalten, dass Widerspruch gegen diese Verfügung eingelegt wird. Er ist zu unterzeichnen und soll begründet werden."
    },
    {
      "date": "2024-10-21",
      "id": "91129",
      "original_text": "Einreichung neuer Dokumente\nNordrhein-Westfalen Amtsgericht Dortmund HRB 2783\nContinentale Sachversicherung Aktiengesellschaft – Dortmund",
      "type": "Einreichung neuer Dokumente",
      "state": "Nordrhein-Westfalen",
      "amtsgericht": "Amtsgericht Dortmund",
      "registernummer": "HRB 2783",
      "registerart": "HRB",
      "company_name": "Continentale Sachversicherung Aktiengesellschaft",
      "company_seat": "Dortmund",
      "details": "21.10.2024 (Bekanntmachungsdatum)\n\nNordrhein-Westfalen Amtsgericht Dortmund HRB 2783\nEinreichung neuer Dokumente\n\nContinentale Sachversicherung Aktiengesellschaft\nAktiengesellschaft\nDortmund\n\nDem Registergericht ist eine neue Liste der Mitglieder des Aufsichtsrates eingereicht worden."
    },
    {
      "date": "2024-10-21",
      "id": "91130",
      "original_text": "Registerbekanntmachung nach dem Umwandlungsgesetz\nNordrhein-Westfalen Amtsgericht Gütersloh HRA 8529\nKernbohrtechnik Yener e.K. – Rheda-Wiedenbrück",
      "type": "Registerbekanntmachung nach dem Umwandlungsgesetz",
      "state": "Nordrhein-Westfalen",
      "amtsgericht": "Amtsgericht Gütersloh",
      "registernummer": "HRA 8529",
      "registerart": "HRA",
      "company_name": "Kernbohrtechnik Yener e.K.",
      "company_seat": "Rheda-Wiedenbrück",
      "details": "21.10.2024 (Bekanntmachungsdatum)\n\nNordrhein-Westfalen Amtsgericht Gütersloh HRA 8529\nRegisterbekanntmachung nach dem Umwandlungsgesetz 21.10.2024 (Eintragungsdatum)\n\nKernbohrtechnik Yener e.K.\nEinzelkaufmann / Einzelkauffrau\nRheda-Wiedenbrück\n\nDen Gläubigern der an der Ausgliederung beteiligten Rechtsträger ist, wenn sie binnen sechs Monaten nach dem Tag, an dem die Eintragung der Ausgliederung in das Register des Sitzes desjenigen Rechtsträgers, dessen Gläubiger sie sind, nach § 19 Absatz 3 UmwG als bekanntgemacht gilt, ihren Anspruch nach Grund und Höhe schriftlich anmelden, Sicherheit zu leisten, soweit sie nicht Befriedigung verlangen können. Dieses Recht steht den Gläubigern jedoch nur zu, wenn sie glaubhaft machen, dass durch die Ausgliederung die Erfüllung ihrer Forderung gefährdet wird."
    },
    {
      "date": "2024-10-21",
      "id": "91131",
      "original_text": "Löschungsankündigung\nNordrhein-Westfalen Amtsgericht Dortmund HRB 14765\nGIG Göge Immobiliengesellschaft mit beschränkter Haftung – Dortmund",
      "type": "Löschungsankündigung",
      "state": "Nordrhein-Westfalen",
      "amtsgericht": "Amtsgericht Dortmund",
      "registernummer": "HRB 14765",
      "registerart": "HRB",
      "company_name": "GIG Göge Immobiliengesellschaft mit beschränkter Haftung",
      "company_seat": "Dortmund",
      "details": "21.10.2024 (Bekanntmachungsdatum)\n\nNordrhein-Westfalen Amtsgericht Dortmund HRB 14765\nLöschungsankündigung\n\nGIG Göge Immobiliengesellschaft mit beschränkter Haftung\nGesellschaft mit beschränkter Haftung\nDortmund\n\nDie Veröffentlichung vom 14.10.2024 ist gegenstandslos."
    },
    {
      "date": "2024-10-21",
      "id": "91132",
      "original_text": "Registerbekanntmachung nach dem Umwandlungsgesetz\nNordrhein-Westfalen Amtsgericht Arnsberg VR 40255 früher Amtsgericht Menden\nTurnverein Menden-Schwitten 1908 e.V. – Menden",
      "type": "Registerbekanntmachung nach dem Umwandlungsgesetz",
      "state": "Nordrhein-Westfalen",
      "amtsgericht": "Amtsgericht Arnsberg",
      "registernummer": "VR 40255",
      "registerart": "VR",
      "company_name": "Turnverein Menden-Schwitten 1908 e.V.",
      "company_seat": "Menden",
      "former_amtsgericht": "Menden",
      "details": "21.10.2024 (Bekanntmachungsdatum)\n\nNordrhein-Westfalen Amtsgericht Arnsberg VR 40255 früher Amtsgericht Menden\nRegisterbekanntmachung nach dem Umwandlungsgesetz 21.10.2024 (Eintragungsdatum)\n\nTurnverein Menden-Schwitten 1908 e.V.\neingetragener Verein\nMenden\n\nDen Gläubigern der an der Verschmelzung beteiligten Rechtsträger ist, wenn sie binnen sechs Monaten nach dem Tag, an dem die Eintragung der Verschmelzung in das Register des Sitzes desjenigen Rechtsträgers, dessen Gläubiger sie sind, nach § 19 Absatz 3 UmwG als bekanntgemacht gilt, ihren Anspruch nach Grund und Höhe schriftlich anmelden, Sicherheit zu leisten, soweit sie nicht Befriedigung verlangen können. Dieses Recht steht den Gläubigern jedoch nur zu, wenn sie glaubhaft machen, dass durch die Verschmelzung die Erfüllung ihrer Forderung gefährdet wird."
    },
    {
      "date": "2024-10-21",
      "id": "91133",
      "original_text": "Löschungsankündigung\nNordrhein-Westfalen Amtsgericht Siegburg HRB 16185\nProjektbüro Colloseus Unternehmergesellschaft (haftungsbeschränkt) – Sankt Augustin",
      "type": "Löschungsankündigung",
      "state": "Nordrhein-Westfalen",
      "amtsgericht": "Amtsgericht Siegburg",
      "registernummer": "HRB 16185",
      "registerart": "HRB",
      "company_name": "Projektbüro Colloseus Unternehmergesellschaft (haftungsbeschränkt)",
      "company_seat": "Sankt Augustin",
      "details": "21.10.2024 (Bekanntmachungsdatum)\n\nNordrhein-Westfalen Amtsgericht Siegburg HRB 16185\nLöschungsankündigung\n\nProjektbüro Colloseus Unternehmergesellschaft (haftungsbeschränkt)\nGesellschaft mit beschränkter Haftung\nSankt Augustin\n\nDas Registergericht hat festgestellt, dass der im Handelsregister eingetragene Geschäftsführer aufgrund einer Gewerbeuntersagung nicht befugt ist, dieses Amt auszuüben. Damit handelt es sich bei der Eintragung des Geschäftsführers im Handelsregister um eine unzulässige Eintragung, die nach § 395 FamFG von Amts wegen zu löschen ist.\nEinwände gegen die Löschung sind durch Widerspruch binnen einer Frist von 1 Monat geltend zu machen, andernfalls die Löschung erfolgen wird.\nEinzulegen ist der Widerspruch bei dem Amtsgericht Siegburg, Neue Poststraße 16, 53721 Siegburg, und zwar entweder schriftlich in deutscher Sprache oder mündlich zur Niederschrift der Geschäftsstelle. Der Widerspruch kann auch zur Niederschrift der Geschäftsstelle eines jeden Amtsgerichts abgegeben werden. Der Widerspruch ist binnen der in der Verfügung bestimmten Frist einzulegen. Die Frist ist nur gewahrt, wenn der Widerspruch rechtzeitig bei dem Amtsgericht Siegburg eingeht, auch wenn der Widerspruch zur Niederschrift der Geschäftsstelle eines anderen Amtsgerichts abgegeben wurde. Die Frist beginnt jeweils mit der schriftlichen Bekanntgabe der Verfügung an die Beteiligten. Kann die schriftliche Bekanntgabe an einen Beteiligten nicht bewirkt werden, beginnt die Frist spätestens mit Ablauf von fünf Monaten nach Erlass der Verfügung. Die Bekanntgabe ist entweder durch Zustellung oder am dritten Tage nach Aufgabe zur Post bewirkt.\nSofern die Löschung noch nicht erfolgt ist, kann der Widerspruch auch noch nach Ablauf der Frist eingelegt werden. Fällt das Ende der Frist auf einen Sonnabend, einen Sonntag oder einen allgemeinen Feiertag, endet die Frist mit Ablauf des nächsten Werktages. Der Widerspruch ist zu unterzeichnen. Eine Begründung des Widerspruchs ist nicht vorgeschrieben."
    },
    {
      "date": "2024-10-21",
      "id": "91134",
      "original_text": "Einreichung neuer Dokumente\nNordrhein-Westfalen Amtsgericht Dortmund HRB 23391\nSIBA Fuses GmbH – Lünen",
      "type": "Einreichung neuer Dokumente",
      "state": "Nordrhein-Westfalen",
      "amtsgericht": "Amtsgericht Dortmund",
      "registernummer": "HRB 23391",
      "registerart": "HRB",
      "company_name": "SIBA Fuses GmbH",
      "company_seat": "Lünen",
      "details": "21.10.2024 (Bekanntmachungsdatum)\n\nNordrhein-Westfalen Amtsgericht Dortmund HRB 23391\nEinreichung neuer Dokumente\n\nSIBA Fuses GmbH\nGesellschaft mit beschränkter Haftung\nLünen\n\nDem Registergericht ist eine neue Liste der Mitglieder des Aufsichtsrates eingereicht worden."
    },
    {
      "date": "2024-10-21",
      "id": "91135",
      "original_text": "Registerbekanntmachung nach dem Umwandlungsgesetz\nNordrhein-Westfalen Amtsgericht Köln HRA 37706\nSavorm OHG – Köln",
      "type": "Registerbekanntmachung nach dem Umwandlungsgesetz",
      "state": "Nordrhein-Westfalen",
      "amtsgericht": "Amtsgericht Köln",
      "registernummer": "HRA 37706",
      "registerart": "HRA",
      "company_name": "Savorm OHG",
      "company_seat": "Köln",
      "details": "21.10.2024 (Bekanntmachungsdatum)\n\nNordrhein-Westfalen Amtsgericht Köln HRA 37706\nRegisterbekanntmachung nach dem Umwandlungsgesetz 21.10.2024 (Eintragungsdatum)\n\nSavorm OHG\nOffene Handelsgesellschaft\nKöln\n\nDen Gläubigern der an der formwechselnden Umwandlung beteiligten Rechtsträger ist, wenn sie binnen sechs Monaten nach dem Tag, an dem die Eintragung der formwechselnden Umwandlung in das Register des Sitzes desjenigen Rechtsträgers, dessen Gläubiger sie sind, nach § 19 Absatz 3 UmwG als bekanntgemacht gilt, ihren Anspruch nach Grund und Höhe schriftlich anmelden, Sicherheit zu leisten, soweit sie nicht Befriedigung verlangen können. Dieses Recht steht den Gläubigern jedoch nur zu, wenn sie glaubhaft machen, dass durch die formwechselnden Umwandlung die Erfüllung ihrer Forderung gefährdet wird."
    },
    {
      "date": "2024-10-21",
      "id": "91136",
      "original_text": "Einreichung neuer Dokumente\nNordrhein-Westfalen Amtsgericht Hagen HRB 1\nHagener Straßenbahn Aktiengesellschaft – Hagen",
      "type": "Einreichung neuer Dokumente",
      "state": "Nordrhein-Westfalen",
      "amtsgericht": "Amtsgericht Hagen",
      "registernummer": "HRB 1",
      "registerart": "HRB",
      "company_name": "Hagener Straßenbahn Aktiengesellschaft",
      "company_seat": "Hagen",
      "details": "21.10.2024 (Bekanntmachungsdatum)\n\nNordrhein-Westfalen Amtsgericht Hagen HRB 1\nEinreichung neuer Dokumente\n\nHagener Straßenbahn Aktiengesellschaft\nAktiengesellschaft\nHagen\n\nDem Registergericht ist eine Liste der Mitglieder des Aufsichtsrates eingereicht worden."
    },
    {
      "date": "2024-10-21",
      "id": "91137",
      "original_text": "Registerbekanntmachung nach dem Umwandlungsgesetz\nNordrhein-Westfalen Amtsgericht Dortmund HRB 16098\nCopier Center A & T GmbH – Dortmund",
      "type": "Registerbekanntmachung nach dem Umwandlungsgesetz",
      "state": "Nordrhein-Westfalen",
      "amtsgericht": "Amtsgericht Dortmund",
      "registernummer": "HRB 16098",
      "registerart": "HRB",
      "company_name": "Copier Center A & T GmbH",
      "company_seat": "Dortmund",
      "details": "21.10.2024 (Bekanntmachungsdatum)\n\nNordrhein-Westfalen Amtsgericht Dortmund HRB 16098\nRegisterbekanntmachung nach dem Umwandlungsgesetz 18.10.2024 (Eintragungsdatum)\n\nCopier Center A & T GmbH\nGesellschaft mit beschränkter Haftung\nDortmund\n\nDen Gläubigern der an der Verschmelzung beteiligten Rechtsträger ist, wenn sie binnen sechs Monaten nach dem Tag, an dem die Eintragung der Verschmelzung in das Register des Sitzes desjenigen Rechtsträgers, dessen Gläubiger sie sind, nach § 19 Absatz 3 UmwG als bekanntgemacht gilt, ihren Anspruch nach Grund und Höhe schriftlich anmelden, Sicherheit zu leisten, soweit sie nicht Befriedigung verlangen können. Dieses Recht steht den Gläubigern jedoch nur zu, wenn sie glaubhaft machen, dass durch die Verschmelzung die Erfüllung ihrer Forderung gefährdet wird."
    },
    {
      "date": "2024-10-21",
      "id": "91138",
      "original_text": "Registerbekanntmachung nach dem Umwandlungsgesetz\nNordrhein-Westfalen Amtsgericht Köln HRB 99924\nFinch Properties Cologne 4 Access GmbH – Köln",
      "type": "Registerbekanntmachung nach dem Umwandlungsgesetz",
      "state": "Nordrhein-Westfalen",
      "amtsgericht": "Amtsgericht Köln",
      "registernummer": "HRB 99924",
      "registerart": "HRB",
      "company_name": "Finch Properties Cologne 4 Access GmbH",
      "company_seat": "Köln",
      "details": "21.10.2024 (Bekanntmachungsdatum)\n\nNordrhein-Westfalen Amtsgericht Köln HRB 99924\nRegisterbekanntmachung nach dem Umwandlungsgesetz 21.10.2024 (Eintragungsdatum)\n\nFinch Properties Cologne 4 Access GmbH\nGesellschaft mit beschränkter Haftung\nKöln\n\nDen Gläubigern der an der Verschmelzung beteiligten Rechtsträger ist, wenn sie binnen sechs Monaten nach dem Tag, an dem die Eintragung der Verschmelzung in das Register des Sitzes desjenigen Rechtsträgers, dessen Gläubiger sie sind, nach § 19 Absatz 3 UmwG als bekanntgemacht gilt, ihren Anspruch nach Grund und Höhe schriftlich anmelden, Sicherheit zu leisten, soweit sie nicht Befriedigung verlangen können. Dieses Recht steht den Gläubigern jedoch nur zu, wenn sie glaubhaft machen, dass durch die Verschmelzung die Erfüllung ihrer Forderung gefährdet wird."
    },
    {
      "date": "2024-10-21",
      "id": "91139",
      "original_text": "Registerbekanntmachung nach dem Umwandlungsgesetz\nNordrhein-Westfalen Amtsgericht Köln HRB 120861\nSavorm GmbH – Köln",
      "type": "Registerbekanntmachung nach dem Umwandlungsgesetz",
      "state": "Nordrhein-Westfalen",
      "amtsgericht": "Amtsgericht Köln",
      "registernummer": "HRB 120861",
      "registerart": "HRB",
      "company_name": "Savorm GmbH",
      "company_seat": "Köln",
      "details": "21.10.2024 (Bekanntmachungsdatum)\n\nNordrhein-Westfalen Amtsgericht Köln HRB 120861\nRegisterbekanntmachung nach dem Umwandlungsgesetz 21.10.2024 (Eintragungsdatum)\n\nSavorm GmbH\nGesellschaft mit beschränkter Haftung\nKöln\n\nDen Gläubigern der an der formwechselnden Umwandlung beteiligten Rechtsträger ist, wenn sie binnen sechs Monaten nach dem Tag, an dem die Eintragung der formwechselnden Umwandlung in das Register des Sitzes desjenigen Rechtsträgers, dessen Gläubiger sie sind, nach § 19 Absatz 3 UmwG als bekanntgemacht gilt, ihren Anspruch nach Grund und Höhe schriftlich anmelden, Sicherheit zu leisten, soweit sie nicht Befriedigung verlangen können. Dieses Recht steht den Gläubigern jedoch nur zu, wenn sie glaubhaft machen, dass durch die formwechselnden Umwandlung die Erfüllung ihrer Forderung gefährdet wird."
    },
    {
      "date": "2024-10-21",
      "id": "91140",
      "original_text": "Registerbekanntmachung nach dem Umwandlungsgesetz\nNordrhein-Westfalen Amtsgericht Arnsberg VR 40327 früher Amtsgericht Menden\nDJK (Deutsche Jugendkraft) Saxonia Lendringsen eingetragener Verein – Menden",
      "type": "Registerbekanntmachung nach dem Umwandlungsgesetz",
      "state": "Nordrhein-Westfalen",
      "amtsgericht": "Amtsgericht Arnsberg",
      "registernummer": "VR 40327",
      "registerart": "VR",
      "company_name": "DJK (Deutsche Jugendkraft) Saxonia Lendringsen eingetragener Verein",
      "company_seat": "Menden",
      "former_amtsgericht": "Menden",
      "details": "21.10.2024 (Bekanntmachungsdatum)\n\nNordrhein-Westfalen Amtsgericht Arnsberg VR 40327 früher Amtsgericht Menden\nRegisterbekanntmachung nach dem Umwandlungsgesetz 21.10.2024 (Eintragungsdatum)\n\nDJK (Deutsche Jugendkraft) Saxonia Lendringsen eingetragener Verein\neingetragener Verein\nMenden\n\nDen Gläubigern der an der Verschmelzung beteiligten Rechtsträger ist, wenn sie binnen sechs Monaten nach dem Tag, an dem die Eintragung der Verschmelzung in das Register des Sitzes desjenigen Rechtsträgers, dessen Gläubiger sie sind, nach § 19 Absatz 3 UmwG als bekanntgemacht gilt, ihren Anspruch nach Grund und Höhe schriftlich anmelden, Sicherheit zu leisten, soweit sie nicht Befriedigung verlangen können. Dieses Recht steht den Gläubigern jedoch nur zu, wenn sie glaubhaft machen, dass durch die Verschmelzung die Erfüllung ihrer Forderung gefährdet wird."
    },
    {
      "date": "2024-10-21",
      "id": "91141",
      "original_text": "Sonstige Registerbekanntmachung\nNordrhein-Westfalen Amtsgericht Hagen HRB 10128\nVAMED Klinik Hagen-Ambrock GmbH – Hagen",
      "type": "Sonstige Registerbekanntmachung",
      "state": "Nordrhein-Westfalen",
      "amtsgericht": "Amtsgericht Hagen",
      "registernummer": "HRB 10128",
      "registerart": "HRB",
      "company_name": "VAMED Klinik Hagen-Ambrock GmbH",
      "company_seat": "Hagen",
      "details": "21.10.2024 (Bekanntmachungsdatum)\n\nNordrhein-Westfalen Amtsgericht Hagen HRB 10128\nSonstige Registerbekanntmachung 21.10.2024 (Eintragungsdatum)\n\nVAMED Klinik Hagen-Ambrock GmbH\nGesellschaft mit beschränkter Haftung\nHagen\n\nAls nicht eingetragen wird veröffentlicht: Den Gläubigern der Gesellschaft, deren Forderungen begründet worden sind bevor die Eintragung der Beendigung des Beherrschungs- und Ergebnisabführungsvertrages  in das Handelsregister nach § 10 des Handelsgesetzbuches als bekanntgemacht gilt, hat der andere Vertragsteil Sicherheit zu leisten, wenn sie sich binnen sechs Monaten nach der Bekanntmachung der Eintragung zu diesem Zweck bei ihm melden."
    },
    {
      "date": "2024-10-21",
      "id": "91142",
      "original_text": "Registerbekanntmachung nach dem Umwandlungsgesetz\nNordrhein-Westfalen Amtsgericht Münster HRA 5343\nMaka GmbH & Co. KG – Münster",
      "type": "Registerbekanntmachung nach dem Umwandlungsgesetz",
      "state": "Nordrhein-Westfalen",
      "amtsgericht": "Amtsgericht Münster",
      "registernummer": "HRA 5343",
      "registerart": "HRA",
      "company_name": "Maka GmbH & Co. KG",
      "company_seat": "Münster",
      "details": "21.10.2024 (Bekanntmachungsdatum)\n\nNordrhein-Westfalen Amtsgericht Münster HRA 5343\nRegisterbekanntmachung nach dem Umwandlungsgesetz 21.10.2024 (Eintragungsdatum)\n\nMaka GmbH & Co. KG\nKommanditgesellschaft\nMünster\n\nDen Gläubigern der an der Verschmelzung beteiligten Rechtsträger ist, wenn sie binnen sechs Monaten nach dem Tag, an dem die Eintragung der Verschmelzung in das Register des Sitzes desjenigen Rechtsträgers, dessen Gläubiger sie sind, nach § 19 Absatz 3 UmwG als bekanntgemacht gilt, ihren Anspruch nach Grund und Höhe schriftlich anmelden, Sicherheit zu leisten, soweit sie nicht Befriedigung verlangen können. Dieses Recht steht den Gläubigern jedoch nur zu, wenn sie glaubhaft machen, dass durch die Verschmelzung die Erfüllung ihrer Forderung gefährdet wird."
    },
    {
      "date": "2024-10-21",
      "id": "91143",
      "original_text": "Einreichung neuer Dokumente\nNordrhein-Westfalen Amtsgericht Bonn HRB 8522\nDeutsche Telekom IT GmbH – Bonn",
      "type": "Einreichung neuer Dokumente",
      "state": "Nordrhein-Westfalen",
      "amtsgericht": "Amtsgericht Bonn",
      "registernummer": "HRB 8522",
      "registerart": "HRB",
      "company_name": "Deutsche Telekom IT GmbH",
      "company_seat": "Bonn",
      "details": "21.10.2024 (Bekanntmachungsdatum)\n\nNordrhein-Westfalen Amtsgericht Bonn HRB 8522\nEinreichung neuer Dokumente\n\nDeutsche Telekom IT GmbH\nGesellschaft mit beschränkter Haftung\nBonn\n\nDem Registergericht ist eine neue Liste der Mitglieder des Aufsichtsrates eingereicht worden."
    },
    {
      "date": "2024-10-21",
      "id": "91144",
      "original_text": "Einreichung neuer Dokumente\nNordrhein-Westfalen Amtsgericht Köln HRB 7474\nEUROPA Versicherung Aktiengesellschaft – Köln",
      "type": "Einreichung neuer Dokumente",
      "state": "Nordrhein-Westfalen",
      "amtsgericht": "Amtsgericht Köln",
      "registernummer": "HRB 7474",
      "registerart": "HRB",
      "company_name": "EUROPA Versicherung Aktiengesellschaft",
      "company_seat": "Köln",
      "details": "21.10.2024 (Bekanntmachungsdatum)\n\nNordrhein-Westfalen Amtsgericht Köln HRB 7474\nEinreichung neuer Dokumente\n\nEUROPA Versicherung Aktiengesellschaft\nAktiengesellschaft\nKöln\n\nDem Registergericht ist eine neue Liste der Mitglieder des Aufsichtsrates eingereicht worden."
    },
    {
      "date": "2024-10-21",
      "id": "91145",
      "original_text": "Registerbekanntmachung nach dem Umwandlungsgesetz\nNordrhein-Westfalen Amtsgericht Arnsberg VR 1837\nSG Menden Sauerland Wölfe e.V. – Menden",
      "type": "Registerbekanntmachung nach dem Umwandlungsgesetz",
      "state": "Nordrhein-Westfalen",
      "amtsgericht": "Amtsgericht Arnsberg",
      "registernummer": "VR 1837",
      "registerart": "VR",
      "company_name": "SG Menden Sauerland Wölfe e.V.",
      "company_seat": "Menden",
      "details": "21.10.2024 (Bekanntmachungsdatum)\n\nNordrhein-Westfalen Amtsgericht Arnsberg VR 1837\nRegisterbekanntmachung nach dem Umwandlungsgesetz 21.10.2024 (Eintragungsdatum)\n\nSG Menden Sauerland Wölfe e.V.\neingetragener Verein\nMenden\n\nDen Gläubigern der an der Verschmelzung bzw. Ausgliederung beteiligten Rechtsträger ist, wenn sie binnen sechs Monaten nach dem Tag, an dem die Eintragung der Verschmelzung bzw. der Ausgliederung in das Register des Sitzes desjenigen Rechtsträgers, dessen Gläubiger sie sind, nach § 19 Absatz 3 UmwG als bekanntgemacht gilt, ihren Anspruch nach Grund und Höhe schriftlich anmelden, Sicherheit zu leisten, soweit sie nicht Befriedigung verlangen können. Dieses Recht steht den Gläubigern jedoch nur zu, wenn sie glaubhaft machen, dass durch die Verschmelzung Ausgliederung die Erfüllung ihrer Forderung gefährdet wird."
    },
    {
      "date": "2024-10-21",
      "id": "91146",
      "original_text": "Registerbekanntmachung nach dem Umwandlungsgesetz\nNordrhein-Westfalen Amtsgericht Düsseldorf HRB 88406\nnet service AG – Düsseldorf",
      "type": "Registerbekanntmachung nach dem Umwandlungsgesetz",
      "state": "Nordrhein-Westfalen",
      "amtsgericht": "Amtsgericht Düsseldorf",
      "registernummer": "HRB 88406",
      "registerart": "HRB",
      "company_name": "net service AG",
      "company_seat": "Düsseldorf",
      "details": "21.10.2024 (Bekanntmachungsdatum)\n\nNordrhein-Westfalen Amtsgericht Düsseldorf HRB 88406\nRegisterbekanntmachung nach dem Umwandlungsgesetz 21.10.2024 (Eintragungsdatum)\n\nnet service AG\nAktiengesellschaft\nDüsseldorf\n\nDen Gläubigern der an der Verschmelzung beteiligten Rechtsträger ist, wenn sie binnen sechs Monaten nach dem Tag, an dem die Eintragung der Verschmelzung in das Register des Sitzes desjenigen Rechtsträgers, dessen Gläubiger sie sind, nach § 19 Absatz 3 UmwG als bekanntgemacht gilt, ihren Anspruch nach Grund und Höhe schriftlich anmelden, Sicherheit zu leisten, soweit sie nicht Befriedigung verlangen können. Dieses Recht steht den Gläubigern jedoch nur zu, wenn sie glaubhaft machen, dass durch die Verschmelzung die Erfüllung ihrer Forderung gefährdet wird."
    },
    {
      "date": "2024-10-21",
      "id": "91147",
      "original_text": "Registerbekanntmachung nach dem Umwandlungsgesetz\nNordrhein-Westfalen Amtsgericht Arnsberg VR 40274 früher Amtsgericht Menden\nSportverein Menden 1864 e.V. – Menden",
      "type": "Registerbekanntmachung nach dem Umwandlungsgesetz",
      "state": "Nordrhein-Westfalen",
      "amtsgericht": "Amtsgericht Arnsberg",
      "registernummer": "VR 40274",
      "registerart": "VR",
      "company_name": "Sportverein Menden 1864 e.V.",
      "company_seat": "Menden",
      "former_amtsgericht": "Menden",
      "details": "21.10.2024 (Bekanntmachungsdatum)\n\nNordrhein-Westfalen Amtsgericht Arnsberg VR 40274 früher Amtsgericht Menden\nRegisterbekanntmachung nach dem Umwandlungsgesetz 21.10.2024 (Eintragungsdatum)\n\nSportverein Menden 1864 e.V.\neingetragener Verein\nMenden\n\nDen Gläubigern der an der Ausgliederung beteiligten Rechtsträger ist, wenn sie binnen sechs Monaten nach dem Tag, an dem die Eintragung der Ausgliederung in das Register des Sitzes desjenigen Rechtsträgers, dessen Gläubiger sie sind, nach § 19 Absatz 3 UmwG als bekanntgemacht gilt, ihren Anspruch nach Grund und Höhe schriftlich anmelden, Sicherheit zu leisten, soweit sie nicht Befriedigung verlangen können. Dieses Recht steht den Gläubigern jedoch nur zu, wenn sie glaubhaft machen, dass durch die Ausgliederung die Erfüllung ihrer Forderung gefährdet wird."
    },
    {
      "date": "2024-10-21",
      "id": "91148",
      "original_text": "Löschungsankündigung\nNordrhein-Westfalen Amtsgericht Arnsberg VR 71099 früher Amtsgericht Soest\nInternationaler Musik- und Kulturverein Soest e.V. – Soest",
      "type": "Löschungsankündigung",
      "state": "Nordrhein-Westfalen",
      "amtsgericht": "Amtsgericht Arnsberg",
      "registernummer": "VR 71099",
      "registerart": "VR",
      "company_name": "Internationaler Musik- und Kulturverein Soest e.V.",
      "company_seat": "Soest",
      "former_amtsgericht": "Soest",
      "details": "21.10.2024 (Bekanntmachungsdatum)\n\nNordrhein-Westfalen Amtsgericht Arnsberg VR 71099 früher Amtsgericht Soest\nLöschungsankündigung\n\nInternationaler Musik- und Kulturverein Soest e.V.\neingetragener Verein\nSoest\n\nDas Registergericht beabsichtigt, den Verein wegen Wegfalls sämtlicher Mitglieder gem. § 395 FamFG zu löschen. Die Frist zur Erhebung eines Widerspruchs wird auf einen Monat festgesetzt.\nRechtsbehelfsbelehrung:\nGegen diese Verfügung kann Widerspruch eingelegt werden.\nDer Widerspruch ist bei dem Amtsgericht Arnsberg, Eichholzstraße 4, 59821 Arnsberg, schriftlich in deutscher Sprache oder zur Niederschrift der Geschäftsstelle einzulegen. Der Widerspruch kann auch zur Niederschrift der Geschäftsstelle eines jeden Amtsgerichtes abgegeben werden.\nDie Einlegung ist auch durch Übertragung eins elektronischen Dokuments an die elektronische Poststelle des Gerichts möglich. Das elektronische Dokument muss für die Bearbeitung durch das Gericht geeignet und mit einer qualifizierten elektronischen Signatur der verantwortenden Person versehen sein oder von der verantwortenden Person signiert und auf einem sicheren Übermittlungsweg gemäß § 130a ZPO nach näherer Maßgabe der Verordnung über die technischen Rahmenbedingungen des elektronischen Rechtsverkehrs und über das besondere elektronische Behördenpostfach (BGBl. I, S.3803) eingereicht werden. Weitere Informationen erhalten Sie auf der Internetseite www.justiz.de.\nDer Widerspruch muss spätestens innerhalb der gesetzten Frist bei dem Amtsgericht Arnsberg eingegangen sein. Dies gilt auch dann, wenn der Widerspruch zur Niederschrift der Geschäftsstelle eines anderen Amtsgerichts abgegeben wurde. Die Frist beginnt mit der Veröffentlichung. Fällt das Ende der Frist auf einen Sonntag, einen allgemeinen Feiertag oder Sonnabend, so endet die Frist mit Ablauf des nächsten Werktages.\nDer Widerspruch muss die Bezeichnung der angefochtenen Verfügung sowie die Erklärung enthalten, dass Widerspruch gegen diese Verfügung eingelegt wird. Er ist zu unterzeichnen und soll begründet werden."
    },
    {
      "date": "2024-10-21",
      "id": "91149",
      "original_text": "Sonstige Registerbekanntmachung\nNordrhein-Westfalen Amtsgericht Köln HRB 103180\nAdverio Pharma GmbH – Leverkusen",
      "type": "Sonstige Registerbekanntmachung",
      "state": "Nordrhein-Westfalen",
      "amtsgericht": "Amtsgericht Köln",
      "registernummer": "HRB 103180",
      "registerart": "HRB",
      "company_name": "Adverio Pharma GmbH",
      "company_seat": "Leverkusen",
      "details": "21.10.2024 (Bekanntmachungsdatum)\n\nNordrhein-Westfalen Amtsgericht Köln HRB 103180\nSonstige Registerbekanntmachung 21.10.2024 (Eintragungsdatum)\n\nAdverio Pharma GmbH\nGesellschaft mit beschränkter Haftung\nLeverkusen\n\nAls nicht eingetragen wird veröffentlicht: Den Gläubigern der Gesellschaft, deren Forderungen begründet worden sind bevor die Eintragung der Beendigung des Beherrschungsvertrages  in das Handelsregister nach § 10 des Handelsgesetzbuches als bekanntgemacht gilt, hat der andere Vertragsteil Sicherheit zu leisten, wenn sie sich binnen sechs Monaten nach der Bekanntmachung der Eintragung zu diesem Zweck bei ihm melden."
    },
    {
      "date": "2024-10-21",
      "id": "91150",
      "original_text": "Registerbekanntmachung nach dem Umwandlungsgesetz\nNordrhein-Westfalen Amtsgericht Dortmund HRB 36402\nTerra M Bau GmbH – Dortmund",
      "type": "Registerbekanntmachung nach dem Umwandlungsgesetz",
      "state": "Nordrhein-Westfalen",
      "amtsgericht": "Amtsgericht Dortmund",
      "registernummer": "HRB 36402",
      "registerart": "HRB",
      "company_name": "Terra M Bau GmbH",
      "company_seat": "Dortmund",
      "details": "21.10.2024 (Bekanntmachungsdatum)\n\nNordrhein-Westfalen Amtsgericht Dortmund HRB 36402\nRegisterbekanntmachung nach dem Umwandlungsgesetz 21.10.2024 (Eintragungsdatum)\n\nTerra M Bau GmbH\nGesellschaft mit beschränkter Haftung\nDortmund\n\nDen Gläubigern der an der Verschmelzung beteiligten Rechtsträger ist, wenn sie binnen sechs Monaten nach dem Tag, an dem die Eintragung der Verschmelzung in das Register des Sitzes desjenigen Rechtsträgers, dessen Gläubiger sie sind, nach § 19 Absatz 3 UmwG als bekanntgemacht gilt, ihren Anspruch nach Grund und Höhe schriftlich anmelden, Sicherheit zu leisten, soweit sie nicht Befriedigung verlangen können. Dieses Recht steht den Gläubigern jedoch nur zu, wenn sie glaubhaft machen, dass durch die Verschmelzung die Erfüllung ihrer Forderung gefährdet wird."
    },
    {
      "date": "2024-10-21",
      "id": "91151",
      "original_text": "Löschungsankündigung\nThüringen Amtsgericht Jena HRB 510152\nDie Finanzärzte UG (haftungsbeschränkt) – Gera",
      "type": "Löschungsankündigung",
      "state": "Thüringen",
      "amtsgericht": "Amtsgericht Jena",
      "registernummer": "HRB 510152",
      "registerart": "HRB",
      "company_name": "Die Finanzärzte UG (haftungsbeschränkt)",
      "company_seat": "Gera",
      "details": "21.10.2024 (Bekanntmachungsdatum)\n\nThüringen Amtsgericht Jena HRB 510152\nLöschungsankündigung\n\nDie Finanzärzte UG (haftungsbeschränkt)\nGesellschaft mit beschränkter Haftung\nGera\n\nDas Registergericht beabsichtigt, die im Handelsregister eingetragene Gesellschaft wegen Vermögenslosigkeit nach § 394 FamFG von Amts wegen zu löschen. Die Frist zur Erhebung eines Widerspruchs gegen die beabsichtigte Löschung wird auf 6 Wochen festgesetzt."
    },
    {
      "date": "2024-10-21",
      "id": "91152",
      "original_text": "Registerbekanntmachung nach dem Umwandlungsgesetz\nThüringen Amtsgericht Jena HRB 109350\nEMTELLE GmbH – Erfurt",
      "type": "Registerbekanntmachung nach dem Umwandlungsgesetz",
      "state": "Thüringen",
      "amtsgericht": "Amtsgericht Jena",
      "registernummer": "HRB 109350",
      "registerart": "HRB",
      "company_name": "EMTELLE GmbH",
      "company_seat": "Erfurt",
      "details": "21.10.2024 (Bekanntmachungsdatum)\n\nThüringen Amtsgericht Jena HRB 109350\nRegisterbekanntmachung nach dem Umwandlungsgesetz 21.10.2024 (Eintragungsdatum)\n\nEMTELLE GmbH\nGesellschaft mit beschränkter Haftung\nErfurt\n\nNicht eingetragen: Den Gläubigern der an der Verschmelzung beteiligten Rechtsträger, ist wenn sie binnen sechs Monaten nach dem Tag, an dem die Eintragung der Verschmelzung in das Register des Sitzes desjenigen Rechtsträgers, dessen Gläubiger sie sind,  nach § 19 Abs. 3 UmwG als bekanntgemacht gilt, ihren Anspruch nach Grund und Höhe schriftlich anmelden, Sicherheit zu leisten, soweit sie nicht Befriedigung verlangen können. Dieses Recht steht ihnen jedoch nur zu, wenn sie glaubhaft machen, daß durch die Verschmelzung die Erfüllung ihrer Forderung gefährdet wird."
    },
    {
      "date": "2024-10-21",
      "id": "91153",
      "original_text": "Einreichung neuer Dokumente\nThüringen Amtsgericht Jena HRB 101529\nFlughafen Erfurt GmbH – Erfurt",
      "type": "Einreichung neuer Dokumente",
      "state": "Thüringen",
      "amtsgericht": "Amtsgericht Jena",
      "registernummer": "HRB 101529",
      "registerart": "HRB",
      "company_name": "Flughafen Erfurt GmbH",
      "company_seat": "Erfurt",
      "details": "21.10.2024 (Bekanntmachungsdatum)\n\nThüringen Amtsgericht Jena HRB 101529\nEinreichung neuer Dokumente 21.10.2024 (Eintragungsdatum)\n\nFlughafen Erfurt GmbH\nGesellschaft mit beschränkter Haftung\nErfurt\n\nBekanntmachung gem. § 52 Abs. 3 Satz 2 GmbHG: Aufgrund einer Veränderung in den Personen der Aufsichtsratsmitglieder ist durch die Geschäftsführer eine neue Liste zum Handelsregister eingereicht worden."
    },
    {
      "date": "2024-10-21",
      "id": "91154",
      "original_text": "Registerbekanntmachung nach dem Umwandlungsgesetz\nSachsen Amtsgericht Dresden HRB 22959\nAgrargesellschaft Ruppendorf AG – Klingenberg",
      "type": "Registerbekanntmachung nach dem Umwandlungsgesetz",
      "state": "Sachsen",
      "amtsgericht": "Amtsgericht Dresden",
      "registernummer": "HRB 22959",
      "registerart": "HRB",
      "company_name": "Agrargesellschaft Ruppendorf AG",
      "company_seat": "Klingenberg",
      "details": "21.10.2024 (Bekanntmachungsdatum)\n\nSachsen Amtsgericht Dresden HRB 22959\nRegisterbekanntmachung nach dem Umwandlungsgesetz 17.10.2024 (Eintragungsdatum)\n\nAgrargesellschaft Ruppendorf AG\nAktiengesellschaft\nKlingenberg\n\nGemäß § 61 UmwG wird bekanntgemacht, dass der Entwurf eines Verschmelzungsvertrages zwischen der Gesellschaft als dem übernehmenden Rechtsträger und der SZA-Agrarprodukte GmbH Eberbach mit Sitz in Klingenberg (Amtsgericht Dresden, HRB 11995) als dem übertragenden Rechtsträger eingereicht wurde."
    },
    {
      "date": "2024-10-21",
      "id": "91155",
      "original_text": "Löschungsankündigung\nHessen Amtsgericht Offenbach am Main HRB 42972\nIdealbau GmbH – Offenbach am Main",
      "type": "Löschungsankündigung",
      "state": "Hessen",
      "amtsgericht": "Amtsgericht Offenbach am Main",
      "registernummer": "HRB 42972",
      "registerart": "HRB",
      "company_name": "Idealbau GmbH",
      "company_seat": "Offenbach am Main",
      "details": "21.10.2024 (Bekanntmachungsdatum)\n\nHessen Amtsgericht Offenbach am Main HRB 42972\nLöschungsankündigung\n\nIdealbau GmbH\nGesellschaft mit beschränkter Haftung\nOffenbach am Main\n\nDas Registergericht beabsichtigt die im Handelsregister eingetragene Gesellschaft von Amts wegen nach § 394 FamFG zu löschen. Die Frist zur Erhebung eines Widerspruchs gegen die beabsichtigte Löschung wird auf 3 Monate festgesetzt."
    },
    {
      "date": "2024-10-21",
      "id": "91156",
      "original_text": "Registerbekanntmachung nach dem Umwandlungsgesetz\nHessen Amtsgericht Wetzlar HRB 4086\nDornseiff GmbH – Wetzlar",
      "type": "Registerbekanntmachung nach dem Umwandlungsgesetz",
      "state": "Hessen",
      "amtsgericht": "Amtsgericht Wetzlar",
      "registernummer": "HRB 4086",
      "registerart": "HRB",
      "company_name": "Dornseiff GmbH",
      "company_seat": "Wetzlar",
      "details": "21.10.2024 (Bekanntmachungsdatum)\n\nHessen Amtsgericht Wetzlar HRB 4086\nRegisterbekanntmachung nach dem Umwandlungsgesetz 20.10.2024 (Eintragungsdatum)\n\nDornseiff GmbH\nGesellschaft mit beschränkter Haftung\nWetzlar\n\nDen Gläubigern der an der Verschmelzung beteiligten Rechtsträger ist, wenn sie binnen sechs Monaten nach dem Tag, an dem die Eintragung der Verschmelzung in das Register des Sitzes desjenigen Rechtsträgers, dessen Gläubiger sie sind, nach § 19 Absatz 3 UmwG bekannt gemacht worden ist, ihren Anspruch nach Grund und Höhe schriftlich anmelden, Sicherheit zu leisten, soweit sie nicht Befriedigung verlangen können. Dieses Recht steht den Gläubigern jedoch nur zu, wenn sie glaubhaft machen, dass durch die Verschmelzung die Erfüllung ihrer Forderung gefährdet wird."
    },
    {
      "date": "2024-10-21",
      "id": "91157",
      "original_text": "Sonstige Registerbekanntmachung\nHessen Amtsgericht Marburg VR 5637\nwir hoch vier Gemeinschaft – Marburg",
      "type": "Sonstige Registerbekanntmachung",
      "state": "Hessen",
      "amtsgericht": "Amtsgericht Marburg",
      "registernummer": "VR 5637",
      "registerart": "VR",
      "company_name": "wir hoch vier Gemeinschaft",
      "company_seat": "Marburg",
      "details": "21.10.2024 (Bekanntmachungsdatum)\n\nHessen Amtsgericht Marburg VR 5637\nSonstige Registerbekanntmachung 21.10.2024 (Eintragungsdatum)\n\nwir hoch vier Gemeinschaft\neingetragener Verein\nMarburg\n\nDer Verein ist aufgelöst."
    },
    {
      "date": "2024-10-21",
      "id": "91158",
      "original_text": "Sonstige Registerbekanntmachung\nHessen Amtsgericht Bad Hersfeld VR 1873\nBürger Forum Bebra e.V. – Bebra",
      "type": "Sonstige Registerbekanntmachung",
      "state": "Hessen",
      "amtsgericht": "Amtsgericht Bad Hersfeld",
      "registernummer": "VR 1873",
      "registerart": "VR",
      "company_name": "Bürger Forum Bebra e.V.",
      "company_seat": "Bebra",
      "details": "21.10.2024 (Bekanntmachungsdatum)\n\nHessen Amtsgericht Bad Hersfeld VR 1873\nSonstige Registerbekanntmachung 21.10.2024 (Eintragungsdatum)\n\nBürger Forum Bebra e.V.\neingetragener Verein\nBebra\n\nDer Verein ist aufgelöst."
    },
    {
      "date": "2024-10-21",
      "id": "91159",
      "original_text": "Einreichung neuer Dokumente\nHessen Amtsgericht Frankfurt am Main HRB 40601\nDeka Investment GmbH – Frankfurt am Main",
      "type": "Einreichung neuer Dokumente",
      "state": "Hessen",
      "amtsgericht": "Amtsgericht Frankfurt am Main",
      "registernummer": "HRB 40601",
      "registerart": "HRB",
      "company_name": "Deka Investment GmbH",
      "company_seat": "Frankfurt am Main",
      "details": "21.10.2024 (Bekanntmachungsdatum)\n\nHessen Amtsgericht Frankfurt am Main HRB 40601\nEinreichung neuer Dokumente 16.10.2024 (Eintragungsdatum)\n\nDeka Investment GmbH\nGesellschaft mit beschränkter Haftung\nFrankfurt am Main\n\nDurch eine Änderung in den Personen der Aufsichtsratsmitglieder ist eine Liste der Mitglieder des Aufsichtsrates zum Handelsregister eingereicht worden."
    },
    {
      "date": "2024-10-21",
      "id": "91160",
      "original_text": "Einreichung neuer Dokumente\nHessen Amtsgericht Offenbach am Main HRB 5389\nStadtwerke Mühlheim am Main, Gesellschaft mit beschränkter Haftung – Mühlheim am Main",
      "type": "Einreichung neuer Dokumente",
      "state": "Hessen",
      "amtsgericht": "Amtsgericht Offenbach am Main",
      "registernummer": "HRB 5389",
      "registerart": "HRB",
      "company_name": "Stadtwerke Mühlheim am Main, Gesellschaft mit beschränkter Haftung",
      "company_seat": "Mühlheim am Main",
      "details": "21.10.2024 (Bekanntmachungsdatum)\n\nHessen Amtsgericht Offenbach am Main HRB 5389\nEinreichung neuer Dokumente 21.10.2024 (Eintragungsdatum)\n\nStadtwerke Mühlheim am Main, Gesellschaft mit beschränkter Haftung\nGesellschaft mit beschränkter Haftung\nMühlheim am Main\n\nDurch eine Änderung in den Personen der Aufsichtsratsmitglieder ist eine Liste der Mitglieder des Aufsichtsrates zum Handelsregister eingereicht worden."
    },
    {
      "date": "2024-10-21",
      "id": "91161",
      "original_text": "Einreichung neuer Dokumente\nHessen Amtsgericht Hanau HRB 94473\nNORMA Group SE – Maintal",
      "type": "Einreichung neuer Dokumente",
      "state": "Hessen",
      "amtsgericht": "Amtsgericht Hanau",
      "registernummer": "HRB 94473",
      "registerart": "HRB",
      "company_name": "NORMA Group SE",
      "company_seat": "Maintal",
      "details": "21.10.2024 (Bekanntmachungsdatum)\n\nHessen Amtsgericht Hanau HRB 94473\nEinreichung neuer Dokumente\n\nNORMA Group SE\nEuropäische Aktiengesellschaft (SE)\nMaintal\n\nDurch eine Änderung in den Personen der Aufsichtsratsmitglieder ist eine Liste der Mitglieder des Aufsichtsrates zum Handelsregister eingereicht worden."
    },
    {
      "date": "2024-10-21",
      "id": "91162",
      "original_text": "Löschungsankündigung\nHessen Amtsgericht Wiesbaden HRA 8588\nCRED Consulting for Real Estate Development UG (haftungsbeschränkt) & Co.KG – Idstein",
      "type": "Löschungsankündigung",
      "state": "Hessen",
      "amtsgericht": "Amtsgericht Wiesbaden",
      "registernummer": "HRA 8588",
      "registerart": "HRA",
      "company_name": "CRED Consulting for Real Estate Development UG (haftungsbeschränkt) & Co.KG",
      "company_seat": "Idstein",
      "details": "21.10.2024 (Bekanntmachungsdatum)\n\nHessen Amtsgericht Wiesbaden HRA 8588\nLöschungsankündigung\n\nCRED Consulting for Real Estate Development UG (haftungsbeschränkt) & Co.KG\nKommanditgesellschaft\nIdstein\n\nDas Registergericht beabsichtigt die im Handelsregister eingetragene Firma von Amts wegen nach § 394 FamFG zu löschen. Die Frist zur Erhebung eines Widerspruchs gegen die beabsichtigte Löschung wird auf 3 Monate festgesetzt."
    },
    {
      "date": "2024-10-21",
      "id": "91163",
      "original_text": "Sonstige Registerbekanntmachung\nHessen Amtsgericht Bad Hersfeld HRB 3244\nBickhardt Bau SE – Kirchheim",
      "type": "Sonstige Registerbekanntmachung",
      "state": "Hessen",
      "amtsgericht": "Amtsgericht Bad Hersfeld",
      "registernummer": "HRB 3244",
      "registerart": "HRB",
      "company_name": "Bickhardt Bau SE",
      "company_seat": "Kirchheim",
      "details": "21.10.2024 (Bekanntmachungsdatum)\n\nHessen Amtsgericht Bad Hersfeld HRB 3244\nSonstige Registerbekanntmachung 20.10.2024 (Eintragungsdatum)\n\nBickhardt Bau SE\nEuropäische Aktiengesellschaft (SE)\nKirchheim\n\nDurch eine Änderung in den Personen der Aufsichtsratsmitglieder ist eine Liste der Mitglieder des Aufsichtsrates zum Handelsregister eingereicht worden."
    },
    {
      "date": "2024-10-21",
      "id": "91164",
      "original_text": "Registerbekanntmachung nach dem Umwandlungsgesetz\nHessen Amtsgericht Gießen HRB 11749\nITM Technik GmbH – Alsfeld",
      "type": "Registerbekanntmachung nach dem Umwandlungsgesetz",
      "state": "Hessen",
      "amtsgericht": "Amtsgericht Gießen",
      "registernummer": "HRB 11749",
      "registerart": "HRB",
      "company_name": "ITM Technik GmbH",
      "company_seat": "Alsfeld",
      "details": "21.10.2024 (Bekanntmachungsdatum)\n\nHessen Amtsgericht Gießen HRB 11749\nRegisterbekanntmachung nach dem Umwandlungsgesetz 19.10.2024 (Eintragungsdatum)\n\nITM Technik GmbH\nGesellschaft mit beschränkter Haftung\nAlsfeld\n\nDen Gläubigern der an der Ausgliederung beteiligten Rechtsträger ist, wenn sie binnen sechs Monaten nach dem Tag, an dem die Eintragung der Ausgliederung in das Register des Sitzes desjenigen Rechtsträgers, dessen Gläubiger sie sind, nach §§ 125, 19 Absatz 3 UmwG bekannt gemacht worden ist, ihren Anspruch nach Grund und Höhe schriftlich anmelden, Sicherheit zu leisten, soweit sie nicht Befriedigung verlangen können. Dieses Recht steht den Gläubigern jedoch nur zu, wenn sie glaubhaft machen, dass durch die Ausgliederung die Erfüllung ihrer Forderung gefährdet wird."
    },
    {
      "date": "2024-10-21",
      "id": "91165",
      "original_text": "Registerbekanntmachung nach dem Umwandlungsgesetz\nHessen Amtsgericht Frankfurt am Main HRB 107046\nUBS Europe SE – Frankfurt am Main",
      "type": "Registerbekanntmachung nach dem Umwandlungsgesetz",
      "state": "Hessen",
      "amtsgericht": "Amtsgericht Frankfurt am Main",
      "registernummer": "HRB 107046",
      "registerart": "HRB",
      "company_name": "UBS Europe SE",
      "company_seat": "Frankfurt am Main",
      "details": "21.10.2024 (Bekanntmachungsdatum)\n\nHessen Amtsgericht Frankfurt am Main HRB 107046\nRegisterbekanntmachung nach dem Umwandlungsgesetz 21.10.2024 (Eintragungsdatum)\n\nUBS Europe SE\nEuropäische Aktiengesellschaft (SE)\nFrankfurt am Main\n\nDen Gläubigern der an der grenzüberschreitenden Verschmelzung beteiligten übernehmenden Rechtsträger ist, wenn sie binnen sechs Monaten nach dem Tag, an dem die Eintragung der Verschmelzung in das Register des Sitzes desjenigen Rechtsträgers, dessen Gläubiger sie sind, nach § 19 Absatz 3 UmwG als bekanntgemacht gilt, ihren Anspruch nach Grund und Höhe schriftlich anmelden, Sicherheit zu leisten, soweit sie nicht Befriedigung verlangen können.\n\nDieses Recht steht den Gläubigern jedoch nur zu, wenn sie glaubhaft machen, dass durch die Verschmelzung die Erfüllung ihrer Forderung gefährdet wird."
    },
    {
      "date": "2024-10-21",
      "id": "91166",
      "original_text": "Sonstige Registerbekanntmachung\nHessen Amtsgericht Limburg VR 955\nFörderverein der Fachschule für Wirtschaft/Fachrichtung Catering, Systemgastronomie und Gemeinschaftsverpflegung CAT & ACT – Limburg a. d. Lahn",
      "type": "Sonstige Registerbekanntmachung",
      "state": "Hessen",
      "amtsgericht": "Amtsgericht Limburg",
      "registernummer": "VR 955",
      "registerart": "VR",
      "company_name": "Förderverein der Fachschule für Wirtschaft/Fachrichtung Catering, Systemgastronomie und Gemeinschaftsverpflegung CAT & ACT",
      "company_seat": "Limburg a. d. Lahn",
      "details": "21.10.2024 (Bekanntmachungsdatum)\n\nHessen Amtsgericht Limburg VR 955\nSonstige Registerbekanntmachung 21.10.2024 (Eintragungsdatum)\n\nFörderverein der Fachschule für Wirtschaft/Fachrichtung Catering, Systemgastronomie und Gemeinschaftsverpflegung CAT & ACT\neingetragener Verein\nLimburg a. d. Lahn\n\nDie Mitgliederversammlung vom 08.07.2024 hat die Auflösung des Vereins beschlossen."
    },
    {
      "date": "2024-10-21",
      "id": "91167",
      "original_text": "Löschungsankündigung\nHessen Amtsgericht Offenbach am Main HRB 53932\nTB Dienstleistungs-GmbH – Dreieich",
      "type": "Löschungsankündigung",
      "state": "Hessen",
      "amtsgericht": "Amtsgericht Offenbach am Main",
      "registernummer": "HRB 53932",
      "registerart": "HRB",
      "company_name": "TB Dienstleistungs-GmbH",
      "company_seat": "Dreieich",
      "details": "21.10.2024 (Bekanntmachungsdatum)\n\nHessen Amtsgericht Offenbach am Main HRB 53932\nLöschungsankündigung\n\nTB Dienstleistungs-GmbH\nGesellschaft mit beschränkter Haftung\nDreieich\n\nDas Registergericht beabsichtigt die im Handelsregister eingetragene Gesellschaft von Amts wegen nach § 394 FamFG zu löschen. Die Frist zur Erhebung eines Widerspruchs gegen die beabsichtigte Löschung wird auf 3 Monate festgesetzt."
    },
    {
      "date": "2024-10-21",
      "id": "91168",
      "original_text": "Registerbekanntmachung nach dem Umwandlungsgesetz\nHessen Amtsgericht Gießen HRA 5471\nTugay Maden e. K. – Alsfeld",
      "type": "Registerbekanntmachung nach dem Umwandlungsgesetz",
      "state": "Hessen",
      "amtsgericht": "Amtsgericht Gießen",
      "registernummer": "HRA 5471",
      "registerart": "HRA",
      "company_name": "Tugay Maden e. K.",
      "company_seat": "Alsfeld",
      "details": "21.10.2024 (Bekanntmachungsdatum)\n\nHessen Amtsgericht Gießen HRA 5471\nRegisterbekanntmachung nach dem Umwandlungsgesetz 19.10.2024 (Eintragungsdatum)\n\nTugay Maden e. K.\nEinzelkaufmann / Einzelkauffrau\nAlsfeld\n\nDen Gläubigern der an der Ausgliederung beteiligten Rechtsträger ist, wenn sie binnen sechs Monaten nach dem Tag, an dem die Eintragung der Ausgliederung in das Register des Sitzes desjenigen Rechtsträgers, dessen Gläubiger sie sind, nach §§ 125, 19 Absatz 3 UmwG bekannt gemacht worden ist, ihren Anspruch nach Grund und Höhe schriftlich anmelden, Sicherheit zu leisten, soweit sie nicht Befriedigung verlangen können. Dieses Recht steht den Gläubigern jedoch nur zu, wenn sie glaubhaft machen, dass durch die Ausgliederung die Erfüllung ihrer Forderung gefährdet wird."
    }
  ]
}