{
  "date": "2024-10-12",
  "date_of_scrape": "2024-11-26T21:46:41.619Z",
  "tool_version": "0.1.0",
  "number_of_announcements": 18,
  "announcements": [
    {
      "date": "2024-10-12",
      "original_text": "Löschungsankündigung\nBayern Amtsgericht München HRB 199822\nAsphaltbau München GmbH – München",
      "type": "Löschungsankündigung",
      "state": "Bayern",
      "amtsgericht": "Amtsgericht München",
      "registernummer": "HRB 199822",
      "registerart": "HRB",
      "company_name": "Asphaltbau München GmbH",
      "company_seat": "München",
      "details": "12.10.2024 (Bekanntmachungsdatum)\n\nBayern Amtsgericht München HRB 199822\nLöschungsankündigung 11.10.2024 (Eintragungsdatum)\n\nAsphaltbau München GmbH\nGesellschaft mit beschränkter Haftung\nMünchen\n\nDas Registergericht beabsichtigt, die im Handelsregister eingetragene Gesellschaft wegen Vermögenslosigkeit von Amts wegen nach § 394 FamFG zu löschen. Die Frist zur Erhebung eines Widerspruchs ist auf drei Monate festgesetzt."
    },
    {
      "date": "2024-10-12",
      "original_text": "Löschungsankündigung\nBayern Amtsgericht München HRB 226580\nAutoMaster München UG (haftungsbeschränkt) – München",
      "type": "Löschungsankündigung",
      "state": "Bayern",
      "amtsgericht": "Amtsgericht München",
      "registernummer": "HRB 226580",
      "registerart": "HRB",
      "company_name": "AutoMaster München UG (haftungsbeschränkt)",
      "company_seat": "München",
      "details": "12.10.2024 (Bekanntmachungsdatum)\n\nBayern Amtsgericht München HRB 226580\nLöschungsankündigung\n\nAutoMaster München UG (haftungsbeschränkt)\nGesellschaft mit beschränkter Haftung\nMünchen\n\nDas Registergericht beabsichtigt, die im Handelsregister eingetragene Gesellschaft wegen Vermögenslosigkeit von Amts wegen nach § 394 FamFG zu löschen. Die Frist zur Erhebung eines Widerspruchs ist auf drei Monate festgesetzt."
    },
    {
      "date": "2024-10-12",
      "original_text": "Löschungsankündigung\nBayern Amtsgericht München HRB 147527\nAyiko Europe GmbH – München",
      "type": "Löschungsankündigung",
      "state": "Bayern",
      "amtsgericht": "Amtsgericht München",
      "registernummer": "HRB 147527",
      "registerart": "HRB",
      "company_name": "Ayiko Europe GmbH",
      "company_seat": "München",
      "details": "12.10.2024 (Bekanntmachungsdatum)\n\nBayern Amtsgericht München HRB 147527\nLöschungsankündigung 11.10.2024 (Eintragungsdatum)\n\nAyiko Europe GmbH\nGesellschaft mit beschränkter Haftung\nMünchen\n\nDas Registergericht beabsichtigt, die im Handelsregister eingetragene Gesellschaft wegen Vermögenslosigkeit von Amts wegen nach § 394 FamFG zu löschen. Die Frist zur Erhebung eines Widerspruchs ist auf drei Monate festgesetzt."
    },
    {
      "date": "2024-10-12",
      "original_text": "Registerbekanntmachung nach dem Umwandlungsgesetz\nBayern Amtsgericht München HRB 294529\nBrainground GmbH – München",
      "type": "Registerbekanntmachung nach dem Umwandlungsgesetz",
      "state": "Bayern",
      "amtsgericht": "Amtsgericht München",
      "registernummer": "HRB 294529",
      "registerart": "HRB",
      "company_name": "Brainground GmbH",
      "company_seat": "München",
      "details": "12.10.2024 (Bekanntmachungsdatum)\n\nBayern Amtsgericht München HRB 294529\nRegisterbekanntmachung nach dem Umwandlungsgesetz 11.10.2024 (Eintragungsdatum)\n\nBrainground GmbH\nGesellschaft mit beschränkter Haftung\nMünchen\n\nDen Gläubigern der an der Verschmelzung beteiligten Rechtsträger ist, wenn sie binnen sechs Monaten nach dem Tag, an dem die Eintragung der Verschmelzung in das Register des Sitzes desjenigen Rechtsträgers, dessen Gläubiger sie sind, nach § 19 Abs. 3 UmwG als bekannt gemacht gilt, ihren Anspruch nach Grund und Höhe schriftlich anmelden, Sicherheit zu leisten, soweit sie nicht Befriedigung verlangen können. Dieses Recht steht den Gläubigern jedoch nur zu, wenn sie glaubhaft machen, dass durch die Verschmelzung die Erfüllung ihrer Forderung gefährdet wird."
    },
    {
      "date": "2024-10-12",
      "original_text": "Registerbekanntmachung nach dem Umwandlungsgesetz\nBayern Amtsgericht Nürnberg HRB 27179\nCosmo Consult GmbH – Nürnberg",
      "type": "Registerbekanntmachung nach dem Umwandlungsgesetz",
      "state": "Bayern",
      "amtsgericht": "Amtsgericht Nürnberg",
      "registernummer": "HRB 27179",
      "registerart": "HRB",
      "company_name": "Cosmo Consult GmbH",
      "company_seat": "Nürnberg",
      "details": "12.10.2024 (Bekanntmachungsdatum)\n\nBayern Amtsgericht Nürnberg HRB 27179\nRegisterbekanntmachung nach dem Umwandlungsgesetz 11.10.2024 (Eintragungsdatum)\n\nCosmo Consult GmbH\nGesellschaft mit beschränkter Haftung\nNürnberg\n\nDen Gläubigern der an der Verschmelzung beteiligten Rechtsträger ist, wenn sie binnen sechs Monaten nach dem Tag, an dem die Eintragung der Verschmelzung in das Register des Sitzes desjenigen Rechtsträgers, dessen Gläubiger sie sind, nach § 19 Abs. 3 UmwG als bekannt gemacht gilt, ihren Anspruch nach Grund und Höhe schriftlich anmelden, Sicherheit zu leisten, soweit sie nicht Befriedigung verlangen können. Dieses Recht steht den Gläubigern jedoch nur zu, wenn sie glaubhaft machen, dass durch die Verschmelzung die Erfüllung ihrer Forderung gefährdet wird."
    },
    {
      "date": "2024-10-12",
      "original_text": "Registerbekanntmachung nach dem Umwandlungsgesetz\nBayern Amtsgericht Augsburg HRB 22397\nFoodstaffing GmbH – Augsburg",
      "type": "Registerbekanntmachung nach dem Umwandlungsgesetz",
      "state": "Bayern",
      "amtsgericht": "Amtsgericht Augsburg",
      "registernummer": "HRB 22397",
      "registerart": "HRB",
      "company_name": "Foodstaffing GmbH",
      "company_seat": "Augsburg",
      "details": "12.10.2024 (Bekanntmachungsdatum)\n\nBayern Amtsgericht Augsburg HRB 22397\nRegisterbekanntmachung nach dem Umwandlungsgesetz 11.10.2024 (Eintragungsdatum)\n\nFoodstaffing GmbH\nGesellschaft mit beschränkter Haftung\nAugsburg\n\nDen Gläubigern der an der Verschmelzung beteiligten Rechtsträger ist, wenn sie binnen sechs Monaten nach dem Tag, an dem die Eintragung der Verschmelzung in das Register des Sitzes desjenigen Rechtsträgers, dessen Gläubiger sie sind, nach § 19 Abs. 3 UmwG als bekannt gemacht gilt, ihren Anspruch nach Grund und Höhe schriftlich anmelden, Sicherheit zu leisten, soweit sie nicht Befriedigung verlangen können. Dieses Recht steht den Gläubigern jedoch nur zu, wenn sie glaubhaft machen, dass durch die Verschmelzung die Erfüllung ihrer Forderung gefährdet wird."
    },
    {
      "date": "2024-10-12",
      "original_text": "Sonstige Registerbekanntmachung\nBayern Amtsgericht Augsburg HRB 22397\nFoodstaffing GmbH – Augsburg",
      "type": "Sonstige Registerbekanntmachung",
      "state": "Bayern",
      "amtsgericht": "Amtsgericht Augsburg",
      "registernummer": "HRB 22397",
      "registerart": "HRB",
      "company_name": "Foodstaffing GmbH",
      "company_seat": "Augsburg",
      "details": "12.10.2024 (Bekanntmachungsdatum)\n\nBayern Amtsgericht Augsburg HRB 22397\nSonstige Registerbekanntmachung 11.10.2024 (Eintragungsdatum)\n\nFoodstaffing GmbH\nGesellschaft mit beschränkter Haftung\nAugsburg\n\nDen Gläubigern der Gesellschaft, deren Forderungen begründet worden sind, bevor die Eintragung der Beendigung des Beherrschungs- und Gewinnabführungsvertrages in das Handelsregister nach § 10 des Handelsgesetzbuches als bekanntgemacht gilt, hat der andere Vertragsteil Sicherheit zu leisten, wenn sie sich binnen sechs Monaten nach der Bekanntmachung der Eintragung zu diesem Zweck bei ihm melden."
    },
    {
      "date": "2024-10-12",
      "original_text": "Löschungsankündigung\nBayern Amtsgericht Coburg HRB 2808\nInnotech Sondermaschinen und Vorrichtungen GmbH – Hochstadt OT Wolfsloch",
      "type": "Löschungsankündigung",
      "state": "Bayern",
      "amtsgericht": "Amtsgericht Coburg",
      "registernummer": "HRB 2808",
      "registerart": "HRB",
      "company_name": "Innotech Sondermaschinen und Vorrichtungen GmbH",
      "company_seat": "Hochstadt OT Wolfsloch",
      "details": "12.10.2024 (Bekanntmachungsdatum)\n\nBayern Amtsgericht Coburg HRB 2808\nLöschungsankündigung 11.10.2024 (Eintragungsdatum)\n\nInnotech Sondermaschinen und Vorrichtungen GmbH\nGesellschaft mit beschränkter Haftung\nHochstadt OT Wolfsloch\n\nDas Registergericht beabsichtigt, die im Handelsregister eingetragene Gesellschaft wegen Vermögenslosigkeit von Amts wegen nach § 394 FamFG zu löschen. Die Frist zur Erhebung eines Widerspruchs ist auf sechs Wochen festgesetzt."
    },
    {
      "date": "2024-10-12",
      "original_text": "Registerbekanntmachung nach dem Umwandlungsgesetz\nBayern Amtsgericht München HRB 248091\nLifeFit Group TopCo GmbH – München",
      "type": "Registerbekanntmachung nach dem Umwandlungsgesetz",
      "state": "Bayern",
      "amtsgericht": "Amtsgericht München",
      "registernummer": "HRB 248091",
      "registerart": "HRB",
      "company_name": "LifeFit Group TopCo GmbH",
      "company_seat": "München",
      "details": "12.10.2024 (Bekanntmachungsdatum)\n\nBayern Amtsgericht München HRB 248091\nRegisterbekanntmachung nach dem Umwandlungsgesetz 11.10.2024 (Eintragungsdatum)\n\nLifeFit Group TopCo GmbH\nGesellschaft mit beschränkter Haftung\nMünchen\n\nDen Gläubigern der an der Verschmelzung beteiligten Rechtsträger ist, wenn sie binnen sechs Monaten nach dem Tag, an dem die Eintragung der Verschmelzung in das Register des Sitzes desjenigen Rechtsträgers, dessen Gläubiger sie sind, nach § 19 Abs. 3 UmwG als bekannt gemacht gilt, ihren Anspruch nach Grund und Höhe schriftlich anmelden, Sicherheit zu leisten, soweit sie nicht Befriedigung verlangen können. Dieses Recht steht den Gläubigern jedoch nur zu, wenn sie glaubhaft machen, dass durch die Verschmelzung die Erfüllung ihrer Forderung gefährdet wird."
    },
    {
      "date": "2024-10-12",
      "original_text": "Registerbekanntmachung nach dem Umwandlungsgesetz\nBayern Amtsgericht Regensburg HRB 15466\nMäusl GmbH – Pentling",
      "type": "Registerbekanntmachung nach dem Umwandlungsgesetz",
      "state": "Bayern",
      "amtsgericht": "Amtsgericht Regensburg",
      "registernummer": "HRB 15466",
      "registerart": "HRB",
      "company_name": "Mäusl GmbH",
      "company_seat": "Pentling",
      "details": "12.10.2024 (Bekanntmachungsdatum)\n\nBayern Amtsgericht Regensburg HRB 15466\nRegisterbekanntmachung nach dem Umwandlungsgesetz 11.10.2024 (Eintragungsdatum)\n\nMäusl GmbH\nGesellschaft mit beschränkter Haftung\nPentling\n\nDen Gläubigern der an der Spaltung beteiligten Rechtsträger ist, wenn sie binnen sechs Monaten nach dem Tag, an dem die Eintragung der Spaltung in das Register des Sitzes desjenigen Rechtsträgers, dessen Gläubiger sie sind, nach §§ 125, 19 Abs. 3 UmwG als bekannt gemacht gilt, ihren Anspruch nach Grund und Höhe schriftlich anmelden, Sicherheit zu leisten, soweit sie nicht Befriedigung verlangen können. Dieses Recht steht den Gläubigern jedoch nur zu, wenn sie glaubhaft machen, dass durch die Spaltung die Erfüllung ihrer Forderung gefährdet wird."
    },
    {
      "date": "2024-10-12",
      "original_text": "Registerbekanntmachung nach dem Umwandlungsgesetz\nBayern Amtsgericht Augsburg HRB 27248\nOrizon GmbH – Augsburg",
      "type": "Registerbekanntmachung nach dem Umwandlungsgesetz",
      "state": "Bayern",
      "amtsgericht": "Amtsgericht Augsburg",
      "registernummer": "HRB 27248",
      "registerart": "HRB",
      "company_name": "Orizon GmbH",
      "company_seat": "Augsburg",
      "details": "12.10.2024 (Bekanntmachungsdatum)\n\nBayern Amtsgericht Augsburg HRB 27248\nRegisterbekanntmachung nach dem Umwandlungsgesetz 11.10.2024 (Eintragungsdatum)\n\nOrizon GmbH\nGesellschaft mit beschränkter Haftung\nAugsburg\n\nDen Gläubigern der an der Verschmelzung beteiligten Rechtsträger ist, wenn sie binnen sechs Monaten nach dem Tag, an dem die Eintragung der Verschmelzung in das Register des Sitzes desjenigen Rechtsträgers, dessen Gläubiger sie sind, nach § 19 Abs. 3 UmwG als bekannt gemacht gilt, ihren Anspruch nach Grund und Höhe schriftlich anmelden, Sicherheit zu leisten, soweit sie nicht Befriedigung verlangen können. Dieses Recht steht den Gläubigern jedoch nur zu, wenn sie glaubhaft machen, dass durch die Verschmelzung die Erfüllung ihrer Forderung gefährdet wird."
    },
    {
      "date": "2024-10-12",
      "original_text": "Registerbekanntmachung nach dem Umwandlungsgesetz\nBayern Amtsgericht Schweinfurt HRA 10622\nPelzer GmbH & Co. KG – Schweinfurt",
      "type": "Registerbekanntmachung nach dem Umwandlungsgesetz",
      "state": "Bayern",
      "amtsgericht": "Amtsgericht Schweinfurt",
      "registernummer": "HRA 10622",
      "registerart": "HRA",
      "company_name": "Pelzer GmbH & Co. KG",
      "company_seat": "Schweinfurt",
      "details": "12.10.2024 (Bekanntmachungsdatum)\n\nBayern Amtsgericht Schweinfurt HRA 10622\nRegisterbekanntmachung nach dem Umwandlungsgesetz 10.10.2024 (Eintragungsdatum)\n\nPelzer GmbH & Co. KG\nKommanditgesellschaft\nSchweinfurt\n\nDen Gläubigern der an der Ausgliederung beteiligten Rechtsträger ist, wenn sie binnen sechs Monaten nach dem Tag, an dem die Eintragung der Ausgliederung in das Register des Sitzes desjenigen Rechtsträgers, dessen Gläubiger sie sind, nach §§ 125, 19 Abs. 3 UmwG als bekannt gemacht gilt, ihren Anspruch nach Grund und Höhe schriftlich anmelden, Sicherheit zu leisten, soweit sie nicht Befriedigung verlangen können. Dieses Recht steht den Gläubigern jedoch nur zu, wenn sie glaubhaft machen, dass durch die Ausgliederung die Erfüllung ihrer Forderung gefährdet wird."
    },
    {
      "date": "2024-10-12",
      "original_text": "Löschungsankündigung\nBayern Amtsgericht Regensburg HRB 16032\nRW Gastro Verwaltungs UG (haftungsbeschränkt) – Regensburg",
      "type": "Löschungsankündigung",
      "state": "Bayern",
      "amtsgericht": "Amtsgericht Regensburg",
      "registernummer": "HRB 16032",
      "registerart": "HRB",
      "company_name": "RW Gastro Verwaltungs UG (haftungsbeschränkt)",
      "company_seat": "Regensburg",
      "details": "12.10.2024 (Bekanntmachungsdatum)\n\nBayern Amtsgericht Regensburg HRB 16032\nLöschungsankündigung\n\nRW Gastro Verwaltungs UG (haftungsbeschränkt)\nGesellschaft mit beschränkter Haftung\nRegensburg\n\nDas Registergericht beabsichtigt, die im Handelsregister eingetragene Gesellschaft wegen Vermögenslosigkeit von Amts wegen nach § 394 FamFG zu löschen. Die Frist zur Erhebung eines Widerspruchs ist auf einen Monat festgesetzt."
    },
    {
      "date": "2024-10-12",
      "original_text": "Löschungsankündigung\nBrandenburg Amtsgericht Potsdam HRB 24790\nRailserv UG (haftungsbeschränkt) – Blankenfelde-Mahlow",
      "type": "Löschungsankündigung",
      "state": "Brandenburg",
      "amtsgericht": "Amtsgericht Potsdam",
      "registernummer": "HRB 24790",
      "registerart": "HRB",
      "company_name": "Railserv UG (haftungsbeschränkt)",
      "company_seat": "Blankenfelde-Mahlow",
      "details": "12.10.2024 (Bekanntmachungsdatum)\n\nBrandenburg Amtsgericht Potsdam HRB 24790\nLöschungsankündigung\n\nRailserv UG (haftungsbeschränkt)\nGesellschaft mit beschränkter Haftung\nBlankenfelde-Mahlow\n\nBei der nachstehenden Gesellschaft wird das Amtslöschungsverfahren gemäß § 394 FamFG eingeleitet."
    },
    {
      "date": "2024-10-12",
      "original_text": "Einreichung neuer Dokumente\nBayern Amtsgericht München HRB 247027\nSeccua Holding AG – Weilheim",
      "type": "Einreichung neuer Dokumente",
      "state": "Bayern",
      "amtsgericht": "Amtsgericht München",
      "registernummer": "HRB 247027",
      "registerart": "HRB",
      "company_name": "Seccua Holding AG",
      "company_seat": "Weilheim",
      "details": "12.10.2024 (Bekanntmachungsdatum)\n\nBayern Amtsgericht München HRB 247027\nEinreichung neuer Dokumente 11.10.2024 (Eintragungsdatum)\n\nSeccua Holding AG\nAktiengesellschaft\nWeilheim\n\nDem Amtsgericht München -Registergericht- ist eine Liste der Mitglieder des Aufsichtsrats eingereicht worden, § 106 AktG."
    },
    {
      "date": "2024-10-12",
      "original_text": "Registerbekanntmachung nach dem Umwandlungsgesetz\nBayern Amtsgericht München HRB 289565\nTechanics GmbH – Gmund a.Tegernsee",
      "type": "Registerbekanntmachung nach dem Umwandlungsgesetz",
      "state": "Bayern",
      "amtsgericht": "Amtsgericht München",
      "registernummer": "HRB 289565",
      "registerart": "HRB",
      "company_name": "Techanics GmbH",
      "company_seat": "Gmund a.Tegernsee",
      "details": "12.10.2024 (Bekanntmachungsdatum)\n\nBayern Amtsgericht München HRB 289565\nRegisterbekanntmachung nach dem Umwandlungsgesetz 11.10.2024 (Eintragungsdatum)\n\nTechanics GmbH\nGesellschaft mit beschränkter Haftung\nGmund a.Tegernsee\n\nDen Gläubigern der an der Ausgliederung beteiligten Rechtsträger ist, wenn sie binnen sechs Monaten nach dem Tag, an dem die Eintragung der Ausgliederung in das Register des Sitzes desjenigen Rechtsträgers, dessen Gläubiger sie sind, nach §§ 125, 19 Abs. 3 UmwG als bekannt gemacht gilt, ihren Anspruch nach Grund und Höhe schriftlich anmelden, Sicherheit zu leisten, soweit sie nicht Befriedigung verlangen können. Dieses Recht steht den Gläubigern jedoch nur zu, wenn sie glaubhaft machen, dass durch die Ausgliederung die Erfüllung ihrer Forderung gefährdet wird."
    },
    {
      "date": "2024-10-12",
      "original_text": "Registerbekanntmachung nach dem Umwandlungsgesetz\nBrandenburg Amtsgericht Potsdam HRB 37598\ne-cars24 UG (haftungsbeschränkt) – Brandenburg an der Havel",
      "type": "Registerbekanntmachung nach dem Umwandlungsgesetz",
      "state": "Brandenburg",
      "amtsgericht": "Amtsgericht Potsdam",
      "registernummer": "HRB 37598",
      "registerart": "HRB",
      "company_name": "e-cars24 UG (haftungsbeschränkt)",
      "company_seat": "Brandenburg an der Havel",
      "details": "12.10.2024 (Bekanntmachungsdatum)\n\nBrandenburg Amtsgericht Potsdam HRB 37598\nRegisterbekanntmachung nach dem Umwandlungsgesetz 02.10.2024 (Eintragungsdatum)\n\ne-cars24 UG (haftungsbeschränkt)\nGesellschaft mit beschränkter Haftung\nBrandenburg an der Havel\n\nZu Eintragungsnummer 2 vom 02.10.2024 wird als nicht eingetragen veröffentlicht:\nDen Gläubigern der an der Verschmelzung beteiligten Rechtsträger ist, wenn sie binnen sechs Monaten nach dem Tag, an dem die Eintragung der Verschmelzung in das Register des Sitzes desjenigen Rechtsträgers, dessen Gläubiger sie sind, als bekannt gemacht gilt, ihren Anspruch nach Grund und Höhe schriftlich anmelden, Sicherheit zu leisten, soweit sie nicht Befriedigung verlangen können. Dieses Recht steht den Gläubigern jedoch nur zu, wenn sie glaubhaft machen, dass durch die Verschmelzung die Erfüllung ihrer Forderung gefährdet wird."
    },
    {
      "date": "2024-10-12",
      "original_text": "Registerbekanntmachung nach dem Umwandlungsgesetz\nBrandenburg Amtsgericht Potsdam HRA 8517\ne-cars24 e.K. – Brandenburg an der Havel",
      "type": "Registerbekanntmachung nach dem Umwandlungsgesetz",
      "state": "Brandenburg",
      "amtsgericht": "Amtsgericht Potsdam",
      "registernummer": "HRA 8517",
      "registerart": "HRA",
      "company_name": "e-cars24 e.K.",
      "company_seat": "Brandenburg an der Havel",
      "details": "12.10.2024 (Bekanntmachungsdatum)\n\nBrandenburg Amtsgericht Potsdam HRA 8517\nRegisterbekanntmachung nach dem Umwandlungsgesetz 02.10.2024 (Eintragungsdatum)\n\ne-cars24 e.K.\nEinzelkaufmann / Einzelkauffrau\nBrandenburg an der Havel\n\nZu Eintragungsnummer 1 vom 02.10.2024 wird als nicht eingetragen veröffentlicht:\nDen Gläubigern der an der Verschmelzung beteiligten Rechtsträger ist, wenn sie binnen sechs Monaten nach dem Tag, an dem die Eintragung der Verschmelzung in das Register des Sitzes desjenigen Rechtsträgers, dessen Gläubiger sie sind, als bekannt gemacht gilt, ihren Anspruch nach Grund und Höhe schriftlich anmelden, Sicherheit zu leisten, soweit sie nicht Befriedigung verlangen können. Dieses Recht steht den Gläubigern jedoch nur zu, wenn sie glaubhaft machen, dass durch die Verschmelzung die Erfüllung ihrer Forderung gefährdet wird."
    }
  ]
}