{
  "date": "2024-10-16",
  "date_of_scrape": "2024-11-30T12:23:17.921Z",
  "tool_version": "0.2.0",
  "number_of_announcements": 143,
  "announcements": [
    {
      "date": "2024-10-16",
      "id": "90673",
      "original_text": "Sonstige Registerbekanntmachung\nHessen Amtsgericht Frankfurt am Main HRB 107682\nAGF Videoforschung GmbH – Frankfurt am Main",
      "type": "Sonstige Registerbekanntmachung",
      "state": "Hessen",
      "amtsgericht": "Amtsgericht Frankfurt am Main",
      "registernummer": "HRB 107682",
      "registerart": "HRB",
      "company_name": "AGF Videoforschung GmbH",
      "company_seat": "Frankfurt am Main",
      "details": "16.10.2024 (Bekanntmachungsdatum)\n\nHessen Amtsgericht Frankfurt am Main HRB 107682\nSonstige Registerbekanntmachung\n\nAGF Videoforschung GmbH\nGesellschaft mit beschränkter Haftung\nFrankfurt am Main\n\nDurch eine Änderung in den Personen der Aufsichtsratsmitglieder ist eine Liste der Mitglieder des Aufsichtsrates zum Handelsregister eingereicht worden."
    },
    {
      "date": "2024-10-16",
      "id": "90548",
      "original_text": "Registerbekanntmachung nach dem Umwandlungsgesetz\nBayern Amtsgericht München HRB 216476\nAHI Holding GmbH – Grünwald",
      "type": "Registerbekanntmachung nach dem Umwandlungsgesetz",
      "state": "Bayern",
      "amtsgericht": "Amtsgericht München",
      "registernummer": "HRB 216476",
      "registerart": "HRB",
      "company_name": "AHI Holding GmbH",
      "company_seat": "Grünwald",
      "details": "16.10.2024 (Bekanntmachungsdatum)\n\nBayern Amtsgericht München HRB 216476\nRegisterbekanntmachung nach dem Umwandlungsgesetz 15.10.2024 (Eintragungsdatum)\n\nAHI Holding GmbH\nGesellschaft mit beschränkter Haftung\nGrünwald\n\nDen Gläubigern der an der Verschmelzung beteiligten Rechtsträger ist, wenn sie binnen sechs Monaten nach dem Tag, an dem die Eintragung der Verschmelzung in das Register des Sitzes desjenigen Rechtsträgers, dessen Gläubiger sie sind, nach § 19 Abs. 3 UmwG als bekannt gemacht gilt, ihren Anspruch nach Grund und Höhe schriftlich anmelden, Sicherheit zu leisten, soweit sie nicht Befriedigung verlangen können. Dieses Recht steht den Gläubigern jedoch nur zu, wenn sie glaubhaft machen, dass durch die Verschmelzung die Erfüllung ihrer Forderung gefährdet wird."
    },
    {
      "date": "2024-10-16",
      "id": "90611",
      "original_text": "Sonstige Registerbekanntmachung\nHamburg Amtsgericht Hamburg HRB 100790\nAVARA Aktiengesellschaft für Informations- und TV - Systeme – Hamburg",
      "type": "Sonstige Registerbekanntmachung",
      "state": "Hamburg",
      "amtsgericht": "Amtsgericht Hamburg",
      "registernummer": "HRB 100790",
      "registerart": "HRB",
      "company_name": "AVARA Aktiengesellschaft für Informations- und TV - Systeme",
      "company_seat": "Hamburg",
      "details": "16.10.2024 (Bekanntmachungsdatum)\n\nHamburg Amtsgericht Hamburg HRB 100790\nSonstige Registerbekanntmachung\n\nAVARA Aktiengesellschaft für Informations- und TV - Systeme\nAktiengesellschaft\nHamburg\n\nAls nicht eingetragen wird bekannt gemacht: Liste des Aufsichtsrats wurde eingereicht."
    },
    {
      "date": "2024-10-16",
      "id": "90676",
      "original_text": "Löschungsankündigung\nHessen Amtsgericht Wiesbaden HRB 31553\nAVENUE GTZ GmbH – Wiesbaden",
      "type": "Löschungsankündigung",
      "state": "Hessen",
      "amtsgericht": "Amtsgericht Wiesbaden",
      "registernummer": "HRB 31553",
      "registerart": "HRB",
      "company_name": "AVENUE GTZ GmbH",
      "company_seat": "Wiesbaden",
      "details": "16.10.2024 (Bekanntmachungsdatum)\n\nHessen Amtsgericht Wiesbaden HRB 31553\nLöschungsankündigung\n\nAVENUE GTZ GmbH\nGesellschaft mit beschränkter Haftung\nWiesbaden\n\nDas Registergericht beabsichtigt die im Handelsregister eingetragene Gesellschaft von Amts wegen nach § 394 FamFG zu löschen. Die Frist zur Erhebung eines Widerspruchs gegen die beabsichtigte Löschung wird auf 3 Monate festgesetzt."
    },
    {
      "date": "2024-10-16",
      "id": "90542",
      "original_text": "Registerbekanntmachung nach dem Umwandlungsgesetz\nBayern Amtsgericht Traunstein HRB 30447\nAlpha Trust UG (haftungsbeschränkt) – Rosenheim",
      "type": "Registerbekanntmachung nach dem Umwandlungsgesetz",
      "state": "Bayern",
      "amtsgericht": "Amtsgericht Traunstein",
      "registernummer": "HRB 30447",
      "registerart": "HRB",
      "company_name": "Alpha Trust UG (haftungsbeschränkt)",
      "company_seat": "Rosenheim",
      "details": "16.10.2024 (Bekanntmachungsdatum)\n\nBayern Amtsgericht Traunstein HRB 30447\nRegisterbekanntmachung nach dem Umwandlungsgesetz 15.10.2024 (Eintragungsdatum)\n\nAlpha Trust UG (haftungsbeschränkt)\nGesellschaft mit beschränkter Haftung\nRosenheim\n\nDen Gläubigern der an der Verschmelzung beteiligten Rechtsträger ist, wenn sie binnen sechs Monaten nach dem Tag, an dem die Eintragung der Verschmelzung in das Register des Sitzes desjenigen Rechtsträgers, dessen Gläubiger sie sind, nach § 19 Abs. 3 UmwG als bekannt gemacht gilt, ihren Anspruch nach Grund und Höhe schriftlich anmelden, Sicherheit zu leisten, soweit sie nicht Befriedigung verlangen können. Dieses Recht steht den Gläubigern jedoch nur zu, wenn sie glaubhaft machen, dass durch die Verschmelzung die Erfüllung ihrer Forderung gefährdet wird."
    },
    {
      "date": "2024-10-16",
      "id": "90637",
      "original_text": "Registerbekanntmachung nach dem Umwandlungsgesetz\nRheinland-Pfalz Amtsgericht Mainz HRB 40478\nAureal Beteiligungen GmbH – Mainz",
      "type": "Registerbekanntmachung nach dem Umwandlungsgesetz",
      "state": "Rheinland-Pfalz",
      "amtsgericht": "Amtsgericht Mainz",
      "registernummer": "HRB 40478",
      "registerart": "HRB",
      "company_name": "Aureal Beteiligungen GmbH",
      "company_seat": "Mainz",
      "details": "16.10.2024 (Bekanntmachungsdatum)\n\nRheinland-Pfalz Amtsgericht Mainz HRB 40478\nRegisterbekanntmachung nach dem Umwandlungsgesetz 16.10.2024 (Eintragungsdatum)\n\nAureal Beteiligungen GmbH\nGesellschaft mit beschränkter Haftung\nMainz\n\nAls nicht eingetragen wird veröffentlicht: Den Gläubigern der an der Verschmelzung beteiligten Rechtsträger ist, wenn sie binnen sechs Monaten nach dem Tag, an dem die Eintragung der Verschmelzung in das Register des Sitzes desjenigen Rechtsträgers,dessen Gläubiger sie sind, nach § 19 Abs. 3 UmwG als bekannt gemacht gilt, ihren Anspruch nach Grund und Höhe schriftlich anmelden, Sicherheit zu leisten, soweit sie nicht Befriedigung verlangen können. Dieses Recht steht den Gläubigern jedoch nur zu, wenn sie glaubhaft machen, dass durch die Verschmelzung die Erfüllung der Forderung gefährdet wird."
    },
    {
      "date": "2024-10-16",
      "id": "90638",
      "original_text": "Registerbekanntmachung nach dem Umwandlungsgesetz\nRheinland-Pfalz Amtsgericht Mainz HRB 40478\nAureal Beteiligungen GmbH – Mainz",
      "type": "Registerbekanntmachung nach dem Umwandlungsgesetz",
      "state": "Rheinland-Pfalz",
      "amtsgericht": "Amtsgericht Mainz",
      "registernummer": "HRB 40478",
      "registerart": "HRB",
      "company_name": "Aureal Beteiligungen GmbH",
      "company_seat": "Mainz",
      "details": "16.10.2024 (Bekanntmachungsdatum)\n\nRheinland-Pfalz Amtsgericht Mainz HRB 40478\nRegisterbekanntmachung nach dem Umwandlungsgesetz 16.10.2024 (Eintragungsdatum)\n\nAureal Beteiligungen GmbH\nGesellschaft mit beschränkter Haftung\nMainz\n\nAls nicht eingetragen wird veröffentlicht: Den Gläubigern der an der Verschmelzung beteiligten Rechtsträger ist, wenn sie binnen sechs Monaten nach dem Tag, an dem die Eintragung der Verschmelzung in das Register des Sitzes desjenigen Rechtsträgers,dessen Gläubiger sie sind, nach § 19 Abs. 3 UmwG als bekannt gemacht gilt, ihren Anspruch nach Grund und Höhe schriftlich anmelden, Sicherheit zu leisten, soweit sie nicht Befriedigung verlangen können. Dieses Recht steht den Gläubigern jedoch nur zu, wenn sie glaubhaft machen, dass durch die Verschmelzung die Erfüllung der Forderung gefährdet wird."
    },
    {
      "date": "2024-10-16",
      "id": "90639",
      "original_text": "Registerbekanntmachung nach dem Umwandlungsgesetz\nRheinland-Pfalz Amtsgericht Mainz HRB 40477\nAureal Grundbesitz GmbH – Mainz",
      "type": "Registerbekanntmachung nach dem Umwandlungsgesetz",
      "state": "Rheinland-Pfalz",
      "amtsgericht": "Amtsgericht Mainz",
      "registernummer": "HRB 40477",
      "registerart": "HRB",
      "company_name": "Aureal Grundbesitz GmbH",
      "company_seat": "Mainz",
      "details": "16.10.2024 (Bekanntmachungsdatum)\n\nRheinland-Pfalz Amtsgericht Mainz HRB 40477\nRegisterbekanntmachung nach dem Umwandlungsgesetz 16.10.2024 (Eintragungsdatum)\n\nAureal Grundbesitz GmbH\nGesellschaft mit beschränkter Haftung\nMainz\n\nAls nicht eingetragen wird veröffentlicht: Den Gläubigern der an der Verschmelzung beteiligten Rechtsträger ist, wenn sie binnen sechs Monaten nach dem Tag, an dem die Eintragung der Verschmelzung in das Register des Sitzes desjenigen Rechtsträgers,dessen Gläubiger sie sind, nach § 19 Abs. 3 UmwG als bekannt gemacht gilt, ihren Anspruch nach Grund und Höhe schriftlich anmelden, Sicherheit zu leisten, soweit sie nicht Befriedigung verlangen können. Dieses Recht steht den Gläubigern jedoch nur zu, wenn sie glaubhaft machen, dass durch die Verschmelzung die Erfüllung der Forderung gefährdet wird."
    },
    {
      "date": "2024-10-16",
      "id": "90641",
      "original_text": "Registerbekanntmachung nach dem Umwandlungsgesetz\nRheinland-Pfalz Amtsgericht Mainz HRB 43944\nAureal Immobilien UG (haftungsbeschränkt) – Mainz",
      "type": "Registerbekanntmachung nach dem Umwandlungsgesetz",
      "state": "Rheinland-Pfalz",
      "amtsgericht": "Amtsgericht Mainz",
      "registernummer": "HRB 43944",
      "registerart": "HRB",
      "company_name": "Aureal Immobilien UG (haftungsbeschränkt)",
      "company_seat": "Mainz",
      "details": "16.10.2024 (Bekanntmachungsdatum)\n\nRheinland-Pfalz Amtsgericht Mainz HRB 43944\nRegisterbekanntmachung nach dem Umwandlungsgesetz 16.10.2024 (Eintragungsdatum)\n\nAureal Immobilien UG (haftungsbeschränkt)\nGesellschaft mit beschränkter Haftung\nMainz\n\nAls nicht eingetragen wird veröffentlicht: Den Gläubigern der an der Verschmelzung beteiligten Rechtsträger ist, wenn sie binnen sechs Monaten nach dem Tag, an dem die Eintragung der Verschmelzung in das Register des Sitzes desjenigen Rechtsträgers,dessen Gläubiger sie sind, nach § 19 Abs. 3 UmwG als bekannt gemacht gilt, ihren Anspruch nach Grund und Höhe schriftlich anmelden, Sicherheit zu leisten, soweit sie nicht Befriedigung verlangen können. Dieses Recht steht den Gläubigern jedoch nur zu, wenn sie glaubhaft machen, dass durch die Verschmelzung die Erfüllung der Forderung gefährdet wird."
    },
    {
      "date": "2024-10-16",
      "id": "90590",
      "original_text": "Registerbekanntmachung nach dem Umwandlungsgesetz\nSaarland Amtsgericht Saarbrücken HRB 14005\nAutohaus Kilian GmbH – St. Ingbert",
      "type": "Registerbekanntmachung nach dem Umwandlungsgesetz",
      "state": "Saarland",
      "amtsgericht": "Amtsgericht Saarbrücken",
      "registernummer": "HRB 14005",
      "registerart": "HRB",
      "company_name": "Autohaus Kilian GmbH",
      "company_seat": "St. Ingbert",
      "details": "16.10.2024 (Bekanntmachungsdatum)\n\nSaarland Amtsgericht Saarbrücken HRB 14005\nRegisterbekanntmachung nach dem Umwandlungsgesetz 16.10.2024 (Eintragungsdatum)\n\nAutohaus Kilian GmbH\nGesellschaft mit beschränkter Haftung\nSt. Ingbert\n\nAls nicht eingetragen wird bekannt gemacht: Den Gläubigern der an der Verschmelzung beteiligten Gesellschaften ist, wenn sie binnen sechs Monaten nach dem Tag, an dem die Eintragung der Verschmelzung in das Register des Sitzes desjenigen Rechtsträgers, dessen Gläubiger sie sind, nach § 19 Absatz 3 UmwG bekannt gemacht worden ist, ihren Anspruch nach Grund und Höhe schriftlich anmelden, Sicherheit zu leisten, soweit sie nicht Befriedigung verlangen können. Dieses Recht steht den Gläubigern jedoch nur zu, wenn sie glaubhaft machen, dass durch die Verschmelzung die Erfüllung ihrer Forderung gefährdet wird."
    },
    {
      "date": "2024-10-16",
      "id": "90546",
      "original_text": "Registerbekanntmachung nach dem Umwandlungsgesetz\nBayern Amtsgericht Fürth HRA 8232\nAutohaus Specht GmbH & Co. KG – Dietersheim",
      "type": "Registerbekanntmachung nach dem Umwandlungsgesetz",
      "state": "Bayern",
      "amtsgericht": "Amtsgericht Fürth",
      "registernummer": "HRA 8232",
      "registerart": "HRA",
      "company_name": "Autohaus Specht GmbH & Co. KG",
      "company_seat": "Dietersheim",
      "details": "16.10.2024 (Bekanntmachungsdatum)\n\nBayern Amtsgericht Fürth HRA 8232\nRegisterbekanntmachung nach dem Umwandlungsgesetz 15.10.2024 (Eintragungsdatum)\n\nAutohaus Specht GmbH & Co. KG\nKommanditgesellschaft\nDietersheim\n\nDen Gläubigern des formwechselnden Rechtsträgers ist, wenn sie binnen sechs Monaten nach dem Tag, an dem die Eintragung des Formwechsels nach § 201 UmwG als bekannt gemacht gilt, ihren Anspruch nach Grund und Höhe schriftlich anmelden, Sicherheit zu leisten, soweit sie nicht Befriedigung verlangen können. Dieses Recht steht den Gläubigern jedoch nur zu, wenn sie glaubhaft machen, dass durch den Formwechsel die Erfüllung ihrer Forderung gefährdet wird."
    },
    {
      "date": "2024-10-16",
      "id": "90683",
      "original_text": "Löschungsankündigung\nHessen Amtsgericht Wiesbaden HRB 24780\nAutotec Ingenieurbüro GmbH – Wiesbaden",
      "type": "Löschungsankündigung",
      "state": "Hessen",
      "amtsgericht": "Amtsgericht Wiesbaden",
      "registernummer": "HRB 24780",
      "registerart": "HRB",
      "company_name": "Autotec Ingenieurbüro GmbH",
      "company_seat": "Wiesbaden",
      "details": "16.10.2024 (Bekanntmachungsdatum)\n\nHessen Amtsgericht Wiesbaden HRB 24780\nLöschungsankündigung\n\nAutotec Ingenieurbüro GmbH\nGesellschaft mit beschränkter Haftung\nWiesbaden\n\nDas Registergericht beabsichtigt die im Handelsregister eingetragene Gesellschaft von Amts wegen nach § 394 FamFG zu löschen. Die Frist zur Erhebung eines Widerspruchs gegen die beabsichtigte Löschung wird auf 3 Monate festgesetzt."
    },
    {
      "date": "2024-10-16",
      "id": "90563",
      "original_text": "Löschungsankündigung\nBayern Amtsgericht Aschaffenburg HRB 8627\nBAGO GmbH – Goldbach",
      "type": "Löschungsankündigung",
      "state": "Bayern",
      "amtsgericht": "Amtsgericht Aschaffenburg",
      "registernummer": "HRB 8627",
      "registerart": "HRB",
      "company_name": "BAGO GmbH",
      "company_seat": "Goldbach",
      "details": "16.10.2024 (Bekanntmachungsdatum)\n\nBayern Amtsgericht Aschaffenburg HRB 8627\nLöschungsankündigung\n\nBAGO GmbH\nGesellschaft mit beschränkter Haftung\nGoldbach\n\nDas Registergericht beabsichtigt, die im Handelsregister eingetragene Gesellschaft wegen Vermögenslosigkeit von Amts wegen nach § 394 FamFG zu löschen. Die Frist zur Erhebung eines Widerspruchs ist auf drei Monate festgesetzt."
    },
    {
      "date": "2024-10-16",
      "id": "90682",
      "original_text": "Löschungsankündigung\nHessen Amtsgericht Offenbach am Main HRB 48311\nBRATEC GmbH – Dreieich",
      "type": "Löschungsankündigung",
      "state": "Hessen",
      "amtsgericht": "Amtsgericht Offenbach am Main",
      "registernummer": "HRB 48311",
      "registerart": "HRB",
      "company_name": "BRATEC GmbH",
      "company_seat": "Dreieich",
      "details": "16.10.2024 (Bekanntmachungsdatum)\n\nHessen Amtsgericht Offenbach am Main HRB 48311\nLöschungsankündigung\n\nBRATEC GmbH\nGesellschaft mit beschränkter Haftung\nDreieich\n\nDas Registergericht beabsichtigt die im Handelsregister eingetragene Gesellschaft von Amts wegen nach § 394 FamFG zu löschen. Die Frist zur Erhebung eines Widerspruchs gegen die beabsichtigte Löschung wird auf 3 Monate festgesetzt."
    },
    {
      "date": "2024-10-16",
      "id": "90567",
      "original_text": "Löschungsankündigung\nBayern Amtsgericht Kempten (Allgäu) HRB 13518\nBelmedo UG (haftungsbeschränkt) – Oberstaufen",
      "type": "Löschungsankündigung",
      "state": "Bayern",
      "amtsgericht": "Amtsgericht Kempten (Allgäu)",
      "registernummer": "HRB 13518",
      "registerart": "HRB",
      "company_name": "Belmedo UG (haftungsbeschränkt)",
      "company_seat": "Oberstaufen",
      "details": "16.10.2024 (Bekanntmachungsdatum)\n\nBayern Amtsgericht Kempten (Allgäu) HRB 13518\nLöschungsankündigung\n\nBelmedo UG (haftungsbeschränkt)\nGesellschaft mit beschränkter Haftung\nOberstaufen\n\nDas Registergericht beabsichtigt, die im Handelsregister eingetragene Gesellschaft wegen Vermögenslosigkeit von Amts wegen nach § 394 FamFG zu löschen. Die Frist zur Erhebung eines Widerspruchs ist auf einen Monat festgesetzt."
    },
    {
      "date": "2024-10-16",
      "id": "90600",
      "original_text": "Registerbekanntmachung nach dem Umwandlungsgesetz\nBerlin Amtsgericht Berlin (Charlottenburg) HRA 55927\nBettina Roden e.K. – Berlin",
      "type": "Registerbekanntmachung nach dem Umwandlungsgesetz",
      "state": "Berlin",
      "amtsgericht": "Amtsgericht Berlin (Charlottenburg)",
      "registernummer": "HRA 55927",
      "registerart": "HRA",
      "company_name": "Bettina Roden e.K.",
      "company_seat": "Berlin",
      "details": "16.10.2024 (Bekanntmachungsdatum)\n\nBerlin Amtsgericht Berlin (Charlottenburg) HRA 55927\nRegisterbekanntmachung nach dem Umwandlungsgesetz 15.10.2024 (Eintragungsdatum)\n\nBettina Roden e.K.\nEinzelkaufmann / Einzelkauffrau\nBerlin\n\nZu Eintragungsnummer 2 vom 15.10.2024 wird als nicht eingetragen veröffentlicht: Den Gläubigern der an der Verschmelzung beteiligten Rechtsträger ist, wenn sie binnen sechs Monaten nach dem Tag, an dem die Eintragung der Verschmelzung in das Register des Sitzes desjenigen Rechtsträgers, dessen Gläubiger sie sind, als bekannt gemacht gilt, ihren Anspruch nach Grund und Höhe schriftlich anmelden, Sicherheit zu leisten, soweit sie nicht Befriedigung verlangen können. Dieses Recht steht den Gläubigern jedoch nur zu, wenn sie glaubhaft machen, dass durch die Verschmelzung die Erfüllung ihrer Forderung gefährdet wird. Das Recht, Sicherheitsleistung zu verlangen, steht Gläubigern nicht zu, die im Falle der Insolvenz ein Recht auf vorzugsweise Befriedigung aus einer Deckungsmasse haben, die nach gesetzlicher Vorschrift zu ihrem Schutz errichtet und staatlich überwacht ist."
    },
    {
      "date": "2024-10-16",
      "id": "90562",
      "original_text": "Registerbekanntmachung nach dem Umwandlungsgesetz\nBayern Amtsgericht München HRB 290684\nBlitz 24-2 GmbH – München",
      "type": "Registerbekanntmachung nach dem Umwandlungsgesetz",
      "state": "Bayern",
      "amtsgericht": "Amtsgericht München",
      "registernummer": "HRB 290684",
      "registerart": "HRB",
      "company_name": "Blitz 24-2 GmbH",
      "company_seat": "München",
      "details": "16.10.2024 (Bekanntmachungsdatum)\n\nBayern Amtsgericht München HRB 290684\nRegisterbekanntmachung nach dem Umwandlungsgesetz 15.10.2024 (Eintragungsdatum)\n\nBlitz 24-2 GmbH\nGesellschaft mit beschränkter Haftung\nMünchen\n\nDen Gläubigern der an der Verschmelzung beteiligten Rechtsträger ist, wenn sie binnen sechs Monaten nach dem Tag, an dem die Eintragung der Verschmelzung in das Register des Sitzes desjenigen Rechtsträgers, dessen Gläubiger sie sind, nach § 19 Abs. 3 UmwG als bekannt gemacht gilt, ihren Anspruch nach Grund und Höhe schriftlich anmelden, Sicherheit zu leisten, soweit sie nicht Befriedigung verlangen können. Dieses Recht steht den Gläubigern jedoch nur zu, wenn sie glaubhaft machen, dass durch die Verschmelzung die Erfüllung ihrer Forderung gefährdet wird."
    },
    {
      "date": "2024-10-16",
      "id": "90651",
      "original_text": "Einreichung neuer Dokumente\nNordrhein-Westfalen Amtsgericht Bochum HRB 1\nBochum-Gelsenkirchener Straßenbahnen Aktiengesellschaft – Bochum",
      "type": "Einreichung neuer Dokumente",
      "state": "Nordrhein-Westfalen",
      "amtsgericht": "Amtsgericht Bochum",
      "registernummer": "HRB 1",
      "registerart": "HRB",
      "company_name": "Bochum-Gelsenkirchener Straßenbahnen Aktiengesellschaft",
      "company_seat": "Bochum",
      "details": "16.10.2024 (Bekanntmachungsdatum)\n\nNordrhein-Westfalen Amtsgericht Bochum HRB 1\nEinreichung neuer Dokumente 16.10.2024 (Eintragungsdatum)\n\nBochum-Gelsenkirchener Straßenbahnen Aktiengesellschaft\nAktiengesellschaft\nBochum\n\nDem Registergericht ist eine neue Liste der Mitglieder des Aufsichtsrates eingereicht worden."
    },
    {
      "date": "2024-10-16",
      "id": "90674",
      "original_text": "Registerbekanntmachung nach dem Umwandlungsgesetz\nHessen Amtsgericht Frankfurt am Main HRB 92054\nBookwire GmbH – Frankfurt am Main",
      "type": "Registerbekanntmachung nach dem Umwandlungsgesetz",
      "state": "Hessen",
      "amtsgericht": "Amtsgericht Frankfurt am Main",
      "registernummer": "HRB 92054",
      "registerart": "HRB",
      "company_name": "Bookwire GmbH",
      "company_seat": "Frankfurt am Main",
      "details": "16.10.2024 (Bekanntmachungsdatum)\n\nHessen Amtsgericht Frankfurt am Main HRB 92054\nRegisterbekanntmachung nach dem Umwandlungsgesetz 02.10.2024 (Eintragungsdatum)\n\nBookwire GmbH\nGesellschaft mit beschränkter Haftung\nFrankfurt am Main\n\nEs wird darauf hingewiesen, dass ein Verschmelzungsplan oder sein Entwurf über eine grenzüberschreitende Verschmelzung zur Aufnahme mit der Bookrepublic Distribuzione S.r.l.,  mit Sitz in Mailand, Italien beim Handelsregister eingereicht worden ist.\n\nDie Anteilsinhaber, die Gläubiger sowie die zuständigen Betriebsräte der an der grenzüberschreitenden Verschmelzung beteiligten Gesellschaften oder, soweit es keinen Betriebsrat gibt, die Arbeitnehmer der an der grenzüberschreitenden Verschmelzung beteiligten Gesellschaften, können der jeweiligen Gesellschaft spätestens fünf Arbeitstage vor dem Tag der Hauptversammlung Bemerkungen zum Verschmelzungsplan übermitteln."
    },
    {
      "date": "2024-10-16",
      "id": "90552",
      "original_text": "Registerbekanntmachung nach dem Umwandlungsgesetz\nBayern Amtsgericht München HRB 295454\nBorninvest GmbH – Grünwald",
      "type": "Registerbekanntmachung nach dem Umwandlungsgesetz",
      "state": "Bayern",
      "amtsgericht": "Amtsgericht München",
      "registernummer": "HRB 295454",
      "registerart": "HRB",
      "company_name": "Borninvest GmbH",
      "company_seat": "Grünwald",
      "details": "16.10.2024 (Bekanntmachungsdatum)\n\nBayern Amtsgericht München HRB 295454\nRegisterbekanntmachung nach dem Umwandlungsgesetz 15.10.2024 (Eintragungsdatum)\n\nBorninvest GmbH\nGesellschaft mit beschränkter Haftung\nGrünwald\n\nDen Gläubigern der an der Ausgliederung beteiligten Rechtsträger ist, wenn sie binnen sechs Monaten nach dem Tag, an dem die Eintragung der Ausgliederung in das Register des Sitzes desjenigen Rechtsträgers, dessen Gläubiger sie sind, nach §§ 125, 19 Abs. 3 UmwG als bekannt gemacht gilt, ihren Anspruch nach Grund und Höhe schriftlich anmelden, Sicherheit zu leisten, soweit sie nicht Befriedigung verlangen können. Dieses Recht steht den Gläubigern jedoch nur zu, wenn sie glaubhaft machen, dass durch die Ausgliederung die Erfüllung ihrer Forderung gefährdet wird."
    },
    {
      "date": "2024-10-16",
      "id": "90550",
      "original_text": "Sonstige Registerbekanntmachung\nBayern Amtsgericht Würzburg HRB 12826\nBosch Rexroth Vermögensverwaltung GmbH – Lohr a.Main",
      "type": "Sonstige Registerbekanntmachung",
      "state": "Bayern",
      "amtsgericht": "Amtsgericht Würzburg",
      "registernummer": "HRB 12826",
      "registerart": "HRB",
      "company_name": "Bosch Rexroth Vermögensverwaltung GmbH",
      "company_seat": "Lohr a.Main",
      "details": "16.10.2024 (Bekanntmachungsdatum)\n\nBayern Amtsgericht Würzburg HRB 12826\nSonstige Registerbekanntmachung 15.10.2024 (Eintragungsdatum)\n\nBosch Rexroth Vermögensverwaltung GmbH\nGesellschaft mit beschränkter Haftung\nLohr a.Main\n\nDen Gläubigern der Gesellschaft, deren Forderungen begründet worden sind, bevor die Eintragung der Beendigung des Gewinnabführungsvertrages in das Handelsregister nach § 10 des Handelsgesetzbuches als bekanntgemacht gilt, hat der andere Vertragsteil Sicherheit zu leisten, wenn sie sich binnen sechs Monaten nach der Bekanntmachung der Eintragung zu diesem Zweck bei ihm melden."
    },
    {
      "date": "2024-10-16",
      "id": "90541",
      "original_text": "Sonstige Registerbekanntmachung\nBayern Amtsgericht München HRB 203845\nCANCOM SE – München",
      "type": "Sonstige Registerbekanntmachung",
      "state": "Bayern",
      "amtsgericht": "Amtsgericht München",
      "registernummer": "HRB 203845",
      "registerart": "HRB",
      "company_name": "CANCOM SE",
      "company_seat": "München",
      "details": "16.10.2024 (Bekanntmachungsdatum)\n\nBayern Amtsgericht München HRB 203845\nSonstige Registerbekanntmachung\n\nCANCOM SE\nEuropäische Aktiengesellschaft (SE)\nMünchen\n\nDem Amtsgericht München -Registergericht- ist eine Liste der Mitglieder des Aufsichtsrats eingereicht worden, Art. 9 Abs. 1 Buchst. c (ii) SE-VO i.V.m. § 106 AktG."
    },
    {
      "date": "2024-10-16",
      "id": "90612",
      "original_text": "Löschungsankündigung\nBaden-Württemberg Amtsgericht Stuttgart HRB 761328\nCOBLA GmbH – Böblingen",
      "type": "Löschungsankündigung",
      "state": "Baden-Württemberg",
      "amtsgericht": "Amtsgericht Stuttgart",
      "registernummer": "HRB 761328",
      "registerart": "HRB",
      "company_name": "COBLA GmbH",
      "company_seat": "Böblingen",
      "details": "16.10.2024 (Bekanntmachungsdatum)\n\nBaden-Württemberg Amtsgericht Stuttgart HRB 761328\nLöschungsankündigung\n\nCOBLA GmbH\nGesellschaft mit beschränkter Haftung\nBöblingen\n\nDas Gericht beabsichtigt, die Gesellschaft wegen Vermögenslosigkeit im Handelsregister von Amts wegen nach § 394 FamFG zu löschen. Die Frist zur Geltendmachung eines Widerspruchs gegen die beabsichtigte Löschung ist auf zwei Monate ab Veröffentlichung bestimmt."
    },
    {
      "date": "2024-10-16",
      "id": "90606",
      "original_text": "Löschungsankündigung\nBerlin Amtsgericht Berlin (Charlottenburg) HRB 95402\nCaffein Espressosysteme GmbH – Berlin",
      "type": "Löschungsankündigung",
      "state": "Berlin",
      "amtsgericht": "Amtsgericht Berlin (Charlottenburg)",
      "registernummer": "HRB 95402",
      "registerart": "HRB",
      "company_name": "Caffein Espressosysteme GmbH",
      "company_seat": "Berlin",
      "details": "16.10.2024 (Bekanntmachungsdatum)\n\nBerlin Amtsgericht Berlin (Charlottenburg) HRB 95402\nLöschungsankündigung\n\nCaffein Espressosysteme GmbH\nGesellschaft mit beschränkter Haftung\nBerlin\n\nBei der nachstehenden Gesellschaft wird das Amtslöschungsverfahren gemäß § 394 FamFG eingeleitet. Widerspruchsfrist: 6 Wochen."
    },
    {
      "date": "2024-10-16",
      "id": "90669",
      "original_text": "Registerbekanntmachung nach dem Umwandlungsgesetz\nHessen Amtsgericht Bad Homburg v.d.H. VR 1016\nCaritasverband Taunus e.V. – Bad Homburg v. d. Höhe",
      "type": "Registerbekanntmachung nach dem Umwandlungsgesetz",
      "state": "Hessen",
      "amtsgericht": "Amtsgericht Bad Homburg v.d.H.",
      "registernummer": "VR 1016",
      "registerart": "VR",
      "company_name": "Caritasverband Taunus e.V.",
      "company_seat": "Bad Homburg v. d. Höhe",
      "details": "16.10.2024 (Bekanntmachungsdatum)\n\nHessen Amtsgericht Bad Homburg v.d.H. VR 1016\nRegisterbekanntmachung nach dem Umwandlungsgesetz 16.10.2024 (Eintragungsdatum)\n\nCaritasverband Taunus e.V.\neingetragener Verein\nBad Homburg v. d. Höhe\n\nDen Gläubigern der an der Verschmelzung beteiligten Rechtsträger ist, wenn sie binnen sechs Monaten nach dem Tag, an dem die Eintragung der Verschmelzung in das Register des Sitzes desjenigen Rechtsträgers, dessen Gläubiger sie sind, nach § 19 Absatz 3 UmwG bekannt gemacht worden ist, ihren Anspruch nach Grund und Höhe schriftlich anmelden, Sicherheit zu leisten, soweit sie nicht Befriedigung verlangen können. Dieses Recht steht den Gläubigern jedoch nur zu, wenn sie glaubhaft machen, dass durch die Verschmelzung die Erfüllung ihrer Forderung gefährdet wird."
    },
    {
      "date": "2024-10-16",
      "id": "90608",
      "original_text": "Löschungsankündigung\nBerlin Amtsgericht Berlin (Charlottenburg) HRB 102418\nChristo Mare Yachting GmbH – Berlin",
      "type": "Löschungsankündigung",
      "state": "Berlin",
      "amtsgericht": "Amtsgericht Berlin (Charlottenburg)",
      "registernummer": "HRB 102418",
      "registerart": "HRB",
      "company_name": "Christo Mare Yachting GmbH",
      "company_seat": "Berlin",
      "details": "16.10.2024 (Bekanntmachungsdatum)\n\nBerlin Amtsgericht Berlin (Charlottenburg) HRB 102418\nLöschungsankündigung\n\nChristo Mare Yachting GmbH\nGesellschaft mit beschränkter Haftung\nBerlin\n\nBei der nachstehenden Gesellschaft wird das Amtslöschungsverfahren gemäß § 394 FamFG eingeleitet. Widerspruchsfrist: 6 Wochen."
    },
    {
      "date": "2024-10-16",
      "id": "90582",
      "original_text": "Registerbekanntmachung nach dem Umwandlungsgesetz\nSachsen-Anhalt Amtsgericht Stendal HRB 215036\nConcentrix Halle GmbH – Halle (Saale)",
      "type": "Registerbekanntmachung nach dem Umwandlungsgesetz",
      "state": "Sachsen-Anhalt",
      "amtsgericht": "Amtsgericht Stendal",
      "registernummer": "HRB 215036",
      "registerart": "HRB",
      "company_name": "Concentrix Halle GmbH",
      "company_seat": "Halle (Saale)",
      "details": "16.10.2024 (Bekanntmachungsdatum)\n\nSachsen-Anhalt Amtsgericht Stendal HRB 215036\nRegisterbekanntmachung nach dem Umwandlungsgesetz 16.10.2024 (Eintragungsdatum)\n\nConcentrix Halle GmbH\nGesellschaft mit beschränkter Haftung\nHalle (Saale)\n\nNicht eingetragen:\nDen Gläubigern der an der Verschmelzung beteiligten Rechtsträger ist, wenn sie binnen sechs Monaten nach dem Tag, an dem die Eintragung der Verschmelzung nach § 19 Abs. 3 UmwG als bekanntgemacht gilt, ihren Anspruch nach Grund und Höhe schriftlich anmelden, Sicherheit zu leisten, soweit sie nicht Befriedigung verlangen können. Dieses Recht steht ihnen jedoch nur zu, wenn sie glaubhaft machen, dass durch die Verschmelzung die Erfüllung ihrer Forderung gefährdet wird."
    },
    {
      "date": "2024-10-16",
      "id": "90593",
      "original_text": "Registerbekanntmachung nach dem Umwandlungsgesetz\nThüringen Amtsgericht Jena HRB 501093\nDO Kinder- und Jugendhilfe gGmbH – Jena",
      "type": "Registerbekanntmachung nach dem Umwandlungsgesetz",
      "state": "Thüringen",
      "amtsgericht": "Amtsgericht Jena",
      "registernummer": "HRB 501093",
      "registerart": "HRB",
      "company_name": "DO Kinder- und Jugendhilfe gGmbH",
      "company_seat": "Jena",
      "details": "16.10.2024 (Bekanntmachungsdatum)\n\nThüringen Amtsgericht Jena HRB 501093\nRegisterbekanntmachung nach dem Umwandlungsgesetz 16.10.2024 (Eintragungsdatum)\n\nDO Kinder- und Jugendhilfe gGmbH\nGesellschaft mit beschränkter Haftung\nJena\n\nNicht eingetragen: Den Gläubigern der an der Verschmelzung beteiligten Rechtsträger, ist wenn sie binnen sechs Monaten nach dem Tag, an dem die Eintragung der Verschmelzung in das Register des Sitzes desjenigen Rechtsträgers, dessen Gläubiger sie sind,  nach § 19 Abs. 3 UmwG als bekanntgemacht gilt, ihren Anspruch nach Grund und Höhe schriftlich anmelden, Sicherheit zu leisten, soweit sie nicht Befriedigung verlangen können. Dieses Recht steht ihnen jedoch nur zu, wenn sie glaubhaft machen, daß durch die Verschmelzung die Erfüllung ihrer Forderung gefährdet wird."
    },
    {
      "date": "2024-10-16",
      "id": "90609",
      "original_text": "Löschungsankündigung\nBrandenburg Amtsgericht Neuruppin HRB 13773\nDash-Sicherheit GmbH – Oranienburg",
      "type": "Löschungsankündigung",
      "state": "Brandenburg",
      "amtsgericht": "Amtsgericht Neuruppin",
      "registernummer": "HRB 13773",
      "registerart": "HRB",
      "company_name": "Dash-Sicherheit GmbH",
      "company_seat": "Oranienburg",
      "details": "16.10.2024 (Bekanntmachungsdatum)\n\nBrandenburg Amtsgericht Neuruppin HRB 13773\nLöschungsankündigung\n\nDash-Sicherheit GmbH\nGesellschaft mit beschränkter Haftung\nOranienburg\n\nBei der nachstehenden Gesellschaft wird das Amtslöschungsverfahren gemäß § 394 FamFG eingeleitet.\nWiderspruchsfrist: 1 Monat"
    },
    {
      "date": "2024-10-16",
      "id": "90610",
      "original_text": "Registerbekanntmachung nach dem Umwandlungsgesetz\nBaden-Württemberg Amtsgericht Ulm VR 620440\nDeutscher Berufsverband Klinischer Umweltmediziner e.V. – Wangen im Allgäu",
      "type": "Registerbekanntmachung nach dem Umwandlungsgesetz",
      "state": "Baden-Württemberg",
      "amtsgericht": "Amtsgericht Ulm",
      "registernummer": "VR 620440",
      "registerart": "VR",
      "company_name": "Deutscher Berufsverband Klinischer Umweltmediziner e.V.",
      "company_seat": "Wangen im Allgäu",
      "details": "16.10.2024 (Bekanntmachungsdatum)\n\nBaden-Württemberg Amtsgericht Ulm VR 620440\nRegisterbekanntmachung nach dem Umwandlungsgesetz 16.10.2024 (Eintragungsdatum)\n\nDeutscher Berufsverband Klinischer Umweltmediziner e.V.\neingetragener Verein\nWangen im Allgäu\n\nDen Gläubigern der an der Verschmelzung beteiligten Rechtsträger ist, wenn sie binnen sechs Monaten nach dem Tag, an dem die Eintragung der Verschmelzung in das Register des Sitzes desjenigen Rechtsträgers, dessen Gläubiger sie sind, nach § 19 Abs. 3 UmwG als bekanntgemacht gilt, ihren Anspruch nach Grund und Höhe schriftlich anmelden, Sicherheit zu leisten, soweit sie nicht Befriedigung verlangen können. Dieses Recht steht den Gläubigern jedoch nur zu, wenn sie glaubhaft machen, dass durch die Verschmelzung die Erfüllung ihrer Forderung gefährdet wird."
    },
    {
      "date": "2024-10-16",
      "id": "90575",
      "original_text": "Registerbekanntmachung nach dem Umwandlungsgesetz\nSchleswig-Holstein Amtsgericht Lübeck VR 4765\nDeutsches Rotes Kreuz Ortsverein Petersdorf e. V. – Petersdorf",
      "type": "Registerbekanntmachung nach dem Umwandlungsgesetz",
      "state": "Schleswig-Holstein",
      "amtsgericht": "Amtsgericht Lübeck",
      "registernummer": "VR 4765",
      "registerart": "VR",
      "company_name": "Deutsches Rotes Kreuz Ortsverein Petersdorf e. V.",
      "company_seat": "Petersdorf",
      "details": "16.10.2024 (Bekanntmachungsdatum)\n\nSchleswig-Holstein Amtsgericht Lübeck VR 4765\nRegisterbekanntmachung nach dem Umwandlungsgesetz 14.10.2024 (Eintragungsdatum)\n\nDeutsches Rotes Kreuz Ortsverein Petersdorf e. V.\neingetragener Verein\nPetersdorf\n\nZu Eintragungsnummer 2 vom 14.10.2024 wird als nicht eingetragen veröffentlicht:   Den Gläubigern der an der Verschmelzung beteiligten Rechtsträger ist, wenn sie binnen sechs Monaten nach dem Tag, an dem die Eintragung der Verschmelzung in das Register des Sitzes desjenigen Rechtsträgers, dessen Gläubiger sie sind, als bekannt gemacht gilt, ihren Anspruch nach Grund und Höhe schriftlich anmelden, Sicherheit zu leisten, soweit sie nicht Befriedigung verlangen können. Dieses Recht steht den Gläubigern jedoch nur zu, wenn sie glaubhaft machen, dass durch die Verschmelzung die Erfüllung ihrer Forderung gefährdet wird."
    },
    {
      "date": "2024-10-16",
      "id": "90594",
      "original_text": "Registerbekanntmachung nach dem Umwandlungsgesetz\nThüringen Amtsgericht Jena HRB 207077\nDiako Ostthüringen gemeinnützige GmbH – Jena",
      "type": "Registerbekanntmachung nach dem Umwandlungsgesetz",
      "state": "Thüringen",
      "amtsgericht": "Amtsgericht Jena",
      "registernummer": "HRB 207077",
      "registerart": "HRB",
      "company_name": "Diako Ostthüringen gemeinnützige GmbH",
      "company_seat": "Jena",
      "details": "16.10.2024 (Bekanntmachungsdatum)\n\nThüringen Amtsgericht Jena HRB 207077\nRegisterbekanntmachung nach dem Umwandlungsgesetz 16.10.2024 (Eintragungsdatum)\n\nDiako Ostthüringen gemeinnützige GmbH\nGesellschaft mit beschränkter Haftung\nJena\n\nNicht eingetragen: Den Gläubigern der an der Verschmelzung beteiligten Rechtsträger, ist wenn sie binnen sechs Monaten nach dem Tag, an dem die Eintragung der Verschmelzung in das Register des Sitzes desjenigen Rechtsträgers, dessen Gläubiger sie sind,  nach § 19 Abs. 3 UmwG als bekanntgemacht gilt, ihren Anspruch nach Grund und Höhe schriftlich anmelden, Sicherheit zu leisten, soweit sie nicht Befriedigung verlangen können. Dieses Recht steht ihnen jedoch nur zu, wenn sie glaubhaft machen, daß durch die Verschmelzung die Erfüllung ihrer Forderung gefährdet wird."
    },
    {
      "date": "2024-10-16",
      "id": "90661",
      "original_text": "Registerbekanntmachung nach dem Umwandlungsgesetz\nNordrhein-Westfalen Amtsgericht Mönchengladbach HRA 5466\nEA Elektro-Automatik GmbH & Co. KG – Viersen",
      "type": "Registerbekanntmachung nach dem Umwandlungsgesetz",
      "state": "Nordrhein-Westfalen",
      "amtsgericht": "Amtsgericht Mönchengladbach",
      "registernummer": "HRA 5466",
      "registerart": "HRA",
      "company_name": "EA Elektro-Automatik GmbH & Co. KG",
      "company_seat": "Viersen",
      "details": "16.10.2024 (Bekanntmachungsdatum)\n\nNordrhein-Westfalen Amtsgericht Mönchengladbach HRA 5466\nRegisterbekanntmachung nach dem Umwandlungsgesetz 16.10.2024 (Eintragungsdatum)\n\nEA Elektro-Automatik GmbH & Co. KG\nKommanditgesellschaft\nViersen\n\nDen Gläubigern der an der formwechselnden Umwandlung beteiligten Rechtsträger ist, wenn sie binnen sechs Monaten nach dem Tag, an dem die Eintragung der formwechselnden Umwandlung in das Register des Sitzes desjenigen Rechtsträgers, dessen Gläubiger sie sind, nach § 19 Absatz 3 UmwG als bekanntgemacht gilt, ihren Anspruch nach Grund und Höhe schriftlich anmelden, Sicherheit zu leisten, soweit sie nicht Befriedigung verlangen können. Dieses Recht steht den Gläubigern jedoch nur zu, wenn sie glaubhaft machen, dass durch die formwechselnden Umwandlung die Erfüllung ihrer Forderung gefährdet wird."
    },
    {
      "date": "2024-10-16",
      "id": "90577",
      "original_text": "Löschungsankündigung\nBerlin Amtsgericht Berlin (Charlottenburg) HRB 205374\nENERMED Deutschland GmbH – Berlin",
      "type": "Löschungsankündigung",
      "state": "Berlin",
      "amtsgericht": "Amtsgericht Berlin (Charlottenburg)",
      "registernummer": "HRB 205374",
      "registerart": "HRB",
      "company_name": "ENERMED Deutschland GmbH",
      "company_seat": "Berlin",
      "details": "16.10.2024 (Bekanntmachungsdatum)\n\nBerlin Amtsgericht Berlin (Charlottenburg) HRB 205374\nLöschungsankündigung\n\nENERMED Deutschland GmbH\nGesellschaft mit beschränkter Haftung\nBerlin\n\nBei der nachstehenden Gesellschaft wird das Amtslöschungsverfahren gemäß § 394 FamFG eingeleitet. Widerspruchsfrist 6 Wochen"
    },
    {
      "date": "2024-10-16",
      "id": "90623",
      "original_text": "Registerbekanntmachung nach dem Umwandlungsgesetz\nNiedersachsen Amtsgericht Osnabrück HRA 209226\nEdelwarm Ofenbau Thomas Benning e.K. – Lingen (Ems)",
      "type": "Registerbekanntmachung nach dem Umwandlungsgesetz",
      "state": "Niedersachsen",
      "amtsgericht": "Amtsgericht Osnabrück",
      "registernummer": "HRA 209226",
      "registerart": "HRA",
      "company_name": "Edelwarm Ofenbau Thomas Benning e.K.",
      "company_seat": "Lingen (Ems)",
      "details": "16.10.2024 (Bekanntmachungsdatum)\n\nNiedersachsen Amtsgericht Osnabrück HRA 209226\nRegisterbekanntmachung nach dem Umwandlungsgesetz 16.10.2024 (Eintragungsdatum)\n\nEdelwarm Ofenbau Thomas Benning e.K.\nEinzelkaufmann / Einzelkauffrau\nLingen (Ems)\n\nDen Gläubigern der an der Ausgliederung beteiligten Rechtsträger ist, wenn sie binnen sechs Monaten nach dem Tag, an dem die Eintragung der Ausgliederung in das Register des Sitzes desjenigen Rechtsträgers, dessen Gläubiger sie sind, nach § 19 Abs. 3 UmwG als bekannt gemacht gilt, ihren Anspruch nach Grund und Höhe schriftlich anmelden, Sicherheit zu leisten, soweit sie nicht Befriedigung verlangen können. Dieses Recht steht den Gläubigern jedoch nur zu, wenn sie glaubhaft machen, dass durch die Ausgliederung die Erfüllung der Forderung gefährdet wird."
    },
    {
      "date": "2024-10-16",
      "id": "90601",
      "original_text": "Registerbekanntmachung nach dem Umwandlungsgesetz\nNordrhein-Westfalen Amtsgericht Coesfeld HRA 8946\nEmils Gastro GmbH & Co. KG – Vreden",
      "type": "Registerbekanntmachung nach dem Umwandlungsgesetz",
      "state": "Nordrhein-Westfalen",
      "amtsgericht": "Amtsgericht Coesfeld",
      "registernummer": "HRA 8946",
      "registerart": "HRA",
      "company_name": "Emils Gastro GmbH & Co. KG",
      "company_seat": "Vreden",
      "details": "16.10.2024 (Bekanntmachungsdatum)\n\nNordrhein-Westfalen Amtsgericht Coesfeld HRA 8946\nRegisterbekanntmachung nach dem Umwandlungsgesetz 16.10.2024 (Eintragungsdatum)\n\nEmils Gastro GmbH & Co. KG\nKommanditgesellschaft\nVreden\n\nDen Gläubigern der an der Verschmelzung beteiligten Rechtsträger ist, wenn sie binnen sechs Monaten nach dem Tag, an dem die Eintragung der Verschmelzung in das Register des Sitzes desjenigen Rechtsträgers, dessen Gläubiger sie sind, nach § 19 Absatz 3 UmwG als bekanntgemacht gilt, ihren Anspruch nach Grund und Höhe schriftlich anmelden, Sicherheit zu leisten, soweit sie nicht Befriedigung verlangen können. Dieses Recht steht den Gläubigern jedoch nur zu, wenn sie glaubhaft machen, dass durch die Verschmelzung die Erfüllung ihrer Forderung gefährdet wird."
    },
    {
      "date": "2024-10-16",
      "id": "90657",
      "original_text": "Registerbekanntmachung nach dem Umwandlungsgesetz\nNordrhein-Westfalen Amtsgericht Bad Oeynhausen HRB 18137\nEqin Deutschland GmbH – Bad Oeynhausen",
      "type": "Registerbekanntmachung nach dem Umwandlungsgesetz",
      "state": "Nordrhein-Westfalen",
      "amtsgericht": "Amtsgericht Bad Oeynhausen",
      "registernummer": "HRB 18137",
      "registerart": "HRB",
      "company_name": "Eqin Deutschland GmbH",
      "company_seat": "Bad Oeynhausen",
      "details": "16.10.2024 (Bekanntmachungsdatum)\n\nNordrhein-Westfalen Amtsgericht Bad Oeynhausen HRB 18137\nRegisterbekanntmachung nach dem Umwandlungsgesetz 16.10.2024 (Eintragungsdatum)\n\nEqin Deutschland GmbH\nGesellschaft mit beschränkter Haftung\nBad Oeynhausen\n\nDen Gläubigern der an der Verschmelzung beteiligten Rechtsträger ist, wenn sie binnen sechs Monaten nach dem Tag, an dem die Eintragung der Verschmelzung in das Register des Sitzes desjenigen Rechtsträgers, dessen Gläubiger sie sind, nach § 19 Absatz 3 UmwG als bekanntgemacht gilt, ihren Anspruch nach Grund und Höhe schriftlich anmelden, Sicherheit zu leisten, soweit sie nicht Befriedigung verlangen können. Dieses Recht steht den Gläubigern jedoch nur zu, wenn sie glaubhaft machen, dass durch die Verschmelzung die Erfüllung ihrer Forderung gefährdet wird."
    },
    {
      "date": "2024-10-16",
      "id": "90653",
      "original_text": "Löschungsankündigung\nNordrhein-Westfalen Amtsgericht Mönchengladbach HRB 19406\nEumerica Classic Motors GmbH – Schwalmtal",
      "type": "Löschungsankündigung",
      "state": "Nordrhein-Westfalen",
      "amtsgericht": "Amtsgericht Mönchengladbach",
      "registernummer": "HRB 19406",
      "registerart": "HRB",
      "company_name": "Eumerica Classic Motors GmbH",
      "company_seat": "Schwalmtal",
      "details": "16.10.2024 (Bekanntmachungsdatum)\n\nNordrhein-Westfalen Amtsgericht Mönchengladbach HRB 19406\nLöschungsankündigung\n\nEumerica Classic Motors GmbH\nGesellschaft mit beschränkter Haftung\nSchwalmtal\n\nEumerica Classic Motors GmbH, Schwalmtal (Amtsgericht Mönchengladbach, HRB 19406)\nDas Registergericht beabsichtigt, die im Handelsregister eingetragene Gesellschaft gemäß § 394 Absatz 1 FamFG wegen Vermögenslosigkeit von Amts wegen zu löschen. Gegen diese Verfügung kann Widerspruch eingelegt werden. Die Frist zur Erhebung eines Widerspruchs gegen die beabsichtigte Löschung von Amts wegen ist auf drei Monate festgesetzt."
    },
    {
      "date": "2024-10-16",
      "id": "90665",
      "original_text": "Löschungsankündigung\nNordrhein-Westfalen Amtsgericht Dortmund HRB 23808\nFIIV - Food Invest International Vermögen GmbH – Dortmund",
      "type": "Löschungsankündigung",
      "state": "Nordrhein-Westfalen",
      "amtsgericht": "Amtsgericht Dortmund",
      "registernummer": "HRB 23808",
      "registerart": "HRB",
      "company_name": "FIIV - Food Invest International Vermögen GmbH",
      "company_seat": "Dortmund",
      "details": "16.10.2024 (Bekanntmachungsdatum)\n\nNordrhein-Westfalen Amtsgericht Dortmund HRB 23808\nLöschungsankündigung\n\nFIIV - Food Invest International Vermögen GmbH\nGesellschaft mit beschränkter Haftung\nDortmund\n\nDas Registergericht beabsichtigt die Gesellschaft von Amts wegen nach § 394 FamFG zu löschen. Die Frist zur Erhebung eines Widerspruchs ist auf zwei Monate festgesetzt."
    },
    {
      "date": "2024-10-16",
      "id": "90681",
      "original_text": "Löschungsankündigung\nHessen Amtsgericht Offenbach am Main HRA 42232\nFINE Real Estate GmbH & Co. KG – Neu-Isenburg",
      "type": "Löschungsankündigung",
      "state": "Hessen",
      "amtsgericht": "Amtsgericht Offenbach am Main",
      "registernummer": "HRA 42232",
      "registerart": "HRA",
      "company_name": "FINE Real Estate GmbH & Co. KG",
      "company_seat": "Neu-Isenburg",
      "details": "16.10.2024 (Bekanntmachungsdatum)\n\nHessen Amtsgericht Offenbach am Main HRA 42232\nLöschungsankündigung\n\nFINE Real Estate GmbH & Co. KG\nKommanditgesellschaft\nNeu-Isenburg\n\nDas Registergericht beabsichtigt die im Handelsregister eingetragene Firma von Amts wegen nach § 394 FamFG zu löschen. Die Frist zur Erhebung eines Widerspruchs gegen die beabsichtigte Löschung wird auf 3 Monate festgesetzt."
    },
    {
      "date": "2024-10-16",
      "id": "90586",
      "original_text": "Registerbekanntmachung nach dem Umwandlungsgesetz\nMecklenburg-Vorpommern Amtsgericht Schwerin HRA 4712\nFahrschule Fritz e.K. – Schwerin",
      "type": "Registerbekanntmachung nach dem Umwandlungsgesetz",
      "state": "Mecklenburg-Vorpommern",
      "amtsgericht": "Amtsgericht Schwerin",
      "registernummer": "HRA 4712",
      "registerart": "HRA",
      "company_name": "Fahrschule Fritz e.K.",
      "company_seat": "Schwerin",
      "details": "16.10.2024 (Bekanntmachungsdatum)\n\nMecklenburg-Vorpommern Amtsgericht Schwerin HRA 4712\nRegisterbekanntmachung nach dem Umwandlungsgesetz 16.10.2024 (Eintragungsdatum)\n\nFahrschule Fritz e.K.\nEinzelkaufmann / Einzelkauffrau\nSchwerin\n\nAls nicht eingetragen wird veröffentlicht: Den Gläubigern der an der Ausgliederung beteiligten Rechtsträger ist, wenn sie binnen sechs Monaten nach dem Tag, an dem die Eintragung der Ausgliederung in das Register des Sitzes desjenigen Rechtsträgers, dessen Gläubiger sie sind, nach § 19 Abs. 3 UmwG als bekannt gemacht gilt, ihren Anspruch nach Grund und Höhe schriftlich anmelden,\nSicherheit zu leisten, soweit sie nicht Befriedigung verlangen können. Dieses Recht steht den Gläubigern jedoch nur zu, wenn sie glaubhaft machen, dass durch die Ausgliederung die Erfüllung der Forderung gefährdet wird."
    },
    {
      "date": "2024-10-16",
      "id": "90613",
      "original_text": "Löschungsankündigung\nBerlin Amtsgericht Berlin (Charlottenburg) HRB 249551\nFalway UG (haftungsbeschränkt) – Berlin",
      "type": "Löschungsankündigung",
      "state": "Berlin",
      "amtsgericht": "Amtsgericht Berlin (Charlottenburg)",
      "registernummer": "HRB 249551",
      "registerart": "HRB",
      "company_name": "Falway UG (haftungsbeschränkt)",
      "company_seat": "Berlin",
      "details": "16.10.2024 (Bekanntmachungsdatum)\n\nBerlin Amtsgericht Berlin (Charlottenburg) HRB 249551\nLöschungsankündigung\n\nFalway UG (haftungsbeschränkt)\nGesellschaft mit beschränkter Haftung\nBerlin\n\nBei der nachstehenden Gesellschaft wird das Amtslöschungsverfahren gemäß § 394 FamFG eingeleitet. Widerspruchsfrist 6 Wochen"
    },
    {
      "date": "2024-10-16",
      "id": "90592",
      "original_text": "Einreichung neuer Dokumente\nHamburg Amtsgericht Hamburg HRB 153232\nFinexity AG – Hamburg",
      "type": "Einreichung neuer Dokumente",
      "state": "Hamburg",
      "amtsgericht": "Amtsgericht Hamburg",
      "registernummer": "HRB 153232",
      "registerart": "HRB",
      "company_name": "Finexity AG",
      "company_seat": "Hamburg",
      "details": "16.10.2024 (Bekanntmachungsdatum)\n\nHamburg Amtsgericht Hamburg HRB 153232\nEinreichung neuer Dokumente\n\nFinexity AG\nAktiengesellschaft\nHamburg\n\nAls nicht eingetragen wird bekannt gemacht: Liste des Aufsichtsrats wurde eingereicht."
    },
    {
      "date": "2024-10-16",
      "id": "90555",
      "original_text": "Registerbekanntmachung nach dem Umwandlungsgesetz\nBayern Amtsgericht München HRB 238746\nFinparx Holding GmbH – München",
      "type": "Registerbekanntmachung nach dem Umwandlungsgesetz",
      "state": "Bayern",
      "amtsgericht": "Amtsgericht München",
      "registernummer": "HRB 238746",
      "registerart": "HRB",
      "company_name": "Finparx Holding GmbH",
      "company_seat": "München",
      "details": "16.10.2024 (Bekanntmachungsdatum)\n\nBayern Amtsgericht München HRB 238746\nRegisterbekanntmachung nach dem Umwandlungsgesetz 15.10.2024 (Eintragungsdatum)\n\nFinparx Holding GmbH\nGesellschaft mit beschränkter Haftung\nMünchen\n\nDen Gläubigern der an der Verschmelzung beteiligten Rechtsträger ist, wenn sie binnen sechs Monaten nach dem Tag, an dem die Eintragung der Verschmelzung in das Register des Sitzes desjenigen Rechtsträgers, dessen Gläubiger sie sind, nach § 19 Abs. 3 UmwG als bekannt gemacht gilt, ihren Anspruch nach Grund und Höhe schriftlich anmelden, Sicherheit zu leisten, soweit sie nicht Befriedigung verlangen können. Dieses Recht steht den Gläubigern jedoch nur zu, wenn sie glaubhaft machen, dass durch die Verschmelzung die Erfüllung ihrer Forderung gefährdet wird."
    },
    {
      "date": "2024-10-16",
      "id": "90574",
      "original_text": "Löschungsankündigung\nBrandenburg Amtsgericht Neuruppin HRB 10464\nFortuna Kyritz Automaten GmbH – Kyritz",
      "type": "Löschungsankündigung",
      "state": "Brandenburg",
      "amtsgericht": "Amtsgericht Neuruppin",
      "registernummer": "HRB 10464",
      "registerart": "HRB",
      "company_name": "Fortuna Kyritz Automaten GmbH",
      "company_seat": "Kyritz",
      "details": "16.10.2024 (Bekanntmachungsdatum)\n\nBrandenburg Amtsgericht Neuruppin HRB 10464\nLöschungsankündigung\n\nFortuna Kyritz Automaten GmbH\nGesellschaft mit beschränkter Haftung\nKyritz\n\nBei der nachstehenden Gesellschaft wird das Amtslöschungsverfahren gemäß § 394 FamFG eingeleitet.\nWiderspruchsfrist: 1 Monat"
    },
    {
      "date": "2024-10-16",
      "id": "90566",
      "original_text": "Einreichung neuer Dokumente\nBayern Amtsgericht Coburg HRB 3712\nGEISS Aktiengesellschaft – Seßlach",
      "type": "Einreichung neuer Dokumente",
      "state": "Bayern",
      "amtsgericht": "Amtsgericht Coburg",
      "registernummer": "HRB 3712",
      "registerart": "HRB",
      "company_name": "GEISS Aktiengesellschaft",
      "company_seat": "Seßlach",
      "details": "16.10.2024 (Bekanntmachungsdatum)\n\nBayern Amtsgericht Coburg HRB 3712\nEinreichung neuer Dokumente 15.10.2024 (Eintragungsdatum)\n\nGEISS Aktiengesellschaft\nAktiengesellschaft\nSeßlach\n\nDem Amtsgericht Coburg -Registergericht- ist eine Liste der Mitglieder des Aufsichtsrats eingereicht worden, § 106 AktG."
    },
    {
      "date": "2024-10-16",
      "id": "90662",
      "original_text": "Einreichung neuer Dokumente\nNordrhein-Westfalen Amtsgericht Gelsenkirchen HRB 4382\nGWG-Gladbecker Wohnungsgesellschaft mbH – Gladbeck",
      "type": "Einreichung neuer Dokumente",
      "state": "Nordrhein-Westfalen",
      "amtsgericht": "Amtsgericht Gelsenkirchen",
      "registernummer": "HRB 4382",
      "registerart": "HRB",
      "company_name": "GWG-Gladbecker Wohnungsgesellschaft mbH",
      "company_seat": "Gladbeck",
      "details": "16.10.2024 (Bekanntmachungsdatum)\n\nNordrhein-Westfalen Amtsgericht Gelsenkirchen HRB 4382\nEinreichung neuer Dokumente 16.10.2024 (Eintragungsdatum)\n\nGWG-Gladbecker Wohnungsgesellschaft mbH\nGesellschaft mit beschränkter Haftung\nGladbeck\n\nDem Registergericht ist eine neue Liste der Mitglieder des Aufsichtsrates eingereicht worden."
    },
    {
      "date": "2024-10-16",
      "id": "90578",
      "original_text": "Löschungsankündigung\nBrandenburg Amtsgericht Frankfurt/Oder VR 289\nGaragengemeinschaft \"Mittelweg\" e.V. Frankfurt (Oder) – Frankfurt (Oder)",
      "type": "Löschungsankündigung",
      "state": "Brandenburg",
      "amtsgericht": "Amtsgericht Frankfurt/Oder",
      "registernummer": "VR 289",
      "registerart": "VR",
      "company_name": "Garagengemeinschaft \"Mittelweg\" e.V. Frankfurt (Oder)",
      "company_seat": "Frankfurt (Oder)",
      "details": "16.10.2024 (Bekanntmachungsdatum)\n\nBrandenburg Amtsgericht Frankfurt/Oder VR 289\nLöschungsankündigung\n\nGaragengemeinschaft \"Mittelweg\" e.V. Frankfurt (Oder)\neingetragener Verein\nFrankfurt (Oder)\n\nBei der nachstehenden Gesellschaft/dem nachstehenden Verein wird das Amtslöschungsverfahren gemäß § 395 FamFG eingeleitet."
    },
    {
      "date": "2024-10-16",
      "id": "90629",
      "original_text": "Einreichung neuer Dokumente\nBremen Amtsgericht Bremen HRB 34064\nGoethe-Quartier Wohnungsbau AG – Bremerhaven",
      "type": "Einreichung neuer Dokumente",
      "state": "Bremen",
      "amtsgericht": "Amtsgericht Bremen",
      "registernummer": "HRB 34064",
      "registerart": "HRB",
      "company_name": "Goethe-Quartier Wohnungsbau AG",
      "company_seat": "Bremerhaven",
      "details": "16.10.2024 (Bekanntmachungsdatum)\n\nBremen Amtsgericht Bremen HRB 34064\nEinreichung neuer Dokumente\n\nGoethe-Quartier Wohnungsbau AG\nAktiengesellschaft\nBremerhaven\n\nAls nicht eingetragen wird bekannt gemacht: Liste des Aufsichtsrats wurde eingereicht."
    },
    {
      "date": "2024-10-16",
      "id": "90591",
      "original_text": "Registerbekanntmachung nach dem Umwandlungsgesetz\nBerlin Amtsgericht Berlin (Charlottenburg) HRA 63441\nGrawert e.K. – Berlin",
      "type": "Registerbekanntmachung nach dem Umwandlungsgesetz",
      "state": "Berlin",
      "amtsgericht": "Amtsgericht Berlin (Charlottenburg)",
      "registernummer": "HRA 63441",
      "registerart": "HRA",
      "company_name": "Grawert e.K.",
      "company_seat": "Berlin",
      "details": "16.10.2024 (Bekanntmachungsdatum)\n\nBerlin Amtsgericht Berlin (Charlottenburg) HRA 63441\nRegisterbekanntmachung nach dem Umwandlungsgesetz 15.10.2024 (Eintragungsdatum)\n\nGrawert e.K.\nEinzelkaufmann / Einzelkauffrau\nBerlin\n\nZu Eintragungsnummer 2 vom 15.10.2024 wird als nicht eingetragen veröffentlicht: Den Gläubigern der an der Spaltung beteiligten Rechtsträger ist, wenn sie binnen sechs Monaten nach dem Tag, an dem die Eintragung der Spaltung in das Register des Sitzes desjenigen Rechtsträgers, dessen Gläubiger sie sind, als bekannt gemacht gilt, ihren Anspruch nach Grund und Höhe schriftlich anmelden, Sicherheit zu leisten, soweit sie nicht Befriedigung verlangen können. Dieses Recht steht den Gläubigern jedoch nur zu, wenn sie glaubhaft machen, dass durch die Spaltung die Erfüllung ihrer Forderung gefährdet wird. Das Recht, Sicherheitsleistung zu verlangen, steht Gläubigern nicht zu, die im Falle der Insolvenz ein Recht auf vorzugsweise Befriedigung aus einer Deckungsmasse haben, die nach gesetzlicher Vorschrift zu ihrem Schutz errichtet und staatlich überwacht ist."
    },
    {
      "date": "2024-10-16",
      "id": "90573",
      "original_text": "Löschungsankündigung\nBaden-Württemberg Amtsgericht Mannheim HRB 362040\nHBV Hallenbanden- Vermietungs Gesellschaft mbH – Karlsbad",
      "type": "Löschungsankündigung",
      "state": "Baden-Württemberg",
      "amtsgericht": "Amtsgericht Mannheim",
      "registernummer": "HRB 362040",
      "registerart": "HRB",
      "company_name": "HBV Hallenbanden- Vermietungs Gesellschaft mbH",
      "company_seat": "Karlsbad",
      "details": "16.10.2024 (Bekanntmachungsdatum)\n\nBaden-Württemberg Amtsgericht Mannheim HRB 362040\nLöschungsankündigung\n\nHBV Hallenbanden- Vermietungs Gesellschaft mbH\nGesellschaft mit beschränkter Haftung\nKarlsbad\n\nDas Gericht beabsichtigt, die Gesellschaft wegen Vermögenslosigkeit im Handelsregister von Amts wegen nach § 394 FamFG zu löschen. Die Frist zur Geltendmachung eines Widerspruchs gegen die beabsichtigte Löschung ist auf einen Monat ab Veröffentlichung bestimmt."
    },
    {
      "date": "2024-10-16",
      "id": "90603",
      "original_text": "Einreichung neuer Dokumente\nHamburg Amtsgericht Hamburg HRB 3072\nHamburger Hochbahn Aktiengesellschaft – Hamburg",
      "type": "Einreichung neuer Dokumente",
      "state": "Hamburg",
      "amtsgericht": "Amtsgericht Hamburg",
      "registernummer": "HRB 3072",
      "registerart": "HRB",
      "company_name": "Hamburger Hochbahn Aktiengesellschaft",
      "company_seat": "Hamburg",
      "details": "16.10.2024 (Bekanntmachungsdatum)\n\nHamburg Amtsgericht Hamburg HRB 3072\nEinreichung neuer Dokumente\n\nHamburger Hochbahn Aktiengesellschaft\nAktiengesellschaft\nHamburg\n\nAls nicht eingetragen wird bekannt gemacht: Liste des Aufsichtsrats wurde eingereicht."
    },
    {
      "date": "2024-10-16",
      "id": "90604",
      "original_text": "Löschungsankündigung\nBaden-Württemberg Amtsgericht Freiburg HRB 726271\nHandel & Bau Gesellschaft mbH – Lahr",
      "type": "Löschungsankündigung",
      "state": "Baden-Württemberg",
      "amtsgericht": "Amtsgericht Freiburg",
      "registernummer": "HRB 726271",
      "registerart": "HRB",
      "company_name": "Handel & Bau Gesellschaft mbH",
      "company_seat": "Lahr",
      "details": "16.10.2024 (Bekanntmachungsdatum)\n\nBaden-Württemberg Amtsgericht Freiburg HRB 726271\nLöschungsankündigung\n\nHandel & Bau Gesellschaft mbH\nGesellschaft mit beschränkter Haftung\nLahr\n\nDas Gericht beabsichtigt, die Gesellschaft wegen Vermögenslosigkeit im Handelsregister von Amts wegen nach § 394 FamFG zu löschen. Die Frist zur Geltendmachung eines Widerspruchs gegen die beabsichtigte Löschung ist auf einen Monat ab Veröffentlichung bestimmt."
    },
    {
      "date": "2024-10-16",
      "id": "90646",
      "original_text": "Löschungsankündigung\nRheinland-Pfalz Amtsgericht Koblenz HRB 12464\nHans Peter Ott Verwaltungs GmbH – Weißenthurm",
      "type": "Löschungsankündigung",
      "state": "Rheinland-Pfalz",
      "amtsgericht": "Amtsgericht Koblenz",
      "registernummer": "HRB 12464",
      "registerart": "HRB",
      "company_name": "Hans Peter Ott Verwaltungs GmbH",
      "company_seat": "Weißenthurm",
      "details": "16.10.2024 (Bekanntmachungsdatum)\n\nRheinland-Pfalz Amtsgericht Koblenz HRB 12464\nLöschungsankündigung\n\nHans Peter Ott Verwaltungs GmbH\nGesellschaft mit beschränkter Haftung\nWeißenthurm\n\nDas Registergericht beabsichtigt die Gesellschaft wegen Vermögenslosigkeit von Amts wegen nach § 394 FamFG zu löschen. Die Frist zur Erhebung eines Widerspruchs ist auf zwei Monate festgesetzt."
    },
    {
      "date": "2024-10-16",
      "id": "90655",
      "original_text": "Registerbekanntmachung nach dem Umwandlungsgesetz\nNordrhein-Westfalen Amtsgericht Düsseldorf HRB 106728\nIB Hamacher GmbH – Ratingen",
      "type": "Registerbekanntmachung nach dem Umwandlungsgesetz",
      "state": "Nordrhein-Westfalen",
      "amtsgericht": "Amtsgericht Düsseldorf",
      "registernummer": "HRB 106728",
      "registerart": "HRB",
      "company_name": "IB Hamacher GmbH",
      "company_seat": "Ratingen",
      "details": "16.10.2024 (Bekanntmachungsdatum)\n\nNordrhein-Westfalen Amtsgericht Düsseldorf HRB 106728\nRegisterbekanntmachung nach dem Umwandlungsgesetz 16.10.2024 (Eintragungsdatum)\n\nIB Hamacher GmbH\nGesellschaft mit beschränkter Haftung\nRatingen\n\nDen Gläubigern der an der Ausgliederung beteiligten Rechtsträger ist, wenn sie binnen sechs Monaten nach dem Tag, an dem die Eintragung der Ausgliederung in das Register des Sitzes desjenigen Rechtsträgers, dessen Gläubiger sie sind, nach § 19 Absatz 3 UmwG als bekanntgemacht gilt, ihren Anspruch nach Grund und Höhe schriftlich anmelden, Sicherheit zu leisten, soweit sie nicht Befriedigung verlangen können. Dieses Recht steht den Gläubigern jedoch nur zu, wenn sie glaubhaft machen, dass durch die Ausgliederung die Erfüllung ihrer Forderung gefährdet wird."
    },
    {
      "date": "2024-10-16",
      "id": "90640",
      "original_text": "Registerbekanntmachung nach dem Umwandlungsgesetz\nRheinland-Pfalz Amtsgericht Mainz HRB 7649\nIGW AG – Zornheim",
      "type": "Registerbekanntmachung nach dem Umwandlungsgesetz",
      "state": "Rheinland-Pfalz",
      "amtsgericht": "Amtsgericht Mainz",
      "registernummer": "HRB 7649",
      "registerart": "HRB",
      "company_name": "IGW AG",
      "company_seat": "Zornheim",
      "details": "16.10.2024 (Bekanntmachungsdatum)\n\nRheinland-Pfalz Amtsgericht Mainz HRB 7649\nRegisterbekanntmachung nach dem Umwandlungsgesetz 16.10.2024 (Eintragungsdatum)\n\nIGW AG\nAktiengesellschaft\nZornheim\n\nAls nicht eingetragen wird veröffentlicht:\nDen Gläubigern des formwechselnden Rechtsträgers ist, wenn sie binnen sechs Monaten nach dem Tag, an dem die Eintragung des Formwechsels nach § 201 UmwG als bekannt gemacht gilt, ihren Anspruch nach Grund und Höhe schriftlich anmelden, Sicherheit zu leisten, soweit sie nicht Befriedigung verlangen können. Dieses Recht steht den Gläubigern jedoch nur zu, wenn sie glaubhaft machen, dass durch den Formwechsel die Erfüllung der Forderung gefährdet wird."
    },
    {
      "date": "2024-10-16",
      "id": "90605",
      "original_text": "Löschungsankündigung\nBerlin Amtsgericht Berlin (Charlottenburg) HRB 138347\nIQS Systems UG (haftungsbeschränkt) – Berlin",
      "type": "Löschungsankündigung",
      "state": "Berlin",
      "amtsgericht": "Amtsgericht Berlin (Charlottenburg)",
      "registernummer": "HRB 138347",
      "registerart": "HRB",
      "company_name": "IQS Systems UG (haftungsbeschränkt)",
      "company_seat": "Berlin",
      "details": "16.10.2024 (Bekanntmachungsdatum)\n\nBerlin Amtsgericht Berlin (Charlottenburg) HRB 138347\nLöschungsankündigung\n\nIQS Systems UG (haftungsbeschränkt)\nGesellschaft mit beschränkter Haftung\nBerlin\n\nBei der nachstehenden Gesellschaft wird das Amtslöschungsverfahren gemäß § 394 FamFG eingeleitet. Widerspruchsfrist 6 Wochen"
    },
    {
      "date": "2024-10-16",
      "id": "90620",
      "original_text": "Löschungsankündigung\nSachsen Amtsgericht Leipzig HRB 31629\nImmo Nord GmbH – Leipzig",
      "type": "Löschungsankündigung",
      "state": "Sachsen",
      "amtsgericht": "Amtsgericht Leipzig",
      "registernummer": "HRB 31629",
      "registerart": "HRB",
      "company_name": "Immo Nord GmbH",
      "company_seat": "Leipzig",
      "details": "16.10.2024 (Bekanntmachungsdatum)\n\nSachsen Amtsgericht Leipzig HRB 31629\nLöschungsankündigung 16.10.2024 (Eintragungsdatum)\n\nImmo Nord GmbH\nGesellschaft mit beschränkter Haftung\nLeipzig\n\nDas Registergericht beabsichtigt, die im Handelsregister eingetragene Gesellschaft von Amts wegen nach § 394 FamFG zu löschen. Die Frist zu Erhebung eines Widerspruchs gegen die beabsichtigte Löschung wird auf einen Monat festgesetzt."
    },
    {
      "date": "2024-10-16",
      "id": "90559",
      "original_text": "Registerbekanntmachung nach dem Umwandlungsgesetz\nBayern Amtsgericht München HRA 119833\nIndustrieservice Hinterholzer e.K. – Unterschleißheim",
      "type": "Registerbekanntmachung nach dem Umwandlungsgesetz",
      "state": "Bayern",
      "amtsgericht": "Amtsgericht München",
      "registernummer": "HRA 119833",
      "registerart": "HRA",
      "company_name": "Industrieservice Hinterholzer e.K.",
      "company_seat": "Unterschleißheim",
      "details": "16.10.2024 (Bekanntmachungsdatum)\n\nBayern Amtsgericht München HRA 119833\nRegisterbekanntmachung nach dem Umwandlungsgesetz 15.10.2024 (Eintragungsdatum)\n\nIndustrieservice Hinterholzer e.K.\nEinzelkaufmann / Einzelkauffrau\nUnterschleißheim\n\nDen Gläubigern der an der Ausgliederung beteiligten Rechtsträger ist, wenn sie binnen sechs Monaten nach dem Tag, an dem die Eintragung der Ausgliederung in das Register des Sitzes desjenigen Rechtsträgers, dessen Gläubiger sie sind, nach §§ 125, 19 Abs. 3 UmwG als bekannt gemacht gilt, ihren Anspruch nach Grund und Höhe schriftlich anmelden, Sicherheit zu leisten, soweit sie nicht Befriedigung verlangen können. Dieses Recht steht den Gläubigern jedoch nur zu, wenn sie glaubhaft machen, dass durch die Ausgliederung die Erfüllung ihrer Forderung gefährdet wird."
    },
    {
      "date": "2024-10-16",
      "id": "90597",
      "original_text": "Registerbekanntmachung nach dem Umwandlungsgesetz\nBerlin Amtsgericht Berlin (Charlottenburg) HRA 63142\nJade Palast Senlei Ye e.K. – Berlin",
      "type": "Registerbekanntmachung nach dem Umwandlungsgesetz",
      "state": "Berlin",
      "amtsgericht": "Amtsgericht Berlin (Charlottenburg)",
      "registernummer": "HRA 63142",
      "registerart": "HRA",
      "company_name": "Jade Palast Senlei Ye e.K.",
      "company_seat": "Berlin",
      "details": "16.10.2024 (Bekanntmachungsdatum)\n\nBerlin Amtsgericht Berlin (Charlottenburg) HRA 63142\nRegisterbekanntmachung nach dem Umwandlungsgesetz 14.10.2024 (Eintragungsdatum)\n\nJade Palast Senlei Ye e.K.\nEinzelkaufmann / Einzelkauffrau\nBerlin\n\nZu Eintragungsnummer 2 vom 14.10.2024 wird als nicht eingetragen veröffentlicht: Den Gläubigern der an der Spaltung beteiligten Rechtsträger ist, wenn sie binnen sechs Monaten nach dem Tag, an dem die Eintragung der Spaltung in das Register des Sitzes desjenigen Rechtsträgers, dessen Gläubiger sie sind, als bekannt gemacht gilt, ihren Anspruch nach Grund und Höhe schriftlich anmelden, Sicherheit zu leisten, soweit sie nicht Befriedigung verlangen können. Dieses Recht steht den Gläubigern jedoch nur zu, wenn sie glaubhaft machen, dass durch die Spaltung die Erfüllung ihrer Forderung gefährdet wird. Das Recht, Sicherheitsleistung zu verlangen, steht Gläubigern nicht zu, die im Falle der Insolvenz ein Recht auf vorzugsweise Befriedigung aus einer Deckungsmasse haben, die nach gesetzlicher Vorschrift zu ihrem Schutz errichtet und staatlich überwacht ist."
    },
    {
      "date": "2024-10-16",
      "id": "90625",
      "original_text": "Registerbekanntmachung nach dem Umwandlungsgesetz\nNiedersachsen Amtsgericht Oldenburg (Oldenburg) HRB 200745\nKBG GmbH – Wildeshausen",
      "type": "Registerbekanntmachung nach dem Umwandlungsgesetz",
      "state": "Niedersachsen",
      "amtsgericht": "Amtsgericht Oldenburg (Oldenburg)",
      "registernummer": "HRB 200745",
      "registerart": "HRB",
      "company_name": "KBG GmbH",
      "company_seat": "Wildeshausen",
      "details": "16.10.2024 (Bekanntmachungsdatum)\n\nNiedersachsen Amtsgericht Oldenburg (Oldenburg) HRB 200745\nRegisterbekanntmachung nach dem Umwandlungsgesetz 16.10.2024 (Eintragungsdatum)\n\nKBG GmbH\nGesellschaft mit beschränkter Haftung\nWildeshausen\n\nDen Gläubigern der an der Verschmelzung beteiligten Rechtsträger ist, wenn sie binnen sechs Monaten nach dem Tag, an dem die Eintragung der Verschmelzung in das Register des Sitzes desjenigen Rechtsträgers, dessen Gläubiger sie sind, nach § 19  Abs.  3 UmwG als bekannt gemacht gilt, ihren Anspruch nach Grund und Höhe schriftlich anmelden, Sicherheit zu leisten, soweit sie nicht Befriedigung verlangen können. Dieses Recht steht den Gläubigern jedoch nur zu, wenn sie glaubhaft machen, dass durch die Verschmelzung die Erfüllung der Forderung gefährdet wird."
    },
    {
      "date": "2024-10-16",
      "id": "90672",
      "original_text": "Sonstige Registerbekanntmachung\nHessen Amtsgericht Frankfurt am Main HRB 36083\nKEB Hana Bank (D) Aktiengesellschaft – Frankfurt am Main",
      "type": "Sonstige Registerbekanntmachung",
      "state": "Hessen",
      "amtsgericht": "Amtsgericht Frankfurt am Main",
      "registernummer": "HRB 36083",
      "registerart": "HRB",
      "company_name": "KEB Hana Bank (D) Aktiengesellschaft",
      "company_seat": "Frankfurt am Main",
      "details": "16.10.2024 (Bekanntmachungsdatum)\n\nHessen Amtsgericht Frankfurt am Main HRB 36083\nSonstige Registerbekanntmachung 16.10.2024 (Eintragungsdatum)\n\nKEB Hana Bank (D) Aktiengesellschaft\nAktiengesellschaft\nFrankfurt am Main\n\nDurch eine Änderung in den Personen der Aufsichtsratsmitglieder ist eine Liste der Mitglieder des Aufsichtsrates zum Handelsregister eingereicht worden."
    },
    {
      "date": "2024-10-16",
      "id": "90664",
      "original_text": "Registerbekanntmachung nach dem Umwandlungsgesetz\nNordrhein-Westfalen Amtsgericht Köln HRB 36170\nKONTEXT Gesellschaft für Psychosoziale Dienste GmbH – Köln",
      "type": "Registerbekanntmachung nach dem Umwandlungsgesetz",
      "state": "Nordrhein-Westfalen",
      "amtsgericht": "Amtsgericht Köln",
      "registernummer": "HRB 36170",
      "registerart": "HRB",
      "company_name": "KONTEXT Gesellschaft für Psychosoziale Dienste GmbH",
      "company_seat": "Köln",
      "details": "16.10.2024 (Bekanntmachungsdatum)\n\nNordrhein-Westfalen Amtsgericht Köln HRB 36170\nRegisterbekanntmachung nach dem Umwandlungsgesetz 16.10.2024 (Eintragungsdatum)\n\nKONTEXT Gesellschaft für Psychosoziale Dienste GmbH\nGesellschaft mit beschränkter Haftung\nKöln\n\nDen Gläubigern der an der Verschmelzung beteiligten Rechtsträger ist, wenn sie binnen sechs Monaten nach dem Tag, an dem die Eintragung der Verschmelzung in das Register des Sitzes desjenigen Rechtsträgers, dessen Gläubiger sie sind, nach § 19 Absatz 3 UmwG als bekanntgemacht gilt, ihren Anspruch nach Grund und Höhe schriftlich anmelden, Sicherheit zu leisten, soweit sie nicht Befriedigung verlangen können. Dieses Recht steht den Gläubigern jedoch nur zu, wenn sie glaubhaft machen, dass durch die Verschmelzung die Erfüllung ihrer Forderung gefährdet wird."
    },
    {
      "date": "2024-10-16",
      "id": "90561",
      "original_text": "Löschungsankündigung\nBayern Amtsgericht Fürth HRB 20232\nKS Services UG (haftungsbeschränkt) – Zirndorf",
      "type": "Löschungsankündigung",
      "state": "Bayern",
      "amtsgericht": "Amtsgericht Fürth",
      "registernummer": "HRB 20232",
      "registerart": "HRB",
      "company_name": "KS Services UG (haftungsbeschränkt)",
      "company_seat": "Zirndorf",
      "details": "16.10.2024 (Bekanntmachungsdatum)\n\nBayern Amtsgericht Fürth HRB 20232\nLöschungsankündigung\n\nKS Services UG (haftungsbeschränkt)\nGesellschaft mit beschränkter Haftung\nZirndorf\n\nDas Registergericht beabsichtigt, die im Handelsregister eingetragene Gesellschaft wegen Vermögenslosigkeit von Amts wegen nach § 394 FamFG zu löschen. Die Frist zur Erhebung eines Widerspruchs ist auf drei Monate festgesetzt."
    },
    {
      "date": "2024-10-16",
      "id": "90652",
      "original_text": "Löschungsankündigung\nNordrhein-Westfalen Amtsgericht Köln HRB 48667\nKarl Heinz Tenner Sanitäre Installationen, Öl- und Gasheizung GmbH – Leverkusen",
      "type": "Löschungsankündigung",
      "state": "Nordrhein-Westfalen",
      "amtsgericht": "Amtsgericht Köln",
      "registernummer": "HRB 48667",
      "registerart": "HRB",
      "company_name": "Karl Heinz Tenner Sanitäre Installationen, Öl- und Gasheizung GmbH",
      "company_seat": "Leverkusen",
      "details": "16.10.2024 (Bekanntmachungsdatum)\n\nNordrhein-Westfalen Amtsgericht Köln HRB 48667\nLöschungsankündigung\n\nKarl Heinz Tenner Sanitäre Installationen, Öl- und Gasheizung GmbH\nGesellschaft mit beschränkter Haftung\nLeverkusen\n\nDas Registergericht beabsichtigt, die im Handelsregister eingetragene Gesellschaft gemäß § 394 Absatz 1 FamFG wegen Vermögenslosigkeit von Amts wegen zu löschen. Gegen diese Verfügung kann Widerspruch eingelegt werden. Die Frist zur Erhebung eines Widerspruchs gegen die beabsichtigte Löschung von Amts wegen ist auf einen Monat festgesetzt. Rechtsbehelfsbelehrung: Gegen diese Verfügung können Sie Widerspruch einlegen. Der Widerspruch ist bei dem Amtsgericht Köln, Reichenspergerplatz 1, 50670 Köln schriftlich in deutscher Sprache oder zur Niederschrift der Geschäftsstelle einzulegen. Der Widerspruch kann auch zur Niederschrift der Geschäftsstelle eines jeden Amtsgerichtes abgegeben werden. Die Einlegung ist auch durch Übertragung eines elektronischen Dokuments an die elektronische Poststelle des Gerichts möglich. Das elektronische Dokument muss für die Bearbeitung durch das Gericht geeignet und mit einer qualifizierten elektronischen Signatur der verantwortenden Person versehen sein oder von der verantwortenden Person signiert und auf einem sicheren Übermittlungsweg gemäß § 130a ZPO nach näherer Maßgabe der Verordnung über die technischen Rahmenbedingungen des elektronischen Rechtsverkehrs und über das besondere elektronische Behördenpostfach (BGBl. I, S.3803) eingereicht werden. Weitere Informationen erhalten Sie auf der Internetseite www.justiz.de.Der Widerspruch muss spätestens innerhalb der gesetzten Frist bei dem Amtsgericht Köln eingegangen sein. Dies gilt auch dann, wenn der Widerspruch zur Niederschrift der Geschäftsstelle eines anderen Amtsgerichtes abgegeben wurde. Die Frist beginnt mit der Veröffentlichung. Fällt das Ende der Frist auf einen Sonntag, einen allgemeinen Feiertag oder Sonnabend, so endet die Frist mit Ablauf des nächsten Werktages.\n\nDer Widerspruch muss die Bezeichnung der angefochtenen Verfügung sowie die Erklärung enthalten, dass Widerspruch gegen diese Verfügung eingelegt wird. Er ist zu unterzeichnen und soll begründet werden."
    },
    {
      "date": "2024-10-16",
      "id": "90668",
      "original_text": "Sonstige Registerbekanntmachung\nHessen Amtsgericht Limburg VR 2063\nKeine Windkraft im Wald von Hünfelden und Hünstetten – Hünfelden",
      "type": "Sonstige Registerbekanntmachung",
      "state": "Hessen",
      "amtsgericht": "Amtsgericht Limburg",
      "registernummer": "VR 2063",
      "registerart": "VR",
      "company_name": "Keine Windkraft im Wald von Hünfelden und Hünstetten",
      "company_seat": "Hünfelden",
      "details": "16.10.2024 (Bekanntmachungsdatum)\n\nHessen Amtsgericht Limburg VR 2063\nSonstige Registerbekanntmachung 15.10.2024 (Eintragungsdatum)\n\nKeine Windkraft im Wald von Hünfelden und Hünstetten\neingetragener Verein\nHünfelden\n\nDurch rechtskräftigen Beschluss des Amtsgerichts Limburg vom 19.04.2024 ist dem Verein gemäß § 73 BGB die Rechtsfähigkeit entzogen worden."
    },
    {
      "date": "2024-10-16",
      "id": "90624",
      "original_text": "Registerbekanntmachung nach dem Umwandlungsgesetz\nNiedersachsen Amtsgericht Oldenburg (Oldenburg) HRB 205990\nKreienkamp Hähnchenschlachterei Verwaltungs-GmbH – Wildeshausen",
      "type": "Registerbekanntmachung nach dem Umwandlungsgesetz",
      "state": "Niedersachsen",
      "amtsgericht": "Amtsgericht Oldenburg (Oldenburg)",
      "registernummer": "HRB 205990",
      "registerart": "HRB",
      "company_name": "Kreienkamp Hähnchenschlachterei Verwaltungs-GmbH",
      "company_seat": "Wildeshausen",
      "details": "16.10.2024 (Bekanntmachungsdatum)\n\nNiedersachsen Amtsgericht Oldenburg (Oldenburg) HRB 205990\nRegisterbekanntmachung nach dem Umwandlungsgesetz 16.10.2024 (Eintragungsdatum)\n\nKreienkamp Hähnchenschlachterei Verwaltungs-GmbH\nGesellschaft mit beschränkter Haftung\nWildeshausen\n\nDen Gläubigern der an der Verschmelzung beteiligten Rechtsträger ist, wenn sie binnen sechs Monaten nach dem Tag, an dem die Eintragung der Verschmelzung in das Register des Sitzes desjenigen Rechtsträgers, dessen Gläubiger sie sind, nach § 19  Abs.  3 UmwG als bekannt gemacht gilt, ihren Anspruch nach Grund und Höhe schriftlich anmelden, Sicherheit zu leisten, soweit sie nicht Befriedigung verlangen können. Dieses Recht steht den Gläubigern jedoch nur zu, wenn sie glaubhaft machen, dass durch die Verschmelzung die Erfüllung der Forderung gefährdet wird."
    },
    {
      "date": "2024-10-16",
      "id": "90580",
      "original_text": "Einreichung neuer Dokumente\nBaden-Württemberg Amtsgericht Freiburg HRB 728548\nKörber Supply Chain Logistics GmbH – Konstanz",
      "type": "Einreichung neuer Dokumente",
      "state": "Baden-Württemberg",
      "amtsgericht": "Amtsgericht Freiburg",
      "registernummer": "HRB 728548",
      "registerart": "HRB",
      "company_name": "Körber Supply Chain Logistics GmbH",
      "company_seat": "Konstanz",
      "details": "16.10.2024 (Bekanntmachungsdatum)\n\nBaden-Württemberg Amtsgericht Freiburg HRB 728548\nEinreichung neuer Dokumente\n\nKörber Supply Chain Logistics GmbH\nGesellschaft mit beschränkter Haftung\nKonstanz\n\nDie Gesellschaft hat am 15.10.2024 die Liste über die Zusammensetzung des Aufsichtsrats zum Handelsregister eingereicht."
    },
    {
      "date": "2024-10-16",
      "id": "90634",
      "original_text": "Registerbekanntmachung nach dem Umwandlungsgesetz\nRheinland-Pfalz Amtsgericht Wittlich HRA 42101\nL'Angolo Ristorante e.K. – Trier",
      "type": "Registerbekanntmachung nach dem Umwandlungsgesetz",
      "state": "Rheinland-Pfalz",
      "amtsgericht": "Amtsgericht Wittlich",
      "registernummer": "HRA 42101",
      "registerart": "HRA",
      "company_name": "L'Angolo Ristorante e.K.",
      "company_seat": "Trier",
      "details": "16.10.2024 (Bekanntmachungsdatum)\n\nRheinland-Pfalz Amtsgericht Wittlich HRA 42101\nRegisterbekanntmachung nach dem Umwandlungsgesetz 16.10.2024 (Eintragungsdatum)\n\nL'Angolo Ristorante e.K.\nEinzelkaufmann / Einzelkauffrau\nTrier\n\nAls nicht eingetragen wird veröffentlicht: Den Gläubigern der an der Ausgliederung beteiligten Rechtsträger ist, wenn sie binnen sechs Monaten nac hdem Tag, an dem die Eintragung der Ausgliederung in das Register des Sitzes desjenigen Rechtsträgers,dessen Gläubiger sie sind, nach § 19 Abs. 3 UmwG als bekannt gemacht gilt, ihren Anspruch nach Grund und Höhe schriftlich anmelden, Sicherheit zu leisten, soweit sie nicht Befriedigung verlangen können. Dieses Recht steht den Gläubigern jedoch nur zu, wenn sie glaubhaft machen, dass durch die Ausgliederung die Erfüllung der Forderung gefährdet wird."
    },
    {
      "date": "2024-10-16",
      "id": "90628",
      "original_text": "Löschungsankündigung\nNiedersachsen Amtsgericht Braunschweig HRB 208695\nLuis Bau GmbH – Seesen",
      "type": "Löschungsankündigung",
      "state": "Niedersachsen",
      "amtsgericht": "Amtsgericht Braunschweig",
      "registernummer": "HRB 208695",
      "registerart": "HRB",
      "company_name": "Luis Bau GmbH",
      "company_seat": "Seesen",
      "details": "16.10.2024 (Bekanntmachungsdatum)\n\nNiedersachsen Amtsgericht Braunschweig HRB 208695\nLöschungsankündigung 16.10.2024 (Eintragungsdatum)\n\nLuis Bau GmbH\nGesellschaft mit beschränkter Haftung\nSeesen\n\nDas Registergericht beabsichtigt, die Gesellschaft von Amts wegen nach § 394 FamFG zu löschen. Die Frist zur Erhebung eines Widerspruchs ist auf 1 Monat ab dieser Registerbekanntmachung festgesetzt.."
    },
    {
      "date": "2024-10-16",
      "id": "90649",
      "original_text": "Löschungsankündigung\nNordrhein-Westfalen Amtsgericht Bochum HRB 18872\nMF Cars GmbH – Bochum",
      "type": "Löschungsankündigung",
      "state": "Nordrhein-Westfalen",
      "amtsgericht": "Amtsgericht Bochum",
      "registernummer": "HRB 18872",
      "registerart": "HRB",
      "company_name": "MF Cars GmbH",
      "company_seat": "Bochum",
      "details": "16.10.2024 (Bekanntmachungsdatum)\n\nNordrhein-Westfalen Amtsgericht Bochum HRB 18872\nLöschungsankündigung\n\nMF Cars GmbH\nGesellschaft mit beschränkter Haftung\nBochum\n\nDas Registergericht beabsichtigt die Gesellschaft von Amts wegen nach § 394 FamFG zu löschen. Die Frist zur Erhebung eines Widerspruchs ist auf #DV.Fr(Text=\"Bitte wählen Sie die Widerspruchsfrist aus!\",Eingabe=\"einen Monat\",\"zwei Monate\",\"drei Monate\",\"#insert(Text=\"Freitext\")\"|\"freier Text\") festgesetzt."
    },
    {
      "date": "2024-10-16",
      "id": "90659",
      "original_text": "Löschungsankündigung\nNordrhein-Westfalen Amtsgericht Neuss HRB 20687\nMISEY GmbH – Kaarst",
      "type": "Löschungsankündigung",
      "state": "Nordrhein-Westfalen",
      "amtsgericht": "Amtsgericht Neuss",
      "registernummer": "HRB 20687",
      "registerart": "HRB",
      "company_name": "MISEY GmbH",
      "company_seat": "Kaarst",
      "details": "16.10.2024 (Bekanntmachungsdatum)\n\nNordrhein-Westfalen Amtsgericht Neuss HRB 20687\nLöschungsankündigung 15.10.2024 (Eintragungsdatum)\n\nMISEY GmbH\nGesellschaft mit beschränkter Haftung\nKaarst\n\nDas Registergericht beabsichtigt die Gesellschaft wegen Vermögenslosigkeit aufgrund des § 394 Abs. 1 FamFG zu löschen. Frist zur Geltendmachung eines Widerspruchs: 1 Monat.\nRechtsbehelfsbelehrung:\nGegen diese Verfügung können Sie Widerspruch einlegen.\nDer Widerspruch ist bei dem Amtsgericht Neuss - Registergericht -, Breite Str. 48, 41460 Neuss schriftlich in deutscher Sprache oder zur Niederschrift der Geschäftsstelle einzulegen.\nDer Widerspruch kann auch zur Niederschrift der Geschäftsstelle eines jeden Amtsgerichtes abgegeben werden.\nDie Einlegung ist auch durch Übertragung eines elektronischen Dokuments an die elektronische Poststelle des Gerichts möglich. Das elektronische Dokument muss für die Bearbeitung durch das Gericht geeignet und mit einer qualifizierten elektronischen Signatur der verantwortenden Person versehen sein oder von der verantwortenden Person signiert und auf einem sicheren Übermittlungsweg gemäß § 130a ZPO nach näherer Maßgabe der Verordnung über die technischen Rahmenbedingungen des elektronischen Rechtsverkehrs und über das besondere elektronische Behördenpostfach (BGBl. I, S.3803) eingereicht werden. Weitere Informationen erhalten Sie auf der Internetseite www.justiz.de.\nDer Widerspruch muss spätestens innerhalb der gesetzten Frist nach der schriftlichen Bekanntgabe der Verfügung bei dem Amtsgericht - Registergericht - Neuss eingegangen sein. Dies gilt auch dann, wenn der Widerspruch zur Niederschrift der Geschäftsstelle eines anderen Amtsgerichtes abgegeben wurde. Die Frist beginnt mit der schriftlichen Bekanntgabe der Verfügung. Die Bekanntgabe ist entweder durch Zustellung oder am dritten Tage nach Aufgabe zur Post bewirkt. Fällt das Ende der Frist auf einen Sonntag, einen allgemeinen Feiertag oder Sonnabend, so endet die Frist mit Ablauf des nächsten Werktages.\nDer Widerspruch muss die Bezeichnung der angefochtenen Verfügung sowie die Erklärung enthalten, dass Widerspruch gegen diese Verfügung eingelegt wird. Er ist zu unterzeichnen und soll begründet werden."
    },
    {
      "date": "2024-10-16",
      "id": "90596",
      "original_text": "Registerbekanntmachung nach dem Umwandlungsgesetz\nBerlin Amtsgericht Berlin (Charlottenburg) HRB 268458\nMahari GmbH – Berlin",
      "type": "Registerbekanntmachung nach dem Umwandlungsgesetz",
      "state": "Berlin",
      "amtsgericht": "Amtsgericht Berlin (Charlottenburg)",
      "registernummer": "HRB 268458",
      "registerart": "HRB",
      "company_name": "Mahari GmbH",
      "company_seat": "Berlin",
      "details": "16.10.2024 (Bekanntmachungsdatum)\n\nBerlin Amtsgericht Berlin (Charlottenburg) HRB 268458\nRegisterbekanntmachung nach dem Umwandlungsgesetz 15.10.2024 (Eintragungsdatum)\n\nMahari GmbH\nGesellschaft mit beschränkter Haftung\nBerlin\n\nZu Eintragungsnummer 1 vom 15.10.2024 wird als nicht eingetragen veröffentlicht: Den Gläubigern der an der Spaltung beteiligten Rechtsträger ist, wenn sie binnen sechs Monaten nach dem Tag, an dem die Eintragung der Spaltung in das Register des Sitzes desjenigen Rechtsträgers, dessen Gläubiger sie sind, als bekannt gemacht gilt, ihren Anspruch nach Grund und Höhe schriftlich anmelden, Sicherheit zu leisten, soweit sie nicht Befriedigung verlangen können. Dieses Recht steht den Gläubigern jedoch nur zu, wenn sie glaubhaft machen, dass durch die Spaltung die Erfüllung ihrer Forderung gefährdet wird. Das Recht, Sicherheitsleistung zu verlangen, steht Gläubigern nicht zu, die im Falle der Insolvenz ein Recht auf vorzugsweise Befriedigung aus einer Deckungsmasse haben, die nach gesetzlicher Vorschrift zu ihrem Schutz errichtet und staatlich überwacht ist."
    },
    {
      "date": "2024-10-16",
      "id": "90614",
      "original_text": "Registerbekanntmachung nach dem Umwandlungsgesetz\nMecklenburg-Vorpommern Amtsgericht Stralsund HRB 22679\nManufactura GmbH – Stralsund",
      "type": "Registerbekanntmachung nach dem Umwandlungsgesetz",
      "state": "Mecklenburg-Vorpommern",
      "amtsgericht": "Amtsgericht Stralsund",
      "registernummer": "HRB 22679",
      "registerart": "HRB",
      "company_name": "Manufactura GmbH",
      "company_seat": "Stralsund",
      "details": "16.10.2024 (Bekanntmachungsdatum)\n\nMecklenburg-Vorpommern Amtsgericht Stralsund HRB 22679\nRegisterbekanntmachung nach dem Umwandlungsgesetz 16.10.2024 (Eintragungsdatum)\n\nManufactura GmbH\nGesellschaft mit beschränkter Haftung\nStralsund\n\nAls nicht eingetragen wird veröffentlicht: Den Gläubigern der an der Umwandlung beteiligten Rechtsträger ist, wenn sie binnen sechs\nMonaten nach dem Tag, an dem die Eintragung der Umwandlung in das Register des Sitzes desjenigen Rechtsträgers, dessen Gläubiger sie sind, nach § 19 Abs. 3 UmwG als bekannt gemacht gilt, ihren Anspruch nach Grund und Höhe schriftlich anmelden, Sicherheit zu leisten, soweit sie nicht Befriedigung verlangen können. Dieses Recht steht den Gläubigern jedoch nur zu, wenn sie glaubhaft machen, dass durch die Umwandlung die Erfüllung der Forderung gefährdet wird."
    },
    {
      "date": "2024-10-16",
      "id": "90671",
      "original_text": "Registerbekanntmachung nach dem Umwandlungsgesetz\nHessen Amtsgericht Frankfurt am Main HRB 129344\nMatrix42 GmbH – Frankfurt am Main",
      "type": "Registerbekanntmachung nach dem Umwandlungsgesetz",
      "state": "Hessen",
      "amtsgericht": "Amtsgericht Frankfurt am Main",
      "registernummer": "HRB 129344",
      "registerart": "HRB",
      "company_name": "Matrix42 GmbH",
      "company_seat": "Frankfurt am Main",
      "details": "16.10.2024 (Bekanntmachungsdatum)\n\nHessen Amtsgericht Frankfurt am Main HRB 129344\nRegisterbekanntmachung nach dem Umwandlungsgesetz 16.10.2024 (Eintragungsdatum)\n\nMatrix42 GmbH\nGesellschaft mit beschränkter Haftung\nFrankfurt am Main\n\nDen Gläubigern der an der Verschmelzung beteiligten Rechtsträger ist, wenn sie binnen sechs Monaten nach dem Tag, an dem die Eintragung der Verschmelzung in das Register des Sitzes derjenigen Rechtsträger deren Gläubiger sie sind, nach § 19 Absatz 3 UmwG bekannt gemacht worden ist, ihren Anspruch nach Grund und Höhe schriftlich anmelden, Sicherheit zu leisten, soweit sie nicht Befriedigung verlangen können. Dieses Recht steht den Gläubigern jedoch nur zu, wenn sie glaubhaft machen, dass durch die Verschmelzung die Erfüllung ihrer Forderung gefährdet wird."
    },
    {
      "date": "2024-10-16",
      "id": "90677",
      "original_text": "Registerbekanntmachung nach dem Umwandlungsgesetz\nHessen Amtsgericht Frankfurt am Main HRB 129344\nMatrix42 GmbH – Frankfurt am Main",
      "type": "Registerbekanntmachung nach dem Umwandlungsgesetz",
      "state": "Hessen",
      "amtsgericht": "Amtsgericht Frankfurt am Main",
      "registernummer": "HRB 129344",
      "registerart": "HRB",
      "company_name": "Matrix42 GmbH",
      "company_seat": "Frankfurt am Main",
      "details": "16.10.2024 (Bekanntmachungsdatum)\n\nHessen Amtsgericht Frankfurt am Main HRB 129344\nRegisterbekanntmachung nach dem Umwandlungsgesetz 16.10.2024 (Eintragungsdatum)\n\nMatrix42 GmbH\nGesellschaft mit beschränkter Haftung\nFrankfurt am Main\n\nDen Gläubigern der an der Verschmelzung beteiligten Rechtsträger ist, wenn sie binnen sechs Monaten nach dem Tag, an dem die Eintragung der Verschmelzung in das Register des Sitzes derjenigen Rechtsträger deren Gläubiger sie sind, nach § 19 Absatz 3 UmwG bekannt gemacht worden ist, ihren Anspruch nach Grund und Höhe schriftlich anmelden, Sicherheit zu leisten, soweit sie nicht Befriedigung verlangen können. Dieses Recht steht den Gläubigern jedoch nur zu, wenn sie glaubhaft machen, dass durch die Verschmelzung die Erfüllung ihrer Forderung gefährdet wird."
    },
    {
      "date": "2024-10-16",
      "id": "90678",
      "original_text": "Registerbekanntmachung nach dem Umwandlungsgesetz\nHessen Amtsgericht Frankfurt am Main HRB 129344\nMatrix42 GmbH – Frankfurt am Main",
      "type": "Registerbekanntmachung nach dem Umwandlungsgesetz",
      "state": "Hessen",
      "amtsgericht": "Amtsgericht Frankfurt am Main",
      "registernummer": "HRB 129344",
      "registerart": "HRB",
      "company_name": "Matrix42 GmbH",
      "company_seat": "Frankfurt am Main",
      "details": "16.10.2024 (Bekanntmachungsdatum)\n\nHessen Amtsgericht Frankfurt am Main HRB 129344\nRegisterbekanntmachung nach dem Umwandlungsgesetz 16.10.2024 (Eintragungsdatum)\n\nMatrix42 GmbH\nGesellschaft mit beschränkter Haftung\nFrankfurt am Main\n\nDen Gläubigern der an der Verschmelzung beteiligten Rechtsträger ist, wenn sie binnen sechs Monaten nach dem Tag, an dem die Eintragung der Verschmelzung in das Register des Sitzes derjenigen Rechtsträger deren Gläubiger sie sind, nach § 19 Absatz 3 UmwG bekannt gemacht worden ist, ihren Anspruch nach Grund und Höhe schriftlich anmelden, Sicherheit zu leisten, soweit sie nicht Befriedigung verlangen können. Dieses Recht steht den Gläubigern jedoch nur zu, wenn sie glaubhaft machen, dass durch die Verschmelzung die Erfüllung ihrer Forderung gefährdet wird."
    },
    {
      "date": "2024-10-16",
      "id": "90680",
      "original_text": "Registerbekanntmachung nach dem Umwandlungsgesetz\nHessen Amtsgericht Frankfurt am Main HRB 101131\nMatrix42 Marketplace GmbH – Frankfurt am Main",
      "type": "Registerbekanntmachung nach dem Umwandlungsgesetz",
      "state": "Hessen",
      "amtsgericht": "Amtsgericht Frankfurt am Main",
      "registernummer": "HRB 101131",
      "registerart": "HRB",
      "company_name": "Matrix42 Marketplace GmbH",
      "company_seat": "Frankfurt am Main",
      "details": "16.10.2024 (Bekanntmachungsdatum)\n\nHessen Amtsgericht Frankfurt am Main HRB 101131\nRegisterbekanntmachung nach dem Umwandlungsgesetz 16.10.2024 (Eintragungsdatum)\n\nMatrix42 Marketplace GmbH\nGesellschaft mit beschränkter Haftung\nFrankfurt am Main\n\nDen Gläubigern der an der Verschmelzung beteiligten Rechtsträger ist, wenn sie binnen sechs Monaten nach dem Tag, an dem die Eintragung der Verschmelzung in das Register des Sitzes derjenigen Rechtsträger deren Gläubiger sie sind, nach § 19 Absatz 3 UmwG bekannt gemacht worden ist, ihren Anspruch nach Grund und Höhe schriftlich anmelden, Sicherheit zu leisten, soweit sie nicht Befriedigung verlangen können. Dieses Recht steht den Gläubigern jedoch nur zu, wenn sie glaubhaft machen, dass durch die Verschmelzung die Erfüllung ihrer Forderung gefährdet wird."
    },
    {
      "date": "2024-10-16",
      "id": "90545",
      "original_text": "Löschungsankündigung\nBayern Amtsgericht München HRB 268803\nMia Service UG (haftungsbeschränkt) – München",
      "type": "Löschungsankündigung",
      "state": "Bayern",
      "amtsgericht": "Amtsgericht München",
      "registernummer": "HRB 268803",
      "registerart": "HRB",
      "company_name": "Mia Service UG (haftungsbeschränkt)",
      "company_seat": "München",
      "details": "16.10.2024 (Bekanntmachungsdatum)\n\nBayern Amtsgericht München HRB 268803\nLöschungsankündigung 15.10.2024 (Eintragungsdatum)\n\nMia Service UG (haftungsbeschränkt)\nGesellschaft mit beschränkter Haftung\nMünchen\n\nDas Registergericht beabsichtigt, den im Handelsregister eingetragenen Geschäftsführer Grzegorz Miler wegen fehlender Eignung von Amts wegen nach § 395 FamFG zu löschen. Die Frist zur Erhebung eines Widerspruchs ist auf drei Monate festgesetzt."
    },
    {
      "date": "2024-10-16",
      "id": "90599",
      "original_text": "Registerbekanntmachung nach dem Umwandlungsgesetz\nBerlin Amtsgericht Berlin (Charlottenburg) HRA 55921\nMichael Roden e.K. – Berlin",
      "type": "Registerbekanntmachung nach dem Umwandlungsgesetz",
      "state": "Berlin",
      "amtsgericht": "Amtsgericht Berlin (Charlottenburg)",
      "registernummer": "HRA 55921",
      "registerart": "HRA",
      "company_name": "Michael Roden e.K.",
      "company_seat": "Berlin",
      "details": "16.10.2024 (Bekanntmachungsdatum)\n\nBerlin Amtsgericht Berlin (Charlottenburg) HRA 55921\nRegisterbekanntmachung nach dem Umwandlungsgesetz 15.10.2024 (Eintragungsdatum)\n\nMichael Roden e.K.\nEinzelkaufmann / Einzelkauffrau\nBerlin\n\nZu Eintragungsnummer 2 vom 15.10.2024 wird als nicht eingetragen veröffentlicht: Den Gläubigern der an der Verschmelzung beteiligten Rechtsträger ist, wenn sie binnen sechs Monaten nach dem Tag, an dem die Eintragung der Verschmelzung in das Register des Sitzes desjenigen Rechtsträgers, dessen Gläubiger sie sind, als bekannt gemacht gilt, ihren Anspruch nach Grund und Höhe schriftlich anmelden, Sicherheit zu leisten, soweit sie nicht Befriedigung verlangen können. Dieses Recht steht den Gläubigern jedoch nur zu, wenn sie glaubhaft machen, dass durch die Verschmelzung die Erfüllung ihrer Forderung gefährdet wird. Das Recht, Sicherheitsleistung zu verlangen, steht Gläubigern nicht zu, die im Falle der Insolvenz ein Recht auf vorzugsweise Befriedigung aus einer Deckungsmasse haben, die nach gesetzlicher Vorschrift zu ihrem Schutz errichtet und staatlich überwacht ist."
    },
    {
      "date": "2024-10-16",
      "id": "90679",
      "original_text": "Sonstige Registerbekanntmachung\nHessen Amtsgericht Frankfurt am Main HRB 6712\nNassauische Heimstätte Wohnungs- und Entwicklungsgesellschaft mit beschränkter Haftung – Frankfurt am Main",
      "type": "Sonstige Registerbekanntmachung",
      "state": "Hessen",
      "amtsgericht": "Amtsgericht Frankfurt am Main",
      "registernummer": "HRB 6712",
      "registerart": "HRB",
      "company_name": "Nassauische Heimstätte Wohnungs- und Entwicklungsgesellschaft mit beschränkter Haftung",
      "company_seat": "Frankfurt am Main",
      "details": "16.10.2024 (Bekanntmachungsdatum)\n\nHessen Amtsgericht Frankfurt am Main HRB 6712\nSonstige Registerbekanntmachung\n\nNassauische Heimstätte Wohnungs- und Entwicklungsgesellschaft mit beschränkter Haftung\nGesellschaft mit beschränkter Haftung\nFrankfurt am Main\n\nDurch eine Änderung in den Personen der Aufsichtsratsmitglieder ist eine Liste der Mitglieder des Aufsichtsrates zum Handelsregister eingereicht worden."
    },
    {
      "date": "2024-10-16",
      "id": "90560",
      "original_text": "Löschungsankündigung\nBayern Amtsgericht Coburg HRB 2155\nNecke GmbH – Schneckenlohe",
      "type": "Löschungsankündigung",
      "state": "Bayern",
      "amtsgericht": "Amtsgericht Coburg",
      "registernummer": "HRB 2155",
      "registerart": "HRB",
      "company_name": "Necke GmbH",
      "company_seat": "Schneckenlohe",
      "details": "16.10.2024 (Bekanntmachungsdatum)\n\nBayern Amtsgericht Coburg HRB 2155\nLöschungsankündigung\n\nNecke GmbH\nGesellschaft mit beschränkter Haftung\nSchneckenlohe\n\nDas Registergericht beabsichtigt, die im Handelsregister eingetragene Gesellschaft wegen Vermögenslosigkeit von Amts wegen nach § 394 FamFG zu löschen. Die Frist zur Erhebung eines Widerspruchs ist auf sechs Wochen festgesetzt."
    },
    {
      "date": "2024-10-16",
      "id": "90602",
      "original_text": "Löschungsankündigung\nBrandenburg Amtsgericht Potsdam HRB 28424\nNeverland Wohngruppen gUG (haftunsgeschränkt) – Potsdam",
      "type": "Löschungsankündigung",
      "state": "Brandenburg",
      "amtsgericht": "Amtsgericht Potsdam",
      "registernummer": "HRB 28424",
      "registerart": "HRB",
      "company_name": "Neverland Wohngruppen gUG (haftunsgeschränkt)",
      "company_seat": "Potsdam",
      "details": "16.10.2024 (Bekanntmachungsdatum)\n\nBrandenburg Amtsgericht Potsdam HRB 28424\nLöschungsankündigung\n\nNeverland Wohngruppen gUG (haftunsgeschränkt)\nGesellschaft mit beschränkter Haftung\nPotsdam\n\nBei der nachstehenden Gesellschaft wird das Amtslöschungsverfahren gemäß § 394 FamFG eingeleitet. Widerspruchsfrist: 8 Wochen."
    },
    {
      "date": "2024-10-16",
      "id": "90663",
      "original_text": "Löschungsankündigung\nNordrhein-Westfalen Amtsgericht Düsseldorf HRB 78565\nNikai GmbH – Düsseldorf",
      "type": "Löschungsankündigung",
      "state": "Nordrhein-Westfalen",
      "amtsgericht": "Amtsgericht Düsseldorf",
      "registernummer": "HRB 78565",
      "registerart": "HRB",
      "company_name": "Nikai GmbH",
      "company_seat": "Düsseldorf",
      "details": "16.10.2024 (Bekanntmachungsdatum)\n\nNordrhein-Westfalen Amtsgericht Düsseldorf HRB 78565\nLöschungsankündigung\n\nNikai GmbH\nGesellschaft mit beschränkter Haftung\nDüsseldorf\n\nBetr.: Nikai GmbH, Beekstr. 48, 47051 Duisburg\n\nDas Registergericht beabsichtigt die Gesellschaft von Amts wegen nach § 394 FamFG zu löschen. Die Frist zur Erhebung eines Widerspruchs ist auf 3 Wochen festgesetzt.\n\nRechtsbehelfsbelehrung:\n\nDas Widerspruchsrecht steht jedem zu, der an der Unterlassung der Löschung ein berechtigtes Interesse hat. Der Widerspruch ist bei dem Amtsgericht Düsseldorf -Registergericht-, Werdener Straße 1, 40227 Düsseldorf schriftlich in deutscher Sprache oder zur Niederschrift der Geschäftsstelle einzulegen. Der Widerspruch kann auch zur Niederschrift der Geschäftsstelle eines jeden Amtsgerichtes abgegeben werden. Die Einlegung ist auch durch Übertragung eines elektronischen Dokuments an die elektronische Poststelle des Gerichts möglich. Das elektronische Dokument muss für die Bearbeitung durch das Gericht geeignet und mit einer qualifizierten elektronischen Signatur der verantwortenden Person versehen sein oder von der verantwortenden Person signiert und auf einem sicheren Übermittlungsweg gemäß § 130a ZPO nach näherer Maßgabe der Verordnung über die technischen Rahmenbedingungen des elektronischen Rechtsverkehrs und über das besondere elektronische Behördenpostfach (BGBl. I, S.3803) eingereicht werden. Weitere Informationen erhalten Sie auf der Internetseite www.justiz.de.\nDer Widerspruch muss spätestens innerhalb der gesetzten Frist nach dem Datum der Bekanntmachung der Löschungsankündigung bei dem Amtsgericht - Registergericht - Düsseldorf eingegangen sein.  Dies gilt auch dann, wenn der Widerspruch zur Niederschrift der Geschäftsstelle eines anderen Amtsgerichtes abgegeben wurde. Die Frist beginnt mit dem Tage der Bekanntmachung der Löschungsankündigung in dem für die Bekanntmachung der Eintragungen in das Handelsregister bestimmten elektronischen Informations- und Kommunikationssystem nach § 10 des Handelsgesetzbuches. Fällt das Ende der Frist auf einen Sonntag, einen allgemeinen Feiertag oder Sonnabend, so endet die Frist mit Ablauf des nächsten Werktages.\nDer Widerspruch muss die Bezeichnung der angefochtenen Löschungsankündigung sowie die Erklärung enthalten, dass Widerspruch gegen diese Löschungsankündigung eingelegt wird. Er ist zu unterzeichnen und soll begründet werden."
    },
    {
      "date": "2024-10-16",
      "id": "90549",
      "original_text": "Registerbekanntmachung nach dem Umwandlungsgesetz\nBayern Amtsgericht München HRB 283042\nNovartis BidCo Germany AG – München",
      "type": "Registerbekanntmachung nach dem Umwandlungsgesetz",
      "state": "Bayern",
      "amtsgericht": "Amtsgericht München",
      "registernummer": "HRB 283042",
      "registerart": "HRB",
      "company_name": "Novartis BidCo Germany AG",
      "company_seat": "München",
      "details": "16.10.2024 (Bekanntmachungsdatum)\n\nBayern Amtsgericht München HRB 283042\nRegisterbekanntmachung nach dem Umwandlungsgesetz 15.10.2024 (Eintragungsdatum)\n\nNovartis BidCo Germany AG\nAktiengesellschaft\nMünchen\n\nDen Gläubigern der an der Verschmelzung beteiligten Rechtsträger ist, wenn sie binnen sechs Monaten nach dem Tag, an dem die Eintragung der Verschmelzung in das Register des Sitzes desjenigen Rechtsträgers, dessen Gläubiger sie sind, nach § 19 Abs. 3 UmwG als bekannt gemacht gilt, ihren Anspruch nach Grund und Höhe schriftlich anmelden, Sicherheit zu leisten, soweit sie nicht Befriedigung verlangen können. Dieses Recht steht den Gläubigern jedoch nur zu, wenn sie glaubhaft machen, dass durch die Verschmelzung die Erfüllung ihrer Forderung gefährdet wird."
    },
    {
      "date": "2024-10-16",
      "id": "90576",
      "original_text": "Löschungsankündigung\nBrandenburg Amtsgericht Neuruppin HRB 14284\nODC Offroad Design Concept GmbH – Gransee",
      "type": "Löschungsankündigung",
      "state": "Brandenburg",
      "amtsgericht": "Amtsgericht Neuruppin",
      "registernummer": "HRB 14284",
      "registerart": "HRB",
      "company_name": "ODC Offroad Design Concept GmbH",
      "company_seat": "Gransee",
      "details": "16.10.2024 (Bekanntmachungsdatum)\n\nBrandenburg Amtsgericht Neuruppin HRB 14284\nLöschungsankündigung\n\nODC Offroad Design Concept GmbH\nGesellschaft mit beschränkter Haftung\nGransee\n\nBei der nachstehenden Gesellschaft wird das Amtslöschungsverfahren gemäß § 394 FamFG eingeleitet.\nWiderspruchsfrist: 1 Monat"
    },
    {
      "date": "2024-10-16",
      "id": "90616",
      "original_text": "Löschungsankündigung\nBerlin Amtsgericht Berlin (Charlottenburg) HRB 123304\nPIRO Automobile GmbH – Berlin",
      "type": "Löschungsankündigung",
      "state": "Berlin",
      "amtsgericht": "Amtsgericht Berlin (Charlottenburg)",
      "registernummer": "HRB 123304",
      "registerart": "HRB",
      "company_name": "PIRO Automobile GmbH",
      "company_seat": "Berlin",
      "details": "16.10.2024 (Bekanntmachungsdatum)\n\nBerlin Amtsgericht Berlin (Charlottenburg) HRB 123304\nLöschungsankündigung\n\nPIRO Automobile GmbH\nGesellschaft mit beschränkter Haftung\nBerlin\n\nBei der nachstehenden Gesellschaft wird das Amtslöschungsverfahren gemäß § 394 FamFG eingeleitet. Widerspruchsfrist 6 Wochen"
    },
    {
      "date": "2024-10-16",
      "id": "90607",
      "original_text": "Löschungsankündigung\nBerlin Amtsgericht Berlin (Charlottenburg) HRB 137175\nPine Ridge International Holdings GmbH – Berlin",
      "type": "Löschungsankündigung",
      "state": "Berlin",
      "amtsgericht": "Amtsgericht Berlin (Charlottenburg)",
      "registernummer": "HRB 137175",
      "registerart": "HRB",
      "company_name": "Pine Ridge International Holdings GmbH",
      "company_seat": "Berlin",
      "details": "16.10.2024 (Bekanntmachungsdatum)\n\nBerlin Amtsgericht Berlin (Charlottenburg) HRB 137175\nLöschungsankündigung\n\nPine Ridge International Holdings GmbH\nGesellschaft mit beschränkter Haftung\nBerlin\n\nBei der nachstehenden Gesellschaft wird das Amtslöschungsverfahren gemäß § 394 FamFG eingeleitet. Widerspruchsfrist 6 Wochen"
    },
    {
      "date": "2024-10-16",
      "id": "90626",
      "original_text": "Löschungsankündigung\nNiedersachsen Amtsgericht Braunschweig HRB 208038\nPower Moving GmbH – Braunschweig",
      "type": "Löschungsankündigung",
      "state": "Niedersachsen",
      "amtsgericht": "Amtsgericht Braunschweig",
      "registernummer": "HRB 208038",
      "registerart": "HRB",
      "company_name": "Power Moving GmbH",
      "company_seat": "Braunschweig",
      "details": "16.10.2024 (Bekanntmachungsdatum)\n\nNiedersachsen Amtsgericht Braunschweig HRB 208038\nLöschungsankündigung\n\nPower Moving GmbH\nGesellschaft mit beschränkter Haftung\nBraunschweig\n\nDas Registergericht beabsichtigt, die Gesellschaft von Amts wegen nach § 394 FamFG zu löschen. Die Frist zur Erhebung eines Widerspruchs ist auf 1 Monat ab dieser Registerbekanntmachung festgesetzt."
    },
    {
      "date": "2024-10-16",
      "id": "90650",
      "original_text": "Registerbekanntmachung nach dem Umwandlungsgesetz\nNordrhein-Westfalen Amtsgericht Siegburg GsR 218\nPrimeAviator eGbR – Bad Honnef",
      "type": "Registerbekanntmachung nach dem Umwandlungsgesetz",
      "state": "Nordrhein-Westfalen",
      "amtsgericht": "Amtsgericht Siegburg",
      "registernummer": "GsR 218",
      "registerart": "GsR",
      "company_name": "PrimeAviator eGbR",
      "company_seat": "Bad Honnef",
      "details": "16.10.2024 (Bekanntmachungsdatum)\n\nNordrhein-Westfalen Amtsgericht Siegburg GsR 218\nRegisterbekanntmachung nach dem Umwandlungsgesetz 16.10.2024 (Eintragungsdatum)\n\nPrimeAviator eGbR\nGesellschaft bürgerlichen Rechts\nBad Honnef\n\nDen Gläubigern der an der formwechselnden Umwandlung beteiligten Rechtsträger ist, wenn sie binnen sechs Monaten nach dem Tag, an dem die Eintragung der formwechselnden Umwandlung in das Register des Sitzes desjenigen Rechtsträgers, dessen Gläubiger sie sind, nach § 19 Absatz 3 UmwG als bekanntgemacht gilt, ihren Anspruch nach Grund und Höhe schriftlich anmelden, Sicherheit zu leisten, soweit sie nicht Befriedigung verlangen können. Dieses Recht steht den Gläubigern jedoch nur zu, wenn sie glaubhaft machen, dass durch die formwechselnden Umwandlung die Erfüllung ihrer Forderung gefährdet wird."
    },
    {
      "date": "2024-10-16",
      "id": "90588",
      "original_text": "Löschungsankündigung\nHamburg Amtsgericht Hamburg HRB 179888\nPronto Sicherheit & Service GmbH – Hamburg",
      "type": "Löschungsankündigung",
      "state": "Hamburg",
      "amtsgericht": "Amtsgericht Hamburg",
      "registernummer": "HRB 179888",
      "registerart": "HRB",
      "company_name": "Pronto Sicherheit & Service GmbH",
      "company_seat": "Hamburg",
      "details": "16.10.2024 (Bekanntmachungsdatum)\n\nHamburg Amtsgericht Hamburg HRB 179888\nLöschungsankündigung\n\nPronto Sicherheit & Service GmbH\nGesellschaft mit beschränkter Haftung\nHamburg\n\nDas Registergericht beabsichtigt, die im Handelsregister eingetragene Gesellschaft von Amts wegen nach § 394 FamFG zu löschen. Die Frist zur Erhebung eines Widerspruchs gegen die beabsichtigte Löschung wird auf 3 Monate festgesetzt."
    },
    {
      "date": "2024-10-16",
      "id": "90630",
      "original_text": "Löschungsankündigung\nBremen Amtsgericht Bremen HRB 38429\nProstory Cargo GmbH – Bremen",
      "type": "Löschungsankündigung",
      "state": "Bremen",
      "amtsgericht": "Amtsgericht Bremen",
      "registernummer": "HRB 38429",
      "registerart": "HRB",
      "company_name": "Prostory Cargo GmbH",
      "company_seat": "Bremen",
      "details": "16.10.2024 (Bekanntmachungsdatum)\n\nBremen Amtsgericht Bremen HRB 38429\nLöschungsankündigung\n\nProstory Cargo GmbH\nGesellschaft mit beschränkter Haftung\nBremen\n\nEs ist beabsichtigt die im Handelsregister eingetragene Gesellschaft von Amts wegen gemäß § 394 FamFG zu löschen. Gegen die Löschung kann beim AG Bremen schriftlich oder zu Protokoll der Geschäftsstelle Widerspruch eingelegt werden. Widerspruchsfrist 4 Wochen."
    },
    {
      "date": "2024-10-16",
      "id": "90587",
      "original_text": "Löschungsankündigung\nHamburg Amtsgericht Hamburg HRB 153557\nRE:concept Komplementär GmbH – Hamburg",
      "type": "Löschungsankündigung",
      "state": "Hamburg",
      "amtsgericht": "Amtsgericht Hamburg",
      "registernummer": "HRB 153557",
      "registerart": "HRB",
      "company_name": "RE:concept Komplementär GmbH",
      "company_seat": "Hamburg",
      "details": "16.10.2024 (Bekanntmachungsdatum)\n\nHamburg Amtsgericht Hamburg HRB 153557\nLöschungsankündigung\n\nRE:concept Komplementär GmbH\nGesellschaft mit beschränkter Haftung\nHamburg\n\nDas Registergericht beabsichtigt, die im Handelsregister eingetragene Gesellschaft von Amts wegen nach § 394 FamFG zu löschen. Die Frist zur Erhebung eines Widerspruchs gegen die beabsichtigte Löschung wird auf 3 Monate festgesetzt."
    },
    {
      "date": "2024-10-16",
      "id": "90644",
      "original_text": "Löschungsankündigung\nRheinland-Pfalz Amtsgericht Landau HRB 32382\nRTR GmbH – Wörth am Rhein",
      "type": "Löschungsankündigung",
      "state": "Rheinland-Pfalz",
      "amtsgericht": "Amtsgericht Landau",
      "registernummer": "HRB 32382",
      "registerart": "HRB",
      "company_name": "RTR GmbH",
      "company_seat": "Wörth am Rhein",
      "details": "16.10.2024 (Bekanntmachungsdatum)\n\nRheinland-Pfalz Amtsgericht Landau HRB 32382\nLöschungsankündigung\n\nRTR GmbH\nGesellschaft mit beschränkter Haftung\nWörth am Rhein\n\nDas Registergericht beabsichtigt die Gesellschaft von Amts wegen nach § 394 FamFG zu löschen. Die Frist zur Erhebung eines Widerspruchs ist auf einen Monat festgesetzt."
    },
    {
      "date": "2024-10-16",
      "id": "90554",
      "original_text": "Registerbekanntmachung nach dem Umwandlungsgesetz\nBayern Amtsgericht Nürnberg HRB 39613\nRaumtracht GmbH – Kammerstein",
      "type": "Registerbekanntmachung nach dem Umwandlungsgesetz",
      "state": "Bayern",
      "amtsgericht": "Amtsgericht Nürnberg",
      "registernummer": "HRB 39613",
      "registerart": "HRB",
      "company_name": "Raumtracht GmbH",
      "company_seat": "Kammerstein",
      "details": "16.10.2024 (Bekanntmachungsdatum)\n\nBayern Amtsgericht Nürnberg HRB 39613\nRegisterbekanntmachung nach dem Umwandlungsgesetz 15.10.2024 (Eintragungsdatum)\n\nRaumtracht GmbH\nGesellschaft mit beschränkter Haftung\nKammerstein\n\nDen Gläubigern der an der Verschmelzung beteiligten Rechtsträger ist, wenn sie binnen sechs Monaten nach dem Tag, an dem die Eintragung der Verschmelzung in das Register des Sitzes desjenigen Rechtsträgers, dessen Gläubiger sie sind, nach § 19 Abs. 3 UmwG als bekannt gemacht gilt, ihren Anspruch nach Grund und Höhe schriftlich anmelden, Sicherheit zu leisten, soweit sie nicht Befriedigung verlangen können. Dieses Recht steht den Gläubigern jedoch nur zu, wenn sie glaubhaft machen, dass durch die Verschmelzung die Erfüllung ihrer Forderung gefährdet wird."
    },
    {
      "date": "2024-10-16",
      "id": "90619",
      "original_text": "Registerbekanntmachung nach dem Umwandlungsgesetz\nBaden-Württemberg Amtsgericht Stuttgart HRB 793614\nRemacs GmbH – Gärtringen",
      "type": "Registerbekanntmachung nach dem Umwandlungsgesetz",
      "state": "Baden-Württemberg",
      "amtsgericht": "Amtsgericht Stuttgart",
      "registernummer": "HRB 793614",
      "registerart": "HRB",
      "company_name": "Remacs GmbH",
      "company_seat": "Gärtringen",
      "details": "16.10.2024 (Bekanntmachungsdatum)\n\nBaden-Württemberg Amtsgericht Stuttgart HRB 793614\nRegisterbekanntmachung nach dem Umwandlungsgesetz 16.10.2024 (Eintragungsdatum)\n\nRemacs GmbH\nGesellschaft mit beschränkter Haftung\nGärtringen\n\nAls nicht eingetragen wird bekanntgemacht:\nDen Gläubigern der an der Ausgliederung beteiligten Rechtsträger ist, wenn sie binnen sechs Monaten nach dem Tag, an dem die Eintragung der Ausgliederung in das Register des Sitzes desjenigen Rechtsträgers, dessen Gläubiger sie sind, nach § 19 Abs. 3 UmwG als bekanntgemacht gilt, ihren Anspruch nach Grund und Höhe schriftlich anmelden, Sicherheit zu leisten, soweit sie nicht Befriedigung verlangen können. Dieses Recht steht den Gläubigern jedoch nur zu, wenn sie glaubhaft machen, dass durch die Ausgliederung die Erfüllung ihrer Forderung gefährdet wird."
    },
    {
      "date": "2024-10-16",
      "id": "90565",
      "original_text": "Löschungsankündigung\nBayern Amtsgericht Coburg HRB 6319\nSL-Individualhaus GmbH – Marktzeuln",
      "type": "Löschungsankündigung",
      "state": "Bayern",
      "amtsgericht": "Amtsgericht Coburg",
      "registernummer": "HRB 6319",
      "registerart": "HRB",
      "company_name": "SL-Individualhaus GmbH",
      "company_seat": "Marktzeuln",
      "details": "16.10.2024 (Bekanntmachungsdatum)\n\nBayern Amtsgericht Coburg HRB 6319\nLöschungsankündigung\n\nSL-Individualhaus GmbH\nGesellschaft mit beschränkter Haftung\nMarktzeuln\n\nDas Registergericht beabsichtigt, die im Handelsregister eingetragene Gesellschaft wegen Vermögenslosigkeit von Amts wegen nach § 394 FamFG zu löschen. Die Frist zur Erhebung eines Widerspruchs ist auf sechs Wochen festgesetzt."
    },
    {
      "date": "2024-10-16",
      "id": "90556",
      "original_text": "Löschungsankündigung\nBayern Amtsgericht Ingolstadt HRB 10744\nSLG Transport GmbH – Ingolstadt",
      "type": "Löschungsankündigung",
      "state": "Bayern",
      "amtsgericht": "Amtsgericht Ingolstadt",
      "registernummer": "HRB 10744",
      "registerart": "HRB",
      "company_name": "SLG Transport GmbH",
      "company_seat": "Ingolstadt",
      "details": "16.10.2024 (Bekanntmachungsdatum)\n\nBayern Amtsgericht Ingolstadt HRB 10744\nLöschungsankündigung\n\nSLG Transport GmbH\nGesellschaft mit beschränkter Haftung\nIngolstadt\n\nDas Registergericht beabsichtigt, die im Handelsregister eingetragene Gesellschaft wegen Vermögenslosigkeit von Amts wegen nach § 394 FamFG zu löschen. Die Frist zur Erhebung eines Widerspruchs ist auf einen Monat festgesetzt."
    },
    {
      "date": "2024-10-16",
      "id": "90648",
      "original_text": "Löschungsankündigung\nNordrhein-Westfalen Amtsgericht Köln HRB 100146\nSVU Soliman Vertriebsunion UG (haftungsbeschränkt) – Köln",
      "type": "Löschungsankündigung",
      "state": "Nordrhein-Westfalen",
      "amtsgericht": "Amtsgericht Köln",
      "registernummer": "HRB 100146",
      "registerart": "HRB",
      "company_name": "SVU Soliman Vertriebsunion UG (haftungsbeschränkt)",
      "company_seat": "Köln",
      "details": "16.10.2024 (Bekanntmachungsdatum)\n\nNordrhein-Westfalen Amtsgericht Köln HRB 100146\nLöschungsankündigung\n\nSVU Soliman Vertriebsunion UG (haftungsbeschränkt)\nGesellschaft mit beschränkter Haftung\nKöln\n\nDas Registergericht beabsichtigt die Gesellschaft von Amts wegen nach § 394 FamFG zu löschen. Die Frist zur Erhebung eines Widerspruchs ist auf einen Monat festgesetzt."
    },
    {
      "date": "2024-10-16",
      "id": "90570",
      "original_text": "Registerbekanntmachung nach dem Umwandlungsgesetz\nBaden-Württemberg Amtsgericht Mannheim HRB 109537\nSanLucar Vertrieb Deutschland GmbH – Ettlingen",
      "type": "Registerbekanntmachung nach dem Umwandlungsgesetz",
      "state": "Baden-Württemberg",
      "amtsgericht": "Amtsgericht Mannheim",
      "registernummer": "HRB 109537",
      "registerart": "HRB",
      "company_name": "SanLucar Vertrieb Deutschland GmbH",
      "company_seat": "Ettlingen",
      "details": "16.10.2024 (Bekanntmachungsdatum)\n\nBaden-Württemberg Amtsgericht Mannheim HRB 109537\nRegisterbekanntmachung nach dem Umwandlungsgesetz 30.09.2024 (Eintragungsdatum)\n\nSanLucar Vertrieb Deutschland GmbH\nGesellschaft mit beschränkter Haftung\nEttlingen\n\nDen Gläubigern der an der Verschmelzung beteiligten Rechtsträger ist, wenn sie binnen sechs Monaten nach dem Tag, an dem die Eintragung der Verschmelzung in das Register des Sitzes desjenigen Rechtsträgers, dessen Gläubiger sie sind, nach § 19 Abs. 3 UmwG als bekanntgemacht gilt, ihren Anspruch nach Grund und Höhe schriftlich anmelden, Sicherheit zu leisten, soweit sie nicht Befriedigung verlangen können. Dieses Recht steht den Gläubigern jedoch nur zu, wenn sie glaubhaft machen, dass durch die Verschmelzung die Erfüllung ihrer Forderung gefährdet wird."
    },
    {
      "date": "2024-10-16",
      "id": "90666",
      "original_text": "Sonstige Registerbekanntmachung\nBrandenburg Amtsgericht Potsdam HRA 8355\nSandokan Ventures Holding GmbH & Co. KG – Stahnsdorf",
      "type": "Sonstige Registerbekanntmachung",
      "state": "Brandenburg",
      "amtsgericht": "Amtsgericht Potsdam",
      "registernummer": "HRA 8355",
      "registerart": "HRA",
      "company_name": "Sandokan Ventures Holding GmbH & Co. KG",
      "company_seat": "Stahnsdorf",
      "details": "16.10.2024 (Bekanntmachungsdatum)\n\nBrandenburg Amtsgericht Potsdam HRA 8355\nSonstige Registerbekanntmachung\n\nSandokan Ventures Holding GmbH & Co. KG\nKommanditgesellschaft\nStahnsdorf\n\nAls nicht eingetragen wird veröffentlicht:\nDer Gegenstand des Unternehmens ist das Halten und Verwalten von eigenen Beteiligungen und eigenem Vermögen."
    },
    {
      "date": "2024-10-16",
      "id": "90584",
      "original_text": "Registerbekanntmachung nach dem Umwandlungsgesetz\nBaden-Württemberg Amtsgericht Freiburg HRA 708657\nSandra Weber e.K. – Überlingen",
      "type": "Registerbekanntmachung nach dem Umwandlungsgesetz",
      "state": "Baden-Württemberg",
      "amtsgericht": "Amtsgericht Freiburg",
      "registernummer": "HRA 708657",
      "registerart": "HRA",
      "company_name": "Sandra Weber e.K.",
      "company_seat": "Überlingen",
      "details": "16.10.2024 (Bekanntmachungsdatum)\n\nBaden-Württemberg Amtsgericht Freiburg HRA 708657\nRegisterbekanntmachung nach dem Umwandlungsgesetz 16.10.2024 (Eintragungsdatum)\n\nSandra Weber e.K.\nEinzelkaufmann / Einzelkauffrau\nÜberlingen\n\nAls nicht eingetragen wird bekanntgemacht:\nDen Gläubigern der an der Ausgliederung beteiligten Rechtsträger ist, wenn sie binnen sechs Monaten nach dem Tag, an dem die Eintragung der Ausgliederung in das Register des Sitzes desjenigen Rechtsträgers, dessen Gläubiger sie sind, nach § 19 Abs. 3 UmwG als bekanntgemacht gilt, ihren Anspruch nach Grund und Höhe schriftlich anmelden, Sicherheit zu leisten, soweit sie nicht Befriedigung verlangen können. Dieses Recht steht den Gläubigern jedoch nur zu, wenn sie glaubhaft machen, dass durch die Ausgliederung die Erfüllung ihrer Forderung gefährdet wird."
    },
    {
      "date": "2024-10-16",
      "id": "90642",
      "original_text": "Einreichung neuer Dokumente\nRheinland-Pfalz Amtsgericht Koblenz HRB 3917\nScania Finance Deutschland GmbH – Koblenz",
      "type": "Einreichung neuer Dokumente",
      "state": "Rheinland-Pfalz",
      "amtsgericht": "Amtsgericht Koblenz",
      "registernummer": "HRB 3917",
      "registerart": "HRB",
      "company_name": "Scania Finance Deutschland GmbH",
      "company_seat": "Koblenz",
      "details": "16.10.2024 (Bekanntmachungsdatum)\n\nRheinland-Pfalz Amtsgericht Koblenz HRB 3917\nEinreichung neuer Dokumente\n\nScania Finance Deutschland GmbH\nGesellschaft mit beschränkter Haftung\nKoblenz\n\nDem Registergericht ist eine Liste der Mitglieder des Aufsichtsrates eingereicht worden."
    },
    {
      "date": "2024-10-16",
      "id": "90631",
      "original_text": "Registerbekanntmachung nach dem Umwandlungsgesetz\nRheinland-Pfalz Amtsgericht Mainz HRA 44616\nSchrinner Sanitär Heizung Klimatechnik e.K. – Worms",
      "type": "Registerbekanntmachung nach dem Umwandlungsgesetz",
      "state": "Rheinland-Pfalz",
      "amtsgericht": "Amtsgericht Mainz",
      "registernummer": "HRA 44616",
      "registerart": "HRA",
      "company_name": "Schrinner Sanitär Heizung Klimatechnik e.K.",
      "company_seat": "Worms",
      "details": "16.10.2024 (Bekanntmachungsdatum)\n\nRheinland-Pfalz Amtsgericht Mainz HRA 44616\nRegisterbekanntmachung nach dem Umwandlungsgesetz 16.10.2024 (Eintragungsdatum)\n\nSchrinner Sanitär Heizung Klimatechnik e.K.\nEinzelkaufmann / Einzelkauffrau\nWorms\n\nAls nicht eingetragen wird veröffentlicht: Den Gläubigern der an der Ausgliederung beteiligten Rechtsträger ist, wenn sie binnen sechs Monaten nach dem Tag, an dem die Eintragung der Ausgliederung in das Register des Sitzes desjenigen Rechtsträgers,dessen Gläubiger sie sind, nach § 19 Abs. 3 UmwG als bekannt gemacht gilt, ihren Anspruch nach Grund und Höhe schriftlich anmelden, Sicherheit zu leisten, soweit sie nicht Befriedigung verlangen können. Dieses Recht steht den Gläubigern jedoch nur zu, wenn sie glaubhaft machen, dass durch die Ausgliederung die Erfüllung der Forderung gefährdet wird."
    },
    {
      "date": "2024-10-16",
      "id": "90645",
      "original_text": "Registerbekanntmachung nach dem Umwandlungsgesetz\nRheinland-Pfalz Amtsgericht Mainz HRB 53210\nSchrinner Sanitär-Heizungs-Klimatechnik GmbH – Worms",
      "type": "Registerbekanntmachung nach dem Umwandlungsgesetz",
      "state": "Rheinland-Pfalz",
      "amtsgericht": "Amtsgericht Mainz",
      "registernummer": "HRB 53210",
      "registerart": "HRB",
      "company_name": "Schrinner Sanitär-Heizungs-Klimatechnik GmbH",
      "company_seat": "Worms",
      "details": "16.10.2024 (Bekanntmachungsdatum)\n\nRheinland-Pfalz Amtsgericht Mainz HRB 53210\nRegisterbekanntmachung nach dem Umwandlungsgesetz 16.10.2024 (Eintragungsdatum)\n\nSchrinner Sanitär-Heizungs-Klimatechnik GmbH\nGesellschaft mit beschränkter Haftung\nWorms\n\nAls nicht eingetragen wird veröffentlicht: Den Gläubigern der an der Ausgliederung beteiligten Rechtsträger ist, wenn sie binnen sechs Monaten nach dem Tag, an dem die Eintragung der Ausgliederung in das Register des Sitzes desjenigen Rechtsträgers,dessen Gläubiger sie sind, nach § 19 Abs. 3 UmwG als bekannt gemacht gilt, ihren Anspruch nach Grund und Höhe schriftlich anmelden, Sicherheit zu leisten, soweit sie nicht Befriedigung verlangen können. Dieses Recht steht den Gläubigern jedoch nur zu, wenn sie glaubhaft machen, dass durch die Ausgliederung die Erfüllung der Forderung gefährdet wird."
    },
    {
      "date": "2024-10-16",
      "id": "90667",
      "original_text": "Löschungsankündigung\nSaarland Amtsgericht Saarbrücken HRA 12191\nSchuster & Schwarz GmbH & Co. KG – Perl",
      "type": "Löschungsankündigung",
      "state": "Saarland",
      "amtsgericht": "Amtsgericht Saarbrücken",
      "registernummer": "HRA 12191",
      "registerart": "HRA",
      "company_name": "Schuster & Schwarz GmbH & Co. KG",
      "company_seat": "Perl",
      "details": "16.10.2024 (Bekanntmachungsdatum)\n\nSaarland Amtsgericht Saarbrücken HRA 12191\nLöschungsankündigung\n\nSchuster & Schwarz GmbH & Co. KG\nKommanditgesellschaft\nPerl\n\nEs ist beabsichtigt, die Gesellschaft von Amts wegen gemäß § 394 FamFG wegen Vermögenslosigkeit zu löschen. Gegen die Löschung von Amts wegen ist das Rechtsmittel des Widerspruchs statthaft. Der Widerspruch ist binnen einer Frist von 1 Monat beginnend mit dem Tag dieser Veröffentlichung durch Einreichen eines Widerspruchsschreibens -schriftlich oder zur Niederschrift der Geschäftsstelle- beim Amtsgericht Saarbrücken, -zentrales Handelsregister-, Mainzerstr.178, 66121 Saarbrücken einzulegen. Der Widerspruch muss die Bezeichnung der angefochtenen Löschungsankündigung enthalten sowie die Erklärung, dass Widerspruch eingelegt wird. Er ist vom Widerspruchsführer oder seinem Bevollmächtigten zu unterzeichnen."
    },
    {
      "date": "2024-10-16",
      "id": "90585",
      "original_text": "Einreichung neuer Dokumente\nBaden-Württemberg Amtsgericht Stuttgart HRB 21970\nSchwäbische Wohnungs AG – Stuttgart",
      "type": "Einreichung neuer Dokumente",
      "state": "Baden-Württemberg",
      "amtsgericht": "Amtsgericht Stuttgart",
      "registernummer": "HRB 21970",
      "registerart": "HRB",
      "company_name": "Schwäbische Wohnungs AG",
      "company_seat": "Stuttgart",
      "details": "16.10.2024 (Bekanntmachungsdatum)\n\nBaden-Württemberg Amtsgericht Stuttgart HRB 21970\nEinreichung neuer Dokumente 16.10.2024 (Eintragungsdatum)\n\nSchwäbische Wohnungs AG\nAktiengesellschaft\nStuttgart\n\nDie Gesellschaft hat am 15.10.2024 die Liste über die Zusammensetzung des Aufsichtsrats zum Handelsregister eingereicht."
    },
    {
      "date": "2024-10-16",
      "id": "90670",
      "original_text": "Registerbekanntmachung nach dem Umwandlungsgesetz\nHessen Amtsgericht Frankfurt am Main HRB 100080\nSeitran GmbH – Frankfurt am Main",
      "type": "Registerbekanntmachung nach dem Umwandlungsgesetz",
      "state": "Hessen",
      "amtsgericht": "Amtsgericht Frankfurt am Main",
      "registernummer": "HRB 100080",
      "registerart": "HRB",
      "company_name": "Seitran GmbH",
      "company_seat": "Frankfurt am Main",
      "details": "16.10.2024 (Bekanntmachungsdatum)\n\nHessen Amtsgericht Frankfurt am Main HRB 100080\nRegisterbekanntmachung nach dem Umwandlungsgesetz 16.10.2024 (Eintragungsdatum)\n\nSeitran GmbH\nGesellschaft mit beschränkter Haftung\nFrankfurt am Main\n\nDen Gläubigern der an der grenzüberschreitenden Verschmelzung beteiligten übernehmenden Rechtsträger ist, wenn sie binnen sechs Monaten nach dem Tag, an dem die Eintragung der Verschmelzung in das Register des Sitzes desjenigen Rechtsträgers, dessen Gläubiger sie sind, nach § 19 Absatz 3 UmwG als bekanntgemacht gilt, ihren Anspruch nach Grund und Höhe schriftlich anmelden, Sicherheit zu leisten, soweit sie nicht Befriedigung verlangen können.\n\nDieses Recht steht den Gläubigern jedoch nur zu, wenn sie glaubhaft machen, dass durch die Verschmelzung die Erfüllung ihrer Forderung gefährdet wird."
    },
    {
      "date": "2024-10-16",
      "id": "90618",
      "original_text": "Registerbekanntmachung nach dem Umwandlungsgesetz\nHamburg Amtsgericht Hamburg HRB 166240\nSimply Warm UG (haftungsbeschränkt) – Hamburg",
      "type": "Registerbekanntmachung nach dem Umwandlungsgesetz",
      "state": "Hamburg",
      "amtsgericht": "Amtsgericht Hamburg",
      "registernummer": "HRB 166240",
      "registerart": "HRB",
      "company_name": "Simply Warm UG (haftungsbeschränkt)",
      "company_seat": "Hamburg",
      "details": "16.10.2024 (Bekanntmachungsdatum)\n\nHamburg Amtsgericht Hamburg HRB 166240\nRegisterbekanntmachung nach dem Umwandlungsgesetz 16.10.2024 (Eintragungsdatum)\n\nSimply Warm UG (haftungsbeschränkt)\nGesellschaft mit beschränkter Haftung\nHamburg\n\nAls nicht eingetragen wird bekannt gemacht:\nDen Gläubigern der an der Verschmelzung beteiligten Gesellschaften ist, wenn sie binnen sechs Monaten nach dem Tag, an dem die Eintragung der Verschmelzung in das Register des Sitzes desjenigen Rechtsträgers, dessen Gläubiger sie sind, nach § 19 Absatz 3 UmwG als bekannt gemacht gilt, ihren Anspruch nach Grund und Höhe schriftlich anmelden, Sicherheit zu leisten, soweit sie nicht Befriedigung verlangen können. Dieses Recht steht den Gläubigern jedoch nur zu, wenn sie glaubhaft machen, dass durch die Verschmelzung die Erfüllung ihrer Forderung gefährdet wird."
    },
    {
      "date": "2024-10-16",
      "id": "90617",
      "original_text": "Registerbekanntmachung nach dem Umwandlungsgesetz\nHamburg Amtsgericht Hamburg HRA 128125\nSimply Warm UG (haftungsbeschränkt) & Co. KG – Hamburg",
      "type": "Registerbekanntmachung nach dem Umwandlungsgesetz",
      "state": "Hamburg",
      "amtsgericht": "Amtsgericht Hamburg",
      "registernummer": "HRA 128125",
      "registerart": "HRA",
      "company_name": "Simply Warm UG (haftungsbeschränkt) & Co. KG",
      "company_seat": "Hamburg",
      "details": "16.10.2024 (Bekanntmachungsdatum)\n\nHamburg Amtsgericht Hamburg HRA 128125\nRegisterbekanntmachung nach dem Umwandlungsgesetz 16.10.2024 (Eintragungsdatum)\n\nSimply Warm UG (haftungsbeschränkt) & Co. KG\nKommanditgesellschaft\nHamburg\n\nAls nicht eingetragen wird bekannt gemacht:\nDen Gläubigern der an der Verschmelzung beteiligten Gesellschaften ist, wenn sie binnen sechs Monaten nach dem Tag, an dem die Eintragung der Verschmelzung in das Register des Sitzes desjenigen Rechtsträgers, dessen Gläubiger sie sind, nach § 19 Absatz 3 UmwG als bekannt gemacht gilt, ihren Anspruch nach Grund und Höhe schriftlich anmelden, Sicherheit zu leisten, soweit sie nicht Befriedigung verlangen können. Dieses Recht steht den Gläubigern jedoch nur zu, wenn sie glaubhaft machen, dass durch die Verschmelzung die Erfüllung ihrer Forderung gefährdet wird."
    },
    {
      "date": "2024-10-16",
      "id": "90598",
      "original_text": "Einreichung neuer Dokumente\nBaden-Württemberg Amtsgericht Ulm HRB 501411\nStadtwerke Aalen GmbH – Aalen",
      "type": "Einreichung neuer Dokumente",
      "state": "Baden-Württemberg",
      "amtsgericht": "Amtsgericht Ulm",
      "registernummer": "HRB 501411",
      "registerart": "HRB",
      "company_name": "Stadtwerke Aalen GmbH",
      "company_seat": "Aalen",
      "details": "16.10.2024 (Bekanntmachungsdatum)\n\nBaden-Württemberg Amtsgericht Ulm HRB 501411\nEinreichung neuer Dokumente\n\nStadtwerke Aalen GmbH\nGesellschaft mit beschränkter Haftung\nAalen\n\nDie Gesellschaft hat am 15.10.2024 die Liste über die Zusammensetzung des Aufsichtsrats zum Handelsregister eingereicht."
    },
    {
      "date": "2024-10-16",
      "id": "90627",
      "original_text": "Einreichung neuer Dokumente\nNiedersachsen Amtsgericht Hannover HRB 110532 früher Amtsgericht Neustadt a. Rbge. (Neustadt)\nStadtwerke Garbsen GmbH – Garbsen",
      "type": "Einreichung neuer Dokumente",
      "state": "Niedersachsen",
      "amtsgericht": "Amtsgericht Hannover",
      "registernummer": "HRB 110532",
      "registerart": "HRB",
      "company_name": "Stadtwerke Garbsen GmbH",
      "company_seat": "Garbsen",
      "former_amtsgericht": "Neustadt a. Rbge. (Neustadt)",
      "details": "16.10.2024 (Bekanntmachungsdatum)\n\nNiedersachsen Amtsgericht Hannover HRB 110532 früher Amtsgericht Neustadt a. Rbge. (Neustadt)\nEinreichung neuer Dokumente\n\nStadtwerke Garbsen GmbH\nGesellschaft mit beschränkter Haftung\nGarbsen\n\nDie Liste der Mitglieder des Aufsichtsrats wurde beim Registergericht eingereicht."
    },
    {
      "date": "2024-10-16",
      "id": "90569",
      "original_text": "Einreichung neuer Dokumente\nBaden-Württemberg Amtsgericht Mannheim HRB 331079\nStadtwerke Heidelberg GmbH – Heidelberg",
      "type": "Einreichung neuer Dokumente",
      "state": "Baden-Württemberg",
      "amtsgericht": "Amtsgericht Mannheim",
      "registernummer": "HRB 331079",
      "registerart": "HRB",
      "company_name": "Stadtwerke Heidelberg GmbH",
      "company_seat": "Heidelberg",
      "details": "16.10.2024 (Bekanntmachungsdatum)\n\nBaden-Württemberg Amtsgericht Mannheim HRB 331079\nEinreichung neuer Dokumente\n\nStadtwerke Heidelberg GmbH\nGesellschaft mit beschränkter Haftung\nHeidelberg\n\nDie Gesellschaft hat am 14.10.2024 die Liste über die Zusammensetzung des Aufsichtsrats zum Handelsregister eingereicht."
    },
    {
      "date": "2024-10-16",
      "id": "90551",
      "original_text": "Registerbekanntmachung nach dem Umwandlungsgesetz\nBayern Amtsgericht München HRA 119850\nStefan Alex GmbH & Co. KG Höhenkirchen – Höhenkirchen-Siegertsbrunn",
      "type": "Registerbekanntmachung nach dem Umwandlungsgesetz",
      "state": "Bayern",
      "amtsgericht": "Amtsgericht München",
      "registernummer": "HRA 119850",
      "registerart": "HRA",
      "company_name": "Stefan Alex GmbH & Co. KG Höhenkirchen",
      "company_seat": "Höhenkirchen-Siegertsbrunn",
      "details": "16.10.2024 (Bekanntmachungsdatum)\n\nBayern Amtsgericht München HRA 119850\nRegisterbekanntmachung nach dem Umwandlungsgesetz 15.10.2024 (Eintragungsdatum)\n\nStefan Alex GmbH & Co. KG Höhenkirchen\nKommanditgesellschaft\nHöhenkirchen-Siegertsbrunn\n\nDen Gläubigern der an der Ausgliederung beteiligten Rechtsträger ist, wenn sie binnen sechs Monaten nach dem Tag, an dem die Eintragung der Ausgliederung in das Register des Sitzes desjenigen Rechtsträgers, dessen Gläubiger sie sind, nach §§ 125, 19 Abs. 3 UmwG als bekannt gemacht gilt, ihren Anspruch nach Grund und Höhe schriftlich anmelden, Sicherheit zu leisten, soweit sie nicht Befriedigung verlangen können. Dieses Recht steht den Gläubigern jedoch nur zu, wenn sie glaubhaft machen, dass durch die Ausgliederung die Erfüllung ihrer Forderung gefährdet wird."
    },
    {
      "date": "2024-10-16",
      "id": "90658",
      "original_text": "Registerbekanntmachung nach dem Umwandlungsgesetz\nNordrhein-Westfalen Amtsgericht Köln HRB 73901\nSysteam Holding GmbH – Köln",
      "type": "Registerbekanntmachung nach dem Umwandlungsgesetz",
      "state": "Nordrhein-Westfalen",
      "amtsgericht": "Amtsgericht Köln",
      "registernummer": "HRB 73901",
      "registerart": "HRB",
      "company_name": "Systeam Holding GmbH",
      "company_seat": "Köln",
      "details": "16.10.2024 (Bekanntmachungsdatum)\n\nNordrhein-Westfalen Amtsgericht Köln HRB 73901\nRegisterbekanntmachung nach dem Umwandlungsgesetz 16.10.2024 (Eintragungsdatum)\n\nSysteam Holding GmbH\nGesellschaft mit beschränkter Haftung\nKöln\n\nDen Gläubigern der an der Verschmelzung beteiligten Rechtsträger ist, wenn sie binnen sechs Monaten nach dem Tag, an dem die Eintragung der Verschmelzung in das Register des Sitzes desjenigen Rechtsträgers, dessen Gläubiger sie sind, nach § 19 Absatz 3 UmwG als bekanntgemacht gilt, ihren Anspruch nach Grund und Höhe schriftlich anmelden, Sicherheit zu leisten, soweit sie nicht Befriedigung verlangen können. Dieses Recht steht den Gläubigern jedoch nur zu, wenn sie glaubhaft machen, dass durch die Verschmelzung die Erfüllung ihrer Forderung gefährdet wird."
    },
    {
      "date": "2024-10-16",
      "id": "90581",
      "original_text": "Registerbekanntmachung nach dem Umwandlungsgesetz\nBaden-Württemberg Amtsgericht Freiburg HRA 708758\nTHEKI Academy GmbH & Co. KG – Überlingen",
      "type": "Registerbekanntmachung nach dem Umwandlungsgesetz",
      "state": "Baden-Württemberg",
      "amtsgericht": "Amtsgericht Freiburg",
      "registernummer": "HRA 708758",
      "registerart": "HRA",
      "company_name": "THEKI Academy GmbH & Co. KG",
      "company_seat": "Überlingen",
      "details": "16.10.2024 (Bekanntmachungsdatum)\n\nBaden-Württemberg Amtsgericht Freiburg HRA 708758\nRegisterbekanntmachung nach dem Umwandlungsgesetz 16.10.2024 (Eintragungsdatum)\n\nTHEKI Academy GmbH & Co. KG\nKommanditgesellschaft\nÜberlingen\n\nDas Einzelunternehmen \"Sandra Weber e.K.\" (Amtsgericht Freiburg, HRA 708657) wurde gemäß Vertrag und Beschluss vom 16.08.2024 auf diese Gesellschaft ausgegliedert. Den Gläubigern der an der Ausgliederung beteiligten Rechtsträger ist, wenn sie binnen sechs Monaten nach dem Tag, an dem die Eintragung der Ausgliederung in das Register des Sitzes desjenigen Rechtsträgers, dessen Gläubiger sie sind, nach § 19 Abs. 3 UmwG als bekanntgemacht gilt, ihren Anspruch nach Grund und Höhe schriftlich anmelden, Sicherheit zu leisten, soweit sie nicht Befriedigung verlangen können. Dieses Recht steht den Gläubigern jedoch nur zu, wenn sie glaubhaft machen, dass durch die Ausgliederung die Erfüllung ihrer Forderung gefährdet wird."
    },
    {
      "date": "2024-10-16",
      "id": "90656",
      "original_text": "Löschungsankündigung\nNordrhein-Westfalen Amtsgericht Dortmund HRB 30535\nTOPCASABAU GmbH – Dortmund",
      "type": "Löschungsankündigung",
      "state": "Nordrhein-Westfalen",
      "amtsgericht": "Amtsgericht Dortmund",
      "registernummer": "HRB 30535",
      "registerart": "HRB",
      "company_name": "TOPCASABAU GmbH",
      "company_seat": "Dortmund",
      "details": "16.10.2024 (Bekanntmachungsdatum)\n\nNordrhein-Westfalen Amtsgericht Dortmund HRB 30535\nLöschungsankündigung\n\nTOPCASABAU GmbH\nGesellschaft mit beschränkter Haftung\nDortmund\n\nDas Registergericht beabsichtigt die Gesellschaft von Amts wegen nach § 394 FamFG zu löschen. Die Frist zur Erhebung eines Widerspruchs ist auf zwei Monate festgesetzt."
    },
    {
      "date": "2024-10-16",
      "id": "90643",
      "original_text": "Registerbekanntmachung nach dem Umwandlungsgesetz\nRheinland-Pfalz Amtsgericht Mainz HRA 44437\nTVi Meyer e.K. – Bingen am Rhein",
      "type": "Registerbekanntmachung nach dem Umwandlungsgesetz",
      "state": "Rheinland-Pfalz",
      "amtsgericht": "Amtsgericht Mainz",
      "registernummer": "HRA 44437",
      "registerart": "HRA",
      "company_name": "TVi Meyer e.K.",
      "company_seat": "Bingen am Rhein",
      "details": "16.10.2024 (Bekanntmachungsdatum)\n\nRheinland-Pfalz Amtsgericht Mainz HRA 44437\nRegisterbekanntmachung nach dem Umwandlungsgesetz 16.10.2024 (Eintragungsdatum)\n\nTVi Meyer e.K.\nEinzelkaufmann / Einzelkauffrau\nBingen am Rhein\n\nAls nicht eingetragen wird veröffentlicht: Den Gläubigern der an der Ausgliederung beteiligten Rechtsträger ist, wenn sie binnen sechs Monaten nach dem Tag, an dem die Eintragung der Ausgliederung in das Register des Sitzes desjenigen Rechtsträgers,dessen Gläubiger sie sind, nach § 19 Abs. 3 UmwG als bekannt gemacht gilt, ihren Anspruch nach Grund und Höhe schriftlich anmelden, Sicherheit zu leisten, soweit sie nicht Befriedigung verlangen können. Dieses Recht steht den Gläubigern jedoch nur zu, wenn sie glaubhaft machen, dass durch die Ausgliederung die Erfüllung der Forderung gefährdet wird."
    },
    {
      "date": "2024-10-16",
      "id": "90557",
      "original_text": "Registerbekanntmachung nach dem Umwandlungsgesetz\nBayern Amtsgericht München HRB 229823\nTopglas GmbH – Grünwald",
      "type": "Registerbekanntmachung nach dem Umwandlungsgesetz",
      "state": "Bayern",
      "amtsgericht": "Amtsgericht München",
      "registernummer": "HRB 229823",
      "registerart": "HRB",
      "company_name": "Topglas GmbH",
      "company_seat": "Grünwald",
      "details": "16.10.2024 (Bekanntmachungsdatum)\n\nBayern Amtsgericht München HRB 229823\nRegisterbekanntmachung nach dem Umwandlungsgesetz 15.10.2024 (Eintragungsdatum)\n\nTopglas GmbH\nGesellschaft mit beschränkter Haftung\nGrünwald\n\nDen Gläubigern der an der Verschmelzung beteiligten Rechtsträger ist, wenn sie binnen sechs Monaten nach dem Tag, an dem die Eintragung der Verschmelzung in das Register des Sitzes desjenigen Rechtsträgers, dessen Gläubiger sie sind, nach § 19 Abs. 3 UmwG als bekannt gemacht gilt, ihren Anspruch nach Grund und Höhe schriftlich anmelden, Sicherheit zu leisten, soweit sie nicht Befriedigung verlangen können. Dieses Recht steht den Gläubigern jedoch nur zu, wenn sie glaubhaft machen, dass durch die Verschmelzung die Erfüllung ihrer Forderung gefährdet wird."
    },
    {
      "date": "2024-10-16",
      "id": "90632",
      "original_text": "Registerbekanntmachung nach dem Umwandlungsgesetz\nRheinland-Pfalz Amtsgericht Mainz HRA 44438\nTreuhandverwaltung für Immobilienprojekte GmbH & Co. KG – Bingen am Rhein",
      "type": "Registerbekanntmachung nach dem Umwandlungsgesetz",
      "state": "Rheinland-Pfalz",
      "amtsgericht": "Amtsgericht Mainz",
      "registernummer": "HRA 44438",
      "registerart": "HRA",
      "company_name": "Treuhandverwaltung für Immobilienprojekte GmbH & Co. KG",
      "company_seat": "Bingen am Rhein",
      "details": "16.10.2024 (Bekanntmachungsdatum)\n\nRheinland-Pfalz Amtsgericht Mainz HRA 44438\nRegisterbekanntmachung nach dem Umwandlungsgesetz 16.10.2024 (Eintragungsdatum)\n\nTreuhandverwaltung für Immobilienprojekte GmbH & Co. KG\nKommanditgesellschaft\nBingen am Rhein\n\nAls nicht eingetragen wird veröffentlicht: Den Gläubigern der an der Ausgliederung beteiligten Rechtsträger ist, wenn sie binnen sechs Monaten nach dem Tag, an dem die Eintragung der Ausgliederung in das Register des Sitzes desjenigen Rechtsträgers,dessen Gläubiger sie sind, nach § 19 Abs. 3 UmwG als bekannt gemacht gilt, ihren Anspruch nach Grund und Höhe schriftlich anmelden, Sicherheit zu leisten, soweit sie nicht Befriedigung verlangen können. Dieses Recht steht den Gläubigern jedoch nur zu, wenn sie glaubhaft machen, dass durch die Ausgliederung die Erfüllung der Forderung gefährdet wird."
    },
    {
      "date": "2024-10-16",
      "id": "90595",
      "original_text": "Löschungsankündigung\nSaarland Amtsgericht Saarbrücken HRB 102806\nTässje am Dom UG (haftungsbeschränkt) – St. Wendel",
      "type": "Löschungsankündigung",
      "state": "Saarland",
      "amtsgericht": "Amtsgericht Saarbrücken",
      "registernummer": "HRB 102806",
      "registerart": "HRB",
      "company_name": "Tässje am Dom UG (haftungsbeschränkt)",
      "company_seat": "St. Wendel",
      "details": "16.10.2024 (Bekanntmachungsdatum)\n\nSaarland Amtsgericht Saarbrücken HRB 102806\nLöschungsankündigung\n\nTässje am Dom UG (haftungsbeschränkt)\nGesellschaft mit beschränkter Haftung\nSt. Wendel\n\nEs ist beabsichtigt, die Gesellschaft von Amts wegen gemäß § 394 FamFG wegen Vermögenslosigkeit zu löschen.\nGegen die Löschung von Amts wegen ist das Rechtsmittel des Widerspruchs statthaft. Der Widerspruch ist binnen einer Frist zwei Monaten beginnend mit dem Tag dieser Veröffentlichung durch Einreichen eines Widerspruchsschreibens -schriftlich oder zur Niederschrift der Geschäftsstelle beim Amtsgericht Saarbrücken, -zentrales Handelsregister-, Mainzer Str.178, 66121 Saarbrücken einzulegen.\nDer Widerspruch muss die Bezeichnung der angefochtenen Löschungsankündigung enthalten sowie die Erklärung, dass Widerspruch eingelegt wird. Er ist vom Widerspruchsführer oder seinem Bevollmächtigten zu unterzeichnen.\nDas Widerspruchsschreiben kann auch in der Form eines elektronischen Dokumentes eingereicht werden, das mit einer qualifizierten elektronischen Signatur nach dem Signaturgesetz versehen sein muss (§§ 14 Abs. 2 FamFG, 130a, 298 ZPO)."
    },
    {
      "date": "2024-10-16",
      "id": "90544",
      "original_text": "Registerbekanntmachung nach dem Umwandlungsgesetz\nBayern Amtsgericht Bamberg HRB 10094\nVI Technomix Visuallnspection GmbH – Pommersfelden",
      "type": "Registerbekanntmachung nach dem Umwandlungsgesetz",
      "state": "Bayern",
      "amtsgericht": "Amtsgericht Bamberg",
      "registernummer": "HRB 10094",
      "registerart": "HRB",
      "company_name": "VI Technomix Visuallnspection GmbH",
      "company_seat": "Pommersfelden",
      "details": "16.10.2024 (Bekanntmachungsdatum)\n\nBayern Amtsgericht Bamberg HRB 10094\nRegisterbekanntmachung nach dem Umwandlungsgesetz 15.10.2024 (Eintragungsdatum)\n\nVI Technomix Visuallnspection GmbH\nGesellschaft mit beschränkter Haftung\nPommersfelden\n\nDen Gläubigern der an der Verschmelzung beteiligten Rechtsträger ist, wenn sie binnen sechs Monaten nach dem Tag, an dem die Eintragung der Verschmelzung in das Register des Sitzes desjenigen Rechtsträgers, dessen Gläubiger sie sind, nach § 19 Abs. 3 UmwG als bekannt gemacht gilt, ihren Anspruch nach Grund und Höhe schriftlich anmelden, Sicherheit zu leisten, soweit sie nicht Befriedigung verlangen können. Dieses Recht steht den Gläubigern jedoch nur zu, wenn sie glaubhaft machen, dass durch die Verschmelzung die Erfüllung ihrer Forderung gefährdet wird."
    },
    {
      "date": "2024-10-16",
      "id": "90633",
      "original_text": "Registerbekanntmachung nach dem Umwandlungsgesetz\nRheinland-Pfalz Amtsgericht Landau HRB 34098\nVollmer GmbH - Schreinerei und Fensterbau- – Lustadt",
      "type": "Registerbekanntmachung nach dem Umwandlungsgesetz",
      "state": "Rheinland-Pfalz",
      "amtsgericht": "Amtsgericht Landau",
      "registernummer": "HRB 34098",
      "registerart": "HRB",
      "company_name": "Vollmer GmbH - Schreinerei und Fensterbau-",
      "company_seat": "Lustadt",
      "details": "16.10.2024 (Bekanntmachungsdatum)\n\nRheinland-Pfalz Amtsgericht Landau HRB 34098\nRegisterbekanntmachung nach dem Umwandlungsgesetz 16.10.2024 (Eintragungsdatum)\n\nVollmer GmbH - Schreinerei und Fensterbau-\nGesellschaft mit beschränkter Haftung\nLustadt\n\nAls nicht eingetragen wird veröffentlicht: Den Gläubigern der an der Ausgliederung beteiligten Rechtsträger ist, wenn sie binnen sechs Monaten nach dem Tag, an dem die Eintragung der Ausgliederung in das Register des Sitzes desjenigen Rechtsträgers,dessen Gläubiger sie sind, nach § 19 Abs. 3 UmwG als bekannt gemacht gilt, ihren Anspruch nach Grund und Höhe schriftlich anmelden, Sicherheit zu leisten, soweit sie nicht Befriedigung verlangen können. Dieses Recht steht den Gläubigern jedoch nur zu, wenn sie glaubhaft machen, dass durch die Ausgliederung die Erfüllung der Forderung gefährdet wird."
    },
    {
      "date": "2024-10-16",
      "id": "90635",
      "original_text": "Registerbekanntmachung nach dem Umwandlungsgesetz\nRheinland-Pfalz Amtsgericht Landau HRA 31075\nVollmer e.K. – Lustadt",
      "type": "Registerbekanntmachung nach dem Umwandlungsgesetz",
      "state": "Rheinland-Pfalz",
      "amtsgericht": "Amtsgericht Landau",
      "registernummer": "HRA 31075",
      "registerart": "HRA",
      "company_name": "Vollmer e.K.",
      "company_seat": "Lustadt",
      "details": "16.10.2024 (Bekanntmachungsdatum)\n\nRheinland-Pfalz Amtsgericht Landau HRA 31075\nRegisterbekanntmachung nach dem Umwandlungsgesetz 16.10.2024 (Eintragungsdatum)\n\nVollmer e.K.\nEinzelkaufmann / Einzelkauffrau\nLustadt\n\nAls nicht eingetragen wird veröffentlicht: Den Gläubigern der an der Ausgliederung beteiligten Rechtsträger ist, wenn sie binnen sechs Monaten nach dem Tag, an dem die Eintragung der Ausgliederung in das Register des Sitzes desjenigen Rechtsträgers, dessen Gläubiger sie sind, nach § 19 Abs. 3 UmwG als bekannt gemacht gilt, ihren Anspruch nach Grund und Höhe schriftlich anmelden, Sicherheit zu leisten, soweit sie nicht Befriedigung verlangen können. Dieses Recht steht den Gläubigern jedoch nur zu, wenn sie glaubhaft machen, dass durch die Ausgliederung die Erfüllung der Forderung gefährdet wird."
    },
    {
      "date": "2024-10-16",
      "id": "90558",
      "original_text": "Registerbekanntmachung nach dem Umwandlungsgesetz\nBayern Amtsgericht Weiden i. d. OPf. HRB 4838\nWITRON Vermögensverwaltungs GmbH – Parkstein",
      "type": "Registerbekanntmachung nach dem Umwandlungsgesetz",
      "state": "Bayern",
      "amtsgericht": "Amtsgericht Weiden i. d. OPf.",
      "registernummer": "HRB 4838",
      "registerart": "HRB",
      "company_name": "WITRON Vermögensverwaltungs GmbH",
      "company_seat": "Parkstein",
      "details": "16.10.2024 (Bekanntmachungsdatum)\n\nBayern Amtsgericht Weiden i. d. OPf. HRB 4838\nRegisterbekanntmachung nach dem Umwandlungsgesetz 15.10.2024 (Eintragungsdatum)\n\nWITRON Vermögensverwaltungs GmbH\nGesellschaft mit beschränkter Haftung\nParkstein\n\nDen Gläubigern der an der Verschmelzung beteiligten Rechtsträger ist, wenn sie binnen sechs Monaten nach dem Tag, an dem die Eintragung der Verschmelzung in das Register des Sitzes desjenigen Rechtsträgers, dessen Gläubiger sie sind, nach § 19 Abs. 3 UmwG als bekannt gemacht gilt, ihren Anspruch nach Grund und Höhe schriftlich anmelden, Sicherheit zu leisten, soweit sie nicht Befriedigung verlangen können. Dieses Recht steht den Gläubigern jedoch nur zu, wenn sie glaubhaft machen, dass durch die Verschmelzung die Erfüllung ihrer Forderung gefährdet wird."
    },
    {
      "date": "2024-10-16",
      "id": "90547",
      "original_text": "Registerbekanntmachung nach dem Umwandlungsgesetz\nBayern Amtsgericht Weiden i. d. OPf. HRA 3251\nWITRON Vermögensverwaltungs SE & Co. KG – Parkstein",
      "type": "Registerbekanntmachung nach dem Umwandlungsgesetz",
      "state": "Bayern",
      "amtsgericht": "Amtsgericht Weiden i. d. OPf.",
      "registernummer": "HRA 3251",
      "registerart": "HRA",
      "company_name": "WITRON Vermögensverwaltungs SE & Co. KG",
      "company_seat": "Parkstein",
      "details": "16.10.2024 (Bekanntmachungsdatum)\n\nBayern Amtsgericht Weiden i. d. OPf. HRA 3251\nRegisterbekanntmachung nach dem Umwandlungsgesetz 15.10.2024 (Eintragungsdatum)\n\nWITRON Vermögensverwaltungs SE & Co. KG\nKommanditgesellschaft\nParkstein\n\nDen Gläubigern der an der Verschmelzung beteiligten Rechtsträger ist, wenn sie binnen sechs Monaten nach dem Tag, an dem die Eintragung der Verschmelzung in das Register des Sitzes desjenigen Rechtsträgers, dessen Gläubiger sie sind, nach § 19 Abs. 3 UmwG als bekannt gemacht gilt, ihren Anspruch nach Grund und Höhe schriftlich anmelden, Sicherheit zu leisten, soweit sie nicht Befriedigung verlangen können. Dieses Recht steht den Gläubigern jedoch nur zu, wenn sie glaubhaft machen, dass durch die Verschmelzung die Erfüllung ihrer Forderung gefährdet wird."
    },
    {
      "date": "2024-10-16",
      "id": "90660",
      "original_text": "Löschungsankündigung\nNordrhein-Westfalen Amtsgericht Gelsenkirchen HRB 13252\nWKU GmbH – Gladbeck",
      "type": "Löschungsankündigung",
      "state": "Nordrhein-Westfalen",
      "amtsgericht": "Amtsgericht Gelsenkirchen",
      "registernummer": "HRB 13252",
      "registerart": "HRB",
      "company_name": "WKU GmbH",
      "company_seat": "Gladbeck",
      "details": "16.10.2024 (Bekanntmachungsdatum)\n\nNordrhein-Westfalen Amtsgericht Gelsenkirchen HRB 13252\nLöschungsankündigung\n\nWKU GmbH\nGesellschaft mit beschränkter Haftung\nGladbeck\n\nDas Gericht beabsichtigt, die Gesellschaft WKU GmbH mit Sitz in Gladbeck, HRB 13252 Amtsgericht Gelsenkirchen, wegen Vermögenslosigkeit zu löschen.\n\nHiermit wird denjenigen, die an der Unterlassung der Löschung ein berechtigtes Interesse haben, gem. § 394 Abs. 2 FamFG Gelegenheit gegeben, gegen dieses Vorhaben binnen eines Monats nach dieser Bekanntmachung Widerspruch einzulegen. Der Widerspruch kann schriftlich oder zu Protokoll der Geschäftsstelle erhoben werden."
    },
    {
      "date": "2024-10-16",
      "id": "90543",
      "original_text": "Registerbekanntmachung nach dem Umwandlungsgesetz\nBayern Amtsgericht Nürnberg HRB 37683\nWerkhaus GmbH – Kammerstein",
      "type": "Registerbekanntmachung nach dem Umwandlungsgesetz",
      "state": "Bayern",
      "amtsgericht": "Amtsgericht Nürnberg",
      "registernummer": "HRB 37683",
      "registerart": "HRB",
      "company_name": "Werkhaus GmbH",
      "company_seat": "Kammerstein",
      "details": "16.10.2024 (Bekanntmachungsdatum)\n\nBayern Amtsgericht Nürnberg HRB 37683\nRegisterbekanntmachung nach dem Umwandlungsgesetz 15.10.2024 (Eintragungsdatum)\n\nWerkhaus GmbH\nGesellschaft mit beschränkter Haftung\nKammerstein\n\nDen Gläubigern der an der Verschmelzung beteiligten Rechtsträger ist, wenn sie binnen sechs Monaten nach dem Tag, an dem die Eintragung der Verschmelzung in das Register des Sitzes desjenigen Rechtsträgers, dessen Gläubiger sie sind, nach § 19 Abs. 3 UmwG als bekannt gemacht gilt, ihren Anspruch nach Grund und Höhe schriftlich anmelden, Sicherheit zu leisten, soweit sie nicht Befriedigung verlangen können. Dieses Recht steht den Gläubigern jedoch nur zu, wenn sie glaubhaft machen, dass durch die Verschmelzung die Erfüllung ihrer Forderung gefährdet wird."
    },
    {
      "date": "2024-10-16",
      "id": "90571",
      "original_text": "Löschungsankündigung\nSaarland Amtsgericht Saarbrücken HRB 75176\nWerner Roth Verwaltungs GmbH – Saarbrücken",
      "type": "Löschungsankündigung",
      "state": "Saarland",
      "amtsgericht": "Amtsgericht Saarbrücken",
      "registernummer": "HRB 75176",
      "registerart": "HRB",
      "company_name": "Werner Roth Verwaltungs GmbH",
      "company_seat": "Saarbrücken",
      "details": "16.10.2024 (Bekanntmachungsdatum)\n\nSaarland Amtsgericht Saarbrücken HRB 75176\nLöschungsankündigung\n\nWerner Roth Verwaltungs GmbH\nGesellschaft mit beschränkter Haftung\nSaarbrücken\n\nEs ist beabsichtigt, die Gesellschaft von Amts wegen gemäß § 394 FamFG wegen Vermögenslosigkeit zu löschen.\nGegen die Löschung von Amts wegen ist das Rechtsmittel des Widerspruchs statthaft. Der Widerspruch ist binnen einer Frist drei Monaten beginnend mit dem Tag dieser Veröffentlichung durch Einreichen eines Widerspruchsschreibens -schriftlich oder zur Niederschrift der Geschäftsstelle beim Amtsgericht Saarbrücken, -zentrales Handelsregister-, Mainzerstr.178, 66121 Saarbrücken einzulegen.\nDer Widerspruch muss die Bezeichnung der angefochtenen Löschungsankündigung enthalten sowie die Erklärung, dass Widerspruch eingelegt wird. Er ist vom Widerspruchsführer oder seinem Bevollmächtigten zu unterzeichnen.\nDas Widerspruchsschreiben kann auch in der Form eines elektronischen Dokumentes eingereicht werden, das mit einer qualifizierten elektronischen Signatur nach dem Signaturgesetz versehen sein muss (§§ 14 Abs. 2 FamFG, 130a, 298 ZPO)."
    },
    {
      "date": "2024-10-16",
      "id": "90647",
      "original_text": "Einreichung neuer Dokumente\nRheinland-Pfalz Amtsgericht Koblenz HRB 1030\nWirtschaftsförderungsgesellschaft am Mittelrhein mbH – Koblenz",
      "type": "Einreichung neuer Dokumente",
      "state": "Rheinland-Pfalz",
      "amtsgericht": "Amtsgericht Koblenz",
      "registernummer": "HRB 1030",
      "registerart": "HRB",
      "company_name": "Wirtschaftsförderungsgesellschaft am Mittelrhein mbH",
      "company_seat": "Koblenz",
      "details": "16.10.2024 (Bekanntmachungsdatum)\n\nRheinland-Pfalz Amtsgericht Koblenz HRB 1030\nEinreichung neuer Dokumente\n\nWirtschaftsförderungsgesellschaft am Mittelrhein mbH\nGesellschaft mit beschränkter Haftung\nKoblenz\n\nDem Registergericht ist eine neue Liste der Mitglieder des Aufsichtsrates eingereicht worden."
    },
    {
      "date": "2024-10-16",
      "id": "90589",
      "original_text": "Einreichung neuer Dokumente\nBaden-Württemberg Amtsgericht Stuttgart HRB 200105\nWohnungsbau Ludwigsburg GmbH – Ludwigsburg",
      "type": "Einreichung neuer Dokumente",
      "state": "Baden-Württemberg",
      "amtsgericht": "Amtsgericht Stuttgart",
      "registernummer": "HRB 200105",
      "registerart": "HRB",
      "company_name": "Wohnungsbau Ludwigsburg GmbH",
      "company_seat": "Ludwigsburg",
      "details": "16.10.2024 (Bekanntmachungsdatum)\n\nBaden-Württemberg Amtsgericht Stuttgart HRB 200105\nEinreichung neuer Dokumente\n\nWohnungsbau Ludwigsburg GmbH\nGesellschaft mit beschränkter Haftung\nLudwigsburg\n\nDie Gesellschaft hat am 15.10.2024 die Liste über die Zusammensetzung des Aufsichtsrats zum Handelsregister eingereicht."
    },
    {
      "date": "2024-10-16",
      "id": "90622",
      "original_text": "Einreichung neuer Dokumente\nSachsen Amtsgericht Dresden HRB 8543\nWohnungsgesellschaft Freital mit beschränkter Haftung – Freital",
      "type": "Einreichung neuer Dokumente",
      "state": "Sachsen",
      "amtsgericht": "Amtsgericht Dresden",
      "registernummer": "HRB 8543",
      "registerart": "HRB",
      "company_name": "Wohnungsgesellschaft Freital mit beschränkter Haftung",
      "company_seat": "Freital",
      "details": "16.10.2024 (Bekanntmachungsdatum)\n\nSachsen Amtsgericht Dresden HRB 8543\nEinreichung neuer Dokumente\n\nWohnungsgesellschaft Freital mit beschränkter Haftung\nGesellschaft mit beschränkter Haftung\nFreital\n\nAm 15.10.2024 wurde beim Handelsregister des Amtsgerichts Dresden die Liste der Mitglieder des Aufsichtsrats gemäß § 52 GmbHG eingereicht."
    },
    {
      "date": "2024-10-16",
      "id": "90654",
      "original_text": "Registerbekanntmachung nach dem Umwandlungsgesetz\nNordrhein-Westfalen Amtsgericht Münster GsR 305\nZinshaus Ensemble eGbR – Münster",
      "type": "Registerbekanntmachung nach dem Umwandlungsgesetz",
      "state": "Nordrhein-Westfalen",
      "amtsgericht": "Amtsgericht Münster",
      "registernummer": "GsR 305",
      "registerart": "GsR",
      "company_name": "Zinshaus Ensemble eGbR",
      "company_seat": "Münster",
      "details": "16.10.2024 (Bekanntmachungsdatum)\n\nNordrhein-Westfalen Amtsgericht Münster GsR 305\nRegisterbekanntmachung nach dem Umwandlungsgesetz 16.10.2024 (Eintragungsdatum)\n\nZinshaus Ensemble eGbR\nGesellschaft bürgerlichen Rechts\nMünster\n\nDen Gläubigern der an der formwechselnden Umwandlung beteiligten Rechtsträger ist, wenn sie binnen sechs Monaten nach dem Tag, an dem die Eintragung der formwechselnden Umwandlung in das Register des Sitzes desjenigen Rechtsträgers, dessen Gläubiger sie sind, nach § 19 Absatz 3 UmwG als bekanntgemacht gilt, ihren Anspruch nach Grund und Höhe schriftlich anmelden, Sicherheit zu leisten, soweit sie nicht Befriedigung verlangen können. Dieses Recht steht den Gläubigern jedoch nur zu, wenn sie glaubhaft machen, dass durch die formwechselnden Umwandlung die Erfüllung ihrer Forderung gefährdet wird."
    },
    {
      "date": "2024-10-16",
      "id": "90621",
      "original_text": "Löschungsankündigung\nSachsen Amtsgericht Chemnitz HRB 33962\nasurenz GmbH – Plauen",
      "type": "Löschungsankündigung",
      "state": "Sachsen",
      "amtsgericht": "Amtsgericht Chemnitz",
      "registernummer": "HRB 33962",
      "registerart": "HRB",
      "company_name": "asurenz GmbH",
      "company_seat": "Plauen",
      "details": "16.10.2024 (Bekanntmachungsdatum)\n\nSachsen Amtsgericht Chemnitz HRB 33962\nLöschungsankündigung\n\nasurenz GmbH\nGesellschaft mit beschränkter Haftung\nPlauen\n\nDas Registergericht beabsichtigt, die im Handelsregister eingetragene Gesellschaft von Amts wegen nach § 394 FamFG zu löschen. Die Frist zu Erhebung eines Widerspruchs gegen die beabsichtigte Löschung wird auf einen Monat festgesetzt."
    },
    {
      "date": "2024-10-16",
      "id": "90675",
      "original_text": "Löschungsankündigung\nHessen Amtsgericht Offenbach am Main HRB 50001\nbni Sicherheitsdienst UG (haftungsbeschränkt) – Offenbach am Main",
      "type": "Löschungsankündigung",
      "state": "Hessen",
      "amtsgericht": "Amtsgericht Offenbach am Main",
      "registernummer": "HRB 50001",
      "registerart": "HRB",
      "company_name": "bni Sicherheitsdienst UG (haftungsbeschränkt)",
      "company_seat": "Offenbach am Main",
      "details": "16.10.2024 (Bekanntmachungsdatum)\n\nHessen Amtsgericht Offenbach am Main HRB 50001\nLöschungsankündigung\n\nbni Sicherheitsdienst UG (haftungsbeschränkt)\nGesellschaft mit beschränkter Haftung\nOffenbach am Main\n\nDas Registergericht beabsichtigt die im Handelsregister eingetragene Gesellschaft von Amts wegen nach § 394 FamFG zu löschen. Die Frist zur Erhebung eines Widerspruchs gegen die beabsichtigte Löschung wird auf 3 Monate festgesetzt."
    },
    {
      "date": "2024-10-16",
      "id": "90568",
      "original_text": "Löschungsankündigung\nBayern Amtsgericht Ingolstadt HRB 11056\ndisu.GROUP GmbH – Ingolstadt",
      "type": "Löschungsankündigung",
      "state": "Bayern",
      "amtsgericht": "Amtsgericht Ingolstadt",
      "registernummer": "HRB 11056",
      "registerart": "HRB",
      "company_name": "disu.GROUP GmbH",
      "company_seat": "Ingolstadt",
      "details": "16.10.2024 (Bekanntmachungsdatum)\n\nBayern Amtsgericht Ingolstadt HRB 11056\nLöschungsankündigung\n\ndisu.GROUP GmbH\nGesellschaft mit beschränkter Haftung\nIngolstadt\n\nDas Registergericht beabsichtigt, die im Handelsregister eingetragene Gesellschaft wegen Vermögenslosigkeit von Amts wegen nach § 394 FamFG zu löschen. Die Frist zur Erhebung eines Widerspruchs ist auf einen Monat festgesetzt."
    },
    {
      "date": "2024-10-16",
      "id": "90572",
      "original_text": "Einreichung neuer Dokumente\nBrandenburg Amtsgericht Potsdam HRB 16858\ne.dialog Netz GmbH – Potsdam",
      "type": "Einreichung neuer Dokumente",
      "state": "Brandenburg",
      "amtsgericht": "Amtsgericht Potsdam",
      "registernummer": "HRB 16858",
      "registerart": "HRB",
      "company_name": "e.dialog Netz GmbH",
      "company_seat": "Potsdam",
      "details": "16.10.2024 (Bekanntmachungsdatum)\n\nBrandenburg Amtsgericht Potsdam HRB 16858\nEinreichung neuer Dokumente\n\ne.dialog Netz GmbH\nGesellschaft mit beschränkter Haftung\nPotsdam\n\nAls nicht eingetragen wird veröffentlicht: Eine Liste der Mitglieder des Aufsichtsrates wurde zum Handelsregister eingereicht."
    },
    {
      "date": "2024-10-16",
      "id": "90636",
      "original_text": "Registerbekanntmachung nach dem Umwandlungsgesetz\nRheinland-Pfalz Amtsgericht Mainz HRB 47897\nframecontrol TV Produktion UG (haftungsbeschränkt) – Gau-Bischofsheim",
      "type": "Registerbekanntmachung nach dem Umwandlungsgesetz",
      "state": "Rheinland-Pfalz",
      "amtsgericht": "Amtsgericht Mainz",
      "registernummer": "HRB 47897",
      "registerart": "HRB",
      "company_name": "framecontrol TV Produktion UG (haftungsbeschränkt)",
      "company_seat": "Gau-Bischofsheim",
      "details": "16.10.2024 (Bekanntmachungsdatum)\n\nRheinland-Pfalz Amtsgericht Mainz HRB 47897\nRegisterbekanntmachung nach dem Umwandlungsgesetz 16.10.2024 (Eintragungsdatum)\n\nframecontrol TV Produktion UG (haftungsbeschränkt)\nGesellschaft mit beschränkter Haftung\nGau-Bischofsheim\n\nAls nicht eingetragen wird veröffentlicht: Den Gläubigern der an der Verschmelzung beteiligten Rechtsträger ist, wenn sie binnen sechs Monaten nach dem Tag, an dem die Eintragung der Verschmelzung in das Register des Sitzes desjenigen Rechtsträgers, dessen Gläubiger sie sind, nach § 19 Abs. 3 UmwG als bekannt gemacht gilt, ihren Anspruch nach Grund und Höhe schriftlich anmelden, Sicherheit zu leisten, soweit sie nicht Befriedigung verlangen können. Dieses Recht steht den Gläubigern jedoch nur zu, wenn sie glaubhaft machen, dass durch die Verschmelzung die Erfüllung der Forderung gefährdet wird."
    },
    {
      "date": "2024-10-16",
      "id": "90579",
      "original_text": "Einreichung neuer Dokumente\nSaarland Amtsgericht Saarbrücken HRB 75372\nitp GmbH – Völklingen",
      "type": "Einreichung neuer Dokumente",
      "state": "Saarland",
      "amtsgericht": "Amtsgericht Saarbrücken",
      "registernummer": "HRB 75372",
      "registerart": "HRB",
      "company_name": "itp GmbH",
      "company_seat": "Völklingen",
      "details": "16.10.2024 (Bekanntmachungsdatum)\n\nSaarland Amtsgericht Saarbrücken HRB 75372\nEinreichung neuer Dokumente 16.10.2024 (Eintragungsdatum)\n\nitp GmbH\nGesellschaft mit beschränkter Haftung\nVölklingen\n\nDie Geschäftsführung der Gesellschaft hat eine Liste der Mitglieder des Beirates zum Handelsregister eingereicht."
    },
    {
      "date": "2024-10-16",
      "id": "90564",
      "original_text": "Registerbekanntmachung nach dem Umwandlungsgesetz\nBayern Amtsgericht München HRB 174388\nmantro GmbH – München",
      "type": "Registerbekanntmachung nach dem Umwandlungsgesetz",
      "state": "Bayern",
      "amtsgericht": "Amtsgericht München",
      "registernummer": "HRB 174388",
      "registerart": "HRB",
      "company_name": "mantro GmbH",
      "company_seat": "München",
      "details": "16.10.2024 (Bekanntmachungsdatum)\n\nBayern Amtsgericht München HRB 174388\nRegisterbekanntmachung nach dem Umwandlungsgesetz 15.10.2024 (Eintragungsdatum)\n\nmantro GmbH\nGesellschaft mit beschränkter Haftung\nMünchen\n\nDen Gläubigern der an der Verschmelzung beteiligten Rechtsträger ist, wenn sie binnen sechs Monaten nach dem Tag, an dem die Eintragung der Verschmelzung in das Register des Sitzes desjenigen Rechtsträgers, dessen Gläubiger sie sind, nach § 19 Abs. 3 UmwG als bekannt gemacht gilt, ihren Anspruch nach Grund und Höhe schriftlich anmelden, Sicherheit zu leisten, soweit sie nicht Befriedigung verlangen können. Dieses Recht steht den Gläubigern jedoch nur zu, wenn sie glaubhaft machen, dass durch die Verschmelzung die Erfüllung ihrer Forderung gefährdet wird."
    },
    {
      "date": "2024-10-16",
      "id": "90553",
      "original_text": "Registerbekanntmachung nach dem Umwandlungsgesetz\nBayern Amtsgericht Nürnberg HRB 39877\nselbst-kreation 106/10 GmbH – Kammerstein",
      "type": "Registerbekanntmachung nach dem Umwandlungsgesetz",
      "state": "Bayern",
      "amtsgericht": "Amtsgericht Nürnberg",
      "registernummer": "HRB 39877",
      "registerart": "HRB",
      "company_name": "selbst-kreation 106/10 GmbH",
      "company_seat": "Kammerstein",
      "details": "16.10.2024 (Bekanntmachungsdatum)\n\nBayern Amtsgericht Nürnberg HRB 39877\nRegisterbekanntmachung nach dem Umwandlungsgesetz 15.10.2024 (Eintragungsdatum)\n\nselbst-kreation 106/10 GmbH\nGesellschaft mit beschränkter Haftung\nKammerstein\n\nDen Gläubigern der an der Verschmelzung beteiligten Rechtsträger ist, wenn sie binnen sechs Monaten nach dem Tag, an dem die Eintragung der Verschmelzung in das Register des Sitzes desjenigen Rechtsträgers, dessen Gläubiger sie sind, nach § 19 Abs. 3 UmwG als bekannt gemacht gilt, ihren Anspruch nach Grund und Höhe schriftlich anmelden, Sicherheit zu leisten, soweit sie nicht Befriedigung verlangen können. Dieses Recht steht den Gläubigern jedoch nur zu, wenn sie glaubhaft machen, dass durch die Verschmelzung die Erfüllung ihrer Forderung gefährdet wird."
    },
    {
      "date": "2024-10-16",
      "id": "90583",
      "original_text": "Registerbekanntmachung nach dem Umwandlungsgesetz\nBerlin Amtsgericht Berlin (Charlottenburg) HRB 268470\nvon Ey Architektur GmbH – Berlin",
      "type": "Registerbekanntmachung nach dem Umwandlungsgesetz",
      "state": "Berlin",
      "amtsgericht": "Amtsgericht Berlin (Charlottenburg)",
      "registernummer": "HRB 268470",
      "registerart": "HRB",
      "company_name": "von Ey Architektur GmbH",
      "company_seat": "Berlin",
      "details": "16.10.2024 (Bekanntmachungsdatum)\n\nBerlin Amtsgericht Berlin (Charlottenburg) HRB 268470\nRegisterbekanntmachung nach dem Umwandlungsgesetz 15.10.2024 (Eintragungsdatum)\n\nvon Ey Architektur GmbH\nGesellschaft mit beschränkter Haftung\nBerlin\n\nZu Eintragungsnummer 1 vom 15.10.2024 wird als nicht eingetragen veröffentlicht: Den Gläubigern ist, wenn sie binnen sechs Monaten nach dem Tag, an dem die Eintragung der Umwandlung als bekannt gemacht gilt, ihren Anspruch nach Grund und Höhe schriftlich anmelden, Sicherheit zu leisten, soweit sie nicht Befriedigung verlangen können. Dieses Recht steht den Gläubigern jedoch nur zu, wenn sie glaubhaft machen, dass durch die Umwandlung die Erfüllung ihrer Forderung gefährdet wird. Das Recht, Sicherheitsleistung zu verlangen, steht Gläubigern nicht zu, die im Falle der Insolvenz ein Recht auf vorzugsweise Befriedigung aus einer Deckungsmasse haben, die nach gesetzlicher Vorschrift zu ihrem Schutz errichtet und staatlich überwacht ist."
    },
    {
      "date": "2024-10-16",
      "id": "90615",
      "original_text": "Registerbekanntmachung nach dem Umwandlungsgesetz\nBaden-Württemberg Amtsgericht Ulm HRB 740530\nvon Richter & Lang Projekt GmbH – Rechberghausen",
      "type": "Registerbekanntmachung nach dem Umwandlungsgesetz",
      "state": "Baden-Württemberg",
      "amtsgericht": "Amtsgericht Ulm",
      "registernummer": "HRB 740530",
      "registerart": "HRB",
      "company_name": "von Richter & Lang Projekt GmbH",
      "company_seat": "Rechberghausen",
      "details": "16.10.2024 (Bekanntmachungsdatum)\n\nBaden-Württemberg Amtsgericht Ulm HRB 740530\nRegisterbekanntmachung nach dem Umwandlungsgesetz 16.10.2024 (Eintragungsdatum)\n\nvon Richter & Lang Projekt GmbH\nGesellschaft mit beschränkter Haftung\nRechberghausen\n\nDen Gläubigern der an der Verschmelzung beteiligten Rechtsträger ist, wenn sie binnen sechs Monaten nach dem Tag, an dem die Eintragung der Verschmelzung in das Register des Sitzes desjenigen Rechtsträgers, dessen Gläubiger sie sind, nach § 19 Abs. 3 UmwG als bekanntgemacht gilt, ihren Anspruch nach Grund und Höhe schriftlich anmelden, Sicherheit zu leisten, soweit sie nicht Befriedigung verlangen können. Dieses Recht steht den Gläubigern jedoch nur zu, wenn sie glaubhaft machen, dass durch die Verschmelzung die Erfüllung ihrer Forderung gefährdet wird."
    }
  ]
}