{
  "date": "2024-10-17",
  "date_of_scrape": "2024-11-28T08:21:36.001Z",
  "tool_version": "0.1.0",
  "number_of_announcements": 182,
  "announcements": [
    {
      "date": "2024-10-17",
      "original_text": "Sonstige Registerbekanntmachung\nBayern Amtsgericht Kempten (Allgäu) GnR 1125\nAKR eG – Biessenhofen",
      "type": "Sonstige Registerbekanntmachung",
      "state": "Bayern",
      "amtsgericht": "Amtsgericht Kempten (Allgäu)",
      "registernummer": "GnR 1125",
      "registerart": "GnR",
      "company_name": "AKR eG",
      "company_seat": "Biessenhofen",
      "details": "17.10.2024 (Bekanntmachungsdatum)\n\nBayern Amtsgericht Kempten (Allgäu) GnR 1125\nSonstige Registerbekanntmachung 16.10.2024 (Eintragungsdatum)\n\nAKR eG\neingetragene Genossenschaft\nBiessenhofen\n\nDen Gläubigern der Genossenschaft ist gemäß § 22 GenG, wenn sie sich binnen sechs Monaten nach der Bekanntmachung bei der Genossenschaft zu diesem Zweck melden, Sicherheit zu leisten, soweit sie nicht Befriedigung verlangen können.\n\nDie Generalversammlung vom 10.06.2024 hat die Änderung der Satzung beschlossen. Geändert wurde u.a. § 2 (Geschäftsanteil, Zahlungen, Rücklagen, Nachschüsse, Haftung, Rückvergütung,Verjährung, Mindestkapital).\n§ 2 Abs. 1 lautet neu wie folgt: Der Geschäftsanteil beträgt 10,00 €. Ein Geschäftsanteil ist Pflichtanteil. Er ist sofort in voller Höhe einzuzahlen. Einzahlungen auf weitere Geschäftsanteile als Sacheinlagen sind gem. § 7a GenG zulässig."
    },
    {
      "date": "2024-10-17",
      "original_text": "Registerbekanntmachung nach dem Umwandlungsgesetz\nBaden-Württemberg Amtsgericht Mannheim HRB 742011\nALEX & GROSS Sourcing GmbH – Mannheim",
      "type": "Registerbekanntmachung nach dem Umwandlungsgesetz",
      "state": "Baden-Württemberg",
      "amtsgericht": "Amtsgericht Mannheim",
      "registernummer": "HRB 742011",
      "registerart": "HRB",
      "company_name": "ALEX & GROSS Sourcing GmbH",
      "company_seat": "Mannheim",
      "details": "17.10.2024 (Bekanntmachungsdatum)\n\nBaden-Württemberg Amtsgericht Mannheim HRB 742011\nRegisterbekanntmachung nach dem Umwandlungsgesetz 17.10.2024 (Eintragungsdatum)\n\nALEX & GROSS Sourcing GmbH\nGesellschaft mit beschränkter Haftung\nMannheim\n\nAls nicht eingetragen wird bekanntgemacht:\nDen Gläubigern der an der Verschmelzung beteiligten Rechtsträger ist, wenn sie binnen sechs Monaten nach dem Tag, an dem die Eintragung der Verschmelzung in das Register des Sitzes desjenigen Rechtsträgers, dessen Gläubiger sie sind, nach § 19 Abs. 3 UmwG als bekanntgemacht gilt, ihren Anspruch nach Grund und Höhe schriftlich anmelden, Sicherheit zu leisten, soweit sie nicht Befriedigung verlangen können. Dieses Recht steht den Gläubigern jedoch nur zu, wenn sie glaubhaft machen, dass durch die Verschmelzung die Erfüllung ihrer Forderung gefährdet wird."
    },
    {
      "date": "2024-10-17",
      "original_text": "Löschungsankündigung\nBayern Amtsgericht München HRB 254375\nALKOS GmbH – München",
      "type": "Löschungsankündigung",
      "state": "Bayern",
      "amtsgericht": "Amtsgericht München",
      "registernummer": "HRB 254375",
      "registerart": "HRB",
      "company_name": "ALKOS GmbH",
      "company_seat": "München",
      "details": "17.10.2024 (Bekanntmachungsdatum)\n\nBayern Amtsgericht München HRB 254375\nLöschungsankündigung 16.10.2024 (Eintragungsdatum)\n\nALKOS GmbH\nGesellschaft mit beschränkter Haftung\nMünchen\n\nDas Registergericht beabsichtigt, die im Handelsregister eingetragene Gesellschaft wegen Vermögenslosigkeit von Amts wegen nach § 394 FamFG zu löschen. Die Frist zur Erhebung eines Widerspruchs ist auf drei Monate festgesetzt."
    },
    {
      "date": "2024-10-17",
      "original_text": "Registerbekanntmachung nach dem Umwandlungsgesetz\nBerlin Amtsgericht Berlin (Charlottenburg) HRB 209607\nAMBOSS GmbH – Berlin",
      "type": "Registerbekanntmachung nach dem Umwandlungsgesetz",
      "state": "Berlin",
      "amtsgericht": "Amtsgericht Berlin (Charlottenburg)",
      "registernummer": "HRB 209607",
      "registerart": "HRB",
      "company_name": "AMBOSS GmbH",
      "company_seat": "Berlin",
      "details": "17.10.2024 (Bekanntmachungsdatum)\n\nBerlin Amtsgericht Berlin (Charlottenburg) HRB 209607\nRegisterbekanntmachung nach dem Umwandlungsgesetz\n\nAMBOSS GmbH\nGesellschaft mit beschränkter Haftung\nBerlin\n\nZu Eintragungsnummer  vom  wird als nicht eingetragen veröffentlicht: Die Gesellschaft soll im Wege des Kettenformwechsels in eine Aktiengesellschaft nach deutschem Recht und im unmittelbaren Anschluss hieran in eine Europäische Gesellschaft (SE) umgewandelt werden. Hierzu hat die Gesellschaft gemäß Art. 37 Abs. 5 SE-VO den Entwurf eines Umwandlungsplans zum Handelsregister des Amtsgerichts Charlottenburg, HRB 209607 B, eingereicht."
    },
    {
      "date": "2024-10-17",
      "original_text": "Registerbekanntmachung nach dem Umwandlungsgesetz\nNiedersachsen Amtsgericht Oldenburg (Oldenburg) HRB 140370 früher Amtsgericht Delmenhorst\nAMORIM Deutschland GmbH – Delmenhorst",
      "type": "Registerbekanntmachung nach dem Umwandlungsgesetz",
      "state": "Niedersachsen",
      "amtsgericht": "Amtsgericht Oldenburg (Oldenburg)",
      "registernummer": "HRB 140370",
      "registerart": "HRB",
      "company_name": "AMORIM Deutschland GmbH",
      "company_seat": "Delmenhorst",
      "former_amtsgericht": "Delmenhorst",
      "details": "17.10.2024 (Bekanntmachungsdatum)\n\nNiedersachsen Amtsgericht Oldenburg (Oldenburg) HRB 140370 früher Amtsgericht Delmenhorst\nRegisterbekanntmachung nach dem Umwandlungsgesetz 17.10.2024 (Eintragungsdatum)\n\nAMORIM Deutschland GmbH\nGesellschaft mit beschränkter Haftung\nDelmenhorst\n\nDen Gläubigern der an der Verschmelzung beteiligten Rechtsträger ist, wenn sie binnen sechs Monaten nach dem Tag, an dem die Eintragung der Verschmelzung in das Register des Sitzes desjenigen Rechtsträgers, dessen Gläubiger sie sind, nach § 19  Abs.  3 UmwG als bekannt gemacht gilt, ihren Anspruch nach Grund und Höhe schriftlich anmelden, Sicherheit zu leisten, soweit sie nicht Befriedigung verlangen können. Dieses Recht steht den Gläubigern jedoch nur zu, wenn sie glaubhaft machen, dass durch die Verschmelzung die Erfüllung der Forderung gefährdet wird."
    },
    {
      "date": "2024-10-17",
      "original_text": "Registerbekanntmachung nach dem Umwandlungsgesetz\nBaden-Württemberg Amtsgericht Stuttgart HRB 789531\nAPEX NDNE HOLDING GmbH – Stuttgart",
      "type": "Registerbekanntmachung nach dem Umwandlungsgesetz",
      "state": "Baden-Württemberg",
      "amtsgericht": "Amtsgericht Stuttgart",
      "registernummer": "HRB 789531",
      "registerart": "HRB",
      "company_name": "APEX NDNE HOLDING GmbH",
      "company_seat": "Stuttgart",
      "details": "17.10.2024 (Bekanntmachungsdatum)\n\nBaden-Württemberg Amtsgericht Stuttgart HRB 789531\nRegisterbekanntmachung nach dem Umwandlungsgesetz 17.10.2024 (Eintragungsdatum)\n\nAPEX NDNE HOLDING GmbH\nGesellschaft mit beschränkter Haftung\nStuttgart\n\nAls nicht eingetragen wird bekanntgemacht:\nDen Gläubigern der an der Verschmelzung beteiligten Rechtsträger ist, wenn sie binnen sechs Monaten nach dem Tag, an dem die Eintragung der Verschmelzung in das Register des Sitzes desjenigen Rechtsträgers, dessen Gläubiger sie sind, nach § 19 Abs. 3 UmwG als bekanntgemacht gilt, ihren Anspruch nach Grund und Höhe schriftlich anmelden, Sicherheit zu leisten, soweit sie nicht Befriedigung verlangen können. Dieses Recht steht den Gläubigern jedoch nur zu, wenn sie glaubhaft machen, dass durch die Verschmelzung die Erfüllung ihrer Forderung gefährdet wird."
    },
    {
      "date": "2024-10-17",
      "original_text": "Registerbekanntmachung nach dem Umwandlungsgesetz\nNordrhein-Westfalen Amtsgericht Köln HRB 76842\nAPZ Altenpflegezentrum GmbH – Köln",
      "type": "Registerbekanntmachung nach dem Umwandlungsgesetz",
      "state": "Nordrhein-Westfalen",
      "amtsgericht": "Amtsgericht Köln",
      "registernummer": "HRB 76842",
      "registerart": "HRB",
      "company_name": "APZ Altenpflegezentrum GmbH",
      "company_seat": "Köln",
      "details": "17.10.2024 (Bekanntmachungsdatum)\n\nNordrhein-Westfalen Amtsgericht Köln HRB 76842\nRegisterbekanntmachung nach dem Umwandlungsgesetz 17.10.2024 (Eintragungsdatum)\n\nAPZ Altenpflegezentrum GmbH\nGesellschaft mit beschränkter Haftung\nKöln\n\nDen Gläubigern der an der Verschmelzung beteiligten Rechtsträger ist, wenn sie binnen sechs Monaten nach dem Tag, an dem die Eintragung der Verschmelzung in das Register des Sitzes desjenigen Rechtsträgers, dessen Gläubiger sie sind, nach § 19 Absatz 3 UmwG als bekanntgemacht gilt, ihren Anspruch nach Grund und Höhe schriftlich anmelden, Sicherheit zu leisten, soweit sie nicht Befriedigung verlangen können. Dieses Recht steht den Gläubigern jedoch nur zu, wenn sie glaubhaft machen, dass durch die Verschmelzung die Erfüllung ihrer Forderung gefährdet wird."
    },
    {
      "date": "2024-10-17",
      "original_text": "Registerbekanntmachung nach dem Umwandlungsgesetz\nNordrhein-Westfalen Amtsgericht Köln HRB 672\nAXA Konzern Aktiengesellschaft – Köln",
      "type": "Registerbekanntmachung nach dem Umwandlungsgesetz",
      "state": "Nordrhein-Westfalen",
      "amtsgericht": "Amtsgericht Köln",
      "registernummer": "HRB 672",
      "registerart": "HRB",
      "company_name": "AXA Konzern Aktiengesellschaft",
      "company_seat": "Köln",
      "details": "17.10.2024 (Bekanntmachungsdatum)\n\nNordrhein-Westfalen Amtsgericht Köln HRB 672\nRegisterbekanntmachung nach dem Umwandlungsgesetz 17.10.2024 (Eintragungsdatum)\n\nAXA Konzern Aktiengesellschaft\nAktiengesellschaft\nKöln\n\nDen Gläubigern der an der Abspaltung beteiligten Rechtsträger ist, wenn sie binnen sechs Monaten nach dem Tag, an dem die Eintragung der Abspaltung in das Register des Sitzes desjenigen Rechtsträgers, dessen Gläubiger sie sind, nach § 19 Absatz 3 UmwG als bekanntgemacht gilt, ihren Anspruch nach Grund und Höhe schriftlich anmelden, Sicherheit zu leisten, soweit sie nicht Befriedigung verlangen können. Dieses Recht steht den Gläubigern jedoch nur zu, wenn sie glaubhaft machen, dass durch die Abspaltung die Erfüllung ihrer Forderung gefährdet wird."
    },
    {
      "date": "2024-10-17",
      "original_text": "Registerbekanntmachung nach dem Umwandlungsgesetz\nNordrhein-Westfalen Amtsgericht Köln HRB 271\nAXA Lebensversicherung Aktiengesellschaft – Köln",
      "type": "Registerbekanntmachung nach dem Umwandlungsgesetz",
      "state": "Nordrhein-Westfalen",
      "amtsgericht": "Amtsgericht Köln",
      "registernummer": "HRB 271",
      "registerart": "HRB",
      "company_name": "AXA Lebensversicherung Aktiengesellschaft",
      "company_seat": "Köln",
      "details": "17.10.2024 (Bekanntmachungsdatum)\n\nNordrhein-Westfalen Amtsgericht Köln HRB 271\nRegisterbekanntmachung nach dem Umwandlungsgesetz 17.10.2024 (Eintragungsdatum)\n\nAXA Lebensversicherung Aktiengesellschaft\nAktiengesellschaft\nKöln\n\nDen Gläubigern der an der Abspaltung beteiligten Rechtsträger ist, wenn sie binnen sechs Monaten nach dem Tag, an dem die Eintragung der Abspaltung in das Register des Sitzes desjenigen Rechtsträgers, dessen Gläubiger sie sind, nach § 19 Absatz 3 UmwG als bekanntgemacht gilt, ihren Anspruch nach Grund und Höhe schriftlich anmelden, Sicherheit zu leisten, soweit sie nicht Befriedigung verlangen können. Dieses Recht steht den Gläubigern jedoch nur zu, wenn sie glaubhaft machen, dass durch die Abspaltung die Erfüllung ihrer Forderung gefährdet wird."
    },
    {
      "date": "2024-10-17",
      "original_text": "Registerbekanntmachung nach dem Umwandlungsgesetz\nBerlin Amtsgericht Berlin (Charlottenburg) HRB 168861\nAZH Holding GmbH – Berlin",
      "type": "Registerbekanntmachung nach dem Umwandlungsgesetz",
      "state": "Berlin",
      "amtsgericht": "Amtsgericht Berlin (Charlottenburg)",
      "registernummer": "HRB 168861",
      "registerart": "HRB",
      "company_name": "AZH Holding GmbH",
      "company_seat": "Berlin",
      "details": "17.10.2024 (Bekanntmachungsdatum)\n\nBerlin Amtsgericht Berlin (Charlottenburg) HRB 168861\nRegisterbekanntmachung nach dem Umwandlungsgesetz 17.10.2024 (Eintragungsdatum)\n\nAZH Holding GmbH\nGesellschaft mit beschränkter Haftung\nBerlin\n\nZu Eintragungsnummer 5 vom 17.10.2024 wird als nicht eingetragen veröffentlicht: Den Gläubigern der an der Verschmelzung beteiligten Rechtsträger ist, wenn sie binnen sechs Monaten nach dem Tag, an dem die Eintragung der Verschmelzung in das Register des Sitzes desjenigen Rechtsträgers, dessen Gläubiger sie sind, als bekannt gemacht gilt, ihren Anspruch nach Grund und Höhe schriftlich anmelden, Sicherheit zu leisten, soweit sie nicht Befriedigung verlangen können. Dieses Recht steht den Gläubigern jedoch nur zu, wenn sie glaubhaft machen, dass durch die Verschmelzung die Erfüllung ihrer Forderung gefährdet wird. Das Recht, Sicherheitsleistung zu verlangen, steht Gläubigern nicht zu, die im Falle der Insolvenz ein Recht auf vorzugsweise Befriedigung aus einer Deckungsmasse haben, die nach gesetzlicher Vorschrift zu ihrem Schutz errichtet und staatlich überwacht ist."
    },
    {
      "date": "2024-10-17",
      "original_text": "Registerbekanntmachung nach dem Umwandlungsgesetz\nBerlin Amtsgericht Berlin (Charlottenburg) HRB 168861\nAZH Holding GmbH – Berlin",
      "type": "Registerbekanntmachung nach dem Umwandlungsgesetz",
      "state": "Berlin",
      "amtsgericht": "Amtsgericht Berlin (Charlottenburg)",
      "registernummer": "HRB 168861",
      "registerart": "HRB",
      "company_name": "AZH Holding GmbH",
      "company_seat": "Berlin",
      "details": "17.10.2024 (Bekanntmachungsdatum)\n\nBerlin Amtsgericht Berlin (Charlottenburg) HRB 168861\nRegisterbekanntmachung nach dem Umwandlungsgesetz 17.10.2024 (Eintragungsdatum)\n\nAZH Holding GmbH\nGesellschaft mit beschränkter Haftung\nBerlin\n\nZu Eintragungsnummer 6 vom 17.10.2024 wird als nicht eingetragen veröffentlicht: Den Gläubigern der an der Verschmelzung beteiligten Rechtsträger ist, wenn sie binnen sechs Monaten nach dem Tag, an dem die Eintragung der Verschmelzung in das Register des Sitzes desjenigen Rechtsträgers, dessen Gläubiger sie sind, als bekannt gemacht gilt, ihren Anspruch nach Grund und Höhe schriftlich anmelden, Sicherheit zu leisten, soweit sie nicht Befriedigung verlangen können. Dieses Recht steht den Gläubigern jedoch nur zu, wenn sie glaubhaft machen, dass durch die Verschmelzung die Erfüllung ihrer Forderung gefährdet wird. Das Recht, Sicherheitsleistung zu verlangen, steht Gläubigern nicht zu, die im Falle der Insolvenz ein Recht auf vorzugsweise Befriedigung aus einer Deckungsmasse haben, die nach gesetzlicher Vorschrift zu ihrem Schutz errichtet und staatlich überwacht ist."
    },
    {
      "date": "2024-10-17",
      "original_text": "Registerbekanntmachung nach dem Umwandlungsgesetz\nBerlin Amtsgericht Berlin (Charlottenburg) HRB 168941\nAZH Meerane GmbH – Berlin",
      "type": "Registerbekanntmachung nach dem Umwandlungsgesetz",
      "state": "Berlin",
      "amtsgericht": "Amtsgericht Berlin (Charlottenburg)",
      "registernummer": "HRB 168941",
      "registerart": "HRB",
      "company_name": "AZH Meerane GmbH",
      "company_seat": "Berlin",
      "details": "17.10.2024 (Bekanntmachungsdatum)\n\nBerlin Amtsgericht Berlin (Charlottenburg) HRB 168941\nRegisterbekanntmachung nach dem Umwandlungsgesetz 17.10.2024 (Eintragungsdatum)\n\nAZH Meerane GmbH\nGesellschaft mit beschränkter Haftung\nBerlin\n\nZu Eintragungsnummer 4 vom 17.10.2024 wird als nicht eingetragen veröffentlicht: Den Gläubigern der an der Verschmelzung beteiligten Rechtsträger ist, wenn sie binnen sechs Monaten nach dem Tag, an dem die Eintragung der Verschmelzung in das Register des Sitzes desjenigen Rechtsträgers, dessen Gläubiger sie sind, als bekannt gemacht gilt, ihren Anspruch nach Grund und Höhe schriftlich anmelden, Sicherheit zu leisten, soweit sie nicht Befriedigung verlangen können. Dieses Recht steht den Gläubigern jedoch nur zu, wenn sie glaubhaft machen, dass durch die Verschmelzung die Erfüllung ihrer Forderung gefährdet wird. Das Recht, Sicherheitsleistung zu verlangen, steht Gläubigern nicht zu, die im Falle der Insolvenz ein Recht auf vorzugsweise Befriedigung aus einer Deckungsmasse haben, die nach gesetzlicher Vorschrift zu ihrem Schutz errichtet und staatlich überwacht ist."
    },
    {
      "date": "2024-10-17",
      "original_text": "Registerbekanntmachung nach dem Umwandlungsgesetz\nBerlin Amtsgericht Berlin (Charlottenburg) HRB 168943\nAZH Zwickau Land GmbH – Berlin",
      "type": "Registerbekanntmachung nach dem Umwandlungsgesetz",
      "state": "Berlin",
      "amtsgericht": "Amtsgericht Berlin (Charlottenburg)",
      "registernummer": "HRB 168943",
      "registerart": "HRB",
      "company_name": "AZH Zwickau Land GmbH",
      "company_seat": "Berlin",
      "details": "17.10.2024 (Bekanntmachungsdatum)\n\nBerlin Amtsgericht Berlin (Charlottenburg) HRB 168943\nRegisterbekanntmachung nach dem Umwandlungsgesetz 17.10.2024 (Eintragungsdatum)\n\nAZH Zwickau Land GmbH\nGesellschaft mit beschränkter Haftung\nBerlin\n\nZu Eintragungsnummer 4 vom 17.10.2024 wird als nicht eingetragen veröffentlicht: Den Gläubigern der an der Verschmelzung beteiligten Rechtsträger ist, wenn sie binnen sechs Monaten nach dem Tag, an dem die Eintragung der Verschmelzung in das Register des Sitzes desjenigen Rechtsträgers, dessen Gläubiger sie sind, als bekannt gemacht gilt, ihren Anspruch nach Grund und Höhe schriftlich anmelden, Sicherheit zu leisten, soweit sie nicht Befriedigung verlangen können. Dieses Recht steht den Gläubigern jedoch nur zu, wenn sie glaubhaft machen, dass durch die Verschmelzung die Erfüllung ihrer Forderung gefährdet wird. Das Recht, Sicherheitsleistung zu verlangen, steht Gläubigern nicht zu, die im Falle der Insolvenz ein Recht auf vorzugsweise Befriedigung aus einer Deckungsmasse haben, die nach gesetzlicher Vorschrift zu ihrem Schutz errichtet und staatlich überwacht ist."
    },
    {
      "date": "2024-10-17",
      "original_text": "Löschungsankündigung\nNordrhein-Westfalen Amtsgericht Dortmund HRB 24193\nAdler Logistik GmbH – Castrop-Rauxel",
      "type": "Löschungsankündigung",
      "state": "Nordrhein-Westfalen",
      "amtsgericht": "Amtsgericht Dortmund",
      "registernummer": "HRB 24193",
      "registerart": "HRB",
      "company_name": "Adler Logistik GmbH",
      "company_seat": "Castrop-Rauxel",
      "details": "17.10.2024 (Bekanntmachungsdatum)\n\nNordrhein-Westfalen Amtsgericht Dortmund HRB 24193\nLöschungsankündigung\n\nAdler Logistik GmbH\nGesellschaft mit beschränkter Haftung\nCastrop-Rauxel\n\nDas Registergericht beabsichtigt die Gesellschaft von Amts wegen nach § 394 FamFG zu löschen. Die Frist zur Erhebung eines Widerspruchs ist auf zwei Monate festgesetzt."
    },
    {
      "date": "2024-10-17",
      "original_text": "Registerbekanntmachung nach dem Umwandlungsgesetz\nSachsen-Anhalt Amtsgericht Stendal GnR 134\nAgrargenossenschaft Engersen eG – Kalbe (Milde)",
      "type": "Registerbekanntmachung nach dem Umwandlungsgesetz",
      "state": "Sachsen-Anhalt",
      "amtsgericht": "Amtsgericht Stendal",
      "registernummer": "GnR 134",
      "registerart": "GnR",
      "company_name": "Agrargenossenschaft Engersen eG",
      "company_seat": "Kalbe (Milde)",
      "details": "17.10.2024 (Bekanntmachungsdatum)\n\nSachsen-Anhalt Amtsgericht Stendal GnR 134\nRegisterbekanntmachung nach dem Umwandlungsgesetz 17.10.2024 (Eintragungsdatum)\n\nAgrargenossenschaft Engersen eG\neingetragene Genossenschaft\nKalbe (Milde)\n\nNicht eingetragen:\nDen Gläubigern der an der Verschmelzung beteiligten Rechtsträger ist, wenn sie binnen sechs Monaten nach dem Tag, an dem die Eintragung der Verschmelzung nach § 19 Abs. 3 UmwG als bekanntgemacht gilt, ihren Anspruch nach Grund und Höhe schriftlich anmelden, Sicherheit zu leisten, soweit sie nicht Befriedigung verlangen können. Dieses Recht steht ihnen jedoch nur zu, wenn sie glaubhaft machen, dass durch die Verschmelzung die Erfüllung ihrer Forderung gefährdet wird."
    },
    {
      "date": "2024-10-17",
      "original_text": "Registerbekanntmachung nach dem Umwandlungsgesetz\nSachsen-Anhalt Amtsgericht Stendal GnR 42\nAgrarproduktion GEMIZU eG Kremkau – Kremkau",
      "type": "Registerbekanntmachung nach dem Umwandlungsgesetz",
      "state": "Sachsen-Anhalt",
      "amtsgericht": "Amtsgericht Stendal",
      "registernummer": "GnR 42",
      "registerart": "GnR",
      "company_name": "Agrarproduktion GEMIZU eG Kremkau",
      "company_seat": "Kremkau",
      "details": "17.10.2024 (Bekanntmachungsdatum)\n\nSachsen-Anhalt Amtsgericht Stendal GnR 42\nRegisterbekanntmachung nach dem Umwandlungsgesetz 17.10.2024 (Eintragungsdatum)\n\nAgrarproduktion GEMIZU eG Kremkau\neingetragene Genossenschaft\nKremkau\n\nNicht eingetragen:\nDen Gläubigern der an der Verschmelzung beteiligten Rechtsträger ist, wenn sie binnen sechs Monaten nach dem Tag, an dem die Eintragung der Verschmelzung nach § 19 Abs. 3 UmwG als bekanntgemacht gilt, ihren Anspruch nach Grund und Höhe schriftlich anmelden, Sicherheit zu leisten, soweit sie nicht Befriedigung verlangen können. Dieses Recht steht ihnen jedoch nur zu, wenn sie glaubhaft machen, dass durch die Verschmelzung die Erfüllung ihrer Forderung gefährdet wird."
    },
    {
      "date": "2024-10-17",
      "original_text": "Registerbekanntmachung nach dem Umwandlungsgesetz\nBaden-Württemberg Amtsgericht Mannheim HRB 422268\nAlex & Gross Inside Sales GmbH – Mannheim",
      "type": "Registerbekanntmachung nach dem Umwandlungsgesetz",
      "state": "Baden-Württemberg",
      "amtsgericht": "Amtsgericht Mannheim",
      "registernummer": "HRB 422268",
      "registerart": "HRB",
      "company_name": "Alex & Gross Inside Sales GmbH",
      "company_seat": "Mannheim",
      "details": "17.10.2024 (Bekanntmachungsdatum)\n\nBaden-Württemberg Amtsgericht Mannheim HRB 422268\nRegisterbekanntmachung nach dem Umwandlungsgesetz 17.10.2024 (Eintragungsdatum)\n\nAlex & Gross Inside Sales GmbH\nGesellschaft mit beschränkter Haftung\nMannheim\n\nAls nicht eingetragen wird bekanntgemacht: Den Gläubigern der an der Verschmelzung beteiligten Rechtsträger ist, wenn sie binnen sechs Monaten nach dem Tag, an dem die Eintragung der Verschmelzung in das Register des Sitzes desjenigen Rechtsträgers, dessen Gläubiger sie sind, nach § 19 Abs. 3 UmwG als bekanntgemacht gilt, ihren Anspruch nach Grund und Höhe schriftlich anmelden, Sicherheit zu leisten, soweit sie nicht Befriedigung verlangen können. Dieses Recht steht den Gläubigern jedoch nur zu, wenn sie glaubhaft machen, dass durch die Verschmelzung die Erfüllung ihrer Forderung gefährdet wird."
    },
    {
      "date": "2024-10-17",
      "original_text": "Löschungsankündigung\nBayern Amtsgericht München HRB 190308\nAnda Technologies GmbH – München",
      "type": "Löschungsankündigung",
      "state": "Bayern",
      "amtsgericht": "Amtsgericht München",
      "registernummer": "HRB 190308",
      "registerart": "HRB",
      "company_name": "Anda Technologies GmbH",
      "company_seat": "München",
      "details": "17.10.2024 (Bekanntmachungsdatum)\n\nBayern Amtsgericht München HRB 190308\nLöschungsankündigung 16.10.2024 (Eintragungsdatum)\n\nAnda Technologies GmbH\nGesellschaft mit beschränkter Haftung\nMünchen\n\nDas Registergericht beabsichtigt, die im Handelsregister eingetragene Gesellschaft wegen Vermögenslosigkeit von Amts wegen nach § 394 FamFG zu löschen. Die Frist zur Erhebung eines Widerspruchs ist auf drei Monate festgesetzt."
    },
    {
      "date": "2024-10-17",
      "original_text": "Löschungsankündigung\nBrandenburg Amtsgericht Potsdam HRB 36446\nAtlas Bau UG (haftungsbeschränkt) – Zossen",
      "type": "Löschungsankündigung",
      "state": "Brandenburg",
      "amtsgericht": "Amtsgericht Potsdam",
      "registernummer": "HRB 36446",
      "registerart": "HRB",
      "company_name": "Atlas Bau UG (haftungsbeschränkt)",
      "company_seat": "Zossen",
      "details": "17.10.2024 (Bekanntmachungsdatum)\n\nBrandenburg Amtsgericht Potsdam HRB 36446\nLöschungsankündigung\n\nAtlas Bau UG (haftungsbeschränkt)\nGesellschaft mit beschränkter Haftung\nZossen\n\nBei der nachstehenden Gesellschaft wird das Amtslöschungsverfahren gemäß § 394 FamFG eingeleitet. Widerspruchsfrist: 8 Wochen"
    },
    {
      "date": "2024-10-17",
      "original_text": "Registerbekanntmachung nach dem Umwandlungsgesetz\nBaden-Württemberg Amtsgericht Ulm HRB 641725\nAutoCenter Benz GmbH – Laupheim",
      "type": "Registerbekanntmachung nach dem Umwandlungsgesetz",
      "state": "Baden-Württemberg",
      "amtsgericht": "Amtsgericht Ulm",
      "registernummer": "HRB 641725",
      "registerart": "HRB",
      "company_name": "AutoCenter Benz GmbH",
      "company_seat": "Laupheim",
      "details": "17.10.2024 (Bekanntmachungsdatum)\n\nBaden-Württemberg Amtsgericht Ulm HRB 641725\nRegisterbekanntmachung nach dem Umwandlungsgesetz 17.10.2024 (Eintragungsdatum)\n\nAutoCenter Benz GmbH\nGesellschaft mit beschränkter Haftung\nLaupheim\n\nAls nicht eingetragen wird bekanntgemacht:\nDen Gläubigern der an der Verschmelzung beteiligten Rechtsträger ist, wenn sie binnen sechs Monaten nach dem Tag, an dem die Eintragung der Verschmelzung in das Register des Sitzes desjenigen Rechtsträgers, dessen Gläubiger sie sind, nach § 19 Abs. 3 UmwG als bekanntgemacht gilt, ihren Anspruch nach Grund und Höhe schriftlich anmelden, Sicherheit zu leisten, soweit sie nicht Befriedigung verlangen können. Dieses Recht steht den Gläubigern jedoch nur zu, wenn sie glaubhaft machen, dass durch die Verschmelzung die Erfüllung ihrer Forderung gefährdet wird."
    },
    {
      "date": "2024-10-17",
      "original_text": "Registerbekanntmachung nach dem Umwandlungsgesetz\nBaden-Württemberg Amtsgericht Ulm HRB 640315\nAutohaus Ströbele GmbH – Ochsenhausen",
      "type": "Registerbekanntmachung nach dem Umwandlungsgesetz",
      "state": "Baden-Württemberg",
      "amtsgericht": "Amtsgericht Ulm",
      "registernummer": "HRB 640315",
      "registerart": "HRB",
      "company_name": "Autohaus Ströbele GmbH",
      "company_seat": "Ochsenhausen",
      "details": "17.10.2024 (Bekanntmachungsdatum)\n\nBaden-Württemberg Amtsgericht Ulm HRB 640315\nRegisterbekanntmachung nach dem Umwandlungsgesetz 17.10.2024 (Eintragungsdatum)\n\nAutohaus Ströbele GmbH\nGesellschaft mit beschränkter Haftung\nOchsenhausen\n\nAls nicht eingetragen wird bekanntgemacht:\nDen Gläubigern der an der Verschmelzung beteiligten Rechtsträger ist, wenn sie binnen sechs Monaten nach dem Tag, an dem die Eintragung der Verschmelzung in das Register des Sitzes desjenigen Rechtsträgers, dessen Gläubiger sie sind, nach § 19 Abs. 3 UmwG als bekanntgemacht gilt, ihren Anspruch nach Grund und Höhe schriftlich anmelden, Sicherheit zu leisten, soweit sie nicht Befriedigung verlangen können. Dieses Recht steht den Gläubigern jedoch nur zu, wenn sie glaubhaft machen, dass durch die Verschmelzung die Erfüllung ihrer Forderung gefährdet wird."
    },
    {
      "date": "2024-10-17",
      "original_text": "Registerbekanntmachung nach dem Umwandlungsgesetz\nSchleswig-Holstein Amtsgericht Pinneberg HRB 8067\nB + R Bauen und Renovieren GmbH – Halstenbek",
      "type": "Registerbekanntmachung nach dem Umwandlungsgesetz",
      "state": "Schleswig-Holstein",
      "amtsgericht": "Amtsgericht Pinneberg",
      "registernummer": "HRB 8067",
      "registerart": "HRB",
      "company_name": "B + R Bauen und Renovieren GmbH",
      "company_seat": "Halstenbek",
      "details": "17.10.2024 (Bekanntmachungsdatum)\n\nSchleswig-Holstein Amtsgericht Pinneberg HRB 8067\nRegisterbekanntmachung nach dem Umwandlungsgesetz 15.10.2024 (Eintragungsdatum)\n\nB + R Bauen und Renovieren GmbH\nGesellschaft mit beschränkter Haftung\nHalstenbek\n\nZu Eintragungsnummer 6 vom 15.10.2024 wird als nicht eingetragen veröffentlicht: Als nicht eingetragen wird veröffentlicht: Den Gläubigern der an der Verschmelzung beteiligten Rechtsträger ist, wenn sie binnen sechs Monaten nach dem Tag, an dem die Eintragung der Verschmelzung in das Register des Sitzes desjenigen Rechtsträgers, dessen Gläubiger sie sind, als bekannt gemacht gilt, ihren Anspruch nach Grund und Höhe schriftlich anmelden, Sicherheit zu leisten, soweit sie nicht Befriedigung verlangen können. Dieses Recht steht den Gläubigern jedoch nur zu, wenn sie glaubhaft machen, dass durch die Verschmelzung die Erfüllung ihrer Forderung gefährdet wird. Das Recht, Sicherheitsleistung zu verlangen, steht Gläubigern nicht zu, die im Falle der Insolvenz ein Recht auf vorzugsweise Befriedigung aus einer Deckungsmasse haben, die nach gesetzlicher Vorschrift zu ihrem Schutz errichtet und staatlich überwacht ist."
    },
    {
      "date": "2024-10-17",
      "original_text": "Registerbekanntmachung nach dem Umwandlungsgesetz\nHessen Amtsgericht Fritzlar HRB 11312\nB.Braun Medical Aktiengesellschaft – Melsungen",
      "type": "Registerbekanntmachung nach dem Umwandlungsgesetz",
      "state": "Hessen",
      "amtsgericht": "Amtsgericht Fritzlar",
      "registernummer": "HRB 11312",
      "registerart": "HRB",
      "company_name": "B.Braun Medical Aktiengesellschaft",
      "company_seat": "Melsungen",
      "details": "17.10.2024 (Bekanntmachungsdatum)\n\nHessen Amtsgericht Fritzlar HRB 11312\nRegisterbekanntmachung nach dem Umwandlungsgesetz 17.10.2024 (Eintragungsdatum)\n\nB.Braun Medical Aktiengesellschaft\nAktiengesellschaft\nMelsungen\n\nDie Gesellschaft hat den Entwurf des Verschmelzungsvertrages zwischen ihr und der GELIMER Verwaltungsgesellschaft mbH, Melsungen (Amtsgericht Fritzlar HRB 12836) beim Amtsgericht Fritzlar (Registergericht) zur Einsichtnahme eingereicht."
    },
    {
      "date": "2024-10-17",
      "original_text": "Registerbekanntmachung nach dem Umwandlungsgesetz\nNordrhein-Westfalen Amtsgericht Köln HRB 120829\nBAUART Projekte GmbH – Bergneustadt",
      "type": "Registerbekanntmachung nach dem Umwandlungsgesetz",
      "state": "Nordrhein-Westfalen",
      "amtsgericht": "Amtsgericht Köln",
      "registernummer": "HRB 120829",
      "registerart": "HRB",
      "company_name": "BAUART Projekte GmbH",
      "company_seat": "Bergneustadt",
      "details": "17.10.2024 (Bekanntmachungsdatum)\n\nNordrhein-Westfalen Amtsgericht Köln HRB 120829\nRegisterbekanntmachung nach dem Umwandlungsgesetz 17.10.2024 (Eintragungsdatum)\n\nBAUART Projekte GmbH\nGesellschaft mit beschränkter Haftung\nBergneustadt\n\nDen Gläubigern der an der formwechselnden Umwandlung beteiligten Rechtsträger ist, wenn sie binnen sechs Monaten nach dem Tag, an dem die Eintragung der formwechselnden Umwandlung in das Register des Sitzes desjenigen Rechtsträgers, dessen Gläubiger sie sind, nach § 19 Absatz 3 UmwG als bekanntgemacht gilt, ihren Anspruch nach Grund und Höhe schriftlich anmelden, Sicherheit zu leisten, soweit sie nicht Befriedigung verlangen können. Dieses Recht steht den Gläubigern jedoch nur zu, wenn sie glaubhaft machen, dass durch die formwechselnden Umwandlung die Erfüllung ihrer Forderung gefährdet wird."
    },
    {
      "date": "2024-10-17",
      "original_text": "Löschungsankündigung\nMecklenburg-Vorpommern Amtsgericht Rostock HRB 15067\nBDMV-Bau Dienstleistungen MV UG (haftungsbeschränkt) – Rostock",
      "type": "Löschungsankündigung",
      "state": "Mecklenburg-Vorpommern",
      "amtsgericht": "Amtsgericht Rostock",
      "registernummer": "HRB 15067",
      "registerart": "HRB",
      "company_name": "BDMV-Bau Dienstleistungen MV UG (haftungsbeschränkt)",
      "company_seat": "Rostock",
      "details": "17.10.2024 (Bekanntmachungsdatum)\n\nMecklenburg-Vorpommern Amtsgericht Rostock HRB 15067\nLöschungsankündigung\n\nBDMV-Bau Dienstleistungen MV UG (haftungsbeschränkt)\nGesellschaft mit beschränkter Haftung\nRostock\n\nDas Registergericht beabsichtigt, die im Handelsregister eingetragene Gesellschaft von Amts wegen nach § 394 FamFG zu löschen. Die Frist zur Erhebung eines Widerspruchs gegen die beabsichtigte Löschung wird auf einen Monat festgesetzt."
    },
    {
      "date": "2024-10-17",
      "original_text": "Löschungsankündigung\nNiedersachsen Amtsgericht Braunschweig HRB 201495\nBES AB GmbH – Cremlingen",
      "type": "Löschungsankündigung",
      "state": "Niedersachsen",
      "amtsgericht": "Amtsgericht Braunschweig",
      "registernummer": "HRB 201495",
      "registerart": "HRB",
      "company_name": "BES AB GmbH",
      "company_seat": "Cremlingen",
      "details": "17.10.2024 (Bekanntmachungsdatum)\n\nNiedersachsen Amtsgericht Braunschweig HRB 201495\nLöschungsankündigung 17.10.2024 (Eintragungsdatum)\n\nBES AB GmbH\nGesellschaft mit beschränkter Haftung\nCremlingen\n\nDas Registergericht beabsichtigt, die Gesellschaft von Amts wegen nach § 394 FamFG zu löschen. Die Frist zur Erhebung eines Widerspruchs ist auf 1 Monat ab dieser Registerbekanntmachung festgesetzt."
    },
    {
      "date": "2024-10-17",
      "original_text": "Registerbekanntmachung nach dem Umwandlungsgesetz\nRheinland-Pfalz Amtsgericht Mainz HRB 2170\nBMS Baumaschinen - Mietservice Hildner GmbH – Mainz",
      "type": "Registerbekanntmachung nach dem Umwandlungsgesetz",
      "state": "Rheinland-Pfalz",
      "amtsgericht": "Amtsgericht Mainz",
      "registernummer": "HRB 2170",
      "registerart": "HRB",
      "company_name": "BMS Baumaschinen - Mietservice Hildner GmbH",
      "company_seat": "Mainz",
      "details": "17.10.2024 (Bekanntmachungsdatum)\n\nRheinland-Pfalz Amtsgericht Mainz HRB 2170\nRegisterbekanntmachung nach dem Umwandlungsgesetz 17.10.2024 (Eintragungsdatum)\n\nBMS Baumaschinen - Mietservice Hildner GmbH\nGesellschaft mit beschränkter Haftung\nMainz\n\nAls nicht eingetragen wird veröffentlicht: Den Gläubigern der an der Verschmelzung beteiligten Rechtsträger ist, wenn sie binnen sechs Monaten nach dem Tag, an dem die Eintragung der Verschmelzung in das Register des Sitzes desjenigen Rechtsträgers, dessen Gläubiger sie sind, nach § 19 Abs. 3 UmwG als bekannt gemacht gilt, ihren Anspruch nach Grund und Höhe schriftlich anmelden, Sicherheit zu leisten, soweit sie nicht Befriedigung verlangen können. Dieses Recht steht den Gläubigern jedoch nur zu, wenn sie glaubhaft machen, dass durch die Verschmelzung die Erfüllung der Forderung gefährdet wird."
    },
    {
      "date": "2024-10-17",
      "original_text": "Löschungsankündigung\nMecklenburg-Vorpommern Amtsgericht Rostock HRB 11781\nBaor Haus- und Dachtechnik GmbH – Bad Doberan",
      "type": "Löschungsankündigung",
      "state": "Mecklenburg-Vorpommern",
      "amtsgericht": "Amtsgericht Rostock",
      "registernummer": "HRB 11781",
      "registerart": "HRB",
      "company_name": "Baor Haus- und Dachtechnik GmbH",
      "company_seat": "Bad Doberan",
      "details": "17.10.2024 (Bekanntmachungsdatum)\n\nMecklenburg-Vorpommern Amtsgericht Rostock HRB 11781\nLöschungsankündigung\n\nBaor Haus- und Dachtechnik GmbH\nGesellschaft mit beschränkter Haftung\nBad Doberan\n\nDas Registergericht beabsichtigt, die im Handelsregister eingetragene Gesellschaft von Amts wegen nach § 394 FamFG zu löschen. Die Frist zur Erhebung eines Widerspruchs gegen die beabsichtigte Löschung wird auf einen Monat festgesetzt."
    },
    {
      "date": "2024-10-17",
      "original_text": "Löschungsankündigung\nHamburg Amtsgericht Hamburg VR 20180\nBaptist-Evangelisch-Sinai e.v. – Hamburg",
      "type": "Löschungsankündigung",
      "state": "Hamburg",
      "amtsgericht": "Amtsgericht Hamburg",
      "registernummer": "VR 20180",
      "registerart": "VR",
      "company_name": "Baptist-Evangelisch-Sinai e.v.",
      "company_seat": "Hamburg",
      "details": "17.10.2024 (Bekanntmachungsdatum)\n\nHamburg Amtsgericht Hamburg VR 20180\nLöschungsankündigung\n\nBaptist-Evangelisch-Sinai e.v.\neingetragener Verein\nHamburg\n\nDas Registergericht beabsichtigt, den im Vereinsregister eingetragenen Verein von Amts wegen nach § 395 FamFG zu löschen, da nach den angestellten Ermittlungen dieser Verein offenbar nicht mehr besteht. Die Frist zur Erhebung eines Widerspruchs gegen die beabsichtigte Löschung wird auf 3 Monate festgesetzt."
    },
    {
      "date": "2024-10-17",
      "original_text": "Registerbekanntmachung nach dem Umwandlungsgesetz\nNordrhein-Westfalen Amtsgericht Köln HRA 37700\nBau-Art OHG – Bergneustadt",
      "type": "Registerbekanntmachung nach dem Umwandlungsgesetz",
      "state": "Nordrhein-Westfalen",
      "amtsgericht": "Amtsgericht Köln",
      "registernummer": "HRA 37700",
      "registerart": "HRA",
      "company_name": "Bau-Art OHG",
      "company_seat": "Bergneustadt",
      "details": "17.10.2024 (Bekanntmachungsdatum)\n\nNordrhein-Westfalen Amtsgericht Köln HRA 37700\nRegisterbekanntmachung nach dem Umwandlungsgesetz 17.10.2024 (Eintragungsdatum)\n\nBau-Art OHG\nOffene Handelsgesellschaft\nBergneustadt\n\nDen Gläubigern der an der formwechselnden Umwandlung beteiligten Rechtsträger ist, wenn sie binnen sechs Monaten nach dem Tag, an dem die Eintragung der formwechselnden Umwandlung in das Register des Sitzes desjenigen Rechtsträgers, dessen Gläubiger sie sind, nach § 19 Absatz 3 UmwG als bekanntgemacht gilt, ihren Anspruch nach Grund und Höhe schriftlich anmelden, Sicherheit zu leisten, soweit sie nicht Befriedigung verlangen können. Dieses Recht steht den Gläubigern jedoch nur zu, wenn sie glaubhaft machen, dass durch die formwechselnden Umwandlung die Erfüllung ihrer Forderung gefährdet wird."
    },
    {
      "date": "2024-10-17",
      "original_text": "Registerbekanntmachung nach dem Umwandlungsgesetz\nBerlin Amtsgericht Berlin (Charlottenburg) HRA 55927\nBettina Roden e.K. – Berlin",
      "type": "Registerbekanntmachung nach dem Umwandlungsgesetz",
      "state": "Berlin",
      "amtsgericht": "Amtsgericht Berlin (Charlottenburg)",
      "registernummer": "HRA 55927",
      "registerart": "HRA",
      "company_name": "Bettina Roden e.K.",
      "company_seat": "Berlin",
      "details": "17.10.2024 (Bekanntmachungsdatum)\n\nBerlin Amtsgericht Berlin (Charlottenburg) HRA 55927\nRegisterbekanntmachung nach dem Umwandlungsgesetz 15.10.2024 (Eintragungsdatum)\n\nBettina Roden e.K.\nEinzelkaufmann / Einzelkauffrau\nBerlin\n\nDie Eintragung lfd. Nummer 2 vom 15.10.2024 wird nochmals berichtigend als nicht eingetragen veröffentlicht: Den Gläubigern der an der Spaltung beteiligten Rechtsträger ist, wenn sie binnen sechs Monaten nach dem Tag, an dem die Eintragung der Spaltung in das Register des Sitzes desjenigen Rechtsträgers, dessen Gläubiger sie sind, als bekannt gemacht gilt, ihren Anspruch nach Grund und Höhe schriftlich anmelden, Sicherheit zu leisten, soweit sie nicht Befriedigung verlangen können. Dieses Recht steht den Gläubigern jedoch nur zu, wenn sie glaubhaft machen, dass durch die Spaltung die Erfüllung ihrer Forderung gefährdet wird. Das Recht, Sicherheitsleistung zu verlangen, steht Gläubigern nicht zu, die im Falle der Insolvenz ein Recht auf vorzugsweise Befriedigung aus einer Deckungsmasse haben, die nach gesetzlicher Vorschrift zu ihrem Schutz errichtet und staatlich überwacht ist."
    },
    {
      "date": "2024-10-17",
      "original_text": "Registerbekanntmachung nach dem Umwandlungsgesetz\nBayern Amtsgericht Kempten (Allgäu) HRB 15875\nBlack Swan Trading GmbH – Haldenwang",
      "type": "Registerbekanntmachung nach dem Umwandlungsgesetz",
      "state": "Bayern",
      "amtsgericht": "Amtsgericht Kempten (Allgäu)",
      "registernummer": "HRB 15875",
      "registerart": "HRB",
      "company_name": "Black Swan Trading GmbH",
      "company_seat": "Haldenwang",
      "details": "17.10.2024 (Bekanntmachungsdatum)\n\nBayern Amtsgericht Kempten (Allgäu) HRB 15875\nRegisterbekanntmachung nach dem Umwandlungsgesetz 16.10.2024 (Eintragungsdatum)\n\nBlack Swan Trading GmbH\nGesellschaft mit beschränkter Haftung\nHaldenwang\n\nDen Gläubigern der an der Verschmelzung beteiligten Rechtsträger ist, wenn sie binnen sechs Monaten nach dem Tag, an dem die Eintragung der Verschmelzung in das Register des Sitzes desjenigen Rechtsträgers, dessen Gläubiger sie sind, nach § 19 Abs. 3 UmwG als bekannt gemacht gilt, ihren Anspruch nach Grund und Höhe schriftlich anmelden, Sicherheit zu leisten, soweit sie nicht Befriedigung verlangen können. Dieses Recht steht den Gläubigern jedoch nur zu, wenn sie glaubhaft machen, dass durch die Verschmelzung die Erfüllung ihrer Forderung gefährdet wird."
    },
    {
      "date": "2024-10-17",
      "original_text": "Löschungsankündigung\nNordrhein-Westfalen Amtsgericht Duisburg HRB 29667\nBlaundus Terminarbeit GmbH – Duisburg",
      "type": "Löschungsankündigung",
      "state": "Nordrhein-Westfalen",
      "amtsgericht": "Amtsgericht Duisburg",
      "registernummer": "HRB 29667",
      "registerart": "HRB",
      "company_name": "Blaundus Terminarbeit GmbH",
      "company_seat": "Duisburg",
      "details": "17.10.2024 (Bekanntmachungsdatum)\n\nNordrhein-Westfalen Amtsgericht Duisburg HRB 29667\nLöschungsankündigung\n\nBlaundus Terminarbeit GmbH\nGesellschaft mit beschränkter Haftung\nDuisburg\n\nHRB 29667:\nBlaundus Terminarbeit GmbH,\nDuisburg,\nReinerstr. 20, 47166 Duisburg. Das Registergericht beabsichtigt, die im Handelsregister eingetragene Gesellschaft gemäß § 394 Absatz 1 FamFG wegen Vermögenslosigkeit von Amts wegen zu löschen. Gegen diese Verfügung kann Widerspruch eingelegt werden. Die Frist zur Erhebung eines Widerspruchs gegen die beabsichtigte Löschung von Amts wegen ist auf drei Monate festgesetzt. Rechtsbehelfsbelehrung Der Widerspruch ist bei dem Amtsgericht Duisburg, Kardinal-Galen-Str. 124-132, 47058 Duisburg schriftlich in deutscher Sprache oder zur Niederschrift der Geschäftsstelle einzulegen. Der Widerspruch kann auch zur Niederschrift der Geschäftsstelle eines jeden Amtsgerichtes abgegeben werden. Die Einlegung ist auch durch Übertragung eines elektronischen Dokuments an die elektronische Poststelle des Gerichts möglich. Das elektronische Dokument muss für die Bearbeitung durch das Gericht geeignet und mit einer qualifizierten elektronischen Signatur der verantwortenden Person versehen sein oder von der verantwortenden Person signiert und auf einem sicheren Übermittlungsweg gemäß § 130 a ZPO nach näherer Maßgabe der Verordnung über die technischen Rahmenbedingungen des elektronischen Rechtsverkehrs und über das besondere elektronische Behördenpostfach (BGBl. I, S. 3803) eingereicht werden. Weitere Informationen erhalten Sie auf der Internetseite www.justiz.de <http://www.justiz.de>. Der Widerspruch muss spätestens innerhalb der gesetzten Frist bei dem Amtsgericht Duisburg eingegangen sein. Dies gilt auch dann, wenn der Widerspruch zur Niederschrift der Geschäftsstelle eines anderen Amtsgerichtes abgegeben wurde. Die Frist beginnt mit der Veröffentlichung. Fällt das Ende der Frist auf einen Sonntag, einen allgemeinen Feiertag oder Sonnabend, so endet die Frist mit Ablauf des nächsten Werktages. Der Widerspruch muss die Bezeichnung der angefochtenen Verfügung sowie die Erklärung enthalten, dass Widerspruch gegen diese Verfügung eingelegt wird. Er ist zu unterzeichnen und soll begründet werden."
    },
    {
      "date": "2024-10-17",
      "original_text": "Registerbekanntmachung nach dem Umwandlungsgesetz\nSchleswig-Holstein Amtsgericht Kiel HRB 10565\nBoeing Distribution Services II GmbH – Norderstedt",
      "type": "Registerbekanntmachung nach dem Umwandlungsgesetz",
      "state": "Schleswig-Holstein",
      "amtsgericht": "Amtsgericht Kiel",
      "registernummer": "HRB 10565",
      "registerart": "HRB",
      "company_name": "Boeing Distribution Services II GmbH",
      "company_seat": "Norderstedt",
      "details": "17.10.2024 (Bekanntmachungsdatum)\n\nSchleswig-Holstein Amtsgericht Kiel HRB 10565\nRegisterbekanntmachung nach dem Umwandlungsgesetz 11.09.2024 (Eintragungsdatum)\n\nBoeing Distribution Services II GmbH\nGesellschaft mit beschränkter Haftung\nNorderstedt\n\nZu Eintragungsnummer 12 vom 11.09.2024 wird als nicht eingetragen veröffentlicht: Den Gläubigern der an der Verschmelzung beteiligten Rechtsträger ist, wenn sie binnen sechs Monaten nach dem Tag, an dem die Eintragung der Verschmelzung in das Register des Sitzes desjenigen Rechtsträgers, dessen Gläubiger sie sind, nach § 19 Abs. 3 UmwG bekannt gemacht worden ist, ihren Anspruch nach Grund und Höhe schriftlich anmelden, Sicherheit zu leisten, soweit sie nicht Befriedigung verlangen können. Dieses Recht steht den Gläubigern jedoch nur zu, wenn sie glaubhaft machen, dass durch die Verschmelzung die Erfüllung ihrer Forderung gefährdet wird."
    },
    {
      "date": "2024-10-17",
      "original_text": "Registerbekanntmachung nach dem Umwandlungsgesetz\nNordrhein-Westfalen Amtsgericht Köln HRB 73534\nBonatero GmbH – Köln",
      "type": "Registerbekanntmachung nach dem Umwandlungsgesetz",
      "state": "Nordrhein-Westfalen",
      "amtsgericht": "Amtsgericht Köln",
      "registernummer": "HRB 73534",
      "registerart": "HRB",
      "company_name": "Bonatero GmbH",
      "company_seat": "Köln",
      "details": "17.10.2024 (Bekanntmachungsdatum)\n\nNordrhein-Westfalen Amtsgericht Köln HRB 73534\nRegisterbekanntmachung nach dem Umwandlungsgesetz 17.10.2024 (Eintragungsdatum)\n\nBonatero GmbH\nGesellschaft mit beschränkter Haftung\nKöln\n\nDen Gläubigern der an der Verschmelzung beteiligten Rechtsträger ist, wenn sie binnen sechs Monaten nach dem Tag, an dem die Eintragung der Verschmelzung in das Register des Sitzes desjenigen Rechtsträgers, dessen Gläubiger sie sind, nach § 19 Absatz 3 UmwG als bekanntgemacht gilt, ihren Anspruch nach Grund und Höhe schriftlich anmelden, Sicherheit zu leisten, soweit sie nicht Befriedigung verlangen können. Dieses Recht steht den Gläubigern jedoch nur zu, wenn sie glaubhaft machen, dass durch die Verschmelzung die Erfüllung ihrer Forderung gefährdet wird."
    },
    {
      "date": "2024-10-17",
      "original_text": "Registerbekanntmachung nach dem Umwandlungsgesetz\nHessen Amtsgericht Frankfurt am Main HRB 92054\nBookwire GmbH – Frankfurt am Main",
      "type": "Registerbekanntmachung nach dem Umwandlungsgesetz",
      "state": "Hessen",
      "amtsgericht": "Amtsgericht Frankfurt am Main",
      "registernummer": "HRB 92054",
      "registerart": "HRB",
      "company_name": "Bookwire GmbH",
      "company_seat": "Frankfurt am Main",
      "details": "17.10.2024 (Bekanntmachungsdatum)\n\nHessen Amtsgericht Frankfurt am Main HRB 92054\nRegisterbekanntmachung nach dem Umwandlungsgesetz 02.10.2024 (Eintragungsdatum)\n\nBookwire GmbH\nGesellschaft mit beschränkter Haftung\nFrankfurt am Main\n\nEs ist beabsichtigt, die Bookrepublic Distribuzione S.r.l., eine Gesellschaft mit beschränkter Haftung italienischen Rechts mit Sitz in Mailand, Italien, eingetragen im italienischen Handelsregister (registro delle imprese) von von Mailand, Monza, Brianza und Lodi unter der Nummer 13335330968, R.E.A. Nr. 2717193, als übertragende Gesellschaft unter Auflösung ohne Abwicklung im Wege der grenzüberschreitenden Verschmelzung zur Aufnahme durch Übertragung des Vermögens der Bookrepublic Distribuzione S.r.l. als Ganzes gemäß § 305 Abs. 2 S. 1 UmwG i.V.m. § 2 Nr. 1 UmwG auf die Bookwire GmbH, eine Gesellschaft mit beschränkter Haftung deutschen Rechts mit Sitz in Frankfurt am Main, Bundesrepublik Deutschland, eingetragen im Handelsregister des Amtsgerichts Frankfurt am Main unter HRB 92054, als übernehmende Gesellschaft zu verschmelzen.\nGemäß § 308 Abs. 1 S. 1 UmwG wird der Verschmelzungsplan eingereicht mit der Bitte um Bekanntmachung der gemäß § 308 Abs. 1 S. 2 UmwG erforderlichen Angaben.\n\nII.\nHierzu teilen wir gemäß § 308 Abs. 1 S. 3 UmwG die bekannt zu machenden Angaben wie folgt mit:\n1.\tDem Registergericht ist der Verschmelzungsplan über die geplante grenzüberschreitende Verschmelzung der Bookrepublic Distribuzione S.r.l., einer Gesellschaft mit beschränkter Haftung italienischen Rechts, als übertragender Gesellschaft auf die Bookwire GmbH, eine Gesellschaft mit beschränkter Haftung deutschen Rechts, als übernehmende Gesellschaft eingereicht worden.\n2.\tRechtsform, Firma und Sitz der an der grenzüberschreitenden Verschmelzung beteiligten Gesellschaften:\n2.1\tübertragende Gesellschaft:\nDie übertragende Gesellschaft ist eine Gesellschaft mit beschränkter Haftung italienischen Rechts.\nDie Firma der übertragenden Gesellschaft lautet: Bookrepublic Distribuzione S.r.l..\nDie übertragende Gesellschaft hat ihren Sitz in Mailand, Italien.\n2.2\tübernehmende Gesellschaft:\nDie übernehmende Gesellschaft ist eine Gesellschaft mit beschränkter Haftung deutschen Rechts.\nDie Firma der übernehmenden Gesellschaft lautet Bookwire GmbH.\nDie übernehmende Gesellschaft hat ihren Sitz in Frankfurt am Main, Bundesrepublik Deutschland.\n\n3.\tRegister, bei denen die an der grenzüberschreitenden Verschmelzung beteiligten Gesellschaften eingetragen sind, sowie die jeweilige Registernummer:\n\n3.1\tübertragende Gesellschaft:\n\nDie übertragende Gesellschaft Bookrepublic Distribuzione S.r.l. ist eingetragen im italienischen Handelsregister (registro delle imprese) von Mailand, Monza, Brianza und Lodi unter der Nummer 13335330968, R.E.A. Nr. 2717193\n\n3.2\tübernehmende Gesellschaft:\n\nDie übernehmende Gesellschaft Bookwire GmbH ist eingetragen im Handelsregister des Amtsgerichts Frankfurt am Main unter HRB 92054\n\n4.\tDie Anteilsinhaber und Gläubiger der an der grenzüberschreitenden Verschmelzung beteiligten Gesellschaften können der jeweiligen Gesellschaft bis spätestens fünf Arbeitstage vor dem Tag der Gesellschafterversammlung der Bookwire GmbH Bemerkungen zum Verschmelzungsplan übermitteln. Die an der grenzüberschreitenden Verschmelzung beteiligten Gesellschaften haben Arbeitnehmer, aber keine Arbeitnehmervertretungen.\nDie Gesellschafterversammlung der Bookwire GmbH darf gemäß § 308 Abs. 1 S. 4 UmwG erst einen Monat nach dieser Bekanntmachung über die Zustimmung zu dem Verschmelzungsplan gemäß § 13 UmwG beschließen.\nBemerkungen sind zu übermitteln an:\n\nBookrepublic Distribuzione S.r.l.\n\nVia Degli Olivetani 12\n20123 Mailand\nItalien\n\nbzw.\n\nBookwire GmbH\nVoltastraße 1\n60486 Frankfurt am Main\nBundesrepublik Deutschland"
    },
    {
      "date": "2024-10-17",
      "original_text": "Registerbekanntmachung nach dem Umwandlungsgesetz\nThüringen Amtsgericht Jena HRB 209127\nBöttcher AG – Jena",
      "type": "Registerbekanntmachung nach dem Umwandlungsgesetz",
      "state": "Thüringen",
      "amtsgericht": "Amtsgericht Jena",
      "registernummer": "HRB 209127",
      "registerart": "HRB",
      "company_name": "Böttcher AG",
      "company_seat": "Jena",
      "details": "17.10.2024 (Bekanntmachungsdatum)\n\nThüringen Amtsgericht Jena HRB 209127\nRegisterbekanntmachung nach dem Umwandlungsgesetz 17.10.2024 (Eintragungsdatum)\n\nBöttcher AG\nAktiengesellschaft\nJena\n\nNicht eingetragen: Den Gläubigern der an der Ausgliederung beteiligten Rechtsträger, ist wenn sie binnen sechs Monaten nach dem Tag, an dem die Eintragung der Ausgliederung in das Register des Sitzes desjenigen Rechtsträgers, dessen Gläubiger sie sind, nach §§125, 19 Abs. 3 UmwG als bekanntgemacht gilt, ihren Anspruch nach Grund und Höhe schriftlich anmelden, Sicherheit zu leisten, soweit sie nicht Befriedigung verlangen können. Dieses Recht steht ihnen jedoch nur zu, wenn sie glaubhaft machen, daß durch die Ausgliederung die Erfüllung ihrer Forderung gefährdet wird."
    },
    {
      "date": "2024-10-17",
      "original_text": "Registerbekanntmachung nach dem Umwandlungsgesetz\nBerlin Amtsgericht Berlin (Charlottenburg) HRB 265317\nCORE GORIMO GmbH – Berlin",
      "type": "Registerbekanntmachung nach dem Umwandlungsgesetz",
      "state": "Berlin",
      "amtsgericht": "Amtsgericht Berlin (Charlottenburg)",
      "registernummer": "HRB 265317",
      "registerart": "HRB",
      "company_name": "CORE GORIMO GmbH",
      "company_seat": "Berlin",
      "details": "17.10.2024 (Bekanntmachungsdatum)\n\nBerlin Amtsgericht Berlin (Charlottenburg) HRB 265317\nRegisterbekanntmachung nach dem Umwandlungsgesetz 16.10.2024 (Eintragungsdatum)\n\nCORE GORIMO GmbH\nGesellschaft mit beschränkter Haftung\nBerlin\n\nZu Eintragungsnummer 2 vom 16.10.2024 wird als nicht eingetragen veröffentlicht: Den Gläubigern der an der Spaltung beteiligten Rechtsträger ist, wenn sie binnen sechs Monaten nach dem Tag, an dem die Eintragung der Spaltung in das Register des Sitzes desjenigen Rechtsträgers, dessen Gläubiger sie sind, als bekannt gemacht gilt, ihren Anspruch nach Grund und Höhe schriftlich anmelden, Sicherheit zu leisten, soweit sie nicht Befriedigung verlangen können. Dieses Recht steht den Gläubigern jedoch nur zu, wenn sie glaubhaft machen, dass durch die Spaltung die Erfüllung ihrer Forderung gefährdet wird. Das Recht, Sicherheitsleistung zu verlangen, steht Gläubigern nicht zu, die im Falle der Insolvenz ein Recht auf vorzugsweise Befriedigung aus einer Deckungsmasse haben, die nach gesetzlicher Vorschrift zu ihrem Schutz errichtet und staatlich überwacht ist."
    },
    {
      "date": "2024-10-17",
      "original_text": "Löschungsankündigung\nBerlin Amtsgericht Berlin (Charlottenburg) HRB 245322\nCostaClean Service GmbH – Berlin",
      "type": "Löschungsankündigung",
      "state": "Berlin",
      "amtsgericht": "Amtsgericht Berlin (Charlottenburg)",
      "registernummer": "HRB 245322",
      "registerart": "HRB",
      "company_name": "CostaClean Service GmbH",
      "company_seat": "Berlin",
      "details": "17.10.2024 (Bekanntmachungsdatum)\n\nBerlin Amtsgericht Berlin (Charlottenburg) HRB 245322\nLöschungsankündigung\n\nCostaClean Service GmbH\nGesellschaft mit beschränkter Haftung\nBerlin\n\nEs ist beabsichtigt, die Eintragung wegen Mangels einer wesentlichen Voraussetzung gemäß § 395 FamFG von Amts wegen zu löschen. Widerspruchsfrist 6 Wochen"
    },
    {
      "date": "2024-10-17",
      "original_text": "Registerbekanntmachung nach dem Umwandlungsgesetz\nSchleswig-Holstein Amtsgericht Pinneberg HRB 18526\nD&R Holding GmbH – Quickborn/Krs. Pinneberg",
      "type": "Registerbekanntmachung nach dem Umwandlungsgesetz",
      "state": "Schleswig-Holstein",
      "amtsgericht": "Amtsgericht Pinneberg",
      "registernummer": "HRB 18526",
      "registerart": "HRB",
      "company_name": "D&R Holding GmbH",
      "company_seat": "Quickborn/Krs. Pinneberg",
      "details": "17.10.2024 (Bekanntmachungsdatum)\n\nSchleswig-Holstein Amtsgericht Pinneberg HRB 18526\nRegisterbekanntmachung nach dem Umwandlungsgesetz 16.10.2024 (Eintragungsdatum)\n\nD&R Holding GmbH\nGesellschaft mit beschränkter Haftung\nQuickborn/Krs. Pinneberg\n\nZu Eintragungsnummer 1 vom 16.10.2024 wird als nicht eingetragen veröffentlicht: Als nicht eingetragen wird veröffentlicht: Den Gläubigern ist, wenn sie binnen sechs Monaten nach dem Tag, an dem die Eintragung der Umwandlung als bekannt gemacht gilt, ihren Anspruch nach Grund und Höhe schriftlich anmelden, Sicherheit zu leisten, soweit sie nicht Befriedigung verlangen können. Dieses Recht steht den Gläubigern jedoch nur zu, wenn sie glaubhaft machen, dass durch die Umwandlung die Erfüllung ihrer Forderung gefährdet wird. Das Recht, Sicherheitsleistung zu verlangen, steht Gläubigern nicht zu, die im Falle der Insolvenz ein Recht auf vorzugsweise Befriedigung aus einer Deckungsmasse haben, die nach gesetzlicher Vorschrift zu ihrem Schutz errichtet und staatlich überwacht ist."
    },
    {
      "date": "2024-10-17",
      "original_text": "Registerbekanntmachung nach dem Umwandlungsgesetz\nBayern Amtsgericht Amberg HRB 5807\nDIG Interieur GmbH – Wackersdorf",
      "type": "Registerbekanntmachung nach dem Umwandlungsgesetz",
      "state": "Bayern",
      "amtsgericht": "Amtsgericht Amberg",
      "registernummer": "HRB 5807",
      "registerart": "HRB",
      "company_name": "DIG Interieur GmbH",
      "company_seat": "Wackersdorf",
      "details": "17.10.2024 (Bekanntmachungsdatum)\n\nBayern Amtsgericht Amberg HRB 5807\nRegisterbekanntmachung nach dem Umwandlungsgesetz 16.10.2024 (Eintragungsdatum)\n\nDIG Interieur GmbH\nGesellschaft mit beschränkter Haftung\nWackersdorf\n\nDen Gläubigern der an der Verschmelzung beteiligten Rechtsträger ist, wenn sie binnen sechs Monaten nach dem Tag, an dem die Eintragung der Verschmelzung in das Register des Sitzes desjenigen Rechtsträgers, dessen Gläubiger sie sind, nach § 19 Abs. 3 UmwG als bekannt gemacht gilt, ihren Anspruch nach Grund und Höhe schriftlich anmelden, Sicherheit zu leisten, soweit sie nicht Befriedigung verlangen können. Dieses Recht steht den Gläubigern jedoch nur zu, wenn sie glaubhaft machen, dass durch die Verschmelzung die Erfüllung ihrer Forderung gefährdet wird."
    },
    {
      "date": "2024-10-17",
      "original_text": "Registerbekanntmachung nach dem Umwandlungsgesetz\nBayern Amtsgericht Amberg HRB 4805\nDIG Logistik Service GmbH – Wackersdorf",
      "type": "Registerbekanntmachung nach dem Umwandlungsgesetz",
      "state": "Bayern",
      "amtsgericht": "Amtsgericht Amberg",
      "registernummer": "HRB 4805",
      "registerart": "HRB",
      "company_name": "DIG Logistik Service GmbH",
      "company_seat": "Wackersdorf",
      "details": "17.10.2024 (Bekanntmachungsdatum)\n\nBayern Amtsgericht Amberg HRB 4805\nRegisterbekanntmachung nach dem Umwandlungsgesetz 16.10.2024 (Eintragungsdatum)\n\nDIG Logistik Service GmbH\nGesellschaft mit beschränkter Haftung\nWackersdorf\n\nDen Gläubigern der an der Verschmelzung beteiligten Rechtsträger ist, wenn sie binnen sechs Monaten nach dem Tag, an dem die Eintragung der Verschmelzung in das Register des Sitzes desjenigen Rechtsträgers, dessen Gläubiger sie sind, nach § 19 Abs. 3 UmwG als bekannt gemacht gilt, ihren Anspruch nach Grund und Höhe schriftlich anmelden, Sicherheit zu leisten, soweit sie nicht Befriedigung verlangen können. Dieses Recht steht den Gläubigern jedoch nur zu, wenn sie glaubhaft machen, dass durch die Verschmelzung die Erfüllung ihrer Forderung gefährdet wird."
    },
    {
      "date": "2024-10-17",
      "original_text": "Registerbekanntmachung nach dem Umwandlungsgesetz\nSchleswig-Holstein Amtsgericht Kiel VR 745 PL\nDeutsches Rotes Kreuz Ortsverein Dobersdorf e.V. – Dobersdorf",
      "type": "Registerbekanntmachung nach dem Umwandlungsgesetz",
      "state": "Schleswig-Holstein",
      "amtsgericht": "Amtsgericht Kiel",
      "registernummer": "VR 745 PL",
      "registerart": "VR",
      "company_name": "Deutsches Rotes Kreuz Ortsverein Dobersdorf e.V.",
      "company_seat": "Dobersdorf",
      "details": "17.10.2024 (Bekanntmachungsdatum)\n\nSchleswig-Holstein Amtsgericht Kiel VR 745 PL\nRegisterbekanntmachung nach dem Umwandlungsgesetz 04.09.2024 (Eintragungsdatum)\n\nDeutsches Rotes Kreuz Ortsverein Dobersdorf e.V.\neingetragener Verein\nDobersdorf\n\nZu Eintragungsnummer 4 vom 04.09.2024 wird als nicht eingetragen veröffentlicht: Den Gläubigern der an der Verschmelzung beteiligten Rechtsträger ist, wenn sie binnen sechs Monaten nach dem Tag, an dem die Eintragung der Verschmelzung in das Register des Sitzes desjenigen Rechtsträgers, dessen Gläubiger sie sind, nach § 19 Abs. 3 UmwG bekannt gemacht worden ist, ihren Anspruch nach Grund und Höhe schriftlich anmelden, Sicherheit zu leisten, soweit sie nicht Befriedigung verlangen können. Dieses Recht steht den Gläubigern jedoch nur zu, wenn sie glaubhaft machen, dass durch die Verschmelzung die Erfüllung ihrer Forderung gefährdet wird."
    },
    {
      "date": "2024-10-17",
      "original_text": "Einreichung neuer Dokumente\nBaden-Württemberg Amtsgericht Ulm HRB 3532\nDonau-Iller-Nahverkehrsverbund-GmbH – Ulm",
      "type": "Einreichung neuer Dokumente",
      "state": "Baden-Württemberg",
      "amtsgericht": "Amtsgericht Ulm",
      "registernummer": "HRB 3532",
      "registerart": "HRB",
      "company_name": "Donau-Iller-Nahverkehrsverbund-GmbH",
      "company_seat": "Ulm",
      "details": "17.10.2024 (Bekanntmachungsdatum)\n\nBaden-Württemberg Amtsgericht Ulm HRB 3532\nEinreichung neuer Dokumente\n\nDonau-Iller-Nahverkehrsverbund-GmbH\nGesellschaft mit beschränkter Haftung\nUlm\n\nDie Gesellschaft hat am 16.10.2024 die Liste über die Zusammensetzung des Aufsichtsrats zum Handelsregister eingereicht."
    },
    {
      "date": "2024-10-17",
      "original_text": "Registerbekanntmachung nach dem Umwandlungsgesetz\nBayern Amtsgericht München HRA 119957\nDr. Ralph Oehler e.K. – München",
      "type": "Registerbekanntmachung nach dem Umwandlungsgesetz",
      "state": "Bayern",
      "amtsgericht": "Amtsgericht München",
      "registernummer": "HRA 119957",
      "registerart": "HRA",
      "company_name": "Dr. Ralph Oehler e.K.",
      "company_seat": "München",
      "details": "17.10.2024 (Bekanntmachungsdatum)\n\nBayern Amtsgericht München HRA 119957\nRegisterbekanntmachung nach dem Umwandlungsgesetz 14.10.2024 (Eintragungsdatum)\n\nDr. Ralph Oehler e.K.\nEinzelkaufmann / Einzelkauffrau\nMünchen\n\nDen Gläubigern der an der Ausgliederung beteiligten Rechtsträger ist, wenn sie binnen sechs Monaten nach dem Tag, an dem die Eintragung der Ausgliederung in das Register des Sitzes desjenigen Rechtsträgers, dessen Gläubiger sie sind, nach §§ 125, 19 Abs. 3 UmwG als bekannt gemacht gilt, ihren Anspruch nach Grund und Höhe schriftlich anmelden, Sicherheit zu leisten, soweit sie nicht Befriedigung verlangen können. Dieses Recht steht den Gläubigern jedoch nur zu, wenn sie glaubhaft machen, dass durch die Ausgliederung die Erfüllung ihrer Forderung gefährdet wird."
    },
    {
      "date": "2024-10-17",
      "original_text": "Registerbekanntmachung nach dem Umwandlungsgesetz\nSchleswig-Holstein Amtsgericht Pinneberg HRA 5520\nEHB Dritte Grundbesitzverwaltung GmbH & Co. KG – Kollmar",
      "type": "Registerbekanntmachung nach dem Umwandlungsgesetz",
      "state": "Schleswig-Holstein",
      "amtsgericht": "Amtsgericht Pinneberg",
      "registernummer": "HRA 5520",
      "registerart": "HRA",
      "company_name": "EHB Dritte Grundbesitzverwaltung GmbH & Co. KG",
      "company_seat": "Kollmar",
      "details": "17.10.2024 (Bekanntmachungsdatum)\n\nSchleswig-Holstein Amtsgericht Pinneberg HRA 5520\nRegisterbekanntmachung nach dem Umwandlungsgesetz 11.10.2024 (Eintragungsdatum)\n\nEHB Dritte Grundbesitzverwaltung GmbH & Co. KG\nKommanditgesellschaft\nKollmar\n\nZu Eintragungsnummer 4 vom 11.10.2024 wird als nicht eingetragen veröffentlicht: Den Gläubigern ist, wenn sie binnen sechs Monaten nach dem Tag, an dem die Eintragung der Umwandlung als bekannt gemacht gilt, ihren Anspruch nach Grund und Höhe schriftlich anmelden, Sicherheit zu leisten, soweit sie nicht Befriedigung verlangen können. Dieses Recht steht den Gläubigern jedoch nur zu, wenn sie glaubhaft machen, dass durch die Umwandlung die Erfüllung ihrer Forderung gefährdet wird. Das Recht, Sicherheitsleistung zu verlangen, steht Gläubigern nicht zu, die im Falle der Insolvenz ein Recht auf vorzugsweise Befriedigung aus einer Deckungsmasse haben, die nach gesetzlicher Vorschrift zu ihrem Schutz errichtet und staatlich überwacht ist."
    },
    {
      "date": "2024-10-17",
      "original_text": "Registerbekanntmachung nach dem Umwandlungsgesetz\nSchleswig-Holstein Amtsgericht Pinneberg HRA 5519\nEHB Erste Grundbesitzverwaltung GmbH & Co. KG – Kollmar",
      "type": "Registerbekanntmachung nach dem Umwandlungsgesetz",
      "state": "Schleswig-Holstein",
      "amtsgericht": "Amtsgericht Pinneberg",
      "registernummer": "HRA 5519",
      "registerart": "HRA",
      "company_name": "EHB Erste Grundbesitzverwaltung GmbH & Co. KG",
      "company_seat": "Kollmar",
      "details": "17.10.2024 (Bekanntmachungsdatum)\n\nSchleswig-Holstein Amtsgericht Pinneberg HRA 5519\nRegisterbekanntmachung nach dem Umwandlungsgesetz 11.10.2024 (Eintragungsdatum)\n\nEHB Erste Grundbesitzverwaltung GmbH & Co. KG\nKommanditgesellschaft\nKollmar\n\nZu Eintragungsnummer 4 vom 11.10.2024 wird als nicht eingetragen veröffentlicht: Den Gläubigern ist, wenn sie binnen sechs Monaten nach dem Tag, an dem die Eintragung der Umwandlung als bekannt gemacht gilt, ihren Anspruch nach Grund und Höhe schriftlich anmelden, Sicherheit zu leisten, soweit sie nicht Befriedigung verlangen können. Dieses Recht steht den Gläubigern jedoch nur zu, wenn sie glaubhaft machen, dass durch die Umwandlung die Erfüllung ihrer Forderung gefährdet wird. Das Recht, Sicherheitsleistung zu verlangen, steht Gläubigern nicht zu, die im Falle der Insolvenz ein Recht auf vorzugsweise Befriedigung aus einer Deckungsmasse haben, die nach gesetzlicher Vorschrift zu ihrem Schutz errichtet und staatlich überwacht ist."
    },
    {
      "date": "2024-10-17",
      "original_text": "Löschungsankündigung\nBayern Amtsgericht Augsburg HRB 35379\nELT GmbH – Hurlach",
      "type": "Löschungsankündigung",
      "state": "Bayern",
      "amtsgericht": "Amtsgericht Augsburg",
      "registernummer": "HRB 35379",
      "registerart": "HRB",
      "company_name": "ELT GmbH",
      "company_seat": "Hurlach",
      "details": "17.10.2024 (Bekanntmachungsdatum)\n\nBayern Amtsgericht Augsburg HRB 35379\nLöschungsankündigung 16.10.2024 (Eintragungsdatum)\n\nELT GmbH\nGesellschaft mit beschränkter Haftung\nHurlach"
    },
    {
      "date": "2024-10-17",
      "original_text": "Registerbekanntmachung nach dem Umwandlungsgesetz\nBayern Amtsgericht München HRA 119685\nELTEGU Regeltechnik Gutt e.K. – Aschheim",
      "type": "Registerbekanntmachung nach dem Umwandlungsgesetz",
      "state": "Bayern",
      "amtsgericht": "Amtsgericht München",
      "registernummer": "HRA 119685",
      "registerart": "HRA",
      "company_name": "ELTEGU Regeltechnik Gutt e.K.",
      "company_seat": "Aschheim",
      "details": "17.10.2024 (Bekanntmachungsdatum)\n\nBayern Amtsgericht München HRA 119685\nRegisterbekanntmachung nach dem Umwandlungsgesetz 16.10.2024 (Eintragungsdatum)\n\nELTEGU Regeltechnik Gutt e.K.\nEinzelkaufmann / Einzelkauffrau\nAschheim\n\nDen Gläubigern der an der Ausgliederung beteiligten Rechtsträger ist, wenn sie binnen sechs Monaten nach dem Tag, an dem die Eintragung der Ausgliederung in das Register des Sitzes desjenigen Rechtsträgers, dessen Gläubiger sie sind, nach §§ 125, 19 Abs. 3 UmwG als bekannt gemacht gilt, ihren Anspruch nach Grund und Höhe schriftlich anmelden, Sicherheit zu leisten, soweit sie nicht Befriedigung verlangen können. Dieses Recht steht den Gläubigern jedoch nur zu, wenn sie glaubhaft machen, dass durch die Ausgliederung die Erfüllung ihrer Forderung gefährdet wird."
    },
    {
      "date": "2024-10-17",
      "original_text": "Löschungsankündigung\nHessen Amtsgericht Friedberg HRB 7786\nESH Bau GmbH – Bad Nauheim",
      "type": "Löschungsankündigung",
      "state": "Hessen",
      "amtsgericht": "Amtsgericht Friedberg",
      "registernummer": "HRB 7786",
      "registerart": "HRB",
      "company_name": "ESH Bau GmbH",
      "company_seat": "Bad Nauheim",
      "details": "17.10.2024 (Bekanntmachungsdatum)\n\nHessen Amtsgericht Friedberg HRB 7786\nLöschungsankündigung\n\nESH Bau GmbH\nGesellschaft mit beschränkter Haftung\nBad Nauheim\n\nDas Registergericht beabsichtigt die im Handelsregister eingetragene Gesellschaft von Amts wegen nach § 394 FamFG zu löschen. Die Frist zur Erhebung eines Widerspruchs gegen die beabsichtigte Löschung wird auf 3 Monate festgesetzt."
    },
    {
      "date": "2024-10-17",
      "original_text": "Registerbekanntmachung nach dem Umwandlungsgesetz\nNordrhein-Westfalen Amtsgericht Bonn HRB 16661\nESK Holding GmbH – Bonn",
      "type": "Registerbekanntmachung nach dem Umwandlungsgesetz",
      "state": "Nordrhein-Westfalen",
      "amtsgericht": "Amtsgericht Bonn",
      "registernummer": "HRB 16661",
      "registerart": "HRB",
      "company_name": "ESK Holding GmbH",
      "company_seat": "Bonn",
      "details": "17.10.2024 (Bekanntmachungsdatum)\n\nNordrhein-Westfalen Amtsgericht Bonn HRB 16661\nRegisterbekanntmachung nach dem Umwandlungsgesetz 17.10.2024 (Eintragungsdatum)\n\nESK Holding GmbH\nGesellschaft mit beschränkter Haftung\nBonn\n\nDen Gläubigern der an der Verschmelzung beteiligten Rechtsträger ist, wenn sie binnen sechs Monaten nach dem Tag, an dem die Eintragung der Verschmelzung in das Register des Sitzes desjenigen Rechtsträgers, dessen Gläubiger sie sind, nach § 19 Absatz 3 UmwG als bekanntgemacht gilt, ihren Anspruch nach Grund und Höhe schriftlich anmelden, Sicherheit zu leisten, soweit sie nicht Befriedigung verlangen können. Dieses Recht steht den Gläubigern jedoch nur zu, wenn sie glaubhaft machen, dass durch die Verschmelzung die Erfüllung ihrer Forderung gefährdet wird."
    },
    {
      "date": "2024-10-17",
      "original_text": "Registerbekanntmachung nach dem Umwandlungsgesetz\nBaden-Württemberg Amtsgericht Freiburg HRB 731863\nEisemann Handel und Transport GmbH – Donaueschingen",
      "type": "Registerbekanntmachung nach dem Umwandlungsgesetz",
      "state": "Baden-Württemberg",
      "amtsgericht": "Amtsgericht Freiburg",
      "registernummer": "HRB 731863",
      "registerart": "HRB",
      "company_name": "Eisemann Handel und Transport GmbH",
      "company_seat": "Donaueschingen",
      "details": "17.10.2024 (Bekanntmachungsdatum)\n\nBaden-Württemberg Amtsgericht Freiburg HRB 731863\nRegisterbekanntmachung nach dem Umwandlungsgesetz 17.10.2024 (Eintragungsdatum)\n\nEisemann Handel und Transport GmbH\nGesellschaft mit beschränkter Haftung\nDonaueschingen\n\nAls nicht eingetragen wird bekanntgemacht:\nDen Gläubigern der an der Ausgliederung beteiligten Rechtsträger ist, wenn sie binnen sechs Monaten nach dem Tag, an dem die Eintragung der Ausgliederung in das Register des Sitzes desjenigen Rechtsträgers, dessen Gläubiger sie sind, nach § 19 Abs. 3 UmwG als bekanntgemacht gilt, ihren Anspruch nach Grund und Höhe schriftlich anmelden, Sicherheit zu leisten, soweit sie nicht Befriedigung verlangen können. Dieses Recht steht den Gläubigern jedoch nur zu, wenn sie glaubhaft machen, dass durch die Ausgliederung die Erfüllung ihrer Forderung gefährdet wird."
    },
    {
      "date": "2024-10-17",
      "original_text": "Registerbekanntmachung nach dem Umwandlungsgesetz\nSachsen Amtsgericht Dresden HRB 33258\nEnergieWerk Ost GmbH – Klingenberg",
      "type": "Registerbekanntmachung nach dem Umwandlungsgesetz",
      "state": "Sachsen",
      "amtsgericht": "Amtsgericht Dresden",
      "registernummer": "HRB 33258",
      "registerart": "HRB",
      "company_name": "EnergieWerk Ost GmbH",
      "company_seat": "Klingenberg",
      "details": "17.10.2024 (Bekanntmachungsdatum)\n\nSachsen Amtsgericht Dresden HRB 33258\nRegisterbekanntmachung nach dem Umwandlungsgesetz 17.10.2024 (Eintragungsdatum)\n\nEnergieWerk Ost GmbH\nGesellschaft mit beschränkter Haftung\nKlingenberg\n\nDen Gläubigern der an der Verschmelzung beteiligten Rechtsträger ist, wenn sie binnen sechs Monaten nach dem Tag, an dem die Eintragung der Verschmelzung in das Register des Sitzes desjenigen Rechtsträgers, dessen Gläubiger sie sind, nach § 19 Abs. 3 UmwG als bekannt gemacht gilt, ihren Anspruch nach Grund und Höhe schriftlich anmelden, Sicherheit zu leisten, soweit sie nicht Befriedigung verlangen können. Dieses Recht steht den Gläubigern jedoch nur zu, wenn sie glaubhaft machen, dass durch die Verschmelzung die Erfüllung der Forderung gefährdet wird."
    },
    {
      "date": "2024-10-17",
      "original_text": "Registerbekanntmachung nach dem Umwandlungsgesetz\nRheinland-Pfalz Amtsgericht Mainz HRB 867\nF. Kessel GmbH – Mainz",
      "type": "Registerbekanntmachung nach dem Umwandlungsgesetz",
      "state": "Rheinland-Pfalz",
      "amtsgericht": "Amtsgericht Mainz",
      "registernummer": "HRB 867",
      "registerart": "HRB",
      "company_name": "F. Kessel GmbH",
      "company_seat": "Mainz",
      "details": "17.10.2024 (Bekanntmachungsdatum)\n\nRheinland-Pfalz Amtsgericht Mainz HRB 867\nRegisterbekanntmachung nach dem Umwandlungsgesetz 17.10.2024 (Eintragungsdatum)\n\nF. Kessel GmbH\nGesellschaft mit beschränkter Haftung\nMainz\n\nAls nicht eingetragen wird veröffentlicht: Den Gläubigern der an der Verschmelzung beteiligten Rechtsträger ist, wenn sie binnen sechs Monaten nach dem Tag, an dem die Eintragung der Verschmelzung in das Register des Sitzes desjenigen Rechtsträgers, dessen Gläubiger sie sind, nach § 19 Abs. 3 UmwG als bekannt gemacht gilt, ihren Anspruch nach Grund und Höhe schriftlich anmelden, Sicherheit zu leisten, soweit sie nicht Befriedigung verlangen können. Dieses Recht steht den Gläubigern jedoch nur zu, wenn sie glaubhaft machen, dass durch die Verschmelzung die Erfüllung der Forderung gefährdet wird."
    },
    {
      "date": "2024-10-17",
      "original_text": "Registerbekanntmachung nach dem Umwandlungsgesetz\nBayern Amtsgericht Augsburg HRB 7844\nF.X. Stöhr GmbH – Königsbrunn",
      "type": "Registerbekanntmachung nach dem Umwandlungsgesetz",
      "state": "Bayern",
      "amtsgericht": "Amtsgericht Augsburg",
      "registernummer": "HRB 7844",
      "registerart": "HRB",
      "company_name": "F.X. Stöhr GmbH",
      "company_seat": "Königsbrunn",
      "details": "17.10.2024 (Bekanntmachungsdatum)\n\nBayern Amtsgericht Augsburg HRB 7844\nRegisterbekanntmachung nach dem Umwandlungsgesetz 16.10.2024 (Eintragungsdatum)\n\nF.X. Stöhr GmbH\nGesellschaft mit beschränkter Haftung\nKönigsbrunn\n\nDen Gläubigern der an der Verschmelzung beteiligten Rechtsträger ist, wenn sie binnen sechs Monaten nach dem Tag, an dem die Eintragung der Verschmelzung in das Register des Sitzes desjenigen Rechtsträgers, dessen Gläubiger sie sind, nach § 19 Abs. 3 UmwG als bekannt gemacht gilt, ihren Anspruch nach Grund und Höhe schriftlich anmelden, Sicherheit zu leisten, soweit sie nicht Befriedigung verlangen können. Dieses Recht steht den Gläubigern jedoch nur zu, wenn sie glaubhaft machen, dass durch die Verschmelzung die Erfüllung ihrer Forderung gefährdet wird."
    },
    {
      "date": "2024-10-17",
      "original_text": "Einreichung neuer Dokumente\nBayern Amtsgericht München HRB 158196\nF24 AG – München",
      "type": "Einreichung neuer Dokumente",
      "state": "Bayern",
      "amtsgericht": "Amtsgericht München",
      "registernummer": "HRB 158196",
      "registerart": "HRB",
      "company_name": "F24 AG",
      "company_seat": "München",
      "details": "17.10.2024 (Bekanntmachungsdatum)\n\nBayern Amtsgericht München HRB 158196\nEinreichung neuer Dokumente\n\nF24 AG\nAktiengesellschaft\nMünchen\n\nDem Amtsgericht München -Registergericht- ist eine Liste der Mitglieder des Aufsichtsrats eingereicht worden, § 106 AktG."
    },
    {
      "date": "2024-10-17",
      "original_text": "Registerbekanntmachung nach dem Umwandlungsgesetz\nHessen Amtsgericht Friedberg HRA 5090\nFelix Schnella e.K. – Bad Nauheim",
      "type": "Registerbekanntmachung nach dem Umwandlungsgesetz",
      "state": "Hessen",
      "amtsgericht": "Amtsgericht Friedberg",
      "registernummer": "HRA 5090",
      "registerart": "HRA",
      "company_name": "Felix Schnella e.K.",
      "company_seat": "Bad Nauheim",
      "details": "17.10.2024 (Bekanntmachungsdatum)\n\nHessen Amtsgericht Friedberg HRA 5090\nRegisterbekanntmachung nach dem Umwandlungsgesetz 17.10.2024 (Eintragungsdatum)\n\nFelix Schnella e.K.\nEinzelkaufmann / Einzelkauffrau\nBad Nauheim\n\nDen Gläubigern der an der Ausgliederung beteiligten Rechtsträger ist, wenn sie binnen sechs Monaten nach dem Tag, an dem die Eintragung der Ausgliederung in das Register des Sitzes desjenigen Rechtsträgers, dessen Gläubiger sie sind, nach §§ 125, 19 Absatz 3 UmwG bekannt gemacht worden ist, ihren Anspruch nach Grund und Höhe schriftlich anmelden, Sicherheit zu leisten, soweit sie nicht Befriedigung verlangen können. Dieses Recht steht den Gläubigern jedoch nur zu, wenn sie glaubhaft machen, dass durch die Ausgliederung die Erfüllung ihrer Forderung gefährdet wird."
    },
    {
      "date": "2024-10-17",
      "original_text": "Löschungsankündigung\nNordrhein-Westfalen Amtsgericht Gelsenkirchen HRA 5779\nFortuna Event und Promotion GmbH & Co.KG – Marl",
      "type": "Löschungsankündigung",
      "state": "Nordrhein-Westfalen",
      "amtsgericht": "Amtsgericht Gelsenkirchen",
      "registernummer": "HRA 5779",
      "registerart": "HRA",
      "company_name": "Fortuna Event und Promotion GmbH & Co.KG",
      "company_seat": "Marl",
      "details": "17.10.2024 (Bekanntmachungsdatum)\n\nNordrhein-Westfalen Amtsgericht Gelsenkirchen HRA 5779\nLöschungsankündigung\n\nFortuna Event und Promotion GmbH & Co.KG\nKommanditgesellschaft\nMarl\n\nDas Registergericht beabsichtigt die Firma von Amts wegen nach § 394 FamFG wegen Vermögenslosigkeit zu löschen. Die Frist zur Erhebung eines Widerspruchs ist auf einen Monat festgesetzt.\n\nRechtsbehelfsbelehrung:\n\nGegen diese Verfügung kann Widerspruch eingelegt werden.\n\nDer Widerspruch ist bei dem Amtsgericht Gelsenkirchen, Bochumer Straße 79, 45886 Gelsenkirchen schriftlich in deutscher Sprache oder zur Niederschrift der Geschäftsstelle einzulegen. Der Widerspruch kann auch zur Niederschrift der Geschäftsstelle eines jeden Amtsgerichtes abgegeben werden.\n\nDer Widerspruch muss spätestens innerhalb der gesetzten Frist bei dem Amtsgericht Gelsenkirchen eingegangen sein. Dies gilt auch dann, wenn der Widerspruch zur Niederschrift der Geschäftsstelle eines anderen Amtsgerichtes abgegeben wurde. Die Frist beginnt mit der Veröffentlichung. Fällt das Ende der Frist auf einen Sonntag, einen allgemeinen Feiertag oder Sonnabend, so endet die Frist mit Ablauf des nächsten Werktages.\n\nDer Widerspruch muss die Bezeichnung der angefochtenen Verfügung sowie die Erklärung enthalten, dass Widerspruch gegen diese Verfügung eingelegt wird. Er ist zu unterzeichnen und soll begründet werden.\n\nHinweis zum elektronischen Rechtsverkehr:\nDie Einlegung ist auch durch Übertragung eines elektronischen Dokuments an die elektronische Poststelle des Gerichts möglich. Das elektronische Dokument muss für die Bearbeitung durch das Gericht geeignet und mit einer qualifizierten elektronischen Signatur der verantwortenden Person versehen sein oder von der verantwortenden Person signiert und auf einem sicheren Übermittlungsweg gemäß § 130a ZPO nach näherer Maßgabe der Verordnung über die technischen Rahmenbedingungen des elektronischen Rechtsverkehrs und über das besondere elektronische Behördenpostfach (BGBl. 2017 I, S. 3803) eingereicht werden. Auf die Pflicht zur elektronischen Einreichung durch professionelle Einreicher/innen ab dem 01.01.2022 durch das Gesetz zum Ausbau des elektronischen Rechtsverkehrs mit den Gerichten vom 10. Oktober 2013, das Gesetz zur Einführung der elektronischen Akte in der Justiz und zur weiteren Förderung des elektronischen Rechtsverkehrs vom 5. Juli 2017 und das Gesetz zum Ausbau des elektronischen Rechtsverkehrs mit den Gerichten und zur Änderung weiterer Vorschriften vom 05.10.2021 wird hingewiesen.\nWeitere Informationen erhalten Sie auf der Internetseite www.justiz.de"
    },
    {
      "date": "2024-10-17",
      "original_text": "Registerbekanntmachung nach dem Umwandlungsgesetz\nNordrhein-Westfalen Amtsgericht Dortmund GsR 191\nFrrokaj + Balaj eGbR – Dortmund",
      "type": "Registerbekanntmachung nach dem Umwandlungsgesetz",
      "state": "Nordrhein-Westfalen",
      "amtsgericht": "Amtsgericht Dortmund",
      "registernummer": "GsR 191",
      "registerart": "GsR",
      "company_name": "Frrokaj + Balaj eGbR",
      "company_seat": "Dortmund",
      "details": "17.10.2024 (Bekanntmachungsdatum)\n\nNordrhein-Westfalen Amtsgericht Dortmund GsR 191\nRegisterbekanntmachung nach dem Umwandlungsgesetz 17.10.2024 (Eintragungsdatum)\n\nFrrokaj + Balaj eGbR\nGesellschaft bürgerlichen Rechts\nDortmund\n\nDen Gläubigern der an Verschmelzung beteiligten Rechtsträger ist, wenn sie binnen sechs Monaten nach dem Tag, an dem die Eintragung der Verschmelzung in das Register des Sitzes desjenigen Rechtsträgers, dessen Gläubiger sie sind, nach § 19 Absatz 3 UmwG als bekanntgemacht gilt, ihren Anspruch nach Grund und Höhe schriftlich anmelden, Sicherheit zu leisten, soweit sie nicht Befriedigung verlangen können. Dieses Recht steht den Gläubigern jedoch nur zu, wenn sie glaubhaft machen, dass durch die Verschmelzung die Erfüllung ihrer Forderung gefährdet wird."
    },
    {
      "date": "2024-10-17",
      "original_text": "Sonstige Registerbekanntmachung\nBerlin Amtsgericht Berlin (Charlottenburg) HRB 267135\nGE Grid GmbH – Berlin",
      "type": "Sonstige Registerbekanntmachung",
      "state": "Berlin",
      "amtsgericht": "Amtsgericht Berlin (Charlottenburg)",
      "registernummer": "HRB 267135",
      "registerart": "HRB",
      "company_name": "GE Grid GmbH",
      "company_seat": "Berlin",
      "details": "17.10.2024 (Bekanntmachungsdatum)\n\nBerlin Amtsgericht Berlin (Charlottenburg) HRB 267135\nSonstige Registerbekanntmachung\n\nGE Grid GmbH\nGesellschaft mit beschränkter Haftung\nBerlin\n\nAls nicht eingetragen wird veröffentlicht: Es wurde eine neue Liste der Aufsichtsratsmitglieder eingereicht (§52 GmbHG)."
    },
    {
      "date": "2024-10-17",
      "original_text": "Einreichung neuer Dokumente\nHessen Amtsgericht Marburg HRB 5629\nGSK Vaccines GmbH – Marburg",
      "type": "Einreichung neuer Dokumente",
      "state": "Hessen",
      "amtsgericht": "Amtsgericht Marburg",
      "registernummer": "HRB 5629",
      "registerart": "HRB",
      "company_name": "GSK Vaccines GmbH",
      "company_seat": "Marburg",
      "details": "17.10.2024 (Bekanntmachungsdatum)\n\nHessen Amtsgericht Marburg HRB 5629\nEinreichung neuer Dokumente\n\nGSK Vaccines GmbH\nGesellschaft mit beschränkter Haftung\nMarburg\n\nDurch eine Änderung in den Personen der Aufsichtsratsmitglieder ist eine Liste der Mitglieder des Aufsichtsrates zum Handelsregister eingereicht worden."
    },
    {
      "date": "2024-10-17",
      "original_text": "Registerbekanntmachung nach dem Umwandlungsgesetz\nSachsen-Anhalt Amtsgericht Stendal HRA 7970\nGebäudeservice Scheibler GmbH & Co. KG – Halberstadt",
      "type": "Registerbekanntmachung nach dem Umwandlungsgesetz",
      "state": "Sachsen-Anhalt",
      "amtsgericht": "Amtsgericht Stendal",
      "registernummer": "HRA 7970",
      "registerart": "HRA",
      "company_name": "Gebäudeservice Scheibler GmbH & Co. KG",
      "company_seat": "Halberstadt",
      "details": "17.10.2024 (Bekanntmachungsdatum)\n\nSachsen-Anhalt Amtsgericht Stendal HRA 7970\nRegisterbekanntmachung nach dem Umwandlungsgesetz 17.10.2024 (Eintragungsdatum)\n\nGebäudeservice Scheibler GmbH & Co. KG\nKommanditgesellschaft\nHalberstadt\n\nNicht eingetragen:\nDen Gläubigern der an der Ausgliederung beteiligten Rechtsträger, ist wenn sie binnen sechs Monaten nach dem Tag, an dem die Eintragung der Ausgliederung nach §§125, 19 Abs. 3 UmwG als bekanntgemacht gilt, ihren Anspruch nach Grund und Höhe schriftlich anmelden, Sicherheit zu leisten, soweit sie nicht Befriedigung verlangen können. Diese Recht steht ihnen jedoch nur zu, wenn sie glaubhaft machen, dass durch die Ausgliederung die Erfüllung ihrer Forderung gefährdet wird."
    },
    {
      "date": "2024-10-17",
      "original_text": "Einreichung neuer Dokumente\nBaden-Württemberg Amtsgericht Mannheim HRB 200753\nGesellschaft für Stadterneuerung und Stadtentwicklung Baden-Baden mbH – Baden-Baden",
      "type": "Einreichung neuer Dokumente",
      "state": "Baden-Württemberg",
      "amtsgericht": "Amtsgericht Mannheim",
      "registernummer": "HRB 200753",
      "registerart": "HRB",
      "company_name": "Gesellschaft für Stadterneuerung und Stadtentwicklung Baden-Baden mbH",
      "company_seat": "Baden-Baden",
      "details": "17.10.2024 (Bekanntmachungsdatum)\n\nBaden-Württemberg Amtsgericht Mannheim HRB 200753\nEinreichung neuer Dokumente 17.10.2024 (Eintragungsdatum)\n\nGesellschaft für Stadterneuerung und Stadtentwicklung Baden-Baden mbH\nGesellschaft mit beschränkter Haftung\nBaden-Baden\n\nDie Gesellschaft hat am 09.10.2024 zwei Listen über die Zusammensetzung des Aufsichtsrats zum Handelsregister eingereicht."
    },
    {
      "date": "2024-10-17",
      "original_text": "Registerbekanntmachung nach dem Umwandlungsgesetz\nSchleswig-Holstein Amtsgericht Kiel HRA 7264\nGiovanni L. Holstentörn Kiel GmbH & Co. KG – Kiel",
      "type": "Registerbekanntmachung nach dem Umwandlungsgesetz",
      "state": "Schleswig-Holstein",
      "amtsgericht": "Amtsgericht Kiel",
      "registernummer": "HRA 7264",
      "registerart": "HRA",
      "company_name": "Giovanni L. Holstentörn Kiel GmbH & Co. KG",
      "company_seat": "Kiel",
      "details": "17.10.2024 (Bekanntmachungsdatum)\n\nSchleswig-Holstein Amtsgericht Kiel HRA 7264\nRegisterbekanntmachung nach dem Umwandlungsgesetz 11.10.2024 (Eintragungsdatum)\n\nGiovanni L. Holstentörn Kiel GmbH & Co. KG\nKommanditgesellschaft\nKiel\n\nZu Eintragungsnummer 6 vom 11.10.2024 wird als nicht eingetragen veröffentlicht:  Als nicht eingetragen wird veröffentlicht: Den Gläubigern der an der Verschmelzung beteiligten Rechtsträger ist, wenn sie binnen sechs Monaten nach dem Tag, an dem die Eintragung der Verschmelzung in das Register des Sitzes desjenigen Rechtsträgers, dessen Gläubiger sie sind, nach § 19 Abs. 3 UmwG bekannt gemacht worden ist, ihren Anspruch nach Grund und Höhe schriftlich anmelden, Sicherheit zu leisten, soweit sie nicht Befriedigung verlangen können. Dieses Recht steht den Gläubigern jedoch nur zu, wenn sie glaubhaft machen, dass durch die Verschmelzung die Erfüllung ihrer Forderung gefährdet wird."
    },
    {
      "date": "2024-10-17",
      "original_text": "Registerbekanntmachung nach dem Umwandlungsgesetz\nRheinland-Pfalz Amtsgericht Koblenz HRA 23017\nGoodVillage e.K. – Koblenz",
      "type": "Registerbekanntmachung nach dem Umwandlungsgesetz",
      "state": "Rheinland-Pfalz",
      "amtsgericht": "Amtsgericht Koblenz",
      "registernummer": "HRA 23017",
      "registerart": "HRA",
      "company_name": "GoodVillage e.K.",
      "company_seat": "Koblenz",
      "details": "17.10.2024 (Bekanntmachungsdatum)\n\nRheinland-Pfalz Amtsgericht Koblenz HRA 23017\nRegisterbekanntmachung nach dem Umwandlungsgesetz 17.10.2024 (Eintragungsdatum)\n\nGoodVillage e.K.\nEinzelkaufmann / Einzelkauffrau\nKoblenz\n\nAls nicht eingetragen wird veröffentlicht: Den Gläubigern der an der Ausgliederung beteiligten Rechtsträger ist, wenn sie binnen sechs Monaten nac hdem Tag, an dem die Eintragung der Ausgliederung in das Register des Sitzes desjenigen Rechtsträgers,dessen Gläubiger sie sind, nach § 19 Abs. 3 UmwG als bekannt gemacht gilt, ihren Anspruch nach Grund und Höhe schriftlich anmelden, Sicherheit zu leisten, soweit sie nicht Befriedigung verlangen können. Dieses Recht steht den Gläubigern jedoch nur zu, wenn sie glaubhaft machen, dass durch die Ausgliederung die Erfüllung der Forderung gefährdet wird."
    },
    {
      "date": "2024-10-17",
      "original_text": "Registerbekanntmachung nach dem Umwandlungsgesetz\nNordrhein-Westfalen Amtsgericht Düsseldorf HRB 72843\nGottfried Schultz Automobilhandels SE – Düsseldorf",
      "type": "Registerbekanntmachung nach dem Umwandlungsgesetz",
      "state": "Nordrhein-Westfalen",
      "amtsgericht": "Amtsgericht Düsseldorf",
      "registernummer": "HRB 72843",
      "registerart": "HRB",
      "company_name": "Gottfried Schultz Automobilhandels SE",
      "company_seat": "Düsseldorf",
      "details": "17.10.2024 (Bekanntmachungsdatum)\n\nNordrhein-Westfalen Amtsgericht Düsseldorf HRB 72843\nRegisterbekanntmachung nach dem Umwandlungsgesetz 17.10.2024 (Eintragungsdatum)\n\nGottfried Schultz Automobilhandels SE\nEuropäische Aktiengesellschaft (SE)\nDüsseldorf\n\nDen Gläubigern der an der Verschmelzung beteiligten Rechtsträger ist, wenn sie binnen sechs Monaten nach dem Tag, an dem die Eintragung der Verschmelzung in das Register des Sitzes desjenigen Rechtsträgers, dessen Gläubiger sie sind, nach § 19 Absatz 3 UmwG als bekanntgemacht gilt, ihren Anspruch nach Grund und Höhe schriftlich anmelden, Sicherheit zu leisten, soweit sie nicht Befriedigung verlangen können. Dieses Recht steht den Gläubigern jedoch nur zu, wenn sie glaubhaft machen, dass durch die Verschmelzung die Erfüllung ihrer Forderung gefährdet wird."
    },
    {
      "date": "2024-10-17",
      "original_text": "Registerbekanntmachung nach dem Umwandlungsgesetz\nSchleswig-Holstein Amtsgericht Lübeck HRB 7616\nGreater Union Media & Event GmbH – Lübeck",
      "type": "Registerbekanntmachung nach dem Umwandlungsgesetz",
      "state": "Schleswig-Holstein",
      "amtsgericht": "Amtsgericht Lübeck",
      "registernummer": "HRB 7616",
      "registerart": "HRB",
      "company_name": "Greater Union Media & Event GmbH",
      "company_seat": "Lübeck",
      "details": "17.10.2024 (Bekanntmachungsdatum)\n\nSchleswig-Holstein Amtsgericht Lübeck HRB 7616\nRegisterbekanntmachung nach dem Umwandlungsgesetz 17.10.2024 (Eintragungsdatum)\n\nGreater Union Media & Event GmbH\nGesellschaft mit beschränkter Haftung\nLübeck\n\nZu Eintragungsnummer 13 vom 17.10.2024 wird als nicht eingetragen veröffentlicht:\nDen Gläubigern der an der Verschmelzung beteiligten Rechtsträger ist, wenn sie binnen sechs Monaten nach dem Tag, an dem die Eintragung der Verschmelzung in das Register des Sitzes desjenigen Rechtsträgers, dessen Gläubiger sie sind, als bekannt gemacht gilt, ihren Anspruch nach Grund und Höhe schriftlich anmelden, Sicherheit zu leisten, soweit sie nicht Befriedigung verlangen können. Dieses Recht steht den Gläubigern jedoch nur zu, wenn sie glaubhaft machen, dass durch die Verschmelzung die Erfüllung ihrer Forderung gefährdet wird."
    },
    {
      "date": "2024-10-17",
      "original_text": "Registerbekanntmachung nach dem Umwandlungsgesetz\nSchleswig-Holstein Amtsgericht Lübeck HRB 6319\nGreater Union Theaters Management Mainz GmbH – Lübeck",
      "type": "Registerbekanntmachung nach dem Umwandlungsgesetz",
      "state": "Schleswig-Holstein",
      "amtsgericht": "Amtsgericht Lübeck",
      "registernummer": "HRB 6319",
      "registerart": "HRB",
      "company_name": "Greater Union Theaters Management Mainz GmbH",
      "company_seat": "Lübeck",
      "details": "17.10.2024 (Bekanntmachungsdatum)\n\nSchleswig-Holstein Amtsgericht Lübeck HRB 6319\nRegisterbekanntmachung nach dem Umwandlungsgesetz 17.10.2024 (Eintragungsdatum)\n\nGreater Union Theaters Management Mainz GmbH\nGesellschaft mit beschränkter Haftung\nLübeck\n\nZu Eintragungsnummer 6 vom 17.10.2024 wird als nicht eingetragen veröffentlicht:\nDen Gläubigern der an der Verschmelzung beteiligten Rechtsträger ist, wenn sie binnen sechs Monaten nach dem Tag, an dem die Eintragung der Verschmelzung in das Register des Sitzes desjenigen Rechtsträgers, dessen Gläubiger sie sind, als bekannt gemacht gilt, ihren Anspruch nach Grund und Höhe schriftlich anmelden, Sicherheit zu leisten, soweit sie nicht Befriedigung verlangen können. Dieses Recht steht den Gläubigern jedoch nur zu, wenn sie glaubhaft machen, dass durch die Verschmelzung die Erfüllung ihrer Forderung gefährdet wird."
    },
    {
      "date": "2024-10-17",
      "original_text": "Registerbekanntmachung nach dem Umwandlungsgesetz\nSachsen-Anhalt Amtsgericht Stendal HRB 3535\nGrundstücks- und Verwaltungs GmbH Gardelegen – Gardelegen",
      "type": "Registerbekanntmachung nach dem Umwandlungsgesetz",
      "state": "Sachsen-Anhalt",
      "amtsgericht": "Amtsgericht Stendal",
      "registernummer": "HRB 3535",
      "registerart": "HRB",
      "company_name": "Grundstücks- und Verwaltungs GmbH Gardelegen",
      "company_seat": "Gardelegen",
      "details": "17.10.2024 (Bekanntmachungsdatum)\n\nSachsen-Anhalt Amtsgericht Stendal HRB 3535\nRegisterbekanntmachung nach dem Umwandlungsgesetz 17.10.2024 (Eintragungsdatum)\n\nGrundstücks- und Verwaltungs GmbH Gardelegen\nGesellschaft mit beschränkter Haftung\nGardelegen\n\nNicht eingetragen:\nDen Gläubigern der an der Verschmelzung beteiligten Rechtsträger ist, wenn sie binnen sechs Monaten nach dem Tag, an dem die Eintragung der Verschmelzung nach § 19 Abs. 3 UmwG als bekanntgemacht gilt, ihren Anspruch nach Grund und Höhe schriftlich anmelden, Sicherheit zu leisten, soweit sie nicht Befriedigung verlangen können. Dieses Recht steht ihnen jedoch nur zu, wenn sie glaubhaft machen, dass durch die Verschmelzung die Erfüllung ihrer Forderung gefährdet wird."
    },
    {
      "date": "2024-10-17",
      "original_text": "Registerbekanntmachung nach dem Umwandlungsgesetz\nSchleswig-Holstein Amtsgericht Pinneberg GsR 375\nGörz & Barreto Quickborn eGbR – Quickborn/Krs. Pinneberg",
      "type": "Registerbekanntmachung nach dem Umwandlungsgesetz",
      "state": "Schleswig-Holstein",
      "amtsgericht": "Amtsgericht Pinneberg",
      "registernummer": "GsR 375",
      "registerart": "GsR",
      "company_name": "Görz & Barreto Quickborn eGbR",
      "company_seat": "Quickborn/Krs. Pinneberg",
      "details": "17.10.2024 (Bekanntmachungsdatum)\n\nSchleswig-Holstein Amtsgericht Pinneberg GsR 375\nRegisterbekanntmachung nach dem Umwandlungsgesetz 16.10.2024 (Eintragungsdatum)\n\nGörz & Barreto Quickborn eGbR\nGesellschaft bürgerlichen Rechts\nQuickborn/Krs. Pinneberg\n\nZu Eintragungsnummer 3 vom 16.10.2024 wird als nicht eingetragen veröffentlicht: Als nicht eingetragen wird veröffentlicht: Den Gläubigern ist, wenn sie binnen sechs Monaten nach dem Tag, an dem die Eintragung der Umwandlung als bekannt gemacht gilt, ihren Anspruch nach Grund und Höhe schriftlich anmelden, Sicherheit zu leisten, soweit sie nicht Befriedigung verlangen können. Dieses Recht steht den Gläubigern jedoch nur zu, wenn sie glaubhaft machen, dass durch die Umwandlung die Erfüllung ihrer Forderung gefährdet wird. Das Recht, Sicherheitsleistung zu verlangen, steht Gläubigern nicht zu, die im Falle der Insolvenz ein Recht auf vorzugsweise Befriedigung aus einer Deckungsmasse haben, die nach gesetzlicher Vorschrift zu ihrem Schutz errichtet und staatlich überwacht ist."
    },
    {
      "date": "2024-10-17",
      "original_text": "Löschungsankündigung\nBerlin Amtsgericht Berlin (Charlottenburg) HRB 217933\nHASPACO GmbH – Berlin",
      "type": "Löschungsankündigung",
      "state": "Berlin",
      "amtsgericht": "Amtsgericht Berlin (Charlottenburg)",
      "registernummer": "HRB 217933",
      "registerart": "HRB",
      "company_name": "HASPACO GmbH",
      "company_seat": "Berlin",
      "details": "17.10.2024 (Bekanntmachungsdatum)\n\nBerlin Amtsgericht Berlin (Charlottenburg) HRB 217933\nLöschungsankündigung\n\nHASPACO GmbH\nGesellschaft mit beschränkter Haftung\nBerlin\n\nBei der nachstehenden Gesellschaft wird das Amtslöschungsverfahren gemäß § 394 FamFG eingeleitet. Widerspruchsfrist 6 Wochen"
    },
    {
      "date": "2024-10-17",
      "original_text": "Registerbekanntmachung nach dem Umwandlungsgesetz\nSachsen-Anhalt Amtsgericht Stendal HRA 7695\nHausmeisterservice Scheibler e.K. – Halberstadt",
      "type": "Registerbekanntmachung nach dem Umwandlungsgesetz",
      "state": "Sachsen-Anhalt",
      "amtsgericht": "Amtsgericht Stendal",
      "registernummer": "HRA 7695",
      "registerart": "HRA",
      "company_name": "Hausmeisterservice Scheibler e.K.",
      "company_seat": "Halberstadt",
      "details": "17.10.2024 (Bekanntmachungsdatum)\n\nSachsen-Anhalt Amtsgericht Stendal HRA 7695\nRegisterbekanntmachung nach dem Umwandlungsgesetz 17.10.2024 (Eintragungsdatum)\n\nHausmeisterservice Scheibler e.K.\nEinzelkaufmann / Einzelkauffrau\nHalberstadt\n\nNicht eingetragen:\nDen Gläubigern der an der Ausgliederung beteiligten Rechtsträger, ist wenn sie binnen sechs Monaten nach dem Tag, an dem die Eintragung der Ausgliederung nach §§125, 19 Abs. 3 UmwG als bekanntgemacht gilt, ihren Anspruch nach Grund und Höhe schriftlich anmelden, Sicherheit zu leisten, soweit sie nicht Befriedigung verlangen können. Diese Recht steht ihnen jedoch nur zu, wenn sie glaubhaft machen, dass durch die Ausgliederung die Erfüllung ihrer Forderung gefährdet wird."
    },
    {
      "date": "2024-10-17",
      "original_text": "Registerbekanntmachung nach dem Umwandlungsgesetz\nSchleswig-Holstein Amtsgericht Kiel HRB 27291\nIGB Internationale Grundwert Beteiligungs GmbH – Norderstedt",
      "type": "Registerbekanntmachung nach dem Umwandlungsgesetz",
      "state": "Schleswig-Holstein",
      "amtsgericht": "Amtsgericht Kiel",
      "registernummer": "HRB 27291",
      "registerart": "HRB",
      "company_name": "IGB Internationale Grundwert Beteiligungs GmbH",
      "company_seat": "Norderstedt",
      "details": "17.10.2024 (Bekanntmachungsdatum)\n\nSchleswig-Holstein Amtsgericht Kiel HRB 27291\nRegisterbekanntmachung nach dem Umwandlungsgesetz 16.10.2024 (Eintragungsdatum)\n\nIGB Internationale Grundwert Beteiligungs GmbH\nGesellschaft mit beschränkter Haftung\nNorderstedt\n\nZu Eintragungsnummer 3 vom 16.10.2024 wird als nicht eingetragen veröffentlicht: Den Gläubigern der an der Verschmelzung beteiligten Rechtsträger ist, wenn sie binnen sechs Monaten nach dem Tag, an dem die Eintragung der Verschmelzung in das Register des Sitzes desjenigen Rechtsträgers, dessen Gläubiger sie sind, nach § 19 Abs. 3 UmwG bekannt gemacht worden ist, ihren Anspruch nach Grund und Höhe schriftlich anmelden, Sicherheit zu leisten, soweit sie nicht Befriedigung verlangen können. Dieses Recht steht den Gläubigern jedoch nur zu, wenn sie glaubhaft machen, dass durch die Verschmelzung die Erfüllung ihrer Forderung gefährdet wird."
    },
    {
      "date": "2024-10-17",
      "original_text": "Registerbekanntmachung nach dem Umwandlungsgesetz\nSchleswig-Holstein Amtsgericht Kiel HRB 27291\nIGB Internationale Grundwert Beteiligungs GmbH – Norderstedt",
      "type": "Registerbekanntmachung nach dem Umwandlungsgesetz",
      "state": "Schleswig-Holstein",
      "amtsgericht": "Amtsgericht Kiel",
      "registernummer": "HRB 27291",
      "registerart": "HRB",
      "company_name": "IGB Internationale Grundwert Beteiligungs GmbH",
      "company_seat": "Norderstedt",
      "details": "17.10.2024 (Bekanntmachungsdatum)\n\nSchleswig-Holstein Amtsgericht Kiel HRB 27291\nRegisterbekanntmachung nach dem Umwandlungsgesetz 16.10.2024 (Eintragungsdatum)\n\nIGB Internationale Grundwert Beteiligungs GmbH\nGesellschaft mit beschränkter Haftung\nNorderstedt\n\nZu Eintragungsnummer 4 vom 16.10.2024 wird als nicht eingetragen veröffentlicht: Den Gläubigern der an der Verschmelzung beteiligten Rechtsträger ist, wenn sie binnen sechs Monaten nach dem Tag, an dem die Eintragung der Verschmelzung in das Register des Sitzes desjenigen Rechtsträgers, dessen Gläubiger sie sind, nach § 19 Abs. 3 UmwG bekannt gemacht worden ist, ihren Anspruch nach Grund und Höhe schriftlich anmelden, Sicherheit zu leisten, soweit sie nicht Befriedigung verlangen können. Dieses Recht steht den Gläubigern jedoch nur zu, wenn sie glaubhaft machen, dass durch die Verschmelzung die Erfüllung ihrer Forderung gefährdet wird."
    },
    {
      "date": "2024-10-17",
      "original_text": "Registerbekanntmachung nach dem Umwandlungsgesetz\nSchleswig-Holstein Amtsgericht Kiel HRB 27291\nIGB Internationale Grundwert Beteiligungs GmbH – Norderstedt",
      "type": "Registerbekanntmachung nach dem Umwandlungsgesetz",
      "state": "Schleswig-Holstein",
      "amtsgericht": "Amtsgericht Kiel",
      "registernummer": "HRB 27291",
      "registerart": "HRB",
      "company_name": "IGB Internationale Grundwert Beteiligungs GmbH",
      "company_seat": "Norderstedt",
      "details": "17.10.2024 (Bekanntmachungsdatum)\n\nSchleswig-Holstein Amtsgericht Kiel HRB 27291\nRegisterbekanntmachung nach dem Umwandlungsgesetz 16.10.2024 (Eintragungsdatum)\n\nIGB Internationale Grundwert Beteiligungs GmbH\nGesellschaft mit beschränkter Haftung\nNorderstedt\n\nZu Eintragungsnummer 5 vom 16.10.2024 wird als nicht eingetragen veröffentlicht:  Den Gläubigern der an der Verschmelzung beteiligten Rechtsträger ist, wenn sie binnen sechs Monaten nach dem Tag, an dem die Eintragung der Verschmelzung in das Register des Sitzes desjenigen Rechtsträgers, dessen Gläubiger sie sind, nach § 19 Abs. 3 UmwG bekannt gemacht worden ist, ihren Anspruch nach Grund und Höhe schriftlich anmelden, Sicherheit zu leisten, soweit sie nicht Befriedigung verlangen können. Dieses Recht steht den Gläubigern jedoch nur zu, wenn sie glaubhaft machen, dass durch die Verschmelzung die Erfüllung ihrer Forderung gefährdet wird."
    },
    {
      "date": "2024-10-17",
      "original_text": "Registerbekanntmachung nach dem Umwandlungsgesetz\nSchleswig-Holstein Amtsgericht Kiel HRB 27291\nIGB Internationale Grundwert Beteiligungs GmbH – Norderstedt",
      "type": "Registerbekanntmachung nach dem Umwandlungsgesetz",
      "state": "Schleswig-Holstein",
      "amtsgericht": "Amtsgericht Kiel",
      "registernummer": "HRB 27291",
      "registerart": "HRB",
      "company_name": "IGB Internationale Grundwert Beteiligungs GmbH",
      "company_seat": "Norderstedt",
      "details": "17.10.2024 (Bekanntmachungsdatum)\n\nSchleswig-Holstein Amtsgericht Kiel HRB 27291\nRegisterbekanntmachung nach dem Umwandlungsgesetz 16.10.2024 (Eintragungsdatum)\n\nIGB Internationale Grundwert Beteiligungs GmbH\nGesellschaft mit beschränkter Haftung\nNorderstedt\n\nZu Eintragungsnummer 6 vom 16.10.2024 wird als nicht eingetragen veröffentlicht:  Den Gläubigern der an der Verschmelzung beteiligten Rechtsträger ist, wenn sie binnen sechs Monaten nach dem Tag, an dem die Eintragung der Verschmelzung in das Register des Sitzes desjenigen Rechtsträgers, dessen Gläubiger sie sind, nach § 19 Abs. 3 UmwG bekannt gemacht worden ist, ihren Anspruch nach Grund und Höhe schriftlich anmelden, Sicherheit zu leisten, soweit sie nicht Befriedigung verlangen können. Dieses Recht steht den Gläubigern jedoch nur zu, wenn sie glaubhaft machen, dass durch die Verschmelzung die Erfüllung ihrer Forderung gefährdet wird."
    },
    {
      "date": "2024-10-17",
      "original_text": "Registerbekanntmachung nach dem Umwandlungsgesetz\nSchleswig-Holstein Amtsgericht Kiel HRB 27291\nIGB Internationale Grundwert Beteiligungs GmbH – Norderstedt",
      "type": "Registerbekanntmachung nach dem Umwandlungsgesetz",
      "state": "Schleswig-Holstein",
      "amtsgericht": "Amtsgericht Kiel",
      "registernummer": "HRB 27291",
      "registerart": "HRB",
      "company_name": "IGB Internationale Grundwert Beteiligungs GmbH",
      "company_seat": "Norderstedt",
      "details": "17.10.2024 (Bekanntmachungsdatum)\n\nSchleswig-Holstein Amtsgericht Kiel HRB 27291\nRegisterbekanntmachung nach dem Umwandlungsgesetz 16.10.2024 (Eintragungsdatum)\n\nIGB Internationale Grundwert Beteiligungs GmbH\nGesellschaft mit beschränkter Haftung\nNorderstedt\n\nZu Eintragungsnummer 2 vom 16.10.2024 wird als nicht eingetragen veröffentlicht:  Den Gläubigern der an der Verschmelzung beteiligten Rechtsträger ist, wenn sie binnen sechs Monaten nach dem Tag, an dem die Eintragung der Verschmelzung in das Register des Sitzes desjenigen Rechtsträgers, dessen Gläubiger sie sind, nach § 19 Abs. 3 UmwG bekannt gemacht worden ist, ihren Anspruch nach Grund und Höhe schriftlich anmelden, Sicherheit zu leisten, soweit sie nicht Befriedigung verlangen können. Dieses Recht steht den Gläubigern jedoch nur zu, wenn sie glaubhaft machen, dass durch die Verschmelzung die Erfüllung ihrer Forderung gefährdet wird."
    },
    {
      "date": "2024-10-17",
      "original_text": "Registerbekanntmachung nach dem Umwandlungsgesetz\nNordrhein-Westfalen Amtsgericht Iserlohn HRB 11097\nIhmertsche Liegenschaften GmbH – Iserlohn",
      "type": "Registerbekanntmachung nach dem Umwandlungsgesetz",
      "state": "Nordrhein-Westfalen",
      "amtsgericht": "Amtsgericht Iserlohn",
      "registernummer": "HRB 11097",
      "registerart": "HRB",
      "company_name": "Ihmertsche Liegenschaften GmbH",
      "company_seat": "Iserlohn",
      "details": "17.10.2024 (Bekanntmachungsdatum)\n\nNordrhein-Westfalen Amtsgericht Iserlohn HRB 11097\nRegisterbekanntmachung nach dem Umwandlungsgesetz 11.10.2024 (Eintragungsdatum)\n\nIhmertsche Liegenschaften GmbH\nGesellschaft mit beschränkter Haftung\nIserlohn\n\nDen Gläubigern der an der formwechselnden Umwandlung beteiligten Rechtsträger ist, wenn sie binnen sechs Monaten nach dem Tag, an dem die Eintragung der formwechselnden Umwandlung in das Register des Sitzes desjenigen Rechtsträgers, dessen Gläubiger sie sind, nach § 19 Absatz 3 UmwG als bekanntgemacht gilt, ihren Anspruch nach Grund und Höhe schriftlich anmelden, Sicherheit zu leisten, soweit sie nicht Befriedigung verlangen können. Dieses Recht steht den Gläubigern jedoch nur zu, wenn sie glaubhaft machen, dass durch die formwechselnden Umwandlung die Erfüllung ihrer Forderung gefährdet wird."
    },
    {
      "date": "2024-10-17",
      "original_text": "Löschungsankündigung\nHamburg Amtsgericht Hamburg VR 24574\nInternationaler Treffpunkt Cafe 49 e.V. – Hamburg",
      "type": "Löschungsankündigung",
      "state": "Hamburg",
      "amtsgericht": "Amtsgericht Hamburg",
      "registernummer": "VR 24574",
      "registerart": "VR",
      "company_name": "Internationaler Treffpunkt Cafe 49 e.V.",
      "company_seat": "Hamburg",
      "details": "17.10.2024 (Bekanntmachungsdatum)\n\nHamburg Amtsgericht Hamburg VR 24574\nLöschungsankündigung\n\nInternationaler Treffpunkt Cafe 49 e.V.\neingetragener Verein\nHamburg\n\nDas Registergericht beabsichtigt, den im Vereinsregister eingetragenen Verein von Amts wegen nach § 395 FamFG zu löschen, da nach den angestellten Ermittlungen dieser Verein offenbar nicht mehr besteht. Die Frist zur Erhebung eines Widerspruchs gegen die beabsichtigte Löschung wird auf 3 Monate festgesetzt."
    },
    {
      "date": "2024-10-17",
      "original_text": "Löschungsankündigung\nNordrhein-Westfalen Amtsgericht Neuss HRB 21347\nJAZ Dienstleistungen GmbH – Neuss",
      "type": "Löschungsankündigung",
      "state": "Nordrhein-Westfalen",
      "amtsgericht": "Amtsgericht Neuss",
      "registernummer": "HRB 21347",
      "registerart": "HRB",
      "company_name": "JAZ Dienstleistungen GmbH",
      "company_seat": "Neuss",
      "details": "17.10.2024 (Bekanntmachungsdatum)\n\nNordrhein-Westfalen Amtsgericht Neuss HRB 21347\nLöschungsankündigung 16.10.2024 (Eintragungsdatum)\n\nJAZ Dienstleistungen GmbH\nGesellschaft mit beschränkter Haftung\nNeuss\n\nDas Registergericht beabsichtigt die Gesellschaft wegen Vermögenslosigkeit aufgrund des § 394 Abs. 1 FamFG zu löschen. Frist zur Geltendmachung eines Widerspruchs: 1 Monat.\nRechtsbehelfsbelehrung:\nGegen diese Verfügung können Sie Widerspruch einlegen.\nDer Widerspruch ist bei dem Amtsgericht Neuss - Registergericht -, Breite Str. 48, 41460 Neuss schriftlich in deutscher Sprache oder zur Niederschrift der Geschäftsstelle einzulegen.\nDer Widerspruch kann auch zur Niederschrift der Geschäftsstelle eines jeden Amtsgerichtes abgegeben werden.\nDie Einlegung ist auch durch Übertragung eines elektronischen Dokuments an die elektronische Poststelle des Gerichts möglich. Das elektronische Dokument muss für die Bearbeitung durch das Gericht geeignet und mit einer qualifizierten elektronischen Signatur der verantwortenden Person versehen sein oder von der verantwortenden Person signiert und auf einem sicheren Übermittlungsweg gemäß § 130a ZPO nach näherer Maßgabe der Verordnung über die technischen Rahmenbedingungen des elektronischen Rechtsverkehrs und über das besondere elektronische Behördenpostfach (BGBl. I, S.3803) eingereicht werden. Weitere Informationen erhalten Sie auf der Internetseite www.justiz.de.\nDer Widerspruch muss spätestens innerhalb der gesetzten Frist nach der schriftlichen Bekanntgabe der Verfügung bei dem Amtsgericht - Registergericht - Neuss eingegangen sein. Dies gilt auch dann, wenn der Widerspruch zur Niederschrift der Geschäftsstelle eines anderen Amtsgerichtes abgegeben wurde. Die Frist beginnt mit der schriftlichen Bekanntgabe der Verfügung. Die Bekanntgabe ist entweder durch Zustellung oder am dritten Tage nach Aufgabe zur Post bewirkt. Fällt das Ende der Frist auf einen Sonntag, einen allgemeinen Feiertag oder Sonnabend, so endet die Frist mit Ablauf des nächsten Werktages.\nDer Widerspruch muss die Bezeichnung der angefochtenen Verfügung sowie die Erklärung enthalten, dass Widerspruch gegen diese Verfügung eingelegt wird. Er ist zu unterzeichnen und soll begründet werden."
    },
    {
      "date": "2024-10-17",
      "original_text": "Registerbekanntmachung nach dem Umwandlungsgesetz\nNordrhein-Westfalen Amtsgericht Dortmund HRB 35128\nK/S/R/ GmbH Wirtschaftsprüfungsgesellschaft – Dortmund",
      "type": "Registerbekanntmachung nach dem Umwandlungsgesetz",
      "state": "Nordrhein-Westfalen",
      "amtsgericht": "Amtsgericht Dortmund",
      "registernummer": "HRB 35128",
      "registerart": "HRB",
      "company_name": "K/S/R/ GmbH Wirtschaftsprüfungsgesellschaft",
      "company_seat": "Dortmund",
      "details": "17.10.2024 (Bekanntmachungsdatum)\n\nNordrhein-Westfalen Amtsgericht Dortmund HRB 35128\nRegisterbekanntmachung nach dem Umwandlungsgesetz 02.10.2024 (Eintragungsdatum)\n\nK/S/R/ GmbH Wirtschaftsprüfungsgesellschaft\nGesellschaft mit beschränkter Haftung\nDortmund\n\nDen Gläubigern der an der Verschmelzung beteiligten Rechtsträger ist, wenn sie binnen sechs Monaten nach dem Tag, an dem die Eintragung der Verschmelzung in das Register des Sitzes desjenigen Rechtsträgers, dessen Gläubiger sie sind, nach § 19 Absatz 3 UmwG als bekanntgemacht gilt, ihren Anspruch nach Grund und Höhe schriftlich anmelden, Sicherheit zu leisten, soweit sie nicht Befriedigung verlangen können. Dieses Recht steht den Gläubigern jedoch nur zu, wenn sie glaubhaft machen, dass durch die Verschmelzung die Erfüllung ihrer Forderung gefährdet wird."
    },
    {
      "date": "2024-10-17",
      "original_text": "Einreichung neuer Dokumente\nBaden-Württemberg Amtsgericht Mannheim HRB 708881\nKME Karlsruhe Marketing und Event GmbH – Karlsruhe",
      "type": "Einreichung neuer Dokumente",
      "state": "Baden-Württemberg",
      "amtsgericht": "Amtsgericht Mannheim",
      "registernummer": "HRB 708881",
      "registerart": "HRB",
      "company_name": "KME Karlsruhe Marketing und Event GmbH",
      "company_seat": "Karlsruhe",
      "details": "17.10.2024 (Bekanntmachungsdatum)\n\nBaden-Württemberg Amtsgericht Mannheim HRB 708881\nEinreichung neuer Dokumente\n\nKME Karlsruhe Marketing und Event GmbH\nGesellschaft mit beschränkter Haftung\nKarlsruhe\n\nDie Gesellschaft hat am 16.10.2024 die Liste über die Zusammensetzung des Aufsichtsrats zum Handelsregister eingereicht."
    },
    {
      "date": "2024-10-17",
      "original_text": "Löschungsankündigung\nBaden-Württemberg Amtsgericht Ulm HRB 4877\nKONTEK Messtechnik GmbH – Blaubeuren",
      "type": "Löschungsankündigung",
      "state": "Baden-Württemberg",
      "amtsgericht": "Amtsgericht Ulm",
      "registernummer": "HRB 4877",
      "registerart": "HRB",
      "company_name": "KONTEK Messtechnik GmbH",
      "company_seat": "Blaubeuren",
      "details": "17.10.2024 (Bekanntmachungsdatum)\n\nBaden-Württemberg Amtsgericht Ulm HRB 4877\nLöschungsankündigung\n\nKONTEK Messtechnik GmbH\nGesellschaft mit beschränkter Haftung\nBlaubeuren\n\nAls nicht eingetragen wird bekanntgemacht:\nDas Gericht beabsichtigt, die Gesellschaft wegen Vermögenslosigkeit im Handelsregister von Amts wegen nach § 394 FamFG zu löschen. Die Frist zur Geltendmachung eines Widerspruchs gegen die beabsichtigte Löschung ist auf  einen Monat ab Veröffentlichung bestimmt."
    },
    {
      "date": "2024-10-17",
      "original_text": "Registerbekanntmachung nach dem Umwandlungsgesetz\nNordrhein-Westfalen Amtsgericht Köln HRB 36170\nKONTEXT Gesellschaft für Psychosoziale Dienste GmbH – Köln",
      "type": "Registerbekanntmachung nach dem Umwandlungsgesetz",
      "state": "Nordrhein-Westfalen",
      "amtsgericht": "Amtsgericht Köln",
      "registernummer": "HRB 36170",
      "registerart": "HRB",
      "company_name": "KONTEXT Gesellschaft für Psychosoziale Dienste GmbH",
      "company_seat": "Köln",
      "details": "17.10.2024 (Bekanntmachungsdatum)\n\nNordrhein-Westfalen Amtsgericht Köln HRB 36170\nRegisterbekanntmachung nach dem Umwandlungsgesetz 17.10.2024 (Eintragungsdatum)\n\nKONTEXT Gesellschaft für Psychosoziale Dienste GmbH\nGesellschaft mit beschränkter Haftung\nKöln\n\nDen Gläubigern der an der Verschmelzung beteiligten Rechtsträger ist, wenn sie binnen sechs Monaten nach dem Tag, an dem die Eintragung der Verschmelzung in das Register des Sitzes desjenigen Rechtsträgers, dessen Gläubiger sie sind, nach § 19 Absatz 3 UmwG als bekanntgemacht gilt, ihren Anspruch nach Grund und Höhe schriftlich anmelden, Sicherheit zu leisten, soweit sie nicht Befriedigung verlangen können. Dieses Recht steht den Gläubigern jedoch nur zu, wenn sie glaubhaft machen, dass durch die Verschmelzung die Erfüllung ihrer Forderung gefährdet wird."
    },
    {
      "date": "2024-10-17",
      "original_text": "Registerbekanntmachung nach dem Umwandlungsgesetz\nSachsen Amtsgericht Dresden HRB 31676\nKanuk GmbH – Klingenberg",
      "type": "Registerbekanntmachung nach dem Umwandlungsgesetz",
      "state": "Sachsen",
      "amtsgericht": "Amtsgericht Dresden",
      "registernummer": "HRB 31676",
      "registerart": "HRB",
      "company_name": "Kanuk GmbH",
      "company_seat": "Klingenberg",
      "details": "17.10.2024 (Bekanntmachungsdatum)\n\nSachsen Amtsgericht Dresden HRB 31676\nRegisterbekanntmachung nach dem Umwandlungsgesetz 17.10.2024 (Eintragungsdatum)\n\nKanuk GmbH\nGesellschaft mit beschränkter Haftung\nKlingenberg\n\nDen Gläubigern der an der Verschmelzung beteiligten Rechtsträger ist, wenn sie binnen sechs Monaten nach dem Tag, an dem die Eintragung der Verschmelzung in das Register des Sitzes desjenigen Rechtsträgers, dessen Gläubiger sie sind, nach § 19 Abs. 3 UmwG als bekannt gemacht gilt, ihren Anspruch nach Grund und Höhe schriftlich anmelden, Sicherheit zu leisten, soweit sie nicht Befriedigung verlangen können. Dieses Recht steht den Gläubigern jedoch nur zu, wenn sie glaubhaft machen, dass durch die Verschmelzung die Erfüllung der Forderung gefährdet wird."
    },
    {
      "date": "2024-10-17",
      "original_text": "Löschungsankündigung\nSaarland Amtsgericht Saarbrücken HRB 75240\nKirsch GmbH – Rehlingen-Siersburg",
      "type": "Löschungsankündigung",
      "state": "Saarland",
      "amtsgericht": "Amtsgericht Saarbrücken",
      "registernummer": "HRB 75240",
      "registerart": "HRB",
      "company_name": "Kirsch GmbH",
      "company_seat": "Rehlingen-Siersburg",
      "details": "17.10.2024 (Bekanntmachungsdatum)\n\nSaarland Amtsgericht Saarbrücken HRB 75240\nLöschungsankündigung\n\nKirsch GmbH\nGesellschaft mit beschränkter Haftung\nRehlingen-Siersburg\n\nEs ist beabsichtigt, die Gesellschaft von Amts wegen gemäß § 394 FamFG wegen Vermögenslosigkeit zu löschen.\nGegen die Löschung von Amts wegen ist das Rechtsmittel des Widerspruchs statthaft. Der Widerspruch ist binnen einer Frist zwei Monaten beginnend mit dem Tag dieser Veröffentlichung durch Einreichen eines Widerspruchsschreibens -schriftlich oder zur Niederschrift der Geschäftsstelle beim Amtsgericht Saarbrücken, -zentrales Handelsregister-, Mainzerstr.178, 66121 Saarbrücken einzulegen.\nDer Widerspruch muss die Bezeichnung der angefochtenen Löschungsankündigung enthalten sowie die Erklärung, dass Widerspruch eingelegt wird. Er ist vom Widerspruchsführer oder seinem Bevollmächtigten zu unterzeichnen.\nDas Widerspruchsschreiben kann auch in der Form eines elektronischen Dokumentes eingereicht werden, das mit einer qualifizierten elektronischen Signatur nach dem Signaturgesetz versehen sein muss (§§ 14 Abs. 2 FamFG, 130a, 298 ZPO)."
    },
    {
      "date": "2024-10-17",
      "original_text": "Registerbekanntmachung nach dem Umwandlungsgesetz\nNordrhein-Westfalen Amtsgericht Köln HRA 37665\nKlassische Fahrzeuge Inhaber Mario Engels e.K. – Elsdorf",
      "type": "Registerbekanntmachung nach dem Umwandlungsgesetz",
      "state": "Nordrhein-Westfalen",
      "amtsgericht": "Amtsgericht Köln",
      "registernummer": "HRA 37665",
      "registerart": "HRA",
      "company_name": "Klassische Fahrzeuge Inhaber Mario Engels e.K.",
      "company_seat": "Elsdorf",
      "details": "17.10.2024 (Bekanntmachungsdatum)\n\nNordrhein-Westfalen Amtsgericht Köln HRA 37665\nRegisterbekanntmachung nach dem Umwandlungsgesetz 17.10.2024 (Eintragungsdatum)\n\nKlassische Fahrzeuge Inhaber Mario Engels e.K.\nEinzelkaufmann / Einzelkauffrau\nElsdorf\n\nDen Gläubigern der an der Ausgliederung beteiligten Rechtsträger ist, wenn sie binnen sechs Monaten nach dem Tag, an dem die Eintragung der Ausgliederung in das Register des Sitzes derjenigen Rechtsträger deren Gläubiger sie sind, nach § 19 Absatz 3 UmwG als bekanntgemacht gilt, ihren Anspruch nach Grund und Höhe schriftlich anmelden, Sicherheit zu leisten, soweit sie nicht Befriedigung verlangen können. Dieses Recht steht den Gläubigern jedoch nur zu, wenn sie glaubhaft machen, dass durch die Ausgliederung die Erfüllung ihrer Forderung gefährdet wird."
    },
    {
      "date": "2024-10-17",
      "original_text": "Registerbekanntmachung nach dem Umwandlungsgesetz\nNordrhein-Westfalen Amtsgericht Köln HRB 119983\nKlassische Fahrzeuge Mario Engels GmbH – Elsdorf",
      "type": "Registerbekanntmachung nach dem Umwandlungsgesetz",
      "state": "Nordrhein-Westfalen",
      "amtsgericht": "Amtsgericht Köln",
      "registernummer": "HRB 119983",
      "registerart": "HRB",
      "company_name": "Klassische Fahrzeuge Mario Engels GmbH",
      "company_seat": "Elsdorf",
      "details": "17.10.2024 (Bekanntmachungsdatum)\n\nNordrhein-Westfalen Amtsgericht Köln HRB 119983\nRegisterbekanntmachung nach dem Umwandlungsgesetz 17.10.2024 (Eintragungsdatum)\n\nKlassische Fahrzeuge Mario Engels GmbH\nGesellschaft mit beschränkter Haftung\nElsdorf\n\nDen Gläubigern der an der Ausgliederung beteiligten Rechtsträger ist, wenn sie binnen sechs Monaten nach dem Tag, an dem die Eintragung der Ausgliederung in das Register des Sitzes desjenigen Rechtsträgers, dessen Gläubiger sie sind, nach § 19 Absatz 3 UmwG als bekanntgemacht gilt, ihren Anspruch nach Grund und Höhe schriftlich anmelden, Sicherheit zu leisten, soweit sie nicht Befriedigung verlangen können. Dieses Recht steht den Gläubigern jedoch nur zu, wenn sie glaubhaft machen, dass durch die Ausgliederung die Erfüllung ihrer Forderung gefährdet wird."
    },
    {
      "date": "2024-10-17",
      "original_text": "Löschungsankündigung\nNordrhein-Westfalen Amtsgericht Köln HRA 35576\nKlauter Industriemontagen e.K. – Kerpen",
      "type": "Löschungsankündigung",
      "state": "Nordrhein-Westfalen",
      "amtsgericht": "Amtsgericht Köln",
      "registernummer": "HRA 35576",
      "registerart": "HRA",
      "company_name": "Klauter Industriemontagen e.K.",
      "company_seat": "Kerpen",
      "details": "17.10.2024 (Bekanntmachungsdatum)\n\nNordrhein-Westfalen Amtsgericht Köln HRA 35576\nLöschungsankündigung\n\nKlauter Industriemontagen e.K.\nEinzelkaufmann / Einzelkauffrau\nKerpen\n\nDas Registergericht beabsichtigt nachfolgende Firmen von Amts wegen wegen Aufgabe des Betriebs nach § 31 Abs. 2 HGB zu löschen. Die Frist zur Erhebung eines Widerspruchs ist auf 1 Monat festgesetzt."
    },
    {
      "date": "2024-10-17",
      "original_text": "Löschungsankündigung\nRheinland-Pfalz Amtsgericht Landau HRB 32799\nKlemm Gastronomie UG (haftungsbeschränkt) – Bad Bergzabern",
      "type": "Löschungsankündigung",
      "state": "Rheinland-Pfalz",
      "amtsgericht": "Amtsgericht Landau",
      "registernummer": "HRB 32799",
      "registerart": "HRB",
      "company_name": "Klemm Gastronomie UG (haftungsbeschränkt)",
      "company_seat": "Bad Bergzabern",
      "details": "17.10.2024 (Bekanntmachungsdatum)\n\nRheinland-Pfalz Amtsgericht Landau HRB 32799\nLöschungsankündigung\n\nKlemm Gastronomie UG (haftungsbeschränkt)\nGesellschaft mit beschränkter Haftung\nBad Bergzabern\n\nDas Registergericht beabsichtigt die Gesellschaft von Amts wegen nach § 394 FamFG zu löschen. Die Frist zur Erhebung eines Widerspruchs ist auf einen Monat festgesetzt."
    },
    {
      "date": "2024-10-17",
      "original_text": "Registerbekanntmachung nach dem Umwandlungsgesetz\nBaden-Württemberg Amtsgericht Freiburg HRB 731864\nKnobloch Sportwagen GmbH – Appenweier",
      "type": "Registerbekanntmachung nach dem Umwandlungsgesetz",
      "state": "Baden-Württemberg",
      "amtsgericht": "Amtsgericht Freiburg",
      "registernummer": "HRB 731864",
      "registerart": "HRB",
      "company_name": "Knobloch Sportwagen GmbH",
      "company_seat": "Appenweier",
      "details": "17.10.2024 (Bekanntmachungsdatum)\n\nBaden-Württemberg Amtsgericht Freiburg HRB 731864\nRegisterbekanntmachung nach dem Umwandlungsgesetz 17.10.2024 (Eintragungsdatum)\n\nKnobloch Sportwagen GmbH\nGesellschaft mit beschränkter Haftung\nAppenweier\n\nAls nicht eingetragen wird bekanntgemacht:\nDen Gläubigern der an der Ausgliederung beteiligten Rechtsträger ist, wenn sie binnen sechs Monaten nach dem Tag, an dem die Eintragung der Ausgliederung in das Register des Sitzes desjenigen Rechtsträgers, dessen Gläubiger sie sind, nach § 19 Abs. 3 UmwG als bekanntgemacht gilt, ihren Anspruch nach Grund und Höhe schriftlich anmelden, Sicherheit zu leisten, soweit sie nicht Befriedigung verlangen können. Dieses Recht steht den Gläubigern jedoch nur zu, wenn sie glaubhaft machen, dass durch die Ausgliederung die Erfüllung ihrer Forderung gefährdet wird."
    },
    {
      "date": "2024-10-17",
      "original_text": "Registerbekanntmachung nach dem Umwandlungsgesetz\nBaden-Württemberg Amtsgericht Freiburg HRA 708677\nKnobloch Sportwagen e.K. – Appenweier",
      "type": "Registerbekanntmachung nach dem Umwandlungsgesetz",
      "state": "Baden-Württemberg",
      "amtsgericht": "Amtsgericht Freiburg",
      "registernummer": "HRA 708677",
      "registerart": "HRA",
      "company_name": "Knobloch Sportwagen e.K.",
      "company_seat": "Appenweier",
      "details": "17.10.2024 (Bekanntmachungsdatum)\n\nBaden-Württemberg Amtsgericht Freiburg HRA 708677\nRegisterbekanntmachung nach dem Umwandlungsgesetz 17.10.2024 (Eintragungsdatum)\n\nKnobloch Sportwagen e.K.\nEinzelkaufmann / Einzelkauffrau\nAppenweier\n\nAls nicht eingetragen wird bekanntgemacht:\nDen Gläubigern der an der Ausgliederung beteiligten Rechtsträger ist, wenn sie binnen sechs Monaten nach dem Tag, an dem die Eintragung der Ausgliederung in das Register des Sitzes desjenigen Rechtsträgers, dessen Gläubiger sie sind, nach § 19 Abs. 3 UmwG als bekanntgemacht gilt, ihren Anspruch nach Grund und Höhe schriftlich anmelden, Sicherheit zu leisten, soweit sie nicht Befriedigung verlangen können. Dieses Recht steht den Gläubigern jedoch nur zu, wenn sie glaubhaft machen, dass durch die Ausgliederung die Erfüllung ihrer Forderung gefährdet wird."
    },
    {
      "date": "2024-10-17",
      "original_text": "Einreichung neuer Dokumente\nBaden-Württemberg Amtsgericht Mannheim HRB 240219\nKommunalbau GmbH Gesellschaft für Stadterneuerung und Stadtentwicklung Bretten – Bretten",
      "type": "Einreichung neuer Dokumente",
      "state": "Baden-Württemberg",
      "amtsgericht": "Amtsgericht Mannheim",
      "registernummer": "HRB 240219",
      "registerart": "HRB",
      "company_name": "Kommunalbau GmbH Gesellschaft für Stadterneuerung und Stadtentwicklung Bretten",
      "company_seat": "Bretten",
      "details": "17.10.2024 (Bekanntmachungsdatum)\n\nBaden-Württemberg Amtsgericht Mannheim HRB 240219\nEinreichung neuer Dokumente\n\nKommunalbau GmbH Gesellschaft für Stadterneuerung und Stadtentwicklung Bretten\nGesellschaft mit beschränkter Haftung\nBretten\n\nDie Gesellschaft hat am 15.10.2024 die Liste über die Zusammensetzung des Aufsichtsrats zum Handelsregister eingereicht."
    },
    {
      "date": "2024-10-17",
      "original_text": "Löschungsankündigung\nMecklenburg-Vorpommern Amtsgericht Stralsund HRA 463\nKorbwerk Heringsdorf GmbH & Co. Betriebs KG – Heringsdorf",
      "type": "Löschungsankündigung",
      "state": "Mecklenburg-Vorpommern",
      "amtsgericht": "Amtsgericht Stralsund",
      "registernummer": "HRA 463",
      "registerart": "HRA",
      "company_name": "Korbwerk Heringsdorf GmbH & Co. Betriebs KG",
      "company_seat": "Heringsdorf",
      "details": "17.10.2024 (Bekanntmachungsdatum)\n\nMecklenburg-Vorpommern Amtsgericht Stralsund HRA 463\nLöschungsankündigung\n\nKorbwerk Heringsdorf GmbH & Co. Betriebs KG\nKommanditgesellschaft\nHeringsdorf\n\nDas Registergericht beabsichtigt, die im Handelsregister eingetragene Gesellschaft von Amts wegen nach § 394 FamFG zu löschen. Die Frist zur Erhebung eines Widerspruchs ist auf 1 Monat festgesetzt."
    },
    {
      "date": "2024-10-17",
      "original_text": "Löschungsankündigung\nNordrhein-Westfalen Amtsgericht Düren HRB 7008\nLED WV Verwaltungs GmbH – Nettersheim",
      "type": "Löschungsankündigung",
      "state": "Nordrhein-Westfalen",
      "amtsgericht": "Amtsgericht Düren",
      "registernummer": "HRB 7008",
      "registerart": "HRB",
      "company_name": "LED WV Verwaltungs GmbH",
      "company_seat": "Nettersheim",
      "details": "17.10.2024 (Bekanntmachungsdatum)\n\nNordrhein-Westfalen Amtsgericht Düren HRB 7008\nLöschungsankündigung\n\nLED WV Verwaltungs GmbH\nGesellschaft mit beschränkter Haftung\nNettersheim\n\nDas Registergericht beabsichtigt die Gesellschaft von Amts wegen nach § 394 FamFG zu löschen. Die Frist zur Erhebung eines Widerspruchs ist auf drei Monate festgesetzt."
    },
    {
      "date": "2024-10-17",
      "original_text": "Löschungsankündigung\nBaden-Württemberg Amtsgericht Freiburg HRB 380345\nLange Beteiligungsgesellschaft mit beschränkter Haftung – Konstanz",
      "type": "Löschungsankündigung",
      "state": "Baden-Württemberg",
      "amtsgericht": "Amtsgericht Freiburg",
      "registernummer": "HRB 380345",
      "registerart": "HRB",
      "company_name": "Lange Beteiligungsgesellschaft mit beschränkter Haftung",
      "company_seat": "Konstanz",
      "details": "17.10.2024 (Bekanntmachungsdatum)\n\nBaden-Württemberg Amtsgericht Freiburg HRB 380345\nLöschungsankündigung 17.10.2024 (Eintragungsdatum)\n\nLange Beteiligungsgesellschaft mit beschränkter Haftung\nGesellschaft mit beschränkter Haftung\nKonstanz\n\nAls nicht eingetragen wird bekanntgemacht:\nDas Gericht beabsichtigt, die Gesellschaft wegen Vermögenslosigkeit im Handelsregister von Amts wegen nach § 394 FamFG zu löschen. Die Frist zur Geltendmachung eines Widerspruchs gegen die beabsichtigte Löschung ist auf einen Monat ab Veröffentlichung bestimmt."
    },
    {
      "date": "2024-10-17",
      "original_text": "Registerbekanntmachung nach dem Umwandlungsgesetz\nHessen Amtsgericht Frankfurt am Main HRB 135808\nLitura GmbH – Frankfurt am Main",
      "type": "Registerbekanntmachung nach dem Umwandlungsgesetz",
      "state": "Hessen",
      "amtsgericht": "Amtsgericht Frankfurt am Main",
      "registernummer": "HRB 135808",
      "registerart": "HRB",
      "company_name": "Litura GmbH",
      "company_seat": "Frankfurt am Main",
      "details": "17.10.2024 (Bekanntmachungsdatum)\n\nHessen Amtsgericht Frankfurt am Main HRB 135808\nRegisterbekanntmachung nach dem Umwandlungsgesetz 17.10.2024 (Eintragungsdatum)\n\nLitura GmbH\nGesellschaft mit beschränkter Haftung\nFrankfurt am Main\n\nDen Gläubigern der an der Ausgliederung beteiligten Rechtsträger ist, wenn sie binnen sechs Monaten nach dem Tag, an dem die Eintragung der Ausgliederung in das Register des Sitzes desjenigen Rechtsträgers, dessen Gläubiger sie sind, nach §§ 125, 19 Absatz 3 UmwG bekannt gemacht worden ist, ihren Anspruch nach Grund und Höhe schriftlich anmelden, Sicherheit zu leisten, soweit sie nicht Befriedigung verlangen können. Dieses Recht steht den Gläubigern jedoch nur zu, wenn sie glaubhaft machen, dass durch die Ausgliederung die Erfüllung ihrer Forderung gefährdet wird."
    },
    {
      "date": "2024-10-17",
      "original_text": "Löschungsankündigung\nSchleswig-Holstein Amtsgericht Lübeck HRB 14893\nLübecker Feinguss GmbH – Lübeck",
      "type": "Löschungsankündigung",
      "state": "Schleswig-Holstein",
      "amtsgericht": "Amtsgericht Lübeck",
      "registernummer": "HRB 14893",
      "registerart": "HRB",
      "company_name": "Lübecker Feinguss GmbH",
      "company_seat": "Lübeck",
      "details": "17.10.2024 (Bekanntmachungsdatum)\n\nSchleswig-Holstein Amtsgericht Lübeck HRB 14893\nLöschungsankündigung\n\nLübecker Feinguss GmbH\nGesellschaft mit beschränkter Haftung\nLübeck\n\nEs ist die Löschung der nachstehenden Gesellschaft wegen Vermögenslosigkeit gemäß § 394 FamFG beabsichtigt."
    },
    {
      "date": "2024-10-17",
      "original_text": "Registerbekanntmachung nach dem Umwandlungsgesetz\nSachsen-Anhalt Amtsgericht Stendal HRA 7563\nME Event Technik Inhaber Mathias Wieczorek eingetragener Kaufmann – Oebisfelde-Weferlingen",
      "type": "Registerbekanntmachung nach dem Umwandlungsgesetz",
      "state": "Sachsen-Anhalt",
      "amtsgericht": "Amtsgericht Stendal",
      "registernummer": "HRA 7563",
      "registerart": "HRA",
      "company_name": "ME Event Technik Inhaber Mathias Wieczorek eingetragener Kaufmann",
      "company_seat": "Oebisfelde-Weferlingen",
      "details": "17.10.2024 (Bekanntmachungsdatum)\n\nSachsen-Anhalt Amtsgericht Stendal HRA 7563\nRegisterbekanntmachung nach dem Umwandlungsgesetz 17.10.2024 (Eintragungsdatum)\n\nME Event Technik Inhaber Mathias Wieczorek eingetragener Kaufmann\nEinzelkaufmann / Einzelkauffrau\nOebisfelde-Weferlingen\n\nNicht eingetragen:\nDen Gläubigern der an der Ausgliederung beteiligten Rechtsträger, ist wenn sie binnen sechs Monaten nach dem Tag, an dem die Eintragung der Ausgliederung nach §§125, 19 Abs. 3 UmwG als bekanntgemacht gilt, ihren Anspruch nach Grund und Höhe schriftlich anmelden, Sicherheit zu leisten, soweit sie nicht Befriedigung verlangen können. Diese Recht steht ihnen jedoch nur zu, wenn sie glaubhaft machen, dass durch die Ausgliederung die Erfüllung ihrer Forderung gefährdet wird."
    },
    {
      "date": "2024-10-17",
      "original_text": "Registerbekanntmachung nach dem Umwandlungsgesetz\nSachsen-Anhalt Amtsgericht Stendal HRA 7674\nME event technik GmbH & Co. KG – Oebisfelde-Weferlingen",
      "type": "Registerbekanntmachung nach dem Umwandlungsgesetz",
      "state": "Sachsen-Anhalt",
      "amtsgericht": "Amtsgericht Stendal",
      "registernummer": "HRA 7674",
      "registerart": "HRA",
      "company_name": "ME event technik GmbH & Co. KG",
      "company_seat": "Oebisfelde-Weferlingen",
      "details": "17.10.2024 (Bekanntmachungsdatum)\n\nSachsen-Anhalt Amtsgericht Stendal HRA 7674\nRegisterbekanntmachung nach dem Umwandlungsgesetz 17.10.2024 (Eintragungsdatum)\n\nME event technik GmbH & Co. KG\nKommanditgesellschaft\nOebisfelde-Weferlingen\n\nNicht eingetragen:\nDen Gläubigern der an der Ausgliederung beteiligten Rechtsträger, ist wenn sie binnen sechs Monaten nach dem Tag, an dem die Eintragung der Ausgliederung nach §§125, 19 Abs. 3 UmwG als bekanntgemacht gilt, ihren Anspruch nach Grund und Höhe schriftlich anmelden, Sicherheit zu leisten, soweit sie nicht Befriedigung verlangen können. Diese Recht steht ihnen jedoch nur zu, wenn sie glaubhaft machen, dass durch die Ausgliederung die Erfüllung ihrer Forderung gefährdet wird."
    },
    {
      "date": "2024-10-17",
      "original_text": "Registerbekanntmachung nach dem Umwandlungsgesetz\nBayern Amtsgericht München HRB 188205\nMHF Vermögensverwaltung achtzehn GmbH – München",
      "type": "Registerbekanntmachung nach dem Umwandlungsgesetz",
      "state": "Bayern",
      "amtsgericht": "Amtsgericht München",
      "registernummer": "HRB 188205",
      "registerart": "HRB",
      "company_name": "MHF Vermögensverwaltung achtzehn GmbH",
      "company_seat": "München",
      "details": "17.10.2024 (Bekanntmachungsdatum)\n\nBayern Amtsgericht München HRB 188205\nRegisterbekanntmachung nach dem Umwandlungsgesetz 16.10.2024 (Eintragungsdatum)\n\nMHF Vermögensverwaltung achtzehn GmbH\nGesellschaft mit beschränkter Haftung\nMünchen\n\nDen Gläubigern der an der Verschmelzung beteiligten Rechtsträger ist, wenn sie binnen sechs Monaten nach dem Tag, an dem die Eintragung der Verschmelzung in das Register des Sitzes desjenigen Rechtsträgers, dessen Gläubiger sie sind, nach § 19 Abs. 3 UmwG als bekannt gemacht gilt, ihren Anspruch nach Grund und Höhe schriftlich anmelden, Sicherheit zu leisten, soweit sie nicht Befriedigung verlangen können. Dieses Recht steht den Gläubigern jedoch nur zu, wenn sie glaubhaft machen, dass durch die Verschmelzung die Erfüllung ihrer Forderung gefährdet wird."
    },
    {
      "date": "2024-10-17",
      "original_text": "Löschungsankündigung\nBrandenburg Amtsgericht Potsdam HRB 24896\nMS-Dienstleistungs UG (haftungsbeschränkt) – Brandenburg an der Havel",
      "type": "Löschungsankündigung",
      "state": "Brandenburg",
      "amtsgericht": "Amtsgericht Potsdam",
      "registernummer": "HRB 24896",
      "registerart": "HRB",
      "company_name": "MS-Dienstleistungs UG (haftungsbeschränkt)",
      "company_seat": "Brandenburg an der Havel",
      "details": "17.10.2024 (Bekanntmachungsdatum)\n\nBrandenburg Amtsgericht Potsdam HRB 24896\nLöschungsankündigung\n\nMS-Dienstleistungs UG (haftungsbeschränkt)\nGesellschaft mit beschränkter Haftung\nBrandenburg an der Havel\n\nBei der nachstehenden Gesellschaft wird das Amtslöschungsverfahren gemäß § 394 FamFG eingeleitet. Widerspruchsfrist: 8 Wochen"
    },
    {
      "date": "2024-10-17",
      "original_text": "Registerbekanntmachung nach dem Umwandlungsgesetz\nHessen Amtsgericht Hanau HRA 94071\nMainhatten Automobile D.A. e.K. – Freigericht",
      "type": "Registerbekanntmachung nach dem Umwandlungsgesetz",
      "state": "Hessen",
      "amtsgericht": "Amtsgericht Hanau",
      "registernummer": "HRA 94071",
      "registerart": "HRA",
      "company_name": "Mainhatten Automobile D.A. e.K.",
      "company_seat": "Freigericht",
      "details": "17.10.2024 (Bekanntmachungsdatum)\n\nHessen Amtsgericht Hanau HRA 94071\nRegisterbekanntmachung nach dem Umwandlungsgesetz 17.10.2024 (Eintragungsdatum)\n\nMainhatten Automobile D.A. e.K.\nEinzelkaufmann / Einzelkauffrau\nFreigericht\n\nDen Gläubigern der an der Ausgliederung beteiligten Rechtsträger ist, wenn sie binnen sechs Monaten nach dem Tag, an dem die Eintragung der Ausgliederung in das Register des Sitzes desjenigen Rechtsträgers, dessen Gläubiger sie sind, nach §§ 125, 19 Absatz 3 UmwG bekannt gemacht worden ist, ihren Anspruch nach Grund und Höhe schriftlich anmelden, Sicherheit zu leisten, soweit sie nicht Befriedigung verlangen können. Dieses Recht steht den Gläubigern jedoch nur zu, wenn sie glaubhaft machen, dass durch die Ausgliederung die Erfüllung ihrer Forderung gefährdet wird."
    },
    {
      "date": "2024-10-17",
      "original_text": "Registerbekanntmachung nach dem Umwandlungsgesetz\nNordrhein-Westfalen Amtsgericht Iserlohn HRA 5730\nManVision GmbH & Co. KG – Hemer",
      "type": "Registerbekanntmachung nach dem Umwandlungsgesetz",
      "state": "Nordrhein-Westfalen",
      "amtsgericht": "Amtsgericht Iserlohn",
      "registernummer": "HRA 5730",
      "registerart": "HRA",
      "company_name": "ManVision GmbH & Co. KG",
      "company_seat": "Hemer",
      "details": "17.10.2024 (Bekanntmachungsdatum)\n\nNordrhein-Westfalen Amtsgericht Iserlohn HRA 5730\nRegisterbekanntmachung nach dem Umwandlungsgesetz 17.10.2024 (Eintragungsdatum)\n\nManVision GmbH & Co. KG\nKommanditgesellschaft\nHemer\n\nDen Gläubigern der an der formwechselnden Umwandlung beteiligten Rechtsträger ist, wenn sie binnen sechs Monaten nach dem Tag, an dem die Eintragung der formwechselnden Umwandlung in das Register des Sitzes desjenigen Rechtsträgers, dessen Gläubiger sie sind, nach § 19 Absatz 3 UmwG als bekanntgemacht gilt, ihren Anspruch nach Grund und Höhe schriftlich anmelden, Sicherheit zu leisten, soweit sie nicht Befriedigung verlangen können. Dieses Recht steht den Gläubigern jedoch nur zu, wenn sie glaubhaft machen, dass durch die formwechselnden Umwandlung die Erfüllung ihrer Forderung gefährdet wird."
    },
    {
      "date": "2024-10-17",
      "original_text": "Löschungsankündigung\nHessen Amtsgericht Offenbach am Main HRB 54728\nManpower Sicherheit und Servicedienstleister UG (haftungsbeschränkt) – Rodgau",
      "type": "Löschungsankündigung",
      "state": "Hessen",
      "amtsgericht": "Amtsgericht Offenbach am Main",
      "registernummer": "HRB 54728",
      "registerart": "HRB",
      "company_name": "Manpower Sicherheit und Servicedienstleister UG (haftungsbeschränkt)",
      "company_seat": "Rodgau",
      "details": "17.10.2024 (Bekanntmachungsdatum)\n\nHessen Amtsgericht Offenbach am Main HRB 54728\nLöschungsankündigung\n\nManpower Sicherheit und Servicedienstleister UG (haftungsbeschränkt)\nGesellschaft mit beschränkter Haftung\nRodgau\n\nDas Registergericht beabsichtigt die im Handelsregister eingetragene Gesellschaft von Amts wegen nach § 394 FamFG zu löschen. Die Frist zur Erhebung eines Widerspruchs gegen die beabsichtigte Löschung wird auf 3 Monate festgesetzt."
    },
    {
      "date": "2024-10-17",
      "original_text": "Einreichung neuer Dokumente\nSachsen Amtsgericht Leipzig HRB 9826\nMarkranstädter Bau- und Wohnungsverwaltungsgesellschaft mbH – Markranstädt",
      "type": "Einreichung neuer Dokumente",
      "state": "Sachsen",
      "amtsgericht": "Amtsgericht Leipzig",
      "registernummer": "HRB 9826",
      "registerart": "HRB",
      "company_name": "Markranstädter Bau- und Wohnungsverwaltungsgesellschaft mbH",
      "company_seat": "Markranstädt",
      "details": "17.10.2024 (Bekanntmachungsdatum)\n\nSachsen Amtsgericht Leipzig HRB 9826\nEinreichung neuer Dokumente\n\nMarkranstädter Bau- und Wohnungsverwaltungsgesellschaft mbH\nGesellschaft mit beschränkter Haftung\nMarkranstädt\n\nAm 16.10.2024 wurde beim Handelsregister des Amtsgerichts Leipzig die Liste der Mitglieder des Aufsichtsrats gemäß § 52 GmbHG eingereicht."
    },
    {
      "date": "2024-10-17",
      "original_text": "Registerbekanntmachung nach dem Umwandlungsgesetz\nBayern Amtsgericht München GsR 433\nMedien Zentrum Berlin eGbR – München",
      "type": "Registerbekanntmachung nach dem Umwandlungsgesetz",
      "state": "Bayern",
      "amtsgericht": "Amtsgericht München",
      "registernummer": "GsR 433",
      "registerart": "GsR",
      "company_name": "Medien Zentrum Berlin eGbR",
      "company_seat": "München",
      "details": "17.10.2024 (Bekanntmachungsdatum)\n\nBayern Amtsgericht München GsR 433\nRegisterbekanntmachung nach dem Umwandlungsgesetz 16.10.2024 (Eintragungsdatum)\n\nMedien Zentrum Berlin eGbR\nGesellschaft bürgerlichen Rechts\nMünchen\n\nDen Gläubigern der an der Verschmelzung beteiligten Rechtsträger ist, wenn sie binnen sechs Monaten nach dem Tag, an dem die Eintragung der Verschmelzung in das Register des Sitzes desjenigen Rechtsträgers, dessen Gläubiger sie sind, nach § 19 Abs. 3 UmwG als bekannt gemacht gilt, ihren Anspruch nach Grund und Höhe schriftlich anmelden, Sicherheit zu leisten, soweit sie nicht Befriedigung verlangen können. Dieses Recht steht den Gläubigern jedoch nur zu, wenn sie glaubhaft machen, dass durch die Verschmelzung die Erfüllung ihrer Forderung gefährdet wird."
    },
    {
      "date": "2024-10-17",
      "original_text": "Registerbekanntmachung nach dem Umwandlungsgesetz\nBaden-Württemberg Amtsgericht Freiburg HRA 708780\nMichael Eisemann Logistik e.K., Inh. Michael Eisemann – Donaueschingen",
      "type": "Registerbekanntmachung nach dem Umwandlungsgesetz",
      "state": "Baden-Württemberg",
      "amtsgericht": "Amtsgericht Freiburg",
      "registernummer": "HRA 708780",
      "registerart": "HRA",
      "company_name": "Michael Eisemann Logistik e.K., Inh. Michael Eisemann",
      "company_seat": "Donaueschingen",
      "details": "17.10.2024 (Bekanntmachungsdatum)\n\nBaden-Württemberg Amtsgericht Freiburg HRA 708780\nRegisterbekanntmachung nach dem Umwandlungsgesetz 17.10.2024 (Eintragungsdatum)\n\nMichael Eisemann Logistik e.K., Inh. Michael Eisemann\nEinzelkaufmann / Einzelkauffrau\nDonaueschingen\n\nAls nicht eingetragen wird bekanntgemacht:\nDen Gläubigern der an der Ausgliederung beteiligten Rechtsträger ist, wenn sie binnen sechs Monaten nach dem Tag, an dem die Eintragung der Ausgliederung in das Register des Sitzes desjenigen Rechtsträgers, dessen Gläubiger sie sind, nach § 19 Abs. 3 UmwG als bekanntgemacht gilt, ihren Anspruch nach Grund und Höhe schriftlich anmelden, Sicherheit zu leisten, soweit sie nicht Befriedigung verlangen können. Dieses Recht steht den Gläubigern jedoch nur zu, wenn sie glaubhaft machen, dass durch die Ausgliederung die Erfüllung ihrer Forderung gefährdet wird."
    },
    {
      "date": "2024-10-17",
      "original_text": "Registerbekanntmachung nach dem Umwandlungsgesetz\nBerlin Amtsgericht Berlin (Charlottenburg) HRA 55921\nMichael Roden e.K. – Berlin",
      "type": "Registerbekanntmachung nach dem Umwandlungsgesetz",
      "state": "Berlin",
      "amtsgericht": "Amtsgericht Berlin (Charlottenburg)",
      "registernummer": "HRA 55921",
      "registerart": "HRA",
      "company_name": "Michael Roden e.K.",
      "company_seat": "Berlin",
      "details": "17.10.2024 (Bekanntmachungsdatum)\n\nBerlin Amtsgericht Berlin (Charlottenburg) HRA 55921\nRegisterbekanntmachung nach dem Umwandlungsgesetz 15.10.2024 (Eintragungsdatum)\n\nMichael Roden e.K.\nEinzelkaufmann / Einzelkauffrau\nBerlin\n\nDie Eintragung lfd. Nummer 2 vom 15.10.2024 wird nochmals berichtigend als nicht eingetragen veröffentlicht: Den Gläubigern der an der Spaltung beteiligten Rechtsträger ist, wenn sie binnen sechs Monaten nach dem Tag, an dem die Eintragung der Spaltung in das Register des Sitzes desjenigen Rechtsträgers, dessen Gläubiger sie sind, als bekannt gemacht gilt, ihren Anspruch nach Grund und Höhe schriftlich anmelden, Sicherheit zu leisten, soweit sie nicht Befriedigung verlangen können. Dieses Recht steht den Gläubigern jedoch nur zu, wenn sie glaubhaft machen, dass durch die Spaltung die Erfüllung ihrer Forderung gefährdet wird. Das Recht, Sicherheitsleistung zu verlangen, steht Gläubigern nicht zu, die im Falle der Insolvenz ein Recht auf vorzugsweise Befriedigung aus einer Deckungsmasse haben, die nach gesetzlicher Vorschrift zu ihrem Schutz errichtet und staatlich überwacht ist."
    },
    {
      "date": "2024-10-17",
      "original_text": "Löschungsankündigung\nHessen Amtsgericht Fritzlar HRB 12158\nMucha GmbH – Morschen",
      "type": "Löschungsankündigung",
      "state": "Hessen",
      "amtsgericht": "Amtsgericht Fritzlar",
      "registernummer": "HRB 12158",
      "registerart": "HRB",
      "company_name": "Mucha GmbH",
      "company_seat": "Morschen",
      "details": "17.10.2024 (Bekanntmachungsdatum)\n\nHessen Amtsgericht Fritzlar HRB 12158\nLöschungsankündigung 17.10.2024 (Eintragungsdatum)\n\nMucha GmbH\nGesellschaft mit beschränkter Haftung\nMorschen\n\nDas Registergericht beabsichtigt die im Handelsregister eingetragene Gesellschaft von Amts wegen nach § 394 FamFG zu löschen. Die Frist zur Erhebung eines Widerspruchs gegen die beabsichtigte Löschung wird auf 3 Monate festgesetzt."
    },
    {
      "date": "2024-10-17",
      "original_text": "Sonstige Registerbekanntmachung\nHessen Amtsgericht Bad Homburg v.d.H. VR 536\nMusikcorps 1960 Bad Homburg e.V. – Bad Homburg v. d. Höhe",
      "type": "Sonstige Registerbekanntmachung",
      "state": "Hessen",
      "amtsgericht": "Amtsgericht Bad Homburg v.d.H.",
      "registernummer": "VR 536",
      "registerart": "VR",
      "company_name": "Musikcorps 1960 Bad Homburg e.V.",
      "company_seat": "Bad Homburg v. d. Höhe",
      "details": "17.10.2024 (Bekanntmachungsdatum)\n\nHessen Amtsgericht Bad Homburg v.d.H. VR 536\nSonstige Registerbekanntmachung 17.10.2024 (Eintragungsdatum)\n\nMusikcorps 1960 Bad Homburg e.V.\neingetragener Verein\nBad Homburg v. d. Höhe\n\nDer Verein ist aufgelöst."
    },
    {
      "date": "2024-10-17",
      "original_text": "Registerbekanntmachung nach dem Umwandlungsgesetz\nNordrhein-Westfalen Amtsgericht Duisburg HRA 11858\nN & B Sanitär und Heizung e.K. – Mülheim an der Ruhr",
      "type": "Registerbekanntmachung nach dem Umwandlungsgesetz",
      "state": "Nordrhein-Westfalen",
      "amtsgericht": "Amtsgericht Duisburg",
      "registernummer": "HRA 11858",
      "registerart": "HRA",
      "company_name": "N & B Sanitär und Heizung e.K.",
      "company_seat": "Mülheim an der Ruhr",
      "details": "17.10.2024 (Bekanntmachungsdatum)\n\nNordrhein-Westfalen Amtsgericht Duisburg HRA 11858\nRegisterbekanntmachung nach dem Umwandlungsgesetz 17.10.2024 (Eintragungsdatum)\n\nN & B Sanitär und Heizung e.K.\nEinzelkaufmann / Einzelkauffrau\nMülheim an der Ruhr\n\nDie Gesellschaft hat Gläubigern, deren Forderungen vor dieser Bekanntmachung begründet worden sind, Sicherheit zu leisten, soweit sie nicht Befriedigung verlangen können, wenn sie sich binnen sechs Monaten zu diesem Zweck melden."
    },
    {
      "date": "2024-10-17",
      "original_text": "Registerbekanntmachung nach dem Umwandlungsgesetz\nNordrhein-Westfalen Amtsgericht Duisburg HRB 35439\nN&B Sanitär, Heizung und Klima GmbH – Mülheim an der Ruhr",
      "type": "Registerbekanntmachung nach dem Umwandlungsgesetz",
      "state": "Nordrhein-Westfalen",
      "amtsgericht": "Amtsgericht Duisburg",
      "registernummer": "HRB 35439",
      "registerart": "HRB",
      "company_name": "N&B Sanitär, Heizung und Klima GmbH",
      "company_seat": "Mülheim an der Ruhr",
      "details": "17.10.2024 (Bekanntmachungsdatum)\n\nNordrhein-Westfalen Amtsgericht Duisburg HRB 35439\nRegisterbekanntmachung nach dem Umwandlungsgesetz 17.10.2024 (Eintragungsdatum)\n\nN&B Sanitär, Heizung und Klima GmbH\nGesellschaft mit beschränkter Haftung\nMülheim an der Ruhr\n\nDie Gesellschaft hat Gläubigern, deren Forderungen vor dieser Bekanntmachung begründet worden sind, Sicherheit zu leisten, soweit sie nicht Befriedigung verlangen können, wenn sie sich binnen sechs Monaten zu diesem Zweck melden."
    },
    {
      "date": "2024-10-17",
      "original_text": "Löschungsankündigung\nBerlin Amtsgericht Berlin (Charlottenburg) HRB 177258\nNapoli Fashion GmbH – Berlin",
      "type": "Löschungsankündigung",
      "state": "Berlin",
      "amtsgericht": "Amtsgericht Berlin (Charlottenburg)",
      "registernummer": "HRB 177258",
      "registerart": "HRB",
      "company_name": "Napoli Fashion GmbH",
      "company_seat": "Berlin",
      "details": "17.10.2024 (Bekanntmachungsdatum)\n\nBerlin Amtsgericht Berlin (Charlottenburg) HRB 177258\nLöschungsankündigung\n\nNapoli Fashion GmbH\nGesellschaft mit beschränkter Haftung\nBerlin\n\nBei der nachstehenden Gesellschaft wird das Amtslöschungsverfahren gemäß § 394 FamFG eingeleitet. Widerspruchsfrist 6 Wochen"
    },
    {
      "date": "2024-10-17",
      "original_text": "Registerbekanntmachung nach dem Umwandlungsgesetz\nNiedersachsen Amtsgericht Aurich HRB 207433\nNorddeutsche Zaunsysteme Erdmann GmbH – Südbrookmerland",
      "type": "Registerbekanntmachung nach dem Umwandlungsgesetz",
      "state": "Niedersachsen",
      "amtsgericht": "Amtsgericht Aurich",
      "registernummer": "HRB 207433",
      "registerart": "HRB",
      "company_name": "Norddeutsche Zaunsysteme Erdmann GmbH",
      "company_seat": "Südbrookmerland",
      "details": "17.10.2024 (Bekanntmachungsdatum)\n\nNiedersachsen Amtsgericht Aurich HRB 207433\nRegisterbekanntmachung nach dem Umwandlungsgesetz 17.10.2024 (Eintragungsdatum)\n\nNorddeutsche Zaunsysteme Erdmann GmbH\nGesellschaft mit beschränkter Haftung\nSüdbrookmerland\n\nDen Gläubigern der an der Ausgliederung beteiligten Rechtsträger ist, wenn sie binnen sechs Monaten nach dem Tag, an dem die Eintragung der Ausgliederung in das Register des Sitzes desjenigen Rechtsträgers, dessen Gläubiger sie sind, nach § 19 Abs. 3 UmwG als bekannt gemacht gilt, ihren Anspruch nach Grund und Höhe schriftlich anmelden, Sicherheit zu leisten, soweit sie nicht Befriedigung verlangen können. Dieses Recht steht den Gläubigern jedoch nur zu, wenn sie glaubhaft machen, dass durch die Ausgliederung die Erfüllung der Forderung gefährdet wird."
    },
    {
      "date": "2024-10-17",
      "original_text": "Einreichung neuer Dokumente\nNiedersachsen Amtsgericht Braunschweig HRB 2936\nNordzucker AG – Braunschweig",
      "type": "Einreichung neuer Dokumente",
      "state": "Niedersachsen",
      "amtsgericht": "Amtsgericht Braunschweig",
      "registernummer": "HRB 2936",
      "registerart": "HRB",
      "company_name": "Nordzucker AG",
      "company_seat": "Braunschweig",
      "details": "17.10.2024 (Bekanntmachungsdatum)\n\nNiedersachsen Amtsgericht Braunschweig HRB 2936\nEinreichung neuer Dokumente\n\nNordzucker AG\nAktiengesellschaft\nBraunschweig\n\nEine aktuelle Liste der Mitglieder des Aufsichtsrats wurde beim Registergericht eingereicht."
    },
    {
      "date": "2024-10-17",
      "original_text": "Registerbekanntmachung nach dem Umwandlungsgesetz\nNordrhein-Westfalen Amtsgericht Bonn HRB 16613\nOPC Holding GmbH – Bonn",
      "type": "Registerbekanntmachung nach dem Umwandlungsgesetz",
      "state": "Nordrhein-Westfalen",
      "amtsgericht": "Amtsgericht Bonn",
      "registernummer": "HRB 16613",
      "registerart": "HRB",
      "company_name": "OPC Holding GmbH",
      "company_seat": "Bonn",
      "details": "17.10.2024 (Bekanntmachungsdatum)\n\nNordrhein-Westfalen Amtsgericht Bonn HRB 16613\nRegisterbekanntmachung nach dem Umwandlungsgesetz 17.10.2024 (Eintragungsdatum)\n\nOPC Holding GmbH\nGesellschaft mit beschränkter Haftung\nBonn\n\nDen Gläubigern der an der Verschmelzung beteiligten Rechtsträger ist, wenn sie binnen sechs Monaten nach dem Tag, an dem die Eintragung der Verschmelzung in das Register des Sitzes desjenigen Rechtsträgers, dessen Gläubiger sie sind, nach § 19 Absatz 3 UmwG als bekanntgemacht gilt, ihren Anspruch nach Grund und Höhe schriftlich anmelden, Sicherheit zu leisten, soweit sie nicht Befriedigung verlangen können. Dieses Recht steht den Gläubigern jedoch nur zu, wenn sie glaubhaft machen, dass durch die Verschmelzung die Erfüllung ihrer Forderung gefährdet wird."
    },
    {
      "date": "2024-10-17",
      "original_text": "Löschungsankündigung\nNiedersachsen Amtsgericht Osnabrück HRB 217383\nOasis Deutschland GmbH – Emsbüren",
      "type": "Löschungsankündigung",
      "state": "Niedersachsen",
      "amtsgericht": "Amtsgericht Osnabrück",
      "registernummer": "HRB 217383",
      "registerart": "HRB",
      "company_name": "Oasis Deutschland GmbH",
      "company_seat": "Emsbüren",
      "details": "17.10.2024 (Bekanntmachungsdatum)\n\nNiedersachsen Amtsgericht Osnabrück HRB 217383\nLöschungsankündigung 17.10.2024 (Eintragungsdatum)\n\nOasis Deutschland GmbH\nGesellschaft mit beschränkter Haftung\nEmsbüren\n\nDas Registergericht beabsichtigt, die Gesellschaft nach Ablehnung der Eröffnung des Insolvenzverfahrens mangels Masse von Amts wegen nach § 394 FamFG wegen Vermögenslosigkeit zu löschen. Die Frist zur Erhebung eines Widerspruchs ist auf 1 Monat ab dieser Registerbekanntmachung festgesetzt."
    },
    {
      "date": "2024-10-17",
      "original_text": "Einreichung neuer Dokumente\nBaden-Württemberg Amtsgericht Freiburg HRB 731612\nOhlthaver & List Europe SE – Eschbach",
      "type": "Einreichung neuer Dokumente",
      "state": "Baden-Württemberg",
      "amtsgericht": "Amtsgericht Freiburg",
      "registernummer": "HRB 731612",
      "registerart": "HRB",
      "company_name": "Ohlthaver & List Europe SE",
      "company_seat": "Eschbach",
      "details": "17.10.2024 (Bekanntmachungsdatum)\n\nBaden-Württemberg Amtsgericht Freiburg HRB 731612\nEinreichung neuer Dokumente 17.10.2024 (Eintragungsdatum)\n\nOhlthaver & List Europe SE\nEuropäische Aktiengesellschaft (SE)\nEschbach\n\nAls nicht eingetragen wird bekanntgemacht:\nDie Gesellschaft hat am 15.10.2024 die Liste über die Zusammensetzung des Verwaltungsrats zum Handelsregister eingereicht."
    },
    {
      "date": "2024-10-17",
      "original_text": "Registerbekanntmachung nach dem Umwandlungsgesetz\nBayern Amtsgericht München HRB 235825\nOvid Management Reserve GmbH – München",
      "type": "Registerbekanntmachung nach dem Umwandlungsgesetz",
      "state": "Bayern",
      "amtsgericht": "Amtsgericht München",
      "registernummer": "HRB 235825",
      "registerart": "HRB",
      "company_name": "Ovid Management Reserve GmbH",
      "company_seat": "München",
      "details": "17.10.2024 (Bekanntmachungsdatum)\n\nBayern Amtsgericht München HRB 235825\nRegisterbekanntmachung nach dem Umwandlungsgesetz 16.10.2024 (Eintragungsdatum)\n\nOvid Management Reserve GmbH\nGesellschaft mit beschränkter Haftung\nMünchen\n\nBeim Amtsgericht München - Registergericht - ist am 07.10.2024 der Entwurf eines Verschmelzungsplans betreffend die grenzüberschreitende Verschmelzung der Ovid Management Reserve GmbH mit Sitz in München, Deutschland, als übertragende Gesellschaft auf die Senior Living Invest S.à r.l. mit Sitz in Luxemburg, Großherzogtum Luxemburg, als übernehmende Gesellschaft eingereicht worden.\n\nAn der grenzüberschreitenden Verschmelzung sind die Ovid Management Reserve GmbH, eine Gesellschaft mit beschränkter Haftung nach dem Recht der Bundesrepublik Deutschland mit Sitz in München, als übertragende Gesellschaft und die Senior Living Invest S.à r.l., eine Gesellschaft mit beschränkter Haftung (Société à responsabilité limitée) nach dem Recht des Großherzogtums Luxemburg mit Sitz in Luxemburg, Großherzogtum Luxemburg, als übernehmende Gesellschaft beteiligt. Die Ovid Management Reserve GmbH ist eine 100%-ige Tochtergesellschaft der Senior Living Invest S.à r.l..\n\nDie an der grenzüberschreitenden Verschmelzung beteiligten Gesellschaften sind in folgenden Registern eingetragen: Die übertragende Gesellschaft ist eingetragen im Handelsregister des Amtsgerichts München unter HRB 235825. Die übernehmende Gesellschaft ist eingetragen im Handels- und Gesellschaftsregister (Registrede Commerce et des Sociètès) von Luxemburg unter B217381.\n\nFolgende Personen werden darauf hingewiesen, dass sie der jeweiligen Gesellschaft spätestens fünf (5) Arbeitstage vor dem Tag der Beurkundung des Verschmelzungsplans Bemerkungen zum Verschmelzungsplan übermitteln können:\ndie Anteilsinhaber und Gläubiger der an der grenzüberschreitenden Verschmelzung beteiligten Gesellschaften sowie die Arbeitnehmer der an der grenzüberschreitenden Verschmelzung beteiligten Gesellschaften. Bei den an der grenzüberschreitenden Verschmelzung beteiligten Gesellschaften\ngibt es keinen Betriebsrat.\n\nDer Tag der Beurkundung des Verschmelzungsplans ist der 16. Dezember 2024, so dass die Frist für die Übermittlung von Bemerkungen am 9. Dezember 2024 abläuft."
    },
    {
      "date": "2024-10-17",
      "original_text": "Einreichung neuer Dokumente\nNiedersachsen Amtsgericht Göttingen HRB 206574\nPantapharm AG – Duderstadt",
      "type": "Einreichung neuer Dokumente",
      "state": "Niedersachsen",
      "amtsgericht": "Amtsgericht Göttingen",
      "registernummer": "HRB 206574",
      "registerart": "HRB",
      "company_name": "Pantapharm AG",
      "company_seat": "Duderstadt",
      "details": "17.10.2024 (Bekanntmachungsdatum)\n\nNiedersachsen Amtsgericht Göttingen HRB 206574\nEinreichung neuer Dokumente\n\nPantapharm AG\nAktiengesellschaft\nDuderstadt\n\nDie Liste der Mitglieder des Aufsichtsrats wurde beim Registergericht eingereicht."
    },
    {
      "date": "2024-10-17",
      "original_text": "Sonstige Registerbekanntmachung\nHessen Amtsgericht Marburg VR 4267\nPartnerschaftsverein Seigertshausen – Neukirchen (Knüllgebirge) - Seigertshausen",
      "type": "Sonstige Registerbekanntmachung",
      "state": "Hessen",
      "amtsgericht": "Amtsgericht Marburg",
      "registernummer": "VR 4267",
      "registerart": "VR",
      "company_name": "Partnerschaftsverein Seigertshausen",
      "company_seat": "Neukirchen (Knüllgebirge) - Seigertshausen",
      "details": "17.10.2024 (Bekanntmachungsdatum)\n\nHessen Amtsgericht Marburg VR 4267\nSonstige Registerbekanntmachung 17.10.2024 (Eintragungsdatum)\n\nPartnerschaftsverein Seigertshausen\neingetragener Verein\nNeukirchen (Knüllgebirge) - Seigertshausen\n\nDer Verein ist aufgelöst."
    },
    {
      "date": "2024-10-17",
      "original_text": "Löschungsankündigung\nMecklenburg-Vorpommern Amtsgericht Stralsund HRA 20081\nPeene Landschwein GmbH & Co. KG – Wolgast",
      "type": "Löschungsankündigung",
      "state": "Mecklenburg-Vorpommern",
      "amtsgericht": "Amtsgericht Stralsund",
      "registernummer": "HRA 20081",
      "registerart": "HRA",
      "company_name": "Peene Landschwein GmbH & Co. KG",
      "company_seat": "Wolgast",
      "details": "17.10.2024 (Bekanntmachungsdatum)\n\nMecklenburg-Vorpommern Amtsgericht Stralsund HRA 20081\nLöschungsankündigung\n\nPeene Landschwein GmbH & Co. KG\nKommanditgesellschaft\nWolgast\n\nDas Registergericht beabsichtigt, die im Handelsregister eingetragene Gesellschaft von Amts wegen nach § 394 FamFG zu löschen. Die Frist zur Erhebung eines Widerspruchs ist auf 1 Monat festgesetzt."
    },
    {
      "date": "2024-10-17",
      "original_text": "Löschungsankündigung\nMecklenburg-Vorpommern Amtsgericht Stralsund HRB 20203\nPeene Landschwein Verwaltungs GmbH – Wolgast",
      "type": "Löschungsankündigung",
      "state": "Mecklenburg-Vorpommern",
      "amtsgericht": "Amtsgericht Stralsund",
      "registernummer": "HRB 20203",
      "registerart": "HRB",
      "company_name": "Peene Landschwein Verwaltungs GmbH",
      "company_seat": "Wolgast",
      "details": "17.10.2024 (Bekanntmachungsdatum)\n\nMecklenburg-Vorpommern Amtsgericht Stralsund HRB 20203\nLöschungsankündigung\n\nPeene Landschwein Verwaltungs GmbH\nGesellschaft mit beschränkter Haftung\nWolgast\n\nDas Registergericht beabsichtigt, die im Handelsregister eingetragene Gesellschaft von Amts wegen nach § 394 FamFG zu löschen. Die Frist zur Erhebung eines Widerspruchs ist auf 1 Monat festgesetzt."
    },
    {
      "date": "2024-10-17",
      "original_text": "Registerbekanntmachung nach dem Umwandlungsgesetz\nSachsen-Anhalt Amtsgericht Stendal HRB 3432\nPlanung & Immobilien Gardelegen GmbH – Gardelegen",
      "type": "Registerbekanntmachung nach dem Umwandlungsgesetz",
      "state": "Sachsen-Anhalt",
      "amtsgericht": "Amtsgericht Stendal",
      "registernummer": "HRB 3432",
      "registerart": "HRB",
      "company_name": "Planung & Immobilien Gardelegen GmbH",
      "company_seat": "Gardelegen",
      "details": "17.10.2024 (Bekanntmachungsdatum)\n\nSachsen-Anhalt Amtsgericht Stendal HRB 3432\nRegisterbekanntmachung nach dem Umwandlungsgesetz 17.10.2024 (Eintragungsdatum)\n\nPlanung & Immobilien Gardelegen GmbH\nGesellschaft mit beschränkter Haftung\nGardelegen\n\nNicht eingetragen:\nDen Gläubigern der an der Verschmelzung beteiligten Rechtsträger ist, wenn sie binnen sechs Monaten nach dem Tag, an dem die Eintragung der Verschmelzung nach § 19 Abs. 3 UmwG als bekanntgemacht gilt, ihren Anspruch nach Grund und Höhe schriftlich anmelden, Sicherheit zu leisten, soweit sie nicht Befriedigung verlangen können. Dieses Recht steht ihnen jedoch nur zu, wenn sie glaubhaft machen, dass durch die Verschmelzung die Erfüllung ihrer Forderung gefährdet wird."
    },
    {
      "date": "2024-10-17",
      "original_text": "Registerbekanntmachung nach dem Umwandlungsgesetz\nRheinland-Pfalz Amtsgericht Mainz HRB 41842\nPossehl Construction GmbH – Sprendlingen",
      "type": "Registerbekanntmachung nach dem Umwandlungsgesetz",
      "state": "Rheinland-Pfalz",
      "amtsgericht": "Amtsgericht Mainz",
      "registernummer": "HRB 41842",
      "registerart": "HRB",
      "company_name": "Possehl Construction GmbH",
      "company_seat": "Sprendlingen",
      "details": "17.10.2024 (Bekanntmachungsdatum)\n\nRheinland-Pfalz Amtsgericht Mainz HRB 41842\nRegisterbekanntmachung nach dem Umwandlungsgesetz 17.10.2024 (Eintragungsdatum)\n\nPossehl Construction GmbH\nGesellschaft mit beschränkter Haftung\nSprendlingen\n\nAls nicht eingetragen wird veröffentlicht: Den Gläubigern der an der Ausgliederung beteiligten Rechtsträger ist, wenn sie binnen sechs Monaten nach dem Tag, an dem die Eintragung der Ausgliederung in das Register des Sitzes desjenigen Rechtsträgers,dessen Gläubiger sie sind, nach § 19 Abs. 3 UmwG als bekannt gemacht gilt, ihren Anspruch nach Grund und Höhe schriftlich anmelden, Sicherheit zu leisten, soweit sie nicht Befriedigung verlangen können. Dieses Recht steht den Gläubigern jedoch nur zu, wenn sie glaubhaft machen, dass durch die Ausgliederung die Erfüllung der Forderung gefährdet wird."
    },
    {
      "date": "2024-10-17",
      "original_text": "Registerbekanntmachung nach dem Umwandlungsgesetz\nRheinland-Pfalz Amtsgericht Mainz HRA 44722\nPossehl Spezialbau GmbH & Co. KG – Sprendlingen",
      "type": "Registerbekanntmachung nach dem Umwandlungsgesetz",
      "state": "Rheinland-Pfalz",
      "amtsgericht": "Amtsgericht Mainz",
      "registernummer": "HRA 44722",
      "registerart": "HRA",
      "company_name": "Possehl Spezialbau GmbH & Co. KG",
      "company_seat": "Sprendlingen",
      "details": "17.10.2024 (Bekanntmachungsdatum)\n\nRheinland-Pfalz Amtsgericht Mainz HRA 44722\nRegisterbekanntmachung nach dem Umwandlungsgesetz 17.10.2024 (Eintragungsdatum)\n\nPossehl Spezialbau GmbH & Co. KG\nKommanditgesellschaft\nSprendlingen\n\nAls nicht eingetragen wird veröffentlicht: Den Gläubigern der an der Ausgliederung beteiligten Rechtsträger ist, wenn sie binnen sechs Monaten nach dem Tag, an dem die Eintragung der Ausgliederung in das Register des Sitzes desjenigen Rechtsträgers,dessen Gläubiger sie sind, nach § 19 Abs. 3 UmwG als bekannt gemacht gilt, ihren Anspruch nach Grund und Höhe schriftlich anmelden, Sicherheit zu leisten, soweit sie nicht Befriedigung verlangen können. Dieses Recht steht den Gläubigern jedoch nur zu, wenn sie glaubhaft machen, dass durch die Ausgliederung die Erfüllung der Forderung gefährdet wird."
    },
    {
      "date": "2024-10-17",
      "original_text": "Registerbekanntmachung nach dem Umwandlungsgesetz\nThüringen Amtsgericht Jena HRB 521486\nPreller Holding GmbH – Silbitz",
      "type": "Registerbekanntmachung nach dem Umwandlungsgesetz",
      "state": "Thüringen",
      "amtsgericht": "Amtsgericht Jena",
      "registernummer": "HRB 521486",
      "registerart": "HRB",
      "company_name": "Preller Holding GmbH",
      "company_seat": "Silbitz",
      "details": "17.10.2024 (Bekanntmachungsdatum)\n\nThüringen Amtsgericht Jena HRB 521486\nRegisterbekanntmachung nach dem Umwandlungsgesetz 17.10.2024 (Eintragungsdatum)\n\nPreller Holding GmbH\nGesellschaft mit beschränkter Haftung\nSilbitz\n\nNicht eingetragen: Den Gläubigern der an der Ausgliederung beteiligten Rechtsträger, ist wenn sie binnen sechs Monaten nach dem Tag, an dem die Eintragung der Ausgliederung in das Register des Sitzes desjenigen Rechtsträgers, dessen Gläubiger sie sind, nach §§125, 19 Abs. 3 UmwG als bekanntgemacht gilt, ihren Anspruch nach Grund und Höhe schriftlich anmelden, Sicherheit zu leisten, soweit sie nicht Befriedigung verlangen können. Dieses Recht steht ihnen jedoch nur zu, wenn sie glaubhaft machen, daß durch die Ausgliederung die Erfüllung ihrer Forderung gefährdet wird."
    },
    {
      "date": "2024-10-17",
      "original_text": "Registerbekanntmachung nach dem Umwandlungsgesetz\nSachsen Amtsgericht Leipzig HRB 28071\nPrimaCom Holding GmbH – Leipzig",
      "type": "Registerbekanntmachung nach dem Umwandlungsgesetz",
      "state": "Sachsen",
      "amtsgericht": "Amtsgericht Leipzig",
      "registernummer": "HRB 28071",
      "registerart": "HRB",
      "company_name": "PrimaCom Holding GmbH",
      "company_seat": "Leipzig",
      "details": "17.10.2024 (Bekanntmachungsdatum)\n\nSachsen Amtsgericht Leipzig HRB 28071\nRegisterbekanntmachung nach dem Umwandlungsgesetz 17.10.2024 (Eintragungsdatum)\n\nPrimaCom Holding GmbH\nGesellschaft mit beschränkter Haftung\nLeipzig\n\nDen Gläubigern der an der Verschmelzung beteiligten Rechtsträger ist, wenn sie binnen sechs Monaten nach dem Tag, an dem die Eintragung der Verschmelzung in das Register des Sitzes desjenigen Rechtsträgers, dessen Gläubiger sie sind, nach § 19 Abs. 3 UmwG als bekannt gemacht gilt, ihren Anspruch nach Grund und Höhe schriftlich anmelden, Sicherheit zu leisten, soweit sie nicht Befriedigung verlangen können. Dieses Recht steht den Gläubigern jedoch nur zu, wenn sie glaubhaft machen, dass durch die Verschmelzung die Erfüllung der Forderung gefährdet wird."
    },
    {
      "date": "2024-10-17",
      "original_text": "Registerbekanntmachung nach dem Umwandlungsgesetz\nSachsen Amtsgericht Leipzig HRB 28071\nPrimaCom Holding GmbH – Leipzig",
      "type": "Registerbekanntmachung nach dem Umwandlungsgesetz",
      "state": "Sachsen",
      "amtsgericht": "Amtsgericht Leipzig",
      "registernummer": "HRB 28071",
      "registerart": "HRB",
      "company_name": "PrimaCom Holding GmbH",
      "company_seat": "Leipzig",
      "details": "17.10.2024 (Bekanntmachungsdatum)\n\nSachsen Amtsgericht Leipzig HRB 28071\nRegisterbekanntmachung nach dem Umwandlungsgesetz 17.10.2024 (Eintragungsdatum)\n\nPrimaCom Holding GmbH\nGesellschaft mit beschränkter Haftung\nLeipzig\n\nDen Gläubigern der an der Verschmelzung beteiligten Rechtsträger ist, wenn sie binnen sechs Monaten nach dem Tag, an dem die Eintragung der Verschmelzung in das Register des Sitzes desjenigen Rechtsträgers, dessen Gläubiger sie sind, nach § 19 Abs. 3 UmwG als bekannt gemacht gilt, ihren Anspruch nach Grund und Höhe schriftlich anmelden, Sicherheit zu leisten, soweit sie nicht Befriedigung verlangen können. Dieses Recht steht den Gläubigern jedoch nur zu, wenn sie glaubhaft machen, dass durch die Verschmelzung die Erfüllung der Forderung gefährdet wird."
    },
    {
      "date": "2024-10-17",
      "original_text": "Registerbekanntmachung nach dem Umwandlungsgesetz\nNiedersachsen Amtsgericht Hannover HRA 206468\nProduktManageMentor | Jan Harste e.K. – Wedemark",
      "type": "Registerbekanntmachung nach dem Umwandlungsgesetz",
      "state": "Niedersachsen",
      "amtsgericht": "Amtsgericht Hannover",
      "registernummer": "HRA 206468",
      "registerart": "HRA",
      "company_name": "ProduktManageMentor | Jan Harste e.K.",
      "company_seat": "Wedemark",
      "details": "17.10.2024 (Bekanntmachungsdatum)\n\nNiedersachsen Amtsgericht Hannover HRA 206468\nRegisterbekanntmachung nach dem Umwandlungsgesetz 17.10.2024 (Eintragungsdatum)\n\nProduktManageMentor | Jan Harste e.K.\nEinzelkaufmann / Einzelkauffrau\nWedemark\n\nDen Gläubigern der an der Ausgliederung beteiligten Rechtsträger ist, wenn sie binnen sechs Monaten nach dem Tag, an dem die Eintragung der Ausgliederung in das Register des Sitzes desjenigen Rechtsträgers, dessen Gläubiger sie sind, nach § 19 Abs. 3 UmwG als bekannt gemacht gilt, ihren Anspruch nach Grund und Höhe schriftlich anmelden, Sicherheit zu leisten, soweit sie nicht Befriedigung verlangen können. Dieses Recht steht den Gläubigern jedoch nur zu, wenn sie glaubhaft machen, dass durch die Ausgliederung die Erfüllung der Forderung gefährdet wird."
    },
    {
      "date": "2024-10-17",
      "original_text": "Löschungsankündigung\nSchleswig-Holstein Amtsgericht Lübeck HRB 17090\nR.R.H Dienstleistungs-GmbH – Glinde",
      "type": "Löschungsankündigung",
      "state": "Schleswig-Holstein",
      "amtsgericht": "Amtsgericht Lübeck",
      "registernummer": "HRB 17090",
      "registerart": "HRB",
      "company_name": "R.R.H Dienstleistungs-GmbH",
      "company_seat": "Glinde",
      "details": "17.10.2024 (Bekanntmachungsdatum)\n\nSchleswig-Holstein Amtsgericht Lübeck HRB 17090\nLöschungsankündigung\n\nR.R.H Dienstleistungs-GmbH\nGesellschaft mit beschränkter Haftung\nGlinde\n\nEs ist die Löschung der nachstehenden Gesellschaft wegen Vermögenslosigkeit gemäß § 394 FamFG beabsichtigt."
    },
    {
      "date": "2024-10-17",
      "original_text": "Sonstige Registerbekanntmachung\nHessen Amtsgericht Wiesbaden VR 3459\nRADLER-CLUB NASSOVIA FRAUENSTEIN 1900 e.V. – Wiesbaden",
      "type": "Sonstige Registerbekanntmachung",
      "state": "Hessen",
      "amtsgericht": "Amtsgericht Wiesbaden",
      "registernummer": "VR 3459",
      "registerart": "VR",
      "company_name": "RADLER-CLUB NASSOVIA FRAUENSTEIN 1900 e.V.",
      "company_seat": "Wiesbaden",
      "details": "17.10.2024 (Bekanntmachungsdatum)\n\nHessen Amtsgericht Wiesbaden VR 3459\nSonstige Registerbekanntmachung 17.10.2024 (Eintragungsdatum)\n\nRADLER-CLUB NASSOVIA FRAUENSTEIN 1900 e.V.\neingetragener Verein\nWiesbaden\n\nDer Verein ist aufgelöst."
    },
    {
      "date": "2024-10-17",
      "original_text": "Einreichung neuer Dokumente\nBayern Amtsgericht München HRB 131870\nRaiffeisen-Waren GmbH Erdinger Land – Taufkirchen/Vils",
      "type": "Einreichung neuer Dokumente",
      "state": "Bayern",
      "amtsgericht": "Amtsgericht München",
      "registernummer": "HRB 131870",
      "registerart": "HRB",
      "company_name": "Raiffeisen-Waren GmbH Erdinger Land",
      "company_seat": "Taufkirchen/Vils",
      "details": "17.10.2024 (Bekanntmachungsdatum)\n\nBayern Amtsgericht München HRB 131870\nEinreichung neuer Dokumente\n\nRaiffeisen-Waren GmbH Erdinger Land\nGesellschaft mit beschränkter Haftung\nTaufkirchen/Vils\n\nDem Amtsgericht München -Registergericht- ist eine Liste der Mitglieder des Aufsichtsrats eingereicht worden, § 52 Abs. 3 S. 2 GmbHG."
    },
    {
      "date": "2024-10-17",
      "original_text": "Löschungsankündigung\nBayern Amtsgericht München HRB 221224\nReversus GmbH – München",
      "type": "Löschungsankündigung",
      "state": "Bayern",
      "amtsgericht": "Amtsgericht München",
      "registernummer": "HRB 221224",
      "registerart": "HRB",
      "company_name": "Reversus GmbH",
      "company_seat": "München",
      "details": "17.10.2024 (Bekanntmachungsdatum)\n\nBayern Amtsgericht München HRB 221224\nLöschungsankündigung 16.10.2024 (Eintragungsdatum)\n\nReversus GmbH\nGesellschaft mit beschränkter Haftung\nMünchen\n\nDas Registergericht beabsichtigt, die im Handelsregister eingetragene Gesellschaft wegen Vermögenslosigkeit von Amts wegen nach § 394 FamFG zu löschen. Die Frist zur Erhebung eines Widerspruchs ist auf drei Monate festgesetzt."
    },
    {
      "date": "2024-10-17",
      "original_text": "Registerbekanntmachung nach dem Umwandlungsgesetz\nNordrhein-Westfalen Amtsgericht Hamm HRB 9718\nRhenus Immobilien Logistik Düsseldorf GmbH – Holzwickede",
      "type": "Registerbekanntmachung nach dem Umwandlungsgesetz",
      "state": "Nordrhein-Westfalen",
      "amtsgericht": "Amtsgericht Hamm",
      "registernummer": "HRB 9718",
      "registerart": "HRB",
      "company_name": "Rhenus Immobilien Logistik Düsseldorf GmbH",
      "company_seat": "Holzwickede",
      "details": "17.10.2024 (Bekanntmachungsdatum)\n\nNordrhein-Westfalen Amtsgericht Hamm HRB 9718\nRegisterbekanntmachung nach dem Umwandlungsgesetz 17.10.2024 (Eintragungsdatum)\n\nRhenus Immobilien Logistik Düsseldorf GmbH\nGesellschaft mit beschränkter Haftung\nHolzwickede\n\nDen Gläubigern der an der Verschmelzung beteiligten Rechtsträger ist, wenn sie binnen sechs Monaten nach dem Tag, an dem die Eintragung der Verschmelzung in das Register des Sitzes derjenigen Rechtsträger deren Gläubiger sie sind, nach § 19 Absatz 3 UmwG als bekanntgemacht gilt, ihren Anspruch nach Grund und Höhe schriftlich anmelden, Sicherheit zu leisten, soweit sie nicht Befriedigung verlangen können. Dieses Recht steht den Gläubigern jedoch nur zu, wenn sie glaubhaft machen, dass durch die Verschmelzung die Erfüllung ihrer Forderung gefährdet wird."
    },
    {
      "date": "2024-10-17",
      "original_text": "Registerbekanntmachung nach dem Umwandlungsgesetz\nBayern Amtsgericht München HRA 119373\nRobert Wohlmuth e.K. – Alling",
      "type": "Registerbekanntmachung nach dem Umwandlungsgesetz",
      "state": "Bayern",
      "amtsgericht": "Amtsgericht München",
      "registernummer": "HRA 119373",
      "registerart": "HRA",
      "company_name": "Robert Wohlmuth e.K.",
      "company_seat": "Alling",
      "details": "17.10.2024 (Bekanntmachungsdatum)\n\nBayern Amtsgericht München HRA 119373\nRegisterbekanntmachung nach dem Umwandlungsgesetz 16.10.2024 (Eintragungsdatum)\n\nRobert Wohlmuth e.K.\nEinzelkaufmann / Einzelkauffrau\nAlling\n\nDen Gläubigern der an der Ausgliederung beteiligten Rechtsträger ist, wenn sie binnen sechs Monaten nach dem Tag, an dem die Eintragung der Ausgliederung in das Register des Sitzes desjenigen Rechtsträgers, dessen Gläubiger sie sind, nach §§ 125, 19 Abs. 3 UmwG als bekannt gemacht gilt, ihren Anspruch nach Grund und Höhe schriftlich anmelden, Sicherheit zu leisten, soweit sie nicht Befriedigung verlangen können. Dieses Recht steht den Gläubigern jedoch nur zu, wenn sie glaubhaft machen, dass durch die Ausgliederung die Erfüllung ihrer Forderung gefährdet wird."
    },
    {
      "date": "2024-10-17",
      "original_text": "Registerbekanntmachung nach dem Umwandlungsgesetz\nBerlin Amtsgericht Berlin (Charlottenburg) HRB 268451\nRoden - Berlin GmbH – Berlin",
      "type": "Registerbekanntmachung nach dem Umwandlungsgesetz",
      "state": "Berlin",
      "amtsgericht": "Amtsgericht Berlin (Charlottenburg)",
      "registernummer": "HRB 268451",
      "registerart": "HRB",
      "company_name": "Roden - Berlin GmbH",
      "company_seat": "Berlin",
      "details": "17.10.2024 (Bekanntmachungsdatum)\n\nBerlin Amtsgericht Berlin (Charlottenburg) HRB 268451\nRegisterbekanntmachung nach dem Umwandlungsgesetz 15.10.2024 (Eintragungsdatum)\n\nRoden - Berlin GmbH\nGesellschaft mit beschränkter Haftung\nBerlin\n\nZu Eintragungsnummer 1 vom 15.10.2024 wird als nicht eingetragen veröffentlicht: Den Gläubigern der an der Spaltung beteiligten Rechtsträger ist, wenn sie binnen sechs Monaten nach dem Tag, an dem die Eintragung der Spaltung in das Register des Sitzes desjenigen Rechtsträgers, dessen Gläubiger sie sind, als bekannt gemacht gilt, ihren Anspruch nach Grund und Höhe schriftlich anmelden, Sicherheit zu leisten, soweit sie nicht Befriedigung verlangen können. Dieses Recht steht den Gläubigern jedoch nur zu, wenn sie glaubhaft machen, dass durch die Spaltung die Erfüllung ihrer Forderung gefährdet wird. Das Recht, Sicherheitsleistung zu verlangen, steht Gläubigern nicht zu, die im Falle der Insolvenz ein Recht auf vorzugsweise Befriedigung aus einer Deckungsmasse haben, die nach gesetzlicher Vorschrift zu ihrem Schutz errichtet und staatlich überwacht ist."
    },
    {
      "date": "2024-10-17",
      "original_text": "Löschungsankündigung\nRheinland-Pfalz Amtsgericht Ludwigshafen a.Rhein (Ludwigshafen) VR 61223\nRuprechtiana e.V. – Neustadt/Wstr.",
      "type": "Löschungsankündigung",
      "state": "Rheinland-Pfalz",
      "amtsgericht": "Amtsgericht Ludwigshafen a.Rhein (Ludwigshafen)",
      "registernummer": "VR 61223",
      "registerart": "VR",
      "company_name": "Ruprechtiana e.V.",
      "company_seat": "Neustadt/Wstr.",
      "details": "17.10.2024 (Bekanntmachungsdatum)\n\nRheinland-Pfalz Amtsgericht Ludwigshafen a.Rhein (Ludwigshafen) VR 61223\nLöschungsankündigung\n\nRuprechtiana e.V.\neingetragener Verein\nNeustadt/Wstr.\n\nDas Registergericht beabsichtigt den Verein von Amts wegen aufgrund Wegfall aller Mitglieder nach § 395 FamFG zu löschen. Die Frist zur Erhebung eines Widerspruchs ist auf einen Monat festgesetzt."
    },
    {
      "date": "2024-10-17",
      "original_text": "Einreichung neuer Dokumente\nHessen Amtsgericht Gießen HRB 6492\nS-International Mittelhessen GmbH – Gießen",
      "type": "Einreichung neuer Dokumente",
      "state": "Hessen",
      "amtsgericht": "Amtsgericht Gießen",
      "registernummer": "HRB 6492",
      "registerart": "HRB",
      "company_name": "S-International Mittelhessen GmbH",
      "company_seat": "Gießen",
      "details": "17.10.2024 (Bekanntmachungsdatum)\n\nHessen Amtsgericht Gießen HRB 6492\nEinreichung neuer Dokumente\n\nS-International Mittelhessen GmbH\nGesellschaft mit beschränkter Haftung\nGießen\n\nAufgrund einer Änderung in den Personen der Aufsichtsratsmitglieder ist eine Liste der Mitglieder des Aufsichtsrates zum Handelsregister eingereicht worden."
    },
    {
      "date": "2024-10-17",
      "original_text": "Löschungsankündigung\nNordrhein-Westfalen Amtsgericht Krefeld HRB 18292\nSG-CPDM UG (haftungsbeschränkt) – Krefeld",
      "type": "Löschungsankündigung",
      "state": "Nordrhein-Westfalen",
      "amtsgericht": "Amtsgericht Krefeld",
      "registernummer": "HRB 18292",
      "registerart": "HRB",
      "company_name": "SG-CPDM UG (haftungsbeschränkt)",
      "company_seat": "Krefeld",
      "details": "17.10.2024 (Bekanntmachungsdatum)\n\nNordrhein-Westfalen Amtsgericht Krefeld HRB 18292\nLöschungsankündigung\n\nSG-CPDM UG (haftungsbeschränkt)\nGesellschaft mit beschränkter Haftung\nKrefeld\n\nDas Registergericht beabsichtigt die Gesellschaft von Amts wegen nach § 394 FamFG zu löschen. Die Frist zur Erhebung eines Widerspruchs ist auf einen Monat festgesetzt."
    },
    {
      "date": "2024-10-17",
      "original_text": "Registerbekanntmachung nach dem Umwandlungsgesetz\nSchleswig-Holstein Amtsgericht Pinneberg HRA 5514\nSMB Siebte Immobilien GmbH & Co. KG – Kollmar",
      "type": "Registerbekanntmachung nach dem Umwandlungsgesetz",
      "state": "Schleswig-Holstein",
      "amtsgericht": "Amtsgericht Pinneberg",
      "registernummer": "HRA 5514",
      "registerart": "HRA",
      "company_name": "SMB Siebte Immobilien GmbH & Co. KG",
      "company_seat": "Kollmar",
      "details": "17.10.2024 (Bekanntmachungsdatum)\n\nSchleswig-Holstein Amtsgericht Pinneberg HRA 5514\nRegisterbekanntmachung nach dem Umwandlungsgesetz 11.10.2024 (Eintragungsdatum)\n\nSMB Siebte Immobilien GmbH & Co. KG\nKommanditgesellschaft\nKollmar\n\nZu Eintragungsnummer 5 vom 11.10.2024 wird als nicht eingetragen veröffentlicht: Den Gläubigern ist, wenn sie binnen sechs Monaten nach dem Tag, an dem die Eintragung der Umwandlung als bekannt gemacht gilt, ihren Anspruch nach Grund und Höhe schriftlich anmelden, Sicherheit zu leisten, soweit sie nicht Befriedigung verlangen können. Dieses Recht steht den Gläubigern jedoch nur zu, wenn sie glaubhaft machen, dass durch die Umwandlung die Erfüllung ihrer Forderung gefährdet wird. Das Recht, Sicherheitsleistung zu verlangen, steht Gläubigern nicht zu, die im Falle der Insolvenz ein Recht auf vorzugsweise Befriedigung aus einer Deckungsmasse haben, die nach gesetzlicher Vorschrift zu ihrem Schutz errichtet und staatlich überwacht ist."
    },
    {
      "date": "2024-10-17",
      "original_text": "Registerbekanntmachung nach dem Umwandlungsgesetz\nNiedersachsen Amtsgericht Göttingen HRB 3497\nSchmidthals GmbH – Duderstadt",
      "type": "Registerbekanntmachung nach dem Umwandlungsgesetz",
      "state": "Niedersachsen",
      "amtsgericht": "Amtsgericht Göttingen",
      "registernummer": "HRB 3497",
      "registerart": "HRB",
      "company_name": "Schmidthals GmbH",
      "company_seat": "Duderstadt",
      "details": "17.10.2024 (Bekanntmachungsdatum)\n\nNiedersachsen Amtsgericht Göttingen HRB 3497\nRegisterbekanntmachung nach dem Umwandlungsgesetz 17.10.2024 (Eintragungsdatum)\n\nSchmidthals GmbH\nGesellschaft mit beschränkter Haftung\nDuderstadt\n\nDen Gläubigern der an der Verschmelzung beteiligten Rechtsträger ist, wenn sie binnen sechs Monaten nach dem Tag, an dem die Eintragung der Verschmelzung in das Register des Sitzes desjenigen Rechtsträgers, dessen Gläubiger sie sind, nach § 19  Abs.  3 UmwG als bekannt gemacht gilt, ihren Anspruch nach Grund und Höhe schriftlich anmelden, Sicherheit zu leisten, soweit sie nicht Befriedigung verlangen können. Dieses Recht steht den Gläubigern jedoch nur zu, wenn sie glaubhaft machen, dass durch die Verschmelzung die Erfüllung der Forderung gefährdet wird."
    },
    {
      "date": "2024-10-17",
      "original_text": "Registerbekanntmachung nach dem Umwandlungsgesetz\nBaden-Württemberg Amtsgericht Stuttgart HRB 765886\nSchneider Bauunternehmung Verwaltungs GmbH – Haigerloch",
      "type": "Registerbekanntmachung nach dem Umwandlungsgesetz",
      "state": "Baden-Württemberg",
      "amtsgericht": "Amtsgericht Stuttgart",
      "registernummer": "HRB 765886",
      "registerart": "HRB",
      "company_name": "Schneider Bauunternehmung Verwaltungs GmbH",
      "company_seat": "Haigerloch",
      "details": "17.10.2024 (Bekanntmachungsdatum)\n\nBaden-Württemberg Amtsgericht Stuttgart HRB 765886\nRegisterbekanntmachung nach dem Umwandlungsgesetz 17.10.2024 (Eintragungsdatum)\n\nSchneider Bauunternehmung Verwaltungs GmbH\nGesellschaft mit beschränkter Haftung\nHaigerloch\n\nAls nicht eingetragen wird bekanntgemacht:\nDen Gläubigern der an der Verschmelzung beteiligten Rechtsträger ist, wenn sie binnen sechs Monaten nach dem Tag, an dem die Eintragung der Verschmelzung in das Register des Sitzes desjenigen Rechtsträgers, dessen Gläubiger sie sind, nach § 19 Abs. 3 UmwG als bekanntgemacht gilt, ihren Anspruch nach Grund und Höhe schriftlich anmelden, Sicherheit zu leisten, soweit sie nicht Befriedigung verlangen können. Dieses Recht steht den Gläubigern jedoch nur zu, wenn sie glaubhaft machen, dass durch die Verschmelzung die Erfüllung ihrer Forderung gefährdet wird."
    },
    {
      "date": "2024-10-17",
      "original_text": "Registerbekanntmachung nach dem Umwandlungsgesetz\nNordrhein-Westfalen Amtsgericht Bad Oeynhausen HRB 17010\nSchroers & Schroers Vertriebsgesellschaft mbH – Hüllhorst",
      "type": "Registerbekanntmachung nach dem Umwandlungsgesetz",
      "state": "Nordrhein-Westfalen",
      "amtsgericht": "Amtsgericht Bad Oeynhausen",
      "registernummer": "HRB 17010",
      "registerart": "HRB",
      "company_name": "Schroers & Schroers Vertriebsgesellschaft mbH",
      "company_seat": "Hüllhorst",
      "details": "17.10.2024 (Bekanntmachungsdatum)\n\nNordrhein-Westfalen Amtsgericht Bad Oeynhausen HRB 17010\nRegisterbekanntmachung nach dem Umwandlungsgesetz 17.10.2024 (Eintragungsdatum)\n\nSchroers & Schroers Vertriebsgesellschaft mbH\nGesellschaft mit beschränkter Haftung\nHüllhorst\n\nDen Gläubigern der an der Verschmelzung beteiligten Rechtsträger ist, wenn sie binnen sechs Monaten nach dem Tag, an dem die Eintragung der Verschmelzung in das Register des Sitzes desjenigen Rechtsträgers, dessen Gläubiger sie sind, nach § 19 Absatz 3 UmwG als bekanntgemacht gilt, ihren Anspruch nach Grund und Höhe schriftlich anmelden, Sicherheit zu leisten, soweit sie nicht Befriedigung verlangen können. Dieses Recht steht den Gläubigern jedoch nur zu, wenn sie glaubhaft machen, dass durch die Verschmelzung die Erfüllung ihrer Forderung gefährdet wird."
    },
    {
      "date": "2024-10-17",
      "original_text": "Registerbekanntmachung nach dem Umwandlungsgesetz\nNordrhein-Westfalen Amtsgericht Köln HRB 71293\nSchuy Klebetechnik GmbH – Köln",
      "type": "Registerbekanntmachung nach dem Umwandlungsgesetz",
      "state": "Nordrhein-Westfalen",
      "amtsgericht": "Amtsgericht Köln",
      "registernummer": "HRB 71293",
      "registerart": "HRB",
      "company_name": "Schuy Klebetechnik GmbH",
      "company_seat": "Köln",
      "details": "17.10.2024 (Bekanntmachungsdatum)\n\nNordrhein-Westfalen Amtsgericht Köln HRB 71293\nRegisterbekanntmachung nach dem Umwandlungsgesetz 17.10.2024 (Eintragungsdatum)\n\nSchuy Klebetechnik GmbH\nGesellschaft mit beschränkter Haftung\nKöln\n\nDen Gläubigern der an der Verschmelzung beteiligten Rechtsträger ist, wenn sie binnen sechs Monaten nach dem Tag, an dem die Eintragung der Verschmelzung in das Register des Sitzes desjenigen Rechtsträgers, dessen Gläubiger sie sind, nach § 19 Absatz 3 UmwG als bekanntgemacht gilt, ihren Anspruch nach Grund und Höhe schriftlich anmelden, Sicherheit zu leisten, soweit sie nicht Befriedigung verlangen können. Dieses Recht steht den Gläubigern jedoch nur zu, wenn sie glaubhaft machen, dass durch die Verschmelzung die Erfüllung ihrer Forderung gefährdet wird."
    },
    {
      "date": "2024-10-17",
      "original_text": "Registerbekanntmachung nach dem Umwandlungsgesetz\nBerlin Amtsgericht Berlin (Charlottenburg) HRA 63247\nSchwarzer Marc e.K. – Berlin",
      "type": "Registerbekanntmachung nach dem Umwandlungsgesetz",
      "state": "Berlin",
      "amtsgericht": "Amtsgericht Berlin (Charlottenburg)",
      "registernummer": "HRA 63247",
      "registerart": "HRA",
      "company_name": "Schwarzer Marc e.K.",
      "company_seat": "Berlin",
      "details": "17.10.2024 (Bekanntmachungsdatum)\n\nBerlin Amtsgericht Berlin (Charlottenburg) HRA 63247\nRegisterbekanntmachung nach dem Umwandlungsgesetz 16.10.2024 (Eintragungsdatum)\n\nSchwarzer Marc e.K.\nEinzelkaufmann / Einzelkauffrau\nBerlin\n\nZu Eintragungsnummer 2 vom 16.10.2024 wird als nicht eingetragen veröffentlicht: Den Gläubigern der an der Spaltung beteiligten Rechtsträger ist, wenn sie binnen sechs Monaten nach dem Tag, an dem die Eintragung der Spaltung in das Register des Sitzes desjenigen Rechtsträgers, dessen Gläubiger sie sind, als bekannt gemacht gilt, ihren Anspruch nach Grund und Höhe schriftlich anmelden, Sicherheit zu leisten, soweit sie nicht Befriedigung verlangen können. Dieses Recht steht den Gläubigern jedoch nur zu, wenn sie glaubhaft machen, dass durch die Spaltung die Erfüllung ihrer Forderung gefährdet wird. Das Recht, Sicherheitsleistung zu verlangen, steht Gläubigern nicht zu, die im Falle der Insolvenz ein Recht auf vorzugsweise Befriedigung aus einer Deckungsmasse haben, die nach gesetzlicher Vorschrift zu ihrem Schutz errichtet und staatlich überwacht ist."
    },
    {
      "date": "2024-10-17",
      "original_text": "Registerbekanntmachung nach dem Umwandlungsgesetz\nBaden-Württemberg Amtsgericht Mannheim HRA 712082\nSlavica Djurkovic Gebäudeservice e.K. – Rheinstetten",
      "type": "Registerbekanntmachung nach dem Umwandlungsgesetz",
      "state": "Baden-Württemberg",
      "amtsgericht": "Amtsgericht Mannheim",
      "registernummer": "HRA 712082",
      "registerart": "HRA",
      "company_name": "Slavica Djurkovic Gebäudeservice e.K.",
      "company_seat": "Rheinstetten",
      "details": "17.10.2024 (Bekanntmachungsdatum)\n\nBaden-Württemberg Amtsgericht Mannheim HRA 712082\nRegisterbekanntmachung nach dem Umwandlungsgesetz 17.10.2024 (Eintragungsdatum)\n\nSlavica Djurkovic Gebäudeservice e.K.\nEinzelkaufmann / Einzelkauffrau\nRheinstetten\n\nDen Gläubigern der an der Ausgliederung beteiligten Rechtsträger ist, wenn sie binnen sechs Monaten nach dem Tag, an dem die Eintragung der Ausgliederung in das Register des Sitzes desjenigen Rechtsträgers, dessen Gläubiger sie sind, nach § 19 Abs. 3 UmwG als bekanntgemacht gilt, ihren Anspruch nach Grund und Höhe schriftlich anmelden, Sicherheit zu leisten, soweit sie nicht Befriedigung verlangen können. Dieses Recht steht den Gläubigern jedoch nur zu, wenn sie glaubhaft machen, dass durch die Ausgliederung die Erfüllung ihrer Forderung gefährdet wird."
    },
    {
      "date": "2024-10-17",
      "original_text": "Einreichung neuer Dokumente\nBaden-Württemberg Amtsgericht Stuttgart HRB 728140\nStadtwerke Schorndorf GmbH – Schorndorf",
      "type": "Einreichung neuer Dokumente",
      "state": "Baden-Württemberg",
      "amtsgericht": "Amtsgericht Stuttgart",
      "registernummer": "HRB 728140",
      "registerart": "HRB",
      "company_name": "Stadtwerke Schorndorf GmbH",
      "company_seat": "Schorndorf",
      "details": "17.10.2024 (Bekanntmachungsdatum)\n\nBaden-Württemberg Amtsgericht Stuttgart HRB 728140\nEinreichung neuer Dokumente\n\nStadtwerke Schorndorf GmbH\nGesellschaft mit beschränkter Haftung\nSchorndorf\n\nDie Gesellschaft hat am 14.10.2024 die Liste über die Zusammensetzung des Aufsichtsrats zum Handelsregister eingereicht."
    },
    {
      "date": "2024-10-17",
      "original_text": "Registerbekanntmachung nach dem Umwandlungsgesetz\nBayern Amtsgericht Augsburg HRA 10986\nStöhr Armaturen GmbH & Co KG – Königsbrunn",
      "type": "Registerbekanntmachung nach dem Umwandlungsgesetz",
      "state": "Bayern",
      "amtsgericht": "Amtsgericht Augsburg",
      "registernummer": "HRA 10986",
      "registerart": "HRA",
      "company_name": "Stöhr Armaturen GmbH & Co KG",
      "company_seat": "Königsbrunn",
      "details": "17.10.2024 (Bekanntmachungsdatum)\n\nBayern Amtsgericht Augsburg HRA 10986\nRegisterbekanntmachung nach dem Umwandlungsgesetz 16.10.2024 (Eintragungsdatum)\n\nStöhr Armaturen GmbH & Co KG\nKommanditgesellschaft\nKönigsbrunn\n\nDen Gläubigern der an der Verschmelzung beteiligten Rechtsträger ist, wenn sie binnen sechs Monaten nach dem Tag, an dem die Eintragung der Verschmelzung in das Register des Sitzes desjenigen Rechtsträgers, dessen Gläubiger sie sind, nach § 19 Abs. 3 UmwG als bekannt gemacht gilt, ihren Anspruch nach Grund und Höhe schriftlich anmelden, Sicherheit zu leisten, soweit sie nicht Befriedigung verlangen können. Dieses Recht steht den Gläubigern jedoch nur zu, wenn sie glaubhaft machen, dass durch die Verschmelzung die Erfüllung ihrer Forderung gefährdet wird."
    },
    {
      "date": "2024-10-17",
      "original_text": "Löschungsankündigung\nBayern Amtsgericht Augsburg HRB 29552\nSybizz GmbH – Gersthofen",
      "type": "Löschungsankündigung",
      "state": "Bayern",
      "amtsgericht": "Amtsgericht Augsburg",
      "registernummer": "HRB 29552",
      "registerart": "HRB",
      "company_name": "Sybizz GmbH",
      "company_seat": "Gersthofen",
      "details": "17.10.2024 (Bekanntmachungsdatum)\n\nBayern Amtsgericht Augsburg HRB 29552\nLöschungsankündigung 15.10.2024 (Eintragungsdatum)\n\nSybizz GmbH\nGesellschaft mit beschränkter Haftung\nGersthofen"
    },
    {
      "date": "2024-10-17",
      "original_text": "Löschungsankündigung\nRheinland-Pfalz Amtsgericht Bad Kreuznach HRB 23491\nSyntinnovatex UG (haftungsbeschränkt) – Baumholder",
      "type": "Löschungsankündigung",
      "state": "Rheinland-Pfalz",
      "amtsgericht": "Amtsgericht Bad Kreuznach",
      "registernummer": "HRB 23491",
      "registerart": "HRB",
      "company_name": "Syntinnovatex UG (haftungsbeschränkt)",
      "company_seat": "Baumholder",
      "details": "17.10.2024 (Bekanntmachungsdatum)\n\nRheinland-Pfalz Amtsgericht Bad Kreuznach HRB 23491\nLöschungsankündigung\n\nSyntinnovatex UG (haftungsbeschränkt)\nGesellschaft mit beschränkter Haftung\nBaumholder\n\nDas Registergericht beabsichtigt die Gesellschaft wegen Vermögenslosigkeit im Handelsregister von Amts wegen nach § 394 FamFG zu löschen. Die Frist zur Erhebung eines Widerspruchs gegen die beabsichtigte Löschung ist auf einen Monat ab Veröffentlichung bestimmt."
    },
    {
      "date": "2024-10-17",
      "original_text": "Einreichung neuer Dokumente\nNiedersachsen Amtsgericht Braunschweig HRB 1532\nTAP Telion-Air-Pac Gesellschaft für moderne Verpackungen mit beschränkter Haftung – Braunschweig",
      "type": "Einreichung neuer Dokumente",
      "state": "Niedersachsen",
      "amtsgericht": "Amtsgericht Braunschweig",
      "registernummer": "HRB 1532",
      "registerart": "HRB",
      "company_name": "TAP Telion-Air-Pac Gesellschaft für moderne Verpackungen mit beschränkter Haftung",
      "company_seat": "Braunschweig",
      "details": "17.10.2024 (Bekanntmachungsdatum)\n\nNiedersachsen Amtsgericht Braunschweig HRB 1532\nEinreichung neuer Dokumente\n\nTAP Telion-Air-Pac Gesellschaft für moderne Verpackungen mit beschränkter Haftung\nGesellschaft mit beschränkter Haftung\nBraunschweig\n\nDie Liste der Mitglieder des Aufsichtsrats wurde beim Registergericht eingereicht."
    },
    {
      "date": "2024-10-17",
      "original_text": "Registerbekanntmachung nach dem Umwandlungsgesetz\nBrandenburg Amtsgericht Cottbus HRB 16839\nTHINK Digital Consulting GmbH – Schönefeld",
      "type": "Registerbekanntmachung nach dem Umwandlungsgesetz",
      "state": "Brandenburg",
      "amtsgericht": "Amtsgericht Cottbus",
      "registernummer": "HRB 16839",
      "registerart": "HRB",
      "company_name": "THINK Digital Consulting GmbH",
      "company_seat": "Schönefeld",
      "details": "17.10.2024 (Bekanntmachungsdatum)\n\nBrandenburg Amtsgericht Cottbus HRB 16839\nRegisterbekanntmachung nach dem Umwandlungsgesetz 15.10.2024 (Eintragungsdatum)\n\nTHINK Digital Consulting GmbH\nGesellschaft mit beschränkter Haftung\nSchönefeld\n\nDen Gläubigern der an der Verschmelzung beteiligten Rechtsträger ist, wenn sie binnen sechs Monaten nach dem Tag, an dem die Eintragung der Verschmelzung in das Register des Sitzes desjenigen Rechtsträgers, dessen Gläubiger sie sind, als bekannt gemacht gilt, ihren Anspruch nach Grund und Höhe schriftlich anmelden, Sicherheit zu leisten, soweit sie nicht Befriedigung verlangen können. Dieses Recht steht den Gläubigern jedoch nur zu, wenn sie glaubhaft machen, dass durch die Verschmelzung die Erfüllung ihrer Forderung gefährdet wird"
    },
    {
      "date": "2024-10-17",
      "original_text": "Einreichung neuer Dokumente\nBerlin Amtsgericht Berlin (Charlottenburg) HRB 65553\nTME Pharma Aktiengesellschaft – Berlin",
      "type": "Einreichung neuer Dokumente",
      "state": "Berlin",
      "amtsgericht": "Amtsgericht Berlin (Charlottenburg)",
      "registernummer": "HRB 65553",
      "registerart": "HRB",
      "company_name": "TME Pharma Aktiengesellschaft",
      "company_seat": "Berlin",
      "details": "17.10.2024 (Bekanntmachungsdatum)\n\nBerlin Amtsgericht Berlin (Charlottenburg) HRB 65553\nEinreichung neuer Dokumente\n\nTME Pharma Aktiengesellschaft\nAktiengesellschaft\nBerlin\n\nAls nicht eingetragen wird veröffentlicht: Es wurde eine neue Liste der Aufsichtsratsmitglieder eingereicht (§ 106 AktG)."
    },
    {
      "date": "2024-10-17",
      "original_text": "Registerbekanntmachung nach dem Umwandlungsgesetz\nBerlin Amtsgericht Berlin (Charlottenburg) HRB 268515\nTQ Engineering GmbH – Berlin",
      "type": "Registerbekanntmachung nach dem Umwandlungsgesetz",
      "state": "Berlin",
      "amtsgericht": "Amtsgericht Berlin (Charlottenburg)",
      "registernummer": "HRB 268515",
      "registerart": "HRB",
      "company_name": "TQ Engineering GmbH",
      "company_seat": "Berlin",
      "details": "17.10.2024 (Bekanntmachungsdatum)\n\nBerlin Amtsgericht Berlin (Charlottenburg) HRB 268515\nRegisterbekanntmachung nach dem Umwandlungsgesetz 16.10.2024 (Eintragungsdatum)\n\nTQ Engineering GmbH\nGesellschaft mit beschränkter Haftung\nBerlin\n\nZu Eintragungsnummer 1 vom 16.10.2024 wird als nicht eingetragen veröffentlicht: Den Gläubigern ist, wenn sie binnen sechs Monaten nach dem Tag, an dem die Eintragung der Umwandlung als bekannt gemacht gilt, ihren Anspruch nach Grund und Höhe schriftlich anmelden, Sicherheit zu leisten, soweit sie nicht Befriedigung verlangen können. Dieses Recht steht den Gläubigern jedoch nur zu, wenn sie glaubhaft machen, dass durch die Umwandlung die Erfüllung ihrer Forderung gefährdet wird. Das Recht, Sicherheitsleistung zu verlangen, steht Gläubigern nicht zu, die im Falle der Insolvenz ein Recht auf vorzugsweise Befriedigung aus einer Deckungsmasse haben, die nach gesetzlicher Vorschrift zu ihrem Schutz errichtet und staatlich überwacht ist."
    },
    {
      "date": "2024-10-17",
      "original_text": "Registerbekanntmachung nach dem Umwandlungsgesetz\nBerlin Amtsgericht Berlin (Charlottenburg) PR 1250\nTQ Engineering Uhlenberg & Müller Partnerschaft mbB, Ingenieure – Berlin",
      "type": "Registerbekanntmachung nach dem Umwandlungsgesetz",
      "state": "Berlin",
      "amtsgericht": "Amtsgericht Berlin (Charlottenburg)",
      "registernummer": "PR 1250",
      "registerart": "PR",
      "company_name": "TQ Engineering Uhlenberg & Müller Partnerschaft mbB, Ingenieure",
      "company_seat": "Berlin",
      "details": "17.10.2024 (Bekanntmachungsdatum)\n\nBerlin Amtsgericht Berlin (Charlottenburg) PR 1250\nRegisterbekanntmachung nach dem Umwandlungsgesetz 16.10.2024 (Eintragungsdatum)\n\nTQ Engineering Uhlenberg & Müller Partnerschaft mbB, Ingenieure\nPartnerschaftsgesellschaft\nBerlin\n\nZu Eintragungsnummer 2 vom 16.10.2024 wird als nicht eingetragen veröffentlicht: Den Gläubigern ist, wenn sie binnen sechs Monaten nach dem Tag, an dem die Eintragung der Umwandlung als bekannt gemacht gilt, ihren Anspruch nach Grund und Höhe schriftlich anmelden, Sicherheit zu leisten, soweit sie nicht Befriedigung verlangen können. Dieses Recht steht den Gläubigern jedoch nur zu, wenn sie glaubhaft machen, dass durch die Umwandlung die Erfüllung ihrer Forderung gefährdet wird. Das Recht, Sicherheitsleistung zu verlangen, steht Gläubigern nicht zu, die im Falle der Insolvenz ein Recht auf vorzugsweise Befriedigung aus einer Deckungsmasse haben, die nach gesetzlicher Vorschrift zu ihrem Schutz errichtet und staatlich überwacht ist."
    },
    {
      "date": "2024-10-17",
      "original_text": "Registerbekanntmachung nach dem Umwandlungsgesetz\nBaden-Württemberg Amtsgericht Ulm HRA 725394\nTailfinger Druckerei Heinrich Weidle GmbH & Co. KG – Ulm",
      "type": "Registerbekanntmachung nach dem Umwandlungsgesetz",
      "state": "Baden-Württemberg",
      "amtsgericht": "Amtsgericht Ulm",
      "registernummer": "HRA 725394",
      "registerart": "HRA",
      "company_name": "Tailfinger Druckerei Heinrich Weidle GmbH & Co. KG",
      "company_seat": "Ulm",
      "details": "17.10.2024 (Bekanntmachungsdatum)\n\nBaden-Württemberg Amtsgericht Ulm HRA 725394\nRegisterbekanntmachung nach dem Umwandlungsgesetz 17.10.2024 (Eintragungsdatum)\n\nTailfinger Druckerei Heinrich Weidle GmbH & Co. KG\nKommanditgesellschaft\nUlm\n\nAls nicht eingetragen wird bekanntgemacht:\nDen Gläubigern der an der Verschmelzung beteiligten Rechtsträger ist, wenn sie binnen sechs Monaten nach dem Tag, an dem die Eintragung der Verschmelzung in das Register des Sitzes desjenigen Rechtsträgers, dessen Gläubiger sie sind, nach § 19 Abs. 3 UmwG als bekanntgemacht gilt, ihren Anspruch nach Grund und Höhe schriftlich anmelden, Sicherheit zu leisten, soweit sie nicht Befriedigung verlangen können. Dieses Recht steht den Gläubigern jedoch nur zu, wenn sie glaubhaft machen, dass durch die Verschmelzung die Erfüllung ihrer Forderung gefährdet wird."
    },
    {
      "date": "2024-10-17",
      "original_text": "Einreichung neuer Dokumente\nBaden-Württemberg Amtsgericht Freiburg HRB 490552\nTechnische Werke Oberkirch GmbH – Oberkirch",
      "type": "Einreichung neuer Dokumente",
      "state": "Baden-Württemberg",
      "amtsgericht": "Amtsgericht Freiburg",
      "registernummer": "HRB 490552",
      "registerart": "HRB",
      "company_name": "Technische Werke Oberkirch GmbH",
      "company_seat": "Oberkirch",
      "details": "17.10.2024 (Bekanntmachungsdatum)\n\nBaden-Württemberg Amtsgericht Freiburg HRB 490552\nEinreichung neuer Dokumente\n\nTechnische Werke Oberkirch GmbH\nGesellschaft mit beschränkter Haftung\nOberkirch\n\nDie Gesellschaft hat am 16.10.2024 die Liste über die Zusammensetzung des Aufsichtsrats zum Handelsregister eingereicht."
    },
    {
      "date": "2024-10-17",
      "original_text": "Löschungsankündigung\nSachsen Amtsgericht Leipzig HRB 22011\nTerra Development GmbH – Leipzig",
      "type": "Löschungsankündigung",
      "state": "Sachsen",
      "amtsgericht": "Amtsgericht Leipzig",
      "registernummer": "HRB 22011",
      "registerart": "HRB",
      "company_name": "Terra Development GmbH",
      "company_seat": "Leipzig",
      "details": "17.10.2024 (Bekanntmachungsdatum)\n\nSachsen Amtsgericht Leipzig HRB 22011\nLöschungsankündigung 17.10.2024 (Eintragungsdatum)\n\nTerra Development GmbH\nGesellschaft mit beschränkter Haftung\nLeipzig\n\nDas Registergericht beabsichtigt, die im Handelsregister eingetragene Gesellschaft von Amts wegen nach § 394 FamFG zu löschen. Die Frist zu Erhebung eines Widerspruchs gegen die beabsichtigte Löschung wird auf einen Monat festgesetzt."
    },
    {
      "date": "2024-10-17",
      "original_text": "Registerbekanntmachung nach dem Umwandlungsgesetz\nBayern Amtsgericht Fürth HRB 16759\nTischkultur UG (haftungsbeschränkt) – Erlangen",
      "type": "Registerbekanntmachung nach dem Umwandlungsgesetz",
      "state": "Bayern",
      "amtsgericht": "Amtsgericht Fürth",
      "registernummer": "HRB 16759",
      "registerart": "HRB",
      "company_name": "Tischkultur UG (haftungsbeschränkt)",
      "company_seat": "Erlangen",
      "details": "17.10.2024 (Bekanntmachungsdatum)\n\nBayern Amtsgericht Fürth HRB 16759\nRegisterbekanntmachung nach dem Umwandlungsgesetz 16.10.2024 (Eintragungsdatum)\n\nTischkultur UG (haftungsbeschränkt)\nGesellschaft mit beschränkter Haftung\nErlangen\n\nDen Gläubigern der an der Verschmelzung beteiligten Rechtsträger ist, wenn sie binnen sechs Monaten nach dem Tag, an dem die Eintragung der Verschmelzung in das Register des Sitzes desjenigen Rechtsträgers, dessen Gläubiger sie sind, nach § 19 Abs. 3 UmwG als bekannt gemacht gilt, ihren Anspruch nach Grund und Höhe schriftlich anmelden, Sicherheit zu leisten, soweit sie nicht Befriedigung verlangen können. Dieses Recht steht den Gläubigern jedoch nur zu, wenn sie glaubhaft machen, dass durch die Verschmelzung die Erfüllung ihrer Forderung gefährdet wird."
    },
    {
      "date": "2024-10-17",
      "original_text": "Löschungsankündigung\nSchleswig-Holstein Amtsgericht Flensburg HRB 13986\nTotalOnline GmbH – Flensburg",
      "type": "Löschungsankündigung",
      "state": "Schleswig-Holstein",
      "amtsgericht": "Amtsgericht Flensburg",
      "registernummer": "HRB 13986",
      "registerart": "HRB",
      "company_name": "TotalOnline GmbH",
      "company_seat": "Flensburg",
      "details": "17.10.2024 (Bekanntmachungsdatum)\n\nSchleswig-Holstein Amtsgericht Flensburg HRB 13986\nLöschungsankündigung\n\nTotalOnline GmbH\nGesellschaft mit beschränkter Haftung\nFlensburg\n\nEs ist die Löschung der nachstehenden Gesellschaft wegen Vermögenslosigkeit gemäß § 394 FamFG beabsichtigt.\nWiderspruchsfrist: 2 Monate."
    },
    {
      "date": "2024-10-17",
      "original_text": "Sonstige Registerbekanntmachung\nBaden-Württemberg Amtsgericht Stuttgart HRB 780751\nTriStyle Customerce GmbH – Stuttgart",
      "type": "Sonstige Registerbekanntmachung",
      "state": "Baden-Württemberg",
      "amtsgericht": "Amtsgericht Stuttgart",
      "registernummer": "HRB 780751",
      "registerart": "HRB",
      "company_name": "TriStyle Customerce GmbH",
      "company_seat": "Stuttgart",
      "details": "17.10.2024 (Bekanntmachungsdatum)\n\nBaden-Württemberg Amtsgericht Stuttgart HRB 780751\nSonstige Registerbekanntmachung 17.10.2024 (Eintragungsdatum)\n\nTriStyle Customerce GmbH\nGesellschaft mit beschränkter Haftung\nStuttgart\n\nDen Gläubigern der Gesellschaft, deren Forderungen begründet worden sind, bevor die Eintragung der Beendigung des Vertrages in das Handelsregister nach § 10 HGB als bekanntgemacht gilt, ist vom anderen Vertragsteil Sicherheit zu leisten, wenn sie sich binnen sechs Monaten nach der Bekanntmachung zu diesem Zweck bei ihm melden."
    },
    {
      "date": "2024-10-17",
      "original_text": "Registerbekanntmachung nach dem Umwandlungsgesetz\nHessen Amtsgericht Offenbach am Main HRB 45732\nUC Unlimited Cruises GmbH – Langen (Hessen)",
      "type": "Registerbekanntmachung nach dem Umwandlungsgesetz",
      "state": "Hessen",
      "amtsgericht": "Amtsgericht Offenbach am Main",
      "registernummer": "HRB 45732",
      "registerart": "HRB",
      "company_name": "UC Unlimited Cruises GmbH",
      "company_seat": "Langen (Hessen)",
      "details": "17.10.2024 (Bekanntmachungsdatum)\n\nHessen Amtsgericht Offenbach am Main HRB 45732\nRegisterbekanntmachung nach dem Umwandlungsgesetz 17.10.2024 (Eintragungsdatum)\n\nUC Unlimited Cruises GmbH\nGesellschaft mit beschränkter Haftung\nLangen (Hessen)\n\nDen Gläubigern der an der Verschmelzung beteiligten Rechtsträger ist, wenn sie binnen sechs Monaten nach dem Tag, an dem die Eintragung der Verschmelzung in das Register des Sitzes desjenigen Rechtsträgers, dessen Gläubiger sie sind, nach § 19 Absatz 3 UmwG bekannt gemacht worden ist, ihren Anspruch nach Grund und Höhe schriftlich anmelden, Sicherheit zu leisten, soweit sie nicht Befriedigung verlangen können. Dieses Recht steht den Gläubigern jedoch nur zu, wenn sie glaubhaft machen, dass durch die Verschmelzung die Erfüllung ihrer Forderung gefährdet wird."
    },
    {
      "date": "2024-10-17",
      "original_text": "Registerbekanntmachung nach dem Umwandlungsgesetz\nHessen Amtsgericht Offenbach am Main HRA 41620\nUC Unlimited Cruises GmbH & Co. KG – Langen (Hessen)",
      "type": "Registerbekanntmachung nach dem Umwandlungsgesetz",
      "state": "Hessen",
      "amtsgericht": "Amtsgericht Offenbach am Main",
      "registernummer": "HRA 41620",
      "registerart": "HRA",
      "company_name": "UC Unlimited Cruises GmbH & Co. KG",
      "company_seat": "Langen (Hessen)",
      "details": "17.10.2024 (Bekanntmachungsdatum)\n\nHessen Amtsgericht Offenbach am Main HRA 41620\nRegisterbekanntmachung nach dem Umwandlungsgesetz 17.10.2024 (Eintragungsdatum)\n\nUC Unlimited Cruises GmbH & Co. KG\nKommanditgesellschaft\nLangen (Hessen)\n\nDen Gläubigern der an der Verschmelzung beteiligten Rechtsträger ist, wenn sie binnen sechs Monaten nach dem Tag, an dem die Eintragung der Verschmelzung in das Register des Sitzes desjenigen Rechtsträgers, dessen Gläubiger sie sind, nach § 19 Absatz 3 UmwG bekannt gemacht worden ist, ihren Anspruch nach Grund und Höhe schriftlich anmelden, Sicherheit zu leisten, soweit sie nicht Befriedigung verlangen können. Dieses Recht steht den Gläubigern jedoch nur zu, wenn sie glaubhaft machen, dass durch die Verschmelzung die Erfüllung ihrer Forderung gefährdet wird."
    },
    {
      "date": "2024-10-17",
      "original_text": "Registerbekanntmachung nach dem Umwandlungsgesetz\nThüringen Amtsgericht Jena HRA 505104\nVermietung & Logistik Böttcher e.K. – Jena",
      "type": "Registerbekanntmachung nach dem Umwandlungsgesetz",
      "state": "Thüringen",
      "amtsgericht": "Amtsgericht Jena",
      "registernummer": "HRA 505104",
      "registerart": "HRA",
      "company_name": "Vermietung & Logistik Böttcher e.K.",
      "company_seat": "Jena",
      "details": "17.10.2024 (Bekanntmachungsdatum)\n\nThüringen Amtsgericht Jena HRA 505104\nRegisterbekanntmachung nach dem Umwandlungsgesetz 17.10.2024 (Eintragungsdatum)\n\nVermietung & Logistik Böttcher e.K.\nEinzelkaufmann / Einzelkauffrau\nJena\n\nNicht eingetragen: Den Gläubigern der an der Ausgliederung beteiligten Rechtsträger, ist wenn sie binnen sechs Monaten nach dem Tag, an dem die Eintragung der Ausgliederung in das Register des Sitzes desjenigen Rechtsträgers, dessen Gläubiger sie sind, nach §§125, 19 Abs. 3 UmwG als bekanntgemacht gilt, ihren Anspruch nach Grund und Höhe schriftlich anmelden, Sicherheit zu leisten, soweit sie nicht Befriedigung verlangen können. Dieses Recht steht ihnen jedoch nur zu, wenn sie glaubhaft machen, daß durch die Ausgliederung die Erfüllung ihrer Forderung gefährdet wird."
    },
    {
      "date": "2024-10-17",
      "original_text": "Registerbekanntmachung nach dem Umwandlungsgesetz\nNordrhein-Westfalen Amtsgericht Dortmund HRB 28754\nW Ventures Holding GmbH – Dortmund",
      "type": "Registerbekanntmachung nach dem Umwandlungsgesetz",
      "state": "Nordrhein-Westfalen",
      "amtsgericht": "Amtsgericht Dortmund",
      "registernummer": "HRB 28754",
      "registerart": "HRB",
      "company_name": "W Ventures Holding GmbH",
      "company_seat": "Dortmund",
      "details": "17.10.2024 (Bekanntmachungsdatum)\n\nNordrhein-Westfalen Amtsgericht Dortmund HRB 28754\nRegisterbekanntmachung nach dem Umwandlungsgesetz 16.10.2024 (Eintragungsdatum)\n\nW Ventures Holding GmbH\nGesellschaft mit beschränkter Haftung\nDortmund\n\nDen Gläubigern der an der Verschmelzung beteiligten Rechtsträger ist, wenn sie binnen sechs Monaten nach dem Tag, an dem die Eintragung der Verschmelzung in das Register des Sitzes desjenigen Rechtsträgers, dessen Gläubiger sie sind, nach § 19 Absatz 3 UmwG als bekanntgemacht gilt, ihren Anspruch nach Grund und Höhe schriftlich anmelden, Sicherheit zu leisten, soweit sie nicht Befriedigung verlangen können. Dieses Recht steht den Gläubigern jedoch nur zu, wenn sie glaubhaft machen, dass durch die Verschmelzung die Erfüllung ihrer Forderung gefährdet wird."
    },
    {
      "date": "2024-10-17",
      "original_text": "Sonstige Registerbekanntmachung\nHamburg Amtsgericht Hamburg HRB 188336\nWECOYA SERVICES & CLAIMS GmbH – Hamburg",
      "type": "Sonstige Registerbekanntmachung",
      "state": "Hamburg",
      "amtsgericht": "Amtsgericht Hamburg",
      "registernummer": "HRB 188336",
      "registerart": "HRB",
      "company_name": "WECOYA SERVICES & CLAIMS GmbH",
      "company_seat": "Hamburg",
      "details": "17.10.2024 (Bekanntmachungsdatum)\n\nHamburg Amtsgericht Hamburg HRB 188336\nSonstige Registerbekanntmachung 14.10.2024 (Eintragungsdatum)\n\nWECOYA SERVICES & CLAIMS GmbH\nGesellschaft mit beschränkter Haftung\nHamburg\n\nAls nicht eingetragen wird bekannt gemacht:  Den Gläubigern der Gesellschaft, deren Forderungen begründet worden sind, bevor die Eintragung der Vertragsbeendigung in das Handelsregister nach § 10 HGB als bekannt gemacht gilt, ist vom anderen Vertragsteil Sicherheit zu leisten, wenn sie sich binnen 6 Monaten nach Bekanntmachung der Eintragung zu diesem Zweck bei ihm melden."
    },
    {
      "date": "2024-10-17",
      "original_text": "Einreichung neuer Dokumente\nBrandenburg Amtsgericht Frankfurt/Oder HRB 4458\nWHG Wohnungsbau- und Hausverwaltungs-GmbH – Eberswalde",
      "type": "Einreichung neuer Dokumente",
      "state": "Brandenburg",
      "amtsgericht": "Amtsgericht Frankfurt/Oder",
      "registernummer": "HRB 4458",
      "registerart": "HRB",
      "company_name": "WHG Wohnungsbau- und Hausverwaltungs-GmbH",
      "company_seat": "Eberswalde",
      "details": "17.10.2024 (Bekanntmachungsdatum)\n\nBrandenburg Amtsgericht Frankfurt/Oder HRB 4458\nEinreichung neuer Dokumente\n\nWHG Wohnungsbau- und Hausverwaltungs-GmbH\nGesellschaft mit beschränkter Haftung\nEberswalde\n\nAls nicht eingetragen wird veröffentlicht: Die Liste der Aufsichtsratsmitglieder vom 01.10.2024 ist zum Handelsregister eingereicht worden."
    },
    {
      "date": "2024-10-17",
      "original_text": "Registerbekanntmachung nach dem Umwandlungsgesetz\nRheinland-Pfalz Amtsgericht Montabaur HRB 30099\nWWline GmbH – Steinefrenz",
      "type": "Registerbekanntmachung nach dem Umwandlungsgesetz",
      "state": "Rheinland-Pfalz",
      "amtsgericht": "Amtsgericht Montabaur",
      "registernummer": "HRB 30099",
      "registerart": "HRB",
      "company_name": "WWline GmbH",
      "company_seat": "Steinefrenz",
      "details": "17.10.2024 (Bekanntmachungsdatum)\n\nRheinland-Pfalz Amtsgericht Montabaur HRB 30099\nRegisterbekanntmachung nach dem Umwandlungsgesetz 17.10.2024 (Eintragungsdatum)\n\nWWline GmbH\nGesellschaft mit beschränkter Haftung\nSteinefrenz\n\nAls nicht eingetragen wird veröffentlicht: Den Gläubigern der an der Ausgliederung beteiligten Rechtsträger ist, wenn sie binnen sechs Monaten nach dem Tag, an dem die Eintragung der Ausgliederung in das Register des Sitzes desjenigen Rechtsträgers,dessen Gläubiger sie sind, nach § 19 Abs. 3 UmwG als bekannt gemacht gilt, ihren Anspruch nach Grund und Höhe schriftlich anmelden, Sicherheit zu leisten, soweit sie nicht Befriedigung verlangen können. Dieses Recht steht den Gläubigern jedoch nur zu, wenn sie glaubhaft machen, dass durch die Ausgliederung die Erfüllung der Forderung gefährdet wird."
    },
    {
      "date": "2024-10-17",
      "original_text": "Registerbekanntmachung nach dem Umwandlungsgesetz\nNordrhein-Westfalen Amtsgericht Siegen HRB 6582\nWagner Baugesellschaft mbH – Bad Laasphe",
      "type": "Registerbekanntmachung nach dem Umwandlungsgesetz",
      "state": "Nordrhein-Westfalen",
      "amtsgericht": "Amtsgericht Siegen",
      "registernummer": "HRB 6582",
      "registerart": "HRB",
      "company_name": "Wagner Baugesellschaft mbH",
      "company_seat": "Bad Laasphe",
      "details": "17.10.2024 (Bekanntmachungsdatum)\n\nNordrhein-Westfalen Amtsgericht Siegen HRB 6582\nRegisterbekanntmachung nach dem Umwandlungsgesetz 17.10.2024 (Eintragungsdatum)\n\nWagner Baugesellschaft mbH\nGesellschaft mit beschränkter Haftung\nBad Laasphe\n\nDen Gläubigern der an der Ausgliederung beteiligten Rechtsträger ist, wenn sie binnen sechs Monaten nach dem Tag, an dem die Eintragung der Ausgliederung in das Register des Sitzes desjenigen Rechtsträgers, dessen Gläubiger sie sind, nach § 19 Absatz 3 UmwG als bekanntgemacht gilt, ihren Anspruch nach Grund und Höhe schriftlich anmelden, Sicherheit zu leisten, soweit sie nicht Befriedigung verlangen können. Dieses Recht steht den Gläubigern jedoch nur zu, wenn sie glaubhaft machen, dass durch die Ausgliederung die Erfüllung ihrer Forderung gefährdet wird."
    },
    {
      "date": "2024-10-17",
      "original_text": "Löschungsankündigung\nHessen Amtsgericht Wiesbaden VR 7151\nWasserZeichen e. V. – Wiesbaden",
      "type": "Löschungsankündigung",
      "state": "Hessen",
      "amtsgericht": "Amtsgericht Wiesbaden",
      "registernummer": "VR 7151",
      "registerart": "VR",
      "company_name": "WasserZeichen e. V.",
      "company_seat": "Wiesbaden",
      "details": "17.10.2024 (Bekanntmachungsdatum)\n\nHessen Amtsgericht Wiesbaden VR 7151\nLöschungsankündigung 17.10.2024 (Eintragungsdatum)\n\nWasserZeichen e. V.\neingetragener Verein\nWiesbaden\n\nDer Verein ist aufgelöst."
    },
    {
      "date": "2024-10-17",
      "original_text": "Einreichung neuer Dokumente\nSachsen Amtsgericht Leipzig HRB 22168\nWohnservice Markranstädt GmbH – Markranstädt",
      "type": "Einreichung neuer Dokumente",
      "state": "Sachsen",
      "amtsgericht": "Amtsgericht Leipzig",
      "registernummer": "HRB 22168",
      "registerart": "HRB",
      "company_name": "Wohnservice Markranstädt GmbH",
      "company_seat": "Markranstädt",
      "details": "17.10.2024 (Bekanntmachungsdatum)\n\nSachsen Amtsgericht Leipzig HRB 22168\nEinreichung neuer Dokumente\n\nWohnservice Markranstädt GmbH\nGesellschaft mit beschränkter Haftung\nMarkranstädt\n\nAm 16.10.2024 wurde beim Handelsregister des Amtsgerichts Leipzig die Liste der Mitglieder des Aufsichtsrats gemäß § 52 GmbHG eingereicht."
    },
    {
      "date": "2024-10-17",
      "original_text": "Registerbekanntmachung nach dem Umwandlungsgesetz\nNiedersachsen Amtsgericht Aurich HRA 203938\nZaunteam Ostfriesland Matthias Erdmann e. K. – Südbrookmerland",
      "type": "Registerbekanntmachung nach dem Umwandlungsgesetz",
      "state": "Niedersachsen",
      "amtsgericht": "Amtsgericht Aurich",
      "registernummer": "HRA 203938",
      "registerart": "HRA",
      "company_name": "Zaunteam Ostfriesland Matthias Erdmann e. K.",
      "company_seat": "Südbrookmerland",
      "details": "17.10.2024 (Bekanntmachungsdatum)\n\nNiedersachsen Amtsgericht Aurich HRA 203938\nRegisterbekanntmachung nach dem Umwandlungsgesetz 17.10.2024 (Eintragungsdatum)\n\nZaunteam Ostfriesland Matthias Erdmann e. K.\nEinzelkaufmann / Einzelkauffrau\nSüdbrookmerland\n\nDen Gläubigern der an der Ausgliederung beteiligten Rechtsträger ist, wenn sie binnen sechs Monaten nach dem Tag, an dem die Eintragung der Ausgliederung in das Register des Sitzes desjenigen Rechtsträgers, dessen Gläubiger sie sind, nach § 19 Abs. 3 UmwG als bekannt gemacht gilt, ihren Anspruch nach Grund und Höhe schriftlich anmelden, Sicherheit zu leisten, soweit sie nicht Befriedigung verlangen können. Dieses Recht steht den Gläubigern jedoch nur zu, wenn sie glaubhaft machen, dass durch die Ausgliederung die Erfüllung der Forderung gefährdet wird."
    },
    {
      "date": "2024-10-17",
      "original_text": "Registerbekanntmachung nach dem Umwandlungsgesetz\nBrandenburg Amtsgericht Frankfurt/Oder HRB 21049\nZimmerei Zühlke GmbH – Storkow (Mark)",
      "type": "Registerbekanntmachung nach dem Umwandlungsgesetz",
      "state": "Brandenburg",
      "amtsgericht": "Amtsgericht Frankfurt/Oder",
      "registernummer": "HRB 21049",
      "registerart": "HRB",
      "company_name": "Zimmerei Zühlke GmbH",
      "company_seat": "Storkow (Mark)",
      "details": "17.10.2024 (Bekanntmachungsdatum)\n\nBrandenburg Amtsgericht Frankfurt/Oder HRB 21049\nRegisterbekanntmachung nach dem Umwandlungsgesetz 12.09.2024 (Eintragungsdatum)\n\nZimmerei Zühlke GmbH\nGesellschaft mit beschränkter Haftung\nStorkow (Mark)\n\nZu Eintragungsnummer 1 vom 12.09.2024 wird als nicht eingetragen veröffentlicht: Als nicht eingetragen wird veröffentlicht:\nDen Gläubigern der an der Umwandlung beteiligten Rechtsträger ist, wenn sie binnen sechs Monaten nach dem Tag, an dem die Eintragung der Umwandlung in das Register des Sitzes desjenigen Rechtsträgers, dessen Gläubiger sie sind, als bekannt gemacht gilt, ihren Anspruch nach Grund und Höhe schriftlich anmelden, Sicherheit zu leisten, soweit sie nicht Befriedigung verlangen können. Dieses Recht steht den Gläubigern jedoch nur zu, wenn sie glaubhaft machen, dass durch die Umwandlung die Erfüllung ihrer Forderung gefährdet wird"
    },
    {
      "date": "2024-10-17",
      "original_text": "Einreichung neuer Dokumente\nNordrhein-Westfalen Amtsgericht Coesfeld HRB 4903\nd.velop AG – Gescher",
      "type": "Einreichung neuer Dokumente",
      "state": "Nordrhein-Westfalen",
      "amtsgericht": "Amtsgericht Coesfeld",
      "registernummer": "HRB 4903",
      "registerart": "HRB",
      "company_name": "d.velop AG",
      "company_seat": "Gescher",
      "details": "17.10.2024 (Bekanntmachungsdatum)\n\nNordrhein-Westfalen Amtsgericht Coesfeld HRB 4903\nEinreichung neuer Dokumente 17.10.2024 (Eintragungsdatum)\n\nd.velop AG\nAktiengesellschaft\nGescher\n\nDie Liste der Mitglieder des Aufsichtsrates ist zum Handelsregister eingereicht worden."
    },
    {
      "date": "2024-10-17",
      "original_text": "Löschungsankündigung\nBerlin Amtsgericht Berlin (Charlottenburg) HRB 233683\ndoupha UG (haftungsbeschränkt) – Berlin",
      "type": "Löschungsankündigung",
      "state": "Berlin",
      "amtsgericht": "Amtsgericht Berlin (Charlottenburg)",
      "registernummer": "HRB 233683",
      "registerart": "HRB",
      "company_name": "doupha UG (haftungsbeschränkt)",
      "company_seat": "Berlin",
      "details": "17.10.2024 (Bekanntmachungsdatum)\n\nBerlin Amtsgericht Berlin (Charlottenburg) HRB 233683\nLöschungsankündigung\n\ndoupha UG (haftungsbeschränkt)\nGesellschaft mit beschränkter Haftung\nBerlin\n\nBei der nachstehenden Gesellschaft wird das Amtslöschungsverfahren gemäß § 394 FamFG eingeleitet. Widerspruchsfrist 6 Wochen"
    },
    {
      "date": "2024-10-17",
      "original_text": "Registerbekanntmachung nach dem Umwandlungsgesetz\nNordrhein-Westfalen Amtsgericht Hagen HRB 13092\ndreizett Plus Hagen GmbH – Hagen",
      "type": "Registerbekanntmachung nach dem Umwandlungsgesetz",
      "state": "Nordrhein-Westfalen",
      "amtsgericht": "Amtsgericht Hagen",
      "registernummer": "HRB 13092",
      "registerart": "HRB",
      "company_name": "dreizett Plus Hagen GmbH",
      "company_seat": "Hagen",
      "details": "17.10.2024 (Bekanntmachungsdatum)\n\nNordrhein-Westfalen Amtsgericht Hagen HRB 13092\nRegisterbekanntmachung nach dem Umwandlungsgesetz 17.10.2024 (Eintragungsdatum)\n\ndreizett Plus Hagen GmbH\nGesellschaft mit beschränkter Haftung\nHagen\n\nDen Gläubigern der an der Ausgliederung beteiligten Rechtsträger ist, wenn sie binnen sechs Monaten nach dem Tag, an dem die Eintragung der Ausgliederung in das Register des Sitzes derjenigen Rechtsträger deren Gläubiger sie sind, nach § 19 Absatz 3 UmwG als bekanntgemacht gilt, ihren Anspruch nach Grund und Höhe schriftlich anmelden, Sicherheit zu leisten, soweit sie nicht Befriedigung verlangen können. Dieses Recht steht den Gläubigern jedoch nur zu, wenn sie glaubhaft machen, dass durch die Ausgliederung die Erfüllung ihrer Forderung gefährdet wird."
    },
    {
      "date": "2024-10-17",
      "original_text": "Registerbekanntmachung nach dem Umwandlungsgesetz\nBayern Amtsgericht Fürth HRB 16274\neesy-ic GmbH – Erlangen",
      "type": "Registerbekanntmachung nach dem Umwandlungsgesetz",
      "state": "Bayern",
      "amtsgericht": "Amtsgericht Fürth",
      "registernummer": "HRB 16274",
      "registerart": "HRB",
      "company_name": "eesy-ic GmbH",
      "company_seat": "Erlangen",
      "details": "17.10.2024 (Bekanntmachungsdatum)\n\nBayern Amtsgericht Fürth HRB 16274\nRegisterbekanntmachung nach dem Umwandlungsgesetz 16.10.2024 (Eintragungsdatum)\n\neesy-ic GmbH\nGesellschaft mit beschränkter Haftung\nErlangen\n\nDen Gläubigern der an der Verschmelzung beteiligten Rechtsträger ist, wenn sie binnen sechs Monaten nach dem Tag, an dem die Eintragung der Verschmelzung in das Register des Sitzes desjenigen Rechtsträgers, dessen Gläubiger sie sind, nach § 19 Abs. 3 UmwG als bekannt gemacht gilt, ihren Anspruch nach Grund und Höhe schriftlich anmelden, Sicherheit zu leisten, soweit sie nicht Befriedigung verlangen können. Dieses Recht steht den Gläubigern jedoch nur zu, wenn sie glaubhaft machen, dass durch die Verschmelzung die Erfüllung ihrer Forderung gefährdet wird."
    },
    {
      "date": "2024-10-17",
      "original_text": "Löschungsankündigung\nBayern Amtsgericht München HRB 165054\nesVedra consulting GmbH – München",
      "type": "Löschungsankündigung",
      "state": "Bayern",
      "amtsgericht": "Amtsgericht München",
      "registernummer": "HRB 165054",
      "registerart": "HRB",
      "company_name": "esVedra consulting GmbH",
      "company_seat": "München",
      "details": "17.10.2024 (Bekanntmachungsdatum)\n\nBayern Amtsgericht München HRB 165054\nLöschungsankündigung 16.10.2024 (Eintragungsdatum)\n\nesVedra consulting GmbH\nGesellschaft mit beschränkter Haftung\nMünchen\n\nDas Registergericht beabsichtigt, die im Handelsregister eingetragene Gesellschaft wegen Vermögenslosigkeit von Amts wegen nach § 394 FamFG zu löschen. Die Frist zur Erhebung eines Widerspruchs ist auf drei Monate festgesetzt."
    },
    {
      "date": "2024-10-17",
      "original_text": "Einreichung neuer Dokumente\nHessen Amtsgericht Offenbach am Main HRB 12381\nglueckkanja AG – Offenbach am Main",
      "type": "Einreichung neuer Dokumente",
      "state": "Hessen",
      "amtsgericht": "Amtsgericht Offenbach am Main",
      "registernummer": "HRB 12381",
      "registerart": "HRB",
      "company_name": "glueckkanja AG",
      "company_seat": "Offenbach am Main",
      "details": "17.10.2024 (Bekanntmachungsdatum)\n\nHessen Amtsgericht Offenbach am Main HRB 12381\nEinreichung neuer Dokumente\n\nglueckkanja AG\nAktiengesellschaft\nOffenbach am Main\n\nDurch eine Änderung in den Personen der Aufsichtsratsmitglieder ist eine Liste der Mitglieder des Aufsichtsrates zum Handelsregister eingereicht worden."
    },
    {
      "date": "2024-10-17",
      "original_text": "Registerbekanntmachung nach dem Umwandlungsgesetz\nRheinland-Pfalz Amtsgericht Koblenz HRB 27342\nretailize GmbH – Koblenz",
      "type": "Registerbekanntmachung nach dem Umwandlungsgesetz",
      "state": "Rheinland-Pfalz",
      "amtsgericht": "Amtsgericht Koblenz",
      "registernummer": "HRB 27342",
      "registerart": "HRB",
      "company_name": "retailize GmbH",
      "company_seat": "Koblenz",
      "details": "17.10.2024 (Bekanntmachungsdatum)\n\nRheinland-Pfalz Amtsgericht Koblenz HRB 27342\nRegisterbekanntmachung nach dem Umwandlungsgesetz 17.10.2024 (Eintragungsdatum)\n\nretailize GmbH\nGesellschaft mit beschränkter Haftung\nKoblenz\n\nAls nicht eingetragen wird veröffentlicht: Den Gläubigern der an der Ausgliederung beteiligten Rechtsträger ist, wenn sie binnen sechs Monaten nac hdem Tag, an dem die Eintragung der Ausgliederung in das Register des Sitzes desjenigen Rechtsträgers,dessen Gläubiger sie sind, nach § 19 Abs. 3 UmwG als bekannt gemacht gilt, ihren Anspruch nach Grund und Höhe schriftlich anmelden, Sicherheit zu leisten, soweit sie nicht Befriedigung verlangen können. Dieses Recht steht den Gläubigern jedoch nur zu, wenn sie glaubhaft machen, dass durch die Ausgliederung die Erfüllung der Forderung gefährdet wird."
    }
  ]
}