{
  "date": "2024-10-19",
  "date_of_scrape": "2024-11-30T13:54:30.141Z",
  "tool_version": "0.2.0",
  "number_of_announcements": 24,
  "announcements": [
    {
      "date": "2024-10-19",
      "id": "90982",
      "original_text": "Registerbekanntmachung nach dem Umwandlungsgesetz\nBayern Amtsgericht München HRB 174430\nBOOSTing Communication GmbH – München",
      "type": "Registerbekanntmachung nach dem Umwandlungsgesetz",
      "state": "Bayern",
      "amtsgericht": "Amtsgericht München",
      "registernummer": "HRB 174430",
      "registerart": "HRB",
      "company_name": "BOOSTing Communication GmbH",
      "company_seat": "München",
      "details": "19.10.2024 (Bekanntmachungsdatum)\n\nBayern Amtsgericht München HRB 174430\nRegisterbekanntmachung nach dem Umwandlungsgesetz 18.10.2024 (Eintragungsdatum)\n\nBOOSTing Communication GmbH\nGesellschaft mit beschränkter Haftung\nMünchen\n\nDen Gläubigern der an der Verschmelzung beteiligten Rechtsträger ist, wenn sie binnen sechs Monaten nach dem Tag, an dem die Eintragung der Verschmelzung in das Register des Sitzes desjenigen Rechtsträgers, dessen Gläubiger sie sind, nach § 19 Abs. 3 UmwG als bekannt gemacht gilt, ihren Anspruch nach Grund und Höhe schriftlich anmelden, Sicherheit zu leisten, soweit sie nicht Befriedigung verlangen können. Dieses Recht steht den Gläubigern jedoch nur zu, wenn sie glaubhaft machen, dass durch die Verschmelzung die Erfüllung ihrer Forderung gefährdet wird."
    },
    {
      "date": "2024-10-19",
      "id": "90974",
      "original_text": "Einreichung neuer Dokumente\nBayern Amtsgericht München HRB 197019\nBayerische Hypotheken- und Wechselgesellschaft SE – München",
      "type": "Einreichung neuer Dokumente",
      "state": "Bayern",
      "amtsgericht": "Amtsgericht München",
      "registernummer": "HRB 197019",
      "registerart": "HRB",
      "company_name": "Bayerische Hypotheken- und Wechselgesellschaft SE",
      "company_seat": "München",
      "details": "19.10.2024 (Bekanntmachungsdatum)\n\nBayern Amtsgericht München HRB 197019\nEinreichung neuer Dokumente 18.10.2024 (Eintragungsdatum)\n\nBayerische Hypotheken- und Wechselgesellschaft SE\nEuropäische Aktiengesellschaft (SE)\nMünchen\n\nDem Amtsgericht München -Registergericht- ist eine Liste der Mitglieder des Verwaltungsrates eingereicht worden, Art. 9 Abs. 1 Buchst. c (ii) SE-VO i.V.m. § 106 AktG."
    },
    {
      "date": "2024-10-19",
      "id": "90991",
      "original_text": "Registerbekanntmachung nach dem Umwandlungsgesetz\nBayern Amtsgericht München HRB 295120\nELTEGU Regeltechnik GmbH – Aschheim",
      "type": "Registerbekanntmachung nach dem Umwandlungsgesetz",
      "state": "Bayern",
      "amtsgericht": "Amtsgericht München",
      "registernummer": "HRB 295120",
      "registerart": "HRB",
      "company_name": "ELTEGU Regeltechnik GmbH",
      "company_seat": "Aschheim",
      "details": "19.10.2024 (Bekanntmachungsdatum)\n\nBayern Amtsgericht München HRB 295120\nRegisterbekanntmachung nach dem Umwandlungsgesetz 05.08.2024 (Eintragungsdatum)\n\nELTEGU Regeltechnik GmbH\nGesellschaft mit beschränkter Haftung\nAschheim\n\nDen Gläubigern der an der Ausgliederung beteiligten Rechtsträger ist, wenn sie binnen sechs Monaten nach dem Tag, an dem die Eintragung der Ausgliederung in das Register des Sitzes desjenigen Rechtsträgers, dessen Gläubiger sie sind, nach §§ 125, 19 Abs. 3 UmwG als bekannt gemacht gilt, ihren Anspruch nach Grund und Höhe schriftlich anmelden, Sicherheit zu leisten, soweit sie nicht Befriedigung verlangen können. Dieses Recht steht den Gläubigern jedoch nur zu, wenn sie glaubhaft machen, dass durch die Ausgliederung die Erfüllung ihrer Forderung gefährdet wird."
    },
    {
      "date": "2024-10-19",
      "id": "90977",
      "original_text": "Löschungsankündigung\nBayern Amtsgericht Ansbach HRA 2303\nFachfirma Dürr Turmuhren - Glocken - Läutemaschinen GmbH & Co. KG – Rothenburg ob der Tauber",
      "type": "Löschungsankündigung",
      "state": "Bayern",
      "amtsgericht": "Amtsgericht Ansbach",
      "registernummer": "HRA 2303",
      "registerart": "HRA",
      "company_name": "Fachfirma Dürr Turmuhren - Glocken - Läutemaschinen GmbH & Co. KG",
      "company_seat": "Rothenburg ob der Tauber",
      "details": "19.10.2024 (Bekanntmachungsdatum)\n\nBayern Amtsgericht Ansbach HRA 2303\nDie Registerbekanntmachung ist nachträglich am 22.10.2024 um 02:00 Uhr gelöscht worden.\nWegen der Einzelheiten und näherer Auskünfte wenden Sie sich bitte an das Amtsgericht Ansbach ."
    },
    {
      "date": "2024-10-19",
      "id": "90985",
      "original_text": "Einreichung neuer Dokumente\nBayern Amtsgericht Fürth HRB 15957\nFramatome GmbH – Erlangen",
      "type": "Einreichung neuer Dokumente",
      "state": "Bayern",
      "amtsgericht": "Amtsgericht Fürth",
      "registernummer": "HRB 15957",
      "registerart": "HRB",
      "company_name": "Framatome GmbH",
      "company_seat": "Erlangen",
      "details": "19.10.2024 (Bekanntmachungsdatum)\n\nBayern Amtsgericht Fürth HRB 15957\nEinreichung neuer Dokumente\n\nFramatome GmbH\nGesellschaft mit beschränkter Haftung\nErlangen\n\nDem Amtsgericht Fürth -Registergericht- ist eine Liste der Mitglieder des Aufsichtsrats eingereicht worden, § 52 Abs. 3 S. 2 GmbHG."
    },
    {
      "date": "2024-10-19",
      "id": "90990",
      "original_text": "Registerbekanntmachung nach dem Umwandlungsgesetz\nBayern Amtsgericht Nürnberg VR 200682\nFörderverein LC Nürnberg-Franken \"We serve\" e.V. – Nürnberg",
      "type": "Registerbekanntmachung nach dem Umwandlungsgesetz",
      "state": "Bayern",
      "amtsgericht": "Amtsgericht Nürnberg",
      "registernummer": "VR 200682",
      "registerart": "VR",
      "company_name": "Förderverein LC Nürnberg-Franken \"We serve\" e.V.",
      "company_seat": "Nürnberg",
      "details": "19.10.2024 (Bekanntmachungsdatum)\n\nBayern Amtsgericht Nürnberg VR 200682\nRegisterbekanntmachung nach dem Umwandlungsgesetz 18.10.2024 (Eintragungsdatum)\n\nFörderverein LC Nürnberg-Franken \"We serve\" e.V.\neingetragener Verein\nNürnberg\n\nDen Gläubigern der an der Verschmelzung beteiligten Rechtsträger ist, wenn sie binnen sechs Monaten nach dem Tag, an dem die Eintragung der Verschmelzung in das Register des Sitzes desjenigen Rechtsträgers, dessen Gläubiger sie sind, nach § 19 Abs. 3 UmwG als bekannt gemacht gilt, ihren Anspruch nach Grund und Höhe schriftlich anmelden, Sicherheit zu leisten, soweit sie nicht Befriedigung verlangen können. Dieses Recht steht den Gläubigern jedoch nur zu, wenn sie glaubhaft machen, dass durch die Verschmelzung die Erfüllung ihrer Forderung gefährdet wird."
    },
    {
      "date": "2024-10-19",
      "id": "90970",
      "original_text": "Registerbekanntmachung nach dem Umwandlungsgesetz\nBayern Amtsgericht Nürnberg VR 200938\nFörderverein Sternschnuppen e.V. – Nürnberg",
      "type": "Registerbekanntmachung nach dem Umwandlungsgesetz",
      "state": "Bayern",
      "amtsgericht": "Amtsgericht Nürnberg",
      "registernummer": "VR 200938",
      "registerart": "VR",
      "company_name": "Förderverein Sternschnuppen e.V.",
      "company_seat": "Nürnberg",
      "details": "19.10.2024 (Bekanntmachungsdatum)\n\nBayern Amtsgericht Nürnberg VR 200938\nRegisterbekanntmachung nach dem Umwandlungsgesetz 18.10.2024 (Eintragungsdatum)\n\nFörderverein Sternschnuppen e.V.\neingetragener Verein\nNürnberg\n\nDen Gläubigern der an der Verschmelzung beteiligten Rechtsträger ist, wenn sie binnen sechs Monaten nach dem Tag, an dem die Eintragung der Verschmelzung in das Register des Sitzes desjenigen Rechtsträgers, dessen Gläubiger sie sind, nach § 19 Abs. 3 UmwG als bekannt gemacht gilt, ihren Anspruch nach Grund und Höhe schriftlich anmelden, Sicherheit zu leisten, soweit sie nicht Befriedigung verlangen können. Dieses Recht steht den Gläubigern jedoch nur zu, wenn sie glaubhaft machen, dass durch die Verschmelzung die Erfüllung ihrer Forderung gefährdet wird."
    },
    {
      "date": "2024-10-19",
      "id": "90983",
      "original_text": "Einreichung neuer Dokumente\nBayern Amtsgericht München HRB 280285\nHartwein Vermögensverwaltung AG – Weilheim i.OB",
      "type": "Einreichung neuer Dokumente",
      "state": "Bayern",
      "amtsgericht": "Amtsgericht München",
      "registernummer": "HRB 280285",
      "registerart": "HRB",
      "company_name": "Hartwein Vermögensverwaltung AG",
      "company_seat": "Weilheim i.OB",
      "details": "19.10.2024 (Bekanntmachungsdatum)\n\nBayern Amtsgericht München HRB 280285\nEinreichung neuer Dokumente\n\nHartwein Vermögensverwaltung AG\nAktiengesellschaft\nWeilheim i.OB\n\nDem Amtsgericht München -Registergericht- ist eine Liste der Mitglieder des Aufsichtsrats eingereicht worden, § 106 AktG."
    },
    {
      "date": "2024-10-19",
      "id": "90989",
      "original_text": "Registerbekanntmachung nach dem Umwandlungsgesetz\nBayern Amtsgericht Regensburg VR 54\nKEB - Katholische Erwachsenenbildung im Bistum Regensburg e. V. – Regensburg",
      "type": "Registerbekanntmachung nach dem Umwandlungsgesetz",
      "state": "Bayern",
      "amtsgericht": "Amtsgericht Regensburg",
      "registernummer": "VR 54",
      "registerart": "VR",
      "company_name": "KEB - Katholische Erwachsenenbildung im Bistum Regensburg e. V.",
      "company_seat": "Regensburg",
      "details": "19.10.2024 (Bekanntmachungsdatum)\n\nBayern Amtsgericht Regensburg VR 54\nRegisterbekanntmachung nach dem Umwandlungsgesetz 18.10.2024 (Eintragungsdatum)\n\nKEB - Katholische Erwachsenenbildung im Bistum Regensburg e. V.\neingetragener Verein\nRegensburg"
    },
    {
      "date": "2024-10-19",
      "id": "90981",
      "original_text": "Registerbekanntmachung nach dem Umwandlungsgesetz\nBayern Amtsgericht Regensburg VR 20190\nKEB Cham - Katholische Erwachsenenbildung im Landkreis Cham e. V. – Cham",
      "type": "Registerbekanntmachung nach dem Umwandlungsgesetz",
      "state": "Bayern",
      "amtsgericht": "Amtsgericht Regensburg",
      "registernummer": "VR 20190",
      "registerart": "VR",
      "company_name": "KEB Cham - Katholische Erwachsenenbildung im Landkreis Cham e. V.",
      "company_seat": "Cham",
      "details": "19.10.2024 (Bekanntmachungsdatum)\n\nBayern Amtsgericht Regensburg VR 20190\nRegisterbekanntmachung nach dem Umwandlungsgesetz 18.10.2024 (Eintragungsdatum)\n\nKEB Cham - Katholische Erwachsenenbildung im Landkreis Cham e. V.\neingetragener Verein\nCham"
    },
    {
      "date": "2024-10-19",
      "id": "90972",
      "original_text": "Registerbekanntmachung nach dem Umwandlungsgesetz\nBayern Amtsgericht Regensburg VR 70095\nKEB Kelheim - Katholische Erwachsenenbildung im Landkreis Kelheim eingetragener Verein – Kelheim",
      "type": "Registerbekanntmachung nach dem Umwandlungsgesetz",
      "state": "Bayern",
      "amtsgericht": "Amtsgericht Regensburg",
      "registernummer": "VR 70095",
      "registerart": "VR",
      "company_name": "KEB Kelheim - Katholische Erwachsenenbildung im Landkreis Kelheim eingetragener Verein",
      "company_seat": "Kelheim",
      "details": "19.10.2024 (Bekanntmachungsdatum)\n\nBayern Amtsgericht Regensburg VR 70095\nRegisterbekanntmachung nach dem Umwandlungsgesetz 18.10.2024 (Eintragungsdatum)\n\nKEB Kelheim - Katholische Erwachsenenbildung im Landkreis Kelheim eingetragener Verein\neingetragener Verein\nKelheim"
    },
    {
      "date": "2024-10-19",
      "id": "90979",
      "original_text": "Registerbekanntmachung nach dem Umwandlungsgesetz\nBayern Amtsgericht Regensburg VR 374\nKEB Regensburg-Land - Katholische Erwachsenenbildung im Landkreis Regensburg e. V. – Regensburg",
      "type": "Registerbekanntmachung nach dem Umwandlungsgesetz",
      "state": "Bayern",
      "amtsgericht": "Amtsgericht Regensburg",
      "registernummer": "VR 374",
      "registerart": "VR",
      "company_name": "KEB Regensburg-Land - Katholische Erwachsenenbildung im Landkreis Regensburg e. V.",
      "company_seat": "Regensburg",
      "details": "19.10.2024 (Bekanntmachungsdatum)\n\nBayern Amtsgericht Regensburg VR 374\nRegisterbekanntmachung nach dem Umwandlungsgesetz 18.10.2024 (Eintragungsdatum)\n\nKEB Regensburg-Land - Katholische Erwachsenenbildung im Landkreis Regensburg e. V.\neingetragener Verein\nRegensburg"
    },
    {
      "date": "2024-10-19",
      "id": "90980",
      "original_text": "Registerbekanntmachung nach dem Umwandlungsgesetz\nBayern Amtsgericht Regensburg VR 431\nKEB Regensburg-Stadt - Katholische Erwachsenenbildung in der Stadt Regensburg e.V. – Regensburg",
      "type": "Registerbekanntmachung nach dem Umwandlungsgesetz",
      "state": "Bayern",
      "amtsgericht": "Amtsgericht Regensburg",
      "registernummer": "VR 431",
      "registerart": "VR",
      "company_name": "KEB Regensburg-Stadt - Katholische Erwachsenenbildung in der Stadt Regensburg e.V.",
      "company_seat": "Regensburg",
      "details": "19.10.2024 (Bekanntmachungsdatum)\n\nBayern Amtsgericht Regensburg VR 431\nRegisterbekanntmachung nach dem Umwandlungsgesetz 18.10.2024 (Eintragungsdatum)\n\nKEB Regensburg-Stadt - Katholische Erwachsenenbildung in der Stadt Regensburg e.V.\neingetragener Verein\nRegensburg"
    },
    {
      "date": "2024-10-19",
      "id": "90976",
      "original_text": "Registerbekanntmachung nach dem Umwandlungsgesetz\nBayern Amtsgericht München HRB 255188\nLAYA Solutions GmbH – München",
      "type": "Registerbekanntmachung nach dem Umwandlungsgesetz",
      "state": "Bayern",
      "amtsgericht": "Amtsgericht München",
      "registernummer": "HRB 255188",
      "registerart": "HRB",
      "company_name": "LAYA Solutions GmbH",
      "company_seat": "München",
      "details": "19.10.2024 (Bekanntmachungsdatum)\n\nBayern Amtsgericht München HRB 255188\nRegisterbekanntmachung nach dem Umwandlungsgesetz 18.10.2024 (Eintragungsdatum)\n\nLAYA Solutions GmbH\nGesellschaft mit beschränkter Haftung\nMünchen\n\nDen Gläubigern der an der Verschmelzung beteiligten Rechtsträger ist, wenn sie binnen sechs Monaten nach dem Tag, an dem die Eintragung der Verschmelzung in das Register des Sitzes desjenigen Rechtsträgers, dessen Gläubiger sie sind, nach § 19 Abs. 3 UmwG als bekannt gemacht gilt, ihren Anspruch nach Grund und Höhe schriftlich anmelden, Sicherheit zu leisten, soweit sie nicht Befriedigung verlangen können. Dieses Recht steht den Gläubigern jedoch nur zu, wenn sie glaubhaft machen, dass durch die Verschmelzung die Erfüllung ihrer Forderung gefährdet wird."
    },
    {
      "date": "2024-10-19",
      "id": "90988",
      "original_text": "Registerbekanntmachung nach dem Umwandlungsgesetz\nBayern Amtsgericht Nürnberg VR 3205\nLIONS FÖRDERVEREIN Nürnberg-Franken e.V. – Nürnberg",
      "type": "Registerbekanntmachung nach dem Umwandlungsgesetz",
      "state": "Bayern",
      "amtsgericht": "Amtsgericht Nürnberg",
      "registernummer": "VR 3205",
      "registerart": "VR",
      "company_name": "LIONS FÖRDERVEREIN Nürnberg-Franken e.V.",
      "company_seat": "Nürnberg",
      "details": "19.10.2024 (Bekanntmachungsdatum)\n\nBayern Amtsgericht Nürnberg VR 3205\nRegisterbekanntmachung nach dem Umwandlungsgesetz 18.10.2024 (Eintragungsdatum)\n\nLIONS FÖRDERVEREIN Nürnberg-Franken e.V.\neingetragener Verein\nNürnberg\n\nDen Gläubigern der an der Verschmelzung beteiligten Rechtsträger ist, wenn sie binnen sechs Monaten nach dem Tag, an dem die Eintragung der Verschmelzung in das Register des Sitzes desjenigen Rechtsträgers, dessen Gläubiger sie sind, nach § 19 Abs. 3 UmwG als bekannt gemacht gilt, ihren Anspruch nach Grund und Höhe schriftlich anmelden, Sicherheit zu leisten, soweit sie nicht Befriedigung verlangen können. Dieses Recht steht den Gläubigern jedoch nur zu, wenn sie glaubhaft machen, dass durch die Verschmelzung die Erfüllung ihrer Forderung gefährdet wird."
    },
    {
      "date": "2024-10-19",
      "id": "90984",
      "original_text": "Löschungsankündigung\nBayern Amtsgericht Traunstein HRB 25442\nML Real-Industrieservice UG (haftungsbeschränkt) – Freilassing",
      "type": "Löschungsankündigung",
      "state": "Bayern",
      "amtsgericht": "Amtsgericht Traunstein",
      "registernummer": "HRB 25442",
      "registerart": "HRB",
      "company_name": "ML Real-Industrieservice UG (haftungsbeschränkt)",
      "company_seat": "Freilassing",
      "details": "19.10.2024 (Bekanntmachungsdatum)\n\nBayern Amtsgericht Traunstein HRB 25442\nLöschungsankündigung\n\nML Real-Industrieservice UG (haftungsbeschränkt)\nGesellschaft mit beschränkter Haftung\nFreilassing\n\nDas Registergericht beabsichtigt, die im Handelsregister eingetragene Gesellschaft wegen Vermögenslosigkeit von Amts wegen nach § 394 FamFG zu löschen. Die Frist zur Erhebung eines Widerspruchs ist auf einen Monat festgesetzt."
    },
    {
      "date": "2024-10-19",
      "id": "90978",
      "original_text": "Löschungsankündigung\nBayern Amtsgericht Fürth HRB 9031\nR & R Gastronomie GmbH – Weisendorf",
      "type": "Löschungsankündigung",
      "state": "Bayern",
      "amtsgericht": "Amtsgericht Fürth",
      "registernummer": "HRB 9031",
      "registerart": "HRB",
      "company_name": "R & R Gastronomie GmbH",
      "company_seat": "Weisendorf",
      "details": "19.10.2024 (Bekanntmachungsdatum)\n\nBayern Amtsgericht Fürth HRB 9031\nLöschungsankündigung\n\nR & R Gastronomie GmbH\nGesellschaft mit beschränkter Haftung\nWeisendorf\n\nDas Registergericht beabsichtigt, die Geschäftsführerin Rudel Ulrike, geboren am 10.11.1978, durch das AG Nürnberg am 07.08.2024, rechtskräftig seit 24.08.2024 wegen vorsätzlicher Insolvenzverschleppung u.a. verurteilt,  von Amts wegen nach § 395 FamFG zu löschen. Die Frist zur Erhebung eines Widerspruchs ist auf einen Monat festgesetzt."
    },
    {
      "date": "2024-10-19",
      "id": "90992",
      "original_text": "Registerbekanntmachung nach dem Umwandlungsgesetz\nBayern Amtsgericht Augsburg HRB 33159\nSpecial Items GmbH – Gersthofen",
      "type": "Registerbekanntmachung nach dem Umwandlungsgesetz",
      "state": "Bayern",
      "amtsgericht": "Amtsgericht Augsburg",
      "registernummer": "HRB 33159",
      "registerart": "HRB",
      "company_name": "Special Items GmbH",
      "company_seat": "Gersthofen",
      "details": "19.10.2024 (Bekanntmachungsdatum)\n\nBayern Amtsgericht Augsburg HRB 33159\nRegisterbekanntmachung nach dem Umwandlungsgesetz 18.10.2024 (Eintragungsdatum)\n\nSpecial Items GmbH\nGesellschaft mit beschränkter Haftung\nGersthofen\n\nDen Gläubigern der an der Verschmelzung beteiligten Rechtsträger ist, wenn sie binnen sechs Monaten nach dem Tag, an dem die Eintragung der Verschmelzung in das Register des Sitzes desjenigen Rechtsträgers, dessen Gläubiger sie sind, nach § 19 Abs. 3 UmwG als bekannt gemacht gilt, ihren Anspruch nach Grund und Höhe schriftlich anmelden, Sicherheit zu leisten, soweit sie nicht Befriedigung verlangen können. Dieses Recht steht den Gläubigern jedoch nur zu, wenn sie glaubhaft machen, dass durch die Verschmelzung die Erfüllung ihrer Forderung gefährdet wird."
    },
    {
      "date": "2024-10-19",
      "id": "90971",
      "original_text": "Registerbekanntmachung nach dem Umwandlungsgesetz\nBayern Amtsgericht München HRB 217437\nThera Bytes GmbH – München",
      "type": "Registerbekanntmachung nach dem Umwandlungsgesetz",
      "state": "Bayern",
      "amtsgericht": "Amtsgericht München",
      "registernummer": "HRB 217437",
      "registerart": "HRB",
      "company_name": "Thera Bytes GmbH",
      "company_seat": "München",
      "details": "19.10.2024 (Bekanntmachungsdatum)\n\nBayern Amtsgericht München HRB 217437\nRegisterbekanntmachung nach dem Umwandlungsgesetz 18.10.2024 (Eintragungsdatum)\n\nThera Bytes GmbH\nGesellschaft mit beschränkter Haftung\nMünchen\n\nDen Gläubigern der an der Ausgliederung beteiligten Rechtsträger ist, wenn sie binnen sechs Monaten nach dem Tag, an dem die Eintragung der Ausgliederung in das Register des Sitzes desjenigen Rechtsträgers, dessen Gläubiger sie sind, nach §§ 125, 19 Abs. 3 UmwG als bekannt gemacht gilt, ihren Anspruch nach Grund und Höhe schriftlich anmelden, Sicherheit zu leisten, soweit sie nicht Befriedigung verlangen können. Dieses Recht steht den Gläubigern jedoch nur zu, wenn sie glaubhaft machen, dass durch die Ausgliederung die Erfüllung ihrer Forderung gefährdet wird."
    },
    {
      "date": "2024-10-19",
      "id": "90993",
      "original_text": "Sonstige Registerbekanntmachung\nBayern Amtsgericht Memmingen HRB 16601\nVAMED Rehaklinik Bad Grönenbach GmbH – Bad Grönenbach",
      "type": "Sonstige Registerbekanntmachung",
      "state": "Bayern",
      "amtsgericht": "Amtsgericht Memmingen",
      "registernummer": "HRB 16601",
      "registerart": "HRB",
      "company_name": "VAMED Rehaklinik Bad Grönenbach GmbH",
      "company_seat": "Bad Grönenbach",
      "details": "19.10.2024 (Bekanntmachungsdatum)\n\nBayern Amtsgericht Memmingen HRB 16601\nSonstige Registerbekanntmachung 18.10.2024 (Eintragungsdatum)\n\nVAMED Rehaklinik Bad Grönenbach GmbH\nGesellschaft mit beschränkter Haftung\nBad Grönenbach\n\nDen Gläubigern der Gesellschaft, deren Forderungen begründet worden sind, bevor die Eintragung der Beendigung des Beherrschungs- und Gewinnabführungsvertrages in das Handelsregister nach § 10 des Handelsgesetzbuches als bekanntgemacht gilt, hat der andere Vertragsteil Sicherheit zu leisten, wenn sie sich binnen sechs Monaten nach der Bekanntmachung der Eintragung zu diesem Zweck bei ihm melden."
    },
    {
      "date": "2024-10-19",
      "id": "90987",
      "original_text": "Registerbekanntmachung nach dem Umwandlungsgesetz\nBayern Amtsgericht München HRB 295874\nValeroo GmbH – Gräfelfing",
      "type": "Registerbekanntmachung nach dem Umwandlungsgesetz",
      "state": "Bayern",
      "amtsgericht": "Amtsgericht München",
      "registernummer": "HRB 295874",
      "registerart": "HRB",
      "company_name": "Valeroo GmbH",
      "company_seat": "Gräfelfing",
      "details": "19.10.2024 (Bekanntmachungsdatum)\n\nBayern Amtsgericht München HRB 295874\nRegisterbekanntmachung nach dem Umwandlungsgesetz 18.10.2024 (Eintragungsdatum)\n\nValeroo GmbH\nGesellschaft mit beschränkter Haftung\nGräfelfing\n\nDen Gläubigern der an der Verschmelzung beteiligten Rechtsträger ist, wenn sie binnen sechs Monaten nach dem Tag, an dem die Eintragung der Verschmelzung in das Register des Sitzes desjenigen Rechtsträgers, dessen Gläubiger sie sind, nach § 19 Abs. 3 UmwG als bekannt gemacht gilt, ihren Anspruch nach Grund und Höhe schriftlich anmelden, Sicherheit zu leisten, soweit sie nicht Befriedigung verlangen können. Dieses Recht steht den Gläubigern jedoch nur zu, wenn sie glaubhaft machen, dass durch die Verschmelzung die Erfüllung ihrer Forderung gefährdet wird."
    },
    {
      "date": "2024-10-19",
      "id": "90973",
      "original_text": "Registerbekanntmachung nach dem Umwandlungsgesetz\nBayern Amtsgericht Augsburg HRA 19593\nWalser GmbH & Co. KG – Gersthofen",
      "type": "Registerbekanntmachung nach dem Umwandlungsgesetz",
      "state": "Bayern",
      "amtsgericht": "Amtsgericht Augsburg",
      "registernummer": "HRA 19593",
      "registerart": "HRA",
      "company_name": "Walser GmbH & Co. KG",
      "company_seat": "Gersthofen",
      "details": "19.10.2024 (Bekanntmachungsdatum)\n\nBayern Amtsgericht Augsburg HRA 19593\nRegisterbekanntmachung nach dem Umwandlungsgesetz 18.10.2024 (Eintragungsdatum)\n\nWalser GmbH & Co. KG\nKommanditgesellschaft\nGersthofen\n\nDen Gläubigern der an der Verschmelzung beteiligten Rechtsträger ist, wenn sie binnen sechs Monaten nach dem Tag, an dem die Eintragung der Verschmelzung in das Register des Sitzes desjenigen Rechtsträgers, dessen Gläubiger sie sind, nach § 19 Abs. 3 UmwG als bekannt gemacht gilt, ihren Anspruch nach Grund und Höhe schriftlich anmelden, Sicherheit zu leisten, soweit sie nicht Befriedigung verlangen können. Dieses Recht steht den Gläubigern jedoch nur zu, wenn sie glaubhaft machen, dass durch die Verschmelzung die Erfüllung ihrer Forderung gefährdet wird."
    },
    {
      "date": "2024-10-19",
      "id": "90975",
      "original_text": "Löschungsankündigung\nBayern Amtsgericht München HRB 229119\naXport Mobile GmbH – Unterföhring",
      "type": "Löschungsankündigung",
      "state": "Bayern",
      "amtsgericht": "Amtsgericht München",
      "registernummer": "HRB 229119",
      "registerart": "HRB",
      "company_name": "aXport Mobile GmbH",
      "company_seat": "Unterföhring",
      "details": "19.10.2024 (Bekanntmachungsdatum)\n\nBayern Amtsgericht München HRB 229119\nLöschungsankündigung 18.10.2024 (Eintragungsdatum)\n\naXport Mobile GmbH\nGesellschaft mit beschränkter Haftung\nUnterföhring\n\nDas Registergericht beabsichtigt, die im Handelsregister eingetragene Gesellschaft wegen Vermögenslosigkeit von Amts wegen nach § 394 FamFG zu löschen. Die Frist zur Erhebung eines Widerspruchs ist auf drei Monate festgesetzt."
    },
    {
      "date": "2024-10-19",
      "id": "90986",
      "original_text": "Löschungsankündigung\nBayern Amtsgericht München HRB 167674\ndima24.de Investmentberatung GmbH – Unterföhring",
      "type": "Löschungsankündigung",
      "state": "Bayern",
      "amtsgericht": "Amtsgericht München",
      "registernummer": "HRB 167674",
      "registerart": "HRB",
      "company_name": "dima24.de Investmentberatung GmbH",
      "company_seat": "Unterföhring",
      "details": "19.10.2024 (Bekanntmachungsdatum)\n\nBayern Amtsgericht München HRB 167674\nLöschungsankündigung\n\ndima24.de Investmentberatung GmbH\nGesellschaft mit beschränkter Haftung\nUnterföhring\n\nDas Registergericht beabsichtigt, die im Handelsregister eingetragene Gesellschaft wegen Vermögenslosigkeit von Amts wegen nach § 394 FamFG zu löschen. Die Frist zur Erhebung eines Widerspruchs ist auf drei Monate festgesetzt."
    }
  ]
}