{
  "date": "2024-10-28",
  "date_of_scrape": "2024-11-30T21:14:17.177Z",
  "tool_version": "0.2.0",
  "number_of_announcements": 108,
  "announcements": [
    {
      "date": "2024-10-28",
      "id": "91794",
      "original_text": "Einreichung neuer Dokumente\nBaden-Württemberg Amtsgericht Freiburg HRB 261146\nWFG - Wirtschaftsförderungsgesellschaft des Landkreises Emmendingen mbH – Emmendingen",
      "type": "Einreichung neuer Dokumente",
      "state": "Baden-Württemberg",
      "amtsgericht": "Amtsgericht Freiburg",
      "registernummer": "HRB 261146",
      "registerart": "HRB",
      "company_name": "WFG - Wirtschaftsförderungsgesellschaft des Landkreises Emmendingen mbH",
      "company_seat": "Emmendingen",
      "details": "28.10.2024 (Bekanntmachungsdatum)\n\nBaden-Württemberg Amtsgericht Freiburg HRB 261146\nEinreichung neuer Dokumente 28.10.2024 (Eintragungsdatum)\n\nWFG - Wirtschaftsförderungsgesellschaft des Landkreises Emmendingen mbH\nGesellschaft mit beschränkter Haftung\nEmmendingen\n\nAls nicht eingetragen wird bekanntgemacht:\nDie Gesellschaft hat am 25.10.2024 die Liste über die Zusammensetzung des Aufsichtsrats zum Handelsregister eingereicht."
    },
    {
      "date": "2024-10-28",
      "id": "91795",
      "original_text": "Registerbekanntmachung nach dem Umwandlungsgesetz\nBaden-Württemberg Amtsgericht Mannheim HRB 743304\nPAUL Tech AG – Mannheim",
      "type": "Registerbekanntmachung nach dem Umwandlungsgesetz",
      "state": "Baden-Württemberg",
      "amtsgericht": "Amtsgericht Mannheim",
      "registernummer": "HRB 743304",
      "registerart": "HRB",
      "company_name": "PAUL Tech AG",
      "company_seat": "Mannheim",
      "details": "28.10.2024 (Bekanntmachungsdatum)\n\nBaden-Württemberg Amtsgericht Mannheim HRB 743304\nRegisterbekanntmachung nach dem Umwandlungsgesetz 28.10.2024 (Eintragungsdatum)\n\nPAUL Tech AG\nAktiengesellschaft\nMannheim\n\nAls nicht eingetragen wird bekanntgemacht:\nDen Gläubigern der an der Verschmelzung beteiligten Rechtsträger ist, wenn sie binnen sechs Monaten nach dem Tag, an dem die Eintragung der Verschmelzung in das Register des Sitzes desjenigen Rechtsträgers, dessen Gläubiger sie sind, nach § 19 Abs. 3 UmwG als bekanntgemacht gilt, ihren Anspruch nach Grund und Höhe schriftlich anmelden, Sicherheit zu leisten, soweit sie nicht Befriedigung verlangen können. Dieses Recht steht den Gläubigern jedoch nur zu, wenn sie glaubhaft machen, dass durch die Verschmelzung die Erfüllung ihrer Forderung gefährdet wird."
    },
    {
      "date": "2024-10-28",
      "id": "91796",
      "original_text": "Registerbekanntmachung nach dem Umwandlungsgesetz\nSchleswig-Holstein Amtsgericht Flensburg HRB 5961\nPK Speicher GmbH – Kappeln",
      "type": "Registerbekanntmachung nach dem Umwandlungsgesetz",
      "state": "Schleswig-Holstein",
      "amtsgericht": "Amtsgericht Flensburg",
      "registernummer": "HRB 5961",
      "registerart": "HRB",
      "company_name": "PK Speicher GmbH",
      "company_seat": "Kappeln",
      "details": "28.10.2024 (Bekanntmachungsdatum)\n\nSchleswig-Holstein Amtsgericht Flensburg HRB 5961\nRegisterbekanntmachung nach dem Umwandlungsgesetz 21.10.2024 (Eintragungsdatum)\n\nPK Speicher GmbH\nGesellschaft mit beschränkter Haftung\nKappeln\n\nZu Eintragungsnummer 9 vom 21.10.2024 wird als nicht eingetragen veröffentlicht: Den Gläubigern ist, wenn sie binnen sechs Monaten nach dem Tag, an dem die Eintragung der Umwandlung als bekannt gemacht gilt, ihren Anspruch nach Grund und Höhe schriftlich anmelden, Sicherheit zu leisten, soweit sie nicht Befriedigung verlangen können. Dieses Recht steht den Gläubigern jedoch nur zu, wenn sie glaubhaft machen, dass durch die Umwandlung die Erfüllung ihrer Forderung gefährdet wird."
    },
    {
      "date": "2024-10-28",
      "id": "91797",
      "original_text": "Einreichung neuer Dokumente\nBaden-Württemberg Amtsgericht Freiburg HRB 412367\nWeil am Rhein Wirtschaft & Tourismus GmbH – Weil am Rhein",
      "type": "Einreichung neuer Dokumente",
      "state": "Baden-Württemberg",
      "amtsgericht": "Amtsgericht Freiburg",
      "registernummer": "HRB 412367",
      "registerart": "HRB",
      "company_name": "Weil am Rhein Wirtschaft & Tourismus GmbH",
      "company_seat": "Weil am Rhein",
      "details": "28.10.2024 (Bekanntmachungsdatum)\n\nBaden-Württemberg Amtsgericht Freiburg HRB 412367\nEinreichung neuer Dokumente\n\nWeil am Rhein Wirtschaft & Tourismus GmbH\nGesellschaft mit beschränkter Haftung\nWeil am Rhein\n\nDie Gesellschaft hat am 24.10.2024 die Liste über die Zusammensetzung des Aufsichtsrats zum Handelsregister eingereicht."
    },
    {
      "date": "2024-10-28",
      "id": "91798",
      "original_text": "Löschungsankündigung\nBaden-Württemberg Amtsgericht Stuttgart HRA 275\nKHS Management GmbH & Co. KG – Stuttgart",
      "type": "Löschungsankündigung",
      "state": "Baden-Württemberg",
      "amtsgericht": "Amtsgericht Stuttgart",
      "registernummer": "HRA 275",
      "registerart": "HRA",
      "company_name": "KHS Management GmbH & Co. KG",
      "company_seat": "Stuttgart",
      "details": "28.10.2024 (Bekanntmachungsdatum)\n\nBaden-Württemberg Amtsgericht Stuttgart HRA 275\nLöschungsankündigung\n\nKHS Management GmbH & Co. KG\nKommanditgesellschaft\nStuttgart\n\nDas Gericht beabsichtigt, die Gesellschaft wegen Vermögenslosigkeit im Handelsregister von Amts wegen nach § 394 FamFG zu löschen. Die Frist zur Geltendmachung eines Widerspruchs gegen die beabsichtigte Löschung ist auf einen Monat ab Veröffentlichung bestimmt."
    },
    {
      "date": "2024-10-28",
      "id": "91799",
      "original_text": "Löschungsankündigung\nSaarland Amtsgericht Saarbrücken HRB 101143\nMaus GmbH – Saarbrücken",
      "type": "Löschungsankündigung",
      "state": "Saarland",
      "amtsgericht": "Amtsgericht Saarbrücken",
      "registernummer": "HRB 101143",
      "registerart": "HRB",
      "company_name": "Maus GmbH",
      "company_seat": "Saarbrücken",
      "details": "28.10.2024 (Bekanntmachungsdatum)\n\nSaarland Amtsgericht Saarbrücken HRB 101143\nLöschungsankündigung\n\nMaus GmbH\nGesellschaft mit beschränkter Haftung\nSaarbrücken\n\nEs ist beabsichtigt, die Gesellschaft von Amts wegen gemäß § 394 FamFG wegen Vermögenslosigkeit zu löschen.\nGegen die Löschung von Amts wegen ist das Rechtsmittel des Widerspruchs statthaft. Der Widerspruch ist binnen einer Frist zwei Monaten beginnend mit dem Tag dieser Veröffentlichung durch Einreichen eines Widerspruchsschreibens -schriftlich oder zur Niederschrift der Geschäftsstelle beim Amtsgericht Saarbrücken, -zentrales Handelsregister-, Mainzerstr.178, 66121 Saarbrücken einzulegen.\nDer Widerspruch muss die Bezeichnung der angefochtenen Löschungsankündigung enthalten sowie die Erklärung, dass Widerspruch eingelegt wird. Er ist vom Widerspruchsführer oder seinem Bevollmächtigten zu unterzeichnen.\nDas Widerspruchsschreiben kann auch in der Form eines elektronischen Dokumentes eingereicht werden, das mit einer qualifizierten elektronischen Signatur nach dem Signaturgesetz versehen sein muss (§§ 14 Abs. 2 FamFG, 130a, 298 ZPO)."
    },
    {
      "date": "2024-10-28",
      "id": "91800",
      "original_text": "Einreichung neuer Dokumente\nBaden-Württemberg Amtsgericht Mannheim HRB 733113\nHitachi Energy Germany AG – Mannheim",
      "type": "Einreichung neuer Dokumente",
      "state": "Baden-Württemberg",
      "amtsgericht": "Amtsgericht Mannheim",
      "registernummer": "HRB 733113",
      "registerart": "HRB",
      "company_name": "Hitachi Energy Germany AG",
      "company_seat": "Mannheim",
      "details": "28.10.2024 (Bekanntmachungsdatum)\n\nBaden-Württemberg Amtsgericht Mannheim HRB 733113\nEinreichung neuer Dokumente 28.10.2024 (Eintragungsdatum)\n\nHitachi Energy Germany AG\nAktiengesellschaft\nMannheim\n\nDie Gesellschaft hat am 24.10.2024 die Liste über die Zusammensetzung des Aufsichtsrats zum Handelsregister eingereicht."
    },
    {
      "date": "2024-10-28",
      "id": "91801",
      "original_text": "Einreichung neuer Dokumente\nSaarland Amtsgericht Saarbrücken HRB 25172\nGas- und Wasserwerke Bous - Schwalbach GmbH – Bous",
      "type": "Einreichung neuer Dokumente",
      "state": "Saarland",
      "amtsgericht": "Amtsgericht Saarbrücken",
      "registernummer": "HRB 25172",
      "registerart": "HRB",
      "company_name": "Gas- und Wasserwerke Bous - Schwalbach GmbH",
      "company_seat": "Bous",
      "details": "28.10.2024 (Bekanntmachungsdatum)\n\nSaarland Amtsgericht Saarbrücken HRB 25172\nEinreichung neuer Dokumente\n\nGas- und Wasserwerke Bous - Schwalbach GmbH\nGesellschaft mit beschränkter Haftung\nBous\n\nDie Geschäftsführung der Gesellschaft hat eine Liste der Mitglieder des Aufsichtsrats zum Handelsregister eingereicht (§ 52 Abs. 3 Satz 2 GmbHG)."
    },
    {
      "date": "2024-10-28",
      "id": "91802",
      "original_text": "Einreichung neuer Dokumente\nSachsen-Anhalt Amtsgericht Stendal HRB 207029\nTechnische Werke Naumburg GmbH – Naumburg (Saale)",
      "type": "Einreichung neuer Dokumente",
      "state": "Sachsen-Anhalt",
      "amtsgericht": "Amtsgericht Stendal",
      "registernummer": "HRB 207029",
      "registerart": "HRB",
      "company_name": "Technische Werke Naumburg GmbH",
      "company_seat": "Naumburg (Saale)",
      "details": "28.10.2024 (Bekanntmachungsdatum)\n\nSachsen-Anhalt Amtsgericht Stendal HRB 207029\nEinreichung neuer Dokumente\n\nTechnische Werke Naumburg GmbH\nGesellschaft mit beschränkter Haftung\nNaumburg (Saale)\n\nEine Liste der Mitglieder des Aufsichtsrates wurde zum Handelsregister eingereicht."
    },
    {
      "date": "2024-10-28",
      "id": "91803",
      "original_text": "Löschungsankündigung\nBaden-Württemberg Amtsgericht Stuttgart HRB 765868\nCVC Classic Vintage Cars UG (haftungsbeschränkt) automobile Klassiker – Weinstadt",
      "type": "Löschungsankündigung",
      "state": "Baden-Württemberg",
      "amtsgericht": "Amtsgericht Stuttgart",
      "registernummer": "HRB 765868",
      "registerart": "HRB",
      "company_name": "CVC Classic Vintage Cars UG (haftungsbeschränkt) automobile Klassiker",
      "company_seat": "Weinstadt",
      "details": "28.10.2024 (Bekanntmachungsdatum)\n\nBaden-Württemberg Amtsgericht Stuttgart HRB 765868\nLöschungsankündigung\n\nCVC Classic Vintage Cars UG (haftungsbeschränkt) automobile Klassiker\nGesellschaft mit beschränkter Haftung\nWeinstadt\n\nDas Gericht beabsichtigt, die Gesellschaft wegen Vermögenslosigkeit im Handelsregister von Amts wegen nach § 394 FamFG zu löschen. Die Frist zur Geltendmachung eines Widerspruchs gegen die beabsichtigte Löschung ist auf einen Monat ab Veröffentlichung bestimmt."
    },
    {
      "date": "2024-10-28",
      "id": "91804",
      "original_text": "Einreichung neuer Dokumente\nBaden-Württemberg Amtsgericht Stuttgart HRB 100630\nStadtwerke Weinsberg Gesellschaft mit beschränkter Haftung – Weinsberg",
      "type": "Einreichung neuer Dokumente",
      "state": "Baden-Württemberg",
      "amtsgericht": "Amtsgericht Stuttgart",
      "registernummer": "HRB 100630",
      "registerart": "HRB",
      "company_name": "Stadtwerke Weinsberg Gesellschaft mit beschränkter Haftung",
      "company_seat": "Weinsberg",
      "details": "28.10.2024 (Bekanntmachungsdatum)\n\nBaden-Württemberg Amtsgericht Stuttgart HRB 100630\nEinreichung neuer Dokumente\n\nStadtwerke Weinsberg Gesellschaft mit beschränkter Haftung\nGesellschaft mit beschränkter Haftung\nWeinsberg\n\nDie Gesellschaft hat am 22.10.2024 die Liste über die Zusammensetzung des Aufsichtsrats zum Handelsregister eingereicht."
    },
    {
      "date": "2024-10-28",
      "id": "91805",
      "original_text": "Registerbekanntmachung nach dem Umwandlungsgesetz\nSachsen-Anhalt Amtsgericht Stendal HRB 11100\nMöbel-Mitnahmemarkt GmbH – Wittenberg",
      "type": "Registerbekanntmachung nach dem Umwandlungsgesetz",
      "state": "Sachsen-Anhalt",
      "amtsgericht": "Amtsgericht Stendal",
      "registernummer": "HRB 11100",
      "registerart": "HRB",
      "company_name": "Möbel-Mitnahmemarkt GmbH",
      "company_seat": "Wittenberg",
      "details": "28.10.2024 (Bekanntmachungsdatum)\n\nSachsen-Anhalt Amtsgericht Stendal HRB 11100\nRegisterbekanntmachung nach dem Umwandlungsgesetz 28.10.2024 (Eintragungsdatum)\n\nMöbel-Mitnahmemarkt GmbH\nGesellschaft mit beschränkter Haftung\nWittenberg\n\nNicht eingetragen:\nDen Gläubigern der an der Verschmelzung beteiligten Rechtsträger ist, wenn sie binnen sechs Monaten nach dem Tag, an dem die Eintragung der Verschmelzung nach § 19 Abs. 3 UmwG als bekanntgemacht gilt, ihren Anspruch nach Grund und Höhe schriftlich anmelden, Sicherheit zu leisten, soweit sie nicht Befriedigung verlangen können. Dieses Recht steht ihnen jedoch nur zu, wenn sie glaubhaft machen, dass durch die Verschmelzung die Erfüllung ihrer Forderung gefährdet wird."
    },
    {
      "date": "2024-10-28",
      "id": "91806",
      "original_text": "Einreichung neuer Dokumente\nBaden-Württemberg Amtsgericht Freiburg HRB 630219\nRehaKlinikum Bad Säckingen GmbH – Bad Säckingen",
      "type": "Einreichung neuer Dokumente",
      "state": "Baden-Württemberg",
      "amtsgericht": "Amtsgericht Freiburg",
      "registernummer": "HRB 630219",
      "registerart": "HRB",
      "company_name": "RehaKlinikum Bad Säckingen GmbH",
      "company_seat": "Bad Säckingen",
      "details": "28.10.2024 (Bekanntmachungsdatum)\n\nBaden-Württemberg Amtsgericht Freiburg HRB 630219\nEinreichung neuer Dokumente\n\nRehaKlinikum Bad Säckingen GmbH\nGesellschaft mit beschränkter Haftung\nBad Säckingen\n\nAls nicht eingetragen wird bekanntgemacht:\nDie Gesellschaft hat am 24.10.2024 die Liste über die Zusammensetzung des Aufsichtsrats zum Handelsregister eingereicht."
    },
    {
      "date": "2024-10-28",
      "id": "91807",
      "original_text": "Löschungsankündigung\nMecklenburg-Vorpommern Amtsgericht Stralsund HRB 8490\nNoack Speditions-Logistik- und Dienstleistungs UG (haftungsbeschränkt) – Bergen auf Rügen",
      "type": "Löschungsankündigung",
      "state": "Mecklenburg-Vorpommern",
      "amtsgericht": "Amtsgericht Stralsund",
      "registernummer": "HRB 8490",
      "registerart": "HRB",
      "company_name": "Noack Speditions-Logistik- und Dienstleistungs UG (haftungsbeschränkt)",
      "company_seat": "Bergen auf Rügen",
      "details": "28.10.2024 (Bekanntmachungsdatum)\n\nMecklenburg-Vorpommern Amtsgericht Stralsund HRB 8490\nLöschungsankündigung\n\nNoack Speditions-Logistik- und Dienstleistungs UG (haftungsbeschränkt)\nGesellschaft mit beschränkter Haftung\nBergen auf Rügen\n\nDas Registergericht beabsichtigt, die im Handelsregister eingetragene Gesellschaft von Amts wegen nach § 394 FamFG zu löschen. Die Frist zur Erhebung eines Widerspruchs gegen die beabsichtigte Löschung wird auf einen Monat festgesetzt."
    },
    {
      "date": "2024-10-28",
      "id": "91808",
      "original_text": "Registerbekanntmachung nach dem Umwandlungsgesetz\nHamburg Amtsgericht Hamburg HRB 74384\nNetzpiloten AG – Hamburg",
      "type": "Registerbekanntmachung nach dem Umwandlungsgesetz",
      "state": "Hamburg",
      "amtsgericht": "Amtsgericht Hamburg",
      "registernummer": "HRB 74384",
      "registerart": "HRB",
      "company_name": "Netzpiloten AG",
      "company_seat": "Hamburg",
      "details": "28.10.2024 (Bekanntmachungsdatum)\n\nHamburg Amtsgericht Hamburg HRB 74384\nRegisterbekanntmachung nach dem Umwandlungsgesetz 25.10.2024 (Eintragungsdatum)\n\nNetzpiloten AG\nAktiengesellschaft\nHamburg\n\nAls nicht eingetragen wird bekannt gemacht:\nDen Gläubigern der an der Verschmelzung beteiligten Gesellschaften ist, wenn sie binnen sechs Monaten nach dem Tag, an dem die Eintragung der Verschmelzung in das Register des Sitzes derjenigen Rechtsträger deren Gläubiger sie sind, nach § 19 Absatz 3 UmwG als bekannt gemacht gilt, ihren Anspruch nach Grund und Höhe schriftlich anmelden, Sicherheit zu leisten, soweit sie nicht Befriedigung verlangen können. Dieses Recht steht den Gläubigern jedoch nur zu, wenn sie glaubhaft machen, dass durch die Verschmelzung die Erfüllung ihrer Forderung gefährdet wird."
    },
    {
      "date": "2024-10-28",
      "id": "91809",
      "original_text": "Einreichung neuer Dokumente\nSchleswig-Holstein Amtsgericht Lübeck HRB 22622\nBAADER Global SE – Lübeck",
      "type": "Einreichung neuer Dokumente",
      "state": "Schleswig-Holstein",
      "amtsgericht": "Amtsgericht Lübeck",
      "registernummer": "HRB 22622",
      "registerart": "HRB",
      "company_name": "BAADER Global SE",
      "company_seat": "Lübeck",
      "details": "28.10.2024 (Bekanntmachungsdatum)\n\nSchleswig-Holstein Amtsgericht Lübeck HRB 22622\nEinreichung neuer Dokumente\n\nBAADER Global SE\nEuropäische Aktiengesellschaft (SE)\nLübeck\n\nAls nicht eingetragen wird veröffentlicht:\nEs wurde eine neue Liste der Aufsichtsratsmitglieder mit Datum 30.09.2024 zum Handelsregister eingereicht."
    },
    {
      "date": "2024-10-28",
      "id": "91810",
      "original_text": "Registerbekanntmachung nach dem Umwandlungsgesetz\nBaden-Württemberg Amtsgericht Mannheim HRB 337518\nSRH Hochschulen GmbH – Heidelberg",
      "type": "Registerbekanntmachung nach dem Umwandlungsgesetz",
      "state": "Baden-Württemberg",
      "amtsgericht": "Amtsgericht Mannheim",
      "registernummer": "HRB 337518",
      "registerart": "HRB",
      "company_name": "SRH Hochschulen GmbH",
      "company_seat": "Heidelberg",
      "details": "28.10.2024 (Bekanntmachungsdatum)\n\nBaden-Württemberg Amtsgericht Mannheim HRB 337518\nRegisterbekanntmachung nach dem Umwandlungsgesetz 28.10.2024 (Eintragungsdatum)\n\nSRH Hochschulen GmbH\nGesellschaft mit beschränkter Haftung\nHeidelberg\n\nDen Gläubigern der an der Verschmelzung beteiligten Rechtsträger ist, wenn sie binnen sechs Monaten nach dem Tag, an dem die Eintragung der Verschmelzung in das Register des Sitzes desjenigen Rechtsträgers, dessen Gläubiger sie sind, nach § 19 Abs. 3 UmwG als bekanntgemacht gilt, ihren Anspruch nach Grund und Höhe schriftlich anmelden, Sicherheit zu leisten, soweit sie nicht Befriedigung verlangen können. Dieses Recht steht den Gläubigern jedoch nur zu, wenn sie glaubhaft machen, dass durch die Verschmelzung die Erfüllung ihrer Forderung gefährdet wird."
    },
    {
      "date": "2024-10-28",
      "id": "91811",
      "original_text": "Einreichung neuer Dokumente\nBaden-Württemberg Amtsgericht Stuttgart HRB 570105\nBausparkasse Schwäbisch Hall Aktiengesellschaft - Bausparkasse der Volksbanken und Raiffeisenbanken - – Schwäbisch Hall",
      "type": "Einreichung neuer Dokumente",
      "state": "Baden-Württemberg",
      "amtsgericht": "Amtsgericht Stuttgart",
      "registernummer": "HRB 570105",
      "registerart": "HRB",
      "company_name": "Bausparkasse Schwäbisch Hall Aktiengesellschaft - Bausparkasse der Volksbanken und Raiffeisenbanken -",
      "company_seat": "Schwäbisch Hall",
      "details": "28.10.2024 (Bekanntmachungsdatum)\n\nBaden-Württemberg Amtsgericht Stuttgart HRB 570105\nEinreichung neuer Dokumente\n\nBausparkasse Schwäbisch Hall Aktiengesellschaft - Bausparkasse der Volksbanken und Raiffeisenbanken -\nAktiengesellschaft\nSchwäbisch Hall\n\nDie Gesellschaft hat am 27.09.2024 die Liste über die Zusammensetzung des Aufsichtsrats zum Handelsregister eingereicht."
    },
    {
      "date": "2024-10-28",
      "id": "91812",
      "original_text": "Registerbekanntmachung nach dem Umwandlungsgesetz\nSachsen-Anhalt Amtsgericht Stendal HRB 1496\nWTS GmbH Wirtschafts- und Technologieservice – Gommern",
      "type": "Registerbekanntmachung nach dem Umwandlungsgesetz",
      "state": "Sachsen-Anhalt",
      "amtsgericht": "Amtsgericht Stendal",
      "registernummer": "HRB 1496",
      "registerart": "HRB",
      "company_name": "WTS GmbH Wirtschafts- und Technologieservice",
      "company_seat": "Gommern",
      "details": "28.10.2024 (Bekanntmachungsdatum)\n\nSachsen-Anhalt Amtsgericht Stendal HRB 1496\nRegisterbekanntmachung nach dem Umwandlungsgesetz 28.10.2024 (Eintragungsdatum)\n\nWTS GmbH Wirtschafts- und Technologieservice\nGesellschaft mit beschränkter Haftung\nGommern\n\nNicht eingetragen:\nDen Gläubigern der an der Verschmelzung beteiligten Rechtsträger ist, wenn sie binnen sechs Monaten nach dem Tag, an dem die Eintragung der Verschmelzung nach § 19 Abs. 3 UmwG als bekanntgemacht gilt, ihren Anspruch nach Grund und Höhe schriftlich anmelden, Sicherheit zu leisten, soweit sie nicht Befriedigung verlangen können. Dieses Recht steht ihnen jedoch nur zu, wenn sie glaubhaft machen, dass durch die Verschmelzung die Erfüllung ihrer Forderung gefährdet wird."
    },
    {
      "date": "2024-10-28",
      "id": "91813",
      "original_text": "Registerbekanntmachung nach dem Umwandlungsgesetz\nSachsen-Anhalt Amtsgericht Stendal HRB 1724\nTWB Vermögensverwaltungs GmbH ( TWB-VV ) – Gommern",
      "type": "Registerbekanntmachung nach dem Umwandlungsgesetz",
      "state": "Sachsen-Anhalt",
      "amtsgericht": "Amtsgericht Stendal",
      "registernummer": "HRB 1724",
      "registerart": "HRB",
      "company_name": "TWB Vermögensverwaltungs GmbH ( TWB-VV )",
      "company_seat": "Gommern",
      "details": "28.10.2024 (Bekanntmachungsdatum)\n\nSachsen-Anhalt Amtsgericht Stendal HRB 1724\nRegisterbekanntmachung nach dem Umwandlungsgesetz 28.10.2024 (Eintragungsdatum)\n\nTWB Vermögensverwaltungs GmbH ( TWB-VV )\nGesellschaft mit beschränkter Haftung\nGommern\n\nNicht eingetragen:\nDen Gläubigern der an der Verschmelzung beteiligten Rechtsträger ist, wenn sie binnen sechs Monaten nach dem Tag, an dem die Eintragung der Verschmelzung nach § 19 Abs. 3 UmwG als bekanntgemacht gilt, ihren Anspruch nach Grund und Höhe schriftlich anmelden, Sicherheit zu leisten, soweit sie nicht Befriedigung verlangen können. Dieses Recht steht ihnen jedoch nur zu, wenn sie glaubhaft machen, dass durch die Verschmelzung die Erfüllung ihrer Forderung gefährdet wird."
    },
    {
      "date": "2024-10-28",
      "id": "91814",
      "original_text": "Löschungsankündigung\nSaarland Amtsgericht Saarbrücken HRB 107394\nWineKing Trading UG (haftungsbeschränkt) – Neunkirchen",
      "type": "Löschungsankündigung",
      "state": "Saarland",
      "amtsgericht": "Amtsgericht Saarbrücken",
      "registernummer": "HRB 107394",
      "registerart": "HRB",
      "company_name": "WineKing Trading UG (haftungsbeschränkt)",
      "company_seat": "Neunkirchen",
      "details": "28.10.2024 (Bekanntmachungsdatum)\n\nSaarland Amtsgericht Saarbrücken HRB 107394\nLöschungsankündigung\n\nWineKing Trading UG (haftungsbeschränkt)\nGesellschaft mit beschränkter Haftung\nNeunkirchen\n\nEs ist beabsichtigt, die Gesellschaft von Amts wegen gemäß § 394 FamFG wegen Vermögenslosigkeit zu löschen. Gegen die Löschung von Amts wegen ist das Rechtsmittel des Widerspruchs statthaft. Der Widerspruch ist binnen einer Frist von 3 Monaten beginnend mit dem Tag dieser Veröffentlichung durch Einreichen eines Widerspruchsschreibens -schriftlich oder zur Niederschrift der Geschäftsstelle- beim Amtsgericht Saarbrücken, -zentrales Handelsregister-, Mainzerstr.178, 66121 Saarbrücken einzulegen. Der Widerspruch muss die Bezeichnung der angefochtenen Löschungsankündigung enthalten sowie die Erklärung, dass Widerspruch eingelegt wird. Er ist vom Widerspruchsführer oder seinem Bevollmächtigten zu unterzeichnen."
    },
    {
      "date": "2024-10-28",
      "id": "91815",
      "original_text": "Registerbekanntmachung nach dem Umwandlungsgesetz\nBaden-Württemberg Amtsgericht Mannheim HRB 106393\nHeinrich Heine GmbH – Karlsruhe",
      "type": "Registerbekanntmachung nach dem Umwandlungsgesetz",
      "state": "Baden-Württemberg",
      "amtsgericht": "Amtsgericht Mannheim",
      "registernummer": "HRB 106393",
      "registerart": "HRB",
      "company_name": "Heinrich Heine GmbH",
      "company_seat": "Karlsruhe",
      "details": "28.10.2024 (Bekanntmachungsdatum)\n\nBaden-Württemberg Amtsgericht Mannheim HRB 106393\nRegisterbekanntmachung nach dem Umwandlungsgesetz 28.10.2024 (Eintragungsdatum)\n\nHeinrich Heine GmbH\nGesellschaft mit beschränkter Haftung\nKarlsruhe\n\nAls nicht eingetragen wird bekanntgemacht:\nDen Gläubigern der an der Verschmelzung beteiligten Rechtsträger ist, wenn sie binnen sechs Monaten nach dem Tag, an dem die Eintragung der Verschmelzung in das Register des Sitzes desjenigen Rechtsträgers, dessen Gläubiger sie sind, nach § 19 Abs. 3 UmwG als bekanntgemacht gilt, ihren Anspruch nach Grund und Höhe schriftlich anmelden, Sicherheit zu leisten, soweit sie nicht Befriedigung verlangen können. Dieses Recht steht den Gläubigern jedoch nur zu, wenn sie glaubhaft machen, dass durch die Verschmelzung die Erfüllung ihrer Forderung gefährdet wird."
    },
    {
      "date": "2024-10-28",
      "id": "91816",
      "original_text": "Registerbekanntmachung nach dem Umwandlungsgesetz\nHamburg Amtsgericht Hamburg HRB 118896\nNCR Invest GmbH – Hamburg",
      "type": "Registerbekanntmachung nach dem Umwandlungsgesetz",
      "state": "Hamburg",
      "amtsgericht": "Amtsgericht Hamburg",
      "registernummer": "HRB 118896",
      "registerart": "HRB",
      "company_name": "NCR Invest GmbH",
      "company_seat": "Hamburg",
      "details": "28.10.2024 (Bekanntmachungsdatum)\n\nHamburg Amtsgericht Hamburg HRB 118896\nRegisterbekanntmachung nach dem Umwandlungsgesetz 28.10.2024 (Eintragungsdatum)\n\nNCR Invest GmbH\nGesellschaft mit beschränkter Haftung\nHamburg\n\nAls nicht eingetragen wird bekannt gemacht:\nDen Gläubigern der an der Verschmelzung beteiligten Gesellschaften ist, wenn sie binnen sechs Monaten nach dem Tag, an dem die Eintragung der Verschmelzung in das Register des Sitzes desjenigen Rechtsträgers, dessen Gläubiger sie sind, nach § 19 Absatz 3 UmwG als bekannt gemacht gilt, ihren Anspruch nach Grund und Höhe schriftlich anmelden, Sicherheit zu leisten, soweit sie nicht Befriedigung verlangen können. Dieses Recht steht den Gläubigern jedoch nur zu, wenn sie glaubhaft machen, dass durch die Verschmelzung die Erfüllung ihrer Forderung gefährdet wird."
    },
    {
      "date": "2024-10-28",
      "id": "91817",
      "original_text": "Registerbekanntmachung nach dem Umwandlungsgesetz\nHamburg Amtsgericht Hamburg HRB 117399\nLARMIKA Beteiligungsgesellschaft mbH – Hamburg",
      "type": "Registerbekanntmachung nach dem Umwandlungsgesetz",
      "state": "Hamburg",
      "amtsgericht": "Amtsgericht Hamburg",
      "registernummer": "HRB 117399",
      "registerart": "HRB",
      "company_name": "LARMIKA Beteiligungsgesellschaft mbH",
      "company_seat": "Hamburg",
      "details": "28.10.2024 (Bekanntmachungsdatum)\n\nHamburg Amtsgericht Hamburg HRB 117399\nRegisterbekanntmachung nach dem Umwandlungsgesetz 28.10.2024 (Eintragungsdatum)\n\nLARMIKA Beteiligungsgesellschaft mbH\nGesellschaft mit beschränkter Haftung\nHamburg\n\nAls nicht eingetragen wird bekannt gemacht:\nDen Gläubigern der an der Verschmelzung beteiligten Gesellschaften ist, wenn sie binnen sechs Monaten nach dem Tag, an dem die Eintragung der Verschmelzung in das Register des Sitzes desjenigen Rechtsträgers, dessen Gläubiger sie sind, nach § 19 Absatz 3 UmwG als bekannt gemacht gilt, ihren Anspruch nach Grund und Höhe schriftlich anmelden, Sicherheit zu leisten, soweit sie nicht Befriedigung verlangen können. Dieses Recht steht den Gläubigern jedoch nur zu, wenn sie glaubhaft machen, dass durch die Verschmelzung die Erfüllung ihrer Forderung gefährdet wird."
    },
    {
      "date": "2024-10-28",
      "id": "91818",
      "original_text": "Löschungsankündigung\nBerlin Amtsgericht Berlin (Charlottenburg) HRB 182102\nkreuz & kümmel UG (haftungsbeschränkt) – Berlin",
      "type": "Löschungsankündigung",
      "state": "Berlin",
      "amtsgericht": "Amtsgericht Berlin (Charlottenburg)",
      "registernummer": "HRB 182102",
      "registerart": "HRB",
      "company_name": "kreuz & kümmel UG (haftungsbeschränkt)",
      "company_seat": "Berlin",
      "details": "28.10.2024 (Bekanntmachungsdatum)\n\nBerlin Amtsgericht Berlin (Charlottenburg) HRB 182102\nLöschungsankündigung\n\nkreuz & kümmel UG (haftungsbeschränkt)\nGesellschaft mit beschränkter Haftung\nBerlin\n\nBei der nachstehenden Gesellschaft wird das Amtslöschungsverfahren gemäß § 394 FamFG eingeleitet. Widerspruchsfrist 6 Wochen"
    },
    {
      "date": "2024-10-28",
      "id": "91819",
      "original_text": "Registerbekanntmachung nach dem Umwandlungsgesetz\nBaden-Württemberg Amtsgericht Stuttgart HRB 796880\nChristian Buck GmbH – Oberriexingen",
      "type": "Registerbekanntmachung nach dem Umwandlungsgesetz",
      "state": "Baden-Württemberg",
      "amtsgericht": "Amtsgericht Stuttgart",
      "registernummer": "HRB 796880",
      "registerart": "HRB",
      "company_name": "Christian Buck GmbH",
      "company_seat": "Oberriexingen",
      "details": "28.10.2024 (Bekanntmachungsdatum)\n\nBaden-Württemberg Amtsgericht Stuttgart HRB 796880\nRegisterbekanntmachung nach dem Umwandlungsgesetz 28.10.2024 (Eintragungsdatum)\n\nChristian Buck GmbH\nGesellschaft mit beschränkter Haftung\nOberriexingen\n\nAls nicht eingetragen wird bekanntgemacht:\nDen Gläubigern der an der Ausgliederung beteiligten Rechtsträger ist, wenn sie binnen sechs Monaten nach dem Tag, an dem die Eintragung der Ausgliederung in das Register des Sitzes desjenigen Rechtsträgers, dessen Gläubiger sie sind, nach § 19 Abs. 3 UmwG als bekanntgemacht gilt, ihren Anspruch nach Grund und Höhe schriftlich anmelden, Sicherheit zu leisten, soweit sie nicht Befriedigung verlangen können. Dieses Recht steht den Gläubigern jedoch nur zu, wenn sie glaubhaft machen, dass durch die Ausgliederung die Erfüllung ihrer Forderung gefährdet wird."
    },
    {
      "date": "2024-10-28",
      "id": "91820",
      "original_text": "Registerbekanntmachung nach dem Umwandlungsgesetz\nBaden-Württemberg Amtsgericht Stuttgart HRA 741083\nChristian Buck e.K. – Oberriexingen",
      "type": "Registerbekanntmachung nach dem Umwandlungsgesetz",
      "state": "Baden-Württemberg",
      "amtsgericht": "Amtsgericht Stuttgart",
      "registernummer": "HRA 741083",
      "registerart": "HRA",
      "company_name": "Christian Buck e.K.",
      "company_seat": "Oberriexingen",
      "details": "28.10.2024 (Bekanntmachungsdatum)\n\nBaden-Württemberg Amtsgericht Stuttgart HRA 741083\nRegisterbekanntmachung nach dem Umwandlungsgesetz 28.10.2024 (Eintragungsdatum)\n\nChristian Buck e.K.\nEinzelkaufmann / Einzelkauffrau\nOberriexingen\n\nAls nicht eingetragen wird bekanntgemacht:\nDen Gläubigern der an der Ausgliederung beteiligten Rechtsträger ist, wenn sie binnen sechs Monaten nach dem Tag, an dem die Eintragung der Ausgliederung in das Register des Sitzes desjenigen Rechtsträgers, dessen Gläubiger sie sind, nach § 19 Abs. 3 UmwG als bekanntgemacht gilt, ihren Anspruch nach Grund und Höhe schriftlich anmelden, Sicherheit zu leisten, soweit sie nicht Befriedigung verlangen können. Dieses Recht steht den Gläubigern jedoch nur zu, wenn sie glaubhaft machen, dass durch die Ausgliederung die Erfüllung ihrer Forderung gefährdet wird."
    },
    {
      "date": "2024-10-28",
      "id": "91821",
      "original_text": "Sonstige Registerbekanntmachung\nHamburg Amtsgericht Hamburg HRB 80305\nDATAGROUP Hamburg GmbH – Hamburg",
      "type": "Sonstige Registerbekanntmachung",
      "state": "Hamburg",
      "amtsgericht": "Amtsgericht Hamburg",
      "registernummer": "HRB 80305",
      "registerart": "HRB",
      "company_name": "DATAGROUP Hamburg GmbH",
      "company_seat": "Hamburg",
      "details": "28.10.2024 (Bekanntmachungsdatum)\n\nHamburg Amtsgericht Hamburg HRB 80305\nSonstige Registerbekanntmachung 28.10.2024 (Eintragungsdatum)\n\nDATAGROUP Hamburg GmbH\nGesellschaft mit beschränkter Haftung\nHamburg\n\nAls nicht eingetragen wird bekannt gemacht:  Den Gläubigern der Gesellschaft, deren Forderungen begründet worden sind, bevor die Eintragung der Vertragsbeendigung in das Handelsregister nach § 10 HGB als bekannt gemacht gilt, ist vom anderen Vertragsteil Sicherheit zu leisten, wenn sie sich binnen 6 Monaten nach Bekanntmachung der Eintragung zu diesem Zweck bei ihm melden."
    },
    {
      "date": "2024-10-28",
      "id": "91822",
      "original_text": "Löschungsankündigung\nBerlin Amtsgericht Berlin (Charlottenburg) HRB 198493\nPEKER GmbH – Berlin",
      "type": "Löschungsankündigung",
      "state": "Berlin",
      "amtsgericht": "Amtsgericht Berlin (Charlottenburg)",
      "registernummer": "HRB 198493",
      "registerart": "HRB",
      "company_name": "PEKER GmbH",
      "company_seat": "Berlin",
      "details": "28.10.2024 (Bekanntmachungsdatum)\n\nBerlin Amtsgericht Berlin (Charlottenburg) HRB 198493\nLöschungsankündigung\n\nPEKER GmbH\nGesellschaft mit beschränkter Haftung\nBerlin\n\nBei der nachstehenden Gesellschaft wird das Amtslöschungsverfahren gemäß § 394 FamFG eingeleitet. Widerspruchsfrist 6 Wochen"
    },
    {
      "date": "2024-10-28",
      "id": "91823",
      "original_text": "Sonstige Registerbekanntmachung\nBerlin Amtsgericht Berlin (Charlottenburg) HRB 2095\nBerliner Großmarkt Gesellschaft mit beschränkter Haftung – Berlin",
      "type": "Sonstige Registerbekanntmachung",
      "state": "Berlin",
      "amtsgericht": "Amtsgericht Berlin (Charlottenburg)",
      "registernummer": "HRB 2095",
      "registerart": "HRB",
      "company_name": "Berliner Großmarkt Gesellschaft mit beschränkter Haftung",
      "company_seat": "Berlin",
      "details": "28.10.2024 (Bekanntmachungsdatum)\n\nBerlin Amtsgericht Berlin (Charlottenburg) HRB 2095\nSonstige Registerbekanntmachung\n\nBerliner Großmarkt Gesellschaft mit beschränkter Haftung\nGesellschaft mit beschränkter Haftung\nBerlin\n\nAls nicht eingetragen wird veröffentlicht: Es wurde eine neue Liste der Aufsichtsratsmitglieder eingereicht (§52 GmbHG)."
    },
    {
      "date": "2024-10-28",
      "id": "91824",
      "original_text": "Registerbekanntmachung nach dem Umwandlungsgesetz\nBrandenburg Amtsgericht Neuruppin HRA 3628\nAppetz GmbH & Co. KG – Angermünde",
      "type": "Registerbekanntmachung nach dem Umwandlungsgesetz",
      "state": "Brandenburg",
      "amtsgericht": "Amtsgericht Neuruppin",
      "registernummer": "HRA 3628",
      "registerart": "HRA",
      "company_name": "Appetz GmbH & Co. KG",
      "company_seat": "Angermünde",
      "details": "28.10.2024 (Bekanntmachungsdatum)\n\nBrandenburg Amtsgericht Neuruppin HRA 3628\nRegisterbekanntmachung nach dem Umwandlungsgesetz 28.10.2024 (Eintragungsdatum)\n\nAppetz GmbH & Co. KG\nKommanditgesellschaft\nAngermünde\n\nZu Eintragungsnummer 2 vom 28.10.2024 wird als nicht eingetragen veröffentlicht:\nDen Gläubigern der an der Umwandlung beteiligten Rechtsträger ist, wenn sie binnen sechs Monaten nach dem Tag, an dem die Eintragung der Umwandlung in das Register des Sitzes desjenigen Rechtsträgers, dessen Gläubiger sie sind, als bekannt gemacht gilt, ihren Anspruch nach Grund und Höhe schriftlich anmelden, Sicherheit zu leisten, soweit sie nicht Befriedigung verlangen können. Dieses Recht steht den Gläubigern jedoch nur zu, wenn sie glaubhaft machen, dass durch die Umwandlung die Erfüllung ihrer Forderung gefährdet wird"
    },
    {
      "date": "2024-10-28",
      "id": "91825",
      "original_text": "Registerbekanntmachung nach dem Umwandlungsgesetz\nSchleswig-Holstein Amtsgericht Kiel HRB 10235\nNeon Paintball GmbH – Henstedt-Ulzburg",
      "type": "Registerbekanntmachung nach dem Umwandlungsgesetz",
      "state": "Schleswig-Holstein",
      "amtsgericht": "Amtsgericht Kiel",
      "registernummer": "HRB 10235",
      "registerart": "HRB",
      "company_name": "Neon Paintball GmbH",
      "company_seat": "Henstedt-Ulzburg",
      "details": "28.10.2024 (Bekanntmachungsdatum)\n\nSchleswig-Holstein Amtsgericht Kiel HRB 10235\nRegisterbekanntmachung nach dem Umwandlungsgesetz 09.09.2024 (Eintragungsdatum)\n\nNeon Paintball GmbH\nGesellschaft mit beschränkter Haftung\nHenstedt-Ulzburg\n\nZu Eintragungsnummer 6 vom 09.09.2024 wird als nicht eingetragen veröffentlicht: Den Gläubigern der an der Verschmelzung beteiligten Rechtsträger ist, wenn sie binnen sechs Monaten nach dem Tag, an dem die Eintragung der Verschmelzung in das Register des Sitzes desjenigen Rechtsträgers, dessen Gläubiger sie sind, nach § 19 Abs. 3 UmwG bekannt gemacht worden ist, ihren Anspruch nach Grund und Höhe schriftlich anmelden, Sicherheit zu leisten, soweit sie nicht Befriedigung verlangen können. Dieses Recht steht den Gläubigern jedoch nur zu, wenn sie glaubhaft machen, dass durch die Verschmelzung die Erfüllung ihrer Forderung gefährdet wird."
    },
    {
      "date": "2024-10-28",
      "id": "91826",
      "original_text": "Registerbekanntmachung nach dem Umwandlungsgesetz\nBaden-Württemberg Amtsgericht Stuttgart HRB 796778\nYVAL Idiosynkratische Investments SE – Stuttgart",
      "type": "Registerbekanntmachung nach dem Umwandlungsgesetz",
      "state": "Baden-Württemberg",
      "amtsgericht": "Amtsgericht Stuttgart",
      "registernummer": "HRB 796778",
      "registerart": "HRB",
      "company_name": "YVAL Idiosynkratische Investments SE",
      "company_seat": "Stuttgart",
      "details": "28.10.2024 (Bekanntmachungsdatum)\n\nBaden-Württemberg Amtsgericht Stuttgart HRB 796778\nRegisterbekanntmachung nach dem Umwandlungsgesetz\n\nYVAL Idiosynkratische Investments SE\nEuropäische Aktiengesellschaft (SE)\nStuttgart\n\nDie Gesellschaft hat am 24.10.2024 den Entwurf des Verschmelzungsvertrages zwischen \"DELPHI Unternehmensberatung Aktiengesellschaft\", Stuttgart (Amtsgericht Stuttgart HRB 796728)\nund der hiesigen Gesellschaft (übertragender Rechtsträger) zum Handelsregister eingereicht."
    },
    {
      "date": "2024-10-28",
      "id": "91827",
      "original_text": "Registerbekanntmachung nach dem Umwandlungsgesetz\nBaden-Württemberg Amtsgericht Stuttgart HRB 769098\nNKR Immobilienverwaltungs-GmbH – Tübingen",
      "type": "Registerbekanntmachung nach dem Umwandlungsgesetz",
      "state": "Baden-Württemberg",
      "amtsgericht": "Amtsgericht Stuttgart",
      "registernummer": "HRB 769098",
      "registerart": "HRB",
      "company_name": "NKR Immobilienverwaltungs-GmbH",
      "company_seat": "Tübingen",
      "details": "28.10.2024 (Bekanntmachungsdatum)\n\nBaden-Württemberg Amtsgericht Stuttgart HRB 769098\nRegisterbekanntmachung nach dem Umwandlungsgesetz 28.10.2024 (Eintragungsdatum)\n\nNKR Immobilienverwaltungs-GmbH\nGesellschaft mit beschränkter Haftung\nTübingen\n\nAls nicht eingetragen wird bekanntgemacht:\nDen Gläubigern der an der Verschmelzung beteiligten Rechtsträger ist, wenn sie binnen sechs Monaten nach dem Tag, an dem die Eintragung der Verschmelzung in das Register des Sitzes desjenigen Rechtsträgers, dessen Gläubiger sie sind, nach § 19 Abs. 3 UmwG als bekanntgemacht gilt, ihren Anspruch nach Grund und Höhe schriftlich anmelden, Sicherheit zu leisten, soweit sie nicht Befriedigung verlangen können. Dieses Recht steht den Gläubigern jedoch nur zu, wenn sie glaubhaft machen, dass durch die Verschmelzung die Erfüllung ihrer Forderung gefährdet wird."
    },
    {
      "date": "2024-10-28",
      "id": "91828",
      "original_text": "Registerbekanntmachung nach dem Umwandlungsgesetz\nBerlin Amtsgericht Berlin (Charlottenburg) HRB 75836\nA tempo Personalmanagement GmbH – Berlin",
      "type": "Registerbekanntmachung nach dem Umwandlungsgesetz",
      "state": "Berlin",
      "amtsgericht": "Amtsgericht Berlin (Charlottenburg)",
      "registernummer": "HRB 75836",
      "registerart": "HRB",
      "company_name": "A tempo Personalmanagement GmbH",
      "company_seat": "Berlin",
      "details": "28.10.2024 (Bekanntmachungsdatum)\n\nBerlin Amtsgericht Berlin (Charlottenburg) HRB 75836\nRegisterbekanntmachung nach dem Umwandlungsgesetz 26.10.2024 (Eintragungsdatum)\n\nA tempo Personalmanagement GmbH\nGesellschaft mit beschränkter Haftung\nBerlin\n\nZu Eintragungsnummer 7 vom 26.10.2024 wird als nicht eingetragen veröffentlicht: Den Gläubigern der an der Verschmelzung beteiligten Rechtsträger ist, wenn sie binnen sechs Monaten nach dem Tag, an dem die Eintragung der Verschmelzung in das Register des Sitzes desjenigen Rechtsträgers, dessen Gläubiger sie sind, als bekannt gemacht gilt, ihren Anspruch nach Grund und Höhe schriftlich anmelden, Sicherheit zu leisten, soweit sie nicht Befriedigung verlangen können. Dieses Recht steht den Gläubigern jedoch nur zu, wenn sie glaubhaft machen, dass durch die Verschmelzung die Erfüllung ihrer Forderung gefährdet wird. Das Recht, Sicherheitsleistung zu verlangen, steht Gläubigern nicht zu, die im Falle der Insolvenz ein Recht auf vorzugsweise Befriedigung aus einer Deckungsmasse haben, die nach gesetzlicher Vorschrift zu ihrem Schutz errichtet und staatlich überwacht ist."
    },
    {
      "date": "2024-10-28",
      "id": "91829",
      "original_text": "Löschungsankündigung\nSchleswig-Holstein Amtsgericht Lübeck HRB 10714\nBAB Germany GmbH – Bargfeld-Stegen",
      "type": "Löschungsankündigung",
      "state": "Schleswig-Holstein",
      "amtsgericht": "Amtsgericht Lübeck",
      "registernummer": "HRB 10714",
      "registerart": "HRB",
      "company_name": "BAB Germany GmbH",
      "company_seat": "Bargfeld-Stegen",
      "details": "28.10.2024 (Bekanntmachungsdatum)\n\nSchleswig-Holstein Amtsgericht Lübeck HRB 10714\nLöschungsankündigung\n\nBAB Germany GmbH\nGesellschaft mit beschränkter Haftung\nBargfeld-Stegen\n\nEs ist die Löschung der nachstehenden Gesellschaft wegen Vermögenslosigkeit gemäß § 394 FamFG beabsichtigt."
    },
    {
      "date": "2024-10-28",
      "id": "91830",
      "original_text": "Einreichung neuer Dokumente\nBaden-Württemberg Amtsgericht Stuttgart HRB 753447\nPRM Software AG – Rutesheim",
      "type": "Einreichung neuer Dokumente",
      "state": "Baden-Württemberg",
      "amtsgericht": "Amtsgericht Stuttgart",
      "registernummer": "HRB 753447",
      "registerart": "HRB",
      "company_name": "PRM Software AG",
      "company_seat": "Rutesheim",
      "details": "28.10.2024 (Bekanntmachungsdatum)\n\nBaden-Württemberg Amtsgericht Stuttgart HRB 753447\nEinreichung neuer Dokumente\n\nPRM Software AG\nAktiengesellschaft\nRutesheim\n\nDie Gesellschaft hat am 28.10.2024 die Liste über die Zusammensetzung des Aufsichtsrats zum Handelsregister eingereicht."
    },
    {
      "date": "2024-10-28",
      "id": "91831",
      "original_text": "Löschungsankündigung\nBaden-Württemberg Amtsgericht Mannheim HRB 731298\nSWK Verwaltung GmbH – Altlußheim",
      "type": "Löschungsankündigung",
      "state": "Baden-Württemberg",
      "amtsgericht": "Amtsgericht Mannheim",
      "registernummer": "HRB 731298",
      "registerart": "HRB",
      "company_name": "SWK Verwaltung GmbH",
      "company_seat": "Altlußheim",
      "details": "28.10.2024 (Bekanntmachungsdatum)\n\nBaden-Württemberg Amtsgericht Mannheim HRB 731298\nLöschungsankündigung\n\nSWK Verwaltung GmbH\nGesellschaft mit beschränkter Haftung\nAltlußheim\n\nDas Gericht beabsichtigt, die Gesellschaft wegen Vermögenslosigkeit im Handelsregister von Amts wegen nach § 394 FamFG zu löschen. Die Frist zur Geltendmachung eines Widerspruchs gegen die beabsichtigte Löschung ist auf einen Monat ab Veröffentlichung bestimmt."
    },
    {
      "date": "2024-10-28",
      "id": "91832",
      "original_text": "Registerbekanntmachung nach dem Umwandlungsgesetz\nHamburg Amtsgericht Hamburg HRB 165750\nMiral GmbH – Hamburg",
      "type": "Registerbekanntmachung nach dem Umwandlungsgesetz",
      "state": "Hamburg",
      "amtsgericht": "Amtsgericht Hamburg",
      "registernummer": "HRB 165750",
      "registerart": "HRB",
      "company_name": "Miral GmbH",
      "company_seat": "Hamburg",
      "details": "28.10.2024 (Bekanntmachungsdatum)\n\nHamburg Amtsgericht Hamburg HRB 165750\nRegisterbekanntmachung nach dem Umwandlungsgesetz 28.10.2024 (Eintragungsdatum)\n\nMiral GmbH\nGesellschaft mit beschränkter Haftung\nHamburg\n\nAls nicht eingetragen wird bekannt gemacht:\nDen Gläubigern der an der Vermögensübertragung beteiligten Gesellschaft ist, wenn sie binnen sechs Monaten nach dem Tag, an dem die Eintragung der Vermögensübertragung in das Register des Sitzes desjenigen Rechtsträgers, dessen Gläubiger sie sind, nach § 19 Absatz 3 UmwG als bekannt gemacht gilt, ihren Anspruch nach Grund und Höhe schriftlich anmelden, Sicherheit zu leisten, soweit sie nicht Befriedigung verlangen können. Dieses Recht steht den Gläubigern jedoch nur zu, wenn sie glaubhaft machen, dass durch die Vermögensübertragung die Erfüllung ihrer Forderung gefährdet wird."
    },
    {
      "date": "2024-10-28",
      "id": "91833",
      "original_text": "Sonstige Registerbekanntmachung\nSchleswig-Holstein Amtsgericht Flensburg HRB 589 NI\nSchleswiger Versicherungsverein auf Gegenseitigkeit – Emmelsbüll-Horsbüll",
      "type": "Sonstige Registerbekanntmachung",
      "state": "Schleswig-Holstein",
      "amtsgericht": "Amtsgericht Flensburg",
      "registernummer": "HRB 589 NI",
      "registerart": "HRB",
      "company_name": "Schleswiger Versicherungsverein auf Gegenseitigkeit",
      "company_seat": "Emmelsbüll-Horsbüll",
      "details": "28.10.2024 (Bekanntmachungsdatum)\n\nSchleswig-Holstein Amtsgericht Flensburg HRB 589 NI\nSonstige Registerbekanntmachung\n\nSchleswiger Versicherungsverein auf Gegenseitigkeit\nVersicherungsverein auf Gegenseitigkeit\nEmmelsbüll-Horsbüll\n\nAls nicht eingetragen wird veröffentlicht: Neue Aufsichtsratsliste nach Änderung eingereicht am 25.10.2024."
    },
    {
      "date": "2024-10-28",
      "id": "91834",
      "original_text": "Registerbekanntmachung nach dem Umwandlungsgesetz\nSachsen-Anhalt Amtsgericht Stendal HRB 106448\nHeidewasser GmbH – Magdeburg",
      "type": "Registerbekanntmachung nach dem Umwandlungsgesetz",
      "state": "Sachsen-Anhalt",
      "amtsgericht": "Amtsgericht Stendal",
      "registernummer": "HRB 106448",
      "registerart": "HRB",
      "company_name": "Heidewasser GmbH",
      "company_seat": "Magdeburg",
      "details": "28.10.2024 (Bekanntmachungsdatum)\n\nSachsen-Anhalt Amtsgericht Stendal HRB 106448\nRegisterbekanntmachung nach dem Umwandlungsgesetz 23.10.2024 (Eintragungsdatum)\n\nHeidewasser GmbH\nGesellschaft mit beschränkter Haftung\nMagdeburg\n\nNicht eingetragen:\nDen Gläubigern der an der Ausgliederung beteiligten Rechtsträger, ist wenn sie binnen sechs Monaten nach dem Tag, an dem die Eintragung der Ausgliederung nach §§125, 19 Abs. 3 UmwG als bekanntgemacht gilt, ihren Anspruch nach Grund und Höhe schriftlich anmelden, Sicherheit zu leisten, soweit sie nicht Befriedigung verlangen können. Diese Recht steht ihnen jedoch nur zu, wenn sie glaubhaft machen, dass durch die Ausgliederung die Erfüllung ihrer Forderung gefährdet wird.Sie erhalten Gelegenheit zur Nachreichung binnen eines Monats."
    },
    {
      "date": "2024-10-28",
      "id": "91835",
      "original_text": "Einreichung neuer Dokumente\nBaden-Württemberg Amtsgericht Freiburg HRB 3609\nSBG SüdbadenBus GmbH – Freiburg im Breisgau",
      "type": "Einreichung neuer Dokumente",
      "state": "Baden-Württemberg",
      "amtsgericht": "Amtsgericht Freiburg",
      "registernummer": "HRB 3609",
      "registerart": "HRB",
      "company_name": "SBG SüdbadenBus GmbH",
      "company_seat": "Freiburg im Breisgau",
      "details": "28.10.2024 (Bekanntmachungsdatum)\n\nBaden-Württemberg Amtsgericht Freiburg HRB 3609\nEinreichung neuer Dokumente 28.10.2024 (Eintragungsdatum)\n\nSBG SüdbadenBus GmbH\nGesellschaft mit beschränkter Haftung\nFreiburg im Breisgau\n\nDie Gesellschaft hat am 24.10.2024 die Liste über die Zusammensetzung des Aufsichtsrats zum Handelsregister eingereicht."
    },
    {
      "date": "2024-10-28",
      "id": "91836",
      "original_text": "Registerbekanntmachung nach dem Umwandlungsgesetz\nBaden-Württemberg Amtsgericht Ulm HRB 501561\nCarl Zeiss Industrielle Messtechnik GmbH – Oberkochen",
      "type": "Registerbekanntmachung nach dem Umwandlungsgesetz",
      "state": "Baden-Württemberg",
      "amtsgericht": "Amtsgericht Ulm",
      "registernummer": "HRB 501561",
      "registerart": "HRB",
      "company_name": "Carl Zeiss Industrielle Messtechnik GmbH",
      "company_seat": "Oberkochen",
      "details": "28.10.2024 (Bekanntmachungsdatum)\n\nBaden-Württemberg Amtsgericht Ulm HRB 501561\nRegisterbekanntmachung nach dem Umwandlungsgesetz 28.10.2024 (Eintragungsdatum)\n\nCarl Zeiss Industrielle Messtechnik GmbH\nGesellschaft mit beschränkter Haftung\nOberkochen\n\nAls nicht eingetragen wird bekanntgemacht:\nDen Gläubigern der an der Verschmelzung beteiligten Rechtsträger ist, wenn sie binnen sechs Monaten nach dem Tag, an dem die Eintragung der Verschmelzung in das Register des Sitzes desjenigen Rechtsträgers, dessen Gläubiger sie sind, nach § 19 Abs. 3 UmwG als bekanntgemacht gilt, ihren Anspruch nach Grund und Höhe schriftlich anmelden, Sicherheit zu leisten, soweit sie nicht Befriedigung verlangen können. Dieses Recht steht den Gläubigern jedoch nur zu, wenn sie glaubhaft machen, dass durch die Verschmelzung die Erfüllung ihrer Forderung gefährdet wird."
    },
    {
      "date": "2024-10-28",
      "id": "91837",
      "original_text": "Registerbekanntmachung nach dem Umwandlungsgesetz\nBaden-Württemberg Amtsgericht Mannheim HRA 711831\nDÜRR Metall & Kunststofftechnik e. K. – Karlsbad",
      "type": "Registerbekanntmachung nach dem Umwandlungsgesetz",
      "state": "Baden-Württemberg",
      "amtsgericht": "Amtsgericht Mannheim",
      "registernummer": "HRA 711831",
      "registerart": "HRA",
      "company_name": "DÜRR Metall & Kunststofftechnik e. K.",
      "company_seat": "Karlsbad",
      "details": "28.10.2024 (Bekanntmachungsdatum)\n\nBaden-Württemberg Amtsgericht Mannheim HRA 711831\nRegisterbekanntmachung nach dem Umwandlungsgesetz 28.10.2024 (Eintragungsdatum)\n\nDÜRR Metall & Kunststofftechnik e. K.\nEinzelkaufmann / Einzelkauffrau\nKarlsbad\n\nAls nicht eingetragen wird bekanntgemacht:\nDen Gläubigern der an der Ausgliederung beteiligten Rechtsträger ist, wenn sie binnen sechs Monaten nach dem Tag, an dem die Eintragung der Ausgliederung in das Register des Sitzes desjenigen Rechtsträgers, dessen Gläubiger sie sind, nach § 19 Abs. 3 UmwG als bekanntgemacht gilt, ihren Anspruch nach Grund und Höhe schriftlich anmelden, Sicherheit zu leisten, soweit sie nicht Befriedigung verlangen können. Dieses Recht steht den Gläubigern jedoch nur zu, wenn sie glaubhaft machen, dass durch die Ausgliederung die Erfüllung ihrer Forderung gefährdet wird."
    },
    {
      "date": "2024-10-28",
      "id": "91838",
      "original_text": "Registerbekanntmachung nach dem Umwandlungsgesetz\nBaden-Württemberg Amtsgericht Mannheim HRA 712140\nDÜRR Metall Vertriebs GmbH & Co. KG – Karlsbad",
      "type": "Registerbekanntmachung nach dem Umwandlungsgesetz",
      "state": "Baden-Württemberg",
      "amtsgericht": "Amtsgericht Mannheim",
      "registernummer": "HRA 712140",
      "registerart": "HRA",
      "company_name": "DÜRR Metall Vertriebs GmbH & Co. KG",
      "company_seat": "Karlsbad",
      "details": "28.10.2024 (Bekanntmachungsdatum)\n\nBaden-Württemberg Amtsgericht Mannheim HRA 712140\nRegisterbekanntmachung nach dem Umwandlungsgesetz 28.10.2024 (Eintragungsdatum)\n\nDÜRR Metall Vertriebs GmbH & Co. KG\nKommanditgesellschaft\nKarlsbad\n\nDen Gläubigern der an der Ausgliederung beteiligten Rechtsträger ist, wenn sie binnen sechs Monaten nach dem Tag, an dem die Eintragung der Ausgliederung in das Register des Sitzes desjenigen Rechtsträgers, dessen Gläubiger sie sind, nach § 19 Abs. 3 UmwG als bekanntgemacht gilt, ihren Anspruch nach Grund und Höhe schriftlich anmelden, Sicherheit zu leisten, soweit sie nicht Befriedigung verlangen können. Dieses Recht steht den Gläubigern jedoch nur zu, wenn sie glaubhaft machen, dass durch die Ausgliederung die Erfüllung ihrer Forderung gefährdet wird."
    },
    {
      "date": "2024-10-28",
      "id": "91839",
      "original_text": "Registerbekanntmachung nach dem Umwandlungsgesetz\nBrandenburg Amtsgericht Neuruppin HRA 3634\nMartin Appetz e.K. – Angermünde OT Bölkendorf",
      "type": "Registerbekanntmachung nach dem Umwandlungsgesetz",
      "state": "Brandenburg",
      "amtsgericht": "Amtsgericht Neuruppin",
      "registernummer": "HRA 3634",
      "registerart": "HRA",
      "company_name": "Martin Appetz e.K.",
      "company_seat": "Angermünde OT Bölkendorf",
      "details": "28.10.2024 (Bekanntmachungsdatum)\n\nBrandenburg Amtsgericht Neuruppin HRA 3634\nRegisterbekanntmachung nach dem Umwandlungsgesetz 28.10.2024 (Eintragungsdatum)\n\nMartin Appetz e.K.\nEinzelkaufmann / Einzelkauffrau\nAngermünde OT Bölkendorf\n\nZu Eintragungsnummer 2 vom 28.10.2024 wird als nicht eingetragen veröffentlicht:\nDen Gläubigern der an der Umwandlung beteiligten Rechtsträger ist, wenn sie binnen sechs Monaten nach dem Tag, an dem die Eintragung der Umwandlung in das Register des Sitzes desjenigen Rechtsträgers, dessen Gläubiger sie sind, als bekannt gemacht gilt, ihren Anspruch nach Grund und Höhe schriftlich anmelden, Sicherheit zu leisten, soweit sie nicht Befriedigung verlangen können. Dieses Recht steht den Gläubigern jedoch nur zu, wenn sie glaubhaft machen, dass durch die Umwandlung die Erfüllung ihrer Forderung gefährdet wird"
    },
    {
      "date": "2024-10-28",
      "id": "91840",
      "original_text": "Löschungsankündigung\nBaden-Württemberg Amtsgericht Freiburg HRB 725250\nBodea Immobilien GmbH – Bad Säckingen",
      "type": "Löschungsankündigung",
      "state": "Baden-Württemberg",
      "amtsgericht": "Amtsgericht Freiburg",
      "registernummer": "HRB 725250",
      "registerart": "HRB",
      "company_name": "Bodea Immobilien GmbH",
      "company_seat": "Bad Säckingen",
      "details": "28.10.2024 (Bekanntmachungsdatum)\n\nBaden-Württemberg Amtsgericht Freiburg HRB 725250\nLöschungsankündigung\n\nBodea Immobilien GmbH\nGesellschaft mit beschränkter Haftung\nBad Säckingen\n\nAls nicht eingetragen wird bekanntgemacht:\nDas Gericht beabsichtigt, die Gesellschaft wegen Vermögenslosigkeit im Handelsregister von Amts wegen nach § 394 FamFG zu löschen. Die Frist zur Geltendmachung eines Widerspruchs gegen die beabsichtigte Löschung ist auf einen Monat ab Veröffentlichung bestimmt."
    },
    {
      "date": "2024-10-28",
      "id": "91841",
      "original_text": "Registerbekanntmachung nach dem Umwandlungsgesetz\nSchleswig-Holstein Amtsgericht Flensburg HRB 6975\nMPG Optische Werke GmbH – Glücksburg",
      "type": "Registerbekanntmachung nach dem Umwandlungsgesetz",
      "state": "Schleswig-Holstein",
      "amtsgericht": "Amtsgericht Flensburg",
      "registernummer": "HRB 6975",
      "registerart": "HRB",
      "company_name": "MPG Optische Werke GmbH",
      "company_seat": "Glücksburg",
      "details": "28.10.2024 (Bekanntmachungsdatum)\n\nSchleswig-Holstein Amtsgericht Flensburg HRB 6975\nRegisterbekanntmachung nach dem Umwandlungsgesetz 28.10.2024 (Eintragungsdatum)\n\nMPG Optische Werke GmbH\nGesellschaft mit beschränkter Haftung\nGlücksburg\n\nZu Eintragungsnummer 15 vom 28.10.2024 wird als nicht eingetragen veröffentlicht: Den Gläubigern des an der grenzüberschreitenden Verschmelzung beteiligten übernehmenden Rechtsträgers (übernehmender Rechtsträger: MPG Optische Werke GmbH) ist, wenn sie binnen sechs Monaten nach dem Tag, an dem die Eintragung der grenzüberschreitenden Verschmelzung in das Register des Sitzes des übernehmenden Rechtsträgers, dessen Gläubiger sie sind, als bekannt gemacht gilt, ihren Anspruch nach Grund und Höhe schriftlich anmelden, Sicherheit zu leisten, soweit sie nicht Befriedigung verlangen können. Dieses Recht steht den Gläubigern jedoch nur zu, wenn sie glaubhaft machen, dass durch die Verschmelzung die Erfüllung ihrer Forderung gefährdet wird."
    },
    {
      "date": "2024-10-28",
      "id": "91842",
      "original_text": "Einreichung neuer Dokumente\nBaden-Württemberg Amtsgericht Ulm HRB 1268\nUlmer Wohnungs- und Siedlungs-Gesellschaft mit beschränkter Haftung. – Ulm",
      "type": "Einreichung neuer Dokumente",
      "state": "Baden-Württemberg",
      "amtsgericht": "Amtsgericht Ulm",
      "registernummer": "HRB 1268",
      "registerart": "HRB",
      "company_name": "Ulmer Wohnungs- und Siedlungs-Gesellschaft mit beschränkter Haftung.",
      "company_seat": "Ulm",
      "details": "28.10.2024 (Bekanntmachungsdatum)\n\nBaden-Württemberg Amtsgericht Ulm HRB 1268\nEinreichung neuer Dokumente\n\nUlmer Wohnungs- und Siedlungs-Gesellschaft mit beschränkter Haftung.\nGesellschaft mit beschränkter Haftung\nUlm\n\nDie Gesellschaft hat am 28.10.2024 die Liste über die Zusammensetzung des Aufsichtsrats zum Handelsregister eingereicht."
    },
    {
      "date": "2024-10-28",
      "id": "91843",
      "original_text": "Einreichung neuer Dokumente\nMecklenburg-Vorpommern Amtsgericht Neubrandenburg HRB 6654\nMüritzeum gGmbH – Waren (Müritz)",
      "type": "Einreichung neuer Dokumente",
      "state": "Mecklenburg-Vorpommern",
      "amtsgericht": "Amtsgericht Neubrandenburg",
      "registernummer": "HRB 6654",
      "registerart": "HRB",
      "company_name": "Müritzeum gGmbH",
      "company_seat": "Waren (Müritz)",
      "details": "28.10.2024 (Bekanntmachungsdatum)\n\nMecklenburg-Vorpommern Amtsgericht Neubrandenburg HRB 6654\nEinreichung neuer Dokumente 08.10.2024 (Eintragungsdatum)\n\nMüritzeum gGmbH\nGesellschaft mit beschränkter Haftung\nWaren (Müritz)\n\nEine Liste der Mitglieder des Aufsichtsrats ist zum Handelsregister eingereicht worden."
    },
    {
      "date": "2024-10-28",
      "id": "91844",
      "original_text": "Registerbekanntmachung nach dem Umwandlungsgesetz\nNordrhein-Westfalen Amtsgericht Coesfeld HRA 7403\nWiegert Besitzgesellschaft GmbH & Co. KG – Velen",
      "type": "Registerbekanntmachung nach dem Umwandlungsgesetz",
      "state": "Nordrhein-Westfalen",
      "amtsgericht": "Amtsgericht Coesfeld",
      "registernummer": "HRA 7403",
      "registerart": "HRA",
      "company_name": "Wiegert Besitzgesellschaft GmbH & Co. KG",
      "company_seat": "Velen",
      "details": "28.10.2024 (Bekanntmachungsdatum)\n\nNordrhein-Westfalen Amtsgericht Coesfeld HRA 7403\nRegisterbekanntmachung nach dem Umwandlungsgesetz 28.10.2024 (Eintragungsdatum)\n\nWiegert Besitzgesellschaft GmbH & Co. KG\nKommanditgesellschaft\nVelen\n\nDen Gläubigern der an der Verschmelzung beteiligten Rechtsträger ist, wenn sie binnen sechs Monaten nach dem Tag, an dem die Eintragung der Verschmelzung in das Register des Sitzes desjenigen Rechtsträgers, dessen Gläubiger sie sind, nach § 19 Absatz 3 UmwG als bekanntgemacht gilt, ihren Anspruch nach Grund und Höhe schriftlich anmelden, Sicherheit zu leisten, soweit sie nicht Befriedigung verlangen können. Dieses Recht steht den Gläubigern jedoch nur zu, wenn sie glaubhaft machen, dass durch die Verschmelzung die Erfüllung ihrer Forderung gefährdet wird."
    },
    {
      "date": "2024-10-28",
      "id": "91845",
      "original_text": "Registerbekanntmachung nach dem Umwandlungsgesetz\nNordrhein-Westfalen Amtsgericht Coesfeld HRA 7693\nMolkerei Wiegert GmbH & Co. KG – Velen",
      "type": "Registerbekanntmachung nach dem Umwandlungsgesetz",
      "state": "Nordrhein-Westfalen",
      "amtsgericht": "Amtsgericht Coesfeld",
      "registernummer": "HRA 7693",
      "registerart": "HRA",
      "company_name": "Molkerei Wiegert GmbH & Co. KG",
      "company_seat": "Velen",
      "details": "28.10.2024 (Bekanntmachungsdatum)\n\nNordrhein-Westfalen Amtsgericht Coesfeld HRA 7693\nRegisterbekanntmachung nach dem Umwandlungsgesetz 28.10.2024 (Eintragungsdatum)\n\nMolkerei Wiegert GmbH & Co. KG\nKommanditgesellschaft\nVelen\n\nDen Gläubigern der an der Verschmelzung beteiligten Rechtsträger ist, wenn sie binnen sechs Monaten nach dem Tag, an dem die Eintragung der Verschmelzung in das Register des Sitzes desjenigen Rechtsträgers, dessen Gläubiger sie sind, nach § 19 Absatz 3 UmwG als bekanntgemacht gilt, ihren Anspruch nach Grund und Höhe schriftlich anmelden, Sicherheit zu leisten, soweit sie nicht Befriedigung verlangen können. Dieses Recht steht den Gläubigern jedoch nur zu, wenn sie glaubhaft machen, dass durch die Verschmelzung die Erfüllung ihrer Forderung gefährdet wird."
    },
    {
      "date": "2024-10-28",
      "id": "91846",
      "original_text": "Löschungsankündigung\nSachsen Amtsgericht Dresden HRB 32356\nXylerynos Trade GmbH – Dresden",
      "type": "Löschungsankündigung",
      "state": "Sachsen",
      "amtsgericht": "Amtsgericht Dresden",
      "registernummer": "HRB 32356",
      "registerart": "HRB",
      "company_name": "Xylerynos Trade GmbH",
      "company_seat": "Dresden",
      "details": "28.10.2024 (Bekanntmachungsdatum)\n\nSachsen Amtsgericht Dresden HRB 32356\nLöschungsankündigung\n\nXylerynos Trade GmbH\nGesellschaft mit beschränkter Haftung\nDresden\n\nDas Registergericht beabsichtigt, die im Handelsregister eingetragene Gesellschaft von Amts wegen nach § 394 FamFG zu löschen. Die Frist zu Erhebung eines Widerspruchs gegen die beabsichtigte Löschung wird auf einen Monat festgesetzt."
    },
    {
      "date": "2024-10-28",
      "id": "91847",
      "original_text": "Löschungsankündigung\nSachsen Amtsgericht Leipzig VR 2041\nGaragengemeinschaft \"An der Tankstelle\" e.V. – Wiederitzsch",
      "type": "Löschungsankündigung",
      "state": "Sachsen",
      "amtsgericht": "Amtsgericht Leipzig",
      "registernummer": "VR 2041",
      "registerart": "VR",
      "company_name": "Garagengemeinschaft \"An der Tankstelle\" e.V.",
      "company_seat": "Wiederitzsch",
      "details": "28.10.2024 (Bekanntmachungsdatum)\n\nSachsen Amtsgericht Leipzig VR 2041\nLöschungsankündigung\n\nGaragengemeinschaft \"An der Tankstelle\" e.V.\neingetragener Verein\nWiederitzsch\n\nDas Gericht beabsichtigt, gemäß § 4 Absatz 2 Ziffer 1 der Verordnung über das Vereinsregister das Registerblatt  des Vereins zu schließen, da nach den Ermittlungen des Gerichts sämtliche Mitglieder aus dem Verein ausgeschieden sind. Zur Geltendmachung eines Widerspruchs gegen die beabsichtigte Schließung wird eine Frist von einem Monat nach der Veröffentlichung bestimmt."
    },
    {
      "date": "2024-10-28",
      "id": "91848",
      "original_text": "Löschungsankündigung\nSachsen Amtsgericht Dresden HRB 34165\nMetapriori GmbH – Dresden",
      "type": "Löschungsankündigung",
      "state": "Sachsen",
      "amtsgericht": "Amtsgericht Dresden",
      "registernummer": "HRB 34165",
      "registerart": "HRB",
      "company_name": "Metapriori GmbH",
      "company_seat": "Dresden",
      "details": "28.10.2024 (Bekanntmachungsdatum)\n\nSachsen Amtsgericht Dresden HRB 34165\nLöschungsankündigung\n\nMetapriori GmbH\nGesellschaft mit beschränkter Haftung\nDresden\n\nDas Registergericht beabsichtigt, die im Handelsregister eingetragene Gesellschaft von Amts wegen nach § 394 FamFG zu löschen. Die Frist zu Erhebung eines Widerspruchs gegen die beabsichtigte Löschung wird auf einen Monat festgesetzt."
    },
    {
      "date": "2024-10-28",
      "id": "91849",
      "original_text": "Löschungsankündigung\nSachsen Amtsgericht Dresden HRB 32365\nCedrus Hausbau GmbH – Görlitz",
      "type": "Löschungsankündigung",
      "state": "Sachsen",
      "amtsgericht": "Amtsgericht Dresden",
      "registernummer": "HRB 32365",
      "registerart": "HRB",
      "company_name": "Cedrus Hausbau GmbH",
      "company_seat": "Görlitz",
      "details": "28.10.2024 (Bekanntmachungsdatum)\n\nSachsen Amtsgericht Dresden HRB 32365\nLöschungsankündigung\n\nCedrus Hausbau GmbH\nGesellschaft mit beschränkter Haftung\nGörlitz\n\nDas Registergericht beabsichtigt, die im Handelsregister eingetragene Gesellschaft von Amts wegen nach § 394 FamFG zu löschen. Die Frist zu Erhebung eines Widerspruchs gegen die beabsichtigte Löschung wird auf einen Monat festgesetzt."
    },
    {
      "date": "2024-10-28",
      "id": "91850",
      "original_text": "Sonstige Registerbekanntmachung\nSachsen Amtsgericht Leipzig HRB 10001\nWohnungsgesellschaft der Stadt Delitzsch mbH – Delitzsch",
      "type": "Sonstige Registerbekanntmachung",
      "state": "Sachsen",
      "amtsgericht": "Amtsgericht Leipzig",
      "registernummer": "HRB 10001",
      "registerart": "HRB",
      "company_name": "Wohnungsgesellschaft der Stadt Delitzsch mbH",
      "company_seat": "Delitzsch",
      "details": "28.10.2024 (Bekanntmachungsdatum)\n\nSachsen Amtsgericht Leipzig HRB 10001\nSonstige Registerbekanntmachung\n\nWohnungsgesellschaft der Stadt Delitzsch mbH\nGesellschaft mit beschränkter Haftung\nDelitzsch\n\nAm 24.10.2024 wurde beim Handelsregister des Amtsgerichts Leipzig die Liste der Mitglieder des Aufsichtsrats gemäß § 52 GmbHG eingereicht."
    },
    {
      "date": "2024-10-28",
      "id": "91851",
      "original_text": "Einreichung neuer Dokumente\nSachsen Amtsgericht Dresden HRB 2246\nStadtwerke Görlitz Aktiengesellschaft – Görlitz",
      "type": "Einreichung neuer Dokumente",
      "state": "Sachsen",
      "amtsgericht": "Amtsgericht Dresden",
      "registernummer": "HRB 2246",
      "registerart": "HRB",
      "company_name": "Stadtwerke Görlitz Aktiengesellschaft",
      "company_seat": "Görlitz",
      "details": "28.10.2024 (Bekanntmachungsdatum)\n\nSachsen Amtsgericht Dresden HRB 2246\nEinreichung neuer Dokumente\n\nStadtwerke Görlitz Aktiengesellschaft\nAktiengesellschaft\nGörlitz\n\nAm 25.10.2024 wurde beim Handelsregister des Amtsgerichts Dresden die Liste der Mitglieder des Aufsichtsrats gemäß § 106 AktG eingereicht."
    },
    {
      "date": "2024-10-28",
      "id": "91852",
      "original_text": "Registerbekanntmachung nach dem Umwandlungsgesetz\nNiedersachsen Amtsgericht Osnabrück HRA 208353\nAlpha Paletten & Boxen e.K. – Wilsum",
      "type": "Registerbekanntmachung nach dem Umwandlungsgesetz",
      "state": "Niedersachsen",
      "amtsgericht": "Amtsgericht Osnabrück",
      "registernummer": "HRA 208353",
      "registerart": "HRA",
      "company_name": "Alpha Paletten & Boxen e.K.",
      "company_seat": "Wilsum",
      "details": "28.10.2024 (Bekanntmachungsdatum)\n\nNiedersachsen Amtsgericht Osnabrück HRA 208353\nRegisterbekanntmachung nach dem Umwandlungsgesetz 28.10.2024 (Eintragungsdatum)\n\nAlpha Paletten & Boxen e.K.\nEinzelkaufmann / Einzelkauffrau\nWilsum\n\nDen Gläubigern der an der Ausgliederung beteiligten Rechtsträger ist, wenn sie binnen sechs Monaten nach dem Tag, an dem die Eintragung der Ausgliederung in das Register des Sitzes desjenigen Rechtsträgers, dessen Gläubiger sie sind, nach § 19 Abs. 3 UmwG als bekannt gemacht gilt, ihren Anspruch nach Grund und Höhe schriftlich anmelden, Sicherheit zu leisten, soweit sie nicht Befriedigung verlangen können. Dieses Recht steht den Gläubigern jedoch nur zu, wenn sie glaubhaft machen, dass durch die Ausgliederung die Erfüllung der Forderung gefährdet wird."
    },
    {
      "date": "2024-10-28",
      "id": "91853",
      "original_text": "Registerbekanntmachung nach dem Umwandlungsgesetz\nNiedersachsen Amtsgericht Osnabrück HRB 18165\nSalzgitter Automotive Engineering Immobilien Verwaltungsgesellschaft mit beschränkter Haftung – Osnabrück",
      "type": "Registerbekanntmachung nach dem Umwandlungsgesetz",
      "state": "Niedersachsen",
      "amtsgericht": "Amtsgericht Osnabrück",
      "registernummer": "HRB 18165",
      "registerart": "HRB",
      "company_name": "Salzgitter Automotive Engineering Immobilien Verwaltungsgesellschaft mit beschränkter Haftung",
      "company_seat": "Osnabrück",
      "details": "28.10.2024 (Bekanntmachungsdatum)\n\nNiedersachsen Amtsgericht Osnabrück HRB 18165\nRegisterbekanntmachung nach dem Umwandlungsgesetz 28.10.2024 (Eintragungsdatum)\n\nSalzgitter Automotive Engineering Immobilien Verwaltungsgesellschaft mit beschränkter Haftung\nGesellschaft mit beschränkter Haftung\nOsnabrück\n\nDen Gläubigern der an der Verschmelzung beteiligten Rechtsträger ist, wenn sie binnen sechs Monaten nach dem Tag, an dem die Eintragung der Verschmelzung in das Register des Sitzes desjenigen Rechtsträgers, dessen Gläubiger sie sind, nach § 19  Abs.  3 UmwG als bekannt gemacht gilt, ihren Anspruch nach Grund und Höhe schriftlich anmelden, Sicherheit zu leisten, soweit sie nicht Befriedigung verlangen können. Dieses Recht steht den Gläubigern jedoch nur zu, wenn sie glaubhaft machen, dass durch die Verschmelzung die Erfüllung der Forderung gefährdet wird."
    },
    {
      "date": "2024-10-28",
      "id": "91854",
      "original_text": "Löschungsankündigung\nNiedersachsen Amtsgericht Hannover HRB 201188\nStrohdach Verwaltungsges. mbH – Langenhagen",
      "type": "Löschungsankündigung",
      "state": "Niedersachsen",
      "amtsgericht": "Amtsgericht Hannover",
      "registernummer": "HRB 201188",
      "registerart": "HRB",
      "company_name": "Strohdach Verwaltungsges. mbH",
      "company_seat": "Langenhagen",
      "details": "28.10.2024 (Bekanntmachungsdatum)\n\nNiedersachsen Amtsgericht Hannover HRB 201188\nLöschungsankündigung 28.10.2024 (Eintragungsdatum)\n\nStrohdach Verwaltungsges. mbH\nGesellschaft mit beschränkter Haftung\nLangenhagen\n\nDas Registergericht beabsichtigt, die Gesellschaft von Amts wegen nach § 394 Abs. 1 FamFG zu löschen. Die Frist zur Erhebung eines Widerspruchs ist auf 1 Monat ab dieser Registerbekanntmachung festgesetzt."
    },
    {
      "date": "2024-10-28",
      "id": "91855",
      "original_text": "Löschungsankündigung\nNiedersachsen Amtsgericht Lüneburg HRB 200162\nKleopatra GmbH – Celle",
      "type": "Löschungsankündigung",
      "state": "Niedersachsen",
      "amtsgericht": "Amtsgericht Lüneburg",
      "registernummer": "HRB 200162",
      "registerart": "HRB",
      "company_name": "Kleopatra GmbH",
      "company_seat": "Celle",
      "details": "28.10.2024 (Bekanntmachungsdatum)\n\nNiedersachsen Amtsgericht Lüneburg HRB 200162\nLöschungsankündigung\n\nKleopatra GmbH\nGesellschaft mit beschränkter Haftung\nCelle\n\nDas Registergericht beabsichtigt, die Gesellschaft von Amts wegen nach § 394 FamFG zu löschen. Die Frist zur Erhebung eines Widerspruchs ist auf 2 Monate ab dieser Registerbekanntmachung festgesetzt."
    },
    {
      "date": "2024-10-28",
      "id": "91856",
      "original_text": "Löschungsankündigung\nNiedersachsen Amtsgericht Aurich HRB 203128\nHaustechnik Backer GmbH – Esens",
      "type": "Löschungsankündigung",
      "state": "Niedersachsen",
      "amtsgericht": "Amtsgericht Aurich",
      "registernummer": "HRB 203128",
      "registerart": "HRB",
      "company_name": "Haustechnik Backer GmbH",
      "company_seat": "Esens",
      "details": "28.10.2024 (Bekanntmachungsdatum)\n\nNiedersachsen Amtsgericht Aurich HRB 203128\nLöschungsankündigung\n\nHaustechnik Backer GmbH\nGesellschaft mit beschränkter Haftung\nEsens\n\nDas Registergericht beabsichtigt, die Gesellschaft von Amts wegen nach § 394 FamFG zu löschen. Die Frist zur Erhebung eines Widerspruchs ist auf 1 Monat ab dieser Registerbekanntmachung festgesetzt."
    },
    {
      "date": "2024-10-28",
      "id": "91857",
      "original_text": "Löschungsankündigung\nNiedersachsen Amtsgericht Osnabrück VR 130210\nUnabhängiges Jugend- und Kulturzentrum Samtgemeinde Uelsen e.V. – Uelsen",
      "type": "Löschungsankündigung",
      "state": "Niedersachsen",
      "amtsgericht": "Amtsgericht Osnabrück",
      "registernummer": "VR 130210",
      "registerart": "VR",
      "company_name": "Unabhängiges Jugend- und Kulturzentrum Samtgemeinde Uelsen e.V.",
      "company_seat": "Uelsen",
      "details": "28.10.2024 (Bekanntmachungsdatum)\n\nNiedersachsen Amtsgericht Osnabrück VR 130210\nLöschungsankündigung\n\nUnabhängiges Jugend- und Kulturzentrum Samtgemeinde Uelsen e.V.\neingetragener Verein\nUelsen\n\nDas Registergericht beabsichtigt, den Verein von Amts wegen nach § 395 FamFG aufgrund Wegfalls sämtlicher Mitglieder zu löschen. Die Frist zur Erhebung eines Widerspruchs ist auf 1 Monat ab dieser Registerbekanntmachung festgesetzt."
    },
    {
      "date": "2024-10-28",
      "id": "91858",
      "original_text": "Registerbekanntmachung nach dem Umwandlungsgesetz\nRheinland-Pfalz Amtsgericht Ludwigshafen a.Rhein (Ludwigshafen) HRB 69623\nCanisAlpha GmbH – Bad Dürkheim",
      "type": "Registerbekanntmachung nach dem Umwandlungsgesetz",
      "state": "Rheinland-Pfalz",
      "amtsgericht": "Amtsgericht Ludwigshafen a.Rhein (Ludwigshafen)",
      "registernummer": "HRB 69623",
      "registerart": "HRB",
      "company_name": "CanisAlpha GmbH",
      "company_seat": "Bad Dürkheim",
      "details": "28.10.2024 (Bekanntmachungsdatum)\n\nRheinland-Pfalz Amtsgericht Ludwigshafen a.Rhein (Ludwigshafen) HRB 69623\nRegisterbekanntmachung nach dem Umwandlungsgesetz 28.10.2024 (Eintragungsdatum)\n\nCanisAlpha GmbH\nGesellschaft mit beschränkter Haftung\nBad Dürkheim\n\nAls nicht eingetragen wird veröffentlicht: Den Gläubigern der an der Ausgliederung beteiligten Rechtsträger ist, wenn sie binnen sechs Monaten nach dem Tag, an dem die Eintragung der Ausgliederung in das Register des Sitzes desjenigen Rechtsträgers,dessen Gläubiger sie sind, nach § 19 Abs. 3 UmwG als bekannt gemacht gilt, ihren Anspruch nach Grund und Höhe schriftlich anmelden, Sicherheit zu leisten, soweit sie nicht Befriedigung verlangen können. Dieses Recht steht den Gläubigern jedoch nur zu, wenn sie glaubhaft machen, dass durch die Ausgliederung die Erfüllung der Forderung gefährdet wird."
    },
    {
      "date": "2024-10-28",
      "id": "91859",
      "original_text": "Registerbekanntmachung nach dem Umwandlungsgesetz\nRheinland-Pfalz Amtsgericht Ludwigshafen a.Rhein (Ludwigshafen) HRA 62321\nAnja Willnauer e. K. – Bad Dürkheim",
      "type": "Registerbekanntmachung nach dem Umwandlungsgesetz",
      "state": "Rheinland-Pfalz",
      "amtsgericht": "Amtsgericht Ludwigshafen a.Rhein (Ludwigshafen)",
      "registernummer": "HRA 62321",
      "registerart": "HRA",
      "company_name": "Anja Willnauer e. K.",
      "company_seat": "Bad Dürkheim",
      "details": "28.10.2024 (Bekanntmachungsdatum)\n\nRheinland-Pfalz Amtsgericht Ludwigshafen a.Rhein (Ludwigshafen) HRA 62321\nRegisterbekanntmachung nach dem Umwandlungsgesetz 28.10.2024 (Eintragungsdatum)\n\nAnja Willnauer e. K.\nEinzelkaufmann / Einzelkauffrau\nBad Dürkheim\n\nAls nicht eingetragen wird veröffentlicht: Den Gläubigern der an der Ausgliederung beteiligten Rechtsträger ist, wenn sie binnen sechs Monaten nach dem Tag, an dem die Eintragung der Ausgliederung in das Register des Sitzes desjenigen Rechtsträgers,dessen Gläubiger sie sind, nach § 19 Abs. 3 UmwG als bekannt gemacht gilt, ihren Anspruch nach Grund und Höhe schriftlich anmelden, Sicherheit zu leisten, soweit sie nicht Befriedigung verlangen können. Dieses Recht steht den Gläubigern jedoch nur zu, wenn sie glaubhaft machen, dass durch die Ausgliederung die Erfüllung der Forderung gefährdet wird."
    },
    {
      "date": "2024-10-28",
      "id": "91860",
      "original_text": "Einreichung neuer Dokumente\nNordrhein-Westfalen Amtsgericht Köln HRB 31597\nMalteser Deutschland gemeinnützige GmbH – Köln",
      "type": "Einreichung neuer Dokumente",
      "state": "Nordrhein-Westfalen",
      "amtsgericht": "Amtsgericht Köln",
      "registernummer": "HRB 31597",
      "registerart": "HRB",
      "company_name": "Malteser Deutschland gemeinnützige GmbH",
      "company_seat": "Köln",
      "details": "28.10.2024 (Bekanntmachungsdatum)\n\nNordrhein-Westfalen Amtsgericht Köln HRB 31597\nEinreichung neuer Dokumente\n\nMalteser Deutschland gemeinnützige GmbH\nGesellschaft mit beschränkter Haftung\nKöln\n\nDem Registergericht ist eine Liste der Mitglieder des Aufsichtsrates eingereicht worden."
    },
    {
      "date": "2024-10-28",
      "id": "91861",
      "original_text": "Löschungsankündigung\nNordrhein-Westfalen Amtsgericht Aachen HRB 25024\nBT Express UG (haftungsbeschränkt) – Aachen",
      "type": "Löschungsankündigung",
      "state": "Nordrhein-Westfalen",
      "amtsgericht": "Amtsgericht Aachen",
      "registernummer": "HRB 25024",
      "registerart": "HRB",
      "company_name": "BT Express UG (haftungsbeschränkt)",
      "company_seat": "Aachen",
      "details": "28.10.2024 (Bekanntmachungsdatum)\n\nNordrhein-Westfalen Amtsgericht Aachen HRB 25024\nLöschungsankündigung\n\nBT Express UG (haftungsbeschränkt)\nGesellschaft mit beschränkter Haftung\nAachen\n\nDas Registergericht beabsichtigt, von Amts wegen die Gesellschaft wegen Vermögenslosigkeit nach § 394 FamFG zu löschen weil das Finanzamt mit Schreiben vom 23.09.2024 Umstände mitgeteilt hat, aufgrund derer das Gericht davon überzeugt ist, dass die Gesellschaft vollständig vermögenslos ist.\n\nZur Geltendmachung des Widerspruchs gegen die beabsichtigte Löschung wird hiermit eine Frist von einem Monat ab Veröffentlichung dieser Ankündigung bestimmt.\n\nRechtsbehelfsbelehrung:\n\nGegen diese Verfügung kann Widerspruch eingelegt werden. Zum Widerspruch ist jeder berechtigt, der an der Unterlassung der Löschung ein berechtigtes Interesse hat.\n\nDer Widerspruch ist bei dem Amtsgericht Aachen, Adalbertsteinweg 92, 52070 Aachen schriftlich in deutscher Sprache oder zur Niederschrift der Geschäftsstelle einzulegen. Der Widerspruch kann auch zur Niederschrift der Geschäftsstelle eines jeden Amtsgerichtes abgegeben werden.\n\nDer Widerspruch muss spätestens innerhalb der gesetzten Frist nach der Bekanntgabe der Verfügung bei dem Amtsgericht Aachen eingegangen sein. Dies gilt auch dann, wenn der Widerspruch zur Niederschrift der Geschäftsstelle eines anderen Amtsgerichtes abgegeben wurde. Die Frist beginnt mit der Bekanntgabe der Verfügung durch Veröffentlichung. Fällt das Ende der Frist auf einen Sonntag, einen allgemeinen Feiertag oder Sonnabend, so endet die Frist mit Ablauf des nächsten Werktages.\n\nDer Widerspruch muss die Bezeichnung der angefochtenen Verfügung sowie die Erklärung enthalten, dass Widerspruch gegen diese Verfügung eingelegt wird. Er ist zu unterzeichnen und soll begründet werden.\n\nDie Einlegung ist auch durch Übertragung eines elektronischen Dokuments an die elektronische Poststelle des Gerichts möglich. Das elektronische Dokument muss für die Bearbeitung durch das Gericht geeignet und mit einer qualifizierten elektronischen Signatur der verantwortenden Person versehen sein oder von der verantwortenden Person signiert und auf einem sicheren Übermittlungsweg gemäß § 130 a ZPO nach näherer Maßgabe der Verordnung über die technischen Rahmenbedingungen des elektronischen Rechtsverkehrs und über das besondere elektronische Behördenpostfach (BGBl. I, S. 3803) eingereicht werden. Weitere Informationen erhalten Sie auf der Internetseite www.justiz.de."
    },
    {
      "date": "2024-10-28",
      "id": "91862",
      "original_text": "Sonstige Registerbekanntmachung\nNordrhein-Westfalen Amtsgericht Düsseldorf HRB 87856\nGerman Aesthetic GmbH – Düsseldorf",
      "type": "Sonstige Registerbekanntmachung",
      "state": "Nordrhein-Westfalen",
      "amtsgericht": "Amtsgericht Düsseldorf",
      "registernummer": "HRB 87856",
      "registerart": "HRB",
      "company_name": "German Aesthetic GmbH",
      "company_seat": "Düsseldorf",
      "details": "28.10.2024 (Bekanntmachungsdatum)\n\nNordrhein-Westfalen Amtsgericht Düsseldorf HRB 87856\nSonstige Registerbekanntmachung 28.10.2024 (Eintragungsdatum)\n\nGerman Aesthetic GmbH\nGesellschaft mit beschränkter Haftung\nDüsseldorf\n\nDie Gesellschaft ist aufgelöst. Von Amts wegen eingetragen."
    },
    {
      "date": "2024-10-28",
      "id": "91863",
      "original_text": "Löschungsankündigung\nBremen Amtsgericht Bremen HRB 2045 BHV\nHeise Schiffsreparatur und Industrie Service GmbH – Bremerhaven",
      "type": "Löschungsankündigung",
      "state": "Bremen",
      "amtsgericht": "Amtsgericht Bremen",
      "registernummer": "HRB 2045 BHV",
      "registerart": "HRB",
      "company_name": "Heise Schiffsreparatur und Industrie Service GmbH",
      "company_seat": "Bremerhaven",
      "details": "28.10.2024 (Bekanntmachungsdatum)\n\nBremen Amtsgericht Bremen HRB 2045 BHV\nLöschungsankündigung\n\nHeise Schiffsreparatur und Industrie Service GmbH\nGesellschaft mit beschränkter Haftung\nBremerhaven\n\nEs ist beabsichtigt die im Handelsregister eingetragene Gesellschaft von Amts wegen gemäß § 394 FamFG zu löschen. Gegen die Löschung kann beim AG Bremen schriftlich oder zu Protokoll der Geschäftsstelle Widerspruch eingelegt werden. Widerspruchsfrist 4 Wochen."
    },
    {
      "date": "2024-10-28",
      "id": "91864",
      "original_text": "Löschungsankündigung\nBremen Amtsgericht Bremen HRA 3719 BHV\nRogge Stahl- und Maschinenbau GmbH & Co. KG – Bremerhaven",
      "type": "Löschungsankündigung",
      "state": "Bremen",
      "amtsgericht": "Amtsgericht Bremen",
      "registernummer": "HRA 3719 BHV",
      "registerart": "HRA",
      "company_name": "Rogge Stahl- und Maschinenbau GmbH & Co. KG",
      "company_seat": "Bremerhaven",
      "details": "28.10.2024 (Bekanntmachungsdatum)\n\nBremen Amtsgericht Bremen HRA 3719 BHV\nLöschungsankündigung\n\nRogge Stahl- und Maschinenbau GmbH & Co. KG\nKommanditgesellschaft\nBremerhaven\n\nEs ist beabsichtigt die im Handelsregister eingetragene Firma von Amts wegen gemäß § 31 Abs.2 HGB zu löschen. Gegen die Löschung kann beim AG Bremen schriftlich oder zu Protokoll der Geschäftsstelle Widerspruch eingelegt werden. Widerspruchsfrist 4 Wochen."
    },
    {
      "date": "2024-10-28",
      "id": "91865",
      "original_text": "Registerbekanntmachung nach dem Umwandlungsgesetz\nNordrhein-Westfalen Amtsgericht Bad Oeynhausen HRA 6623\nWilfried Kampa Immobilien GmbH & Co. KG – Minden",
      "type": "Registerbekanntmachung nach dem Umwandlungsgesetz",
      "state": "Nordrhein-Westfalen",
      "amtsgericht": "Amtsgericht Bad Oeynhausen",
      "registernummer": "HRA 6623",
      "registerart": "HRA",
      "company_name": "Wilfried Kampa Immobilien GmbH & Co. KG",
      "company_seat": "Minden",
      "details": "28.10.2024 (Bekanntmachungsdatum)\n\nNordrhein-Westfalen Amtsgericht Bad Oeynhausen HRA 6623\nRegisterbekanntmachung nach dem Umwandlungsgesetz 28.10.2024 (Eintragungsdatum)\n\nWilfried Kampa Immobilien GmbH & Co. KG\nKommanditgesellschaft\nMinden\n\nDie Gesellschaft hat Gläubigern, deren Forderungen vor dieser Bekanntmachung begründet worden sind, Sicherheit zu leisten, soweit sie nicht Befriedigung verlangen können, wenn sie sich binnen sechs Monaten zu diesem Zweck melden."
    },
    {
      "date": "2024-10-28",
      "id": "91866",
      "original_text": "Einreichung neuer Dokumente\nNordrhein-Westfalen Amtsgericht Bonn HRB 21185\nnorisbank GmbH – Bonn",
      "type": "Einreichung neuer Dokumente",
      "state": "Nordrhein-Westfalen",
      "amtsgericht": "Amtsgericht Bonn",
      "registernummer": "HRB 21185",
      "registerart": "HRB",
      "company_name": "norisbank GmbH",
      "company_seat": "Bonn",
      "details": "28.10.2024 (Bekanntmachungsdatum)\n\nNordrhein-Westfalen Amtsgericht Bonn HRB 21185\nEinreichung neuer Dokumente 28.10.2024 (Eintragungsdatum)\n\nnorisbank GmbH\nGesellschaft mit beschränkter Haftung\nBonn\n\nDem Registergericht ist eine neue Liste der Mitglieder des Aufsichtsrates eingereicht worden."
    },
    {
      "date": "2024-10-28",
      "id": "91867",
      "original_text": "Registerbekanntmachung nach dem Umwandlungsgesetz\nNordrhein-Westfalen Amtsgericht Neuss HRB 16770\nBluebird-Alliance GmbH – Neuss",
      "type": "Registerbekanntmachung nach dem Umwandlungsgesetz",
      "state": "Nordrhein-Westfalen",
      "amtsgericht": "Amtsgericht Neuss",
      "registernummer": "HRB 16770",
      "registerart": "HRB",
      "company_name": "Bluebird-Alliance GmbH",
      "company_seat": "Neuss",
      "details": "28.10.2024 (Bekanntmachungsdatum)\n\nNordrhein-Westfalen Amtsgericht Neuss HRB 16770\nRegisterbekanntmachung nach dem Umwandlungsgesetz 28.10.2024 (Eintragungsdatum)\n\nBluebird-Alliance GmbH\nGesellschaft mit beschränkter Haftung\nNeuss\n\nDen Gläubigern der an der formwechselnden Umwandlung beteiligten Rechtsträger ist, wenn sie binnen sechs Monaten nach dem Tag, an dem die Eintragung der formwechselnden Umwandlung in das Register des Sitzes desjenigen Rechtsträgers, dessen Gläubiger sie sind, nach § 19 Absatz 3 UmwG als bekanntgemacht gilt, ihren Anspruch nach Grund und Höhe schriftlich anmelden, Sicherheit zu leisten, soweit sie nicht Befriedigung verlangen können. Dieses Recht steht den Gläubigern jedoch nur zu, wenn sie glaubhaft machen, dass durch die formwechselnden Umwandlung die Erfüllung ihrer Forderung gefährdet wird."
    },
    {
      "date": "2024-10-28",
      "id": "91868",
      "original_text": "Registerbekanntmachung nach dem Umwandlungsgesetz\nNordrhein-Westfalen Amtsgericht Kleve HRB 10678\nIPG NRW GmbH – Goch",
      "type": "Registerbekanntmachung nach dem Umwandlungsgesetz",
      "state": "Nordrhein-Westfalen",
      "amtsgericht": "Amtsgericht Kleve",
      "registernummer": "HRB 10678",
      "registerart": "HRB",
      "company_name": "IPG NRW GmbH",
      "company_seat": "Goch",
      "details": "28.10.2024 (Bekanntmachungsdatum)\n\nNordrhein-Westfalen Amtsgericht Kleve HRB 10678\nRegisterbekanntmachung nach dem Umwandlungsgesetz\n\nIPG NRW GmbH\nGesellschaft mit beschränkter Haftung\nGoch\n\nDen Gläubigern der an der Verschmelzung beteiligten Rechtsträger ist, wenn sie binnen sechs Monaten nach dem Tag, an dem die Eintragung der Verschmelzung in das Register des Sitzes desjenigen Rechtsträgers, dessen Gläubiger sie sind, nach § 19 Absatz 3 UmwG als bekanntgemacht gilt, ihren Anspruch nach Grund und Höhe schriftlich anmelden, Sicherheit zu leisten, soweit sie nicht Befriedigung verlangen können. Dieses Recht steht den Gläubigern jedoch nur zu, wenn sie glaubhaft machen, dass durch die Verschmelzung die Erfüllung ihrer Forderung gefährdet wird."
    },
    {
      "date": "2024-10-28",
      "id": "91869",
      "original_text": "Registerbekanntmachung nach dem Umwandlungsgesetz\nNordrhein-Westfalen Amtsgericht Kleve HRB 11333\nIPG Moers GmbH – Goch",
      "type": "Registerbekanntmachung nach dem Umwandlungsgesetz",
      "state": "Nordrhein-Westfalen",
      "amtsgericht": "Amtsgericht Kleve",
      "registernummer": "HRB 11333",
      "registerart": "HRB",
      "company_name": "IPG Moers GmbH",
      "company_seat": "Goch",
      "details": "28.10.2024 (Bekanntmachungsdatum)\n\nNordrhein-Westfalen Amtsgericht Kleve HRB 11333\nRegisterbekanntmachung nach dem Umwandlungsgesetz 28.10.2024 (Eintragungsdatum)\n\nIPG Moers GmbH\nGesellschaft mit beschränkter Haftung\nGoch\n\nDen Gläubigern der an der Verschmelzung beteiligten Rechtsträger ist, wenn sie binnen sechs Monaten nach dem Tag, an dem die Eintragung der Verschmelzung in das Register des Sitzes desjenigen Rechtsträgers, dessen Gläubiger sie sind, nach § 19 Absatz 3 UmwG als bekanntgemacht gilt, ihren Anspruch nach Grund und Höhe schriftlich anmelden, Sicherheit zu leisten, soweit sie nicht Befriedigung verlangen können. Dieses Recht steht den Gläubigern jedoch nur zu, wenn sie glaubhaft machen, dass durch die Verschmelzung die Erfüllung ihrer Forderung gefährdet wird."
    },
    {
      "date": "2024-10-28",
      "id": "91870",
      "original_text": "Löschungsankündigung\nNordrhein-Westfalen Amtsgericht Bochum HRB 15534\nNuclibau GmbH – Bochum",
      "type": "Löschungsankündigung",
      "state": "Nordrhein-Westfalen",
      "amtsgericht": "Amtsgericht Bochum",
      "registernummer": "HRB 15534",
      "registerart": "HRB",
      "company_name": "Nuclibau GmbH",
      "company_seat": "Bochum",
      "details": "28.10.2024 (Bekanntmachungsdatum)\n\nNordrhein-Westfalen Amtsgericht Bochum HRB 15534\nLöschungsankündigung 29.10.2024 (Eintragungsdatum)\n\nNuclibau GmbH\nGesellschaft mit beschränkter Haftung\nBochum\n\nDas Registergericht beabsichtigt die Gesellschaft von Amts wegen nach § 394 FamFG zu löschen. Die Frist zur Erhebung eines Widerspruchs ist auf drei Monate festgesetzt."
    },
    {
      "date": "2024-10-28",
      "id": "91871",
      "original_text": "Löschungsankündigung\nNordrhein-Westfalen Amtsgericht Köln HRB 44202\nBauunternehmung Schmitz GmbH – Hürth",
      "type": "Löschungsankündigung",
      "state": "Nordrhein-Westfalen",
      "amtsgericht": "Amtsgericht Köln",
      "registernummer": "HRB 44202",
      "registerart": "HRB",
      "company_name": "Bauunternehmung Schmitz GmbH",
      "company_seat": "Hürth",
      "details": "28.10.2024 (Bekanntmachungsdatum)\n\nNordrhein-Westfalen Amtsgericht Köln HRB 44202\nLöschungsankündigung\n\nBauunternehmung Schmitz GmbH\nGesellschaft mit beschränkter Haftung\nHürth\n\nDas Registergericht beabsichtigt die Gesellschaft von Amts wegen nach § 394 FamFG zu löschen. Die Frist zur Erhebung eines Widerspruchs ist auf einen Monat festgesetzt."
    },
    {
      "date": "2024-10-28",
      "id": "91872",
      "original_text": "Einreichung neuer Dokumente\nNordrhein-Westfalen Amtsgericht Köln HRB 26997\nMalteser Hilfsdienst gemeinnützige GmbH – Köln",
      "type": "Einreichung neuer Dokumente",
      "state": "Nordrhein-Westfalen",
      "amtsgericht": "Amtsgericht Köln",
      "registernummer": "HRB 26997",
      "registerart": "HRB",
      "company_name": "Malteser Hilfsdienst gemeinnützige GmbH",
      "company_seat": "Köln",
      "details": "28.10.2024 (Bekanntmachungsdatum)\n\nNordrhein-Westfalen Amtsgericht Köln HRB 26997\nEinreichung neuer Dokumente\n\nMalteser Hilfsdienst gemeinnützige GmbH\nGesellschaft mit beschränkter Haftung\nKöln\n\nDem Registergericht ist eine Liste der Mitglieder des Aufsichtsrates eingereicht worden."
    },
    {
      "date": "2024-10-28",
      "id": "91873",
      "original_text": "Registerbekanntmachung nach dem Umwandlungsgesetz\nNordrhein-Westfalen Amtsgericht Aachen GsR 273\nSki-Keller Kaulard & Schroiff eGbR – Simmerath",
      "type": "Registerbekanntmachung nach dem Umwandlungsgesetz",
      "state": "Nordrhein-Westfalen",
      "amtsgericht": "Amtsgericht Aachen",
      "registernummer": "GsR 273",
      "registerart": "GsR",
      "company_name": "Ski-Keller Kaulard & Schroiff eGbR",
      "company_seat": "Simmerath",
      "details": "28.10.2024 (Bekanntmachungsdatum)\n\nNordrhein-Westfalen Amtsgericht Aachen GsR 273\nRegisterbekanntmachung nach dem Umwandlungsgesetz 28.10.2024 (Eintragungsdatum)\n\nSki-Keller Kaulard & Schroiff eGbR\nGesellschaft bürgerlichen Rechts\nSimmerath\n\nDen Gläubigern der an der formwechselnden Umwandlung beteiligten Rechtsträger ist, wenn sie binnen sechs Monaten nach dem Tag, an dem die Eintragung der formwechselnden Umwandlung in das Register des Sitzes desjenigen Rechtsträgers, dessen Gläubiger sie sind, nach § 19 Absatz 3 UmwG als bekanntgemacht gilt, ihren Anspruch nach Grund und Höhe schriftlich anmelden, Sicherheit zu leisten, soweit sie nicht Befriedigung verlangen können. Dieses Recht steht den Gläubigern jedoch nur zu, wenn sie glaubhaft machen, dass durch die formwechselnden Umwandlung die Erfüllung ihrer Forderung gefährdet wird."
    },
    {
      "date": "2024-10-28",
      "id": "91874",
      "original_text": "Registerbekanntmachung nach dem Umwandlungsgesetz\nNordrhein-Westfalen Amtsgericht Bochum HRA 8036\nK-CNS, Das Systemhaus e. K. – Bochum",
      "type": "Registerbekanntmachung nach dem Umwandlungsgesetz",
      "state": "Nordrhein-Westfalen",
      "amtsgericht": "Amtsgericht Bochum",
      "registernummer": "HRA 8036",
      "registerart": "HRA",
      "company_name": "K-CNS, Das Systemhaus e. K.",
      "company_seat": "Bochum",
      "details": "28.10.2024 (Bekanntmachungsdatum)\n\nNordrhein-Westfalen Amtsgericht Bochum HRA 8036\nRegisterbekanntmachung nach dem Umwandlungsgesetz 28.10.2024 (Eintragungsdatum)\n\nK-CNS, Das Systemhaus e. K.\nEinzelkaufmann / Einzelkauffrau\nBochum\n\nDen Gläubigern der an der Ausgliederung beteiligten Rechtsträger ist, wenn sie binnen sechs Monaten nach dem Tag, an dem die Eintragung der Ausgliederung in das Register des Sitzes desjenigen Rechtsträgers, dessen Gläubiger sie sind, nach § 19 Absatz 3 UmwG als bekanntgemacht gilt, ihren Anspruch nach Grund und Höhe schriftlich anmelden, Sicherheit zu leisten, soweit sie nicht Befriedigung verlangen können. Dieses Recht steht den Gläubigern jedoch nur zu, wenn sie glaubhaft machen, dass durch die Ausgliederung die Erfüllung ihrer Forderung gefährdet wird."
    },
    {
      "date": "2024-10-28",
      "id": "91875",
      "original_text": "Löschungsankündigung\nNordrhein-Westfalen Amtsgericht Münster HRB 19687\nFertighaus-Deluxe GmbH – Warendorf",
      "type": "Löschungsankündigung",
      "state": "Nordrhein-Westfalen",
      "amtsgericht": "Amtsgericht Münster",
      "registernummer": "HRB 19687",
      "registerart": "HRB",
      "company_name": "Fertighaus-Deluxe GmbH",
      "company_seat": "Warendorf",
      "details": "28.10.2024 (Bekanntmachungsdatum)\n\nNordrhein-Westfalen Amtsgericht Münster HRB 19687\nLöschungsankündigung 28.10.2024 (Eintragungsdatum)\n\nFertighaus-Deluxe GmbH\nGesellschaft mit beschränkter Haftung\nWarendorf\n\nDas Registergericht beabsichtigt die Gesellschaft von Amts wegen nach § 394 FamFG zu löschen. Die Frist zur Erhebung eines Widerspruchs ist auf einen Monat festgesetzt.\n\nRechtbehelfsbelehrung:\n\nGegen diese Verfügung können Sie Widerspruch einlegen.\n\nDer Widerspruch ist bei dem Amtsgericht Münster, Gerichtsstraße 2 bis 6, 48149 Münster schriftlich in deutscher Sprache oder zur Niederschrift der Geschäftsstelle eines jeden Amtsgerichtes abgegeben werden.\nDie Einlegung ist auch durch Übertragung eines elektronischen Dokuments an die elektronische Poststelle des Gerichts möglich. Das elektronische Dokument muss für die Bearbeitung durch das Gericht geeignet und mit einer qualifizierten elektronischen Signatur der verantwortenden Person versehen sein oder von der verantwortenden Person signiert und auf einem sicheren Übermittlungsweg gem. § 130a ZPO nach nähere Maßgabe der Verordnung über die technischen Rahmenbedingungen des elektronischen Rechtsverkehrs und über das besondere elektronische Behördenpostfach (BGBI. I. S.3808) eingereicht werden. Weitere Informationen erhalten Sie auf der Internetseite www.justiz.de.\n\nDer Widerspruch muss spätestens innerhalb der gesetzten Frist nach der schriftlichen Bekanntgabe der Verfügung bei dem Amtsgericht Münster eingegangen sein. Dies gilt auch dann, wenn der Widerspruch zur Niederschrift der Geschäftsstelle eines anderen Amtsgerichtes abgegeben wurde. Die Frist beginnt mit der schriftlichen Bekanntgabe der Verfügung, spätestens mit Ablauf von fünf Monaten nach Erlass der Verfügung. Die Bekanntgabe ist entweder durch Zustellung oder am dritten Tage nach Aufgabe zur Post bewirkt. Fällt das Ende der First auf einen Sonntag, einen allgemeinen Feiertag oder Sonnabend, so endet die Frist mit Ablauf des nächsten Werktages.\n\nDer Widerspruch muss die Bezeichnung der angefochtenen Verfügung sowie die Erklärung enthalten, dass Widerspruch gegen diese Verfügung eingelegt wird. Er ist zu unterzeichnen  und soll begründet werden."
    },
    {
      "date": "2024-10-28",
      "id": "91876",
      "original_text": "Registerbekanntmachung nach dem Umwandlungsgesetz\nNordrhein-Westfalen Amtsgericht Steinfurt HRA 8277\nFlorine Kienbaum e.K. – Lengerich",
      "type": "Registerbekanntmachung nach dem Umwandlungsgesetz",
      "state": "Nordrhein-Westfalen",
      "amtsgericht": "Amtsgericht Steinfurt",
      "registernummer": "HRA 8277",
      "registerart": "HRA",
      "company_name": "Florine Kienbaum e.K.",
      "company_seat": "Lengerich",
      "details": "28.10.2024 (Bekanntmachungsdatum)\n\nNordrhein-Westfalen Amtsgericht Steinfurt HRA 8277\nRegisterbekanntmachung nach dem Umwandlungsgesetz 28.10.2024 (Eintragungsdatum)\n\nFlorine Kienbaum e.K.\nEinzelkaufmann / Einzelkauffrau\nLengerich\n\nDen Gläubigern der an der Ausgliederung beteiligten Rechtsträger ist, wenn sie binnen sechs Monaten nach dem Tag, an dem die Eintragung der Ausgliederung in das Register des Sitzes desjenigen Rechtsträgers, dessen Gläubiger sie sind, nach § 19 Absatz 3 UmwG als bekanntgemacht gilt, ihren Anspruch nach Grund und Höhe schriftlich anmelden, Sicherheit zu leisten, soweit sie nicht Befriedigung verlangen können. Dieses Recht steht den Gläubigern jedoch nur zu, wenn sie glaubhaft machen, dass durch die Ausgliederung die Erfüllung ihrer Forderung gefährdet wird."
    },
    {
      "date": "2024-10-28",
      "id": "91877",
      "original_text": "Löschungsankündigung\nNordrhein-Westfalen Amtsgericht Steinfurt HRB 11239\nASBRA UG (haftungsbeschränkt) – Westerkappeln",
      "type": "Löschungsankündigung",
      "state": "Nordrhein-Westfalen",
      "amtsgericht": "Amtsgericht Steinfurt",
      "registernummer": "HRB 11239",
      "registerart": "HRB",
      "company_name": "ASBRA UG (haftungsbeschränkt)",
      "company_seat": "Westerkappeln",
      "details": "28.10.2024 (Bekanntmachungsdatum)\n\nNordrhein-Westfalen Amtsgericht Steinfurt HRB 11239\nLöschungsankündigung\n\nASBRA UG (haftungsbeschränkt)\nGesellschaft mit beschränkter Haftung\nWesterkappeln\n\nDas Registergericht beabsichtigt, die im Handelsregister eingetragene Gesellschaft gemäß § 394 Absatz 1 FamFG wegen Vermögenslosigkeit von Amts wegen zu löschen.\n\nGegen diese Verfügung kann Widerspruch eingelegt werden. Die Frist zur Erhebung eines Widerspruchs gegen die beabsichtigte Löschung von Amts wegen ist auf einen Monat festgesetzt.\n\nRechtsbehelfsbelehrung:\n\nGegen diese Verfügung können Sie Widerspruch einlegen.\n\nDer Widerspruch ist bei dem Amtsgericht Steinfurt, Gerichtstraße 2, 48565 Steinfurt schriftlich in deutscher Sprache oder zur Niederschrift der Geschäftsstelle einzulegen. Der Widerspruch kann auch zur Niederschrift der Geschäftsstelle eines jeden Amtsgerichtes abgegeben werden.\nDie Einlegung ist auch durch Übertragung eines elektronischen Dokuments an die elektronische Poststelle des Gerichts möglich. Das elektronische Dokument muss für die Bearbeitung durch das Gericht geeignet und mit einer qualifizierten elektronischen Signatur der verantwortenden Person versehen sein oder von der verantwortenden Person signiert und auf einem sicheren Übermittlungsweg gemäß § 130 a ZPO nach näherer Maßgabe der Verordnung über die technischen Rahmenbedingungen des elektronischen Rechtsverkehrs und über das besondere elektronische Behördenpostfach (BGBl. I, S.3803) eingereicht werden. Weitere Informationen erhalten Sie auf der Internetseite www.justiz.de.\n\nDer Widerspruch muss spätestens innerhalb der gesetzten Frist bei dem Amtsgericht Steinfurt eingegangen sein. Dies gilt auch dann, wenn der Widerspruch zur Niederschrift der Geschäftsstelle eines anderen Amtsgerichtes abgegeben wurde. Die Frist beginnt mit der Veröffentlichung. Fällt das Ende der Frist auf einen Sonntag, einen allgemeinen Feiertag oder Sonnabend, so endet die Frist mit Ablauf des nächsten Werktages.\n\nDer Widerspruch muss die Bezeichnung der angefochtenen Verfügung sowie die Erklärung enthalten, dass Widerspruch gegen diese Verfügung eingelegt wird. Er ist zu unterzeichnen und soll begründet werden."
    },
    {
      "date": "2024-10-28",
      "id": "91878",
      "original_text": "Löschungsankündigung\nNordrhein-Westfalen Amtsgericht Düsseldorf HRB 97341\nMenzata GmbH – Düsseldorf",
      "type": "Löschungsankündigung",
      "state": "Nordrhein-Westfalen",
      "amtsgericht": "Amtsgericht Düsseldorf",
      "registernummer": "HRB 97341",
      "registerart": "HRB",
      "company_name": "Menzata GmbH",
      "company_seat": "Düsseldorf",
      "details": "28.10.2024 (Bekanntmachungsdatum)\n\nNordrhein-Westfalen Amtsgericht Düsseldorf HRB 97341\nLöschungsankündigung\n\nMenzata GmbH\nGesellschaft mit beschränkter Haftung\nDüsseldorf\n\nDas Registergericht beabsichtigt die Gesellschaft von Amts wegen nach § 394 FamFG zu löschen. Die Frist zur Erhebung eines Widerspruchs ist auf 3 Wochen festgesetzt.\n\nRechtsbehelfsbelehrung:\nDas Widerspruchsrecht steht jedem zu, der an der Unterlassung der Löschung ein berechtigtes Interesse hat. Der Widerspruch ist bei dem Amtsgericht Düsseldorf -Registergericht-, Werdener Straße 1, 40227 Düsseldorf schriftlich in deutscher Sprache oder zur Niederschrift der Geschäftsstelle einzulegen. Der Widerspruch kann auch zur Niederschrift der Geschäftsstelle eines jeden Amtsgerichtes abgegeben werden. Die Einlegung ist auch durch Übertragung eines elektronischen Dokuments an die elektronische Poststelle des Gerichts möglich. Das elektronische Dokument muss für die Bearbeitung durch das Gericht geeignet und mit einer qualifizierten elektronischen Signatur der verantwortenden Person versehen sein oder von der verantwortenden Person signiert und auf einem sicheren Übermittlungsweg gemäß § 130a ZPO nach näherer Maßgabe der Verordnung über die technischen Rahmenbedingungen des elektronischen Rechtsverkehrs und über das besondere elektronische Behördenpostfach (BGBl. I, S.3803) eingereicht werden. Weitere Informationen erhalten Sie auf der Internetseite www.justiz.de.\nDer Widerspruch muss spätestens innerhalb der gesetzten Frist nach dem Datum der Bekanntmachung der Löschungsankündigung bei dem Amtsgericht - Registergericht - Düsseldorf eingegangen sein.  Dies gilt auch dann, wenn der Widerspruch zur Niederschrift der Geschäftsstelle eines anderen Amtsgerichtes abgegeben wurde. Die Frist beginnt mit dem Tage der Bekanntmachung der Löschungsankündigung in dem für die Bekanntmachung der Eintragungen in das Handelsregister bestimmten elektronischen Informations- und Kommunikationssystem nach § 10 des Handelsgesetzbuches. Fällt das Ende der Frist auf einen Sonntag, einen allgemeinen Feiertag oder Sonnabend, so endet die Frist mit Ablauf des nächsten Werktages.\nDer Widerspruch muss die Bezeichnung der angefochtenen Löschungsankündigung sowie die Erklärung enthalten, dass Widerspruch gegen diese Löschungsankündigung eingelegt wird. Er ist zu unterzeichnen und soll begründet werden."
    },
    {
      "date": "2024-10-28",
      "id": "91879",
      "original_text": "Löschungsankündigung\nNordrhein-Westfalen Amtsgericht Mönchengladbach HRB 19586\nRoskor Holding GmbH – Mönchengladbach",
      "type": "Löschungsankündigung",
      "state": "Nordrhein-Westfalen",
      "amtsgericht": "Amtsgericht Mönchengladbach",
      "registernummer": "HRB 19586",
      "registerart": "HRB",
      "company_name": "Roskor Holding GmbH",
      "company_seat": "Mönchengladbach",
      "details": "28.10.2024 (Bekanntmachungsdatum)\n\nNordrhein-Westfalen Amtsgericht Mönchengladbach HRB 19586\nLöschungsankündigung\n\nRoskor Holding GmbH\nGesellschaft mit beschränkter Haftung\nMönchengladbach\n\nDas Registergericht beabsichtigt die Gesellschaft von Amts wegen nach § 394 FamFG zu löschen. Die Frist zur Erhebung eines Widerspruchs ist auf zwei Monate festgesetzt."
    },
    {
      "date": "2024-10-28",
      "id": "91880",
      "original_text": "Registerbekanntmachung nach dem Umwandlungsgesetz\nNordrhein-Westfalen Amtsgericht Kleve HRB 10567\nIPG Niederrhein GmbH – Goch",
      "type": "Registerbekanntmachung nach dem Umwandlungsgesetz",
      "state": "Nordrhein-Westfalen",
      "amtsgericht": "Amtsgericht Kleve",
      "registernummer": "HRB 10567",
      "registerart": "HRB",
      "company_name": "IPG Niederrhein GmbH",
      "company_seat": "Goch",
      "details": "28.10.2024 (Bekanntmachungsdatum)\n\nNordrhein-Westfalen Amtsgericht Kleve HRB 10567\nRegisterbekanntmachung nach dem Umwandlungsgesetz 28.10.2024 (Eintragungsdatum)\n\nIPG Niederrhein GmbH\nGesellschaft mit beschränkter Haftung\nGoch\n\nDen Gläubigern der an der Verschmelzung beteiligten Rechtsträger ist, wenn sie binnen sechs Monaten nach dem Tag, an dem die Eintragung der Verschmelzung in das Register des Sitzes desjenigen Rechtsträgers, dessen Gläubiger sie sind, nach § 19 Absatz 3 UmwG als bekanntgemacht gilt, ihren Anspruch nach Grund und Höhe schriftlich anmelden, Sicherheit zu leisten, soweit sie nicht Befriedigung verlangen können. Dieses Recht steht den Gläubigern jedoch nur zu, wenn sie glaubhaft machen, dass durch die Verschmelzung die Erfüllung ihrer Forderung gefährdet wird."
    },
    {
      "date": "2024-10-28",
      "id": "91881",
      "original_text": "Löschungsankündigung\nNordrhein-Westfalen Amtsgericht Bochum HRB 18894\nFilip Hoch- und Ingenieurbau GmbH – Witten",
      "type": "Löschungsankündigung",
      "state": "Nordrhein-Westfalen",
      "amtsgericht": "Amtsgericht Bochum",
      "registernummer": "HRB 18894",
      "registerart": "HRB",
      "company_name": "Filip Hoch- und Ingenieurbau GmbH",
      "company_seat": "Witten",
      "details": "28.10.2024 (Bekanntmachungsdatum)\n\nNordrhein-Westfalen Amtsgericht Bochum HRB 18894\nLöschungsankündigung 29.10.2024 (Eintragungsdatum)\n\nFilip Hoch- und Ingenieurbau GmbH\nGesellschaft mit beschränkter Haftung\nWitten\n\nDas Registergericht beabsichtigt die Gesellschaft von Amts wegen nach § 395 FamFG zu löschen, da nach dem Tod des hiesigen Geschäftsführers kein Nachfolger bestimmt worden ist.  Die Frist zur Erhebung eines Widerspruchs ist auf drei Monate festgesetzt."
    },
    {
      "date": "2024-10-28",
      "id": "91882",
      "original_text": "Registerbekanntmachung nach dem Umwandlungsgesetz\nNordrhein-Westfalen Amtsgericht Bochum HRA 8034\nK-CNS e.K. – Bochum",
      "type": "Registerbekanntmachung nach dem Umwandlungsgesetz",
      "state": "Nordrhein-Westfalen",
      "amtsgericht": "Amtsgericht Bochum",
      "registernummer": "HRA 8034",
      "registerart": "HRA",
      "company_name": "K-CNS e.K.",
      "company_seat": "Bochum",
      "details": "28.10.2024 (Bekanntmachungsdatum)\n\nNordrhein-Westfalen Amtsgericht Bochum HRA 8034\nRegisterbekanntmachung nach dem Umwandlungsgesetz 28.10.2024 (Eintragungsdatum)\n\nK-CNS e.K.\nEinzelkaufmann / Einzelkauffrau\nBochum\n\nDen Gläubigern der an der Ausgliederung beteiligten Rechtsträger ist, wenn sie binnen sechs Monaten nach dem Tag, an dem die Eintragung der Ausgliederung in das Register des Sitzes desjenigen Rechtsträgers, dessen Gläubiger sie sind, nach § 19 Absatz 3 UmwG als bekanntgemacht gilt, ihren Anspruch nach Grund und Höhe schriftlich anmelden, Sicherheit zu leisten, soweit sie nicht Befriedigung verlangen können. Dieses Recht steht den Gläubigern jedoch nur zu, wenn sie glaubhaft machen, dass durch die Ausgliederung die Erfüllung ihrer Forderung gefährdet wird."
    },
    {
      "date": "2024-10-28",
      "id": "91883",
      "original_text": "Einreichung neuer Dokumente\nNordrhein-Westfalen Amtsgericht Düsseldorf HRB 79055\nMETRO AG – Düsseldorf",
      "type": "Einreichung neuer Dokumente",
      "state": "Nordrhein-Westfalen",
      "amtsgericht": "Amtsgericht Düsseldorf",
      "registernummer": "HRB 79055",
      "registerart": "HRB",
      "company_name": "METRO AG",
      "company_seat": "Düsseldorf",
      "details": "28.10.2024 (Bekanntmachungsdatum)\n\nNordrhein-Westfalen Amtsgericht Düsseldorf HRB 79055\nEinreichung neuer Dokumente\n\nMETRO AG\nAktiengesellschaft\nDüsseldorf\n\nDem Registergericht ist eine Liste der Mitglieder des Aufsichtsrates eingereicht worden."
    },
    {
      "date": "2024-10-28",
      "id": "91884",
      "original_text": "Registerbekanntmachung nach dem Umwandlungsgesetz\nNordrhein-Westfalen Amtsgericht Bad Oeynhausen HRB 19930\nChancenreich gGmbH – Herford",
      "type": "Registerbekanntmachung nach dem Umwandlungsgesetz",
      "state": "Nordrhein-Westfalen",
      "amtsgericht": "Amtsgericht Bad Oeynhausen",
      "registernummer": "HRB 19930",
      "registerart": "HRB",
      "company_name": "Chancenreich gGmbH",
      "company_seat": "Herford",
      "details": "28.10.2024 (Bekanntmachungsdatum)\n\nNordrhein-Westfalen Amtsgericht Bad Oeynhausen HRB 19930\nRegisterbekanntmachung nach dem Umwandlungsgesetz 28.10.2024 (Eintragungsdatum)\n\nChancenreich gGmbH\nGesellschaft mit beschränkter Haftung\nHerford\n\nDen Gläubigern der an der formwechselnden Umwandlung beteiligten Rechtsträger ist, wenn sie binnen sechs Monaten nach dem Tag, an dem die Eintragung der formwechselnden Umwandlung in das Register des Sitzes desjenigen Rechtsträgers, dessen Gläubiger sie sind, nach § 19 Absatz 3 UmwG als bekanntgemacht gilt, ihren Anspruch nach Grund und Höhe schriftlich anmelden, Sicherheit zu leisten, soweit sie nicht Befriedigung verlangen können. Dieses Recht steht den Gläubigern jedoch nur zu, wenn sie glaubhaft machen, dass durch die formwechselnden Umwandlung die Erfüllung ihrer Forderung gefährdet wird."
    },
    {
      "date": "2024-10-28",
      "id": "91885",
      "original_text": "Löschungsankündigung\nNordrhein-Westfalen Amtsgericht Aachen HRB 23766\nPSW Peters Stahl UG (haftungsbeschränkt) – Aachen",
      "type": "Löschungsankündigung",
      "state": "Nordrhein-Westfalen",
      "amtsgericht": "Amtsgericht Aachen",
      "registernummer": "HRB 23766",
      "registerart": "HRB",
      "company_name": "PSW Peters Stahl UG (haftungsbeschränkt)",
      "company_seat": "Aachen",
      "details": "28.10.2024 (Bekanntmachungsdatum)\n\nNordrhein-Westfalen Amtsgericht Aachen HRB 23766\nLöschungsankündigung\n\nPSW Peters Stahl UG (haftungsbeschränkt)\nGesellschaft mit beschränkter Haftung\nAachen\n\nDas Registergericht beabsichtigt, von Amts wegen die Gesellschaft wegen Vermögenslosigkeit nach § 394 FamFG zu löschen weil das Finanzamt   Aachen-Stadt mit Schreiben vom   02.10.2024 Umstände mitgeteilt hat, aufgrund derer das Gericht davon überzeugt ist, dass die Gesellschaft vollständig vermögenslos ist.\n\nZur Geltendmachung des Widerspruchs gegen die beabsichtigte Löschung wird hiermit eine Frist von einem Monat ab Veröffentlichung dieser Ankündigung bestimmt.\n\nRechtsbehelfsbelehrung:\n\nGegen diese Verfügung kann Widerspruch eingelegt werden. Zum Widerspruch ist jeder berechtigt, der an der Unterlassung der Löschung ein berechtigtes Interesse hat.\n\nDer Widerspruch ist bei dem Amtsgericht Aachen, Adalbertsteinweg 92, 52070 Aachen schriftlich in deutscher Sprache oder zur Niederschrift der Geschäftsstelle einzulegen. Der Widerspruch kann auch zur Niederschrift der Geschäftsstelle eines jeden Amtsgerichtes abgegeben werden.\n\nDer Widerspruch muss spätestens innerhalb der gesetzten Frist nach der Bekanntgabe der Verfügung bei dem Amtsgericht Aachen eingegangen sein. Dies gilt auch dann, wenn der Widerspruch zur Niederschrift der Geschäftsstelle eines anderen Amtsgerichtes abgegeben wurde. Die Frist beginnt mit der Bekanntgabe der Verfügung durch Veröffentlichung. Fällt das Ende der Frist auf einen Sonntag, einen allgemeinen Feiertag oder Sonnabend, so endet die Frist mit Ablauf des nächsten Werktages.\n\nDer Widerspruch muss die Bezeichnung der angefochtenen Verfügung sowie die Erklärung enthalten, dass Widerspruch gegen diese Verfügung eingelegt wird. Er ist zu unterzeichnen und soll begründet werden.\n\nDie Einlegung ist auch durch Übertragung eines elektronischen Dokuments an die elektronische Poststelle des Gerichts möglich. Das elektronische Dokument muss für die Bearbeitung durch das Gericht geeignet und mit einer qualifizierten elektronischen Signatur der verantwortenden Person versehen sein oder von der verantwortenden Person signiert und auf einem sicheren Übermittlungsweg gemäß § 130 a ZPO nach näherer Maßgabe der Verordnung über die technischen Rahmenbedingungen des elektronischen Rechtsverkehrs und über das besondere elektronische Behördenpostfach (BGBl. I, S. 3803) eingereicht werden. Weitere Informationen erhalten Sie auf der Internetseite www.justiz.de."
    },
    {
      "date": "2024-10-28",
      "id": "91886",
      "original_text": "Einreichung neuer Dokumente\nHessen Amtsgericht Offenbach am Main HRB 4593\nEnergieversorgung Offenbach Aktiengesellschaft – Offenbach am Main",
      "type": "Einreichung neuer Dokumente",
      "state": "Hessen",
      "amtsgericht": "Amtsgericht Offenbach am Main",
      "registernummer": "HRB 4593",
      "registerart": "HRB",
      "company_name": "Energieversorgung Offenbach Aktiengesellschaft",
      "company_seat": "Offenbach am Main",
      "details": "28.10.2024 (Bekanntmachungsdatum)\n\nHessen Amtsgericht Offenbach am Main HRB 4593\nEinreichung neuer Dokumente\n\nEnergieversorgung Offenbach Aktiengesellschaft\nAktiengesellschaft\nOffenbach am Main\n\nDurch eine Änderung in den Personen der Aufsichtsratsmitglieder ist eine Liste der Mitglieder des Aufsichtsrates zum Handelsregister eingereicht worden."
    },
    {
      "date": "2024-10-28",
      "id": "91887",
      "original_text": "Registerbekanntmachung nach dem Umwandlungsgesetz\nHessen Amtsgericht Kassel HRB 19974\nSempers - Senioren mit Perspektive gGmbH – Kaufungen",
      "type": "Registerbekanntmachung nach dem Umwandlungsgesetz",
      "state": "Hessen",
      "amtsgericht": "Amtsgericht Kassel",
      "registernummer": "HRB 19974",
      "registerart": "HRB",
      "company_name": "Sempers - Senioren mit Perspektive gGmbH",
      "company_seat": "Kaufungen",
      "details": "28.10.2024 (Bekanntmachungsdatum)\n\nHessen Amtsgericht Kassel HRB 19974\nRegisterbekanntmachung nach dem Umwandlungsgesetz 28.10.2024 (Eintragungsdatum)\n\nSempers - Senioren mit Perspektive gGmbH\nGesellschaft mit beschränkter Haftung\nKaufungen\n\nDen Gläubigern der an der formwechselnden Umwandlung beteiligten Rechtsträger ist, wenn sie binnen sechs Monaten nach dem Tag, an dem die Eintragung der formwechselnden Umwandlung in das Register des Sitzes desjenigen Rechtsträgers, dessen Gläubiger sie sind, nach § 201 UmwG bekannt gemacht worden ist, ihren Anspruch nach Grund und Höhe schriftlich anmelden, Sicherheit zu leisten, soweit sie nicht Befriedigung verlangen können. Dieses Recht steht den Gläubigern jedoch nur zu, wenn sie glaubhaft machen, dass durch die formwechselnden Umwandlung die Erfüllung ihrer Forderung gefährdet wird."
    },
    {
      "date": "2024-10-28",
      "id": "91888",
      "original_text": "Sonstige Registerbekanntmachung\nHessen Amtsgericht Wiesbaden VR 4550\nKarneval- und Brauchtumsverein \"Die munteren Schwälbchen\" e.V. – Bad Schwalbach",
      "type": "Sonstige Registerbekanntmachung",
      "state": "Hessen",
      "amtsgericht": "Amtsgericht Wiesbaden",
      "registernummer": "VR 4550",
      "registerart": "VR",
      "company_name": "Karneval- und Brauchtumsverein \"Die munteren Schwälbchen\" e.V.",
      "company_seat": "Bad Schwalbach",
      "details": "28.10.2024 (Bekanntmachungsdatum)\n\nHessen Amtsgericht Wiesbaden VR 4550\nSonstige Registerbekanntmachung 27.10.2024 (Eintragungsdatum)\n\nKarneval- und Brauchtumsverein \"Die munteren Schwälbchen\" e.V.\neingetragener Verein\nBad Schwalbach\n\nDer Verein ist aufgelöst."
    },
    {
      "date": "2024-10-28",
      "id": "91889",
      "original_text": "Löschungsankündigung\nHessen Amtsgericht Frankfurt am Main HRA 27349\nHOTEL LUXOR Goldman und Urseanu – Frankfurt am Main",
      "type": "Löschungsankündigung",
      "state": "Hessen",
      "amtsgericht": "Amtsgericht Frankfurt am Main",
      "registernummer": "HRA 27349",
      "registerart": "HRA",
      "company_name": "HOTEL LUXOR Goldman und Urseanu",
      "company_seat": "Frankfurt am Main",
      "details": "28.10.2024 (Bekanntmachungsdatum)\n\nHessen Amtsgericht Frankfurt am Main HRA 27349\nLöschungsankündigung\n\nHOTEL LUXOR Goldman und Urseanu\nOffene Handelsgesellschaft\nFrankfurt am Main\n\nEs ist beabsichtigt, die Gesellschaft gemäß § 31 Absatz 2 HGB i.V.m. § 393 FamFG von Amts wegen im Handelsregister zu löschen. Hiergegen kann innerhalb eines Monats nach dieser Veröffentlichung Widerspruch bei dem Amtsgericht Frankfurt am Main eingelegt werden."
    },
    {
      "date": "2024-10-28",
      "id": "91890",
      "original_text": "Einreichung neuer Dokumente\nHessen Amtsgericht Frankfurt am Main HRB 79744\nKfW IPEX-Bank GmbH – Frankfurt am Main",
      "type": "Einreichung neuer Dokumente",
      "state": "Hessen",
      "amtsgericht": "Amtsgericht Frankfurt am Main",
      "registernummer": "HRB 79744",
      "registerart": "HRB",
      "company_name": "KfW IPEX-Bank GmbH",
      "company_seat": "Frankfurt am Main",
      "details": "28.10.2024 (Bekanntmachungsdatum)\n\nHessen Amtsgericht Frankfurt am Main HRB 79744\nEinreichung neuer Dokumente\n\nKfW IPEX-Bank GmbH\nGesellschaft mit beschränkter Haftung\nFrankfurt am Main\n\nDurch eine Änderung in den Personen der Aufsichtsratsmitglieder ist eine Liste der Mitglieder des Aufsichtsrates zum Handelsregister eingereicht worden."
    },
    {
      "date": "2024-10-28",
      "id": "91891",
      "original_text": "Registerbekanntmachung nach dem Umwandlungsgesetz\nHessen Amtsgericht Bad Homburg v.d.H. HRB 8146\n\"Wegmann GmbH\" – Neu-Anspach",
      "type": "Registerbekanntmachung nach dem Umwandlungsgesetz",
      "state": "Hessen",
      "amtsgericht": "Amtsgericht Bad Homburg v.d.H.",
      "registernummer": "HRB 8146",
      "registerart": "HRB",
      "company_name": "\"Wegmann GmbH\"",
      "company_seat": "Neu-Anspach",
      "details": "28.10.2024 (Bekanntmachungsdatum)\n\nHessen Amtsgericht Bad Homburg v.d.H. HRB 8146\nRegisterbekanntmachung nach dem Umwandlungsgesetz 28.10.2024 (Eintragungsdatum)\n\n\"Wegmann GmbH\"\nGesellschaft mit beschränkter Haftung\nNeu-Anspach\n\nDen Gläubigern der an der Verschmelzung beteiligten Rechtsträger ist, wenn sie binnen sechs Monaten nach dem Tag, an dem die Eintragung der Verschmelzung in das Register des Sitzes desjenigen Rechtsträgers, dessen Gläubiger sie sind, nach § 19 Absatz 3 UmwG bekannt gemacht worden ist, ihren Anspruch nach Grund und Höhe schriftlich anmelden, Sicherheit zu leisten, soweit sie nicht Befriedigung verlangen können. Dieses Recht steht den Gläubigern jedoch nur zu, wenn sie glaubhaft machen, dass durch die Verschmelzung die Erfüllung ihrer Forderung gefährdet wird."
    },
    {
      "date": "2024-10-28",
      "id": "91892",
      "original_text": "Löschungsankündigung\nHessen Amtsgericht Offenbach am Main HRB 51850\nNTS BAU GmbH – Offenbach am Main",
      "type": "Löschungsankündigung",
      "state": "Hessen",
      "amtsgericht": "Amtsgericht Offenbach am Main",
      "registernummer": "HRB 51850",
      "registerart": "HRB",
      "company_name": "NTS BAU GmbH",
      "company_seat": "Offenbach am Main",
      "details": "28.10.2024 (Bekanntmachungsdatum)\n\nHessen Amtsgericht Offenbach am Main HRB 51850\nLöschungsankündigung 28.10.0204 (Eintragungsdatum)\n\nNTS BAU GmbH\nGesellschaft mit beschränkter Haftung\nOffenbach am Main\n\nDas Registergericht beabsichtigt die im Handelsregister eingetragene Gesellschaft von Amts wegen nach § 394 FamFG zu löschen. Die Frist zur Erhebung eines Widerspruchs gegen die beabsichtigte Löschung wird auf 3 Monate festgesetzt."
    },
    {
      "date": "2024-10-28",
      "id": "91893",
      "original_text": "Registerbekanntmachung nach dem Umwandlungsgesetz\nHessen Amtsgericht Wetzlar HRB 4344\nRittal Beteiligungs GmbH – Herborn",
      "type": "Registerbekanntmachung nach dem Umwandlungsgesetz",
      "state": "Hessen",
      "amtsgericht": "Amtsgericht Wetzlar",
      "registernummer": "HRB 4344",
      "registerart": "HRB",
      "company_name": "Rittal Beteiligungs GmbH",
      "company_seat": "Herborn",
      "details": "28.10.2024 (Bekanntmachungsdatum)\n\nHessen Amtsgericht Wetzlar HRB 4344\nRegisterbekanntmachung nach dem Umwandlungsgesetz 28.10.2024 (Eintragungsdatum)\n\nRittal Beteiligungs GmbH\nGesellschaft mit beschränkter Haftung\nHerborn\n\nDen Gläubigern der an der grenzüberschreitenden Verschmelzung beteiligten übernehmenden Rechtsträger ist, wenn sie binnen sechs Monaten nach dem Tag, an dem die Eintragung der Verschmelzung in das Register des Sitzes desjenigen Rechtsträgers, dessen Gläubiger sie sind, nach § 19 Absatz 3 UmwG als bekanntgemacht gilt, ihren Anspruch nach Grund und Höhe schriftlich anmelden, Sicherheit zu leisten, soweit sie nicht Befriedigung verlangen können.\n\nDieses Recht steht den Gläubigern jedoch nur zu, wenn sie glaubhaft machen, dass durch die Verschmelzung die Erfüllung ihrer Forderung gefährdet wird."
    },
    {
      "date": "2024-10-28",
      "id": "91894",
      "original_text": "Sonstige Registerbekanntmachung\nHessen Amtsgericht Wiesbaden VR 5471\nHeinrich Birk Gesellschaft Verein zur Förderung der Wissenschaft und wissenschaftlichen Zusammenarbeit auf dem Gebiet der Rebenzüchtung und Rebenveredelung – Geisenheim",
      "type": "Sonstige Registerbekanntmachung",
      "state": "Hessen",
      "amtsgericht": "Amtsgericht Wiesbaden",
      "registernummer": "VR 5471",
      "registerart": "VR",
      "company_name": "Heinrich Birk Gesellschaft Verein zur Förderung der Wissenschaft und wissenschaftlichen Zusammenarbeit auf dem Gebiet der Rebenzüchtung und Rebenveredelung",
      "company_seat": "Geisenheim",
      "details": "28.10.2024 (Bekanntmachungsdatum)\n\nHessen Amtsgericht Wiesbaden VR 5471\nSonstige Registerbekanntmachung 28.10.2024 (Eintragungsdatum)\n\nHeinrich Birk Gesellschaft Verein zur Förderung der Wissenschaft und wissenschaftlichen Zusammenarbeit auf dem Gebiet der Rebenzüchtung und Rebenveredelung\neingetragener Verein\nGeisenheim\n\nDer Verein ist aufgelöst."
    },
    {
      "date": "2024-10-28",
      "id": "91895",
      "original_text": "Registerbekanntmachung nach dem Umwandlungsgesetz\nHessen Amtsgericht Kassel VR 5352\nSempers - Senioren mit Perspektive e.V. – Kaufungen",
      "type": "Registerbekanntmachung nach dem Umwandlungsgesetz",
      "state": "Hessen",
      "amtsgericht": "Amtsgericht Kassel",
      "registernummer": "VR 5352",
      "registerart": "VR",
      "company_name": "Sempers - Senioren mit Perspektive e.V.",
      "company_seat": "Kaufungen",
      "details": "28.10.2024 (Bekanntmachungsdatum)\n\nHessen Amtsgericht Kassel VR 5352\nRegisterbekanntmachung nach dem Umwandlungsgesetz 28.10.2024 (Eintragungsdatum)\n\nSempers - Senioren mit Perspektive e.V.\neingetragener Verein\nKaufungen\n\nDen Gläubigern der an der formwechselnden Umwandlung beteiligten Rechtsträger ist, wenn sie binnen sechs Monaten nach dem Tag, an dem die Eintragung der formwechselnden Umwandlung in das Register des Sitzes desjenigen Rechtsträgers, dessen Gläubiger sie sind, nach § 201 UmwG bekannt gemacht worden ist, ihren Anspruch nach Grund und Höhe schriftlich anmelden, Sicherheit zu leisten, soweit sie nicht Befriedigung verlangen können. Dieses Recht steht den Gläubigern jedoch nur zu, wenn sie glaubhaft machen, dass durch die formwechselnden Umwandlung die Erfüllung ihrer Forderung gefährdet wird."
    },
    {
      "date": "2024-10-28",
      "id": "91896",
      "original_text": "Löschungsankündigung\nHessen Amtsgericht Frankfurt am Main HRB 128465\nPM Aero Worx GmbH – Frankfurt am Main",
      "type": "Löschungsankündigung",
      "state": "Hessen",
      "amtsgericht": "Amtsgericht Frankfurt am Main",
      "registernummer": "HRB 128465",
      "registerart": "HRB",
      "company_name": "PM Aero Worx GmbH",
      "company_seat": "Frankfurt am Main",
      "details": "28.10.2024 (Bekanntmachungsdatum)\n\nHessen Amtsgericht Frankfurt am Main HRB 128465\nLöschungsankündigung\n\nPM Aero Worx GmbH\nGesellschaft mit beschränkter Haftung\nFrankfurt am Main\n\nDas Registergericht beabsichtigt die im Handelsregister eingetragene Gesellschaft von Amts wegen nach § 394 FamFG zu löschen. Die Frist zur Erhebung eines Widerspruchs gegen die beabsichtigte Löschung wird auf 3 Monate festgesetzt."
    },
    {
      "date": "2024-10-28",
      "id": "91897",
      "original_text": "Löschungsankündigung\nHessen Amtsgericht Frankfurt am Main HRB 86649\nAirglobal GmbH – Frankfurt am Main",
      "type": "Löschungsankündigung",
      "state": "Hessen",
      "amtsgericht": "Amtsgericht Frankfurt am Main",
      "registernummer": "HRB 86649",
      "registerart": "HRB",
      "company_name": "Airglobal GmbH",
      "company_seat": "Frankfurt am Main",
      "details": "28.10.2024 (Bekanntmachungsdatum)\n\nHessen Amtsgericht Frankfurt am Main HRB 86649\nLöschungsankündigung\n\nAirglobal GmbH\nGesellschaft mit beschränkter Haftung\nFrankfurt am Main\n\nEs ist beabsichtigt, die Gesellschaft wegen Vermögenslosigkeit gemäß § 394 FamFG von Amts wegen im Handelsregister zu löschen. Hiergegen kann innerhalb eines Monats nach dieser Veröffentlichung Widerspruch bei dem Amtsgericht Frankfurt am Main eingelegt werden."
    },
    {
      "date": "2024-10-28",
      "id": "91898",
      "original_text": "Löschungsankündigung\nHessen Amtsgericht Offenbach am Main HRB 53183\nMühlbach Residenz GmbH – Neu-Isenburg",
      "type": "Löschungsankündigung",
      "state": "Hessen",
      "amtsgericht": "Amtsgericht Offenbach am Main",
      "registernummer": "HRB 53183",
      "registerart": "HRB",
      "company_name": "Mühlbach Residenz GmbH",
      "company_seat": "Neu-Isenburg",
      "details": "28.10.2024 (Bekanntmachungsdatum)\n\nHessen Amtsgericht Offenbach am Main HRB 53183\nLöschungsankündigung\n\nMühlbach Residenz GmbH\nGesellschaft mit beschränkter Haftung\nNeu-Isenburg\n\nEs ist beabsichtigt die im Handelsregister eingetragene Gesellschaft von Amts wegen nach § 394 FamFG zu löschen. Die Frist zur Erhebung eines Widerspruchs gegen die beabsichtigte Löschung wird auf 3 Monate festgesetzt."
    },
    {
      "date": "2024-10-28",
      "id": "91899",
      "original_text": "Registerbekanntmachung nach dem Umwandlungsgesetz\nHessen Amtsgericht Frankfurt am Main HRB 132813\nBlueSky Estate Management UG (haftungsbeschränkt) – Frankfurt am Main",
      "type": "Registerbekanntmachung nach dem Umwandlungsgesetz",
      "state": "Hessen",
      "amtsgericht": "Amtsgericht Frankfurt am Main",
      "registernummer": "HRB 132813",
      "registerart": "HRB",
      "company_name": "BlueSky Estate Management UG (haftungsbeschränkt)",
      "company_seat": "Frankfurt am Main",
      "details": "28.10.2024 (Bekanntmachungsdatum)\n\nHessen Amtsgericht Frankfurt am Main HRB 132813\nRegisterbekanntmachung nach dem Umwandlungsgesetz 28.10.2024 (Eintragungsdatum)\n\nBlueSky Estate Management UG (haftungsbeschränkt)\nGesellschaft mit beschränkter Haftung\nFrankfurt am Main\n\nDen Gläubigern der an der Verschmelzung beteiligten Rechtsträger ist, wenn sie binnen sechs Monaten nach dem Tag, an dem die Eintragung der Verschmelzung in das Register des Sitzes desjenigen Rechtsträgers, dessen Gläubiger sie sind, nach § 19 Absatz 3 UmwG bekannt gemacht worden ist, ihren Anspruch nach Grund und Höhe schriftlich anmelden, Sicherheit zu leisten, soweit sie nicht Befriedigung verlangen können. Dieses Recht steht den Gläubigern jedoch nur zu, wenn sie glaubhaft machen, dass durch die Verschmelzung die Erfüllung ihrer Forderung gefährdet wird."
    },
    {
      "date": "2024-10-28",
      "id": "91900",
      "original_text": "Registerbekanntmachung nach dem Umwandlungsgesetz\nHessen Amtsgericht Frankfurt am Main HRB 117251\nVision GmbH – Frankfurt am Main",
      "type": "Registerbekanntmachung nach dem Umwandlungsgesetz",
      "state": "Hessen",
      "amtsgericht": "Amtsgericht Frankfurt am Main",
      "registernummer": "HRB 117251",
      "registerart": "HRB",
      "company_name": "Vision GmbH",
      "company_seat": "Frankfurt am Main",
      "details": "28.10.2024 (Bekanntmachungsdatum)\n\nHessen Amtsgericht Frankfurt am Main HRB 117251\nRegisterbekanntmachung nach dem Umwandlungsgesetz 28.10.2024 (Eintragungsdatum)\n\nVision GmbH\nGesellschaft mit beschränkter Haftung\nFrankfurt am Main\n\nDen Gläubigern der an der Verschmelzung beteiligten Rechtsträger ist, wenn sie binnen sechs Monaten nach dem Tag, an dem die Eintragung der Verschmelzung in das Register des Sitzes desjenigen Rechtsträgers, dessen Gläubiger sie sind, nach § 19 Absatz 3 UmwG bekannt gemacht worden ist, ihren Anspruch nach Grund und Höhe schriftlich anmelden, Sicherheit zu leisten, soweit sie nicht Befriedigung verlangen können. Dieses Recht steht den Gläubigern jedoch nur zu, wenn sie glaubhaft machen, dass durch die Verschmelzung die Erfüllung ihrer Forderung gefährdet wird."
    },
    {
      "date": "2024-10-28",
      "id": "91901",
      "original_text": "Sonstige Registerbekanntmachung\nHessen Amtsgericht Frankfurt am Main HRB 132234\nclearvise AG – Frankfurt am Main",
      "type": "Sonstige Registerbekanntmachung",
      "state": "Hessen",
      "amtsgericht": "Amtsgericht Frankfurt am Main",
      "registernummer": "HRB 132234",
      "registerart": "HRB",
      "company_name": "clearvise AG",
      "company_seat": "Frankfurt am Main",
      "details": "28.10.2024 (Bekanntmachungsdatum)\n\nHessen Amtsgericht Frankfurt am Main HRB 132234\nSonstige Registerbekanntmachung\n\nclearvise AG\nAktiengesellschaft\nFrankfurt am Main\n\nDurch eine Änderung in den Personen der Aufsichtsratsmitglieder ist eine Liste der Mitglieder des Aufsichtsrates zum Handelsregister eingereicht worden."
    }
  ]
}