{
  "date": "2024-10-03",
  "date_of_scrape": "2024-11-24T14:46:35.355Z",
  "tool_version": "0.1.0",
  "announcements": [
    {
      "date": "2024-10-03",
      "original_text": "Löschungsankündigung\nBayern Amtsgericht München HRB 261370\n5DENT GmbH – München",
      "type": "Löschungsankündigung",
      "state": "Bayern",
      "amtsgericht": "Amtsgericht München",
      "registernummer": "HRB 261370",
      "registerart": "HRB",
      "company_name": "5DENT GmbH",
      "company_seat": "München",
      "details": "03.10.2024 (Bekanntmachungsdatum)\n\nBayern Amtsgericht München HRB 261370\nLöschungsankündigung\n\n5DENT GmbH\nGesellschaft mit beschränkter Haftung\nMünchen\n\nDas Registergericht beabsichtigt, die im Handelsregister eingetragene Gesellschaft wegen Vermögenslosigkeit von Amts wegen nach § 394 FamFG zu löschen. Die Frist zur Erhebung eines Widerspruchs ist auf drei Monate festgesetzt."
    },
    {
      "date": "2024-10-03",
      "original_text": "Einreichung neuer Dokumente\nHessen Amtsgericht Kassel HRB 6458\nArbeiter-Samariter-Bund Gesellschaft für soziale Einrichtungen Hessen mbH – Kassel",
      "type": "Einreichung neuer Dokumente",
      "state": "Hessen",
      "amtsgericht": "Amtsgericht Kassel",
      "registernummer": "HRB 6458",
      "registerart": "HRB",
      "company_name": "Arbeiter-Samariter-Bund Gesellschaft für soziale Einrichtungen Hessen mbH",
      "company_seat": "Kassel",
      "details": "03.10.2024 (Bekanntmachungsdatum)\n\nHessen Amtsgericht Kassel HRB 6458\nEinreichung neuer Dokumente 03.10.2024 (Eintragungsdatum)\n\nArbeiter-Samariter-Bund Gesellschaft für soziale Einrichtungen Hessen mbH\nGesellschaft mit beschränkter Haftung\nKassel\n\nDurch eine Änderung in den Personen der Aufsichtsratsmitglieder ist eine Liste der Mitglieder des Aufsichtsrates zum Handelsregister eingereicht worden."
    },
    {
      "date": "2024-10-03",
      "original_text": "Löschungsankündigung\nBayern Amtsgericht München HRB 223013\nBM Verwaltung GmbH – Sauerlach",
      "type": "Löschungsankündigung",
      "state": "Bayern",
      "amtsgericht": "Amtsgericht München",
      "registernummer": "HRB 223013",
      "registerart": "HRB",
      "company_name": "BM Verwaltung GmbH",
      "company_seat": "Sauerlach",
      "details": "03.10.2024 (Bekanntmachungsdatum)\n\nBayern Amtsgericht München HRB 223013\nLöschungsankündigung 02.10.2024 (Eintragungsdatum)\n\nBM Verwaltung GmbH\nGesellschaft mit beschränkter Haftung\nSauerlach\n\nDas Registergericht beabsichtigt, die im Handelsregister eingetragene Gesellschaft wegen Vermögenslosigkeit von Amts wegen nach § 394 FamFG zu löschen. Die Frist zur Erhebung eines Widerspruchs ist auf drei Monate festgesetzt."
    },
    {
      "date": "2024-10-03",
      "original_text": "Registerbekanntmachung nach dem Umwandlungsgesetz\nBayern Amtsgericht Ingolstadt HRB 5900\nBertelshofer GmbH – Weichering",
      "type": "Registerbekanntmachung nach dem Umwandlungsgesetz",
      "state": "Bayern",
      "amtsgericht": "Amtsgericht Ingolstadt",
      "registernummer": "HRB 5900",
      "registerart": "HRB",
      "company_name": "Bertelshofer GmbH",
      "company_seat": "Weichering",
      "details": "03.10.2024 (Bekanntmachungsdatum)\n\nBayern Amtsgericht Ingolstadt HRB 5900\nRegisterbekanntmachung nach dem Umwandlungsgesetz 02.10.2024 (Eintragungsdatum)\n\nBertelshofer GmbH\nGesellschaft mit beschränkter Haftung\nWeichering\n\nDen Gläubigern der an der Verschmelzung beteiligten Rechtsträger ist, wenn sie binnen sechs Monaten nach dem Tag, an dem die Eintragung der Verschmelzung in das Register des Sitzes desjenigen Rechtsträgers, dessen Gläubiger sie sind, nach § 19 Abs. 3 UmwG als bekannt gemacht gilt, ihren Anspruch nach Grund und Höhe schriftlich anmelden, Sicherheit zu leisten, soweit sie nicht Befriedigung verlangen können. Dieses Recht steht den Gläubigern jedoch nur zu, wenn sie glaubhaft machen, dass durch die Verschmelzung die Erfüllung ihrer Forderung gefährdet wird."
    },
    {
      "date": "2024-10-03",
      "original_text": "Registerbekanntmachung nach dem Umwandlungsgesetz\nBayern Amtsgericht Coburg HRA 5598\nBrückner Sanitär Heizung Service GmbH & Co. KG – Großheirath",
      "type": "Registerbekanntmachung nach dem Umwandlungsgesetz",
      "state": "Bayern",
      "amtsgericht": "Amtsgericht Coburg",
      "registernummer": "HRA 5598",
      "registerart": "HRA",
      "company_name": "Brückner Sanitär Heizung Service GmbH & Co. KG",
      "company_seat": "Großheirath",
      "details": "03.10.2024 (Bekanntmachungsdatum)\n\nBayern Amtsgericht Coburg HRA 5598\nRegisterbekanntmachung nach dem Umwandlungsgesetz 02.10.2024 (Eintragungsdatum)\n\nBrückner Sanitär Heizung Service GmbH & Co. KG\nKommanditgesellschaft\nGroßheirath\n\nDen Gläubigern der an der Ausgliederung beteiligten Rechtsträger ist, wenn sie binnen sechs Monaten nach dem Tag, an dem die Eintragung der Ausgliederung in das Register des Sitzes desjenigen Rechtsträgers, dessen Gläubiger sie sind, nach §§ 125, 19 Abs. 3 UmwG als bekannt gemacht gilt, ihren Anspruch nach Grund und Höhe schriftlich anmelden, Sicherheit zu leisten, soweit sie nicht Befriedigung verlangen können. Dieses Recht steht den Gläubigern jedoch nur zu, wenn sie glaubhaft machen, dass durch die Ausgliederung die Erfüllung ihrer Forderung gefährdet wird."
    },
    {
      "date": "2024-10-03",
      "original_text": "Einreichung neuer Dokumente\nBayern Amtsgericht Traunstein HRB 31585\nBrückner Verwaltungs SE – Siegsdorf",
      "type": "Einreichung neuer Dokumente",
      "state": "Bayern",
      "amtsgericht": "Amtsgericht Traunstein",
      "registernummer": "HRB 31585",
      "registerart": "HRB",
      "company_name": "Brückner Verwaltungs SE",
      "company_seat": "Siegsdorf",
      "details": "03.10.2024 (Bekanntmachungsdatum)\n\nBayern Amtsgericht Traunstein HRB 31585\nEinreichung neuer Dokumente\n\nBrückner Verwaltungs SE\nEuropäische Aktiengesellschaft (SE)\nSiegsdorf\n\nDem Amtsgericht Traunstein -Registergericht- ist eine Liste der Mitglieder des Verwaltungsrats eingereicht worden, Art. 9 Abs. 1 Buchst. c (ii) SE-VO i.V.m. § 106 AktG."
    },
    {
      "date": "2024-10-03",
      "original_text": "Löschungsankündigung\nBayern Amtsgericht Deggendorf HRB 4668\nChaplin GmbH – Deggendorf",
      "type": "Löschungsankündigung",
      "state": "Bayern",
      "amtsgericht": "Amtsgericht Deggendorf",
      "registernummer": "HRB 4668",
      "registerart": "HRB",
      "company_name": "Chaplin GmbH",
      "company_seat": "Deggendorf",
      "details": "03.10.2024 (Bekanntmachungsdatum)\n\nBayern Amtsgericht Deggendorf HRB 4668\nLöschungsankündigung\n\nChaplin GmbH\nGesellschaft mit beschränkter Haftung\nDeggendorf\n\nDas Registergericht beabsichtigt, die im Handelsregister eingetragene Gesellschaft wegen Vermögenslosigkeit von Amts wegen nach § 394 FamFG zu löschen. Die Frist zur Erhebung eines Widerspruchs ist auf einen Monat festgesetzt."
    },
    {
      "date": "2024-10-03",
      "original_text": "Löschungsankündigung\nBayern Amtsgericht Nürnberg HRB 39854\nCri8 UG (haftungsbeschränkt) – Nürnberg",
      "type": "Löschungsankündigung",
      "state": "Bayern",
      "amtsgericht": "Amtsgericht Nürnberg",
      "registernummer": "HRB 39854",
      "registerart": "HRB",
      "company_name": "Cri8 UG (haftungsbeschränkt)",
      "company_seat": "Nürnberg",
      "details": "03.10.2024 (Bekanntmachungsdatum)\n\nBayern Amtsgericht Nürnberg HRB 39854\nLöschungsankündigung\n\nCri8 UG (haftungsbeschränkt)\nGesellschaft mit beschränkter Haftung\nNürnberg\n\nDas Registergericht beabsichtigt, die im Handelsregister eingetragene Gesellschaft wegen Vermögenslosigkeit von Amts wegen nach § 394 FamFG zu löschen. Die Frist zur Erhebung eines Widerspruchs ist auf einen Monat festgesetzt."
    },
    {
      "date": "2024-10-03",
      "original_text": "Registerbekanntmachung nach dem Umwandlungsgesetz\nBayern Amtsgericht Landshut HRA 11727\nElektro Ecker GmbH & Co. KG – Landshut",
      "type": "Registerbekanntmachung nach dem Umwandlungsgesetz",
      "state": "Bayern",
      "amtsgericht": "Amtsgericht Landshut",
      "registernummer": "HRA 11727",
      "registerart": "HRA",
      "company_name": "Elektro Ecker GmbH & Co. KG",
      "company_seat": "Landshut",
      "details": "03.10.2024 (Bekanntmachungsdatum)\n\nBayern Amtsgericht Landshut HRA 11727\nRegisterbekanntmachung nach dem Umwandlungsgesetz 18.09.2024 (Eintragungsdatum)\n\nElektro Ecker GmbH & Co. KG\nKommanditgesellschaft\nLandshut\n\nDen Gläubigern des formwechselnden Rechtsträgers ist, wenn sie binnen sechs Monaten nach dem Tag, an dem die Eintragung des Formwechsels nach § 201 UmwG als bekannt gemacht gilt, ihren Anspruch nach Grund und Höhe schriftlich anmelden, Sicherheit zu leisten, soweit sie nicht Befriedigung verlangen können. Dieses Recht steht den Gläubigern jedoch nur zu, wenn sie glaubhaft machen, dass durch den Formwechsel die Erfüllung ihrer Forderung gefährdet wird."
    },
    {
      "date": "2024-10-03",
      "original_text": "Sonstige Registerbekanntmachung\nBayern Amtsgericht München HRB 125419\nEssenceMediacom München GmbH – München",
      "type": "Sonstige Registerbekanntmachung",
      "state": "Bayern",
      "amtsgericht": "Amtsgericht München",
      "registernummer": "HRB 125419",
      "registerart": "HRB",
      "company_name": "EssenceMediacom München GmbH",
      "company_seat": "München",
      "details": "03.10.2024 (Bekanntmachungsdatum)\n\nBayern Amtsgericht München HRB 125419\nSonstige Registerbekanntmachung 02.10.2024 (Eintragungsdatum)\n\nEssenceMediacom München GmbH\nGesellschaft mit beschränkter Haftung\nMünchen\n\nDen Gläubigern der Gesellschaft, deren Forderungen begründet worden sind, bevor die Eintragung der Beendigung des Beherrschungs- und Gewinnabführungsvertrages in das Handelsregister nach § 10 des Handelsgesetzbuches als bekanntgemacht gilt, hat der andere Vertragsteil Sicherheit zu leisten, wenn sie sich binnen sechs Monaten nach der Bekanntmachung der Eintragung zu diesem Zweck bei ihm melden."
    },
    {
      "date": "2024-10-03",
      "original_text": "Sonstige Registerbekanntmachung\nBayern Amtsgericht München HRB 187413\nFTI Flight Trading GmbH – München",
      "type": "Sonstige Registerbekanntmachung",
      "state": "Bayern",
      "amtsgericht": "Amtsgericht München",
      "registernummer": "HRB 187413",
      "registerart": "HRB",
      "company_name": "FTI Flight Trading GmbH",
      "company_seat": "München",
      "details": "03.10.2024 (Bekanntmachungsdatum)\n\nBayern Amtsgericht München HRB 187413\nSonstige Registerbekanntmachung 02.10.2024 (Eintragungsdatum)\n\nFTI Flight Trading GmbH\nGesellschaft mit beschränkter Haftung\nMünchen\n\nDen Gläubigern der Gesellschaft, deren Forderungen begründet worden sind, bevor die Eintragung der Beendigung des Gewinnabführungsvertrages in das Handelsregister nach § 10 des Handelsgesetzbuches als bekanntgemacht gilt, hat der andere Vertragsteil Sicherheit zu leisten, wenn sie sich binnen sechs Monaten nach der Bekanntmachung der Eintragung zu diesem Zweck bei ihm melden."
    },
    {
      "date": "2024-10-03",
      "original_text": "Registerbekanntmachung nach dem Umwandlungsgesetz\nBayern Amtsgericht München HRB 296496\nFXU Immobilien GmbH – München",
      "type": "Registerbekanntmachung nach dem Umwandlungsgesetz",
      "state": "Bayern",
      "amtsgericht": "Amtsgericht München",
      "registernummer": "HRB 296496",
      "registerart": "HRB",
      "company_name": "FXU Immobilien GmbH",
      "company_seat": "München",
      "details": "03.10.2024 (Bekanntmachungsdatum)\n\nBayern Amtsgericht München HRB 296496\nRegisterbekanntmachung nach dem Umwandlungsgesetz 02.10.2024 (Eintragungsdatum)\n\nFXU Immobilien GmbH\nGesellschaft mit beschränkter Haftung\nMünchen\n\nDen Gläubigern des formwechselnden Rechtsträgers ist, wenn sie binnen sechs Monaten nach dem Tag, an dem die Eintragung des Formwechsels nach § 201 UmwG als bekannt gemacht gilt, ihren Anspruch nach Grund und Höhe schriftlich anmelden, Sicherheit zu leisten, soweit sie nicht Befriedigung verlangen können. Dieses Recht steht den Gläubigern jedoch nur zu, wenn sie glaubhaft machen, dass durch den Formwechsel die Erfüllung ihrer Forderung gefährdet wird."
    },
    {
      "date": "2024-10-03",
      "original_text": "Löschungsankündigung\nBayern Amtsgericht Deggendorf HRA 3034\nHDT KG – Deggendorf",
      "type": "Löschungsankündigung",
      "state": "Bayern",
      "amtsgericht": "Amtsgericht Deggendorf",
      "registernummer": "HRA 3034",
      "registerart": "HRA",
      "company_name": "HDT KG",
      "company_seat": "Deggendorf",
      "details": "03.10.2024 (Bekanntmachungsdatum)\n\nBayern Amtsgericht Deggendorf HRA 3034\nLöschungsankündigung\n\nHDT KG\nKommanditgesellschaft\nDeggendorf\n\nDas Registergericht beabsichtigt, die im Handelsregister eingetragene Firma von Amts wegen nach § 31 Abs. 2 HGB zu löschen. Die Frist zur Erhebung eines Widerspruchs ist auf einen Monat festgesetzt."
    },
    {
      "date": "2024-10-03",
      "original_text": "Löschungsankündigung\nBayern Amtsgericht Würzburg HRB 14680\nHaus Cherie Kitzingen UG (haftungsbeschränkt) – Kitzingen",
      "type": "Löschungsankündigung",
      "state": "Bayern",
      "amtsgericht": "Amtsgericht Würzburg",
      "registernummer": "HRB 14680",
      "registerart": "HRB",
      "company_name": "Haus Cherie Kitzingen UG (haftungsbeschränkt)",
      "company_seat": "Kitzingen",
      "details": "03.10.2024 (Bekanntmachungsdatum)\n\nBayern Amtsgericht Würzburg HRB 14680\nLöschungsankündigung\n\nHaus Cherie Kitzingen UG (haftungsbeschränkt)\nGesellschaft mit beschränkter Haftung\nKitzingen\n\nDas Registergericht beabsichtigt, die im Handelsregister eingetragene Gesellschaft wegen Vermögenslosigkeit von Amts wegen nach § 394 FamFG zu löschen."
    },
    {
      "date": "2024-10-03",
      "original_text": "Löschungsankündigung\nBayern Amtsgericht München HRB 255319\nHaus und Grund Projektbau GmbH – Olching",
      "type": "Löschungsankündigung",
      "state": "Bayern",
      "amtsgericht": "Amtsgericht München",
      "registernummer": "HRB 255319",
      "registerart": "HRB",
      "company_name": "Haus und Grund Projektbau GmbH",
      "company_seat": "Olching",
      "details": "03.10.2024 (Bekanntmachungsdatum)\n\nBayern Amtsgericht München HRB 255319\nLöschungsankündigung 02.10.2024 (Eintragungsdatum)\n\nHaus und Grund Projektbau GmbH\nGesellschaft mit beschränkter Haftung\nOlching\n\nDas Registergericht beabsichtigt, die im Handelsregister eingetragene Gesellschaft wegen Vermögenslosigkeit von Amts wegen nach § 394 FamFG zu löschen. Die Frist zur Erhebung eines Widerspruchs ist auf drei Monate festgesetzt."
    },
    {
      "date": "2024-10-03",
      "original_text": "Registerbekanntmachung nach dem Umwandlungsgesetz\nBayern Amtsgericht Coburg HRA 4494\nHeinz Brückner Sanitär- und Heizungstechnik e.K. – Großheirath, OT Neuses a.d.E.",
      "type": "Registerbekanntmachung nach dem Umwandlungsgesetz",
      "state": "Bayern",
      "amtsgericht": "Amtsgericht Coburg",
      "registernummer": "HRA 4494",
      "registerart": "HRA",
      "company_name": "Heinz Brückner Sanitär- und Heizungstechnik e.K.",
      "company_seat": "Großheirath, OT Neuses a.d.E.",
      "details": "03.10.2024 (Bekanntmachungsdatum)\n\nBayern Amtsgericht Coburg HRA 4494\nRegisterbekanntmachung nach dem Umwandlungsgesetz 02.10.2024 (Eintragungsdatum)\n\nHeinz Brückner Sanitär- und Heizungstechnik e.K.\nEinzelkaufmann / Einzelkauffrau\nGroßheirath, OT Neuses a.d.E.\n\nDen Gläubigern der an der Ausgliederung beteiligten Rechtsträger ist, wenn sie binnen sechs Monaten nach dem Tag, an dem die Eintragung der Ausgliederung in das Register des Sitzes desjenigen Rechtsträgers, dessen Gläubiger sie sind, nach §§ 125, 19 Abs. 3 UmwG als bekannt gemacht gilt, ihren Anspruch nach Grund und Höhe schriftlich anmelden, Sicherheit zu leisten, soweit sie nicht Befriedigung verlangen können. Dieses Recht steht den Gläubigern jedoch nur zu, wenn sie glaubhaft machen, dass durch die Ausgliederung die Erfüllung ihrer Forderung gefährdet wird."
    },
    {
      "date": "2024-10-03",
      "original_text": "Registerbekanntmachung nach dem Umwandlungsgesetz\nBayern Amtsgericht München HRB 234117\nKabelcom Rheinhessen GmbH – Unterföhring",
      "type": "Registerbekanntmachung nach dem Umwandlungsgesetz",
      "state": "Bayern",
      "amtsgericht": "Amtsgericht München",
      "registernummer": "HRB 234117",
      "registerart": "HRB",
      "company_name": "Kabelcom Rheinhessen GmbH",
      "company_seat": "Unterföhring",
      "details": "03.10.2024 (Bekanntmachungsdatum)\n\nBayern Amtsgericht München HRB 234117\nRegisterbekanntmachung nach dem Umwandlungsgesetz 02.10.2024 (Eintragungsdatum)\n\nKabelcom Rheinhessen GmbH\nGesellschaft mit beschränkter Haftung\nUnterföhring\n\nDen Gläubigern der an der Verschmelzung beteiligten Rechtsträger ist, wenn sie binnen sechs Monaten nach dem Tag, an dem die Eintragung der Verschmelzung in das Register des Sitzes desjenigen Rechtsträgers, dessen Gläubiger sie sind, nach § 19 Abs. 3 UmwG als bekannt gemacht gilt, ihren Anspruch nach Grund und Höhe schriftlich anmelden, Sicherheit zu leisten, soweit sie nicht Befriedigung verlangen können. Dieses Recht steht den Gläubigern jedoch nur zu, wenn sie glaubhaft machen, dass durch die Verschmelzung die Erfüllung ihrer Forderung gefährdet wird."
    },
    {
      "date": "2024-10-03",
      "original_text": "Registerbekanntmachung nach dem Umwandlungsgesetz\nBayern Amtsgericht Bayreuth HRA 2814\nKnoll Elektro Großhandel GmbH & Co. KG – Bayreuth",
      "type": "Registerbekanntmachung nach dem Umwandlungsgesetz",
      "state": "Bayern",
      "amtsgericht": "Amtsgericht Bayreuth",
      "registernummer": "HRA 2814",
      "registerart": "HRA",
      "company_name": "Knoll Elektro Großhandel GmbH & Co. KG",
      "company_seat": "Bayreuth",
      "details": "03.10.2024 (Bekanntmachungsdatum)\n\nBayern Amtsgericht Bayreuth HRA 2814\nRegisterbekanntmachung nach dem Umwandlungsgesetz 02.10.2024 (Eintragungsdatum)\n\nKnoll Elektro Großhandel GmbH & Co. KG\nKommanditgesellschaft\nBayreuth\n\nDen Gläubigern der an der Verschmelzung beteiligten Rechtsträger ist, wenn sie binnen sechs Monaten nach dem Tag, an dem die Eintragung der Verschmelzung in das Register des Sitzes desjenigen Rechtsträgers, dessen Gläubiger sie sind, nach § 19 Abs. 3 UmwG als bekannt gemacht gilt, ihren Anspruch nach Grund und Höhe schriftlich anmelden, Sicherheit zu leisten, soweit sie nicht Befriedigung verlangen können. Dieses Recht steht den Gläubigern jedoch nur zu, wenn sie glaubhaft machen, dass durch die Verschmelzung die Erfüllung ihrer Forderung gefährdet wird."
    },
    {
      "date": "2024-10-03",
      "original_text": "Sonstige Registerbekanntmachung\nBayern Amtsgericht Bayreuth HRB 1682\nKnoll Elektro Großhandel Verwaltungs GmbH – Bayreuth",
      "type": "Sonstige Registerbekanntmachung",
      "state": "Bayern",
      "amtsgericht": "Amtsgericht Bayreuth",
      "registernummer": "HRB 1682",
      "registerart": "HRB",
      "company_name": "Knoll Elektro Großhandel Verwaltungs GmbH",
      "company_seat": "Bayreuth",
      "details": "03.10.2024 (Bekanntmachungsdatum)\n\nBayern Amtsgericht Bayreuth HRB 1682\nSonstige Registerbekanntmachung 02.10.2024 (Eintragungsdatum)\n\nKnoll Elektro Großhandel Verwaltungs GmbH\nGesellschaft mit beschränkter Haftung\nBayreuth\n\nDen Gläubigern der an der Verschmelzung beteiligten Rechtsträger ist, wenn sie binnen sechs Monaten nach dem Tag, an dem die Eintragung der Verschmelzung in das Register des Sitzes desjenigen Rechtsträgers, dessen Gläubiger sie sind, nach § 19 Abs. 3 UmwG als bekannt gemacht gilt, ihren Anspruch nach Grund und Höhe schriftlich anmelden, Sicherheit zu leisten, soweit sie nicht Befriedigung verlangen können. Dieses Recht steht den Gläubigern jedoch nur zu, wenn sie glaubhaft machen, dass durch die Verschmelzung die Erfüllung ihrer Forderung gefährdet wird."
    },
    {
      "date": "2024-10-03",
      "original_text": "Registerbekanntmachung nach dem Umwandlungsgesetz\nBayern Amtsgericht Bamberg HRB 9823\nKrefft Verwaltungs UG (haftungsbeschränkt) – Bamberg",
      "type": "Registerbekanntmachung nach dem Umwandlungsgesetz",
      "state": "Bayern",
      "amtsgericht": "Amtsgericht Bamberg",
      "registernummer": "HRB 9823",
      "registerart": "HRB",
      "company_name": "Krefft Verwaltungs UG (haftungsbeschränkt)",
      "company_seat": "Bamberg",
      "details": "03.10.2024 (Bekanntmachungsdatum)\n\nBayern Amtsgericht Bamberg HRB 9823\nRegisterbekanntmachung nach dem Umwandlungsgesetz 02.10.2024 (Eintragungsdatum)\n\nKrefft Verwaltungs UG (haftungsbeschränkt)\nGesellschaft mit beschränkter Haftung\nBamberg\n\nDen Gläubigern der an der Verschmelzung beteiligten Rechtsträger ist, wenn sie binnen sechs Monaten nach dem Tag, an dem die Eintragung der Verschmelzung in das Register des Sitzes desjenigen Rechtsträgers, dessen Gläubiger sie sind, nach § 19 Abs. 3 UmwG als bekannt gemacht gilt, ihren Anspruch nach Grund und Höhe schriftlich anmelden, Sicherheit zu leisten, soweit sie nicht Befriedigung verlangen können. Dieses Recht steht den Gläubigern jedoch nur zu, wenn sie glaubhaft machen, dass durch die Verschmelzung die Erfüllung ihrer Forderung gefährdet wird."
    },
    {
      "date": "2024-10-03",
      "original_text": "Einreichung neuer Dokumente\nBayern Amtsgericht Traunstein HRB 28119\nMedical Park SE – Amerang",
      "type": "Einreichung neuer Dokumente",
      "state": "Bayern",
      "amtsgericht": "Amtsgericht Traunstein",
      "registernummer": "HRB 28119",
      "registerart": "HRB",
      "company_name": "Medical Park SE",
      "company_seat": "Amerang",
      "details": "03.10.2024 (Bekanntmachungsdatum)\n\nBayern Amtsgericht Traunstein HRB 28119\nEinreichung neuer Dokumente\n\nMedical Park SE\nEuropäische Aktiengesellschaft (SE)\nAmerang\n\nDem Amtsgericht Traunstein -Registergericht- ist eine Liste der Mitglieder des Aufsichtsrats eingereicht worden, Art. 9 Abs. 1 Buchst. c (ii) SE-VO i.V.m. § 106 AktG."
    },
    {
      "date": "2024-10-03",
      "original_text": "Registerbekanntmachung nach dem Umwandlungsgesetz\nBayern Amtsgericht München HRB 250764\nSchwandorfer 10 GmbH – Herrsching a.Ammersee",
      "type": "Registerbekanntmachung nach dem Umwandlungsgesetz",
      "state": "Bayern",
      "amtsgericht": "Amtsgericht München",
      "registernummer": "HRB 250764",
      "registerart": "HRB",
      "company_name": "Schwandorfer 10 GmbH",
      "company_seat": "Herrsching a.Ammersee",
      "details": "03.10.2024 (Bekanntmachungsdatum)\n\nBayern Amtsgericht München HRB 250764\nRegisterbekanntmachung nach dem Umwandlungsgesetz 02.10.2024 (Eintragungsdatum)\n\nSchwandorfer 10 GmbH\nGesellschaft mit beschränkter Haftung\nHerrsching a.Ammersee\n\nDen Gläubigern der an der Verschmelzung beteiligten Rechtsträger ist, wenn sie binnen sechs Monaten nach dem Tag, an dem die Eintragung der Verschmelzung in das Register des Sitzes desjenigen Rechtsträgers, dessen Gläubiger sie sind, nach § 19 Abs. 3 UmwG als bekannt gemacht gilt, ihren Anspruch nach Grund und Höhe schriftlich anmelden, Sicherheit zu leisten, soweit sie nicht Befriedigung verlangen können. Dieses Recht steht den Gläubigern jedoch nur zu, wenn sie glaubhaft machen, dass durch die Verschmelzung die Erfüllung ihrer Forderung gefährdet wird."
    },
    {
      "date": "2024-10-03",
      "original_text": "Löschungsankündigung\nBayern Amtsgericht München HRA 11294\nTrumpf Blusen-Kleider GmbH & Co. KG München – Aschheim/Dornach",
      "type": "Löschungsankündigung",
      "state": "Bayern",
      "amtsgericht": "Amtsgericht München",
      "registernummer": "HRA 11294",
      "registerart": "HRA",
      "company_name": "Trumpf Blusen-Kleider GmbH & Co. KG München",
      "company_seat": "Aschheim/Dornach",
      "details": "03.10.2024 (Bekanntmachungsdatum)\n\nBayern Amtsgericht München HRA 11294\nLöschungsankündigung\n\nTrumpf Blusen-Kleider GmbH & Co. KG München\nKommanditgesellschaft\nAschheim/Dornach\n\nDas Registergericht beabsichtigt, die im Handelsregister eingetragene Firma von Amts wegen nach § 31 Abs. 2 HGB zu löschen. Die Frist zur Erhebung eines Widerspruchs ist auf drei Monate festgesetzt."
    },
    {
      "date": "2024-10-03",
      "original_text": "Einreichung neuer Dokumente\nBayern Amtsgericht München HRB 174695\nViscovery AG – München",
      "type": "Einreichung neuer Dokumente",
      "state": "Bayern",
      "amtsgericht": "Amtsgericht München",
      "registernummer": "HRB 174695",
      "registerart": "HRB",
      "company_name": "Viscovery AG",
      "company_seat": "München",
      "details": "03.10.2024 (Bekanntmachungsdatum)\n\nBayern Amtsgericht München HRB 174695\nEinreichung neuer Dokumente\n\nViscovery AG\nAktiengesellschaft\nMünchen\n\nDem Amtsgericht München -Registergericht- ist eine Liste der Mitglieder des Aufsichtsrats eingereicht worden, § 106 AktG."
    },
    {
      "date": "2024-10-03",
      "original_text": "Löschungsankündigung\nBayern Amtsgericht München HRB 211282\nWAG Praxisvertretungen UG (haftungsbeschränkt) – München",
      "type": "Löschungsankündigung",
      "state": "Bayern",
      "amtsgericht": "Amtsgericht München",
      "registernummer": "HRB 211282",
      "registerart": "HRB",
      "company_name": "WAG Praxisvertretungen UG (haftungsbeschränkt)",
      "company_seat": "München",
      "details": "03.10.2024 (Bekanntmachungsdatum)\n\nBayern Amtsgericht München HRB 211282\nLöschungsankündigung\n\nWAG Praxisvertretungen UG (haftungsbeschränkt)\nGesellschaft mit beschränkter Haftung\nMünchen\n\nDas Registergericht beabsichtigt, die im Handelsregister eingetragene Gesellschaft wegen Vermögenslosigkeit von Amts wegen nach § 394 FamFG zu löschen. Die Frist zur Erhebung eines Widerspruchs ist auf drei Monate festgesetzt."
    },
    {
      "date": "2024-10-03",
      "original_text": "Einreichung neuer Dokumente\nBayern Amtsgericht Memmingen HRB 18559\nWanzl GmbH & Co. KGaA – Leipheim",
      "type": "Einreichung neuer Dokumente",
      "state": "Bayern",
      "amtsgericht": "Amtsgericht Memmingen",
      "registernummer": "HRB 18559",
      "registerart": "HRB",
      "company_name": "Wanzl GmbH & Co. KGaA",
      "company_seat": "Leipheim",
      "details": "03.10.2024 (Bekanntmachungsdatum)\n\nBayern Amtsgericht Memmingen HRB 18559\nEinreichung neuer Dokumente\n\nWanzl GmbH & Co. KGaA\nKommanditgesellschaft auf Aktien\nLeipheim\n\nDem Amtsgericht Memmingen -Registergericht- ist eine Liste der Mitglieder des Aufsichtsrats eingereicht worden, §§ 278 Abs. 3, 106 AktG."
    },
    {
      "date": "2024-10-03",
      "original_text": "Löschungsankündigung\nBayern Amtsgericht München HRB 237557\nWorld Wide Trade Company WWTC GmbH – München",
      "type": "Löschungsankündigung",
      "state": "Bayern",
      "amtsgericht": "Amtsgericht München",
      "registernummer": "HRB 237557",
      "registerart": "HRB",
      "company_name": "World Wide Trade Company WWTC GmbH",
      "company_seat": "München",
      "details": "03.10.2024 (Bekanntmachungsdatum)\n\nBayern Amtsgericht München HRB 237557\nLöschungsankündigung 02.10.2024 (Eintragungsdatum)\n\nWorld Wide Trade Company WWTC GmbH\nGesellschaft mit beschränkter Haftung\nMünchen\n\nDas Registergericht beabsichtigt, die im Handelsregister eingetragene Gesellschaft wegen Vermögenslosigkeit von Amts wegen nach § 394 FamFG zu löschen. Die Frist zur Erhebung eines Widerspruchs ist auf drei Monate festgesetzt."
    },
    {
      "date": "2024-10-03",
      "original_text": "Einreichung neuer Dokumente\nBayern Amtsgericht München HRB 277898\nYouco M22-H447 Vorrats-AG – München",
      "type": "Einreichung neuer Dokumente",
      "state": "Bayern",
      "amtsgericht": "Amtsgericht München",
      "registernummer": "HRB 277898",
      "registerart": "HRB",
      "company_name": "Youco M22-H447 Vorrats-AG",
      "company_seat": "München",
      "details": "03.10.2024 (Bekanntmachungsdatum)\n\nBayern Amtsgericht München HRB 277898\nEinreichung neuer Dokumente 01.10.2024 (Eintragungsdatum)\n\nYouco M22-H447 Vorrats-AG\nAktiengesellschaft\nMünchen\n\nDem Amtsgericht München -Registergericht- ist eine Liste der Mitglieder des Aufsichtsrats eingereicht worden, § 106 AktG."
    },
    {
      "date": "2024-10-03",
      "original_text": "Löschungsankündigung\nBayern Amtsgericht Landshut HRB 10767\nsourcecrew GmbH – Vilsheim",
      "type": "Löschungsankündigung",
      "state": "Bayern",
      "amtsgericht": "Amtsgericht Landshut",
      "registernummer": "HRB 10767",
      "registerart": "HRB",
      "company_name": "sourcecrew GmbH",
      "company_seat": "Vilsheim",
      "details": "03.10.2024 (Bekanntmachungsdatum)\n\nBayern Amtsgericht Landshut HRB 10767\nLöschungsankündigung\n\nsourcecrew GmbH\nGesellschaft mit beschränkter Haftung\nVilsheim\n\nDas Registergericht beabsichtigt, die im Handelsregister eingetragene Gesellschaft wegen Vermögenslosigkeit von Amts wegen nach § 394 FamFG zu löschen. Die Frist zur Erhebung eines Widerspruchs ist auf einen Monat festgesetzt."
    },
    {
      "date": "2024-10-03",
      "original_text": "Registerbekanntmachung nach dem Umwandlungsgesetz\nBayern Amtsgericht Landshut HRB 8784\nt´works Deutschland GmbH – Geisenhausen",
      "type": "Registerbekanntmachung nach dem Umwandlungsgesetz",
      "state": "Bayern",
      "amtsgericht": "Amtsgericht Landshut",
      "registernummer": "HRB 8784",
      "registerart": "HRB",
      "company_name": "t´works Deutschland GmbH",
      "company_seat": "Geisenhausen",
      "details": "03.10.2024 (Bekanntmachungsdatum)\n\nBayern Amtsgericht Landshut HRB 8784\nRegisterbekanntmachung nach dem Umwandlungsgesetz 02.10.2024 (Eintragungsdatum)\n\nt´works Deutschland GmbH\nGesellschaft mit beschränkter Haftung\nGeisenhausen\n\nDen Gläubigern der an der Verschmelzung beteiligten Rechtsträger ist, wenn sie binnen sechs Monaten nach dem Tag, an dem die Eintragung der Verschmelzung in das Register des Sitzes desjenigen Rechtsträgers, dessen Gläubiger sie sind, nach § 19 Abs. 3 UmwG als bekannt gemacht gilt, ihren Anspruch nach Grund und Höhe schriftlich anmelden, Sicherheit zu leisten, soweit sie nicht Befriedigung verlangen können. Dieses Recht steht den Gläubigern jedoch nur zu, wenn sie glaubhaft machen, dass durch die Verschmelzung die Erfüllung ihrer Forderung gefährdet wird."
    }
  ]
}