{
  "date": "2024-11-19",
  "date_of_scrape": "2024-11-22",
  "tool_version": "0.1.0",
  "announcements": [
    {
      "date": "2024-11-19",
      "original_text": "Registerbekanntmachung nach dem Umwandlungsgesetz\nBayern Amtsgericht München HRB 143338\n\"Kallos\" Verlag und Versand GmbH – Krailling",
      "type": "Registerbekanntmachung nach dem Umwandlungsgesetz",
      "state": "Bayern",
      "amtsgericht": "Amtsgericht München",
      "registernummer": "HRB 143338",
      "registerart": "HRB",
      "company_name": "\"Kallos\" Verlag und Versand GmbH",
      "company_seat": "Krailling",
      "details": "19.11.2024 (Bekanntmachungsdatum)\n\nBayern Amtsgericht München HRB 143338\nRegisterbekanntmachung nach dem Umwandlungsgesetz 15.11.2024 (Eintragungsdatum)\n\n\"Kallos\" Verlag und Versand GmbH\nGesellschaft mit beschränkter Haftung\nKrailling\n\nDen Gläubigern der an der Verschmelzung beteiligten Rechtsträger ist, wenn sie binnen sechs Monaten nach dem Tag, an dem die Eintragung der Verschmelzung in das Register des Sitzes desjenigen Rechtsträgers, dessen Gläubiger sie sind, nach § 19 Abs. 3 UmwG als bekannt gemacht gilt, ihren Anspruch nach Grund und Höhe schriftlich anmelden, Sicherheit zu leisten, soweit sie nicht Befriedigung verlangen können. Dieses Recht steht den Gläubigern jedoch nur zu, wenn sie glaubhaft machen, dass durch die Verschmelzung die Erfüllung ihrer Forderung gefährdet wird."
    },
    {
      "date": "2024-11-19",
      "original_text": "Löschungsankündigung\nNordrhein-Westfalen Amtsgericht Siegburg HRB 7952\n\"Landleben\" - Fleischverarbeitungs- und Handels GmbH – Waldbröl",
      "type": "Löschungsankündigung",
      "state": "Nordrhein-Westfalen",
      "amtsgericht": "Amtsgericht Siegburg",
      "registernummer": "HRB 7952",
      "registerart": "HRB",
      "company_name": "\"Landleben\" - Fleischverarbeitungs- und Handels GmbH",
      "company_seat": "Waldbröl",
      "details": "19.11.2024 (Bekanntmachungsdatum)\n\nNordrhein-Westfalen Amtsgericht Siegburg HRB 7952\nLöschungsankündigung\n\n\"Landleben\" - Fleischverarbeitungs- und Handels GmbH\nGesellschaft mit beschränkter Haftung\nWaldbröl\n\nDas Registergericht hat glaubhafte Kenntnis erlangt, dass die Gesellschaft vermögenslos geworden ist, da ein Insolvenzverfahren wegen Masselosigkeit nach § 207 InsO eingestellt wurde.\n\nEs ist daher beabsichtigt, die Gesellschaft nach § 394 FamFG im Handelsregister wegen Vermögenslosigkeit zu löschen.\nEinwände gegen die Löschung sind durch Widerspruch binnen einer Frist von 3 Monaten geltend zu machen, andernfalls die Löschung erfolgen wird.\n\nEinzulegen ist der Widerspruch bei dem Amtsgericht Siegburg, Neue Poststraße 16, 53721 Siegburg, und zwar entweder schriftlich in deutscher Sprache oder mündlich zur Niederschrift der Geschäftsstelle. Der Widerspruch kann auch zur Niederschrift der Geschäftsstelle eines jeden Amtsgerichts abgegeben werden. Der Widerspruch ist binnen der in der Verfügung bestimmten Frist einzulegen. Die Frist ist nur gewahrt, wenn der Widerspruch rechtzeitig bei dem Amtsgericht Siegburg eingeht, auch wenn der Widerspruch zur Niederschrift der Geschäftsstelle eines anderen Amtsgerichts abgegeben wurde. Die Frist beginnt jeweils mit der schriftlichen Bekanntgabe der Verfügung an die Beteiligten. Kann die schriftliche Bekanntgabe an einen Beteiligten nicht bewirkt werden, beginnt die Frist spätestens mit Ablauf von fünf Monaten nach Erlass der Verfügung. Die Bekanntgabe ist entweder durch Zustellung oder am dritten Tage nach Aufgabe zur Post bewirkt. Sofern die Löschung noch nicht erfolgt ist, kann der Widerspruch auch noch nach Ablauf der Frist eingelegt werden. Fällt das Ende der Frist auf einen Sonnabend, einen Sonntag oder einen allgemeinen Feiertag, endet die Frist mit Ablauf des nächsten Werktages. Der Widerspruch ist zu unterzeichnen. Eine Begründung des Widerspruchs ist nicht vorgeschrieben."
    },
    {
      "date": "2024-11-19",
      "original_text": "Einreichung neuer Dokumente\nNordrhein-Westfalen Amtsgericht Düsseldorf HRB 92416\n360X Art AG – Düsseldorf",
      "type": "Einreichung neuer Dokumente",
      "state": "Nordrhein-Westfalen",
      "amtsgericht": "Amtsgericht Düsseldorf",
      "registernummer": "HRB 92416",
      "registerart": "HRB",
      "company_name": "360X Art AG",
      "company_seat": "Düsseldorf",
      "details": "19.11.2024 (Bekanntmachungsdatum)\n\nNordrhein-Westfalen Amtsgericht Düsseldorf HRB 92416\nEinreichung neuer Dokumente 19.11.2024 (Eintragungsdatum)\n\n360X Art AG\nAktiengesellschaft\nDüsseldorf\n\nDem Registergericht ist eine Liste der Mitglieder des Aufsichtsrates eingereicht worden."
    },
    {
      "date": "2024-11-19",
      "original_text": "Einreichung neuer Dokumente\nBaden-Württemberg Amtsgericht Mannheim HRB 3279\nABG Abfallbeseitigungsgesellschaft mbH – Mannheim",
      "type": "Einreichung neuer Dokumente",
      "state": "Baden-Württemberg",
      "amtsgericht": "Amtsgericht Mannheim",
      "registernummer": "HRB 3279",
      "registerart": "HRB",
      "company_name": "ABG Abfallbeseitigungsgesellschaft mbH",
      "company_seat": "Mannheim",
      "details": "19.11.2024 (Bekanntmachungsdatum)\n\nBaden-Württemberg Amtsgericht Mannheim HRB 3279\nEinreichung neuer Dokumente 19.11.2024 (Eintragungsdatum)\n\nABG Abfallbeseitigungsgesellschaft mbH\nGesellschaft mit beschränkter Haftung\nMannheim\n\nDie Gesellschaft hat am 15.11.2024 die Listen über die Zusammensetzung des Aufsichtsrats zum Handelsregister eingereicht."
    },
    {
      "date": "2024-11-19",
      "original_text": "Einreichung neuer Dokumente\nBayern Amtsgericht Fürth HRB 18056\nALDI Bayern-Nordost Verwaltungs-SE – Adelsdorf",
      "type": "Einreichung neuer Dokumente",
      "state": "Bayern",
      "amtsgericht": "Amtsgericht Fürth",
      "registernummer": "HRB 18056",
      "registerart": "HRB",
      "company_name": "ALDI Bayern-Nordost Verwaltungs-SE",
      "company_seat": "Adelsdorf",
      "details": "19.11.2024 (Bekanntmachungsdatum)\n\nBayern Amtsgericht Fürth HRB 18056\nEinreichung neuer Dokumente\n\nALDI Bayern-Nordost Verwaltungs-SE\nEuropäische Aktiengesellschaft (SE)\nAdelsdorf\n\nDem Amtsgericht Fürth -Registergericht- ist eine Liste der Mitglieder des Aufsichtsrats eingereicht worden, Art. 9 Abs. 1 Buchst. c (ii) SE-VO i.V.m. § 106 AktG."
    },
    {
      "date": "2024-11-19",
      "original_text": "Einreichung neuer Dokumente\nNordrhein-Westfalen Amtsgericht Mönchengladbach HRB 19416\nALDI Niederrhein Verwaltungs-SE – Mönchengladbach",
      "type": "Einreichung neuer Dokumente",
      "state": "Nordrhein-Westfalen",
      "amtsgericht": "Amtsgericht Mönchengladbach",
      "registernummer": "HRB 19416",
      "registerart": "HRB",
      "company_name": "ALDI Niederrhein Verwaltungs-SE",
      "company_seat": "Mönchengladbach",
      "details": "19.11.2024 (Bekanntmachungsdatum)\n\nNordrhein-Westfalen Amtsgericht Mönchengladbach HRB 19416\nEinreichung neuer Dokumente\n\nALDI Niederrhein Verwaltungs-SE\nEuropäische Aktiengesellschaft (SE)\nMönchengladbach\n\nDem Registergericht ist eine neue Liste der Mitglieder des Aufsichtsrates eingereicht worden."
    },
    {
      "date": "2024-11-19",
      "original_text": "Registerbekanntmachung nach dem Umwandlungsgesetz\nRheinland-Pfalz Amtsgericht Koblenz HRB 24702\nASSFINET GmbH – Grafschaft",
      "type": "Registerbekanntmachung nach dem Umwandlungsgesetz",
      "state": "Rheinland-Pfalz",
      "amtsgericht": "Amtsgericht Koblenz",
      "registernummer": "HRB 24702",
      "registerart": "HRB",
      "company_name": "ASSFINET GmbH",
      "company_seat": "Grafschaft",
      "details": "19.11.2024 (Bekanntmachungsdatum)\n\nRheinland-Pfalz Amtsgericht Koblenz HRB 24702\nRegisterbekanntmachung nach dem Umwandlungsgesetz 19.11.2024 (Eintragungsdatum)\n\nASSFINET GmbH\nGesellschaft mit beschränkter Haftung\nGrafschaft\n\nAls nicht eingetragen wird veröffentlicht: Den Gläubigern der an der Verschmelzung beteiligten Rechtsträger ist, wenn sie binnen sechs Monaten nach dem Tag, an dem die Eintragung der Verschmelzung in das Register des Sitzes desjenigen Rechtsträgers,dessen Gläubiger sie sind, nach § 19 Abs. 3 UmwG als bekannt gemacht gilt, ihren Anspruch nach Grund und Höhe schriftlich anmelden, Sicherheit zu leisten, soweit sie nicht Befriedigung verlangen können. Dieses Recht steht den Gläubigern jedoch nur zu, wenn sie glaubhaft machen, dass durch die Verschmelzung die Erfüllungd er Forderung gefährdet wird."
    },
    {
      "date": "2024-11-19",
      "original_text": "Löschungsankündigung\nHessen Amtsgericht Darmstadt HRB 92732\nAabau GmbH – Groß-Gerau",
      "type": "Löschungsankündigung",
      "state": "Hessen",
      "amtsgericht": "Amtsgericht Darmstadt",
      "registernummer": "HRB 92732",
      "registerart": "HRB",
      "company_name": "Aabau GmbH",
      "company_seat": "Groß-Gerau",
      "details": "19.11.2024 (Bekanntmachungsdatum)\n\nHessen Amtsgericht Darmstadt HRB 92732\nLöschungsankündigung\n\nAabau GmbH\nGesellschaft mit beschränkter Haftung\nGroß-Gerau\n\nDas Registergericht beabsichtigt die im Handelsregister eingetragene Gesellschaft von Amts wegen nach § 394 FamFG zu löschen. Die Frist zur Erhebung eines Widerspruchs gegen die beabsichtigte Löschung wird auf 3 Monate festgesetzt."
    },
    {
      "date": "2024-11-19",
      "original_text": "Registerbekanntmachung nach dem Umwandlungsgesetz\nBaden-Württemberg Amtsgericht Stuttgart HRA 741511\nAjdnik Versicherungsmakler GmbH & Co. KG – Albstadt",
      "type": "Registerbekanntmachung nach dem Umwandlungsgesetz",
      "state": "Baden-Württemberg",
      "amtsgericht": "Amtsgericht Stuttgart",
      "registernummer": "HRA 741511",
      "registerart": "HRA",
      "company_name": "Ajdnik Versicherungsmakler GmbH & Co. KG",
      "company_seat": "Albstadt",
      "details": "19.11.2024 (Bekanntmachungsdatum)\n\nBaden-Württemberg Amtsgericht Stuttgart HRA 741511\nRegisterbekanntmachung nach dem Umwandlungsgesetz 19.11.2024 (Eintragungsdatum)\n\nAjdnik Versicherungsmakler GmbH & Co. KG\nKommanditgesellschaft\nAlbstadt\n\nAls nicht eingetragen wird bekanntgemacht:\nDen Gläubigern der an der Ausgliederung beteiligten Rechtsträger ist, wenn sie binnen sechs Monaten nach dem Tag, an dem die Eintragung der Ausgliederung in das Register des Sitzes desjenigen Rechtsträgers, dessen Gläubiger sie sind, nach § 19 Abs. 3 UmwG als bekanntgemacht gilt, ihren Anspruch nach Grund und Höhe schriftlich anmelden, Sicherheit zu leisten, soweit sie nicht Befriedigung verlangen können. Dieses Recht steht den Gläubigern jedoch nur zu, wenn sie glaubhaft machen, dass durch die Ausgliederung die Erfüllung ihrer Forderung gefährdet wird."
    },
    {
      "date": "2024-11-19",
      "original_text": "Löschungsankündigung\nNordrhein-Westfalen Amtsgericht Dortmund HRB 26398\nAllgemeines Netzwerk für Ingenieure und Architekten GmbH – Dortmund",
      "type": "Löschungsankündigung",
      "state": "Nordrhein-Westfalen",
      "amtsgericht": "Amtsgericht Dortmund",
      "registernummer": "HRB 26398",
      "registerart": "HRB",
      "company_name": "Allgemeines Netzwerk für Ingenieure und Architekten GmbH",
      "company_seat": "Dortmund",
      "details": "19.11.2024 (Bekanntmachungsdatum)\n\nNordrhein-Westfalen Amtsgericht Dortmund HRB 26398\nLöschungsankündigung 19.11.2024 (Eintragungsdatum)\n\nAllgemeines Netzwerk für Ingenieure und Architekten GmbH\nGesellschaft mit beschränkter Haftung\nDortmund\n\nDas Registergericht beabsichtigt die Gesellschaft von Amts wegen nach § 394 FamFG zu löschen. Die Frist zur Erhebung eines Widerspruchs ist auf zwei Monate festgesetzt."
    },
    {
      "date": "2024-11-19",
      "original_text": "Einreichung neuer Dokumente\nBaden-Württemberg Amtsgericht Freiburg HRB 541022\nAmcor Flexibles Singen GmbH – Singen Hohentwiel",
      "type": "Einreichung neuer Dokumente",
      "state": "Baden-Württemberg",
      "amtsgericht": "Amtsgericht Freiburg",
      "registernummer": "HRB 541022",
      "registerart": "HRB",
      "company_name": "Amcor Flexibles Singen GmbH",
      "company_seat": "Singen Hohentwiel",
      "details": "19.11.2024 (Bekanntmachungsdatum)\n\nBaden-Württemberg Amtsgericht Freiburg HRB 541022\nEinreichung neuer Dokumente\n\nAmcor Flexibles Singen GmbH\nGesellschaft mit beschränkter Haftung\nSingen Hohentwiel\n\nDie Gesellschaft hat am 15.11.2024 die Liste über die Zusammensetzung des Aufsichtsrats zum Handelsregister eingereicht."
    },
    {
      "date": "2024-11-19",
      "original_text": "Löschungsankündigung\nRheinland-Pfalz Amtsgericht Landau HRB 33253\nAmoria UG (haftungsbeschränkt) – Dörrenbach",
      "type": "Löschungsankündigung",
      "state": "Rheinland-Pfalz",
      "amtsgericht": "Amtsgericht Landau",
      "registernummer": "HRB 33253",
      "registerart": "HRB",
      "company_name": "Amoria UG (haftungsbeschränkt)",
      "company_seat": "Dörrenbach",
      "details": "19.11.2024 (Bekanntmachungsdatum)\n\nRheinland-Pfalz Amtsgericht Landau HRB 33253\nLöschungsankündigung\n\nAmoria UG (haftungsbeschränkt)\nGesellschaft mit beschränkter Haftung\nDörrenbach\n\nDas Registergericht beabsichtigt die Gesellschaft von Amts wegen nach § 394 FamFG zu löschen. Die Frist zur Erhebung eines Widerspruchs ist auf einen Monat festgesetzt."
    },
    {
      "date": "2024-11-19",
      "original_text": "Einreichung neuer Dokumente\nSachsen Amtsgericht Chemnitz HRB 23231\nAnlagenprüforganisation Geopohl AG – Chemnitz",
      "type": "Einreichung neuer Dokumente",
      "state": "Sachsen",
      "amtsgericht": "Amtsgericht Chemnitz",
      "registernummer": "HRB 23231",
      "registerart": "HRB",
      "company_name": "Anlagenprüforganisation Geopohl AG",
      "company_seat": "Chemnitz",
      "details": "19.11.2024 (Bekanntmachungsdatum)\n\nSachsen Amtsgericht Chemnitz HRB 23231\nEinreichung neuer Dokumente 19.11.2024 (Eintragungsdatum)\n\nAnlagenprüforganisation Geopohl AG\nAktiengesellschaft\nChemnitz\n\nAm 09.09.2024 wurde beim Handelsregister des Amtsgerichts Chemnitz die Liste der Mitglieder des Aufsichtsrats gemäß § 106 AktG eingereicht."
    },
    {
      "date": "2024-11-19",
      "original_text": "Registerbekanntmachung nach dem Umwandlungsgesetz\nBayern Amtsgericht München HRB 99992\nArt of Travel GmbH – München",
      "type": "Registerbekanntmachung nach dem Umwandlungsgesetz",
      "state": "Bayern",
      "amtsgericht": "Amtsgericht München",
      "registernummer": "HRB 99992",
      "registerart": "HRB",
      "company_name": "Art of Travel GmbH",
      "company_seat": "München",
      "details": "19.11.2024 (Bekanntmachungsdatum)\n\nBayern Amtsgericht München HRB 99992\nRegisterbekanntmachung nach dem Umwandlungsgesetz 18.11.2024 (Eintragungsdatum)\n\nArt of Travel GmbH\nGesellschaft mit beschränkter Haftung\nMünchen\n\nDen Gläubigern der an der Verschmelzung beteiligten Rechtsträger ist, wenn sie binnen sechs Monaten nach dem Tag, an dem die Eintragung der Verschmelzung in das Register des Sitzes desjenigen Rechtsträgers, dessen Gläubiger sie sind, nach § 19 Abs. 3 UmwG als bekannt gemacht gilt, ihren Anspruch nach Grund und Höhe schriftlich anmelden, Sicherheit zu leisten, soweit sie nicht Befriedigung verlangen können. Dieses Recht steht den Gläubigern jedoch nur zu, wenn sie glaubhaft machen, dass durch die Verschmelzung die Erfüllung ihrer Forderung gefährdet wird."
    },
    {
      "date": "2024-11-19",
      "original_text": "Registerbekanntmachung nach dem Umwandlungsgesetz\nBayern Amtsgericht München HRB 295901\nAssetFactory 24 GmbH – Tutzing",
      "type": "Registerbekanntmachung nach dem Umwandlungsgesetz",
      "state": "Bayern",
      "amtsgericht": "Amtsgericht München",
      "registernummer": "HRB 295901",
      "registerart": "HRB",
      "company_name": "AssetFactory 24 GmbH",
      "company_seat": "Tutzing",
      "details": "19.11.2024 (Bekanntmachungsdatum)\n\nBayern Amtsgericht München HRB 295901\nRegisterbekanntmachung nach dem Umwandlungsgesetz 18.11.2024 (Eintragungsdatum)\n\nAssetFactory 24 GmbH\nGesellschaft mit beschränkter Haftung\nTutzing\n\nDen Gläubigern des formwechselnden Rechtsträgers ist, wenn sie binnen sechs Monaten nach dem Tag, an dem die Eintragung des Formwechsels nach § 201 UmwG als bekannt gemacht gilt, ihren Anspruch nach Grund und Höhe schriftlich anmelden, Sicherheit zu leisten, soweit sie nicht Befriedigung verlangen können. Dieses Recht steht den Gläubigern jedoch nur zu, wenn sie glaubhaft machen, dass durch den Formwechsel die Erfüllung ihrer Forderung gefährdet wird."
    },
    {
      "date": "2024-11-19",
      "original_text": "Löschungsankündigung\nBayern Amtsgericht Augsburg HRB 36838\nAtaks GmbH – Augsburg",
      "type": "Löschungsankündigung",
      "state": "Bayern",
      "amtsgericht": "Amtsgericht Augsburg",
      "registernummer": "HRB 36838",
      "registerart": "HRB",
      "company_name": "Ataks GmbH",
      "company_seat": "Augsburg",
      "details": "19.11.2024 (Bekanntmachungsdatum)\n\nBayern Amtsgericht Augsburg HRB 36838\nLöschungsankündigung\n\nAtaks GmbH\nGesellschaft mit beschränkter Haftung\nAugsburg\n\nDas Registergericht beabsichtigt, die im Handelsregister eingetragene Gesellschaft wegen Vermögenslosigkeit von Amts wegen nach § 394 FamFG zu löschen. Die Frist zur Erhebung eines Widerspruchs ist auf einen Monat festgesetzt."
    },
    {
      "date": "2024-11-19",
      "original_text": "Einreichung neuer Dokumente\nBayern Amtsgericht München HRB 181570\nAuctus Capital Partners AG – München",
      "type": "Einreichung neuer Dokumente",
      "state": "Bayern",
      "amtsgericht": "Amtsgericht München",
      "registernummer": "HRB 181570",
      "registerart": "HRB",
      "company_name": "Auctus Capital Partners AG",
      "company_seat": "München",
      "details": "19.11.2024 (Bekanntmachungsdatum)\n\nBayern Amtsgericht München HRB 181570\nEinreichung neuer Dokumente\n\nAuctus Capital Partners AG\nAktiengesellschaft\nMünchen\n\nDem Amtsgericht München -Registergericht- ist eine Liste der Mitglieder des Aufsichtsrats eingereicht worden, § 106 AktG."
    },
    {
      "date": "2024-11-19",
      "original_text": "Einreichung neuer Dokumente\nMecklenburg-Vorpommern Amtsgericht Neubrandenburg HRB 15695 früher Amtsgericht Stralsund\nA|R|E - AG Anklamer Regional-Investitions Aktiengesellschaft – Anklam",
      "type": "Einreichung neuer Dokumente",
      "state": "Mecklenburg-Vorpommern",
      "amtsgericht": "Amtsgericht Neubrandenburg",
      "registernummer": "HRB 15695",
      "registerart": "HRB",
      "company_name": "A|R|E - AG Anklamer Regional-Investitions Aktiengesellschaft",
      "company_seat": "Anklam",
      "former_amtsgericht": "Stralsund",
      "details": "19.11.2024 (Bekanntmachungsdatum)\n\nMecklenburg-Vorpommern Amtsgericht Neubrandenburg HRB 15695 früher Amtsgericht Stralsund\nEinreichung neuer Dokumente\n\nA|R|E - AG Anklamer Regional-Investitions Aktiengesellschaft\nAktiengesellschaft\nAnklam\n\nEine Liste der Mitglieder des Aufsichtsrats ist zum Handelsregister eingereicht worden."
    },
    {
      "date": "2024-11-19",
      "original_text": "Löschungsankündigung\nBayern Amtsgericht München HRB 225492\nBA Gastronomie GmbH – München",
      "type": "Löschungsankündigung",
      "state": "Bayern",
      "amtsgericht": "Amtsgericht München",
      "registernummer": "HRB 225492",
      "registerart": "HRB",
      "company_name": "BA Gastronomie GmbH",
      "company_seat": "München",
      "details": "19.11.2024 (Bekanntmachungsdatum)\n\nBayern Amtsgericht München HRB 225492\nLöschungsankündigung\n\nBA Gastronomie GmbH\nGesellschaft mit beschränkter Haftung\nMünchen\n\nDas Registergericht beabsichtigt, die im Handelsregister eingetragene Gesellschaft wegen Vermögenslosigkeit von Amts wegen nach § 394 FamFG zu löschen. Die Frist zur Erhebung eines Widerspruchs ist auf drei Monate festgesetzt."
    },
    {
      "date": "2024-11-19",
      "original_text": "Registerbekanntmachung nach dem Umwandlungsgesetz\nNiedersachsen Amtsgericht Walsrode HRB 208353\nBARBAU GmbH – Barnstorf",
      "type": "Registerbekanntmachung nach dem Umwandlungsgesetz",
      "state": "Niedersachsen",
      "amtsgericht": "Amtsgericht Walsrode",
      "registernummer": "HRB 208353",
      "registerart": "HRB",
      "company_name": "BARBAU GmbH",
      "company_seat": "Barnstorf",
      "details": "19.11.2024 (Bekanntmachungsdatum)\n\nNiedersachsen Amtsgericht Walsrode HRB 208353\nRegisterbekanntmachung nach dem Umwandlungsgesetz 19.11.2024 (Eintragungsdatum)\n\nBARBAU GmbH\nGesellschaft mit beschränkter Haftung\nBarnstorf\n\nDen Gläubigern der an der Verschmelzung beteiligten Rechtsträger ist, wenn sie binnen sechs Monaten nach dem Tag, an dem die Eintragung der Verschmelzung in das Register des Sitzes desjenigen Rechtsträgers, dessen Gläubiger sie sind, nach § 19  Abs.  3 UmwG als bekannt gemacht gilt, ihren Anspruch nach Grund und Höhe schriftlich anmelden, Sicherheit zu leisten, soweit sie nicht Befriedigung verlangen können. Dieses Recht steht den Gläubigern jedoch nur zu, wenn sie glaubhaft machen, dass durch die Verschmelzung die Erfüllung der Forderung gefährdet wird."
    },
    {
      "date": "2024-11-19",
      "original_text": "Löschungsankündigung\nNordrhein-Westfalen Amtsgericht Duisburg HRB 31556\nBMK GmbH – Oberhausen",
      "type": "Löschungsankündigung",
      "state": "Nordrhein-Westfalen",
      "amtsgericht": "Amtsgericht Duisburg",
      "registernummer": "HRB 31556",
      "registerart": "HRB",
      "company_name": "BMK GmbH",
      "company_seat": "Oberhausen",
      "details": "19.11.2024 (Bekanntmachungsdatum)\n\nNordrhein-Westfalen Amtsgericht Duisburg HRB 31556\nLöschungsankündigung\n\nBMK GmbH\nGesellschaft mit beschränkter Haftung\nOberhausen\n\nDas Registergericht beabsichtigt, die im Handelsregister Duisburg unter HRB 31556 eingetragene Gesellschaft BMK Oberhausen, Elsässer Str. 26, 46045 Oberhausen mit Sitz in Oberhausen gemäß § 394 Absatz 1 FamFG wegen Vermögenslosigkeit von Amts wegen zu löschen. Gegen diese Verfügung kann Widerspruch eingelegt werden. Die Frist zur Erhebung eines Widerspruchs gegen die beabsichtigte Löschung von Amts wegen ist auf drei Monate festgesetzt. Rechtsbehelfsbelehrung Der Widerspruch ist bei dem Amtsgericht Duisburg, Kardinal-Galen-Str. 124-132, 47058 Duisburg schriftlich in deutscher Sprache oder zur Niederschrift der Geschäftsstelle einzulegen. Der Widerspruch kann auch zur Niederschrift der Geschäftsstelle eines jeden Amtsgerichtes abgegeben werden. Die Einlegung ist auch durch Übertragung eines elektronischen Dokuments an die elektronische Poststelle des Gerichts möglich. Das elektronische Dokument muss für die Bearbeitung durch das Gericht geeignet und mit einer qualifizierten elektronischen Signatur der verantwortenden Person versehen sein oder von der verantwortenden Person signiert und auf einem sicheren Übermittlungsweg gemäß § 130 a ZPO nach näherer Maßgabe der Verordnung über die technischen Rahmenbedingungen des elektronischen Rechtsverkehrs und über das besondere elektronische Behördenpostfach (BGBl. I, S. 3803) eingereicht werden. Weitere Informationen erhalten Sie auf der Internetseite www.justiz.de <http://www.justiz.de>. Der Widerspruch muss spätestens innerhalb der gesetzten Frist bei dem Amtsgericht Duisburg eingegangen sein. Dies gilt auch dann, wenn der Widerspruch zur Niederschrift der Geschäftsstelle eines anderen Amtsgerichtes abgegeben wurde. Die Frist beginnt mit der Veröffentlichung. Fällt das Ende der Frist auf einen Sonntag, einen allgemeinen Feiertag oder Sonnabend, so endet die Frist mit Ablauf des nächsten Werktages. Der Widerspruch muss die Bezeichnung der angefochtenen Verfügung sowie die Erklärung enthalten, dass Widerspruch gegen diese Verfügung eingelegt wird. Er ist zu unterzeichnen und soll begründet werden."
    },
    {
      "date": "2024-11-19",
      "original_text": "Registerbekanntmachung nach dem Umwandlungsgesetz\nBayern Amtsgericht Fürth HRB 19651\nBMP Managementgesellschaft für Beschaffungsmarketing, Materialwirtschaft und Personal mbH – Veitsbronn",
      "type": "Registerbekanntmachung nach dem Umwandlungsgesetz",
      "state": "Bayern",
      "amtsgericht": "Amtsgericht Fürth",
      "registernummer": "HRB 19651",
      "registerart": "HRB",
      "company_name": "BMP Managementgesellschaft für Beschaffungsmarketing, Materialwirtschaft und Personal mbH",
      "company_seat": "Veitsbronn",
      "details": "19.11.2024 (Bekanntmachungsdatum)\n\nBayern Amtsgericht Fürth HRB 19651\nRegisterbekanntmachung nach dem Umwandlungsgesetz 15.11.2024 (Eintragungsdatum)\n\nBMP Managementgesellschaft für Beschaffungsmarketing, Materialwirtschaft und Personal mbH\nGesellschaft mit beschränkter Haftung\nVeitsbronn\n\nDen Gläubigern der an der Verschmelzung beteiligten Rechtsträger ist, wenn sie binnen sechs Monaten nach dem Tag, an dem die Eintragung der Verschmelzung in das Register des Sitzes desjenigen Rechtsträgers, dessen Gläubiger sie sind, nach § 19 Abs. 3 UmwG als bekannt gemacht gilt, ihren Anspruch nach Grund und Höhe schriftlich anmelden, Sicherheit zu leisten, soweit sie nicht Befriedigung verlangen können. Dieses Recht steht den Gläubigern jedoch nur zu, wenn sie glaubhaft machen, dass durch die Verschmelzung die Erfüllung ihrer Forderung gefährdet wird."
    },
    {
      "date": "2024-11-19",
      "original_text": "Löschungsankündigung\nBaden-Württemberg Amtsgericht Mannheim HRB 732586\nBalendu Ventures UG (haftungsbeschränkt) – Heidelberg",
      "type": "Löschungsankündigung",
      "state": "Baden-Württemberg",
      "amtsgericht": "Amtsgericht Mannheim",
      "registernummer": "HRB 732586",
      "registerart": "HRB",
      "company_name": "Balendu Ventures UG (haftungsbeschränkt)",
      "company_seat": "Heidelberg",
      "details": "19.11.2024 (Bekanntmachungsdatum)\n\nBaden-Württemberg Amtsgericht Mannheim HRB 732586\nLöschungsankündigung\n\nBalendu Ventures UG (haftungsbeschränkt)\nGesellschaft mit beschränkter Haftung\nHeidelberg\n\nDas Gericht beabsichtigt, die Gesellschaft wegen Vermögenslosigkeit im Handelsregister von Amts wegen nach § 394 FamFG zu löschen. Die Frist zur Geltendmachung eines Widerspruchs gegen die beabsichtigte Löschung ist auf einen Monat ab Veröffentlichung bestimmt."
    },
    {
      "date": "2024-11-19",
      "original_text": "Registerbekanntmachung nach dem Umwandlungsgesetz\nNordrhein-Westfalen Amtsgericht Coesfeld HRB 5259\nBauer GmbH – Südlohn",
      "type": "Registerbekanntmachung nach dem Umwandlungsgesetz",
      "state": "Nordrhein-Westfalen",
      "amtsgericht": "Amtsgericht Coesfeld",
      "registernummer": "HRB 5259",
      "registerart": "HRB",
      "company_name": "Bauer GmbH",
      "company_seat": "Südlohn",
      "details": "19.11.2024 (Bekanntmachungsdatum)\n\nNordrhein-Westfalen Amtsgericht Coesfeld HRB 5259\nRegisterbekanntmachung nach dem Umwandlungsgesetz 19.11.2024 (Eintragungsdatum)\n\nBauer GmbH\nGesellschaft mit beschränkter Haftung\nSüdlohn\n\nDen Gläubigern der an der Verschmelzung beteiligten Rechtsträger ist, wenn sie binnen sechs Monaten nach dem Tag, an dem die Eintragung der Verschmelzung in das Register des Sitzes derjenigen Rechtsträger deren Gläubiger sie sind, nach § 19 Absatz 3 UmwG als bekanntgemacht gilt, ihren Anspruch nach Grund und Höhe schriftlich anmelden, Sicherheit zu leisten, soweit sie nicht Befriedigung verlangen können. Dieses Recht steht den Gläubigern jedoch nur zu, wenn sie glaubhaft machen, dass durch die Verschmelzung die Erfüllung ihrer Forderung gefährdet wird."
    },
    {
      "date": "2024-11-19",
      "original_text": "Einreichung neuer Dokumente\nBayern Amtsgericht München HRB 264823\nBayWa r.e. AG – München",
      "type": "Einreichung neuer Dokumente",
      "state": "Bayern",
      "amtsgericht": "Amtsgericht München",
      "registernummer": "HRB 264823",
      "registerart": "HRB",
      "company_name": "BayWa r.e. AG",
      "company_seat": "München",
      "details": "19.11.2024 (Bekanntmachungsdatum)\n\nBayern Amtsgericht München HRB 264823\nEinreichung neuer Dokumente 18.11.2024 (Eintragungsdatum)\n\nBayWa r.e. AG\nAktiengesellschaft\nMünchen\n\nDem Amtsgericht München -Registergericht- ist eine Liste der Mitglieder des Aufsichtsrats eingereicht worden, § 106 AktG."
    },
    {
      "date": "2024-11-19",
      "original_text": "Registerbekanntmachung nach dem Umwandlungsgesetz\nSachsen-Anhalt Amtsgericht Stendal HRB 202365\nBecker + Reichelt GmbH – Halle (Saale)",
      "type": "Registerbekanntmachung nach dem Umwandlungsgesetz",
      "state": "Sachsen-Anhalt",
      "amtsgericht": "Amtsgericht Stendal",
      "registernummer": "HRB 202365",
      "registerart": "HRB",
      "company_name": "Becker + Reichelt GmbH",
      "company_seat": "Halle (Saale)",
      "details": "19.11.2024 (Bekanntmachungsdatum)\n\nSachsen-Anhalt Amtsgericht Stendal HRB 202365\nRegisterbekanntmachung nach dem Umwandlungsgesetz 19.11.2024 (Eintragungsdatum)\n\nBecker + Reichelt GmbH\nGesellschaft mit beschränkter Haftung\nHalle (Saale)\n\nNicht eingetragen:\nDen Gläubigern der an der Ausgliederung beteiligten Rechtsträger, ist wenn sie binnen sechs Monaten nach dem Tag, an dem die Eintragung der Ausgliederung nach §§125, 19 Abs. 3 UmwG als bekanntgemacht gilt, ihren Anspruch nach Grund und Höhe schriftlich anmelden, Sicherheit zu leisten, soweit sie nicht Befriedigung verlangen können. Diese Recht steht ihnen jedoch nur zu, wenn sie glaubhaft machen, dass durch die Ausgliederung die Erfüllung ihrer Forderung gefährdet wird."
    },
    {
      "date": "2024-11-19",
      "original_text": "Löschungsankündigung\nSchleswig-Holstein Amtsgericht Lübeck HRB 3065 RE\nBeckmann Aggregate Service GmbH – Reinbek",
      "type": "Löschungsankündigung",
      "state": "Schleswig-Holstein",
      "amtsgericht": "Amtsgericht Lübeck",
      "registernummer": "HRB 3065 RE",
      "registerart": "HRB",
      "company_name": "Beckmann Aggregate Service GmbH",
      "company_seat": "Reinbek",
      "details": "19.11.2024 (Bekanntmachungsdatum)\n\nSchleswig-Holstein Amtsgericht Lübeck HRB 3065 RE\nLöschungsankündigung\n\nBeckmann Aggregate Service GmbH\nGesellschaft mit beschränkter Haftung\nReinbek\n\nEs ist die Löschung der nachstehenden Gesellschaft wegen Vermögenslosigkeit gemäß § 394 FamFG beabsichtigt.\nWiderspruchsfrist: 1 Monat"
    },
    {
      "date": "2024-11-19",
      "original_text": "Registerbekanntmachung nach dem Umwandlungsgesetz\nNordrhein-Westfalen Amtsgericht Coesfeld HRB 16936\nBergerbusch Pulverbeschichtungen GmbH – Stadtlohn",
      "type": "Registerbekanntmachung nach dem Umwandlungsgesetz",
      "state": "Nordrhein-Westfalen",
      "amtsgericht": "Amtsgericht Coesfeld",
      "registernummer": "HRB 16936",
      "registerart": "HRB",
      "company_name": "Bergerbusch Pulverbeschichtungen GmbH",
      "company_seat": "Stadtlohn",
      "details": "19.11.2024 (Bekanntmachungsdatum)\n\nNordrhein-Westfalen Amtsgericht Coesfeld HRB 16936\nRegisterbekanntmachung nach dem Umwandlungsgesetz 19.11.2024 (Eintragungsdatum)\n\nBergerbusch Pulverbeschichtungen GmbH\nGesellschaft mit beschränkter Haftung\nStadtlohn\n\nDen Gläubigern der an der Verschmelzung beteiligten Rechtsträger ist, wenn sie binnen sechs Monaten nach dem Tag, an dem die Eintragung der Verschmelzung in das Register des Sitzes derjenigen Rechtsträger deren Gläubiger sie sind, nach § 19 Absatz 3 UmwG als bekanntgemacht gilt, ihren Anspruch nach Grund und Höhe schriftlich anmelden, Sicherheit zu leisten, soweit sie nicht Befriedigung verlangen können. Dieses Recht steht den Gläubigern jedoch nur zu, wenn sie glaubhaft machen, dass durch die Verschmelzung die Erfüllung ihrer Forderung gefährdet wird."
    },
    {
      "date": "2024-11-19",
      "original_text": "Registerbekanntmachung nach dem Umwandlungsgesetz\nBayern Amtsgericht Traunstein HRB 28709\nBilfinger Industrial Services Germany GmbH – Burghausen",
      "type": "Registerbekanntmachung nach dem Umwandlungsgesetz",
      "state": "Bayern",
      "amtsgericht": "Amtsgericht Traunstein",
      "registernummer": "HRB 28709",
      "registerart": "HRB",
      "company_name": "Bilfinger Industrial Services Germany GmbH",
      "company_seat": "Burghausen",
      "details": "19.11.2024 (Bekanntmachungsdatum)\n\nBayern Amtsgericht Traunstein HRB 28709\nRegisterbekanntmachung nach dem Umwandlungsgesetz 05.09.2024 (Eintragungsdatum)\n\nBilfinger Industrial Services Germany GmbH\nGesellschaft mit beschränkter Haftung\nBurghausen\n\nDen Gläubigern der an der Verschmelzung beteiligten Rechtsträger ist, wenn sie binnen sechs Monaten nach dem Tag, an dem die Eintragung der Verschmelzung in das Register des Sitzes desjenigen Rechtsträgers, dessen Gläubiger sie sind, nach § 19 Abs. 3 UmwG als bekannt gemacht gilt, ihren Anspruch nach Grund und Höhe schriftlich anmelden, Sicherheit zu leisten, soweit sie nicht Befriedigung verlangen können. Dieses Recht steht den Gläubigern jedoch nur zu, wenn sie glaubhaft machen, dass durch die Verschmelzung die Erfüllung ihrer Forderung gefährdet wird."
    },
    {
      "date": "2024-11-19",
      "original_text": "Einreichung neuer Dokumente\nBremen Amtsgericht Bremen HRB 3338\nBremer Industrie - Haus Gesellschaft mit beschränkter Haftung – Bremen",
      "type": "Einreichung neuer Dokumente",
      "state": "Bremen",
      "amtsgericht": "Amtsgericht Bremen",
      "registernummer": "HRB 3338",
      "registerart": "HRB",
      "company_name": "Bremer Industrie - Haus Gesellschaft mit beschränkter Haftung",
      "company_seat": "Bremen",
      "details": "19.11.2024 (Bekanntmachungsdatum)\n\nBremen Amtsgericht Bremen HRB 3338\nEinreichung neuer Dokumente\n\nBremer Industrie - Haus Gesellschaft mit beschränkter Haftung\nGesellschaft mit beschränkter Haftung\nBremen\n\nAls nicht eingetragen wird veröffentlicht: Liste des Aufsichtsrats wurde eingereicht."
    },
    {
      "date": "2024-11-19",
      "original_text": "Löschungsankündigung\nNiedersachsen Amtsgericht Hildesheim HRB 205455\nC & B Baudienstleistungen UG (haftungsbeschränkt) – Hildesheim",
      "type": "Löschungsankündigung",
      "state": "Niedersachsen",
      "amtsgericht": "Amtsgericht Hildesheim",
      "registernummer": "HRB 205455",
      "registerart": "HRB",
      "company_name": "C & B Baudienstleistungen UG (haftungsbeschränkt)",
      "company_seat": "Hildesheim",
      "details": "19.11.2024 (Bekanntmachungsdatum)\n\nNiedersachsen Amtsgericht Hildesheim HRB 205455\nLöschungsankündigung\n\nC & B Baudienstleistungen UG (haftungsbeschränkt)\nGesellschaft mit beschränkter Haftung\nHildesheim\n\nDas Registergericht beabsichtigt, die Gesellschaft von Amts wegen nach § 394 FamFG zu löschen. Die Frist zur Erhebung eines Widerspruchs ist auf 1 Monat ab dieser Registerbekanntmachung festgesetzt."
    },
    {
      "date": "2024-11-19",
      "original_text": "Einreichung neuer Dokumente\nBerlin Amtsgericht Berlin (Charlottenburg) HRB 111483\nCBE DIGIDEN AG – Berlin",
      "type": "Einreichung neuer Dokumente",
      "state": "Berlin",
      "amtsgericht": "Amtsgericht Berlin (Charlottenburg)",
      "registernummer": "HRB 111483",
      "registerart": "HRB",
      "company_name": "CBE DIGIDEN AG",
      "company_seat": "Berlin",
      "details": "19.11.2024 (Bekanntmachungsdatum)\n\nBerlin Amtsgericht Berlin (Charlottenburg) HRB 111483\nEinreichung neuer Dokumente\n\nCBE DIGIDEN AG\nAktiengesellschaft\nBerlin\n\nAls nicht eingetragen wird veröffentlicht: Es wurde eine neue Liste der Aufsichtsratsmitglieder eingereicht (§ 106 AktG)."
    },
    {
      "date": "2024-11-19",
      "original_text": "Löschungsankündigung\nBerlin Amtsgericht Berlin (Charlottenburg) HRB 250661\nCRT BAU UG (haftungsbeschränkt) – Berlin",
      "type": "Löschungsankündigung",
      "state": "Berlin",
      "amtsgericht": "Amtsgericht Berlin (Charlottenburg)",
      "registernummer": "HRB 250661",
      "registerart": "HRB",
      "company_name": "CRT BAU UG (haftungsbeschränkt)",
      "company_seat": "Berlin",
      "details": "19.11.2024 (Bekanntmachungsdatum)\n\nBerlin Amtsgericht Berlin (Charlottenburg) HRB 250661\nLöschungsankündigung\n\nCRT BAU UG (haftungsbeschränkt)\nGesellschaft mit beschränkter Haftung\nBerlin\n\nBei der nachstehenden Gesellschaft wird das Amtslöschungsverfahren gemäß § 394 FamFG eingeleitet. Widerspruchsfrist 6 Wochen"
    },
    {
      "date": "2024-11-19",
      "original_text": "Registerbekanntmachung nach dem Umwandlungsgesetz\nSaarland Amtsgericht Saarbrücken HRB 110555\nCafé Ausblick Verwaltungs GmbH – Saarlouis",
      "type": "Registerbekanntmachung nach dem Umwandlungsgesetz",
      "state": "Saarland",
      "amtsgericht": "Amtsgericht Saarbrücken",
      "registernummer": "HRB 110555",
      "registerart": "HRB",
      "company_name": "Café Ausblick Verwaltungs GmbH",
      "company_seat": "Saarlouis",
      "details": "19.11.2024 (Bekanntmachungsdatum)\n\nSaarland Amtsgericht Saarbrücken HRB 110555\nRegisterbekanntmachung nach dem Umwandlungsgesetz 18.11.2024 (Eintragungsdatum)\n\nCafé Ausblick Verwaltungs GmbH\nGesellschaft mit beschränkter Haftung\nSaarlouis\n\nAls nicht eingetragen wird bekannt gemacht: Den Gläubigern der an der Verschmelzung beteiligten Gesellschaften ist, wenn sie binnen sechs Monaten nach dem Tag, an dem die Eintragung der Verschmelzung in das Register des Sitzes desjenigen Rechtsträgers, dessen Gläubiger sie sind, nach § 19 Absatz 3 UmwG bekannt gemacht worden ist, ihren Anspruch nach Grund und Höhe schriftlich anmelden, Sicherheit zu leisten, soweit sie nicht Befriedigung verlangen können. Dieses Recht steht den Gläubigern jedoch nur zu, wenn sie glaubhaft machen, dass durch die Verschmelzung die Erfüllung ihrer Forderung gefährdet wird."
    },
    {
      "date": "2024-11-19",
      "original_text": "Registerbekanntmachung nach dem Umwandlungsgesetz\nNiedersachsen Amtsgericht Walsrode HRB 208138\nCamping World GmbH – Barnstorf",
      "type": "Registerbekanntmachung nach dem Umwandlungsgesetz",
      "state": "Niedersachsen",
      "amtsgericht": "Amtsgericht Walsrode",
      "registernummer": "HRB 208138",
      "registerart": "HRB",
      "company_name": "Camping World GmbH",
      "company_seat": "Barnstorf",
      "details": "19.11.2024 (Bekanntmachungsdatum)\n\nNiedersachsen Amtsgericht Walsrode HRB 208138\nRegisterbekanntmachung nach dem Umwandlungsgesetz 19.11.2024 (Eintragungsdatum)\n\nCamping World GmbH\nGesellschaft mit beschränkter Haftung\nBarnstorf\n\nDen Gläubigern der an der Verschmelzung beteiligten Rechtsträger ist, wenn sie binnen sechs Monaten nach dem Tag, an dem die Eintragung der Verschmelzung in das Register des Sitzes desjenigen Rechtsträgers, dessen Gläubiger sie sind, nach § 19  Abs.  3 UmwG als bekannt gemacht gilt, ihren Anspruch nach Grund und Höhe schriftlich anmelden, Sicherheit zu leisten, soweit sie nicht Befriedigung verlangen können. Dieses Recht steht den Gläubigern jedoch nur zu, wenn sie glaubhaft machen, dass durch die Verschmelzung die Erfüllung der Forderung gefährdet wird."
    },
    {
      "date": "2024-11-19",
      "original_text": "Registerbekanntmachung nach dem Umwandlungsgesetz\nNiedersachsen Amtsgericht Walsrode HRB 208128\nCamping World Holding GmbH – Barnstorf",
      "type": "Registerbekanntmachung nach dem Umwandlungsgesetz",
      "state": "Niedersachsen",
      "amtsgericht": "Amtsgericht Walsrode",
      "registernummer": "HRB 208128",
      "registerart": "HRB",
      "company_name": "Camping World Holding GmbH",
      "company_seat": "Barnstorf",
      "details": "19.11.2024 (Bekanntmachungsdatum)\n\nNiedersachsen Amtsgericht Walsrode HRB 208128\nRegisterbekanntmachung nach dem Umwandlungsgesetz 19.11.2024 (Eintragungsdatum)\n\nCamping World Holding GmbH\nGesellschaft mit beschränkter Haftung\nBarnstorf\n\nDen Gläubigern der an der Verschmelzung beteiligten Rechtsträger ist, wenn sie binnen sechs Monaten nach dem Tag, an dem die Eintragung der Verschmelzung in das Register des Sitzes desjenigen Rechtsträgers, dessen Gläubiger sie sind, nach § 19  Abs.  3 UmwG als bekannt gemacht gilt, ihren Anspruch nach Grund und Höhe schriftlich anmelden, Sicherheit zu leisten, soweit sie nicht Befriedigung verlangen können. Dieses Recht steht den Gläubigern jedoch nur zu, wenn sie glaubhaft machen, dass durch die Verschmelzung die Erfüllung der Forderung gefährdet wird."
    },
    {
      "date": "2024-11-19",
      "original_text": "Löschungsankündigung\nBaden-Württemberg Amtsgericht Stuttgart HRB 108118\nCelijus GmbH – Untergruppenbach",
      "type": "Löschungsankündigung",
      "state": "Baden-Württemberg",
      "amtsgericht": "Amtsgericht Stuttgart",
      "registernummer": "HRB 108118",
      "registerart": "HRB",
      "company_name": "Celijus GmbH",
      "company_seat": "Untergruppenbach",
      "details": "19.11.2024 (Bekanntmachungsdatum)\n\nBaden-Württemberg Amtsgericht Stuttgart HRB 108118\nLöschungsankündigung\n\nCelijus GmbH\nGesellschaft mit beschränkter Haftung\nUntergruppenbach\n\nDas Gericht beabsichtigt, die Gesellschaft wegen Vermögenslosigkeit im Handelsregister von Amts wegen nach § 394 FamFG zu löschen. Die Frist zur Geltendmachung eines Widerspruchs gegen die beabsichtigte Löschung ist auf zwei Monate ab Veröffentlichung bestimmt."
    },
    {
      "date": "2024-11-19",
      "original_text": "Löschungsankündigung\nHessen Amtsgericht Darmstadt HRB 97222\nDIG Bau GmbH – Viernheim",
      "type": "Löschungsankündigung",
      "state": "Hessen",
      "amtsgericht": "Amtsgericht Darmstadt",
      "registernummer": "HRB 97222",
      "registerart": "HRB",
      "company_name": "DIG Bau GmbH",
      "company_seat": "Viernheim",
      "details": "19.11.2024 (Bekanntmachungsdatum)\n\nHessen Amtsgericht Darmstadt HRB 97222\nLöschungsankündigung\n\nDIG Bau GmbH\nGesellschaft mit beschränkter Haftung\nViernheim\n\nDas Registergericht beabsichtigt die im Handelsregister eingetragene Gesellschaft von Amts wegen nach § 394 FamFG zu löschen. Die Frist zur Erhebung eines Widerspruchs gegen die beabsichtigte Löschung wird auf 3 Monate festgesetzt."
    },
    {
      "date": "2024-11-19",
      "original_text": "Einreichung neuer Dokumente\nHessen Amtsgericht Kassel HRB 14586\nDeutscher Wanderverband Service GmbH – Kassel",
      "type": "Einreichung neuer Dokumente",
      "state": "Hessen",
      "amtsgericht": "Amtsgericht Kassel",
      "registernummer": "HRB 14586",
      "registerart": "HRB",
      "company_name": "Deutscher Wanderverband Service GmbH",
      "company_seat": "Kassel",
      "details": "19.11.2024 (Bekanntmachungsdatum)\n\nHessen Amtsgericht Kassel HRB 14586\nEinreichung neuer Dokumente\n\nDeutscher Wanderverband Service GmbH\nGesellschaft mit beschränkter Haftung\nKassel\n\nDurch eine Änderung in den Personen der Aufsichtsratsmitglieder ist eine Liste der Mitglieder des Aufsichtsrates zum Handelsregister eingereicht worden."
    },
    {
      "date": "2024-11-19",
      "original_text": "Registerbekanntmachung nach dem Umwandlungsgesetz\nBayern Amtsgericht Ansbach HRB 8531\nDirk Langhammer Holding GmbH – Ansbach",
      "type": "Registerbekanntmachung nach dem Umwandlungsgesetz",
      "state": "Bayern",
      "amtsgericht": "Amtsgericht Ansbach",
      "registernummer": "HRB 8531",
      "registerart": "HRB",
      "company_name": "Dirk Langhammer Holding GmbH",
      "company_seat": "Ansbach",
      "details": "19.11.2024 (Bekanntmachungsdatum)\n\nBayern Amtsgericht Ansbach HRB 8531\nRegisterbekanntmachung nach dem Umwandlungsgesetz 15.11.2024 (Eintragungsdatum)\n\nDirk Langhammer Holding GmbH\nGesellschaft mit beschränkter Haftung\nAnsbach\n\nDen Gläubigern der an der Verschmelzung beteiligten Rechtsträger ist, wenn sie binnen sechs Monaten nach dem Tag, an dem die Eintragung der Verschmelzung in das Register des Sitzes desjenigen Rechtsträgers, dessen Gläubiger sie sind, nach § 19 Abs. 3 UmwG als bekannt gemacht gilt, ihren Anspruch nach Grund und Höhe schriftlich anmelden, Sicherheit zu leisten, soweit sie nicht Befriedigung verlangen können. Dieses Recht steht den Gläubigern jedoch nur zu, wenn sie glaubhaft machen, dass durch die Verschmelzung die Erfüllung ihrer Forderung gefährdet wird."
    },
    {
      "date": "2024-11-19",
      "original_text": "Löschungsankündigung\nNordrhein-Westfalen Amtsgericht Dortmund HRB 23330\nDortmunder Hochbau GmbH – Dortmund",
      "type": "Löschungsankündigung",
      "state": "Nordrhein-Westfalen",
      "amtsgericht": "Amtsgericht Dortmund",
      "registernummer": "HRB 23330",
      "registerart": "HRB",
      "company_name": "Dortmunder Hochbau GmbH",
      "company_seat": "Dortmund",
      "details": "19.11.2024 (Bekanntmachungsdatum)\n\nNordrhein-Westfalen Amtsgericht Dortmund HRB 23330\nLöschungsankündigung\n\nDortmunder Hochbau GmbH\nGesellschaft mit beschränkter Haftung\nDortmund"
    },
    {
      "date": "2024-11-19",
      "original_text": "Löschungsankündigung\nNordrhein-Westfalen Amtsgericht Düsseldorf HRB 99965\nE. & F. Brinkmann G.m.b.H. – Düsseldorf",
      "type": "Löschungsankündigung",
      "state": "Nordrhein-Westfalen",
      "amtsgericht": "Amtsgericht Düsseldorf",
      "registernummer": "HRB 99965",
      "registerart": "HRB",
      "company_name": "E. & F. Brinkmann G.m.b.H.",
      "company_seat": "Düsseldorf",
      "details": "19.11.2024 (Bekanntmachungsdatum)\n\nNordrhein-Westfalen Amtsgericht Düsseldorf HRB 99965\nLöschungsankündigung\n\nE. & F. Brinkmann G.m.b.H.\nGesellschaft mit beschränkter Haftung\nDüsseldorf\n\nBetr.: E. & F. Brinkmann G.m.b.H., Kaiserswerther Str. 215, 40474 Düsseldorf\n\nDas Registergericht beabsichtigt die Gesellschaft von Amts wegen nach § 394 FamFG zu löschen. Die Frist zur Erhebung eines Widerspruchs ist auf 3 Wochen festgesetzt.\n\nRechtsbehelfsbelehrung:\n\nDas Widerspruchsrecht steht jedem zu, der an der Unterlassung der Löschung ein berechtigtes Interesse hat. Der Widerspruch ist bei dem Amtsgericht Düsseldorf -Registergericht-, Werdener Straße 1, 40227 Düsseldorf schriftlich in deutscher Sprache oder zur Niederschrift der Geschäftsstelle einzulegen. Der Widerspruch kann auch zur Niederschrift der Geschäftsstelle eines jeden Amtsgerichtes abgegeben werden. Die Einlegung ist auch durch Übertragung eines elektronischen Dokuments an die elektronische Poststelle des Gerichts möglich. Das elektronische Dokument muss für die Bearbeitung durch das Gericht geeignet und mit einer qualifizierten elektronischen Signatur der verantwortenden Person versehen sein oder von der verantwortenden Person signiert und auf einem sicheren Übermittlungsweg gemäß § 130a ZPO nach näherer Maßgabe der Verordnung über die technischen Rahmenbedingungen des elektronischen Rechtsverkehrs und über das besondere elektronische Behördenpostfach (BGBl. I, S.3803) eingereicht werden. Weitere Informationen erhalten Sie auf der Internetseite www.justiz.de.\nDer Widerspruch muss spätestens innerhalb der gesetzten Frist nach dem Datum der Bekanntmachung der Löschungsankündigung bei dem Amtsgericht - Registergericht - Düsseldorf eingegangen sein.  Dies gilt auch dann, wenn der Widerspruch zur Niederschrift der Geschäftsstelle eines anderen Amtsgerichtes abgegeben wurde. Die Frist beginnt mit dem Tage der Bekanntmachung der Löschungsankündigung in dem für die Bekanntmachung der Eintragungen in das Handelsregister bestimmten elektronischen Informations- und Kommunikationssystem nach § 10 des Handelsgesetzbuches. Fällt das Ende der Frist auf einen Sonntag, einen allgemeinen Feiertag oder Sonnabend, so endet die Frist mit Ablauf des nächsten Werktages.\nDer Widerspruch muss die Bezeichnung der angefochtenen Löschungsankündigung sowie die Erklärung enthalten, dass Widerspruch gegen diese Löschungsankündigung eingelegt wird. Er ist zu unterzeichnen und soll begründet werden."
    },
    {
      "date": "2024-11-19",
      "original_text": "Löschungsankündigung\nNiedersachsen Amtsgericht Aurich HRB 205767\nEFG Edelstahlfertigung UG (haftungsbeschränkt) – Großefehn",
      "type": "Löschungsankündigung",
      "state": "Niedersachsen",
      "amtsgericht": "Amtsgericht Aurich",
      "registernummer": "HRB 205767",
      "registerart": "HRB",
      "company_name": "EFG Edelstahlfertigung UG (haftungsbeschränkt)",
      "company_seat": "Großefehn",
      "details": "19.11.2024 (Bekanntmachungsdatum)\n\nNiedersachsen Amtsgericht Aurich HRB 205767\nLöschungsankündigung\n\nEFG Edelstahlfertigung UG (haftungsbeschränkt)\nGesellschaft mit beschränkter Haftung\nGroßefehn\n\nDas Registergericht beabsichtigt, die Gesellschaft von Amts wegen nach § 394 FamFG zu löschen. Die Frist zur Erhebung eines Widerspruchs ist auf 1 Monat ab dieser Registerbekanntmachung festgesetzt."
    },
    {
      "date": "2024-11-19",
      "original_text": "Löschungsankündigung\nNordrhein-Westfalen Amtsgericht Köln HRB 28079\nEFK Maschinenbautechnik GmbH – Köln",
      "type": "Löschungsankündigung",
      "state": "Nordrhein-Westfalen",
      "amtsgericht": "Amtsgericht Köln",
      "registernummer": "HRB 28079",
      "registerart": "HRB",
      "company_name": "EFK Maschinenbautechnik GmbH",
      "company_seat": "Köln",
      "details": "19.11.2024 (Bekanntmachungsdatum)\n\nNordrhein-Westfalen Amtsgericht Köln HRB 28079\nLöschungsankündigung\n\nEFK Maschinenbautechnik GmbH\nGesellschaft mit beschränkter Haftung\nKöln\n\nDas Registergericht beabsichtigt die Gesellschaft von Amts wegen nach § 394 FamFG zu löschen. Die Frist zur Erhebung eines Widerspruchs ist auf einen Monat festgesetzt."
    },
    {
      "date": "2024-11-19",
      "original_text": "Einreichung neuer Dokumente\nSchleswig-Holstein Amtsgericht Lübeck HRB 2330\nEUROIMMUN Medizinische Labordiagnostika AG – Lübeck",
      "type": "Einreichung neuer Dokumente",
      "state": "Schleswig-Holstein",
      "amtsgericht": "Amtsgericht Lübeck",
      "registernummer": "HRB 2330",
      "registerart": "HRB",
      "company_name": "EUROIMMUN Medizinische Labordiagnostika AG",
      "company_seat": "Lübeck",
      "details": "19.11.2024 (Bekanntmachungsdatum)\n\nSchleswig-Holstein Amtsgericht Lübeck HRB 2330\nEinreichung neuer Dokumente\n\nEUROIMMUN Medizinische Labordiagnostika AG\nAktiengesellschaft\nLübeck\n\nAls nicht eingetragen wird veröffentlicht: Die Gesellschaft hat eine aktuelle Liste der Aufsichtsratsmitglieder zum Handelsregister eingereicht."
    },
    {
      "date": "2024-11-19",
      "original_text": "Löschungsankündigung\nThüringen Amtsgericht Jena HRB 110237\nEasy-Haus GmbH – Erfurt",
      "type": "Löschungsankündigung",
      "state": "Thüringen",
      "amtsgericht": "Amtsgericht Jena",
      "registernummer": "HRB 110237",
      "registerart": "HRB",
      "company_name": "Easy-Haus GmbH",
      "company_seat": "Erfurt",
      "details": "19.11.2024 (Bekanntmachungsdatum)\n\nThüringen Amtsgericht Jena HRB 110237\nLöschungsankündigung\n\nEasy-Haus GmbH\nGesellschaft mit beschränkter Haftung\nErfurt\n\nDas Registergericht beabsichtigt, die im Handelsregister eingetragene Gesellschaft wegen Vermögenslosigkeit nach § 394 FamFG von Amts wegen zu löschen. Die Frist zur Erhebung eines Widerspruchs gegen die beabsichtigte Löschung wird auf 6 Wochen festgesetzt."
    },
    {
      "date": "2024-11-19",
      "original_text": "Sonstige Registerbekanntmachung\nNiedersachsen Amtsgericht Göttingen VR 202431\nEnsemble ProCant e.V. – Göttingen",
      "type": "Sonstige Registerbekanntmachung",
      "state": "Niedersachsen",
      "amtsgericht": "Amtsgericht Göttingen",
      "registernummer": "VR 202431",
      "registerart": "VR",
      "company_name": "Ensemble ProCant e.V.",
      "company_seat": "Göttingen",
      "details": "19.11.2024 (Bekanntmachungsdatum)\n\nNiedersachsen Amtsgericht Göttingen VR 202431\nSonstige Registerbekanntmachung 19.11.2024 (Eintragungsdatum)\n\nEnsemble ProCant e.V.\neingetragener Verein\nGöttingen\n\nGeschäftsanschrift des Vereins: An der Bleichewiese 4, 37073 Göttingen"
    },
    {
      "date": "2024-11-19",
      "original_text": "Löschungsankündigung\nSachsen-Anhalt Amtsgericht Stendal HRB 205977\nEppe Handelskontor GmbH – Eisleben",
      "type": "Löschungsankündigung",
      "state": "Sachsen-Anhalt",
      "amtsgericht": "Amtsgericht Stendal",
      "registernummer": "HRB 205977",
      "registerart": "HRB",
      "company_name": "Eppe Handelskontor GmbH",
      "company_seat": "Eisleben",
      "details": "19.11.2024 (Bekanntmachungsdatum)\n\nSachsen-Anhalt Amtsgericht Stendal HRB 205977\nLöschungsankündigung\n\nEppe Handelskontor GmbH\nGesellschaft mit beschränkter Haftung\nEisleben\n\nDas Registergericht beabsichtigt, nachfolgende im Handelregister eingetragenen Firmen von Amts wegen nach § 394 FamFG zu löschen. Die Frist zu Erhebung eines Widerspruchs wird auf drei Monate festgesetzt."
    },
    {
      "date": "2024-11-19",
      "original_text": "Einreichung neuer Dokumente\nNordrhein-Westfalen Amtsgericht Münster HRB 11727\nFRIWO AG – Ostbevern",
      "type": "Einreichung neuer Dokumente",
      "state": "Nordrhein-Westfalen",
      "amtsgericht": "Amtsgericht Münster",
      "registernummer": "HRB 11727",
      "registerart": "HRB",
      "company_name": "FRIWO AG",
      "company_seat": "Ostbevern",
      "details": "19.11.2024 (Bekanntmachungsdatum)\n\nNordrhein-Westfalen Amtsgericht Münster HRB 11727\nEinreichung neuer Dokumente\n\nFRIWO AG\nAktiengesellschaft\nOstbevern\n\nDem Registergericht ist eine Liste der Mitglieder des Aufsichtsrates eingereicht worden."
    },
    {
      "date": "2024-11-19",
      "original_text": "Einreichung neuer Dokumente\nNordrhein-Westfalen Amtsgericht Coesfeld HRB 16929\nFlender GmbH – Bocholt",
      "type": "Einreichung neuer Dokumente",
      "state": "Nordrhein-Westfalen",
      "amtsgericht": "Amtsgericht Coesfeld",
      "registernummer": "HRB 16929",
      "registerart": "HRB",
      "company_name": "Flender GmbH",
      "company_seat": "Bocholt",
      "details": "19.11.2024 (Bekanntmachungsdatum)\n\nNordrhein-Westfalen Amtsgericht Coesfeld HRB 16929\nEinreichung neuer Dokumente\n\nFlender GmbH\nGesellschaft mit beschränkter Haftung\nBocholt\n\nDie Liste der Mitglieder des Aufsichtsrates vom 27.09.2024 ist zum Handelsregister eingereicht worden."
    },
    {
      "date": "2024-11-19",
      "original_text": "Sonstige Registerbekanntmachung\nBayern Amtsgericht München HRB 251034\nFolienhelfer GmbH – München",
      "type": "Sonstige Registerbekanntmachung",
      "state": "Bayern",
      "amtsgericht": "Amtsgericht München",
      "registernummer": "HRB 251034",
      "registerart": "HRB",
      "company_name": "Folienhelfer GmbH",
      "company_seat": "München",
      "details": "19.11.2024 (Bekanntmachungsdatum)\n\nBayern Amtsgericht München HRB 251034\nSonstige Registerbekanntmachung 15.11.2024 (Eintragungsdatum)\n\nFolienhelfer GmbH\nGesellschaft mit beschränkter Haftung\nMünchen\n\nDen Gläubigern der Gesellschaft, deren Forderungen begründet worden sind, bevor die Eintragung der Beendigung des Gewinnabführungsvertrages in das Handelsregister nach § 10 des Handelsgesetzbuches als bekanntgemacht gilt, hat der andere Vertragsteil Sicherheit zu leisten, wenn sie sich binnen sechs Monaten nach der Bekanntmachung der Eintragung zu diesem Zweck bei ihm melden."
    },
    {
      "date": "2024-11-19",
      "original_text": "Registerbekanntmachung nach dem Umwandlungsgesetz\nBayern Amtsgericht Fürth HRA 12390\nFriedrich Leist Gebäudereinigung e.K. – Neustadt a.d.Aisch",
      "type": "Registerbekanntmachung nach dem Umwandlungsgesetz",
      "state": "Bayern",
      "amtsgericht": "Amtsgericht Fürth",
      "registernummer": "HRA 12390",
      "registerart": "HRA",
      "company_name": "Friedrich Leist Gebäudereinigung e.K.",
      "company_seat": "Neustadt a.d.Aisch",
      "details": "19.11.2024 (Bekanntmachungsdatum)\n\nBayern Amtsgericht Fürth HRA 12390\nRegisterbekanntmachung nach dem Umwandlungsgesetz 18.11.2024 (Eintragungsdatum)\n\nFriedrich Leist Gebäudereinigung e.K.\nEinzelkaufmann / Einzelkauffrau\nNeustadt a.d.Aisch\n\nDen Gläubigern der an der Ausgliederung beteiligten Rechtsträger ist, wenn sie binnen sechs Monaten nach dem Tag, an dem die Eintragung der Ausgliederung in das Register des Sitzes desjenigen Rechtsträgers, dessen Gläubiger sie sind, nach §§ 125, 19 Abs. 3 UmwG als bekannt gemacht gilt, ihren Anspruch nach Grund und Höhe schriftlich anmelden, Sicherheit zu leisten, soweit sie nicht Befriedigung verlangen können. Dieses Recht steht den Gläubigern jedoch nur zu, wenn sie glaubhaft machen, dass durch die Ausgliederung die Erfüllung ihrer Forderung gefährdet wird."
    },
    {
      "date": "2024-11-19",
      "original_text": "Sonstige Registerbekanntmachung\nBayern Amtsgericht Amberg HRB 3872\nFronberg Guss Immobilien GmbH – Schwandorf",
      "type": "Sonstige Registerbekanntmachung",
      "state": "Bayern",
      "amtsgericht": "Amtsgericht Amberg",
      "registernummer": "HRB 3872",
      "registerart": "HRB",
      "company_name": "Fronberg Guss Immobilien GmbH",
      "company_seat": "Schwandorf",
      "details": "19.11.2024 (Bekanntmachungsdatum)\n\nBayern Amtsgericht Amberg HRB 3872\nSonstige Registerbekanntmachung 18.11.2024 (Eintragungsdatum)\n\nFronberg Guss Immobilien GmbH\nGesellschaft mit beschränkter Haftung\nSchwandorf\n\nDen Gläubigern der Gesellschaft, deren Forderungen begründet worden sind, bevor die Eintragung der Beendigung des Gewinnabführungsvertrages in das Handelsregister nach § 10 des Handelsgesetzbuches als bekanntgemacht gilt, hat der andere Vertragsteil Sicherheit zu leisten, wenn sie sich binnen sechs Monaten nach der Bekanntmachung der Eintragung zu diesem Zweck bei ihm melden."
    },
    {
      "date": "2024-11-19",
      "original_text": "Sonstige Registerbekanntmachung\nHessen Amtsgericht Kassel VR 3889\nGemeinnützige Interessengemeinschaft OrganSpende e.V. – Hofgeismar",
      "type": "Sonstige Registerbekanntmachung",
      "state": "Hessen",
      "amtsgericht": "Amtsgericht Kassel",
      "registernummer": "VR 3889",
      "registerart": "VR",
      "company_name": "Gemeinnützige Interessengemeinschaft OrganSpende e.V.",
      "company_seat": "Hofgeismar",
      "details": "19.11.2024 (Bekanntmachungsdatum)\n\nHessen Amtsgericht Kassel VR 3889\nSonstige Registerbekanntmachung 19.11.2024 (Eintragungsdatum)\n\nGemeinnützige Interessengemeinschaft OrganSpende e.V.\neingetragener Verein\nHofgeismar\n\nDer Verein ist aufgelöst."
    },
    {
      "date": "2024-11-19",
      "original_text": "Einreichung neuer Dokumente\nBayern Amtsgericht München HRB 257068\nGenerali Deutschland Lebensversicherung AG – München",
      "type": "Einreichung neuer Dokumente",
      "state": "Bayern",
      "amtsgericht": "Amtsgericht München",
      "registernummer": "HRB 257068",
      "registerart": "HRB",
      "company_name": "Generali Deutschland Lebensversicherung AG",
      "company_seat": "München",
      "details": "19.11.2024 (Bekanntmachungsdatum)\n\nBayern Amtsgericht München HRB 257068\nEinreichung neuer Dokumente\n\nGenerali Deutschland Lebensversicherung AG\nAktiengesellschaft\nMünchen\n\nDem Amtsgericht München -Registergericht- ist eine Liste der Mitglieder des Aufsichtsrats eingereicht worden, § 106 AktG."
    },
    {
      "date": "2024-11-19",
      "original_text": "Sonstige Registerbekanntmachung\nBrandenburg Amtsgericht Frankfurt/Oder HRB 13709\nGlobal Broadcast Monitoring GmbH – Frankfurt (Oder)",
      "type": "Sonstige Registerbekanntmachung",
      "state": "Brandenburg",
      "amtsgericht": "Amtsgericht Frankfurt/Oder",
      "registernummer": "HRB 13709",
      "registerart": "HRB",
      "company_name": "Global Broadcast Monitoring GmbH",
      "company_seat": "Frankfurt (Oder)",
      "details": "19.11.2024 (Bekanntmachungsdatum)\n\nBrandenburg Amtsgericht Frankfurt/Oder HRB 13709\nSonstige Registerbekanntmachung\n\nGlobal Broadcast Monitoring GmbH\nGesellschaft mit beschränkter Haftung\nFrankfurt (Oder)\n\nDie vermögenslose Gesellschaft ist auf Grund des § 394 FamFG von Amts wegen gelöscht."
    },
    {
      "date": "2024-11-19",
      "original_text": "Registerbekanntmachung nach dem Umwandlungsgesetz\nBayern Amtsgericht Nürnberg HRB 40591\nGreeno Solarprojekt 54 GmbH – Nürnberg",
      "type": "Registerbekanntmachung nach dem Umwandlungsgesetz",
      "state": "Bayern",
      "amtsgericht": "Amtsgericht Nürnberg",
      "registernummer": "HRB 40591",
      "registerart": "HRB",
      "company_name": "Greeno Solarprojekt 54 GmbH",
      "company_seat": "Nürnberg",
      "details": "19.11.2024 (Bekanntmachungsdatum)\n\nBayern Amtsgericht Nürnberg HRB 40591\nRegisterbekanntmachung nach dem Umwandlungsgesetz 18.11.2024 (Eintragungsdatum)\n\nGreeno Solarprojekt 54 GmbH\nGesellschaft mit beschränkter Haftung\nNürnberg\n\nDen Gläubigern des formwechselnden Rechtsträgers ist, wenn sie binnen sechs Monaten nach dem Tag, an dem die Eintragung des Formwechsels nach § 201 UmwG als bekannt gemacht gilt, ihren Anspruch nach Grund und Höhe schriftlich anmelden, Sicherheit zu leisten, soweit sie nicht Befriedigung verlangen können. Dieses Recht steht den Gläubigern jedoch nur zu, wenn sie glaubhaft machen, dass durch den Formwechsel die Erfüllung ihrer Forderung gefährdet wird."
    },
    {
      "date": "2024-11-19",
      "original_text": "Registerbekanntmachung nach dem Umwandlungsgesetz\nBayern Amtsgericht Nürnberg HRA 20213\nGreeno Solarprojekt 54 GmbH & Co. KG – Nürnberg",
      "type": "Registerbekanntmachung nach dem Umwandlungsgesetz",
      "state": "Bayern",
      "amtsgericht": "Amtsgericht Nürnberg",
      "registernummer": "HRA 20213",
      "registerart": "HRA",
      "company_name": "Greeno Solarprojekt 54 GmbH & Co. KG",
      "company_seat": "Nürnberg",
      "details": "19.11.2024 (Bekanntmachungsdatum)\n\nBayern Amtsgericht Nürnberg HRA 20213\nRegisterbekanntmachung nach dem Umwandlungsgesetz 18.11.2024 (Eintragungsdatum)\n\nGreeno Solarprojekt 54 GmbH & Co. KG\nKommanditgesellschaft\nNürnberg\n\nDen Gläubigern des formwechselnden Rechtsträgers ist, wenn sie binnen sechs Monaten nach dem Tag, an dem die Eintragung des Formwechsels nach § 201 UmwG als bekannt gemacht gilt, ihren Anspruch nach Grund und Höhe schriftlich anmelden, Sicherheit zu leisten, soweit sie nicht Befriedigung verlangen können. Dieses Recht steht den Gläubigern jedoch nur zu, wenn sie glaubhaft machen, dass durch den Formwechsel die Erfüllung ihrer Forderung gefährdet wird."
    },
    {
      "date": "2024-11-19",
      "original_text": "Registerbekanntmachung nach dem Umwandlungsgesetz\nBayern Amtsgericht München HRB 194218\nGyros DE GmbH – München",
      "type": "Registerbekanntmachung nach dem Umwandlungsgesetz",
      "state": "Bayern",
      "amtsgericht": "Amtsgericht München",
      "registernummer": "HRB 194218",
      "registerart": "HRB",
      "company_name": "Gyros DE GmbH",
      "company_seat": "München",
      "details": "19.11.2024 (Bekanntmachungsdatum)\n\nBayern Amtsgericht München HRB 194218\nRegisterbekanntmachung nach dem Umwandlungsgesetz 18.11.2024 (Eintragungsdatum)\n\nGyros DE GmbH\nGesellschaft mit beschränkter Haftung\nMünchen\n\nDen Gläubigern der an der Verschmelzung beteiligten Rechtsträger ist, wenn sie binnen sechs Monaten nach dem Tag, an dem die Eintragung der Verschmelzung in das Register des Sitzes desjenigen Rechtsträgers, dessen Gläubiger sie sind, nach § 19 Abs. 3 UmwG als bekannt gemacht gilt, ihren Anspruch nach Grund und Höhe schriftlich anmelden, Sicherheit zu leisten, soweit sie nicht Befriedigung verlangen können. Dieses Recht steht den Gläubigern jedoch nur zu, wenn sie glaubhaft machen, dass durch die Verschmelzung die Erfüllung ihrer Forderung gefährdet wird."
    },
    {
      "date": "2024-11-19",
      "original_text": "Löschungsankündigung\nSchleswig-Holstein Amtsgericht Kiel HRB 16168\nHG Building Services UG (haftungsbeschränkt) – Jevenstedt",
      "type": "Löschungsankündigung",
      "state": "Schleswig-Holstein",
      "amtsgericht": "Amtsgericht Kiel",
      "registernummer": "HRB 16168",
      "registerart": "HRB",
      "company_name": "HG Building Services UG (haftungsbeschränkt)",
      "company_seat": "Jevenstedt",
      "details": "19.11.2024 (Bekanntmachungsdatum)\n\nSchleswig-Holstein Amtsgericht Kiel HRB 16168\nLöschungsankündigung\n\nHG Building Services UG (haftungsbeschränkt)\nGesellschaft mit beschränkter Haftung\nJevenstedt\n\nEs ist die Löschung der nachstehenden Gesellschaft wegen Vermögenslosigkeit gemäß § 394 FamFG beabsichtigt. Widerspruchsfrist: 2 Monate."
    },
    {
      "date": "2024-11-19",
      "original_text": "Löschungsankündigung\nNordrhein-Westfalen Amtsgericht Bochum HRB 16027\nHUKA Bau GmbH – Witten",
      "type": "Löschungsankündigung",
      "state": "Nordrhein-Westfalen",
      "amtsgericht": "Amtsgericht Bochum",
      "registernummer": "HRB 16027",
      "registerart": "HRB",
      "company_name": "HUKA Bau GmbH",
      "company_seat": "Witten",
      "details": "19.11.2024 (Bekanntmachungsdatum)\n\nNordrhein-Westfalen Amtsgericht Bochum HRB 16027\nLöschungsankündigung 20.11.2024 (Eintragungsdatum)\n\nHUKA Bau GmbH\nGesellschaft mit beschränkter Haftung\nWitten\n\nDas Registergericht beabsichtigt die Gesellschaft von Amts wegen nach § 394 FamFG zu löschen. Die Frist zur Erhebung eines Widerspruchs ist auf drei Monate festgesetzt."
    },
    {
      "date": "2024-11-19",
      "original_text": "Löschungsankündigung\nBayern Amtsgericht München HRB 249088\nHelske Resort Braunschweig AG – München",
      "type": "Löschungsankündigung",
      "state": "Bayern",
      "amtsgericht": "Amtsgericht München",
      "registernummer": "HRB 249088",
      "registerart": "HRB",
      "company_name": "Helske Resort Braunschweig AG",
      "company_seat": "München",
      "details": "19.11.2024 (Bekanntmachungsdatum)\n\nBayern Amtsgericht München HRB 249088\nLöschungsankündigung\n\nHelske Resort Braunschweig AG\nAktiengesellschaft\nMünchen\n\nDas Registergericht beabsichtigt, die im Handelsregister eingetragene Gesellschaft wegen Vermögenslosigkeit von Amts wegen nach § 394 FamFG zu löschen. Die Frist zur Erhebung eines Widerspruchs ist auf drei Monate festgesetzt."
    },
    {
      "date": "2024-11-19",
      "original_text": "Löschungsankündigung\nRheinland-Pfalz Amtsgericht Ludwigshafen a.Rhein (Ludwigshafen) HRB 66453\nHirsch Mietagentur UG (haftungsbeschränkt) – Speyer",
      "type": "Löschungsankündigung",
      "state": "Rheinland-Pfalz",
      "amtsgericht": "Amtsgericht Ludwigshafen a.Rhein (Ludwigshafen)",
      "registernummer": "HRB 66453",
      "registerart": "HRB",
      "company_name": "Hirsch Mietagentur UG (haftungsbeschränkt)",
      "company_seat": "Speyer",
      "details": "19.11.2024 (Bekanntmachungsdatum)\n\nRheinland-Pfalz Amtsgericht Ludwigshafen a.Rhein (Ludwigshafen) HRB 66453\nLöschungsankündigung\n\nHirsch Mietagentur UG (haftungsbeschränkt)\nGesellschaft mit beschränkter Haftung\nSpeyer\n\nDas Registergericht beabsichtigt die Gesellschaft von Amts wegen nach § 394 FamFG zu löschen. Die Frist zur Erhebung eines Widerspruchs ist auf einen Monat festgesetzt."
    },
    {
      "date": "2024-11-19",
      "original_text": "Registerbekanntmachung nach dem Umwandlungsgesetz\nBaden-Württemberg Amtsgericht Stuttgart HRB 797144\nHorlacher & Sajfutdinow GmbH – Heilbronn",
      "type": "Registerbekanntmachung nach dem Umwandlungsgesetz",
      "state": "Baden-Württemberg",
      "amtsgericht": "Amtsgericht Stuttgart",
      "registernummer": "HRB 797144",
      "registerart": "HRB",
      "company_name": "Horlacher & Sajfutdinow GmbH",
      "company_seat": "Heilbronn",
      "details": "19.11.2024 (Bekanntmachungsdatum)\n\nBaden-Württemberg Amtsgericht Stuttgart HRB 797144\nRegisterbekanntmachung nach dem Umwandlungsgesetz 19.11.2024 (Eintragungsdatum)\n\nHorlacher & Sajfutdinow GmbH\nGesellschaft mit beschränkter Haftung\nHeilbronn\n\nAls nicht eingetragen wird bekanntgemacht:\nDen Gläubigern des an dem Formwechsel beteiligten Rechtsträgers ist, wenn sie binnen sechs Monaten nach dem Tag, an dem die Eintragung des Formwechsels in das Register des Sitzes desjenigen Rechtsträgers, dessen Gläubiger sie sind, nach § 19 Abs. 3 UmwG als bekanntgemacht gilt, ihren Anspruch nach Grund und Höhe schriftlich anmelden, Sicherheit zu leisten, soweit sie nicht Befriedigung verlangen können. Dieses Recht steht den Gläubigern jedoch nur zu, wenn sie glaubhaft machen, dass durch den Formwechsel die Erfüllung ihrer Forderung gefährdet wird."
    },
    {
      "date": "2024-11-19",
      "original_text": "Registerbekanntmachung nach dem Umwandlungsgesetz\nBaden-Württemberg Amtsgericht Stuttgart GsR 880\nHorlacher & Sajfutdinow eGbR – Heilbronn",
      "type": "Registerbekanntmachung nach dem Umwandlungsgesetz",
      "state": "Baden-Württemberg",
      "amtsgericht": "Amtsgericht Stuttgart",
      "registernummer": "GsR 880",
      "registerart": "GsR",
      "company_name": "Horlacher & Sajfutdinow eGbR",
      "company_seat": "Heilbronn",
      "details": "19.11.2024 (Bekanntmachungsdatum)\n\nBaden-Württemberg Amtsgericht Stuttgart GsR 880\nRegisterbekanntmachung nach dem Umwandlungsgesetz 19.11.2024 (Eintragungsdatum)\n\nHorlacher & Sajfutdinow eGbR\nGesellschaft bürgerlichen Rechts\nHeilbronn\n\nAls nicht eingetragen wird bekanntgemacht:\nDen Gläubigern des an dem Formwechsel beteiligten Rechtsträgers ist, wenn sie binnen sechs Monaten nach dem Tag, an dem die Eintragung des Formwechsels in das Register des Sitzes desjenigen Rechtsträgers, dessen Gläubiger sie sind, nach § 19 Abs. 3 UmwG als bekanntgemacht gilt, ihren Anspruch nach Grund und Höhe schriftlich anmelden, Sicherheit zu leisten, soweit sie nicht Befriedigung verlangen können. Dieses Recht steht den Gläubigern jedoch nur zu, wenn sie glaubhaft machen, dass durch den Formwechsel die Erfüllung ihrer Forderung gefährdet wird."
    },
    {
      "date": "2024-11-19",
      "original_text": "Registerbekanntmachung nach dem Umwandlungsgesetz\nBayern Amtsgericht Fürth HRB 19380\nHprocure GmbH – Veitsbronn",
      "type": "Registerbekanntmachung nach dem Umwandlungsgesetz",
      "state": "Bayern",
      "amtsgericht": "Amtsgericht Fürth",
      "registernummer": "HRB 19380",
      "registerart": "HRB",
      "company_name": "Hprocure GmbH",
      "company_seat": "Veitsbronn",
      "details": "19.11.2024 (Bekanntmachungsdatum)\n\nBayern Amtsgericht Fürth HRB 19380\nRegisterbekanntmachung nach dem Umwandlungsgesetz 15.11.2024 (Eintragungsdatum)\n\nHprocure GmbH\nGesellschaft mit beschränkter Haftung\nVeitsbronn\n\nDen Gläubigern der an der Verschmelzung beteiligten Rechtsträger ist, wenn sie binnen sechs Monaten nach dem Tag, an dem die Eintragung der Verschmelzung in das Register des Sitzes desjenigen Rechtsträgers, dessen Gläubiger sie sind, nach § 19 Abs. 3 UmwG als bekannt gemacht gilt, ihren Anspruch nach Grund und Höhe schriftlich anmelden, Sicherheit zu leisten, soweit sie nicht Befriedigung verlangen können. Dieses Recht steht den Gläubigern jedoch nur zu, wenn sie glaubhaft machen, dass durch die Verschmelzung die Erfüllung ihrer Forderung gefährdet wird."
    },
    {
      "date": "2024-11-19",
      "original_text": "Registerbekanntmachung nach dem Umwandlungsgesetz\nBaden-Württemberg Amtsgericht Stuttgart HRB 251135\nHutchinson Stop-Choc Vertriebs-GmbH – Renningen",
      "type": "Registerbekanntmachung nach dem Umwandlungsgesetz",
      "state": "Baden-Württemberg",
      "amtsgericht": "Amtsgericht Stuttgart",
      "registernummer": "HRB 251135",
      "registerart": "HRB",
      "company_name": "Hutchinson Stop-Choc Vertriebs-GmbH",
      "company_seat": "Renningen",
      "details": "19.11.2024 (Bekanntmachungsdatum)\n\nBaden-Württemberg Amtsgericht Stuttgart HRB 251135\nRegisterbekanntmachung nach dem Umwandlungsgesetz 19.11.2024 (Eintragungsdatum)\n\nHutchinson Stop-Choc Vertriebs-GmbH\nGesellschaft mit beschränkter Haftung\nRenningen\n\nAls nicht eingetragen wird bekanntgemacht:\nDen Gläubigern der an der Verschmelzung beteiligten Rechtsträger ist, wenn sie binnen sechs Monaten nach dem Tag, an dem die Eintragung der Verschmelzung in das Register des Sitzes desjenigen Rechtsträgers, dessen Gläubiger sie sind, nach § 19 Abs. 3 UmwG als bekanntgemacht gilt, ihren Anspruch nach Grund und Höhe schriftlich anmelden, Sicherheit zu leisten, soweit sie nicht Befriedigung verlangen können. Dieses Recht steht den Gläubigern jedoch nur zu, wenn sie glaubhaft machen, dass durch die Verschmelzung die Erfüllung ihrer Forderung gefährdet wird."
    },
    {
      "date": "2024-11-19",
      "original_text": "Registerbekanntmachung nach dem Umwandlungsgesetz\nBremen Amtsgericht Bremen HRB 17567\nI.C.NET Software GmbH – Bremen",
      "type": "Registerbekanntmachung nach dem Umwandlungsgesetz",
      "state": "Bremen",
      "amtsgericht": "Amtsgericht Bremen",
      "registernummer": "HRB 17567",
      "registerart": "HRB",
      "company_name": "I.C.NET Software GmbH",
      "company_seat": "Bremen",
      "details": "19.11.2024 (Bekanntmachungsdatum)\n\nBremen Amtsgericht Bremen HRB 17567\nRegisterbekanntmachung nach dem Umwandlungsgesetz 18.11.2024 (Eintragungsdatum)\n\nI.C.NET Software GmbH\nGesellschaft mit beschränkter Haftung\nBremen\n\nZu Eintragungsnummer 4 vom 18.11.2024 wird als nicht eingetragen veröffentlicht:\nDen Gläubigern der an der Verschmelzung beteiligten Rechtsträger ist, wenn sie binnen sechs Monaten nach dem Tag, an dem die Eintragung der Verschmelzung in das Register des Sitzes desjenigen Rechtsträgers, dessen Gläubiger sie sind, als bekannt gemacht gilt, ihren Anspruch nach Grund und Höhe schriftlich anmelden, Sicherheit zu leisten, soweit sie nicht Befriedigung verlangen können. Dieses Recht steht den Gläubigern jedoch nur zu, wenn sie glaubhaft machen, dass durch die Verschmelzung die Erfüllung ihrer Forderung gefährdet wird. Das Recht, Sicherheitsleistung zu verlangen, steht Gläubigern nicht zu, die im Falle der Insolvenz ein Recht auf vorzugsweise Befriedigung aus einer Deckungsmasse haben, die nach gesetzlicher Vorschrift zu ihrem Schutz errichtet und staatlich überwacht ist."
    },
    {
      "date": "2024-11-19",
      "original_text": "Registerbekanntmachung nach dem Umwandlungsgesetz\nBayern Amtsgericht München HRB 249181\nINOS 19-025 GmbH – München",
      "type": "Registerbekanntmachung nach dem Umwandlungsgesetz",
      "state": "Bayern",
      "amtsgericht": "Amtsgericht München",
      "registernummer": "HRB 249181",
      "registerart": "HRB",
      "company_name": "INOS 19-025 GmbH",
      "company_seat": "München",
      "details": "19.11.2024 (Bekanntmachungsdatum)\n\nBayern Amtsgericht München HRB 249181\nRegisterbekanntmachung nach dem Umwandlungsgesetz 18.11.2024 (Eintragungsdatum)\n\nINOS 19-025 GmbH\nGesellschaft mit beschränkter Haftung\nMünchen\n\nDen Gläubigern der an der Verschmelzung beteiligten Rechtsträger ist, wenn sie binnen sechs Monaten nach dem Tag, an dem die Eintragung der Verschmelzung in das Register des Sitzes desjenigen Rechtsträgers, dessen Gläubiger sie sind, nach § 19 Abs. 3 UmwG als bekannt gemacht gilt, ihren Anspruch nach Grund und Höhe schriftlich anmelden, Sicherheit zu leisten, soweit sie nicht Befriedigung verlangen können. Dieses Recht steht den Gläubigern jedoch nur zu, wenn sie glaubhaft machen, dass durch die Verschmelzung die Erfüllung ihrer Forderung gefährdet wird."
    },
    {
      "date": "2024-11-19",
      "original_text": "Einreichung neuer Dokumente\nBayern Amtsgericht Kempten (Allgäu) HRB 528\nImmobiliengesellschaft der Allgäuer Volksbank GmbH. – Kempten",
      "type": "Einreichung neuer Dokumente",
      "state": "Bayern",
      "amtsgericht": "Amtsgericht Kempten (Allgäu)",
      "registernummer": "HRB 528",
      "registerart": "HRB",
      "company_name": "Immobiliengesellschaft der Allgäuer Volksbank GmbH.",
      "company_seat": "Kempten",
      "details": "19.11.2024 (Bekanntmachungsdatum)\n\nBayern Amtsgericht Kempten (Allgäu) HRB 528\nEinreichung neuer Dokumente 18.11.2024 (Eintragungsdatum)\n\nImmobiliengesellschaft der Allgäuer Volksbank GmbH.\nGesellschaft mit beschränkter Haftung\nKempten\n\nDem Amtsgericht Kempten (Allgäu) -Registergericht- ist eine Liste der Mitglieder des Aufsichtsrats eingereicht worden, § 52 Abs. 3 S. 2 GmbHG."
    },
    {
      "date": "2024-11-19",
      "original_text": "Registerbekanntmachung nach dem Umwandlungsgesetz\nBaden-Württemberg Amtsgericht Ulm HRA 510278\nJelu-Werk Josef Ehrler GmbH & Co.KG – Rosenberg",
      "type": "Registerbekanntmachung nach dem Umwandlungsgesetz",
      "state": "Baden-Württemberg",
      "amtsgericht": "Amtsgericht Ulm",
      "registernummer": "HRA 510278",
      "registerart": "HRA",
      "company_name": "Jelu-Werk Josef Ehrler GmbH & Co.KG",
      "company_seat": "Rosenberg",
      "details": "19.11.2024 (Bekanntmachungsdatum)\n\nBaden-Württemberg Amtsgericht Ulm HRA 510278\nRegisterbekanntmachung nach dem Umwandlungsgesetz 19.11.2024 (Eintragungsdatum)\n\nJelu-Werk Josef Ehrler GmbH & Co.KG\nKommanditgesellschaft\nRosenberg\n\nAls nicht eingetragen wird bekanntgemacht:\nDen Gläubigern der an der Verschmelzung beteiligten Rechtsträger ist, wenn sie binnen sechs Monaten nach dem Tag, an dem die Eintragung der Verschmelzung in das Register des Sitzes desjenigen Rechtsträgers, dessen Gläubiger sie sind, nach § 19 Abs. 3 UmwG als bekanntgemacht gilt, ihren Anspruch nach Grund und Höhe schriftlich anmelden, Sicherheit zu leisten, soweit sie nicht Befriedigung verlangen können. Dieses Recht steht den Gläubigern jedoch nur zu, wenn sie glaubhaft machen, dass durch die Verschmelzung die Erfüllung ihrer Forderung gefährdet wird."
    },
    {
      "date": "2024-11-19",
      "original_text": "Einreichung neuer Dokumente\nThüringen Amtsgericht Jena HRB 205656\nJenaer Nahverkehr GmbH – Jena",
      "type": "Einreichung neuer Dokumente",
      "state": "Thüringen",
      "amtsgericht": "Amtsgericht Jena",
      "registernummer": "HRB 205656",
      "registerart": "HRB",
      "company_name": "Jenaer Nahverkehr GmbH",
      "company_seat": "Jena",
      "details": "19.11.2024 (Bekanntmachungsdatum)\n\nThüringen Amtsgericht Jena HRB 205656\nEinreichung neuer Dokumente\n\nJenaer Nahverkehr GmbH\nGesellschaft mit beschränkter Haftung\nJena\n\nBekanntmachung gem. § 52 Abs. 3 Satz 2 GmbHG: Aufgrund einer Veränderung in den Personen der Aufsichtsratsmitglieder ist durch die Geschäftsführer eine neue Liste zum Handelsregister eingereicht worden."
    },
    {
      "date": "2024-11-19",
      "original_text": "Registerbekanntmachung nach dem Umwandlungsgesetz\nBaden-Württemberg Amtsgericht Ulm HRA 726965\nJosef Ehrler Immobilien GmbH & Co. KG – Rosenberg",
      "type": "Registerbekanntmachung nach dem Umwandlungsgesetz",
      "state": "Baden-Württemberg",
      "amtsgericht": "Amtsgericht Ulm",
      "registernummer": "HRA 726965",
      "registerart": "HRA",
      "company_name": "Josef Ehrler Immobilien GmbH & Co. KG",
      "company_seat": "Rosenberg",
      "details": "19.11.2024 (Bekanntmachungsdatum)\n\nBaden-Württemberg Amtsgericht Ulm HRA 726965\nRegisterbekanntmachung nach dem Umwandlungsgesetz 19.11.2024 (Eintragungsdatum)\n\nJosef Ehrler Immobilien GmbH & Co. KG\nKommanditgesellschaft\nRosenberg\n\nAls nicht eingetragen wird bekanntgemacht:\nDen Gläubigern der an der Verschmelzung beteiligten Rechtsträger ist, wenn sie binnen sechs Monaten nach dem Tag, an dem die Eintragung der Verschmelzung in das Register des Sitzes desjenigen Rechtsträgers, dessen Gläubiger sie sind, nach § 19 Abs. 3 UmwG als bekanntgemacht gilt, ihren Anspruch nach Grund und Höhe schriftlich anmelden, Sicherheit zu leisten, soweit sie nicht Befriedigung verlangen können. Dieses Recht steht den Gläubigern jedoch nur zu, wenn sie glaubhaft machen, dass durch die Verschmelzung die Erfüllung ihrer Forderung gefährdet wird."
    },
    {
      "date": "2024-11-19",
      "original_text": "Löschungsankündigung\nNiedersachsen Amtsgericht Hildesheim HRB 203940\nKCS Maschinen- und Anlagensicherheit GmbH – Sassenburg",
      "type": "Löschungsankündigung",
      "state": "Niedersachsen",
      "amtsgericht": "Amtsgericht Hildesheim",
      "registernummer": "HRB 203940",
      "registerart": "HRB",
      "company_name": "KCS Maschinen- und Anlagensicherheit GmbH",
      "company_seat": "Sassenburg",
      "details": "19.11.2024 (Bekanntmachungsdatum)\n\nNiedersachsen Amtsgericht Hildesheim HRB 203940\nLöschungsankündigung\n\nKCS Maschinen- und Anlagensicherheit GmbH\nGesellschaft mit beschränkter Haftung\nSassenburg\n\nDas Registergericht beabsichtigt, die Gesellschaft von Amts wegen nach § 394 FamFG zu löschen. Die Frist zur Erhebung eines Widerspruchs ist auf 1 Monat ab dieser Registerbekanntmachung festgesetzt."
    },
    {
      "date": "2024-11-19",
      "original_text": "Löschungsankündigung\nBayern Amtsgericht Landshut HRB 10651\nKM Kreativbau UG (haftungsbeschränkt) – Eching i.Ndb.",
      "type": "Löschungsankündigung",
      "state": "Bayern",
      "amtsgericht": "Amtsgericht Landshut",
      "registernummer": "HRB 10651",
      "registerart": "HRB",
      "company_name": "KM Kreativbau UG (haftungsbeschränkt)",
      "company_seat": "Eching i.Ndb.",
      "details": "19.11.2024 (Bekanntmachungsdatum)\n\nBayern Amtsgericht Landshut HRB 10651\nLöschungsankündigung\n\nKM Kreativbau UG (haftungsbeschränkt)\nGesellschaft mit beschränkter Haftung\nEching i.Ndb.\n\nDas Registergericht beabsichtigt, die im Handelsregister eingetragene Gesellschaft wegen Vermögenslosigkeit von Amts wegen nach § 394 FamFG zu löschen. Die Frist zur Erhebung eines Widerspruchs ist auf einen Monat festgesetzt."
    },
    {
      "date": "2024-11-19",
      "original_text": "Registerbekanntmachung nach dem Umwandlungsgesetz\nBaden-Württemberg Amtsgericht Stuttgart HRB 771696\nKessler Verwaltungsgesellschaft UG ( haftungsbeschränkt) – Tübingen",
      "type": "Registerbekanntmachung nach dem Umwandlungsgesetz",
      "state": "Baden-Württemberg",
      "amtsgericht": "Amtsgericht Stuttgart",
      "registernummer": "HRB 771696",
      "registerart": "HRB",
      "company_name": "Kessler Verwaltungsgesellschaft UG ( haftungsbeschränkt)",
      "company_seat": "Tübingen",
      "details": "19.11.2024 (Bekanntmachungsdatum)\n\nBaden-Württemberg Amtsgericht Stuttgart HRB 771696\nRegisterbekanntmachung nach dem Umwandlungsgesetz 19.11.2024 (Eintragungsdatum)\n\nKessler Verwaltungsgesellschaft UG ( haftungsbeschränkt)\nGesellschaft mit beschränkter Haftung\nTübingen\n\nAls nicht eingetragen wird bekanntgemacht:\nDen Gläubigern der an der Verschmelzung beteiligten Rechtsträger ist, wenn sie binnen sechs Monaten nach dem Tag, an dem die Eintragung der Verschmelzung in das Register des Sitzes desjenigen Rechtsträgers, dessen Gläubiger sie sind, nach § 19 Abs. 3 UmwG als bekanntgemacht gilt, ihren Anspruch nach Grund und Höhe schriftlich anmelden, Sicherheit zu leisten, soweit sie nicht Befriedigung verlangen können. Dieses Recht steht den Gläubigern jedoch nur zu, wenn sie glaubhaft machen, dass durch die Verschmelzung die Erfüllung ihrer Forderung gefährdet wird."
    },
    {
      "date": "2024-11-19",
      "original_text": "Registerbekanntmachung nach dem Umwandlungsgesetz\nNiedersachsen Amtsgericht Osnabrück HRB 209442\nKiese Fenstertechnik GmbH – Melle",
      "type": "Registerbekanntmachung nach dem Umwandlungsgesetz",
      "state": "Niedersachsen",
      "amtsgericht": "Amtsgericht Osnabrück",
      "registernummer": "HRB 209442",
      "registerart": "HRB",
      "company_name": "Kiese Fenstertechnik GmbH",
      "company_seat": "Melle",
      "details": "19.11.2024 (Bekanntmachungsdatum)\n\nNiedersachsen Amtsgericht Osnabrück HRB 209442\nRegisterbekanntmachung nach dem Umwandlungsgesetz 19.11.2024 (Eintragungsdatum)\n\nKiese Fenstertechnik GmbH\nGesellschaft mit beschränkter Haftung\nMelle\n\nDen Gläubigern der an der Verschmelzung beteiligten Rechtsträger ist, wenn sie binnen sechs Monaten nach dem Tag, an dem die Eintragung der Verschmelzung in das Register des Sitzes desjenigen Rechtsträgers, dessen Gläubiger sie sind, nach § 19  Abs.  3 UmwG als bekannt gemacht gilt, ihren Anspruch nach Grund und Höhe schriftlich anmelden, Sicherheit zu leisten, soweit sie nicht Befriedigung verlangen können. Dieses Recht steht den Gläubigern jedoch nur zu, wenn sie glaubhaft machen, dass durch die Verschmelzung die Erfüllung der Forderung gefährdet wird."
    },
    {
      "date": "2024-11-19",
      "original_text": "Löschungsankündigung\nSchleswig-Holstein Amtsgericht Kiel HRB 4043 NM\nKilia Fleischerei- und Spezial-Maschinen-Fabrik GmbH – Neumünster",
      "type": "Löschungsankündigung",
      "state": "Schleswig-Holstein",
      "amtsgericht": "Amtsgericht Kiel",
      "registernummer": "HRB 4043 NM",
      "registerart": "HRB",
      "company_name": "Kilia Fleischerei- und Spezial-Maschinen-Fabrik GmbH",
      "company_seat": "Neumünster",
      "details": "19.11.2024 (Bekanntmachungsdatum)\n\nSchleswig-Holstein Amtsgericht Kiel HRB 4043 NM\nLöschungsankündigung\n\nKilia Fleischerei- und Spezial-Maschinen-Fabrik GmbH\nGesellschaft mit beschränkter Haftung\nNeumünster\n\nEs ist die Löschung der nachstehenden Gesellschaft wegen Vermögenslosigkeit gemäß § 394 FamFG beabsichtigt. Widerspruchsfrist: 2 Monate."
    },
    {
      "date": "2024-11-19",
      "original_text": "Sonstige Registerbekanntmachung\nHessen Amtsgericht Wetzlar VR 4745\nKita Lebensvoll e.V. – Wetzlar",
      "type": "Sonstige Registerbekanntmachung",
      "state": "Hessen",
      "amtsgericht": "Amtsgericht Wetzlar",
      "registernummer": "VR 4745",
      "registerart": "VR",
      "company_name": "Kita Lebensvoll e.V.",
      "company_seat": "Wetzlar",
      "details": "19.11.2024 (Bekanntmachungsdatum)\n\nHessen Amtsgericht Wetzlar VR 4745\nSonstige Registerbekanntmachung 19.11.2024 (Eintragungsdatum)\n\nKita Lebensvoll e.V.\neingetragener Verein\nWetzlar\n\nDer Verein ist aufgelöst."
    },
    {
      "date": "2024-11-19",
      "original_text": "Einreichung neuer Dokumente\nBrandenburg Amtsgericht Potsdam HRB 16279\nKlinikum Ernst von Bergmann gemeinnützige GmbH – Potsdam",
      "type": "Einreichung neuer Dokumente",
      "state": "Brandenburg",
      "amtsgericht": "Amtsgericht Potsdam",
      "registernummer": "HRB 16279",
      "registerart": "HRB",
      "company_name": "Klinikum Ernst von Bergmann gemeinnützige GmbH",
      "company_seat": "Potsdam",
      "details": "19.11.2024 (Bekanntmachungsdatum)\n\nBrandenburg Amtsgericht Potsdam HRB 16279\nEinreichung neuer Dokumente\n\nKlinikum Ernst von Bergmann gemeinnützige GmbH\nGesellschaft mit beschränkter Haftung\nPotsdam\n\nAls nicht eingetragen wird veröffentlicht: Eine Liste der Mitglieder des Aufsichtsrates wurde zum Handelsregister eingereicht."
    },
    {
      "date": "2024-11-19",
      "original_text": "Einreichung neuer Dokumente\nNiedersachsen Amtsgericht Osnabrück HRB 18565\nKlinikum Osnabrück GmbH – Osnabrück",
      "type": "Einreichung neuer Dokumente",
      "state": "Niedersachsen",
      "amtsgericht": "Amtsgericht Osnabrück",
      "registernummer": "HRB 18565",
      "registerart": "HRB",
      "company_name": "Klinikum Osnabrück GmbH",
      "company_seat": "Osnabrück",
      "details": "19.11.2024 (Bekanntmachungsdatum)\n\nNiedersachsen Amtsgericht Osnabrück HRB 18565\nEinreichung neuer Dokumente 19.11.2024 (Eintragungsdatum)\n\nKlinikum Osnabrück GmbH\nGesellschaft mit beschränkter Haftung\nOsnabrück\n\nDie Liste der Mitglieder des Aufsichtsrats wurde beim Registergericht eingereicht."
    },
    {
      "date": "2024-11-19",
      "original_text": "Einreichung neuer Dokumente\nBaden-Württemberg Amtsgericht Stuttgart HRB 590167\nKonrad Hornschuch Aktiengesellschaft – Weißbach",
      "type": "Einreichung neuer Dokumente",
      "state": "Baden-Württemberg",
      "amtsgericht": "Amtsgericht Stuttgart",
      "registernummer": "HRB 590167",
      "registerart": "HRB",
      "company_name": "Konrad Hornschuch Aktiengesellschaft",
      "company_seat": "Weißbach",
      "details": "19.11.2024 (Bekanntmachungsdatum)\n\nBaden-Württemberg Amtsgericht Stuttgart HRB 590167\nEinreichung neuer Dokumente\n\nKonrad Hornschuch Aktiengesellschaft\nAktiengesellschaft\nWeißbach\n\nDie Gesellschaft hat am 19.11.2024 die Liste über die Zusammensetzung des Aufsichtsrats zum Handelsregister eingereicht."
    },
    {
      "date": "2024-11-19",
      "original_text": "Registerbekanntmachung nach dem Umwandlungsgesetz\nMecklenburg-Vorpommern Amtsgericht Neubrandenburg HRB 21184\nKranich UG (haftungsbeschränkt) – Klink",
      "type": "Registerbekanntmachung nach dem Umwandlungsgesetz",
      "state": "Mecklenburg-Vorpommern",
      "amtsgericht": "Amtsgericht Neubrandenburg",
      "registernummer": "HRB 21184",
      "registerart": "HRB",
      "company_name": "Kranich UG (haftungsbeschränkt)",
      "company_seat": "Klink",
      "details": "19.11.2024 (Bekanntmachungsdatum)\n\nMecklenburg-Vorpommern Amtsgericht Neubrandenburg HRB 21184\nRegisterbekanntmachung nach dem Umwandlungsgesetz 19.11.2024 (Eintragungsdatum)\n\nKranich UG (haftungsbeschränkt)\nGesellschaft mit beschränkter Haftung\nKlink\n\nAls nicht eingetragen wird veröffentlicht: Den Gläubigern der an der Verschmelzung beteiligten Rechtsträger ist, wenn sie binnen sechs Monaten nach dem Tag, an dem die Eintragung der Verschmelzung in das Register des Sitzes desjenigen Rechtsträgers, dessen Gläubiger sie sind, nach § 19 Abs. 3 UmwG als bekannt gemacht gilt,\nihren Anspruch nach Grund und Höhe schriftlich anmelden, Sicherheit zu leisten, soweit sie nicht Befriedigung verlangen können. Dieses Recht steht den Gläubigern jedoch nur zu, wenn sie glaubhaft machen, dass durch die Verschmelzung die Erfüllung der Forderung gefährdet wird."
    },
    {
      "date": "2024-11-19",
      "original_text": "Einreichung neuer Dokumente\nBrandenburg Amtsgericht Neuruppin HRB 8205\nKreiskrankenhaus Prignitz Seniorenpflegezentrum Perleberg GmbH – Perleberg",
      "type": "Einreichung neuer Dokumente",
      "state": "Brandenburg",
      "amtsgericht": "Amtsgericht Neuruppin",
      "registernummer": "HRB 8205",
      "registerart": "HRB",
      "company_name": "Kreiskrankenhaus Prignitz Seniorenpflegezentrum Perleberg GmbH",
      "company_seat": "Perleberg",
      "details": "19.11.2024 (Bekanntmachungsdatum)\n\nBrandenburg Amtsgericht Neuruppin HRB 8205\nEinreichung neuer Dokumente\n\nKreiskrankenhaus Prignitz Seniorenpflegezentrum Perleberg GmbH\nGesellschaft mit beschränkter Haftung\nPerleberg\n\nAls nicht eingetragen wird veröffentlicht: Eine Liste der Mitglieder des Aufsichtsrates wurde zum Handelsregister eingereicht."
    },
    {
      "date": "2024-11-19",
      "original_text": "Einreichung neuer Dokumente\nBrandenburg Amtsgericht Neuruppin HRB 5426\nKreiskrankenhaus Prignitz Servicegesellschaft GmbH – Perleberg",
      "type": "Einreichung neuer Dokumente",
      "state": "Brandenburg",
      "amtsgericht": "Amtsgericht Neuruppin",
      "registernummer": "HRB 5426",
      "registerart": "HRB",
      "company_name": "Kreiskrankenhaus Prignitz Servicegesellschaft GmbH",
      "company_seat": "Perleberg",
      "details": "19.11.2024 (Bekanntmachungsdatum)\n\nBrandenburg Amtsgericht Neuruppin HRB 5426\nEinreichung neuer Dokumente\n\nKreiskrankenhaus Prignitz Servicegesellschaft GmbH\nGesellschaft mit beschränkter Haftung\nPerleberg\n\nAls nicht eingetragen wird veröffentlicht: Eine Liste der Mitglieder des Aufsichtsrates wurde zum Handelsregister eingereicht."
    },
    {
      "date": "2024-11-19",
      "original_text": "Einreichung neuer Dokumente\nBrandenburg Amtsgericht Neuruppin HRB 4981\nKreiskrankenhaus Prignitz gemeinnützige GmbH – Perleberg",
      "type": "Einreichung neuer Dokumente",
      "state": "Brandenburg",
      "amtsgericht": "Amtsgericht Neuruppin",
      "registernummer": "HRB 4981",
      "registerart": "HRB",
      "company_name": "Kreiskrankenhaus Prignitz gemeinnützige GmbH",
      "company_seat": "Perleberg",
      "details": "19.11.2024 (Bekanntmachungsdatum)\n\nBrandenburg Amtsgericht Neuruppin HRB 4981\nEinreichung neuer Dokumente\n\nKreiskrankenhaus Prignitz gemeinnützige GmbH\nGesellschaft mit beschränkter Haftung\nPerleberg\n\nAls nicht eingetragen wird veröffentlicht: Eine Liste der Mitglieder des Aufsichtsrates wurde zum Handelsregister eingereicht."
    },
    {
      "date": "2024-11-19",
      "original_text": "Löschungsankündigung\nThüringen Amtsgericht Jena HRB 510663\nKreißl Innenausbau GmbH – Erfurt",
      "type": "Löschungsankündigung",
      "state": "Thüringen",
      "amtsgericht": "Amtsgericht Jena",
      "registernummer": "HRB 510663",
      "registerart": "HRB",
      "company_name": "Kreißl Innenausbau GmbH",
      "company_seat": "Erfurt",
      "details": "19.11.2024 (Bekanntmachungsdatum)\n\nThüringen Amtsgericht Jena HRB 510663\nLöschungsankündigung\n\nKreißl Innenausbau GmbH\nGesellschaft mit beschränkter Haftung\nErfurt\n\nDas Registergericht beabsichtigt, die im Handelsregister eingetragene Gesellschaft wegen Vermögenslosigkeit nach § 394 FamFG von Amts wegen zu löschen. Die Frist zur Erhebung eines Widerspruchs gegen die beabsichtigte Löschung wird auf 6 Wochen festgesetzt."
    },
    {
      "date": "2024-11-19",
      "original_text": "Löschungsankündigung\nNiedersachsen Amtsgericht Braunschweig HRB 207363\nLOFT Clean GmbH – Braunschweig",
      "type": "Löschungsankündigung",
      "state": "Niedersachsen",
      "amtsgericht": "Amtsgericht Braunschweig",
      "registernummer": "HRB 207363",
      "registerart": "HRB",
      "company_name": "LOFT Clean GmbH",
      "company_seat": "Braunschweig",
      "details": "19.11.2024 (Bekanntmachungsdatum)\n\nNiedersachsen Amtsgericht Braunschweig HRB 207363\nLöschungsankündigung\n\nLOFT Clean GmbH\nGesellschaft mit beschränkter Haftung\nBraunschweig\n\nDas Registergericht beabsichtigt, die Gesellschaft von Amts wegen nach § 394 FamFG zu löschen. Die Frist zur Erhebung eines Widerspruchs ist auf 1 Monat ab dieser Registerbekanntmachung festgesetzt."
    },
    {
      "date": "2024-11-19",
      "original_text": "Registerbekanntmachung nach dem Umwandlungsgesetz\nRheinland-Pfalz Amtsgericht Koblenz HRB 25853\nLUTRONIK Software GmbH – Grafschaft",
      "type": "Registerbekanntmachung nach dem Umwandlungsgesetz",
      "state": "Rheinland-Pfalz",
      "amtsgericht": "Amtsgericht Koblenz",
      "registernummer": "HRB 25853",
      "registerart": "HRB",
      "company_name": "LUTRONIK Software GmbH",
      "company_seat": "Grafschaft",
      "details": "19.11.2024 (Bekanntmachungsdatum)\n\nRheinland-Pfalz Amtsgericht Koblenz HRB 25853\nRegisterbekanntmachung nach dem Umwandlungsgesetz 19.11.2024 (Eintragungsdatum)\n\nLUTRONIK Software GmbH\nGesellschaft mit beschränkter Haftung\nGrafschaft\n\nAls nicht eingetragen wird veröffentlicht: Den Gläubigern der an der Verschmelzung beteiligten Rechtsträger ist, wenn sie binnen sechs Monaten nach dem Tag, an dem die Eintragung der Verschmelzung in das Register des Sitzes desjenigen Rechtsträgers,dessen Gläubiger sie sind, nach § 19 Abs. 3 UmwG als bekannt gemacht gilt, ihren Anspruch nach Grund und Höhe schriftlich anmelden, Sicherheit zu leisten, soweit sie nicht Befriedigung verlangen können. Dieses Recht steht den Gläubigern jedoch nur zu, wenn sie glaubhaft machen, dass durch die Verschmelzung die Erfüllungd er Forderung gefährdet wird."
    },
    {
      "date": "2024-11-19",
      "original_text": "Registerbekanntmachung nach dem Umwandlungsgesetz\nBayern Amtsgericht Ansbach HRB 2915\nLanghammer & Gasda Beteiligungs-GmbH – Ansbach",
      "type": "Registerbekanntmachung nach dem Umwandlungsgesetz",
      "state": "Bayern",
      "amtsgericht": "Amtsgericht Ansbach",
      "registernummer": "HRB 2915",
      "registerart": "HRB",
      "company_name": "Langhammer & Gasda Beteiligungs-GmbH",
      "company_seat": "Ansbach",
      "details": "19.11.2024 (Bekanntmachungsdatum)\n\nBayern Amtsgericht Ansbach HRB 2915\nRegisterbekanntmachung nach dem Umwandlungsgesetz 15.11.2024 (Eintragungsdatum)\n\nLanghammer & Gasda Beteiligungs-GmbH\nGesellschaft mit beschränkter Haftung\nAnsbach\n\nDen Gläubigern der an der Verschmelzung beteiligten Rechtsträger ist, wenn sie binnen sechs Monaten nach dem Tag, an dem die Eintragung der Verschmelzung in das Register des Sitzes desjenigen Rechtsträgers, dessen Gläubiger sie sind, nach § 19 Abs. 3 UmwG als bekannt gemacht gilt, ihren Anspruch nach Grund und Höhe schriftlich anmelden, Sicherheit zu leisten, soweit sie nicht Befriedigung verlangen können. Dieses Recht steht den Gläubigern jedoch nur zu, wenn sie glaubhaft machen, dass durch die Verschmelzung die Erfüllung ihrer Forderung gefährdet wird."
    },
    {
      "date": "2024-11-19",
      "original_text": "Registerbekanntmachung nach dem Umwandlungsgesetz\nBayern Amtsgericht Fürth HRB 21230\nLeist Gebäudereinigung GmbH – Neustadt a.d.Aisch",
      "type": "Registerbekanntmachung nach dem Umwandlungsgesetz",
      "state": "Bayern",
      "amtsgericht": "Amtsgericht Fürth",
      "registernummer": "HRB 21230",
      "registerart": "HRB",
      "company_name": "Leist Gebäudereinigung GmbH",
      "company_seat": "Neustadt a.d.Aisch",
      "details": "19.11.2024 (Bekanntmachungsdatum)\n\nBayern Amtsgericht Fürth HRB 21230\nRegisterbekanntmachung nach dem Umwandlungsgesetz 18.11.2024 (Eintragungsdatum)\n\nLeist Gebäudereinigung GmbH\nGesellschaft mit beschränkter Haftung\nNeustadt a.d.Aisch\n\nDen Gläubigern der an der Ausgliederung beteiligten Rechtsträger ist, wenn sie binnen sechs Monaten nach dem Tag, an dem die Eintragung der Ausgliederung in das Register des Sitzes desjenigen Rechtsträgers, dessen Gläubiger sie sind, nach §§ 125, 19 Abs. 3 UmwG als bekannt gemacht gilt, ihren Anspruch nach Grund und Höhe schriftlich anmelden, Sicherheit zu leisten, soweit sie nicht Befriedigung verlangen können. Dieses Recht steht den Gläubigern jedoch nur zu, wenn sie glaubhaft machen, dass durch die Ausgliederung die Erfüllung ihrer Forderung gefährdet wird. s"
    },
    {
      "date": "2024-11-19",
      "original_text": "Löschungsankündigung\nBerlin Amtsgericht Berlin (Charlottenburg) HRB 185929\nLes Souvenirs UG (haftungsbeschränkt) – Berlin",
      "type": "Löschungsankündigung",
      "state": "Berlin",
      "amtsgericht": "Amtsgericht Berlin (Charlottenburg)",
      "registernummer": "HRB 185929",
      "registerart": "HRB",
      "company_name": "Les Souvenirs UG (haftungsbeschränkt)",
      "company_seat": "Berlin",
      "details": "19.11.2024 (Bekanntmachungsdatum)\n\nBerlin Amtsgericht Berlin (Charlottenburg) HRB 185929\nLöschungsankündigung\n\nLes Souvenirs UG (haftungsbeschränkt)\nGesellschaft mit beschränkter Haftung\nBerlin\n\nBei der nachstehenden Gesellschaft wird das Amtslöschungsverfahren gemäß § 394 FamFG eingeleitet. Widerspruchsfrist 6 Wochen"
    },
    {
      "date": "2024-11-19",
      "original_text": "Registerbekanntmachung nach dem Umwandlungsgesetz\nBayern Amtsgericht München HRB 248091\nLifeFit Group TopCo GmbH – München",
      "type": "Registerbekanntmachung nach dem Umwandlungsgesetz",
      "state": "Bayern",
      "amtsgericht": "Amtsgericht München",
      "registernummer": "HRB 248091",
      "registerart": "HRB",
      "company_name": "LifeFit Group TopCo GmbH",
      "company_seat": "München",
      "details": "19.11.2024 (Bekanntmachungsdatum)\n\nBayern Amtsgericht München HRB 248091\nRegisterbekanntmachung nach dem Umwandlungsgesetz 18.11.2024 (Eintragungsdatum)\n\nLifeFit Group TopCo GmbH\nGesellschaft mit beschränkter Haftung\nMünchen\n\nDen Gläubigern der an der Verschmelzung beteiligten Rechtsträger ist, wenn sie binnen sechs Monaten nach dem Tag, an dem die Eintragung der Verschmelzung in das Register des Sitzes desjenigen Rechtsträgers, dessen Gläubiger sie sind, nach § 19 Abs. 3 UmwG als bekannt gemacht gilt, ihren Anspruch nach Grund und Höhe schriftlich anmelden, Sicherheit zu leisten, soweit sie nicht Befriedigung verlangen können. Dieses Recht steht den Gläubigern jedoch nur zu, wenn sie glaubhaft machen, dass durch die Verschmelzung die Erfüllung ihrer Forderung gefährdet wird."
    },
    {
      "date": "2024-11-19",
      "original_text": "Einreichung neuer Dokumente\nBayern Amtsgericht München HRB 180068\nM - INVESTAR AG – Isen",
      "type": "Einreichung neuer Dokumente",
      "state": "Bayern",
      "amtsgericht": "Amtsgericht München",
      "registernummer": "HRB 180068",
      "registerart": "HRB",
      "company_name": "M - INVESTAR AG",
      "company_seat": "Isen",
      "details": "19.11.2024 (Bekanntmachungsdatum)\n\nBayern Amtsgericht München HRB 180068\nEinreichung neuer Dokumente\n\nM - INVESTAR AG\nAktiengesellschaft\nIsen\n\nDem Amtsgericht München -Registergericht- ist eine Liste der Mitglieder des Aufsichtsrats eingereicht worden, § 106 AktG."
    },
    {
      "date": "2024-11-19",
      "original_text": "Löschungsankündigung\nSchleswig-Holstein Amtsgericht Flensburg HRB 13387\nMAHPAC GmbH – Handewitt",
      "type": "Löschungsankündigung",
      "state": "Schleswig-Holstein",
      "amtsgericht": "Amtsgericht Flensburg",
      "registernummer": "HRB 13387",
      "registerart": "HRB",
      "company_name": "MAHPAC GmbH",
      "company_seat": "Handewitt",
      "details": "19.11.2024 (Bekanntmachungsdatum)\n\nSchleswig-Holstein Amtsgericht Flensburg HRB 13387\nLöschungsankündigung\n\nMAHPAC GmbH\nGesellschaft mit beschränkter Haftung\nHandewitt\n\nEs ist die Löschung der nachstehenden Gesellschaft wegen Vermögenslosigkeit gemäß § 394 FamFG beabsichtigt.\nWiderspruchsfrist: 2 Monate."
    },
    {
      "date": "2024-11-19",
      "original_text": "Registerbekanntmachung nach dem Umwandlungsgesetz\nHessen Amtsgericht Darmstadt HRA 52347\nMAYER LEHN GmbH & Co. KG Glas & Bauelemente – Ginsheim-Gustavsburg",
      "type": "Registerbekanntmachung nach dem Umwandlungsgesetz",
      "state": "Hessen",
      "amtsgericht": "Amtsgericht Darmstadt",
      "registernummer": "HRA 52347",
      "registerart": "HRA",
      "company_name": "MAYER LEHN GmbH & Co. KG Glas & Bauelemente",
      "company_seat": "Ginsheim-Gustavsburg",
      "details": "19.11.2024 (Bekanntmachungsdatum)\n\nHessen Amtsgericht Darmstadt HRA 52347\nRegisterbekanntmachung nach dem Umwandlungsgesetz 19.11.2024 (Eintragungsdatum)\n\nMAYER LEHN GmbH & Co. KG Glas & Bauelemente\nKommanditgesellschaft\nGinsheim-Gustavsburg\n\nDen Gläubigern der an der Verschmelzung beteiligten Rechtsträger ist, wenn sie binnen sechs Monaten nach dem Tag, an dem die Eintragung der Verschmelzung in das Register des Sitzes derjenigen Rechtsträger deren Gläubiger sie sind, nach § 19 Absatz 3 UmwG bekannt gemacht worden ist, ihren Anspruch nach Grund und Höhe schriftlich anmelden, Sicherheit zu leisten, soweit sie nicht Befriedigung verlangen können. Dieses Recht steht den Gläubigern jedoch nur zu, wenn sie glaubhaft machen, dass durch die Verschmelzung die Erfüllung ihrer Forderung gefährdet wird."
    },
    {
      "date": "2024-11-19",
      "original_text": "Löschungsankündigung\nBayern Amtsgericht Ingolstadt HRB 8715\nMBE Beteiligungsgesellschaft mbH – Pollenfeld",
      "type": "Löschungsankündigung",
      "state": "Bayern",
      "amtsgericht": "Amtsgericht Ingolstadt",
      "registernummer": "HRB 8715",
      "registerart": "HRB",
      "company_name": "MBE Beteiligungsgesellschaft mbH",
      "company_seat": "Pollenfeld",
      "details": "19.11.2024 (Bekanntmachungsdatum)\n\nBayern Amtsgericht Ingolstadt HRB 8715\nLöschungsankündigung\n\nMBE Beteiligungsgesellschaft mbH\nGesellschaft mit beschränkter Haftung\nPollenfeld\n\nDas Registergericht beabsichtigt, die im Handelsregister eingetragene Gesellschaft wegen Vermögenslosigkeit von Amts wegen nach § 394 FamFG zu löschen. Die Frist zur Erhebung eines Widerspruchs ist auf einen Monat festgesetzt."
    },
    {
      "date": "2024-11-19",
      "original_text": "Einreichung neuer Dokumente\nNiedersachsen Amtsgericht Osnabrück HRB 18913\nMICHAELTELECOM AG – Bohmte",
      "type": "Einreichung neuer Dokumente",
      "state": "Niedersachsen",
      "amtsgericht": "Amtsgericht Osnabrück",
      "registernummer": "HRB 18913",
      "registerart": "HRB",
      "company_name": "MICHAELTELECOM AG",
      "company_seat": "Bohmte",
      "details": "19.11.2024 (Bekanntmachungsdatum)\n\nNiedersachsen Amtsgericht Osnabrück HRB 18913\nEinreichung neuer Dokumente\n\nMICHAELTELECOM AG\nAktiengesellschaft\nBohmte\n\nDie Liste der Mitglieder des Aufsichtsrats wurde beim Registergericht eingereicht."
    },
    {
      "date": "2024-11-19",
      "original_text": "Löschungsankündigung\nRheinland-Pfalz Amtsgericht Mainz HRB 43015\nMLB LAB GmbH – Jugenheim",
      "type": "Löschungsankündigung",
      "state": "Rheinland-Pfalz",
      "amtsgericht": "Amtsgericht Mainz",
      "registernummer": "HRB 43015",
      "registerart": "HRB",
      "company_name": "MLB LAB GmbH",
      "company_seat": "Jugenheim",
      "details": "19.11.2024 (Bekanntmachungsdatum)\n\nRheinland-Pfalz Amtsgericht Mainz HRB 43015\nLöschungsankündigung\n\nMLB LAB GmbH\nGesellschaft mit beschränkter Haftung\nJugenheim\n\nDas Registergericht beabsichtigt die Gesellschaft von Amts wegen nach § 394 FamFG zu löschen. Die Frist zur Erhebung eines Widerspruchs ist auf einen Monat festgesetzt."
    },
    {
      "date": "2024-11-19",
      "original_text": "Einreichung neuer Dokumente\nNiedersachsen Amtsgericht Hannover HRB 217148\nMOIA Operations Germany GmbH – Hannover",
      "type": "Einreichung neuer Dokumente",
      "state": "Niedersachsen",
      "amtsgericht": "Amtsgericht Hannover",
      "registernummer": "HRB 217148",
      "registerart": "HRB",
      "company_name": "MOIA Operations Germany GmbH",
      "company_seat": "Hannover",
      "details": "19.11.2024 (Bekanntmachungsdatum)\n\nNiedersachsen Amtsgericht Hannover HRB 217148\nEinreichung neuer Dokumente\n\nMOIA Operations Germany GmbH\nGesellschaft mit beschränkter Haftung\nHannover\n\nDie Liste der Mitglieder des Aufsichtsrats wurde beim Registergericht eingereicht."
    },
    {
      "date": "2024-11-19",
      "original_text": "Registerbekanntmachung nach dem Umwandlungsgesetz\nBaden-Württemberg Amtsgericht Stuttgart HRB 786761\nMW Digital Consulting GmbH – Stuttgart",
      "type": "Registerbekanntmachung nach dem Umwandlungsgesetz",
      "state": "Baden-Württemberg",
      "amtsgericht": "Amtsgericht Stuttgart",
      "registernummer": "HRB 786761",
      "registerart": "HRB",
      "company_name": "MW Digital Consulting GmbH",
      "company_seat": "Stuttgart",
      "details": "19.11.2024 (Bekanntmachungsdatum)\n\nBaden-Württemberg Amtsgericht Stuttgart HRB 786761\nRegisterbekanntmachung nach dem Umwandlungsgesetz 19.11.2024 (Eintragungsdatum)\n\nMW Digital Consulting GmbH\nGesellschaft mit beschränkter Haftung\nStuttgart\n\nAls nicht eingetragen wird bekanntgemacht:\nDen Gläubigern der an der Verschmelzung beteiligten Rechtsträger ist, wenn sie binnen sechs Monaten nach dem Tag, an dem die Eintragung der Verschmelzung in das Register des Sitzes desjenigen Rechtsträgers, dessen Gläubiger sie sind, nach § 19 Abs. 3 UmwG als bekanntgemacht gilt, ihren Anspruch nach Grund und Höhe schriftlich anmelden, Sicherheit zu leisten, soweit sie nicht Befriedigung verlangen können. Dieses Recht steht den Gläubigern jedoch nur zu, wenn sie glaubhaft machen, dass durch die Verschmelzung die Erfüllung ihrer Forderung gefährdet wird."
    },
    {
      "date": "2024-11-19",
      "original_text": "Löschungsankündigung\nNordrhein-Westfalen Amtsgericht Siegen HRB 13408\nMeisterplan UG (haftungsbeschränkt) – Freudenberg",
      "type": "Löschungsankündigung",
      "state": "Nordrhein-Westfalen",
      "amtsgericht": "Amtsgericht Siegen",
      "registernummer": "HRB 13408",
      "registerart": "HRB",
      "company_name": "Meisterplan UG (haftungsbeschränkt)",
      "company_seat": "Freudenberg",
      "details": "19.11.2024 (Bekanntmachungsdatum)\n\nNordrhein-Westfalen Amtsgericht Siegen HRB 13408\nLöschungsankündigung\n\nMeisterplan UG (haftungsbeschränkt)\nGesellschaft mit beschränkter Haftung\nFreudenberg\n\nDas Registergericht beabsichtigt die Gesellschaft von Amts wegen nach § 394 FamFG zu löschen. Die Frist zur Erhebung eines Widerspruchs ist auf drei Monate festgesetzt."
    },
    {
      "date": "2024-11-19",
      "original_text": "Registerbekanntmachung nach dem Umwandlungsgesetz\nBayern Amtsgericht München HRA 119826\nMichaela Sassenbach e.K. – Starnberg",
      "type": "Registerbekanntmachung nach dem Umwandlungsgesetz",
      "state": "Bayern",
      "amtsgericht": "Amtsgericht München",
      "registernummer": "HRA 119826",
      "registerart": "HRA",
      "company_name": "Michaela Sassenbach e.K.",
      "company_seat": "Starnberg",
      "details": "19.11.2024 (Bekanntmachungsdatum)\n\nBayern Amtsgericht München HRA 119826\nRegisterbekanntmachung nach dem Umwandlungsgesetz 18.11.2024 (Eintragungsdatum)\n\nMichaela Sassenbach e.K.\nEinzelkaufmann / Einzelkauffrau\nStarnberg\n\nDen Gläubigern der an der Ausgliederung beteiligten Rechtsträger ist, wenn sie binnen sechs Monaten nach dem Tag, an dem die Eintragung der Ausgliederung in das Register des Sitzes desjenigen Rechtsträgers, dessen Gläubiger sie sind, nach §§ 125, 19 Abs. 3 UmwG als bekannt gemacht gilt, ihren Anspruch nach Grund und Höhe schriftlich anmelden, Sicherheit zu leisten, soweit sie nicht Befriedigung verlangen können. Dieses Recht steht den Gläubigern jedoch nur zu, wenn sie glaubhaft machen, dass durch die Ausgliederung die Erfüllung ihrer Forderung gefährdet wird."
    },
    {
      "date": "2024-11-19",
      "original_text": "Registerbekanntmachung nach dem Umwandlungsgesetz\nBayern Amtsgericht Schweinfurt HRB 8625\nMoja Innovations GmbH – Üchtelhausen",
      "type": "Registerbekanntmachung nach dem Umwandlungsgesetz",
      "state": "Bayern",
      "amtsgericht": "Amtsgericht Schweinfurt",
      "registernummer": "HRB 8625",
      "registerart": "HRB",
      "company_name": "Moja Innovations GmbH",
      "company_seat": "Üchtelhausen",
      "details": "19.11.2024 (Bekanntmachungsdatum)\n\nBayern Amtsgericht Schweinfurt HRB 8625\nRegisterbekanntmachung nach dem Umwandlungsgesetz 18.11.2024 (Eintragungsdatum)\n\nMoja Innovations GmbH\nGesellschaft mit beschränkter Haftung\nÜchtelhausen\n\nDen Gläubigern der an der Verschmelzung beteiligten Rechtsträger ist, wenn sie binnen sechs Monaten nach dem Tag, an dem die Eintragung der Verschmelzung in das Register des Sitzes desjenigen Rechtsträgers, dessen Gläubiger sie sind, nach § 19 Abs. 3 UmwG als bekannt gemacht gilt, ihren Anspruch nach Grund und Höhe schriftlich anmelden, Sicherheit zu leisten, soweit sie nicht Befriedigung verlangen können. Dieses Recht steht den Gläubigern jedoch nur zu, wenn sie glaubhaft machen, dass durch die Verschmelzung die Erfüllung ihrer Forderung gefährdet wird."
    },
    {
      "date": "2024-11-19",
      "original_text": "Registerbekanntmachung nach dem Umwandlungsgesetz\nBayern Amtsgericht Würzburg HRA 8817\nNermin Sacic Verpachtung e. K. – Kitzingen",
      "type": "Registerbekanntmachung nach dem Umwandlungsgesetz",
      "state": "Bayern",
      "amtsgericht": "Amtsgericht Würzburg",
      "registernummer": "HRA 8817",
      "registerart": "HRA",
      "company_name": "Nermin Sacic Verpachtung e. K.",
      "company_seat": "Kitzingen",
      "details": "19.11.2024 (Bekanntmachungsdatum)\n\nBayern Amtsgericht Würzburg HRA 8817\nRegisterbekanntmachung nach dem Umwandlungsgesetz 16.11.2024 (Eintragungsdatum)\n\nNermin Sacic Verpachtung e. K.\nEinzelkaufmann / Einzelkauffrau\nKitzingen\n\nDen Gläubigern der an der Ausgliederung beteiligten Rechtsträger ist, wenn sie binnen sechs Monaten nach dem Tag, an dem die Eintragung der Ausgliederung in das Register des Sitzes desjenigen Rechtsträgers, dessen Gläubiger sie sind, nach §§ 125, 19 Abs. 3 UmwG als bekannt gemacht gilt, ihren Anspruch nach Grund und Höhe schriftlich anmelden, Sicherheit zu leisten, soweit sie nicht Befriedigung verlangen können. Dieses Recht steht den Gläubigern jedoch nur zu, wenn sie glaubhaft machen, dass durch die Ausgliederung die Erfüllung ihrer Forderung gefährdet wird."
    },
    {
      "date": "2024-11-19",
      "original_text": "Löschungsankündigung\nHessen Amtsgericht Bad Hersfeld HRB 2393\nNibas Limited – Niederaula",
      "type": "Löschungsankündigung",
      "state": "Hessen",
      "amtsgericht": "Amtsgericht Bad Hersfeld",
      "registernummer": "HRB 2393",
      "registerart": "HRB",
      "company_name": "Nibas Limited",
      "company_seat": "Niederaula",
      "details": "19.11.2024 (Bekanntmachungsdatum)\n\nHessen Amtsgericht Bad Hersfeld HRB 2393\nLöschungsankündigung\n\nNibas Limited\nRechtsform ausländischen Rechts HRB\nNiederaula\n\nDas Registergericht beabsichtigt die im Handelsregister eingetragene Gesellschaft von Amts wegen nach § 395 FamFG zu löschen. Die Frist zur Erhebung eines Widerspruchs gegen die beabsichtigte Löschung wird auf 5 Wochen festgesetzt."
    },
    {
      "date": "2024-11-19",
      "original_text": "Einreichung neuer Dokumente\nNiedersachsen Amtsgericht Tostedt HRB 110420 früher Amtsgericht Langen\nNordseeheilbad Cuxhaven GmbH – Cuxhaven",
      "type": "Einreichung neuer Dokumente",
      "state": "Niedersachsen",
      "amtsgericht": "Amtsgericht Tostedt",
      "registernummer": "HRB 110420",
      "registerart": "HRB",
      "company_name": "Nordseeheilbad Cuxhaven GmbH",
      "company_seat": "Cuxhaven",
      "former_amtsgericht": "Langen",
      "details": "19.11.2024 (Bekanntmachungsdatum)\n\nNiedersachsen Amtsgericht Tostedt HRB 110420 früher Amtsgericht Langen\nEinreichung neuer Dokumente\n\nNordseeheilbad Cuxhaven GmbH\nGesellschaft mit beschränkter Haftung\nCuxhaven\n\nDie Liste der Mitglieder des Aufsichtsrats wurde beim Registergericht eingereicht."
    },
    {
      "date": "2024-11-19",
      "original_text": "Löschungsankündigung\nBerlin Amtsgericht Berlin (Charlottenburg) HRB 190447\nONE-LOVE Event UG (haftungsbeschränkt) – Berlin",
      "type": "Löschungsankündigung",
      "state": "Berlin",
      "amtsgericht": "Amtsgericht Berlin (Charlottenburg)",
      "registernummer": "HRB 190447",
      "registerart": "HRB",
      "company_name": "ONE-LOVE Event UG (haftungsbeschränkt)",
      "company_seat": "Berlin",
      "details": "19.11.2024 (Bekanntmachungsdatum)\n\nBerlin Amtsgericht Berlin (Charlottenburg) HRB 190447\nLöschungsankündigung\n\nONE-LOVE Event UG (haftungsbeschränkt)\nGesellschaft mit beschränkter Haftung\nBerlin\n\nBei der nachstehenden Gesellschaft wird das Amtslöschungsverfahren gemäß § 394 FamFG eingeleitet. Widerspruchsfrist: 6 Wochen."
    },
    {
      "date": "2024-11-19",
      "original_text": "Löschungsankündigung\nBerlin Amtsgericht Berlin (Charlottenburg) HRB 243653\nOlympia Security GmbH – Berlin",
      "type": "Löschungsankündigung",
      "state": "Berlin",
      "amtsgericht": "Amtsgericht Berlin (Charlottenburg)",
      "registernummer": "HRB 243653",
      "registerart": "HRB",
      "company_name": "Olympia Security GmbH",
      "company_seat": "Berlin",
      "details": "19.11.2024 (Bekanntmachungsdatum)\n\nBerlin Amtsgericht Berlin (Charlottenburg) HRB 243653\nLöschungsankündigung\n\nOlympia Security GmbH\nGesellschaft mit beschränkter Haftung\nBerlin\n\nBei der nachstehenden Gesellschaft wird das Amtslöschungsverfahren gemäß § 394 FamFG eingeleitet. Widerspruchsfrist 6 Wochen"
    },
    {
      "date": "2024-11-19",
      "original_text": "Einreichung neuer Dokumente\nNiedersachsen Amtsgericht Osnabrück HRB 1296\nOsnabrücker Parkstätten- Betriebsgesellschaft mit beschränkter Haftung – Osnabrück",
      "type": "Einreichung neuer Dokumente",
      "state": "Niedersachsen",
      "amtsgericht": "Amtsgericht Osnabrück",
      "registernummer": "HRB 1296",
      "registerart": "HRB",
      "company_name": "Osnabrücker Parkstätten- Betriebsgesellschaft mit beschränkter Haftung",
      "company_seat": "Osnabrück",
      "details": "19.11.2024 (Bekanntmachungsdatum)\n\nNiedersachsen Amtsgericht Osnabrück HRB 1296\nEinreichung neuer Dokumente 01.10.2024 (Eintragungsdatum)\n\nOsnabrücker Parkstätten- Betriebsgesellschaft mit beschränkter Haftung\nGesellschaft mit beschränkter Haftung\nOsnabrück\n\nDie Liste der Mitglieder des Aufsichtsrats wurde beim Registergericht eingereicht."
    },
    {
      "date": "2024-11-19",
      "original_text": "Sonstige Registerbekanntmachung\nBaden-Württemberg Amtsgericht Stuttgart HRB 722999\nPOWRX GmbH – Köngen",
      "type": "Sonstige Registerbekanntmachung",
      "state": "Baden-Württemberg",
      "amtsgericht": "Amtsgericht Stuttgart",
      "registernummer": "HRB 722999",
      "registerart": "HRB",
      "company_name": "POWRX GmbH",
      "company_seat": "Köngen",
      "details": "19.11.2024 (Bekanntmachungsdatum)\n\nBaden-Württemberg Amtsgericht Stuttgart HRB 722999\nSonstige Registerbekanntmachung 19.11.2024 (Eintragungsdatum)\n\nPOWRX GmbH\nGesellschaft mit beschränkter Haftung\nKöngen\n\nAls nicht eingetragen wird bekanntgemacht:\nDen Gläubigern der Gesellschaft, deren Forderungen begründet worden sind, bevor die Eintragung der Beendigung des Vertrages in das Handelsregister nach § 10 HGB als bekanntgemacht gilt, ist vom anderen Vertragsteil Sicherheit zu leisten, wenn sie sich binnen sechs Monaten nach der Bekanntmachung zu diesem Zweck bei ihm melden.\nDen Gläubigern der an der Verschmelzung beteiligten Rechtsträger ist, wenn sie binnen sechs Monaten nach dem Tag, an dem die Eintragung der Verschmelzung in das Register des Sitzes desjenigen Rechtsträgers, dessen Gläubiger sie sind, nach § 19 Abs. 3 UmwG als bekanntgemacht gilt, ihren Anspruch nach Grund und Höhe schriftlich anmelden, Sicherheit zu leisten, soweit sie nicht Befriedigung verlangen können. Dieses Recht steht den Gläubigern jedoch nur zu, wenn sie glaubhaft machen, dass durch die Verschmelzung die Erfüllung ihrer Forderung gefährdet wird."
    },
    {
      "date": "2024-11-19",
      "original_text": "Löschungsankündigung\nBrandenburg Amtsgericht Frankfurt/Oder HRB 10459\nPlanen und Bauen Baubetreuungs GmbH – Wandlitz",
      "type": "Löschungsankündigung",
      "state": "Brandenburg",
      "amtsgericht": "Amtsgericht Frankfurt/Oder",
      "registernummer": "HRB 10459",
      "registerart": "HRB",
      "company_name": "Planen und Bauen Baubetreuungs GmbH",
      "company_seat": "Wandlitz",
      "details": "19.11.2024 (Bekanntmachungsdatum)\n\nBrandenburg Amtsgericht Frankfurt/Oder HRB 10459\nLöschungsankündigung\n\nPlanen und Bauen Baubetreuungs GmbH\nGesellschaft mit beschränkter Haftung\nWandlitz\n\nBei der nachstehenden Gesellschaft wird das Amtslöschungsverfahren gemäß § 394 FamFG eingeleitet."
    },
    {
      "date": "2024-11-19",
      "original_text": "Einreichung neuer Dokumente\nBayern Amtsgericht Coburg HRB 21\nPorzellanfabrik Tettau Gesellschaft mit beschränkter Haftung – Tettau",
      "type": "Einreichung neuer Dokumente",
      "state": "Bayern",
      "amtsgericht": "Amtsgericht Coburg",
      "registernummer": "HRB 21",
      "registerart": "HRB",
      "company_name": "Porzellanfabrik Tettau Gesellschaft mit beschränkter Haftung",
      "company_seat": "Tettau",
      "details": "19.11.2024 (Bekanntmachungsdatum)\n\nBayern Amtsgericht Coburg HRB 21\nEinreichung neuer Dokumente 15.11.2024 (Eintragungsdatum)\n\nPorzellanfabrik Tettau Gesellschaft mit beschränkter Haftung\nGesellschaft mit beschränkter Haftung\nTettau\n\nDem Amtsgericht Coburg -Registergericht- ist eine Liste der Mitglieder des Aufsichtsrats eingereicht worden, § 52 Abs. 3 S. 2 GmbHG."
    },
    {
      "date": "2024-11-19",
      "original_text": "Löschungsankündigung\nBayern Amtsgericht München HRB 245931\nPoseidon Martinsried Gastro UG (haftungsbeschränkt) – Planegg",
      "type": "Löschungsankündigung",
      "state": "Bayern",
      "amtsgericht": "Amtsgericht München",
      "registernummer": "HRB 245931",
      "registerart": "HRB",
      "company_name": "Poseidon Martinsried Gastro UG (haftungsbeschränkt)",
      "company_seat": "Planegg",
      "details": "19.11.2024 (Bekanntmachungsdatum)\n\nBayern Amtsgericht München HRB 245931\nLöschungsankündigung 15.11.2024 (Eintragungsdatum)\n\nPoseidon Martinsried Gastro UG (haftungsbeschränkt)\nGesellschaft mit beschränkter Haftung\nPlanegg\n\nDas Registergericht beabsichtigt, die im Handelsregister eingetragene Gesellschaft wegen Vermögenslosigkeit von Amts wegen nach § 394 FamFG zu löschen. Die Frist zur Erhebung eines Widerspruchs ist auf drei Monate festgesetzt."
    },
    {
      "date": "2024-11-19",
      "original_text": "Löschungsankündigung\nNordrhein-Westfalen Amtsgericht Düsseldorf HRB 77575\nQualisource Global GmbH – Düsseldorf",
      "type": "Löschungsankündigung",
      "state": "Nordrhein-Westfalen",
      "amtsgericht": "Amtsgericht Düsseldorf",
      "registernummer": "HRB 77575",
      "registerart": "HRB",
      "company_name": "Qualisource Global GmbH",
      "company_seat": "Düsseldorf",
      "details": "19.11.2024 (Bekanntmachungsdatum)\n\nNordrhein-Westfalen Amtsgericht Düsseldorf HRB 77575\nLöschungsankündigung\n\nQualisource Global GmbH\nGesellschaft mit beschränkter Haftung\nDüsseldorf\n\nBetr.: Qualisource Global GmbH, Sandstraße 88, 45473 Mülheim an der Ruhr; Sitz Düsseldorf\n\nDas Registergericht beabsichtigt die Gesellschaft von Amts wegen nach § 394 FamFG zu löschen. Die Frist zur Erhebung eines Widerspruchs ist auf 3 Wochen festgesetzt.\n\nRechtsbehelfsbelehrung:\n\nDas Widerspruchsrecht steht jedem zu, der an der Unterlassung der Löschung ein berechtigtes Interesse hat. Der Widerspruch ist bei dem Amtsgericht Düsseldorf -Registergericht-, Werdener Straße 1, 40227 Düsseldorf schriftlich in deutscher Sprache oder zur Niederschrift der Geschäftsstelle einzulegen. Der Widerspruch kann auch zur Niederschrift der Geschäftsstelle eines jeden Amtsgerichtes abgegeben werden. Die Einlegung ist auch durch Übertragung eines elektronischen Dokuments an die elektronische Poststelle des Gerichts möglich. Das elektronische Dokument muss für die Bearbeitung durch das Gericht geeignet und mit einer qualifizierten elektronischen Signatur der verantwortenden Person versehen sein oder von der verantwortenden Person signiert und auf einem sicheren Übermittlungsweg gemäß § 130a ZPO nach näherer Maßgabe der Verordnung über die technischen Rahmenbedingungen des elektronischen Rechtsverkehrs und über das besondere elektronische Behördenpostfach (BGBl. I, S.3803) eingereicht werden. Weitere Informationen erhalten Sie auf der Internetseite www.justiz.de.\nDer Widerspruch muss spätestens innerhalb der gesetzten Frist nach dem Datum der Bekanntmachung der Löschungsankündigung bei dem Amtsgericht - Registergericht - Düsseldorf eingegangen sein.  Dies gilt auch dann, wenn der Widerspruch zur Niederschrift der Geschäftsstelle eines anderen Amtsgerichtes abgegeben wurde. Die Frist beginnt mit dem Tage der Bekanntmachung der Löschungsankündigung in dem für die Bekanntmachung der Eintragungen in das Handelsregister bestimmten elektronischen Informations- und Kommunikationssystem nach § 10 des Handelsgesetzbuches. Fällt das Ende der Frist auf einen Sonntag, einen allgemeinen Feiertag oder Sonnabend, so endet die Frist mit Ablauf des nächsten Werktages.\nDer Widerspruch muss die Bezeichnung der angefochtenen Löschungsankündigung sowie die Erklärung enthalten, dass Widerspruch gegen diese Löschungsankündigung eingelegt wird. Er ist zu unterzeichnen und soll begründet werden."
    },
    {
      "date": "2024-11-19",
      "original_text": "Registerbekanntmachung nach dem Umwandlungsgesetz\nBayern Amtsgericht München HRB 143061\nRP RICHTER GmbH Wirtschaftsprüfungsgesellschaft – München",
      "type": "Registerbekanntmachung nach dem Umwandlungsgesetz",
      "state": "Bayern",
      "amtsgericht": "Amtsgericht München",
      "registernummer": "HRB 143061",
      "registerart": "HRB",
      "company_name": "RP RICHTER GmbH Wirtschaftsprüfungsgesellschaft",
      "company_seat": "München",
      "details": "19.11.2024 (Bekanntmachungsdatum)\n\nBayern Amtsgericht München HRB 143061\nRegisterbekanntmachung nach dem Umwandlungsgesetz 18.11.2024 (Eintragungsdatum)\n\nRP RICHTER GmbH Wirtschaftsprüfungsgesellschaft\nGesellschaft mit beschränkter Haftung\nMünchen\n\nDen Gläubigern der an der Verschmelzung beteiligten Rechtsträger ist, wenn sie binnen sechs Monaten nach dem Tag, an dem die Eintragung der Verschmelzung in das Register des Sitzes desjenigen Rechtsträgers, dessen Gläubiger sie sind, nach § 19 Abs. 3 UmwG als bekannt gemacht gilt, ihren Anspruch nach Grund und Höhe schriftlich anmelden, Sicherheit zu leisten, soweit sie nicht Befriedigung verlangen können. Dieses Recht steht den Gläubigern jedoch nur zu, wenn sie glaubhaft machen, dass durch die Verschmelzung die Erfüllung ihrer Forderung gefährdet wird."
    },
    {
      "date": "2024-11-19",
      "original_text": "Registerbekanntmachung nach dem Umwandlungsgesetz\nNiedersachsen Amtsgericht Oldenburg (Oldenburg) GnR 150020 früher Amtsgericht Cloppenburg\nRaiffeisen Südoldenburg eG – Markhausen",
      "type": "Registerbekanntmachung nach dem Umwandlungsgesetz",
      "state": "Niedersachsen",
      "amtsgericht": "Amtsgericht Oldenburg (Oldenburg)",
      "registernummer": "GnR 150020",
      "registerart": "GnR",
      "company_name": "Raiffeisen Südoldenburg eG",
      "company_seat": "Markhausen",
      "former_amtsgericht": "Cloppenburg",
      "details": "19.11.2024 (Bekanntmachungsdatum)\n\nNiedersachsen Amtsgericht Oldenburg (Oldenburg) GnR 150020 früher Amtsgericht Cloppenburg\nRegisterbekanntmachung nach dem Umwandlungsgesetz 19.11.2024 (Eintragungsdatum)\n\nRaiffeisen Südoldenburg eG\neingetragene Genossenschaft\nMarkhausen\n\nDen Gläubigern der an der Verschmelzung beteiligten Rechtsträger ist, wenn sie binnen sechs Monaten nach dem Tag, an dem die Eintragung der Verschmelzung in das Register des Sitzes desjenigen Rechtsträgers, dessen Gläubiger sie sind, nach § 19  Abs.  3 UmwG als bekannt gemacht gilt, ihren Anspruch nach Grund und Höhe schriftlich anmelden, Sicherheit zu leisten, soweit sie nicht Befriedigung verlangen können. Dieses Recht steht den Gläubigern jedoch nur zu, wenn sie glaubhaft machen, dass durch die Verschmelzung die Erfüllung der Forderung gefährdet wird."
    },
    {
      "date": "2024-11-19",
      "original_text": "Registerbekanntmachung nach dem Umwandlungsgesetz\nNiedersachsen Amtsgericht Oldenburg (Oldenburg) GnR 120007 früher Amtsgericht Westerstede\nRaiffeisen-Warengenossenschaft Ammerland-OstFriesland eG – Wiefelstede",
      "type": "Registerbekanntmachung nach dem Umwandlungsgesetz",
      "state": "Niedersachsen",
      "amtsgericht": "Amtsgericht Oldenburg (Oldenburg)",
      "registernummer": "GnR 120007",
      "registerart": "GnR",
      "company_name": "Raiffeisen-Warengenossenschaft Ammerland-OstFriesland eG",
      "company_seat": "Wiefelstede",
      "former_amtsgericht": "Westerstede",
      "details": "19.11.2024 (Bekanntmachungsdatum)\n\nNiedersachsen Amtsgericht Oldenburg (Oldenburg) GnR 120007 früher Amtsgericht Westerstede\nRegisterbekanntmachung nach dem Umwandlungsgesetz 19.11.2024 (Eintragungsdatum)\n\nRaiffeisen-Warengenossenschaft Ammerland-OstFriesland eG\neingetragene Genossenschaft\nWiefelstede\n\nDen Gläubigern der an der Verschmelzung beteiligten Rechtsträger ist, wenn sie binnen sechs Monaten nach dem Tag, an dem die Eintragung der Verschmelzung in das Register des Sitzes desjenigen Rechtsträgers, dessen Gläubiger sie sind, nach § 19  Abs.  3 UmwG als bekannt gemacht gilt, ihren Anspruch nach Grund und Höhe schriftlich anmelden, Sicherheit zu leisten, soweit sie nicht Befriedigung verlangen können. Dieses Recht steht den Gläubigern jedoch nur zu, wenn sie glaubhaft machen, dass durch die Verschmelzung die Erfüllung der Forderung gefährdet wird."
    },
    {
      "date": "2024-11-19",
      "original_text": "Registerbekanntmachung nach dem Umwandlungsgesetz\nBaden-Württemberg Amtsgericht Ulm HRB 748895\nRainer Hafenbrack GmbH – Tettnang",
      "type": "Registerbekanntmachung nach dem Umwandlungsgesetz",
      "state": "Baden-Württemberg",
      "amtsgericht": "Amtsgericht Ulm",
      "registernummer": "HRB 748895",
      "registerart": "HRB",
      "company_name": "Rainer Hafenbrack GmbH",
      "company_seat": "Tettnang",
      "details": "19.11.2024 (Bekanntmachungsdatum)\n\nBaden-Württemberg Amtsgericht Ulm HRB 748895\nRegisterbekanntmachung nach dem Umwandlungsgesetz 19.11.2024 (Eintragungsdatum)\n\nRainer Hafenbrack GmbH\nGesellschaft mit beschränkter Haftung\nTettnang\n\nAls nicht eingetragen wird bekanntgemacht:\nDen Gläubigern der an der Ausgliederung beteiligten Rechtsträger ist, wenn sie binnen sechs Monaten nach dem Tag, an dem die Eintragung der Ausgliederung in das Register des Sitzes desjenigen Rechtsträgers, dessen Gläubiger sie sind, nach § 19 Abs. 3 UmwG als bekanntgemacht gilt, ihren Anspruch nach Grund und Höhe schriftlich anmelden, Sicherheit zu leisten, soweit sie nicht Befriedigung verlangen können. Dieses Recht steht den Gläubigern jedoch nur zu, wenn sie glaubhaft machen, dass durch die Ausgliederung die Erfüllung ihrer Forderung gefährdet wird."
    },
    {
      "date": "2024-11-19",
      "original_text": "Registerbekanntmachung nach dem Umwandlungsgesetz\nBaden-Württemberg Amtsgericht Ulm HRA 631033\nRainer Hafenbrack, Putz, Stuck, Gerüstbau e.K. – Tettnang",
      "type": "Registerbekanntmachung nach dem Umwandlungsgesetz",
      "state": "Baden-Württemberg",
      "amtsgericht": "Amtsgericht Ulm",
      "registernummer": "HRA 631033",
      "registerart": "HRA",
      "company_name": "Rainer Hafenbrack, Putz, Stuck, Gerüstbau e.K.",
      "company_seat": "Tettnang",
      "details": "19.11.2024 (Bekanntmachungsdatum)\n\nBaden-Württemberg Amtsgericht Ulm HRA 631033\nRegisterbekanntmachung nach dem Umwandlungsgesetz 19.11.2024 (Eintragungsdatum)\n\nRainer Hafenbrack, Putz, Stuck, Gerüstbau e.K.\nEinzelkaufmann / Einzelkauffrau\nTettnang\n\nAls nicht eingetragen wird bekanntgemacht:\nDen Gläubigern der an der Ausgliederung beteiligten Rechtsträger ist, wenn sie binnen sechs Monaten nach dem Tag, an dem die Eintragung der Ausgliederung in das Register des Sitzes desjenigen Rechtsträgers, dessen Gläubiger sie sind, nach § 19 Abs. 3 UmwG als bekanntgemacht gilt, ihren Anspruch nach Grund und Höhe schriftlich anmelden, Sicherheit zu leisten, soweit sie nicht Befriedigung verlangen können. Dieses Recht steht den Gläubigern jedoch nur zu, wenn sie glaubhaft machen, dass durch die Ausgliederung die Erfüllung ihrer Forderung gefährdet wird."
    },
    {
      "date": "2024-11-19",
      "original_text": "Registerbekanntmachung nach dem Umwandlungsgesetz\nHessen Amtsgericht Frankfurt am Main HRB 119395\nRazor Group Acquisition V UG (haftungsbeschränkt) – Frankfurt am Main",
      "type": "Registerbekanntmachung nach dem Umwandlungsgesetz",
      "state": "Hessen",
      "amtsgericht": "Amtsgericht Frankfurt am Main",
      "registernummer": "HRB 119395",
      "registerart": "HRB",
      "company_name": "Razor Group Acquisition V UG (haftungsbeschränkt)",
      "company_seat": "Frankfurt am Main",
      "details": "19.11.2024 (Bekanntmachungsdatum)\n\nHessen Amtsgericht Frankfurt am Main HRB 119395\nRegisterbekanntmachung nach dem Umwandlungsgesetz 19.11.2024 (Eintragungsdatum)\n\nRazor Group Acquisition V UG (haftungsbeschränkt)\nGesellschaft mit beschränkter Haftung\nFrankfurt am Main\n\nDen Gläubigern der an der Verschmelzung beteiligten Rechtsträger ist, wenn sie binnen sechs Monaten nach dem Tag, an dem die Eintragung der Verschmelzung in das Register des Sitzes desjenigen Rechtsträgers, dessen Gläubiger sie sind, nach § 19 Absatz 3 UmwG bekannt gemacht worden ist, ihren Anspruch nach Grund und Höhe schriftlich anmelden, Sicherheit zu leisten, soweit sie nicht Befriedigung verlangen können. Dieses Recht steht den Gläubigern jedoch nur zu, wenn sie glaubhaft machen, dass durch die Verschmelzung die Erfüllung ihrer Forderung gefährdet wird."
    },
    {
      "date": "2024-11-19",
      "original_text": "Registerbekanntmachung nach dem Umwandlungsgesetz\nHessen Amtsgericht Frankfurt am Main HRB 119395\nRazor Group Acquisition V UG (haftungsbeschränkt) – Frankfurt am Main",
      "type": "Registerbekanntmachung nach dem Umwandlungsgesetz",
      "state": "Hessen",
      "amtsgericht": "Amtsgericht Frankfurt am Main",
      "registernummer": "HRB 119395",
      "registerart": "HRB",
      "company_name": "Razor Group Acquisition V UG (haftungsbeschränkt)",
      "company_seat": "Frankfurt am Main",
      "details": "19.11.2024 (Bekanntmachungsdatum)\n\nHessen Amtsgericht Frankfurt am Main HRB 119395\nRegisterbekanntmachung nach dem Umwandlungsgesetz 19.11.2024 (Eintragungsdatum)\n\nRazor Group Acquisition V UG (haftungsbeschränkt)\nGesellschaft mit beschränkter Haftung\nFrankfurt am Main\n\nDen Gläubigern der an der Verschmelzung beteiligten Rechtsträger ist, wenn sie binnen sechs Monaten nach dem Tag, an dem die Eintragung der Verschmelzung in das Register des Sitzes desjenigen Rechtsträgers, dessen Gläubiger sie sind, nach § 19 Absatz 3 UmwG bekannt gemacht worden ist, ihren Anspruch nach Grund und Höhe schriftlich anmelden, Sicherheit zu leisten, soweit sie nicht Befriedigung verlangen können. Dieses Recht steht den Gläubigern jedoch nur zu, wenn sie glaubhaft machen, dass durch die Verschmelzung die Erfüllung ihrer Forderung gefährdet wird."
    },
    {
      "date": "2024-11-19",
      "original_text": "Registerbekanntmachung nach dem Umwandlungsgesetz\nHessen Amtsgericht Frankfurt am Main HRB 119395\nRazor Group Acquisition V UG (haftungsbeschränkt) – Frankfurt am Main",
      "type": "Registerbekanntmachung nach dem Umwandlungsgesetz",
      "state": "Hessen",
      "amtsgericht": "Amtsgericht Frankfurt am Main",
      "registernummer": "HRB 119395",
      "registerart": "HRB",
      "company_name": "Razor Group Acquisition V UG (haftungsbeschränkt)",
      "company_seat": "Frankfurt am Main",
      "details": "19.11.2024 (Bekanntmachungsdatum)\n\nHessen Amtsgericht Frankfurt am Main HRB 119395\nRegisterbekanntmachung nach dem Umwandlungsgesetz 19.11.2024 (Eintragungsdatum)\n\nRazor Group Acquisition V UG (haftungsbeschränkt)\nGesellschaft mit beschränkter Haftung\nFrankfurt am Main\n\nDen Gläubigern der an der Verschmelzung beteiligten Rechtsträger ist, wenn sie binnen sechs Monaten nach dem Tag, an dem die Eintragung der Verschmelzung in das Register des Sitzes desjenigen Rechtsträgers, dessen Gläubiger sie sind, nach § 19 Absatz 3 UmwG bekannt gemacht worden ist, ihren Anspruch nach Grund und Höhe schriftlich anmelden, Sicherheit zu leisten, soweit sie nicht Befriedigung verlangen können. Dieses Recht steht den Gläubigern jedoch nur zu, wenn sie glaubhaft machen, dass durch die Verschmelzung die Erfüllung ihrer Forderung gefährdet wird."
    },
    {
      "date": "2024-11-19",
      "original_text": "Löschungsankündigung\nBaden-Württemberg Amtsgericht Mannheim HRB 702747\nReal Estate Investment Developing Beteiligungs- und Verwaltungs GmbH – Hockenheim",
      "type": "Löschungsankündigung",
      "state": "Baden-Württemberg",
      "amtsgericht": "Amtsgericht Mannheim",
      "registernummer": "HRB 702747",
      "registerart": "HRB",
      "company_name": "Real Estate Investment Developing Beteiligungs- und Verwaltungs GmbH",
      "company_seat": "Hockenheim",
      "details": "19.11.2024 (Bekanntmachungsdatum)\n\nBaden-Württemberg Amtsgericht Mannheim HRB 702747\nLöschungsankündigung\n\nReal Estate Investment Developing Beteiligungs- und Verwaltungs GmbH\nGesellschaft mit beschränkter Haftung\nHockenheim\n\nDas Gericht beabsichtigt, die Gesellschaft wegen Vermögenslosigkeit im Handelsregister von Amts wegen nach § 394 FamFG zu löschen. Die Frist zur Geltendmachung eines Widerspruchs gegen die beabsichtigte Löschung ist auf einen Monat ab Veröffentlichung bestimmt."
    },
    {
      "date": "2024-11-19",
      "original_text": "Registerbekanntmachung nach dem Umwandlungsgesetz\nBayern Amtsgericht Schweinfurt HRB 8574\nSAVI Venture UG (haftungsbeschränkt) – Üchtelhausen",
      "type": "Registerbekanntmachung nach dem Umwandlungsgesetz",
      "state": "Bayern",
      "amtsgericht": "Amtsgericht Schweinfurt",
      "registernummer": "HRB 8574",
      "registerart": "HRB",
      "company_name": "SAVI Venture UG (haftungsbeschränkt)",
      "company_seat": "Üchtelhausen",
      "details": "19.11.2024 (Bekanntmachungsdatum)\n\nBayern Amtsgericht Schweinfurt HRB 8574\nRegisterbekanntmachung nach dem Umwandlungsgesetz 18.11.2024 (Eintragungsdatum)\n\nSAVI Venture UG (haftungsbeschränkt)\nGesellschaft mit beschränkter Haftung\nÜchtelhausen\n\nDen Gläubigern der an der Verschmelzung beteiligten Rechtsträger ist, wenn sie binnen sechs Monaten nach dem Tag, an dem die Eintragung der Verschmelzung in das Register des Sitzes desjenigen Rechtsträgers, dessen Gläubiger sie sind, nach § 19 Abs. 3 UmwG als bekannt gemacht gilt, ihren Anspruch nach Grund und Höhe schriftlich anmelden, Sicherheit zu leisten, soweit sie nicht Befriedigung verlangen können. Dieses Recht steht den Gläubigern jedoch nur zu, wenn sie glaubhaft machen, dass durch die Verschmelzung die Erfüllung ihrer Forderung gefährdet wird."
    },
    {
      "date": "2024-11-19",
      "original_text": "Registerbekanntmachung nach dem Umwandlungsgesetz\nBayern Amtsgericht Würzburg HRB 13403\nSN Transport GmbH – Kitzingen",
      "type": "Registerbekanntmachung nach dem Umwandlungsgesetz",
      "state": "Bayern",
      "amtsgericht": "Amtsgericht Würzburg",
      "registernummer": "HRB 13403",
      "registerart": "HRB",
      "company_name": "SN Transport GmbH",
      "company_seat": "Kitzingen",
      "details": "19.11.2024 (Bekanntmachungsdatum)\n\nBayern Amtsgericht Würzburg HRB 13403\nRegisterbekanntmachung nach dem Umwandlungsgesetz 16.11.2024 (Eintragungsdatum)\n\nSN Transport GmbH\nGesellschaft mit beschränkter Haftung\nKitzingen\n\nDen Gläubigern der an der Ausgliederung beteiligten Rechtsträger ist, wenn sie binnen sechs Monaten nach dem Tag, an dem die Eintragung der Ausgliederung in das Register des Sitzes desjenigen Rechtsträgers, dessen Gläubiger sie sind, nach §§ 125, 19 Abs. 3 UmwG als bekannt gemacht gilt, ihren Anspruch nach Grund und Höhe schriftlich anmelden, Sicherheit zu leisten, soweit sie nicht Befriedigung verlangen können. Dieses Recht steht den Gläubigern jedoch nur zu, wenn sie glaubhaft machen, dass durch die Ausgliederung die Erfüllung ihrer Forderung gefährdet wird."
    },
    {
      "date": "2024-11-19",
      "original_text": "Registerbekanntmachung nach dem Umwandlungsgesetz\nBayern Amtsgericht Bamberg HRB 110\nSPS Germany GmbH – Bamberg",
      "type": "Registerbekanntmachung nach dem Umwandlungsgesetz",
      "state": "Bayern",
      "amtsgericht": "Amtsgericht Bamberg",
      "registernummer": "HRB 110",
      "registerart": "HRB",
      "company_name": "SPS Germany GmbH",
      "company_seat": "Bamberg",
      "details": "19.11.2024 (Bekanntmachungsdatum)\n\nBayern Amtsgericht Bamberg HRB 110\nRegisterbekanntmachung nach dem Umwandlungsgesetz 15.11.2024 (Eintragungsdatum)\n\nSPS Germany GmbH\nGesellschaft mit beschränkter Haftung\nBamberg\n\nDen Gläubigern der an der Verschmelzung beteiligten Rechtsträger ist, wenn sie binnen sechs Monaten nach dem Tag, an dem die Eintragung der Verschmelzung in das Register des Sitzes desjenigen Rechtsträgers, dessen Gläubiger sie sind, nach § 19 Abs. 3 UmwG als bekannt gemacht gilt, ihren Anspruch nach Grund und Höhe schriftlich anmelden, Sicherheit zu leisten, soweit sie nicht Befriedigung verlangen können. Dieses Recht steht den Gläubigern jedoch nur zu, wenn sie glaubhaft machen, dass durch die Verschmelzung die Erfüllung ihrer Forderung gefährdet wird."
    },
    {
      "date": "2024-11-19",
      "original_text": "Registerbekanntmachung nach dem Umwandlungsgesetz\nBaden-Württemberg Amtsgericht Stuttgart HRA 741349\nSTACKIT Holding GmbH & Co. KG – Neckarsulm",
      "type": "Registerbekanntmachung nach dem Umwandlungsgesetz",
      "state": "Baden-Württemberg",
      "amtsgericht": "Amtsgericht Stuttgart",
      "registernummer": "HRA 741349",
      "registerart": "HRA",
      "company_name": "STACKIT Holding GmbH & Co. KG",
      "company_seat": "Neckarsulm",
      "details": "19.11.2024 (Bekanntmachungsdatum)\n\nBaden-Württemberg Amtsgericht Stuttgart HRA 741349\nRegisterbekanntmachung nach dem Umwandlungsgesetz 19.11.2024 (Eintragungsdatum)\n\nSTACKIT Holding GmbH & Co. KG\nKommanditgesellschaft\nNeckarsulm\n\nAls nicht eingetragen wird bekanntgemacht:\nDen Gläubigern der an der Abspaltung beteiligten Rechtsträger ist, wenn sie binnen sechs Monaten nach dem Tag, an dem die Eintragung der Abspaltung in das Register des Sitzes desjenigen Rechtsträgers, dessen Gläubiger sie sind, nach § 19 Abs. 3 UmwG als bekanntgemacht gilt, ihren Anspruch nach Grund und Höhe schriftlich anmelden, Sicherheit zu leisten, soweit sie nicht Befriedigung verlangen können. Dieses Recht steht den Gläubigern jedoch nur zu, wenn sie glaubhaft machen, dass durch die Abspaltung die Erfüllung ihrer Forderung gefährdet wird."
    },
    {
      "date": "2024-11-19",
      "original_text": "Löschungsankündigung\nBayern Amtsgericht München HRB 257489\nSTEINKÖNIG Bauunternehmung GmbH – Unterhaching",
      "type": "Löschungsankündigung",
      "state": "Bayern",
      "amtsgericht": "Amtsgericht München",
      "registernummer": "HRB 257489",
      "registerart": "HRB",
      "company_name": "STEINKÖNIG Bauunternehmung GmbH",
      "company_seat": "Unterhaching",
      "details": "19.11.2024 (Bekanntmachungsdatum)\n\nBayern Amtsgericht München HRB 257489\nLöschungsankündigung\n\nSTEINKÖNIG Bauunternehmung GmbH\nGesellschaft mit beschränkter Haftung\nUnterhaching\n\nDas Registergericht beabsichtigt, die im Handelsregister eingetragene Gesellschaft wegen Vermögenslosigkeit von Amts wegen nach § 394 FamFG zu löschen. Die Frist zur Erhebung eines Widerspruchs ist auf drei Monate festgesetzt."
    },
    {
      "date": "2024-11-19",
      "original_text": "Einreichung neuer Dokumente\nBaden-Württemberg Amtsgericht Stuttgart HRB 211282\nSanierungs- und Entwicklungsgesellschaft Ostfildern mit beschränkter Haftung (SEG Ostfildern) – Ostfildern",
      "type": "Einreichung neuer Dokumente",
      "state": "Baden-Württemberg",
      "amtsgericht": "Amtsgericht Stuttgart",
      "registernummer": "HRB 211282",
      "registerart": "HRB",
      "company_name": "Sanierungs- und Entwicklungsgesellschaft Ostfildern mit beschränkter Haftung (SEG Ostfildern)",
      "company_seat": "Ostfildern",
      "details": "19.11.2024 (Bekanntmachungsdatum)\n\nBaden-Württemberg Amtsgericht Stuttgart HRB 211282\nEinreichung neuer Dokumente\n\nSanierungs- und Entwicklungsgesellschaft Ostfildern mit beschränkter Haftung (SEG Ostfildern)\nGesellschaft mit beschränkter Haftung\nOstfildern\n\nDie Gesellschaft hat am 18.11.2024 die Liste über die Zusammensetzung des Aufsichtsrats zum Handelsregister eingereicht."
    },
    {
      "date": "2024-11-19",
      "original_text": "Sonstige Registerbekanntmachung\nMecklenburg-Vorpommern Amtsgericht Schwerin HRB 13562\nSchwerinCOM Telekommunikation GmbH – Schwerin",
      "type": "Sonstige Registerbekanntmachung",
      "state": "Mecklenburg-Vorpommern",
      "amtsgericht": "Amtsgericht Schwerin",
      "registernummer": "HRB 13562",
      "registerart": "HRB",
      "company_name": "SchwerinCOM Telekommunikation GmbH",
      "company_seat": "Schwerin",
      "details": "19.11.2024 (Bekanntmachungsdatum)\n\nMecklenburg-Vorpommern Amtsgericht Schwerin HRB 13562\nSonstige Registerbekanntmachung 19.11.2024 (Eintragungsdatum)\n\nSchwerinCOM Telekommunikation GmbH\nGesellschaft mit beschränkter Haftung\nSchwerin\n\nEine Liste der Mitglieder des Aufsichtsrats ist zum Handelsregister eingereicht worden."
    },
    {
      "date": "2024-11-19",
      "original_text": "Sonstige Registerbekanntmachung\nBayern Amtsgericht München HRB 264358\nSchön Klinik Medizinisches Versorgungszentrum GmbH – München",
      "type": "Sonstige Registerbekanntmachung",
      "state": "Bayern",
      "amtsgericht": "Amtsgericht München",
      "registernummer": "HRB 264358",
      "registerart": "HRB",
      "company_name": "Schön Klinik Medizinisches Versorgungszentrum GmbH",
      "company_seat": "München",
      "details": "19.11.2024 (Bekanntmachungsdatum)\n\nBayern Amtsgericht München HRB 264358\nSonstige Registerbekanntmachung 18.11.2024 (Eintragungsdatum)\n\nSchön Klinik Medizinisches Versorgungszentrum GmbH\nGesellschaft mit beschränkter Haftung\nMünchen\n\nDen Gläubigern der Gesellschaft, deren Forderungen begründet worden sind, bevor die Eintragung der Beendigung des Gewinnabführungsvertrages in das Handelsregister nach § 10 des Handelsgesetzbuches als bekanntgemacht gilt, hat der andere Vertragsteil Sicherheit zu leisten, wenn sie sich binnen sechs Monaten nach der Bekanntmachung der Eintragung zu diesem Zweck bei ihm melden."
    },
    {
      "date": "2024-11-19",
      "original_text": "Registerbekanntmachung nach dem Umwandlungsgesetz\nNordrhein-Westfalen Amtsgericht Düsseldorf HRB 86486\nShow MEP Beteiligungs GmbH – Düsseldorf",
      "type": "Registerbekanntmachung nach dem Umwandlungsgesetz",
      "state": "Nordrhein-Westfalen",
      "amtsgericht": "Amtsgericht Düsseldorf",
      "registernummer": "HRB 86486",
      "registerart": "HRB",
      "company_name": "Show MEP Beteiligungs GmbH",
      "company_seat": "Düsseldorf",
      "details": "19.11.2024 (Bekanntmachungsdatum)\n\nNordrhein-Westfalen Amtsgericht Düsseldorf HRB 86486\nRegisterbekanntmachung nach dem Umwandlungsgesetz 19.11.2024 (Eintragungsdatum)\n\nShow MEP Beteiligungs GmbH\nGesellschaft mit beschränkter Haftung\nDüsseldorf\n\nDen Gläubigern der an der Verschmelzung beteiligten Rechtsträger ist, wenn sie binnen sechs Monaten nach dem Tag, an dem die Eintragung der Verschmelzung in das Register des Sitzes desjenigen Rechtsträgers, dessen Gläubiger sie sind, nach § 19 Absatz 3 UmwG als bekanntgemacht gilt, ihren Anspruch nach Grund und Höhe schriftlich anmelden, Sicherheit zu leisten, soweit sie nicht Befriedigung verlangen können. Dieses Recht steht den Gläubigern jedoch nur zu, wenn sie glaubhaft machen, dass durch die Verschmelzung die Erfüllung ihrer Forderung gefährdet wird."
    },
    {
      "date": "2024-11-19",
      "original_text": "Löschungsankündigung\nNordrhein-Westfalen Amtsgericht Siegen HRB 9250\nSiBAtec GmbH Betriebs- und Anlagentechnik – Wilnsdorf",
      "type": "Löschungsankündigung",
      "state": "Nordrhein-Westfalen",
      "amtsgericht": "Amtsgericht Siegen",
      "registernummer": "HRB 9250",
      "registerart": "HRB",
      "company_name": "SiBAtec GmbH Betriebs- und Anlagentechnik",
      "company_seat": "Wilnsdorf",
      "details": "19.11.2024 (Bekanntmachungsdatum)\n\nNordrhein-Westfalen Amtsgericht Siegen HRB 9250\nLöschungsankündigung\n\nSiBAtec GmbH Betriebs- und Anlagentechnik\nGesellschaft mit beschränkter Haftung\nWilnsdorf\n\nDas Registergericht beabsichtigt die Gesellschaft von Amts wegen nach § 394 FamFG zu löschen. Die Frist zur Erhebung eines Widerspruchs ist auf drei Monate festgesetzt."
    },
    {
      "date": "2024-11-19",
      "original_text": "Löschungsankündigung\nSchleswig-Holstein Amtsgericht Flensburg HRB 16265\nSievers Erdarbeiten GmbH – Klein Bennebek",
      "type": "Löschungsankündigung",
      "state": "Schleswig-Holstein",
      "amtsgericht": "Amtsgericht Flensburg",
      "registernummer": "HRB 16265",
      "registerart": "HRB",
      "company_name": "Sievers Erdarbeiten GmbH",
      "company_seat": "Klein Bennebek",
      "details": "19.11.2024 (Bekanntmachungsdatum)\n\nSchleswig-Holstein Amtsgericht Flensburg HRB 16265\nLöschungsankündigung\n\nSievers Erdarbeiten GmbH\nGesellschaft mit beschränkter Haftung\nKlein Bennebek\n\nEs ist die Löschung der nachstehenden Gesellschaft wegen Vermögenslosigkeit gemäß § 394 FamFG beabsichtigt.\nWiderspruchsfrist: 2 Monate."
    },
    {
      "date": "2024-11-19",
      "original_text": "Löschungsankündigung\nBayern Amtsgericht München HRB 177766\nSolyndra GmbH – Holzkirchen",
      "type": "Löschungsankündigung",
      "state": "Bayern",
      "amtsgericht": "Amtsgericht München",
      "registernummer": "HRB 177766",
      "registerart": "HRB",
      "company_name": "Solyndra GmbH",
      "company_seat": "Holzkirchen",
      "details": "19.11.2024 (Bekanntmachungsdatum)\n\nBayern Amtsgericht München HRB 177766\nLöschungsankündigung\n\nSolyndra GmbH\nGesellschaft mit beschränkter Haftung\nHolzkirchen\n\nDas Registergericht beabsichtigt, die im Handelsregister eingetragene Gesellschaft wegen Vermögenslosigkeit von Amts wegen nach § 394 FamFG zu löschen. Die Frist zur Erhebung eines Widerspruchs ist auf drei Monate festgesetzt."
    },
    {
      "date": "2024-11-19",
      "original_text": "Einreichung neuer Dokumente\nBaden-Württemberg Amtsgericht Freiburg HRB 630367\nStadtwerke Bad Säckingen GmbH – Bad Säckingen",
      "type": "Einreichung neuer Dokumente",
      "state": "Baden-Württemberg",
      "amtsgericht": "Amtsgericht Freiburg",
      "registernummer": "HRB 630367",
      "registerart": "HRB",
      "company_name": "Stadtwerke Bad Säckingen GmbH",
      "company_seat": "Bad Säckingen",
      "details": "19.11.2024 (Bekanntmachungsdatum)\n\nBaden-Württemberg Amtsgericht Freiburg HRB 630367\nEinreichung neuer Dokumente\n\nStadtwerke Bad Säckingen GmbH\nGesellschaft mit beschränkter Haftung\nBad Säckingen\n\nDie Gesellschaft hat am 05.10.2024 die Liste über die Zusammensetzung des Aufsichtsrats zum Handelsregister eingereicht."
    },
    {
      "date": "2024-11-19",
      "original_text": "Einreichung neuer Dokumente\nBaden-Württemberg Amtsgericht Mannheim HRB 240414\nStadtwerke Bretten Gesellschaft mit beschränkter Haftung – Bretten",
      "type": "Einreichung neuer Dokumente",
      "state": "Baden-Württemberg",
      "amtsgericht": "Amtsgericht Mannheim",
      "registernummer": "HRB 240414",
      "registerart": "HRB",
      "company_name": "Stadtwerke Bretten Gesellschaft mit beschränkter Haftung",
      "company_seat": "Bretten",
      "details": "19.11.2024 (Bekanntmachungsdatum)\n\nBaden-Württemberg Amtsgericht Mannheim HRB 240414\nEinreichung neuer Dokumente\n\nStadtwerke Bretten Gesellschaft mit beschränkter Haftung\nGesellschaft mit beschränkter Haftung\nBretten\n\nDie Gesellschaft hat am 18.11.2024 die Liste über die Zusammensetzung des Aufsichtsrats zum Handelsregister eingereicht."
    },
    {
      "date": "2024-11-19",
      "original_text": "Einreichung neuer Dokumente\nBaden-Württemberg Amtsgericht Freiburg HRB 410447\nStädtische Wohnungsbaugesellschaft mbH Rheinfelden – Rheinfelden (Baden)",
      "type": "Einreichung neuer Dokumente",
      "state": "Baden-Württemberg",
      "amtsgericht": "Amtsgericht Freiburg",
      "registernummer": "HRB 410447",
      "registerart": "HRB",
      "company_name": "Städtische Wohnungsbaugesellschaft mbH Rheinfelden",
      "company_seat": "Rheinfelden (Baden)",
      "details": "19.11.2024 (Bekanntmachungsdatum)\n\nBaden-Württemberg Amtsgericht Freiburg HRB 410447\nEinreichung neuer Dokumente 19.11.2024 (Eintragungsdatum)\n\nStädtische Wohnungsbaugesellschaft mbH Rheinfelden\nGesellschaft mit beschränkter Haftung\nRheinfelden (Baden)\n\nAls nicht eingetragen wird bekanntgemacht:\nDie Gesellschaft hat am 18.11.2024 die Liste über die Zusammensetzung des Aufsichtsrats zum Handelsregister eingereicht."
    },
    {
      "date": "2024-11-19",
      "original_text": "Löschungsankündigung\nBerlin Amtsgericht Berlin (Charlottenburg) HRB 213386\nSupreme Cars GmbH – Berlin",
      "type": "Löschungsankündigung",
      "state": "Berlin",
      "amtsgericht": "Amtsgericht Berlin (Charlottenburg)",
      "registernummer": "HRB 213386",
      "registerart": "HRB",
      "company_name": "Supreme Cars GmbH",
      "company_seat": "Berlin",
      "details": "19.11.2024 (Bekanntmachungsdatum)\n\nBerlin Amtsgericht Berlin (Charlottenburg) HRB 213386\nLöschungsankündigung\n\nSupreme Cars GmbH\nGesellschaft mit beschränkter Haftung\nBerlin\n\nBei der nachstehenden Gesellschaft wird das Amtslöschungsverfahren gemäß § 394 FamFG eingeleitet. Widerspruchsfrist 6 Wochen"
    },
    {
      "date": "2024-11-19",
      "original_text": "Registerbekanntmachung nach dem Umwandlungsgesetz\nNordrhein-Westfalen Amtsgericht Coesfeld HRB 8992\nTBP Gewerbebau Komplementär GmbH – Bocholt",
      "type": "Registerbekanntmachung nach dem Umwandlungsgesetz",
      "state": "Nordrhein-Westfalen",
      "amtsgericht": "Amtsgericht Coesfeld",
      "registernummer": "HRB 8992",
      "registerart": "HRB",
      "company_name": "TBP Gewerbebau Komplementär GmbH",
      "company_seat": "Bocholt",
      "details": "19.11.2024 (Bekanntmachungsdatum)\n\nNordrhein-Westfalen Amtsgericht Coesfeld HRB 8992\nRegisterbekanntmachung nach dem Umwandlungsgesetz 19.11.2024 (Eintragungsdatum)\n\nTBP Gewerbebau Komplementär GmbH\nGesellschaft mit beschränkter Haftung\nBocholt\n\nDen Gläubigern der an der Verschmelzung beteiligten Rechtsträger ist, wenn sie binnen sechs Monaten nach dem Tag, an dem die Eintragung der Verschmelzung in das Register des Sitzes derjenigen Rechtsträger deren Gläubiger sie sind, nach § 19 Absatz 3 UmwG als bekanntgemacht gilt, ihren Anspruch nach Grund und Höhe schriftlich anmelden, Sicherheit zu leisten, soweit sie nicht Befriedigung verlangen können. Dieses Recht steht den Gläubigern jedoch nur zu, wenn sie glaubhaft machen, dass durch die Verschmelzung die Erfüllung ihrer Forderung gefährdet wird."
    },
    {
      "date": "2024-11-19",
      "original_text": "Löschungsankündigung\nBaden-Württemberg Amtsgericht Stuttgart HRB 787442\nTEMI GmbH – Pliezhausen",
      "type": "Löschungsankündigung",
      "state": "Baden-Württemberg",
      "amtsgericht": "Amtsgericht Stuttgart",
      "registernummer": "HRB 787442",
      "registerart": "HRB",
      "company_name": "TEMI GmbH",
      "company_seat": "Pliezhausen",
      "details": "19.11.2024 (Bekanntmachungsdatum)\n\nBaden-Württemberg Amtsgericht Stuttgart HRB 787442\nLöschungsankündigung\n\nTEMI GmbH\nGesellschaft mit beschränkter Haftung\nPliezhausen\n\nDas Gericht beabsichtigt, die Gesellschaft wegen Vermögenslosigkeit im Handelsregister von Amts wegen nach § 394 FamFG zu löschen. Die Frist zur Geltendmachung eines Widerspruchs gegen die beabsichtigte Löschung ist auf zwei Monate ab Veröffentlichung bestimmt."
    },
    {
      "date": "2024-11-19",
      "original_text": "Registerbekanntmachung nach dem Umwandlungsgesetz\nBrandenburg Amtsgericht Cottbus HRB 42\nTele Columbus Cottbus GmbH – Cottbus",
      "type": "Registerbekanntmachung nach dem Umwandlungsgesetz",
      "state": "Brandenburg",
      "amtsgericht": "Amtsgericht Cottbus",
      "registernummer": "HRB 42",
      "registerart": "HRB",
      "company_name": "Tele Columbus Cottbus GmbH",
      "company_seat": "Cottbus",
      "details": "19.11.2024 (Bekanntmachungsdatum)\n\nBrandenburg Amtsgericht Cottbus HRB 42\nRegisterbekanntmachung nach dem Umwandlungsgesetz 19.11.2024 (Eintragungsdatum)\n\nTele Columbus Cottbus GmbH\nGesellschaft mit beschränkter Haftung\nCottbus\n\nZu Eintragungsnummer 31 vom 19.11.2024 wird als nicht eingetragen veröffentlicht:\nDen Gläubigern der an der Verschmelzung beteiligten Rechtsträger ist, wenn sie binnen sechs Monaten nach dem Tag, an dem die Eintragung der Verschmelzung in das Register des Sitzes desjenigen Rechtsträgers, dessen Gläubiger sie sind, als bekannt gemacht gilt, ihren Anspruch nach Grund und Höhe schriftlich anmelden, Sicherheit zu leisten, soweit sie nicht Befriedigung verlangen können. Dieses Recht steht den Gläubigern jedoch nur zu, wenn sie glaubhaft machen, dass durch die Verschmelzung die Erfüllung ihrer Forderung gefährdet wird"
    },
    {
      "date": "2024-11-19",
      "original_text": "Sonstige Registerbekanntmachung\nBayern Amtsgericht Bayreuth HRB 8303\nThomas & Heller Immobilien GmbH – Stadtsteinach",
      "type": "Sonstige Registerbekanntmachung",
      "state": "Bayern",
      "amtsgericht": "Amtsgericht Bayreuth",
      "registernummer": "HRB 8303",
      "registerart": "HRB",
      "company_name": "Thomas & Heller Immobilien GmbH",
      "company_seat": "Stadtsteinach",
      "details": "19.11.2024 (Bekanntmachungsdatum)\n\nBayern Amtsgericht Bayreuth HRB 8303\nSonstige Registerbekanntmachung 18.11.2024 (Eintragungsdatum)\n\nThomas & Heller Immobilien GmbH\nGesellschaft mit beschränkter Haftung\nStadtsteinach\n\nDen Gläubigern des formwechselnden Rechtsträgers ist, wenn sie binnen sechs Monaten nach dem Tag, an dem die Eintragung des Formwechsels nach § 201 UmwG als bekannt gemacht gilt, ihren Anspruch nach Grund und Höhe schriftlich anmelden, Sicherheit zu leisten, soweit sie nicht Befriedigung verlangen können. Dieses Recht steht den Gläubigern jedoch nur zu, wenn sie glaubhaft machen, dass durch den Formwechsel die Erfüllung ihrer Forderung gefährdet wird."
    },
    {
      "date": "2024-11-19",
      "original_text": "Registerbekanntmachung nach dem Umwandlungsgesetz\nBayern Amtsgericht Bayreuth GsR 59\nThomas & Heller Immobilien Grundstücksverwaltung eGbR – Stadtsteinach",
      "type": "Registerbekanntmachung nach dem Umwandlungsgesetz",
      "state": "Bayern",
      "amtsgericht": "Amtsgericht Bayreuth",
      "registernummer": "GsR 59",
      "registerart": "GsR",
      "company_name": "Thomas & Heller Immobilien Grundstücksverwaltung eGbR",
      "company_seat": "Stadtsteinach",
      "details": "19.11.2024 (Bekanntmachungsdatum)\n\nBayern Amtsgericht Bayreuth GsR 59\nRegisterbekanntmachung nach dem Umwandlungsgesetz 18.11.2024 (Eintragungsdatum)\n\nThomas & Heller Immobilien Grundstücksverwaltung eGbR\nGesellschaft bürgerlichen Rechts\nStadtsteinach\n\nDen Gläubigern des formwechselnden Rechtsträgers ist, wenn sie binnen sechs Monaten nach dem Tag, an dem die Eintragung des Formwechsels nach § 201 UmwG als bekannt gemacht gilt, ihren Anspruch nach Grund und Höhe schriftlich anmelden, Sicherheit zu leisten, soweit sie nicht Befriedigung verlangen können. Dieses Recht steht den Gläubigern jedoch nur zu, wenn sie glaubhaft machen, dass durch den Formwechsel die Erfüllung ihrer Forderung gefährdet wird."
    },
    {
      "date": "2024-11-19",
      "original_text": "Registerbekanntmachung nach dem Umwandlungsgesetz\nSachsen-Anhalt Amtsgericht Stendal HRA 7929\nTief- und Spezialbau Halle GmbH & Co. KG – Halle (Saale)",
      "type": "Registerbekanntmachung nach dem Umwandlungsgesetz",
      "state": "Sachsen-Anhalt",
      "amtsgericht": "Amtsgericht Stendal",
      "registernummer": "HRA 7929",
      "registerart": "HRA",
      "company_name": "Tief- und Spezialbau Halle GmbH & Co. KG",
      "company_seat": "Halle (Saale)",
      "details": "19.11.2024 (Bekanntmachungsdatum)\n\nSachsen-Anhalt Amtsgericht Stendal HRA 7929\nRegisterbekanntmachung nach dem Umwandlungsgesetz 19.11.2024 (Eintragungsdatum)\n\nTief- und Spezialbau Halle GmbH & Co. KG\nKommanditgesellschaft\nHalle (Saale)\n\nNicht eingetragen:\nDen Gläubigern der an der Ausgliederung beteiligten Rechtsträger ist, wenn sie binnen sechs Monaten nach dem Tag, an dem die Eintragung der Ausgliederung nach §§125, 19 Abs. 3 UmwG als bekanntgemacht gilt, ihren Anspruch nach Grund und Höhe schriftlich anmelden, Sicherheit zu leisten, soweit sie nicht Befriedigung verlangen können. Diese Recht steht ihnen jedoch nur zu, wenn sie glaubhaft machen, dass durch die Ausgliederung die Erfüllung ihrer Forderung gefährdet wird."
    },
    {
      "date": "2024-11-19",
      "original_text": "Löschungsankündigung\nBayern Amtsgericht Regensburg HRB 19375\nUMH GmbH – Neutraubling",
      "type": "Löschungsankündigung",
      "state": "Bayern",
      "amtsgericht": "Amtsgericht Regensburg",
      "registernummer": "HRB 19375",
      "registerart": "HRB",
      "company_name": "UMH GmbH",
      "company_seat": "Neutraubling",
      "details": "19.11.2024 (Bekanntmachungsdatum)\n\nBayern Amtsgericht Regensburg HRB 19375\nLöschungsankündigung 18.11.2024 (Eintragungsdatum)\n\nUMH GmbH\nGesellschaft mit beschränkter Haftung\nNeutraubling\n\nDas Registergericht beabsichtigt, die im Handelsregister eingetragene Gesellschaft wegen Vermögenslosigkeit von Amts wegen nach § 394 FamFG zu löschen. Die Frist zur Erhebung eines Widerspruchs ist auf einen Monat festgesetzt."
    },
    {
      "date": "2024-11-19",
      "original_text": "Registerbekanntmachung nach dem Umwandlungsgesetz\nBayern Amtsgericht München HRB 291826\nUXUIX GmbH – Feldafing",
      "type": "Registerbekanntmachung nach dem Umwandlungsgesetz",
      "state": "Bayern",
      "amtsgericht": "Amtsgericht München",
      "registernummer": "HRB 291826",
      "registerart": "HRB",
      "company_name": "UXUIX GmbH",
      "company_seat": "Feldafing",
      "details": "19.11.2024 (Bekanntmachungsdatum)\n\nBayern Amtsgericht München HRB 291826\nRegisterbekanntmachung nach dem Umwandlungsgesetz 15.11.2024 (Eintragungsdatum)\n\nUXUIX GmbH\nGesellschaft mit beschränkter Haftung\nFeldafing\n\nDen Gläubigern der an der Verschmelzung beteiligten Rechtsträger ist, wenn sie binnen sechs Monaten nach dem Tag, an dem die Eintragung der Verschmelzung in das Register des Sitzes desjenigen Rechtsträgers, dessen Gläubiger sie sind, nach § 19 Abs. 3 UmwG als bekannt gemacht gilt, ihren Anspruch nach Grund und Höhe schriftlich anmelden, Sicherheit zu leisten, soweit sie nicht Befriedigung verlangen können. Dieses Recht steht den Gläubigern jedoch nur zu, wenn sie glaubhaft machen, dass durch die Verschmelzung die Erfüllung ihrer Forderung gefährdet wird."
    },
    {
      "date": "2024-11-19",
      "original_text": "Sonstige Registerbekanntmachung\nBrandenburg Amtsgericht Potsdam HRB 28399\nVAMED Klinik Hohenstücken GmbH – Brandenburg an der Havel",
      "type": "Sonstige Registerbekanntmachung",
      "state": "Brandenburg",
      "amtsgericht": "Amtsgericht Potsdam",
      "registernummer": "HRB 28399",
      "registerart": "HRB",
      "company_name": "VAMED Klinik Hohenstücken GmbH",
      "company_seat": "Brandenburg an der Havel",
      "details": "19.11.2024 (Bekanntmachungsdatum)\n\nBrandenburg Amtsgericht Potsdam HRB 28399\nSonstige Registerbekanntmachung\n\nVAMED Klinik Hohenstücken GmbH\nGesellschaft mit beschränkter Haftung\nBrandenburg an der Havel\n\nAls nicht eingetragen wird veröffentlicht: Den Gläubigern der Gesellschaft, deren Forderungen begründet worden sind, bevor die Eintragung der Beendigung des Vertrages in das Handelsregister nach § 10 des Handelsgesetzbuches als bekannt gemacht gilt, hat der andere Vertragsteil Sicherheit zu leisten, wenn sie sich binnen sechs Monaten  nach der Bekanntmachung der Eintragung zu diesem Zweck bei ihm melden."
    },
    {
      "date": "2024-11-19",
      "original_text": "Einreichung neuer Dokumente\nSaarland Amtsgericht Saarbrücken HRB 9627\nVIB Versicherungen und Immobilien, Beratungs- und Vermittlungsgesellschaft mbH – Saarbrücken",
      "type": "Einreichung neuer Dokumente",
      "state": "Saarland",
      "amtsgericht": "Amtsgericht Saarbrücken",
      "registernummer": "HRB 9627",
      "registerart": "HRB",
      "company_name": "VIB Versicherungen und Immobilien, Beratungs- und Vermittlungsgesellschaft mbH",
      "company_seat": "Saarbrücken",
      "details": "19.11.2024 (Bekanntmachungsdatum)\n\nSaarland Amtsgericht Saarbrücken HRB 9627\nEinreichung neuer Dokumente\n\nVIB Versicherungen und Immobilien, Beratungs- und Vermittlungsgesellschaft mbH\nGesellschaft mit beschränkter Haftung\nSaarbrücken\n\nDie Geschäftsführung der Gesellschaft hat eine Liste der Mitglieder des Aufsichtsrats zum Handelsregister eingereicht (§ 52 Abs. 3 Satz 2 GmbHG)."
    },
    {
      "date": "2024-11-19",
      "original_text": "Löschungsankündigung\nNiedersachsen Amtsgericht Oldenburg (Oldenburg) HRB 216134\nVITA UG (haftungsbeschränkt) – Sevelten",
      "type": "Löschungsankündigung",
      "state": "Niedersachsen",
      "amtsgericht": "Amtsgericht Oldenburg (Oldenburg)",
      "registernummer": "HRB 216134",
      "registerart": "HRB",
      "company_name": "VITA UG (haftungsbeschränkt)",
      "company_seat": "Sevelten",
      "details": "19.11.2024 (Bekanntmachungsdatum)\n\nNiedersachsen Amtsgericht Oldenburg (Oldenburg) HRB 216134\nLöschungsankündigung\n\nVITA UG (haftungsbeschränkt)\nGesellschaft mit beschränkter Haftung\nSevelten\n\nDas Registergericht beabsichtigt, die Gesellschaft von Amts wegen nach § 394 FamFG zu löschen. Die Frist zur Erhebung eines Widerspruchs ist auf 1 Monat ab dieser Registerbekanntmachung festgesetzt."
    },
    {
      "date": "2024-11-19",
      "original_text": "Löschungsankündigung\nBerlin Amtsgericht Berlin (Charlottenburg) HRB 222707\nVVB Bau GmbH – Berlin",
      "type": "Löschungsankündigung",
      "state": "Berlin",
      "amtsgericht": "Amtsgericht Berlin (Charlottenburg)",
      "registernummer": "HRB 222707",
      "registerart": "HRB",
      "company_name": "VVB Bau GmbH",
      "company_seat": "Berlin",
      "details": "19.11.2024 (Bekanntmachungsdatum)\n\nBerlin Amtsgericht Berlin (Charlottenburg) HRB 222707\nLöschungsankündigung\n\nVVB Bau GmbH\nGesellschaft mit beschränkter Haftung\nBerlin\n\nBei der nachstehenden Gesellschaft wird das Amtslöschungsverfahren gemäß § 394 FamFG eingeleitet. Widerspruchsfrist 6 Wochen"
    },
    {
      "date": "2024-11-19",
      "original_text": "Registerbekanntmachung nach dem Umwandlungsgesetz\nNiedersachsen Amtsgericht Oldenburg (Oldenburg) HRB 221495\nVWind GmbH – Varel",
      "type": "Registerbekanntmachung nach dem Umwandlungsgesetz",
      "state": "Niedersachsen",
      "amtsgericht": "Amtsgericht Oldenburg (Oldenburg)",
      "registernummer": "HRB 221495",
      "registerart": "HRB",
      "company_name": "VWind GmbH",
      "company_seat": "Varel",
      "details": "19.11.2024 (Bekanntmachungsdatum)\n\nNiedersachsen Amtsgericht Oldenburg (Oldenburg) HRB 221495\nRegisterbekanntmachung nach dem Umwandlungsgesetz 19.11.2024 (Eintragungsdatum)\n\nVWind GmbH\nGesellschaft mit beschränkter Haftung\nVarel\n\nDen Gläubigern der an der formwechselnden Umwandlung beteiligten Rechtsträger ist, wenn sie binnen sechs Monaten nach dem Tag, an dem die Eintragung der Umwandlung in das Register des Sitzes desjenigen Rechtsträgers, dessen Gläubiger sie sind, nach § 19 Abs. 3 UmwG als bekannt gemacht gilt, ihren Anspruch nach Grund und Höhe schriftlich anmelden, Sicherheit zu leisten, soweit sie nicht Befriedigung verlangen können. Dieses Recht steht den Gläubigern jedoch nur zu, wenn sie glaubhaft machen, dass durch die formwechselnde Umwandlung die Erfüllung der Forderung gefährdet wird."
    },
    {
      "date": "2024-11-19",
      "original_text": "Registerbekanntmachung nach dem Umwandlungsgesetz\nSchleswig-Holstein Amtsgericht Kiel VR 1909\nVerein der Freunde der Max-Planck-Schule zu Kiel e.V. – Kiel",
      "type": "Registerbekanntmachung nach dem Umwandlungsgesetz",
      "state": "Schleswig-Holstein",
      "amtsgericht": "Amtsgericht Kiel",
      "registernummer": "VR 1909",
      "registerart": "VR",
      "company_name": "Verein der Freunde der Max-Planck-Schule zu Kiel e.V.",
      "company_seat": "Kiel",
      "details": "19.11.2024 (Bekanntmachungsdatum)\n\nSchleswig-Holstein Amtsgericht Kiel VR 1909\nRegisterbekanntmachung nach dem Umwandlungsgesetz 19.11.2024 (Eintragungsdatum)\n\nVerein der Freunde der Max-Planck-Schule zu Kiel e.V.\neingetragener Verein\nKiel\n\nAls nicht eingetragen wird veröffentlicht: Den Gläubigern der an der Verschmelzung beteiligten Rechtsträger ist, wenn sie binnen sechs Monaten nach dem Tag, an dem die Eintragung der Verschmelzung in das Register des Sitzes desjenigen Rechtsträgers, dessen Gläubiger sie sind, nach § 19 Abs. 3 UmwG bekannt gemacht worden ist, ihren Anspruch nach Grund und Höhe schriftlich anmelden, Sicherheit zu leisten, soweit sie nicht Befriedigung verlangen können. Dieses Recht steht den Gläubigern jedoch nur zu, wenn sie glaubhaft machen, dass durch die Verschmelzung die Erfüllung ihrer Forderung gefährdet wird."
    },
    {
      "date": "2024-11-19",
      "original_text": "Registerbekanntmachung nach dem Umwandlungsgesetz\nBayern Amtsgericht München HRB 282342\nVisionAIr UG (haftungsbeschränkt) – München",
      "type": "Registerbekanntmachung nach dem Umwandlungsgesetz",
      "state": "Bayern",
      "amtsgericht": "Amtsgericht München",
      "registernummer": "HRB 282342",
      "registerart": "HRB",
      "company_name": "VisionAIr UG (haftungsbeschränkt)",
      "company_seat": "München",
      "details": "19.11.2024 (Bekanntmachungsdatum)\n\nBayern Amtsgericht München HRB 282342\nRegisterbekanntmachung nach dem Umwandlungsgesetz 15.11.2024 (Eintragungsdatum)\n\nVisionAIr UG (haftungsbeschränkt)\nGesellschaft mit beschränkter Haftung\nMünchen\n\nDen Gläubigern der an der Verschmelzung beteiligten Rechtsträger ist, wenn sie binnen sechs Monaten nach dem Tag, an dem die Eintragung der Verschmelzung in das Register des Sitzes desjenigen Rechtsträgers, dessen Gläubiger sie sind, nach § 19 Abs. 3 UmwG als bekannt gemacht gilt, ihren Anspruch nach Grund und Höhe schriftlich anmelden, Sicherheit zu leisten, soweit sie nicht Befriedigung verlangen können. Dieses Recht steht den Gläubigern jedoch nur zu, wenn sie glaubhaft machen, dass durch die Verschmelzung die Erfüllung ihrer Forderung gefährdet wird."
    },
    {
      "date": "2024-11-19",
      "original_text": "Registerbekanntmachung nach dem Umwandlungsgesetz\nNiedersachsen Amtsgericht Oldenburg (Oldenburg) HRB 131735 früher Amtsgericht Wilhelmshaven\nVwind AG – Varel",
      "type": "Registerbekanntmachung nach dem Umwandlungsgesetz",
      "state": "Niedersachsen",
      "amtsgericht": "Amtsgericht Oldenburg (Oldenburg)",
      "registernummer": "HRB 131735",
      "registerart": "HRB",
      "company_name": "Vwind AG",
      "company_seat": "Varel",
      "former_amtsgericht": "Wilhelmshaven",
      "details": "19.11.2024 (Bekanntmachungsdatum)\n\nNiedersachsen Amtsgericht Oldenburg (Oldenburg) HRB 131735 früher Amtsgericht Wilhelmshaven\nRegisterbekanntmachung nach dem Umwandlungsgesetz 19.11.2024 (Eintragungsdatum)\n\nVwind AG\nAktiengesellschaft\nVarel\n\nDen Gläubigern der an der formwechselnden Umwandlung beteiligten Rechtsträger ist, wenn sie binnen sechs Monaten nach dem Tag, an dem die Eintragung der Umwandlung in das Register des Sitzes desjenigen Rechtsträgers, dessen Gläubiger sie sind, nach § 19 Abs. 3 UmwG als bekannt gemacht gilt, ihren Anspruch nach Grund und Höhe schriftlich anmelden, Sicherheit zu leisten, soweit sie nicht Befriedigung verlangen können. Dieses Recht steht den Gläubigern jedoch nur zu, wenn sie glaubhaft machen, dass durch die formwechselnde Umwandlung die Erfüllung der Forderung gefährdet wird."
    },
    {
      "date": "2024-11-19",
      "original_text": "Registerbekanntmachung nach dem Umwandlungsgesetz\nBaden-Württemberg Amtsgericht Stuttgart HRB 350161\nWAFIOS Maschinenfabrik GmbH – Reutlingen",
      "type": "Registerbekanntmachung nach dem Umwandlungsgesetz",
      "state": "Baden-Württemberg",
      "amtsgericht": "Amtsgericht Stuttgart",
      "registernummer": "HRB 350161",
      "registerart": "HRB",
      "company_name": "WAFIOS Maschinenfabrik GmbH",
      "company_seat": "Reutlingen",
      "details": "19.11.2024 (Bekanntmachungsdatum)\n\nBaden-Württemberg Amtsgericht Stuttgart HRB 350161\nRegisterbekanntmachung nach dem Umwandlungsgesetz 19.11.2024 (Eintragungsdatum)\n\nWAFIOS Maschinenfabrik GmbH\nGesellschaft mit beschränkter Haftung\nReutlingen\n\nAls nicht eingetragen wird bekanntgemacht:\nDen Gläubigern der an der Verschmelzung beteiligten Rechtsträger ist, wenn sie binnen sechs Monaten nach dem Tag, an dem die Eintragung der Verschmelzung in das Register des Sitzes desjenigen Rechtsträgers, dessen Gläubiger sie sind, nach § 19 Abs. 3 UmwG als bekanntgemacht gilt, ihren Anspruch nach Grund und Höhe schriftlich anmelden, Sicherheit zu leisten, soweit sie nicht Befriedigung verlangen können. Dieses Recht steht den Gläubigern jedoch nur zu, wenn sie glaubhaft machen, dass durch die Verschmelzung die Erfüllung ihrer Forderung gefährdet wird."
    },
    {
      "date": "2024-11-19",
      "original_text": "Registerbekanntmachung nach dem Umwandlungsgesetz\nBaden-Württemberg Amtsgericht Stuttgart HRB 350286\nWafios Handelsgesellschaft mit beschränkter Haftung – Reutlingen",
      "type": "Registerbekanntmachung nach dem Umwandlungsgesetz",
      "state": "Baden-Württemberg",
      "amtsgericht": "Amtsgericht Stuttgart",
      "registernummer": "HRB 350286",
      "registerart": "HRB",
      "company_name": "Wafios Handelsgesellschaft mit beschränkter Haftung",
      "company_seat": "Reutlingen",
      "details": "19.11.2024 (Bekanntmachungsdatum)\n\nBaden-Württemberg Amtsgericht Stuttgart HRB 350286\nRegisterbekanntmachung nach dem Umwandlungsgesetz 19.11.2024 (Eintragungsdatum)\n\nWafios Handelsgesellschaft mit beschränkter Haftung\nGesellschaft mit beschränkter Haftung\nReutlingen\n\nAls nicht eingetragen wird bekanntgemacht:\nDen Gläubigern der an der Verschmelzung beteiligten Rechtsträger ist, wenn sie binnen sechs Monaten nach dem Tag, an dem die Eintragung der Verschmelzung in das Register des Sitzes desjenigen Rechtsträgers, dessen Gläubiger sie sind, nach § 19 Abs. 3 UmwG als bekanntgemacht gilt, ihren Anspruch nach Grund und Höhe schriftlich anmelden, Sicherheit zu leisten, soweit sie nicht Befriedigung verlangen können. Dieses Recht steht den Gläubigern jedoch nur zu, wenn sie glaubhaft machen, dass durch die Verschmelzung die Erfüllung ihrer Forderung gefährdet wird."
    },
    {
      "date": "2024-11-19",
      "original_text": "Einreichung neuer Dokumente\nBerlin Amtsgericht Berlin (Charlottenburg) HRB 172976\nXU Group GmbH – Berlin",
      "type": "Einreichung neuer Dokumente",
      "state": "Berlin",
      "amtsgericht": "Amtsgericht Berlin (Charlottenburg)",
      "registernummer": "HRB 172976",
      "registerart": "HRB",
      "company_name": "XU Group GmbH",
      "company_seat": "Berlin",
      "details": "19.11.2024 (Bekanntmachungsdatum)\n\nBerlin Amtsgericht Berlin (Charlottenburg) HRB 172976\nEinreichung neuer Dokumente\n\nXU Group GmbH\nGesellschaft mit beschränkter Haftung\nBerlin\n\nAls nicht eingetragen wird veröffentlicht: Es wurde eine neue Liste der Aufsichtsratsmitglieder eingereicht (§52 GmbHG)."
    },
    {
      "date": "2024-11-19",
      "original_text": "Registerbekanntmachung nach dem Umwandlungsgesetz\nBaden-Württemberg Amtsgericht Stuttgart HRA 741442\nZAR West GmbH & Co. KG – Stuttgart",
      "type": "Registerbekanntmachung nach dem Umwandlungsgesetz",
      "state": "Baden-Württemberg",
      "amtsgericht": "Amtsgericht Stuttgart",
      "registernummer": "HRA 741442",
      "registerart": "HRA",
      "company_name": "ZAR West GmbH & Co. KG",
      "company_seat": "Stuttgart",
      "details": "19.11.2024 (Bekanntmachungsdatum)\n\nBaden-Württemberg Amtsgericht Stuttgart HRA 741442\nRegisterbekanntmachung nach dem Umwandlungsgesetz 19.11.2024 (Eintragungsdatum)\n\nZAR West GmbH & Co. KG\nKommanditgesellschaft\nStuttgart\n\nAls nicht eingetragen wird bekanntgemacht: Den Gläubigern des an dem Formwechsel beteiligten Rechtsträgers ist, wenn sie binnen sechs Monaten nach dem Tag, an dem die Eintragung des Formwechsels in das Register des Sitzes desjenigen Rechtsträgers, dessen Gläubiger sie sind, nach § 19 Abs. 3 UmwG als bekanntgemacht gilt, ihren Anspruch nach Grund und Höhe schriftlich anmelden, Sicherheit zu leisten, soweit sie nicht Befriedigung verlangen können. Dieses Recht steht den Gläubigern jedoch nur zu, wenn sie glaubhaft machen, dass durch den Formwechsel die Erfüllung ihrer Forderung gefährdet wird."
    },
    {
      "date": "2024-11-19",
      "original_text": "Registerbekanntmachung nach dem Umwandlungsgesetz\nNordrhein-Westfalen Amtsgericht Paderborn HRB 5237\nZeitungsverlag Der Patriot GmbH – Lippstadt",
      "type": "Registerbekanntmachung nach dem Umwandlungsgesetz",
      "state": "Nordrhein-Westfalen",
      "amtsgericht": "Amtsgericht Paderborn",
      "registernummer": "HRB 5237",
      "registerart": "HRB",
      "company_name": "Zeitungsverlag Der Patriot GmbH",
      "company_seat": "Lippstadt",
      "details": "19.11.2024 (Bekanntmachungsdatum)\n\nNordrhein-Westfalen Amtsgericht Paderborn HRB 5237\nRegisterbekanntmachung nach dem Umwandlungsgesetz 19.11.2024 (Eintragungsdatum)\n\nZeitungsverlag Der Patriot GmbH\nGesellschaft mit beschränkter Haftung\nLippstadt\n\nDen Gläubigern der an der Verschmelzung beteiligten Rechtsträger ist, wenn sie binnen sechs Monaten nach dem Tag, an dem die Eintragung der Verschmelzung in das Register des Sitzes desjenigen Rechtsträgers, dessen Gläubiger sie sind, nach § 19 Absatz 3 UmwG als bekanntgemacht gilt, ihren Anspruch nach Grund und Höhe schriftlich anmelden, Sicherheit zu leisten, soweit sie nicht Befriedigung verlangen können. Dieses Recht steht den Gläubigern jedoch nur zu, wenn sie glaubhaft machen, dass durch die Verschmelzung die Erfüllung ihrer Forderung gefährdet wird."
    },
    {
      "date": "2024-11-19",
      "original_text": "Registerbekanntmachung nach dem Umwandlungsgesetz\nBayern Amtsgericht Landshut HRB 11013\nZitz Solutions GmbH – Essenbach",
      "type": "Registerbekanntmachung nach dem Umwandlungsgesetz",
      "state": "Bayern",
      "amtsgericht": "Amtsgericht Landshut",
      "registernummer": "HRB 11013",
      "registerart": "HRB",
      "company_name": "Zitz Solutions GmbH",
      "company_seat": "Essenbach",
      "details": "19.11.2024 (Bekanntmachungsdatum)\n\nBayern Amtsgericht Landshut HRB 11013\nRegisterbekanntmachung nach dem Umwandlungsgesetz 18.11.2024 (Eintragungsdatum)\n\nZitz Solutions GmbH\nGesellschaft mit beschränkter Haftung\nEssenbach\n\nDen Gläubigern des formwechselnden Rechtsträgers ist, wenn sie binnen sechs Monaten nach dem Tag, an dem die Eintragung des Formwechsels nach § 201 UmwG als bekannt gemacht gilt, ihren Anspruch nach Grund und Höhe schriftlich anmelden, Sicherheit zu leisten, soweit sie nicht Befriedigung verlangen können. Dieses Recht steht den Gläubigern jedoch nur zu, wenn sie glaubhaft machen, dass durch den Formwechsel die Erfüllung ihrer Forderung gefährdet wird."
    },
    {
      "date": "2024-11-19",
      "original_text": "Löschungsankündigung\nBremen Amtsgericht Bremen HRA 21785\nbrain storm GmbH & Co. KG – Bremen",
      "type": "Löschungsankündigung",
      "state": "Bremen",
      "amtsgericht": "Amtsgericht Bremen",
      "registernummer": "HRA 21785",
      "registerart": "HRA",
      "company_name": "brain storm GmbH & Co. KG",
      "company_seat": "Bremen",
      "details": "19.11.2024 (Bekanntmachungsdatum)\n\nBremen Amtsgericht Bremen HRA 21785\nLöschungsankündigung\n\nbrain storm GmbH & Co. KG\nKommanditgesellschaft\nBremen\n\nEs ist beabsichtigt die im Handelsregister eingetragene Firma von Amts wegen gemäß § 31 Abs.2 HGB zu löschen. Gegen die Löschung kann beim AG Bremen schriftlich oder zu Protokoll der Geschäftsstelle Widerspruch eingelegt werden. Widerspruchsfrist 4 Wochen."
    },
    {
      "date": "2024-11-19",
      "original_text": "Registerbekanntmachung nach dem Umwandlungsgesetz\nNordrhein-Westfalen Amtsgericht Köln HRA 15449\nce competence. exclusive. e.K. – Bedburg",
      "type": "Registerbekanntmachung nach dem Umwandlungsgesetz",
      "state": "Nordrhein-Westfalen",
      "amtsgericht": "Amtsgericht Köln",
      "registernummer": "HRA 15449",
      "registerart": "HRA",
      "company_name": "ce competence. exclusive. e.K.",
      "company_seat": "Bedburg",
      "details": "19.11.2024 (Bekanntmachungsdatum)\n\nNordrhein-Westfalen Amtsgericht Köln HRA 15449\nRegisterbekanntmachung nach dem Umwandlungsgesetz 19.11.2024 (Eintragungsdatum)\n\nce competence. exclusive. e.K.\nEinzelkaufmann / Einzelkauffrau\nBedburg\n\nDen Gläubigern der an der Ausgliederung beteiligten Rechtsträger ist, wenn sie binnen sechs Monaten nach dem Tag, an dem die Eintragung der Ausgliederung in das Register des Sitzes desjenigen Rechtsträgers, dessen Gläubiger sie sind, nach § 19 Absatz 3 UmwG als bekanntgemacht gilt, ihren Anspruch nach Grund und Höhe schriftlich anmelden, Sicherheit zu leisten, soweit sie nicht Befriedigung verlangen können. Dieses Recht steht den Gläubigern jedoch nur zu, wenn sie glaubhaft machen, dass durch die Ausgliederung die Erfüllung ihrer Forderung gefährdet wird."
    },
    {
      "date": "2024-11-19",
      "original_text": "Einreichung neuer Dokumente\nBayern Amtsgericht München HRB 182633\ncorent AG – München",
      "type": "Einreichung neuer Dokumente",
      "state": "Bayern",
      "amtsgericht": "Amtsgericht München",
      "registernummer": "HRB 182633",
      "registerart": "HRB",
      "company_name": "corent AG",
      "company_seat": "München",
      "details": "19.11.2024 (Bekanntmachungsdatum)\n\nBayern Amtsgericht München HRB 182633\nEinreichung neuer Dokumente\n\ncorent AG\nAktiengesellschaft\nMünchen\n\nDem Amtsgericht München -Registergericht- ist eine Liste der Mitglieder des Aufsichtsrats eingereicht worden, § 106 AktG."
    },
    {
      "date": "2024-11-19",
      "original_text": "Löschungsankündigung\nThüringen Amtsgericht Jena HRB 113840\ndpmenwomen GmbH – Erfurt",
      "type": "Löschungsankündigung",
      "state": "Thüringen",
      "amtsgericht": "Amtsgericht Jena",
      "registernummer": "HRB 113840",
      "registerart": "HRB",
      "company_name": "dpmenwomen GmbH",
      "company_seat": "Erfurt",
      "details": "19.11.2024 (Bekanntmachungsdatum)\n\nThüringen Amtsgericht Jena HRB 113840\nLöschungsankündigung\n\ndpmenwomen GmbH\nGesellschaft mit beschränkter Haftung\nErfurt\n\nDas Registergericht beabsichtigt, die im Handelsregister eingetragene Gesellschaft wegen Vermögenslosigkeit nach § 394 FamFG von Amts wegen zu löschen. Die Frist zur Erhebung eines Widerspruchs gegen die beabsichtigte Löschung wird auf 6 Wochen festgesetzt."
    },
    {
      "date": "2024-11-19",
      "original_text": "Registerbekanntmachung nach dem Umwandlungsgesetz\nSaarland Amtsgericht Saarbrücken HRA 11346\neenovativ GmbH & Co. KG – Homburg",
      "type": "Registerbekanntmachung nach dem Umwandlungsgesetz",
      "state": "Saarland",
      "amtsgericht": "Amtsgericht Saarbrücken",
      "registernummer": "HRA 11346",
      "registerart": "HRA",
      "company_name": "eenovativ GmbH & Co. KG",
      "company_seat": "Homburg",
      "details": "19.11.2024 (Bekanntmachungsdatum)\n\nSaarland Amtsgericht Saarbrücken HRA 11346\nRegisterbekanntmachung nach dem Umwandlungsgesetz 19.11.2024 (Eintragungsdatum)\n\neenovativ GmbH & Co. KG\nKommanditgesellschaft\nHomburg\n\nAls nicht eingetragen wird bekannt gemacht: Den Gläubigern der an der formwechselnden Umwandlung beteiligten Gesellschaften ist, wenn sie binnen sechs Monaten nach dem Tag, an dem die Eintragung der formwechselnden Umwandlung in das Register des Sitzes desjenigen Rechtsträgers, dessen Gläubiger sie sind, nach § 19 Absatz 3 UmwG bekannt gemacht worden ist, ihren Anspruch nach Grund und Höhe schriftlich anmelden, Sicherheit zu leisten, soweit sie nicht Befriedigung verlangen können. Dieses Recht steht den Gläubigern jedoch nur zu, wenn sie glaubhaft machen, dass durch die formwechselnden Umwandlung die Erfüllung ihrer Forderung gefährdet wird."
    },
    {
      "date": "2024-11-19",
      "original_text": "Einreichung neuer Dokumente\nHessen Amtsgericht Offenbach am Main HRB 12381\nglueckkanja AG – Offenbach am Main",
      "type": "Einreichung neuer Dokumente",
      "state": "Hessen",
      "amtsgericht": "Amtsgericht Offenbach am Main",
      "registernummer": "HRB 12381",
      "registerart": "HRB",
      "company_name": "glueckkanja AG",
      "company_seat": "Offenbach am Main",
      "details": "19.11.2024 (Bekanntmachungsdatum)\n\nHessen Amtsgericht Offenbach am Main HRB 12381\nEinreichung neuer Dokumente\n\nglueckkanja AG\nAktiengesellschaft\nOffenbach am Main\n\nDurch eine Änderung in den Personen der Aufsichtsratsmitglieder ist eine Liste der Mitglieder des Aufsichtsrates zum Handelsregister eingereicht worden."
    },
    {
      "date": "2024-11-19",
      "original_text": "Löschungsankündigung\nBaden-Württemberg Amtsgericht Stuttgart HRB 787270\niRay Imaging Europe GmbH – Neckarsulm",
      "type": "Löschungsankündigung",
      "state": "Baden-Württemberg",
      "amtsgericht": "Amtsgericht Stuttgart",
      "registernummer": "HRB 787270",
      "registerart": "HRB",
      "company_name": "iRay Imaging Europe GmbH",
      "company_seat": "Neckarsulm",
      "details": "19.11.2024 (Bekanntmachungsdatum)\n\nBaden-Württemberg Amtsgericht Stuttgart HRB 787270\nLöschungsankündigung 19.11.2024 (Eintragungsdatum)\n\niRay Imaging Europe GmbH\nGesellschaft mit beschränkter Haftung\nNeckarsulm\n\nAls nicht eingetragen wird bekanntgemacht:\nDas Gericht beabsichtigt, die Gesellschaft wegen Vermögenslosigkeit im Handelsregister von Amts wegen nach § 394 FamFG zu löschen. Die Frist zur Geltendmachung eines Widerspruchs gegen die beabsichtigte Löschung ist auf zwei Monate ab Veröffentlichung bestimmt."
    },
    {
      "date": "2024-11-19",
      "original_text": "Löschungsankündigung\nBayern Amtsgericht München HRB 224672\nmr Verwaltungs GmbH – München",
      "type": "Löschungsankündigung",
      "state": "Bayern",
      "amtsgericht": "Amtsgericht München",
      "registernummer": "HRB 224672",
      "registerart": "HRB",
      "company_name": "mr Verwaltungs GmbH",
      "company_seat": "München",
      "details": "19.11.2024 (Bekanntmachungsdatum)\n\nBayern Amtsgericht München HRB 224672\nLöschungsankündigung 15.11.2024 (Eintragungsdatum)\n\nmr Verwaltungs GmbH\nGesellschaft mit beschränkter Haftung\nMünchen\n\nDas Registergericht beabsichtigt, die im Handelsregister eingetragene Gesellschaft wegen Vermögenslosigkeit von Amts wegen nach § 394 FamFG zu löschen. Die Frist zur Erhebung eines Widerspruchs ist auf drei Monate festgesetzt."
    },
    {
      "date": "2024-11-19",
      "original_text": "Einreichung neuer Dokumente\nBayern Amtsgericht München HRB 214765\nmutares Holding-21 AG – Bad Wiessee",
      "type": "Einreichung neuer Dokumente",
      "state": "Bayern",
      "amtsgericht": "Amtsgericht München",
      "registernummer": "HRB 214765",
      "registerart": "HRB",
      "company_name": "mutares Holding-21 AG",
      "company_seat": "Bad Wiessee",
      "details": "19.11.2024 (Bekanntmachungsdatum)\n\nBayern Amtsgericht München HRB 214765\nEinreichung neuer Dokumente 18.11.2024 (Eintragungsdatum)\n\nmutares Holding-21 AG\nAktiengesellschaft\nBad Wiessee\n\nDem Amtsgericht München -Registergericht- ist eine Liste der Mitglieder des Aufsichtsrats eingereicht worden, § 106 AktG."
    },
    {
      "date": "2024-11-19",
      "original_text": "Einreichung neuer Dokumente\nBayern Amtsgericht München HRB 214765\nmutares Holding-21 AG – Bad Wiessee",
      "type": "Einreichung neuer Dokumente",
      "state": "Bayern",
      "amtsgericht": "Amtsgericht München",
      "registernummer": "HRB 214765",
      "registerart": "HRB",
      "company_name": "mutares Holding-21 AG",
      "company_seat": "Bad Wiessee",
      "details": "19.11.2024 (Bekanntmachungsdatum)\n\nBayern Amtsgericht München HRB 214765\nEinreichung neuer Dokumente\n\nmutares Holding-21 AG\nAktiengesellschaft\nBad Wiessee\n\nDem Amtsgericht München -Registergericht- ist eine Liste der Mitglieder des Aufsichtsrats eingereicht worden, § 106 AktG."
    },
    {
      "date": "2024-11-19",
      "original_text": "Sonstige Registerbekanntmachung\nHessen Amtsgericht Frankfurt am Main HRB 136212\npallasse verwaltungs se – Frankfurt am Main",
      "type": "Sonstige Registerbekanntmachung",
      "state": "Hessen",
      "amtsgericht": "Amtsgericht Frankfurt am Main",
      "registernummer": "HRB 136212",
      "registerart": "HRB",
      "company_name": "pallasse verwaltungs se",
      "company_seat": "Frankfurt am Main",
      "details": "19.11.2024 (Bekanntmachungsdatum)\n\nHessen Amtsgericht Frankfurt am Main HRB 136212\nSonstige Registerbekanntmachung 19.11.2024 (Eintragungsdatum)\n\npallasse verwaltungs se\nEuropäische Aktiengesellschaft (SE)\nFrankfurt am Main\n\nDurch eine Änderung in den Personen der Aufsichtsratsmitglieder ist eine Liste der Mitglieder des Aufsichtsrates zum Handelsregister eingereicht worden."
    },
    {
      "date": "2024-11-19",
      "original_text": "Registerbekanntmachung nach dem Umwandlungsgesetz\nSchleswig-Holstein Amtsgericht Kiel HRB 433 SE\npely-plastic Beteiligungsgesellschaft mbH – Wahlstedt",
      "type": "Registerbekanntmachung nach dem Umwandlungsgesetz",
      "state": "Schleswig-Holstein",
      "amtsgericht": "Amtsgericht Kiel",
      "registernummer": "HRB 433 SE",
      "registerart": "HRB",
      "company_name": "pely-plastic Beteiligungsgesellschaft mbH",
      "company_seat": "Wahlstedt",
      "details": "19.11.2024 (Bekanntmachungsdatum)\n\nSchleswig-Holstein Amtsgericht Kiel HRB 433 SE\nRegisterbekanntmachung nach dem Umwandlungsgesetz 18.11.2024 (Eintragungsdatum)\n\npely-plastic  Beteiligungsgesellschaft mbH\nGesellschaft mit beschränkter Haftung\nWahlstedt\n\nZu Eintragungsnummer 9 vom 18.11.2024 wird als nicht eingetragen veröffentlicht: Den Gläubigern der an der Verschmelzung beteiligten Rechtsträger ist, wenn sie binnen sechs Monaten nach dem Tag, an dem die Eintragung der Verschmelzung in das Register des Sitzes desjenigen Rechtsträgers, dessen Gläubiger sie sind, nach § 19 Abs. 3 UmwG bekannt gemacht worden ist, ihren Anspruch nach Grund und Höhe schriftlich anmelden, Sicherheit zu leisten, soweit sie nicht Befriedigung verlangen können. Dieses Recht steht den Gläubigern jedoch nur zu, wenn sie glaubhaft machen, dass durch die Verschmelzung die Erfüllung ihrer Forderung gefährdet wird."
    },
    {
      "date": "2024-11-19",
      "original_text": "Löschungsankündigung\nBerlin Amtsgericht Berlin (Charlottenburg) HRB 122768\ntotalCommerce GmbH – Berlin",
      "type": "Löschungsankündigung",
      "state": "Berlin",
      "amtsgericht": "Amtsgericht Berlin (Charlottenburg)",
      "registernummer": "HRB 122768",
      "registerart": "HRB",
      "company_name": "totalCommerce GmbH",
      "company_seat": "Berlin",
      "details": "19.11.2024 (Bekanntmachungsdatum)\n\nBerlin Amtsgericht Berlin (Charlottenburg) HRB 122768\nLöschungsankündigung\n\ntotalCommerce GmbH\nGesellschaft mit beschränkter Haftung\nBerlin\n\nBei der nachstehenden Gesellschaft wird das Amtslöschungsverfahren gemäß § 394 FamFG eingeleitet. Widerspruchsfrist 6 Wochen"
    },
    {
      "date": "2024-11-19",
      "original_text": "Registerbekanntmachung nach dem Umwandlungsgesetz\nBayern Amtsgericht Nürnberg HRB 43754\nvepos GmbH – Nürnberg",
      "type": "Registerbekanntmachung nach dem Umwandlungsgesetz",
      "state": "Bayern",
      "amtsgericht": "Amtsgericht Nürnberg",
      "registernummer": "HRB 43754",
      "registerart": "HRB",
      "company_name": "vepos GmbH",
      "company_seat": "Nürnberg",
      "details": "19.11.2024 (Bekanntmachungsdatum)\n\nBayern Amtsgericht Nürnberg HRB 43754\nRegisterbekanntmachung nach dem Umwandlungsgesetz 18.11.2024 (Eintragungsdatum)\n\nvepos GmbH\nGesellschaft mit beschränkter Haftung\nNürnberg\n\nDen Gläubigern des formwechselnden Rechtsträgers ist, wenn sie binnen sechs Monaten nach dem Tag, an dem die Eintragung des Formwechsels nach § 201 UmwG als bekannt gemacht gilt, ihren Anspruch nach Grund und Höhe schriftlich anmelden, Sicherheit zu leisten, soweit sie nicht Befriedigung verlangen können. Dieses Recht steht den Gläubigern jedoch nur zu, wenn sie glaubhaft machen, dass durch den Formwechsel die Erfüllung ihrer Forderung gefährdet wird."
    },
    {
      "date": "2024-11-19",
      "original_text": "Registerbekanntmachung nach dem Umwandlungsgesetz\nBayern Amtsgericht Nürnberg HRA 13798\nvepos GmbH & Co. KG – Nürnberg",
      "type": "Registerbekanntmachung nach dem Umwandlungsgesetz",
      "state": "Bayern",
      "amtsgericht": "Amtsgericht Nürnberg",
      "registernummer": "HRA 13798",
      "registerart": "HRA",
      "company_name": "vepos GmbH & Co. KG",
      "company_seat": "Nürnberg",
      "details": "19.11.2024 (Bekanntmachungsdatum)\n\nBayern Amtsgericht Nürnberg HRA 13798\nRegisterbekanntmachung nach dem Umwandlungsgesetz 18.11.2024 (Eintragungsdatum)\n\nvepos GmbH & Co. KG\nKommanditgesellschaft\nNürnberg\n\nDen Gläubigern des formwechselnden Rechtsträgers ist, wenn sie binnen sechs Monaten nach dem Tag, an dem die Eintragung des Formwechsels nach § 201 UmwG als bekannt gemacht gilt, ihren Anspruch nach Grund und Höhe schriftlich anmelden, Sicherheit zu leisten, soweit sie nicht Befriedigung verlangen können. Dieses Recht steht den Gläubigern jedoch nur zu, wenn sie glaubhaft machen, dass durch den Formwechsel die Erfüllung ihrer Forderung gefährdet wird."
    }
  ]
}