{
  "date": "2024-11-21",
  "date_of_scrape": "2024-11-22",
  "tool_version": "0.1.0",
  "announcements": [
    {
      "date": "2024-11-21",
      "original_text": "Löschungsankündigung\nNordrhein-Westfalen Amtsgericht Mönchengladbach HRB 15227\n4 Fashion24 GmbH – Mönchengladbach",
      "type": "Löschungsankündigung",
      "state": "Nordrhein-Westfalen",
      "amtsgericht": "Amtsgericht Mönchengladbach",
      "registernummer": "HRB 15227",
      "registerart": "HRB",
      "company_name": "4 Fashion24 GmbH",
      "company_seat": "Mönchengladbach",
      "details": "21.11.2024 (Bekanntmachungsdatum)\n\nNordrhein-Westfalen Amtsgericht Mönchengladbach HRB 15227\nLöschungsankündigung\n\n4 Fashion24 GmbH\nGesellschaft mit beschränkter Haftung\nMönchengladbach\n\n4 Fashion24 GmbH, Mönchengladbach (Amtsgericht Mönchengladbach, HRB 15227).\nDas Registergericht beabsichtigt, die im Handelsregister eingetragene Gesellschaft gemäß § 394 Absatz 1 FamFG wegen Vermögenslosigkeit von Amts wegen zu löschen. Gegen diese Verfügung kann Widerspruch eingelegt werden. Die Frist zur Erhebung eines Widerspruchs gegen die beabsichtigte Löschung von Amts wegen ist auf drei Monate festgesetzt."
    },
    {
      "date": "2024-11-21",
      "original_text": "Registerbekanntmachung nach dem Umwandlungsgesetz\nSchleswig-Holstein Amtsgericht Kiel HRB 13135\nA Tavola GmbH – Eckernförde",
      "type": "Registerbekanntmachung nach dem Umwandlungsgesetz",
      "state": "Schleswig-Holstein",
      "amtsgericht": "Amtsgericht Kiel",
      "registernummer": "HRB 13135",
      "registerart": "HRB",
      "company_name": "A Tavola GmbH",
      "company_seat": "Eckernförde",
      "details": "21.11.2024 (Bekanntmachungsdatum)\n\nSchleswig-Holstein Amtsgericht Kiel HRB 13135\nRegisterbekanntmachung nach dem Umwandlungsgesetz 20.11.2024 (Eintragungsdatum)\n\nA Tavola GmbH\nGesellschaft mit beschränkter Haftung\nEckernförde\n\nZu Eintragungsnummer 3 vom 20.11.2024 wird als nicht eingetragen veröffentlicht: Den Gläubigern der an der Verschmelzung beteiligten Rechtsträger ist, wenn sie binnen sechs Monaten nach dem Tag, an dem die Eintragung der Verschmelzung in das Register des Sitzes desjenigen Rechtsträgers, dessen Gläubiger sie sind, nach § 19 Abs. 3 UmwG bekannt gemacht worden ist, ihren Anspruch nach Grund und Höhe schriftlich anmelden, Sicherheit zu leisten, soweit sie nicht Befriedigung verlangen können. Dieses Recht steht den Gläubigern jedoch nur zu, wenn sie glaubhaft machen, dass durch die Verschmelzung die Erfüllung ihrer Forderung gefährdet wird."
    },
    {
      "date": "2024-11-21",
      "original_text": "Registerbekanntmachung nach dem Umwandlungsgesetz\nBayern Amtsgericht München HRB 235920\nACP Business Solutions GmbH – München",
      "type": "Registerbekanntmachung nach dem Umwandlungsgesetz",
      "state": "Bayern",
      "amtsgericht": "Amtsgericht München",
      "registernummer": "HRB 235920",
      "registerart": "HRB",
      "company_name": "ACP Business Solutions GmbH",
      "company_seat": "München",
      "details": "21.11.2024 (Bekanntmachungsdatum)\n\nBayern Amtsgericht München HRB 235920\nRegisterbekanntmachung nach dem Umwandlungsgesetz 20.11.2024 (Eintragungsdatum)\n\nACP Business Solutions GmbH\nGesellschaft mit beschränkter Haftung\nMünchen\n\nDen Gläubigern der an der Verschmelzung beteiligten Rechtsträger ist, wenn sie binnen sechs Monaten nach dem Tag, an dem die Eintragung der Verschmelzung in das Register des Sitzes desjenigen Rechtsträgers, dessen Gläubiger sie sind, nach § 19 Abs. 3 UmwG als bekannt gemacht gilt, ihren Anspruch nach Grund und Höhe schriftlich anmelden, Sicherheit zu leisten, soweit sie nicht Befriedigung verlangen können. Dieses Recht steht den Gläubigern jedoch nur zu, wenn sie glaubhaft machen, dass durch die Verschmelzung die Erfüllung ihrer Forderung gefährdet wird."
    },
    {
      "date": "2024-11-21",
      "original_text": "Löschungsankündigung\nBayern Amtsgericht München HRB 204773\nAFH Group GmbH – München",
      "type": "Löschungsankündigung",
      "state": "Bayern",
      "amtsgericht": "Amtsgericht München",
      "registernummer": "HRB 204773",
      "registerart": "HRB",
      "company_name": "AFH Group GmbH",
      "company_seat": "München",
      "details": "21.11.2024 (Bekanntmachungsdatum)\n\nBayern Amtsgericht München HRB 204773\nLöschungsankündigung\n\nAFH Group GmbH\nGesellschaft mit beschränkter Haftung\nMünchen\n\nDas Registergericht beabsichtigt, die im Handelsregister eingetragene Gesellschaft wegen Vermögenslosigkeit von Amts wegen nach § 394 FamFG zu löschen. Die Frist zur Erhebung eines Widerspruchs ist auf drei Monate festgesetzt."
    },
    {
      "date": "2024-11-21",
      "original_text": "Registerbekanntmachung nach dem Umwandlungsgesetz\nSchleswig-Holstein Amtsgericht Lübeck HRB 25224\nAGA.PIE GmbH – Ahrensburg",
      "type": "Registerbekanntmachung nach dem Umwandlungsgesetz",
      "state": "Schleswig-Holstein",
      "amtsgericht": "Amtsgericht Lübeck",
      "registernummer": "HRB 25224",
      "registerart": "HRB",
      "company_name": "AGA.PIE GmbH",
      "company_seat": "Ahrensburg",
      "details": "21.11.2024 (Bekanntmachungsdatum)\n\nSchleswig-Holstein Amtsgericht Lübeck HRB 25224\nRegisterbekanntmachung nach dem Umwandlungsgesetz 21.11.2024 (Eintragungsdatum)\n\nAGA.PIE GmbH\nGesellschaft mit beschränkter Haftung\nAhrensburg\n\nZu Eintragungsnummer 2 vom 21.11.2024 wird als nicht eingetragen veröffentlicht: Den Gläubigern ist, wenn sie binnen sechs Monaten nach dem Tag, an dem die Eintragung der Umwandlung als bekannt gemacht gilt, ihren Anspruch nach Grund und Höhe schriftlich anmelden, Sicherheit zu leisten, soweit sie nicht Befriedigung verlangen können. Dieses Recht steht den Gläubigern jedoch nur zu, wenn sie glaubhaft machen, dass durch die Umwandlung die Erfüllung ihrer Forderung gefährdet wird."
    },
    {
      "date": "2024-11-21",
      "original_text": "Einreichung neuer Dokumente\nSchleswig-Holstein Amtsgericht Pinneberg HRB 1597 EL\nAbwasserentsorgung Uetersen GmbH – Uetersen",
      "type": "Einreichung neuer Dokumente",
      "state": "Schleswig-Holstein",
      "amtsgericht": "Amtsgericht Pinneberg",
      "registernummer": "HRB 1597 EL",
      "registerart": "HRB",
      "company_name": "Abwasserentsorgung Uetersen GmbH",
      "company_seat": "Uetersen",
      "details": "21.11.2024 (Bekanntmachungsdatum)\n\nSchleswig-Holstein Amtsgericht Pinneberg HRB 1597 EL\nEinreichung neuer Dokumente\n\nAbwasserentsorgung Uetersen GmbH\nGesellschaft mit beschränkter Haftung\nUetersen\n\nAls nicht eingetragen wird veröffentlicht: Gemäß § 52 Abs. 3 2. Hs. GmbHG i.V.m. § 10 HGB wurde eine Aufsichtsratsliste zum Handelsregister eingereicht."
    },
    {
      "date": "2024-11-21",
      "original_text": "Löschungsankündigung\nBaden-Württemberg Amtsgericht Mannheim HRB 712426\nAgaddor GmbH – Karlsruhe",
      "type": "Löschungsankündigung",
      "state": "Baden-Württemberg",
      "amtsgericht": "Amtsgericht Mannheim",
      "registernummer": "HRB 712426",
      "registerart": "HRB",
      "company_name": "Agaddor GmbH",
      "company_seat": "Karlsruhe",
      "details": "21.11.2024 (Bekanntmachungsdatum)\n\nBaden-Württemberg Amtsgericht Mannheim HRB 712426\nLöschungsankündigung\n\nAgaddor GmbH\nGesellschaft mit beschränkter Haftung\nKarlsruhe\n\nDas Gericht beabsichtigt, die Gesellschaft wegen Vermögenslosigkeit im Handelsregister von Amts wegen nach § 394 FamFG zu löschen. Die Frist zur Geltendmachung eines Widerspruchs gegen die beabsichtigte Löschung ist auf einen Monat ab Veröffentlichung bestimmt."
    },
    {
      "date": "2024-11-21",
      "original_text": "Löschungsankündigung\nSaarland Amtsgericht Saarbrücken HRB 103457\nAktiva Service UG (haftungsbeschränkt) – Saarbrücken",
      "type": "Löschungsankündigung",
      "state": "Saarland",
      "amtsgericht": "Amtsgericht Saarbrücken",
      "registernummer": "HRB 103457",
      "registerart": "HRB",
      "company_name": "Aktiva Service UG (haftungsbeschränkt)",
      "company_seat": "Saarbrücken",
      "details": "21.11.2024 (Bekanntmachungsdatum)\n\nSaarland Amtsgericht Saarbrücken HRB 103457\nLöschungsankündigung\n\nAktiva Service UG (haftungsbeschränkt)\nGesellschaft mit beschränkter Haftung\nSaarbrücken\n\nEs ist beabsichtigt, die Gesellschaft von Amts wegen gemäß § 394 FamFG wegen Vermögenslosigkeit zu löschen. Gegen die Löschung von Amts wegen ist das Rechtsmittel des Widerspruchs statthaft. Der Widerspruch ist binnen einer Frist von 2 Monaten beginnend mit dem Tag dieser Veröffentlichung durch Einreichen eines Widerspruchsschreibens -schriftlich oder zur Niederschrift der Geschäftsstelle- beim Amtsgericht Saarbrücken, -zentrales Handelsregister-, Mainzerstr.178, 66121 Saarbrücken einzulegen. Der Widerspruch muss die Bezeichnung der angefochtenen Löschungsankündigung enthalten sowie die Erklärung, dass Widerspruch eingelegt wird. Er ist vom Widerspruchsführer oder seinem Bevollmächtigten zu unterzeichnen."
    },
    {
      "date": "2024-11-21",
      "original_text": "Registerbekanntmachung nach dem Umwandlungsgesetz\nBayern Amtsgericht Würzburg HRB 3395\nAmrhein & Sohn GmbH – Frammersbach",
      "type": "Registerbekanntmachung nach dem Umwandlungsgesetz",
      "state": "Bayern",
      "amtsgericht": "Amtsgericht Würzburg",
      "registernummer": "HRB 3395",
      "registerart": "HRB",
      "company_name": "Amrhein & Sohn GmbH",
      "company_seat": "Frammersbach",
      "details": "21.11.2024 (Bekanntmachungsdatum)\n\nBayern Amtsgericht Würzburg HRB 3395\nRegisterbekanntmachung nach dem Umwandlungsgesetz 20.11.2024 (Eintragungsdatum)\n\nAmrhein & Sohn GmbH\nGesellschaft mit beschränkter Haftung\nFrammersbach\n\nDen Gläubigern der an der Verschmelzung beteiligten Rechtsträger ist, wenn sie binnen sechs Monaten nach dem Tag, an dem die Eintragung der Verschmelzung in das Register des Sitzes desjenigen Rechtsträgers, dessen Gläubiger sie sind, nach § 19 Abs. 3 UmwG als bekannt gemacht gilt, ihren Anspruch nach Grund und Höhe schriftlich anmelden, Sicherheit zu leisten, soweit sie nicht Befriedigung verlangen können. Dieses Recht steht den Gläubigern jedoch nur zu, wenn sie glaubhaft machen, dass durch die Verschmelzung die Erfüllung ihrer Forderung gefährdet wird."
    },
    {
      "date": "2024-11-21",
      "original_text": "Löschungsankündigung\nNordrhein-Westfalen Amtsgericht Mönchengladbach HRB 16984\nArro Stadtentwicklung GmbH – Grevenbroich",
      "type": "Löschungsankündigung",
      "state": "Nordrhein-Westfalen",
      "amtsgericht": "Amtsgericht Mönchengladbach",
      "registernummer": "HRB 16984",
      "registerart": "HRB",
      "company_name": "Arro Stadtentwicklung GmbH",
      "company_seat": "Grevenbroich",
      "details": "21.11.2024 (Bekanntmachungsdatum)\n\nNordrhein-Westfalen Amtsgericht Mönchengladbach HRB 16984\nLöschungsankündigung\n\nArro Stadtentwicklung GmbH\nGesellschaft mit beschränkter Haftung\nGrevenbroich\n\nDas Registergericht beabsichtigt die Gesellschaft von Amts wegen nach § 394 FamFG zu löschen. Die Frist zur Erhebung eines Widerspruchs ist auf drei Monate festgesetzt."
    },
    {
      "date": "2024-11-21",
      "original_text": "Löschungsankündigung\nNordrhein-Westfalen Amtsgericht Mönchengladbach HRB 16984\nArro Stadtentwicklung GmbH – Grevenbroich",
      "type": "Löschungsankündigung",
      "state": "Nordrhein-Westfalen",
      "amtsgericht": "Amtsgericht Mönchengladbach",
      "registernummer": "HRB 16984",
      "registerart": "HRB",
      "company_name": "Arro Stadtentwicklung GmbH",
      "company_seat": "Grevenbroich",
      "details": "21.11.2024 (Bekanntmachungsdatum)\n\nNordrhein-Westfalen Amtsgericht Mönchengladbach HRB 16984\nLöschungsankündigung 21.11.2024 (Eintragungsdatum)\n\nArro Stadtentwicklung GmbH\nGesellschaft mit beschränkter Haftung\nGrevenbroich\n\nDas Registergericht beabsichtigt die Gesellschaft von Amts wegen nach § 394 FamFG zu löschen. Die Frist zur Erhebung eines Widerspruchs ist auf drei Monate festgesetzt."
    },
    {
      "date": "2024-11-21",
      "original_text": "Löschungsankündigung\nBaden-Württemberg Amtsgericht Mannheim HRB 330474\nAuto-Joncker GmbH – Heidelberg",
      "type": "Löschungsankündigung",
      "state": "Baden-Württemberg",
      "amtsgericht": "Amtsgericht Mannheim",
      "registernummer": "HRB 330474",
      "registerart": "HRB",
      "company_name": "Auto-Joncker GmbH",
      "company_seat": "Heidelberg",
      "details": "21.11.2024 (Bekanntmachungsdatum)\n\nBaden-Württemberg Amtsgericht Mannheim HRB 330474\nLöschungsankündigung\n\nAuto-Joncker GmbH\nGesellschaft mit beschränkter Haftung\nHeidelberg\n\nDas Gericht beabsichtigt, die Gesellschaft wegen Vermögenslosigkeit im Handelsregister von Amts wegen nach § 394 FamFG zu löschen. Die Frist zur Geltendmachung eines Widerspruchs gegen die beabsichtigte Löschung ist auf einen Monat ab Veröffentlichung bestimmt."
    },
    {
      "date": "2024-11-21",
      "original_text": "Löschungsankündigung\nBerlin Amtsgericht Berlin (Charlottenburg) HRB 255879\nB-M-S GmbH – Berlin",
      "type": "Löschungsankündigung",
      "state": "Berlin",
      "amtsgericht": "Amtsgericht Berlin (Charlottenburg)",
      "registernummer": "HRB 255879",
      "registerart": "HRB",
      "company_name": "B-M-S GmbH",
      "company_seat": "Berlin",
      "details": "21.11.2024 (Bekanntmachungsdatum)\n\nBerlin Amtsgericht Berlin (Charlottenburg) HRB 255879\nLöschungsankündigung\n\nB-M-S GmbH\nGesellschaft mit beschränkter Haftung\nBerlin\n\nBei der nachstehenden Gesellschaft wird das Amtslöschungsverfahren gemäß § 394 FamFG eingeleitet. Widerspruchsfrist 6 Wochen"
    },
    {
      "date": "2024-11-21",
      "original_text": "Einreichung neuer Dokumente\nNordrhein-Westfalen Amtsgericht Bonn HRB 19378\nBENOCS GmbH – Bonn",
      "type": "Einreichung neuer Dokumente",
      "state": "Nordrhein-Westfalen",
      "amtsgericht": "Amtsgericht Bonn",
      "registernummer": "HRB 19378",
      "registerart": "HRB",
      "company_name": "BENOCS GmbH",
      "company_seat": "Bonn",
      "details": "21.11.2024 (Bekanntmachungsdatum)\n\nNordrhein-Westfalen Amtsgericht Bonn HRB 19378\nEinreichung neuer Dokumente\n\nBENOCS GmbH\nGesellschaft mit beschränkter Haftung\nBonn\n\nDem Registergericht ist eine neue Liste der Mitglieder des Aufsichtsrates eingereicht worden."
    },
    {
      "date": "2024-11-21",
      "original_text": "Einreichung neuer Dokumente\nNiedersachsen Amtsgericht Hannover HRB 59345\nBG-Phoenics GmbH – Hannover",
      "type": "Einreichung neuer Dokumente",
      "state": "Niedersachsen",
      "amtsgericht": "Amtsgericht Hannover",
      "registernummer": "HRB 59345",
      "registerart": "HRB",
      "company_name": "BG-Phoenics GmbH",
      "company_seat": "Hannover",
      "details": "21.11.2024 (Bekanntmachungsdatum)\n\nNiedersachsen Amtsgericht Hannover HRB 59345\nEinreichung neuer Dokumente\n\nBG-Phoenics GmbH\nGesellschaft mit beschränkter Haftung\nHannover\n\nDie Liste der Mitglieder des Aufsichtsrats wurde beim Registergericht eingereicht."
    },
    {
      "date": "2024-11-21",
      "original_text": "Einreichung neuer Dokumente\nNordrhein-Westfalen Amtsgericht Wuppertal HRB 3033\nBarmenia Allgemeine Versicherungs-Aktiengesellschaft – Wuppertal",
      "type": "Einreichung neuer Dokumente",
      "state": "Nordrhein-Westfalen",
      "amtsgericht": "Amtsgericht Wuppertal",
      "registernummer": "HRB 3033",
      "registerart": "HRB",
      "company_name": "Barmenia Allgemeine Versicherungs-Aktiengesellschaft",
      "company_seat": "Wuppertal",
      "details": "21.11.2024 (Bekanntmachungsdatum)\n\nNordrhein-Westfalen Amtsgericht Wuppertal HRB 3033\nEinreichung neuer Dokumente\n\nBarmenia Allgemeine Versicherungs-Aktiengesellschaft\nAktiengesellschaft\nWuppertal\n\nDem Registergericht ist eine Liste der Mitglieder des Aufsichtsrates eingereicht worden."
    },
    {
      "date": "2024-11-21",
      "original_text": "Löschungsankündigung\nBremen Amtsgericht Bremen HRB 24899\nBeluga Travel Lounge GmbH – Bremen",
      "type": "Löschungsankündigung",
      "state": "Bremen",
      "amtsgericht": "Amtsgericht Bremen",
      "registernummer": "HRB 24899",
      "registerart": "HRB",
      "company_name": "Beluga Travel Lounge GmbH",
      "company_seat": "Bremen",
      "details": "21.11.2024 (Bekanntmachungsdatum)\n\nBremen Amtsgericht Bremen HRB 24899\nLöschungsankündigung\n\nBeluga Travel Lounge GmbH\nGesellschaft mit beschränkter Haftung\nBremen\n\nEs ist beabsichtigt die im Handelsregister eingetragene Gesellschaft von Amts wegen gemäß § 394 FamFG zu löschen. Gegen die Löschung kann beim AG Bremen schriftlich oder zu Protokoll der Geschäftsstelle Widerspruch eingelegt werden. Widerspruchsfrist 4 Wochen."
    },
    {
      "date": "2024-11-21",
      "original_text": "Sonderregisterbekanntmachung OHNE Bezug zum elektr. Register\nSachsen-Anhalt Amtsgericht Stendal\n65 AR 1888/12\nBergmannswohnstätten GmbH \"Egelner Mulde\"",
      "type": "Sonderregisterbekanntmachung OHNE Bezug zum elektr. Register",
      "state": "Sachsen-Anhalt",
      "amtsgericht": "Amtsgericht Stendal",
      "company_name": "Bergmannswohnstätten GmbH \"Egelner Mulde\"",
      "sonderegister_referenz": "65 AR 1888/12",
      "details": "21.11.2024 (Bekanntmachungsdatum)\n\nSachsen-Anhalt Amtsgericht Stendal\n65 AR 1888/12\nSonderregisterbekanntmachung OHNE Bezug zum elektr. Register\n\nBergmannswohnstätten GmbH \"Egelner Mulde\"\n\n65 AR 1888/12 Bergmannswohnstättengesellschaft Egelner Mulde Gesellschaft mit beschränkter Haftung\nHinsichtlich der o.g. im Handelsregister am 27.01.1939 gelöschten Gesellschaft ist beabsichtigt, Herrn Rechtsanwalt Peter May, geschäftsansässig in Egeln zum Nachtragsliquidator mit  beschränktem Wirkungskreis zu bestellen.\nDer Antrag kann bei berechtigtem Interesse beim Registergericht Stendal eingesehen werden.\nDie Frist zu Einreichung etwaiger Stellungnahmen bzw. Erhebung eines Widerspruchs wird auf 6 Wochen ab dieser Veröffentlichung festgesetzt."
    },
    {
      "date": "2024-11-21",
      "original_text": "Einreichung neuer Dokumente\nBerlin Amtsgericht Berlin (Charlottenburg) HRB 155360\nBigRep GmbH – Berlin",
      "type": "Einreichung neuer Dokumente",
      "state": "Berlin",
      "amtsgericht": "Amtsgericht Berlin (Charlottenburg)",
      "registernummer": "HRB 155360",
      "registerart": "HRB",
      "company_name": "BigRep GmbH",
      "company_seat": "Berlin",
      "details": "21.11.2024 (Bekanntmachungsdatum)\n\nBerlin Amtsgericht Berlin (Charlottenburg) HRB 155360\nEinreichung neuer Dokumente\n\nBigRep GmbH\nGesellschaft mit beschränkter Haftung\nBerlin\n\nAls nicht eingetragen wird veröffentlicht:Es wurde eine neue Liste der Aufsichtsratsmitglieder eingereicht (§52 GmbHG)."
    },
    {
      "date": "2024-11-21",
      "original_text": "Löschungsankündigung\nBerlin Amtsgericht Berlin (Charlottenburg) HRB 159110\nBio Block Kraft GmbH – Berlin",
      "type": "Löschungsankündigung",
      "state": "Berlin",
      "amtsgericht": "Amtsgericht Berlin (Charlottenburg)",
      "registernummer": "HRB 159110",
      "registerart": "HRB",
      "company_name": "Bio Block Kraft GmbH",
      "company_seat": "Berlin",
      "details": "21.11.2024 (Bekanntmachungsdatum)\n\nBerlin Amtsgericht Berlin (Charlottenburg) HRB 159110\nLöschungsankündigung\n\nBio Block Kraft GmbH\nGesellschaft mit beschränkter Haftung\nBerlin\n\nBei der nachstehenden Gesellschaft wird das Amtslöschungsverfahren gemäß § 394 FamFG eingeleitet. Widerspruchsfrist 6 Wochen"
    },
    {
      "date": "2024-11-21",
      "original_text": "Sonstige Registerbekanntmachung\nBayern Amtsgericht Aschaffenburg HRB 10452\nBlister Center Aschaffenburg GmbH – Aschaffenburg",
      "type": "Sonstige Registerbekanntmachung",
      "state": "Bayern",
      "amtsgericht": "Amtsgericht Aschaffenburg",
      "registernummer": "HRB 10452",
      "registerart": "HRB",
      "company_name": "Blister Center Aschaffenburg GmbH",
      "company_seat": "Aschaffenburg",
      "details": "21.11.2024 (Bekanntmachungsdatum)\n\nBayern Amtsgericht Aschaffenburg HRB 10452\nSonstige Registerbekanntmachung 20.11.2024 (Eintragungsdatum)\n\nBlister Center Aschaffenburg GmbH\nGesellschaft mit beschränkter Haftung\nAschaffenburg\n\nDen Gläubigern der Gesellschaft, deren Forderungen begründet worden sind, bevor die Eintragung der Beendigung des #DV.art(Text=\"Bitte Art des Vertrages auswählen\",Eingabe=\n\"Beherrschungs- und Gewinnabführungsvertrages\",\n\"Beherrschungsvertrages\",\n\"Gewinnabführungsvertrages\",\n\"Teilgewinnabführungsvertrages\") in das Handelsregister nach § 10 des Handelsgesetzbuches als bekanntgemacht gilt, hat der andere Vertragsteil Sicherheit zu leisten, wenn sie sich binnen sechs Monaten nach der Bekanntmachung der Eintragung zu diesem Zweck bei ihm melden."
    },
    {
      "date": "2024-11-21",
      "original_text": "Löschungsankündigung\nBayern Amtsgericht München HRB 269627\nBoutique Stocks UG (haftungsbeschränkt) – München",
      "type": "Löschungsankündigung",
      "state": "Bayern",
      "amtsgericht": "Amtsgericht München",
      "registernummer": "HRB 269627",
      "registerart": "HRB",
      "company_name": "Boutique Stocks UG (haftungsbeschränkt)",
      "company_seat": "München",
      "details": "21.11.2024 (Bekanntmachungsdatum)\n\nBayern Amtsgericht München HRB 269627\nLöschungsankündigung 20.11.2024 (Eintragungsdatum)\n\nBoutique Stocks UG (haftungsbeschränkt)\nGesellschaft mit beschränkter Haftung\nMünchen\n\nDas Registergericht beabsichtigt, die im Handelsregister eingetragene Gesellschaft wegen Vermögenslosigkeit von Amts wegen nach § 394 FamFG zu löschen. Die Frist zur Erhebung eines Widerspruchs ist auf drei Monate festgesetzt."
    },
    {
      "date": "2024-11-21",
      "original_text": "Löschungsankündigung\nBayern Amtsgericht München HRB 219391\nBrombeershop GmbH – München",
      "type": "Löschungsankündigung",
      "state": "Bayern",
      "amtsgericht": "Amtsgericht München",
      "registernummer": "HRB 219391",
      "registerart": "HRB",
      "company_name": "Brombeershop GmbH",
      "company_seat": "München",
      "details": "21.11.2024 (Bekanntmachungsdatum)\n\nBayern Amtsgericht München HRB 219391\nLöschungsankündigung\n\nBrombeershop GmbH\nGesellschaft mit beschränkter Haftung\nMünchen\n\nDas Registergericht beabsichtigt, die im Handelsregister eingetragene Gesellschaft wegen Vermögenslosigkeit von Amts wegen nach § 394 FamFG zu löschen. Die Frist zur Erhebung eines Widerspruchs ist auf drei Monate festgesetzt."
    },
    {
      "date": "2024-11-21",
      "original_text": "Löschungsankündigung\nHessen Amtsgericht Frankfurt am Main HRB 120454\nBuck Holding GmbH – Frankfurt am Main",
      "type": "Löschungsankündigung",
      "state": "Hessen",
      "amtsgericht": "Amtsgericht Frankfurt am Main",
      "registernummer": "HRB 120454",
      "registerart": "HRB",
      "company_name": "Buck Holding GmbH",
      "company_seat": "Frankfurt am Main",
      "details": "21.11.2024 (Bekanntmachungsdatum)\n\nHessen Amtsgericht Frankfurt am Main HRB 120454\nLöschungsankündigung\n\nBuck Holding GmbH\nGesellschaft mit beschränkter Haftung\nFrankfurt am Main\n\nEs ist beabsichtigt, die Gesellschaft wegen Vermögenslosigkeit gemäß § 394 FamFG von Amts wegen im Handelsregister zu löschen. Hiergegen kann innerhalb eines Monats nach dieser Veröffentlichung Widerspruch bei dem Amtsgericht Frankfurt am Main eingelegt werden."
    },
    {
      "date": "2024-11-21",
      "original_text": "Löschungsankündigung\nBaden-Württemberg Amtsgericht Mannheim HRB 700426\nCenturio GmbH – Mannheim",
      "type": "Löschungsankündigung",
      "state": "Baden-Württemberg",
      "amtsgericht": "Amtsgericht Mannheim",
      "registernummer": "HRB 700426",
      "registerart": "HRB",
      "company_name": "Centurio GmbH",
      "company_seat": "Mannheim",
      "details": "21.11.2024 (Bekanntmachungsdatum)\n\nBaden-Württemberg Amtsgericht Mannheim HRB 700426\nLöschungsankündigung\n\nCenturio GmbH\nGesellschaft mit beschränkter Haftung\nMannheim\n\nDas Gericht beabsichtigt, die Gesellschaft wegen Vermögenslosigkeit im Handelsregister von Amts wegen nach § 394 FamFG zu löschen. Die Frist zur Geltendmachung eines Widerspruchs gegen die beabsichtigte Löschung ist auf einen Monat ab Veröffentlichung bestimmt."
    },
    {
      "date": "2024-11-21",
      "original_text": "Löschungsankündigung\nBayern Amtsgericht München HRB 250750\nColibra FinCo UG (haftungsbeschränkt) – München",
      "type": "Löschungsankündigung",
      "state": "Bayern",
      "amtsgericht": "Amtsgericht München",
      "registernummer": "HRB 250750",
      "registerart": "HRB",
      "company_name": "Colibra FinCo UG (haftungsbeschränkt)",
      "company_seat": "München",
      "details": "21.11.2024 (Bekanntmachungsdatum)\n\nBayern Amtsgericht München HRB 250750\nLöschungsankündigung 20.11.2024 (Eintragungsdatum)\n\nColibra FinCo UG (haftungsbeschränkt)\nGesellschaft mit beschränkter Haftung\nMünchen\n\nDas Registergericht beabsichtigt, die im Handelsregister eingetragene Gesellschaft wegen Vermögenslosigkeit von Amts wegen nach § 394 FamFG zu löschen. Die Frist zur Erhebung eines Widerspruchs ist auf drei Monate festgesetzt."
    },
    {
      "date": "2024-11-21",
      "original_text": "Sonstige Registerbekanntmachung\nHessen Amtsgericht Frankfurt am Main HRB 77717\nCommerz Business Consulting GmbH – Frankfurt am Main",
      "type": "Sonstige Registerbekanntmachung",
      "state": "Hessen",
      "amtsgericht": "Amtsgericht Frankfurt am Main",
      "registernummer": "HRB 77717",
      "registerart": "HRB",
      "company_name": "Commerz Business Consulting GmbH",
      "company_seat": "Frankfurt am Main",
      "details": "21.11.2024 (Bekanntmachungsdatum)\n\nHessen Amtsgericht Frankfurt am Main HRB 77717\nSonstige Registerbekanntmachung 21.11.2024 (Eintragungsdatum)\n\nCommerz Business Consulting GmbH\nGesellschaft mit beschränkter Haftung\nFrankfurt am Main\n\nDurch eine Änderung in den Personen der Aufsichtsratsmitglieder ist eine Liste der Mitglieder des Aufsichtsrates zum Handelsregister eingereicht worden."
    },
    {
      "date": "2024-11-21",
      "original_text": "Löschungsankündigung\nBaden-Württemberg Amtsgericht Stuttgart HRB 740964\nConsilium Project Management GmbH – Heilbronn",
      "type": "Löschungsankündigung",
      "state": "Baden-Württemberg",
      "amtsgericht": "Amtsgericht Stuttgart",
      "registernummer": "HRB 740964",
      "registerart": "HRB",
      "company_name": "Consilium Project Management GmbH",
      "company_seat": "Heilbronn",
      "details": "21.11.2024 (Bekanntmachungsdatum)\n\nBaden-Württemberg Amtsgericht Stuttgart HRB 740964\nLöschungsankündigung\n\nConsilium Project Management GmbH\nGesellschaft mit beschränkter Haftung\nHeilbronn\n\nDas Gericht beabsichtigt, die Gesellschaft wegen Vermögenslosigkeit im Handelsregister von Amts wegen nach § 394 FamFG zu löschen. Die Frist zur Geltendmachung eines Widerspruchs gegen die beabsichtigte Löschung ist auf zwei Monate ab Veröffentlichung bestimmt."
    },
    {
      "date": "2024-11-21",
      "original_text": "Registerbekanntmachung nach dem Umwandlungsgesetz\nBayern Amtsgericht Augsburg HRB 33069\nDC 32 und 142 Planungs-UG (haftungsbeschränkt) – Augsburg",
      "type": "Registerbekanntmachung nach dem Umwandlungsgesetz",
      "state": "Bayern",
      "amtsgericht": "Amtsgericht Augsburg",
      "registernummer": "HRB 33069",
      "registerart": "HRB",
      "company_name": "DC 32 und 142 Planungs-UG (haftungsbeschränkt)",
      "company_seat": "Augsburg",
      "details": "21.11.2024 (Bekanntmachungsdatum)\n\nBayern Amtsgericht Augsburg HRB 33069\nRegisterbekanntmachung nach dem Umwandlungsgesetz 20.11.2024 (Eintragungsdatum)\n\nDC 32 und 142 Planungs-UG (haftungsbeschränkt)\nGesellschaft mit beschränkter Haftung\nAugsburg\n\nDen Gläubigern der an der Verschmelzung beteiligten Rechtsträger ist, wenn sie binnen sechs Monaten nach dem Tag, an dem die Eintragung der Verschmelzung in das Register des Sitzes desjenigen Rechtsträgers, dessen Gläubiger sie sind, nach § 19 Abs. 3 UmwG als bekannt gemacht gilt, ihren Anspruch nach Grund und Höhe schriftlich anmelden, Sicherheit zu leisten, soweit sie nicht Befriedigung verlangen können. Dieses Recht steht den Gläubigern jedoch nur zu, wenn sie glaubhaft machen, dass durch die Verschmelzung die Erfüllung ihrer Forderung gefährdet wird."
    },
    {
      "date": "2024-11-21",
      "original_text": "Registerbekanntmachung nach dem Umwandlungsgesetz\nBayern Amtsgericht München HRB 282455\nDFI Holding GmbH – München",
      "type": "Registerbekanntmachung nach dem Umwandlungsgesetz",
      "state": "Bayern",
      "amtsgericht": "Amtsgericht München",
      "registernummer": "HRB 282455",
      "registerart": "HRB",
      "company_name": "DFI Holding GmbH",
      "company_seat": "München",
      "details": "21.11.2024 (Bekanntmachungsdatum)\n\nBayern Amtsgericht München HRB 282455\nRegisterbekanntmachung nach dem Umwandlungsgesetz 20.11.2024 (Eintragungsdatum)\n\nDFI Holding GmbH\nGesellschaft mit beschränkter Haftung\nMünchen\n\nDen Gläubigern der an der Verschmelzung beteiligten Rechtsträger ist, wenn sie binnen sechs Monaten nach dem Tag, an dem die Eintragung der Verschmelzung in das Register des Sitzes desjenigen Rechtsträgers, dessen Gläubiger sie sind, nach § 19 Abs. 3 UmwG als bekannt gemacht gilt, ihren Anspruch nach Grund und Höhe schriftlich anmelden, Sicherheit zu leisten, soweit sie nicht Befriedigung verlangen können. Dieses Recht steht den Gläubigern jedoch nur zu, wenn sie glaubhaft machen, dass durch die Verschmelzung die Erfüllung ihrer Forderung gefährdet wird."
    },
    {
      "date": "2024-11-21",
      "original_text": "Registerbekanntmachung nach dem Umwandlungsgesetz\nHessen Amtsgericht Bad Homburg v.d.H. VR 2360\nDJK Sportfreunde Bad Homburg e.V. – Bad Homburg v. d. Höhe",
      "type": "Registerbekanntmachung nach dem Umwandlungsgesetz",
      "state": "Hessen",
      "amtsgericht": "Amtsgericht Bad Homburg v.d.H.",
      "registernummer": "VR 2360",
      "registerart": "VR",
      "company_name": "DJK Sportfreunde Bad Homburg e.V.",
      "company_seat": "Bad Homburg v. d. Höhe",
      "details": "21.11.2024 (Bekanntmachungsdatum)\n\nHessen Amtsgericht Bad Homburg v.d.H. VR 2360\nRegisterbekanntmachung nach dem Umwandlungsgesetz 21.11.2024 (Eintragungsdatum)\n\nDJK Sportfreunde Bad Homburg e.V.\neingetragener Verein\nBad Homburg v. d. Höhe\n\nDen Gläubigern der an der Verschmelzung beteiligten Rechtsträger ist, wenn sie binnen sechs Monaten nach dem Tag, an dem die Eintragung der Verschmelzung in das Register des Sitzes derjenigen Rechtsträger deren Gläubiger sie sind, nach § 19 Absatz 3 UmwG bekannt gemacht worden ist, ihren Anspruch nach Grund und Höhe schriftlich anmelden, Sicherheit zu leisten, soweit sie nicht Befriedigung verlangen können. Dieses Recht steht den Gläubigern jedoch nur zu, wenn sie glaubhaft machen, dass durch die Verschmelzung die Erfüllung ihrer Forderung gefährdet wird."
    },
    {
      "date": "2024-11-21",
      "original_text": "Löschungsankündigung\nBayern Amtsgericht München HRB 218336\nDaser Holding GmbH – München",
      "type": "Löschungsankündigung",
      "state": "Bayern",
      "amtsgericht": "Amtsgericht München",
      "registernummer": "HRB 218336",
      "registerart": "HRB",
      "company_name": "Daser Holding GmbH",
      "company_seat": "München",
      "details": "21.11.2024 (Bekanntmachungsdatum)\n\nBayern Amtsgericht München HRB 218336\nLöschungsankündigung 19.11.2024 (Eintragungsdatum)\n\nDaser Holding GmbH\nGesellschaft mit beschränkter Haftung\nMünchen\n\nDas Registergericht beabsichtigt, die im Handelsregister eingetragene Gesellschaft wegen Vermögenslosigkeit von Amts wegen nach § 394 FamFG zu löschen. Die Frist zur Erhebung eines Widerspruchs ist auf drei Monate festgesetzt."
    },
    {
      "date": "2024-11-21",
      "original_text": "Löschungsankündigung\nNordrhein-Westfalen Amtsgericht Coesfeld HRB 20066\nDassolar GmbH – Ahaus",
      "type": "Löschungsankündigung",
      "state": "Nordrhein-Westfalen",
      "amtsgericht": "Amtsgericht Coesfeld",
      "registernummer": "HRB 20066",
      "registerart": "HRB",
      "company_name": "Dassolar GmbH",
      "company_seat": "Ahaus",
      "details": "21.11.2024 (Bekanntmachungsdatum)\n\nNordrhein-Westfalen Amtsgericht Coesfeld HRB 20066\nLöschungsankündigung\n\nDassolar GmbH\nGesellschaft mit beschränkter Haftung\nAhaus\n\nDas Registergericht beabsichtigt, den Rechtsträger wegen Vermögenslosigkeit gemäß § 394 FamFG von Amts wegen zu löschen.\n\nGegen diese Verfügung kann Widerspruch eingelegt werden. Die Frist zur Erhebung eines Widerspruchs gegen die beabsichtigte Löschung ist auf einen Monat ab Veröffentlichung festgesetzt."
    },
    {
      "date": "2024-11-21",
      "original_text": "Registerbekanntmachung nach dem Umwandlungsgesetz\nHessen Amtsgericht Bad Homburg v.d.H. VR 600\nDeutsche Jugend Kraft (DJK) SV Helvetia Bad Homburg-Kirdorf 1920 e.V. – Bad Homburg v. d. Höhe - Kirdorf",
      "type": "Registerbekanntmachung nach dem Umwandlungsgesetz",
      "state": "Hessen",
      "amtsgericht": "Amtsgericht Bad Homburg v.d.H.",
      "registernummer": "VR 600",
      "registerart": "VR",
      "company_name": "Deutsche Jugend Kraft (DJK) SV Helvetia Bad Homburg-Kirdorf 1920 e.V.",
      "company_seat": "Bad Homburg v. d. Höhe - Kirdorf",
      "details": "21.11.2024 (Bekanntmachungsdatum)\n\nHessen Amtsgericht Bad Homburg v.d.H. VR 600\nRegisterbekanntmachung nach dem Umwandlungsgesetz 21.11.2024 (Eintragungsdatum)\n\nDeutsche Jugend Kraft (DJK) SV Helvetia Bad Homburg-Kirdorf 1920 e.V.\neingetragener Verein\nBad Homburg v. d. Höhe - Kirdorf\n\nDen Gläubigern der an der Verschmelzung beteiligten Rechtsträger ist, wenn sie binnen sechs Monaten nach dem Tag, an dem die Eintragung der Verschmelzung in das Register des Sitzes derjenigen Rechtsträger deren Gläubiger sie sind, nach § 19 Absatz 3 UmwG bekannt gemacht worden ist, ihren Anspruch nach Grund und Höhe schriftlich anmelden, Sicherheit zu leisten, soweit sie nicht Befriedigung verlangen können. Dieses Recht steht den Gläubigern jedoch nur zu, wenn sie glaubhaft machen, dass durch die Verschmelzung die Erfüllung ihrer Forderung gefährdet wird."
    },
    {
      "date": "2024-11-21",
      "original_text": "Registerbekanntmachung nach dem Umwandlungsgesetz\nNordrhein-Westfalen Amtsgericht Düsseldorf HRB 94247\nDouglas Service GmbH – Düsseldorf",
      "type": "Registerbekanntmachung nach dem Umwandlungsgesetz",
      "state": "Nordrhein-Westfalen",
      "amtsgericht": "Amtsgericht Düsseldorf",
      "registernummer": "HRB 94247",
      "registerart": "HRB",
      "company_name": "Douglas Service GmbH",
      "company_seat": "Düsseldorf",
      "details": "21.11.2024 (Bekanntmachungsdatum)\n\nNordrhein-Westfalen Amtsgericht Düsseldorf HRB 94247\nRegisterbekanntmachung nach dem Umwandlungsgesetz 21.11.2024 (Eintragungsdatum)\n\nDouglas Service GmbH\nGesellschaft mit beschränkter Haftung\nDüsseldorf\n\nDen Gläubigern der an der Verschmelzung beteiligten Rechtsträger ist, wenn sie binnen sechs Monaten nach dem Tag, an dem die Eintragung der Verschmelzung in das Register des Sitzes desjenigen Rechtsträgers, dessen Gläubiger sie sind, nach § 19 Absatz 3 UmwG als bekanntgemacht gilt, ihren Anspruch nach Grund und Höhe schriftlich anmelden, Sicherheit zu leisten, soweit sie nicht Befriedigung verlangen können. Dieses Recht steht den Gläubigern jedoch nur zu, wenn sie glaubhaft machen, dass durch die Verschmelzung die Erfüllung ihrer Forderung gefährdet wird."
    },
    {
      "date": "2024-11-21",
      "original_text": "Einreichung neuer Dokumente\nSachsen Amtsgericht Dresden HRB 8213\nDresdner Verkehrsbetriebe Aktiengesellschaft – Dresden",
      "type": "Einreichung neuer Dokumente",
      "state": "Sachsen",
      "amtsgericht": "Amtsgericht Dresden",
      "registernummer": "HRB 8213",
      "registerart": "HRB",
      "company_name": "Dresdner Verkehrsbetriebe Aktiengesellschaft",
      "company_seat": "Dresden",
      "details": "21.11.2024 (Bekanntmachungsdatum)\n\nSachsen Amtsgericht Dresden HRB 8213\nEinreichung neuer Dokumente\n\nDresdner Verkehrsbetriebe Aktiengesellschaft\nAktiengesellschaft\nDresden\n\nAm 19.11.2024 wurde beim Handelsregister des Amtsgerichts Dresden die Liste der Mitglieder des Aufsichtsrats gemäß § 106 AktG eingereicht."
    },
    {
      "date": "2024-11-21",
      "original_text": "Löschungsankündigung\nThüringen Amtsgericht Jena HRB 506629\nEABS GmbH – Eisenach",
      "type": "Löschungsankündigung",
      "state": "Thüringen",
      "amtsgericht": "Amtsgericht Jena",
      "registernummer": "HRB 506629",
      "registerart": "HRB",
      "company_name": "EABS GmbH",
      "company_seat": "Eisenach",
      "details": "21.11.2024 (Bekanntmachungsdatum)\n\nThüringen Amtsgericht Jena HRB 506629\nLöschungsankündigung\n\nEABS GmbH\nGesellschaft mit beschränkter Haftung\nEisenach\n\nDas Registergericht beabsichtigt, die im Handelsregister eingetragene Gesellschaft wegen Vermögenslosigkeit nach § 394 FamFG von Amts wegen zu löschen. Die Frist zur Erhebung eines Widerspruchs gegen die beabsichtigte Löschung wird auf 6 Wochen festgesetzt."
    },
    {
      "date": "2024-11-21",
      "original_text": "Löschungsankündigung\nNordrhein-Westfalen Amtsgericht Mönchengladbach HRB 11544\nEMA Personal Service GmbH – Mönchengladbach",
      "type": "Löschungsankündigung",
      "state": "Nordrhein-Westfalen",
      "amtsgericht": "Amtsgericht Mönchengladbach",
      "registernummer": "HRB 11544",
      "registerart": "HRB",
      "company_name": "EMA Personal Service GmbH",
      "company_seat": "Mönchengladbach",
      "details": "21.11.2024 (Bekanntmachungsdatum)\n\nNordrhein-Westfalen Amtsgericht Mönchengladbach HRB 11544\nLöschungsankündigung 21.11.2024 (Eintragungsdatum)\n\nEMA Personal Service GmbH\nGesellschaft mit beschränkter Haftung\nMönchengladbach\n\nDas Registergericht beabsichtigt die Gesellschaft von Amts wegen nach § 394 FamFG zu löschen. Die Frist zur Erhebung eines Widerspruchs ist auf drei Monate festgesetzt."
    },
    {
      "date": "2024-11-21",
      "original_text": "Einreichung neuer Dokumente\nHessen Amtsgericht Offenbach am Main HRB 46666\nESO Stadtservice GmbH – Offenbach am Main",
      "type": "Einreichung neuer Dokumente",
      "state": "Hessen",
      "amtsgericht": "Amtsgericht Offenbach am Main",
      "registernummer": "HRB 46666",
      "registerart": "HRB",
      "company_name": "ESO Stadtservice GmbH",
      "company_seat": "Offenbach am Main",
      "details": "21.11.2024 (Bekanntmachungsdatum)\n\nHessen Amtsgericht Offenbach am Main HRB 46666\nEinreichung neuer Dokumente\n\nESO Stadtservice GmbH\nGesellschaft mit beschränkter Haftung\nOffenbach am Main\n\nDurch eine Änderung in den Personen der Aufsichtsratsmitglieder ist eine Liste der Mitglieder des Aufsichtsrates zum Handelsregister eingereicht worden."
    },
    {
      "date": "2024-11-21",
      "original_text": "Registerbekanntmachung nach dem Umwandlungsgesetz\nBaden-Württemberg Amtsgericht Stuttgart HRB 330648\nEnergie Calw GmbH – Calw",
      "type": "Registerbekanntmachung nach dem Umwandlungsgesetz",
      "state": "Baden-Württemberg",
      "amtsgericht": "Amtsgericht Stuttgart",
      "registernummer": "HRB 330648",
      "registerart": "HRB",
      "company_name": "Energie Calw GmbH",
      "company_seat": "Calw",
      "details": "21.11.2024 (Bekanntmachungsdatum)\n\nBaden-Württemberg Amtsgericht Stuttgart HRB 330648\nRegisterbekanntmachung nach dem Umwandlungsgesetz 21.11.2024 (Eintragungsdatum)\n\nEnergie Calw GmbH\nGesellschaft mit beschränkter Haftung\nCalw\n\nAls nicht eingetragen wird bekanntgemacht:\nDen Gläubigern der an der Ausgliederung beteiligten Rechtsträger ist, wenn sie binnen sechs Monaten nach dem Tag, an dem die Eintragung der Ausgliederung in das Register des Sitzes desjenigen Rechtsträgers, dessen Gläubiger sie sind, nach § 19 Abs. 3 UmwG als bekanntgemacht gilt, ihren Anspruch nach Grund und Höhe schriftlich anmelden, Sicherheit zu leisten, soweit sie nicht Befriedigung verlangen können. Dieses Recht steht den Gläubigern jedoch nur zu, wenn sie glaubhaft machen, dass durch die Ausgliederung die Erfüllung ihrer Forderung gefährdet wird."
    },
    {
      "date": "2024-11-21",
      "original_text": "Einreichung neuer Dokumente\nBaden-Württemberg Amtsgericht Mannheim HRB 200754\nEntwicklungsgesellschaft Cité mbH – Baden-Baden",
      "type": "Einreichung neuer Dokumente",
      "state": "Baden-Württemberg",
      "amtsgericht": "Amtsgericht Mannheim",
      "registernummer": "HRB 200754",
      "registerart": "HRB",
      "company_name": "Entwicklungsgesellschaft Cité mbH",
      "company_seat": "Baden-Baden",
      "details": "21.11.2024 (Bekanntmachungsdatum)\n\nBaden-Württemberg Amtsgericht Mannheim HRB 200754\nEinreichung neuer Dokumente\n\nEntwicklungsgesellschaft Cité mbH\nGesellschaft mit beschränkter Haftung\nBaden-Baden\n\nDie Gesellschaft hat am 20.11.2024 die Liste über die Zusammensetzung des Aufsichtsrats zum Handelsregister eingereicht."
    },
    {
      "date": "2024-11-21",
      "original_text": "Registerbekanntmachung nach dem Umwandlungsgesetz\nHamburg Amtsgericht Hamburg HRB 147432\nEraneos Analytics Germany GmbH – Hamburg",
      "type": "Registerbekanntmachung nach dem Umwandlungsgesetz",
      "state": "Hamburg",
      "amtsgericht": "Amtsgericht Hamburg",
      "registernummer": "HRB 147432",
      "registerart": "HRB",
      "company_name": "Eraneos Analytics Germany GmbH",
      "company_seat": "Hamburg",
      "details": "21.11.2024 (Bekanntmachungsdatum)\n\nHamburg Amtsgericht Hamburg HRB 147432\nRegisterbekanntmachung nach dem Umwandlungsgesetz 21.11.2024 (Eintragungsdatum)\n\nEraneos Analytics Germany GmbH\nGesellschaft mit beschränkter Haftung\nHamburg\n\nAls nicht eingetragen wird bekannt gemacht:\nDen Gläubigern der an der Verschmelzung beteiligten Gesellschaften ist, wenn sie binnen sechs Monaten nach dem Tag, an dem die Eintragung der Verschmelzung in das Register des Sitzes desjenigen Rechtsträgers, dessen Gläubiger sie sind, nach § 19 Absatz 3 UmwG als bekannt gemacht gilt, ihren Anspruch nach Grund und Höhe schriftlich anmelden, Sicherheit zu leisten, soweit sie nicht Befriedigung verlangen können. Dieses Recht steht den Gläubigern jedoch nur zu, wenn sie glaubhaft machen, dass durch die Verschmelzung die Erfüllung ihrer Forderung gefährdet wird."
    },
    {
      "date": "2024-11-21",
      "original_text": "Registerbekanntmachung nach dem Umwandlungsgesetz\nBayern Amtsgericht Würzburg HRB 17173\nFahrenheit AcquiCo GmbH – Würzburg",
      "type": "Registerbekanntmachung nach dem Umwandlungsgesetz",
      "state": "Bayern",
      "amtsgericht": "Amtsgericht Würzburg",
      "registernummer": "HRB 17173",
      "registerart": "HRB",
      "company_name": "Fahrenheit AcquiCo GmbH",
      "company_seat": "Würzburg",
      "details": "21.11.2024 (Bekanntmachungsdatum)\n\nBayern Amtsgericht Würzburg HRB 17173\nRegisterbekanntmachung nach dem Umwandlungsgesetz 20.11.2024 (Eintragungsdatum)\n\nFahrenheit AcquiCo GmbH\nGesellschaft mit beschränkter Haftung\nWürzburg\n\nDen Gläubigern der an der Spaltung beteiligten Rechtsträger ist, wenn sie binnen sechs Monaten nach dem Tag, an dem die Eintragung der Spaltung in das Register des Sitzes desjenigen Rechtsträgers, dessen Gläubiger sie sind, nach §§ 125, 19 Abs. 3 UmwG als bekannt gemacht gilt, ihren Anspruch nach Grund und Höhe schriftlich anmelden, Sicherheit zu leisten, soweit sie nicht Befriedigung verlangen können. Dieses Recht steht den Gläubigern jedoch nur zu, wenn sie glaubhaft machen, dass durch die Spaltung die Erfüllung ihrer Forderung gefährdet wird."
    },
    {
      "date": "2024-11-21",
      "original_text": "Registerbekanntmachung nach dem Umwandlungsgesetz\nNiedersachsen Amtsgericht Oldenburg (Oldenburg) HRB 151962 früher Amtsgericht Cloppenburg\nFleming + Wendeln Besitz Beteiligungs-GmbH – Garrel",
      "type": "Registerbekanntmachung nach dem Umwandlungsgesetz",
      "state": "Niedersachsen",
      "amtsgericht": "Amtsgericht Oldenburg (Oldenburg)",
      "registernummer": "HRB 151962",
      "registerart": "HRB",
      "company_name": "Fleming + Wendeln Besitz Beteiligungs-GmbH",
      "company_seat": "Garrel",
      "former_amtsgericht": "Cloppenburg",
      "details": "21.11.2024 (Bekanntmachungsdatum)\n\nNiedersachsen Amtsgericht Oldenburg (Oldenburg) HRB 151962 früher Amtsgericht Cloppenburg\nRegisterbekanntmachung nach dem Umwandlungsgesetz 21.11.2024 (Eintragungsdatum)\n\nFleming + Wendeln Besitz Beteiligungs-GmbH\nGesellschaft mit beschränkter Haftung\nGarrel\n\nDen Gläubigern der an der Verschmelzung beteiligten Rechtsträger ist, wenn sie binnen sechs Monaten nach dem Tag, an dem die Eintragung der Verschmelzung in das Register des Sitzes desjenigen Rechtsträgers, dessen Gläubiger sie sind, nach § 19  Abs.  3 UmwG als bekannt gemacht gilt, ihren Anspruch nach Grund und Höhe schriftlich anmelden, Sicherheit zu leisten, soweit sie nicht Befriedigung verlangen können. Dieses Recht steht den Gläubigern jedoch nur zu, wenn sie glaubhaft machen, dass durch die Verschmelzung die Erfüllung der Forderung gefährdet wird."
    },
    {
      "date": "2024-11-21",
      "original_text": "Löschungsankündigung\nBaden-Württemberg Amtsgericht Mannheim HRB 8908\nFloor-Design GmbH – Mannheim",
      "type": "Löschungsankündigung",
      "state": "Baden-Württemberg",
      "amtsgericht": "Amtsgericht Mannheim",
      "registernummer": "HRB 8908",
      "registerart": "HRB",
      "company_name": "Floor-Design GmbH",
      "company_seat": "Mannheim",
      "details": "21.11.2024 (Bekanntmachungsdatum)\n\nBaden-Württemberg Amtsgericht Mannheim HRB 8908\nLöschungsankündigung\n\nFloor-Design GmbH\nGesellschaft mit beschränkter Haftung\nMannheim\n\nDas Gericht beabsichtigt, die Gesellschaft wegen Vermögenslosigkeit im Handelsregister von Amts wegen nach § 394 FamFG zu löschen. Die Frist zur Geltendmachung eines Widerspruchs gegen die beabsichtigte Löschung ist auf einen Monat ab Veröffentlichung bestimmt."
    },
    {
      "date": "2024-11-21",
      "original_text": "Einreichung neuer Dokumente\nRheinland-Pfalz Amtsgericht Ludwigshafen a.Rhein (Ludwigshafen) HRB 51056\nGEWO Wohnen GmbH – Speyer",
      "type": "Einreichung neuer Dokumente",
      "state": "Rheinland-Pfalz",
      "amtsgericht": "Amtsgericht Ludwigshafen a.Rhein (Ludwigshafen)",
      "registernummer": "HRB 51056",
      "registerart": "HRB",
      "company_name": "GEWO Wohnen GmbH",
      "company_seat": "Speyer",
      "details": "21.11.2024 (Bekanntmachungsdatum)\n\nRheinland-Pfalz Amtsgericht Ludwigshafen a.Rhein (Ludwigshafen) HRB 51056\nEinreichung neuer Dokumente\n\nGEWO Wohnen GmbH\nGesellschaft mit beschränkter Haftung\nSpeyer\n\nDem Registergericht ist eine neue Liste der Mitglieder des Aufsichtsrates eingereicht worden."
    },
    {
      "date": "2024-11-21",
      "original_text": "Registerbekanntmachung nach dem Umwandlungsgesetz\nBerlin Amtsgericht Berlin (Charlottenburg) HRB 196093\nGaia Berlin GmbH – Berlin",
      "type": "Registerbekanntmachung nach dem Umwandlungsgesetz",
      "state": "Berlin",
      "amtsgericht": "Amtsgericht Berlin (Charlottenburg)",
      "registernummer": "HRB 196093",
      "registerart": "HRB",
      "company_name": "Gaia Berlin GmbH",
      "company_seat": "Berlin",
      "details": "21.11.2024 (Bekanntmachungsdatum)\n\nBerlin Amtsgericht Berlin (Charlottenburg) HRB 196093\nRegisterbekanntmachung nach dem Umwandlungsgesetz 20.11.2024 (Eintragungsdatum)\n\nGaia Berlin GmbH\nGesellschaft mit beschränkter Haftung\nBerlin\n\nZu Eintragungsnummer 7 vom 20.11.2024 wird als nicht eingetragen veröffentlicht: Den Gläubigern der an der Spaltung beteiligten Rechtsträger ist, wenn sie binnen sechs Monaten nach dem Tag, an dem die Eintragung der Spaltung in das Register des Sitzes desjenigen Rechtsträgers, dessen Gläubiger sie sind, als bekannt gemacht gilt, ihren Anspruch nach Grund und Höhe schriftlich anmelden, Sicherheit zu leisten, soweit sie nicht Befriedigung verlangen können. Dieses Recht steht den Gläubigern jedoch nur zu, wenn sie glaubhaft machen, dass durch die Spaltung die Erfüllung ihrer Forderung gefährdet wird. Das Recht, Sicherheitsleistung zu verlangen, steht Gläubigern nicht zu, die im Falle der Insolvenz ein Recht auf vorzugsweise Befriedigung aus einer Deckungsmasse haben, die nach gesetzlicher Vorschrift zu ihrem Schutz errichtet und staatlich überwacht ist."
    },
    {
      "date": "2024-11-21",
      "original_text": "Einreichung neuer Dokumente\nRheinland-Pfalz Amtsgericht Ludwigshafen a.Rhein (Ludwigshafen) HRB 21940\nGemeindewerke Bobenheim-Roxheim GmbH – Bobenheim-Roxheim",
      "type": "Einreichung neuer Dokumente",
      "state": "Rheinland-Pfalz",
      "amtsgericht": "Amtsgericht Ludwigshafen a.Rhein (Ludwigshafen)",
      "registernummer": "HRB 21940",
      "registerart": "HRB",
      "company_name": "Gemeindewerke Bobenheim-Roxheim GmbH",
      "company_seat": "Bobenheim-Roxheim",
      "details": "21.11.2024 (Bekanntmachungsdatum)\n\nRheinland-Pfalz Amtsgericht Ludwigshafen a.Rhein (Ludwigshafen) HRB 21940\nEinreichung neuer Dokumente\n\nGemeindewerke Bobenheim-Roxheim GmbH\nGesellschaft mit beschränkter Haftung\nBobenheim-Roxheim\n\nDem Registergericht ist eine neue Liste der Mitglieder des Aufsichtsrates eingereicht worden."
    },
    {
      "date": "2024-11-21",
      "original_text": "Einreichung neuer Dokumente\nSachsen Amtsgericht Chemnitz HRB 12315\nGemeinnützige Heimbetriebsgesellschaft mbH Kirchberg – Kirchberg",
      "type": "Einreichung neuer Dokumente",
      "state": "Sachsen",
      "amtsgericht": "Amtsgericht Chemnitz",
      "registernummer": "HRB 12315",
      "registerart": "HRB",
      "company_name": "Gemeinnützige Heimbetriebsgesellschaft mbH Kirchberg",
      "company_seat": "Kirchberg",
      "details": "21.11.2024 (Bekanntmachungsdatum)\n\nSachsen Amtsgericht Chemnitz HRB 12315\nEinreichung neuer Dokumente\n\nGemeinnützige Heimbetriebsgesellschaft mbH Kirchberg\nGesellschaft mit beschränkter Haftung\nKirchberg\n\nAm 19.11.2024 wurde beim Handelsregister des Amtsgerichts Chemnitz die Liste der Mitglieder des Aufsichtsrats gemäß § 52 GmbHG eingereicht."
    },
    {
      "date": "2024-11-21",
      "original_text": "Löschungsankündigung\nSachsen Amtsgericht Leipzig VR 5632\nGemeinschaftlich leben e.V. – Leipzig",
      "type": "Löschungsankündigung",
      "state": "Sachsen",
      "amtsgericht": "Amtsgericht Leipzig",
      "registernummer": "VR 5632",
      "registerart": "VR",
      "company_name": "Gemeinschaftlich leben e.V.",
      "company_seat": "Leipzig",
      "details": "21.11.2024 (Bekanntmachungsdatum)\n\nSachsen Amtsgericht Leipzig VR 5632\nLöschungsankündigung\n\nGemeinschaftlich leben e.V.\neingetragener Verein\nLeipzig\n\nDas Gericht beabsichtigt, gemäß § 4 Absatz 2 Ziffer 1 der Verordnung über das Vereinsregister das Registerblatt  des Vereins zu schließen, da nach den Ermittlungen des Gerichts sämtliche Mitglieder aus dem Verein ausgeschieden sind. Zur Geltendmachung eines Widerspruchs gegen die beabsichtigte Schließung wird eine Frist von einem Monat nach der Veröffentlichung bestimmt."
    },
    {
      "date": "2024-11-21",
      "original_text": "Löschungsankündigung\nSaarland Amtsgericht Saarbrücken HRB 17716\nHFS GmbH – Überherrn",
      "type": "Löschungsankündigung",
      "state": "Saarland",
      "amtsgericht": "Amtsgericht Saarbrücken",
      "registernummer": "HRB 17716",
      "registerart": "HRB",
      "company_name": "HFS GmbH",
      "company_seat": "Überherrn",
      "details": "21.11.2024 (Bekanntmachungsdatum)\n\nSaarland Amtsgericht Saarbrücken HRB 17716\nLöschungsankündigung\n\nHFS GmbH\nGesellschaft mit beschränkter Haftung\nÜberherrn\n\nEs ist beabsichtigt, die Gesellschaft von Amts wegen gemäß § 394 FamFG wegen Vermögenslosigkeit zu löschen.\nGegen die Löschung von Amts wegen ist das Rechtsmittel des Widerspruchs statthaft. Der Widerspruch ist binnen einer Frist zwei Monaten beginnend mit dem Tag dieser Veröffentlichung durch Einreichen eines Widerspruchsschreibens -schriftlich oder zur Niederschrift der Geschäftsstelle beim Amtsgericht Saarbrücken, -zentrales Handelsregister-, Mainzer Str.178, 66121 Saarbrücken einzulegen.\nDer Widerspruch muss die Bezeichnung der angefochtenen Löschungsankündigung enthalten sowie die Erklärung, dass Widerspruch eingelegt wird. Er ist vom Widerspruchsführer oder seinem Bevollmächtigten zu unterzeichnen.\nDas Widerspruchsschreiben kann auch in der Form eines elektronischen Dokumentes eingereicht werden, das mit einer qualifizierten elektronischen Signatur nach dem Signaturgesetz versehen sein muss (§§ 14 Abs. 2 FamFG, 130a, 298 ZPO)."
    },
    {
      "date": "2024-11-21",
      "original_text": "Löschungsankündigung\nBayern Amtsgericht München HRB 150871\nHaarprofi Handelsgesellschaft mbH – München",
      "type": "Löschungsankündigung",
      "state": "Bayern",
      "amtsgericht": "Amtsgericht München",
      "registernummer": "HRB 150871",
      "registerart": "HRB",
      "company_name": "Haarprofi Handelsgesellschaft mbH",
      "company_seat": "München",
      "details": "21.11.2024 (Bekanntmachungsdatum)\n\nBayern Amtsgericht München HRB 150871\nLöschungsankündigung\n\nHaarprofi Handelsgesellschaft mbH\nGesellschaft mit beschränkter Haftung\nMünchen\n\nDas Registergericht beabsichtigt, die im Handelsregister eingetragene Gesellschaft wegen Vermögenslosigkeit von Amts wegen nach § 394 FamFG zu löschen. Die Frist zur Erhebung eines Widerspruchs ist auf drei Monate festgesetzt."
    },
    {
      "date": "2024-11-21",
      "original_text": "Löschungsankündigung\nSchleswig-Holstein Amtsgericht Kiel HRB 20454\nHellerholz Academy GmbH – Alveslohe",
      "type": "Löschungsankündigung",
      "state": "Schleswig-Holstein",
      "amtsgericht": "Amtsgericht Kiel",
      "registernummer": "HRB 20454",
      "registerart": "HRB",
      "company_name": "Hellerholz Academy GmbH",
      "company_seat": "Alveslohe",
      "details": "21.11.2024 (Bekanntmachungsdatum)\n\nSchleswig-Holstein Amtsgericht Kiel HRB 20454\nLöschungsankündigung\n\nHellerholz Academy GmbH\nGesellschaft mit beschränkter Haftung\nAlveslohe\n\nEs ist die Löschung der nachstehenden Gesellschaft wegen Vermögenslosigkeit gemäß § 394 FamFG beabsichtigt. Widerspruchsfrist: 2 Monate."
    },
    {
      "date": "2024-11-21",
      "original_text": "Registerbekanntmachung nach dem Umwandlungsgesetz\nBayern Amtsgericht München HRA 120051\nHo-Bra GmbH & Co. KG – München",
      "type": "Registerbekanntmachung nach dem Umwandlungsgesetz",
      "state": "Bayern",
      "amtsgericht": "Amtsgericht München",
      "registernummer": "HRA 120051",
      "registerart": "HRA",
      "company_name": "Ho-Bra GmbH & Co. KG",
      "company_seat": "München",
      "details": "21.11.2024 (Bekanntmachungsdatum)\n\nBayern Amtsgericht München HRA 120051\nRegisterbekanntmachung nach dem Umwandlungsgesetz 20.11.2024 (Eintragungsdatum)\n\nHo-Bra GmbH & Co. KG\nKommanditgesellschaft\nMünchen\n\nDen Gläubigern der an der Ausgliederung beteiligten Rechtsträger ist, wenn sie binnen sechs Monaten nach dem Tag, an dem die Eintragung der Ausgliederung in das Register des Sitzes desjenigen Rechtsträgers, dessen Gläubiger sie sind, nach §§ 125, 19 Abs. 3 UmwG als bekannt gemacht gilt, ihren Anspruch nach Grund und Höhe schriftlich anmelden, Sicherheit zu leisten, soweit sie nicht Befriedigung verlangen können. Dieses Recht steht den Gläubigern jedoch nur zu, wenn sie glaubhaft machen, dass durch die Ausgliederung die Erfüllung ihrer Forderung gefährdet wird."
    },
    {
      "date": "2024-11-21",
      "original_text": "Löschungsankündigung\nBremen Amtsgericht Bremen HRB 28492\nHomepage24 GmbH – Bremen",
      "type": "Löschungsankündigung",
      "state": "Bremen",
      "amtsgericht": "Amtsgericht Bremen",
      "registernummer": "HRB 28492",
      "registerart": "HRB",
      "company_name": "Homepage24 GmbH",
      "company_seat": "Bremen",
      "details": "21.11.2024 (Bekanntmachungsdatum)\n\nBremen Amtsgericht Bremen HRB 28492\nLöschungsankündigung\n\nHomepage24 GmbH\nGesellschaft mit beschränkter Haftung\nBremen\n\nEs ist beabsichtigt die im Handelsregister eingetragene Gesellschaft von Amts wegen gemäß § 394 FamFG zu löschen. Gegen die Löschung kann beim AG Bremen schriftlich oder zu Protokoll der Geschäftsstelle Widerspruch eingelegt werden. Widerspruchsfrist 4 Wochen."
    },
    {
      "date": "2024-11-21",
      "original_text": "Registerbekanntmachung nach dem Umwandlungsgesetz\nBayern Amtsgericht Fürth HRB 21441\nHotel Riesengebirge GmbH – Neuhof a.d.Zenn",
      "type": "Registerbekanntmachung nach dem Umwandlungsgesetz",
      "state": "Bayern",
      "amtsgericht": "Amtsgericht Fürth",
      "registernummer": "HRB 21441",
      "registerart": "HRB",
      "company_name": "Hotel Riesengebirge GmbH",
      "company_seat": "Neuhof a.d.Zenn",
      "details": "21.11.2024 (Bekanntmachungsdatum)\n\nBayern Amtsgericht Fürth HRB 21441\nRegisterbekanntmachung nach dem Umwandlungsgesetz 20.11.2024 (Eintragungsdatum)\n\nHotel Riesengebirge GmbH\nGesellschaft mit beschränkter Haftung\nNeuhof a.d.Zenn\n\nDen Gläubigern der an der Ausgliederung beteiligten Rechtsträger ist, wenn sie binnen sechs Monaten nach dem Tag, an dem die Eintragung der Ausgliederung in das Register des Sitzes desjenigen Rechtsträgers, dessen Gläubiger sie sind, nach §§ 125, 19 Abs. 3 UmwG als bekannt gemacht gilt, ihren Anspruch nach Grund und Höhe schriftlich anmelden, Sicherheit zu leisten, soweit sie nicht Befriedigung verlangen können. Dieses Recht steht den Gläubigern jedoch nur zu, wenn sie glaubhaft machen, dass durch die Ausgliederung die Erfüllung ihrer Forderung gefährdet wird."
    },
    {
      "date": "2024-11-21",
      "original_text": "Einreichung neuer Dokumente\nBerlin Amtsgericht Berlin (Charlottenburg) HRB 21280\nIAV GmbH Ingenieurgesellschaft Auto und Verkehr – Berlin",
      "type": "Einreichung neuer Dokumente",
      "state": "Berlin",
      "amtsgericht": "Amtsgericht Berlin (Charlottenburg)",
      "registernummer": "HRB 21280",
      "registerart": "HRB",
      "company_name": "IAV GmbH Ingenieurgesellschaft Auto und Verkehr",
      "company_seat": "Berlin",
      "details": "21.11.2024 (Bekanntmachungsdatum)\n\nBerlin Amtsgericht Berlin (Charlottenburg) HRB 21280\nEinreichung neuer Dokumente\n\nIAV GmbH Ingenieurgesellschaft Auto und Verkehr\nGesellschaft mit beschränkter Haftung\nBerlin\n\nAls nicht eingetragen wird veröffentlicht:Es wurde eine neue Liste der Aufsichtsratsmitglieder eingereicht (§52 GmbHG)."
    },
    {
      "date": "2024-11-21",
      "original_text": "Löschungsankündigung\nHessen Amtsgericht Offenbach am Main HRB 48489\nIndian Catering Service UG (haftungsbeschränkt) – Offenbach am Main",
      "type": "Löschungsankündigung",
      "state": "Hessen",
      "amtsgericht": "Amtsgericht Offenbach am Main",
      "registernummer": "HRB 48489",
      "registerart": "HRB",
      "company_name": "Indian Catering Service UG (haftungsbeschränkt)",
      "company_seat": "Offenbach am Main",
      "details": "21.11.2024 (Bekanntmachungsdatum)\n\nHessen Amtsgericht Offenbach am Main HRB 48489\nLöschungsankündigung\n\nIndian Catering Service UG (haftungsbeschränkt)\nGesellschaft mit beschränkter Haftung\nOffenbach am Main\n\nDas Registergericht beabsichtigt die im Handelsregister eingetragene Gesellschaft von Amts wegen nach § 394 FamFG zu löschen. Die Frist zur Erhebung eines Widerspruchs gegen die beabsichtigte Löschung wird auf 3 Monate festgesetzt."
    },
    {
      "date": "2024-11-21",
      "original_text": "Löschungsankündigung\nNordrhein-Westfalen Amtsgericht Duisburg HRB 30942\nJ. O. Immobilien GmbH – Duisburg",
      "type": "Löschungsankündigung",
      "state": "Nordrhein-Westfalen",
      "amtsgericht": "Amtsgericht Duisburg",
      "registernummer": "HRB 30942",
      "registerart": "HRB",
      "company_name": "J. O. Immobilien GmbH",
      "company_seat": "Duisburg",
      "details": "21.11.2024 (Bekanntmachungsdatum)\n\nNordrhein-Westfalen Amtsgericht Duisburg HRB 30942\nLöschungsankündigung\n\nJ. O. Immobilien GmbH\nGesellschaft mit beschränkter Haftung\nDuisburg\n\nDas Registergericht beabsichtigt, die im Handelsregister unter HRB 30942  eingetragene Gesellschaft  J. O. Immobilien GmbH gemäß § 394 FamFG wegen Vermögenslosigkeit von Amts wegen zu löschen. Gegen diese Verfügung kann Widerspruch eingelegt werden. Die Frist zur Erhebung eines Widerspruchs gegen die beabsichtigte Löschung von Amts wegen ist auf drei Monate festgesetzt. Rechtsbehelfsbelehrung Der Widerspruch ist bei dem Amtsgericht Duisburg, Kardinal-Galen-Str. 124-132, 47058 Duisburg schriftlich in deutscher Sprache oder zur Niederschrift der Geschäftsstelle einzulegen. Der Widerspruch kann auch zur Niederschrift der Geschäftsstelle eines jeden Amtsgerichtes abgegeben werden. Die Einlegung ist auch durch Übertragung eines elektronischen Dokuments an die elektronische Poststelle des Gerichts möglich. Das elektronische Dokument muss für die Bearbeitung durch das Gericht geeignet und mit einer qualifizierten elektronischen Signatur der verantwortenden Person versehen sein oder von der verantwortenden Person signiert und auf einem sicheren Übermittlungsweg gemäß § 130 a ZPO nach näherer Maßgabe der Verordnung über die technischen Rahmenbedingungen des elektronischen Rechtsverkehrs und über das besondere elektronische Behördenpostfach (BGBl. I, S. 3803) eingereicht werden. Weitere Informationen erhalten Sie auf der Internetseite www.justiz.de <http://www.justiz.de>. Der Widerspruch muss spätestens innerhalb der gesetzten Frist bei dem Amtsgericht Duisburg eingegangen sein. Dies gilt auch dann, wenn der Widerspruch zur Niederschrift der Geschäftsstelle eines anderen Amtsgerichtes abgegeben wurde. Die Frist beginnt mit der Veröffentlichung. Fällt das Ende der Frist auf einen Sonntag, einen allgemeinen Feiertag oder Sonnabend, so endet die Frist mit Ablauf des nächsten Werktages. Der Widerspruch muss die Bezeichnung der angefochtenen Verfügung sowie die Erklärung enthalten, dass Widerspruch gegen diese Verfügung eingelegt wird. Er ist zu unterzeichnen und soll begründet werden."
    },
    {
      "date": "2024-11-21",
      "original_text": "Löschungsankündigung\nBayern Amtsgericht München HRB 185169\nJosef Riedl Gebäudereinigung GmbH – München",
      "type": "Löschungsankündigung",
      "state": "Bayern",
      "amtsgericht": "Amtsgericht München",
      "registernummer": "HRB 185169",
      "registerart": "HRB",
      "company_name": "Josef Riedl Gebäudereinigung GmbH",
      "company_seat": "München",
      "details": "21.11.2024 (Bekanntmachungsdatum)\n\nBayern Amtsgericht München HRB 185169\nLöschungsankündigung 14.11.2024 (Eintragungsdatum)\n\nJosef Riedl Gebäudereinigung GmbH\nGesellschaft mit beschränkter Haftung\nMünchen\n\nDas Registergericht beabsichtigt, die im Handelsregister eingetragene Gesellschaft wegen Vermögenslosigkeit von Amts wegen nach § 394 FamFG zu löschen. Die Frist zur Erhebung eines Widerspruchs ist auf drei Monate festgesetzt."
    },
    {
      "date": "2024-11-21",
      "original_text": "Registerbekanntmachung nach dem Umwandlungsgesetz\nMecklenburg-Vorpommern Amtsgericht Stralsund HRB 3265\nKID Krankenhaus Informatik und Dienstleistungen GmbH – Greifswald",
      "type": "Registerbekanntmachung nach dem Umwandlungsgesetz",
      "state": "Mecklenburg-Vorpommern",
      "amtsgericht": "Amtsgericht Stralsund",
      "registernummer": "HRB 3265",
      "registerart": "HRB",
      "company_name": "KID Krankenhaus Informatik und Dienstleistungen GmbH",
      "company_seat": "Greifswald",
      "details": "21.11.2024 (Bekanntmachungsdatum)\n\nMecklenburg-Vorpommern Amtsgericht Stralsund HRB 3265\nRegisterbekanntmachung nach dem Umwandlungsgesetz 21.11.2024 (Eintragungsdatum)\n\nKID Krankenhaus Informatik und Dienstleistungen GmbH\nGesellschaft mit beschränkter Haftung\nGreifswald\n\nAls nicht eingetragen wird veröffentlicht: Den Gläubigern der an der Verschmelzung beteiligten Rechtsträger ist, wenn sie binnen sechs Monaten nach dem Tag, an dem die Eintragung der Verschmelzung in das Register des Sitzes desjenigen Rechtsträgers, dessen Gläubiger sie sind, nach § 19 Abs. 3 UmwG als bekannt gemacht gilt,\nihren Anspruch nach Grund und Höhe schriftlich anmelden, Sicherheit zu leisten, soweit sie nicht Befriedigung verlangen können. Dieses Recht steht den Gläubigern jedoch nur zu, wenn sie glaubhaft machen, dass durch die Verschmelzung die Erfüllung der Forderung gefährdet wird."
    },
    {
      "date": "2024-11-21",
      "original_text": "Registerbekanntmachung nach dem Umwandlungsgesetz\nBayern Amtsgericht München HRB 291266\nKailumin Germany GmbH – Garching b.München",
      "type": "Registerbekanntmachung nach dem Umwandlungsgesetz",
      "state": "Bayern",
      "amtsgericht": "Amtsgericht München",
      "registernummer": "HRB 291266",
      "registerart": "HRB",
      "company_name": "Kailumin Germany GmbH",
      "company_seat": "Garching b.München",
      "details": "21.11.2024 (Bekanntmachungsdatum)\n\nBayern Amtsgericht München HRB 291266\nRegisterbekanntmachung nach dem Umwandlungsgesetz 20.11.2024 (Eintragungsdatum)\n\nKailumin Germany GmbH\nGesellschaft mit beschränkter Haftung\nGarching b.München\n\nDen Gläubigern der an der Verschmelzung beteiligten Rechtsträger ist, wenn sie binnen sechs Monaten nach dem Tag, an dem die Eintragung der Verschmelzung in das Register des Sitzes desjenigen Rechtsträgers, dessen Gläubiger sie sind, nach § 19 Abs. 3 UmwG als bekannt gemacht gilt, ihren Anspruch nach Grund und Höhe schriftlich anmelden, Sicherheit zu leisten, soweit sie nicht Befriedigung verlangen können. Dieses Recht steht den Gläubigern jedoch nur zu, wenn sie glaubhaft machen, dass durch die Verschmelzung die Erfüllung ihrer Forderung gefährdet wird."
    },
    {
      "date": "2024-11-21",
      "original_text": "Löschungsankündigung\nNordrhein-Westfalen Amtsgericht Lemgo HRB 11252\nKibou Service GmbH – Bad Salzuflen",
      "type": "Löschungsankündigung",
      "state": "Nordrhein-Westfalen",
      "amtsgericht": "Amtsgericht Lemgo",
      "registernummer": "HRB 11252",
      "registerart": "HRB",
      "company_name": "Kibou Service GmbH",
      "company_seat": "Bad Salzuflen",
      "details": "21.11.2024 (Bekanntmachungsdatum)\n\nNordrhein-Westfalen Amtsgericht Lemgo HRB 11252\nLöschungsankündigung\n\nKibou Service GmbH\nGesellschaft mit beschränkter Haftung\nBad Salzuflen\n\nEs ist beabsichtigt, die Gesellschaft von Amts wegen im Hinblick auf das Fehlen jeglichen praktisch einen Wert darstellenden Aktivvermögens wegen Vermögenslosigkeit gemäß § 394 Abs. 1 FamFG zu löschen. Hiergegen kann binnen drei Monaten nach Veröffentlichung dieser Bekanntmachung Widerspruch beim Amtsgericht Lemgo eingelegt werden."
    },
    {
      "date": "2024-11-21",
      "original_text": "Registerbekanntmachung nach dem Umwandlungsgesetz\nBrandenburg Amtsgericht Potsdam HRB 39915\nKolibri Beteiligung GmbH – Kleinmachnow",
      "type": "Registerbekanntmachung nach dem Umwandlungsgesetz",
      "state": "Brandenburg",
      "amtsgericht": "Amtsgericht Potsdam",
      "registernummer": "HRB 39915",
      "registerart": "HRB",
      "company_name": "Kolibri Beteiligung GmbH",
      "company_seat": "Kleinmachnow",
      "details": "21.11.2024 (Bekanntmachungsdatum)\n\nBrandenburg Amtsgericht Potsdam HRB 39915\nRegisterbekanntmachung nach dem Umwandlungsgesetz 20.11.2024 (Eintragungsdatum)\n\nKolibri Beteiligung GmbH\nGesellschaft mit beschränkter Haftung\nKleinmachnow\n\nZu Eintragungsnummer 3 vom 20.11.2024 wird als nicht eingetragen veröffentlicht:\nDen Gläubigern der an der Verschmelzung beteiligten Rechtsträger ist, wenn sie binnen sechs Monaten nach dem Tag, an dem die Eintragung der Verschmelzung in das Register des Sitzes desjenigen Rechtsträgers, dessen Gläubiger sie sind, als bekannt gemacht gilt, ihren Anspruch nach Grund und Höhe schriftlich anmelden, Sicherheit zu leisten, soweit sie nicht Befriedigung verlangen können. Dieses Recht steht den Gläubigern jedoch nur zu, wenn sie glaubhaft machen, dass durch die Verschmelzung die Erfüllung ihrer Forderung gefährdet wird."
    },
    {
      "date": "2024-11-21",
      "original_text": "Registerbekanntmachung nach dem Umwandlungsgesetz\nBrandenburg Amtsgericht Potsdam HRB 36532\nKolibri Geschäftsführungs GmbH – Kleinmachnow",
      "type": "Registerbekanntmachung nach dem Umwandlungsgesetz",
      "state": "Brandenburg",
      "amtsgericht": "Amtsgericht Potsdam",
      "registernummer": "HRB 36532",
      "registerart": "HRB",
      "company_name": "Kolibri Geschäftsführungs GmbH",
      "company_seat": "Kleinmachnow",
      "details": "21.11.2024 (Bekanntmachungsdatum)\n\nBrandenburg Amtsgericht Potsdam HRB 36532\nRegisterbekanntmachung nach dem Umwandlungsgesetz 20.11.2024 (Eintragungsdatum)\n\nKolibri Geschäftsführungs GmbH\nGesellschaft mit beschränkter Haftung\nKleinmachnow\n\nZu Eintragungsnummer 7 vom 20.11.2024 wird als nicht eingetragen veröffentlicht:\nDen Gläubigern der an der Verschmelzung beteiligten Rechtsträger ist, wenn sie binnen sechs Monaten nach dem Tag, an dem die Eintragung der Verschmelzung in das Register des Sitzes desjenigen Rechtsträgers, dessen Gläubiger sie sind, als bekannt gemacht gilt, ihren Anspruch nach Grund und Höhe schriftlich anmelden, Sicherheit zu leisten, soweit sie nicht Befriedigung verlangen können. Dieses Recht steht den Gläubigern jedoch nur zu, wenn sie glaubhaft machen, dass durch die Verschmelzung die Erfüllung ihrer Forderung gefährdet wird."
    },
    {
      "date": "2024-11-21",
      "original_text": "Löschungsankündigung\nHamburg Amtsgericht Hamburg HRA 95727\nKommanditgesellschaft MS \"SANTA VIRGINIA\" Offen Reederei GmbH & Co. – Hamburg",
      "type": "Löschungsankündigung",
      "state": "Hamburg",
      "amtsgericht": "Amtsgericht Hamburg",
      "registernummer": "HRA 95727",
      "registerart": "HRA",
      "company_name": "Kommanditgesellschaft MS \"SANTA VIRGINIA\" Offen Reederei GmbH & Co.",
      "company_seat": "Hamburg",
      "details": "21.11.2024 (Bekanntmachungsdatum)\n\nHamburg Amtsgericht Hamburg HRA 95727\nLöschungsankündigung\n\nKommanditgesellschaft MS \"SANTA VIRGINIA\" Offen Reederei GmbH & Co.\nKommanditgesellschaft\nHamburg\n\nDas Registergericht beabsichtigt, die im Handelsregister eingetragene Gesellschaft von Amts wegen nach § 394 FamFG zu löschen. Die Frist zur Erhebung eines Widerspruchs gegen die beabsichtigte Löschung wird auf 3 Monate festgesetzt."
    },
    {
      "date": "2024-11-21",
      "original_text": "Löschungsankündigung\nBaden-Württemberg Amtsgericht Stuttgart HRB 722175\nKorecki Verwaltungs-GmbH – Nufringen",
      "type": "Löschungsankündigung",
      "state": "Baden-Württemberg",
      "amtsgericht": "Amtsgericht Stuttgart",
      "registernummer": "HRB 722175",
      "registerart": "HRB",
      "company_name": "Korecki Verwaltungs-GmbH",
      "company_seat": "Nufringen",
      "details": "21.11.2024 (Bekanntmachungsdatum)\n\nBaden-Württemberg Amtsgericht Stuttgart HRB 722175\nLöschungsankündigung\n\nKorecki Verwaltungs-GmbH\nGesellschaft mit beschränkter Haftung\nNufringen\n\nDas Gericht beabsichtigt, die Gesellschaft wegen Vermögenslosigkeit im Handelsregister von Amts wegen nach § 394 FamFG zu löschen. Die Frist zur Geltendmachung eines Widerspruchs gegen die beabsichtigte Löschung ist auf zwei Monate ab Veröffentlichung bestimmt."
    },
    {
      "date": "2024-11-21",
      "original_text": "Einreichung neuer Dokumente\nBaden-Württemberg Amtsgericht Ulm HRB 48\nKreisbaugesellschaft mbH Alb-Donau – Ehingen Donau",
      "type": "Einreichung neuer Dokumente",
      "state": "Baden-Württemberg",
      "amtsgericht": "Amtsgericht Ulm",
      "registernummer": "HRB 48",
      "registerart": "HRB",
      "company_name": "Kreisbaugesellschaft mbH Alb-Donau",
      "company_seat": "Ehingen Donau",
      "details": "21.11.2024 (Bekanntmachungsdatum)\n\nBaden-Württemberg Amtsgericht Ulm HRB 48\nEinreichung neuer Dokumente\n\nKreisbaugesellschaft mbH Alb-Donau\nGesellschaft mit beschränkter Haftung\nEhingen Donau\n\nDie Gesellschaft hat am 20.11.2024 die Liste über die Zusammensetzung des Aufsichtsrats zum Handelsregister eingereicht."
    },
    {
      "date": "2024-11-21",
      "original_text": "Löschungsankündigung\nSaarland Amtsgericht Saarbrücken HRB 105941\nLB CORPORATE UG (haftungsbeschränkt) – Saarbrücken",
      "type": "Löschungsankündigung",
      "state": "Saarland",
      "amtsgericht": "Amtsgericht Saarbrücken",
      "registernummer": "HRB 105941",
      "registerart": "HRB",
      "company_name": "LB CORPORATE UG (haftungsbeschränkt)",
      "company_seat": "Saarbrücken",
      "details": "21.11.2024 (Bekanntmachungsdatum)\n\nSaarland Amtsgericht Saarbrücken HRB 105941\nLöschungsankündigung\n\nLB CORPORATE UG (haftungsbeschränkt)\nGesellschaft mit beschränkter Haftung\nSaarbrücken\n\nEs ist beabsichtigt, die Gesellschaft von Amts wegen gemäß § 394 FamFG wegen Vermögenslosigkeit zu löschen.\nGegen die Löschung von Amts wegen ist das Rechtsmittel des Widerspruchs statthaft. Der Widerspruch ist binnen einer Frist zwei Monaten beginnend mit dem Tag dieser Veröffentlichung durch Einreichen eines Widerspruchsschreibens -schriftlich oder zur Niederschrift der Geschäftsstelle beim Amtsgericht Saarbrücken, -zentrales Handelsregister-, Mainzerstr.178, 66121 Saarbrücken einzulegen.\nDer Widerspruch muss die Bezeichnung der angefochtenen Löschungsankündigung enthalten sowie die Erklärung, dass Widerspruch eingelegt wird. Er ist vom Widerspruchsführer oder seinem Bevollmächtigten zu unterzeichnen.\nDas Widerspruchsschreiben kann auch in der Form eines elektronischen Dokumentes eingereicht werden, das mit einer qualifizierten elektronischen Signatur nach dem Signaturgesetz versehen sein muss (§§ 14 Abs. 2 FamFG, 130a, 298 ZPO)."
    },
    {
      "date": "2024-11-21",
      "original_text": "Registerbekanntmachung nach dem Umwandlungsgesetz\nNordrhein-Westfalen Amtsgericht Duisburg HRB 23468\nLBOffice Software GmbH – Oberhausen",
      "type": "Registerbekanntmachung nach dem Umwandlungsgesetz",
      "state": "Nordrhein-Westfalen",
      "amtsgericht": "Amtsgericht Duisburg",
      "registernummer": "HRB 23468",
      "registerart": "HRB",
      "company_name": "LBOffice Software GmbH",
      "company_seat": "Oberhausen",
      "details": "21.11.2024 (Bekanntmachungsdatum)\n\nNordrhein-Westfalen Amtsgericht Duisburg HRB 23468\nRegisterbekanntmachung nach dem Umwandlungsgesetz 21.11.2024 (Eintragungsdatum)\n\nLBOffice Software GmbH\nGesellschaft mit beschränkter Haftung\nOberhausen\n\nDie Gesellschaft hat Gläubigern, deren Forderungen vor dieser Bekanntmachung begründet worden sind, Sicherheit zu leisten, soweit sie nicht Befriedigung verlangen können, wenn sie sich binnen sechs Monaten zu diesem Zweck melden."
    },
    {
      "date": "2024-11-21",
      "original_text": "Registerbekanntmachung nach dem Umwandlungsgesetz\nBrandenburg Amtsgericht Potsdam HRB 36525\nLakeview Invest GmbH – Kleinmachnow",
      "type": "Registerbekanntmachung nach dem Umwandlungsgesetz",
      "state": "Brandenburg",
      "amtsgericht": "Amtsgericht Potsdam",
      "registernummer": "HRB 36525",
      "registerart": "HRB",
      "company_name": "Lakeview Invest GmbH",
      "company_seat": "Kleinmachnow",
      "details": "21.11.2024 (Bekanntmachungsdatum)\n\nBrandenburg Amtsgericht Potsdam HRB 36525\nRegisterbekanntmachung nach dem Umwandlungsgesetz 20.11.2024 (Eintragungsdatum)\n\nLakeview Invest GmbH\nGesellschaft mit beschränkter Haftung\nKleinmachnow\n\nZu Eintragungsnummer 7 vom 20.11.2024 wird als nicht eingetragen veröffentlicht:\nDen Gläubigern der an der Verschmelzung beteiligten Rechtsträger ist, wenn sie binnen sechs Monaten nach dem Tag, an dem die Eintragung der Verschmelzung in das Register des Sitzes desjenigen Rechtsträgers, dessen Gläubiger sie sind, als bekannt gemacht gilt, ihren Anspruch nach Grund und Höhe schriftlich anmelden, Sicherheit zu leisten, soweit sie nicht Befriedigung verlangen können. Dieses Recht steht den Gläubigern jedoch nur zu, wenn sie glaubhaft machen, dass durch die Verschmelzung die Erfüllung ihrer Forderung gefährdet wird"
    },
    {
      "date": "2024-11-21",
      "original_text": "Registerbekanntmachung nach dem Umwandlungsgesetz\nHamburg Amtsgericht Hamburg HRA 131426\nLea Schilling Aga.Pie e. K. – Hamburg",
      "type": "Registerbekanntmachung nach dem Umwandlungsgesetz",
      "state": "Hamburg",
      "amtsgericht": "Amtsgericht Hamburg",
      "registernummer": "HRA 131426",
      "registerart": "HRA",
      "company_name": "Lea Schilling Aga.Pie e. K.",
      "company_seat": "Hamburg",
      "details": "21.11.2024 (Bekanntmachungsdatum)\n\nHamburg Amtsgericht Hamburg HRA 131426\nRegisterbekanntmachung nach dem Umwandlungsgesetz 21.11.2024 (Eintragungsdatum)\n\nLea Schilling Aga.Pie e. K.\nEinzelkaufmann\nHamburg\n\nAls nicht eingetragen wird bekannt gemacht:\nDen Gläubigern der an der Ausgliederung beteiligten Gesellschaften ist, wenn sie binnen sechs Monaten nach dem Tag, an dem die Eintragung der Ausgliederung in das Register des Sitzes desjenigen Rechtsträgers, dessen Gläubiger sie sind, nach § 19 Absatz 3 UmwG als bekannt gemacht gilt, ihren Anspruch nach Grund und Höhe schriftlich anmelden, Sicherheit zu leisten, soweit sie nicht Befriedigung verlangen können. Dieses Recht steht den Gläubigern jedoch nur zu, wenn sie glaubhaft machen, dass durch die Ausgliederung die Erfüllung ihrer Forderung gefährdet wird."
    },
    {
      "date": "2024-11-21",
      "original_text": "Registerbekanntmachung nach dem Umwandlungsgesetz\nNordrhein-Westfalen Amtsgericht Duisburg HRB 12033\nLenord, Bauer & Co. GmbH – Oberhausen",
      "type": "Registerbekanntmachung nach dem Umwandlungsgesetz",
      "state": "Nordrhein-Westfalen",
      "amtsgericht": "Amtsgericht Duisburg",
      "registernummer": "HRB 12033",
      "registerart": "HRB",
      "company_name": "Lenord, Bauer & Co. GmbH",
      "company_seat": "Oberhausen",
      "details": "21.11.2024 (Bekanntmachungsdatum)\n\nNordrhein-Westfalen Amtsgericht Duisburg HRB 12033\nRegisterbekanntmachung nach dem Umwandlungsgesetz 21.11.2024 (Eintragungsdatum)\n\nLenord, Bauer & Co. GmbH\nGesellschaft mit beschränkter Haftung\nOberhausen\n\nDie Gesellschaft hat Gläubigern, deren Forderungen vor dieser Bekanntmachung begründet worden sind, Sicherheit zu leisten, soweit sie nicht Befriedigung verlangen können, wenn sie sich binnen sechs Monaten zu diesem Zweck melden."
    },
    {
      "date": "2024-11-21",
      "original_text": "Registerbekanntmachung nach dem Umwandlungsgesetz\nBayern Amtsgericht Fürth HRB 15604\nLeonidas XIX Verwaltungs GmbH – Kalchreuth",
      "type": "Registerbekanntmachung nach dem Umwandlungsgesetz",
      "state": "Bayern",
      "amtsgericht": "Amtsgericht Fürth",
      "registernummer": "HRB 15604",
      "registerart": "HRB",
      "company_name": "Leonidas XIX Verwaltungs GmbH",
      "company_seat": "Kalchreuth",
      "details": "21.11.2024 (Bekanntmachungsdatum)\n\nBayern Amtsgericht Fürth HRB 15604\nRegisterbekanntmachung nach dem Umwandlungsgesetz 20.11.2024 (Eintragungsdatum)\n\nLeonidas XIX Verwaltungs GmbH\nGesellschaft mit beschränkter Haftung\nKalchreuth\n\nDen Gläubigern der an der Verschmelzung beteiligten Rechtsträger ist, wenn sie binnen sechs Monaten nach dem Tag, an dem die Eintragung der Verschmelzung in das Register des Sitzes desjenigen Rechtsträgers, dessen Gläubiger sie sind, nach § 19 Abs. 3 UmwG als bekannt gemacht gilt, ihren Anspruch nach Grund und Höhe schriftlich anmelden, Sicherheit zu leisten, soweit sie nicht Befriedigung verlangen können. Dieses Recht steht den Gläubigern jedoch nur zu, wenn sie glaubhaft machen, dass durch die Verschmelzung die Erfüllung ihrer Forderung gefährdet wird."
    },
    {
      "date": "2024-11-21",
      "original_text": "Löschungsankündigung\nHessen Amtsgericht Frankfurt am Main HRB 104345\nM&S Personaldienstleistung GmbH – Frankfurt am Main",
      "type": "Löschungsankündigung",
      "state": "Hessen",
      "amtsgericht": "Amtsgericht Frankfurt am Main",
      "registernummer": "HRB 104345",
      "registerart": "HRB",
      "company_name": "M&S Personaldienstleistung GmbH",
      "company_seat": "Frankfurt am Main",
      "details": "21.11.2024 (Bekanntmachungsdatum)\n\nHessen Amtsgericht Frankfurt am Main HRB 104345\nLöschungsankündigung\n\nM&S Personaldienstleistung GmbH\nGesellschaft mit beschränkter Haftung\nFrankfurt am Main\n\nEs ist beabsichtigt, die Gesellschaft wegen Vermögenslosigkeit gemäß § 394 FamFG von Amts wegen im Handelsregister zu löschen. Hiergegen kann innerhalb eines Monats nach dieser Veröffentlichung Widerspruch bei dem Amtsgericht Frankfurt am Main eingelegt werden."
    },
    {
      "date": "2024-11-21",
      "original_text": "Löschungsankündigung\nNordrhein-Westfalen Amtsgericht Dortmund HRB 34254\nMAS Concept GmbH – Dortmund",
      "type": "Löschungsankündigung",
      "state": "Nordrhein-Westfalen",
      "amtsgericht": "Amtsgericht Dortmund",
      "registernummer": "HRB 34254",
      "registerart": "HRB",
      "company_name": "MAS Concept GmbH",
      "company_seat": "Dortmund",
      "details": "21.11.2024 (Bekanntmachungsdatum)\n\nNordrhein-Westfalen Amtsgericht Dortmund HRB 34254\nLöschungsankündigung\n\nMAS Concept GmbH\nGesellschaft mit beschränkter Haftung\nDortmund\n\nDas Registergericht beabsichtigt die Gesellschaft von Amts wegen nach § 394 FamFG zu löschen. Die Frist zur Erhebung eines Widerspruchs ist auf zwei Monate festgesetzt."
    },
    {
      "date": "2024-11-21",
      "original_text": "Registerbekanntmachung nach dem Umwandlungsgesetz\nBayern Amtsgericht Würzburg HRB 17619\nMG Immobilien GmbH – Kitzingen",
      "type": "Registerbekanntmachung nach dem Umwandlungsgesetz",
      "state": "Bayern",
      "amtsgericht": "Amtsgericht Würzburg",
      "registernummer": "HRB 17619",
      "registerart": "HRB",
      "company_name": "MG Immobilien GmbH",
      "company_seat": "Kitzingen",
      "details": "21.11.2024 (Bekanntmachungsdatum)\n\nBayern Amtsgericht Würzburg HRB 17619\nRegisterbekanntmachung nach dem Umwandlungsgesetz 20.11.2024 (Eintragungsdatum)\n\nMG Immobilien GmbH\nGesellschaft mit beschränkter Haftung\nKitzingen\n\nDen Gläubigern des formwechselnden Rechtsträgers ist, wenn sie binnen sechs Monaten nach dem Tag, an dem die Eintragung des Formwechsels nach § 201 UmwG als bekannt gemacht gilt, ihren Anspruch nach Grund und Höhe schriftlich anmelden, Sicherheit zu leisten, soweit sie nicht Befriedigung verlangen können. Dieses Recht steht den Gläubigern jedoch nur zu, wenn sie glaubhaft machen, dass durch den Formwechsel die Erfüllung ihrer Forderung gefährdet wird."
    },
    {
      "date": "2024-11-21",
      "original_text": "Registerbekanntmachung nach dem Umwandlungsgesetz\nBayern Amtsgericht Würzburg HRA 8863\nMG Immobilien GmbH & Co. OHG – Kitzingen",
      "type": "Registerbekanntmachung nach dem Umwandlungsgesetz",
      "state": "Bayern",
      "amtsgericht": "Amtsgericht Würzburg",
      "registernummer": "HRA 8863",
      "registerart": "HRA",
      "company_name": "MG Immobilien GmbH & Co. OHG",
      "company_seat": "Kitzingen",
      "details": "21.11.2024 (Bekanntmachungsdatum)\n\nBayern Amtsgericht Würzburg HRA 8863\nRegisterbekanntmachung nach dem Umwandlungsgesetz 20.11.2024 (Eintragungsdatum)\n\nMG Immobilien GmbH & Co. OHG\nOffene Handelsgesellschaft\nKitzingen\n\nDen Gläubigern des formwechselnden Rechtsträgers ist, wenn sie binnen sechs Monaten nach dem Tag, an dem die Eintragung des Formwechsels nach § 201 UmwG als bekannt gemacht gilt, ihren Anspruch nach Grund und Höhe schriftlich anmelden, Sicherheit zu leisten, soweit sie nicht Befriedigung verlangen können. Dieses Recht steht den Gläubigern jedoch nur zu, wenn sie glaubhaft machen, dass durch den Formwechsel die Erfüllung ihrer Forderung gefährdet wird."
    },
    {
      "date": "2024-11-21",
      "original_text": "Registerbekanntmachung nach dem Umwandlungsgesetz\nNordrhein-Westfalen Amtsgericht Duisburg HRB 38024\nMK Tradings GmbH – Mülheim an der Ruhr",
      "type": "Registerbekanntmachung nach dem Umwandlungsgesetz",
      "state": "Nordrhein-Westfalen",
      "amtsgericht": "Amtsgericht Duisburg",
      "registernummer": "HRB 38024",
      "registerart": "HRB",
      "company_name": "MK Tradings GmbH",
      "company_seat": "Mülheim an der Ruhr",
      "details": "21.11.2024 (Bekanntmachungsdatum)\n\nNordrhein-Westfalen Amtsgericht Duisburg HRB 38024\nRegisterbekanntmachung nach dem Umwandlungsgesetz 21.11.2024 (Eintragungsdatum)\n\nMK Tradings GmbH\nGesellschaft mit beschränkter Haftung\nMülheim an der Ruhr\n\nDie Gesellschaft hat Gläubigern, deren Forderungen vor dieser Bekanntmachung begründet worden sind, Sicherheit zu leisten, soweit sie nicht Befriedigung verlangen können, wenn sie sich binnen sechs Monaten zu diesem Zweck melden."
    },
    {
      "date": "2024-11-21",
      "original_text": "Registerbekanntmachung nach dem Umwandlungsgesetz\nBaden-Württemberg Amtsgericht Stuttgart HRB 22998\nMRH Trowe Stuttgart AG – Stuttgart",
      "type": "Registerbekanntmachung nach dem Umwandlungsgesetz",
      "state": "Baden-Württemberg",
      "amtsgericht": "Amtsgericht Stuttgart",
      "registernummer": "HRB 22998",
      "registerart": "HRB",
      "company_name": "MRH Trowe Stuttgart AG",
      "company_seat": "Stuttgart",
      "details": "21.11.2024 (Bekanntmachungsdatum)\n\nBaden-Württemberg Amtsgericht Stuttgart HRB 22998\nRegisterbekanntmachung nach dem Umwandlungsgesetz 21.11.2024 (Eintragungsdatum)\n\nMRH Trowe Stuttgart AG\nAktiengesellschaft\nStuttgart\n\nAls nicht eingetragen wird bekanntgemacht:\nDen Gläubigern des an dem Formwechsel beteiligten Rechtsträgers ist, wenn sie binnen sechs Monaten nach dem Tag, an dem die Eintragung des Formwechsels in das Register des Sitzes desjenigen Rechtsträgers, dessen Gläubiger sie sind, nach § 19 Abs. 3 UmwG als bekanntgemacht gilt, ihren Anspruch nach Grund und Höhe schriftlich anmelden, Sicherheit zu leisten, soweit sie nicht Befriedigung verlangen können. Dieses Recht steht den Gläubigern jedoch nur zu, wenn sie glaubhaft machen, dass durch den Formwechsel die Erfüllung ihrer Forderung gefährdet wird."
    },
    {
      "date": "2024-11-21",
      "original_text": "Registerbekanntmachung nach dem Umwandlungsgesetz\nBaden-Württemberg Amtsgericht Stuttgart HRB 797178\nMRH Trowe Stuttgart GmbH – Stuttgart",
      "type": "Registerbekanntmachung nach dem Umwandlungsgesetz",
      "state": "Baden-Württemberg",
      "amtsgericht": "Amtsgericht Stuttgart",
      "registernummer": "HRB 797178",
      "registerart": "HRB",
      "company_name": "MRH Trowe Stuttgart GmbH",
      "company_seat": "Stuttgart",
      "details": "21.11.2024 (Bekanntmachungsdatum)\n\nBaden-Württemberg Amtsgericht Stuttgart HRB 797178\nRegisterbekanntmachung nach dem Umwandlungsgesetz 21.11.2024 (Eintragungsdatum)\n\nMRH Trowe Stuttgart GmbH\nGesellschaft mit beschränkter Haftung\nStuttgart\n\nAls nicht eingetragen wird bekanntgemacht:\nDen Gläubigern des an dem Formwechsel beteiligten Rechtsträgers ist, wenn sie binnen sechs Monaten nach dem Tag, an dem die Eintragung des Formwechsels in das Register des Sitzes desjenigen Rechtsträgers, dessen Gläubiger sie sind, nach § 19 Abs. 3 UmwG als bekanntgemacht gilt, ihren Anspruch nach Grund und Höhe schriftlich anmelden, Sicherheit zu leisten, soweit sie nicht Befriedigung verlangen können. Dieses Recht steht den Gläubigern jedoch nur zu, wenn sie glaubhaft machen, dass durch den Formwechsel die Erfüllung ihrer Forderung gefährdet wird."
    },
    {
      "date": "2024-11-21",
      "original_text": "Registerbekanntmachung nach dem Umwandlungsgesetz\nNordrhein-Westfalen Amtsgericht Duisburg HRA 13517\nMarco Kuroczik Online-Handel e.K – Mülheim an der Ruhr",
      "type": "Registerbekanntmachung nach dem Umwandlungsgesetz",
      "state": "Nordrhein-Westfalen",
      "amtsgericht": "Amtsgericht Duisburg",
      "registernummer": "HRA 13517",
      "registerart": "HRA",
      "company_name": "Marco Kuroczik Online-Handel e.K",
      "company_seat": "Mülheim an der Ruhr",
      "details": "21.11.2024 (Bekanntmachungsdatum)\n\nNordrhein-Westfalen Amtsgericht Duisburg HRA 13517\nRegisterbekanntmachung nach dem Umwandlungsgesetz 21.11.2024 (Eintragungsdatum)\n\nMarco Kuroczik Online-Handel e.K\nEinzelkaufmann / Einzelkauffrau\nMülheim an der Ruhr\n\nDie Gesellschaft hat Gläubigern, deren Forderungen vor dieser Bekanntmachung begründet worden sind, Sicherheit zu leisten, soweit sie nicht Befriedigung verlangen können, wenn sie sich binnen sechs Monaten zu diesem Zweck melden."
    },
    {
      "date": "2024-11-21",
      "original_text": "Registerbekanntmachung nach dem Umwandlungsgesetz\nRheinland-Pfalz Amtsgericht Bad Kreuznach HRB 4384\nMarco Susenburger GmbH – Kisselbach",
      "type": "Registerbekanntmachung nach dem Umwandlungsgesetz",
      "state": "Rheinland-Pfalz",
      "amtsgericht": "Amtsgericht Bad Kreuznach",
      "registernummer": "HRB 4384",
      "registerart": "HRB",
      "company_name": "Marco Susenburger GmbH",
      "company_seat": "Kisselbach",
      "details": "21.11.2024 (Bekanntmachungsdatum)\n\nRheinland-Pfalz Amtsgericht Bad Kreuznach HRB 4384\nRegisterbekanntmachung nach dem Umwandlungsgesetz 21.11.2024 (Eintragungsdatum)\n\nMarco Susenburger GmbH\nGesellschaft mit beschränkter Haftung\nKisselbach\n\nAls nicht eingetragen wird veröffentlicht: Den Gläubigern der an der Verschmelzung beteiligten Rechtsträger ist, wenn sie binnen sechs Monaten nach dem Tag, an dem die Eintragung der Verschmelzung in das Register des Sitzes desjenigen Rechtsträgers, dessen Gläubiger sie sind, nach § 19 Abs. 3 UmwG als bekannt gemacht gilt, ihren Anspruch nach Grund und Höhe schriftlich anmelden, Sicherheit zu leisten, soweit sie nicht Befriedigung verlangen können. Dieses Recht steht den Gläubigern jedoch nur zu, wenn sie glaubhaft machen, dass durch die Verschmelzung die Erfüllung der Forderung gefährdet wird."
    },
    {
      "date": "2024-11-21",
      "original_text": "Registerbekanntmachung nach dem Umwandlungsgesetz\nHamburg Amtsgericht Hamburg HRB 166731\nMartin Schön Beteiligungen GmbH – Hamburg",
      "type": "Registerbekanntmachung nach dem Umwandlungsgesetz",
      "state": "Hamburg",
      "amtsgericht": "Amtsgericht Hamburg",
      "registernummer": "HRB 166731",
      "registerart": "HRB",
      "company_name": "Martin Schön Beteiligungen GmbH",
      "company_seat": "Hamburg",
      "details": "21.11.2024 (Bekanntmachungsdatum)\n\nHamburg Amtsgericht Hamburg HRB 166731\nRegisterbekanntmachung nach dem Umwandlungsgesetz 21.11.2024 (Eintragungsdatum)\n\nMartin Schön Beteiligungen GmbH\nGesellschaft mit beschränkter Haftung\nHamburg\n\nAls nicht eingetragen wird bekannt gemacht:\nDen Gläubigern der an der Verschmelzung beteiligten Gesellschaften ist, wenn sie binnen sechs Monaten nach dem Tag, an dem die Eintragung der Verschmelzung in das Register des Sitzes desjenigen Rechtsträgers, dessen Gläubiger sie sind, nach § 19 Absatz 3 UmwG als bekannt gemacht gilt, ihren Anspruch nach Grund und Höhe schriftlich anmelden, Sicherheit zu leisten, soweit sie nicht Befriedigung verlangen können. Dieses Recht steht den Gläubigern jedoch nur zu, wenn sie glaubhaft machen, dass durch die Verschmelzung die Erfüllung ihrer Forderung gefährdet wird."
    },
    {
      "date": "2024-11-21",
      "original_text": "Registerbekanntmachung nach dem Umwandlungsgesetz\nHamburg Amtsgericht Hamburg HRB 166731\nMartin Schön Beteiligungen GmbH – Hamburg",
      "type": "Registerbekanntmachung nach dem Umwandlungsgesetz",
      "state": "Hamburg",
      "amtsgericht": "Amtsgericht Hamburg",
      "registernummer": "HRB 166731",
      "registerart": "HRB",
      "company_name": "Martin Schön Beteiligungen GmbH",
      "company_seat": "Hamburg",
      "details": "21.11.2024 (Bekanntmachungsdatum)\n\nHamburg Amtsgericht Hamburg HRB 166731\nRegisterbekanntmachung nach dem Umwandlungsgesetz 21.11.2024 (Eintragungsdatum)\n\nMartin Schön Beteiligungen GmbH\nGesellschaft mit beschränkter Haftung\nHamburg\n\nAls nicht eingetragen wird bekannt gemacht:\nDen Gläubigern der an der Verschmelzung beteiligten Gesellschaften ist, wenn sie binnen sechs Monaten nach dem Tag, an dem die Eintragung der Verschmelzung in das Register des Sitzes desjenigen Rechtsträgers, dessen Gläubiger sie sind, nach § 19 Absatz 3 UmwG als bekannt gemacht gilt, ihren Anspruch nach Grund und Höhe schriftlich anmelden, Sicherheit zu leisten, soweit sie nicht Befriedigung verlangen können. Dieses Recht steht den Gläubigern jedoch nur zu, wenn sie glaubhaft machen, dass durch die Verschmelzung die Erfüllung ihrer Forderung gefährdet wird."
    },
    {
      "date": "2024-11-21",
      "original_text": "Registerbekanntmachung nach dem Umwandlungsgesetz\nNordrhein-Westfalen Amtsgericht Köln HRB 116848\nMarusya Capital GmbH – Köln",
      "type": "Registerbekanntmachung nach dem Umwandlungsgesetz",
      "state": "Nordrhein-Westfalen",
      "amtsgericht": "Amtsgericht Köln",
      "registernummer": "HRB 116848",
      "registerart": "HRB",
      "company_name": "Marusya Capital GmbH",
      "company_seat": "Köln",
      "details": "21.11.2024 (Bekanntmachungsdatum)\n\nNordrhein-Westfalen Amtsgericht Köln HRB 116848\nRegisterbekanntmachung nach dem Umwandlungsgesetz 21.11.2024 (Eintragungsdatum)\n\nMarusya Capital GmbH\nGesellschaft mit beschränkter Haftung\nKöln\n\nDen Gläubigern der an der Verschmelzung beteiligten Rechtsträger ist, wenn sie binnen sechs Monaten nach dem Tag, an dem die Eintragung der Verschmelzung in das Register des Sitzes desjenigen Rechtsträgers, dessen Gläubiger sie sind, nach § 19 Absatz 3 UmwG als bekanntgemacht gilt, ihren Anspruch nach Grund und Höhe schriftlich anmelden, Sicherheit zu leisten, soweit sie nicht Befriedigung verlangen können. Dieses Recht steht den Gläubigern jedoch nur zu, wenn sie glaubhaft machen, dass durch die Verschmelzung die Erfüllung ihrer Forderung gefährdet wird."
    },
    {
      "date": "2024-11-21",
      "original_text": "Registerbekanntmachung nach dem Umwandlungsgesetz\nMecklenburg-Vorpommern Amtsgericht Stralsund HRB 7357\nMedical Service Greifswald GmbH – Greifswald",
      "type": "Registerbekanntmachung nach dem Umwandlungsgesetz",
      "state": "Mecklenburg-Vorpommern",
      "amtsgericht": "Amtsgericht Stralsund",
      "registernummer": "HRB 7357",
      "registerart": "HRB",
      "company_name": "Medical Service Greifswald GmbH",
      "company_seat": "Greifswald",
      "details": "21.11.2024 (Bekanntmachungsdatum)\n\nMecklenburg-Vorpommern Amtsgericht Stralsund HRB 7357\nRegisterbekanntmachung nach dem Umwandlungsgesetz 21.11.2024 (Eintragungsdatum)\n\nMedical Service Greifswald GmbH\nGesellschaft mit beschränkter Haftung\nGreifswald\n\nAls nicht eingetragen wird veröffentlicht: Den Gläubigern der an der Verschmelzung beteiligten Rechtsträger ist, wenn sie binnen sechs Monaten nach dem Tag, an dem die Eintragung der Verschmelzung in das Register des Sitzes desjenigen Rechtsträgers, dessen Gläubiger sie sind, nach § 19 Abs. 3 UmwG als bekannt gemacht gilt,\nihren Anspruch nach Grund und Höhe schriftlich anmelden, Sicherheit zu leisten, soweit sie nicht Befriedigung verlangen können. Dieses Recht steht den Gläubigern jedoch nur zu, wenn sie glaubhaft machen, dass durch die Verschmelzung die Erfüllung der Forderung gefährdet wird."
    },
    {
      "date": "2024-11-21",
      "original_text": "Registerbekanntmachung nach dem Umwandlungsgesetz\nRheinland-Pfalz Amtsgericht Ludwigshafen a.Rhein (Ludwigshafen) HRB 69842\nMedien Union Grundbesitz Pfalz GmbH – Ludwigshafen",
      "type": "Registerbekanntmachung nach dem Umwandlungsgesetz",
      "state": "Rheinland-Pfalz",
      "amtsgericht": "Amtsgericht Ludwigshafen a.Rhein (Ludwigshafen)",
      "registernummer": "HRB 69842",
      "registerart": "HRB",
      "company_name": "Medien Union Grundbesitz Pfalz GmbH",
      "company_seat": "Ludwigshafen",
      "details": "21.11.2024 (Bekanntmachungsdatum)\n\nRheinland-Pfalz Amtsgericht Ludwigshafen a.Rhein (Ludwigshafen) HRB 69842\nRegisterbekanntmachung nach dem Umwandlungsgesetz 21.11.2024 (Eintragungsdatum)\n\nMedien Union Grundbesitz Pfalz GmbH\nGesellschaft mit beschränkter Haftung\nLudwigshafen\n\nGläubigern des bisherigen Rechtsträgers ist unter den Voraussetzungen der §§ 204, 22 UmwG Sicherheit zu leisten."
    },
    {
      "date": "2024-11-21",
      "original_text": "Registerbekanntmachung nach dem Umwandlungsgesetz\nRheinland-Pfalz Amtsgericht Ludwigshafen a.Rhein (Ludwigshafen) HRA 61556\nMedien Union Grundbesitz Pfalz GmbH & Co. KG – Ludwigshafen am Rhein",
      "type": "Registerbekanntmachung nach dem Umwandlungsgesetz",
      "state": "Rheinland-Pfalz",
      "amtsgericht": "Amtsgericht Ludwigshafen a.Rhein (Ludwigshafen)",
      "registernummer": "HRA 61556",
      "registerart": "HRA",
      "company_name": "Medien Union Grundbesitz Pfalz GmbH & Co. KG",
      "company_seat": "Ludwigshafen am Rhein",
      "details": "21.11.2024 (Bekanntmachungsdatum)\n\nRheinland-Pfalz Amtsgericht Ludwigshafen a.Rhein (Ludwigshafen) HRA 61556\nRegisterbekanntmachung nach dem Umwandlungsgesetz 21.11.2024 (Eintragungsdatum)\n\nMedien Union Grundbesitz Pfalz GmbH & Co. KG\nKommanditgesellschaft\nLudwigshafen am Rhein\n\nDen Gläubigern des formwechselnden Rechtsträgers ist, wenn sie binnen sechs Monaten nach dem Tag, an dem die Eintragung des Formwechsels nach § 201 UmwG als bekannt gemacht gilt, ihren Anspruch nach Grund und Höhe schriftlich anmelden, Sicherheit zu leisten, soweit sie nicht Befriedigung verlangen können. Dieses Recht steht den Gläubigern jedoch nur zu, wenn sie glaubhaft machen, dass durch den Formwechsel die Erfüllung der Forderung gefährdet wird."
    },
    {
      "date": "2024-11-21",
      "original_text": "Registerbekanntmachung nach dem Umwandlungsgesetz\nSchleswig-Holstein Amtsgericht Kiel HRB 22794\nMercato Eckernförde GmbH – Eckernförde",
      "type": "Registerbekanntmachung nach dem Umwandlungsgesetz",
      "state": "Schleswig-Holstein",
      "amtsgericht": "Amtsgericht Kiel",
      "registernummer": "HRB 22794",
      "registerart": "HRB",
      "company_name": "Mercato Eckernförde GmbH",
      "company_seat": "Eckernförde",
      "details": "21.11.2024 (Bekanntmachungsdatum)\n\nSchleswig-Holstein Amtsgericht Kiel HRB 22794\nRegisterbekanntmachung nach dem Umwandlungsgesetz 20.11.2024 (Eintragungsdatum)\n\nMercato Eckernförde GmbH\nGesellschaft mit beschränkter Haftung\nEckernförde\n\nZu Eintragungsnummer 5 vom 20.11.2024 wird als nicht eingetragen veröffentlicht: Als nicht eingetragen wird veröffentlicht: Den Gläubigern der an der Spaltung beteiligten Rechtsträger ist, wenn sie binnen sechs Monaten nach dem Tag, an dem die Eintragung der Spaltung in das Register des Sitzes desjenigen Rechtsträgers, dessen Gläubiger sie sind,  bekannt gemacht worden ist, ihren Anspruch nach Grund und Höhe schriftlich anmelden, Sicherheit zu leisten, soweit sie nicht Befriedigung verlangen können. Dieses Recht steht den Gläubigern jedoch nur zu, wenn sie glaubhaft machen, dass durch die Spaltung die Erfüllung ihrer Forderung gefährdet wird."
    },
    {
      "date": "2024-11-21",
      "original_text": "Registerbekanntmachung nach dem Umwandlungsgesetz\nSchleswig-Holstein Amtsgericht Kiel HRB 22794\nMercato Eckernförde GmbH – Eckernförde",
      "type": "Registerbekanntmachung nach dem Umwandlungsgesetz",
      "state": "Schleswig-Holstein",
      "amtsgericht": "Amtsgericht Kiel",
      "registernummer": "HRB 22794",
      "registerart": "HRB",
      "company_name": "Mercato Eckernförde GmbH",
      "company_seat": "Eckernförde",
      "details": "21.11.2024 (Bekanntmachungsdatum)\n\nSchleswig-Holstein Amtsgericht Kiel HRB 22794\nRegisterbekanntmachung nach dem Umwandlungsgesetz 20.11.2024 (Eintragungsdatum)\n\nMercato Eckernförde GmbH\nGesellschaft mit beschränkter Haftung\nEckernförde\n\nZu Eintragungsnummer 4 vom 20.11.2024 wird als nicht eingetragen veröffentlicht: Als nicht eingetragen wird veröffentlicht: Den Gläubigern der an der Verschmelzung beteiligten Rechtsträger ist, wenn sie binnen sechs Monaten nach dem Tag, an dem die Eintragung der Verschmelzung in das Register des Sitzes desjenigen Rechtsträgers, dessen Gläubiger sie sind, nach § 19 Abs. 3 UmwG bekannt gemacht worden ist, ihren Anspruch nach Grund und Höhe schriftlich anmelden, Sicherheit zu leisten, soweit sie nicht Befriedigung verlangen können. Dieses Recht steht den Gläubigern jedoch nur zu, wenn sie glaubhaft machen, dass durch die Verschmelzung die Erfüllung ihrer Forderung gefährdet wird."
    },
    {
      "date": "2024-11-21",
      "original_text": "Registerbekanntmachung nach dem Umwandlungsgesetz\nNiedersachsen Amtsgericht Hannover HRB 227816\nMeyer Menü H GmbH – Hannover",
      "type": "Registerbekanntmachung nach dem Umwandlungsgesetz",
      "state": "Niedersachsen",
      "amtsgericht": "Amtsgericht Hannover",
      "registernummer": "HRB 227816",
      "registerart": "HRB",
      "company_name": "Meyer Menü H GmbH",
      "company_seat": "Hannover",
      "details": "21.11.2024 (Bekanntmachungsdatum)\n\nNiedersachsen Amtsgericht Hannover HRB 227816\nRegisterbekanntmachung nach dem Umwandlungsgesetz 21.11.2024 (Eintragungsdatum)\n\nMeyer Menü H GmbH\nGesellschaft mit beschränkter Haftung\nHannover\n\nDen Gläubigern der an der Verschmelzung beteiligten Rechtsträger ist, wenn sie binnen sechs Monaten nach dem Tag, an dem die Eintragung der Verschmelzung in das Register des Sitzes desjenigen Rechtsträgers, dessen Gläubiger sie sind, nach § 19  Abs.  3 UmwG als bekannt gemacht gilt, ihren Anspruch nach Grund und Höhe schriftlich anmelden, Sicherheit zu leisten, soweit sie nicht Befriedigung verlangen können. Dieses Recht steht den Gläubigern jedoch nur zu, wenn sie glaubhaft machen, dass durch die Verschmelzung die Erfüllung der Forderung gefährdet wird."
    },
    {
      "date": "2024-11-21",
      "original_text": "Registerbekanntmachung nach dem Umwandlungsgesetz\nNiedersachsen Amtsgericht Hannover HRB 201157\nMeyer Menü Hannover Verwaltungs-GmbH – Hannover",
      "type": "Registerbekanntmachung nach dem Umwandlungsgesetz",
      "state": "Niedersachsen",
      "amtsgericht": "Amtsgericht Hannover",
      "registernummer": "HRB 201157",
      "registerart": "HRB",
      "company_name": "Meyer Menü Hannover Verwaltungs-GmbH",
      "company_seat": "Hannover",
      "details": "21.11.2024 (Bekanntmachungsdatum)\n\nNiedersachsen Amtsgericht Hannover HRB 201157\nRegisterbekanntmachung nach dem Umwandlungsgesetz 21.11.2024 (Eintragungsdatum)\n\nMeyer Menü Hannover Verwaltungs-GmbH\nGesellschaft mit beschränkter Haftung\nHannover\n\nDen Gläubigern der an der Verschmelzung beteiligten Rechtsträger ist, wenn sie binnen sechs Monaten nach dem Tag, an dem die Eintragung der Verschmelzung in das Register des Sitzes desjenigen Rechtsträgers, dessen Gläubiger sie sind, nach § 19  Abs.  3 UmwG als bekannt gemacht gilt, ihren Anspruch nach Grund und Höhe schriftlich anmelden, Sicherheit zu leisten, soweit sie nicht Befriedigung verlangen können. Dieses Recht steht den Gläubigern jedoch nur zu, wenn sie glaubhaft machen, dass durch die Verschmelzung die Erfüllung der Forderung gefährdet wird."
    },
    {
      "date": "2024-11-21",
      "original_text": "Registerbekanntmachung nach dem Umwandlungsgesetz\nBayern Amtsgericht München HRB 283042\nMorphoSys AG – München",
      "type": "Registerbekanntmachung nach dem Umwandlungsgesetz",
      "state": "Bayern",
      "amtsgericht": "Amtsgericht München",
      "registernummer": "HRB 283042",
      "registerart": "HRB",
      "company_name": "MorphoSys AG",
      "company_seat": "München",
      "details": "21.11.2024 (Bekanntmachungsdatum)\n\nBayern Amtsgericht München HRB 283042\nRegisterbekanntmachung nach dem Umwandlungsgesetz 20.11.2024 (Eintragungsdatum)\n\nMorphoSys AG\nAktiengesellschaft\nMünchen\n\nDen Gläubigern des formwechselnden Rechtsträgers ist, wenn sie binnen sechs Monaten nach dem Tag, an dem die Eintragung des Formwechsels nach § 201 UmwG als bekannt gemacht gilt, ihren Anspruch nach Grund und Höhe schriftlich anmelden, Sicherheit zu leisten, soweit sie nicht Befriedigung verlangen können. Dieses Recht steht den Gläubigern jedoch nur zu, wenn sie glaubhaft machen, dass durch den Formwechsel die Erfüllung ihrer Forderung gefährdet wird."
    },
    {
      "date": "2024-11-21",
      "original_text": "Löschungsankündigung\nHessen Amtsgericht Frankfurt am Main HRB 130376\nNIK CARGO GmbH – Frankfurt am Main",
      "type": "Löschungsankündigung",
      "state": "Hessen",
      "amtsgericht": "Amtsgericht Frankfurt am Main",
      "registernummer": "HRB 130376",
      "registerart": "HRB",
      "company_name": "NIK CARGO GmbH",
      "company_seat": "Frankfurt am Main",
      "details": "21.11.2024 (Bekanntmachungsdatum)\n\nHessen Amtsgericht Frankfurt am Main HRB 130376\nLöschungsankündigung 21.11.2024 (Eintragungsdatum)\n\nNIK CARGO GmbH\nGesellschaft mit beschränkter Haftung\nFrankfurt am Main\n\nDas Registergericht beabsichtigt die im Handelsregister eingetragene Gesellschaft von Amts wegen nach § 394 FamFG zu löschen. Die Frist zur Erhebung eines Widerspruchs gegen die beabsichtigte Löschung wird auf 1 Monat festgesetzt."
    },
    {
      "date": "2024-11-21",
      "original_text": "Löschungsankündigung\nNordrhein-Westfalen Amtsgericht Bochum HRB 17649\nNNA-UG (haftungsbeschränkt) – Herne",
      "type": "Löschungsankündigung",
      "state": "Nordrhein-Westfalen",
      "amtsgericht": "Amtsgericht Bochum",
      "registernummer": "HRB 17649",
      "registerart": "HRB",
      "company_name": "NNA-UG (haftungsbeschränkt)",
      "company_seat": "Herne",
      "details": "21.11.2024 (Bekanntmachungsdatum)\n\nNordrhein-Westfalen Amtsgericht Bochum HRB 17649\nLöschungsankündigung\n\nNNA-UG (haftungsbeschränkt)\nGesellschaft mit beschränkter Haftung\nHerne\n\nDas Registergericht beabsichtigt die Gesellschaft von Amts wegen nach § 394 FamFG zu löschen. Die Frist zur Erhebung eines Widerspruchs ist auf drei Monate festgesetzt."
    },
    {
      "date": "2024-11-21",
      "original_text": "Löschungsankündigung\nBrandenburg Amtsgericht Potsdam HRB 205\nNOWAWESER Fachgroßhandel GmbH Heizung, Sanitär, Klimatechnik, Elektrotechnik – Potsdam",
      "type": "Löschungsankündigung",
      "state": "Brandenburg",
      "amtsgericht": "Amtsgericht Potsdam",
      "registernummer": "HRB 205",
      "registerart": "HRB",
      "company_name": "NOWAWESER Fachgroßhandel GmbH Heizung, Sanitär, Klimatechnik, Elektrotechnik",
      "company_seat": "Potsdam",
      "details": "21.11.2024 (Bekanntmachungsdatum)\n\nBrandenburg Amtsgericht Potsdam HRB 205\nLöschungsankündigung\n\nNOWAWESER Fachgroßhandel GmbH Heizung, Sanitär, Klimatechnik, Elektrotechnik\nGesellschaft mit beschränkter Haftung\nPotsdam\n\nBei der nachstehenden Gesellschaft wird das Amtslöschungsverfahren gemäß § 394 FamFG eingeleitet. Widerspruchsfrist: 8 Wochen."
    },
    {
      "date": "2024-11-21",
      "original_text": "Löschungsankündigung\nNordrhein-Westfalen Amtsgericht Kleve HRB 13318\nNRW infra GmbH – Emmerich am Rhein",
      "type": "Löschungsankündigung",
      "state": "Nordrhein-Westfalen",
      "amtsgericht": "Amtsgericht Kleve",
      "registernummer": "HRB 13318",
      "registerart": "HRB",
      "company_name": "NRW infra GmbH",
      "company_seat": "Emmerich am Rhein",
      "details": "21.11.2024 (Bekanntmachungsdatum)\n\nNordrhein-Westfalen Amtsgericht Kleve HRB 13318\nLöschungsankündigung\n\nNRW infra GmbH\nGesellschaft mit beschränkter Haftung\nEmmerich am Rhein\n\nDas Registergericht beabsichtigt die Gesellschaft von Amts wegen nach § 394 FamFG zu löschen. Die Frist zur Erhebung eines Widerspruchs ist auf einen Monat festgesetzt."
    },
    {
      "date": "2024-11-21",
      "original_text": "Registerbekanntmachung nach dem Umwandlungsgesetz\nBaden-Württemberg Amtsgericht Stuttgart HRB 797181\nNetze Calw GmbH – Calw",
      "type": "Registerbekanntmachung nach dem Umwandlungsgesetz",
      "state": "Baden-Württemberg",
      "amtsgericht": "Amtsgericht Stuttgart",
      "registernummer": "HRB 797181",
      "registerart": "HRB",
      "company_name": "Netze Calw GmbH",
      "company_seat": "Calw",
      "details": "21.11.2024 (Bekanntmachungsdatum)\n\nBaden-Württemberg Amtsgericht Stuttgart HRB 797181\nRegisterbekanntmachung nach dem Umwandlungsgesetz 21.11.2024 (Eintragungsdatum)\n\nNetze Calw GmbH\nGesellschaft mit beschränkter Haftung\nCalw\n\nAls nicht eingetragen wird bekanntgemacht:\nDen Gläubigern der an der Ausgliederung beteiligten Rechtsträger ist, wenn sie binnen sechs Monaten nach dem Tag, an dem die Eintragung der Ausgliederung in das Register des Sitzes desjenigen Rechtsträgers, dessen Gläubiger sie sind, nach § 19 Abs. 3 UmwG als bekanntgemacht gilt, ihren Anspruch nach Grund und Höhe schriftlich anmelden, Sicherheit zu leisten, soweit sie nicht Befriedigung verlangen können. Dieses Recht steht den Gläubigern jedoch nur zu, wenn sie glaubhaft machen, dass durch die Ausgliederung die Erfüllung ihrer Forderung gefährdet wird."
    },
    {
      "date": "2024-11-21",
      "original_text": "Registerbekanntmachung nach dem Umwandlungsgesetz\nBayern Amtsgericht Nürnberg HRB 42861\nNeumann Versicherungsmakler GmbH – Nürnberg",
      "type": "Registerbekanntmachung nach dem Umwandlungsgesetz",
      "state": "Bayern",
      "amtsgericht": "Amtsgericht Nürnberg",
      "registernummer": "HRB 42861",
      "registerart": "HRB",
      "company_name": "Neumann Versicherungsmakler GmbH",
      "company_seat": "Nürnberg",
      "details": "21.11.2024 (Bekanntmachungsdatum)\n\nBayern Amtsgericht Nürnberg HRB 42861\nRegisterbekanntmachung nach dem Umwandlungsgesetz 20.11.2024 (Eintragungsdatum)\n\nNeumann Versicherungsmakler GmbH\nGesellschaft mit beschränkter Haftung\nNürnberg\n\nDen Gläubigern der an der Verschmelzung beteiligten Rechtsträger ist, wenn sie binnen sechs Monaten nach dem Tag, an dem die Eintragung der Verschmelzung in das Register des Sitzes desjenigen Rechtsträgers, dessen Gläubiger sie sind, nach § 19 Abs. 3 UmwG als bekannt gemacht gilt, ihren Anspruch nach Grund und Höhe schriftlich anmelden, Sicherheit zu leisten, soweit sie nicht Befriedigung verlangen können. Dieses Recht steht den Gläubigern jedoch nur zu, wenn sie glaubhaft machen, dass durch die Verschmelzung die Erfüllung ihrer Forderung gefährdet wird."
    },
    {
      "date": "2024-11-21",
      "original_text": "Registerbekanntmachung nach dem Umwandlungsgesetz\nBayern Amtsgericht Augsburg HRB 33068\nObjekt DC 142 Planungs-UG (haftungsbeschränkt) – Augsburg",
      "type": "Registerbekanntmachung nach dem Umwandlungsgesetz",
      "state": "Bayern",
      "amtsgericht": "Amtsgericht Augsburg",
      "registernummer": "HRB 33068",
      "registerart": "HRB",
      "company_name": "Objekt DC 142 Planungs-UG (haftungsbeschränkt)",
      "company_seat": "Augsburg",
      "details": "21.11.2024 (Bekanntmachungsdatum)\n\nBayern Amtsgericht Augsburg HRB 33068\nRegisterbekanntmachung nach dem Umwandlungsgesetz 20.11.2024 (Eintragungsdatum)\n\nObjekt DC 142 Planungs-UG (haftungsbeschränkt)\nGesellschaft mit beschränkter Haftung\nAugsburg\n\nDen Gläubigern der an der Verschmelzung beteiligten Rechtsträger ist, wenn sie binnen sechs Monaten nach dem Tag, an dem die Eintragung der Verschmelzung in das Register des Sitzes desjenigen Rechtsträgers, dessen Gläubiger sie sind, nach § 19 Abs. 3 UmwG als bekannt gemacht gilt, ihren Anspruch nach Grund und Höhe schriftlich anmelden, Sicherheit zu leisten, soweit sie nicht Befriedigung verlangen können. Dieses Recht steht den Gläubigern jedoch nur zu, wenn sie glaubhaft machen, dass durch die Verschmelzung die Erfüllung ihrer Forderung gefährdet wird."
    },
    {
      "date": "2024-11-21",
      "original_text": "Sonstige Registerbekanntmachung\nSachsen Amtsgericht Leipzig HRB 27109\nOschatzer Verwaltungsgesellschaft mbH – Oschatz",
      "type": "Sonstige Registerbekanntmachung",
      "state": "Sachsen",
      "amtsgericht": "Amtsgericht Leipzig",
      "registernummer": "HRB 27109",
      "registerart": "HRB",
      "company_name": "Oschatzer Verwaltungsgesellschaft mbH",
      "company_seat": "Oschatz",
      "details": "21.11.2024 (Bekanntmachungsdatum)\n\nSachsen Amtsgericht Leipzig HRB 27109\nSonstige Registerbekanntmachung\n\nOschatzer Verwaltungsgesellschaft mbH\nGesellschaft mit beschränkter Haftung\nOschatz\n\nAm 06.11.2024 wurde beim Handelsregister des Amtsgerichts Leipzig die Liste der Mitglieder des Aufsichtsrats gemäß § 52 GmbHG eingereicht."
    },
    {
      "date": "2024-11-21",
      "original_text": "Löschungsankündigung\nBaden-Württemberg Amtsgericht Stuttgart HRB 3869\nPARAT Werkzeugmaschinen GmbH – Ditzingen",
      "type": "Löschungsankündigung",
      "state": "Baden-Württemberg",
      "amtsgericht": "Amtsgericht Stuttgart",
      "registernummer": "HRB 3869",
      "registerart": "HRB",
      "company_name": "PARAT Werkzeugmaschinen GmbH",
      "company_seat": "Ditzingen",
      "details": "21.11.2024 (Bekanntmachungsdatum)\n\nBaden-Württemberg Amtsgericht Stuttgart HRB 3869\nLöschungsankündigung\n\nPARAT Werkzeugmaschinen GmbH\nGesellschaft mit beschränkter Haftung\nDitzingen\n\nDas Gericht beabsichtigt, die Gesellschaft wegen Vermögenslosigkeit im Handelsregister von Amts wegen nach § 394 FamFG zu löschen. Die Frist zur Geltendmachung eines Widerspruchs gegen die beabsichtigte Löschung ist auf zwei Monate ab Veröffentlichung bestimmt."
    },
    {
      "date": "2024-11-21",
      "original_text": "Einreichung neuer Dokumente\nRheinland-Pfalz Amtsgericht Kaiserslautern HRB 31786\nPFAFF-Areal-Entwicklungsgesellschaft mbH Kaiserslautern – Kaiserslautern",
      "type": "Einreichung neuer Dokumente",
      "state": "Rheinland-Pfalz",
      "amtsgericht": "Amtsgericht Kaiserslautern",
      "registernummer": "HRB 31786",
      "registerart": "HRB",
      "company_name": "PFAFF-Areal-Entwicklungsgesellschaft mbH Kaiserslautern",
      "company_seat": "Kaiserslautern",
      "details": "21.11.2024 (Bekanntmachungsdatum)\n\nRheinland-Pfalz Amtsgericht Kaiserslautern HRB 31786\nEinreichung neuer Dokumente\n\nPFAFF-Areal-Entwicklungsgesellschaft mbH Kaiserslautern\nGesellschaft mit beschränkter Haftung\nKaiserslautern\n\nDem Registergericht ist eine neue Liste der Mitglieder des Aufsichtsrates eingereicht worden."
    },
    {
      "date": "2024-11-21",
      "original_text": "Registerbekanntmachung nach dem Umwandlungsgesetz\nMecklenburg-Vorpommern Amtsgericht Stralsund HRB 6097\nPersonalservice Gesundheitswesen GmbH – Greifswald",
      "type": "Registerbekanntmachung nach dem Umwandlungsgesetz",
      "state": "Mecklenburg-Vorpommern",
      "amtsgericht": "Amtsgericht Stralsund",
      "registernummer": "HRB 6097",
      "registerart": "HRB",
      "company_name": "Personalservice Gesundheitswesen GmbH",
      "company_seat": "Greifswald",
      "details": "21.11.2024 (Bekanntmachungsdatum)\n\nMecklenburg-Vorpommern Amtsgericht Stralsund HRB 6097\nRegisterbekanntmachung nach dem Umwandlungsgesetz 21.11.2024 (Eintragungsdatum)\n\nPersonalservice Gesundheitswesen GmbH\nGesellschaft mit beschränkter Haftung\nGreifswald\n\nAls nicht eingetragen wird veröffentlicht: Den Gläubigern der an der Verschmelzung beteiligten Rechtsträger ist, wenn sie binnen sechs Monaten nach dem Tag, an dem die Eintragung der Verschmelzung in das Register des Sitzes desjenigen Rechtsträgers, dessen Gläubiger sie sind, nach § 19 Abs. 3 UmwG als bekannt gemacht gilt,\nihren Anspruch nach Grund und Höhe schriftlich anmelden, Sicherheit zu leisten, soweit sie nicht Befriedigung verlangen können. Dieses Recht steht den Gläubigern jedoch nur zu, wenn sie glaubhaft machen, dass durch die Verschmelzung die Erfüllung der Forderung gefährdet wird."
    },
    {
      "date": "2024-11-21",
      "original_text": "Registerbekanntmachung nach dem Umwandlungsgesetz\nBrandenburg Amtsgericht Potsdam HRB 37773\nPlanetary Transportation Systems GmbH – Kleinmachnow",
      "type": "Registerbekanntmachung nach dem Umwandlungsgesetz",
      "state": "Brandenburg",
      "amtsgericht": "Amtsgericht Potsdam",
      "registernummer": "HRB 37773",
      "registerart": "HRB",
      "company_name": "Planetary Transportation Systems GmbH",
      "company_seat": "Kleinmachnow",
      "details": "21.11.2024 (Bekanntmachungsdatum)\n\nBrandenburg Amtsgericht Potsdam HRB 37773\nRegisterbekanntmachung nach dem Umwandlungsgesetz 20.11.2024 (Eintragungsdatum)\n\nPlanetary Transportation Systems GmbH\nGesellschaft mit beschränkter Haftung\nKleinmachnow\n\nZu Eintragungsnummer 5 vom 20.11.2024 wird als nicht eingetragen veröffentlicht:\nDen Gläubigern der an der Verschmelzung beteiligten Rechtsträger ist, wenn sie binnen sechs Monaten nach dem Tag, an dem die Eintragung der Verschmelzung in das Register des Sitzes desjenigen Rechtsträgers, dessen Gläubiger sie sind, als bekannt gemacht gilt, ihren Anspruch nach Grund und Höhe schriftlich anmelden, Sicherheit zu leisten, soweit sie nicht Befriedigung verlangen können. Dieses Recht steht den Gläubigern jedoch nur zu, wenn sie glaubhaft machen, dass durch die Verschmelzung die Erfüllung ihrer Forderung gefährdet wird."
    },
    {
      "date": "2024-11-21",
      "original_text": "Registerbekanntmachung nach dem Umwandlungsgesetz\nHessen Amtsgericht Darmstadt HRB 100292\nPontegadea Logistics Germany GmbH – Bensheim",
      "type": "Registerbekanntmachung nach dem Umwandlungsgesetz",
      "state": "Hessen",
      "amtsgericht": "Amtsgericht Darmstadt",
      "registernummer": "HRB 100292",
      "registerart": "HRB",
      "company_name": "Pontegadea Logistics Germany GmbH",
      "company_seat": "Bensheim",
      "details": "21.11.2024 (Bekanntmachungsdatum)\n\nHessen Amtsgericht Darmstadt HRB 100292\nRegisterbekanntmachung nach dem Umwandlungsgesetz\n\nPontegadea Logistics Germany GmbH\nGesellschaft mit beschränkter Haftung\nBensheim\n\nDie Gesellschaft hat am 18.11.2024 den Entwurf des Formwechselplans eingereicht. Die formwechselnde Gesellschaft hat die Rechtsform einer Gesellschaft mit beschränkter Haftung nach deutschem Recht. Die Firma lautet Pontegadea Logistics Germany GmbH. Ihr Sitz befindet sich in Bensheim. Durch den Formwechsel soll die Gesellschaft die Rechtsform einer société à responsabilité limitée (S.à.r.l.) nach dem Recht des Großherzogtums Luxemburg erlangen. Die formwechselnde Gesellschaft ist beim Handelsregister des Amtsgerichts Darmstadt unter HRB 100292 eingetragen. Nach dem Formwechsel wird die Gesellschaft in das Handels- und Firmenregister des Großherzogtums Luxemburt (Registre de Commerce et des Societées) eingetragen werden. Gesellschafter der formwechselnden Gesellschaft und Gläubiger der formwechselnden Gesellschaft können der formwechselnden Gesellschaft bis spätestend fünf Arbeitstage vor dem Tag der Gesellschafterversammlung, die über die Zustimmung zum Formwechselplan beschließen soll, unter der nachstehenden Anschrift Bemerkungen zum Formwechselplan übermitteln:\n\nPontegadea Logistics Germany GmbH\n\nWestendstraße 38\n\n60325 Frankfurt am Main\n\nDie Gesellschafterversammlung, die über die Zustimmung zum Formwechselplan beschließen soll, soll am 03.01.2025 stattfinden.\nDa die Gesellschaft keine Arbeitnehmer beschäftigt und keine Betriebsräte bestehen, können diese Personen keine Bemerkungen zum Formwechselplan übermitteln."
    },
    {
      "date": "2024-11-21",
      "original_text": "Sonstige Registerbekanntmachung\nSachsen Amtsgericht Leipzig HRB 16377\nPorsche Leipzig GmbH – Leipzig",
      "type": "Sonstige Registerbekanntmachung",
      "state": "Sachsen",
      "amtsgericht": "Amtsgericht Leipzig",
      "registernummer": "HRB 16377",
      "registerart": "HRB",
      "company_name": "Porsche Leipzig GmbH",
      "company_seat": "Leipzig",
      "details": "21.11.2024 (Bekanntmachungsdatum)\n\nSachsen Amtsgericht Leipzig HRB 16377\nSonstige Registerbekanntmachung\n\nPorsche Leipzig GmbH\nGesellschaft mit beschränkter Haftung\nLeipzig\n\nAm 21.11.2024 wurde beim Handelsregister des Amtsgerichts Leipzig die Liste der Mitglieder des Aufsichtsrats gemäß § 52 GmbHG eingereicht."
    },
    {
      "date": "2024-11-21",
      "original_text": "Einreichung neuer Dokumente\nNordrhein-Westfalen Amtsgericht Essen HRB 22242\nProContent gAG – Essen",
      "type": "Einreichung neuer Dokumente",
      "state": "Nordrhein-Westfalen",
      "amtsgericht": "Amtsgericht Essen",
      "registernummer": "HRB 22242",
      "registerart": "HRB",
      "company_name": "ProContent gAG",
      "company_seat": "Essen",
      "details": "21.11.2024 (Bekanntmachungsdatum)\n\nNordrhein-Westfalen Amtsgericht Essen HRB 22242\nEinreichung neuer Dokumente\n\nProContent gAG\nAktiengesellschaft\nEssen\n\nAls nicht eingetragen wird bekannt gemacht: Dem Registergericht liegt ein neues Hauptversammlungsprotokoll vor."
    },
    {
      "date": "2024-11-21",
      "original_text": "Registerbekanntmachung nach dem Umwandlungsgesetz\nBayern Amtsgericht Würzburg HRB 17479\nProducts AcquiCo GmbH – Würzburg",
      "type": "Registerbekanntmachung nach dem Umwandlungsgesetz",
      "state": "Bayern",
      "amtsgericht": "Amtsgericht Würzburg",
      "registernummer": "HRB 17479",
      "registerart": "HRB",
      "company_name": "Products AcquiCo GmbH",
      "company_seat": "Würzburg",
      "details": "21.11.2024 (Bekanntmachungsdatum)\n\nBayern Amtsgericht Würzburg HRB 17479\nRegisterbekanntmachung nach dem Umwandlungsgesetz 20.11.2024 (Eintragungsdatum)\n\nProducts AcquiCo GmbH\nGesellschaft mit beschränkter Haftung\nWürzburg\n\nDen Gläubigern der an der Spaltung beteiligten Rechtsträger ist, wenn sie binnen sechs Monaten nach dem Tag, an dem die Eintragung der Spaltung in das Register des Sitzes desjenigen Rechtsträgers, dessen Gläubiger sie sind, nach §§ 125, 19 Abs. 3 UmwG als bekannt gemacht gilt, ihren Anspruch nach Grund und Höhe schriftlich anmelden, Sicherheit zu leisten, soweit sie nicht Befriedigung verlangen können. Dieses Recht steht den Gläubigern jedoch nur zu, wenn sie glaubhaft machen, dass durch die Spaltung die Erfüllung ihrer Forderung gefährdet wird."
    },
    {
      "date": "2024-11-21",
      "original_text": "Löschungsankündigung\nNiedersachsen Amtsgericht Braunschweig HRA 201580\nRandomPortals LTD & Co. KG – Helmstedt",
      "type": "Löschungsankündigung",
      "state": "Niedersachsen",
      "amtsgericht": "Amtsgericht Braunschweig",
      "registernummer": "HRA 201580",
      "registerart": "HRA",
      "company_name": "RandomPortals LTD & Co. KG",
      "company_seat": "Helmstedt",
      "details": "21.11.2024 (Bekanntmachungsdatum)\n\nNiedersachsen Amtsgericht Braunschweig HRA 201580\nLöschungsankündigung\n\nRandomPortals LTD & Co. KG\nKommanditgesellschaft\nHelmstedt\n\nDas Registergericht beabsichtigt, die Firma von Amts wegen nach § 394 Absatz 4  FamFG zu löschen. Die Frist zur Erhebung eines Widerspruchs ist auf 1 Monat ab dieser Registerbekanntmachung festgesetzt."
    },
    {
      "date": "2024-11-21",
      "original_text": "Sonstige Registerbekanntmachung\nBayern Amtsgericht München HRB 258042\nRazor Group Acquisition XII UG (haftungsbeschränkt) – München",
      "type": "Sonstige Registerbekanntmachung",
      "state": "Bayern",
      "amtsgericht": "Amtsgericht München",
      "registernummer": "HRB 258042",
      "registerart": "HRB",
      "company_name": "Razor Group Acquisition XII UG (haftungsbeschränkt)",
      "company_seat": "München",
      "details": "21.11.2024 (Bekanntmachungsdatum)\n\nBayern Amtsgericht München HRB 258042\nSonstige Registerbekanntmachung 20.11.2024 (Eintragungsdatum)\n\nRazor Group Acquisition XII UG (haftungsbeschränkt)\nGesellschaft mit beschränkter Haftung\nMünchen\n\nDen Gläubigern der Gesellschaft, deren Forderungen begründet worden sind, bevor die Eintragung der Beendigung des Beherrschungs- und Gewinnabführungsvertrages in das Handelsregister nach § 10 des Handelsgesetzbuches als bekanntgemacht gilt, hat der andere Vertragsteil Sicherheit zu leisten, wenn sie sich binnen sechs Monaten nach der Bekanntmachung der Eintragung zu diesem Zweck bei ihm melden."
    },
    {
      "date": "2024-11-21",
      "original_text": "Löschungsankündigung\nBaden-Württemberg Amtsgericht Mannheim HRB 733326\nRost Facility UG (haftungsbeschränkt) – Sinsheim",
      "type": "Löschungsankündigung",
      "state": "Baden-Württemberg",
      "amtsgericht": "Amtsgericht Mannheim",
      "registernummer": "HRB 733326",
      "registerart": "HRB",
      "company_name": "Rost Facility UG (haftungsbeschränkt)",
      "company_seat": "Sinsheim",
      "details": "21.11.2024 (Bekanntmachungsdatum)\n\nBaden-Württemberg Amtsgericht Mannheim HRB 733326\nLöschungsankündigung\n\nRost Facility UG (haftungsbeschränkt)\nGesellschaft mit beschränkter Haftung\nSinsheim\n\nDas Gericht beabsichtigt, die Gesellschaft wegen Vermögenslosigkeit im Handelsregister von Amts wegen nach § 394 FamFG zu löschen. Die Frist zur Geltendmachung eines Widerspruchs gegen die beabsichtigte Löschung ist auf einen Monat ab Veröffentlichung bestimmt."
    },
    {
      "date": "2024-11-21",
      "original_text": "Registerbekanntmachung nach dem Umwandlungsgesetz\nBayern Amtsgericht München HRA 120026\nRoswitha Holzer-Brack e.K. – München",
      "type": "Registerbekanntmachung nach dem Umwandlungsgesetz",
      "state": "Bayern",
      "amtsgericht": "Amtsgericht München",
      "registernummer": "HRA 120026",
      "registerart": "HRA",
      "company_name": "Roswitha Holzer-Brack e.K.",
      "company_seat": "München",
      "details": "21.11.2024 (Bekanntmachungsdatum)\n\nBayern Amtsgericht München HRA 120026\nRegisterbekanntmachung nach dem Umwandlungsgesetz 20.11.2024 (Eintragungsdatum)\n\nRoswitha Holzer-Brack e.K.\nEinzelkaufmann / Einzelkauffrau\nMünchen\n\nDen Gläubigern der an der Ausgliederung beteiligten Rechtsträger ist, wenn sie binnen sechs Monaten nach dem Tag, an dem die Eintragung der Ausgliederung in das Register des Sitzes desjenigen Rechtsträgers, dessen Gläubiger sie sind, nach §§ 125, 19 Abs. 3 UmwG als bekannt gemacht gilt, ihren Anspruch nach Grund und Höhe schriftlich anmelden, Sicherheit zu leisten, soweit sie nicht Befriedigung verlangen können. Dieses Recht steht den Gläubigern jedoch nur zu, wenn sie glaubhaft machen, dass durch die Ausgliederung die Erfüllung ihrer Forderung gefährdet wird."
    },
    {
      "date": "2024-11-21",
      "original_text": "Registerbekanntmachung nach dem Umwandlungsgesetz\nNiedersachsen Amtsgericht Oldenburg (Oldenburg) HRB 211057\nRuppiner Landferkel GmbH – Garrel",
      "type": "Registerbekanntmachung nach dem Umwandlungsgesetz",
      "state": "Niedersachsen",
      "amtsgericht": "Amtsgericht Oldenburg (Oldenburg)",
      "registernummer": "HRB 211057",
      "registerart": "HRB",
      "company_name": "Ruppiner Landferkel GmbH",
      "company_seat": "Garrel",
      "details": "21.11.2024 (Bekanntmachungsdatum)\n\nNiedersachsen Amtsgericht Oldenburg (Oldenburg) HRB 211057\nRegisterbekanntmachung nach dem Umwandlungsgesetz 21.11.2024 (Eintragungsdatum)\n\nRuppiner Landferkel GmbH\nGesellschaft mit beschränkter Haftung\nGarrel\n\nDen Gläubigern der an der Verschmelzung beteiligten Rechtsträger ist, wenn sie binnen sechs Monaten nach dem Tag, an dem die Eintragung der Verschmelzung in das Register des Sitzes desjenigen Rechtsträgers, dessen Gläubiger sie sind, nach § 19  Abs.  3 UmwG als bekannt gemacht gilt, ihren Anspruch nach Grund und Höhe schriftlich anmelden, Sicherheit zu leisten, soweit sie nicht Befriedigung verlangen können. Dieses Recht steht den Gläubigern jedoch nur zu, wenn sie glaubhaft machen, dass durch die Verschmelzung die Erfüllung der Forderung gefährdet wird."
    },
    {
      "date": "2024-11-21",
      "original_text": "Löschungsankündigung\nHessen Amtsgericht Limburg HRB 6980\nS.E.D. Project Bau GmbH – Brechen",
      "type": "Löschungsankündigung",
      "state": "Hessen",
      "amtsgericht": "Amtsgericht Limburg",
      "registernummer": "HRB 6980",
      "registerart": "HRB",
      "company_name": "S.E.D. Project Bau GmbH",
      "company_seat": "Brechen",
      "details": "21.11.2024 (Bekanntmachungsdatum)\n\nHessen Amtsgericht Limburg HRB 6980\nLöschungsankündigung\n\nS.E.D. Project Bau GmbH\nGesellschaft mit beschränkter Haftung\nBrechen\n\nDas Registergericht beabsichtigt die im Handelsregister eingetragene Gesellschaft von Amts wegen nach § 394 FamFG zu löschen. Die Frist zur Erhebung eines Widerspruchs gegen die beabsichtigte Löschung wird auf 1 Monat festgesetzt."
    },
    {
      "date": "2024-11-21",
      "original_text": "Registerbekanntmachung nach dem Umwandlungsgesetz\nBayern Amtsgericht Nürnberg HRB 42893\nSAXONIA Maklerservice GmbH – Nürnberg",
      "type": "Registerbekanntmachung nach dem Umwandlungsgesetz",
      "state": "Bayern",
      "amtsgericht": "Amtsgericht Nürnberg",
      "registernummer": "HRB 42893",
      "registerart": "HRB",
      "company_name": "SAXONIA Maklerservice GmbH",
      "company_seat": "Nürnberg",
      "details": "21.11.2024 (Bekanntmachungsdatum)\n\nBayern Amtsgericht Nürnberg HRB 42893\nRegisterbekanntmachung nach dem Umwandlungsgesetz 20.11.2024 (Eintragungsdatum)\n\nSAXONIA Maklerservice GmbH\nGesellschaft mit beschränkter Haftung\nNürnberg\n\nDen Gläubigern der an der Verschmelzung beteiligten Rechtsträger ist, wenn sie binnen sechs Monaten nach dem Tag, an dem die Eintragung der Verschmelzung in das Register des Sitzes desjenigen Rechtsträgers, dessen Gläubiger sie sind, nach § 19 Abs. 3 UmwG als bekannt gemacht gilt, ihren Anspruch nach Grund und Höhe schriftlich anmelden, Sicherheit zu leisten, soweit sie nicht Befriedigung verlangen können. Dieses Recht steht den Gläubigern jedoch nur zu, wenn sie glaubhaft machen, dass durch die Verschmelzung die Erfüllung ihrer Forderung gefährdet wird."
    },
    {
      "date": "2024-11-21",
      "original_text": "Sonstige Registerbekanntmachung\nHamburg Amtsgericht Hamburg HRB 144213\nSDA SE Open Industry Solutions – Hamburg",
      "type": "Sonstige Registerbekanntmachung",
      "state": "Hamburg",
      "amtsgericht": "Amtsgericht Hamburg",
      "registernummer": "HRB 144213",
      "registerart": "HRB",
      "company_name": "SDA SE Open Industry Solutions",
      "company_seat": "Hamburg",
      "details": "21.11.2024 (Bekanntmachungsdatum)\n\nHamburg Amtsgericht Hamburg HRB 144213\nSonstige Registerbekanntmachung 21.11.2024 (Eintragungsdatum)\n\nSDA SE Open Industry Solutions\nEuropäische Aktiengesellschaft (SE)\nHamburg\n\nAls nicht eingetragen wird bekannt gemacht: Liste des Aufsichtsrats wurde eingereicht."
    },
    {
      "date": "2024-11-21",
      "original_text": "Sonstige Registerbekanntmachung\nBayern Amtsgericht München HRB 103522\nSIMICON GmbH – München",
      "type": "Sonstige Registerbekanntmachung",
      "state": "Bayern",
      "amtsgericht": "Amtsgericht München",
      "registernummer": "HRB 103522",
      "registerart": "HRB",
      "company_name": "SIMICON GmbH",
      "company_seat": "München",
      "details": "21.11.2024 (Bekanntmachungsdatum)\n\nBayern Amtsgericht München HRB 103522\nSonstige Registerbekanntmachung 20.11.2024 (Eintragungsdatum)\n\nSIMICON GmbH\nGesellschaft mit beschränkter Haftung\nMünchen\n\nDen Gläubigern der Gesellschaft, deren Forderungen begründet worden sind, bevor die Eintragung der Beendigung des Beherrschungs- und Gewinnabführungsvertrages in das Handelsregister nach § 10 des Handelsgesetzbuches als bekanntgemacht gilt, hat der andere Vertragsteil Sicherheit zu leisten, wenn sie sich binnen sechs Monaten nach der Bekanntmachung der Eintragung zu diesem Zweck bei ihm melden."
    },
    {
      "date": "2024-11-21",
      "original_text": "Löschungsankündigung\nNiedersachsen Amtsgericht Osnabrück HRB 214243\nSKT Schüttorfer Kabel Tiefbau UG (haftungsbeschränkt) – Schüttorf",
      "type": "Löschungsankündigung",
      "state": "Niedersachsen",
      "amtsgericht": "Amtsgericht Osnabrück",
      "registernummer": "HRB 214243",
      "registerart": "HRB",
      "company_name": "SKT Schüttorfer Kabel Tiefbau UG (haftungsbeschränkt)",
      "company_seat": "Schüttorf",
      "details": "21.11.2024 (Bekanntmachungsdatum)\n\nNiedersachsen Amtsgericht Osnabrück HRB 214243\nLöschungsankündigung\n\nSKT Schüttorfer Kabel Tiefbau UG (haftungsbeschränkt)\nGesellschaft mit beschränkter Haftung\nSchüttorf\n\nDas Registergericht beabsichtigt, die Gesellschaft von Amts wegen nach § 394 FamFG wegen Vermögenslosigkeit zu löschen. Die Frist zur Erhebung eines Widerspruchs ist auf 1 Monat ab dieser Registerbekanntmachung festgesetzt."
    },
    {
      "date": "2024-11-21",
      "original_text": "Registerbekanntmachung nach dem Umwandlungsgesetz\nNiedersachsen Amtsgericht Osnabrück HRA 208817\nSchilder Husmann e. K. – Lingen (Ems)",
      "type": "Registerbekanntmachung nach dem Umwandlungsgesetz",
      "state": "Niedersachsen",
      "amtsgericht": "Amtsgericht Osnabrück",
      "registernummer": "HRA 208817",
      "registerart": "HRA",
      "company_name": "Schilder Husmann e. K.",
      "company_seat": "Lingen (Ems)",
      "details": "21.11.2024 (Bekanntmachungsdatum)\n\nNiedersachsen Amtsgericht Osnabrück HRA 208817\nRegisterbekanntmachung nach dem Umwandlungsgesetz 21.11.2024 (Eintragungsdatum)\n\nSchilder Husmann e. K.\nEinzelkaufmann / Einzelkauffrau\nLingen (Ems)\n\nDen Gläubigern der an der Ausgliederung beteiligten Rechtsträger ist, wenn sie binnen sechs Monaten nach dem Tag, an dem die Eintragung der Ausgliederung in das Register des Sitzes desjenigen Rechtsträgers, dessen Gläubiger sie sind, nach § 19 Abs. 3 UmwG als bekannt gemacht gilt, ihren Anspruch nach Grund und Höhe schriftlich anmelden, Sicherheit zu leisten, soweit sie nicht Befriedigung verlangen können. Dieses Recht steht den Gläubigern jedoch nur zu, wenn sie glaubhaft machen, dass durch die Ausgliederung die Erfüllung der Forderung gefährdet wird."
    },
    {
      "date": "2024-11-21",
      "original_text": "Registerbekanntmachung nach dem Umwandlungsgesetz\nNordrhein-Westfalen Amtsgericht Köln HRB 111109\nSchorn Immo Verwaltungs GmbH – Kerpen",
      "type": "Registerbekanntmachung nach dem Umwandlungsgesetz",
      "state": "Nordrhein-Westfalen",
      "amtsgericht": "Amtsgericht Köln",
      "registernummer": "HRB 111109",
      "registerart": "HRB",
      "company_name": "Schorn Immo Verwaltungs GmbH",
      "company_seat": "Kerpen",
      "details": "21.11.2024 (Bekanntmachungsdatum)\n\nNordrhein-Westfalen Amtsgericht Köln HRB 111109\nRegisterbekanntmachung nach dem Umwandlungsgesetz 21.11.2024 (Eintragungsdatum)\n\nSchorn Immo Verwaltungs GmbH\nGesellschaft mit beschränkter Haftung\nKerpen\n\nDen Gläubigern der an der Verschmelzung beteiligten Rechtsträger ist, wenn sie binnen sechs Monaten nach dem Tag, an dem die Eintragung der Verschmelzung in das Register des Sitzes derjenigen Rechtsträger deren Gläubiger sie sind, nach § 19 Absatz 3 UmwG als bekanntgemacht gilt, ihren Anspruch nach Grund und Höhe schriftlich anmelden, Sicherheit zu leisten, soweit sie nicht Befriedigung verlangen können. Dieses Recht steht den Gläubigern jedoch nur zu, wenn sie glaubhaft machen, dass durch die Verschmelzung die Erfüllung ihrer Forderung gefährdet wird."
    },
    {
      "date": "2024-11-21",
      "original_text": "Registerbekanntmachung nach dem Umwandlungsgesetz\nBaden-Württemberg Amtsgericht Freiburg HRB 729116\nSchweizer Kaffeemaschinen GmbH – Breisach am Rhein",
      "type": "Registerbekanntmachung nach dem Umwandlungsgesetz",
      "state": "Baden-Württemberg",
      "amtsgericht": "Amtsgericht Freiburg",
      "registernummer": "HRB 729116",
      "registerart": "HRB",
      "company_name": "Schweizer Kaffeemaschinen GmbH",
      "company_seat": "Breisach am Rhein",
      "details": "21.11.2024 (Bekanntmachungsdatum)\n\nBaden-Württemberg Amtsgericht Freiburg HRB 729116\nRegisterbekanntmachung nach dem Umwandlungsgesetz 21.11.2024 (Eintragungsdatum)\n\nSchweizer Kaffeemaschinen GmbH\nGesellschaft mit beschränkter Haftung\nBreisach am Rhein\n\nAls nicht eingetragen wird bekanntgemacht:\nDen Gläubigern der an der Verschmelzung beteiligten Rechtsträger ist, wenn sie binnen sechs Monaten nach dem Tag, an dem die Eintragung der Verschmelzung in das Register des Sitzes desjenigen Rechtsträgers, dessen Gläubiger sie sind, nach § 19 Abs. 3 UmwG als bekanntgemacht gilt, ihren Anspruch nach Grund und Höhe schriftlich anmelden, Sicherheit zu leisten, soweit sie nicht Befriedigung verlangen können. Dieses Recht steht den Gläubigern jedoch nur zu, wenn sie glaubhaft machen, dass durch die Verschmelzung die Erfüllung ihrer Forderung gefährdet wird."
    },
    {
      "date": "2024-11-21",
      "original_text": "Registerbekanntmachung nach dem Umwandlungsgesetz\nNordrhein-Westfalen Amtsgericht Coesfeld HRB 3356\nSenerTec Center Heek Gesellschaft mit beschränkter Haftung – Heek",
      "type": "Registerbekanntmachung nach dem Umwandlungsgesetz",
      "state": "Nordrhein-Westfalen",
      "amtsgericht": "Amtsgericht Coesfeld",
      "registernummer": "HRB 3356",
      "registerart": "HRB",
      "company_name": "SenerTec Center Heek Gesellschaft mit beschränkter Haftung",
      "company_seat": "Heek",
      "details": "21.11.2024 (Bekanntmachungsdatum)\n\nNordrhein-Westfalen Amtsgericht Coesfeld HRB 3356\nRegisterbekanntmachung nach dem Umwandlungsgesetz 21.11.2024 (Eintragungsdatum)\n\nSenerTec Center Heek Gesellschaft mit beschränkter Haftung\nGesellschaft mit beschränkter Haftung\nHeek\n\nDen Gläubigern der an der Verschmelzung beteiligten Rechtsträger ist, wenn sie binnen sechs Monaten nach dem Tag, an dem die Eintragung der Verschmelzung in das Register des Sitzes derjenigen Rechtsträger deren Gläubiger sie sind, nach § 19 Absatz 3 UmwG als bekanntgemacht gilt, ihren Anspruch nach Grund und Höhe schriftlich anmelden, Sicherheit zu leisten, soweit sie nicht Befriedigung verlangen können. Dieses Recht steht den Gläubigern jedoch nur zu, wenn sie glaubhaft machen, dass durch die Verschmelzung die Erfüllung ihrer Forderung gefährdet wird."
    },
    {
      "date": "2024-11-21",
      "original_text": "Registerbekanntmachung nach dem Umwandlungsgesetz\nHessen Amtsgericht Königstein HRB 8859\nService-Company-Dienstleistungen UG (haftungsbeschränkt) – Kelkheim (Taunus)",
      "type": "Registerbekanntmachung nach dem Umwandlungsgesetz",
      "state": "Hessen",
      "amtsgericht": "Amtsgericht Königstein",
      "registernummer": "HRB 8859",
      "registerart": "HRB",
      "company_name": "Service-Company-Dienstleistungen UG (haftungsbeschränkt)",
      "company_seat": "Kelkheim (Taunus)",
      "details": "21.11.2024 (Bekanntmachungsdatum)\n\nHessen Amtsgericht Königstein HRB 8859\nRegisterbekanntmachung nach dem Umwandlungsgesetz 21.11.2024 (Eintragungsdatum)\n\nService-Company-Dienstleistungen UG (haftungsbeschränkt)\nGesellschaft mit beschränkter Haftung\nKelkheim (Taunus)\n\nDen Gläubigern der an der Verschmelzung beteiligten Rechtsträger ist, wenn sie binnen sechs Monaten nach dem Tag, an dem die Eintragung der Verschmelzung in das Register des Sitzes desjenigen Rechtsträgers, dessen Gläubiger sie sind, nach § 19 Absatz 3 UmwG bekannt gemacht worden ist, ihren Anspruch nach Grund und Höhe schriftlich anmelden, Sicherheit zu leisten, soweit sie nicht Befriedigung verlangen können. Dieses Recht steht den Gläubigern jedoch nur zu, wenn sie glaubhaft machen, dass durch die Verschmelzung die Erfüllung ihrer Forderung gefährdet wird."
    },
    {
      "date": "2024-11-21",
      "original_text": "Registerbekanntmachung nach dem Umwandlungsgesetz\nHamburg Amtsgericht Hamburg HRB 166856\nSharkBytes GmbH – Hamburg",
      "type": "Registerbekanntmachung nach dem Umwandlungsgesetz",
      "state": "Hamburg",
      "amtsgericht": "Amtsgericht Hamburg",
      "registernummer": "HRB 166856",
      "registerart": "HRB",
      "company_name": "SharkBytes GmbH",
      "company_seat": "Hamburg",
      "details": "21.11.2024 (Bekanntmachungsdatum)\n\nHamburg Amtsgericht Hamburg HRB 166856\nRegisterbekanntmachung nach dem Umwandlungsgesetz 21.11.2024 (Eintragungsdatum)\n\nSharkBytes GmbH\nGesellschaft mit beschränkter Haftung\nHamburg\n\nAls nicht eingetragen wird bekannt gemacht:\nDen Gläubigern der an der Verschmelzung beteiligten Gesellschaften ist, wenn sie binnen sechs Monaten nach dem Tag, an dem die Eintragung der Verschmelzung in das Register des Sitzes desjenigen Rechtsträgers, dessen Gläubiger sie sind, nach § 19 Absatz 3 UmwG als bekannt gemacht gilt, ihren Anspruch nach Grund und Höhe schriftlich anmelden, Sicherheit zu leisten, soweit sie nicht Befriedigung verlangen können. Dieses Recht steht den Gläubigern jedoch nur zu, wenn sie glaubhaft machen, dass durch die Verschmelzung die Erfüllung ihrer Forderung gefährdet wird."
    },
    {
      "date": "2024-11-21",
      "original_text": "Löschungsankündigung\nBerlin Amtsgericht Berlin (Charlottenburg) HRB 174283\nShri Amarjeet Singh Ji UG (haftungsbeschränkt) – Berlin",
      "type": "Löschungsankündigung",
      "state": "Berlin",
      "amtsgericht": "Amtsgericht Berlin (Charlottenburg)",
      "registernummer": "HRB 174283",
      "registerart": "HRB",
      "company_name": "Shri Amarjeet Singh Ji UG (haftungsbeschränkt)",
      "company_seat": "Berlin",
      "details": "21.11.2024 (Bekanntmachungsdatum)\n\nBerlin Amtsgericht Berlin (Charlottenburg) HRB 174283\nLöschungsankündigung\n\nShri Amarjeet Singh Ji UG (haftungsbeschränkt)\nGesellschaft mit beschränkter Haftung\nBerlin\n\nBei der nachstehenden Gesellschaft wird das Amtslöschungsverfahren gemäß § 394 FamFG eingeleitet. Widerspruchsfrist 6 Wochen"
    },
    {
      "date": "2024-11-21",
      "original_text": "Registerbekanntmachung nach dem Umwandlungsgesetz\nHessen Amtsgericht Bad Homburg v.d.H. VR 723\nSportfreunde Friedrichsdorf 1974 e.V. – Friedrichsdorf",
      "type": "Registerbekanntmachung nach dem Umwandlungsgesetz",
      "state": "Hessen",
      "amtsgericht": "Amtsgericht Bad Homburg v.d.H.",
      "registernummer": "VR 723",
      "registerart": "VR",
      "company_name": "Sportfreunde Friedrichsdorf 1974 e.V.",
      "company_seat": "Friedrichsdorf",
      "details": "21.11.2024 (Bekanntmachungsdatum)\n\nHessen Amtsgericht Bad Homburg v.d.H. VR 723\nRegisterbekanntmachung nach dem Umwandlungsgesetz 21.11.2024 (Eintragungsdatum)\n\nSportfreunde Friedrichsdorf 1974 e.V.\neingetragener Verein\nFriedrichsdorf\n\nDen Gläubigern der an der Verschmelzung beteiligten Rechtsträger ist, wenn sie binnen sechs Monaten nach dem Tag, an dem die Eintragung der Verschmelzung in das Register des Sitzes derjenigen Rechtsträger deren Gläubiger sie sind, nach § 19 Absatz 3 UmwG bekannt gemacht worden ist, ihren Anspruch nach Grund und Höhe schriftlich anmelden, Sicherheit zu leisten, soweit sie nicht Befriedigung verlangen können. Dieses Recht steht den Gläubigern jedoch nur zu, wenn sie glaubhaft machen, dass durch die Verschmelzung die Erfüllung ihrer Forderung gefährdet wird."
    },
    {
      "date": "2024-11-21",
      "original_text": "Einreichung neuer Dokumente\nSaarland Amtsgericht Saarbrücken HRB 2964\nStadtwerke Homburg GmbH – Homburg",
      "type": "Einreichung neuer Dokumente",
      "state": "Saarland",
      "amtsgericht": "Amtsgericht Saarbrücken",
      "registernummer": "HRB 2964",
      "registerart": "HRB",
      "company_name": "Stadtwerke Homburg GmbH",
      "company_seat": "Homburg",
      "details": "21.11.2024 (Bekanntmachungsdatum)\n\nSaarland Amtsgericht Saarbrücken HRB 2964\nEinreichung neuer Dokumente\n\nStadtwerke Homburg GmbH\nGesellschaft mit beschränkter Haftung\nHomburg\n\nDie Geschäftsführung der Gesellschaft hat zwei Listen der Mitglieder des Aufsichtsrats zum Handelsregister eingereicht (§ 52 Abs. 3 Satz 2 GmbHG)."
    },
    {
      "date": "2024-11-21",
      "original_text": "Einreichung neuer Dokumente\nMecklenburg-Vorpommern Amtsgericht Neubrandenburg HRB 1168\nStadtwerke Waren GmbH – Waren",
      "type": "Einreichung neuer Dokumente",
      "state": "Mecklenburg-Vorpommern",
      "amtsgericht": "Amtsgericht Neubrandenburg",
      "registernummer": "HRB 1168",
      "registerart": "HRB",
      "company_name": "Stadtwerke Waren GmbH",
      "company_seat": "Waren",
      "details": "21.11.2024 (Bekanntmachungsdatum)\n\nMecklenburg-Vorpommern Amtsgericht Neubrandenburg HRB 1168\nEinreichung neuer Dokumente\n\nStadtwerke Waren GmbH\nGesellschaft mit beschränkter Haftung\nWaren\n\nEine Liste der Mitglieder des Aufsichtsrats ist zum Handelsregister eingereicht worden."
    },
    {
      "date": "2024-11-21",
      "original_text": "Registerbekanntmachung nach dem Umwandlungsgesetz\nBerlin Amtsgericht Berlin (Charlottenburg) HRA 63178\nStaycity Berlin GmbH & Co. KG – Berlin",
      "type": "Registerbekanntmachung nach dem Umwandlungsgesetz",
      "state": "Berlin",
      "amtsgericht": "Amtsgericht Berlin (Charlottenburg)",
      "registernummer": "HRA 63178",
      "registerart": "HRA",
      "company_name": "Staycity Berlin GmbH & Co. KG",
      "company_seat": "Berlin",
      "details": "21.11.2024 (Bekanntmachungsdatum)\n\nBerlin Amtsgericht Berlin (Charlottenburg) HRA 63178\nRegisterbekanntmachung nach dem Umwandlungsgesetz 20.11.2024 (Eintragungsdatum)\n\nStaycity Berlin GmbH & Co. KG\nKommanditgesellschaft\nBerlin\n\nZu Eintragungsnummer 3 vom 20.11.2024 wird als nicht eingetragen veröffentlicht: Den Gläubigern der an der Spaltung beteiligten Rechtsträger ist, wenn sie binnen sechs Monaten nach dem Tag, an dem die Eintragung der Spaltung in das Register des Sitzes desjenigen Rechtsträgers, dessen Gläubiger sie sind, als bekannt gemacht gilt, ihren Anspruch nach Grund und Höhe schriftlich anmelden, Sicherheit zu leisten, soweit sie nicht Befriedigung verlangen können. Dieses Recht steht den Gläubigern jedoch nur zu, wenn sie glaubhaft machen, dass durch die Spaltung die Erfüllung ihrer Forderung gefährdet wird. Das Recht, Sicherheitsleistung zu verlangen, steht Gläubigern nicht zu, die im Falle der Insolvenz ein Recht auf vorzugsweise Befriedigung aus einer Deckungsmasse haben, die nach gesetzlicher Vorschrift zu ihrem Schutz errichtet und staatlich überwacht ist."
    },
    {
      "date": "2024-11-21",
      "original_text": "Sonstige Registerbekanntmachung\nHessen Amtsgericht Frankfurt am Main HRB 74234\nSyna GmbH – Frankfurt am Main",
      "type": "Sonstige Registerbekanntmachung",
      "state": "Hessen",
      "amtsgericht": "Amtsgericht Frankfurt am Main",
      "registernummer": "HRB 74234",
      "registerart": "HRB",
      "company_name": "Syna GmbH",
      "company_seat": "Frankfurt am Main",
      "details": "21.11.2024 (Bekanntmachungsdatum)\n\nHessen Amtsgericht Frankfurt am Main HRB 74234\nSonstige Registerbekanntmachung\n\nSyna GmbH\nGesellschaft mit beschränkter Haftung\nFrankfurt am Main\n\nDurch eine Änderung in den Personen der Aufsichtsratsmitglieder ist eine Liste der Mitglieder des Aufsichtsrates zum Handelsregister eingereicht worden."
    },
    {
      "date": "2024-11-21",
      "original_text": "Registerbekanntmachung nach dem Umwandlungsgesetz\nHamburg Amtsgericht Hamburg HRB 123015\nTAG 1. NRW-Immobilien GmbH – Hamburg",
      "type": "Registerbekanntmachung nach dem Umwandlungsgesetz",
      "state": "Hamburg",
      "amtsgericht": "Amtsgericht Hamburg",
      "registernummer": "HRB 123015",
      "registerart": "HRB",
      "company_name": "TAG 1. NRW-Immobilien GmbH",
      "company_seat": "Hamburg",
      "details": "21.11.2024 (Bekanntmachungsdatum)\n\nHamburg Amtsgericht Hamburg HRB 123015\nRegisterbekanntmachung nach dem Umwandlungsgesetz 21.11.2024 (Eintragungsdatum)\n\nTAG 1. NRW-Immobilien GmbH\nGesellschaft mit beschränkter Haftung\nHamburg\n\nAls nicht eingetragen wird bekannt gemacht:\nDen Gläubigern der an der Verschmelzung beteiligten Gesellschaften ist, wenn sie binnen sechs Monaten nach dem Tag, an dem die Eintragung der Verschmelzung in das Register des Sitzes desjenigen Rechtsträgers, dessen Gläubiger sie sind, nach § 19 Absatz 3 UmwG als bekannt gemacht gilt, ihren Anspruch nach Grund und Höhe schriftlich anmelden, Sicherheit zu leisten, soweit sie nicht Befriedigung verlangen können. Dieses Recht steht den Gläubigern jedoch nur zu, wenn sie glaubhaft machen, dass durch die Verschmelzung die Erfüllung ihrer Forderung gefährdet wird."
    },
    {
      "date": "2024-11-21",
      "original_text": "Registerbekanntmachung nach dem Umwandlungsgesetz\nHamburg Amtsgericht Hamburg HRB 122968\nTAG 2. NRW-Immobilien GmbH – Hamburg",
      "type": "Registerbekanntmachung nach dem Umwandlungsgesetz",
      "state": "Hamburg",
      "amtsgericht": "Amtsgericht Hamburg",
      "registernummer": "HRB 122968",
      "registerart": "HRB",
      "company_name": "TAG 2. NRW-Immobilien GmbH",
      "company_seat": "Hamburg",
      "details": "21.11.2024 (Bekanntmachungsdatum)\n\nHamburg Amtsgericht Hamburg HRB 122968\nRegisterbekanntmachung nach dem Umwandlungsgesetz 21.11.2024 (Eintragungsdatum)\n\nTAG 2. NRW-Immobilien GmbH\nGesellschaft mit beschränkter Haftung\nHamburg\n\nAls nicht eingetragen wird bekannt gemacht:\nDen Gläubigern der an der Verschmelzung beteiligten Gesellschaften ist, wenn sie binnen sechs Monaten nach dem Tag, an dem die Eintragung der Verschmelzung in das Register des Sitzes desjenigen Rechtsträgers, dessen Gläubiger sie sind, nach § 19 Absatz 3 UmwG als bekannt gemacht gilt, ihren Anspruch nach Grund und Höhe schriftlich anmelden, Sicherheit zu leisten, soweit sie nicht Befriedigung verlangen können. Dieses Recht steht den Gläubigern jedoch nur zu, wenn sie glaubhaft machen, dass durch die Verschmelzung die Erfüllung ihrer Forderung gefährdet wird."
    },
    {
      "date": "2024-11-21",
      "original_text": "Löschungsankündigung\nNordrhein-Westfalen Amtsgericht Münster HRB 16106\nTECHNOSAN Umwelttechnik GmbH – Münster",
      "type": "Löschungsankündigung",
      "state": "Nordrhein-Westfalen",
      "amtsgericht": "Amtsgericht Münster",
      "registernummer": "HRB 16106",
      "registerart": "HRB",
      "company_name": "TECHNOSAN Umwelttechnik GmbH",
      "company_seat": "Münster",
      "details": "21.11.2024 (Bekanntmachungsdatum)\n\nNordrhein-Westfalen Amtsgericht Münster HRB 16106\nLöschungsankündigung 21.11.2024 (Eintragungsdatum)\n\nTECHNOSAN Umwelttechnik GmbH\nGesellschaft mit beschränkter Haftung\nMünster\n\nDas Registergericht beabsichtigt die Gesellschaft von Amts wegen nach § 394 FamFG zu löschen. Die Frist zur Erhebung eines Widerspruchs ist auf einen Monat festgesetzt.\n\nRechtbehelfsbelehrung:\n\nGegen diese Verfügung können Sie Widerspruch einlegen.\n\nDer Widerspruch ist bei dem Amtsgericht Münster, Gerichtsstraße 2 bis 6, 48149 Münster schriftlich in deutscher Sprache oder zur Niederschrift der Geschäftsstelle eines jeden Amtsgerichtes abgegeben werden.\nDie Einlegung ist auch durch Übertragung eines elektronischen Dokuments an die elektronische Poststelle des Gerichts möglich. Das elektronische Dokument muss für die Bearbeitung durch das Gericht geeignet und mit einer qualifizierten elektronischen Signatur der verantwortenden Person versehen sein oder von der verantwortenden Person signiert und auf einem sicheren Übermittlungsweg gem. § 130a ZPO nach nähere Maßgabe der Verordnung über die technischen Rahmenbedingungen des elektronischen Rechtsverkehrs und über das besondere elektronische Behördenpostfach (BGBI. I. S.3808) eingereicht werden. Weitere Informationen erhalten Sie auf der Internetseite www.justiz.de.\n\nDer Widerspruch muss spätestens innerhalb der gesetzten Frist nach der schriftlichen Bekanntgabe der Verfügung bei dem Amtsgericht Münster eingegangen sein. Dies gilt auch dann, wenn der Widerspruch zur Niederschrift der Geschäftsstelle eines anderen Amtsgerichtes abgegeben wurde. Die Frist beginnt mit der schriftlichen Bekanntgabe der Verfügung, spätestens mit Ablauf von fünf Monaten nach Erlass der Verfügung. Die Bekanntgabe ist entweder durch Zustellung oder am dritten Tage nach Aufgabe zur Post bewirkt. Fällt das Ende der First auf einen Sonntag, einen allgemeinen Feiertag oder Sonnabend, so endet die Frist mit Ablauf des nächsten Werktages.\n\nDer Widerspruch muss die Bezeichnung der angefochtenen Verfügung sowie die Erklärung enthalten, dass Widerspruch gegen diese Verfügung eingelegt wird. Er ist zu unterzeichnen  und soll begründet werden."
    },
    {
      "date": "2024-11-21",
      "original_text": "Löschungsankündigung\nNordrhein-Westfalen Amtsgericht Dortmund HRB 26754\nTMG Bau- und Immobilienservice GmbH – Dortmund",
      "type": "Löschungsankündigung",
      "state": "Nordrhein-Westfalen",
      "amtsgericht": "Amtsgericht Dortmund",
      "registernummer": "HRB 26754",
      "registerart": "HRB",
      "company_name": "TMG Bau- und Immobilienservice GmbH",
      "company_seat": "Dortmund",
      "details": "21.11.2024 (Bekanntmachungsdatum)\n\nNordrhein-Westfalen Amtsgericht Dortmund HRB 26754\nLöschungsankündigung\n\nTMG Bau- und Immobilienservice GmbH\nGesellschaft mit beschränkter Haftung\nDortmund\n\nDas Registergericht beabsichtigt die Gesellschaft von Amts wegen nach § 394 FamFG zu löschen. Die Frist zur Erhebung eines Widerspruchs ist auf zwei Monate festgesetzt."
    },
    {
      "date": "2024-11-21",
      "original_text": "Einreichung neuer Dokumente\nBaden-Württemberg Amtsgericht Mannheim HRB 712352\nThood AG – Baden-Baden",
      "type": "Einreichung neuer Dokumente",
      "state": "Baden-Württemberg",
      "amtsgericht": "Amtsgericht Mannheim",
      "registernummer": "HRB 712352",
      "registerart": "HRB",
      "company_name": "Thood AG",
      "company_seat": "Baden-Baden",
      "details": "21.11.2024 (Bekanntmachungsdatum)\n\nBaden-Württemberg Amtsgericht Mannheim HRB 712352\nEinreichung neuer Dokumente 21.11.2024 (Eintragungsdatum)\n\nThood AG\nAktiengesellschaft\nBaden-Baden\n\nDie Gesellschaft hat am 28.08.2024 die Liste über die Zusammensetzung des Aufsichtsrats zum Handelsregister eingereicht."
    },
    {
      "date": "2024-11-21",
      "original_text": "Löschungsankündigung\nBrandenburg Amtsgericht Frankfurt/Oder HRB 15406\nTraffic Dealer GmbH – Schöneiche bei Berlin",
      "type": "Löschungsankündigung",
      "state": "Brandenburg",
      "amtsgericht": "Amtsgericht Frankfurt/Oder",
      "registernummer": "HRB 15406",
      "registerart": "HRB",
      "company_name": "Traffic Dealer GmbH",
      "company_seat": "Schöneiche bei Berlin",
      "details": "21.11.2024 (Bekanntmachungsdatum)\n\nBrandenburg Amtsgericht Frankfurt/Oder HRB 15406\nLöschungsankündigung\n\nTraffic Dealer GmbH\nGesellschaft mit beschränkter Haftung\nSchöneiche bei Berlin\n\nBei der nachstehenden Gesellschaft wird das Amtslöschungsverfahren gemäß § 394 FamFG eingeleitet."
    },
    {
      "date": "2024-11-21",
      "original_text": "Sonstige Registerbekanntmachung\nHessen Amtsgericht Königstein VR 1499\nVeritas e.V. – Bad Soden am Taunus",
      "type": "Sonstige Registerbekanntmachung",
      "state": "Hessen",
      "amtsgericht": "Amtsgericht Königstein",
      "registernummer": "VR 1499",
      "registerart": "VR",
      "company_name": "Veritas e.V.",
      "company_seat": "Bad Soden am Taunus",
      "details": "21.11.2024 (Bekanntmachungsdatum)\n\nHessen Amtsgericht Königstein VR 1499\nSonstige Registerbekanntmachung 21.11.2024 (Eintragungsdatum)\n\nVeritas e.V.\neingetragener Verein\nBad Soden am Taunus\n\nDer Verein ist aufgelöst."
    },
    {
      "date": "2024-11-21",
      "original_text": "Einreichung neuer Dokumente\nHessen Amtsgericht Kassel HRB 5592\nVerkehrsverbund und Fördergesellschaft Nordhessen mbH – Kassel",
      "type": "Einreichung neuer Dokumente",
      "state": "Hessen",
      "amtsgericht": "Amtsgericht Kassel",
      "registernummer": "HRB 5592",
      "registerart": "HRB",
      "company_name": "Verkehrsverbund und Fördergesellschaft Nordhessen mbH",
      "company_seat": "Kassel",
      "details": "21.11.2024 (Bekanntmachungsdatum)\n\nHessen Amtsgericht Kassel HRB 5592\nEinreichung neuer Dokumente\n\nVerkehrsverbund und Fördergesellschaft Nordhessen mbH\nGesellschaft mit beschränkter Haftung\nKassel\n\nDurch eine Änderung in den Personen der Aufsichtsratsmitglieder ist eine Liste der Mitglieder des Aufsichtsrates zum Handelsregister eingereicht worden."
    },
    {
      "date": "2024-11-21",
      "original_text": "Registerbekanntmachung nach dem Umwandlungsgesetz\nBerlin Amtsgericht Berlin (Charlottenburg) HRB 188726\nVia Maris International Food Trade. Ochyon GmbH – Berlin",
      "type": "Registerbekanntmachung nach dem Umwandlungsgesetz",
      "state": "Berlin",
      "amtsgericht": "Amtsgericht Berlin (Charlottenburg)",
      "registernummer": "HRB 188726",
      "registerart": "HRB",
      "company_name": "Via Maris International Food Trade. Ochyon GmbH",
      "company_seat": "Berlin",
      "details": "21.11.2024 (Bekanntmachungsdatum)\n\nBerlin Amtsgericht Berlin (Charlottenburg) HRB 188726\nRegisterbekanntmachung nach dem Umwandlungsgesetz 20.11.2024 (Eintragungsdatum)\n\nVia Maris International  Food Trade. Ochyon GmbH\nGesellschaft mit beschränkter Haftung\nBerlin\n\nZu Eintragungsnummer 4 vom 20.11.2024 wird als nicht eingetragen veröffentlicht: Den Gläubigern der an der Spaltung beteiligten Rechtsträger ist, wenn sie binnen sechs Monaten nach dem Tag, an dem die Eintragung der Spaltung in das Register des Sitzes desjenigen Rechtsträgers, dessen Gläubiger sie sind, als bekannt gemacht gilt, ihren Anspruch nach Grund und Höhe schriftlich anmelden, Sicherheit zu leisten, soweit sie nicht Befriedigung verlangen können. Dieses Recht steht den Gläubigern jedoch nur zu, wenn sie glaubhaft machen, dass durch die Spaltung die Erfüllung ihrer Forderung gefährdet wird. Das Recht, Sicherheitsleistung zu verlangen, steht Gläubigern nicht zu, die im Falle der Insolvenz ein Recht auf vorzugsweise Befriedigung aus einer Deckungsmasse haben, die nach gesetzlicher Vorschrift zu ihrem Schutz errichtet und staatlich überwacht ist."
    },
    {
      "date": "2024-11-21",
      "original_text": "Registerbekanntmachung nach dem Umwandlungsgesetz\nNordrhein-Westfalen Amtsgericht Duisburg HRB 10530\nViertmeier Vermögensverwaltung GmbH – Dinslaken",
      "type": "Registerbekanntmachung nach dem Umwandlungsgesetz",
      "state": "Nordrhein-Westfalen",
      "amtsgericht": "Amtsgericht Duisburg",
      "registernummer": "HRB 10530",
      "registerart": "HRB",
      "company_name": "Viertmeier Vermögensverwaltung GmbH",
      "company_seat": "Dinslaken",
      "details": "21.11.2024 (Bekanntmachungsdatum)\n\nNordrhein-Westfalen Amtsgericht Duisburg HRB 10530\nRegisterbekanntmachung nach dem Umwandlungsgesetz 21.11.2024 (Eintragungsdatum)\n\nViertmeier Vermögensverwaltung GmbH\nGesellschaft mit beschränkter Haftung\nDinslaken\n\nDie Gesellschaft hat Gläubigern, deren Forderungen vor dieser Bekanntmachung begründet worden sind, Sicherheit zu leisten, soweit sie nicht Befriedigung verlangen können, wenn sie sich binnen sechs Monaten zu diesem Zweck melden."
    },
    {
      "date": "2024-11-21",
      "original_text": "Löschungsankündigung\nBayern Amtsgericht München HRB 221149\nVini Bau GmbH – München",
      "type": "Löschungsankündigung",
      "state": "Bayern",
      "amtsgericht": "Amtsgericht München",
      "registernummer": "HRB 221149",
      "registerart": "HRB",
      "company_name": "Vini Bau GmbH",
      "company_seat": "München",
      "details": "21.11.2024 (Bekanntmachungsdatum)\n\nBayern Amtsgericht München HRB 221149\nLöschungsankündigung 20.11.2024 (Eintragungsdatum)\n\nVini Bau GmbH\nGesellschaft mit beschränkter Haftung\nMünchen\n\nDas Registergericht beabsichtigt, die im Handelsregister eingetragene Gesellschaft wegen Vermögenslosigkeit von Amts wegen nach § 394 FamFG zu löschen. Die Frist zur Erhebung eines Widerspruchs ist auf drei Monate festgesetzt."
    },
    {
      "date": "2024-11-21",
      "original_text": "Registerbekanntmachung nach dem Umwandlungsgesetz\nThüringen Amtsgericht Jena HRA 506679\nVitalservice Hildebrandt e. K. – Neustadt an der Orla",
      "type": "Registerbekanntmachung nach dem Umwandlungsgesetz",
      "state": "Thüringen",
      "amtsgericht": "Amtsgericht Jena",
      "registernummer": "HRA 506679",
      "registerart": "HRA",
      "company_name": "Vitalservice Hildebrandt e. K.",
      "company_seat": "Neustadt an der Orla",
      "details": "21.11.2024 (Bekanntmachungsdatum)\n\nThüringen Amtsgericht Jena HRA 506679\nRegisterbekanntmachung nach dem Umwandlungsgesetz 21.11.2024 (Eintragungsdatum)\n\nVitalservice Hildebrandt e. K.\nEinzelkaufmann / Einzelkauffrau\nNeustadt an der Orla\n\nNicht eingetragen: Den Gläubigern der an der Ausgliederung beteiligten Rechtsträger, ist wenn sie binnen sechs Monaten nach dem Tag, an dem die Eintragung der Ausgliederung in das Register des Sitzes desjenigen Rechtsträgers, dessen Gläubiger sie sind, nach §§125, 19 Abs. 3 UmwG als bekanntgemacht gilt, ihren Anspruch nach Grund und Höhe schriftlich anmelden, Sicherheit zu leisten, soweit sie nicht Befriedigung verlangen können. Dieses Recht steht ihnen jedoch nur zu, wenn sie glaubhaft machen, daß durch die Ausgliederung die Erfüllung ihrer Forderung gefährdet wird."
    },
    {
      "date": "2024-11-21",
      "original_text": "Registerbekanntmachung nach dem Umwandlungsgesetz\nThüringen Amtsgericht Jena GnR 500164\nVitalservice Hildebrandt eG – Neustadt an der Orla",
      "type": "Registerbekanntmachung nach dem Umwandlungsgesetz",
      "state": "Thüringen",
      "amtsgericht": "Amtsgericht Jena",
      "registernummer": "GnR 500164",
      "registerart": "GnR",
      "company_name": "Vitalservice Hildebrandt eG",
      "company_seat": "Neustadt an der Orla",
      "details": "21.11.2024 (Bekanntmachungsdatum)\n\nThüringen Amtsgericht Jena GnR 500164\nRegisterbekanntmachung nach dem Umwandlungsgesetz 21.11.2024 (Eintragungsdatum)\n\nVitalservice Hildebrandt eG\neingetragene Genossenschaft\nNeustadt an der Orla\n\nNicht eingetragen: Den Gläubigern der an der Ausgliederung beteiligten Rechtsträger, ist wenn sie binnen sechs Monaten nach dem Tag, an dem die Eintragung der Ausgliederung in das Register des Sitzes desjenigen Rechtsträgers, dessen Gläubiger sie sind, nach §§125, 19 Abs. 3 UmwG als bekanntgemacht gilt, ihren Anspruch nach Grund und Höhe schriftlich anmelden, Sicherheit zu leisten, soweit sie nicht Befriedigung verlangen können. Dieses Recht steht ihnen jedoch nur zu, wenn sie glaubhaft machen, daß durch die Ausgliederung die Erfüllung ihrer Forderung gefährdet wird."
    },
    {
      "date": "2024-11-21",
      "original_text": "Registerbekanntmachung nach dem Umwandlungsgesetz\nNordrhein-Westfalen Amtsgericht Düsseldorf HRB 38062\nVodafone GmbH – Düsseldorf",
      "type": "Registerbekanntmachung nach dem Umwandlungsgesetz",
      "state": "Nordrhein-Westfalen",
      "amtsgericht": "Amtsgericht Düsseldorf",
      "registernummer": "HRB 38062",
      "registerart": "HRB",
      "company_name": "Vodafone GmbH",
      "company_seat": "Düsseldorf",
      "details": "21.11.2024 (Bekanntmachungsdatum)\n\nNordrhein-Westfalen Amtsgericht Düsseldorf HRB 38062\nRegisterbekanntmachung nach dem Umwandlungsgesetz 21.11.2024 (Eintragungsdatum)\n\nVodafone GmbH\nGesellschaft mit beschränkter Haftung\nDüsseldorf\n\nDen Gläubigern der an der Verschmelzung beteiligten Rechtsträger ist, wenn sie binnen sechs Monaten nach dem Tag, an dem die Eintragung der Verschmelzung in das Register des Sitzes desjenigen Rechtsträgers, dessen Gläubiger sie sind, nach § 19 Absatz 3 UmwG als bekanntgemacht gilt, ihren Anspruch nach Grund und Höhe schriftlich anmelden, Sicherheit zu leisten, soweit sie nicht Befriedigung verlangen können. Dieses Recht steht den Gläubigern jedoch nur zu, wenn sie glaubhaft machen, dass durch die Verschmelzung die Erfüllung ihrer Forderung gefährdet wird."
    },
    {
      "date": "2024-11-21",
      "original_text": "Löschungsankündigung\nHessen Amtsgericht Offenbach am Main HRB 51877\nVorrata CEHA Protection GmbH – Dreieich",
      "type": "Löschungsankündigung",
      "state": "Hessen",
      "amtsgericht": "Amtsgericht Offenbach am Main",
      "registernummer": "HRB 51877",
      "registerart": "HRB",
      "company_name": "Vorrata CEHA Protection GmbH",
      "company_seat": "Dreieich",
      "details": "21.11.2024 (Bekanntmachungsdatum)\n\nHessen Amtsgericht Offenbach am Main HRB 51877\nLöschungsankündigung\n\nVorrata CEHA Protection GmbH\nGesellschaft mit beschränkter Haftung\nDreieich\n\nDas Registergericht beabsichtigt die im Handelsregister eingetragene Gesellschaft von Amts wegen nach § 394 FamFG zu löschen. Die Frist zur Erhebung eines Widerspruchs gegen die beabsichtigte Löschung wird auf 3 Monate festgesetzt."
    },
    {
      "date": "2024-11-21",
      "original_text": "Einreichung neuer Dokumente\nRheinland-Pfalz Amtsgericht Ludwigshafen a.Rhein (Ludwigshafen) HRB 41004\nWBG Wohnungsbaugesellschaft Neustadt an der Weinstraße mbH – Neustadt a.d.Weinstr.",
      "type": "Einreichung neuer Dokumente",
      "state": "Rheinland-Pfalz",
      "amtsgericht": "Amtsgericht Ludwigshafen a.Rhein (Ludwigshafen)",
      "registernummer": "HRB 41004",
      "registerart": "HRB",
      "company_name": "WBG Wohnungsbaugesellschaft Neustadt an der Weinstraße mbH",
      "company_seat": "Neustadt a.d.Weinstr.",
      "details": "21.11.2024 (Bekanntmachungsdatum)\n\nRheinland-Pfalz Amtsgericht Ludwigshafen a.Rhein (Ludwigshafen) HRB 41004\nEinreichung neuer Dokumente\n\nWBG Wohnungsbaugesellschaft Neustadt an der Weinstraße mbH\nGesellschaft mit beschränkter Haftung\nNeustadt a.d.Weinstr.\n\nDem Registergericht ist eine Liste der Mitglieder des Aufsichtsrates eingereicht worden."
    },
    {
      "date": "2024-11-21",
      "original_text": "Einreichung neuer Dokumente\nMecklenburg-Vorpommern Amtsgericht Neubrandenburg HRB 4918\nWaren (Müritz) Kur- und Tourismus GmbH – Waren",
      "type": "Einreichung neuer Dokumente",
      "state": "Mecklenburg-Vorpommern",
      "amtsgericht": "Amtsgericht Neubrandenburg",
      "registernummer": "HRB 4918",
      "registerart": "HRB",
      "company_name": "Waren (Müritz) Kur- und Tourismus GmbH",
      "company_seat": "Waren",
      "details": "21.11.2024 (Bekanntmachungsdatum)\n\nMecklenburg-Vorpommern Amtsgericht Neubrandenburg HRB 4918\nEinreichung neuer Dokumente\n\nWaren (Müritz) Kur- und Tourismus GmbH\nGesellschaft mit beschränkter Haftung\nWaren\n\nEine Liste der Mitglieder des Aufsichtsrats ist zum Handelsregister eingereicht worden."
    },
    {
      "date": "2024-11-21",
      "original_text": "Löschungsankündigung\nNordrhein-Westfalen Amtsgericht Gelsenkirchen HRA 2239\nWilly Zaremba GmbH & Co. KG – Gladbeck",
      "type": "Löschungsankündigung",
      "state": "Nordrhein-Westfalen",
      "amtsgericht": "Amtsgericht Gelsenkirchen",
      "registernummer": "HRA 2239",
      "registerart": "HRA",
      "company_name": "Willy Zaremba GmbH & Co. KG",
      "company_seat": "Gladbeck",
      "details": "21.11.2024 (Bekanntmachungsdatum)\n\nNordrhein-Westfalen Amtsgericht Gelsenkirchen HRA 2239\nLöschungsankündigung 21.11.2024 (Eintragungsdatum)\n\nWilly Zaremba GmbH & Co. KG\nKommanditgesellschaft\nGladbeck\n\nDas Registergericht beabsichtigt die Firma von Amts wegen nach § 394 FamFG zu löschen. Die Frist zur Erhebung eines Widerspruchs ist auf einen Monat festgesetzt."
    },
    {
      "date": "2024-11-21",
      "original_text": "Registerbekanntmachung nach dem Umwandlungsgesetz\nNordrhein-Westfalen Amtsgericht Köln HRA 37836\nWonderland Inc. & Co. KG – Köln",
      "type": "Registerbekanntmachung nach dem Umwandlungsgesetz",
      "state": "Nordrhein-Westfalen",
      "amtsgericht": "Amtsgericht Köln",
      "registernummer": "HRA 37836",
      "registerart": "HRA",
      "company_name": "Wonderland Inc. & Co. KG",
      "company_seat": "Köln",
      "details": "21.11.2024 (Bekanntmachungsdatum)\n\nNordrhein-Westfalen Amtsgericht Köln HRA 37836\nRegisterbekanntmachung nach dem Umwandlungsgesetz 21.11.2024 (Eintragungsdatum)\n\nWonderland Inc. & Co. KG\nKommanditgesellschaft\nKöln\n\nDie Gesellschaft hat Gläubigern, deren Forderungen vor dieser Bekanntmachung begründet worden sind, Sicherheit zu leisten, soweit sie nicht Befriedigung verlangen können, wenn sie sich binnen sechs Monaten zu diesem Zweck melden."
    },
    {
      "date": "2024-11-21",
      "original_text": "Löschungsankündigung\nBayern Amtsgericht München HRB 232925\nXiangwei Restaurant GmbH – München",
      "type": "Löschungsankündigung",
      "state": "Bayern",
      "amtsgericht": "Amtsgericht München",
      "registernummer": "HRB 232925",
      "registerart": "HRB",
      "company_name": "Xiangwei Restaurant GmbH",
      "company_seat": "München",
      "details": "21.11.2024 (Bekanntmachungsdatum)\n\nBayern Amtsgericht München HRB 232925\nLöschungsankündigung 20.11.2024 (Eintragungsdatum)\n\nXiangwei Restaurant GmbH\nGesellschaft mit beschränkter Haftung\nMünchen\n\nDas Registergericht beabsichtigt, die im Handelsregister eingetragene Gesellschaft wegen Vermögenslosigkeit von Amts wegen nach § 394 FamFG zu löschen. Die Frist zur Erhebung eines Widerspruchs ist auf drei Monate festgesetzt."
    },
    {
      "date": "2024-11-21",
      "original_text": "Löschungsankündigung\nSchleswig-Holstein Amtsgericht Lübeck HRB 7048\ndatexa GmbH – Reinbek",
      "type": "Löschungsankündigung",
      "state": "Schleswig-Holstein",
      "amtsgericht": "Amtsgericht Lübeck",
      "registernummer": "HRB 7048",
      "registerart": "HRB",
      "company_name": "datexa GmbH",
      "company_seat": "Reinbek",
      "details": "21.11.2024 (Bekanntmachungsdatum)\n\nSchleswig-Holstein Amtsgericht Lübeck HRB 7048\nLöschungsankündigung\n\ndatexa GmbH\nGesellschaft mit beschränkter Haftung\nReinbek\n\nEs ist die Löschung der nachstehenden Gesellschaft wegen Vermögenslosigkeit gemäß § 394 FamFG beabsichtigt. Widerspruchsfrist: 1 Monat."
    },
    {
      "date": "2024-11-21",
      "original_text": "Einreichung neuer Dokumente\nBayern Amtsgericht München HRB 253548\nneoshare AG – München",
      "type": "Einreichung neuer Dokumente",
      "state": "Bayern",
      "amtsgericht": "Amtsgericht München",
      "registernummer": "HRB 253548",
      "registerart": "HRB",
      "company_name": "neoshare AG",
      "company_seat": "München",
      "details": "21.11.2024 (Bekanntmachungsdatum)\n\nBayern Amtsgericht München HRB 253548\nEinreichung neuer Dokumente\n\nneoshare AG\nAktiengesellschaft\nMünchen\n\nDem Amtsgericht München -Registergericht- ist eine Liste der Mitglieder des Aufsichtsrats eingereicht worden, § 106 AktG."
    },
    {
      "date": "2024-11-21",
      "original_text": "Registerbekanntmachung nach dem Umwandlungsgesetz\nNordrhein-Westfalen Amtsgericht Bochum HRB 19564\northohoch3 GmbH – Bochum",
      "type": "Registerbekanntmachung nach dem Umwandlungsgesetz",
      "state": "Nordrhein-Westfalen",
      "amtsgericht": "Amtsgericht Bochum",
      "registernummer": "HRB 19564",
      "registerart": "HRB",
      "company_name": "orthohoch3 GmbH",
      "company_seat": "Bochum",
      "details": "21.11.2024 (Bekanntmachungsdatum)\n\nNordrhein-Westfalen Amtsgericht Bochum HRB 19564\nRegisterbekanntmachung nach dem Umwandlungsgesetz 19.11.2024 (Eintragungsdatum)\n\northohoch3 GmbH\nGesellschaft mit beschränkter Haftung\nBochum\n\nDen Gläubigern der an der Ausgliederung beteiligten Rechtsträger ist, wenn sie binnen sechs Monaten nach dem Tag, an dem die Eintragung der Ausgliederung in das Register des Sitzes derjenigen Rechtsträger deren Gläubiger sie sind, nach § 19 Absatz 3 UmwG als bekanntgemacht gilt, ihren Anspruch nach Grund und Höhe schriftlich anmelden, Sicherheit zu leisten, soweit sie nicht Befriedigung verlangen können. Dieses Recht steht den Gläubigern jedoch nur zu, wenn sie glaubhaft machen, dass durch die Ausgliederung die Erfüllung ihrer Forderung gefährdet wird."
    },
    {
      "date": "2024-11-21",
      "original_text": "Registerbekanntmachung nach dem Umwandlungsgesetz\nBayern Amtsgericht München HRB 260863\npetitini Ludlstrasse GmbH – München",
      "type": "Registerbekanntmachung nach dem Umwandlungsgesetz",
      "state": "Bayern",
      "amtsgericht": "Amtsgericht München",
      "registernummer": "HRB 260863",
      "registerart": "HRB",
      "company_name": "petitini Ludlstrasse GmbH",
      "company_seat": "München",
      "details": "21.11.2024 (Bekanntmachungsdatum)\n\nBayern Amtsgericht München HRB 260863\nRegisterbekanntmachung nach dem Umwandlungsgesetz 20.11.2024 (Eintragungsdatum)\n\npetitini Ludlstrasse GmbH\nGesellschaft mit beschränkter Haftung\nMünchen\n\nDen Gläubigern der an der Verschmelzung beteiligten Rechtsträger ist, wenn sie binnen sechs Monaten nach dem Tag, an dem die Eintragung der Verschmelzung in das Register des Sitzes desjenigen Rechtsträgers, dessen Gläubiger sie sind, nach § 19 Abs. 3 UmwG als bekannt gemacht gilt, ihren Anspruch nach Grund und Höhe schriftlich anmelden, Sicherheit zu leisten, soweit sie nicht Befriedigung verlangen können. Dieses Recht steht den Gläubigern jedoch nur zu, wenn sie glaubhaft machen, dass durch die Verschmelzung die Erfüllung ihrer Forderung gefährdet wird."
    },
    {
      "date": "2024-11-21",
      "original_text": "Registerbekanntmachung nach dem Umwandlungsgesetz\nNordrhein-Westfalen Amtsgericht Münster HRB 22141\nundrafted Sports Media GmbH – Münster",
      "type": "Registerbekanntmachung nach dem Umwandlungsgesetz",
      "state": "Nordrhein-Westfalen",
      "amtsgericht": "Amtsgericht Münster",
      "registernummer": "HRB 22141",
      "registerart": "HRB",
      "company_name": "undrafted Sports Media GmbH",
      "company_seat": "Münster",
      "details": "21.11.2024 (Bekanntmachungsdatum)\n\nNordrhein-Westfalen Amtsgericht Münster HRB 22141\nRegisterbekanntmachung nach dem Umwandlungsgesetz 21.11.2024 (Eintragungsdatum)\n\nundrafted Sports Media GmbH\nGesellschaft mit beschränkter Haftung\nMünster\n\nDen Gläubigern der an der Ausgliederung beteiligten Rechtsträger ist, wenn sie binnen sechs Monaten nach dem Tag, an dem die Eintragung der Ausgliederung in das Register des Sitzes desjenigen Rechtsträgers, dessen Gläubiger sie sind, nach § 19 Absatz 3 UmwG als bekanntgemacht gilt, ihren Anspruch nach Grund und Höhe schriftlich anmelden, Sicherheit zu leisten, soweit sie nicht Befriedigung verlangen können. Dieses Recht steht den Gläubigern jedoch nur zu, wenn sie glaubhaft machen, dass durch die Ausgliederung die Erfüllung ihrer Forderung gefährdet wird."
    },
    {
      "date": "2024-11-21",
      "original_text": "Registerbekanntmachung nach dem Umwandlungsgesetz\nNordrhein-Westfalen Amtsgericht Münster HRA 11967\nundrafted e.K. – Münster",
      "type": "Registerbekanntmachung nach dem Umwandlungsgesetz",
      "state": "Nordrhein-Westfalen",
      "amtsgericht": "Amtsgericht Münster",
      "registernummer": "HRA 11967",
      "registerart": "HRA",
      "company_name": "undrafted e.K.",
      "company_seat": "Münster",
      "details": "21.11.2024 (Bekanntmachungsdatum)\n\nNordrhein-Westfalen Amtsgericht Münster HRA 11967\nRegisterbekanntmachung nach dem Umwandlungsgesetz 21.11.2024 (Eintragungsdatum)\n\nundrafted e.K.\nEinzelkaufmann / Einzelkauffrau\nMünster\n\nDen Gläubigern der an der Ausgliederung beteiligten Rechtsträger ist, wenn sie binnen sechs Monaten nach dem Tag, an dem die Eintragung der Ausgliederung in das Register des Sitzes desjenigen Rechtsträgers, dessen Gläubiger sie sind, nach § 19 Absatz 3 UmwG als bekanntgemacht gilt, ihren Anspruch nach Grund und Höhe schriftlich anmelden, Sicherheit zu leisten, soweit sie nicht Befriedigung verlangen können. Dieses Recht steht den Gläubigern jedoch nur zu, wenn sie glaubhaft machen, dass durch die Ausgliederung die Erfüllung ihrer Forderung gefährdet wird."
    }
  ]
}