{
  "date": "2024-11-08",
  "date_of_scrape": "2024-11-22",
  "tool_version": "0.1.0",
  "announcements": [
    {
      "date": "2024-11-08",
      "original_text": "Registerbekanntmachung nach dem Umwandlungsgesetz\nBayern Amtsgericht München HRB 140545\nA-HEAT Allied Heat Exchange Technology AG – Fürstenfeldbruck",
      "type": "Registerbekanntmachung nach dem Umwandlungsgesetz",
      "state": "Bayern",
      "amtsgericht": "Amtsgericht München",
      "registernummer": "HRB 140545",
      "registerart": "HRB",
      "company_name": "A-HEAT Allied Heat Exchange Technology AG",
      "company_seat": "Fürstenfeldbruck",
      "details": "08.11.2024 (Bekanntmachungsdatum)\n\nBayern Amtsgericht München HRB 140545\nRegisterbekanntmachung nach dem Umwandlungsgesetz 07.11.2024 (Eintragungsdatum)\n\nA-HEAT Allied Heat Exchange Technology AG\nAktiengesellschaft\nFürstenfeldbruck\n\nDer Entwurf des Formwechselplans der A-HEAT Allied Heat Exchange Technology AG, eingetragen im Handelsregister des Amtsgericht München, HRB 140545, ist am 30.10.2024 beim Handelsregister des Amtsgerichts München, HRB 140545, eingereicht worden. Formwechselnder Rechtsträger ist die A-HEAT Allied Heat Exchange Technology AG, eine nach deutschem Recht gegründete und bestehende Aktiengesellschaft mit Sitz in 82256 Fürstenfeldbruck, Hans- Güntner -Str. 2-6. Für die Gesellschaft neuer Rechtsform (im Folgenden Rechtsträger neuer Rechtsform) ist im Zuzugsmitgliedstaat (Österreich) die Rechtsform einer Aktiengesellschaft nach österreichischem Recht unter der Firma A-HEAT Allied Heat Exchange Technology AG mit dem satzungsmäßigen Sitz in Wien (Österreich) vorgesehen. Der formwechselnde Rechtsträger ist im Handelsregister des Amtsgerichts  Registergericht  München unter HRB 140545 eingetragen. Die Gesellschaft neuer Rechtsform soll im Firmenbuch des Handelsgerichtes Wien registriert werden. Hinweis an die Anteilsinhaber und Gläubiger des formwechselnden Rechtsträgers sowie an die Arbeitnehmer des formwechselnden Rechtsträgers (ein Betriebsrat existiert nicht): Die vorgenannten Personen können dem formwechselnden Rechtsträger spätestens fünf Arbeitstage vor dem Tag der Hauptversammlung Bemerkungen zum Formwechselplan übermitteln. Diese Hauptversammlung darf über die Zustimmung zum Formwechsel frühestens einen Monat nach der hier veranlassten Bekanntmachung beschließen."
    },
    {
      "date": "2024-11-08",
      "original_text": "Registerbekanntmachung nach dem Umwandlungsgesetz\nHessen Amtsgericht Kassel HRB 7524\nAD-ARTISTS GmbH – Kassel",
      "type": "Registerbekanntmachung nach dem Umwandlungsgesetz",
      "state": "Hessen",
      "amtsgericht": "Amtsgericht Kassel",
      "registernummer": "HRB 7524",
      "registerart": "HRB",
      "company_name": "AD-ARTISTS GmbH",
      "company_seat": "Kassel",
      "details": "08.11.2024 (Bekanntmachungsdatum)\n\nHessen Amtsgericht Kassel HRB 7524\nRegisterbekanntmachung nach dem Umwandlungsgesetz 08.11.2024 (Eintragungsdatum)\n\nAD-ARTISTS GmbH\nGesellschaft mit beschränkter Haftung\nKassel\n\nDen Gläubigern der an der Verschmelzung beteiligten Rechtsträger ist, wenn sie binnen sechs Monaten nach dem Tag, an dem die Eintragung der Verschmelzung in das Register des Sitzes derjenigen Rechtsträger deren Gläubiger sie sind, nach § 19 Absatz 3 UmwG bekannt gemacht worden ist, ihren Anspruch nach Grund und Höhe schriftlich anmelden, Sicherheit zu leisten, soweit sie nicht Befriedigung verlangen können. Dieses Recht steht den Gläubigern jedoch nur zu, wenn sie glaubhaft machen, dass durch die Verschmelzung die Erfüllung ihrer Forderung gefährdet wird."
    },
    {
      "date": "2024-11-08",
      "original_text": "Löschungsankündigung\nBayern Amtsgericht München HRB 276056\nADO Bau GmbH – München",
      "type": "Löschungsankündigung",
      "state": "Bayern",
      "amtsgericht": "Amtsgericht München",
      "registernummer": "HRB 276056",
      "registerart": "HRB",
      "company_name": "ADO Bau GmbH",
      "company_seat": "München",
      "details": "08.11.2024 (Bekanntmachungsdatum)\n\nBayern Amtsgericht München HRB 276056\nLöschungsankündigung 07.11.2024 (Eintragungsdatum)\n\nADO Bau GmbH\nGesellschaft mit beschränkter Haftung\nMünchen\n\nDas Registergericht beabsichtigt, die im Handelsregister eingetragene Gesellschaft wegen Vermögenslosigkeit von Amts wegen nach § 394 FamFG zu löschen. Die Frist zur Erhebung eines Widerspruchs ist auf drei Monate festgesetzt."
    },
    {
      "date": "2024-11-08",
      "original_text": "Einreichung neuer Dokumente\nNordrhein-Westfalen Amtsgericht Bielefeld HRB 36919\nAER Kooperation AG – Bielefeld",
      "type": "Einreichung neuer Dokumente",
      "state": "Nordrhein-Westfalen",
      "amtsgericht": "Amtsgericht Bielefeld",
      "registernummer": "HRB 36919",
      "registerart": "HRB",
      "company_name": "AER Kooperation AG",
      "company_seat": "Bielefeld",
      "details": "08.11.2024 (Bekanntmachungsdatum)\n\nNordrhein-Westfalen Amtsgericht Bielefeld HRB 36919\nEinreichung neuer Dokumente\n\nAER Kooperation AG\nAktiengesellschaft\nBielefeld\n\nDem Registergericht ist eine Liste der Mitglieder des Aufsichtsrates eingereicht worden."
    },
    {
      "date": "2024-11-08",
      "original_text": "Registerbekanntmachung nach dem Umwandlungsgesetz\nNiedersachsen Amtsgericht Tostedt HRA 205249\nALLX GmbH & Co. KG – Harsefeld",
      "type": "Registerbekanntmachung nach dem Umwandlungsgesetz",
      "state": "Niedersachsen",
      "amtsgericht": "Amtsgericht Tostedt",
      "registernummer": "HRA 205249",
      "registerart": "HRA",
      "company_name": "ALLX GmbH & Co. KG",
      "company_seat": "Harsefeld",
      "details": "08.11.2024 (Bekanntmachungsdatum)\n\nNiedersachsen Amtsgericht Tostedt HRA 205249\nRegisterbekanntmachung nach dem Umwandlungsgesetz 08.11.2024 (Eintragungsdatum)\n\nALLX GmbH & Co. KG\nKommanditgesellschaft\nHarsefeld\n\nDen Gläubigern der an der Ausgliederung beteiligten Rechtsträger ist, wenn sie binnen sechs Monaten nach dem Tag, an dem die Eintragung der Ausgliederung in das Register des Sitzes desjenigen Rechtsträgers, dessen Gläubiger sie sind, nach § 19 Abs. 3 UmwG als bekannt gemacht gilt, ihren Anspruch nach Grund und Höhe schriftlich anmelden, Sicherheit zu leisten, soweit sie nicht Befriedigung verlangen können. Dieses Recht steht den Gläubigern jedoch nur zu, wenn sie glaubhaft machen, dass durch die Ausgliederung die Erfüllung der Forderung gefährdet wird."
    },
    {
      "date": "2024-11-08",
      "original_text": "Löschungsankündigung\nBayern Amtsgericht Nürnberg HRB 36763\nAV AGE & VISION GmbH – Engelthal",
      "type": "Löschungsankündigung",
      "state": "Bayern",
      "amtsgericht": "Amtsgericht Nürnberg",
      "registernummer": "HRB 36763",
      "registerart": "HRB",
      "company_name": "AV AGE & VISION GmbH",
      "company_seat": "Engelthal",
      "details": "08.11.2024 (Bekanntmachungsdatum)\n\nBayern Amtsgericht Nürnberg HRB 36763\nLöschungsankündigung\n\nAV AGE & VISION GmbH\nGesellschaft mit beschränkter Haftung\nEngelthal\n\nDas Registergericht beabsichtigt, die im Handelsregister eingetragene Gesellschaft wegen Vermögenslosigkeit von Amts wegen nach § 394 FamFG zu löschen. Die Frist zur Erhebung eines Widerspruchs ist auf einen Monat festgesetzt."
    },
    {
      "date": "2024-11-08",
      "original_text": "Registerbekanntmachung nach dem Umwandlungsgesetz\nBaden-Württemberg Amtsgericht Stuttgart HRB 769761\nAVL Versicherungsvergleich GmbH – Weinstadt",
      "type": "Registerbekanntmachung nach dem Umwandlungsgesetz",
      "state": "Baden-Württemberg",
      "amtsgericht": "Amtsgericht Stuttgart",
      "registernummer": "HRB 769761",
      "registerart": "HRB",
      "company_name": "AVL Versicherungsvergleich GmbH",
      "company_seat": "Weinstadt",
      "details": "08.11.2024 (Bekanntmachungsdatum)\n\nBaden-Württemberg Amtsgericht Stuttgart HRB 769761\nRegisterbekanntmachung nach dem Umwandlungsgesetz 08.11.2024 (Eintragungsdatum)\n\nAVL Versicherungsvergleich GmbH\nGesellschaft mit beschränkter Haftung\nWeinstadt\n\nAls nicht eingetragen wird bekanntgemacht:\nDen Gläubigern der an der Verschmelzung beteiligten Rechtsträger ist, wenn sie binnen sechs Monaten nach dem Tag, an dem die Eintragung der Verschmelzung in das Register des Sitzes desjenigen Rechtsträgers, dessen Gläubiger sie sind, nach § 19 Abs. 3 UmwG als bekanntgemacht gilt, ihren Anspruch nach Grund und Höhe schriftlich anmelden, Sicherheit zu leisten, soweit sie nicht Befriedigung verlangen können. Dieses Recht steht den Gläubigern jedoch nur zu, wenn sie glaubhaft machen, dass durch die Verschmelzung die Erfüllung ihrer Forderung gefährdet wird."
    },
    {
      "date": "2024-11-08",
      "original_text": "Einreichung neuer Dokumente\nBerlin Amtsgericht Berlin (Charlottenburg) HRB 241556\nAlphaQ Venture Capital geschlossene InvAG mit TGV – Berlin",
      "type": "Einreichung neuer Dokumente",
      "state": "Berlin",
      "amtsgericht": "Amtsgericht Berlin (Charlottenburg)",
      "registernummer": "HRB 241556",
      "registerart": "HRB",
      "company_name": "AlphaQ Venture Capital geschlossene InvAG mit TGV",
      "company_seat": "Berlin",
      "details": "08.11.2024 (Bekanntmachungsdatum)\n\nBerlin Amtsgericht Berlin (Charlottenburg) HRB 241556\nEinreichung neuer Dokumente\n\nAlphaQ Venture Capital geschlossene InvAG mit TGV\nAktiengesellschaft\nBerlin\n\nAls nicht eingetragen wird veröffentlicht: Es wurde eine neue Liste der Aufsichtsratsmitglieder eingereicht (§ 106 AktG)."
    },
    {
      "date": "2024-11-08",
      "original_text": "Registerbekanntmachung nach dem Umwandlungsgesetz\nNordrhein-Westfalen Amtsgericht Paderborn HRA 5578\nAluminiumgesellschaft Hövelhof mbH & Co.KG – Hövelhof",
      "type": "Registerbekanntmachung nach dem Umwandlungsgesetz",
      "state": "Nordrhein-Westfalen",
      "amtsgericht": "Amtsgericht Paderborn",
      "registernummer": "HRA 5578",
      "registerart": "HRA",
      "company_name": "Aluminiumgesellschaft Hövelhof mbH & Co.KG",
      "company_seat": "Hövelhof",
      "details": "08.11.2024 (Bekanntmachungsdatum)\n\nNordrhein-Westfalen Amtsgericht Paderborn HRA 5578\nRegisterbekanntmachung nach dem Umwandlungsgesetz 08.11.2024 (Eintragungsdatum)\n\nAluminiumgesellschaft Hövelhof mbH & Co.KG\nKommanditgesellschaft\nHövelhof\n\nDen Gläubigern der an der Abspaltung beteiligten Rechtsträger ist, wenn sie binnen sechs Monaten nach dem Tag, an dem die Eintragung der Abspaltung in das Register des Sitzes derjenigen Rechtsträger deren Gläubiger sie sind, nach § 19 Absatz 3 UmwG als bekanntgemacht gilt, ihren Anspruch nach Grund und Höhe schriftlich anmelden, Sicherheit zu leisten, soweit sie nicht Befriedigung verlangen können. Dieses Recht steht den Gläubigern jedoch nur zu, wenn sie glaubhaft machen, dass durch die Abspaltung die Erfüllung ihrer Forderung gefährdet wird."
    },
    {
      "date": "2024-11-08",
      "original_text": "Löschungsankündigung\nHessen Amtsgericht Hanau HRB 95808\nApoyas UG (haftungsbeschränkt) – Hammersbach",
      "type": "Löschungsankündigung",
      "state": "Hessen",
      "amtsgericht": "Amtsgericht Hanau",
      "registernummer": "HRB 95808",
      "registerart": "HRB",
      "company_name": "Apoyas UG (haftungsbeschränkt)",
      "company_seat": "Hammersbach",
      "details": "08.11.2024 (Bekanntmachungsdatum)\n\nHessen Amtsgericht Hanau HRB 95808\nLöschungsankündigung 08.11.2024 (Eintragungsdatum)\n\nApoyas UG (haftungsbeschränkt)\nGesellschaft mit beschränkter Haftung\nHammersbach\n\nDas Registergericht beabsichtigt die im Handelsregister eingetragene Gesellschaft von Amts wegen nach § 394 FamFG zu löschen. Die Frist zur Erhebung eines Widerspruchs gegen die beabsichtigte Löschung wird auf 3 Monate festgesetzt."
    },
    {
      "date": "2024-11-08",
      "original_text": "Registerbekanntmachung nach dem Umwandlungsgesetz\nBerlin Amtsgericht Berlin (Charlottenburg) HRB 88343\nArtprojekt Real Estate GmbH – Berlin",
      "type": "Registerbekanntmachung nach dem Umwandlungsgesetz",
      "state": "Berlin",
      "amtsgericht": "Amtsgericht Berlin (Charlottenburg)",
      "registernummer": "HRB 88343",
      "registerart": "HRB",
      "company_name": "Artprojekt Real Estate GmbH",
      "company_seat": "Berlin",
      "details": "08.11.2024 (Bekanntmachungsdatum)\n\nBerlin Amtsgericht Berlin (Charlottenburg) HRB 88343\nRegisterbekanntmachung nach dem Umwandlungsgesetz 07.11.2024 (Eintragungsdatum)\n\nArtprojekt Real Estate GmbH\nGesellschaft mit beschränkter Haftung\nBerlin\n\nZu Eintragungsnummer 22 vom 07.11.2024 wird als nicht eingetragen veröffentlicht: Den Gläubigern der an der Verschmelzung beteiligten Rechtsträger ist, wenn sie binnen sechs Monaten nach dem Tag, an dem die Eintragung der Verschmelzung in das Register des Sitzes desjenigen Rechtsträgers, dessen Gläubiger sie sind, als bekannt gemacht gilt, ihren Anspruch nach Grund und Höhe schriftlich anmelden, Sicherheit zu leisten, soweit sie nicht Befriedigung verlangen können. Dieses Recht steht den Gläubigern jedoch nur zu, wenn sie glaubhaft machen, dass durch die Verschmelzung die Erfüllung ihrer Forderung gefährdet wird. Das Recht, Sicherheitsleistung zu verlangen, steht Gläubigern nicht zu, die im Falle der Insolvenz ein Recht auf vorzugsweise Befriedigung aus einer Deckungsmasse haben, die nach gesetzlicher Vorschrift zu ihrem Schutz errichtet und staatlich überwacht ist."
    },
    {
      "date": "2024-11-08",
      "original_text": "Löschungsankündigung\nNordrhein-Westfalen Amtsgericht Essen HRB 31586\nAutomobilgesellschaft IMR CARS mbH – Essen",
      "type": "Löschungsankündigung",
      "state": "Nordrhein-Westfalen",
      "amtsgericht": "Amtsgericht Essen",
      "registernummer": "HRB 31586",
      "registerart": "HRB",
      "company_name": "Automobilgesellschaft IMR CARS mbH",
      "company_seat": "Essen",
      "details": "08.11.2024 (Bekanntmachungsdatum)\n\nNordrhein-Westfalen Amtsgericht Essen HRB 31586\nLöschungsankündigung\n\nAutomobilgesellschaft IMR CARS mbH\nGesellschaft mit beschränkter Haftung\nEssen\n\nDas Registergericht beabsichtigt die Gesellschaft von Amts wegen nach § 394 FamFG zu löschen. Die Frist zur Erhebung eines Widerspruchs ist auf einen Monat festgesetzt."
    },
    {
      "date": "2024-11-08",
      "original_text": "Löschungsankündigung\nRheinland-Pfalz Amtsgericht Ludwigshafen a.Rhein (Ludwigshafen) HRB 65385\nBALENO Service GmbH – Ludwigshafen/Rhein",
      "type": "Löschungsankündigung",
      "state": "Rheinland-Pfalz",
      "amtsgericht": "Amtsgericht Ludwigshafen a.Rhein (Ludwigshafen)",
      "registernummer": "HRB 65385",
      "registerart": "HRB",
      "company_name": "BALENO Service GmbH",
      "company_seat": "Ludwigshafen/Rhein",
      "details": "08.11.2024 (Bekanntmachungsdatum)\n\nRheinland-Pfalz Amtsgericht Ludwigshafen a.Rhein (Ludwigshafen) HRB 65385\nLöschungsankündigung\n\nBALENO Service GmbH\nGesellschaft mit beschränkter Haftung\nLudwigshafen/Rhein\n\nDas Registergericht beabsichtigt die Gesellschaft von Amts wegen nach § 394 FamFG zu löschen. Die Frist zur Erhebung eines Widerspruchs ist auf einen Monat festgesetzt."
    },
    {
      "date": "2024-11-08",
      "original_text": "Einreichung neuer Dokumente\nBerlin Amtsgericht Berlin (Charlottenburg) HRB 38874\nBeta Systems Software Aktiengesellschaft – Berlin",
      "type": "Einreichung neuer Dokumente",
      "state": "Berlin",
      "amtsgericht": "Amtsgericht Berlin (Charlottenburg)",
      "registernummer": "HRB 38874",
      "registerart": "HRB",
      "company_name": "Beta Systems Software Aktiengesellschaft",
      "company_seat": "Berlin",
      "details": "08.11.2024 (Bekanntmachungsdatum)\n\nBerlin Amtsgericht Berlin (Charlottenburg) HRB 38874\nEinreichung neuer Dokumente\n\nBeta Systems Software Aktiengesellschaft\nAktiengesellschaft\nBerlin\n\nAls nicht eingetragen wird veröffentlicht:\nEs wurde eine neue Liste der Aufsichtsratsmitglieder eingereicht (§ 106 AktG)."
    },
    {
      "date": "2024-11-08",
      "original_text": "Löschungsankündigung\nBerlin Amtsgericht Berlin (Charlottenburg) HRB 157325\nBitcoin Europa GmbH – Berlin",
      "type": "Löschungsankündigung",
      "state": "Berlin",
      "amtsgericht": "Amtsgericht Berlin (Charlottenburg)",
      "registernummer": "HRB 157325",
      "registerart": "HRB",
      "company_name": "Bitcoin Europa GmbH",
      "company_seat": "Berlin",
      "details": "08.11.2024 (Bekanntmachungsdatum)\n\nBerlin Amtsgericht Berlin (Charlottenburg) HRB 157325\nLöschungsankündigung\n\nBitcoin Europa GmbH\nGesellschaft mit beschränkter Haftung\nBerlin\n\nBei der nachstehenden Gesellschaft wird das Amtslöschungsverfahren gemäß § 394 FamFG eingeleitet. Widerspruchsfrist 6 Wochen"
    },
    {
      "date": "2024-11-08",
      "original_text": "Registerbekanntmachung nach dem Umwandlungsgesetz\nNordrhein-Westfalen Amtsgericht Wuppertal HRB 28395\nBöhme & Weihs GmbH Industrieholding – Wuppertal",
      "type": "Registerbekanntmachung nach dem Umwandlungsgesetz",
      "state": "Nordrhein-Westfalen",
      "amtsgericht": "Amtsgericht Wuppertal",
      "registernummer": "HRB 28395",
      "registerart": "HRB",
      "company_name": "Böhme & Weihs GmbH Industrieholding",
      "company_seat": "Wuppertal",
      "details": "08.11.2024 (Bekanntmachungsdatum)\n\nNordrhein-Westfalen Amtsgericht Wuppertal HRB 28395\nRegisterbekanntmachung nach dem Umwandlungsgesetz 08.11.2024 (Eintragungsdatum)\n\nBöhme & Weihs GmbH Industrieholding\nGesellschaft mit beschränkter Haftung\nWuppertal\n\nDen Gläubigern der an der Verschmelzung beteiligten Rechtsträger ist, wenn sie binnen sechs Monaten nach dem Tag, an dem die Eintragung der Verschmelzung in das Register des Sitzes desjenigen Rechtsträgers, dessen Gläubiger sie sind, nach § 19 Absatz 3 UmwG als bekanntgemacht gilt, ihren Anspruch nach Grund und Höhe schriftlich anmelden, Sicherheit zu leisten, soweit sie nicht Befriedigung verlangen können. Dieses Recht steht den Gläubigern jedoch nur zu, wenn sie glaubhaft machen, dass durch die Verschmelzung die Erfüllung ihrer Forderung gefährdet wird."
    },
    {
      "date": "2024-11-08",
      "original_text": "Löschungsankündigung\nNordrhein-Westfalen Amtsgericht Gütersloh HRB 6384\nCVC-Camping Van Conversion GmbH – Rheda-Wiedenbrück",
      "type": "Löschungsankündigung",
      "state": "Nordrhein-Westfalen",
      "amtsgericht": "Amtsgericht Gütersloh",
      "registernummer": "HRB 6384",
      "registerart": "HRB",
      "company_name": "CVC-Camping Van Conversion GmbH",
      "company_seat": "Rheda-Wiedenbrück",
      "details": "08.11.2024 (Bekanntmachungsdatum)\n\nNordrhein-Westfalen Amtsgericht Gütersloh HRB 6384\nLöschungsankündigung\n\nCVC-Camping Van Conversion GmbH\nGesellschaft mit beschränkter Haftung\nRheda-Wiedenbrück\n\nDas Registergericht beabsichtigt die Gesellschaft von Amts wegen nach § 394 FamFG zu löschen. Die Frist zur Erhebung eines Widerspruchs ist auf einen Monat festgesetzt."
    },
    {
      "date": "2024-11-08",
      "original_text": "Registerbekanntmachung nach dem Umwandlungsgesetz\nBayern Amtsgericht München HRB 219678\nCampus Hamburg I GmbH – Unterföhring",
      "type": "Registerbekanntmachung nach dem Umwandlungsgesetz",
      "state": "Bayern",
      "amtsgericht": "Amtsgericht München",
      "registernummer": "HRB 219678",
      "registerart": "HRB",
      "company_name": "Campus Hamburg I GmbH",
      "company_seat": "Unterföhring",
      "details": "08.11.2024 (Bekanntmachungsdatum)\n\nBayern Amtsgericht München HRB 219678\nRegisterbekanntmachung nach dem Umwandlungsgesetz\n\nCampus Hamburg I GmbH\nGesellschaft mit beschränkter Haftung\nUnterföhring\n\nEs wird darauf hingewiesen, dass ein Formwechselplan oder sein Entwurf über einen grenzüberschreitenden Formwechsel in die IC Hamburg WDQ S.à r.l. mit Sitz in Luxemburg, Großherzogtum Luxemburg, beim Handelsregister eingereicht worden ist.\nDie Anteilsinhaber, die Gläubiger sowie die zuständigen Betriebsräte der an dem grenzüberschreitenden Formwechsel beteiligten Gesellschaft oder, soweit es keinen Betriebsrat gibt, die Arbeitnehmer der an dem grenzüberschreitenden Formwechsel beteiligten Gesellschaft, können der Gesellschaft spätestens fünf Arbeitstage vor dem Tag der Gesellschafterversammlung am 31.01.2025 Bemerkungen zum Formwechselplan übermitteln."
    },
    {
      "date": "2024-11-08",
      "original_text": "Löschungsankündigung\nNordrhein-Westfalen Amtsgericht Hamm HRB 9210\nClean-Concept UG (haftungsbeschränkt) – Unna",
      "type": "Löschungsankündigung",
      "state": "Nordrhein-Westfalen",
      "amtsgericht": "Amtsgericht Hamm",
      "registernummer": "HRB 9210",
      "registerart": "HRB",
      "company_name": "Clean-Concept UG (haftungsbeschränkt)",
      "company_seat": "Unna",
      "details": "08.11.2024 (Bekanntmachungsdatum)\n\nNordrhein-Westfalen Amtsgericht Hamm HRB 9210\nLöschungsankündigung\n\nClean-Concept UG (haftungsbeschränkt)\nGesellschaft mit beschränkter Haftung\nUnna\n\nDas Registergericht beabsichtigt die Gesellschaft von Amts wegen nach § 394 FamFG zu löschen. Die Frist zur Erhebung eines Widerspruchs ist auf drei Monate festgesetzt."
    },
    {
      "date": "2024-11-08",
      "original_text": "Löschungsankündigung\nBerlin Amtsgericht Berlin (Charlottenburg) HRB 181562\nCroxteth Group GmbH – Berlin",
      "type": "Löschungsankündigung",
      "state": "Berlin",
      "amtsgericht": "Amtsgericht Berlin (Charlottenburg)",
      "registernummer": "HRB 181562",
      "registerart": "HRB",
      "company_name": "Croxteth Group GmbH",
      "company_seat": "Berlin",
      "details": "08.11.2024 (Bekanntmachungsdatum)\n\nBerlin Amtsgericht Berlin (Charlottenburg) HRB 181562\nLöschungsankündigung\n\nCroxteth Group GmbH\nGesellschaft mit beschränkter Haftung\nBerlin\n\nBei der nachstehenden Gesellschaft wird das Amtslöschungsverfahren gemäß § 394 FamFG eingeleitet. Widerspruchsfrist 6 Wochen"
    },
    {
      "date": "2024-11-08",
      "original_text": "Löschungsankündigung\nBayern Amtsgericht München HRB 275953\nDALCI UG (haftungsbeschränkt) – München",
      "type": "Löschungsankündigung",
      "state": "Bayern",
      "amtsgericht": "Amtsgericht München",
      "registernummer": "HRB 275953",
      "registerart": "HRB",
      "company_name": "DALCI UG (haftungsbeschränkt)",
      "company_seat": "München",
      "details": "08.11.2024 (Bekanntmachungsdatum)\n\nBayern Amtsgericht München HRB 275953\nLöschungsankündigung 07.11.2024 (Eintragungsdatum)\n\nDALCI UG (haftungsbeschränkt)\nGesellschaft mit beschränkter Haftung\nMünchen\n\nDas Registergericht beabsichtigt, die im Handelsregister eingetragene Gesellschaft wegen Vermögenslosigkeit von Amts wegen nach § 394 FamFG zu löschen. Die Frist zur Erhebung eines Widerspruchs ist auf drei Monate festgesetzt."
    },
    {
      "date": "2024-11-08",
      "original_text": "Löschungsankündigung\nNiedersachsen Amtsgericht Tostedt HRB 209649\nDOCK Holzbau und Dachdeckerei UG (haftungsbeschränkt) – Stade",
      "type": "Löschungsankündigung",
      "state": "Niedersachsen",
      "amtsgericht": "Amtsgericht Tostedt",
      "registernummer": "HRB 209649",
      "registerart": "HRB",
      "company_name": "DOCK Holzbau und Dachdeckerei UG (haftungsbeschränkt)",
      "company_seat": "Stade",
      "details": "08.11.2024 (Bekanntmachungsdatum)\n\nNiedersachsen Amtsgericht Tostedt HRB 209649\nLöschungsankündigung 08.11.2024 (Eintragungsdatum)\n\nDOCK Holzbau und Dachdeckerei UG (haftungsbeschränkt)\nGesellschaft mit beschränkter Haftung\nStade\n\nDas Registergericht beabsichtigt, die Gesellschaft von Amts wegen nach § 394 FamFG zu löschen. Die Frist zur Erhebung eines Widerspruchs ist auf 1 Monat ab dieser Registerbekanntmachung festgesetzt."
    },
    {
      "date": "2024-11-08",
      "original_text": "Löschungsankündigung\nBaden-Württemberg Amtsgericht Mannheim HRB 708112\nDUMA GmbH Dach und Maler Technik – Karlsruhe",
      "type": "Löschungsankündigung",
      "state": "Baden-Württemberg",
      "amtsgericht": "Amtsgericht Mannheim",
      "registernummer": "HRB 708112",
      "registerart": "HRB",
      "company_name": "DUMA GmbH Dach und Maler Technik",
      "company_seat": "Karlsruhe",
      "details": "08.11.2024 (Bekanntmachungsdatum)\n\nBaden-Württemberg Amtsgericht Mannheim HRB 708112\nLöschungsankündigung\n\nDUMA GmbH Dach und Maler Technik\nGesellschaft mit beschränkter Haftung\nKarlsruhe\n\nDas Gericht beabsichtigt, die Gesellschaft wegen Vermögenslosigkeit im Handelsregister von Amts wegen nach § 394 FamFG zu löschen. Die Frist zur Geltendmachung eines Widerspruchs gegen die beabsichtigte Löschung ist auf einen Monat ab Veröffentlichung bestimmt."
    },
    {
      "date": "2024-11-08",
      "original_text": "Löschungsankündigung\nBaden-Württemberg Amtsgericht Mannheim HRB 750126\nDelta Bauunternehmung GmbH – Pforzheim",
      "type": "Löschungsankündigung",
      "state": "Baden-Württemberg",
      "amtsgericht": "Amtsgericht Mannheim",
      "registernummer": "HRB 750126",
      "registerart": "HRB",
      "company_name": "Delta Bauunternehmung GmbH",
      "company_seat": "Pforzheim",
      "details": "08.11.2024 (Bekanntmachungsdatum)\n\nBaden-Württemberg Amtsgericht Mannheim HRB 750126\nLöschungsankündigung\n\nDelta Bauunternehmung GmbH\nGesellschaft mit beschränkter Haftung\nPforzheim\n\nDas Gericht beabsichtigt, die Gesellschaft wegen Vermögenslosigkeit im Handelsregister von Amts wegen nach § 394 FamFG zu löschen. Die Frist zur Geltendmachung eines Widerspruchs gegen die beabsichtigte Löschung ist auf einen Monat ab Veröffentlichung bestimmt."
    },
    {
      "date": "2024-11-08",
      "original_text": "Registerbekanntmachung nach dem Umwandlungsgesetz\nRheinland-Pfalz Amtsgericht Ludwigshafen a.Rhein (Ludwigshafen) HRB 63928\nDeufol Südwest GmbH – Frankenthal",
      "type": "Registerbekanntmachung nach dem Umwandlungsgesetz",
      "state": "Rheinland-Pfalz",
      "amtsgericht": "Amtsgericht Ludwigshafen a.Rhein (Ludwigshafen)",
      "registernummer": "HRB 63928",
      "registerart": "HRB",
      "company_name": "Deufol Südwest GmbH",
      "company_seat": "Frankenthal",
      "details": "08.11.2024 (Bekanntmachungsdatum)\n\nRheinland-Pfalz Amtsgericht Ludwigshafen a.Rhein (Ludwigshafen) HRB 63928\nRegisterbekanntmachung nach dem Umwandlungsgesetz 08.11.2024 (Eintragungsdatum)\n\nDeufol Südwest GmbH\nGesellschaft mit beschränkter Haftung\nFrankenthal\n\nAls nicht eingetragen wird veröffentlicht: Den Gläubigern der an der Spaltung beteiligten Rechtsträger ist, wenn sie binnen sechs Monaten nach dem Tag, an dem die Eintragung der Spaltung in das Register des Sitzes desjenigen Rechtsträgers, dessen Gläubiger sie sind, nach § 19 Abs. 3 UmwG als bekanntgemacht gilt, ihren Anspruch nach Grund und Höhe schriftlich anmelden, Sicherheit zu leisten, soweit sie nicht Befriedigung verlangen können. Dieses Recht steht den Gläubigern jedoch nur zu, wenn sie glaubhaft machen, dass durch die Spaltung die Erfüllung der Forderung gefährdet wird."
    },
    {
      "date": "2024-11-08",
      "original_text": "Registerbekanntmachung nach dem Umwandlungsgesetz\nBaden-Württemberg Amtsgericht Mannheim HRB 752565\nDirk Hartmann Garten- und Landschaftsbau GmbH – Wurmberg",
      "type": "Registerbekanntmachung nach dem Umwandlungsgesetz",
      "state": "Baden-Württemberg",
      "amtsgericht": "Amtsgericht Mannheim",
      "registernummer": "HRB 752565",
      "registerart": "HRB",
      "company_name": "Dirk Hartmann Garten- und Landschaftsbau GmbH",
      "company_seat": "Wurmberg",
      "details": "08.11.2024 (Bekanntmachungsdatum)\n\nBaden-Württemberg Amtsgericht Mannheim HRB 752565\nRegisterbekanntmachung nach dem Umwandlungsgesetz 08.11.2024 (Eintragungsdatum)\n\nDirk Hartmann Garten- und Landschaftsbau GmbH\nGesellschaft mit beschränkter Haftung\nWurmberg\n\nDen Gläubigern der an der Ausgliederung beteiligten Rechtsträger ist, wenn sie binnen sechs Monaten nach dem Tag, an dem die Eintragung der Ausgliederung in das Register des Sitzes desjenigen Rechtsträgers, dessen Gläubiger sie sind, nach § 19 Abs. 3 UmwG als bekanntgemacht gilt, ihren Anspruch nach Grund und Höhe schriftlich anmelden, Sicherheit zu leisten, soweit sie nicht Befriedigung verlangen können. Dieses Recht steht den Gläubigern jedoch nur zu, wenn sie glaubhaft machen, dass durch die Ausgliederung die Erfüllung ihrer Forderung gefährdet wird."
    },
    {
      "date": "2024-11-08",
      "original_text": "Registerbekanntmachung nach dem Umwandlungsgesetz\nBaden-Württemberg Amtsgericht Mannheim HRA 711988\nDirk Hartmann Garten- und Landschaftsbau e.K. – Wurmberg",
      "type": "Registerbekanntmachung nach dem Umwandlungsgesetz",
      "state": "Baden-Württemberg",
      "amtsgericht": "Amtsgericht Mannheim",
      "registernummer": "HRA 711988",
      "registerart": "HRA",
      "company_name": "Dirk Hartmann Garten- und Landschaftsbau e.K.",
      "company_seat": "Wurmberg",
      "details": "08.11.2024 (Bekanntmachungsdatum)\n\nBaden-Württemberg Amtsgericht Mannheim HRA 711988\nRegisterbekanntmachung nach dem Umwandlungsgesetz 08.11.2024 (Eintragungsdatum)\n\nDirk Hartmann Garten- und Landschaftsbau e.K.\nEinzelkaufmann / Einzelkauffrau\nWurmberg\n\nAls nicht eingetragen wird bekanntgemacht:\nDen Gläubigern der an der Ausgliederung beteiligten Rechtsträger ist, wenn sie binnen sechs Monaten nach dem Tag, an dem die Eintragung der Ausgliederung in das Register des Sitzes desjenigen Rechtsträgers, dessen Gläubiger sie sind, nach § 19 Abs. 3 UmwG als bekanntgemacht gilt, ihren Anspruch nach Grund und Höhe schriftlich anmelden, Sicherheit zu leisten, soweit sie nicht Befriedigung verlangen können. Dieses Recht steht den Gläubigern jedoch nur zu, wenn sie glaubhaft machen, dass durch die Ausgliederung die Erfüllung ihrer Forderung gefährdet wird."
    },
    {
      "date": "2024-11-08",
      "original_text": "Registerbekanntmachung nach dem Umwandlungsgesetz\nHessen Amtsgericht Korbach HRA 1905\nDr. Eberhard Enß e. K. – Korbach",
      "type": "Registerbekanntmachung nach dem Umwandlungsgesetz",
      "state": "Hessen",
      "amtsgericht": "Amtsgericht Korbach",
      "registernummer": "HRA 1905",
      "registerart": "HRA",
      "company_name": "Dr. Eberhard Enß e. K.",
      "company_seat": "Korbach",
      "details": "08.11.2024 (Bekanntmachungsdatum)\n\nHessen Amtsgericht Korbach HRA 1905\nRegisterbekanntmachung nach dem Umwandlungsgesetz 08.11.2024 (Eintragungsdatum)\n\nDr. Eberhard Enß e. K.\nEinzelkaufmann / Einzelkauffrau\nKorbach\n\nDen Gläubigern der an der Verschmelzung beteiligten Rechtsträger ist, wenn sie binnen sechs Monaten nach dem Tag, an dem die Eintragung der Verschmelzung in das Register des Sitzes desjenigen Rechtsträgers, dessen Gläubiger sie sind, nach § 19 Absatz 3 UmwG bekannt gemacht worden ist, ihren Anspruch nach Grund und Höhe schriftlich anmelden, Sicherheit zu leisten, soweit sie nicht Befriedigung verlangen können. Dieses Recht steht den Gläubigern jedoch nur zu, wenn sie glaubhaft machen, dass durch die Verschmelzung die Erfüllung ihrer Forderung gefährdet wird."
    },
    {
      "date": "2024-11-08",
      "original_text": "Registerbekanntmachung nach dem Umwandlungsgesetz\nNordrhein-Westfalen Amtsgericht Münster HRB 9865\nDrepper & Brüggen GmbH – Münster",
      "type": "Registerbekanntmachung nach dem Umwandlungsgesetz",
      "state": "Nordrhein-Westfalen",
      "amtsgericht": "Amtsgericht Münster",
      "registernummer": "HRB 9865",
      "registerart": "HRB",
      "company_name": "Drepper & Brüggen GmbH",
      "company_seat": "Münster",
      "details": "08.11.2024 (Bekanntmachungsdatum)\n\nNordrhein-Westfalen Amtsgericht Münster HRB 9865\nRegisterbekanntmachung nach dem Umwandlungsgesetz 08.11.2024 (Eintragungsdatum)\n\nDrepper & Brüggen GmbH\nGesellschaft mit beschränkter Haftung\nMünster\n\nDen Gläubigern der an der Verschmelzung beteiligten Rechtsträger ist, wenn sie binnen sechs Monaten nach dem Tag, an dem die Eintragung der Verschmelzung in das Register des Sitzes desjenigen Rechtsträgers, dessen Gläubiger sie sind, nach § 19 Absatz 3 UmwG als bekanntgemacht gilt, ihren Anspruch nach Grund und Höhe schriftlich anmelden, Sicherheit zu leisten, soweit sie nicht Befriedigung verlangen können. Dieses Recht steht den Gläubigern jedoch nur zu, wenn sie glaubhaft machen, dass durch die Verschmelzung die Erfüllung ihrer Forderung gefährdet wird."
    },
    {
      "date": "2024-11-08",
      "original_text": "Löschungsankündigung\nRheinland-Pfalz Amtsgericht Ludwigshafen a.Rhein (Ludwigshafen) HRB 63953\nEASY - FRUIT GmbH – Schifferstadt",
      "type": "Löschungsankündigung",
      "state": "Rheinland-Pfalz",
      "amtsgericht": "Amtsgericht Ludwigshafen a.Rhein (Ludwigshafen)",
      "registernummer": "HRB 63953",
      "registerart": "HRB",
      "company_name": "EASY - FRUIT GmbH",
      "company_seat": "Schifferstadt",
      "details": "08.11.2024 (Bekanntmachungsdatum)\n\nRheinland-Pfalz Amtsgericht Ludwigshafen a.Rhein (Ludwigshafen) HRB 63953\nLöschungsankündigung\n\nEASY - FRUIT GmbH\nGesellschaft mit beschränkter Haftung\nSchifferstadt\n\nDas Registergericht beabsichtigt die Gesellschaft von Amts wegen nach § 394 FamFG zu löschen. Die Frist zur Erhebung eines Widerspruchs ist auf einen Monat festgesetzt."
    },
    {
      "date": "2024-11-08",
      "original_text": "Einreichung neuer Dokumente\nBayern Amtsgericht München HRB 118140\nEOS Holding Aktiengesellschaft – Krailling",
      "type": "Einreichung neuer Dokumente",
      "state": "Bayern",
      "amtsgericht": "Amtsgericht München",
      "registernummer": "HRB 118140",
      "registerart": "HRB",
      "company_name": "EOS Holding Aktiengesellschaft",
      "company_seat": "Krailling",
      "details": "08.11.2024 (Bekanntmachungsdatum)\n\nBayern Amtsgericht München HRB 118140\nEinreichung neuer Dokumente 07.11.2024 (Eintragungsdatum)\n\nEOS Holding Aktiengesellschaft\nAktiengesellschaft\nKrailling\n\nDem Amtsgericht München -Registergericht- ist eine Liste der Mitglieder des Aufsichtsrats eingereicht worden, § 106 AktG."
    },
    {
      "date": "2024-11-08",
      "original_text": "Registerbekanntmachung nach dem Umwandlungsgesetz\nBaden-Württemberg Amtsgericht Mannheim HRB 726471\nEPPLEZWEI Alpha GmbH – Baden-Baden",
      "type": "Registerbekanntmachung nach dem Umwandlungsgesetz",
      "state": "Baden-Württemberg",
      "amtsgericht": "Amtsgericht Mannheim",
      "registernummer": "HRB 726471",
      "registerart": "HRB",
      "company_name": "EPPLEZWEI Alpha GmbH",
      "company_seat": "Baden-Baden",
      "details": "08.11.2024 (Bekanntmachungsdatum)\n\nBaden-Württemberg Amtsgericht Mannheim HRB 726471\nRegisterbekanntmachung nach dem Umwandlungsgesetz 08.11.2024 (Eintragungsdatum)\n\nEPPLEZWEI Alpha GmbH\nGesellschaft mit beschränkter Haftung\nBaden-Baden\n\nDen Gläubigern der an der Verschmelzung beteiligten Rechtsträger ist, wenn sie binnen sechs Monaten nach dem Tag, an dem die Eintragung der Verschmelzung in das Register des Sitzes desjenigen Rechtsträgers, dessen Gläubiger sie sind, nach § 19 Abs. 3 UmwG als bekanntgemacht gilt, ihren Anspruch nach Grund und Höhe schriftlich anmelden, Sicherheit zu leisten, soweit sie nicht Befriedigung verlangen können. Dieses Recht steht den Gläubigern jedoch nur zu, wenn sie glaubhaft machen, dass durch die Verschmelzung die Erfüllung ihrer Forderung gefährdet wird."
    },
    {
      "date": "2024-11-08",
      "original_text": "Registerbekanntmachung nach dem Umwandlungsgesetz\nBaden-Württemberg Amtsgericht Ulm HRB 748852\nEhrlich Family GmbH – Bad Wurzach",
      "type": "Registerbekanntmachung nach dem Umwandlungsgesetz",
      "state": "Baden-Württemberg",
      "amtsgericht": "Amtsgericht Ulm",
      "registernummer": "HRB 748852",
      "registerart": "HRB",
      "company_name": "Ehrlich Family GmbH",
      "company_seat": "Bad Wurzach",
      "details": "08.11.2024 (Bekanntmachungsdatum)\n\nBaden-Württemberg Amtsgericht Ulm HRB 748852\nRegisterbekanntmachung nach dem Umwandlungsgesetz 08.11.2024 (Eintragungsdatum)\n\nEhrlich Family GmbH\nGesellschaft mit beschränkter Haftung\nBad Wurzach\n\nAls nicht eingetragen wird bekanntgemacht:\nDen Gläubigern des an dem Formwechsel beteiligten Rechtsträgers ist, wenn sie binnen sechs Monaten nach dem Tag, an dem die Eintragung des Formwechsels in das Register des Sitzes desjenigen Rechtsträgers, dessen Gläubiger sie sind, nach § 19 Abs. 3 UmwG als bekanntgemacht gilt, ihren Anspruch nach Grund und Höhe schriftlich anmelden, Sicherheit zu leisten, soweit sie nicht Befriedigung verlangen können. Dieses Recht steht den Gläubigern jedoch nur zu, wenn sie glaubhaft machen, dass durch den Formwechsel die Erfüllung ihrer Forderung gefährdet wird."
    },
    {
      "date": "2024-11-08",
      "original_text": "Registerbekanntmachung nach dem Umwandlungsgesetz\nSachsen Amtsgericht Chemnitz HRA 10102\nEisenbahnlogistik Fritz Hessel e.K. – Meerane",
      "type": "Registerbekanntmachung nach dem Umwandlungsgesetz",
      "state": "Sachsen",
      "amtsgericht": "Amtsgericht Chemnitz",
      "registernummer": "HRA 10102",
      "registerart": "HRA",
      "company_name": "Eisenbahnlogistik Fritz Hessel e.K.",
      "company_seat": "Meerane",
      "details": "08.11.2024 (Bekanntmachungsdatum)\n\nSachsen Amtsgericht Chemnitz HRA 10102\nRegisterbekanntmachung nach dem Umwandlungsgesetz 08.11.2024 (Eintragungsdatum)\n\nEisenbahnlogistik Fritz Hessel e.K.\nEinzelkaufmann / Einzelkauffrau\nMeerane\n\nDen Gläubigern der an der Ausgliederung beteiligten Rechtsträger ist, wenn sie binnen sechs Monaten nach dem Tag, an dem die Eintragung der Ausgliederung in das Register des Sitzes desjenigen Rechtsträgers, dessen Gläubiger sie sind, nach § 19 Abs. 3 UmwG als bekannt gemacht gilt, ihren Anspruch nach Grund und Höhe schriftlich anmelden, Sicherheit zu leisten, soweit sie nicht Befriedigung verlangen können. Dieses Recht steht den Gläubigern jedoch nur zu, wenn sie glaubhaft machen, dass durch die Ausgliederung die Erfüllung der Forderung gefährdet wird."
    },
    {
      "date": "2024-11-08",
      "original_text": "Einreichung neuer Dokumente\nBayern Amtsgericht Fürth HRB 4886\nElektrobit Automotive GmbH – Erlangen",
      "type": "Einreichung neuer Dokumente",
      "state": "Bayern",
      "amtsgericht": "Amtsgericht Fürth",
      "registernummer": "HRB 4886",
      "registerart": "HRB",
      "company_name": "Elektrobit Automotive GmbH",
      "company_seat": "Erlangen",
      "details": "08.11.2024 (Bekanntmachungsdatum)\n\nBayern Amtsgericht Fürth HRB 4886\nEinreichung neuer Dokumente\n\nElektrobit Automotive GmbH\nGesellschaft mit beschränkter Haftung\nErlangen\n\nDem Amtsgericht Fürth -Registergericht- ist eine Liste der Mitglieder des Aufsichtsrats eingereicht worden, § 52 Abs. 3 S. 2 GmbHG."
    },
    {
      "date": "2024-11-08",
      "original_text": "Einreichung neuer Dokumente\nSaarland Amtsgericht Saarbrücken HRB 104671\nErneuerbare Energien Gesellschaft Dillingen/Saar mbH – Dillingen",
      "type": "Einreichung neuer Dokumente",
      "state": "Saarland",
      "amtsgericht": "Amtsgericht Saarbrücken",
      "registernummer": "HRB 104671",
      "registerart": "HRB",
      "company_name": "Erneuerbare Energien Gesellschaft Dillingen/Saar mbH",
      "company_seat": "Dillingen",
      "details": "08.11.2024 (Bekanntmachungsdatum)\n\nSaarland Amtsgericht Saarbrücken HRB 104671\nEinreichung neuer Dokumente\n\nErneuerbare Energien Gesellschaft Dillingen/Saar mbH\nGesellschaft mit beschränkter Haftung\nDillingen\n\nDie Geschäftsführung der Gesellschaft hat eine Liste der Mitglieder des Aufsichtsrats zum Handelsregister eingereicht (§ 52 Abs. 3 Satz 2 GmbHG)."
    },
    {
      "date": "2024-11-08",
      "original_text": "Löschungsankündigung\nNordrhein-Westfalen Amtsgericht Mönchengladbach HRB 13795\nFRED&GO UG (haftungsbeschränkt) – Niederkrüchten",
      "type": "Löschungsankündigung",
      "state": "Nordrhein-Westfalen",
      "amtsgericht": "Amtsgericht Mönchengladbach",
      "registernummer": "HRB 13795",
      "registerart": "HRB",
      "company_name": "FRED&GO UG (haftungsbeschränkt)",
      "company_seat": "Niederkrüchten",
      "details": "08.11.2024 (Bekanntmachungsdatum)\n\nNordrhein-Westfalen Amtsgericht Mönchengladbach HRB 13795\nLöschungsankündigung\n\nFRED&GO UG (haftungsbeschränkt)\nGesellschaft mit beschränkter Haftung\nNiederkrüchten\n\nFRED&GO UG (haftungsbeschränkt), Niederkrüchten (Amtsgericht Mönchengladbach, HRB 13795)\nDas Registergericht beabsichtigt, die im Handelsregister eingetragene Gesellschaft gemäß § 394 Absatz 1 FamFG wegen Vermögenslosigkeit von Amts wegen zu löschen. Gegen diese Verfügung kann Widerspruch eingelegt werden. Die Frist zur Erhebung eines Widerspruchs gegen die beabsichtigte Löschung von Amts wegen ist auf drei Monate festgesetzt."
    },
    {
      "date": "2024-11-08",
      "original_text": "Registerbekanntmachung nach dem Umwandlungsgesetz\nBerlin Amtsgericht Berlin (Charlottenburg) HRB 227893\nFT C2C GmbH – Berlin",
      "type": "Registerbekanntmachung nach dem Umwandlungsgesetz",
      "state": "Berlin",
      "amtsgericht": "Amtsgericht Berlin (Charlottenburg)",
      "registernummer": "HRB 227893",
      "registerart": "HRB",
      "company_name": "FT C2C GmbH",
      "company_seat": "Berlin",
      "details": "08.11.2024 (Bekanntmachungsdatum)\n\nBerlin Amtsgericht Berlin (Charlottenburg) HRB 227893\nRegisterbekanntmachung nach dem Umwandlungsgesetz 07.11.2024 (Eintragungsdatum)\n\nFT C2C GmbH\nGesellschaft mit beschränkter Haftung\nBerlin\n\nZu Eintragungsnummer 3 vom 07.11.2024 jeweils wird als nicht eingetragen veröffentlicht:\nDen Gläubigern der an der Verschmelzung beteiligten Rechtsträger ist, wenn sie binnen sechs Monaten nach dem Tag, an dem die Eintragung der Verschmelzung in das Register des Sitzes desjenigen Rechtsträgers, dessen Gläubiger sie sind, als bekannt gemacht gilt, ihren Anspruch nach Grund und Höhe schriftlich anmelden, Sicherheit zu leisten, soweit sie nicht Befriedigung verlangen können. Dieses Recht steht den Gläubigern jedoch nur zu, wenn sie glaubhaft machen, dass durch die Verschmelzung die Erfüllung ihrer Forderung gefährdet wird. Das Recht, Sicherheitsleistung zu verlangen, steht Gläubigern nicht zu, die im Falle der Insolvenz ein Recht auf vorzugsweise Befriedigung aus einer Deckungsmasse haben, die nach gesetzlicher Vorschrift zu ihrem Schutz errichtet und staatlich überwacht ist."
    },
    {
      "date": "2024-11-08",
      "original_text": "Registerbekanntmachung nach dem Umwandlungsgesetz\nBerlin Amtsgericht Berlin (Charlottenburg) HRB 233993\nFT Recycling GmbH – Berlin",
      "type": "Registerbekanntmachung nach dem Umwandlungsgesetz",
      "state": "Berlin",
      "amtsgericht": "Amtsgericht Berlin (Charlottenburg)",
      "registernummer": "HRB 233993",
      "registerart": "HRB",
      "company_name": "FT Recycling GmbH",
      "company_seat": "Berlin",
      "details": "08.11.2024 (Bekanntmachungsdatum)\n\nBerlin Amtsgericht Berlin (Charlottenburg) HRB 233993\nRegisterbekanntmachung nach dem Umwandlungsgesetz 07.11.2024 (Eintragungsdatum)\n\nFT Recycling GmbH\nGesellschaft mit beschränkter Haftung\nBerlin\n\nZu Eintragungsnummer 3 vom 07.11.2024 wird als nicht eingetragen veröffentlicht:\nDen Gläubigern der an der Verschmelzung beteiligten Rechtsträger ist, wenn sie binnen sechs Monaten nach dem Tag, an dem die Eintragung der Verschmelzung in das Register des Sitzes desjenigen Rechtsträgers, dessen Gläubiger sie sind, als bekannt gemacht gilt, ihren Anspruch nach Grund und Höhe schriftlich anmelden, Sicherheit zu leisten, soweit sie nicht Befriedigung verlangen können. Dieses Recht steht den Gläubigern jedoch nur zu, wenn sie glaubhaft machen, dass durch die Verschmelzung die Erfüllung ihrer Forderung gefährdet wird. Das Recht, Sicherheitsleistung zu verlangen, steht Gläubigern nicht zu, die im Falle der Insolvenz ein Recht auf vorzugsweise Befriedigung aus einer Deckungsmasse haben, die nach gesetzlicher Vorschrift zu ihrem Schutz errichtet und staatlich überwacht ist."
    },
    {
      "date": "2024-11-08",
      "original_text": "Registerbekanntmachung nach dem Umwandlungsgesetz\nHessen Amtsgericht Kassel HRA 18374\nFrau Schwardtmann, Inhaberin Iris Schwardtmann e.K. – Kassel",
      "type": "Registerbekanntmachung nach dem Umwandlungsgesetz",
      "state": "Hessen",
      "amtsgericht": "Amtsgericht Kassel",
      "registernummer": "HRA 18374",
      "registerart": "HRA",
      "company_name": "Frau Schwardtmann, Inhaberin Iris Schwardtmann e.K.",
      "company_seat": "Kassel",
      "details": "08.11.2024 (Bekanntmachungsdatum)\n\nHessen Amtsgericht Kassel HRA 18374\nRegisterbekanntmachung nach dem Umwandlungsgesetz 08.11.2024 (Eintragungsdatum)\n\nFrau Schwardtmann, Inhaberin Iris Schwardtmann e.K.\nEinzelkaufmann / Einzelkauffrau\nKassel\n\nDen Gläubigern der an der Verschmelzung beteiligten Rechtsträger ist, wenn sie binnen sechs Monaten nach dem Tag, an dem die Eintragung der Verschmelzung in das Register des Sitzes desjenigen Rechtsträgers, dessen Gläubiger sie sind, nach § 19 Absatz 3 UmwG bekannt gemacht worden ist, ihren Anspruch nach Grund und Höhe schriftlich anmelden, Sicherheit zu leisten, soweit sie nicht Befriedigung verlangen können. Dieses Recht steht den Gläubigern jedoch nur zu, wenn sie glaubhaft machen, dass durch die Verschmelzung die Erfüllung ihrer Forderung gefährdet wird."
    },
    {
      "date": "2024-11-08",
      "original_text": "Löschungsankündigung\nBrandenburg Amtsgericht Frankfurt/Oder HRB 15895\nGPW Media Auto UG (haftungsbeschränkt) – Frankfurt (Oder)",
      "type": "Löschungsankündigung",
      "state": "Brandenburg",
      "amtsgericht": "Amtsgericht Frankfurt/Oder",
      "registernummer": "HRB 15895",
      "registerart": "HRB",
      "company_name": "GPW Media Auto UG (haftungsbeschränkt)",
      "company_seat": "Frankfurt (Oder)",
      "details": "08.11.2024 (Bekanntmachungsdatum)\n\nBrandenburg Amtsgericht Frankfurt/Oder HRB 15895\nLöschungsankündigung\n\nGPW Media Auto UG (haftungsbeschränkt)\nGesellschaft mit beschränkter Haftung\nFrankfurt (Oder)\n\nBei der nachstehenden Gesellschaft wird das Amtslöschungsverfahren gemäß § 394 Abs. 1 FamFG eingeleitet."
    },
    {
      "date": "2024-11-08",
      "original_text": "Einreichung neuer Dokumente\nBayern Amtsgericht München HRB 250638\nGenerali Deutschland Versicherung AG – München",
      "type": "Einreichung neuer Dokumente",
      "state": "Bayern",
      "amtsgericht": "Amtsgericht München",
      "registernummer": "HRB 250638",
      "registerart": "HRB",
      "company_name": "Generali Deutschland Versicherung AG",
      "company_seat": "München",
      "details": "08.11.2024 (Bekanntmachungsdatum)\n\nBayern Amtsgericht München HRB 250638\nEinreichung neuer Dokumente 01.10.2024 (Eintragungsdatum)\n\nGenerali Deutschland Versicherung AG\nAktiengesellschaft\nMünchen\n\nDem Amtsgericht München -Registergericht- ist eine Liste der Mitglieder des Aufsichtsrats eingereicht worden, § 106 AktG."
    },
    {
      "date": "2024-11-08",
      "original_text": "Löschungsankündigung\nNordrhein-Westfalen Amtsgericht Gütersloh HRB 2806\nH&S Druckgesellschaft mbH – Gütersloh",
      "type": "Löschungsankündigung",
      "state": "Nordrhein-Westfalen",
      "amtsgericht": "Amtsgericht Gütersloh",
      "registernummer": "HRB 2806",
      "registerart": "HRB",
      "company_name": "H&S Druckgesellschaft mbH",
      "company_seat": "Gütersloh",
      "details": "08.11.2024 (Bekanntmachungsdatum)\n\nNordrhein-Westfalen Amtsgericht Gütersloh HRB 2806\nLöschungsankündigung 08.11.2024 (Eintragungsdatum)\n\nH&S Druckgesellschaft mbH\nGesellschaft mit beschränkter Haftung\nGütersloh\n\nDas Registergericht beabsichtigt die Gesellschaft von Amts wegen nach § 394 FamFG zu löschen. Die Frist zur Erhebung eines Widerspruchs ist auf einen Monat festgesetzt."
    },
    {
      "date": "2024-11-08",
      "original_text": "Einreichung neuer Dokumente\nSachsen-Anhalt Amtsgericht Stendal HRB 105496\nHVG Halberstädter Verkehrs GmbH – Halberstadt",
      "type": "Einreichung neuer Dokumente",
      "state": "Sachsen-Anhalt",
      "amtsgericht": "Amtsgericht Stendal",
      "registernummer": "HRB 105496",
      "registerart": "HRB",
      "company_name": "HVG Halberstädter Verkehrs GmbH",
      "company_seat": "Halberstadt",
      "details": "08.11.2024 (Bekanntmachungsdatum)\n\nSachsen-Anhalt Amtsgericht Stendal HRB 105496\nEinreichung neuer Dokumente\n\nHVG Halberstädter Verkehrs GmbH\nGesellschaft mit beschränkter Haftung\nHalberstadt\n\nEine Liste der Mitglieder des Aufsichtsrates wurde zum Handelsregister eingereicht."
    },
    {
      "date": "2024-11-08",
      "original_text": "Sonstige Registerbekanntmachung\nSchleswig-Holstein Amtsgericht Lübeck HRB 20364\nHausmeisterservice Schönberg UG (haftungsbeschränkt) – Schönberg",
      "type": "Sonstige Registerbekanntmachung",
      "state": "Schleswig-Holstein",
      "amtsgericht": "Amtsgericht Lübeck",
      "registernummer": "HRB 20364",
      "registerart": "HRB",
      "company_name": "Hausmeisterservice Schönberg UG (haftungsbeschränkt)",
      "company_seat": "Schönberg",
      "details": "08.11.2024 (Bekanntmachungsdatum)\n\nSchleswig-Holstein Amtsgericht Lübeck HRB 20364\nSonstige Registerbekanntmachung\n\nHausmeisterservice Schönberg UG (haftungsbeschränkt)\nGesellschaft mit beschränkter Haftung\nSchönberg\n\nAls nicht eingetragen wird veröffentlicht:\nIn der Handelsregistersache der\n\nHausmeisterservice Schönberg UG (haftungsbeschränkt)\n\nergeben sich Anhaltspunkte dafür, dass die Gesellschaft, als deren Geschäftsführer Herr Serhii Bevz, letzter bekannter Wohnort: Schönberg eingetragen ist, vermögenslos ist:\n\nDas Registergericht beabsichtigt daher, die Gesellschaft wegen Vermögenslosigkeit gemäß § 394 FamFG zu löschen.\n\nEs wird eine Frist von zwei Monaten zur Geltendmachung eines Widerspruchs gegen die Löschung, § 394 Abs. 2 S. 1 FamFG bestimmt.\n\nNach Fristablauf ohne Widerspruch wird die Gesellschaft gelöscht.\n\nGärtner\nDipl.-Rechtspflegerin (FH)"
    },
    {
      "date": "2024-11-08",
      "original_text": "Löschungsankündigung\nBayern Amtsgericht Nürnberg HRB 22672\nHosemann GmbH – Nürnberg",
      "type": "Löschungsankündigung",
      "state": "Bayern",
      "amtsgericht": "Amtsgericht Nürnberg",
      "registernummer": "HRB 22672",
      "registerart": "HRB",
      "company_name": "Hosemann GmbH",
      "company_seat": "Nürnberg",
      "details": "08.11.2024 (Bekanntmachungsdatum)\n\nBayern Amtsgericht Nürnberg HRB 22672\nLöschungsankündigung\n\nHosemann GmbH\nGesellschaft mit beschränkter Haftung\nNürnberg\n\nDas Registergericht beabsichtigt, die im Handelsregister eingetragene Gesellschaft wegen Vermögenslosigkeit von Amts wegen nach § 394 FamFG zu löschen. Die Frist zur Erhebung eines Widerspruchs ist auf einen Monat festgesetzt."
    },
    {
      "date": "2024-11-08",
      "original_text": "Registerbekanntmachung nach dem Umwandlungsgesetz\nNordrhein-Westfalen Amtsgericht Dortmund HRA 14921 früher Amtsgericht Lünen\nHufnagel e.K. Inhaber Stefan Sattler – Lünen",
      "type": "Registerbekanntmachung nach dem Umwandlungsgesetz",
      "state": "Nordrhein-Westfalen",
      "amtsgericht": "Amtsgericht Dortmund",
      "registernummer": "HRA 14921",
      "registerart": "HRA",
      "company_name": "Hufnagel e.K. Inhaber Stefan Sattler",
      "company_seat": "Lünen",
      "former_amtsgericht": "Lünen",
      "details": "08.11.2024 (Bekanntmachungsdatum)\n\nNordrhein-Westfalen Amtsgericht Dortmund HRA 14921 früher Amtsgericht Lünen\nRegisterbekanntmachung nach dem Umwandlungsgesetz 08.11.2024 (Eintragungsdatum)\n\nHufnagel e.K. Inhaber Stefan Sattler\nEinzelkaufmann / Einzelkauffrau\nLünen\n\nDen Gläubigern der an der Verschmelzung beteiligten Rechtsträger ist, wenn sie binnen sechs Monaten nach dem Tag, an dem die Eintragung der Verschmelzung in das Register des Sitzes desjenigen Rechtsträgers, dessen Gläubiger sie sind, nach § 19 Absatz 3 UmwG als bekanntgemacht gilt, ihren Anspruch nach Grund und Höhe schriftlich anmelden, Sicherheit zu leisten, soweit sie nicht Befriedigung verlangen können. Dieses Recht steht den Gläubigern jedoch nur zu, wenn sie glaubhaft machen, dass durch die Verschmelzung die Erfüllung ihrer Forderung gefährdet wird."
    },
    {
      "date": "2024-11-08",
      "original_text": "Registerbekanntmachung nach dem Umwandlungsgesetz\nNordrhein-Westfalen Amtsgericht Münster HRB 22084\nIB Special Purpose UG (haftungsbeschränkt) – Münster",
      "type": "Registerbekanntmachung nach dem Umwandlungsgesetz",
      "state": "Nordrhein-Westfalen",
      "amtsgericht": "Amtsgericht Münster",
      "registernummer": "HRB 22084",
      "registerart": "HRB",
      "company_name": "IB Special Purpose UG (haftungsbeschränkt)",
      "company_seat": "Münster",
      "details": "08.11.2024 (Bekanntmachungsdatum)\n\nNordrhein-Westfalen Amtsgericht Münster HRB 22084\nRegisterbekanntmachung nach dem Umwandlungsgesetz 08.11.2024 (Eintragungsdatum)\n\nIB Special Purpose UG (haftungsbeschränkt)\nGesellschaft mit beschränkter Haftung\nMünster\n\nDen Gläubigern der an der Verschmelzung beteiligten Rechtsträger ist, wenn sie binnen sechs Monaten nach dem Tag, an dem die Eintragung der Verschmelzung in das Register des Sitzes desjenigen Rechtsträgers, dessen Gläubiger sie sind, nach § 19 Absatz 3 UmwG als bekanntgemacht gilt, ihren Anspruch nach Grund und Höhe schriftlich anmelden, Sicherheit zu leisten, soweit sie nicht Befriedigung verlangen können. Dieses Recht steht den Gläubigern jedoch nur zu, wenn sie glaubhaft machen, dass durch die Verschmelzung die Erfüllung ihrer Forderung gefährdet wird."
    },
    {
      "date": "2024-11-08",
      "original_text": "Registerbekanntmachung nach dem Umwandlungsgesetz\nBayern Amtsgericht Ingolstadt HRB 2585\nINIT Consulting AG – Ingolstadt",
      "type": "Registerbekanntmachung nach dem Umwandlungsgesetz",
      "state": "Bayern",
      "amtsgericht": "Amtsgericht Ingolstadt",
      "registernummer": "HRB 2585",
      "registerart": "HRB",
      "company_name": "INIT Consulting AG",
      "company_seat": "Ingolstadt",
      "details": "08.11.2024 (Bekanntmachungsdatum)\n\nBayern Amtsgericht Ingolstadt HRB 2585\nRegisterbekanntmachung nach dem Umwandlungsgesetz 07.11.2024 (Eintragungsdatum)\n\nINIT Consulting AG\nAktiengesellschaft\nIngolstadt\n\nDen Gläubigern der an der Verschmelzung beteiligten Rechtsträger ist, wenn sie binnen sechs Monaten nach dem Tag, an dem die Eintragung der Verschmelzung in das Register des Sitzes desjenigen Rechtsträgers, dessen Gläubiger sie sind, nach § 19 Abs. 3 UmwG als bekannt gemacht gilt, ihren Anspruch nach Grund und Höhe schriftlich anmelden, Sicherheit zu leisten, soweit sie nicht Befriedigung verlangen können. Dieses Recht steht den Gläubigern jedoch nur zu, wenn sie glaubhaft machen, dass durch die Verschmelzung die Erfüllung ihrer Forderung gefährdet wird."
    },
    {
      "date": "2024-11-08",
      "original_text": "Registerbekanntmachung nach dem Umwandlungsgesetz\nNordrhein-Westfalen Amtsgericht Paderborn HRA 8747\nINTERN Heizkontroll-Gesellschaft mbH & Co. KG – Paderborn",
      "type": "Registerbekanntmachung nach dem Umwandlungsgesetz",
      "state": "Nordrhein-Westfalen",
      "amtsgericht": "Amtsgericht Paderborn",
      "registernummer": "HRA 8747",
      "registerart": "HRA",
      "company_name": "INTERN Heizkontroll-Gesellschaft mbH & Co. KG",
      "company_seat": "Paderborn",
      "details": "08.11.2024 (Bekanntmachungsdatum)\n\nNordrhein-Westfalen Amtsgericht Paderborn HRA 8747\nRegisterbekanntmachung nach dem Umwandlungsgesetz 08.11.2024 (Eintragungsdatum)\n\nINTERN Heizkontroll-Gesellschaft mbH & Co. KG\nKommanditgesellschaft\nPaderborn\n\nDen Gläubigern der an der Ausgliederung beteiligten Rechtsträger ist, wenn sie binnen sechs Monaten nach dem Tag, an dem die Eintragung der Ausgliederung in das Register des Sitzes desjenigen Rechtsträgers, dessen Gläubiger sie sind, nach § 19 Absatz 3 UmwG als bekanntgemacht gilt, ihren Anspruch nach Grund und Höhe schriftlich anmelden, Sicherheit zu leisten, soweit sie nicht Befriedigung verlangen können. Dieses Recht steht den Gläubigern jedoch nur zu, wenn sie glaubhaft machen, dass durch die Ausgliederung die Erfüllung ihrer Forderung gefährdet wird."
    },
    {
      "date": "2024-11-08",
      "original_text": "Einreichung neuer Dokumente\nNiedersachsen Amtsgericht Osnabrück HRB 20215\nIQ-Agrar Service GmbH – Osnabrück",
      "type": "Einreichung neuer Dokumente",
      "state": "Niedersachsen",
      "amtsgericht": "Amtsgericht Osnabrück",
      "registernummer": "HRB 20215",
      "registerart": "HRB",
      "company_name": "IQ-Agrar Service GmbH",
      "company_seat": "Osnabrück",
      "details": "08.11.2024 (Bekanntmachungsdatum)\n\nNiedersachsen Amtsgericht Osnabrück HRB 20215\nEinreichung neuer Dokumente\n\nIQ-Agrar Service GmbH\nGesellschaft mit beschränkter Haftung\nOsnabrück\n\nDie Liste der Mitglieder des Aufsichtsrats wurde beim Registergericht eingereicht."
    },
    {
      "date": "2024-11-08",
      "original_text": "Registerbekanntmachung nach dem Umwandlungsgesetz\nNordrhein-Westfalen Amtsgericht Paderborn HRB 16891\nISM GmbH – Lippstadt",
      "type": "Registerbekanntmachung nach dem Umwandlungsgesetz",
      "state": "Nordrhein-Westfalen",
      "amtsgericht": "Amtsgericht Paderborn",
      "registernummer": "HRB 16891",
      "registerart": "HRB",
      "company_name": "ISM GmbH",
      "company_seat": "Lippstadt",
      "details": "08.11.2024 (Bekanntmachungsdatum)\n\nNordrhein-Westfalen Amtsgericht Paderborn HRB 16891\nRegisterbekanntmachung nach dem Umwandlungsgesetz 08.11.2024 (Eintragungsdatum)\n\nISM GmbH\nGesellschaft mit beschränkter Haftung\nLippstadt\n\nDen Gläubigern der an der Verschmelzung beteiligten Rechtsträger ist, wenn sie binnen sechs Monaten nach dem Tag, an dem die Eintragung der Verschmelzung in das Register des Sitzes desjenigen Rechtsträgers, dessen Gläubiger sie sind, nach § 19 Absatz 3 UmwG als bekanntgemacht gilt, ihren Anspruch nach Grund und Höhe schriftlich anmelden, Sicherheit zu leisten, soweit sie nicht Befriedigung verlangen können. Dieses Recht steht den Gläubigern jedoch nur zu, wenn sie glaubhaft machen, dass durch die Verschmelzung die Erfüllung ihrer Forderung gefährdet wird."
    },
    {
      "date": "2024-11-08",
      "original_text": "Registerbekanntmachung nach dem Umwandlungsgesetz\nHessen Amtsgericht Frankfurt am Main HRB 135779\nIVM plus GmbH – Frankfurt am Main",
      "type": "Registerbekanntmachung nach dem Umwandlungsgesetz",
      "state": "Hessen",
      "amtsgericht": "Amtsgericht Frankfurt am Main",
      "registernummer": "HRB 135779",
      "registerart": "HRB",
      "company_name": "IVM plus GmbH",
      "company_seat": "Frankfurt am Main",
      "details": "08.11.2024 (Bekanntmachungsdatum)\n\nHessen Amtsgericht Frankfurt am Main HRB 135779\nRegisterbekanntmachung nach dem Umwandlungsgesetz 08.11.2024 (Eintragungsdatum)\n\nIVM plus GmbH\nGesellschaft mit beschränkter Haftung\nFrankfurt am Main\n\nDen Gläubigern der an der Verschmelzung beteiligten Rechtsträger ist, wenn sie binnen sechs Monaten nach dem Tag, an dem die Eintragung der Verschmelzung in das Register des Sitzes desjenigen Rechtsträgers, dessen Gläubiger sie sind, nach § 19 Absatz 3 UmwG bekannt gemacht worden ist, ihren Anspruch nach Grund und Höhe schriftlich anmelden, Sicherheit zu leisten, soweit sie nicht Befriedigung verlangen können. Dieses Recht steht den Gläubigern jedoch nur zu, wenn sie glaubhaft machen, dass durch die Verschmelzung die Erfüllung ihrer Forderung gefährdet wird."
    },
    {
      "date": "2024-11-08",
      "original_text": "Löschungsankündigung\nBayern Amtsgericht Nürnberg HRB 34976\nIZ Performance UG (haftungsbeschränkt) – Nürnberg",
      "type": "Löschungsankündigung",
      "state": "Bayern",
      "amtsgericht": "Amtsgericht Nürnberg",
      "registernummer": "HRB 34976",
      "registerart": "HRB",
      "company_name": "IZ Performance UG (haftungsbeschränkt)",
      "company_seat": "Nürnberg",
      "details": "08.11.2024 (Bekanntmachungsdatum)\n\nBayern Amtsgericht Nürnberg HRB 34976\nLöschungsankündigung\n\nIZ Performance UG (haftungsbeschränkt)\nGesellschaft mit beschränkter Haftung\nNürnberg\n\nDas Registergericht beabsichtigt, die im Handelsregister eingetragene Gesellschaft wegen Vermögenslosigkeit von Amts wegen nach § 394 FamFG zu löschen. Die Frist zur Erhebung eines Widerspruchs ist auf einen Monat festgesetzt."
    },
    {
      "date": "2024-11-08",
      "original_text": "Registerbekanntmachung nach dem Umwandlungsgesetz\nHessen Amtsgericht Wiesbaden HRB 27572\nImmoestate Management GmbH – Wiesbaden",
      "type": "Registerbekanntmachung nach dem Umwandlungsgesetz",
      "state": "Hessen",
      "amtsgericht": "Amtsgericht Wiesbaden",
      "registernummer": "HRB 27572",
      "registerart": "HRB",
      "company_name": "Immoestate Management GmbH",
      "company_seat": "Wiesbaden",
      "details": "08.11.2024 (Bekanntmachungsdatum)\n\nHessen Amtsgericht Wiesbaden HRB 27572\nRegisterbekanntmachung nach dem Umwandlungsgesetz 08.11.2024 (Eintragungsdatum)\n\nImmoestate Management GmbH\nGesellschaft mit beschränkter Haftung\nWiesbaden\n\nDen Gläubigern der an der formwechselnden Umwandlung beteiligten Rechtsträger ist, wenn sie binnen sechs Monaten nach dem Tag, an dem die Eintragung der formwechselnden Umwandlung in das Register des Sitzes derjenigen Rechtsträger deren Gläubiger sie sind, nach § 201 UmwG bekannt gemacht worden ist, ihren Anspruch nach Grund und Höhe schriftlich anmelden, Sicherheit zu leisten, soweit sie nicht Befriedigung verlangen können. Dieses Recht steht den Gläubigern jedoch nur zu, wenn sie glaubhaft machen, dass durch die formwechselnden Umwandlung die Erfüllung ihrer Forderung gefährdet wird."
    },
    {
      "date": "2024-11-08",
      "original_text": "Einreichung neuer Dokumente\nThüringen Amtsgericht Jena HRB 112845\nInternate im Landkreis Gotha GmbH (ILG GmbH) – Waltershausen",
      "type": "Einreichung neuer Dokumente",
      "state": "Thüringen",
      "amtsgericht": "Amtsgericht Jena",
      "registernummer": "HRB 112845",
      "registerart": "HRB",
      "company_name": "Internate im Landkreis Gotha GmbH (ILG GmbH)",
      "company_seat": "Waltershausen",
      "details": "08.11.2024 (Bekanntmachungsdatum)\n\nThüringen Amtsgericht Jena HRB 112845\nEinreichung neuer Dokumente 05.11.2024 (Eintragungsdatum)\n\nInternate im Landkreis Gotha GmbH (ILG GmbH)\nGesellschaft mit beschränkter Haftung\nWaltershausen\n\nBekanntmachung gem. § 52 Abs. 3 Satz 2 GmbHG: Aufgrund einer Veränderung in den Personen der Aufsichtsratsmitglieder ist durch die Geschäftsführer eine neue Liste zum Handelsregister eingereicht worden."
    },
    {
      "date": "2024-11-08",
      "original_text": "Löschungsankündigung\nBayern Amtsgericht Augsburg HRB 22882\nJophiel Augsburg GmbH – Augsburg",
      "type": "Löschungsankündigung",
      "state": "Bayern",
      "amtsgericht": "Amtsgericht Augsburg",
      "registernummer": "HRB 22882",
      "registerart": "HRB",
      "company_name": "Jophiel Augsburg GmbH",
      "company_seat": "Augsburg",
      "details": "08.11.2024 (Bekanntmachungsdatum)\n\nBayern Amtsgericht Augsburg HRB 22882\nLöschungsankündigung 07.11.2024 (Eintragungsdatum)\n\nJophiel Augsburg GmbH\nGesellschaft mit beschränkter Haftung\nAugsburg"
    },
    {
      "date": "2024-11-08",
      "original_text": "Registerbekanntmachung nach dem Umwandlungsgesetz\nBerlin Amtsgericht Berlin (Charlottenburg) HRB 114344\nJoysun Cotheniusstraße Grundstücks GmbH – Berlin",
      "type": "Registerbekanntmachung nach dem Umwandlungsgesetz",
      "state": "Berlin",
      "amtsgericht": "Amtsgericht Berlin (Charlottenburg)",
      "registernummer": "HRB 114344",
      "registerart": "HRB",
      "company_name": "Joysun Cotheniusstraße Grundstücks GmbH",
      "company_seat": "Berlin",
      "details": "08.11.2024 (Bekanntmachungsdatum)\n\nBerlin Amtsgericht Berlin (Charlottenburg) HRB 114344\nRegisterbekanntmachung nach dem Umwandlungsgesetz 08.11.2024 (Eintragungsdatum)\n\nJoysun Cotheniusstraße Grundstücks GmbH\nGesellschaft mit beschränkter Haftung\nBerlin\n\nZu Eintragungsnummer 13 vom 08.11.2024 wird als nicht eingetragen veröffentlicht: Den Gläubigern der an der Verschmelzung beteiligten Rechtsträger ist, wenn sie binnen sechs Monaten nach dem Tag, an dem die Eintragung der Verschmelzung in das Register des Sitzes desjenigen Rechtsträgers, dessen Gläubiger sie sind, als bekannt gemacht gilt, ihren Anspruch nach Grund und Höhe schriftlich anmelden, Sicherheit zu leisten, soweit sie nicht Befriedigung verlangen können. Dieses Recht steht den Gläubigern jedoch nur zu, wenn sie glaubhaft machen, dass durch die Verschmelzung die Erfüllung ihrer Forderung gefährdet wird. Das Recht, Sicherheitsleistung zu verlangen, steht Gläubigern nicht zu, die im Falle der Insolvenz ein Recht auf vorzugsweise Befriedigung aus einer Deckungsmasse haben, die nach gesetzlicher Vorschrift zu ihrem Schutz errichtet und staatlich überwacht ist."
    },
    {
      "date": "2024-11-08",
      "original_text": "Registerbekanntmachung nach dem Umwandlungsgesetz\nBerlin Amtsgericht Berlin (Charlottenburg) HRB 114631\nJoysun Florapromenade Grundstücks GmbH – Berlin",
      "type": "Registerbekanntmachung nach dem Umwandlungsgesetz",
      "state": "Berlin",
      "amtsgericht": "Amtsgericht Berlin (Charlottenburg)",
      "registernummer": "HRB 114631",
      "registerart": "HRB",
      "company_name": "Joysun Florapromenade Grundstücks GmbH",
      "company_seat": "Berlin",
      "details": "08.11.2024 (Bekanntmachungsdatum)\n\nBerlin Amtsgericht Berlin (Charlottenburg) HRB 114631\nRegisterbekanntmachung nach dem Umwandlungsgesetz 08.11.2024 (Eintragungsdatum)\n\nJoysun Florapromenade Grundstücks GmbH\nGesellschaft mit beschränkter Haftung\nBerlin\n\nZu Eintragungsnummer 16 vom 08.11.2024 wird als nicht eingetragen veröffentlicht: Den Gläubigern der an der Verschmelzung beteiligten Rechtsträger ist, wenn sie binnen sechs Monaten nach dem Tag, an dem die Eintragung der Verschmelzung in das Register des Sitzes desjenigen Rechtsträgers, dessen Gläubiger sie sind, als bekannt gemacht gilt, ihren Anspruch nach Grund und Höhe schriftlich anmelden, Sicherheit zu leisten, soweit sie nicht Befriedigung verlangen können. Dieses Recht steht den Gläubigern jedoch nur zu, wenn sie glaubhaft machen, dass durch die Verschmelzung die Erfüllung ihrer Forderung gefährdet wird. Das Recht, Sicherheitsleistung zu verlangen, steht Gläubigern nicht zu, die im Falle der Insolvenz ein Recht auf vorzugsweise Befriedigung aus einer Deckungsmasse haben, die nach gesetzlicher Vorschrift zu ihrem Schutz errichtet und staatlich überwacht ist."
    },
    {
      "date": "2024-11-08",
      "original_text": "Registerbekanntmachung nach dem Umwandlungsgesetz\nBerlin Amtsgericht Berlin (Charlottenburg) HRB 114611\nJoysun Kiehlufer Grundstücks GmbH – Berlin",
      "type": "Registerbekanntmachung nach dem Umwandlungsgesetz",
      "state": "Berlin",
      "amtsgericht": "Amtsgericht Berlin (Charlottenburg)",
      "registernummer": "HRB 114611",
      "registerart": "HRB",
      "company_name": "Joysun Kiehlufer Grundstücks GmbH",
      "company_seat": "Berlin",
      "details": "08.11.2024 (Bekanntmachungsdatum)\n\nBerlin Amtsgericht Berlin (Charlottenburg) HRB 114611\nRegisterbekanntmachung nach dem Umwandlungsgesetz 08.11.2024 (Eintragungsdatum)\n\nJoysun Kiehlufer Grundstücks GmbH\nGesellschaft mit beschränkter Haftung\nBerlin\n\nZu Eintragungsnummer 14 vom 08.11.2024 wird als nicht eingetragen veröffentlicht: Den Gläubigern der an der Verschmelzung beteiligten Rechtsträger ist, wenn sie binnen sechs Monaten nach dem Tag, an dem die Eintragung der Verschmelzung in das Register des Sitzes desjenigen Rechtsträgers, dessen Gläubiger sie sind, als bekannt gemacht gilt, ihren Anspruch nach Grund und Höhe schriftlich anmelden, Sicherheit zu leisten, soweit sie nicht Befriedigung verlangen können. Dieses Recht steht den Gläubigern jedoch nur zu, wenn sie glaubhaft machen, dass durch die Verschmelzung die Erfüllung ihrer Forderung gefährdet wird. Das Recht, Sicherheitsleistung zu verlangen, steht Gläubigern nicht zu, die im Falle der Insolvenz ein Recht auf vorzugsweise Befriedigung aus einer Deckungsmasse haben, die nach gesetzlicher Vorschrift zu ihrem Schutz errichtet und staatlich überwacht ist."
    },
    {
      "date": "2024-11-08",
      "original_text": "Registerbekanntmachung nach dem Umwandlungsgesetz\nBerlin Amtsgericht Berlin (Charlottenburg) HRB 114124\nJoysun Tauroggener Straße Grundstücks GmbH – Berlin",
      "type": "Registerbekanntmachung nach dem Umwandlungsgesetz",
      "state": "Berlin",
      "amtsgericht": "Amtsgericht Berlin (Charlottenburg)",
      "registernummer": "HRB 114124",
      "registerart": "HRB",
      "company_name": "Joysun Tauroggener Straße Grundstücks GmbH",
      "company_seat": "Berlin",
      "details": "08.11.2024 (Bekanntmachungsdatum)\n\nBerlin Amtsgericht Berlin (Charlottenburg) HRB 114124\nRegisterbekanntmachung nach dem Umwandlungsgesetz 08.11.2024 (Eintragungsdatum)\n\nJoysun Tauroggener Straße Grundstücks GmbH\nGesellschaft mit beschränkter Haftung\nBerlin\n\nZu Eintragungsnummer 14 vom 08.11.2024 wird als nicht eingetragen veröffentlicht: Den Gläubigern der an der Verschmelzung beteiligten Rechtsträger ist, wenn sie binnen sechs Monaten nach dem Tag, an dem die Eintragung der Verschmelzung in das Register des Sitzes desjenigen Rechtsträgers, dessen Gläubiger sie sind, als bekannt gemacht gilt, ihren Anspruch nach Grund und Höhe schriftlich anmelden, Sicherheit zu leisten, soweit sie nicht Befriedigung verlangen können. Dieses Recht steht den Gläubigern jedoch nur zu, wenn sie glaubhaft machen, dass durch die Verschmelzung die Erfüllung ihrer Forderung gefährdet wird. Das Recht, Sicherheitsleistung zu verlangen, steht Gläubigern nicht zu, die im Falle der Insolvenz ein Recht auf vorzugsweise Befriedigung aus einer Deckungsmasse haben, die nach gesetzlicher Vorschrift zu ihrem Schutz errichtet und staatlich überwacht ist."
    },
    {
      "date": "2024-11-08",
      "original_text": "Löschungsankündigung\nBrandenburg Amtsgericht Frankfurt/Oder HRB 16426\nK.B.N. Komfortbau und Naturstein GmbH – Seelow",
      "type": "Löschungsankündigung",
      "state": "Brandenburg",
      "amtsgericht": "Amtsgericht Frankfurt/Oder",
      "registernummer": "HRB 16426",
      "registerart": "HRB",
      "company_name": "K.B.N. Komfortbau und Naturstein GmbH",
      "company_seat": "Seelow",
      "details": "08.11.2024 (Bekanntmachungsdatum)\n\nBrandenburg Amtsgericht Frankfurt/Oder HRB 16426\nLöschungsankündigung\n\nK.B.N. Komfortbau und Naturstein GmbH\nGesellschaft mit beschränkter Haftung\nSeelow\n\nBei der nachstehenden Gesellschaft wird das Amtslöschungsverfahren gemäß § 394 Abs. 1 FamFG eingeleitet."
    },
    {
      "date": "2024-11-08",
      "original_text": "Löschungsankündigung\nBayern Amtsgericht Nürnberg HRB 33178\nKansas City Event Verwaltungs UG (haftungsbeschränkt) – Velden",
      "type": "Löschungsankündigung",
      "state": "Bayern",
      "amtsgericht": "Amtsgericht Nürnberg",
      "registernummer": "HRB 33178",
      "registerart": "HRB",
      "company_name": "Kansas City Event Verwaltungs UG (haftungsbeschränkt)",
      "company_seat": "Velden",
      "details": "08.11.2024 (Bekanntmachungsdatum)\n\nBayern Amtsgericht Nürnberg HRB 33178\nLöschungsankündigung\n\nKansas City Event Verwaltungs UG (haftungsbeschränkt)\nGesellschaft mit beschränkter Haftung\nVelden\n\nDas Registergericht beabsichtigt, die im Handelsregister eingetragene Gesellschaft wegen Vermögenslosigkeit von Amts wegen nach § 394 FamFG zu löschen. Die Frist zur Erhebung eines Widerspruchs ist auf einen Monat festgesetzt."
    },
    {
      "date": "2024-11-08",
      "original_text": "Sonstige Registerbekanntmachung\nBaden-Württemberg Amtsgericht Mannheim HRB 202374\nKlinikum Mittelbaden gGmbH – Baden-Baden",
      "type": "Sonstige Registerbekanntmachung",
      "state": "Baden-Württemberg",
      "amtsgericht": "Amtsgericht Mannheim",
      "registernummer": "HRB 202374",
      "registerart": "HRB",
      "company_name": "Klinikum Mittelbaden gGmbH",
      "company_seat": "Baden-Baden",
      "details": "08.11.2024 (Bekanntmachungsdatum)\n\nBaden-Württemberg Amtsgericht Mannheim HRB 202374\nSonstige Registerbekanntmachung 08.11.2024 (Eintragungsdatum)\n\nKlinikum Mittelbaden gGmbH\nGesellschaft mit beschränkter Haftung\nBaden-Baden\n\nDie Gesellschaft hat am 07.11.2024 die Liste über die Zusammensetzung des Aufsichtsrats zum Handelsregister eingereicht."
    },
    {
      "date": "2024-11-08",
      "original_text": "Einreichung neuer Dokumente\nBerlin Amtsgericht Berlin (Charlottenburg) HRB 217341\nKulturraum Berlin gGmbH – Berlin",
      "type": "Einreichung neuer Dokumente",
      "state": "Berlin",
      "amtsgericht": "Amtsgericht Berlin (Charlottenburg)",
      "registernummer": "HRB 217341",
      "registerart": "HRB",
      "company_name": "Kulturraum Berlin gGmbH",
      "company_seat": "Berlin",
      "details": "08.11.2024 (Bekanntmachungsdatum)\n\nBerlin Amtsgericht Berlin (Charlottenburg) HRB 217341\nEinreichung neuer Dokumente\n\nKulturraum Berlin gGmbH\nGesellschaft mit beschränkter Haftung\nBerlin\n\nAls nicht eingetragen wird veröffentlicht: Es wurde eine neue Liste der Aufsichtsratsmitglieder eingereicht (§52 GmbHG)."
    },
    {
      "date": "2024-11-08",
      "original_text": "Löschungsankündigung\nBayern Amtsgericht München HRB 235531\nL-EventCon UG (haftungsbeschränkt) – München",
      "type": "Löschungsankündigung",
      "state": "Bayern",
      "amtsgericht": "Amtsgericht München",
      "registernummer": "HRB 235531",
      "registerart": "HRB",
      "company_name": "L-EventCon UG (haftungsbeschränkt)",
      "company_seat": "München",
      "details": "08.11.2024 (Bekanntmachungsdatum)\n\nBayern Amtsgericht München HRB 235531\nLöschungsankündigung 07.11.2024 (Eintragungsdatum)\n\nL-EventCon UG (haftungsbeschränkt)\nGesellschaft mit beschränkter Haftung\nMünchen\n\nDas Registergericht beabsichtigt, die im Handelsregister eingetragene Gesellschaft wegen Vermögenslosigkeit von Amts wegen nach § 394 FamFG zu löschen. Die Frist zur Erhebung eines Widerspruchs ist auf drei Monate festgesetzt."
    },
    {
      "date": "2024-11-08",
      "original_text": "Einreichung neuer Dokumente\nHessen Amtsgericht Marburg HRB 6415\nLAHN-DILL-BERGLAND ENERGIE GmbH – Bad Endbach",
      "type": "Einreichung neuer Dokumente",
      "state": "Hessen",
      "amtsgericht": "Amtsgericht Marburg",
      "registernummer": "HRB 6415",
      "registerart": "HRB",
      "company_name": "LAHN-DILL-BERGLAND ENERGIE GmbH",
      "company_seat": "Bad Endbach",
      "details": "08.11.2024 (Bekanntmachungsdatum)\n\nHessen Amtsgericht Marburg HRB 6415\nEinreichung neuer Dokumente\n\nLAHN-DILL-BERGLAND ENERGIE GmbH\nGesellschaft mit beschränkter Haftung\nBad Endbach\n\nDurch eine Änderung in den Personen der Aufsichtsratsmitglieder ist eine Liste der Mitglieder des Aufsichtsrates zum Handelsregister eingereicht worden."
    },
    {
      "date": "2024-11-08",
      "original_text": "Registerbekanntmachung nach dem Umwandlungsgesetz\nNordrhein-Westfalen Amtsgericht Düsseldorf HRB 83497\nLUTOP Datenschutz Akademie GmbH – Düsseldorf",
      "type": "Registerbekanntmachung nach dem Umwandlungsgesetz",
      "state": "Nordrhein-Westfalen",
      "amtsgericht": "Amtsgericht Düsseldorf",
      "registernummer": "HRB 83497",
      "registerart": "HRB",
      "company_name": "LUTOP Datenschutz Akademie GmbH",
      "company_seat": "Düsseldorf",
      "details": "08.11.2024 (Bekanntmachungsdatum)\n\nNordrhein-Westfalen Amtsgericht Düsseldorf HRB 83497\nRegisterbekanntmachung nach dem Umwandlungsgesetz 08.11.2024 (Eintragungsdatum)\n\nLUTOP Datenschutz Akademie GmbH\nGesellschaft mit beschränkter Haftung\nDüsseldorf\n\nDen Gläubigern der an der Verschmelzung beteiligten Rechtsträger ist, wenn sie binnen sechs Monaten nach dem Tag, an dem die Eintragung der Verschmelzung in das Register des Sitzes desjenigen Rechtsträgers, dessen Gläubiger sie sind, nach § 19 Absatz 3 UmwG als bekanntgemacht gilt, ihren Anspruch nach Grund und Höhe schriftlich anmelden, Sicherheit zu leisten, soweit sie nicht Befriedigung verlangen können. Dieses Recht steht den Gläubigern jedoch nur zu, wenn sie glaubhaft machen, dass durch die Verschmelzung die Erfüllung ihrer Forderung gefährdet wird."
    },
    {
      "date": "2024-11-08",
      "original_text": "Löschungsankündigung\nNordrhein-Westfalen Amtsgericht Kleve HRA 5191\nLandcafé Viktoriya e.K. – Rees",
      "type": "Löschungsankündigung",
      "state": "Nordrhein-Westfalen",
      "amtsgericht": "Amtsgericht Kleve",
      "registernummer": "HRA 5191",
      "registerart": "HRA",
      "company_name": "Landcafé Viktoriya e.K.",
      "company_seat": "Rees",
      "details": "08.11.2024 (Bekanntmachungsdatum)\n\nNordrhein-Westfalen Amtsgericht Kleve HRA 5191\nLöschungsankündigung\n\nLandcafé Viktoriya e.K.\nEinzelkaufmann / Einzelkauffrau\nRees\n\nDas Registergericht beabsichtigt die Firma von Amts wegen nach § 31 Abs. 2 HGB, § 393 FamFG zu löschen. Die Frist zur Erhebung eines Widerspruchs ist auf einen Monat festgesetzt."
    },
    {
      "date": "2024-11-08",
      "original_text": "Löschungsankündigung\nSchleswig-Holstein Amtsgericht Flensburg HRB 15132\nLöwen Leasing UG (haftungsbeschränkt) – Hörup",
      "type": "Löschungsankündigung",
      "state": "Schleswig-Holstein",
      "amtsgericht": "Amtsgericht Flensburg",
      "registernummer": "HRB 15132",
      "registerart": "HRB",
      "company_name": "Löwen Leasing UG (haftungsbeschränkt)",
      "company_seat": "Hörup",
      "details": "08.11.2024 (Bekanntmachungsdatum)\n\nSchleswig-Holstein Amtsgericht Flensburg HRB 15132\nLöschungsankündigung\n\nLöwen Leasing UG (haftungsbeschränkt)\nGesellschaft mit beschränkter Haftung\nHörup\n\nEs ist die Löschung der nachstehenden Gesellschaft wegen Vermögenslosigkeit gemäß § 394 FamFG beabsichtigt.\nWiderspruchsfrist: 2 Monate"
    },
    {
      "date": "2024-11-08",
      "original_text": "Löschungsankündigung\nSchleswig-Holstein Amtsgericht Kiel HRA 10486\nMMZ Innovations GmbH & Co. KG – Kattendorf",
      "type": "Löschungsankündigung",
      "state": "Schleswig-Holstein",
      "amtsgericht": "Amtsgericht Kiel",
      "registernummer": "HRA 10486",
      "registerart": "HRA",
      "company_name": "MMZ Innovations GmbH & Co. KG",
      "company_seat": "Kattendorf",
      "details": "08.11.2024 (Bekanntmachungsdatum)\n\nSchleswig-Holstein Amtsgericht Kiel HRA 10486\nLöschungsankündigung\n\nMMZ Innovations GmbH & Co. KG\nKommanditgesellschaft\nKattendorf\n\nBei der nachstehenden Firma wird das Amtslöschungsverfahren gemäß § 31 Abs. 2 HGB eingeleitet. Widerspruchsfrist: 2 Monate."
    },
    {
      "date": "2024-11-08",
      "original_text": "Registerbekanntmachung nach dem Umwandlungsgesetz\nNordrhein-Westfalen Amtsgericht Bonn HRB 29229\nMORENO GmbH – Bornheim",
      "type": "Registerbekanntmachung nach dem Umwandlungsgesetz",
      "state": "Nordrhein-Westfalen",
      "amtsgericht": "Amtsgericht Bonn",
      "registernummer": "HRB 29229",
      "registerart": "HRB",
      "company_name": "MORENO GmbH",
      "company_seat": "Bornheim",
      "details": "08.11.2024 (Bekanntmachungsdatum)\n\nNordrhein-Westfalen Amtsgericht Bonn HRB 29229\nRegisterbekanntmachung nach dem Umwandlungsgesetz 08.11.2024 (Eintragungsdatum)\n\nMORENO GmbH\nGesellschaft mit beschränkter Haftung\nBornheim\n\nDen Gläubigern der an der Verschmelzung beteiligten Rechtsträger ist, wenn sie binnen sechs Monaten nach dem Tag, an dem die Eintragung der Verschmelzung in das Register des Sitzes desjenigen Rechtsträgers, dessen Gläubiger sie sind, nach § 19 Absatz 3 UmwG als bekanntgemacht gilt, ihren Anspruch nach Grund und Höhe schriftlich anmelden, Sicherheit zu leisten, soweit sie nicht Befriedigung verlangen können. Dieses Recht steht den Gläubigern jedoch nur zu, wenn sie glaubhaft machen, dass durch die Verschmelzung die Erfüllung ihrer Forderung gefährdet wird."
    },
    {
      "date": "2024-11-08",
      "original_text": "Registerbekanntmachung nach dem Umwandlungsgesetz\nNordrhein-Westfalen Amtsgericht Bonn HRB 8734\nMORENO Verwaltungs GmbH – Bornheim",
      "type": "Registerbekanntmachung nach dem Umwandlungsgesetz",
      "state": "Nordrhein-Westfalen",
      "amtsgericht": "Amtsgericht Bonn",
      "registernummer": "HRB 8734",
      "registerart": "HRB",
      "company_name": "MORENO Verwaltungs GmbH",
      "company_seat": "Bornheim",
      "details": "08.11.2024 (Bekanntmachungsdatum)\n\nNordrhein-Westfalen Amtsgericht Bonn HRB 8734\nRegisterbekanntmachung nach dem Umwandlungsgesetz 08.11.2024 (Eintragungsdatum)\n\nMORENO Verwaltungs GmbH\nGesellschaft mit beschränkter Haftung\nBornheim\n\nDen Gläubigern der an der Verschmelzung beteiligten Rechtsträger ist, wenn sie binnen sechs Monaten nach dem Tag, an dem die Eintragung der Verschmelzung in das Register des Sitzes desjenigen Rechtsträgers, dessen Gläubiger sie sind, nach § 19 Absatz 3 UmwG als bekanntgemacht gilt, ihren Anspruch nach Grund und Höhe schriftlich anmelden, Sicherheit zu leisten, soweit sie nicht Befriedigung verlangen können. Dieses Recht steht den Gläubigern jedoch nur zu, wenn sie glaubhaft machen, dass durch die Verschmelzung die Erfüllung ihrer Forderung gefährdet wird."
    },
    {
      "date": "2024-11-08",
      "original_text": "Registerbekanntmachung nach dem Umwandlungsgesetz\nBayern Amtsgericht Fürth HRA 12385\nMarkus Römer Hausmeisterservice e.K. – Fürth",
      "type": "Registerbekanntmachung nach dem Umwandlungsgesetz",
      "state": "Bayern",
      "amtsgericht": "Amtsgericht Fürth",
      "registernummer": "HRA 12385",
      "registerart": "HRA",
      "company_name": "Markus Römer Hausmeisterservice e.K.",
      "company_seat": "Fürth",
      "details": "08.11.2024 (Bekanntmachungsdatum)\n\nBayern Amtsgericht Fürth HRA 12385\nRegisterbekanntmachung nach dem Umwandlungsgesetz 07.11.2024 (Eintragungsdatum)\n\nMarkus Römer Hausmeisterservice e.K.\nEinzelkaufmann / Einzelkauffrau\nFürth\n\nDen Gläubigern der an der Ausgliederung beteiligten Rechtsträger ist, wenn sie binnen sechs Monaten nach dem Tag, an dem die Eintragung der Ausgliederung in das Register des Sitzes desjenigen Rechtsträgers, dessen Gläubiger sie sind, nach §§ 125, 19 Abs. 3 UmwG als bekannt gemacht gilt, ihren Anspruch nach Grund und Höhe schriftlich anmelden, Sicherheit zu leisten, soweit sie nicht Befriedigung verlangen können. Dieses Recht steht den Gläubigern jedoch nur zu, wenn sie glaubhaft machen, dass durch die Ausgliederung die Erfüllung ihrer Forderung gefährdet wird."
    },
    {
      "date": "2024-11-08",
      "original_text": "Einreichung neuer Dokumente\nHessen Amtsgericht Marburg HRB 3056\nMeissner AG Modell- und Werkzeugfabrik – Biedenkopf",
      "type": "Einreichung neuer Dokumente",
      "state": "Hessen",
      "amtsgericht": "Amtsgericht Marburg",
      "registernummer": "HRB 3056",
      "registerart": "HRB",
      "company_name": "Meissner AG Modell- und Werkzeugfabrik",
      "company_seat": "Biedenkopf",
      "details": "08.11.2024 (Bekanntmachungsdatum)\n\nHessen Amtsgericht Marburg HRB 3056\nEinreichung neuer Dokumente\n\nMeissner AG Modell- und Werkzeugfabrik\nAktiengesellschaft\nBiedenkopf\n\nDurch eine Änderung in den Personen der Aufsichtsratsmitglieder ist eine Liste der Mitglieder des Aufsichtsrates zum Handelsregister eingereicht worden."
    },
    {
      "date": "2024-11-08",
      "original_text": "Registerbekanntmachung nach dem Umwandlungsgesetz\nBerlin Amtsgericht Berlin (Charlottenburg) HRB 175196\nMellifera Einundzwanzigste Beteiligungsgesellschaft mbH – Berlin",
      "type": "Registerbekanntmachung nach dem Umwandlungsgesetz",
      "state": "Berlin",
      "amtsgericht": "Amtsgericht Berlin (Charlottenburg)",
      "registernummer": "HRB 175196",
      "registerart": "HRB",
      "company_name": "Mellifera Einundzwanzigste Beteiligungsgesellschaft mbH",
      "company_seat": "Berlin",
      "details": "08.11.2024 (Bekanntmachungsdatum)\n\nBerlin Amtsgericht Berlin (Charlottenburg) HRB 175196\nRegisterbekanntmachung nach dem Umwandlungsgesetz 08.11.2024 (Eintragungsdatum)\n\nMellifera Einundzwanzigste Beteiligungsgesellschaft mbH\nGesellschaft mit beschränkter Haftung\nBerlin\n\nZu Eintragungsnummer 9 vom 08.11.2024 wird als nicht eingetragen veröffentlicht:Den Gläubigern der an der Verschmelzung beteiligten Rechtsträger ist, wenn sie binnen sechs Monaten nach dem Tag, an dem die Eintragung der Verschmelzung in das Register des Sitzes desjenigen Rechtsträgers, dessen Gläubiger sie sind, als bekannt gemacht gilt, ihren Anspruch nach Grund und Höhe schriftlich anmelden, Sicherheit zu leisten, soweit sie nicht Befriedigung verlangen können. Dieses Recht steht den Gläubigern jedoch nur zu, wenn sie glaubhaft machen, dass durch die Verschmelzung die Erfüllung ihrer Forderung gefährdet wird. Das Recht, Sicherheitsleistung zu verlangen, steht Gläubigern nicht zu, die im Falle der Insolvenz ein Recht auf vorzugsweise Befriedigung aus einer Deckungsmasse haben, die nach gesetzlicher Vorschrift zu ihrem Schutz errichtet und staatlich überwacht ist."
    },
    {
      "date": "2024-11-08",
      "original_text": "Löschungsankündigung\nRheinland-Pfalz Amtsgericht Ludwigshafen a.Rhein (Ludwigshafen) HRB 67668\nMiliziano UG (haftungsbeschränkt) – Ludwigshafen am Rhein",
      "type": "Löschungsankündigung",
      "state": "Rheinland-Pfalz",
      "amtsgericht": "Amtsgericht Ludwigshafen a.Rhein (Ludwigshafen)",
      "registernummer": "HRB 67668",
      "registerart": "HRB",
      "company_name": "Miliziano UG (haftungsbeschränkt)",
      "company_seat": "Ludwigshafen am Rhein",
      "details": "08.11.2024 (Bekanntmachungsdatum)\n\nRheinland-Pfalz Amtsgericht Ludwigshafen a.Rhein (Ludwigshafen) HRB 67668\nLöschungsankündigung\n\nMiliziano UG (haftungsbeschränkt)\nGesellschaft mit beschränkter Haftung\nLudwigshafen am Rhein\n\nDas Registergericht beabsichtigt die Gesellschaft von Amts wegen nach § 394 FamFG zu löschen. Die Frist zur Erhebung eines Widerspruchs ist auf einen Monat festgesetzt."
    },
    {
      "date": "2024-11-08",
      "original_text": "Registerbekanntmachung nach dem Umwandlungsgesetz\nNiedersachsen Amtsgericht Osnabrück HRB 219694\nNELKE-NICOLAI Spedition Verwaltungs-GmbH – Osnabrück",
      "type": "Registerbekanntmachung nach dem Umwandlungsgesetz",
      "state": "Niedersachsen",
      "amtsgericht": "Amtsgericht Osnabrück",
      "registernummer": "HRB 219694",
      "registerart": "HRB",
      "company_name": "NELKE-NICOLAI Spedition Verwaltungs-GmbH",
      "company_seat": "Osnabrück",
      "details": "08.11.2024 (Bekanntmachungsdatum)\n\nNiedersachsen Amtsgericht Osnabrück HRB 219694\nRegisterbekanntmachung nach dem Umwandlungsgesetz 08.11.2024 (Eintragungsdatum)\n\nNELKE-NICOLAI Spedition Verwaltungs-GmbH\nGesellschaft mit beschränkter Haftung\nOsnabrück\n\nDen Gläubigern der an der Verschmelzung beteiligten Rechtsträger ist, wenn sie binnen sechs Monaten nach dem Tag, an dem die Eintragung der Verschmelzung in das Register des Sitzes desjenigen Rechtsträgers, dessen Gläubiger sie sind, nach § 19  Abs.  3 UmwG als bekannt gemacht gilt, ihren Anspruch nach Grund und Höhe schriftlich anmelden, Sicherheit zu leisten, soweit sie nicht Befriedigung verlangen können. Dieses Recht steht den Gläubigern jedoch nur zu, wenn sie glaubhaft machen, dass durch die Verschmelzung die Erfüllung der Forderung gefährdet wird."
    },
    {
      "date": "2024-11-08",
      "original_text": "Registerbekanntmachung nach dem Umwandlungsgesetz\nHamburg Amtsgericht Hamburg HRA 131541\nNiclas Stock e.K. – Hamburg",
      "type": "Registerbekanntmachung nach dem Umwandlungsgesetz",
      "state": "Hamburg",
      "amtsgericht": "Amtsgericht Hamburg",
      "registernummer": "HRA 131541",
      "registerart": "HRA",
      "company_name": "Niclas Stock e.K.",
      "company_seat": "Hamburg",
      "details": "08.11.2024 (Bekanntmachungsdatum)\n\nHamburg Amtsgericht Hamburg HRA 131541\nRegisterbekanntmachung nach dem Umwandlungsgesetz 08.11.2024 (Eintragungsdatum)\n\nNiclas Stock e.K.\nEinzelkaufmann\nHamburg\n\nAls nicht eingetragen wird bekannt gemacht:\nDen Gläubigern der an der Ausgliederung beteiligten Gesellschaften ist, wenn sie binnen sechs Monaten nach dem Tag, an dem die Eintragung der Ausgliederung in das Register des Sitzes desjenigen Rechtsträgers, dessen Gläubiger sie sind, nach § 19 Absatz 3 UmwG als bekannt gemacht gilt, ihren Anspruch nach Grund und Höhe schriftlich anmelden, Sicherheit zu leisten, soweit sie nicht Befriedigung verlangen können. Dieses Recht steht den Gläubigern jedoch nur zu, wenn sie glaubhaft machen, dass durch die Ausgliederung die Erfüllung ihrer Forderung gefährdet wird."
    },
    {
      "date": "2024-11-08",
      "original_text": "Löschungsankündigung\nBerlin Amtsgericht Berlin (Charlottenburg) HRB 194313\nNovaktec GmbH – Berlin",
      "type": "Löschungsankündigung",
      "state": "Berlin",
      "amtsgericht": "Amtsgericht Berlin (Charlottenburg)",
      "registernummer": "HRB 194313",
      "registerart": "HRB",
      "company_name": "Novaktec GmbH",
      "company_seat": "Berlin",
      "details": "08.11.2024 (Bekanntmachungsdatum)\n\nBerlin Amtsgericht Berlin (Charlottenburg) HRB 194313\nLöschungsankündigung\n\nNovaktec GmbH\nGesellschaft mit beschränkter Haftung\nBerlin\n\nBei der nachstehenden Gesellschaft wird das Amtslöschungsverfahren gemäß § 394 FamFG eingeleitet. Widerspruchsfrist 6 Wochen"
    },
    {
      "date": "2024-11-08",
      "original_text": "Registerbekanntmachung nach dem Umwandlungsgesetz\nMecklenburg-Vorpommern Amtsgericht Stralsund HRB 5924\nOptima GmbH – Kloster",
      "type": "Registerbekanntmachung nach dem Umwandlungsgesetz",
      "state": "Mecklenburg-Vorpommern",
      "amtsgericht": "Amtsgericht Stralsund",
      "registernummer": "HRB 5924",
      "registerart": "HRB",
      "company_name": "Optima GmbH",
      "company_seat": "Kloster",
      "details": "08.11.2024 (Bekanntmachungsdatum)\n\nMecklenburg-Vorpommern Amtsgericht Stralsund HRB 5924\nRegisterbekanntmachung nach dem Umwandlungsgesetz 07.11.2024 (Eintragungsdatum)\n\nOptima GmbH\nGesellschaft mit beschränkter Haftung\nKloster\n\nAls nicht eingetragen wird veröffentlicht: Den Gläubigern der an der Verschmelzung beteiligten Rechtsträger ist, wenn sie binnen sechs Monaten nach dem Tag, an dem die Eintragung der Verschmelzung in das Register des Sitzes desjenigen Rechtsträgers, dessen Gläubiger sie sind, nach § 19 Abs. 3 UmwG als bekannt gemacht gilt,\nihren Anspruch nach Grund und Höhe schriftlich anmelden, Sicherheit zu leisten, soweit sie nicht Befriedigung verlangen können. Dieses Recht steht den Gläubigern jedoch nur zu, wenn sie glaubhaft machen, dass durch die Verschmelzung die Erfüllung der Forderung gefährdet wird."
    },
    {
      "date": "2024-11-08",
      "original_text": "Registerbekanntmachung nach dem Umwandlungsgesetz\nBayern Amtsgericht Ingolstadt HRB 4988\nOrca Capital GmbH – Hettenshausen",
      "type": "Registerbekanntmachung nach dem Umwandlungsgesetz",
      "state": "Bayern",
      "amtsgericht": "Amtsgericht Ingolstadt",
      "registernummer": "HRB 4988",
      "registerart": "HRB",
      "company_name": "Orca Capital GmbH",
      "company_seat": "Hettenshausen",
      "details": "08.11.2024 (Bekanntmachungsdatum)\n\nBayern Amtsgericht Ingolstadt HRB 4988\nRegisterbekanntmachung nach dem Umwandlungsgesetz 07.11.2024 (Eintragungsdatum)\n\nOrca Capital GmbH\nGesellschaft mit beschränkter Haftung\nHettenshausen\n\nDen Gläubigern des formwechselnden Rechtsträgers ist, wenn sie binnen sechs Monaten nach dem Tag, an dem die Eintragung des Formwechsels nach § 201 UmwG als bekannt gemacht gilt, ihren Anspruch nach Grund und Höhe schriftlich anmelden, Sicherheit zu leisten, soweit sie nicht Befriedigung verlangen können. Dieses Recht steht den Gläubigern jedoch nur zu, wenn sie glaubhaft machen, dass durch den Formwechsel die Erfüllung ihrer Forderung gefährdet wird."
    },
    {
      "date": "2024-11-08",
      "original_text": "Löschungsankündigung\nRheinland-Pfalz Amtsgericht Ludwigshafen a.Rhein (Ludwigshafen) HRB 65500\nPROsanabit GmbH – Mutterstadt",
      "type": "Löschungsankündigung",
      "state": "Rheinland-Pfalz",
      "amtsgericht": "Amtsgericht Ludwigshafen a.Rhein (Ludwigshafen)",
      "registernummer": "HRB 65500",
      "registerart": "HRB",
      "company_name": "PROsanabit GmbH",
      "company_seat": "Mutterstadt",
      "details": "08.11.2024 (Bekanntmachungsdatum)\n\nRheinland-Pfalz Amtsgericht Ludwigshafen a.Rhein (Ludwigshafen) HRB 65500\nLöschungsankündigung\n\nPROsanabit GmbH\nGesellschaft mit beschränkter Haftung\nMutterstadt\n\nDas Registergericht beabsichtigt die Gesellschaft von Amts wegen nach § 394 FamFG zu löschen. Die Frist zur Erhebung eines Widerspruchs ist auf einen Monat festgesetzt."
    },
    {
      "date": "2024-11-08",
      "original_text": "Registerbekanntmachung nach dem Umwandlungsgesetz\nRheinland-Pfalz Amtsgericht Bad Kreuznach HRB 23237\nPapa Rhein Event GmbH – Bad Sobernheim",
      "type": "Registerbekanntmachung nach dem Umwandlungsgesetz",
      "state": "Rheinland-Pfalz",
      "amtsgericht": "Amtsgericht Bad Kreuznach",
      "registernummer": "HRB 23237",
      "registerart": "HRB",
      "company_name": "Papa Rhein Event GmbH",
      "company_seat": "Bad Sobernheim",
      "details": "08.11.2024 (Bekanntmachungsdatum)\n\nRheinland-Pfalz Amtsgericht Bad Kreuznach HRB 23237\nRegisterbekanntmachung nach dem Umwandlungsgesetz 08.11.2024 (Eintragungsdatum)\n\nPapa Rhein Event GmbH\nGesellschaft mit beschränkter Haftung\nBad Sobernheim\n\nAls nicht eingetragen wird veröffentlicht: Den Gläubigern der an der Verschmelzung beteiligten Rechtsträger ist, wenn sie binnen sechs Monaten nach dem Tag, an dem die Eintragung der Verschmelzung in das Register des Sitzes desjenigen Rechtsträgers, dessen Gläubiger sie sind, nach § 19 Abs. 3 UmwG als bekannt gemacht gilt, ihren Anspruch nach Grund und Höhe schriftlich anmelden, Sicherheit zu leisten, soweit sie nicht Befriedigung verlangen können. Dieses Recht steht den Gläubigern jedoch nur zu, wenn sie glaubhaft machen, dass durch die Verschmelzung die Erfüllung der Forderung gefährdet wird."
    },
    {
      "date": "2024-11-08",
      "original_text": "Registerbekanntmachung nach dem Umwandlungsgesetz\nHessen Amtsgericht Kassel HRB 5683\nParfümerie Schwardtmann GmbH – Kassel",
      "type": "Registerbekanntmachung nach dem Umwandlungsgesetz",
      "state": "Hessen",
      "amtsgericht": "Amtsgericht Kassel",
      "registernummer": "HRB 5683",
      "registerart": "HRB",
      "company_name": "Parfümerie Schwardtmann GmbH",
      "company_seat": "Kassel",
      "details": "08.11.2024 (Bekanntmachungsdatum)\n\nHessen Amtsgericht Kassel HRB 5683\nRegisterbekanntmachung nach dem Umwandlungsgesetz 08.11.2024 (Eintragungsdatum)\n\nParfümerie Schwardtmann GmbH\nGesellschaft mit beschränkter Haftung\nKassel\n\nDen Gläubigern der an der Verschmelzung beteiligten Rechtsträger ist, wenn sie binnen sechs Monaten nach dem Tag, an dem die Eintragung der Verschmelzung in das Register des Sitzes desjenigen Rechtsträgers, dessen Gläubiger sie sind, nach § 19 Absatz 3 UmwG bekannt gemacht worden ist, ihren Anspruch nach Grund und Höhe schriftlich anmelden, Sicherheit zu leisten, soweit sie nicht Befriedigung verlangen können. Dieses Recht steht den Gläubigern jedoch nur zu, wenn sie glaubhaft machen, dass durch die Verschmelzung die Erfüllung ihrer Forderung gefährdet wird."
    },
    {
      "date": "2024-11-08",
      "original_text": "Löschungsankündigung\nNordrhein-Westfalen Amtsgericht Siegen HRB 11940\nPlatzhirsch UG (haftungsbeschränkt) – Siegen",
      "type": "Löschungsankündigung",
      "state": "Nordrhein-Westfalen",
      "amtsgericht": "Amtsgericht Siegen",
      "registernummer": "HRB 11940",
      "registerart": "HRB",
      "company_name": "Platzhirsch UG (haftungsbeschränkt)",
      "company_seat": "Siegen",
      "details": "08.11.2024 (Bekanntmachungsdatum)\n\nNordrhein-Westfalen Amtsgericht Siegen HRB 11940\nLöschungsankündigung\n\nPlatzhirsch UG (haftungsbeschränkt)\nGesellschaft mit beschränkter Haftung\nSiegen\n\nDas Registergericht beabsichtigt die Gesellschaft von Amts wegen nach § 394 FamFG zu löschen. Die Frist zur Erhebung eines Widerspruchs ist auf drei Monate festgesetzt."
    },
    {
      "date": "2024-11-08",
      "original_text": "Registerbekanntmachung nach dem Umwandlungsgesetz\nHessen Amtsgericht Korbach HRB 295\nPrima Nota Notengraphik und Verlagsservice GmbH – Korbach",
      "type": "Registerbekanntmachung nach dem Umwandlungsgesetz",
      "state": "Hessen",
      "amtsgericht": "Amtsgericht Korbach",
      "registernummer": "HRB 295",
      "registerart": "HRB",
      "company_name": "Prima Nota Notengraphik und Verlagsservice GmbH",
      "company_seat": "Korbach",
      "details": "08.11.2024 (Bekanntmachungsdatum)\n\nHessen Amtsgericht Korbach HRB 295\nRegisterbekanntmachung nach dem Umwandlungsgesetz 08.11.2024 (Eintragungsdatum)\n\nPrima Nota Notengraphik und Verlagsservice GmbH\nGesellschaft mit beschränkter Haftung\nKorbach\n\nDen Gläubigern der an der Verschmelzung beteiligten Rechtsträger ist, wenn sie binnen sechs Monaten nach dem Tag, an dem die Eintragung der Verschmelzung in das Register des Sitzes desjenigen Rechtsträgers, dessen Gläubiger sie sind, nach § 19 Absatz 3 UmwG bekannt gemacht worden ist, ihren Anspruch nach Grund und Höhe schriftlich anmelden, Sicherheit zu leisten, soweit sie nicht Befriedigung verlangen können. Dieses Recht steht den Gläubigern jedoch nur zu, wenn sie glaubhaft machen, dass durch die Verschmelzung die Erfüllung ihrer Forderung gefährdet wird."
    },
    {
      "date": "2024-11-08",
      "original_text": "Registerbekanntmachung nach dem Umwandlungsgesetz\nHessen Amtsgericht Wiesbaden HRA 11739\nRealdaptive Management GmbH & Co. KG – Wiesbaden",
      "type": "Registerbekanntmachung nach dem Umwandlungsgesetz",
      "state": "Hessen",
      "amtsgericht": "Amtsgericht Wiesbaden",
      "registernummer": "HRA 11739",
      "registerart": "HRA",
      "company_name": "Realdaptive Management GmbH & Co. KG",
      "company_seat": "Wiesbaden",
      "details": "08.11.2024 (Bekanntmachungsdatum)\n\nHessen Amtsgericht Wiesbaden HRA 11739\nRegisterbekanntmachung nach dem Umwandlungsgesetz 08.11.2024 (Eintragungsdatum)\n\nRealdaptive Management GmbH & Co. KG\nKommanditgesellschaft\nWiesbaden\n\nDen Gläubigern der an der formwechselnden Umwandlung beteiligten Rechtsträger ist, wenn sie binnen sechs Monaten nach dem Tag, an dem die Eintragung der formwechselnden Umwandlung in das Register des Sitzes derjenigen Rechtsträger deren Gläubiger sie sind, nach § 201 UmwG bekannt gemacht worden ist, ihren Anspruch nach Grund und Höhe schriftlich anmelden, Sicherheit zu leisten, soweit sie nicht Befriedigung verlangen können. Dieses Recht steht den Gläubigern jedoch nur zu, wenn sie glaubhaft machen, dass durch die formwechselnden Umwandlung die Erfüllung ihrer Forderung gefährdet wird."
    },
    {
      "date": "2024-11-08",
      "original_text": "Registerbekanntmachung nach dem Umwandlungsgesetz\nBayern Amtsgericht Fürth HRB 21272\nRömer Facility Management GmbH – Fürth",
      "type": "Registerbekanntmachung nach dem Umwandlungsgesetz",
      "state": "Bayern",
      "amtsgericht": "Amtsgericht Fürth",
      "registernummer": "HRB 21272",
      "registerart": "HRB",
      "company_name": "Römer Facility Management GmbH",
      "company_seat": "Fürth",
      "details": "08.11.2024 (Bekanntmachungsdatum)\n\nBayern Amtsgericht Fürth HRB 21272\nRegisterbekanntmachung nach dem Umwandlungsgesetz 07.11.2024 (Eintragungsdatum)\n\nRömer Facility Management GmbH\nGesellschaft mit beschränkter Haftung\nFürth\n\nDen Gläubigern der an der Ausgliederung beteiligten Rechtsträger ist, wenn sie binnen sechs Monaten nach dem Tag, an dem die Eintragung der Ausgliederung in das Register des Sitzes desjenigen Rechtsträgers, dessen Gläubiger sie sind, nach §§ 125, 19 Abs. 3 UmwG als bekannt gemacht gilt, ihren Anspruch nach Grund und Höhe schriftlich anmelden, Sicherheit zu leisten, soweit sie nicht Befriedigung verlangen können. Dieses Recht steht den Gläubigern jedoch nur zu, wenn sie glaubhaft machen, dass durch die Ausgliederung die Erfüllung ihrer Forderung gefährdet wird."
    },
    {
      "date": "2024-11-08",
      "original_text": "Sonstige Registerbekanntmachung\nBerlin Amtsgericht Berlin (Charlottenburg) HRB 63549\nSCHOLZ & FRIENDS Realisation Hub GmbH – Berlin",
      "type": "Sonstige Registerbekanntmachung",
      "state": "Berlin",
      "amtsgericht": "Amtsgericht Berlin (Charlottenburg)",
      "registernummer": "HRB 63549",
      "registerart": "HRB",
      "company_name": "SCHOLZ & FRIENDS Realisation Hub GmbH",
      "company_seat": "Berlin",
      "details": "08.11.2024 (Bekanntmachungsdatum)\n\nBerlin Amtsgericht Berlin (Charlottenburg) HRB 63549\nSonstige Registerbekanntmachung 07.11.2024 (Eintragungsdatum)\n\nSCHOLZ & FRIENDS Realisation Hub GmbH\nGesellschaft mit beschränkter Haftung\nBerlin\n\nAls nicht eingetragen wird veröffentlicht: Der andere Vertragsteil hat den Gläubigern dieses Rechtsträgers, deren Forderungen begründet worden sind, bevor die Eintragung der Beendigung dieses Vertrages in das Handelsregister nach § 10 des Handelsgesetzbuches als bekannt gemacht gilt, Sicherheit zu leisten, wenn sie sich binnen sechs Monaten nach der Bekanntmachung der Eintragung zu diesem Zweck bei ihm melden. Dieses Recht steht den Gläubigern nicht zu, die im Fall des Insolvenzverfahrens ein Recht auf vorzugsweise Befriedigung aus der Deckungsmasse haben, die nach gesetzlicher Vorschrift zu ihrem Schutz errichtet und staatlich überwacht ist."
    },
    {
      "date": "2024-11-08",
      "original_text": "Löschungsankündigung\nBaden-Württemberg Amtsgericht Ulm HRB 721201\nSEEDECO GmbH – Crailsheim",
      "type": "Löschungsankündigung",
      "state": "Baden-Württemberg",
      "amtsgericht": "Amtsgericht Ulm",
      "registernummer": "HRB 721201",
      "registerart": "HRB",
      "company_name": "SEEDECO GmbH",
      "company_seat": "Crailsheim",
      "details": "08.11.2024 (Bekanntmachungsdatum)\n\nBaden-Württemberg Amtsgericht Ulm HRB 721201\nLöschungsankündigung\n\nSEEDECO GmbH\nGesellschaft mit beschränkter Haftung\nCrailsheim\n\nDas Gericht beabsichtigt, die Gesellschaft wegen Vermögenslosigkeit im Handelsregister von Amts wegen nach § 394 FamFG zu löschen. Die Frist zur Geltendmachung eines Widerspruchs gegen die beabsichtigte Löschung ist auf  einen Monat ab Veröffentlichung bestimmt."
    },
    {
      "date": "2024-11-08",
      "original_text": "Einreichung neuer Dokumente\nBayern Amtsgericht Fürth HRB 14738\nSchaeffler AG – Herzogenaurach",
      "type": "Einreichung neuer Dokumente",
      "state": "Bayern",
      "amtsgericht": "Amtsgericht Fürth",
      "registernummer": "HRB 14738",
      "registerart": "HRB",
      "company_name": "Schaeffler AG",
      "company_seat": "Herzogenaurach",
      "details": "08.11.2024 (Bekanntmachungsdatum)\n\nBayern Amtsgericht Fürth HRB 14738\nEinreichung neuer Dokumente\n\nSchaeffler AG\nAktiengesellschaft\nHerzogenaurach\n\nDem Amtsgericht Fürth -Registergericht- ist eine Liste der Mitglieder des Aufsichtsrats eingereicht worden, § 106 AktG."
    },
    {
      "date": "2024-11-08",
      "original_text": "Löschungsankündigung\nBayern Amtsgericht München HRB 92086\nSchmidtke & Partner GmbH Management Consultants – München",
      "type": "Löschungsankündigung",
      "state": "Bayern",
      "amtsgericht": "Amtsgericht München",
      "registernummer": "HRB 92086",
      "registerart": "HRB",
      "company_name": "Schmidtke & Partner GmbH Management Consultants",
      "company_seat": "München",
      "details": "08.11.2024 (Bekanntmachungsdatum)\n\nBayern Amtsgericht München HRB 92086\nLöschungsankündigung\n\nSchmidtke & Partner GmbH Management Consultants\nGesellschaft mit beschränkter Haftung\nMünchen\n\nDas Registergericht beabsichtigt, die im Handelsregister eingetragene Gesellschaft wegen Vermögenslosigkeit von Amts wegen nach § 394 FamFG zu löschen. Die Frist zur Erhebung eines Widerspruchs ist auf drei Monate festgesetzt."
    },
    {
      "date": "2024-11-08",
      "original_text": "Registerbekanntmachung nach dem Umwandlungsgesetz\nBerlin Amtsgericht Berlin (Charlottenburg) HRB 232039\nSmart & Green Energy GmbH – Berlin",
      "type": "Registerbekanntmachung nach dem Umwandlungsgesetz",
      "state": "Berlin",
      "amtsgericht": "Amtsgericht Berlin (Charlottenburg)",
      "registernummer": "HRB 232039",
      "registerart": "HRB",
      "company_name": "Smart & Green Energy GmbH",
      "company_seat": "Berlin",
      "details": "08.11.2024 (Bekanntmachungsdatum)\n\nBerlin Amtsgericht Berlin (Charlottenburg) HRB 232039\nRegisterbekanntmachung nach dem Umwandlungsgesetz 07.11.2024 (Eintragungsdatum)\n\nSmart & Green Energy GmbH\nGesellschaft mit beschränkter Haftung\nBerlin\n\nZu Eintragungsnummer 5 vom 07.11.2024 wird als nicht eingetragen veröffentlicht:\nDen Gläubigern der an der Verschmelzung beteiligten Rechtsträger ist, wenn sie binnen sechs Monaten nach dem Tag, an dem die Eintragung der Verschmelzung in das Register des Sitzes desjenigen Rechtsträgers, dessen Gläubiger sie sind, als bekannt gemacht gilt, ihren Anspruch nach Grund und Höhe schriftlich anmelden, Sicherheit zu leisten, soweit sie nicht Befriedigung verlangen können. Dieses Recht steht den Gläubigern jedoch nur zu, wenn sie glaubhaft machen, dass durch die Verschmelzung die Erfüllung ihrer Forderung gefährdet wird. Das Recht, Sicherheitsleistung zu verlangen, steht Gläubigern nicht zu, die im Falle der Insolvenz ein Recht auf vorzugsweise Befriedigung aus einer Deckungsmasse haben, die nach gesetzlicher Vorschrift zu ihrem Schutz errichtet und staatlich überwacht ist."
    },
    {
      "date": "2024-11-08",
      "original_text": "Einreichung neuer Dokumente\nBrandenburg Amtsgericht Cottbus HRB 1037\nStadtwerke Cottbus GmbH – Cottbus/Chóśebuz",
      "type": "Einreichung neuer Dokumente",
      "state": "Brandenburg",
      "amtsgericht": "Amtsgericht Cottbus",
      "registernummer": "HRB 1037",
      "registerart": "HRB",
      "company_name": "Stadtwerke Cottbus GmbH",
      "company_seat": "Cottbus/Chóśebuz",
      "details": "08.11.2024 (Bekanntmachungsdatum)\n\nBrandenburg Amtsgericht Cottbus HRB 1037\nEinreichung neuer Dokumente\n\nStadtwerke Cottbus GmbH\nGesellschaft mit beschränkter Haftung\nCottbus/Chóśebuz\n\nAls nicht eingetragen wird veröffentlicht:\nDie Geschäftsführer haben eine Liste der Aufsichtsratsmitglieder gem. § 52 Abs. 3 Satz 2 GmbHG zum Handelsregister eingereicht"
    },
    {
      "date": "2024-11-08",
      "original_text": "Einreichung neuer Dokumente\nBaden-Württemberg Amtsgericht Stuttgart HRB 15709\nStuttgart-Marketing GmbH – Stuttgart",
      "type": "Einreichung neuer Dokumente",
      "state": "Baden-Württemberg",
      "amtsgericht": "Amtsgericht Stuttgart",
      "registernummer": "HRB 15709",
      "registerart": "HRB",
      "company_name": "Stuttgart-Marketing GmbH",
      "company_seat": "Stuttgart",
      "details": "08.11.2024 (Bekanntmachungsdatum)\n\nBaden-Württemberg Amtsgericht Stuttgart HRB 15709\nEinreichung neuer Dokumente\n\nStuttgart-Marketing GmbH\nGesellschaft mit beschränkter Haftung\nStuttgart\n\nDie Gesellschaft hat am 07.11.2024 die Liste über die Zusammensetzung des Aufsichtsrats zum Handelsregister eingereicht."
    },
    {
      "date": "2024-11-08",
      "original_text": "Löschungsankündigung\nMecklenburg-Vorpommern Amtsgericht Rostock HRB 13744\nSupremesurfshop GmbH – Rostock",
      "type": "Löschungsankündigung",
      "state": "Mecklenburg-Vorpommern",
      "amtsgericht": "Amtsgericht Rostock",
      "registernummer": "HRB 13744",
      "registerart": "HRB",
      "company_name": "Supremesurfshop GmbH",
      "company_seat": "Rostock",
      "details": "08.11.2024 (Bekanntmachungsdatum)\n\nMecklenburg-Vorpommern Amtsgericht Rostock HRB 13744\nLöschungsankündigung\n\nSupremesurfshop GmbH\nGesellschaft mit beschränkter Haftung\nRostock\n\nDas Registergericht beabsichtigt, die im Handelsregister eingetragene Gesellschaft von Amts wegen nach § 394 FamFG zu löschen. Die Frist zur Erhebung eines Widerspruchs gegen die beabsichtigte Löschung wird auf einen Monat festgesetzt."
    },
    {
      "date": "2024-11-08",
      "original_text": "Einreichung neuer Dokumente\nBaden-Württemberg Amtsgericht Stuttgart HRB 100644\nSüdwestdeutsche Salzwerke Aktiengesellschaft – Heilbronn",
      "type": "Einreichung neuer Dokumente",
      "state": "Baden-Württemberg",
      "amtsgericht": "Amtsgericht Stuttgart",
      "registernummer": "HRB 100644",
      "registerart": "HRB",
      "company_name": "Südwestdeutsche Salzwerke Aktiengesellschaft",
      "company_seat": "Heilbronn",
      "details": "08.11.2024 (Bekanntmachungsdatum)\n\nBaden-Württemberg Amtsgericht Stuttgart HRB 100644\nEinreichung neuer Dokumente\n\nSüdwestdeutsche Salzwerke Aktiengesellschaft\nAktiengesellschaft\nHeilbronn\n\nDie Gesellschaft hat am 07.11.2024 die Liste über die Zusammensetzung des Aufsichtsrats zum Handelsregister eingereicht."
    },
    {
      "date": "2024-11-08",
      "original_text": "Registerbekanntmachung nach dem Umwandlungsgesetz\nHamburg Amtsgericht Hamburg HRB 172230\nTGBC GmbH – Hamburg",
      "type": "Registerbekanntmachung nach dem Umwandlungsgesetz",
      "state": "Hamburg",
      "amtsgericht": "Amtsgericht Hamburg",
      "registernummer": "HRB 172230",
      "registerart": "HRB",
      "company_name": "TGBC GmbH",
      "company_seat": "Hamburg",
      "details": "08.11.2024 (Bekanntmachungsdatum)\n\nHamburg Amtsgericht Hamburg HRB 172230\nRegisterbekanntmachung nach dem Umwandlungsgesetz 08.11.2024 (Eintragungsdatum)\n\nTGBC GmbH\nGesellschaft mit beschränkter Haftung\nHamburg\n\nAls nicht eingetragen wird bekannt gemacht:\nDen Gläubigern der an der Ausgliederung beteiligten Gesellschaften ist, wenn sie binnen sechs Monaten nach dem Tag, an dem die Eintragung der Ausgliederung in das Register des Sitzes desjenigen Rechtsträgers, dessen Gläubiger sie sind, nach § 19 Absatz 3 UmwG als bekannt gemacht gilt, ihren Anspruch nach Grund und Höhe schriftlich anmelden, Sicherheit zu leisten, soweit sie nicht Befriedigung verlangen können. Dieses Recht steht den Gläubigern jedoch nur zu, wenn sie glaubhaft machen, dass durch die Ausgliederung die Erfüllung ihrer Forderung gefährdet wird."
    },
    {
      "date": "2024-11-08",
      "original_text": "Löschungsankündigung\nNordrhein-Westfalen Amtsgericht Siegen HRB 11898\nTIKO - Import und Export von Tiefkühlkost UG (haftungsbeschränkt) – Kreuztal",
      "type": "Löschungsankündigung",
      "state": "Nordrhein-Westfalen",
      "amtsgericht": "Amtsgericht Siegen",
      "registernummer": "HRB 11898",
      "registerart": "HRB",
      "company_name": "TIKO - Import und Export von Tiefkühlkost UG (haftungsbeschränkt)",
      "company_seat": "Kreuztal",
      "details": "08.11.2024 (Bekanntmachungsdatum)\n\nNordrhein-Westfalen Amtsgericht Siegen HRB 11898\nLöschungsankündigung\n\nTIKO - Import und Export von Tiefkühlkost UG (haftungsbeschränkt)\nGesellschaft mit beschränkter Haftung\nKreuztal\n\nDas Registergericht beabsichtigt die Gesellschaft von Amts wegen nach § 394 FamFG zu löschen. Die Frist zur Erhebung eines Widerspruchs ist auf drei Monate festgesetzt."
    },
    {
      "date": "2024-11-08",
      "original_text": "Registerbekanntmachung nach dem Umwandlungsgesetz\nBerlin Amtsgericht Berlin (Charlottenburg) HRB 269243\nTYT Invest GmbH – Berlin",
      "type": "Registerbekanntmachung nach dem Umwandlungsgesetz",
      "state": "Berlin",
      "amtsgericht": "Amtsgericht Berlin (Charlottenburg)",
      "registernummer": "HRB 269243",
      "registerart": "HRB",
      "company_name": "TYT Invest GmbH",
      "company_seat": "Berlin",
      "details": "08.11.2024 (Bekanntmachungsdatum)\n\nBerlin Amtsgericht Berlin (Charlottenburg) HRB 269243\nRegisterbekanntmachung nach dem Umwandlungsgesetz 07.11.2024 (Eintragungsdatum)\n\nTYT Invest GmbH\nGesellschaft mit beschränkter Haftung\nBerlin\n\nZu Eintragungsnummer 1 vom 07.11.2024 wird als nicht eingetragen veröffentlicht: Den Gläubigern ist, wenn sie binnen sechs Monaten nach dem Tag, an dem die Eintragung der Umwandlung als bekannt gemacht gilt, ihren Anspruch nach Grund und Höhe schriftlich anmelden, Sicherheit zu leisten, soweit sie nicht Befriedigung verlangen können. Dieses Recht steht den Gläubigern jedoch nur zu, wenn sie glaubhaft machen, dass durch die Umwandlung die Erfüllung ihrer Forderung gefährdet wird. Das Recht, Sicherheitsleistung zu verlangen, steht Gläubigern nicht zu, die im Falle der Insolvenz ein Recht auf vorzugsweise Befriedigung aus einer Deckungsmasse haben, die nach gesetzlicher Vorschrift zu ihrem Schutz errichtet und staatlich überwacht ist."
    },
    {
      "date": "2024-11-08",
      "original_text": "Löschungsankündigung\nNordrhein-Westfalen Amtsgericht Siegen HRB 9828\nTemaTec UG (haftungsbeschränkt) – Drolshagen",
      "type": "Löschungsankündigung",
      "state": "Nordrhein-Westfalen",
      "amtsgericht": "Amtsgericht Siegen",
      "registernummer": "HRB 9828",
      "registerart": "HRB",
      "company_name": "TemaTec UG (haftungsbeschränkt)",
      "company_seat": "Drolshagen",
      "details": "08.11.2024 (Bekanntmachungsdatum)\n\nNordrhein-Westfalen Amtsgericht Siegen HRB 9828\nLöschungsankündigung\n\nTemaTec UG (haftungsbeschränkt)\nGesellschaft mit beschränkter Haftung\nDrolshagen\n\nDas Registergericht beabsichtigt die Gesellschaft von Amts wegen nach § 394 FamFG zu löschen. Die Frist zur Erhebung eines Widerspruchs ist auf drei Monate festgesetzt."
    },
    {
      "date": "2024-11-08",
      "original_text": "Registerbekanntmachung nach dem Umwandlungsgesetz\nBerlin Amtsgericht Berlin (Charlottenburg) GsR 234\nTopcuoglu Yagmur Topcuoglu eGbR – Berlin",
      "type": "Registerbekanntmachung nach dem Umwandlungsgesetz",
      "state": "Berlin",
      "amtsgericht": "Amtsgericht Berlin (Charlottenburg)",
      "registernummer": "GsR 234",
      "registerart": "GsR",
      "company_name": "Topcuoglu Yagmur Topcuoglu eGbR",
      "company_seat": "Berlin",
      "details": "08.11.2024 (Bekanntmachungsdatum)\n\nBerlin Amtsgericht Berlin (Charlottenburg) GsR 234\nRegisterbekanntmachung nach dem Umwandlungsgesetz 07.11.2024 (Eintragungsdatum)\n\nTopcuoglu Yagmur Topcuoglu eGbR\nGesellschaft bürgerlichen Rechts\nBerlin\n\nZu Eintragungsnummer 2 vom 07.11.2024 wird als nicht eingetragen veröffentlicht:Den Gläubigern ist, wenn sie binnen sechs Monaten nach dem Tag, an dem die Eintragung der Umwandlung als bekannt gemacht gilt, ihren Anspruch nach Grund und Höhe schriftlich anmelden, Sicherheit zu leisten, soweit sie nicht Befriedigung verlangen können. Dieses Recht steht den Gläubigern jedoch nur zu, wenn sie glaubhaft machen, dass durch die Umwandlung die Erfüllung ihrer Forderung gefährdet wird. Das Recht, Sicherheitsleistung zu verlangen, steht Gläubigern nicht zu, die im Falle der Insolvenz ein Recht auf vorzugsweise Befriedigung aus einer Deckungsmasse haben, die nach gesetzlicher Vorschrift zu ihrem Schutz errichtet und staatlich überwacht ist."
    },
    {
      "date": "2024-11-08",
      "original_text": "Registerbekanntmachung nach dem Umwandlungsgesetz\nSchleswig-Holstein Amtsgericht Kiel HRB 214 EC\nVAMED Ostseeklinik Damp GmbH – Damp",
      "type": "Registerbekanntmachung nach dem Umwandlungsgesetz",
      "state": "Schleswig-Holstein",
      "amtsgericht": "Amtsgericht Kiel",
      "registernummer": "HRB 214 EC",
      "registerart": "HRB",
      "company_name": "VAMED Ostseeklinik Damp GmbH",
      "company_seat": "Damp",
      "details": "08.11.2024 (Bekanntmachungsdatum)\n\nSchleswig-Holstein Amtsgericht Kiel HRB 214 EC\nRegisterbekanntmachung nach dem Umwandlungsgesetz 06.11.2024 (Eintragungsdatum)\n\nVAMED Ostseeklinik Damp GmbH\nGesellschaft mit beschränkter Haftung\nDamp\n\nZu Eintragungsnummer 30 vom 06.11.2024 wird als nicht eingetragen veröffentlicht: Den Gläubigern der Gesellschaft, deren Forderungen begründet worden sind, bevor die Eintragung der Beendigung des Vertrages in das Handelsregister nach § 10 HGB bekannt gemacht worden ist, ist vom anderen Vertragspartner Sicherheit zu leisten, wenn sie sich binnen sechs Monaten nach Bekanntmachung der Eintragung zu diesem Zweck bei ihm melden."
    },
    {
      "date": "2024-11-08",
      "original_text": "Registerbekanntmachung nach dem Umwandlungsgesetz\nSaarland Amtsgericht Saarbrücken HRB 110552\nVeit Beratungs- und Handelsgesellschaft mbH – Oberthal",
      "type": "Registerbekanntmachung nach dem Umwandlungsgesetz",
      "state": "Saarland",
      "amtsgericht": "Amtsgericht Saarbrücken",
      "registernummer": "HRB 110552",
      "registerart": "HRB",
      "company_name": "Veit Beratungs- und Handelsgesellschaft mbH",
      "company_seat": "Oberthal",
      "details": "08.11.2024 (Bekanntmachungsdatum)\n\nSaarland Amtsgericht Saarbrücken HRB 110552\nRegisterbekanntmachung nach dem Umwandlungsgesetz 08.11.2024 (Eintragungsdatum)\n\nVeit Beratungs- und Handelsgesellschaft mbH\nGesellschaft mit beschränkter Haftung\nOberthal\n\nAls nicht eingetragen wird bekannt gemacht: Den Gläubigern der an der Verschmelzung beteiligten Gesellschaften ist, wenn sie binnen sechs Monaten nach dem Tag, an dem die Eintragung der Verschmelzung in das Register des Sitzes desjenigen Rechtsträgers, dessen Gläubiger sie sind, nach § 19 Absatz 3 UmwG bekannt gemacht worden ist, ihren Anspruch nach Grund und Höhe schriftlich anmelden, Sicherheit zu leisten, soweit sie nicht Befriedigung verlangen können. Dieses Recht steht den Gläubigern jedoch nur zu, wenn sie glaubhaft machen, dass durch die Verschmelzung die Erfüllung ihrer Forderung gefährdet wird."
    },
    {
      "date": "2024-11-08",
      "original_text": "Registerbekanntmachung nach dem Umwandlungsgesetz\nSaarland Amtsgericht Saarbrücken HRA 13555\nVeit Handelsvertretungen Inh. Nils Veit e.K. – Oberthal",
      "type": "Registerbekanntmachung nach dem Umwandlungsgesetz",
      "state": "Saarland",
      "amtsgericht": "Amtsgericht Saarbrücken",
      "registernummer": "HRA 13555",
      "registerart": "HRA",
      "company_name": "Veit Handelsvertretungen Inh. Nils Veit e.K.",
      "company_seat": "Oberthal",
      "details": "08.11.2024 (Bekanntmachungsdatum)\n\nSaarland Amtsgericht Saarbrücken HRA 13555\nRegisterbekanntmachung nach dem Umwandlungsgesetz 08.11.2024 (Eintragungsdatum)\n\nVeit Handelsvertretungen Inh. Nils Veit e.K.\nEinzelkaufmann / Einzelkauffrau\nOberthal\n\nAls nicht eingetragen wird bekannt gemacht: Den Gläubigern der an der Verschmelzung beteiligten Gesellschaften ist, wenn sie binnen sechs Monaten nach dem Tag, an dem die Eintragung der Verschmelzung in das Register des Sitzes desjenigen Rechtsträgers, dessen Gläubiger sie sind, nach § 19 Absatz 3 UmwG bekannt gemacht worden ist, ihren Anspruch nach Grund und Höhe schriftlich anmelden, Sicherheit zu leisten, soweit sie nicht Befriedigung verlangen können. Dieses Recht steht den Gläubigern jedoch nur zu, wenn sie glaubhaft machen, dass durch die Verschmelzung die Erfüllung ihrer Forderung gefährdet wird."
    },
    {
      "date": "2024-11-08",
      "original_text": "Löschungsankündigung\nRheinland-Pfalz Amtsgericht Mainz HRB 436\nVereinigte Kapselfabriken Nackenheim Gesellschaft mit beschränkter Haftung – Nackenheim",
      "type": "Löschungsankündigung",
      "state": "Rheinland-Pfalz",
      "amtsgericht": "Amtsgericht Mainz",
      "registernummer": "HRB 436",
      "registerart": "HRB",
      "company_name": "Vereinigte Kapselfabriken Nackenheim Gesellschaft mit beschränkter Haftung",
      "company_seat": "Nackenheim",
      "details": "08.11.2024 (Bekanntmachungsdatum)\n\nRheinland-Pfalz Amtsgericht Mainz HRB 436\nLöschungsankündigung\n\nVereinigte Kapselfabriken Nackenheim Gesellschaft mit beschränkter Haftung\nGesellschaft mit beschränkter Haftung\nNackenheim\n\nDas Registergericht beabsichtigt die Gesellschaft von Amts wegen nach § 394 FamFG zu löschen. Die Frist zur Erhebung eines Widerspruchs ist auf einen Monat festgesetzt."
    },
    {
      "date": "2024-11-08",
      "original_text": "Einreichung neuer Dokumente\nThüringen Amtsgericht Jena HRB 401487\nVerkehrsbetriebe Nordhausen GmbH – Nordhausen",
      "type": "Einreichung neuer Dokumente",
      "state": "Thüringen",
      "amtsgericht": "Amtsgericht Jena",
      "registernummer": "HRB 401487",
      "registerart": "HRB",
      "company_name": "Verkehrsbetriebe Nordhausen GmbH",
      "company_seat": "Nordhausen",
      "details": "08.11.2024 (Bekanntmachungsdatum)\n\nThüringen Amtsgericht Jena HRB 401487\nEinreichung neuer Dokumente\n\nVerkehrsbetriebe Nordhausen GmbH\nGesellschaft mit beschränkter Haftung\nNordhausen\n\nBekanntmachung gem. § 52 Abs. 3 Satz 2 GmbHG: Aufgrund einer Veränderung in den Personen der Aufsichtsratsmitglieder ist durch die Geschäftsführer eine neue Liste zum Handelsregister eingereicht worden."
    },
    {
      "date": "2024-11-08",
      "original_text": "Registerbekanntmachung nach dem Umwandlungsgesetz\nNiedersachsen Amtsgericht Tostedt HRA 205238\nVoinschi Transporte e.K. – Harsefeld",
      "type": "Registerbekanntmachung nach dem Umwandlungsgesetz",
      "state": "Niedersachsen",
      "amtsgericht": "Amtsgericht Tostedt",
      "registernummer": "HRA 205238",
      "registerart": "HRA",
      "company_name": "Voinschi Transporte e.K.",
      "company_seat": "Harsefeld",
      "details": "08.11.2024 (Bekanntmachungsdatum)\n\nNiedersachsen Amtsgericht Tostedt HRA 205238\nRegisterbekanntmachung nach dem Umwandlungsgesetz 08.11.2024 (Eintragungsdatum)\n\nVoinschi Transporte e.K.\nEinzelkaufmann / Einzelkauffrau\nHarsefeld\n\nDen Gläubigern der an der Ausgliederung beteiligten Rechtsträger ist, wenn sie binnen sechs Monaten nach dem Tag, an dem die Eintragung der Ausgliederung in das Register des Sitzes desjenigen Rechtsträgers, dessen Gläubiger sie sind, nach § 19 Abs. 3 UmwG als bekannt gemacht gilt, ihren Anspruch nach Grund und Höhe schriftlich anmelden, Sicherheit zu leisten, soweit sie nicht Befriedigung verlangen können. Dieses Recht steht den Gläubigern jedoch nur zu, wenn sie glaubhaft machen, dass durch die Ausgliederung die Erfüllung der Forderung gefährdet wird."
    },
    {
      "date": "2024-11-08",
      "original_text": "Registerbekanntmachung nach dem Umwandlungsgesetz\nRheinland-Pfalz Amtsgericht Wittlich HRA 42113\nW&S Bedachungen GmbH & Co. KG – Osburg",
      "type": "Registerbekanntmachung nach dem Umwandlungsgesetz",
      "state": "Rheinland-Pfalz",
      "amtsgericht": "Amtsgericht Wittlich",
      "registernummer": "HRA 42113",
      "registerart": "HRA",
      "company_name": "W&S Bedachungen GmbH & Co. KG",
      "company_seat": "Osburg",
      "details": "08.11.2024 (Bekanntmachungsdatum)\n\nRheinland-Pfalz Amtsgericht Wittlich HRA 42113\nRegisterbekanntmachung nach dem Umwandlungsgesetz 08.11.2024 (Eintragungsdatum)\n\nW&S Bedachungen GmbH & Co. KG\nKommanditgesellschaft\nOsburg\n\nAls nicht eingetragen wird veröffentlicht: Den Gläubigern der an der Ausgliederung beteiligten Rechtsträger ist, wenn sie binnen sechs Monaten nac hdem Tag, an dem die Eintragung der Ausgliederung in das Register des Sitzes desjenigen Rechtsträgers,dessen Gläubiger sie sind, nach § 19 Abs. 3 UmwG als bekannt gemacht gilt, ihren Anspruch nach Grund und Höhe schriftlich anmelden, Sicherheit zu leisten, soweit sie nicht Befriedigung verlangen können. Dieses Recht steht den Gläubigern jedoch nur zu, wenn sie glaubhaft machen, dass durch die Ausgliederung die Erfüllung der Forderung gefährdet wird."
    },
    {
      "date": "2024-11-08",
      "original_text": "Registerbekanntmachung nach dem Umwandlungsgesetz\nRheinland-Pfalz Amtsgericht Ludwigshafen a.Rhein (Ludwigshafen) HRB 69823\nWICOBA GmbH – Heßheim",
      "type": "Registerbekanntmachung nach dem Umwandlungsgesetz",
      "state": "Rheinland-Pfalz",
      "amtsgericht": "Amtsgericht Ludwigshafen a.Rhein (Ludwigshafen)",
      "registernummer": "HRB 69823",
      "registerart": "HRB",
      "company_name": "WICOBA GmbH",
      "company_seat": "Heßheim",
      "details": "08.11.2024 (Bekanntmachungsdatum)\n\nRheinland-Pfalz Amtsgericht Ludwigshafen a.Rhein (Ludwigshafen) HRB 69823\nRegisterbekanntmachung nach dem Umwandlungsgesetz 08.11.2024 (Eintragungsdatum)\n\nWICOBA GmbH\nGesellschaft mit beschränkter Haftung\nHeßheim\n\nAls nicht eingetragen wird veröffentlicht: Den Gläubigern der an der Verschmelzung beteiligten Rechtsträger ist, wenn sie binnen sechs Monaten nach dem Tag, an dem die Eintragung der Verschmelzung in das Register des Sitzes desjenigen Rechtsträgers, dessen Gläubiger sie sind, nach § 19 Abs. 3 UmwG als bekannt gemacht gilt, ihren Anspruch nach Grund und Höhe schriftlich anmelden, Sicherheit zu leisten, soweit sie nicht Befriedigung verlangen können. Dieses Recht steht den Gläubigern jedoch nur zu, wenn sie glaubhaft machen, dass durch die Verschmelzung die Erfüllung der Forderung gefährdet wird."
    },
    {
      "date": "2024-11-08",
      "original_text": "Löschungsankündigung\nBayern Amtsgericht München HRB 225697\nWILTON GmbH – Schliersee",
      "type": "Löschungsankündigung",
      "state": "Bayern",
      "amtsgericht": "Amtsgericht München",
      "registernummer": "HRB 225697",
      "registerart": "HRB",
      "company_name": "WILTON GmbH",
      "company_seat": "Schliersee",
      "details": "08.11.2024 (Bekanntmachungsdatum)\n\nBayern Amtsgericht München HRB 225697\nLöschungsankündigung\n\nWILTON GmbH\nGesellschaft mit beschränkter Haftung\nSchliersee\n\nDas Registergericht beabsichtigt, die im Handelsregister eingetragene Gesellschaft wegen Vermögenslosigkeit von Amts wegen nach § 394 FamFG zu löschen. Die Frist zur Erhebung eines Widerspruchs ist auf drei Monate festgesetzt."
    },
    {
      "date": "2024-11-08",
      "original_text": "Löschungsankündigung\nBerlin Amtsgericht Berlin (Charlottenburg) HRB 201938\nWa-Na Tec GmbH – Berlin",
      "type": "Löschungsankündigung",
      "state": "Berlin",
      "amtsgericht": "Amtsgericht Berlin (Charlottenburg)",
      "registernummer": "HRB 201938",
      "registerart": "HRB",
      "company_name": "Wa-Na Tec GmbH",
      "company_seat": "Berlin",
      "details": "08.11.2024 (Bekanntmachungsdatum)\n\nBerlin Amtsgericht Berlin (Charlottenburg) HRB 201938\nLöschungsankündigung\n\nWa-Na Tec GmbH\nGesellschaft mit beschränkter Haftung\nBerlin\n\nBei der nachstehenden Gesellschaft wird das Amtslöschungsverfahren gemäß § 394 FamFG eingeleitet. Widerspruchsfrist 6 Wochen"
    },
    {
      "date": "2024-11-08",
      "original_text": "Einreichung neuer Dokumente\nHessen Amtsgericht Frankfurt am Main HRB 49323\nWayss & Freytag Ingenieurbau AG – Frankfurt am Main",
      "type": "Einreichung neuer Dokumente",
      "state": "Hessen",
      "amtsgericht": "Amtsgericht Frankfurt am Main",
      "registernummer": "HRB 49323",
      "registerart": "HRB",
      "company_name": "Wayss & Freytag Ingenieurbau AG",
      "company_seat": "Frankfurt am Main",
      "details": "08.11.2024 (Bekanntmachungsdatum)\n\nHessen Amtsgericht Frankfurt am Main HRB 49323\nEinreichung neuer Dokumente\n\nWayss & Freytag Ingenieurbau AG\nAktiengesellschaft\nFrankfurt am Main\n\nDurch eine Änderung in den Personen der Aufsichtsratsmitglieder ist eine Liste der Mitglieder des Aufsichtsrates zum Handelsregister eingereicht worden."
    },
    {
      "date": "2024-11-08",
      "original_text": "Einreichung neuer Dokumente\nNiedersachsen Amtsgericht Hannover HRB 110075 früher Amtsgericht Neustadt a. Rbge. (Neustadt)\nWirtschaftsbetriebe Neustadt am Rübenberge GmbH – Neustadt a.Rbge.",
      "type": "Einreichung neuer Dokumente",
      "state": "Niedersachsen",
      "amtsgericht": "Amtsgericht Hannover",
      "registernummer": "HRB 110075",
      "registerart": "HRB",
      "company_name": "Wirtschaftsbetriebe Neustadt am Rübenberge GmbH",
      "company_seat": "Neustadt a.Rbge.",
      "former_amtsgericht": "Neustadt a. Rbge. (Neustadt)",
      "details": "08.11.2024 (Bekanntmachungsdatum)\n\nNiedersachsen Amtsgericht Hannover HRB 110075 früher Amtsgericht Neustadt a. Rbge. (Neustadt)\nEinreichung neuer Dokumente\n\nWirtschaftsbetriebe Neustadt am Rübenberge GmbH\nGesellschaft mit beschränkter Haftung\nNeustadt a.Rbge.\n\nDie Liste der Mitglieder des Aufsichtsrats wurde beim Registergericht eingereicht."
    },
    {
      "date": "2024-11-08",
      "original_text": "Einreichung neuer Dokumente\nBrandenburg Amtsgericht Frankfurt/Oder HRB 1190\nWohnungsbaugesellschaft Rüdersdorf mbH – Rüdersdorf bei Berlin",
      "type": "Einreichung neuer Dokumente",
      "state": "Brandenburg",
      "amtsgericht": "Amtsgericht Frankfurt/Oder",
      "registernummer": "HRB 1190",
      "registerart": "HRB",
      "company_name": "Wohnungsbaugesellschaft Rüdersdorf mbH",
      "company_seat": "Rüdersdorf bei Berlin",
      "details": "08.11.2024 (Bekanntmachungsdatum)\n\nBrandenburg Amtsgericht Frankfurt/Oder HRB 1190\nEinreichung neuer Dokumente\n\nWohnungsbaugesellschaft Rüdersdorf mbH\nGesellschaft mit beschränkter Haftung\nRüdersdorf bei Berlin\n\nDie Gesellschaft hat Änderungen in der Zusammensetzung des Aufsichtsrates angezeigt."
    },
    {
      "date": "2024-11-08",
      "original_text": "Löschungsankündigung\nNordrhein-Westfalen Amtsgericht Siegen HRB 11895\nYupi - Your Private and individual Space UG (haftungsbeschränkt) – Kreuztal",
      "type": "Löschungsankündigung",
      "state": "Nordrhein-Westfalen",
      "amtsgericht": "Amtsgericht Siegen",
      "registernummer": "HRB 11895",
      "registerart": "HRB",
      "company_name": "Yupi - Your Private and individual Space UG (haftungsbeschränkt)",
      "company_seat": "Kreuztal",
      "details": "08.11.2024 (Bekanntmachungsdatum)\n\nNordrhein-Westfalen Amtsgericht Siegen HRB 11895\nLöschungsankündigung\n\nYupi - Your Private and individual Space UG (haftungsbeschränkt)\nGesellschaft mit beschränkter Haftung\nKreuztal\n\nDas Registergericht beabsichtigt die Gesellschaft von Amts wegen nach § 394 FamFG zu löschen. Die Frist zur Erhebung eines Widerspruchs ist auf drei Monate festgesetzt."
    },
    {
      "date": "2024-11-08",
      "original_text": "Registerbekanntmachung nach dem Umwandlungsgesetz\nBaden-Württemberg Amtsgericht Stuttgart HRA 741788\nZahnlabor R. Ehrlich e.K. – Weinstadt",
      "type": "Registerbekanntmachung nach dem Umwandlungsgesetz",
      "state": "Baden-Württemberg",
      "amtsgericht": "Amtsgericht Stuttgart",
      "registernummer": "HRA 741788",
      "registerart": "HRA",
      "company_name": "Zahnlabor R. Ehrlich e.K.",
      "company_seat": "Weinstadt",
      "details": "08.11.2024 (Bekanntmachungsdatum)\n\nBaden-Württemberg Amtsgericht Stuttgart HRA 741788\nRegisterbekanntmachung nach dem Umwandlungsgesetz 08.11.2024 (Eintragungsdatum)\n\nZahnlabor R. Ehrlich e.K.\nEinzelkaufmann / Einzelkauffrau\nWeinstadt\n\nDen Gläubigern der an der Verschmelzung beteiligten Rechtsträger ist, wenn sie binnen sechs Monaten nach dem Tag, an dem die Eintragung der Verschmelzung in das Register des Sitzes desjenigen Rechtsträgers, dessen Gläubiger sie sind, nach § 19 Abs. 3 UmwG als bekanntgemacht gilt, ihren Anspruch nach Grund und Höhe schriftlich anmelden, Sicherheit zu leisten, soweit sie nicht Befriedigung verlangen können. Dieses Recht steht den Gläubigern jedoch nur zu, wenn sie glaubhaft machen, dass durch die Verschmelzung die Erfüllung ihrer Forderung gefährdet wird."
    },
    {
      "date": "2024-11-08",
      "original_text": "Registerbekanntmachung nach dem Umwandlungsgesetz\nBaden-Württemberg Amtsgericht Stuttgart HRB 745634\nZahntechnik EhrlichOkubo GmbH – Weinstadt",
      "type": "Registerbekanntmachung nach dem Umwandlungsgesetz",
      "state": "Baden-Württemberg",
      "amtsgericht": "Amtsgericht Stuttgart",
      "registernummer": "HRB 745634",
      "registerart": "HRB",
      "company_name": "Zahntechnik EhrlichOkubo GmbH",
      "company_seat": "Weinstadt",
      "details": "08.11.2024 (Bekanntmachungsdatum)\n\nBaden-Württemberg Amtsgericht Stuttgart HRB 745634\nRegisterbekanntmachung nach dem Umwandlungsgesetz 08.11.2024 (Eintragungsdatum)\n\nZahntechnik EhrlichOkubo GmbH\nGesellschaft mit beschränkter Haftung\nWeinstadt\n\nAls nicht eingetragen wird bekanntgemacht:\nDen Gläubigern der an der Verschmelzung beteiligten Rechtsträger ist, wenn sie binnen sechs Monaten nach dem Tag, an dem die Eintragung der Verschmelzung in das Register des Sitzes desjenigen Rechtsträgers, dessen Gläubiger sie sind, nach § 19 Abs. 3 UmwG als bekanntgemacht gilt, ihren Anspruch nach Grund und Höhe schriftlich anmelden, Sicherheit zu leisten, soweit sie nicht Befriedigung verlangen können. Dieses Recht steht den Gläubigern jedoch nur zu, wenn sie glaubhaft machen, dass durch die Verschmelzung die Erfüllung ihrer Forderung gefährdet wird."
    },
    {
      "date": "2024-11-08",
      "original_text": "Registerbekanntmachung nach dem Umwandlungsgesetz\nBerlin Amtsgericht Berlin (Charlottenburg) HRB 159526\nZiporim Investment GmbH – Berlin",
      "type": "Registerbekanntmachung nach dem Umwandlungsgesetz",
      "state": "Berlin",
      "amtsgericht": "Amtsgericht Berlin (Charlottenburg)",
      "registernummer": "HRB 159526",
      "registerart": "HRB",
      "company_name": "Ziporim Investment GmbH",
      "company_seat": "Berlin",
      "details": "08.11.2024 (Bekanntmachungsdatum)\n\nBerlin Amtsgericht Berlin (Charlottenburg) HRB 159526\nRegisterbekanntmachung nach dem Umwandlungsgesetz 08.11.2024 (Eintragungsdatum)\n\nZiporim Investment GmbH\nGesellschaft mit beschränkter Haftung\nBerlin\n\nZu Eintragungsnummer 18 vom 08.11.2024 wird als nicht eingetragen veröffentlicht: Den Gläubigern der an der Verschmelzung beteiligten Rechtsträger ist, wenn sie binnen sechs Monaten nach dem Tag, an dem die Eintragung der Verschmelzung in das Register des Sitzes desjenigen Rechtsträgers, dessen Gläubiger sie sind, als bekannt gemacht gilt, ihren Anspruch nach Grund und Höhe schriftlich anmelden, Sicherheit zu leisten, soweit sie nicht Befriedigung verlangen können. Dieses Recht steht den Gläubigern jedoch nur zu, wenn sie glaubhaft machen, dass durch die Verschmelzung die Erfüllung ihrer Forderung gefährdet wird. Das Recht, Sicherheitsleistung zu verlangen, steht Gläubigern nicht zu, die im Falle der Insolvenz ein Recht auf vorzugsweise Befriedigung aus einer Deckungsmasse haben, die nach gesetzlicher Vorschrift zu ihrem Schutz errichtet und staatlich überwacht ist."
    },
    {
      "date": "2024-11-08",
      "original_text": "Registerbekanntmachung nach dem Umwandlungsgesetz\nBerlin Amtsgericht Berlin (Charlottenburg) HRB 159526\nZiporim Investment GmbH – Berlin",
      "type": "Registerbekanntmachung nach dem Umwandlungsgesetz",
      "state": "Berlin",
      "amtsgericht": "Amtsgericht Berlin (Charlottenburg)",
      "registernummer": "HRB 159526",
      "registerart": "HRB",
      "company_name": "Ziporim Investment GmbH",
      "company_seat": "Berlin",
      "details": "08.11.2024 (Bekanntmachungsdatum)\n\nBerlin Amtsgericht Berlin (Charlottenburg) HRB 159526\nRegisterbekanntmachung nach dem Umwandlungsgesetz 08.11.2024 (Eintragungsdatum)\n\nZiporim Investment GmbH\nGesellschaft mit beschränkter Haftung\nBerlin\n\nZu Eintragungsnummer 19 vom 08.11.2024 wird als nicht eingetragen veröffentlicht: Den Gläubigern der an der Verschmelzung beteiligten Rechtsträger ist, wenn sie binnen sechs Monaten nach dem Tag, an dem die Eintragung der Verschmelzung in das Register des Sitzes desjenigen Rechtsträgers, dessen Gläubiger sie sind, als bekannt gemacht gilt, ihren Anspruch nach Grund und Höhe schriftlich anmelden, Sicherheit zu leisten, soweit sie nicht Befriedigung verlangen können. Dieses Recht steht den Gläubigern jedoch nur zu, wenn sie glaubhaft machen, dass durch die Verschmelzung die Erfüllung ihrer Forderung gefährdet wird. Das Recht, Sicherheitsleistung zu verlangen, steht Gläubigern nicht zu, die im Falle der Insolvenz ein Recht auf vorzugsweise Befriedigung aus einer Deckungsmasse haben, die nach gesetzlicher Vorschrift zu ihrem Schutz errichtet und staatlich überwacht ist."
    },
    {
      "date": "2024-11-08",
      "original_text": "Registerbekanntmachung nach dem Umwandlungsgesetz\nBerlin Amtsgericht Berlin (Charlottenburg) HRB 159526\nZiporim Investment GmbH – Berlin",
      "type": "Registerbekanntmachung nach dem Umwandlungsgesetz",
      "state": "Berlin",
      "amtsgericht": "Amtsgericht Berlin (Charlottenburg)",
      "registernummer": "HRB 159526",
      "registerart": "HRB",
      "company_name": "Ziporim Investment GmbH",
      "company_seat": "Berlin",
      "details": "08.11.2024 (Bekanntmachungsdatum)\n\nBerlin Amtsgericht Berlin (Charlottenburg) HRB 159526\nRegisterbekanntmachung nach dem Umwandlungsgesetz 08.11.2024 (Eintragungsdatum)\n\nZiporim Investment GmbH\nGesellschaft mit beschränkter Haftung\nBerlin\n\nZu Eintragungsnummer 20 vom 08.11.2024 wird als nicht eingetragen veröffentlicht: Den Gläubigern der an der Verschmelzung beteiligten Rechtsträger ist, wenn sie binnen sechs Monaten nach dem Tag, an dem die Eintragung der Verschmelzung in das Register des Sitzes desjenigen Rechtsträgers, dessen Gläubiger sie sind, als bekannt gemacht gilt, ihren Anspruch nach Grund und Höhe schriftlich anmelden, Sicherheit zu leisten, soweit sie nicht Befriedigung verlangen können. Dieses Recht steht den Gläubigern jedoch nur zu, wenn sie glaubhaft machen, dass durch die Verschmelzung die Erfüllung ihrer Forderung gefährdet wird. Das Recht, Sicherheitsleistung zu verlangen, steht Gläubigern nicht zu, die im Falle der Insolvenz ein Recht auf vorzugsweise Befriedigung aus einer Deckungsmasse haben, die nach gesetzlicher Vorschrift zu ihrem Schutz errichtet und staatlich überwacht ist."
    },
    {
      "date": "2024-11-08",
      "original_text": "Registerbekanntmachung nach dem Umwandlungsgesetz\nBerlin Amtsgericht Berlin (Charlottenburg) HRB 159526\nZiporim Investment GmbH – Berlin",
      "type": "Registerbekanntmachung nach dem Umwandlungsgesetz",
      "state": "Berlin",
      "amtsgericht": "Amtsgericht Berlin (Charlottenburg)",
      "registernummer": "HRB 159526",
      "registerart": "HRB",
      "company_name": "Ziporim Investment GmbH",
      "company_seat": "Berlin",
      "details": "08.11.2024 (Bekanntmachungsdatum)\n\nBerlin Amtsgericht Berlin (Charlottenburg) HRB 159526\nRegisterbekanntmachung nach dem Umwandlungsgesetz 08.11.2024 (Eintragungsdatum)\n\nZiporim Investment GmbH\nGesellschaft mit beschränkter Haftung\nBerlin\n\nZu Eintragungsnummer 21 vom 08.11.2024 wird als nicht eingetragen veröffentlicht: Den Gläubigern der an der Verschmelzung beteiligten Rechtsträger ist, wenn sie binnen sechs Monaten nach dem Tag, an dem die Eintragung der Verschmelzung in das Register des Sitzes desjenigen Rechtsträgers, dessen Gläubiger sie sind, als bekannt gemacht gilt, ihren Anspruch nach Grund und Höhe schriftlich anmelden, Sicherheit zu leisten, soweit sie nicht Befriedigung verlangen können. Dieses Recht steht den Gläubigern jedoch nur zu, wenn sie glaubhaft machen, dass durch die Verschmelzung die Erfüllung ihrer Forderung gefährdet wird. Das Recht, Sicherheitsleistung zu verlangen, steht Gläubigern nicht zu, die im Falle der Insolvenz ein Recht auf vorzugsweise Befriedigung aus einer Deckungsmasse haben, die nach gesetzlicher Vorschrift zu ihrem Schutz errichtet und staatlich überwacht ist."
    },
    {
      "date": "2024-11-08",
      "original_text": "Löschungsankündigung\nNordrhein-Westfalen Amtsgericht Gütersloh HRB 11387\nally4ever Event GmbH – Verl",
      "type": "Löschungsankündigung",
      "state": "Nordrhein-Westfalen",
      "amtsgericht": "Amtsgericht Gütersloh",
      "registernummer": "HRB 11387",
      "registerart": "HRB",
      "company_name": "ally4ever Event GmbH",
      "company_seat": "Verl",
      "details": "08.11.2024 (Bekanntmachungsdatum)\n\nNordrhein-Westfalen Amtsgericht Gütersloh HRB 11387\nLöschungsankündigung\n\nally4ever Event GmbH\nGesellschaft mit beschränkter Haftung\nVerl\n\nDas Registergericht beabsichtigt die Gesellschaft von Amts wegen nach § 394 FamFG zu löschen. Die Frist zur Erhebung eines Widerspruchs ist auf einen Monat festgesetzt."
    },
    {
      "date": "2024-11-08",
      "original_text": "Registerbekanntmachung nach dem Umwandlungsgesetz\nSchleswig-Holstein Amtsgericht Kiel HRB 4497\nasg Allgemeine Steuerberatungsgesellschaft mbH – Kiel",
      "type": "Registerbekanntmachung nach dem Umwandlungsgesetz",
      "state": "Schleswig-Holstein",
      "amtsgericht": "Amtsgericht Kiel",
      "registernummer": "HRB 4497",
      "registerart": "HRB",
      "company_name": "asg Allgemeine Steuerberatungsgesellschaft mbH",
      "company_seat": "Kiel",
      "details": "08.11.2024 (Bekanntmachungsdatum)\n\nSchleswig-Holstein Amtsgericht Kiel HRB 4497\nRegisterbekanntmachung nach dem Umwandlungsgesetz 07.11.2024 (Eintragungsdatum)\n\nasg Allgemeine Steuerberatungsgesellschaft mbH\nGesellschaft mit beschränkter Haftung\nKiel\n\nZu Eintragungsnummer 6 vom 07.11.2024 wird als nicht eingetragen veröffentlicht: Den Gläubigern der an der Verschmelzung beteiligten Rechtsträger ist, wenn sie binnen sechs Monaten nach dem Tag, an dem die Eintragung der Verschmelzung in das Register des Sitzes desjenigen Rechtsträgers, dessen Gläubiger sie sind, nach § 19 Abs. 3 UmwG bekannt gemacht worden ist, ihren Anspruch nach Grund und Höhe schriftlich anmelden, Sicherheit zu leisten, soweit sie nicht Befriedigung verlangen können. Dieses Recht steht den Gläubigern jedoch nur zu, wenn sie glaubhaft machen, dass durch die Verschmelzung die Erfüllung ihrer Forderung gefährdet wird."
    },
    {
      "date": "2024-11-08",
      "original_text": "Löschungsankündigung\nBayern Amtsgericht Nürnberg HRB 16880\nblande health care GmbH – Nürnberg",
      "type": "Löschungsankündigung",
      "state": "Bayern",
      "amtsgericht": "Amtsgericht Nürnberg",
      "registernummer": "HRB 16880",
      "registerart": "HRB",
      "company_name": "blande health care GmbH",
      "company_seat": "Nürnberg",
      "details": "08.11.2024 (Bekanntmachungsdatum)\n\nBayern Amtsgericht Nürnberg HRB 16880\nLöschungsankündigung\n\nblande health care GmbH\nGesellschaft mit beschränkter Haftung\nNürnberg\n\nDas Registergericht beabsichtigt, die im Handelsregister eingetragene Gesellschaft wegen Vermögenslosigkeit von Amts wegen nach § 394 FamFG zu löschen. Die Frist zur Erhebung eines Widerspruchs ist auf einen Monat festgesetzt."
    },
    {
      "date": "2024-11-08",
      "original_text": "Registerbekanntmachung nach dem Umwandlungsgesetz\nNiedersachsen Amtsgericht Hannover HRB 224246\nblumläger feld celle gmbh – Hannover",
      "type": "Registerbekanntmachung nach dem Umwandlungsgesetz",
      "state": "Niedersachsen",
      "amtsgericht": "Amtsgericht Hannover",
      "registernummer": "HRB 224246",
      "registerart": "HRB",
      "company_name": "blumläger feld celle gmbh",
      "company_seat": "Hannover",
      "details": "08.11.2024 (Bekanntmachungsdatum)\n\nNiedersachsen Amtsgericht Hannover HRB 224246\nRegisterbekanntmachung nach dem Umwandlungsgesetz 08.11.2024 (Eintragungsdatum)\n\nblumläger feld celle gmbh\nGesellschaft mit beschränkter Haftung\nHannover\n\nDen Gläubigern der an der formwechselnden Umwandlung beteiligten Rechtsträger ist, wenn sie binnen sechs Monaten nach dem Tag, an dem die Eintragung der Umwandlung in das Register des Sitzes desjenigen Rechtsträgers, dessen Gläubiger sie sind, nach § 19 Abs. 3 UmwG als bekannt gemacht gilt, ihren Anspruch nach Grund und Höhe schriftlich anmelden, Sicherheit zu leisten, soweit sie nicht Befriedigung verlangen können. Dieses Recht steht den Gläubigern jedoch nur zu, wenn sie glaubhaft machen, dass durch die formwechselnde Umwandlung die Erfüllung der Forderung gefährdet wird."
    },
    {
      "date": "2024-11-08",
      "original_text": "Registerbekanntmachung nach dem Umwandlungsgesetz\nNiedersachsen Amtsgericht Hannover HRA 206548\nblumläger feld celle gmbh & co. kg – Hannover",
      "type": "Registerbekanntmachung nach dem Umwandlungsgesetz",
      "state": "Niedersachsen",
      "amtsgericht": "Amtsgericht Hannover",
      "registernummer": "HRA 206548",
      "registerart": "HRA",
      "company_name": "blumläger feld celle gmbh & co. kg",
      "company_seat": "Hannover",
      "details": "08.11.2024 (Bekanntmachungsdatum)\n\nNiedersachsen Amtsgericht Hannover HRA 206548\nRegisterbekanntmachung nach dem Umwandlungsgesetz 08.11.2024 (Eintragungsdatum)\n\nblumläger feld celle gmbh & co. kg\nKommanditgesellschaft\nHannover\n\nDen Gläubigern der an der formwechselnden Umwandlung beteiligten Rechtsträger ist, wenn sie binnen sechs Monaten nach dem Tag, an dem die Eintragung der Umwandlung in das Register des Sitzes desjenigen Rechtsträgers, dessen Gläubiger sie sind, nach § 19 Abs. 3 UmwG als bekannt gemacht gilt, ihren Anspruch nach Grund und Höhe schriftlich anmelden, Sicherheit zu leisten, soweit sie nicht Befriedigung verlangen können. Dieses Recht steht den Gläubigern jedoch nur zu, wenn sie glaubhaft machen, dass durch die formwechselnde Umwandlung die Erfüllung der Forderung gefährdet wird."
    },
    {
      "date": "2024-11-08",
      "original_text": "Sonstige Registerbekanntmachung\nNordrhein-Westfalen Amtsgericht Köln HRB 77846\neCademy GmbH – Köln",
      "type": "Sonstige Registerbekanntmachung",
      "state": "Nordrhein-Westfalen",
      "amtsgericht": "Amtsgericht Köln",
      "registernummer": "HRB 77846",
      "registerart": "HRB",
      "company_name": "eCademy GmbH",
      "company_seat": "Köln",
      "details": "08.11.2024 (Bekanntmachungsdatum)\n\nNordrhein-Westfalen Amtsgericht Köln HRB 77846\nSonstige Registerbekanntmachung 08.11.2024 (Eintragungsdatum)\n\neCademy GmbH\nGesellschaft mit beschränkter Haftung\nKöln\n\nAls nicht eingetragen wird veröffentlicht: Den Gläubigern der Gesellschaft, deren Forderungen begründet worden sind bevor die Eintragung der Beendigung des Beherrschungs- und Gewinnabführungsvertrages  in das Handelsregister nach § 10 des Handelsgesetzbuches als bekanntgemacht gilt, hat der andere Vertragsteil Sicherheit zu leisten, wenn sie sich binnen sechs Monaten nach der Bekanntmachung der Eintragung zu diesem Zweck bei ihm melden."
    },
    {
      "date": "2024-11-08",
      "original_text": "Einreichung neuer Dokumente\nBayern Amtsgericht München HRB 238885\nisarlend GmbH – München",
      "type": "Einreichung neuer Dokumente",
      "state": "Bayern",
      "amtsgericht": "Amtsgericht München",
      "registernummer": "HRB 238885",
      "registerart": "HRB",
      "company_name": "isarlend GmbH",
      "company_seat": "München",
      "details": "08.11.2024 (Bekanntmachungsdatum)\n\nBayern Amtsgericht München HRB 238885\nEinreichung neuer Dokumente\n\nisarlend GmbH\nGesellschaft mit beschränkter Haftung\nMünchen\n\nDem Amtsgericht München -Registergericht- ist eine Liste der Mitglieder des Beirats eingereicht worden, § 52 Abs. 3 S. 2 GmbHG."
    },
    {
      "date": "2024-11-08",
      "original_text": "Löschungsankündigung\nBayern Amtsgericht Nürnberg HRB 30866\nlogodirekt GmbH – Nürnberg",
      "type": "Löschungsankündigung",
      "state": "Bayern",
      "amtsgericht": "Amtsgericht Nürnberg",
      "registernummer": "HRB 30866",
      "registerart": "HRB",
      "company_name": "logodirekt GmbH",
      "company_seat": "Nürnberg",
      "details": "08.11.2024 (Bekanntmachungsdatum)\n\nBayern Amtsgericht Nürnberg HRB 30866\nLöschungsankündigung\n\nlogodirekt GmbH\nGesellschaft mit beschränkter Haftung\nNürnberg\n\nDas Registergericht beabsichtigt, die im Handelsregister eingetragene Gesellschaft wegen Vermögenslosigkeit von Amts wegen nach § 394 FamFG zu löschen. Die Frist zur Erhebung eines Widerspruchs ist auf einen Monat festgesetzt."
    },
    {
      "date": "2024-11-08",
      "original_text": "Registerbekanntmachung nach dem Umwandlungsgesetz\nHessen Amtsgericht Kassel HRA 17273\nmeinmarketing.de GmbH & Co. KG – Kassel",
      "type": "Registerbekanntmachung nach dem Umwandlungsgesetz",
      "state": "Hessen",
      "amtsgericht": "Amtsgericht Kassel",
      "registernummer": "HRA 17273",
      "registerart": "HRA",
      "company_name": "meinmarketing.de GmbH & Co. KG",
      "company_seat": "Kassel",
      "details": "08.11.2024 (Bekanntmachungsdatum)\n\nHessen Amtsgericht Kassel HRA 17273\nRegisterbekanntmachung nach dem Umwandlungsgesetz 08.11.2024 (Eintragungsdatum)\n\nmeinmarketing.de GmbH & Co. KG\nKommanditgesellschaft\nKassel\n\nDen Gläubigern der an der Verschmelzung beteiligten Rechtsträger ist, wenn sie binnen sechs Monaten nach dem Tag, an dem die Eintragung der Verschmelzung in das Register des Sitzes derjenigen Rechtsträger deren Gläubiger sie sind, nach § 19 Absatz 3 UmwG bekannt gemacht worden ist, ihren Anspruch nach Grund und Höhe schriftlich anmelden, Sicherheit zu leisten, soweit sie nicht Befriedigung verlangen können. Dieses Recht steht den Gläubigern jedoch nur zu, wenn sie glaubhaft machen, dass durch die Verschmelzung die Erfüllung ihrer Forderung gefährdet wird."
    },
    {
      "date": "2024-11-08",
      "original_text": "Registerbekanntmachung nach dem Umwandlungsgesetz\nNordrhein-Westfalen Amtsgericht Wuppertal HRB 34767\nproALPHA B&W GmbH – Wuppertal",
      "type": "Registerbekanntmachung nach dem Umwandlungsgesetz",
      "state": "Nordrhein-Westfalen",
      "amtsgericht": "Amtsgericht Wuppertal",
      "registernummer": "HRB 34767",
      "registerart": "HRB",
      "company_name": "proALPHA B&W GmbH",
      "company_seat": "Wuppertal",
      "details": "08.11.2024 (Bekanntmachungsdatum)\n\nNordrhein-Westfalen Amtsgericht Wuppertal HRB 34767\nRegisterbekanntmachung nach dem Umwandlungsgesetz 08.11.2024 (Eintragungsdatum)\n\nproALPHA B&W GmbH\nGesellschaft mit beschränkter Haftung\nWuppertal\n\nDen Gläubigern der an der Verschmelzung beteiligten Rechtsträger ist, wenn sie binnen sechs Monaten nach dem Tag, an dem die Eintragung der Verschmelzung in das Register des Sitzes derjenigen Rechtsträger deren Gläubiger sie sind, nach § 19 Absatz 3 UmwG als bekanntgemacht gilt, ihren Anspruch nach Grund und Höhe schriftlich anmelden, Sicherheit zu leisten, soweit sie nicht Befriedigung verlangen können. Dieses Recht steht den Gläubigern jedoch nur zu, wenn sie glaubhaft machen, dass durch die Verschmelzung die Erfüllung ihrer Forderung gefährdet wird."
    }
  ]
}