{
  "date": "2025-12-10",
  "date_of_scrape": "2025-12-11T04:18:52.669Z",
  "tool_version": "0.2.0",
  "number_of_announcements": 127,
  "announcements": [
    {
      "date": "2025-12-10",
      "id": "139582",
      "original_text": "Löschungsankündigung\nBayern Amtsgericht München HRB 164643\nAgens-Engineering GmbH – Ismaning",
      "type": "Löschungsankündigung",
      "state": "Bayern",
      "amtsgericht": "Amtsgericht München",
      "registernummer": "HRB 164643",
      "registerart": "HRB",
      "company_name": "Agens-Engineering GmbH",
      "company_seat": "Ismaning",
      "details": "10.12.2025 (Bekanntmachungsdatum)\n\nBayern Amtsgericht München HRB 164643\nLöschungsankündigung 09.12.2025 (Eintragungsdatum)\n\nAgens-Engineering GmbH\nGesellschaft mit beschränkter Haftung\nIsmaning\n\nDen Gläubigern der Gesellschaft, deren Forderungen begründet worden sind, bevor die Eintragung der Beendigung des Beherrschungs- und Gewinnabführungsvertrages in das Handelsregister nach § 10 des Handelsgesetzbuches als bekanntgemacht gilt, hat der andere Vertragsteil Sicherheit zu leisten, wenn sie sich binnen sechs Monaten nach der Bekanntmachung der Eintragung zu diesem Zweck bei ihm melden."
    },
    {
      "date": "2025-12-10",
      "id": "139583",
      "original_text": "Registerbekanntmachung nach dem Umwandlungsgesetz\nBayern Amtsgericht Ingolstadt HRB 12650\nLackiercenter Pförring GmbH – Pförring",
      "type": "Registerbekanntmachung nach dem Umwandlungsgesetz",
      "state": "Bayern",
      "amtsgericht": "Amtsgericht Ingolstadt",
      "registernummer": "HRB 12650",
      "registerart": "HRB",
      "company_name": "Lackiercenter Pförring GmbH",
      "company_seat": "Pförring",
      "details": "10.12.2025 (Bekanntmachungsdatum)\n\nBayern Amtsgericht Ingolstadt HRB 12650\nRegisterbekanntmachung nach dem Umwandlungsgesetz 09.12.2025 (Eintragungsdatum)\n\nLackiercenter Pförring GmbH\nGesellschaft mit beschränkter Haftung\nPförring\n\nDen Gläubigern der an der Ausgliederung beteiligten Rechtsträger ist, wenn sie binnen sechs Monaten nach dem Tag, an dem die Eintragung der Ausgliederung in das Register des Sitzes desjenigen Rechtsträgers, dessen Gläubiger sie sind, nach §§ 125, 19 Abs. 3 UmwG als bekannt gemacht gilt, ihren Anspruch nach Grund und Höhe in Textform anmelden, Sicherheit zu leisten, soweit sie nicht Befriedigung verlangen können. Dieses Recht steht den Gläubigern jedoch nur zu, wenn sie glaubhaft machen, dass durch die Ausgliederung die Erfüllung ihrer Forderung gefährdet wird."
    },
    {
      "date": "2025-12-10",
      "id": "139584",
      "original_text": "Einreichung neuer Dokumente\nBayern Amtsgericht München HRB 2212\nAllianz Private Krankenversicherungs-Aktiengesellschaft – München",
      "type": "Einreichung neuer Dokumente",
      "state": "Bayern",
      "amtsgericht": "Amtsgericht München",
      "registernummer": "HRB 2212",
      "registerart": "HRB",
      "company_name": "Allianz Private Krankenversicherungs-Aktiengesellschaft",
      "company_seat": "München",
      "details": "10.12.2025 (Bekanntmachungsdatum)\n\nBayern Amtsgericht München HRB 2212\nEinreichung neuer Dokumente 09.12.2025 (Eintragungsdatum)\n\nAllianz Private Krankenversicherungs-Aktiengesellschaft\nAktiengesellschaft\nMünchen\n\nDem Amtsgericht München -Registergericht- ist eine Liste der Mitglieder des Aufsichtsrats eingereicht worden, § 106 AktG."
    },
    {
      "date": "2025-12-10",
      "id": "139585",
      "original_text": "Registerbekanntmachung nach dem Umwandlungsgesetz\nBayern Amtsgericht München HRB 237104\nELT AcquiCo GmbH – Puchheim",
      "type": "Registerbekanntmachung nach dem Umwandlungsgesetz",
      "state": "Bayern",
      "amtsgericht": "Amtsgericht München",
      "registernummer": "HRB 237104",
      "registerart": "HRB",
      "company_name": "ELT AcquiCo GmbH",
      "company_seat": "Puchheim",
      "details": "10.12.2025 (Bekanntmachungsdatum)\n\nBayern Amtsgericht München HRB 237104\nRegisterbekanntmachung nach dem Umwandlungsgesetz 09.12.2025 (Eintragungsdatum)\n\nELT AcquiCo GmbH\nGesellschaft mit beschränkter Haftung\nPuchheim\n\nDen Gläubigern der an der Verschmelzung beteiligten Rechtsträger ist, wenn sie binnen sechs Monaten nach dem Tag, an dem die Eintragung der Verschmelzung in das Register des Sitzes desjenigen Rechtsträgers, dessen Gläubiger sie sind, nach § 19 Abs. 3 UmwG als bekannt gemacht gilt, ihren Anspruch nach Grund und Höhe in Textform anmelden, Sicherheit zu leisten, soweit sie nicht Befriedigung verlangen können. Dieses Recht steht den Gläubigern jedoch nur zu, wenn sie glaubhaft machen, dass durch die Verschmelzung die Erfüllung ihrer Forderung gefährdet wird."
    },
    {
      "date": "2025-12-10",
      "id": "139586",
      "original_text": "Einreichung neuer Dokumente\nBayern Amtsgericht München HRB 252412\nB-4it AG – München",
      "type": "Einreichung neuer Dokumente",
      "state": "Bayern",
      "amtsgericht": "Amtsgericht München",
      "registernummer": "HRB 252412",
      "registerart": "HRB",
      "company_name": "B-4it AG",
      "company_seat": "München",
      "details": "10.12.2025 (Bekanntmachungsdatum)\n\nBayern Amtsgericht München HRB 252412\nEinreichung neuer Dokumente 09.12.2025 (Eintragungsdatum)\n\nB-4it AG\nAktiengesellschaft\nMünchen\n\nDem Amtsgericht München -Registergericht- ist eine Liste der Mitglieder des Aufsichtsrats eingereicht worden, § 106 AktG."
    },
    {
      "date": "2025-12-10",
      "id": "139587",
      "original_text": "Registerbekanntmachung nach dem Umwandlungsgesetz\nBayern Amtsgericht München HRB 288178\nHowden Deutschland AG – München",
      "type": "Registerbekanntmachung nach dem Umwandlungsgesetz",
      "state": "Bayern",
      "amtsgericht": "Amtsgericht München",
      "registernummer": "HRB 288178",
      "registerart": "HRB",
      "company_name": "Howden Deutschland AG",
      "company_seat": "München",
      "details": "10.12.2025 (Bekanntmachungsdatum)\n\nBayern Amtsgericht München HRB 288178\nRegisterbekanntmachung nach dem Umwandlungsgesetz 09.12.2025 (Eintragungsdatum)\n\nHowden Deutschland AG\nAktiengesellschaft\nMünchen\n\nDen Gläubigern der an der Verschmelzung beteiligten Rechtsträger ist, wenn sie binnen sechs Monaten nach dem Tag, an dem die Eintragung der Verschmelzung in das Register des Sitzes desjenigen Rechtsträgers, dessen Gläubiger sie sind, nach § 19 Abs. 3 UmwG als bekannt gemacht gilt, ihren Anspruch nach Grund und Höhe in Textform anmelden, Sicherheit zu leisten, soweit sie nicht Befriedigung verlangen können. Dieses Recht steht den Gläubigern jedoch nur zu, wenn sie glaubhaft machen, dass durch die Verschmelzung die Erfüllung ihrer Forderung gefährdet wird."
    },
    {
      "date": "2025-12-10",
      "id": "139588",
      "original_text": "Einreichung neuer Dokumente\nBayern Amtsgericht Kempten (Allgäu) HRB 4153\nCooper Standard GmbH – Lindau (B)",
      "type": "Einreichung neuer Dokumente",
      "state": "Bayern",
      "amtsgericht": "Amtsgericht Kempten (Allgäu)",
      "registernummer": "HRB 4153",
      "registerart": "HRB",
      "company_name": "Cooper Standard GmbH",
      "company_seat": "Lindau (B)",
      "details": "10.12.2025 (Bekanntmachungsdatum)\n\nBayern Amtsgericht Kempten (Allgäu) HRB 4153\nEinreichung neuer Dokumente 09.12.2025 (Eintragungsdatum)\n\nCooper Standard GmbH\nGesellschaft mit beschränkter Haftung\nLindau (B)\n\nDem Amtsgericht Kempten (Allgäu) -Registergericht- ist eine Liste der Mitglieder des Aufsichtsrats eingereicht worden, § 52 Abs. 3 S. 2 GmbHG."
    },
    {
      "date": "2025-12-10",
      "id": "139589",
      "original_text": "Einreichung neuer Dokumente\nBayern Amtsgericht München HRB 281696\nEviden Germany GmbH – München",
      "type": "Einreichung neuer Dokumente",
      "state": "Bayern",
      "amtsgericht": "Amtsgericht München",
      "registernummer": "HRB 281696",
      "registerart": "HRB",
      "company_name": "Eviden Germany GmbH",
      "company_seat": "München",
      "details": "10.12.2025 (Bekanntmachungsdatum)\n\nBayern Amtsgericht München HRB 281696\nEinreichung neuer Dokumente\n\nEviden Germany GmbH\nGesellschaft mit beschränkter Haftung\nMünchen\n\nDem Amtsgericht München -Registergericht- ist eine Liste der Mitglieder des Aufsichtsrats eingereicht worden, § 52 Abs. 3 S. 2 GmbHG."
    },
    {
      "date": "2025-12-10",
      "id": "139590",
      "original_text": "Registerbekanntmachung nach dem Umwandlungsgesetz\nBayern Amtsgericht Weiden i. d. OPf. HRB 4235\naquagroup AG – Weiden in der Oberpfalz",
      "type": "Registerbekanntmachung nach dem Umwandlungsgesetz",
      "state": "Bayern",
      "amtsgericht": "Amtsgericht Weiden i. d. OPf.",
      "registernummer": "HRB 4235",
      "registerart": "HRB",
      "company_name": "aquagroup AG",
      "company_seat": "Weiden in der Oberpfalz",
      "details": "10.12.2025 (Bekanntmachungsdatum)\n\nBayern Amtsgericht Weiden i. d. OPf. HRB 4235\nRegisterbekanntmachung nach dem Umwandlungsgesetz 09.12.2025 (Eintragungsdatum)\n\naquagroup AG\nAktiengesellschaft\nWeiden in der Oberpfalz\n\nDen Gläubigern des formwechselnden Rechtsträgers ist, wenn sie binnen sechs Monaten nach dem Tag, an dem die Eintragung des Formwechsels nach § 201 UmwG als bekannt gemacht gilt, ihren Anspruch nach Grund und Höhe in Textform anmelden, Sicherheit zu leisten, soweit sie nicht Befriedigung verlangen können. Dieses Recht steht den Gläubigern jedoch nur zu, wenn sie glaubhaft machen, dass durch den Formwechsel die Erfüllung ihrer Forderung gefährdet wird"
    },
    {
      "date": "2025-12-10",
      "id": "139591",
      "original_text": "Registerbekanntmachung nach dem Umwandlungsgesetz\nBayern Amtsgericht Regensburg HRB 13157\nzvoove Consulting GmbH – Regensburg",
      "type": "Registerbekanntmachung nach dem Umwandlungsgesetz",
      "state": "Bayern",
      "amtsgericht": "Amtsgericht Regensburg",
      "registernummer": "HRB 13157",
      "registerart": "HRB",
      "company_name": "zvoove Consulting GmbH",
      "company_seat": "Regensburg",
      "details": "10.12.2025 (Bekanntmachungsdatum)\n\nBayern Amtsgericht Regensburg HRB 13157\nRegisterbekanntmachung nach dem Umwandlungsgesetz 09.12.2025 (Eintragungsdatum)\n\nzvoove Consulting GmbH\nGesellschaft mit beschränkter Haftung\nRegensburg\n\nDen Gläubigern der an der Verschmelzung beteiligten Rechtsträger ist, wenn sie binnen sechs Monaten nach dem Tag, an dem die Eintragung der Verschmelzung in das Register des Sitzes desjenigen Rechtsträgers, dessen Gläubiger sie sind, nach § 19 Abs. 3 UmwG als bekannt gemacht gilt, ihren Anspruch nach Grund und Höhe in Textform anmelden, Sicherheit zu leisten, soweit sie nicht Befriedigung verlangen können. Dieses Recht steht den Gläubigern jedoch nur zu, wenn sie glaubhaft machen, dass durch die Verschmelzung die Erfüllung ihrer Forderung gefährdet wird."
    },
    {
      "date": "2025-12-10",
      "id": "139592",
      "original_text": "Registerbekanntmachung nach dem Umwandlungsgesetz\nBayern Amtsgericht München HRB 145766\nAB Cube Germany GmbH – München",
      "type": "Registerbekanntmachung nach dem Umwandlungsgesetz",
      "state": "Bayern",
      "amtsgericht": "Amtsgericht München",
      "registernummer": "HRB 145766",
      "registerart": "HRB",
      "company_name": "AB Cube Germany GmbH",
      "company_seat": "München",
      "details": "10.12.2025 (Bekanntmachungsdatum)\n\nBayern Amtsgericht München HRB 145766\nRegisterbekanntmachung nach dem Umwandlungsgesetz 09.12.2025 (Eintragungsdatum)\n\nAB Cube Germany GmbH\nGesellschaft mit beschränkter Haftung\nMünchen\n\nDen Gläubigern der an der Verschmelzung beteiligten Rechtsträger ist, wenn sie binnen sechs Monaten nach dem Tag, an dem die Eintragung der Verschmelzung in das Register des Sitzes desjenigen Rechtsträgers, dessen Gläubiger sie sind, nach § 19 Abs. 3 UmwG als bekannt gemacht gilt, ihren Anspruch nach Grund und Höhe in Textform anmelden, Sicherheit zu leisten, soweit sie nicht Befriedigung verlangen können. Dieses Recht steht den Gläubigern jedoch nur zu, wenn sie glaubhaft machen, dass durch die Verschmelzung die Erfüllung ihrer Forderung gefährdet wird."
    },
    {
      "date": "2025-12-10",
      "id": "139593",
      "original_text": "Registerbekanntmachung nach dem Umwandlungsgesetz\nBayern Amtsgericht Augsburg HRA 22048\nAuto-Service-Klatt e.K. – Eching am Ammersee",
      "type": "Registerbekanntmachung nach dem Umwandlungsgesetz",
      "state": "Bayern",
      "amtsgericht": "Amtsgericht Augsburg",
      "registernummer": "HRA 22048",
      "registerart": "HRA",
      "company_name": "Auto-Service-Klatt e.K.",
      "company_seat": "Eching am Ammersee",
      "details": "10.12.2025 (Bekanntmachungsdatum)\n\nBayern Amtsgericht Augsburg HRA 22048\nRegisterbekanntmachung nach dem Umwandlungsgesetz 09.12.2025 (Eintragungsdatum)\n\nAuto-Service-Klatt e.K.\nEinzelkaufmann / Einzelkauffrau\nEching am Ammersee\n\nDen Gläubigern der an der Ausgliederung beteiligten Rechtsträger ist, wenn sie binnen sechs Monaten nach dem Tag, an dem die Eintragung der Ausgliederung in das Register des Sitzes desjenigen Rechtsträgers, dessen Gläubiger sie sind, nach §§ 125, 19 Abs. 3 UmwG als bekannt gemacht gilt, ihren Anspruch nach Grund und Höhe in Textform anmelden, Sicherheit zu leisten, soweit sie nicht Befriedigung verlangen können. Dieses Recht steht den Gläubigern jedoch nur zu, wenn sie glaubhaft machen, dass durch die Ausgliederung die Erfüllung ihrer Forderung gefährdet wird."
    },
    {
      "date": "2025-12-10",
      "id": "139594",
      "original_text": "Löschungsankündigung\nBayern Amtsgericht München HRB 188375\nMurdaca Ristorante GmbH – München",
      "type": "Löschungsankündigung",
      "state": "Bayern",
      "amtsgericht": "Amtsgericht München",
      "registernummer": "HRB 188375",
      "registerart": "HRB",
      "company_name": "Murdaca Ristorante GmbH",
      "company_seat": "München",
      "details": "10.12.2025 (Bekanntmachungsdatum)\n\nBayern Amtsgericht München HRB 188375\nLöschungsankündigung\n\nMurdaca Ristorante GmbH\nGesellschaft mit beschränkter Haftung\nMünchen\n\nDas Registergericht beabsichtigt, die im Handelsregister eingetragene Gesellschaft wegen Vermögenslosigkeit von Amts wegen nach § 394 FamFG zu löschen. #insert(Text=\"zztb_V_Widerspruchsfrist\")"
    },
    {
      "date": "2025-12-10",
      "id": "139595",
      "original_text": "Registerbekanntmachung nach dem Umwandlungsgesetz\nBayern Amtsgericht München HRB 129584\nSPS-Verwaltungsgesellschaft Sales Promotions & Solutions mbH – Erding",
      "type": "Registerbekanntmachung nach dem Umwandlungsgesetz",
      "state": "Bayern",
      "amtsgericht": "Amtsgericht München",
      "registernummer": "HRB 129584",
      "registerart": "HRB",
      "company_name": "SPS-Verwaltungsgesellschaft Sales Promotions & Solutions mbH",
      "company_seat": "Erding",
      "details": "10.12.2025 (Bekanntmachungsdatum)\n\nBayern Amtsgericht München HRB 129584\nRegisterbekanntmachung nach dem Umwandlungsgesetz 09.12.2025 (Eintragungsdatum)\n\nSPS-Verwaltungsgesellschaft Sales Promotions & Solutions mbH\nGesellschaft mit beschränkter Haftung\nErding\n\nDen Gläubigern der an der Verschmelzung beteiligten Rechtsträger ist, wenn sie binnen sechs Monaten nach dem Tag, an dem die Eintragung der Verschmelzung in das Register des Sitzes desjenigen Rechtsträgers, dessen Gläubiger sie sind, nach § 19 Abs. 3 UmwG als bekannt gemacht gilt, ihren Anspruch nach Grund und Höhe in Textform anmelden, Sicherheit zu leisten, soweit sie nicht Befriedigung verlangen können. Dieses Recht steht den Gläubigern jedoch nur zu, wenn sie glaubhaft machen, dass durch die Verschmelzung die Erfüllung ihrer Forderung gefährdet wird."
    },
    {
      "date": "2025-12-10",
      "id": "139596",
      "original_text": "Einreichung neuer Dokumente\nBayern Amtsgericht München HRB 234787\nLinde Holding GmbH – Pullach i.Isartal",
      "type": "Einreichung neuer Dokumente",
      "state": "Bayern",
      "amtsgericht": "Amtsgericht München",
      "registernummer": "HRB 234787",
      "registerart": "HRB",
      "company_name": "Linde Holding GmbH",
      "company_seat": "Pullach i.Isartal",
      "details": "10.12.2025 (Bekanntmachungsdatum)\n\nBayern Amtsgericht München HRB 234787\nEinreichung neuer Dokumente\n\nLinde Holding GmbH\nGesellschaft mit beschränkter Haftung\nPullach i.Isartal\n\nDem Amtsgericht München -Registergericht- ist eine Liste der Mitglieder des Aufsichtsrats eingereicht worden, § 52 Abs. 3 S. 2 GmbHG."
    },
    {
      "date": "2025-12-10",
      "id": "139597",
      "original_text": "Registerbekanntmachung nach dem Umwandlungsgesetz\nBayern Amtsgericht Traunstein HRA 15132\nVermietung und Verpachtung Manuela Bobenstetter-Kroll e.K. – Perach",
      "type": "Registerbekanntmachung nach dem Umwandlungsgesetz",
      "state": "Bayern",
      "amtsgericht": "Amtsgericht Traunstein",
      "registernummer": "HRA 15132",
      "registerart": "HRA",
      "company_name": "Vermietung und Verpachtung Manuela Bobenstetter-Kroll e.K.",
      "company_seat": "Perach",
      "details": "10.12.2025 (Bekanntmachungsdatum)\n\nBayern Amtsgericht Traunstein HRA 15132\nRegisterbekanntmachung nach dem Umwandlungsgesetz 09.12.2025 (Eintragungsdatum)\n\nVermietung und Verpachtung Manuela Bobenstetter-Kroll e.K.\nEinzelkaufmann / Einzelkauffrau\nPerach\n\nDen Gläubigern der an der Ausgliederung beteiligten Rechtsträger ist, wenn sie binnen sechs Monaten nach dem Tag, an dem die Eintragung der Ausgliederung in das Register des Sitzes desjenigen Rechtsträgers, dessen Gläubiger sie sind, nach §§ 125, 19 Abs. 3 UmwG als bekannt gemacht gilt, ihren Anspruch nach Grund und Höhe in Textform anmelden, Sicherheit zu leisten, soweit sie nicht Befriedigung verlangen können. Dieses Recht steht den Gläubigern jedoch nur zu, wenn sie glaubhaft machen, dass durch die Ausgliederung die Erfüllung ihrer Forderung gefährdet wird."
    },
    {
      "date": "2025-12-10",
      "id": "139598",
      "original_text": "Registerbekanntmachung nach dem Umwandlungsgesetz\nBayern Amtsgericht Augsburg HRB 33810\nPittini-Stahl GmbH – Aichach",
      "type": "Registerbekanntmachung nach dem Umwandlungsgesetz",
      "state": "Bayern",
      "amtsgericht": "Amtsgericht Augsburg",
      "registernummer": "HRB 33810",
      "registerart": "HRB",
      "company_name": "Pittini-Stahl GmbH",
      "company_seat": "Aichach",
      "details": "10.12.2025 (Bekanntmachungsdatum)\n\nBayern Amtsgericht Augsburg HRB 33810\nRegisterbekanntmachung nach dem Umwandlungsgesetz 09.12.2025 (Eintragungsdatum)\n\nPittini-Stahl GmbH\nGesellschaft mit beschränkter Haftung\nAichach\n\nDen Gläubigern der an der Verschmelzung beteiligten Rechtsträger ist, wenn sie binnen sechs Monaten nach dem Tag, an dem die Eintragung der Verschmelzung in das Register des Sitzes desjenigen Rechtsträgers, dessen Gläubiger sie sind, nach § 19 Abs. 3 UmwG als bekannt gemacht gilt, ihren Anspruch nach Grund und Höhe in Textform anmelden, Sicherheit zu leisten, soweit sie nicht Befriedigung verlangen können. Dieses Recht steht den Gläubigern jedoch nur zu, wenn sie glaubhaft machen, dass durch die Verschmelzung die Erfüllung ihrer Forderung gefährdet wird."
    },
    {
      "date": "2025-12-10",
      "id": "139599",
      "original_text": "Löschungsankündigung\nBayern Amtsgericht München HRB 286926\nKANOS Holding GmbH – Germering",
      "type": "Löschungsankündigung",
      "state": "Bayern",
      "amtsgericht": "Amtsgericht München",
      "registernummer": "HRB 286926",
      "registerart": "HRB",
      "company_name": "KANOS Holding GmbH",
      "company_seat": "Germering",
      "details": "10.12.2025 (Bekanntmachungsdatum)\n\nBayern Amtsgericht München HRB 286926\nLöschungsankündigung 09.12.2025 (Eintragungsdatum)\n\nKANOS Holding GmbH\nGesellschaft mit beschränkter Haftung\nGermering\n\nDas Registergericht beabsichtigt, die im Handelsregister eingetragene Gesellschaft wegen Vermögenslosigkeit von Amts wegen nach § 394 FamFG zu löschen. Die Frist zur Erhebung eines Widerspruchs ist auf 3 Monate festgesetzt."
    },
    {
      "date": "2025-12-10",
      "id": "139600",
      "original_text": "Registerbekanntmachung nach dem Umwandlungsgesetz\nBayern Amtsgericht Ingolstadt HRA 4419\nGeorg Haas Lackiererei e.K. – Pförring",
      "type": "Registerbekanntmachung nach dem Umwandlungsgesetz",
      "state": "Bayern",
      "amtsgericht": "Amtsgericht Ingolstadt",
      "registernummer": "HRA 4419",
      "registerart": "HRA",
      "company_name": "Georg Haas Lackiererei e.K.",
      "company_seat": "Pförring",
      "details": "10.12.2025 (Bekanntmachungsdatum)\n\nBayern Amtsgericht Ingolstadt HRA 4419\nRegisterbekanntmachung nach dem Umwandlungsgesetz 09.12.2025 (Eintragungsdatum)\n\nGeorg Haas Lackiererei e.K.\nEinzelkaufmann / Einzelkauffrau\nPförring\n\nDen Gläubigern der an der Ausgliederung beteiligten Rechtsträger ist, wenn sie binnen sechs Monaten nach dem Tag, an dem die Eintragung der Ausgliederung in das Register des Sitzes desjenigen Rechtsträgers, dessen Gläubiger sie sind, nach §§ 125, 19 Abs. 3 UmwG als bekannt gemacht gilt, ihren Anspruch nach Grund und Höhe in Textform anmelden, Sicherheit zu leisten, soweit sie nicht Befriedigung verlangen können. Dieses Recht steht den Gläubigern jedoch nur zu, wenn sie glaubhaft machen, dass durch die Ausgliederung die Erfüllung ihrer Forderung gefährdet wird."
    },
    {
      "date": "2025-12-10",
      "id": "139601",
      "original_text": "Registerbekanntmachung nach dem Umwandlungsgesetz\nBayern Amtsgericht München HRB 299002\nGoldburg Holding GmbH – Gilching",
      "type": "Registerbekanntmachung nach dem Umwandlungsgesetz",
      "state": "Bayern",
      "amtsgericht": "Amtsgericht München",
      "registernummer": "HRB 299002",
      "registerart": "HRB",
      "company_name": "Goldburg Holding GmbH",
      "company_seat": "Gilching",
      "details": "10.12.2025 (Bekanntmachungsdatum)\n\nBayern Amtsgericht München HRB 299002\nRegisterbekanntmachung nach dem Umwandlungsgesetz 09.12.2025 (Eintragungsdatum)\n\nGoldburg Holding GmbH\nGesellschaft mit beschränkter Haftung\nGilching\n\nDen Gläubigern der an der Ausgliederung beteiligten Rechtsträger ist, wenn sie binnen sechs Monaten nach dem Tag, an dem die Eintragung der Ausgliederung in das Register des Sitzes desjenigen Rechtsträgers, dessen Gläubiger sie sind, nach §§ 125, 19 Abs. 3 UmwG als bekannt gemacht gilt, ihren Anspruch nach Grund und Höhe in Textform anmelden, Sicherheit zu leisten, soweit sie nicht Befriedigung verlangen können. Dieses Recht steht den Gläubigern jedoch nur zu, wenn sie glaubhaft machen, dass durch die Ausgliederung die Erfüllung ihrer Forderung gefährdet wird."
    },
    {
      "date": "2025-12-10",
      "id": "139602",
      "original_text": "Löschungsankündigung\nBayern Amtsgericht Coburg HRB 6871\nWI LOGISTICS UG (haftungsbeschränkt) – Stockheim",
      "type": "Löschungsankündigung",
      "state": "Bayern",
      "amtsgericht": "Amtsgericht Coburg",
      "registernummer": "HRB 6871",
      "registerart": "HRB",
      "company_name": "WI LOGISTICS UG (haftungsbeschränkt)",
      "company_seat": "Stockheim",
      "details": "10.12.2025 (Bekanntmachungsdatum)\n\nBayern Amtsgericht Coburg HRB 6871\nLöschungsankündigung 05.12.2025 (Eintragungsdatum)\n\nWI LOGISTICS UG (haftungsbeschränkt)\nGesellschaft mit beschränkter Haftung\nStockheim\n\nDas Registergericht beabsichtigt, die im Handelsregister eingetragene Gesellschaft wegen Vermögenslosigkeit von Amts wegen nach § 394 FamFG zu löschen. Die Frist zur Erhebung eines Widerspruchs ist auf sechs Wochen festgesetzt."
    },
    {
      "date": "2025-12-10",
      "id": "139603",
      "original_text": "Registerbekanntmachung nach dem Umwandlungsgesetz\nBayern Amtsgericht München HRB 126685\nAHS MÜNCHEN Aviation Handling Services GmbH – München",
      "type": "Registerbekanntmachung nach dem Umwandlungsgesetz",
      "state": "Bayern",
      "amtsgericht": "Amtsgericht München",
      "registernummer": "HRB 126685",
      "registerart": "HRB",
      "company_name": "AHS MÜNCHEN Aviation Handling Services GmbH",
      "company_seat": "München",
      "details": "10.12.2025 (Bekanntmachungsdatum)\n\nBayern Amtsgericht München HRB 126685\nRegisterbekanntmachung nach dem Umwandlungsgesetz 09.12.2025 (Eintragungsdatum)\n\nAHS MÜNCHEN Aviation Handling Services GmbH\nGesellschaft mit beschränkter Haftung\nMünchen\n\nDen Gläubigern der an der Verschmelzung beteiligten Rechtsträger ist, wenn sie binnen sechs Monaten nach dem Tag, an dem die Eintragung der Verschmelzung in das Register des Sitzes desjenigen Rechtsträgers, dessen Gläubiger sie sind, nach § 19 Abs. 3 UmwG als bekannt gemacht gilt, ihren Anspruch nach Grund und Höhe in Textform anmelden, Sicherheit zu leisten, soweit sie nicht Befriedigung verlangen können. Dieses Recht steht den Gläubigern jedoch nur zu, wenn sie glaubhaft machen, dass durch die Verschmelzung die Erfüllung ihrer Forderung gefährdet wird."
    },
    {
      "date": "2025-12-10",
      "id": "139604",
      "original_text": "Registerbekanntmachung nach dem Umwandlungsgesetz\nBayern Amtsgericht München HRB 231622\nDaiichi Sankyo Oncology Europe GmbH – München",
      "type": "Registerbekanntmachung nach dem Umwandlungsgesetz",
      "state": "Bayern",
      "amtsgericht": "Amtsgericht München",
      "registernummer": "HRB 231622",
      "registerart": "HRB",
      "company_name": "Daiichi Sankyo Oncology Europe GmbH",
      "company_seat": "München",
      "details": "10.12.2025 (Bekanntmachungsdatum)\n\nBayern Amtsgericht München HRB 231622\nRegisterbekanntmachung nach dem Umwandlungsgesetz 09.12.2025 (Eintragungsdatum)\n\nDaiichi Sankyo Oncology Europe GmbH\nGesellschaft mit beschränkter Haftung\nMünchen\n\nDen Gläubigern der an der Verschmelzung beteiligten Rechtsträger ist, wenn sie binnen sechs Monaten nach dem Tag, an dem die Eintragung der Verschmelzung in das Register des Sitzes desjenigen Rechtsträgers, dessen Gläubiger sie sind, nach § 19 Abs. 3 UmwG als bekannt gemacht gilt, ihren Anspruch nach Grund und Höhe in Textform anmelden, Sicherheit zu leisten, soweit sie nicht Befriedigung verlangen können. Dieses Recht steht den Gläubigern jedoch nur zu, wenn sie glaubhaft machen, dass durch die Verschmelzung die Erfüllung ihrer Forderung gefährdet wird."
    },
    {
      "date": "2025-12-10",
      "id": "139605",
      "original_text": "Registerbekanntmachung nach dem Umwandlungsgesetz\nBayern Amtsgericht Augsburg HRB 15386\nSTEELAG Deutschland GmbH – Aichach",
      "type": "Registerbekanntmachung nach dem Umwandlungsgesetz",
      "state": "Bayern",
      "amtsgericht": "Amtsgericht Augsburg",
      "registernummer": "HRB 15386",
      "registerart": "HRB",
      "company_name": "STEELAG Deutschland GmbH",
      "company_seat": "Aichach",
      "details": "10.12.2025 (Bekanntmachungsdatum)\n\nBayern Amtsgericht Augsburg HRB 15386\nRegisterbekanntmachung nach dem Umwandlungsgesetz 09.12.2025 (Eintragungsdatum)\n\nSTEELAG Deutschland GmbH\nGesellschaft mit beschränkter Haftung\nAichach\n\nDen Gläubigern der an der Verschmelzung beteiligten Rechtsträger ist, wenn sie binnen sechs Monaten nach dem Tag, an dem die Eintragung der Verschmelzung in das Register des Sitzes desjenigen Rechtsträgers, dessen Gläubiger sie sind, nach § 19 Abs. 3 UmwG als bekannt gemacht gilt, ihren Anspruch nach Grund und Höhe in Textform anmelden, Sicherheit zu leisten, soweit sie nicht Befriedigung verlangen können. Dieses Recht steht den Gläubigern jedoch nur zu, wenn sie glaubhaft machen, dass durch die Verschmelzung die Erfüllung ihrer Forderung gefährdet wird."
    },
    {
      "date": "2025-12-10",
      "id": "139606",
      "original_text": "Löschungsankündigung\nBayern Amtsgericht München HRB 166024\nBold Group GmbH – München",
      "type": "Löschungsankündigung",
      "state": "Bayern",
      "amtsgericht": "Amtsgericht München",
      "registernummer": "HRB 166024",
      "registerart": "HRB",
      "company_name": "Bold Group GmbH",
      "company_seat": "München",
      "details": "10.12.2025 (Bekanntmachungsdatum)\n\nBayern Amtsgericht München HRB 166024\nLöschungsankündigung 09.12.2025 (Eintragungsdatum)\n\nBold Group GmbH\nGesellschaft mit beschränkter Haftung\nMünchen\n\nDas Registergericht beabsichtigt, die im Handelsregister eingetragene Gesellschaft wegen Vermögenslosigkeit von Amts wegen nach § 394 FamFG zu löschen. Die Frist zur Erhebung eines Widerspruchs ist auf drei Monate festgesetzt."
    },
    {
      "date": "2025-12-10",
      "id": "139607",
      "original_text": "Löschungsankündigung\nBayern Amtsgericht Fürth HRB 14647\ntn-medien Marketing UG (haftungsbeschränkt) – Seukendorf",
      "type": "Löschungsankündigung",
      "state": "Bayern",
      "amtsgericht": "Amtsgericht Fürth",
      "registernummer": "HRB 14647",
      "registerart": "HRB",
      "company_name": "tn-medien Marketing UG (haftungsbeschränkt)",
      "company_seat": "Seukendorf",
      "details": "10.12.2025 (Bekanntmachungsdatum)\n\nBayern Amtsgericht Fürth HRB 14647\nLöschungsankündigung 09.12.2024 (Eintragungsdatum)\n\ntn-medien Marketing UG (haftungsbeschränkt)\nGesellschaft mit beschränkter Haftung\nSeukendorf\n\nDas Registergericht beabsichtigt, die im Handelsregister eingetragene Gesellschaft wegen Vermögenslosigkeit von Amts wegen nach § 394 FamFG zu löschen. Die Frist zur Erhebung eines Widerspruchs ist auf drei Monate festgesetzt."
    },
    {
      "date": "2025-12-10",
      "id": "139608",
      "original_text": "Einreichung neuer Dokumente\nBayern Amtsgericht München HRB 167912\nMaHö Vermögensverwaltungs AG – München",
      "type": "Einreichung neuer Dokumente",
      "state": "Bayern",
      "amtsgericht": "Amtsgericht München",
      "registernummer": "HRB 167912",
      "registerart": "HRB",
      "company_name": "MaHö Vermögensverwaltungs AG",
      "company_seat": "München",
      "details": "10.12.2025 (Bekanntmachungsdatum)\n\nBayern Amtsgericht München HRB 167912\nEinreichung neuer Dokumente\n\nMaHö Vermögensverwaltungs AG\nAktiengesellschaft\nMünchen\n\nDem Amtsgericht München -Registergericht- ist eine Liste der Mitglieder des Aufsichtsrats eingereicht worden, § 106 AktG."
    },
    {
      "date": "2025-12-10",
      "id": "139609",
      "original_text": "Löschungsankündigung\nBayern Amtsgericht München HRB 269526\nElektro-General UG (haftungsbeschränkt) – München",
      "type": "Löschungsankündigung",
      "state": "Bayern",
      "amtsgericht": "Amtsgericht München",
      "registernummer": "HRB 269526",
      "registerart": "HRB",
      "company_name": "Elektro-General UG (haftungsbeschränkt)",
      "company_seat": "München",
      "details": "10.12.2025 (Bekanntmachungsdatum)\n\nBayern Amtsgericht München HRB 269526\nLöschungsankündigung 09.12.2025 (Eintragungsdatum)\n\nElektro-General UG (haftungsbeschränkt)\nGesellschaft mit beschränkter Haftung\nMünchen\n\nDas Registergericht beabsichtigt, die im Handelsregister eingetragene Gesellschaft wegen Vermögenslosigkeit von Amts wegen nach § 394 FamFG zu löschen. Die Frist zur Erhebung eines Widerspruchs ist auf drei Monate festgesetzt."
    },
    {
      "date": "2025-12-10",
      "id": "139610",
      "original_text": "Sonstige Registerbekanntmachung\nBaden-Württemberg Amtsgericht Mannheim HRB 713739\nCatalent Germany Eberbach GmbH – Eberbach",
      "type": "Sonstige Registerbekanntmachung",
      "state": "Baden-Württemberg",
      "amtsgericht": "Amtsgericht Mannheim",
      "registernummer": "HRB 713739",
      "registerart": "HRB",
      "company_name": "Catalent Germany Eberbach GmbH",
      "company_seat": "Eberbach",
      "details": "10.12.2025 (Bekanntmachungsdatum)\n\nBaden-Württemberg Amtsgericht Mannheim HRB 713739\nSonstige Registerbekanntmachung 10.12.2025 (Eintragungsdatum)\n\nCatalent Germany Eberbach GmbH\nGesellschaft mit beschränkter Haftung\nEberbach\n\nDie Gesellschaft hat am 12.11./19.11.2025 die Liste über die Zusammensetzung des Aufsichtsrats zum Handelsregister eingereicht."
    },
    {
      "date": "2025-12-10",
      "id": "139611",
      "original_text": "Löschungsankündigung\nSaarland Amtsgericht Saarbrücken HRB 105730\nKronauer Handelsgesellschaft mbH – St. Ingbert",
      "type": "Löschungsankündigung",
      "state": "Saarland",
      "amtsgericht": "Amtsgericht Saarbrücken",
      "registernummer": "HRB 105730",
      "registerart": "HRB",
      "company_name": "Kronauer Handelsgesellschaft mbH",
      "company_seat": "St. Ingbert",
      "details": "10.12.2025 (Bekanntmachungsdatum)\n\nSaarland Amtsgericht Saarbrücken HRB 105730\nLöschungsankündigung\n\nKronauer Handelsgesellschaft mbH\nGesellschaft mit beschränkter Haftung\nSt. Ingbert\n\nEs ist beabsichtigt, die Gesellschaft von Amts wegen gemäß § 394 FamFG wegen Vermögenslosigkeit zu löschen.\nGegen die Löschung von Amts wegen ist das Rechtsmittel des Widerspruchs statthaft. Der Widerspruch ist binnen einer Frist einem Monat beginnend mit dem Tag dieser Veröffentlichung durch Einreichen eines Widerspruchsschreibens -schriftlich oder zur Niederschrift der Geschäftsstelle beim Amtsgericht Saarbrücken, -zentrales Handelsregister-, Mainzerstr.178, 66121 Saarbrücken einzulegen.\nDer Widerspruch muss die Bezeichnung der angefochtenen Löschungsankündigung enthalten sowie die Erklärung, dass Widerspruch eingelegt wird. Er ist vom Widerspruchsführer oder seinem Bevollmächtigten zu unterzeichnen.\nDas Widerspruchsschreiben kann auch in der Form eines elektronischen Dokumentes eingereicht werden, das mit einer qualifizierten elektronischen Signatur nach dem Signaturgesetz versehen sein muss (§§ 14 Abs. 2 FamFG, 130a, 298 ZPO)."
    },
    {
      "date": "2025-12-10",
      "id": "139612",
      "original_text": "Registerbekanntmachung nach dem Umwandlungsgesetz\nBaden-Württemberg Amtsgericht Stuttgart HRB 752938\nIBM Deutschland Verwaltung GmbH – Ehningen",
      "type": "Registerbekanntmachung nach dem Umwandlungsgesetz",
      "state": "Baden-Württemberg",
      "amtsgericht": "Amtsgericht Stuttgart",
      "registernummer": "HRB 752938",
      "registerart": "HRB",
      "company_name": "IBM Deutschland Verwaltung GmbH",
      "company_seat": "Ehningen",
      "details": "10.12.2025 (Bekanntmachungsdatum)\n\nBaden-Württemberg Amtsgericht Stuttgart HRB 752938\nRegisterbekanntmachung nach dem Umwandlungsgesetz 10.12.2025 (Eintragungsdatum)\n\nIBM Deutschland Verwaltung GmbH\nGesellschaft mit beschränkter Haftung\nEhningen\n\nDen Gläubigern der an der Verschmelzung beteiligten Rechtsträger ist, wenn sie binnen sechs Monaten nach dem Tag, an dem die Eintragung der Verschmelzung in das Register des Sitzes desjenigen Rechtsträgers, dessen Gläubiger sie sind, nach § 19 Abs. 3 UmwG als bekanntgemacht gilt, ihren Anspruch nach Grund und Höhe schriftlich anmelden, Sicherheit zu leisten, soweit sie nicht Befriedigung verlangen können. Dieses Recht steht den Gläubigern jedoch nur zu, wenn sie glaubhaft machen, dass durch die Verschmelzung die Erfüllung ihrer Forderung gefährdet wird."
    },
    {
      "date": "2025-12-10",
      "id": "139613",
      "original_text": "Registerbekanntmachung nach dem Umwandlungsgesetz\nBaden-Württemberg Amtsgericht Stuttgart HRB 803033\nF&G Pfaff GmbH – Rottweil",
      "type": "Registerbekanntmachung nach dem Umwandlungsgesetz",
      "state": "Baden-Württemberg",
      "amtsgericht": "Amtsgericht Stuttgart",
      "registernummer": "HRB 803033",
      "registerart": "HRB",
      "company_name": "F&G Pfaff GmbH",
      "company_seat": "Rottweil",
      "details": "10.12.2025 (Bekanntmachungsdatum)\n\nBaden-Württemberg Amtsgericht Stuttgart HRB 803033\nRegisterbekanntmachung nach dem Umwandlungsgesetz 10.12.2025 (Eintragungsdatum)\n\nF&G Pfaff GmbH\nGesellschaft mit beschränkter Haftung\nRottweil\n\nAls nicht eingetragen wird bekanntgemacht:\nDen Gläubigern des an dem Formwechsel beteiligten Rechtsträgers ist, wenn sie binnen sechs Monaten nach dem Tag, an dem die Eintragung des Formwechsels in das Register des Sitzes desjenigen Rechtsträgers, dessen Gläubiger sie sind, nach § 19 Abs. 3 UmwG als bekanntgemacht gilt, ihren Anspruch nach Grund und Höhe schriftlich anmelden, Sicherheit zu leisten, soweit sie nicht Befriedigung verlangen können. Dieses Recht steht den Gläubigern jedoch nur zu, wenn sie glaubhaft machen, dass durch den Formwechsel die Erfüllung ihrer Forderung gefährdet wird."
    },
    {
      "date": "2025-12-10",
      "id": "139614",
      "original_text": "Registerbekanntmachung nach dem Umwandlungsgesetz\nBaden-Württemberg Amtsgericht Stuttgart GsR 4198\nGünther und Florian Pfaff eGbR – Rottweil",
      "type": "Registerbekanntmachung nach dem Umwandlungsgesetz",
      "state": "Baden-Württemberg",
      "amtsgericht": "Amtsgericht Stuttgart",
      "registernummer": "GsR 4198",
      "registerart": "GsR",
      "company_name": "Günther und Florian Pfaff eGbR",
      "company_seat": "Rottweil",
      "details": "10.12.2025 (Bekanntmachungsdatum)\n\nBaden-Württemberg Amtsgericht Stuttgart GsR 4198\nRegisterbekanntmachung nach dem Umwandlungsgesetz 10.12.2025 (Eintragungsdatum)\n\nGünther und Florian Pfaff eGbR\nGesellschaft bürgerlichen Rechts\nRottweil\n\nAls nicht eingetragen wird bekanntgemacht:\nDen Gläubigern des an dem Formwechsel beteiligten Rechtsträgers ist, wenn sie binnen sechs Monaten nach dem Tag, an dem die Eintragung des Formwechsels in das Register des Sitzes desjenigen Rechtsträgers, dessen Gläubiger sie sind, nach § 19 Abs. 3 UmwG als bekanntgemacht gilt, ihren Anspruch nach Grund und Höhe schriftlich anmelden, Sicherheit zu leisten, soweit sie nicht Befriedigung verlangen können. Dieses Recht steht den Gläubigern jedoch nur zu, wenn sie glaubhaft machen, dass durch den Formwechsel die Erfüllung ihrer Forderung gefährdet wird."
    },
    {
      "date": "2025-12-10",
      "id": "139615",
      "original_text": "Löschungsankündigung\nBaden-Württemberg Amtsgericht Mannheim HRB 732928\nMechFS GmbH – Mannheim",
      "type": "Löschungsankündigung",
      "state": "Baden-Württemberg",
      "amtsgericht": "Amtsgericht Mannheim",
      "registernummer": "HRB 732928",
      "registerart": "HRB",
      "company_name": "MechFS GmbH",
      "company_seat": "Mannheim",
      "details": "10.12.2025 (Bekanntmachungsdatum)\n\nBaden-Württemberg Amtsgericht Mannheim HRB 732928\nLöschungsankündigung\n\nMechFS GmbH\nGesellschaft mit beschränkter Haftung\nMannheim\n\nDas Gericht beabsichtigt, die Gesellschaft wegen Vermögenslosigkeit im Handelsregister von Amts wegen nach § 394 FamFG zu löschen. Die Frist zur Geltendmachung eines Widerspruchs gegen die beabsichtigte Löschung ist auf einen Monat ab Veröffentlichung bestimmt."
    },
    {
      "date": "2025-12-10",
      "id": "139616",
      "original_text": "Löschungsankündigung\nBaden-Württemberg Amtsgericht Stuttgart HRA 728904\nalsus GmbH & Co. KG – Öhringen",
      "type": "Löschungsankündigung",
      "state": "Baden-Württemberg",
      "amtsgericht": "Amtsgericht Stuttgart",
      "registernummer": "HRA 728904",
      "registerart": "HRA",
      "company_name": "alsus GmbH & Co. KG",
      "company_seat": "Öhringen",
      "details": "10.12.2025 (Bekanntmachungsdatum)\n\nBaden-Württemberg Amtsgericht Stuttgart HRA 728904\nLöschungsankündigung\n\nalsus GmbH & Co. KG\nKommanditgesellschaft\nÖhringen\n\nDas Gericht beabsichtigt, die Gesellschaft wegen Vermögenslosigkeit im Handelsregister von Amts wegen nach § 394 FamFG zu löschen. Die Frist zur Geltendmachung eines Widerspruchs gegen die beabsichtigte Löschung ist auf zwei Monate ab Veröffentlichung bestimmt."
    },
    {
      "date": "2025-12-10",
      "id": "139617",
      "original_text": "Löschungsankündigung\nSaarland Amtsgericht Saarbrücken HRB 101036\nennotec GmbH – St. Ingbert",
      "type": "Löschungsankündigung",
      "state": "Saarland",
      "amtsgericht": "Amtsgericht Saarbrücken",
      "registernummer": "HRB 101036",
      "registerart": "HRB",
      "company_name": "ennotec GmbH",
      "company_seat": "St. Ingbert",
      "details": "10.12.2025 (Bekanntmachungsdatum)\n\nSaarland Amtsgericht Saarbrücken HRB 101036\nLöschungsankündigung\n\nennotec GmbH\nGesellschaft mit beschränkter Haftung\nSt. Ingbert\n\nEs ist beabsichtigt, die Gesellschaft von Amts wegen gemäß § 394 FamFG wegen Vermögenslosigkeit zu löschen.\nGegen die Löschung von Amts wegen ist das Rechtsmittel des Widerspruchs statthaft. Der Widerspruch ist binnen einer Frist zwei Monaten beginnend mit dem Tag dieser Veröffentlichung durch Einreichen eines Widerspruchsschreibens -schriftlich oder zur Niederschrift der Geschäftsstelle beim Amtsgericht Saarbrücken, -zentrales Handelsregister-, Mainzerstr.178, 66121 Saarbrücken einzulegen.\nDer Widerspruch muss die Bezeichnung der angefochtenen Löschungsankündigung enthalten sowie die Erklärung, dass Widerspruch eingelegt wird. Er ist vom Widerspruchsführer oder seinem Bevollmächtigten zu unterzeichnen.\nDas Widerspruchsschreiben kann auch in der Form eines elektronischen Dokumentes eingereicht werden, das mit einer qualifizierten elektronischen Signatur nach dem Signaturgesetz versehen sein muss (§§ 14 Abs. 2 FamFG, 130a, 298 ZPO)."
    },
    {
      "date": "2025-12-10",
      "id": "139618",
      "original_text": "Registerbekanntmachung nach dem Umwandlungsgesetz\nBaden-Württemberg Amtsgericht Stuttgart HRB 777733\nFalkenstein Forst KGaA – Löwenstein",
      "type": "Registerbekanntmachung nach dem Umwandlungsgesetz",
      "state": "Baden-Württemberg",
      "amtsgericht": "Amtsgericht Stuttgart",
      "registernummer": "HRB 777733",
      "registerart": "HRB",
      "company_name": "Falkenstein Forst KGaA",
      "company_seat": "Löwenstein",
      "details": "10.12.2025 (Bekanntmachungsdatum)\n\nBaden-Württemberg Amtsgericht Stuttgart HRB 777733\nRegisterbekanntmachung nach dem Umwandlungsgesetz 10.12.2025 (Eintragungsdatum)\n\nFalkenstein Forst KGaA\nKommanditgesellschaft auf Aktien\nLöwenstein\n\nAls nicht eingetragen wird bekanntgemacht:\nDen Gläubigern der an der Verschmelzung beteiligten Rechtsträger ist, wenn sie binnen sechs Monaten nach dem Tag, an dem die Eintragung der Verschmelzung in das Register des Sitzes desjenigen Rechtsträgers, dessen Gläubiger sie sind, nach § 19 Abs. 3 UmwG als bekanntgemacht gilt, ihren Anspruch nach Grund und Höhe schriftlich anmelden, Sicherheit zu leisten, soweit sie nicht Befriedigung verlangen können. Dieses Recht steht den Gläubigern jedoch nur zu, wenn sie glaubhaft machen, dass durch die Verschmelzung die Erfüllung ihrer Forderung gefährdet wird."
    },
    {
      "date": "2025-12-10",
      "id": "139619",
      "original_text": "Löschungsankündigung\nBaden-Württemberg Amtsgericht Stuttgart HRB 769200\nB ConZept GmbH – Sindelfingen",
      "type": "Löschungsankündigung",
      "state": "Baden-Württemberg",
      "amtsgericht": "Amtsgericht Stuttgart",
      "registernummer": "HRB 769200",
      "registerart": "HRB",
      "company_name": "B ConZept GmbH",
      "company_seat": "Sindelfingen",
      "details": "10.12.2025 (Bekanntmachungsdatum)\n\nBaden-Württemberg Amtsgericht Stuttgart HRB 769200\nLöschungsankündigung\n\nB ConZept GmbH\nGesellschaft mit beschränkter Haftung\nSindelfingen\n\nAls nicht eingetragen wird bekanntgemacht:\nDas Gericht beabsichtigt, die Gesellschaft wegen Vermögenslosigkeit im Handelsregister von Amts wegen nach § 394 FamFG zu löschen. Die Frist zur Geltendmachung eines Widerspruchs gegen die beabsichtigte Löschung ist auf zwei Monate ab Veröffentlichung bestimmt."
    },
    {
      "date": "2025-12-10",
      "id": "139620",
      "original_text": "Registerbekanntmachung nach dem Umwandlungsgesetz\nBaden-Württemberg Amtsgericht Stuttgart HRB 799536\nInfoniqa Group Holding GmbH – Böblingen",
      "type": "Registerbekanntmachung nach dem Umwandlungsgesetz",
      "state": "Baden-Württemberg",
      "amtsgericht": "Amtsgericht Stuttgart",
      "registernummer": "HRB 799536",
      "registerart": "HRB",
      "company_name": "Infoniqa Group Holding GmbH",
      "company_seat": "Böblingen",
      "details": "10.12.2025 (Bekanntmachungsdatum)\n\nBaden-Württemberg Amtsgericht Stuttgart HRB 799536\nRegisterbekanntmachung nach dem Umwandlungsgesetz\n\nInfoniqa Group Holding GmbH\nGesellschaft mit beschränkter Haftung\nBöblingen\n\nDie Gesellschaft hat am 04.12.2025 den Entwurf des Verschmelzungsvertrages zwischen \"WP GG Holdings VI B.V.\", Amsterdam (Amtsgericht Kamer van Koophandel 77468309)\nund der hiesigen Gesellschaft (übernehmender Rechtsträger) zum Handelsregister eingereicht.\n\nGrenzüberschreitende Verschmelzung der WP GG Holdings VI B.V., Amsterdam,\nNiederlande, auf die Infoniqa Group Holding GmbH, Böblingen,\nDeutschland\n- Bekanntmachung gemäß § 308 Abs. 1 Satz 2, 3 UmwG, § 10 HGB -\nDas Leitungsorgan der WP GG Holdings VI B.V. mit satzungsmäßigem Sitz in Amsterdam,\nNiederlande, eingetragen im Handelsregister der niederländischen Handelskammer\n(Kamer van Koophandel) unter Registernummer 77468309, mit\neingetragener Geschäftsanschrift in Eduard van Beinumstraat 8 Unit 6, 1077CZ\nAmsterdam, Niederlande, und die Geschäftsführung der Infoniqa Group Holding\nGmbH mit Sitz in Böblingen, Deutschland, eingetragen im Handelsregister des\nAmtsgerichts Stuttgart unter HRB 799536, mit Geschäftsadresse in Wolfgang\nBrumme-Allee 3, 71034 Böblingen, Deutschland, beabsichtigen, die WP GG Holdings\nVI B.V. als übertragende Gesellschaft auf die Infoniqa Group Holding GmbH\nals übernehmende Gesellschaft im Wege der Verschmelzung durch Aufnahme\ngrenzüberschreitend zu verschmelzen.\nEs werden daher gemäß § 308 Abs. 1 Satz 2, 3 Umwandlungsgesetz (UmwG) in\nVerbindung mit § 10 Handelsgesetzbuch (HGB) die folgenden Angaben bekanntgemacht:\n1. Der gemeinsame Verschmelzungsplan betreffend die grenzüberschreitende\nVerschmelzung der WP GG Holdings VI B.V. (übertragende Gesellschaft)\nauf die Infoniqa Group Holding GmbH (übernehmende\nGesellschaft) ist im Entwurf gemäß § 308 Abs. 1 Satz 1 UmwG beim\nHandelsregister eingereicht worden (§ 308 Abs. 1 Satz 2 Nr. 1\nUmwG).\n2. Rechtsform, Firma und Sitz der an der grenzüberschreitenden Verschmelzung\nbeteiligten Gesellschaften (§ 308 Abs. 1 Satz 2 Nr. 2\nUmwG)\n(a) WP GG Holdings VI B.V.\nRechtsform: besloten vennootschap niederländischen Rechts\nFirma: WP GG Holdings VI B.V.\nSitz: Eduard van Beinumstraat 8 Unit 6, 1077CZ Amsterdam, Niederlande\n(b) Infoniqa Group Holding GmbH\nRechtsform: Gesellschaft mit beschränkter Haftung\nFirma: Infoniqa Group Holding GmbH\n2 | 2\nSitz: Wolfgang Brumme-Allee 3, 71034 Böblingen, Deutschland\n3. Register, bei denen die an der grenzüberschreitenden Verschmelzung\nbeteiligten Gesellschaften eingetragen sind, sowie die jeweilige Registernummer\n(§ 308 Abs. 1 Satz 2 Nr. 3 UmwG)\n(a) WP GG Holdings VI B.V.\nHandelsregister der niederländischen Handelskammer (Kamer van Koophandel)\nunter Registernummer 77468309\n(b) Infoniqa Group Holding GmbH\nHandelsregister des Amtsgerichts Stuttgart unter HRB 799536\n4. Hinweis an folgende Personen, dass sie der jeweiligen Gesellschaft\nspätestens fünf Arbeitstage vor dem Tag der Gesellschafterversammlung\nder übernehmenden Gesellschaft Bemerkungen zum Verschmelzungsplan\nübermitteln können:\na) an die Anteilsinhaber und Gläubiger der an der grenzüberschreitenden\nVerschmelzung beteiligten Gesellschaften sowie\nb) an die zuständigen Betriebsräte der an der grenzüberschreitenden\nVerschmelzung beteiligten Gesellschaften oder, soweit es\nkeinen Betriebsrat gibt, an die Arbeitnehmer der an der grenzüberschreitenden\nVerschmelzung beteiligten Gesellschaften\n(§ 308 Abs. 1 Satz 2 Nr. 4 UmwG).\nDie Gesellschafterversammlung der Infoniqa Group Holding GmbH, in der über\ndie Zustimmung zum gemeinsamen Verschmelzungsplan Beschluss gefasst\nwerden soll, soll voraussichtlich in der Woche vom 18. August 2025 stattfinden.\nAnteilsinhaber, Gläubiger sowie die zuständigen Betriebsräte und, soweit einschlägig,\ndie Arbeitnehmer der Infoniqa Group Holding GmbH und der WP GG\nHoldings VI B.V. können der jeweiligen Gesellschaft spätestens fünf Arbeitstage\nvor dem Tag der Gesellschafterversammlung der übernehmenden Gesellschaft,\nin der über die Zustimmung zum gemeinsamen Verschmelzungsplan\nBeschluss gefasst werden soll, Bemerkungen zum Entwurf des gemeinsamen\nVerschmelzungsplans übermitteln.\nBöblingen, den 1. Juli 2025\nInfoniqa Group Holding GmbH\nDie Geschäftsführung"
    },
    {
      "date": "2025-12-10",
      "id": "139621",
      "original_text": "Registerbekanntmachung nach dem Umwandlungsgesetz\nBaden-Württemberg Amtsgericht Stuttgart HRB 801348\nTPH Bausysteme GmbH – Stuttgart",
      "type": "Registerbekanntmachung nach dem Umwandlungsgesetz",
      "state": "Baden-Württemberg",
      "amtsgericht": "Amtsgericht Stuttgart",
      "registernummer": "HRB 801348",
      "registerart": "HRB",
      "company_name": "TPH Bausysteme GmbH",
      "company_seat": "Stuttgart",
      "details": "10.12.2025 (Bekanntmachungsdatum)\n\nBaden-Württemberg Amtsgericht Stuttgart HRB 801348\nRegisterbekanntmachung nach dem Umwandlungsgesetz 10.12.2025 (Eintragungsdatum)\n\nTPH Bausysteme GmbH\nGesellschaft mit beschränkter Haftung\nStuttgart\n\nAls nicht eingetragen wird bekanntgemacht:\nDen Gläubigern der an der Verschmelzung beteiligten Rechtsträger ist, wenn sie binnen sechs Monaten nach dem Tag, an dem die Eintragung der Verschmelzung in das Register des Sitzes desjenigen Rechtsträgers, dessen Gläubiger sie sind, nach § 19 Abs. 3 UmwG als bekanntgemacht gilt, ihren Anspruch nach Grund und Höhe schriftlich anmelden, Sicherheit zu leisten, soweit sie nicht Befriedigung verlangen können. Dieses Recht steht den Gläubigern jedoch nur zu, wenn sie glaubhaft machen, dass durch die Verschmelzung die Erfüllung ihrer Forderung gefährdet wird."
    },
    {
      "date": "2025-12-10",
      "id": "139622",
      "original_text": "Registerbekanntmachung nach dem Umwandlungsgesetz\nBaden-Württemberg Amtsgericht Mannheim HRB 6410\nBunge Deutschland GmbH – Mannheim",
      "type": "Registerbekanntmachung nach dem Umwandlungsgesetz",
      "state": "Baden-Württemberg",
      "amtsgericht": "Amtsgericht Mannheim",
      "registernummer": "HRB 6410",
      "registerart": "HRB",
      "company_name": "Bunge Deutschland GmbH",
      "company_seat": "Mannheim",
      "details": "10.12.2025 (Bekanntmachungsdatum)\n\nBaden-Württemberg Amtsgericht Mannheim HRB 6410\nRegisterbekanntmachung nach dem Umwandlungsgesetz 10.12.2025 (Eintragungsdatum)\n\nBunge Deutschland GmbH\nGesellschaft mit beschränkter Haftung\nMannheim\n\nAls nicht eingetragen wird bekanntgemacht:\nDen Gläubigern der an der Verschmelzung beteiligten Rechtsträger ist, wenn sie binnen sechs Monaten nach dem Tag, an dem die Eintragung der Verschmelzung in das Register des Sitzes desjenigen Rechtsträgers, dessen Gläubiger sie sind, nach § 19 Abs. 3 UmwG als bekanntgemacht gilt, ihren Anspruch nach Grund und Höhe schriftlich anmelden, Sicherheit zu leisten, soweit sie nicht Befriedigung verlangen können. Dieses Recht steht den Gläubigern jedoch nur zu, wenn sie glaubhaft machen, dass durch die Verschmelzung die Erfüllung ihrer Forderung gefährdet wird."
    },
    {
      "date": "2025-12-10",
      "id": "139623",
      "original_text": "Registerbekanntmachung nach dem Umwandlungsgesetz\nBrandenburg Amtsgericht Potsdam HRB 28527\nBirdShirt GmbH – Michendorf",
      "type": "Registerbekanntmachung nach dem Umwandlungsgesetz",
      "state": "Brandenburg",
      "amtsgericht": "Amtsgericht Potsdam",
      "registernummer": "HRB 28527",
      "registerart": "HRB",
      "company_name": "BirdShirt GmbH",
      "company_seat": "Michendorf",
      "details": "10.12.2025 (Bekanntmachungsdatum)\n\nBrandenburg Amtsgericht Potsdam HRB 28527\nRegisterbekanntmachung nach dem Umwandlungsgesetz 06.12.2025 (Eintragungsdatum)\n\nBirdShirt GmbH\nGesellschaft mit beschränkter Haftung\nMichendorf\n\nZu Eintragungsnummer 3 vom 06.12.2025 wird als nicht eingetragen veröffentlicht: Den Gläubigern der an der Verschmelzung beteiligten Rechtsträger ist, wenn sie binnen sechs Monaten nach dem Tag, an dem die Eintragung der Verschmelzung in das Register des Sitzes desjenigen Rechtsträgers, dessen Gläubiger sie sind, als bekannt gemacht gilt, ihren Anspruch nach Grund und Höhe schriftlich anmelden, Sicherheit zu leisten, soweit sie nicht Befriedigung verlangen können. Dieses Recht steht den Gläubigern jedoch nur zu, wenn sie glaubhaft machen, dass durch die Verschmelzung die Erfüllung ihrer Forderung gefährdet wird."
    },
    {
      "date": "2025-12-10",
      "id": "139624",
      "original_text": "Löschungsankündigung\nBaden-Württemberg Amtsgericht Stuttgart HRB 755435\nParola Design GmbH – Hechingen",
      "type": "Löschungsankündigung",
      "state": "Baden-Württemberg",
      "amtsgericht": "Amtsgericht Stuttgart",
      "registernummer": "HRB 755435",
      "registerart": "HRB",
      "company_name": "Parola Design GmbH",
      "company_seat": "Hechingen",
      "details": "10.12.2025 (Bekanntmachungsdatum)\n\nBaden-Württemberg Amtsgericht Stuttgart HRB 755435\nLöschungsankündigung\n\nParola Design GmbH\nGesellschaft mit beschränkter Haftung\nHechingen\n\nAls nicht eingetragen wird bekanntgemacht:\nDas Gericht beabsichtigt, die Gesellschaft wegen Vermögenslosigkeit im Handelsregister von Amts wegen nach § 394 FamFG zu löschen. Die Frist zur Geltendmachung eines Widerspruchs gegen die beabsichtigte Löschung ist auf zwei Monate ab Veröffentlichung bestimmt."
    },
    {
      "date": "2025-12-10",
      "id": "139625",
      "original_text": "Löschungsankündigung\nBerlin Amtsgericht Berlin (Charlottenburg) HRB 160409\nPapaya Media & Entertainment GmbH – Berlin",
      "type": "Löschungsankündigung",
      "state": "Berlin",
      "amtsgericht": "Amtsgericht Berlin (Charlottenburg)",
      "registernummer": "HRB 160409",
      "registerart": "HRB",
      "company_name": "Papaya Media & Entertainment GmbH",
      "company_seat": "Berlin",
      "details": "10.12.2025 (Bekanntmachungsdatum)\n\nBerlin Amtsgericht Berlin (Charlottenburg) HRB 160409\nLöschungsankündigung\n\nPapaya Media & Entertainment GmbH\nGesellschaft mit beschränkter Haftung\nBerlin\n\nBei der nachstehenden Gesellschaft wird das Amtslöschungsverfahren gemäß § 394 FamFG eingeleitet. Widerspruchsfrist\n6 Wochen."
    },
    {
      "date": "2025-12-10",
      "id": "139626",
      "original_text": "Registerbekanntmachung nach dem Umwandlungsgesetz\nBrandenburg Amtsgericht Potsdam HRB 20712\nChristoph Abraham Ausbau & Montage GmbH – Michendorf",
      "type": "Registerbekanntmachung nach dem Umwandlungsgesetz",
      "state": "Brandenburg",
      "amtsgericht": "Amtsgericht Potsdam",
      "registernummer": "HRB 20712",
      "registerart": "HRB",
      "company_name": "Christoph Abraham Ausbau & Montage GmbH",
      "company_seat": "Michendorf",
      "details": "10.12.2025 (Bekanntmachungsdatum)\n\nBrandenburg Amtsgericht Potsdam HRB 20712\nRegisterbekanntmachung nach dem Umwandlungsgesetz 06.12.2025 (Eintragungsdatum)\n\nChristoph Abraham Ausbau & Montage GmbH\nGesellschaft mit beschränkter Haftung\nMichendorf\n\nZu Eintragungsnummer 5 vom 06.12.2025 wird als nicht eingetragen veröffentlicht: Den Gläubigern der an der Verschmelzung beteiligten Rechtsträger ist, wenn sie binnen sechs Monaten nach dem Tag, an dem die Eintragung der Verschmelzung in das Register des Sitzes desjenigen Rechtsträgers, dessen Gläubiger sie sind, als bekannt gemacht gilt, ihren Anspruch nach Grund und Höhe schriftlich anmelden, Sicherheit zu leisten, soweit sie nicht Befriedigung verlangen können. Dieses Recht steht den Gläubigern jedoch nur zu, wenn sie glaubhaft machen, dass durch die Verschmelzung die Erfüllung ihrer Forderung gefährdet wird."
    },
    {
      "date": "2025-12-10",
      "id": "139627",
      "original_text": "Löschungsankündigung\nBaden-Württemberg Amtsgericht Freiburg HRA 706215\nAS Heizung und Sanitär e.K. – Gutach im Breisgau",
      "type": "Löschungsankündigung",
      "state": "Baden-Württemberg",
      "amtsgericht": "Amtsgericht Freiburg",
      "registernummer": "HRA 706215",
      "registerart": "HRA",
      "company_name": "AS Heizung und Sanitär e.K.",
      "company_seat": "Gutach im Breisgau",
      "details": "10.12.2025 (Bekanntmachungsdatum)\n\nBaden-Württemberg Amtsgericht Freiburg HRA 706215\nLöschungsankündigung\n\nAS Heizung und Sanitär e.K.\nEinzelkaufmann / Einzelkauffrau\nGutach im Breisgau\n\nAls nicht eingetragen wird bekanntgemacht:\nDas Registergericht beabsichtigt, die Firma im Handelsregister von Amts wegen nach § 31 Abs. 2 HGB zu löschen. Die Frist zur Geltendmachung eines Widerspruchs gegen die beabsichtigte Löschung ist auf einen Monat ab Veröffentlichung bestimmt."
    },
    {
      "date": "2025-12-10",
      "id": "139628",
      "original_text": "Registerbekanntmachung nach dem Umwandlungsgesetz\nBerlin Amtsgericht Berlin (Charlottenburg) HRB 232148\nTB Lead UG (haftungsbeschränkt) – Berlin",
      "type": "Registerbekanntmachung nach dem Umwandlungsgesetz",
      "state": "Berlin",
      "amtsgericht": "Amtsgericht Berlin (Charlottenburg)",
      "registernummer": "HRB 232148",
      "registerart": "HRB",
      "company_name": "TB Lead UG (haftungsbeschränkt)",
      "company_seat": "Berlin",
      "details": "10.12.2025 (Bekanntmachungsdatum)\n\nBerlin Amtsgericht Berlin (Charlottenburg) HRB 232148\nRegisterbekanntmachung nach dem Umwandlungsgesetz 09.12.2025 (Eintragungsdatum)\n\nTB Lead UG (haftungsbeschränkt)\nGesellschaft mit beschränkter Haftung\nBerlin\n\nZu Eintragungsnummer 5 vom 09.12.2025 wird als nicht eingetragen veröffentlicht:Den Gläubigern der an der Verschmelzung beteiligten Rechtsträger ist, wenn sie binnen sechs Monaten nach dem Tag, an dem die Eintragung der Verschmelzung in das Register des Sitzes desjenigen Rechtsträgers, dessen Gläubiger sie sind, als bekannt gemacht gilt, ihren Anspruch nach Grund und Höhe schriftlich anmelden, Sicherheit zu leisten, soweit sie nicht Befriedigung verlangen können. Dieses Recht steht den Gläubigern jedoch nur zu, wenn sie glaubhaft machen, dass durch die Verschmelzung die Erfüllung ihrer Forderung gefährdet wird. Das Recht, Sicherheitsleistung zu verlangen, steht Gläubigern nicht zu, die im Falle der Insolvenz ein Recht auf vorzugsweise Befriedigung aus einer Deckungsmasse haben, die nach gesetzlicher Vorschrift zu ihrem Schutz errichtet und staatlich überwacht ist."
    },
    {
      "date": "2025-12-10",
      "id": "139629",
      "original_text": "Registerbekanntmachung nach dem Umwandlungsgesetz\nBaden-Württemberg Amtsgericht Mannheim HRA 710333\nBruker Optics GmbH & Co. KG – Ettlingen",
      "type": "Registerbekanntmachung nach dem Umwandlungsgesetz",
      "state": "Baden-Württemberg",
      "amtsgericht": "Amtsgericht Mannheim",
      "registernummer": "HRA 710333",
      "registerart": "HRA",
      "company_name": "Bruker Optics GmbH & Co. KG",
      "company_seat": "Ettlingen",
      "details": "10.12.2025 (Bekanntmachungsdatum)\n\nBaden-Württemberg Amtsgericht Mannheim HRA 710333\nRegisterbekanntmachung nach dem Umwandlungsgesetz 10.12.2025 (Eintragungsdatum)\n\nBruker Optics GmbH & Co. KG\nKommanditgesellschaft\nEttlingen\n\nAls nicht eingetragen wird bekanntgemacht:\nDen Gläubigern der an der Verschmelzung beteiligten Rechtsträger ist, wenn sie binnen sechs Monaten nach dem Tag, an dem die Eintragung der Verschmelzung in das Register des Sitzes desjenigen Rechtsträgers, dessen Gläubiger sie sind, nach § 19 Abs. 3 UmwG als bekanntgemacht gilt, ihren Anspruch nach Grund und Höhe schriftlich anmelden, Sicherheit zu leisten, soweit sie nicht Befriedigung verlangen können. Dieses Recht steht den Gläubigern jedoch nur zu, wenn sie glaubhaft machen, dass durch die Verschmelzung die Erfüllung ihrer Forderung gefährdet wird."
    },
    {
      "date": "2025-12-10",
      "id": "139630",
      "original_text": "Registerbekanntmachung nach dem Umwandlungsgesetz\nSchleswig-Holstein Amtsgericht Kiel HRB 20336\namperias GmbH – Ellerau",
      "type": "Registerbekanntmachung nach dem Umwandlungsgesetz",
      "state": "Schleswig-Holstein",
      "amtsgericht": "Amtsgericht Kiel",
      "registernummer": "HRB 20336",
      "registerart": "HRB",
      "company_name": "amperias GmbH",
      "company_seat": "Ellerau",
      "details": "10.12.2025 (Bekanntmachungsdatum)\n\nSchleswig-Holstein Amtsgericht Kiel HRB 20336\nRegisterbekanntmachung nach dem Umwandlungsgesetz 04.12.2025 (Eintragungsdatum)\n\namperias GmbH\nGesellschaft mit beschränkter Haftung\nEllerau\n\nZu Eintragungsnummer 6 vom 04.12.2025 wird als nicht eingetragen veröffentlicht: Den Gläubigern der an der Verschmelzung beteiligten Rechtsträger ist, wenn sie binnen sechs Monaten nach dem Tag, an dem die Eintragung der Verschmelzung in das Register des Sitzes desjenigen Rechtsträgers, dessen Gläubiger sie sind, nach § 19 Abs. 3 UmwG bekannt gemacht worden ist, ihren Anspruch nach Grund und Höhe schriftlich anmelden, Sicherheit zu leisten, soweit sie nicht Befriedigung verlangen können. Dieses Recht steht den Gläubigern jedoch nur zu, wenn sie glaubhaft machen, dass durch die Verschmelzung die Erfüllung ihrer Forderung gefährdet wird."
    },
    {
      "date": "2025-12-10",
      "id": "139631",
      "original_text": "Sonstige Registerbekanntmachung\nBerlin Amtsgericht Berlin (Charlottenburg) HRB 192244\nDe Liquido GmbH – Berlin",
      "type": "Sonstige Registerbekanntmachung",
      "state": "Berlin",
      "amtsgericht": "Amtsgericht Berlin (Charlottenburg)",
      "registernummer": "HRB 192244",
      "registerart": "HRB",
      "company_name": "De Liquido GmbH",
      "company_seat": "Berlin",
      "details": "10.12.2025 (Bekanntmachungsdatum)\n\nBerlin Amtsgericht Berlin (Charlottenburg) HRB 192244\nSonstige Registerbekanntmachung\n\nDe Liquido GmbH\nGesellschaft mit beschränkter Haftung\nBerlin\n\nAls nicht eingetragen wird veröffentlicht: Das Löschungsverfahren gemäß § 394 FamFG ist eingestellt."
    },
    {
      "date": "2025-12-10",
      "id": "139632",
      "original_text": "Einreichung neuer Dokumente\nBerlin Amtsgericht Berlin (Charlottenburg) HRB 33259\nTÜV Rheinland Akademie GmbH – Berlin",
      "type": "Einreichung neuer Dokumente",
      "state": "Berlin",
      "amtsgericht": "Amtsgericht Berlin (Charlottenburg)",
      "registernummer": "HRB 33259",
      "registerart": "HRB",
      "company_name": "TÜV Rheinland Akademie GmbH",
      "company_seat": "Berlin",
      "details": "10.12.2025 (Bekanntmachungsdatum)\n\nBerlin Amtsgericht Berlin (Charlottenburg) HRB 33259\nEinreichung neuer Dokumente\n\nTÜV  Rheinland Akademie GmbH\nGesellschaft mit beschränkter Haftung\nBerlin\n\nAls nicht eingetragen wird veröffentlicht: Es wurde eine neue Liste der Aufsichtsratsmitglieder eingereicht (§52 GmbHG)."
    },
    {
      "date": "2025-12-10",
      "id": "139633",
      "original_text": "Einreichung neuer Dokumente\nBerlin Amtsgericht Berlin (Charlottenburg) HRB 200131\nDie Autobahn GmbH des Bundes – Berlin",
      "type": "Einreichung neuer Dokumente",
      "state": "Berlin",
      "amtsgericht": "Amtsgericht Berlin (Charlottenburg)",
      "registernummer": "HRB 200131",
      "registerart": "HRB",
      "company_name": "Die Autobahn GmbH des Bundes",
      "company_seat": "Berlin",
      "details": "10.12.2025 (Bekanntmachungsdatum)\n\nBerlin Amtsgericht Berlin (Charlottenburg) HRB 200131\nEinreichung neuer Dokumente\n\nDie Autobahn GmbH des Bundes\nGesellschaft mit beschränkter Haftung\nBerlin\n\nAls nicht eingetragen wird veröffentlicht:Es wurde eine neue Liste der Aufsichtsratsmitglieder eingereicht (§52 GmbHG)."
    },
    {
      "date": "2025-12-10",
      "id": "139634",
      "original_text": "Registerbekanntmachung nach dem Umwandlungsgesetz\nBaden-Württemberg Amtsgericht Stuttgart HRA 735772\nSika Deutschland CH AG & Co KG – Stuttgart",
      "type": "Registerbekanntmachung nach dem Umwandlungsgesetz",
      "state": "Baden-Württemberg",
      "amtsgericht": "Amtsgericht Stuttgart",
      "registernummer": "HRA 735772",
      "registerart": "HRA",
      "company_name": "Sika Deutschland CH AG & Co KG",
      "company_seat": "Stuttgart",
      "details": "10.12.2025 (Bekanntmachungsdatum)\n\nBaden-Württemberg Amtsgericht Stuttgart HRA 735772\nRegisterbekanntmachung nach dem Umwandlungsgesetz 10.12.2025 (Eintragungsdatum)\n\nSika Deutschland CH AG & Co KG\nKommanditgesellschaft\nStuttgart\n\nAls nicht eingetragen wird bekanntgemacht:\nDen Gläubigern der an der Verschmelzung beteiligten Rechtsträger ist, wenn sie binnen sechs Monaten nach dem Tag, an dem die Eintragung der Verschmelzung in das Register des Sitzes desjenigen Rechtsträgers, dessen Gläubiger sie sind, nach § 19 Abs. 3 UmwG als bekanntgemacht gilt, ihren Anspruch nach Grund und Höhe schriftlich anmelden, Sicherheit zu leisten, soweit sie nicht Befriedigung verlangen können. Dieses Recht steht den Gläubigern jedoch nur zu, wenn sie glaubhaft machen, dass durch die Verschmelzung die Erfüllung ihrer Forderung gefährdet wird."
    },
    {
      "date": "2025-12-10",
      "id": "139635",
      "original_text": "Registerbekanntmachung nach dem Umwandlungsgesetz\nBerlin Amtsgericht Berlin (Charlottenburg) HRB 128541\nRPG Beteiligungs- und Verwaltungsgesellschaft mbH – Berlin",
      "type": "Registerbekanntmachung nach dem Umwandlungsgesetz",
      "state": "Berlin",
      "amtsgericht": "Amtsgericht Berlin (Charlottenburg)",
      "registernummer": "HRB 128541",
      "registerart": "HRB",
      "company_name": "RPG Beteiligungs- und Verwaltungsgesellschaft mbH",
      "company_seat": "Berlin",
      "details": "10.12.2025 (Bekanntmachungsdatum)\n\nBerlin Amtsgericht Berlin (Charlottenburg) HRB 128541\nRegisterbekanntmachung nach dem Umwandlungsgesetz 09.12.2025 (Eintragungsdatum)\n\nRPG Beteiligungs- und Verwaltungsgesellschaft mbH\nGesellschaft mit beschränkter Haftung\nBerlin\n\nZu Eintragungsnummer 5 vom 09.12.2025 wird als nicht eingetragen veröffentlicht: Den Gläubigern der an der Verschmelzung beteiligten Rechtsträger ist, wenn sie binnen sechs Monaten nach dem Tag, an dem die Eintragung der Verschmelzung in das Register des Sitzes desjenigen Rechtsträgers, dessen Gläubiger sie sind, als bekannt gemacht gilt, ihren Anspruch nach Grund und Höhe schriftlich anmelden, Sicherheit zu leisten, soweit sie nicht Befriedigung verlangen können. Dieses Recht steht den Gläubigern jedoch nur zu, wenn sie glaubhaft machen, dass durch die Verschmelzung die Erfüllung ihrer Forderung gefährdet wird. Das Recht, Sicherheitsleistung zu verlangen, steht Gläubigern nicht zu, die im Falle der Insolvenz ein Recht auf vorzugsweise Befriedigung aus einer Deckungsmasse haben, die nach gesetzlicher Vorschrift zu ihrem Schutz errichtet und staatlich überwacht ist."
    },
    {
      "date": "2025-12-10",
      "id": "139636",
      "original_text": "Registerbekanntmachung nach dem Umwandlungsgesetz\nBerlin Amtsgericht Berlin (Charlottenburg) HRB 212143\nmrs Gebäudereinigung GmbH – Berlin",
      "type": "Registerbekanntmachung nach dem Umwandlungsgesetz",
      "state": "Berlin",
      "amtsgericht": "Amtsgericht Berlin (Charlottenburg)",
      "registernummer": "HRB 212143",
      "registerart": "HRB",
      "company_name": "mrs Gebäudereinigung GmbH",
      "company_seat": "Berlin",
      "details": "10.12.2025 (Bekanntmachungsdatum)\n\nBerlin Amtsgericht Berlin (Charlottenburg) HRB 212143\nRegisterbekanntmachung nach dem Umwandlungsgesetz 09.12.2025 (Eintragungsdatum)\n\nmrs Gebäudereinigung GmbH\nGesellschaft mit beschränkter Haftung\nBerlin\n\nZu Eintragungsnummer 5 vom 09.12.2025 wird als nicht eingetragen veröffentlicht: Den Gläubigern der an der Verschmelzung beteiligten Rechtsträger ist, wenn sie binnen sechs Monaten nach dem Tag, an dem die Eintragung der Verschmelzung in das Register des Sitzes desjenigen Rechtsträgers, dessen Gläubiger sie sind, als bekannt gemacht gilt, ihren Anspruch nach Grund und Höhe schriftlich anmelden, Sicherheit zu leisten, soweit sie nicht Befriedigung verlangen können. Dieses Recht steht den Gläubigern jedoch nur zu, wenn sie glaubhaft machen, dass durch die Verschmelzung die Erfüllung ihrer Forderung gefährdet wird. Das Recht, Sicherheitsleistung zu verlangen, steht Gläubigern nicht zu, die im Falle der Insolvenz ein Recht auf vorzugsweise Befriedigung aus einer Deckungsmasse haben, die nach gesetzlicher Vorschrift zu ihrem Schutz errichtet und staatlich überwacht ist."
    },
    {
      "date": "2025-12-10",
      "id": "139637",
      "original_text": "Einreichung neuer Dokumente\nBerlin Amtsgericht Berlin (Charlottenburg) HRB 188499\nExpert Systems AG – Berlin",
      "type": "Einreichung neuer Dokumente",
      "state": "Berlin",
      "amtsgericht": "Amtsgericht Berlin (Charlottenburg)",
      "registernummer": "HRB 188499",
      "registerart": "HRB",
      "company_name": "Expert Systems AG",
      "company_seat": "Berlin",
      "details": "10.12.2025 (Bekanntmachungsdatum)\n\nBerlin Amtsgericht Berlin (Charlottenburg) HRB 188499\nEinreichung neuer Dokumente\n\nExpert Systems AG\nAktiengesellschaft\nBerlin\n\nAls nicht eingetragen wird veröffentlicht: Es wurde eine neue Liste der Aufsichtsratsmitglieder eingereicht (§ 106 AktG)."
    },
    {
      "date": "2025-12-10",
      "id": "139638",
      "original_text": "Löschungsankündigung\nHamburg Amtsgericht Hamburg HRA 125206\nFresh Coup Produktion GmbH & Co. KG – Hamburg",
      "type": "Löschungsankündigung",
      "state": "Hamburg",
      "amtsgericht": "Amtsgericht Hamburg",
      "registernummer": "HRA 125206",
      "registerart": "HRA",
      "company_name": "Fresh Coup Produktion GmbH & Co. KG",
      "company_seat": "Hamburg",
      "details": "10.12.2025 (Bekanntmachungsdatum)\n\nHamburg Amtsgericht Hamburg HRA 125206\nLöschungsankündigung\n\nFresh Coup Produktion GmbH & Co. KG\nKommanditgesellschaft\nHamburg\n\nDas Registergericht beabsichtigt, die im Handelsregister eingetragene Firma von Amts wegen nach § 31 Abs. 2 HBG zu löschen. Die Frist zur Erhebung eines Widerspruchs gegen die beabsichtigte Löschung wird auf 3 Monate festgesetzt."
    },
    {
      "date": "2025-12-10",
      "id": "139639",
      "original_text": "Löschungsankündigung\nHamburg Amtsgericht Hamburg HRB 88511\nKAL Elektrooptik GmbH – Hamburg",
      "type": "Löschungsankündigung",
      "state": "Hamburg",
      "amtsgericht": "Amtsgericht Hamburg",
      "registernummer": "HRB 88511",
      "registerart": "HRB",
      "company_name": "KAL Elektrooptik GmbH",
      "company_seat": "Hamburg",
      "details": "10.12.2025 (Bekanntmachungsdatum)\n\nHamburg Amtsgericht Hamburg HRB 88511\nLöschungsankündigung\n\nKAL Elektrooptik GmbH\nGesellschaft mit beschränkter Haftung\nHamburg\n\nDas Registergericht beabsichtigt, die im Handelsregister eingetragene Gesellschaft von Amts wegen nach § 394 FamFG zu löschen. Die Frist zur Erhebung eines Widerspruchs gegen die beabsichtigte Löschung wird auf 3 Monate festgesetzt."
    },
    {
      "date": "2025-12-10",
      "id": "139640",
      "original_text": "Löschungsankündigung\nHamburg Amtsgericht Hamburg HRB 111355\nPflegedienst Volga GmbH – Hamburg",
      "type": "Löschungsankündigung",
      "state": "Hamburg",
      "amtsgericht": "Amtsgericht Hamburg",
      "registernummer": "HRB 111355",
      "registerart": "HRB",
      "company_name": "Pflegedienst Volga GmbH",
      "company_seat": "Hamburg",
      "details": "10.12.2025 (Bekanntmachungsdatum)\n\nHamburg Amtsgericht Hamburg HRB 111355\nLöschungsankündigung\n\nPflegedienst Volga GmbH\nGesellschaft mit beschränkter Haftung\nHamburg\n\nDas Registergericht beabsichtigt, die im Handelsregister eingetragene Gesellschaft von Amts wegen nach § 394 FamFG zu löschen. Die Frist zur Erhebung eines Widerspruchs gegen die beabsichtigte Löschung wird auf 3 Monate festgesetzt."
    },
    {
      "date": "2025-12-10",
      "id": "139641",
      "original_text": "Einreichung neuer Dokumente\nBaden-Württemberg Amtsgericht Stuttgart HRB 748211\nFesto Didactic SE – Esslingen am Neckar",
      "type": "Einreichung neuer Dokumente",
      "state": "Baden-Württemberg",
      "amtsgericht": "Amtsgericht Stuttgart",
      "registernummer": "HRB 748211",
      "registerart": "HRB",
      "company_name": "Festo Didactic SE",
      "company_seat": "Esslingen am Neckar",
      "details": "10.12.2025 (Bekanntmachungsdatum)\n\nBaden-Württemberg Amtsgericht Stuttgart HRB 748211\nEinreichung neuer Dokumente\n\nFesto Didactic SE\nEuropäische Aktiengesellschaft (SE)\nEsslingen am Neckar\n\nDie Gesellschaft hat am 24.11.2025 die Liste über die Zusammensetzung des Aufsichtsrats zum Handelsregister eingereicht."
    },
    {
      "date": "2025-12-10",
      "id": "139642",
      "original_text": "Löschungsankündigung\nBaden-Württemberg Amtsgericht Stuttgart HRB 734585\nalera international GmbH – Weinstadt",
      "type": "Löschungsankündigung",
      "state": "Baden-Württemberg",
      "amtsgericht": "Amtsgericht Stuttgart",
      "registernummer": "HRB 734585",
      "registerart": "HRB",
      "company_name": "alera international GmbH",
      "company_seat": "Weinstadt",
      "details": "10.12.2025 (Bekanntmachungsdatum)\n\nBaden-Württemberg Amtsgericht Stuttgart HRB 734585\nLöschungsankündigung\n\nalera international GmbH\nGesellschaft mit beschränkter Haftung\nWeinstadt\n\nAls nicht eingetragen wird bekanntgemacht:\nDas Gericht beabsichtigt, die Gesellschaft wegen Vermögenslosigkeit im Handelsregister von Amts wegen nach § 394 FamFG zu löschen. Die Frist zur Geltendmachung eines Widerspruchs gegen die beabsichtigte Löschung ist auf zwei Monate ab Veröffentlichung bestimmt."
    },
    {
      "date": "2025-12-10",
      "id": "139643",
      "original_text": "Löschungsankündigung\nHamburg Amtsgericht Hamburg HRB 150357\nM & Blitz GmbH – Hamburg",
      "type": "Löschungsankündigung",
      "state": "Hamburg",
      "amtsgericht": "Amtsgericht Hamburg",
      "registernummer": "HRB 150357",
      "registerart": "HRB",
      "company_name": "M & Blitz GmbH",
      "company_seat": "Hamburg",
      "details": "10.12.2025 (Bekanntmachungsdatum)\n\nHamburg Amtsgericht Hamburg HRB 150357\nLöschungsankündigung\n\nM & Blitz GmbH\nGesellschaft mit beschränkter Haftung\nHamburg\n\nDas Registergericht beabsichtigt, die im Handelsregister eingetragene Gesellschaft von Amts wegen nach § 394 FamFG zu löschen. Die Frist zur Erhebung eines Widerspruchs gegen die beabsichtigte Löschung wird auf 3 Monate festgesetzt."
    },
    {
      "date": "2025-12-10",
      "id": "139644",
      "original_text": "Löschungsankündigung\nHamburg Amtsgericht Hamburg HRB 155165\nBest Space Networks GmbH – Hamburg",
      "type": "Löschungsankündigung",
      "state": "Hamburg",
      "amtsgericht": "Amtsgericht Hamburg",
      "registernummer": "HRB 155165",
      "registerart": "HRB",
      "company_name": "Best Space Networks GmbH",
      "company_seat": "Hamburg",
      "details": "10.12.2025 (Bekanntmachungsdatum)\n\nHamburg Amtsgericht Hamburg HRB 155165\nLöschungsankündigung\n\nBest Space Networks GmbH\nGesellschaft mit beschränkter Haftung\nHamburg\n\nDas Registergericht beabsichtigt, die im Handelsregister eingetragene Gesellschaft von Amts wegen nach § 394 FamFG zu löschen. Die Frist zur Erhebung eines Widerspruchs gegen die beabsichtigte Löschung wird auf 3 Monate festgesetzt."
    },
    {
      "date": "2025-12-10",
      "id": "139645",
      "original_text": "Löschungsankündigung\nHamburg Amtsgericht Hamburg HRB 175142\nDing Sheng GmbH – Hamburg",
      "type": "Löschungsankündigung",
      "state": "Hamburg",
      "amtsgericht": "Amtsgericht Hamburg",
      "registernummer": "HRB 175142",
      "registerart": "HRB",
      "company_name": "Ding Sheng GmbH",
      "company_seat": "Hamburg",
      "details": "10.12.2025 (Bekanntmachungsdatum)\n\nHamburg Amtsgericht Hamburg HRB 175142\nLöschungsankündigung\n\nDing Sheng GmbH\nGesellschaft mit beschränkter Haftung\nHamburg\n\nDas Registergericht beabsichtigt, die im Handelsregister eingetragene Gesellschaft von Amts wegen nach § 394 FamFG zu löschen. Die Frist zur Erhebung eines Widerspruchs gegen die beabsichtigte Löschung wird auf 3 Monate festgesetzt."
    },
    {
      "date": "2025-12-10",
      "id": "139646",
      "original_text": "Löschungsankündigung\nHamburg Amtsgericht Hamburg HRB 181091\nNorth Elite Service und Dienstleistungen GmbH – Hamburg",
      "type": "Löschungsankündigung",
      "state": "Hamburg",
      "amtsgericht": "Amtsgericht Hamburg",
      "registernummer": "HRB 181091",
      "registerart": "HRB",
      "company_name": "North Elite Service und Dienstleistungen GmbH",
      "company_seat": "Hamburg",
      "details": "10.12.2025 (Bekanntmachungsdatum)\n\nHamburg Amtsgericht Hamburg HRB 181091\nLöschungsankündigung\n\nNorth Elite Service und Dienstleistungen GmbH\nGesellschaft mit beschränkter Haftung\nHamburg\n\nNach Mitteilung des Bezirksamtes Wandsbek  wurde\nHerrn Altan Köz\ndurch Bescheid vom 30.06.2025, bestandskräftig seit dem 13.08.2025, (Gesch.Nr.W/VS 111-G-26/25/1),\nder Betrieb eines Gewerbes \"Die Vermittlung von Dienstleistungen als Sicherheits- und Wachdienst, Gebäude- und Unterhaltsreinigung und Personal- und Servicedienstleistungen wie insbesondere Ordnertätigkeiten und Auf- und Abbautätigkeiten bei Events und Veranstaltungen\" sowie jeden Gewerbes, für das § 35 Gewerbeordnung (GewO) gilt, sowie Ihnen auch die Tätigkeit als mit der Leitung eines Gewerbebetriebes und als Vertretungsberechtigter eines Gewerbetreibenden untersagt.\n\nGemäß § 6 Abs. 2 S. 2 Nr. 2 des Gesetzes betreffend die Gesellschaften mit beschränkter Haftung (GmbHG) kann dieser infolgedessen kein Geschäftsführer der North Elite Service und Dienstleistungen GmbH  mehr sein.\n\nDie Eintragung des Herrn Altan Köz als Geschäftsführer\nist damit wegen des Mangels einer wesentlichen Voraussetzung unzulässig geworden.\n\nDas Registergericht beabsichtigt daher,\ndie Eintragung des Geschäftsführers\ngemäß § 395 des Gesetzes über das Verfahren in Familiensachen und in Angelegenheiten der freiwilligen Gerichtsbarkeit (FamFG) von Amts wegen aus dem Handelsregister zu löschen.\n\nGegen die beabsichtigte Löschung kann innerhalb eines Monats seit dieser Bekanntmachung Widerspruch beim\n\nAmtsgericht Hamburg - Registergericht -, Caffamacherreihe 20, 20355 Hamburg,\n\nschriftlich oder zur Niederschrift der Geschäftsstelle oder des Rechtspflegers eingelegt werden. Der Widerspruch kann auch zu Protokoll der Geschäftsstelle eines anderen Amtsgerichtes erfolgen. In diesem Falle ist die Frist nur dann gewahrt, wenn das den Widerspruch enthaltende Protokoll innerhalb der Frist bei dem Registergericht eingeht.\n\nSofern binnen der genannten Frist kein Widerspruch eingeht, wird das Gericht die genannten Eintragungen von Amts wegen löschen."
    },
    {
      "date": "2025-12-10",
      "id": "139647",
      "original_text": "Löschungsankündigung\nHamburg Amtsgericht Hamburg HRB 173833\nViviendo Concept GmbH – Hamburg",
      "type": "Löschungsankündigung",
      "state": "Hamburg",
      "amtsgericht": "Amtsgericht Hamburg",
      "registernummer": "HRB 173833",
      "registerart": "HRB",
      "company_name": "Viviendo Concept GmbH",
      "company_seat": "Hamburg",
      "details": "10.12.2025 (Bekanntmachungsdatum)\n\nHamburg Amtsgericht Hamburg HRB 173833\nLöschungsankündigung\n\nViviendo Concept GmbH\nGesellschaft mit beschränkter Haftung\nHamburg\n\nNach Mitteilung des Bezirksamtes Wandsbek wurde dem Geschäftsführer Altan Köz durch Bescheid vom 30.06.2025, bestandskräftig seit dem 13.08.2025, (Gesch.Nr. W/VS 111-G-26/25/1), der Betrieb jeden Gewerbes, für das § 35 Gewerbeordnung (GewO) gilt, sowie ihm auch die Tätigkeit als mit der Leitung eines Gewerbebetriebes und als Vertretungsberechtigter eines Gewerbetreibenden untersagt.\n\nGemäß § 6 Abs. 2 S. 2 Nr. 2 des Gesetzes betreffend die Gesellschaften mit beschränkter Haftung (GmbHG) kann er infolgedessen kein Geschäftsführer der Viviendo Concept GmbH mehr sein.\n\nSeine Eintragung als Geschäftsführer ist damit wegen des Mangels einer wesentlichen Voraussetzung unzulässig geworden.\n\nDas Registergericht beabsichtigt daher, die Eintragung des Altan Köz als Geschäftsführer gemäß § 395 des Gesetzes über das Verfahren in Familiensachen und in Angelegenheiten der freiwilligen Gerichtsbarkeit (FamFG) von Amts wegen aus dem Handelsregister zu löschen.\n\nHiermit erfolgt die Benachrichtigung von der beabsichtigten Löschung.\n\nEs wird Gelegenheit gegeben, gegen die beabsichtigte Löschung innerhalb von einem Monat seit ihrer schriftlichen Bekanntgabe Widerspruch beim\n\nAmtsgericht Hamburg - Registergericht -, Caffamacherreihe 20, 20355 Hamburg,\n\nschriftlich oder zur Niederschrift der Geschäftsstelle oder des Rechtspflegers einzulegen.\nDer Widerspruch kann auch zu Protokoll der Geschäftsstelle eines anderen Amtsgerichtes erfolgen. In diesem Falle ist die Frist nur dann gewahrt, wenn das den Widerspruch enthaltende Protokoll innerhalb der Frist bei dem Registergericht eingeht.\n\nSofern hier binnen der genannten Frist kein Widerspruch eingeht, wird das Gericht die genannte Eintragung von Amts wegen löschen."
    },
    {
      "date": "2025-12-10",
      "id": "139648",
      "original_text": "Löschungsankündigung\nHamburg Amtsgericht Hamburg HRB 174962\nNordmark Bahnbau GmbH – Hamburg",
      "type": "Löschungsankündigung",
      "state": "Hamburg",
      "amtsgericht": "Amtsgericht Hamburg",
      "registernummer": "HRB 174962",
      "registerart": "HRB",
      "company_name": "Nordmark Bahnbau GmbH",
      "company_seat": "Hamburg",
      "details": "10.12.2025 (Bekanntmachungsdatum)\n\nHamburg Amtsgericht Hamburg HRB 174962\nLöschungsankündigung\n\nNordmark Bahnbau GmbH\nGesellschaft mit beschränkter Haftung\nHamburg\n\nDas Registergericht beabsichtigt, die im Handelsregister eingetragene Gesellschaft von Amts wegen nach § 394 FamFG zu löschen. Die Frist zur Erhebung eines Widerspruchs gegen die beabsichtigte Löschung wird auf 3 Monate festgesetzt."
    },
    {
      "date": "2025-12-10",
      "id": "139649",
      "original_text": "Löschungsankündigung\nHamburg Amtsgericht Hamburg HRB 176379\nOrange Restaurants GmbH – Hamburg",
      "type": "Löschungsankündigung",
      "state": "Hamburg",
      "amtsgericht": "Amtsgericht Hamburg",
      "registernummer": "HRB 176379",
      "registerart": "HRB",
      "company_name": "Orange Restaurants GmbH",
      "company_seat": "Hamburg",
      "details": "10.12.2025 (Bekanntmachungsdatum)\n\nHamburg Amtsgericht Hamburg HRB 176379\nLöschungsankündigung\n\nOrange Restaurants GmbH\nGesellschaft mit beschränkter Haftung\nHamburg\n\nDas Registergericht beabsichtigt, die im Handelsregister eingetragene Gesellschaft von Amts wegen nach § 394 FamFG zu löschen. Die Frist zur Erhebung eines Widerspruchs gegen die beabsichtigte Löschung wird auf 3 Monate festgesetzt."
    },
    {
      "date": "2025-12-10",
      "id": "139650",
      "original_text": "Registerbekanntmachung nach dem Umwandlungsgesetz\nBaden-Württemberg Amtsgericht Ulm HRB 740649\nJ. Rehms Gebäudetechnik GmbH – Eislingen",
      "type": "Registerbekanntmachung nach dem Umwandlungsgesetz",
      "state": "Baden-Württemberg",
      "amtsgericht": "Amtsgericht Ulm",
      "registernummer": "HRB 740649",
      "registerart": "HRB",
      "company_name": "J. Rehms Gebäudetechnik GmbH",
      "company_seat": "Eislingen",
      "details": "10.12.2025 (Bekanntmachungsdatum)\n\nBaden-Württemberg Amtsgericht Ulm HRB 740649\nRegisterbekanntmachung nach dem Umwandlungsgesetz 10.12.2025 (Eintragungsdatum)\n\nJ. Rehms Gebäudetechnik GmbH\nGesellschaft mit beschränkter Haftung\nEislingen\n\nAls nicht eingetragen wird bekanntgemacht:\nDen Gläubigern der an der Verschmelzung beteiligten Rechtsträger ist, wenn sie binnen sechs Monaten nach dem Tag, an dem die Eintragung der Verschmelzung in das Register des Sitzes desjenigen Rechtsträgers, dessen Gläubiger sie sind, nach § 19 Abs. 3 UmwG als bekanntgemacht gilt, ihren Anspruch nach Grund und Höhe schriftlich anmelden, Sicherheit zu leisten, soweit sie nicht Befriedigung verlangen können. Dieses Recht steht den Gläubigern jedoch nur zu, wenn sie glaubhaft machen, dass durch die Verschmelzung die Erfüllung ihrer Forderung gefährdet wird."
    },
    {
      "date": "2025-12-10",
      "id": "139651",
      "original_text": "Registerbekanntmachung nach dem Umwandlungsgesetz\nBaden-Württemberg Amtsgericht Stuttgart HRB 745912\nDie Stoffmacher GmbH – Weilheim an der Teck",
      "type": "Registerbekanntmachung nach dem Umwandlungsgesetz",
      "state": "Baden-Württemberg",
      "amtsgericht": "Amtsgericht Stuttgart",
      "registernummer": "HRB 745912",
      "registerart": "HRB",
      "company_name": "Die Stoffmacher GmbH",
      "company_seat": "Weilheim an der Teck",
      "details": "10.12.2025 (Bekanntmachungsdatum)\n\nBaden-Württemberg Amtsgericht Stuttgart HRB 745912\nRegisterbekanntmachung nach dem Umwandlungsgesetz 10.12.2025 (Eintragungsdatum)\n\nDie Stoffmacher GmbH\nGesellschaft mit beschränkter Haftung\nWeilheim an der Teck\n\nAls nicht eingetragen wird bekanntgemacht:\nDen Gläubigern der an der Verschmelzung beteiligten Rechtsträger ist, wenn sie binnen sechs Monaten nach dem Tag, an dem die Eintragung der Verschmelzung in das Register des Sitzes desjenigen Rechtsträgers, dessen Gläubiger sie sind, nach § 19 Abs. 3 UmwG als bekanntgemacht gilt, ihren Anspruch nach Grund und Höhe schriftlich anmelden, Sicherheit zu leisten, soweit sie nicht Befriedigung verlangen können. Dieses Recht steht den Gläubigern jedoch nur zu, wenn sie glaubhaft machen, dass durch die Verschmelzung die Erfüllung ihrer Forderung gefährdet wird."
    },
    {
      "date": "2025-12-10",
      "id": "139652",
      "original_text": "Registerbekanntmachung nach dem Umwandlungsgesetz\nBaden-Württemberg Amtsgericht Stuttgart HRB 231965\nINTERIOR-DESIGN GmbH – Weilheim an der Teck",
      "type": "Registerbekanntmachung nach dem Umwandlungsgesetz",
      "state": "Baden-Württemberg",
      "amtsgericht": "Amtsgericht Stuttgart",
      "registernummer": "HRB 231965",
      "registerart": "HRB",
      "company_name": "INTERIOR-DESIGN GmbH",
      "company_seat": "Weilheim an der Teck",
      "details": "10.12.2025 (Bekanntmachungsdatum)\n\nBaden-Württemberg Amtsgericht Stuttgart HRB 231965\nRegisterbekanntmachung nach dem Umwandlungsgesetz 10.12.2025 (Eintragungsdatum)\n\nINTERIOR-DESIGN GmbH\nGesellschaft mit beschränkter Haftung\nWeilheim an der Teck\n\nDen Gläubigern der an der Verschmelzung beteiligten Rechtsträger ist, wenn sie binnen sechs Monaten nach dem Tag, an dem die Eintragung der Verschmelzung in das Register des Sitzes desjenigen Rechtsträgers, dessen Gläubiger sie sind, nach § 19 Abs. 3 UmwG als bekanntgemacht gilt, ihren Anspruch nach Grund und Höhe schriftlich anmelden, Sicherheit zu leisten, soweit sie nicht Befriedigung verlangen können. Dieses Recht steht den Gläubigern jedoch nur zu, wenn sie glaubhaft machen, dass durch die Verschmelzung die Erfüllung ihrer Forderung gefährdet wird."
    },
    {
      "date": "2025-12-10",
      "id": "139653",
      "original_text": "Registerbekanntmachung nach dem Umwandlungsgesetz\nBerlin Amtsgericht Berlin (Charlottenburg) HRB 213699\nEvermood GmbH – Berlin",
      "type": "Registerbekanntmachung nach dem Umwandlungsgesetz",
      "state": "Berlin",
      "amtsgericht": "Amtsgericht Berlin (Charlottenburg)",
      "registernummer": "HRB 213699",
      "registerart": "HRB",
      "company_name": "Evermood GmbH",
      "company_seat": "Berlin",
      "details": "10.12.2025 (Bekanntmachungsdatum)\n\nBerlin Amtsgericht Berlin (Charlottenburg) HRB 213699\nRegisterbekanntmachung nach dem Umwandlungsgesetz 09.12.2025 (Eintragungsdatum)\n\nEvermood GmbH\nGesellschaft mit beschränkter Haftung\nBerlin\n\nZu Eintragungsnummer 10 vom 09.12.2025 wird als nicht eingetragen veröffentlicht: Den Gläubigern der an der Verschmelzung beteiligten Rechtsträger ist, wenn sie binnen sechs Monaten nach dem Tag, an dem die Eintragung der Verschmelzung in das Register des Sitzes desjenigen Rechtsträgers, dessen Gläubiger sie sind, als bekannt gemacht gilt, ihren Anspruch nach Grund und Höhe schriftlich anmelden, Sicherheit zu leisten, soweit sie nicht Befriedigung verlangen können. Dieses Recht steht den Gläubigern jedoch nur zu, wenn sie glaubhaft machen, dass durch die Verschmelzung die Erfüllung ihrer Forderung gefährdet wird. Das Recht, Sicherheitsleistung zu verlangen, steht Gläubigern nicht zu, die im Falle der Insolvenz ein Recht auf vorzugsweise Befriedigung aus einer Deckungsmasse haben, die nach gesetzlicher Vorschrift zu ihrem Schutz errichtet und staatlich überwacht ist."
    },
    {
      "date": "2025-12-10",
      "id": "139654",
      "original_text": "Löschungsankündigung\nHamburg Amtsgericht Hamburg VR 24133\nInvisible Handicap Association – Hamburg",
      "type": "Löschungsankündigung",
      "state": "Hamburg",
      "amtsgericht": "Amtsgericht Hamburg",
      "registernummer": "VR 24133",
      "registerart": "VR",
      "company_name": "Invisible Handicap Association",
      "company_seat": "Hamburg",
      "details": "10.12.2025 (Bekanntmachungsdatum)\n\nHamburg Amtsgericht Hamburg VR 24133\nLöschungsankündigung\n\nInvisible Handicap Association\neingetragener Verein\nHamburg\n\nDas Registergericht beabsichtigt, den im Vereinsregister eingetragenen Verein von Amts wegen nach § 395 FamFG zu löschen, da nach den angestellten  Ermittlungen dieser Verein offenbar nicht mehr besteht. Die Frist zur Erhebung eines Widerspruchs gegen die beabsichtigte Löschung wird auf 3 Monate festgesetzt."
    },
    {
      "date": "2025-12-10",
      "id": "139655",
      "original_text": "Registerbekanntmachung nach dem Umwandlungsgesetz\nBaden-Württemberg Amtsgericht Stuttgart HRA 742198\nWurtz Hausverwaltung GmbH & Co. KG – Leonberg",
      "type": "Registerbekanntmachung nach dem Umwandlungsgesetz",
      "state": "Baden-Württemberg",
      "amtsgericht": "Amtsgericht Stuttgart",
      "registernummer": "HRA 742198",
      "registerart": "HRA",
      "company_name": "Wurtz Hausverwaltung GmbH & Co. KG",
      "company_seat": "Leonberg",
      "details": "10.12.2025 (Bekanntmachungsdatum)\n\nBaden-Württemberg Amtsgericht Stuttgart HRA 742198\nRegisterbekanntmachung nach dem Umwandlungsgesetz 10.12.2025 (Eintragungsdatum)\n\nWurtz Hausverwaltung GmbH & Co. KG\nKommanditgesellschaft\nLeonberg\n\nAls nicht eingetragen wird bekanntgemacht:\nDen Gläubigern der an der Ausgliederung beteiligten Rechtsträger ist, wenn sie binnen sechs Monaten nach dem Tag, an dem die Eintragung der Ausgliederung in das Register des Sitzes desjenigen Rechtsträgers, dessen Gläubiger sie sind, nach § 19 Abs. 3 UmwG als bekanntgemacht gilt, ihren Anspruch nach Grund und Höhe schriftlich anmelden, Sicherheit zu leisten, soweit sie nicht Befriedigung verlangen können. Dieses Recht steht den Gläubigern jedoch nur zu, wenn sie glaubhaft machen, dass durch die Ausgliederung die Erfüllung ihrer Forderung gefährdet wird."
    },
    {
      "date": "2025-12-10",
      "id": "139656",
      "original_text": "Registerbekanntmachung nach dem Umwandlungsgesetz\nBaden-Württemberg Amtsgericht Mannheim HRB 736140\nAmbulanter Pflegedienst Sana GmbH – Plankstadt",
      "type": "Registerbekanntmachung nach dem Umwandlungsgesetz",
      "state": "Baden-Württemberg",
      "amtsgericht": "Amtsgericht Mannheim",
      "registernummer": "HRB 736140",
      "registerart": "HRB",
      "company_name": "Ambulanter Pflegedienst Sana GmbH",
      "company_seat": "Plankstadt",
      "details": "10.12.2025 (Bekanntmachungsdatum)\n\nBaden-Württemberg Amtsgericht Mannheim HRB 736140\nRegisterbekanntmachung nach dem Umwandlungsgesetz 10.12.2025 (Eintragungsdatum)\n\nAmbulanter Pflegedienst Sana GmbH\nGesellschaft mit beschränkter Haftung\nPlankstadt\n\nDen Gläubigern der an der Abspaltung beteiligten Rechtsträger ist, wenn sie binnen sechs Monaten nach dem Tag, an dem die Eintragung der Abspaltung in das Register des Sitzes desjenigen Rechtsträgers, dessen Gläubiger sie sind, nach § 19 Abs. 3 UmwG als bekanntgemacht gilt, ihren Anspruch nach Grund und Höhe schriftlich anmelden, Sicherheit zu leisten, soweit sie nicht Befriedigung verlangen können. Dieses Recht steht den Gläubigern jedoch nur zu, wenn sie glaubhaft machen, dass durch die Abspaltung die Erfüllung ihrer Forderung gefährdet wird."
    },
    {
      "date": "2025-12-10",
      "id": "139657",
      "original_text": "Löschungsankündigung\nBerlin Amtsgericht Berlin (Charlottenburg) HRB 96501\nWarmia Bau Gesellschaft mit beschränkter Haftung – Berlin",
      "type": "Löschungsankündigung",
      "state": "Berlin",
      "amtsgericht": "Amtsgericht Berlin (Charlottenburg)",
      "registernummer": "HRB 96501",
      "registerart": "HRB",
      "company_name": "Warmia Bau Gesellschaft mit beschränkter Haftung",
      "company_seat": "Berlin",
      "details": "10.12.2025 (Bekanntmachungsdatum)\n\nBerlin Amtsgericht Berlin (Charlottenburg) HRB 96501\nLöschungsankündigung\n\nWarmia Bau Gesellschaft mit beschränkter Haftung\nGesellschaft mit beschränkter Haftung\nBerlin\n\nBei der nachstehenden Gesellschaft wird das Amtslöschungsverfahren gemäß § 394 FamFG eingeleitet. Widerspruchsfrist 6 Wochen"
    },
    {
      "date": "2025-12-10",
      "id": "139658",
      "original_text": "Registerbekanntmachung nach dem Umwandlungsgesetz\nBaden-Württemberg Amtsgericht Mannheim HRB 754846\nIntensivpflegedienst Sana GmbH – Eppelheim",
      "type": "Registerbekanntmachung nach dem Umwandlungsgesetz",
      "state": "Baden-Württemberg",
      "amtsgericht": "Amtsgericht Mannheim",
      "registernummer": "HRB 754846",
      "registerart": "HRB",
      "company_name": "Intensivpflegedienst Sana GmbH",
      "company_seat": "Eppelheim",
      "details": "10.12.2025 (Bekanntmachungsdatum)\n\nBaden-Württemberg Amtsgericht Mannheim HRB 754846\nRegisterbekanntmachung nach dem Umwandlungsgesetz 10.12.2025 (Eintragungsdatum)\n\nIntensivpflegedienst Sana GmbH\nGesellschaft mit beschränkter Haftung\nEppelheim\n\nDen Gläubigern der an der Abspaltung beteiligten Rechtsträger ist, wenn sie binnen sechs Monaten nach dem Tag, an dem die Eintragung der Abspaltung in das Register des Sitzes desjenigen Rechtsträgers, dessen Gläubiger sie sind, nach § 19 Abs. 3 UmwG als bekanntgemacht gilt, ihren Anspruch nach Grund und Höhe schriftlich anmelden, Sicherheit zu leisten, soweit sie nicht Befriedigung verlangen können. Dieses Recht steht den Gläubigern jedoch nur zu, wenn sie glaubhaft machen, dass durch die Abspaltung die Erfüllung ihrer Forderung gefährdet wird."
    },
    {
      "date": "2025-12-10",
      "id": "139659",
      "original_text": "Einreichung neuer Dokumente\nBerlin Amtsgericht Berlin (Charlottenburg) HRB 248259\nSolaris SE – Berlin",
      "type": "Einreichung neuer Dokumente",
      "state": "Berlin",
      "amtsgericht": "Amtsgericht Berlin (Charlottenburg)",
      "registernummer": "HRB 248259",
      "registerart": "HRB",
      "company_name": "Solaris SE",
      "company_seat": "Berlin",
      "details": "10.12.2025 (Bekanntmachungsdatum)\n\nBerlin Amtsgericht Berlin (Charlottenburg) HRB 248259\nEinreichung neuer Dokumente\n\nSolaris SE\nEuropäische Aktiengesellschaft (SE)\nBerlin\n\nAls nicht eingetragen wird veröffentlicht: Es wurde eine neue Liste der Aufsichtsratsmitglieder eingereicht (§ 106 AktG)."
    },
    {
      "date": "2025-12-10",
      "id": "139660",
      "original_text": "Löschungsankündigung\nSachsen Amtsgericht Dresden HRB 31966\nMachmit GmbH – Dresden",
      "type": "Löschungsankündigung",
      "state": "Sachsen",
      "amtsgericht": "Amtsgericht Dresden",
      "registernummer": "HRB 31966",
      "registerart": "HRB",
      "company_name": "Machmit GmbH",
      "company_seat": "Dresden",
      "details": "10.12.2025 (Bekanntmachungsdatum)\n\nSachsen Amtsgericht Dresden HRB 31966\nLöschungsankündigung\n\nMachmit GmbH\nGesellschaft mit beschränkter Haftung\nDresden\n\nDas Registergericht beabsichtigt, die im Handelsregister eingetragene Gesellschaft von Amts wegen nach § 394 FamFG zu löschen. Die Frist zu Erhebung eines Widerspruchs gegen die beabsichtigte Löschung wird auf einen Monat festgesetzt."
    },
    {
      "date": "2025-12-10",
      "id": "139661",
      "original_text": "Einreichung neuer Dokumente\nSachsen Amtsgericht Dresden HRB 30290\nHeimann Beteiligungs-GmbH – Dresden",
      "type": "Einreichung neuer Dokumente",
      "state": "Sachsen",
      "amtsgericht": "Amtsgericht Dresden",
      "registernummer": "HRB 30290",
      "registerart": "HRB",
      "company_name": "Heimann Beteiligungs-GmbH",
      "company_seat": "Dresden",
      "details": "10.12.2025 (Bekanntmachungsdatum)\n\nSachsen Amtsgericht Dresden HRB 30290\nEinreichung neuer Dokumente\n\nHeimann Beteiligungs-GmbH\nGesellschaft mit beschränkter Haftung\nDresden\n\nAm 09.12.2025 wurde beim Handelsregister des Amtsgerichts Dresden die Liste der Mitglieder des Aufsichtsrats gemäß § 52 GmbHG eingereicht."
    },
    {
      "date": "2025-12-10",
      "id": "139662",
      "original_text": "Sonstige Registerbekanntmachung\nSachsen Amtsgericht Dresden HRB 20046\nDresden-IT GmbH – Dresden",
      "type": "Sonstige Registerbekanntmachung",
      "state": "Sachsen",
      "amtsgericht": "Amtsgericht Dresden",
      "registernummer": "HRB 20046",
      "registerart": "HRB",
      "company_name": "Dresden-IT GmbH",
      "company_seat": "Dresden",
      "details": "10.12.2025 (Bekanntmachungsdatum)\n\nSachsen Amtsgericht Dresden HRB 20046\nSonstige Registerbekanntmachung 10.12.2025 (Eintragungsdatum)\n\nDresden-IT GmbH\nGesellschaft mit beschränkter Haftung\nDresden\n\nDen Gläubigern der Gesellschaft, deren Forderungen begründet worden sind bevor die Eintragung der Beendigung des Gewinnabführungsvertrages in das Handelsregister nach § 10 des Handelsgesetzbuches als bekanntgemacht gilt, hat der andere Vertragsteil Sicherheit zu leisten, wenn sie sich binnen sechs Monaten nach der Bekanntmachung der Eintragung zu diesem Zweck bei ihm melden."
    },
    {
      "date": "2025-12-10",
      "id": "139663",
      "original_text": "Einreichung neuer Dokumente\nSachsen Amtsgericht Leipzig HRB 32141\nPeires AG – Leipzig",
      "type": "Einreichung neuer Dokumente",
      "state": "Sachsen",
      "amtsgericht": "Amtsgericht Leipzig",
      "registernummer": "HRB 32141",
      "registerart": "HRB",
      "company_name": "Peires AG",
      "company_seat": "Leipzig",
      "details": "10.12.2025 (Bekanntmachungsdatum)\n\nSachsen Amtsgericht Leipzig HRB 32141\nEinreichung neuer Dokumente\n\nPeires AG\nAktiengesellschaft\nLeipzig\n\nAm 26.11.2025 wurde beim Handelsregister des Amtsgerichts Leipzig die Liste der Mitglieder des Aufsichtsrats gemäß § 106 AktG eingereicht."
    },
    {
      "date": "2025-12-10",
      "id": "139664",
      "original_text": "Einreichung neuer Dokumente\nSachsen Amtsgericht Leipzig HRB 8661\nDorf- und Seenentwicklungsgesellschaft Großpösna mbH – Großpösna",
      "type": "Einreichung neuer Dokumente",
      "state": "Sachsen",
      "amtsgericht": "Amtsgericht Leipzig",
      "registernummer": "HRB 8661",
      "registerart": "HRB",
      "company_name": "Dorf- und Seenentwicklungsgesellschaft Großpösna mbH",
      "company_seat": "Großpösna",
      "details": "10.12.2025 (Bekanntmachungsdatum)\n\nSachsen Amtsgericht Leipzig HRB 8661\nEinreichung neuer Dokumente\n\nDorf- und Seenentwicklungsgesellschaft Großpösna mbH\nGesellschaft mit beschränkter Haftung\nGroßpösna\n\nAm 5.12.2025 wurde beim Handelsregister des Amtsgerichts Leipzig die Liste der Mitglieder des Aufsichtsrats gemäß § 52 GmbHG eingereicht."
    },
    {
      "date": "2025-12-10",
      "id": "139665",
      "original_text": "Löschungsankündigung\nSachsen Amtsgericht Dresden HRB 39631\nJ&S Verwaltungs UG (haftungsbeschränkt) – Dresden",
      "type": "Löschungsankündigung",
      "state": "Sachsen",
      "amtsgericht": "Amtsgericht Dresden",
      "registernummer": "HRB 39631",
      "registerart": "HRB",
      "company_name": "J&S Verwaltungs UG (haftungsbeschränkt)",
      "company_seat": "Dresden",
      "details": "10.12.2025 (Bekanntmachungsdatum)\n\nSachsen Amtsgericht Dresden HRB 39631\nLöschungsankündigung\n\nJ&S Verwaltungs UG (haftungsbeschränkt)\nGesellschaft mit beschränkter Haftung\nDresden\n\nDas Registergericht beabsichtigt, die im Handelsregister eingetragene Gesellschaft von Amts wegen nach § 394 FamFG zu löschen. Die Frist zu Erhebung eines Widerspruchs gegen die beabsichtigte Löschung wird auf einen Monat festgesetzt."
    },
    {
      "date": "2025-12-10",
      "id": "139666",
      "original_text": "Löschungsankündigung\nSachsen Amtsgericht Dresden HRB 43328\nG2 Montage UG (haftungsbeschränkt) – Dresden",
      "type": "Löschungsankündigung",
      "state": "Sachsen",
      "amtsgericht": "Amtsgericht Dresden",
      "registernummer": "HRB 43328",
      "registerart": "HRB",
      "company_name": "G2 Montage UG (haftungsbeschränkt)",
      "company_seat": "Dresden",
      "details": "10.12.2025 (Bekanntmachungsdatum)\n\nSachsen Amtsgericht Dresden HRB 43328\nLöschungsankündigung\n\nG2 Montage UG (haftungsbeschränkt)\nGesellschaft mit beschränkter Haftung\nDresden\n\nDas Registergericht beabsichtigt, die im Handelsregister eingetragene Gesellschaft von Amts wegen nach § 394 FamFG zu löschen. Die Frist zu Erhebung eines Widerspruchs gegen die beabsichtigte Löschung wird auf einen Monat festgesetzt."
    },
    {
      "date": "2025-12-10",
      "id": "139667",
      "original_text": "Löschungsankündigung\nSachsen Amtsgericht Leipzig VR 20281\nDas Leben ist kein Ponyhof e.V. – Parthenstein OT Klinga",
      "type": "Löschungsankündigung",
      "state": "Sachsen",
      "amtsgericht": "Amtsgericht Leipzig",
      "registernummer": "VR 20281",
      "registerart": "VR",
      "company_name": "Das Leben ist kein Ponyhof e.V.",
      "company_seat": "Parthenstein OT Klinga",
      "details": "10.12.2025 (Bekanntmachungsdatum)\n\nSachsen Amtsgericht Leipzig VR 20281\nLöschungsankündigung\n\nDas Leben ist kein Ponyhof e.V.\neingetragener Verein\nParthenstein OT Klinga\n\nDas Gericht beabsichtigt, gemäß § 4 Absatz 2 Ziffer 1 der Verordnung über das Vereinsregister das Registerblatt  des Vereins zu schließen, da nach Mitteilung des bisherigen Vorstandes sämtliche Mitglieder aus dem Verein ausgeschieden sind. Zur Geltendmachung eines Widerspruchs gegen die beabsichtigte Schließung wird eine Frist von einem Monat nach der Veröffentlichung bestimmt."
    },
    {
      "date": "2025-12-10",
      "id": "139668",
      "original_text": "Registerbekanntmachung nach dem Umwandlungsgesetz\nSachsen Amtsgericht Dresden HRA 9022\nRalf Ullrich e.K. – Dresden",
      "type": "Registerbekanntmachung nach dem Umwandlungsgesetz",
      "state": "Sachsen",
      "amtsgericht": "Amtsgericht Dresden",
      "registernummer": "HRA 9022",
      "registerart": "HRA",
      "company_name": "Ralf Ullrich e.K.",
      "company_seat": "Dresden",
      "details": "10.12.2025 (Bekanntmachungsdatum)\n\nSachsen Amtsgericht Dresden HRA 9022\nRegisterbekanntmachung nach dem Umwandlungsgesetz 10.12.2025 (Eintragungsdatum)\n\nRalf Ullrich e.K.\nEinzelkaufmann / Einzelkauffrau\nDresden\n\nDen Gläubigern der an der Ausgliederung beteiligten Rechtsträger ist, wenn sie binnen sechs Monaten nach dem Tag, an dem die Eintragung der Ausgliederung in das Register des Sitzes desjenigen Rechtsträgers, dessen Gläubiger sie sind, nach § 19 Abs. 3 UmwG als bekannt gemacht gilt, ihren Anspruch nach Grund und Höhe in Textform anmelden, Sicherheit zu leisten, soweit sie nicht Befriedigung verlangen können. Dieses Recht steht den Gläubigern jedoch nur zu, wenn sie glaubhaft machen, dass durch die Ausgliederung die Erfüllung der Forderung gefährdet wird."
    },
    {
      "date": "2025-12-10",
      "id": "139669",
      "original_text": "Einreichung neuer Dokumente\nNiedersachsen Amtsgericht Hannover HRB 220936\nLeineEnergie GmbH – Neustadt am Rübenberge",
      "type": "Einreichung neuer Dokumente",
      "state": "Niedersachsen",
      "amtsgericht": "Amtsgericht Hannover",
      "registernummer": "HRB 220936",
      "registerart": "HRB",
      "company_name": "LeineEnergie GmbH",
      "company_seat": "Neustadt am Rübenberge",
      "details": "10.12.2025 (Bekanntmachungsdatum)\n\nNiedersachsen Amtsgericht Hannover HRB 220936\nEinreichung neuer Dokumente\n\nLeineEnergie GmbH\nGesellschaft mit beschränkter Haftung\nNeustadt am Rübenberge\n\nDie Liste der Mitglieder des Aufsichtsrats wurde beim Registergericht eingereicht."
    },
    {
      "date": "2025-12-10",
      "id": "139670",
      "original_text": "Einreichung neuer Dokumente\nNiedersachsen Amtsgericht Osnabrück HRB 213574\nGeorgsmarienhütte GmbH – Georgsmarienhütte",
      "type": "Einreichung neuer Dokumente",
      "state": "Niedersachsen",
      "amtsgericht": "Amtsgericht Osnabrück",
      "registernummer": "HRB 213574",
      "registerart": "HRB",
      "company_name": "Georgsmarienhütte GmbH",
      "company_seat": "Georgsmarienhütte",
      "details": "10.12.2025 (Bekanntmachungsdatum)\n\nNiedersachsen Amtsgericht Osnabrück HRB 213574\nEinreichung neuer Dokumente 10.12.2025 (Eintragungsdatum)\n\nGeorgsmarienhütte GmbH\nGesellschaft mit beschränkter Haftung\nGeorgsmarienhütte\n\nDie Liste der Mitglieder des Aufsichtsrats wurde beim Registergericht eingereicht."
    },
    {
      "date": "2025-12-10",
      "id": "139671",
      "original_text": "Registerbekanntmachung nach dem Umwandlungsgesetz\nNiedersachsen Amtsgericht Göttingen HRB 120280\nGebr. Gropengießer Beteiligungs- und Betriebs-GmbH – Wulften",
      "type": "Registerbekanntmachung nach dem Umwandlungsgesetz",
      "state": "Niedersachsen",
      "amtsgericht": "Amtsgericht Göttingen",
      "registernummer": "HRB 120280",
      "registerart": "HRB",
      "company_name": "Gebr. Gropengießer Beteiligungs- und Betriebs-GmbH",
      "company_seat": "Wulften",
      "details": "10.12.2025 (Bekanntmachungsdatum)\n\nNiedersachsen Amtsgericht Göttingen HRB 120280\nRegisterbekanntmachung nach dem Umwandlungsgesetz 10.12.2025 (Eintragungsdatum)\n\nGebr. Gropengießer Beteiligungs- und Betriebs-GmbH\nGesellschaft mit beschränkter Haftung\nWulften\n\nDen Gläubigern der an der Verschmelzung beteiligten Rechtsträger ist, wenn sie binnen sechs Monaten nach dem Tag, an dem die Eintragung der Verschmelzung in das Register des Sitzes desjenigen Rechtsträgers, dessen Gläubiger sie sind, nach § 19  Abs.  3 UmwG als bekannt gemacht gilt, ihren Anspruch nach Grund und Höhe schriftlich anmelden, Sicherheit zu leisten, soweit sie nicht Befriedigung verlangen können. Dieses Recht steht den Gläubigern jedoch nur zu, wenn sie glaubhaft machen, dass durch die Verschmelzung die Erfüllung der Forderung gefährdet wird."
    },
    {
      "date": "2025-12-10",
      "id": "139672",
      "original_text": "Löschungsankündigung\nBremen Amtsgericht Bremen HRB 36781\nJELT Holding GmbH – Bremerhaven",
      "type": "Löschungsankündigung",
      "state": "Bremen",
      "amtsgericht": "Amtsgericht Bremen",
      "registernummer": "HRB 36781",
      "registerart": "HRB",
      "company_name": "JELT Holding GmbH",
      "company_seat": "Bremerhaven",
      "details": "10.12.2025 (Bekanntmachungsdatum)\n\nBremen Amtsgericht Bremen HRB 36781\nLöschungsankündigung\n\nJELT Holding GmbH\nGesellschaft mit beschränkter Haftung\nBremerhaven\n\nEs ist beabsichtigt die im Handelsregister eingetragene Gesellschaft von Amts wegen gemäß § 394 FamFG zu löschen. Gegen die Löschung kann beim AG Bremen schriftlich oder zu Protokoll der Geschäftsstelle Widerspruch eingelegt werden. Widerspruchsfrist 4 Wochen."
    },
    {
      "date": "2025-12-10",
      "id": "139673",
      "original_text": "Löschungsankündigung\nBremen Amtsgericht Bremen HRB 27837\nAS Cars GmbH – Bremen",
      "type": "Löschungsankündigung",
      "state": "Bremen",
      "amtsgericht": "Amtsgericht Bremen",
      "registernummer": "HRB 27837",
      "registerart": "HRB",
      "company_name": "AS Cars GmbH",
      "company_seat": "Bremen",
      "details": "10.12.2025 (Bekanntmachungsdatum)\n\nBremen Amtsgericht Bremen HRB 27837\nLöschungsankündigung\n\nAS Cars GmbH\nGesellschaft mit beschränkter Haftung\nBremen\n\nEs ist beabsichtigt die im Handelsregister eingetragene Gesellschaft von Amts wegen gemäß § 394 FamFG zu löschen. Gegen die Löschung kann beim AG Bremen schriftlich oder zu Protokoll der Geschäftsstelle Widerspruch eingelegt werden. Widerspruchsfrist 4 Wochen."
    },
    {
      "date": "2025-12-10",
      "id": "139674",
      "original_text": "Registerbekanntmachung nach dem Umwandlungsgesetz\nNordrhein-Westfalen Amtsgericht Wuppertal HRB 19188\nDoppstadt Beteiligungs GmbH – Velbert",
      "type": "Registerbekanntmachung nach dem Umwandlungsgesetz",
      "state": "Nordrhein-Westfalen",
      "amtsgericht": "Amtsgericht Wuppertal",
      "registernummer": "HRB 19188",
      "registerart": "HRB",
      "company_name": "Doppstadt Beteiligungs GmbH",
      "company_seat": "Velbert",
      "details": "10.12.2025 (Bekanntmachungsdatum)\n\nNordrhein-Westfalen Amtsgericht Wuppertal HRB 19188\nRegisterbekanntmachung nach dem Umwandlungsgesetz 10.12.2025 (Eintragungsdatum)\n\nDoppstadt Beteiligungs GmbH\nGesellschaft mit beschränkter Haftung\nVelbert\n\nDen Gläubigern der an der Verschmelzung beteiligten Rechtsträger ist, wenn sie binnen sechs Monaten nach dem Tag, an dem die Eintragung der Verschmelzung in das Register des Sitzes derjenigen Rechtsträger deren Gläubiger sie sind, nach § 19 Absatz 3 UmwG als bekanntgemacht gilt, ihren Anspruch nach Grund und Höhe schriftlich anmelden, Sicherheit zu leisten, soweit sie nicht Befriedigung verlangen können. Dieses Recht steht den Gläubigern jedoch nur zu, wenn sie glaubhaft machen, dass durch die Verschmelzung die Erfüllung ihrer Forderung gefährdet wird."
    },
    {
      "date": "2025-12-10",
      "id": "139675",
      "original_text": "Registerbekanntmachung nach dem Umwandlungsgesetz\nNordrhein-Westfalen Amtsgericht Bielefeld HRB 32089\nDürkopp Fördertechnik GmbH – Bielefeld",
      "type": "Registerbekanntmachung nach dem Umwandlungsgesetz",
      "state": "Nordrhein-Westfalen",
      "amtsgericht": "Amtsgericht Bielefeld",
      "registernummer": "HRB 32089",
      "registerart": "HRB",
      "company_name": "Dürkopp Fördertechnik GmbH",
      "company_seat": "Bielefeld",
      "details": "10.12.2025 (Bekanntmachungsdatum)\n\nNordrhein-Westfalen Amtsgericht Bielefeld HRB 32089\nRegisterbekanntmachung nach dem Umwandlungsgesetz 10.12.2025 (Eintragungsdatum)\n\nDürkopp Fördertechnik GmbH\nGesellschaft mit beschränkter Haftung\nBielefeld\n\nDen Gläubigern der an der Verschmelzung beteiligten Rechtsträger ist, wenn sie binnen sechs Monaten nach dem Tag, an dem die Eintragung der Verschmelzung in das Register des Sitzes desjenigen Rechtsträgers, dessen Gläubiger sie sind, nach § 19 Absatz 3 UmwG als bekanntgemacht gilt, ihren Anspruch nach Grund und Höhe schriftlich anmelden, Sicherheit zu leisten, soweit sie nicht Befriedigung verlangen können. Dieses Recht steht den Gläubigern jedoch nur zu, wenn sie glaubhaft machen, dass durch die Verschmelzung die Erfüllung ihrer Forderung gefährdet wird."
    },
    {
      "date": "2025-12-10",
      "id": "139676",
      "original_text": "Einreichung neuer Dokumente\nNordrhein-Westfalen Amtsgericht Dortmund HRB 32754\nKath. St. Paulus GmbH – Dortmund",
      "type": "Einreichung neuer Dokumente",
      "state": "Nordrhein-Westfalen",
      "amtsgericht": "Amtsgericht Dortmund",
      "registernummer": "HRB 32754",
      "registerart": "HRB",
      "company_name": "Kath. St. Paulus GmbH",
      "company_seat": "Dortmund",
      "details": "10.12.2025 (Bekanntmachungsdatum)\n\nNordrhein-Westfalen Amtsgericht Dortmund HRB 32754\nEinreichung neuer Dokumente 10.12.2025 (Eintragungsdatum)\n\nKath. St. Paulus GmbH\nGesellschaft mit beschränkter Haftung\nDortmund\n\nDem Registergericht ist eine neue Liste der Mitglieder des Aufsichtsrates eingereicht worden."
    },
    {
      "date": "2025-12-10",
      "id": "139677",
      "original_text": "Löschungsankündigung\nNordrhein-Westfalen Amtsgericht Köln HRB 121701\nKolosovskis Logistics UG (haftungsbeschränkt) – Köln",
      "type": "Löschungsankündigung",
      "state": "Nordrhein-Westfalen",
      "amtsgericht": "Amtsgericht Köln",
      "registernummer": "HRB 121701",
      "registerart": "HRB",
      "company_name": "Kolosovskis Logistics UG (haftungsbeschränkt)",
      "company_seat": "Köln",
      "details": "10.12.2025 (Bekanntmachungsdatum)\n\nNordrhein-Westfalen Amtsgericht Köln HRB 121701\nLöschungsankündigung\n\nKolosovskis Logistics UG (haftungsbeschränkt)\nGesellschaft mit beschränkter Haftung\nKöln\n\nDas Registergericht beabsichtigt die Gesellschaft von Amts wegen nach § 394 FamFG zu löschen. Die Frist zur Erhebung eines Widerspruchs ist auf einen Monat festgesetzt."
    },
    {
      "date": "2025-12-10",
      "id": "139678",
      "original_text": "Löschungsankündigung\nNordrhein-Westfalen Amtsgericht Wuppertal HRB 28567\nArtemis Network GmbH – Mettmann",
      "type": "Löschungsankündigung",
      "state": "Nordrhein-Westfalen",
      "amtsgericht": "Amtsgericht Wuppertal",
      "registernummer": "HRB 28567",
      "registerart": "HRB",
      "company_name": "Artemis Network GmbH",
      "company_seat": "Mettmann",
      "details": "10.12.2025 (Bekanntmachungsdatum)\n\nNordrhein-Westfalen Amtsgericht Wuppertal HRB 28567\nLöschungsankündigung\n\nArtemis Network GmbH\nGesellschaft mit beschränkter Haftung\nMettmann\n\nDas Registergericht beabsichtigt die Gesellschaft von Amts wegen nach § 394 FamFG zu löschen. Die Frist zur Erhebung eines Widerspruchs ist auf einen Monat festgesetzt."
    },
    {
      "date": "2025-12-10",
      "id": "139679",
      "original_text": "Löschungsankündigung\nNordrhein-Westfalen Amtsgericht Hamm HRB 7010\nLapo UG (haftungsbeschränkt) – Hamm",
      "type": "Löschungsankündigung",
      "state": "Nordrhein-Westfalen",
      "amtsgericht": "Amtsgericht Hamm",
      "registernummer": "HRB 7010",
      "registerart": "HRB",
      "company_name": "Lapo UG (haftungsbeschränkt)",
      "company_seat": "Hamm",
      "details": "10.12.2025 (Bekanntmachungsdatum)\n\nNordrhein-Westfalen Amtsgericht Hamm HRB 7010\nLöschungsankündigung\n\nLapo UG (haftungsbeschränkt)\nGesellschaft mit beschränkter Haftung\nHamm\n\nDas Registergericht beabsichtigt die Gesellschaft von Amts wegen nach § 394 FamFG zu löschen. Die Frist zur Erhebung eines Widerspruchs ist auf #DV.Fr(Text=\"Bitte wählen Sie die Widerspruchsfrist aus!\",Eingabe=\"einen Monat\",\"zwei Monate\",\"drei Monate\",\"#insert(Text=\"Freitext\")\"|\"freier Text\") festgesetzt."
    },
    {
      "date": "2025-12-10",
      "id": "139680",
      "original_text": "Registerbekanntmachung nach dem Umwandlungsgesetz\nNordrhein-Westfalen Amtsgericht Bochum HRB 4860\nBochumer Verein Verkehrstechnik GmbH – Bochum",
      "type": "Registerbekanntmachung nach dem Umwandlungsgesetz",
      "state": "Nordrhein-Westfalen",
      "amtsgericht": "Amtsgericht Bochum",
      "registernummer": "HRB 4860",
      "registerart": "HRB",
      "company_name": "Bochumer Verein Verkehrstechnik GmbH",
      "company_seat": "Bochum",
      "details": "10.12.2025 (Bekanntmachungsdatum)\n\nNordrhein-Westfalen Amtsgericht Bochum HRB 4860\nRegisterbekanntmachung nach dem Umwandlungsgesetz 09.12.2025 (Eintragungsdatum)\n\nBochumer Verein Verkehrstechnik GmbH\nGesellschaft mit beschränkter Haftung\nBochum\n\nDie Gesellschaft hat Gläubigern, deren Forderungen vor dieser Bekanntmachung begründet worden sind, Sicherheit zu leisten, soweit sie nicht Befriedigung verlangen können, wenn sie sich binnen sechs Monaten zu diesem Zweck melden."
    },
    {
      "date": "2025-12-10",
      "id": "139681",
      "original_text": "Löschungsankündigung\nNordrhein-Westfalen Amtsgericht Köln HRB 116496\npublic:health GmbH – Köln",
      "type": "Löschungsankündigung",
      "state": "Nordrhein-Westfalen",
      "amtsgericht": "Amtsgericht Köln",
      "registernummer": "HRB 116496",
      "registerart": "HRB",
      "company_name": "public:health GmbH",
      "company_seat": "Köln",
      "details": "10.12.2025 (Bekanntmachungsdatum)\n\nNordrhein-Westfalen Amtsgericht Köln HRB 116496\nLöschungsankündigung\n\npublic:health GmbH\nGesellschaft mit beschränkter Haftung\nKöln\n\nDas Registergericht beabsichtigt die Gesellschaft von Amts wegen nach § 394 FamFG zu löschen. Die Frist zur Erhebung eines Widerspruchs ist auf einen Monat festgesetzt."
    },
    {
      "date": "2025-12-10",
      "id": "139682",
      "original_text": "Löschungsankündigung\nNordrhein-Westfalen Amtsgericht Köln HRB 120960\nPV Dienstleistungen GmbH – Köln",
      "type": "Löschungsankündigung",
      "state": "Nordrhein-Westfalen",
      "amtsgericht": "Amtsgericht Köln",
      "registernummer": "HRB 120960",
      "registerart": "HRB",
      "company_name": "PV Dienstleistungen GmbH",
      "company_seat": "Köln",
      "details": "10.12.2025 (Bekanntmachungsdatum)\n\nNordrhein-Westfalen Amtsgericht Köln HRB 120960\nLöschungsankündigung\n\nPV Dienstleistungen GmbH\nGesellschaft mit beschränkter Haftung\nKöln\n\nDas Registergericht beabsichtigt die Gesellschaft von Amts wegen nach § 394 FamFG zu löschen. Die Frist zur Erhebung eines Widerspruchs ist auf einen Monat festgesetzt."
    },
    {
      "date": "2025-12-10",
      "id": "139683",
      "original_text": "Registerbekanntmachung nach dem Umwandlungsgesetz\nNordrhein-Westfalen Amtsgericht Wuppertal HRB 29985\nDoppstadt Umwelttechnik GmbH – Velbert",
      "type": "Registerbekanntmachung nach dem Umwandlungsgesetz",
      "state": "Nordrhein-Westfalen",
      "amtsgericht": "Amtsgericht Wuppertal",
      "registernummer": "HRB 29985",
      "registerart": "HRB",
      "company_name": "Doppstadt Umwelttechnik GmbH",
      "company_seat": "Velbert",
      "details": "10.12.2025 (Bekanntmachungsdatum)\n\nNordrhein-Westfalen Amtsgericht Wuppertal HRB 29985\nRegisterbekanntmachung nach dem Umwandlungsgesetz 10.12.2025 (Eintragungsdatum)\n\nDoppstadt Umwelttechnik GmbH\nGesellschaft mit beschränkter Haftung\nVelbert\n\nDen Gläubigern der an der Verschmelzung beteiligten Rechtsträger ist, wenn sie binnen sechs Monaten nach dem Tag, an dem die Eintragung der Verschmelzung in das Register des Sitzes desjenigen Rechtsträgers, dessen Gläubiger sie sind, nach § 19 Absatz 3 UmwG als bekanntgemacht gilt, ihren Anspruch nach Grund und Höhe schriftlich anmelden, Sicherheit zu leisten, soweit sie nicht Befriedigung verlangen können. Dieses Recht steht den Gläubigern jedoch nur zu, wenn sie glaubhaft machen, dass durch die Verschmelzung die Erfüllung ihrer Forderung gefährdet wird."
    },
    {
      "date": "2025-12-10",
      "id": "139684",
      "original_text": "Sonstige Registerbekanntmachung\nNordrhein-Westfalen Amtsgericht Gelsenkirchen HRB 9421\nCFH GmbH – Marl",
      "type": "Sonstige Registerbekanntmachung",
      "state": "Nordrhein-Westfalen",
      "amtsgericht": "Amtsgericht Gelsenkirchen",
      "registernummer": "HRB 9421",
      "registerart": "HRB",
      "company_name": "CFH GmbH",
      "company_seat": "Marl",
      "details": "10.12.2025 (Bekanntmachungsdatum)\n\nNordrhein-Westfalen Amtsgericht Gelsenkirchen HRB 9421\nSonstige Registerbekanntmachung 10.12.2025 (Eintragungsdatum)\n\nCFH GmbH\nGesellschaft mit beschränkter Haftung\nMarl\n\nDem Registergericht ist eine Liste der Mitglieder des Aufsichtsrates eingereicht worden."
    },
    {
      "date": "2025-12-10",
      "id": "139685",
      "original_text": "Löschungsankündigung\nNordrhein-Westfalen Amtsgericht Düsseldorf HRB 99779\nKB DREAMS GmbH – Düsseldorf",
      "type": "Löschungsankündigung",
      "state": "Nordrhein-Westfalen",
      "amtsgericht": "Amtsgericht Düsseldorf",
      "registernummer": "HRB 99779",
      "registerart": "HRB",
      "company_name": "KB DREAMS GmbH",
      "company_seat": "Düsseldorf",
      "details": "10.12.2025 (Bekanntmachungsdatum)\n\nNordrhein-Westfalen Amtsgericht Düsseldorf HRB 99779\nLöschungsankündigung\n\nKB DREAMS GmbH\nGesellschaft mit beschränkter Haftung\nDüsseldorf\n\nDas Registergericht beabsichtigt die Gesellschaft von Amts wegen nach § 394 FamFG zu löschen. Die Frist zur Erhebung eines Widerspruchs ist auf 3 Wochen festgesetzt.\n\nRechtsbehelfsbelehrung:\nDas Widerspruchsrecht steht jedem zu, der an der Unterlassung der Löschung ein berechtigtes Interesse hat. Der Widerspruch ist bei dem Amtsgericht Düsseldorf -Registergericht-, Werdener Straße 1, 40227 Düsseldorf schriftlich in deutscher Sprache oder zur Niederschrift der Geschäftsstelle einzulegen. Der Widerspruch kann auch zur Niederschrift der Geschäftsstelle eines jeden Amtsgerichtes abgegeben werden. Die Einlegung ist auch durch Übertragung eines elektronischen Dokuments an die elektronische Poststelle des Gerichts möglich. Das elektronische Dokument muss für die Bearbeitung durch das Gericht geeignet und mit einer qualifizierten elektronischen Signatur der verantwortenden Person versehen sein oder von der verantwortenden Person signiert und auf einem sicheren Übermittlungsweg gemäß § 130a ZPO nach näherer Maßgabe der Verordnung über die technischen Rahmenbedingungen des elektronischen Rechtsverkehrs und über das besondere elektronische Behördenpostfach (BGBl. I, S.3803) eingereicht werden. Weitere Informationen erhalten Sie auf der Internetseite www.justiz.de.\nDer Widerspruch muss spätestens innerhalb der gesetzten Frist nach dem Datum der Bekanntmachung der Löschungsankündigung bei dem Amtsgericht - Registergericht - Düsseldorf eingegangen sein.  Dies gilt auch dann, wenn der Widerspruch zur Niederschrift der Geschäftsstelle eines anderen Amtsgerichtes abgegeben wurde. Die Frist beginnt mit dem Tage der Bekanntmachung der Löschungsankündigung in dem für die Bekanntmachung der Eintragungen in das Handelsregister bestimmten elektronischen Informations- und Kommunikationssystem nach § 10 des Handelsgesetzbuches. Fällt das Ende der Frist auf einen Sonntag, einen allgemeinen Feiertag oder Sonnabend, so endet die Frist mit Ablauf des nächsten Werktages.\nDer Widerspruch muss die Bezeichnung der angefochtenen Löschungsankündigung sowie die Erklärung enthalten, dass Widerspruch gegen diese Löschungsankündigung eingelegt wird. Er ist zu unterzeichnen und soll begründet werden."
    },
    {
      "date": "2025-12-10",
      "id": "139686",
      "original_text": "Registerbekanntmachung nach dem Umwandlungsgesetz\nNordrhein-Westfalen Amtsgericht Essen HRB 33076\nifm real estate gmbh – Essen",
      "type": "Registerbekanntmachung nach dem Umwandlungsgesetz",
      "state": "Nordrhein-Westfalen",
      "amtsgericht": "Amtsgericht Essen",
      "registernummer": "HRB 33076",
      "registerart": "HRB",
      "company_name": "ifm real estate gmbh",
      "company_seat": "Essen",
      "details": "10.12.2025 (Bekanntmachungsdatum)\n\nNordrhein-Westfalen Amtsgericht Essen HRB 33076\nRegisterbekanntmachung nach dem Umwandlungsgesetz 10.12.2025 (Eintragungsdatum)\n\nifm real estate gmbh\nGesellschaft mit beschränkter Haftung\nEssen\n\nDen Gläubigern der an der Ausgliederung beteiligten Rechtsträger ist, wenn sie binnen sechs Monaten nach dem Tag, an dem die Eintragung der Ausgliederung in das Register des Sitzes desjenigen Rechtsträgers, dessen Gläubiger sie sind, nach § 19 Absatz 3 UmwG als bekanntgemacht gilt, ihren Anspruch nach Grund und Höhe schriftlich anmelden, Sicherheit zu leisten, soweit sie nicht Befriedigung verlangen können. Dieses Recht steht den Gläubigern jedoch nur zu, wenn sie glaubhaft machen, dass durch die Ausgliederung die Erfüllung ihrer Forderung gefährdet wird."
    },
    {
      "date": "2025-12-10",
      "id": "139687",
      "original_text": "Löschungsankündigung\nThüringen Amtsgericht Jena HRB 516569\nAurum Security GmbH – Schwarzatal",
      "type": "Löschungsankündigung",
      "state": "Thüringen",
      "amtsgericht": "Amtsgericht Jena",
      "registernummer": "HRB 516569",
      "registerart": "HRB",
      "company_name": "Aurum Security GmbH",
      "company_seat": "Schwarzatal",
      "details": "10.12.2025 (Bekanntmachungsdatum)\n\nThüringen Amtsgericht Jena HRB 516569\nLöschungsankündigung\n\nAurum Security GmbH\nGesellschaft mit beschränkter Haftung\nSchwarzatal\n\nDas Registergericht beabsichtigt, die im Handelsregister eingetragene Gesellschaft wegen Vermögenslosigkeit nach § 394 FamFG von Amts wegen zu löschen. Die Frist zur Erhebung eines Widerspruchs gegen die beabsichtigte Löschung wird auf 6 Wochen festgesetzt."
    },
    {
      "date": "2025-12-10",
      "id": "139688",
      "original_text": "Löschungsankündigung\nHessen Amtsgericht Frankfurt am Main HRB 125895\nEat & Live UG (haftungsbeschränkt) – Frankfurt am Main",
      "type": "Löschungsankündigung",
      "state": "Hessen",
      "amtsgericht": "Amtsgericht Frankfurt am Main",
      "registernummer": "HRB 125895",
      "registerart": "HRB",
      "company_name": "Eat & Live UG (haftungsbeschränkt)",
      "company_seat": "Frankfurt am Main",
      "details": "10.12.2025 (Bekanntmachungsdatum)\n\nHessen Amtsgericht Frankfurt am Main HRB 125895\nLöschungsankündigung\n\nEat & Live UG (haftungsbeschränkt)\nGesellschaft mit beschränkter Haftung\nFrankfurt am Main\n\nDas Registergericht beabsichtigt die im Handelsregister eingetragene Gesellschaft von Amts wegen nach § 394 FamFG zu löschen. Die Frist zur Erhebung eines Widerspruchs gegen die beabsichtigte Löschung wird auf 1 Monat festgesetzt."
    },
    {
      "date": "2025-12-10",
      "id": "139689",
      "original_text": "Registerbekanntmachung nach dem Umwandlungsgesetz\nHessen Amtsgericht Darmstadt HRB 99099\nmedia delight GmbH – Darmstadt",
      "type": "Registerbekanntmachung nach dem Umwandlungsgesetz",
      "state": "Hessen",
      "amtsgericht": "Amtsgericht Darmstadt",
      "registernummer": "HRB 99099",
      "registerart": "HRB",
      "company_name": "media delight GmbH",
      "company_seat": "Darmstadt",
      "details": "10.12.2025 (Bekanntmachungsdatum)\n\nHessen Amtsgericht Darmstadt HRB 99099\nRegisterbekanntmachung nach dem Umwandlungsgesetz 10.12.2025 (Eintragungsdatum)\n\nmedia delight GmbH\nGesellschaft mit beschränkter Haftung\nDarmstadt\n\nDen Gläubigern der an der Verschmelzung beteiligten Rechtsträger ist, wenn sie binnen sechs Monaten nach dem Tag, an dem die Eintragung der Verschmelzung in das Register des Sitzes derjenigen Rechtsträger deren Gläubiger sie sind, nach § 19 Absatz 3 UmwG bekannt gemacht worden ist, ihren Anspruch nach Grund und Höhe schriftlich anmelden, Sicherheit zu leisten, soweit sie nicht Befriedigung verlangen können. Dieses Recht steht den Gläubigern jedoch nur zu, wenn sie glaubhaft machen, dass durch die Verschmelzung die Erfüllung ihrer Forderung gefährdet wird."
    },
    {
      "date": "2025-12-10",
      "id": "139690",
      "original_text": "Registerbekanntmachung nach dem Umwandlungsgesetz\nHessen Amtsgericht Offenbach am Main HRB 46149\nXOLUTION Consulting GmbH – Dietzenbach",
      "type": "Registerbekanntmachung nach dem Umwandlungsgesetz",
      "state": "Hessen",
      "amtsgericht": "Amtsgericht Offenbach am Main",
      "registernummer": "HRB 46149",
      "registerart": "HRB",
      "company_name": "XOLUTION Consulting GmbH",
      "company_seat": "Dietzenbach",
      "details": "10.12.2025 (Bekanntmachungsdatum)\n\nHessen Amtsgericht Offenbach am Main HRB 46149\nRegisterbekanntmachung nach dem Umwandlungsgesetz 10.12.2025 (Eintragungsdatum)\n\nXOLUTION Consulting GmbH\nGesellschaft mit beschränkter Haftung\nDietzenbach\n\nDen Gläubigern der an der formwechselnden Umwandlung beteiligten Rechtsträger ist, wenn sie binnen sechs Monaten nach dem Tag, an dem die Eintragung der formwechselnden Umwandlung in das Register des Sitzes desjenigen Rechtsträgers, dessen Gläubiger sie sind, nach § 201 UmwG bekannt gemacht worden ist, ihren Anspruch nach Grund und Höhe schriftlich anmelden, Sicherheit zu leisten, soweit sie nicht Befriedigung verlangen können. Dieses Recht steht den Gläubigern jedoch nur zu, wenn sie glaubhaft machen, dass durch die formwechselnden Umwandlung die Erfüllung ihrer Forderung gefährdet wird."
    },
    {
      "date": "2025-12-10",
      "id": "139691",
      "original_text": "Registerbekanntmachung nach dem Umwandlungsgesetz\nHessen Amtsgericht Offenbach am Main HRB 58490\nXOLUTION Consulting AG – Dietzenbach",
      "type": "Registerbekanntmachung nach dem Umwandlungsgesetz",
      "state": "Hessen",
      "amtsgericht": "Amtsgericht Offenbach am Main",
      "registernummer": "HRB 58490",
      "registerart": "HRB",
      "company_name": "XOLUTION Consulting AG",
      "company_seat": "Dietzenbach",
      "details": "10.12.2025 (Bekanntmachungsdatum)\n\nHessen Amtsgericht Offenbach am Main HRB 58490\nRegisterbekanntmachung nach dem Umwandlungsgesetz 10.12.2025 (Eintragungsdatum)\n\nXOLUTION Consulting AG\nAktiengesellschaft\nDietzenbach\n\nDen Gläubigern der an der formwechselnden Umwandlung beteiligten Rechtsträger ist, wenn sie binnen sechs Monaten nach dem Tag, an dem die Eintragung der formwechselnden Umwandlung in das Register des Sitzes desjenigen Rechtsträgers, dessen Gläubiger sie sind, nach § 201 UmwG bekannt gemacht worden ist, ihren Anspruch nach Grund und Höhe schriftlich anmelden, Sicherheit zu leisten, soweit sie nicht Befriedigung verlangen können. Dieses Recht steht den Gläubigern jedoch nur zu, wenn sie glaubhaft machen, dass durch die formwechselnden Umwandlung die Erfüllung ihrer Forderung gefährdet wird."
    },
    {
      "date": "2025-12-10",
      "id": "139692",
      "original_text": "Löschungsankündigung\nHessen Amtsgericht Wiesbaden HRB 12863\nKoenig Leatherwear GmbH – Wiesbaden",
      "type": "Löschungsankündigung",
      "state": "Hessen",
      "amtsgericht": "Amtsgericht Wiesbaden",
      "registernummer": "HRB 12863",
      "registerart": "HRB",
      "company_name": "Koenig Leatherwear GmbH",
      "company_seat": "Wiesbaden",
      "details": "10.12.2025 (Bekanntmachungsdatum)\n\nHessen Amtsgericht Wiesbaden HRB 12863\nLöschungsankündigung\n\nKoenig Leatherwear GmbH\nGesellschaft mit beschränkter Haftung\nWiesbaden\n\nDas Registergericht beabsichtigt die im Handelsregister eingetragene Gesellschaft von Amts wegen nach § 394 FamFG zu löschen. Die Frist zur Erhebung eines Widerspruchs gegen die beabsichtigte Löschung wird auf 3 Monate festgesetzt."
    },
    {
      "date": "2025-12-10",
      "id": "139693",
      "original_text": "Sonstige Registerbekanntmachung\nHessen Amtsgericht Bad Homburg v.d.H. VR 2211\nPrepper e. V. – Bad Homburg v. d. Höhe",
      "type": "Sonstige Registerbekanntmachung",
      "state": "Hessen",
      "amtsgericht": "Amtsgericht Bad Homburg v.d.H.",
      "registernummer": "VR 2211",
      "registerart": "VR",
      "company_name": "Prepper e. V.",
      "company_seat": "Bad Homburg v. d. Höhe",
      "details": "10.12.2025 (Bekanntmachungsdatum)\n\nHessen Amtsgericht Bad Homburg v.d.H. VR 2211\nSonstige Registerbekanntmachung 10.12.2025 (Eintragungsdatum)\n\nPrepper e. V.\neingetragener Verein\nBad Homburg v. d. Höhe\n\nDurch rechtskräftigen Beschluss des Amtsgerichts Bad Homburg v. d. Höhe vom 20.05.2025 ist dem Verein gemäß § 73 BGB die Rechtsfähigkeit entzogen worden."
    },
    {
      "date": "2025-12-10",
      "id": "139694",
      "original_text": "Löschungsankündigung\nHessen Amtsgericht Frankfurt am Main HRB 135860\nG-Border GmbH – Frankfurt am Main",
      "type": "Löschungsankündigung",
      "state": "Hessen",
      "amtsgericht": "Amtsgericht Frankfurt am Main",
      "registernummer": "HRB 135860",
      "registerart": "HRB",
      "company_name": "G-Border GmbH",
      "company_seat": "Frankfurt am Main",
      "details": "10.12.2025 (Bekanntmachungsdatum)\n\nHessen Amtsgericht Frankfurt am Main HRB 135860\nLöschungsankündigung\n\nG-Border GmbH\nGesellschaft mit beschränkter Haftung\nFrankfurt am Main\n\nEs ist beabsichtigt, die Gesellschaft wegen Vermögenslosigkeit gemäß § 394 FamFG von Amts wegen im Handelsregister zu löschen. Hiergegen kann innerhalb eines Monats nach dieser Veröffentlichung Widerspruch bei dem Amtsgericht Frankfurt am Main eingelegt werden."
    },
    {
      "date": "2025-12-10",
      "id": "139695",
      "original_text": "Registerbekanntmachung nach dem Umwandlungsgesetz\nHessen Amtsgericht Friedberg HRB 9832\nSenioren und Familienbetreuung Wetterau GmbH – Bad Nauheim",
      "type": "Registerbekanntmachung nach dem Umwandlungsgesetz",
      "state": "Hessen",
      "amtsgericht": "Amtsgericht Friedberg",
      "registernummer": "HRB 9832",
      "registerart": "HRB",
      "company_name": "Senioren und Familienbetreuung Wetterau GmbH",
      "company_seat": "Bad Nauheim",
      "details": "10.12.2025 (Bekanntmachungsdatum)\n\nHessen Amtsgericht Friedberg HRB 9832\nRegisterbekanntmachung nach dem Umwandlungsgesetz 10.12.2025 (Eintragungsdatum)\n\nSenioren und Familienbetreuung Wetterau GmbH\nGesellschaft mit beschränkter Haftung\nBad Nauheim\n\nDen Gläubigern der an der Verschmelzung beteiligten Rechtsträger ist, wenn sie binnen sechs Monaten nach dem Tag, an dem die Eintragung der Verschmelzung in das Register des Sitzes desjenigen Rechtsträgers, dessen Gläubiger sie sind, nach § 19 Absatz 3 UmwG bekannt gemacht worden ist, ihren Anspruch nach Grund und Höhe schriftlich anmelden, Sicherheit zu leisten, soweit sie nicht Befriedigung verlangen können. Dieses Recht steht den Gläubigern jedoch nur zu, wenn sie glaubhaft machen, dass durch die Verschmelzung die Erfüllung ihrer Forderung gefährdet wird."
    },
    {
      "date": "2025-12-10",
      "id": "139696",
      "original_text": "Registerbekanntmachung nach dem Umwandlungsgesetz\nHessen Amtsgericht Darmstadt HRB 102987\nFleet & Sales GmbH – Eppertshausen",
      "type": "Registerbekanntmachung nach dem Umwandlungsgesetz",
      "state": "Hessen",
      "amtsgericht": "Amtsgericht Darmstadt",
      "registernummer": "HRB 102987",
      "registerart": "HRB",
      "company_name": "Fleet & Sales GmbH",
      "company_seat": "Eppertshausen",
      "details": "10.12.2025 (Bekanntmachungsdatum)\n\nHessen Amtsgericht Darmstadt HRB 102987\nRegisterbekanntmachung nach dem Umwandlungsgesetz 10.12.2025 (Eintragungsdatum)\n\nFleet & Sales GmbH\nGesellschaft mit beschränkter Haftung\nEppertshausen\n\nDen Gläubigern der an der Verschmelzung beteiligten Rechtsträger ist, wenn sie binnen sechs Monaten nach dem Tag, an dem die Eintragung der Verschmelzung in das Register des Sitzes derjenigen Rechtsträger deren Gläubiger sie sind, nach § 19 Absatz 3 UmwG bekannt gemacht worden ist, ihren Anspruch nach Grund und Höhe schriftlich anmelden, Sicherheit zu leisten, soweit sie nicht Befriedigung verlangen können. Dieses Recht steht den Gläubigern jedoch nur zu, wenn sie glaubhaft machen, dass durch die Verschmelzung die Erfüllung ihrer Forderung gefährdet wird."
    },
    {
      "date": "2025-12-10",
      "id": "139697",
      "original_text": "Registerbekanntmachung nach dem Umwandlungsgesetz\nHessen Amtsgericht Offenbach am Main HRB 46149\nXOLUTION Consulting GmbH – Dietzenbach",
      "type": "Registerbekanntmachung nach dem Umwandlungsgesetz",
      "state": "Hessen",
      "amtsgericht": "Amtsgericht Offenbach am Main",
      "registernummer": "HRB 46149",
      "registerart": "HRB",
      "company_name": "XOLUTION Consulting GmbH",
      "company_seat": "Dietzenbach",
      "details": "10.12.2025 (Bekanntmachungsdatum)\n\nHessen Amtsgericht Offenbach am Main HRB 46149\nRegisterbekanntmachung nach dem Umwandlungsgesetz 10.12.2025 (Eintragungsdatum)\n\nXOLUTION Consulting GmbH\nGesellschaft mit beschränkter Haftung\nDietzenbach\n\nDen Gläubigern der an der formwechselnden Umwandlung beteiligten Rechtsträger ist, wenn sie binnen sechs Monaten nach dem Tag, an dem die Eintragung der formwechselnden Umwandlung in das Register des Sitzes desjenigen Rechtsträgers, dessen Gläubiger sie sind, nach § 201 UmwG bekannt gemacht worden ist, ihren Anspruch nach Grund und Höhe schriftlich anmelden, Sicherheit zu leisten, soweit sie nicht Befriedigung verlangen können. Dieses Recht steht den Gläubigern jedoch nur zu, wenn sie glaubhaft machen, dass durch die formwechselnden Umwandlung die Erfüllung ihrer Forderung gefährdet wird."
    },
    {
      "date": "2025-12-10",
      "id": "139698",
      "original_text": "Registerbekanntmachung nach dem Umwandlungsgesetz\nHessen Amtsgericht Darmstadt HRA 87818\nB2B General Ltd. & Co. KG – Münster",
      "type": "Registerbekanntmachung nach dem Umwandlungsgesetz",
      "state": "Hessen",
      "amtsgericht": "Amtsgericht Darmstadt",
      "registernummer": "HRA 87818",
      "registerart": "HRA",
      "company_name": "B2B General Ltd. & Co. KG",
      "company_seat": "Münster",
      "details": "10.12.2025 (Bekanntmachungsdatum)\n\nHessen Amtsgericht Darmstadt HRA 87818\nRegisterbekanntmachung nach dem Umwandlungsgesetz 10.12.2025 (Eintragungsdatum)\n\nB2B General Ltd. & Co. KG\nKommanditgesellschaft\nMünster\n\nDen Gläubigern der an der Verschmelzung beteiligten Rechtsträger ist, wenn sie binnen sechs Monaten nach dem Tag, an dem die Eintragung der Verschmelzung in das Register des Sitzes derjenigen Rechtsträger deren Gläubiger sie sind, nach § 19 Absatz 3 UmwG bekannt gemacht worden ist, ihren Anspruch nach Grund und Höhe schriftlich anmelden, Sicherheit zu leisten, soweit sie nicht Befriedigung verlangen können. Dieses Recht steht den Gläubigern jedoch nur zu, wenn sie glaubhaft machen, dass durch die Verschmelzung die Erfüllung ihrer Forderung gefährdet wird."
    },
    {
      "date": "2025-12-10",
      "id": "139699",
      "original_text": "Einreichung neuer Dokumente\nHessen Amtsgericht Marburg HRB 7728\nCSL Innovation GmbH – Marburg/Lahn",
      "type": "Einreichung neuer Dokumente",
      "state": "Hessen",
      "amtsgericht": "Amtsgericht Marburg",
      "registernummer": "HRB 7728",
      "registerart": "HRB",
      "company_name": "CSL Innovation GmbH",
      "company_seat": "Marburg/Lahn",
      "details": "10.12.2025 (Bekanntmachungsdatum)\n\nHessen Amtsgericht Marburg HRB 7728\nEinreichung neuer Dokumente 10.12.2025 (Eintragungsdatum)\n\nCSL Innovation GmbH\nGesellschaft mit beschränkter Haftung\nMarburg/Lahn\n\nDurch eine Änderung in den Personen der Aufsichtsratsmitglieder ist eine Liste der Mitglieder des Aufsichtsrates zum Handelsregister eingereicht worden."
    },
    {
      "date": "2025-12-10",
      "id": "139700",
      "original_text": "Löschungsankündigung\nHessen Amtsgericht Darmstadt HRB 94230\nPEGASUS Unternehmensberatung- u. Beteilungsgesellschaft UG (haftungsbeschränkt – Groß-Umstadt",
      "type": "Löschungsankündigung",
      "state": "Hessen",
      "amtsgericht": "Amtsgericht Darmstadt",
      "registernummer": "HRB 94230",
      "registerart": "HRB",
      "company_name": "PEGASUS Unternehmensberatung- u. Beteilungsgesellschaft UG (haftungsbeschränkt",
      "company_seat": "Groß-Umstadt",
      "details": "10.12.2025 (Bekanntmachungsdatum)\n\nHessen Amtsgericht Darmstadt HRB 94230\nLöschungsankündigung\n\nPEGASUS Unternehmensberatung- u. Beteilungsgesellschaft UG (haftungsbeschränkt\nGesellschaft mit beschränkter Haftung\nGroß-Umstadt\n\nDas Registergericht beabsichtigt die im Handelsregister eingetragene Gesellschaft von Amts wegen nach § 394 FamFG zu löschen. Die Frist zur Erhebung eines Widerspruchs gegen die beabsichtigte Löschung wird auf 3 Monate festgesetzt."
    },
    {
      "date": "2025-12-10",
      "id": "139701",
      "original_text": "Registerbekanntmachung nach dem Umwandlungsgesetz\nHessen Amtsgericht Frankfurt am Main HRB 57272\nGSS Gesellschaft für Stahlbau und Schweißtechnik mbH – Hattersheim",
      "type": "Registerbekanntmachung nach dem Umwandlungsgesetz",
      "state": "Hessen",
      "amtsgericht": "Amtsgericht Frankfurt am Main",
      "registernummer": "HRB 57272",
      "registerart": "HRB",
      "company_name": "GSS Gesellschaft für Stahlbau und Schweißtechnik mbH",
      "company_seat": "Hattersheim",
      "details": "10.12.2025 (Bekanntmachungsdatum)\n\nHessen Amtsgericht Frankfurt am Main HRB 57272\nRegisterbekanntmachung nach dem Umwandlungsgesetz 10.12.2025 (Eintragungsdatum)\n\nGSS Gesellschaft für Stahlbau und Schweißtechnik mbH\nGesellschaft mit beschränkter Haftung\nHattersheim\n\nDen Gläubigern der an der formwechselnden Umwandlung beteiligten Rechtsträger ist, wenn sie binnen sechs Monaten nach dem Tag, an dem die Eintragung der formwechselnden Umwandlung in das Register des Sitzes desjenigen Rechtsträgers, dessen Gläubiger sie sind, nach § 201 UmwG bekannt gemacht worden ist, ihren Anspruch nach Grund und Höhe schriftlich anmelden, Sicherheit zu leisten, soweit sie nicht Befriedigung verlangen können. Dieses Recht steht den Gläubigern jedoch nur zu, wenn sie glaubhaft machen, dass durch die formwechselnden Umwandlung die Erfüllung ihrer Forderung gefährdet wird."
    },
    {
      "date": "2025-12-10",
      "id": "139702",
      "original_text": "Löschungsankündigung\nHessen Amtsgericht Offenbach am Main HRB 54931\nMBS Dienstleistungen GmbH – Offenbach am Main",
      "type": "Löschungsankündigung",
      "state": "Hessen",
      "amtsgericht": "Amtsgericht Offenbach am Main",
      "registernummer": "HRB 54931",
      "registerart": "HRB",
      "company_name": "MBS Dienstleistungen GmbH",
      "company_seat": "Offenbach am Main",
      "details": "10.12.2025 (Bekanntmachungsdatum)\n\nHessen Amtsgericht Offenbach am Main HRB 54931\nLöschungsankündigung\n\nMBS Dienstleistungen GmbH\nGesellschaft mit beschränkter Haftung\nOffenbach am Main\n\nDas Registergericht beabsichtigt die im Handelsregister eingetragene Gesellschaft von Amts wegen nach § 394 FamFG zu löschen. Die Frist zur Erhebung eines Widerspruchs gegen die beabsichtigte Löschung wird auf 3 Monate festgesetzt."
    },
    {
      "date": "2025-12-10",
      "id": "139703",
      "original_text": "Registerbekanntmachung nach dem Umwandlungsgesetz\nHessen Amtsgericht Darmstadt HRA 87890\nmedia-delight Christian Bauer e.K. – Darmstadt",
      "type": "Registerbekanntmachung nach dem Umwandlungsgesetz",
      "state": "Hessen",
      "amtsgericht": "Amtsgericht Darmstadt",
      "registernummer": "HRA 87890",
      "registerart": "HRA",
      "company_name": "media-delight Christian Bauer e.K.",
      "company_seat": "Darmstadt",
      "details": "10.12.2025 (Bekanntmachungsdatum)\n\nHessen Amtsgericht Darmstadt HRA 87890\nRegisterbekanntmachung nach dem Umwandlungsgesetz 10.12.2025 (Eintragungsdatum)\n\nmedia-delight Christian Bauer e.K.\nEinzelkaufmann / Einzelkauffrau\nDarmstadt\n\nDen Gläubigern der an der Verschmelzung beteiligten Rechtsträger ist, wenn sie binnen sechs Monaten nach dem Tag, an dem die Eintragung der Verschmelzung in das Register des Sitzes derjenigen Rechtsträger deren Gläubiger sie sind, nach § 19 Absatz 3 UmwG bekannt gemacht worden ist, ihren Anspruch nach Grund und Höhe schriftlich anmelden, Sicherheit zu leisten, soweit sie nicht Befriedigung verlangen können. Dieses Recht steht den Gläubigern jedoch nur zu, wenn sie glaubhaft machen, dass durch die Verschmelzung die Erfüllung ihrer Forderung gefährdet wird."
    },
    {
      "date": "2025-12-10",
      "id": "139704",
      "original_text": "Löschungsankündigung\nHessen Amtsgericht Frankfurt am Main HRB 107948\nBORCH-WKAER Umwelt Technik GmbH – Sulzbach (Taunus)",
      "type": "Löschungsankündigung",
      "state": "Hessen",
      "amtsgericht": "Amtsgericht Frankfurt am Main",
      "registernummer": "HRB 107948",
      "registerart": "HRB",
      "company_name": "BORCH-WKAER Umwelt Technik GmbH",
      "company_seat": "Sulzbach (Taunus)",
      "details": "10.12.2025 (Bekanntmachungsdatum)\n\nHessen Amtsgericht Frankfurt am Main HRB 107948\nLöschungsankündigung\n\nBORCH-WKAER Umwelt Technik GmbH\nGesellschaft mit beschränkter Haftung\nSulzbach (Taunus)\n\nDas Registergericht beabsichtigt die im Handelsregister eingetragene Gesellschaft von Amts wegen nach § 394 FamFG zu löschen. Die Frist zur Erhebung eines Widerspruchs gegen die beabsichtigte Löschung wird auf 1 Monat festgesetzt."
    },
    {
      "date": "2025-12-10",
      "id": "139705",
      "original_text": "Registerbekanntmachung nach dem Umwandlungsgesetz\nHessen Amtsgericht Frankfurt am Main HRB 94515\nChina Visa Service Center (Germany) GmbH – Frankfurt am Main",
      "type": "Registerbekanntmachung nach dem Umwandlungsgesetz",
      "state": "Hessen",
      "amtsgericht": "Amtsgericht Frankfurt am Main",
      "registernummer": "HRB 94515",
      "registerart": "HRB",
      "company_name": "China Visa Service Center (Germany) GmbH",
      "company_seat": "Frankfurt am Main",
      "details": "10.12.2025 (Bekanntmachungsdatum)\n\nHessen Amtsgericht Frankfurt am Main HRB 94515\nRegisterbekanntmachung nach dem Umwandlungsgesetz\n\nChina Visa Service Center (Germany) GmbH\nGesellschaft mit beschränkter Haftung\nFrankfurt am Main\n\nDem Registergericht ist ein Verschmelzungsplan über die geplante grenzüberschreitende Verschmelzung der China Visa Service Center (Germany) GmbH mit Sitz in Frankfurt am Main (Gesellschaft mit beschränkter Haftung, eingetragen beim Amtsgericht Frankfurt am Main unter der HRB  94515) als übernehmender Rechtsträger mit der CITS V SERVICE (BELGIUM) S.R.L mit Sitz in Woluwe-Saint-Lambert/Belgien (Société à responsabilité limitée, eingetragen beim Belgian Crossroads Bank for Enterprises 0831.680.671) als übertragender Rechtsträger eingereicht worden.\nDen Gläubigern der übertragenden Gesellschaft ist Sicherheit zu leisten, wenn sie innerhalb einer Frist von zwei Monaten nach Bekanntmachung des Verschmelzungsplans glaubhaft machen, dass durch die Verschmelzung die Erfüllung ihrer Forderung gefährdet wird. Die Anteilseigner der übertragenden Gesellschaft haben bei grenzüberschreitenden Verschmelzungen einen Anspruch auf angemessene Abfindung, sofern sie der Verschmelzung widersprochen haben; gegebenenfalls steht ihnen auch ein Anspruch auf bare Zuzahlung zu."
    },
    {
      "date": "2025-12-10",
      "id": "139706",
      "original_text": "Löschungsankündigung\nHessen Amtsgericht Frankfurt am Main HRB 133872\nClemy Ent. GmbH – Frankfurt am Main",
      "type": "Löschungsankündigung",
      "state": "Hessen",
      "amtsgericht": "Amtsgericht Frankfurt am Main",
      "registernummer": "HRB 133872",
      "registerart": "HRB",
      "company_name": "Clemy Ent. GmbH",
      "company_seat": "Frankfurt am Main",
      "details": "10.12.2025 (Bekanntmachungsdatum)\n\nHessen Amtsgericht Frankfurt am Main HRB 133872\nLöschungsankündigung\n\nClemy Ent. GmbH\nGesellschaft mit beschränkter Haftung\nFrankfurt am Main\n\nEs ist beabsichtigt, die Gesellschaft wegen Vermögenslosigkeit gemäß § 394 FamFG von Amts wegen im Handelsregister zu löschen. Hiergegen kann innerhalb eines Monats nach dieser Veröffentlichung Widerspruch bei dem Amtsgericht Frankfurt am Main eingelegt werden."
    },
    {
      "date": "2025-12-10",
      "id": "139707",
      "original_text": "Registerbekanntmachung nach dem Umwandlungsgesetz\nHessen Amtsgericht Frankfurt am Main HRB 8633\nDeka Immobilien Investment GmbH – Frankfurt am Main",
      "type": "Registerbekanntmachung nach dem Umwandlungsgesetz",
      "state": "Hessen",
      "amtsgericht": "Amtsgericht Frankfurt am Main",
      "registernummer": "HRB 8633",
      "registerart": "HRB",
      "company_name": "Deka Immobilien Investment GmbH",
      "company_seat": "Frankfurt am Main",
      "details": "10.12.2025 (Bekanntmachungsdatum)\n\nHessen Amtsgericht Frankfurt am Main HRB 8633\nRegisterbekanntmachung nach dem Umwandlungsgesetz\n\nDeka Immobilien Investment GmbH\nGesellschaft mit beschränkter Haftung\nFrankfurt am Main\n\nDem Registergericht ist der Entwurf eines Verschmelzungsplans über die geplante grenzüberschreitende Verschmelzung der Deka Immobilien Investment GmbH mit Sitz in Frankfurt am Main (Gesellschaft mit beschränkter Haftung, eingetragen beim Amtsgericht Frankfurt am Main unter der HRB  8633) als übernehmender Rechtsträger mit der Deka Immobilien Cristalia S.L.U. mit Sitz in Madrid/Spanien (Gesellschaft mit beschränkter Haftung nach spanischem Recht, eingetragen beim Handelsregister von Madrid, Band 32.558, Blatt 49, Seite\nM-585992, 1. Eintragung unter die Steueridentifikationsnummer C.I.F.\nB- 64.962.368.) als übertragender Rechtsträger eingereicht worden.\nDen Gläubigern der übertragenden Gesellschaft ist Sicherheit zu leisten, wenn sie innerhalb einer Frist von zwei Monaten nach Bekanntmachung des Verschmelzungsplans glaubhaft machen, dass durch die Verschmelzung die Erfüllung ihrer Forderung gefährdet wird. Die Anteilseigner der übertragenden Gesellschaft haben bei grenzüberschreitenden Verschmelzungen einen Anspruch auf angemessene Abfindung, sofern sie der Verschmelzung widersprochen haben; gegebenenfalls steht ihnen auch ein Anspruch auf bare Zuzahlung zu.\nGemäß § 308 UmwG wird bekannt gemacht:\n\nRechtsform, Firma und Sitz der beteiligten Gesellschaften\n\nAn der grenzüberschreitenden Verschmelzung sind beteiligt:\n\n- Als übernehmende Gesellschaft, Deka Immobilien Investment GmbH, eine Gesellschaft mit beschränkter Haftung nach deutschem Recht, mit Satzungssitz in der Lyoner Straße 13, 60528 Frankfurt am Main, Deutschland.\n\n- Als übertragende Gesellschaft, Deka Immobilien Cristalia S.L.U., eine Gesellschaft mit beschränkter Haftung nach spanischem Recht. Die Gesellschaft hat ihren Sitz von Barcelona nach Madrid gewechselt, und ist nun ansässig in Palacio de Miraflores, Carretera de San Jerónimo número 15, 2º, 28014, Madrid, Spanien.\n\nRegister der an der grenzüberschreitenden Verschmelzung beteiligten Gesellschaften sowie die Nummer der Eintragung.\n\n- Die Deka Immobilien Investment GmbH ist eingetragen im Handelsregister des Amtsgerichts Frankfurt am Main unter HRB 8633.\n\n- Die Deka Immobilien Cristalia S.L.U., ist eingetragen im Handelsregister von Madrid, Band 32.558, Blatt 49, Seite M-585992, 1. Eintragung unter die Steueridentifikationsnummer C.I.F. B- 64.962.368.\n\n3. Form der grenzüberschreitenden Verschmelzung: Verschmelzung durch Aufnahme.\n\nDie Deka Immobilien Cristalia S.L.U., eine vollständig von der Deka Immobilien Investment GmbH gehaltene Tochtergesellschaft, wird mit der Deka Immobilien Investment GmbH unter ihrer Auflösung ohne Abwicklung durch Übertragung verschmolzen. Dabei übernimmt die Deka Immobilien Investment GmbH im Wege der Gesamtrechtsnachfolge sämtliche Vermögenswerte und Verbindlichkeiten der Deka Immobilien Cristalia S.L.U.\n\n4. Hinweis an die Anteilsinhaber, die Gläubiger und die zuständige Betriebsräte der an der grenzüberschreitenden Verschmelzung beteiligten Gesellschaft, dass sie der jeweiligen Gesellschaft spätestens fünf Arbeitstage vor dem Tag der Gesellschafterversammlung Bemerkungen zum Verschmelzungsplan übermitteln können.\nDie Anteilsinhaber, Gläubiger und Betriebsräte der an der Verschmelzung beteiligten Gesellschaften können den Gesellschaften spätestens fünf (5) Arbeitstage vor dem Tag der Beurkundung des Verschmelzungsbeschlusses Bemerkungen zum Verschmelzungsplan übermitteln.\nEs wird hiermit ausdrücklich darauf hingewiesen, dass Deka Immobilien Cristalia S.L.U. keine Arbeitnehmer beschäftigt und dass sich für die von der Verschmelzung betroffenen Gesellschafter keine Auswirkungen ergeben, da die übertragende Gesellschaft vollständig im Besitz der übernehmenden Gesellschaft befindet.\nZum Zeitpunkt dieser Bekanntmachung ist das Datum der notariellen Beurkundung des Verschmelzungsbeschlusses jedoch noch nicht festgelegt, die Versammlung wird aber frühestens am 24. Dezember 2025 stattfinden. Daher endet die Frist zur Einreichung von Bemerkungen spätestens fünf (5) Arbeitstage vor dem 24. Dezember 2025.\n\nDie Bemerkungen können per Post an die Geschäftsanschrift: Lyoner Straße 13, 60528 Frankfurt am Main, Deutschland, gesendet werden."
    },
    {
      "date": "2025-12-10",
      "id": "139708",
      "original_text": "Sonstige Registerbekanntmachung\nHessen Amtsgericht Wiesbaden VR 1260\nBiochemischer Verein Wiesbaden und Umgebung e.V. – Wiesbaden",
      "type": "Sonstige Registerbekanntmachung",
      "state": "Hessen",
      "amtsgericht": "Amtsgericht Wiesbaden",
      "registernummer": "VR 1260",
      "registerart": "VR",
      "company_name": "Biochemischer Verein Wiesbaden und Umgebung e.V.",
      "company_seat": "Wiesbaden",
      "details": "10.12.2025 (Bekanntmachungsdatum)\n\nHessen Amtsgericht Wiesbaden VR 1260\nSonstige Registerbekanntmachung 10.12.2025 (Eintragungsdatum)\n\nBiochemischer Verein Wiesbaden und Umgebung e.V.\neingetragener Verein\nWiesbaden\n\nDer Verein ist aufgelöst."
    }
  ]
}