{
  "date": "2025-12-18",
  "date_of_scrape": "2025-12-19T04:20:42.650Z",
  "tool_version": "0.2.0",
  "number_of_announcements": 165,
  "announcements": [
    {
      "date": "2025-12-18",
      "id": "140379",
      "original_text": "Registerbekanntmachung nach dem Umwandlungsgesetz\nBayern Amtsgericht München HRB 303894\nJS Vermögensverwaltung GmbH – Kirchseeon",
      "type": "Registerbekanntmachung nach dem Umwandlungsgesetz",
      "state": "Bayern",
      "amtsgericht": "Amtsgericht München",
      "registernummer": "HRB 303894",
      "registerart": "HRB",
      "company_name": "JS Vermögensverwaltung GmbH",
      "company_seat": "Kirchseeon",
      "details": "18.12.2025 (Bekanntmachungsdatum)\n\nBayern Amtsgericht München HRB 303894\nRegisterbekanntmachung nach dem Umwandlungsgesetz 17.12.2025 (Eintragungsdatum)\n\nJS Vermögensverwaltung GmbH\nGesellschaft mit beschränkter Haftung\nKirchseeon\n\nDen Gläubigern der an der Spaltung beteiligten Rechtsträger ist, wenn sie binnen sechs Monaten nach dem Tag, an dem die Eintragung der Spaltung in das Register des Sitzes desjenigen Rechtsträgers, dessen Gläubiger sie sind, nach §§ 125, 19 Abs. 3 UmwG als bekannt gemacht gilt, ihren Anspruch nach Grund und Höhe in Textform anmelden, Sicherheit zu leisten, soweit sie nicht Befriedigung verlangen können. Dieses Recht steht den Gläubigern jedoch nur zu, wenn sie glaubhaft machen, dass durch die Spaltung die Erfüllung ihrer Forderung gefährdet wird."
    },
    {
      "date": "2025-12-18",
      "id": "140380",
      "original_text": "Registerbekanntmachung nach dem Umwandlungsgesetz\nBayern Amtsgericht München HRB 303912\nAR Vermögensverwaltung GmbH – Kirchseeon",
      "type": "Registerbekanntmachung nach dem Umwandlungsgesetz",
      "state": "Bayern",
      "amtsgericht": "Amtsgericht München",
      "registernummer": "HRB 303912",
      "registerart": "HRB",
      "company_name": "AR Vermögensverwaltung GmbH",
      "company_seat": "Kirchseeon",
      "details": "18.12.2025 (Bekanntmachungsdatum)\n\nBayern Amtsgericht München HRB 303912\nRegisterbekanntmachung nach dem Umwandlungsgesetz 17.12.2025 (Eintragungsdatum)\n\nAR Vermögensverwaltung GmbH\nGesellschaft mit beschränkter Haftung\nKirchseeon\n\nDen Gläubigern der an der Spaltung beteiligten Rechtsträger ist, wenn sie binnen sechs Monaten nach dem Tag, an dem die Eintragung der Spaltung in das Register des Sitzes desjenigen Rechtsträgers, dessen Gläubiger sie sind, nach §§ 125, 19 Abs. 3 UmwG als bekannt gemacht gilt, ihren Anspruch nach Grund und Höhe in Textform anmelden, Sicherheit zu leisten, soweit sie nicht Befriedigung verlangen können. Dieses Recht steht den Gläubigern jedoch nur zu, wenn sie glaubhaft machen, dass durch die Spaltung die Erfüllung ihrer Forderung gefährdet wird."
    },
    {
      "date": "2025-12-18",
      "id": "140381",
      "original_text": "Registerbekanntmachung nach dem Umwandlungsgesetz\nBayern Amtsgericht Augsburg HRB 41826\nWEKA Media Group GmbH – Kissing",
      "type": "Registerbekanntmachung nach dem Umwandlungsgesetz",
      "state": "Bayern",
      "amtsgericht": "Amtsgericht Augsburg",
      "registernummer": "HRB 41826",
      "registerart": "HRB",
      "company_name": "WEKA Media Group GmbH",
      "company_seat": "Kissing",
      "details": "18.12.2025 (Bekanntmachungsdatum)\n\nBayern Amtsgericht Augsburg HRB 41826\nRegisterbekanntmachung nach dem Umwandlungsgesetz 17.12.2025 (Eintragungsdatum)\n\nWEKA Media Group GmbH\nGesellschaft mit beschränkter Haftung\nKissing\n\nDen Gläubigern der an der Spaltung beteiligten Rechtsträger ist, wenn sie binnen sechs Monaten nach dem Tag, an dem die Eintragung der Spaltung in das Register des Sitzes desjenigen Rechtsträgers, dessen Gläubiger sie sind, nach §§ 125, 19 Abs. 3 UmwG als bekannt gemacht gilt, ihren Anspruch nach Grund und Höhe in Textform anmelden, Sicherheit zu leisten, soweit sie nicht Befriedigung verlangen können. Dieses Recht steht den Gläubigern jedoch nur zu, wenn sie glaubhaft machen, dass durch die Spaltung die Erfüllung ihrer Forderung gefährdet wird."
    },
    {
      "date": "2025-12-18",
      "id": "140382",
      "original_text": "Löschungsankündigung\nBayern Amtsgericht München HRB 242150\nForthset UG (haftungsbeschränkt) – München",
      "type": "Löschungsankündigung",
      "state": "Bayern",
      "amtsgericht": "Amtsgericht München",
      "registernummer": "HRB 242150",
      "registerart": "HRB",
      "company_name": "Forthset UG (haftungsbeschränkt)",
      "company_seat": "München",
      "details": "18.12.2025 (Bekanntmachungsdatum)\n\nBayern Amtsgericht München HRB 242150\nLöschungsankündigung\n\nForthset UG (haftungsbeschränkt)\nGesellschaft mit beschränkter Haftung\nMünchen\n\nDas Registergericht beabsichtigt, die im Handelsregister eingetragene Gesellschaft wegen Vermögenslosigkeit von Amts wegen nach § 394 FamFG zu löschen. Die Frist zur Erhebung eines Widerspruchs ist auf drei Monate festgesetzt."
    },
    {
      "date": "2025-12-18",
      "id": "140383",
      "original_text": "Einreichung neuer Dokumente\nBayern Amtsgericht Augsburg HRB 6049\nTextil - Treuhand Gesellschaft mit beschränkter Haftung – Augsburg",
      "type": "Einreichung neuer Dokumente",
      "state": "Bayern",
      "amtsgericht": "Amtsgericht Augsburg",
      "registernummer": "HRB 6049",
      "registerart": "HRB",
      "company_name": "Textil - Treuhand Gesellschaft mit beschränkter Haftung",
      "company_seat": "Augsburg",
      "details": "18.12.2025 (Bekanntmachungsdatum)\n\nBayern Amtsgericht Augsburg HRB 6049\nEinreichung neuer Dokumente\n\nTextil - Treuhand Gesellschaft mit beschränkter Haftung\nGesellschaft mit beschränkter Haftung\nAugsburg\n\nDem Amtsgericht Augsburg -Registergericht- ist eine Liste der Mitglieder des Aufsichtsrats eingereicht worden, § 52 Abs. 3 S. 2 GmbHG."
    },
    {
      "date": "2025-12-18",
      "id": "140384",
      "original_text": "Löschungsankündigung\nBayern Amtsgericht München HRB 114399\nB & S Beteiligungsgesellschaft mbH – München",
      "type": "Löschungsankündigung",
      "state": "Bayern",
      "amtsgericht": "Amtsgericht München",
      "registernummer": "HRB 114399",
      "registerart": "HRB",
      "company_name": "B & S Beteiligungsgesellschaft mbH",
      "company_seat": "München",
      "details": "18.12.2025 (Bekanntmachungsdatum)\n\nBayern Amtsgericht München HRB 114399\nLöschungsankündigung\n\nB & S Beteiligungsgesellschaft mbH\nGesellschaft mit beschränkter Haftung\nMünchen\n\nDas Registergericht beabsichtigt, die im Handelsregister eingetragene Gesellschaft wegen Vermögenslosigkeit von Amts wegen nach § 394 FamFG zu löschen. Die Frist zur Erhebung eines Widerspruchs ist auf drei Monate festgesetzt."
    },
    {
      "date": "2025-12-18",
      "id": "140385",
      "original_text": "Registerbekanntmachung nach dem Umwandlungsgesetz\nBayern Amtsgericht München HRB 126733\nSTUDIOCANAL TV GmbH – München",
      "type": "Registerbekanntmachung nach dem Umwandlungsgesetz",
      "state": "Bayern",
      "amtsgericht": "Amtsgericht München",
      "registernummer": "HRB 126733",
      "registerart": "HRB",
      "company_name": "STUDIOCANAL TV GmbH",
      "company_seat": "München",
      "details": "18.12.2025 (Bekanntmachungsdatum)\n\nBayern Amtsgericht München HRB 126733\nRegisterbekanntmachung nach dem Umwandlungsgesetz 17.12.2025 (Eintragungsdatum)\n\nSTUDIOCANAL TV GmbH\nGesellschaft mit beschränkter Haftung\nMünchen\n\nDen Gläubigern der an der Verschmelzung beteiligten Rechtsträger ist, wenn sie binnen sechs Monaten nach dem Tag, an dem die Eintragung der Verschmelzung in das Register des Sitzes desjenigen Rechtsträgers, dessen Gläubiger sie sind, nach § 19 Abs. 3 UmwG als bekannt gemacht gilt, ihren Anspruch nach Grund und Höhe in Textform anmelden, Sicherheit zu leisten, soweit sie nicht Befriedigung verlangen können. Dieses Recht steht den Gläubigern jedoch nur zu, wenn sie glaubhaft machen, dass durch die Verschmelzung die Erfüllung ihrer Forderung gefährdet wird."
    },
    {
      "date": "2025-12-18",
      "id": "140386",
      "original_text": "Einreichung neuer Dokumente\nBayern Amtsgericht Nürnberg HRB 9954\nTADANO FAUN GmbH – Lauf a. d. Pegnitz",
      "type": "Einreichung neuer Dokumente",
      "state": "Bayern",
      "amtsgericht": "Amtsgericht Nürnberg",
      "registernummer": "HRB 9954",
      "registerart": "HRB",
      "company_name": "TADANO FAUN GmbH",
      "company_seat": "Lauf a. d. Pegnitz",
      "details": "18.12.2025 (Bekanntmachungsdatum)\n\nBayern Amtsgericht Nürnberg HRB 9954\nEinreichung neuer Dokumente\n\nTADANO FAUN GmbH\nGesellschaft mit beschränkter Haftung\nLauf a. d. Pegnitz\n\nDem Amtsgericht Nürnberg -Registergericht- ist eine Liste der Mitglieder des Aufsichtsrats eingereicht worden, § 52 Abs. 3 S. 2 GmbHG."
    },
    {
      "date": "2025-12-18",
      "id": "140387",
      "original_text": "Löschungsankündigung\nBayern Amtsgericht München HRB 139154\nMV Media GmbH – München",
      "type": "Löschungsankündigung",
      "state": "Bayern",
      "amtsgericht": "Amtsgericht München",
      "registernummer": "HRB 139154",
      "registerart": "HRB",
      "company_name": "MV Media GmbH",
      "company_seat": "München",
      "details": "18.12.2025 (Bekanntmachungsdatum)\n\nBayern Amtsgericht München HRB 139154\nLöschungsankündigung\n\nMV Media GmbH\nGesellschaft mit beschränkter Haftung\nMünchen\n\nDas Registergericht beabsichtigt, die im Handelsregister eingetragene Gesellschaft wegen Vermögenslosigkeit von Amts wegen nach § 394 FamFG zu löschen. Die Frist zur Erhebung eines Widerspruchs ist auf drei Monate festgesetzt."
    },
    {
      "date": "2025-12-18",
      "id": "140388",
      "original_text": "Einreichung neuer Dokumente\nBayern Amtsgericht München HRB 177272\nVolkshochschule Stadt Land Bruck gemeinnützige Gesellschaft mit beschränkter Haftung (vhs Stadt Land Bruck gGmbH) – Fürstenfeldbruck",
      "type": "Einreichung neuer Dokumente",
      "state": "Bayern",
      "amtsgericht": "Amtsgericht München",
      "registernummer": "HRB 177272",
      "registerart": "HRB",
      "company_name": "Volkshochschule Stadt Land Bruck gemeinnützige Gesellschaft mit beschränkter Haftung (vhs Stadt Land Bruck gGmbH)",
      "company_seat": "Fürstenfeldbruck",
      "details": "18.12.2025 (Bekanntmachungsdatum)\n\nBayern Amtsgericht München HRB 177272\nEinreichung neuer Dokumente\n\nVolkshochschule Stadt Land Bruck gemeinnützige Gesellschaft mit beschränkter Haftung (vhs Stadt Land Bruck gGmbH)\nGesellschaft mit beschränkter Haftung\nFürstenfeldbruck\n\nDem Amtsgericht München -Registergericht- ist eine Liste der Mitglieder des Aufsichtsrats eingereicht worden, § 52 Abs. 3 S. 2 GmbHG."
    },
    {
      "date": "2025-12-18",
      "id": "140389",
      "original_text": "Löschungsankündigung\nBayern Amtsgericht Regensburg HRB 15272\nDukkan Al-Hara - Der orientalische Laden - GmbH – Cham",
      "type": "Löschungsankündigung",
      "state": "Bayern",
      "amtsgericht": "Amtsgericht Regensburg",
      "registernummer": "HRB 15272",
      "registerart": "HRB",
      "company_name": "Dukkan Al-Hara - Der orientalische Laden - GmbH",
      "company_seat": "Cham",
      "details": "18.12.2025 (Bekanntmachungsdatum)\n\nBayern Amtsgericht Regensburg HRB 15272\nLöschungsankündigung\n\nDukkan Al-Hara - Der orientalische Laden - GmbH\nGesellschaft mit beschränkter Haftung\nCham\n\nDas Registergericht beabsichtigt, die im Handelsregister eingetragene Gesellschaft wegen Vermögenslosigkeit von Amts wegen nach § 394 FamFG zu löschen. Die Frist zur Erhebung eines Widerspruchs ist auf einen Monat festgesetzt."
    },
    {
      "date": "2025-12-18",
      "id": "140390",
      "original_text": "Einreichung neuer Dokumente\nBayern Amtsgericht München HRB 75534\nBSH Hausgeräte GmbH – München",
      "type": "Einreichung neuer Dokumente",
      "state": "Bayern",
      "amtsgericht": "Amtsgericht München",
      "registernummer": "HRB 75534",
      "registerart": "HRB",
      "company_name": "BSH Hausgeräte GmbH",
      "company_seat": "München",
      "details": "18.12.2025 (Bekanntmachungsdatum)\n\nBayern Amtsgericht München HRB 75534\nEinreichung neuer Dokumente\n\nBSH Hausgeräte GmbH\nGesellschaft mit beschränkter Haftung\nMünchen\n\nDem Amtsgericht München -Registergericht- ist eine Liste der Mitglieder des Aufsichtsrats eingereicht worden, § 52 Abs. 3 S. 2 GmbHG."
    },
    {
      "date": "2025-12-18",
      "id": "140391",
      "original_text": "Löschungsankündigung\nBayern Amtsgericht München HRB 250197\nBluetech Technologie GmbH – Hallbergmoos",
      "type": "Löschungsankündigung",
      "state": "Bayern",
      "amtsgericht": "Amtsgericht München",
      "registernummer": "HRB 250197",
      "registerart": "HRB",
      "company_name": "Bluetech Technologie GmbH",
      "company_seat": "Hallbergmoos",
      "details": "18.12.2025 (Bekanntmachungsdatum)\n\nBayern Amtsgericht München HRB 250197\nLöschungsankündigung\n\nBluetech Technologie GmbH\nGesellschaft mit beschränkter Haftung\nHallbergmoos\n\nDas Registergericht beabsichtigt, die im Handelsregister eingetragene Gesellschaft wegen Vermögenslosigkeit von Amts wegen nach § 394 FamFG zu löschen. Die Frist zur Erhebung eines Widerspruchs ist auf drei Monate festgesetzt."
    },
    {
      "date": "2025-12-18",
      "id": "140392",
      "original_text": "Einreichung neuer Dokumente\nBayern Amtsgericht München HRB 235509\nAtos Information Technology GmbH – München",
      "type": "Einreichung neuer Dokumente",
      "state": "Bayern",
      "amtsgericht": "Amtsgericht München",
      "registernummer": "HRB 235509",
      "registerart": "HRB",
      "company_name": "Atos Information Technology GmbH",
      "company_seat": "München",
      "details": "18.12.2025 (Bekanntmachungsdatum)\n\nBayern Amtsgericht München HRB 235509\nEinreichung neuer Dokumente\n\nAtos Information Technology GmbH\nGesellschaft mit beschränkter Haftung\nMünchen\n\nDem Amtsgericht München -Registergericht- ist eine Liste der Mitglieder des Aufsichtsrats eingereicht worden, § 52 Abs. 3 S. 2 GmbHG."
    },
    {
      "date": "2025-12-18",
      "id": "140393",
      "original_text": "Einreichung neuer Dokumente\nBayern Amtsgericht Nürnberg HRB 10469\nVEDES AG – Nürnberg",
      "type": "Einreichung neuer Dokumente",
      "state": "Bayern",
      "amtsgericht": "Amtsgericht Nürnberg",
      "registernummer": "HRB 10469",
      "registerart": "HRB",
      "company_name": "VEDES AG",
      "company_seat": "Nürnberg",
      "details": "18.12.2025 (Bekanntmachungsdatum)\n\nBayern Amtsgericht Nürnberg HRB 10469\nEinreichung neuer Dokumente\n\nVEDES AG\nAktiengesellschaft\nNürnberg\n\nDem Amtsgericht Nürnberg -Registergericht- ist eine Liste der Mitglieder des Aufsichtsrats eingereicht worden, § 106 AktG."
    },
    {
      "date": "2025-12-18",
      "id": "140394",
      "original_text": "Einreichung neuer Dokumente\nBayern Amtsgericht Weiden i. d. OPf. HRB 3346\nV.I.P. Aktiengesellschaft – Waldershof",
      "type": "Einreichung neuer Dokumente",
      "state": "Bayern",
      "amtsgericht": "Amtsgericht Weiden i. d. OPf.",
      "registernummer": "HRB 3346",
      "registerart": "HRB",
      "company_name": "V.I.P. Aktiengesellschaft",
      "company_seat": "Waldershof",
      "details": "18.12.2025 (Bekanntmachungsdatum)\n\nBayern Amtsgericht Weiden i. d. OPf. HRB 3346\nEinreichung neuer Dokumente 17.12.2025 (Eintragungsdatum)\n\nV.I.P. Aktiengesellschaft\nAktiengesellschaft\nWaldershof\n\nDem Amtsgericht Weiden i.d.OPf. -Registergericht- ist eine Liste der Mitglieder des Aufsichtsrats eingereicht worden, § 106 AktG."
    },
    {
      "date": "2025-12-18",
      "id": "140395",
      "original_text": "Registerbekanntmachung nach dem Umwandlungsgesetz\nBayern Amtsgericht München HRB 282432\nConnex Holding GmbH – Grünwald",
      "type": "Registerbekanntmachung nach dem Umwandlungsgesetz",
      "state": "Bayern",
      "amtsgericht": "Amtsgericht München",
      "registernummer": "HRB 282432",
      "registerart": "HRB",
      "company_name": "Connex Holding GmbH",
      "company_seat": "Grünwald",
      "details": "18.12.2025 (Bekanntmachungsdatum)\n\nBayern Amtsgericht München HRB 282432\nRegisterbekanntmachung nach dem Umwandlungsgesetz 17.12.2025 (Eintragungsdatum)\n\nConnex Holding GmbH\nGesellschaft mit beschränkter Haftung\nGrünwald\n\nDen Gläubigern der an der Verschmelzung beteiligten Rechtsträger ist, wenn sie binnen sechs Monaten nach dem Tag, an dem die Eintragung der Verschmelzung in das Register des Sitzes desjenigen Rechtsträgers, dessen Gläubiger sie sind, nach § 19 Abs. 3 UmwG als bekannt gemacht gilt, ihren Anspruch nach Grund und Höhe in Textform anmelden, Sicherheit zu leisten, soweit sie nicht Befriedigung verlangen können. Dieses Recht steht den Gläubigern jedoch nur zu, wenn sie glaubhaft machen, dass durch die Verschmelzung die Erfüllung ihrer Forderung gefährdet wird."
    },
    {
      "date": "2025-12-18",
      "id": "140396",
      "original_text": "Registerbekanntmachung nach dem Umwandlungsgesetz\nBayern Amtsgericht München HRA 121141\nJulius Wiese e.K. – München",
      "type": "Registerbekanntmachung nach dem Umwandlungsgesetz",
      "state": "Bayern",
      "amtsgericht": "Amtsgericht München",
      "registernummer": "HRA 121141",
      "registerart": "HRA",
      "company_name": "Julius Wiese e.K.",
      "company_seat": "München",
      "details": "18.12.2025 (Bekanntmachungsdatum)\n\nBayern Amtsgericht München HRA 121141\nRegisterbekanntmachung nach dem Umwandlungsgesetz 17.12.2025 (Eintragungsdatum)\n\nJulius Wiese e.K.\nEinzelkaufmann / Einzelkauffrau\nMünchen\n\nDen Gläubigern der an der Ausgliederung beteiligten Rechtsträger ist, wenn sie binnen sechs Monaten nach dem Tag, an dem die Eintragung der Ausgliederung in das Register des Sitzes desjenigen Rechtsträgers, dessen Gläubiger sie sind, nach §§ 125, 19 Abs. 3 UmwG als bekannt gemacht gilt, ihren Anspruch nach Grund und Höhe in Textform anmelden, Sicherheit zu leisten, soweit sie nicht Befriedigung verlangen können. Dieses Recht steht den Gläubigern jedoch nur zu, wenn sie glaubhaft machen, dass durch die Ausgliederung die Erfüllung ihrer Forderung gefährdet wird."
    },
    {
      "date": "2025-12-18",
      "id": "140397",
      "original_text": "Einreichung neuer Dokumente\nBayern Amtsgericht Regensburg HRB 1055\nBundesbahn-Wohnungsbaugesellschaft Regensburg mbH – Regensburg",
      "type": "Einreichung neuer Dokumente",
      "state": "Bayern",
      "amtsgericht": "Amtsgericht Regensburg",
      "registernummer": "HRB 1055",
      "registerart": "HRB",
      "company_name": "Bundesbahn-Wohnungsbaugesellschaft Regensburg mbH",
      "company_seat": "Regensburg",
      "details": "18.12.2025 (Bekanntmachungsdatum)\n\nBayern Amtsgericht Regensburg HRB 1055\nEinreichung neuer Dokumente\n\nBundesbahn-Wohnungsbaugesellschaft Regensburg mbH\nGesellschaft mit beschränkter Haftung\nRegensburg\n\nDem Amtsgericht Regensburg -Registergericht- ist eine Liste der Mitglieder des Aufsichtsrats eingereicht worden, § 52 Abs. 3 S. 2 GmbHG."
    },
    {
      "date": "2025-12-18",
      "id": "140398",
      "original_text": "Löschungsankündigung\nBayern Amtsgericht Augsburg HRB 34930\nNew Wheels Order GmbH – Augsburg",
      "type": "Löschungsankündigung",
      "state": "Bayern",
      "amtsgericht": "Amtsgericht Augsburg",
      "registernummer": "HRB 34930",
      "registerart": "HRB",
      "company_name": "New Wheels Order GmbH",
      "company_seat": "Augsburg",
      "details": "18.12.2025 (Bekanntmachungsdatum)\n\nBayern Amtsgericht Augsburg HRB 34930\nLöschungsankündigung\n\nNew Wheels Order GmbH\nGesellschaft mit beschränkter Haftung\nAugsburg\n\nDas Registergericht beabsichtigt, die im Handelsregister eingetragene Gesellschaft wegen Vermögenslosigkeit von Amts wegen nach § 394 FamFG zu löschen. Die Frist zur Erhebung eines Widerspruchs ist auf einen Monat festgesetzt."
    },
    {
      "date": "2025-12-18",
      "id": "140399",
      "original_text": "Löschungsankündigung\nBayern Amtsgericht München HRB 261157\nTurboEGM GmbH – Grünwald",
      "type": "Löschungsankündigung",
      "state": "Bayern",
      "amtsgericht": "Amtsgericht München",
      "registernummer": "HRB 261157",
      "registerart": "HRB",
      "company_name": "TurboEGM GmbH",
      "company_seat": "Grünwald",
      "details": "18.12.2025 (Bekanntmachungsdatum)\n\nBayern Amtsgericht München HRB 261157\nLöschungsankündigung\n\nTurboEGM GmbH\nGesellschaft mit beschränkter Haftung\nGrünwald\n\nDas Registergericht beabsichtigt, die im Handelsregister eingetragene Gesellschaft wegen Vermögenslosigkeit von Amts wegen nach § 394 FamFG zu löschen. Die Frist zur Erhebung eines Widerspruchs ist auf drei Monate festgesetzt."
    },
    {
      "date": "2025-12-18",
      "id": "140400",
      "original_text": "Löschungsankündigung\nBayern Amtsgericht Traunstein HRB 14937\nBewachungsservice Rosenheim GmbH - BSR – Rosenheim",
      "type": "Löschungsankündigung",
      "state": "Bayern",
      "amtsgericht": "Amtsgericht Traunstein",
      "registernummer": "HRB 14937",
      "registerart": "HRB",
      "company_name": "Bewachungsservice Rosenheim GmbH - BSR",
      "company_seat": "Rosenheim",
      "details": "18.12.2025 (Bekanntmachungsdatum)\n\nBayern Amtsgericht Traunstein HRB 14937\nLöschungsankündigung\n\nBewachungsservice Rosenheim GmbH - BSR\nGesellschaft mit beschränkter Haftung\nRosenheim\n\nDas Registergericht beabsichtigt, die im Handelsregister eingetragene Gesellschaft wegen Vermögenslosigkeit von Amts wegen nach § 394 FamFG zu löschen. Die Frist zur Erhebung eines Widerspruchs ist auf einen Monat festgesetzt."
    },
    {
      "date": "2025-12-18",
      "id": "140401",
      "original_text": "Sonstige Registerbekanntmachung\nBayern Amtsgericht Nürnberg HRB 2288\nMartha-Maria Krankenhaus gemeinnützige GmbH – Nürnberg",
      "type": "Sonstige Registerbekanntmachung",
      "state": "Bayern",
      "amtsgericht": "Amtsgericht Nürnberg",
      "registernummer": "HRB 2288",
      "registerart": "HRB",
      "company_name": "Martha-Maria Krankenhaus gemeinnützige GmbH",
      "company_seat": "Nürnberg",
      "details": "18.12.2025 (Bekanntmachungsdatum)\n\nBayern Amtsgericht Nürnberg HRB 2288\nSonstige Registerbekanntmachung\n\nMartha-Maria Krankenhaus gemeinnützige GmbH\nGesellschaft mit beschränkter Haftung\nNürnberg\n\nDem Amtsgericht Nürnberg -Registergericht- ist eine Liste der Mitglieder des Aufsichtsrats eingereicht worden, § 52 Abs. 3 S. 2 GmbHG."
    },
    {
      "date": "2025-12-18",
      "id": "140402",
      "original_text": "Einreichung neuer Dokumente\nBayern Amtsgericht Nürnberg HRB 36438\nMartha-Maria MVZ Süd gemeinnützige GmbH – Nürnberg",
      "type": "Einreichung neuer Dokumente",
      "state": "Bayern",
      "amtsgericht": "Amtsgericht Nürnberg",
      "registernummer": "HRB 36438",
      "registerart": "HRB",
      "company_name": "Martha-Maria MVZ Süd gemeinnützige GmbH",
      "company_seat": "Nürnberg",
      "details": "18.12.2025 (Bekanntmachungsdatum)\n\nBayern Amtsgericht Nürnberg HRB 36438\nEinreichung neuer Dokumente\n\nMartha-Maria MVZ Süd gemeinnützige GmbH\nGesellschaft mit beschränkter Haftung\nNürnberg\n\nDem Amtsgericht Nürnberg -Registergericht- ist eine Liste der Mitglieder des Aufsichtsrats eingereicht worden, § 52 Abs. 3 S. 2 GmbHG."
    },
    {
      "date": "2025-12-18",
      "id": "140403",
      "original_text": "Registerbekanntmachung nach dem Umwandlungsgesetz\nBayern Amtsgericht Fürth HRB 17525\nPeter Family Office Objekt 8 GmbH – Fürth",
      "type": "Registerbekanntmachung nach dem Umwandlungsgesetz",
      "state": "Bayern",
      "amtsgericht": "Amtsgericht Fürth",
      "registernummer": "HRB 17525",
      "registerart": "HRB",
      "company_name": "Peter Family Office Objekt 8 GmbH",
      "company_seat": "Fürth",
      "details": "18.12.2025 (Bekanntmachungsdatum)\n\nBayern Amtsgericht Fürth HRB 17525\nRegisterbekanntmachung nach dem Umwandlungsgesetz 17.12.2025 (Eintragungsdatum)\n\nPeter Family Office Objekt 8 GmbH\nGesellschaft mit beschränkter Haftung\nFürth\n\nDen Gläubigern der an der Verschmelzung beteiligten Rechtsträger ist, wenn sie binnen sechs Monaten nach dem Tag, an dem die Eintragung der Verschmelzung in das Register des Sitzes desjenigen Rechtsträgers, dessen Gläubiger sie sind, nach § 19 Abs. 3 UmwG als bekannt gemacht gilt, ihren Anspruch nach Grund und Höhe in Textform anmelden, Sicherheit zu leisten, soweit sie nicht Befriedigung verlangen können. Dieses Recht steht den Gläubigern jedoch nur zu, wenn sie glaubhaft machen, dass durch die Verschmelzung die Erfüllung ihrer Forderung gefährdet wird."
    },
    {
      "date": "2025-12-18",
      "id": "140404",
      "original_text": "Einreichung neuer Dokumente\nBerlin Amtsgericht Berlin (Charlottenburg) HRB 70764\nBundesdruckerei GmbH – Berlin",
      "type": "Einreichung neuer Dokumente",
      "state": "Berlin",
      "amtsgericht": "Amtsgericht Berlin (Charlottenburg)",
      "registernummer": "HRB 70764",
      "registerart": "HRB",
      "company_name": "Bundesdruckerei GmbH",
      "company_seat": "Berlin",
      "details": "18.12.2025 (Bekanntmachungsdatum)\n\nBerlin Amtsgericht Berlin (Charlottenburg) HRB 70764\nEinreichung neuer Dokumente\n\nBundesdruckerei GmbH\nGesellschaft mit beschränkter Haftung\nBerlin\n\nAls nicht eingetragen wird veröffentlicht: Es wurde eine neue Liste der Aufsichtsratsmitglieder eingereicht (§52 GmbHG)."
    },
    {
      "date": "2025-12-18",
      "id": "140405",
      "original_text": "Registerbekanntmachung nach dem Umwandlungsgesetz\nBaden-Württemberg Amtsgericht Mannheim HRB 746278\nBlitz F22-113 GmbH – Karlsruhe",
      "type": "Registerbekanntmachung nach dem Umwandlungsgesetz",
      "state": "Baden-Württemberg",
      "amtsgericht": "Amtsgericht Mannheim",
      "registernummer": "HRB 746278",
      "registerart": "HRB",
      "company_name": "Blitz F22-113 GmbH",
      "company_seat": "Karlsruhe",
      "details": "18.12.2025 (Bekanntmachungsdatum)\n\nBaden-Württemberg Amtsgericht Mannheim HRB 746278\nRegisterbekanntmachung nach dem Umwandlungsgesetz 18.12.2025 (Eintragungsdatum)\n\nBlitz F22-113 GmbH\nGesellschaft mit beschränkter Haftung\nKarlsruhe\n\nAls nicht eingetragen wird bekanntgemacht: Den Gläubigern der an der Verschmelzung beteiligten Rechtsträger ist, wenn sie binnen sechs Monaten nach dem Tag, an dem die Eintragung der Verschmelzung in das Register des Sitzes desjenigen Rechtsträgers, dessen Gläubiger sie sind, nach § 19 Abs. 3 UmwG als bekanntgemacht gilt, ihren Anspruch nach Grund und Höhe schriftlich anmelden, Sicherheit zu leisten, soweit sie nicht Befriedigung verlangen können. Dieses Recht steht den Gläubigern jedoch nur zu, wenn sie glaubhaft machen, dass durch die Verschmelzung die Erfüllung ihrer Forderung gefährdet wird."
    },
    {
      "date": "2025-12-18",
      "id": "140406",
      "original_text": "Registerbekanntmachung nach dem Umwandlungsgesetz\nBaden-Württemberg Amtsgericht Mannheim HRB 108535\nAsseco Solutions AG – Karlsruhe",
      "type": "Registerbekanntmachung nach dem Umwandlungsgesetz",
      "state": "Baden-Württemberg",
      "amtsgericht": "Amtsgericht Mannheim",
      "registernummer": "HRB 108535",
      "registerart": "HRB",
      "company_name": "Asseco Solutions AG",
      "company_seat": "Karlsruhe",
      "details": "18.12.2025 (Bekanntmachungsdatum)\n\nBaden-Württemberg Amtsgericht Mannheim HRB 108535\nRegisterbekanntmachung nach dem Umwandlungsgesetz 18.12.2025 (Eintragungsdatum)\n\nAsseco Solutions AG\nAktiengesellschaft\nKarlsruhe\n\nAls nicht eingetragen wird bekanntgemacht: Den Gläubigern der an der Verschmelzung beteiligten Rechtsträger ist, wenn sie binnen sechs Monaten nach dem Tag, an dem die Eintragung der Verschmelzung in das Register des Sitzes desjenigen Rechtsträgers, dessen Gläubiger sie sind, nach § 19 Abs. 3 UmwG als bekanntgemacht gilt, ihren Anspruch nach Grund und Höhe schriftlich anmelden, Sicherheit zu leisten, soweit sie nicht Befriedigung verlangen können. Dieses Recht steht den Gläubigern jedoch nur zu, wenn sie glaubhaft machen, dass durch die Verschmelzung die Erfüllung ihrer Forderung gefährdet wird."
    },
    {
      "date": "2025-12-18",
      "id": "140407",
      "original_text": "Löschungsankündigung\nBaden-Württemberg Amtsgericht Stuttgart HRB 212998\nRohr Profi GmbH Rohrreinigungs-Service – Waiblingen",
      "type": "Löschungsankündigung",
      "state": "Baden-Württemberg",
      "amtsgericht": "Amtsgericht Stuttgart",
      "registernummer": "HRB 212998",
      "registerart": "HRB",
      "company_name": "Rohr Profi GmbH Rohrreinigungs-Service",
      "company_seat": "Waiblingen",
      "details": "18.12.2025 (Bekanntmachungsdatum)\n\nBaden-Württemberg Amtsgericht Stuttgart HRB 212998\nLöschungsankündigung\n\nRohr Profi GmbH Rohrreinigungs-Service\nGesellschaft mit beschränkter Haftung\nWaiblingen\n\nAls nicht eingetragen wird bekanntgemacht:\nDas Gericht beabsichtigt, die Gesellschaft wegen Vermögenslosigkeit im Handelsregister von Amts wegen nach § 394 FamFG zu löschen. Die Frist zur Geltendmachung eines Widerspruchs gegen die beabsichtigte Löschung ist auf zwei Monate ab Veröffentlichung bestimmt."
    },
    {
      "date": "2025-12-18",
      "id": "140408",
      "original_text": "Löschungsankündigung\nBaden-Württemberg Amtsgericht Mannheim HRB 709477\nwalter services Abwicklungsgesellschaft Ettlingen GmbH – Ettlingen",
      "type": "Löschungsankündigung",
      "state": "Baden-Württemberg",
      "amtsgericht": "Amtsgericht Mannheim",
      "registernummer": "HRB 709477",
      "registerart": "HRB",
      "company_name": "walter services Abwicklungsgesellschaft Ettlingen GmbH",
      "company_seat": "Ettlingen",
      "details": "18.12.2025 (Bekanntmachungsdatum)\n\nBaden-Württemberg Amtsgericht Mannheim HRB 709477\nLöschungsankündigung\n\nwalter services Abwicklungsgesellschaft Ettlingen GmbH\nGesellschaft mit beschränkter Haftung\nEttlingen\n\nDas Gericht beabsichtigt, die Gesellschaft wegen Vermögenslosigkeit im Handelsregister von Amts wegen nach § 394 FamFG zu löschen. Die Frist zur Geltendmachung eines Widerspruchs gegen die beabsichtigte Löschung ist auf einen Monat ab Veröffentlichung bestimmt."
    },
    {
      "date": "2025-12-18",
      "id": "140409",
      "original_text": "Löschungsankündigung\nBaden-Württemberg Amtsgericht Ulm HRB 726486\nEDO Transport GmbH – Crailsheim",
      "type": "Löschungsankündigung",
      "state": "Baden-Württemberg",
      "amtsgericht": "Amtsgericht Ulm",
      "registernummer": "HRB 726486",
      "registerart": "HRB",
      "company_name": "EDO Transport GmbH",
      "company_seat": "Crailsheim",
      "details": "18.12.2025 (Bekanntmachungsdatum)\n\nBaden-Württemberg Amtsgericht Ulm HRB 726486\nLöschungsankündigung\n\nEDO Transport GmbH\nGesellschaft mit beschränkter Haftung\nCrailsheim\n\nDas Gericht beabsichtigt, die Gesellschaft wegen Vermögenslosigkeit im Handelsregister von Amts wegen nach § 394 FamFG zu löschen. Die Frist zur Geltendmachung eines Widerspruchs gegen die beabsichtigte Löschung ist auf  einen Monat ab Veröffentlichung bestimmt."
    },
    {
      "date": "2025-12-18",
      "id": "140410",
      "original_text": "Sonstige Registerbekanntmachung\nMecklenburg-Vorpommern Amtsgericht Schwerin HRB 14490\nBIOCEN Management AG – Wismar",
      "type": "Sonstige Registerbekanntmachung",
      "state": "Mecklenburg-Vorpommern",
      "amtsgericht": "Amtsgericht Schwerin",
      "registernummer": "HRB 14490",
      "registerart": "HRB",
      "company_name": "BIOCEN Management AG",
      "company_seat": "Wismar",
      "details": "18.12.2025 (Bekanntmachungsdatum)\n\nMecklenburg-Vorpommern Amtsgericht Schwerin HRB 14490\nSonstige Registerbekanntmachung 01.12.2025 (Eintragungsdatum)\n\nBIOCEN Management AG\nAktiengesellschaft\nWismar\n\nEine Liste der Mitglieder des Aufsichtsrats ist zum Handelsregister eingereicht worden."
    },
    {
      "date": "2025-12-18",
      "id": "140411",
      "original_text": "Registerbekanntmachung nach dem Umwandlungsgesetz\nSchleswig-Holstein Amtsgericht Kiel HRA 12912\nrt Steuer + Recht GmbH & Co. KG Rechtsanwaltsgesellschaft Steuerberatungsgesellschaft – Kiel",
      "type": "Registerbekanntmachung nach dem Umwandlungsgesetz",
      "state": "Schleswig-Holstein",
      "amtsgericht": "Amtsgericht Kiel",
      "registernummer": "HRA 12912",
      "registerart": "HRA",
      "company_name": "rt Steuer + Recht GmbH & Co. KG Rechtsanwaltsgesellschaft Steuerberatungsgesellschaft",
      "company_seat": "Kiel",
      "details": "18.12.2025 (Bekanntmachungsdatum)\n\nSchleswig-Holstein Amtsgericht Kiel HRA 12912\nRegisterbekanntmachung nach dem Umwandlungsgesetz 17.12.2025 (Eintragungsdatum)\n\nrt Steuer + Recht GmbH & Co. KG Rechtsanwaltsgesellschaft Steuerberatungsgesellschaft\nKommanditgesellschaft\nKiel\n\nZu Eintragungsnummer 2 vom 17.12.2025 wird als nicht eingetragen veröffentlicht: Den Gläubigern ist, wenn sie binnen sechs Monaten nach dem Tag, an dem die Eintragung der Umwandlung bekannt gemacht worden ist, ihren Anspruch nach Grund und Höhe schriftlich anmelden, Sicherheit zu leisten, soweit sie nicht Befriedigung verlangen können. Dieses Recht steht den Gläubigern jedoch nur zu, wenn sie glaubhaft machen, dass durch die Umwandlung die Erfüllung ihrer Forderung gefährdet wird."
    },
    {
      "date": "2025-12-18",
      "id": "140412",
      "original_text": "Einreichung neuer Dokumente\nSchleswig-Holstein Amtsgericht Kiel HRB 25168\nUNIBERG Group AG – Bebensee",
      "type": "Einreichung neuer Dokumente",
      "state": "Schleswig-Holstein",
      "amtsgericht": "Amtsgericht Kiel",
      "registernummer": "HRB 25168",
      "registerart": "HRB",
      "company_name": "UNIBERG Group AG",
      "company_seat": "Bebensee",
      "details": "18.12.2025 (Bekanntmachungsdatum)\n\nSchleswig-Holstein Amtsgericht Kiel HRB 25168\nEinreichung neuer Dokumente\n\nUNIBERG Group AG\nAktiengesellschaft\nBebensee\n\nAls nicht eingetragen wird veröffentlicht:Eine neue Liste der Aufsichtsratsmitglieder ist eingereicht worden."
    },
    {
      "date": "2025-12-18",
      "id": "140413",
      "original_text": "Registerbekanntmachung nach dem Umwandlungsgesetz\nBaden-Württemberg Amtsgericht Ulm HRB 640074\nReger & Schulz Gesellschaft mit beschränkter Haftung – Biberach an der Riß",
      "type": "Registerbekanntmachung nach dem Umwandlungsgesetz",
      "state": "Baden-Württemberg",
      "amtsgericht": "Amtsgericht Ulm",
      "registernummer": "HRB 640074",
      "registerart": "HRB",
      "company_name": "Reger & Schulz Gesellschaft mit beschränkter Haftung",
      "company_seat": "Biberach an der Riß",
      "details": "18.12.2025 (Bekanntmachungsdatum)\n\nBaden-Württemberg Amtsgericht Ulm HRB 640074\nRegisterbekanntmachung nach dem Umwandlungsgesetz 18.12.2025 (Eintragungsdatum)\n\nReger & Schulz Gesellschaft mit beschränkter Haftung\nGesellschaft mit beschränkter Haftung\nBiberach an der Riß\n\nAls nicht eingetragen wird bekanntgemacht:\nDen Gläubigern der an der Verschmelzung beteiligten Rechtsträger ist, wenn sie binnen sechs Monaten nach dem Tag, an dem die Eintragung der Verschmelzung in das Register des Sitzes desjenigen Rechtsträgers, dessen Gläubiger sie sind, nach § 19 Abs. 3 UmwG als bekanntgemacht gilt, ihren Anspruch nach Grund und Höhe schriftlich anmelden, Sicherheit zu leisten, soweit sie nicht Befriedigung verlangen können. Dieses Recht steht den Gläubigern jedoch nur zu, wenn sie glaubhaft machen, dass durch die Verschmelzung die Erfüllung ihrer Forderung gefährdet wird."
    },
    {
      "date": "2025-12-18",
      "id": "140414",
      "original_text": "Registerbekanntmachung nach dem Umwandlungsgesetz\nSachsen-Anhalt Amtsgericht Stendal HRB 26344\nVKK Standardkessel Köthen GmbH – Köthen (Anhalt)",
      "type": "Registerbekanntmachung nach dem Umwandlungsgesetz",
      "state": "Sachsen-Anhalt",
      "amtsgericht": "Amtsgericht Stendal",
      "registernummer": "HRB 26344",
      "registerart": "HRB",
      "company_name": "VKK Standardkessel Köthen GmbH",
      "company_seat": "Köthen (Anhalt)",
      "details": "18.12.2025 (Bekanntmachungsdatum)\n\nSachsen-Anhalt Amtsgericht Stendal HRB 26344\nRegisterbekanntmachung nach dem Umwandlungsgesetz 18.12.2025 (Eintragungsdatum)\n\nVKK Standardkessel Köthen GmbH\nGesellschaft mit beschränkter Haftung\nKöthen (Anhalt)\n\nNicht eingetragen:\nDen Gläubigern der an der Verschmelzung beteiligten Rechtsträger ist, wenn sie binnen sechs Monaten nach dem Tag, an dem die Eintragung der Verschmelzung nach § 19 Abs. 3 UmwG als bekanntgemacht gilt, ihren Anspruch nach Grund und Höhe schriftlich anmelden, Sicherheit zu leisten, soweit sie nicht Befriedigung verlangen können. Dieses Recht steht ihnen jedoch nur zu, wenn sie glaubhaft machen, dass durch die Verschmelzung die Erfüllung ihrer Forderung gefährdet wird."
    },
    {
      "date": "2025-12-18",
      "id": "140415",
      "original_text": "Registerbekanntmachung nach dem Umwandlungsgesetz\nSachsen-Anhalt Amtsgericht Stendal HRB 26459\nVKK Standardkessel Service Köthen GmbH – Köthen (Anhalt)",
      "type": "Registerbekanntmachung nach dem Umwandlungsgesetz",
      "state": "Sachsen-Anhalt",
      "amtsgericht": "Amtsgericht Stendal",
      "registernummer": "HRB 26459",
      "registerart": "HRB",
      "company_name": "VKK Standardkessel Service Köthen GmbH",
      "company_seat": "Köthen (Anhalt)",
      "details": "18.12.2025 (Bekanntmachungsdatum)\n\nSachsen-Anhalt Amtsgericht Stendal HRB 26459\nRegisterbekanntmachung nach dem Umwandlungsgesetz 18.12.2025 (Eintragungsdatum)\n\nVKK Standardkessel Service Köthen GmbH\nGesellschaft mit beschränkter Haftung\nKöthen (Anhalt)\n\nNicht eingetragen:\nDen Gläubigern der an der Verschmelzung beteiligten Rechtsträger ist, wenn sie binnen sechs Monaten nach dem Tag, an dem die Eintragung der Verschmelzung nach § 19 Abs. 3 UmwG als bekanntgemacht gilt, ihren Anspruch nach Grund und Höhe schriftlich anmelden, Sicherheit zu leisten, soweit sie nicht Befriedigung verlangen können. Dieses Recht steht ihnen jedoch nur zu, wenn sie glaubhaft machen, dass durch die Verschmelzung die Erfüllung ihrer Forderung gefährdet wird."
    },
    {
      "date": "2025-12-18",
      "id": "140416",
      "original_text": "Einreichung neuer Dokumente\nBaden-Württemberg Amtsgericht Freiburg HRB 47\nImmobilien- und Verwaltungsgesellschaft mit beschränkter Haftung – Freiburg im Breisgau",
      "type": "Einreichung neuer Dokumente",
      "state": "Baden-Württemberg",
      "amtsgericht": "Amtsgericht Freiburg",
      "registernummer": "HRB 47",
      "registerart": "HRB",
      "company_name": "Immobilien- und Verwaltungsgesellschaft mit beschränkter Haftung",
      "company_seat": "Freiburg im Breisgau",
      "details": "18.12.2025 (Bekanntmachungsdatum)\n\nBaden-Württemberg Amtsgericht Freiburg HRB 47\nEinreichung neuer Dokumente 18.12.2025 (Eintragungsdatum)\n\nImmobilien- und Verwaltungsgesellschaft mit beschränkter Haftung\nGesellschaft mit beschränkter Haftung\nFreiburg im Breisgau\n\nAls nicht eingetragen wird bekanntgemacht:\nDie Gesellschaft hat am 17.12.2025 die Liste über die Zusammensetzung des Aufsichtsrats zum Handelsregister eingereicht."
    },
    {
      "date": "2025-12-18",
      "id": "140417",
      "original_text": "Löschungsankündigung\nBerlin Amtsgericht Berlin (Charlottenburg) HRB 193377\nExclusive Cars Dytman GmbH – Berlin",
      "type": "Löschungsankündigung",
      "state": "Berlin",
      "amtsgericht": "Amtsgericht Berlin (Charlottenburg)",
      "registernummer": "HRB 193377",
      "registerart": "HRB",
      "company_name": "Exclusive Cars Dytman GmbH",
      "company_seat": "Berlin",
      "details": "18.12.2025 (Bekanntmachungsdatum)\n\nBerlin Amtsgericht Berlin (Charlottenburg) HRB 193377\nLöschungsankündigung\n\nExclusive Cars Dytman GmbH\nGesellschaft mit beschränkter Haftung\nBerlin\n\nBei der nachstehenden Gesellschaft wird das Amtslöschungsverfahren gemäß § 394 FamFG eingeleitet. Widerspruchsfrist 6 Wochen"
    },
    {
      "date": "2025-12-18",
      "id": "140418",
      "original_text": "Löschungsankündigung\nBaden-Württemberg Amtsgericht Stuttgart HRB 771449\nGTC-Hightech GmbH – Stuttgart",
      "type": "Löschungsankündigung",
      "state": "Baden-Württemberg",
      "amtsgericht": "Amtsgericht Stuttgart",
      "registernummer": "HRB 771449",
      "registerart": "HRB",
      "company_name": "GTC-Hightech GmbH",
      "company_seat": "Stuttgart",
      "details": "18.12.2025 (Bekanntmachungsdatum)\n\nBaden-Württemberg Amtsgericht Stuttgart HRB 771449\nLöschungsankündigung\n\nGTC-Hightech GmbH\nGesellschaft mit beschränkter Haftung\nStuttgart\n\nDas Gericht beabsichtigt, die Gesellschaft wegen Vermögenslosigkeit im Handelsregister von Amts wegen nach § 394 FamFG zu löschen. Die Frist zur Geltendmachung eines Widerspruchs gegen die beabsichtigte Löschung ist auf zwei Monate ab Veröffentlichung bestimmt."
    },
    {
      "date": "2025-12-18",
      "id": "140419",
      "original_text": "Löschungsankündigung\nBerlin Amtsgericht Berlin (Charlottenburg) HRB 155214\nSMG Holding GmbH – Berlin",
      "type": "Löschungsankündigung",
      "state": "Berlin",
      "amtsgericht": "Amtsgericht Berlin (Charlottenburg)",
      "registernummer": "HRB 155214",
      "registerart": "HRB",
      "company_name": "SMG Holding GmbH",
      "company_seat": "Berlin",
      "details": "18.12.2025 (Bekanntmachungsdatum)\n\nBerlin Amtsgericht Berlin (Charlottenburg) HRB 155214\nLöschungsankündigung\n\nSMG Holding GmbH\nGesellschaft mit beschränkter Haftung\nBerlin\n\nBei der nachstehenden Gesellschaft wird das Amtslöschungsverfahren gemäß § 394 FamFG eingeleitet. Widerspruchsfrist 6 Wochen"
    },
    {
      "date": "2025-12-18",
      "id": "140420",
      "original_text": "Löschungsankündigung\nSchleswig-Holstein Amtsgericht Lübeck HRB 26346\nMBT Gesellschaft für innovatives Bauen mbH – Lübeck",
      "type": "Löschungsankündigung",
      "state": "Schleswig-Holstein",
      "amtsgericht": "Amtsgericht Lübeck",
      "registernummer": "HRB 26346",
      "registerart": "HRB",
      "company_name": "MBT Gesellschaft für innovatives Bauen mbH",
      "company_seat": "Lübeck",
      "details": "18.12.2025 (Bekanntmachungsdatum)\n\nSchleswig-Holstein Amtsgericht Lübeck HRB 26346\nLöschungsankündigung\n\nMBT Gesellschaft für innovatives Bauen mbH\nGesellschaft mit beschränkter Haftung\nLübeck\n\nEs ist die Löschung der nachstehenden Gesellschaft wegen Vermögenslosigkeit gemäß § 394 FamFG beabsichtigt. Widerspruchsfrist: 1 Monat."
    },
    {
      "date": "2025-12-18",
      "id": "140421",
      "original_text": "Registerbekanntmachung nach dem Umwandlungsgesetz\nBaden-Württemberg Amtsgericht Stuttgart HRB 802402\nDATAPART HoldCo GmbH – Ludwigsburg",
      "type": "Registerbekanntmachung nach dem Umwandlungsgesetz",
      "state": "Baden-Württemberg",
      "amtsgericht": "Amtsgericht Stuttgart",
      "registernummer": "HRB 802402",
      "registerart": "HRB",
      "company_name": "DATAPART HoldCo GmbH",
      "company_seat": "Ludwigsburg",
      "details": "18.12.2025 (Bekanntmachungsdatum)\n\nBaden-Württemberg Amtsgericht Stuttgart HRB 802402\nRegisterbekanntmachung nach dem Umwandlungsgesetz 18.12.2025 (Eintragungsdatum)\n\nDATAPART HoldCo GmbH\nGesellschaft mit beschränkter Haftung\nLudwigsburg\n\nDen Gläubigern der an der Verschmelzung beteiligten Rechtsträger ist, wenn sie binnen sechs Monaten nach dem Tag, an dem die Eintragung der Verschmelzung in das Register des Sitzes desjenigen Rechtsträgers, dessen Gläubiger sie sind, nach § 19 Abs. 3 UmwG als bekanntgemacht gilt, ihren Anspruch nach Grund und Höhe schriftlich anmelden, Sicherheit zu leisten, soweit sie nicht Befriedigung verlangen können. Dieses Recht steht den Gläubigern jedoch nur zu, wenn sie glaubhaft machen, dass durch die Verschmelzung die Erfüllung ihrer Forderung gefährdet wird."
    },
    {
      "date": "2025-12-18",
      "id": "140422",
      "original_text": "Registerbekanntmachung nach dem Umwandlungsgesetz\nNordrhein-Westfalen Amtsgericht Coesfeld VR 2603\nFreizeitanlage Aa-See Bocholt e. V. – Bocholt",
      "type": "Registerbekanntmachung nach dem Umwandlungsgesetz",
      "state": "Nordrhein-Westfalen",
      "amtsgericht": "Amtsgericht Coesfeld",
      "registernummer": "VR 2603",
      "registerart": "VR",
      "company_name": "Freizeitanlage Aa-See Bocholt e. V.",
      "company_seat": "Bocholt",
      "details": "18.12.2025 (Bekanntmachungsdatum)\n\nNordrhein-Westfalen Amtsgericht Coesfeld VR 2603\nRegisterbekanntmachung nach dem Umwandlungsgesetz 18.12.2025 (Eintragungsdatum)\n\nFreizeitanlage Aa-See Bocholt e. V.\neingetragener Verein\nBocholt\n\nDen Gläubigern der an der Verschmelzung beteiligten Rechtsträger ist, wenn sie binnen sechs Monaten nach dem Tag, an dem die Eintragung der Verschmelzung in das Register des Sitzes desjenigen Rechtsträgers, dessen Gläubiger sie sind, nach § 19 Absatz 3 UmwG als bekanntgemacht gilt, ihren Anspruch nach Grund und Höhe schriftlich anmelden, Sicherheit zu leisten, soweit sie nicht Befriedigung verlangen können. Dieses Recht steht den Gläubigern jedoch nur zu, wenn sie glaubhaft machen, dass durch die Verschmelzung die Erfüllung ihrer Forderung gefährdet wird."
    },
    {
      "date": "2025-12-18",
      "id": "140423",
      "original_text": "Registerbekanntmachung nach dem Umwandlungsgesetz\nHamburg Amtsgericht Hamburg HRB 181011\nRyan Specialty Europe GmbH – Hamburg",
      "type": "Registerbekanntmachung nach dem Umwandlungsgesetz",
      "state": "Hamburg",
      "amtsgericht": "Amtsgericht Hamburg",
      "registernummer": "HRB 181011",
      "registerart": "HRB",
      "company_name": "Ryan Specialty Europe GmbH",
      "company_seat": "Hamburg",
      "details": "18.12.2025 (Bekanntmachungsdatum)\n\nHamburg Amtsgericht Hamburg HRB 181011\nRegisterbekanntmachung nach dem Umwandlungsgesetz 09.12.2025 (Eintragungsdatum)\n\nRyan Specialty Europe GmbH\nGesellschaft mit beschränkter Haftung\nHamburg\n\nAls nicht eingetragen wird bekannt gemacht:\nDen Gläubigern der an der grenzüberschreitenden Verschmelzung beteiligten übernehmenden Rechtsträger ist, wenn sie binnen sechs Monaten nach dem Tag, an dem die Eintragung der Verschmelzung in das Register des Sitzes desjenigen Rechtsträgers, dessen Gläubiger sie sind, nach § 19 Absatz 3 UmwG als bekanntgemacht gilt, ihren Anspruch nach Grund und Höhe schriftlich anmelden, Sicherheit zu leisten, soweit sie nicht Befriedigung verlangen können.\nDieses Recht steht den Gläubigern jedoch nur zu, wenn sie glaubhaft machen, dass durch die Verschmelzung die Erfüllung ihrer Forderung gefährdet wird."
    },
    {
      "date": "2025-12-18",
      "id": "140424",
      "original_text": "Registerbekanntmachung nach dem Umwandlungsgesetz\nHamburg Amtsgericht Hamburg HRB 181011\nRyan Specialty Europe GmbH – Hamburg",
      "type": "Registerbekanntmachung nach dem Umwandlungsgesetz",
      "state": "Hamburg",
      "amtsgericht": "Amtsgericht Hamburg",
      "registernummer": "HRB 181011",
      "registerart": "HRB",
      "company_name": "Ryan Specialty Europe GmbH",
      "company_seat": "Hamburg",
      "details": "18.12.2025 (Bekanntmachungsdatum)\n\nHamburg Amtsgericht Hamburg HRB 181011\nRegisterbekanntmachung nach dem Umwandlungsgesetz 09.12.2025 (Eintragungsdatum)\n\nRyan Specialty Europe GmbH\nGesellschaft mit beschränkter Haftung\nHamburg\n\nAls nicht eingetragen wird bekannt gemacht:\nDen Gläubigern der an der grenzüberschreitenden Verschmelzung beteiligten übernehmenden Rechtsträger ist, wenn sie binnen sechs Monaten nach dem Tag, an dem die Eintragung der Verschmelzung in das Register des Sitzes desjenigen Rechtsträgers, dessen Gläubiger sie sind, nach § 19 Absatz 3 UmwG als bekanntgemacht gilt, ihren Anspruch nach Grund und Höhe schriftlich anmelden, Sicherheit zu leisten, soweit sie nicht Befriedigung verlangen können.\nDieses Recht steht den Gläubigern jedoch nur zu, wenn sie glaubhaft machen, dass durch die Verschmelzung die Erfüllung ihrer Forderung gefährdet wird."
    },
    {
      "date": "2025-12-18",
      "id": "140425",
      "original_text": "Löschungsankündigung\nMecklenburg-Vorpommern Amtsgericht Stralsund HRB 20613\nBringer & Springer GmbH – Stralsund",
      "type": "Löschungsankündigung",
      "state": "Mecklenburg-Vorpommern",
      "amtsgericht": "Amtsgericht Stralsund",
      "registernummer": "HRB 20613",
      "registerart": "HRB",
      "company_name": "Bringer & Springer GmbH",
      "company_seat": "Stralsund",
      "details": "18.12.2025 (Bekanntmachungsdatum)\n\nMecklenburg-Vorpommern Amtsgericht Stralsund HRB 20613\nLöschungsankündigung\n\nBringer & Springer GmbH\nGesellschaft mit beschränkter Haftung\nStralsund\n\nDas Registergericht beabsichtigt, die Firma von Amts wegen nach § 394 FamFG zu löschen. Die Frist zur Erhebung eines Widerspruchs ist auf 1 Monat festgesetzt."
    },
    {
      "date": "2025-12-18",
      "id": "140426",
      "original_text": "Löschungsankündigung\nThüringen Amtsgericht Jena HRB 509027\nAutohaus Guri Verwaltungs-GmbH – Zella-Mehlis",
      "type": "Löschungsankündigung",
      "state": "Thüringen",
      "amtsgericht": "Amtsgericht Jena",
      "registernummer": "HRB 509027",
      "registerart": "HRB",
      "company_name": "Autohaus Guri Verwaltungs-GmbH",
      "company_seat": "Zella-Mehlis",
      "details": "18.12.2025 (Bekanntmachungsdatum)\n\nThüringen Amtsgericht Jena HRB 509027\nLöschungsankündigung\n\nAutohaus Guri Verwaltungs-GmbH\nGesellschaft mit beschränkter Haftung\nZella-Mehlis\n\nDas Registergericht beabsichtigt, die im Handelsregister eingetragene Gesellschaft wegen Vermögenslosigkeit nach § 394 FamFG von Amts wegen zu löschen. Die Frist zur Erhebung eines Widerspruchs gegen die beabsichtigte Löschung wird auf 6 Wochen festgesetzt."
    },
    {
      "date": "2025-12-18",
      "id": "140427",
      "original_text": "Sonstige Registerbekanntmachung\nBaden-Württemberg Amtsgericht Ulm HRB 630206\nZF Friedrichshafen AG – Friedrichshafen",
      "type": "Sonstige Registerbekanntmachung",
      "state": "Baden-Württemberg",
      "amtsgericht": "Amtsgericht Ulm",
      "registernummer": "HRB 630206",
      "registerart": "HRB",
      "company_name": "ZF Friedrichshafen AG",
      "company_seat": "Friedrichshafen",
      "details": "18.12.2025 (Bekanntmachungsdatum)\n\nBaden-Württemberg Amtsgericht Ulm HRB 630206\nSonstige Registerbekanntmachung\n\nZF Friedrichshafen AG\nAktiengesellschaft\nFriedrichshafen\n\nDie Gesellschaft hat am 17.12.2025 die Liste über die Zusammensetzung des Aufsichtsrats zum Handelsregister eingereicht."
    },
    {
      "date": "2025-12-18",
      "id": "140428",
      "original_text": "Registerbekanntmachung nach dem Umwandlungsgesetz\nNordrhein-Westfalen Amtsgericht Coesfeld VR 2758\nJugendhilfe und soziale Integration (jusina) e. V. – Bocholt",
      "type": "Registerbekanntmachung nach dem Umwandlungsgesetz",
      "state": "Nordrhein-Westfalen",
      "amtsgericht": "Amtsgericht Coesfeld",
      "registernummer": "VR 2758",
      "registerart": "VR",
      "company_name": "Jugendhilfe und soziale Integration (jusina) e. V.",
      "company_seat": "Bocholt",
      "details": "18.12.2025 (Bekanntmachungsdatum)\n\nNordrhein-Westfalen Amtsgericht Coesfeld VR 2758\nRegisterbekanntmachung nach dem Umwandlungsgesetz 18.12.2025 (Eintragungsdatum)\n\nJugendhilfe und soziale Integration (jusina) e. V.\neingetragener Verein\nBocholt\n\nDen Gläubigern der an der Verschmelzung beteiligten Rechtsträger ist, wenn sie binnen sechs Monaten nach dem Tag, an dem die Eintragung der Verschmelzung in das Register des Sitzes derjenigen Rechtsträger deren Gläubiger sie sind, nach § 19 Absatz 3 UmwG als bekanntgemacht gilt, ihren Anspruch nach Grund und Höhe schriftlich anmelden, Sicherheit zu leisten, soweit sie nicht Befriedigung verlangen können. Dieses Recht steht den Gläubigern jedoch nur zu, wenn sie glaubhaft machen, dass durch die Verschmelzung die Erfüllung ihrer Forderung gefährdet wird."
    },
    {
      "date": "2025-12-18",
      "id": "140429",
      "original_text": "Einreichung neuer Dokumente\nNiedersachsen Amtsgericht Lüneburg HRB 101256 früher Amtsgericht Celle\nNIBE Systemtechnik GmbH – Celle",
      "type": "Einreichung neuer Dokumente",
      "state": "Niedersachsen",
      "amtsgericht": "Amtsgericht Lüneburg",
      "registernummer": "HRB 101256",
      "registerart": "HRB",
      "company_name": "NIBE Systemtechnik GmbH",
      "company_seat": "Celle",
      "former_amtsgericht": "Celle",
      "details": "18.12.2025 (Bekanntmachungsdatum)\n\nNiedersachsen Amtsgericht Lüneburg HRB 101256 früher Amtsgericht Celle\nEinreichung neuer Dokumente 18.12.2025 (Eintragungsdatum)\n\nNIBE Systemtechnik GmbH\nGesellschaft mit beschränkter Haftung\nCelle\n\nDie Liste der Mitglieder des Aufsichtsrats wurde beim Registergericht eingereicht."
    },
    {
      "date": "2025-12-18",
      "id": "140430",
      "original_text": "Registerbekanntmachung nach dem Umwandlungsgesetz\nNiedersachsen Amtsgericht Oldenburg (Oldenburg) HRB 218190\nHansalinie GSW Services GmbH – Großenkneten",
      "type": "Registerbekanntmachung nach dem Umwandlungsgesetz",
      "state": "Niedersachsen",
      "amtsgericht": "Amtsgericht Oldenburg (Oldenburg)",
      "registernummer": "HRB 218190",
      "registerart": "HRB",
      "company_name": "Hansalinie GSW Services GmbH",
      "company_seat": "Großenkneten",
      "details": "18.12.2025 (Bekanntmachungsdatum)\n\nNiedersachsen Amtsgericht Oldenburg (Oldenburg) HRB 218190\nRegisterbekanntmachung nach dem Umwandlungsgesetz 18.12.2025 (Eintragungsdatum)\n\nHansalinie GSW Services GmbH\nGesellschaft mit beschränkter Haftung\nGroßenkneten\n\nDen Gläubigern der an der Verschmelzung beteiligten Rechtsträger ist, wenn sie binnen sechs Monaten nach dem Tag, an dem die Eintragung der Verschmelzung in das Register des Sitzes desjenigen Rechtsträgers, dessen Gläubiger sie sind, nach § 19  Abs.  3 UmwG als bekannt gemacht gilt, ihren Anspruch nach Grund und Höhe schriftlich anmelden, Sicherheit zu leisten, soweit sie nicht Befriedigung verlangen können. Dieses Recht steht den Gläubigern jedoch nur zu, wenn sie glaubhaft machen, dass durch die Verschmelzung die Erfüllung der Forderung gefährdet wird."
    },
    {
      "date": "2025-12-18",
      "id": "140431",
      "original_text": "Registerbekanntmachung nach dem Umwandlungsgesetz\nNiedersachsen Amtsgericht Osnabrück VR 1922\nKatholische Erwachsenenbildung Osnabrück e.V. – Osnabrück",
      "type": "Registerbekanntmachung nach dem Umwandlungsgesetz",
      "state": "Niedersachsen",
      "amtsgericht": "Amtsgericht Osnabrück",
      "registernummer": "VR 1922",
      "registerart": "VR",
      "company_name": "Katholische Erwachsenenbildung Osnabrück e.V.",
      "company_seat": "Osnabrück",
      "details": "18.12.2025 (Bekanntmachungsdatum)\n\nNiedersachsen Amtsgericht Osnabrück VR 1922\nRegisterbekanntmachung nach dem Umwandlungsgesetz 18.12.2025 (Eintragungsdatum)\n\nKatholische Erwachsenenbildung Osnabrück e.V.\neingetragener Verein\nOsnabrück\n\nDen Gläubigern der an der Verschmelzung beteiligten Rechtsträger ist, wenn sie binnen sechs Monaten nach dem Tag, an dem die Eintragung der Verschmelzung in das Register des Sitzes desjenigen Rechtsträgers, dessen Gläubiger sie sind, nach § 19  Abs.  3 UmwG als bekannt gemacht gilt, ihren Anspruch nach Grund und Höhe schriftlich anmelden, Sicherheit zu leisten, soweit sie nicht Befriedigung verlangen können. Dieses Recht steht den Gläubigern jedoch nur zu, wenn sie glaubhaft machen, dass durch die Verschmelzung die Erfüllung der Forderung gefährdet wird."
    },
    {
      "date": "2025-12-18",
      "id": "140432",
      "original_text": "Registerbekanntmachung nach dem Umwandlungsgesetz\nNiedersachsen Amtsgericht Oldenburg (Oldenburg) HRB 221157\nHBG Vermögensverwaltungs- und Beteiligungsgesellschaft mbH – Großenkneten",
      "type": "Registerbekanntmachung nach dem Umwandlungsgesetz",
      "state": "Niedersachsen",
      "amtsgericht": "Amtsgericht Oldenburg (Oldenburg)",
      "registernummer": "HRB 221157",
      "registerart": "HRB",
      "company_name": "HBG Vermögensverwaltungs- und Beteiligungsgesellschaft mbH",
      "company_seat": "Großenkneten",
      "details": "18.12.2025 (Bekanntmachungsdatum)\n\nNiedersachsen Amtsgericht Oldenburg (Oldenburg) HRB 221157\nRegisterbekanntmachung nach dem Umwandlungsgesetz 18.12.2025 (Eintragungsdatum)\n\nHBG Vermögensverwaltungs- und Beteiligungsgesellschaft mbH\nGesellschaft mit beschränkter Haftung\nGroßenkneten\n\nDen Gläubigern der an der Verschmelzung beteiligten Rechtsträger ist, wenn sie binnen sechs Monaten nach dem Tag, an dem die Eintragung der Verschmelzung in das Register des Sitzes desjenigen Rechtsträgers, dessen Gläubiger sie sind, nach § 19  Abs.  3 UmwG als bekannt gemacht gilt, ihren Anspruch nach Grund und Höhe schriftlich anmelden, Sicherheit zu leisten, soweit sie nicht Befriedigung verlangen können. Dieses Recht steht den Gläubigern jedoch nur zu, wenn sie glaubhaft machen, dass durch die Verschmelzung die Erfüllung der Forderung gefährdet wird."
    },
    {
      "date": "2025-12-18",
      "id": "140433",
      "original_text": "Registerbekanntmachung nach dem Umwandlungsgesetz\nNiedersachsen Amtsgericht Oldenburg (Oldenburg) HRB 209260\nHB Grundstücksverwaltungs- und Beteiligungsgesellschaft mbH – Großenkneten",
      "type": "Registerbekanntmachung nach dem Umwandlungsgesetz",
      "state": "Niedersachsen",
      "amtsgericht": "Amtsgericht Oldenburg (Oldenburg)",
      "registernummer": "HRB 209260",
      "registerart": "HRB",
      "company_name": "HB Grundstücksverwaltungs- und Beteiligungsgesellschaft mbH",
      "company_seat": "Großenkneten",
      "details": "18.12.2025 (Bekanntmachungsdatum)\n\nNiedersachsen Amtsgericht Oldenburg (Oldenburg) HRB 209260\nRegisterbekanntmachung nach dem Umwandlungsgesetz 18.12.2025 (Eintragungsdatum)\n\nHB Grundstücksverwaltungs- und Beteiligungsgesellschaft mbH\nGesellschaft mit beschränkter Haftung\nGroßenkneten\n\nDen Gläubigern der an der Verschmelzung beteiligten Rechtsträger ist, wenn sie binnen sechs Monaten nach dem Tag, an dem die Eintragung der Verschmelzung in das Register des Sitzes desjenigen Rechtsträgers, dessen Gläubiger sie sind, nach § 19  Abs.  3 UmwG als bekannt gemacht gilt, ihren Anspruch nach Grund und Höhe schriftlich anmelden, Sicherheit zu leisten, soweit sie nicht Befriedigung verlangen können. Dieses Recht steht den Gläubigern jedoch nur zu, wenn sie glaubhaft machen, dass durch die Verschmelzung die Erfüllung der Forderung gefährdet wird."
    },
    {
      "date": "2025-12-18",
      "id": "140434",
      "original_text": "Registerbekanntmachung nach dem Umwandlungsgesetz\nNiedersachsen Amtsgericht Oldenburg (Oldenburg) HRB 218768\nBruchmann Consulting UG (haftungsbeschränkt) – Schortens",
      "type": "Registerbekanntmachung nach dem Umwandlungsgesetz",
      "state": "Niedersachsen",
      "amtsgericht": "Amtsgericht Oldenburg (Oldenburg)",
      "registernummer": "HRB 218768",
      "registerart": "HRB",
      "company_name": "Bruchmann Consulting UG (haftungsbeschränkt)",
      "company_seat": "Schortens",
      "details": "18.12.2025 (Bekanntmachungsdatum)\n\nNiedersachsen Amtsgericht Oldenburg (Oldenburg) HRB 218768\nRegisterbekanntmachung nach dem Umwandlungsgesetz 18.12.2025 (Eintragungsdatum)\n\nBruchmann Consulting UG (haftungsbeschränkt)\nGesellschaft mit beschränkter Haftung\nSchortens\n\nDen Gläubigern der an der Verschmelzung beteiligten Rechtsträger ist, wenn sie binnen sechs Monaten nach dem Tag, an dem die Eintragung der Verschmelzung in das Register des Sitzes desjenigen Rechtsträgers, dessen Gläubiger sie sind, nach § 19  Abs.  3 UmwG als bekannt gemacht gilt, ihren Anspruch nach Grund und Höhe schriftlich anmelden, Sicherheit zu leisten, soweit sie nicht Befriedigung verlangen können. Dieses Recht steht den Gläubigern jedoch nur zu, wenn sie glaubhaft machen, dass durch die Verschmelzung die Erfüllung der Forderung gefährdet wird."
    },
    {
      "date": "2025-12-18",
      "id": "140435",
      "original_text": "Registerbekanntmachung nach dem Umwandlungsgesetz\nNiedersachsen Amtsgericht Tostedt HRB 211407\nKolibri Immobilien GmbH – Heeslingen",
      "type": "Registerbekanntmachung nach dem Umwandlungsgesetz",
      "state": "Niedersachsen",
      "amtsgericht": "Amtsgericht Tostedt",
      "registernummer": "HRB 211407",
      "registerart": "HRB",
      "company_name": "Kolibri Immobilien GmbH",
      "company_seat": "Heeslingen",
      "details": "18.12.2025 (Bekanntmachungsdatum)\n\nNiedersachsen Amtsgericht Tostedt HRB 211407\nRegisterbekanntmachung nach dem Umwandlungsgesetz 18.12.2025 (Eintragungsdatum)\n\nKolibri Immobilien GmbH\nGesellschaft mit beschränkter Haftung\nHeeslingen\n\nDen Gläubigern der an der Verschmelzung beteiligten Rechtsträger ist, wenn sie binnen sechs Monaten nach dem Tag, an dem die Eintragung der Verschmelzung in das Register des Sitzes desjenigen Rechtsträgers, dessen Gläubiger sie sind, nach § 19  Abs.  3 UmwG als bekannt gemacht gilt, ihren Anspruch nach Grund und Höhe schriftlich anmelden, Sicherheit zu leisten, soweit sie nicht Befriedigung verlangen können. Dieses Recht steht den Gläubigern jedoch nur zu, wenn sie glaubhaft machen, dass durch die Verschmelzung die Erfüllung der Forderung gefährdet wird."
    },
    {
      "date": "2025-12-18",
      "id": "140436",
      "original_text": "Registerbekanntmachung nach dem Umwandlungsgesetz\nNiedersachsen Amtsgericht Oldenburg (Oldenburg) HRB 221157\nHBG Vermögensverwaltungs- und Beteiligungsgesellschaft mbH – Großenkneten",
      "type": "Registerbekanntmachung nach dem Umwandlungsgesetz",
      "state": "Niedersachsen",
      "amtsgericht": "Amtsgericht Oldenburg (Oldenburg)",
      "registernummer": "HRB 221157",
      "registerart": "HRB",
      "company_name": "HBG Vermögensverwaltungs- und Beteiligungsgesellschaft mbH",
      "company_seat": "Großenkneten",
      "details": "18.12.2025 (Bekanntmachungsdatum)\n\nNiedersachsen Amtsgericht Oldenburg (Oldenburg) HRB 221157\nRegisterbekanntmachung nach dem Umwandlungsgesetz 18.12.2025 (Eintragungsdatum)\n\nHBG Vermögensverwaltungs- und Beteiligungsgesellschaft mbH\nGesellschaft mit beschränkter Haftung\nGroßenkneten\n\nDen Gläubigern der an der Verschmelzung beteiligten Rechtsträger ist, wenn sie binnen sechs Monaten nach dem Tag, an dem die Eintragung der Verschmelzung in das Register des Sitzes desjenigen Rechtsträgers, dessen Gläubiger sie sind, nach § 19  Abs.  3 UmwG als bekannt gemacht gilt, ihren Anspruch nach Grund und Höhe schriftlich anmelden, Sicherheit zu leisten, soweit sie nicht Befriedigung verlangen können. Dieses Recht steht den Gläubigern jedoch nur zu, wenn sie glaubhaft machen, dass durch die Verschmelzung die Erfüllung der Forderung gefährdet wird."
    },
    {
      "date": "2025-12-18",
      "id": "140437",
      "original_text": "Löschungsankündigung\nNiedersachsen Amtsgericht Osnabrück HRB 203405\nFerié Übersetzungsdienst UG (haftungsbeschränkt) – Osnabrück",
      "type": "Löschungsankündigung",
      "state": "Niedersachsen",
      "amtsgericht": "Amtsgericht Osnabrück",
      "registernummer": "HRB 203405",
      "registerart": "HRB",
      "company_name": "Ferié Übersetzungsdienst UG (haftungsbeschränkt)",
      "company_seat": "Osnabrück",
      "details": "18.12.2025 (Bekanntmachungsdatum)\n\nNiedersachsen Amtsgericht Osnabrück HRB 203405\nLöschungsankündigung\n\nFerié Übersetzungsdienst UG (haftungsbeschränkt)\nGesellschaft mit beschränkter Haftung\nOsnabrück\n\nDas Registergericht beabsichtigt, die Gesellschaft von Amts wegen nach § 394 FamFG wegen Vermögenslosigkeit zu löschen. Die Frist zur Erhebung eines Widerspruchs ist auf 1 Monat ab dieser Registerbekanntmachung festgesetzt."
    },
    {
      "date": "2025-12-18",
      "id": "140438",
      "original_text": "Registerbekanntmachung nach dem Umwandlungsgesetz\nNiedersachsen Amtsgericht Oldenburg (Oldenburg) HRB 217890\nBEVENT GmbH – Jever",
      "type": "Registerbekanntmachung nach dem Umwandlungsgesetz",
      "state": "Niedersachsen",
      "amtsgericht": "Amtsgericht Oldenburg (Oldenburg)",
      "registernummer": "HRB 217890",
      "registerart": "HRB",
      "company_name": "BEVENT GmbH",
      "company_seat": "Jever",
      "details": "18.12.2025 (Bekanntmachungsdatum)\n\nNiedersachsen Amtsgericht Oldenburg (Oldenburg) HRB 217890\nRegisterbekanntmachung nach dem Umwandlungsgesetz 18.12.2025 (Eintragungsdatum)\n\nBEVENT GmbH\nGesellschaft mit beschränkter Haftung\nJever\n\nDen Gläubigern der an der Verschmelzung beteiligten Rechtsträger ist, wenn sie binnen sechs Monaten nach dem Tag, an dem die Eintragung der Verschmelzung in das Register des Sitzes desjenigen Rechtsträgers, dessen Gläubiger sie sind, nach § 19  Abs.  3 UmwG als bekannt gemacht gilt, ihren Anspruch nach Grund und Höhe schriftlich anmelden, Sicherheit zu leisten, soweit sie nicht Befriedigung verlangen können. Dieses Recht steht den Gläubigern jedoch nur zu, wenn sie glaubhaft machen, dass durch die Verschmelzung die Erfüllung der Forderung gefährdet wird."
    },
    {
      "date": "2025-12-18",
      "id": "140439",
      "original_text": "Einreichung neuer Dokumente\nNiedersachsen Amtsgericht Lüneburg HRB 212347\nELMESS Thermosystemtechnik GmbH – Uelzen",
      "type": "Einreichung neuer Dokumente",
      "state": "Niedersachsen",
      "amtsgericht": "Amtsgericht Lüneburg",
      "registernummer": "HRB 212347",
      "registerart": "HRB",
      "company_name": "ELMESS Thermosystemtechnik GmbH",
      "company_seat": "Uelzen",
      "details": "18.12.2025 (Bekanntmachungsdatum)\n\nNiedersachsen Amtsgericht Lüneburg HRB 212347\nEinreichung neuer Dokumente 18.12.2025 (Eintragungsdatum)\n\nELMESS Thermosystemtechnik GmbH\nGesellschaft mit beschränkter Haftung\nUelzen\n\nDie Liste der Mitglieder des Aufsichtsrats wurde beim Registergericht eingereicht."
    },
    {
      "date": "2025-12-18",
      "id": "140440",
      "original_text": "Löschungsankündigung\nNiedersachsen Amtsgericht Aurich HRB 988\nASM Sanitärinstallation GmbH – Südbrookmerland-Moordorf",
      "type": "Löschungsankündigung",
      "state": "Niedersachsen",
      "amtsgericht": "Amtsgericht Aurich",
      "registernummer": "HRB 988",
      "registerart": "HRB",
      "company_name": "ASM Sanitärinstallation GmbH",
      "company_seat": "Südbrookmerland-Moordorf",
      "details": "18.12.2025 (Bekanntmachungsdatum)\n\nNiedersachsen Amtsgericht Aurich HRB 988\nLöschungsankündigung\n\nASM Sanitärinstallation GmbH\nGesellschaft mit beschränkter Haftung\nSüdbrookmerland-Moordorf\n\nDas Registergericht beabsichtigt, die Gesellschaft von Amts wegen nach § 394 FamFG zu löschen. Die Frist zur Erhebung eines Widerspruchs ist auf 3 Monate ab dieser Registerbekanntmachung festgesetzt."
    },
    {
      "date": "2025-12-18",
      "id": "140441",
      "original_text": "Registerbekanntmachung nach dem Umwandlungsgesetz\nMecklenburg-Vorpommern Amtsgericht Schwerin HRB 6154\nG+S Gesellschaft für Assekuranzberatung und -vermittlung mbH – Schwerin",
      "type": "Registerbekanntmachung nach dem Umwandlungsgesetz",
      "state": "Mecklenburg-Vorpommern",
      "amtsgericht": "Amtsgericht Schwerin",
      "registernummer": "HRB 6154",
      "registerart": "HRB",
      "company_name": "G+S Gesellschaft für Assekuranzberatung und -vermittlung mbH",
      "company_seat": "Schwerin",
      "details": "18.12.2025 (Bekanntmachungsdatum)\n\nMecklenburg-Vorpommern Amtsgericht Schwerin HRB 6154\nRegisterbekanntmachung nach dem Umwandlungsgesetz\n\nG+S Gesellschaft für Assekuranzberatung und -vermittlung mbH\nGesellschaft mit beschränkter Haftung\nSchwerin\n\nDen Gläubigern der an der Verschmelzung beteiligten Gesellschaften ist, wenn sie binnen sechs Monaten nach dem Tag, an dem die Eintragung der Verschmelzungen in das Register des Sitzes desjenigen Rechtsträgers, dessen Gläubiger sie sind, nach § 19 Absatz 3 UmwG als bekanntgemacht gilt, ihren Anspruch nach Grund und Höhe schriftlich anmelden, Sicherheit zu leisten, soweit sie nicht Befriedigung verlangen können. Dieses Recht steht den Gläubigern jedoch nur zu, wenn sie glaubhaft machen, dass durch die Verschmelzung die Erfüllung ihrer Forderung gefährdet wird."
    },
    {
      "date": "2025-12-18",
      "id": "140442",
      "original_text": "Sonstige Registerbekanntmachung\nMecklenburg-Vorpommern Amtsgericht Schwerin HRB 8428\nHELIOS Kliniken Schwerin GmbH – Schwerin",
      "type": "Sonstige Registerbekanntmachung",
      "state": "Mecklenburg-Vorpommern",
      "amtsgericht": "Amtsgericht Schwerin",
      "registernummer": "HRB 8428",
      "registerart": "HRB",
      "company_name": "HELIOS Kliniken Schwerin GmbH",
      "company_seat": "Schwerin",
      "details": "18.12.2025 (Bekanntmachungsdatum)\n\nMecklenburg-Vorpommern Amtsgericht Schwerin HRB 8428\nSonstige Registerbekanntmachung 18.12.2025 (Eintragungsdatum)\n\nHELIOS Kliniken Schwerin GmbH\nGesellschaft mit beschränkter Haftung\nSchwerin\n\nEine Liste der Mitglieder des Aufsichtsrats ist zum Handelsregister eingereicht worden."
    },
    {
      "date": "2025-12-18",
      "id": "140443",
      "original_text": "Sonstige Registerbekanntmachung\nBerlin Amtsgericht Berlin (Charlottenburg) HRB 163815\nKAYDEE GmbH – Berlin",
      "type": "Sonstige Registerbekanntmachung",
      "state": "Berlin",
      "amtsgericht": "Amtsgericht Berlin (Charlottenburg)",
      "registernummer": "HRB 163815",
      "registerart": "HRB",
      "company_name": "KAYDEE GmbH",
      "company_seat": "Berlin",
      "details": "18.12.2025 (Bekanntmachungsdatum)\n\nBerlin Amtsgericht Berlin (Charlottenburg) HRB 163815\nSonstige Registerbekanntmachung\n\nKAYDEE GmbH\nGesellschaft mit beschränkter Haftung\nBerlin\n\nAls nicht eingetragen wird gemäß § 394 Abs. 2 Satz 2 FamFG veröffentlicht: Es ist beabsichtigt, die Eintragung des Herrn Andreas Schaetzke als Geschäftsführer der Gesellschaft wegen Mangels einer wesentlichen Voraussetzung gemäß § 395 FamFG von Amts wegen zu löschen. Widerspruchsfrist 2 Wochen."
    },
    {
      "date": "2025-12-18",
      "id": "140444",
      "original_text": "Löschungsankündigung\nBerlin Amtsgericht Berlin (Charlottenburg) HRB 227306\nSH Logistik GmbH – Berlin",
      "type": "Löschungsankündigung",
      "state": "Berlin",
      "amtsgericht": "Amtsgericht Berlin (Charlottenburg)",
      "registernummer": "HRB 227306",
      "registerart": "HRB",
      "company_name": "SH Logistik GmbH",
      "company_seat": "Berlin",
      "details": "18.12.2025 (Bekanntmachungsdatum)\n\nBerlin Amtsgericht Berlin (Charlottenburg) HRB 227306\nLöschungsankündigung\n\nSH Logistik GmbH\nGesellschaft mit beschränkter Haftung\nBerlin\n\nBei der nachstehenden Gesellschaft wird das Amtslöschungsverfahren gemäß § 394 FamFG eingeleitet. Widerspruchsfrist 6 Wochen"
    },
    {
      "date": "2025-12-18",
      "id": "140445",
      "original_text": "Registerbekanntmachung nach dem Umwandlungsgesetz\nBerlin Amtsgericht Berlin (Charlottenburg) HRB 98393\nIDEAL Berlin Immobilienmanagement GmbH – Berlin",
      "type": "Registerbekanntmachung nach dem Umwandlungsgesetz",
      "state": "Berlin",
      "amtsgericht": "Amtsgericht Berlin (Charlottenburg)",
      "registernummer": "HRB 98393",
      "registerart": "HRB",
      "company_name": "IDEAL Berlin Immobilienmanagement GmbH",
      "company_seat": "Berlin",
      "details": "18.12.2025 (Bekanntmachungsdatum)\n\nBerlin Amtsgericht Berlin (Charlottenburg) HRB 98393\nRegisterbekanntmachung nach dem Umwandlungsgesetz 16.12.2025 (Eintragungsdatum)\n\nIDEAL Berlin Immobilienmanagement GmbH\nGesellschaft mit beschränkter Haftung\nBerlin\n\nZu Eintragungsnummer 13 vom 16.12.2025 wird als nicht eingetragen veröffentlicht: Den Gläubigern der an der Verschmelzung beteiligten Rechtsträger ist, wenn sie binnen sechs Monaten nach dem Tag, an dem die Eintragung der Verschmelzung in das Register des Sitzes desjenigen Rechtsträgers, dessen Gläubiger sie sind, als bekannt gemacht gilt, ihren Anspruch nach Grund und Höhe schriftlich anmelden, Sicherheit zu leisten, soweit sie nicht Befriedigung verlangen können. Dieses Recht steht den Gläubigern jedoch nur zu, wenn sie glaubhaft machen, dass durch die Verschmelzung die Erfüllung ihrer Forderung gefährdet wird. Das Recht, Sicherheitsleistung zu verlangen, steht Gläubigern nicht zu, die im Falle der Insolvenz ein Recht auf vorzugsweise Befriedigung aus einer Deckungsmasse haben, die nach gesetzlicher Vorschrift zu ihrem Schutz errichtet und staatlich überwacht ist."
    },
    {
      "date": "2025-12-18",
      "id": "140446",
      "original_text": "Einreichung neuer Dokumente\nSchleswig-Holstein Amtsgericht Flensburg HRB 3140\nDeutsches Rotes Kreuz Pflegeservice Flensburg gGmbH – Flensburg",
      "type": "Einreichung neuer Dokumente",
      "state": "Schleswig-Holstein",
      "amtsgericht": "Amtsgericht Flensburg",
      "registernummer": "HRB 3140",
      "registerart": "HRB",
      "company_name": "Deutsches Rotes Kreuz Pflegeservice Flensburg gGmbH",
      "company_seat": "Flensburg",
      "details": "18.12.2025 (Bekanntmachungsdatum)\n\nSchleswig-Holstein Amtsgericht Flensburg HRB 3140\nEinreichung neuer Dokumente\n\nDeutsches Rotes Kreuz Pflegeservice Flensburg gGmbH\nGesellschaft mit beschränkter Haftung\nFlensburg\n\nAls nicht eingetragen wird veröffentlicht: Neue Aufsichtsratsliste nach Änderung eingereicht am 17.12.2025."
    },
    {
      "date": "2025-12-18",
      "id": "140447",
      "original_text": "Löschungsankündigung\nBrandenburg Amtsgericht Frankfurt/Oder HRB 17562\nL + L Gerüstbau GmbH – Bernau bei Berlin",
      "type": "Löschungsankündigung",
      "state": "Brandenburg",
      "amtsgericht": "Amtsgericht Frankfurt/Oder",
      "registernummer": "HRB 17562",
      "registerart": "HRB",
      "company_name": "L + L Gerüstbau GmbH",
      "company_seat": "Bernau bei Berlin",
      "details": "18.12.2025 (Bekanntmachungsdatum)\n\nBrandenburg Amtsgericht Frankfurt/Oder HRB 17562\nLöschungsankündigung\n\nL + L Gerüstbau GmbH\nGesellschaft mit beschränkter Haftung\nBernau bei Berlin\n\nBei der nachstehenden Gesellschaft wird das Amtslöschungsverfahren gemäß § 394 FamFG eingeleitet."
    },
    {
      "date": "2025-12-18",
      "id": "140448",
      "original_text": "Einreichung neuer Dokumente\nBaden-Württemberg Amtsgericht Mannheim HRB 746505\nICODOS GmbH – Mannheim",
      "type": "Einreichung neuer Dokumente",
      "state": "Baden-Württemberg",
      "amtsgericht": "Amtsgericht Mannheim",
      "registernummer": "HRB 746505",
      "registerart": "HRB",
      "company_name": "ICODOS GmbH",
      "company_seat": "Mannheim",
      "details": "18.12.2025 (Bekanntmachungsdatum)\n\nBaden-Württemberg Amtsgericht Mannheim HRB 746505\nEinreichung neuer Dokumente 18.12.2025 (Eintragungsdatum)\n\nICODOS GmbH\nGesellschaft mit beschränkter Haftung\nMannheim\n\nDie Gesellschaft hat am 03.12.2025 die Liste über die Zusammensetzung des Aufsichtsrats zum Handelsregister eingereicht."
    },
    {
      "date": "2025-12-18",
      "id": "140449",
      "original_text": "Registerbekanntmachung nach dem Umwandlungsgesetz\nBaden-Württemberg Amtsgericht Freiburg HRB 734608\nStaller GmbH – Grafenhausen",
      "type": "Registerbekanntmachung nach dem Umwandlungsgesetz",
      "state": "Baden-Württemberg",
      "amtsgericht": "Amtsgericht Freiburg",
      "registernummer": "HRB 734608",
      "registerart": "HRB",
      "company_name": "Staller GmbH",
      "company_seat": "Grafenhausen",
      "details": "18.12.2025 (Bekanntmachungsdatum)\n\nBaden-Württemberg Amtsgericht Freiburg HRB 734608\nRegisterbekanntmachung nach dem Umwandlungsgesetz 18.12.2025 (Eintragungsdatum)\n\nStaller GmbH\nGesellschaft mit beschränkter Haftung\nGrafenhausen\n\nAls nicht eingetragen wird bekanntgemacht:\nDen Gläubigern der an der Ausgliederung beteiligten Rechtsträger ist, wenn sie binnen sechs Monaten nach dem Tag, an dem die Eintragung der Ausgliederung in das Register des Sitzes desjenigen Rechtsträgers, dessen Gläubiger sie sind, nach § 19 Abs. 3 UmwG als bekanntgemacht gilt, ihren Anspruch nach Grund und Höhe schriftlich anmelden, Sicherheit zu leisten, soweit sie nicht Befriedigung verlangen können. Dieses Recht steht den Gläubigern jedoch nur zu, wenn sie glaubhaft machen, dass durch die Ausgliederung die Erfüllung ihrer Forderung gefährdet wird."
    },
    {
      "date": "2025-12-18",
      "id": "140450",
      "original_text": "Registerbekanntmachung nach dem Umwandlungsgesetz\nBaden-Württemberg Amtsgericht Freiburg HRA 709047\nWolfram Staller Tiefbau Straßenbau Pflasterbau e. K. – Grafenhausen",
      "type": "Registerbekanntmachung nach dem Umwandlungsgesetz",
      "state": "Baden-Württemberg",
      "amtsgericht": "Amtsgericht Freiburg",
      "registernummer": "HRA 709047",
      "registerart": "HRA",
      "company_name": "Wolfram Staller Tiefbau Straßenbau Pflasterbau e. K.",
      "company_seat": "Grafenhausen",
      "details": "18.12.2025 (Bekanntmachungsdatum)\n\nBaden-Württemberg Amtsgericht Freiburg HRA 709047\nRegisterbekanntmachung nach dem Umwandlungsgesetz 18.12.2025 (Eintragungsdatum)\n\nWolfram Staller Tiefbau Straßenbau Pflasterbau e. K.\nEinzelkaufmann / Einzelkauffrau\nGrafenhausen\n\nAls nicht eingetragen wird bekanntgemacht:\nDen Gläubigern der an der Ausgliederung beteiligten Rechtsträger ist, wenn sie binnen sechs Monaten nach dem Tag, an dem die Eintragung der Ausgliederung in das Register des Sitzes desjenigen Rechtsträgers, dessen Gläubiger sie sind, nach § 19 Abs. 3 UmwG als bekanntgemacht gilt, ihren Anspruch nach Grund und Höhe schriftlich anmelden, Sicherheit zu leisten, soweit sie nicht Befriedigung verlangen können. Dieses Recht steht den Gläubigern jedoch nur zu, wenn sie glaubhaft machen, dass durch die Ausgliederung die Erfüllung ihrer Forderung gefährdet wird."
    },
    {
      "date": "2025-12-18",
      "id": "140451",
      "original_text": "Löschungsankündigung\nBerlin Amtsgericht Berlin (Charlottenburg) HRB 216634\nConcordia Immobilien Bau GmbH – Berlin",
      "type": "Löschungsankündigung",
      "state": "Berlin",
      "amtsgericht": "Amtsgericht Berlin (Charlottenburg)",
      "registernummer": "HRB 216634",
      "registerart": "HRB",
      "company_name": "Concordia Immobilien Bau GmbH",
      "company_seat": "Berlin",
      "details": "18.12.2025 (Bekanntmachungsdatum)\n\nBerlin Amtsgericht Berlin (Charlottenburg) HRB 216634\nLöschungsankündigung\n\nConcordia Immobilien Bau GmbH\nGesellschaft mit beschränkter Haftung\nBerlin\n\nBei der nachstehenden Gesellschaft wird das Amtslöschungsverfahren gemäß § 394 FamFG eingeleitet. Widerspruchsfrist 6 Wochen"
    },
    {
      "date": "2025-12-18",
      "id": "140452",
      "original_text": "Registerbekanntmachung nach dem Umwandlungsgesetz\nBaden-Württemberg Amtsgericht Stuttgart HRB 796509\nAUDERE Holding GmbH – Fellbach",
      "type": "Registerbekanntmachung nach dem Umwandlungsgesetz",
      "state": "Baden-Württemberg",
      "amtsgericht": "Amtsgericht Stuttgart",
      "registernummer": "HRB 796509",
      "registerart": "HRB",
      "company_name": "AUDERE Holding GmbH",
      "company_seat": "Fellbach",
      "details": "18.12.2025 (Bekanntmachungsdatum)\n\nBaden-Württemberg Amtsgericht Stuttgart HRB 796509\nRegisterbekanntmachung nach dem Umwandlungsgesetz 18.12.2025 (Eintragungsdatum)\n\nAUDERE Holding GmbH\nGesellschaft mit beschränkter Haftung\nFellbach\n\nDen Gläubigern der an der Verschmelzung beteiligten Rechtsträger ist, wenn sie binnen sechs Monaten nach dem Tag, an dem die Eintragung der Verschmelzung in das Register des Sitzes desjenigen Rechtsträgers, dessen Gläubiger sie sind, nach § 19 Abs. 3 UmwG als bekanntgemacht gilt, ihren Anspruch nach Grund und Höhe schriftlich anmelden, Sicherheit zu leisten, soweit sie nicht Befriedigung verlangen können. Dieses Recht steht den Gläubigern jedoch nur zu, wenn sie glaubhaft machen, dass durch die Verschmelzung die Erfüllung ihrer Forderung gefährdet wird."
    },
    {
      "date": "2025-12-18",
      "id": "140453",
      "original_text": "Registerbekanntmachung nach dem Umwandlungsgesetz\nBaden-Württemberg Amtsgericht Stuttgart HRB 797509\naMoS Invest No. 1 GmbH – Fellbach",
      "type": "Registerbekanntmachung nach dem Umwandlungsgesetz",
      "state": "Baden-Württemberg",
      "amtsgericht": "Amtsgericht Stuttgart",
      "registernummer": "HRB 797509",
      "registerart": "HRB",
      "company_name": "aMoS Invest No. 1 GmbH",
      "company_seat": "Fellbach",
      "details": "18.12.2025 (Bekanntmachungsdatum)\n\nBaden-Württemberg Amtsgericht Stuttgart HRB 797509\nRegisterbekanntmachung nach dem Umwandlungsgesetz 18.12.2025 (Eintragungsdatum)\n\naMoS Invest No. 1 GmbH\nGesellschaft mit beschränkter Haftung\nFellbach\n\nDen Gläubigern der an der Verschmelzung beteiligten Rechtsträger ist, wenn sie binnen sechs Monaten nach dem Tag, an dem die Eintragung der Verschmelzung in das Register des Sitzes desjenigen Rechtsträgers, dessen Gläubiger sie sind, nach § 19 Abs. 3 UmwG als bekanntgemacht gilt, ihren Anspruch nach Grund und Höhe schriftlich anmelden, Sicherheit zu leisten, soweit sie nicht Befriedigung verlangen können. Dieses Recht steht den Gläubigern jedoch nur zu, wenn sie glaubhaft machen, dass durch die Verschmelzung die Erfüllung ihrer Forderung gefährdet wird."
    },
    {
      "date": "2025-12-18",
      "id": "140454",
      "original_text": "Registerbekanntmachung nach dem Umwandlungsgesetz\nHamburg Amtsgericht Hamburg HRA 132733\nNisa Perestrelo Lamela, Glück u. Selig Café e.K. – Hamburg",
      "type": "Registerbekanntmachung nach dem Umwandlungsgesetz",
      "state": "Hamburg",
      "amtsgericht": "Amtsgericht Hamburg",
      "registernummer": "HRA 132733",
      "registerart": "HRA",
      "company_name": "Nisa Perestrelo Lamela, Glück u. Selig Café e.K.",
      "company_seat": "Hamburg",
      "details": "18.12.2025 (Bekanntmachungsdatum)\n\nHamburg Amtsgericht Hamburg HRA 132733\nRegisterbekanntmachung nach dem Umwandlungsgesetz 18.12.2025 (Eintragungsdatum)\n\nNisa Perestrelo Lamela, Glück u. Selig Café e.K.\nEinzelkaufmann\nHamburg\n\nAls nicht eingetragen wird bekannt gemacht:\nDen Gläubigern der an der Ausgliederung beteiligten Gesellschaften ist, wenn sie binnen sechs Monaten nach dem Tag, an dem die Eintragung der Ausgliederung in das Register des Sitzes desjenigen Rechtsträgers, dessen Gläubiger sie sind, nach § 19 Absatz 3 UmwG als bekannt gemacht gilt, ihren Anspruch nach Grund und Höhe schriftlich anmelden, Sicherheit zu leisten, soweit sie nicht Befriedigung verlangen können. Dieses Recht steht den Gläubigern jedoch nur zu, wenn sie glaubhaft machen, dass durch die Ausgliederung die Erfüllung ihrer Forderung gefährdet wird."
    },
    {
      "date": "2025-12-18",
      "id": "140455",
      "original_text": "Registerbekanntmachung nach dem Umwandlungsgesetz\nHamburg Amtsgericht Hamburg HRB 196139\nNPL Glück & Selig Café GmbH – Hamburg",
      "type": "Registerbekanntmachung nach dem Umwandlungsgesetz",
      "state": "Hamburg",
      "amtsgericht": "Amtsgericht Hamburg",
      "registernummer": "HRB 196139",
      "registerart": "HRB",
      "company_name": "NPL Glück & Selig Café GmbH",
      "company_seat": "Hamburg",
      "details": "18.12.2025 (Bekanntmachungsdatum)\n\nHamburg Amtsgericht Hamburg HRB 196139\nRegisterbekanntmachung nach dem Umwandlungsgesetz 18.12.2025 (Eintragungsdatum)\n\nNPL Glück & Selig Café GmbH\nGesellschaft mit beschränkter Haftung\nHamburg\n\nAls nicht eingetragen wird bekannt gemacht:\nDen Gläubigern der an der Ausgliederung beteiligten Gesellschaften ist, wenn sie binnen sechs Monaten nach dem Tag, an dem die Eintragung der Ausgliederung in das Register des Sitzes desjenigen Rechtsträgers, dessen Gläubiger sie sind, nach § 19 Absatz 3 UmwG als bekannt gemacht gilt, ihren Anspruch nach Grund und Höhe schriftlich anmelden, Sicherheit zu leisten, soweit sie nicht Befriedigung verlangen können. Dieses Recht steht den Gläubigern jedoch nur zu, wenn sie glaubhaft machen, dass durch die Ausgliederung die Erfüllung ihrer Forderung gefährdet wird."
    },
    {
      "date": "2025-12-18",
      "id": "140456",
      "original_text": "Registerbekanntmachung nach dem Umwandlungsgesetz\nSachsen-Anhalt Amtsgericht Stendal HRB 100158\nDoppstadt Calbe GmbH – Calbe (Saale)",
      "type": "Registerbekanntmachung nach dem Umwandlungsgesetz",
      "state": "Sachsen-Anhalt",
      "amtsgericht": "Amtsgericht Stendal",
      "registernummer": "HRB 100158",
      "registerart": "HRB",
      "company_name": "Doppstadt Calbe GmbH",
      "company_seat": "Calbe (Saale)",
      "details": "18.12.2025 (Bekanntmachungsdatum)\n\nSachsen-Anhalt Amtsgericht Stendal HRB 100158\nRegisterbekanntmachung nach dem Umwandlungsgesetz 17.12.2025 (Eintragungsdatum)\n\nDoppstadt Calbe GmbH\nGesellschaft mit beschränkter Haftung\nCalbe (Saale)\n\nDie Gesellschaft ist auf Grund des Verschmelzungsvertrages vom 28.11.2025 sowie der Beschlüsse der Gesellschafterversammlungen vom selben Tag mit der Doppstadt Beteiligungs GmbH mit dem Sitz in Velbert (Amtsgericht Wuppertal HRB 19188) verschmolzen. Die Verschmelzung wurde am 17.12.2025 im Register der übernehmenden Gesellschaft eingetragen.\nNicht eingetragen:Den Gläubigern der an der Verschmelzung beteiligten Rechtsträger ist, wenn sie binnen sechs Monaten nach dem Tag, an dem die Eintragung der Verschmelzung nach § 19 Abs. 3 UmwG als bekanntgemacht gilt, ihren Anspruch nach Grund und Höhe schriftlich anmelden, Sicherheit zu leisten, soweit sie nicht Befriedigung verlangen können. Dieses Recht steht ihnen jedoch nur zu, wenn sie glaubhaft machen, dass durch die Verschmelzung die Erfüllung ihrer Forderung gefährdet wird."
    },
    {
      "date": "2025-12-18",
      "id": "140457",
      "original_text": "Löschungsankündigung\nBaden-Württemberg Amtsgericht Freiburg HRB 725203\nCBD-Market.de GmbH – Lahr",
      "type": "Löschungsankündigung",
      "state": "Baden-Württemberg",
      "amtsgericht": "Amtsgericht Freiburg",
      "registernummer": "HRB 725203",
      "registerart": "HRB",
      "company_name": "CBD-Market.de GmbH",
      "company_seat": "Lahr",
      "details": "18.12.2025 (Bekanntmachungsdatum)\n\nBaden-Württemberg Amtsgericht Freiburg HRB 725203\nLöschungsankündigung\n\nCBD-Market.de GmbH\nGesellschaft mit beschränkter Haftung\nLahr\n\nDas Gericht beabsichtigt, die Gesellschaft wegen Vermögenslosigkeit im Handelsregister von Amts wegen nach § 394 FamFG zu löschen. Die Frist zur Geltendmachung eines Widerspruchs gegen die beabsichtigte Löschung ist auf einen Monat ab Veröffentlichung bestimmt."
    },
    {
      "date": "2025-12-18",
      "id": "140458",
      "original_text": "Registerbekanntmachung nach dem Umwandlungsgesetz\nSchleswig-Holstein Amtsgericht Kiel HRB 11785\nrt Steuer + Recht GmbH Steuerberatungsgesellschaft Rechtsanwaltsgesellschaft – Kiel",
      "type": "Registerbekanntmachung nach dem Umwandlungsgesetz",
      "state": "Schleswig-Holstein",
      "amtsgericht": "Amtsgericht Kiel",
      "registernummer": "HRB 11785",
      "registerart": "HRB",
      "company_name": "rt Steuer + Recht GmbH Steuerberatungsgesellschaft Rechtsanwaltsgesellschaft",
      "company_seat": "Kiel",
      "details": "18.12.2025 (Bekanntmachungsdatum)\n\nSchleswig-Holstein Amtsgericht Kiel HRB 11785\nRegisterbekanntmachung nach dem Umwandlungsgesetz 12.12.2025 (Eintragungsdatum)\n\nrt Steuer + Recht GmbH Steuerberatungsgesellschaft Rechtsanwaltsgesellschaft\nGesellschaft mit beschränkter Haftung\nKiel\n\nZu Eintragungsnummer 17 vom 12.12.2025 wird als nicht eingetragen veröffentlicht:  Als nicht eingetragen wird veröffentlicht: Den Gläubigern ist, wenn sie binnen sechs Monaten nach dem Tag, an dem die Eintragung der Umwandlung bekannt gemacht worden ist, ihren Anspruch nach Grund und Höhe schriftlich anmelden, Sicherheit zu leisten, soweit sie nicht Befriedigung verlangen können. Dieses Recht steht den Gläubigern jedoch nur zu, wenn sie glaubhaft machen, dass durch die Umwandlung die Erfüllung ihrer Forderung gefährdet wird."
    },
    {
      "date": "2025-12-18",
      "id": "140459",
      "original_text": "Registerbekanntmachung nach dem Umwandlungsgesetz\nBerlin Amtsgericht Berlin (Charlottenburg) HRB 96473\nAkzent Personaldienstleistungen Mitte GmbH – Berlin",
      "type": "Registerbekanntmachung nach dem Umwandlungsgesetz",
      "state": "Berlin",
      "amtsgericht": "Amtsgericht Berlin (Charlottenburg)",
      "registernummer": "HRB 96473",
      "registerart": "HRB",
      "company_name": "Akzent Personaldienstleistungen Mitte GmbH",
      "company_seat": "Berlin",
      "details": "18.12.2025 (Bekanntmachungsdatum)\n\nBerlin Amtsgericht Berlin (Charlottenburg) HRB 96473\nRegisterbekanntmachung nach dem Umwandlungsgesetz 17.12.2025 (Eintragungsdatum)\n\nAkzent Personaldienstleistungen  Mitte GmbH\nGesellschaft mit beschränkter Haftung\nBerlin\n\nZu Eintragungsnummer 10 vom 17.12.2025 wird als nicht eingetragen veröffentlicht: Der andere Vertragsteil hat den Gläubigern dieses Rechtsträgers, deren Forderungen begründet worden sind, bevor die Eintragung der Beendigung dieses Vertrages in das Handelsregister nach § 10 des Handelsgesetzbuches als bekannt gemacht gilt, Sicherheit zu leisten, wenn sie sich binnen sechs Monaten nach der Bekanntmachung der Eintragung zu diesem Zweck bei ihm melden. Dieses Recht steht den Gläubigern nicht zu, die im Fall des Insolvenzverfahrens ein Recht auf vorzugsweise Befriedigung aus der Deckungsmasse haben, die nach gesetzlicher Vorschrift zu ihrem Schutz errichtet und staatlich überwacht ist."
    },
    {
      "date": "2025-12-18",
      "id": "140460",
      "original_text": "Registerbekanntmachung nach dem Umwandlungsgesetz\nBerlin Amtsgericht Berlin (Charlottenburg) HRB 248716\nDNS:NET Internet Service GmbH – Berlin",
      "type": "Registerbekanntmachung nach dem Umwandlungsgesetz",
      "state": "Berlin",
      "amtsgericht": "Amtsgericht Berlin (Charlottenburg)",
      "registernummer": "HRB 248716",
      "registerart": "HRB",
      "company_name": "DNS:NET Internet Service GmbH",
      "company_seat": "Berlin",
      "details": "18.12.2025 (Bekanntmachungsdatum)\n\nBerlin Amtsgericht Berlin (Charlottenburg) HRB 248716\nRegisterbekanntmachung nach dem Umwandlungsgesetz 17.12.2025 (Eintragungsdatum)\n\nDNS:NET Internet Service GmbH\nGesellschaft mit beschränkter Haftung\nBerlin\n\nZu Eintragungsnummer 8 vom 17.12.2025 wird als nicht eingetragen veröffentlicht: Den Gläubigern der an der Verschmelzung beteiligten Rechtsträger ist, wenn sie binnen sechs Monaten nach dem Tag, an dem die Eintragung der Verschmelzung in das Register des Sitzes desjenigen Rechtsträgers, dessen Gläubiger sie sind, als bekannt gemacht gilt, ihren Anspruch nach Grund und Höhe schriftlich anmelden, Sicherheit zu leisten, soweit sie nicht Befriedigung verlangen können. Dieses Recht steht den Gläubigern jedoch nur zu, wenn sie glaubhaft machen, dass durch die Verschmelzung die Erfüllung ihrer Forderung gefährdet wird. Das Recht, Sicherheitsleistung zu verlangen, steht Gläubigern nicht zu, die im Falle der Insolvenz ein Recht auf vorzugsweise Befriedigung aus einer Deckungsmasse haben, die nach gesetzlicher Vorschrift zu ihrem Schutz errichtet und staatlich überwacht ist."
    },
    {
      "date": "2025-12-18",
      "id": "140461",
      "original_text": "Registerbekanntmachung nach dem Umwandlungsgesetz\nBerlin Amtsgericht Berlin (Charlottenburg) HRB 101855\nDNS:NET Fiber Networks GmbH – Berlin",
      "type": "Registerbekanntmachung nach dem Umwandlungsgesetz",
      "state": "Berlin",
      "amtsgericht": "Amtsgericht Berlin (Charlottenburg)",
      "registernummer": "HRB 101855",
      "registerart": "HRB",
      "company_name": "DNS:NET Fiber Networks GmbH",
      "company_seat": "Berlin",
      "details": "18.12.2025 (Bekanntmachungsdatum)\n\nBerlin Amtsgericht Berlin (Charlottenburg) HRB 101855\nRegisterbekanntmachung nach dem Umwandlungsgesetz 17.12.2025 (Eintragungsdatum)\n\nDNS:NET Fiber Networks GmbH\nGesellschaft mit beschränkter Haftung\nBerlin\n\nZu Eintragungsnummer 6 vom 17.12.2025 wird als nicht eingetragen veröffentlicht: Den Gläubigern der an der Verschmelzung beteiligten Rechtsträger ist, wenn sie binnen sechs Monaten nach dem Tag, an dem die Eintragung der Verschmelzung in das Register des Sitzes desjenigen Rechtsträgers, dessen Gläubiger sie sind, als bekannt gemacht gilt, ihren Anspruch nach Grund und Höhe schriftlich anmelden, Sicherheit zu leisten, soweit sie nicht Befriedigung verlangen können. Dieses Recht steht den Gläubigern jedoch nur zu, wenn sie glaubhaft machen, dass durch die Verschmelzung die Erfüllung ihrer Forderung gefährdet wird. Das Recht, Sicherheitsleistung zu verlangen, steht Gläubigern nicht zu, die im Falle der Insolvenz ein Recht auf vorzugsweise Befriedigung aus einer Deckungsmasse haben, die nach gesetzlicher Vorschrift zu ihrem Schutz errichtet und staatlich überwacht ist."
    },
    {
      "date": "2025-12-18",
      "id": "140462",
      "original_text": "Registerbekanntmachung nach dem Umwandlungsgesetz\nBaden-Württemberg Amtsgericht Stuttgart HRB 737788\nMercedes-Benz Mobility AG – Stuttgart",
      "type": "Registerbekanntmachung nach dem Umwandlungsgesetz",
      "state": "Baden-Württemberg",
      "amtsgericht": "Amtsgericht Stuttgart",
      "registernummer": "HRB 737788",
      "registerart": "HRB",
      "company_name": "Mercedes-Benz Mobility AG",
      "company_seat": "Stuttgart",
      "details": "18.12.2025 (Bekanntmachungsdatum)\n\nBaden-Württemberg Amtsgericht Stuttgart HRB 737788\nRegisterbekanntmachung nach dem Umwandlungsgesetz 18.12.2025 (Eintragungsdatum)\n\nMercedes-Benz Mobility AG\nAktiengesellschaft\nStuttgart\n\nAls nicht eingetragen wird bekanntgemacht:\nDen Gläubigern der an der Verschmelzung beteiligten Rechtsträger ist, wenn sie binnen sechs Monaten nach dem Tag, an dem die Eintragung der Verschmelzung in das Register des Sitzes desjenigen Rechtsträgers, dessen Gläubiger sie sind, nach § 19 Abs. 3 UmwG als bekanntgemacht gilt, ihren Anspruch nach Grund und Höhe schriftlich anmelden, Sicherheit zu leisten, soweit sie nicht Befriedigung verlangen können. Dieses Recht steht den Gläubigern jedoch nur zu, wenn sie glaubhaft machen, dass durch die Verschmelzung die Erfüllung ihrer Forderung gefährdet wird."
    },
    {
      "date": "2025-12-18",
      "id": "140463",
      "original_text": "Einreichung neuer Dokumente\nSchleswig-Holstein Amtsgericht Flensburg HRB 6072\nDeutsches Rotes Kreuz Pflege Am Lautrupsbach gGmbH – Flensburg",
      "type": "Einreichung neuer Dokumente",
      "state": "Schleswig-Holstein",
      "amtsgericht": "Amtsgericht Flensburg",
      "registernummer": "HRB 6072",
      "registerart": "HRB",
      "company_name": "Deutsches Rotes Kreuz Pflege Am Lautrupsbach gGmbH",
      "company_seat": "Flensburg",
      "details": "18.12.2025 (Bekanntmachungsdatum)\n\nSchleswig-Holstein Amtsgericht Flensburg HRB 6072\nEinreichung neuer Dokumente\n\nDeutsches Rotes Kreuz Pflege Am Lautrupsbach gGmbH\nGesellschaft mit beschränkter Haftung\nFlensburg\n\n1. Aufsichtsratsliste eingereicht am 17.12.2025."
    },
    {
      "date": "2025-12-18",
      "id": "140464",
      "original_text": "Registerbekanntmachung nach dem Umwandlungsgesetz\nHamburg Amtsgericht Hamburg HRB 127310\nNordseecluster B GmbH – Hamburg",
      "type": "Registerbekanntmachung nach dem Umwandlungsgesetz",
      "state": "Hamburg",
      "amtsgericht": "Amtsgericht Hamburg",
      "registernummer": "HRB 127310",
      "registerart": "HRB",
      "company_name": "Nordseecluster B GmbH",
      "company_seat": "Hamburg",
      "details": "18.12.2025 (Bekanntmachungsdatum)\n\nHamburg Amtsgericht Hamburg HRB 127310\nRegisterbekanntmachung nach dem Umwandlungsgesetz 18.12.2025 (Eintragungsdatum)\n\nNordseecluster B GmbH\nGesellschaft mit beschränkter Haftung\nHamburg\n\nAls nicht eingetragen wird bekannt gemacht:\nDen Gläubigern der an der formwechselnden Umwandlung beteiligten Gesellschaften ist, wenn sie binnen sechs Monaten nach dem Tag, an dem die Eintragung der formwechselnden Umwandlung in das Register des Sitzes desjenigen Rechtsträgers, dessen Gläubiger sie sind, nach § 19 Absatz 3 UmwG als bekannt gemacht gilt, ihren Anspruch nach Grund und Höhe schriftlich anmelden, Sicherheit zu leisten, soweit sie nicht Befriedigung verlangen können. Dieses Recht steht den Gläubigern jedoch nur zu, wenn sie glaubhaft machen, dass durch die formwechselnde Umwandlung die Erfüllung ihrer Forderung gefährdet wird."
    },
    {
      "date": "2025-12-18",
      "id": "140465",
      "original_text": "Registerbekanntmachung nach dem Umwandlungsgesetz\nHamburg Amtsgericht Hamburg HRA 133092\nNordseecluster B GmbH & Co. KG – Hamburg",
      "type": "Registerbekanntmachung nach dem Umwandlungsgesetz",
      "state": "Hamburg",
      "amtsgericht": "Amtsgericht Hamburg",
      "registernummer": "HRA 133092",
      "registerart": "HRA",
      "company_name": "Nordseecluster B GmbH & Co. KG",
      "company_seat": "Hamburg",
      "details": "18.12.2025 (Bekanntmachungsdatum)\n\nHamburg Amtsgericht Hamburg HRA 133092\nRegisterbekanntmachung nach dem Umwandlungsgesetz 18.12.2025 (Eintragungsdatum)\n\nNordseecluster B GmbH & Co. KG\nKommanditgesellschaft\nHamburg\n\nAls nicht eingetragen wird bekannt gemacht:\nDen Gläubigern der an der formwechselnden Umwandlung beteiligten Gesellschaften ist, wenn sie binnen sechs Monaten nach dem Tag, an dem die Eintragung der formwechselnden Umwandlung in das Register des Sitzes desjenigen Rechtsträgers, dessen Gläubiger sie sind, nach § 19 Absatz 3 UmwG als bekannt gemacht gilt, ihren Anspruch nach Grund und Höhe schriftlich anmelden, Sicherheit zu leisten, soweit sie nicht Befriedigung verlangen können. Dieses Recht steht den Gläubigern jedoch nur zu, wenn sie glaubhaft machen, dass durch die formwechselnde Umwandlung die Erfüllung ihrer Forderung gefährdet wird."
    },
    {
      "date": "2025-12-18",
      "id": "140466",
      "original_text": "Löschungsankündigung\nMecklenburg-Vorpommern Amtsgericht Rostock HRB 13794\ntuu-hus Bau- und Immobilienmanagement GmbH – Rostock",
      "type": "Löschungsankündigung",
      "state": "Mecklenburg-Vorpommern",
      "amtsgericht": "Amtsgericht Rostock",
      "registernummer": "HRB 13794",
      "registerart": "HRB",
      "company_name": "tuu-hus Bau- und Immobilienmanagement GmbH",
      "company_seat": "Rostock",
      "details": "18.12.2025 (Bekanntmachungsdatum)\n\nMecklenburg-Vorpommern Amtsgericht Rostock HRB 13794\nLöschungsankündigung\n\ntuu-hus Bau- und Immobilienmanagement GmbH\nGesellschaft mit beschränkter Haftung\nRostock\n\nDas Registergericht beabsichtigt, die im Handelsregister eingetragene Gesellschaft von Amts wegen nach § 394 FamFG zu löschen. Die Frist zur Erhebung eines Widerspruchs gegen die beabsichtigte Löschung wird auf 1 Monat festgesetzt."
    },
    {
      "date": "2025-12-18",
      "id": "140467",
      "original_text": "Einreichung neuer Dokumente\nHamburg Amtsgericht Hamburg HRB 179725\nCommertunity AG – Hamburg",
      "type": "Einreichung neuer Dokumente",
      "state": "Hamburg",
      "amtsgericht": "Amtsgericht Hamburg",
      "registernummer": "HRB 179725",
      "registerart": "HRB",
      "company_name": "Commertunity AG",
      "company_seat": "Hamburg",
      "details": "18.12.2025 (Bekanntmachungsdatum)\n\nHamburg Amtsgericht Hamburg HRB 179725\nEinreichung neuer Dokumente\n\nCommertunity AG\nAktiengesellschaft\nHamburg\n\nAls nicht eingetragen wird bekannt gemacht: Liste des Aufsichtsrats wurde eingereicht."
    },
    {
      "date": "2025-12-18",
      "id": "140468",
      "original_text": "Löschungsankündigung\nMecklenburg-Vorpommern Amtsgericht Rostock HRB 4487\nJ & P Dentaltechnik GmbH \"Das Mundwerk\" – Rostock",
      "type": "Löschungsankündigung",
      "state": "Mecklenburg-Vorpommern",
      "amtsgericht": "Amtsgericht Rostock",
      "registernummer": "HRB 4487",
      "registerart": "HRB",
      "company_name": "J & P Dentaltechnik GmbH \"Das Mundwerk\"",
      "company_seat": "Rostock",
      "details": "18.12.2025 (Bekanntmachungsdatum)\n\nMecklenburg-Vorpommern Amtsgericht Rostock HRB 4487\nLöschungsankündigung\n\nJ & P Dentaltechnik GmbH \"Das Mundwerk\"\nGesellschaft mit beschränkter Haftung\nRostock\n\nDas Registergericht beabsichtigt, die im Handelsregister eingetragene Gesellschaft von Amts wegen nach § 394 FamFG zu löschen. Die Frist zur Erhebung eines Widerspruchs gegen die beabsichtigte Löschung wird auf 1 Monat festgesetzt."
    },
    {
      "date": "2025-12-18",
      "id": "140469",
      "original_text": "Einreichung neuer Dokumente\nBaden-Württemberg Amtsgericht Stuttgart GnR 244\nBaugenossenschaft Zuffenhausen eG – Stuttgart",
      "type": "Einreichung neuer Dokumente",
      "state": "Baden-Württemberg",
      "amtsgericht": "Amtsgericht Stuttgart",
      "registernummer": "GnR 244",
      "registerart": "GnR",
      "company_name": "Baugenossenschaft Zuffenhausen eG",
      "company_seat": "Stuttgart",
      "details": "18.12.2025 (Bekanntmachungsdatum)\n\nBaden-Württemberg Amtsgericht Stuttgart GnR 244\nEinreichung neuer Dokumente\n\nBaugenossenschaft Zuffenhausen eG\neingetragene Genossenschaft\nStuttgart\n\nDie Gesellschaft hat am 16.12.2025 die Liste über die Zusammensetzung des Aufsichtsrats zum Handelsregister eingereicht."
    },
    {
      "date": "2025-12-18",
      "id": "140470",
      "original_text": "Löschungsankündigung\nSachsen Amtsgericht Dresden HRB 11314\nKarl Pfeffer Fenster & Türen GmbH – Dresden",
      "type": "Löschungsankündigung",
      "state": "Sachsen",
      "amtsgericht": "Amtsgericht Dresden",
      "registernummer": "HRB 11314",
      "registerart": "HRB",
      "company_name": "Karl Pfeffer Fenster & Türen GmbH",
      "company_seat": "Dresden",
      "details": "18.12.2025 (Bekanntmachungsdatum)\n\nSachsen Amtsgericht Dresden HRB 11314\nLöschungsankündigung\n\nKarl Pfeffer Fenster & Türen GmbH\nGesellschaft mit beschränkter Haftung\nDresden\n\nDas Registergericht beabsichtigt, die im Handelsregister eingetragene Gesellschaft von Amts wegen nach § 394 FamFG zu löschen. Die Frist zu Erhebung eines Widerspruchs gegen die beabsichtigte Löschung wird auf einen Monat festgesetzt."
    },
    {
      "date": "2025-12-18",
      "id": "140471",
      "original_text": "Einreichung neuer Dokumente\nSachsen Amtsgericht Chemnitz HRB 32426\nKommunalBau Chemnitz GmbH (KBC) – Chemnitz",
      "type": "Einreichung neuer Dokumente",
      "state": "Sachsen",
      "amtsgericht": "Amtsgericht Chemnitz",
      "registernummer": "HRB 32426",
      "registerart": "HRB",
      "company_name": "KommunalBau Chemnitz GmbH (KBC)",
      "company_seat": "Chemnitz",
      "details": "18.12.2025 (Bekanntmachungsdatum)\n\nSachsen Amtsgericht Chemnitz HRB 32426\nEinreichung neuer Dokumente\n\nKommunalBau Chemnitz GmbH (KBC)\nGesellschaft mit beschränkter Haftung\nChemnitz\n\nAm 15.12.2025 wurde beim Handelsregister des Amtsgerichts Chemnitz die Liste der Mitglieder des Aufsichtsrats gemäß § 52 GmbHG eingereicht."
    },
    {
      "date": "2025-12-18",
      "id": "140472",
      "original_text": "Registerbekanntmachung nach dem Umwandlungsgesetz\nSachsen Amtsgericht Dresden HRB 27612\nSECUPAY AG – Pulsnitz",
      "type": "Registerbekanntmachung nach dem Umwandlungsgesetz",
      "state": "Sachsen",
      "amtsgericht": "Amtsgericht Dresden",
      "registernummer": "HRB 27612",
      "registerart": "HRB",
      "company_name": "SECUPAY AG",
      "company_seat": "Pulsnitz",
      "details": "18.12.2025 (Bekanntmachungsdatum)\n\nSachsen Amtsgericht Dresden HRB 27612\nRegisterbekanntmachung nach dem Umwandlungsgesetz\n\nSECUPAY AG\nAktiengesellschaft\nPulsnitz\n\nGemäß § 61 UmwG wird bekannt gemacht: Zum Handelsregister ist der Entwurf eines Verschmelzungsvertrages der Gesellschaft als übernehmender Gesellschaft mit der secucard GmbH mit Sitz in Dresden (Amtsgericht Dresden, HRB 35438) als übertragender Gesellschaft eingereicht worden."
    },
    {
      "date": "2025-12-18",
      "id": "140473",
      "original_text": "Registerbekanntmachung nach dem Umwandlungsgesetz\nSachsen Amtsgericht Chemnitz HRB 35713\nWindpark Niederlungwitz Struktur GmbH – Glauchau",
      "type": "Registerbekanntmachung nach dem Umwandlungsgesetz",
      "state": "Sachsen",
      "amtsgericht": "Amtsgericht Chemnitz",
      "registernummer": "HRB 35713",
      "registerart": "HRB",
      "company_name": "Windpark Niederlungwitz Struktur GmbH",
      "company_seat": "Glauchau",
      "details": "18.12.2025 (Bekanntmachungsdatum)\n\nSachsen Amtsgericht Chemnitz HRB 35713\nRegisterbekanntmachung nach dem Umwandlungsgesetz 18.12.2025 (Eintragungsdatum)\n\nWindpark Niederlungwitz Struktur GmbH\nGesellschaft mit beschränkter Haftung\nGlauchau\n\nDen Gläubigern der an der Umwandlung beteiligten Rechtsträger ist, wenn sie binnen sechs Monaten nach dem Tag, an dem die Eintragung der Umwandlung in das Register des Sitzes desjenigen Rechtsträgers, dessen Gläubiger sie sind, nach § 19 Abs. 3 UmwG als bekannt gemacht gilt, ihren Anspruch nach Grund und Höhe in Textform anmelden, Sicherheit zu leisten, soweit sie nicht Befriedigung verlangen können. Dieses Recht steht den Gläubigern jedoch nur zu, wenn sie glaubhaft machen, dass durch die Umwandlung die Erfüllung der Forderung gefährdet wird."
    },
    {
      "date": "2025-12-18",
      "id": "140474",
      "original_text": "Registerbekanntmachung nach dem Umwandlungsgesetz\nSachsen Amtsgericht Dresden HRB 26157\nForensis Capital Advisory GmbH – Dresden",
      "type": "Registerbekanntmachung nach dem Umwandlungsgesetz",
      "state": "Sachsen",
      "amtsgericht": "Amtsgericht Dresden",
      "registernummer": "HRB 26157",
      "registerart": "HRB",
      "company_name": "Forensis Capital Advisory GmbH",
      "company_seat": "Dresden",
      "details": "18.12.2025 (Bekanntmachungsdatum)\n\nSachsen Amtsgericht Dresden HRB 26157\nRegisterbekanntmachung nach dem Umwandlungsgesetz 18.12.2025 (Eintragungsdatum)\n\nForensis Capital Advisory GmbH\nGesellschaft mit beschränkter Haftung\nDresden\n\nDen Gläubigern der an der Verschmelzung beteiligten Rechtsträger ist, wenn sie binnen sechs Monaten nach dem Tag, an dem die Eintragung der Verschmelzung in das Register des Sitzes desjenigen Rechtsträgers, dessen Gläubiger sie sind, nach § 19 Abs. 3 UmwG als bekannt gemacht gilt, ihren Anspruch nach Grund und Höhe in Textform anmelden, Sicherheit zu leisten, soweit sie nicht Befriedigung verlangen können. Dieses Recht steht den Gläubigern jedoch nur zu, wenn sie glaubhaft machen, dass durch die Verschmelzung die Erfüllung der Forderung gefährdet wird. Den Gläubigern der an der Verschmelzung beteiligten Rechtsträger ist, wenn sie binnen sechs Monaten nach dem Tag, an dem die Eintragung der Verschmelzung in das Register des Sitzes desjenigen Rechtsträgers, dessen Gläubiger sie sind, nach § 19 Abs. 3 UmwG als bekannt gemacht gilt, ihren Anspruch nach Grund und Höhe in Textform anmelden, Sicherheit zu leisten, soweit sie nicht Befriedigung verlangen können. Dieses Recht steht den Gläubigern jedoch nur zu, wenn sie glaubhaft machen, dass durch die Verschmelzung die Erfüllung der Forderung gefährdet wird."
    },
    {
      "date": "2025-12-18",
      "id": "140475",
      "original_text": "Einreichung neuer Dokumente\nSachsen Amtsgericht Leipzig HRB 20859\nStädtische Altenpflegeheime Leipzig gGmbH – Leipzig",
      "type": "Einreichung neuer Dokumente",
      "state": "Sachsen",
      "amtsgericht": "Amtsgericht Leipzig",
      "registernummer": "HRB 20859",
      "registerart": "HRB",
      "company_name": "Städtische Altenpflegeheime Leipzig gGmbH",
      "company_seat": "Leipzig",
      "details": "18.12.2025 (Bekanntmachungsdatum)\n\nSachsen Amtsgericht Leipzig HRB 20859\nEinreichung neuer Dokumente\n\nStädtische Altenpflegeheime Leipzig gGmbH\nGesellschaft mit beschränkter Haftung\nLeipzig\n\nAm 17.12.2025 wurde beim Handelsregister des Amtsgerichts Leipzig die Liste der Mitglieder des Aufsichtsrats gemäß § 52 GmbHG eingereicht."
    },
    {
      "date": "2025-12-18",
      "id": "140476",
      "original_text": "Einreichung neuer Dokumente\nSachsen Amtsgericht Dresden HRB 19553\nIndustrie-Center Neustadt GmbH – Neustadt/Sachsen",
      "type": "Einreichung neuer Dokumente",
      "state": "Sachsen",
      "amtsgericht": "Amtsgericht Dresden",
      "registernummer": "HRB 19553",
      "registerart": "HRB",
      "company_name": "Industrie-Center Neustadt GmbH",
      "company_seat": "Neustadt/Sachsen",
      "details": "18.12.2025 (Bekanntmachungsdatum)\n\nSachsen Amtsgericht Dresden HRB 19553\nEinreichung neuer Dokumente\n\nIndustrie-Center Neustadt GmbH\nGesellschaft mit beschränkter Haftung\nNeustadt/Sachsen\n\nAm 17.12.2025 wurde beim Handelsregister des Amtsgerichts Dresden die Liste der Mitglieder des Aufsichtsrats gemäß § 52 GmbHG eingereicht."
    },
    {
      "date": "2025-12-18",
      "id": "140477",
      "original_text": "Löschungsankündigung\nSachsen Amtsgericht Dresden HRB 39318\nEventum UG (haftungsbeschränkt) – Dresden",
      "type": "Löschungsankündigung",
      "state": "Sachsen",
      "amtsgericht": "Amtsgericht Dresden",
      "registernummer": "HRB 39318",
      "registerart": "HRB",
      "company_name": "Eventum UG (haftungsbeschränkt)",
      "company_seat": "Dresden",
      "details": "18.12.2025 (Bekanntmachungsdatum)\n\nSachsen Amtsgericht Dresden HRB 39318\nLöschungsankündigung\n\nEventum UG (haftungsbeschränkt)\nGesellschaft mit beschränkter Haftung\nDresden\n\nDas Registergericht beabsichtigt, die im Handelsregister eingetragene Gesellschaft von Amts wegen nach § 394 FamFG zu löschen. Die Frist zu Erhebung eines Widerspruchs gegen die beabsichtigte Löschung wird auf einen Monat festgesetzt."
    },
    {
      "date": "2025-12-18",
      "id": "140478",
      "original_text": "Registerbekanntmachung nach dem Umwandlungsgesetz\nNiedersachsen Amtsgericht Oldenburg (Oldenburg) HRB 208275\nWINSTORM-CLP GmbH – Cloppenburg",
      "type": "Registerbekanntmachung nach dem Umwandlungsgesetz",
      "state": "Niedersachsen",
      "amtsgericht": "Amtsgericht Oldenburg (Oldenburg)",
      "registernummer": "HRB 208275",
      "registerart": "HRB",
      "company_name": "WINSTORM-CLP GmbH",
      "company_seat": "Cloppenburg",
      "details": "18.12.2025 (Bekanntmachungsdatum)\n\nNiedersachsen Amtsgericht Oldenburg (Oldenburg) HRB 208275\nRegisterbekanntmachung nach dem Umwandlungsgesetz 18.12.2025 (Eintragungsdatum)\n\nWINSTORM-CLP GmbH\nGesellschaft mit beschränkter Haftung\nCloppenburg\n\nDen Gläubigern der an der Verschmelzung beteiligten Rechtsträger ist, wenn sie binnen sechs Monaten nach dem Tag, an dem die Eintragung der Verschmelzung in das Register des Sitzes desjenigen Rechtsträgers, dessen Gläubiger sie sind, nach § 19  Abs.  3 UmwG als bekannt gemacht gilt, ihren Anspruch nach Grund und Höhe schriftlich anmelden, Sicherheit zu leisten, soweit sie nicht Befriedigung verlangen können. Dieses Recht steht den Gläubigern jedoch nur zu, wenn sie glaubhaft machen, dass durch die Verschmelzung die Erfüllung der Forderung gefährdet wird."
    },
    {
      "date": "2025-12-18",
      "id": "140479",
      "original_text": "Registerbekanntmachung nach dem Umwandlungsgesetz\nNiedersachsen Amtsgericht Oldenburg (Oldenburg) HRA 208876\nAdam Transport, Inh. Ludmilla Fröhlich e. K. – Delmenhorst",
      "type": "Registerbekanntmachung nach dem Umwandlungsgesetz",
      "state": "Niedersachsen",
      "amtsgericht": "Amtsgericht Oldenburg (Oldenburg)",
      "registernummer": "HRA 208876",
      "registerart": "HRA",
      "company_name": "Adam Transport, Inh. Ludmilla Fröhlich e. K.",
      "company_seat": "Delmenhorst",
      "details": "18.12.2025 (Bekanntmachungsdatum)\n\nNiedersachsen Amtsgericht Oldenburg (Oldenburg) HRA 208876\nRegisterbekanntmachung nach dem Umwandlungsgesetz 18.12.2025 (Eintragungsdatum)\n\nAdam Transport, Inh. Ludmilla Fröhlich e. K.\nEinzelkaufmann / Einzelkauffrau\nDelmenhorst\n\nDen Gläubigern der an der Ausgliederung beteiligten Rechtsträger ist, wenn sie binnen sechs Monaten nach dem Tag, an dem die Eintragung der Ausgliederung in das Register des Sitzes desjenigen Rechtsträgers, dessen Gläubiger sie sind, nach § 19 Abs. 3 UmwG als bekannt gemacht gilt, ihren Anspruch nach Grund und Höhe schriftlich anmelden, Sicherheit zu leisten, soweit sie nicht Befriedigung verlangen können. Dieses Recht steht den Gläubigern jedoch nur zu, wenn sie glaubhaft machen, dass durch die Ausgliederung die Erfüllung der Forderung gefährdet wird."
    },
    {
      "date": "2025-12-18",
      "id": "140480",
      "original_text": "Registerbekanntmachung nach dem Umwandlungsgesetz\nNiedersachsen Amtsgericht Braunschweig HRB 209492\nFlorian Kroker Beteiligungs-GmbH – Braunschweig",
      "type": "Registerbekanntmachung nach dem Umwandlungsgesetz",
      "state": "Niedersachsen",
      "amtsgericht": "Amtsgericht Braunschweig",
      "registernummer": "HRB 209492",
      "registerart": "HRB",
      "company_name": "Florian Kroker Beteiligungs-GmbH",
      "company_seat": "Braunschweig",
      "details": "18.12.2025 (Bekanntmachungsdatum)\n\nNiedersachsen Amtsgericht Braunschweig HRB 209492\nRegisterbekanntmachung nach dem Umwandlungsgesetz 18.12.2025 (Eintragungsdatum)\n\nFlorian Kroker Beteiligungs-GmbH\nGesellschaft mit beschränkter Haftung\nBraunschweig\n\nDen Gläubigern der an der Verschmelzung beteiligten Rechtsträger ist, wenn sie binnen sechs Monaten nach dem Tag, an dem die Eintragung der Verschmelzung in das Register des Sitzes desjenigen Rechtsträgers, dessen Gläubiger sie sind, nach § 19  Abs.  3 UmwG als bekannt gemacht gilt, ihren Anspruch nach Grund und Höhe schriftlich anmelden, Sicherheit zu leisten, soweit sie nicht Befriedigung verlangen können. Dieses Recht steht den Gläubigern jedoch nur zu, wenn sie glaubhaft machen, dass durch die Verschmelzung die Erfüllung der Forderung gefährdet wird."
    },
    {
      "date": "2025-12-18",
      "id": "140481",
      "original_text": "Registerbekanntmachung nach dem Umwandlungsgesetz\nNiedersachsen Amtsgericht Oldenburg (Oldenburg) HRB 214581\nMHGlenz UG (haftungsbeschränkt) – Oldenburg",
      "type": "Registerbekanntmachung nach dem Umwandlungsgesetz",
      "state": "Niedersachsen",
      "amtsgericht": "Amtsgericht Oldenburg (Oldenburg)",
      "registernummer": "HRB 214581",
      "registerart": "HRB",
      "company_name": "MHGlenz UG (haftungsbeschränkt)",
      "company_seat": "Oldenburg",
      "details": "18.12.2025 (Bekanntmachungsdatum)\n\nNiedersachsen Amtsgericht Oldenburg (Oldenburg) HRB 214581\nRegisterbekanntmachung nach dem Umwandlungsgesetz\n\nMHGlenz UG (haftungsbeschränkt)\nGesellschaft mit beschränkter Haftung\nOldenburg\n\nDen Gläubigern der an der Verschmelzung beteiligten Rechtsträger ist, wenn sie binnen sechs Monaten nach dem Tag, an dem die Eintragung der Verschmelzung in das Register des Sitzes desjenigen Rechtsträgers, dessen Gläubiger sie sind, nach § 19  Abs.  3 UmwG als bekannt gemacht gilt, ihren Anspruch nach Grund und Höhe schriftlich anmelden, Sicherheit zu leisten, soweit sie nicht Befriedigung verlangen können. Dieses Recht steht den Gläubigern jedoch nur zu, wenn sie glaubhaft machen, dass durch die Verschmelzung die Erfüllung der Forderung gefährdet wird."
    },
    {
      "date": "2025-12-18",
      "id": "140482",
      "original_text": "Registerbekanntmachung nach dem Umwandlungsgesetz\nNiedersachsen Amtsgericht Oldenburg (Oldenburg) HRB 151133 früher Amtsgericht Cloppenburg\nINFO GmbH Institut für Hypertonie- und Herz-Kreislauf-Forschung – Cloppenburg",
      "type": "Registerbekanntmachung nach dem Umwandlungsgesetz",
      "state": "Niedersachsen",
      "amtsgericht": "Amtsgericht Oldenburg (Oldenburg)",
      "registernummer": "HRB 151133",
      "registerart": "HRB",
      "company_name": "INFO GmbH Institut für Hypertonie- und Herz-Kreislauf-Forschung",
      "company_seat": "Cloppenburg",
      "former_amtsgericht": "Cloppenburg",
      "details": "18.12.2025 (Bekanntmachungsdatum)\n\nNiedersachsen Amtsgericht Oldenburg (Oldenburg) HRB 151133 früher Amtsgericht Cloppenburg\nRegisterbekanntmachung nach dem Umwandlungsgesetz 18.12.2025 (Eintragungsdatum)\n\nINFO GmbH Institut für Hypertonie- und Herz-Kreislauf-Forschung\nGesellschaft mit beschränkter Haftung\nCloppenburg\n\nDen Gläubigern der an der Verschmelzung beteiligten Rechtsträger ist, wenn sie binnen sechs Monaten nach dem Tag, an dem die Eintragung der Verschmelzung in das Register des Sitzes desjenigen Rechtsträgers, dessen Gläubiger sie sind, nach § 19  Abs.  3 UmwG als bekannt gemacht gilt, ihren Anspruch nach Grund und Höhe schriftlich anmelden, Sicherheit zu leisten, soweit sie nicht Befriedigung verlangen können. Dieses Recht steht den Gläubigern jedoch nur zu, wenn sie glaubhaft machen, dass durch die Verschmelzung die Erfüllung der Forderung gefährdet wird."
    },
    {
      "date": "2025-12-18",
      "id": "140483",
      "original_text": "Registerbekanntmachung nach dem Umwandlungsgesetz\nNiedersachsen Amtsgericht Oldenburg (Oldenburg) HRB 216322\nSpedition Knorr GmbH – Visbek-Rechterfeld",
      "type": "Registerbekanntmachung nach dem Umwandlungsgesetz",
      "state": "Niedersachsen",
      "amtsgericht": "Amtsgericht Oldenburg (Oldenburg)",
      "registernummer": "HRB 216322",
      "registerart": "HRB",
      "company_name": "Spedition Knorr GmbH",
      "company_seat": "Visbek-Rechterfeld",
      "details": "18.12.2025 (Bekanntmachungsdatum)\n\nNiedersachsen Amtsgericht Oldenburg (Oldenburg) HRB 216322\nRegisterbekanntmachung nach dem Umwandlungsgesetz 18.12.2025 (Eintragungsdatum)\n\nSpedition Knorr GmbH\nGesellschaft mit beschränkter Haftung\nVisbek-Rechterfeld\n\nDen Gläubigern der an der Verschmelzung beteiligten Rechtsträger ist, wenn sie binnen sechs Monaten nach dem Tag, an dem die Eintragung der Verschmelzung in das Register des Sitzes desjenigen Rechtsträgers, dessen Gläubiger sie sind, nach § 19  Abs.  3 UmwG als bekannt gemacht gilt, ihren Anspruch nach Grund und Höhe schriftlich anmelden, Sicherheit zu leisten, soweit sie nicht Befriedigung verlangen können. Dieses Recht steht den Gläubigern jedoch nur zu, wenn sie glaubhaft machen, dass durch die Verschmelzung die Erfüllung der Forderung gefährdet wird."
    },
    {
      "date": "2025-12-18",
      "id": "140484",
      "original_text": "Registerbekanntmachung nach dem Umwandlungsgesetz\nNiedersachsen Amtsgericht Oldenburg (Oldenburg) HRB 110845 früher Amtsgericht Vechta\nMega Logistik & Service GmbH – Rechterfeld",
      "type": "Registerbekanntmachung nach dem Umwandlungsgesetz",
      "state": "Niedersachsen",
      "amtsgericht": "Amtsgericht Oldenburg (Oldenburg)",
      "registernummer": "HRB 110845",
      "registerart": "HRB",
      "company_name": "Mega Logistik & Service GmbH",
      "company_seat": "Rechterfeld",
      "former_amtsgericht": "Vechta",
      "details": "18.12.2025 (Bekanntmachungsdatum)\n\nNiedersachsen Amtsgericht Oldenburg (Oldenburg) HRB 110845 früher Amtsgericht Vechta\nRegisterbekanntmachung nach dem Umwandlungsgesetz 18.12.2025 (Eintragungsdatum)\n\nMega Logistik & Service GmbH\nGesellschaft mit beschränkter Haftung\nRechterfeld\n\nDen Gläubigern der an der Verschmelzung beteiligten Rechtsträger ist, wenn sie binnen sechs Monaten nach dem Tag, an dem die Eintragung der Verschmelzung in das Register des Sitzes desjenigen Rechtsträgers, dessen Gläubiger sie sind, nach § 19  Abs.  3 UmwG als bekannt gemacht gilt, ihren Anspruch nach Grund und Höhe schriftlich anmelden, Sicherheit zu leisten, soweit sie nicht Befriedigung verlangen können. Dieses Recht steht den Gläubigern jedoch nur zu, wenn sie glaubhaft machen, dass durch die Verschmelzung die Erfüllung der Forderung gefährdet wird."
    },
    {
      "date": "2025-12-18",
      "id": "140485",
      "original_text": "Löschungsankündigung\nNiedersachsen Amtsgericht Lüneburg HRB 204626\nMasannek-Bau GmbH – Munster",
      "type": "Löschungsankündigung",
      "state": "Niedersachsen",
      "amtsgericht": "Amtsgericht Lüneburg",
      "registernummer": "HRB 204626",
      "registerart": "HRB",
      "company_name": "Masannek-Bau GmbH",
      "company_seat": "Munster",
      "details": "18.12.2025 (Bekanntmachungsdatum)\n\nNiedersachsen Amtsgericht Lüneburg HRB 204626\nLöschungsankündigung\n\nMasannek-Bau GmbH\nGesellschaft mit beschränkter Haftung\nMunster\n\nDas Registergericht beabsichtigt, die Gesellschaft von Amts wegen nach § 394 FamFG zu löschen. Die Frist zur Erhebung eines Widerspruchs ist auf 1 Monat ab dieser Registerbekanntmachung festgesetzt."
    },
    {
      "date": "2025-12-18",
      "id": "140486",
      "original_text": "Registerbekanntmachung nach dem Umwandlungsgesetz\nSachsen Amtsgericht Chemnitz HRB 30843\nDDV Döbeln GmbH – Döbeln",
      "type": "Registerbekanntmachung nach dem Umwandlungsgesetz",
      "state": "Sachsen",
      "amtsgericht": "Amtsgericht Chemnitz",
      "registernummer": "HRB 30843",
      "registerart": "HRB",
      "company_name": "DDV Döbeln GmbH",
      "company_seat": "Döbeln",
      "details": "18.12.2025 (Bekanntmachungsdatum)\n\nSachsen Amtsgericht Chemnitz HRB 30843\nRegisterbekanntmachung nach dem Umwandlungsgesetz 18.12.2025 (Eintragungsdatum)\n\nDDV Döbeln GmbH\nGesellschaft mit beschränkter Haftung\nDöbeln\n\nDen Gläubigern der an der Verschmelzung beteiligten Rechtsträger ist, wenn sie binnen sechs Monaten nach dem Tag, an dem die Eintragung der Verschmelzung in das Register des Sitzes desjenigen Rechtsträgers, dessen Gläubiger sie sind, nach § 19 Abs. 3 UmwG als bekannt gemacht gilt, ihren Anspruch nach Grund und Höhe in Textform anmelden, Sicherheit zu leisten, soweit sie nicht Befriedigung verlangen können. Dieses Recht steht den Gläubigern jedoch nur zu, wenn sie glaubhaft machen, dass durch die Verschmelzung die Erfüllung der Forderung gefährdet wird."
    },
    {
      "date": "2025-12-18",
      "id": "140487",
      "original_text": "Registerbekanntmachung nach dem Umwandlungsgesetz\nRheinland-Pfalz Amtsgericht Kaiserslautern HRB 33068\nWIWIN Green Impact Fund GmbH – Gerbach",
      "type": "Registerbekanntmachung nach dem Umwandlungsgesetz",
      "state": "Rheinland-Pfalz",
      "amtsgericht": "Amtsgericht Kaiserslautern",
      "registernummer": "HRB 33068",
      "registerart": "HRB",
      "company_name": "WIWIN Green Impact Fund GmbH",
      "company_seat": "Gerbach",
      "details": "18.12.2025 (Bekanntmachungsdatum)\n\nRheinland-Pfalz Amtsgericht Kaiserslautern HRB 33068\nRegisterbekanntmachung nach dem Umwandlungsgesetz 18.12.2025 (Eintragungsdatum)\n\nWIWIN Green Impact Fund GmbH\nGesellschaft mit beschränkter Haftung\nGerbach\n\nAls nicht eingetragen wird veröffentlicht: Den Gläubigern der an der Verschmelzung beteiligten Rechtsträger ist, wenn sie binnen sechs Monaten nach dem Tag, an dem die Eintragung der Verschmelzung in das Register des Sitzes desjenigen Rechtsträgers,dessen Gläubiger sie sind, nach § 19 Abs. 3 UmwG als bekannt gemacht gilt, ihren Anspruch nach Grund und Höhe schriftlich anmelden, Sicherheit zu leisten, soweit sie nicht Befriedigung verlangen können. Dieses Recht steht den Gläubigern jedoch nur zu, wenn sie glaubhaft machen, dass durch die Verschmelzung die Erfüllung der Forderung gefährdet wird.\nDie Gesellschaft hat Gläubigern, deren Forderungen vor dieser Bekanntmachung begründet worden sind, Sicherheit zu leisten, soweit sie nicht Befriedigung verlangen können, wenn sie sich binnen sechs Monaten zu diesem Zweck melden."
    },
    {
      "date": "2025-12-18",
      "id": "140488",
      "original_text": "Registerbekanntmachung nach dem Umwandlungsgesetz\nRheinland-Pfalz Amtsgericht Koblenz HRA 20438\nADW Industriebedarf Verpackungsmittel Inh. Alfred Doll e.K. – Nickenich",
      "type": "Registerbekanntmachung nach dem Umwandlungsgesetz",
      "state": "Rheinland-Pfalz",
      "amtsgericht": "Amtsgericht Koblenz",
      "registernummer": "HRA 20438",
      "registerart": "HRA",
      "company_name": "ADW Industriebedarf Verpackungsmittel Inh. Alfred Doll e.K.",
      "company_seat": "Nickenich",
      "details": "18.12.2025 (Bekanntmachungsdatum)\n\nRheinland-Pfalz Amtsgericht Koblenz HRA 20438\nRegisterbekanntmachung nach dem Umwandlungsgesetz 18.12.2025 (Eintragungsdatum)\n\nADW Industriebedarf Verpackungsmittel Inh. Alfred Doll e.K.\nEinzelkaufmann / Einzelkauffrau\nNickenich\n\nAls nicht eingetragen wird veröffentlicht: Den Gläubigern der an der Ausgliederung beteiligten Rechtsträger ist, wenn sie binnen sechs Monaten nac hdem Tag, an dem die Eintragung der Ausgliederung in das Register des Sitzes desjenigen Rechtsträgers,dessen Gläubiger sie sind, nach § 19 Abs. 3 UmwG als bekannt gemacht gilt, ihren Anspruch nach Grund und Höhe schriftlich anmelden, Sicherheit zu leisten, soweit sie nicht Befriedigung verlangen können. Dieses Recht steht den Gläubigern jedoch nur zu, wenn sie glaubhaft machen, dass durch die Ausgliederung die Erfüllung der Forderung gefährdet wird."
    },
    {
      "date": "2025-12-18",
      "id": "140489",
      "original_text": "Sonstige Registerbekanntmachung\nRheinland-Pfalz Amtsgericht Mainz HRB 51356\nJUWI GmbH – Wörrstadt",
      "type": "Sonstige Registerbekanntmachung",
      "state": "Rheinland-Pfalz",
      "amtsgericht": "Amtsgericht Mainz",
      "registernummer": "HRB 51356",
      "registerart": "HRB",
      "company_name": "JUWI GmbH",
      "company_seat": "Wörrstadt",
      "details": "18.12.2025 (Bekanntmachungsdatum)\n\nRheinland-Pfalz Amtsgericht Mainz HRB 51356\nSonstige Registerbekanntmachung\n\nJUWI GmbH\nGesellschaft mit beschränkter Haftung\nWörrstadt\n\nDem Registergericht ist eine neue Liste der Mitglieder des Aufsichtsrates eingereicht worden."
    },
    {
      "date": "2025-12-18",
      "id": "140490",
      "original_text": "Registerbekanntmachung nach dem Umwandlungsgesetz\nRheinland-Pfalz Amtsgericht Kaiserslautern HRB 33266\nwiwin GmbH – Gerbach",
      "type": "Registerbekanntmachung nach dem Umwandlungsgesetz",
      "state": "Rheinland-Pfalz",
      "amtsgericht": "Amtsgericht Kaiserslautern",
      "registernummer": "HRB 33266",
      "registerart": "HRB",
      "company_name": "wiwin GmbH",
      "company_seat": "Gerbach",
      "details": "18.12.2025 (Bekanntmachungsdatum)\n\nRheinland-Pfalz Amtsgericht Kaiserslautern HRB 33266\nRegisterbekanntmachung nach dem Umwandlungsgesetz 18.12.2025 (Eintragungsdatum)\n\nwiwin GmbH\nGesellschaft mit beschränkter Haftung\nGerbach\n\nAls nicht eingetragen wird veröffentlicht: Den Gläubigern der an der Verschmelzung beteiligten Rechtsträger ist, wenn sie binnen sechs Monaten nach dem Tag, an dem die Eintragung der Verschmelzung in das Register des Sitzes desjenigen Rechtsträgers,dessen Gläubiger sie sind, nach § 19 Abs. 3 UmwG als bekannt gemacht gilt, ihren Anspruch nach Grund und Höhe schriftlich anmelden, Sicherheit zu leisten, soweit sie nicht Befriedigung verlangen können. Dieses Recht steht den Gläubigern jedoch nur zu, wenn sie glaubhaft machen, dass durch die Verschmelzung die Erfüllung der Forderung gefährdet wird.\nDie Gesellschaft hat Gläubigern, deren Forderungen vor dieser Bekanntmachung begründet worden sind, Sicherheit zu leisten, soweit sie nicht Befriedigung verlangen können, wenn sie sich binnen sechs Monaten zu diesem Zweck melden."
    },
    {
      "date": "2025-12-18",
      "id": "140491",
      "original_text": "Registerbekanntmachung nach dem Umwandlungsgesetz\nBremen Amtsgericht Bremen HRB 31293\nAWO Service GmbH – Bremerhaven",
      "type": "Registerbekanntmachung nach dem Umwandlungsgesetz",
      "state": "Bremen",
      "amtsgericht": "Amtsgericht Bremen",
      "registernummer": "HRB 31293",
      "registerart": "HRB",
      "company_name": "AWO Service GmbH",
      "company_seat": "Bremerhaven",
      "details": "18.12.2025 (Bekanntmachungsdatum)\n\nBremen Amtsgericht Bremen HRB 31293\nRegisterbekanntmachung nach dem Umwandlungsgesetz 16.12.2025 (Eintragungsdatum)\n\nAWO Service GmbH\nGesellschaft mit beschränkter Haftung\nBremerhaven\n\nZu Eintragungsnummer 6 vom 16.12.2025 wird als nicht eingetragen veröffentlicht: Den Gläubigern der an der Verschmelzung beteiligten Rechtsträger ist, wenn sie binnen sechs Monaten nach dem Tag, an dem die Eintragung der Verschmelzung in das Register des Sitzes desjenigen Rechtsträgers, dessen Gläubiger sie sind, als bekannt gemacht gilt, ihren Anspruch nach Grund und Höhe schriftlich anmelden, Sicherheit zu leisten, soweit sie nicht Befriedigung verlangen können. Dieses Recht steht den Gläubigern jedoch nur zu, wenn sie glaubhaft machen, dass durch die Verschmelzung die Erfüllung ihrer Forderung gefährdet wird. Das Recht, Sicherheitsleistung zu verlangen, steht Gläubigern nicht zu, die im Falle der Insolvenz ein Recht auf vorzugsweise Befriedigung aus einer Deckungsmasse haben, die nach gesetzlicher Vorschrift zu ihrem Schutz errichtet und staatlich überwacht ist."
    },
    {
      "date": "2025-12-18",
      "id": "140492",
      "original_text": "Löschungsankündigung\nBremen Amtsgericht Bremen HRB 29491\ndie Prozessberater GmbH – Bremen",
      "type": "Löschungsankündigung",
      "state": "Bremen",
      "amtsgericht": "Amtsgericht Bremen",
      "registernummer": "HRB 29491",
      "registerart": "HRB",
      "company_name": "die Prozessberater GmbH",
      "company_seat": "Bremen",
      "details": "18.12.2025 (Bekanntmachungsdatum)\n\nBremen Amtsgericht Bremen HRB 29491\nLöschungsankündigung\n\ndie Prozessberater GmbH\nGesellschaft mit beschränkter Haftung\nBremen\n\nEs ist beabsichtigt die im Handelsregister eingetragene Gesellschaft von Amts wegen gemäß § 394 FamFG zu löschen. Gegen die Löschung kann beim AG Bremen schriftlich oder zu Protokoll der Geschäftsstelle Widerspruch eingelegt werden. Widerspruchsfrist 4 Wochen."
    },
    {
      "date": "2025-12-18",
      "id": "140493",
      "original_text": "Registerbekanntmachung nach dem Umwandlungsgesetz\nRheinland-Pfalz Amtsgericht Koblenz HRB 31165\nADW Verpackungen GmbH – Nickenich",
      "type": "Registerbekanntmachung nach dem Umwandlungsgesetz",
      "state": "Rheinland-Pfalz",
      "amtsgericht": "Amtsgericht Koblenz",
      "registernummer": "HRB 31165",
      "registerart": "HRB",
      "company_name": "ADW Verpackungen GmbH",
      "company_seat": "Nickenich",
      "details": "18.12.2025 (Bekanntmachungsdatum)\n\nRheinland-Pfalz Amtsgericht Koblenz HRB 31165\nRegisterbekanntmachung nach dem Umwandlungsgesetz 18.12.2025 (Eintragungsdatum)\n\nADW Verpackungen GmbH\nGesellschaft mit beschränkter Haftung\nNickenich\n\nAls nicht eingetragen wird veröffentlicht: Den Gläubigern der an der Ausgliederung beteiligten Rechtsträger ist, wenn sie binnen sechs Monaten nac hdem Tag, an dem die Eintragung der Ausgliederung in das Register des Sitzes desjenigen Rechtsträgers,dessen Gläubiger sie sind, nach § 19 Abs. 3 UmwG als bekannt gemacht gilt, ihren Anspruch nach Grund und Höhe schriftlich anmelden, Sicherheit zu leisten, soweit sie nicht Befriedigung verlangen können. Dieses Recht steht den Gläubigern jedoch nur zu, wenn sie glaubhaft machen, dass durch die Ausgliederung die Erfüllung der Forderung gefährdet wird."
    },
    {
      "date": "2025-12-18",
      "id": "140494",
      "original_text": "Löschungsankündigung\nNordrhein-Westfalen Amtsgericht Wuppertal HRB 17554\nKarrenberg Verwaltungs-GmbH. – Velbert",
      "type": "Löschungsankündigung",
      "state": "Nordrhein-Westfalen",
      "amtsgericht": "Amtsgericht Wuppertal",
      "registernummer": "HRB 17554",
      "registerart": "HRB",
      "company_name": "Karrenberg Verwaltungs-GmbH.",
      "company_seat": "Velbert",
      "details": "18.12.2025 (Bekanntmachungsdatum)\n\nNordrhein-Westfalen Amtsgericht Wuppertal HRB 17554\nLöschungsankündigung\n\nKarrenberg Verwaltungs-GmbH.\nGesellschaft mit beschränkter Haftung\nVelbert\n\nDas Registergericht beabsichtigt die Gesellschaft von Amts wegen nach § 394 FamFG zu löschen. Die Frist zur Erhebung eines Widerspruchs ist auf einen Monat festgesetzt."
    },
    {
      "date": "2025-12-18",
      "id": "140495",
      "original_text": "Registerbekanntmachung nach dem Umwandlungsgesetz\nNordrhein-Westfalen Amtsgericht Bielefeld HRB 45557\nGeno immobilien GmbH – Bielefeld",
      "type": "Registerbekanntmachung nach dem Umwandlungsgesetz",
      "state": "Nordrhein-Westfalen",
      "amtsgericht": "Amtsgericht Bielefeld",
      "registernummer": "HRB 45557",
      "registerart": "HRB",
      "company_name": "Geno immobilien GmbH",
      "company_seat": "Bielefeld",
      "details": "18.12.2025 (Bekanntmachungsdatum)\n\nNordrhein-Westfalen Amtsgericht Bielefeld HRB 45557\nRegisterbekanntmachung nach dem Umwandlungsgesetz 18.12.2025 (Eintragungsdatum)\n\nGeno immobilien GmbH\nGesellschaft mit beschränkter Haftung\nBielefeld\n\nDen Gläubigern der an der Verschmelzung beteiligten Rechtsträger ist, wenn sie binnen sechs Monaten nach dem Tag, an dem die Eintragung der Verschmelzung in das Register des Sitzes desjenigen Rechtsträgers, dessen Gläubiger sie sind, nach § 19 Absatz 3 UmwG als bekanntgemacht gilt, ihren Anspruch nach Grund und Höhe schriftlich anmelden, Sicherheit zu leisten, soweit sie nicht Befriedigung verlangen können. Dieses Recht steht den Gläubigern jedoch nur zu, wenn sie glaubhaft machen, dass durch die Verschmelzung die Erfüllung ihrer Forderung gefährdet wird."
    },
    {
      "date": "2025-12-18",
      "id": "140496",
      "original_text": "Löschungsankündigung\nNordrhein-Westfalen Amtsgericht Düsseldorf HRB 85958\nRohrreinigung24 GmbH – Monheim am Rhein",
      "type": "Löschungsankündigung",
      "state": "Nordrhein-Westfalen",
      "amtsgericht": "Amtsgericht Düsseldorf",
      "registernummer": "HRB 85958",
      "registerart": "HRB",
      "company_name": "Rohrreinigung24 GmbH",
      "company_seat": "Monheim am Rhein",
      "details": "18.12.2025 (Bekanntmachungsdatum)\n\nNordrhein-Westfalen Amtsgericht Düsseldorf HRB 85958\nLöschungsankündigung\n\nRohrreinigung24 GmbH\nGesellschaft mit beschränkter Haftung\nMonheim am Rhein\n\nDas Registergericht beabsichtigt die Gesellschaft von Amts wegen nach § 394 FamFG zu löschen. Die Frist zur Erhebung eines Widerspruchs ist auf 3 Wochen festgesetzt.\n\nRechtsbehelfsbelehrung:\nDas Widerspruchsrecht steht jedem zu, der an der Unterlassung der Löschung ein berechtigtes Interesse hat. Der Widerspruch ist bei dem Amtsgericht Düsseldorf -Registergericht-, Werdener Straße 1, 40227 Düsseldorf schriftlich in deutscher Sprache oder zur Niederschrift der Geschäftsstelle einzulegen. Der Widerspruch kann auch zur Niederschrift der Geschäftsstelle eines jeden Amtsgerichtes abgegeben werden. Die Einlegung ist auch durch Übertragung eines elektronischen Dokuments an die elektronische Poststelle des Gerichts möglich. Das elektronische Dokument muss für die Bearbeitung durch das Gericht geeignet und mit einer qualifizierten elektronischen Signatur der verantwortenden Person versehen sein oder von der verantwortenden Person signiert und auf einem sicheren Übermittlungsweg gemäß § 130a ZPO nach näherer Maßgabe der Verordnung über die technischen Rahmenbedingungen des elektronischen Rechtsverkehrs und über das besondere elektronische Behördenpostfach (BGBl. I, S.3803) eingereicht werden. Weitere Informationen erhalten Sie auf der Internetseite www.justiz.de.\nDer Widerspruch muss spätestens innerhalb der gesetzten Frist nach dem Datum der Bekanntmachung der Löschungsankündigung bei dem Amtsgericht - Registergericht - Düsseldorf eingegangen sein.  Dies gilt auch dann, wenn der Widerspruch zur Niederschrift der Geschäftsstelle eines anderen Amtsgerichtes abgegeben wurde. Die Frist beginnt mit dem Tage der Bekanntmachung der Löschungsankündigung in dem für die Bekanntmachung der Eintragungen in das Handelsregister bestimmten elektronischen Informations- und Kommunikationssystem nach § 10 des Handelsgesetzbuches. Fällt das Ende der Frist auf einen Sonntag, einen allgemeinen Feiertag oder Sonnabend, so endet die Frist mit Ablauf des nächsten Werktages.\nDer Widerspruch muss die Bezeichnung der angefochtenen Löschungsankündigung sowie die Erklärung enthalten, dass Widerspruch gegen diese Löschungsankündigung eingelegt wird. Er ist zu unterzeichnen und soll begründet werden."
    },
    {
      "date": "2025-12-18",
      "id": "140497",
      "original_text": "Registerbekanntmachung nach dem Umwandlungsgesetz\nNordrhein-Westfalen Amtsgericht Arnsberg HRB 16222\nHoher Knochen GmbH – Schmallenberg",
      "type": "Registerbekanntmachung nach dem Umwandlungsgesetz",
      "state": "Nordrhein-Westfalen",
      "amtsgericht": "Amtsgericht Arnsberg",
      "registernummer": "HRB 16222",
      "registerart": "HRB",
      "company_name": "Hoher Knochen GmbH",
      "company_seat": "Schmallenberg",
      "details": "18.12.2025 (Bekanntmachungsdatum)\n\nNordrhein-Westfalen Amtsgericht Arnsberg HRB 16222\nRegisterbekanntmachung nach dem Umwandlungsgesetz 18.12.2025 (Eintragungsdatum)\n\nHoher Knochen GmbH\nGesellschaft mit beschränkter Haftung\nSchmallenberg\n\nDen Gläubigern der an der Ausgliederung beteiligten Rechtsträger ist, wenn sie binnen sechs Monaten nach dem Tag, an dem die Eintragung der Ausgliederung in das Register des Sitzes desjenigen Rechtsträgers, dessen Gläubiger sie sind, nach § 19 Absatz 3 UmwG als bekanntgemacht gilt, ihren Anspruch nach Grund und Höhe schriftlich anmelden, Sicherheit zu leisten, soweit sie nicht Befriedigung verlangen können. Dieses Recht steht den Gläubigern jedoch nur zu, wenn sie glaubhaft machen, dass durch die Ausgliederung die Erfüllung ihrer Forderung gefährdet wird."
    },
    {
      "date": "2025-12-18",
      "id": "140498",
      "original_text": "Löschungsankündigung\nNordrhein-Westfalen Amtsgericht Wuppertal HRB 23323\nLuWer Personaldienstleistung Gesellschaft für Arbeit auf Zeit und Personalentwicklung mbH – Solingen",
      "type": "Löschungsankündigung",
      "state": "Nordrhein-Westfalen",
      "amtsgericht": "Amtsgericht Wuppertal",
      "registernummer": "HRB 23323",
      "registerart": "HRB",
      "company_name": "LuWer Personaldienstleistung Gesellschaft für Arbeit auf Zeit und Personalentwicklung mbH",
      "company_seat": "Solingen",
      "details": "18.12.2025 (Bekanntmachungsdatum)\n\nNordrhein-Westfalen Amtsgericht Wuppertal HRB 23323\nLöschungsankündigung\n\nLuWer Personaldienstleistung Gesellschaft für Arbeit auf Zeit und Personalentwicklung mbH\nGesellschaft mit beschränkter Haftung\nSolingen\n\nDas Registergericht beabsichtigt die Gesellschaft von Amts wegen nach § 394 FamFG zu löschen. Die Frist zur Erhebung eines Widerspruchs ist auf einen Monat festgesetzt."
    },
    {
      "date": "2025-12-18",
      "id": "140499",
      "original_text": "Registerbekanntmachung nach dem Umwandlungsgesetz\nNordrhein-Westfalen Amtsgericht Köln HRB 118100\nv. Reitzenstein & Partner Versicherungsvermittlung für steuer- und rechtsberatende Berufe Gesellschaft mit beschränkter Haftung – Köln",
      "type": "Registerbekanntmachung nach dem Umwandlungsgesetz",
      "state": "Nordrhein-Westfalen",
      "amtsgericht": "Amtsgericht Köln",
      "registernummer": "HRB 118100",
      "registerart": "HRB",
      "company_name": "v. Reitzenstein & Partner Versicherungsvermittlung für steuer- und rechtsberatende Berufe Gesellschaft mit beschränkter Haftung",
      "company_seat": "Köln",
      "details": "18.12.2025 (Bekanntmachungsdatum)\n\nNordrhein-Westfalen Amtsgericht Köln HRB 118100\nRegisterbekanntmachung nach dem Umwandlungsgesetz 18.12.2025 (Eintragungsdatum)\n\nv. Reitzenstein & Partner Versicherungsvermittlung für steuer- und rechtsberatende Berufe Gesellschaft mit beschränkter Haftung\nGesellschaft mit beschränkter Haftung\nKöln\n\nDen Gläubigern der an der Verschmelzung beteiligten Rechtsträger ist, wenn sie binnen sechs Monaten nach dem Tag, an dem die Eintragung der Verschmelzung in das Register des Sitzes desjenigen Rechtsträgers, dessen Gläubiger sie sind, nach § 19 Absatz 3 UmwG als bekanntgemacht gilt, ihren Anspruch nach Grund und Höhe schriftlich anmelden, Sicherheit zu leisten, soweit sie nicht Befriedigung verlangen können. Dieses Recht steht den Gläubigern jedoch nur zu, wenn sie glaubhaft machen, dass durch die Verschmelzung die Erfüllung ihrer Forderung gefährdet wird."
    },
    {
      "date": "2025-12-18",
      "id": "140500",
      "original_text": "Löschungsankündigung\nNordrhein-Westfalen Amtsgericht Mönchengladbach HRB 20527\nKABLU UG (haftungsbeschränkt) – Grevenbroich",
      "type": "Löschungsankündigung",
      "state": "Nordrhein-Westfalen",
      "amtsgericht": "Amtsgericht Mönchengladbach",
      "registernummer": "HRB 20527",
      "registerart": "HRB",
      "company_name": "KABLU UG (haftungsbeschränkt)",
      "company_seat": "Grevenbroich",
      "details": "18.12.2025 (Bekanntmachungsdatum)\n\nNordrhein-Westfalen Amtsgericht Mönchengladbach HRB 20527\nLöschungsankündigung\n\nKABLU UG (haftungsbeschränkt)\nGesellschaft mit beschränkter Haftung\nGrevenbroich\n\nDas Registergericht beabsichtigt, die im Handelsregister eingetragene Gesellschaft gemäß § 394 Absatz 1 FamFG wegen Vermögenslosigkeit von Amts wegen zu löschen. Gegen diese Verfügung kann Widerspruch eingelegt werden. Die Frist zur Erhebung eines Widerspruchs gegen die beabsichtigte Löschung von Amts wegen ist auf drei Monate festgesetzt."
    },
    {
      "date": "2025-12-18",
      "id": "140501",
      "original_text": "Löschungsankündigung\nNordrhein-Westfalen Amtsgericht Gelsenkirchen HRB 16256\nSymon SKM GmbH – Dorsten",
      "type": "Löschungsankündigung",
      "state": "Nordrhein-Westfalen",
      "amtsgericht": "Amtsgericht Gelsenkirchen",
      "registernummer": "HRB 16256",
      "registerart": "HRB",
      "company_name": "Symon SKM GmbH",
      "company_seat": "Dorsten",
      "details": "18.12.2025 (Bekanntmachungsdatum)\n\nNordrhein-Westfalen Amtsgericht Gelsenkirchen HRB 16256\nLöschungsankündigung\n\nSymon SKM GmbH\nGesellschaft mit beschränkter Haftung\nDorsten\n\nDas Gericht beabsichtigt, die im Handelsregister eingetragene Symon SKM GmbH mit Sitz in Dorsten, HRB 16256, Amtsgericht Gelsenkirchen, wegen Vermögenslosigkeit zu löschen.\nHiermit wird denjenigen, die an der Unterlassung der Löschung ein berechtigtes Interesse haben, gem. § 394 Abs. 2 FamFG Gelegenheit gegeben, gegen dieses Vorhaben binnen eines Monats nach dieser Bekanntmachung Widerspruch einzulegen. Der Widerspruch kann schriftlich oder zu Protokoll der Geschäftsstelle erhoben werden."
    },
    {
      "date": "2025-12-18",
      "id": "140502",
      "original_text": "Löschungsankündigung\nNordrhein-Westfalen Amtsgericht Düsseldorf HRB 41411\nRheinische Leben GmbH – Düsseldorf",
      "type": "Löschungsankündigung",
      "state": "Nordrhein-Westfalen",
      "amtsgericht": "Amtsgericht Düsseldorf",
      "registernummer": "HRB 41411",
      "registerart": "HRB",
      "company_name": "Rheinische Leben GmbH",
      "company_seat": "Düsseldorf",
      "details": "18.12.2025 (Bekanntmachungsdatum)\n\nNordrhein-Westfalen Amtsgericht Düsseldorf HRB 41411\nLöschungsankündigung\n\nRheinische Leben GmbH\nGesellschaft mit beschränkter Haftung\nDüsseldorf\n\nDas Registergericht beabsichtigt die Gesellschaft von Amts wegen nach § 394 FamFG zu löschen. Die Frist zur Erhebung eines Widerspruchs ist auf 3 Wochen festgesetzt.\n\nRechtsbehelfsbelehrung:\nDas Widerspruchsrecht steht jedem zu, der an der Unterlassung der Löschung ein berechtigtes Interesse hat. Der Widerspruch ist bei dem Amtsgericht Düsseldorf -Registergericht-, Werdener Straße 1, 40227 Düsseldorf schriftlich in deutscher Sprache oder zur Niederschrift der Geschäftsstelle einzulegen. Der Widerspruch kann auch zur Niederschrift der Geschäftsstelle eines jeden Amtsgerichtes abgegeben werden. Die Einlegung ist auch durch Übertragung eines elektronischen Dokuments an die elektronische Poststelle des Gerichts möglich. Das elektronische Dokument muss für die Bearbeitung durch das Gericht geeignet und mit einer qualifizierten elektronischen Signatur der verantwortenden Person versehen sein oder von der verantwortenden Person signiert und auf einem sicheren Übermittlungsweg gemäß § 130a ZPO nach näherer Maßgabe der Verordnung über die technischen Rahmenbedingungen des elektronischen Rechtsverkehrs und über das besondere elektronische Behördenpostfach (BGBl. I, S.3803) eingereicht werden. Weitere Informationen erhalten Sie auf der Internetseite www.justiz.de.\nDer Widerspruch muss spätestens innerhalb der gesetzten Frist nach dem Datum der Bekanntmachung der Löschungsankündigung bei dem Amtsgericht - Registergericht - Düsseldorf eingegangen sein.  Dies gilt auch dann, wenn der Widerspruch zur Niederschrift der Geschäftsstelle eines anderen Amtsgerichtes abgegeben wurde. Die Frist beginnt mit dem Tage der Bekanntmachung der Löschungsankündigung in dem für die Bekanntmachung der Eintragungen in das Handelsregister bestimmten elektronischen Informations- und Kommunikationssystem nach § 10 des Handelsgesetzbuches. Fällt das Ende der Frist auf einen Sonntag, einen allgemeinen Feiertag oder Sonnabend, so endet die Frist mit Ablauf des nächsten Werktages.\nDer Widerspruch muss die Bezeichnung der angefochtenen Löschungsankündigung sowie die Erklärung enthalten, dass Widerspruch gegen diese Löschungsankündigung eingelegt wird. Er ist zu unterzeichnen und soll begründet werden."
    },
    {
      "date": "2025-12-18",
      "id": "140503",
      "original_text": "Löschungsankündigung\nNordrhein-Westfalen Amtsgericht Dortmund HRB 36407\nAS Dienstleistung GmbH – Lünen",
      "type": "Löschungsankündigung",
      "state": "Nordrhein-Westfalen",
      "amtsgericht": "Amtsgericht Dortmund",
      "registernummer": "HRB 36407",
      "registerart": "HRB",
      "company_name": "AS Dienstleistung GmbH",
      "company_seat": "Lünen",
      "details": "18.12.2025 (Bekanntmachungsdatum)\n\nNordrhein-Westfalen Amtsgericht Dortmund HRB 36407\nLöschungsankündigung 18.12.2025 (Eintragungsdatum)\n\nAS Dienstleistung GmbH\nGesellschaft mit beschränkter Haftung\nLünen\n\nDas Registergericht beabsichtigt die Gesellschaft von Amts wegen nach § 394 FamFG zu löschen. Die Frist zur Erhebung eines Widerspruchs ist auf zwei Monate festgesetzt."
    },
    {
      "date": "2025-12-18",
      "id": "140504",
      "original_text": "Löschungsankündigung\nNordrhein-Westfalen Amtsgericht Dortmund HRA 18288\nADcompo UG (haftungsbeschränkt) & Co. KG – Dortmund",
      "type": "Löschungsankündigung",
      "state": "Nordrhein-Westfalen",
      "amtsgericht": "Amtsgericht Dortmund",
      "registernummer": "HRA 18288",
      "registerart": "HRA",
      "company_name": "ADcompo UG (haftungsbeschränkt) & Co. KG",
      "company_seat": "Dortmund",
      "details": "18.12.2025 (Bekanntmachungsdatum)\n\nNordrhein-Westfalen Amtsgericht Dortmund HRA 18288\nLöschungsankündigung 18.12.2025 (Eintragungsdatum)\n\nADcompo UG (haftungsbeschränkt) & Co. KG\nKommanditgesellschaft\nDortmund\n\nDas Registergericht beabsichtigt die Firma von Amts wegen nach § 394 FamFG zu löschen. Die Frist zur Erhebung eines Widerspruchs ist auf zwei Monate festgesetzt."
    },
    {
      "date": "2025-12-18",
      "id": "140505",
      "original_text": "Registerbekanntmachung nach dem Umwandlungsgesetz\nNordrhein-Westfalen Amtsgericht Hamm HRB 6588\nAA-Food Company mbH System-Gastronomie – Hamm",
      "type": "Registerbekanntmachung nach dem Umwandlungsgesetz",
      "state": "Nordrhein-Westfalen",
      "amtsgericht": "Amtsgericht Hamm",
      "registernummer": "HRB 6588",
      "registerart": "HRB",
      "company_name": "AA-Food Company mbH System-Gastronomie",
      "company_seat": "Hamm",
      "details": "18.12.2025 (Bekanntmachungsdatum)\n\nNordrhein-Westfalen Amtsgericht Hamm HRB 6588\nRegisterbekanntmachung nach dem Umwandlungsgesetz 18.12.2025 (Eintragungsdatum)\n\nAA-Food Company mbH System-Gastronomie\nGesellschaft mit beschränkter Haftung\nHamm\n\nDen Gläubigern der an der Verschmelzung beteiligten Rechtsträger ist, wenn sie binnen sechs Monaten nach dem Tag, an dem die Eintragung der Verschmelzung in das Register des Sitzes derjenigen Rechtsträger deren Gläubiger sie sind, nach § 19 Absatz 3 UmwG als bekanntgemacht gilt, ihren Anspruch nach Grund und Höhe schriftlich anmelden, Sicherheit zu leisten, soweit sie nicht Befriedigung verlangen können. Dieses Recht steht den Gläubigern jedoch nur zu, wenn sie glaubhaft machen, dass durch die Verschmelzung die Erfüllung ihrer Forderung gefährdet wird."
    },
    {
      "date": "2025-12-18",
      "id": "140506",
      "original_text": "Registerbekanntmachung nach dem Umwandlungsgesetz\nNordrhein-Westfalen Amtsgericht Dortmund HRB 37544\nNC Bau Dortmund GmbH – Dortmund",
      "type": "Registerbekanntmachung nach dem Umwandlungsgesetz",
      "state": "Nordrhein-Westfalen",
      "amtsgericht": "Amtsgericht Dortmund",
      "registernummer": "HRB 37544",
      "registerart": "HRB",
      "company_name": "NC Bau Dortmund GmbH",
      "company_seat": "Dortmund",
      "details": "18.12.2025 (Bekanntmachungsdatum)\n\nNordrhein-Westfalen Amtsgericht Dortmund HRB 37544\nRegisterbekanntmachung nach dem Umwandlungsgesetz 18.12.2025 (Eintragungsdatum)\n\nNC Bau Dortmund GmbH\nGesellschaft mit beschränkter Haftung\nDortmund\n\nDen Gläubigern der an der Ausgliederung beteiligten Rechtsträger ist, wenn sie binnen sechs Monaten nach dem Tag, an dem die Eintragung der Ausgliederung in das Register des Sitzes derjenigen Rechtsträger deren Gläubiger sie sind, nach § 19 Absatz 3 UmwG als bekanntgemacht gilt, ihren Anspruch nach Grund und Höhe schriftlich anmelden, Sicherheit zu leisten, soweit sie nicht Befriedigung verlangen können. Dieses Recht steht den Gläubigern jedoch nur zu, wenn sie glaubhaft machen, dass durch die Ausgliederung die Erfüllung ihrer Forderung gefährdet wird."
    },
    {
      "date": "2025-12-18",
      "id": "140507",
      "original_text": "Registerbekanntmachung nach dem Umwandlungsgesetz\nNordrhein-Westfalen Amtsgericht Arnsberg HRA 3065\nBernhard Kevekordes Hoher Knochen e.K. – Schmallenberg",
      "type": "Registerbekanntmachung nach dem Umwandlungsgesetz",
      "state": "Nordrhein-Westfalen",
      "amtsgericht": "Amtsgericht Arnsberg",
      "registernummer": "HRA 3065",
      "registerart": "HRA",
      "company_name": "Bernhard Kevekordes Hoher Knochen e.K.",
      "company_seat": "Schmallenberg",
      "details": "18.12.2025 (Bekanntmachungsdatum)\n\nNordrhein-Westfalen Amtsgericht Arnsberg HRA 3065\nRegisterbekanntmachung nach dem Umwandlungsgesetz 18.12.2025 (Eintragungsdatum)\n\nBernhard Kevekordes Hoher Knochen e.K.\nEinzelkaufmann / Einzelkauffrau\nSchmallenberg\n\nDen Gläubigern der an der Ausgliederung beteiligten Rechtsträger ist, wenn sie binnen sechs Monaten nach dem Tag, an dem die Eintragung der Ausgliederung in das Register des Sitzes derjenigen Rechtsträger deren Gläubiger sie sind, nach § 19 Absatz 3 UmwG als bekanntgemacht gilt, ihren Anspruch nach Grund und Höhe schriftlich anmelden, Sicherheit zu leisten, soweit sie nicht Befriedigung verlangen können. Dieses Recht steht den Gläubigern jedoch nur zu, wenn sie glaubhaft machen, dass durch die Ausgliederung die Erfüllung ihrer Forderung gefährdet wird."
    },
    {
      "date": "2025-12-18",
      "id": "140508",
      "original_text": "Einreichung neuer Dokumente\nNordrhein-Westfalen Amtsgericht Münster HRB 18137\nDREIEICH AG – Münster",
      "type": "Einreichung neuer Dokumente",
      "state": "Nordrhein-Westfalen",
      "amtsgericht": "Amtsgericht Münster",
      "registernummer": "HRB 18137",
      "registerart": "HRB",
      "company_name": "DREIEICH AG",
      "company_seat": "Münster",
      "details": "18.12.2025 (Bekanntmachungsdatum)\n\nNordrhein-Westfalen Amtsgericht Münster HRB 18137\nEinreichung neuer Dokumente\n\nDREIEICH AG\nAktiengesellschaft\nMünster\n\nDem Registergericht ist eine Liste der Mitglieder des Aufsichtsrates eingereicht worden."
    },
    {
      "date": "2025-12-18",
      "id": "140509",
      "original_text": "Löschungsankündigung\nNordrhein-Westfalen Amtsgericht Bonn HRB 23261\nEVB Mobile GmbH – Bonn",
      "type": "Löschungsankündigung",
      "state": "Nordrhein-Westfalen",
      "amtsgericht": "Amtsgericht Bonn",
      "registernummer": "HRB 23261",
      "registerart": "HRB",
      "company_name": "EVB Mobile GmbH",
      "company_seat": "Bonn",
      "details": "18.12.2025 (Bekanntmachungsdatum)\n\nNordrhein-Westfalen Amtsgericht Bonn HRB 23261\nLöschungsankündigung\n\nEVB Mobile GmbH\nGesellschaft mit beschränkter Haftung\nBonn\n\nDas Registergericht beabsichtigt die Gesellschaft von Amts wegen nach § 394 FamFG zu löschen. Die Frist zur Erhebung eines Widerspruchs ist auf einen Monat festgesetzt."
    },
    {
      "date": "2025-12-18",
      "id": "140510",
      "original_text": "Einreichung neuer Dokumente\nNordrhein-Westfalen Amtsgericht Duisburg HRB 11582\nACTEGA GmbH – Wesel",
      "type": "Einreichung neuer Dokumente",
      "state": "Nordrhein-Westfalen",
      "amtsgericht": "Amtsgericht Duisburg",
      "registernummer": "HRB 11582",
      "registerart": "HRB",
      "company_name": "ACTEGA GmbH",
      "company_seat": "Wesel",
      "details": "18.12.2025 (Bekanntmachungsdatum)\n\nNordrhein-Westfalen Amtsgericht Duisburg HRB 11582\nEinreichung neuer Dokumente\n\nACTEGA GmbH\nGesellschaft mit beschränkter Haftung\nWesel\n\nDem Registergericht ist eine Liste der Mitglieder des Aufsichtsrates eingereicht worden."
    },
    {
      "date": "2025-12-18",
      "id": "140511",
      "original_text": "Registerbekanntmachung nach dem Umwandlungsgesetz\nNordrhein-Westfalen Amtsgericht Münster HRB 21628\ntraderinfo GmbH – Münster",
      "type": "Registerbekanntmachung nach dem Umwandlungsgesetz",
      "state": "Nordrhein-Westfalen",
      "amtsgericht": "Amtsgericht Münster",
      "registernummer": "HRB 21628",
      "registerart": "HRB",
      "company_name": "traderinfo GmbH",
      "company_seat": "Münster",
      "details": "18.12.2025 (Bekanntmachungsdatum)\n\nNordrhein-Westfalen Amtsgericht Münster HRB 21628\nRegisterbekanntmachung nach dem Umwandlungsgesetz 18.12.2025 (Eintragungsdatum)\n\ntraderinfo GmbH\nGesellschaft mit beschränkter Haftung\nMünster\n\nDen Gläubigern der an der Verschmelzung beteiligten Rechtsträger ist, wenn sie binnen sechs Monaten nach dem Tag, an dem die Eintragung der Verschmelzung in das Register des Sitzes desjenigen Rechtsträgers, dessen Gläubiger sie sind, nach § 19 Absatz 3 UmwG als bekanntgemacht gilt, ihren Anspruch nach Grund und Höhe schriftlich anmelden, Sicherheit zu leisten, soweit sie nicht Befriedigung verlangen können. Dieses Recht steht den Gläubigern jedoch nur zu, wenn sie glaubhaft machen, dass durch die Verschmelzung die Erfüllung ihrer Forderung gefährdet wird."
    },
    {
      "date": "2025-12-18",
      "id": "140512",
      "original_text": "Löschungsankündigung\nNordrhein-Westfalen Amtsgericht Bad Oeynhausen HRA 323\nFritz Schröder GmbH & Co Kommanditgesellschaft – Löhne",
      "type": "Löschungsankündigung",
      "state": "Nordrhein-Westfalen",
      "amtsgericht": "Amtsgericht Bad Oeynhausen",
      "registernummer": "HRA 323",
      "registerart": "HRA",
      "company_name": "Fritz Schröder GmbH & Co Kommanditgesellschaft",
      "company_seat": "Löhne",
      "details": "18.12.2025 (Bekanntmachungsdatum)\n\nNordrhein-Westfalen Amtsgericht Bad Oeynhausen HRA 323\nLöschungsankündigung\n\nFritz Schröder GmbH & Co Kommanditgesellschaft\nKommanditgesellschaft\nLöhne\n\nDas Registergericht beabsichtigt die Firma von Amts wegen nach §§ 393 FamFG, 31 HGB zu löschen. Die Frist zur Erhebung eines Widerspruchs ist auf einen Monat festgesetzt."
    },
    {
      "date": "2025-12-18",
      "id": "140513",
      "original_text": "Registerbekanntmachung nach dem Umwandlungsgesetz\nNordrhein-Westfalen Amtsgericht Köln HRA 34365\nSzczepanski OHG – Engelskirchen",
      "type": "Registerbekanntmachung nach dem Umwandlungsgesetz",
      "state": "Nordrhein-Westfalen",
      "amtsgericht": "Amtsgericht Köln",
      "registernummer": "HRA 34365",
      "registerart": "HRA",
      "company_name": "Szczepanski OHG",
      "company_seat": "Engelskirchen",
      "details": "18.12.2025 (Bekanntmachungsdatum)\n\nNordrhein-Westfalen Amtsgericht Köln HRA 34365\nRegisterbekanntmachung nach dem Umwandlungsgesetz 18.12.2025 (Eintragungsdatum)\n\nSzczepanski OHG\nOffene Handelsgesellschaft\nEngelskirchen\n\nDen Gläubigern der an der formwechselnden Umwandlung beteiligten Rechtsträger ist, wenn sie binnen sechs Monaten nach dem Tag, an dem die Eintragung der formwechselnden Umwandlung in das Register des Sitzes desjenigen Rechtsträgers, dessen Gläubiger sie sind, nach § 19 Absatz 3 UmwG als bekanntgemacht gilt, ihren Anspruch nach Grund und Höhe schriftlich anmelden, Sicherheit zu leisten, soweit sie nicht Befriedigung verlangen können. Dieses Recht steht den Gläubigern jedoch nur zu, wenn sie glaubhaft machen, dass durch die formwechselnden Umwandlung die Erfüllung ihrer Forderung gefährdet wird."
    },
    {
      "date": "2025-12-18",
      "id": "140514",
      "original_text": "Registerbekanntmachung nach dem Umwandlungsgesetz\nNordrhein-Westfalen Amtsgericht Arnsberg HRB 12495\nForstify GmbH – Arnsberg",
      "type": "Registerbekanntmachung nach dem Umwandlungsgesetz",
      "state": "Nordrhein-Westfalen",
      "amtsgericht": "Amtsgericht Arnsberg",
      "registernummer": "HRB 12495",
      "registerart": "HRB",
      "company_name": "Forstify GmbH",
      "company_seat": "Arnsberg",
      "details": "18.12.2025 (Bekanntmachungsdatum)\n\nNordrhein-Westfalen Amtsgericht Arnsberg HRB 12495\nRegisterbekanntmachung nach dem Umwandlungsgesetz 18.12.2025 (Eintragungsdatum)\n\nForstify GmbH\nGesellschaft mit beschränkter Haftung\nArnsberg\n\nDen Gläubigern der an der Abspaltung beteiligten Rechtsträger ist, wenn sie binnen sechs Monaten nach dem Tag, an dem die Eintragung der Abspaltung in das Register des Sitzes desjenigen Rechtsträgers, dessen Gläubiger sie sind, nach § 19 Absatz 3 UmwG als bekanntgemacht gilt, ihren Anspruch nach Grund und Höhe schriftlich anmelden, Sicherheit zu leisten, soweit sie nicht Befriedigung verlangen können. Dieses Recht steht den Gläubigern jedoch nur zu, wenn sie glaubhaft machen, dass durch die Abspaltung die Erfüllung ihrer Forderung gefährdet wird."
    },
    {
      "date": "2025-12-18",
      "id": "140515",
      "original_text": "Löschungsankündigung\nNordrhein-Westfalen Amtsgericht Düsseldorf HRB 91610\nIMS Metallbau GmbH – Ratingen",
      "type": "Löschungsankündigung",
      "state": "Nordrhein-Westfalen",
      "amtsgericht": "Amtsgericht Düsseldorf",
      "registernummer": "HRB 91610",
      "registerart": "HRB",
      "company_name": "IMS Metallbau GmbH",
      "company_seat": "Ratingen",
      "details": "18.12.2025 (Bekanntmachungsdatum)\n\nNordrhein-Westfalen Amtsgericht Düsseldorf HRB 91610\nLöschungsankündigung\n\nIMS Metallbau GmbH\nGesellschaft mit beschränkter Haftung\nRatingen\n\nDas Registergericht beabsichtigt die Gesellschaft von Amts wegen nach § 394 Abs. 1 FamFG zu löschen. Die Frist zur Erhebung eines Widerspruchs ist auf 3 Wochen festgesetzt.\n\nRechtsbehelfsbelehrung:\nDas Widerspruchsrecht steht jedem zu, der an der Unterlassung der Löschung ein berechtigtes Interesse hat. Der Widerspruch ist bei dem Amtsgericht Düsseldorf -Registergericht-, Werdener Straße 1, 40227 Düsseldorf schriftlich in deutscher Sprache oder zur Niederschrift der Geschäftsstelle einzulegen. Der Widerspruch kann auch zur Niederschrift der Geschäftsstelle eines jeden Amtsgerichtes abgegeben werden. Die Einlegung ist auch durch Übertragung eines elektronischen Dokuments an die elektronische Poststelle des Gerichts möglich. Das elektronische Dokument muss für die Bearbeitung durch das Gericht geeignet und mit einer qualifizierten elektronischen Signatur der verantwortenden Person versehen sein oder von der verantwortenden Person signiert und auf einem sicheren Übermittlungsweg gemäß § 130a ZPO nach näherer Maßgabe der Verordnung über die technischen Rahmenbedingungen des elektronischen Rechtsverkehrs und über das besondere elektronische Behördenpostfach (BGBl. I, S.3803) eingereicht werden. Weitere Informationen erhalten Sie auf der Internetseite www.justiz.de.\nDer Widerspruch muss spätestens innerhalb der gesetzten Frist nach dem Datum der Bekanntmachung der Löschungsankündigung bei dem Amtsgericht - Registergericht - Düsseldorf eingegangen sein.  Dies gilt auch dann, wenn der Widerspruch zur Niederschrift der Geschäftsstelle eines anderen Amtsgerichtes abgegeben wurde. Die Frist beginnt mit dem Tage der Bekanntmachung der Löschungsankündigung in dem für die Bekanntmachung der Eintragungen in das Handelsregister bestimmten elektronischen Informations- und Kommunikationssystem nach § 10 des Handelsgesetzbuches. Fällt das Ende der Frist auf einen Sonntag, einen allgemeinen Feiertag oder Sonnabend, so endet die Frist mit Ablauf des nächsten Werktages.\nDer Widerspruch muss die Bezeichnung der angefochtenen Löschungsankündigung sowie die Erklärung enthalten, dass Widerspruch gegen diese Löschungsankündigung eingelegt wird. Er ist zu unterzeichnen und soll begründet werden."
    },
    {
      "date": "2025-12-18",
      "id": "140516",
      "original_text": "Registerbekanntmachung nach dem Umwandlungsgesetz\nNordrhein-Westfalen Amtsgericht Münster HRB 21284\nfloris assets GmbH – Münster",
      "type": "Registerbekanntmachung nach dem Umwandlungsgesetz",
      "state": "Nordrhein-Westfalen",
      "amtsgericht": "Amtsgericht Münster",
      "registernummer": "HRB 21284",
      "registerart": "HRB",
      "company_name": "floris assets GmbH",
      "company_seat": "Münster",
      "details": "18.12.2025 (Bekanntmachungsdatum)\n\nNordrhein-Westfalen Amtsgericht Münster HRB 21284\nRegisterbekanntmachung nach dem Umwandlungsgesetz 18.12.2025 (Eintragungsdatum)\n\nfloris assets GmbH\nGesellschaft mit beschränkter Haftung\nMünster\n\nDen Gläubigern der an der Verschmelzung beteiligten Rechtsträger ist, wenn sie binnen sechs Monaten nach dem Tag, an dem die Eintragung der Verschmelzung in das Register des Sitzes desjenigen Rechtsträgers, dessen Gläubiger sie sind, nach § 19 Absatz 3 UmwG als bekanntgemacht gilt, ihren Anspruch nach Grund und Höhe schriftlich anmelden, Sicherheit zu leisten, soweit sie nicht Befriedigung verlangen können. Dieses Recht steht den Gläubigern jedoch nur zu, wenn sie glaubhaft machen, dass durch die Verschmelzung die Erfüllung ihrer Forderung gefährdet wird."
    },
    {
      "date": "2025-12-18",
      "id": "140517",
      "original_text": "Registerbekanntmachung nach dem Umwandlungsgesetz\nNordrhein-Westfalen Amtsgericht Köln HRB 125992\nSzczepanski GmbH – Engelskirchen",
      "type": "Registerbekanntmachung nach dem Umwandlungsgesetz",
      "state": "Nordrhein-Westfalen",
      "amtsgericht": "Amtsgericht Köln",
      "registernummer": "HRB 125992",
      "registerart": "HRB",
      "company_name": "Szczepanski GmbH",
      "company_seat": "Engelskirchen",
      "details": "18.12.2025 (Bekanntmachungsdatum)\n\nNordrhein-Westfalen Amtsgericht Köln HRB 125992\nRegisterbekanntmachung nach dem Umwandlungsgesetz 18.12.2025 (Eintragungsdatum)\n\nSzczepanski GmbH\nGesellschaft mit beschränkter Haftung\nEngelskirchen\n\nDen Gläubigern der an der formwechselnden Umwandlung beteiligten Rechtsträger ist, wenn sie binnen sechs Monaten nach dem Tag, an dem die Eintragung der formwechselnden Umwandlung in das Register des Sitzes derjenigen Rechtsträger deren Gläubiger sie sind, nach § 19 Absatz 3 UmwG als bekanntgemacht gilt, ihren Anspruch nach Grund und Höhe schriftlich anmelden, Sicherheit zu leisten, soweit sie nicht Befriedigung verlangen können. Dieses Recht steht den Gläubigern jedoch nur zu, wenn sie glaubhaft machen, dass durch die formwechselnden Umwandlung die Erfüllung ihrer Forderung gefährdet wird."
    },
    {
      "date": "2025-12-18",
      "id": "140518",
      "original_text": "Registerbekanntmachung nach dem Umwandlungsgesetz\nNordrhein-Westfalen Amtsgericht Essen HRB 24896\nBöhm & Partner Treuhandgesellschaft mbH Steuerberatungsgesellschaft – Essen",
      "type": "Registerbekanntmachung nach dem Umwandlungsgesetz",
      "state": "Nordrhein-Westfalen",
      "amtsgericht": "Amtsgericht Essen",
      "registernummer": "HRB 24896",
      "registerart": "HRB",
      "company_name": "Böhm & Partner Treuhandgesellschaft mbH Steuerberatungsgesellschaft",
      "company_seat": "Essen",
      "details": "18.12.2025 (Bekanntmachungsdatum)\n\nNordrhein-Westfalen Amtsgericht Essen HRB 24896\nRegisterbekanntmachung nach dem Umwandlungsgesetz 18.12.2025 (Eintragungsdatum)\n\nBöhm & Partner Treuhandgesellschaft mbH Steuerberatungsgesellschaft\nGesellschaft mit beschränkter Haftung\nEssen\n\nDen Gläubigern der an der Verschmelzung beteiligten Rechtsträger ist, wenn sie binnen sechs Monaten nach dem Tag, an dem die Eintragung der Verschmelzung in das Register des Sitzes desjenigen Rechtsträgers, dessen Gläubiger sie sind, nach § 19 Absatz 3 UmwG als bekanntgemacht gilt, ihren Anspruch nach Grund und Höhe schriftlich anmelden, Sicherheit zu leisten, soweit sie nicht Befriedigung verlangen können. Dieses Recht steht den Gläubigern jedoch nur zu, wenn sie glaubhaft machen, dass durch die Verschmelzung die Erfüllung ihrer Forderung gefährdet wird."
    },
    {
      "date": "2025-12-18",
      "id": "140519",
      "original_text": "Löschungsankündigung\nNordrhein-Westfalen Amtsgericht Düsseldorf HRB 85254\nMM Automobile GmbH – Düsseldorf",
      "type": "Löschungsankündigung",
      "state": "Nordrhein-Westfalen",
      "amtsgericht": "Amtsgericht Düsseldorf",
      "registernummer": "HRB 85254",
      "registerart": "HRB",
      "company_name": "MM Automobile GmbH",
      "company_seat": "Düsseldorf",
      "details": "18.12.2025 (Bekanntmachungsdatum)\n\nNordrhein-Westfalen Amtsgericht Düsseldorf HRB 85254\nLöschungsankündigung\n\nMM Automobile GmbH\nGesellschaft mit beschränkter Haftung\nDüsseldorf\n\nEs ist beabsichtigt, die Gesellschaft wegen Vermögenslosigkeit aufgrund des § 394 Abs. 1 FamFG zu löschen. Die Frist zur Erhebung eines Widerspruchs ist auf 3 Wochen festgesetzt.\n\nRechtsbehelfsbelehrung:\nDas Widerspruchsrecht steht jedem zu, der an der Unterlassung der Löschung ein berechtigtes Interesse hat. Der Widerspruch ist bei dem Amtsgericht Düsseldorf -Registergericht-, Werdener Straße 1, 40227 Düsseldorf schriftlich in deutscher Sprache oder zur Niederschrift der Geschäftsstelle einzulegen. Der Widerspruch kann auch zur Niederschrift der Geschäftsstelle eines jeden Amtsgerichtes abgegeben werden. Die Einlegung ist auch durch Übertragung eines elektronischen Dokuments an die elektronische Poststelle des Gerichts möglich. Das elektronische Dokument muss für die Bearbeitung durch das Gericht geeignet und mit einer qualifizierten elektronischen Signatur der verantwortenden Person versehen sein oder von der verantwortenden Person signiert und auf einem sicheren Übermittlungsweg gemäß § 130a ZPO nach näherer Maßgabe der Verordnung über die technischen Rahmenbedingungen des elektronischen Rechtsverkehrs und über das besondere elektronische Behördenpostfach (BGBl. I, S.3803) eingereicht werden. Weitere Informationen erhalten Sie auf der Internetseite www.justiz.de.\nDer Widerspruch muss spätestens innerhalb der gesetzten Frist nach dem Datum der Bekanntmachung der Löschungsankündigung bei dem Amtsgericht - Registergericht - Düsseldorf eingegangen sein.  Dies gilt auch dann, wenn der Widerspruch zur Niederschrift der Geschäftsstelle eines anderen Amtsgerichtes abgegeben wurde. Die Frist beginnt mit dem Tage der Bekanntmachung der Löschungsankündigung in dem für die Bekanntmachung der Eintragungen in das Handelsregister bestimmten elektronischen Informations- und Kommunikationssystem nach § 10 des Handelsgesetzbuches. Fällt das Ende der Frist auf einen Sonntag, einen allgemeinen Feiertag oder Sonnabend, so endet die Frist mit Ablauf des nächsten Werktages.\nDer Widerspruch muss die Bezeichnung der angefochtenen Löschungsankündigung sowie die Erklärung enthalten, dass Widerspruch gegen diese Löschungsankündigung eingelegt wird. Er ist zu unterzeichnen und soll begründet werden."
    },
    {
      "date": "2025-12-18",
      "id": "140520",
      "original_text": "Einreichung neuer Dokumente\nNordrhein-Westfalen Amtsgericht Wuppertal HRB 14521\n\"Stadtwerke Haan GmbH\" – Haan",
      "type": "Einreichung neuer Dokumente",
      "state": "Nordrhein-Westfalen",
      "amtsgericht": "Amtsgericht Wuppertal",
      "registernummer": "HRB 14521",
      "registerart": "HRB",
      "company_name": "\"Stadtwerke Haan GmbH\"",
      "company_seat": "Haan",
      "details": "18.12.2025 (Bekanntmachungsdatum)\n\nNordrhein-Westfalen Amtsgericht Wuppertal HRB 14521\nEinreichung neuer Dokumente 18.12.2025 (Eintragungsdatum)\n\n\"Stadtwerke Haan GmbH\"\nGesellschaft mit beschränkter Haftung\nHaan\n\nDem Registergericht ist eine neue Liste der Mitglieder des Aufsichtsrates eingereicht worden."
    },
    {
      "date": "2025-12-18",
      "id": "140521",
      "original_text": "Registerbekanntmachung nach dem Umwandlungsgesetz\nNordrhein-Westfalen Amtsgericht Düsseldorf HRB 89524\nContec Kromiss GmbH – Düsseldorf",
      "type": "Registerbekanntmachung nach dem Umwandlungsgesetz",
      "state": "Nordrhein-Westfalen",
      "amtsgericht": "Amtsgericht Düsseldorf",
      "registernummer": "HRB 89524",
      "registerart": "HRB",
      "company_name": "Contec Kromiss GmbH",
      "company_seat": "Düsseldorf",
      "details": "18.12.2025 (Bekanntmachungsdatum)\n\nNordrhein-Westfalen Amtsgericht Düsseldorf HRB 89524\nRegisterbekanntmachung nach dem Umwandlungsgesetz 18.12.2025 (Eintragungsdatum)\n\nContec Kromiss GmbH\nGesellschaft mit beschränkter Haftung\nDüsseldorf\n\nDen Gläubigern der an der Verschmelzung beteiligten Rechtsträger ist, wenn sie binnen sechs Monaten nach dem Tag, an dem die Eintragung der Verschmelzung in das Register des Sitzes desjenigen Rechtsträgers, dessen Gläubiger sie sind, nach § 19 Absatz 3 UmwG als bekanntgemacht gilt, ihren Anspruch nach Grund und Höhe schriftlich anmelden, Sicherheit zu leisten, soweit sie nicht Befriedigung verlangen können. Dieses Recht steht den Gläubigern jedoch nur zu, wenn sie glaubhaft machen, dass durch die Verschmelzung die Erfüllung ihrer Forderung gefährdet wird."
    },
    {
      "date": "2025-12-18",
      "id": "140522",
      "original_text": "Registerbekanntmachung nach dem Umwandlungsgesetz\nNordrhein-Westfalen Amtsgericht Köln HRB 101555\nLTA Legal & Tax Assekuranzmakler GmbH – Köln",
      "type": "Registerbekanntmachung nach dem Umwandlungsgesetz",
      "state": "Nordrhein-Westfalen",
      "amtsgericht": "Amtsgericht Köln",
      "registernummer": "HRB 101555",
      "registerart": "HRB",
      "company_name": "LTA Legal & Tax Assekuranzmakler GmbH",
      "company_seat": "Köln",
      "details": "18.12.2025 (Bekanntmachungsdatum)\n\nNordrhein-Westfalen Amtsgericht Köln HRB 101555\nRegisterbekanntmachung nach dem Umwandlungsgesetz 18.12.2025 (Eintragungsdatum)\n\nLTA Legal & Tax Assekuranzmakler GmbH\nGesellschaft mit beschränkter Haftung\nKöln\n\nDen Gläubigern der an der Verschmelzung beteiligten Rechtsträger ist, wenn sie binnen sechs Monaten nach dem Tag, an dem die Eintragung der Verschmelzung in das Register des Sitzes desjenigen Rechtsträgers, dessen Gläubiger sie sind, nach § 19 Absatz 3 UmwG als bekanntgemacht gilt, ihren Anspruch nach Grund und Höhe schriftlich anmelden, Sicherheit zu leisten, soweit sie nicht Befriedigung verlangen können. Dieses Recht steht den Gläubigern jedoch nur zu, wenn sie glaubhaft machen, dass durch die Verschmelzung die Erfüllung ihrer Forderung gefährdet wird."
    },
    {
      "date": "2025-12-18",
      "id": "140523",
      "original_text": "Sonstige Registerbekanntmachung\nNordrhein-Westfalen Amtsgericht Hagen HRB 5575\nAVU Aktiengesellschaft für Versorgungs-Unternehmen – Gevelsberg",
      "type": "Sonstige Registerbekanntmachung",
      "state": "Nordrhein-Westfalen",
      "amtsgericht": "Amtsgericht Hagen",
      "registernummer": "HRB 5575",
      "registerart": "HRB",
      "company_name": "AVU Aktiengesellschaft für Versorgungs-Unternehmen",
      "company_seat": "Gevelsberg",
      "details": "18.12.2025 (Bekanntmachungsdatum)\n\nNordrhein-Westfalen Amtsgericht Hagen HRB 5575\nSonstige Registerbekanntmachung\n\nAVU Aktiengesellschaft für Versorgungs-Unternehmen\nAktiengesellschaft\nGevelsberg\n\nDie gesetzlichen Vertreter der Gesellschaft haben eine aktuelle Liste der Aufsichtsratsmitglieder zum Handelsregister eingereicht."
    },
    {
      "date": "2025-12-18",
      "id": "140524",
      "original_text": "Einreichung neuer Dokumente\nThüringen Amtsgericht Jena HRB 401130\nStädtische Wohnungsbaugesellschaft mbH Nordhausen – Nordhausen",
      "type": "Einreichung neuer Dokumente",
      "state": "Thüringen",
      "amtsgericht": "Amtsgericht Jena",
      "registernummer": "HRB 401130",
      "registerart": "HRB",
      "company_name": "Städtische Wohnungsbaugesellschaft mbH Nordhausen",
      "company_seat": "Nordhausen",
      "details": "18.12.2025 (Bekanntmachungsdatum)\n\nThüringen Amtsgericht Jena HRB 401130\nEinreichung neuer Dokumente 22.09.2025 (Eintragungsdatum)\n\nStädtische Wohnungsbaugesellschaft mbH Nordhausen\nGesellschaft mit beschränkter Haftung\nNordhausen\n\nBekanntmachung gem. § 52 Abs. 3 Satz 2 GmbHG: Aufgrund einer Veränderung in den Personen der Aufsichtsratsmitglieder ist durch die Geschäftsführerin eine neue Liste zum Handelsregister eingereicht worden."
    },
    {
      "date": "2025-12-18",
      "id": "140525",
      "original_text": "Registerbekanntmachung nach dem Umwandlungsgesetz\nHessen Amtsgericht Frankfurt am Main HRB 8633\nDeka Immobilien Investment GmbH – Frankfurt am Main",
      "type": "Registerbekanntmachung nach dem Umwandlungsgesetz",
      "state": "Hessen",
      "amtsgericht": "Amtsgericht Frankfurt am Main",
      "registernummer": "HRB 8633",
      "registerart": "HRB",
      "company_name": "Deka Immobilien Investment GmbH",
      "company_seat": "Frankfurt am Main",
      "details": "18.12.2025 (Bekanntmachungsdatum)\n\nHessen Amtsgericht Frankfurt am Main HRB 8633\nRegisterbekanntmachung nach dem Umwandlungsgesetz 18.12.2025 (Eintragungsdatum)\n\nDeka Immobilien Investment GmbH\nGesellschaft mit beschränkter Haftung\nFrankfurt am Main\n\nDen Gläubigern der an der Verschmelzung beteiligten Rechtsträger ist, wenn sie binnen sechs Monaten nach dem Tag, an dem die Eintragung der Verschmelzung in das Register des Sitzes desjenigen Rechtsträgers, dessen Gläubiger sie sind, nach §§ 122a Absatz 2, 19 Absatz 3 UmwG bekannt gemacht worden ist, ihren Anspruch nach Grund und Höhe schriftlich anmelden, Sicherheit zu leisten, soweit sie nicht Befriedigung verlangen können. Dieses Recht steht den Gläubigern jedoch nur zu, wenn sie glaubhaft machen, dass durch die Verschmelzung die Erfüllung ihrer Forderung gefährdet wird."
    },
    {
      "date": "2025-12-18",
      "id": "140526",
      "original_text": "Löschungsankündigung\nHessen Amtsgericht Wiesbaden HRA 9683\nNo Limit Adventure GmbH & Co.KG. – Wiesbaden",
      "type": "Löschungsankündigung",
      "state": "Hessen",
      "amtsgericht": "Amtsgericht Wiesbaden",
      "registernummer": "HRA 9683",
      "registerart": "HRA",
      "company_name": "No Limit Adventure GmbH & Co.KG.",
      "company_seat": "Wiesbaden",
      "details": "18.12.2025 (Bekanntmachungsdatum)\n\nHessen Amtsgericht Wiesbaden HRA 9683\nLöschungsankündigung\n\nNo Limit Adventure GmbH & Co.KG.\nKommanditgesellschaft\nWiesbaden\n\nDas Registergericht beabsichtigt die im Handelsregister eingetragene Firma von Amts wegen nach § 394 FamFG zu löschen. Die Frist zur Erhebung eines Widerspruchs gegen die beabsichtigte Löschung wird auf 3 Monate festgesetzt."
    },
    {
      "date": "2025-12-18",
      "id": "140527",
      "original_text": "Registerbekanntmachung nach dem Umwandlungsgesetz\nHessen Amtsgericht Offenbach am Main HRA 42581\nKappich Plastic-Werk e.K. – Heusenstamm",
      "type": "Registerbekanntmachung nach dem Umwandlungsgesetz",
      "state": "Hessen",
      "amtsgericht": "Amtsgericht Offenbach am Main",
      "registernummer": "HRA 42581",
      "registerart": "HRA",
      "company_name": "Kappich Plastic-Werk e.K.",
      "company_seat": "Heusenstamm",
      "details": "18.12.2025 (Bekanntmachungsdatum)\n\nHessen Amtsgericht Offenbach am Main HRA 42581\nRegisterbekanntmachung nach dem Umwandlungsgesetz 18.12.2025 (Eintragungsdatum)\n\nKappich Plastic-Werk e.K.\nEinzelkaufmann / Einzelkauffrau\nHeusenstamm\n\nDen Gläubigern der an der Ausgliederung beteiligten Rechtsträger ist, wenn sie binnen sechs Monaten nach dem Tag, an dem die Eintragung der Ausgliederung in das Register des Sitzes desjenigen Rechtsträgers, dessen Gläubiger sie sind, nach §§ 125, 19 Absatz 3 UmwG bekannt gemacht worden ist, ihren Anspruch nach Grund und Höhe schriftlich anmelden, Sicherheit zu leisten, soweit sie nicht Befriedigung verlangen können. Dieses Recht steht den Gläubigern jedoch nur zu, wenn sie glaubhaft machen, dass durch die Ausgliederung die Erfüllung ihrer Forderung gefährdet wird."
    },
    {
      "date": "2025-12-18",
      "id": "140528",
      "original_text": "Löschungsankündigung\nHessen Amtsgericht Offenbach am Main HRB 46081\nGMO Macchiato UG (haftungsbeschränkt) – Offenbach am Main",
      "type": "Löschungsankündigung",
      "state": "Hessen",
      "amtsgericht": "Amtsgericht Offenbach am Main",
      "registernummer": "HRB 46081",
      "registerart": "HRB",
      "company_name": "GMO Macchiato UG (haftungsbeschränkt)",
      "company_seat": "Offenbach am Main",
      "details": "18.12.2025 (Bekanntmachungsdatum)\n\nHessen Amtsgericht Offenbach am Main HRB 46081\nLöschungsankündigung\n\nGMO Macchiato UG (haftungsbeschränkt)\nGesellschaft mit beschränkter Haftung\nOffenbach am Main\n\nDas Registergericht beabsichtigt die im Handelsregister eingetragene Gesellschaft von Amts wegen nach § 394 FamFG zu löschen. Die Frist zur Erhebung eines Widerspruchs gegen die beabsichtigte Löschung wird auf 3 Monate festgesetzt."
    },
    {
      "date": "2025-12-18",
      "id": "140529",
      "original_text": "Sonstige Registerbekanntmachung\nHessen Amtsgericht Kassel VR 2769\nNiederzwehrener Kirmes – Kassel",
      "type": "Sonstige Registerbekanntmachung",
      "state": "Hessen",
      "amtsgericht": "Amtsgericht Kassel",
      "registernummer": "VR 2769",
      "registerart": "VR",
      "company_name": "Niederzwehrener Kirmes",
      "company_seat": "Kassel",
      "details": "18.12.2025 (Bekanntmachungsdatum)\n\nHessen Amtsgericht Kassel VR 2769\nSonstige Registerbekanntmachung 18.12.2025 (Eintragungsdatum)\n\nNiederzwehrener Kirmes\neingetragener Verein\nKassel\n\nDurch rechtskräftigen Beschluss des Amtsgerichts Kassel vom 04.11.2025 ist dem Verein gemäß § 73 BGB die Rechtsfähigkeit entzogen worden."
    },
    {
      "date": "2025-12-18",
      "id": "140530",
      "original_text": "Löschungsankündigung\nHessen Amtsgericht Hanau HRB 97376\nLanz Bau GmbH – Maintal",
      "type": "Löschungsankündigung",
      "state": "Hessen",
      "amtsgericht": "Amtsgericht Hanau",
      "registernummer": "HRB 97376",
      "registerart": "HRB",
      "company_name": "Lanz Bau GmbH",
      "company_seat": "Maintal",
      "details": "18.12.2025 (Bekanntmachungsdatum)\n\nHessen Amtsgericht Hanau HRB 97376\nLöschungsankündigung\n\nLanz Bau GmbH\nGesellschaft mit beschränkter Haftung\nMaintal\n\nDas Registergericht beabsichtigt die im Handelsregister eingetragene Gesellschaft von Amts wegen nach § 394 FamFG zu löschen. Die Frist zur Erhebung eines Widerspruchs gegen die beabsichtigte Löschung wird auf 3 Monate festgesetzt."
    },
    {
      "date": "2025-12-18",
      "id": "140531",
      "original_text": "Löschungsankündigung\nHessen Amtsgericht Offenbach am Main HRB 53011\nNOVA-BED GmbH – Offenbach am Main",
      "type": "Löschungsankündigung",
      "state": "Hessen",
      "amtsgericht": "Amtsgericht Offenbach am Main",
      "registernummer": "HRB 53011",
      "registerart": "HRB",
      "company_name": "NOVA-BED GmbH",
      "company_seat": "Offenbach am Main",
      "details": "18.12.2025 (Bekanntmachungsdatum)\n\nHessen Amtsgericht Offenbach am Main HRB 53011\nLöschungsankündigung\n\nNOVA-BED GmbH\nGesellschaft mit beschränkter Haftung\nOffenbach am Main\n\nDas Registergericht beabsichtigt die im Handelsregister eingetragene Gesellschaft von Amts wegen nach § 394 FamFG zu löschen. Die Frist zur Erhebung eines Widerspruchs gegen die beabsichtigte Löschung wird auf 3 Monate festgesetzt."
    },
    {
      "date": "2025-12-18",
      "id": "140532",
      "original_text": "Sonstige Registerbekanntmachung\nHessen Amtsgericht Limburg VR 953\nStaffeler Ritterschaft – Limburg a. d. Lahn - Staffel",
      "type": "Sonstige Registerbekanntmachung",
      "state": "Hessen",
      "amtsgericht": "Amtsgericht Limburg",
      "registernummer": "VR 953",
      "registerart": "VR",
      "company_name": "Staffeler Ritterschaft",
      "company_seat": "Limburg a. d. Lahn - Staffel",
      "details": "18.12.2025 (Bekanntmachungsdatum)\n\nHessen Amtsgericht Limburg VR 953\nSonstige Registerbekanntmachung 18.12.2025 (Eintragungsdatum)\n\nStaffeler Ritterschaft\neingetragener Verein\nLimburg a. d. Lahn - Staffel\n\nDer Verein ist aufgelöst und liquidationslos erloschen."
    },
    {
      "date": "2025-12-18",
      "id": "140533",
      "original_text": "Einreichung neuer Dokumente\nHessen Amtsgericht Frankfurt am Main HRB 123279\nEHTI Eurasia High Technology Industries SE – Frankfurt am Main",
      "type": "Einreichung neuer Dokumente",
      "state": "Hessen",
      "amtsgericht": "Amtsgericht Frankfurt am Main",
      "registernummer": "HRB 123279",
      "registerart": "HRB",
      "company_name": "EHTI Eurasia High Technology Industries SE",
      "company_seat": "Frankfurt am Main",
      "details": "18.12.2025 (Bekanntmachungsdatum)\n\nHessen Amtsgericht Frankfurt am Main HRB 123279\nEinreichung neuer Dokumente 18.12.2025 (Eintragungsdatum)\n\nEHTI Eurasia High Technology Industries SE\nEuropäische Aktiengesellschaft (SE)\nFrankfurt am Main\n\nDurch eine Änderung in den Personen der Verwaltungsratsmitglieder ist eine Liste der Mitglieder des Verwaltungsrates zum Handelsregister eingereicht worden."
    },
    {
      "date": "2025-12-18",
      "id": "140534",
      "original_text": "Löschungsankündigung\nHessen Amtsgericht Offenbach am Main HRA 41851\nMB Group GmbH & Co. Trans KG – Dreieich",
      "type": "Löschungsankündigung",
      "state": "Hessen",
      "amtsgericht": "Amtsgericht Offenbach am Main",
      "registernummer": "HRA 41851",
      "registerart": "HRA",
      "company_name": "MB Group GmbH & Co. Trans KG",
      "company_seat": "Dreieich",
      "details": "18.12.2025 (Bekanntmachungsdatum)\n\nHessen Amtsgericht Offenbach am Main HRA 41851\nLöschungsankündigung\n\nMB Group GmbH & Co. Trans KG\nKommanditgesellschaft\nDreieich\n\nDas Registergericht beabsichtigt die im Handelsregister eingetragene Firma von Amts wegen nach § 394 FamFG zu löschen. Die Frist zur Erhebung eines Widerspruchs gegen die beabsichtigte Löschung wird auf 3 Monate festgesetzt."
    },
    {
      "date": "2025-12-18",
      "id": "140535",
      "original_text": "Registerbekanntmachung nach dem Umwandlungsgesetz\nHessen Amtsgericht Wetzlar HRA 2638\nBestattungshaus Werner Dörr e.K. – Lahnau Ortsteil Atzbach",
      "type": "Registerbekanntmachung nach dem Umwandlungsgesetz",
      "state": "Hessen",
      "amtsgericht": "Amtsgericht Wetzlar",
      "registernummer": "HRA 2638",
      "registerart": "HRA",
      "company_name": "Bestattungshaus Werner Dörr e.K.",
      "company_seat": "Lahnau Ortsteil Atzbach",
      "details": "18.12.2025 (Bekanntmachungsdatum)\n\nHessen Amtsgericht Wetzlar HRA 2638\nRegisterbekanntmachung nach dem Umwandlungsgesetz 18.12.2025 (Eintragungsdatum)\n\nBestattungshaus Werner Dörr e.K.\nEinzelkaufmann / Einzelkauffrau\nLahnau Ortsteil Atzbach\n\nDen Gläubigern der an der Ausgliederung beteiligten Rechtsträger ist, wenn sie binnen sechs Monaten nach dem Tag, an dem die Eintragung der Ausgliederung in das Register des Sitzes desjenigen Rechtsträgers, dessen Gläubiger sie sind, nach §§ 125, 19 Absatz 3 UmwG bekannt gemacht worden ist, ihren Anspruch nach Grund und Höhe schriftlich anmelden, Sicherheit zu leisten, soweit sie nicht Befriedigung verlangen können. Dieses Recht steht den Gläubigern jedoch nur zu, wenn sie glaubhaft machen, dass durch die Ausgliederung die Erfüllung ihrer Forderung gefährdet wird."
    },
    {
      "date": "2025-12-18",
      "id": "140536",
      "original_text": "Löschungsankündigung\nHessen Amtsgericht Offenbach am Main HRB 46051\nElectronic XXL GmbH – Rodgau",
      "type": "Löschungsankündigung",
      "state": "Hessen",
      "amtsgericht": "Amtsgericht Offenbach am Main",
      "registernummer": "HRB 46051",
      "registerart": "HRB",
      "company_name": "Electronic XXL GmbH",
      "company_seat": "Rodgau",
      "details": "18.12.2025 (Bekanntmachungsdatum)\n\nHessen Amtsgericht Offenbach am Main HRB 46051\nLöschungsankündigung\n\nElectronic XXL GmbH\nGesellschaft mit beschränkter Haftung\nRodgau\n\nDas Registergericht beabsichtigt die im Handelsregister eingetragene Gesellschaft von Amts wegen nach § 394 FamFG zu löschen. Die Frist zur Erhebung eines Widerspruchs gegen die beabsichtigte Löschung wird auf 3 Monate festgesetzt."
    },
    {
      "date": "2025-12-18",
      "id": "140537",
      "original_text": "Registerbekanntmachung nach dem Umwandlungsgesetz\nHessen Amtsgericht Wetzlar HRA 8234\nBestattungshaus Dörr OHG – Lahnau",
      "type": "Registerbekanntmachung nach dem Umwandlungsgesetz",
      "state": "Hessen",
      "amtsgericht": "Amtsgericht Wetzlar",
      "registernummer": "HRA 8234",
      "registerart": "HRA",
      "company_name": "Bestattungshaus Dörr OHG",
      "company_seat": "Lahnau",
      "details": "18.12.2025 (Bekanntmachungsdatum)\n\nHessen Amtsgericht Wetzlar HRA 8234\nRegisterbekanntmachung nach dem Umwandlungsgesetz 18.12.2025 (Eintragungsdatum)\n\nBestattungshaus Dörr OHG\nOffene Handelsgesellschaft\nLahnau\n\nDen Gläubigern der an der Ausgliederung beteiligten Rechtsträger ist, wenn sie binnen sechs Monaten nach dem Tag, an dem die Eintragung der Ausgliederung in das Register des Sitzes desjenigen Rechtsträgers, dessen Gläubiger sie sind, nach §§ 125, 19 Absatz 3 UmwG bekannt gemacht worden ist, ihren Anspruch nach Grund und Höhe schriftlich anmelden, Sicherheit zu leisten, soweit sie nicht Befriedigung verlangen können. Dieses Recht steht den Gläubigern jedoch nur zu, wenn sie glaubhaft machen, dass durch die Ausgliederung die Erfüllung ihrer Forderung gefährdet wird."
    },
    {
      "date": "2025-12-18",
      "id": "140538",
      "original_text": "Löschungsankündigung\nHessen Amtsgericht Darmstadt HRB 89149\nSuntop Reisen GmbH – Rüsselsheim",
      "type": "Löschungsankündigung",
      "state": "Hessen",
      "amtsgericht": "Amtsgericht Darmstadt",
      "registernummer": "HRB 89149",
      "registerart": "HRB",
      "company_name": "Suntop Reisen GmbH",
      "company_seat": "Rüsselsheim",
      "details": "18.12.2025 (Bekanntmachungsdatum)\n\nHessen Amtsgericht Darmstadt HRB 89149\nLöschungsankündigung\n\nSuntop Reisen GmbH\nGesellschaft mit beschränkter Haftung\nRüsselsheim\n\nDas Registergericht beabsichtigt die im Handelsregister eingetragene Gesellschaft von Amts wegen nach § 394 FamFG zu löschen. Die Frist zur Erhebung eines Widerspruchs gegen die beabsichtigte Löschung wird auf 3 Monate festgesetzt."
    },
    {
      "date": "2025-12-18",
      "id": "140539",
      "original_text": "Registerbekanntmachung nach dem Umwandlungsgesetz\nHessen Amtsgericht Kassel HRB 20054\nBeckers Gutes vom Lande Lebensmittelhandel GmbH – Espenau",
      "type": "Registerbekanntmachung nach dem Umwandlungsgesetz",
      "state": "Hessen",
      "amtsgericht": "Amtsgericht Kassel",
      "registernummer": "HRB 20054",
      "registerart": "HRB",
      "company_name": "Beckers Gutes vom Lande Lebensmittelhandel GmbH",
      "company_seat": "Espenau",
      "details": "18.12.2025 (Bekanntmachungsdatum)\n\nHessen Amtsgericht Kassel HRB 20054\nRegisterbekanntmachung nach dem Umwandlungsgesetz 18.12.2025 (Eintragungsdatum)\n\nBeckers Gutes vom Lande Lebensmittelhandel GmbH\nGesellschaft mit beschränkter Haftung\nEspenau\n\nDie Gesellschaft hat Gläubigern, deren Forderungen vor dieser Bekanntmachung begründet worden sind, Sicherheit zu leisten, soweit sie nicht Befriedigung verlangen können, wenn sie sich binnen sechs Monaten nach dieser Bekanntmachung zu diesem Zweck melden.\nDen Gläubigern der an der Ausgliederung beteiligten Rechtsträger ist, wenn sie binnen sechs Monaten nach dem Tag, an dem die Eintragung der Ausgliederung in das Register des Sitzes desjenigen Rechtsträgers, dessen Gläubiger sie sind, nach §§ 125, 19 Absatz 3 UmwG bekannt gemacht worden ist, ihren Anspruch nach Grund und Höhe schriftlich anmelden, Sicherheit zu leisten, soweit sie nicht Befriedigung verlangen können. Dieses Recht steht den Gläubigern jedoch nur zu, wenn sie glaubhaft machen, dass durch die Ausgliederung die Erfüllung ihrer Forderung gefährdet wird."
    },
    {
      "date": "2025-12-18",
      "id": "140540",
      "original_text": "Registerbekanntmachung nach dem Umwandlungsgesetz\nHessen Amtsgericht Kassel HRA 18376\nKlaus-Günther Becker Lebensmittelhandel e. K. – Espenau",
      "type": "Registerbekanntmachung nach dem Umwandlungsgesetz",
      "state": "Hessen",
      "amtsgericht": "Amtsgericht Kassel",
      "registernummer": "HRA 18376",
      "registerart": "HRA",
      "company_name": "Klaus-Günther Becker Lebensmittelhandel e. K.",
      "company_seat": "Espenau",
      "details": "18.12.2025 (Bekanntmachungsdatum)\n\nHessen Amtsgericht Kassel HRA 18376\nRegisterbekanntmachung nach dem Umwandlungsgesetz 18.12.2025 (Eintragungsdatum)\n\nKlaus-Günther Becker Lebensmittelhandel e. K.\nEinzelkaufmann / Einzelkauffrau\nEspenau\n\nDen Gläubigern der an der Ausgliederung beteiligten Rechtsträger ist, wenn sie binnen sechs Monaten nach dem Tag, an dem die Eintragung der Ausgliederung in das Register des Sitzes desjenigen Rechtsträgers, dessen Gläubiger sie sind, nach §§ 125, 19 Absatz 3 UmwG bekannt gemacht worden ist, ihren Anspruch nach Grund und Höhe schriftlich anmelden, Sicherheit zu leisten, soweit sie nicht Befriedigung verlangen können. Dieses Recht steht den Gläubigern jedoch nur zu, wenn sie glaubhaft machen, dass durch die Ausgliederung die Erfüllung ihrer Forderung gefährdet wird."
    },
    {
      "date": "2025-12-18",
      "id": "140541",
      "original_text": "Löschungsankündigung\nHessen Amtsgericht Darmstadt HRB 97574\nThoFe24 GmbH – Bürstadt",
      "type": "Löschungsankündigung",
      "state": "Hessen",
      "amtsgericht": "Amtsgericht Darmstadt",
      "registernummer": "HRB 97574",
      "registerart": "HRB",
      "company_name": "ThoFe24 GmbH",
      "company_seat": "Bürstadt",
      "details": "18.12.2025 (Bekanntmachungsdatum)\n\nHessen Amtsgericht Darmstadt HRB 97574\nLöschungsankündigung 18.12.2025 (Eintragungsdatum)\n\nThoFe24 GmbH\nGesellschaft mit beschränkter Haftung\nBürstadt\n\nDas Registergericht beabsichtigt die im Handelsregister eingetragene Gesellschaft von Amts wegen nach § 394 FamFG zu löschen. Die Frist zur Erhebung eines Widerspruchs gegen die beabsichtigte Löschung wird auf 3 Monate festgesetzt."
    },
    {
      "date": "2025-12-18",
      "id": "140542",
      "original_text": "Löschungsankündigung\nHessen Amtsgericht Darmstadt HRB 105338\nOEURON.Shop UG (haftungsbeschränkt) – Ginsheim-Gustavsburg",
      "type": "Löschungsankündigung",
      "state": "Hessen",
      "amtsgericht": "Amtsgericht Darmstadt",
      "registernummer": "HRB 105338",
      "registerart": "HRB",
      "company_name": "OEURON.Shop UG (haftungsbeschränkt)",
      "company_seat": "Ginsheim-Gustavsburg",
      "details": "18.12.2025 (Bekanntmachungsdatum)\n\nHessen Amtsgericht Darmstadt HRB 105338\nLöschungsankündigung\n\nOEURON.Shop UG (haftungsbeschränkt)\nGesellschaft mit beschränkter Haftung\nGinsheim-Gustavsburg\n\nDas Registergericht beabsichtigt die im Handelsregister eingetragene Gesellschaft von Amts wegen nach § 394 FamFG zu löschen. Die Frist zur Erhebung eines Widerspruchs gegen die beabsichtigte Löschung wird auf 3 Monate festgesetzt."
    },
    {
      "date": "2025-12-18",
      "id": "140543",
      "original_text": "Registerbekanntmachung nach dem Umwandlungsgesetz\nHessen Amtsgericht Offenbach am Main HRA 43385\nPWK Plastic-Werk Kappich GmbH & Co. KG – Heusenstamm",
      "type": "Registerbekanntmachung nach dem Umwandlungsgesetz",
      "state": "Hessen",
      "amtsgericht": "Amtsgericht Offenbach am Main",
      "registernummer": "HRA 43385",
      "registerart": "HRA",
      "company_name": "PWK Plastic-Werk Kappich GmbH & Co. KG",
      "company_seat": "Heusenstamm",
      "details": "18.12.2025 (Bekanntmachungsdatum)\n\nHessen Amtsgericht Offenbach am Main HRA 43385\nRegisterbekanntmachung nach dem Umwandlungsgesetz 18.12.2025 (Eintragungsdatum)\n\nPWK Plastic-Werk Kappich GmbH & Co. KG\nKommanditgesellschaft\nHeusenstamm\n\nDen Gläubigern der an der Ausgliederung beteiligten Rechtsträger ist, wenn sie binnen sechs Monaten nach dem Tag, an dem die Eintragung der Ausgliederung in das Register des Sitzes desjenigen Rechtsträgers, dessen Gläubiger sie sind, nach §§ 125, 19 Absatz 3 UmwG bekannt gemacht worden ist, ihren Anspruch nach Grund und Höhe schriftlich anmelden, Sicherheit zu leisten, soweit sie nicht Befriedigung verlangen können. Dieses Recht steht den Gläubigern jedoch nur zu, wenn sie glaubhaft machen, dass durch die Ausgliederung die Erfüllung ihrer Forderung gefährdet wird."
    }
  ]
}