{
  "date": "2025-12-08",
  "date_of_scrape": "2025-12-09T04:13:25.615Z",
  "tool_version": "0.2.0",
  "number_of_announcements": 108,
  "announcements": [
    {
      "date": "2025-12-08",
      "id": "139339",
      "original_text": "Löschungsankündigung\nBerlin Amtsgericht Berlin (Charlottenburg) HRB 239008\nKalisi Bau GmbH – Berlin",
      "type": "Löschungsankündigung",
      "state": "Berlin",
      "amtsgericht": "Amtsgericht Berlin (Charlottenburg)",
      "registernummer": "HRB 239008",
      "registerart": "HRB",
      "company_name": "Kalisi Bau GmbH",
      "company_seat": "Berlin",
      "details": "08.12.2025 (Bekanntmachungsdatum)\n\nBerlin Amtsgericht Berlin (Charlottenburg) HRB 239008\nLöschungsankündigung\n\nKalisi Bau GmbH\nGesellschaft mit beschränkter Haftung\nBerlin\n\nBei der nachstehenden Gesellschaft wird das Amtslöschungsverfahren gemäß § 394 FamFG eingeleitet. Widerspruchsfrist 6 Wochen"
    },
    {
      "date": "2025-12-08",
      "id": "139340",
      "original_text": "Registerbekanntmachung nach dem Umwandlungsgesetz\nBerlin Amtsgericht Berlin (Charlottenburg) HRB 226958\nMastera GmbH – Berlin",
      "type": "Registerbekanntmachung nach dem Umwandlungsgesetz",
      "state": "Berlin",
      "amtsgericht": "Amtsgericht Berlin (Charlottenburg)",
      "registernummer": "HRB 226958",
      "registerart": "HRB",
      "company_name": "Mastera GmbH",
      "company_seat": "Berlin",
      "details": "08.12.2025 (Bekanntmachungsdatum)\n\nBerlin Amtsgericht Berlin (Charlottenburg) HRB 226958\nRegisterbekanntmachung nach dem Umwandlungsgesetz 07.12.2025 (Eintragungsdatum)\n\nMastera GmbH\nGesellschaft mit beschränkter Haftung\nBerlin\n\nZu Eintragungsnummer 4 vom 07.12.2025 wird als nicht eingetragen veröffentlicht:\n\nDen Gläubigern der an der Verschmelzung beteiligten Rechtsträger ist, wenn sie binnen sechs Monaten nach dem Tag, an dem die Eintragung der Verschmelzung in das Register des Sitzes desjenigen Rechtsträgers, dessen Gläubiger sie sind, als bekannt gemacht gilt, ihren Anspruch nach Grund und Höhe schriftlich anmelden, Sicherheit zu leisten, soweit sie nicht Befriedigung verlangen können. Dieses Recht steht den Gläubigern jedoch nur zu, wenn sie glaubhaft machen, dass durch die Verschmelzung die Erfüllung ihrer Forderung gefährdet wird. Das Recht, Sicherheitsleistung zu verlangen, steht Gläubigern nicht zu, die im Falle der Insolvenz ein Recht auf vorzugsweise Befriedigung aus einer Deckungsmasse haben, die nach gesetzlicher Vorschrift zu ihrem Schutz errichtet und staatlich überwacht ist."
    },
    {
      "date": "2025-12-08",
      "id": "139341",
      "original_text": "Löschungsankündigung\nBaden-Württemberg Amtsgericht Stuttgart HRB 244775\nJPEV Karosserie Konstuktionen GmbH – Sindelfingen",
      "type": "Löschungsankündigung",
      "state": "Baden-Württemberg",
      "amtsgericht": "Amtsgericht Stuttgart",
      "registernummer": "HRB 244775",
      "registerart": "HRB",
      "company_name": "JPEV Karosserie Konstuktionen GmbH",
      "company_seat": "Sindelfingen",
      "details": "08.12.2025 (Bekanntmachungsdatum)\n\nBaden-Württemberg Amtsgericht Stuttgart HRB 244775\nLöschungsankündigung\n\nJPEV Karosserie Konstuktionen GmbH\nGesellschaft mit beschränkter Haftung\nSindelfingen\n\nDas Gericht beabsichtigt, die Gesellschaft wegen Vermögenslosigkeit im Handelsregister von Amts wegen nach § 394 FamFG zu löschen. Die Frist zur Geltendmachung eines Widerspruchs gegen die beabsichtigte Löschung ist auf einen Monat ab Veröffentlichung bestimmt."
    },
    {
      "date": "2025-12-08",
      "id": "139342",
      "original_text": "Registerbekanntmachung nach dem Umwandlungsgesetz\nBaden-Württemberg Amtsgericht Stuttgart HRA 742198\nWurtz Hausverwaltung GmbH & Co. KG – Leonberg",
      "type": "Registerbekanntmachung nach dem Umwandlungsgesetz",
      "state": "Baden-Württemberg",
      "amtsgericht": "Amtsgericht Stuttgart",
      "registernummer": "HRA 742198",
      "registerart": "HRA",
      "company_name": "Wurtz Hausverwaltung GmbH & Co. KG",
      "company_seat": "Leonberg",
      "details": "08.12.2025 (Bekanntmachungsdatum)\n\nBaden-Württemberg Amtsgericht Stuttgart HRA 742198\nRegisterbekanntmachung nach dem Umwandlungsgesetz 08.12.2025 (Eintragungsdatum)\n\nWurtz Hausverwaltung GmbH & Co. KG\nKommanditgesellschaft\nLeonberg\n\nAls nicht eingetragen wird bekanntgemacht:\nDen Gläubigern der an der Ausgliederung beteiligten Rechtsträger ist, wenn sie binnen sechs Monaten nach dem Tag, an dem die Eintragung der Ausgliederung in das Register des Sitzes desjenigen Rechtsträgers, dessen Gläubiger sie sind, nach § 19 Abs. 3 UmwG als bekanntgemacht gilt, ihren Anspruch nach Grund und Höhe schriftlich anmelden, Sicherheit zu leisten, soweit sie nicht Befriedigung verlangen können. Dieses Recht steht den Gläubigern jedoch nur zu, wenn sie glaubhaft machen, dass durch die Ausgliederung die Erfüllung ihrer Forderung gefährdet wird."
    },
    {
      "date": "2025-12-08",
      "id": "139343",
      "original_text": "Einreichung neuer Dokumente\nBaden-Württemberg Amtsgericht Ulm HRB 501561\nCarl Zeiss Industrielle Messtechnik GmbH – Oberkochen",
      "type": "Einreichung neuer Dokumente",
      "state": "Baden-Württemberg",
      "amtsgericht": "Amtsgericht Ulm",
      "registernummer": "HRB 501561",
      "registerart": "HRB",
      "company_name": "Carl Zeiss Industrielle Messtechnik GmbH",
      "company_seat": "Oberkochen",
      "details": "08.12.2025 (Bekanntmachungsdatum)\n\nBaden-Württemberg Amtsgericht Ulm HRB 501561\nEinreichung neuer Dokumente 08.12.2025 (Eintragungsdatum)\n\nCarl Zeiss Industrielle Messtechnik GmbH\nGesellschaft mit beschränkter Haftung\nOberkochen\n\nDie Gesellschaft hat am 04.12.2025 die Liste über die Zusammensetzung des Aufsichtsrats zum Handelsregister eingereicht."
    },
    {
      "date": "2025-12-08",
      "id": "139344",
      "original_text": "Einreichung neuer Dokumente\nBaden-Württemberg Amtsgericht Ulm HRB 737231\nJ.M. Voith Management SE – Heidenheim an der Brenz",
      "type": "Einreichung neuer Dokumente",
      "state": "Baden-Württemberg",
      "amtsgericht": "Amtsgericht Ulm",
      "registernummer": "HRB 737231",
      "registerart": "HRB",
      "company_name": "J.M. Voith Management SE",
      "company_seat": "Heidenheim an der Brenz",
      "details": "08.12.2025 (Bekanntmachungsdatum)\n\nBaden-Württemberg Amtsgericht Ulm HRB 737231\nEinreichung neuer Dokumente 08.12.2025 (Eintragungsdatum)\n\nJ.M. Voith Management SE\nEuropäische Aktiengesellschaft (SE)\nHeidenheim an der Brenz\n\nDie Gesellschaft hat am 06.11.2025 die Liste über die Zusammensetzung des Aufsichtsrats zum Handelsregister eingereicht."
    },
    {
      "date": "2025-12-08",
      "id": "139345",
      "original_text": "Registerbekanntmachung nach dem Umwandlungsgesetz\nBaden-Württemberg Amtsgericht Stuttgart HRB 351150\nPaul Musse Elektrotechnik GmbH – Metzingen",
      "type": "Registerbekanntmachung nach dem Umwandlungsgesetz",
      "state": "Baden-Württemberg",
      "amtsgericht": "Amtsgericht Stuttgart",
      "registernummer": "HRB 351150",
      "registerart": "HRB",
      "company_name": "Paul Musse Elektrotechnik GmbH",
      "company_seat": "Metzingen",
      "details": "08.12.2025 (Bekanntmachungsdatum)\n\nBaden-Württemberg Amtsgericht Stuttgart HRB 351150\nRegisterbekanntmachung nach dem Umwandlungsgesetz 08.12.2025 (Eintragungsdatum)\n\nPaul Musse Elektrotechnik GmbH\nGesellschaft mit beschränkter Haftung\nMetzingen\n\nDen Gläubigern der an der Verschmelzung beteiligten Rechtsträger ist, wenn sie binnen sechs Monaten nach dem Tag, an dem die Eintragung der Verschmelzung in das Register des Sitzes desjenigen Rechtsträgers, dessen Gläubiger sie sind, nach § 19 Abs. 3 UmwG als bekanntgemacht gilt, ihren Anspruch nach Grund und Höhe schriftlich anmelden, Sicherheit zu leisten, soweit sie nicht Befriedigung verlangen können. Dieses Recht steht den Gläubigern jedoch nur zu, wenn sie glaubhaft machen, dass durch die Verschmelzung die Erfüllung ihrer Forderung gefährdet wird."
    },
    {
      "date": "2025-12-08",
      "id": "139346",
      "original_text": "Löschungsankündigung\nBaden-Württemberg Amtsgericht Mannheim HRA 3863\nConvest Heldermann Kommanditgesellschaft Objekt Colditz – Mannheim",
      "type": "Löschungsankündigung",
      "state": "Baden-Württemberg",
      "amtsgericht": "Amtsgericht Mannheim",
      "registernummer": "HRA 3863",
      "registerart": "HRA",
      "company_name": "Convest Heldermann Kommanditgesellschaft Objekt Colditz",
      "company_seat": "Mannheim",
      "details": "08.12.2025 (Bekanntmachungsdatum)\n\nBaden-Württemberg Amtsgericht Mannheim HRA 3863\nLöschungsankündigung\n\nConvest Heldermann Kommanditgesellschaft Objekt Colditz\nKommanditgesellschaft\nMannheim\n\nDas Gericht beabsichtigt, die Gesellschaft  von Amts wegen nach § 31 Abs. 2 HGB zu löschen. Die Frist zur Geltendmachung eines Widerspruchs gegen die beabsichtigte Löschung ist auf drei Monate ab Veröffentlichung bestimmt."
    },
    {
      "date": "2025-12-08",
      "id": "139347",
      "original_text": "Registerbekanntmachung nach dem Umwandlungsgesetz\nHamburg Amtsgericht Hamburg PR 1119\nnybo architekten Alexander Kubiessa Michael Raphael Partnerschafsgesellschaft mbB – Hamburg",
      "type": "Registerbekanntmachung nach dem Umwandlungsgesetz",
      "state": "Hamburg",
      "amtsgericht": "Amtsgericht Hamburg",
      "registernummer": "PR 1119",
      "registerart": "PR",
      "company_name": "nybo architekten Alexander Kubiessa Michael Raphael Partnerschafsgesellschaft mbB",
      "company_seat": "Hamburg",
      "details": "08.12.2025 (Bekanntmachungsdatum)\n\nHamburg Amtsgericht Hamburg PR 1119\nRegisterbekanntmachung nach dem Umwandlungsgesetz 08.12.2025 (Eintragungsdatum)\n\nnybo architekten Alexander Kubiessa Michael Raphael Partnerschafsgesellschaft mbB\nPartnerschaft\nHamburg\n\nAls nicht eingetragen wird bekannt gemacht:\nDen Gläubigern der an der formwechselnden Umwandlung beteiligten Gesellschaften ist, wenn sie binnen sechs Monaten nach dem Tag, an dem die Eintragung der formwechselnden Umwandlung in das Register des Sitzes desjenigen Rechtsträgers, dessen Gläubiger sie sind, nach § 19 Absatz 3 UmwG als bekannt gemacht gilt, ihren Anspruch nach Grund und Höhe schriftlich anmelden, Sicherheit zu leisten, soweit sie nicht Befriedigung verlangen können. Dieses Recht steht den Gläubigern jedoch nur zu, wenn sie glaubhaft machen, dass durch die formwechselnde Umwandlung die Erfüllung ihrer Forderung gefährdet wird."
    },
    {
      "date": "2025-12-08",
      "id": "139348",
      "original_text": "Löschungsankündigung\nBaden-Württemberg Amtsgericht Mannheim HRB 733856\nWWO - UG (haftungsbeschränlt) – Bühl",
      "type": "Löschungsankündigung",
      "state": "Baden-Württemberg",
      "amtsgericht": "Amtsgericht Mannheim",
      "registernummer": "HRB 733856",
      "registerart": "HRB",
      "company_name": "WWO - UG (haftungsbeschränlt)",
      "company_seat": "Bühl",
      "details": "08.12.2025 (Bekanntmachungsdatum)\n\nBaden-Württemberg Amtsgericht Mannheim HRB 733856\nLöschungsankündigung\n\nWWO - UG (haftungsbeschränlt)\nGesellschaft mit beschränkter Haftung\nBühl\n\nDas Gericht beabsichtigt, die Gesellschaft wegen Vermögenslosigkeit im Handelsregister von Amts wegen nach § 394 FamFG zu löschen. Die Frist zur Geltendmachung eines Widerspruchs gegen die beabsichtigte Löschung ist auf einen Monat ab Veröffentlichung bestimmt."
    },
    {
      "date": "2025-12-08",
      "id": "139349",
      "original_text": "Registerbekanntmachung nach dem Umwandlungsgesetz\nSachsen-Anhalt Amtsgericht Stendal HRA 3813\nDerBra Pv GmbH & Co. KG – Bördeland",
      "type": "Registerbekanntmachung nach dem Umwandlungsgesetz",
      "state": "Sachsen-Anhalt",
      "amtsgericht": "Amtsgericht Stendal",
      "registernummer": "HRA 3813",
      "registerart": "HRA",
      "company_name": "DerBra Pv GmbH & Co. KG",
      "company_seat": "Bördeland",
      "details": "08.12.2025 (Bekanntmachungsdatum)\n\nSachsen-Anhalt Amtsgericht Stendal HRA 3813\nRegisterbekanntmachung nach dem Umwandlungsgesetz 08.12.2025 (Eintragungsdatum)\n\nDerBra Pv GmbH & Co. KG\nKommanditgesellschaft\nBördeland\n\nNicht eingetragen:\nDen Gläubigern der an der Verschmelzung beteiligten Rechtsträger ist, wenn sie binnen sechs Monaten nach dem Tag, an dem die Eintragung der Verschmelzung nach § 19 Abs. 3 UmwG als bekanntgemacht gilt, ihren Anspruch nach Grund und Höhe schriftlich anmelden, Sicherheit zu leisten, soweit sie nicht Befriedigung verlangen können. Dieses Recht steht ihnen jedoch nur zu, wenn sie glaubhaft machen, dass durch die Verschmelzung die Erfüllung ihrer Forderung gefährdet wird."
    },
    {
      "date": "2025-12-08",
      "id": "139350",
      "original_text": "Registerbekanntmachung nach dem Umwandlungsgesetz\nSachsen-Anhalt Amtsgericht Stendal HRB 114893\nSchweinezucht GROSSMÜHLINGEN GmbH – Großmühlingen",
      "type": "Registerbekanntmachung nach dem Umwandlungsgesetz",
      "state": "Sachsen-Anhalt",
      "amtsgericht": "Amtsgericht Stendal",
      "registernummer": "HRB 114893",
      "registerart": "HRB",
      "company_name": "Schweinezucht GROSSMÜHLINGEN GmbH",
      "company_seat": "Großmühlingen",
      "details": "08.12.2025 (Bekanntmachungsdatum)\n\nSachsen-Anhalt Amtsgericht Stendal HRB 114893\nRegisterbekanntmachung nach dem Umwandlungsgesetz 08.12.2025 (Eintragungsdatum)\n\nSchweinezucht GROSSMÜHLINGEN GmbH\nGesellschaft mit beschränkter Haftung\nGroßmühlingen\n\nDie Biogas Grossmühlingen GmbH & Co.KG mit dem Sitz in Bördeland (Amtsgericht Stendal HRA 1860) und die DerBra Pv GmbH & Co.KG mit dem Sitz in Bördeland (Amtsgericht Stendal HRA 3813) sind auf Grund des Verschmelzungsvertrages vom 10.06.2025    und der Beschlüsse der Gesellschafterversammlungen vom selben Tag mit der Gesellschaft verschmolzen. Nicht eingetragen: Den Gläubigern der an der Verschmelzung beteiligten Rechtsträger ist, wenn sie binnen sechs Monaten nach dem Tag, an dem die Eintragung der Verschmelzung nach § 19 Abs. 3 UmwG als bekanntgemacht gilt, ihren Anspruch nach Grund und Höhe schriftlich anmelden, Sicherheit zu leisten, soweit sie nicht Befriedigung verlangen können. Dieses Recht steht ihnen jedoch nur zu, wenn sie glaubhaft machen, dass durch die Verschmelzung die Erfüllung ihrer Forderung gefährdet wird."
    },
    {
      "date": "2025-12-08",
      "id": "139351",
      "original_text": "Registerbekanntmachung nach dem Umwandlungsgesetz\nBrandenburg Amtsgericht Potsdam HRB 30213\nEQ Vision GmbH – Zossen",
      "type": "Registerbekanntmachung nach dem Umwandlungsgesetz",
      "state": "Brandenburg",
      "amtsgericht": "Amtsgericht Potsdam",
      "registernummer": "HRB 30213",
      "registerart": "HRB",
      "company_name": "EQ Vision GmbH",
      "company_seat": "Zossen",
      "details": "08.12.2025 (Bekanntmachungsdatum)\n\nBrandenburg Amtsgericht Potsdam HRB 30213\nRegisterbekanntmachung nach dem Umwandlungsgesetz 06.12.2025 (Eintragungsdatum)\n\nEQ Vision GmbH\nGesellschaft mit beschränkter Haftung\nZossen\n\nZu Eintragungsnummer 6 vom 06.12.2025 wird als nicht eingetragen veröffentlicht:\nDen Gläubigern der an der Verschmelzung beteiligten Rechtsträger ist, wenn sie binnen sechs Monaten nach dem Tag, an dem die Eintragung der Verschmelzung in das Register des Sitzes desjenigen Rechtsträgers, dessen Gläubiger sie sind, als bekannt gemacht gilt, ihren Anspruch nach Grund und Höhe schriftlich anmelden, Sicherheit zu leisten, soweit sie nicht Befriedigung verlangen können. Dieses Recht steht den Gläubigern jedoch nur zu, wenn sie glaubhaft machen, dass durch die Verschmelzung die Erfüllung ihrer Forderung gefährdet wird"
    },
    {
      "date": "2025-12-08",
      "id": "139352",
      "original_text": "Löschungsankündigung\nBaden-Württemberg Amtsgericht Mannheim HRB 735657\nKADO Cooperation GmbH – Karlsruhe",
      "type": "Löschungsankündigung",
      "state": "Baden-Württemberg",
      "amtsgericht": "Amtsgericht Mannheim",
      "registernummer": "HRB 735657",
      "registerart": "HRB",
      "company_name": "KADO Cooperation GmbH",
      "company_seat": "Karlsruhe",
      "details": "08.12.2025 (Bekanntmachungsdatum)\n\nBaden-Württemberg Amtsgericht Mannheim HRB 735657\nLöschungsankündigung\n\nKADO Cooperation GmbH\nGesellschaft mit beschränkter Haftung\nKarlsruhe\n\nDas Gericht beabsichtigt, die Gesellschaft wegen Vermögenslosigkeit im Handelsregister von Amts wegen nach § 394 FamFG zu löschen. Die Frist zur Geltendmachung eines Widerspruchs gegen die beabsichtigte Löschung ist auf einen Monat ab Veröffentlichung bestimmt."
    },
    {
      "date": "2025-12-08",
      "id": "139353",
      "original_text": "Registerbekanntmachung nach dem Umwandlungsgesetz\nBrandenburg Amtsgericht Potsdam HRB 17169\nEnergiequelle Verwaltungs GmbH – Treuenbrietzen",
      "type": "Registerbekanntmachung nach dem Umwandlungsgesetz",
      "state": "Brandenburg",
      "amtsgericht": "Amtsgericht Potsdam",
      "registernummer": "HRB 17169",
      "registerart": "HRB",
      "company_name": "Energiequelle Verwaltungs GmbH",
      "company_seat": "Treuenbrietzen",
      "details": "08.12.2025 (Bekanntmachungsdatum)\n\nBrandenburg Amtsgericht Potsdam HRB 17169\nRegisterbekanntmachung nach dem Umwandlungsgesetz 06.12.2025 (Eintragungsdatum)\n\nEnergiequelle Verwaltungs GmbH\nGesellschaft mit beschränkter Haftung\nTreuenbrietzen\n\nZu Eintragungsnummer 12 vom 06.12.2025 wird als nicht eingetragen veröffentlicht:\nDen Gläubigern der an der Verschmelzung beteiligten Rechtsträger ist, wenn sie binnen sechs Monaten nach dem Tag, an dem die Eintragung der Verschmelzung in das Register des Sitzes desjenigen Rechtsträgers, dessen Gläubiger sie sind, als bekannt gemacht gilt, ihren Anspruch nach Grund und Höhe schriftlich anmelden, Sicherheit zu leisten, soweit sie nicht Befriedigung verlangen können. Dieses Recht steht den Gläubigern jedoch nur zu, wenn sie glaubhaft machen, dass durch die Verschmelzung die Erfüllung ihrer Forderung gefährdet wird."
    },
    {
      "date": "2025-12-08",
      "id": "139354",
      "original_text": "Sonstige Registerbekanntmachung\nBaden-Württemberg Amtsgericht Ulm HRB 532914\nGOI Vertriebs GmbH – Göppingen",
      "type": "Sonstige Registerbekanntmachung",
      "state": "Baden-Württemberg",
      "amtsgericht": "Amtsgericht Ulm",
      "registernummer": "HRB 532914",
      "registerart": "HRB",
      "company_name": "GOI Vertriebs GmbH",
      "company_seat": "Göppingen",
      "details": "08.12.2025 (Bekanntmachungsdatum)\n\nBaden-Württemberg Amtsgericht Ulm HRB 532914\nSonstige Registerbekanntmachung 08.12.2025 (Eintragungsdatum)\n\nGOI Vertriebs GmbH\nGesellschaft mit beschränkter Haftung\nGöppingen\n\nAls nicht eingetragen wird bekanntgemacht:\nDen Gläubigern der Gesellschaft, deren Forderungen begründet worden sind, bevor die Eintragung der Beendigung des Vertrages in das Handelsregister nach § 10 HGB als bekanntgemacht gilt, ist vom anderen Vertragsteil Sicherheit zu leisten, wenn sie sich binnen sechs Monaten nach der Bekanntmachung zu diesem Zweck bei ihm melden."
    },
    {
      "date": "2025-12-08",
      "id": "139355",
      "original_text": "Einreichung neuer Dokumente\nSaarland Amtsgericht Saarbrücken HRB 7461\nCOSMOS Versicherung Aktiengesellschaft – Saarbrücken",
      "type": "Einreichung neuer Dokumente",
      "state": "Saarland",
      "amtsgericht": "Amtsgericht Saarbrücken",
      "registernummer": "HRB 7461",
      "registerart": "HRB",
      "company_name": "COSMOS Versicherung Aktiengesellschaft",
      "company_seat": "Saarbrücken",
      "details": "08.12.2025 (Bekanntmachungsdatum)\n\nSaarland Amtsgericht Saarbrücken HRB 7461\nEinreichung neuer Dokumente 01.12.2025 (Eintragungsdatum)\n\nCOSMOS Versicherung Aktiengesellschaft\nAktiengesellschaft\nSaarbrücken\n\nDer Vorstand der Gesellschaft hat eine Liste der Mitglieder des Aufsichtsrats zum Handelsregister eingereicht (§ 106 AktG)."
    },
    {
      "date": "2025-12-08",
      "id": "139356",
      "original_text": "Löschungsankündigung\nBerlin Amtsgericht Berlin (Charlottenburg) HRB 167279\nSidestage UG (haftungsbeschränkt) – Berlin",
      "type": "Löschungsankündigung",
      "state": "Berlin",
      "amtsgericht": "Amtsgericht Berlin (Charlottenburg)",
      "registernummer": "HRB 167279",
      "registerart": "HRB",
      "company_name": "Sidestage UG (haftungsbeschränkt)",
      "company_seat": "Berlin",
      "details": "08.12.2025 (Bekanntmachungsdatum)\n\nBerlin Amtsgericht Berlin (Charlottenburg) HRB 167279\nLöschungsankündigung\n\nSidestage UG (haftungsbeschränkt)\nGesellschaft mit beschränkter Haftung\nBerlin\n\nBei der nachstehenden Gesellschaft wird das Amtslöschungsverfahren gemäß § 394 FamFG eingeleitet. Widerspruchsfrist 6 Wochen"
    },
    {
      "date": "2025-12-08",
      "id": "139357",
      "original_text": "Löschungsankündigung\nBaden-Württemberg Amtsgericht Stuttgart HRB 758382\nLengyel Spedition GmbH – Obersulm",
      "type": "Löschungsankündigung",
      "state": "Baden-Württemberg",
      "amtsgericht": "Amtsgericht Stuttgart",
      "registernummer": "HRB 758382",
      "registerart": "HRB",
      "company_name": "Lengyel Spedition GmbH",
      "company_seat": "Obersulm",
      "details": "08.12.2025 (Bekanntmachungsdatum)\n\nBaden-Württemberg Amtsgericht Stuttgart HRB 758382\nLöschungsankündigung\n\nLengyel Spedition GmbH\nGesellschaft mit beschränkter Haftung\nObersulm\n\nAls nicht eingetragen wird bekanntgemacht:\nDas Gericht beabsichtigt, die Gesellschaft wegen Vermögenslosigkeit im Handelsregister von Amts wegen nach § 394 FamFG zu löschen. Die Frist zur Geltendmachung eines Widerspruchs gegen die beabsichtigte Löschung ist auf zwei Monate ab Veröffentlichung bestimmt."
    },
    {
      "date": "2025-12-08",
      "id": "139358",
      "original_text": "Löschungsankündigung\nBerlin Amtsgericht Berlin (Charlottenburg) HRB 241929\nBiser Company GmbH – Berlin",
      "type": "Löschungsankündigung",
      "state": "Berlin",
      "amtsgericht": "Amtsgericht Berlin (Charlottenburg)",
      "registernummer": "HRB 241929",
      "registerart": "HRB",
      "company_name": "Biser Company GmbH",
      "company_seat": "Berlin",
      "details": "08.12.2025 (Bekanntmachungsdatum)\n\nBerlin Amtsgericht Berlin (Charlottenburg) HRB 241929\nLöschungsankündigung\n\nBiser Company GmbH\nGesellschaft mit beschränkter Haftung\nBerlin\n\nBei der nachstehenden Gesellschaft wird das Amtslöschungsverfahren gemäß § 394 FamFG eingeleitet. Widerspruchsfrist 6 Wochen"
    },
    {
      "date": "2025-12-08",
      "id": "139359",
      "original_text": "Sonstige Registerbekanntmachung\nSachsen-Anhalt Amtsgericht Stendal HRB 72\nBurger Schuhfabrik GmbH – Burg",
      "type": "Sonstige Registerbekanntmachung",
      "state": "Sachsen-Anhalt",
      "amtsgericht": "Amtsgericht Stendal",
      "registernummer": "HRB 72",
      "registerart": "HRB",
      "company_name": "Burger Schuhfabrik GmbH",
      "company_seat": "Burg",
      "details": "08.12.2025 (Bekanntmachungsdatum)\n\nSachsen-Anhalt Amtsgericht Stendal HRB 72\nSonstige Registerbekanntmachung\n\nBurger Schuhfabrik GmbH\nGesellschaft mit beschränkter Haftung\nBurg\n\nDas Registergericht beabsichtigt, für nachfolgende im Handelregister eingetragenen Firmen Herr  Rechtsanwälte Müller-Güldemeister, 12205 Berlin zum Nachtragsliquidator der Gesellschaft zu bestellen.\nDie Frist zu Erhebung eines Widerspruchs wird auf zwei Wochen festgesetzt."
    },
    {
      "date": "2025-12-08",
      "id": "139360",
      "original_text": "Einreichung neuer Dokumente\nBaden-Württemberg Amtsgericht Stuttgart HRB 440006\nBaugesellschaft Horb Gesellschaft mit beschränkter Haftung – Horb am Neckar",
      "type": "Einreichung neuer Dokumente",
      "state": "Baden-Württemberg",
      "amtsgericht": "Amtsgericht Stuttgart",
      "registernummer": "HRB 440006",
      "registerart": "HRB",
      "company_name": "Baugesellschaft Horb Gesellschaft mit beschränkter Haftung",
      "company_seat": "Horb am Neckar",
      "details": "08.12.2025 (Bekanntmachungsdatum)\n\nBaden-Württemberg Amtsgericht Stuttgart HRB 440006\nEinreichung neuer Dokumente\n\nBaugesellschaft Horb Gesellschaft mit beschränkter Haftung\nGesellschaft mit beschränkter Haftung\nHorb am Neckar\n\nDie Gesellschaft hat am 03.12.2025 die Liste über die Zusammensetzung des Aufsichtsrats zum Handelsregister eingereicht."
    },
    {
      "date": "2025-12-08",
      "id": "139361",
      "original_text": "Registerbekanntmachung nach dem Umwandlungsgesetz\nSachsen-Anhalt Amtsgericht Stendal HRA 1860\nBiogas Grossmühlingen GmbH & Co. KG – Bördeland",
      "type": "Registerbekanntmachung nach dem Umwandlungsgesetz",
      "state": "Sachsen-Anhalt",
      "amtsgericht": "Amtsgericht Stendal",
      "registernummer": "HRA 1860",
      "registerart": "HRA",
      "company_name": "Biogas Grossmühlingen GmbH & Co. KG",
      "company_seat": "Bördeland",
      "details": "08.12.2025 (Bekanntmachungsdatum)\n\nSachsen-Anhalt Amtsgericht Stendal HRA 1860\nRegisterbekanntmachung nach dem Umwandlungsgesetz 08.12.2025 (Eintragungsdatum)\n\nBiogas Grossmühlingen GmbH & Co. KG\nKommanditgesellschaft\nBördeland\n\nNicht eingetragen:\nDen Gläubigern der an der Verschmelzung beteiligten Rechtsträger ist, wenn sie binnen sechs Monaten nach dem Tag, an dem die Eintragung der Verschmelzung nach § 19 Abs. 3 UmwG als bekanntgemacht gilt, ihren Anspruch nach Grund und Höhe schriftlich anmelden, Sicherheit zu leisten, soweit sie nicht Befriedigung verlangen können. Dieses Recht steht ihnen jedoch nur zu, wenn sie glaubhaft machen, dass durch die Verschmelzung die Erfüllung ihrer Forderung gefährdet wird."
    },
    {
      "date": "2025-12-08",
      "id": "139362",
      "original_text": "Sonstige Registerbekanntmachung\nMecklenburg-Vorpommern Amtsgericht Rostock HRB 11369\nReriker BildungsArt AG – Rerik",
      "type": "Sonstige Registerbekanntmachung",
      "state": "Mecklenburg-Vorpommern",
      "amtsgericht": "Amtsgericht Rostock",
      "registernummer": "HRB 11369",
      "registerart": "HRB",
      "company_name": "Reriker BildungsArt AG",
      "company_seat": "Rerik",
      "details": "08.12.2025 (Bekanntmachungsdatum)\n\nMecklenburg-Vorpommern Amtsgericht Rostock HRB 11369\nSonstige Registerbekanntmachung\n\nReriker BildungsArt AG\nAktiengesellschaft\nRerik\n\nEine Liste der Mitglieder des Aufsichtsrats ist zum Handelsregister eingereicht worden."
    },
    {
      "date": "2025-12-08",
      "id": "139363",
      "original_text": "Einreichung neuer Dokumente\nBaden-Württemberg Amtsgericht Mannheim HRB 201995\nEurAka Baden-Baden gGmbH – Baden-Baden",
      "type": "Einreichung neuer Dokumente",
      "state": "Baden-Württemberg",
      "amtsgericht": "Amtsgericht Mannheim",
      "registernummer": "HRB 201995",
      "registerart": "HRB",
      "company_name": "EurAka Baden-Baden gGmbH",
      "company_seat": "Baden-Baden",
      "details": "08.12.2025 (Bekanntmachungsdatum)\n\nBaden-Württemberg Amtsgericht Mannheim HRB 201995\nEinreichung neuer Dokumente\n\nEurAka Baden-Baden gGmbH\nGesellschaft mit beschränkter Haftung\nBaden-Baden\n\nDie Gesellschaft hat am 28.11.2025 die Liste über die Zusammensetzung des Aufsichtsrats zum Handelsregister eingereicht."
    },
    {
      "date": "2025-12-08",
      "id": "139364",
      "original_text": "Einreichung neuer Dokumente\nSachsen-Anhalt Amtsgericht Stendal HRB 104283\nMittelständische Beteiligungsgesellschaft Sachsen-Anhalt (MBG) mbH – Magdeburg",
      "type": "Einreichung neuer Dokumente",
      "state": "Sachsen-Anhalt",
      "amtsgericht": "Amtsgericht Stendal",
      "registernummer": "HRB 104283",
      "registerart": "HRB",
      "company_name": "Mittelständische Beteiligungsgesellschaft Sachsen-Anhalt (MBG) mbH",
      "company_seat": "Magdeburg",
      "details": "08.12.2025 (Bekanntmachungsdatum)\n\nSachsen-Anhalt Amtsgericht Stendal HRB 104283\nEinreichung neuer Dokumente\n\nMittelständische Beteiligungsgesellschaft Sachsen-Anhalt (MBG) mbH\nGesellschaft mit beschränkter Haftung\nMagdeburg\n\nEine Liste der Mitglieder des Aufsichtsrates wurde zum Handelsregister eingereicht."
    },
    {
      "date": "2025-12-08",
      "id": "139365",
      "original_text": "Einreichung neuer Dokumente\nBerlin Amtsgericht Berlin (Charlottenburg) HRB 59349\nGdW Revision Aktiengesellschaft Wirtschaftsprüfungsgesellschaft Steuerberatungsgesellschaft – Berlin",
      "type": "Einreichung neuer Dokumente",
      "state": "Berlin",
      "amtsgericht": "Amtsgericht Berlin (Charlottenburg)",
      "registernummer": "HRB 59349",
      "registerart": "HRB",
      "company_name": "GdW Revision Aktiengesellschaft Wirtschaftsprüfungsgesellschaft Steuerberatungsgesellschaft",
      "company_seat": "Berlin",
      "details": "08.12.2025 (Bekanntmachungsdatum)\n\nBerlin Amtsgericht Berlin (Charlottenburg) HRB 59349\nEinreichung neuer Dokumente\n\nGdW Revision Aktiengesellschaft Wirtschaftsprüfungsgesellschaft Steuerberatungsgesellschaft\nAktiengesellschaft\nBerlin\n\nAls nicht eingetragen wird veröffentlicht: Es wurde eine neue Liste der Aufsichtsratsmitglieder eingereicht (§ 106 AktG)."
    },
    {
      "date": "2025-12-08",
      "id": "139366",
      "original_text": "Löschungsankündigung\nBaden-Württemberg Amtsgericht Mannheim HRB 721815\nNBM Bauunternehmung Stutensee GmbH – Stutensee",
      "type": "Löschungsankündigung",
      "state": "Baden-Württemberg",
      "amtsgericht": "Amtsgericht Mannheim",
      "registernummer": "HRB 721815",
      "registerart": "HRB",
      "company_name": "NBM Bauunternehmung Stutensee GmbH",
      "company_seat": "Stutensee",
      "details": "08.12.2025 (Bekanntmachungsdatum)\n\nBaden-Württemberg Amtsgericht Mannheim HRB 721815\nLöschungsankündigung\n\nNBM Bauunternehmung Stutensee GmbH\nGesellschaft mit beschränkter Haftung\nStutensee\n\nAls nicht eingetragen wird bekanntgemacht:\nDas Gericht beabsichtigt, die Gesellschaft wegen Vermögenslosigkeit im Handelsregister von Amts wegen nach § 394 FamFG zu löschen. Die Frist zur Geltendmachung eines Widerspruchs gegen die beabsichtigte Löschung ist auf einen Monat ab Veröffentlichung bestimmt."
    },
    {
      "date": "2025-12-08",
      "id": "139367",
      "original_text": "Registerbekanntmachung nach dem Umwandlungsgesetz\nThüringen Amtsgericht Jena HRA 506844\nProtectum Humanum e.K. – Meiningen",
      "type": "Registerbekanntmachung nach dem Umwandlungsgesetz",
      "state": "Thüringen",
      "amtsgericht": "Amtsgericht Jena",
      "registernummer": "HRA 506844",
      "registerart": "HRA",
      "company_name": "Protectum Humanum e.K.",
      "company_seat": "Meiningen",
      "details": "08.12.2025 (Bekanntmachungsdatum)\n\nThüringen Amtsgericht Jena HRA 506844\nRegisterbekanntmachung nach dem Umwandlungsgesetz 08.12.2025 (Eintragungsdatum)\n\nProtectum Humanum e.K.\nEinzelkaufmann / Einzelkauffrau\nMeiningen\n\nNicht eingetragen: Den Gläubigern der an der Ausgliederung beteiligten Rechtsträger, ist wenn sie binnen sechs Monaten nach dem Tag, an dem die Eintragung der Ausgliederung in das Register des Sitzes desjenigen Rechtsträgers, dessen Gläubiger sie sind, nach §§125, 19 Abs. 3 UmwG als bekanntgemacht gilt, ihren Anspruch nach Grund und Höhe schriftlich anmelden, Sicherheit zu leisten, soweit sie nicht Befriedigung verlangen können. Dieses Recht steht ihnen jedoch nur zu, wenn sie glaubhaft machen, daß durch die Ausgliederung die Erfüllung ihrer Forderung gefährdet wird."
    },
    {
      "date": "2025-12-08",
      "id": "139368",
      "original_text": "Sonstige Registerbekanntmachung\nHamburg Amtsgericht Hamburg HRB 79505\nZweite Mercator Vermietungsgesellschaft mbH – Hamburg",
      "type": "Sonstige Registerbekanntmachung",
      "state": "Hamburg",
      "amtsgericht": "Amtsgericht Hamburg",
      "registernummer": "HRB 79505",
      "registerart": "HRB",
      "company_name": "Zweite Mercator Vermietungsgesellschaft mbH",
      "company_seat": "Hamburg",
      "details": "08.12.2025 (Bekanntmachungsdatum)\n\nHamburg Amtsgericht Hamburg HRB 79505\nSonstige Registerbekanntmachung 04.12.2025 (Eintragungsdatum)\n\nZweite Mercator Vermietungsgesellschaft mbH\nGesellschaft mit beschränkter Haftung\nHamburg\n\nAls nicht eingetragen wird bekannt gemacht:  Den Gläubigern der Gesellschaft, deren Forderungen begründet worden sind, bevor die Eintragung der Vertragsbeendigung in das Handelsregister nach § 10 HGB als bekannt gemacht gilt, ist vom anderen Vertragsteil Sicherheit zu leisten, wenn sie sich binnen 6 Monaten nach Bekanntmachung der Eintragung zu diesem Zweck bei ihm melden."
    },
    {
      "date": "2025-12-08",
      "id": "139369",
      "original_text": "Sonstige Registerbekanntmachung\nHamburg Amtsgericht Hamburg HRB 72042\nBritish American Tobacco (Industrie) GmbH – Hamburg",
      "type": "Sonstige Registerbekanntmachung",
      "state": "Hamburg",
      "amtsgericht": "Amtsgericht Hamburg",
      "registernummer": "HRB 72042",
      "registerart": "HRB",
      "company_name": "British American Tobacco (Industrie) GmbH",
      "company_seat": "Hamburg",
      "details": "08.12.2025 (Bekanntmachungsdatum)\n\nHamburg Amtsgericht Hamburg HRB 72042\nSonstige Registerbekanntmachung\n\nBritish American Tobacco (Industrie) GmbH\nGesellschaft mit beschränkter Haftung\nHamburg\n\nAls nicht eingetragen wird bekannt gemacht: Liste des Aufsichtsrats wurde eingereicht."
    },
    {
      "date": "2025-12-08",
      "id": "139370",
      "original_text": "Registerbekanntmachung nach dem Umwandlungsgesetz\nBrandenburg Amtsgericht Cottbus HRB 735\nZüblin Stahlbau GmbH – Senftenberg",
      "type": "Registerbekanntmachung nach dem Umwandlungsgesetz",
      "state": "Brandenburg",
      "amtsgericht": "Amtsgericht Cottbus",
      "registernummer": "HRB 735",
      "registerart": "HRB",
      "company_name": "Züblin Stahlbau GmbH",
      "company_seat": "Senftenberg",
      "details": "08.12.2025 (Bekanntmachungsdatum)\n\nBrandenburg Amtsgericht Cottbus HRB 735\nRegisterbekanntmachung nach dem Umwandlungsgesetz 05.12.2025 (Eintragungsdatum)\n\nZüblin Stahlbau GmbH\nGesellschaft mit beschränkter Haftung\nSenftenberg\n\nZu Eintragungsnummer 21 vom 05.12.2025 wird als nicht eingetragen veröffentlicht:\nAls nicht eingetragen wird veröffentlicht:\nDen Gläubigern der an der Verschmelzung beteiligten Rechtsträger ist, wenn sie binnen sechs Monaten nach dem Tag, an dem die Eintragung der Verschmelzung in das Register des Sitzes desjenigen Rechtsträgers, dessen Gläubiger sie sind, als bekannt gemacht gilt, ihren Anspruch nach Grund und Höhe schriftlich anmelden, Sicherheit zu leisten, soweit sie nicht Befriedigung verlangen können. Dieses Recht steht den Gläubigern jedoch nur zu, wenn sie glaubhaft machen, dass durch die Verschmelzung die Erfüllung ihrer Forderung gefährdet wird"
    },
    {
      "date": "2025-12-08",
      "id": "139371",
      "original_text": "Einreichung neuer Dokumente\nBaden-Württemberg Amtsgericht Ulm HRB 501555\nCarl Zeiss AG – Oberkochen",
      "type": "Einreichung neuer Dokumente",
      "state": "Baden-Württemberg",
      "amtsgericht": "Amtsgericht Ulm",
      "registernummer": "HRB 501555",
      "registerart": "HRB",
      "company_name": "Carl Zeiss AG",
      "company_seat": "Oberkochen",
      "details": "08.12.2025 (Bekanntmachungsdatum)\n\nBaden-Württemberg Amtsgericht Ulm HRB 501555\nEinreichung neuer Dokumente\n\nCarl Zeiss AG\nAktiengesellschaft\nOberkochen\n\nDie Gesellschaft hat am 04.12.2025 die Liste über die Zusammensetzung des Aufsichtsrats zum Handelsregister eingereicht."
    },
    {
      "date": "2025-12-08",
      "id": "139372",
      "original_text": "Sonstige Registerbekanntmachung\nHamburg Amtsgericht Hamburg HRB 1905\nBATIG Gesellschaft für Beteiligungen mbH – Hamburg",
      "type": "Sonstige Registerbekanntmachung",
      "state": "Hamburg",
      "amtsgericht": "Amtsgericht Hamburg",
      "registernummer": "HRB 1905",
      "registerart": "HRB",
      "company_name": "BATIG Gesellschaft für Beteiligungen mbH",
      "company_seat": "Hamburg",
      "details": "08.12.2025 (Bekanntmachungsdatum)\n\nHamburg Amtsgericht Hamburg HRB 1905\nSonstige Registerbekanntmachung\n\nBATIG Gesellschaft für Beteiligungen mbH\nGesellschaft mit beschränkter Haftung\nHamburg\n\nAls nicht eingetragen wird bekannt gemacht: Liste des Aufsichtsrats wurde eingereicht."
    },
    {
      "date": "2025-12-08",
      "id": "139373",
      "original_text": "Registerbekanntmachung nach dem Umwandlungsgesetz\nBaden-Württemberg Amtsgericht Stuttgart HRB 779739\nAlba Beteiligungsgesellschaft mbH – Ludwigsburg",
      "type": "Registerbekanntmachung nach dem Umwandlungsgesetz",
      "state": "Baden-Württemberg",
      "amtsgericht": "Amtsgericht Stuttgart",
      "registernummer": "HRB 779739",
      "registerart": "HRB",
      "company_name": "Alba Beteiligungsgesellschaft mbH",
      "company_seat": "Ludwigsburg",
      "details": "08.12.2025 (Bekanntmachungsdatum)\n\nBaden-Württemberg Amtsgericht Stuttgart HRB 779739\nRegisterbekanntmachung nach dem Umwandlungsgesetz 08.12.2025 (Eintragungsdatum)\n\nAlba Beteiligungsgesellschaft mbH\nGesellschaft mit beschränkter Haftung\nLudwigsburg\n\nAls nicht eingetragen wird bekanntgemacht:\nDen Gläubigern der an der Verschmelzung beteiligten Rechtsträger ist, wenn sie binnen sechs Monaten nach dem Tag, an dem die Eintragung der Verschmelzung in das Register des Sitzes desjenigen Rechtsträgers, dessen Gläubiger sie sind, nach § 19 Abs. 3 UmwG als bekanntgemacht gilt, ihren Anspruch nach Grund und Höhe schriftlich anmelden, Sicherheit zu leisten, soweit sie nicht Befriedigung verlangen können. Dieses Recht steht den Gläubigern jedoch nur zu, wenn sie glaubhaft machen, dass durch die Verschmelzung die Erfüllung ihrer Forderung gefährdet wird."
    },
    {
      "date": "2025-12-08",
      "id": "139374",
      "original_text": "Sonstige Registerbekanntmachung\nBerlin Amtsgericht Berlin (Charlottenburg) HRB 201110\nRAW Value 2 GmbH – Berlin",
      "type": "Sonstige Registerbekanntmachung",
      "state": "Berlin",
      "amtsgericht": "Amtsgericht Berlin (Charlottenburg)",
      "registernummer": "HRB 201110",
      "registerart": "HRB",
      "company_name": "RAW Value 2 GmbH",
      "company_seat": "Berlin",
      "details": "08.12.2025 (Bekanntmachungsdatum)\n\nBerlin Amtsgericht Berlin (Charlottenburg) HRB 201110\nSonstige Registerbekanntmachung\n\nRAW Value 2 GmbH\nGesellschaft mit beschränkter Haftung\nBerlin\n\nAls nicht eingetragen wird veröffentlicht: Den Gläubigern der an der Verschmelzung beteiligten Rechtsträger ist, wenn sie binnen sechs Monaten nach dem Tag, an dem die Eintragung der Verschmelzung in das Register des Sitzes desjenigen Rechtsträgers, dessen Gläubiger sie sind, als bekannt gemacht gilt, ihren Anspruch nach Grund und Höhe schriftlich anmelden, Sicherheit zu leisten, soweit sie nicht Befriedigung verlangen können. Dieses Recht steht den Gläubigern jedoch nur zu, wenn sie glaubhaft machen, dass durch die Verschmelzung die Erfüllung ihrer Forderung gefährdet wird. Das Recht, Sicherheitsleistung zu verlangen, steht Gläubigern nicht zu, die im Falle der Insolvenz ein Recht auf vorzugsweise Befriedigung aus einer Deckungsmasse haben, die nach gesetzlicher Vorschrift zu ihrem Schutz errichtet und staatlich überwacht ist."
    },
    {
      "date": "2025-12-08",
      "id": "139375",
      "original_text": "Registerbekanntmachung nach dem Umwandlungsgesetz\nBaden-Württemberg Amtsgericht Stuttgart HRB 14562\nIBM Deutschland GmbH – Ehningen",
      "type": "Registerbekanntmachung nach dem Umwandlungsgesetz",
      "state": "Baden-Württemberg",
      "amtsgericht": "Amtsgericht Stuttgart",
      "registernummer": "HRB 14562",
      "registerart": "HRB",
      "company_name": "IBM Deutschland GmbH",
      "company_seat": "Ehningen",
      "details": "08.12.2025 (Bekanntmachungsdatum)\n\nBaden-Württemberg Amtsgericht Stuttgart HRB 14562\nRegisterbekanntmachung nach dem Umwandlungsgesetz 08.12.2025 (Eintragungsdatum)\n\nIBM Deutschland GmbH\nGesellschaft mit beschränkter Haftung\nEhningen\n\nAls nicht eingetragen wird bekanntgemacht:\nDen Gläubigern der an der Verschmelzung beteiligten Rechtsträger ist, wenn sie binnen sechs Monaten nach dem Tag, an dem die Eintragung der Verschmelzung in das Register des Sitzes desjenigen Rechtsträgers, dessen Gläubiger sie sind, nach § 19 Abs. 3 UmwG als bekanntgemacht gilt, ihren Anspruch nach Grund und Höhe schriftlich anmelden, Sicherheit zu leisten, soweit sie nicht Befriedigung verlangen können. Dieses Recht steht den Gläubigern jedoch nur zu, wenn sie glaubhaft machen, dass durch die Verschmelzung die Erfüllung ihrer Forderung gefährdet wird."
    },
    {
      "date": "2025-12-08",
      "id": "139376",
      "original_text": "Registerbekanntmachung nach dem Umwandlungsgesetz\nNordrhein-Westfalen Amtsgericht Coesfeld HRA 10082\nEdith Reckert gewerbliche Vermietung e.K. – Borken",
      "type": "Registerbekanntmachung nach dem Umwandlungsgesetz",
      "state": "Nordrhein-Westfalen",
      "amtsgericht": "Amtsgericht Coesfeld",
      "registernummer": "HRA 10082",
      "registerart": "HRA",
      "company_name": "Edith Reckert gewerbliche Vermietung e.K.",
      "company_seat": "Borken",
      "details": "08.12.2025 (Bekanntmachungsdatum)\n\nNordrhein-Westfalen Amtsgericht Coesfeld HRA 10082\nRegisterbekanntmachung nach dem Umwandlungsgesetz 08.12.2025 (Eintragungsdatum)\n\nEdith Reckert gewerbliche Vermietung e.K.\nEinzelkaufmann\nBorken\n\nDen Gläubigern der an der Ausgliederung beteiligten Rechtsträger ist, wenn sie binnen sechs Monaten nach dem Tag, an dem die Eintragung der Ausgliederung in das Register des Sitzes desjenigen Rechtsträgers, dessen Gläubiger sie sind, nach § 19 Absatz 3 UmwG als bekanntgemacht gilt, ihren Anspruch nach Grund und Höhe schriftlich anmelden, Sicherheit zu leisten, soweit sie nicht Befriedigung verlangen können. Dieses Recht steht den Gläubigern jedoch nur zu, wenn sie glaubhaft machen, dass durch die Ausgliederung die Erfüllung ihrer Forderung gefährdet wird."
    },
    {
      "date": "2025-12-08",
      "id": "139377",
      "original_text": "Registerbekanntmachung nach dem Umwandlungsgesetz\nBaden-Württemberg Amtsgericht Stuttgart HRB 757025\nPMG Gesellschaft für Immobilien mbH – Spaichingen",
      "type": "Registerbekanntmachung nach dem Umwandlungsgesetz",
      "state": "Baden-Württemberg",
      "amtsgericht": "Amtsgericht Stuttgart",
      "registernummer": "HRB 757025",
      "registerart": "HRB",
      "company_name": "PMG Gesellschaft für Immobilien mbH",
      "company_seat": "Spaichingen",
      "details": "08.12.2025 (Bekanntmachungsdatum)\n\nBaden-Württemberg Amtsgericht Stuttgart HRB 757025\nRegisterbekanntmachung nach dem Umwandlungsgesetz 08.12.2025 (Eintragungsdatum)\n\nPMG Gesellschaft für Immobilien mbH\nGesellschaft mit beschränkter Haftung\nSpaichingen\n\nAls nicht eingetragen wird bekanntgemacht:\nDen Gläubigern der an der Verschmelzung beteiligten Rechtsträger ist, wenn sie binnen sechs Monaten nach dem Tag, an dem die Eintragung der Verschmelzung in das Register des Sitzes desjenigen Rechtsträgers, dessen Gläubiger sie sind, nach § 19 Abs. 3 UmwG als bekanntgemacht gilt, ihren Anspruch nach Grund und Höhe schriftlich anmelden, Sicherheit zu leisten, soweit sie nicht Befriedigung verlangen können. Dieses Recht steht den Gläubigern jedoch nur zu, wenn sie glaubhaft machen, dass durch die Verschmelzung die Erfüllung ihrer Forderung gefährdet wird."
    },
    {
      "date": "2025-12-08",
      "id": "139378",
      "original_text": "Löschungsankündigung\nBaden-Württemberg Amtsgericht Freiburg HRA 540882\nKläranlage \"Am Ortberg\" GmbH & Co. KG – Singen Hohentwiel",
      "type": "Löschungsankündigung",
      "state": "Baden-Württemberg",
      "amtsgericht": "Amtsgericht Freiburg",
      "registernummer": "HRA 540882",
      "registerart": "HRA",
      "company_name": "Kläranlage \"Am Ortberg\" GmbH & Co. KG",
      "company_seat": "Singen Hohentwiel",
      "details": "08.12.2025 (Bekanntmachungsdatum)\n\nBaden-Württemberg Amtsgericht Freiburg HRA 540882\nLöschungsankündigung\n\nKläranlage \"Am Ortberg\" GmbH & Co. KG\nKommanditgesellschaft\nSingen Hohentwiel\n\nAls nicht eingetragen wird bekanntgemacht:\nDas Gericht beabsichtigt, die Gesellschaft wegen Vermögenslosigkeit im Handelsregister von Amts wegen nach § 394 FamFG zu löschen. Die Frist zur Geltendmachung eines Widerspruchs gegen die beabsichtigte Löschung ist auf einen Monat ab Veröffentlichung bestimmt."
    },
    {
      "date": "2025-12-08",
      "id": "139379",
      "original_text": "Sonstige Registerbekanntmachung\nHamburg Amtsgericht Hamburg HRB 34008\nHermes Abrasives GmbH – Hamburg",
      "type": "Sonstige Registerbekanntmachung",
      "state": "Hamburg",
      "amtsgericht": "Amtsgericht Hamburg",
      "registernummer": "HRB 34008",
      "registerart": "HRB",
      "company_name": "Hermes Abrasives GmbH",
      "company_seat": "Hamburg",
      "details": "08.12.2025 (Bekanntmachungsdatum)\n\nHamburg Amtsgericht Hamburg HRB 34008\nSonstige Registerbekanntmachung 08.12.2025 (Eintragungsdatum)\n\nHermes Abrasives GmbH\nGesellschaft mit beschränkter Haftung\nHamburg\n\nAls nicht eingetragen wird bekannt gemacht:  Den Gläubigern der Gesellschaft, deren Forderungen begründet worden sind, bevor die Eintragung der Vertragsbeendigung in das Handelsregister nach § 10 HGB als bekannt gemacht gilt, ist vom anderen Vertragsteil Sicherheit zu leisten, wenn sie sich binnen 6 Monaten nach Bekanntmachung der Eintragung zu diesem Zweck bei ihm melden."
    },
    {
      "date": "2025-12-08",
      "id": "139380",
      "original_text": "Löschungsankündigung\nBaden-Württemberg Amtsgericht Stuttgart HRB 244935\nSalmi-Reissverschluss GmbH – Stuttgart",
      "type": "Löschungsankündigung",
      "state": "Baden-Württemberg",
      "amtsgericht": "Amtsgericht Stuttgart",
      "registernummer": "HRB 244935",
      "registerart": "HRB",
      "company_name": "Salmi-Reissverschluss GmbH",
      "company_seat": "Stuttgart",
      "details": "08.12.2025 (Bekanntmachungsdatum)\n\nBaden-Württemberg Amtsgericht Stuttgart HRB 244935\nLöschungsankündigung\n\nSalmi-Reissverschluss GmbH\nGesellschaft mit beschränkter Haftung\nStuttgart\n\nAls nicht eingetragen wird bekanntgemacht:\nDas Gericht beabsichtigt, die Gesellschaft wegen Vermögenslosigkeit im Handelsregister von Amts wegen nach § 394 FamFG zu löschen. Die Frist zur Geltendmachung eines Widerspruchs gegen die beabsichtigte Löschung ist auf zwei Monate ab Veröffentlichung bestimmt."
    },
    {
      "date": "2025-12-08",
      "id": "139381",
      "original_text": "Registerbekanntmachung nach dem Umwandlungsgesetz\nSachsen Amtsgericht Leipzig HRB 6627\nBarth Metall am Dach GmbH – Leipzig",
      "type": "Registerbekanntmachung nach dem Umwandlungsgesetz",
      "state": "Sachsen",
      "amtsgericht": "Amtsgericht Leipzig",
      "registernummer": "HRB 6627",
      "registerart": "HRB",
      "company_name": "Barth Metall am Dach GmbH",
      "company_seat": "Leipzig",
      "details": "08.12.2025 (Bekanntmachungsdatum)\n\nSachsen Amtsgericht Leipzig HRB 6627\nRegisterbekanntmachung nach dem Umwandlungsgesetz 08.12.2025 (Eintragungsdatum)\n\nBarth Metall am Dach GmbH\nGesellschaft mit beschränkter Haftung\nLeipzig\n\nDen Gläubigern der an der Verschmelzung beteiligten Rechtsträger ist, wenn sie binnen sechs Monaten nach dem Tag, an dem die Eintragung der Verschmelzung in das Register des Sitzes desjenigen Rechtsträgers, dessen Gläubiger sie sind, nach § 19 Abs. 3 UmwG als bekannt gemacht gilt, ihren Anspruch nach Grund und Höhe in Textform anmelden, Sicherheit zu leisten, soweit sie nicht Befriedigung verlangen können. Dieses Recht steht den Gläubigern jedoch nur zu, wenn sie glaubhaft machen, dass durch die Verschmelzung die Erfüllung der Forderung gefährdet wird."
    },
    {
      "date": "2025-12-08",
      "id": "139382",
      "original_text": "Registerbekanntmachung nach dem Umwandlungsgesetz\nSachsen Amtsgericht Chemnitz HRB 2062\nEicher GmbH – Hartmannsdorf",
      "type": "Registerbekanntmachung nach dem Umwandlungsgesetz",
      "state": "Sachsen",
      "amtsgericht": "Amtsgericht Chemnitz",
      "registernummer": "HRB 2062",
      "registerart": "HRB",
      "company_name": "Eicher GmbH",
      "company_seat": "Hartmannsdorf",
      "details": "08.12.2025 (Bekanntmachungsdatum)\n\nSachsen Amtsgericht Chemnitz HRB 2062\nRegisterbekanntmachung nach dem Umwandlungsgesetz 08.12.2025 (Eintragungsdatum)\n\nEicher GmbH\nGesellschaft mit beschränkter Haftung\nHartmannsdorf\n\nDen Gläubigern der an der Verschmelzung beteiligten Rechtsträger ist, wenn sie binnen sechs Monaten nach dem Tag, an dem die Eintragung der Verschmelzung in das Register des Sitzes desjenigen Rechtsträgers, dessen Gläubiger sie sind, nach § 19 Abs. 3 UmwG als bekannt gemacht gilt, ihren Anspruch nach Grund und Höhe in Textform anmelden, Sicherheit zu leisten, soweit sie nicht Befriedigung verlangen können. Dieses Recht steht den Gläubigern jedoch nur zu, wenn sie glaubhaft machen, dass durch die Verschmelzung die Erfüllung der Forderung gefährdet wird."
    },
    {
      "date": "2025-12-08",
      "id": "139383",
      "original_text": "Registerbekanntmachung nach dem Umwandlungsgesetz\nNiedersachsen Amtsgericht Oldenburg (Oldenburg) HRB 121258 früher Amtsgericht Westerstede\nECR Solutions Servicegesellschaft mbH – Edewecht",
      "type": "Registerbekanntmachung nach dem Umwandlungsgesetz",
      "state": "Niedersachsen",
      "amtsgericht": "Amtsgericht Oldenburg (Oldenburg)",
      "registernummer": "HRB 121258",
      "registerart": "HRB",
      "company_name": "ECR Solutions Servicegesellschaft mbH",
      "company_seat": "Edewecht",
      "former_amtsgericht": "Westerstede",
      "details": "08.12.2025 (Bekanntmachungsdatum)\n\nNiedersachsen Amtsgericht Oldenburg (Oldenburg) HRB 121258 früher Amtsgericht Westerstede\nRegisterbekanntmachung nach dem Umwandlungsgesetz 08.12.2025 (Eintragungsdatum)\n\nECR Solutions Servicegesellschaft mbH\nGesellschaft mit beschränkter Haftung\nEdewecht\n\nDen Gläubigern der an der Verschmelzung beteiligten Rechtsträger ist, wenn sie binnen sechs Monaten nach dem Tag, an dem die Eintragung der Verschmelzung in das Register des Sitzes desjenigen Rechtsträgers, dessen Gläubiger sie sind, nach § 19  Abs.  3 UmwG als bekannt gemacht gilt, ihren Anspruch nach Grund und Höhe schriftlich anmelden, Sicherheit zu leisten, soweit sie nicht Befriedigung verlangen können. Dieses Recht steht den Gläubigern jedoch nur zu, wenn sie glaubhaft machen, dass durch die Verschmelzung die Erfüllung der Forderung gefährdet wird."
    },
    {
      "date": "2025-12-08",
      "id": "139384",
      "original_text": "Registerbekanntmachung nach dem Umwandlungsgesetz\nNiedersachsen Amtsgericht Tostedt GsR 212\nAlter Teichweg 71 Hamburg GmbH & Co. eGbR – Gyhum",
      "type": "Registerbekanntmachung nach dem Umwandlungsgesetz",
      "state": "Niedersachsen",
      "amtsgericht": "Amtsgericht Tostedt",
      "registernummer": "GsR 212",
      "registerart": "GsR",
      "company_name": "Alter Teichweg 71 Hamburg GmbH & Co. eGbR",
      "company_seat": "Gyhum",
      "details": "08.12.2025 (Bekanntmachungsdatum)\n\nNiedersachsen Amtsgericht Tostedt GsR 212\nRegisterbekanntmachung nach dem Umwandlungsgesetz 08.12.2025 (Eintragungsdatum)\n\nAlter Teichweg 71 Hamburg GmbH & Co. eGbR\nGesellschaft bürgerlichen Rechts\nGyhum\n\nDen Gläubigern der an der formwechselnden Umwandlung beteiligten Rechtsträger ist, wenn sie binnen sechs Monaten nach dem Tag, an dem die Eintragung der Umwandlung in das Register des Sitzes desjenigen Rechtsträgers, dessen Gläubiger sie sind, nach § 19 Abs. 3 UmwG als bekannt gemacht gilt, ihren Anspruch nach Grund und Höhe schriftlich anmelden, Sicherheit zu leisten, soweit sie nicht Befriedigung verlangen können. Dieses Recht steht den Gläubigern jedoch nur zu, wenn sie glaubhaft machen, dass durch die formwechselnde Umwandlung die Erfüllung der Forderung gefährdet wird."
    },
    {
      "date": "2025-12-08",
      "id": "139385",
      "original_text": "Registerbekanntmachung nach dem Umwandlungsgesetz\nNiedersachsen Amtsgericht Osnabrück HRB 216642\nzvoove international Cleaning Holding GmbH – Wietmarschen-Lohne",
      "type": "Registerbekanntmachung nach dem Umwandlungsgesetz",
      "state": "Niedersachsen",
      "amtsgericht": "Amtsgericht Osnabrück",
      "registernummer": "HRB 216642",
      "registerart": "HRB",
      "company_name": "zvoove international Cleaning Holding GmbH",
      "company_seat": "Wietmarschen-Lohne",
      "details": "08.12.2025 (Bekanntmachungsdatum)\n\nNiedersachsen Amtsgericht Osnabrück HRB 216642\nRegisterbekanntmachung nach dem Umwandlungsgesetz 08.12.2025 (Eintragungsdatum)\n\nzvoove international Cleaning Holding GmbH\nGesellschaft mit beschränkter Haftung\nWietmarschen-Lohne\n\nDen Gläubigern der an der Verschmelzung beteiligten Rechtsträger ist, wenn sie binnen sechs Monaten nach dem Tag, an dem die Eintragung der Verschmelzung in das Register des Sitzes desjenigen Rechtsträgers, dessen Gläubiger sie sind, nach § 19  Abs.  3 UmwG als bekannt gemacht gilt, ihren Anspruch nach Grund und Höhe schriftlich anmelden, Sicherheit zu leisten, soweit sie nicht Befriedigung verlangen können. Dieses Recht steht den Gläubigern jedoch nur zu, wenn sie glaubhaft machen, dass durch die Verschmelzung die Erfüllung der Forderung gefährdet wird."
    },
    {
      "date": "2025-12-08",
      "id": "139386",
      "original_text": "Löschungsankündigung\nNiedersachsen Amtsgericht Lüneburg HRB 212035\nSchulz M. Holzmontage & Dachservice UG (haftungsbeschränkt) – Celle",
      "type": "Löschungsankündigung",
      "state": "Niedersachsen",
      "amtsgericht": "Amtsgericht Lüneburg",
      "registernummer": "HRB 212035",
      "registerart": "HRB",
      "company_name": "Schulz M. Holzmontage & Dachservice UG (haftungsbeschränkt)",
      "company_seat": "Celle",
      "details": "08.12.2025 (Bekanntmachungsdatum)\n\nNiedersachsen Amtsgericht Lüneburg HRB 212035\nLöschungsankündigung\n\nSchulz M. Holzmontage & Dachservice UG (haftungsbeschränkt)\nGesellschaft mit beschränkter Haftung\nCelle\n\nDas Registergericht beabsichtigt, die Gesellschaft von Amts wegen nach § 394 FamFG zu löschen. Die Frist zur Erhebung eines Widerspruchs ist auf 1 Monat ab dieser Registerbekanntmachung festgesetzt."
    },
    {
      "date": "2025-12-08",
      "id": "139387",
      "original_text": "Registerbekanntmachung nach dem Umwandlungsgesetz\nNiedersachsen Amtsgericht Tostedt HRB 211947\nAlter Teichweg 71 Hamburg Grundbesitzgesellschaft mbH – Gyhum",
      "type": "Registerbekanntmachung nach dem Umwandlungsgesetz",
      "state": "Niedersachsen",
      "amtsgericht": "Amtsgericht Tostedt",
      "registernummer": "HRB 211947",
      "registerart": "HRB",
      "company_name": "Alter Teichweg 71 Hamburg Grundbesitzgesellschaft mbH",
      "company_seat": "Gyhum",
      "details": "08.12.2025 (Bekanntmachungsdatum)\n\nNiedersachsen Amtsgericht Tostedt HRB 211947\nRegisterbekanntmachung nach dem Umwandlungsgesetz 08.12.2025 (Eintragungsdatum)\n\nAlter Teichweg 71 Hamburg Grundbesitzgesellschaft mbH\nGesellschaft mit beschränkter Haftung\nGyhum\n\nDen Gläubigern der an der formwechselnden Umwandlung beteiligten Rechtsträger ist, wenn sie binnen sechs Monaten nach dem Tag, an dem die Eintragung der Umwandlung in das Register des Sitzes desjenigen Rechtsträgers, dessen Gläubiger sie sind, nach § 19 Abs. 3 UmwG als bekannt gemacht gilt, ihren Anspruch nach Grund und Höhe schriftlich anmelden, Sicherheit zu leisten, soweit sie nicht Befriedigung verlangen können. Dieses Recht steht den Gläubigern jedoch nur zu, wenn sie glaubhaft machen, dass durch die formwechselnde Umwandlung die Erfüllung der Forderung gefährdet wird."
    },
    {
      "date": "2025-12-08",
      "id": "139388",
      "original_text": "Registerbekanntmachung nach dem Umwandlungsgesetz\nNiedersachsen Amtsgericht Osnabrück HRB 100130 früher Amtsgericht Lingen (Ems)\nHermann Jansen Geschäftsführungs-Gesellschaft-mbH – Lingen",
      "type": "Registerbekanntmachung nach dem Umwandlungsgesetz",
      "state": "Niedersachsen",
      "amtsgericht": "Amtsgericht Osnabrück",
      "registernummer": "HRB 100130",
      "registerart": "HRB",
      "company_name": "Hermann Jansen Geschäftsführungs-Gesellschaft-mbH",
      "company_seat": "Lingen",
      "former_amtsgericht": "Lingen (Ems)",
      "details": "08.12.2025 (Bekanntmachungsdatum)\n\nNiedersachsen Amtsgericht Osnabrück HRB 100130 früher Amtsgericht Lingen (Ems)\nRegisterbekanntmachung nach dem Umwandlungsgesetz 08.12.2025 (Eintragungsdatum)\n\nHermann Jansen Geschäftsführungs-Gesellschaft-mbH\nGesellschaft mit beschränkter Haftung\nLingen\n\nDen Gläubigern der an der Verschmelzung beteiligten Rechtsträger ist, wenn sie binnen sechs Monaten nach dem Tag, an dem die Eintragung der Verschmelzung in das Register des Sitzes desjenigen Rechtsträgers, dessen Gläubiger sie sind, nach § 19  Abs.  3 UmwG als bekannt gemacht gilt, ihren Anspruch nach Grund und Höhe schriftlich anmelden, Sicherheit zu leisten, soweit sie nicht Befriedigung verlangen können. Dieses Recht steht den Gläubigern jedoch nur zu, wenn sie glaubhaft machen, dass durch die Verschmelzung die Erfüllung der Forderung gefährdet wird."
    },
    {
      "date": "2025-12-08",
      "id": "139389",
      "original_text": "Registerbekanntmachung nach dem Umwandlungsgesetz\nNiedersachsen Amtsgericht Oldenburg (Oldenburg) HRB 219269\nKleine Lohnehof Diepholz GmbH – Steinfeld-Mühlen",
      "type": "Registerbekanntmachung nach dem Umwandlungsgesetz",
      "state": "Niedersachsen",
      "amtsgericht": "Amtsgericht Oldenburg (Oldenburg)",
      "registernummer": "HRB 219269",
      "registerart": "HRB",
      "company_name": "Kleine Lohnehof Diepholz GmbH",
      "company_seat": "Steinfeld-Mühlen",
      "details": "08.12.2025 (Bekanntmachungsdatum)\n\nNiedersachsen Amtsgericht Oldenburg (Oldenburg) HRB 219269\nRegisterbekanntmachung nach dem Umwandlungsgesetz 08.12.2025 (Eintragungsdatum)\n\nKleine Lohnehof Diepholz GmbH\nGesellschaft mit beschränkter Haftung\nSteinfeld-Mühlen\n\nDen Gläubigern der an der Verschmelzung beteiligten Rechtsträger ist, wenn sie binnen sechs Monaten nach dem Tag, an dem die Eintragung der Verschmelzung in das Register des Sitzes desjenigen Rechtsträgers, dessen Gläubiger sie sind, nach § 19  Abs.  3 UmwG als bekannt gemacht gilt, ihren Anspruch nach Grund und Höhe schriftlich anmelden, Sicherheit zu leisten, soweit sie nicht Befriedigung verlangen können. Dieses Recht steht den Gläubigern jedoch nur zu, wenn sie glaubhaft machen, dass durch die Verschmelzung die Erfüllung der Forderung gefährdet wird."
    },
    {
      "date": "2025-12-08",
      "id": "139390",
      "original_text": "Einreichung neuer Dokumente\nNiedersachsen Amtsgericht Göttingen HRB 130376 früher Amtsgericht Northeim\nSWN Stadtwerke Northeim GmbH – Northeim",
      "type": "Einreichung neuer Dokumente",
      "state": "Niedersachsen",
      "amtsgericht": "Amtsgericht Göttingen",
      "registernummer": "HRB 130376",
      "registerart": "HRB",
      "company_name": "SWN Stadtwerke Northeim GmbH",
      "company_seat": "Northeim",
      "former_amtsgericht": "Northeim",
      "details": "08.12.2025 (Bekanntmachungsdatum)\n\nNiedersachsen Amtsgericht Göttingen HRB 130376 früher Amtsgericht Northeim\nEinreichung neuer Dokumente 13.11.2025 (Eintragungsdatum)\n\nSWN Stadtwerke Northeim GmbH\nGesellschaft mit beschränkter Haftung\nNortheim\n\nDie Liste der Aufsichtsratsmitglieder ist zum Handelsregister eingereicht."
    },
    {
      "date": "2025-12-08",
      "id": "139391",
      "original_text": "Einreichung neuer Dokumente\nNiedersachsen Amtsgericht Hannover HRB 2560\nNiedersächsische Gesellschaft zur Endablagerung von Sonderabfall mbH – Hannover",
      "type": "Einreichung neuer Dokumente",
      "state": "Niedersachsen",
      "amtsgericht": "Amtsgericht Hannover",
      "registernummer": "HRB 2560",
      "registerart": "HRB",
      "company_name": "Niedersächsische Gesellschaft zur Endablagerung von Sonderabfall mbH",
      "company_seat": "Hannover",
      "details": "08.12.2025 (Bekanntmachungsdatum)\n\nNiedersachsen Amtsgericht Hannover HRB 2560\nEinreichung neuer Dokumente\n\nNiedersächsische Gesellschaft zur Endablagerung von Sonderabfall mbH\nGesellschaft mit beschränkter Haftung\nHannover\n\nDie Liste der Mitglieder des Aufsichtsrats wurde beim Registergericht eingereicht."
    },
    {
      "date": "2025-12-08",
      "id": "139392",
      "original_text": "Registerbekanntmachung nach dem Umwandlungsgesetz\nNiedersachsen Amtsgericht Walsrode HRA 205456\n\"Sigrid Brocke\" e.Kfr. – Ritterhude",
      "type": "Registerbekanntmachung nach dem Umwandlungsgesetz",
      "state": "Niedersachsen",
      "amtsgericht": "Amtsgericht Walsrode",
      "registernummer": "HRA 205456",
      "registerart": "HRA",
      "company_name": "\"Sigrid Brocke\" e.Kfr.",
      "company_seat": "Ritterhude",
      "details": "08.12.2025 (Bekanntmachungsdatum)\n\nNiedersachsen Amtsgericht Walsrode HRA 205456\nRegisterbekanntmachung nach dem Umwandlungsgesetz 08.12.2025 (Eintragungsdatum)\n\n\"Sigrid Brocke\" e.Kfr.\nEinzelkaufmann / Einzelkauffrau\nRitterhude\n\nDen Gläubigern der an der Verschmelzung beteiligten Rechtsträger ist, wenn sie binnen sechs Monaten nach dem Tag, an dem die Eintragung der Verschmelzung in das Register des Sitzes desjenigen Rechtsträgers, dessen Gläubiger sie sind, nach § 19  Abs.  3 UmwG als bekannt gemacht gilt, ihren Anspruch nach Grund und Höhe schriftlich anmelden, Sicherheit zu leisten, soweit sie nicht Befriedigung verlangen können. Dieses Recht steht den Gläubigern jedoch nur zu, wenn sie glaubhaft machen, dass durch die Verschmelzung die Erfüllung der Forderung gefährdet wird."
    },
    {
      "date": "2025-12-08",
      "id": "139393",
      "original_text": "Registerbekanntmachung nach dem Umwandlungsgesetz\nNiedersachsen Amtsgericht Walsrode HRB 201115\nKOM.MA Kommunikation & Marketing GmbH – 49406 Eydelstedt",
      "type": "Registerbekanntmachung nach dem Umwandlungsgesetz",
      "state": "Niedersachsen",
      "amtsgericht": "Amtsgericht Walsrode",
      "registernummer": "HRB 201115",
      "registerart": "HRB",
      "company_name": "KOM.MA Kommunikation & Marketing GmbH",
      "company_seat": "49406 Eydelstedt",
      "details": "08.12.2025 (Bekanntmachungsdatum)\n\nNiedersachsen Amtsgericht Walsrode HRB 201115\nRegisterbekanntmachung nach dem Umwandlungsgesetz 08.12.2025 (Eintragungsdatum)\n\nKOM.MA Kommunikation & Marketing GmbH\nGesellschaft mit beschränkter Haftung\n49406 Eydelstedt\n\nDen Gläubigern der an der Verschmelzung beteiligten Rechtsträger ist, wenn sie binnen sechs Monaten nach dem Tag, an dem die Eintragung der Verschmelzung in das Register des Sitzes desjenigen Rechtsträgers, dessen Gläubiger sie sind, nach § 19  Abs.  3 UmwG als bekannt gemacht gilt, ihren Anspruch nach Grund und Höhe schriftlich anmelden, Sicherheit zu leisten, soweit sie nicht Befriedigung verlangen können. Dieses Recht steht den Gläubigern jedoch nur zu, wenn sie glaubhaft machen, dass durch die Verschmelzung die Erfüllung der Forderung gefährdet wird."
    },
    {
      "date": "2025-12-08",
      "id": "139394",
      "original_text": "Löschungsankündigung\nNiedersachsen Amtsgericht Lüneburg HRB 203012\nGreen Lemon Verwaltungs-UG (haftungsbeschränkt) – Uelzen",
      "type": "Löschungsankündigung",
      "state": "Niedersachsen",
      "amtsgericht": "Amtsgericht Lüneburg",
      "registernummer": "HRB 203012",
      "registerart": "HRB",
      "company_name": "Green Lemon Verwaltungs-UG (haftungsbeschränkt)",
      "company_seat": "Uelzen",
      "details": "08.12.2025 (Bekanntmachungsdatum)\n\nNiedersachsen Amtsgericht Lüneburg HRB 203012\nLöschungsankündigung\n\nGreen Lemon Verwaltungs-UG (haftungsbeschränkt)\nGesellschaft mit beschränkter Haftung\nUelzen\n\nDas Registergericht beabsichtigt, die Gesellschaft von Amts wegen nach § 394 FamFG zu löschen. Die Frist zur Erhebung eines Widerspruchs ist auf 1 Monat ab dieser Registerbekanntmachung festgesetzt."
    },
    {
      "date": "2025-12-08",
      "id": "139395",
      "original_text": "Registerbekanntmachung nach dem Umwandlungsgesetz\nNiedersachsen Amtsgericht Hannover HRB 52500\nAngelika Emmermann Verwaltungsgesellschaft mbH – Hannover",
      "type": "Registerbekanntmachung nach dem Umwandlungsgesetz",
      "state": "Niedersachsen",
      "amtsgericht": "Amtsgericht Hannover",
      "registernummer": "HRB 52500",
      "registerart": "HRB",
      "company_name": "Angelika Emmermann Verwaltungsgesellschaft mbH",
      "company_seat": "Hannover",
      "details": "08.12.2025 (Bekanntmachungsdatum)\n\nNiedersachsen Amtsgericht Hannover HRB 52500\nRegisterbekanntmachung nach dem Umwandlungsgesetz 08.12.2025 (Eintragungsdatum)\n\nAngelika Emmermann Verwaltungsgesellschaft mbH\nGesellschaft mit beschränkter Haftung\nHannover\n\nDen Gläubigern der an der Verschmelzung beteiligten Rechtsträger ist, wenn sie binnen sechs Monaten nach dem Tag, an dem die Eintragung der Verschmelzung in das Register des Sitzes desjenigen Rechtsträgers, dessen Gläubiger sie sind, nach § 19  Abs.  3 UmwG als bekannt gemacht gilt, ihren Anspruch nach Grund und Höhe schriftlich anmelden, Sicherheit zu leisten, soweit sie nicht Befriedigung verlangen können. Dieses Recht steht den Gläubigern jedoch nur zu, wenn sie glaubhaft machen, dass durch die Verschmelzung die Erfüllung der Forderung gefährdet wird."
    },
    {
      "date": "2025-12-08",
      "id": "139396",
      "original_text": "Löschungsankündigung\nNiedersachsen Amtsgericht Osnabrück HRA 200437\nRabe Service GmbH & Co. KG – Bad Essen",
      "type": "Löschungsankündigung",
      "state": "Niedersachsen",
      "amtsgericht": "Amtsgericht Osnabrück",
      "registernummer": "HRA 200437",
      "registerart": "HRA",
      "company_name": "Rabe Service GmbH & Co. KG",
      "company_seat": "Bad Essen",
      "details": "08.12.2025 (Bekanntmachungsdatum)\n\nNiedersachsen Amtsgericht Osnabrück HRA 200437\nLöschungsankündigung\n\nRabe Service GmbH & Co. KG\nKommanditgesellschaft\nBad Essen\n\nDas Registergericht beabsichtigt, die Firma von Amts wegen nach § 394 FamFG wegen Vermögenslosigkeit zu löschen. Die Frist zur Erhebung eines Widerspruchs ist auf 1 Monat ab dieser Registerbekanntmachung festgesetzt."
    },
    {
      "date": "2025-12-08",
      "id": "139397",
      "original_text": "Registerbekanntmachung nach dem Umwandlungsgesetz\nNiedersachsen Amtsgericht Walsrode HRB 121644\nMC Lease & Rent Beteiligungs-GmbH – Ritterhude",
      "type": "Registerbekanntmachung nach dem Umwandlungsgesetz",
      "state": "Niedersachsen",
      "amtsgericht": "Amtsgericht Walsrode",
      "registernummer": "HRB 121644",
      "registerart": "HRB",
      "company_name": "MC Lease & Rent Beteiligungs-GmbH",
      "company_seat": "Ritterhude",
      "details": "08.12.2025 (Bekanntmachungsdatum)\n\nNiedersachsen Amtsgericht Walsrode HRB 121644\nRegisterbekanntmachung nach dem Umwandlungsgesetz 08.12.2025 (Eintragungsdatum)\n\nMC Lease & Rent Beteiligungs-GmbH\nGesellschaft mit beschränkter Haftung\nRitterhude\n\nDen Gläubigern der an der Verschmelzung beteiligten Rechtsträger ist, wenn sie binnen sechs Monaten nach dem Tag, an dem die Eintragung der Verschmelzung in das Register des Sitzes desjenigen Rechtsträgers, dessen Gläubiger sie sind, nach § 19  Abs.  3 UmwG als bekannt gemacht gilt, ihren Anspruch nach Grund und Höhe schriftlich anmelden, Sicherheit zu leisten, soweit sie nicht Befriedigung verlangen können. Dieses Recht steht den Gläubigern jedoch nur zu, wenn sie glaubhaft machen, dass durch die Verschmelzung die Erfüllung der Forderung gefährdet wird."
    },
    {
      "date": "2025-12-08",
      "id": "139398",
      "original_text": "Registerbekanntmachung nach dem Umwandlungsgesetz\nNiedersachsen Amtsgericht Oldenburg (Oldenburg) HRB 217649\nFS Beteiligungs GmbH – Edewecht",
      "type": "Registerbekanntmachung nach dem Umwandlungsgesetz",
      "state": "Niedersachsen",
      "amtsgericht": "Amtsgericht Oldenburg (Oldenburg)",
      "registernummer": "HRB 217649",
      "registerart": "HRB",
      "company_name": "FS Beteiligungs GmbH",
      "company_seat": "Edewecht",
      "details": "08.12.2025 (Bekanntmachungsdatum)\n\nNiedersachsen Amtsgericht Oldenburg (Oldenburg) HRB 217649\nRegisterbekanntmachung nach dem Umwandlungsgesetz 08.12.2025 (Eintragungsdatum)\n\nFS Beteiligungs GmbH\nGesellschaft mit beschränkter Haftung\nEdewecht\n\nDen Gläubigern der an der Verschmelzung beteiligten Rechtsträger ist, wenn sie binnen sechs Monaten nach dem Tag, an dem die Eintragung der Verschmelzung in das Register des Sitzes desjenigen Rechtsträgers, dessen Gläubiger sie sind, nach § 19  Abs.  3 UmwG als bekannt gemacht gilt, ihren Anspruch nach Grund und Höhe schriftlich anmelden, Sicherheit zu leisten, soweit sie nicht Befriedigung verlangen können. Dieses Recht steht den Gläubigern jedoch nur zu, wenn sie glaubhaft machen, dass durch die Verschmelzung die Erfüllung der Forderung gefährdet wird."
    },
    {
      "date": "2025-12-08",
      "id": "139399",
      "original_text": "Registerbekanntmachung nach dem Umwandlungsgesetz\nNiedersachsen Amtsgericht Oldenburg (Oldenburg) HRB 111452 früher Amtsgericht Vechta\nVALPRO GmbH – Steinfeld-Mühlen",
      "type": "Registerbekanntmachung nach dem Umwandlungsgesetz",
      "state": "Niedersachsen",
      "amtsgericht": "Amtsgericht Oldenburg (Oldenburg)",
      "registernummer": "HRB 111452",
      "registerart": "HRB",
      "company_name": "VALPRO GmbH",
      "company_seat": "Steinfeld-Mühlen",
      "former_amtsgericht": "Vechta",
      "details": "08.12.2025 (Bekanntmachungsdatum)\n\nNiedersachsen Amtsgericht Oldenburg (Oldenburg) HRB 111452 früher Amtsgericht Vechta\nRegisterbekanntmachung nach dem Umwandlungsgesetz 08.12.2025 (Eintragungsdatum)\n\nVALPRO GmbH\nGesellschaft mit beschränkter Haftung\nSteinfeld-Mühlen\n\nDen Gläubigern der an der Verschmelzung beteiligten Rechtsträger ist, wenn sie binnen sechs Monaten nach dem Tag, an dem die Eintragung der Verschmelzung in das Register des Sitzes desjenigen Rechtsträgers, dessen Gläubiger sie sind, nach § 19  Abs.  3 UmwG als bekannt gemacht gilt, ihren Anspruch nach Grund und Höhe schriftlich anmelden, Sicherheit zu leisten, soweit sie nicht Befriedigung verlangen können. Dieses Recht steht den Gläubigern jedoch nur zu, wenn sie glaubhaft machen, dass durch die Verschmelzung die Erfüllung der Forderung gefährdet wird."
    },
    {
      "date": "2025-12-08",
      "id": "139400",
      "original_text": "Einreichung neuer Dokumente\nRheinland-Pfalz Amtsgericht Zweibrücken HRB 11761\nNardini Klinikum GmbH – Zweibrücken",
      "type": "Einreichung neuer Dokumente",
      "state": "Rheinland-Pfalz",
      "amtsgericht": "Amtsgericht Zweibrücken",
      "registernummer": "HRB 11761",
      "registerart": "HRB",
      "company_name": "Nardini Klinikum GmbH",
      "company_seat": "Zweibrücken",
      "details": "08.12.2025 (Bekanntmachungsdatum)\n\nRheinland-Pfalz Amtsgericht Zweibrücken HRB 11761\nEinreichung neuer Dokumente\n\nNardini Klinikum GmbH\nGesellschaft mit beschränkter Haftung\nZweibrücken\n\nDem Registergericht ist eine Liste der Mitglieder des Aufsichtsrates eingereicht worden."
    },
    {
      "date": "2025-12-08",
      "id": "139401",
      "original_text": "Löschungsankündigung\nBremen Amtsgericht Bremen HRB 36958\nMARINSKI TRADE GMBH – Bremerhaven",
      "type": "Löschungsankündigung",
      "state": "Bremen",
      "amtsgericht": "Amtsgericht Bremen",
      "registernummer": "HRB 36958",
      "registerart": "HRB",
      "company_name": "MARINSKI TRADE GMBH",
      "company_seat": "Bremerhaven",
      "details": "08.12.2025 (Bekanntmachungsdatum)\n\nBremen Amtsgericht Bremen HRB 36958\nLöschungsankündigung\n\nMARINSKI TRADE GMBH\nGesellschaft mit beschränkter Haftung\nBremerhaven\n\nEs ist beabsichtigt die im Handelsregister eingetragene Gesellschaft von Amts wegen gemäß § 394 FamFG zu löschen. Gegen die Löschung kann beim AG Bremen schriftlich oder zu Protokoll der Geschäftsstelle Widerspruch eingelegt werden. Widerspruchsfrist 4 Wochen."
    },
    {
      "date": "2025-12-08",
      "id": "139402",
      "original_text": "Registerbekanntmachung nach dem Umwandlungsgesetz\nBremen Amtsgericht Bremen HRB 5622 BHV\nbap Bündnis Ambulante Psychiatrie GmbH – Bremerhaven",
      "type": "Registerbekanntmachung nach dem Umwandlungsgesetz",
      "state": "Bremen",
      "amtsgericht": "Amtsgericht Bremen",
      "registernummer": "HRB 5622 BHV",
      "registerart": "HRB",
      "company_name": "bap Bündnis Ambulante Psychiatrie GmbH",
      "company_seat": "Bremerhaven",
      "details": "08.12.2025 (Bekanntmachungsdatum)\n\nBremen Amtsgericht Bremen HRB 5622 BHV\nRegisterbekanntmachung nach dem Umwandlungsgesetz 04.12.2025 (Eintragungsdatum)\n\nbap Bündnis Ambulante Psychiatrie GmbH\nGesellschaft mit beschränkter Haftung\nBremerhaven\n\nAls nicht eingetragen wird veröffentlicht: Den Gläubigern der an der Spaltung beteiligten Rechtsträger ist, wenn sie binnen sechs Monaten nach dem Tag, an dem die Eintragung der Spaltung in das Register des Sitzes desjenigen Rechtsträgers, dessen Gläubiger sie sind, als bekannt gemacht gilt, ihren Anspruch nach Grund und Höhe schriftlich anmelden, Sicherheit zu leisten, soweit sie nicht Befriedigung verlangen können. Dieses Recht steht den Gläubigern jedoch nur zu, wenn sie glaubhaft machen, dass durch die Spaltung die Erfüllung ihrer Forderung gefährdet wird. Das Recht, Sicherheitsleistung zu verlangen, steht Gläubigern nicht zu, die im Falle der Insolvenz ein Recht auf vorzugsweise Befriedigung aus einer Deckungsmasse haben, die nach gesetzlicher Vorschrift zu ihrem Schutz errichtet und staatlich überwacht ist."
    },
    {
      "date": "2025-12-08",
      "id": "139403",
      "original_text": "Registerbekanntmachung nach dem Umwandlungsgesetz\nBremen Amtsgericht Bremen HRB 27698\ni hoch 5 GmbH – Bremen",
      "type": "Registerbekanntmachung nach dem Umwandlungsgesetz",
      "state": "Bremen",
      "amtsgericht": "Amtsgericht Bremen",
      "registernummer": "HRB 27698",
      "registerart": "HRB",
      "company_name": "i hoch 5 GmbH",
      "company_seat": "Bremen",
      "details": "08.12.2025 (Bekanntmachungsdatum)\n\nBremen Amtsgericht Bremen HRB 27698\nRegisterbekanntmachung nach dem Umwandlungsgesetz 03.12.2025 (Eintragungsdatum)\n\ni hoch 5 GmbH\nGesellschaft mit beschränkter Haftung\nBremen\n\nAls nicht eingetragen wird veröffentlicht: Den Gläubigern der an der Verschmelzung beteiligten Rechtsträger ist, wenn sie binnen sechs Monaten nach dem Tag, an dem die Eintragung der Verschmelzung in das Register des Sitzes desjenigen Rechtsträgers, dessen Gläubiger sie sind, als bekannt gemacht gilt, ihren Anspruch nach Grund und Höhe schriftlich anmelden, Sicherheit zu leisten, soweit sie nicht Befriedigung verlangen können. Dieses Recht steht den Gläubigern jedoch nur zu, wenn sie glaubhaft machen, dass durch die Verschmelzung die Erfüllung ihrer Forderung gefährdet wird. Das Recht, Sicherheitsleistung zu verlangen, steht Gläubigern nicht zu, die im Falle der Insolvenz ein Recht auf vorzugsweise Befriedigung aus einer Deckungsmasse haben, die nach gesetzlicher Vorschrift zu ihrem Schutz errichtet und staatlich überwacht ist."
    },
    {
      "date": "2025-12-08",
      "id": "139404",
      "original_text": "Löschungsankündigung\nRheinland-Pfalz Amtsgericht Mainz HRB 45418\nKarolus UG (haftungsbeschränkt) – Ingelheim am Rhein",
      "type": "Löschungsankündigung",
      "state": "Rheinland-Pfalz",
      "amtsgericht": "Amtsgericht Mainz",
      "registernummer": "HRB 45418",
      "registerart": "HRB",
      "company_name": "Karolus UG (haftungsbeschränkt)",
      "company_seat": "Ingelheim am Rhein",
      "details": "08.12.2025 (Bekanntmachungsdatum)\n\nRheinland-Pfalz Amtsgericht Mainz HRB 45418\nLöschungsankündigung\n\nKarolus UG (haftungsbeschränkt)\nGesellschaft mit beschränkter Haftung\nIngelheim am Rhein\n\nDas Registergericht beabsichtigt die Gesellschaft von Amts wegen nach § 394 FamFG zu löschen. Die Frist zur Erhebung eines Widerspruchs ist auf einen Monat festgesetzt."
    },
    {
      "date": "2025-12-08",
      "id": "139405",
      "original_text": "Registerbekanntmachung nach dem Umwandlungsgesetz\nBremen Amtsgericht Bremen HRB 23807\ni hoch 5 GmbH – Bremen",
      "type": "Registerbekanntmachung nach dem Umwandlungsgesetz",
      "state": "Bremen",
      "amtsgericht": "Amtsgericht Bremen",
      "registernummer": "HRB 23807",
      "registerart": "HRB",
      "company_name": "i hoch 5 GmbH",
      "company_seat": "Bremen",
      "details": "08.12.2025 (Bekanntmachungsdatum)\n\nBremen Amtsgericht Bremen HRB 23807\nRegisterbekanntmachung nach dem Umwandlungsgesetz 03.12.2025 (Eintragungsdatum)\n\ni hoch 5 GmbH\nGesellschaft mit beschränkter Haftung\nBremen\n\nZu Eintragungsnummer 6 vom 03.12.2025 wird als nicht eingetragen veröffentlicht: Den Gläubigern der an der Verschmelzung beteiligten Rechtsträger ist, wenn sie binnen sechs Monaten nach dem Tag, an dem die Eintragung der Verschmelzung in das Register des Sitzes desjenigen Rechtsträgers, dessen Gläubiger sie sind, als bekannt gemacht gilt, ihren Anspruch nach Grund und Höhe schriftlich anmelden, Sicherheit zu leisten, soweit sie nicht Befriedigung verlangen können. Dieses Recht steht den Gläubigern jedoch nur zu, wenn sie glaubhaft machen, dass durch die Verschmelzung die Erfüllung ihrer Forderung gefährdet wird. Das Recht, Sicherheitsleistung zu verlangen, steht Gläubigern nicht zu, die im Falle der Insolvenz ein Recht auf vorzugsweise Befriedigung aus einer Deckungsmasse haben, die nach gesetzlicher Vorschrift zu ihrem Schutz errichtet und staatlich überwacht ist."
    },
    {
      "date": "2025-12-08",
      "id": "139406",
      "original_text": "Löschungsankündigung\nNordrhein-Westfalen Amtsgericht Köln HRB 120211\nMMS Logistik und Services GmbH – Leichlingen",
      "type": "Löschungsankündigung",
      "state": "Nordrhein-Westfalen",
      "amtsgericht": "Amtsgericht Köln",
      "registernummer": "HRB 120211",
      "registerart": "HRB",
      "company_name": "MMS Logistik und Services GmbH",
      "company_seat": "Leichlingen",
      "details": "08.12.2025 (Bekanntmachungsdatum)\n\nNordrhein-Westfalen Amtsgericht Köln HRB 120211\nLöschungsankündigung\n\nMMS Logistik und Services GmbH\nGesellschaft mit beschränkter Haftung\nLeichlingen\n\nDas Registergericht beabsichtigt die Gesellschaft von Amts wegen nach § 394 FamFG zu löschen. Die Frist zur Erhebung eines Widerspruchs ist auf einen Monat festgesetzt."
    },
    {
      "date": "2025-12-08",
      "id": "139407",
      "original_text": "Registerbekanntmachung nach dem Umwandlungsgesetz\nNordrhein-Westfalen Amtsgericht Köln HRB 57420\nM + P Umweltdienste GmbH – Overath",
      "type": "Registerbekanntmachung nach dem Umwandlungsgesetz",
      "state": "Nordrhein-Westfalen",
      "amtsgericht": "Amtsgericht Köln",
      "registernummer": "HRB 57420",
      "registerart": "HRB",
      "company_name": "M + P Umweltdienste GmbH",
      "company_seat": "Overath",
      "details": "08.12.2025 (Bekanntmachungsdatum)\n\nNordrhein-Westfalen Amtsgericht Köln HRB 57420\nRegisterbekanntmachung nach dem Umwandlungsgesetz 08.12.2025 (Eintragungsdatum)\n\nM + P Umweltdienste GmbH\nGesellschaft mit beschränkter Haftung\nOverath\n\nDen Gläubigern der an der Verschmelzung beteiligten Rechtsträger ist, wenn sie binnen sechs Monaten nach dem Tag, an dem die Eintragung der Verschmelzung in das Register des Sitzes desjenigen Rechtsträgers, dessen Gläubiger sie sind, nach § 19 Absatz 3 UmwG als bekanntgemacht gilt, ihren Anspruch nach Grund und Höhe schriftlich anmelden, Sicherheit zu leisten, soweit sie nicht Befriedigung verlangen können. Dieses Recht steht den Gläubigern jedoch nur zu, wenn sie glaubhaft machen, dass durch die Verschmelzung die Erfüllung ihrer Forderung gefährdet wird."
    },
    {
      "date": "2025-12-08",
      "id": "139408",
      "original_text": "Registerbekanntmachung nach dem Umwandlungsgesetz\nNordrhein-Westfalen Amtsgericht Aachen HRB 29084\nDEKRA Claims International - Germany GmbH – Aachen",
      "type": "Registerbekanntmachung nach dem Umwandlungsgesetz",
      "state": "Nordrhein-Westfalen",
      "amtsgericht": "Amtsgericht Aachen",
      "registernummer": "HRB 29084",
      "registerart": "HRB",
      "company_name": "DEKRA Claims International - Germany GmbH",
      "company_seat": "Aachen",
      "details": "08.12.2025 (Bekanntmachungsdatum)\n\nNordrhein-Westfalen Amtsgericht Aachen HRB 29084\nRegisterbekanntmachung nach dem Umwandlungsgesetz 08.12.2025 (Eintragungsdatum)\n\nDEKRA Claims International - Germany GmbH\nGesellschaft mit beschränkter Haftung\nAachen\n\nDen Gläubigern der an der Abspaltung beteiligten Rechtsträger ist, wenn sie binnen sechs Monaten nach dem Tag, an dem die Eintragung der Abspaltung in das Register des Sitzes derjenigen Rechtsträger deren Gläubiger sie sind, nach § 19 Absatz 3 UmwG als bekanntgemacht gilt, ihren Anspruch nach Grund und Höhe schriftlich anmelden, Sicherheit zu leisten, soweit sie nicht Befriedigung verlangen können. Dieses Recht steht den Gläubigern jedoch nur zu, wenn sie glaubhaft machen, dass durch die Abspaltung die Erfüllung ihrer Forderung gefährdet wird."
    },
    {
      "date": "2025-12-08",
      "id": "139409",
      "original_text": "Löschungsankündigung\nNordrhein-Westfalen Amtsgericht Siegburg HRB 17095\nImEx - West GmbH – Troisdorf",
      "type": "Löschungsankündigung",
      "state": "Nordrhein-Westfalen",
      "amtsgericht": "Amtsgericht Siegburg",
      "registernummer": "HRB 17095",
      "registerart": "HRB",
      "company_name": "ImEx - West GmbH",
      "company_seat": "Troisdorf",
      "details": "08.12.2025 (Bekanntmachungsdatum)\n\nNordrhein-Westfalen Amtsgericht Siegburg HRB 17095\nLöschungsankündigung\n\nImEx - West GmbH\nGesellschaft mit beschränkter Haftung\nTroisdorf\n\nDas Registergericht hat glaubhafte Kenntnis erlangt, dass die Gesellschaft vermögenslos geworden ist.\n\nEs ist daher beabsichtigt, die Gesellschaft nach § 394 FamFG im Handelsregister wegen Vermögenslosigkeit zu löschen.\nEinwände gegen die Löschung sind durch Widerspruch binnen einer Frist von 3 Monaten geltend zu machen, andernfalls die Löschung erfolgen wird.\n\nEinzulegen ist der Widerspruch bei dem Amtsgericht Siegburg, Neue Poststraße 16, 53721 Siegburg, und zwar entweder schriftlich in deutscher Sprache oder mündlich zur Niederschrift der Geschäftsstelle. Der Widerspruch kann auch zur Niederschrift der Geschäftsstelle eines jeden Amtsgerichts abgegeben werden. Der Widerspruch ist binnen der in der Verfügung bestimmten Frist einzulegen. Die Frist ist nur gewahrt, wenn der Widerspruch rechtzeitig bei dem Amtsgericht Siegburg eingeht, auch wenn der Widerspruch zur Niederschrift der Geschäftsstelle eines anderen Amtsgerichts abgegeben wurde. Die Frist beginnt jeweils mit der schriftlichen Bekanntgabe der Verfügung an die Beteiligten. Kann die schriftliche Bekanntgabe an einen Beteiligten nicht bewirkt werden, beginnt die Frist spätestens mit Ablauf von fünf Monaten nach Erlass der Verfügung. Die Bekanntgabe ist entweder durch Zustellung oder am dritten Tage nach Aufgabe zur Post bewirkt. Sofern die Löschung noch nicht erfolgt ist, kann der Widerspruch auch noch nach Ablauf der Frist eingelegt werden. Fällt das Ende der Frist auf einen Sonnabend, einen Sonntag oder einen allgemeinen Feiertag, endet die Frist mit Ablauf des nächsten Werktages. Der Widerspruch ist zu unterzeichnen. Eine Begründung des Widerspruchs ist nicht vorgeschrieben."
    },
    {
      "date": "2025-12-08",
      "id": "139410",
      "original_text": "Registerbekanntmachung nach dem Umwandlungsgesetz\nNordrhein-Westfalen Amtsgericht Münster HRB 22023\nScholz Industrielackierungen GmbH – Münster",
      "type": "Registerbekanntmachung nach dem Umwandlungsgesetz",
      "state": "Nordrhein-Westfalen",
      "amtsgericht": "Amtsgericht Münster",
      "registernummer": "HRB 22023",
      "registerart": "HRB",
      "company_name": "Scholz Industrielackierungen GmbH",
      "company_seat": "Münster",
      "details": "08.12.2025 (Bekanntmachungsdatum)\n\nNordrhein-Westfalen Amtsgericht Münster HRB 22023\nRegisterbekanntmachung nach dem Umwandlungsgesetz 08.12.2025 (Eintragungsdatum)\n\nScholz Industrielackierungen GmbH\nGesellschaft mit beschränkter Haftung\nMünster\n\nDie Gesellschaft hat Gläubigern, deren Forderungen vor dieser Bekanntmachung begründet worden sind, Sicherheit zu leisten, soweit sie nicht Befriedigung verlangen können, wenn sie sich binnen sechs Monaten zu diesem Zweck melden. Den Gläubigern der an der Verschmelzung beteiligten Rechtsträger ist, wenn sie binnen sechs Monaten nach dem Tag, an dem die Eintragung der Verschmelzung in das Register des Sitzes desjenigen Rechtsträgers, dessen Gläubiger sie sind, nach § 19 Absatz 3 UmwG als bekanntgemacht gilt, ihren Anspruch nach Grund und Höhe schriftlich anmelden, Sicherheit zu leisten, soweit sie nicht Befriedigung verlangen können. Dieses Recht steht den Gläubigern jedoch nur zu, wenn sie glaubhaft machen, dass durch die Verschmelzung die Erfüllung ihrer Forderung gefährdet wird.Den Gläubigern der an der grenzüberschreitenden Verschmelzung beteiligten übernehmenden Rechtsträger ist, wenn sie binnen sechs Monaten nach dem Tag, an dem die Eintragung der Spaltung in das Register des Sitzes desjenigen Rechtsträgers, dessen Gläubiger sie sind, nach § 19 Absatz 3 UmwG als bekanntgemacht gilt, ihren Anspruch nach Grund und Höhe in Textform anmelden, Sicherheit zu leisten, soweit sie nicht Befriedigung verlangen können.\n\nDieses Recht steht den Gläubigern jedoch nur zu, wenn sie glaubhaft machen, dass durch die Spaltung die Erfüllung ihrer Forderung gefährdet wird."
    },
    {
      "date": "2025-12-08",
      "id": "139411",
      "original_text": "Löschungsankündigung\nNordrhein-Westfalen Amtsgericht Dortmund HRB 33432\nDein Dach GmbH – Dortmund",
      "type": "Löschungsankündigung",
      "state": "Nordrhein-Westfalen",
      "amtsgericht": "Amtsgericht Dortmund",
      "registernummer": "HRB 33432",
      "registerart": "HRB",
      "company_name": "Dein Dach GmbH",
      "company_seat": "Dortmund",
      "details": "08.12.2025 (Bekanntmachungsdatum)\n\nNordrhein-Westfalen Amtsgericht Dortmund HRB 33432\nLöschungsankündigung\n\nDein Dach GmbH\nGesellschaft mit beschränkter Haftung\nDortmund\n\nDas Registergericht beabsichtigt die Gesellschaft von Amts wegen nach § 394 FamFG zu löschen. Die Frist zur Erhebung eines Widerspruchs ist auf zwei Monate festgesetzt."
    },
    {
      "date": "2025-12-08",
      "id": "139412",
      "original_text": "Registerbekanntmachung nach dem Umwandlungsgesetz\nNordrhein-Westfalen Amtsgericht Duisburg HRB 39831\nTornetta Besitz GmbH – Wesel",
      "type": "Registerbekanntmachung nach dem Umwandlungsgesetz",
      "state": "Nordrhein-Westfalen",
      "amtsgericht": "Amtsgericht Duisburg",
      "registernummer": "HRB 39831",
      "registerart": "HRB",
      "company_name": "Tornetta Besitz GmbH",
      "company_seat": "Wesel",
      "details": "08.12.2025 (Bekanntmachungsdatum)\n\nNordrhein-Westfalen Amtsgericht Duisburg HRB 39831\nRegisterbekanntmachung nach dem Umwandlungsgesetz 03.12.2025 (Eintragungsdatum)\n\nTornetta Besitz GmbH\nGesellschaft mit beschränkter Haftung\nWesel\n\nDie Gesellschaft hat Gläubigern, deren Forderungen vor dieser Bekanntmachung begründet worden sind, Sicherheit zu leisten, soweit sie nicht Befriedigung verlangen können, wenn sie sich binnen sechs Monaten zu diesem Zweck melden."
    },
    {
      "date": "2025-12-08",
      "id": "139413",
      "original_text": "Löschungsankündigung\nNordrhein-Westfalen Amtsgericht Aachen VR 6225\nAachen Turkish Student Association e.V. – Aachen",
      "type": "Löschungsankündigung",
      "state": "Nordrhein-Westfalen",
      "amtsgericht": "Amtsgericht Aachen",
      "registernummer": "VR 6225",
      "registerart": "VR",
      "company_name": "Aachen Turkish Student Association e.V.",
      "company_seat": "Aachen",
      "details": "08.12.2025 (Bekanntmachungsdatum)\n\nNordrhein-Westfalen Amtsgericht Aachen VR 6225\nLöschungsankündigung\n\nAachen Turkish Student Association e.V.\neingetragener Verein\nAachen\n\nDas Registergericht beabsichtigt, von Amts wegen den Verein wegen Wegfalls aller Mitglieder wegen Unzulässigkeit nach § 395 FamFG zu löschen.\n\nZur Geltendmachung des Widerspruchs gegen die beabsichtigte Löschung wird hiermit eine Frist von einem Monat ab Veröffentlichung dieser Ankündigung bestimmt.\n\nRechtsbehelfsbelehrung:\n\nGegen diese Verfügung kann Widerspruch eingelegt werden. Zum Widerspruch ist jeder berechtigt, der an der Unterlassung der Löschung ein berechtigtes Interesse hat.\n\nDer Widerspruch ist bei dem Amtsgericht Aachen, Adalbertsteinweg 92, 52070 Aachen schriftlich in deutscher Sprache oder zur Niederschrift der Geschäftsstelle einzulegen. Der Widerspruch kann auch zur Niederschrift der Geschäftsstelle eines jeden Amtsgerichtes abgegeben werden.\n\nDer Widerspruch muss spätestens innerhalb der gesetzten Frist nach der Bekanntgabe der Verfügung bei dem Amtsgericht Aachen eingegangen sein. Dies gilt auch dann, wenn der Widerspruch zur Niederschrift der Geschäftsstelle eines anderen Amtsgerichtes abgegeben wurde. Die Frist beginnt mit der Bekanntgabe der Verfügung durch Veröffentlichung. Fällt das Ende der Frist auf einen Sonntag, einen allgemeinen Feiertag oder Sonnabend, so endet die Frist mit Ablauf des nächsten Werktages.\n\nDer Widerspruch muss die Bezeichnung der angefochtenen Verfügung sowie die Erklärung enthalten, dass Widerspruch gegen diese Verfügung eingelegt wird. Er ist zu unterzeichnen und soll begründet werden.\n\nDie Einlegung ist auch durch Übertragung eines elektronischen Dokuments an die elektronische Poststelle des Gerichts möglich. Das elektronische Dokument muss für die Bearbeitung durch das Gericht geeignet und mit einer qualifizierten elektronischen Signatur der verantwortenden Person versehen sein oder von der verantwortenden Person signiert und auf einem sicheren Übermittlungsweg gemäß § 130 a ZPO nach näherer Maßgabe der Verordnung über die technischen Rahmenbedingungen des elektronischen Rechtsverkehrs und über das besondere elektronische Behördenpostfach (BGBl. I, S. 3803) eingereicht werden. Weitere Informationen erhalten Sie auf der Internetseite www.justiz.de."
    },
    {
      "date": "2025-12-08",
      "id": "139414",
      "original_text": "Löschungsankündigung\nNordrhein-Westfalen Amtsgericht Aachen HRB 27189\nSKEYEFORGE AG – Aachen",
      "type": "Löschungsankündigung",
      "state": "Nordrhein-Westfalen",
      "amtsgericht": "Amtsgericht Aachen",
      "registernummer": "HRB 27189",
      "registerart": "HRB",
      "company_name": "SKEYEFORGE AG",
      "company_seat": "Aachen",
      "details": "08.12.2025 (Bekanntmachungsdatum)\n\nNordrhein-Westfalen Amtsgericht Aachen HRB 27189\nLöschungsankündigung\n\nSKEYEFORGE AG\nAktiengesellschaft\nAachen\n\nEs ist beabsichtigt, von Amts wegen folgende Eintragung wegen Unzulässigkeit nach § 395 FamFG zu löschen: Eintragung von Herrn Horst Ebhart, Olbendorf/Österreich, *18.11.1957, als Vorstand.\n\nNach den Erkenntnissen des Gerichts hat Herr Ebhart mit Schreiben vom 04.08.2025 das Vorstandsamt gegenüber der Gesellschaft, vertreten durch den Aufsichtsrat, niedergelegt.\n\nZur Geltendmachung des Widerspruchs gegen die beabsichtigte Löschung wird hiermit eine Frist von einem Monat bestimmt.\n\nRechtsbehelfsbelehrung\nGegen diese Verfügung können Sie Widerspruch einlegen.\n\nDer Widerspruch ist bei dem Amtsgericht Aachen, Adalbertsteinweg 92, 52070 Aachen schriftlich in deutscher Sprache oder zur Niederschrift der Geschäftsstelle einzulegen. Der Widerspruch kann auch zur Niederschrift der Geschäftsstelle eines jeden Amtsgerichtes abgegeben werden.\n\nDer Widerspruch muss spätestens innerhalb der gesetzten Frist nach der schriftlichen Bekanntgabe der Verfügung bei dem Amtsgericht Aachen eingegangen sein. Dies gilt auch dann, wenn der Widerspruch zur Niederschrift der Geschäftsstelle eines anderen Amtsgerichtes abgegeben wurde. Die Frist beginnt mit der schriftlichen Bekanntgabe der Verfügung, spätestens mit Ablauf von fünf Monaten nach Erlass der Verfügung. Die Bekanntgabe ist entweder durch Zustellung oder am dritten Tage nach Aufgabe zur Post bewirkt. Fällt das Ende der Frist auf einen Sonntag, einen allgemeinen Feiertag oder Sonnabend, so endet die Frist mit Ablauf des nächsten Werktages.\n\nDer Widerspruch muss die Bezeichnung der angefochtenen Verfügung sowie die Erklärung enthalten, dass Widerspruch gegen diese Verfügung eingelegt wird. Er ist zu unterzeichnen und soll begründet werden.\n\nDie Einlegung ist auch durch Übertragung eines elektronischen Dokuments an die elektronische Poststelle des Gerichts möglich. Das elektronische Dokument muss für die Bearbeitung durch das Gericht geeignet und mit einer qualifizierten elektronischen Signatur der verantwortenden Person versehen sein oder von der verantwortenden Person signiert und auf einem sicheren Übermittlungsweg gemäß § 130 a ZPO nach näherer Maßgabe der Verordnung über die technischen Rahmenbedingungen des elektronischen Rechtsverkehrs und über das besondere elektronische Behördenpostfach (BGBl. I, S. 3803) eingereicht werden. Weitere Informationen erhalten Sie auf der Internetseite www.justiz.de."
    },
    {
      "date": "2025-12-08",
      "id": "139415",
      "original_text": "Löschungsankündigung\nNordrhein-Westfalen Amtsgericht Aachen HRB 26628\nFormella UG (haftungsbeschränkt) – Heinsberg",
      "type": "Löschungsankündigung",
      "state": "Nordrhein-Westfalen",
      "amtsgericht": "Amtsgericht Aachen",
      "registernummer": "HRB 26628",
      "registerart": "HRB",
      "company_name": "Formella UG (haftungsbeschränkt)",
      "company_seat": "Heinsberg",
      "details": "08.12.2025 (Bekanntmachungsdatum)\n\nNordrhein-Westfalen Amtsgericht Aachen HRB 26628\nLöschungsankündigung\n\nFormella UG (haftungsbeschränkt)\nGesellschaft mit beschränkter Haftung\nHeinsberg\n\nDas Registergericht beabsichtigt, von Amts wegen die Gesellschaft wegen Vermögenslosigkeit nach § 394 FamFG zu löschen, weil das Insolvenzverfahren Amtsgericht Aachen (Az.:  93 IN 141/24) beendet und Vermögen der Gesellschaft nicht mehr erkennbar ist.\n\nZur Geltendmachung des Widerspruchs gegen die beabsichtigte Löschung wird hiermit eine Frist von einem Monat ab Veröffentlichung dieser Ankündigung bestimmt.\n\nRechtsbehelfsbelehrung:\n\nGegen diese Verfügung kann Widerspruch eingelegt werden. Zum Widerspruch ist jeder berechtigt, der an der Unterlassung der Löschung ein berechtigtes Interesse hat.\n\nDer Widerspruch ist bei dem Amtsgericht Aachen, Adalbertsteinweg 92, 52070 Aachen schriftlich in deutscher Sprache oder zur Niederschrift der Geschäftsstelle einzulegen. Der Widerspruch kann auch zur Niederschrift der Geschäftsstelle eines jeden Amtsgerichtes abgegeben werden.\n\nDer Widerspruch muss spätestens innerhalb der gesetzten Frist nach der Bekanntgabe der Verfügung bei dem Amtsgericht Aachen eingegangen sein. Dies gilt auch dann, wenn der Widerspruch zur Niederschrift der Geschäftsstelle eines anderen Amtsgerichtes abgegeben wurde. Die Frist beginnt mit der Bekanntgabe der Verfügung durch Veröffentlichung. Fällt das Ende der Frist auf einen Sonntag, einen allgemeinen Feiertag oder Sonnabend, so endet die Frist mit Ablauf des nächsten Werktages.\n\nDer Widerspruch muss die Bezeichnung der angefochtenen Verfügung sowie die Erklärung enthalten, dass Widerspruch gegen diese Verfügung eingelegt wird. Er ist zu unterzeichnen und soll begründet werden.\n\nDie Einlegung ist auch durch Übertragung eines elektronischen Dokuments an die elektronische Poststelle des Gerichts möglich. Das elektronische Dokument muss für die Bearbeitung durch das Gericht geeignet und mit einer qualifizierten elektronischen Signatur der verantwortenden Person versehen sein oder von der verantwortenden Person signiert und auf einem sicheren Übermittlungsweg gemäß § 130 a ZPO nach näherer Maßgabe der Verordnung über die technischen Rahmenbedingungen des elektronischen Rechtsverkehrs und über das besondere elektronische Behördenpostfach (BGBl. I, S. 3803) eingereicht werden. Weitere Informationen erhalten Sie auf der Internetseite www.justiz.de."
    },
    {
      "date": "2025-12-08",
      "id": "139416",
      "original_text": "Einreichung neuer Dokumente\nNordrhein-Westfalen Amtsgericht Münster HRB 9745\nStädtische Baugesellschaft Ennigerloh, Gesellschaft mit beschränkter Haftung – Ennigerloh",
      "type": "Einreichung neuer Dokumente",
      "state": "Nordrhein-Westfalen",
      "amtsgericht": "Amtsgericht Münster",
      "registernummer": "HRB 9745",
      "registerart": "HRB",
      "company_name": "Städtische Baugesellschaft Ennigerloh, Gesellschaft mit beschränkter Haftung",
      "company_seat": "Ennigerloh",
      "details": "08.12.2025 (Bekanntmachungsdatum)\n\nNordrhein-Westfalen Amtsgericht Münster HRB 9745\nEinreichung neuer Dokumente\n\nStädtische Baugesellschaft Ennigerloh, Gesellschaft mit beschränkter Haftung\nGesellschaft mit beschränkter Haftung\nEnnigerloh\n\nDem Registergericht ist eine Liste der Mitglieder des Aufsichtsrates eingereicht worden."
    },
    {
      "date": "2025-12-08",
      "id": "139417",
      "original_text": "Registerbekanntmachung nach dem Umwandlungsgesetz\nNordrhein-Westfalen Amtsgericht Essen HRB 27138\nADVISA EAV Steuerberatungsgesellschaft mbH – Essen",
      "type": "Registerbekanntmachung nach dem Umwandlungsgesetz",
      "state": "Nordrhein-Westfalen",
      "amtsgericht": "Amtsgericht Essen",
      "registernummer": "HRB 27138",
      "registerart": "HRB",
      "company_name": "ADVISA EAV Steuerberatungsgesellschaft mbH",
      "company_seat": "Essen",
      "details": "08.12.2025 (Bekanntmachungsdatum)\n\nNordrhein-Westfalen Amtsgericht Essen HRB 27138\nRegisterbekanntmachung nach dem Umwandlungsgesetz 08.12.2025 (Eintragungsdatum)\n\nADVISA EAV Steuerberatungsgesellschaft mbH\nGesellschaft mit beschränkter Haftung\nEssen\n\nDen Gläubigern der an der Verschmelzung beteiligten Rechtsträger ist, wenn sie binnen sechs Monaten nach dem Tag, an dem die Eintragung der Verschmelzung in das Register des Sitzes derjenigen Rechtsträger deren Gläubiger sie sind, nach § 19 Absatz 3 UmwG als bekanntgemacht gilt, ihren Anspruch nach Grund und Höhe schriftlich anmelden, Sicherheit zu leisten, soweit sie nicht Befriedigung verlangen können. Dieses Recht steht den Gläubigern jedoch nur zu, wenn sie glaubhaft machen, dass durch die Verschmelzung die Erfüllung ihrer Forderung gefährdet wird."
    },
    {
      "date": "2025-12-08",
      "id": "139418",
      "original_text": "Registerbekanntmachung nach dem Umwandlungsgesetz\nNordrhein-Westfalen Amtsgericht Köln HRB 125827\nLaudanis GmbH – Köln",
      "type": "Registerbekanntmachung nach dem Umwandlungsgesetz",
      "state": "Nordrhein-Westfalen",
      "amtsgericht": "Amtsgericht Köln",
      "registernummer": "HRB 125827",
      "registerart": "HRB",
      "company_name": "Laudanis GmbH",
      "company_seat": "Köln",
      "details": "08.12.2025 (Bekanntmachungsdatum)\n\nNordrhein-Westfalen Amtsgericht Köln HRB 125827\nRegisterbekanntmachung nach dem Umwandlungsgesetz 08.12.2025 (Eintragungsdatum)\n\nLaudanis GmbH\nGesellschaft mit beschränkter Haftung\nKöln\n\nDen Gläubigern der an der formwechselnden Umwandlung beteiligten Rechtsträger ist, wenn sie binnen sechs Monaten nach dem Tag, an dem die Eintragung der formwechselnden Umwandlung in das Register des Sitzes desjenigen Rechtsträgers, dessen Gläubiger sie sind, nach § 19 Absatz 3 UmwG als bekanntgemacht gilt, ihren Anspruch nach Grund und Höhe schriftlich anmelden, Sicherheit zu leisten, soweit sie nicht Befriedigung verlangen können. Dieses Recht steht den Gläubigern jedoch nur zu, wenn sie glaubhaft machen, dass durch die formwechselnden Umwandlung die Erfüllung ihrer Forderung gefährdet wird."
    },
    {
      "date": "2025-12-08",
      "id": "139419",
      "original_text": "Registerbekanntmachung nach dem Umwandlungsgesetz\nNordrhein-Westfalen Amtsgericht Lemgo HRB 7371\nProLip-Service GmbH – Detmold",
      "type": "Registerbekanntmachung nach dem Umwandlungsgesetz",
      "state": "Nordrhein-Westfalen",
      "amtsgericht": "Amtsgericht Lemgo",
      "registernummer": "HRB 7371",
      "registerart": "HRB",
      "company_name": "ProLip-Service GmbH",
      "company_seat": "Detmold",
      "details": "08.12.2025 (Bekanntmachungsdatum)\n\nNordrhein-Westfalen Amtsgericht Lemgo HRB 7371\nRegisterbekanntmachung nach dem Umwandlungsgesetz 08.12.2025 (Eintragungsdatum)\n\nProLip-Service GmbH\nGesellschaft mit beschränkter Haftung\nDetmold\n\nDen Gläubigern der an der Verschmelzung beteiligten Rechtsträger ist, wenn sie binnen sechs Monaten nach dem Tag, an dem die Eintragung der Verschmelzung in das Register des Sitzes desjenigen Rechtsträgers, dessen Gläubiger sie sind, nach § 19 Absatz 3 UmwG als bekanntgemacht gilt, ihren Anspruch nach Grund und Höhe schriftlich anmelden, Sicherheit zu leisten, soweit sie nicht Befriedigung verlangen können. Dieses Recht steht den Gläubigern jedoch nur zu, wenn sie glaubhaft machen, dass durch die Verschmelzung die Erfüllung ihrer Forderung gefährdet wird."
    },
    {
      "date": "2025-12-08",
      "id": "139420",
      "original_text": "Registerbekanntmachung nach dem Umwandlungsgesetz\nNordrhein-Westfalen Amtsgericht Bad Oeynhausen HRB 17677\nMM Coating plus GmbH – Herford",
      "type": "Registerbekanntmachung nach dem Umwandlungsgesetz",
      "state": "Nordrhein-Westfalen",
      "amtsgericht": "Amtsgericht Bad Oeynhausen",
      "registernummer": "HRB 17677",
      "registerart": "HRB",
      "company_name": "MM Coating plus GmbH",
      "company_seat": "Herford",
      "details": "08.12.2025 (Bekanntmachungsdatum)\n\nNordrhein-Westfalen Amtsgericht Bad Oeynhausen HRB 17677\nRegisterbekanntmachung nach dem Umwandlungsgesetz 08.12.2025 (Eintragungsdatum)\n\nMM Coating plus GmbH\nGesellschaft mit beschränkter Haftung\nHerford\n\nDen Gläubigern der an der Verschmelzung beteiligten Rechtsträger ist, wenn sie binnen sechs Monaten nach dem Tag, an dem die Eintragung der Verschmelzung in das Register des Sitzes desjenigen Rechtsträgers, dessen Gläubiger sie sind, nach § 19 Absatz 3 UmwG als bekanntgemacht gilt, ihren Anspruch nach Grund und Höhe schriftlich anmelden, Sicherheit zu leisten, soweit sie nicht Befriedigung verlangen können. Dieses Recht steht den Gläubigern jedoch nur zu, wenn sie glaubhaft machen, dass durch die Verschmelzung die Erfüllung ihrer Forderung gefährdet wird."
    },
    {
      "date": "2025-12-08",
      "id": "139421",
      "original_text": "Registerbekanntmachung nach dem Umwandlungsgesetz\nNordrhein-Westfalen Amtsgericht Köln HRB 53152\nDERTOUR Deutschland GmbH – Köln",
      "type": "Registerbekanntmachung nach dem Umwandlungsgesetz",
      "state": "Nordrhein-Westfalen",
      "amtsgericht": "Amtsgericht Köln",
      "registernummer": "HRB 53152",
      "registerart": "HRB",
      "company_name": "DERTOUR Deutschland GmbH",
      "company_seat": "Köln",
      "details": "08.12.2025 (Bekanntmachungsdatum)\n\nNordrhein-Westfalen Amtsgericht Köln HRB 53152\nRegisterbekanntmachung nach dem Umwandlungsgesetz 08.12.2025 (Eintragungsdatum)\n\nDERTOUR Deutschland GmbH\nGesellschaft mit beschränkter Haftung\nKöln\n\nDen Gläubigern der an der Verschmelzung beteiligten Rechtsträger ist, wenn sie binnen sechs Monaten nach dem Tag, an dem die Eintragung der Verschmelzung in das Register des Sitzes desjenigen Rechtsträgers, dessen Gläubiger sie sind, nach § 19 Absatz 3 UmwG als bekanntgemacht gilt, ihren Anspruch nach Grund und Höhe schriftlich anmelden, Sicherheit zu leisten, soweit sie nicht Befriedigung verlangen können. Dieses Recht steht den Gläubigern jedoch nur zu, wenn sie glaubhaft machen, dass durch die Verschmelzung die Erfüllung ihrer Forderung gefährdet wird."
    },
    {
      "date": "2025-12-08",
      "id": "139422",
      "original_text": "Sonstige Registerbekanntmachung\nNordrhein-Westfalen Amtsgericht Bielefeld HRB 35157\nNextPharma Logistics GmbH – Bielefeld",
      "type": "Sonstige Registerbekanntmachung",
      "state": "Nordrhein-Westfalen",
      "amtsgericht": "Amtsgericht Bielefeld",
      "registernummer": "HRB 35157",
      "registerart": "HRB",
      "company_name": "NextPharma Logistics GmbH",
      "company_seat": "Bielefeld",
      "details": "08.12.2025 (Bekanntmachungsdatum)\n\nNordrhein-Westfalen Amtsgericht Bielefeld HRB 35157\nSonstige Registerbekanntmachung 08.12.2025 (Eintragungsdatum)\n\nNextPharma Logistics GmbH\nGesellschaft mit beschränkter Haftung\nBielefeld\n\nAls nicht eingetragen wird veröffentlicht: Den Gläubigern der Gesellschaft, deren Forderungen begründet worden sind bevor die Eintragung der Beendigung des Gewinnabführungsvertrages  in das Handelsregister nach § 10 des Handelsgesetzbuches als bekanntgemacht gilt, hat der andere Vertragsteil Sicherheit zu leisten, wenn sie sich binnen sechs Monaten nach der Bekanntmachung der Eintragung zu diesem Zweck bei ihm melden."
    },
    {
      "date": "2025-12-08",
      "id": "139423",
      "original_text": "Registerbekanntmachung nach dem Umwandlungsgesetz\nNordrhein-Westfalen Amtsgericht Köln HRB 4595\nITS Reisen GmbH – Köln",
      "type": "Registerbekanntmachung nach dem Umwandlungsgesetz",
      "state": "Nordrhein-Westfalen",
      "amtsgericht": "Amtsgericht Köln",
      "registernummer": "HRB 4595",
      "registerart": "HRB",
      "company_name": "ITS Reisen GmbH",
      "company_seat": "Köln",
      "details": "08.12.2025 (Bekanntmachungsdatum)\n\nNordrhein-Westfalen Amtsgericht Köln HRB 4595\nRegisterbekanntmachung nach dem Umwandlungsgesetz 08.12.2025 (Eintragungsdatum)\n\nITS Reisen GmbH\nGesellschaft mit beschränkter Haftung\nKöln\n\nDen Gläubigern der an der Verschmelzung beteiligten Rechtsträger ist, wenn sie binnen sechs Monaten nach dem Tag, an dem die Eintragung der Verschmelzung in das Register des Sitzes desjenigen Rechtsträgers, dessen Gläubiger sie sind, nach § 19 Absatz 3 UmwG als bekanntgemacht gilt, ihren Anspruch nach Grund und Höhe schriftlich anmelden, Sicherheit zu leisten, soweit sie nicht Befriedigung verlangen können. Dieses Recht steht den Gläubigern jedoch nur zu, wenn sie glaubhaft machen, dass durch die Verschmelzung die Erfüllung ihrer Forderung gefährdet wird."
    },
    {
      "date": "2025-12-08",
      "id": "139424",
      "original_text": "Registerbekanntmachung nach dem Umwandlungsgesetz\nNordrhein-Westfalen Amtsgericht Hamm HRB 11965\nElektrotechnik Brendan Blank GmbH – Hamm",
      "type": "Registerbekanntmachung nach dem Umwandlungsgesetz",
      "state": "Nordrhein-Westfalen",
      "amtsgericht": "Amtsgericht Hamm",
      "registernummer": "HRB 11965",
      "registerart": "HRB",
      "company_name": "Elektrotechnik Brendan Blank GmbH",
      "company_seat": "Hamm",
      "details": "08.12.2025 (Bekanntmachungsdatum)\n\nNordrhein-Westfalen Amtsgericht Hamm HRB 11965\nRegisterbekanntmachung nach dem Umwandlungsgesetz 08.12.2025 (Eintragungsdatum)\n\nElektrotechnik Brendan Blank GmbH\nGesellschaft mit beschränkter Haftung\nHamm\n\nDen Gläubigern der an der Ausgliederung beteiligten Rechtsträger ist, wenn sie binnen sechs Monaten nach dem Tag, an dem die Eintragung der Ausgliederung in das Register des Sitzes derjenigen Rechtsträger deren Gläubiger sie sind, nach § 19 Absatz 3 UmwG als bekanntgemacht gilt, ihren Anspruch nach Grund und Höhe schriftlich anmelden, Sicherheit zu leisten, soweit sie nicht Befriedigung verlangen können. Dieses Recht steht den Gläubigern jedoch nur zu, wenn sie glaubhaft machen, dass durch die Ausgliederung die Erfüllung ihrer Forderung gefährdet wird."
    },
    {
      "date": "2025-12-08",
      "id": "139425",
      "original_text": "Registerbekanntmachung nach dem Umwandlungsgesetz\nNordrhein-Westfalen Amtsgericht Köln HRA 38322\nLaudanis oHG – Köln",
      "type": "Registerbekanntmachung nach dem Umwandlungsgesetz",
      "state": "Nordrhein-Westfalen",
      "amtsgericht": "Amtsgericht Köln",
      "registernummer": "HRA 38322",
      "registerart": "HRA",
      "company_name": "Laudanis oHG",
      "company_seat": "Köln",
      "details": "08.12.2025 (Bekanntmachungsdatum)\n\nNordrhein-Westfalen Amtsgericht Köln HRA 38322\nRegisterbekanntmachung nach dem Umwandlungsgesetz 08.12.2025 (Eintragungsdatum)\n\nLaudanis oHG\nOffene Handelsgesellschaft\nKöln\n\nDen Gläubigern der an der formwechselnden Umwandlung beteiligten Rechtsträger ist, wenn sie binnen sechs Monaten nach dem Tag, an dem die Eintragung der formwechselnden Umwandlung in das Register des Sitzes desjenigen Rechtsträgers, dessen Gläubiger sie sind, nach § 19 Absatz 3 UmwG als bekanntgemacht gilt, ihren Anspruch nach Grund und Höhe schriftlich anmelden, Sicherheit zu leisten, soweit sie nicht Befriedigung verlangen können. Dieses Recht steht den Gläubigern jedoch nur zu, wenn sie glaubhaft machen, dass durch die formwechselnden Umwandlung die Erfüllung ihrer Forderung gefährdet wird."
    },
    {
      "date": "2025-12-08",
      "id": "139426",
      "original_text": "Löschungsankündigung\nNordrhein-Westfalen Amtsgericht Köln HRB 108566\nD ONE asset & development GmbH – Leverkusen",
      "type": "Löschungsankündigung",
      "state": "Nordrhein-Westfalen",
      "amtsgericht": "Amtsgericht Köln",
      "registernummer": "HRB 108566",
      "registerart": "HRB",
      "company_name": "D ONE asset & development GmbH",
      "company_seat": "Leverkusen",
      "details": "08.12.2025 (Bekanntmachungsdatum)\n\nNordrhein-Westfalen Amtsgericht Köln HRB 108566\nLöschungsankündigung\n\nD ONE asset & development GmbH\nGesellschaft mit beschränkter Haftung\nLeverkusen\n\nDas Registergericht beabsichtigt die Gesellschaft von Amts wegen nach § 394 FamFG zu löschen. Die Frist zur Erhebung eines Widerspruchs ist auf einen Monat festgesetzt."
    },
    {
      "date": "2025-12-08",
      "id": "139427",
      "original_text": "Sonstige Registerbekanntmachung\nNordrhein-Westfalen Amtsgericht Recklinghausen HRB 3239\nStadtbetriebe Recklinghausen GmbH – Recklinghausen",
      "type": "Sonstige Registerbekanntmachung",
      "state": "Nordrhein-Westfalen",
      "amtsgericht": "Amtsgericht Recklinghausen",
      "registernummer": "HRB 3239",
      "registerart": "HRB",
      "company_name": "Stadtbetriebe Recklinghausen GmbH",
      "company_seat": "Recklinghausen",
      "details": "08.12.2025 (Bekanntmachungsdatum)\n\nNordrhein-Westfalen Amtsgericht Recklinghausen HRB 3239\nSonstige Registerbekanntmachung 08.12.2025 (Eintragungsdatum)\n\nStadtbetriebe Recklinghausen GmbH\nGesellschaft mit beschränkter Haftung\nRecklinghausen\n\nDem Registergericht ist eine Liste der Mitglieder des Aufsichtsrates eingereicht worden."
    },
    {
      "date": "2025-12-08",
      "id": "139428",
      "original_text": "Einreichung neuer Dokumente\nNordrhein-Westfalen Amtsgericht Köln HRB 37030\n1. FC Köln GmbH & Co. KGaA – Köln",
      "type": "Einreichung neuer Dokumente",
      "state": "Nordrhein-Westfalen",
      "amtsgericht": "Amtsgericht Köln",
      "registernummer": "HRB 37030",
      "registerart": "HRB",
      "company_name": "1. FC Köln GmbH & Co. KGaA",
      "company_seat": "Köln",
      "details": "08.12.2025 (Bekanntmachungsdatum)\n\nNordrhein-Westfalen Amtsgericht Köln HRB 37030\nEinreichung neuer Dokumente 08.12.2025 (Eintragungsdatum)\n\n1. FC Köln GmbH & Co. KGaA\nKommanditgesellschaft auf Aktien\nKöln\n\nDem Registergericht ist eine neue Liste der Mitglieder des Aufsichtsrates eingereicht worden."
    },
    {
      "date": "2025-12-08",
      "id": "139429",
      "original_text": "Registerbekanntmachung nach dem Umwandlungsgesetz\nNordrhein-Westfalen Amtsgericht Lemgo HRB 4776\nInformatik und Consulting GmbH der Lippische Landesbrandversicherung AG – Detmold",
      "type": "Registerbekanntmachung nach dem Umwandlungsgesetz",
      "state": "Nordrhein-Westfalen",
      "amtsgericht": "Amtsgericht Lemgo",
      "registernummer": "HRB 4776",
      "registerart": "HRB",
      "company_name": "Informatik und Consulting GmbH der Lippische Landesbrandversicherung AG",
      "company_seat": "Detmold",
      "details": "08.12.2025 (Bekanntmachungsdatum)\n\nNordrhein-Westfalen Amtsgericht Lemgo HRB 4776\nRegisterbekanntmachung nach dem Umwandlungsgesetz 08.12.2025 (Eintragungsdatum)\n\nInformatik und Consulting GmbH der Lippische Landesbrandversicherung AG\nGesellschaft mit beschränkter Haftung\nDetmold\n\nDen Gläubigern der an der Verschmelzung beteiligten Rechtsträger ist, wenn sie binnen sechs Monaten nach dem Tag, an dem die Eintragung der Verschmelzung in das Register des Sitzes desjenigen Rechtsträgers, dessen Gläubiger sie sind, nach § 19 Absatz 3 UmwG als bekanntgemacht gilt, ihren Anspruch nach Grund und Höhe schriftlich anmelden, Sicherheit zu leisten, soweit sie nicht Befriedigung verlangen können. Dieses Recht steht den Gläubigern jedoch nur zu, wenn sie glaubhaft machen, dass durch die Verschmelzung die Erfüllung ihrer Forderung gefährdet wird."
    },
    {
      "date": "2025-12-08",
      "id": "139430",
      "original_text": "Registerbekanntmachung nach dem Umwandlungsgesetz\nNordrhein-Westfalen Amtsgericht Hamm HRB 11025\nPhoenix Mining GmbH – Bergkamen",
      "type": "Registerbekanntmachung nach dem Umwandlungsgesetz",
      "state": "Nordrhein-Westfalen",
      "amtsgericht": "Amtsgericht Hamm",
      "registernummer": "HRB 11025",
      "registerart": "HRB",
      "company_name": "Phoenix Mining GmbH",
      "company_seat": "Bergkamen",
      "details": "08.12.2025 (Bekanntmachungsdatum)\n\nNordrhein-Westfalen Amtsgericht Hamm HRB 11025\nRegisterbekanntmachung nach dem Umwandlungsgesetz 08.12.2025 (Eintragungsdatum)\n\nPhoenix Mining GmbH\nGesellschaft mit beschränkter Haftung\nBergkamen\n\nDen Gläubigern der an der Verschmelzung beteiligten Rechtsträger ist, wenn sie binnen sechs Monaten nach dem Tag, an dem die Eintragung der Verschmelzung in das Register des Sitzes derjenigen Rechtsträger deren Gläubiger sie sind, nach § 19 Absatz 3 UmwG als bekanntgemacht gilt, ihren Anspruch nach Grund und Höhe schriftlich anmelden, Sicherheit zu leisten, soweit sie nicht Befriedigung verlangen können. Dieses Recht steht den Gläubigern jedoch nur zu, wenn sie glaubhaft machen, dass durch die Verschmelzung die Erfüllung ihrer Forderung gefährdet wird."
    },
    {
      "date": "2025-12-08",
      "id": "139431",
      "original_text": "Löschungsankündigung\nThüringen Amtsgericht Jena HRB 516501\nmystarthaus.de ug (haftungsbeschränkt) – Erfurt",
      "type": "Löschungsankündigung",
      "state": "Thüringen",
      "amtsgericht": "Amtsgericht Jena",
      "registernummer": "HRB 516501",
      "registerart": "HRB",
      "company_name": "mystarthaus.de ug (haftungsbeschränkt)",
      "company_seat": "Erfurt",
      "details": "08.12.2025 (Bekanntmachungsdatum)\n\nThüringen Amtsgericht Jena HRB 516501\nLöschungsankündigung\n\nmystarthaus.de ug (haftungsbeschränkt)\nGesellschaft mit beschränkter Haftung\nErfurt\n\nDas Registergericht beabsichtigt, die im Handelsregister eingetragene Gesellschaft wegen Vermögenslosigkeit nach § 394 FamFG von Amts wegen zu löschen. Die Frist zur Erhebung eines Widerspruchs gegen die beabsichtigte Löschung wird auf 6 Wochen festgesetzt."
    },
    {
      "date": "2025-12-08",
      "id": "139432",
      "original_text": "Löschungsankündigung\nBaden-Württemberg Amtsgericht Mannheim HRB 728036\nR. & Y. Gastro GmbH – Mannheim",
      "type": "Löschungsankündigung",
      "state": "Baden-Württemberg",
      "amtsgericht": "Amtsgericht Mannheim",
      "registernummer": "HRB 728036",
      "registerart": "HRB",
      "company_name": "R. & Y. Gastro GmbH",
      "company_seat": "Mannheim",
      "details": "08.12.2025 (Bekanntmachungsdatum)\n\nBaden-Württemberg Amtsgericht Mannheim HRB 728036\nLöschungsankündigung\n\nR. & Y. Gastro GmbH\nGesellschaft mit beschränkter Haftung\nMannheim\n\nDas Gericht beabsichtigt, die Gesellschaft wegen Vermögenslosigkeit im Handelsregister von Amts wegen nach § 394 FamFG zu löschen. Die Frist zur Geltendmachung eines Widerspruchs gegen die beabsichtigte Löschung ist auf einen Monat ab Veröffentlichung bestimmt."
    },
    {
      "date": "2025-12-08",
      "id": "139433",
      "original_text": "Einreichung neuer Dokumente\nNordrhein-Westfalen Amtsgericht Wuppertal HRB 21404\nARC Schweisstechnologie AG – Erkrath",
      "type": "Einreichung neuer Dokumente",
      "state": "Nordrhein-Westfalen",
      "amtsgericht": "Amtsgericht Wuppertal",
      "registernummer": "HRB 21404",
      "registerart": "HRB",
      "company_name": "ARC Schweisstechnologie AG",
      "company_seat": "Erkrath",
      "details": "08.12.2025 (Bekanntmachungsdatum)\n\nNordrhein-Westfalen Amtsgericht Wuppertal HRB 21404\nEinreichung neuer Dokumente\n\nARC Schweisstechnologie AG\nAktiengesellschaft\nErkrath\n\nDem Registergericht ist eine neue Liste der Mitglieder des Aufsichtsrates eingereicht worden."
    },
    {
      "date": "2025-12-08",
      "id": "139434",
      "original_text": "Löschungsankündigung\nHessen Amtsgericht Frankfurt am Main HRB 134051\nFLYMAT Personal GmbH – Frankfurt am Main",
      "type": "Löschungsankündigung",
      "state": "Hessen",
      "amtsgericht": "Amtsgericht Frankfurt am Main",
      "registernummer": "HRB 134051",
      "registerart": "HRB",
      "company_name": "FLYMAT Personal GmbH",
      "company_seat": "Frankfurt am Main",
      "details": "08.12.2025 (Bekanntmachungsdatum)\n\nHessen Amtsgericht Frankfurt am Main HRB 134051\nLöschungsankündigung\n\nFLYMAT Personal GmbH\nGesellschaft mit beschränkter Haftung\nFrankfurt am Main\n\nDas Registergericht beabsichtigt die im Handelsregister eingetragene Gesellschaft von Amts wegen nach § 394 FamFG zu löschen. Die Frist zur Erhebung eines Widerspruchs gegen die beabsichtigte Löschung wird auf 1 Monat festgesetzt."
    },
    {
      "date": "2025-12-08",
      "id": "139435",
      "original_text": "Löschungsankündigung\nHessen Amtsgericht Frankfurt am Main HRB 107618\nCyberserv UG (haftungsbeschränkt) – Frankfurt am Main",
      "type": "Löschungsankündigung",
      "state": "Hessen",
      "amtsgericht": "Amtsgericht Frankfurt am Main",
      "registernummer": "HRB 107618",
      "registerart": "HRB",
      "company_name": "Cyberserv UG (haftungsbeschränkt)",
      "company_seat": "Frankfurt am Main",
      "details": "08.12.2025 (Bekanntmachungsdatum)\n\nHessen Amtsgericht Frankfurt am Main HRB 107618\nLöschungsankündigung\n\nCyberserv UG (haftungsbeschränkt)\nGesellschaft mit beschränkter Haftung\nFrankfurt am Main\n\nEs ist beabsichtig, die Gesellschaft wegen Vermögenslosigkeit gemäß § 394 FamFG von Amts wegen im Handelsregister zu löschen. Hiergegen kann innerhalb eines Zeitraums von 1 Monat nach dieser Veröffentlichung Widerspruch bei dem Amtsgericht Frankfurt am Main eingelegt werden."
    },
    {
      "date": "2025-12-08",
      "id": "139436",
      "original_text": "Löschungsankündigung\nHessen Amtsgericht Frankfurt am Main HRB 114814\nNU R GmbH – Eschborn",
      "type": "Löschungsankündigung",
      "state": "Hessen",
      "amtsgericht": "Amtsgericht Frankfurt am Main",
      "registernummer": "HRB 114814",
      "registerart": "HRB",
      "company_name": "NU R GmbH",
      "company_seat": "Eschborn",
      "details": "08.12.2025 (Bekanntmachungsdatum)\n\nHessen Amtsgericht Frankfurt am Main HRB 114814\nLöschungsankündigung\n\nNU R GmbH\nGesellschaft mit beschränkter Haftung\nEschborn\n\nDas Registergericht beabsichtigt die im Handelsregister eingetragene Gesellschaft von Amts wegen nach § 394 FamFG zu löschen. Die Frist zur Erhebung eines Widerspruchs gegen die beabsichtigte Löschung wird auf 1 Monat festgesetzt."
    },
    {
      "date": "2025-12-08",
      "id": "139437",
      "original_text": "Registerbekanntmachung nach dem Umwandlungsgesetz\nHessen Amtsgericht Frankfurt am Main HRB 88570\nCEVA Freight Germany GmbH – Frankfurt am Main",
      "type": "Registerbekanntmachung nach dem Umwandlungsgesetz",
      "state": "Hessen",
      "amtsgericht": "Amtsgericht Frankfurt am Main",
      "registernummer": "HRB 88570",
      "registerart": "HRB",
      "company_name": "CEVA Freight Germany GmbH",
      "company_seat": "Frankfurt am Main",
      "details": "08.12.2025 (Bekanntmachungsdatum)\n\nHessen Amtsgericht Frankfurt am Main HRB 88570\nRegisterbekanntmachung nach dem Umwandlungsgesetz 06.12.2025 (Eintragungsdatum)\n\nCEVA Freight Germany GmbH\nGesellschaft mit beschränkter Haftung\nFrankfurt am Main\n\nDen Gläubigern der an der Verschmelzung beteiligten Rechtsträger ist, wenn sie binnen sechs Monaten nach dem Tag, an dem die Eintragung der Verschmelzung in das Register des Sitzes desjenigen Rechtsträgers, dessen Gläubiger sie sind, nach § 19 Absatz 3 UmwG bekannt gemacht worden ist, ihren Anspruch nach Grund und Höhe schriftlich anmelden, Sicherheit zu leisten, soweit sie nicht Befriedigung verlangen können. Dieses Recht steht den Gläubigern jedoch nur zu, wenn sie glaubhaft machen, dass durch die Verschmelzung die Erfüllung ihrer Forderung gefährdet wird."
    },
    {
      "date": "2025-12-08",
      "id": "139438",
      "original_text": "Löschungsankündigung\nHessen Amtsgericht Darmstadt HRB 96060\nMarc Weber Logistik GmbH – Weiterstadt",
      "type": "Löschungsankündigung",
      "state": "Hessen",
      "amtsgericht": "Amtsgericht Darmstadt",
      "registernummer": "HRB 96060",
      "registerart": "HRB",
      "company_name": "Marc Weber Logistik GmbH",
      "company_seat": "Weiterstadt",
      "details": "08.12.2025 (Bekanntmachungsdatum)\n\nHessen Amtsgericht Darmstadt HRB 96060\nLöschungsankündigung\n\nMarc Weber Logistik GmbH\nGesellschaft mit beschränkter Haftung\nWeiterstadt\n\nDas Registergericht beabsichtigt die im Handelsregister eingetragene Gesellschaft von Amts wegen nach § 394 FamFG zu löschen. Die Frist zur Erhebung eines Widerspruchs gegen die beabsichtigte Löschung wird auf 3 Monate festgesetzt."
    },
    {
      "date": "2025-12-08",
      "id": "139439",
      "original_text": "Löschungsankündigung\nHessen Amtsgericht Frankfurt am Main HRB 133585\nAOS Consult und Invest GmbH – Frankfurt am Main",
      "type": "Löschungsankündigung",
      "state": "Hessen",
      "amtsgericht": "Amtsgericht Frankfurt am Main",
      "registernummer": "HRB 133585",
      "registerart": "HRB",
      "company_name": "AOS Consult und Invest GmbH",
      "company_seat": "Frankfurt am Main",
      "details": "08.12.2025 (Bekanntmachungsdatum)\n\nHessen Amtsgericht Frankfurt am Main HRB 133585\nLöschungsankündigung\n\nAOS Consult und Invest GmbH\nGesellschaft mit beschränkter Haftung\nFrankfurt am Main\n\nEs ist beabsichtigt, die Gesellschaft wegen Vermögenslosigkeit gemäß § 394 FamFG von Amts wegen im Handelsregister zu löschen. Hiergegen kann innerhalb eines Monats nach dieser Veröffentlichung Widerspruch bei dem Amtsgericht Frankfurt am Main eingelegt werden."
    },
    {
      "date": "2025-12-08",
      "id": "139440",
      "original_text": "Sonstige Registerbekanntmachung\nHessen Amtsgericht Königstein VR 816\nSefa Königstein/Ts. e.V. – Königstein im Taunus",
      "type": "Sonstige Registerbekanntmachung",
      "state": "Hessen",
      "amtsgericht": "Amtsgericht Königstein",
      "registernummer": "VR 816",
      "registerart": "VR",
      "company_name": "Sefa Königstein/Ts. e.V.",
      "company_seat": "Königstein im Taunus",
      "details": "08.12.2025 (Bekanntmachungsdatum)\n\nHessen Amtsgericht Königstein VR 816\nSonstige Registerbekanntmachung 08.12.2025 (Eintragungsdatum)\n\nSefa Königstein/Ts. e.V.\neingetragener Verein\nKönigstein im Taunus\n\nDurch rechtskräftigen Beschluss des Amtsgerichts Königstein im Taunus vom 25.06.2025 ist dem Verein gemäß § 73 BGB die Rechtsfähigkeit entzogen worden."
    },
    {
      "date": "2025-12-08",
      "id": "139441",
      "original_text": "Registerbekanntmachung nach dem Umwandlungsgesetz\nHessen Amtsgericht Frankfurt am Main HRB 89165\nGelbe Seiten Marketing Gesellschaft mbH – Frankfurt am Main",
      "type": "Registerbekanntmachung nach dem Umwandlungsgesetz",
      "state": "Hessen",
      "amtsgericht": "Amtsgericht Frankfurt am Main",
      "registernummer": "HRB 89165",
      "registerart": "HRB",
      "company_name": "Gelbe Seiten Marketing Gesellschaft mbH",
      "company_seat": "Frankfurt am Main",
      "details": "08.12.2025 (Bekanntmachungsdatum)\n\nHessen Amtsgericht Frankfurt am Main HRB 89165\nRegisterbekanntmachung nach dem Umwandlungsgesetz 08.12.2025 (Eintragungsdatum)\n\nGelbe Seiten Marketing Gesellschaft mbH\nGesellschaft mit beschränkter Haftung\nFrankfurt am Main\n\nDen Gläubigern der an der Verschmelzung beteiligten Rechtsträger ist, wenn sie binnen sechs Monaten nach dem Tag, an dem die Eintragung der Verschmelzung in das Register des Sitzes desjenigen Rechtsträgers, dessen Gläubiger sie sind, nach § 19 Absatz 3 UmwG bekannt gemacht worden ist, ihren Anspruch nach Grund und Höhe schriftlich anmelden, Sicherheit zu leisten, soweit sie nicht Befriedigung verlangen können. Dieses Recht steht den Gläubigern jedoch nur zu, wenn sie glaubhaft machen, dass durch die Verschmelzung die Erfüllung ihrer Forderung gefährdet wird."
    },
    {
      "date": "2025-12-08",
      "id": "139442",
      "original_text": "Löschungsankündigung\nHessen Amtsgericht Frankfurt am Main HRB 116940\nETHR Digital Matter GmbH – Frankfurt am Main",
      "type": "Löschungsankündigung",
      "state": "Hessen",
      "amtsgericht": "Amtsgericht Frankfurt am Main",
      "registernummer": "HRB 116940",
      "registerart": "HRB",
      "company_name": "ETHR Digital Matter GmbH",
      "company_seat": "Frankfurt am Main",
      "details": "08.12.2025 (Bekanntmachungsdatum)\n\nHessen Amtsgericht Frankfurt am Main HRB 116940\nLöschungsankündigung\n\nETHR Digital Matter GmbH\nGesellschaft mit beschränkter Haftung\nFrankfurt am Main\n\nDas Registergericht beabsichtigt die im Handelsregister eingetragene Gesellschaft von Amts wegen nach § 394 FamFG zu löschen. Die Frist zur Erhebung eines Widerspruchs gegen die beabsichtigte Löschung wird auf 1 Monat festgesetzt."
    },
    {
      "date": "2025-12-08",
      "id": "139443",
      "original_text": "Löschungsankündigung\nHessen Amtsgericht Frankfurt am Main HRB 135471\nTannenheim UG (haftungsbeschränkt) – Frankfurt am Main",
      "type": "Löschungsankündigung",
      "state": "Hessen",
      "amtsgericht": "Amtsgericht Frankfurt am Main",
      "registernummer": "HRB 135471",
      "registerart": "HRB",
      "company_name": "Tannenheim UG (haftungsbeschränkt)",
      "company_seat": "Frankfurt am Main",
      "details": "08.12.2025 (Bekanntmachungsdatum)\n\nHessen Amtsgericht Frankfurt am Main HRB 135471\nLöschungsankündigung\n\nTannenheim UG (haftungsbeschränkt)\nGesellschaft mit beschränkter Haftung\nFrankfurt am Main\n\nDas Registergericht beabsichtigt die im Handelsregister eingetragene Gesellschaft von Amts wegen nach § 394 FamFG zu löschen. Die Frist zur Erhebung eines Widerspruchs gegen die beabsichtigte Löschung wird auf 1 Monate festgesetzt."
    },
    {
      "date": "2025-12-08",
      "id": "139444",
      "original_text": "Sonstige Registerbekanntmachung\nHessen Amtsgericht Limburg VR 435\nSängervereinigung 1871 Runkel – Runkel",
      "type": "Sonstige Registerbekanntmachung",
      "state": "Hessen",
      "amtsgericht": "Amtsgericht Limburg",
      "registernummer": "VR 435",
      "registerart": "VR",
      "company_name": "Sängervereinigung 1871 Runkel",
      "company_seat": "Runkel",
      "details": "08.12.2025 (Bekanntmachungsdatum)\n\nHessen Amtsgericht Limburg VR 435\nSonstige Registerbekanntmachung 08.12.2025 (Eintragungsdatum)\n\nSängervereinigung 1871 Runkel\neingetragener Verein\nRunkel\n\nDer Verein ist aufgelöst."
    },
    {
      "date": "2025-12-08",
      "id": "139445",
      "original_text": "Registerbekanntmachung nach dem Umwandlungsgesetz\nHessen Amtsgericht Frankfurt am Main HRB 132652\nCEVA Logistics Forwarding Germany GmbH – Frankfurt am Main",
      "type": "Registerbekanntmachung nach dem Umwandlungsgesetz",
      "state": "Hessen",
      "amtsgericht": "Amtsgericht Frankfurt am Main",
      "registernummer": "HRB 132652",
      "registerart": "HRB",
      "company_name": "CEVA Logistics Forwarding Germany GmbH",
      "company_seat": "Frankfurt am Main",
      "details": "08.12.2025 (Bekanntmachungsdatum)\n\nHessen Amtsgericht Frankfurt am Main HRB 132652\nRegisterbekanntmachung nach dem Umwandlungsgesetz 06.12.2025 (Eintragungsdatum)\n\nCEVA Logistics Forwarding Germany GmbH\nGesellschaft mit beschränkter Haftung\nFrankfurt am Main\n\nDen Gläubigern der an der Verschmelzung beteiligten Rechtsträger ist, wenn sie binnen sechs Monaten nach dem Tag, an dem die Eintragung der Verschmelzung in das Register des Sitzes desjenigen Rechtsträgers, dessen Gläubiger sie sind, nach § 19 Absatz 3 UmwG bekannt gemacht worden ist, ihren Anspruch nach Grund und Höhe schriftlich anmelden, Sicherheit zu leisten, soweit sie nicht Befriedigung verlangen können. Dieses Recht steht den Gläubigern jedoch nur zu, wenn sie glaubhaft machen, dass durch die Verschmelzung die Erfüllung ihrer Forderung gefährdet wird."
    },
    {
      "date": "2025-12-08",
      "id": "139446",
      "original_text": "Einreichung neuer Dokumente\nHessen Amtsgericht Frankfurt am Main HRB 40336\nFES Frankfurter Entsorgungs- und Service GmbH – Frankfurt am Main",
      "type": "Einreichung neuer Dokumente",
      "state": "Hessen",
      "amtsgericht": "Amtsgericht Frankfurt am Main",
      "registernummer": "HRB 40336",
      "registerart": "HRB",
      "company_name": "FES Frankfurter Entsorgungs- und Service GmbH",
      "company_seat": "Frankfurt am Main",
      "details": "08.12.2025 (Bekanntmachungsdatum)\n\nHessen Amtsgericht Frankfurt am Main HRB 40336\nEinreichung neuer Dokumente\n\nFES Frankfurter Entsorgungs- und Service GmbH\nGesellschaft mit beschränkter Haftung\nFrankfurt am Main\n\nDurch eine Änderung in den Personen der Aufsichtsratsmitglieder ist eine Liste der Mitglieder des Aufsichtsrates zum Handelsregister eingereicht worden."
    }
  ]
}