{
  "date": "2025-12-30",
  "date_of_scrape": "2025-12-31T04:21:56.814Z",
  "tool_version": "0.2.0",
  "number_of_announcements": 124,
  "announcements": [
    {
      "date": "2025-12-30",
      "id": "141149",
      "original_text": "Löschungsankündigung\nBayern Amtsgericht München HRA 110834\nPRIMUS Concept Rain am Lech GmbH & Co. KG – Markt Indersdorf",
      "type": "Löschungsankündigung",
      "state": "Bayern",
      "amtsgericht": "Amtsgericht München",
      "registernummer": "HRA 110834",
      "registerart": "HRA",
      "company_name": "PRIMUS Concept Rain am Lech GmbH & Co. KG",
      "company_seat": "Markt Indersdorf",
      "details": "30.12.2025 (Bekanntmachungsdatum)\n\nBayern Amtsgericht München HRA 110834\nLöschungsankündigung 29.12.2025 (Eintragungsdatum)\n\nPRIMUS Concept Rain am Lech GmbH & Co. KG\nKommanditgesellschaft\nMarkt Indersdorf\n\nDas Registergericht beabsichtigt, die im Handelsregister eingetragene Firma von Amts wegen nach § 31 Abs. 2 HGB zu löschen. Die Frist zur Erhebung eines Widerspruchs ist auf drei Monate festgesetzt."
    },
    {
      "date": "2025-12-30",
      "id": "141150",
      "original_text": "Registerbekanntmachung nach dem Umwandlungsgesetz\nBayern Amtsgericht Coburg HRB 6268\nSondermaschinenbau Brückner GmbH – Marktgraitz",
      "type": "Registerbekanntmachung nach dem Umwandlungsgesetz",
      "state": "Bayern",
      "amtsgericht": "Amtsgericht Coburg",
      "registernummer": "HRB 6268",
      "registerart": "HRB",
      "company_name": "Sondermaschinenbau Brückner GmbH",
      "company_seat": "Marktgraitz",
      "details": "30.12.2025 (Bekanntmachungsdatum)\n\nBayern Amtsgericht Coburg HRB 6268\nRegisterbekanntmachung nach dem Umwandlungsgesetz 23.12.2025 (Eintragungsdatum)\n\nSondermaschinenbau Brückner GmbH\nGesellschaft mit beschränkter Haftung\nMarktgraitz\n\nDen Gläubigern der an der Verschmelzung beteiligten Rechtsträger ist, wenn sie binnen sechs Monaten nach dem Tag, an dem die Eintragung der Verschmelzung in das Register des Sitzes desjenigen Rechtsträgers, dessen Gläubiger sie sind, nach § 19 Abs. 3 UmwG als bekannt gemacht gilt, ihren Anspruch nach Grund und Höhe in Textform anmelden, Sicherheit zu leisten, soweit sie nicht Befriedigung verlangen können. Dieses Recht steht den Gläubigern jedoch nur zu, wenn sie glaubhaft machen, dass durch die Verschmelzung die Erfüllung ihrer Forderung gefährdet wird."
    },
    {
      "date": "2025-12-30",
      "id": "141151",
      "original_text": "Registerbekanntmachung nach dem Umwandlungsgesetz\nBayern Amtsgericht Hof HRB 6448\nErwin Schiller Holding GmbH – Hof",
      "type": "Registerbekanntmachung nach dem Umwandlungsgesetz",
      "state": "Bayern",
      "amtsgericht": "Amtsgericht Hof",
      "registernummer": "HRB 6448",
      "registerart": "HRB",
      "company_name": "Erwin Schiller Holding GmbH",
      "company_seat": "Hof",
      "details": "30.12.2025 (Bekanntmachungsdatum)\n\nBayern Amtsgericht Hof HRB 6448\nRegisterbekanntmachung nach dem Umwandlungsgesetz 29.12.2025 (Eintragungsdatum)\n\nErwin Schiller Holding GmbH\nGesellschaft mit beschränkter Haftung\nHof\n\nDen Gläubigern der an der Ausgliederung beteiligten Rechtsträger ist, wenn sie binnen sechs Monaten nach dem Tag, an dem die Eintragung der Ausgliederung in das Register des Sitzes desjenigen Rechtsträgers, dessen Gläubiger sie sind, nach §§ 125, 19 Abs. 3 UmwG als bekannt gemacht gilt, ihren Anspruch nach Grund und Höhe in Textform anmelden, Sicherheit zu leisten, soweit sie nicht Befriedigung verlangen können. Dieses Recht steht den Gläubigern jedoch nur zu, wenn sie glaubhaft machen, dass durch die Ausgliederung die Erfüllung ihrer Forderung gefährdet wird."
    },
    {
      "date": "2025-12-30",
      "id": "141152",
      "original_text": "Registerbekanntmachung nach dem Umwandlungsgesetz\nBayern Amtsgericht Kempten (Allgäu) HRB 13086\nDialyse Limbach GmbH – Füssen",
      "type": "Registerbekanntmachung nach dem Umwandlungsgesetz",
      "state": "Bayern",
      "amtsgericht": "Amtsgericht Kempten (Allgäu)",
      "registernummer": "HRB 13086",
      "registerart": "HRB",
      "company_name": "Dialyse Limbach GmbH",
      "company_seat": "Füssen",
      "details": "30.12.2025 (Bekanntmachungsdatum)\n\nBayern Amtsgericht Kempten (Allgäu) HRB 13086\nRegisterbekanntmachung nach dem Umwandlungsgesetz 28.12.2025 (Eintragungsdatum)\n\nDialyse Limbach GmbH\nGesellschaft mit beschränkter Haftung\nFüssen\n\nDen Gläubigern der an der Verschmelzung beteiligten Rechtsträger ist, wenn sie binnen sechs Monaten nach dem Tag, an dem die Eintragung der Verschmelzung in das Register des Sitzes desjenigen Rechtsträgers, dessen Gläubiger sie sind, nach § 19 Abs. 3 UmwG als bekannt gemacht gilt, ihren Anspruch nach Grund und Höhe in Textform anmelden, Sicherheit zu leisten, soweit sie nicht Befriedigung verlangen können. Dieses Recht steht den Gläubigern jedoch nur zu, wenn sie glaubhaft machen, dass durch die Verschmelzung die Erfüllung ihrer Forderung gefährdet wird."
    },
    {
      "date": "2025-12-30",
      "id": "141153",
      "original_text": "Löschungsankündigung\nBayern Amtsgericht Nürnberg HRB 27603\nAlpha LED Technik GmbH – Nürnberg",
      "type": "Löschungsankündigung",
      "state": "Bayern",
      "amtsgericht": "Amtsgericht Nürnberg",
      "registernummer": "HRB 27603",
      "registerart": "HRB",
      "company_name": "Alpha LED Technik GmbH",
      "company_seat": "Nürnberg",
      "details": "30.12.2025 (Bekanntmachungsdatum)\n\nBayern Amtsgericht Nürnberg HRB 27603\nLöschungsankündigung\n\nAlpha LED Technik GmbH\nGesellschaft mit beschränkter Haftung\nNürnberg\n\nDas Registergericht beabsichtigt, die im Handelsregister eingetragene Gesellschaft wegen Vermögenslosigkeit von Amts wegen nach § 394 FamFG zu löschen. Die Frist zur Erhebung eines Widerspruchs ist auf einen Monat festgesetzt."
    },
    {
      "date": "2025-12-30",
      "id": "141154",
      "original_text": "Registerbekanntmachung nach dem Umwandlungsgesetz\nBayern Amtsgericht München HRB 205565\nSCUR24 Holding GmbH – München",
      "type": "Registerbekanntmachung nach dem Umwandlungsgesetz",
      "state": "Bayern",
      "amtsgericht": "Amtsgericht München",
      "registernummer": "HRB 205565",
      "registerart": "HRB",
      "company_name": "SCUR24 Holding GmbH",
      "company_seat": "München",
      "details": "30.12.2025 (Bekanntmachungsdatum)\n\nBayern Amtsgericht München HRB 205565\nRegisterbekanntmachung nach dem Umwandlungsgesetz 29.12.2025 (Eintragungsdatum)\n\nSCUR24 Holding GmbH\nGesellschaft mit beschränkter Haftung\nMünchen\n\nDen Gläubigern der an der Verschmelzung beteiligten Rechtsträger ist, wenn sie binnen sechs Monaten nach dem Tag, an dem die Eintragung der Verschmelzung in das Register des Sitzes desjenigen Rechtsträgers, dessen Gläubiger sie sind, nach § 19 Abs. 3 UmwG als bekannt gemacht gilt, ihren Anspruch nach Grund und Höhe in Textform anmelden, Sicherheit zu leisten, soweit sie nicht Befriedigung verlangen können. Dieses Recht steht den Gläubigern jedoch nur zu, wenn sie glaubhaft machen, dass durch die Verschmelzung die Erfüllung ihrer Forderung gefährdet wird."
    },
    {
      "date": "2025-12-30",
      "id": "141155",
      "original_text": "Registerbekanntmachung nach dem Umwandlungsgesetz\nBayern Amtsgericht Nürnberg HRB 36109\nTriathlon Holding GmbH – Pyrbaum OT Seligenporten",
      "type": "Registerbekanntmachung nach dem Umwandlungsgesetz",
      "state": "Bayern",
      "amtsgericht": "Amtsgericht Nürnberg",
      "registernummer": "HRB 36109",
      "registerart": "HRB",
      "company_name": "Triathlon Holding GmbH",
      "company_seat": "Pyrbaum OT Seligenporten",
      "details": "30.12.2025 (Bekanntmachungsdatum)\n\nBayern Amtsgericht Nürnberg HRB 36109\nRegisterbekanntmachung nach dem Umwandlungsgesetz 29.12.2025 (Eintragungsdatum)\n\nTriathlon Holding GmbH\nGesellschaft mit beschränkter Haftung\nPyrbaum OT Seligenporten\n\nDen Gläubigern der an der Verschmelzung beteiligten Rechtsträger ist, wenn sie binnen sechs Monaten nach dem Tag, an dem die Eintragung der Verschmelzung in das Register des Sitzes desjenigen Rechtsträgers, dessen Gläubiger sie sind, nach § 19 Abs. 3 UmwG als bekannt gemacht gilt, ihren Anspruch nach Grund und Höhe in Textform anmelden, Sicherheit zu leisten, soweit sie nicht Befriedigung verlangen können. Dieses Recht steht den Gläubigern jedoch nur zu, wenn sie glaubhaft machen, dass durch die Verschmelzung die Erfüllung ihrer Forderung gefährdet wird."
    },
    {
      "date": "2025-12-30",
      "id": "141156",
      "original_text": "Einreichung neuer Dokumente\nBayern Amtsgericht Schweinfurt HRB 4491\nPreh GmbH – Bad Neustadt a.d.Saale",
      "type": "Einreichung neuer Dokumente",
      "state": "Bayern",
      "amtsgericht": "Amtsgericht Schweinfurt",
      "registernummer": "HRB 4491",
      "registerart": "HRB",
      "company_name": "Preh GmbH",
      "company_seat": "Bad Neustadt a.d.Saale",
      "details": "30.12.2025 (Bekanntmachungsdatum)\n\nBayern Amtsgericht Schweinfurt HRB 4491\nEinreichung neuer Dokumente 29.12.2025 (Eintragungsdatum)\n\nPreh GmbH\nGesellschaft mit beschränkter Haftung\nBad Neustadt a.d.Saale\n\nDem Amtsgericht Schweinfurt -Registergericht- ist eine Liste der Mitglieder des Aufsichtsrats eingereicht worden, § 52 Abs. 3 S. 2 GmbHG."
    },
    {
      "date": "2025-12-30",
      "id": "141157",
      "original_text": "Löschungsankündigung\nBayern Amtsgericht Traunstein HRB 34241\nHandelshaus Hôgmoar UG (haftungsbeschränkt) – Reit im Winkl",
      "type": "Löschungsankündigung",
      "state": "Bayern",
      "amtsgericht": "Amtsgericht Traunstein",
      "registernummer": "HRB 34241",
      "registerart": "HRB",
      "company_name": "Handelshaus Hôgmoar UG (haftungsbeschränkt)",
      "company_seat": "Reit im Winkl",
      "details": "30.12.2025 (Bekanntmachungsdatum)\n\nBayern Amtsgericht Traunstein HRB 34241\nLöschungsankündigung 29.12.2025 (Eintragungsdatum)\n\nHandelshaus Hôgmoar UG (haftungsbeschränkt)\nGesellschaft mit beschränkter Haftung\nReit im Winkl\n\nDas Registergericht beabsichtigt, die im Handelsregister eingetragene Gesellschaft wegen Vermögenslosigkeit von Amts wegen nach § 394 FamFG zu löschen. Die Frist zur Erhebung eines Widerspruchs ist auf einen Monat festgesetzt."
    },
    {
      "date": "2025-12-30",
      "id": "141158",
      "original_text": "Registerbekanntmachung nach dem Umwandlungsgesetz\nBayern Amtsgericht Schweinfurt HRB 7370\nWMZ Projektentwicklung GmbH – Sulzfeld",
      "type": "Registerbekanntmachung nach dem Umwandlungsgesetz",
      "state": "Bayern",
      "amtsgericht": "Amtsgericht Schweinfurt",
      "registernummer": "HRB 7370",
      "registerart": "HRB",
      "company_name": "WMZ Projektentwicklung GmbH",
      "company_seat": "Sulzfeld",
      "details": "30.12.2025 (Bekanntmachungsdatum)\n\nBayern Amtsgericht Schweinfurt HRB 7370\nRegisterbekanntmachung nach dem Umwandlungsgesetz 29.12.2025 (Eintragungsdatum)\n\nWMZ Projektentwicklung GmbH\nGesellschaft mit beschränkter Haftung\nSulzfeld\n\nDen Gläubigern der an der Verschmelzung beteiligten Rechtsträger ist, wenn sie binnen sechs Monaten nach dem Tag, an dem die Eintragung der Verschmelzung in das Register des Sitzes desjenigen Rechtsträgers, dessen Gläubiger sie sind, nach § 19 Abs. 3 UmwG als bekannt gemacht gilt, ihren Anspruch nach Grund und Höhe in Textform anmelden, Sicherheit zu leisten, soweit sie nicht Befriedigung verlangen können. Dieses Recht steht den Gläubigern jedoch nur zu, wenn sie glaubhaft machen, dass durch die Verschmelzung die Erfüllung ihrer Forderung gefährdet wird."
    },
    {
      "date": "2025-12-30",
      "id": "141159",
      "original_text": "Löschungsankündigung\nBayern Amtsgericht München HRB 245011\nMycarsgroup UG (haftungsbeschränkt) – Garmisch-Partenkirchen",
      "type": "Löschungsankündigung",
      "state": "Bayern",
      "amtsgericht": "Amtsgericht München",
      "registernummer": "HRB 245011",
      "registerart": "HRB",
      "company_name": "Mycarsgroup UG (haftungsbeschränkt)",
      "company_seat": "Garmisch-Partenkirchen",
      "details": "30.12.2025 (Bekanntmachungsdatum)\n\nBayern Amtsgericht München HRB 245011\nLöschungsankündigung 29.12.2025 (Eintragungsdatum)\n\nMycarsgroup UG (haftungsbeschränkt)\nGesellschaft mit beschränkter Haftung\nGarmisch-Partenkirchen\n\nDas Registergericht beabsichtigt, die im Handelsregister eingetragene Gesellschaft wegen Vermögenslosigkeit von Amts wegen nach § 394 FamFG zu löschen. Die Frist zur Erhebung eines Widerspruchs ist auf drei Monate festgesetzt."
    },
    {
      "date": "2025-12-30",
      "id": "141160",
      "original_text": "Registerbekanntmachung nach dem Umwandlungsgesetz\nBayern Amtsgericht Traunstein HRB 14025\nFS Grundstücksverwaltung GmbH – Bad Reichenhall",
      "type": "Registerbekanntmachung nach dem Umwandlungsgesetz",
      "state": "Bayern",
      "amtsgericht": "Amtsgericht Traunstein",
      "registernummer": "HRB 14025",
      "registerart": "HRB",
      "company_name": "FS Grundstücksverwaltung GmbH",
      "company_seat": "Bad Reichenhall",
      "details": "30.12.2025 (Bekanntmachungsdatum)\n\nBayern Amtsgericht Traunstein HRB 14025\nRegisterbekanntmachung nach dem Umwandlungsgesetz 30.12.2025 (Eintragungsdatum)\n\nFS Grundstücksverwaltung GmbH\nGesellschaft mit beschränkter Haftung\nBad Reichenhall\n\nDen Gläubigern der an der Verschmelzung beteiligten Rechtsträger ist, wenn sie binnen sechs Monaten nach dem Tag, an dem die Eintragung der Verschmelzung in das Register des Sitzes desjenigen Rechtsträgers, dessen Gläubiger sie sind, nach § 19 Abs. 3 UmwG als bekannt gemacht gilt, ihren Anspruch nach Grund und Höhe in Textform anmelden, Sicherheit zu leisten, soweit sie nicht Befriedigung verlangen können. Dieses Recht steht den Gläubigern jedoch nur zu, wenn sie glaubhaft machen, dass durch die Verschmelzung die Erfüllung ihrer Forderung gefährdet wird."
    },
    {
      "date": "2025-12-30",
      "id": "141161",
      "original_text": "Registerbekanntmachung nach dem Umwandlungsgesetz\nBayern Amtsgericht Deggendorf HRA 2612\nSüddeutsche Immobilien GmbH & Co. KG – Deggendorf",
      "type": "Registerbekanntmachung nach dem Umwandlungsgesetz",
      "state": "Bayern",
      "amtsgericht": "Amtsgericht Deggendorf",
      "registernummer": "HRA 2612",
      "registerart": "HRA",
      "company_name": "Süddeutsche Immobilien GmbH & Co. KG",
      "company_seat": "Deggendorf",
      "details": "30.12.2025 (Bekanntmachungsdatum)\n\nBayern Amtsgericht Deggendorf HRA 2612\nRegisterbekanntmachung nach dem Umwandlungsgesetz 29.12.2025 (Eintragungsdatum)\n\nSüddeutsche Immobilien GmbH & Co. KG\nKommanditgesellschaft\nDeggendorf\n\nDen Gläubigern der an der Verschmelzung beteiligten Rechtsträger ist, wenn sie binnen sechs Monaten nach dem Tag, an dem die Eintragung der Verschmelzung in das Register des Sitzes desjenigen Rechtsträgers, dessen Gläubiger sie sind, nach § 19 Abs. 3 UmwG als bekannt gemacht gilt, ihren Anspruch nach Grund und Höhe in Textform anmelden, Sicherheit zu leisten, soweit sie nicht Befriedigung verlangen können. Dieses Recht steht den Gläubigern jedoch nur zu, wenn sie glaubhaft machen, dass durch die Verschmelzung die Erfüllung ihrer Forderung gefährdet wird."
    },
    {
      "date": "2025-12-30",
      "id": "141162",
      "original_text": "Registerbekanntmachung nach dem Umwandlungsgesetz\nBayern Amtsgericht Traunstein HRB 34427\nFSP Immobilien GmbH – Bad Reichenhall",
      "type": "Registerbekanntmachung nach dem Umwandlungsgesetz",
      "state": "Bayern",
      "amtsgericht": "Amtsgericht Traunstein",
      "registernummer": "HRB 34427",
      "registerart": "HRB",
      "company_name": "FSP Immobilien GmbH",
      "company_seat": "Bad Reichenhall",
      "details": "30.12.2025 (Bekanntmachungsdatum)\n\nBayern Amtsgericht Traunstein HRB 34427\nRegisterbekanntmachung nach dem Umwandlungsgesetz 30.12.2025 (Eintragungsdatum)\n\nFSP Immobilien GmbH\nGesellschaft mit beschränkter Haftung\nBad Reichenhall\n\nDen Gläubigern der an der Verschmelzung beteiligten Rechtsträger ist, wenn sie binnen sechs Monaten nach dem Tag, an dem die Eintragung der Verschmelzung in das Register des Sitzes desjenigen Rechtsträgers, dessen Gläubiger sie sind, nach § 19 Abs. 3 UmwG als bekannt gemacht gilt, ihren Anspruch nach Grund und Höhe in Textform anmelden, Sicherheit zu leisten, soweit sie nicht Befriedigung verlangen können. Dieses Recht steht den Gläubigern jedoch nur zu, wenn sie glaubhaft machen, dass durch die Verschmelzung die Erfüllung ihrer Forderung gefährdet wird."
    },
    {
      "date": "2025-12-30",
      "id": "141163",
      "original_text": "Löschungsankündigung\nBayern Amtsgericht Nürnberg HRB 26731\nH + P Datenintegration GmbH – Nürnberg",
      "type": "Löschungsankündigung",
      "state": "Bayern",
      "amtsgericht": "Amtsgericht Nürnberg",
      "registernummer": "HRB 26731",
      "registerart": "HRB",
      "company_name": "H + P Datenintegration GmbH",
      "company_seat": "Nürnberg",
      "details": "30.12.2025 (Bekanntmachungsdatum)\n\nBayern Amtsgericht Nürnberg HRB 26731\nLöschungsankündigung\n\nH + P Datenintegration GmbH\nGesellschaft mit beschränkter Haftung\nNürnberg\n\nDas Registergericht beabsichtigt, die im Handelsregister eingetragene Gesellschaft wegen Vermögenslosigkeit von Amts wegen nach § 394 FamFG zu löschen. Die Frist zur Erhebung eines Widerspruchs ist auf einen Monat festgesetzt."
    },
    {
      "date": "2025-12-30",
      "id": "141164",
      "original_text": "Registerbekanntmachung nach dem Umwandlungsgesetz\nBayern Amtsgericht Augsburg HRB 40900\nLechfeld Consulting UG (haftungsbeschränkt) – 86836 Obermeitingen",
      "type": "Registerbekanntmachung nach dem Umwandlungsgesetz",
      "state": "Bayern",
      "amtsgericht": "Amtsgericht Augsburg",
      "registernummer": "HRB 40900",
      "registerart": "HRB",
      "company_name": "Lechfeld Consulting UG (haftungsbeschränkt)",
      "company_seat": "86836 Obermeitingen",
      "details": "30.12.2025 (Bekanntmachungsdatum)\n\nBayern Amtsgericht Augsburg HRB 40900\nRegisterbekanntmachung nach dem Umwandlungsgesetz 29.12.2025 (Eintragungsdatum)\n\nLechfeld Consulting UG (haftungsbeschränkt)\nGesellschaft mit beschränkter Haftung\n86836 Obermeitingen\n\nDen Gläubigern der an der Verschmelzung beteiligten Rechtsträger ist, wenn sie binnen sechs Monaten nach dem Tag, an dem die Eintragung der Verschmelzung in das Register des Sitzes desjenigen Rechtsträgers, dessen Gläubiger sie sind, nach § 19 Abs. 3 UmwG als bekannt gemacht gilt, ihren Anspruch nach Grund und Höhe in Textform anmelden, Sicherheit zu leisten, soweit sie nicht Befriedigung verlangen können. Dieses Recht steht den Gläubigern jedoch nur zu, wenn sie glaubhaft machen, dass durch die Verschmelzung die Erfüllung ihrer Forderung gefährdet wird."
    },
    {
      "date": "2025-12-30",
      "id": "141165",
      "original_text": "Registerbekanntmachung nach dem Umwandlungsgesetz\nBayern Amtsgericht München HRB 282871\nEuro Racing GmbH – München",
      "type": "Registerbekanntmachung nach dem Umwandlungsgesetz",
      "state": "Bayern",
      "amtsgericht": "Amtsgericht München",
      "registernummer": "HRB 282871",
      "registerart": "HRB",
      "company_name": "Euro Racing GmbH",
      "company_seat": "München",
      "details": "30.12.2025 (Bekanntmachungsdatum)\n\nBayern Amtsgericht München HRB 282871\nRegisterbekanntmachung nach dem Umwandlungsgesetz 29.12.2025 (Eintragungsdatum)\n\nEuro Racing GmbH\nGesellschaft mit beschränkter Haftung\nMünchen\n\nDen Gläubigern der an der Verschmelzung beteiligten Rechtsträger ist, wenn sie binnen sechs Monaten nach dem Tag, an dem die Eintragung der Verschmelzung in das Register des Sitzes desjenigen Rechtsträgers, dessen Gläubiger sie sind, nach § 19 Abs. 3 UmwG als bekannt gemacht gilt, ihren Anspruch nach Grund und Höhe in Textform anmelden, Sicherheit zu leisten, soweit sie nicht Befriedigung verlangen können. Dieses Recht steht den Gläubigern jedoch nur zu, wenn sie glaubhaft machen, dass durch die Verschmelzung die Erfüllung ihrer Forderung gefährdet wird."
    },
    {
      "date": "2025-12-30",
      "id": "141166",
      "original_text": "Registerbekanntmachung nach dem Umwandlungsgesetz\nBayern Amtsgericht Hof HRB 7252\nS89 Anlagen GmbH – Hof",
      "type": "Registerbekanntmachung nach dem Umwandlungsgesetz",
      "state": "Bayern",
      "amtsgericht": "Amtsgericht Hof",
      "registernummer": "HRB 7252",
      "registerart": "HRB",
      "company_name": "S89 Anlagen GmbH",
      "company_seat": "Hof",
      "details": "30.12.2025 (Bekanntmachungsdatum)\n\nBayern Amtsgericht Hof HRB 7252\nRegisterbekanntmachung nach dem Umwandlungsgesetz 29.12.2025 (Eintragungsdatum)\n\nS89 Anlagen GmbH\nGesellschaft mit beschränkter Haftung\nHof\n\nDen Gläubigern der an der Ausgliederung beteiligten Rechtsträger ist, wenn sie binnen sechs Monaten nach dem Tag, an dem die Eintragung der Ausgliederung in das Register des Sitzes desjenigen Rechtsträgers, dessen Gläubiger sie sind, nach §§ 125, 19 Abs. 3 UmwG als bekannt gemacht gilt, ihren Anspruch nach Grund und Höhe in Textform anmelden, Sicherheit zu leisten, soweit sie nicht Befriedigung verlangen können. Dieses Recht steht den Gläubigern jedoch nur zu, wenn sie glaubhaft machen, dass durch die Ausgliederung die Erfüllung ihrer Forderung gefährdet wird."
    },
    {
      "date": "2025-12-30",
      "id": "141167",
      "original_text": "Registerbekanntmachung nach dem Umwandlungsgesetz\nBayern Amtsgericht Deggendorf HRB 4915\nRSD Grundstücks GmbH – Deggendorf",
      "type": "Registerbekanntmachung nach dem Umwandlungsgesetz",
      "state": "Bayern",
      "amtsgericht": "Amtsgericht Deggendorf",
      "registernummer": "HRB 4915",
      "registerart": "HRB",
      "company_name": "RSD Grundstücks GmbH",
      "company_seat": "Deggendorf",
      "details": "30.12.2025 (Bekanntmachungsdatum)\n\nBayern Amtsgericht Deggendorf HRB 4915\nRegisterbekanntmachung nach dem Umwandlungsgesetz 29.12.2025 (Eintragungsdatum)\n\nRSD Grundstücks GmbH\nGesellschaft mit beschränkter Haftung\nDeggendorf\n\nDen Gläubigern der an der Verschmelzung beteiligten Rechtsträger ist, wenn sie binnen sechs Monaten nach dem Tag, an dem die Eintragung der Verschmelzung in das Register des Sitzes desjenigen Rechtsträgers, dessen Gläubiger sie sind, nach § 19 Abs. 3 UmwG als bekannt gemacht gilt, ihren Anspruch nach Grund und Höhe in Textform anmelden, Sicherheit zu leisten, soweit sie nicht Befriedigung verlangen können. Dieses Recht steht den Gläubigern jedoch nur zu, wenn sie glaubhaft machen, dass durch die Verschmelzung die Erfüllung ihrer Forderung gefährdet wird."
    },
    {
      "date": "2025-12-30",
      "id": "141168",
      "original_text": "Löschungsankündigung\nBayern Amtsgericht Bayreuth HRB 7881\nBongual GmbH – Bayreuth",
      "type": "Löschungsankündigung",
      "state": "Bayern",
      "amtsgericht": "Amtsgericht Bayreuth",
      "registernummer": "HRB 7881",
      "registerart": "HRB",
      "company_name": "Bongual GmbH",
      "company_seat": "Bayreuth",
      "details": "30.12.2025 (Bekanntmachungsdatum)\n\nBayern Amtsgericht Bayreuth HRB 7881\nLöschungsankündigung\n\nBongual GmbH\nGesellschaft mit beschränkter Haftung\nBayreuth\n\nDas Registergericht beabsichtigt, die im Handelsregister eingetragene Gesellschaft wegen Vermögenslosigkeit von Amts wegen nach § 394 FamFG zu löschen. Die Frist zur Erhebung eines Widerspruchs ist auf drei Monate festgesetzt."
    },
    {
      "date": "2025-12-30",
      "id": "141169",
      "original_text": "Löschungsankündigung\nBaden-Württemberg Amtsgericht Mannheim HRB 250861\nAMA Adress- und Zeitschriftenverlag GmbH – Waghäusel",
      "type": "Löschungsankündigung",
      "state": "Baden-Württemberg",
      "amtsgericht": "Amtsgericht Mannheim",
      "registernummer": "HRB 250861",
      "registerart": "HRB",
      "company_name": "AMA Adress- und Zeitschriftenverlag GmbH",
      "company_seat": "Waghäusel",
      "details": "30.12.2025 (Bekanntmachungsdatum)\n\nBaden-Württemberg Amtsgericht Mannheim HRB 250861\nLöschungsankündigung\n\nAMA Adress- und Zeitschriftenverlag GmbH\nGesellschaft mit beschränkter Haftung\nWaghäusel\n\nAls nicht eingetragen wird bekanntgemacht:\nDas Gericht beabsichtigt, die Gesellschaft wegen Vermögenslosigkeit im Handelsregister von Amts wegen nach § 394 FamFG zu löschen. Die Frist zur Geltendmachung eines Widerspruchs gegen die beabsichtigte Löschung ist auf einen Monat ab Veröffentlichung bestimmt."
    },
    {
      "date": "2025-12-30",
      "id": "141170",
      "original_text": "Registerbekanntmachung nach dem Umwandlungsgesetz\nBaden-Württemberg Amtsgericht Ulm HRB 725614\nRKU - Universitäts- und Rehabilitationskliniken Ulm Gemeinnützige Gesellschaft mit beschränkter Haftung – Ulm",
      "type": "Registerbekanntmachung nach dem Umwandlungsgesetz",
      "state": "Baden-Württemberg",
      "amtsgericht": "Amtsgericht Ulm",
      "registernummer": "HRB 725614",
      "registerart": "HRB",
      "company_name": "RKU - Universitäts- und Rehabilitationskliniken Ulm Gemeinnützige Gesellschaft mit beschränkter Haftung",
      "company_seat": "Ulm",
      "details": "30.12.2025 (Bekanntmachungsdatum)\n\nBaden-Württemberg Amtsgericht Ulm HRB 725614\nRegisterbekanntmachung nach dem Umwandlungsgesetz 30.12.2025 (Eintragungsdatum)\n\nRKU - Universitäts- und Rehabilitationskliniken Ulm Gemeinnützige Gesellschaft mit beschränkter Haftung\nGesellschaft mit beschränkter Haftung\nUlm\n\nAls nicht eingetragen wird bekanntgemacht:\nDen Gläubigern der an der Vermögensübertragung beteiligten Rechtsträger ist, wenn sie binnen sechs Monaten nach dem Tag, an dem die Eintragung der Vermögensübertragung in das Register des Sitzes desjenigen Rechtsträgers, dessen Gläubiger sie sind, nach § 19 Abs. 3 UmwG als bekanntgemacht gilt, ihren Anspruch nach Grund und Höhe schriftlich anmelden, Sicherheit zu leisten, soweit sie nicht Befriedigung verlangen können. Dieses Recht steht den Gläubigern jedoch nur zu, wenn sie glaubhaft machen, dass durch die Vermögensübertragung die Erfüllung ihrer Forderung gefährdet wird."
    },
    {
      "date": "2025-12-30",
      "id": "141171",
      "original_text": "Löschungsankündigung\nBrandenburg Amtsgericht Potsdam HRB 38160\nFlorian Dressler UG (haftungsbeschränkt) – Teltow",
      "type": "Löschungsankündigung",
      "state": "Brandenburg",
      "amtsgericht": "Amtsgericht Potsdam",
      "registernummer": "HRB 38160",
      "registerart": "HRB",
      "company_name": "Florian Dressler UG (haftungsbeschränkt)",
      "company_seat": "Teltow",
      "details": "30.12.2025 (Bekanntmachungsdatum)\n\nBrandenburg Amtsgericht Potsdam HRB 38160\nLöschungsankündigung\n\nFlorian Dressler UG (haftungsbeschränkt)\nGesellschaft mit beschränkter Haftung\nTeltow\n\nBei der nachstehenden Gesellschaft wird das Amtslöschungsverfahren gemäß § 394 FamFG eingeleitet. Widerspruchsfrist: 8 Wochen."
    },
    {
      "date": "2025-12-30",
      "id": "141172",
      "original_text": "Löschungsankündigung\nBerlin Amtsgericht Berlin (Charlottenburg) HRB 138810\nKekic Ambiente GmbH – Berlin",
      "type": "Löschungsankündigung",
      "state": "Berlin",
      "amtsgericht": "Amtsgericht Berlin (Charlottenburg)",
      "registernummer": "HRB 138810",
      "registerart": "HRB",
      "company_name": "Kekic Ambiente GmbH",
      "company_seat": "Berlin",
      "details": "30.12.2025 (Bekanntmachungsdatum)\n\nBerlin Amtsgericht Berlin (Charlottenburg) HRB 138810\nLöschungsankündigung\n\nKekic Ambiente GmbH\nGesellschaft mit beschränkter Haftung\nBerlin\n\nBei der nachstehenden Gesellschaft wird das Amtslöschungsverfahren gemäß § 394 FamFG eingeleitet. Widerspruchsfrist 6 Wochen"
    },
    {
      "date": "2025-12-30",
      "id": "141173",
      "original_text": "Sonstige Registerbekanntmachung\nBerlin Amtsgericht Berlin (Charlottenburg) HRB 246794\naifinyo AG – Berlin",
      "type": "Sonstige Registerbekanntmachung",
      "state": "Berlin",
      "amtsgericht": "Amtsgericht Berlin (Charlottenburg)",
      "registernummer": "HRB 246794",
      "registerart": "HRB",
      "company_name": "aifinyo AG",
      "company_seat": "Berlin",
      "details": "30.12.2025 (Bekanntmachungsdatum)\n\nBerlin Amtsgericht Berlin (Charlottenburg) HRB 246794\nSonstige Registerbekanntmachung\n\naifinyo AG\nAktiengesellschaft\nBerlin\n\nAls nicht eingetragen wird veröffentlicht: Der Vorstand der Gesellschaft hat durch Beschluss vom 11.09.2025 eine Wandelschuldverschreibung im Nennbetrag von 1.480.000 mit Laufzeit bis zum 07.08.2030 ausgegeben und am 19.12.2025 eine entsprechende Erklärung abgegeben."
    },
    {
      "date": "2025-12-30",
      "id": "141174",
      "original_text": "Löschungsankündigung\nBerlin Amtsgericht Berlin (Charlottenburg) HRB 200997\nSZP Service GmbH – Berlin",
      "type": "Löschungsankündigung",
      "state": "Berlin",
      "amtsgericht": "Amtsgericht Berlin (Charlottenburg)",
      "registernummer": "HRB 200997",
      "registerart": "HRB",
      "company_name": "SZP Service GmbH",
      "company_seat": "Berlin",
      "details": "30.12.2025 (Bekanntmachungsdatum)\n\nBerlin Amtsgericht Berlin (Charlottenburg) HRB 200997\nLöschungsankündigung\n\nSZP Service GmbH\nGesellschaft mit beschränkter Haftung\nBerlin\n\nBei der nachstehenden Gesellschaft wird das Amtslöschungsverfahren gemäß § 394 FamFG eingeleitet. Widerspruchsfrist 6 Wochen"
    },
    {
      "date": "2025-12-30",
      "id": "141175",
      "original_text": "Löschungsankündigung\nBaden-Württemberg Amtsgericht Mannheim HRB 745061\nSchnelltest Seider & Arango GmbH – Durmersheim",
      "type": "Löschungsankündigung",
      "state": "Baden-Württemberg",
      "amtsgericht": "Amtsgericht Mannheim",
      "registernummer": "HRB 745061",
      "registerart": "HRB",
      "company_name": "Schnelltest Seider & Arango GmbH",
      "company_seat": "Durmersheim",
      "details": "30.12.2025 (Bekanntmachungsdatum)\n\nBaden-Württemberg Amtsgericht Mannheim HRB 745061\nLöschungsankündigung\n\nSchnelltest Seider & Arango GmbH\nGesellschaft mit beschränkter Haftung\nDurmersheim\n\nDas Gericht beabsichtigt, die die am 29.09.2022 vorgenommene Eintragung der Bestellung von Herrn Manuel-Andres Arango Roa als Geschäftsführer der Gesellschaft gemäß § 395 FamFG von Amts wegen im Handelsregister wegen des Mangels einer wesentlichen Voraussetzung zu löschen. Die Frist zur Geltendmachung eines Widerspruchs gegen die beabsichtigte Löschung ist auf einen Monat ab Veröffentlichung bestimmt."
    },
    {
      "date": "2025-12-30",
      "id": "141176",
      "original_text": "Löschungsankündigung\nBerlin Amtsgericht Berlin (Charlottenburg) HRB 147441\nPerlinski Edelmetalle GmbH – Berlin",
      "type": "Löschungsankündigung",
      "state": "Berlin",
      "amtsgericht": "Amtsgericht Berlin (Charlottenburg)",
      "registernummer": "HRB 147441",
      "registerart": "HRB",
      "company_name": "Perlinski Edelmetalle GmbH",
      "company_seat": "Berlin",
      "details": "30.12.2025 (Bekanntmachungsdatum)\n\nBerlin Amtsgericht Berlin (Charlottenburg) HRB 147441\nLöschungsankündigung\n\nPerlinski Edelmetalle GmbH\nGesellschaft mit beschränkter Haftung\nBerlin\n\nBei der nachstehenden Gesellschaft wird das Amtslöschungsverfahren gemäß § 394 FamFG eingeleitet. Widerspruchsfrist 6 Wochen"
    },
    {
      "date": "2025-12-30",
      "id": "141177",
      "original_text": "Löschungsankündigung\nBaden-Württemberg Amtsgericht Freiburg HRB 726027\nMD Renovierung UG (haftungsbeschränkt) – Kehl",
      "type": "Löschungsankündigung",
      "state": "Baden-Württemberg",
      "amtsgericht": "Amtsgericht Freiburg",
      "registernummer": "HRB 726027",
      "registerart": "HRB",
      "company_name": "MD Renovierung UG (haftungsbeschränkt)",
      "company_seat": "Kehl",
      "details": "30.12.2025 (Bekanntmachungsdatum)\n\nBaden-Württemberg Amtsgericht Freiburg HRB 726027\nLöschungsankündigung\n\nMD Renovierung UG (haftungsbeschränkt)\nGesellschaft mit beschränkter Haftung\nKehl\n\nDas Gericht beabsichtigt, die Gesellschaft wegen Vermögenslosigkeit im Handelsregister von Amts wegen nach § 394 FamFG zu löschen. Die Frist zur Geltendmachung eines Widerspruchs gegen die beabsichtigte Löschung ist auf einen Monat ab Veröffentlichung bestimmt."
    },
    {
      "date": "2025-12-30",
      "id": "141178",
      "original_text": "Löschungsankündigung\nSaarland Amtsgericht Saarbrücken HRB 26069\nSITUS Umwelt- und Sicherheits- GmbH – Bous",
      "type": "Löschungsankündigung",
      "state": "Saarland",
      "amtsgericht": "Amtsgericht Saarbrücken",
      "registernummer": "HRB 26069",
      "registerart": "HRB",
      "company_name": "SITUS Umwelt- und Sicherheits- GmbH",
      "company_seat": "Bous",
      "details": "30.12.2025 (Bekanntmachungsdatum)\n\nSaarland Amtsgericht Saarbrücken HRB 26069\nLöschungsankündigung\n\nSITUS Umwelt- und Sicherheits- GmbH\nGesellschaft mit beschränkter Haftung\nBous\n\nEs ist beabsichtigt, die Gesellschaft von Amts wegen gemäß § 394 FamFG wegen Vermögenslosigkeit zu löschen.\nGegen die Löschung von Amts wegen ist das Rechtsmittel des Widerspruchs statthaft. Der Widerspruch ist binnen einer Frist drei Monaten beginnend mit dem Tag dieser Veröffentlichung durch Einreichen eines Widerspruchsschreibens -schriftlich oder zur Niederschrift der Geschäftsstelle beim Amtsgericht Saarbrücken, -zentrales Handelsregister-, Mainzerstr.178, 66121 Saarbrücken einzulegen.\nDer Widerspruch muss die Bezeichnung der angefochtenen Löschungsankündigung enthalten sowie die Erklärung, dass Widerspruch eingelegt wird. Er ist vom Widerspruchsführer oder seinem Bevollmächtigten zu unterzeichnen.\nDas Widerspruchsschreiben kann auch in der Form eines elektronischen Dokumentes eingereicht werden, das mit einer qualifizierten elektronischen Signatur nach dem Signaturgesetz versehen sein muss (§§ 14 Abs. 2 FamFG, 130a, 298 ZPO)."
    },
    {
      "date": "2025-12-30",
      "id": "141179",
      "original_text": "Einreichung neuer Dokumente\nBerlin Amtsgericht Berlin (Charlottenburg) HRB 181408\nWustermarker Str. 38/39 Objekt GmbH – Berlin",
      "type": "Einreichung neuer Dokumente",
      "state": "Berlin",
      "amtsgericht": "Amtsgericht Berlin (Charlottenburg)",
      "registernummer": "HRB 181408",
      "registerart": "HRB",
      "company_name": "Wustermarker Str. 38/39 Objekt GmbH",
      "company_seat": "Berlin",
      "details": "30.12.2025 (Bekanntmachungsdatum)\n\nBerlin Amtsgericht Berlin (Charlottenburg) HRB 181408\nEinreichung neuer Dokumente\n\nWustermarker Str. 38/39 Objekt GmbH\nGesellschaft mit beschränkter Haftung\nBerlin\n\nAls nicht eingetragen wird veröffentlicht: 1.\nDie Gesellschaft hat den Entwurf eines Formwechselplans vom 15.12.2025 betreffend ihren grenzüberschreitenden Formwechsel nach Luxemburg, Luxemburg, zum Handelsregister eingereicht.\n\n2.\nDie an dem Formwechsel beteiligte Gesellschaft ist die „Wustermarker Str. 38/39 Objekt GmbH“ mit Sitz in Berlin, Deutschland. Durch den Formwechsel soll sie die Rechtsform einer Societé à responsabilité limitée (S.à r.l.) luxemburgischen Rechts erhalten und unter „Wustermarker Str. 38/39 Objekt S.à r.l.“ firmieren.\n3.\nDie formwechselnde Gesellschaft ist eingetragen im Handelsregister des Amtsgerichts Charlottenburg mit der Nummer HRB 181408 B und ist bereits eingetragen im Handels- und\nGesellschaftsregister von Luxemburg (Registre de commerce et des sociétés\nLuxembourg) unter der Nummer B228413. In Luxemburg soll sie im genannten luxemburgischen Gesellschaftsregister unter der genannten Nummer eingetragen bleiben.\n\n4.\nEs ergeht Hinweis an folgende Personen, dass sie der Gesellschaft spätestens fünf Arbeitstage vor dem Tag der Gesellschafterversammlung der Gesellschaft, die über die Zustimmung zum Formwechselplan entscheidet, Bemerkungen zum Formwechselplan übermitteln können:\n\na) die Anteilsinhaber und Gläubiger der an dem grenzüberschreitenden Formwechsel beteiligten Gesellschaft sowie\n\nb) die zuständigen Betriebsräte der an dem grenzüberschreitenden Formwechsel beteiligten\nGesellschaft oder, soweit es keinen Betriebsrat gibt, die Arbeitnehmer der an dem\ngrenzüberschreitenden Formwechsel beteiligten Gesellschaft.\n\nDie Gesellschafterversammlung darf erst einen Monat nach der Bekanntmachung des Formwechselplans über ihre Zustimmung zu dem Formwechselplan beschließen. Die Gesellschafterversammlung ist für den Tag geplant, der auf den Ablauf eines Monats nach dem Tag der Bekanntmachung des Formwechselplans folgt, ggfs. für den nächsten Arbeitstag (wobei Samstage, Sonntage und bundesweite Feiertage nicht als Arbeitstage zählen.\n\nDie Gesellschaft hat mitgeteilt, dass sie keine Arbeitnehmer und keinen Betriebsrat hat.“"
    },
    {
      "date": "2025-12-30",
      "id": "141180",
      "original_text": "Löschungsankündigung\nBerlin Amtsgericht Berlin (Charlottenburg) HRB 103344\nW & B KFZ-Service und Selbsthilfewerkstatt GmbH – Berlin",
      "type": "Löschungsankündigung",
      "state": "Berlin",
      "amtsgericht": "Amtsgericht Berlin (Charlottenburg)",
      "registernummer": "HRB 103344",
      "registerart": "HRB",
      "company_name": "W & B KFZ-Service und Selbsthilfewerkstatt GmbH",
      "company_seat": "Berlin",
      "details": "30.12.2025 (Bekanntmachungsdatum)\n\nBerlin Amtsgericht Berlin (Charlottenburg) HRB 103344\nLöschungsankündigung\n\nW & B KFZ-Service und Selbsthilfewerkstatt GmbH\nGesellschaft mit beschränkter Haftung\nBerlin\n\nBei der nachstehenden Gesellschaft wird das Amtslöschungsverfahren gemäß § 394 FamFG eingeleitet. Widerspruchsfrist 6 Wochen"
    },
    {
      "date": "2025-12-30",
      "id": "141181",
      "original_text": "Registerbekanntmachung nach dem Umwandlungsgesetz\nBerlin Amtsgericht Berlin (Charlottenburg) HRB 271792\nNico Scheinert Holding GmbH – Berlin",
      "type": "Registerbekanntmachung nach dem Umwandlungsgesetz",
      "state": "Berlin",
      "amtsgericht": "Amtsgericht Berlin (Charlottenburg)",
      "registernummer": "HRB 271792",
      "registerart": "HRB",
      "company_name": "Nico Scheinert Holding GmbH",
      "company_seat": "Berlin",
      "details": "30.12.2025 (Bekanntmachungsdatum)\n\nBerlin Amtsgericht Berlin (Charlottenburg) HRB 271792\nRegisterbekanntmachung nach dem Umwandlungsgesetz 29.12.2025 (Eintragungsdatum)\n\nNico Scheinert Holding GmbH\nGesellschaft mit beschränkter Haftung\nBerlin\n\nZu Eintragungsnummer 2 vom 29.12.2025 wird als nicht eingetragen veröffentlicht: Den Gläubigern der an der Verschmelzung beteiligten Rechtsträger ist, wenn sie binnen sechs Monaten nach dem Tag, an dem die Eintragung der Verschmelzung in das Register des Sitzes desjenigen Rechtsträgers, dessen Gläubiger sie sind, als bekannt gemacht gilt, ihren Anspruch nach Grund und Höhe schriftlich anmelden, Sicherheit zu leisten, soweit sie nicht Befriedigung verlangen können. Dieses Recht steht den Gläubigern jedoch nur zu, wenn sie glaubhaft machen, dass durch die Verschmelzung die Erfüllung ihrer Forderung gefährdet wird. Das Recht, Sicherheitsleistung zu verlangen, steht Gläubigern nicht zu, die im Falle der Insolvenz ein Recht auf vorzugsweise Befriedigung aus einer Deckungsmasse haben, die nach gesetzlicher Vorschrift zu ihrem Schutz errichtet und staatlich überwacht ist."
    },
    {
      "date": "2025-12-30",
      "id": "141182",
      "original_text": "Löschungsankündigung\nBerlin Amtsgericht Berlin (Charlottenburg) HRB 111782\nARCADIA Bauausführungs GmbH – Berlin",
      "type": "Löschungsankündigung",
      "state": "Berlin",
      "amtsgericht": "Amtsgericht Berlin (Charlottenburg)",
      "registernummer": "HRB 111782",
      "registerart": "HRB",
      "company_name": "ARCADIA Bauausführungs GmbH",
      "company_seat": "Berlin",
      "details": "30.12.2025 (Bekanntmachungsdatum)\n\nBerlin Amtsgericht Berlin (Charlottenburg) HRB 111782\nLöschungsankündigung\n\nARCADIA Bauausführungs GmbH\nGesellschaft mit beschränkter Haftung\nBerlin\n\nBei der nachstehenden Gesellschaft wird das Amtslöschungsverfahren gemäß § 394 FamFG eingeleitet. Widerspruchsfrist 6 Wochen"
    },
    {
      "date": "2025-12-30",
      "id": "141183",
      "original_text": "Registerbekanntmachung nach dem Umwandlungsgesetz\nHamburg Amtsgericht Hamburg HRB 154579\nUNITANK Beteiligungs GmbH – Hamburg",
      "type": "Registerbekanntmachung nach dem Umwandlungsgesetz",
      "state": "Hamburg",
      "amtsgericht": "Amtsgericht Hamburg",
      "registernummer": "HRB 154579",
      "registerart": "HRB",
      "company_name": "UNITANK Beteiligungs GmbH",
      "company_seat": "Hamburg",
      "details": "30.12.2025 (Bekanntmachungsdatum)\n\nHamburg Amtsgericht Hamburg HRB 154579\nRegisterbekanntmachung nach dem Umwandlungsgesetz 18.12.2025 (Eintragungsdatum)\n\nUNITANK Beteiligungs GmbH\nGesellschaft mit beschränkter Haftung\nHamburg\n\nAls nicht eingetragen wird bekannt gemacht:\nDen Gläubigern der an der Verschmelzung beteiligten Gesellschaften ist, wenn sie binnen zwei Monaten nach dem Tag, an dem der gemeinsame Verschmelzungsplan bekannt gemacht worden ist, ihren Anspruch nach Grund und Höhe schriftlich anmelden, Sicherheit zu leisten, soweit sie nicht Befriedigung verlangen können. Dieses Recht steht den Gläubigern jedoch nur zu, wenn sie glaubhaft machen, dass durch die Verschmelzung die Erfüllung ihrer Forderung gefährdet wird, und nur in Hinblick auf solche Forderungen, die vor oder bis zu 15 Tagen nach Bekanntmachung des Verschmelzungsplans entstanden sind."
    },
    {
      "date": "2025-12-30",
      "id": "141184",
      "original_text": "Registerbekanntmachung nach dem Umwandlungsgesetz\nBerlin Amtsgericht Berlin (Charlottenburg) HRB 271860\nKonstantin Gufler Vermögensverwaltungs GmbH – Berlin",
      "type": "Registerbekanntmachung nach dem Umwandlungsgesetz",
      "state": "Berlin",
      "amtsgericht": "Amtsgericht Berlin (Charlottenburg)",
      "registernummer": "HRB 271860",
      "registerart": "HRB",
      "company_name": "Konstantin Gufler Vermögensverwaltungs GmbH",
      "company_seat": "Berlin",
      "details": "30.12.2025 (Bekanntmachungsdatum)\n\nBerlin Amtsgericht Berlin (Charlottenburg) HRB 271860\nRegisterbekanntmachung nach dem Umwandlungsgesetz 29.12.2025 (Eintragungsdatum)\n\nKonstantin Gufler Vermögensverwaltungs GmbH\nGesellschaft mit beschränkter Haftung\nBerlin\n\nZu Eintragungsnummer 3 vom 29.12.2025 wird als nicht eingetragen veröffentlicht: Den Gläubigern der an der Verschmelzung beteiligten Rechtsträger ist, wenn sie binnen sechs Monaten nach dem Tag, an dem die Eintragung der Verschmelzung in das Register des Sitzes desjenigen Rechtsträgers, dessen Gläubiger sie sind, als bekannt gemacht gilt, ihren Anspruch nach Grund und Höhe schriftlich anmelden, Sicherheit zu leisten, soweit sie nicht Befriedigung verlangen können. Dieses Recht steht den Gläubigern jedoch nur zu, wenn sie glaubhaft machen, dass durch die Verschmelzung die Erfüllung ihrer Forderung gefährdet wird. Das Recht, Sicherheitsleistung zu verlangen, steht Gläubigern nicht zu, die im Falle der Insolvenz ein Recht auf vorzugsweise Befriedigung aus einer Deckungsmasse haben, die nach gesetzlicher Vorschrift zu ihrem Schutz errichtet und staatlich überwacht ist."
    },
    {
      "date": "2025-12-30",
      "id": "141185",
      "original_text": "Registerbekanntmachung nach dem Umwandlungsgesetz\nBerlin Amtsgericht Berlin (Charlottenburg) HRB 232944\nGercomm 2 Holding GmbH – Berlin",
      "type": "Registerbekanntmachung nach dem Umwandlungsgesetz",
      "state": "Berlin",
      "amtsgericht": "Amtsgericht Berlin (Charlottenburg)",
      "registernummer": "HRB 232944",
      "registerart": "HRB",
      "company_name": "Gercomm 2 Holding GmbH",
      "company_seat": "Berlin",
      "details": "30.12.2025 (Bekanntmachungsdatum)\n\nBerlin Amtsgericht Berlin (Charlottenburg) HRB 232944\nRegisterbekanntmachung nach dem Umwandlungsgesetz 29.12.2025 (Eintragungsdatum)\n\nGercomm 2 Holding GmbH\nGesellschaft mit beschränkter Haftung\nBerlin\n\nZu Eintragungsnummer 5 vom 29.12.2025 wird als nicht eingetragen veröffentlicht:\n\nDen Gläubigern der an der Verschmelzung beteiligten Rechtsträger ist, wenn sie binnen sechs Monaten nach dem Tag, an dem die Eintragung der Verschmelzung in das Register des Sitzes desjenigen Rechtsträgers, dessen Gläubiger sie sind, als bekannt gemacht gilt, ihren Anspruch nach Grund und Höhe schriftlich anmelden, Sicherheit zu leisten, soweit sie nicht Befriedigung verlangen können. Dieses Recht steht den Gläubigern jedoch nur zu, wenn sie glaubhaft machen, dass durch die Verschmelzung die Erfüllung ihrer Forderung gefährdet wird. Das Recht, Sicherheitsleistung zu verlangen, steht Gläubigern nicht zu, die im Falle der Insolvenz ein Recht auf vorzugsweise Befriedigung aus einer Deckungsmasse haben, die nach gesetzlicher Vorschrift zu ihrem Schutz errichtet und staatlich überwacht ist."
    },
    {
      "date": "2025-12-30",
      "id": "141186",
      "original_text": "Löschungsankündigung\nSchleswig-Holstein Amtsgericht Flensburg HRB 15144\nSylt Taxi UG (haftungsbeschränkt) – Sylt",
      "type": "Löschungsankündigung",
      "state": "Schleswig-Holstein",
      "amtsgericht": "Amtsgericht Flensburg",
      "registernummer": "HRB 15144",
      "registerart": "HRB",
      "company_name": "Sylt Taxi UG (haftungsbeschränkt)",
      "company_seat": "Sylt",
      "details": "30.12.2025 (Bekanntmachungsdatum)\n\nSchleswig-Holstein Amtsgericht Flensburg HRB 15144\nLöschungsankündigung\n\nSylt Taxi UG (haftungsbeschränkt)\nGesellschaft mit beschränkter Haftung\nSylt\n\nEs ist die Löschung der nachstehenden Gesellschaft wegen Vermögenslosigkeit gemäß § 394 FamFG beabsichtigt.\nWiderspruchsfrist: 2 Monate"
    },
    {
      "date": "2025-12-30",
      "id": "141187",
      "original_text": "Einreichung neuer Dokumente\nBerlin Amtsgericht Berlin (Charlottenburg) HRB 166390\nRichardstraße 60, 61 Berlin-Neukölln GmbH – Berlin",
      "type": "Einreichung neuer Dokumente",
      "state": "Berlin",
      "amtsgericht": "Amtsgericht Berlin (Charlottenburg)",
      "registernummer": "HRB 166390",
      "registerart": "HRB",
      "company_name": "Richardstraße 60, 61 Berlin-Neukölln GmbH",
      "company_seat": "Berlin",
      "details": "30.12.2025 (Bekanntmachungsdatum)\n\nBerlin Amtsgericht Berlin (Charlottenburg) HRB 166390\nEinreichung neuer Dokumente\n\nRichardstraße 60, 61 Berlin-Neukölln GmbH\nGesellschaft mit beschränkter Haftung\nBerlin\n\nAls nicht eingetragen wird veröffentlicht:\n1.\nDie Gesellschaft hat den Entwurf eines Formwechselplans vom 15.12.2025 betreffend ihren grenzüberschreitenden Formwechsel nach Luxemburg, Luxemburg, zum Handelsregister eingereicht.\n\n2.\nDie an dem Formwechsel beteiligte Gesellschaft ist die „RichardstraBe 60, 61 Berlin-Neukölln GmbH“ mit Sitz in Berlin, Deutschland. Durch den Formwechsel soll sie die Rechtsform einer Societé à responsabilité limitée (S.à r.l.) luxemburgischen Rechts erhalten und unter „RichardstraBe 60, 61 Berlin-Neukölln S.à r.l.“ firmieren.\n\n3.\nDie formwechselnde Gesellschaft ist eingetragen im Handelsregister des Amtsgerichts Charlottenburg mit der Nummer HRB 166390 B und ist bereits eingetragen im Handels- und\nGesellschaftsregister von Luxemburg (Registre de commerce et des sociétés\nLuxembourg) unter der Nummer B228412. In Luxemburg soll sie im genannten luxemburgischen Gesellschaftsregister unter der genannten Nummer eingetragen bleiben.\n\n4.\nEs ergeht Hinweis an folgende Personen, dass sie der Gesellschaft spätestens fünf Arbeitstage vor dem Tag der Gesellschafterversammlung der Gesellschaft, die über die Zustimmung zum Formwechselplan entscheidet, Bemerkungen zum Formwechselplan übermitteln können:\n\na) die Anteilsinhaber und Gläubiger der an dem grenzüberschreitenden Formwechsel beteiligten Gesellschaft sowie\n\nb) die zuständigen Betriebsräte der an dem grenzüberschreitenden Formwechsel beteiligten\nGesellschaft oder, soweit es keinen Betriebsrat gibt, die Arbeitnehmer der an dem\ngrenzüberschreitenden Formwechsel beteiligten Gesellschaft.\n\nDie Gesellschafterversammlung darf erst einen Monat nach der Bekanntmachung des Formwechselplans über ihre Zustimmung zu dem Formwechselplan beschließen. Die Gesellschafterversammlung ist für den Tag geplant, der auf den Ablauf eines Monats nach dem Tag der Bekanntmachung des Formwechselplans folgt, ggfs. für den nächsten Arbeitstag (wobei Samstage, Sonntage und bundesweite Feiertage nicht als Arbeitstage zählen.\n\nDie Gesellschaft hat mitgeteilt, dass sie keine Arbeitnehmer und keinen Betriebsrat hat."
    },
    {
      "date": "2025-12-30",
      "id": "141188",
      "original_text": "Registerbekanntmachung nach dem Umwandlungsgesetz\nHamburg Amtsgericht Hamburg HRB 141274\nEMASE GmbH – Hamburg",
      "type": "Registerbekanntmachung nach dem Umwandlungsgesetz",
      "state": "Hamburg",
      "amtsgericht": "Amtsgericht Hamburg",
      "registernummer": "HRB 141274",
      "registerart": "HRB",
      "company_name": "EMASE GmbH",
      "company_seat": "Hamburg",
      "details": "30.12.2025 (Bekanntmachungsdatum)\n\nHamburg Amtsgericht Hamburg HRB 141274\nRegisterbekanntmachung nach dem Umwandlungsgesetz 22.12.2025 (Eintragungsdatum)\n\nEMASE GmbH\nGesellschaft mit beschränkter Haftung\nHamburg\n\nAls nicht eingetragen wird bekannt gemacht:\nDen Gläubigern der an der Verschmelzung beteiligten Gesellschaften ist, wenn sie binnen sechs Monaten nach dem Tag, an dem die Eintragung der Verschmelzung in das Register des Sitzes desjenigen Rechtsträgers, dessen Gläubiger sie sind, nach § 19 Absatz 3 UmwG als bekannt gemacht gilt, ihren Anspruch nach Grund und Höhe schriftlich anmelden, Sicherheit zu leisten, soweit sie nicht Befriedigung verlangen können. Dieses Recht steht den Gläubigern jedoch nur zu, wenn sie glaubhaft machen, dass durch die Verschmelzung die Erfüllung ihrer Forderung gefährdet wird."
    },
    {
      "date": "2025-12-30",
      "id": "141189",
      "original_text": "Löschungsankündigung\nBerlin Amtsgericht Berlin (Charlottenburg) HRB 229770\nZefir GmbH – Berlin",
      "type": "Löschungsankündigung",
      "state": "Berlin",
      "amtsgericht": "Amtsgericht Berlin (Charlottenburg)",
      "registernummer": "HRB 229770",
      "registerart": "HRB",
      "company_name": "Zefir GmbH",
      "company_seat": "Berlin",
      "details": "30.12.2025 (Bekanntmachungsdatum)\n\nBerlin Amtsgericht Berlin (Charlottenburg) HRB 229770\nLöschungsankündigung\n\nZefir GmbH\nGesellschaft mit beschränkter Haftung\nBerlin\n\nBei der nachstehenden Gesellschaft wird das Amtslöschungsverfahren gemäß § 394 FamFG eingeleitet. Widerspruchsfrist 6 Wochen"
    },
    {
      "date": "2025-12-30",
      "id": "141190",
      "original_text": "Einreichung neuer Dokumente\nBaden-Württemberg Amtsgericht Mannheim HRB 520444\nKurgesellschaft Bad Rotenfels mbH – Gaggenau",
      "type": "Einreichung neuer Dokumente",
      "state": "Baden-Württemberg",
      "amtsgericht": "Amtsgericht Mannheim",
      "registernummer": "HRB 520444",
      "registerart": "HRB",
      "company_name": "Kurgesellschaft Bad Rotenfels mbH",
      "company_seat": "Gaggenau",
      "details": "30.12.2025 (Bekanntmachungsdatum)\n\nBaden-Württemberg Amtsgericht Mannheim HRB 520444\nEinreichung neuer Dokumente\n\nKurgesellschaft Bad Rotenfels mbH\nGesellschaft mit beschränkter Haftung\nGaggenau\n\nDie Gesellschaft hat am 23.12.2025 die Liste über die Zusammensetzung des Aufsichtsrats zum Handelsregister eingereicht."
    },
    {
      "date": "2025-12-30",
      "id": "141191",
      "original_text": "Löschungsankündigung\nBerlin Amtsgericht Berlin (Charlottenburg) HRB 252992\nElb Channel GmbH – Berlin",
      "type": "Löschungsankündigung",
      "state": "Berlin",
      "amtsgericht": "Amtsgericht Berlin (Charlottenburg)",
      "registernummer": "HRB 252992",
      "registerart": "HRB",
      "company_name": "Elb Channel GmbH",
      "company_seat": "Berlin",
      "details": "30.12.2025 (Bekanntmachungsdatum)\n\nBerlin Amtsgericht Berlin (Charlottenburg) HRB 252992\nLöschungsankündigung\n\nElb Channel GmbH\nGesellschaft mit beschränkter Haftung\nBerlin\n\nBei der nachstehenden Gesellschaft wird das Amtslöschungsverfahren gemäß § 394 FamFG eingeleitet. Widerspruchsfrist 6 Wochen"
    },
    {
      "date": "2025-12-30",
      "id": "141192",
      "original_text": "Löschungsankündigung\nBaden-Württemberg Amtsgericht Freiburg HRB 724507\nAvantgarde FOUR GmbH – Konstanz",
      "type": "Löschungsankündigung",
      "state": "Baden-Württemberg",
      "amtsgericht": "Amtsgericht Freiburg",
      "registernummer": "HRB 724507",
      "registerart": "HRB",
      "company_name": "Avantgarde FOUR GmbH",
      "company_seat": "Konstanz",
      "details": "30.12.2025 (Bekanntmachungsdatum)\n\nBaden-Württemberg Amtsgericht Freiburg HRB 724507\nLöschungsankündigung\n\nAvantgarde FOUR GmbH\nGesellschaft mit beschränkter Haftung\nKonstanz\n\nAls nicht eingetragen wird bekanntgemacht:\nDas Gericht beabsichtigt, die Gesellschaft wegen Vermögenslosigkeit im Handelsregister von Amts wegen nach § 394 FamFG zu löschen. Die Frist zur Geltendmachung eines Widerspruchs gegen die beabsichtigte Löschung ist auf einen Monat ab Veröffentlichung bestimmt."
    },
    {
      "date": "2025-12-30",
      "id": "141193",
      "original_text": "Löschungsankündigung\nBerlin Amtsgericht Berlin (Charlottenburg) HRB 201993\nSky City Events GmbH – Berlin",
      "type": "Löschungsankündigung",
      "state": "Berlin",
      "amtsgericht": "Amtsgericht Berlin (Charlottenburg)",
      "registernummer": "HRB 201993",
      "registerart": "HRB",
      "company_name": "Sky City Events GmbH",
      "company_seat": "Berlin",
      "details": "30.12.2025 (Bekanntmachungsdatum)\n\nBerlin Amtsgericht Berlin (Charlottenburg) HRB 201993\nLöschungsankündigung\n\nSky City Events GmbH\nGesellschaft mit beschränkter Haftung\nBerlin\n\nBei der nachstehenden Gesellschaft wird das Amtslöschungsverfahren gemäß § 394 FamFG eingeleitet. Widerspruchsfrist 6 Wochen"
    },
    {
      "date": "2025-12-30",
      "id": "141194",
      "original_text": "Einreichung neuer Dokumente\nSaarland Amtsgericht Saarbrücken HRB 17422\nGemeindewerke Wadgassen GmbH – Wadgassen",
      "type": "Einreichung neuer Dokumente",
      "state": "Saarland",
      "amtsgericht": "Amtsgericht Saarbrücken",
      "registernummer": "HRB 17422",
      "registerart": "HRB",
      "company_name": "Gemeindewerke Wadgassen GmbH",
      "company_seat": "Wadgassen",
      "details": "30.12.2025 (Bekanntmachungsdatum)\n\nSaarland Amtsgericht Saarbrücken HRB 17422\nEinreichung neuer Dokumente 30.12.2025 (Eintragungsdatum)\n\nGemeindewerke Wadgassen GmbH\nGesellschaft mit beschränkter Haftung\nWadgassen\n\nDie Geschäftsführung der Gesellschaft hat eine Liste der Mitglieder des Aufsichtsrats zum Handelsregister eingereicht (§ 52 Abs. 3 Satz 2 GmbHG)."
    },
    {
      "date": "2025-12-30",
      "id": "141195",
      "original_text": "Registerbekanntmachung nach dem Umwandlungsgesetz\nBerlin Amtsgericht Berlin (Charlottenburg) HRB 264969\nPetros Beteiligungs GmbH – Berlin",
      "type": "Registerbekanntmachung nach dem Umwandlungsgesetz",
      "state": "Berlin",
      "amtsgericht": "Amtsgericht Berlin (Charlottenburg)",
      "registernummer": "HRB 264969",
      "registerart": "HRB",
      "company_name": "Petros Beteiligungs GmbH",
      "company_seat": "Berlin",
      "details": "30.12.2025 (Bekanntmachungsdatum)\n\nBerlin Amtsgericht Berlin (Charlottenburg) HRB 264969\nRegisterbekanntmachung nach dem Umwandlungsgesetz 29.12.2025 (Eintragungsdatum)\n\nPetros Beteiligungs GmbH\nGesellschaft mit beschränkter Haftung\nBerlin\n\nZu Eintragungsnummer 2 vom 29.12.2025 wird als nicht eingetragen veröffentlicht: Den Gläubigern der an der Verschmelzung beteiligten Rechtsträger ist, wenn sie binnen sechs Monaten nach dem Tag, an dem die Eintragung der Verschmelzung in das Register des Sitzes desjenigen Rechtsträgers, dessen Gläubiger sie sind, als bekannt gemacht gilt, ihren Anspruch nach Grund und Höhe schriftlich anmelden, Sicherheit zu leisten, soweit sie nicht Befriedigung verlangen können. Dieses Recht steht den Gläubigern jedoch nur zu, wenn sie glaubhaft machen, dass durch die Verschmelzung die Erfüllung ihrer Forderung gefährdet wird. Das Recht, Sicherheitsleistung zu verlangen, steht Gläubigern nicht zu, die im Falle der Insolvenz ein Recht auf vorzugsweise Befriedigung aus einer Deckungsmasse haben, die nach gesetzlicher Vorschrift zu ihrem Schutz errichtet und staatlich überwacht ist."
    },
    {
      "date": "2025-12-30",
      "id": "141196",
      "original_text": "Registerbekanntmachung nach dem Umwandlungsgesetz\nBerlin Amtsgericht Berlin (Charlottenburg) HRB 217395\nJSS GmbH – Berlin",
      "type": "Registerbekanntmachung nach dem Umwandlungsgesetz",
      "state": "Berlin",
      "amtsgericht": "Amtsgericht Berlin (Charlottenburg)",
      "registernummer": "HRB 217395",
      "registerart": "HRB",
      "company_name": "JSS GmbH",
      "company_seat": "Berlin",
      "details": "30.12.2025 (Bekanntmachungsdatum)\n\nBerlin Amtsgericht Berlin (Charlottenburg) HRB 217395\nRegisterbekanntmachung nach dem Umwandlungsgesetz 29.12.2025 (Eintragungsdatum)\n\nJSS GmbH\nGesellschaft mit beschränkter Haftung\nBerlin\n\nZu Eintragungsnummer 5 vom 29.12.2025 wird als nicht eingetragen veröffentlicht: Den Gläubigern der an der Verschmelzung beteiligten Rechtsträger ist, wenn sie binnen sechs Monaten nach dem Tag, an dem die Eintragung der Verschmelzung in das Register des Sitzes desjenigen Rechtsträgers, dessen Gläubiger sie sind, als bekannt gemacht gilt, ihren Anspruch nach Grund und Höhe schriftlich anmelden, Sicherheit zu leisten, soweit sie nicht Befriedigung verlangen können. Dieses Recht steht den Gläubigern jedoch nur zu, wenn sie glaubhaft machen, dass durch die Verschmelzung die Erfüllung ihrer Forderung gefährdet wird. Das Recht, Sicherheitsleistung zu verlangen, steht Gläubigern nicht zu, die im Falle der Insolvenz ein Recht auf vorzugsweise Befriedigung aus einer Deckungsmasse haben, die nach gesetzlicher Vorschrift zu ihrem Schutz errichtet und staatlich überwacht ist."
    },
    {
      "date": "2025-12-30",
      "id": "141197",
      "original_text": "Sonstige Registerbekanntmachung\nThüringen Amtsgericht Gotha VR 141704\nKitafreunde Gräfentonna e. V. – Tonna",
      "type": "Sonstige Registerbekanntmachung",
      "state": "Thüringen",
      "amtsgericht": "Amtsgericht Gotha",
      "registernummer": "VR 141704",
      "registerart": "VR",
      "company_name": "Kitafreunde Gräfentonna e. V.",
      "company_seat": "Tonna",
      "details": "30.12.2025 (Bekanntmachungsdatum)\n\nThüringen Amtsgericht Gotha VR 141704\nSonstige Registerbekanntmachung 30.12.2025 (Eintragungsdatum)\n\nKitafreunde Gräfentonna e. V.\neingetragener Verein\nTonna"
    },
    {
      "date": "2025-12-30",
      "id": "141198",
      "original_text": "Einreichung neuer Dokumente\nBerlin Amtsgericht Berlin (Charlottenburg) HRB 98743\nTerraverde AG – Berlin",
      "type": "Einreichung neuer Dokumente",
      "state": "Berlin",
      "amtsgericht": "Amtsgericht Berlin (Charlottenburg)",
      "registernummer": "HRB 98743",
      "registerart": "HRB",
      "company_name": "Terraverde AG",
      "company_seat": "Berlin",
      "details": "30.12.2025 (Bekanntmachungsdatum)\n\nBerlin Amtsgericht Berlin (Charlottenburg) HRB 98743\nEinreichung neuer Dokumente\n\nTerraverde AG\nAktiengesellschaft\nBerlin\n\nAls nicht eingetragen wird veröffentlicht:\n\nEs wurde eine neue Liste der Aufsichtsratsmitglieder eingereicht (§ 106 AktG)."
    },
    {
      "date": "2025-12-30",
      "id": "141199",
      "original_text": "Löschungsankündigung\nBerlin Amtsgericht Berlin (Charlottenburg) HRB 151264\nLichtenberg 3 5 7 GmbH – Berlin",
      "type": "Löschungsankündigung",
      "state": "Berlin",
      "amtsgericht": "Amtsgericht Berlin (Charlottenburg)",
      "registernummer": "HRB 151264",
      "registerart": "HRB",
      "company_name": "Lichtenberg 3 5 7 GmbH",
      "company_seat": "Berlin",
      "details": "30.12.2025 (Bekanntmachungsdatum)\n\nBerlin Amtsgericht Berlin (Charlottenburg) HRB 151264\nLöschungsankündigung\n\nLichtenberg 3 5 7 GmbH\nGesellschaft mit beschränkter Haftung\nBerlin\n\nBei der nachstehenden Gesellschaft wird das Amtslöschungsverfahren gemäß § 394 FamFG eingeleitet. Widerspruchsfrist 6 Wochen"
    },
    {
      "date": "2025-12-30",
      "id": "141200",
      "original_text": "Registerbekanntmachung nach dem Umwandlungsgesetz\nSaarland Amtsgericht Saarbrücken HRB 111207\nGreen Future E-Commerce GmbH – Saarbrücken",
      "type": "Registerbekanntmachung nach dem Umwandlungsgesetz",
      "state": "Saarland",
      "amtsgericht": "Amtsgericht Saarbrücken",
      "registernummer": "HRB 111207",
      "registerart": "HRB",
      "company_name": "Green Future E-Commerce GmbH",
      "company_seat": "Saarbrücken",
      "details": "30.12.2025 (Bekanntmachungsdatum)\n\nSaarland Amtsgericht Saarbrücken HRB 111207\nRegisterbekanntmachung nach dem Umwandlungsgesetz 29.12.2025 (Eintragungsdatum)\n\nGreen Future E-Commerce GmbH\nGesellschaft mit beschränkter Haftung\nSaarbrücken\n\nAls nicht eingetragen wird bekannt gemacht: Den Gläubigern der an der Verschmelzung beteiligten Gesellschaften ist, wenn sie binnen sechs Monaten nach dem Tag, an dem die Eintragung der Verschmelzung in das Register des Sitzes derjenigen Rechtsträger deren Gläubiger sie sind, nach § 19 Absatz 3 UmwG bekannt gemacht worden ist, ihren Anspruch nach Grund und Höhe schriftlich anmelden, Sicherheit zu leisten, soweit sie nicht Befriedigung verlangen können. Dieses Recht steht den Gläubigern jedoch nur zu, wenn sie glaubhaft machen, dass durch die Verschmelzung die Erfüllung ihrer Forderung gefährdet wird."
    },
    {
      "date": "2025-12-30",
      "id": "141201",
      "original_text": "Löschungsankündigung\nBerlin Amtsgericht Berlin (Charlottenburg) HRB 213859\nARENSTROW GmbH – Berlin",
      "type": "Löschungsankündigung",
      "state": "Berlin",
      "amtsgericht": "Amtsgericht Berlin (Charlottenburg)",
      "registernummer": "HRB 213859",
      "registerart": "HRB",
      "company_name": "ARENSTROW GmbH",
      "company_seat": "Berlin",
      "details": "30.12.2025 (Bekanntmachungsdatum)\n\nBerlin Amtsgericht Berlin (Charlottenburg) HRB 213859\nLöschungsankündigung\n\nARENSTROW GmbH\nGesellschaft mit beschränkter Haftung\nBerlin\n\nBei der nachstehenden Gesellschaft wird das Amtslöschungsverfahren gemäß § 394 FamFG eingeleitet. Widerspruchsfrist 6 Wochen"
    },
    {
      "date": "2025-12-30",
      "id": "141202",
      "original_text": "Einreichung neuer Dokumente\nSchleswig-Holstein Amtsgericht Kiel HRB 9369\nGesundheits- und Pflegeeinrichtungen des Kreises Plön gemeinnützige GmbH – Preetz",
      "type": "Einreichung neuer Dokumente",
      "state": "Schleswig-Holstein",
      "amtsgericht": "Amtsgericht Kiel",
      "registernummer": "HRB 9369",
      "registerart": "HRB",
      "company_name": "Gesundheits- und Pflegeeinrichtungen des Kreises Plön gemeinnützige GmbH",
      "company_seat": "Preetz",
      "details": "30.12.2025 (Bekanntmachungsdatum)\n\nSchleswig-Holstein Amtsgericht Kiel HRB 9369\nEinreichung neuer Dokumente\n\nGesundheits- und Pflegeeinrichtungen des Kreises Plön gemeinnützige GmbH\nGesellschaft mit beschränkter Haftung\nPreetz\n\nAls nicht eingetragen wird veröffentlicht: Eine neue Liste der Aufsichtsratsmitglieder ist eingereicht worden."
    },
    {
      "date": "2025-12-30",
      "id": "141203",
      "original_text": "Einreichung neuer Dokumente\nSchleswig-Holstein Amtsgericht Kiel HRB 23326\nIGEFA Beteiligung SE – Neumünster",
      "type": "Einreichung neuer Dokumente",
      "state": "Schleswig-Holstein",
      "amtsgericht": "Amtsgericht Kiel",
      "registernummer": "HRB 23326",
      "registerart": "HRB",
      "company_name": "IGEFA Beteiligung SE",
      "company_seat": "Neumünster",
      "details": "30.12.2025 (Bekanntmachungsdatum)\n\nSchleswig-Holstein Amtsgericht Kiel HRB 23326\nEinreichung neuer Dokumente\n\nIGEFA Beteiligung SE\nEuropäische Aktiengesellschaft (SE)\nNeumünster\n\nAls nicht eingetragen wird veröffentlicht: Eine neue Liste der Aufsichtsratsmitglieder ist eingereicht worden."
    },
    {
      "date": "2025-12-30",
      "id": "141204",
      "original_text": "Sonstige Registerbekanntmachung\nBerlin Amtsgericht Berlin (Charlottenburg) HRB 140163\nF2 Capital GmbH – Berlin",
      "type": "Sonstige Registerbekanntmachung",
      "state": "Berlin",
      "amtsgericht": "Amtsgericht Berlin (Charlottenburg)",
      "registernummer": "HRB 140163",
      "registerart": "HRB",
      "company_name": "F2 Capital GmbH",
      "company_seat": "Berlin",
      "details": "30.12.2025 (Bekanntmachungsdatum)\n\nBerlin Amtsgericht Berlin (Charlottenburg) HRB 140163\nSonstige Registerbekanntmachung\n\nF2 Capital GmbH\nGesellschaft mit beschränkter Haftung\nBerlin\n\nAls nicht eingetragen wird veröffentlicht: Den Gläubigern ist, wenn sie binnen sechs Monaten nach dem Tag, an dem die Eintragung der Umwandlung als bekannt gemacht gilt, ihren Anspruch nach Grund und Höhe schriftlich anmelden, Sicherheit zu leisten, soweit sie nicht Befriedigung verlangen können. Dieses Recht steht den Gläubigern jedoch nur zu, wenn sie glaubhaft machen, dass durch die Umwandlung die Erfüllung ihrer Forderung gefährdet wird. Das Recht, Sicherheitsleistung zu verlangen, steht Gläubigern nicht zu, die im Falle der Insolvenz ein Recht auf vorzugsweise Befriedigung aus einer Deckungsmasse haben, die nach gesetzlicher Vorschrift zu ihrem Schutz errichtet und staatlich überwacht ist."
    },
    {
      "date": "2025-12-30",
      "id": "141205",
      "original_text": "Sonstige Registerbekanntmachung\nHamburg Amtsgericht Hamburg HRB 189539\nKinesso GmbH – Hamburg",
      "type": "Sonstige Registerbekanntmachung",
      "state": "Hamburg",
      "amtsgericht": "Amtsgericht Hamburg",
      "registernummer": "HRB 189539",
      "registerart": "HRB",
      "company_name": "Kinesso GmbH",
      "company_seat": "Hamburg",
      "details": "30.12.2025 (Bekanntmachungsdatum)\n\nHamburg Amtsgericht Hamburg HRB 189539\nSonstige Registerbekanntmachung 30.12.2025 (Eintragungsdatum)\n\nKinesso GmbH\nGesellschaft mit beschränkter Haftung\nHamburg\n\nAls nicht eingetragen wird bekannt gemacht:  Den Gläubigern der Gesellschaft, deren Forderungen begründet worden sind, bevor die Eintragung der Vertragsbeendigung in das Handelsregister nach § 10 HGB als bekannt gemacht gilt, ist vom anderen Vertragsteil Sicherheit zu leisten, wenn sie sich binnen 6 Monaten nach Bekanntmachung der Eintragung zu diesem Zweck bei ihm melden."
    },
    {
      "date": "2025-12-30",
      "id": "141206",
      "original_text": "Einreichung neuer Dokumente\nBerlin Amtsgericht Berlin (Charlottenburg) HRB 100157\nVivantes - Forum für Senioren GmbH – Berlin",
      "type": "Einreichung neuer Dokumente",
      "state": "Berlin",
      "amtsgericht": "Amtsgericht Berlin (Charlottenburg)",
      "registernummer": "HRB 100157",
      "registerart": "HRB",
      "company_name": "Vivantes - Forum für Senioren GmbH",
      "company_seat": "Berlin",
      "details": "30.12.2025 (Bekanntmachungsdatum)\n\nBerlin Amtsgericht Berlin (Charlottenburg) HRB 100157\nEinreichung neuer Dokumente\n\nVivantes - Forum für Senioren GmbH\nGesellschaft mit beschränkter Haftung\nBerlin\n\nAls nicht eingetragen wird veröffentlicht:Es wurde eine neue Liste der Aufsichtsratsmitglieder eingereicht (§52 GmbHG)."
    },
    {
      "date": "2025-12-30",
      "id": "141207",
      "original_text": "Registerbekanntmachung nach dem Umwandlungsgesetz\nSaarland Amtsgericht Saarbrücken HRB 103491\nGFU Berufliche Bildung und Beratung GmbH – Saarlouis",
      "type": "Registerbekanntmachung nach dem Umwandlungsgesetz",
      "state": "Saarland",
      "amtsgericht": "Amtsgericht Saarbrücken",
      "registernummer": "HRB 103491",
      "registerart": "HRB",
      "company_name": "GFU Berufliche Bildung und Beratung GmbH",
      "company_seat": "Saarlouis",
      "details": "30.12.2025 (Bekanntmachungsdatum)\n\nSaarland Amtsgericht Saarbrücken HRB 103491\nRegisterbekanntmachung nach dem Umwandlungsgesetz 30.12.2025 (Eintragungsdatum)\n\nGFU Berufliche Bildung und Beratung GmbH\nGesellschaft mit beschränkter Haftung\nSaarlouis\n\nAls nicht eingetragen wird bekannt gemacht: Den Gläubigern der an der Verschmelzung beteiligten Gesellschaften ist, wenn sie binnen sechs Monaten nach dem Tag, an dem die Eintragung der Verschmelzung in das Register des Sitzes desjenigen Rechtsträgers, dessen Gläubiger sie sind, nach § 19 Absatz 3 UmwG bekannt gemacht worden ist, ihren Anspruch nach Grund und Höhe schriftlich anmelden, Sicherheit zu leisten, soweit sie nicht Befriedigung verlangen können. Dieses Recht steht den Gläubigern jedoch nur zu, wenn sie glaubhaft machen, dass durch die Verschmelzung die Erfüllung ihrer Forderung gefährdet wird."
    },
    {
      "date": "2025-12-30",
      "id": "141208",
      "original_text": "Löschungsankündigung\nSachsen-Anhalt Amtsgericht Stendal HRB 27869\nASG Estrichtechnik UG (haftungsbeschränkt) – Halle (Saale)",
      "type": "Löschungsankündigung",
      "state": "Sachsen-Anhalt",
      "amtsgericht": "Amtsgericht Stendal",
      "registernummer": "HRB 27869",
      "registerart": "HRB",
      "company_name": "ASG Estrichtechnik UG (haftungsbeschränkt)",
      "company_seat": "Halle (Saale)",
      "details": "30.12.2025 (Bekanntmachungsdatum)\n\nSachsen-Anhalt Amtsgericht Stendal HRB 27869\nLöschungsankündigung\n\nASG Estrichtechnik UG (haftungsbeschränkt)\nGesellschaft mit beschränkter Haftung\nHalle (Saale)\n\nDas Registergericht beabsichtigt, nachfolgende Gesellschaften wegen Vermögenslosigkeit von Amts wegen nach § 394 FamFG zu löschen. Die Frist zur Erhebung eines Widerspruchs gegen die beabsichtigte Löschung wird auf drei Monate festgesetzt."
    },
    {
      "date": "2025-12-30",
      "id": "141209",
      "original_text": "Einreichung neuer Dokumente\nSaarland Amtsgericht Saarbrücken HRB 107892\nGrundstücks- und Immobiliengeschäftsführungsgesellschaft Wadgassen mbH – Wadgassen",
      "type": "Einreichung neuer Dokumente",
      "state": "Saarland",
      "amtsgericht": "Amtsgericht Saarbrücken",
      "registernummer": "HRB 107892",
      "registerart": "HRB",
      "company_name": "Grundstücks- und Immobiliengeschäftsführungsgesellschaft Wadgassen mbH",
      "company_seat": "Wadgassen",
      "details": "30.12.2025 (Bekanntmachungsdatum)\n\nSaarland Amtsgericht Saarbrücken HRB 107892\nEinreichung neuer Dokumente 30.12.2025 (Eintragungsdatum)\n\nGrundstücks- und Immobiliengeschäftsführungsgesellschaft Wadgassen mbH\nGesellschaft mit beschränkter Haftung\nWadgassen\n\nDie Geschäftsführung der Gesellschaft hat eine Liste der Mitglieder des Aufsichtsrats zum Handelsregister eingereicht (§ 52 Abs. 3 Satz 2 GmbHG)."
    },
    {
      "date": "2025-12-30",
      "id": "141210",
      "original_text": "Einreichung neuer Dokumente\nBaden-Württemberg Amtsgericht Freiburg HRB 722081\nMVZ Bad Säckingen GmbH – Bad Säckingen",
      "type": "Einreichung neuer Dokumente",
      "state": "Baden-Württemberg",
      "amtsgericht": "Amtsgericht Freiburg",
      "registernummer": "HRB 722081",
      "registerart": "HRB",
      "company_name": "MVZ Bad Säckingen GmbH",
      "company_seat": "Bad Säckingen",
      "details": "30.12.2025 (Bekanntmachungsdatum)\n\nBaden-Württemberg Amtsgericht Freiburg HRB 722081\nEinreichung neuer Dokumente\n\nMVZ Bad Säckingen GmbH\nGesellschaft mit beschränkter Haftung\nBad Säckingen\n\nDie Gesellschaft hat am 23.12.2025 die Liste über die Zusammensetzung des Aufsichtsrats zum Handelsregister eingereicht."
    },
    {
      "date": "2025-12-30",
      "id": "141211",
      "original_text": "Einreichung neuer Dokumente\nSachsen Amtsgericht Leipzig HRB 622\nLeipziger Messe Gesellschaft mbH – Leipzig",
      "type": "Einreichung neuer Dokumente",
      "state": "Sachsen",
      "amtsgericht": "Amtsgericht Leipzig",
      "registernummer": "HRB 622",
      "registerart": "HRB",
      "company_name": "Leipziger Messe Gesellschaft mbH",
      "company_seat": "Leipzig",
      "details": "30.12.2025 (Bekanntmachungsdatum)\n\nSachsen Amtsgericht Leipzig HRB 622\nEinreichung neuer Dokumente\n\nLeipziger Messe Gesellschaft mbH\nGesellschaft mit beschränkter Haftung\nLeipzig\n\nAm 17.12.2025 wurde beim Handelsregister des Amtsgerichts Leipzig die Liste der Mitglieder des Aufsichtsrats gemäß § 52 GmbHG eingereicht."
    },
    {
      "date": "2025-12-30",
      "id": "141212",
      "original_text": "Einreichung neuer Dokumente\nSachsen Amtsgericht Chemnitz HRB 16274\nVersorgungs- und Verkehrsholding GmbH Chemnitz (VVHC) – Chemnitz",
      "type": "Einreichung neuer Dokumente",
      "state": "Sachsen",
      "amtsgericht": "Amtsgericht Chemnitz",
      "registernummer": "HRB 16274",
      "registerart": "HRB",
      "company_name": "Versorgungs- und Verkehrsholding GmbH Chemnitz (VVHC)",
      "company_seat": "Chemnitz",
      "details": "30.12.2025 (Bekanntmachungsdatum)\n\nSachsen Amtsgericht Chemnitz HRB 16274\nEinreichung neuer Dokumente\n\nVersorgungs- und Verkehrsholding GmbH Chemnitz (VVHC)\nGesellschaft mit beschränkter Haftung\nChemnitz\n\nAm 22.12.2025 wurde beim Handelsregister des Amtsgerichts Chemnitz die Liste der Mitglieder des Aufsichtsrats gemäß § 52 GmbHG eingereicht."
    },
    {
      "date": "2025-12-30",
      "id": "141213",
      "original_text": "Einreichung neuer Dokumente\nNiedersachsen Amtsgericht Lüneburg HRB 101818 früher Amtsgericht Celle\nGebr. Röders AG – Soltau",
      "type": "Einreichung neuer Dokumente",
      "state": "Niedersachsen",
      "amtsgericht": "Amtsgericht Lüneburg",
      "registernummer": "HRB 101818",
      "registerart": "HRB",
      "company_name": "Gebr. Röders AG",
      "company_seat": "Soltau",
      "former_amtsgericht": "Celle",
      "details": "30.12.2025 (Bekanntmachungsdatum)\n\nNiedersachsen Amtsgericht Lüneburg HRB 101818 früher Amtsgericht Celle\nEinreichung neuer Dokumente 30.12.2025 (Eintragungsdatum)\n\nGebr. Röders AG\nAktiengesellschaft\nSoltau\n\nEine aktuelle Liste der Mitglieder des Aufsichtsrats wurde beim Registergericht eingereicht."
    },
    {
      "date": "2025-12-30",
      "id": "141214",
      "original_text": "Löschungsankündigung\nNiedersachsen Amtsgericht Lüneburg HRB 203168\nDMM Deutsche Medien- und Marketinggesellschaft UG (haftungsbeschränkt) – Lüneburg",
      "type": "Löschungsankündigung",
      "state": "Niedersachsen",
      "amtsgericht": "Amtsgericht Lüneburg",
      "registernummer": "HRB 203168",
      "registerart": "HRB",
      "company_name": "DMM Deutsche Medien- und Marketinggesellschaft UG (haftungsbeschränkt)",
      "company_seat": "Lüneburg",
      "details": "30.12.2025 (Bekanntmachungsdatum)\n\nNiedersachsen Amtsgericht Lüneburg HRB 203168\nLöschungsankündigung\n\nDMM Deutsche Medien- und Marketinggesellschaft UG (haftungsbeschränkt)\nGesellschaft mit beschränkter Haftung\nLüneburg\n\nDas Registergericht beabsichtigt, die Gesellschaft von Amts wegen nach § 394 FamFG zu löschen. Die Frist zur Erhebung eines Widerspruchs ist auf 1 Monat ab dieser Registerbekanntmachung festgesetzt."
    },
    {
      "date": "2025-12-30",
      "id": "141215",
      "original_text": "Registerbekanntmachung nach dem Umwandlungsgesetz\nNiedersachsen Amtsgericht Oldenburg (Oldenburg) HRB 151635 früher Amtsgericht Cloppenburg\nKS-Modulbau Verwaltungsgesellschaft mbH – Ahlhorn",
      "type": "Registerbekanntmachung nach dem Umwandlungsgesetz",
      "state": "Niedersachsen",
      "amtsgericht": "Amtsgericht Oldenburg (Oldenburg)",
      "registernummer": "HRB 151635",
      "registerart": "HRB",
      "company_name": "KS-Modulbau Verwaltungsgesellschaft mbH",
      "company_seat": "Ahlhorn",
      "former_amtsgericht": "Cloppenburg",
      "details": "30.12.2025 (Bekanntmachungsdatum)\n\nNiedersachsen Amtsgericht Oldenburg (Oldenburg) HRB 151635 früher Amtsgericht Cloppenburg\nRegisterbekanntmachung nach dem Umwandlungsgesetz 30.12.2025 (Eintragungsdatum)\n\nKS-Modulbau Verwaltungsgesellschaft mbH\nGesellschaft mit beschränkter Haftung\nAhlhorn\n\nDen Gläubigern der an der Verschmelzung beteiligten Rechtsträger ist, wenn sie binnen sechs Monaten nach dem Tag, an dem die Eintragung der Verschmelzung in das Register des Sitzes desjenigen Rechtsträgers, dessen Gläubiger sie sind, nach § 19  Abs.  3 UmwG als bekannt gemacht gilt, ihren Anspruch nach Grund und Höhe schriftlich anmelden, Sicherheit zu leisten, soweit sie nicht Befriedigung verlangen können. Dieses Recht steht den Gläubigern jedoch nur zu, wenn sie glaubhaft machen, dass durch die Verschmelzung die Erfüllung der Forderung gefährdet wird."
    },
    {
      "date": "2025-12-30",
      "id": "141216",
      "original_text": "Löschungsankündigung\nNiedersachsen Amtsgericht Lüneburg HRB 208067\nE² T Produktions GmbH – Wrestedt",
      "type": "Löschungsankündigung",
      "state": "Niedersachsen",
      "amtsgericht": "Amtsgericht Lüneburg",
      "registernummer": "HRB 208067",
      "registerart": "HRB",
      "company_name": "E² T Produktions GmbH",
      "company_seat": "Wrestedt",
      "details": "30.12.2025 (Bekanntmachungsdatum)\n\nNiedersachsen Amtsgericht Lüneburg HRB 208067\nLöschungsankündigung\n\nE² T Produktions GmbH\nGesellschaft mit beschränkter Haftung\nWrestedt\n\nDas Registergericht beabsichtigt, die Gesellschaft von Amts wegen nach § 394 FamFG zu löschen. Die Frist zur Erhebung eines Widerspruchs ist auf 1 Monat ab dieser Registerbekanntmachung festgesetzt."
    },
    {
      "date": "2025-12-30",
      "id": "141217",
      "original_text": "Löschungsankündigung\nNiedersachsen Amtsgericht Braunschweig HRB 4435\nSchaare Projektmanagement Gesellschaft mit beschränkter Haftung – Braunschweig",
      "type": "Löschungsankündigung",
      "state": "Niedersachsen",
      "amtsgericht": "Amtsgericht Braunschweig",
      "registernummer": "HRB 4435",
      "registerart": "HRB",
      "company_name": "Schaare Projektmanagement Gesellschaft mit beschränkter Haftung",
      "company_seat": "Braunschweig",
      "details": "30.12.2025 (Bekanntmachungsdatum)\n\nNiedersachsen Amtsgericht Braunschweig HRB 4435\nLöschungsankündigung 30.12.2025 (Eintragungsdatum)\n\nSchaare Projektmanagement Gesellschaft mit beschränkter Haftung\nGesellschaft mit beschränkter Haftung\nBraunschweig\n\nDas Registergericht beabsichtigt, die Gesellschaft von Amts wegen nach § 394 FamFG zu löschen. Die Frist zur Erhebung eines Widerspruchs ist auf 1 Monat ab dieser Registerbekanntmachung festgesetzt."
    },
    {
      "date": "2025-12-30",
      "id": "141218",
      "original_text": "Registerbekanntmachung nach dem Umwandlungsgesetz\nNiedersachsen Amtsgericht Oldenburg (Oldenburg) HRB 222534\nBALKOW Immobilien GmbH – Oldenburg",
      "type": "Registerbekanntmachung nach dem Umwandlungsgesetz",
      "state": "Niedersachsen",
      "amtsgericht": "Amtsgericht Oldenburg (Oldenburg)",
      "registernummer": "HRB 222534",
      "registerart": "HRB",
      "company_name": "BALKOW Immobilien GmbH",
      "company_seat": "Oldenburg",
      "details": "30.12.2025 (Bekanntmachungsdatum)\n\nNiedersachsen Amtsgericht Oldenburg (Oldenburg) HRB 222534\nRegisterbekanntmachung nach dem Umwandlungsgesetz 30.12.2025 (Eintragungsdatum)\n\nBALKOW Immobilien GmbH\nGesellschaft mit beschränkter Haftung\nOldenburg\n\nDen Gläubigern der an der Ausgliederung beteiligten Rechtsträger ist, wenn sie binnen sechs Monaten nach dem Tag, an dem die Eintragung der Ausgliederung in das Register des Sitzes desjenigen Rechtsträgers, dessen Gläubiger sie sind, nach § 19 Abs. 3 UmwG als bekannt gemacht gilt, ihren Anspruch nach Grund und Höhe schriftlich anmelden, Sicherheit zu leisten, soweit sie nicht Befriedigung verlangen können. Dieses Recht steht den Gläubigern jedoch nur zu, wenn sie glaubhaft machen, dass durch die Ausgliederung die Erfüllung der Forderung gefährdet wird."
    },
    {
      "date": "2025-12-30",
      "id": "141219",
      "original_text": "Registerbekanntmachung nach dem Umwandlungsgesetz\nNiedersachsen Amtsgericht Oldenburg (Oldenburg) HRB 140793 früher Amtsgericht Delmenhorst\nKS-Bausysteme Verwaltungs GmbH – Ahlhorn",
      "type": "Registerbekanntmachung nach dem Umwandlungsgesetz",
      "state": "Niedersachsen",
      "amtsgericht": "Amtsgericht Oldenburg (Oldenburg)",
      "registernummer": "HRB 140793",
      "registerart": "HRB",
      "company_name": "KS-Bausysteme Verwaltungs GmbH",
      "company_seat": "Ahlhorn",
      "former_amtsgericht": "Delmenhorst",
      "details": "30.12.2025 (Bekanntmachungsdatum)\n\nNiedersachsen Amtsgericht Oldenburg (Oldenburg) HRB 140793 früher Amtsgericht Delmenhorst\nRegisterbekanntmachung nach dem Umwandlungsgesetz 30.12.2025 (Eintragungsdatum)\n\nKS-Bausysteme Verwaltungs GmbH\nGesellschaft mit beschränkter Haftung\nAhlhorn\n\nDen Gläubigern der an der Verschmelzung beteiligten Rechtsträger ist, wenn sie binnen sechs Monaten nach dem Tag, an dem die Eintragung der Verschmelzung in das Register des Sitzes desjenigen Rechtsträgers, dessen Gläubiger sie sind, nach § 19  Abs.  3 UmwG als bekannt gemacht gilt, ihren Anspruch nach Grund und Höhe schriftlich anmelden, Sicherheit zu leisten, soweit sie nicht Befriedigung verlangen können. Dieses Recht steht den Gläubigern jedoch nur zu, wenn sie glaubhaft machen, dass durch die Verschmelzung die Erfüllung der Forderung gefährdet wird."
    },
    {
      "date": "2025-12-30",
      "id": "141220",
      "original_text": "Sonstige Registerbekanntmachung\nNiedersachsen Amtsgericht Oldenburg (Oldenburg) HRB 216157\nFF Immobilien Holding GmbH – Ganderkesee",
      "type": "Sonstige Registerbekanntmachung",
      "state": "Niedersachsen",
      "amtsgericht": "Amtsgericht Oldenburg (Oldenburg)",
      "registernummer": "HRB 216157",
      "registerart": "HRB",
      "company_name": "FF Immobilien Holding GmbH",
      "company_seat": "Ganderkesee",
      "details": "30.12.2025 (Bekanntmachungsdatum)\n\nNiedersachsen Amtsgericht Oldenburg (Oldenburg) HRB 216157\nSonstige Registerbekanntmachung 30.12.2025 (Eintragungsdatum)\n\nFF Immobilien Holding GmbH\nGesellschaft mit beschränkter Haftung\nGanderkesee\n\nDen Gläubigern der Gesellschaft, deren Forderungen begründet worden sind, bevor die Eintragung der Beendigung des Vertrages in das Handelsregister nach § 10 HGB als bekanntgemacht gilt, ist vom anderen Vertragsteil Sicherheit zu leisten, wenn sie sich binnen sechs Monaten nach der Bekanntmachung zu diesem Zweck bei ihm melden."
    },
    {
      "date": "2025-12-30",
      "id": "141221",
      "original_text": "Löschungsankündigung\nNiedersachsen Amtsgericht Stadthagen HRB 202028\nEMS-Elektrotechnik Muhammet Sentürk GmbH – Rinteln",
      "type": "Löschungsankündigung",
      "state": "Niedersachsen",
      "amtsgericht": "Amtsgericht Stadthagen",
      "registernummer": "HRB 202028",
      "registerart": "HRB",
      "company_name": "EMS-Elektrotechnik Muhammet Sentürk GmbH",
      "company_seat": "Rinteln",
      "details": "30.12.2025 (Bekanntmachungsdatum)\n\nNiedersachsen Amtsgericht Stadthagen HRB 202028\nLöschungsankündigung\n\nEMS-Elektrotechnik Muhammet Sentürk GmbH\nGesellschaft mit beschränkter Haftung\nRinteln\n\nDas Registergericht beabsichtigt, die Gesellschaft von Amts wegen nach § 394 FamFG zu löschen. Die Frist zur Erhebung eines Widerspruchs ist auf 1 Monat ab dieser Registerbekanntmachung festgesetzt."
    },
    {
      "date": "2025-12-30",
      "id": "141222",
      "original_text": "Registerbekanntmachung nach dem Umwandlungsgesetz\nNiedersachsen Amtsgericht Oldenburg (Oldenburg) HRB 150363 früher Amtsgericht Cloppenburg\nHJD Holding GmbH – Essen/Oldenburg",
      "type": "Registerbekanntmachung nach dem Umwandlungsgesetz",
      "state": "Niedersachsen",
      "amtsgericht": "Amtsgericht Oldenburg (Oldenburg)",
      "registernummer": "HRB 150363",
      "registerart": "HRB",
      "company_name": "HJD Holding GmbH",
      "company_seat": "Essen/Oldenburg",
      "former_amtsgericht": "Cloppenburg",
      "details": "30.12.2025 (Bekanntmachungsdatum)\n\nNiedersachsen Amtsgericht Oldenburg (Oldenburg) HRB 150363 früher Amtsgericht Cloppenburg\nRegisterbekanntmachung nach dem Umwandlungsgesetz 30.12.2025 (Eintragungsdatum)\n\nHJD Holding GmbH\nGesellschaft mit beschränkter Haftung\nEssen/Oldenburg\n\nDen Gläubigern der an der Verschmelzung beteiligten Rechtsträger ist, wenn sie binnen sechs Monaten nach dem Tag, an dem die Eintragung der Verschmelzung in das Register des Sitzes desjenigen Rechtsträgers, dessen Gläubiger sie sind, nach § 19  Abs.  3 UmwG als bekannt gemacht gilt, ihren Anspruch nach Grund und Höhe schriftlich anmelden, Sicherheit zu leisten, soweit sie nicht Befriedigung verlangen können. Dieses Recht steht den Gläubigern jedoch nur zu, wenn sie glaubhaft machen, dass durch die Verschmelzung die Erfüllung der Forderung gefährdet wird."
    },
    {
      "date": "2025-12-30",
      "id": "141223",
      "original_text": "Löschungsankündigung\nNiedersachsen Amtsgericht Lüneburg HRB 204265\nTimm & Co. Finanzkonzepte UG (haftungsbeschränkt) – Schneverdingen",
      "type": "Löschungsankündigung",
      "state": "Niedersachsen",
      "amtsgericht": "Amtsgericht Lüneburg",
      "registernummer": "HRB 204265",
      "registerart": "HRB",
      "company_name": "Timm & Co. Finanzkonzepte UG (haftungsbeschränkt)",
      "company_seat": "Schneverdingen",
      "details": "30.12.2025 (Bekanntmachungsdatum)\n\nNiedersachsen Amtsgericht Lüneburg HRB 204265\nLöschungsankündigung\n\nTimm & Co. Finanzkonzepte UG (haftungsbeschränkt)\nGesellschaft mit beschränkter Haftung\nSchneverdingen\n\nDas Registergericht beabsichtigt, die Gesellschaft von Amts wegen nach § 394 FamFG zu löschen. Die Frist zur Erhebung eines Widerspruchs ist auf 1 Monat ab dieser Registerbekanntmachung festgesetzt."
    },
    {
      "date": "2025-12-30",
      "id": "141224",
      "original_text": "Registerbekanntmachung nach dem Umwandlungsgesetz\nNiedersachsen Amtsgericht Oldenburg (Oldenburg) HRA 208449\nBALKOW MAKLERFACHBÜRO e.K. – Oldenburg",
      "type": "Registerbekanntmachung nach dem Umwandlungsgesetz",
      "state": "Niedersachsen",
      "amtsgericht": "Amtsgericht Oldenburg (Oldenburg)",
      "registernummer": "HRA 208449",
      "registerart": "HRA",
      "company_name": "BALKOW MAKLERFACHBÜRO e.K.",
      "company_seat": "Oldenburg",
      "details": "30.12.2025 (Bekanntmachungsdatum)\n\nNiedersachsen Amtsgericht Oldenburg (Oldenburg) HRA 208449\nRegisterbekanntmachung nach dem Umwandlungsgesetz 30.12.2025 (Eintragungsdatum)\n\nBALKOW MAKLERFACHBÜRO e.K.\nEinzelkaufmann / Einzelkauffrau\nOldenburg\n\nDen Gläubigern der an der Ausgliederung beteiligten Rechtsträger ist, wenn sie binnen sechs Monaten nach dem Tag, an dem die Eintragung der Ausgliederung in das Register des Sitzes desjenigen Rechtsträgers, dessen Gläubiger sie sind, nach § 19 Abs. 3 UmwG als bekannt gemacht gilt, ihren Anspruch nach Grund und Höhe schriftlich anmelden, Sicherheit zu leisten, soweit sie nicht Befriedigung verlangen können. Dieses Recht steht den Gläubigern jedoch nur zu, wenn sie glaubhaft machen, dass durch die Ausgliederung die Erfüllung der Forderung gefährdet wird."
    },
    {
      "date": "2025-12-30",
      "id": "141225",
      "original_text": "Registerbekanntmachung nach dem Umwandlungsgesetz\nRheinland-Pfalz Amtsgericht Kaiserslautern HRB 31072\nSissi & Franz Kaiserslautern GmbH – Kaiserslautern",
      "type": "Registerbekanntmachung nach dem Umwandlungsgesetz",
      "state": "Rheinland-Pfalz",
      "amtsgericht": "Amtsgericht Kaiserslautern",
      "registernummer": "HRB 31072",
      "registerart": "HRB",
      "company_name": "Sissi & Franz Kaiserslautern GmbH",
      "company_seat": "Kaiserslautern",
      "details": "30.12.2025 (Bekanntmachungsdatum)\n\nRheinland-Pfalz Amtsgericht Kaiserslautern HRB 31072\nRegisterbekanntmachung nach dem Umwandlungsgesetz 30.12.2025 (Eintragungsdatum)\n\nSissi & Franz Kaiserslautern GmbH\nGesellschaft mit beschränkter Haftung\nKaiserslautern\n\nAls nicht eingetragen wird veröffentlicht: Den Gläubigern der an der Verschmelzung beteiligten Rechtsträger ist, wenn sie binnen sechs Monaten nach dem Tag, an dem die Eintragung der Verschmelzung in das Register des Sitzes desjenigen Rechtsträgers,dessen Gläubiger sie sind, nach § 19 Abs. 3 UmwG als bekannt gemacht gilt, ihren Anspruch nach Grund und Höhe schriftlich anmelden, Sicherheit zu leisten, soweit sie nicht Befriedigung verlangen können. Dieses Recht steht den Gläubigern jedoch nur zu, wenn sie glaubhaft machen, dass durch die Verschmelzung die Erfüllung der Forderung gefährdet wird."
    },
    {
      "date": "2025-12-30",
      "id": "141226",
      "original_text": "Einreichung neuer Dokumente\nRheinland-Pfalz Amtsgericht Ludwigshafen a.Rhein (Ludwigshafen) HRB 11701\nStrukturentwicklungsgeselIschaft für den Landkreis Bad Dürkheim m.b.H. – Bad Dürkheim",
      "type": "Einreichung neuer Dokumente",
      "state": "Rheinland-Pfalz",
      "amtsgericht": "Amtsgericht Ludwigshafen a.Rhein (Ludwigshafen)",
      "registernummer": "HRB 11701",
      "registerart": "HRB",
      "company_name": "StrukturentwicklungsgeselIschaft für den Landkreis Bad Dürkheim m.b.H.",
      "company_seat": "Bad Dürkheim",
      "details": "30.12.2025 (Bekanntmachungsdatum)\n\nRheinland-Pfalz Amtsgericht Ludwigshafen a.Rhein (Ludwigshafen) HRB 11701\nEinreichung neuer Dokumente\n\nStrukturentwicklungsgeselIschaft für den Landkreis Bad Dürkheim m.b.H.\nGesellschaft mit beschränkter Haftung\nBad Dürkheim\n\nDem Registergericht ist eine neue Liste der Mitglieder des Aufsichtsrates eingereicht worden."
    },
    {
      "date": "2025-12-30",
      "id": "141227",
      "original_text": "Registerbekanntmachung nach dem Umwandlungsgesetz\nRheinland-Pfalz Amtsgericht Kaiserslautern HRB 32359\nRuWe Gastro GmbH – Kaiserslautern",
      "type": "Registerbekanntmachung nach dem Umwandlungsgesetz",
      "state": "Rheinland-Pfalz",
      "amtsgericht": "Amtsgericht Kaiserslautern",
      "registernummer": "HRB 32359",
      "registerart": "HRB",
      "company_name": "RuWe Gastro GmbH",
      "company_seat": "Kaiserslautern",
      "details": "30.12.2025 (Bekanntmachungsdatum)\n\nRheinland-Pfalz Amtsgericht Kaiserslautern HRB 32359\nRegisterbekanntmachung nach dem Umwandlungsgesetz 30.12.2025 (Eintragungsdatum)\n\nRuWe Gastro GmbH\nGesellschaft mit beschränkter Haftung\nKaiserslautern\n\nAls nicht eingetragen wird veröffentlicht: Den Gläubigern der an der Verschmelzung beteiligten Rechtsträger ist, wenn sie binnen sechs Monaten nach dem Tag, an dem die Eintragung der Verschmelzung in das Register des Sitzes desjenigen Rechtsträgers,dessen Gläubiger sie sind, nach § 19 Abs. 3 UmwG als bekannt gemacht gilt, ihren Anspruch nach Grund und Höhe schriftlich anmelden, Sicherheit zu leisten, soweit sie nicht Befriedigung verlangen können. Dieses Recht steht den Gläubigern jedoch nur zu, wenn sie glaubhaft machen, dass durch die Verschmelzung die Erfüllung der Forderung gefährdet wird."
    },
    {
      "date": "2025-12-30",
      "id": "141228",
      "original_text": "Registerbekanntmachung nach dem Umwandlungsgesetz\nRheinland-Pfalz Amtsgericht Bad Kreuznach HRA 21281\nBurkhard Kunz Betriebswirtschaftliche Aus- und Weiterbildung e.K. – Bad Kreuznach",
      "type": "Registerbekanntmachung nach dem Umwandlungsgesetz",
      "state": "Rheinland-Pfalz",
      "amtsgericht": "Amtsgericht Bad Kreuznach",
      "registernummer": "HRA 21281",
      "registerart": "HRA",
      "company_name": "Burkhard Kunz Betriebswirtschaftliche Aus- und Weiterbildung e.K.",
      "company_seat": "Bad Kreuznach",
      "details": "30.12.2025 (Bekanntmachungsdatum)\n\nRheinland-Pfalz Amtsgericht Bad Kreuznach HRA 21281\nRegisterbekanntmachung nach dem Umwandlungsgesetz 30.12.2025 (Eintragungsdatum)\n\nBurkhard Kunz Betriebswirtschaftliche Aus- und Weiterbildung e.K.\nEinzelkaufmann / Einzelkauffrau\nBad Kreuznach\n\nAls nicht eingetragen wird veröffentlicht: Den Gläubigern der an der Ausgliederung beteiligten Rechtsträger ist, wenn sie binnen sechs Monaten nach dem Tag, an dem die Eintragung der Ausgliederung in das Register des Sitzes desjenigen Rechtsträgers, dessen Gläubiger sie sind, nach § 19 Abs. 3 UmwG als bekannt gemacht gilt, ihren Anspruch nach Grund und Höhe schriftlich anmelden, Sicherheit zu leisten, soweit sie nicht Befriedigung verlangen können. Dieses Recht steht den Gläubigern jedoch nur zu, wenn sie glaubhaft machen, dass durch die Ausgliederung die Erfüllung der Forderung gefährdet wird."
    },
    {
      "date": "2025-12-30",
      "id": "141229",
      "original_text": "Registerbekanntmachung nach dem Umwandlungsgesetz\nRheinland-Pfalz Amtsgericht Bad Kreuznach HRA 21289\nKUNZ Gesellschaft für Betriebswirtschaftliche Aus- und Weiterbildung mbH & Co. KG – Bad Kreuznach",
      "type": "Registerbekanntmachung nach dem Umwandlungsgesetz",
      "state": "Rheinland-Pfalz",
      "amtsgericht": "Amtsgericht Bad Kreuznach",
      "registernummer": "HRA 21289",
      "registerart": "HRA",
      "company_name": "KUNZ Gesellschaft für Betriebswirtschaftliche Aus- und Weiterbildung mbH & Co. KG",
      "company_seat": "Bad Kreuznach",
      "details": "30.12.2025 (Bekanntmachungsdatum)\n\nRheinland-Pfalz Amtsgericht Bad Kreuznach HRA 21289\nRegisterbekanntmachung nach dem Umwandlungsgesetz 30.12.2025 (Eintragungsdatum)\n\nKUNZ Gesellschaft für Betriebswirtschaftliche Aus- und Weiterbildung mbH & Co. KG\nKommanditgesellschaft\nBad Kreuznach\n\nAls nicht eingetragen wird veröffentlicht: Den Gläubigern der an der Ausgliederung beteiligten Rechtsträger ist, wenn sie binnen sechs Monaten nach dem Tag, an dem die Eintragung der Ausgliederung in das Register des Sitzes desjenigen Rechtsträgers, dessen Gläubiger sie sind, nach § 19 Abs. 3 UmwG als bekannt gemacht gilt, ihren Anspruch nach Grund und Höhe schriftlich anmelden, Sicherheit zu leisten, soweit sie nicht Befriedigung verlangen können. Dieses Recht steht den Gläubigern jedoch nur zu, wenn sie glaubhaft machen, dass durch die Ausgliederung die Erfüllung der Forderung gefährdet wird."
    },
    {
      "date": "2025-12-30",
      "id": "141230",
      "original_text": "Registerbekanntmachung nach dem Umwandlungsgesetz\nBremen Amtsgericht Bremen HRB 39586\nHofmeister & Meincke SE – Bremen",
      "type": "Registerbekanntmachung nach dem Umwandlungsgesetz",
      "state": "Bremen",
      "amtsgericht": "Amtsgericht Bremen",
      "registernummer": "HRB 39586",
      "registerart": "HRB",
      "company_name": "Hofmeister & Meincke SE",
      "company_seat": "Bremen",
      "details": "30.12.2025 (Bekanntmachungsdatum)\n\nBremen Amtsgericht Bremen HRB 39586\nRegisterbekanntmachung nach dem Umwandlungsgesetz 18.12.2025 (Eintragungsdatum)\n\nHofmeister & Meincke SE\nEuropäische Aktiengesellschaft (SE)\nBremen\n\nAls nicht eingetragen wird veröffentlicht: Den Gläubigern der an der Verschmelzung beteiligten Rechtsträger ist, wenn sie binnen sechs Monaten nach dem Tag, an dem die Eintragung der Verschmelzung in das Register des Sitzes desjenigen Rechtsträgers, dessen Gläubiger sie sind, als bekannt gemacht gilt, ihren Anspruch nach Grund und Höhe schriftlich anmelden, Sicherheit zu leisten, soweit sie nicht Befriedigung verlangen können. Dieses Recht steht den Gläubigern jedoch nur zu, wenn sie glaubhaft machen, dass durch die Verschmelzung die Erfüllung ihrer Forderung gefährdet wird. Das Recht, Sicherheitsleistung zu verlangen, steht Gläubigern nicht zu, die im Falle der Insolvenz ein Recht auf vorzugsweise Befriedigung aus einer Deckungsmasse haben, die nach gesetzlicher Vorschrift zu ihrem Schutz errichtet und staatlich überwacht ist."
    },
    {
      "date": "2025-12-30",
      "id": "141231",
      "original_text": "Löschungsankündigung\nBremen Amtsgericht Bremen HRB 29687\nRTL Logistics GmbH – Bremerhaven",
      "type": "Löschungsankündigung",
      "state": "Bremen",
      "amtsgericht": "Amtsgericht Bremen",
      "registernummer": "HRB 29687",
      "registerart": "HRB",
      "company_name": "RTL Logistics GmbH",
      "company_seat": "Bremerhaven",
      "details": "30.12.2025 (Bekanntmachungsdatum)\n\nBremen Amtsgericht Bremen HRB 29687\nLöschungsankündigung\n\nRTL Logistics GmbH\nGesellschaft mit beschränkter Haftung\nBremerhaven\n\nEs ist beabsichtigt die im Handelsregister eingetragene Gesellschaft von Amts wegen gemäß § 394 FamFG zu löschen. Gegen die Löschung kann beim AG Bremen schriftlich oder zu Protokoll der Geschäftsstelle Widerspruch eingelegt werden. Widerspruchsfrist 4 Wochen."
    },
    {
      "date": "2025-12-30",
      "id": "141232",
      "original_text": "Einreichung neuer Dokumente\nNordrhein-Westfalen Amtsgericht Duisburg HRB 11582\nACTEGA GmbH – Wesel",
      "type": "Einreichung neuer Dokumente",
      "state": "Nordrhein-Westfalen",
      "amtsgericht": "Amtsgericht Duisburg",
      "registernummer": "HRB 11582",
      "registerart": "HRB",
      "company_name": "ACTEGA GmbH",
      "company_seat": "Wesel",
      "details": "30.12.2025 (Bekanntmachungsdatum)\n\nNordrhein-Westfalen Amtsgericht Duisburg HRB 11582\nEinreichung neuer Dokumente\n\nACTEGA GmbH\nGesellschaft mit beschränkter Haftung\nWesel\n\nDem Registergericht ist eine neue Liste der Mitglieder des Aufsichtsrates eingereicht worden."
    },
    {
      "date": "2025-12-30",
      "id": "141233",
      "original_text": "Einreichung neuer Dokumente\nNordrhein-Westfalen Amtsgericht Düsseldorf HRB 55574\nADELTA.FINANZ AG – Düsseldorf",
      "type": "Einreichung neuer Dokumente",
      "state": "Nordrhein-Westfalen",
      "amtsgericht": "Amtsgericht Düsseldorf",
      "registernummer": "HRB 55574",
      "registerart": "HRB",
      "company_name": "ADELTA.FINANZ AG",
      "company_seat": "Düsseldorf",
      "details": "30.12.2025 (Bekanntmachungsdatum)\n\nNordrhein-Westfalen Amtsgericht Düsseldorf HRB 55574\nEinreichung neuer Dokumente 30.12.2025 (Eintragungsdatum)\n\nADELTA.FINANZ AG\nAktiengesellschaft\nDüsseldorf\n\nDem Registergericht ist ein neues Hauptversammlungsprotokoll eingereicht worden."
    },
    {
      "date": "2025-12-30",
      "id": "141234",
      "original_text": "Löschungsankündigung\nNordrhein-Westfalen Amtsgericht Düsseldorf HRB 21044\nXEO GmbH – Düsseldorf",
      "type": "Löschungsankündigung",
      "state": "Nordrhein-Westfalen",
      "amtsgericht": "Amtsgericht Düsseldorf",
      "registernummer": "HRB 21044",
      "registerart": "HRB",
      "company_name": "XEO GmbH",
      "company_seat": "Düsseldorf",
      "details": "30.12.2025 (Bekanntmachungsdatum)\n\nNordrhein-Westfalen Amtsgericht Düsseldorf HRB 21044\nLöschungsankündigung\n\nXEO GmbH\nGesellschaft mit beschränkter Haftung\nDüsseldorf\n\nDas Registergericht beabsichtigt die Gesellschaft von Amts wegen nach § 394 FamFG zu löschen. Die Frist zur Erhebung eines Widerspruchs ist auf 3 Wochen festgesetzt.\n\nRechtsbehelfsbelehrung:\nDas Widerspruchsrecht steht jedem zu, der an der Unterlassung der Löschung ein berechtigtes Interesse hat. Der Widerspruch ist bei dem Amtsgericht Düsseldorf -Registergericht-, Werdener Straße 1, 40227 Düsseldorf schriftlich in deutscher Sprache oder zur Niederschrift der Geschäftsstelle einzulegen. Der Widerspruch kann auch zur Niederschrift der Geschäftsstelle eines jeden Amtsgerichtes abgegeben werden. Die Einlegung ist auch durch Übertragung eines elektronischen Dokuments an die elektronische Poststelle des Gerichts möglich. Das elektronische Dokument muss für die Bearbeitung durch das Gericht geeignet und mit einer qualifizierten elektronischen Signatur der verantwortenden Person versehen sein oder von der verantwortenden Person signiert und auf einem sicheren Übermittlungsweg gemäß § 130a ZPO nach näherer Maßgabe der Verordnung über die technischen Rahmenbedingungen des elektronischen Rechtsverkehrs und über das besondere elektronische Behördenpostfach (BGBl. I, S.3803) eingereicht werden. Weitere Informationen erhalten Sie auf der Internetseite www.justiz.de.\nDer Widerspruch muss spätestens innerhalb der gesetzten Frist nach dem Datum der Bekanntmachung der Löschungsankündigung bei dem Amtsgericht - Registergericht - Düsseldorf eingegangen sein.  Dies gilt auch dann, wenn der Widerspruch zur Niederschrift der Geschäftsstelle eines anderen Amtsgerichtes abgegeben wurde. Die Frist beginnt mit dem Tage der Bekanntmachung der Löschungsankündigung in dem für die Bekanntmachung der Eintragungen in das Handelsregister bestimmten elektronischen Informations- und Kommunikationssystem nach § 10 des Handelsgesetzbuches. Fällt das Ende der Frist auf einen Sonntag, einen allgemeinen Feiertag oder Sonnabend, so endet die Frist mit Ablauf des nächsten Werktages.\nDer Widerspruch muss die Bezeichnung der angefochtenen Löschungsankündigung sowie die Erklärung enthalten, dass Widerspruch gegen diese Löschungsankündigung eingelegt wird. Er ist zu unterzeichnen und soll begründet werden."
    },
    {
      "date": "2025-12-30",
      "id": "141235",
      "original_text": "Registerbekanntmachung nach dem Umwandlungsgesetz\nNordrhein-Westfalen Amtsgericht Aachen HRB 24441\nThe Ark GmbH – Aachen",
      "type": "Registerbekanntmachung nach dem Umwandlungsgesetz",
      "state": "Nordrhein-Westfalen",
      "amtsgericht": "Amtsgericht Aachen",
      "registernummer": "HRB 24441",
      "registerart": "HRB",
      "company_name": "The Ark GmbH",
      "company_seat": "Aachen",
      "details": "30.12.2025 (Bekanntmachungsdatum)\n\nNordrhein-Westfalen Amtsgericht Aachen HRB 24441\nRegisterbekanntmachung nach dem Umwandlungsgesetz 30.12.2025 (Eintragungsdatum)\n\nThe Ark GmbH\nGesellschaft mit beschränkter Haftung\nAachen\n\nDen Gläubigern der an der Verschmelzung beteiligten Rechtsträger ist, wenn sie binnen sechs Monaten nach dem Tag, an dem die Eintragung der Verschmelzung in das Register des Sitzes desjenigen Rechtsträgers, dessen Gläubiger sie sind, nach § 19 Absatz 3 UmwG als bekanntgemacht gilt, ihren Anspruch nach Grund und Höhe schriftlich anmelden, Sicherheit zu leisten, soweit sie nicht Befriedigung verlangen können. Dieses Recht steht den Gläubigern jedoch nur zu, wenn sie glaubhaft machen, dass durch die Verschmelzung die Erfüllung ihrer Forderung gefährdet wird."
    },
    {
      "date": "2025-12-30",
      "id": "141236",
      "original_text": "Einreichung neuer Dokumente\nNordrhein-Westfalen Amtsgericht Wuppertal HRB 8891\nGWG Stadt- und Projektentwicklungsgesellschaft mbH – Wuppertal",
      "type": "Einreichung neuer Dokumente",
      "state": "Nordrhein-Westfalen",
      "amtsgericht": "Amtsgericht Wuppertal",
      "registernummer": "HRB 8891",
      "registerart": "HRB",
      "company_name": "GWG Stadt- und Projektentwicklungsgesellschaft mbH",
      "company_seat": "Wuppertal",
      "details": "30.12.2025 (Bekanntmachungsdatum)\n\nNordrhein-Westfalen Amtsgericht Wuppertal HRB 8891\nEinreichung neuer Dokumente 30.12.2025 (Eintragungsdatum)\n\nGWG Stadt- und Projektentwicklungsgesellschaft mbH\nGesellschaft mit beschränkter Haftung\nWuppertal\n\nDem Registergericht ist eine neue Liste der Mitglieder des Aufsichtsrates eingereicht worden."
    },
    {
      "date": "2025-12-30",
      "id": "141237",
      "original_text": "Einreichung neuer Dokumente\nNordrhein-Westfalen Amtsgericht Köln HRB 57796\nSportcast GmbH – Köln",
      "type": "Einreichung neuer Dokumente",
      "state": "Nordrhein-Westfalen",
      "amtsgericht": "Amtsgericht Köln",
      "registernummer": "HRB 57796",
      "registerart": "HRB",
      "company_name": "Sportcast GmbH",
      "company_seat": "Köln",
      "details": "30.12.2025 (Bekanntmachungsdatum)\n\nNordrhein-Westfalen Amtsgericht Köln HRB 57796\nEinreichung neuer Dokumente\n\nSportcast GmbH\nGesellschaft mit beschränkter Haftung\nKöln\n\nDem Registergericht ist eine Liste der Mitglieder des Aufsichtsrates eingereicht worden."
    },
    {
      "date": "2025-12-30",
      "id": "141238",
      "original_text": "Löschungsankündigung\nNordrhein-Westfalen Amtsgericht Gelsenkirchen HRB 12143\nCaretta Caravan GmbH – Bottrop",
      "type": "Löschungsankündigung",
      "state": "Nordrhein-Westfalen",
      "amtsgericht": "Amtsgericht Gelsenkirchen",
      "registernummer": "HRB 12143",
      "registerart": "HRB",
      "company_name": "Caretta Caravan GmbH",
      "company_seat": "Bottrop",
      "details": "30.12.2025 (Bekanntmachungsdatum)\n\nNordrhein-Westfalen Amtsgericht Gelsenkirchen HRB 12143\nLöschungsankündigung\n\nCaretta Caravan GmbH\nGesellschaft mit beschränkter Haftung\nBottrop\n\nDas Gericht beabsichtigt, die Gesellschaft Caretta Caravan GmbH mit Sitz in Bottrop, HRB 12143 Amtsgericht Gelsenkirchen, wegen Vermögenslosigkeit zu löschen.\n\nHiermit wird denjenigen, die an der Unterlassung der Löschung ein berechtigtes Interesse haben, gem. § 394 Abs. 2 FamFG Gelegenheit gegeben, gegen dieses Vorhaben binnen eines Monats nach dieser Bekanntmachung Widerspruch einzulegen. Der Widerspruch kann schriftlich oder zu Protokoll der Geschäftsstelle erhoben werden."
    },
    {
      "date": "2025-12-30",
      "id": "141239",
      "original_text": "Löschungsankündigung\nNordrhein-Westfalen Amtsgericht Hamm HRA 2477\nD & R Denzinger & Rademacher Gebäudereinigung GmbH & Co. KG – Unna",
      "type": "Löschungsankündigung",
      "state": "Nordrhein-Westfalen",
      "amtsgericht": "Amtsgericht Hamm",
      "registernummer": "HRA 2477",
      "registerart": "HRA",
      "company_name": "D & R Denzinger & Rademacher Gebäudereinigung GmbH & Co. KG",
      "company_seat": "Unna",
      "details": "30.12.2025 (Bekanntmachungsdatum)\n\nNordrhein-Westfalen Amtsgericht Hamm HRA 2477\nLöschungsankündigung\n\nD & R Denzinger & Rademacher Gebäudereinigung GmbH & Co. KG\nKommanditgesellschaft\nUnna\n\nDas Registergericht beabsichtigt die Firma von Amts wegen nach § 394 FamFG zu löschen. Die Frist zur Erhebung eines Widerspruchs ist auf drei Monate festgesetzt."
    },
    {
      "date": "2025-12-30",
      "id": "141240",
      "original_text": "Registerbekanntmachung nach dem Umwandlungsgesetz\nNordrhein-Westfalen Amtsgericht Düsseldorf HRA 25956\nWattner SunAsset Solarkraftwerk 012 GmbH & Co. KG – Monheim am Rhein",
      "type": "Registerbekanntmachung nach dem Umwandlungsgesetz",
      "state": "Nordrhein-Westfalen",
      "amtsgericht": "Amtsgericht Düsseldorf",
      "registernummer": "HRA 25956",
      "registerart": "HRA",
      "company_name": "Wattner SunAsset Solarkraftwerk 012 GmbH & Co. KG",
      "company_seat": "Monheim am Rhein",
      "details": "30.12.2025 (Bekanntmachungsdatum)\n\nNordrhein-Westfalen Amtsgericht Düsseldorf HRA 25956\nRegisterbekanntmachung nach dem Umwandlungsgesetz 30.12.2025 (Eintragungsdatum)\n\nWattner SunAsset Solarkraftwerk 012 GmbH & Co. KG\nKommanditgesellschaft\nMonheim am Rhein\n\nDen Gläubigern der an der Verschmelzung beteiligten Rechtsträger ist, wenn sie binnen sechs Monaten nach dem Tag, an dem die Eintragung der Verschmelzung in das Register des Sitzes derjenigen Rechtsträger deren Gläubiger sie sind, nach § 19 Absatz 3 UmwG als bekanntgemacht gilt, ihren Anspruch nach Grund und Höhe schriftlich anmelden, Sicherheit zu leisten, soweit sie nicht Befriedigung verlangen können. Dieses Recht steht den Gläubigern jedoch nur zu, wenn sie glaubhaft machen, dass durch die Verschmelzung die Erfüllung ihrer Forderung gefährdet wird."
    },
    {
      "date": "2025-12-30",
      "id": "141241",
      "original_text": "Registerbekanntmachung nach dem Umwandlungsgesetz\nNordrhein-Westfalen Amtsgericht Bad Oeynhausen HRB 20249\nTappe+Scholz GmbH – Hiddenhausen",
      "type": "Registerbekanntmachung nach dem Umwandlungsgesetz",
      "state": "Nordrhein-Westfalen",
      "amtsgericht": "Amtsgericht Bad Oeynhausen",
      "registernummer": "HRB 20249",
      "registerart": "HRB",
      "company_name": "Tappe+Scholz GmbH",
      "company_seat": "Hiddenhausen",
      "details": "30.12.2025 (Bekanntmachungsdatum)\n\nNordrhein-Westfalen Amtsgericht Bad Oeynhausen HRB 20249\nRegisterbekanntmachung nach dem Umwandlungsgesetz 23.12.2025 (Eintragungsdatum)\n\nTappe+Scholz GmbH\nGesellschaft mit beschränkter Haftung\nHiddenhausen\n\nDen Gläubigern der an der Verschmelzung beteiligten Rechtsträger ist, wenn sie binnen sechs Monaten nach dem Tag, an dem die Eintragung der Verschmelzung in das Register des Sitzes desjenigen Rechtsträgers, dessen Gläubiger sie sind, nach § 19 Absatz 3 UmwG als bekanntgemacht gilt, ihren Anspruch nach Grund und Höhe schriftlich anmelden, Sicherheit zu leisten, soweit sie nicht Befriedigung verlangen können. Dieses Recht steht den Gläubigern jedoch nur zu, wenn sie glaubhaft machen, dass durch die Verschmelzung die Erfüllung ihrer Forderung gefährdet wird."
    },
    {
      "date": "2025-12-30",
      "id": "141242",
      "original_text": "Registerbekanntmachung nach dem Umwandlungsgesetz\nNordrhein-Westfalen Amtsgericht Düsseldorf HRA 25956\nWattner SunAsset Solarkraftwerk 012 GmbH & Co. KG – Monheim am Rhein",
      "type": "Registerbekanntmachung nach dem Umwandlungsgesetz",
      "state": "Nordrhein-Westfalen",
      "amtsgericht": "Amtsgericht Düsseldorf",
      "registernummer": "HRA 25956",
      "registerart": "HRA",
      "company_name": "Wattner SunAsset Solarkraftwerk 012 GmbH & Co. KG",
      "company_seat": "Monheim am Rhein",
      "details": "30.12.2025 (Bekanntmachungsdatum)\n\nNordrhein-Westfalen Amtsgericht Düsseldorf HRA 25956\nRegisterbekanntmachung nach dem Umwandlungsgesetz 30.12.2025 (Eintragungsdatum)\n\nWattner SunAsset Solarkraftwerk 012 GmbH & Co. KG\nKommanditgesellschaft\nMonheim am Rhein\n\nDen Gläubigern der an der Verschmelzung beteiligten Rechtsträger ist, wenn sie binnen sechs Monaten nach dem Tag, an dem die Eintragung der Verschmelzung in das Register des Sitzes derjenigen Rechtsträger deren Gläubiger sie sind, nach § 19 Absatz 3 UmwG als bekanntgemacht gilt, ihren Anspruch nach Grund und Höhe schriftlich anmelden, Sicherheit zu leisten, soweit sie nicht Befriedigung verlangen können. Dieses Recht steht den Gläubigern jedoch nur zu, wenn sie glaubhaft machen, dass durch die Verschmelzung die Erfüllung ihrer Forderung gefährdet wird."
    },
    {
      "date": "2025-12-30",
      "id": "141243",
      "original_text": "Registerbekanntmachung nach dem Umwandlungsgesetz\nNordrhein-Westfalen Amtsgericht Düsseldorf HRA 25940\nWattner SunAsset Solarkraftwerk 025 GmbH & Co. KG – Monheim am Rhein",
      "type": "Registerbekanntmachung nach dem Umwandlungsgesetz",
      "state": "Nordrhein-Westfalen",
      "amtsgericht": "Amtsgericht Düsseldorf",
      "registernummer": "HRA 25940",
      "registerart": "HRA",
      "company_name": "Wattner SunAsset Solarkraftwerk 025 GmbH & Co. KG",
      "company_seat": "Monheim am Rhein",
      "details": "30.12.2025 (Bekanntmachungsdatum)\n\nNordrhein-Westfalen Amtsgericht Düsseldorf HRA 25940\nRegisterbekanntmachung nach dem Umwandlungsgesetz 30.12.2025 (Eintragungsdatum)\n\nWattner SunAsset Solarkraftwerk 025 GmbH & Co. KG\nKommanditgesellschaft\nMonheim am Rhein\n\nDen Gläubigern der an der Verschmelzung beteiligten Rechtsträger ist, wenn sie binnen sechs Monaten nach dem Tag, an dem die Eintragung der Verschmelzung in das Register des Sitzes derjenigen Rechtsträger deren Gläubiger sie sind, nach § 19 Absatz 3 UmwG als bekanntgemacht gilt, ihren Anspruch nach Grund und Höhe schriftlich anmelden, Sicherheit zu leisten, soweit sie nicht Befriedigung verlangen können. Dieses Recht steht den Gläubigern jedoch nur zu, wenn sie glaubhaft machen, dass durch die Verschmelzung die Erfüllung ihrer Forderung gefährdet wird."
    },
    {
      "date": "2025-12-30",
      "id": "141244",
      "original_text": "Registerbekanntmachung nach dem Umwandlungsgesetz\nNordrhein-Westfalen Amtsgericht Bad Oeynhausen HRB 4282\nKAVG Kreisabfallverwertungsgesellschaft mbH Minden-Lübbecke – Hille",
      "type": "Registerbekanntmachung nach dem Umwandlungsgesetz",
      "state": "Nordrhein-Westfalen",
      "amtsgericht": "Amtsgericht Bad Oeynhausen",
      "registernummer": "HRB 4282",
      "registerart": "HRB",
      "company_name": "KAVG Kreisabfallverwertungsgesellschaft mbH Minden-Lübbecke",
      "company_seat": "Hille",
      "details": "30.12.2025 (Bekanntmachungsdatum)\n\nNordrhein-Westfalen Amtsgericht Bad Oeynhausen HRB 4282\nRegisterbekanntmachung nach dem Umwandlungsgesetz 30.12.2025 (Eintragungsdatum)\n\nKAVG Kreisabfallverwertungsgesellschaft mbH Minden-Lübbecke\nGesellschaft mit beschränkter Haftung\nHille\n\nDen Gläubigern der an der Vermögensübertragung beteiligten Rechtsträger ist, wenn sie binnen sechs Monaten nach dem Tag, an dem die Eintragung der Vermögensübertragung in das Register des Sitzes desjenigen Rechtsträgers, dessen Gläubiger sie sind, nach § 19 Absatz 3 UmwG als bekanntgemacht gilt, ihren Anspruch nach Grund und Höhe schriftlich anmelden, Sicherheit zu leisten, soweit sie nicht Befriedigung verlangen können. Dieses Recht steht den Gläubigern jedoch nur zu, wenn sie glaubhaft machen, dass durch die Vermögensübertragung die Erfüllung ihrer Forderung gefährdet wird."
    },
    {
      "date": "2025-12-30",
      "id": "141245",
      "original_text": "Registerbekanntmachung nach dem Umwandlungsgesetz\nNordrhein-Westfalen Amtsgericht Aachen HRB 12497\nAudit Pro GmbH – Aachen",
      "type": "Registerbekanntmachung nach dem Umwandlungsgesetz",
      "state": "Nordrhein-Westfalen",
      "amtsgericht": "Amtsgericht Aachen",
      "registernummer": "HRB 12497",
      "registerart": "HRB",
      "company_name": "Audit Pro GmbH",
      "company_seat": "Aachen",
      "details": "30.12.2025 (Bekanntmachungsdatum)\n\nNordrhein-Westfalen Amtsgericht Aachen HRB 12497\nRegisterbekanntmachung nach dem Umwandlungsgesetz 30.12.2025 (Eintragungsdatum)\n\nAudit Pro GmbH\nGesellschaft mit beschränkter Haftung\nAachen\n\nDen Gläubigern der an der Verschmelzung beteiligten Rechtsträger ist, wenn sie binnen sechs Monaten nach dem Tag, an dem die Eintragung der Verschmelzung in das Register des Sitzes desjenigen Rechtsträgers, dessen Gläubiger sie sind, nach § 19 Absatz 3 UmwG als bekanntgemacht gilt, ihren Anspruch nach Grund und Höhe schriftlich anmelden, Sicherheit zu leisten, soweit sie nicht Befriedigung verlangen können. Dieses Recht steht den Gläubigern jedoch nur zu, wenn sie glaubhaft machen, dass durch die Verschmelzung die Erfüllung ihrer Forderung gefährdet wird."
    },
    {
      "date": "2025-12-30",
      "id": "141246",
      "original_text": "Löschungsankündigung\nNordrhein-Westfalen Amtsgericht Gelsenkirchen HRB 19001\nVEDO GmbH – Gelsenkirchen",
      "type": "Löschungsankündigung",
      "state": "Nordrhein-Westfalen",
      "amtsgericht": "Amtsgericht Gelsenkirchen",
      "registernummer": "HRB 19001",
      "registerart": "HRB",
      "company_name": "VEDO GmbH",
      "company_seat": "Gelsenkirchen",
      "details": "30.12.2025 (Bekanntmachungsdatum)\n\nNordrhein-Westfalen Amtsgericht Gelsenkirchen HRB 19001\nLöschungsankündigung\n\nVEDO GmbH\nGesellschaft mit beschränkter Haftung\nGelsenkirchen\n\nDas Gericht beabsichtigt, die Gesellschaft VEDO GmbH mit Sitz in Gelsenkirchen, HRB 19001 Amtsgericht Gelsenkirchen, wegen Vermögenslosigkeit zu löschen.\n\nHiermit wird denjenigen, die an der Unterlassung der Löschung ein berechtigtes Interesse haben, gem. § 394 Abs. 2 FamFG Gelegenheit gegeben, gegen dieses Vorhaben binnen eines Monats nach dieser Bekanntmachung Widerspruch einzulegen. Der Widerspruch kann schriftlich oder zu Protokoll der Geschäftsstelle erhoben werden."
    },
    {
      "date": "2025-12-30",
      "id": "141247",
      "original_text": "Sonstige Registerbekanntmachung\nNordrhein-Westfalen Amtsgericht Hagen HRB 3262\nHUI GmbH Hagener Umweltservice- und Investitionsgesellschaft – Hagen",
      "type": "Sonstige Registerbekanntmachung",
      "state": "Nordrhein-Westfalen",
      "amtsgericht": "Amtsgericht Hagen",
      "registernummer": "HRB 3262",
      "registerart": "HRB",
      "company_name": "HUI GmbH Hagener Umweltservice- und Investitionsgesellschaft",
      "company_seat": "Hagen",
      "details": "30.12.2025 (Bekanntmachungsdatum)\n\nNordrhein-Westfalen Amtsgericht Hagen HRB 3262\nSonstige Registerbekanntmachung\n\nHUI GmbH Hagener Umweltservice- und Investitionsgesellschaft\nGesellschaft mit beschränkter Haftung\nHagen\n\nDem Registergericht ist eine Liste der Mitglieder des Aufsichtsrates eingereicht worden."
    },
    {
      "date": "2025-12-30",
      "id": "141248",
      "original_text": "Sonstige Registerbekanntmachung\nNordrhein-Westfalen Amtsgericht Düsseldorf HRB 87043\nAttikon Finanz Aktiengesellschaft – Düsseldorf",
      "type": "Sonstige Registerbekanntmachung",
      "state": "Nordrhein-Westfalen",
      "amtsgericht": "Amtsgericht Düsseldorf",
      "registernummer": "HRB 87043",
      "registerart": "HRB",
      "company_name": "Attikon Finanz Aktiengesellschaft",
      "company_seat": "Düsseldorf",
      "details": "30.12.2025 (Bekanntmachungsdatum)\n\nNordrhein-Westfalen Amtsgericht Düsseldorf HRB 87043\nSonstige Registerbekanntmachung\n\nAttikon Finanz Aktiengesellschaft\nAktiengesellschaft\nDüsseldorf\n\nDem Registergericht ist eine Liste der Mitglieder des Aufsichtsrates eingereicht worden."
    },
    {
      "date": "2025-12-30",
      "id": "141249",
      "original_text": "Registerbekanntmachung nach dem Umwandlungsgesetz\nNordrhein-Westfalen Amtsgericht Düsseldorf HRB 100672\nKUCHEL Werkzeugtechnik GmbH – Düsseldorf",
      "type": "Registerbekanntmachung nach dem Umwandlungsgesetz",
      "state": "Nordrhein-Westfalen",
      "amtsgericht": "Amtsgericht Düsseldorf",
      "registernummer": "HRB 100672",
      "registerart": "HRB",
      "company_name": "KUCHEL Werkzeugtechnik GmbH",
      "company_seat": "Düsseldorf",
      "details": "30.12.2025 (Bekanntmachungsdatum)\n\nNordrhein-Westfalen Amtsgericht Düsseldorf HRB 100672\nRegisterbekanntmachung nach dem Umwandlungsgesetz 30.12.2025 (Eintragungsdatum)\n\nKUCHEL Werkzeugtechnik GmbH\nGesellschaft mit beschränkter Haftung\nDüsseldorf\n\nDen Gläubigern der an der Verschmelzung beteiligten Rechtsträger ist, wenn sie binnen sechs Monaten nach dem Tag, an dem die Eintragung der Verschmelzung in das Register des Sitzes desjenigen Rechtsträgers, dessen Gläubiger sie sind, nach § 19 Absatz 3 UmwG als bekanntgemacht gilt, ihren Anspruch nach Grund und Höhe schriftlich anmelden, Sicherheit zu leisten, soweit sie nicht Befriedigung verlangen können. Dieses Recht steht den Gläubigern jedoch nur zu, wenn sie glaubhaft machen, dass durch die Verschmelzung die Erfüllung ihrer Forderung gefährdet wird."
    },
    {
      "date": "2025-12-30",
      "id": "141250",
      "original_text": "Registerbekanntmachung nach dem Umwandlungsgesetz\nNordrhein-Westfalen Amtsgericht Düsseldorf HRA 28493\nPalais Vest GmbH & Co. KG – Düsseldorf",
      "type": "Registerbekanntmachung nach dem Umwandlungsgesetz",
      "state": "Nordrhein-Westfalen",
      "amtsgericht": "Amtsgericht Düsseldorf",
      "registernummer": "HRA 28493",
      "registerart": "HRA",
      "company_name": "Palais Vest GmbH & Co. KG",
      "company_seat": "Düsseldorf",
      "details": "30.12.2025 (Bekanntmachungsdatum)\n\nNordrhein-Westfalen Amtsgericht Düsseldorf HRA 28493\nRegisterbekanntmachung nach dem Umwandlungsgesetz 30.12.2025 (Eintragungsdatum)\n\nPalais Vest GmbH & Co. KG\nKommanditgesellschaft\nDüsseldorf\n\nDen Gläubigern der an der formwechselnden Umwandlung beteiligten Rechtsträger ist, wenn sie binnen sechs Monaten nach dem Tag, an dem die Eintragung der formwechselnden Umwandlung in das Register des Sitzes desjenigen Rechtsträgers, dessen Gläubiger sie sind, nach § 19 Absatz 3 UmwG als bekanntgemacht gilt, ihren Anspruch nach Grund und Höhe schriftlich anmelden, Sicherheit zu leisten, soweit sie nicht Befriedigung verlangen können. Dieses Recht steht den Gläubigern jedoch nur zu, wenn sie glaubhaft machen, dass durch die formwechselnden Umwandlung die Erfüllung ihrer Forderung gefährdet wird."
    },
    {
      "date": "2025-12-30",
      "id": "141251",
      "original_text": "Löschungsankündigung\nNordrhein-Westfalen Amtsgericht Dortmund HRB 26955\nNIC Consulting GmbH – Dortmund",
      "type": "Löschungsankündigung",
      "state": "Nordrhein-Westfalen",
      "amtsgericht": "Amtsgericht Dortmund",
      "registernummer": "HRB 26955",
      "registerart": "HRB",
      "company_name": "NIC Consulting GmbH",
      "company_seat": "Dortmund",
      "details": "30.12.2025 (Bekanntmachungsdatum)\n\nNordrhein-Westfalen Amtsgericht Dortmund HRB 26955\nLöschungsankündigung\n\nNIC Consulting GmbH\nGesellschaft mit beschränkter Haftung\nDortmund\n\nDas Registergericht beabsichtigt die Gesellschaft von Amts wegen nach § 394 FamFG zu löschen. Die Frist zur Erhebung eines Widerspruchs ist auf zwei Monate festgesetzt."
    },
    {
      "date": "2025-12-30",
      "id": "141252",
      "original_text": "Löschungsankündigung\nNordrhein-Westfalen Amtsgericht Düsseldorf HRB 96425\nVERTEX STAHLHANDEL UG (haftungsbeschränkt) – Düsseldorf",
      "type": "Löschungsankündigung",
      "state": "Nordrhein-Westfalen",
      "amtsgericht": "Amtsgericht Düsseldorf",
      "registernummer": "HRB 96425",
      "registerart": "HRB",
      "company_name": "VERTEX STAHLHANDEL UG (haftungsbeschränkt)",
      "company_seat": "Düsseldorf",
      "details": "30.12.2025 (Bekanntmachungsdatum)\n\nNordrhein-Westfalen Amtsgericht Düsseldorf HRB 96425\nLöschungsankündigung\n\nVERTEX STAHLHANDEL UG (haftungsbeschränkt)\nGesellschaft mit beschränkter Haftung\nDüsseldorf\n\nBetr.: VERTEX STAHLHANDEL UG (haftungsbeschränkt), Beedstr. 54, 40468 Düsseldorf\n\nDas Registergericht beabsichtigt die Gesellschaft von Amts wegen nach § 394 FamFG zu löschen. Die Frist zur Erhebung eines Widerspruchs ist auf 3 Wochen festgesetzt.\n\nRechtsbehelfsbelehrung:\n\nDas Widerspruchsrecht steht jedem zu, der an der Unterlassung der Löschung ein berechtigtes Interesse hat. Der Widerspruch ist bei dem Amtsgericht Düsseldorf -Registergericht-, Werdener Straße 1, 40227 Düsseldorf schriftlich in deutscher Sprache oder zur Niederschrift der Geschäftsstelle einzulegen. Der Widerspruch kann auch zur Niederschrift der Geschäftsstelle eines jeden Amtsgerichtes abgegeben werden. Die Einlegung ist auch durch Übertragung eines elektronischen Dokuments an die elektronische Poststelle des Gerichts möglich. Das elektronische Dokument muss für die Bearbeitung durch das Gericht geeignet und mit einer qualifizierten elektronischen Signatur der verantwortenden Person versehen sein oder von der verantwortenden Person signiert und auf einem sicheren Übermittlungsweg gemäß § 130a ZPO nach näherer Maßgabe der Verordnung über die technischen Rahmenbedingungen des elektronischen Rechtsverkehrs und über das besondere elektronische Behördenpostfach (BGBl. I, S.3803) eingereicht werden. Weitere Informationen erhalten Sie auf der Internetseite www.justiz.de.\nDer Widerspruch muss spätestens innerhalb der gesetzten Frist nach dem Datum der Bekanntmachung der Löschungsankündigung bei dem Amtsgericht - Registergericht - Düsseldorf eingegangen sein.  Dies gilt auch dann, wenn der Widerspruch zur Niederschrift der Geschäftsstelle eines anderen Amtsgerichtes abgegeben wurde. Die Frist beginnt mit dem Tage der Bekanntmachung der Löschungsankündigung in dem für die Bekanntmachung der Eintragungen in das Handelsregister bestimmten elektronischen Informations- und Kommunikationssystem nach § 10 des Handelsgesetzbuches. Fällt das Ende der Frist auf einen Sonntag, einen allgemeinen Feiertag oder Sonnabend, so endet die Frist mit Ablauf des nächsten Werktages.\nDer Widerspruch muss die Bezeichnung der angefochtenen Löschungsankündigung sowie die Erklärung enthalten, dass Widerspruch gegen diese Löschungsankündigung eingelegt wird. Er ist zu unterzeichnen und soll begründet werden."
    },
    {
      "date": "2025-12-30",
      "id": "141253",
      "original_text": "Löschungsankündigung\nNordrhein-Westfalen Amtsgericht Wuppertal HRB 31944\nJT Gebäudetechnik GmbH – Heiligenhaus",
      "type": "Löschungsankündigung",
      "state": "Nordrhein-Westfalen",
      "amtsgericht": "Amtsgericht Wuppertal",
      "registernummer": "HRB 31944",
      "registerart": "HRB",
      "company_name": "JT Gebäudetechnik GmbH",
      "company_seat": "Heiligenhaus",
      "details": "30.12.2025 (Bekanntmachungsdatum)\n\nNordrhein-Westfalen Amtsgericht Wuppertal HRB 31944\nLöschungsankündigung\n\nJT Gebäudetechnik GmbH\nGesellschaft mit beschränkter Haftung\nHeiligenhaus\n\nDas Registergericht beabsichtigt die Gesellschaft von Amts wegen nach § 394 FamFG zu löschen. Die Frist zur Erhebung eines Widerspruchs ist auf einen Monat festgesetzt."
    },
    {
      "date": "2025-12-30",
      "id": "141254",
      "original_text": "Registerbekanntmachung nach dem Umwandlungsgesetz\nNordrhein-Westfalen Amtsgericht Düsseldorf HRB 48555\nRheinstahl Union Gesellschaft mit beschränkter Haftung – Düsseldorf",
      "type": "Registerbekanntmachung nach dem Umwandlungsgesetz",
      "state": "Nordrhein-Westfalen",
      "amtsgericht": "Amtsgericht Düsseldorf",
      "registernummer": "HRB 48555",
      "registerart": "HRB",
      "company_name": "Rheinstahl Union Gesellschaft mit beschränkter Haftung",
      "company_seat": "Düsseldorf",
      "details": "30.12.2025 (Bekanntmachungsdatum)\n\nNordrhein-Westfalen Amtsgericht Düsseldorf HRB 48555\nRegisterbekanntmachung nach dem Umwandlungsgesetz 30.12.2025 (Eintragungsdatum)\n\nRheinstahl Union Gesellschaft mit beschränkter Haftung\nGesellschaft mit beschränkter Haftung\nDüsseldorf\n\nDen Gläubigern der an der Verschmelzung beteiligten Rechtsträger ist, wenn sie binnen sechs Monaten nach dem Tag, an dem die Eintragung der Verschmelzung in das Register des Sitzes desjenigen Rechtsträgers, dessen Gläubiger sie sind, nach § 19 Absatz 3 UmwG als bekanntgemacht gilt, ihren Anspruch nach Grund und Höhe schriftlich anmelden, Sicherheit zu leisten, soweit sie nicht Befriedigung verlangen können. Dieses Recht steht den Gläubigern jedoch nur zu, wenn sie glaubhaft machen, dass durch die Verschmelzung die Erfüllung ihrer Forderung gefährdet wird."
    },
    {
      "date": "2025-12-30",
      "id": "141255",
      "original_text": "Registerbekanntmachung nach dem Umwandlungsgesetz\nNordrhein-Westfalen Amtsgericht Dortmund HRB 37735\nFenSon GmbH – Dortmund",
      "type": "Registerbekanntmachung nach dem Umwandlungsgesetz",
      "state": "Nordrhein-Westfalen",
      "amtsgericht": "Amtsgericht Dortmund",
      "registernummer": "HRB 37735",
      "registerart": "HRB",
      "company_name": "FenSon GmbH",
      "company_seat": "Dortmund",
      "details": "30.12.2025 (Bekanntmachungsdatum)\n\nNordrhein-Westfalen Amtsgericht Dortmund HRB 37735\nRegisterbekanntmachung nach dem Umwandlungsgesetz 30.12.2025 (Eintragungsdatum)\n\nFenSon GmbH\nGesellschaft mit beschränkter Haftung\nDortmund\n\nDen Gläubigern der an der Ausgliederung beteiligten Rechtsträger ist, wenn sie binnen sechs Monaten nach dem Tag, an dem die Eintragung der Ausgliederung in das Register des Sitzes desjenigen Rechtsträgers, dessen Gläubiger sie sind, nach § 19 Absatz 3 UmwG als bekanntgemacht gilt, ihren Anspruch nach Grund und Höhe schriftlich anmelden, Sicherheit zu leisten, soweit sie nicht Befriedigung verlangen können. Dieses Recht steht den Gläubigern jedoch nur zu, wenn sie glaubhaft machen, dass durch die Ausgliederung die Erfüllung ihrer Forderung gefährdet wird."
    },
    {
      "date": "2025-12-30",
      "id": "141256",
      "original_text": "Löschungsankündigung\nNordrhein-Westfalen Amtsgericht Düsseldorf HRB 100160\nFarringa Y UG (haftungsbeschränkt) – Düsseldorf",
      "type": "Löschungsankündigung",
      "state": "Nordrhein-Westfalen",
      "amtsgericht": "Amtsgericht Düsseldorf",
      "registernummer": "HRB 100160",
      "registerart": "HRB",
      "company_name": "Farringa Y UG (haftungsbeschränkt)",
      "company_seat": "Düsseldorf",
      "details": "30.12.2025 (Bekanntmachungsdatum)\n\nNordrhein-Westfalen Amtsgericht Düsseldorf HRB 100160\nLöschungsankündigung\n\nFarringa Y UG (haftungsbeschränkt)\nGesellschaft mit beschränkter Haftung\nDüsseldorf\n\nDas Registergericht beabsichtigt die Gesellschaft von Amts wegen nach § 394 Abs. 1 FamFG zu löschen. Die Frist zur Erhebung eines Widerspruchs ist auf 3 Wochen festgesetzt.\n\nRechtsbehelfsbelehrung:\nDas Widerspruchsrecht steht jedem zu, der an der Unterlassung der Löschung ein berechtigtes Interesse hat. Der Widerspruch ist bei dem Amtsgericht Düsseldorf -Registergericht-, Werdener Straße 1, 40227 Düsseldorf schriftlich in deutscher Sprache oder zur Niederschrift der Geschäftsstelle einzulegen. Der Widerspruch kann auch zur Niederschrift der Geschäftsstelle eines jeden Amtsgerichtes abgegeben werden. Die Einlegung ist auch durch Übertragung eines elektronischen Dokuments an die elektronische Poststelle des Gerichts möglich. Das elektronische Dokument muss für die Bearbeitung durch das Gericht geeignet und mit einer qualifizierten elektronischen Signatur der verantwortenden Person versehen sein oder von der verantwortenden Person signiert und auf einem sicheren Übermittlungsweg gemäß § 130a ZPO nach näherer Maßgabe der Verordnung über die technischen Rahmenbedingungen des elektronischen Rechtsverkehrs und über das besondere elektronische Behördenpostfach (BGBl. I, S.3803) eingereicht werden. Weitere Informationen erhalten Sie auf der Internetseite www.justiz.de.\nDer Widerspruch muss spätestens innerhalb der gesetzten Frist nach dem Datum der Bekanntmachung der Löschungsankündigung bei dem Amtsgericht - Registergericht - Düsseldorf eingegangen sein.  Dies gilt auch dann, wenn der Widerspruch zur Niederschrift der Geschäftsstelle eines anderen Amtsgerichtes abgegeben wurde. Die Frist beginnt mit dem Tage der Bekanntmachung der Löschungsankündigung in dem für die Bekanntmachung der Eintragungen in das Handelsregister bestimmten elektronischen Informations- und Kommunikationssystem nach § 10 des Handelsgesetzbuches. Fällt das Ende der Frist auf einen Sonntag, einen allgemeinen Feiertag oder Sonnabend, so endet die Frist mit Ablauf des nächsten Werktages.\nDer Widerspruch muss die Bezeichnung der angefochtenen Löschungsankündigung sowie die Erklärung enthalten, dass Widerspruch gegen diese Löschungsankündigung eingelegt wird. Er ist zu unterzeichnen und soll begründet werden."
    },
    {
      "date": "2025-12-30",
      "id": "141257",
      "original_text": "Sonstige Registerbekanntmachung\nNordrhein-Westfalen Amtsgericht Hagen HRB 3642\nHEB GmbH Hagener Entsorgungsbetrieb – Hagen",
      "type": "Sonstige Registerbekanntmachung",
      "state": "Nordrhein-Westfalen",
      "amtsgericht": "Amtsgericht Hagen",
      "registernummer": "HRB 3642",
      "registerart": "HRB",
      "company_name": "HEB GmbH Hagener Entsorgungsbetrieb",
      "company_seat": "Hagen",
      "details": "30.12.2025 (Bekanntmachungsdatum)\n\nNordrhein-Westfalen Amtsgericht Hagen HRB 3642\nSonstige Registerbekanntmachung\n\nHEB GmbH Hagener Entsorgungsbetrieb\nGesellschaft mit beschränkter Haftung\nHagen\n\nDem Registergericht ist eine Liste der Mitglieder des Aufsichtsrates eingereicht worden."
    },
    {
      "date": "2025-12-30",
      "id": "141258",
      "original_text": "Einreichung neuer Dokumente\nNordrhein-Westfalen Amtsgericht Bochum HRB 6886\nG DATA CyberDefense AG – Bochum",
      "type": "Einreichung neuer Dokumente",
      "state": "Nordrhein-Westfalen",
      "amtsgericht": "Amtsgericht Bochum",
      "registernummer": "HRB 6886",
      "registerart": "HRB",
      "company_name": "G DATA CyberDefense AG",
      "company_seat": "Bochum",
      "details": "30.12.2025 (Bekanntmachungsdatum)\n\nNordrhein-Westfalen Amtsgericht Bochum HRB 6886\nEinreichung neuer Dokumente\n\nG DATA CyberDefense AG\nAktiengesellschaft\nBochum\n\nDem Registergericht ist eine neue Liste der Mitglieder des Aufsichtsrates eingereicht worden."
    },
    {
      "date": "2025-12-30",
      "id": "141259",
      "original_text": "Registerbekanntmachung nach dem Umwandlungsgesetz\nNordrhein-Westfalen Amtsgericht Köln HRB 116884\nVendingGalaxy GmbH – Köln",
      "type": "Registerbekanntmachung nach dem Umwandlungsgesetz",
      "state": "Nordrhein-Westfalen",
      "amtsgericht": "Amtsgericht Köln",
      "registernummer": "HRB 116884",
      "registerart": "HRB",
      "company_name": "VendingGalaxy GmbH",
      "company_seat": "Köln",
      "details": "30.12.2025 (Bekanntmachungsdatum)\n\nNordrhein-Westfalen Amtsgericht Köln HRB 116884\nRegisterbekanntmachung nach dem Umwandlungsgesetz 30.12.2025 (Eintragungsdatum)\n\nVendingGalaxy GmbH\nGesellschaft mit beschränkter Haftung\nKöln\n\nDen Gläubigern der an der Verschmelzung beteiligten Rechtsträger ist, wenn sie binnen sechs Monaten nach dem Tag, an dem die Eintragung der Verschmelzung in das Register des Sitzes desjenigen Rechtsträgers, dessen Gläubiger sie sind, nach § 19 Absatz 3 UmwG als bekanntgemacht gilt, ihren Anspruch nach Grund und Höhe schriftlich anmelden, Sicherheit zu leisten, soweit sie nicht Befriedigung verlangen können. Dieses Recht steht den Gläubigern jedoch nur zu, wenn sie glaubhaft machen, dass durch die Verschmelzung die Erfüllung ihrer Forderung gefährdet wird."
    },
    {
      "date": "2025-12-30",
      "id": "141260",
      "original_text": "Registerbekanntmachung nach dem Umwandlungsgesetz\nNordrhein-Westfalen Amtsgericht Münster HRA 11526\nLymphatica GmbH & Co. KG – Münster",
      "type": "Registerbekanntmachung nach dem Umwandlungsgesetz",
      "state": "Nordrhein-Westfalen",
      "amtsgericht": "Amtsgericht Münster",
      "registernummer": "HRA 11526",
      "registerart": "HRA",
      "company_name": "Lymphatica GmbH & Co. KG",
      "company_seat": "Münster",
      "details": "30.12.2025 (Bekanntmachungsdatum)\n\nNordrhein-Westfalen Amtsgericht Münster HRA 11526\nRegisterbekanntmachung nach dem Umwandlungsgesetz 30.12.2025 (Eintragungsdatum)\n\nLymphatica GmbH & Co. KG\nKommanditgesellschaft\nMünster\n\nDen Gläubigern der an der Verschmelzung beteiligten Rechtsträger ist, wenn sie binnen sechs Monaten nach dem Tag, an dem die Eintragung der Verschmelzung in das Register des Sitzes desjenigen Rechtsträgers, dessen Gläubiger sie sind, nach § 19 Absatz 3 UmwG als bekanntgemacht gilt, ihren Anspruch nach Grund und Höhe schriftlich anmelden, Sicherheit zu leisten, soweit sie nicht Befriedigung verlangen können. Dieses Recht steht den Gläubigern jedoch nur zu, wenn sie glaubhaft machen, dass durch die Verschmelzung die Erfüllung ihrer Forderung gefährdet wird."
    },
    {
      "date": "2025-12-30",
      "id": "141261",
      "original_text": "Registerbekanntmachung nach dem Umwandlungsgesetz\nNordrhein-Westfalen Amtsgericht Dortmund HRB 32800\ngetKPI UG (haftungsbeschränkt) – Dortmund",
      "type": "Registerbekanntmachung nach dem Umwandlungsgesetz",
      "state": "Nordrhein-Westfalen",
      "amtsgericht": "Amtsgericht Dortmund",
      "registernummer": "HRB 32800",
      "registerart": "HRB",
      "company_name": "getKPI UG (haftungsbeschränkt)",
      "company_seat": "Dortmund",
      "details": "30.12.2025 (Bekanntmachungsdatum)\n\nNordrhein-Westfalen Amtsgericht Dortmund HRB 32800\nRegisterbekanntmachung nach dem Umwandlungsgesetz 30.12.2025 (Eintragungsdatum)\n\ngetKPI UG (haftungsbeschränkt)\nGesellschaft mit beschränkter Haftung\nDortmund\n\nDie Gesellschaft hat Gläubigern, deren Forderungen vor dieser Bekanntmachung begründet worden sind, Sicherheit zu leisten, soweit sie nicht Befriedigung verlangen können, wenn sie sich binnen sechs Monaten zu diesem Zweck melden."
    },
    {
      "date": "2025-12-30",
      "id": "141262",
      "original_text": "Löschungsankündigung\nNordrhein-Westfalen Amtsgericht Köln HRB 94937\nGoldman Findelkind GmbH – Köln",
      "type": "Löschungsankündigung",
      "state": "Nordrhein-Westfalen",
      "amtsgericht": "Amtsgericht Köln",
      "registernummer": "HRB 94937",
      "registerart": "HRB",
      "company_name": "Goldman Findelkind GmbH",
      "company_seat": "Köln",
      "details": "30.12.2025 (Bekanntmachungsdatum)\n\nNordrhein-Westfalen Amtsgericht Köln HRB 94937\nLöschungsankündigung\n\nGoldman Findelkind GmbH\nGesellschaft mit beschränkter Haftung\nKöln\n\nDas Registergericht beabsichtigt, die im Handelsregister eingetragene Gesellschaft gemäß § 394 Absatz 1 FamFG wegen Vermögenslosigkeit von Amts wegen zu löschen. Gegen diese Verfügung kann Widerspruch eingelegt werden. Die Frist zur Erhebung eines Widerspruchs gegen die beabsichtigte Löschung von Amts wegen ist auf einen Monat festgesetzt. Rechtsbehelfsbelehrung: Gegen diese Verfügung können Sie Widerspruch einlegen. Der Widerspruch ist bei dem Amtsgericht Köln, Reichenspergerplatz 1, 50670 Köln schriftlich in deutscher Sprache oder zur Niederschrift der Geschäftsstelle einzulegen. Der Widerspruch kann auch zur Niederschrift der Geschäftsstelle eines jeden Amtsgerichtes abgegeben werden. Die Einlegung ist auch durch Übertragung eines elektronischen Dokuments an die elektronische Poststelle des Gerichts möglich. Das elektronische Dokument muss für die Bearbeitung durch das Gericht geeignet und mit einer qualifizierten elektronischen Signatur der verantwortenden Person versehen sein oder von der verantwortenden Person signiert und auf einem sicheren Übermittlungsweg gemäß § 130a ZPO nach näherer Maßgabe der Verordnung über die technischen Rahmenbedingungen des elektronischen Rechtsverkehrs und über das besondere elektronische Behördenpostfach (BGBl. I, S.3803) eingereicht werden. Weitere Informationen erhalten Sie auf der Internetseite www.justiz.de.Der Widerspruch muss spätestens innerhalb der gesetzten Frist bei dem Amtsgericht Köln eingegangen sein. Dies gilt auch dann, wenn der Widerspruch zur Niederschrift der Geschäftsstelle eines anderen Amtsgerichtes abgegeben wurde. Die Frist beginnt mit der Veröffentlichung. Fällt das Ende der Frist auf einen Sonntag, einen allgemeinen Feiertag oder Sonnabend, so endet die Frist mit Ablauf des nächsten Werktages.\n\nDer Widerspruch muss die Bezeichnung der angefochtenen Verfügung sowie die Erklärung enthalten, dass Widerspruch gegen diese Verfügung eingelegt wird. Er ist zu unterzeichnen und soll begründet werden."
    },
    {
      "date": "2025-12-30",
      "id": "141263",
      "original_text": "Registerbekanntmachung nach dem Umwandlungsgesetz\nNordrhein-Westfalen Amtsgericht Düsseldorf HRA 25971\nWattner SunAsset Solarkraftwerk 027 GmbH & Co. KG – Monheim am Rhein",
      "type": "Registerbekanntmachung nach dem Umwandlungsgesetz",
      "state": "Nordrhein-Westfalen",
      "amtsgericht": "Amtsgericht Düsseldorf",
      "registernummer": "HRA 25971",
      "registerart": "HRA",
      "company_name": "Wattner SunAsset Solarkraftwerk 027 GmbH & Co. KG",
      "company_seat": "Monheim am Rhein",
      "details": "30.12.2025 (Bekanntmachungsdatum)\n\nNordrhein-Westfalen Amtsgericht Düsseldorf HRA 25971\nRegisterbekanntmachung nach dem Umwandlungsgesetz 30.12.2025 (Eintragungsdatum)\n\nWattner SunAsset Solarkraftwerk 027 GmbH & Co. KG\nKommanditgesellschaft\nMonheim am Rhein\n\nDen Gläubigern der an der Verschmelzung beteiligten Rechtsträger ist, wenn sie binnen sechs Monaten nach dem Tag, an dem die Eintragung der Verschmelzung in das Register des Sitzes desjenigen Rechtsträgers, dessen Gläubiger sie sind, nach § 19 Absatz 3 UmwG als bekanntgemacht gilt, ihren Anspruch nach Grund und Höhe schriftlich anmelden, Sicherheit zu leisten, soweit sie nicht Befriedigung verlangen können. Dieses Recht steht den Gläubigern jedoch nur zu, wenn sie glaubhaft machen, dass durch die Verschmelzung die Erfüllung ihrer Forderung gefährdet wird."
    },
    {
      "date": "2025-12-30",
      "id": "141264",
      "original_text": "Registerbekanntmachung nach dem Umwandlungsgesetz\nNordrhein-Westfalen Amtsgericht Iserlohn HRB 10564\nLeckerchen24 GmbH – Plettenberg",
      "type": "Registerbekanntmachung nach dem Umwandlungsgesetz",
      "state": "Nordrhein-Westfalen",
      "amtsgericht": "Amtsgericht Iserlohn",
      "registernummer": "HRB 10564",
      "registerart": "HRB",
      "company_name": "Leckerchen24 GmbH",
      "company_seat": "Plettenberg",
      "details": "30.12.2025 (Bekanntmachungsdatum)\n\nNordrhein-Westfalen Amtsgericht Iserlohn HRB 10564\nRegisterbekanntmachung nach dem Umwandlungsgesetz 19.12.2025 (Eintragungsdatum)\n\nLeckerchen24 GmbH\nGesellschaft mit beschränkter Haftung\nPlettenberg\n\nDen Gläubigern der an der Verschmelzung beteiligten Rechtsträger ist, wenn sie binnen sechs Monaten nach dem Tag, an dem die Eintragung der Verschmelzung in das Register des Sitzes desjenigen Rechtsträgers, dessen Gläubiger sie sind, nach § 19 Absatz 3 UmwG als bekanntgemacht gilt, ihren Anspruch nach Grund und Höhe schriftlich anmelden, Sicherheit zu leisten, soweit sie nicht Befriedigung verlangen können. Dieses Recht steht den Gläubigern jedoch nur zu, wenn sie glaubhaft machen, dass durch die Verschmelzung die Erfüllung ihrer Forderung gefährdet wird."
    },
    {
      "date": "2025-12-30",
      "id": "141265",
      "original_text": "Registerbekanntmachung nach dem Umwandlungsgesetz\nNordrhein-Westfalen Amtsgericht Essen HRB 37536\nRdB Germany Holding GmbH – Essen",
      "type": "Registerbekanntmachung nach dem Umwandlungsgesetz",
      "state": "Nordrhein-Westfalen",
      "amtsgericht": "Amtsgericht Essen",
      "registernummer": "HRB 37536",
      "registerart": "HRB",
      "company_name": "RdB Germany Holding GmbH",
      "company_seat": "Essen",
      "details": "30.12.2025 (Bekanntmachungsdatum)\n\nNordrhein-Westfalen Amtsgericht Essen HRB 37536\nRegisterbekanntmachung nach dem Umwandlungsgesetz 30.12.2025 (Eintragungsdatum)\n\nRdB Germany Holding GmbH\nGesellschaft mit beschränkter Haftung\nEssen\n\nDen Gläubigern der an der Ausgliederung beteiligten Rechtsträger ist, wenn sie binnen sechs Monaten nach dem Tag, an dem die Eintragung der Ausgliederung in das Register des Sitzes desjenigen Rechtsträgers, dessen Gläubiger sie sind, nach § 19 Absatz 3 UmwG als bekanntgemacht gilt, ihren Anspruch nach Grund und Höhe schriftlich anmelden, Sicherheit zu leisten, soweit sie nicht Befriedigung verlangen können. Dieses Recht steht den Gläubigern jedoch nur zu, wenn sie glaubhaft machen, dass durch die Ausgliederung die Erfüllung ihrer Forderung gefährdet wird."
    },
    {
      "date": "2025-12-30",
      "id": "141266",
      "original_text": "Registerbekanntmachung nach dem Umwandlungsgesetz\nHessen Amtsgericht Darmstadt HRB 91666\nhairfree GmbH – Darmstadt",
      "type": "Registerbekanntmachung nach dem Umwandlungsgesetz",
      "state": "Hessen",
      "amtsgericht": "Amtsgericht Darmstadt",
      "registernummer": "HRB 91666",
      "registerart": "HRB",
      "company_name": "hairfree GmbH",
      "company_seat": "Darmstadt",
      "details": "30.12.2025 (Bekanntmachungsdatum)\n\nHessen Amtsgericht Darmstadt HRB 91666\nRegisterbekanntmachung nach dem Umwandlungsgesetz 30.12.2025 (Eintragungsdatum)\n\nhairfree GmbH\nGesellschaft mit beschränkter Haftung\nDarmstadt\n\nDen Gläubigern der an der Verschmelzung beteiligten Rechtsträger ist, wenn sie binnen sechs Monaten nach dem Tag, an dem die Eintragung der Verschmelzung in das Register des Sitzes derjenigen Rechtsträger deren Gläubiger sie sind, nach § 19 Absatz 3 UmwG bekannt gemacht worden ist, ihren Anspruch nach Grund und Höhe schriftlich anmelden, Sicherheit zu leisten, soweit sie nicht Befriedigung verlangen können. Dieses Recht steht den Gläubigern jedoch nur zu, wenn sie glaubhaft machen, dass durch die Verschmelzung die Erfüllung ihrer Forderung gefährdet wird."
    },
    {
      "date": "2025-12-30",
      "id": "141267",
      "original_text": "Löschungsankündigung\nHessen Amtsgericht Hanau HRB 98971\nShadowWolf JW Holding UG (haftungsbeschränkt) – Biebergemünd",
      "type": "Löschungsankündigung",
      "state": "Hessen",
      "amtsgericht": "Amtsgericht Hanau",
      "registernummer": "HRB 98971",
      "registerart": "HRB",
      "company_name": "ShadowWolf JW Holding UG (haftungsbeschränkt)",
      "company_seat": "Biebergemünd",
      "details": "30.12.2025 (Bekanntmachungsdatum)\n\nHessen Amtsgericht Hanau HRB 98971\nLöschungsankündigung\n\nShadowWolf JW Holding UG (haftungsbeschränkt)\nGesellschaft mit beschränkter Haftung\nBiebergemünd\n\nDas Registergericht beabsichtigt die im Handelsregister eingetragene Gesellschaft von Amts wegen nach § 394 FamFG zu löschen. Die Frist zur Erhebung eines Widerspruchs gegen die beabsichtigte Löschung wird auf 3 Monate festgesetzt."
    },
    {
      "date": "2025-12-30",
      "id": "141268",
      "original_text": "Registerbekanntmachung nach dem Umwandlungsgesetz\nHessen Amtsgericht Frankfurt am Main HRB 105687\nflatexDEGIRO Bank AG – Frankfurt am Main",
      "type": "Registerbekanntmachung nach dem Umwandlungsgesetz",
      "state": "Hessen",
      "amtsgericht": "Amtsgericht Frankfurt am Main",
      "registernummer": "HRB 105687",
      "registerart": "HRB",
      "company_name": "flatexDEGIRO Bank AG",
      "company_seat": "Frankfurt am Main",
      "details": "30.12.2025 (Bekanntmachungsdatum)\n\nHessen Amtsgericht Frankfurt am Main HRB 105687\nRegisterbekanntmachung nach dem Umwandlungsgesetz 30.12.2025 (Eintragungsdatum)\n\nflatexDEGIRO Bank AG\nAktiengesellschaft\nFrankfurt am Main\n\nDen Gläubigern der an der grenzüberschreitenden Verschmelzung beteiligten übernehmenden Rechtsträger ist, wenn sie binnen sechs Monaten nach dem Tag, an dem die Eintragung der Verschmelzung in das Register des Sitzes desjenigen Rechtsträgers, dessen Gläubiger sie sind, nach § 19 Absatz 3 UmwG als bekanntgemacht gilt, ihren Anspruch nach Grund und Höhe schriftlich anmelden, Sicherheit zu leisten, soweit sie nicht Befriedigung verlangen können.\n\nDieses Recht steht den Gläubigern jedoch nur zu, wenn sie glaubhaft machen, dass durch die Verschmelzung die Erfüllung ihrer Forderung gefährdet wird."
    },
    {
      "date": "2025-12-30",
      "id": "141269",
      "original_text": "Registerbekanntmachung nach dem Umwandlungsgesetz\nHessen Amtsgericht Frankfurt am Main HRB 141330\nflatexDEGIRO Bank SE – Frankfurt am Main",
      "type": "Registerbekanntmachung nach dem Umwandlungsgesetz",
      "state": "Hessen",
      "amtsgericht": "Amtsgericht Frankfurt am Main",
      "registernummer": "HRB 141330",
      "registerart": "HRB",
      "company_name": "flatexDEGIRO Bank SE",
      "company_seat": "Frankfurt am Main",
      "details": "30.12.2025 (Bekanntmachungsdatum)\n\nHessen Amtsgericht Frankfurt am Main HRB 141330\nRegisterbekanntmachung nach dem Umwandlungsgesetz 30.12.2025 (Eintragungsdatum)\n\nflatexDEGIRO Bank SE\nEuropäische Aktiengesellschaft (SE)\nFrankfurt am Main\n\nDen Gläubigern der an der formwechselnden Umwandlung beteiligten Rechtsträger ist, wenn sie binnen sechs Monaten nach dem Tag, an dem die Eintragung der formwechselnden Umwandlung in das Register des Sitzes desjenigen Rechtsträgers, dessen Gläubiger sie sind, nach § 201 UmwG bekannt gemacht worden ist, ihren Anspruch nach Grund und Höhe schriftlich anmelden, Sicherheit zu leisten, soweit sie nicht Befriedigung verlangen können. Dieses Recht steht den Gläubigern jedoch nur zu, wenn sie glaubhaft machen, dass durch die formwechselnden Umwandlung die Erfüllung ihrer Forderung gefährdet wird."
    },
    {
      "date": "2025-12-30",
      "id": "141270",
      "original_text": "Sonstige Registerbekanntmachung\nHessen Amtsgericht Eschwege VR 1474\nModellbau-Club Bad Sooden-Allendorf – Bad Sooden-Allendorf",
      "type": "Sonstige Registerbekanntmachung",
      "state": "Hessen",
      "amtsgericht": "Amtsgericht Eschwege",
      "registernummer": "VR 1474",
      "registerart": "VR",
      "company_name": "Modellbau-Club Bad Sooden-Allendorf",
      "company_seat": "Bad Sooden-Allendorf",
      "details": "30.12.2025 (Bekanntmachungsdatum)\n\nHessen Amtsgericht Eschwege VR 1474\nSonstige Registerbekanntmachung 30.12.2025 (Eintragungsdatum)\n\nModellbau-Club Bad Sooden-Allendorf\neingetragener Verein\nBad Sooden-Allendorf\n\nDer Verein ist aufgelöst."
    },
    {
      "date": "2025-12-30",
      "id": "141271",
      "original_text": "Registerbekanntmachung nach dem Umwandlungsgesetz\nHessen Amtsgericht Hanau HRA 94125\nGerüstbau Lückhardt e.K. – Neuberg",
      "type": "Registerbekanntmachung nach dem Umwandlungsgesetz",
      "state": "Hessen",
      "amtsgericht": "Amtsgericht Hanau",
      "registernummer": "HRA 94125",
      "registerart": "HRA",
      "company_name": "Gerüstbau Lückhardt e.K.",
      "company_seat": "Neuberg",
      "details": "30.12.2025 (Bekanntmachungsdatum)\n\nHessen Amtsgericht Hanau HRA 94125\nRegisterbekanntmachung nach dem Umwandlungsgesetz 30.12.2025 (Eintragungsdatum)\n\nGerüstbau Lückhardt e.K.\nEinzelkaufmann / Einzelkauffrau\nNeuberg\n\nDen Gläubigern der an der Ausgliederung beteiligten Rechtsträger ist, wenn sie binnen sechs Monaten nach dem Tag, an dem die Eintragung der Ausgliederung in das Register des Sitzes desjenigen Rechtsträgers, dessen Gläubiger sie sind, nach §§ 125, 19 Absatz 3 UmwG bekannt gemacht worden ist, ihren Anspruch nach Grund und Höhe schriftlich anmelden, Sicherheit zu leisten, soweit sie nicht Befriedigung verlangen können. Dieses Recht steht den Gläubigern jedoch nur zu, wenn sie glaubhaft machen, dass durch die Ausgliederung die Erfüllung ihrer Forderung gefährdet wird."
    },
    {
      "date": "2025-12-30",
      "id": "141272",
      "original_text": "Löschungsankündigung\nHessen Amtsgericht Darmstadt HRB 70785\nGunPort GmbH – Bad König",
      "type": "Löschungsankündigung",
      "state": "Hessen",
      "amtsgericht": "Amtsgericht Darmstadt",
      "registernummer": "HRB 70785",
      "registerart": "HRB",
      "company_name": "GunPort GmbH",
      "company_seat": "Bad König",
      "details": "30.12.2025 (Bekanntmachungsdatum)\n\nHessen Amtsgericht Darmstadt HRB 70785\nLöschungsankündigung\n\nGunPort GmbH\nGesellschaft mit beschränkter Haftung\nBad König\n\nDas Registergericht beabsichtigt die im Handelsregister eingetragene Gesellschaft von Amts wegen nach § 394 FamFG zu löschen. Die Frist zur Erhebung eines Widerspruchs gegen die beabsichtigte Löschung wird auf 3 Monate festgesetzt."
    }
  ]
}