{
  "date": "2025-12-22",
  "date_of_scrape": "2025-12-23T04:21:17.506Z",
  "tool_version": "0.2.0",
  "number_of_announcements": 140,
  "announcements": [
    {
      "date": "2025-12-22",
      "id": "140720",
      "original_text": "Löschungsankündigung\nBaden-Württemberg Amtsgericht Freiburg HRB 732641\nK und M Gastro und Bau UG (haftungsbeschränkt) – Lahr",
      "type": "Löschungsankündigung",
      "state": "Baden-Württemberg",
      "amtsgericht": "Amtsgericht Freiburg",
      "registernummer": "HRB 732641",
      "registerart": "HRB",
      "company_name": "K und M Gastro und Bau UG (haftungsbeschränkt)",
      "company_seat": "Lahr",
      "details": "22.12.2025 (Bekanntmachungsdatum)\n\nBaden-Württemberg Amtsgericht Freiburg HRB 732641\nLöschungsankündigung 22.12.2025 (Eintragungsdatum)\n\nK und M Gastro und Bau UG (haftungsbeschränkt)\nGesellschaft mit beschränkter Haftung\nLahr\n\nAls nicht eingetragen wird bekanntgemacht:\nDas Gericht beabsichtigt, die Gesellschaft wegen Vermögenslosigkeit im Handelsregister von Amts wegen nach § 394 FamFG zu löschen. Die Frist zur Geltendmachung eines Widerspruchs gegen die beabsichtigte Löschung ist auf einen Monat ab Veröffentlichung bestimmt."
    },
    {
      "date": "2025-12-22",
      "id": "140721",
      "original_text": "Registerbekanntmachung nach dem Umwandlungsgesetz\nBaden-Württemberg Amtsgericht Stuttgart HRB 800963\nMillane Holding GmbH – Trossingen",
      "type": "Registerbekanntmachung nach dem Umwandlungsgesetz",
      "state": "Baden-Württemberg",
      "amtsgericht": "Amtsgericht Stuttgart",
      "registernummer": "HRB 800963",
      "registerart": "HRB",
      "company_name": "Millane Holding GmbH",
      "company_seat": "Trossingen",
      "details": "22.12.2025 (Bekanntmachungsdatum)\n\nBaden-Württemberg Amtsgericht Stuttgart HRB 800963\nRegisterbekanntmachung nach dem Umwandlungsgesetz 22.12.2025 (Eintragungsdatum)\n\nMillane Holding GmbH\nGesellschaft mit beschränkter Haftung\nTrossingen\n\nAls nicht eingetragen wird bekanntgemacht:\nDen Gläubigern der an der Ausgliederung beteiligten Rechtsträger ist, wenn sie binnen sechs Monaten nach dem Tag, an dem die Eintragung der Ausgliederung in das Register des Sitzes desjenigen Rechtsträgers, dessen Gläubiger sie sind, nach § 19 Abs. 3 UmwG als bekanntgemacht gilt, ihren Anspruch nach Grund und Höhe schriftlich anmelden, Sicherheit zu leisten, soweit sie nicht Befriedigung verlangen können. Dieses Recht steht den Gläubigern jedoch nur zu, wenn sie glaubhaft machen, dass durch die Ausgliederung die Erfüllung ihrer Forderung gefährdet wird."
    },
    {
      "date": "2025-12-22",
      "id": "140722",
      "original_text": "Registerbekanntmachung nach dem Umwandlungsgesetz\nBaden-Württemberg Amtsgericht Stuttgart HRB 21664\nUPL Verwaltungs GmbH – Stuttgart",
      "type": "Registerbekanntmachung nach dem Umwandlungsgesetz",
      "state": "Baden-Württemberg",
      "amtsgericht": "Amtsgericht Stuttgart",
      "registernummer": "HRB 21664",
      "registerart": "HRB",
      "company_name": "UPL Verwaltungs GmbH",
      "company_seat": "Stuttgart",
      "details": "22.12.2025 (Bekanntmachungsdatum)\n\nBaden-Württemberg Amtsgericht Stuttgart HRB 21664\nRegisterbekanntmachung nach dem Umwandlungsgesetz 22.12.2025 (Eintragungsdatum)\n\nUPL Verwaltungs GmbH\nGesellschaft mit beschränkter Haftung\nStuttgart\n\nDen Gläubigern der an der Verschmelzung beteiligten Rechtsträger ist, wenn sie binnen sechs Monaten nach dem Tag, an dem die Eintragung der Verschmelzung in das Register des Sitzes desjenigen Rechtsträgers, dessen Gläubiger sie sind, nach § 19 Abs. 3 UmwG als bekanntgemacht gilt, ihren Anspruch nach Grund und Höhe schriftlich anmelden, Sicherheit zu leisten, soweit sie nicht Befriedigung verlangen können. Dieses Recht steht den Gläubigern jedoch nur zu, wenn sie glaubhaft machen, dass durch die Verschmelzung die Erfüllung ihrer Forderung gefährdet wird."
    },
    {
      "date": "2025-12-22",
      "id": "140723",
      "original_text": "Einreichung neuer Dokumente\nBaden-Württemberg Amtsgericht Stuttgart HRB 22147\nIBM Central Holding GmbH – Ehningen",
      "type": "Einreichung neuer Dokumente",
      "state": "Baden-Württemberg",
      "amtsgericht": "Amtsgericht Stuttgart",
      "registernummer": "HRB 22147",
      "registerart": "HRB",
      "company_name": "IBM Central Holding GmbH",
      "company_seat": "Ehningen",
      "details": "22.12.2025 (Bekanntmachungsdatum)\n\nBaden-Württemberg Amtsgericht Stuttgart HRB 22147\nEinreichung neuer Dokumente\n\nIBM Central Holding GmbH\nGesellschaft mit beschränkter Haftung\nEhningen\n\nDie Gesellschaft hat am 19.12.2025 die Liste über die Zusammensetzung des Aufsichtsrats zum Handelsregister eingereicht."
    },
    {
      "date": "2025-12-22",
      "id": "140724",
      "original_text": "Registerbekanntmachung nach dem Umwandlungsgesetz\nBerlin Amtsgericht Berlin (Charlottenburg) HRB 278742\nMJ Immobilien Management & Verwaltungs GmbH – Berlin",
      "type": "Registerbekanntmachung nach dem Umwandlungsgesetz",
      "state": "Berlin",
      "amtsgericht": "Amtsgericht Berlin (Charlottenburg)",
      "registernummer": "HRB 278742",
      "registerart": "HRB",
      "company_name": "MJ Immobilien Management & Verwaltungs GmbH",
      "company_seat": "Berlin",
      "details": "22.12.2025 (Bekanntmachungsdatum)\n\nBerlin Amtsgericht Berlin (Charlottenburg) HRB 278742\nRegisterbekanntmachung nach dem Umwandlungsgesetz 21.12.2025 (Eintragungsdatum)\n\nMJ Immobilien Management & Verwaltungs GmbH\nGesellschaft mit beschränkter Haftung\nBerlin\n\nZu Eintragungsnummer 2 vom 21.12.2025 wird als nicht eingetragen veröffentlicht:\n\nDen Gläubigern der an der Spaltung beteiligten Rechtsträger ist, wenn sie binnen sechs Monaten nach dem Tag, an dem die Eintragung der Spaltung in das Register des Sitzes desjenigen Rechtsträgers, dessen Gläubiger sie sind, als bekannt gemacht gilt, ihren Anspruch nach Grund und Höhe schriftlich anmelden, Sicherheit zu leisten, soweit sie nicht Befriedigung verlangen können. Dieses Recht steht den Gläubigern jedoch nur zu, wenn sie glaubhaft machen, dass durch die Spaltung die Erfüllung ihrer Forderung gefährdet wird. Das Recht, Sicherheitsleistung zu verlangen, steht Gläubigern nicht zu, die im Falle der Insolvenz ein Recht auf vorzugsweise Befriedigung aus einer Deckungsmasse haben, die nach gesetzlicher Vorschrift zu ihrem Schutz errichtet und staatlich überwacht ist."
    },
    {
      "date": "2025-12-22",
      "id": "140725",
      "original_text": "Einreichung neuer Dokumente\nBaden-Württemberg Amtsgericht Mannheim HRB 504376\nMartin Walter Ultraschalltechnik AG – Straubenhardt",
      "type": "Einreichung neuer Dokumente",
      "state": "Baden-Württemberg",
      "amtsgericht": "Amtsgericht Mannheim",
      "registernummer": "HRB 504376",
      "registerart": "HRB",
      "company_name": "Martin Walter Ultraschalltechnik AG",
      "company_seat": "Straubenhardt",
      "details": "22.12.2025 (Bekanntmachungsdatum)\n\nBaden-Württemberg Amtsgericht Mannheim HRB 504376\nEinreichung neuer Dokumente 22.12.2025 (Eintragungsdatum)\n\nMartin Walter Ultraschalltechnik AG\nAktiengesellschaft\nStraubenhardt\n\nDie Gesellschaft hat am 19.12.2025 die Liste über die Zusammensetzung des Aufsichtsrats zum Handelsregister eingereicht."
    },
    {
      "date": "2025-12-22",
      "id": "140726",
      "original_text": "Einreichung neuer Dokumente\nBaden-Württemberg Amtsgericht Mannheim HRB 108368\nAscent Aktiengesellschaft – Karlsruhe",
      "type": "Einreichung neuer Dokumente",
      "state": "Baden-Württemberg",
      "amtsgericht": "Amtsgericht Mannheim",
      "registernummer": "HRB 108368",
      "registerart": "HRB",
      "company_name": "Ascent Aktiengesellschaft",
      "company_seat": "Karlsruhe",
      "details": "22.12.2025 (Bekanntmachungsdatum)\n\nBaden-Württemberg Amtsgericht Mannheim HRB 108368\nEinreichung neuer Dokumente 22.12.2025 (Eintragungsdatum)\n\nAscent Aktiengesellschaft\nAktiengesellschaft\nKarlsruhe\n\nDie Gesellschaft hat am 19.12.2025 die Liste über die Zusammensetzung des Aufsichtsrats zum Handelsregister eingereicht."
    },
    {
      "date": "2025-12-22",
      "id": "140727",
      "original_text": "Registerbekanntmachung nach dem Umwandlungsgesetz\nBaden-Württemberg Amtsgericht Stuttgart HRB 754814\nHWS Holding Verwaltungs GmbH Wirtschaftsprüfungsgesellschaft Steuerberatungsgesellschaft – Stuttgart",
      "type": "Registerbekanntmachung nach dem Umwandlungsgesetz",
      "state": "Baden-Württemberg",
      "amtsgericht": "Amtsgericht Stuttgart",
      "registernummer": "HRB 754814",
      "registerart": "HRB",
      "company_name": "HWS Holding Verwaltungs GmbH Wirtschaftsprüfungsgesellschaft Steuerberatungsgesellschaft",
      "company_seat": "Stuttgart",
      "details": "22.12.2025 (Bekanntmachungsdatum)\n\nBaden-Württemberg Amtsgericht Stuttgart HRB 754814\nRegisterbekanntmachung nach dem Umwandlungsgesetz 22.12.2025 (Eintragungsdatum)\n\nHWS Holding Verwaltungs GmbH Wirtschaftsprüfungsgesellschaft Steuerberatungsgesellschaft\nGesellschaft mit beschränkter Haftung\nStuttgart\n\nDen Gläubigern der an der Verschmelzung beteiligten Rechtsträger ist, wenn sie binnen sechs Monaten nach dem Tag, an dem die Eintragung der Verschmelzung in das Register des Sitzes desjenigen Rechtsträgers, dessen Gläubiger sie sind, nach § 19 Abs. 3 UmwG als bekanntgemacht gilt, ihren Anspruch nach Grund und Höhe schriftlich anmelden, Sicherheit zu leisten, soweit sie nicht Befriedigung verlangen können. Dieses Recht steht den Gläubigern jedoch nur zu, wenn sie glaubhaft machen, dass durch die Verschmelzung die Erfüllung ihrer Forderung gefährdet wird."
    },
    {
      "date": "2025-12-22",
      "id": "140728",
      "original_text": "Registerbekanntmachung nach dem Umwandlungsgesetz\nBaden-Württemberg Amtsgericht Stuttgart HRB 801336\nZollernalb Clean Service GmbH – Schömberg",
      "type": "Registerbekanntmachung nach dem Umwandlungsgesetz",
      "state": "Baden-Württemberg",
      "amtsgericht": "Amtsgericht Stuttgart",
      "registernummer": "HRB 801336",
      "registerart": "HRB",
      "company_name": "Zollernalb Clean Service GmbH",
      "company_seat": "Schömberg",
      "details": "22.12.2025 (Bekanntmachungsdatum)\n\nBaden-Württemberg Amtsgericht Stuttgart HRB 801336\nRegisterbekanntmachung nach dem Umwandlungsgesetz 22.12.2025 (Eintragungsdatum)\n\nZollernalb Clean Service GmbH\nGesellschaft mit beschränkter Haftung\nSchömberg\n\nAls nicht eingetragen wird bekanntgemacht:\nDen Gläubigern der an der Ausgliederung beteiligten Rechtsträger ist, wenn sie binnen sechs Monaten nach dem Tag, an dem die Eintragung der Ausgliederung in das Register des Sitzes desjenigen Rechtsträgers, dessen Gläubiger sie sind, nach § 19 Abs. 3 UmwG als bekanntgemacht gilt, ihren Anspruch nach Grund und Höhe schriftlich anmelden, Sicherheit zu leisten, soweit sie nicht Befriedigung verlangen können. Dieses Recht steht den Gläubigern jedoch nur zu, wenn sie glaubhaft machen, dass durch die Ausgliederung die Erfüllung ihrer Forderung gefährdet wird."
    },
    {
      "date": "2025-12-22",
      "id": "140729",
      "original_text": "Registerbekanntmachung nach dem Umwandlungsgesetz\nBaden-Württemberg Amtsgericht Stuttgart HRA 742837\nZollernAlb CLEAN SERVICE e.K., Inh. Aykut Kütük – Schömberg",
      "type": "Registerbekanntmachung nach dem Umwandlungsgesetz",
      "state": "Baden-Württemberg",
      "amtsgericht": "Amtsgericht Stuttgart",
      "registernummer": "HRA 742837",
      "registerart": "HRA",
      "company_name": "ZollernAlb CLEAN SERVICE e.K., Inh. Aykut Kütük",
      "company_seat": "Schömberg",
      "details": "22.12.2025 (Bekanntmachungsdatum)\n\nBaden-Württemberg Amtsgericht Stuttgart HRA 742837\nRegisterbekanntmachung nach dem Umwandlungsgesetz 22.12.2025 (Eintragungsdatum)\n\nZollernAlb CLEAN SERVICE e.K., Inh. Aykut Kütük\nEinzelkaufmann / Einzelkauffrau\nSchömberg\n\nAls nicht eingetragen wird bekanntgemacht:\nDen Gläubigern der an der Ausgliederung beteiligten Rechtsträger ist, wenn sie binnen sechs Monaten nach dem Tag, an dem die Eintragung der Ausgliederung in das Register des Sitzes desjenigen Rechtsträgers, dessen Gläubiger sie sind, nach § 19 Abs. 3 UmwG als bekanntgemacht gilt, ihren Anspruch nach Grund und Höhe schriftlich anmelden, Sicherheit zu leisten, soweit sie nicht Befriedigung verlangen können. Dieses Recht steht den Gläubigern jedoch nur zu, wenn sie glaubhaft machen, dass durch die Ausgliederung die Erfüllung ihrer Forderung gefährdet wird."
    },
    {
      "date": "2025-12-22",
      "id": "140730",
      "original_text": "Registerbekanntmachung nach dem Umwandlungsgesetz\nBaden-Württemberg Amtsgericht Stuttgart HRB 360443\nKammerer Elektrotechnik GmbH – Metzingen",
      "type": "Registerbekanntmachung nach dem Umwandlungsgesetz",
      "state": "Baden-Württemberg",
      "amtsgericht": "Amtsgericht Stuttgart",
      "registernummer": "HRB 360443",
      "registerart": "HRB",
      "company_name": "Kammerer Elektrotechnik GmbH",
      "company_seat": "Metzingen",
      "details": "22.12.2025 (Bekanntmachungsdatum)\n\nBaden-Württemberg Amtsgericht Stuttgart HRB 360443\nRegisterbekanntmachung nach dem Umwandlungsgesetz 22.12.2025 (Eintragungsdatum)\n\nKammerer Elektrotechnik GmbH\nGesellschaft mit beschränkter Haftung\nMetzingen\n\nDen Gläubigern der an der Verschmelzung beteiligten Rechtsträger ist, wenn sie binnen sechs Monaten nach dem Tag, an dem die Eintragung der Verschmelzung in das Register des Sitzes desjenigen Rechtsträgers, dessen Gläubiger sie sind, nach § 19 Abs. 3 UmwG als bekanntgemacht gilt, ihren Anspruch nach Grund und Höhe schriftlich anmelden, Sicherheit zu leisten, soweit sie nicht Befriedigung verlangen können. Dieses Recht steht den Gläubigern jedoch nur zu, wenn sie glaubhaft machen, dass durch die Verschmelzung die Erfüllung ihrer Forderung gefährdet wird."
    },
    {
      "date": "2025-12-22",
      "id": "140731",
      "original_text": "Registerbekanntmachung nach dem Umwandlungsgesetz\nBaden-Württemberg Amtsgericht Stuttgart HRB 755649\nMERITUS Business Advisors GmbH – Esslingen am Neckar",
      "type": "Registerbekanntmachung nach dem Umwandlungsgesetz",
      "state": "Baden-Württemberg",
      "amtsgericht": "Amtsgericht Stuttgart",
      "registernummer": "HRB 755649",
      "registerart": "HRB",
      "company_name": "MERITUS Business Advisors GmbH",
      "company_seat": "Esslingen am Neckar",
      "details": "22.12.2025 (Bekanntmachungsdatum)\n\nBaden-Württemberg Amtsgericht Stuttgart HRB 755649\nRegisterbekanntmachung nach dem Umwandlungsgesetz 22.12.2025 (Eintragungsdatum)\n\nMERITUS Business Advisors GmbH\nGesellschaft mit beschränkter Haftung\nEsslingen am Neckar\n\nAls nicht eingetragen wird bekanntgemacht:\nDen Gläubigern der an der Verschmelzung beteiligten Rechtsträger ist, wenn sie binnen sechs Monaten nach dem Tag, an dem die Eintragung der Verschmelzung in das Register des Sitzes desjenigen Rechtsträgers, dessen Gläubiger sie sind, nach § 19 Abs. 3 UmwG als bekanntgemacht gilt, ihren Anspruch nach Grund und Höhe schriftlich anmelden, Sicherheit zu leisten, soweit sie nicht Befriedigung verlangen können. Dieses Recht steht den Gläubigern jedoch nur zu, wenn sie glaubhaft machen, dass durch die Verschmelzung die Erfüllung ihrer Forderung gefährdet wird."
    },
    {
      "date": "2025-12-22",
      "id": "140732",
      "original_text": "Sonstige Registerbekanntmachung\nHamburg Amtsgericht Hamburg HRB 155460\nClubhaus Aktiengesellschaft – Hamburg",
      "type": "Sonstige Registerbekanntmachung",
      "state": "Hamburg",
      "amtsgericht": "Amtsgericht Hamburg",
      "registernummer": "HRB 155460",
      "registerart": "HRB",
      "company_name": "Clubhaus Aktiengesellschaft",
      "company_seat": "Hamburg",
      "details": "22.12.2025 (Bekanntmachungsdatum)\n\nHamburg Amtsgericht Hamburg HRB 155460\nSonstige Registerbekanntmachung\n\nClubhaus Aktiengesellschaft\nAktiengesellschaft\nHamburg\n\nAls nicht eingetragen wird bekannt gemacht: Liste des Aufsichtsrats wurde eingereicht."
    },
    {
      "date": "2025-12-22",
      "id": "140733",
      "original_text": "Registerbekanntmachung nach dem Umwandlungsgesetz\nHamburg Amtsgericht Hamburg HRB 183504\nActure Germany GmbH – Hamburg",
      "type": "Registerbekanntmachung nach dem Umwandlungsgesetz",
      "state": "Hamburg",
      "amtsgericht": "Amtsgericht Hamburg",
      "registernummer": "HRB 183504",
      "registerart": "HRB",
      "company_name": "Acture Germany GmbH",
      "company_seat": "Hamburg",
      "details": "22.12.2025 (Bekanntmachungsdatum)\n\nHamburg Amtsgericht Hamburg HRB 183504\nRegisterbekanntmachung nach dem Umwandlungsgesetz 22.12.2025 (Eintragungsdatum)\n\nActure Germany GmbH\nGesellschaft mit beschränkter Haftung\nHamburg\n\nAls nicht eingetragen wird bekannt gemacht:\nDen Gläubigern der an der Verschmelzung beteiligten Gesellschaften ist, wenn sie binnen sechs Monaten nach dem Tag, an dem die Eintragung der Verschmelzung in das Register des Sitzes desjenigen Rechtsträgers, dessen Gläubiger sie sind, nach § 19 Absatz 3 UmwG als bekannt gemacht gilt, ihren Anspruch nach Grund und Höhe schriftlich anmelden, Sicherheit zu leisten, soweit sie nicht Befriedigung verlangen können. Dieses Recht steht den Gläubigern jedoch nur zu, wenn sie glaubhaft machen, dass durch die Verschmelzung die Erfüllung ihrer Forderung gefährdet wird."
    },
    {
      "date": "2025-12-22",
      "id": "140734",
      "original_text": "Registerbekanntmachung nach dem Umwandlungsgesetz\nHamburg Amtsgericht Hamburg HRB 187968\nbp Retail Austria GmbH – Hamburg",
      "type": "Registerbekanntmachung nach dem Umwandlungsgesetz",
      "state": "Hamburg",
      "amtsgericht": "Amtsgericht Hamburg",
      "registernummer": "HRB 187968",
      "registerart": "HRB",
      "company_name": "bp Retail Austria GmbH",
      "company_seat": "Hamburg",
      "details": "22.12.2025 (Bekanntmachungsdatum)\n\nHamburg Amtsgericht Hamburg HRB 187968\nRegisterbekanntmachung nach dem Umwandlungsgesetz 22.12.2025 (Eintragungsdatum)\n\nbp Retail Austria GmbH\nGesellschaft mit beschränkter Haftung\nHamburg\n\nAls nicht eingetragen wird bekannt gemacht:\nEs wird darauf hingewiesen, dass ein Formwechselplan oder sein Entwurf über einen grenzüberschreitenden Formwechsel in die bp Retail Austria GmbH mit Sitz in Wien/Österreich (Gesellschaft mit beschränkter Haftung nach österreichischem Recht) beim Handelsregister eingereicht worden ist.\nDie Anteilsinhaber, die Gläubiger sowie die zuständigen Betriebsräte der an dem grenzüberschreitenden Formwechsel beteiligten Gesellschaft oder, soweit es keinen Betriebsrat gibt, die Arbeitnehmer der an dem grenzüberschreitenden Formwechsel beteiligten Gesellschaft, können der Gesellschaft spätestens fünf Arbeitstage vor dem Tag der Gesellschafterversammlung am 29.01.2026 Bemerkungen zum Formwechselplan übermitteln. Bemerkungen können an die Gesellschaft in Textform (§ 126b BGB) unter M&ALEGALUK@uk.bp.com oder postalisch an die folgende Anschrift übermittelt werden: bp Retail Austria GmbH zu Händen: Birgit Sommer, Am Belvedere 10, 1100 Wien, Republik Österreich."
    },
    {
      "date": "2025-12-22",
      "id": "140735",
      "original_text": "Registerbekanntmachung nach dem Umwandlungsgesetz\nHamburg Amtsgericht Hamburg HRB 187969\nbp Austria GmbH – Hamburg",
      "type": "Registerbekanntmachung nach dem Umwandlungsgesetz",
      "state": "Hamburg",
      "amtsgericht": "Amtsgericht Hamburg",
      "registernummer": "HRB 187969",
      "registerart": "HRB",
      "company_name": "bp Austria GmbH",
      "company_seat": "Hamburg",
      "details": "22.12.2025 (Bekanntmachungsdatum)\n\nHamburg Amtsgericht Hamburg HRB 187969\nRegisterbekanntmachung nach dem Umwandlungsgesetz 22.12.2025 (Eintragungsdatum)\n\nbp Austria GmbH\nGesellschaft mit beschränkter Haftung\nHamburg\n\nAls nicht eingetragen wird bekannt gemacht:\nEs wird darauf hingewiesen, dass ein Formwechselplan oder sein Entwurf über einen grenzüberschreitenden Formwechsel in die bp Austria GmbH mit Sitz in Wien/Österreich (Gesellschaft mit beschränkter Haftung nach österreichischem Recht) beim Handelsregister eingereicht worden ist.\nDie Anteilsinhaber, die Gläubiger sowie die zuständigen Betriebsräte der an dem grenzüberschreitenden Formwechsel beteiligten Gesellschaft oder, soweit es keinen Betriebsrat gibt, die Arbeitnehmer der an dem grenzüberschreitenden Formwechsel beteiligten Gesellschaft, können der Gesellschaft spätestens fünf Arbeitstage vor dem Tag der Gesellschafterversammlung am 29. Januar 2026 Bemerkungen zum Formwechselplan übermitteln. Bemerkungen können an die Gesellschaft in Textform (§ 126b BGB) unter M&ALEGALUK@uk.bp.com oder postalisch an die folgende Anschrift übermittelt werden:  bp Austria GmbH zu Händen: Christian Hartmann, Am Belvedere 10, 1100 Wien, Republik Österreich."
    },
    {
      "date": "2025-12-22",
      "id": "140736",
      "original_text": "Registerbekanntmachung nach dem Umwandlungsgesetz\nBaden-Württemberg Amtsgericht Stuttgart HRB 351150\nPaul Musse Elektrotechnik GmbH – Metzingen",
      "type": "Registerbekanntmachung nach dem Umwandlungsgesetz",
      "state": "Baden-Württemberg",
      "amtsgericht": "Amtsgericht Stuttgart",
      "registernummer": "HRB 351150",
      "registerart": "HRB",
      "company_name": "Paul Musse Elektrotechnik GmbH",
      "company_seat": "Metzingen",
      "details": "22.12.2025 (Bekanntmachungsdatum)\n\nBaden-Württemberg Amtsgericht Stuttgart HRB 351150\nRegisterbekanntmachung nach dem Umwandlungsgesetz 22.12.2025 (Eintragungsdatum)\n\nPaul Musse Elektrotechnik GmbH\nGesellschaft mit beschränkter Haftung\nMetzingen\n\nDen Gläubigern der an der Verschmelzung beteiligten Rechtsträger ist, wenn sie binnen sechs Monaten nach dem Tag, an dem die Eintragung der Verschmelzung in das Register des Sitzes desjenigen Rechtsträgers, dessen Gläubiger sie sind, nach § 19 Abs. 3 UmwG als bekanntgemacht gilt, ihren Anspruch nach Grund und Höhe schriftlich anmelden, Sicherheit zu leisten, soweit sie nicht Befriedigung verlangen können. Dieses Recht steht den Gläubigern jedoch nur zu, wenn sie glaubhaft machen, dass durch die Verschmelzung die Erfüllung ihrer Forderung gefährdet wird."
    },
    {
      "date": "2025-12-22",
      "id": "140737",
      "original_text": "Einreichung neuer Dokumente\nBerlin Amtsgericht Berlin (Charlottenburg) HRB 237918\nMAXAR AG – Berlin",
      "type": "Einreichung neuer Dokumente",
      "state": "Berlin",
      "amtsgericht": "Amtsgericht Berlin (Charlottenburg)",
      "registernummer": "HRB 237918",
      "registerart": "HRB",
      "company_name": "MAXAR AG",
      "company_seat": "Berlin",
      "details": "22.12.2025 (Bekanntmachungsdatum)\n\nBerlin Amtsgericht Berlin (Charlottenburg) HRB 237918\nEinreichung neuer Dokumente\n\nMAXAR AG\nAktiengesellschaft\nBerlin\n\nAls nicht eingetragen wird veröffentlicht:\n\nEs wurde eine neue Liste der Aufsichtsratsmitglieder eingereicht (§ 106 AktG)."
    },
    {
      "date": "2025-12-22",
      "id": "140738",
      "original_text": "Löschungsankündigung\nBerlin Amtsgericht Berlin (Charlottenburg) HRB 58860\nSpielhallen GmbH Müllerstraße 144 – Berlin",
      "type": "Löschungsankündigung",
      "state": "Berlin",
      "amtsgericht": "Amtsgericht Berlin (Charlottenburg)",
      "registernummer": "HRB 58860",
      "registerart": "HRB",
      "company_name": "Spielhallen GmbH Müllerstraße 144",
      "company_seat": "Berlin",
      "details": "22.12.2025 (Bekanntmachungsdatum)\n\nBerlin Amtsgericht Berlin (Charlottenburg) HRB 58860\nLöschungsankündigung\n\nSpielhallen GmbH Müllerstraße 144\nGesellschaft mit beschränkter Haftung\nBerlin\n\nBei der nachstehenden Gesellschaft wird das Amtslöschungsverfahren gemäß § 394 FamFG eingeleitet. Widerspruchsfrist 6 Wochen"
    },
    {
      "date": "2025-12-22",
      "id": "140739",
      "original_text": "Registerbekanntmachung nach dem Umwandlungsgesetz\nBaden-Württemberg Amtsgericht Stuttgart HRB 801048\nDA ImmoInvest Holding UG (haftungsbeschränkt) – Neustetten",
      "type": "Registerbekanntmachung nach dem Umwandlungsgesetz",
      "state": "Baden-Württemberg",
      "amtsgericht": "Amtsgericht Stuttgart",
      "registernummer": "HRB 801048",
      "registerart": "HRB",
      "company_name": "DA ImmoInvest Holding UG (haftungsbeschränkt)",
      "company_seat": "Neustetten",
      "details": "22.12.2025 (Bekanntmachungsdatum)\n\nBaden-Württemberg Amtsgericht Stuttgart HRB 801048\nRegisterbekanntmachung nach dem Umwandlungsgesetz 22.12.2025 (Eintragungsdatum)\n\nDA ImmoInvest Holding UG (haftungsbeschränkt)\nGesellschaft mit beschränkter Haftung\nNeustetten\n\nAls nicht eingetragen wird bekanntgemacht:\nDen Gläubigern der an der Verschmelzung beteiligten Rechtsträger ist, wenn sie binnen sechs Monaten nach dem Tag, an dem die Eintragung der Verschmelzung in das Register des Sitzes desjenigen Rechtsträgers, dessen Gläubiger sie sind, nach § 19 Abs. 3 UmwG als bekanntgemacht gilt, ihren Anspruch nach Grund und Höhe schriftlich anmelden, Sicherheit zu leisten, soweit sie nicht Befriedigung verlangen können. Dieses Recht steht den Gläubigern jedoch nur zu, wenn sie glaubhaft machen, dass durch die Verschmelzung die Erfüllung ihrer Forderung gefährdet wird."
    },
    {
      "date": "2025-12-22",
      "id": "140740",
      "original_text": "Registerbekanntmachung nach dem Umwandlungsgesetz\nBaden-Württemberg Amtsgericht Ulm HRA 729623\nWagner Management Consulting e.K., Kevin Richard Wagner – Westerstetten",
      "type": "Registerbekanntmachung nach dem Umwandlungsgesetz",
      "state": "Baden-Württemberg",
      "amtsgericht": "Amtsgericht Ulm",
      "registernummer": "HRA 729623",
      "registerart": "HRA",
      "company_name": "Wagner Management Consulting e.K., Kevin Richard Wagner",
      "company_seat": "Westerstetten",
      "details": "22.12.2025 (Bekanntmachungsdatum)\n\nBaden-Württemberg Amtsgericht Ulm HRA 729623\nRegisterbekanntmachung nach dem Umwandlungsgesetz 22.12.2025 (Eintragungsdatum)\n\nWagner Management Consulting e.K., Kevin Richard Wagner\nEinzelkaufmann / Einzelkauffrau\nWesterstetten\n\nAls nicht eingetragen wird bekanntgemacht:\nDen Gläubigern der an der Ausgliederung beteiligten Rechtsträger ist, wenn sie binnen sechs Monaten nach dem Tag, an dem die Eintragung der Ausgliederung in das Register des Sitzes desjenigen Rechtsträgers, dessen Gläubiger sie sind, nach § 19 Abs. 3 UmwG als bekanntgemacht gilt, ihren Anspruch nach Grund und Höhe schriftlich anmelden, Sicherheit zu leisten, soweit sie nicht Befriedigung verlangen können. Dieses Recht steht den Gläubigern jedoch nur zu, wenn sie glaubhaft machen, dass durch die Ausgliederung die Erfüllung ihrer Forderung gefährdet wird."
    },
    {
      "date": "2025-12-22",
      "id": "140741",
      "original_text": "Sonstige Registerbekanntmachung\nSchleswig-Holstein Amtsgericht Kiel PR 51\nTake Maracke & Partner – Kiel",
      "type": "Sonstige Registerbekanntmachung",
      "state": "Schleswig-Holstein",
      "amtsgericht": "Amtsgericht Kiel",
      "registernummer": "PR 51",
      "registerart": "PR",
      "company_name": "Take Maracke & Partner",
      "company_seat": "Kiel",
      "details": "22.12.2025 (Bekanntmachungsdatum)\n\nSchleswig-Holstein Amtsgericht Kiel PR 51\nSonstige Registerbekanntmachung\n\nTake Maracke & Partner\nPartnerschaftsgesellschaft\nKiel\n\nAls nicht eingetragen wird veröffentlicht: Den Gläubigern der an der Spaltung beteiligten Rechtsträger ist, wenn sie binnen sechs Monaten nach dem Tag, an dem die Eintragung der Spaltung in das Register des Sitzes desjenigen Rechtsträgers, dessen Gläubiger sie sind,  bekannt gemacht worden ist, ihren Anspruch nach Grund und Höhe schriftlich anmelden, Sicherheit zu leisten, soweit sie nicht Befriedigung verlangen können. Dieses Recht steht den Gläubigern jedoch nur zu, wenn sie glaubhaft machen, dass durch die Spaltung die Erfüllung ihrer Forderung gefährdet wird."
    },
    {
      "date": "2025-12-22",
      "id": "140742",
      "original_text": "Registerbekanntmachung nach dem Umwandlungsgesetz\nHamburg Amtsgericht Hamburg HRB 139449\nHolcim (Deutschland) GmbH – Hamburg",
      "type": "Registerbekanntmachung nach dem Umwandlungsgesetz",
      "state": "Hamburg",
      "amtsgericht": "Amtsgericht Hamburg",
      "registernummer": "HRB 139449",
      "registerart": "HRB",
      "company_name": "Holcim (Deutschland) GmbH",
      "company_seat": "Hamburg",
      "details": "22.12.2025 (Bekanntmachungsdatum)\n\nHamburg Amtsgericht Hamburg HRB 139449\nRegisterbekanntmachung nach dem Umwandlungsgesetz 22.12.2025 (Eintragungsdatum)\n\nHolcim (Deutschland) GmbH\nGesellschaft mit beschränkter Haftung\nHamburg\n\nAls nicht eingetragen wird bekannt gemacht:\nDen Gläubigern der an der Verschmelzung beteiligten Gesellschaften ist, wenn sie binnen sechs Monaten nach dem Tag, an dem die Eintragung der Verschmelzung in das Register des Sitzes desjenigen Rechtsträgers, dessen Gläubiger sie sind, nach § 19 Absatz 3 UmwG als bekannt gemacht gilt, ihren Anspruch nach Grund und Höhe schriftlich anmelden, Sicherheit zu leisten, soweit sie nicht Befriedigung verlangen können. Dieses Recht steht den Gläubigern jedoch nur zu, wenn sie glaubhaft machen, dass durch die Verschmelzung die Erfüllung ihrer Forderung gefährdet wird."
    },
    {
      "date": "2025-12-22",
      "id": "140743",
      "original_text": "Registerbekanntmachung nach dem Umwandlungsgesetz\nHamburg Amtsgericht Hamburg HRB 30791\nHolcim Digital GmbH – Hamburg",
      "type": "Registerbekanntmachung nach dem Umwandlungsgesetz",
      "state": "Hamburg",
      "amtsgericht": "Amtsgericht Hamburg",
      "registernummer": "HRB 30791",
      "registerart": "HRB",
      "company_name": "Holcim Digital GmbH",
      "company_seat": "Hamburg",
      "details": "22.12.2025 (Bekanntmachungsdatum)\n\nHamburg Amtsgericht Hamburg HRB 30791\nRegisterbekanntmachung nach dem Umwandlungsgesetz 22.12.2025 (Eintragungsdatum)\n\nHolcim Digital GmbH\nGesellschaft mit beschränkter Haftung\nHamburg\n\nAls nicht eingetragen wird bekannt gemacht:\nDen Gläubigern der an der Verschmelzung beteiligten Gesellschaften ist, wenn sie binnen sechs Monaten nach dem Tag, an dem die Eintragung der Verschmelzung in das Register des Sitzes desjenigen Rechtsträgers, dessen Gläubiger sie sind, nach § 19 Absatz 3 UmwG als bekannt gemacht gilt, ihren Anspruch nach Grund und Höhe schriftlich anmelden, Sicherheit zu leisten, soweit sie nicht Befriedigung verlangen können. Dieses Recht steht den Gläubigern jedoch nur zu, wenn sie glaubhaft machen, dass durch die Verschmelzung die Erfüllung ihrer Forderung gefährdet wird."
    },
    {
      "date": "2025-12-22",
      "id": "140744",
      "original_text": "Einreichung neuer Dokumente\nBaden-Württemberg Amtsgericht Stuttgart HRB 725573\nPutzmeister Concrete Pumps GmbH – Aichtal",
      "type": "Einreichung neuer Dokumente",
      "state": "Baden-Württemberg",
      "amtsgericht": "Amtsgericht Stuttgart",
      "registernummer": "HRB 725573",
      "registerart": "HRB",
      "company_name": "Putzmeister Concrete Pumps GmbH",
      "company_seat": "Aichtal",
      "details": "22.12.2025 (Bekanntmachungsdatum)\n\nBaden-Württemberg Amtsgericht Stuttgart HRB 725573\nEinreichung neuer Dokumente\n\nPutzmeister Concrete Pumps GmbH\nGesellschaft mit beschränkter Haftung\nAichtal\n\nDie Gesellschaft hat am 18.12.2025 die Liste über die Zusammensetzung des Aufsichtsrats zum Handelsregister eingereicht."
    },
    {
      "date": "2025-12-22",
      "id": "140745",
      "original_text": "Registerbekanntmachung nach dem Umwandlungsgesetz\nBaden-Württemberg Amtsgericht Freiburg HRB 711258\nAUTOHAUSEN AG – Offenburg",
      "type": "Registerbekanntmachung nach dem Umwandlungsgesetz",
      "state": "Baden-Württemberg",
      "amtsgericht": "Amtsgericht Freiburg",
      "registernummer": "HRB 711258",
      "registerart": "HRB",
      "company_name": "AUTOHAUSEN AG",
      "company_seat": "Offenburg",
      "details": "22.12.2025 (Bekanntmachungsdatum)\n\nBaden-Württemberg Amtsgericht Freiburg HRB 711258\nRegisterbekanntmachung nach dem Umwandlungsgesetz 22.12.2025 (Eintragungsdatum)\n\nAUTOHAUSEN AG\nAktiengesellschaft\nOffenburg\n\nDie \"ARS Automotive Retail Software GmbH\" (Amtsgericht Freiburg, HRB 709932) ist gemäß Vertrag und Beschluss vom 15.12.2025 auf diese Gesellschaft verschmolzen. Den Gläubigern der an der Verschmelzung beteiligten Rechtsträger ist, wenn sie binnen sechs Monaten nach dem Tag, an dem die Eintragung der Verschmelzung in das Register des Sitzes desjenigen Rechtsträgers, dessen Gläubiger sie sind, nach § 19 Abs. 3 UmwG als bekanntgemacht gilt, ihren Anspruch nach Grund und Höhe schriftlich anmelden, Sicherheit zu leisten, soweit sie nicht Befriedigung verlangen können. Dieses Recht steht den Gläubigern jedoch nur zu, wenn sie glaubhaft machen, dass durch die Verschmelzung die Erfüllung ihrer Forderung gefährdet wird."
    },
    {
      "date": "2025-12-22",
      "id": "140746",
      "original_text": "Registerbekanntmachung nach dem Umwandlungsgesetz\nBaden-Württemberg Amtsgericht Freiburg HRB 709932\nARS Automotive Retail Software GmbH – Offenburg",
      "type": "Registerbekanntmachung nach dem Umwandlungsgesetz",
      "state": "Baden-Württemberg",
      "amtsgericht": "Amtsgericht Freiburg",
      "registernummer": "HRB 709932",
      "registerart": "HRB",
      "company_name": "ARS Automotive Retail Software GmbH",
      "company_seat": "Offenburg",
      "details": "22.12.2025 (Bekanntmachungsdatum)\n\nBaden-Württemberg Amtsgericht Freiburg HRB 709932\nRegisterbekanntmachung nach dem Umwandlungsgesetz 22.12.2025 (Eintragungsdatum)\n\nARS Automotive Retail Software GmbH\nGesellschaft mit beschränkter Haftung\nOffenburg\n\nAls nicht eingetragen wird bekanntgemacht:\nDen Gläubigern der an der Verschmelzung beteiligten Rechtsträger ist, wenn sie binnen sechs Monaten nach dem Tag, an dem die Eintragung der Verschmelzung in das Register des Sitzes desjenigen Rechtsträgers, dessen Gläubiger sie sind, nach § 19 Abs. 3 UmwG als bekanntgemacht gilt, ihren Anspruch nach Grund und Höhe schriftlich anmelden, Sicherheit zu leisten, soweit sie nicht Befriedigung verlangen können. Dieses Recht steht den Gläubigern jedoch nur zu, wenn sie glaubhaft machen, dass durch die Verschmelzung die Erfüllung ihrer Forderung gefährdet wird."
    },
    {
      "date": "2025-12-22",
      "id": "140747",
      "original_text": "Sonstige Registerbekanntmachung\nThüringen Amtsgericht Jena HRB 111465\nKS Media und Kultur GmbH – Pößneck",
      "type": "Sonstige Registerbekanntmachung",
      "state": "Thüringen",
      "amtsgericht": "Amtsgericht Jena",
      "registernummer": "HRB 111465",
      "registerart": "HRB",
      "company_name": "KS Media und Kultur GmbH",
      "company_seat": "Pößneck",
      "details": "22.12.2025 (Bekanntmachungsdatum)\n\nThüringen Amtsgericht Jena HRB 111465\nSonstige Registerbekanntmachung 22.12.2025 (Eintragungsdatum)\n\nKS Media und Kultur GmbH\nGesellschaft mit beschränkter Haftung\nPößneck\n\nNicht eingetragen: Den Gläubigern der Gesellschaft, deren Forderungen begründet worden sind, bevor die Eintragung der Beendigung des Vertrages in das Handelsregister nach § 10 des Handelsgesetzbuches als bekanntgemacht gilt, hat der andere Vertragsteil Sicherheit zu leisten, wenn sie sich binnen sechs Monaten nach der Bekanntmachung der Eintragung zu diesem Zweck bei ihm melden."
    },
    {
      "date": "2025-12-22",
      "id": "140748",
      "original_text": "Registerbekanntmachung nach dem Umwandlungsgesetz\nThüringen Amtsgericht Jena HRA 504977\nWilliam Mohring - Internationale Transporte GmbH & Co. KG – Cursdorf",
      "type": "Registerbekanntmachung nach dem Umwandlungsgesetz",
      "state": "Thüringen",
      "amtsgericht": "Amtsgericht Jena",
      "registernummer": "HRA 504977",
      "registerart": "HRA",
      "company_name": "William Mohring - Internationale Transporte GmbH & Co. KG",
      "company_seat": "Cursdorf",
      "details": "22.12.2025 (Bekanntmachungsdatum)\n\nThüringen Amtsgericht Jena HRA 504977\nRegisterbekanntmachung nach dem Umwandlungsgesetz 22.12.2025 (Eintragungsdatum)\n\nWilliam Mohring - Internationale Transporte GmbH & Co. KG\nKommanditgesellschaft\nCursdorf\n\nNicht eingetragen: Den Gläubigern der an der Ausgliederung beteiligten Rechtsträger, ist wenn sie binnen sechs Monaten nach dem Tag, an dem die Eintragung der Ausgliederung in das Register des Sitzes desjenigen Rechtsträgers, dessen Gläubiger sie sind, nach §§125, 19 Abs. 3 UmwG als bekanntgemacht gilt, ihren Anspruch nach Grund und Höhe schriftlich anmelden, Sicherheit zu leisten, soweit sie nicht Befriedigung verlangen können. Dieses Recht steht ihnen jedoch nur zu, wenn sie glaubhaft machen, daß durch die Ausgliederung die Erfüllung ihrer Forderung gefährdet wird."
    },
    {
      "date": "2025-12-22",
      "id": "140749",
      "original_text": "Registerbekanntmachung nach dem Umwandlungsgesetz\nThüringen Amtsgericht Jena HRA 507215\nWilliam Mohring Nutzfahrzeuge e.K. – Cursdorf",
      "type": "Registerbekanntmachung nach dem Umwandlungsgesetz",
      "state": "Thüringen",
      "amtsgericht": "Amtsgericht Jena",
      "registernummer": "HRA 507215",
      "registerart": "HRA",
      "company_name": "William Mohring Nutzfahrzeuge e.K.",
      "company_seat": "Cursdorf",
      "details": "22.12.2025 (Bekanntmachungsdatum)\n\nThüringen Amtsgericht Jena HRA 507215\nRegisterbekanntmachung nach dem Umwandlungsgesetz 22.12.2025 (Eintragungsdatum)\n\nWilliam Mohring Nutzfahrzeuge e.K.\nEinzelkaufmann / Einzelkauffrau\nCursdorf\n\nNicht eingetragen: Den Gläubigern der an der Ausgliederung beteiligten Rechtsträger, ist wenn sie binnen sechs Monaten nach dem Tag, an dem die Eintragung der Ausgliederung in das Register des Sitzes desjenigen Rechtsträgers, dessen Gläubiger sie sind, nach §§125, 19 Abs. 3 UmwG als bekanntgemacht gilt, ihren Anspruch nach Grund und Höhe schriftlich anmelden, Sicherheit zu leisten, soweit sie nicht Befriedigung verlangen können. Dieses Recht steht ihnen jedoch nur zu, wenn sie glaubhaft machen, daß durch die Ausgliederung die Erfüllung ihrer Forderung gefährdet wird."
    },
    {
      "date": "2025-12-22",
      "id": "140750",
      "original_text": "Registerbekanntmachung nach dem Umwandlungsgesetz\nSchleswig-Holstein Amtsgericht Kiel HRA 12897\nAdventure Golf Damp e. K. – Barkelsby",
      "type": "Registerbekanntmachung nach dem Umwandlungsgesetz",
      "state": "Schleswig-Holstein",
      "amtsgericht": "Amtsgericht Kiel",
      "registernummer": "HRA 12897",
      "registerart": "HRA",
      "company_name": "Adventure Golf Damp e. K.",
      "company_seat": "Barkelsby",
      "details": "22.12.2025 (Bekanntmachungsdatum)\n\nSchleswig-Holstein Amtsgericht Kiel HRA 12897\nRegisterbekanntmachung nach dem Umwandlungsgesetz 19.12.2025 (Eintragungsdatum)\n\nAdventure Golf Damp e. K.\nEinzelkaufmann / Einzelkauffrau\nBarkelsby\n\nZu Eintragungsnummer 2 vom 19.12.2025 wird als nicht eingetragen veröffentlicht:  Den Gläubigern der an der Spaltung beteiligten Rechtsträger ist, wenn sie binnen sechs Monaten nach dem Tag, an dem die Eintragung der Spaltung in das Register des Sitzes desjenigen Rechtsträgers, dessen Gläubiger sie sind,  bekannt gemacht worden ist, ihren Anspruch nach Grund und Höhe schriftlich anmelden, Sicherheit zu leisten, soweit sie nicht Befriedigung verlangen können. Dieses Recht steht den Gläubigern jedoch nur zu, wenn sie glaubhaft machen, dass durch die Spaltung die Erfüllung ihrer Forderung gefährdet wird."
    },
    {
      "date": "2025-12-22",
      "id": "140751",
      "original_text": "Sonstige Registerbekanntmachung\nNordrhein-Westfalen Amtsgericht Coesfeld HRB 3011\nAKG Ahler Gravuren GmbH – Vreden",
      "type": "Sonstige Registerbekanntmachung",
      "state": "Nordrhein-Westfalen",
      "amtsgericht": "Amtsgericht Coesfeld",
      "registernummer": "HRB 3011",
      "registerart": "HRB",
      "company_name": "AKG Ahler Gravuren GmbH",
      "company_seat": "Vreden",
      "details": "22.12.2025 (Bekanntmachungsdatum)\n\nNordrhein-Westfalen Amtsgericht Coesfeld HRB 3011\nSonstige Registerbekanntmachung 22.12.2025 (Eintragungsdatum)\n\nAKG Ahler Gravuren GmbH\nGesellschaft mit beschränkter Haftung\nVreden\n\nDen Gläubigern der Gesellschaft, deren Forderungen begründet worden sind, bevor die Eintragung der Beendigung des Vertrages in das Handelsregister nach § 10 HGB als bekanntgemacht gilt, ist vom anderen Vertragsteil Sicherheit zu leisten, wenn sie sich binnen sechs Monaten nach der Bekanntmachung zu diesem Zweck bei ihm melden."
    },
    {
      "date": "2025-12-22",
      "id": "140752",
      "original_text": "Registerbekanntmachung nach dem Umwandlungsgesetz\nSchleswig-Holstein Amtsgericht Kiel HRA 12712\nRalf Perske e.K. – Rendsburg",
      "type": "Registerbekanntmachung nach dem Umwandlungsgesetz",
      "state": "Schleswig-Holstein",
      "amtsgericht": "Amtsgericht Kiel",
      "registernummer": "HRA 12712",
      "registerart": "HRA",
      "company_name": "Ralf Perske e.K.",
      "company_seat": "Rendsburg",
      "details": "22.12.2025 (Bekanntmachungsdatum)\n\nSchleswig-Holstein Amtsgericht Kiel HRA 12712\nRegisterbekanntmachung nach dem Umwandlungsgesetz 18.12.2025 (Eintragungsdatum)\n\nRalf Perske e.K.\nEinzelkaufmann / Einzelkauffrau\nRendsburg\n\nZu Eintragungsnummer 2 vom 18.12.2025 wird als nicht eingetragen veröffentlicht: Den Gläubigern der an der Spaltung beteiligten Rechtsträger ist, wenn sie binnen sechs Monaten nach dem Tag, an dem die Eintragung der Spaltung in das Register des Sitzes desjenigen Rechtsträgers, dessen Gläubiger sie sind,  bekannt gemacht worden ist, ihren Anspruch nach Grund und Höhe schriftlich anmelden, Sicherheit zu leisten, soweit sie nicht Befriedigung verlangen können. Dieses Recht steht den Gläubigern jedoch nur zu, wenn sie glaubhaft machen, dass durch die Spaltung die Erfüllung ihrer Forderung gefährdet wird."
    },
    {
      "date": "2025-12-22",
      "id": "140753",
      "original_text": "Registerbekanntmachung nach dem Umwandlungsgesetz\nBerlin Amtsgericht Berlin (Charlottenburg) HRA 64513\nTicket B - Architektur erleben e. K. – Berlin",
      "type": "Registerbekanntmachung nach dem Umwandlungsgesetz",
      "state": "Berlin",
      "amtsgericht": "Amtsgericht Berlin (Charlottenburg)",
      "registernummer": "HRA 64513",
      "registerart": "HRA",
      "company_name": "Ticket B - Architektur erleben e. K.",
      "company_seat": "Berlin",
      "details": "22.12.2025 (Bekanntmachungsdatum)\n\nBerlin Amtsgericht Berlin (Charlottenburg) HRA 64513\nRegisterbekanntmachung nach dem Umwandlungsgesetz 19.12.2025 (Eintragungsdatum)\n\nTicket B - Architektur erleben e. K.\nEinzelkaufmann / Einzelkauffrau\nBerlin\n\nZu Eintragungsnummer 2 vom 19.12.2025 wird als nicht eingetragen veröffentlicht:\nDen Gläubigern der an der Spaltung beteiligten Rechtsträger ist, wenn sie binnen sechs Monaten nach dem Tag, an dem die Eintragung der Spaltung in das Register des Sitzes desjenigen Rechtsträgers, dessen Gläubiger sie sind, als bekannt gemacht gilt, ihren Anspruch nach Grund und Höhe schriftlich anmelden, Sicherheit zu leisten, soweit sie nicht Befriedigung verlangen können. Dieses Recht steht den Gläubigern jedoch nur zu, wenn sie glaubhaft machen, dass durch die Spaltung die Erfüllung ihrer Forderung gefährdet wird. Das Recht, Sicherheitsleistung zu verlangen, steht Gläubigern nicht zu, die im Falle der Insolvenz ein Recht auf vorzugsweise Befriedigung aus einer Deckungsmasse haben, die nach gesetzlicher Vorschrift zu ihrem Schutz errichtet und staatlich überwacht ist."
    },
    {
      "date": "2025-12-22",
      "id": "140754",
      "original_text": "Registerbekanntmachung nach dem Umwandlungsgesetz\nBrandenburg Amtsgericht Potsdam HRB 36310\nSenziger Liegenschaften GmbH – Zossen",
      "type": "Registerbekanntmachung nach dem Umwandlungsgesetz",
      "state": "Brandenburg",
      "amtsgericht": "Amtsgericht Potsdam",
      "registernummer": "HRB 36310",
      "registerart": "HRB",
      "company_name": "Senziger Liegenschaften GmbH",
      "company_seat": "Zossen",
      "details": "22.12.2025 (Bekanntmachungsdatum)\n\nBrandenburg Amtsgericht Potsdam HRB 36310\nRegisterbekanntmachung nach dem Umwandlungsgesetz 20.12.2025 (Eintragungsdatum)\n\nSenziger Liegenschaften GmbH\nGesellschaft mit beschränkter Haftung\nZossen\n\nZu Eintragungsnummer 4 vom 20.12.2025 wird als nicht eingetragen veröffentlicht: Den Gläubigern der an der Verschmelzung beteiligten Rechtsträger ist, wenn sie binnen sechs Monaten nach dem Tag, an dem die Eintragung der Verschmelzung in das Register des Sitzes desjenigen Rechtsträgers, dessen Gläubiger sie sind, als bekannt gemacht gilt, ihren Anspruch nach Grund und Höhe schriftlich anmelden, Sicherheit zu leisten, soweit sie nicht Befriedigung verlangen können. Dieses Recht steht den Gläubigern jedoch nur zu, wenn sie glaubhaft machen, dass durch die Verschmelzung die Erfüllung ihrer Forderung gefährdet wird."
    },
    {
      "date": "2025-12-22",
      "id": "140755",
      "original_text": "Registerbekanntmachung nach dem Umwandlungsgesetz\nBerlin Amtsgericht Berlin (Charlottenburg) HRB 99457\nFreund & Partner GmbH Steuerberatungsgesellschaft – Berlin",
      "type": "Registerbekanntmachung nach dem Umwandlungsgesetz",
      "state": "Berlin",
      "amtsgericht": "Amtsgericht Berlin (Charlottenburg)",
      "registernummer": "HRB 99457",
      "registerart": "HRB",
      "company_name": "Freund & Partner GmbH Steuerberatungsgesellschaft",
      "company_seat": "Berlin",
      "details": "22.12.2025 (Bekanntmachungsdatum)\n\nBerlin Amtsgericht Berlin (Charlottenburg) HRB 99457\nRegisterbekanntmachung nach dem Umwandlungsgesetz 18.12.2025 (Eintragungsdatum)\n\nFreund & Partner GmbH Steuerberatungsgesellschaft\nGesellschaft mit beschränkter Haftung\nBerlin\n\nZu Eintragungsnummer 38 vom 18.12.2025 wird als nicht eingetragen veröffentlicht: Den Gläubigern der an der Verschmelzung beteiligten Rechtsträger ist, wenn sie binnen sechs Monaten nach dem Tag, an dem die Eintragung der Verschmelzung in das Register des Sitzes desjenigen Rechtsträgers, dessen Gläubiger sie sind, als bekannt gemacht gilt, ihren Anspruch nach Grund und Höhe schriftlich anmelden, Sicherheit zu leisten, soweit sie nicht Befriedigung verlangen können. Dieses Recht steht den Gläubigern jedoch nur zu, wenn sie glaubhaft machen, dass durch die Verschmelzung die Erfüllung ihrer Forderung gefährdet wird. Das Recht, Sicherheitsleistung zu verlangen, steht Gläubigern nicht zu, die im Falle der Insolvenz ein Recht auf vorzugsweise Befriedigung aus einer Deckungsmasse haben, die nach gesetzlicher Vorschrift zu ihrem Schutz errichtet und staatlich überwacht ist."
    },
    {
      "date": "2025-12-22",
      "id": "140756",
      "original_text": "Einreichung neuer Dokumente\nBaden-Württemberg Amtsgericht Mannheim HRB 4664\nABB AG – Mannheim",
      "type": "Einreichung neuer Dokumente",
      "state": "Baden-Württemberg",
      "amtsgericht": "Amtsgericht Mannheim",
      "registernummer": "HRB 4664",
      "registerart": "HRB",
      "company_name": "ABB AG",
      "company_seat": "Mannheim",
      "details": "22.12.2025 (Bekanntmachungsdatum)\n\nBaden-Württemberg Amtsgericht Mannheim HRB 4664\nEinreichung neuer Dokumente\n\nABB AG\nAktiengesellschaft\nMannheim\n\nDie Gesellschaft hat am 19.12.2025 die Liste über die Zusammensetzung des Aufsichtsrats zum Handelsregister eingereicht."
    },
    {
      "date": "2025-12-22",
      "id": "140757",
      "original_text": "Registerbekanntmachung nach dem Umwandlungsgesetz\nBrandenburg Amtsgericht Cottbus HRB 12834\nRefugium Beelitz Quadrant C Grundstücksgesellschaft mbH – Schönefeld",
      "type": "Registerbekanntmachung nach dem Umwandlungsgesetz",
      "state": "Brandenburg",
      "amtsgericht": "Amtsgericht Cottbus",
      "registernummer": "HRB 12834",
      "registerart": "HRB",
      "company_name": "Refugium Beelitz Quadrant C Grundstücksgesellschaft mbH",
      "company_seat": "Schönefeld",
      "details": "22.12.2025 (Bekanntmachungsdatum)\n\nBrandenburg Amtsgericht Cottbus HRB 12834\nRegisterbekanntmachung nach dem Umwandlungsgesetz 22.12.2025 (Eintragungsdatum)\n\nRefugium Beelitz Quadrant C Grundstücksgesellschaft mbH\nGesellschaft mit beschränkter Haftung\nSchönefeld\n\nAls nicht eingetragen wird veröffentlicht:\nDen Gläubigern der an der Spaltung beteiligten Rechtsträger ist, wenn sie binnen sechs Monaten nach dem Tag, an dem die Eintragung der Spaltung in das Register des Sitzes desjenigen Rechtsträgers, dessen Gläubiger sie sind, als bekannt gemacht gilt, ihren Anspruch nach Grund und Höhe schriftlich anmelden, Sicherheit zu leisten, soweit sie nicht Befriedigung verlangen können. Dieses Recht steht den Gläubigern jedoch nur zu, wenn sie glaubhaft machen, dass durch die Spaltung die Erfüllung ihrer Forderung gefährdet wird"
    },
    {
      "date": "2025-12-22",
      "id": "140758",
      "original_text": "Einreichung neuer Dokumente\nBerlin Amtsgericht Berlin (Charlottenburg) HRB 99582\nCharité CFM Facility Management GmbH – Berlin",
      "type": "Einreichung neuer Dokumente",
      "state": "Berlin",
      "amtsgericht": "Amtsgericht Berlin (Charlottenburg)",
      "registernummer": "HRB 99582",
      "registerart": "HRB",
      "company_name": "Charité CFM Facility Management GmbH",
      "company_seat": "Berlin",
      "details": "22.12.2025 (Bekanntmachungsdatum)\n\nBerlin Amtsgericht Berlin (Charlottenburg) HRB 99582\nEinreichung neuer Dokumente\n\nCharité CFM Facility Management GmbH\nGesellschaft mit beschränkter Haftung\nBerlin\n\nAls nicht eingetragen wird veröffentlicht: Es wurde eine neue Liste der Aufsichtsratsmitglieder eingereicht (§52 GmbHG)."
    },
    {
      "date": "2025-12-22",
      "id": "140759",
      "original_text": "Registerbekanntmachung nach dem Umwandlungsgesetz\nBrandenburg Amtsgericht Cottbus HRB 19295\nQuartier Beelitz-Heilstätten fünfte Grundstücksgesellschaft mbH – Schönefeld",
      "type": "Registerbekanntmachung nach dem Umwandlungsgesetz",
      "state": "Brandenburg",
      "amtsgericht": "Amtsgericht Cottbus",
      "registernummer": "HRB 19295",
      "registerart": "HRB",
      "company_name": "Quartier Beelitz-Heilstätten fünfte Grundstücksgesellschaft mbH",
      "company_seat": "Schönefeld",
      "details": "22.12.2025 (Bekanntmachungsdatum)\n\nBrandenburg Amtsgericht Cottbus HRB 19295\nRegisterbekanntmachung nach dem Umwandlungsgesetz 22.12.2025 (Eintragungsdatum)\n\nQuartier Beelitz-Heilstätten fünfte Grundstücksgesellschaft mbH\nGesellschaft mit beschränkter Haftung\nSchönefeld\n\nZu Eintragungsnummer 1 vom 22.12.2025 wird als nicht eingetragen veröffentlicht:\nDen Gläubigern der an der Spaltung beteiligten Rechtsträger ist, wenn sie binnen sechs Monaten nach dem Tag, an dem die Eintragung der Spaltung in das Register des Sitzes desjenigen Rechtsträgers, dessen Gläubiger sie sind, als bekannt gemacht gilt, ihren Anspruch nach Grund und Höhe schriftlich anmelden, Sicherheit zu leisten, soweit sie nicht Befriedigung verlangen können. Dieses Recht steht den Gläubigern jedoch nur zu, wenn sie glaubhaft machen, dass durch die Spaltung die Erfüllung ihrer Forderung gefährdet wird"
    },
    {
      "date": "2025-12-22",
      "id": "140760",
      "original_text": "Registerbekanntmachung nach dem Umwandlungsgesetz\nBaden-Württemberg Amtsgericht Freiburg HRB 590347\nJOIN(+) GmbH – Villingen-Schwenningen",
      "type": "Registerbekanntmachung nach dem Umwandlungsgesetz",
      "state": "Baden-Württemberg",
      "amtsgericht": "Amtsgericht Freiburg",
      "registernummer": "HRB 590347",
      "registerart": "HRB",
      "company_name": "JOIN(+) GmbH",
      "company_seat": "Villingen-Schwenningen",
      "details": "22.12.2025 (Bekanntmachungsdatum)\n\nBaden-Württemberg Amtsgericht Freiburg HRB 590347\nRegisterbekanntmachung nach dem Umwandlungsgesetz 22.12.2025 (Eintragungsdatum)\n\nJOIN(+) GmbH\nGesellschaft mit beschränkter Haftung\nVillingen-Schwenningen\n\nAls nicht eingetragen wird bekanntgemacht:\nDen Gläubigern der an der Verschmelzung beteiligten Rechtsträger ist, wenn sie binnen sechs Monaten nach dem Tag, an dem die Eintragung der Verschmelzung in das Register des Sitzes desjenigen Rechtsträgers, dessen Gläubiger sie sind, nach § 19 Abs. 3 UmwG als bekanntgemacht gilt, ihren Anspruch nach Grund und Höhe schriftlich anmelden, Sicherheit zu leisten, soweit sie nicht Befriedigung verlangen können. Dieses Recht steht den Gläubigern jedoch nur zu, wenn sie glaubhaft machen, dass durch die Verschmelzung die Erfüllung ihrer Forderung gefährdet wird."
    },
    {
      "date": "2025-12-22",
      "id": "140761",
      "original_text": "Einreichung neuer Dokumente\nBrandenburg Amtsgericht Frankfurt/Oder HRB 16136\nKreiswerke Barnim GmbH (KWB) – Eberswalde",
      "type": "Einreichung neuer Dokumente",
      "state": "Brandenburg",
      "amtsgericht": "Amtsgericht Frankfurt/Oder",
      "registernummer": "HRB 16136",
      "registerart": "HRB",
      "company_name": "Kreiswerke Barnim GmbH (KWB)",
      "company_seat": "Eberswalde",
      "details": "22.12.2025 (Bekanntmachungsdatum)\n\nBrandenburg Amtsgericht Frankfurt/Oder HRB 16136\nEinreichung neuer Dokumente\n\nKreiswerke Barnim GmbH (KWB)\nGesellschaft mit beschränkter Haftung\nEberswalde\n\nAls nicht eingetragen wird veröffentlicht:\n\nEs wurde eine Liste der Aufsichtsratsmitglieder vom 20.11.2025 eingereicht."
    },
    {
      "date": "2025-12-22",
      "id": "140762",
      "original_text": "Registerbekanntmachung nach dem Umwandlungsgesetz\nHamburg Amtsgericht Hamburg HRB 127487\nLazerfun Hamburg GmbH – Hamburg",
      "type": "Registerbekanntmachung nach dem Umwandlungsgesetz",
      "state": "Hamburg",
      "amtsgericht": "Amtsgericht Hamburg",
      "registernummer": "HRB 127487",
      "registerart": "HRB",
      "company_name": "Lazerfun Hamburg GmbH",
      "company_seat": "Hamburg",
      "details": "22.12.2025 (Bekanntmachungsdatum)\n\nHamburg Amtsgericht Hamburg HRB 127487\nRegisterbekanntmachung nach dem Umwandlungsgesetz 22.12.2025 (Eintragungsdatum)\n\nLazerfun Hamburg GmbH\nGesellschaft mit beschränkter Haftung\nHamburg\n\nAls nicht eingetragen wird bekannt gemacht:\nDen Gläubigern der an der Verschmelzung beteiligten Gesellschaften ist, wenn sie binnen sechs Monaten nach dem Tag, an dem die Eintragung der Verschmelzung in das Register des Sitzes desjenigen Rechtsträgers, dessen Gläubiger sie sind, nach § 19 Absatz 3 UmwG als bekannt gemacht gilt, ihren Anspruch nach Grund und Höhe schriftlich anmelden, Sicherheit zu leisten, soweit sie nicht Befriedigung verlangen können. Dieses Recht steht den Gläubigern jedoch nur zu, wenn sie glaubhaft machen, dass durch die Verschmelzung die Erfüllung ihrer Forderung gefährdet wird."
    },
    {
      "date": "2025-12-22",
      "id": "140763",
      "original_text": "Registerbekanntmachung nach dem Umwandlungsgesetz\nBaden-Württemberg Amtsgericht Ulm HRB 751093\nSWW 32 Immobilien GmbH – Tettnang",
      "type": "Registerbekanntmachung nach dem Umwandlungsgesetz",
      "state": "Baden-Württemberg",
      "amtsgericht": "Amtsgericht Ulm",
      "registernummer": "HRB 751093",
      "registerart": "HRB",
      "company_name": "SWW 32 Immobilien GmbH",
      "company_seat": "Tettnang",
      "details": "22.12.2025 (Bekanntmachungsdatum)\n\nBaden-Württemberg Amtsgericht Ulm HRB 751093\nRegisterbekanntmachung nach dem Umwandlungsgesetz 22.12.2025 (Eintragungsdatum)\n\nSWW 32 Immobilien GmbH\nGesellschaft mit beschränkter Haftung\nTettnang\n\nAls nicht eingetragen wird bekanntgemacht:\nDen Gläubigern der an der Ausgliederung beteiligten Rechtsträger ist, wenn sie binnen sechs Monaten nach dem Tag, an dem die Eintragung der Ausgliederung in das Register des Sitzes desjenigen Rechtsträgers, dessen Gläubiger sie sind, nach § 19 Abs. 3 UmwG als bekanntgemacht gilt, ihren Anspruch nach Grund und Höhe schriftlich anmelden, Sicherheit zu leisten, soweit sie nicht Befriedigung verlangen können. Dieses Recht steht den Gläubigern jedoch nur zu, wenn sie glaubhaft machen, dass durch die Ausgliederung die Erfüllung ihrer Forderung gefährdet wird."
    },
    {
      "date": "2025-12-22",
      "id": "140764",
      "original_text": "Registerbekanntmachung nach dem Umwandlungsgesetz\nBaden-Württemberg Amtsgericht Ulm HRA 729834\nReinhold Schulz - Immobilien e.K. – Tettnang",
      "type": "Registerbekanntmachung nach dem Umwandlungsgesetz",
      "state": "Baden-Württemberg",
      "amtsgericht": "Amtsgericht Ulm",
      "registernummer": "HRA 729834",
      "registerart": "HRA",
      "company_name": "Reinhold Schulz - Immobilien e.K.",
      "company_seat": "Tettnang",
      "details": "22.12.2025 (Bekanntmachungsdatum)\n\nBaden-Württemberg Amtsgericht Ulm HRA 729834\nRegisterbekanntmachung nach dem Umwandlungsgesetz 22.12.2025 (Eintragungsdatum)\n\nReinhold Schulz - Immobilien e.K.\nEinzelkaufmann / Einzelkauffrau\nTettnang\n\nAls nicht eingetragen wird bekanntgemacht:\nDen Gläubigern der an der Ausgliederung beteiligten Rechtsträger ist, wenn sie binnen sechs Monaten nach dem Tag, an dem die Eintragung der Ausgliederung in das Register des Sitzes desjenigen Rechtsträgers, dessen Gläubiger sie sind, nach § 19 Abs. 3 UmwG als bekanntgemacht gilt, ihren Anspruch nach Grund und Höhe schriftlich anmelden, Sicherheit zu leisten, soweit sie nicht Befriedigung verlangen können. Dieses Recht steht den Gläubigern jedoch nur zu, wenn sie glaubhaft machen, dass durch die Ausgliederung die Erfüllung ihrer Forderung gefährdet wird."
    },
    {
      "date": "2025-12-22",
      "id": "140765",
      "original_text": "Löschungsankündigung\nBaden-Württemberg Amtsgericht Stuttgart HRB 764275\nRK Objektausbau GmbH – Hohenstein",
      "type": "Löschungsankündigung",
      "state": "Baden-Württemberg",
      "amtsgericht": "Amtsgericht Stuttgart",
      "registernummer": "HRB 764275",
      "registerart": "HRB",
      "company_name": "RK Objektausbau GmbH",
      "company_seat": "Hohenstein",
      "details": "22.12.2025 (Bekanntmachungsdatum)\n\nBaden-Württemberg Amtsgericht Stuttgart HRB 764275\nLöschungsankündigung\n\nRK Objektausbau GmbH\nGesellschaft mit beschränkter Haftung\nHohenstein\n\nDas Gericht beabsichtigt, die Gesellschaft wegen Vermögenslosigkeit im Handelsregister von Amts wegen nach § 394 FamFG zu löschen. Die Frist zur Geltendmachung eines Widerspruchs gegen die beabsichtigte Löschung ist auf einen Monat ab Veröffentlichung bestimmt."
    },
    {
      "date": "2025-12-22",
      "id": "140766",
      "original_text": "Löschungsankündigung\nSchleswig-Holstein Amtsgericht Flensburg HRA 9115\nLimitless Networks GmbH & Co. KG – Freienwill",
      "type": "Löschungsankündigung",
      "state": "Schleswig-Holstein",
      "amtsgericht": "Amtsgericht Flensburg",
      "registernummer": "HRA 9115",
      "registerart": "HRA",
      "company_name": "Limitless Networks GmbH & Co. KG",
      "company_seat": "Freienwill",
      "details": "22.12.2025 (Bekanntmachungsdatum)\n\nSchleswig-Holstein Amtsgericht Flensburg HRA 9115\nLöschungsankündigung\n\nLimitless Networks GmbH & Co. KG\nKommanditgesellschaft\nFreienwill\n\nEs ist die Löschung der nachstehenden Gesellschaft wegen Vermögenslosigkeit gemäß § 394 FamFG beabsichtigt.\nWiderspruchsfrist: 2 Monate"
    },
    {
      "date": "2025-12-22",
      "id": "140767",
      "original_text": "Einreichung neuer Dokumente\nBerlin Amtsgericht Berlin (Charlottenburg) HRB 156846\nvolders GmbH – Berlin",
      "type": "Einreichung neuer Dokumente",
      "state": "Berlin",
      "amtsgericht": "Amtsgericht Berlin (Charlottenburg)",
      "registernummer": "HRB 156846",
      "registerart": "HRB",
      "company_name": "volders GmbH",
      "company_seat": "Berlin",
      "details": "22.12.2025 (Bekanntmachungsdatum)\n\nBerlin Amtsgericht Berlin (Charlottenburg) HRB 156846\nEinreichung neuer Dokumente\n\nvolders GmbH\nGesellschaft mit beschränkter Haftung\nBerlin\n\nAls nicht eingetragen wird veröffentlicht:\nEs wurde eine neue Liste der Beiratsmitglieder eingereicht (§52 GmbHG)."
    },
    {
      "date": "2025-12-22",
      "id": "140768",
      "original_text": "Löschungsankündigung\nSchleswig-Holstein Amtsgericht Flensburg HRB 12716\nOWA-Handel UG (haftungsbeschränkt) – Ringsberg",
      "type": "Löschungsankündigung",
      "state": "Schleswig-Holstein",
      "amtsgericht": "Amtsgericht Flensburg",
      "registernummer": "HRB 12716",
      "registerart": "HRB",
      "company_name": "OWA-Handel UG (haftungsbeschränkt)",
      "company_seat": "Ringsberg",
      "details": "22.12.2025 (Bekanntmachungsdatum)\n\nSchleswig-Holstein Amtsgericht Flensburg HRB 12716\nLöschungsankündigung\n\nOWA-Handel UG (haftungsbeschränkt)\nGesellschaft mit beschränkter Haftung\nRingsberg\n\nEs ist die Löschung der nachstehenden Gesellschaft wegen Vermögenslosigkeit gemäß § 394 FamFG beabsichtigt.\nWiderspruchsfrist: 2 Monate"
    },
    {
      "date": "2025-12-22",
      "id": "140769",
      "original_text": "Registerbekanntmachung nach dem Umwandlungsgesetz\nSachsen Amtsgericht Dresden HRB 43067\nIRIS Engineering - Renewables GmbH – Dresden",
      "type": "Registerbekanntmachung nach dem Umwandlungsgesetz",
      "state": "Sachsen",
      "amtsgericht": "Amtsgericht Dresden",
      "registernummer": "HRB 43067",
      "registerart": "HRB",
      "company_name": "IRIS Engineering - Renewables GmbH",
      "company_seat": "Dresden",
      "details": "22.12.2025 (Bekanntmachungsdatum)\n\nSachsen Amtsgericht Dresden HRB 43067\nRegisterbekanntmachung nach dem Umwandlungsgesetz 22.12.2025 (Eintragungsdatum)\n\nIRIS Engineering - Renewables GmbH\nGesellschaft mit beschränkter Haftung\nDresden\n\nDen Gläubigern der an der Verschmelzung beteiligten Rechtsträger ist, wenn sie binnen sechs Monaten nach dem Tag, an dem die Eintragung der Verschmelzung in das Register des Sitzes desjenigen Rechtsträgers, dessen Gläubiger sie sind, nach § 19 Abs. 3 UmwG als bekannt gemacht gilt, ihren Anspruch nach Grund und Höhe in Textform anmelden, Sicherheit zu leisten, soweit sie nicht Befriedigung verlangen können. Dieses Recht steht den Gläubigern jedoch nur zu, wenn sie glaubhaft machen, dass durch die Verschmelzung die Erfüllung der Forderung gefährdet wird."
    },
    {
      "date": "2025-12-22",
      "id": "140770",
      "original_text": "Registerbekanntmachung nach dem Umwandlungsgesetz\nSachsen Amtsgericht Dresden HRB 20230\nDDV Elbland GmbH – Meißen",
      "type": "Registerbekanntmachung nach dem Umwandlungsgesetz",
      "state": "Sachsen",
      "amtsgericht": "Amtsgericht Dresden",
      "registernummer": "HRB 20230",
      "registerart": "HRB",
      "company_name": "DDV Elbland GmbH",
      "company_seat": "Meißen",
      "details": "22.12.2025 (Bekanntmachungsdatum)\n\nSachsen Amtsgericht Dresden HRB 20230\nRegisterbekanntmachung nach dem Umwandlungsgesetz 22.12.2025 (Eintragungsdatum)\n\nDDV Elbland GmbH\nGesellschaft mit beschränkter Haftung\nMeißen\n\nDen Gläubigern der an der Verschmelzung beteiligten Rechtsträger ist, wenn sie binnen sechs Monaten nach dem Tag, an dem die Eintragung der Verschmelzung in das Register des Sitzes desjenigen Rechtsträgers, dessen Gläubiger sie sind, nach § 19 Abs. 3 UmwG als bekannt gemacht gilt, ihren Anspruch nach Grund und Höhe in Textform anmelden, Sicherheit zu leisten, soweit sie nicht Befriedigung verlangen können. Dieses Recht steht den Gläubigern jedoch nur zu, wenn sie glaubhaft machen, dass durch die Verschmelzung die Erfüllung der Forderung gefährdet wird."
    },
    {
      "date": "2025-12-22",
      "id": "140771",
      "original_text": "Registerbekanntmachung nach dem Umwandlungsgesetz\nSachsen Amtsgericht Leipzig GsR 612\nKarin Kroker und Michael Haake eGbR – Leipzig",
      "type": "Registerbekanntmachung nach dem Umwandlungsgesetz",
      "state": "Sachsen",
      "amtsgericht": "Amtsgericht Leipzig",
      "registernummer": "GsR 612",
      "registerart": "GsR",
      "company_name": "Karin Kroker und Michael Haake eGbR",
      "company_seat": "Leipzig",
      "details": "22.12.2025 (Bekanntmachungsdatum)\n\nSachsen Amtsgericht Leipzig GsR 612\nRegisterbekanntmachung nach dem Umwandlungsgesetz 22.12.2025 (Eintragungsdatum)\n\nKarin Kroker und Michael Haake eGbR\nGesellschaft bürgerlichen Rechts\nLeipzig\n\nDen Gläubigern der an der Verschmelzung beteiligten Rechtsträger ist, wenn sie binnen sechs Monaten nach dem Tag, an dem die Eintragung der Verschmelzung in das Register des Sitzes desjenigen Rechtsträgers, dessen Gläubiger sie sind, nach § 19 Abs. 3 UmwG als bekannt gemacht gilt, ihren Anspruch nach Grund und Höhe in Textform anmelden, Sicherheit zu leisten, soweit sie nicht Befriedigung verlangen können. Dieses Recht steht den Gläubigern jedoch nur zu, wenn sie glaubhaft machen, dass durch die Verschmelzung die Erfüllung der Forderung gefährdet wird."
    },
    {
      "date": "2025-12-22",
      "id": "140772",
      "original_text": "Registerbekanntmachung nach dem Umwandlungsgesetz\nSachsen Amtsgericht Leipzig HRA 19791\nIngenieurbüro Steven Schlender e.K. – Colditz",
      "type": "Registerbekanntmachung nach dem Umwandlungsgesetz",
      "state": "Sachsen",
      "amtsgericht": "Amtsgericht Leipzig",
      "registernummer": "HRA 19791",
      "registerart": "HRA",
      "company_name": "Ingenieurbüro Steven Schlender e.K.",
      "company_seat": "Colditz",
      "details": "22.12.2025 (Bekanntmachungsdatum)\n\nSachsen Amtsgericht Leipzig HRA 19791\nRegisterbekanntmachung nach dem Umwandlungsgesetz 22.12.2025 (Eintragungsdatum)\n\nIngenieurbüro Steven Schlender e.K.\nEinzelkaufmann / Einzelkauffrau\nColditz\n\nDen Gläubigern der an der Ausgliederung beteiligten Rechtsträger ist, wenn sie binnen sechs Monaten nach dem Tag, an dem die Eintragung der Ausgliederung in das Register des Sitzes desjenigen Rechtsträgers, dessen Gläubiger sie sind, nach § 19 Abs. 3 UmwG als bekannt gemacht gilt, ihren Anspruch nach Grund und Höhe in Textform anmelden, Sicherheit zu leisten, soweit sie nicht Befriedigung verlangen können. Dieses Recht steht den Gläubigern jedoch nur zu, wenn sie glaubhaft machen, dass durch die Ausgliederung die Erfüllung der Forderung gefährdet wird."
    },
    {
      "date": "2025-12-22",
      "id": "140773",
      "original_text": "Registerbekanntmachung nach dem Umwandlungsgesetz\nSachsen Amtsgericht Dresden HRB 45354\nOSIRIS Off Shore International Repair & Installation Services GmbH – Dresden",
      "type": "Registerbekanntmachung nach dem Umwandlungsgesetz",
      "state": "Sachsen",
      "amtsgericht": "Amtsgericht Dresden",
      "registernummer": "HRB 45354",
      "registerart": "HRB",
      "company_name": "OSIRIS Off Shore International Repair & Installation Services GmbH",
      "company_seat": "Dresden",
      "details": "22.12.2025 (Bekanntmachungsdatum)\n\nSachsen Amtsgericht Dresden HRB 45354\nRegisterbekanntmachung nach dem Umwandlungsgesetz 22.12.2025 (Eintragungsdatum)\n\nOSIRIS Off Shore International Repair & Installation Services GmbH\nGesellschaft mit beschränkter Haftung\nDresden\n\nDen Gläubigern der an der Verschmelzung beteiligten Rechtsträger ist, wenn sie binnen sechs Monaten nach dem Tag, an dem die Eintragung der Verschmelzung in das Register des Sitzes desjenigen Rechtsträgers, dessen Gläubiger sie sind, nach § 19 Abs. 3 UmwG als bekannt gemacht gilt, ihren Anspruch nach Grund und Höhe in Textform anmelden, Sicherheit zu leisten, soweit sie nicht Befriedigung verlangen können. Dieses Recht steht den Gläubigern jedoch nur zu, wenn sie glaubhaft machen, dass durch die Verschmelzung die Erfüllung der Forderung gefährdet wird."
    },
    {
      "date": "2025-12-22",
      "id": "140774",
      "original_text": "Löschungsankündigung\nSachsen Amtsgericht Leipzig HRB 34820\nDie Trockenbauer UG (haftungsbeschränkt) – Leipzig",
      "type": "Löschungsankündigung",
      "state": "Sachsen",
      "amtsgericht": "Amtsgericht Leipzig",
      "registernummer": "HRB 34820",
      "registerart": "HRB",
      "company_name": "Die Trockenbauer UG (haftungsbeschränkt)",
      "company_seat": "Leipzig",
      "details": "22.12.2025 (Bekanntmachungsdatum)\n\nSachsen Amtsgericht Leipzig HRB 34820\nLöschungsankündigung 22.12.2025 (Eintragungsdatum)\n\nDie Trockenbauer UG (haftungsbeschränkt)\nGesellschaft mit beschränkter Haftung\nLeipzig\n\nDas Registergericht beabsichtigt, die im Handelsregister eingetragene Gesellschaft von Amts wegen nach § 394 FamFG zu löschen. Die Frist zu Erhebung eines Widerspruchs gegen die beabsichtigte Löschung wird auf einen Monat festgesetzt."
    },
    {
      "date": "2025-12-22",
      "id": "140775",
      "original_text": "Löschungsankündigung\nSachsen Amtsgericht Dresden HRB 36174\nObjektgesellschaft Schmöckwitz - Godbersenstraße 26/27 mbH – Radeberg",
      "type": "Löschungsankündigung",
      "state": "Sachsen",
      "amtsgericht": "Amtsgericht Dresden",
      "registernummer": "HRB 36174",
      "registerart": "HRB",
      "company_name": "Objektgesellschaft Schmöckwitz - Godbersenstraße 26/27 mbH",
      "company_seat": "Radeberg",
      "details": "22.12.2025 (Bekanntmachungsdatum)\n\nSachsen Amtsgericht Dresden HRB 36174\nLöschungsankündigung\n\nObjektgesellschaft Schmöckwitz - Godbersenstraße 26/27 mbH\nGesellschaft mit beschränkter Haftung\nRadeberg\n\nDas Registergericht beabsichtigt, die im Handelsregister eingetragene Gesellschaft von Amts wegen nach § 394 FamFG zu löschen. Die Frist zu Erhebung eines Widerspruchs gegen die beabsichtigte Löschung wird auf einen Monat festgesetzt."
    },
    {
      "date": "2025-12-22",
      "id": "140776",
      "original_text": "Registerbekanntmachung nach dem Umwandlungsgesetz\nSachsen Amtsgericht Leipzig HRA 19803\nBaugeschäft Glass e.K. – Leipzig",
      "type": "Registerbekanntmachung nach dem Umwandlungsgesetz",
      "state": "Sachsen",
      "amtsgericht": "Amtsgericht Leipzig",
      "registernummer": "HRA 19803",
      "registerart": "HRA",
      "company_name": "Baugeschäft Glass e.K.",
      "company_seat": "Leipzig",
      "details": "22.12.2025 (Bekanntmachungsdatum)\n\nSachsen Amtsgericht Leipzig HRA 19803\nRegisterbekanntmachung nach dem Umwandlungsgesetz 22.12.2025 (Eintragungsdatum)\n\nBaugeschäft Glass e.K.\nEinzelkaufmann / Einzelkauffrau\nLeipzig\n\nDen Gläubigern der an der Verschmelzung beteiligten Rechtsträger ist, wenn sie binnen sechs Monaten nach dem Tag, an dem die Eintragung der Verschmelzung in das Register des Sitzes desjenigen Rechtsträgers, dessen Gläubiger sie sind, nach § 19 Abs. 3 UmwG als bekannt gemacht gilt, ihren Anspruch nach Grund und Höhe in Textform anmelden, Sicherheit zu leisten, soweit sie nicht Befriedigung verlangen können. Dieses Recht steht den Gläubigern jedoch nur zu, wenn sie glaubhaft machen, dass durch die Verschmelzung die Erfüllung der Forderung gefährdet wird."
    },
    {
      "date": "2025-12-22",
      "id": "140777",
      "original_text": "Registerbekanntmachung nach dem Umwandlungsgesetz\nSachsen Amtsgericht Leipzig HRB 40127\nBaugeschäft Glass UG (haftungsbeschränkt) – Leipzig",
      "type": "Registerbekanntmachung nach dem Umwandlungsgesetz",
      "state": "Sachsen",
      "amtsgericht": "Amtsgericht Leipzig",
      "registernummer": "HRB 40127",
      "registerart": "HRB",
      "company_name": "Baugeschäft Glass UG (haftungsbeschränkt)",
      "company_seat": "Leipzig",
      "details": "22.12.2025 (Bekanntmachungsdatum)\n\nSachsen Amtsgericht Leipzig HRB 40127\nRegisterbekanntmachung nach dem Umwandlungsgesetz 22.12.2025 (Eintragungsdatum)\n\nBaugeschäft Glass UG (haftungsbeschränkt)\nGesellschaft mit beschränkter Haftung\nLeipzig\n\nDen Gläubigern der an der Verschmelzung beteiligten Rechtsträger ist, wenn sie binnen sechs Monaten nach dem Tag, an dem die Eintragung der Verschmelzung in das Register des Sitzes desjenigen Rechtsträgers, dessen Gläubiger sie sind, nach § 19 Abs. 3 UmwG als bekannt gemacht gilt, ihren Anspruch nach Grund und Höhe in Textform anmelden, Sicherheit zu leisten, soweit sie nicht Befriedigung verlangen können. Dieses Recht steht den Gläubigern jedoch nur zu, wenn sie glaubhaft machen, dass durch die Verschmelzung die Erfüllung der Forderung gefährdet wird."
    },
    {
      "date": "2025-12-22",
      "id": "140778",
      "original_text": "Registerbekanntmachung nach dem Umwandlungsgesetz\nSachsen Amtsgericht Dresden HRB 17837\nDDV Bautzen GmbH – Bautzen",
      "type": "Registerbekanntmachung nach dem Umwandlungsgesetz",
      "state": "Sachsen",
      "amtsgericht": "Amtsgericht Dresden",
      "registernummer": "HRB 17837",
      "registerart": "HRB",
      "company_name": "DDV Bautzen GmbH",
      "company_seat": "Bautzen",
      "details": "22.12.2025 (Bekanntmachungsdatum)\n\nSachsen Amtsgericht Dresden HRB 17837\nRegisterbekanntmachung nach dem Umwandlungsgesetz 22.12.2025 (Eintragungsdatum)\n\nDDV Bautzen GmbH\nGesellschaft mit beschränkter Haftung\nBautzen\n\nDen Gläubigern der an der Verschmelzung beteiligten Rechtsträger ist, wenn sie binnen sechs Monaten nach dem Tag, an dem die Eintragung der Verschmelzung in das Register des Sitzes desjenigen Rechtsträgers, dessen Gläubiger sie sind, nach § 19 Abs. 3 UmwG als bekannt gemacht gilt, ihren Anspruch nach Grund und Höhe in Textform anmelden, Sicherheit zu leisten, soweit sie nicht Befriedigung verlangen können. Dieses Recht steht den Gläubigern jedoch nur zu, wenn sie glaubhaft machen, dass durch die Verschmelzung die Erfüllung der Forderung gefährdet wird."
    },
    {
      "date": "2025-12-22",
      "id": "140779",
      "original_text": "Einreichung neuer Dokumente\nSachsen Amtsgericht Chemnitz HRB 19751\nenvia Mitteldeutsche Energie AG – Chemnitz",
      "type": "Einreichung neuer Dokumente",
      "state": "Sachsen",
      "amtsgericht": "Amtsgericht Chemnitz",
      "registernummer": "HRB 19751",
      "registerart": "HRB",
      "company_name": "envia Mitteldeutsche Energie AG",
      "company_seat": "Chemnitz",
      "details": "22.12.2025 (Bekanntmachungsdatum)\n\nSachsen Amtsgericht Chemnitz HRB 19751\nEinreichung neuer Dokumente\n\nenvia Mitteldeutsche Energie AG\nAktiengesellschaft\nChemnitz\n\nAm 18.12.2025 wurde beim Handelsregister des Amtsgerichts Chemnitz die Liste der Mitglieder des Aufsichtsrats gemäß § 106 AktG eingereicht."
    },
    {
      "date": "2025-12-22",
      "id": "140780",
      "original_text": "Registerbekanntmachung nach dem Umwandlungsgesetz\nSachsen Amtsgericht Leipzig HRB 43334\nIngenieurbüro Schlender GmbH – Colditz",
      "type": "Registerbekanntmachung nach dem Umwandlungsgesetz",
      "state": "Sachsen",
      "amtsgericht": "Amtsgericht Leipzig",
      "registernummer": "HRB 43334",
      "registerart": "HRB",
      "company_name": "Ingenieurbüro Schlender GmbH",
      "company_seat": "Colditz",
      "details": "22.12.2025 (Bekanntmachungsdatum)\n\nSachsen Amtsgericht Leipzig HRB 43334\nRegisterbekanntmachung nach dem Umwandlungsgesetz 22.12.2025 (Eintragungsdatum)\n\nIngenieurbüro Schlender GmbH\nGesellschaft mit beschränkter Haftung\nColditz\n\nDen Gläubigern der an der Ausgliederung beteiligten Rechtsträger ist, wenn sie binnen sechs Monaten nach dem Tag, an dem die Eintragung der Ausgliederung in das Register des Sitzes desjenigen Rechtsträgers, dessen Gläubiger sie sind, nach § 19 Abs. 3 UmwG als bekannt gemacht gilt, ihren Anspruch nach Grund und Höhe in Textform anmelden, Sicherheit zu leisten, soweit sie nicht Befriedigung verlangen können. Dieses Recht steht den Gläubigern jedoch nur zu, wenn sie glaubhaft machen, dass durch die Ausgliederung die Erfüllung der Forderung gefährdet wird."
    },
    {
      "date": "2025-12-22",
      "id": "140781",
      "original_text": "Registerbekanntmachung nach dem Umwandlungsgesetz\nNiedersachsen Amtsgericht Osnabrück HRB 213177\nMUUUH! Digital GmbH – Osnabrück",
      "type": "Registerbekanntmachung nach dem Umwandlungsgesetz",
      "state": "Niedersachsen",
      "amtsgericht": "Amtsgericht Osnabrück",
      "registernummer": "HRB 213177",
      "registerart": "HRB",
      "company_name": "MUUUH! Digital GmbH",
      "company_seat": "Osnabrück",
      "details": "22.12.2025 (Bekanntmachungsdatum)\n\nNiedersachsen Amtsgericht Osnabrück HRB 213177\nRegisterbekanntmachung nach dem Umwandlungsgesetz 22.12.2025 (Eintragungsdatum)\n\nMUUUH! Digital GmbH\nGesellschaft mit beschränkter Haftung\nOsnabrück\n\nDen Gläubigern der an der Verschmelzung beteiligten Rechtsträger ist, wenn sie binnen sechs Monaten nach dem Tag, an dem die Eintragung der Verschmelzung in das Register des Sitzes desjenigen Rechtsträgers, dessen Gläubiger sie sind, nach § 19  Abs.  3 UmwG als bekannt gemacht gilt, ihren Anspruch nach Grund und Höhe schriftlich anmelden, Sicherheit zu leisten, soweit sie nicht Befriedigung verlangen können. Dieses Recht steht den Gläubigern jedoch nur zu, wenn sie glaubhaft machen, dass durch die Verschmelzung die Erfüllung der Forderung gefährdet wird."
    },
    {
      "date": "2025-12-22",
      "id": "140782",
      "original_text": "Registerbekanntmachung nach dem Umwandlungsgesetz\nNiedersachsen Amtsgericht Hildesheim HRB 202867\nTimberpak GmbH – Lehrte",
      "type": "Registerbekanntmachung nach dem Umwandlungsgesetz",
      "state": "Niedersachsen",
      "amtsgericht": "Amtsgericht Hildesheim",
      "registernummer": "HRB 202867",
      "registerart": "HRB",
      "company_name": "Timberpak GmbH",
      "company_seat": "Lehrte",
      "details": "22.12.2025 (Bekanntmachungsdatum)\n\nNiedersachsen Amtsgericht Hildesheim HRB 202867\nRegisterbekanntmachung nach dem Umwandlungsgesetz 22.12.2025 (Eintragungsdatum)\n\nTimberpak GmbH\nGesellschaft mit beschränkter Haftung\nLehrte\n\nDen Gläubigern der an der Verschmelzung beteiligten Rechtsträger ist, wenn sie binnen sechs Monaten nach dem Tag, an dem die Eintragung der Verschmelzung in das Register des Sitzes desjenigen Rechtsträgers, dessen Gläubiger sie sind, nach § 19  Abs.  3 UmwG als bekannt gemacht gilt, ihren Anspruch nach Grund und Höhe schriftlich anmelden, Sicherheit zu leisten, soweit sie nicht Befriedigung verlangen können. Dieses Recht steht den Gläubigern jedoch nur zu, wenn sie glaubhaft machen, dass durch die Verschmelzung die Erfüllung der Forderung gefährdet wird."
    },
    {
      "date": "2025-12-22",
      "id": "140783",
      "original_text": "Löschungsankündigung\nNiedersachsen Amtsgericht Hildesheim HRB 202738\nBochnia Hightech Hometech UG (haftungsbeschränkt) – Ilsede",
      "type": "Löschungsankündigung",
      "state": "Niedersachsen",
      "amtsgericht": "Amtsgericht Hildesheim",
      "registernummer": "HRB 202738",
      "registerart": "HRB",
      "company_name": "Bochnia Hightech Hometech UG (haftungsbeschränkt)",
      "company_seat": "Ilsede",
      "details": "22.12.2025 (Bekanntmachungsdatum)\n\nNiedersachsen Amtsgericht Hildesheim HRB 202738\nLöschungsankündigung\n\nBochnia Hightech Hometech UG (haftungsbeschränkt)\nGesellschaft mit beschränkter Haftung\nIlsede\n\nDas Registergericht beabsichtigt, die Gesellschaft von Amts wegen nach § 394 FamFG zu löschen. Die Frist zur Erhebung eines Widerspruchs ist auf 1 Monat ab dieser Registerbekanntmachung festgesetzt."
    },
    {
      "date": "2025-12-22",
      "id": "140784",
      "original_text": "Löschungsankündigung\nNiedersachsen Amtsgericht Aurich HRB 206729\nDaGo Service GmbH – Emden",
      "type": "Löschungsankündigung",
      "state": "Niedersachsen",
      "amtsgericht": "Amtsgericht Aurich",
      "registernummer": "HRB 206729",
      "registerart": "HRB",
      "company_name": "DaGo Service GmbH",
      "company_seat": "Emden",
      "details": "22.12.2025 (Bekanntmachungsdatum)\n\nNiedersachsen Amtsgericht Aurich HRB 206729\nLöschungsankündigung 22.12.2025 (Eintragungsdatum)\n\nDaGo Service GmbH\nGesellschaft mit beschränkter Haftung\nEmden\n\nDas Registergericht beabsichtigt, die Gesellschaft von Amts wegen nach § 393 FamFG zu löschen. Die Frist zur Erhebung eines Widerspruchs ist auf 3 Monate ab dieser Registerbekanntmachung festgesetzt."
    },
    {
      "date": "2025-12-22",
      "id": "140785",
      "original_text": "Registerbekanntmachung nach dem Umwandlungsgesetz\nNiedersachsen Amtsgericht Aurich HRA 202584\nUpstalsboom Ferienwohnungen GmbH & Co. KG – Emden",
      "type": "Registerbekanntmachung nach dem Umwandlungsgesetz",
      "state": "Niedersachsen",
      "amtsgericht": "Amtsgericht Aurich",
      "registernummer": "HRA 202584",
      "registerart": "HRA",
      "company_name": "Upstalsboom Ferienwohnungen GmbH & Co. KG",
      "company_seat": "Emden",
      "details": "22.12.2025 (Bekanntmachungsdatum)\n\nNiedersachsen Amtsgericht Aurich HRA 202584\nRegisterbekanntmachung nach dem Umwandlungsgesetz 22.12.2025 (Eintragungsdatum)\n\nUpstalsboom Ferienwohnungen GmbH & Co. KG\nKommanditgesellschaft\nEmden\n\nDen Gläubigern der an der Ausgliederung beteiligten Rechtsträger ist, wenn sie binnen sechs Monaten nach dem Tag, an dem die Eintragung der Ausgliederung in das Register des Sitzes desjenigen Rechtsträgers, dessen Gläubiger sie sind, nach § 19 Abs. 3 UmwG als bekannt gemacht gilt, ihren Anspruch nach Grund und Höhe schriftlich anmelden, Sicherheit zu leisten, soweit sie nicht Befriedigung verlangen können. Dieses Recht steht den Gläubigern jedoch nur zu, wenn sie glaubhaft machen, dass durch die Ausgliederung die Erfüllung der Forderung gefährdet wird."
    },
    {
      "date": "2025-12-22",
      "id": "140786",
      "original_text": "Registerbekanntmachung nach dem Umwandlungsgesetz\nNiedersachsen Amtsgericht Oldenburg (Oldenburg) HRB 210039\nRBA Holding GmbH – Oldenburg",
      "type": "Registerbekanntmachung nach dem Umwandlungsgesetz",
      "state": "Niedersachsen",
      "amtsgericht": "Amtsgericht Oldenburg (Oldenburg)",
      "registernummer": "HRB 210039",
      "registerart": "HRB",
      "company_name": "RBA Holding GmbH",
      "company_seat": "Oldenburg",
      "details": "22.12.2025 (Bekanntmachungsdatum)\n\nNiedersachsen Amtsgericht Oldenburg (Oldenburg) HRB 210039\nRegisterbekanntmachung nach dem Umwandlungsgesetz 22.12.2025 (Eintragungsdatum)\n\nRBA Holding GmbH\nGesellschaft mit beschränkter Haftung\nOldenburg\n\nDen Gläubigern der an der Verschmelzung beteiligten Rechtsträger ist, wenn sie binnen sechs Monaten nach dem Tag, an dem die Eintragung der Verschmelzung in das Register des Sitzes desjenigen Rechtsträgers, dessen Gläubiger sie sind, nach § 19  Abs.  3 UmwG als bekannt gemacht gilt, ihren Anspruch nach Grund und Höhe schriftlich anmelden, Sicherheit zu leisten, soweit sie nicht Befriedigung verlangen können. Dieses Recht steht den Gläubigern jedoch nur zu, wenn sie glaubhaft machen, dass durch die Verschmelzung die Erfüllung der Forderung gefährdet wird."
    },
    {
      "date": "2025-12-22",
      "id": "140787",
      "original_text": "Löschungsankündigung\nNiedersachsen Amtsgericht Osnabrück VR 2737\n\"Belmer Marktring e. V.\" – Belm",
      "type": "Löschungsankündigung",
      "state": "Niedersachsen",
      "amtsgericht": "Amtsgericht Osnabrück",
      "registernummer": "VR 2737",
      "registerart": "VR",
      "company_name": "\"Belmer Marktring e. V.\"",
      "company_seat": "Belm",
      "details": "22.12.2025 (Bekanntmachungsdatum)\n\nNiedersachsen Amtsgericht Osnabrück VR 2737\nLöschungsankündigung 22.12.2025 (Eintragungsdatum)\n\n\"Belmer Marktring e. V.\"\neingetragener Verein\nBelm\n\nDas Registergericht beabsichtigt, den Verein wegen Wegfall aller Mitglieder von Amts wegen nach § 395 FamFG zu löschen. Die Frist zur Erhebung eines Widerspruchs ist auf 1 Monat ab dieser Registerbekanntmachung festgesetzt."
    },
    {
      "date": "2025-12-22",
      "id": "140788",
      "original_text": "Löschungsankündigung\nNiedersachsen Amtsgericht Osnabrück HRB 211350\nWiesbauer Beteiligungs GmbH – Bissendorf",
      "type": "Löschungsankündigung",
      "state": "Niedersachsen",
      "amtsgericht": "Amtsgericht Osnabrück",
      "registernummer": "HRB 211350",
      "registerart": "HRB",
      "company_name": "Wiesbauer Beteiligungs GmbH",
      "company_seat": "Bissendorf",
      "details": "22.12.2025 (Bekanntmachungsdatum)\n\nNiedersachsen Amtsgericht Osnabrück HRB 211350\nLöschungsankündigung\n\nWiesbauer Beteiligungs GmbH\nGesellschaft mit beschränkter Haftung\nBissendorf\n\nDas Registergericht beabsichtigt, die Gesellschaft von Amts wegen nach § 394 FamFG wegen Vermögenslosigkeit zu löschen. Die Frist zur Erhebung eines Widerspruchs ist auf 1 Monat ab dieser Registerbekanntmachung festgesetzt."
    },
    {
      "date": "2025-12-22",
      "id": "140789",
      "original_text": "Einreichung neuer Dokumente\nNiedersachsen Amtsgericht Hannover HRB 213645\nGesellschaft für Sozialen Wohnungsbau und Projektentwicklung mbH – Hameln",
      "type": "Einreichung neuer Dokumente",
      "state": "Niedersachsen",
      "amtsgericht": "Amtsgericht Hannover",
      "registernummer": "HRB 213645",
      "registerart": "HRB",
      "company_name": "Gesellschaft für Sozialen Wohnungsbau und Projektentwicklung mbH",
      "company_seat": "Hameln",
      "details": "22.12.2025 (Bekanntmachungsdatum)\n\nNiedersachsen Amtsgericht Hannover HRB 213645\nEinreichung neuer Dokumente\n\nGesellschaft für Sozialen Wohnungsbau und Projektentwicklung mbH\nGesellschaft mit beschränkter Haftung\nHameln\n\nDie Liste der Mitglieder des Aufsichtsrats wurde beim Registergericht eingereicht."
    },
    {
      "date": "2025-12-22",
      "id": "140790",
      "original_text": "Löschungsankündigung\nNiedersachsen Amtsgericht Osnabrück HRB 218746\nHulskers Tiefbau UG (haftungsbeschränkt) – Haren (Ems)",
      "type": "Löschungsankündigung",
      "state": "Niedersachsen",
      "amtsgericht": "Amtsgericht Osnabrück",
      "registernummer": "HRB 218746",
      "registerart": "HRB",
      "company_name": "Hulskers Tiefbau UG (haftungsbeschränkt)",
      "company_seat": "Haren (Ems)",
      "details": "22.12.2025 (Bekanntmachungsdatum)\n\nNiedersachsen Amtsgericht Osnabrück HRB 218746\nLöschungsankündigung 22.12.2025 (Eintragungsdatum)\n\nHulskers Tiefbau UG (haftungsbeschränkt)\nGesellschaft mit beschränkter Haftung\nHaren (Ems)\n\nDas Registergericht beabsichtigt, die Gesellschaft von Amts wegen nach § 394 FamFG wegen Vermögenslosigkeit zu löschen. Die Frist zur Erhebung eines Widerspruchs ist auf 1 Monat ab dieser Registerbekanntmachung festgesetzt."
    },
    {
      "date": "2025-12-22",
      "id": "140791",
      "original_text": "Registerbekanntmachung nach dem Umwandlungsgesetz\nNiedersachsen Amtsgericht Osnabrück HRB 212744\nJ & K Invest Line GmbH – Lingen (Ems)",
      "type": "Registerbekanntmachung nach dem Umwandlungsgesetz",
      "state": "Niedersachsen",
      "amtsgericht": "Amtsgericht Osnabrück",
      "registernummer": "HRB 212744",
      "registerart": "HRB",
      "company_name": "J & K Invest Line GmbH",
      "company_seat": "Lingen (Ems)",
      "details": "22.12.2025 (Bekanntmachungsdatum)\n\nNiedersachsen Amtsgericht Osnabrück HRB 212744\nRegisterbekanntmachung nach dem Umwandlungsgesetz 22.12.2025 (Eintragungsdatum)\n\nJ & K Invest Line GmbH\nGesellschaft mit beschränkter Haftung\nLingen (Ems)\n\nDen Gläubigern der an der Verschmelzung beteiligten Rechtsträger ist, wenn sie binnen sechs Monaten nach dem Tag, an dem die Eintragung der Verschmelzung in das Register des Sitzes desjenigen Rechtsträgers, dessen Gläubiger sie sind, nach § 19  Abs.  3 UmwG als bekannt gemacht gilt, ihren Anspruch nach Grund und Höhe schriftlich anmelden, Sicherheit zu leisten, soweit sie nicht Befriedigung verlangen können. Dieses Recht steht den Gläubigern jedoch nur zu, wenn sie glaubhaft machen, dass durch die Verschmelzung die Erfüllung der Forderung gefährdet wird."
    },
    {
      "date": "2025-12-22",
      "id": "140792",
      "original_text": "Einreichung neuer Dokumente\nNiedersachsen Amtsgericht Hannover HRB 225647\nContiTech Deutschland GmbH – Hannover",
      "type": "Einreichung neuer Dokumente",
      "state": "Niedersachsen",
      "amtsgericht": "Amtsgericht Hannover",
      "registernummer": "HRB 225647",
      "registerart": "HRB",
      "company_name": "ContiTech Deutschland GmbH",
      "company_seat": "Hannover",
      "details": "22.12.2025 (Bekanntmachungsdatum)\n\nNiedersachsen Amtsgericht Hannover HRB 225647\nEinreichung neuer Dokumente\n\nContiTech Deutschland GmbH\nGesellschaft mit beschränkter Haftung\nHannover\n\nDie Liste der Mitglieder des Aufsichtsrats wurde beim Registergericht eingereicht."
    },
    {
      "date": "2025-12-22",
      "id": "140793",
      "original_text": "Sonstige Registerbekanntmachung\nNiedersachsen Amtsgericht Hannover HRB 100014 früher Amtsgericht Hameln\nHWG Hamelner Wohnungsbau-Gesellschaft mbH – Hameln",
      "type": "Sonstige Registerbekanntmachung",
      "state": "Niedersachsen",
      "amtsgericht": "Amtsgericht Hannover",
      "registernummer": "HRB 100014",
      "registerart": "HRB",
      "company_name": "HWG Hamelner Wohnungsbau-Gesellschaft mbH",
      "company_seat": "Hameln",
      "former_amtsgericht": "Hameln",
      "details": "22.12.2025 (Bekanntmachungsdatum)\n\nNiedersachsen Amtsgericht Hannover HRB 100014 früher Amtsgericht Hameln\nSonstige Registerbekanntmachung\n\nHWG Hamelner Wohnungsbau-Gesellschaft mbH\nGesellschaft mit beschränkter Haftung\nHameln\n\nDie Liste der Mitglieder des Aufsichtsrats wurde beim Registergericht eingereicht."
    },
    {
      "date": "2025-12-22",
      "id": "140794",
      "original_text": "Registerbekanntmachung nach dem Umwandlungsgesetz\nNiedersachsen Amtsgericht Aurich HRA 100204 früher Amtsgericht Emden\nUpstalsboom Hotel + Freizeit GmbH & Co. KG – Emden",
      "type": "Registerbekanntmachung nach dem Umwandlungsgesetz",
      "state": "Niedersachsen",
      "amtsgericht": "Amtsgericht Aurich",
      "registernummer": "HRA 100204",
      "registerart": "HRA",
      "company_name": "Upstalsboom Hotel + Freizeit GmbH & Co. KG",
      "company_seat": "Emden",
      "former_amtsgericht": "Emden",
      "details": "22.12.2025 (Bekanntmachungsdatum)\n\nNiedersachsen Amtsgericht Aurich HRA 100204 früher Amtsgericht Emden\nRegisterbekanntmachung nach dem Umwandlungsgesetz 22.12.2025 (Eintragungsdatum)\n\nUpstalsboom Hotel + Freizeit GmbH & Co. KG\nKommanditgesellschaft\nEmden\n\nDen Gläubigern der an der Ausgliederung beteiligten Rechtsträger ist, wenn sie binnen sechs Monaten nach dem Tag, an dem die Eintragung der Ausgliederung in das Register des Sitzes desjenigen Rechtsträgers, dessen Gläubiger sie sind, nach § 19 Abs. 3 UmwG als bekannt gemacht gilt, ihren Anspruch nach Grund und Höhe schriftlich anmelden, Sicherheit zu leisten, soweit sie nicht Befriedigung verlangen können. Dieses Recht steht den Gläubigern jedoch nur zu, wenn sie glaubhaft machen, dass durch die Ausgliederung die Erfüllung der Forderung gefährdet wird."
    },
    {
      "date": "2025-12-22",
      "id": "140795",
      "original_text": "Registerbekanntmachung nach dem Umwandlungsgesetz\nNiedersachsen Amtsgericht Göttingen HRB 201083\nDRAIS GmbH – Göttingen",
      "type": "Registerbekanntmachung nach dem Umwandlungsgesetz",
      "state": "Niedersachsen",
      "amtsgericht": "Amtsgericht Göttingen",
      "registernummer": "HRB 201083",
      "registerart": "HRB",
      "company_name": "DRAIS GmbH",
      "company_seat": "Göttingen",
      "details": "22.12.2025 (Bekanntmachungsdatum)\n\nNiedersachsen Amtsgericht Göttingen HRB 201083\nRegisterbekanntmachung nach dem Umwandlungsgesetz 22.12.2025 (Eintragungsdatum)\n\nDRAIS GmbH\nGesellschaft mit beschränkter Haftung\nGöttingen\n\nDen Gläubigern der an der Verschmelzung beteiligten Rechtsträger ist, wenn sie binnen sechs Monaten nach dem Tag, an dem die Eintragung der Verschmelzung in das Register des Sitzes desjenigen Rechtsträgers, dessen Gläubiger sie sind, nach § 19  Abs.  3 UmwG als bekannt gemacht gilt, ihren Anspruch nach Grund und Höhe schriftlich anmelden, Sicherheit zu leisten, soweit sie nicht Befriedigung verlangen können. Dieses Recht steht den Gläubigern jedoch nur zu, wenn sie glaubhaft machen, dass durch die Verschmelzung die Erfüllung der Forderung gefährdet wird."
    },
    {
      "date": "2025-12-22",
      "id": "140796",
      "original_text": "Löschungsankündigung\nNiedersachsen Amtsgericht Braunschweig HRB 211471\nSHARKA GmbH – Braunschweig",
      "type": "Löschungsankündigung",
      "state": "Niedersachsen",
      "amtsgericht": "Amtsgericht Braunschweig",
      "registernummer": "HRB 211471",
      "registerart": "HRB",
      "company_name": "SHARKA GmbH",
      "company_seat": "Braunschweig",
      "details": "22.12.2025 (Bekanntmachungsdatum)\n\nNiedersachsen Amtsgericht Braunschweig HRB 211471\nLöschungsankündigung 22.12.2025 (Eintragungsdatum)\n\nSHARKA GmbH\nGesellschaft mit beschränkter Haftung\nBraunschweig\n\nDas Registergericht beabsichtigt, die Gesellschaft von Amts wegen nach § 394 FamFG zu löschen. Die Frist zur Erhebung eines Widerspruchs ist auf 1 Monat ab dieser Registerbekanntmachung festgesetzt."
    },
    {
      "date": "2025-12-22",
      "id": "140797",
      "original_text": "Registerbekanntmachung nach dem Umwandlungsgesetz\nNiedersachsen Amtsgericht Oldenburg (Oldenburg) HRB 216620\nTAbaron GmbH – Oldenburg",
      "type": "Registerbekanntmachung nach dem Umwandlungsgesetz",
      "state": "Niedersachsen",
      "amtsgericht": "Amtsgericht Oldenburg (Oldenburg)",
      "registernummer": "HRB 216620",
      "registerart": "HRB",
      "company_name": "TAbaron GmbH",
      "company_seat": "Oldenburg",
      "details": "22.12.2025 (Bekanntmachungsdatum)\n\nNiedersachsen Amtsgericht Oldenburg (Oldenburg) HRB 216620\nRegisterbekanntmachung nach dem Umwandlungsgesetz 22.12.2025 (Eintragungsdatum)\n\nTAbaron GmbH\nGesellschaft mit beschränkter Haftung\nOldenburg\n\nDen Gläubigern der an der Verschmelzung beteiligten Rechtsträger ist, wenn sie binnen sechs Monaten nach dem Tag, an dem die Eintragung der Verschmelzung in das Register des Sitzes desjenigen Rechtsträgers, dessen Gläubiger sie sind, nach § 19  Abs.  3 UmwG als bekannt gemacht gilt, ihren Anspruch nach Grund und Höhe schriftlich anmelden, Sicherheit zu leisten, soweit sie nicht Befriedigung verlangen können. Dieses Recht steht den Gläubigern jedoch nur zu, wenn sie glaubhaft machen, dass durch die Verschmelzung die Erfüllung der Forderung gefährdet wird."
    },
    {
      "date": "2025-12-22",
      "id": "140798",
      "original_text": "Löschungsankündigung\nNiedersachsen Amtsgericht Osnabrück HRB 219227\nTraum-Mobilheim auf Maß GmbH – Salzbergen",
      "type": "Löschungsankündigung",
      "state": "Niedersachsen",
      "amtsgericht": "Amtsgericht Osnabrück",
      "registernummer": "HRB 219227",
      "registerart": "HRB",
      "company_name": "Traum-Mobilheim auf Maß GmbH",
      "company_seat": "Salzbergen",
      "details": "22.12.2025 (Bekanntmachungsdatum)\n\nNiedersachsen Amtsgericht Osnabrück HRB 219227\nLöschungsankündigung 22.12.2025 (Eintragungsdatum)\n\nTraum-Mobilheim auf Maß GmbH\nGesellschaft mit beschränkter Haftung\nSalzbergen\n\nDas Registergericht beabsichtigt, die Gesellschaft von Amts wegen nach § 394 FamFG wegen Vermögenslosigkeit zu löschen. Die Frist zur Erhebung eines Widerspruchs ist auf 1 Monat ab dieser Registerbekanntmachung festgesetzt."
    },
    {
      "date": "2025-12-22",
      "id": "140799",
      "original_text": "Registerbekanntmachung nach dem Umwandlungsgesetz\nNiedersachsen Amtsgericht Oldenburg (Oldenburg) HRA 140661 früher Amtsgericht Delmenhorst\nKS-Bausysteme GmbH & Co. KG – Ahlhorn",
      "type": "Registerbekanntmachung nach dem Umwandlungsgesetz",
      "state": "Niedersachsen",
      "amtsgericht": "Amtsgericht Oldenburg (Oldenburg)",
      "registernummer": "HRA 140661",
      "registerart": "HRA",
      "company_name": "KS-Bausysteme GmbH & Co. KG",
      "company_seat": "Ahlhorn",
      "former_amtsgericht": "Delmenhorst",
      "details": "22.12.2025 (Bekanntmachungsdatum)\n\nNiedersachsen Amtsgericht Oldenburg (Oldenburg) HRA 140661 früher Amtsgericht Delmenhorst\nRegisterbekanntmachung nach dem Umwandlungsgesetz 22.12.2025 (Eintragungsdatum)\n\nKS-Bausysteme GmbH & Co. KG\nKommanditgesellschaft\nAhlhorn\n\nDen Gläubigern der an der Verschmelzung beteiligten Rechtsträger ist, wenn sie binnen sechs Monaten nach dem Tag, an dem die Eintragung der Verschmelzung in das Register des Sitzes desjenigen Rechtsträgers, dessen Gläubiger sie sind, nach § 19  Abs.  3 UmwG als bekannt gemacht gilt, ihren Anspruch nach Grund und Höhe schriftlich anmelden, Sicherheit zu leisten, soweit sie nicht Befriedigung verlangen können. Dieses Recht steht den Gläubigern jedoch nur zu, wenn sie glaubhaft machen, dass durch die Verschmelzung die Erfüllung der Forderung gefährdet wird."
    },
    {
      "date": "2025-12-22",
      "id": "140800",
      "original_text": "Registerbekanntmachung nach dem Umwandlungsgesetz\nNiedersachsen Amtsgericht Oldenburg (Oldenburg) HRA 207224\nKS-Modulbau GmbH & Co. KG – Ahlhorn",
      "type": "Registerbekanntmachung nach dem Umwandlungsgesetz",
      "state": "Niedersachsen",
      "amtsgericht": "Amtsgericht Oldenburg (Oldenburg)",
      "registernummer": "HRA 207224",
      "registerart": "HRA",
      "company_name": "KS-Modulbau GmbH & Co. KG",
      "company_seat": "Ahlhorn",
      "details": "22.12.2025 (Bekanntmachungsdatum)\n\nNiedersachsen Amtsgericht Oldenburg (Oldenburg) HRA 207224\nRegisterbekanntmachung nach dem Umwandlungsgesetz 22.12.2025 (Eintragungsdatum)\n\nKS-Modulbau GmbH & Co. KG\nKommanditgesellschaft\nAhlhorn\n\nDen Gläubigern der an der Verschmelzung beteiligten Rechtsträger ist, wenn sie binnen sechs Monaten nach dem Tag, an dem die Eintragung der Verschmelzung in das Register des Sitzes desjenigen Rechtsträgers, dessen Gläubiger sie sind, nach § 19  Abs.  3 UmwG als bekannt gemacht gilt, ihren Anspruch nach Grund und Höhe schriftlich anmelden, Sicherheit zu leisten, soweit sie nicht Befriedigung verlangen können. Dieses Recht steht den Gläubigern jedoch nur zu, wenn sie glaubhaft machen, dass durch die Verschmelzung die Erfüllung der Forderung gefährdet wird."
    },
    {
      "date": "2025-12-22",
      "id": "140801",
      "original_text": "Einreichung neuer Dokumente\nHamburg Amtsgericht Hamburg HRB 43618\nTCHIBO GmbH – Hamburg",
      "type": "Einreichung neuer Dokumente",
      "state": "Hamburg",
      "amtsgericht": "Amtsgericht Hamburg",
      "registernummer": "HRB 43618",
      "registerart": "HRB",
      "company_name": "TCHIBO GmbH",
      "company_seat": "Hamburg",
      "details": "22.12.2025 (Bekanntmachungsdatum)\n\nHamburg Amtsgericht Hamburg HRB 43618\nEinreichung neuer Dokumente 22.12.2025 (Eintragungsdatum)\n\nTCHIBO GmbH\nGesellschaft mit beschränkter Haftung\nHamburg\n\nAls nicht eingetragen wird bekannt gemacht: Liste des Aufsichtsrats wurde eingereicht."
    },
    {
      "date": "2025-12-22",
      "id": "140802",
      "original_text": "Registerbekanntmachung nach dem Umwandlungsgesetz\nRheinland-Pfalz Amtsgericht Montabaur HRB 1412\nTHOMAS MAGNETE GMBH – Herdorf/Sieg",
      "type": "Registerbekanntmachung nach dem Umwandlungsgesetz",
      "state": "Rheinland-Pfalz",
      "amtsgericht": "Amtsgericht Montabaur",
      "registernummer": "HRB 1412",
      "registerart": "HRB",
      "company_name": "THOMAS MAGNETE GMBH",
      "company_seat": "Herdorf/Sieg",
      "details": "22.12.2025 (Bekanntmachungsdatum)\n\nRheinland-Pfalz Amtsgericht Montabaur HRB 1412\nRegisterbekanntmachung nach dem Umwandlungsgesetz 22.12.2025 (Eintragungsdatum)\n\nTHOMAS MAGNETE GMBH\nGesellschaft mit beschränkter Haftung\nHerdorf/Sieg\n\nAls nicht eingetragen wird veröffentlicht: Den Gläubigern der an der Verschmelzung beteiligten Rechtsträger ist, wenn sie binnen sechs Monaten nach dem Tag, an dem die Eintragung der Verschmelzung in das Register des Sitzes desjenigen Rechtsträgers, dessen Gläubiger sie sind, nach § 19 Abs. 3 UmwG als bekannt gemacht gilt, ihren Anspruch nach Grund und Höhe schriftlich anmelden, Sicherheit zu leisten, soweit sie nicht Befriedigung verlangen können. Dieses Recht steht den Gläubigern jedoch nur zu, wenn sie glaubhaft machen, dass durch die Verschmelzung die Erfüllung der Forderung gefährdet wird."
    },
    {
      "date": "2025-12-22",
      "id": "140803",
      "original_text": "Registerbekanntmachung nach dem Umwandlungsgesetz\nRheinland-Pfalz Amtsgericht Koblenz HRB 31588\nBBT Teilhabedienste Region Trier gGmbH – Koblenz",
      "type": "Registerbekanntmachung nach dem Umwandlungsgesetz",
      "state": "Rheinland-Pfalz",
      "amtsgericht": "Amtsgericht Koblenz",
      "registernummer": "HRB 31588",
      "registerart": "HRB",
      "company_name": "BBT Teilhabedienste Region Trier gGmbH",
      "company_seat": "Koblenz",
      "details": "22.12.2025 (Bekanntmachungsdatum)\n\nRheinland-Pfalz Amtsgericht Koblenz HRB 31588\nRegisterbekanntmachung nach dem Umwandlungsgesetz 22.12.2025 (Eintragungsdatum)\n\nBBT Teilhabedienste Region Trier gGmbH\nGesellschaft mit beschränkter Haftung\nKoblenz\n\nAls nicht eingetragen wird veröffentlicht: Den Gläubigern der an der Ausgliederung beteiligten Rechtsträger ist, wenn sie binnen sechs Monaten nach dem Tag, an dem die Eintragung der Ausgliederung in das Register des Sitzes desjenigen Rechtsträgers,dessen Gläubiger sie sind, nach § 19 Abs. 3 UmwG als bekannt gemacht gilt, ihren Anspruch nach Grund und Höhe schriftlich anmelden, Sicherheit zu leisten, soweit sie nicht Befriedigung verlangen können. Dieses Recht steht den Gläubigern jedoch nur zu, wenn sie glaubhaft machen, dass durch die Ausgliederung die Erfüllung der Forderung gefährdet wird."
    },
    {
      "date": "2025-12-22",
      "id": "140804",
      "original_text": "Registerbekanntmachung nach dem Umwandlungsgesetz\nRheinland-Pfalz Amtsgericht Ludwigshafen a.Rhein (Ludwigshafen) HRB 70566\nPERCEL Retreats & Living GmbH – Schifferstadt",
      "type": "Registerbekanntmachung nach dem Umwandlungsgesetz",
      "state": "Rheinland-Pfalz",
      "amtsgericht": "Amtsgericht Ludwigshafen a.Rhein (Ludwigshafen)",
      "registernummer": "HRB 70566",
      "registerart": "HRB",
      "company_name": "PERCEL Retreats & Living GmbH",
      "company_seat": "Schifferstadt",
      "details": "22.12.2025 (Bekanntmachungsdatum)\n\nRheinland-Pfalz Amtsgericht Ludwigshafen a.Rhein (Ludwigshafen) HRB 70566\nRegisterbekanntmachung nach dem Umwandlungsgesetz 22.12.2025 (Eintragungsdatum)\n\nPERCEL Retreats & Living GmbH\nGesellschaft mit beschränkter Haftung\nSchifferstadt\n\nAls nicht eingetragen wird veröffentlicht:\nDen Gläubigern des formwechselnden Rechtsträgers ist, wenn sie binnen sechs Monaten nach dem Tag, an dem die Eintragung des Formwechsels nach § 201 UmwG als bekannt gemacht gilt, ihren Anspruch nach Grund und Höhe schriftlich anmelden, Sicherheit zu leisten, soweit sie nicht Befriedigung verlangen können. Dieses Recht steht den Gläubigern jedoch nur zu, wenn sie glaubhaft machen, dass durch den Formwechsel die Erfüllung der Forderung gefährdet wird."
    },
    {
      "date": "2025-12-22",
      "id": "140805",
      "original_text": "Registerbekanntmachung nach dem Umwandlungsgesetz\nRheinland-Pfalz Amtsgericht Ludwigshafen a.Rhein (Ludwigshafen) HRA 62137\nBott/Luh OHG – Schifferstadt",
      "type": "Registerbekanntmachung nach dem Umwandlungsgesetz",
      "state": "Rheinland-Pfalz",
      "amtsgericht": "Amtsgericht Ludwigshafen a.Rhein (Ludwigshafen)",
      "registernummer": "HRA 62137",
      "registerart": "HRA",
      "company_name": "Bott/Luh OHG",
      "company_seat": "Schifferstadt",
      "details": "22.12.2025 (Bekanntmachungsdatum)\n\nRheinland-Pfalz Amtsgericht Ludwigshafen a.Rhein (Ludwigshafen) HRA 62137\nRegisterbekanntmachung nach dem Umwandlungsgesetz 22.12.2025 (Eintragungsdatum)\n\nBott/Luh OHG\nOffene Handelsgesellschaft\nSchifferstadt\n\nAls nicht eingetragen wird veröffentlicht:\nDen Gläubigern des formwechselnden Rechtsträgers ist, wenn sie binnen sechs Monaten nach dem Tag, an dem die Eintragung des Formwechsels nach § 201 UmwG als bekannt gemacht gilt, ihren Anspruch nach Grund und Höhe schriftlich anmelden, Sicherheit zu leisten, soweit sie nicht Befriedigung verlangen können. Dieses Recht steht den Gläubigern jedoch nur zu, wenn sie glaubhaft machen, dass durch den Formwechsel die Erfüllung der Forderung gefährdet wird."
    },
    {
      "date": "2025-12-22",
      "id": "140806",
      "original_text": "Registerbekanntmachung nach dem Umwandlungsgesetz\nRheinland-Pfalz Amtsgericht Koblenz HRB 31397\nBBT Region Trier gGmbH – Koblenz",
      "type": "Registerbekanntmachung nach dem Umwandlungsgesetz",
      "state": "Rheinland-Pfalz",
      "amtsgericht": "Amtsgericht Koblenz",
      "registernummer": "HRB 31397",
      "registerart": "HRB",
      "company_name": "BBT Region Trier gGmbH",
      "company_seat": "Koblenz",
      "details": "22.12.2025 (Bekanntmachungsdatum)\n\nRheinland-Pfalz Amtsgericht Koblenz HRB 31397\nRegisterbekanntmachung nach dem Umwandlungsgesetz 22.12.2025 (Eintragungsdatum)\n\nBBT Region Trier gGmbH\nGesellschaft mit beschränkter Haftung\nKoblenz\n\nAls nicht eingetragen wird veröffentlicht: Den Gläubigern der an der Ausgliederung beteiligten Rechtsträger ist, wenn sie binnen sechs Monaten nach dem Tag, an dem die Eintragung der Ausgliederung in das Register des Sitzes desjenigen Rechtsträgers,dessen Gläubiger sie sind, nach § 19 Abs. 3 UmwG als bekannt gemacht gilt, ihren Anspruch nach Grund und Höhe schriftlich anmelden, Sicherheit zu leisten, soweit sie nicht Befriedigung verlangen können. Dieses Recht steht den Gläubigern jedoch nur zu, wenn sie glaubhaft machen, dass durch die Ausgliederung die Erfüllung der Forderung gefährdet wird."
    },
    {
      "date": "2025-12-22",
      "id": "140807",
      "original_text": "Registerbekanntmachung nach dem Umwandlungsgesetz\nRheinland-Pfalz Amtsgericht Koblenz HRB 31579\nSastre GmbH – Mülheim-Kärlich",
      "type": "Registerbekanntmachung nach dem Umwandlungsgesetz",
      "state": "Rheinland-Pfalz",
      "amtsgericht": "Amtsgericht Koblenz",
      "registernummer": "HRB 31579",
      "registerart": "HRB",
      "company_name": "Sastre GmbH",
      "company_seat": "Mülheim-Kärlich",
      "details": "22.12.2025 (Bekanntmachungsdatum)\n\nRheinland-Pfalz Amtsgericht Koblenz HRB 31579\nRegisterbekanntmachung nach dem Umwandlungsgesetz 22.12.2025 (Eintragungsdatum)\n\nSastre GmbH\nGesellschaft mit beschränkter Haftung\nMülheim-Kärlich\n\nDen Gläubigern des formwechselnden Rechtsträgers ist, wenn sie binnen sechs Monaten nach dem Tag, an dem die Eintragung des Formwechsels nach § 201 UmwG als bekannt gemacht gilt, ihren Anspruch nach Grund und Höhe schriftlich anmelden, Sicherheit zu leisten, soweit sie nicht Befriedigung verlangen können. Dieses Recht steht den Gläubigern jedoch nur zu, wenn sie glaubhaft machen, dass durch den Formwechsel die Erfüllung der Forderung gefährdet wird."
    },
    {
      "date": "2025-12-22",
      "id": "140808",
      "original_text": "Registerbekanntmachung nach dem Umwandlungsgesetz\nRheinland-Pfalz Amtsgericht Koblenz HRB 31397\nBBT Region Trier gGmbH – Koblenz",
      "type": "Registerbekanntmachung nach dem Umwandlungsgesetz",
      "state": "Rheinland-Pfalz",
      "amtsgericht": "Amtsgericht Koblenz",
      "registernummer": "HRB 31397",
      "registerart": "HRB",
      "company_name": "BBT Region Trier gGmbH",
      "company_seat": "Koblenz",
      "details": "22.12.2025 (Bekanntmachungsdatum)\n\nRheinland-Pfalz Amtsgericht Koblenz HRB 31397\nRegisterbekanntmachung nach dem Umwandlungsgesetz 22.12.2025 (Eintragungsdatum)\n\nBBT Region Trier gGmbH\nGesellschaft mit beschränkter Haftung\nKoblenz\n\nAls nicht eingetragen wird veröffentlicht: Den Gläubigern der an der Ausgliederung beteiligten Rechtsträger ist, wenn sie binnen sechs Monaten nach dem Tag, an dem die Eintragung der Ausgliederung in das Register des Sitzes desjenigen Rechtsträgers,dessen Gläubiger sie sind, nach § 19 Abs. 3 UmwG als bekannt gemacht gilt, ihren Anspruch nach Grund und Höhe schriftlich anmelden, Sicherheit zu leisten, soweit sie nicht Befriedigung verlangen können. Dieses Recht steht den Gläubigern jedoch nur zu, wenn sie glaubhaft machen, dass durch die Ausgliederung die Erfüllung der Forderung gefährdet wird."
    },
    {
      "date": "2025-12-22",
      "id": "140809",
      "original_text": "Registerbekanntmachung nach dem Umwandlungsgesetz\nRheinland-Pfalz Amtsgericht Montabaur HRB 20078\nThomas Holding GmbH – Herdorf",
      "type": "Registerbekanntmachung nach dem Umwandlungsgesetz",
      "state": "Rheinland-Pfalz",
      "amtsgericht": "Amtsgericht Montabaur",
      "registernummer": "HRB 20078",
      "registerart": "HRB",
      "company_name": "Thomas Holding GmbH",
      "company_seat": "Herdorf",
      "details": "22.12.2025 (Bekanntmachungsdatum)\n\nRheinland-Pfalz Amtsgericht Montabaur HRB 20078\nRegisterbekanntmachung nach dem Umwandlungsgesetz 22.12.2025 (Eintragungsdatum)\n\nThomas Holding GmbH\nGesellschaft mit beschränkter Haftung\nHerdorf\n\nAls nicht eingetragen wird veröffentlicht: Den Gläubigern der an der Verschmelzung beteiligten Rechtsträger ist, wenn sie binnen sechs Monaten nach dem Tag, an dem die Eintragung der Verschmelzung in das Register des Sitzes desjenigen Rechtsträgers,dessen Gläubiger sie sind, nach § 19 Abs. 3 UmwG als bekannt gemacht gilt, ihren Anspruch nach Grund und Höhe schriftlich anmelden, Sicherheit zu leisten, soweit sie nicht Befriedigung verlangen können. Dieses Recht steht den Gläubigern jedoch nur zu, wenn sie glaubhaft machen, dass durch die Verschmelzung die Erfüllung der Forderung gefährdet wird."
    },
    {
      "date": "2025-12-22",
      "id": "140810",
      "original_text": "Registerbekanntmachung nach dem Umwandlungsgesetz\nRheinland-Pfalz Amtsgericht Koblenz HRB 31587\nBBT Gesundheitsdienste Region Trier gGmbH – Koblenz",
      "type": "Registerbekanntmachung nach dem Umwandlungsgesetz",
      "state": "Rheinland-Pfalz",
      "amtsgericht": "Amtsgericht Koblenz",
      "registernummer": "HRB 31587",
      "registerart": "HRB",
      "company_name": "BBT Gesundheitsdienste Region Trier gGmbH",
      "company_seat": "Koblenz",
      "details": "22.12.2025 (Bekanntmachungsdatum)\n\nRheinland-Pfalz Amtsgericht Koblenz HRB 31587\nRegisterbekanntmachung nach dem Umwandlungsgesetz 22.12.2025 (Eintragungsdatum)\n\nBBT Gesundheitsdienste Region Trier gGmbH\nGesellschaft mit beschränkter Haftung\nKoblenz\n\nAls nicht eingetragen wird veröffentlicht: Den Gläubigern der an der Ausgliederung beteiligten Rechtsträger ist, wenn sie binnen sechs Monaten nach dem Tag, an dem die Eintragung der Ausgliederung in das Register des Sitzes desjenigen Rechtsträgers,dessen Gläubiger sie sind, nach § 19 Abs. 3 UmwG als bekannt gemacht gilt, ihren Anspruch nach Grund und Höhe schriftlich anmelden, Sicherheit zu leisten, soweit sie nicht Befriedigung verlangen können. Dieses Recht steht den Gläubigern jedoch nur zu, wenn sie glaubhaft machen, dass durch die Ausgliederung die Erfüllung der Forderung gefährdet wird."
    },
    {
      "date": "2025-12-22",
      "id": "140811",
      "original_text": "Registerbekanntmachung nach dem Umwandlungsgesetz\nRheinland-Pfalz Amtsgericht Montabaur HRA 23040\nKurti Holding GmbH & Co. KG – Wissen",
      "type": "Registerbekanntmachung nach dem Umwandlungsgesetz",
      "state": "Rheinland-Pfalz",
      "amtsgericht": "Amtsgericht Montabaur",
      "registernummer": "HRA 23040",
      "registerart": "HRA",
      "company_name": "Kurti Holding GmbH & Co. KG",
      "company_seat": "Wissen",
      "details": "22.12.2025 (Bekanntmachungsdatum)\n\nRheinland-Pfalz Amtsgericht Montabaur HRA 23040\nRegisterbekanntmachung nach dem Umwandlungsgesetz 22.12.2025 (Eintragungsdatum)\n\nKurti Holding GmbH & Co. KG\nKommanditgesellschaft\nWissen\n\nAls nicht eingetragen wird veröffentlicht:\nDen Gläubigern des formwechselnden Rechtsträgers ist, wenn sie binnen sechs Monaten nach dem Tag, an dem die Eintragung des Formwechsels nach § 201 UmwG als bekannt gemacht gilt, ihren Anspruch nach Grund und Höhe schriftlich anmelden, Sicherheit zu leisten, soweit sie nicht Befriedigung verlangen können. Dieses Recht steht den Gläubigern jedoch nur zu, wenn sie glaubhaft machen, dass durch den Formwechsel die Erfüllung der Forderung gefährdet wird."
    },
    {
      "date": "2025-12-22",
      "id": "140812",
      "original_text": "Registerbekanntmachung nach dem Umwandlungsgesetz\nRheinland-Pfalz Amtsgericht Koblenz HRB 31397\nBBT Region Trier gGmbH – Koblenz",
      "type": "Registerbekanntmachung nach dem Umwandlungsgesetz",
      "state": "Rheinland-Pfalz",
      "amtsgericht": "Amtsgericht Koblenz",
      "registernummer": "HRB 31397",
      "registerart": "HRB",
      "company_name": "BBT Region Trier gGmbH",
      "company_seat": "Koblenz",
      "details": "22.12.2025 (Bekanntmachungsdatum)\n\nRheinland-Pfalz Amtsgericht Koblenz HRB 31397\nRegisterbekanntmachung nach dem Umwandlungsgesetz 22.12.2025 (Eintragungsdatum)\n\nBBT Region Trier gGmbH\nGesellschaft mit beschränkter Haftung\nKoblenz\n\nAls nicht eingetragen wird veröffentlicht: Den Gläubigern der an der Ausgliederung beteiligten Rechtsträger ist, wenn sie binnen sechs Monaten nach dem Tag, an dem die Eintragung der Ausgliederung in das Register des Sitzes desjenigen Rechtsträgers,dessen Gläubiger sie sind, nach § 19 Abs. 3 UmwG als bekannt gemacht gilt, ihren Anspruch nach Grund und Höhe schriftlich anmelden, Sicherheit zu leisten, soweit sie nicht Befriedigung verlangen können. Dieses Recht steht den Gläubigern jedoch nur zu, wenn sie glaubhaft machen, dass durch die Ausgliederung die Erfüllung der Forderung gefährdet wird."
    },
    {
      "date": "2025-12-22",
      "id": "140813",
      "original_text": "Registerbekanntmachung nach dem Umwandlungsgesetz\nNordrhein-Westfalen Amtsgericht Köln HRB 86236\nAIRE HIEX Stuttgart Betriebsgesellschaft mbH – Köln",
      "type": "Registerbekanntmachung nach dem Umwandlungsgesetz",
      "state": "Nordrhein-Westfalen",
      "amtsgericht": "Amtsgericht Köln",
      "registernummer": "HRB 86236",
      "registerart": "HRB",
      "company_name": "AIRE HIEX Stuttgart Betriebsgesellschaft mbH",
      "company_seat": "Köln",
      "details": "22.12.2025 (Bekanntmachungsdatum)\n\nNordrhein-Westfalen Amtsgericht Köln HRB 86236\nRegisterbekanntmachung nach dem Umwandlungsgesetz 22.12.2025 (Eintragungsdatum)\n\nAIRE HIEX Stuttgart Betriebsgesellschaft mbH\nGesellschaft mit beschränkter Haftung\nKöln\n\nDen Gläubigern der an der Verschmelzung beteiligten Rechtsträger ist, wenn sie binnen sechs Monaten nach dem Tag, an dem die Eintragung der Verschmelzung in das Register des Sitzes desjenigen Rechtsträgers, dessen Gläubiger sie sind, nach § 19 Absatz 3 UmwG als bekanntgemacht gilt, ihren Anspruch nach Grund und Höhe schriftlich anmelden, Sicherheit zu leisten, soweit sie nicht Befriedigung verlangen können. Dieses Recht steht den Gläubigern jedoch nur zu, wenn sie glaubhaft machen, dass durch die Verschmelzung die Erfüllung ihrer Forderung gefährdet wird."
    },
    {
      "date": "2025-12-22",
      "id": "140814",
      "original_text": "Registerbekanntmachung nach dem Umwandlungsgesetz\nNordrhein-Westfalen Amtsgericht Steinfurt HRB 15666\nBlumigo GmbH – Lienen",
      "type": "Registerbekanntmachung nach dem Umwandlungsgesetz",
      "state": "Nordrhein-Westfalen",
      "amtsgericht": "Amtsgericht Steinfurt",
      "registernummer": "HRB 15666",
      "registerart": "HRB",
      "company_name": "Blumigo GmbH",
      "company_seat": "Lienen",
      "details": "22.12.2025 (Bekanntmachungsdatum)\n\nNordrhein-Westfalen Amtsgericht Steinfurt HRB 15666\nRegisterbekanntmachung nach dem Umwandlungsgesetz 22.12.2025 (Eintragungsdatum)\n\nBlumigo GmbH\nGesellschaft mit beschränkter Haftung\nLienen\n\nDen Gläubigern der an der Ausgliederung beteiligten Rechtsträger ist, wenn sie binnen sechs Monaten nach dem Tag, an dem die Eintragung der Ausgliederung in das Register des Sitzes desjenigen Rechtsträgers, dessen Gläubiger sie sind, nach § 19 Absatz 3 UmwG als bekanntgemacht gilt, ihren Anspruch nach Grund und Höhe schriftlich anmelden, Sicherheit zu leisten, soweit sie nicht Befriedigung verlangen können. Dieses Recht steht den Gläubigern jedoch nur zu, wenn sie glaubhaft machen, dass durch die Ausgliederung die Erfüllung ihrer Forderung gefährdet wird."
    },
    {
      "date": "2025-12-22",
      "id": "140815",
      "original_text": "Einreichung neuer Dokumente\nNordrhein-Westfalen Amtsgericht Düsseldorf HRB 858\nIndustrieterrains Düsseldorf-Reisholz Aktiengesellschaft – Düsseldorf",
      "type": "Einreichung neuer Dokumente",
      "state": "Nordrhein-Westfalen",
      "amtsgericht": "Amtsgericht Düsseldorf",
      "registernummer": "HRB 858",
      "registerart": "HRB",
      "company_name": "Industrieterrains Düsseldorf-Reisholz Aktiengesellschaft",
      "company_seat": "Düsseldorf",
      "details": "22.12.2025 (Bekanntmachungsdatum)\n\nNordrhein-Westfalen Amtsgericht Düsseldorf HRB 858\nEinreichung neuer Dokumente 22.12.2025 (Eintragungsdatum)\n\nIndustrieterrains Düsseldorf-Reisholz Aktiengesellschaft\nAktiengesellschaft\nDüsseldorf\n\nDem Registergericht ist eine neue Liste der Mitglieder des Aufsichtsrates eingereicht worden."
    },
    {
      "date": "2025-12-22",
      "id": "140816",
      "original_text": "Registerbekanntmachung nach dem Umwandlungsgesetz\nNordrhein-Westfalen Amtsgericht Köln HRB 121231\nFischbach GmbH – Engelskirchen",
      "type": "Registerbekanntmachung nach dem Umwandlungsgesetz",
      "state": "Nordrhein-Westfalen",
      "amtsgericht": "Amtsgericht Köln",
      "registernummer": "HRB 121231",
      "registerart": "HRB",
      "company_name": "Fischbach GmbH",
      "company_seat": "Engelskirchen",
      "details": "22.12.2025 (Bekanntmachungsdatum)\n\nNordrhein-Westfalen Amtsgericht Köln HRB 121231\nRegisterbekanntmachung nach dem Umwandlungsgesetz 22.12.2025 (Eintragungsdatum)\n\nFischbach GmbH\nGesellschaft mit beschränkter Haftung\nEngelskirchen\n\nDen Gläubigern der an der Verschmelzung beteiligten Rechtsträger ist, wenn sie binnen sechs Monaten nach dem Tag, an dem die Eintragung der Verschmelzung in das Register des Sitzes desjenigen Rechtsträgers, dessen Gläubiger sie sind, nach § 19 Absatz 3 UmwG als bekanntgemacht gilt, ihren Anspruch nach Grund und Höhe schriftlich anmelden, Sicherheit zu leisten, soweit sie nicht Befriedigung verlangen können. Dieses Recht steht den Gläubigern jedoch nur zu, wenn sie glaubhaft machen, dass durch die Verschmelzung die Erfüllung ihrer Forderung gefährdet wird."
    },
    {
      "date": "2025-12-22",
      "id": "140817",
      "original_text": "Registerbekanntmachung nach dem Umwandlungsgesetz\nNordrhein-Westfalen Amtsgericht Steinfurt HRB 15788\nPS-Immo-GmbH – Wettringen",
      "type": "Registerbekanntmachung nach dem Umwandlungsgesetz",
      "state": "Nordrhein-Westfalen",
      "amtsgericht": "Amtsgericht Steinfurt",
      "registernummer": "HRB 15788",
      "registerart": "HRB",
      "company_name": "PS-Immo-GmbH",
      "company_seat": "Wettringen",
      "details": "22.12.2025 (Bekanntmachungsdatum)\n\nNordrhein-Westfalen Amtsgericht Steinfurt HRB 15788\nRegisterbekanntmachung nach dem Umwandlungsgesetz 22.12.2025 (Eintragungsdatum)\n\nPS-Immo-GmbH\nGesellschaft mit beschränkter Haftung\nWettringen\n\nDen Gläubigern der an der formwechselnden Umwandlung beteiligten Rechtsträger ist, wenn sie binnen sechs Monaten nach dem Tag, an dem die Eintragung der formwechselnden Umwandlung in das Register des Sitzes desjenigen Rechtsträgers, dessen Gläubiger sie sind, nach § 19 Absatz 3 UmwG als bekanntgemacht gilt, ihren Anspruch nach Grund und Höhe schriftlich anmelden, Sicherheit zu leisten, soweit sie nicht Befriedigung verlangen können. Dieses Recht steht den Gläubigern jedoch nur zu, wenn sie glaubhaft machen, dass durch die formwechselnden Umwandlung die Erfüllung ihrer Forderung gefährdet wird."
    },
    {
      "date": "2025-12-22",
      "id": "140818",
      "original_text": "Löschungsankündigung\nNordrhein-Westfalen Amtsgericht Mönchengladbach HRB 18750\nCosmos Capital UG (haftungsbeschränkt) – Grevenbroich",
      "type": "Löschungsankündigung",
      "state": "Nordrhein-Westfalen",
      "amtsgericht": "Amtsgericht Mönchengladbach",
      "registernummer": "HRB 18750",
      "registerart": "HRB",
      "company_name": "Cosmos Capital UG (haftungsbeschränkt)",
      "company_seat": "Grevenbroich",
      "details": "22.12.2025 (Bekanntmachungsdatum)\n\nNordrhein-Westfalen Amtsgericht Mönchengladbach HRB 18750\nLöschungsankündigung 22.12.2025 (Eintragungsdatum)\n\nCosmos Capital UG (haftungsbeschränkt)\nGesellschaft mit beschränkter Haftung\nGrevenbroich\n\nDas Registergericht beabsichtigt die Gesellschaft von Amts wegen nach § 394 FamFG zu löschen. Die Frist zur Erhebung eines Widerspruchs ist auf drei Monate festgesetzt."
    },
    {
      "date": "2025-12-22",
      "id": "140819",
      "original_text": "Einreichung neuer Dokumente\nNordrhein-Westfalen Amtsgericht Kleve HRB 5103\nENNI Energie & Umwelt Niederrhein GmbH – Moers",
      "type": "Einreichung neuer Dokumente",
      "state": "Nordrhein-Westfalen",
      "amtsgericht": "Amtsgericht Kleve",
      "registernummer": "HRB 5103",
      "registerart": "HRB",
      "company_name": "ENNI Energie & Umwelt Niederrhein GmbH",
      "company_seat": "Moers",
      "details": "22.12.2025 (Bekanntmachungsdatum)\n\nNordrhein-Westfalen Amtsgericht Kleve HRB 5103\nEinreichung neuer Dokumente 22.12.2025 (Eintragungsdatum)\n\nENNI Energie & Umwelt Niederrhein GmbH\nGesellschaft mit beschränkter Haftung\nMoers"
    },
    {
      "date": "2025-12-22",
      "id": "140820",
      "original_text": "Sonstige Registerbekanntmachung\nNordrhein-Westfalen Amtsgericht Düsseldorf HRB 562\nRheinbahn AG – Düsseldorf",
      "type": "Sonstige Registerbekanntmachung",
      "state": "Nordrhein-Westfalen",
      "amtsgericht": "Amtsgericht Düsseldorf",
      "registernummer": "HRB 562",
      "registerart": "HRB",
      "company_name": "Rheinbahn AG",
      "company_seat": "Düsseldorf",
      "details": "22.12.2025 (Bekanntmachungsdatum)\n\nNordrhein-Westfalen Amtsgericht Düsseldorf HRB 562\nSonstige Registerbekanntmachung\n\nRheinbahn AG\nAktiengesellschaft\nDüsseldorf\n\nDem Registergericht ist eine Liste der Mitglieder des Aufsichtsrates eingereicht worden."
    },
    {
      "date": "2025-12-22",
      "id": "140821",
      "original_text": "Registerbekanntmachung nach dem Umwandlungsgesetz\nNordrhein-Westfalen Amtsgericht Iserlohn HRA 1788\nLobbe Holding GmbH & Co KG – Iserlohn",
      "type": "Registerbekanntmachung nach dem Umwandlungsgesetz",
      "state": "Nordrhein-Westfalen",
      "amtsgericht": "Amtsgericht Iserlohn",
      "registernummer": "HRA 1788",
      "registerart": "HRA",
      "company_name": "Lobbe Holding GmbH & Co KG",
      "company_seat": "Iserlohn",
      "details": "22.12.2025 (Bekanntmachungsdatum)\n\nNordrhein-Westfalen Amtsgericht Iserlohn HRA 1788\nRegisterbekanntmachung nach dem Umwandlungsgesetz 22.12.2025 (Eintragungsdatum)\n\nLobbe Holding GmbH & Co KG\nKommanditgesellschaft\nIserlohn\n\nDen Gläubigern der an der Verschmelzung beteiligten Rechtsträger ist, wenn sie binnen sechs Monaten nach dem Tag, an dem die Eintragung der Verschmelzung in das Register des Sitzes desjenigen Rechtsträgers, dessen Gläubiger sie sind, nach § 19 Absatz 3 UmwG als bekanntgemacht gilt, ihren Anspruch nach Grund und Höhe schriftlich anmelden, Sicherheit zu leisten, soweit sie nicht Befriedigung verlangen können. Dieses Recht steht den Gläubigern jedoch nur zu, wenn sie glaubhaft machen, dass durch die Verschmelzung die Erfüllung ihrer Forderung gefährdet wird."
    },
    {
      "date": "2025-12-22",
      "id": "140822",
      "original_text": "Registerbekanntmachung nach dem Umwandlungsgesetz\nNordrhein-Westfalen Amtsgericht Duisburg HRB 27258\nCarmagotchi Software GmbH – Oberhausen",
      "type": "Registerbekanntmachung nach dem Umwandlungsgesetz",
      "state": "Nordrhein-Westfalen",
      "amtsgericht": "Amtsgericht Duisburg",
      "registernummer": "HRB 27258",
      "registerart": "HRB",
      "company_name": "Carmagotchi Software GmbH",
      "company_seat": "Oberhausen",
      "details": "22.12.2025 (Bekanntmachungsdatum)\n\nNordrhein-Westfalen Amtsgericht Duisburg HRB 27258\nRegisterbekanntmachung nach dem Umwandlungsgesetz 22.12.2025 (Eintragungsdatum)\n\nCarmagotchi Software GmbH\nGesellschaft mit beschränkter Haftung\nOberhausen\n\nDie Gesellschaft hat Gläubigern, deren Forderungen vor dieser Bekanntmachung begründet worden sind, Sicherheit zu leisten, soweit sie nicht Befriedigung verlangen können, wenn sie sich binnen sechs Monaten zu diesem Zweck melden."
    },
    {
      "date": "2025-12-22",
      "id": "140823",
      "original_text": "Registerbekanntmachung nach dem Umwandlungsgesetz\nNordrhein-Westfalen Amtsgericht Bonn HRB 20928\nIrene Propco 7 (Stralauer Allee Berlin) GmbH – Bonn",
      "type": "Registerbekanntmachung nach dem Umwandlungsgesetz",
      "state": "Nordrhein-Westfalen",
      "amtsgericht": "Amtsgericht Bonn",
      "registernummer": "HRB 20928",
      "registerart": "HRB",
      "company_name": "Irene Propco 7 (Stralauer Allee Berlin) GmbH",
      "company_seat": "Bonn",
      "details": "22.12.2025 (Bekanntmachungsdatum)\n\nNordrhein-Westfalen Amtsgericht Bonn HRB 20928\nRegisterbekanntmachung nach dem Umwandlungsgesetz\n\nIrene Propco 7 (Stralauer Allee Berlin) GmbH\nGesellschaft mit beschränkter Haftung\nBonn\n\nEs wird darauf hingewiesen, dass ein Entwurf eines Formwechselplans über einen grenzüberschreitenden Formwechsel der Irene Propco 7 (Stralauer Allee Berlin) GmbH mit Satzungssitz in Bonn (Amtsgericht Bonn, HRB 20928) und Verwaltungssitz in Luxemburg (Registre de commerce et des sociétés Luxembourg B22031) in eine reine Société à responsibilaté limitée (S.à.r.l.) luxemburgischen Rechts  - Irene Propco 7 (Stralauer Allee Berlin) S.à.r.l. - mit gleichzeitiger Verlegung des Satzungssitzes nach Luxemburg, Großherzogtum Luxemburg, beim Handelsregister eingereicht worden ist.\n\nDie Anteilsinhaber, die Gläubiger sowie die zuständigen Betriebsräte der an dem grenzüberschreitenden Formwechsel beteiligten Gesellschaft oder, soweit es keinen Betriebsrat gibt, die Arbeitnehmer der an dem grenzüberschreitenden Formwechsel beteiligten Gesellschaft, können der Gesellschaft spätestens fünf Arbeitstage vor dem Tag der Gesellschafterversammlung Bemerkungen zum Formwechselplan übermitteln."
    },
    {
      "date": "2025-12-22",
      "id": "140824",
      "original_text": "Registerbekanntmachung nach dem Umwandlungsgesetz\nNordrhein-Westfalen Amtsgericht Hagen HRB 7976\nClavis GmbH – Hagen",
      "type": "Registerbekanntmachung nach dem Umwandlungsgesetz",
      "state": "Nordrhein-Westfalen",
      "amtsgericht": "Amtsgericht Hagen",
      "registernummer": "HRB 7976",
      "registerart": "HRB",
      "company_name": "Clavis GmbH",
      "company_seat": "Hagen",
      "details": "22.12.2025 (Bekanntmachungsdatum)\n\nNordrhein-Westfalen Amtsgericht Hagen HRB 7976\nRegisterbekanntmachung nach dem Umwandlungsgesetz 22.12.2025 (Eintragungsdatum)\n\nClavis GmbH\nGesellschaft mit beschränkter Haftung\nHagen\n\nDen Gläubigern der an der Verschmelzung beteiligten Rechtsträger ist, wenn sie binnen sechs Monaten nach dem Tag, an dem die Eintragung der Verschmelzung in das Register des Sitzes derjenigen Rechtsträger deren Gläubiger sie sind, nach § 19 Absatz 3 UmwG als bekanntgemacht gilt, ihren Anspruch nach Grund und Höhe schriftlich anmelden, Sicherheit zu leisten, soweit sie nicht Befriedigung verlangen können. Dieses Recht steht den Gläubigern jedoch nur zu, wenn sie glaubhaft machen, dass durch die Verschmelzung die Erfüllung ihrer Forderung gefährdet wird."
    },
    {
      "date": "2025-12-22",
      "id": "140825",
      "original_text": "Einreichung neuer Dokumente\nNordrhein-Westfalen Amtsgericht Essen HRB 34665\ncaelium AG – Essen",
      "type": "Einreichung neuer Dokumente",
      "state": "Nordrhein-Westfalen",
      "amtsgericht": "Amtsgericht Essen",
      "registernummer": "HRB 34665",
      "registerart": "HRB",
      "company_name": "caelium AG",
      "company_seat": "Essen",
      "details": "22.12.2025 (Bekanntmachungsdatum)\n\nNordrhein-Westfalen Amtsgericht Essen HRB 34665\nEinreichung neuer Dokumente\n\ncaelium AG\nAktiengesellschaft\nEssen\n\nDem Registergericht ist eine neue Liste der Mitglieder des Aufsichtsrates eingereicht worden."
    },
    {
      "date": "2025-12-22",
      "id": "140826",
      "original_text": "Registerbekanntmachung nach dem Umwandlungsgesetz\nNordrhein-Westfalen Amtsgericht Duisburg HRB 34096\nDotzilla Connect GmbH – Oberhausen",
      "type": "Registerbekanntmachung nach dem Umwandlungsgesetz",
      "state": "Nordrhein-Westfalen",
      "amtsgericht": "Amtsgericht Duisburg",
      "registernummer": "HRB 34096",
      "registerart": "HRB",
      "company_name": "Dotzilla Connect GmbH",
      "company_seat": "Oberhausen",
      "details": "22.12.2025 (Bekanntmachungsdatum)\n\nNordrhein-Westfalen Amtsgericht Duisburg HRB 34096\nRegisterbekanntmachung nach dem Umwandlungsgesetz 22.12.2025 (Eintragungsdatum)\n\nDotzilla Connect GmbH\nGesellschaft mit beschränkter Haftung\nOberhausen\n\nDie Gesellschaft hat Gläubigern, deren Forderungen vor dieser Bekanntmachung begründet worden sind, Sicherheit zu leisten, soweit sie nicht Befriedigung verlangen können, wenn sie sich binnen sechs Monaten zu diesem Zweck melden."
    },
    {
      "date": "2025-12-22",
      "id": "140827",
      "original_text": "Registerbekanntmachung nach dem Umwandlungsgesetz\nNordrhein-Westfalen Amtsgericht Hagen HRB 12426\nNovalis GmbH – Hagen",
      "type": "Registerbekanntmachung nach dem Umwandlungsgesetz",
      "state": "Nordrhein-Westfalen",
      "amtsgericht": "Amtsgericht Hagen",
      "registernummer": "HRB 12426",
      "registerart": "HRB",
      "company_name": "Novalis GmbH",
      "company_seat": "Hagen",
      "details": "22.12.2025 (Bekanntmachungsdatum)\n\nNordrhein-Westfalen Amtsgericht Hagen HRB 12426\nRegisterbekanntmachung nach dem Umwandlungsgesetz 22.12.2025 (Eintragungsdatum)\n\nNovalis GmbH\nGesellschaft mit beschränkter Haftung\nHagen\n\nDen Gläubigern der an der Verschmelzung beteiligten Rechtsträger ist, wenn sie binnen sechs Monaten nach dem Tag, an dem die Eintragung der Verschmelzung in das Register des Sitzes derjenigen Rechtsträger deren Gläubiger sie sind, nach § 19 Absatz 3 UmwG als bekanntgemacht gilt, ihren Anspruch nach Grund und Höhe schriftlich anmelden, Sicherheit zu leisten, soweit sie nicht Befriedigung verlangen können. Dieses Recht steht den Gläubigern jedoch nur zu, wenn sie glaubhaft machen, dass durch die Verschmelzung die Erfüllung ihrer Forderung gefährdet wird."
    },
    {
      "date": "2025-12-22",
      "id": "140828",
      "original_text": "Registerbekanntmachung nach dem Umwandlungsgesetz\nNordrhein-Westfalen Amtsgericht Duisburg HRB 21056\ncarzilla GmbH – Oberhausen",
      "type": "Registerbekanntmachung nach dem Umwandlungsgesetz",
      "state": "Nordrhein-Westfalen",
      "amtsgericht": "Amtsgericht Duisburg",
      "registernummer": "HRB 21056",
      "registerart": "HRB",
      "company_name": "carzilla GmbH",
      "company_seat": "Oberhausen",
      "details": "22.12.2025 (Bekanntmachungsdatum)\n\nNordrhein-Westfalen Amtsgericht Duisburg HRB 21056\nRegisterbekanntmachung nach dem Umwandlungsgesetz 22.12.2025 (Eintragungsdatum)\n\ncarzilla GmbH\nGesellschaft mit beschränkter Haftung\nOberhausen\n\nDie Gesellschaft hat Gläubigern, deren Forderungen vor dieser Bekanntmachung begründet worden sind, Sicherheit zu leisten, soweit sie nicht Befriedigung verlangen können, wenn sie sich binnen sechs Monaten zu diesem Zweck melden."
    },
    {
      "date": "2025-12-22",
      "id": "140829",
      "original_text": "Registerbekanntmachung nach dem Umwandlungsgesetz\nNordrhein-Westfalen Amtsgericht Duisburg HRB 9379\ndotzilla Verwaltungs GmbH – Oberhausen",
      "type": "Registerbekanntmachung nach dem Umwandlungsgesetz",
      "state": "Nordrhein-Westfalen",
      "amtsgericht": "Amtsgericht Duisburg",
      "registernummer": "HRB 9379",
      "registerart": "HRB",
      "company_name": "dotzilla Verwaltungs GmbH",
      "company_seat": "Oberhausen",
      "details": "22.12.2025 (Bekanntmachungsdatum)\n\nNordrhein-Westfalen Amtsgericht Duisburg HRB 9379\nRegisterbekanntmachung nach dem Umwandlungsgesetz 22.12.2025 (Eintragungsdatum)\n\ndotzilla Verwaltungs GmbH\nGesellschaft mit beschränkter Haftung\nOberhausen\n\nDie Gesellschaft hat Gläubigern, deren Forderungen vor dieser Bekanntmachung begründet worden sind, Sicherheit zu leisten, soweit sie nicht Befriedigung verlangen können, wenn sie sich binnen sechs Monaten zu diesem Zweck melden."
    },
    {
      "date": "2025-12-22",
      "id": "140830",
      "original_text": "Löschungsankündigung\nNordrhein-Westfalen Amtsgericht Wuppertal HRB 31146\nALUS GmbH – Wuppertal",
      "type": "Löschungsankündigung",
      "state": "Nordrhein-Westfalen",
      "amtsgericht": "Amtsgericht Wuppertal",
      "registernummer": "HRB 31146",
      "registerart": "HRB",
      "company_name": "ALUS GmbH",
      "company_seat": "Wuppertal",
      "details": "22.12.2025 (Bekanntmachungsdatum)\n\nNordrhein-Westfalen Amtsgericht Wuppertal HRB 31146\nLöschungsankündigung\n\nALUS GmbH\nGesellschaft mit beschränkter Haftung\nWuppertal\n\nDas Registergericht beabsichtigt die Gesellschaft von Amts wegen nach § 394 FamFG zu löschen. Die Frist zur Erhebung eines Widerspruchs ist auf einen Monat festgesetzt."
    },
    {
      "date": "2025-12-22",
      "id": "140831",
      "original_text": "Registerbekanntmachung nach dem Umwandlungsgesetz\nNordrhein-Westfalen Amtsgericht Duisburg HRB 21056\ncarzilla GmbH – Oberhausen",
      "type": "Registerbekanntmachung nach dem Umwandlungsgesetz",
      "state": "Nordrhein-Westfalen",
      "amtsgericht": "Amtsgericht Duisburg",
      "registernummer": "HRB 21056",
      "registerart": "HRB",
      "company_name": "carzilla GmbH",
      "company_seat": "Oberhausen",
      "details": "22.12.2025 (Bekanntmachungsdatum)\n\nNordrhein-Westfalen Amtsgericht Duisburg HRB 21056\nRegisterbekanntmachung nach dem Umwandlungsgesetz 22.12.2025 (Eintragungsdatum)\n\ncarzilla GmbH\nGesellschaft mit beschränkter Haftung\nOberhausen\n\nDie Gesellschaft hat Gläubigern, deren Forderungen vor dieser Bekanntmachung begründet worden sind, Sicherheit zu leisten, soweit sie nicht Befriedigung verlangen können, wenn sie sich binnen sechs Monaten zu diesem Zweck melden."
    },
    {
      "date": "2025-12-22",
      "id": "140832",
      "original_text": "Registerbekanntmachung nach dem Umwandlungsgesetz\nNordrhein-Westfalen Amtsgericht Duisburg HRB 9379\ndotzilla Verwaltungs GmbH – Oberhausen",
      "type": "Registerbekanntmachung nach dem Umwandlungsgesetz",
      "state": "Nordrhein-Westfalen",
      "amtsgericht": "Amtsgericht Duisburg",
      "registernummer": "HRB 9379",
      "registerart": "HRB",
      "company_name": "dotzilla Verwaltungs GmbH",
      "company_seat": "Oberhausen",
      "details": "22.12.2025 (Bekanntmachungsdatum)\n\nNordrhein-Westfalen Amtsgericht Duisburg HRB 9379\nRegisterbekanntmachung nach dem Umwandlungsgesetz 22.12.2025 (Eintragungsdatum)\n\ndotzilla Verwaltungs GmbH\nGesellschaft mit beschränkter Haftung\nOberhausen\n\nDie Gesellschaft hat Gläubigern, deren Forderungen vor dieser Bekanntmachung begründet worden sind, Sicherheit zu leisten, soweit sie nicht Befriedigung verlangen können, wenn sie sich binnen sechs Monaten zu diesem Zweck melden."
    },
    {
      "date": "2025-12-22",
      "id": "140833",
      "original_text": "Registerbekanntmachung nach dem Umwandlungsgesetz\nNordrhein-Westfalen Amtsgericht Duisburg HRB 9379\ndotzilla Verwaltungs GmbH – Oberhausen",
      "type": "Registerbekanntmachung nach dem Umwandlungsgesetz",
      "state": "Nordrhein-Westfalen",
      "amtsgericht": "Amtsgericht Duisburg",
      "registernummer": "HRB 9379",
      "registerart": "HRB",
      "company_name": "dotzilla Verwaltungs GmbH",
      "company_seat": "Oberhausen",
      "details": "22.12.2025 (Bekanntmachungsdatum)\n\nNordrhein-Westfalen Amtsgericht Duisburg HRB 9379\nRegisterbekanntmachung nach dem Umwandlungsgesetz 22.12.2025 (Eintragungsdatum)\n\ndotzilla Verwaltungs GmbH\nGesellschaft mit beschränkter Haftung\nOberhausen\n\nDie Gesellschaft hat Gläubigern, deren Forderungen vor dieser Bekanntmachung begründet worden sind, Sicherheit zu leisten, soweit sie nicht Befriedigung verlangen können, wenn sie sich binnen sechs Monaten zu diesem Zweck melden."
    },
    {
      "date": "2025-12-22",
      "id": "140834",
      "original_text": "Löschungsankündigung\nNordrhein-Westfalen Amtsgericht Duisburg HRA 13281\nALLMAHO Oleksandr Panchenko e.K. – Duisburg",
      "type": "Löschungsankündigung",
      "state": "Nordrhein-Westfalen",
      "amtsgericht": "Amtsgericht Duisburg",
      "registernummer": "HRA 13281",
      "registerart": "HRA",
      "company_name": "ALLMAHO Oleksandr Panchenko e.K.",
      "company_seat": "Duisburg",
      "details": "22.12.2025 (Bekanntmachungsdatum)\n\nNordrhein-Westfalen Amtsgericht Duisburg HRA 13281\nLöschungsankündigung\n\nALLMAHO Oleksandr Panchenko e.K.\nEinzelkaufmann / Einzelkauffrau\nDuisburg\n\nDie bei dem Amtsgericht Duisburg unter HRA 13281 eingetragene Firma ALLMAHO Oleksandr Panchenko e.K. soll von Amts wegen gemäß § 31 Absatz 2 HGB, § 393 FamFG gelöscht werden, da das Gewerbe abgemeldet ist.\nWiderspruch hiergegen ist binnen drei Monaten seit Zustellung zulässig. Geht innerhalb dieser Frist kein Widerspruch ein, wird die Firma gelöscht werden.\n\nRechtsbehelfsbelehrung\nDer Widerspruch ist bei dem Amtsgericht Duisburg, Registergericht, Kardinal-Galen-Straße 124-132, 47058 Duisburg, schriftlich einzulegen. Der Widerspruch kann auch zur Niederschrift der Geschäftsstelle eines jeden Amtsgerichts abgegeben werden.\nDie Einlegung ist auch durch Übertragung eines elektronischen Dokuments an die elektronische Poststelle des Gerichts möglich. Das elektronische Dokument muss für die Bearbeitung durch das Gericht geeignet und mit einer qualifizierten elektronischen Signatur der verantwortenden Person versehen sein oder von der verantwortenden Person signiert und auf einem sicheren Übermittlungsweg gemäß § 130 a ZPO nach näherer Maßgabe der Verordnung über die technischen Rahmenbedingungen des elektronischen Rechtsverkehrs und über das besondere elektronische Behördenpostfach (BGBl. I, S. 3803) eingereicht werden. Weitere Informationen erhalten Sie auf der Internetseite www.justiz.de.\nDer Widerspruch muss spätestens innerhalb der gesetzten Frist, beginnend mit der Zustellung dieser Verfügung, bei dem Amtsgericht Duisburg, Registergericht, eingegangen sein. Dies gilt auch dann, wenn der Widerspruch zur Niederschrift der Geschäftsstelle eines anderen Amtsgerichtes abgegeben wurde. Fällt das Ende der Frist auf einen Sonntag, einen allgemeinen Feiertag oder einen Sonnabend, so endet die Frist mit Ablauf des nächsten Werktages. Der Widerspruch muss die Bezeichnung der angefochtenen Verfügung sowie die Erklärung enthalten, dass Widerspruch gegen diese Verfügung eingelegt wird. Er ist zu unterzeichnen und soll begründet werden."
    },
    {
      "date": "2025-12-22",
      "id": "140835",
      "original_text": "Registerbekanntmachung nach dem Umwandlungsgesetz\nNordrhein-Westfalen Amtsgericht Steinfurt GsR 672\nPS-Immo-eGbR – Wettringen",
      "type": "Registerbekanntmachung nach dem Umwandlungsgesetz",
      "state": "Nordrhein-Westfalen",
      "amtsgericht": "Amtsgericht Steinfurt",
      "registernummer": "GsR 672",
      "registerart": "GsR",
      "company_name": "PS-Immo-eGbR",
      "company_seat": "Wettringen",
      "details": "22.12.2025 (Bekanntmachungsdatum)\n\nNordrhein-Westfalen Amtsgericht Steinfurt GsR 672\nRegisterbekanntmachung nach dem Umwandlungsgesetz 22.12.2025 (Eintragungsdatum)\n\nPS-Immo-eGbR\nGesellschaft bürgerlichen Rechts\nWettringen\n\nDen Gläubigern der an der formwechselnden Umwandlung beteiligten Rechtsträger ist, wenn sie binnen sechs Monaten nach dem Tag, an dem die Eintragung der formwechselnden Umwandlung in das Register des Sitzes desjenigen Rechtsträgers, dessen Gläubiger sie sind, nach § 19 Absatz 3 UmwG als bekanntgemacht gilt, ihren Anspruch nach Grund und Höhe schriftlich anmelden, Sicherheit zu leisten, soweit sie nicht Befriedigung verlangen können. Dieses Recht steht den Gläubigern jedoch nur zu, wenn sie glaubhaft machen, dass durch die formwechselnden Umwandlung die Erfüllung ihrer Forderung gefährdet wird."
    },
    {
      "date": "2025-12-22",
      "id": "140836",
      "original_text": "Einreichung neuer Dokumente\nNordrhein-Westfalen Amtsgericht Krefeld HRB 5707\nHELIOS Klinikum Krefeld GmbH – Krefeld",
      "type": "Einreichung neuer Dokumente",
      "state": "Nordrhein-Westfalen",
      "amtsgericht": "Amtsgericht Krefeld",
      "registernummer": "HRB 5707",
      "registerart": "HRB",
      "company_name": "HELIOS Klinikum Krefeld GmbH",
      "company_seat": "Krefeld",
      "details": "22.12.2025 (Bekanntmachungsdatum)\n\nNordrhein-Westfalen Amtsgericht Krefeld HRB 5707\nEinreichung neuer Dokumente\n\nHELIOS Klinikum Krefeld GmbH\nGesellschaft mit beschränkter Haftung\nKrefeld\n\nDie Gesellschaft hat eine aktualisierte Liste der Aufsichtsratsmitglieder eingereicht."
    },
    {
      "date": "2025-12-22",
      "id": "140837",
      "original_text": "Löschungsankündigung\nNordrhein-Westfalen Amtsgericht Bad Oeynhausen HRB 18304\nAlpha GFV Tiefbau UG (haftungsbeschränkt) – Spenge",
      "type": "Löschungsankündigung",
      "state": "Nordrhein-Westfalen",
      "amtsgericht": "Amtsgericht Bad Oeynhausen",
      "registernummer": "HRB 18304",
      "registerart": "HRB",
      "company_name": "Alpha GFV Tiefbau UG (haftungsbeschränkt)",
      "company_seat": "Spenge",
      "details": "22.12.2025 (Bekanntmachungsdatum)\n\nNordrhein-Westfalen Amtsgericht Bad Oeynhausen HRB 18304\nLöschungsankündigung\n\nAlpha GFV Tiefbau UG (haftungsbeschränkt)\nGesellschaft mit beschränkter Haftung\nSpenge\n\nDas Registergericht beabsichtigt die Gesellschaft von Amts wegen nach § 394 FamFG zu löschen. Die Frist zur Erhebung eines Widerspruchs ist auf einen Monat festgesetzt."
    },
    {
      "date": "2025-12-22",
      "id": "140838",
      "original_text": "Einreichung neuer Dokumente\nNordrhein-Westfalen Amtsgericht Iserlohn HRB 5093\nAltenaer Baugesellschaft Aktiengesellschaft – Altena/Westf.",
      "type": "Einreichung neuer Dokumente",
      "state": "Nordrhein-Westfalen",
      "amtsgericht": "Amtsgericht Iserlohn",
      "registernummer": "HRB 5093",
      "registerart": "HRB",
      "company_name": "Altenaer Baugesellschaft Aktiengesellschaft",
      "company_seat": "Altena/Westf.",
      "details": "22.12.2025 (Bekanntmachungsdatum)\n\nNordrhein-Westfalen Amtsgericht Iserlohn HRB 5093\nEinreichung neuer Dokumente 22.12.2025 (Eintragungsdatum)\n\nAltenaer Baugesellschaft Aktiengesellschaft\nAktiengesellschaft\nAltena/Westf.\n\nDem Registergericht ist eine neue Liste der Mitglieder des Aufsichtsrates eingereicht worden."
    },
    {
      "date": "2025-12-22",
      "id": "140839",
      "original_text": "Registerbekanntmachung nach dem Umwandlungsgesetz\nNordrhein-Westfalen Amtsgericht Duisburg HRB 24954\ndotzilla service GmbH – Oberhausen",
      "type": "Registerbekanntmachung nach dem Umwandlungsgesetz",
      "state": "Nordrhein-Westfalen",
      "amtsgericht": "Amtsgericht Duisburg",
      "registernummer": "HRB 24954",
      "registerart": "HRB",
      "company_name": "dotzilla service GmbH",
      "company_seat": "Oberhausen",
      "details": "22.12.2025 (Bekanntmachungsdatum)\n\nNordrhein-Westfalen Amtsgericht Duisburg HRB 24954\nRegisterbekanntmachung nach dem Umwandlungsgesetz 22.12.2025 (Eintragungsdatum)\n\ndotzilla service GmbH\nGesellschaft mit beschränkter Haftung\nOberhausen\n\nDie Gesellschaft hat Gläubigern, deren Forderungen vor dieser Bekanntmachung begründet worden sind, Sicherheit zu leisten, soweit sie nicht Befriedigung verlangen können, wenn sie sich binnen sechs Monaten zu diesem Zweck melden."
    },
    {
      "date": "2025-12-22",
      "id": "140840",
      "original_text": "Einreichung neuer Dokumente\nNordrhein-Westfalen Amtsgericht Essen HRB 27613\nPCC Services GmbH der Deutschen Bank – Essen",
      "type": "Einreichung neuer Dokumente",
      "state": "Nordrhein-Westfalen",
      "amtsgericht": "Amtsgericht Essen",
      "registernummer": "HRB 27613",
      "registerart": "HRB",
      "company_name": "PCC Services GmbH der Deutschen Bank",
      "company_seat": "Essen",
      "details": "22.12.2025 (Bekanntmachungsdatum)\n\nNordrhein-Westfalen Amtsgericht Essen HRB 27613\nEinreichung neuer Dokumente\n\nPCC Services GmbH der Deutschen Bank\nGesellschaft mit beschränkter Haftung\nEssen\n\nDem Registergericht ist eine neue Liste der Mitglieder des Aufsichtsrates eingereicht worden."
    },
    {
      "date": "2025-12-22",
      "id": "140841",
      "original_text": "Löschungsankündigung\nNordrhein-Westfalen Amtsgericht Krefeld HRB 13108\nHS ImmoConsult GmbH – Tönisvorst",
      "type": "Löschungsankündigung",
      "state": "Nordrhein-Westfalen",
      "amtsgericht": "Amtsgericht Krefeld",
      "registernummer": "HRB 13108",
      "registerart": "HRB",
      "company_name": "HS ImmoConsult GmbH",
      "company_seat": "Tönisvorst",
      "details": "22.12.2025 (Bekanntmachungsdatum)\n\nNordrhein-Westfalen Amtsgericht Krefeld HRB 13108\nLöschungsankündigung\n\nHS ImmoConsult GmbH\nGesellschaft mit beschränkter Haftung\nTönisvorst\n\nDas Registergericht beabsichtigt die Gesellschaft von Amts wegen nach § 394 FamFG zu löschen. Die Frist zur Erhebung eines Widerspruchs ist auf einen Monat festgesetzt."
    },
    {
      "date": "2025-12-22",
      "id": "140842",
      "original_text": "Löschungsankündigung\nNordrhein-Westfalen Amtsgericht Kleve HRB 13238\nImmoLog UG (haftungsbeschränkt) – Emmerich am Rhein",
      "type": "Löschungsankündigung",
      "state": "Nordrhein-Westfalen",
      "amtsgericht": "Amtsgericht Kleve",
      "registernummer": "HRB 13238",
      "registerart": "HRB",
      "company_name": "ImmoLog UG (haftungsbeschränkt)",
      "company_seat": "Emmerich am Rhein",
      "details": "22.12.2025 (Bekanntmachungsdatum)\n\nNordrhein-Westfalen Amtsgericht Kleve HRB 13238\nLöschungsankündigung\n\nImmoLog UG (haftungsbeschränkt)\nGesellschaft mit beschränkter Haftung\nEmmerich am Rhein\n\nDas Registergericht beabsichtigt die Gesellschaft von Amts wegen nach § 394 FamFG zu löschen. Die Frist zur Erhebung eines Widerspruchs ist auf einen Monat festgesetzt."
    },
    {
      "date": "2025-12-22",
      "id": "140843",
      "original_text": "Löschungsankündigung\nNordrhein-Westfalen Amtsgericht Köln HRB 108218\nOSURA-Security GmbH – Köln",
      "type": "Löschungsankündigung",
      "state": "Nordrhein-Westfalen",
      "amtsgericht": "Amtsgericht Köln",
      "registernummer": "HRB 108218",
      "registerart": "HRB",
      "company_name": "OSURA-Security GmbH",
      "company_seat": "Köln",
      "details": "22.12.2025 (Bekanntmachungsdatum)\n\nNordrhein-Westfalen Amtsgericht Köln HRB 108218\nLöschungsankündigung\n\nOSURA-Security GmbH\nGesellschaft mit beschränkter Haftung\nKöln\n\nDas Registergericht beabsichtigt, die im Handelsregister eingetragene Gesellschaft gemäß § 394 Absatz 1 FamFG wegen Vermögenslosigkeit von Amts wegen zu löschen. Gegen diese Verfügung kann Widerspruch eingelegt werden. Die Frist zur Erhebung eines Widerspruchs gegen die beabsichtigte Löschung von Amts wegen ist auf einen Monat festgesetzt. Rechtsbehelfsbelehrung: Gegen diese Verfügung können Sie Widerspruch einlegen. Der Widerspruch ist bei dem Amtsgericht Köln, Reichenspergerplatz 1, 50670 Köln schriftlich in deutscher Sprache oder zur Niederschrift der Geschäftsstelle einzulegen. Der Widerspruch kann auch zur Niederschrift der Geschäftsstelle eines jeden Amtsgerichtes abgegeben werden. Die Einlegung ist auch durch Übertragung eines elektronischen Dokuments an die elektronische Poststelle des Gerichts möglich. Das elektronische Dokument muss für die Bearbeitung durch das Gericht geeignet und mit einer qualifizierten elektronischen Signatur der verantwortenden Person versehen sein oder von der verantwortenden Person signiert und auf einem sicheren Übermittlungsweg gemäß § 130a ZPO nach näherer Maßgabe der Verordnung über die technischen Rahmenbedingungen des elektronischen Rechtsverkehrs und über das besondere elektronische Behördenpostfach (BGBl. I, S.3803) eingereicht werden. Weitere Informationen erhalten Sie auf der Internetseite www.justiz.de.Der Widerspruch muss spätestens innerhalb der gesetzten Frist bei dem Amtsgericht Köln eingegangen sein. Dies gilt auch dann, wenn der Widerspruch zur Niederschrift der Geschäftsstelle eines anderen Amtsgerichtes abgegeben wurde. Die Frist beginnt mit der Veröffentlichung. Fällt das Ende der Frist auf einen Sonntag, einen allgemeinen Feiertag oder Sonnabend, so endet die Frist mit Ablauf des nächsten Werktages.\n\nDer Widerspruch muss die Bezeichnung der angefochtenen Verfügung sowie die Erklärung enthalten, dass Widerspruch gegen diese Verfügung eingelegt wird. Er ist zu unterzeichnen und soll begründet werden."
    },
    {
      "date": "2025-12-22",
      "id": "140844",
      "original_text": "Registerbekanntmachung nach dem Umwandlungsgesetz\nNordrhein-Westfalen Amtsgericht Münster HRA 12170\nKonstantin Schulenburg \"beneFit Fitness & Wellness\" e.K. – Münster",
      "type": "Registerbekanntmachung nach dem Umwandlungsgesetz",
      "state": "Nordrhein-Westfalen",
      "amtsgericht": "Amtsgericht Münster",
      "registernummer": "HRA 12170",
      "registerart": "HRA",
      "company_name": "Konstantin Schulenburg \"beneFit Fitness & Wellness\" e.K.",
      "company_seat": "Münster",
      "details": "22.12.2025 (Bekanntmachungsdatum)\n\nNordrhein-Westfalen Amtsgericht Münster HRA 12170\nRegisterbekanntmachung nach dem Umwandlungsgesetz 22.12.2025 (Eintragungsdatum)\n\nKonstantin Schulenburg \"beneFit Fitness & Wellness\" e.K.\nEinzelkaufmann / Einzelkauffrau\nMünster\n\nDen Gläubigern der an der Ausgliederung beteiligten Rechtsträger ist, wenn sie binnen sechs Monaten nach dem Tag, an dem die Eintragung der Ausgliederung in das Register des Sitzes desjenigen Rechtsträgers, dessen Gläubiger sie sind, nach § 19 Absatz 3 UmwG als bekanntgemacht gilt, ihren Anspruch nach Grund und Höhe schriftlich anmelden, Sicherheit zu leisten, soweit sie nicht Befriedigung verlangen können. Dieses Recht steht den Gläubigern jedoch nur zu, wenn sie glaubhaft machen, dass durch die Ausgliederung die Erfüllung ihrer Forderung gefährdet wird."
    },
    {
      "date": "2025-12-22",
      "id": "140845",
      "original_text": "Registerbekanntmachung nach dem Umwandlungsgesetz\nNordrhein-Westfalen Amtsgericht Hamm HRB 7764\nReady Cuts GmbH – Hamm",
      "type": "Registerbekanntmachung nach dem Umwandlungsgesetz",
      "state": "Nordrhein-Westfalen",
      "amtsgericht": "Amtsgericht Hamm",
      "registernummer": "HRB 7764",
      "registerart": "HRB",
      "company_name": "Ready Cuts GmbH",
      "company_seat": "Hamm",
      "details": "22.12.2025 (Bekanntmachungsdatum)\n\nNordrhein-Westfalen Amtsgericht Hamm HRB 7764\nRegisterbekanntmachung nach dem Umwandlungsgesetz 22.12.2025 (Eintragungsdatum)\n\nReady Cuts GmbH\nGesellschaft mit beschränkter Haftung\nHamm\n\nDen Gläubigern der an der Abspaltung beteiligten Rechtsträger ist, wenn sie binnen sechs Monaten nach dem Tag, an dem die Eintragung der Abspaltung in das Register des Sitzes derjenigen Rechtsträger deren Gläubiger sie sind, nach § 19 Absatz 3 UmwG als bekanntgemacht gilt, ihren Anspruch nach Grund und Höhe schriftlich anmelden, Sicherheit zu leisten, soweit sie nicht Befriedigung verlangen können. Dieses Recht steht den Gläubigern jedoch nur zu, wenn sie glaubhaft machen, dass durch die Abspaltung die Erfüllung ihrer Forderung gefährdet wird."
    },
    {
      "date": "2025-12-22",
      "id": "140846",
      "original_text": "Löschungsankündigung\nBremen Amtsgericht Bremen HRA 27310\nGrote Engineering GmbH & Co. KG – Bremen",
      "type": "Löschungsankündigung",
      "state": "Bremen",
      "amtsgericht": "Amtsgericht Bremen",
      "registernummer": "HRA 27310",
      "registerart": "HRA",
      "company_name": "Grote Engineering GmbH & Co. KG",
      "company_seat": "Bremen",
      "details": "22.12.2025 (Bekanntmachungsdatum)\n\nBremen Amtsgericht Bremen HRA 27310\nLöschungsankündigung\n\nGrote Engineering GmbH & Co. KG\nKommanditgesellschaft\nBremen\n\nEs ist beabsichtigt die im Handelsregister eingetragene Firma von Amts wegen gemäß § 31 Abs.2 HGB zu löschen. Gegen die Löschung kann beim AG Bremen schriftlich oder zu Protokoll der Geschäftsstelle Widerspruch eingelegt werden. Widerspruchsfrist 4 Wochen."
    },
    {
      "date": "2025-12-22",
      "id": "140847",
      "original_text": "Registerbekanntmachung nach dem Umwandlungsgesetz\nBremen Amtsgericht Bremen HRB 42189\nHIAMO GmbH – Bremen",
      "type": "Registerbekanntmachung nach dem Umwandlungsgesetz",
      "state": "Bremen",
      "amtsgericht": "Amtsgericht Bremen",
      "registernummer": "HRB 42189",
      "registerart": "HRB",
      "company_name": "HIAMO GmbH",
      "company_seat": "Bremen",
      "details": "22.12.2025 (Bekanntmachungsdatum)\n\nBremen Amtsgericht Bremen HRB 42189\nRegisterbekanntmachung nach dem Umwandlungsgesetz 16.12.2025 (Eintragungsdatum)\n\nHIAMO GmbH\nGesellschaft mit beschränkter Haftung\nBremen\n\nZu Eintragungsnummer 1 vom 16.12.2025 wird als nicht eingetragen veröffentlicht: Den Gläubigern ist, wenn sie binnen sechs Monaten nach dem Tag, an dem die Eintragung der Umwandlung als bekannt gemacht gilt, ihren Anspruch nach Grund und Höhe schriftlich anmelden, Sicherheit zu leisten, soweit sie nicht Befriedigung verlangen können. Dieses Recht steht den Gläubigern jedoch nur zu, wenn sie glaubhaft machen, dass durch die Umwandlung die Erfüllung ihrer Forderung gefährdet wird. Das Recht, Sicherheitsleistung zu verlangen, steht Gläubigern nicht zu, die im Falle der Insolvenz ein Recht auf vorzugsweise Befriedigung aus einer Deckungsmasse haben, die nach gesetzlicher Vorschrift zu ihrem Schutz errichtet und staatlich überwacht ist."
    },
    {
      "date": "2025-12-22",
      "id": "140848",
      "original_text": "Registerbekanntmachung nach dem Umwandlungsgesetz\nBremen Amtsgericht Bremen HRA 30717\nDesinfektions- und Reinigungsservice Ehrenberg e.K. – Bremen",
      "type": "Registerbekanntmachung nach dem Umwandlungsgesetz",
      "state": "Bremen",
      "amtsgericht": "Amtsgericht Bremen",
      "registernummer": "HRA 30717",
      "registerart": "HRA",
      "company_name": "Desinfektions- und Reinigungsservice Ehrenberg e.K.",
      "company_seat": "Bremen",
      "details": "22.12.2025 (Bekanntmachungsdatum)\n\nBremen Amtsgericht Bremen HRA 30717\nRegisterbekanntmachung nach dem Umwandlungsgesetz 16.12.2025 (Eintragungsdatum)\n\nDesinfektions- und Reinigungsservice Ehrenberg e.K.\nEinzelkaufmann / Einzelkauffrau\nBremen\n\nZu Eintragungsnummer 2 vom 16.12.2025 wird als nicht eingetragen veröffentlicht: Den Gläubigern der an der Spaltung beteiligten Rechtsträger ist, wenn sie binnen sechs Monaten nach dem Tag, an dem die Eintragung der Spaltung in das Register des Sitzes desjenigen Rechtsträgers, dessen Gläubiger sie sind, als bekannt gemacht gilt, ihren Anspruch nach Grund und Höhe schriftlich anmelden, Sicherheit zu leisten, soweit sie nicht Befriedigung verlangen können. Dieses Recht steht den Gläubigern jedoch nur zu, wenn sie glaubhaft machen, dass durch die Spaltung die Erfüllung ihrer Forderung gefährdet wird. Das Recht, Sicherheitsleistung zu verlangen, steht Gläubigern nicht zu, die im Falle der Insolvenz ein Recht auf vorzugsweise Befriedigung aus einer Deckungsmasse haben, die nach gesetzlicher Vorschrift zu ihrem Schutz errichtet und staatlich überwacht ist."
    },
    {
      "date": "2025-12-22",
      "id": "140849",
      "original_text": "Registerbekanntmachung nach dem Umwandlungsgesetz\nBremen Amtsgericht Bremen HRB 2761 BHV\nAuxilium Dienstleistungen GmbH – Bremerhaven",
      "type": "Registerbekanntmachung nach dem Umwandlungsgesetz",
      "state": "Bremen",
      "amtsgericht": "Amtsgericht Bremen",
      "registernummer": "HRB 2761 BHV",
      "registerart": "HRB",
      "company_name": "Auxilium Dienstleistungen GmbH",
      "company_seat": "Bremerhaven",
      "details": "22.12.2025 (Bekanntmachungsdatum)\n\nBremen Amtsgericht Bremen HRB 2761 BHV\nRegisterbekanntmachung nach dem Umwandlungsgesetz 16.12.2025 (Eintragungsdatum)\n\nAuxilium Dienstleistungen GmbH\nGesellschaft mit beschränkter Haftung\nBremerhaven\n\nZu Eintragungsnummer 12 vom 16.12.2025 wird als nicht eingetragen veröffentlicht: Den Gläubigern der an der Verschmelzung beteiligten Rechtsträger ist, wenn sie binnen sechs Monaten nach dem Tag, an dem die Eintragung der Verschmelzung in das Register des Sitzes desjenigen Rechtsträgers, dessen Gläubiger sie sind, als bekannt gemacht gilt, ihren Anspruch nach Grund und Höhe schriftlich anmelden, Sicherheit zu leisten, soweit sie nicht Befriedigung verlangen können. Dieses Recht steht den Gläubigern jedoch nur zu, wenn sie glaubhaft machen, dass durch die Verschmelzung die Erfüllung ihrer Forderung gefährdet wird. Das Recht, Sicherheitsleistung zu verlangen, steht Gläubigern nicht zu, die im Falle der Insolvenz ein Recht auf vorzugsweise Befriedigung aus einer Deckungsmasse haben, die nach gesetzlicher Vorschrift zu ihrem Schutz errichtet und staatlich überwacht ist."
    },
    {
      "date": "2025-12-22",
      "id": "140850",
      "original_text": "Registerbekanntmachung nach dem Umwandlungsgesetz\nBremen Amtsgericht Bremen HRB 37871\nEasy Tire Beteiligungs GmbH – Bremen",
      "type": "Registerbekanntmachung nach dem Umwandlungsgesetz",
      "state": "Bremen",
      "amtsgericht": "Amtsgericht Bremen",
      "registernummer": "HRB 37871",
      "registerart": "HRB",
      "company_name": "Easy Tire Beteiligungs GmbH",
      "company_seat": "Bremen",
      "details": "22.12.2025 (Bekanntmachungsdatum)\n\nBremen Amtsgericht Bremen HRB 37871\nRegisterbekanntmachung nach dem Umwandlungsgesetz 11.12.2025 (Eintragungsdatum)\n\nEasy Tire Beteiligungs GmbH\nGesellschaft mit beschränkter Haftung\nBremen\n\nZu Eintragungsnummer 4 vom 11.12.2025 wird als nicht eingetragen veröffentlicht: Den Gläubigern der an der Verschmelzung beteiligten Rechtsträger ist, wenn sie binnen sechs Monaten nach dem Tag, an dem die Eintragung der Verschmelzung in das Register des Sitzes desjenigen Rechtsträgers, dessen Gläubiger sie sind, als bekannt gemacht gilt, ihren Anspruch nach Grund und Höhe schriftlich anmelden, Sicherheit zu leisten, soweit sie nicht Befriedigung verlangen können. Dieses Recht steht den Gläubigern jedoch nur zu, wenn sie glaubhaft machen, dass durch die Verschmelzung die Erfüllung ihrer Forderung gefährdet wird. Das Recht, Sicherheitsleistung zu verlangen, steht Gläubigern nicht zu, die im Falle der Insolvenz ein Recht auf vorzugsweise Befriedigung aus einer Deckungsmasse haben, die nach gesetzlicher Vorschrift zu ihrem Schutz errichtet und staatlich überwacht ist."
    },
    {
      "date": "2025-12-22",
      "id": "140851",
      "original_text": "Löschungsankündigung\nBremen Amtsgericht Bremen HRB 35773\nMPHA-Holding GmbH – Bremen",
      "type": "Löschungsankündigung",
      "state": "Bremen",
      "amtsgericht": "Amtsgericht Bremen",
      "registernummer": "HRB 35773",
      "registerart": "HRB",
      "company_name": "MPHA-Holding GmbH",
      "company_seat": "Bremen",
      "details": "22.12.2025 (Bekanntmachungsdatum)\n\nBremen Amtsgericht Bremen HRB 35773\nLöschungsankündigung\n\nMPHA-Holding GmbH\nGesellschaft mit beschränkter Haftung\nBremen\n\nEs ist beabsichtigt die im Handelsregister eingetragene Gesellschaft von Amts wegen gemäß § 394 FamFG zu löschen. Gegen die Löschung kann beim AG Bremen schriftlich oder zu Protokoll der Geschäftsstelle Widerspruch eingelegt werden. Widerspruchsfrist 4 Wochen."
    },
    {
      "date": "2025-12-22",
      "id": "140852",
      "original_text": "Löschungsankündigung\nHessen Amtsgericht Wiesbaden HRB 29708\nMOE.CON GmbH – Wiesbaden",
      "type": "Löschungsankündigung",
      "state": "Hessen",
      "amtsgericht": "Amtsgericht Wiesbaden",
      "registernummer": "HRB 29708",
      "registerart": "HRB",
      "company_name": "MOE.CON GmbH",
      "company_seat": "Wiesbaden",
      "details": "22.12.2025 (Bekanntmachungsdatum)\n\nHessen Amtsgericht Wiesbaden HRB 29708\nLöschungsankündigung\n\nMOE.CON GmbH\nGesellschaft mit beschränkter Haftung\nWiesbaden\n\nDas Registergericht beabsichtigt die im Handelsregister eingetragene Gesellschaft von Amts wegen nach § 394 FamFG zu löschen. Die Frist zur Erhebung eines Widerspruchs gegen die beabsichtigte Löschung wird auf 3 Monate festgesetzt."
    },
    {
      "date": "2025-12-22",
      "id": "140853",
      "original_text": "Registerbekanntmachung nach dem Umwandlungsgesetz\nHessen Amtsgericht Frankfurt am Main HRA 54507\nKaempfer Holding KG – Frankfurt am Main",
      "type": "Registerbekanntmachung nach dem Umwandlungsgesetz",
      "state": "Hessen",
      "amtsgericht": "Amtsgericht Frankfurt am Main",
      "registernummer": "HRA 54507",
      "registerart": "HRA",
      "company_name": "Kaempfer Holding KG",
      "company_seat": "Frankfurt am Main",
      "details": "22.12.2025 (Bekanntmachungsdatum)\n\nHessen Amtsgericht Frankfurt am Main HRA 54507\nRegisterbekanntmachung nach dem Umwandlungsgesetz 22.12.2025 (Eintragungsdatum)\n\nKaempfer Holding KG\nKommanditgesellschaft\nFrankfurt am Main\n\nDen Gläubigern der an der formwechselnden Umwandlung beteiligten Rechtsträger ist, wenn sie binnen sechs Monaten nach dem Tag, an dem die Eintragung der formwechselnden Umwandlung in das Register des Sitzes desjenigen Rechtsträgers, dessen Gläubiger sie sind, nach § 201 UmwG bekannt gemacht worden ist, ihren Anspruch nach Grund und Höhe schriftlich anmelden, Sicherheit zu leisten, soweit sie nicht Befriedigung verlangen können. Dieses Recht steht den Gläubigern jedoch nur zu, wenn sie glaubhaft machen, dass durch die formwechselnden Umwandlung die Erfüllung ihrer Forderung gefährdet wird."
    },
    {
      "date": "2025-12-22",
      "id": "140854",
      "original_text": "Registerbekanntmachung nach dem Umwandlungsgesetz\nHessen Amtsgericht Frankfurt am Main HRB 105692\nKaempfer Consult & Invest GmbH – Frankfurt am Main",
      "type": "Registerbekanntmachung nach dem Umwandlungsgesetz",
      "state": "Hessen",
      "amtsgericht": "Amtsgericht Frankfurt am Main",
      "registernummer": "HRB 105692",
      "registerart": "HRB",
      "company_name": "Kaempfer Consult & Invest GmbH",
      "company_seat": "Frankfurt am Main",
      "details": "22.12.2025 (Bekanntmachungsdatum)\n\nHessen Amtsgericht Frankfurt am Main HRB 105692\nRegisterbekanntmachung nach dem Umwandlungsgesetz 22.12.2025 (Eintragungsdatum)\n\nKaempfer Consult & Invest GmbH\nGesellschaft mit beschränkter Haftung\nFrankfurt am Main\n\nDen Gläubigern der an der formwechselnden Umwandlung beteiligten Rechtsträger ist, wenn sie binnen sechs Monaten nach dem Tag, an dem die Eintragung der formwechselnden Umwandlung in das Register des Sitzes desjenigen Rechtsträgers, dessen Gläubiger sie sind, nach § 201 UmwG bekannt gemacht worden ist, ihren Anspruch nach Grund und Höhe schriftlich anmelden, Sicherheit zu leisten, soweit sie nicht Befriedigung verlangen können. Dieses Recht steht den Gläubigern jedoch nur zu, wenn sie glaubhaft machen, dass durch die formwechselnden Umwandlung die Erfüllung ihrer Forderung gefährdet wird."
    },
    {
      "date": "2025-12-22",
      "id": "140855",
      "original_text": "Löschungsankündigung\nHessen Amtsgericht Frankfurt am Main HRB 126990\nSecretäriet Montage-Techniken & Dienstleistungs-Services UG (haftungsbeschränkt) – Liederbach am Taunus",
      "type": "Löschungsankündigung",
      "state": "Hessen",
      "amtsgericht": "Amtsgericht Frankfurt am Main",
      "registernummer": "HRB 126990",
      "registerart": "HRB",
      "company_name": "Secretäriet Montage-Techniken & Dienstleistungs-Services UG (haftungsbeschränkt)",
      "company_seat": "Liederbach am Taunus",
      "details": "22.12.2025 (Bekanntmachungsdatum)\n\nHessen Amtsgericht Frankfurt am Main HRB 126990\nLöschungsankündigung\n\nSecretäriet Montage-Techniken & Dienstleistungs-Services UG (haftungsbeschränkt)\nGesellschaft mit beschränkter Haftung\nLiederbach am Taunus\n\nEs ist beabsichtigt, die Gesellschaft wegen Vermögenslosigkeit gemäß § 394 FamFG von Amts wegen im Handelsregister zu löschen.\nHiergegen kann binnen 1 Monats Widerspruch beim Amtsgericht Frankfurt am Main eingelegt werden."
    },
    {
      "date": "2025-12-22",
      "id": "140856",
      "original_text": "Löschungsankündigung\nHessen Amtsgericht Darmstadt HRA 86401\nStraße der Nationen 146a, Chemnitz GmbH & Co. KG – Pfungstadt",
      "type": "Löschungsankündigung",
      "state": "Hessen",
      "amtsgericht": "Amtsgericht Darmstadt",
      "registernummer": "HRA 86401",
      "registerart": "HRA",
      "company_name": "Straße der Nationen 146a, Chemnitz GmbH & Co. KG",
      "company_seat": "Pfungstadt",
      "details": "22.12.2025 (Bekanntmachungsdatum)\n\nHessen Amtsgericht Darmstadt HRA 86401\nLöschungsankündigung\n\nStraße der Nationen 146a, Chemnitz GmbH & Co. KG\nKommanditgesellschaft\nPfungstadt\n\nDas Registergericht beabsichtigt die im Handelsregister eingetragene Firma von Amts wegen nach § 394 FamFG zu löschen. Die Frist zur Erhebung eines Widerspruchs gegen die beabsichtigte Löschung wird auf 3 Monate festgesetzt."
    },
    {
      "date": "2025-12-22",
      "id": "140857",
      "original_text": "Sonstige Registerbekanntmachung\nHessen Amtsgericht Kassel VR 3195\nMensch zuerst - Netzwerk People First Deutschland e.V. – Kassel",
      "type": "Sonstige Registerbekanntmachung",
      "state": "Hessen",
      "amtsgericht": "Amtsgericht Kassel",
      "registernummer": "VR 3195",
      "registerart": "VR",
      "company_name": "Mensch zuerst - Netzwerk People First Deutschland e.V.",
      "company_seat": "Kassel",
      "details": "22.12.2025 (Bekanntmachungsdatum)\n\nHessen Amtsgericht Kassel VR 3195\nSonstige Registerbekanntmachung 22.12.2025 (Eintragungsdatum)\n\nMensch zuerst - Netzwerk People First Deutschland e.V.\neingetragener Verein\nKassel\n\nDer Verein ist aufgelöst."
    },
    {
      "date": "2025-12-22",
      "id": "140858",
      "original_text": "Registerbekanntmachung nach dem Umwandlungsgesetz\nHessen Amtsgericht Offenbach am Main HRB 43452\nBiokraft Naturbrennstoffe GmbH – Offenbach",
      "type": "Registerbekanntmachung nach dem Umwandlungsgesetz",
      "state": "Hessen",
      "amtsgericht": "Amtsgericht Offenbach am Main",
      "registernummer": "HRB 43452",
      "registerart": "HRB",
      "company_name": "Biokraft Naturbrennstoffe GmbH",
      "company_seat": "Offenbach",
      "details": "22.12.2025 (Bekanntmachungsdatum)\n\nHessen Amtsgericht Offenbach am Main HRB 43452\nRegisterbekanntmachung nach dem Umwandlungsgesetz 22.12.2025 (Eintragungsdatum)\n\nBiokraft Naturbrennstoffe GmbH\nGesellschaft mit beschränkter Haftung\nOffenbach\n\nDen Gläubigern der an der Verschmelzung beteiligten Rechtsträger ist, wenn sie binnen sechs Monaten nach dem Tag, an dem die Eintragung der Verschmelzung in das Register des Sitzes desjenigen Rechtsträgers, dessen Gläubiger sie sind, nach § 19 Absatz 3 UmwG bekannt gemacht worden ist, ihren Anspruch nach Grund und Höhe schriftlich anmelden, Sicherheit zu leisten, soweit sie nicht Befriedigung verlangen können. Dieses Recht steht den Gläubigern jedoch nur zu, wenn sie glaubhaft machen, dass durch die Verschmelzung die Erfüllung ihrer Forderung gefährdet wird."
    },
    {
      "date": "2025-12-22",
      "id": "140859",
      "original_text": "Löschungsankündigung\nHessen Amtsgericht Darmstadt HRB 101159\nMillionDreams Holding UG (haftungsbeschränkt) – Dieburg",
      "type": "Löschungsankündigung",
      "state": "Hessen",
      "amtsgericht": "Amtsgericht Darmstadt",
      "registernummer": "HRB 101159",
      "registerart": "HRB",
      "company_name": "MillionDreams Holding UG (haftungsbeschränkt)",
      "company_seat": "Dieburg",
      "details": "22.12.2025 (Bekanntmachungsdatum)\n\nHessen Amtsgericht Darmstadt HRB 101159\nLöschungsankündigung\n\nMillionDreams Holding UG (haftungsbeschränkt)\nGesellschaft mit beschränkter Haftung\nDieburg\n\nDas Registergericht beabsichtigt die im Handelsregister eingetragene Gesellschaft von Amts wegen nach § 394 FamFG zu löschen. Die Frist zur Erhebung eines Widerspruchs gegen die beabsichtigte Löschung wird auf 3 Monate festgesetzt."
    }
  ]
}