{
  "date": "2025-12-12",
  "date_of_scrape": "2025-12-13T04:11:44.780Z",
  "tool_version": "0.2.0",
  "number_of_announcements": 89,
  "announcements": [
    {
      "date": "2025-12-12",
      "id": "139833",
      "original_text": "Einreichung neuer Dokumente\nBayern Amtsgericht Landshut HRB 827\nLandshuter Kunstmühle C.A. Meyer`s Nachfolger Aktiengesellschaft – Landshut",
      "type": "Einreichung neuer Dokumente",
      "state": "Bayern",
      "amtsgericht": "Amtsgericht Landshut",
      "registernummer": "HRB 827",
      "registerart": "HRB",
      "company_name": "Landshuter Kunstmühle C.A. Meyer`s Nachfolger Aktiengesellschaft",
      "company_seat": "Landshut",
      "details": "12.12.2025 (Bekanntmachungsdatum)\n\nBayern Amtsgericht Landshut HRB 827\nEinreichung neuer Dokumente\n\nLandshuter Kunstmühle C.A. Meyer`s Nachfolger Aktiengesellschaft\nAktiengesellschaft\nLandshut\n\nDem Amtsgericht Landshut -Registergericht- ist eine Liste der Mitglieder des Aufsichtsrats eingereicht worden, § 106 AktG."
    },
    {
      "date": "2025-12-12",
      "id": "139834",
      "original_text": "Löschungsankündigung\nBayern Amtsgericht München HRB 251908\nretailconsultants GmbH – Starnberg",
      "type": "Löschungsankündigung",
      "state": "Bayern",
      "amtsgericht": "Amtsgericht München",
      "registernummer": "HRB 251908",
      "registerart": "HRB",
      "company_name": "retailconsultants GmbH",
      "company_seat": "Starnberg",
      "details": "12.12.2025 (Bekanntmachungsdatum)\n\nBayern Amtsgericht München HRB 251908\nLöschungsankündigung\n\nretailconsultants GmbH\nGesellschaft mit beschränkter Haftung\nStarnberg\n\nDas Registergericht beabsichtigt, die im Handelsregister eingetragene Gesellschaft wegen Vermögenslosigkeit von Amts wegen nach § 394 FamFG zu löschen. Die Frist zur Erhebung eines Widerspruchs ist auf drei Monate festgesetzt."
    },
    {
      "date": "2025-12-12",
      "id": "139835",
      "original_text": "Registerbekanntmachung nach dem Umwandlungsgesetz\nBayern Amtsgericht Schweinfurt HRB 663\nREMOG-Präzisionsteile GmbH – Münnerstadt",
      "type": "Registerbekanntmachung nach dem Umwandlungsgesetz",
      "state": "Bayern",
      "amtsgericht": "Amtsgericht Schweinfurt",
      "registernummer": "HRB 663",
      "registerart": "HRB",
      "company_name": "REMOG-Präzisionsteile GmbH",
      "company_seat": "Münnerstadt",
      "details": "12.12.2025 (Bekanntmachungsdatum)\n\nBayern Amtsgericht Schweinfurt HRB 663\nRegisterbekanntmachung nach dem Umwandlungsgesetz 11.12.2025 (Eintragungsdatum)\n\nREMOG-Präzisionsteile GmbH\nGesellschaft mit beschränkter Haftung\nMünnerstadt\n\nDen Gläubigern der an der Verschmelzung beteiligten Rechtsträger ist, wenn sie binnen sechs Monaten nach dem Tag, an dem die Eintragung der Verschmelzung in das Register des Sitzes desjenigen Rechtsträgers, dessen Gläubiger sie sind, nach § 19 Abs. 3 UmwG als bekannt gemacht gilt, ihren Anspruch nach Grund und Höhe in Textform anmelden, Sicherheit zu leisten, soweit sie nicht Befriedigung verlangen können. Dieses Recht steht den Gläubigern jedoch nur zu, wenn sie glaubhaft machen, dass durch die Verschmelzung die Erfüllung ihrer Forderung gefährdet wird."
    },
    {
      "date": "2025-12-12",
      "id": "139836",
      "original_text": "Löschungsankündigung\nBayern Amtsgericht Landshut HRB 13324\nFOUNDIO UG (haftungsbeschränkt) – Landshut",
      "type": "Löschungsankündigung",
      "state": "Bayern",
      "amtsgericht": "Amtsgericht Landshut",
      "registernummer": "HRB 13324",
      "registerart": "HRB",
      "company_name": "FOUNDIO UG (haftungsbeschränkt)",
      "company_seat": "Landshut",
      "details": "12.12.2025 (Bekanntmachungsdatum)\n\nBayern Amtsgericht Landshut HRB 13324\nLöschungsankündigung\n\nFOUNDIO UG (haftungsbeschränkt)\nGesellschaft mit beschränkter Haftung\nLandshut\n\nDas Registergericht beabsichtigt, die im Handelsregister eingetragene Gesellschaft wegen Vermögenslosigkeit von Amts wegen nach § 394 FamFG zu löschen. Die Frist zur Erhebung eines Widerspruchs ist auf einen Monat festgesetzt."
    },
    {
      "date": "2025-12-12",
      "id": "139837",
      "original_text": "Registerbekanntmachung nach dem Umwandlungsgesetz\nBayern Amtsgericht Augsburg HRB 41826\nWEKA Media Group GmbH – Kissing",
      "type": "Registerbekanntmachung nach dem Umwandlungsgesetz",
      "state": "Bayern",
      "amtsgericht": "Amtsgericht Augsburg",
      "registernummer": "HRB 41826",
      "registerart": "HRB",
      "company_name": "WEKA Media Group GmbH",
      "company_seat": "Kissing",
      "details": "12.12.2025 (Bekanntmachungsdatum)\n\nBayern Amtsgericht Augsburg HRB 41826\nRegisterbekanntmachung nach dem Umwandlungsgesetz 11.12.2025 (Eintragungsdatum)\n\nWEKA Media Group GmbH\nGesellschaft mit beschränkter Haftung\nKissing\n\nDen Gläubigern der an der Spaltung beteiligten Rechtsträger ist, wenn sie binnen sechs Monaten nach dem Tag, an dem die Eintragung der Spaltung in das Register des Sitzes desjenigen Rechtsträgers, dessen Gläubiger sie sind, nach §§ 125, 19 Abs. 3 UmwG als bekannt gemacht gilt, ihren Anspruch nach Grund und Höhe in Textform anmelden, Sicherheit zu leisten, soweit sie nicht Befriedigung verlangen können. Dieses Recht steht den Gläubigern jedoch nur zu, wenn sie glaubhaft machen, dass durch die Spaltung die Erfüllung ihrer Forderung gefährdet wird."
    },
    {
      "date": "2025-12-12",
      "id": "139838",
      "original_text": "Registerbekanntmachung nach dem Umwandlungsgesetz\nBayern Amtsgericht Ansbach HRA 4904\nWaschanlage Fürth e.K. Inh. Christoph Hanel – Gunzenhausen",
      "type": "Registerbekanntmachung nach dem Umwandlungsgesetz",
      "state": "Bayern",
      "amtsgericht": "Amtsgericht Ansbach",
      "registernummer": "HRA 4904",
      "registerart": "HRA",
      "company_name": "Waschanlage Fürth e.K. Inh. Christoph Hanel",
      "company_seat": "Gunzenhausen",
      "details": "12.12.2025 (Bekanntmachungsdatum)\n\nBayern Amtsgericht Ansbach HRA 4904\nRegisterbekanntmachung nach dem Umwandlungsgesetz 11.12.2025 (Eintragungsdatum)\n\nWaschanlage Fürth e.K. Inh. Christoph Hanel\nEinzelkaufmann / Einzelkauffrau\nGunzenhausen\n\nDen Gläubigern der an der Ausgliederung beteiligten Rechtsträger ist, wenn sie binnen sechs Monaten nach dem Tag, an dem die Eintragung der Ausgliederung in das Register des Sitzes desjenigen Rechtsträgers, dessen Gläubiger sie sind, nach §§ 125, 19 Abs. 3 UmwG als bekannt gemacht gilt, ihren Anspruch nach Grund und Höhe in Textform anmelden, Sicherheit zu leisten, soweit sie nicht Befriedigung verlangen können. Dieses Recht steht den Gläubigern jedoch nur zu, wenn sie glaubhaft machen, dass durch die Ausgliederung die Erfüllung ihrer Forderung gefährdet wird."
    },
    {
      "date": "2025-12-12",
      "id": "139839",
      "original_text": "Registerbekanntmachung nach dem Umwandlungsgesetz\nBayern Amtsgericht Ansbach HRA 4905\nWaschanlage Gun u.a. e.K. Inh. Christoph Hanel – Gunzenhausen",
      "type": "Registerbekanntmachung nach dem Umwandlungsgesetz",
      "state": "Bayern",
      "amtsgericht": "Amtsgericht Ansbach",
      "registernummer": "HRA 4905",
      "registerart": "HRA",
      "company_name": "Waschanlage Gun u.a. e.K. Inh. Christoph Hanel",
      "company_seat": "Gunzenhausen",
      "details": "12.12.2025 (Bekanntmachungsdatum)\n\nBayern Amtsgericht Ansbach HRA 4905\nRegisterbekanntmachung nach dem Umwandlungsgesetz 11.12.2025 (Eintragungsdatum)\n\nWaschanlage Gun u.a. e.K. Inh. Christoph Hanel\nEinzelkaufmann / Einzelkauffrau\nGunzenhausen\n\nDen Gläubigern der an der Ausgliederung beteiligten Rechtsträger ist, wenn sie binnen sechs Monaten nach dem Tag, an dem die Eintragung der Ausgliederung in das Register des Sitzes desjenigen Rechtsträgers, dessen Gläubiger sie sind, nach §§ 125, 19 Abs. 3 UmwG als bekannt gemacht gilt, ihren Anspruch nach Grund und Höhe in Textform anmelden, Sicherheit zu leisten, soweit sie nicht Befriedigung verlangen können. Dieses Recht steht den Gläubigern jedoch nur zu, wenn sie glaubhaft machen, dass durch die Ausgliederung die Erfüllung ihrer Forderung gefährdet wird."
    },
    {
      "date": "2025-12-12",
      "id": "139840",
      "original_text": "Registerbekanntmachung nach dem Umwandlungsgesetz\nBayern Amtsgericht Schweinfurt HRB 7451\nREMOG Verwaltungs GmbH – Münnerstadt",
      "type": "Registerbekanntmachung nach dem Umwandlungsgesetz",
      "state": "Bayern",
      "amtsgericht": "Amtsgericht Schweinfurt",
      "registernummer": "HRB 7451",
      "registerart": "HRB",
      "company_name": "REMOG Verwaltungs GmbH",
      "company_seat": "Münnerstadt",
      "details": "12.12.2025 (Bekanntmachungsdatum)\n\nBayern Amtsgericht Schweinfurt HRB 7451\nRegisterbekanntmachung nach dem Umwandlungsgesetz 11.12.2025 (Eintragungsdatum)\n\nREMOG Verwaltungs GmbH\nGesellschaft mit beschränkter Haftung\nMünnerstadt\n\nDen Gläubigern der an der Verschmelzung beteiligten Rechtsträger ist, wenn sie binnen sechs Monaten nach dem Tag, an dem die Eintragung der Verschmelzung in das Register des Sitzes desjenigen Rechtsträgers, dessen Gläubiger sie sind, nach § 19 Abs. 3 UmwG als bekannt gemacht gilt, ihren Anspruch nach Grund und Höhe in Textform anmelden, Sicherheit zu leisten, soweit sie nicht Befriedigung verlangen können. Dieses Recht steht den Gläubigern jedoch nur zu, wenn sie glaubhaft machen, dass durch die Verschmelzung die Erfüllung ihrer Forderung gefährdet wird."
    },
    {
      "date": "2025-12-12",
      "id": "139841",
      "original_text": "Registerbekanntmachung nach dem Umwandlungsgesetz\nBayern Amtsgericht Ansbach HRB 8752\nWaschanlagen Hanel GmbH – Gunzenhausen",
      "type": "Registerbekanntmachung nach dem Umwandlungsgesetz",
      "state": "Bayern",
      "amtsgericht": "Amtsgericht Ansbach",
      "registernummer": "HRB 8752",
      "registerart": "HRB",
      "company_name": "Waschanlagen Hanel GmbH",
      "company_seat": "Gunzenhausen",
      "details": "12.12.2025 (Bekanntmachungsdatum)\n\nBayern Amtsgericht Ansbach HRB 8752\nRegisterbekanntmachung nach dem Umwandlungsgesetz 11.12.2025 (Eintragungsdatum)\n\nWaschanlagen Hanel GmbH\nGesellschaft mit beschränkter Haftung\nGunzenhausen\n\nDen Gläubigern der an der Ausgliederung beteiligten Rechtsträger ist, wenn sie binnen sechs Monaten nach dem Tag, an dem die Eintragung der Ausgliederung in das Register des Sitzes desjenigen Rechtsträgers, dessen Gläubiger sie sind, nach §§ 125, 19 Abs. 3 UmwG als bekannt gemacht gilt, ihren Anspruch nach Grund und Höhe in Textform anmelden, Sicherheit zu leisten, soweit sie nicht Befriedigung verlangen können. Dieses Recht steht den Gläubigern jedoch nur zu, wenn sie glaubhaft machen, dass durch die Ausgliederung die Erfüllung ihrer Forderung gefährdet wird."
    },
    {
      "date": "2025-12-12",
      "id": "139842",
      "original_text": "Sonstige Registerbekanntmachung\nBayern Amtsgericht Augsburg HRB 41865\nPP Media Holding GmbH – Kissing",
      "type": "Sonstige Registerbekanntmachung",
      "state": "Bayern",
      "amtsgericht": "Amtsgericht Augsburg",
      "registernummer": "HRB 41865",
      "registerart": "HRB",
      "company_name": "PP Media Holding GmbH",
      "company_seat": "Kissing",
      "details": "12.12.2025 (Bekanntmachungsdatum)\n\nBayern Amtsgericht Augsburg HRB 41865\nSonstige Registerbekanntmachung 11.12.2025 (Eintragungsdatum)\n\nPP Media Holding GmbH\nGesellschaft mit beschränkter Haftung\nKissing\n\nDen Gläubigern der an der Spaltung beteiligten Rechtsträger ist, wenn sie binnen sechs Monaten nach dem Tag, an dem die Eintragung der Spaltung in das Register des Sitzes desjenigen Rechtsträgers, dessen Gläubiger sie sind, nach §§ 125, 19 Abs. 3 UmwG als bekannt gemacht gilt, ihren Anspruch nach Grund und Höhe in Textform anmelden, Sicherheit zu leisten, soweit sie nicht Befriedigung verlangen können. Dieses Recht steht den Gläubigern jedoch nur zu, wenn sie glaubhaft machen, dass durch die Spaltung die Erfüllung ihrer Forderung gefährdet wird."
    },
    {
      "date": "2025-12-12",
      "id": "139843",
      "original_text": "Registerbekanntmachung nach dem Umwandlungsgesetz\nBayern Amtsgericht Augsburg HRA 20886\nOmnibus-Service e.K. Inh. Tobias Maikowske – Welden",
      "type": "Registerbekanntmachung nach dem Umwandlungsgesetz",
      "state": "Bayern",
      "amtsgericht": "Amtsgericht Augsburg",
      "registernummer": "HRA 20886",
      "registerart": "HRA",
      "company_name": "Omnibus-Service e.K. Inh. Tobias Maikowske",
      "company_seat": "Welden",
      "details": "12.12.2025 (Bekanntmachungsdatum)\n\nBayern Amtsgericht Augsburg HRA 20886\nRegisterbekanntmachung nach dem Umwandlungsgesetz 11.12.2025 (Eintragungsdatum)\n\nOmnibus-Service e.K. Inh. Tobias Maikowske\nEinzelkaufmann / Einzelkauffrau\nWelden\n\nDen Gläubigern der an der Ausgliederung beteiligten Rechtsträger ist, wenn sie binnen sechs Monaten nach dem Tag, an dem die Eintragung der Ausgliederung in das Register des Sitzes desjenigen Rechtsträgers, dessen Gläubiger sie sind, nach §§ 125, 19 Abs. 3 UmwG als bekannt gemacht gilt, ihren Anspruch nach Grund und Höhe in Textform anmelden, Sicherheit zu leisten, soweit sie nicht Befriedigung verlangen können. Dieses Recht steht den Gläubigern jedoch nur zu, wenn sie glaubhaft machen, dass durch die Ausgliederung die Erfüllung ihrer Forderung gefährdet wird."
    },
    {
      "date": "2025-12-12",
      "id": "139844",
      "original_text": "Registerbekanntmachung nach dem Umwandlungsgesetz\nBayern Amtsgericht München HRB 300367\nWheelCare AcquiCo GmbH – München",
      "type": "Registerbekanntmachung nach dem Umwandlungsgesetz",
      "state": "Bayern",
      "amtsgericht": "Amtsgericht München",
      "registernummer": "HRB 300367",
      "registerart": "HRB",
      "company_name": "WheelCare AcquiCo GmbH",
      "company_seat": "München",
      "details": "12.12.2025 (Bekanntmachungsdatum)\n\nBayern Amtsgericht München HRB 300367\nRegisterbekanntmachung nach dem Umwandlungsgesetz 11.12.2025 (Eintragungsdatum)\n\nWheelCare AcquiCo GmbH\nGesellschaft mit beschränkter Haftung\nMünchen\n\nDen Gläubigern der an der Verschmelzung beteiligten Rechtsträger ist, wenn sie binnen sechs Monaten nach dem Tag, an dem die Eintragung der Verschmelzung in das Register des Sitzes desjenigen Rechtsträgers, dessen Gläubiger sie sind, nach § 19 Abs. 3 UmwG als bekannt gemacht gilt, ihren Anspruch nach Grund und Höhe in Textform anmelden, Sicherheit zu leisten, soweit sie nicht Befriedigung verlangen können. Dieses Recht steht den Gläubigern jedoch nur zu, wenn sie glaubhaft machen, dass durch die Verschmelzung die Erfüllung ihrer Forderung gefährdet wird."
    },
    {
      "date": "2025-12-12",
      "id": "139845",
      "original_text": "Registerbekanntmachung nach dem Umwandlungsgesetz\nBayern Amtsgericht Nürnberg HRB 29531\nAHL Grundstücksverwaltungs GmbH – Nürnberg",
      "type": "Registerbekanntmachung nach dem Umwandlungsgesetz",
      "state": "Bayern",
      "amtsgericht": "Amtsgericht Nürnberg",
      "registernummer": "HRB 29531",
      "registerart": "HRB",
      "company_name": "AHL Grundstücksverwaltungs GmbH",
      "company_seat": "Nürnberg",
      "details": "12.12.2025 (Bekanntmachungsdatum)\n\nBayern Amtsgericht Nürnberg HRB 29531\nRegisterbekanntmachung nach dem Umwandlungsgesetz 11.12.2025 (Eintragungsdatum)\n\nAHL Grundstücksverwaltungs GmbH\nGesellschaft mit beschränkter Haftung\nNürnberg\n\nDen Gläubigern des formwechselnden Rechtsträgers ist, wenn sie binnen sechs Monaten nach dem Tag, an dem die Eintragung des Formwechsels nach § 201 UmwG als bekannt gemacht gilt, ihren Anspruch nach Grund und Höhe in Textform anmelden, Sicherheit zu leisten, soweit sie nicht Befriedigung verlangen können. Dieses Recht steht den Gläubigern jedoch nur zu, wenn sie glaubhaft machen, dass durch den Formwechsel die Erfüllung ihrer Forderung gefährdet wird."
    },
    {
      "date": "2025-12-12",
      "id": "139846",
      "original_text": "Einreichung neuer Dokumente\nBayern Amtsgericht München HRB 107648\nAirbus Defence and Space GmbH – Ottobrunn",
      "type": "Einreichung neuer Dokumente",
      "state": "Bayern",
      "amtsgericht": "Amtsgericht München",
      "registernummer": "HRB 107648",
      "registerart": "HRB",
      "company_name": "Airbus Defence and Space GmbH",
      "company_seat": "Ottobrunn",
      "details": "12.12.2025 (Bekanntmachungsdatum)\n\nBayern Amtsgericht München HRB 107648\nEinreichung neuer Dokumente 11.12.2025 (Eintragungsdatum)\n\nAirbus Defence and Space GmbH\nGesellschaft mit beschränkter Haftung\nOttobrunn\n\nDem Amtsgericht München -Registergericht- ist eine Liste der Mitglieder des Aufsichtsrats eingereicht worden, § 52 Abs. 3 S. 2 GmbHG."
    },
    {
      "date": "2025-12-12",
      "id": "139847",
      "original_text": "Registerbekanntmachung nach dem Umwandlungsgesetz\nBayern Amtsgericht München HRB 305939\nWendelstein Steuerberatungsgesellschaft mbH – München",
      "type": "Registerbekanntmachung nach dem Umwandlungsgesetz",
      "state": "Bayern",
      "amtsgericht": "Amtsgericht München",
      "registernummer": "HRB 305939",
      "registerart": "HRB",
      "company_name": "Wendelstein Steuerberatungsgesellschaft mbH",
      "company_seat": "München",
      "details": "12.12.2025 (Bekanntmachungsdatum)\n\nBayern Amtsgericht München HRB 305939\nRegisterbekanntmachung nach dem Umwandlungsgesetz 11.12.2025 (Eintragungsdatum)\n\nWendelstein Steuerberatungsgesellschaft mbH\nGesellschaft mit beschränkter Haftung\nMünchen\n\nDen Gläubigern der an der Ausgliederung beteiligten Rechtsträger ist, wenn sie binnen sechs Monaten nach dem Tag, an dem die Eintragung der Ausgliederung in das Register des Sitzes desjenigen Rechtsträgers, dessen Gläubiger sie sind, nach §§ 125, 19 Abs. 3 UmwG als bekannt gemacht gilt, ihren Anspruch nach Grund und Höhe in Textform anmelden, Sicherheit zu leisten, soweit sie nicht Befriedigung verlangen können. Dieses Recht steht den Gläubigern jedoch nur zu, wenn sie glaubhaft machen, dass durch die Ausgliederung die Erfüllung ihrer Forderung gefährdet wird.Den Gläubigern der an der Ausgliederung beteiligten Rechtsträger ist, wenn sie binnen sechs Monaten nach dem Tag, an dem die Eintragung der Ausgliederung in das Register des Sitzes desjenigen Rechtsträgers, dessen Gläubiger sie sind, nach §§ 125, 19 Abs. 3 UmwG als bekannt gemacht gilt, ihren Anspruch nach Grund und Höhe in Textform anmelden, Sicherheit zu leisten, soweit sie nicht Befriedigung verlangen können. Dieses Recht steht den Gläubigern jedoch nur zu, wenn sie glaubhaft machen, dass durch die Ausgliederung die Erfüllung ihrer Forderung gefährdet wird."
    },
    {
      "date": "2025-12-12",
      "id": "139848",
      "original_text": "Einreichung neuer Dokumente\nBayern Amtsgericht München HRB 4921\nBayWa Aktiengesellschaft – München",
      "type": "Einreichung neuer Dokumente",
      "state": "Bayern",
      "amtsgericht": "Amtsgericht München",
      "registernummer": "HRB 4921",
      "registerart": "HRB",
      "company_name": "BayWa Aktiengesellschaft",
      "company_seat": "München",
      "details": "12.12.2025 (Bekanntmachungsdatum)\n\nBayern Amtsgericht München HRB 4921\nEinreichung neuer Dokumente\n\nBayWa Aktiengesellschaft\nAktiengesellschaft\nMünchen\n\nDem Amtsgericht München -Registergericht- ist eine Liste der Mitglieder des Aufsichtsrats eingereicht worden, § 106 AktG."
    },
    {
      "date": "2025-12-12",
      "id": "139849",
      "original_text": "Löschungsankündigung\nBayern Amtsgericht Nürnberg HRB 31643\nD + H Projektbau GmbH – Nürnberg",
      "type": "Löschungsankündigung",
      "state": "Bayern",
      "amtsgericht": "Amtsgericht Nürnberg",
      "registernummer": "HRB 31643",
      "registerart": "HRB",
      "company_name": "D + H Projektbau GmbH",
      "company_seat": "Nürnberg",
      "details": "12.12.2025 (Bekanntmachungsdatum)\n\nBayern Amtsgericht Nürnberg HRB 31643\nLöschungsankündigung\n\nD + H Projektbau GmbH\nGesellschaft mit beschränkter Haftung\nNürnberg\n\nDas Registergericht beabsichtigt, die im Handelsregister eingetragene Gesellschaft wegen Vermögenslosigkeit von Amts wegen nach § 394 FamFG zu löschen. Die Frist zur Erhebung eines Widerspruchs ist auf einen Monat festgesetzt."
    },
    {
      "date": "2025-12-12",
      "id": "139850",
      "original_text": "Registerbekanntmachung nach dem Umwandlungsgesetz\nBayern Amtsgericht München HRB 166330\nH.C. Management Beteiligungs GmbH – München",
      "type": "Registerbekanntmachung nach dem Umwandlungsgesetz",
      "state": "Bayern",
      "amtsgericht": "Amtsgericht München",
      "registernummer": "HRB 166330",
      "registerart": "HRB",
      "company_name": "H.C. Management Beteiligungs GmbH",
      "company_seat": "München",
      "details": "12.12.2025 (Bekanntmachungsdatum)\n\nBayern Amtsgericht München HRB 166330\nRegisterbekanntmachung nach dem Umwandlungsgesetz 11.12.2025 (Eintragungsdatum)\n\nH.C. Management Beteiligungs GmbH\nGesellschaft mit beschränkter Haftung\nMünchen\n\nDen Gläubigern der an der Verschmelzung beteiligten Rechtsträger ist, wenn sie binnen sechs Monaten nach dem Tag, an dem die Eintragung der Verschmelzung in das Register des Sitzes desjenigen Rechtsträgers, dessen Gläubiger sie sind, nach § 19 Abs. 3 UmwG als bekannt gemacht gilt, ihren Anspruch nach Grund und Höhe in Textform anmelden, Sicherheit zu leisten, soweit sie nicht Befriedigung verlangen können. Dieses Recht steht den Gläubigern jedoch nur zu, wenn sie glaubhaft machen, dass durch die Verschmelzung die Erfüllung ihrer Forderung gefährdet wird."
    },
    {
      "date": "2025-12-12",
      "id": "139851",
      "original_text": "Registerbekanntmachung nach dem Umwandlungsgesetz\nBayern Amtsgericht München HRB 166329\nH.C. Management Verwaltungs GmbH – München",
      "type": "Registerbekanntmachung nach dem Umwandlungsgesetz",
      "state": "Bayern",
      "amtsgericht": "Amtsgericht München",
      "registernummer": "HRB 166329",
      "registerart": "HRB",
      "company_name": "H.C. Management Verwaltungs GmbH",
      "company_seat": "München",
      "details": "12.12.2025 (Bekanntmachungsdatum)\n\nBayern Amtsgericht München HRB 166329\nRegisterbekanntmachung nach dem Umwandlungsgesetz 11.12.2025 (Eintragungsdatum)\n\nH.C. Management Verwaltungs GmbH\nGesellschaft mit beschränkter Haftung\nMünchen\n\nDen Gläubigern der an der Verschmelzung beteiligten Rechtsträger ist, wenn sie binnen sechs Monaten nach dem Tag, an dem die Eintragung der Verschmelzung in das Register des Sitzes desjenigen Rechtsträgers, dessen Gläubiger sie sind, nach § 19 Abs. 3 UmwG als bekannt gemacht gilt, ihren Anspruch nach Grund und Höhe in Textform anmelden, Sicherheit zu leisten, soweit sie nicht Befriedigung verlangen können. Dieses Recht steht den Gläubigern jedoch nur zu, wenn sie glaubhaft machen, dass durch die Verschmelzung die Erfüllung ihrer Forderung gefährdet wird."
    },
    {
      "date": "2025-12-12",
      "id": "139852",
      "original_text": "Registerbekanntmachung nach dem Umwandlungsgesetz\nBayern Amtsgericht München HRB 296156\nATHAGORAS AquiCo-03 GmbH – München",
      "type": "Registerbekanntmachung nach dem Umwandlungsgesetz",
      "state": "Bayern",
      "amtsgericht": "Amtsgericht München",
      "registernummer": "HRB 296156",
      "registerart": "HRB",
      "company_name": "ATHAGORAS AquiCo-03 GmbH",
      "company_seat": "München",
      "details": "12.12.2025 (Bekanntmachungsdatum)\n\nBayern Amtsgericht München HRB 296156\nRegisterbekanntmachung nach dem Umwandlungsgesetz 11.12.2025 (Eintragungsdatum)\n\nATHAGORAS AquiCo-03 GmbH\nGesellschaft mit beschränkter Haftung\nMünchen\n\nDen Gläubigern der an der Ausgliederung beteiligten Rechtsträger ist, wenn sie binnen sechs Monaten nach dem Tag, an dem die Eintragung der Ausgliederung in das Register des Sitzes desjenigen Rechtsträgers, dessen Gläubiger sie sind, nach §§ 125, 19 Abs. 3 UmwG als bekannt gemacht gilt, ihren Anspruch nach Grund und Höhe in Textform anmelden, Sicherheit zu leisten, soweit sie nicht Befriedigung verlangen können. Dieses Recht steht den Gläubigern jedoch nur zu, wenn sie glaubhaft machen, dass durch die Ausgliederung die Erfüllung ihrer Forderung gefährdet wird."
    },
    {
      "date": "2025-12-12",
      "id": "139853",
      "original_text": "Registerbekanntmachung nach dem Umwandlungsgesetz\nBayern Amtsgericht München HRB 256295\nPROCON IT GmbH – Garching b.München",
      "type": "Registerbekanntmachung nach dem Umwandlungsgesetz",
      "state": "Bayern",
      "amtsgericht": "Amtsgericht München",
      "registernummer": "HRB 256295",
      "registerart": "HRB",
      "company_name": "PROCON IT GmbH",
      "company_seat": "Garching b.München",
      "details": "12.12.2025 (Bekanntmachungsdatum)\n\nBayern Amtsgericht München HRB 256295\nRegisterbekanntmachung nach dem Umwandlungsgesetz 11.12.2025 (Eintragungsdatum)\n\nPROCON IT GmbH\nGesellschaft mit beschränkter Haftung\nGarching b.München\n\nDen Gläubigern der an der Verschmelzung beteiligten Rechtsträger ist, wenn sie binnen sechs Monaten nach dem Tag, an dem die Eintragung der Verschmelzung in das Register des Sitzes desjenigen Rechtsträgers, dessen Gläubiger sie sind, nach § 19 Abs. 3 UmwG als bekannt gemacht gilt, ihren Anspruch nach Grund und Höhe in Textform anmelden, Sicherheit zu leisten, soweit sie nicht Befriedigung verlangen können. Dieses Recht steht den Gläubigern jedoch nur zu, wenn sie glaubhaft machen, dass durch die Verschmelzung die Erfüllung ihrer Forderung gefährdet wird."
    },
    {
      "date": "2025-12-12",
      "id": "139854",
      "original_text": "Löschungsankündigung\nBayern Amtsgericht Nürnberg HRB 39449\nDAI Schwabach GmbH – Roth",
      "type": "Löschungsankündigung",
      "state": "Bayern",
      "amtsgericht": "Amtsgericht Nürnberg",
      "registernummer": "HRB 39449",
      "registerart": "HRB",
      "company_name": "DAI Schwabach GmbH",
      "company_seat": "Roth",
      "details": "12.12.2025 (Bekanntmachungsdatum)\n\nBayern Amtsgericht Nürnberg HRB 39449\nLöschungsankündigung\n\nDAI Schwabach GmbH\nGesellschaft mit beschränkter Haftung\nRoth\n\nDas Registergericht beabsichtigt, die im Handelsregister eingetragene Gesellschaft wegen Vermögenslosigkeit von Amts wegen nach § 394 FamFG zu löschen. Die Frist zur Erhebung eines Widerspruchs ist auf einen Monat festgesetzt."
    },
    {
      "date": "2025-12-12",
      "id": "139855",
      "original_text": "Löschungsankündigung\nBerlin Amtsgericht Berlin (Charlottenburg) HRB 250361\nTokis Service GmbH – Berlin",
      "type": "Löschungsankündigung",
      "state": "Berlin",
      "amtsgericht": "Amtsgericht Berlin (Charlottenburg)",
      "registernummer": "HRB 250361",
      "registerart": "HRB",
      "company_name": "Tokis Service GmbH",
      "company_seat": "Berlin",
      "details": "12.12.2025 (Bekanntmachungsdatum)\n\nBerlin Amtsgericht Berlin (Charlottenburg) HRB 250361\nLöschungsankündigung\n\nTokis Service GmbH\nGesellschaft mit beschränkter Haftung\nBerlin\n\nBei der nachstehenden Gesellschaft wird das Amtslöschungsverfahren gemäß § 394 FamFG eingeleitet. Widerspruchsfrist 6 Wochen"
    },
    {
      "date": "2025-12-12",
      "id": "139856",
      "original_text": "Löschungsankündigung\nSchleswig-Holstein Amtsgericht Flensburg HRB 12954\nMHFL GmbH – Flensburg",
      "type": "Löschungsankündigung",
      "state": "Schleswig-Holstein",
      "amtsgericht": "Amtsgericht Flensburg",
      "registernummer": "HRB 12954",
      "registerart": "HRB",
      "company_name": "MHFL GmbH",
      "company_seat": "Flensburg",
      "details": "12.12.2025 (Bekanntmachungsdatum)\n\nSchleswig-Holstein Amtsgericht Flensburg HRB 12954\nLöschungsankündigung\n\nMHFL GmbH\nGesellschaft mit beschränkter Haftung\nFlensburg\n\nEs ist die Löschung der nachstehenden Gesellschaft wegen Vermögenslosigkeit gemäß § 394 FamFG von Amts wegen beabsichtigt.\nWiderspruchsfrist: 2 Monate"
    },
    {
      "date": "2025-12-12",
      "id": "139857",
      "original_text": "Löschungsankündigung\nBerlin Amtsgericht Berlin (Charlottenburg) HRB 259804\nBMA Security Service UG (haftungsbeschränkt) – Berlin",
      "type": "Löschungsankündigung",
      "state": "Berlin",
      "amtsgericht": "Amtsgericht Berlin (Charlottenburg)",
      "registernummer": "HRB 259804",
      "registerart": "HRB",
      "company_name": "BMA Security Service UG (haftungsbeschränkt)",
      "company_seat": "Berlin",
      "details": "12.12.2025 (Bekanntmachungsdatum)\n\nBerlin Amtsgericht Berlin (Charlottenburg) HRB 259804\nLöschungsankündigung\n\nBMA Security Service UG (haftungsbeschränkt)\nGesellschaft mit beschränkter Haftung\nBerlin\n\nBei der nachstehenden Gesellschaft wird das Amtslöschungsverfahren gemäß § 394 FamFG eingeleitet. Widerspruchsfrist 6 Wochen"
    },
    {
      "date": "2025-12-12",
      "id": "139858",
      "original_text": "Registerbekanntmachung nach dem Umwandlungsgesetz\nBerlin Amtsgericht Berlin (Charlottenburg) HRB 232451\nHospitality Software Solutions Beteiligungsgesellschaft mbH – Berlin",
      "type": "Registerbekanntmachung nach dem Umwandlungsgesetz",
      "state": "Berlin",
      "amtsgericht": "Amtsgericht Berlin (Charlottenburg)",
      "registernummer": "HRB 232451",
      "registerart": "HRB",
      "company_name": "Hospitality Software Solutions Beteiligungsgesellschaft mbH",
      "company_seat": "Berlin",
      "details": "12.12.2025 (Bekanntmachungsdatum)\n\nBerlin Amtsgericht Berlin (Charlottenburg) HRB 232451\nRegisterbekanntmachung nach dem Umwandlungsgesetz 10.12.2025 (Eintragungsdatum)\n\nHospitality Software Solutions Beteiligungsgesellschaft mbH\nGesellschaft mit beschränkter Haftung\nBerlin\n\nZu Eintragungsnummer 7 vom 10.12.2025 wird als nicht eingetragen veröffentlicht:Den Gläubigern der an der Verschmelzung beteiligten Rechtsträger ist, wenn sie binnen sechs Monaten nach dem Tag, an dem die Eintragung der Verschmelzung in das Register des Sitzes desjenigen Rechtsträgers, dessen Gläubiger sie sind, als bekannt gemacht gilt, ihren Anspruch nach Grund und Höhe schriftlich anmelden, Sicherheit zu leisten, soweit sie nicht Befriedigung verlangen können. Dieses Recht steht den Gläubigern jedoch nur zu, wenn sie glaubhaft machen, dass durch die Verschmelzung die Erfüllung ihrer Forderung gefährdet wird. Das Recht, Sicherheitsleistung zu verlangen, steht Gläubigern nicht zu, die im Falle der Insolvenz ein Recht auf vorzugsweise Befriedigung aus einer Deckungsmasse haben, die nach gesetzlicher Vorschrift zu ihrem Schutz errichtet und staatlich überwacht ist."
    },
    {
      "date": "2025-12-12",
      "id": "139859",
      "original_text": "Registerbekanntmachung nach dem Umwandlungsgesetz\nBerlin Amtsgericht Berlin (Charlottenburg) HRB 232429\nHospitality Software Solutions Holding GmbH – Berlin",
      "type": "Registerbekanntmachung nach dem Umwandlungsgesetz",
      "state": "Berlin",
      "amtsgericht": "Amtsgericht Berlin (Charlottenburg)",
      "registernummer": "HRB 232429",
      "registerart": "HRB",
      "company_name": "Hospitality Software Solutions Holding GmbH",
      "company_seat": "Berlin",
      "details": "12.12.2025 (Bekanntmachungsdatum)\n\nBerlin Amtsgericht Berlin (Charlottenburg) HRB 232429\nRegisterbekanntmachung nach dem Umwandlungsgesetz 10.12.2025 (Eintragungsdatum)\n\nHospitality Software Solutions Holding GmbH\nGesellschaft mit beschränkter Haftung\nBerlin\n\nDen Gläubigern der an der Verschmelzung beteiligten Rechtsträger ist, wenn sie binnen sechs Monaten nach dem Tag, an dem die Eintragung der Verschmelzung in das Register des Sitzes desjenigen Rechtsträgers, dessen Gläubiger sie sind, als bekannt gemacht gilt, ihren Anspruch nach Grund und Höhe schriftlich anmelden, Sicherheit zu leisten, soweit sie nicht Befriedigung verlangen können. Dieses Recht steht den Gläubigern jedoch nur zu, wenn sie glaubhaft machen, dass durch die Verschmelzung die Erfüllung ihrer Forderung gefährdet wird. Das Recht, Sicherheitsleistung zu verlangen, steht Gläubigern nicht zu, die im Falle der Insolvenz ein Recht auf vorzugsweise Befriedigung aus einer Deckungsmasse haben, die nach gesetzlicher Vorschrift zu ihrem Schutz errichtet und staatlich überwacht ist.Zu Eintragungsnummer 5 vom 10.12.2025 wird als nicht eingetragen veröffentlicht:"
    },
    {
      "date": "2025-12-12",
      "id": "139860",
      "original_text": "Registerbekanntmachung nach dem Umwandlungsgesetz\nHamburg Amtsgericht Hamburg HRB 158657\nAchtzigste LOGIMAC Logistic Grundbesitz GmbH – Hamburg",
      "type": "Registerbekanntmachung nach dem Umwandlungsgesetz",
      "state": "Hamburg",
      "amtsgericht": "Amtsgericht Hamburg",
      "registernummer": "HRB 158657",
      "registerart": "HRB",
      "company_name": "Achtzigste LOGIMAC Logistic Grundbesitz GmbH",
      "company_seat": "Hamburg",
      "details": "12.12.2025 (Bekanntmachungsdatum)\n\nHamburg Amtsgericht Hamburg HRB 158657\nRegisterbekanntmachung nach dem Umwandlungsgesetz 09.12.2025 (Eintragungsdatum)\n\nAchtzigste LOGIMAC Logistic Grundbesitz GmbH\nGesellschaft mit beschränkter Haftung\nHamburg\n\nAls nicht eingetragen wird bekannt gemacht:\nDen Gläubigern der an der grenzüberschreitenden Sitzverlegung und Formwechsel beteiligten Rechtsträger ist, wenn sie binnen sechs Monaten nach dem Tag, an dem die Eintragung der Verschmelzung in das Register des Sitzes desjenigen Rechtsträgers, dessen Gläubiger sie sind, nach § 19 Abs. 3 bekannt gemacht worden ist, ihren Anspruch nach Grund und Höhe schriftlich anmelden, Sicherheit zu leisten, soweit sie nicht Befriedigung verlangen können. Dieses Recht steht den Gläubigern jedoch nur zu, wenn sie glaubhaft machen, dass durch grenzüberschreitenden Formwechsel die Erfüllung ihrer Forderung gefährdet wird."
    },
    {
      "date": "2025-12-12",
      "id": "139861",
      "original_text": "Registerbekanntmachung nach dem Umwandlungsgesetz\nBerlin Amtsgericht Berlin (Charlottenburg) HRB 159106\nGESO Consult GmbH – Berlin",
      "type": "Registerbekanntmachung nach dem Umwandlungsgesetz",
      "state": "Berlin",
      "amtsgericht": "Amtsgericht Berlin (Charlottenburg)",
      "registernummer": "HRB 159106",
      "registerart": "HRB",
      "company_name": "GESO Consult GmbH",
      "company_seat": "Berlin",
      "details": "12.12.2025 (Bekanntmachungsdatum)\n\nBerlin Amtsgericht Berlin (Charlottenburg) HRB 159106\nRegisterbekanntmachung nach dem Umwandlungsgesetz 10.12.2025 (Eintragungsdatum)\n\nGESO Consult GmbH\nGesellschaft mit beschränkter Haftung\nBerlin\n\nZu Eintragungsnummer 4 vom 10.12.2025 wird als nicht eingetragen veröffentlicht: Den Gläubigern der an der Verschmelzung beteiligten Rechtsträger ist, wenn sie binnen sechs Monaten nach dem Tag, an dem die Eintragung der Verschmelzung in das Register des Sitzes desjenigen Rechtsträgers, dessen Gläubiger sie sind, als bekannt gemacht gilt, ihren Anspruch nach Grund und Höhe schriftlich anmelden, Sicherheit zu leisten, soweit sie nicht Befriedigung verlangen können. Dieses Recht steht den Gläubigern jedoch nur zu, wenn sie glaubhaft machen, dass durch die Verschmelzung die Erfüllung ihrer Forderung gefährdet wird. Das Recht, Sicherheitsleistung zu verlangen, steht Gläubigern nicht zu, die im Falle der Insolvenz ein Recht auf vorzugsweise Befriedigung aus einer Deckungsmasse haben, die nach gesetzlicher Vorschrift zu ihrem Schutz errichtet und staatlich überwacht ist."
    },
    {
      "date": "2025-12-12",
      "id": "139862",
      "original_text": "Einreichung neuer Dokumente\nBerlin Amtsgericht Berlin (Charlottenburg) HRB 140238\nZertifizierung Bau GmbH – Berlin",
      "type": "Einreichung neuer Dokumente",
      "state": "Berlin",
      "amtsgericht": "Amtsgericht Berlin (Charlottenburg)",
      "registernummer": "HRB 140238",
      "registerart": "HRB",
      "company_name": "Zertifizierung Bau GmbH",
      "company_seat": "Berlin",
      "details": "12.12.2025 (Bekanntmachungsdatum)\n\nBerlin Amtsgericht Berlin (Charlottenburg) HRB 140238\nEinreichung neuer Dokumente\n\nZertifizierung Bau GmbH\nGesellschaft mit beschränkter Haftung\nBerlin\n\nAls nicht eingetragen wird veröffentlicht:Es wurde eine neue Liste der Beiratsratsmitglieder eingereicht (§52 GmbHG)."
    },
    {
      "date": "2025-12-12",
      "id": "139863",
      "original_text": "Sonstige Registerbekanntmachung\nBrandenburg Amtsgericht Neuruppin HRB 2512\n\"Kommunales Wohnungsunternehmen Prenzlau-Land\" Gesellschaft mit beschränkter Haftung – Prenzlau",
      "type": "Sonstige Registerbekanntmachung",
      "state": "Brandenburg",
      "amtsgericht": "Amtsgericht Neuruppin",
      "registernummer": "HRB 2512",
      "registerart": "HRB",
      "company_name": "\"Kommunales Wohnungsunternehmen Prenzlau-Land\" Gesellschaft mit beschränkter Haftung",
      "company_seat": "Prenzlau",
      "details": "12.12.2025 (Bekanntmachungsdatum)\n\nBrandenburg Amtsgericht Neuruppin HRB 2512\nSonstige Registerbekanntmachung\n\n\"Kommunales Wohnungsunternehmen Prenzlau-Land\" Gesellschaft mit beschränkter Haftung\nGesellschaft mit beschränkter Haftung\nPrenzlau\n\nAls nicht eingetragen wird bekannt gemacht:\nEine Liste der Mitglieder des Aufsichtsrates wurde zum Handelsregister eingereicht."
    },
    {
      "date": "2025-12-12",
      "id": "139864",
      "original_text": "Löschungsankündigung\nBerlin Amtsgericht Berlin (Charlottenburg) HRB 177864\nCAPCY Europe GmbH – Berlin",
      "type": "Löschungsankündigung",
      "state": "Berlin",
      "amtsgericht": "Amtsgericht Berlin (Charlottenburg)",
      "registernummer": "HRB 177864",
      "registerart": "HRB",
      "company_name": "CAPCY Europe GmbH",
      "company_seat": "Berlin",
      "details": "12.12.2025 (Bekanntmachungsdatum)\n\nBerlin Amtsgericht Berlin (Charlottenburg) HRB 177864\nLöschungsankündigung\n\nCAPCY Europe GmbH\nGesellschaft mit beschränkter Haftung\nBerlin\n\nBei der nachstehenden Gesellschaft wird das Amtslöschungsverfahren gemäß § 394 FamFG eingeleitet. Widerspruchsfrist 6 Wochen"
    },
    {
      "date": "2025-12-12",
      "id": "139865",
      "original_text": "Löschungsankündigung\nBrandenburg Amtsgericht Frankfurt/Oder HRB 14460\nSuP Service & Planungs UG (haftungsbeschränkt) – Schorfheide",
      "type": "Löschungsankündigung",
      "state": "Brandenburg",
      "amtsgericht": "Amtsgericht Frankfurt/Oder",
      "registernummer": "HRB 14460",
      "registerart": "HRB",
      "company_name": "SuP Service & Planungs UG (haftungsbeschränkt)",
      "company_seat": "Schorfheide",
      "details": "12.12.2025 (Bekanntmachungsdatum)\n\nBrandenburg Amtsgericht Frankfurt/Oder HRB 14460\nLöschungsankündigung\n\nSuP Service & Planungs UG (haftungsbeschränkt)\nGesellschaft mit beschränkter Haftung\nSchorfheide\n\nBei der nachstehenden Gesellschaft wird das Amtslöschungsverfahren gemäß § 394 FamFG eingeleitet."
    },
    {
      "date": "2025-12-12",
      "id": "139866",
      "original_text": "Sonstige Registerbekanntmachung\nThüringen Amtsgericht Jena HRB 203261\nStädtische Wohnungsgesellschaft Altenburg mbH – Altenburg",
      "type": "Sonstige Registerbekanntmachung",
      "state": "Thüringen",
      "amtsgericht": "Amtsgericht Jena",
      "registernummer": "HRB 203261",
      "registerart": "HRB",
      "company_name": "Städtische Wohnungsgesellschaft Altenburg mbH",
      "company_seat": "Altenburg",
      "details": "12.12.2025 (Bekanntmachungsdatum)\n\nThüringen Amtsgericht Jena HRB 203261\nSonstige Registerbekanntmachung\n\nStädtische Wohnungsgesellschaft Altenburg mbH\nGesellschaft mit beschränkter Haftung\nAltenburg\n\nBekanntmachung gem. § 52 Abs. 3 Satz 2 GmbHG: Aufgrund einer Veränderung in den Personen der Aufsichtsratsmitglieder ist durch die Geschäftsführer eine neue Liste zum Handelsregister eingereicht worden."
    },
    {
      "date": "2025-12-12",
      "id": "139867",
      "original_text": "Registerbekanntmachung nach dem Umwandlungsgesetz\nNiedersachsen Amtsgericht Hannover HRB 59870\nBirla Carbon Europe GmbH – Hannover",
      "type": "Registerbekanntmachung nach dem Umwandlungsgesetz",
      "state": "Niedersachsen",
      "amtsgericht": "Amtsgericht Hannover",
      "registernummer": "HRB 59870",
      "registerart": "HRB",
      "company_name": "Birla Carbon Europe GmbH",
      "company_seat": "Hannover",
      "details": "12.12.2025 (Bekanntmachungsdatum)\n\nNiedersachsen Amtsgericht Hannover HRB 59870\nRegisterbekanntmachung nach dem Umwandlungsgesetz 12.12.2025 (Eintragungsdatum)\n\nBirla Carbon Europe GmbH\nGesellschaft mit beschränkter Haftung\nHannover\n\nDen Gläubigern der an der Verschmelzung beteiligten Rechtsträger ist, wenn sie binnen sechs Monaten nach dem Tag, an dem die Eintragung der Verschmelzung in das Register des Sitzes desjenigen Rechtsträgers, dessen Gläubiger sie sind, nach § 19  Abs.  3 UmwG als bekannt gemacht gilt, ihren Anspruch nach Grund und Höhe schriftlich anmelden, Sicherheit zu leisten, soweit sie nicht Befriedigung verlangen können. Dieses Recht steht den Gläubigern jedoch nur zu, wenn sie glaubhaft machen, dass durch die Verschmelzung die Erfüllung der Forderung gefährdet wird."
    },
    {
      "date": "2025-12-12",
      "id": "139868",
      "original_text": "Löschungsankündigung\nNiedersachsen Amtsgericht Aurich HRB 204737\nJenature UG (haftungsbeschränkt) – Leer",
      "type": "Löschungsankündigung",
      "state": "Niedersachsen",
      "amtsgericht": "Amtsgericht Aurich",
      "registernummer": "HRB 204737",
      "registerart": "HRB",
      "company_name": "Jenature UG (haftungsbeschränkt)",
      "company_seat": "Leer",
      "details": "12.12.2025 (Bekanntmachungsdatum)\n\nNiedersachsen Amtsgericht Aurich HRB 204737\nLöschungsankündigung\n\nJenature UG (haftungsbeschränkt)\nGesellschaft mit beschränkter Haftung\nLeer\n\nDas Registergericht beabsichtigt, die Gesellschaft von Amts wegen nach § 394 FamFG zu löschen. Die Frist zur Erhebung eines Widerspruchs ist auf 1 Monat ab dieser Registerbekanntmachung festgesetzt."
    },
    {
      "date": "2025-12-12",
      "id": "139869",
      "original_text": "Registerbekanntmachung nach dem Umwandlungsgesetz\nNiedersachsen Amtsgericht Hannover HRB 202757\nBirla Carbon Europe GmbH – Hannover",
      "type": "Registerbekanntmachung nach dem Umwandlungsgesetz",
      "state": "Niedersachsen",
      "amtsgericht": "Amtsgericht Hannover",
      "registernummer": "HRB 202757",
      "registerart": "HRB",
      "company_name": "Birla Carbon Europe GmbH",
      "company_seat": "Hannover",
      "details": "12.12.2025 (Bekanntmachungsdatum)\n\nNiedersachsen Amtsgericht Hannover HRB 202757\nRegisterbekanntmachung nach dem Umwandlungsgesetz 12.12.2025 (Eintragungsdatum)\n\nBirla Carbon Europe GmbH\nGesellschaft mit beschränkter Haftung\nHannover\n\nDen Gläubigern der an der Verschmelzung beteiligten Rechtsträger ist, wenn sie binnen sechs Monaten nach dem Tag, an dem die Eintragung der Verschmelzung in das Register des Sitzes desjenigen Rechtsträgers, dessen Gläubiger sie sind, nach § 19  Abs.  3 UmwG als bekannt gemacht gilt, ihren Anspruch nach Grund und Höhe schriftlich anmelden, Sicherheit zu leisten, soweit sie nicht Befriedigung verlangen können. Dieses Recht steht den Gläubigern jedoch nur zu, wenn sie glaubhaft machen, dass durch die Verschmelzung die Erfüllung der Forderung gefährdet wird."
    },
    {
      "date": "2025-12-12",
      "id": "139870",
      "original_text": "Löschungsankündigung\nNiedersachsen Amtsgericht Aurich HRB 203091\nNordseemalerei GmbH – Langeoog",
      "type": "Löschungsankündigung",
      "state": "Niedersachsen",
      "amtsgericht": "Amtsgericht Aurich",
      "registernummer": "HRB 203091",
      "registerart": "HRB",
      "company_name": "Nordseemalerei GmbH",
      "company_seat": "Langeoog",
      "details": "12.12.2025 (Bekanntmachungsdatum)\n\nNiedersachsen Amtsgericht Aurich HRB 203091\nLöschungsankündigung 12.12.2025 (Eintragungsdatum)\n\nNordseemalerei GmbH\nGesellschaft mit beschränkter Haftung\nLangeoog\n\nDas Registergericht beabsichtigt, die Gesellschaft von Amts wegen nach § 394 FamFG zu löschen. Die Frist zur Erhebung eines Widerspruchs ist auf 3 Monate ab dieser Registerbekanntmachung festgesetzt."
    },
    {
      "date": "2025-12-12",
      "id": "139871",
      "original_text": "Löschungsankündigung\nNiedersachsen Amtsgericht Aurich HRB 201226\nPoseidon GmbH – Norden",
      "type": "Löschungsankündigung",
      "state": "Niedersachsen",
      "amtsgericht": "Amtsgericht Aurich",
      "registernummer": "HRB 201226",
      "registerart": "HRB",
      "company_name": "Poseidon GmbH",
      "company_seat": "Norden",
      "details": "12.12.2025 (Bekanntmachungsdatum)\n\nNiedersachsen Amtsgericht Aurich HRB 201226\nLöschungsankündigung 12.12.2025 (Eintragungsdatum)\n\nPoseidon GmbH\nGesellschaft mit beschränkter Haftung\nNorden\n\nDas Registergericht beabsichtigt, die Gesellschaft von Amts wegen nach § 394 FamFG zu löschen. Die Frist zur Erhebung eines Widerspruchs ist auf 1 Monat ab dieser Registerbekanntmachung festgesetzt."
    },
    {
      "date": "2025-12-12",
      "id": "139872",
      "original_text": "Registerbekanntmachung nach dem Umwandlungsgesetz\nNiedersachsen Amtsgericht Tostedt GnR 200043\nSander Charisma Akademie eG – Cuxhaven",
      "type": "Registerbekanntmachung nach dem Umwandlungsgesetz",
      "state": "Niedersachsen",
      "amtsgericht": "Amtsgericht Tostedt",
      "registernummer": "GnR 200043",
      "registerart": "GnR",
      "company_name": "Sander Charisma Akademie eG",
      "company_seat": "Cuxhaven",
      "details": "12.12.2025 (Bekanntmachungsdatum)\n\nNiedersachsen Amtsgericht Tostedt GnR 200043\nRegisterbekanntmachung nach dem Umwandlungsgesetz 12.12.2025 (Eintragungsdatum)\n\nSander Charisma Akademie eG\neingetragene Genossenschaft\nCuxhaven\n\nDen Gläubigern der an der Ausgliederung beteiligten Rechtsträger ist, wenn sie binnen sechs Monaten nach dem Tag, an dem die Eintragung der Ausgliederung in das Register des Sitzes desjenigen Rechtsträgers, dessen Gläubiger sie sind, nach § 19 Abs. 3 UmwG als bekannt gemacht gilt, ihren Anspruch nach Grund und Höhe schriftlich anmelden, Sicherheit zu leisten, soweit sie nicht Befriedigung verlangen können. Dieses Recht steht den Gläubigern jedoch nur zu, wenn sie glaubhaft machen, dass durch die Ausgliederung die Erfüllung der Forderung gefährdet wird."
    },
    {
      "date": "2025-12-12",
      "id": "139873",
      "original_text": "Registerbekanntmachung nach dem Umwandlungsgesetz\nNiedersachsen Amtsgericht Tostedt HRA 205410\nSven Sander Charisma-Akademie e. K. – Cuxhaven",
      "type": "Registerbekanntmachung nach dem Umwandlungsgesetz",
      "state": "Niedersachsen",
      "amtsgericht": "Amtsgericht Tostedt",
      "registernummer": "HRA 205410",
      "registerart": "HRA",
      "company_name": "Sven Sander Charisma-Akademie e. K.",
      "company_seat": "Cuxhaven",
      "details": "12.12.2025 (Bekanntmachungsdatum)\n\nNiedersachsen Amtsgericht Tostedt HRA 205410\nRegisterbekanntmachung nach dem Umwandlungsgesetz 12.12.2025 (Eintragungsdatum)\n\nSven Sander Charisma-Akademie e. K.\nEinzelkaufmann / Einzelkauffrau\nCuxhaven\n\nDen Gläubigern der an der Ausgliederung beteiligten Rechtsträger ist, wenn sie binnen sechs Monaten nach dem Tag, an dem die Eintragung der Ausgliederung in das Register des Sitzes desjenigen Rechtsträgers, dessen Gläubiger sie sind, nach § 19 Abs. 3 UmwG als bekannt gemacht gilt, ihren Anspruch nach Grund und Höhe schriftlich anmelden, Sicherheit zu leisten, soweit sie nicht Befriedigung verlangen können. Dieses Recht steht den Gläubigern jedoch nur zu, wenn sie glaubhaft machen, dass durch die Ausgliederung die Erfüllung der Forderung gefährdet wird."
    },
    {
      "date": "2025-12-12",
      "id": "139874",
      "original_text": "Registerbekanntmachung nach dem Umwandlungsgesetz\nBerlin Amtsgericht Berlin (Charlottenburg) HRB 271986\nkomoot GmbH – Berlin",
      "type": "Registerbekanntmachung nach dem Umwandlungsgesetz",
      "state": "Berlin",
      "amtsgericht": "Amtsgericht Berlin (Charlottenburg)",
      "registernummer": "HRB 271986",
      "registerart": "HRB",
      "company_name": "komoot GmbH",
      "company_seat": "Berlin",
      "details": "12.12.2025 (Bekanntmachungsdatum)\n\nBerlin Amtsgericht Berlin (Charlottenburg) HRB 271986\nRegisterbekanntmachung nach dem Umwandlungsgesetz 11.12.2025 (Eintragungsdatum)\n\nkomoot GmbH\nGesellschaft mit beschränkter Haftung\nBerlin\n\nZu Eintragungsnummer 6 vom 11.12.2025 wird als nicht eingetragen veröffentlicht: Den Gläubigern der an der Verschmelzung beteiligten Rechtsträger ist, wenn sie binnen sechs Monaten nach dem Tag, an dem die Eintragung der Verschmelzung in das Register des Sitzes desjenigen Rechtsträgers, dessen Gläubiger sie sind, als bekannt gemacht gilt, ihren Anspruch nach Grund und Höhe schriftlich anmelden, Sicherheit zu leisten, soweit sie nicht Befriedigung verlangen können. Dieses Recht steht den Gläubigern jedoch nur zu, wenn sie glaubhaft machen, dass durch die Verschmelzung die Erfüllung ihrer Forderung gefährdet wird. Das Recht, Sicherheitsleistung zu verlangen, steht Gläubigern nicht zu, die im Falle der Insolvenz ein Recht auf vorzugsweise Befriedigung aus einer Deckungsmasse haben, die nach gesetzlicher Vorschrift zu ihrem Schutz errichtet und staatlich überwacht ist."
    },
    {
      "date": "2025-12-12",
      "id": "139875",
      "original_text": "Einreichung neuer Dokumente\nBerlin Amtsgericht Berlin (Charlottenburg) HRB 180737\nMILES Mobility GmbH – Berlin",
      "type": "Einreichung neuer Dokumente",
      "state": "Berlin",
      "amtsgericht": "Amtsgericht Berlin (Charlottenburg)",
      "registernummer": "HRB 180737",
      "registerart": "HRB",
      "company_name": "MILES Mobility GmbH",
      "company_seat": "Berlin",
      "details": "12.12.2025 (Bekanntmachungsdatum)\n\nBerlin Amtsgericht Berlin (Charlottenburg) HRB 180737\nEinreichung neuer Dokumente\n\nMILES Mobility GmbH\nGesellschaft mit beschränkter Haftung\nBerlin\n\nAls nicht eingetragen wird veröffentlicht:\n\nEs wurde eine neue Liste der Beiratsmitglieder eingereicht (§52 GmbHG)."
    },
    {
      "date": "2025-12-12",
      "id": "139876",
      "original_text": "Löschungsankündigung\nMecklenburg-Vorpommern Amtsgericht Stralsund HRB 22594\nCafé Schlossperle zu Quilow UG (haftungsbeschränkt) – Groß Polzin",
      "type": "Löschungsankündigung",
      "state": "Mecklenburg-Vorpommern",
      "amtsgericht": "Amtsgericht Stralsund",
      "registernummer": "HRB 22594",
      "registerart": "HRB",
      "company_name": "Café Schlossperle zu Quilow UG (haftungsbeschränkt)",
      "company_seat": "Groß Polzin",
      "details": "12.12.2025 (Bekanntmachungsdatum)\n\nMecklenburg-Vorpommern Amtsgericht Stralsund HRB 22594\nLöschungsankündigung 12.12.2025 (Eintragungsdatum)\n\nCafé Schlossperle zu Quilow UG (haftungsbeschränkt)\nGesellschaft mit beschränkter Haftung\nGroß Polzin\n\nDas Registergericht beabsichtigt, die im Handelsregister eingetragene Gesellschaft von Amts wegen nach § 394 FamFG zu löschen. Die Frist zur Erhebung eines Widerspruchs gegen die beabsichtigte Löschung wird auf 1 Monat festgesetzt."
    },
    {
      "date": "2025-12-12",
      "id": "139877",
      "original_text": "Sonstige Registerbekanntmachung\nBerlin Amtsgericht Berlin (Charlottenburg) HRB 278028\nAcadeMedia Holding SE – Berlin",
      "type": "Sonstige Registerbekanntmachung",
      "state": "Berlin",
      "amtsgericht": "Amtsgericht Berlin (Charlottenburg)",
      "registernummer": "HRB 278028",
      "registerart": "HRB",
      "company_name": "AcadeMedia Holding SE",
      "company_seat": "Berlin",
      "details": "12.12.2025 (Bekanntmachungsdatum)\n\nBerlin Amtsgericht Berlin (Charlottenburg) HRB 278028\nSonstige Registerbekanntmachung\n\nAcadeMedia Holding SE\nEuropäische Aktiengesellschaft (SE)\nBerlin\n\nEs wurde eine neue Liste der Aufsichtsratsmitglieder eingereicht (§ 106 AktG).Als nicht eingetragen wird veröffentlicht:"
    },
    {
      "date": "2025-12-12",
      "id": "139878",
      "original_text": "Löschungsankündigung\nMecklenburg-Vorpommern Amtsgericht Stralsund HRB 22924\nLebenslinien Bestattungen GmbH – Sundhagen",
      "type": "Löschungsankündigung",
      "state": "Mecklenburg-Vorpommern",
      "amtsgericht": "Amtsgericht Stralsund",
      "registernummer": "HRB 22924",
      "registerart": "HRB",
      "company_name": "Lebenslinien Bestattungen GmbH",
      "company_seat": "Sundhagen",
      "details": "12.12.2025 (Bekanntmachungsdatum)\n\nMecklenburg-Vorpommern Amtsgericht Stralsund HRB 22924\nLöschungsankündigung 12.12.2025 (Eintragungsdatum)\n\nLebenslinien Bestattungen GmbH\nGesellschaft mit beschränkter Haftung\nSundhagen\n\nDas Registergericht beabsichtigt, die im Handelsregister eingetragene Gesellschaft von Amts wegen nach § 394 FamFG zu löschen. Die Frist zur Erhebung eines Widerspruchs gegen die beabsichtigte Löschung wird auf 1 Monat festgesetzt."
    },
    {
      "date": "2025-12-12",
      "id": "139879",
      "original_text": "Registerbekanntmachung nach dem Umwandlungsgesetz\nSchleswig-Holstein Amtsgericht Lübeck HRB 22235\nGlobal Invest Worldwide UG (haftungsbeschränkt) – Ahrensburg",
      "type": "Registerbekanntmachung nach dem Umwandlungsgesetz",
      "state": "Schleswig-Holstein",
      "amtsgericht": "Amtsgericht Lübeck",
      "registernummer": "HRB 22235",
      "registerart": "HRB",
      "company_name": "Global Invest Worldwide UG (haftungsbeschränkt)",
      "company_seat": "Ahrensburg",
      "details": "12.12.2025 (Bekanntmachungsdatum)\n\nSchleswig-Holstein Amtsgericht Lübeck HRB 22235\nRegisterbekanntmachung nach dem Umwandlungsgesetz 12.12.2025 (Eintragungsdatum)\n\nGlobal Invest Worldwide UG (haftungsbeschränkt)\nGesellschaft mit beschränkter Haftung\nAhrensburg\n\nZu Eintragungsnummer 5 vom 12.12.2025 wird als nicht eingetragen veröffentlicht:   Den Gläubigern der an der Verschmelzung beteiligten Rechtsträger ist, wenn sie binnen sechs Monaten nach dem Tag, an dem die Eintragung der Verschmelzung in das Register des Sitzes desjenigen Rechtsträgers, dessen Gläubiger sie sind, als bekannt gemacht gilt, ihren Anspruch nach Grund und Höhe schriftlich anmelden, Sicherheit zu leisten, soweit sie nicht Befriedigung verlangen können. Dieses Recht steht den Gläubigern jedoch nur zu, wenn sie glaubhaft machen, dass durch die Verschmelzung die Erfüllung ihrer Forderung gefährdet wird."
    },
    {
      "date": "2025-12-12",
      "id": "139880",
      "original_text": "Registerbekanntmachung nach dem Umwandlungsgesetz\nSachsen Amtsgericht Leipzig HRA 19748\nPhysiotherapie Ina Wolf e.K. – Rackwitz",
      "type": "Registerbekanntmachung nach dem Umwandlungsgesetz",
      "state": "Sachsen",
      "amtsgericht": "Amtsgericht Leipzig",
      "registernummer": "HRA 19748",
      "registerart": "HRA",
      "company_name": "Physiotherapie Ina Wolf e.K.",
      "company_seat": "Rackwitz",
      "details": "12.12.2025 (Bekanntmachungsdatum)\n\nSachsen Amtsgericht Leipzig HRA 19748\nRegisterbekanntmachung nach dem Umwandlungsgesetz 12.12.2025 (Eintragungsdatum)\n\nPhysiotherapie Ina Wolf e.K.\nEinzelkaufmann / Einzelkauffrau\nRackwitz\n\nDen Gläubigern der an der Ausgliederung beteiligten Rechtsträger ist, wenn sie binnen sechs Monaten nach dem Tag, an dem die Eintragung der Ausgliederung in das Register des Sitzes desjenigen Rechtsträgers, dessen Gläubiger sie sind, nach § 19 Abs. 3 UmwG als bekannt gemacht gilt, ihren Anspruch nach Grund und Höhe in Textform anmelden, Sicherheit zu leisten, soweit sie nicht Befriedigung verlangen können. Dieses Recht steht den Gläubigern jedoch nur zu, wenn sie glaubhaft machen, dass durch die Ausgliederung die Erfüllung der Forderung gefährdet wird."
    },
    {
      "date": "2025-12-12",
      "id": "139881",
      "original_text": "Löschungsankündigung\nSachsen Amtsgericht Dresden HRB 38506\nRubin Homes4you UG (haftungsbeschränkt) – Dresden",
      "type": "Löschungsankündigung",
      "state": "Sachsen",
      "amtsgericht": "Amtsgericht Dresden",
      "registernummer": "HRB 38506",
      "registerart": "HRB",
      "company_name": "Rubin Homes4you UG (haftungsbeschränkt)",
      "company_seat": "Dresden",
      "details": "12.12.2025 (Bekanntmachungsdatum)\n\nSachsen Amtsgericht Dresden HRB 38506\nLöschungsankündigung\n\nRubin Homes4you UG (haftungsbeschränkt)\nGesellschaft mit beschränkter Haftung\nDresden\n\nDas Registergericht beabsichtigt, die im Handelsregister eingetragene Gesellschaft von Amts wegen nach § 394 FamFG zu löschen. Die Frist zu Erhebung eines Widerspruchs gegen die beabsichtigte Löschung wird auf einen Monat festgesetzt."
    },
    {
      "date": "2025-12-12",
      "id": "139882",
      "original_text": "Registerbekanntmachung nach dem Umwandlungsgesetz\nSachsen Amtsgericht Leipzig HRA 19741\nPflegedienst Lebensweg Jenny Boritzki e.Kfr. – Eilenburg",
      "type": "Registerbekanntmachung nach dem Umwandlungsgesetz",
      "state": "Sachsen",
      "amtsgericht": "Amtsgericht Leipzig",
      "registernummer": "HRA 19741",
      "registerart": "HRA",
      "company_name": "Pflegedienst Lebensweg Jenny Boritzki e.Kfr.",
      "company_seat": "Eilenburg",
      "details": "12.12.2025 (Bekanntmachungsdatum)\n\nSachsen Amtsgericht Leipzig HRA 19741\nRegisterbekanntmachung nach dem Umwandlungsgesetz 12.12.2025 (Eintragungsdatum)\n\nPflegedienst Lebensweg Jenny Boritzki e.Kfr.\nEinzelkaufmann / Einzelkauffrau\nEilenburg\n\nDen Gläubigern der an der Ausgliederung beteiligten Rechtsträger ist, wenn sie binnen sechs Monaten nach dem Tag, an dem die Eintragung der Ausgliederung in das Register des Sitzes desjenigen Rechtsträgers, dessen Gläubiger sie sind, nach § 19 Abs. 3 UmwG als bekannt gemacht gilt, ihren Anspruch nach Grund und Höhe in Textform anmelden, Sicherheit zu leisten, soweit sie nicht Befriedigung verlangen können. Dieses Recht steht den Gläubigern jedoch nur zu, wenn sie glaubhaft machen, dass durch die Ausgliederung die Erfüllung der Forderung gefährdet wird."
    },
    {
      "date": "2025-12-12",
      "id": "139883",
      "original_text": "Registerbekanntmachung nach dem Umwandlungsgesetz\nBerlin Amtsgericht Berlin (Charlottenburg) HRB 175701\ntink GmbH – Berlin",
      "type": "Registerbekanntmachung nach dem Umwandlungsgesetz",
      "state": "Berlin",
      "amtsgericht": "Amtsgericht Berlin (Charlottenburg)",
      "registernummer": "HRB 175701",
      "registerart": "HRB",
      "company_name": "tink GmbH",
      "company_seat": "Berlin",
      "details": "12.12.2025 (Bekanntmachungsdatum)\n\nBerlin Amtsgericht Berlin (Charlottenburg) HRB 175701\nRegisterbekanntmachung nach dem Umwandlungsgesetz 12.12.2025 (Eintragungsdatum)\n\ntink GmbH\nGesellschaft mit beschränkter Haftung\nBerlin\n\nZu Eintragungsnummer 21 vom 12.12.2025 wird als nicht eingetragen veröffentlicht: Den Gläubigern der an der Verschmelzung beteiligten Rechtsträger ist, wenn sie binnen sechs Monaten nach dem Tag, an dem die Eintragung der Verschmelzung in das Register des Sitzes desjenigen Rechtsträgers, dessen Gläubiger sie sind, als bekannt gemacht gilt, ihren Anspruch nach Grund und Höhe schriftlich anmelden, Sicherheit zu leisten, soweit sie nicht Befriedigung verlangen können. Dieses Recht steht den Gläubigern jedoch nur zu, wenn sie glaubhaft machen, dass durch die Verschmelzung die Erfüllung ihrer Forderung gefährdet wird. Das Recht, Sicherheitsleistung zu verlangen, steht Gläubigern nicht zu, die im Falle der Insolvenz ein Recht auf vorzugsweise Befriedigung aus einer Deckungsmasse haben, die nach gesetzlicher Vorschrift zu ihrem Schutz errichtet und staatlich überwacht ist."
    },
    {
      "date": "2025-12-12",
      "id": "139884",
      "original_text": "Registerbekanntmachung nach dem Umwandlungsgesetz\nBerlin Amtsgericht Berlin (Charlottenburg) HRB 239088\ntink Services GmbH – Berlin",
      "type": "Registerbekanntmachung nach dem Umwandlungsgesetz",
      "state": "Berlin",
      "amtsgericht": "Amtsgericht Berlin (Charlottenburg)",
      "registernummer": "HRB 239088",
      "registerart": "HRB",
      "company_name": "tink Services GmbH",
      "company_seat": "Berlin",
      "details": "12.12.2025 (Bekanntmachungsdatum)\n\nBerlin Amtsgericht Berlin (Charlottenburg) HRB 239088\nRegisterbekanntmachung nach dem Umwandlungsgesetz 12.12.2025 (Eintragungsdatum)\n\ntink Services GmbH\nGesellschaft mit beschränkter Haftung\nBerlin\n\nZu Eintragungsnummer 4 vom 12.12.2025 wird als nicht eingetragen veröffentlicht: Den Gläubigern der an der Verschmelzung beteiligten Rechtsträger ist, wenn sie binnen sechs Monaten nach dem Tag, an dem die Eintragung der Verschmelzung in das Register des Sitzes desjenigen Rechtsträgers, dessen Gläubiger sie sind, als bekannt gemacht gilt, ihren Anspruch nach Grund und Höhe schriftlich anmelden, Sicherheit zu leisten, soweit sie nicht Befriedigung verlangen können. Dieses Recht steht den Gläubigern jedoch nur zu, wenn sie glaubhaft machen, dass durch die Verschmelzung die Erfüllung ihrer Forderung gefährdet wird. Das Recht, Sicherheitsleistung zu verlangen, steht Gläubigern nicht zu, die im Falle der Insolvenz ein Recht auf vorzugsweise Befriedigung aus einer Deckungsmasse haben, die nach gesetzlicher Vorschrift zu ihrem Schutz errichtet und staatlich überwacht ist."
    },
    {
      "date": "2025-12-12",
      "id": "139885",
      "original_text": "Löschungsankündigung\nBerlin Amtsgericht Berlin (Charlottenburg) HRA 50843\nPerfekt-Gastro UG (haftungsbeschränkt) & Co. KG Betriebsgesellschaft Am Strande – Berlin",
      "type": "Löschungsankündigung",
      "state": "Berlin",
      "amtsgericht": "Amtsgericht Berlin (Charlottenburg)",
      "registernummer": "HRA 50843",
      "registerart": "HRA",
      "company_name": "Perfekt-Gastro UG (haftungsbeschränkt) & Co. KG Betriebsgesellschaft Am Strande",
      "company_seat": "Berlin",
      "details": "12.12.2025 (Bekanntmachungsdatum)\n\nBerlin Amtsgericht Berlin (Charlottenburg) HRA 50843\nLöschungsankündigung\n\nPerfekt-Gastro UG (haftungsbeschränkt) & Co. KG Betriebsgesellschaft Am Strande\nKommanditgesellschaft\nBerlin\n\nBei dem nachstehenden Unternehmen / der nachstehenden Gesellschaft wird das Amtslöschungsverfahren gemäß § 31 Abs. 2 HGB eingeleitet. Widerspruchsfrist 2 Monate"
    },
    {
      "date": "2025-12-12",
      "id": "139886",
      "original_text": "Löschungsankündigung\nBerlin Amtsgericht Berlin (Charlottenburg) HRB 202482\nFinvie GmbH – Berlin",
      "type": "Löschungsankündigung",
      "state": "Berlin",
      "amtsgericht": "Amtsgericht Berlin (Charlottenburg)",
      "registernummer": "HRB 202482",
      "registerart": "HRB",
      "company_name": "Finvie GmbH",
      "company_seat": "Berlin",
      "details": "12.12.2025 (Bekanntmachungsdatum)\n\nBerlin Amtsgericht Berlin (Charlottenburg) HRB 202482\nLöschungsankündigung\n\nFinvie GmbH\nGesellschaft mit beschränkter Haftung\nBerlin\n\nBei der nachstehenden Gesellschaft wird das Amtslöschungsverfahren gemäß § 394 FamFG eingeleitet. Widerspruchsfrist 6 Wochen"
    },
    {
      "date": "2025-12-12",
      "id": "139887",
      "original_text": "Löschungsankündigung\nRheinland-Pfalz Amtsgericht Ludwigshafen a.Rhein (Ludwigshafen) HRB 67463\nMegusta Catering GmbH – Ludwigshafen am Rhein",
      "type": "Löschungsankündigung",
      "state": "Rheinland-Pfalz",
      "amtsgericht": "Amtsgericht Ludwigshafen a.Rhein (Ludwigshafen)",
      "registernummer": "HRB 67463",
      "registerart": "HRB",
      "company_name": "Megusta Catering GmbH",
      "company_seat": "Ludwigshafen am Rhein",
      "details": "12.12.2025 (Bekanntmachungsdatum)\n\nRheinland-Pfalz Amtsgericht Ludwigshafen a.Rhein (Ludwigshafen) HRB 67463\nLöschungsankündigung\n\nMegusta Catering GmbH\nGesellschaft mit beschränkter Haftung\nLudwigshafen am Rhein\n\nDas Registergericht beabsichtigt die Gesellschaft von Amts wegen nach § 394 FamFG zu löschen. Die Frist zur Erhebung eines Widerspruchs ist auf einen Monat festgesetzt."
    },
    {
      "date": "2025-12-12",
      "id": "139888",
      "original_text": "Einreichung neuer Dokumente\nRheinland-Pfalz Amtsgericht Mainz HRB 51230\nSCHOTT Pharma AG & Co. KGaA – Mainz",
      "type": "Einreichung neuer Dokumente",
      "state": "Rheinland-Pfalz",
      "amtsgericht": "Amtsgericht Mainz",
      "registernummer": "HRB 51230",
      "registerart": "HRB",
      "company_name": "SCHOTT Pharma AG & Co. KGaA",
      "company_seat": "Mainz",
      "details": "12.12.2025 (Bekanntmachungsdatum)\n\nRheinland-Pfalz Amtsgericht Mainz HRB 51230\nEinreichung neuer Dokumente\n\nSCHOTT Pharma AG & Co. KGaA\nKommanditgesellschaft auf Aktien\nMainz\n\nDem Registergericht ist eine neue Liste der Mitglieder des Aufsichtsrates eingereicht worden."
    },
    {
      "date": "2025-12-12",
      "id": "139889",
      "original_text": "Registerbekanntmachung nach dem Umwandlungsgesetz\nRheinland-Pfalz Amtsgericht Bad Kreuznach HRB 1936\nPfefferkorn & Schneider GmbH – Simmern/Hunsrück",
      "type": "Registerbekanntmachung nach dem Umwandlungsgesetz",
      "state": "Rheinland-Pfalz",
      "amtsgericht": "Amtsgericht Bad Kreuznach",
      "registernummer": "HRB 1936",
      "registerart": "HRB",
      "company_name": "Pfefferkorn & Schneider GmbH",
      "company_seat": "Simmern/Hunsrück",
      "details": "12.12.2025 (Bekanntmachungsdatum)\n\nRheinland-Pfalz Amtsgericht Bad Kreuznach HRB 1936\nRegisterbekanntmachung nach dem Umwandlungsgesetz 12.12.2025 (Eintragungsdatum)\n\nPfefferkorn & Schneider GmbH\nGesellschaft mit beschränkter Haftung\nSimmern/Hunsrück\n\nAls nicht eingetragen wird veröffentlicht: Den Gläubigern der an der Verschmelzung beteiligten Rechtsträger ist, wenn sie binnen sechs Monaten nach dem Tag, an dem die Eintragung der Verschmelzung in das Register des Sitzes desjenigen Rechtsträgers, dessen Gläubiger sie sind, nach § 19 Abs. 3 UmwG als bekannt gemacht gilt, ihren Anspruch nach Grund und Höhe schriftlich anmelden, Sicherheit zu leisten, soweit sie nicht Befriedigung verlangen können. Dieses Recht steht den Gläubigern jedoch nur zu, wenn sie glaubhaft machen, dass durch die Verschmelzung die Erfüllung der Forderung gefährdet wird."
    },
    {
      "date": "2025-12-12",
      "id": "139890",
      "original_text": "Registerbekanntmachung nach dem Umwandlungsgesetz\nRheinland-Pfalz Amtsgericht Bad Kreuznach HRB 23870\nDraht- und Metallwarenfabrik Philipp Schneider GmbH – Simmern/Hunsrück",
      "type": "Registerbekanntmachung nach dem Umwandlungsgesetz",
      "state": "Rheinland-Pfalz",
      "amtsgericht": "Amtsgericht Bad Kreuznach",
      "registernummer": "HRB 23870",
      "registerart": "HRB",
      "company_name": "Draht- und Metallwarenfabrik Philipp Schneider GmbH",
      "company_seat": "Simmern/Hunsrück",
      "details": "12.12.2025 (Bekanntmachungsdatum)\n\nRheinland-Pfalz Amtsgericht Bad Kreuznach HRB 23870\nRegisterbekanntmachung nach dem Umwandlungsgesetz 12.12.2025 (Eintragungsdatum)\n\nDraht- und Metallwarenfabrik Philipp Schneider GmbH\nGesellschaft mit beschränkter Haftung\nSimmern/Hunsrück\n\nAls nicht eingetragen wird veröffentlicht: Den Gläubigern der an der Verschmelzung beteiligten Rechtsträger ist, wenn sie binnen sechs Monaten nach dem Tag, an dem die Eintragung der Verschmelzung in das Register des Sitzes desjenigen Rechtsträgers, dessen Gläubiger sie sind, nach § 19 Abs. 3 UmwG als bekannt gemacht gilt, ihren Anspruch nach Grund und Höhe schriftlich anmelden, Sicherheit zu leisten, soweit sie nicht Befriedigung verlangen können. Dieses Recht steht den Gläubigern jedoch nur zu, wenn sie glaubhaft machen, dass durch die Verschmelzung die Erfüllung der Forderung gefährdet wird."
    },
    {
      "date": "2025-12-12",
      "id": "139891",
      "original_text": "Registerbekanntmachung nach dem Umwandlungsgesetz\nRheinland-Pfalz Amtsgericht Bad Kreuznach HRB 4563\nKapselfabrik Schneider GmbH – Simmern",
      "type": "Registerbekanntmachung nach dem Umwandlungsgesetz",
      "state": "Rheinland-Pfalz",
      "amtsgericht": "Amtsgericht Bad Kreuznach",
      "registernummer": "HRB 4563",
      "registerart": "HRB",
      "company_name": "Kapselfabrik Schneider GmbH",
      "company_seat": "Simmern",
      "details": "12.12.2025 (Bekanntmachungsdatum)\n\nRheinland-Pfalz Amtsgericht Bad Kreuznach HRB 4563\nRegisterbekanntmachung nach dem Umwandlungsgesetz 12.12.2025 (Eintragungsdatum)\n\nKapselfabrik Schneider GmbH\nGesellschaft mit beschränkter Haftung\nSimmern\n\nAls nicht eingetragen wird veröffentlicht: Den Gläubigern der an der Verschmelzung beteiligten Rechtsträger ist, wenn sie binnen sechs Monaten nach dem Tag, an dem die Eintragung der Verschmelzung in das Register des Sitzes desjenigen Rechtsträgers, dessen Gläubiger sie sind, nach § 19 Abs. 3 UmwG als bekannt gemacht gilt, ihren Anspruch nach Grund und Höhe schriftlich anmelden, Sicherheit zu leisten, soweit sie nicht Befriedigung verlangen können. Dieses Recht steht den Gläubigern jedoch nur zu, wenn sie glaubhaft machen, dass durch die Verschmelzung die Erfüllung der Forderung gefährdet wird."
    },
    {
      "date": "2025-12-12",
      "id": "139892",
      "original_text": "Löschungsankündigung\nRheinland-Pfalz Amtsgericht Bad Kreuznach HRB 21522\nXLand International Trading and Consulting GmbH – Hoppstädten-Weiersbach",
      "type": "Löschungsankündigung",
      "state": "Rheinland-Pfalz",
      "amtsgericht": "Amtsgericht Bad Kreuznach",
      "registernummer": "HRB 21522",
      "registerart": "HRB",
      "company_name": "XLand International Trading and Consulting GmbH",
      "company_seat": "Hoppstädten-Weiersbach",
      "details": "12.12.2025 (Bekanntmachungsdatum)\n\nRheinland-Pfalz Amtsgericht Bad Kreuznach HRB 21522\nLöschungsankündigung\n\nXLand International Trading and Consulting GmbH\nGesellschaft mit beschränkter Haftung\nHoppstädten-Weiersbach\n\nDas Registergericht beabsichtigt die Gesellschaft wegen Vermögenslosigkeit im Handelsregister von Amts wegen nach § 394 FamFG zu löschen. Die Frist zur Erhebung eines Widerspruchs gegen die beabsichtigte Löschung ist auf einen Monat ab Veröffentlichung bestimmt."
    },
    {
      "date": "2025-12-12",
      "id": "139893",
      "original_text": "Registerbekanntmachung nach dem Umwandlungsgesetz\nNordrhein-Westfalen Amtsgericht Bad Oeynhausen HRB 20675\nHeinrichsmeier Bestattungen GmbH – Minden",
      "type": "Registerbekanntmachung nach dem Umwandlungsgesetz",
      "state": "Nordrhein-Westfalen",
      "amtsgericht": "Amtsgericht Bad Oeynhausen",
      "registernummer": "HRB 20675",
      "registerart": "HRB",
      "company_name": "Heinrichsmeier Bestattungen GmbH",
      "company_seat": "Minden",
      "details": "12.12.2025 (Bekanntmachungsdatum)\n\nNordrhein-Westfalen Amtsgericht Bad Oeynhausen HRB 20675\nRegisterbekanntmachung nach dem Umwandlungsgesetz 12.12.2025 (Eintragungsdatum)\n\nHeinrichsmeier Bestattungen GmbH\nGesellschaft mit beschränkter Haftung\nMinden\n\nDen Gläubigern der an der Ausgliederung beteiligten Rechtsträger ist, wenn sie binnen sechs Monaten nach dem Tag, an dem die Eintragung der Ausgliederung in das Register des Sitzes desjenigen Rechtsträgers, dessen Gläubiger sie sind, nach § 19 Absatz 3 UmwG als bekanntgemacht gilt, ihren Anspruch nach Grund und Höhe schriftlich anmelden, Sicherheit zu leisten, soweit sie nicht Befriedigung verlangen können. Dieses Recht steht den Gläubigern jedoch nur zu, wenn sie glaubhaft machen, dass durch die Ausgliederung die Erfüllung ihrer Forderung gefährdet wird."
    },
    {
      "date": "2025-12-12",
      "id": "139894",
      "original_text": "Löschungsankündigung\nNordrhein-Westfalen Amtsgericht Siegburg HRB 6216\nKW Supplies & Services GmbH – Troisdorf",
      "type": "Löschungsankündigung",
      "state": "Nordrhein-Westfalen",
      "amtsgericht": "Amtsgericht Siegburg",
      "registernummer": "HRB 6216",
      "registerart": "HRB",
      "company_name": "KW Supplies & Services GmbH",
      "company_seat": "Troisdorf",
      "details": "12.12.2025 (Bekanntmachungsdatum)\n\nNordrhein-Westfalen Amtsgericht Siegburg HRB 6216\nLöschungsankündigung\n\nKW Supplies & Services GmbH\nGesellschaft mit beschränkter Haftung\nTroisdorf\n\nDas Registergericht hat glaubhafte Kenntnis erlangt, dass die Gesellschaft vermögenslos geworden ist.\n\nEs ist daher beabsichtigt, die Gesellschaft nach § 394 FamFG im Handelsregister wegen Vermögenslosigkeit zu löschen.\nEinwände gegen die Löschung sind durch Widerspruch binnen einer Frist von 3 Monaten geltend zu machen, andernfalls die Löschung erfolgen wird.\n\nEinzulegen ist der Widerspruch bei dem Amtsgericht Siegburg, Neue Poststraße 16, 53721 Siegburg, und zwar entweder schriftlich in deutscher Sprache oder mündlich zur Niederschrift der Geschäftsstelle. Der Widerspruch kann auch zur Niederschrift der Geschäftsstelle eines jeden Amtsgerichts abgegeben werden. Der Widerspruch ist binnen der in der Verfügung bestimmten Frist einzulegen. Die Frist ist nur gewahrt, wenn der Widerspruch rechtzeitig bei dem Amtsgericht Siegburg eingeht, auch wenn der Widerspruch zur Niederschrift der Geschäftsstelle eines anderen Amtsgerichts abgegeben wurde. Die Frist beginnt jeweils mit der schriftlichen Bekanntgabe der Verfügung an die Beteiligten. Kann die schriftliche Bekanntgabe an einen Beteiligten nicht bewirkt werden, beginnt die Frist spätestens mit Ablauf von fünf Monaten nach Erlass der Verfügung. Die Bekanntgabe ist entweder durch Zustellung oder am dritten Tage nach Aufgabe zur Post bewirkt. Sofern die Löschung noch nicht erfolgt ist, kann der Widerspruch auch noch nach Ablauf der Frist eingelegt werden. Fällt das Ende der Frist auf einen Sonnabend, einen Sonntag oder einen allgemeinen Feiertag, endet die Frist mit Ablauf des nächsten Werktages. Der Widerspruch ist zu unterzeichnen. Eine Begründung des Widerspruchs ist nicht vorgeschrieben."
    },
    {
      "date": "2025-12-12",
      "id": "139895",
      "original_text": "Registerbekanntmachung nach dem Umwandlungsgesetz\nNordrhein-Westfalen Amtsgericht Bochum HRB 21660\nS & H Verwaltungs GmbH – Bochum",
      "type": "Registerbekanntmachung nach dem Umwandlungsgesetz",
      "state": "Nordrhein-Westfalen",
      "amtsgericht": "Amtsgericht Bochum",
      "registernummer": "HRB 21660",
      "registerart": "HRB",
      "company_name": "S & H Verwaltungs GmbH",
      "company_seat": "Bochum",
      "details": "12.12.2025 (Bekanntmachungsdatum)\n\nNordrhein-Westfalen Amtsgericht Bochum HRB 21660\nRegisterbekanntmachung nach dem Umwandlungsgesetz 11.12.2025 (Eintragungsdatum)\n\nS & H Verwaltungs GmbH\nGesellschaft mit beschränkter Haftung\nBochum\n\nDie Gesellschaft hat Gläubigern, deren Forderungen vor dieser Bekanntmachung begründet worden sind, Sicherheit zu leisten, soweit sie nicht Befriedigung verlangen können, wenn sie sich binnen sechs Monaten zu diesem Zweck melden."
    },
    {
      "date": "2025-12-12",
      "id": "139896",
      "original_text": "Einreichung neuer Dokumente\nNordrhein-Westfalen Amtsgericht Bielefeld HRB 37377\nDSC Arminia Bielefeld GmbH & Co. KGaA – Bielefeld",
      "type": "Einreichung neuer Dokumente",
      "state": "Nordrhein-Westfalen",
      "amtsgericht": "Amtsgericht Bielefeld",
      "registernummer": "HRB 37377",
      "registerart": "HRB",
      "company_name": "DSC Arminia Bielefeld GmbH & Co. KGaA",
      "company_seat": "Bielefeld",
      "details": "12.12.2025 (Bekanntmachungsdatum)\n\nNordrhein-Westfalen Amtsgericht Bielefeld HRB 37377\nEinreichung neuer Dokumente 12.12.2025 (Eintragungsdatum)\n\nDSC Arminia Bielefeld GmbH & Co. KGaA\nKommanditgesellschaft auf Aktien\nBielefeld\n\nDem Registergericht ist eine neue Liste der Mitglieder des Aufsichtsrates eingereicht worden."
    },
    {
      "date": "2025-12-12",
      "id": "139897",
      "original_text": "Registerbekanntmachung nach dem Umwandlungsgesetz\nNordrhein-Westfalen Amtsgericht Düsseldorf HRA 27507\nAugsburg Annastraße EBR Projektentwicklungs SARL & Co. KG – Düsseldorf",
      "type": "Registerbekanntmachung nach dem Umwandlungsgesetz",
      "state": "Nordrhein-Westfalen",
      "amtsgericht": "Amtsgericht Düsseldorf",
      "registernummer": "HRA 27507",
      "registerart": "HRA",
      "company_name": "Augsburg Annastraße EBR Projektentwicklungs SARL & Co. KG",
      "company_seat": "Düsseldorf",
      "details": "12.12.2025 (Bekanntmachungsdatum)\n\nNordrhein-Westfalen Amtsgericht Düsseldorf HRA 27507\nRegisterbekanntmachung nach dem Umwandlungsgesetz 12.12.2025 (Eintragungsdatum)\n\nAugsburg Annastraße EBR Projektentwicklungs SARL & Co. KG\nKommanditgesellschaft\nDüsseldorf\n\nDen Gläubigern der an der formwechselnden Umwandlung beteiligten Rechtsträger ist, wenn sie binnen sechs Monaten nach dem Tag, an dem die Eintragung der formwechselnden Umwandlung in das Register des Sitzes desjenigen Rechtsträgers, dessen Gläubiger sie sind, nach § 19 Absatz 3 UmwG als bekanntgemacht gilt, ihren Anspruch nach Grund und Höhe schriftlich anmelden, Sicherheit zu leisten, soweit sie nicht Befriedigung verlangen können. Dieses Recht steht den Gläubigern jedoch nur zu, wenn sie glaubhaft machen, dass durch die formwechselnden Umwandlung die Erfüllung ihrer Forderung gefährdet wird."
    },
    {
      "date": "2025-12-12",
      "id": "139898",
      "original_text": "Registerbekanntmachung nach dem Umwandlungsgesetz\nNordrhein-Westfalen Amtsgericht Hamm HRA 4615\nElektrotechnik Brendan Blank e.K. – Hamm",
      "type": "Registerbekanntmachung nach dem Umwandlungsgesetz",
      "state": "Nordrhein-Westfalen",
      "amtsgericht": "Amtsgericht Hamm",
      "registernummer": "HRA 4615",
      "registerart": "HRA",
      "company_name": "Elektrotechnik Brendan Blank e.K.",
      "company_seat": "Hamm",
      "details": "12.12.2025 (Bekanntmachungsdatum)\n\nNordrhein-Westfalen Amtsgericht Hamm HRA 4615\nRegisterbekanntmachung nach dem Umwandlungsgesetz 12.12.2025 (Eintragungsdatum)\n\nElektrotechnik Brendan Blank e.K.\nEinzelkaufmann / Einzelkauffrau\nHamm\n\nDen Gläubigern der an der Ausgliederung beteiligten Rechtsträger ist, wenn sie binnen sechs Monaten nach dem Tag, an dem die Eintragung der Ausgliederung in das Register des Sitzes desjenigen Rechtsträgers, dessen Gläubiger sie sind, nach § 19 Absatz 3 UmwG als bekanntgemacht gilt, ihren Anspruch nach Grund und Höhe schriftlich anmelden, Sicherheit zu leisten, soweit sie nicht Befriedigung verlangen können. Dieses Recht steht den Gläubigern jedoch nur zu, wenn sie glaubhaft machen, dass durch die Ausgliederung die Erfüllung ihrer Forderung gefährdet wird."
    },
    {
      "date": "2025-12-12",
      "id": "139899",
      "original_text": "Einreichung neuer Dokumente\nNordrhein-Westfalen Amtsgericht Iserlohn HRB 10340\nOTTO FUCHS Verwaltungs SE – Meinerzhagen",
      "type": "Einreichung neuer Dokumente",
      "state": "Nordrhein-Westfalen",
      "amtsgericht": "Amtsgericht Iserlohn",
      "registernummer": "HRB 10340",
      "registerart": "HRB",
      "company_name": "OTTO FUCHS Verwaltungs SE",
      "company_seat": "Meinerzhagen",
      "details": "12.12.2025 (Bekanntmachungsdatum)\n\nNordrhein-Westfalen Amtsgericht Iserlohn HRB 10340\nEinreichung neuer Dokumente 12.12.2025 (Eintragungsdatum)\n\nOTTO FUCHS Verwaltungs SE\nEuropäische Aktiengesellschaft (SE)\nMeinerzhagen\n\nDem Registergericht ist eine neue Liste der Mitglieder des Aufsichtsrates eingereicht worden."
    },
    {
      "date": "2025-12-12",
      "id": "139900",
      "original_text": "Registerbekanntmachung nach dem Umwandlungsgesetz\nNordrhein-Westfalen Amtsgericht Essen HRA 12033\nfranky PropCo 2 GmbH & Co. KG – Essen",
      "type": "Registerbekanntmachung nach dem Umwandlungsgesetz",
      "state": "Nordrhein-Westfalen",
      "amtsgericht": "Amtsgericht Essen",
      "registernummer": "HRA 12033",
      "registerart": "HRA",
      "company_name": "franky PropCo 2 GmbH & Co. KG",
      "company_seat": "Essen",
      "details": "12.12.2025 (Bekanntmachungsdatum)\n\nNordrhein-Westfalen Amtsgericht Essen HRA 12033\nRegisterbekanntmachung nach dem Umwandlungsgesetz 12.12.2025 (Eintragungsdatum)\n\nfranky PropCo 2 GmbH & Co. KG\nKommanditgesellschaft\nEssen\n\nDen Gläubigern der an der formwechselnden Umwandlung beteiligten Rechtsträger ist, wenn sie binnen sechs Monaten nach dem Tag, an dem die Eintragung der formwechselnden Umwandlung in das Register des Sitzes desjenigen Rechtsträgers, dessen Gläubiger sie sind, nach § 19 Absatz 3 UmwG als bekanntgemacht gilt, ihren Anspruch nach Grund und Höhe schriftlich anmelden, Sicherheit zu leisten, soweit sie nicht Befriedigung verlangen können. Dieses Recht steht den Gläubigern jedoch nur zu, wenn sie glaubhaft machen, dass durch die formwechselnden Umwandlung die Erfüllung ihrer Forderung gefährdet wird."
    },
    {
      "date": "2025-12-12",
      "id": "139901",
      "original_text": "Löschungsankündigung\nNordrhein-Westfalen Amtsgericht Aachen HRB 9989\nEggerath Verwaltungs GmbH – Heinsberg",
      "type": "Löschungsankündigung",
      "state": "Nordrhein-Westfalen",
      "amtsgericht": "Amtsgericht Aachen",
      "registernummer": "HRB 9989",
      "registerart": "HRB",
      "company_name": "Eggerath Verwaltungs GmbH",
      "company_seat": "Heinsberg",
      "details": "12.12.2025 (Bekanntmachungsdatum)\n\nNordrhein-Westfalen Amtsgericht Aachen HRB 9989\nLöschungsankündigung\n\nEggerath Verwaltungs GmbH\nGesellschaft mit beschränkter Haftung\nHeinsberg\n\nDas Registergericht beabsichtigt, von Amts wegen die Gesellschaft wegen Vermögenslosigkeit nach § 394 FamFG zu löschen, weil das Insolvenzverfahren Amtsgericht Aachen (Az.: 93 IN 181/06) beendet und Vermögen der Gesellschaft nicht mehr erkennbar ist.\n\nZur Geltendmachung des Widerspruchs gegen die beabsichtigte Löschung wird hiermit eine Frist von einem Monat ab Veröffentlichung dieser Ankündigung bestimmt.\n\nRechtsbehelfsbelehrung:\n\nGegen diese Verfügung kann Widerspruch eingelegt werden. Zum Widerspruch ist jeder berechtigt, der an der Unterlassung der Löschung ein berechtigtes Interesse hat.\n\nDer Widerspruch ist bei dem Amtsgericht Aachen, Adalbertsteinweg 92, 52070 Aachen schriftlich in deutscher Sprache oder zur Niederschrift der Geschäftsstelle einzulegen. Der Widerspruch kann auch zur Niederschrift der Geschäftsstelle eines jeden Amtsgerichtes abgegeben werden.\n\nDer Widerspruch muss spätestens innerhalb der gesetzten Frist nach der Bekanntgabe der Verfügung bei dem Amtsgericht Aachen eingegangen sein. Dies gilt auch dann, wenn der Widerspruch zur Niederschrift der Geschäftsstelle eines anderen Amtsgerichtes abgegeben wurde. Die Frist beginnt mit der Bekanntgabe der Verfügung durch Veröffentlichung. Fällt das Ende der Frist auf einen Sonntag, einen allgemeinen Feiertag oder Sonnabend, so endet die Frist mit Ablauf des nächsten Werktages.\n\nDer Widerspruch muss die Bezeichnung der angefochtenen Verfügung sowie die Erklärung enthalten, dass Widerspruch gegen diese Verfügung eingelegt wird. Er ist zu unterzeichnen und soll begründet werden.\n\nDie Einlegung ist auch durch Übertragung eines elektronischen Dokuments an die elektronische Poststelle des Gerichts möglich. Das elektronische Dokument muss für die Bearbeitung durch das Gericht geeignet und mit einer qualifizierten elektronischen Signatur der verantwortenden Person versehen sein oder von der verantwortenden Person signiert und auf einem sicheren Übermittlungsweg gemäß § 130 a ZPO nach näherer Maßgabe der Verordnung über die technischen Rahmenbedingungen des elektronischen Rechtsverkehrs und über das besondere elektronische Behördenpostfach (BGBl. I, S. 3803) eingereicht werden. Weitere Informationen erhalten Sie auf der Internetseite www.justiz.de."
    },
    {
      "date": "2025-12-12",
      "id": "139902",
      "original_text": "Löschungsankündigung\nNordrhein-Westfalen Amtsgericht Düsseldorf HRA 23831\nF. Münch Umzug e.K. – Düsseldorf",
      "type": "Löschungsankündigung",
      "state": "Nordrhein-Westfalen",
      "amtsgericht": "Amtsgericht Düsseldorf",
      "registernummer": "HRA 23831",
      "registerart": "HRA",
      "company_name": "F. Münch Umzug e.K.",
      "company_seat": "Düsseldorf",
      "details": "12.12.2025 (Bekanntmachungsdatum)\n\nNordrhein-Westfalen Amtsgericht Düsseldorf HRA 23831\nLöschungsankündigung\n\nF. Münch Umzug e.K.\nEinzelkaufmann / Einzelkauffrau\nDüsseldorf\n\nDas Registergericht beabsichtigt die Firma von Amts wegen nach § 393 FamFG, 31 Abs. 2 HGB zu löschen, da kein Geerbe mehr betrieben wird. Die Frist zur Erhebung eines Widerspruchs ist auf drei Monate festgesetzt.\n\nRechtsbehelfsbelehrung:\nDas Widerspruchsrecht steht jedem zu, der an der Unterlassung der Löschung ein berechtigtes Interesse hat. Der Widerspruch ist bei dem Amtsgericht Düsseldorf -Registergericht-, Werdener Straße 1, 40227 Düsseldorf schriftlich in deutscher Sprache oder zur Niederschrift der Geschäftsstelle einzulegen. Der Widerspruch kann auch zur Niederschrift der Geschäftsstelle eines jeden Amtsgerichtes abgegeben werden. Die Einlegung ist auch durch Übertragung eines elektronischen Dokuments an die elektronische Poststelle des Gerichts möglich. Das elektronische Dokument muss für die Bearbeitung durch das Gericht geeignet und mit einer qualifizierten elektronischen Signatur der verantwortenden Person versehen sein oder von der verantwortenden Person signiert und auf einem sicheren Übermittlungsweg gemäß § 130a ZPO nach näherer Maßgabe der Verordnung über die technischen Rahmenbedingungen des elektronischen Rechtsverkehrs und über das besondere elektronische Behördenpostfach (BGBl. I, S.3803) eingereicht werden. Weitere Informationen erhalten Sie auf der Internetseite www.justiz.de.\nDer Widerspruch muss spätestens innerhalb der gesetzten Frist nach dem Datum der Bekanntmachung der Löschungsankündigung bei dem Amtsgericht - Registergericht - Düsseldorf eingegangen sein.  Dies gilt auch dann, wenn der Widerspruch zur Niederschrift der Geschäftsstelle eines anderen Amtsgerichtes abgegeben wurde. Die Frist beginnt mit dem Tage der Bekanntmachung der Löschungsankündigung in dem für die Bekanntmachung der Eintragungen in das Handelsregister bestimmten elektronischen Informations- und Kommunikationssystem nach § 10 des Handelsgesetzbuches. Fällt das Ende der Frist auf einen Sonntag, einen allgemeinen Feiertag oder Sonnabend, so endet die Frist mit Ablauf des nächsten Werktages.\nDer Widerspruch muss die Bezeichnung der angefochtenen Löschungsankündigung sowie die Erklärung enthalten, dass Widerspruch gegen diese Löschungsankündigung eingelegt wird. Er ist zu unterzeichnen und soll begründet werden."
    },
    {
      "date": "2025-12-12",
      "id": "139903",
      "original_text": "Registerbekanntmachung nach dem Umwandlungsgesetz\nNordrhein-Westfalen Amtsgericht Düsseldorf HRB 110250\nSereni Bestattungen GmbH – Düsseldorf",
      "type": "Registerbekanntmachung nach dem Umwandlungsgesetz",
      "state": "Nordrhein-Westfalen",
      "amtsgericht": "Amtsgericht Düsseldorf",
      "registernummer": "HRB 110250",
      "registerart": "HRB",
      "company_name": "Sereni Bestattungen GmbH",
      "company_seat": "Düsseldorf",
      "details": "12.12.2025 (Bekanntmachungsdatum)\n\nNordrhein-Westfalen Amtsgericht Düsseldorf HRB 110250\nRegisterbekanntmachung nach dem Umwandlungsgesetz 12.12.2025 (Eintragungsdatum)\n\nSereni Bestattungen GmbH\nGesellschaft mit beschränkter Haftung\nDüsseldorf\n\nDen Gläubigern der an der Verschmelzung beteiligten Rechtsträger ist, wenn sie binnen sechs Monaten nach dem Tag, an dem die Eintragung der Verschmelzung in das Register des Sitzes desjenigen Rechtsträgers, dessen Gläubiger sie sind, nach § 19 Absatz 3 UmwG als bekanntgemacht gilt, ihren Anspruch nach Grund und Höhe schriftlich anmelden, Sicherheit zu leisten, soweit sie nicht Befriedigung verlangen können. Dieses Recht steht den Gläubigern jedoch nur zu, wenn sie glaubhaft machen, dass durch die Verschmelzung die Erfüllung ihrer Forderung gefährdet wird."
    },
    {
      "date": "2025-12-12",
      "id": "139904",
      "original_text": "Registerbekanntmachung nach dem Umwandlungsgesetz\nNordrhein-Westfalen Amtsgericht Bochum HRB 21660\nS & H Verwaltungs GmbH – Bochum",
      "type": "Registerbekanntmachung nach dem Umwandlungsgesetz",
      "state": "Nordrhein-Westfalen",
      "amtsgericht": "Amtsgericht Bochum",
      "registernummer": "HRB 21660",
      "registerart": "HRB",
      "company_name": "S & H Verwaltungs GmbH",
      "company_seat": "Bochum",
      "details": "12.12.2025 (Bekanntmachungsdatum)\n\nNordrhein-Westfalen Amtsgericht Bochum HRB 21660\nRegisterbekanntmachung nach dem Umwandlungsgesetz 11.12.2025 (Eintragungsdatum)\n\nS & H Verwaltungs GmbH\nGesellschaft mit beschränkter Haftung\nBochum\n\nDie Gesellschaft hat Gläubigern, deren Forderungen vor dieser Bekanntmachung begründet worden sind, Sicherheit zu leisten, soweit sie nicht Befriedigung verlangen können, wenn sie sich binnen sechs Monaten zu diesem Zweck melden."
    },
    {
      "date": "2025-12-12",
      "id": "139905",
      "original_text": "Registerbekanntmachung nach dem Umwandlungsgesetz\nNordrhein-Westfalen Amtsgericht Essen PR 3505\nKlaus Gasch & Marcel Geffe & Conny Ehmer Steuerberater Partnerschaft mbB – Nettetal",
      "type": "Registerbekanntmachung nach dem Umwandlungsgesetz",
      "state": "Nordrhein-Westfalen",
      "amtsgericht": "Amtsgericht Essen",
      "registernummer": "PR 3505",
      "registerart": "PR",
      "company_name": "Klaus Gasch & Marcel Geffe & Conny Ehmer Steuerberater Partnerschaft mbB",
      "company_seat": "Nettetal",
      "details": "12.12.2025 (Bekanntmachungsdatum)\n\nNordrhein-Westfalen Amtsgericht Essen PR 3505\nRegisterbekanntmachung nach dem Umwandlungsgesetz 12.12.2025 (Eintragungsdatum)\n\nKlaus Gasch & Marcel Geffe & Conny Ehmer Steuerberater Partnerschaft mbB\nPartnerschaftsgesellschaft\nNettetal\n\nDen Gläubigern der an der formwechselnden Umwandlung beteiligten Rechtsträger ist, wenn sie binnen sechs Monaten nach dem Tag, an dem die Eintragung der formwechselnden Umwandlung in das Register des Sitzes desjenigen Rechtsträgers, dessen Gläubiger sie sind, nach § 19 Absatz 3 UmwG als bekanntgemacht gilt, ihren Anspruch nach Grund und Höhe schriftlich anmelden, Sicherheit zu leisten, soweit sie nicht Befriedigung verlangen können. Dieses Recht steht den Gläubigern jedoch nur zu, wenn sie glaubhaft machen, dass durch die formwechselnden Umwandlung die Erfüllung ihrer Forderung gefährdet wird."
    },
    {
      "date": "2025-12-12",
      "id": "139906",
      "original_text": "Löschungsankündigung\nNordrhein-Westfalen Amtsgericht Aachen HRA 5158\nEggerath GmbH & Co KG – Heinsberg",
      "type": "Löschungsankündigung",
      "state": "Nordrhein-Westfalen",
      "amtsgericht": "Amtsgericht Aachen",
      "registernummer": "HRA 5158",
      "registerart": "HRA",
      "company_name": "Eggerath GmbH & Co KG",
      "company_seat": "Heinsberg",
      "details": "12.12.2025 (Bekanntmachungsdatum)\n\nNordrhein-Westfalen Amtsgericht Aachen HRA 5158\nLöschungsankündigung\n\nEggerath GmbH & Co KG\nKommanditgesellschaft\nHeinsberg\n\nDas Registergericht beabsichtigt, von Amts wegen die Gesellschaft wegen Vermögenslosigkeit nach § 394 FamFG zu löschen, weil das Insolvenzverfahren Amtsgericht Aachen (Az.: 92 IN 152/06) beendet und Vermögen der Gesellschaft nicht mehr erkennbar ist.\n\nZur Geltendmachung des Widerspruchs gegen die beabsichtigte Löschung wird hiermit eine Frist von einem Monat ab Veröffentlichung dieser Ankündigung bestimmt.\n\nRechtsbehelfsbelehrung:\n\nGegen diese Verfügung kann Widerspruch eingelegt werden. Zum Widerspruch ist jeder berechtigt, der an der Unterlassung der Löschung ein berechtigtes Interesse hat.\n\nDer Widerspruch ist bei dem Amtsgericht Aachen, Adalbertsteinweg 92, 52070 Aachen schriftlich in deutscher Sprache oder zur Niederschrift der Geschäftsstelle einzulegen. Der Widerspruch kann auch zur Niederschrift der Geschäftsstelle eines jeden Amtsgerichtes abgegeben werden.\n\nDer Widerspruch muss spätestens innerhalb der gesetzten Frist nach der Bekanntgabe der Verfügung bei dem Amtsgericht Aachen eingegangen sein. Dies gilt auch dann, wenn der Widerspruch zur Niederschrift der Geschäftsstelle eines anderen Amtsgerichtes abgegeben wurde. Die Frist beginnt mit der Bekanntgabe der Verfügung durch Veröffentlichung. Fällt das Ende der Frist auf einen Sonntag, einen allgemeinen Feiertag oder Sonnabend, so endet die Frist mit Ablauf des nächsten Werktages.\n\nDer Widerspruch muss die Bezeichnung der angefochtenen Verfügung sowie die Erklärung enthalten, dass Widerspruch gegen diese Verfügung eingelegt wird. Er ist zu unterzeichnen und soll begründet werden.\n\nDie Einlegung ist auch durch Übertragung eines elektronischen Dokuments an die elektronische Poststelle des Gerichts möglich. Das elektronische Dokument muss für die Bearbeitung durch das Gericht geeignet und mit einer qualifizierten elektronischen Signatur der verantwortenden Person versehen sein oder von der verantwortenden Person signiert und auf einem sicheren Übermittlungsweg gemäß § 130 a ZPO nach näherer Maßgabe der Verordnung über die technischen Rahmenbedingungen des elektronischen Rechtsverkehrs und über das besondere elektronische Behördenpostfach (BGBl. I, S. 3803) eingereicht werden. Weitere Informationen erhalten Sie auf der Internetseite www.justiz.de."
    },
    {
      "date": "2025-12-12",
      "id": "139907",
      "original_text": "Löschungsankündigung\nNordrhein-Westfalen Amtsgericht Siegburg HRB 14272\nH. C. Warenhandel und Logistik UG (haftungsbeschränkt) – Niederkassel",
      "type": "Löschungsankündigung",
      "state": "Nordrhein-Westfalen",
      "amtsgericht": "Amtsgericht Siegburg",
      "registernummer": "HRB 14272",
      "registerart": "HRB",
      "company_name": "H. C. Warenhandel und Logistik UG (haftungsbeschränkt)",
      "company_seat": "Niederkassel",
      "details": "12.12.2025 (Bekanntmachungsdatum)\n\nNordrhein-Westfalen Amtsgericht Siegburg HRB 14272\nLöschungsankündigung\n\nH. C. Warenhandel und Logistik UG (haftungsbeschränkt)\nGesellschaft mit beschränkter Haftung\nNiederkassel\n\nDas Registergericht hat glaubhafte Kenntnis erlangt, dass die Gesellschaft vermögenslos geworden ist, da ein Insolvenzeröffnungsantrag mangels Masse nach § 26 InsO zurückgewiesen wurde.\n\nEs ist daher beabsichtigt, die Gesellschaft nach § 394 FamFG im Handelsregister wegen Vermögenslosigkeit zu löschen.\n\nEinwände gegen die Löschung sind durch Widerspruch binnen einer Frist von 3 Monaten geltend zu machen, andernfalls die Löschung erfolgen wird.\n\nEinzulegen ist der Widerspruch bei dem Amtsgericht Siegburg, Neue Poststraße 16, 53721 Siegburg, und zwar entweder schriftlich in deutscher Sprache oder mündlich zur Niederschrift der Geschäftsstelle. Der Widerspruch kann auch zur Niederschrift der Geschäftsstelle eines jeden Amtsgerichts abgegeben werden. Der Widerspruch ist binnen der in der Verfügung bestimmten Frist einzulegen. Die Frist ist nur gewahrt, wenn der Widerspruch rechtzeitig bei dem Amtsgericht Siegburg eingeht, auch wenn der Widerspruch zur Niederschrift der Geschäftsstelle eines anderen Amtsgerichts abgegeben wurde. Die Frist beginnt jeweils mit der schriftlichen Bekanntgabe der Verfügung an die Beteiligten. Kann die schriftliche Bekanntgabe an einen Beteiligten nicht bewirkt werden, beginnt die Frist spätestens mit Ablauf von fünf Monaten nach Erlass der Verfügung. Die Bekanntgabe ist entweder durch Zustellung oder am dritten Tage nach Aufgabe zur Post bewirkt. Sofern die Löschung noch nicht erfolgt ist, kann der Widerspruch auch noch nach Ablauf der Frist eingelegt werden. Fällt das Ende der Frist auf einen Sonnabend, einen Sonntag oder einen allgemeinen Feiertag, endet die Frist mit Ablauf des nächsten Werktages. Der Widerspruch ist zu unterzeichnen. Eine Begründung des Widerspruchs ist nicht vorgeschrieben."
    },
    {
      "date": "2025-12-12",
      "id": "139908",
      "original_text": "Registerbekanntmachung nach dem Umwandlungsgesetz\nNordrhein-Westfalen Amtsgericht Iserlohn HRB 1802\nLobbe Deutschland Geschäftsführung GmbH – Iserlohn",
      "type": "Registerbekanntmachung nach dem Umwandlungsgesetz",
      "state": "Nordrhein-Westfalen",
      "amtsgericht": "Amtsgericht Iserlohn",
      "registernummer": "HRB 1802",
      "registerart": "HRB",
      "company_name": "Lobbe Deutschland Geschäftsführung GmbH",
      "company_seat": "Iserlohn",
      "details": "12.12.2025 (Bekanntmachungsdatum)\n\nNordrhein-Westfalen Amtsgericht Iserlohn HRB 1802\nRegisterbekanntmachung nach dem Umwandlungsgesetz 11.12.2025 (Eintragungsdatum)\n\nLobbe Deutschland Geschäftsführung GmbH\nGesellschaft mit beschränkter Haftung\nIserlohn\n\nDen Gläubigern der an der Verschmelzung beteiligten Rechtsträger ist, wenn sie binnen sechs Monaten nach dem Tag, an dem die Eintragung der Verschmelzung in das Register des Sitzes desjenigen Rechtsträgers, dessen Gläubiger sie sind, nach § 19 Absatz 3 UmwG als bekanntgemacht gilt, ihren Anspruch nach Grund und Höhe schriftlich anmelden, Sicherheit zu leisten, soweit sie nicht Befriedigung verlangen können. Dieses Recht steht den Gläubigern jedoch nur zu, wenn sie glaubhaft machen, dass durch die Verschmelzung die Erfüllung ihrer Forderung gefährdet wird."
    },
    {
      "date": "2025-12-12",
      "id": "139909",
      "original_text": "Sonstige Registerbekanntmachung\nNordrhein-Westfalen Amtsgericht Düsseldorf HRB 65260\nLindopharm GmbH – Hilden",
      "type": "Sonstige Registerbekanntmachung",
      "state": "Nordrhein-Westfalen",
      "amtsgericht": "Amtsgericht Düsseldorf",
      "registernummer": "HRB 65260",
      "registerart": "HRB",
      "company_name": "Lindopharm GmbH",
      "company_seat": "Hilden",
      "details": "12.12.2025 (Bekanntmachungsdatum)\n\nNordrhein-Westfalen Amtsgericht Düsseldorf HRB 65260\nSonstige Registerbekanntmachung 12.12.2025 (Eintragungsdatum)\n\nLindopharm GmbH\nGesellschaft mit beschränkter Haftung\nHilden\n\nAls nicht eingetragen wird veröffentlicht: Den Gläubigern der Gesellschaft, deren Forderungen begründet worden sind bevor die Eintragung der Beendigung des Gewinnabführungsvertrages  in das Handelsregister nach § 10 des Handelsgesetzbuches als bekanntgemacht gilt, hat der andere Vertragsteil Sicherheit zu leisten, wenn sie sich binnen sechs Monaten nach der Bekanntmachung der Eintragung zu diesem Zweck bei ihm melden."
    },
    {
      "date": "2025-12-12",
      "id": "139910",
      "original_text": "Löschungsankündigung\nNordrhein-Westfalen Amtsgericht Duisburg HRB 34967\nMVF Service GmbH – Duisburg",
      "type": "Löschungsankündigung",
      "state": "Nordrhein-Westfalen",
      "amtsgericht": "Amtsgericht Duisburg",
      "registernummer": "HRB 34967",
      "registerart": "HRB",
      "company_name": "MVF Service GmbH",
      "company_seat": "Duisburg",
      "details": "12.12.2025 (Bekanntmachungsdatum)\n\nNordrhein-Westfalen Amtsgericht Duisburg HRB 34967\nLöschungsankündigung\n\nMVF Service GmbH\nGesellschaft mit beschränkter Haftung\nDuisburg\n\nHRB 34967\nMVF Service GmbH,\nDuisburg,\nJägerstraße 68, 47166 Duisburg.\nDas Registergericht beabsichtigt, die im Handelsregister eingetragene Gesellschaft gemäß § 394 Absatz 1 FamFG wegen Vermögenslosigkeit von Amts wegen zu löschen. Gegen diese Verfügung kann Widerspruch eingelegt werden. Die Frist zur Erhebung eines Widerspruchs gegen die beabsichtigte Löschung von Amts wegen ist auf drei Monate festgesetzt. Rechtsbehelfsbelehrung Der Widerspruch ist bei dem Amtsgericht Duisburg, Kardinal-Galen-Str. 124-132, 47058 Duisburg schriftlich in deutscher Sprache oder zur Niederschrift der Geschäftsstelle einzulegen. Der Widerspruch kann auch zur Niederschrift der Geschäftsstelle eines jeden Amtsgerichtes abgegeben werden. Die Einlegung ist auch durch Übertragung eines elektronischen Dokuments an die elektronische Poststelle des Gerichts möglich. Das elektronische Dokument muss für die Bearbeitung durch das Gericht geeignet und mit einer qualifizierten elektronischen Signatur der verantwortenden Person versehen sein oder von der verantwortenden Person signiert und auf einem sicheren Übermittlungsweg gemäß § 130 a ZPO nach näherer Maßgabe der Verordnung über die technischen Rahmenbedingungen des elektronischen Rechtsverkehrs und über das besondere elektronische Behördenpostfach (BGBl. I, S. 3803) eingereicht werden. Weitere Informationen erhalten Sie auf der Internetseite www.justiz.de <http://www.justiz.de>. Der Widerspruch muss spätestens innerhalb der gesetzten Frist bei dem Amtsgericht Duisburg eingegangen sein. Dies gilt auch dann, wenn der Widerspruch zur Niederschrift der Geschäftsstelle eines anderen Amtsgerichtes abgegeben wurde. Die Frist beginnt mit der Veröffentlichung. Fällt das Ende der Frist auf einen Sonntag, einen allgemeinen Feiertag oder Sonnabend, so endet die Frist mit Ablauf des nächsten Werktages. Der Widerspruch muss die Bezeichnung der angefochtenen Verfügung sowie die Erklärung enthalten, dass Widerspruch gegen diese Verfügung eingelegt wird. Er ist zu unterzeichnen und soll begründet werden."
    },
    {
      "date": "2025-12-12",
      "id": "139911",
      "original_text": "Löschungsankündigung\nNordrhein-Westfalen Amtsgericht Bochum HRB 11065\nManss Fruchtimport Bochum GmbH – Bochum",
      "type": "Löschungsankündigung",
      "state": "Nordrhein-Westfalen",
      "amtsgericht": "Amtsgericht Bochum",
      "registernummer": "HRB 11065",
      "registerart": "HRB",
      "company_name": "Manss Fruchtimport Bochum GmbH",
      "company_seat": "Bochum",
      "details": "12.12.2025 (Bekanntmachungsdatum)\n\nNordrhein-Westfalen Amtsgericht Bochum HRB 11065\nLöschungsankündigung 15.12.2025 (Eintragungsdatum)\n\nManss Fruchtimport Bochum GmbH\nGesellschaft mit beschränkter Haftung\nBochum\n\nDas Registergericht beabsichtigt die Gesellschaft von Amts wegen nach § 394 FamFG zu löschen. Die Frist zur Erhebung eines Widerspruchs ist auf drei Monate festgesetzt."
    },
    {
      "date": "2025-12-12",
      "id": "139912",
      "original_text": "Registerbekanntmachung nach dem Umwandlungsgesetz\nNordrhein-Westfalen Amtsgericht Wuppertal HRB 19188\nDoppstadt Beteiligungs GmbH – Velbert",
      "type": "Registerbekanntmachung nach dem Umwandlungsgesetz",
      "state": "Nordrhein-Westfalen",
      "amtsgericht": "Amtsgericht Wuppertal",
      "registernummer": "HRB 19188",
      "registerart": "HRB",
      "company_name": "Doppstadt Beteiligungs GmbH",
      "company_seat": "Velbert",
      "details": "12.12.2025 (Bekanntmachungsdatum)\n\nNordrhein-Westfalen Amtsgericht Wuppertal HRB 19188\nRegisterbekanntmachung nach dem Umwandlungsgesetz 12.12.2025 (Eintragungsdatum)\n\nDoppstadt Beteiligungs GmbH\nGesellschaft mit beschränkter Haftung\nVelbert\n\nDen Gläubigern der an der Verschmelzung beteiligten Rechtsträger ist, wenn sie binnen sechs Monaten nach dem Tag, an dem die Eintragung der Verschmelzung in das Register des Sitzes derjenigen Rechtsträger deren Gläubiger sie sind, nach § 19 Absatz 3 UmwG als bekanntgemacht gilt, ihren Anspruch nach Grund und Höhe schriftlich anmelden, Sicherheit zu leisten, soweit sie nicht Befriedigung verlangen können. Dieses Recht steht den Gläubigern jedoch nur zu, wenn sie glaubhaft machen, dass durch die Verschmelzung die Erfüllung ihrer Forderung gefährdet wird."
    },
    {
      "date": "2025-12-12",
      "id": "139913",
      "original_text": "Registerbekanntmachung nach dem Umwandlungsgesetz\nNordrhein-Westfalen Amtsgericht Köln HRB 62028\nedvXpert GmbH – Köln",
      "type": "Registerbekanntmachung nach dem Umwandlungsgesetz",
      "state": "Nordrhein-Westfalen",
      "amtsgericht": "Amtsgericht Köln",
      "registernummer": "HRB 62028",
      "registerart": "HRB",
      "company_name": "edvXpert GmbH",
      "company_seat": "Köln",
      "details": "12.12.2025 (Bekanntmachungsdatum)\n\nNordrhein-Westfalen Amtsgericht Köln HRB 62028\nRegisterbekanntmachung nach dem Umwandlungsgesetz 12.12.2025 (Eintragungsdatum)\n\nedvXpert GmbH\nGesellschaft mit beschränkter Haftung\nKöln\n\nDen Gläubigern der an der Verschmelzung beteiligten Rechtsträger ist, wenn sie binnen sechs Monaten nach dem Tag, an dem die Eintragung der Verschmelzung in das Register des Sitzes desjenigen Rechtsträgers, dessen Gläubiger sie sind, nach § 19 Absatz 3 UmwG als bekanntgemacht gilt, ihren Anspruch nach Grund und Höhe schriftlich anmelden, Sicherheit zu leisten, soweit sie nicht Befriedigung verlangen können. Dieses Recht steht den Gläubigern jedoch nur zu, wenn sie glaubhaft machen, dass durch die Verschmelzung die Erfüllung ihrer Forderung gefährdet wird."
    },
    {
      "date": "2025-12-12",
      "id": "139914",
      "original_text": "Löschungsankündigung\nNordrhein-Westfalen Amtsgericht Steinfurt HRB 13976\nGräter GmbH – Lotte",
      "type": "Löschungsankündigung",
      "state": "Nordrhein-Westfalen",
      "amtsgericht": "Amtsgericht Steinfurt",
      "registernummer": "HRB 13976",
      "registerart": "HRB",
      "company_name": "Gräter GmbH",
      "company_seat": "Lotte",
      "details": "12.12.2025 (Bekanntmachungsdatum)\n\nNordrhein-Westfalen Amtsgericht Steinfurt HRB 13976\nLöschungsankündigung 12.12.2025 (Eintragungsdatum)\n\nGräter GmbH\nGesellschaft mit beschränkter Haftung\nLotte\n\nDas Registergericht beabsichtigt, die im Handelsregister eingetragene Gesellschaft gemäß § 394 Absatz 1 FamFG wegen Vermögenslosigkeit von Amts wegen zu löschen.\n\nGegen diese Verfügung kann Widerspruch eingelegt werden. Die Frist zur Erhebung eines Widerspruchs gegen die beabsichtigte Löschung von Amts wegen ist auf einen Monat festgesetzt.\n\nRechtsbehelfsbelehrung:\n\nGegen diese Verfügung können Sie Widerspruch einlegen.\n\nDer Widerspruch ist bei dem Amtsgericht Steinfurt, Gerichtstraße 2, 48565 Steinfurt schriftlich in deutscher Sprache oder zur Niederschrift der Geschäftsstelle einzulegen. Der Widerspruch kann auch zur Niederschrift der Geschäftsstelle eines jeden Amtsgerichtes abgegeben werden.\nDie Einlegung ist auch durch Übertragung eines elektronischen Dokuments an die elektronische Poststelle des Gerichts möglich. Das elektronische Dokument muss für die Bearbeitung durch das Gericht geeignet und mit einer qualifizierten elektronischen Signatur der verantwortenden Person versehen sein oder von der verantwortenden Person signiert und auf einem sicheren Übermittlungsweg gemäß § 130 aZPO nach näherer Maßgabe der Verordnung über die technischen Rahmenbedingungen des elektronischen Rechtsverkehrs und über das besondere elektronische Behördenpostfach (BGBl. I, S.3803) eingereicht werden. Weitere Informationen erhalten Sie auf der Internetseite www.justiz.de.\n\nDer Widerspruch muss spätestens innerhalb der gesetzten Frist bei dem Amtsgericht Steinfurt eingegangen sein. Dies gilt auch dann, wenn der Widerspruch zur Niederschrift der Geschäftsstelle eines anderen Amtsgerichtes abgegeben wurde. Die Frist beginnt mit der Veröffentlichung. Fällt das Ende der Frist auf einen Sonntag, einen allgemeinen Feiertag oder Sonnabend, so endet die Frist mit Ablauf des nächsten Werktages.\n\nDer Widerspruch muss die Bezeichnung der angefochtenen Verfügung sowie die Erklärung enthalten, dass Widerspruch gegen diese Verfügung eingelegt wird. Er ist zu unterzeichnen und soll begründet werden."
    },
    {
      "date": "2025-12-12",
      "id": "139915",
      "original_text": "Löschungsankündigung\nNordrhein-Westfalen Amtsgericht Bochum HRB 22493\nMako Bau GmbH – Bochum",
      "type": "Löschungsankündigung",
      "state": "Nordrhein-Westfalen",
      "amtsgericht": "Amtsgericht Bochum",
      "registernummer": "HRB 22493",
      "registerart": "HRB",
      "company_name": "Mako Bau GmbH",
      "company_seat": "Bochum",
      "details": "12.12.2025 (Bekanntmachungsdatum)\n\nNordrhein-Westfalen Amtsgericht Bochum HRB 22493\nLöschungsankündigung\n\nMako Bau GmbH\nGesellschaft mit beschränkter Haftung\nBochum\n\nDas Registergericht beabsichtigt die Gesellschaft von Amts wegen nach § 394 FamFG zu löschen. Die Frist zur Erhebung eines Widerspruchs ist auf drei Monate festgesetzt."
    },
    {
      "date": "2025-12-12",
      "id": "139916",
      "original_text": "Einreichung neuer Dokumente\nNordrhein-Westfalen Amtsgericht Essen HRB 26867\nDeutsche Arzt AG – Essen",
      "type": "Einreichung neuer Dokumente",
      "state": "Nordrhein-Westfalen",
      "amtsgericht": "Amtsgericht Essen",
      "registernummer": "HRB 26867",
      "registerart": "HRB",
      "company_name": "Deutsche Arzt AG",
      "company_seat": "Essen",
      "details": "12.12.2025 (Bekanntmachungsdatum)\n\nNordrhein-Westfalen Amtsgericht Essen HRB 26867\nEinreichung neuer Dokumente\n\nDeutsche Arzt AG\nAktiengesellschaft\nEssen\n\nDem Registergericht ist eine neue Liste der Mitglieder des Aufsichtsrates eingereicht worden."
    },
    {
      "date": "2025-12-12",
      "id": "139917",
      "original_text": "Sonstige Registerbekanntmachung\nNordrhein-Westfalen Amtsgericht Gelsenkirchen HRB 9576\nSpieloase Gelsen GmbH – Gelsenkirchen",
      "type": "Sonstige Registerbekanntmachung",
      "state": "Nordrhein-Westfalen",
      "amtsgericht": "Amtsgericht Gelsenkirchen",
      "registernummer": "HRB 9576",
      "registerart": "HRB",
      "company_name": "Spieloase Gelsen GmbH",
      "company_seat": "Gelsenkirchen",
      "details": "12.12.2025 (Bekanntmachungsdatum)\n\nNordrhein-Westfalen Amtsgericht Gelsenkirchen HRB 9576\nSonstige Registerbekanntmachung 12.12.2025 (Eintragungsdatum)\n\nSpieloase Gelsen GmbH\nGesellschaft mit beschränkter Haftung\nGelsenkirchen\n\nAls nicht eingetragen wird veröffentlicht: Den Gläubigern der Gesellschaft, deren Forderungen begründet worden sind bevor die Eintragung der Beendigung des Gewinnabführungsvertrages  in das Handelsregister nach § 10 des Handelsgesetzbuches als bekanntgemacht gilt, hat der andere Vertragsteil Sicherheit zu leisten, wenn sie sich binnen sechs Monaten nach der Bekanntmachung der Eintragung zu diesem Zweck bei ihm melden."
    },
    {
      "date": "2025-12-12",
      "id": "139918",
      "original_text": "Einreichung neuer Dokumente\nHessen Amtsgericht Frankfurt am Main HRB 74732\nTechem Energy Services GmbH – Eschborn",
      "type": "Einreichung neuer Dokumente",
      "state": "Hessen",
      "amtsgericht": "Amtsgericht Frankfurt am Main",
      "registernummer": "HRB 74732",
      "registerart": "HRB",
      "company_name": "Techem Energy Services GmbH",
      "company_seat": "Eschborn",
      "details": "12.12.2025 (Bekanntmachungsdatum)\n\nHessen Amtsgericht Frankfurt am Main HRB 74732\nEinreichung neuer Dokumente\n\nTechem Energy Services GmbH\nGesellschaft mit beschränkter Haftung\nEschborn\n\nDurch eine Änderung in den Personen der Aufsichtsratsmitglieder ist eine Liste der Mitglieder des Aufsichtsrates zum Handelsregister eingereicht worden."
    },
    {
      "date": "2025-12-12",
      "id": "139919",
      "original_text": "Registerbekanntmachung nach dem Umwandlungsgesetz\nHessen Amtsgericht Darmstadt GsR 880\nBoliwer Games-Nachfolge eGbR – Lampertheim",
      "type": "Registerbekanntmachung nach dem Umwandlungsgesetz",
      "state": "Hessen",
      "amtsgericht": "Amtsgericht Darmstadt",
      "registernummer": "GsR 880",
      "registerart": "GsR",
      "company_name": "Boliwer Games-Nachfolge eGbR",
      "company_seat": "Lampertheim",
      "details": "12.12.2025 (Bekanntmachungsdatum)\n\nHessen Amtsgericht Darmstadt GsR 880\nRegisterbekanntmachung nach dem Umwandlungsgesetz 12.12.2025 (Eintragungsdatum)\n\nBoliwer Games-Nachfolge eGbR\nGesellschaft bürgerlichen Rechts\nLampertheim\n\nDen Gläubigern der an der formwechselnden Umwandlung beteiligten Rechtsträger ist, wenn sie binnen sechs Monaten nach dem Tag, an dem die Eintragung der formwechselnden Umwandlung in das Register des Sitzes desjenigen Rechtsträgers, dessen Gläubiger sie sind, nach § 201 UmwG bekannt gemacht worden ist, ihren Anspruch nach Grund und Höhe schriftlich anmelden, Sicherheit zu leisten, soweit sie nicht Befriedigung verlangen können. Dieses Recht steht den Gläubigern jedoch nur zu, wenn sie glaubhaft machen, dass durch die formwechselnden Umwandlung die Erfüllung ihrer Forderung gefährdet wird."
    },
    {
      "date": "2025-12-12",
      "id": "139920",
      "original_text": "Löschungsankündigung\nHessen Amtsgericht Frankfurt am Main HRB 126422\nCSS Fintech GmbH – Frankfurt am Main",
      "type": "Löschungsankündigung",
      "state": "Hessen",
      "amtsgericht": "Amtsgericht Frankfurt am Main",
      "registernummer": "HRB 126422",
      "registerart": "HRB",
      "company_name": "CSS Fintech GmbH",
      "company_seat": "Frankfurt am Main",
      "details": "12.12.2025 (Bekanntmachungsdatum)\n\nHessen Amtsgericht Frankfurt am Main HRB 126422\nLöschungsankündigung\n\nCSS Fintech GmbH\nGesellschaft mit beschränkter Haftung\nFrankfurt am Main\n\nDas Registergericht beabsichtigt, den Geschäftsführer der Gesellschaft, Herrn Christian Rudolph, gemäß § 395 FamFG von Amtswegen im Handelsregister zu löschen. Hiergegen kann innerhalb von vier Wochen nach dieser Veröffentlichung Widerspruch bei dem Amtsgericht Frankfurt am Main eingelegt werden. Nach Ablauf der Frist erfolgt die Löschung des Geschäftsführers."
    },
    {
      "date": "2025-12-12",
      "id": "139921",
      "original_text": "Einreichung neuer Dokumente\nHessen Amtsgericht Frankfurt am Main HRB 120941\nRegionalverkehre Start Deutschland GmbH – Frankfurt am Main",
      "type": "Einreichung neuer Dokumente",
      "state": "Hessen",
      "amtsgericht": "Amtsgericht Frankfurt am Main",
      "registernummer": "HRB 120941",
      "registerart": "HRB",
      "company_name": "Regionalverkehre Start Deutschland GmbH",
      "company_seat": "Frankfurt am Main",
      "details": "12.12.2025 (Bekanntmachungsdatum)\n\nHessen Amtsgericht Frankfurt am Main HRB 120941\nEinreichung neuer Dokumente\n\nRegionalverkehre Start Deutschland GmbH\nGesellschaft mit beschränkter Haftung\nFrankfurt am Main\n\nDurch eine Änderung in den Personen der Aufsichtsratsmitglieder ist eine Liste der Mitglieder des Aufsichtsrates zum Handelsregister eingereicht worden."
    }
  ]
}