{
  "date": "2025-12-06",
  "date_of_scrape": "2025-12-07T04:15:45.843Z",
  "tool_version": "0.2.0",
  "number_of_announcements": 23,
  "announcements": [
    {
      "date": "2025-12-06",
      "id": "139314",
      "original_text": "Registerbekanntmachung nach dem Umwandlungsgesetz\nBayern Amtsgericht Landshut HRB 3024\nBachhuber GmbH – Gangkofen, Ortsteil Obertrennbach",
      "type": "Registerbekanntmachung nach dem Umwandlungsgesetz",
      "state": "Bayern",
      "amtsgericht": "Amtsgericht Landshut",
      "registernummer": "HRB 3024",
      "registerart": "HRB",
      "company_name": "Bachhuber GmbH",
      "company_seat": "Gangkofen, Ortsteil Obertrennbach",
      "details": "06.12.2025 (Bekanntmachungsdatum)\n\nBayern Amtsgericht Landshut HRB 3024\nRegisterbekanntmachung nach dem Umwandlungsgesetz 05.12.2025 (Eintragungsdatum)\n\nBachhuber GmbH\nGesellschaft mit beschränkter Haftung\nGangkofen, Ortsteil Obertrennbach\n\nDen Gläubigern der an der Verschmelzung beteiligten Rechtsträger ist, wenn sie binnen sechs Monaten nach dem Tag, an dem die Eintragung der Verschmelzung in das Register des Sitzes desjenigen Rechtsträgers, dessen Gläubiger sie sind, nach § 19 Abs. 3 UmwG als bekannt gemacht gilt, ihren Anspruch nach Grund und Höhe in Textform anmelden, Sicherheit zu leisten, soweit sie nicht Befriedigung verlangen können. Dieses Recht steht den Gläubigern jedoch nur zu, wenn sie glaubhaft machen, dass durch die Verschmelzung die Erfüllung ihrer Forderung gefährdet wird."
    },
    {
      "date": "2025-12-06",
      "id": "139315",
      "original_text": "Registerbekanntmachung nach dem Umwandlungsgesetz\nBayern Amtsgericht München HRB 302636\nhabermeyer.holding GmbH – Peißenberg",
      "type": "Registerbekanntmachung nach dem Umwandlungsgesetz",
      "state": "Bayern",
      "amtsgericht": "Amtsgericht München",
      "registernummer": "HRB 302636",
      "registerart": "HRB",
      "company_name": "habermeyer.holding GmbH",
      "company_seat": "Peißenberg",
      "details": "06.12.2025 (Bekanntmachungsdatum)\n\nBayern Amtsgericht München HRB 302636\nRegisterbekanntmachung nach dem Umwandlungsgesetz 05.12.2025 (Eintragungsdatum)\n\nhabermeyer.holding GmbH\nGesellschaft mit beschränkter Haftung\nPeißenberg\n\nDen Gläubigern der an der Spaltung beteiligten Rechtsträger ist, wenn sie binnen sechs Monaten nach dem Tag, an dem die Eintragung der Spaltung in das Register des Sitzes desjenigen Rechtsträgers, dessen Gläubiger sie sind, nach §§ 125, 19 Abs. 3 UmwG als bekannt gemacht gilt, ihren Anspruch nach Grund und Höhe in Textform anmelden, Sicherheit zu leisten, soweit sie nicht Befriedigung verlangen können. Dieses Recht steht den Gläubigern jedoch nur zu, wenn sie glaubhaft machen, dass durch die Spaltung die Erfüllung ihrer Forderung gefährdet wird."
    },
    {
      "date": "2025-12-06",
      "id": "139316",
      "original_text": "Registerbekanntmachung nach dem Umwandlungsgesetz\nBayern Amtsgericht München HRB 302636\nhabermeyer.holding GmbH – Peißenberg",
      "type": "Registerbekanntmachung nach dem Umwandlungsgesetz",
      "state": "Bayern",
      "amtsgericht": "Amtsgericht München",
      "registernummer": "HRB 302636",
      "registerart": "HRB",
      "company_name": "habermeyer.holding GmbH",
      "company_seat": "Peißenberg",
      "details": "06.12.2025 (Bekanntmachungsdatum)\n\nBayern Amtsgericht München HRB 302636\nRegisterbekanntmachung nach dem Umwandlungsgesetz 05.12.2025 (Eintragungsdatum)\n\nhabermeyer.holding GmbH\nGesellschaft mit beschränkter Haftung\nPeißenberg\n\nDen Gläubigern der an der Spaltung beteiligten Rechtsträger ist, wenn sie binnen sechs Monaten nach dem Tag, an dem die Eintragung der Spaltung in das Register des Sitzes desjenigen Rechtsträgers, dessen Gläubiger sie sind, nach §§ 125, 19 Abs. 3 UmwG als bekannt gemacht gilt, ihren Anspruch nach Grund und Höhe in Textform anmelden, Sicherheit zu leisten, soweit sie nicht Befriedigung verlangen können. Dieses Recht steht den Gläubigern jedoch nur zu, wenn sie glaubhaft machen, dass durch die Spaltung die Erfüllung ihrer Forderung gefährdet wird.Den Gläubigern der an der Spaltung beteiligten Rechtsträger ist, wenn sie binnen sechs Monaten nach dem Tag, an dem die Eintragung der Spaltung in das Register des Sitzes desjenigen Rechtsträgers, dessen Gläubiger sie sind, nach §§ 125, 19 Abs. 3 UmwG als bekannt gemacht gilt, ihren Anspruch nach Grund und Höhe in Textform anmelden, Sicherheit zu leisten, soweit sie nicht Befriedigung verlangen können. Dieses Recht steht den Gläubigern jedoch nur zu, wenn sie glaubhaft machen, dass durch die Spaltung die Erfüllung ihrer Forderung gefährdet wird."
    },
    {
      "date": "2025-12-06",
      "id": "139317",
      "original_text": "Löschungsankündigung\nBayern Amtsgericht Bayreuth HRB 2955\nAZB Erste Vermögensverwaltungsgesellschaft mbH – Kasendorf",
      "type": "Löschungsankündigung",
      "state": "Bayern",
      "amtsgericht": "Amtsgericht Bayreuth",
      "registernummer": "HRB 2955",
      "registerart": "HRB",
      "company_name": "AZB Erste Vermögensverwaltungsgesellschaft mbH",
      "company_seat": "Kasendorf",
      "details": "06.12.2025 (Bekanntmachungsdatum)\n\nBayern Amtsgericht Bayreuth HRB 2955\nLöschungsankündigung\n\nAZB Erste Vermögensverwaltungsgesellschaft mbH\nGesellschaft mit beschränkter Haftung\nKasendorf\n\nDas Registergericht beabsichtigt, die im Handelsregister eingetragene Gesellschaft wegen Vermögenslosigkeit von Amts wegen nach § 394 FamFG zu löschen. Die Frist zur Erhebung eines Widerspruchs ist auf einen Monat festgesetzt."
    },
    {
      "date": "2025-12-06",
      "id": "139318",
      "original_text": "Registerbekanntmachung nach dem Umwandlungsgesetz\nBayern Amtsgericht München HRB 264568\nSomething Technology GmbH – Starnberg",
      "type": "Registerbekanntmachung nach dem Umwandlungsgesetz",
      "state": "Bayern",
      "amtsgericht": "Amtsgericht München",
      "registernummer": "HRB 264568",
      "registerart": "HRB",
      "company_name": "Something Technology GmbH",
      "company_seat": "Starnberg",
      "details": "06.12.2025 (Bekanntmachungsdatum)\n\nBayern Amtsgericht München HRB 264568\nRegisterbekanntmachung nach dem Umwandlungsgesetz 05.12.2025 (Eintragungsdatum)\n\nSomething Technology GmbH\nGesellschaft mit beschränkter Haftung\nStarnberg\n\nDen Gläubigern der an der Verschmelzung beteiligten Rechtsträger ist, wenn sie binnen sechs Monaten nach dem Tag, an dem die Eintragung der Verschmelzung in das Register des Sitzes desjenigen Rechtsträgers, dessen Gläubiger sie sind, nach § 19 Abs. 3 UmwG als bekannt gemacht gilt, ihren Anspruch nach Grund und Höhe in Textform anmelden, Sicherheit zu leisten, soweit sie nicht Befriedigung verlangen können. Dieses Recht steht den Gläubigern jedoch nur zu, wenn sie glaubhaft machen, dass durch die Verschmelzung die Erfüllung ihrer Forderung gefährdet wird."
    },
    {
      "date": "2025-12-06",
      "id": "139319",
      "original_text": "Einreichung neuer Dokumente\nBayern Amtsgericht Augsburg HRB 21812\nFußball-Club Augsburg 1907 GmbH & Co. KGaA – Augsburg",
      "type": "Einreichung neuer Dokumente",
      "state": "Bayern",
      "amtsgericht": "Amtsgericht Augsburg",
      "registernummer": "HRB 21812",
      "registerart": "HRB",
      "company_name": "Fußball-Club Augsburg 1907 GmbH & Co. KGaA",
      "company_seat": "Augsburg",
      "details": "06.12.2025 (Bekanntmachungsdatum)\n\nBayern Amtsgericht Augsburg HRB 21812\nEinreichung neuer Dokumente\n\nFußball-Club Augsburg 1907 GmbH & Co. KGaA\nKommanditgesellschaft auf Aktien\nAugsburg\n\nDem Amtsgericht Augsburg -Registergericht- ist eine Liste der Mitglieder des Aufsichtsrats eingereicht worden, §§ 278 Abs. 3, 106 AktG."
    },
    {
      "date": "2025-12-06",
      "id": "139320",
      "original_text": "Löschungsankündigung\nBayern Amtsgericht München HRB 237915\nJK LIVE GmbH – München",
      "type": "Löschungsankündigung",
      "state": "Bayern",
      "amtsgericht": "Amtsgericht München",
      "registernummer": "HRB 237915",
      "registerart": "HRB",
      "company_name": "JK LIVE GmbH",
      "company_seat": "München",
      "details": "06.12.2025 (Bekanntmachungsdatum)\n\nBayern Amtsgericht München HRB 237915\nLöschungsankündigung 05.12.2025 (Eintragungsdatum)\n\nJK LIVE GmbH\nGesellschaft mit beschränkter Haftung\nMünchen\n\nDas Registergericht beabsichtigt, die im Handelsregister eingetragene Gesellschaft wegen Vermögenslosigkeit von Amts wegen nach § 394 FamFG zu löschen. Die Frist zur Erhebung eines Widerspruchs ist auf drei Monate festgesetzt."
    },
    {
      "date": "2025-12-06",
      "id": "139321",
      "original_text": "Löschungsankündigung\nBayern Amtsgericht München HRB 221210\nSolidus Beratungs und Vermittlungs GmbH – München",
      "type": "Löschungsankündigung",
      "state": "Bayern",
      "amtsgericht": "Amtsgericht München",
      "registernummer": "HRB 221210",
      "registerart": "HRB",
      "company_name": "Solidus Beratungs und Vermittlungs GmbH",
      "company_seat": "München",
      "details": "06.12.2025 (Bekanntmachungsdatum)\n\nBayern Amtsgericht München HRB 221210\nLöschungsankündigung 05.12.2025 (Eintragungsdatum)\n\nSolidus Beratungs und Vermittlungs GmbH\nGesellschaft mit beschränkter Haftung\nMünchen\n\nDas Registergericht beabsichtigt, die im Handelsregister eingetragene Gesellschaft wegen Vermögenslosigkeit von Amts wegen nach § 394 FamFG zu löschen. Die Frist zur Erhebung eines Widerspruchs ist auf drei Monate festgesetzt."
    },
    {
      "date": "2025-12-06",
      "id": "139322",
      "original_text": "Registerbekanntmachung nach dem Umwandlungsgesetz\nBayern Amtsgericht München HRB 281936\nPNZ C23 Beteiligungs UG (haftungsbeschränkt) – München",
      "type": "Registerbekanntmachung nach dem Umwandlungsgesetz",
      "state": "Bayern",
      "amtsgericht": "Amtsgericht München",
      "registernummer": "HRB 281936",
      "registerart": "HRB",
      "company_name": "PNZ C23 Beteiligungs UG (haftungsbeschränkt)",
      "company_seat": "München",
      "details": "06.12.2025 (Bekanntmachungsdatum)\n\nBayern Amtsgericht München HRB 281936\nRegisterbekanntmachung nach dem Umwandlungsgesetz 05.12.2025 (Eintragungsdatum)\n\nPNZ C23 Beteiligungs UG (haftungsbeschränkt)\nGesellschaft mit beschränkter Haftung\nMünchen\n\nDen Gläubigern der an der Verschmelzung beteiligten Rechtsträger ist, wenn sie binnen sechs Monaten nach dem Tag, an dem die Eintragung der Verschmelzung in das Register des Sitzes desjenigen Rechtsträgers, dessen Gläubiger sie sind, nach § 19 Abs. 3 UmwG als bekannt gemacht gilt, ihren Anspruch nach Grund und Höhe in Textform anmelden, Sicherheit zu leisten, soweit sie nicht Befriedigung verlangen können. Dieses Recht steht den Gläubigern jedoch nur zu, wenn sie glaubhaft machen, dass durch die Verschmelzung die Erfüllung ihrer Forderung gefährdet wird."
    },
    {
      "date": "2025-12-06",
      "id": "139323",
      "original_text": "Löschungsankündigung\nBayern Amtsgericht München HRB 199914\nInvent Produktion UG (haftungsbeschränkt) – München",
      "type": "Löschungsankündigung",
      "state": "Bayern",
      "amtsgericht": "Amtsgericht München",
      "registernummer": "HRB 199914",
      "registerart": "HRB",
      "company_name": "Invent Produktion UG (haftungsbeschränkt)",
      "company_seat": "München",
      "details": "06.12.2025 (Bekanntmachungsdatum)\n\nBayern Amtsgericht München HRB 199914\nLöschungsankündigung 05.12.2025 (Eintragungsdatum)\n\nInvent Produktion UG (haftungsbeschränkt)\nGesellschaft mit beschränkter Haftung\nMünchen\n\nDas Registergericht beabsichtigt, die im Handelsregister eingetragene Gesellschaft wegen Vermögenslosigkeit von Amts wegen nach § 394 FamFG zu löschen. Die Frist zur Erhebung eines Widerspruchs ist auf drei Monate festgesetzt."
    },
    {
      "date": "2025-12-06",
      "id": "139324",
      "original_text": "Einreichung neuer Dokumente\nBayern Amtsgericht München HRB 256407\nLinde GmbH – Pullach i.Isartal",
      "type": "Einreichung neuer Dokumente",
      "state": "Bayern",
      "amtsgericht": "Amtsgericht München",
      "registernummer": "HRB 256407",
      "registerart": "HRB",
      "company_name": "Linde GmbH",
      "company_seat": "Pullach i.Isartal",
      "details": "06.12.2025 (Bekanntmachungsdatum)\n\nBayern Amtsgericht München HRB 256407\nEinreichung neuer Dokumente\n\nLinde GmbH\nGesellschaft mit beschränkter Haftung\nPullach i.Isartal\n\nDem #Re.Name ist eine Liste der Mitglieder des Aufsichtsrats eingereicht worden, § 52 Abs. 3 S. 2 GmbHG."
    },
    {
      "date": "2025-12-06",
      "id": "139325",
      "original_text": "Registerbekanntmachung nach dem Umwandlungsgesetz\nBayern Amtsgericht Landshut HRB 13556\nMeisterspenglerei Bachhuber GmbH – Gangkofen",
      "type": "Registerbekanntmachung nach dem Umwandlungsgesetz",
      "state": "Bayern",
      "amtsgericht": "Amtsgericht Landshut",
      "registernummer": "HRB 13556",
      "registerart": "HRB",
      "company_name": "Meisterspenglerei Bachhuber GmbH",
      "company_seat": "Gangkofen",
      "details": "06.12.2025 (Bekanntmachungsdatum)\n\nBayern Amtsgericht Landshut HRB 13556\nRegisterbekanntmachung nach dem Umwandlungsgesetz 05.12.2025 (Eintragungsdatum)\n\nMeisterspenglerei Bachhuber GmbH\nGesellschaft mit beschränkter Haftung\nGangkofen\n\nDen Gläubigern der an der Verschmelzung beteiligten Rechtsträger ist, wenn sie binnen sechs Monaten nach dem Tag, an dem die Eintragung der Verschmelzung in das Register des Sitzes desjenigen Rechtsträgers, dessen Gläubiger sie sind, nach § 19 Abs. 3 UmwG als bekannt gemacht gilt, ihren Anspruch nach Grund und Höhe in Textform anmelden, Sicherheit zu leisten, soweit sie nicht Befriedigung verlangen können. Dieses Recht steht den Gläubigern jedoch nur zu, wenn sie glaubhaft machen, dass durch die Verschmelzung die Erfüllung ihrer Forderung gefährdet wird."
    },
    {
      "date": "2025-12-06",
      "id": "139326",
      "original_text": "Registerbekanntmachung nach dem Umwandlungsgesetz\nBayern Amtsgericht München HRB 164232\nAllianz SE – München",
      "type": "Registerbekanntmachung nach dem Umwandlungsgesetz",
      "state": "Bayern",
      "amtsgericht": "Amtsgericht München",
      "registernummer": "HRB 164232",
      "registerart": "HRB",
      "company_name": "Allianz SE",
      "company_seat": "München",
      "details": "06.12.2025 (Bekanntmachungsdatum)\n\nBayern Amtsgericht München HRB 164232\nRegisterbekanntmachung nach dem Umwandlungsgesetz 05.12.2025 (Eintragungsdatum)\n\nAllianz SE\nEuropäische Aktiengesellschaft (SE)\nMünchen\n\nDen Gläubigern der an der Verschmelzung beteiligten Rechtsträger ist, wenn sie binnen sechs Monaten nach dem Tag, an dem die Eintragung der Verschmelzung in das Register des Sitzes desjenigen Rechtsträgers, dessen Gläubiger sie sind, nach § 19 Abs. 3 UmwG als bekannt gemacht gilt, ihren Anspruch nach Grund und Höhe in Textform anmelden, Sicherheit zu leisten, soweit sie nicht Befriedigung verlangen können. Dieses Recht steht den Gläubigern jedoch nur zu, wenn sie glaubhaft machen, dass durch die Verschmelzung die Erfüllung ihrer Forderung gefährdet wird."
    },
    {
      "date": "2025-12-06",
      "id": "139327",
      "original_text": "Registerbekanntmachung nach dem Umwandlungsgesetz\nBayern Amtsgericht Memmingen HRB 20584\nSunbit Energietechnik GmbH – Balzhausen",
      "type": "Registerbekanntmachung nach dem Umwandlungsgesetz",
      "state": "Bayern",
      "amtsgericht": "Amtsgericht Memmingen",
      "registernummer": "HRB 20584",
      "registerart": "HRB",
      "company_name": "Sunbit Energietechnik GmbH",
      "company_seat": "Balzhausen",
      "details": "06.12.2025 (Bekanntmachungsdatum)\n\nBayern Amtsgericht Memmingen HRB 20584\nRegisterbekanntmachung nach dem Umwandlungsgesetz 05.12.2025 (Eintragungsdatum)\n\nSunbit Energietechnik GmbH\nGesellschaft mit beschränkter Haftung\nBalzhausen\n\nDen Gläubigern der an der Ausgliederung beteiligten Rechtsträger ist, wenn sie binnen sechs Monaten nach dem Tag, an dem die Eintragung der Ausgliederung in das Register des Sitzes desjenigen Rechtsträgers, dessen Gläubiger sie sind, nach §§ 125, 19 Abs. 3 UmwG als bekannt gemacht gilt, ihren Anspruch nach Grund und Höhe in Textform anmelden, Sicherheit zu leisten, soweit sie nicht Befriedigung verlangen können. Dieses Recht steht den Gläubigern jedoch nur zu, wenn sie glaubhaft machen, dass durch die Ausgliederung die Erfüllung ihrer Forderung gefährdet wird."
    },
    {
      "date": "2025-12-06",
      "id": "139328",
      "original_text": "Registerbekanntmachung nach dem Umwandlungsgesetz\nBayern Amtsgericht München HRB 218792\nElla Beteiligungs GmbH – Puchheim",
      "type": "Registerbekanntmachung nach dem Umwandlungsgesetz",
      "state": "Bayern",
      "amtsgericht": "Amtsgericht München",
      "registernummer": "HRB 218792",
      "registerart": "HRB",
      "company_name": "Ella Beteiligungs GmbH",
      "company_seat": "Puchheim",
      "details": "06.12.2025 (Bekanntmachungsdatum)\n\nBayern Amtsgericht München HRB 218792\nRegisterbekanntmachung nach dem Umwandlungsgesetz 05.12.2025 (Eintragungsdatum)\n\nElla Beteiligungs GmbH\nGesellschaft mit beschränkter Haftung\nPuchheim\n\nDen Gläubigern der an der Verschmelzung beteiligten Rechtsträger ist, wenn sie binnen sechs Monaten nach dem Tag, an dem die Eintragung der Verschmelzung in das Register des Sitzes desjenigen Rechtsträgers, dessen Gläubiger sie sind, nach § 19 Abs. 3 UmwG als bekannt gemacht gilt, ihren Anspruch nach Grund und Höhe in Textform anmelden, Sicherheit zu leisten, soweit sie nicht Befriedigung verlangen können. Dieses Recht steht den Gläubigern jedoch nur zu, wenn sie glaubhaft machen, dass durch die Verschmelzung die Erfüllung ihrer Forderung gefährdet wird."
    },
    {
      "date": "2025-12-06",
      "id": "139329",
      "original_text": "Löschungsankündigung\nBayern Amtsgericht München HRB 280444\nM2 Technologies GmbH – München",
      "type": "Löschungsankündigung",
      "state": "Bayern",
      "amtsgericht": "Amtsgericht München",
      "registernummer": "HRB 280444",
      "registerart": "HRB",
      "company_name": "M2 Technologies GmbH",
      "company_seat": "München",
      "details": "06.12.2025 (Bekanntmachungsdatum)\n\nBayern Amtsgericht München HRB 280444\nLöschungsankündigung 05.12.2025 (Eintragungsdatum)\n\nM2 Technologies GmbH\nGesellschaft mit beschränkter Haftung\nMünchen\n\nDas Registergericht beabsichtigt, die im Handelsregister eingetragene Gesellschaft wegen Vermögenslosigkeit von Amts wegen nach § 394 FamFG zu löschen. Die Frist zur Erhebung eines Widerspruchs ist auf drei Monate festgesetzt."
    },
    {
      "date": "2025-12-06",
      "id": "139330",
      "original_text": "Einreichung neuer Dokumente\nBayern Amtsgericht München HRB 231742\nGFKD - Gesellschaft für Kommunikation und Digitalisierung AG – Grünwald",
      "type": "Einreichung neuer Dokumente",
      "state": "Bayern",
      "amtsgericht": "Amtsgericht München",
      "registernummer": "HRB 231742",
      "registerart": "HRB",
      "company_name": "GFKD - Gesellschaft für Kommunikation und Digitalisierung AG",
      "company_seat": "Grünwald",
      "details": "06.12.2025 (Bekanntmachungsdatum)\n\nBayern Amtsgericht München HRB 231742\nEinreichung neuer Dokumente\n\nGFKD - Gesellschaft für Kommunikation und Digitalisierung AG\nAktiengesellschaft\nGrünwald\n\nDem Amtsgericht München -Registergericht- ist eine Liste der Mitglieder des Aufsichtsrats eingereicht worden, § 106 AktG."
    },
    {
      "date": "2025-12-06",
      "id": "139331",
      "original_text": "Registerbekanntmachung nach dem Umwandlungsgesetz\nBayern Amtsgericht München HRB 254255\nAthena Management Verwaltungs GmbH – München",
      "type": "Registerbekanntmachung nach dem Umwandlungsgesetz",
      "state": "Bayern",
      "amtsgericht": "Amtsgericht München",
      "registernummer": "HRB 254255",
      "registerart": "HRB",
      "company_name": "Athena Management Verwaltungs GmbH",
      "company_seat": "München",
      "details": "06.12.2025 (Bekanntmachungsdatum)\n\nBayern Amtsgericht München HRB 254255\nRegisterbekanntmachung nach dem Umwandlungsgesetz 05.12.2025 (Eintragungsdatum)\n\nAthena Management Verwaltungs GmbH\nGesellschaft mit beschränkter Haftung\nMünchen\n\nDen Gläubigern der an der Verschmelzung beteiligten Rechtsträger ist, wenn sie binnen sechs Monaten nach dem Tag, an dem die Eintragung der Verschmelzung in das Register des Sitzes desjenigen Rechtsträgers, dessen Gläubiger sie sind, nach § 19 Abs. 3 UmwG als bekannt gemacht gilt, ihren Anspruch nach Grund und Höhe in Textform anmelden, Sicherheit zu leisten, soweit sie nicht Befriedigung verlangen können. Dieses Recht steht den Gläubigern jedoch nur zu, wenn sie glaubhaft machen, dass durch die Verschmelzung die Erfüllung ihrer Forderung gefährdet wird."
    },
    {
      "date": "2025-12-06",
      "id": "139332",
      "original_text": "Registerbekanntmachung nach dem Umwandlungsgesetz\nBayern Amtsgericht Fürth HRB 17865\nInterherence GmbH – Erlangen",
      "type": "Registerbekanntmachung nach dem Umwandlungsgesetz",
      "state": "Bayern",
      "amtsgericht": "Amtsgericht Fürth",
      "registernummer": "HRB 17865",
      "registerart": "HRB",
      "company_name": "Interherence GmbH",
      "company_seat": "Erlangen",
      "details": "06.12.2025 (Bekanntmachungsdatum)\n\nBayern Amtsgericht Fürth HRB 17865\nRegisterbekanntmachung nach dem Umwandlungsgesetz 05.12.2025 (Eintragungsdatum)\n\nInterherence GmbH\nGesellschaft mit beschränkter Haftung\nErlangen\n\nDen Gläubigern der an der Verschmelzung beteiligten Rechtsträger ist, wenn sie binnen sechs Monaten nach dem Tag, an dem die Eintragung der Verschmelzung in das Register des Sitzes desjenigen Rechtsträgers, dessen Gläubiger sie sind, nach § 19 Abs. 3 UmwG als bekannt gemacht gilt, ihren Anspruch nach Grund und Höhe in Textform anmelden, Sicherheit zu leisten, soweit sie nicht Befriedigung verlangen können. Dieses Recht steht den Gläubigern jedoch nur zu, wenn sie glaubhaft machen, dass durch die Verschmelzung die Erfüllung ihrer Forderung gefährdet wird."
    },
    {
      "date": "2025-12-06",
      "id": "139333",
      "original_text": "Registerbekanntmachung nach dem Umwandlungsgesetz\nBayern Amtsgericht München HRB 276792\nMünchen American Football Holding GmbH – München",
      "type": "Registerbekanntmachung nach dem Umwandlungsgesetz",
      "state": "Bayern",
      "amtsgericht": "Amtsgericht München",
      "registernummer": "HRB 276792",
      "registerart": "HRB",
      "company_name": "München American Football Holding GmbH",
      "company_seat": "München",
      "details": "06.12.2025 (Bekanntmachungsdatum)\n\nBayern Amtsgericht München HRB 276792\nRegisterbekanntmachung nach dem Umwandlungsgesetz 05.12.2025 (Eintragungsdatum)\n\nMünchen American Football Holding GmbH\nGesellschaft mit beschränkter Haftung\nMünchen\n\nDen Gläubigern der an der Verschmelzung beteiligten Rechtsträger ist, wenn sie binnen sechs Monaten nach dem Tag, an dem die Eintragung der Verschmelzung in das Register des Sitzes desjenigen Rechtsträgers, dessen Gläubiger sie sind, nach § 19 Abs. 3 UmwG als bekannt gemacht gilt, ihren Anspruch nach Grund und Höhe in Textform anmelden, Sicherheit zu leisten, soweit sie nicht Befriedigung verlangen können. Dieses Recht steht den Gläubigern jedoch nur zu, wenn sie glaubhaft machen, dass durch die Verschmelzung die Erfüllung ihrer Forderung gefährdet wird."
    },
    {
      "date": "2025-12-06",
      "id": "139334",
      "original_text": "Einreichung neuer Dokumente\nBayern Amtsgericht München HRB 220914\nRail Power Systems GmbH – München",
      "type": "Einreichung neuer Dokumente",
      "state": "Bayern",
      "amtsgericht": "Amtsgericht München",
      "registernummer": "HRB 220914",
      "registerart": "HRB",
      "company_name": "Rail Power Systems GmbH",
      "company_seat": "München",
      "details": "06.12.2025 (Bekanntmachungsdatum)\n\nBayern Amtsgericht München HRB 220914\nEinreichung neuer Dokumente 05.12.2025 (Eintragungsdatum)\n\nRail Power Systems GmbH\nGesellschaft mit beschränkter Haftung\nMünchen\n\nDem Amtsgericht München -Registergericht- ist eine Liste der Mitglieder des Aufsichtsrats eingereicht worden, § 52 Abs. 3 S. 2 GmbHG."
    },
    {
      "date": "2025-12-06",
      "id": "139335",
      "original_text": "Einreichung neuer Dokumente\nBayern Amtsgericht Nürnberg HRB 20603\nElectrolux Hausgeräte GmbH – Nürnberg",
      "type": "Einreichung neuer Dokumente",
      "state": "Bayern",
      "amtsgericht": "Amtsgericht Nürnberg",
      "registernummer": "HRB 20603",
      "registerart": "HRB",
      "company_name": "Electrolux Hausgeräte GmbH",
      "company_seat": "Nürnberg",
      "details": "06.12.2025 (Bekanntmachungsdatum)\n\nBayern Amtsgericht Nürnberg HRB 20603\nEinreichung neuer Dokumente 05.12.2025 (Eintragungsdatum)\n\nElectrolux Hausgeräte GmbH\nGesellschaft mit beschränkter Haftung\nNürnberg\n\nDem Amtsgericht Nürnberg -Registergericht- ist eine Liste der Mitglieder des Aufsichtsrats eingereicht worden, § 52 Abs. 3 S. 2 GmbHG."
    },
    {
      "date": "2025-12-06",
      "id": "139336",
      "original_text": "Registerbekanntmachung nach dem Umwandlungsgesetz\nBayern Amtsgericht München HRB 6262\nDaiichi Sankyo Europe GmbH – München",
      "type": "Registerbekanntmachung nach dem Umwandlungsgesetz",
      "state": "Bayern",
      "amtsgericht": "Amtsgericht München",
      "registernummer": "HRB 6262",
      "registerart": "HRB",
      "company_name": "Daiichi Sankyo Europe GmbH",
      "company_seat": "München",
      "details": "06.12.2025 (Bekanntmachungsdatum)\n\nBayern Amtsgericht München HRB 6262\nRegisterbekanntmachung nach dem Umwandlungsgesetz 05.12.2025 (Eintragungsdatum)\n\nDaiichi Sankyo Europe GmbH\nGesellschaft mit beschränkter Haftung\nMünchen\n\nDen Gläubigern der an der Verschmelzung beteiligten Rechtsträger ist, wenn sie binnen sechs Monaten nach dem Tag, an dem die Eintragung der Verschmelzung in das Register des Sitzes desjenigen Rechtsträgers, dessen Gläubiger sie sind, nach § 19 Abs. 3 UmwG als bekannt gemacht gilt, ihren Anspruch nach Grund und Höhe in Textform anmelden, Sicherheit zu leisten, soweit sie nicht Befriedigung verlangen können. Dieses Recht steht den Gläubigern jedoch nur zu, wenn sie glaubhaft machen, dass durch die Verschmelzung die Erfüllung ihrer Forderung gefährdet wird."
    }
  ]
}