{
  "date": "2025-12-20",
  "date_of_scrape": "2025-12-21T04:18:16.406Z",
  "tool_version": "0.2.0",
  "number_of_announcements": 24,
  "announcements": [
    {
      "date": "2025-12-20",
      "id": "140692",
      "original_text": "Löschungsankündigung\nBayern Amtsgericht Ingolstadt HRB 6544\nProsave Security - Facility Services GmbH – Ingolstadt",
      "type": "Löschungsankündigung",
      "state": "Bayern",
      "amtsgericht": "Amtsgericht Ingolstadt",
      "registernummer": "HRB 6544",
      "registerart": "HRB",
      "company_name": "Prosave Security - Facility Services GmbH",
      "company_seat": "Ingolstadt",
      "details": "20.12.2025 (Bekanntmachungsdatum)\n\nBayern Amtsgericht Ingolstadt HRB 6544\nLöschungsankündigung\n\nProsave Security - Facility Services GmbH\nGesellschaft mit beschränkter Haftung\nIngolstadt\n\nDas Registergericht beabsichtigt, die im Handelsregister eingetragene Gesellschaft wegen Vermögenslosigkeit von Amts wegen nach § 394 FamFG zu löschen. #insert(Text=\"zztb_V_Widerspruchsfrist\")"
    },
    {
      "date": "2025-12-20",
      "id": "140693",
      "original_text": "Registerbekanntmachung nach dem Umwandlungsgesetz\nBayern Amtsgericht Nürnberg HRB 28627\ncarriere & more, private Akademie GmbH – Nürnberg",
      "type": "Registerbekanntmachung nach dem Umwandlungsgesetz",
      "state": "Bayern",
      "amtsgericht": "Amtsgericht Nürnberg",
      "registernummer": "HRB 28627",
      "registerart": "HRB",
      "company_name": "carriere & more, private Akademie GmbH",
      "company_seat": "Nürnberg",
      "details": "20.12.2025 (Bekanntmachungsdatum)\n\nBayern Amtsgericht Nürnberg HRB 28627\nRegisterbekanntmachung nach dem Umwandlungsgesetz 19.12.2025 (Eintragungsdatum)\n\ncarriere & more, private Akademie GmbH\nGesellschaft mit beschränkter Haftung\nNürnberg\n\nDen Gläubigern der an der Verschmelzung beteiligten Rechtsträger ist, wenn sie binnen sechs Monaten nach dem Tag, an dem die Eintragung der Verschmelzung in das Register des Sitzes desjenigen Rechtsträgers, dessen Gläubiger sie sind, nach § 19 Abs. 3 UmwG als bekannt gemacht gilt, ihren Anspruch nach Grund und Höhe in Textform anmelden, Sicherheit zu leisten, soweit sie nicht Befriedigung verlangen können. Dieses Recht steht den Gläubigern jedoch nur zu, wenn sie glaubhaft machen, dass durch die Verschmelzung die Erfüllung ihrer Forderung gefährdet wird."
    },
    {
      "date": "2025-12-20",
      "id": "140694",
      "original_text": "Registerbekanntmachung nach dem Umwandlungsgesetz\nBayern Amtsgericht Nürnberg HRB 32093\nc&m Online Campus GmbH – Nürnberg",
      "type": "Registerbekanntmachung nach dem Umwandlungsgesetz",
      "state": "Bayern",
      "amtsgericht": "Amtsgericht Nürnberg",
      "registernummer": "HRB 32093",
      "registerart": "HRB",
      "company_name": "c&m Online Campus GmbH",
      "company_seat": "Nürnberg",
      "details": "20.12.2025 (Bekanntmachungsdatum)\n\nBayern Amtsgericht Nürnberg HRB 32093\nRegisterbekanntmachung nach dem Umwandlungsgesetz 19.12.2025 (Eintragungsdatum)\n\nc&m Online Campus GmbH\nGesellschaft mit beschränkter Haftung\nNürnberg\n\nDen Gläubigern der an der Verschmelzung beteiligten Rechtsträger ist, wenn sie binnen sechs Monaten nach dem Tag, an dem die Eintragung der Verschmelzung in das Register des Sitzes desjenigen Rechtsträgers, dessen Gläubiger sie sind, nach § 19 Abs. 3 UmwG als bekannt gemacht gilt, ihren Anspruch nach Grund und Höhe in Textform anmelden, Sicherheit zu leisten, soweit sie nicht Befriedigung verlangen können. Dieses Recht steht den Gläubigern jedoch nur zu, wenn sie glaubhaft machen, dass durch die Verschmelzung die Erfüllung ihrer Forderung gefährdet wird."
    },
    {
      "date": "2025-12-20",
      "id": "140695",
      "original_text": "Registerbekanntmachung nach dem Umwandlungsgesetz\nBayern Amtsgericht München HRA 122071\nTW-O Management GmbH & Co. KG – Taufkirchen",
      "type": "Registerbekanntmachung nach dem Umwandlungsgesetz",
      "state": "Bayern",
      "amtsgericht": "Amtsgericht München",
      "registernummer": "HRA 122071",
      "registerart": "HRA",
      "company_name": "TW-O Management GmbH & Co. KG",
      "company_seat": "Taufkirchen",
      "details": "20.12.2025 (Bekanntmachungsdatum)\n\nBayern Amtsgericht München HRA 122071\nRegisterbekanntmachung nach dem Umwandlungsgesetz 19.12.2025 (Eintragungsdatum)\n\nTW-O Management GmbH & Co. KG\nKommanditgesellschaft\nTaufkirchen\n\nDen Gläubigern des formwechselnden Rechtsträgers ist, wenn sie binnen sechs Monaten nach dem Tag, an dem die Eintragung des Formwechsels nach § 201 UmwG als bekannt gemacht gilt, ihren Anspruch nach Grund und Höhe in Textform anmelden, Sicherheit zu leisten, soweit sie nicht Befriedigung verlangen können. Dieses Recht steht den Gläubigern jedoch nur zu, wenn sie glaubhaft machen, dass durch den Formwechsel die Erfüllung ihrer Forderung gefährdet wird."
    },
    {
      "date": "2025-12-20",
      "id": "140696",
      "original_text": "Registerbekanntmachung nach dem Umwandlungsgesetz\nBayern Amtsgericht München HRB 266463\nGoodyields Development & Services GmbH – München",
      "type": "Registerbekanntmachung nach dem Umwandlungsgesetz",
      "state": "Bayern",
      "amtsgericht": "Amtsgericht München",
      "registernummer": "HRB 266463",
      "registerart": "HRB",
      "company_name": "Goodyields Development & Services GmbH",
      "company_seat": "München",
      "details": "20.12.2025 (Bekanntmachungsdatum)\n\nBayern Amtsgericht München HRB 266463\nRegisterbekanntmachung nach dem Umwandlungsgesetz 19.12.2025 (Eintragungsdatum)\n\nGoodyields Development & Services GmbH\nGesellschaft mit beschränkter Haftung\nMünchen\n\nDen Gläubigern der an der Verschmelzung beteiligten Rechtsträger ist, wenn sie binnen sechs Monaten nach dem Tag, an dem die Eintragung der Verschmelzung in das Register des Sitzes desjenigen Rechtsträgers, dessen Gläubiger sie sind, nach § 19 Abs. 3 UmwG als bekannt gemacht gilt, ihren Anspruch nach Grund und Höhe in Textform anmelden, Sicherheit zu leisten, soweit sie nicht Befriedigung verlangen können. Dieses Recht steht den Gläubigern jedoch nur zu, wenn sie glaubhaft machen, dass durch die Verschmelzung die Erfüllung ihrer Forderung gefährdet wird."
    },
    {
      "date": "2025-12-20",
      "id": "140697",
      "original_text": "Sonstige Registerbekanntmachung\nBayern Amtsgericht Ingolstadt HRB 12300\nTierarztpraxis Karlskron GmbH – Karlskron",
      "type": "Sonstige Registerbekanntmachung",
      "state": "Bayern",
      "amtsgericht": "Amtsgericht Ingolstadt",
      "registernummer": "HRB 12300",
      "registerart": "HRB",
      "company_name": "Tierarztpraxis Karlskron GmbH",
      "company_seat": "Karlskron",
      "details": "20.12.2025 (Bekanntmachungsdatum)\n\nBayern Amtsgericht Ingolstadt HRB 12300\nSonstige Registerbekanntmachung 19.12.2025 (Eintragungsdatum)\n\nTierarztpraxis Karlskron GmbH\nGesellschaft mit beschränkter Haftung\nKarlskron\n\nDen Gläubigern der Gesellschaft, deren Forderungen begründet worden sind, bevor die Eintragung der Beendigung des Gewinnabführungsvertrages in das Handelsregister nach § 10 des Handelsgesetzbuches als bekanntgemacht gilt, hat der andere Vertragsteil Sicherheit zu leisten, wenn sie sich binnen sechs Monaten nach der Bekanntmachung der Eintragung zu diesem Zweck bei ihm melden."
    },
    {
      "date": "2025-12-20",
      "id": "140698",
      "original_text": "Registerbekanntmachung nach dem Umwandlungsgesetz\nBayern Amtsgericht München HRB 161013\nHMH Holding GmbH – München",
      "type": "Registerbekanntmachung nach dem Umwandlungsgesetz",
      "state": "Bayern",
      "amtsgericht": "Amtsgericht München",
      "registernummer": "HRB 161013",
      "registerart": "HRB",
      "company_name": "HMH Holding GmbH",
      "company_seat": "München",
      "details": "20.12.2025 (Bekanntmachungsdatum)\n\nBayern Amtsgericht München HRB 161013\nRegisterbekanntmachung nach dem Umwandlungsgesetz 19.12.2025 (Eintragungsdatum)\n\nHMH Holding GmbH\nGesellschaft mit beschränkter Haftung\nMünchen\n\nDen Gläubigern der an der Verschmelzung beteiligten Rechtsträger ist, wenn sie binnen sechs Monaten nach dem Tag, an dem die Eintragung der Verschmelzung in das Register des Sitzes desjenigen Rechtsträgers, dessen Gläubiger sie sind, nach § 19 Abs. 3 UmwG als bekannt gemacht gilt, ihren Anspruch nach Grund und Höhe in Textform anmelden, Sicherheit zu leisten, soweit sie nicht Befriedigung verlangen können. Dieses Recht steht den Gläubigern jedoch nur zu, wenn sie glaubhaft machen, dass durch die Verschmelzung die Erfüllung ihrer Forderung gefährdet wird."
    },
    {
      "date": "2025-12-20",
      "id": "140699",
      "original_text": "Einreichung neuer Dokumente\nBayern Amtsgericht München HRB 140204\nNymphenburger Beteiligungs AG – München",
      "type": "Einreichung neuer Dokumente",
      "state": "Bayern",
      "amtsgericht": "Amtsgericht München",
      "registernummer": "HRB 140204",
      "registerart": "HRB",
      "company_name": "Nymphenburger Beteiligungs AG",
      "company_seat": "München",
      "details": "20.12.2025 (Bekanntmachungsdatum)\n\nBayern Amtsgericht München HRB 140204\nEinreichung neuer Dokumente 19.12.2025 (Eintragungsdatum)\n\nNymphenburger Beteiligungs AG\nAktiengesellschaft\nMünchen\n\nDem Amtsgericht München -Registergericht- ist eine Liste der Mitglieder des Aufsichtsrats eingereicht worden, § 106 AktG."
    },
    {
      "date": "2025-12-20",
      "id": "140700",
      "original_text": "Löschungsankündigung\nBayern Amtsgericht Nürnberg HRB 6635\nPZV Peter Zühlke Vertriebsgesellschaft mbH – Nürnberg",
      "type": "Löschungsankündigung",
      "state": "Bayern",
      "amtsgericht": "Amtsgericht Nürnberg",
      "registernummer": "HRB 6635",
      "registerart": "HRB",
      "company_name": "PZV Peter Zühlke Vertriebsgesellschaft mbH",
      "company_seat": "Nürnberg",
      "details": "20.12.2025 (Bekanntmachungsdatum)\n\nBayern Amtsgericht Nürnberg HRB 6635\nLöschungsankündigung\n\nPZV Peter Zühlke Vertriebsgesellschaft mbH\nGesellschaft mit beschränkter Haftung\nNürnberg\n\nDas Registergericht beabsichtigt, die im Handelsregister eingetragene Gesellschaft wegen Vermögenslosigkeit von Amts wegen nach § 394 FamFG zu löschen. Die Frist zur Erhebung eines Widerspruchs ist auf einen Monat festgesetzt."
    },
    {
      "date": "2025-12-20",
      "id": "140701",
      "original_text": "Einreichung neuer Dokumente\nBayern Amtsgericht Ingolstadt HRB 101738\nBAUER Maschinen GmbH – Schrobenhausen",
      "type": "Einreichung neuer Dokumente",
      "state": "Bayern",
      "amtsgericht": "Amtsgericht Ingolstadt",
      "registernummer": "HRB 101738",
      "registerart": "HRB",
      "company_name": "BAUER Maschinen GmbH",
      "company_seat": "Schrobenhausen",
      "details": "20.12.2025 (Bekanntmachungsdatum)\n\nBayern Amtsgericht Ingolstadt HRB 101738\nEinreichung neuer Dokumente\n\nBAUER Maschinen GmbH\nGesellschaft mit beschränkter Haftung\nSchrobenhausen\n\nDem Amtsgericht Ingolstadt -Registergericht- ist eine Liste der Mitglieder des Aufsichtsrats eingereicht worden, § 52 Abs. 3 S. 2 GmbHG."
    },
    {
      "date": "2025-12-20",
      "id": "140702",
      "original_text": "Löschungsankündigung\nBayern Amtsgericht Hof HRB 3127\nAugsten & Scheuerlein sportpark untreusee Verwaltungsgesellschaft mbH – Hof",
      "type": "Löschungsankündigung",
      "state": "Bayern",
      "amtsgericht": "Amtsgericht Hof",
      "registernummer": "HRB 3127",
      "registerart": "HRB",
      "company_name": "Augsten & Scheuerlein sportpark untreusee Verwaltungsgesellschaft mbH",
      "company_seat": "Hof",
      "details": "20.12.2025 (Bekanntmachungsdatum)\n\nBayern Amtsgericht Hof HRB 3127\nLöschungsankündigung\n\nAugsten & Scheuerlein sportpark untreusee Verwaltungsgesellschaft mbH\nGesellschaft mit beschränkter Haftung\nHof\n\nDas Registergericht beabsichtigt, die im Handelsregister eingetragene Gesellschaft wegen Vermögenslosigkeit von Amts wegen nach § 394 FamFG zu löschen. #insert(Text=\"zztb_V_Widerspruchsfrist\")"
    },
    {
      "date": "2025-12-20",
      "id": "140703",
      "original_text": "Registerbekanntmachung nach dem Umwandlungsgesetz\nBayern Amtsgericht München HRB 308135\nGinova PropCo GmbH – Pullach i.Isartal",
      "type": "Registerbekanntmachung nach dem Umwandlungsgesetz",
      "state": "Bayern",
      "amtsgericht": "Amtsgericht München",
      "registernummer": "HRB 308135",
      "registerart": "HRB",
      "company_name": "Ginova PropCo GmbH",
      "company_seat": "Pullach i.Isartal",
      "details": "20.12.2025 (Bekanntmachungsdatum)\n\nBayern Amtsgericht München HRB 308135\nRegisterbekanntmachung nach dem Umwandlungsgesetz 19.12.2025 (Eintragungsdatum)\n\nGinova PropCo GmbH\nGesellschaft mit beschränkter Haftung\nPullach i.Isartal\n\nDen Gläubigern des formwechselnden Rechtsträgers ist, wenn sie binnen sechs Monaten nach dem Tag, an dem die Eintragung des Formwechsels nach § 201 UmwG als bekannt gemacht gilt, ihren Anspruch nach Grund und Höhe in Textform anmelden, Sicherheit zu leisten, soweit sie nicht Befriedigung verlangen können. Dieses Recht steht den Gläubigern jedoch nur zu, wenn sie glaubhaft machen, dass durch den Formwechsel die Erfüllung ihrer Forderung gefährdet wird."
    },
    {
      "date": "2025-12-20",
      "id": "140704",
      "original_text": "Registerbekanntmachung nach dem Umwandlungsgesetz\nBayern Amtsgericht Augsburg HRB 27999\nvoxeljet AG – Augsburg",
      "type": "Registerbekanntmachung nach dem Umwandlungsgesetz",
      "state": "Bayern",
      "amtsgericht": "Amtsgericht Augsburg",
      "registernummer": "HRB 27999",
      "registerart": "HRB",
      "company_name": "voxeljet AG",
      "company_seat": "Augsburg",
      "details": "20.12.2025 (Bekanntmachungsdatum)\n\nBayern Amtsgericht Augsburg HRB 27999\nRegisterbekanntmachung nach dem Umwandlungsgesetz 19.12.2025 (Eintragungsdatum)\n\nvoxeljet AG\nAktiengesellschaft\nAugsburg\n\nDen Gläubigern des formwechselnden Rechtsträgers ist, wenn sie binnen sechs Monaten nach dem Tag, an dem die Eintragung des Formwechsels nach § 201 UmwG als bekannt gemacht gilt, ihren Anspruch nach Grund und Höhe in Textform anmelden, Sicherheit zu leisten, soweit sie nicht Befriedigung verlangen können. Dieses Recht steht den Gläubigern jedoch nur zu, wenn sie glaubhaft machen, dass durch den Formwechsel die Erfüllung ihrer Forderung gefährdet wird."
    },
    {
      "date": "2025-12-20",
      "id": "140705",
      "original_text": "Löschungsankündigung\nBayern Amtsgericht Traunstein HRB 27314\nPingPong4You UG (haftungsbeschränkt) – Kolbermoor",
      "type": "Löschungsankündigung",
      "state": "Bayern",
      "amtsgericht": "Amtsgericht Traunstein",
      "registernummer": "HRB 27314",
      "registerart": "HRB",
      "company_name": "PingPong4You UG (haftungsbeschränkt)",
      "company_seat": "Kolbermoor",
      "details": "20.12.2025 (Bekanntmachungsdatum)\n\nBayern Amtsgericht Traunstein HRB 27314\nLöschungsankündigung 19.12.2025 (Eintragungsdatum)\n\nPingPong4You UG (haftungsbeschränkt)\nGesellschaft mit beschränkter Haftung\nKolbermoor\n\nDas Registergericht beabsichtigt, die im Handelsregister eingetragene Gesellschaft wegen Vermögenslosigkeit von Amts wegen nach § 394 FamFG zu löschen. Die Frist zur Erhebung eines Widerspruchs ist auf drei Monate festgesetzt."
    },
    {
      "date": "2025-12-20",
      "id": "140706",
      "original_text": "Registerbekanntmachung nach dem Umwandlungsgesetz\nBayern Amtsgericht Traunstein HRB 23424\nEMCO Deutschland GmbH – Traunstein",
      "type": "Registerbekanntmachung nach dem Umwandlungsgesetz",
      "state": "Bayern",
      "amtsgericht": "Amtsgericht Traunstein",
      "registernummer": "HRB 23424",
      "registerart": "HRB",
      "company_name": "EMCO Deutschland GmbH",
      "company_seat": "Traunstein",
      "details": "20.12.2025 (Bekanntmachungsdatum)\n\nBayern Amtsgericht Traunstein HRB 23424\nRegisterbekanntmachung nach dem Umwandlungsgesetz 19.12.2025 (Eintragungsdatum)\n\nEMCO Deutschland GmbH\nGesellschaft mit beschränkter Haftung\nTraunstein\n\nDen Gläubigern der an der Verschmelzung beteiligten Rechtsträger ist, wenn sie binnen sechs Monaten nach dem Tag, an dem die Eintragung der Verschmelzung in das Register des Sitzes desjenigen Rechtsträgers, dessen Gläubiger sie sind, nach § 19 Abs. 3 UmwG als bekannt gemacht gilt, ihren Anspruch nach Grund und Höhe in Textform anmelden, Sicherheit zu leisten, soweit sie nicht Befriedigung verlangen können. Dieses Recht steht den Gläubigern jedoch nur zu, wenn sie glaubhaft machen, dass durch die Verschmelzung die Erfüllung ihrer Forderung gefährdet wird."
    },
    {
      "date": "2025-12-20",
      "id": "140707",
      "original_text": "Registerbekanntmachung nach dem Umwandlungsgesetz\nBayern Amtsgericht Nürnberg HRB 28627\ncarriere & more, private Akademie GmbH – Nürnberg",
      "type": "Registerbekanntmachung nach dem Umwandlungsgesetz",
      "state": "Bayern",
      "amtsgericht": "Amtsgericht Nürnberg",
      "registernummer": "HRB 28627",
      "registerart": "HRB",
      "company_name": "carriere & more, private Akademie GmbH",
      "company_seat": "Nürnberg",
      "details": "20.12.2025 (Bekanntmachungsdatum)\n\nBayern Amtsgericht Nürnberg HRB 28627\nRegisterbekanntmachung nach dem Umwandlungsgesetz 19.12.2025 (Eintragungsdatum)\n\ncarriere & more, private Akademie GmbH\nGesellschaft mit beschränkter Haftung\nNürnberg\n\nDen Gläubigern der an der Verschmelzung beteiligten Rechtsträger ist, wenn sie binnen sechs Monaten nach dem Tag, an dem die Eintragung der Verschmelzung in das Register des Sitzes desjenigen Rechtsträgers, dessen Gläubiger sie sind, nach § 19 Abs. 3 UmwG als bekannt gemacht gilt, ihren Anspruch nach Grund und Höhe in Textform anmelden, Sicherheit zu leisten, soweit sie nicht Befriedigung verlangen können. Dieses Recht steht den Gläubigern jedoch nur zu, wenn sie glaubhaft machen, dass durch die Verschmelzung die Erfüllung ihrer Forderung gefährdet wird."
    },
    {
      "date": "2025-12-20",
      "id": "140708",
      "original_text": "Registerbekanntmachung nach dem Umwandlungsgesetz\nBayern Amtsgericht Nürnberg HRB 28628\n&more Medien- und Verlagsgesellschaft Birke-Trummer & Partner GmbH – Nürnberg",
      "type": "Registerbekanntmachung nach dem Umwandlungsgesetz",
      "state": "Bayern",
      "amtsgericht": "Amtsgericht Nürnberg",
      "registernummer": "HRB 28628",
      "registerart": "HRB",
      "company_name": "&more Medien- und Verlagsgesellschaft Birke-Trummer & Partner GmbH",
      "company_seat": "Nürnberg",
      "details": "20.12.2025 (Bekanntmachungsdatum)\n\nBayern Amtsgericht Nürnberg HRB 28628\nRegisterbekanntmachung nach dem Umwandlungsgesetz 19.12.2025 (Eintragungsdatum)\n\n&more Medien- und Verlagsgesellschaft Birke-Trummer & Partner GmbH\nGesellschaft mit beschränkter Haftung\nNürnberg\n\nDen Gläubigern der an der Verschmelzung beteiligten Rechtsträger ist, wenn sie binnen sechs Monaten nach dem Tag, an dem die Eintragung der Verschmelzung in das Register des Sitzes desjenigen Rechtsträgers, dessen Gläubiger sie sind, nach § 19 Abs. 3 UmwG als bekannt gemacht gilt, ihren Anspruch nach Grund und Höhe in Textform anmelden, Sicherheit zu leisten, soweit sie nicht Befriedigung verlangen können. Dieses Recht steht den Gläubigern jedoch nur zu, wenn sie glaubhaft machen, dass durch die Verschmelzung die Erfüllung ihrer Forderung gefährdet wird."
    },
    {
      "date": "2025-12-20",
      "id": "140709",
      "original_text": "Registerbekanntmachung nach dem Umwandlungsgesetz\nBayern Amtsgericht München HRB 298838\nGroh GmbH – Weilheim i.OB",
      "type": "Registerbekanntmachung nach dem Umwandlungsgesetz",
      "state": "Bayern",
      "amtsgericht": "Amtsgericht München",
      "registernummer": "HRB 298838",
      "registerart": "HRB",
      "company_name": "Groh GmbH",
      "company_seat": "Weilheim i.OB",
      "details": "20.12.2025 (Bekanntmachungsdatum)\n\nBayern Amtsgericht München HRB 298838\nRegisterbekanntmachung nach dem Umwandlungsgesetz 19.12.2025 (Eintragungsdatum)\n\nGroh GmbH\nGesellschaft mit beschränkter Haftung\nWeilheim i.OB\n\nDen Gläubigern der an der Ausgliederung beteiligten Rechtsträger ist, wenn sie binnen sechs Monaten nach dem Tag, an dem die Eintragung der Ausgliederung in das Register des Sitzes desjenigen Rechtsträgers, dessen Gläubiger sie sind, nach §§ 125, 19 Abs. 3 UmwG als bekannt gemacht gilt, ihren Anspruch nach Grund und Höhe in Textform anmelden, Sicherheit zu leisten, soweit sie nicht Befriedigung verlangen können. Dieses Recht steht den Gläubigern jedoch nur zu, wenn sie glaubhaft machen, dass durch die Ausgliederung die Erfüllung ihrer Forderung gefährdet wird."
    },
    {
      "date": "2025-12-20",
      "id": "140710",
      "original_text": "Löschungsankündigung\nBayern Amtsgericht München HRB 186751\nC&L Trade and Service GmbH – München",
      "type": "Löschungsankündigung",
      "state": "Bayern",
      "amtsgericht": "Amtsgericht München",
      "registernummer": "HRB 186751",
      "registerart": "HRB",
      "company_name": "C&L Trade and Service GmbH",
      "company_seat": "München",
      "details": "20.12.2025 (Bekanntmachungsdatum)\n\nBayern Amtsgericht München HRB 186751\nLöschungsankündigung\n\nC&L Trade and Service GmbH\nGesellschaft mit beschränkter Haftung\nMünchen\n\nDas Registergericht beabsichtigt, die im Handelsregister eingetragene Gesellschaft wegen Vermögenslosigkeit von Amts wegen nach § 394 FamFG zu löschen. Die Frist zur Erhebung eines Widerspruchs ist auf drei Monate festgesetzt."
    },
    {
      "date": "2025-12-20",
      "id": "140711",
      "original_text": "Löschungsankündigung\nBaden-Württemberg Amtsgericht Freiburg HRB 718076\nAureus-Ars GmbH – Lahr",
      "type": "Löschungsankündigung",
      "state": "Baden-Württemberg",
      "amtsgericht": "Amtsgericht Freiburg",
      "registernummer": "HRB 718076",
      "registerart": "HRB",
      "company_name": "Aureus-Ars GmbH",
      "company_seat": "Lahr",
      "details": "20.12.2025 (Bekanntmachungsdatum)\n\nBaden-Württemberg Amtsgericht Freiburg HRB 718076\nLöschungsankündigung\n\nAureus-Ars GmbH\nGesellschaft mit beschränkter Haftung\nLahr\n\nAls nicht eingetragen wird bekanntgemacht:\nDas Gericht beabsichtigt, die Gesellschaft wegen Vermögenslosigkeit im Handelsregister von Amts wegen nach § 394 FamFG zu löschen. Die Frist zur Geltendmachung eines Widerspruchs gegen die beabsichtigte Löschung ist auf einen Monat ab Veröffentlichung bestimmt."
    },
    {
      "date": "2025-12-20",
      "id": "140712",
      "original_text": "Einreichung neuer Dokumente\nNordrhein-Westfalen Amtsgericht Iserlohn HRB 4396\nSTL Bauträger- und Beteiligungs-GmbH – Lüdenscheid",
      "type": "Einreichung neuer Dokumente",
      "state": "Nordrhein-Westfalen",
      "amtsgericht": "Amtsgericht Iserlohn",
      "registernummer": "HRB 4396",
      "registerart": "HRB",
      "company_name": "STL Bauträger- und Beteiligungs-GmbH",
      "company_seat": "Lüdenscheid",
      "details": "20.12.2025 (Bekanntmachungsdatum)\n\nNordrhein-Westfalen Amtsgericht Iserlohn HRB 4396\nEinreichung neuer Dokumente\n\nSTL Bauträger- und Beteiligungs-GmbH\nGesellschaft mit beschränkter Haftung\nLüdenscheid\n\nDem Registergericht ist eine neue Liste der Mitglieder des Aufsichtsrates eingereicht worden."
    },
    {
      "date": "2025-12-20",
      "id": "140713",
      "original_text": "Einreichung neuer Dokumente\nNordrhein-Westfalen Amtsgericht Recklinghausen HRB 3307\nPROSOZ Herten Softwareentwicklungs- und Beratungsgesellschaft für Gemeinden, Städte und Kreise mbH – Herten",
      "type": "Einreichung neuer Dokumente",
      "state": "Nordrhein-Westfalen",
      "amtsgericht": "Amtsgericht Recklinghausen",
      "registernummer": "HRB 3307",
      "registerart": "HRB",
      "company_name": "PROSOZ Herten Softwareentwicklungs- und Beratungsgesellschaft für Gemeinden, Städte und Kreise mbH",
      "company_seat": "Herten",
      "details": "20.12.2025 (Bekanntmachungsdatum)\n\nNordrhein-Westfalen Amtsgericht Recklinghausen HRB 3307\nEinreichung neuer Dokumente 20.12.2025 (Eintragungsdatum)\n\nPROSOZ Herten Softwareentwicklungs- und Beratungsgesellschaft für Gemeinden, Städte und Kreise mbH\nGesellschaft mit beschränkter Haftung\nHerten\n\nDem Registergericht ist eine neue Liste der Mitglieder des Aufsichtsrates eingereicht worden."
    },
    {
      "date": "2025-12-20",
      "id": "140714",
      "original_text": "Einreichung neuer Dokumente\nNordrhein-Westfalen Amtsgericht Iserlohn HRB 8776\nGiersch GmbH – Hemer",
      "type": "Einreichung neuer Dokumente",
      "state": "Nordrhein-Westfalen",
      "amtsgericht": "Amtsgericht Iserlohn",
      "registernummer": "HRB 8776",
      "registerart": "HRB",
      "company_name": "Giersch GmbH",
      "company_seat": "Hemer",
      "details": "20.12.2025 (Bekanntmachungsdatum)\n\nNordrhein-Westfalen Amtsgericht Iserlohn HRB 8776\nEinreichung neuer Dokumente\n\nGiersch GmbH\nGesellschaft mit beschränkter Haftung\nHemer\n\nDem Registergericht ist eine neue Liste der Mitglieder des Aufsichtsrates eingereicht worden."
    },
    {
      "date": "2025-12-20",
      "id": "140715",
      "original_text": "Einreichung neuer Dokumente\nNordrhein-Westfalen Amtsgericht Iserlohn HRB 11096\nKOSTAL Mobility Holding SE – Lüdenscheid",
      "type": "Einreichung neuer Dokumente",
      "state": "Nordrhein-Westfalen",
      "amtsgericht": "Amtsgericht Iserlohn",
      "registernummer": "HRB 11096",
      "registerart": "HRB",
      "company_name": "KOSTAL Mobility Holding SE",
      "company_seat": "Lüdenscheid",
      "details": "20.12.2025 (Bekanntmachungsdatum)\n\nNordrhein-Westfalen Amtsgericht Iserlohn HRB 11096\nEinreichung neuer Dokumente\n\nKOSTAL Mobility Holding SE\nEuropäische Aktiengesellschaft (SE)\nLüdenscheid\n\nDem Registergericht ist eine neue Liste der Mitglieder des Aufsichtsrates eingereicht worden."
    }
  ]
}