{
  "date": "2025-12-11",
  "date_of_scrape": "2025-12-12T04:17:39.224Z",
  "tool_version": "0.2.0",
  "number_of_announcements": 124,
  "announcements": [
    {
      "date": "2025-12-11",
      "id": "139709",
      "original_text": "Registerbekanntmachung nach dem Umwandlungsgesetz\nBayern Amtsgericht Ansbach GsR 241\nTeam Steinmetz Fabian Slabinak & Andreas Lehrieder eGbR – Dietenhofen",
      "type": "Registerbekanntmachung nach dem Umwandlungsgesetz",
      "state": "Bayern",
      "amtsgericht": "Amtsgericht Ansbach",
      "registernummer": "GsR 241",
      "registerart": "GsR",
      "company_name": "Team Steinmetz Fabian Slabinak & Andreas Lehrieder eGbR",
      "company_seat": "Dietenhofen",
      "details": "11.12.2025 (Bekanntmachungsdatum)\n\nBayern Amtsgericht Ansbach GsR 241\nRegisterbekanntmachung nach dem Umwandlungsgesetz 10.12.2025 (Eintragungsdatum)\n\nTeam Steinmetz Fabian Slabinak & Andreas Lehrieder eGbR\nGesellschaft bürgerlichen Rechts\nDietenhofen\n\nDen Gläubigern des formwechselnden Rechtsträgers ist, wenn sie binnen sechs Monaten nach dem Tag, an dem die Eintragung des Formwechsels nach § 201 UmwG als bekannt gemacht gilt, ihren Anspruch nach Grund und Höhe in Textform anmelden, Sicherheit zu leisten, soweit sie nicht Befriedigung verlangen können. Dieses Recht steht den Gläubigern jedoch nur zu, wenn sie glaubhaft machen, dass durch den Formwechsel die Erfüllung ihrer Forderung gefährdet wird."
    },
    {
      "date": "2025-12-11",
      "id": "139710",
      "original_text": "Registerbekanntmachung nach dem Umwandlungsgesetz\nBayern Amtsgericht Fürth HRB 13680\nPX Immobilien GmbH – Fürth",
      "type": "Registerbekanntmachung nach dem Umwandlungsgesetz",
      "state": "Bayern",
      "amtsgericht": "Amtsgericht Fürth",
      "registernummer": "HRB 13680",
      "registerart": "HRB",
      "company_name": "PX Immobilien GmbH",
      "company_seat": "Fürth",
      "details": "11.12.2025 (Bekanntmachungsdatum)\n\nBayern Amtsgericht Fürth HRB 13680\nRegisterbekanntmachung nach dem Umwandlungsgesetz 10.12.2025 (Eintragungsdatum)\n\nPX Immobilien GmbH\nGesellschaft mit beschränkter Haftung\nFürth\n\nDen Gläubigern der an der Verschmelzung beteiligten Rechtsträger ist, wenn sie binnen sechs Monaten nach dem Tag, an dem die Eintragung der Verschmelzung in das Register des Sitzes desjenigen Rechtsträgers, dessen Gläubiger sie sind, nach § 19 Abs. 3 UmwG als bekannt gemacht gilt, ihren Anspruch nach Grund und Höhe in Textform anmelden, Sicherheit zu leisten, soweit sie nicht Befriedigung verlangen können. Dieses Recht steht den Gläubigern jedoch nur zu, wenn sie glaubhaft machen, dass durch die Verschmelzung die Erfüllung ihrer Forderung gefährdet wird."
    },
    {
      "date": "2025-12-11",
      "id": "139711",
      "original_text": "Registerbekanntmachung nach dem Umwandlungsgesetz\nBayern Amtsgericht Fürth HRB 15918\nP&P Gruppe Nürnberg GmbH – Fürth",
      "type": "Registerbekanntmachung nach dem Umwandlungsgesetz",
      "state": "Bayern",
      "amtsgericht": "Amtsgericht Fürth",
      "registernummer": "HRB 15918",
      "registerart": "HRB",
      "company_name": "P&P Gruppe Nürnberg GmbH",
      "company_seat": "Fürth",
      "details": "11.12.2025 (Bekanntmachungsdatum)\n\nBayern Amtsgericht Fürth HRB 15918\nRegisterbekanntmachung nach dem Umwandlungsgesetz 10.12.2025 (Eintragungsdatum)\n\nP&P Gruppe Nürnberg GmbH\nGesellschaft mit beschränkter Haftung\nFürth\n\nDen Gläubigern der an der Verschmelzung beteiligten Rechtsträger ist, wenn sie binnen sechs Monaten nach dem Tag, an dem die Eintragung der Verschmelzung in das Register des Sitzes desjenigen Rechtsträgers, dessen Gläubiger sie sind, nach § 19 Abs. 3 UmwG als bekannt gemacht gilt, ihren Anspruch nach Grund und Höhe in Textform anmelden, Sicherheit zu leisten, soweit sie nicht Befriedigung verlangen können. Dieses Recht steht den Gläubigern jedoch nur zu, wenn sie glaubhaft machen, dass durch die Verschmelzung die Erfüllung ihrer Forderung gefährdet wird."
    },
    {
      "date": "2025-12-11",
      "id": "139712",
      "original_text": "Einreichung neuer Dokumente\nBayern Amtsgericht München HRB 223251\nTexas Instruments EMEA Sales GmbH – Freising",
      "type": "Einreichung neuer Dokumente",
      "state": "Bayern",
      "amtsgericht": "Amtsgericht München",
      "registernummer": "HRB 223251",
      "registerart": "HRB",
      "company_name": "Texas Instruments EMEA Sales GmbH",
      "company_seat": "Freising",
      "details": "11.12.2025 (Bekanntmachungsdatum)\n\nBayern Amtsgericht München HRB 223251\nEinreichung neuer Dokumente 10.12.2025 (Eintragungsdatum)\n\nTexas Instruments EMEA Sales GmbH\nGesellschaft mit beschränkter Haftung\nFreising\n\nDem Amtsgericht München -Registergericht- ist eine Liste der Mitglieder des Aufsichtsrats eingereicht worden, § 52 Abs. 3 S. 2 GmbHG."
    },
    {
      "date": "2025-12-11",
      "id": "139713",
      "original_text": "Löschungsankündigung\nBayern Amtsgericht Nürnberg HRB 35259\nAK-SE Real Estate Management GmbH – Nürnberg",
      "type": "Löschungsankündigung",
      "state": "Bayern",
      "amtsgericht": "Amtsgericht Nürnberg",
      "registernummer": "HRB 35259",
      "registerart": "HRB",
      "company_name": "AK-SE Real Estate Management GmbH",
      "company_seat": "Nürnberg",
      "details": "11.12.2025 (Bekanntmachungsdatum)\n\nBayern Amtsgericht Nürnberg HRB 35259\nLöschungsankündigung\n\nAK-SE Real Estate Management GmbH\nGesellschaft mit beschränkter Haftung\nNürnberg\n\nDas Registergericht beabsichtigt, die im Handelsregister eingetragene Gesellschaft wegen Vermögenslosigkeit von Amts wegen nach § 394 FamFG zu löschen. Die Frist zur Erhebung eines Widerspruchs ist auf einen Monat festgesetzt."
    },
    {
      "date": "2025-12-11",
      "id": "139714",
      "original_text": "Registerbekanntmachung nach dem Umwandlungsgesetz\nBayern Amtsgericht München HRB 107077\nBaywobau Bauträger GmbH – München",
      "type": "Registerbekanntmachung nach dem Umwandlungsgesetz",
      "state": "Bayern",
      "amtsgericht": "Amtsgericht München",
      "registernummer": "HRB 107077",
      "registerart": "HRB",
      "company_name": "Baywobau Bauträger GmbH",
      "company_seat": "München",
      "details": "11.12.2025 (Bekanntmachungsdatum)\n\nBayern Amtsgericht München HRB 107077\nRegisterbekanntmachung nach dem Umwandlungsgesetz 10.12.2025 (Eintragungsdatum)\n\nBaywobau Bauträger GmbH\nGesellschaft mit beschränkter Haftung\nMünchen\n\nDen Gläubigern der an der Verschmelzung beteiligten Rechtsträger ist, wenn sie binnen sechs Monaten nach dem Tag, an dem die Eintragung der Verschmelzung in das Register des Sitzes desjenigen Rechtsträgers, dessen Gläubiger sie sind, nach § 19 Abs. 3 UmwG als bekannt gemacht gilt, ihren Anspruch nach Grund und Höhe in Textform anmelden, Sicherheit zu leisten, soweit sie nicht Befriedigung verlangen können. Dieses Recht steht den Gläubigern jedoch nur zu, wenn sie glaubhaft machen, dass durch die Verschmelzung die Erfüllung ihrer Forderung gefährdet wird."
    },
    {
      "date": "2025-12-11",
      "id": "139715",
      "original_text": "Einreichung neuer Dokumente\nBayern Amtsgericht München HRB 158196\nF24 AG – München",
      "type": "Einreichung neuer Dokumente",
      "state": "Bayern",
      "amtsgericht": "Amtsgericht München",
      "registernummer": "HRB 158196",
      "registerart": "HRB",
      "company_name": "F24 AG",
      "company_seat": "München",
      "details": "11.12.2025 (Bekanntmachungsdatum)\n\nBayern Amtsgericht München HRB 158196\nEinreichung neuer Dokumente\n\nF24 AG\nAktiengesellschaft\nMünchen\n\nDem Amtsgericht München -Registergericht- ist eine Liste der Mitglieder des Aufsichtsrats eingereicht worden, § 106 AktG."
    },
    {
      "date": "2025-12-11",
      "id": "139716",
      "original_text": "Registerbekanntmachung nach dem Umwandlungsgesetz\nBayern Amtsgericht Traunstein HRB 46\nHamberger Industriewerke GmbH – Stephanskirchen",
      "type": "Registerbekanntmachung nach dem Umwandlungsgesetz",
      "state": "Bayern",
      "amtsgericht": "Amtsgericht Traunstein",
      "registernummer": "HRB 46",
      "registerart": "HRB",
      "company_name": "Hamberger Industriewerke GmbH",
      "company_seat": "Stephanskirchen",
      "details": "11.12.2025 (Bekanntmachungsdatum)\n\nBayern Amtsgericht Traunstein HRB 46\nRegisterbekanntmachung nach dem Umwandlungsgesetz 10.12.2025 (Eintragungsdatum)\n\nHamberger Industriewerke GmbH\nGesellschaft mit beschränkter Haftung\nStephanskirchen\n\nDen Gläubigern der an der Verschmelzung beteiligten Rechtsträger ist, wenn sie binnen sechs Monaten nach dem Tag, an dem die Eintragung der Verschmelzung in das Register des Sitzes desjenigen Rechtsträgers, dessen Gläubiger sie sind, nach § 19 Abs. 3 UmwG als bekannt gemacht gilt, ihren Anspruch nach Grund und Höhe in Textform anmelden, Sicherheit zu leisten, soweit sie nicht Befriedigung verlangen können. Dieses Recht steht den Gläubigern jedoch nur zu, wenn sie glaubhaft machen, dass durch die Verschmelzung die Erfüllung ihrer Forderung gefährdet wird."
    },
    {
      "date": "2025-12-11",
      "id": "139717",
      "original_text": "Registerbekanntmachung nach dem Umwandlungsgesetz\nBayern Amtsgericht Aschaffenburg HRA 6761\nFath Bau e.K. – Hausen",
      "type": "Registerbekanntmachung nach dem Umwandlungsgesetz",
      "state": "Bayern",
      "amtsgericht": "Amtsgericht Aschaffenburg",
      "registernummer": "HRA 6761",
      "registerart": "HRA",
      "company_name": "Fath Bau e.K.",
      "company_seat": "Hausen",
      "details": "11.12.2025 (Bekanntmachungsdatum)\n\nBayern Amtsgericht Aschaffenburg HRA 6761\nRegisterbekanntmachung nach dem Umwandlungsgesetz 10.12.2025 (Eintragungsdatum)\n\nFath Bau e.K.\nEinzelkaufmann / Einzelkauffrau\nHausen\n\nDen Gläubigern der an der Ausgliederung beteiligten Rechtsträger ist, wenn sie binnen sechs Monaten nach dem Tag, an dem die Eintragung der Ausgliederung in das Register des Sitzes desjenigen Rechtsträgers, dessen Gläubiger sie sind, nach §§ 125, 19 Abs. 3 UmwG als bekannt gemacht gilt, ihren Anspruch nach Grund und Höhe in Textform anmelden, Sicherheit zu leisten, soweit sie nicht Befriedigung verlangen können. Dieses Recht steht den Gläubigern jedoch nur zu, wenn sie glaubhaft machen, dass durch die Ausgliederung die Erfüllung ihrer Forderung gefährdet wird."
    },
    {
      "date": "2025-12-11",
      "id": "139718",
      "original_text": "Registerbekanntmachung nach dem Umwandlungsgesetz\nBayern Amtsgericht München HRB 218634\nDataStax Germany GmbH – München",
      "type": "Registerbekanntmachung nach dem Umwandlungsgesetz",
      "state": "Bayern",
      "amtsgericht": "Amtsgericht München",
      "registernummer": "HRB 218634",
      "registerart": "HRB",
      "company_name": "DataStax Germany GmbH",
      "company_seat": "München",
      "details": "11.12.2025 (Bekanntmachungsdatum)\n\nBayern Amtsgericht München HRB 218634\nRegisterbekanntmachung nach dem Umwandlungsgesetz 10.12.2025 (Eintragungsdatum)\n\nDataStax Germany GmbH\nGesellschaft mit beschränkter Haftung\nMünchen\n\nDen Gläubigern der an der Verschmelzung beteiligten Rechtsträger ist, wenn sie binnen sechs Monaten nach dem Tag, an dem die Eintragung der Verschmelzung in das Register des Sitzes desjenigen Rechtsträgers, dessen Gläubiger sie sind, nach § 19 Abs. 3 UmwG als bekannt gemacht gilt, ihren Anspruch nach Grund und Höhe in Textform anmelden, Sicherheit zu leisten, soweit sie nicht Befriedigung verlangen können. Dieses Recht steht den Gläubigern jedoch nur zu, wenn sie glaubhaft machen, dass durch die Verschmelzung die Erfüllung ihrer Forderung gefährdet wird."
    },
    {
      "date": "2025-12-11",
      "id": "139719",
      "original_text": "Registerbekanntmachung nach dem Umwandlungsgesetz\nBayern Amtsgericht Würzburg HRB 17190\nKammann machen GmbH – Eibelstadt",
      "type": "Registerbekanntmachung nach dem Umwandlungsgesetz",
      "state": "Bayern",
      "amtsgericht": "Amtsgericht Würzburg",
      "registernummer": "HRB 17190",
      "registerart": "HRB",
      "company_name": "Kammann machen GmbH",
      "company_seat": "Eibelstadt",
      "details": "11.12.2025 (Bekanntmachungsdatum)\n\nBayern Amtsgericht Würzburg HRB 17190\nRegisterbekanntmachung nach dem Umwandlungsgesetz 10.12.2025 (Eintragungsdatum)\n\nKammann machen GmbH\nGesellschaft mit beschränkter Haftung\nEibelstadt\n\nDen Gläubigern der an der Verschmelzung beteiligten Rechtsträger ist, wenn sie binnen sechs Monaten nach dem Tag, an dem die Eintragung der Verschmelzung in das Register des Sitzes desjenigen Rechtsträgers, dessen Gläubiger sie sind, nach § 19 Abs. 3 UmwG als bekannt gemacht gilt, ihren Anspruch nach Grund und Höhe in Textform anmelden, Sicherheit zu leisten, soweit sie nicht Befriedigung verlangen können. Dieses Recht steht den Gläubigern jedoch nur zu, wenn sie glaubhaft machen, dass durch die Verschmelzung die Erfüllung ihrer Forderung gefährdet wird."
    },
    {
      "date": "2025-12-11",
      "id": "139720",
      "original_text": "Registerbekanntmachung nach dem Umwandlungsgesetz\nBayern Amtsgericht München HRA 122030\nSomething Technology e.K., Inhaberin Sanela Thunig – Starnberg",
      "type": "Registerbekanntmachung nach dem Umwandlungsgesetz",
      "state": "Bayern",
      "amtsgericht": "Amtsgericht München",
      "registernummer": "HRA 122030",
      "registerart": "HRA",
      "company_name": "Something Technology e.K., Inhaberin Sanela Thunig",
      "company_seat": "Starnberg",
      "details": "11.12.2025 (Bekanntmachungsdatum)\n\nBayern Amtsgericht München HRA 122030\nRegisterbekanntmachung nach dem Umwandlungsgesetz 10.12.2025 (Eintragungsdatum)\n\nSomething Technology e.K., Inhaberin Sanela Thunig\nEinzelkaufmann / Einzelkauffrau\nStarnberg\n\nZur Verschmelzung der Something Technology GmbH mit Sitz in Starnberg (Amtsgericht München HRB 264568) auf des Vermögen der Alleingesellschafterin Sanela Thunig , eingetragen unter Something Technology e.K. mit Sitz in Starnberg (Amtsgericht München HRA 122030) Den Gläubigern der an der Verschmelzung beteiligten Rechtsträger ist, wenn sie binnen sechs Monaten nach dem Tag, an dem die Eintragung der Verschmelzung in das Register des Sitzes desjenigen Rechtsträgers, dessen Gläubiger sie sind, nach § 19 Abs. 3 UmwG als bekannt gemacht gilt, ihren Anspruch nach Grund und Höhe in Textform anmelden, Sicherheit zu leisten, soweit sie nicht Befriedigung verlangen können. Dieses Recht steht den Gläubigern jedoch nur zu, wenn sie glaubhaft machen, dass durch die Verschmelzung die Erfüllung ihrer Forderung gefährdet wird."
    },
    {
      "date": "2025-12-11",
      "id": "139721",
      "original_text": "Registerbekanntmachung nach dem Umwandlungsgesetz\nBayern Amtsgericht Nürnberg GsR 721\nAlicia und Nicolas Ahlemeyer eGbR – Nürnberg",
      "type": "Registerbekanntmachung nach dem Umwandlungsgesetz",
      "state": "Bayern",
      "amtsgericht": "Amtsgericht Nürnberg",
      "registernummer": "GsR 721",
      "registerart": "GsR",
      "company_name": "Alicia und Nicolas Ahlemeyer eGbR",
      "company_seat": "Nürnberg",
      "details": "11.12.2025 (Bekanntmachungsdatum)\n\nBayern Amtsgericht Nürnberg GsR 721\nRegisterbekanntmachung nach dem Umwandlungsgesetz 10.12.2025 (Eintragungsdatum)\n\nAlicia und Nicolas Ahlemeyer eGbR\nGesellschaft bürgerlichen Rechts\nNürnberg\n\nDen Gläubigern des formwechselnden Rechtsträgers ist, wenn sie binnen sechs Monaten nach dem Tag, an dem die Eintragung des Formwechsels nach § 201 UmwG als bekannt gemacht gilt, ihren Anspruch nach Grund und Höhe in Textform anmelden, Sicherheit zu leisten, soweit sie nicht Befriedigung verlangen können. Dieses Recht steht den Gläubigern jedoch nur zu, wenn sie glaubhaft machen, dass durch den Formwechsel die Erfüllung ihrer Forderung gefährdet wird."
    },
    {
      "date": "2025-12-11",
      "id": "139722",
      "original_text": "Einreichung neuer Dokumente\nBayern Amtsgericht München HRB 264451\nSchön Klinik SE – München",
      "type": "Einreichung neuer Dokumente",
      "state": "Bayern",
      "amtsgericht": "Amtsgericht München",
      "registernummer": "HRB 264451",
      "registerart": "HRB",
      "company_name": "Schön Klinik SE",
      "company_seat": "München",
      "details": "11.12.2025 (Bekanntmachungsdatum)\n\nBayern Amtsgericht München HRB 264451\nEinreichung neuer Dokumente 10.12.2025 (Eintragungsdatum)\n\nSchön Klinik SE\nEuropäische Aktiengesellschaft (SE)\nMünchen\n\nDem Amtsgericht München -Registergericht- ist eine Liste der Mitglieder des Aufsichtsrats eingereicht worden, Art. 9 Abs. 1 Buchst. c (ii) SE-VO i.V.m. § 106 AktG."
    },
    {
      "date": "2025-12-11",
      "id": "139723",
      "original_text": "Registerbekanntmachung nach dem Umwandlungsgesetz\nBayern Amtsgericht München HRB 305043\nhabermeyer.therapie GmbH – Polling",
      "type": "Registerbekanntmachung nach dem Umwandlungsgesetz",
      "state": "Bayern",
      "amtsgericht": "Amtsgericht München",
      "registernummer": "HRB 305043",
      "registerart": "HRB",
      "company_name": "habermeyer.therapie GmbH",
      "company_seat": "Polling",
      "details": "11.12.2025 (Bekanntmachungsdatum)\n\nBayern Amtsgericht München HRB 305043\nRegisterbekanntmachung nach dem Umwandlungsgesetz 10.12.2025 (Eintragungsdatum)\n\nhabermeyer.therapie GmbH\nGesellschaft mit beschränkter Haftung\nPolling\n\nDen Gläubigern der an der Spaltung beteiligten Rechtsträger ist, wenn sie binnen sechs Monaten nach dem Tag, an dem die Eintragung der Spaltung in das Register des Sitzes desjenigen Rechtsträgers, dessen Gläubiger sie sind, nach §§ 125, 19 Abs. 3 UmwG als bekannt gemacht gilt, ihren Anspruch nach Grund und Höhe in Textform anmelden, Sicherheit zu leisten, soweit sie nicht Befriedigung verlangen können. Dieses Recht steht den Gläubigern jedoch nur zu, wenn sie glaubhaft machen, dass durch die Spaltung die Erfüllung ihrer Forderung gefährdet wird."
    },
    {
      "date": "2025-12-11",
      "id": "139724",
      "original_text": "Registerbekanntmachung nach dem Umwandlungsgesetz\nBayern Amtsgericht Nürnberg HRB 29531\nAHL Grundstücksverwaltungs GmbH – Nürnberg",
      "type": "Registerbekanntmachung nach dem Umwandlungsgesetz",
      "state": "Bayern",
      "amtsgericht": "Amtsgericht Nürnberg",
      "registernummer": "HRB 29531",
      "registerart": "HRB",
      "company_name": "AHL Grundstücksverwaltungs GmbH",
      "company_seat": "Nürnberg",
      "details": "11.12.2025 (Bekanntmachungsdatum)\n\nBayern Amtsgericht Nürnberg HRB 29531\nRegisterbekanntmachung nach dem Umwandlungsgesetz 10.12.2025 (Eintragungsdatum)\n\nAHL Grundstücksverwaltungs GmbH\nGesellschaft mit beschränkter Haftung\nNürnberg\n\nDen Gläubigern des formwechselnden Rechtsträgers ist, wenn sie binnen sechs Monaten nach dem Tag, an dem die Eintragung des Formwechsels nach § 201 UmwG als bekannt gemacht gilt, ihren Anspruch nach Grund und Höhe in Textform anmelden, Sicherheit zu leisten, soweit sie nicht Befriedigung verlangen können. Dieses Recht steht den Gläubigern jedoch nur zu, wenn sie glaubhaft machen, dass durch den Formwechsel die Erfüllung ihrer Forderung gefährdet wird."
    },
    {
      "date": "2025-12-11",
      "id": "139725",
      "original_text": "Löschungsankündigung\nBayern Amtsgericht München HRB 226772\nTherapiezentrum München UG (haftungsbeschränkt) – München",
      "type": "Löschungsankündigung",
      "state": "Bayern",
      "amtsgericht": "Amtsgericht München",
      "registernummer": "HRB 226772",
      "registerart": "HRB",
      "company_name": "Therapiezentrum München UG (haftungsbeschränkt)",
      "company_seat": "München",
      "details": "11.12.2025 (Bekanntmachungsdatum)\n\nBayern Amtsgericht München HRB 226772\nLöschungsankündigung\n\nTherapiezentrum München UG (haftungsbeschränkt)\nGesellschaft mit beschränkter Haftung\nMünchen\n\nDas Registergericht beabsichtigt, die im Handelsregister eingetragene Gesellschaft wegen Vermögenslosigkeit von Amts wegen nach § 394 FamFG zu löschen. Die Frist zur Erhebung eines Widerspruchs ist auf drei Monate festgesetzt."
    },
    {
      "date": "2025-12-11",
      "id": "139726",
      "original_text": "Registerbekanntmachung nach dem Umwandlungsgesetz\nBayern Amtsgericht Traunstein HRB 32487\nAkustik Plus Behringen Verwaltungs GmbH – Stephanskirchen",
      "type": "Registerbekanntmachung nach dem Umwandlungsgesetz",
      "state": "Bayern",
      "amtsgericht": "Amtsgericht Traunstein",
      "registernummer": "HRB 32487",
      "registerart": "HRB",
      "company_name": "Akustik Plus Behringen Verwaltungs GmbH",
      "company_seat": "Stephanskirchen",
      "details": "11.12.2025 (Bekanntmachungsdatum)\n\nBayern Amtsgericht Traunstein HRB 32487\nRegisterbekanntmachung nach dem Umwandlungsgesetz 10.12.2025 (Eintragungsdatum)\n\nAkustik Plus Behringen Verwaltungs GmbH\nGesellschaft mit beschränkter Haftung\nStephanskirchen\n\nDen Gläubigern der an der Verschmelzung beteiligten Rechtsträger ist, wenn sie binnen sechs Monaten nach dem Tag, an dem die Eintragung der Verschmelzung in das Register des Sitzes desjenigen Rechtsträgers, dessen Gläubiger sie sind, nach § 19 Abs. 3 UmwG als bekannt gemacht gilt, ihren Anspruch nach Grund und Höhe in Textform anmelden, Sicherheit zu leisten, soweit sie nicht Befriedigung verlangen können. Dieses Recht steht den Gläubigern jedoch nur zu, wenn sie glaubhaft machen, dass durch die Verschmelzung die Erfüllung ihrer Forderung gefährdet wird."
    },
    {
      "date": "2025-12-11",
      "id": "139727",
      "original_text": "Löschungsankündigung\nBayern Amtsgericht Fürth HRB 14000\nFräger WohnRaum² GmbH – Hemhofen",
      "type": "Löschungsankündigung",
      "state": "Bayern",
      "amtsgericht": "Amtsgericht Fürth",
      "registernummer": "HRB 14000",
      "registerart": "HRB",
      "company_name": "Fräger WohnRaum² GmbH",
      "company_seat": "Hemhofen",
      "details": "11.12.2025 (Bekanntmachungsdatum)\n\nBayern Amtsgericht Fürth HRB 14000\nLöschungsankündigung\n\nFräger WohnRaum² GmbH\nGesellschaft mit beschränkter Haftung\nHemhofen\n\nDas Registergericht beabsichtigt, die im Handelsregister eingetragene Gesellschaft wegen Vermögenslosigkeit von Amts wegen nach § 394 FamFG zu löschen. Die Frist zur Erhebung eines Widerspruchs ist auf drei Monate festgesetzt."
    },
    {
      "date": "2025-12-11",
      "id": "139728",
      "original_text": "Registerbekanntmachung nach dem Umwandlungsgesetz\nBayern Amtsgericht München HRB 214165\ngominga eServices GmbH – München",
      "type": "Registerbekanntmachung nach dem Umwandlungsgesetz",
      "state": "Bayern",
      "amtsgericht": "Amtsgericht München",
      "registernummer": "HRB 214165",
      "registerart": "HRB",
      "company_name": "gominga eServices GmbH",
      "company_seat": "München",
      "details": "11.12.2025 (Bekanntmachungsdatum)\n\nBayern Amtsgericht München HRB 214165\nRegisterbekanntmachung nach dem Umwandlungsgesetz 10.12.2025 (Eintragungsdatum)\n\ngominga eServices GmbH\nGesellschaft mit beschränkter Haftung\nMünchen\n\nDen Gläubigern der an der Verschmelzung beteiligten Rechtsträger ist, wenn sie binnen sechs Monaten nach dem Tag, an dem die Eintragung der Verschmelzung in das Register des Sitzes desjenigen Rechtsträgers, dessen Gläubiger sie sind, nach § 19 Abs. 3 UmwG als bekannt gemacht gilt, ihren Anspruch nach Grund und Höhe in Textform anmelden, Sicherheit zu leisten, soweit sie nicht Befriedigung verlangen können. Dieses Recht steht den Gläubigern jedoch nur zu, wenn sie glaubhaft machen, dass durch die Verschmelzung die Erfüllung ihrer Forderung gefährdet wird."
    },
    {
      "date": "2025-12-11",
      "id": "139729",
      "original_text": "Einreichung neuer Dokumente\nBayern Amtsgericht München HRB 40960\nTexas Instruments Deutschland Gesellschaft mit beschränkter Haftung – Freising",
      "type": "Einreichung neuer Dokumente",
      "state": "Bayern",
      "amtsgericht": "Amtsgericht München",
      "registernummer": "HRB 40960",
      "registerart": "HRB",
      "company_name": "Texas Instruments Deutschland Gesellschaft mit beschränkter Haftung",
      "company_seat": "Freising",
      "details": "11.12.2025 (Bekanntmachungsdatum)\n\nBayern Amtsgericht München HRB 40960\nEinreichung neuer Dokumente\n\nTexas Instruments Deutschland Gesellschaft mit beschränkter Haftung\nGesellschaft mit beschränkter Haftung\nFreising\n\nDem Amtsgericht München -Registergericht- ist eine Liste der Mitglieder des Aufsichtsrats eingereicht worden, § 52 Abs. 3 S. 2 GmbHG."
    },
    {
      "date": "2025-12-11",
      "id": "139730",
      "original_text": "Einreichung neuer Dokumente\nBayern Amtsgericht Würzburg HRB 10733\nSchneider Electric Automation GmbH – Marktheidenfeld",
      "type": "Einreichung neuer Dokumente",
      "state": "Bayern",
      "amtsgericht": "Amtsgericht Würzburg",
      "registernummer": "HRB 10733",
      "registerart": "HRB",
      "company_name": "Schneider Electric Automation GmbH",
      "company_seat": "Marktheidenfeld",
      "details": "11.12.2025 (Bekanntmachungsdatum)\n\nBayern Amtsgericht Würzburg HRB 10733\nEinreichung neuer Dokumente\n\nSchneider Electric Automation GmbH\nGesellschaft mit beschränkter Haftung\nMarktheidenfeld\n\nDem Amtsgericht Würzburg -Registergericht- ist eine Liste der Mitglieder des Aufsichtsrats eingereicht worden, § 52 Abs. 3 S. 2 GmbHG."
    },
    {
      "date": "2025-12-11",
      "id": "139731",
      "original_text": "Registerbekanntmachung nach dem Umwandlungsgesetz\nBayern Amtsgericht München HRB 226386\nPHÖNIX-Seniorenzentrum Ahornhof GmbH – München",
      "type": "Registerbekanntmachung nach dem Umwandlungsgesetz",
      "state": "Bayern",
      "amtsgericht": "Amtsgericht München",
      "registernummer": "HRB 226386",
      "registerart": "HRB",
      "company_name": "PHÖNIX-Seniorenzentrum Ahornhof GmbH",
      "company_seat": "München",
      "details": "11.12.2025 (Bekanntmachungsdatum)\n\nBayern Amtsgericht München HRB 226386\nRegisterbekanntmachung nach dem Umwandlungsgesetz 10.12.2025 (Eintragungsdatum)\n\nPHÖNIX-Seniorenzentrum Ahornhof GmbH\nGesellschaft mit beschränkter Haftung\nMünchen\n\nDen Gläubigern der an der Verschmelzung beteiligten Rechtsträger ist, wenn sie binnen sechs Monaten nach dem Tag, an dem die Eintragung der Verschmelzung in das Register des Sitzes desjenigen Rechtsträgers, dessen Gläubiger sie sind, nach § 19 Abs. 3 UmwG als bekannt gemacht gilt, ihren Anspruch nach Grund und Höhe in Textform anmelden, Sicherheit zu leisten, soweit sie nicht Befriedigung verlangen können. Dieses Recht steht den Gläubigern jedoch nur zu, wenn sie glaubhaft machen, dass durch die Verschmelzung die Erfüllung ihrer Forderung gefährdet wird."
    },
    {
      "date": "2025-12-11",
      "id": "139732",
      "original_text": "Registerbekanntmachung nach dem Umwandlungsgesetz\nBayern Amtsgericht Fürth HRB 17525\nPeter Family Office Objekt 8 GmbH – Fürth",
      "type": "Registerbekanntmachung nach dem Umwandlungsgesetz",
      "state": "Bayern",
      "amtsgericht": "Amtsgericht Fürth",
      "registernummer": "HRB 17525",
      "registerart": "HRB",
      "company_name": "Peter Family Office Objekt 8 GmbH",
      "company_seat": "Fürth",
      "details": "11.12.2025 (Bekanntmachungsdatum)\n\nBayern Amtsgericht Fürth HRB 17525\nRegisterbekanntmachung nach dem Umwandlungsgesetz 10.12.2025 (Eintragungsdatum)\n\nPeter Family Office Objekt 8 GmbH\nGesellschaft mit beschränkter Haftung\nFürth\n\nDen Gläubigern der an der Verschmelzung beteiligten Rechtsträger ist, wenn sie binnen sechs Monaten nach dem Tag, an dem die Eintragung der Verschmelzung in das Register des Sitzes desjenigen Rechtsträgers, dessen Gläubiger sie sind, nach § 19 Abs. 3 UmwG als bekannt gemacht gilt, ihren Anspruch nach Grund und Höhe in Textform anmelden, Sicherheit zu leisten, soweit sie nicht Befriedigung verlangen können. Dieses Recht steht den Gläubigern jedoch nur zu, wenn sie glaubhaft machen, dass durch die Verschmelzung die Erfüllung ihrer Forderung gefährdet wird."
    },
    {
      "date": "2025-12-11",
      "id": "139733",
      "original_text": "Sonstige Registerbekanntmachung\nBayern Amtsgericht München HRB 87693\nBertrandt Systems & Consulting GmbH – Taufkirchen",
      "type": "Sonstige Registerbekanntmachung",
      "state": "Bayern",
      "amtsgericht": "Amtsgericht München",
      "registernummer": "HRB 87693",
      "registerart": "HRB",
      "company_name": "Bertrandt Systems & Consulting GmbH",
      "company_seat": "Taufkirchen",
      "details": "11.12.2025 (Bekanntmachungsdatum)\n\nBayern Amtsgericht München HRB 87693\nSonstige Registerbekanntmachung 10.12.2025 (Eintragungsdatum)\n\nBertrandt Systems & Consulting GmbH\nGesellschaft mit beschränkter Haftung\nTaufkirchen\n\nDen Gläubigern der Gesellschaft, deren Forderungen begründet worden sind, bevor die Eintragung der Beendigung des Beherrschungs- und Gewinnabführungsvertrages in das Handelsregister nach § 10 des Handelsgesetzbuches als bekanntgemacht gilt, hat der andere Vertragsteil Sicherheit zu leisten, wenn sie sich binnen sechs Monaten nach der Bekanntmachung der Eintragung zu diesem Zweck bei ihm melden."
    },
    {
      "date": "2025-12-11",
      "id": "139734",
      "original_text": "Registerbekanntmachung nach dem Umwandlungsgesetz\nBayern Amtsgericht Ansbach HRB 8867\nTeam Steinmetz GmbH – Dietenhofen",
      "type": "Registerbekanntmachung nach dem Umwandlungsgesetz",
      "state": "Bayern",
      "amtsgericht": "Amtsgericht Ansbach",
      "registernummer": "HRB 8867",
      "registerart": "HRB",
      "company_name": "Team Steinmetz GmbH",
      "company_seat": "Dietenhofen",
      "details": "11.12.2025 (Bekanntmachungsdatum)\n\nBayern Amtsgericht Ansbach HRB 8867\nRegisterbekanntmachung nach dem Umwandlungsgesetz 10.12.2025 (Eintragungsdatum)\n\nTeam Steinmetz GmbH\nGesellschaft mit beschränkter Haftung\nDietenhofen\n\nDen Gläubigern des formwechselnden Rechtsträgers ist, wenn sie binnen sechs Monaten nach dem Tag, an dem die Eintragung des Formwechsels nach § 201 UmwG als bekannt gemacht gilt, ihren Anspruch nach Grund und Höhe in Textform anmelden, Sicherheit zu leisten, soweit sie nicht Befriedigung verlangen können. Dieses Recht steht den Gläubigern jedoch nur zu, wenn sie glaubhaft machen, dass durch den Formwechsel die Erfüllung ihrer Forderung gefährdet wird."
    },
    {
      "date": "2025-12-11",
      "id": "139735",
      "original_text": "Einreichung neuer Dokumente\nBayern Amtsgericht Traunstein HRB 19471\nVERBUND Innkraftwerke GmbH – Töging a. Inn",
      "type": "Einreichung neuer Dokumente",
      "state": "Bayern",
      "amtsgericht": "Amtsgericht Traunstein",
      "registernummer": "HRB 19471",
      "registerart": "HRB",
      "company_name": "VERBUND Innkraftwerke GmbH",
      "company_seat": "Töging a. Inn",
      "details": "11.12.2025 (Bekanntmachungsdatum)\n\nBayern Amtsgericht Traunstein HRB 19471\nEinreichung neuer Dokumente\n\nVERBUND Innkraftwerke GmbH\nGesellschaft mit beschränkter Haftung\nTöging a. Inn\n\nDem Amtsgericht Traunstein -Registergericht- ist eine Liste der Mitglieder des Aufsichtsrats eingereicht worden, § 52 Abs. 3 S. 2 GmbHG."
    },
    {
      "date": "2025-12-11",
      "id": "139736",
      "original_text": "Registerbekanntmachung nach dem Umwandlungsgesetz\nBerlin Amtsgericht Berlin (Charlottenburg) HRB 116862\nNiTi4u GmbH – Berlin",
      "type": "Registerbekanntmachung nach dem Umwandlungsgesetz",
      "state": "Berlin",
      "amtsgericht": "Amtsgericht Berlin (Charlottenburg)",
      "registernummer": "HRB 116862",
      "registerart": "HRB",
      "company_name": "NiTi4u GmbH",
      "company_seat": "Berlin",
      "details": "11.12.2025 (Bekanntmachungsdatum)\n\nBerlin Amtsgericht Berlin (Charlottenburg) HRB 116862\nRegisterbekanntmachung nach dem Umwandlungsgesetz 10.12.2025 (Eintragungsdatum)\n\nNiTi4u GmbH\nGesellschaft mit beschränkter Haftung\nBerlin\n\nZu Eintragungsnummer 7 vom 10.12.2025 wird als nicht eingetragen veröffentlicht: Den Gläubigern der an der Verschmelzung beteiligten Rechtsträger ist, wenn sie binnen sechs Monaten nach dem Tag, an dem die Eintragung der Verschmelzung in das Register des Sitzes desjenigen Rechtsträgers, dessen Gläubiger sie sind, als bekannt gemacht gilt, ihren Anspruch nach Grund und Höhe schriftlich anmelden, Sicherheit zu leisten, soweit sie nicht Befriedigung verlangen können. Dieses Recht steht den Gläubigern jedoch nur zu, wenn sie glaubhaft machen, dass durch die Verschmelzung die Erfüllung ihrer Forderung gefährdet wird. Das Recht, Sicherheitsleistung zu verlangen, steht Gläubigern nicht zu, die im Falle der Insolvenz ein Recht auf vorzugsweise Befriedigung aus einer Deckungsmasse haben, die nach gesetzlicher Vorschrift zu ihrem Schutz errichtet und staatlich überwacht ist."
    },
    {
      "date": "2025-12-11",
      "id": "139737",
      "original_text": "Registerbekanntmachung nach dem Umwandlungsgesetz\nBerlin Amtsgericht Berlin (Charlottenburg) HRB 115763\nMESANTIS GmbH – Berlin",
      "type": "Registerbekanntmachung nach dem Umwandlungsgesetz",
      "state": "Berlin",
      "amtsgericht": "Amtsgericht Berlin (Charlottenburg)",
      "registernummer": "HRB 115763",
      "registerart": "HRB",
      "company_name": "MESANTIS GmbH",
      "company_seat": "Berlin",
      "details": "11.12.2025 (Bekanntmachungsdatum)\n\nBerlin Amtsgericht Berlin (Charlottenburg) HRB 115763\nRegisterbekanntmachung nach dem Umwandlungsgesetz 10.12.2025 (Eintragungsdatum)\n\nMESANTIS GmbH\nGesellschaft mit beschränkter Haftung\nBerlin\n\nZu Eintragungsnummer 5 vom 10.12.2025 wird als nicht eingetragen veröffentlicht: Den Gläubigern der an der Verschmelzung beteiligten Rechtsträger ist, wenn sie binnen sechs Monaten nach dem Tag, an dem die Eintragung der Verschmelzung in das Register des Sitzes desjenigen Rechtsträgers, dessen Gläubiger sie sind, als bekannt gemacht gilt, ihren Anspruch nach Grund und Höhe schriftlich anmelden, Sicherheit zu leisten, soweit sie nicht Befriedigung verlangen können. Dieses Recht steht den Gläubigern jedoch nur zu, wenn sie glaubhaft machen, dass durch die Verschmelzung die Erfüllung ihrer Forderung gefährdet wird. Das Recht, Sicherheitsleistung zu verlangen, steht Gläubigern nicht zu, die im Falle der Insolvenz ein Recht auf vorzugsweise Befriedigung aus einer Deckungsmasse haben, die nach gesetzlicher Vorschrift zu ihrem Schutz errichtet und staatlich überwacht ist."
    },
    {
      "date": "2025-12-11",
      "id": "139738",
      "original_text": "Registerbekanntmachung nach dem Umwandlungsgesetz\nBaden-Württemberg Amtsgericht Mannheim HRB 756619\nMKD Schimscha GmbH – Ravenstein",
      "type": "Registerbekanntmachung nach dem Umwandlungsgesetz",
      "state": "Baden-Württemberg",
      "amtsgericht": "Amtsgericht Mannheim",
      "registernummer": "HRB 756619",
      "registerart": "HRB",
      "company_name": "MKD Schimscha GmbH",
      "company_seat": "Ravenstein",
      "details": "11.12.2025 (Bekanntmachungsdatum)\n\nBaden-Württemberg Amtsgericht Mannheim HRB 756619\nRegisterbekanntmachung nach dem Umwandlungsgesetz 11.12.2025 (Eintragungsdatum)\n\nMKD Schimscha GmbH\nGesellschaft mit beschränkter Haftung\nRavenstein\n\nDen Gläubigern des an dem Formwechsel beteiligten Rechtsträgers ist, wenn sie binnen sechs Monaten nach dem Tag, an dem die Eintragung des Formwechsels in das Register des Sitzes desjenigen Rechtsträgers, dessen Gläubiger sie sind, nach § 19 Abs. 3 UmwG als bekanntgemacht gilt, ihren Anspruch nach Grund und Höhe schriftlich anmelden, Sicherheit zu leisten, soweit sie nicht Befriedigung verlangen können. Dieses Recht steht den Gläubigern jedoch nur zu, wenn sie glaubhaft machen, dass durch den Formwechsel die Erfüllung ihrer Forderung gefährdet wird."
    },
    {
      "date": "2025-12-11",
      "id": "139739",
      "original_text": "Registerbekanntmachung nach dem Umwandlungsgesetz\nBaden-Württemberg Amtsgericht Mannheim HRA 712902\nMKD Schimscha UG (haftungsbeschränkt) & Co. KG – Ravenstein",
      "type": "Registerbekanntmachung nach dem Umwandlungsgesetz",
      "state": "Baden-Württemberg",
      "amtsgericht": "Amtsgericht Mannheim",
      "registernummer": "HRA 712902",
      "registerart": "HRA",
      "company_name": "MKD Schimscha UG (haftungsbeschränkt) & Co. KG",
      "company_seat": "Ravenstein",
      "details": "11.12.2025 (Bekanntmachungsdatum)\n\nBaden-Württemberg Amtsgericht Mannheim HRA 712902\nRegisterbekanntmachung nach dem Umwandlungsgesetz 11.12.2025 (Eintragungsdatum)\n\nMKD Schimscha UG (haftungsbeschränkt) & Co. KG\nKommanditgesellschaft\nRavenstein\n\nDen Gläubigern des an dem Formwechsel beteiligten Rechtsträgers ist, wenn sie binnen sechs Monaten nach dem Tag, an dem die Eintragung des Formwechsels in das Register des Sitzes desjenigen Rechtsträgers, dessen Gläubiger sie sind, nach § 19 Abs. 3 UmwG als bekanntgemacht gilt, ihren Anspruch nach Grund und Höhe schriftlich anmelden, Sicherheit zu leisten, soweit sie nicht Befriedigung verlangen können. Dieses Recht steht den Gläubigern jedoch nur zu, wenn sie glaubhaft machen, dass durch den Formwechsel die Erfüllung ihrer Forderung gefährdet wird."
    },
    {
      "date": "2025-12-11",
      "id": "139740",
      "original_text": "Löschungsankündigung\nBaden-Württemberg Amtsgericht Freiburg HRB 731847\nREMOZ TIEFBAU GmbH – Mahlberg",
      "type": "Löschungsankündigung",
      "state": "Baden-Württemberg",
      "amtsgericht": "Amtsgericht Freiburg",
      "registernummer": "HRB 731847",
      "registerart": "HRB",
      "company_name": "REMOZ TIEFBAU GmbH",
      "company_seat": "Mahlberg",
      "details": "11.12.2025 (Bekanntmachungsdatum)\n\nBaden-Württemberg Amtsgericht Freiburg HRB 731847\nLöschungsankündigung 11.12.2025 (Eintragungsdatum)\n\nREMOZ TIEFBAU GmbH\nGesellschaft mit beschränkter Haftung\nMahlberg\n\nAls nicht eingetragen wird bekanntgemacht:\nDas Gericht beabsichtigt, die Gesellschaft wegen Vermögenslosigkeit im Handelsregister von Amts wegen nach § 394 FamFG zu löschen. Die Frist zur Geltendmachung eines Widerspruchs gegen die beabsichtigte Löschung ist auf einen Monat ab Veröffentlichung bestimmt."
    },
    {
      "date": "2025-12-11",
      "id": "139741",
      "original_text": "Registerbekanntmachung nach dem Umwandlungsgesetz\nBaden-Württemberg Amtsgericht Stuttgart HRB 745859\nGDT Süd Gründach Technik GmbH – Unterensingen",
      "type": "Registerbekanntmachung nach dem Umwandlungsgesetz",
      "state": "Baden-Württemberg",
      "amtsgericht": "Amtsgericht Stuttgart",
      "registernummer": "HRB 745859",
      "registerart": "HRB",
      "company_name": "GDT Süd Gründach Technik GmbH",
      "company_seat": "Unterensingen",
      "details": "11.12.2025 (Bekanntmachungsdatum)\n\nBaden-Württemberg Amtsgericht Stuttgart HRB 745859\nRegisterbekanntmachung nach dem Umwandlungsgesetz 11.12.2025 (Eintragungsdatum)\n\nGDT Süd Gründach Technik GmbH\nGesellschaft mit beschränkter Haftung\nUnterensingen\n\nAls nicht eingetragen wird bekanntgemacht:\nDen Gläubigern der an der Verschmelzung beteiligten Rechtsträger ist, wenn sie binnen sechs Monaten nach dem Tag, an dem die Eintragung der Verschmelzung in das Register des Sitzes desjenigen Rechtsträgers, dessen Gläubiger sie sind, nach § 19 Abs. 3 UmwG als bekanntgemacht gilt, ihren Anspruch nach Grund und Höhe schriftlich anmelden, Sicherheit zu leisten, soweit sie nicht Befriedigung verlangen können. Dieses Recht steht den Gläubigern jedoch nur zu, wenn sie glaubhaft machen, dass durch die Verschmelzung die Erfüllung ihrer Forderung gefährdet wird."
    },
    {
      "date": "2025-12-11",
      "id": "139742",
      "original_text": "Löschungsankündigung\nBaden-Württemberg Amtsgericht Ulm HRB 641346\nWH Ingenieurbüro - Ausbausysteme GmbH – Schemmerhofen",
      "type": "Löschungsankündigung",
      "state": "Baden-Württemberg",
      "amtsgericht": "Amtsgericht Ulm",
      "registernummer": "HRB 641346",
      "registerart": "HRB",
      "company_name": "WH Ingenieurbüro - Ausbausysteme GmbH",
      "company_seat": "Schemmerhofen",
      "details": "11.12.2025 (Bekanntmachungsdatum)\n\nBaden-Württemberg Amtsgericht Ulm HRB 641346\nLöschungsankündigung\n\nWH Ingenieurbüro - Ausbausysteme GmbH\nGesellschaft mit beschränkter Haftung\nSchemmerhofen\n\nDas Gericht beabsichtigt, die Gesellschaft wegen Vermögenslosigkeit im Handelsregister von Amts wegen nach § 394 FamFG zu löschen. Die Frist zur Geltendmachung eines Widerspruchs gegen die beabsichtigte Löschung ist auf  einen Monat ab Veröffentlichung bestimmt."
    },
    {
      "date": "2025-12-11",
      "id": "139743",
      "original_text": "Einreichung neuer Dokumente\nBrandenburg Amtsgericht Potsdam HRB 18441\nStudio Babelsberg AG – Potsdam",
      "type": "Einreichung neuer Dokumente",
      "state": "Brandenburg",
      "amtsgericht": "Amtsgericht Potsdam",
      "registernummer": "HRB 18441",
      "registerart": "HRB",
      "company_name": "Studio Babelsberg AG",
      "company_seat": "Potsdam",
      "details": "11.12.2025 (Bekanntmachungsdatum)\n\nBrandenburg Amtsgericht Potsdam HRB 18441\nEinreichung neuer Dokumente\n\nStudio Babelsberg AG\nAktiengesellschaft\nPotsdam\n\nAls nicht eingetragen wird veröffentlicht: Eine Liste der Mitglieder des Aufsichtsrates wurde zum Handelsregister eingereicht."
    },
    {
      "date": "2025-12-11",
      "id": "139744",
      "original_text": "Registerbekanntmachung nach dem Umwandlungsgesetz\nBaden-Württemberg Amtsgericht Freiburg VR 260331\nDeutsche Lebens-Rettungs-Gesellschaft (DLRG), Ortsgruppe Köndringen e.V. im Bezirk Breisgau e.V. – Teningen",
      "type": "Registerbekanntmachung nach dem Umwandlungsgesetz",
      "state": "Baden-Württemberg",
      "amtsgericht": "Amtsgericht Freiburg",
      "registernummer": "VR 260331",
      "registerart": "VR",
      "company_name": "Deutsche Lebens-Rettungs-Gesellschaft (DLRG), Ortsgruppe Köndringen e.V. im Bezirk Breisgau e.V.",
      "company_seat": "Teningen",
      "details": "11.12.2025 (Bekanntmachungsdatum)\n\nBaden-Württemberg Amtsgericht Freiburg VR 260331\nRegisterbekanntmachung nach dem Umwandlungsgesetz 11.12.2025 (Eintragungsdatum)\n\nDeutsche Lebens-Rettungs-Gesellschaft (DLRG), Ortsgruppe Köndringen e.V. im Bezirk Breisgau e.V.\neingetragener Verein\nTeningen\n\nAls nicht eingetragen wird bekanntgemacht:\nDen Gläubigern der an der Verschmelzung beteiligten Rechtsträger ist, wenn sie binnen sechs Monaten nach dem Tag, an dem die Eintragung der Verschmelzung in das Register des Sitzes desjenigen Rechtsträgers, dessen Gläubiger sie sind, nach § 19 Abs. 3 UmwG als bekanntgemacht gilt, ihren Anspruch nach Grund und Höhe schriftlich anmelden, Sicherheit zu leisten, soweit sie nicht Befriedigung verlangen können. Dieses Recht steht den Gläubigern jedoch nur zu, wenn sie glaubhaft machen, dass durch die Verschmelzung die Erfüllung ihrer Forderung gefährdet wird."
    },
    {
      "date": "2025-12-11",
      "id": "139745",
      "original_text": "Registerbekanntmachung nach dem Umwandlungsgesetz\nBaden-Württemberg Amtsgericht Freiburg VR 260472\nDeutsche Lebens-Rettungs-Gesellschaft (DLRG), DLRG Ortsgruppe Teningen im DLRG-Bezirk Breisgau e.V. – Teningen",
      "type": "Registerbekanntmachung nach dem Umwandlungsgesetz",
      "state": "Baden-Württemberg",
      "amtsgericht": "Amtsgericht Freiburg",
      "registernummer": "VR 260472",
      "registerart": "VR",
      "company_name": "Deutsche Lebens-Rettungs-Gesellschaft (DLRG), DLRG Ortsgruppe Teningen im DLRG-Bezirk Breisgau e.V.",
      "company_seat": "Teningen",
      "details": "11.12.2025 (Bekanntmachungsdatum)\n\nBaden-Württemberg Amtsgericht Freiburg VR 260472\nRegisterbekanntmachung nach dem Umwandlungsgesetz 11.12.2025 (Eintragungsdatum)\n\nDeutsche Lebens-Rettungs-Gesellschaft (DLRG), DLRG Ortsgruppe Teningen im DLRG-Bezirk Breisgau e.V.\neingetragener Verein\nTeningen\n\nDen Gläubigern der an der Verschmelzung beteiligten Rechtsträger ist, wenn sie binnen sechs Monaten nach dem Tag, an dem die Eintragung der Verschmelzung in das Register des Sitzes desjenigen Rechtsträgers, dessen Gläubiger sie sind, nach § 19 Abs. 3 UmwG als bekanntgemacht gilt, ihren Anspruch nach Grund und Höhe schriftlich anmelden, Sicherheit zu leisten, soweit sie nicht Befriedigung verlangen können. Dieses Recht steht den Gläubigern jedoch nur zu, wenn sie glaubhaft machen, dass durch die Verschmelzung die Erfüllung ihrer Forderung gefährdet wird."
    },
    {
      "date": "2025-12-11",
      "id": "139746",
      "original_text": "Löschungsankündigung\nBerlin Amtsgericht Berlin (Charlottenburg) HRB 163966\nAlmora GmbH – Berlin",
      "type": "Löschungsankündigung",
      "state": "Berlin",
      "amtsgericht": "Amtsgericht Berlin (Charlottenburg)",
      "registernummer": "HRB 163966",
      "registerart": "HRB",
      "company_name": "Almora GmbH",
      "company_seat": "Berlin",
      "details": "11.12.2025 (Bekanntmachungsdatum)\n\nBerlin Amtsgericht Berlin (Charlottenburg) HRB 163966\nLöschungsankündigung\n\nAlmora GmbH\nGesellschaft mit beschränkter Haftung\nBerlin\n\nBei der nachstehenden Gesellschaft wird das Amtslöschungsverfahren gemäß § 394 FamFG eingeleitet. Widerspruchsfrist 6 Wochen"
    },
    {
      "date": "2025-12-11",
      "id": "139747",
      "original_text": "Registerbekanntmachung nach dem Umwandlungsgesetz\nBaden-Württemberg Amtsgericht Stuttgart HRB 802014\nBJM GmbH – Reutlingen",
      "type": "Registerbekanntmachung nach dem Umwandlungsgesetz",
      "state": "Baden-Württemberg",
      "amtsgericht": "Amtsgericht Stuttgart",
      "registernummer": "HRB 802014",
      "registerart": "HRB",
      "company_name": "BJM GmbH",
      "company_seat": "Reutlingen",
      "details": "11.12.2025 (Bekanntmachungsdatum)\n\nBaden-Württemberg Amtsgericht Stuttgart HRB 802014\nRegisterbekanntmachung nach dem Umwandlungsgesetz 11.12.2025 (Eintragungsdatum)\n\nBJM GmbH\nGesellschaft mit beschränkter Haftung\nReutlingen\n\nDen Gläubigern der an der Verschmelzung beteiligten Rechtsträger ist, wenn sie binnen sechs Monaten nach dem Tag, an dem die Eintragung der Verschmelzung in das Register des Sitzes desjenigen Rechtsträgers, dessen Gläubiger sie sind, nach § 19 Abs. 3 UmwG als bekanntgemacht gilt, ihren Anspruch nach Grund und Höhe schriftlich anmelden, Sicherheit zu leisten, soweit sie nicht Befriedigung verlangen können. Dieses Recht steht den Gläubigern jedoch nur zu, wenn sie glaubhaft machen, dass durch die Verschmelzung die Erfüllung ihrer Forderung gefährdet wird."
    },
    {
      "date": "2025-12-11",
      "id": "139748",
      "original_text": "Löschungsankündigung\nBaden-Württemberg Amtsgericht Mannheim HRB 707519\nHeadflat GmbH – Karlsruhe",
      "type": "Löschungsankündigung",
      "state": "Baden-Württemberg",
      "amtsgericht": "Amtsgericht Mannheim",
      "registernummer": "HRB 707519",
      "registerart": "HRB",
      "company_name": "Headflat GmbH",
      "company_seat": "Karlsruhe",
      "details": "11.12.2025 (Bekanntmachungsdatum)\n\nBaden-Württemberg Amtsgericht Mannheim HRB 707519\nLöschungsankündigung\n\nHeadflat GmbH\nGesellschaft mit beschränkter Haftung\nKarlsruhe\n\nDas Gericht beabsichtigt, die Gesellschaft wegen Vermögenslosigkeit im Handelsregister von Amts wegen nach § 394 FamFG zu löschen. Die Frist zur Geltendmachung eines Widerspruchs gegen die beabsichtigte Löschung ist auf einen Monat ab Veröffentlichung bestimmt."
    },
    {
      "date": "2025-12-11",
      "id": "139749",
      "original_text": "Einreichung neuer Dokumente\nSachsen-Anhalt Amtsgericht Stendal HRB 13127\nGasstadtwerke Zerbst GmbH – Zerbst",
      "type": "Einreichung neuer Dokumente",
      "state": "Sachsen-Anhalt",
      "amtsgericht": "Amtsgericht Stendal",
      "registernummer": "HRB 13127",
      "registerart": "HRB",
      "company_name": "Gasstadtwerke Zerbst GmbH",
      "company_seat": "Zerbst",
      "details": "11.12.2025 (Bekanntmachungsdatum)\n\nSachsen-Anhalt Amtsgericht Stendal HRB 13127\nEinreichung neuer Dokumente\n\nGasstadtwerke Zerbst GmbH\nGesellschaft mit beschränkter Haftung\nZerbst\n\nEine Liste der Mitglieder des Aufsichtsrates wurde zum Handelsregister eingereicht."
    },
    {
      "date": "2025-12-11",
      "id": "139750",
      "original_text": "Sonstige Registerbekanntmachung\nBerlin Amtsgericht Berlin (Charlottenburg) GnR 448\nINTERTEXT Fremdsprachendienst e. G. – Berlin",
      "type": "Sonstige Registerbekanntmachung",
      "state": "Berlin",
      "amtsgericht": "Amtsgericht Berlin (Charlottenburg)",
      "registernummer": "GnR 448",
      "registerart": "GnR",
      "company_name": "INTERTEXT Fremdsprachendienst e. G.",
      "company_seat": "Berlin",
      "details": "11.12.2025 (Bekanntmachungsdatum)\n\nBerlin Amtsgericht Berlin (Charlottenburg) GnR 448\nSonstige Registerbekanntmachung 10.12.2025 (Eintragungsdatum)\n\nINTERTEXT Fremdsprachendienst e. G.\neingetragene Genossenschaft\nBerlin\n\nAls nicht eingetragen wird veröffentlicht: Die Höhe des Geschäftsanteils ist herabgesetz worden. Den Gläubigern der Genossenschaft ist, wenn sie sich binnen 6 Monaten nach der Bekanntmachung bei der Genossenschaft zu diesem Zweck melden, Sicherheit zu leisten, soweit sie nicht Befriedigung verlangen können."
    },
    {
      "date": "2025-12-11",
      "id": "139751",
      "original_text": "Löschungsankündigung\nSchleswig-Holstein Amtsgericht Lübeck VR 3539\nDSD Deutscher Sicherheitsdienst e.V. – Trittau",
      "type": "Löschungsankündigung",
      "state": "Schleswig-Holstein",
      "amtsgericht": "Amtsgericht Lübeck",
      "registernummer": "VR 3539",
      "registerart": "VR",
      "company_name": "DSD Deutscher Sicherheitsdienst e.V.",
      "company_seat": "Trittau",
      "details": "11.12.2025 (Bekanntmachungsdatum)\n\nSchleswig-Holstein Amtsgericht Lübeck VR 3539\nLöschungsankündigung\n\nDSD Deutscher Sicherheitsdienst  e.V.\neingetragener Verein\nTrittau\n\nZu der Vereinsregistersache wird veröffentlicht:\n\nSehr geehrte Damen und Herren,\n\nin der Vereinsregistersache der\n\nDSD Deutscher Sicherheitsdienst  e.V.\n\nist das Gericht zu der Überzeugung gelangt, dass der Verein durch Wegfall sämtlicher Mitglieder aufgelöst ist.\nDas Gericht geht davon aus, dass der Verein nicht mehr besteht.\n\nSollte der Verein - wider Erwarten - noch aktiv sein, so werden Sie gebeten, dies dem Gericht binnen einer Frist von   vier Wochen   ab Zugang dieses Schreibens mitzuteilen.\n\nSofern Sie nicht binnen vier Wochen ab Zugang dieses Schreibens Einwendungen erheben, wird der Verein von Amts wegen aufgrund Wegfalls sämtlicher Mitglieder im Vereinsregister gelöscht werden.\n\nMit freundlichen Grüßen\n\nOstermann\nRechtspflegerin"
    },
    {
      "date": "2025-12-11",
      "id": "139752",
      "original_text": "Registerbekanntmachung nach dem Umwandlungsgesetz\nBerlin Amtsgericht Berlin (Charlottenburg) HRB 79484\nMIB AG Immobilien und Beteiligungen – Berlin",
      "type": "Registerbekanntmachung nach dem Umwandlungsgesetz",
      "state": "Berlin",
      "amtsgericht": "Amtsgericht Berlin (Charlottenburg)",
      "registernummer": "HRB 79484",
      "registerart": "HRB",
      "company_name": "MIB AG Immobilien und Beteiligungen",
      "company_seat": "Berlin",
      "details": "11.12.2025 (Bekanntmachungsdatum)\n\nBerlin Amtsgericht Berlin (Charlottenburg) HRB 79484\nRegisterbekanntmachung nach dem Umwandlungsgesetz 10.12.2025 (Eintragungsdatum)\n\nMIB AG Immobilien und Beteiligungen\nAktiengesellschaft\nBerlin\n\nZu Eintragungsnummer 14 vom 10.12.2025 wird als nicht eingetragen veröffentlicht: Den Gläubigern der an der Verschmelzung beteiligten Rechtsträger ist, wenn sie binnen sechs Monaten nach dem Tag, an dem die Eintragung der Verschmelzung in das Register des Sitzes desjenigen Rechtsträgers, dessen Gläubiger sie sind, als bekannt gemacht gilt, ihren Anspruch nach Grund und Höhe schriftlich anmelden, Sicherheit zu leisten, soweit sie nicht Befriedigung verlangen können. Dieses Recht steht den Gläubigern jedoch nur zu, wenn sie glaubhaft machen, dass durch die Verschmelzung die Erfüllung ihrer Forderung gefährdet wird. Das Recht, Sicherheitsleistung zu verlangen, steht Gläubigern nicht zu, die im Falle der Insolvenz ein Recht auf vorzugsweise Befriedigung aus einer Deckungsmasse haben, die nach gesetzlicher Vorschrift zu ihrem Schutz errichtet und staatlich überwacht ist."
    },
    {
      "date": "2025-12-11",
      "id": "139753",
      "original_text": "Löschungsankündigung\nBerlin Amtsgericht Berlin (Charlottenburg) HRB 264436\nAyax Consulting GmbH – Berlin",
      "type": "Löschungsankündigung",
      "state": "Berlin",
      "amtsgericht": "Amtsgericht Berlin (Charlottenburg)",
      "registernummer": "HRB 264436",
      "registerart": "HRB",
      "company_name": "Ayax Consulting GmbH",
      "company_seat": "Berlin",
      "details": "11.12.2025 (Bekanntmachungsdatum)\n\nBerlin Amtsgericht Berlin (Charlottenburg) HRB 264436\nLöschungsankündigung\n\nAyax Consulting GmbH\nGesellschaft mit beschränkter Haftung\nBerlin\n\nBei der nachstehenden Gesellschaft wird das Amtslöschungsverfahren gemäß § 394 FamFG eingeleitet. Widerspruchsfrist 6 Wochen"
    },
    {
      "date": "2025-12-11",
      "id": "139754",
      "original_text": "Registerbekanntmachung nach dem Umwandlungsgesetz\nBaden-Württemberg Amtsgericht Stuttgart HRA 742850\nRolf Ackermann GmbH & Co. KG – Rietheim-Weilheim",
      "type": "Registerbekanntmachung nach dem Umwandlungsgesetz",
      "state": "Baden-Württemberg",
      "amtsgericht": "Amtsgericht Stuttgart",
      "registernummer": "HRA 742850",
      "registerart": "HRA",
      "company_name": "Rolf Ackermann GmbH & Co. KG",
      "company_seat": "Rietheim-Weilheim",
      "details": "11.12.2025 (Bekanntmachungsdatum)\n\nBaden-Württemberg Amtsgericht Stuttgart HRA 742850\nRegisterbekanntmachung nach dem Umwandlungsgesetz 11.12.2025 (Eintragungsdatum)\n\nRolf Ackermann GmbH & Co. KG\nKommanditgesellschaft\nRietheim-Weilheim\n\nDen Gläubigern der an der Ausgliederung beteiligten Rechtsträger ist, wenn sie binnen sechs Monaten nach dem Tag, an dem die Eintragung der Ausgliederung in das Register des Sitzes desjenigen Rechtsträgers, dessen Gläubiger sie sind, nach § 19 Abs. 3 UmwG als bekanntgemacht gilt, ihren Anspruch nach Grund und Höhe schriftlich anmelden, Sicherheit zu leisten, soweit sie nicht Befriedigung verlangen können. Dieses Recht steht den Gläubigern jedoch nur zu, wenn sie glaubhaft machen, dass durch die Ausgliederung die Erfüllung ihrer Forderung gefährdet wird."
    },
    {
      "date": "2025-12-11",
      "id": "139755",
      "original_text": "Registerbekanntmachung nach dem Umwandlungsgesetz\nBerlin Amtsgericht Berlin (Charlottenburg) HRB 183438\nBueWelen UG (haftungsbeschränkt) – Berlin",
      "type": "Registerbekanntmachung nach dem Umwandlungsgesetz",
      "state": "Berlin",
      "amtsgericht": "Amtsgericht Berlin (Charlottenburg)",
      "registernummer": "HRB 183438",
      "registerart": "HRB",
      "company_name": "BueWelen UG (haftungsbeschränkt)",
      "company_seat": "Berlin",
      "details": "11.12.2025 (Bekanntmachungsdatum)\n\nBerlin Amtsgericht Berlin (Charlottenburg) HRB 183438\nRegisterbekanntmachung nach dem Umwandlungsgesetz 10.12.2025 (Eintragungsdatum)\n\nBueWelen UG (haftungsbeschränkt)\nGesellschaft mit beschränkter Haftung\nBerlin\n\nZu Eintragungsnummer 2 vom 10.12.2025 wird als nicht eingetragen veröffentlicht: Den Gläubigern der an der Verschmelzung beteiligten Rechtsträger ist, wenn sie binnen sechs Monaten nach dem Tag, an dem die Eintragung der Verschmelzung in das Register des Sitzes desjenigen Rechtsträgers, dessen Gläubiger sie sind, als bekannt gemacht gilt, ihren Anspruch nach Grund und Höhe schriftlich anmelden, Sicherheit zu leisten, soweit sie nicht Befriedigung verlangen können. Dieses Recht steht den Gläubigern jedoch nur zu, wenn sie glaubhaft machen, dass durch die Verschmelzung die Erfüllung ihrer Forderung gefährdet wird. Das Recht, Sicherheitsleistung zu verlangen, steht Gläubigern nicht zu, die im Falle der Insolvenz ein Recht auf vorzugsweise Befriedigung aus einer Deckungsmasse haben, die nach gesetzlicher Vorschrift zu ihrem Schutz errichtet und staatlich überwacht ist."
    },
    {
      "date": "2025-12-11",
      "id": "139756",
      "original_text": "Registerbekanntmachung nach dem Umwandlungsgesetz\nBaden-Württemberg Amtsgericht Freiburg HRB 734557\nSeilnacht GmbH – Freiburg im Breisgau",
      "type": "Registerbekanntmachung nach dem Umwandlungsgesetz",
      "state": "Baden-Württemberg",
      "amtsgericht": "Amtsgericht Freiburg",
      "registernummer": "HRB 734557",
      "registerart": "HRB",
      "company_name": "Seilnacht GmbH",
      "company_seat": "Freiburg im Breisgau",
      "details": "11.12.2025 (Bekanntmachungsdatum)\n\nBaden-Württemberg Amtsgericht Freiburg HRB 734557\nRegisterbekanntmachung nach dem Umwandlungsgesetz 11.12.2025 (Eintragungsdatum)\n\nSeilnacht GmbH\nGesellschaft mit beschränkter Haftung\nFreiburg im Breisgau\n\nAls nicht eingetragen wird bekanntgemacht:\nDen Gläubigern der an der Ausgliederung beteiligten Rechtsträger ist, wenn sie binnen sechs Monaten nach dem Tag, an dem die Eintragung der Ausgliederung in das Register des Sitzes desjenigen Rechtsträgers, dessen Gläubiger sie sind, nach § 19 Abs. 3 UmwG als bekanntgemacht gilt, ihren Anspruch nach Grund und Höhe schriftlich anmelden, Sicherheit zu leisten, soweit sie nicht Befriedigung verlangen können. Dieses Recht steht den Gläubigern jedoch nur zu, wenn sie glaubhaft machen, dass durch die Ausgliederung die Erfüllung ihrer Forderung gefährdet wird."
    },
    {
      "date": "2025-12-11",
      "id": "139757",
      "original_text": "Löschungsankündigung\nBerlin Amtsgericht Berlin (Charlottenburg) HRB 250693\nM.P.A. Bau UG (haftungsbeschränkt) – Berlin",
      "type": "Löschungsankündigung",
      "state": "Berlin",
      "amtsgericht": "Amtsgericht Berlin (Charlottenburg)",
      "registernummer": "HRB 250693",
      "registerart": "HRB",
      "company_name": "M.P.A. Bau UG (haftungsbeschränkt)",
      "company_seat": "Berlin",
      "details": "11.12.2025 (Bekanntmachungsdatum)\n\nBerlin Amtsgericht Berlin (Charlottenburg) HRB 250693\nLöschungsankündigung\n\nM.P.A. Bau UG (haftungsbeschränkt)\nGesellschaft mit beschränkter Haftung\nBerlin\n\nBei der nachstehenden Gesellschaft wird das Amtslöschungsverfahren gemäß § 394 FamFG eingeleitet. Widerspruchsfrist 6 Wochen"
    },
    {
      "date": "2025-12-11",
      "id": "139758",
      "original_text": "Löschungsankündigung\nBerlin Amtsgericht Berlin (Charlottenburg) HRB 255424\nSafeway GmbH – Berlin",
      "type": "Löschungsankündigung",
      "state": "Berlin",
      "amtsgericht": "Amtsgericht Berlin (Charlottenburg)",
      "registernummer": "HRB 255424",
      "registerart": "HRB",
      "company_name": "Safeway GmbH",
      "company_seat": "Berlin",
      "details": "11.12.2025 (Bekanntmachungsdatum)\n\nBerlin Amtsgericht Berlin (Charlottenburg) HRB 255424\nLöschungsankündigung\n\nSafeway GmbH\nGesellschaft mit beschränkter Haftung\nBerlin\n\nBei der nachstehenden Gesellschaft wird das Amtslöschungsverfahren gemäß § 394 FamFG eingeleitet. Widerspruchsfrist\n6 Wochen."
    },
    {
      "date": "2025-12-11",
      "id": "139759",
      "original_text": "Registerbekanntmachung nach dem Umwandlungsgesetz\nBaden-Württemberg Amtsgericht Freiburg HRA 4409\nJosef Seilnacht Inh. Matthias Lewalter e. K. – Freiburg im Breisgau",
      "type": "Registerbekanntmachung nach dem Umwandlungsgesetz",
      "state": "Baden-Württemberg",
      "amtsgericht": "Amtsgericht Freiburg",
      "registernummer": "HRA 4409",
      "registerart": "HRA",
      "company_name": "Josef Seilnacht Inh. Matthias Lewalter e. K.",
      "company_seat": "Freiburg im Breisgau",
      "details": "11.12.2025 (Bekanntmachungsdatum)\n\nBaden-Württemberg Amtsgericht Freiburg HRA 4409\nRegisterbekanntmachung nach dem Umwandlungsgesetz 11.12.2025 (Eintragungsdatum)\n\nJosef Seilnacht Inh. Matthias Lewalter e. K.\nEinzelkaufmann / Einzelkauffrau\nFreiburg im Breisgau\n\nAls nicht eingetragen wird bekanntgemacht:\nDen Gläubigern der an der Ausgliederung beteiligten Rechtsträger ist, wenn sie binnen sechs Monaten nach dem Tag, an dem die Eintragung der Ausgliederung in das Register des Sitzes desjenigen Rechtsträgers, dessen Gläubiger sie sind, nach § 19 Abs. 3 UmwG als bekanntgemacht gilt, ihren Anspruch nach Grund und Höhe schriftlich anmelden, Sicherheit zu leisten, soweit sie nicht Befriedigung verlangen können. Dieses Recht steht den Gläubigern jedoch nur zu, wenn sie glaubhaft machen, dass durch die Ausgliederung die Erfüllung ihrer Forderung gefährdet wird."
    },
    {
      "date": "2025-12-11",
      "id": "139760",
      "original_text": "Löschungsankündigung\nSachsen-Anhalt Amtsgericht Stendal VR 48387\nPflegeelternverein Weißenfels e.V. – Weißenfels",
      "type": "Löschungsankündigung",
      "state": "Sachsen-Anhalt",
      "amtsgericht": "Amtsgericht Stendal",
      "registernummer": "VR 48387",
      "registerart": "VR",
      "company_name": "Pflegeelternverein Weißenfels e.V.",
      "company_seat": "Weißenfels",
      "details": "11.12.2025 (Bekanntmachungsdatum)\n\nSachsen-Anhalt Amtsgericht Stendal VR 48387\nLöschungsankündigung 11.12.2025 (Eintragungsdatum)\n\nPflegeelternverein Weißenfels e.V.\neingetragener Verein\nWeißenfels\n\nDas Registergericht beabsichtigt, nachfolgenden im Vereinsregister eingetragenen Verein von Amts wegen nach § 394 FamFG zu löschen. Die Frist zu Erhebung eines Widerspruchs wird auf drei Monate festgesetzt."
    },
    {
      "date": "2025-12-11",
      "id": "139761",
      "original_text": "Löschungsankündigung\nBerlin Amtsgericht Berlin (Charlottenburg) HRB 111653\nSafe Key Trading GmbH – Berlin",
      "type": "Löschungsankündigung",
      "state": "Berlin",
      "amtsgericht": "Amtsgericht Berlin (Charlottenburg)",
      "registernummer": "HRB 111653",
      "registerart": "HRB",
      "company_name": "Safe Key Trading GmbH",
      "company_seat": "Berlin",
      "details": "11.12.2025 (Bekanntmachungsdatum)\n\nBerlin Amtsgericht Berlin (Charlottenburg) HRB 111653\nLöschungsankündigung\n\nSafe Key Trading GmbH\nGesellschaft mit beschränkter Haftung\nBerlin\n\nBei der nachstehenden Gesellschaft wird das Amtslöschungsverfahren gemäß § 394 FamFG eingeleitet. Widerspruchsfrist 6 Wochen"
    },
    {
      "date": "2025-12-11",
      "id": "139762",
      "original_text": "Registerbekanntmachung nach dem Umwandlungsgesetz\nBaden-Württemberg Amtsgericht Stuttgart HRB 23976\nCoperion GmbH – Stuttgart",
      "type": "Registerbekanntmachung nach dem Umwandlungsgesetz",
      "state": "Baden-Württemberg",
      "amtsgericht": "Amtsgericht Stuttgart",
      "registernummer": "HRB 23976",
      "registerart": "HRB",
      "company_name": "Coperion GmbH",
      "company_seat": "Stuttgart",
      "details": "11.12.2025 (Bekanntmachungsdatum)\n\nBaden-Württemberg Amtsgericht Stuttgart HRB 23976\nRegisterbekanntmachung nach dem Umwandlungsgesetz 11.12.2025 (Eintragungsdatum)\n\nCoperion GmbH\nGesellschaft mit beschränkter Haftung\nStuttgart\n\nAls nicht eingetragen wird bekanntgemacht:\nDen Gläubigern der an der Verschmelzung beteiligten Rechtsträger ist, wenn sie binnen sechs Monaten nach dem Tag, an dem die Eintragung der Verschmelzung in das Register des Sitzes desjenigen Rechtsträgers, dessen Gläubiger sie sind, nach § 19 Abs. 3 UmwG als bekanntgemacht gilt, ihren Anspruch nach Grund und Höhe schriftlich anmelden, Sicherheit zu leisten, soweit sie nicht Befriedigung verlangen können. Dieses Recht steht den Gläubigern jedoch nur zu, wenn sie glaubhaft machen, dass durch die Verschmelzung die Erfüllung ihrer Forderung gefährdet wird."
    },
    {
      "date": "2025-12-11",
      "id": "139763",
      "original_text": "Einreichung neuer Dokumente\nSchleswig-Holstein Amtsgericht Kiel HRB 16\nSHBB Steuerberatungsgesellschaft mbH – Kiel",
      "type": "Einreichung neuer Dokumente",
      "state": "Schleswig-Holstein",
      "amtsgericht": "Amtsgericht Kiel",
      "registernummer": "HRB 16",
      "registerart": "HRB",
      "company_name": "SHBB Steuerberatungsgesellschaft mbH",
      "company_seat": "Kiel",
      "details": "11.12.2025 (Bekanntmachungsdatum)\n\nSchleswig-Holstein Amtsgericht Kiel HRB 16\nEinreichung neuer Dokumente\n\nSHBB Steuerberatungsgesellschaft mbH\nGesellschaft mit beschränkter Haftung\nKiel\n\nAls nicht eingetragen wird veröffentlicht: Eine neue Liste der Aufsichtsratsmitglieder ist eingereicht worden."
    },
    {
      "date": "2025-12-11",
      "id": "139764",
      "original_text": "Registerbekanntmachung nach dem Umwandlungsgesetz\nBaden-Württemberg Amtsgericht Mannheim HRB 750203\nBystronic Holding Deutschland AG – Heimsheim",
      "type": "Registerbekanntmachung nach dem Umwandlungsgesetz",
      "state": "Baden-Württemberg",
      "amtsgericht": "Amtsgericht Mannheim",
      "registernummer": "HRB 750203",
      "registerart": "HRB",
      "company_name": "Bystronic Holding Deutschland AG",
      "company_seat": "Heimsheim",
      "details": "11.12.2025 (Bekanntmachungsdatum)\n\nBaden-Württemberg Amtsgericht Mannheim HRB 750203\nRegisterbekanntmachung nach dem Umwandlungsgesetz 11.12.2025 (Eintragungsdatum)\n\nBystronic Holding Deutschland AG\nAktiengesellschaft\nHeimsheim\n\nAls nicht eingetragen wird bekanntgemacht:\nDen Gläubigern des an dem Formwechsel beteiligten Rechtsträgers ist, wenn sie binnen sechs Monaten nach dem Tag, an dem die Eintragung des Formwechsels in das Register des Sitzes desjenigen Rechtsträgers, dessen Gläubiger sie sind, nach § 19 Abs. 3 UmwG als bekanntgemacht gilt, ihren Anspruch nach Grund und Höhe schriftlich anmelden, Sicherheit zu leisten, soweit sie nicht Befriedigung verlangen können. Dieses Recht steht den Gläubigern jedoch nur zu, wenn sie glaubhaft machen, dass durch den Formwechsel die Erfüllung ihrer Forderung gefährdet wird."
    },
    {
      "date": "2025-12-11",
      "id": "139765",
      "original_text": "Registerbekanntmachung nach dem Umwandlungsgesetz\nBerlin Amtsgericht Berlin (Charlottenburg) HRB 100176\nACCEPT EINS Steuerberatungsgesellschaft mbH – Berlin",
      "type": "Registerbekanntmachung nach dem Umwandlungsgesetz",
      "state": "Berlin",
      "amtsgericht": "Amtsgericht Berlin (Charlottenburg)",
      "registernummer": "HRB 100176",
      "registerart": "HRB",
      "company_name": "ACCEPT EINS Steuerberatungsgesellschaft mbH",
      "company_seat": "Berlin",
      "details": "11.12.2025 (Bekanntmachungsdatum)\n\nBerlin Amtsgericht Berlin (Charlottenburg) HRB 100176\nRegisterbekanntmachung nach dem Umwandlungsgesetz 09.12.2025 (Eintragungsdatum)\n\nACCEPT EINS Steuerberatungsgesellschaft mbH\nGesellschaft mit beschränkter Haftung\nBerlin\n\nZu Eintragungsnummer 4 vom 09.12.2025 wird als nicht eingetragen veröffentlicht: Den Gläubigern der an der Verschmelzung beteiligten Rechtsträger ist, wenn sie binnen sechs Monaten nach dem Tag, an dem die Eintragung der Verschmelzung in das Register des Sitzes desjenigen Rechtsträgers, dessen Gläubiger sie sind, als bekannt gemacht gilt, ihren Anspruch nach Grund und Höhe schriftlich anmelden, Sicherheit zu leisten, soweit sie nicht Befriedigung verlangen können. Dieses Recht steht den Gläubigern jedoch nur zu, wenn sie glaubhaft machen, dass durch die Verschmelzung die Erfüllung ihrer Forderung gefährdet wird. Das Recht, Sicherheitsleistung zu verlangen, steht Gläubigern nicht zu, die im Falle der Insolvenz ein Recht auf vorzugsweise Befriedigung aus einer Deckungsmasse haben, die nach gesetzlicher Vorschrift zu ihrem Schutz errichtet und staatlich überwacht ist."
    },
    {
      "date": "2025-12-11",
      "id": "139766",
      "original_text": "Registerbekanntmachung nach dem Umwandlungsgesetz\nBerlin Amtsgericht Berlin (Charlottenburg) HRB 125812\nACCEPT ZWEI Steuerberatungsgesellschaft mbH – Berlin",
      "type": "Registerbekanntmachung nach dem Umwandlungsgesetz",
      "state": "Berlin",
      "amtsgericht": "Amtsgericht Berlin (Charlottenburg)",
      "registernummer": "HRB 125812",
      "registerart": "HRB",
      "company_name": "ACCEPT ZWEI Steuerberatungsgesellschaft mbH",
      "company_seat": "Berlin",
      "details": "11.12.2025 (Bekanntmachungsdatum)\n\nBerlin Amtsgericht Berlin (Charlottenburg) HRB 125812\nRegisterbekanntmachung nach dem Umwandlungsgesetz 09.12.2025 (Eintragungsdatum)\n\nACCEPT ZWEI Steuerberatungsgesellschaft mbH\nGesellschaft mit beschränkter Haftung\nBerlin\n\nZu Eintragungsnummer 3 vom 09.12.2025 wird als nicht eingetragen veröffentlicht: Den Gläubigern der an der Verschmelzung beteiligten Rechtsträger ist, wenn sie binnen sechs Monaten nach dem Tag, an dem die Eintragung der Verschmelzung in das Register des Sitzes desjenigen Rechtsträgers, dessen Gläubiger sie sind, als bekannt gemacht gilt, ihren Anspruch nach Grund und Höhe schriftlich anmelden, Sicherheit zu leisten, soweit sie nicht Befriedigung verlangen können. Dieses Recht steht den Gläubigern jedoch nur zu, wenn sie glaubhaft machen, dass durch die Verschmelzung die Erfüllung ihrer Forderung gefährdet wird. Das Recht, Sicherheitsleistung zu verlangen, steht Gläubigern nicht zu, die im Falle der Insolvenz ein Recht auf vorzugsweise Befriedigung aus einer Deckungsmasse haben, die nach gesetzlicher Vorschrift zu ihrem Schutz errichtet und staatlich überwacht ist."
    },
    {
      "date": "2025-12-11",
      "id": "139767",
      "original_text": "Sonstige Registerbekanntmachung\nBerlin Amtsgericht Berlin (Charlottenburg) HRB 202049\nSARIAS AG – Berlin",
      "type": "Sonstige Registerbekanntmachung",
      "state": "Berlin",
      "amtsgericht": "Amtsgericht Berlin (Charlottenburg)",
      "registernummer": "HRB 202049",
      "registerart": "HRB",
      "company_name": "SARIAS AG",
      "company_seat": "Berlin",
      "details": "11.12.2025 (Bekanntmachungsdatum)\n\nBerlin Amtsgericht Berlin (Charlottenburg) HRB 202049\nSonstige Registerbekanntmachung\n\nSARIAS AG\nAktiengesellschaft\nBerlin\n\nAls nicht eingetragen wird veröffentlicht: Den Gläubigern ist, wenn sie binnen sechs Monaten nach dem Tag, an dem die Eintragung der Umwandlung als bekannt gemacht gilt, ihren Anspruch nach Grund und Höhe schriftlich anmelden, Sicherheit zu leisten, soweit sie nicht Befriedigung verlangen können. Dieses Recht steht den Gläubigern jedoch nur zu, wenn sie glaubhaft machen, dass durch die Umwandlung die Erfüllung ihrer Forderung gefährdet wird. Das Recht, Sicherheitsleistung zu verlangen, steht Gläubigern nicht zu, die im Falle der Insolvenz ein Recht auf vorzugsweise Befriedigung aus einer Deckungsmasse haben, die nach gesetzlicher Vorschrift zu ihrem Schutz errichtet und staatlich überwacht ist."
    },
    {
      "date": "2025-12-11",
      "id": "139768",
      "original_text": "Einreichung neuer Dokumente\nSachsen-Anhalt Amtsgericht Stendal HRB 105251\nEnergie Mittelsachsen GmbH – Staßfurt",
      "type": "Einreichung neuer Dokumente",
      "state": "Sachsen-Anhalt",
      "amtsgericht": "Amtsgericht Stendal",
      "registernummer": "HRB 105251",
      "registerart": "HRB",
      "company_name": "Energie Mittelsachsen GmbH",
      "company_seat": "Staßfurt",
      "details": "11.12.2025 (Bekanntmachungsdatum)\n\nSachsen-Anhalt Amtsgericht Stendal HRB 105251\nEinreichung neuer Dokumente\n\nEnergie Mittelsachsen GmbH\nGesellschaft mit beschränkter Haftung\nStaßfurt\n\nEine Liste der Mitglieder des Aufsichtsrates wurde zum Handelsregister eingereicht."
    },
    {
      "date": "2025-12-11",
      "id": "139769",
      "original_text": "Registerbekanntmachung nach dem Umwandlungsgesetz\nBaden-Württemberg Amtsgericht Mannheim HRA 712852\nOnline-Handel Prietzel e.K. – Durmersheim",
      "type": "Registerbekanntmachung nach dem Umwandlungsgesetz",
      "state": "Baden-Württemberg",
      "amtsgericht": "Amtsgericht Mannheim",
      "registernummer": "HRA 712852",
      "registerart": "HRA",
      "company_name": "Online-Handel Prietzel e.K.",
      "company_seat": "Durmersheim",
      "details": "11.12.2025 (Bekanntmachungsdatum)\n\nBaden-Württemberg Amtsgericht Mannheim HRA 712852\nRegisterbekanntmachung nach dem Umwandlungsgesetz 11.12.2025 (Eintragungsdatum)\n\nOnline-Handel Prietzel e.K.\nEinzelkaufmann / Einzelkauffrau\nDurmersheim\n\nDen Gläubigern der an der Ausgliederung beteiligten Rechtsträger ist, wenn sie binnen sechs Monaten nach dem Tag, an dem die Eintragung der Ausgliederung in das Register des Sitzes desjenigen Rechtsträgers, dessen Gläubiger sie sind, nach § 19 Abs. 3 UmwG als bekanntgemacht gilt, ihren Anspruch nach Grund und Höhe schriftlich anmelden, Sicherheit zu leisten, soweit sie nicht Befriedigung verlangen können. Dieses Recht steht den Gläubigern jedoch nur zu, wenn sie glaubhaft machen, dass durch die Ausgliederung die Erfüllung ihrer Forderung gefährdet wird."
    },
    {
      "date": "2025-12-11",
      "id": "139770",
      "original_text": "Sonstige Registerbekanntmachung\nBerlin Amtsgericht Berlin (Charlottenburg) HRB 282095\nSarias GmbH – Berlin",
      "type": "Sonstige Registerbekanntmachung",
      "state": "Berlin",
      "amtsgericht": "Amtsgericht Berlin (Charlottenburg)",
      "registernummer": "HRB 282095",
      "registerart": "HRB",
      "company_name": "Sarias GmbH",
      "company_seat": "Berlin",
      "details": "11.12.2025 (Bekanntmachungsdatum)\n\nBerlin Amtsgericht Berlin (Charlottenburg) HRB 282095\nSonstige Registerbekanntmachung\n\nSarias GmbH\nGesellschaft mit beschränkter Haftung\nBerlin\n\nAls nicht eingetragen wird veröffentlicht:  Den Gläubigern ist, wenn sie binnen sechs Monaten nach dem Tag, an dem die Eintragung der Umwandlung als bekannt gemacht gilt, ihren Anspruch nach Grund und Höhe schriftlich anmelden, Sicherheit zu leisten, soweit sie nicht Befriedigung verlangen können. Dieses Recht steht den Gläubigern jedoch nur zu, wenn sie glaubhaft machen, dass durch die Umwandlung die Erfüllung ihrer Forderung gefährdet wird. Das Recht, Sicherheitsleistung zu verlangen, steht Gläubigern nicht zu, die im Falle der Insolvenz ein Recht auf vorzugsweise Befriedigung aus einer Deckungsmasse haben, die nach gesetzlicher Vorschrift zu ihrem Schutz errichtet und staatlich überwacht ist."
    },
    {
      "date": "2025-12-11",
      "id": "139771",
      "original_text": "Registerbekanntmachung nach dem Umwandlungsgesetz\nBerlin Amtsgericht Berlin (Charlottenburg) HRB 281695\nVOQUZ Labs GmbH – Berlin",
      "type": "Registerbekanntmachung nach dem Umwandlungsgesetz",
      "state": "Berlin",
      "amtsgericht": "Amtsgericht Berlin (Charlottenburg)",
      "registernummer": "HRB 281695",
      "registerart": "HRB",
      "company_name": "VOQUZ Labs GmbH",
      "company_seat": "Berlin",
      "details": "11.12.2025 (Bekanntmachungsdatum)\n\nBerlin Amtsgericht Berlin (Charlottenburg) HRB 281695\nRegisterbekanntmachung nach dem Umwandlungsgesetz 27.11.2025 (Eintragungsdatum)\n\nVOQUZ Labs GmbH\nGesellschaft mit beschränkter Haftung\nBerlin\n\nZu Eintragungsnummer 1 vom 27.11.2025 wird als nicht eingetragen veröffentlicht: Den Gläubigern ist, wenn sie binnen sechs Monaten nach dem Tag, an dem die Eintragung der Umwandlung als bekannt gemacht gilt, ihren Anspruch nach Grund und Höhe schriftlich anmelden, Sicherheit zu leisten, soweit sie nicht Befriedigung verlangen können. Dieses Recht steht den Gläubigern jedoch nur zu, wenn sie glaubhaft machen, dass durch die Umwandlung die Erfüllung ihrer Forderung gefährdet wird. Das Recht, Sicherheitsleistung zu verlangen, steht Gläubigern nicht zu, die im Falle der Insolvenz ein Recht auf vorzugsweise Befriedigung aus einer Deckungsmasse haben, die nach gesetzlicher Vorschrift zu ihrem Schutz errichtet und staatlich überwacht ist."
    },
    {
      "date": "2025-12-11",
      "id": "139772",
      "original_text": "Sonstige Registerbekanntmachung\nHamburg Amtsgericht Hamburg HRB 119941\nPREO Software AG – Hamburg",
      "type": "Sonstige Registerbekanntmachung",
      "state": "Hamburg",
      "amtsgericht": "Amtsgericht Hamburg",
      "registernummer": "HRB 119941",
      "registerart": "HRB",
      "company_name": "PREO Software AG",
      "company_seat": "Hamburg",
      "details": "11.12.2025 (Bekanntmachungsdatum)\n\nHamburg Amtsgericht Hamburg HRB 119941\nSonstige Registerbekanntmachung\n\nPREO Software AG\nAktiengesellschaft\nHamburg\n\nAls nicht eingetragen wird bekannt gemacht: Liste des Aufsichtsrats wurde eingereicht."
    },
    {
      "date": "2025-12-11",
      "id": "139773",
      "original_text": "Registerbekanntmachung nach dem Umwandlungsgesetz\nBaden-Württemberg Amtsgericht Mannheim HRB 755330\nHaus und Licht Vertriebs GmbH – Durmersheim",
      "type": "Registerbekanntmachung nach dem Umwandlungsgesetz",
      "state": "Baden-Württemberg",
      "amtsgericht": "Amtsgericht Mannheim",
      "registernummer": "HRB 755330",
      "registerart": "HRB",
      "company_name": "Haus und Licht Vertriebs GmbH",
      "company_seat": "Durmersheim",
      "details": "11.12.2025 (Bekanntmachungsdatum)\n\nBaden-Württemberg Amtsgericht Mannheim HRB 755330\nRegisterbekanntmachung nach dem Umwandlungsgesetz 11.12.2025 (Eintragungsdatum)\n\nHaus und Licht Vertriebs GmbH\nGesellschaft mit beschränkter Haftung\nDurmersheim\n\nDen Gläubigern der an der Ausgliederung beteiligten Rechtsträger ist, wenn sie binnen sechs Monaten nach dem Tag, an dem die Eintragung der Ausgliederung in das Register des Sitzes desjenigen Rechtsträgers, dessen Gläubiger sie sind, nach § 19 Abs. 3 UmwG als bekanntgemacht gilt, ihren Anspruch nach Grund und Höhe schriftlich anmelden, Sicherheit zu leisten, soweit sie nicht Befriedigung verlangen können. Dieses Recht steht den Gläubigern jedoch nur zu, wenn sie glaubhaft machen, dass durch die Ausgliederung die Erfüllung ihrer Forderung gefährdet wird."
    },
    {
      "date": "2025-12-11",
      "id": "139774",
      "original_text": "Löschungsankündigung\nSchleswig-Holstein Amtsgericht Pinneberg HRA 8059\nYacht and more OHG – Wedel",
      "type": "Löschungsankündigung",
      "state": "Schleswig-Holstein",
      "amtsgericht": "Amtsgericht Pinneberg",
      "registernummer": "HRA 8059",
      "registerart": "HRA",
      "company_name": "Yacht and more OHG",
      "company_seat": "Wedel",
      "details": "11.12.2025 (Bekanntmachungsdatum)\n\nSchleswig-Holstein Amtsgericht Pinneberg HRA 8059\nLöschungsankündigung\n\nYacht and more OHG\nOffene Handelsgesellschaft\nWedel\n\nBei der nachstehenden Firma wird das Amtslöschungsverfahren gemäß § 31 Abs. 2 HGB eingeleitet. Widerspruchsfrist: 2 Monate."
    },
    {
      "date": "2025-12-11",
      "id": "139775",
      "original_text": "Registerbekanntmachung nach dem Umwandlungsgesetz\nBaden-Württemberg Amtsgericht Stuttgart HRB 14562\nIBM Deutschland GmbH – Ehningen",
      "type": "Registerbekanntmachung nach dem Umwandlungsgesetz",
      "state": "Baden-Württemberg",
      "amtsgericht": "Amtsgericht Stuttgart",
      "registernummer": "HRB 14562",
      "registerart": "HRB",
      "company_name": "IBM Deutschland GmbH",
      "company_seat": "Ehningen",
      "details": "11.12.2025 (Bekanntmachungsdatum)\n\nBaden-Württemberg Amtsgericht Stuttgart HRB 14562\nRegisterbekanntmachung nach dem Umwandlungsgesetz 11.12.2025 (Eintragungsdatum)\n\nIBM Deutschland GmbH\nGesellschaft mit beschränkter Haftung\nEhningen\n\nDen Gläubigern der an der Verschmelzung beteiligten Rechtsträger ist, wenn sie binnen sechs Monaten nach dem Tag, an dem die Eintragung der Verschmelzung in das Register des Sitzes desjenigen Rechtsträgers, dessen Gläubiger sie sind, nach § 19 Abs. 3 UmwG als bekanntgemacht gilt, ihren Anspruch nach Grund und Höhe schriftlich anmelden, Sicherheit zu leisten, soweit sie nicht Befriedigung verlangen können. Dieses Recht steht den Gläubigern jedoch nur zu, wenn sie glaubhaft machen, dass durch die Verschmelzung die Erfüllung ihrer Forderung gefährdet wird."
    },
    {
      "date": "2025-12-11",
      "id": "139776",
      "original_text": "Registerbekanntmachung nach dem Umwandlungsgesetz\nBaden-Württemberg Amtsgericht Freiburg HRB 711726\nSSC-LUXon GmbH – Bad Krozingen",
      "type": "Registerbekanntmachung nach dem Umwandlungsgesetz",
      "state": "Baden-Württemberg",
      "amtsgericht": "Amtsgericht Freiburg",
      "registernummer": "HRB 711726",
      "registerart": "HRB",
      "company_name": "SSC-LUXon GmbH",
      "company_seat": "Bad Krozingen",
      "details": "11.12.2025 (Bekanntmachungsdatum)\n\nBaden-Württemberg Amtsgericht Freiburg HRB 711726\nRegisterbekanntmachung nach dem Umwandlungsgesetz 11.12.2025 (Eintragungsdatum)\n\nSSC-LUXon GmbH\nGesellschaft mit beschränkter Haftung\nBad Krozingen\n\nAls nicht eingetragen wird bekanntgemacht:\nDen Gläubigern der an der Verschmelzung beteiligten Rechtsträger ist, wenn sie binnen sechs Monaten nach dem Tag, an dem die Eintragung der Verschmelzung in das Register des Sitzes desjenigen Rechtsträgers, dessen Gläubiger sie sind, nach § 19 Abs. 3 UmwG als bekanntgemacht gilt, ihren Anspruch nach Grund und Höhe schriftlich anmelden, Sicherheit zu leisten, soweit sie nicht Befriedigung verlangen können. Dieses Recht steht den Gläubigern jedoch nur zu, wenn sie glaubhaft machen, dass durch die Verschmelzung die Erfüllung ihrer Forderung gefährdet wird."
    },
    {
      "date": "2025-12-11",
      "id": "139777",
      "original_text": "Registerbekanntmachung nach dem Umwandlungsgesetz\nBaden-Württemberg Amtsgericht Freiburg HRB 713746\nlinovum GmbH – Bad Krozingen",
      "type": "Registerbekanntmachung nach dem Umwandlungsgesetz",
      "state": "Baden-Württemberg",
      "amtsgericht": "Amtsgericht Freiburg",
      "registernummer": "HRB 713746",
      "registerart": "HRB",
      "company_name": "linovum GmbH",
      "company_seat": "Bad Krozingen",
      "details": "11.12.2025 (Bekanntmachungsdatum)\n\nBaden-Württemberg Amtsgericht Freiburg HRB 713746\nRegisterbekanntmachung nach dem Umwandlungsgesetz 11.12.2025 (Eintragungsdatum)\n\nlinovum GmbH\nGesellschaft mit beschränkter Haftung\nBad Krozingen\n\nAls nicht eingetragen wird bekanntgemacht:\nDen Gläubigern der an der Verschmelzung beteiligten Rechtsträger ist, wenn sie binnen sechs Monaten nach dem Tag, an dem die Eintragung der Verschmelzung in das Register des Sitzes desjenigen Rechtsträgers, dessen Gläubiger sie sind, nach § 19 Abs. 3 UmwG als bekanntgemacht gilt, ihren Anspruch nach Grund und Höhe schriftlich anmelden, Sicherheit zu leisten, soweit sie nicht Befriedigung verlangen können. Dieses Recht steht den Gläubigern jedoch nur zu, wenn sie glaubhaft machen, dass durch die Verschmelzung die Erfüllung ihrer Forderung gefährdet wird."
    },
    {
      "date": "2025-12-11",
      "id": "139778",
      "original_text": "Löschungsankündigung\nBaden-Württemberg Amtsgericht Stuttgart HRB 765093\nInternational Platin Marketing GmbH – Bad Rappenau",
      "type": "Löschungsankündigung",
      "state": "Baden-Württemberg",
      "amtsgericht": "Amtsgericht Stuttgart",
      "registernummer": "HRB 765093",
      "registerart": "HRB",
      "company_name": "International Platin Marketing GmbH",
      "company_seat": "Bad Rappenau",
      "details": "11.12.2025 (Bekanntmachungsdatum)\n\nBaden-Württemberg Amtsgericht Stuttgart HRB 765093\nLöschungsankündigung\n\nInternational Platin Marketing GmbH\nGesellschaft mit beschränkter Haftung\nBad Rappenau\n\nAls nicht eingetragen wird bekanntgemacht:\nDas Gericht beabsichtigt, die Gesellschaft wegen Vermögenslosigkeit im Handelsregister von Amts wegen nach § 394 FamFG zu löschen. Die Frist zur Geltendmachung eines Widerspruchs gegen die beabsichtigte Löschung ist auf zwei Monate ab Veröffentlichung bestimmt."
    },
    {
      "date": "2025-12-11",
      "id": "139779",
      "original_text": "Registerbekanntmachung nach dem Umwandlungsgesetz\nBaden-Württemberg Amtsgericht Stuttgart GsR 4316\nDensic eGbR – Ludwigsburg",
      "type": "Registerbekanntmachung nach dem Umwandlungsgesetz",
      "state": "Baden-Württemberg",
      "amtsgericht": "Amtsgericht Stuttgart",
      "registernummer": "GsR 4316",
      "registerart": "GsR",
      "company_name": "Densic eGbR",
      "company_seat": "Ludwigsburg",
      "details": "11.12.2025 (Bekanntmachungsdatum)\n\nBaden-Württemberg Amtsgericht Stuttgart GsR 4316\nRegisterbekanntmachung nach dem Umwandlungsgesetz 11.12.2025 (Eintragungsdatum)\n\nDensic eGbR\nGesellschaft bürgerlichen Rechts\nLudwigsburg\n\nAls nicht eingetragen wird bekanntgemacht:\nDen Gläubigern des an dem Formwechsel beteiligten Rechtsträgers ist, wenn sie binnen sechs Monaten nach dem Tag, an dem die Eintragung des Formwechsels in das Register des Sitzes desjenigen Rechtsträgers, dessen Gläubiger sie sind, nach § 19 Abs. 3 UmwG als bekanntgemacht gilt, ihren Anspruch nach Grund und Höhe schriftlich anmelden, Sicherheit zu leisten, soweit sie nicht Befriedigung verlangen können. Dieses Recht steht den Gläubigern jedoch nur zu, wenn sie glaubhaft machen, dass durch den Formwechsel die Erfüllung ihrer Forderung gefährdet wird."
    },
    {
      "date": "2025-12-11",
      "id": "139780",
      "original_text": "Registerbekanntmachung nach dem Umwandlungsgesetz\nBaden-Württemberg Amtsgericht Stuttgart HRB 755379\nDensic GmbH – Ludwigsburg",
      "type": "Registerbekanntmachung nach dem Umwandlungsgesetz",
      "state": "Baden-Württemberg",
      "amtsgericht": "Amtsgericht Stuttgart",
      "registernummer": "HRB 755379",
      "registerart": "HRB",
      "company_name": "Densic GmbH",
      "company_seat": "Ludwigsburg",
      "details": "11.12.2025 (Bekanntmachungsdatum)\n\nBaden-Württemberg Amtsgericht Stuttgart HRB 755379\nRegisterbekanntmachung nach dem Umwandlungsgesetz 11.12.2025 (Eintragungsdatum)\n\nDensic GmbH\nGesellschaft mit beschränkter Haftung\nLudwigsburg\n\nAls nicht eingetragen wird bekanntgemacht:\nDen Gläubigern des an dem Formwechsel beteiligten Rechtsträgers ist, wenn sie binnen sechs Monaten nach dem Tag, an dem die Eintragung des Formwechsels in das Register des Sitzes desjenigen Rechtsträgers, dessen Gläubiger sie sind, nach § 19 Abs. 3 UmwG als bekanntgemacht gilt, ihren Anspruch nach Grund und Höhe schriftlich anmelden, Sicherheit zu leisten, soweit sie nicht Befriedigung verlangen können. Dieses Recht steht den Gläubigern jedoch nur zu, wenn sie glaubhaft machen, dass durch den Formwechsel die Erfüllung ihrer Forderung gefährdet wird."
    },
    {
      "date": "2025-12-11",
      "id": "139781",
      "original_text": "Sonstige Registerbekanntmachung\nBaden-Württemberg Amtsgericht Freiburg HRB 727278\nPingitore Sanierung GmbH – Gottmadingen",
      "type": "Sonstige Registerbekanntmachung",
      "state": "Baden-Württemberg",
      "amtsgericht": "Amtsgericht Freiburg",
      "registernummer": "HRB 727278",
      "registerart": "HRB",
      "company_name": "Pingitore Sanierung GmbH",
      "company_seat": "Gottmadingen",
      "details": "11.12.2025 (Bekanntmachungsdatum)\n\nBaden-Württemberg Amtsgericht Freiburg HRB 727278\nSonstige Registerbekanntmachung 11.12.2025 (Eintragungsdatum)\n\nPingitore Sanierung GmbH\nGesellschaft mit beschränkter Haftung\nGottmadingen\n\nAls nicht eingetragen wird bekanntgemacht:\nDen Gläubigern der Gesellschaft, deren Forderungen begründet worden sind, bevor die Eintragung der Beendigung des Vertrages in das Handelsregister nach § 10 HGB als bekanntgemacht gilt, ist vom anderen Vertragsteil Sicherheit zu leisten, wenn sie sich binnen sechs Monaten nach der Bekanntmachung zu diesem Zweck bei ihm melden."
    },
    {
      "date": "2025-12-11",
      "id": "139782",
      "original_text": "Registerbekanntmachung nach dem Umwandlungsgesetz\nBaden-Württemberg Amtsgericht Freiburg HRB 731557\nWFP2 UG (haftungsbeschränkt) – Überlingen",
      "type": "Registerbekanntmachung nach dem Umwandlungsgesetz",
      "state": "Baden-Württemberg",
      "amtsgericht": "Amtsgericht Freiburg",
      "registernummer": "HRB 731557",
      "registerart": "HRB",
      "company_name": "WFP2 UG (haftungsbeschränkt)",
      "company_seat": "Überlingen",
      "details": "11.12.2025 (Bekanntmachungsdatum)\n\nBaden-Württemberg Amtsgericht Freiburg HRB 731557\nRegisterbekanntmachung nach dem Umwandlungsgesetz 11.12.2025 (Eintragungsdatum)\n\nWFP2 UG (haftungsbeschränkt)\nGesellschaft mit beschränkter Haftung\nÜberlingen\n\nDie Gesellschaft ist formwechseln umgewandelt in die \"WFP2 eGbR\" (Amtsgericht Freiburg, GsR 1706). Den Gläubigern des an dem Formwechsel beteiligten Rechtsträgers ist, wenn sie binnen sechs Monaten nach dem Tag, an dem die Eintragung des Formwechsels in das Register des Sitzes desjenigen Rechtsträgers, dessen Gläubiger sie sind, nach § 19 Abs. 3 UmwG als bekanntgemacht gilt, ihren Anspruch nach Grund und Höhe schriftlich anmelden, Sicherheit zu leisten, soweit sie nicht Befriedigung verlangen können. Dieses Recht steht den Gläubigern jedoch nur zu, wenn sie glaubhaft machen, dass durch den Formwechsel die Erfüllung ihrer Forderung gefährdet wird."
    },
    {
      "date": "2025-12-11",
      "id": "139783",
      "original_text": "Löschungsankündigung\nBerlin Amtsgericht Berlin (Charlottenburg) HRB 10251\nArthur Ladegast Waagen- und Maschinen-Fabrik Gesellschaft mit beschränkter Haftung – Berlin",
      "type": "Löschungsankündigung",
      "state": "Berlin",
      "amtsgericht": "Amtsgericht Berlin (Charlottenburg)",
      "registernummer": "HRB 10251",
      "registerart": "HRB",
      "company_name": "Arthur Ladegast Waagen- und Maschinen-Fabrik Gesellschaft mit beschränkter Haftung",
      "company_seat": "Berlin",
      "details": "11.12.2025 (Bekanntmachungsdatum)\n\nBerlin Amtsgericht Berlin (Charlottenburg) HRB 10251\nLöschungsankündigung\n\nArthur Ladegast Waagen- und Maschinen-Fabrik Gesellschaft mit beschränkter Haftung\nGesellschaft mit beschränkter Haftung\nBerlin\n\nBei der nachstehenden Gesellschaft wird das Amtslöschungsverfahren gemäß § 394 FamFG eingeleitet. Widerspruchsfrist: 6 Wochen."
    },
    {
      "date": "2025-12-11",
      "id": "139784",
      "original_text": "Löschungsankündigung\nSchleswig-Holstein Amtsgericht Flensburg HRB 9385\nHochseeangelfahrten Maasholm GmbH – Koldenbüttel",
      "type": "Löschungsankündigung",
      "state": "Schleswig-Holstein",
      "amtsgericht": "Amtsgericht Flensburg",
      "registernummer": "HRB 9385",
      "registerart": "HRB",
      "company_name": "Hochseeangelfahrten Maasholm GmbH",
      "company_seat": "Koldenbüttel",
      "details": "11.12.2025 (Bekanntmachungsdatum)\n\nSchleswig-Holstein Amtsgericht Flensburg HRB 9385\nLöschungsankündigung\n\nHochseeangelfahrten Maasholm GmbH\nGesellschaft mit beschränkter Haftung\nKoldenbüttel\n\nEs ist die Löschung der nachstehenden Gesellschaft wegen Vermögenslosigkeit gemäß § 394 FamFG beabsichtigt.\nWiderspruchsfrist: 2 Monate."
    },
    {
      "date": "2025-12-11",
      "id": "139785",
      "original_text": "Registerbekanntmachung nach dem Umwandlungsgesetz\nSachsen Amtsgericht Leipzig HRB 24649\nCC Beteiligungsgesellschaft mbH – Leipzig",
      "type": "Registerbekanntmachung nach dem Umwandlungsgesetz",
      "state": "Sachsen",
      "amtsgericht": "Amtsgericht Leipzig",
      "registernummer": "HRB 24649",
      "registerart": "HRB",
      "company_name": "CC Beteiligungsgesellschaft mbH",
      "company_seat": "Leipzig",
      "details": "11.12.2025 (Bekanntmachungsdatum)\n\nSachsen Amtsgericht Leipzig HRB 24649\nRegisterbekanntmachung nach dem Umwandlungsgesetz 11.12.2025 (Eintragungsdatum)\n\nCC Beteiligungsgesellschaft mbH\nGesellschaft mit beschränkter Haftung\nLeipzig\n\nDen Gläubigern der an der Spaltung beteiligten Rechtsträger ist, wenn sie binnen sechs Monaten nach dem Tag, an dem die Eintragung der Spaltung in das Register des Sitzes desjenigen Rechtsträgers, dessen Gläubiger sie sind, nach § 19 Abs. 3 UmwG als bekannt gemacht gilt, ihren Anspruch nach Grund und Höhe in Textform anmelden, Sicherheit zu leisten, soweit sie nicht Befriedigung verlangen können. Dieses Recht steht den Gläubigern jedoch nur zu, wenn sie glaubhaft machen, dass durch die Spaltung die Erfüllung der Forderung gefährdet wird."
    },
    {
      "date": "2025-12-11",
      "id": "139786",
      "original_text": "Einreichung neuer Dokumente\nSachsen Amtsgericht Dresden HRB 16581\nBeteiligungs- und Verwaltungsgesellschaft Coswig mbH – Coswig",
      "type": "Einreichung neuer Dokumente",
      "state": "Sachsen",
      "amtsgericht": "Amtsgericht Dresden",
      "registernummer": "HRB 16581",
      "registerart": "HRB",
      "company_name": "Beteiligungs- und Verwaltungsgesellschaft Coswig mbH",
      "company_seat": "Coswig",
      "details": "11.12.2025 (Bekanntmachungsdatum)\n\nSachsen Amtsgericht Dresden HRB 16581\nEinreichung neuer Dokumente\n\nBeteiligungs- und Verwaltungsgesellschaft Coswig mbH\nGesellschaft mit beschränkter Haftung\nCoswig\n\nAm 10.12.2025 wurde beim Handelsregister des Amtsgerichts Dresden die Liste der Mitglieder des Aufsichtsrats gemäß § 52 GmbHG eingereicht."
    },
    {
      "date": "2025-12-11",
      "id": "139787",
      "original_text": "Registerbekanntmachung nach dem Umwandlungsgesetz\nSachsen Amtsgericht Chemnitz HRB 4791\nBarth Metall GmbH – Hainichen",
      "type": "Registerbekanntmachung nach dem Umwandlungsgesetz",
      "state": "Sachsen",
      "amtsgericht": "Amtsgericht Chemnitz",
      "registernummer": "HRB 4791",
      "registerart": "HRB",
      "company_name": "Barth Metall GmbH",
      "company_seat": "Hainichen",
      "details": "11.12.2025 (Bekanntmachungsdatum)\n\nSachsen Amtsgericht Chemnitz HRB 4791\nRegisterbekanntmachung nach dem Umwandlungsgesetz 11.12.2025 (Eintragungsdatum)\n\nBarth Metall GmbH\nGesellschaft mit beschränkter Haftung\nHainichen\n\nDen Gläubigern der an der Verschmelzung beteiligten Rechtsträger ist, wenn sie binnen sechs Monaten nach dem Tag, an dem die Eintragung der Verschmelzung in das Register des Sitzes desjenigen Rechtsträgers, dessen Gläubiger sie sind, nach § 19 Abs. 3 UmwG als bekannt gemacht gilt, ihren Anspruch nach Grund und Höhe in Textform anmelden, Sicherheit zu leisten, soweit sie nicht Befriedigung verlangen können. Dieses Recht steht den Gläubigern jedoch nur zu, wenn sie glaubhaft machen, dass durch die Verschmelzung die Erfüllung der Forderung gefährdet wird."
    },
    {
      "date": "2025-12-11",
      "id": "139788",
      "original_text": "Registerbekanntmachung nach dem Umwandlungsgesetz\nSachsen Amtsgericht Leipzig HRB 44895\nCC-Vermögens- und Verwaltungs GmbH – Leipzig",
      "type": "Registerbekanntmachung nach dem Umwandlungsgesetz",
      "state": "Sachsen",
      "amtsgericht": "Amtsgericht Leipzig",
      "registernummer": "HRB 44895",
      "registerart": "HRB",
      "company_name": "CC-Vermögens- und Verwaltungs GmbH",
      "company_seat": "Leipzig",
      "details": "11.12.2025 (Bekanntmachungsdatum)\n\nSachsen Amtsgericht Leipzig HRB 44895\nRegisterbekanntmachung nach dem Umwandlungsgesetz 11.12.2025 (Eintragungsdatum)\n\nCC-Vermögens- und Verwaltungs GmbH\nGesellschaft mit beschränkter Haftung\nLeipzig\n\nDen Gläubigern der an der Spaltung beteiligten Rechtsträger ist, wenn sie binnen sechs Monaten nach dem Tag, an dem die Eintragung der Spaltung in das Register des Sitzes desjenigen Rechtsträgers, dessen Gläubiger sie sind, nach § 19 Abs. 3 UmwG als bekannt gemacht gilt, ihren Anspruch nach Grund und Höhe in Textform anmelden, Sicherheit zu leisten, soweit sie nicht Befriedigung verlangen können. Dieses Recht steht den Gläubigern jedoch nur zu, wenn sie glaubhaft machen, dass durch die Spaltung die Erfüllung der Forderung gefährdet wird."
    },
    {
      "date": "2025-12-11",
      "id": "139789",
      "original_text": "Registerbekanntmachung nach dem Umwandlungsgesetz\nSachsen Amtsgericht Dresden HRB 42706\nSchellenberg + Bäumler Architekten GmbH – Dresden",
      "type": "Registerbekanntmachung nach dem Umwandlungsgesetz",
      "state": "Sachsen",
      "amtsgericht": "Amtsgericht Dresden",
      "registernummer": "HRB 42706",
      "registerart": "HRB",
      "company_name": "Schellenberg + Bäumler Architekten GmbH",
      "company_seat": "Dresden",
      "details": "11.12.2025 (Bekanntmachungsdatum)\n\nSachsen Amtsgericht Dresden HRB 42706\nRegisterbekanntmachung nach dem Umwandlungsgesetz 11.12.2025 (Eintragungsdatum)\n\nSchellenberg + Bäumler Architekten GmbH\nGesellschaft mit beschränkter Haftung\nDresden\n\nDen Gläubigern der an der Verschmelzung beteiligten Rechtsträger ist, wenn sie binnen sechs Monaten nach dem Tag, an dem die Eintragung der Verschmelzung in das Register des Sitzes desjenigen Rechtsträgers, dessen Gläubiger sie sind, nach § 19 Abs. 3 UmwG als bekannt gemacht gilt, ihren Anspruch nach Grund und Höhe in Textform anmelden, Sicherheit zu leisten, soweit sie nicht Befriedigung verlangen können. Dieses Recht steht den Gläubigern jedoch nur zu, wenn sie glaubhaft machen, dass durch die Verschmelzung die Erfüllung der Forderung gefährdet wird."
    },
    {
      "date": "2025-12-11",
      "id": "139790",
      "original_text": "Einreichung neuer Dokumente\nBrandenburg Amtsgericht Potsdam HRB 26405\nFreibad Kiebitzberge GmbH – Kleinmachnow",
      "type": "Einreichung neuer Dokumente",
      "state": "Brandenburg",
      "amtsgericht": "Amtsgericht Potsdam",
      "registernummer": "HRB 26405",
      "registerart": "HRB",
      "company_name": "Freibad Kiebitzberge GmbH",
      "company_seat": "Kleinmachnow",
      "details": "11.12.2025 (Bekanntmachungsdatum)\n\nBrandenburg Amtsgericht Potsdam HRB 26405\nEinreichung neuer Dokumente\n\nFreibad Kiebitzberge GmbH\nGesellschaft mit beschränkter Haftung\nKleinmachnow\n\nAls nicht eingetragen wird veröffentlicht:\nEine Liste der Mitglieder des Aufsichtsrates wurde zum Handelsregister eingereicht."
    },
    {
      "date": "2025-12-11",
      "id": "139791",
      "original_text": "Löschungsankündigung\nNiedersachsen Amtsgericht Braunschweig HRB 208057\nFachwerk Projekt GmbH – Bad Harzburg",
      "type": "Löschungsankündigung",
      "state": "Niedersachsen",
      "amtsgericht": "Amtsgericht Braunschweig",
      "registernummer": "HRB 208057",
      "registerart": "HRB",
      "company_name": "Fachwerk Projekt GmbH",
      "company_seat": "Bad Harzburg",
      "details": "11.12.2025 (Bekanntmachungsdatum)\n\nNiedersachsen Amtsgericht Braunschweig HRB 208057\nLöschungsankündigung\n\nFachwerk Projekt GmbH\nGesellschaft mit beschränkter Haftung\nBad Harzburg\n\nDas Registergericht beabsichtigt, die Gesellschaft von Amts wegen nach § 394 FamFG zu löschen. Die Frist zur Erhebung eines Widerspruchs ist auf 1 Monat ab dieser Registerbekanntmachung festgesetzt."
    },
    {
      "date": "2025-12-11",
      "id": "139792",
      "original_text": "Löschungsankündigung\nNiedersachsen Amtsgericht Stadthagen HRB 201615\nItalia Ristorante GmbH – Rinteln",
      "type": "Löschungsankündigung",
      "state": "Niedersachsen",
      "amtsgericht": "Amtsgericht Stadthagen",
      "registernummer": "HRB 201615",
      "registerart": "HRB",
      "company_name": "Italia Ristorante GmbH",
      "company_seat": "Rinteln",
      "details": "11.12.2025 (Bekanntmachungsdatum)\n\nNiedersachsen Amtsgericht Stadthagen HRB 201615\nLöschungsankündigung\n\nItalia Ristorante GmbH\nGesellschaft mit beschränkter Haftung\nRinteln\n\nDas Registergericht beabsichtigt, die Gesellschaft von Amts wegen nach § 394 FamFG zu löschen. Die Frist zur Erhebung eines Widerspruchs ist auf 1 Monat ab dieser Registerbekanntmachung festgesetzt."
    },
    {
      "date": "2025-12-11",
      "id": "139793",
      "original_text": "Löschungsankündigung\nNiedersachsen Amtsgericht Aurich HRA 100464 früher Amtsgericht Emden\nW. Bockstiegel UG (haftungsbeschränkt) & Co. Reederei KG MS \"Atlantic Carrier\" – Emden",
      "type": "Löschungsankündigung",
      "state": "Niedersachsen",
      "amtsgericht": "Amtsgericht Aurich",
      "registernummer": "HRA 100464",
      "registerart": "HRA",
      "company_name": "W. Bockstiegel UG (haftungsbeschränkt) & Co. Reederei KG MS \"Atlantic Carrier\"",
      "company_seat": "Emden",
      "former_amtsgericht": "Emden",
      "details": "11.12.2025 (Bekanntmachungsdatum)\n\nNiedersachsen Amtsgericht Aurich HRA 100464 früher Amtsgericht Emden\nLöschungsankündigung\n\nW. Bockstiegel UG (haftungsbeschränkt) & Co. Reederei KG MS \"Atlantic Carrier\"\nKommanditgesellschaft\nEmden\n\nDas Registergericht beabsichtigt, die Firma von Amts wegen nach § 394 FamFG zu löschen. Die Frist zur Erhebung eines Widerspruchs ist auf 4 Monate ab dieser Registerbekanntmachung festgesetzt."
    },
    {
      "date": "2025-12-11",
      "id": "139794",
      "original_text": "Einreichung neuer Dokumente\nNiedersachsen Amtsgericht Oldenburg (Oldenburg) HRB 208120\nSiemer Unternehmensbeteiligung AG – Vechta",
      "type": "Einreichung neuer Dokumente",
      "state": "Niedersachsen",
      "amtsgericht": "Amtsgericht Oldenburg (Oldenburg)",
      "registernummer": "HRB 208120",
      "registerart": "HRB",
      "company_name": "Siemer Unternehmensbeteiligung AG",
      "company_seat": "Vechta",
      "details": "11.12.2025 (Bekanntmachungsdatum)\n\nNiedersachsen Amtsgericht Oldenburg (Oldenburg) HRB 208120\nEinreichung neuer Dokumente\n\nSiemer Unternehmensbeteiligung AG\nAktiengesellschaft\nVechta\n\nDie Liste der Mitglieder des Aufsichtsrats wurde beim Registergericht eingereicht."
    },
    {
      "date": "2025-12-11",
      "id": "139795",
      "original_text": "Einreichung neuer Dokumente\nNiedersachsen Amtsgericht Hannover HRB 212100\nHSP STEUER Aktiengesellschaft Steuerberatungsgesellschaft – Hannover",
      "type": "Einreichung neuer Dokumente",
      "state": "Niedersachsen",
      "amtsgericht": "Amtsgericht Hannover",
      "registernummer": "HRB 212100",
      "registerart": "HRB",
      "company_name": "HSP STEUER Aktiengesellschaft Steuerberatungsgesellschaft",
      "company_seat": "Hannover",
      "details": "11.12.2025 (Bekanntmachungsdatum)\n\nNiedersachsen Amtsgericht Hannover HRB 212100\nEinreichung neuer Dokumente\n\nHSP STEUER Aktiengesellschaft Steuerberatungsgesellschaft\nAktiengesellschaft\nHannover\n\nDie Liste der Mitglieder des Aufsichtsrats wurde beim Registergericht eingereicht."
    },
    {
      "date": "2025-12-11",
      "id": "139796",
      "original_text": "Registerbekanntmachung nach dem Umwandlungsgesetz\nNiedersachsen Amtsgericht Tostedt HRB 101127 früher Amtsgericht Stade\nKarl Meyer GmbH – Wischhafen",
      "type": "Registerbekanntmachung nach dem Umwandlungsgesetz",
      "state": "Niedersachsen",
      "amtsgericht": "Amtsgericht Tostedt",
      "registernummer": "HRB 101127",
      "registerart": "HRB",
      "company_name": "Karl Meyer GmbH",
      "company_seat": "Wischhafen",
      "former_amtsgericht": "Stade",
      "details": "11.12.2025 (Bekanntmachungsdatum)\n\nNiedersachsen Amtsgericht Tostedt HRB 101127 früher Amtsgericht Stade\nRegisterbekanntmachung nach dem Umwandlungsgesetz 11.12.2025 (Eintragungsdatum)\n\nKarl Meyer GmbH\nGesellschaft mit beschränkter Haftung\nWischhafen\n\nDen Gläubigern der an der formwechselnden Umwandlung beteiligten Rechtsträger ist, wenn sie binnen sechs Monaten nach dem Tag, an dem die Eintragung der Umwandlung in das Register des Sitzes desjenigen Rechtsträgers, dessen Gläubiger sie sind, nach § 19 Abs. 3 UmwG als bekannt gemacht gilt, ihren Anspruch nach Grund und Höhe schriftlich anmelden, Sicherheit zu leisten, soweit sie nicht Befriedigung verlangen können. Dieses Recht steht den Gläubigern jedoch nur zu, wenn sie glaubhaft machen, dass durch die formwechselnde Umwandlung die Erfüllung der Forderung gefährdet wird."
    },
    {
      "date": "2025-12-11",
      "id": "139797",
      "original_text": "Registerbekanntmachung nach dem Umwandlungsgesetz\nNiedersachsen Amtsgericht Osnabrück HRB 216132\nzvoove Customer II GmbH – Wietmarschen-Lohne",
      "type": "Registerbekanntmachung nach dem Umwandlungsgesetz",
      "state": "Niedersachsen",
      "amtsgericht": "Amtsgericht Osnabrück",
      "registernummer": "HRB 216132",
      "registerart": "HRB",
      "company_name": "zvoove Customer II GmbH",
      "company_seat": "Wietmarschen-Lohne",
      "details": "11.12.2025 (Bekanntmachungsdatum)\n\nNiedersachsen Amtsgericht Osnabrück HRB 216132\nRegisterbekanntmachung nach dem Umwandlungsgesetz 11.12.2025 (Eintragungsdatum)\n\nzvoove Customer II GmbH\nGesellschaft mit beschränkter Haftung\nWietmarschen-Lohne\n\nDen Gläubigern der an der Verschmelzung beteiligten Rechtsträger ist, wenn sie binnen sechs Monaten nach dem Tag, an dem die Eintragung der Verschmelzung in das Register des Sitzes desjenigen Rechtsträgers, dessen Gläubiger sie sind, nach § 19  Abs.  3 UmwG als bekannt gemacht gilt, ihren Anspruch nach Grund und Höhe schriftlich anmelden, Sicherheit zu leisten, soweit sie nicht Befriedigung verlangen können. Dieses Recht steht den Gläubigern jedoch nur zu, wenn sie glaubhaft machen, dass durch die Verschmelzung die Erfüllung der Forderung gefährdet wird."
    },
    {
      "date": "2025-12-11",
      "id": "139798",
      "original_text": "Löschungsankündigung\nBrandenburg Amtsgericht Potsdam HRB 31135\nKavitat UG (haftungsbeschränkt) – Kloster Lehnin",
      "type": "Löschungsankündigung",
      "state": "Brandenburg",
      "amtsgericht": "Amtsgericht Potsdam",
      "registernummer": "HRB 31135",
      "registerart": "HRB",
      "company_name": "Kavitat UG (haftungsbeschränkt)",
      "company_seat": "Kloster Lehnin",
      "details": "11.12.2025 (Bekanntmachungsdatum)\n\nBrandenburg Amtsgericht Potsdam HRB 31135\nLöschungsankündigung\n\nKavitat UG (haftungsbeschränkt)\nGesellschaft mit beschränkter Haftung\nKloster Lehnin\n\nBei der nachstehenden Gesellschaft wird das Amtslöschungsverfahren gemäß § 394 FamFG eingeleitet."
    },
    {
      "date": "2025-12-11",
      "id": "139799",
      "original_text": "Löschungsankündigung\nBremen Amtsgericht Bremen HRB 37318\nVanfind AS UG (haftungsbeschränkt) – Bremen",
      "type": "Löschungsankündigung",
      "state": "Bremen",
      "amtsgericht": "Amtsgericht Bremen",
      "registernummer": "HRB 37318",
      "registerart": "HRB",
      "company_name": "Vanfind AS UG (haftungsbeschränkt)",
      "company_seat": "Bremen",
      "details": "11.12.2025 (Bekanntmachungsdatum)\n\nBremen Amtsgericht Bremen HRB 37318\nLöschungsankündigung\n\nVanfind AS UG (haftungsbeschränkt)\nGesellschaft mit beschränkter Haftung\nBremen\n\nEs ist beabsichtigt die im Handelsregister eingetragene Gesellschaft von Amts wegen gemäß § 394 FamFG zu löschen. Gegen die Löschung kann beim AG Bremen schriftlich oder zu Protokoll der Geschäftsstelle Widerspruch eingelegt werden. Widerspruchsfrist 4 Wochen."
    },
    {
      "date": "2025-12-11",
      "id": "139800",
      "original_text": "Einreichung neuer Dokumente\nRheinland-Pfalz Amtsgericht Zweibrücken HRB 1732\nComlet Verteilte Systeme GmbH – Zweibrücken",
      "type": "Einreichung neuer Dokumente",
      "state": "Rheinland-Pfalz",
      "amtsgericht": "Amtsgericht Zweibrücken",
      "registernummer": "HRB 1732",
      "registerart": "HRB",
      "company_name": "Comlet Verteilte Systeme GmbH",
      "company_seat": "Zweibrücken",
      "details": "11.12.2025 (Bekanntmachungsdatum)\n\nRheinland-Pfalz Amtsgericht Zweibrücken HRB 1732\nEinreichung neuer Dokumente\n\nComlet Verteilte Systeme GmbH\nGesellschaft mit beschränkter Haftung\nZweibrücken\n\nDem Registergericht ist eine neue Liste der Mitglieder des Aufsichtsrates eingereicht worden."
    },
    {
      "date": "2025-12-11",
      "id": "139801",
      "original_text": "Registerbekanntmachung nach dem Umwandlungsgesetz\nRheinland-Pfalz Amtsgericht Landau HRB 34428\nHeuser & Söhne GmbH – Hatzenbühl",
      "type": "Registerbekanntmachung nach dem Umwandlungsgesetz",
      "state": "Rheinland-Pfalz",
      "amtsgericht": "Amtsgericht Landau",
      "registernummer": "HRB 34428",
      "registerart": "HRB",
      "company_name": "Heuser & Söhne GmbH",
      "company_seat": "Hatzenbühl",
      "details": "11.12.2025 (Bekanntmachungsdatum)\n\nRheinland-Pfalz Amtsgericht Landau HRB 34428\nRegisterbekanntmachung nach dem Umwandlungsgesetz 11.12.2025 (Eintragungsdatum)\n\nHeuser & Söhne GmbH\nGesellschaft mit beschränkter Haftung\nHatzenbühl\n\nAls nicht eingetragen wird veröffentlicht: Den Gläubigern der an der Ausgliederung beteiligten Rechtsträger ist, wenn sie binnen sechs Monaten nach dem Tag, an dem die Eintragung der Ausgliederung in das Register des Sitzes desjenigen Rechtsträgers, dessen Gläubiger sie sind, nach § 19 Abs. 3 UmwG als bekannt gemacht gilt, ihren Anspruch nach Grund und Höhe schriftlich anmelden, Sicherheit zu leisten, soweit sie nicht Befriedigung verlangen können. Dieses Recht steht den Gläubigern jedoch nur zu, wenn sie glaubhaft machen, dass durch die Ausgliederung die Erfüllung der Forderung gefährdet wird."
    },
    {
      "date": "2025-12-11",
      "id": "139802",
      "original_text": "Registerbekanntmachung nach dem Umwandlungsgesetz\nRheinland-Pfalz Amtsgericht Montabaur HRB 20745\nWWA Verwaltungs GmbH – Staudt",
      "type": "Registerbekanntmachung nach dem Umwandlungsgesetz",
      "state": "Rheinland-Pfalz",
      "amtsgericht": "Amtsgericht Montabaur",
      "registernummer": "HRB 20745",
      "registerart": "HRB",
      "company_name": "WWA Verwaltungs GmbH",
      "company_seat": "Staudt",
      "details": "11.12.2025 (Bekanntmachungsdatum)\n\nRheinland-Pfalz Amtsgericht Montabaur HRB 20745\nRegisterbekanntmachung nach dem Umwandlungsgesetz 10.12.2025 (Eintragungsdatum)\n\nWWA Verwaltungs GmbH\nGesellschaft mit beschränkter Haftung\nStaudt\n\nDen Gläubigern der an der Verschmelzung beteiligten übernehmenden Rechtsträger ist, wenn sie binnen sechs Monaten nach dem Tag, an dem die Eintragung der Verschmelzung in das Register des Sitzes desjenigen Rechtsträgers, dessen Gläubiger sie sind, nach § 19 Absatz 3 UmwG als bekanntgemacht gilt, ihren Anspruch nach Grund und Höhe schriftlich anmelden, Sicherheit zu leisten, soweit sie nicht Befriedigung verlangen können.\n\nDieses Recht steht den Gläubigern jedoch nur zu, wenn sie glaubhaft machen, dass durch die Verschmelzung die Erfüllung ihrer Forderung gefährdet wird."
    },
    {
      "date": "2025-12-11",
      "id": "139803",
      "original_text": "Sonstige Registerbekanntmachung\nRheinland-Pfalz Amtsgericht Mainz HRB 5165\nMainzer Alten- und Wohnheime gemeinnützige Gesellschaft mit beschränkter Haftung – Mainz",
      "type": "Sonstige Registerbekanntmachung",
      "state": "Rheinland-Pfalz",
      "amtsgericht": "Amtsgericht Mainz",
      "registernummer": "HRB 5165",
      "registerart": "HRB",
      "company_name": "Mainzer Alten- und Wohnheime gemeinnützige Gesellschaft mit beschränkter Haftung",
      "company_seat": "Mainz",
      "details": "11.12.2025 (Bekanntmachungsdatum)\n\nRheinland-Pfalz Amtsgericht Mainz HRB 5165\nSonstige Registerbekanntmachung\n\nMainzer Alten- und Wohnheime gemeinnützige Gesellschaft mit beschränkter Haftung\nGesellschaft mit beschränkter Haftung\nMainz\n\nDem Registergericht ist eine Liste der Mitglieder des Aufsichtsrates eingereicht worden."
    },
    {
      "date": "2025-12-11",
      "id": "139804",
      "original_text": "Einreichung neuer Dokumente\nRheinland-Pfalz Amtsgericht Mainz HRB 4988\nmainzplus CITYMARKETING GmbH – Mainz",
      "type": "Einreichung neuer Dokumente",
      "state": "Rheinland-Pfalz",
      "amtsgericht": "Amtsgericht Mainz",
      "registernummer": "HRB 4988",
      "registerart": "HRB",
      "company_name": "mainzplus CITYMARKETING GmbH",
      "company_seat": "Mainz",
      "details": "11.12.2025 (Bekanntmachungsdatum)\n\nRheinland-Pfalz Amtsgericht Mainz HRB 4988\nEinreichung neuer Dokumente\n\nmainzplus CITYMARKETING GmbH\nGesellschaft mit beschränkter Haftung\nMainz\n\nDie Gesellschaft hat eine geänderte Liste der Aufsichtsratsmitglieder zum Handelsregister Mainz eingereicht."
    },
    {
      "date": "2025-12-11",
      "id": "139805",
      "original_text": "Löschungsankündigung\nRheinland-Pfalz Amtsgericht Koblenz HRB 25170\nAuto Bens GmbH – Kottenheim",
      "type": "Löschungsankündigung",
      "state": "Rheinland-Pfalz",
      "amtsgericht": "Amtsgericht Koblenz",
      "registernummer": "HRB 25170",
      "registerart": "HRB",
      "company_name": "Auto Bens GmbH",
      "company_seat": "Kottenheim",
      "details": "11.12.2025 (Bekanntmachungsdatum)\n\nRheinland-Pfalz Amtsgericht Koblenz HRB 25170\nLöschungsankündigung\n\nAuto Bens GmbH\nGesellschaft mit beschränkter Haftung\nKottenheim\n\nDas Registergericht beabsichtigt die Gesellschaft von Amts wegen nach § 394 FamFG zu löschen. Die Frist zur Erhebung eines Widerspruchs ist auf zwei Monate festgesetzt."
    },
    {
      "date": "2025-12-11",
      "id": "139806",
      "original_text": "Registerbekanntmachung nach dem Umwandlungsgesetz\nRheinland-Pfalz Amtsgericht Landau HRA 31122\nManfred Heuser e.K. – Hatzenbühl",
      "type": "Registerbekanntmachung nach dem Umwandlungsgesetz",
      "state": "Rheinland-Pfalz",
      "amtsgericht": "Amtsgericht Landau",
      "registernummer": "HRA 31122",
      "registerart": "HRA",
      "company_name": "Manfred Heuser e.K.",
      "company_seat": "Hatzenbühl",
      "details": "11.12.2025 (Bekanntmachungsdatum)\n\nRheinland-Pfalz Amtsgericht Landau HRA 31122\nRegisterbekanntmachung nach dem Umwandlungsgesetz 11.12.2025 (Eintragungsdatum)\n\nManfred Heuser e.K.\nEinzelkaufmann / Einzelkauffrau\nHatzenbühl\n\nAls nicht eingetragen wird veröffentlicht: Den Gläubigern der an der Ausgliederung beteiligten Rechtsträger ist, wenn sie binnen sechs Monaten nach dem Tag, an dem die Eintragung der Ausgliederung in das Register des Sitzes desjenigen Rechtsträgers, dessen Gläubiger sie sind, nach § 19 Abs. 3 UmwG als bekannt gemacht gilt, ihren Anspruch nach Grund und Höhe schriftlich anmelden, Sicherheit zu leisten, soweit sie nicht Befriedigung verlangen können. Dieses Recht steht den Gläubigern jedoch nur zu, wenn sie glaubhaft machen, dass durch die Ausgliederung die Erfüllung der Forderung gefährdet wird."
    },
    {
      "date": "2025-12-11",
      "id": "139807",
      "original_text": "Einreichung neuer Dokumente\nRheinland-Pfalz Amtsgericht Koblenz HRB 20734\nSCHOTTEL GmbH – Spay",
      "type": "Einreichung neuer Dokumente",
      "state": "Rheinland-Pfalz",
      "amtsgericht": "Amtsgericht Koblenz",
      "registernummer": "HRB 20734",
      "registerart": "HRB",
      "company_name": "SCHOTTEL GmbH",
      "company_seat": "Spay",
      "details": "11.12.2025 (Bekanntmachungsdatum)\n\nRheinland-Pfalz Amtsgericht Koblenz HRB 20734\nEinreichung neuer Dokumente\n\nSCHOTTEL GmbH\nGesellschaft mit beschränkter Haftung\nSpay\n\nDem Registergericht ist eine Liste der Mitglieder des Aufsichtsrates eingereicht worden."
    },
    {
      "date": "2025-12-11",
      "id": "139808",
      "original_text": "Registerbekanntmachung nach dem Umwandlungsgesetz\nRheinland-Pfalz Amtsgericht Koblenz HRA 23314\nBestattungen Pfaffinger e.K. – Mendig",
      "type": "Registerbekanntmachung nach dem Umwandlungsgesetz",
      "state": "Rheinland-Pfalz",
      "amtsgericht": "Amtsgericht Koblenz",
      "registernummer": "HRA 23314",
      "registerart": "HRA",
      "company_name": "Bestattungen Pfaffinger e.K.",
      "company_seat": "Mendig",
      "details": "11.12.2025 (Bekanntmachungsdatum)\n\nRheinland-Pfalz Amtsgericht Koblenz HRA 23314\nRegisterbekanntmachung nach dem Umwandlungsgesetz 10.12.2025 (Eintragungsdatum)\n\nBestattungen Pfaffinger e.K.\nEinzelkaufmann / Einzelkauffrau\nMendig\n\nAls nicht eingetragen wird veröffentlicht: Den Gläubigern der an der Ausgliederung beteiligten Rechtsträger ist, wenn sie binnen sechs Monaten nac hdem Tag, an dem die Eintragung der Ausgliederung in das Register des Sitzes desjenigen Rechtsträgers,dessen Gläubiger sie sind, nach § 19 Abs. 3 UmwG als bekannt gemacht gilt, ihren Anspruch nach Grund und Höhe schriftlich anmelden, Sicherheit zu leisten, soweit sie nicht Befriedigung verlangen können. Dieses Recht steht den Gläubigern jedoch nur zu, wenn sie glaubhaft machen, dass durch die Ausgliederung die Erfüllung der Forderung gefährdet wird."
    },
    {
      "date": "2025-12-11",
      "id": "139809",
      "original_text": "Registerbekanntmachung nach dem Umwandlungsgesetz\nRheinland-Pfalz Amtsgericht Koblenz HRB 31547\nPKV Experten GmbH – Kaisersesch",
      "type": "Registerbekanntmachung nach dem Umwandlungsgesetz",
      "state": "Rheinland-Pfalz",
      "amtsgericht": "Amtsgericht Koblenz",
      "registernummer": "HRB 31547",
      "registerart": "HRB",
      "company_name": "PKV Experten GmbH",
      "company_seat": "Kaisersesch",
      "details": "11.12.2025 (Bekanntmachungsdatum)\n\nRheinland-Pfalz Amtsgericht Koblenz HRB 31547\nRegisterbekanntmachung nach dem Umwandlungsgesetz 11.12.2025 (Eintragungsdatum)\n\nPKV Experten GmbH\nGesellschaft mit beschränkter Haftung\nKaisersesch\n\nAls nicht eingetragen wird veröffentlicht:\nDen Gläubigern des formwechselnden Rechtsträgers ist, wenn sie binnen sechs Monaten nach dem Tag, an dem die Eintragung des Formwechsels nach § 201 UmwG als bekannt gemacht gilt, ihren Anspruch nach Grund und Höhe schriftlich anmelden, Sicherheit zu leisten, soweit sie nicht Befriedigung verlangen können. Dieses Recht steht den Gläubigern jedoch nur zu, wenn sie glaubhaft machen, dass durch den Formwechsel die Erfüllung der Forderung gefährdet wird."
    },
    {
      "date": "2025-12-11",
      "id": "139810",
      "original_text": "Registerbekanntmachung nach dem Umwandlungsgesetz\nRheinland-Pfalz Amtsgericht Montabaur HRB 7221\nTBN Transportbeton Verwaltungs GmbH – Nentershausen",
      "type": "Registerbekanntmachung nach dem Umwandlungsgesetz",
      "state": "Rheinland-Pfalz",
      "amtsgericht": "Amtsgericht Montabaur",
      "registernummer": "HRB 7221",
      "registerart": "HRB",
      "company_name": "TBN Transportbeton Verwaltungs GmbH",
      "company_seat": "Nentershausen",
      "details": "11.12.2025 (Bekanntmachungsdatum)\n\nRheinland-Pfalz Amtsgericht Montabaur HRB 7221\nRegisterbekanntmachung nach dem Umwandlungsgesetz 10.12.2025 (Eintragungsdatum)\n\nTBN Transportbeton Verwaltungs GmbH\nGesellschaft mit beschränkter Haftung\nNentershausen\n\nAls nicht eingetragen wird veröffentlicht: Den Gläubigern der an der Verschmelzung beteiligten Rechtsträger ist, wenn sie binnen sechs Monaten nach dem Tag, an dem die Eintragung der Verschmelzung in das Register des Sitzes desjenigen Rechtsträgers, dessen Gläubiger sie sind, nach § 19 Abs. 3 UmwG als bekannt gemacht gilt, ihren Anspruch nach Grund und Höhe schriftlich anmelden, Sicherheit zu leisten, soweit sie nicht Befriedigung verlangen können. Dieses Recht steht den Gläubigern jedoch nur zu, wenn sie glaubhaft machen, dass durch die Verschmelzung die Erfüllung der Forderung gefährdet wird."
    },
    {
      "date": "2025-12-11",
      "id": "139811",
      "original_text": "Einreichung neuer Dokumente\nRheinland-Pfalz Amtsgericht Kaiserslautern HRB 32517\nAVCM Capricorn Real Estate GmbH & Co. KGaA – Weilerbach",
      "type": "Einreichung neuer Dokumente",
      "state": "Rheinland-Pfalz",
      "amtsgericht": "Amtsgericht Kaiserslautern",
      "registernummer": "HRB 32517",
      "registerart": "HRB",
      "company_name": "AVCM Capricorn Real Estate GmbH & Co. KGaA",
      "company_seat": "Weilerbach",
      "details": "11.12.2025 (Bekanntmachungsdatum)\n\nRheinland-Pfalz Amtsgericht Kaiserslautern HRB 32517\nEinreichung neuer Dokumente 11.12.2025 (Eintragungsdatum)\n\nAVCM Capricorn Real Estate GmbH & Co. KGaA\nKommanditgesellschaft auf Aktien\nWeilerbach\n\nDem Registergericht ist eine neue Liste der Mitglieder des Aufsichtsrates eingereicht worden."
    },
    {
      "date": "2025-12-11",
      "id": "139812",
      "original_text": "Löschungsankündigung\nNordrhein-Westfalen Amtsgericht Duisburg HRB 12022\nDach + Fassade-Krause Gesellschaft mit beschränkter Haftung – Oberhausen",
      "type": "Löschungsankündigung",
      "state": "Nordrhein-Westfalen",
      "amtsgericht": "Amtsgericht Duisburg",
      "registernummer": "HRB 12022",
      "registerart": "HRB",
      "company_name": "Dach + Fassade-Krause Gesellschaft mit beschränkter Haftung",
      "company_seat": "Oberhausen",
      "details": "11.12.2025 (Bekanntmachungsdatum)\n\nNordrhein-Westfalen Amtsgericht Duisburg HRB 12022\nLöschungsankündigung\n\nDach + Fassade-Krause Gesellschaft mit beschränkter Haftung\nGesellschaft mit beschränkter Haftung\nOberhausen\n\nDas Registergericht beabsichtigt, die im Handelsregister unter HRB 12022  eingetragene Gesellschaft Dach + Fassade-Krause Gesellschaft mit beschränkter Haftung  gemäß § 394 FamFG wegen Vermögenslosigkeit von Amts wegen zu löschen. Gegen diese Verfügung kann Widerspruch eingelegt werden. Die Frist zur Erhebung eines Widerspruchs gegen die beabsichtigte Löschung von Amts wegen ist auf drei Monate festgesetzt. Rechtsbehelfsbelehrung Der Widerspruch ist bei dem Amtsgericht Duisburg, Kardinal-Galen-Str. 124-132, 47058 Duisburg schriftlich in deutscher Sprache oder zur Niederschrift der Geschäftsstelle einzulegen. Der Widerspruch kann auch zur Niederschrift der Geschäftsstelle eines jeden Amtsgerichtes abgegeben werden. Die Einlegung ist auch durch Übertragung eines elektronischen Dokuments an die elektronische Poststelle des Gerichts möglich. Das elektronische Dokument muss für die Bearbeitung durch das Gericht geeignet und mit einer qualifizierten elektronischen Signatur der verantwortenden Person versehen sein oder von der verantwortenden Person signiert und auf einem sicheren Übermittlungsweg gemäß § 130 a ZPO nach näherer Maßgabe der Verordnung über die technischen Rahmenbedingungen des elektronischen Rechtsverkehrs und über das besondere elektronische Behördenpostfach (BGBl. I, S. 3803) eingereicht werden. Weitere Informationen erhalten Sie auf der Internetseite www.justiz.de <http://www.justiz.de>. Der Widerspruch muss spätestens innerhalb der gesetzten Frist bei dem Amtsgericht Duisburg eingegangen sein. Dies gilt auch dann, wenn der Widerspruch zur Niederschrift der Geschäftsstelle eines anderen Amtsgerichtes abgegeben wurde. Die Frist beginnt mit der Veröffentlichung. Fällt das Ende der Frist auf einen Sonntag, einen allgemeinen Feiertag oder Sonnabend, so endet die Frist mit Ablauf des nächsten Werktages. Der Widerspruch muss die Bezeichnung der angefochtenen Verfügung sowie die Erklärung enthalten, dass Widerspruch gegen diese Verfügung eingelegt wird. Er ist zu unterzeichnen und soll begründet werden."
    },
    {
      "date": "2025-12-11",
      "id": "139813",
      "original_text": "Löschungsankündigung\nNordrhein-Westfalen Amtsgericht Wuppertal HRB 30875\nChari's Getränkehandel GmbH – Wuppertal",
      "type": "Löschungsankündigung",
      "state": "Nordrhein-Westfalen",
      "amtsgericht": "Amtsgericht Wuppertal",
      "registernummer": "HRB 30875",
      "registerart": "HRB",
      "company_name": "Chari's Getränkehandel GmbH",
      "company_seat": "Wuppertal",
      "details": "11.12.2025 (Bekanntmachungsdatum)\n\nNordrhein-Westfalen Amtsgericht Wuppertal HRB 30875\nLöschungsankündigung\n\nChari's Getränkehandel GmbH\nGesellschaft mit beschränkter Haftung\nWuppertal\n\nDas Registergericht beabsichtigt die Gesellschaft von Amts wegen nach § 394 FamFG zu löschen. Die Frist zur Erhebung eines Widerspruchs ist auf einen Monat festgesetzt."
    },
    {
      "date": "2025-12-11",
      "id": "139814",
      "original_text": "Löschungsankündigung\nNordrhein-Westfalen Amtsgericht Neuss HRB 17947\nCALIA GmbH – Neuss",
      "type": "Löschungsankündigung",
      "state": "Nordrhein-Westfalen",
      "amtsgericht": "Amtsgericht Neuss",
      "registernummer": "HRB 17947",
      "registerart": "HRB",
      "company_name": "CALIA GmbH",
      "company_seat": "Neuss",
      "details": "11.12.2025 (Bekanntmachungsdatum)\n\nNordrhein-Westfalen Amtsgericht Neuss HRB 17947\nLöschungsankündigung 11.12.2025 (Eintragungsdatum)\n\nCALIA GmbH\nGesellschaft mit beschränkter Haftung\nNeuss\n\nEs ist beabsichtigt, die Gesellschaft wegen Vermögenslosigkeit aufgrund des § 394 Abs. 1 FamFG zu löschen. Frist zur Geltendmachung eines Widerspruchs: 1 Monat.\n\nRechtsbehelfsbelehrung:\nGegen diese Verfügung können Sie Widerspruch einlegen.\nDer Widerspruch ist bei dem Amtsgericht Neuss - Registergericht -, Breite Str. 48, 41460 Neuss schriftlich in deutscher Sprache oder zur Niederschrift der Geschäftsstelle einzulegen.\nDer Widerspruch kann auch zur Niederschrift der Geschäftsstelle eines jeden Amtsgerichtes abgegeben werden.\nDie Einlegung ist auch durch Übertragung eines elektronischen Dokuments an die elektronische Poststelle des Gerichts möglich. Das elektronische Dokument muss für die Bearbeitung durch das Gericht geeignet und mit einer qualifizierten elektronischen Signatur der verantwortenden Person versehen sein oder von der verantwortenden Person signiert und auf einem sicheren Übermittlungsweg gemäß § 130a ZPO nach näherer Maßgabe der Verordnung über die technischen Rahmenbedingungen des elektronischen Rechtsverkehrs und über das besondere elektronische Behördenpostfach (BGBl. I, S.3803) eingereicht werden. Weitere Informationen erhalten Sie auf der Internetseite www.justiz.de.\nDer Widerspruch muss spätestens innerhalb der gesetzten Frist nach der schriftlichen Bekanntgabe der Verfügung bei dem Amtsgericht - Registergericht - Neuss eingegangen sein. Dies gilt auch dann, wenn der Widerspruch zur Niederschrift der Geschäftsstelle eines anderen Amtsgerichtes abgegeben wurde. Die Frist beginnt mit der schriftlichen Bekanntgabe der Verfügung. Die Bekanntgabe ist entweder durch Zustellung oder am dritten Tage nach Aufgabe zur Post bewirkt. Fällt das Ende der Frist auf einen Sonntag, einen allgemeinen Feiertag oder Sonnabend, so endet die Frist mit Ablauf des nächsten Werktages.\n\nDer Widerspruch muss die Bezeichnung der angefochtenen Verfügung sowie die Erklärung enthalten, dass Widerspruch gegen diese Verfügung eingelegt wird. Er ist zu unterzeichnen und soll begründet werden."
    },
    {
      "date": "2025-12-11",
      "id": "139815",
      "original_text": "Einreichung neuer Dokumente\nNordrhein-Westfalen Amtsgericht Dortmund HRB 20214\nADLER Versicherung AG – Dortmund",
      "type": "Einreichung neuer Dokumente",
      "state": "Nordrhein-Westfalen",
      "amtsgericht": "Amtsgericht Dortmund",
      "registernummer": "HRB 20214",
      "registerart": "HRB",
      "company_name": "ADLER Versicherung AG",
      "company_seat": "Dortmund",
      "details": "11.12.2025 (Bekanntmachungsdatum)\n\nNordrhein-Westfalen Amtsgericht Dortmund HRB 20214\nEinreichung neuer Dokumente 11.12.2025 (Eintragungsdatum)\n\nADLER Versicherung AG\nAktiengesellschaft\nDortmund\n\nDem Registergericht ist eine neue Liste der Mitglieder des Aufsichtsrates eingereicht worden."
    },
    {
      "date": "2025-12-11",
      "id": "139816",
      "original_text": "Registerbekanntmachung nach dem Umwandlungsgesetz\nNordrhein-Westfalen Amtsgericht Dortmund HRB 37866\nForstify Digital GmbH – Dortmund",
      "type": "Registerbekanntmachung nach dem Umwandlungsgesetz",
      "state": "Nordrhein-Westfalen",
      "amtsgericht": "Amtsgericht Dortmund",
      "registernummer": "HRB 37866",
      "registerart": "HRB",
      "company_name": "Forstify Digital GmbH",
      "company_seat": "Dortmund",
      "details": "11.12.2025 (Bekanntmachungsdatum)\n\nNordrhein-Westfalen Amtsgericht Dortmund HRB 37866\nRegisterbekanntmachung nach dem Umwandlungsgesetz 11.12.2025 (Eintragungsdatum)\n\nForstify Digital GmbH\nGesellschaft mit beschränkter Haftung\nDortmund\n\nDen Gläubigern der an der Abspaltung beteiligten Rechtsträger ist, wenn sie binnen sechs Monaten nach dem Tag, an dem die Eintragung der Abspaltung in das Register des Sitzes desjenigen Rechtsträgers, dessen Gläubiger sie sind, nach § 19 Absatz 3 UmwG als bekanntgemacht gilt, ihren Anspruch nach Grund und Höhe schriftlich anmelden, Sicherheit zu leisten, soweit sie nicht Befriedigung verlangen können. Dieses Recht steht den Gläubigern jedoch nur zu, wenn sie glaubhaft machen, dass durch die Abspaltung die Erfüllung ihrer Forderung gefährdet wird."
    },
    {
      "date": "2025-12-11",
      "id": "139817",
      "original_text": "Löschungsankündigung\nNordrhein-Westfalen Amtsgericht Gütersloh HRB 9509\nGuido Berger Verwaltungs GmbH – Rheda-Wiedenbrück",
      "type": "Löschungsankündigung",
      "state": "Nordrhein-Westfalen",
      "amtsgericht": "Amtsgericht Gütersloh",
      "registernummer": "HRB 9509",
      "registerart": "HRB",
      "company_name": "Guido Berger Verwaltungs GmbH",
      "company_seat": "Rheda-Wiedenbrück",
      "details": "11.12.2025 (Bekanntmachungsdatum)\n\nNordrhein-Westfalen Amtsgericht Gütersloh HRB 9509\nLöschungsankündigung 11.12.2025 (Eintragungsdatum)\n\nGuido Berger Verwaltungs GmbH\nGesellschaft mit beschränkter Haftung\nRheda-Wiedenbrück\n\nDas Registergericht beabsichtigt die Gesellschaft von Amts wegen nach § 394 FamFG zu löschen. Die Frist zur Erhebung eines Widerspruchs ist auf einen Monat festgesetzt."
    },
    {
      "date": "2025-12-11",
      "id": "139818",
      "original_text": "Löschungsankündigung\nNordrhein-Westfalen Amtsgericht Kleve HRB 17816\nNT Transporte GmbH – Kamp-Lintfort",
      "type": "Löschungsankündigung",
      "state": "Nordrhein-Westfalen",
      "amtsgericht": "Amtsgericht Kleve",
      "registernummer": "HRB 17816",
      "registerart": "HRB",
      "company_name": "NT Transporte GmbH",
      "company_seat": "Kamp-Lintfort",
      "details": "11.12.2025 (Bekanntmachungsdatum)\n\nNordrhein-Westfalen Amtsgericht Kleve HRB 17816\nLöschungsankündigung\n\nNT Transporte GmbH\nGesellschaft mit beschränkter Haftung\nKamp-Lintfort\n\nDas Registergericht beabsichtigt die Gesellschaft von Amts wegen nach § 394 FamFG zu löschen. Die Frist zur Erhebung eines Widerspruchs ist auf einen Monat festgesetzt."
    },
    {
      "date": "2025-12-11",
      "id": "139819",
      "original_text": "Löschungsankündigung\nNordrhein-Westfalen Amtsgericht Essen HRB 35912\nCarRepair GH GmbH – Essen",
      "type": "Löschungsankündigung",
      "state": "Nordrhein-Westfalen",
      "amtsgericht": "Amtsgericht Essen",
      "registernummer": "HRB 35912",
      "registerart": "HRB",
      "company_name": "CarRepair GH GmbH",
      "company_seat": "Essen",
      "details": "11.12.2025 (Bekanntmachungsdatum)\n\nNordrhein-Westfalen Amtsgericht Essen HRB 35912\nLöschungsankündigung\n\nCarRepair GH GmbH\nGesellschaft mit beschränkter Haftung\nEssen\n\nDas Registergericht beabsichtigt die Gesellschaft von Amts wegen nach § 394 FamFG zu löschen. Die Frist zur Erhebung eines Widerspruchs ist auf einen Monat festgesetzt."
    },
    {
      "date": "2025-12-11",
      "id": "139820",
      "original_text": "Registerbekanntmachung nach dem Umwandlungsgesetz\nNordrhein-Westfalen Amtsgericht Düsseldorf HRB 22930\nEssenceMediacom Germany GmbH – Düsseldorf",
      "type": "Registerbekanntmachung nach dem Umwandlungsgesetz",
      "state": "Nordrhein-Westfalen",
      "amtsgericht": "Amtsgericht Düsseldorf",
      "registernummer": "HRB 22930",
      "registerart": "HRB",
      "company_name": "EssenceMediacom Germany GmbH",
      "company_seat": "Düsseldorf",
      "details": "11.12.2025 (Bekanntmachungsdatum)\n\nNordrhein-Westfalen Amtsgericht Düsseldorf HRB 22930\nRegisterbekanntmachung nach dem Umwandlungsgesetz 11.12.2025 (Eintragungsdatum)\n\nEssenceMediacom Germany GmbH\nGesellschaft mit beschränkter Haftung\nDüsseldorf\n\nDen Gläubigern der an der Verschmelzung beteiligten Rechtsträger ist, wenn sie binnen sechs Monaten nach dem Tag, an dem die Eintragung der Verschmelzung in das Register des Sitzes desjenigen Rechtsträgers, dessen Gläubiger sie sind, nach § 19 Absatz 3 UmwG als bekanntgemacht gilt, ihren Anspruch nach Grund und Höhe schriftlich anmelden, Sicherheit zu leisten, soweit sie nicht Befriedigung verlangen können. Dieses Recht steht den Gläubigern jedoch nur zu, wenn sie glaubhaft machen, dass durch die Verschmelzung die Erfüllung ihrer Forderung gefährdet wird."
    },
    {
      "date": "2025-12-11",
      "id": "139821",
      "original_text": "Löschungsankündigung\nNordrhein-Westfalen Amtsgericht Düsseldorf HRB 97050\nseo.care UG (haftungsbeschränkt) – Düsseldorf",
      "type": "Löschungsankündigung",
      "state": "Nordrhein-Westfalen",
      "amtsgericht": "Amtsgericht Düsseldorf",
      "registernummer": "HRB 97050",
      "registerart": "HRB",
      "company_name": "seo.care UG (haftungsbeschränkt)",
      "company_seat": "Düsseldorf",
      "details": "11.12.2025 (Bekanntmachungsdatum)\n\nNordrhein-Westfalen Amtsgericht Düsseldorf HRB 97050\nLöschungsankündigung\n\nseo.care UG (haftungsbeschränkt)\nGesellschaft mit beschränkter Haftung\nDüsseldorf\n\nDas Registergericht beabsichtigt die Gesellschaft von Amts wegen nach § 394 Abs. 1 FamFG zu löschen. Die Frist zur Erhebung eines Widerspruchs ist auf 3 Wochen festgesetzt.\n\nRechtsbehelfsbelehrung:\nDas Widerspruchsrecht steht jedem zu, der an der Unterlassung der Löschung ein berechtigtes Interesse hat. Der Widerspruch ist bei dem Amtsgericht Düsseldorf -Registergericht-, Werdener Straße 1, 40227 Düsseldorf schriftlich in deutscher Sprache oder zur Niederschrift der Geschäftsstelle einzulegen. Der Widerspruch kann auch zur Niederschrift der Geschäftsstelle eines jeden Amtsgerichtes abgegeben werden. Die Einlegung ist auch durch Übertragung eines elektronischen Dokuments an die elektronische Poststelle des Gerichts möglich. Das elektronische Dokument muss für die Bearbeitung durch das Gericht geeignet und mit einer qualifizierten elektronischen Signatur der verantwortenden Person versehen sein oder von der verantwortenden Person signiert und auf einem sicheren Übermittlungsweg gemäß § 130a ZPO nach näherer Maßgabe der Verordnung über die technischen Rahmenbedingungen des elektronischen Rechtsverkehrs und über das besondere elektronische Behördenpostfach (BGBl. I, S.3803) eingereicht werden. Weitere Informationen erhalten Sie auf der Internetseite www.justiz.de.\nDer Widerspruch muss spätestens innerhalb der gesetzten Frist nach dem Datum der Bekanntmachung der Löschungsankündigung bei dem Amtsgericht - Registergericht - Düsseldorf eingegangen sein.  Dies gilt auch dann, wenn der Widerspruch zur Niederschrift der Geschäftsstelle eines anderen Amtsgerichtes abgegeben wurde. Die Frist beginnt mit dem Tage der Bekanntmachung der Löschungsankündigung in dem für die Bekanntmachung der Eintragungen in das Handelsregister bestimmten elektronischen Informations- und Kommunikationssystem nach § 10 des Handelsgesetzbuches. Fällt das Ende der Frist auf einen Sonntag, einen allgemeinen Feiertag oder Sonnabend, so endet die Frist mit Ablauf des nächsten Werktages.\nDer Widerspruch muss die Bezeichnung der angefochtenen Löschungsankündigung sowie die Erklärung enthalten, dass Widerspruch gegen diese Löschungsankündigung eingelegt wird. Er ist zu unterzeichnen und soll begründet werden."
    },
    {
      "date": "2025-12-11",
      "id": "139822",
      "original_text": "Einreichung neuer Dokumente\nNordrhein-Westfalen Amtsgericht Bochum HRB 8867 früher Amtsgericht Witten\nSiedlungsgesellschaft Witten mit beschränkter Haftung – Witten",
      "type": "Einreichung neuer Dokumente",
      "state": "Nordrhein-Westfalen",
      "amtsgericht": "Amtsgericht Bochum",
      "registernummer": "HRB 8867",
      "registerart": "HRB",
      "company_name": "Siedlungsgesellschaft Witten mit beschränkter Haftung",
      "company_seat": "Witten",
      "former_amtsgericht": "Witten",
      "details": "11.12.2025 (Bekanntmachungsdatum)\n\nNordrhein-Westfalen Amtsgericht Bochum HRB 8867 früher Amtsgericht Witten\nEinreichung neuer Dokumente 10.12.2025 (Eintragungsdatum)\n\nSiedlungsgesellschaft Witten mit beschränkter Haftung\nGesellschaft mit beschränkter Haftung\nWitten\n\nDem Registergericht ist eine Liste der Mitglieder des Aufsichtsrates eingereicht worden."
    },
    {
      "date": "2025-12-11",
      "id": "139823",
      "original_text": "Registerbekanntmachung nach dem Umwandlungsgesetz\nHessen Amtsgericht Hanau HRB 13302\nQualityHosting Aktiengesellschaft – Gelnhausen",
      "type": "Registerbekanntmachung nach dem Umwandlungsgesetz",
      "state": "Hessen",
      "amtsgericht": "Amtsgericht Hanau",
      "registernummer": "HRB 13302",
      "registerart": "HRB",
      "company_name": "QualityHosting Aktiengesellschaft",
      "company_seat": "Gelnhausen",
      "details": "11.12.2025 (Bekanntmachungsdatum)\n\nHessen Amtsgericht Hanau HRB 13302\nRegisterbekanntmachung nach dem Umwandlungsgesetz 11.12.2025 (Eintragungsdatum)\n\nQualityHosting Aktiengesellschaft\nAktiengesellschaft\nGelnhausen\n\nDen Gläubigern der an der formwechselnden Umwandlung beteiligten Rechtsträger ist, wenn sie binnen sechs Monaten nach dem Tag, an dem die Eintragung der formwechselnden Umwandlung in das Register des Sitzes desjenigen Rechtsträgers, dessen Gläubiger sie sind, nach § 201 UmwG bekannt gemacht worden ist, ihren Anspruch nach Grund und Höhe schriftlich anmelden, Sicherheit zu leisten, soweit sie nicht Befriedigung verlangen können. Dieses Recht steht den Gläubigern jedoch nur zu, wenn sie glaubhaft machen, dass durch die formwechselnden Umwandlung die Erfüllung ihrer Forderung gefährdet wird."
    },
    {
      "date": "2025-12-11",
      "id": "139824",
      "original_text": "Registerbekanntmachung nach dem Umwandlungsgesetz\nHessen Amtsgericht Hanau HRB 100878\nQualityHosting GmbH – Gelnhausen",
      "type": "Registerbekanntmachung nach dem Umwandlungsgesetz",
      "state": "Hessen",
      "amtsgericht": "Amtsgericht Hanau",
      "registernummer": "HRB 100878",
      "registerart": "HRB",
      "company_name": "QualityHosting GmbH",
      "company_seat": "Gelnhausen",
      "details": "11.12.2025 (Bekanntmachungsdatum)\n\nHessen Amtsgericht Hanau HRB 100878\nRegisterbekanntmachung nach dem Umwandlungsgesetz 11.12.2025 (Eintragungsdatum)\n\nQualityHosting GmbH\nGesellschaft mit beschränkter Haftung\nGelnhausen\n\nDen Gläubigern der an der formwechselnden Umwandlung beteiligten Rechtsträger ist, wenn sie binnen sechs Monaten nach dem Tag, an dem die Eintragung der formwechselnden Umwandlung in das Register des Sitzes desjenigen Rechtsträgers, dessen Gläubiger sie sind, nach § 201 UmwG bekannt gemacht worden ist, ihren Anspruch nach Grund und Höhe schriftlich anmelden, Sicherheit zu leisten, soweit sie nicht Befriedigung verlangen können. Dieses Recht steht den Gläubigern jedoch nur zu, wenn sie glaubhaft machen, dass durch die formwechselnden Umwandlung die Erfüllung ihrer Forderung gefährdet wird."
    },
    {
      "date": "2025-12-11",
      "id": "139825",
      "original_text": "Löschungsankündigung\nHessen Amtsgericht Frankfurt am Main HRB 134853\nPrimeLink International GmbH – Frankfurt am Main",
      "type": "Löschungsankündigung",
      "state": "Hessen",
      "amtsgericht": "Amtsgericht Frankfurt am Main",
      "registernummer": "HRB 134853",
      "registerart": "HRB",
      "company_name": "PrimeLink International GmbH",
      "company_seat": "Frankfurt am Main",
      "details": "11.12.2025 (Bekanntmachungsdatum)\n\nHessen Amtsgericht Frankfurt am Main HRB 134853\nLöschungsankündigung\n\nPrimeLink International GmbH\nGesellschaft mit beschränkter Haftung\nFrankfurt am Main\n\nEs ist beabsichtigt, die Gesellschaft wegen Vermögenslosigkeit gemäß § 394 FamFG von Amts wegen im Handelsregister zu löschen. Hiergegen kann innerhalb eines Monats nach dieser Veröffentlichung Widerspruch bei dem Amtsgericht Frankfurt am Main eingelegt werden."
    },
    {
      "date": "2025-12-11",
      "id": "139826",
      "original_text": "Sonstige Registerbekanntmachung\nHessen Amtsgericht Wetzlar VR 4244\nApfelstübchen e.V. – Beilstein",
      "type": "Sonstige Registerbekanntmachung",
      "state": "Hessen",
      "amtsgericht": "Amtsgericht Wetzlar",
      "registernummer": "VR 4244",
      "registerart": "VR",
      "company_name": "Apfelstübchen e.V.",
      "company_seat": "Beilstein",
      "details": "11.12.2025 (Bekanntmachungsdatum)\n\nHessen Amtsgericht Wetzlar VR 4244\nSonstige Registerbekanntmachung 11.12.2025 (Eintragungsdatum)\n\nApfelstübchen e.V.\neingetragener Verein\nBeilstein\n\nDer Verein ist aufgelöst."
    },
    {
      "date": "2025-12-11",
      "id": "139827",
      "original_text": "Registerbekanntmachung nach dem Umwandlungsgesetz\nHessen Amtsgericht Frankfurt am Main HRB 141126\nPhotovoltaik-Solarpark Merenberg-Allendorf GmbH – Frankfurt am Main",
      "type": "Registerbekanntmachung nach dem Umwandlungsgesetz",
      "state": "Hessen",
      "amtsgericht": "Amtsgericht Frankfurt am Main",
      "registernummer": "HRB 141126",
      "registerart": "HRB",
      "company_name": "Photovoltaik-Solarpark Merenberg-Allendorf GmbH",
      "company_seat": "Frankfurt am Main",
      "details": "11.12.2025 (Bekanntmachungsdatum)\n\nHessen Amtsgericht Frankfurt am Main HRB 141126\nRegisterbekanntmachung nach dem Umwandlungsgesetz 11.12.2025 (Eintragungsdatum)\n\nPhotovoltaik-Solarpark Merenberg-Allendorf GmbH\nGesellschaft mit beschränkter Haftung\nFrankfurt am Main\n\nDen Gläubigern der an der formwechselnden Umwandlung beteiligten Rechtsträger ist, wenn sie binnen sechs Monaten nach dem Tag, an dem die Eintragung der formwechselnden Umwandlung in das Register des Sitzes desjenigen Rechtsträgers, dessen Gläubiger sie sind, nach § 201 UmwG bekannt gemacht worden ist, ihren Anspruch nach Grund und Höhe schriftlich anmelden, Sicherheit zu leisten, soweit sie nicht Befriedigung verlangen können. Dieses Recht steht den Gläubigern jedoch nur zu, wenn sie glaubhaft machen, dass durch die formwechselnden Umwandlung die Erfüllung ihrer Forderung gefährdet wird."
    },
    {
      "date": "2025-12-11",
      "id": "139828",
      "original_text": "Registerbekanntmachung nach dem Umwandlungsgesetz\nHessen Amtsgericht Offenbach am Main VR 3276\nTurn- und Sportverein Dreieichenhain e.V. – Dreieich",
      "type": "Registerbekanntmachung nach dem Umwandlungsgesetz",
      "state": "Hessen",
      "amtsgericht": "Amtsgericht Offenbach am Main",
      "registernummer": "VR 3276",
      "registerart": "VR",
      "company_name": "Turn- und Sportverein Dreieichenhain e.V.",
      "company_seat": "Dreieich",
      "details": "11.12.2025 (Bekanntmachungsdatum)\n\nHessen Amtsgericht Offenbach am Main VR 3276\nRegisterbekanntmachung nach dem Umwandlungsgesetz 11.12.2025 (Eintragungsdatum)\n\nTurn- und Sportverein Dreieichenhain e.V.\neingetragener Verein\nDreieich\n\nDen Gläubigern der an der Verschmelzung beteiligten Rechtsträger ist, wenn sie binnen sechs Monaten nach dem Tag, an dem die Eintragung der Verschmelzung in das Register des Sitzes desjenigen Rechtsträgers, dessen Gläubiger sie sind, nach § 19 Absatz 3 UmwG bekannt gemacht worden ist, ihren Anspruch nach Grund und Höhe schriftlich anmelden, Sicherheit zu leisten, soweit sie nicht Befriedigung verlangen können. Dieses Recht steht den Gläubigern jedoch nur zu, wenn sie glaubhaft machen, dass durch die Verschmelzung die Erfüllung ihrer Forderung gefährdet wird."
    },
    {
      "date": "2025-12-11",
      "id": "139829",
      "original_text": "Registerbekanntmachung nach dem Umwandlungsgesetz\nHessen Amtsgericht Offenbach am Main VR 3251\nSportverein 1890 e.V. Dreieichenhain – Dreieich-Dreieichenhain",
      "type": "Registerbekanntmachung nach dem Umwandlungsgesetz",
      "state": "Hessen",
      "amtsgericht": "Amtsgericht Offenbach am Main",
      "registernummer": "VR 3251",
      "registerart": "VR",
      "company_name": "Sportverein 1890 e.V. Dreieichenhain",
      "company_seat": "Dreieich-Dreieichenhain",
      "details": "11.12.2025 (Bekanntmachungsdatum)\n\nHessen Amtsgericht Offenbach am Main VR 3251\nRegisterbekanntmachung nach dem Umwandlungsgesetz 11.12.2025 (Eintragungsdatum)\n\nSportverein 1890 e.V. Dreieichenhain\neingetragener Verein\nDreieich-Dreieichenhain\n\nDen Gläubigern der an der Verschmelzung beteiligten Rechtsträger ist, wenn sie binnen sechs Monaten nach dem Tag, an dem die Eintragung der Verschmelzung in das Register des Sitzes desjenigen Rechtsträgers, dessen Gläubiger sie sind, nach § 19 Absatz 3 UmwG bekannt gemacht worden ist, ihren Anspruch nach Grund und Höhe schriftlich anmelden, Sicherheit zu leisten, soweit sie nicht Befriedigung verlangen können. Dieses Recht steht den Gläubigern jedoch nur zu, wenn sie glaubhaft machen, dass durch die Verschmelzung die Erfüllung ihrer Forderung gefährdet wird."
    },
    {
      "date": "2025-12-11",
      "id": "139830",
      "original_text": "Löschungsankündigung\nHessen Amtsgericht Hanau HRB 97300\nSF-Solutions UG (haftungsbeschränkt) – Hanau",
      "type": "Löschungsankündigung",
      "state": "Hessen",
      "amtsgericht": "Amtsgericht Hanau",
      "registernummer": "HRB 97300",
      "registerart": "HRB",
      "company_name": "SF-Solutions UG (haftungsbeschränkt)",
      "company_seat": "Hanau",
      "details": "11.12.2025 (Bekanntmachungsdatum)\n\nHessen Amtsgericht Hanau HRB 97300\nLöschungsankündigung\n\nSF-Solutions UG (haftungsbeschränkt)\nGesellschaft mit beschränkter Haftung\nHanau\n\nDas Registergericht beabsichtigt die im Handelsregister eingetragene Gesellschaft von Amts wegen nach § 394 FamFG zu löschen. Die Frist zur Erhebung eines Widerspruchs gegen die beabsichtigte Löschung wird auf 3 Monate festgesetzt."
    },
    {
      "date": "2025-12-11",
      "id": "139831",
      "original_text": "Löschungsankündigung\nHessen Amtsgericht Frankfurt am Main HRA 12732\nHoss & Co. Buchdruckerei – Frankfurt am Main",
      "type": "Löschungsankündigung",
      "state": "Hessen",
      "amtsgericht": "Amtsgericht Frankfurt am Main",
      "registernummer": "HRA 12732",
      "registerart": "HRA",
      "company_name": "Hoss & Co. Buchdruckerei",
      "company_seat": "Frankfurt am Main",
      "details": "11.12.2025 (Bekanntmachungsdatum)\n\nHessen Amtsgericht Frankfurt am Main HRA 12732\nLöschungsankündigung\n\nHoss & Co. Buchdruckerei\nKommanditgesellschaft\nFrankfurt am Main\n\nDas Registergericht beabsichtigt die im Handelsregister eingetragene Firma von Amts wegen nach § 31 Abs. 2 HGB zu löschen. Die Frist zur Erhebung eines Widerspruchs gegen die beabsichtigte Löschung wird auf 1 Monat festgesetzt."
    },
    {
      "date": "2025-12-11",
      "id": "139832",
      "original_text": "Registerbekanntmachung nach dem Umwandlungsgesetz\nNordrhein-Westfalen Amtsgericht Wuppertal HRB 17933\nWerner Doppstadt Umwelttechnik Verwaltungsgesellschaft mbH – Velbert",
      "type": "Registerbekanntmachung nach dem Umwandlungsgesetz",
      "state": "Nordrhein-Westfalen",
      "amtsgericht": "Amtsgericht Wuppertal",
      "registernummer": "HRB 17933",
      "registerart": "HRB",
      "company_name": "Werner Doppstadt Umwelttechnik Verwaltungsgesellschaft mbH",
      "company_seat": "Velbert",
      "details": "11.12.2025 (Bekanntmachungsdatum)\n\nNordrhein-Westfalen Amtsgericht Wuppertal HRB 17933\nRegisterbekanntmachung nach dem Umwandlungsgesetz 11.12.2025 (Eintragungsdatum)\n\nWerner Doppstadt Umwelttechnik Verwaltungsgesellschaft mbH\nGesellschaft mit beschränkter Haftung\nVelbert\n\nDen Gläubigern der an der Verschmelzung beteiligten Rechtsträger ist, wenn sie binnen sechs Monaten nach dem Tag, an dem die Eintragung der Verschmelzung in das Register des Sitzes desjenigen Rechtsträgers, dessen Gläubiger sie sind, nach § 19 Absatz 3 UmwG als bekanntgemacht gilt, ihren Anspruch nach Grund und Höhe schriftlich anmelden, Sicherheit zu leisten, soweit sie nicht Befriedigung verlangen können. Dieses Recht steht den Gläubigern jedoch nur zu, wenn sie glaubhaft machen, dass durch die Verschmelzung die Erfüllung ihrer Forderung gefährdet wird."
    }
  ]
}