{
  "date": "2025-12-24",
  "date_of_scrape": "2025-12-25T04:18:06.315Z",
  "tool_version": "0.2.0",
  "number_of_announcements": 36,
  "announcements": [
    {
      "date": "2025-12-24",
      "id": "140994",
      "original_text": "Registerbekanntmachung nach dem Umwandlungsgesetz\nBayern Amtsgericht Kempten (Allgäu) HRB 17869\nNEXXOTEL Ventures GmbH – Kempten (Allgäu)",
      "type": "Registerbekanntmachung nach dem Umwandlungsgesetz",
      "state": "Bayern",
      "amtsgericht": "Amtsgericht Kempten (Allgäu)",
      "registernummer": "HRB 17869",
      "registerart": "HRB",
      "company_name": "NEXXOTEL Ventures GmbH",
      "company_seat": "Kempten (Allgäu)",
      "details": "24.12.2025 (Bekanntmachungsdatum)\n\nBayern Amtsgericht Kempten (Allgäu) HRB 17869\nRegisterbekanntmachung nach dem Umwandlungsgesetz 23.12.2025 (Eintragungsdatum)\n\nNEXXOTEL Ventures GmbH\nGesellschaft mit beschränkter Haftung\nKempten (Allgäu)\n\nDen Gläubigern der an der Verschmelzung beteiligten Rechtsträger ist, wenn sie binnen sechs Monaten nach dem Tag, an dem die Eintragung der Verschmelzung in das Register des Sitzes desjenigen Rechtsträgers, dessen Gläubiger sie sind, nach § 19 Abs. 3 UmwG als bekannt gemacht gilt, ihren Anspruch nach Grund und Höhe in Textform anmelden, Sicherheit zu leisten, soweit sie nicht Befriedigung verlangen können. Dieses Recht steht den Gläubigern jedoch nur zu, wenn sie glaubhaft machen, dass durch die Verschmelzung die Erfüllung ihrer Forderung gefährdet wird."
    },
    {
      "date": "2025-12-24",
      "id": "140995",
      "original_text": "Registerbekanntmachung nach dem Umwandlungsgesetz\nBayern Amtsgericht München HRB 233556\nSebastian Neusser UG (haftungsbeschränkt) – München",
      "type": "Registerbekanntmachung nach dem Umwandlungsgesetz",
      "state": "Bayern",
      "amtsgericht": "Amtsgericht München",
      "registernummer": "HRB 233556",
      "registerart": "HRB",
      "company_name": "Sebastian Neusser UG (haftungsbeschränkt)",
      "company_seat": "München",
      "details": "24.12.2025 (Bekanntmachungsdatum)\n\nBayern Amtsgericht München HRB 233556\nRegisterbekanntmachung nach dem Umwandlungsgesetz 23.12.2025 (Eintragungsdatum)\n\nSebastian Neusser UG (haftungsbeschränkt)\nGesellschaft mit beschränkter Haftung\nMünchen\n\nDen Gläubigern der an der Verschmelzung beteiligten Rechtsträger ist, wenn sie binnen sechs Monaten nach dem Tag, an dem die Eintragung der Verschmelzung in das Register des Sitzes desjenigen Rechtsträgers, dessen Gläubiger sie sind, nach § 19 Abs. 3 UmwG als bekannt gemacht gilt, ihren Anspruch nach Grund und Höhe in Textform anmelden, Sicherheit zu leisten, soweit sie nicht Befriedigung verlangen können. Dieses Recht steht den Gläubigern jedoch nur zu, wenn sie glaubhaft machen, dass durch die Verschmelzung die Erfüllung ihrer Forderung gefährdet wird."
    },
    {
      "date": "2025-12-24",
      "id": "140996",
      "original_text": "Einreichung neuer Dokumente\nBayern Amtsgericht München HRB 3031\nDawonia Oberbayern und Schwaben GmbH – Grünwald",
      "type": "Einreichung neuer Dokumente",
      "state": "Bayern",
      "amtsgericht": "Amtsgericht München",
      "registernummer": "HRB 3031",
      "registerart": "HRB",
      "company_name": "Dawonia Oberbayern und Schwaben GmbH",
      "company_seat": "Grünwald",
      "details": "24.12.2025 (Bekanntmachungsdatum)\n\nBayern Amtsgericht München HRB 3031\nEinreichung neuer Dokumente\n\nDawonia Oberbayern und Schwaben GmbH\nGesellschaft mit beschränkter Haftung\nGrünwald\n\nDem Amtsgericht München -Registergericht- ist eine Liste der Mitglieder des Aufsichtsrats eingereicht worden, § 52 Abs. 3 S. 2 GmbHG."
    },
    {
      "date": "2025-12-24",
      "id": "140997",
      "original_text": "Einreichung neuer Dokumente\nBayern Amtsgericht Bayreuth HRB 73\nGEWOG Wohnungsbau- und Wohnungsfürsorgegesellschaft der Stadt Bayreuth mit beschränkter Haftung – Bayreuth",
      "type": "Einreichung neuer Dokumente",
      "state": "Bayern",
      "amtsgericht": "Amtsgericht Bayreuth",
      "registernummer": "HRB 73",
      "registerart": "HRB",
      "company_name": "GEWOG Wohnungsbau- und Wohnungsfürsorgegesellschaft der Stadt Bayreuth mit beschränkter Haftung",
      "company_seat": "Bayreuth",
      "details": "24.12.2025 (Bekanntmachungsdatum)\n\nBayern Amtsgericht Bayreuth HRB 73\nEinreichung neuer Dokumente\n\nGEWOG Wohnungsbau- und Wohnungsfürsorgegesellschaft der Stadt Bayreuth mit beschränkter Haftung\nGesellschaft mit beschränkter Haftung\nBayreuth\n\nDem Amtsgericht Bayreuth -Registergericht- ist eine Liste der Mitglieder des Aufsichtsrats eingereicht worden, § 52 Abs. 3 S. 2 GmbHG."
    },
    {
      "date": "2025-12-24",
      "id": "140998",
      "original_text": "Löschungsankündigung\nBayern Amtsgericht Fürth HRB 1121\nHeizungsbau Weidler GmbH – Bad Windsheim",
      "type": "Löschungsankündigung",
      "state": "Bayern",
      "amtsgericht": "Amtsgericht Fürth",
      "registernummer": "HRB 1121",
      "registerart": "HRB",
      "company_name": "Heizungsbau Weidler GmbH",
      "company_seat": "Bad Windsheim",
      "details": "24.12.2025 (Bekanntmachungsdatum)\n\nBayern Amtsgericht Fürth HRB 1121\nLöschungsankündigung\n\nHeizungsbau Weidler GmbH\nGesellschaft mit beschränkter Haftung\nBad Windsheim\n\nDas Registergericht beabsichtigt, die im Handelsregister eingetragene Gesellschaft wegen Vermögenslosigkeit von Amts wegen nach § 394 FamFG zu löschen. Die Frist zur Erhebung eines Widerspruchs ist auf drei Monate festgesetzt."
    },
    {
      "date": "2025-12-24",
      "id": "140999",
      "original_text": "Einreichung neuer Dokumente\nBayern Amtsgericht Ingolstadt HRB 3593\nKlinikum Ingolstadt GmbH – Ingolstadt",
      "type": "Einreichung neuer Dokumente",
      "state": "Bayern",
      "amtsgericht": "Amtsgericht Ingolstadt",
      "registernummer": "HRB 3593",
      "registerart": "HRB",
      "company_name": "Klinikum Ingolstadt GmbH",
      "company_seat": "Ingolstadt",
      "details": "24.12.2025 (Bekanntmachungsdatum)\n\nBayern Amtsgericht Ingolstadt HRB 3593\nEinreichung neuer Dokumente\n\nKlinikum Ingolstadt GmbH\nGesellschaft mit beschränkter Haftung\nIngolstadt\n\nDem Amtsgericht Ingolstadt -Registergericht- ist eine Liste der Mitglieder des Aufsichtsrats eingereicht worden, § 52 Abs. 3 S. 2 GmbHG."
    },
    {
      "date": "2025-12-24",
      "id": "141000",
      "original_text": "Registerbekanntmachung nach dem Umwandlungsgesetz\nBayern Amtsgericht Ansbach HRA 2870\nHerzog Liegenschaften GmbH & Co. KG – Muhr a. See",
      "type": "Registerbekanntmachung nach dem Umwandlungsgesetz",
      "state": "Bayern",
      "amtsgericht": "Amtsgericht Ansbach",
      "registernummer": "HRA 2870",
      "registerart": "HRA",
      "company_name": "Herzog Liegenschaften GmbH & Co. KG",
      "company_seat": "Muhr a. See",
      "details": "24.12.2025 (Bekanntmachungsdatum)\n\nBayern Amtsgericht Ansbach HRA 2870\nRegisterbekanntmachung nach dem Umwandlungsgesetz 23.12.2025 (Eintragungsdatum)\n\nHerzog Liegenschaften GmbH & Co. KG\nKommanditgesellschaft\nMuhr a. See\n\nDen Gläubigern des formwechselnden Rechtsträgers ist, wenn sie binnen sechs Monaten nach dem Tag, an dem die Eintragung des Formwechsels nach § 201 UmwG als bekannt gemacht gilt, ihren Anspruch nach Grund und Höhe in Textform anmelden, Sicherheit zu leisten, soweit sie nicht Befriedigung verlangen können. Dieses Recht steht den Gläubigern jedoch nur zu, wenn sie glaubhaft machen, dass durch den Formwechsel die Erfüllung ihrer Forderung gefährdet wird."
    },
    {
      "date": "2025-12-24",
      "id": "141001",
      "original_text": "Registerbekanntmachung nach dem Umwandlungsgesetz\nBayern Amtsgericht München HRB 234984\nVALMED Capital GmbH – Gräfelfing",
      "type": "Registerbekanntmachung nach dem Umwandlungsgesetz",
      "state": "Bayern",
      "amtsgericht": "Amtsgericht München",
      "registernummer": "HRB 234984",
      "registerart": "HRB",
      "company_name": "VALMED Capital GmbH",
      "company_seat": "Gräfelfing",
      "details": "24.12.2025 (Bekanntmachungsdatum)\n\nBayern Amtsgericht München HRB 234984\nRegisterbekanntmachung nach dem Umwandlungsgesetz\n\nVALMED Capital GmbH\nGesellschaft mit beschränkter Haftung\nGräfelfing\n\nDem Amtsgericht München -Registergericht- ist ein Verschmelzungsvertrag zwischen der Gesellschaft als übernehmendem Rechtsträger und der MEDDANE AG, München (Amtsgericht München HRB 256369) zur Einsichtnahme eingereicht worden."
    },
    {
      "date": "2025-12-24",
      "id": "141002",
      "original_text": "Einreichung neuer Dokumente\nBayern Amtsgericht München HRB 297227\nGNRTION hydrogen AG – München",
      "type": "Einreichung neuer Dokumente",
      "state": "Bayern",
      "amtsgericht": "Amtsgericht München",
      "registernummer": "HRB 297227",
      "registerart": "HRB",
      "company_name": "GNRTION hydrogen AG",
      "company_seat": "München",
      "details": "24.12.2025 (Bekanntmachungsdatum)\n\nBayern Amtsgericht München HRB 297227\nEinreichung neuer Dokumente 23.12.2025 (Eintragungsdatum)\n\nGNRTION hydrogen AG\nAktiengesellschaft\nMünchen\n\nDem Amtsgericht München -Registergericht- ist eine Liste der Mitglieder des Aufsichtsrats eingereicht worden, § 106 AktG."
    },
    {
      "date": "2025-12-24",
      "id": "141003",
      "original_text": "Löschungsankündigung\nBayern Amtsgericht München HRA 69327\nBerger Invest KG – Seeshaupt",
      "type": "Löschungsankündigung",
      "state": "Bayern",
      "amtsgericht": "Amtsgericht München",
      "registernummer": "HRA 69327",
      "registerart": "HRA",
      "company_name": "Berger Invest KG",
      "company_seat": "Seeshaupt",
      "details": "24.12.2025 (Bekanntmachungsdatum)\n\nBayern Amtsgericht München HRA 69327\nLöschungsankündigung 23.12.2025 (Eintragungsdatum)\n\nBerger Invest KG\nKommanditgesellschaft\nSeeshaupt\n\nDas Registergericht beabsichtigt, die im Handelsregister eingetragene Firma von Amts wegen nach § 31 Abs. 2 HGB zu löschen. Die Frist zur Erhebung eines Widerspruchs ist auf drei Monate festgesetzt."
    },
    {
      "date": "2025-12-24",
      "id": "141004",
      "original_text": "Registerbekanntmachung nach dem Umwandlungsgesetz\nBayern Amtsgericht Deggendorf HRB 3084\nTP Shop Zwiesel GmbH – Zwiesel",
      "type": "Registerbekanntmachung nach dem Umwandlungsgesetz",
      "state": "Bayern",
      "amtsgericht": "Amtsgericht Deggendorf",
      "registernummer": "HRB 3084",
      "registerart": "HRB",
      "company_name": "TP Shop Zwiesel GmbH",
      "company_seat": "Zwiesel",
      "details": "24.12.2025 (Bekanntmachungsdatum)\n\nBayern Amtsgericht Deggendorf HRB 3084\nRegisterbekanntmachung nach dem Umwandlungsgesetz 23.12.2025 (Eintragungsdatum)\n\nTP Shop Zwiesel GmbH\nGesellschaft mit beschränkter Haftung\nZwiesel\n\nDen Gläubigern der an der Verschmelzung beteiligten Rechtsträger ist, wenn sie binnen sechs Monaten nach dem Tag, an dem die Eintragung der Verschmelzung in das Register des Sitzes desjenigen Rechtsträgers, dessen Gläubiger sie sind, nach § 19 Abs. 3 UmwG als bekannt gemacht gilt, ihren Anspruch nach Grund und Höhe in Textform anmelden, Sicherheit zu leisten, soweit sie nicht Befriedigung verlangen können. Dieses Recht steht den Gläubigern jedoch nur zu, wenn sie glaubhaft machen, dass durch die Verschmelzung die Erfüllung ihrer Forderung gefährdet wird."
    },
    {
      "date": "2025-12-24",
      "id": "141005",
      "original_text": "Einreichung neuer Dokumente\nBayern Amtsgericht Nürnberg HRB 28204\nMartha-Maria Altenhilfe gemeinnützige GmbH – Nürnberg",
      "type": "Einreichung neuer Dokumente",
      "state": "Bayern",
      "amtsgericht": "Amtsgericht Nürnberg",
      "registernummer": "HRB 28204",
      "registerart": "HRB",
      "company_name": "Martha-Maria Altenhilfe gemeinnützige GmbH",
      "company_seat": "Nürnberg",
      "details": "24.12.2025 (Bekanntmachungsdatum)\n\nBayern Amtsgericht Nürnberg HRB 28204\nEinreichung neuer Dokumente 23.12.2025 (Eintragungsdatum)\n\nMartha-Maria Altenhilfe gemeinnützige GmbH\nGesellschaft mit beschränkter Haftung\nNürnberg\n\nDem Amtsgericht Nürnberg -Registergericht- ist eine Liste der Mitglieder des Aufsichtsrats eingereicht worden, § 52 Abs. 3 S. 2 GmbHG."
    },
    {
      "date": "2025-12-24",
      "id": "141006",
      "original_text": "Einreichung neuer Dokumente\nBayern Amtsgericht München HRB 285565\nWTS Tax AG – München",
      "type": "Einreichung neuer Dokumente",
      "state": "Bayern",
      "amtsgericht": "Amtsgericht München",
      "registernummer": "HRB 285565",
      "registerart": "HRB",
      "company_name": "WTS Tax AG",
      "company_seat": "München",
      "details": "24.12.2025 (Bekanntmachungsdatum)\n\nBayern Amtsgericht München HRB 285565\nEinreichung neuer Dokumente\n\nWTS Tax AG\nAktiengesellschaft\nMünchen\n\nDem Amtsgericht München -Registergericht- ist eine Liste der Mitglieder des Aufsichtsrats eingereicht worden, § 106 AktG."
    },
    {
      "date": "2025-12-24",
      "id": "141007",
      "original_text": "Registerbekanntmachung nach dem Umwandlungsgesetz\nBayern Amtsgericht Fürth HRB 15460\nSaLiLe Verwaltungs-GmbH – Fürth",
      "type": "Registerbekanntmachung nach dem Umwandlungsgesetz",
      "state": "Bayern",
      "amtsgericht": "Amtsgericht Fürth",
      "registernummer": "HRB 15460",
      "registerart": "HRB",
      "company_name": "SaLiLe Verwaltungs-GmbH",
      "company_seat": "Fürth",
      "details": "24.12.2025 (Bekanntmachungsdatum)\n\nBayern Amtsgericht Fürth HRB 15460\nRegisterbekanntmachung nach dem Umwandlungsgesetz 23.12.2025 (Eintragungsdatum)\n\nSaLiLe Verwaltungs-GmbH\nGesellschaft mit beschränkter Haftung\nFürth\n\nDen Gläubigern des formwechselnden Rechtsträgers ist, wenn sie binnen sechs Monaten nach dem Tag, an dem die Eintragung des Formwechsels nach § 201 UmwG als bekannt gemacht gilt, ihren Anspruch nach Grund und Höhe in Textform anmelden, Sicherheit zu leisten, soweit sie nicht Befriedigung verlangen können. Dieses Recht steht den Gläubigern jedoch nur zu, wenn sie glaubhaft machen, dass durch den Formwechsel die Erfüllung ihrer Forderung gefährdet wird."
    },
    {
      "date": "2025-12-24",
      "id": "141008",
      "original_text": "Registerbekanntmachung nach dem Umwandlungsgesetz\nBayern Amtsgericht München HRB 205336\nGoodyields Capital GmbH – München",
      "type": "Registerbekanntmachung nach dem Umwandlungsgesetz",
      "state": "Bayern",
      "amtsgericht": "Amtsgericht München",
      "registernummer": "HRB 205336",
      "registerart": "HRB",
      "company_name": "Goodyields Capital GmbH",
      "company_seat": "München",
      "details": "24.12.2025 (Bekanntmachungsdatum)\n\nBayern Amtsgericht München HRB 205336\nRegisterbekanntmachung nach dem Umwandlungsgesetz 23.12.2025 (Eintragungsdatum)\n\nGoodyields Capital GmbH\nGesellschaft mit beschränkter Haftung\nMünchen\n\nDen Gläubigern der an der Verschmelzung beteiligten Rechtsträger ist, wenn sie binnen sechs Monaten nach dem Tag, an dem die Eintragung der Verschmelzung in das Register des Sitzes desjenigen Rechtsträgers, dessen Gläubiger sie sind, nach § 19 Abs. 3 UmwG als bekannt gemacht gilt, ihren Anspruch nach Grund und Höhe in Textform anmelden, Sicherheit zu leisten, soweit sie nicht Befriedigung verlangen können. Dieses Recht steht den Gläubigern jedoch nur zu, wenn sie glaubhaft machen, dass durch die Verschmelzung die Erfüllung ihrer Forderung gefährdet wird."
    },
    {
      "date": "2025-12-24",
      "id": "141009",
      "original_text": "Registerbekanntmachung nach dem Umwandlungsgesetz\nBayern Amtsgericht Schweinfurt GsR 314\nWiesenfelder eGbR – Kolitzheim",
      "type": "Registerbekanntmachung nach dem Umwandlungsgesetz",
      "state": "Bayern",
      "amtsgericht": "Amtsgericht Schweinfurt",
      "registernummer": "GsR 314",
      "registerart": "GsR",
      "company_name": "Wiesenfelder eGbR",
      "company_seat": "Kolitzheim",
      "details": "24.12.2025 (Bekanntmachungsdatum)\n\nBayern Amtsgericht Schweinfurt GsR 314\nRegisterbekanntmachung nach dem Umwandlungsgesetz 23.12.2025 (Eintragungsdatum)\n\nWiesenfelder eGbR\nGesellschaft bürgerlichen Rechts\nKolitzheim\n\nDen Gläubigern des formwechselnden Rechtsträgers ist, wenn sie binnen sechs Monaten nach dem Tag, an dem die Eintragung des Formwechsels nach § 201 UmwG als bekannt gemacht gilt, ihren Anspruch nach Grund und Höhe in Textform anmelden, Sicherheit zu leisten, soweit sie nicht Befriedigung verlangen können. Dieses Recht steht den Gläubigern jedoch nur zu, wenn sie glaubhaft machen, dass durch den Formwechsel die Erfüllung ihrer Forderung gefährdet wird."
    },
    {
      "date": "2025-12-24",
      "id": "141010",
      "original_text": "Registerbekanntmachung nach dem Umwandlungsgesetz\nBayern Amtsgericht Coburg HRB 7486\nMR Shuttle Service & more GmbH – Steinwiesen",
      "type": "Registerbekanntmachung nach dem Umwandlungsgesetz",
      "state": "Bayern",
      "amtsgericht": "Amtsgericht Coburg",
      "registernummer": "HRB 7486",
      "registerart": "HRB",
      "company_name": "MR Shuttle Service & more GmbH",
      "company_seat": "Steinwiesen",
      "details": "24.12.2025 (Bekanntmachungsdatum)\n\nBayern Amtsgericht Coburg HRB 7486\nRegisterbekanntmachung nach dem Umwandlungsgesetz 17.12.2025 (Eintragungsdatum)\n\nMR Shuttle Service & more GmbH\nGesellschaft mit beschränkter Haftung\nSteinwiesen\n\nDen Gläubigern der an der Verschmelzung beteiligten Rechtsträger ist, wenn sie binnen sechs Monaten nach dem Tag, an dem die Eintragung der Verschmelzung in das Register des Sitzes desjenigen Rechtsträgers, dessen Gläubiger sie sind, nach § 19 Abs. 3 UmwG als bekannt gemacht gilt, ihren Anspruch nach Grund und Höhe in Textform anmelden, Sicherheit zu leisten, soweit sie nicht Befriedigung verlangen können. Dieses Recht steht den Gläubigern jedoch nur zu, wenn sie glaubhaft machen, dass durch die Verschmelzung die Erfüllung ihrer Forderung gefährdet wird."
    },
    {
      "date": "2025-12-24",
      "id": "141011",
      "original_text": "Registerbekanntmachung nach dem Umwandlungsgesetz\nBayern Amtsgericht München HRB 299202\nWheelCare Co-Invest Verwaltungs GmbH – München",
      "type": "Registerbekanntmachung nach dem Umwandlungsgesetz",
      "state": "Bayern",
      "amtsgericht": "Amtsgericht München",
      "registernummer": "HRB 299202",
      "registerart": "HRB",
      "company_name": "WheelCare Co-Invest Verwaltungs GmbH",
      "company_seat": "München",
      "details": "24.12.2025 (Bekanntmachungsdatum)\n\nBayern Amtsgericht München HRB 299202\nRegisterbekanntmachung nach dem Umwandlungsgesetz 23.12.2025 (Eintragungsdatum)\n\nWheelCare Co-Invest Verwaltungs GmbH\nGesellschaft mit beschränkter Haftung\nMünchen\n\nDen Gläubigern der an der Verschmelzung beteiligten Rechtsträger ist, wenn sie binnen sechs Monaten nach dem Tag, an dem die Eintragung der Verschmelzung in das Register des Sitzes desjenigen Rechtsträgers, dessen Gläubiger sie sind, nach § 19 Abs. 3 UmwG als bekannt gemacht gilt, ihren Anspruch nach Grund und Höhe in Textform anmelden, Sicherheit zu leisten, soweit sie nicht Befriedigung verlangen können. Dieses Recht steht den Gläubigern jedoch nur zu, wenn sie glaubhaft machen, dass durch die Verschmelzung die Erfüllung ihrer Forderung gefährdet wird."
    },
    {
      "date": "2025-12-24",
      "id": "141012",
      "original_text": "Registerbekanntmachung nach dem Umwandlungsgesetz\nBayern Amtsgericht München HRB 226448\nPHÖNIX-Haus Rosmarin Senioren- und Pflegezentrum GmbH – München",
      "type": "Registerbekanntmachung nach dem Umwandlungsgesetz",
      "state": "Bayern",
      "amtsgericht": "Amtsgericht München",
      "registernummer": "HRB 226448",
      "registerart": "HRB",
      "company_name": "PHÖNIX-Haus Rosmarin Senioren- und Pflegezentrum GmbH",
      "company_seat": "München",
      "details": "24.12.2025 (Bekanntmachungsdatum)\n\nBayern Amtsgericht München HRB 226448\nRegisterbekanntmachung nach dem Umwandlungsgesetz 23.12.2025 (Eintragungsdatum)\n\nPHÖNIX-Haus Rosmarin Senioren- und Pflegezentrum GmbH\nGesellschaft mit beschränkter Haftung\nMünchen\n\nDen Gläubigern der an der Verschmelzung beteiligten Rechtsträger ist, wenn sie binnen sechs Monaten nach dem Tag, an dem die Eintragung der Verschmelzung in das Register des Sitzes desjenigen Rechtsträgers, dessen Gläubiger sie sind, nach § 19 Abs. 3 UmwG als bekannt gemacht gilt, ihren Anspruch nach Grund und Höhe in Textform anmelden, Sicherheit zu leisten, soweit sie nicht Befriedigung verlangen können. Dieses Recht steht den Gläubigern jedoch nur zu, wenn sie glaubhaft machen, dass durch die Verschmelzung die Erfüllung ihrer Forderung gefährdet wird."
    },
    {
      "date": "2025-12-24",
      "id": "141013",
      "original_text": "Einreichung neuer Dokumente\nBayern Amtsgericht Traunstein HRB 24717\nDACT Beteiligung AG – Haag i. OB",
      "type": "Einreichung neuer Dokumente",
      "state": "Bayern",
      "amtsgericht": "Amtsgericht Traunstein",
      "registernummer": "HRB 24717",
      "registerart": "HRB",
      "company_name": "DACT Beteiligung AG",
      "company_seat": "Haag i. OB",
      "details": "24.12.2025 (Bekanntmachungsdatum)\n\nBayern Amtsgericht Traunstein HRB 24717\nEinreichung neuer Dokumente\n\nDACT Beteiligung AG\nAktiengesellschaft\nHaag i. OB\n\nDem Amtsgericht Traunstein -Registergericht- ist eine Liste der Mitglieder des Aufsichtsrats eingereicht worden, § 106 AktG."
    },
    {
      "date": "2025-12-24",
      "id": "141014",
      "original_text": "Einreichung neuer Dokumente\nBayern Amtsgericht München HRB 294845\nYouco M24-M387 Vorrats-SE – München",
      "type": "Einreichung neuer Dokumente",
      "state": "Bayern",
      "amtsgericht": "Amtsgericht München",
      "registernummer": "HRB 294845",
      "registerart": "HRB",
      "company_name": "Youco M24-M387 Vorrats-SE",
      "company_seat": "München",
      "details": "24.12.2025 (Bekanntmachungsdatum)\n\nBayern Amtsgericht München HRB 294845\nEinreichung neuer Dokumente 23.12.2025 (Eintragungsdatum)\n\nYouco M24-M387 Vorrats-SE\nEuropäische Aktiengesellschaft (SE)\nMünchen\n\nDem Amtsgericht München -Registergericht- ist eine Liste der Mitglieder des Verwaltungsrates  eingereicht worden, Art. 9 Abs. 1 Buchst. c (ii) SE-VO i.V.m. § 106 AktG."
    },
    {
      "date": "2025-12-24",
      "id": "141015",
      "original_text": "Registerbekanntmachung nach dem Umwandlungsgesetz\nBayern Amtsgericht München HRB 146494\nDMC Production Germany GmbH – Ismaning",
      "type": "Registerbekanntmachung nach dem Umwandlungsgesetz",
      "state": "Bayern",
      "amtsgericht": "Amtsgericht München",
      "registernummer": "HRB 146494",
      "registerart": "HRB",
      "company_name": "DMC Production Germany GmbH",
      "company_seat": "Ismaning",
      "details": "24.12.2025 (Bekanntmachungsdatum)\n\nBayern Amtsgericht München HRB 146494\nRegisterbekanntmachung nach dem Umwandlungsgesetz 23.12.2025 (Eintragungsdatum)\n\nDMC Production Germany GmbH\nGesellschaft mit beschränkter Haftung\nIsmaning\n\nDen Gläubigern der an der Verschmelzung beteiligten Rechtsträger ist, wenn sie binnen sechs Monaten nach dem Tag, an dem die Eintragung der Verschmelzung in das Register des Sitzes desjenigen Rechtsträgers, dessen Gläubiger sie sind, nach § 19 Abs. 3 UmwG als bekannt gemacht gilt, ihren Anspruch nach Grund und Höhe in Textform anmelden, Sicherheit zu leisten, soweit sie nicht Befriedigung verlangen können. Dieses Recht steht den Gläubigern jedoch nur zu, wenn sie glaubhaft machen, dass durch die Verschmelzung die Erfüllung ihrer Forderung gefährdet wird."
    },
    {
      "date": "2025-12-24",
      "id": "141016",
      "original_text": "Registerbekanntmachung nach dem Umwandlungsgesetz\nBayern Amtsgericht Traunstein HRB 11500\nSTEIGENBERGER HOTELBERUFSFACHSCHULE GMBH – Bad Reichenhall",
      "type": "Registerbekanntmachung nach dem Umwandlungsgesetz",
      "state": "Bayern",
      "amtsgericht": "Amtsgericht Traunstein",
      "registernummer": "HRB 11500",
      "registerart": "HRB",
      "company_name": "STEIGENBERGER HOTELBERUFSFACHSCHULE GMBH",
      "company_seat": "Bad Reichenhall",
      "details": "24.12.2025 (Bekanntmachungsdatum)\n\nBayern Amtsgericht Traunstein HRB 11500\nRegisterbekanntmachung nach dem Umwandlungsgesetz 23.12.2025 (Eintragungsdatum)\n\nSTEIGENBERGER HOTELBERUFSFACHSCHULE GMBH\nGesellschaft mit beschränkter Haftung\nBad Reichenhall\n\nDen Gläubigern der an der Verschmelzung beteiligten Rechtsträger ist, wenn sie binnen sechs Monaten nach dem Tag, an dem die Eintragung der Verschmelzung in das Register des Sitzes desjenigen Rechtsträgers, dessen Gläubiger sie sind, nach § 19 Abs. 3 UmwG als bekannt gemacht gilt, ihren Anspruch nach Grund und Höhe in Textform anmelden, Sicherheit zu leisten, soweit sie nicht Befriedigung verlangen können. Dieses Recht steht den Gläubigern jedoch nur zu, wenn sie glaubhaft machen, dass durch die Verschmelzung die Erfüllung ihrer Forderung gefährdet wird."
    },
    {
      "date": "2025-12-24",
      "id": "141017",
      "original_text": "Registerbekanntmachung nach dem Umwandlungsgesetz\nBayern Amtsgericht Kempten (Allgäu) HRB 11892\nGreiter & Cie. Marketing GmbH – Kempten (Allgäu)",
      "type": "Registerbekanntmachung nach dem Umwandlungsgesetz",
      "state": "Bayern",
      "amtsgericht": "Amtsgericht Kempten (Allgäu)",
      "registernummer": "HRB 11892",
      "registerart": "HRB",
      "company_name": "Greiter & Cie. Marketing GmbH",
      "company_seat": "Kempten (Allgäu)",
      "details": "24.12.2025 (Bekanntmachungsdatum)\n\nBayern Amtsgericht Kempten (Allgäu) HRB 11892\nRegisterbekanntmachung nach dem Umwandlungsgesetz 23.12.2025 (Eintragungsdatum)\n\nGreiter & Cie. Marketing GmbH\nGesellschaft mit beschränkter Haftung\nKempten (Allgäu)\n\nDen Gläubigern der an der Verschmelzung beteiligten Rechtsträger ist, wenn sie binnen sechs Monaten nach dem Tag, an dem die Eintragung der Verschmelzung in das Register des Sitzes desjenigen Rechtsträgers, dessen Gläubiger sie sind, nach § 19 Abs. 3 UmwG als bekannt gemacht gilt, ihren Anspruch nach Grund und Höhe in Textform anmelden, Sicherheit zu leisten, soweit sie nicht Befriedigung verlangen können. Dieses Recht steht den Gläubigern jedoch nur zu, wenn sie glaubhaft machen, dass durch die Verschmelzung die Erfüllung ihrer Forderung gefährdet wird."
    },
    {
      "date": "2025-12-24",
      "id": "141018",
      "original_text": "Registerbekanntmachung nach dem Umwandlungsgesetz\nBayern Amtsgericht Schweinfurt HRB 8781\nDOWA Real Estate GmbH – Kolitzheim",
      "type": "Registerbekanntmachung nach dem Umwandlungsgesetz",
      "state": "Bayern",
      "amtsgericht": "Amtsgericht Schweinfurt",
      "registernummer": "HRB 8781",
      "registerart": "HRB",
      "company_name": "DOWA Real Estate GmbH",
      "company_seat": "Kolitzheim",
      "details": "24.12.2025 (Bekanntmachungsdatum)\n\nBayern Amtsgericht Schweinfurt HRB 8781\nRegisterbekanntmachung nach dem Umwandlungsgesetz 23.12.2025 (Eintragungsdatum)\n\nDOWA Real Estate GmbH\nGesellschaft mit beschränkter Haftung\nKolitzheim\n\nDen Gläubigern des formwechselnden Rechtsträgers ist, wenn sie binnen sechs Monaten nach dem Tag, an dem die Eintragung des Formwechsels nach § 201 UmwG als bekannt gemacht gilt, ihren Anspruch nach Grund und Höhe in Textform anmelden, Sicherheit zu leisten, soweit sie nicht Befriedigung verlangen können. Dieses Recht steht den Gläubigern jedoch nur zu, wenn sie glaubhaft machen, dass durch den Formwechsel die Erfüllung ihrer Forderung gefährdet wird."
    },
    {
      "date": "2025-12-24",
      "id": "141019",
      "original_text": "Registerbekanntmachung nach dem Umwandlungsgesetz\nBayern Amtsgericht München HRB 308204\nFERCHAU Contract GmbH – Unterhaching",
      "type": "Registerbekanntmachung nach dem Umwandlungsgesetz",
      "state": "Bayern",
      "amtsgericht": "Amtsgericht München",
      "registernummer": "HRB 308204",
      "registerart": "HRB",
      "company_name": "FERCHAU Contract GmbH",
      "company_seat": "Unterhaching",
      "details": "24.12.2025 (Bekanntmachungsdatum)\n\nBayern Amtsgericht München HRB 308204\nRegisterbekanntmachung nach dem Umwandlungsgesetz 23.12.2025 (Eintragungsdatum)\n\nFERCHAU Contract GmbH\nGesellschaft mit beschränkter Haftung\nUnterhaching\n\nDen Gläubigern des formwechselnden Rechtsträgers ist, wenn sie binnen sechs Monaten nach dem Tag, an dem die Eintragung des Formwechsels nach § 201 UmwG als bekannt gemacht gilt, ihren Anspruch nach Grund und Höhe in Textform anmelden, Sicherheit zu leisten, soweit sie nicht Befriedigung verlangen können. Dieses Recht steht den Gläubigern jedoch nur zu, wenn sie glaubhaft machen, dass durch den Formwechsel die Erfüllung ihrer Forderung gefährdet wird."
    },
    {
      "date": "2025-12-24",
      "id": "141020",
      "original_text": "Löschungsankündigung\nBayern Amtsgericht München HRB 284329\nZoila GmbH – München",
      "type": "Löschungsankündigung",
      "state": "Bayern",
      "amtsgericht": "Amtsgericht München",
      "registernummer": "HRB 284329",
      "registerart": "HRB",
      "company_name": "Zoila GmbH",
      "company_seat": "München",
      "details": "24.12.2025 (Bekanntmachungsdatum)\n\nBayern Amtsgericht München HRB 284329\nLöschungsankündigung 23.12.2025 (Eintragungsdatum)\n\nZoila GmbH\nGesellschaft mit beschränkter Haftung\nMünchen\n\nDas Registergericht beabsichtigt, die im Handelsregister eingetragene Gesellschaft wegen Vermögenslosigkeit von Amts wegen nach § 394 FamFG zu löschen. Die Frist zur Erhebung eines Widerspruchs ist auf drei Monate festgesetzt."
    },
    {
      "date": "2025-12-24",
      "id": "141021",
      "original_text": "Registerbekanntmachung nach dem Umwandlungsgesetz\nBayern Amtsgericht Traunstein HRB 23576\nSteigenberger Berufsfachschule für Assistenten im Hotel- und Tourismusmanagement gGmbH – Bad Reichenhall",
      "type": "Registerbekanntmachung nach dem Umwandlungsgesetz",
      "state": "Bayern",
      "amtsgericht": "Amtsgericht Traunstein",
      "registernummer": "HRB 23576",
      "registerart": "HRB",
      "company_name": "Steigenberger Berufsfachschule für Assistenten im Hotel- und Tourismusmanagement gGmbH",
      "company_seat": "Bad Reichenhall",
      "details": "24.12.2025 (Bekanntmachungsdatum)\n\nBayern Amtsgericht Traunstein HRB 23576\nRegisterbekanntmachung nach dem Umwandlungsgesetz 23.12.2025 (Eintragungsdatum)\n\nSteigenberger Berufsfachschule für Assistenten im Hotel- und Tourismusmanagement gGmbH\nGesellschaft mit beschränkter Haftung\nBad Reichenhall\n\nDen Gläubigern der an der Verschmelzung beteiligten Rechtsträger ist, wenn sie binnen sechs Monaten nach dem Tag, an dem die Eintragung der Verschmelzung in das Register des Sitzes desjenigen Rechtsträgers, dessen Gläubiger sie sind, nach § 19 Abs. 3 UmwG als bekannt gemacht gilt, ihren Anspruch nach Grund und Höhe in Textform anmelden, Sicherheit zu leisten, soweit sie nicht Befriedigung verlangen können. Dieses Recht steht den Gläubigern jedoch nur zu, wenn sie glaubhaft machen, dass durch die Verschmelzung die Erfüllung ihrer Forderung gefährdet wird."
    },
    {
      "date": "2025-12-24",
      "id": "141022",
      "original_text": "Löschungsankündigung\nBayern Amtsgericht München HRB 182636\nHöflinger Filial GmbH – Neufahrn b.Freising",
      "type": "Löschungsankündigung",
      "state": "Bayern",
      "amtsgericht": "Amtsgericht München",
      "registernummer": "HRB 182636",
      "registerart": "HRB",
      "company_name": "Höflinger Filial GmbH",
      "company_seat": "Neufahrn b.Freising",
      "details": "24.12.2025 (Bekanntmachungsdatum)\n\nBayern Amtsgericht München HRB 182636\nLöschungsankündigung 23.12.2025 (Eintragungsdatum)\n\nHöflinger Filial GmbH\nGesellschaft mit beschränkter Haftung\nNeufahrn b.Freising\n\nDen Gläubigern der Gesellschaft, deren Forderungen begründet worden sind, bevor die Eintragung der Beendigung des #DV.art(Text=\"Bitte Art des Vertrages auswählen\",Eingabe=\n\"Beherrschungs- und Gewinnabführungsvertrages\",\n\"Beherrschungsvertrages\",\n\"Gewinnabführungsvertrages\",\n\"Teilgewinnabführungsvertrages\") in das Handelsregister nach § 10 des Handelsgesetzbuches als bekanntgemacht gilt, hat der andere Vertragsteil Sicherheit zu leisten, wenn sie sich binnen sechs Monaten nach der Bekanntmachung der Eintragung zu diesem Zweck bei ihm melden."
    },
    {
      "date": "2025-12-24",
      "id": "141023",
      "original_text": "Registerbekanntmachung nach dem Umwandlungsgesetz\nBayern Amtsgericht Traunstein HRB 34777\nMane's GmbH – Polling",
      "type": "Registerbekanntmachung nach dem Umwandlungsgesetz",
      "state": "Bayern",
      "amtsgericht": "Amtsgericht Traunstein",
      "registernummer": "HRB 34777",
      "registerart": "HRB",
      "company_name": "Mane's GmbH",
      "company_seat": "Polling",
      "details": "24.12.2025 (Bekanntmachungsdatum)\n\nBayern Amtsgericht Traunstein HRB 34777\nRegisterbekanntmachung nach dem Umwandlungsgesetz 23.12.2025 (Eintragungsdatum)\n\nMane's GmbH\nGesellschaft mit beschränkter Haftung\nPolling\n\nDen Gläubigern der an der Ausgliederung beteiligten Rechtsträger ist, wenn sie binnen sechs Monaten nach dem Tag, an dem die Eintragung der Ausgliederung in das Register des Sitzes desjenigen Rechtsträgers, dessen Gläubiger sie sind, nach §§ 125, 19 Abs. 3 UmwG als bekannt gemacht gilt, ihren Anspruch nach Grund und Höhe in Textform anmelden, Sicherheit zu leisten, soweit sie nicht Befriedigung verlangen können. Dieses Recht steht den Gläubigern jedoch nur zu, wenn sie glaubhaft machen, dass durch die Ausgliederung die Erfüllung ihrer Forderung gefährdet wird."
    },
    {
      "date": "2025-12-24",
      "id": "141024",
      "original_text": "Registerbekanntmachung nach dem Umwandlungsgesetz\nBayern Amtsgericht Traunstein HRA 9880\nTB Polling Besitz UG (haftungsbeschränkt) & Co. KG – Polling",
      "type": "Registerbekanntmachung nach dem Umwandlungsgesetz",
      "state": "Bayern",
      "amtsgericht": "Amtsgericht Traunstein",
      "registernummer": "HRA 9880",
      "registerart": "HRA",
      "company_name": "TB Polling Besitz UG (haftungsbeschränkt) & Co. KG",
      "company_seat": "Polling",
      "details": "24.12.2025 (Bekanntmachungsdatum)\n\nBayern Amtsgericht Traunstein HRA 9880\nRegisterbekanntmachung nach dem Umwandlungsgesetz 23.12.2025 (Eintragungsdatum)\n\nTB Polling Besitz UG (haftungsbeschränkt) & Co. KG\nKommanditgesellschaft\nPolling\n\nDen Gläubigern der an der Ausgliederung beteiligten Rechtsträger ist, wenn sie binnen sechs Monaten nach dem Tag, an dem die Eintragung der Ausgliederung in das Register des Sitzes desjenigen Rechtsträgers, dessen Gläubiger sie sind, nach §§ 125, 19 Abs. 3 UmwG als bekannt gemacht gilt, ihren Anspruch nach Grund und Höhe in Textform anmelden, Sicherheit zu leisten, soweit sie nicht Befriedigung verlangen können. Dieses Recht steht den Gläubigern jedoch nur zu, wenn sie glaubhaft machen, dass durch die Ausgliederung die Erfüllung ihrer Forderung gefährdet wird."
    },
    {
      "date": "2025-12-24",
      "id": "141025",
      "original_text": "Registerbekanntmachung nach dem Umwandlungsgesetz\nBayern Amtsgericht Traunstein HRB 21298\nSteigenberger Akademie GmbH – Bad Reichenhall",
      "type": "Registerbekanntmachung nach dem Umwandlungsgesetz",
      "state": "Bayern",
      "amtsgericht": "Amtsgericht Traunstein",
      "registernummer": "HRB 21298",
      "registerart": "HRB",
      "company_name": "Steigenberger Akademie GmbH",
      "company_seat": "Bad Reichenhall",
      "details": "24.12.2025 (Bekanntmachungsdatum)\n\nBayern Amtsgericht Traunstein HRB 21298\nRegisterbekanntmachung nach dem Umwandlungsgesetz 23.12.2025 (Eintragungsdatum)\n\nSteigenberger Akademie GmbH\nGesellschaft mit beschränkter Haftung\nBad Reichenhall\n\nDen Gläubigern der an der Verschmelzung beteiligten Rechtsträger ist, wenn sie binnen sechs Monaten nach dem Tag, an dem die Eintragung der Verschmelzung in das Register des Sitzes desjenigen Rechtsträgers, dessen Gläubiger sie sind, nach § 19 Abs. 3 UmwG als bekannt gemacht gilt, ihren Anspruch nach Grund und Höhe in Textform anmelden, Sicherheit zu leisten, soweit sie nicht Befriedigung verlangen können. Dieses Recht steht den Gläubigern jedoch nur zu, wenn sie glaubhaft machen, dass durch die Verschmelzung die Erfüllung ihrer Forderung gefährdet wird."
    },
    {
      "date": "2025-12-24",
      "id": "141026",
      "original_text": "Registerbekanntmachung nach dem Umwandlungsgesetz\nBayern Amtsgericht München HRB 129233\ntop itservices AG – Unterhaching",
      "type": "Registerbekanntmachung nach dem Umwandlungsgesetz",
      "state": "Bayern",
      "amtsgericht": "Amtsgericht München",
      "registernummer": "HRB 129233",
      "registerart": "HRB",
      "company_name": "top itservices AG",
      "company_seat": "Unterhaching",
      "details": "24.12.2025 (Bekanntmachungsdatum)\n\nBayern Amtsgericht München HRB 129233\nRegisterbekanntmachung nach dem Umwandlungsgesetz 23.12.2025 (Eintragungsdatum)\n\ntop itservices AG\nAktiengesellschaft\nUnterhaching\n\nDen Gläubigern des formwechselnden Rechtsträgers ist, wenn sie binnen sechs Monaten nach dem Tag, an dem die Eintragung des Formwechsels nach § 201 UmwG als bekannt gemacht gilt, ihren Anspruch nach Grund und Höhe in Textform anmelden, Sicherheit zu leisten, soweit sie nicht Befriedigung verlangen können. Dieses Recht steht den Gläubigern jedoch nur zu, wenn sie glaubhaft machen, dass durch den Formwechsel die Erfüllung ihrer Forderung gefährdet wird."
    },
    {
      "date": "2025-12-24",
      "id": "141027",
      "original_text": "Registerbekanntmachung nach dem Umwandlungsgesetz\nBayern Amtsgericht Fürth HRA 12673\ncip collab GmbH & Co. KG – Fürth",
      "type": "Registerbekanntmachung nach dem Umwandlungsgesetz",
      "state": "Bayern",
      "amtsgericht": "Amtsgericht Fürth",
      "registernummer": "HRA 12673",
      "registerart": "HRA",
      "company_name": "cip collab GmbH & Co. KG",
      "company_seat": "Fürth",
      "details": "24.12.2025 (Bekanntmachungsdatum)\n\nBayern Amtsgericht Fürth HRA 12673\nRegisterbekanntmachung nach dem Umwandlungsgesetz 23.12.2025 (Eintragungsdatum)\n\ncip collab GmbH & Co. KG\nKommanditgesellschaft\nFürth\n\nDen Gläubigern des formwechselnden Rechtsträgers ist, wenn sie binnen sechs Monaten nach dem Tag, an dem die Eintragung des Formwechsels nach § 201 UmwG als bekannt gemacht gilt, ihren Anspruch nach Grund und Höhe in Textform anmelden, Sicherheit zu leisten, soweit sie nicht Befriedigung verlangen können. Dieses Recht steht den Gläubigern jedoch nur zu, wenn sie glaubhaft machen, dass durch den Formwechsel die Erfüllung ihrer Forderung gefährdet wird."
    },
    {
      "date": "2025-12-24",
      "id": "141028",
      "original_text": "Registerbekanntmachung nach dem Umwandlungsgesetz\nBerlin Amtsgericht Berlin (Charlottenburg) HRB 86378\nknowledgeTools International GmbH – Berlin",
      "type": "Registerbekanntmachung nach dem Umwandlungsgesetz",
      "state": "Berlin",
      "amtsgericht": "Amtsgericht Berlin (Charlottenburg)",
      "registernummer": "HRB 86378",
      "registerart": "HRB",
      "company_name": "knowledgeTools International GmbH",
      "company_seat": "Berlin",
      "details": "24.12.2025 (Bekanntmachungsdatum)\n\nBerlin Amtsgericht Berlin (Charlottenburg) HRB 86378\nRegisterbekanntmachung nach dem Umwandlungsgesetz 22.12.2025 (Eintragungsdatum)\n\nknowledgeTools International GmbH\nGesellschaft mit beschränkter Haftung\nBerlin\n\nZu Eintragungsnummer 12 vom 22.12.2025 wird als nicht eingetragen veröffentlicht: Den Gläubigern der an der Verschmelzung beteiligten Rechtsträger ist, wenn sie binnen sechs Monaten nach dem Tag, an dem die Eintragung der Verschmelzung in das Register des Sitzes desjenigen Rechtsträgers, dessen Gläubiger sie sind, als bekannt gemacht gilt, ihren Anspruch nach Grund und Höhe schriftlich anmelden, Sicherheit zu leisten, soweit sie nicht Befriedigung verlangen können. Dieses Recht steht den Gläubigern jedoch nur zu, wenn sie glaubhaft machen, dass durch die Verschmelzung die Erfüllung ihrer Forderung gefährdet wird. Das Recht, Sicherheitsleistung zu verlangen, steht Gläubigern nicht zu, die im Falle der Insolvenz ein Recht auf vorzugsweise Befriedigung aus einer Deckungsmasse haben, die nach gesetzlicher Vorschrift zu ihrem Schutz errichtet und staatlich überwacht ist."
    },
    {
      "date": "2025-12-24",
      "id": "141029",
      "original_text": "Registerbekanntmachung nach dem Umwandlungsgesetz\nBerlin Amtsgericht Berlin (Charlottenburg) HRB 95662\nknowledgeTools Systems GmbH – Berlin",
      "type": "Registerbekanntmachung nach dem Umwandlungsgesetz",
      "state": "Berlin",
      "amtsgericht": "Amtsgericht Berlin (Charlottenburg)",
      "registernummer": "HRB 95662",
      "registerart": "HRB",
      "company_name": "knowledgeTools Systems GmbH",
      "company_seat": "Berlin",
      "details": "24.12.2025 (Bekanntmachungsdatum)\n\nBerlin Amtsgericht Berlin (Charlottenburg) HRB 95662\nRegisterbekanntmachung nach dem Umwandlungsgesetz 22.12.2025 (Eintragungsdatum)\n\nknowledgeTools Systems GmbH\nGesellschaft mit beschränkter Haftung\nBerlin\n\nZu Eintragungsnummer 5 vom 22.12.2025 wird als nicht eingetragen veröffentlicht: Den Gläubigern der an der Verschmelzung beteiligten Rechtsträger ist, wenn sie binnen sechs Monaten nach dem Tag, an dem die Eintragung der Verschmelzung in das Register des Sitzes desjenigen Rechtsträgers, dessen Gläubiger sie sind, als bekannt gemacht gilt, ihren Anspruch nach Grund und Höhe schriftlich anmelden, Sicherheit zu leisten, soweit sie nicht Befriedigung verlangen können. Dieses Recht steht den Gläubigern jedoch nur zu, wenn sie glaubhaft machen, dass durch die Verschmelzung die Erfüllung ihrer Forderung gefährdet wird. Das Recht, Sicherheitsleistung zu verlangen, steht Gläubigern nicht zu, die im Falle der Insolvenz ein Recht auf vorzugsweise Befriedigung aus einer Deckungsmasse haben, die nach gesetzlicher Vorschrift zu ihrem Schutz errichtet und staatlich überwacht ist."
    }
  ]
}