{
  "date": "2025-12-16",
  "date_of_scrape": "2025-12-17T04:19:24.034Z",
  "tool_version": "0.2.0",
  "number_of_announcements": 181,
  "announcements": [
    {
      "date": "2025-12-16",
      "id": "140042",
      "original_text": "Registerbekanntmachung nach dem Umwandlungsgesetz\nBayern Amtsgericht Fürth HRB 16632\nP&P Objekt 26 GmbH – Fürth",
      "type": "Registerbekanntmachung nach dem Umwandlungsgesetz",
      "state": "Bayern",
      "amtsgericht": "Amtsgericht Fürth",
      "registernummer": "HRB 16632",
      "registerart": "HRB",
      "company_name": "P&P Objekt 26 GmbH",
      "company_seat": "Fürth",
      "details": "16.12.2025 (Bekanntmachungsdatum)\n\nBayern Amtsgericht Fürth HRB 16632\nRegisterbekanntmachung nach dem Umwandlungsgesetz 15.12.2025 (Eintragungsdatum)\n\nP&P Objekt 26 GmbH\nGesellschaft mit beschränkter Haftung\nFürth\n\nDen Gläubigern der an der Verschmelzung beteiligten Rechtsträger ist, wenn sie binnen sechs Monaten nach dem Tag, an dem die Eintragung der Verschmelzung in das Register des Sitzes desjenigen Rechtsträgers, dessen Gläubiger sie sind, nach § 19 Abs. 3 UmwG als bekannt gemacht gilt, ihren Anspruch nach Grund und Höhe in Textform anmelden, Sicherheit zu leisten, soweit sie nicht Befriedigung verlangen können. Dieses Recht steht den Gläubigern jedoch nur zu, wenn sie glaubhaft machen, dass durch die Verschmelzung die Erfüllung ihrer Forderung gefährdet wird."
    },
    {
      "date": "2025-12-16",
      "id": "140043",
      "original_text": "Einreichung neuer Dokumente\nBayern Amtsgericht Coburg HRB 3942\nGerresheimer Tettau GmbH – Tettau (Oberfranken)",
      "type": "Einreichung neuer Dokumente",
      "state": "Bayern",
      "amtsgericht": "Amtsgericht Coburg",
      "registernummer": "HRB 3942",
      "registerart": "HRB",
      "company_name": "Gerresheimer Tettau GmbH",
      "company_seat": "Tettau (Oberfranken)",
      "details": "16.12.2025 (Bekanntmachungsdatum)\n\nBayern Amtsgericht Coburg HRB 3942\nEinreichung neuer Dokumente 15.12.2025 (Eintragungsdatum)\n\nGerresheimer Tettau GmbH\nGesellschaft mit beschränkter Haftung\nTettau (Oberfranken)\n\nDem Amtsgericht Coburg -Registergericht- ist eine Liste der Mitglieder des Aufsichtsrats eingereicht worden, § 52 Abs. 3 S. 2 GmbHG."
    },
    {
      "date": "2025-12-16",
      "id": "140044",
      "original_text": "Einreichung neuer Dokumente\nBayern Amtsgericht München HRB 178033\nBankhaus Herzogpark AG – München",
      "type": "Einreichung neuer Dokumente",
      "state": "Bayern",
      "amtsgericht": "Amtsgericht München",
      "registernummer": "HRB 178033",
      "registerart": "HRB",
      "company_name": "Bankhaus Herzogpark AG",
      "company_seat": "München",
      "details": "16.12.2025 (Bekanntmachungsdatum)\n\nBayern Amtsgericht München HRB 178033\nEinreichung neuer Dokumente\n\nBankhaus Herzogpark AG\nAktiengesellschaft\nMünchen\n\nDem Amtsgericht München -Registergericht- ist eine Liste der Mitglieder des Aufsichtsrats eingereicht worden, § 106 AktG."
    },
    {
      "date": "2025-12-16",
      "id": "140045",
      "original_text": "Registerbekanntmachung nach dem Umwandlungsgesetz\nBayern Amtsgericht Fürth HRB 11544\ntechmux GmbH – Erlangen",
      "type": "Registerbekanntmachung nach dem Umwandlungsgesetz",
      "state": "Bayern",
      "amtsgericht": "Amtsgericht Fürth",
      "registernummer": "HRB 11544",
      "registerart": "HRB",
      "company_name": "techmux GmbH",
      "company_seat": "Erlangen",
      "details": "16.12.2025 (Bekanntmachungsdatum)\n\nBayern Amtsgericht Fürth HRB 11544\nRegisterbekanntmachung nach dem Umwandlungsgesetz 15.12.2025 (Eintragungsdatum)\n\ntechmux GmbH\nGesellschaft mit beschränkter Haftung\nErlangen\n\nDen Gläubigern der an der Verschmelzung beteiligten Rechtsträger ist, wenn sie binnen sechs Monaten nach dem Tag, an dem die Eintragung der Verschmelzung in das Register des Sitzes desjenigen Rechtsträgers, dessen Gläubiger sie sind, nach § 19 Abs. 3 UmwG als bekannt gemacht gilt, ihren Anspruch nach Grund und Höhe in Textform anmelden, Sicherheit zu leisten, soweit sie nicht Befriedigung verlangen können. Dieses Recht steht den Gläubigern jedoch nur zu, wenn sie glaubhaft machen, dass durch die Verschmelzung die Erfüllung ihrer Forderung gefährdet wird."
    },
    {
      "date": "2025-12-16",
      "id": "140046",
      "original_text": "Registerbekanntmachung nach dem Umwandlungsgesetz\nBayern Amtsgericht Würzburg HRB 14621\nGOOD-BUSINESS GmbH – Gaukönigshofen",
      "type": "Registerbekanntmachung nach dem Umwandlungsgesetz",
      "state": "Bayern",
      "amtsgericht": "Amtsgericht Würzburg",
      "registernummer": "HRB 14621",
      "registerart": "HRB",
      "company_name": "GOOD-BUSINESS GmbH",
      "company_seat": "Gaukönigshofen",
      "details": "16.12.2025 (Bekanntmachungsdatum)\n\nBayern Amtsgericht Würzburg HRB 14621\nRegisterbekanntmachung nach dem Umwandlungsgesetz 14.12.2025 (Eintragungsdatum)\n\nGOOD-BUSINESS GmbH\nGesellschaft mit beschränkter Haftung\nGaukönigshofen\n\nDen Gläubigern der an der Verschmelzung beteiligten Rechtsträger ist, wenn sie binnen sechs Monaten nach dem Tag, an dem die Eintragung der Verschmelzung in das Register des Sitzes desjenigen Rechtsträgers, dessen Gläubiger sie sind, nach § 19 Abs. 3 UmwG als bekannt gemacht gilt, ihren Anspruch nach Grund und Höhe in Textform anmelden, Sicherheit zu leisten, soweit sie nicht Befriedigung verlangen können. Dieses Recht steht den Gläubigern jedoch nur zu, wenn sie glaubhaft machen, dass durch die Verschmelzung die Erfüllung ihrer Forderung gefährdet wird."
    },
    {
      "date": "2025-12-16",
      "id": "140047",
      "original_text": "Löschungsankündigung\nBayern Amtsgericht München HRB 137967\nBrettonLevineCook GmbH – München",
      "type": "Löschungsankündigung",
      "state": "Bayern",
      "amtsgericht": "Amtsgericht München",
      "registernummer": "HRB 137967",
      "registerart": "HRB",
      "company_name": "BrettonLevineCook GmbH",
      "company_seat": "München",
      "details": "16.12.2025 (Bekanntmachungsdatum)\n\nBayern Amtsgericht München HRB 137967\nLöschungsankündigung\n\nBrettonLevineCook GmbH\nGesellschaft mit beschränkter Haftung\nMünchen\n\nDas Registergericht beabsichtigt, die im Handelsregister eingetragene Gesellschaft wegen Vermögenslosigkeit von Amts wegen nach § 394 FamFG zu löschen. Die Frist zur Erhebung eines Widerspruchs ist auf drei Monate festgesetzt."
    },
    {
      "date": "2025-12-16",
      "id": "140048",
      "original_text": "Einreichung neuer Dokumente\nBayern Amtsgericht München HRB 257068\nGenerali Deutschland Lebensversicherung AG – München",
      "type": "Einreichung neuer Dokumente",
      "state": "Bayern",
      "amtsgericht": "Amtsgericht München",
      "registernummer": "HRB 257068",
      "registerart": "HRB",
      "company_name": "Generali Deutschland Lebensversicherung AG",
      "company_seat": "München",
      "details": "16.12.2025 (Bekanntmachungsdatum)\n\nBayern Amtsgericht München HRB 257068\nEinreichung neuer Dokumente\n\nGenerali Deutschland Lebensversicherung AG\nAktiengesellschaft\nMünchen\n\nDem Amtsgericht München -Registergericht- ist eine Liste der Mitglieder des Aufsichtsrats eingereicht worden, § 106 AktG."
    },
    {
      "date": "2025-12-16",
      "id": "140049",
      "original_text": "Registerbekanntmachung nach dem Umwandlungsgesetz\nBayern Amtsgericht München HRB 301787\nAllianz Services Holding GmbH – München",
      "type": "Registerbekanntmachung nach dem Umwandlungsgesetz",
      "state": "Bayern",
      "amtsgericht": "Amtsgericht München",
      "registernummer": "HRB 301787",
      "registerart": "HRB",
      "company_name": "Allianz Services Holding GmbH",
      "company_seat": "München",
      "details": "16.12.2025 (Bekanntmachungsdatum)\n\nBayern Amtsgericht München HRB 301787\nRegisterbekanntmachung nach dem Umwandlungsgesetz 15.12.2025 (Eintragungsdatum)\n\nAllianz Services Holding GmbH\nGesellschaft mit beschränkter Haftung\nMünchen\n\nDen Gläubigern der an der Verschmelzung beteiligten Rechtsträger ist, wenn sie binnen sechs Monaten nach dem Tag, an dem die Eintragung der Verschmelzung in das Register des Sitzes desjenigen Rechtsträgers, dessen Gläubiger sie sind, nach § 19 Abs. 3 UmwG als bekannt gemacht gilt, ihren Anspruch nach Grund und Höhe in Textform anmelden, Sicherheit zu leisten, soweit sie nicht Befriedigung verlangen können. Dieses Recht steht den Gläubigern jedoch nur zu, wenn sie glaubhaft machen, dass durch die Verschmelzung die Erfüllung ihrer Forderung gefährdet wird."
    },
    {
      "date": "2025-12-16",
      "id": "140050",
      "original_text": "Löschungsankündigung\nBayern Amtsgericht Ingolstadt HRB 7290\nmp.Gerüstbau GmbH – Geisenfeld",
      "type": "Löschungsankündigung",
      "state": "Bayern",
      "amtsgericht": "Amtsgericht Ingolstadt",
      "registernummer": "HRB 7290",
      "registerart": "HRB",
      "company_name": "mp.Gerüstbau GmbH",
      "company_seat": "Geisenfeld",
      "details": "16.12.2025 (Bekanntmachungsdatum)\n\nBayern Amtsgericht Ingolstadt HRB 7290\nLöschungsankündigung\n\nmp.Gerüstbau GmbH\nGesellschaft mit beschränkter Haftung\nGeisenfeld\n\nDas Registergericht beabsichtigt, die im Handelsregister eingetragene Gesellschaft wegen Vermögenslosigkeit von Amts wegen nach § 394 FamFG zu löschen. #insert(Text=\"zztb_V_Widerspruchsfrist\")"
    },
    {
      "date": "2025-12-16",
      "id": "140051",
      "original_text": "Einreichung neuer Dokumente\nBayern Amtsgericht Kempten (Allgäu) HRB 1102\nKur- und Sporthotel Appartementhaus GmbH – Hindelang",
      "type": "Einreichung neuer Dokumente",
      "state": "Bayern",
      "amtsgericht": "Amtsgericht Kempten (Allgäu)",
      "registernummer": "HRB 1102",
      "registerart": "HRB",
      "company_name": "Kur- und Sporthotel Appartementhaus GmbH",
      "company_seat": "Hindelang",
      "details": "16.12.2025 (Bekanntmachungsdatum)\n\nBayern Amtsgericht Kempten (Allgäu) HRB 1102\nEinreichung neuer Dokumente 12.12.2025 (Eintragungsdatum)\n\nKur- und Sporthotel Appartementhaus GmbH\nGesellschaft mit beschränkter Haftung\nHindelang\n\nDem Amtsgericht Kempten (Allgäu) -Registergericht- ist eine Liste der Mitglieder des Aufsichtsrats eingereicht worden, § 52 Abs. 3 S. 2 GmbHG."
    },
    {
      "date": "2025-12-16",
      "id": "140052",
      "original_text": "Registerbekanntmachung nach dem Umwandlungsgesetz\nBayern Amtsgericht Würzburg HRB 14620\nGROWTH POSITIVE Management GmbH – Gaukönigshofen",
      "type": "Registerbekanntmachung nach dem Umwandlungsgesetz",
      "state": "Bayern",
      "amtsgericht": "Amtsgericht Würzburg",
      "registernummer": "HRB 14620",
      "registerart": "HRB",
      "company_name": "GROWTH POSITIVE Management GmbH",
      "company_seat": "Gaukönigshofen",
      "details": "16.12.2025 (Bekanntmachungsdatum)\n\nBayern Amtsgericht Würzburg HRB 14620\nRegisterbekanntmachung nach dem Umwandlungsgesetz 14.12.2025 (Eintragungsdatum)\n\nGROWTH POSITIVE Management GmbH\nGesellschaft mit beschränkter Haftung\nGaukönigshofen\n\nDen Gläubigern der an der Verschmelzung beteiligten Rechtsträger ist, wenn sie binnen sechs Monaten nach dem Tag, an dem die Eintragung der Verschmelzung in das Register des Sitzes desjenigen Rechtsträgers, dessen Gläubiger sie sind, nach § 19 Abs. 3 UmwG als bekannt gemacht gilt, ihren Anspruch nach Grund und Höhe in Textform anmelden, Sicherheit zu leisten, soweit sie nicht Befriedigung verlangen können. Dieses Recht steht den Gläubigern jedoch nur zu, wenn sie glaubhaft machen, dass durch die Verschmelzung die Erfüllung ihrer Forderung gefährdet wird."
    },
    {
      "date": "2025-12-16",
      "id": "140053",
      "original_text": "Löschungsankündigung\nBayern Amtsgericht Regensburg HRA 7675\nZERA GmbH & Co. KG – Regensburg",
      "type": "Löschungsankündigung",
      "state": "Bayern",
      "amtsgericht": "Amtsgericht Regensburg",
      "registernummer": "HRA 7675",
      "registerart": "HRA",
      "company_name": "ZERA GmbH & Co. KG",
      "company_seat": "Regensburg",
      "details": "16.12.2025 (Bekanntmachungsdatum)\n\nBayern Amtsgericht Regensburg HRA 7675\nLöschungsankündigung\n\nZERA GmbH & Co. KG\nKommanditgesellschaft\nRegensburg\n\nDas Registergericht beabsichtigt, die im Handelsregister eingetragene Firma wegen Vermögenslosigkeit von Amts wegen nach § 394 FamFG zu löschen. Die Frist zur Erhebung eines Widerspruchs ist auf zwei Monate festgesetzt."
    },
    {
      "date": "2025-12-16",
      "id": "140054",
      "original_text": "Registerbekanntmachung nach dem Umwandlungsgesetz\nBayern Amtsgericht München HRB 188923\nClario Germany GmbH – München",
      "type": "Registerbekanntmachung nach dem Umwandlungsgesetz",
      "state": "Bayern",
      "amtsgericht": "Amtsgericht München",
      "registernummer": "HRB 188923",
      "registerart": "HRB",
      "company_name": "Clario Germany GmbH",
      "company_seat": "München",
      "details": "16.12.2025 (Bekanntmachungsdatum)\n\nBayern Amtsgericht München HRB 188923\nRegisterbekanntmachung nach dem Umwandlungsgesetz 12.12.2025 (Eintragungsdatum)\n\nClario Germany GmbH\nGesellschaft mit beschränkter Haftung\nMünchen\n\nDen Gläubigern der an der Verschmelzung beteiligten Rechtsträger ist, wenn sie binnen sechs Monaten nach dem Tag, an dem die Eintragung der Verschmelzung in das Register des Sitzes desjenigen Rechtsträgers, dessen Gläubiger sie sind, nach § 19 Abs. 3 UmwG als bekannt gemacht gilt, ihren Anspruch nach Grund und Höhe in Textform anmelden, Sicherheit zu leisten, soweit sie nicht Befriedigung verlangen können. Dieses Recht steht den Gläubigern jedoch nur zu, wenn sie glaubhaft machen, dass durch die Verschmelzung die Erfüllung ihrer Forderung gefährdet wird."
    },
    {
      "date": "2025-12-16",
      "id": "140055",
      "original_text": "Registerbekanntmachung nach dem Umwandlungsgesetz\nBayern Amtsgericht München HRB 208675\nZEDORA 118 Verwaltung GmbH – München",
      "type": "Registerbekanntmachung nach dem Umwandlungsgesetz",
      "state": "Bayern",
      "amtsgericht": "Amtsgericht München",
      "registernummer": "HRB 208675",
      "registerart": "HRB",
      "company_name": "ZEDORA 118 Verwaltung GmbH",
      "company_seat": "München",
      "details": "16.12.2025 (Bekanntmachungsdatum)\n\nBayern Amtsgericht München HRB 208675\nRegisterbekanntmachung nach dem Umwandlungsgesetz 15.12.2025 (Eintragungsdatum)\n\nZEDORA 118 Verwaltung GmbH\nGesellschaft mit beschränkter Haftung\nMünchen\n\nDen Gläubigern der an der Verschmelzung beteiligten Rechtsträger ist, wenn sie binnen sechs Monaten nach dem Tag, an dem die Eintragung der Verschmelzung in das Register des Sitzes desjenigen Rechtsträgers, dessen Gläubiger sie sind, nach § 19 Abs. 3 UmwG als bekannt gemacht gilt, ihren Anspruch nach Grund und Höhe in Textform anmelden, Sicherheit zu leisten, soweit sie nicht Befriedigung verlangen können. Dieses Recht steht den Gläubigern jedoch nur zu, wenn sie glaubhaft machen, dass durch die Verschmelzung die Erfüllung ihrer Forderung gefährdet wird."
    },
    {
      "date": "2025-12-16",
      "id": "140056",
      "original_text": "Registerbekanntmachung nach dem Umwandlungsgesetz\nBayern Amtsgericht München HRB 304828\nWiese Dental Beratungs GmbH – München",
      "type": "Registerbekanntmachung nach dem Umwandlungsgesetz",
      "state": "Bayern",
      "amtsgericht": "Amtsgericht München",
      "registernummer": "HRB 304828",
      "registerart": "HRB",
      "company_name": "Wiese Dental Beratungs GmbH",
      "company_seat": "München",
      "details": "16.12.2025 (Bekanntmachungsdatum)\n\nBayern Amtsgericht München HRB 304828\nRegisterbekanntmachung nach dem Umwandlungsgesetz 12.12.2025 (Eintragungsdatum)\n\nWiese Dental Beratungs GmbH\nGesellschaft mit beschränkter Haftung\nMünchen\n\nDen Gläubigern der an der Ausgliederung beteiligten Rechtsträger ist, wenn sie binnen sechs Monaten nach dem Tag, an dem die Eintragung der Ausgliederung in das Register des Sitzes desjenigen Rechtsträgers, dessen Gläubiger sie sind, nach §§ 125, 19 Abs. 3 UmwG als bekannt gemacht gilt, ihren Anspruch nach Grund und Höhe in Textform anmelden, Sicherheit zu leisten, soweit sie nicht Befriedigung verlangen können. Dieses Recht steht den Gläubigern jedoch nur zu, wenn sie glaubhaft machen, dass durch die Ausgliederung die Erfüllung ihrer Forderung gefährdet wird."
    },
    {
      "date": "2025-12-16",
      "id": "140057",
      "original_text": "Löschungsankündigung\nBayern Amtsgericht München HRB 164737\nArrivée AG – München",
      "type": "Löschungsankündigung",
      "state": "Bayern",
      "amtsgericht": "Amtsgericht München",
      "registernummer": "HRB 164737",
      "registerart": "HRB",
      "company_name": "Arrivée AG",
      "company_seat": "München",
      "details": "16.12.2025 (Bekanntmachungsdatum)\n\nBayern Amtsgericht München HRB 164737\nLöschungsankündigung 03.12.2025 (Eintragungsdatum)\n\nArrivée AG\nAktiengesellschaft\nMünchen\n\nDas Registergericht beabsichtigt, die im Handelsregister eingetragene Gesellschaft wegen Vermögenslosigkeit von Amts wegen nach § 394 FamFG zu löschen. Die Frist zur Erhebung eines Widerspruchs ist auf drei Monate festgesetzt."
    },
    {
      "date": "2025-12-16",
      "id": "140058",
      "original_text": "Registerbekanntmachung nach dem Umwandlungsgesetz\nBayern Amtsgericht München HRA 67435\nMUC SERVICE-CENTER Gebäudedienstleistungs GmbH & Co. KG – Neufahrn-Mintraching",
      "type": "Registerbekanntmachung nach dem Umwandlungsgesetz",
      "state": "Bayern",
      "amtsgericht": "Amtsgericht München",
      "registernummer": "HRA 67435",
      "registerart": "HRA",
      "company_name": "MUC SERVICE-CENTER Gebäudedienstleistungs GmbH & Co. KG",
      "company_seat": "Neufahrn-Mintraching",
      "details": "16.12.2025 (Bekanntmachungsdatum)\n\nBayern Amtsgericht München HRA 67435\nRegisterbekanntmachung nach dem Umwandlungsgesetz 15.12.2025 (Eintragungsdatum)\n\nMUC SERVICE-CENTER Gebäudedienstleistungs GmbH & Co. KG\nKommanditgesellschaft\nNeufahrn-Mintraching\n\nDen Gläubigern der an der Verschmelzung beteiligten Rechtsträger ist, wenn sie binnen sechs Monaten nach dem Tag, an dem die Eintragung der Verschmelzung in das Register des Sitzes desjenigen Rechtsträgers, dessen Gläubiger sie sind, nach § 19 Abs. 3 UmwG als bekannt gemacht gilt, ihren Anspruch nach Grund und Höhe in Textform anmelden, Sicherheit zu leisten, soweit sie nicht Befriedigung verlangen können. Dieses Recht steht den Gläubigern jedoch nur zu, wenn sie glaubhaft machen, dass durch die Verschmelzung die Erfüllung ihrer Forderung gefährdet wird."
    },
    {
      "date": "2025-12-16",
      "id": "140059",
      "original_text": "Registerbekanntmachung nach dem Umwandlungsgesetz\nBayern Amtsgericht Memmingen HRB 21712\nAugust Invest GmbH – Jettingen-Scheppach",
      "type": "Registerbekanntmachung nach dem Umwandlungsgesetz",
      "state": "Bayern",
      "amtsgericht": "Amtsgericht Memmingen",
      "registernummer": "HRB 21712",
      "registerart": "HRB",
      "company_name": "August Invest GmbH",
      "company_seat": "Jettingen-Scheppach",
      "details": "16.12.2025 (Bekanntmachungsdatum)\n\nBayern Amtsgericht Memmingen HRB 21712\nRegisterbekanntmachung nach dem Umwandlungsgesetz 15.12.2025 (Eintragungsdatum)\n\nAugust Invest GmbH\nGesellschaft mit beschränkter Haftung\nJettingen-Scheppach\n\nDen Gläubigern der an der Verschmelzung beteiligten Rechtsträger ist, wenn sie binnen sechs Monaten nach dem Tag, an dem die Eintragung der Verschmelzung in das Register des Sitzes desjenigen Rechtsträgers, dessen Gläubiger sie sind, nach § 19 Abs. 3 UmwG als bekannt gemacht gilt, ihren Anspruch nach Grund und Höhe in Textform anmelden, Sicherheit zu leisten, soweit sie nicht Befriedigung verlangen können. Dieses Recht steht den Gläubigern jedoch nur zu, wenn sie glaubhaft machen, dass durch die Verschmelzung die Erfüllung ihrer Forderung gefährdet wird."
    },
    {
      "date": "2025-12-16",
      "id": "140060",
      "original_text": "Registerbekanntmachung nach dem Umwandlungsgesetz\nBayern Amtsgericht Hof HRB 7187\nLinseis Holding GmbH – Selb",
      "type": "Registerbekanntmachung nach dem Umwandlungsgesetz",
      "state": "Bayern",
      "amtsgericht": "Amtsgericht Hof",
      "registernummer": "HRB 7187",
      "registerart": "HRB",
      "company_name": "Linseis Holding GmbH",
      "company_seat": "Selb",
      "details": "16.12.2025 (Bekanntmachungsdatum)\n\nBayern Amtsgericht Hof HRB 7187\nRegisterbekanntmachung nach dem Umwandlungsgesetz 15.12.2025 (Eintragungsdatum)\n\nLinseis Holding GmbH\nGesellschaft mit beschränkter Haftung\nSelb\n\nDen Gläubigern der an der Verschmelzung beteiligten Rechtsträger ist, wenn sie binnen sechs Monaten nach dem Tag, an dem die Eintragung der Verschmelzung in das Register des Sitzes desjenigen Rechtsträgers, dessen Gläubiger sie sind, nach § 19 Abs. 3 UmwG als bekannt gemacht gilt, ihren Anspruch nach Grund und Höhe in Textform anmelden, Sicherheit zu leisten, soweit sie nicht Befriedigung verlangen können. Dieses Recht steht den Gläubigern jedoch nur zu, wenn sie glaubhaft machen, dass durch die Verschmelzung die Erfüllung ihrer Forderung gefährdet wird."
    },
    {
      "date": "2025-12-16",
      "id": "140061",
      "original_text": "Einreichung neuer Dokumente\nBayern Amtsgericht Schweinfurt HRB 5\nSKF GmbH – Schweinfurt",
      "type": "Einreichung neuer Dokumente",
      "state": "Bayern",
      "amtsgericht": "Amtsgericht Schweinfurt",
      "registernummer": "HRB 5",
      "registerart": "HRB",
      "company_name": "SKF GmbH",
      "company_seat": "Schweinfurt",
      "details": "16.12.2025 (Bekanntmachungsdatum)\n\nBayern Amtsgericht Schweinfurt HRB 5\nEinreichung neuer Dokumente 15.12.2025 (Eintragungsdatum)\n\nSKF GmbH\nGesellschaft mit beschränkter Haftung\nSchweinfurt\n\nDem Amtsgericht Schweinfurt -Registergericht- ist eine Liste der Mitglieder des Aufsichtsrats eingereicht worden, § 52 Abs. 3 S. 2 GmbHG."
    },
    {
      "date": "2025-12-16",
      "id": "140062",
      "original_text": "Registerbekanntmachung nach dem Umwandlungsgesetz\nBayern Amtsgericht München HRB 219024\nBlockalarm Service UG (haftungsbeschränkt) – Dachau",
      "type": "Registerbekanntmachung nach dem Umwandlungsgesetz",
      "state": "Bayern",
      "amtsgericht": "Amtsgericht München",
      "registernummer": "HRB 219024",
      "registerart": "HRB",
      "company_name": "Blockalarm Service UG (haftungsbeschränkt)",
      "company_seat": "Dachau",
      "details": "16.12.2025 (Bekanntmachungsdatum)\n\nBayern Amtsgericht München HRB 219024\nRegisterbekanntmachung nach dem Umwandlungsgesetz 12.12.2025 (Eintragungsdatum)\n\nBlockalarm Service UG (haftungsbeschränkt)\nGesellschaft mit beschränkter Haftung\nDachau\n\nDen Gläubigern der an der Verschmelzung beteiligten Rechtsträger ist, wenn sie binnen sechs Monaten nach dem Tag, an dem die Eintragung der Verschmelzung in das Register des Sitzes desjenigen Rechtsträgers, dessen Gläubiger sie sind, nach § 19 Abs. 3 UmwG als bekannt gemacht gilt, ihren Anspruch nach Grund und Höhe in Textform anmelden, Sicherheit zu leisten, soweit sie nicht Befriedigung verlangen können. Dieses Recht steht den Gläubigern jedoch nur zu, wenn sie glaubhaft machen, dass durch die Verschmelzung die Erfüllung ihrer Forderung gefährdet wird."
    },
    {
      "date": "2025-12-16",
      "id": "140063",
      "original_text": "Löschungsankündigung\nBayern Amtsgericht München HRB 269936\nSolemare UG (haftungsbeschränkt) – München",
      "type": "Löschungsankündigung",
      "state": "Bayern",
      "amtsgericht": "Amtsgericht München",
      "registernummer": "HRB 269936",
      "registerart": "HRB",
      "company_name": "Solemare UG (haftungsbeschränkt)",
      "company_seat": "München",
      "details": "16.12.2025 (Bekanntmachungsdatum)\n\nBayern Amtsgericht München HRB 269936\nLöschungsankündigung 05.12.2025 (Eintragungsdatum)\n\nSolemare UG (haftungsbeschränkt)\nGesellschaft mit beschränkter Haftung\nMünchen\n\nDas Registergericht beabsichtigt, die im Handelsregister eingetragene Gesellschaft wegen Vermögenslosigkeit von Amts wegen nach § 394 FamFG zu löschen. Die Frist zur Erhebung eines Widerspruchs ist auf drei Monate festgesetzt."
    },
    {
      "date": "2025-12-16",
      "id": "140064",
      "original_text": "Registerbekanntmachung nach dem Umwandlungsgesetz\nBayern Amtsgericht München HRB 237104\nELT AcquiCo GmbH – Puchheim",
      "type": "Registerbekanntmachung nach dem Umwandlungsgesetz",
      "state": "Bayern",
      "amtsgericht": "Amtsgericht München",
      "registernummer": "HRB 237104",
      "registerart": "HRB",
      "company_name": "ELT AcquiCo GmbH",
      "company_seat": "Puchheim",
      "details": "16.12.2025 (Bekanntmachungsdatum)\n\nBayern Amtsgericht München HRB 237104\nRegisterbekanntmachung nach dem Umwandlungsgesetz 12.12.2025 (Eintragungsdatum)\n\nELT AcquiCo GmbH\nGesellschaft mit beschränkter Haftung\nPuchheim\n\nDen Gläubigern der an der Verschmelzung beteiligten Rechtsträger ist, wenn sie binnen sechs Monaten nach dem Tag, an dem die Eintragung der Verschmelzung in das Register des Sitzes desjenigen Rechtsträgers, dessen Gläubiger sie sind, nach § 19 Abs. 3 UmwG als bekannt gemacht gilt, ihren Anspruch nach Grund und Höhe in Textform anmelden, Sicherheit zu leisten, soweit sie nicht Befriedigung verlangen können. Dieses Recht steht den Gläubigern jedoch nur zu, wenn sie glaubhaft machen, dass durch die Verschmelzung die Erfüllung ihrer Forderung gefährdet wird."
    },
    {
      "date": "2025-12-16",
      "id": "140065",
      "original_text": "Löschungsankündigung\nBayern Amtsgericht Schweinfurt HRB 7015\nEWAN Europe GmbH – Schweinfurt",
      "type": "Löschungsankündigung",
      "state": "Bayern",
      "amtsgericht": "Amtsgericht Schweinfurt",
      "registernummer": "HRB 7015",
      "registerart": "HRB",
      "company_name": "EWAN Europe GmbH",
      "company_seat": "Schweinfurt",
      "details": "16.12.2025 (Bekanntmachungsdatum)\n\nBayern Amtsgericht Schweinfurt HRB 7015\nLöschungsankündigung 12.12.2025 (Eintragungsdatum)\n\nEWAN Europe GmbH\nGesellschaft mit beschränkter Haftung\nSchweinfurt\n\nDas Registergericht beabsichtigt, die im Handelsregister eingetragene Gesellschaft wegen Vermögenslosigkeit von Amts wegen nach § 394 FamFG zu löschen. Die Frist zur Erhebung eines Widerspruchs ist auf einen Monat festgesetzt."
    },
    {
      "date": "2025-12-16",
      "id": "140066",
      "original_text": "Registerbekanntmachung nach dem Umwandlungsgesetz\nBayern Amtsgericht München HRB 230727\nAFINUM Achte Verwaltungs GmbH – München",
      "type": "Registerbekanntmachung nach dem Umwandlungsgesetz",
      "state": "Bayern",
      "amtsgericht": "Amtsgericht München",
      "registernummer": "HRB 230727",
      "registerart": "HRB",
      "company_name": "AFINUM Achte Verwaltungs GmbH",
      "company_seat": "München",
      "details": "16.12.2025 (Bekanntmachungsdatum)\n\nBayern Amtsgericht München HRB 230727\nRegisterbekanntmachung nach dem Umwandlungsgesetz 12.12.2025 (Eintragungsdatum)\n\nAFINUM Achte Verwaltungs GmbH\nGesellschaft mit beschränkter Haftung\nMünchen\n\nDen Gläubigern der an der Verschmelzung beteiligten Rechtsträger ist, wenn sie binnen sechs Monaten nach dem Tag, an dem die Eintragung der Verschmelzung in das Register des Sitzes desjenigen Rechtsträgers, dessen Gläubiger sie sind, nach § 19 Abs. 3 UmwG als bekannt gemacht gilt, ihren Anspruch nach Grund und Höhe in Textform anmelden, Sicherheit zu leisten, soweit sie nicht Befriedigung verlangen können. Dieses Recht steht den Gläubigern jedoch nur zu, wenn sie glaubhaft machen, dass durch die Verschmelzung die Erfüllung ihrer Forderung gefährdet wird."
    },
    {
      "date": "2025-12-16",
      "id": "140067",
      "original_text": "Einreichung neuer Dokumente\nBayern Amtsgericht Fürth HRB 6485\nARA GmbH Auto und Reise ASSISTANCE – Bad Windsheim",
      "type": "Einreichung neuer Dokumente",
      "state": "Bayern",
      "amtsgericht": "Amtsgericht Fürth",
      "registernummer": "HRB 6485",
      "registerart": "HRB",
      "company_name": "ARA GmbH Auto und Reise ASSISTANCE",
      "company_seat": "Bad Windsheim",
      "details": "16.12.2025 (Bekanntmachungsdatum)\n\nBayern Amtsgericht Fürth HRB 6485\nEinreichung neuer Dokumente\n\nARA GmbH Auto und Reise ASSISTANCE\nGesellschaft mit beschränkter Haftung\nBad Windsheim\n\nDem Amtsgericht Fürth -Registergericht- ist eine Liste der Mitglieder des Aufsichtsrats eingereicht worden, § 52 Abs. 3 S. 2 GmbHG."
    },
    {
      "date": "2025-12-16",
      "id": "140068",
      "original_text": "Löschungsankündigung\nBayern Amtsgericht Ingolstadt HRA 3319\nLS Wohnbaugesellschaft mbH & Co. KG – Ingolstadt",
      "type": "Löschungsankündigung",
      "state": "Bayern",
      "amtsgericht": "Amtsgericht Ingolstadt",
      "registernummer": "HRA 3319",
      "registerart": "HRA",
      "company_name": "LS Wohnbaugesellschaft mbH & Co. KG",
      "company_seat": "Ingolstadt",
      "details": "16.12.2025 (Bekanntmachungsdatum)\n\nBayern Amtsgericht Ingolstadt HRA 3319\nLöschungsankündigung\n\nLS Wohnbaugesellschaft mbH & Co. KG\nKommanditgesellschaft\nIngolstadt\n\nDas Registergericht beabsichtigt, die im Handelsregister eingetragene Gesellschaft wegen Vermögenslosigkeit von Amts wegen nach § 394 FamFG zu löschen. Die Frist zur Erhebung eines Widerspruchs ist auf einen Monat festgesetzt."
    },
    {
      "date": "2025-12-16",
      "id": "140069",
      "original_text": "Registerbekanntmachung nach dem Umwandlungsgesetz\nBayern Amtsgericht Landshut HRA 12903\nAlexander Brunhuber e.K. – Eggenfelden",
      "type": "Registerbekanntmachung nach dem Umwandlungsgesetz",
      "state": "Bayern",
      "amtsgericht": "Amtsgericht Landshut",
      "registernummer": "HRA 12903",
      "registerart": "HRA",
      "company_name": "Alexander Brunhuber e.K.",
      "company_seat": "Eggenfelden",
      "details": "16.12.2025 (Bekanntmachungsdatum)\n\nBayern Amtsgericht Landshut HRA 12903\nRegisterbekanntmachung nach dem Umwandlungsgesetz 15.12.2025 (Eintragungsdatum)\n\nAlexander Brunhuber e.K.\nEinzelkaufmann / Einzelkauffrau\nEggenfelden\n\nDen Gläubigern der an der Ausgliederung beteiligten Rechtsträger ist, wenn sie binnen sechs Monaten nach dem Tag, an dem die Eintragung der Ausgliederung in das Register des Sitzes desjenigen Rechtsträgers, dessen Gläubiger sie sind, nach §§ 125, 19 Abs. 3 UmwG als bekannt gemacht gilt, ihren Anspruch nach Grund und Höhe in Textform anmelden, Sicherheit zu leisten, soweit sie nicht Befriedigung verlangen können. Dieses Recht steht den Gläubigern jedoch nur zu, wenn sie glaubhaft machen, dass durch die Ausgliederung die Erfüllung ihrer Forderung gefährdet wird."
    },
    {
      "date": "2025-12-16",
      "id": "140070",
      "original_text": "Registerbekanntmachung nach dem Umwandlungsgesetz\nBayern Amtsgericht München HRB 275386\nPCT Ventures UG (haftungsbeschränkt) – München",
      "type": "Registerbekanntmachung nach dem Umwandlungsgesetz",
      "state": "Bayern",
      "amtsgericht": "Amtsgericht München",
      "registernummer": "HRB 275386",
      "registerart": "HRB",
      "company_name": "PCT Ventures UG (haftungsbeschränkt)",
      "company_seat": "München",
      "details": "16.12.2025 (Bekanntmachungsdatum)\n\nBayern Amtsgericht München HRB 275386\nRegisterbekanntmachung nach dem Umwandlungsgesetz 15.12.2025 (Eintragungsdatum)\n\nPCT Ventures UG (haftungsbeschränkt)\nGesellschaft mit beschränkter Haftung\nMünchen\n\nDen Gläubigern der an der Verschmelzung beteiligten Rechtsträger ist, wenn sie binnen sechs Monaten nach dem Tag, an dem die Eintragung der Verschmelzung in das Register des Sitzes desjenigen Rechtsträgers, dessen Gläubiger sie sind, nach § 19 Abs. 3 UmwG als bekannt gemacht gilt, ihren Anspruch nach Grund und Höhe in Textform anmelden, Sicherheit zu leisten, soweit sie nicht Befriedigung verlangen können. Dieses Recht steht den Gläubigern jedoch nur zu, wenn sie glaubhaft machen, dass durch die Verschmelzung die Erfüllung ihrer Forderung gefährdet wird."
    },
    {
      "date": "2025-12-16",
      "id": "140071",
      "original_text": "Registerbekanntmachung nach dem Umwandlungsgesetz\nBayern Amtsgericht Ansbach HRB 3953\nAuto Bierschneider GmbH – Weißenburg i. Bay.",
      "type": "Registerbekanntmachung nach dem Umwandlungsgesetz",
      "state": "Bayern",
      "amtsgericht": "Amtsgericht Ansbach",
      "registernummer": "HRB 3953",
      "registerart": "HRB",
      "company_name": "Auto Bierschneider GmbH",
      "company_seat": "Weißenburg i. Bay.",
      "details": "16.12.2025 (Bekanntmachungsdatum)\n\nBayern Amtsgericht Ansbach HRB 3953\nRegisterbekanntmachung nach dem Umwandlungsgesetz 15.12.2025 (Eintragungsdatum)\n\nAuto Bierschneider GmbH\nGesellschaft mit beschränkter Haftung\nWeißenburg i. Bay.\n\nDen Gläubigern der an der Spaltung beteiligten Rechtsträger ist, wenn sie binnen sechs Monaten nach dem Tag, an dem die Eintragung der Spaltung in das Register des Sitzes desjenigen Rechtsträgers, dessen Gläubiger sie sind, nach §§ 125, 19 Abs. 3 UmwG als bekannt gemacht gilt, ihren Anspruch nach Grund und Höhe in Textform anmelden, Sicherheit zu leisten, soweit sie nicht Befriedigung verlangen können. Dieses Recht steht den Gläubigern jedoch nur zu, wenn sie glaubhaft machen, dass durch die Spaltung die Erfüllung ihrer Forderung gefährdet wird."
    },
    {
      "date": "2025-12-16",
      "id": "140072",
      "original_text": "Registerbekanntmachung nach dem Umwandlungsgesetz\nBayern Amtsgericht Hof HRB 2447\nLinseis Beteiligungs-Gesellschaft mit beschränkter Haftung – Selb",
      "type": "Registerbekanntmachung nach dem Umwandlungsgesetz",
      "state": "Bayern",
      "amtsgericht": "Amtsgericht Hof",
      "registernummer": "HRB 2447",
      "registerart": "HRB",
      "company_name": "Linseis Beteiligungs-Gesellschaft mit beschränkter Haftung",
      "company_seat": "Selb",
      "details": "16.12.2025 (Bekanntmachungsdatum)\n\nBayern Amtsgericht Hof HRB 2447\nRegisterbekanntmachung nach dem Umwandlungsgesetz 15.12.2025 (Eintragungsdatum)\n\nLinseis Beteiligungs-Gesellschaft mit beschränkter Haftung\nGesellschaft mit beschränkter Haftung\nSelb\n\nDen Gläubigern der an der Verschmelzung beteiligten Rechtsträger ist, wenn sie binnen sechs Monaten nach dem Tag, an dem die Eintragung der Verschmelzung in das Register des Sitzes desjenigen Rechtsträgers, dessen Gläubiger sie sind, nach § 19 Abs. 3 UmwG als bekannt gemacht gilt, ihren Anspruch nach Grund und Höhe in Textform anmelden, Sicherheit zu leisten, soweit sie nicht Befriedigung verlangen können. Dieses Recht steht den Gläubigern jedoch nur zu, wenn sie glaubhaft machen, dass durch die Verschmelzung die Erfüllung ihrer Forderung gefährdet wird."
    },
    {
      "date": "2025-12-16",
      "id": "140073",
      "original_text": "Registerbekanntmachung nach dem Umwandlungsgesetz\nBayern Amtsgericht Memmingen HRB 20076\nSK Investment SE – Jettingen-Scheppach",
      "type": "Registerbekanntmachung nach dem Umwandlungsgesetz",
      "state": "Bayern",
      "amtsgericht": "Amtsgericht Memmingen",
      "registernummer": "HRB 20076",
      "registerart": "HRB",
      "company_name": "SK Investment SE",
      "company_seat": "Jettingen-Scheppach",
      "details": "16.12.2025 (Bekanntmachungsdatum)\n\nBayern Amtsgericht Memmingen HRB 20076\nRegisterbekanntmachung nach dem Umwandlungsgesetz 15.12.2025 (Eintragungsdatum)\n\nSK Investment SE\nEuropäische Aktiengesellschaft (SE)\nJettingen-Scheppach\n\nDen Gläubigern der an der Verschmelzung beteiligten Rechtsträger ist, wenn sie binnen sechs Monaten nach dem Tag, an dem die Eintragung der Verschmelzung in das Register des Sitzes desjenigen Rechtsträgers, dessen Gläubiger sie sind, nach § 19 Abs. 3 UmwG als bekannt gemacht gilt, ihren Anspruch nach Grund und Höhe in Textform anmelden, Sicherheit zu leisten, soweit sie nicht Befriedigung verlangen können. Dieses Recht steht den Gläubigern jedoch nur zu, wenn sie glaubhaft machen, dass durch die Verschmelzung die Erfüllung ihrer Forderung gefährdet wird."
    },
    {
      "date": "2025-12-16",
      "id": "140074",
      "original_text": "Löschungsankündigung\nBerlin Amtsgericht Berlin (Charlottenburg) HRB 102423\nFI factura invest GmbH – Berlin",
      "type": "Löschungsankündigung",
      "state": "Berlin",
      "amtsgericht": "Amtsgericht Berlin (Charlottenburg)",
      "registernummer": "HRB 102423",
      "registerart": "HRB",
      "company_name": "FI factura invest GmbH",
      "company_seat": "Berlin",
      "details": "16.12.2025 (Bekanntmachungsdatum)\n\nBerlin Amtsgericht Berlin (Charlottenburg) HRB 102423\nLöschungsankündigung\n\nFI factura invest GmbH\nGesellschaft mit beschränkter Haftung\nBerlin\n\nBei der nachstehenden Gesellschaft wird das Amtslöschungsverfahren gemäß § 394 FamFG eingeleitet. Widerspruchsfrist\n6 Wochen."
    },
    {
      "date": "2025-12-16",
      "id": "140075",
      "original_text": "Registerbekanntmachung nach dem Umwandlungsgesetz\nBaden-Württemberg Amtsgericht Mannheim HRB 720921\nL&D vdB Verwaltung GmbH – Kraichtal",
      "type": "Registerbekanntmachung nach dem Umwandlungsgesetz",
      "state": "Baden-Württemberg",
      "amtsgericht": "Amtsgericht Mannheim",
      "registernummer": "HRB 720921",
      "registerart": "HRB",
      "company_name": "L&D vdB Verwaltung GmbH",
      "company_seat": "Kraichtal",
      "details": "16.12.2025 (Bekanntmachungsdatum)\n\nBaden-Württemberg Amtsgericht Mannheim HRB 720921\nRegisterbekanntmachung nach dem Umwandlungsgesetz 16.12.2025 (Eintragungsdatum)\n\nL&D vdB Verwaltung GmbH\nGesellschaft mit beschränkter Haftung\nKraichtal\n\nAls nicht eingetragen wird bekanntgemacht:\nDen Gläubigern der an der Verschmelzung beteiligten Rechtsträger ist, wenn sie binnen sechs Monaten nach dem Tag, an dem die Eintragung der Verschmelzung in das Register des Sitzes desjenigen Rechtsträgers, dessen Gläubiger sie sind, nach § 19 Abs. 3 UmwG als bekanntgemacht gilt, ihren Anspruch nach Grund und Höhe schriftlich anmelden, Sicherheit zu leisten, soweit sie nicht Befriedigung verlangen können. Dieses Recht steht den Gläubigern jedoch nur zu, wenn sie glaubhaft machen, dass durch die Verschmelzung die Erfüllung ihrer Forderung gefährdet wird."
    },
    {
      "date": "2025-12-16",
      "id": "140076",
      "original_text": "Registerbekanntmachung nach dem Umwandlungsgesetz\nHamburg Amtsgericht Hamburg HRB 183504\nActure Germany GmbH – Hamburg",
      "type": "Registerbekanntmachung nach dem Umwandlungsgesetz",
      "state": "Hamburg",
      "amtsgericht": "Amtsgericht Hamburg",
      "registernummer": "HRB 183504",
      "registerart": "HRB",
      "company_name": "Acture Germany GmbH",
      "company_seat": "Hamburg",
      "details": "16.12.2025 (Bekanntmachungsdatum)\n\nHamburg Amtsgericht Hamburg HRB 183504\nRegisterbekanntmachung nach dem Umwandlungsgesetz 10.12.2025 (Eintragungsdatum)\n\nActure Germany GmbH\nGesellschaft mit beschränkter Haftung\nHamburg\n\nAls nicht eingetragen wird bekannt gemacht:\nDen Gläubigern der an der Verschmelzung beteiligten Gesellschaften ist, wenn sie binnen sechs Monaten nach dem Tag, an dem die Eintragung der Verschmelzung in das Register des Sitzes desjenigen Rechtsträgers, dessen Gläubiger sie sind, nach § 19 Absatz 3 UmwG als bekannt gemacht gilt, ihren Anspruch nach Grund und Höhe schriftlich anmelden, Sicherheit zu leisten, soweit sie nicht Befriedigung verlangen können. Dieses Recht steht den Gläubigern jedoch nur zu, wenn sie glaubhaft machen, dass durch die Verschmelzung die Erfüllung ihrer Forderung gefährdet wird."
    },
    {
      "date": "2025-12-16",
      "id": "140077",
      "original_text": "Registerbekanntmachung nach dem Umwandlungsgesetz\nHamburg Amtsgericht Hamburg HRB 142983\nmove UP Gesellschaft für Gesundheitsmanagement mbH – Hamburg",
      "type": "Registerbekanntmachung nach dem Umwandlungsgesetz",
      "state": "Hamburg",
      "amtsgericht": "Amtsgericht Hamburg",
      "registernummer": "HRB 142983",
      "registerart": "HRB",
      "company_name": "move UP Gesellschaft für Gesundheitsmanagement mbH",
      "company_seat": "Hamburg",
      "details": "16.12.2025 (Bekanntmachungsdatum)\n\nHamburg Amtsgericht Hamburg HRB 142983\nRegisterbekanntmachung nach dem Umwandlungsgesetz 10.12.2025 (Eintragungsdatum)\n\nmove UP Gesellschaft für Gesundheitsmanagement mbH\nGesellschaft mit beschränkter Haftung\nHamburg\n\nAls nicht eingetragen wird bekannt gemacht:\nDen Gläubigern der an der Verschmelzung beteiligten Gesellschaften ist, wenn sie binnen sechs Monaten nach dem Tag, an dem die Eintragung der Verschmelzung in das Register des Sitzes desjenigen Rechtsträgers, dessen Gläubiger sie sind, nach § 19 Absatz 3 UmwG als bekannt gemacht gilt, ihren Anspruch nach Grund und Höhe schriftlich anmelden, Sicherheit zu leisten, soweit sie nicht Befriedigung verlangen können. Dieses Recht steht den Gläubigern jedoch nur zu, wenn sie glaubhaft machen, dass durch die Verschmelzung die Erfüllung ihrer Forderung gefährdet wird."
    },
    {
      "date": "2025-12-16",
      "id": "140078",
      "original_text": "Löschungsankündigung\nBerlin Amtsgericht Berlin (Charlottenburg) HRB 247938\nfangestate AG – Berlin",
      "type": "Löschungsankündigung",
      "state": "Berlin",
      "amtsgericht": "Amtsgericht Berlin (Charlottenburg)",
      "registernummer": "HRB 247938",
      "registerart": "HRB",
      "company_name": "fangestate AG",
      "company_seat": "Berlin",
      "details": "16.12.2025 (Bekanntmachungsdatum)\n\nBerlin Amtsgericht Berlin (Charlottenburg) HRB 247938\nLöschungsankündigung\n\nfangestate AG\nAktiengesellschaft\nBerlin\n\nBei der nachstehenden Gesellschaft wird das Amtslöschungsverfahren gemäß § 394 FamFG eingeleitet. Widerspruchsfrist 6 Wochen"
    },
    {
      "date": "2025-12-16",
      "id": "140079",
      "original_text": "Löschungsankündigung\nBerlin Amtsgericht Berlin (Charlottenburg) HRB 259315\nFreem Bau UG (haftungsbeschränkt) – Berlin",
      "type": "Löschungsankündigung",
      "state": "Berlin",
      "amtsgericht": "Amtsgericht Berlin (Charlottenburg)",
      "registernummer": "HRB 259315",
      "registerart": "HRB",
      "company_name": "Freem Bau UG (haftungsbeschränkt)",
      "company_seat": "Berlin",
      "details": "16.12.2025 (Bekanntmachungsdatum)\n\nBerlin Amtsgericht Berlin (Charlottenburg) HRB 259315\nLöschungsankündigung\n\nFreem Bau UG (haftungsbeschränkt)\nGesellschaft mit beschränkter Haftung\nBerlin\n\nBei der nachstehenden Gesellschaft wird das Amtslöschungsverfahren gemäß § 394 FamFG eingeleitet. Widerspruchsfrist 6 Wochen"
    },
    {
      "date": "2025-12-16",
      "id": "140080",
      "original_text": "Registerbekanntmachung nach dem Umwandlungsgesetz\nNordrhein-Westfalen Amtsgericht Coesfeld HRA 10187\nER Immobilien & Beteiligungs GmbH & Co KG – Borken",
      "type": "Registerbekanntmachung nach dem Umwandlungsgesetz",
      "state": "Nordrhein-Westfalen",
      "amtsgericht": "Amtsgericht Coesfeld",
      "registernummer": "HRA 10187",
      "registerart": "HRA",
      "company_name": "ER Immobilien & Beteiligungs GmbH & Co KG",
      "company_seat": "Borken",
      "details": "16.12.2025 (Bekanntmachungsdatum)\n\nNordrhein-Westfalen Amtsgericht Coesfeld HRA 10187\nRegisterbekanntmachung nach dem Umwandlungsgesetz 16.12.2025 (Eintragungsdatum)\n\nER Immobilien & Beteiligungs GmbH & Co KG\nKommanditgesellschaft\nBorken\n\nAls nicht eingetragen wird bekanntgemacht: Den Gläubigern der an der Ausgliederung beteiligten Rechtsträger ist, wenn sie binnen sechs Monaten nach dem Tag, an dem die Eintragung der Ausgliederung in das Register des Sitzes desjenigen Rechtsträgers, dessen Gläubiger sie sind, nach § 19 Absatz 3 UmwG als bekanntgemacht gilt, ihren Anspruch nach Grund und Höhe schriftlich anmelden, Sicherheit zu leisten, soweit sie nicht Befriedigung verlangen können. Dieses Recht steht den Gläubigern jedoch nur zu, wenn sie glaubhaft machen, dass durch die Ausgliederung die Erfüllung ihrer Forderung gefährdet wird. Das Recht, Sicherheitsleistung zu verlangen, steht Gläubigern nicht zu, die im Fall des Insolvenzverfahrens ein Recht auf vorzugsweise Befriedigung aus einer Deckungsmasse haben, die nach gesetzlicher Vorschrift zu ihrem Schutz errichtet und staatlich überwacht ist."
    },
    {
      "date": "2025-12-16",
      "id": "140081",
      "original_text": "Sonstige Registerbekanntmachung\nBerlin Amtsgericht Berlin (Charlottenburg) HRB 135316\nPaul Messdienste GmbH – Berlin",
      "type": "Sonstige Registerbekanntmachung",
      "state": "Berlin",
      "amtsgericht": "Amtsgericht Berlin (Charlottenburg)",
      "registernummer": "HRB 135316",
      "registerart": "HRB",
      "company_name": "Paul Messdienste GmbH",
      "company_seat": "Berlin",
      "details": "16.12.2025 (Bekanntmachungsdatum)\n\nBerlin Amtsgericht Berlin (Charlottenburg) HRB 135316\nSonstige Registerbekanntmachung\n\nPaul Messdienste GmbH\nGesellschaft mit beschränkter Haftung\nBerlin\n\nAls nicht eingetragen wird veröffentlicht: Der andere Vertragsteil hat den Gläubigern dieses Rechtsträgers, deren Forderungen begründet worden sind, bevor die Eintragung der Beendigung dieses Vertrages in das Handelsregister nach § 10 des Handelsgesetzbuches als bekannt gemacht gilt, Sicherheit zu leisten, wenn sie sich binnen sechs Monaten nach der Bekanntmachung der Eintragung zu diesem Zweck bei ihm melden. Dieses Recht steht den Gläubigern nicht zu, die im Fall des Insolvenzverfahrens ein Recht auf vorzugsweise Befriedigung aus der Deckungsmasse haben, die nach gesetzlicher Vorschrift zu ihrem Schutz errichtet und staatlich überwacht ist."
    },
    {
      "date": "2025-12-16",
      "id": "140082",
      "original_text": "Registerbekanntmachung nach dem Umwandlungsgesetz\nSchleswig-Holstein Amtsgericht Kiel HRA 684\nHeinrich Knievel e. K. – Kiel",
      "type": "Registerbekanntmachung nach dem Umwandlungsgesetz",
      "state": "Schleswig-Holstein",
      "amtsgericht": "Amtsgericht Kiel",
      "registernummer": "HRA 684",
      "registerart": "HRA",
      "company_name": "Heinrich Knievel e. K.",
      "company_seat": "Kiel",
      "details": "16.12.2025 (Bekanntmachungsdatum)\n\nSchleswig-Holstein Amtsgericht Kiel HRA 684\nRegisterbekanntmachung nach dem Umwandlungsgesetz 12.12.2025 (Eintragungsdatum)\n\nHeinrich Knievel e. K.\nEinzelkaufmann / Einzelkauffrau\nKiel\n\nZu Eintragungsnummer 7 vom 12.12.2025 wird als nicht eingetragen veröffentlicht:  Den Gläubigern der an der Spaltung beteiligten Rechtsträger ist, wenn sie binnen sechs Monaten nach dem Tag, an dem die Eintragung der Spaltung in das Register des Sitzes desjenigen Rechtsträgers, dessen Gläubiger sie sind,  bekannt gemacht worden ist, ihren Anspruch nach Grund und Höhe schriftlich anmelden, Sicherheit zu leisten, soweit sie nicht Befriedigung verlangen können. Dieses Recht steht den Gläubigern jedoch nur zu, wenn sie glaubhaft machen, dass durch die Spaltung die Erfüllung ihrer Forderung gefährdet wird."
    },
    {
      "date": "2025-12-16",
      "id": "140083",
      "original_text": "Einreichung neuer Dokumente\nHamburg Amtsgericht Hamburg HRB 184136\nLion Sirius Management SE – Hamburg",
      "type": "Einreichung neuer Dokumente",
      "state": "Hamburg",
      "amtsgericht": "Amtsgericht Hamburg",
      "registernummer": "HRB 184136",
      "registerart": "HRB",
      "company_name": "Lion Sirius Management SE",
      "company_seat": "Hamburg",
      "details": "16.12.2025 (Bekanntmachungsdatum)\n\nHamburg Amtsgericht Hamburg HRB 184136\nEinreichung neuer Dokumente 16.12.2025 (Eintragungsdatum)\n\nLion Sirius Management SE\nEuropäische Aktiengesellschaft (SE)\nHamburg\n\nAls nicht eingetragen wird bekannt gemacht: Liste des Aufsichtsrats wurde eingereicht."
    },
    {
      "date": "2025-12-16",
      "id": "140084",
      "original_text": "Löschungsankündigung\nBaden-Württemberg Amtsgericht Freiburg HRB 722850\nLenzo Immobilien GmbH – Rheinfelden Baden",
      "type": "Löschungsankündigung",
      "state": "Baden-Württemberg",
      "amtsgericht": "Amtsgericht Freiburg",
      "registernummer": "HRB 722850",
      "registerart": "HRB",
      "company_name": "Lenzo Immobilien GmbH",
      "company_seat": "Rheinfelden Baden",
      "details": "16.12.2025 (Bekanntmachungsdatum)\n\nBaden-Württemberg Amtsgericht Freiburg HRB 722850\nLöschungsankündigung\n\nLenzo Immobilien GmbH\nGesellschaft mit beschränkter Haftung\nRheinfelden Baden\n\nAls nicht eingetragen wird bekanntgemacht:\nDas Gericht beabsichtigt, die Gesellschaft wegen Vermögenslosigkeit im Handelsregister von Amts wegen nach § 394 FamFG zu löschen. Die Frist zur Geltendmachung eines Widerspruchs gegen die beabsichtigte Löschung ist auf einen Monat ab Veröffentlichung bestimmt."
    },
    {
      "date": "2025-12-16",
      "id": "140085",
      "original_text": "Löschungsankündigung\nBerlin Amtsgericht Berlin (Charlottenburg) HRB 124819\nTekin-Bau GmbH – Berlin",
      "type": "Löschungsankündigung",
      "state": "Berlin",
      "amtsgericht": "Amtsgericht Berlin (Charlottenburg)",
      "registernummer": "HRB 124819",
      "registerart": "HRB",
      "company_name": "Tekin-Bau GmbH",
      "company_seat": "Berlin",
      "details": "16.12.2025 (Bekanntmachungsdatum)\n\nBerlin Amtsgericht Berlin (Charlottenburg) HRB 124819\nLöschungsankündigung\n\nTekin-Bau GmbH\nGesellschaft mit beschränkter Haftung\nBerlin\n\nBei der nachstehenden Gesellschaft wird das Amtslöschungsverfahren gemäß § 394 FamFG eingeleitet. Widerspruchsfrist 6 Wochen"
    },
    {
      "date": "2025-12-16",
      "id": "140086",
      "original_text": "Registerbekanntmachung nach dem Umwandlungsgesetz\nBerlin Amtsgericht Berlin (Charlottenburg) VR 36954\nVerein der Zuckerindustrie e. V. – Berlin",
      "type": "Registerbekanntmachung nach dem Umwandlungsgesetz",
      "state": "Berlin",
      "amtsgericht": "Amtsgericht Berlin (Charlottenburg)",
      "registernummer": "VR 36954",
      "registerart": "VR",
      "company_name": "Verein der Zuckerindustrie e. V.",
      "company_seat": "Berlin",
      "details": "16.12.2025 (Bekanntmachungsdatum)\n\nBerlin Amtsgericht Berlin (Charlottenburg) VR 36954\nRegisterbekanntmachung nach dem Umwandlungsgesetz 12.12.2025 (Eintragungsdatum)\n\nVerein der Zuckerindustrie e. V.\neingetragener Verein\nBerlin\n\nZu Eintragungsnummer 4 vom 12.12.2025 wird als nicht eingetragen veröffentlicht: Den Gläubigern der an der Spaltung beteiligten Rechtsträger ist, wenn sie binnen sechs Monaten nach dem Tag, an dem die Eintragung der Spaltung in das Register des Sitzes desjenigen Rechtsträgers, dessen Gläubiger sie sind, als bekannt gemacht gilt, ihren Anspruch nach Grund und Höhe schriftlich anmelden, Sicherheit zu leisten, soweit sie nicht Befriedigung verlangen können. Dieses Recht steht den Gläubigern jedoch nur zu, wenn sie glaubhaft machen, dass durch die Spaltung die Erfüllung ihrer Forderung gefährdet wird. Das Recht, Sicherheitsleistung zu verlangen, steht Gläubigern nicht zu, die im Falle der Insolvenz ein Recht auf vorzugsweise Befriedigung aus einer Deckungsmasse haben, die nach gesetzlicher Vorschrift zu ihrem Schutz errichtet und staatlich überwacht ist."
    },
    {
      "date": "2025-12-16",
      "id": "140087",
      "original_text": "Einreichung neuer Dokumente\nBerlin Amtsgericht Berlin (Charlottenburg) HRB 206804\nKISA Akademie GmbH – Berlin",
      "type": "Einreichung neuer Dokumente",
      "state": "Berlin",
      "amtsgericht": "Amtsgericht Berlin (Charlottenburg)",
      "registernummer": "HRB 206804",
      "registerart": "HRB",
      "company_name": "KISA Akademie GmbH",
      "company_seat": "Berlin",
      "details": "16.12.2025 (Bekanntmachungsdatum)\n\nBerlin Amtsgericht Berlin (Charlottenburg) HRB 206804\nEinreichung neuer Dokumente\n\nKISA Akademie GmbH\nGesellschaft mit beschränkter Haftung\nBerlin\n\nAls nicht eingetragen wird veröffentlicht: Es wurde eine neue Liste der Aufsichtsratsmitglieder eingereicht (§52 GmbHG)."
    },
    {
      "date": "2025-12-16",
      "id": "140088",
      "original_text": "Registerbekanntmachung nach dem Umwandlungsgesetz\nBrandenburg Amtsgericht Cottbus HRB 19274\nQuartier Beelitz-Heilstätten vierte Grundstücksgesellschaft mbH – Schönefeld",
      "type": "Registerbekanntmachung nach dem Umwandlungsgesetz",
      "state": "Brandenburg",
      "amtsgericht": "Amtsgericht Cottbus",
      "registernummer": "HRB 19274",
      "registerart": "HRB",
      "company_name": "Quartier Beelitz-Heilstätten vierte Grundstücksgesellschaft mbH",
      "company_seat": "Schönefeld",
      "details": "16.12.2025 (Bekanntmachungsdatum)\n\nBrandenburg Amtsgericht Cottbus HRB 19274\nRegisterbekanntmachung nach dem Umwandlungsgesetz 15.12.2025 (Eintragungsdatum)\n\nQuartier Beelitz-Heilstätten vierte Grundstücksgesellschaft mbH\nGesellschaft mit beschränkter Haftung\nSchönefeld\n\nZu Eintragungsnummer 1 vom 15.12.2025 wird als nicht eingetragen veröffentlicht:\nAls nicht eingetragen wird veröffentlicht:\nDen Gläubigern der an der Spaltung beteiligten Rechtsträger ist, wenn sie binnen sechs Monaten nach dem Tag, an dem die Eintragung der Spaltung in das Register des Sitzes desjenigen Rechtsträgers, dessen Gläubiger sie sind, als bekannt gemacht gilt, ihren Anspruch nach Grund und Höhe schriftlich anmelden, Sicherheit zu leisten, soweit sie nicht Befriedigung verlangen können. Dieses Recht steht den Gläubigern jedoch nur zu, wenn sie glaubhaft machen, dass durch die Spaltung die Erfüllung ihrer Forderung gefährdet wird"
    },
    {
      "date": "2025-12-16",
      "id": "140089",
      "original_text": "Registerbekanntmachung nach dem Umwandlungsgesetz\nBaden-Württemberg Amtsgericht Mannheim HRB 110429\nG.O. Duwensee & Partner GmbH – Durmersheim",
      "type": "Registerbekanntmachung nach dem Umwandlungsgesetz",
      "state": "Baden-Württemberg",
      "amtsgericht": "Amtsgericht Mannheim",
      "registernummer": "HRB 110429",
      "registerart": "HRB",
      "company_name": "G.O. Duwensee & Partner GmbH",
      "company_seat": "Durmersheim",
      "details": "16.12.2025 (Bekanntmachungsdatum)\n\nBaden-Württemberg Amtsgericht Mannheim HRB 110429\nRegisterbekanntmachung nach dem Umwandlungsgesetz 16.12.2025 (Eintragungsdatum)\n\nG.O. Duwensee & Partner GmbH\nGesellschaft mit beschränkter Haftung\nDurmersheim\n\nAls nicht eingetragen wird bekanntgemacht:\nDen Gläubigern der Gesellschaft, deren Forderungen begründet worden sind, bevor die Eintragung der Beendigung des Vertrages in das Handelsregister nach § 10 HGB als bekanntgemacht gilt, ist vom anderen Vertragsteil Sicherheit zu leisten, wenn sie sich binnen sechs Monaten nach der Bekanntmachung zu diesem Zweck bei ihm melden.\nDen Gläubigern der an der Verschmelzung beteiligten Rechtsträger ist, wenn sie binnen sechs Monaten nach dem Tag, an dem die Eintragung der Verschmelzung in das Register des Sitzes desjenigen Rechtsträgers, dessen Gläubiger sie sind, nach § 19 Abs. 3 UmwG als bekanntgemacht gilt, ihren Anspruch nach Grund und Höhe schriftlich anmelden, Sicherheit zu leisten, soweit sie nicht Befriedigung verlangen können. Dieses Recht steht den Gläubigern jedoch nur zu, wenn sie glaubhaft machen, dass durch die Verschmelzung die Erfüllung ihrer Forderung gefährdet wird."
    },
    {
      "date": "2025-12-16",
      "id": "140090",
      "original_text": "Einreichung neuer Dokumente\nSachsen-Anhalt Amtsgericht Stendal HRB 107049\nWolmirstedter Wohnungsbaugesellschaft mbH – Wolmirstedt",
      "type": "Einreichung neuer Dokumente",
      "state": "Sachsen-Anhalt",
      "amtsgericht": "Amtsgericht Stendal",
      "registernummer": "HRB 107049",
      "registerart": "HRB",
      "company_name": "Wolmirstedter Wohnungsbaugesellschaft mbH",
      "company_seat": "Wolmirstedt",
      "details": "16.12.2025 (Bekanntmachungsdatum)\n\nSachsen-Anhalt Amtsgericht Stendal HRB 107049\nEinreichung neuer Dokumente\n\nWolmirstedter Wohnungsbaugesellschaft mbH\nGesellschaft mit beschränkter Haftung\nWolmirstedt\n\nEine Liste der Mitglieder des Aufsichtsrates wurde zum Handelsregister eingereicht."
    },
    {
      "date": "2025-12-16",
      "id": "140091",
      "original_text": "Registerbekanntmachung nach dem Umwandlungsgesetz\nBaden-Württemberg Amtsgericht Mannheim GsR 2193\nGemeinschaftspraxis Augenarzt Dr. Kohm & Irene Medicke eGbR – Karlsruhe",
      "type": "Registerbekanntmachung nach dem Umwandlungsgesetz",
      "state": "Baden-Württemberg",
      "amtsgericht": "Amtsgericht Mannheim",
      "registernummer": "GsR 2193",
      "registerart": "GsR",
      "company_name": "Gemeinschaftspraxis Augenarzt Dr. Kohm & Irene Medicke eGbR",
      "company_seat": "Karlsruhe",
      "details": "16.12.2025 (Bekanntmachungsdatum)\n\nBaden-Württemberg Amtsgericht Mannheim GsR 2193\nRegisterbekanntmachung nach dem Umwandlungsgesetz 16.12.2025 (Eintragungsdatum)\n\nGemeinschaftspraxis Augenarzt Dr. Kohm & Irene Medicke eGbR\nGesellschaft bürgerlichen Rechts\nKarlsruhe\n\nDen Gläubigern des an dem Formwechsel beteiligten Rechtsträgers ist, wenn sie binnen sechs Monaten nach dem Tag, an dem die Eintragung des Formwechsels in das Register des Sitzes desjenigen Rechtsträgers, dessen Gläubiger sie sind, nach § 19 Abs. 3 UmwG als bekanntgemacht gilt, ihren Anspruch nach Grund und Höhe schriftlich anmelden, Sicherheit zu leisten, soweit sie nicht Befriedigung verlangen können. Dieses Recht steht den Gläubigern jedoch nur zu, wenn sie glaubhaft machen, dass durch den Formwechsel die Erfüllung ihrer Forderung gefährdet wird."
    },
    {
      "date": "2025-12-16",
      "id": "140092",
      "original_text": "Registerbekanntmachung nach dem Umwandlungsgesetz\nBaden-Württemberg Amtsgericht Mannheim HRB 756672\nArgus Augenzentrum West MVZ GmbH – Karlsruhe",
      "type": "Registerbekanntmachung nach dem Umwandlungsgesetz",
      "state": "Baden-Württemberg",
      "amtsgericht": "Amtsgericht Mannheim",
      "registernummer": "HRB 756672",
      "registerart": "HRB",
      "company_name": "Argus Augenzentrum West MVZ GmbH",
      "company_seat": "Karlsruhe",
      "details": "16.12.2025 (Bekanntmachungsdatum)\n\nBaden-Württemberg Amtsgericht Mannheim HRB 756672\nRegisterbekanntmachung nach dem Umwandlungsgesetz 16.12.2025 (Eintragungsdatum)\n\nArgus Augenzentrum West MVZ GmbH\nGesellschaft mit beschränkter Haftung\nKarlsruhe\n\nDen Gläubigern des an dem Formwechsel beteiligten Rechtsträgers ist, wenn sie binnen sechs Monaten nach dem Tag, an dem die Eintragung des Formwechsels in das Register des Sitzes desjenigen Rechtsträgers, dessen Gläubiger sie sind, nach § 19 Abs. 3 UmwG als bekanntgemacht gilt, ihren Anspruch nach Grund und Höhe schriftlich anmelden, Sicherheit zu leisten, soweit sie nicht Befriedigung verlangen können. Dieses Recht steht den Gläubigern jedoch nur zu, wenn sie glaubhaft machen, dass durch den Formwechsel die Erfüllung ihrer Forderung gefährdet wird."
    },
    {
      "date": "2025-12-16",
      "id": "140093",
      "original_text": "Löschungsankündigung\nBrandenburg Amtsgericht Potsdam HRB 28491\nLogi-Fix GmbH – Groß Kreutz (Havel)",
      "type": "Löschungsankündigung",
      "state": "Brandenburg",
      "amtsgericht": "Amtsgericht Potsdam",
      "registernummer": "HRB 28491",
      "registerart": "HRB",
      "company_name": "Logi-Fix GmbH",
      "company_seat": "Groß Kreutz (Havel)",
      "details": "16.12.2025 (Bekanntmachungsdatum)\n\nBrandenburg Amtsgericht Potsdam HRB 28491\nLöschungsankündigung\n\nLogi-Fix GmbH\nGesellschaft mit beschränkter Haftung\nGroß Kreutz (Havel)\n\nBei der nachstehenden Gesellschaft wird das Amtslöschungsverfahren gemäß § 394 FamFG eingeleitet. Widerspruchsfrist: 8 Wochen"
    },
    {
      "date": "2025-12-16",
      "id": "140094",
      "original_text": "Registerbekanntmachung nach dem Umwandlungsgesetz\nBaden-Württemberg Amtsgericht Ulm HRB 734740\nCh. Kempf Verwaltungsgesellschaft mbH – Aalen",
      "type": "Registerbekanntmachung nach dem Umwandlungsgesetz",
      "state": "Baden-Württemberg",
      "amtsgericht": "Amtsgericht Ulm",
      "registernummer": "HRB 734740",
      "registerart": "HRB",
      "company_name": "Ch. Kempf Verwaltungsgesellschaft mbH",
      "company_seat": "Aalen",
      "details": "16.12.2025 (Bekanntmachungsdatum)\n\nBaden-Württemberg Amtsgericht Ulm HRB 734740\nRegisterbekanntmachung nach dem Umwandlungsgesetz 16.12.2025 (Eintragungsdatum)\n\nCh. Kempf Verwaltungsgesellschaft mbH\nGesellschaft mit beschränkter Haftung\nAalen\n\nDen Gläubigern der an der Verschmelzung beteiligten Rechtsträger ist, wenn sie binnen sechs Monaten nach dem Tag, an dem die Eintragung der Verschmelzung in das Register des Sitzes desjenigen Rechtsträgers, dessen Gläubiger sie sind, nach § 19 Abs. 3 UmwG als bekanntgemacht gilt, ihren Anspruch nach Grund und Höhe schriftlich anmelden, Sicherheit zu leisten, soweit sie nicht Befriedigung verlangen können. Dieses Recht steht den Gläubigern jedoch nur zu, wenn sie glaubhaft machen, dass durch die Verschmelzung die Erfüllung ihrer Forderung gefährdet wird."
    },
    {
      "date": "2025-12-16",
      "id": "140095",
      "original_text": "Registerbekanntmachung nach dem Umwandlungsgesetz\nBaden-Württemberg Amtsgericht Mannheim HRA 712956\n42coding KG – Illingen",
      "type": "Registerbekanntmachung nach dem Umwandlungsgesetz",
      "state": "Baden-Württemberg",
      "amtsgericht": "Amtsgericht Mannheim",
      "registernummer": "HRA 712956",
      "registerart": "HRA",
      "company_name": "42coding KG",
      "company_seat": "Illingen",
      "details": "16.12.2025 (Bekanntmachungsdatum)\n\nBaden-Württemberg Amtsgericht Mannheim HRA 712956\nRegisterbekanntmachung nach dem Umwandlungsgesetz 16.12.2025 (Eintragungsdatum)\n\n42coding KG\nKommanditgesellschaft\nIllingen\n\nAls nicht eingetragen wird bekanntgemacht:\nDen Gläubigern des an dem Formwechsel beteiligten Rechtsträgers ist, wenn sie binnen sechs Monaten nach dem Tag, an dem die Eintragung des Formwechsels in das Register des Sitzes desjenigen Rechtsträgers, dessen Gläubiger sie sind, nach § 19 Abs. 3 UmwG als bekanntgemacht gilt, ihren Anspruch nach Grund und Höhe schriftlich anmelden, Sicherheit zu leisten, soweit sie nicht Befriedigung verlangen können. Dieses Recht steht den Gläubigern jedoch nur zu, wenn sie glaubhaft machen, dass durch den Formwechsel die Erfüllung ihrer Forderung gefährdet wird."
    },
    {
      "date": "2025-12-16",
      "id": "140096",
      "original_text": "Registerbekanntmachung nach dem Umwandlungsgesetz\nBaden-Württemberg Amtsgericht Mannheim HRB 745279\nBREOS GmbH – Illingen",
      "type": "Registerbekanntmachung nach dem Umwandlungsgesetz",
      "state": "Baden-Württemberg",
      "amtsgericht": "Amtsgericht Mannheim",
      "registernummer": "HRB 745279",
      "registerart": "HRB",
      "company_name": "BREOS GmbH",
      "company_seat": "Illingen",
      "details": "16.12.2025 (Bekanntmachungsdatum)\n\nBaden-Württemberg Amtsgericht Mannheim HRB 745279\nRegisterbekanntmachung nach dem Umwandlungsgesetz 16.12.2025 (Eintragungsdatum)\n\nBREOS GmbH\nGesellschaft mit beschränkter Haftung\nIllingen\n\nAls nicht eingetragen wird bekanntgemacht:\nDen Gläubigern des an dem Formwechsel beteiligten Rechtsträgers ist, wenn sie binnen sechs Monaten nach dem Tag, an dem die Eintragung des Formwechsels in das Register des Sitzes desjenigen Rechtsträgers, dessen Gläubiger sie sind, nach § 19 Abs. 3 UmwG als bekanntgemacht gilt, ihren Anspruch nach Grund und Höhe schriftlich anmelden, Sicherheit zu leisten, soweit sie nicht Befriedigung verlangen können. Dieses Recht steht den Gläubigern jedoch nur zu, wenn sie glaubhaft machen, dass durch den Formwechsel die Erfüllung ihrer Forderung gefährdet wird."
    },
    {
      "date": "2025-12-16",
      "id": "140097",
      "original_text": "Löschungsankündigung\nBrandenburg Amtsgericht Potsdam HRA 7520\nMontana - Consult e.K., Inhaber Manfred Willms – Zossen",
      "type": "Löschungsankündigung",
      "state": "Brandenburg",
      "amtsgericht": "Amtsgericht Potsdam",
      "registernummer": "HRA 7520",
      "registerart": "HRA",
      "company_name": "Montana - Consult e.K., Inhaber Manfred Willms",
      "company_seat": "Zossen",
      "details": "16.12.2025 (Bekanntmachungsdatum)\n\nBrandenburg Amtsgericht Potsdam HRA 7520\nLöschungsankündigung\n\nMontana - Consult e.K., Inhaber Manfred Willms\nEinzelkaufmann / Einzelkauffrau\nZossen\n\nBei der nachstehenden Gesellschaft/dem nachstehenden Einzelkaufmann wird das Amtslöschungsverfahren gemäß § 31 Abs. 2 HGB eingeleitet. Widerspruchsfrist: 8 Wochen."
    },
    {
      "date": "2025-12-16",
      "id": "140098",
      "original_text": "Registerbekanntmachung nach dem Umwandlungsgesetz\nThüringen Amtsgericht Jena HRB 104040\nGoldfunk GmbH – Erfurt",
      "type": "Registerbekanntmachung nach dem Umwandlungsgesetz",
      "state": "Thüringen",
      "amtsgericht": "Amtsgericht Jena",
      "registernummer": "HRB 104040",
      "registerart": "HRB",
      "company_name": "Goldfunk GmbH",
      "company_seat": "Erfurt",
      "details": "16.12.2025 (Bekanntmachungsdatum)\n\nThüringen Amtsgericht Jena HRB 104040\nRegisterbekanntmachung nach dem Umwandlungsgesetz 16.12.2025 (Eintragungsdatum)\n\nGoldfunk GmbH\nGesellschaft mit beschränkter Haftung\nErfurt\n\nNicht eingetragen: Den Gläubigern der an der Ausgliederung beteiligten Rechtsträger, ist wenn sie binnen sechs Monaten nach dem Tag, an dem die Eintragung der Ausgliederung in das Register des Sitzes desjenigen Rechtsträgers, dessen Gläubiger sie sind, nach §§125, 19 Abs. 3 UmwG als bekanntgemacht gilt, ihren Anspruch nach Grund und Höhe schriftlich anmelden, Sicherheit zu leisten, soweit sie nicht Befriedigung verlangen können. Dieses Recht steht ihnen jedoch nur zu, wenn sie glaubhaft machen, daß durch die Ausgliederung die Erfüllung ihrer Forderung gefährdet wird."
    },
    {
      "date": "2025-12-16",
      "id": "140099",
      "original_text": "Registerbekanntmachung nach dem Umwandlungsgesetz\nThüringen Amtsgericht Jena HRB 112081\nK & W Mineralölgesellschaft Erfurt mbH – Erfurt",
      "type": "Registerbekanntmachung nach dem Umwandlungsgesetz",
      "state": "Thüringen",
      "amtsgericht": "Amtsgericht Jena",
      "registernummer": "HRB 112081",
      "registerart": "HRB",
      "company_name": "K & W Mineralölgesellschaft Erfurt mbH",
      "company_seat": "Erfurt",
      "details": "16.12.2025 (Bekanntmachungsdatum)\n\nThüringen Amtsgericht Jena HRB 112081\nRegisterbekanntmachung nach dem Umwandlungsgesetz 16.12.2025 (Eintragungsdatum)\n\nK & W Mineralölgesellschaft Erfurt mbH\nGesellschaft mit beschränkter Haftung\nErfurt\n\nNicht eingetragen: Den Gläubigern der an der Ausgliederung beteiligten Rechtsträger, ist wenn sie binnen sechs Monaten nach dem Tag, an dem die Eintragung der Ausgliederung in das Register des Sitzes desjenigen Rechtsträgers, dessen Gläubiger sie sind, nach §§125, 19 Abs. 3 UmwG als bekanntgemacht gilt, ihren Anspruch nach Grund und Höhe schriftlich anmelden, Sicherheit zu leisten, soweit sie nicht Befriedigung verlangen können. Dieses Recht steht ihnen jedoch nur zu, wenn sie glaubhaft machen, daß durch die Ausgliederung die Erfüllung ihrer Forderung gefährdet wird."
    },
    {
      "date": "2025-12-16",
      "id": "140100",
      "original_text": "Registerbekanntmachung nach dem Umwandlungsgesetz\nThüringen Amtsgericht Jena HRB 110560\nGoldfunk Sicherheitstechnik GmbH – Erfurt",
      "type": "Registerbekanntmachung nach dem Umwandlungsgesetz",
      "state": "Thüringen",
      "amtsgericht": "Amtsgericht Jena",
      "registernummer": "HRB 110560",
      "registerart": "HRB",
      "company_name": "Goldfunk Sicherheitstechnik GmbH",
      "company_seat": "Erfurt",
      "details": "16.12.2025 (Bekanntmachungsdatum)\n\nThüringen Amtsgericht Jena HRB 110560\nRegisterbekanntmachung nach dem Umwandlungsgesetz 16.12.2025 (Eintragungsdatum)\n\nGoldfunk Sicherheitstechnik GmbH\nGesellschaft mit beschränkter Haftung\nErfurt\n\nNicht eingetragen: Den Gläubigern der an der Ausgliederung beteiligten Rechtsträger, ist wenn sie binnen sechs Monaten nach dem Tag, an dem die Eintragung der Ausgliederung in das Register des Sitzes desjenigen Rechtsträgers, dessen Gläubiger sie sind, nach §§125, 19 Abs. 3 UmwG als bekanntgemacht gilt, ihren Anspruch nach Grund und Höhe schriftlich anmelden, Sicherheit zu leisten, soweit sie nicht Befriedigung verlangen können. Dieses Recht steht ihnen jedoch nur zu, wenn sie glaubhaft machen, daß durch die Ausgliederung die Erfüllung ihrer Forderung gefährdet wird."
    },
    {
      "date": "2025-12-16",
      "id": "140101",
      "original_text": "Registerbekanntmachung nach dem Umwandlungsgesetz\nThüringen Amtsgericht Jena HRB 524011\nK&W Mineralölgesellschaft Erfurt NEU mbH – Erfurt",
      "type": "Registerbekanntmachung nach dem Umwandlungsgesetz",
      "state": "Thüringen",
      "amtsgericht": "Amtsgericht Jena",
      "registernummer": "HRB 524011",
      "registerart": "HRB",
      "company_name": "K&W Mineralölgesellschaft Erfurt NEU mbH",
      "company_seat": "Erfurt",
      "details": "16.12.2025 (Bekanntmachungsdatum)\n\nThüringen Amtsgericht Jena HRB 524011\nRegisterbekanntmachung nach dem Umwandlungsgesetz 16.12.2025 (Eintragungsdatum)\n\nK&W Mineralölgesellschaft Erfurt NEU mbH\nGesellschaft mit beschränkter Haftung\nErfurt\n\nNicht eingetragen: Den Gläubigern der an der Ausgliederung beteiligten Rechtsträger, ist wenn sie binnen sechs Monaten nach dem Tag, an dem die Eintragung der Ausgliederung in das Register des Sitzes desjenigen Rechtsträgers, dessen Gläubiger sie sind, nach §§125, 19 Abs. 3 UmwG als bekanntgemacht gilt, ihren Anspruch nach Grund und Höhe schriftlich anmelden, Sicherheit zu leisten, soweit sie nicht Befriedigung verlangen können. Dieses Recht steht ihnen jedoch nur zu, wenn sie glaubhaft machen, daß durch die Ausgliederung die Erfüllung ihrer Forderung gefährdet wird."
    },
    {
      "date": "2025-12-16",
      "id": "140102",
      "original_text": "Löschungsankündigung\nThüringen Amtsgericht Jena HRB 512648\nLTR Bauservice GmbH Meisterbetrieb – Gera",
      "type": "Löschungsankündigung",
      "state": "Thüringen",
      "amtsgericht": "Amtsgericht Jena",
      "registernummer": "HRB 512648",
      "registerart": "HRB",
      "company_name": "LTR Bauservice GmbH Meisterbetrieb",
      "company_seat": "Gera",
      "details": "16.12.2025 (Bekanntmachungsdatum)\n\nThüringen Amtsgericht Jena HRB 512648\nLöschungsankündigung\n\nLTR Bauservice GmbH Meisterbetrieb\nGesellschaft mit beschränkter Haftung\nGera\n\nDas Registergericht beabsichtigt, die im Handelsregister eingetragene Gesellschaft wegen Vermögenslosigkeit nach § 394 FamFG von Amts wegen zu löschen. Die Frist zur Erhebung eines Widerspruchs gegen die beabsichtigte Löschung wird auf 6 Wochen festgesetzt."
    },
    {
      "date": "2025-12-16",
      "id": "140103",
      "original_text": "Registerbekanntmachung nach dem Umwandlungsgesetz\nBaden-Württemberg Amtsgericht Mannheim HRB 723842\nBruker Luxendo GmbH – Heidelberg",
      "type": "Registerbekanntmachung nach dem Umwandlungsgesetz",
      "state": "Baden-Württemberg",
      "amtsgericht": "Amtsgericht Mannheim",
      "registernummer": "HRB 723842",
      "registerart": "HRB",
      "company_name": "Bruker Luxendo GmbH",
      "company_seat": "Heidelberg",
      "details": "16.12.2025 (Bekanntmachungsdatum)\n\nBaden-Württemberg Amtsgericht Mannheim HRB 723842\nRegisterbekanntmachung nach dem Umwandlungsgesetz 16.12.2025 (Eintragungsdatum)\n\nBruker Luxendo GmbH\nGesellschaft mit beschränkter Haftung\nHeidelberg\n\nAls nicht eingetragen wird bekanntgemacht:\nDen Gläubigern der an der Verschmelzung beteiligten Rechtsträger ist, wenn sie binnen sechs Monaten nach dem Tag, an dem die Eintragung der Verschmelzung in das Register des Sitzes desjenigen Rechtsträgers, dessen Gläubiger sie sind, nach § 19 Abs. 3 UmwG als bekanntgemacht gilt, ihren Anspruch nach Grund und Höhe schriftlich anmelden, Sicherheit zu leisten, soweit sie nicht Befriedigung verlangen können. Dieses Recht steht den Gläubigern jedoch nur zu, wenn sie glaubhaft machen, dass durch die Verschmelzung die Erfüllung ihrer Forderung gefährdet wird."
    },
    {
      "date": "2025-12-16",
      "id": "140104",
      "original_text": "Registerbekanntmachung nach dem Umwandlungsgesetz\nSchleswig-Holstein Amtsgericht Kiel PR 585\nKnüppel & Partner mbB Wirtschaftsprüfer, Steuerberater – Elmshorn",
      "type": "Registerbekanntmachung nach dem Umwandlungsgesetz",
      "state": "Schleswig-Holstein",
      "amtsgericht": "Amtsgericht Kiel",
      "registernummer": "PR 585",
      "registerart": "PR",
      "company_name": "Knüppel & Partner mbB Wirtschaftsprüfer, Steuerberater",
      "company_seat": "Elmshorn",
      "details": "16.12.2025 (Bekanntmachungsdatum)\n\nSchleswig-Holstein Amtsgericht Kiel PR 585\nRegisterbekanntmachung nach dem Umwandlungsgesetz 15.12.2025 (Eintragungsdatum)\n\nKnüppel & Partner mbB Wirtschaftsprüfer, Steuerberater\nPartnerschaftsgesellschaft\nElmshorn\n\nAls nicht eingetragen wird veröffentlicht: Den Gläubigern der an der Spaltung beteiligten Rechtsträger ist, wenn sie binnen sechs Monaten nach dem Tag, an dem die Eintragung der Spaltung in das Register des Sitzes desjenigen Rechtsträgers, dessen Gläubiger sie sind,  bekannt gemacht worden ist, ihren Anspruch nach Grund und Höhe schriftlich anmelden, Sicherheit zu leisten, soweit sie nicht Befriedigung verlangen können. Dieses Recht steht den Gläubigern jedoch nur zu, wenn sie glaubhaft machen, dass durch die Spaltung die Erfüllung ihrer Forderung gefährdet wird."
    },
    {
      "date": "2025-12-16",
      "id": "140105",
      "original_text": "Registerbekanntmachung nach dem Umwandlungsgesetz\nBaden-Württemberg Amtsgericht Ulm GnR 720172\nMeinNaturhaus Mock eG – Ravensburg",
      "type": "Registerbekanntmachung nach dem Umwandlungsgesetz",
      "state": "Baden-Württemberg",
      "amtsgericht": "Amtsgericht Ulm",
      "registernummer": "GnR 720172",
      "registerart": "GnR",
      "company_name": "MeinNaturhaus Mock eG",
      "company_seat": "Ravensburg",
      "details": "16.12.2025 (Bekanntmachungsdatum)\n\nBaden-Württemberg Amtsgericht Ulm GnR 720172\nRegisterbekanntmachung nach dem Umwandlungsgesetz 16.12.2025 (Eintragungsdatum)\n\nMeinNaturhaus Mock eG\neingetragene Genossenschaft\nRavensburg\n\nAls nicht eingetragen wird bekanntgemacht:\nDen Gläubigern des an dem Formwechsel beteiligten Rechtsträgers ist, wenn sie binnen sechs Monaten nach dem Tag, an dem die Eintragung des Formwechsels in das Register des Sitzes desjenigen Rechtsträgers, dessen Gläubiger sie sind, nach § 19 Abs. 3 UmwG als bekanntgemacht gilt, ihren Anspruch nach Grund und Höhe schriftlich anmelden, Sicherheit zu leisten, soweit sie nicht Befriedigung verlangen können. Dieses Recht steht den Gläubigern jedoch nur zu, wenn sie glaubhaft machen, dass durch den Formwechsel die Erfüllung ihrer Forderung gefährdet wird."
    },
    {
      "date": "2025-12-16",
      "id": "140106",
      "original_text": "Registerbekanntmachung nach dem Umwandlungsgesetz\nBaden-Württemberg Amtsgericht Ulm HRA 724996\nmassivholzhaus mock GmbH & Co. KG – Ravensburg",
      "type": "Registerbekanntmachung nach dem Umwandlungsgesetz",
      "state": "Baden-Württemberg",
      "amtsgericht": "Amtsgericht Ulm",
      "registernummer": "HRA 724996",
      "registerart": "HRA",
      "company_name": "massivholzhaus mock GmbH & Co. KG",
      "company_seat": "Ravensburg",
      "details": "16.12.2025 (Bekanntmachungsdatum)\n\nBaden-Württemberg Amtsgericht Ulm HRA 724996\nRegisterbekanntmachung nach dem Umwandlungsgesetz 16.12.2025 (Eintragungsdatum)\n\nmassivholzhaus mock GmbH & Co. KG\nKommanditgesellschaft\nRavensburg\n\nAls nicht eingetragen wird bekanntgemacht:\nDen Gläubigern des an dem Formwechsel beteiligten Rechtsträgers ist, wenn sie binnen sechs Monaten nach dem Tag, an dem die Eintragung des Formwechsels in das Register des Sitzes desjenigen Rechtsträgers, dessen Gläubiger sie sind, nach § 19 Abs. 3 UmwG als bekanntgemacht gilt, ihren Anspruch nach Grund und Höhe schriftlich anmelden, Sicherheit zu leisten, soweit sie nicht Befriedigung verlangen können. Dieses Recht steht den Gläubigern jedoch nur zu, wenn sie glaubhaft machen, dass durch den Formwechsel die Erfüllung ihrer Forderung gefährdet wird."
    },
    {
      "date": "2025-12-16",
      "id": "140107",
      "original_text": "Löschungsankündigung\nBaden-Württemberg Amtsgericht Stuttgart HRA 731456\nMK Paletten Service e.K. – Filderstadt",
      "type": "Löschungsankündigung",
      "state": "Baden-Württemberg",
      "amtsgericht": "Amtsgericht Stuttgart",
      "registernummer": "HRA 731456",
      "registerart": "HRA",
      "company_name": "MK Paletten Service e.K.",
      "company_seat": "Filderstadt",
      "details": "16.12.2025 (Bekanntmachungsdatum)\n\nBaden-Württemberg Amtsgericht Stuttgart HRA 731456\nLöschungsankündigung\n\nMK Paletten Service e.K.\nEinzelkaufmann / Einzelkauffrau\nFilderstadt\n\nDas Registergericht beabsichtigt, die Firma im Handelsregister von Amts wegen nach § 31 Abs. 2 HGB zu löschen. Die Frist zur Geltendmachung eines Widerspruchs gegen die beabsichtigte Löschung ist auf zwei Monate ab Veröffentlichung bestimmt."
    },
    {
      "date": "2025-12-16",
      "id": "140108",
      "original_text": "Sonstige Registerbekanntmachung\nSchleswig-Holstein Amtsgericht Kiel GnR 442\nEDG Beteiligungsgenossenschaft eG – Kiel",
      "type": "Sonstige Registerbekanntmachung",
      "state": "Schleswig-Holstein",
      "amtsgericht": "Amtsgericht Kiel",
      "registernummer": "GnR 442",
      "registerart": "GnR",
      "company_name": "EDG Beteiligungsgenossenschaft eG",
      "company_seat": "Kiel",
      "details": "16.12.2025 (Bekanntmachungsdatum)\n\nSchleswig-Holstein Amtsgericht Kiel GnR 442\nSonstige Registerbekanntmachung\n\nEDG Beteiligungsgenossenschaft eG\neingetragene Genossenschaft\nKiel\n\nAls nicht eingetragen wird veröffentlicht: Den Gläubigern der Genossenschaft ist, wenn sie binnen sechs Monaten  nach dem Tag an dem die Eintragung des Verzichts auf die Nachschusspflicht und die Herabsetzung des Geschäftsanteils in das Register der Genossenschaft, dessen Gläubiger sie sind, nach § 22 und 22a GenG bekannt gemacht worden ist, ihren Anspruch nach Grund und Höhe schriftlich anmelden, Sicherheit zu leisten, soweit sie nicht Befriedigung erlangen können."
    },
    {
      "date": "2025-12-16",
      "id": "140109",
      "original_text": "Löschungsankündigung\nBaden-Württemberg Amtsgericht Freiburg HRB 712963\nLILITH GERMANY GmbH – Kehl",
      "type": "Löschungsankündigung",
      "state": "Baden-Württemberg",
      "amtsgericht": "Amtsgericht Freiburg",
      "registernummer": "HRB 712963",
      "registerart": "HRB",
      "company_name": "LILITH GERMANY GmbH",
      "company_seat": "Kehl",
      "details": "16.12.2025 (Bekanntmachungsdatum)\n\nBaden-Württemberg Amtsgericht Freiburg HRB 712963\nLöschungsankündigung\n\nLILITH GERMANY GmbH\nGesellschaft mit beschränkter Haftung\nKehl\n\nDas Gericht beabsichtigt, die Gesellschaft wegen Vermögenslosigkeit im Handelsregister von Amts wegen nach § 394 FamFG zu löschen. Die Frist zur Geltendmachung eines Widerspruchs gegen die beabsichtigte Löschung ist auf einen Monat ab Veröffentlichung bestimmt."
    },
    {
      "date": "2025-12-16",
      "id": "140110",
      "original_text": "Sonstige Registerbekanntmachung\nHamburg Amtsgericht Hamburg HRB 149532\nAsklepios Kliniken GmbH & Co. KGaA – Hamburg",
      "type": "Sonstige Registerbekanntmachung",
      "state": "Hamburg",
      "amtsgericht": "Amtsgericht Hamburg",
      "registernummer": "HRB 149532",
      "registerart": "HRB",
      "company_name": "Asklepios Kliniken GmbH & Co. KGaA",
      "company_seat": "Hamburg",
      "details": "16.12.2025 (Bekanntmachungsdatum)\n\nHamburg Amtsgericht Hamburg HRB 149532\nSonstige Registerbekanntmachung\n\nAsklepios Kliniken GmbH & Co. KGaA\nKommanditgesellschaft auf Aktien\nHamburg\n\nAls nicht eingetragen wird bekannt gemacht: Liste des Aufsichtsrats wurde eingereicht."
    },
    {
      "date": "2025-12-16",
      "id": "140111",
      "original_text": "Registerbekanntmachung nach dem Umwandlungsgesetz\nBaden-Württemberg Amtsgericht Mannheim HRB 755391\nBDK Handwerks GmbH – Gernsbach",
      "type": "Registerbekanntmachung nach dem Umwandlungsgesetz",
      "state": "Baden-Württemberg",
      "amtsgericht": "Amtsgericht Mannheim",
      "registernummer": "HRB 755391",
      "registerart": "HRB",
      "company_name": "BDK Handwerks GmbH",
      "company_seat": "Gernsbach",
      "details": "16.12.2025 (Bekanntmachungsdatum)\n\nBaden-Württemberg Amtsgericht Mannheim HRB 755391\nRegisterbekanntmachung nach dem Umwandlungsgesetz 16.12.2025 (Eintragungsdatum)\n\nBDK Handwerks GmbH\nGesellschaft mit beschränkter Haftung\nGernsbach\n\nAls nicht eingetragen wird bekanntgemacht:\nDen Gläubigern der an der Ausgliederung beteiligten Rechtsträger ist, wenn sie binnen sechs Monaten nach dem Tag, an dem die Eintragung der Ausgliederung in das Register des Sitzes desjenigen Rechtsträgers, dessen Gläubiger sie sind, nach § 19 Abs. 3 UmwG als bekanntgemacht gilt, ihren Anspruch nach Grund und Höhe schriftlich anmelden, Sicherheit zu leisten, soweit sie nicht Befriedigung verlangen können. Dieses Recht steht den Gläubigern jedoch nur zu, wenn sie glaubhaft machen, dass durch die Ausgliederung die Erfüllung ihrer Forderung gefährdet wird."
    },
    {
      "date": "2025-12-16",
      "id": "140112",
      "original_text": "Registerbekanntmachung nach dem Umwandlungsgesetz\nBaden-Württemberg Amtsgericht Mannheim HRA 712768\nGhulam Khan e.K. – Gernsbach",
      "type": "Registerbekanntmachung nach dem Umwandlungsgesetz",
      "state": "Baden-Württemberg",
      "amtsgericht": "Amtsgericht Mannheim",
      "registernummer": "HRA 712768",
      "registerart": "HRA",
      "company_name": "Ghulam Khan e.K.",
      "company_seat": "Gernsbach",
      "details": "16.12.2025 (Bekanntmachungsdatum)\n\nBaden-Württemberg Amtsgericht Mannheim HRA 712768\nRegisterbekanntmachung nach dem Umwandlungsgesetz 16.12.2025 (Eintragungsdatum)\n\nGhulam Khan e.K.\nEinzelkaufmann / Einzelkauffrau\nGernsbach\n\nAls nicht eingetragen wird bekanntgemacht: Den Gläubigern der an der Ausgliederung beteiligten Rechtsträger ist, wenn sie binnen sechs Monaten nach dem Tag, an dem die Eintragung der Ausgliederung in das Register des Sitzes desjenigen Rechtsträgers, dessen Gläubiger sie sind, nach § 19 Abs. 3 UmwG als bekanntgemacht gilt, ihren Anspruch nach Grund und Höhe schriftlich anmelden, Sicherheit zu leisten, soweit sie nicht Befriedigung verlangen können. Dieses Recht steht den Gläubigern jedoch nur zu, wenn sie glaubhaft machen, dass durch die Ausgliederung die Erfüllung ihrer Forderung gefährdet wird."
    },
    {
      "date": "2025-12-16",
      "id": "140113",
      "original_text": "Registerbekanntmachung nach dem Umwandlungsgesetz\nBaden-Württemberg Amtsgericht Stuttgart HRB 20831\nflexis consult GmbH – Stuttgart",
      "type": "Registerbekanntmachung nach dem Umwandlungsgesetz",
      "state": "Baden-Württemberg",
      "amtsgericht": "Amtsgericht Stuttgart",
      "registernummer": "HRB 20831",
      "registerart": "HRB",
      "company_name": "flexis consult GmbH",
      "company_seat": "Stuttgart",
      "details": "16.12.2025 (Bekanntmachungsdatum)\n\nBaden-Württemberg Amtsgericht Stuttgart HRB 20831\nRegisterbekanntmachung nach dem Umwandlungsgesetz 16.12.2025 (Eintragungsdatum)\n\nflexis consult GmbH\nGesellschaft mit beschränkter Haftung\nStuttgart\n\nDen Gläubigern der an der Verschmelzung beteiligten Rechtsträger ist, wenn sie binnen sechs Monaten nach dem Tag, an dem die Eintragung der Verschmelzung in das Register des Sitzes desjenigen Rechtsträgers, dessen Gläubiger sie sind, nach § 19 Abs. 3 UmwG als bekanntgemacht gilt, ihren Anspruch nach Grund und Höhe schriftlich anmelden, Sicherheit zu leisten, soweit sie nicht Befriedigung verlangen können. Dieses Recht steht den Gläubigern jedoch nur zu, wenn sie glaubhaft machen, dass durch die Verschmelzung die Erfüllung ihrer Forderung gefährdet wird."
    },
    {
      "date": "2025-12-16",
      "id": "140114",
      "original_text": "Einreichung neuer Dokumente\nBaden-Württemberg Amtsgericht Stuttgart HRB 400935\nFerngasgesellschaft Albstadt Gammertingen mbH – Albstadt",
      "type": "Einreichung neuer Dokumente",
      "state": "Baden-Württemberg",
      "amtsgericht": "Amtsgericht Stuttgart",
      "registernummer": "HRB 400935",
      "registerart": "HRB",
      "company_name": "Ferngasgesellschaft Albstadt Gammertingen mbH",
      "company_seat": "Albstadt",
      "details": "16.12.2025 (Bekanntmachungsdatum)\n\nBaden-Württemberg Amtsgericht Stuttgart HRB 400935\nEinreichung neuer Dokumente\n\nFerngasgesellschaft Albstadt Gammertingen mbH\nGesellschaft mit beschränkter Haftung\nAlbstadt\n\nDie Gesellschaft hat am 16.12.2025 die Liste über die Zusammensetzung des Aufsichtsrats zum Handelsregister eingereicht."
    },
    {
      "date": "2025-12-16",
      "id": "140115",
      "original_text": "Einreichung neuer Dokumente\nHamburg Amtsgericht Hamburg HRB 2130\nFlughafen Hamburg Gesellschaft mit beschränkter Haftung – Hamburg",
      "type": "Einreichung neuer Dokumente",
      "state": "Hamburg",
      "amtsgericht": "Amtsgericht Hamburg",
      "registernummer": "HRB 2130",
      "registerart": "HRB",
      "company_name": "Flughafen Hamburg Gesellschaft mit beschränkter Haftung",
      "company_seat": "Hamburg",
      "details": "16.12.2025 (Bekanntmachungsdatum)\n\nHamburg Amtsgericht Hamburg HRB 2130\nEinreichung neuer Dokumente 16.12.2025 (Eintragungsdatum)\n\nFlughafen Hamburg Gesellschaft mit beschränkter Haftung\nGesellschaft mit beschränkter Haftung\nHamburg\n\nAls nicht eingetragen wird bekannt gemacht: Liste des Aufsichtsrats wurde eingereicht."
    },
    {
      "date": "2025-12-16",
      "id": "140116",
      "original_text": "Registerbekanntmachung nach dem Umwandlungsgesetz\nSaarland Amtsgericht Saarbrücken HRB 108790\nHATJ-L Holding GmbH – Wallerfangen",
      "type": "Registerbekanntmachung nach dem Umwandlungsgesetz",
      "state": "Saarland",
      "amtsgericht": "Amtsgericht Saarbrücken",
      "registernummer": "HRB 108790",
      "registerart": "HRB",
      "company_name": "HATJ-L Holding GmbH",
      "company_seat": "Wallerfangen",
      "details": "16.12.2025 (Bekanntmachungsdatum)\n\nSaarland Amtsgericht Saarbrücken HRB 108790\nRegisterbekanntmachung nach dem Umwandlungsgesetz 16.12.2025 (Eintragungsdatum)\n\nHATJ-L Holding GmbH\nGesellschaft mit beschränkter Haftung\nWallerfangen\n\nAls nicht eingetragen wird bekannt gemacht: Den Gläubigern der an der Ausgliederung beteiligten Gesellschaften ist, wenn sie binnen sechs Monaten nach dem Tag, an dem die Eintragung der Ausgliederung in das Register des Sitzes desjenigen Rechtsträgers, dessen Gläubiger sie sind, nach § 19 Absatz 3 UmwG bekannt gemacht worden ist, ihren Anspruch nach Grund und Höhe schriftlich anmelden, Sicherheit zu leisten, soweit sie nicht Befriedigung verlangen können. Dieses Recht steht den Gläubigern jedoch nur zu, wenn sie glaubhaft machen, dass durch die Ausgliederung die Erfüllung ihrer Forderung gefährdet wird."
    },
    {
      "date": "2025-12-16",
      "id": "140117",
      "original_text": "Löschungsankündigung\nBaden-Württemberg Amtsgericht Stuttgart HRB 766093\nWohnbau Freudenstadt GmbH – Balingen",
      "type": "Löschungsankündigung",
      "state": "Baden-Württemberg",
      "amtsgericht": "Amtsgericht Stuttgart",
      "registernummer": "HRB 766093",
      "registerart": "HRB",
      "company_name": "Wohnbau Freudenstadt GmbH",
      "company_seat": "Balingen",
      "details": "16.12.2025 (Bekanntmachungsdatum)\n\nBaden-Württemberg Amtsgericht Stuttgart HRB 766093\nLöschungsankündigung\n\nWohnbau Freudenstadt GmbH\nGesellschaft mit beschränkter Haftung\nBalingen\n\nAls nicht eingetragen wird bekanntgemacht:\nDas Gericht beabsichtigt, die Gesellschaft wegen Vermögenslosigkeit im Handelsregister von Amts wegen nach § 394 FamFG zu löschen. Die Frist zur Geltendmachung eines Widerspruchs gegen die beabsichtigte Löschung ist auf zwei Monate ab Veröffentlichung bestimmt."
    },
    {
      "date": "2025-12-16",
      "id": "140118",
      "original_text": "Registerbekanntmachung nach dem Umwandlungsgesetz\nBaden-Württemberg Amtsgericht Stuttgart HRA 742801\nDS-Innovative Heiztechnik Dirk Söndgerath e.K. – Stuttgart",
      "type": "Registerbekanntmachung nach dem Umwandlungsgesetz",
      "state": "Baden-Württemberg",
      "amtsgericht": "Amtsgericht Stuttgart",
      "registernummer": "HRA 742801",
      "registerart": "HRA",
      "company_name": "DS-Innovative Heiztechnik Dirk Söndgerath e.K.",
      "company_seat": "Stuttgart",
      "details": "16.12.2025 (Bekanntmachungsdatum)\n\nBaden-Württemberg Amtsgericht Stuttgart HRA 742801\nRegisterbekanntmachung nach dem Umwandlungsgesetz 16.12.2025 (Eintragungsdatum)\n\nDS-Innovative Heiztechnik Dirk Söndgerath e.K.\nEinzelkaufmann / Einzelkauffrau\nStuttgart\n\nAls nicht eingetragen wird bekanntgemacht:\nDen Gläubigern der an der Ausgliederung beteiligten Rechtsträger ist, wenn sie binnen sechs Monaten nach dem Tag, an dem die Eintragung der Ausgliederung in das Register des Sitzes desjenigen Rechtsträgers, dessen Gläubiger sie sind, nach § 19 Abs. 3 UmwG als bekanntgemacht gilt, ihren Anspruch nach Grund und Höhe schriftlich anmelden, Sicherheit zu leisten, soweit sie nicht Befriedigung verlangen können. Dieses Recht steht den Gläubigern jedoch nur zu, wenn sie glaubhaft machen, dass durch die Ausgliederung die Erfüllung ihrer Forderung gefährdet wird."
    },
    {
      "date": "2025-12-16",
      "id": "140119",
      "original_text": "Löschungsankündigung\nBaden-Württemberg Amtsgericht Mannheim HRB 729984\nNaujok-Pool GmbH – Altlußheim",
      "type": "Löschungsankündigung",
      "state": "Baden-Württemberg",
      "amtsgericht": "Amtsgericht Mannheim",
      "registernummer": "HRB 729984",
      "registerart": "HRB",
      "company_name": "Naujok-Pool GmbH",
      "company_seat": "Altlußheim",
      "details": "16.12.2025 (Bekanntmachungsdatum)\n\nBaden-Württemberg Amtsgericht Mannheim HRB 729984\nLöschungsankündigung\n\nNaujok-Pool GmbH\nGesellschaft mit beschränkter Haftung\nAltlußheim\n\nDas Gericht beabsichtigt, die Gesellschaft wegen Vermögenslosigkeit im Handelsregister von Amts wegen nach § 394 FamFG zu löschen. Die Frist zur Geltendmachung eines Widerspruchs gegen die beabsichtigte Löschung ist auf einen Monat ab Veröffentlichung bestimmt."
    },
    {
      "date": "2025-12-16",
      "id": "140120",
      "original_text": "Registerbekanntmachung nach dem Umwandlungsgesetz\nBaden-Württemberg Amtsgericht Stuttgart HRA 742575\nLa Fortuna/MeSa Events e.K. – Schömberg",
      "type": "Registerbekanntmachung nach dem Umwandlungsgesetz",
      "state": "Baden-Württemberg",
      "amtsgericht": "Amtsgericht Stuttgart",
      "registernummer": "HRA 742575",
      "registerart": "HRA",
      "company_name": "La Fortuna/MeSa Events e.K.",
      "company_seat": "Schömberg",
      "details": "16.12.2025 (Bekanntmachungsdatum)\n\nBaden-Württemberg Amtsgericht Stuttgart HRA 742575\nRegisterbekanntmachung nach dem Umwandlungsgesetz 16.12.2025 (Eintragungsdatum)\n\nLa Fortuna/MeSa Events e.K.\nEinzelkaufmann / Einzelkauffrau\nSchömberg\n\nDen Gläubigern der an der Ausgliederung beteiligten Rechtsträger ist, wenn sie binnen sechs Monaten nach dem Tag, an dem die Eintragung der Ausgliederung in das Register des Sitzes desjenigen Rechtsträgers, dessen Gläubiger sie sind, nach § 19 Abs. 3 UmwG als bekanntgemacht gilt, ihren Anspruch nach Grund und Höhe schriftlich anmelden, Sicherheit zu leisten, soweit sie nicht Befriedigung verlangen können. Dieses Recht steht den Gläubigern jedoch nur zu, wenn sie glaubhaft machen, dass durch die Ausgliederung die Erfüllung ihrer Forderung gefährdet wird."
    },
    {
      "date": "2025-12-16",
      "id": "140121",
      "original_text": "Löschungsankündigung\nSchleswig-Holstein Amtsgericht Lübeck HRB 23474\nMinas UG (haftungsbeschränkt) – Neustadt i.H.",
      "type": "Löschungsankündigung",
      "state": "Schleswig-Holstein",
      "amtsgericht": "Amtsgericht Lübeck",
      "registernummer": "HRB 23474",
      "registerart": "HRB",
      "company_name": "Minas UG (haftungsbeschränkt)",
      "company_seat": "Neustadt i.H.",
      "details": "16.12.2025 (Bekanntmachungsdatum)\n\nSchleswig-Holstein Amtsgericht Lübeck HRB 23474\nLöschungsankündigung\n\nMinas UG (haftungsbeschränkt)\nGesellschaft mit beschränkter Haftung\nNeustadt i.H.\n\nEs ist die Löschung der nachstehenden Gesellschaft wegen Vermögenslosigkeit gemäß § 394 FamFG beabsichtigt."
    },
    {
      "date": "2025-12-16",
      "id": "140122",
      "original_text": "Registerbekanntmachung nach dem Umwandlungsgesetz\nBerlin Amtsgericht Berlin (Charlottenburg) HRB 216354\nIDEAL-Zille Grundstücksgesellschaft mbH – Berlin",
      "type": "Registerbekanntmachung nach dem Umwandlungsgesetz",
      "state": "Berlin",
      "amtsgericht": "Amtsgericht Berlin (Charlottenburg)",
      "registernummer": "HRB 216354",
      "registerart": "HRB",
      "company_name": "IDEAL-Zille Grundstücksgesellschaft mbH",
      "company_seat": "Berlin",
      "details": "16.12.2025 (Bekanntmachungsdatum)\n\nBerlin Amtsgericht Berlin (Charlottenburg) HRB 216354\nRegisterbekanntmachung nach dem Umwandlungsgesetz 16.12.2025 (Eintragungsdatum)\n\nIDEAL-Zille Grundstücksgesellschaft mbH\nGesellschaft mit beschränkter Haftung\nBerlin\n\nZu Eintragungsnummer 5 vom 16.12.2025 wird als nicht eingetragen veröffentlicht: Den Gläubigern der an der Verschmelzung beteiligten Rechtsträger ist, wenn sie binnen sechs Monaten nach dem Tag, an dem die Eintragung der Verschmelzung in das Register des Sitzes desjenigen Rechtsträgers, dessen Gläubiger sie sind, als bekannt gemacht gilt, ihren Anspruch nach Grund und Höhe schriftlich anmelden, Sicherheit zu leisten, soweit sie nicht Befriedigung verlangen können. Dieses Recht steht den Gläubigern jedoch nur zu, wenn sie glaubhaft machen, dass durch die Verschmelzung die Erfüllung ihrer Forderung gefährdet wird. Das Recht, Sicherheitsleistung zu verlangen, steht Gläubigern nicht zu, die im Falle der Insolvenz ein Recht auf vorzugsweise Befriedigung aus einer Deckungsmasse haben, die nach gesetzlicher Vorschrift zu ihrem Schutz errichtet und staatlich überwacht ist."
    },
    {
      "date": "2025-12-16",
      "id": "140123",
      "original_text": "Registerbekanntmachung nach dem Umwandlungsgesetz\nBaden-Württemberg Amtsgericht Stuttgart HRB 784494\nBirgit Hövel Beteiligungs-GmbH – Reutlingen",
      "type": "Registerbekanntmachung nach dem Umwandlungsgesetz",
      "state": "Baden-Württemberg",
      "amtsgericht": "Amtsgericht Stuttgart",
      "registernummer": "HRB 784494",
      "registerart": "HRB",
      "company_name": "Birgit Hövel Beteiligungs-GmbH",
      "company_seat": "Reutlingen",
      "details": "16.12.2025 (Bekanntmachungsdatum)\n\nBaden-Württemberg Amtsgericht Stuttgart HRB 784494\nRegisterbekanntmachung nach dem Umwandlungsgesetz 11.12.2025 (Eintragungsdatum)\n\nBirgit Hövel Beteiligungs-GmbH\nGesellschaft mit beschränkter Haftung\nReutlingen\n\nDen Gläubigern der an der Verschmelzung beteiligten Rechtsträger ist, wenn sie binnen sechs Monaten nach dem Tag, an dem die Eintragung der Verschmelzung in das Register des Sitzes desjenigen Rechtsträgers, dessen Gläubiger sie sind, nach § 19 Abs. 3 UmwG als bekanntgemacht gilt, ihren Anspruch nach Grund und Höhe schriftlich anmelden, Sicherheit zu leisten, soweit sie nicht Befriedigung verlangen können. Dieses Recht steht den Gläubigern jedoch nur zu, wenn sie glaubhaft machen, dass durch die Verschmelzung die Erfüllung ihrer Forderung gefährdet wird."
    },
    {
      "date": "2025-12-16",
      "id": "140124",
      "original_text": "Registerbekanntmachung nach dem Umwandlungsgesetz\nBaden-Württemberg Amtsgericht Stuttgart HRB 800799\nDS Wärmekonzepte GmbH – Stuttgart",
      "type": "Registerbekanntmachung nach dem Umwandlungsgesetz",
      "state": "Baden-Württemberg",
      "amtsgericht": "Amtsgericht Stuttgart",
      "registernummer": "HRB 800799",
      "registerart": "HRB",
      "company_name": "DS Wärmekonzepte GmbH",
      "company_seat": "Stuttgart",
      "details": "16.12.2025 (Bekanntmachungsdatum)\n\nBaden-Württemberg Amtsgericht Stuttgart HRB 800799\nRegisterbekanntmachung nach dem Umwandlungsgesetz 16.12.2025 (Eintragungsdatum)\n\nDS Wärmekonzepte GmbH\nGesellschaft mit beschränkter Haftung\nStuttgart\n\nAls nicht eingetragen wird bekanntgemacht:\nDen Gläubigern der an der Ausgliederung beteiligten Rechtsträger ist, wenn sie binnen sechs Monaten nach dem Tag, an dem die Eintragung der Ausgliederung in das Register des Sitzes desjenigen Rechtsträgers, dessen Gläubiger sie sind, nach § 19 Abs. 3 UmwG als bekanntgemacht gilt, ihren Anspruch nach Grund und Höhe schriftlich anmelden, Sicherheit zu leisten, soweit sie nicht Befriedigung verlangen können. Dieses Recht steht den Gläubigern jedoch nur zu, wenn sie glaubhaft machen, dass durch die Ausgliederung die Erfüllung ihrer Forderung gefährdet wird."
    },
    {
      "date": "2025-12-16",
      "id": "140125",
      "original_text": "Registerbekanntmachung nach dem Umwandlungsgesetz\nHamburg Amtsgericht Hamburg HRB 101875\ntransLEEtion GmbH – Hamburg",
      "type": "Registerbekanntmachung nach dem Umwandlungsgesetz",
      "state": "Hamburg",
      "amtsgericht": "Amtsgericht Hamburg",
      "registernummer": "HRB 101875",
      "registerart": "HRB",
      "company_name": "transLEEtion GmbH",
      "company_seat": "Hamburg",
      "details": "16.12.2025 (Bekanntmachungsdatum)\n\nHamburg Amtsgericht Hamburg HRB 101875\nRegisterbekanntmachung nach dem Umwandlungsgesetz 16.12.2025 (Eintragungsdatum)\n\ntransLEEtion GmbH\nGesellschaft mit beschränkter Haftung\nHamburg\n\nAls nicht eingetragen wird bekannt gemacht:\nDen Gläubigern der an der Verschmelzung beteiligten Gesellschaften ist, wenn sie binnen sechs Monaten nach dem Tag, an dem die Eintragung der Verschmelzung in das Register des Sitzes desjenigen Rechtsträgers, dessen Gläubiger sie sind, nach § 19 Absatz 3 UmwG als bekannt gemacht gilt, ihren Anspruch nach Grund und Höhe schriftlich anmelden, Sicherheit zu leisten, soweit sie nicht Befriedigung verlangen können. Dieses Recht steht den Gläubigern jedoch nur zu, wenn sie glaubhaft machen, dass durch die Verschmelzung die Erfüllung ihrer Forderung gefährdet wird."
    },
    {
      "date": "2025-12-16",
      "id": "140126",
      "original_text": "Registerbekanntmachung nach dem Umwandlungsgesetz\nHamburg Amtsgericht Hamburg HRB 108415\nABeR - Alternativ Bus Reisen UG (haftungsbeschränkt) – Hamburg",
      "type": "Registerbekanntmachung nach dem Umwandlungsgesetz",
      "state": "Hamburg",
      "amtsgericht": "Amtsgericht Hamburg",
      "registernummer": "HRB 108415",
      "registerart": "HRB",
      "company_name": "ABeR - Alternativ Bus Reisen UG (haftungsbeschränkt)",
      "company_seat": "Hamburg",
      "details": "16.12.2025 (Bekanntmachungsdatum)\n\nHamburg Amtsgericht Hamburg HRB 108415\nRegisterbekanntmachung nach dem Umwandlungsgesetz 16.12.2025 (Eintragungsdatum)\n\nABeR - Alternativ Bus Reisen UG (haftungsbeschränkt)\nGesellschaft mit beschränkter Haftung\nHamburg\n\nAls nicht eingetragen wird bekannt gemacht:\nDen Gläubigern der an der Verschmelzung beteiligten Gesellschaften ist, wenn sie binnen sechs Monaten nach dem Tag, an dem die Eintragung der Verschmelzung in das Register des Sitzes desjenigen Rechtsträgers, dessen Gläubiger sie sind, nach § 19 Absatz 3 UmwG als bekannt gemacht gilt, ihren Anspruch nach Grund und Höhe schriftlich anmelden, Sicherheit zu leisten, soweit sie nicht Befriedigung verlangen können. Dieses Recht steht den Gläubigern jedoch nur zu, wenn sie glaubhaft machen, dass durch die Verschmelzung die Erfüllung ihrer Forderung gefährdet wird."
    },
    {
      "date": "2025-12-16",
      "id": "140127",
      "original_text": "Registerbekanntmachung nach dem Umwandlungsgesetz\nHamburg Amtsgericht Hamburg HRB 120099\nABE Abenteuer, Begegnungen, erlebnisreiche Reisen UG (haftungsbeschränkt) – Hamburg",
      "type": "Registerbekanntmachung nach dem Umwandlungsgesetz",
      "state": "Hamburg",
      "amtsgericht": "Amtsgericht Hamburg",
      "registernummer": "HRB 120099",
      "registerart": "HRB",
      "company_name": "ABE Abenteuer, Begegnungen, erlebnisreiche Reisen UG (haftungsbeschränkt)",
      "company_seat": "Hamburg",
      "details": "16.12.2025 (Bekanntmachungsdatum)\n\nHamburg Amtsgericht Hamburg HRB 120099\nRegisterbekanntmachung nach dem Umwandlungsgesetz 16.12.2025 (Eintragungsdatum)\n\nABE Abenteuer, Begegnungen, erlebnisreiche Reisen UG (haftungsbeschränkt)\nGesellschaft mit beschränkter Haftung\nHamburg\n\nAls nicht eingetragen wird bekannt gemacht:\nDen Gläubigern der an der Verschmelzung beteiligten Gesellschaften ist, wenn sie binnen sechs Monaten nach dem Tag, an dem die Eintragung der Verschmelzung in das Register des Sitzes desjenigen Rechtsträgers, dessen Gläubiger sie sind, nach § 19 Absatz 3 UmwG als bekannt gemacht gilt, ihren Anspruch nach Grund und Höhe schriftlich anmelden, Sicherheit zu leisten, soweit sie nicht Befriedigung verlangen können. Dieses Recht steht den Gläubigern jedoch nur zu, wenn sie glaubhaft machen, dass durch die Verschmelzung die Erfüllung ihrer Forderung gefährdet wird."
    },
    {
      "date": "2025-12-16",
      "id": "140128",
      "original_text": "Löschungsankündigung\nBrandenburg Amtsgericht Potsdam HRB 39206\nLUCKY-SLOTS GmbH – Ludwigsfelde",
      "type": "Löschungsankündigung",
      "state": "Brandenburg",
      "amtsgericht": "Amtsgericht Potsdam",
      "registernummer": "HRB 39206",
      "registerart": "HRB",
      "company_name": "LUCKY-SLOTS GmbH",
      "company_seat": "Ludwigsfelde",
      "details": "16.12.2025 (Bekanntmachungsdatum)\n\nBrandenburg Amtsgericht Potsdam HRB 39206\nLöschungsankündigung\n\nLUCKY-SLOTS GmbH\nGesellschaft mit beschränkter Haftung\nLudwigsfelde\n\nBei der nachstehenden Gesellschaft wird das Amtslöschungsverfahren gemäß § 394 FamFG eingeleitet. Widerspruchsfrist: 8 Wochen."
    },
    {
      "date": "2025-12-16",
      "id": "140129",
      "original_text": "Einreichung neuer Dokumente\nSachsen Amtsgericht Chemnitz HRB 26755\nSaxony Minerals & Exploration - SME AG – Halsbrücke",
      "type": "Einreichung neuer Dokumente",
      "state": "Sachsen",
      "amtsgericht": "Amtsgericht Chemnitz",
      "registernummer": "HRB 26755",
      "registerart": "HRB",
      "company_name": "Saxony Minerals & Exploration - SME AG",
      "company_seat": "Halsbrücke",
      "details": "16.12.2025 (Bekanntmachungsdatum)\n\nSachsen Amtsgericht Chemnitz HRB 26755\nEinreichung neuer Dokumente\n\nSaxony Minerals & Exploration - SME AG\nAktiengesellschaft\nHalsbrücke\n\nAm 15.12.2025 wurde beim Handelsregister des Amtsgerichts Chemnitz die Liste der Mitglieder des Aufsichtsrats gemäß § 106 AktG eingereicht."
    },
    {
      "date": "2025-12-16",
      "id": "140130",
      "original_text": "Einreichung neuer Dokumente\nSachsen Amtsgericht Dresden HRB 22152\nWirtschaftsförderung Region Meißen GmbH – Meißen",
      "type": "Einreichung neuer Dokumente",
      "state": "Sachsen",
      "amtsgericht": "Amtsgericht Dresden",
      "registernummer": "HRB 22152",
      "registerart": "HRB",
      "company_name": "Wirtschaftsförderung Region Meißen GmbH",
      "company_seat": "Meißen",
      "details": "16.12.2025 (Bekanntmachungsdatum)\n\nSachsen Amtsgericht Dresden HRB 22152\nEinreichung neuer Dokumente\n\nWirtschaftsförderung Region Meißen GmbH\nGesellschaft mit beschränkter Haftung\nMeißen\n\nAm 12.12.2025 wurde beim Handelsregister des Amtsgerichts Dresden die Liste der Mitglieder des Aufsichtsrats gemäß § 52 GmbHG eingereicht."
    },
    {
      "date": "2025-12-16",
      "id": "140131",
      "original_text": "Einreichung neuer Dokumente\nSachsen Amtsgericht Chemnitz HRB 4\nGrundstücks- und Gebäudewirtschafts-Gesellschaft m.b.H. (GGG) – Chemnitz",
      "type": "Einreichung neuer Dokumente",
      "state": "Sachsen",
      "amtsgericht": "Amtsgericht Chemnitz",
      "registernummer": "HRB 4",
      "registerart": "HRB",
      "company_name": "Grundstücks- und Gebäudewirtschafts-Gesellschaft m.b.H. (GGG)",
      "company_seat": "Chemnitz",
      "details": "16.12.2025 (Bekanntmachungsdatum)\n\nSachsen Amtsgericht Chemnitz HRB 4\nEinreichung neuer Dokumente\n\nGrundstücks- und Gebäudewirtschafts-Gesellschaft m.b.H. (GGG)\nGesellschaft mit beschränkter Haftung\nChemnitz\n\nAm 15.12.2025 wurde beim Handelsregister des Amtsgerichts Chemnitz die Liste der Mitglieder des Aufsichtsrats gemäß § 52 GmbHG eingereicht."
    },
    {
      "date": "2025-12-16",
      "id": "140132",
      "original_text": "Löschungsankündigung\nSachsen Amtsgericht Chemnitz HRB 25271\nDD&C Design Distribution und Consulting UG (haftungsbeschränkt) – Chemnitz",
      "type": "Löschungsankündigung",
      "state": "Sachsen",
      "amtsgericht": "Amtsgericht Chemnitz",
      "registernummer": "HRB 25271",
      "registerart": "HRB",
      "company_name": "DD&C Design Distribution und Consulting UG (haftungsbeschränkt)",
      "company_seat": "Chemnitz",
      "details": "16.12.2025 (Bekanntmachungsdatum)\n\nSachsen Amtsgericht Chemnitz HRB 25271\nLöschungsankündigung\n\nDD&C Design Distribution und Consulting UG (haftungsbeschränkt)\nGesellschaft mit beschränkter Haftung\nChemnitz\n\nDas Registergericht beabsichtigt, die im Handelsregister eingetragene Gesellschaft von Amts wegen nach § 394 FamFG zu löschen. Die Frist zu Erhebung eines Widerspruchs gegen die beabsichtigte Löschung wird auf einen Monat festgesetzt."
    },
    {
      "date": "2025-12-16",
      "id": "140133",
      "original_text": "Registerbekanntmachung nach dem Umwandlungsgesetz\nSachsen Amtsgericht Leipzig HRA 19800\nBauservice XXL GmbH & Co. KG – Leipzig",
      "type": "Registerbekanntmachung nach dem Umwandlungsgesetz",
      "state": "Sachsen",
      "amtsgericht": "Amtsgericht Leipzig",
      "registernummer": "HRA 19800",
      "registerart": "HRA",
      "company_name": "Bauservice XXL GmbH & Co. KG",
      "company_seat": "Leipzig",
      "details": "16.12.2025 (Bekanntmachungsdatum)\n\nSachsen Amtsgericht Leipzig HRA 19800\nRegisterbekanntmachung nach dem Umwandlungsgesetz 16.12.2025 (Eintragungsdatum)\n\nBauservice XXL GmbH & Co. KG\nKommanditgesellschaft\nLeipzig\n\nDen Gläubigern der an der Umwandlung beteiligten Rechtsträger ist, wenn sie binnen sechs Monaten nach dem Tag, an dem die Eintragung der Umwandlung in das Register des Sitzes desjenigen Rechtsträgers, dessen Gläubiger sie sind, nach § 19 Abs. 3 UmwG als bekannt gemacht gilt, ihren Anspruch nach Grund und Höhe in Textform anmelden, Sicherheit zu leisten, soweit sie nicht Befriedigung verlangen können. Dieses Recht steht den Gläubigern jedoch nur zu, wenn sie glaubhaft machen, dass durch die Umwandlung die Erfüllung der Forderung gefährdet wird."
    },
    {
      "date": "2025-12-16",
      "id": "140134",
      "original_text": "Löschungsankündigung\nSachsen Amtsgericht Dresden HRB 40164\nARAS UG (haftungsbeschränkt) – Bischofswerda",
      "type": "Löschungsankündigung",
      "state": "Sachsen",
      "amtsgericht": "Amtsgericht Dresden",
      "registernummer": "HRB 40164",
      "registerart": "HRB",
      "company_name": "ARAS UG (haftungsbeschränkt)",
      "company_seat": "Bischofswerda",
      "details": "16.12.2025 (Bekanntmachungsdatum)\n\nSachsen Amtsgericht Dresden HRB 40164\nLöschungsankündigung\n\nARAS UG (haftungsbeschränkt)\nGesellschaft mit beschränkter Haftung\nBischofswerda\n\nDas Registergericht beabsichtigt, die im Handelsregister eingetragene Gesellschaft von Amts wegen nach § 394 FamFG zu löschen. Die Frist zu Erhebung eines Widerspruchs gegen die beabsichtigte Löschung wird auf einen Monat festgesetzt."
    },
    {
      "date": "2025-12-16",
      "id": "140135",
      "original_text": "Registerbekanntmachung nach dem Umwandlungsgesetz\nSachsen Amtsgericht Leipzig HRB 30127\nBauservice XXL UG (haftungsbeschränkt) – Leipzig",
      "type": "Registerbekanntmachung nach dem Umwandlungsgesetz",
      "state": "Sachsen",
      "amtsgericht": "Amtsgericht Leipzig",
      "registernummer": "HRB 30127",
      "registerart": "HRB",
      "company_name": "Bauservice XXL UG (haftungsbeschränkt)",
      "company_seat": "Leipzig",
      "details": "16.12.2025 (Bekanntmachungsdatum)\n\nSachsen Amtsgericht Leipzig HRB 30127\nRegisterbekanntmachung nach dem Umwandlungsgesetz 16.12.2025 (Eintragungsdatum)\n\nBauservice XXL UG (haftungsbeschränkt)\nGesellschaft mit beschränkter Haftung\nLeipzig\n\nDen Gläubigern der an der Umwandlung beteiligten Rechtsträger ist, wenn sie binnen sechs Monaten nach dem Tag, an dem die Eintragung der Umwandlung in das Register des Sitzes desjenigen Rechtsträgers, dessen Gläubiger sie sind, nach § 19 Abs. 3 UmwG als bekannt gemacht gilt, ihren Anspruch nach Grund und Höhe in Textform anmelden, Sicherheit zu leisten, soweit sie nicht Befriedigung verlangen können. Dieses Recht steht den Gläubigern jedoch nur zu, wenn sie glaubhaft machen, dass durch die Umwandlung die Erfüllung der Forderung gefährdet wird."
    },
    {
      "date": "2025-12-16",
      "id": "140136",
      "original_text": "Registerbekanntmachung nach dem Umwandlungsgesetz\nNiedersachsen Amtsgericht Walsrode HRA 202192\nSolarpark Husum GmbH & Co. KG – Husum",
      "type": "Registerbekanntmachung nach dem Umwandlungsgesetz",
      "state": "Niedersachsen",
      "amtsgericht": "Amtsgericht Walsrode",
      "registernummer": "HRA 202192",
      "registerart": "HRA",
      "company_name": "Solarpark Husum GmbH & Co. KG",
      "company_seat": "Husum",
      "details": "16.12.2025 (Bekanntmachungsdatum)\n\nNiedersachsen Amtsgericht Walsrode HRA 202192\nRegisterbekanntmachung nach dem Umwandlungsgesetz 16.12.2025 (Eintragungsdatum)\n\nSolarpark Husum GmbH & Co. KG\nKommanditgesellschaft\nHusum\n\nDen Gläubigern der an der formwechselnden Umwandlung beteiligten Rechtsträger ist, wenn sie binnen sechs Monaten nach dem Tag, an dem die Eintragung der Umwandlung in das Register des Sitzes desjenigen Rechtsträgers, dessen Gläubiger sie sind, nach § 19 Abs. 3 UmwG als bekannt gemacht gilt, ihren Anspruch nach Grund und Höhe schriftlich anmelden, Sicherheit zu leisten, soweit sie nicht Befriedigung verlangen können. Dieses Recht steht den Gläubigern jedoch nur zu, wenn sie glaubhaft machen, dass durch die formwechselnde Umwandlung die Erfüllung der Forderung gefährdet wird."
    },
    {
      "date": "2025-12-16",
      "id": "140137",
      "original_text": "Registerbekanntmachung nach dem Umwandlungsgesetz\nNiedersachsen Amtsgericht Oldenburg (Oldenburg) HRB 209829\nVefo GmbH – Emstek",
      "type": "Registerbekanntmachung nach dem Umwandlungsgesetz",
      "state": "Niedersachsen",
      "amtsgericht": "Amtsgericht Oldenburg (Oldenburg)",
      "registernummer": "HRB 209829",
      "registerart": "HRB",
      "company_name": "Vefo GmbH",
      "company_seat": "Emstek",
      "details": "16.12.2025 (Bekanntmachungsdatum)\n\nNiedersachsen Amtsgericht Oldenburg (Oldenburg) HRB 209829\nRegisterbekanntmachung nach dem Umwandlungsgesetz 16.12.2025 (Eintragungsdatum)\n\nVefo GmbH\nGesellschaft mit beschränkter Haftung\nEmstek\n\nDen Gläubigern der an der Verschmelzung beteiligten Rechtsträger ist, wenn sie binnen sechs Monaten nach dem Tag, an dem die Eintragung der Verschmelzung in das Register des Sitzes desjenigen Rechtsträgers, dessen Gläubiger sie sind, nach § 19  Abs.  3 UmwG als bekannt gemacht gilt, ihren Anspruch nach Grund und Höhe schriftlich anmelden, Sicherheit zu leisten, soweit sie nicht Befriedigung verlangen können. Dieses Recht steht den Gläubigern jedoch nur zu, wenn sie glaubhaft machen, dass durch die Verschmelzung die Erfüllung der Forderung gefährdet wird."
    },
    {
      "date": "2025-12-16",
      "id": "140138",
      "original_text": "Löschungsankündigung\nNiedersachsen Amtsgericht Tostedt HRB 204224\nThilo Liedtke Recycling GmbH – Bad Bederkesa",
      "type": "Löschungsankündigung",
      "state": "Niedersachsen",
      "amtsgericht": "Amtsgericht Tostedt",
      "registernummer": "HRB 204224",
      "registerart": "HRB",
      "company_name": "Thilo Liedtke Recycling GmbH",
      "company_seat": "Bad Bederkesa",
      "details": "16.12.2025 (Bekanntmachungsdatum)\n\nNiedersachsen Amtsgericht Tostedt HRB 204224\nLöschungsankündigung\n\nThilo Liedtke Recycling GmbH\nGesellschaft mit beschränkter Haftung\nBad Bederkesa\n\nDas Registergericht beabsichtigt, die Gesellschaft von Amts wegen nach § 394 FamFG zu löschen. Die Frist zur Erhebung eines Widerspruchs ist auf 1 Monat ab dieser Registerbekanntmachung festgesetzt."
    },
    {
      "date": "2025-12-16",
      "id": "140139",
      "original_text": "Registerbekanntmachung nach dem Umwandlungsgesetz\nNiedersachsen Amtsgericht Oldenburg (Oldenburg) HRB 141626 früher Amtsgericht Delmenhorst\nNienaber Consult GmbH – Beckeln",
      "type": "Registerbekanntmachung nach dem Umwandlungsgesetz",
      "state": "Niedersachsen",
      "amtsgericht": "Amtsgericht Oldenburg (Oldenburg)",
      "registernummer": "HRB 141626",
      "registerart": "HRB",
      "company_name": "Nienaber Consult GmbH",
      "company_seat": "Beckeln",
      "former_amtsgericht": "Delmenhorst",
      "details": "16.12.2025 (Bekanntmachungsdatum)\n\nNiedersachsen Amtsgericht Oldenburg (Oldenburg) HRB 141626 früher Amtsgericht Delmenhorst\nRegisterbekanntmachung nach dem Umwandlungsgesetz 16.12.2025 (Eintragungsdatum)\n\nNienaber Consult GmbH\nGesellschaft mit beschränkter Haftung\nBeckeln\n\nDen Gläubigern der an der Verschmelzung beteiligten Rechtsträger ist, wenn sie binnen sechs Monaten nach dem Tag, an dem die Eintragung der Verschmelzung in das Register des Sitzes desjenigen Rechtsträgers, dessen Gläubiger sie sind, nach § 19  Abs.  3 UmwG als bekannt gemacht gilt, ihren Anspruch nach Grund und Höhe schriftlich anmelden, Sicherheit zu leisten, soweit sie nicht Befriedigung verlangen können. Dieses Recht steht den Gläubigern jedoch nur zu, wenn sie glaubhaft machen, dass durch die Verschmelzung die Erfüllung der Forderung gefährdet wird."
    },
    {
      "date": "2025-12-16",
      "id": "140140",
      "original_text": "Löschungsankündigung\nNiedersachsen Amtsgericht Tostedt HRB 207895\nH2-Maritime GmbH – Buchholz in der Nordheide",
      "type": "Löschungsankündigung",
      "state": "Niedersachsen",
      "amtsgericht": "Amtsgericht Tostedt",
      "registernummer": "HRB 207895",
      "registerart": "HRB",
      "company_name": "H2-Maritime GmbH",
      "company_seat": "Buchholz in der Nordheide",
      "details": "16.12.2025 (Bekanntmachungsdatum)\n\nNiedersachsen Amtsgericht Tostedt HRB 207895\nLöschungsankündigung\n\nH2-Maritime GmbH\nGesellschaft mit beschränkter Haftung\nBuchholz in der Nordheide\n\nDas Registergericht beabsichtigt, die Gesellschaft von Amts wegen nach § 394 FamFG zu löschen. Die Frist zur Erhebung eines Widerspruchs ist auf 1 Monat ab dieser Registerbekanntmachung festgesetzt."
    },
    {
      "date": "2025-12-16",
      "id": "140141",
      "original_text": "Registerbekanntmachung nach dem Umwandlungsgesetz\nNiedersachsen Amtsgericht Walsrode HRB 213235\nADIGA-Fenster GmbH – Langwedel",
      "type": "Registerbekanntmachung nach dem Umwandlungsgesetz",
      "state": "Niedersachsen",
      "amtsgericht": "Amtsgericht Walsrode",
      "registernummer": "HRB 213235",
      "registerart": "HRB",
      "company_name": "ADIGA-Fenster GmbH",
      "company_seat": "Langwedel",
      "details": "16.12.2025 (Bekanntmachungsdatum)\n\nNiedersachsen Amtsgericht Walsrode HRB 213235\nRegisterbekanntmachung nach dem Umwandlungsgesetz 16.12.2025 (Eintragungsdatum)\n\nADIGA-Fenster GmbH\nGesellschaft mit beschränkter Haftung\nLangwedel\n\nDen Gläubigern der an der Ausgliederung beteiligten Rechtsträger ist, wenn sie binnen sechs Monaten nach dem Tag, an dem die Eintragung der Ausgliederung in das Register des Sitzes desjenigen Rechtsträgers, dessen Gläubiger sie sind, nach § 19 Abs. 3 UmwG als bekannt gemacht gilt, ihren Anspruch nach Grund und Höhe schriftlich anmelden, Sicherheit zu leisten, soweit sie nicht Befriedigung verlangen können. Dieses Recht steht den Gläubigern jedoch nur zu, wenn sie glaubhaft machen, dass durch die Ausgliederung die Erfüllung der Forderung gefährdet wird."
    },
    {
      "date": "2025-12-16",
      "id": "140142",
      "original_text": "Registerbekanntmachung nach dem Umwandlungsgesetz\nNiedersachsen Amtsgericht Walsrode HRA 203402\nADIGA-Fenster e. K. – Langwedel",
      "type": "Registerbekanntmachung nach dem Umwandlungsgesetz",
      "state": "Niedersachsen",
      "amtsgericht": "Amtsgericht Walsrode",
      "registernummer": "HRA 203402",
      "registerart": "HRA",
      "company_name": "ADIGA-Fenster e. K.",
      "company_seat": "Langwedel",
      "details": "16.12.2025 (Bekanntmachungsdatum)\n\nNiedersachsen Amtsgericht Walsrode HRA 203402\nRegisterbekanntmachung nach dem Umwandlungsgesetz 16.12.2025 (Eintragungsdatum)\n\nADIGA-Fenster e. K.\nEinzelkaufmann / Einzelkauffrau\nLangwedel\n\nDen Gläubigern der an der Ausgliederung beteiligten Rechtsträger ist, wenn sie binnen sechs Monaten nach dem Tag, an dem die Eintragung der Ausgliederung in das Register des Sitzes desjenigen Rechtsträgers, dessen Gläubiger sie sind, nach § 19 Abs. 3 UmwG als bekannt gemacht gilt, ihren Anspruch nach Grund und Höhe schriftlich anmelden, Sicherheit zu leisten, soweit sie nicht Befriedigung verlangen können. Dieses Recht steht den Gläubigern jedoch nur zu, wenn sie glaubhaft machen, dass durch die Ausgliederung die Erfüllung der Forderung gefährdet wird."
    },
    {
      "date": "2025-12-16",
      "id": "140143",
      "original_text": "Registerbekanntmachung nach dem Umwandlungsgesetz\nNiedersachsen Amtsgericht Oldenburg (Oldenburg) HRB 150184 früher Amtsgericht Cloppenburg\nFriedrich Graepel Aktiengesellschaft – Löningen",
      "type": "Registerbekanntmachung nach dem Umwandlungsgesetz",
      "state": "Niedersachsen",
      "amtsgericht": "Amtsgericht Oldenburg (Oldenburg)",
      "registernummer": "HRB 150184",
      "registerart": "HRB",
      "company_name": "Friedrich Graepel Aktiengesellschaft",
      "company_seat": "Löningen",
      "former_amtsgericht": "Cloppenburg",
      "details": "16.12.2025 (Bekanntmachungsdatum)\n\nNiedersachsen Amtsgericht Oldenburg (Oldenburg) HRB 150184 früher Amtsgericht Cloppenburg\nRegisterbekanntmachung nach dem Umwandlungsgesetz\n\nFriedrich Graepel Aktiengesellschaft\nAktiengesellschaft\nLöningen\n\nEs wird darauf hingewiesen, dass ein Formwechselplan vom 11.12.2025 am 12.12.2025 beim Handelsregister eingereicht worden ist. Danach soll die Friedrich Graepel Aktiengesellschaft mit Sitz in Löningen (Amtsgericht Oldenburg (Oldb) HRB 150184) in die Firma Graepel SE formgewechselt werden."
    },
    {
      "date": "2025-12-16",
      "id": "140144",
      "original_text": "Registerbekanntmachung nach dem Umwandlungsgesetz\nNiedersachsen Amtsgericht Osnabrück GnR 200056\nInvee eG – Werlte",
      "type": "Registerbekanntmachung nach dem Umwandlungsgesetz",
      "state": "Niedersachsen",
      "amtsgericht": "Amtsgericht Osnabrück",
      "registernummer": "GnR 200056",
      "registerart": "GnR",
      "company_name": "Invee eG",
      "company_seat": "Werlte",
      "details": "16.12.2025 (Bekanntmachungsdatum)\n\nNiedersachsen Amtsgericht Osnabrück GnR 200056\nRegisterbekanntmachung nach dem Umwandlungsgesetz 16.12.2025 (Eintragungsdatum)\n\nInvee eG\neingetragene Genossenschaft\nWerlte\n\nDen Gläubigern der an der formwechselnden Umwandlung beteiligten Rechtsträger ist, wenn sie binnen sechs Monaten nach dem Tag, an dem die Eintragung der Umwandlung in das Register des Sitzes desjenigen Rechtsträgers, dessen Gläubiger sie sind, nach § 19 Abs. 3 UmwG als bekannt gemacht gilt, ihren Anspruch nach Grund und Höhe schriftlich anmelden, Sicherheit zu leisten, soweit sie nicht Befriedigung verlangen können. Dieses Recht steht den Gläubigern jedoch nur zu, wenn sie glaubhaft machen, dass durch die formwechselnde Umwandlung die Erfüllung der Forderung gefährdet wird."
    },
    {
      "date": "2025-12-16",
      "id": "140145",
      "original_text": "Löschungsankündigung\nNiedersachsen Amtsgericht Oldenburg (Oldenburg) HRB 203050\nFITECO SIA (Gesellschaft mit beschränkter Haftung nach Lettischem Recht) Zweigniederlassung 26676 Barßel – Barßel",
      "type": "Löschungsankündigung",
      "state": "Niedersachsen",
      "amtsgericht": "Amtsgericht Oldenburg (Oldenburg)",
      "registernummer": "HRB 203050",
      "registerart": "HRB",
      "company_name": "FITECO SIA (Gesellschaft mit beschränkter Haftung nach Lettischem Recht) Zweigniederlassung 26676 Barßel",
      "company_seat": "Barßel",
      "details": "16.12.2025 (Bekanntmachungsdatum)\n\nNiedersachsen Amtsgericht Oldenburg (Oldenburg) HRB 203050\nLöschungsankündigung\n\nFITECO SIA (Gesellschaft mit beschränkter Haftung nach Lettischem Recht) Zweigniederlassung 26676 Barßel\nRechtsform ausländischen Rechts HRB\nBarßel\n\nDas Registergericht beabsichtigt, die Zweigniederlassung von Amts wegen nach § 395 FamFG zu löschen. Die Frist zur Erhebung eines Widerspruchs ist auf 1 Monat ab dieser Registerbekanntmachung festgesetzt."
    },
    {
      "date": "2025-12-16",
      "id": "140146",
      "original_text": "Registerbekanntmachung nach dem Umwandlungsgesetz\nNiedersachsen Amtsgericht Oldenburg (Oldenburg) HRB 206766\nFood Fox GmbH – Emstek",
      "type": "Registerbekanntmachung nach dem Umwandlungsgesetz",
      "state": "Niedersachsen",
      "amtsgericht": "Amtsgericht Oldenburg (Oldenburg)",
      "registernummer": "HRB 206766",
      "registerart": "HRB",
      "company_name": "Food Fox GmbH",
      "company_seat": "Emstek",
      "details": "16.12.2025 (Bekanntmachungsdatum)\n\nNiedersachsen Amtsgericht Oldenburg (Oldenburg) HRB 206766\nRegisterbekanntmachung nach dem Umwandlungsgesetz 16.12.2025 (Eintragungsdatum)\n\nFood Fox GmbH\nGesellschaft mit beschränkter Haftung\nEmstek\n\nDen Gläubigern der an der Verschmelzung beteiligten Rechtsträger ist, wenn sie binnen sechs Monaten nach dem Tag, an dem die Eintragung der Verschmelzung in das Register des Sitzes desjenigen Rechtsträgers, dessen Gläubiger sie sind, nach § 19  Abs.  3 UmwG als bekannt gemacht gilt, ihren Anspruch nach Grund und Höhe schriftlich anmelden, Sicherheit zu leisten, soweit sie nicht Befriedigung verlangen können. Dieses Recht steht den Gläubigern jedoch nur zu, wenn sie glaubhaft machen, dass durch die Verschmelzung die Erfüllung der Forderung gefährdet wird."
    },
    {
      "date": "2025-12-16",
      "id": "140147",
      "original_text": "Registerbekanntmachung nach dem Umwandlungsgesetz\nNiedersachsen Amtsgericht Hannover HRB 229293\nFujimi Cha GmbH – Laatzen",
      "type": "Registerbekanntmachung nach dem Umwandlungsgesetz",
      "state": "Niedersachsen",
      "amtsgericht": "Amtsgericht Hannover",
      "registernummer": "HRB 229293",
      "registerart": "HRB",
      "company_name": "Fujimi Cha GmbH",
      "company_seat": "Laatzen",
      "details": "16.12.2025 (Bekanntmachungsdatum)\n\nNiedersachsen Amtsgericht Hannover HRB 229293\nRegisterbekanntmachung nach dem Umwandlungsgesetz 16.12.2025 (Eintragungsdatum)\n\nFujimi Cha GmbH\nGesellschaft mit beschränkter Haftung\nLaatzen\n\nDen Gläubigern der an der Verschmelzung beteiligten Rechtsträger ist, wenn sie binnen sechs Monaten nach dem Tag, an dem die Eintragung der Verschmelzung in das Register des Sitzes desjenigen Rechtsträgers, dessen Gläubiger sie sind, nach § 19  Abs.  3 UmwG als bekannt gemacht gilt, ihren Anspruch nach Grund und Höhe schriftlich anmelden, Sicherheit zu leisten, soweit sie nicht Befriedigung verlangen können. Dieses Recht steht den Gläubigern jedoch nur zu, wenn sie glaubhaft machen, dass durch die Verschmelzung die Erfüllung der Forderung gefährdet wird."
    },
    {
      "date": "2025-12-16",
      "id": "140148",
      "original_text": "Registerbekanntmachung nach dem Umwandlungsgesetz\nNiedersachsen Amtsgericht Walsrode HRB 213236\nSolarpark Husum GmbH – Husum",
      "type": "Registerbekanntmachung nach dem Umwandlungsgesetz",
      "state": "Niedersachsen",
      "amtsgericht": "Amtsgericht Walsrode",
      "registernummer": "HRB 213236",
      "registerart": "HRB",
      "company_name": "Solarpark Husum GmbH",
      "company_seat": "Husum",
      "details": "16.12.2025 (Bekanntmachungsdatum)\n\nNiedersachsen Amtsgericht Walsrode HRB 213236\nRegisterbekanntmachung nach dem Umwandlungsgesetz 16.12.2025 (Eintragungsdatum)\n\nSolarpark Husum GmbH\nGesellschaft mit beschränkter Haftung\nHusum\n\nDen Gläubigern der an der formwechselnden Umwandlung beteiligten Rechtsträger ist, wenn sie binnen sechs Monaten nach dem Tag, an dem die Eintragung der Umwandlung in das Register des Sitzes desjenigen Rechtsträgers, dessen Gläubiger sie sind, nach § 19 Abs. 3 UmwG als bekannt gemacht gilt, ihren Anspruch nach Grund und Höhe schriftlich anmelden, Sicherheit zu leisten, soweit sie nicht Befriedigung verlangen können. Dieses Recht steht den Gläubigern jedoch nur zu, wenn sie glaubhaft machen, dass durch die formwechselnde Umwandlung die Erfüllung der Forderung gefährdet wird."
    },
    {
      "date": "2025-12-16",
      "id": "140149",
      "original_text": "Registerbekanntmachung nach dem Umwandlungsgesetz\nNiedersachsen Amtsgericht Osnabrück HRB 131816\nzvoove Software Germany GmbH – Wietmarschen-Lohne",
      "type": "Registerbekanntmachung nach dem Umwandlungsgesetz",
      "state": "Niedersachsen",
      "amtsgericht": "Amtsgericht Osnabrück",
      "registernummer": "HRB 131816",
      "registerart": "HRB",
      "company_name": "zvoove Software Germany GmbH",
      "company_seat": "Wietmarschen-Lohne",
      "details": "16.12.2025 (Bekanntmachungsdatum)\n\nNiedersachsen Amtsgericht Osnabrück HRB 131816\nRegisterbekanntmachung nach dem Umwandlungsgesetz 16.12.2025 (Eintragungsdatum)\n\nzvoove Software Germany GmbH\nGesellschaft mit beschränkter Haftung\nWietmarschen-Lohne\n\nDen Gläubigern der an der Verschmelzung beteiligten Rechtsträger ist, wenn sie binnen sechs Monaten nach dem Tag, an dem die Eintragung der Verschmelzung in das Register des Sitzes desjenigen Rechtsträgers, dessen Gläubiger sie sind, nach § 19  Abs.  3 UmwG als bekannt gemacht gilt, ihren Anspruch nach Grund und Höhe schriftlich anmelden, Sicherheit zu leisten, soweit sie nicht Befriedigung verlangen können. Dieses Recht steht den Gläubigern jedoch nur zu, wenn sie glaubhaft machen, dass durch die Verschmelzung die Erfüllung der Forderung gefährdet wird."
    },
    {
      "date": "2025-12-16",
      "id": "140150",
      "original_text": "Registerbekanntmachung nach dem Umwandlungsgesetz\nBremen Amtsgericht Bremen HRB 31379\nPneuInvest GmbH – Bremen",
      "type": "Registerbekanntmachung nach dem Umwandlungsgesetz",
      "state": "Bremen",
      "amtsgericht": "Amtsgericht Bremen",
      "registernummer": "HRB 31379",
      "registerart": "HRB",
      "company_name": "PneuInvest GmbH",
      "company_seat": "Bremen",
      "details": "16.12.2025 (Bekanntmachungsdatum)\n\nBremen Amtsgericht Bremen HRB 31379\nRegisterbekanntmachung nach dem Umwandlungsgesetz 11.12.2025 (Eintragungsdatum)\n\nPneuInvest GmbH\nGesellschaft mit beschränkter Haftung\nBremen\n\nZu Eintragungsnummer 2 vom 11.12.2025 wird als nicht eingetragen veröffentlicht: Den Gläubigern der an der Verschmelzung beteiligten Rechtsträger ist, wenn sie binnen sechs Monaten nach dem Tag, an dem die Eintragung der Verschmelzung in das Register des Sitzes desjenigen Rechtsträgers, dessen Gläubiger sie sind, als bekannt gemacht gilt, ihren Anspruch nach Grund und Höhe schriftlich anmelden, Sicherheit zu leisten, soweit sie nicht Befriedigung verlangen können. Dieses Recht steht den Gläubigern jedoch nur zu, wenn sie glaubhaft machen, dass durch die Verschmelzung die Erfüllung ihrer Forderung gefährdet wird. Das Recht, Sicherheitsleistung zu verlangen, steht Gläubigern nicht zu, die im Falle der Insolvenz ein Recht auf vorzugsweise Befriedigung aus einer Deckungsmasse haben, die nach gesetzlicher Vorschrift zu ihrem Schutz errichtet und staatlich überwacht ist."
    },
    {
      "date": "2025-12-16",
      "id": "140151",
      "original_text": "Sonstige Registerbekanntmachung\nRheinland-Pfalz Amtsgericht Montabaur HRB 2017\nSchäfer Shop GmbH – Betzdorf",
      "type": "Sonstige Registerbekanntmachung",
      "state": "Rheinland-Pfalz",
      "amtsgericht": "Amtsgericht Montabaur",
      "registernummer": "HRB 2017",
      "registerart": "HRB",
      "company_name": "Schäfer Shop GmbH",
      "company_seat": "Betzdorf",
      "details": "16.12.2025 (Bekanntmachungsdatum)\n\nRheinland-Pfalz Amtsgericht Montabaur HRB 2017\nSonstige Registerbekanntmachung 16.12.2025 (Eintragungsdatum)\n\nSchäfer Shop GmbH\nGesellschaft mit beschränkter Haftung\nBetzdorf\n\nDen Gläubigern der an der grenzüberschreitenden Verschmelzung beteiligten übernehmenden Rechtsträger ist, wenn sie binnen sechs Monaten nach dem Tag, an dem die Eintragung der Spaltung in das Register des Sitzes desjenigen Rechtsträgers, dessen Gläubiger sie sind, nach § 19 Absatz 3 UmwG als bekanntgemacht gilt, ihren Anspruch nach Grund und Höhe schriftlich anmelden, Sicherheit zu leisten, soweit sie nicht Befriedigung verlangen können.\n\nDieses Recht steht den Gläubigern jedoch nur zu, wenn sie glaubhaft machen, dass durch die Verschmelzung die Erfüllung ihrer Forderung gefährdet wird."
    },
    {
      "date": "2025-12-16",
      "id": "140152",
      "original_text": "Registerbekanntmachung nach dem Umwandlungsgesetz\nRheinland-Pfalz Amtsgericht Bad Kreuznach HRA 21003\nHL. Becker Grundstücksverwaltungs GmbH & Co. KG – Idar-Oberstein",
      "type": "Registerbekanntmachung nach dem Umwandlungsgesetz",
      "state": "Rheinland-Pfalz",
      "amtsgericht": "Amtsgericht Bad Kreuznach",
      "registernummer": "HRA 21003",
      "registerart": "HRA",
      "company_name": "HL. Becker Grundstücksverwaltungs GmbH & Co. KG",
      "company_seat": "Idar-Oberstein",
      "details": "16.12.2025 (Bekanntmachungsdatum)\n\nRheinland-Pfalz Amtsgericht Bad Kreuznach HRA 21003\nRegisterbekanntmachung nach dem Umwandlungsgesetz 16.12.2025 (Eintragungsdatum)\n\nHL. Becker Grundstücksverwaltungs GmbH & Co. KG\nKommanditgesellschaft\nIdar-Oberstein\n\nAls nicht eingetragen wird veröffentlicht:\nDen Gläubigern des formwechselnden Rechtsträgers ist, wenn sie binnen sechs Monaten nach dem Tag, an dem die Eintragung des Formwechsels nach § 201 UmwG als bekannt gemacht gilt, ihren Anspruch nach Grund und Höhe schriftlich anmelden, Sicherheit zu leisten, soweit sie nicht Befriedigung verlangen können. Dieses Recht steht den Gläubigern jedoch nur zu, wenn sie glaubhaft machen, dass durch den Formwechsel die Erfüllung der Forderung gefährdet wird."
    },
    {
      "date": "2025-12-16",
      "id": "140153",
      "original_text": "Einreichung neuer Dokumente\nRheinland-Pfalz Amtsgericht Landau HRB 11595\nStadtwerke Germersheim GmbH – Germersheim",
      "type": "Einreichung neuer Dokumente",
      "state": "Rheinland-Pfalz",
      "amtsgericht": "Amtsgericht Landau",
      "registernummer": "HRB 11595",
      "registerart": "HRB",
      "company_name": "Stadtwerke Germersheim GmbH",
      "company_seat": "Germersheim",
      "details": "16.12.2025 (Bekanntmachungsdatum)\n\nRheinland-Pfalz Amtsgericht Landau HRB 11595\nEinreichung neuer Dokumente 16.12.2025 (Eintragungsdatum)\n\nStadtwerke Germersheim GmbH\nGesellschaft mit beschränkter Haftung\nGermersheim\n\nDem Registergericht ist eine neue Liste der Mitglieder des Aufsichtsrates eingereicht worden."
    },
    {
      "date": "2025-12-16",
      "id": "140154",
      "original_text": "Registerbekanntmachung nach dem Umwandlungsgesetz\nRheinland-Pfalz Amtsgericht Montabaur HRB 26523\nYellow Brand Ventures GmbH – Betzdorf",
      "type": "Registerbekanntmachung nach dem Umwandlungsgesetz",
      "state": "Rheinland-Pfalz",
      "amtsgericht": "Amtsgericht Montabaur",
      "registernummer": "HRB 26523",
      "registerart": "HRB",
      "company_name": "Yellow Brand Ventures GmbH",
      "company_seat": "Betzdorf",
      "details": "16.12.2025 (Bekanntmachungsdatum)\n\nRheinland-Pfalz Amtsgericht Montabaur HRB 26523\nRegisterbekanntmachung nach dem Umwandlungsgesetz 16.12.2025 (Eintragungsdatum)\n\nYellow Brand Ventures GmbH\nGesellschaft mit beschränkter Haftung\nBetzdorf\n\nAls nicht eingetragen wird veröffentlicht: Den Gläubigern der an der Verschmelzung beteiligten Rechtsträger ist, wenn sie binnen sechs Monaten nach dem Tag, an dem die Eintragung der Verschmelzung in das Register des Sitzes desjenigen Rechtsträgers, dessen Gläubiger sie sind, nach § 19 Abs. 3 UmwG als bekannt gemacht gilt, ihren Anspruch nach Grund und Höhe schriftlich anmelden, Sicherheit zu leisten, soweit sie nicht Befriedigung verlangen können. Dieses Recht steht den Gläubigern jedoch nur zu, wenn sie glaubhaft machen, dass durch die Verschmelzung die Erfüllung der Forderung gefährdet wird."
    },
    {
      "date": "2025-12-16",
      "id": "140155",
      "original_text": "Registerbekanntmachung nach dem Umwandlungsgesetz\nRheinland-Pfalz Amtsgericht Koblenz HRB 31559\nBBT Seniorendienste Region Trier gGmbH – Koblenz",
      "type": "Registerbekanntmachung nach dem Umwandlungsgesetz",
      "state": "Rheinland-Pfalz",
      "amtsgericht": "Amtsgericht Koblenz",
      "registernummer": "HRB 31559",
      "registerart": "HRB",
      "company_name": "BBT Seniorendienste Region Trier gGmbH",
      "company_seat": "Koblenz",
      "details": "16.12.2025 (Bekanntmachungsdatum)\n\nRheinland-Pfalz Amtsgericht Koblenz HRB 31559\nRegisterbekanntmachung nach dem Umwandlungsgesetz 16.12.2025 (Eintragungsdatum)\n\nBBT Seniorendienste Region Trier gGmbH\nGesellschaft mit beschränkter Haftung\nKoblenz\n\nAls nicht eingetragen wird veröffentlicht: Den Gläubigern der an der Ausgliederung beteiligten Rechtsträger ist, wenn sie binnen sechs Monaten nac hdem Tag, an dem die Eintragung der Ausgliederung in das Register des Sitzes desjenigen Rechtsträgers,dessen Gläubiger sie sind, nach § 19 Abs. 3 UmwG als bekannt gemacht gilt, ihren Anspruch nach Grund und Höhe schriftlich anmelden, Sicherheit zu leisten, soweit sie nicht Befriedigung verlangen können. Dieses Recht steht den Gläubigern jedoch nur zu, wenn sie glaubhaft machen, dass durch die Ausgliederung die Erfüllung der Forderung gefährdet wird."
    },
    {
      "date": "2025-12-16",
      "id": "140156",
      "original_text": "Registerbekanntmachung nach dem Umwandlungsgesetz\nRheinland-Pfalz Amtsgericht Wittlich HRB 21721\nMettler Packaging GmbH – Morbach",
      "type": "Registerbekanntmachung nach dem Umwandlungsgesetz",
      "state": "Rheinland-Pfalz",
      "amtsgericht": "Amtsgericht Wittlich",
      "registernummer": "HRB 21721",
      "registerart": "HRB",
      "company_name": "Mettler Packaging GmbH",
      "company_seat": "Morbach",
      "details": "16.12.2025 (Bekanntmachungsdatum)\n\nRheinland-Pfalz Amtsgericht Wittlich HRB 21721\nRegisterbekanntmachung nach dem Umwandlungsgesetz 16.12.2025 (Eintragungsdatum)\n\nMettler Packaging GmbH\nGesellschaft mit beschränkter Haftung\nMorbach\n\nAls nicht eingetragen wird veröffentlicht:\nDen Gläubigern des formwechselnden Rechtsträgers ist, wenn sie binnen sechs Monaten nach dem Tag, an dem die Eintragung des Formwechsels nach § 201 UmwG als bekannt gemacht gilt, ihren Anspruch nach Grund und Höhe schriftlich anmelden, Sicherheit zu leisten, soweit sie nicht Befriedigung verlangen können. Dieses Recht steht den Gläubigern jedoch nur zu, wenn sie glaubhaft machen, dass durch den Formwechsel die Erfüllung der Forderung gefährdet wird."
    },
    {
      "date": "2025-12-16",
      "id": "140157",
      "original_text": "Sonstige Registerbekanntmachung\nRheinland-Pfalz Amtsgericht Montabaur HRB 30725\nChB GmbH – Neuwied",
      "type": "Sonstige Registerbekanntmachung",
      "state": "Rheinland-Pfalz",
      "amtsgericht": "Amtsgericht Montabaur",
      "registernummer": "HRB 30725",
      "registerart": "HRB",
      "company_name": "ChB GmbH",
      "company_seat": "Neuwied",
      "details": "16.12.2025 (Bekanntmachungsdatum)\n\nRheinland-Pfalz Amtsgericht Montabaur HRB 30725\nSonstige Registerbekanntmachung 16.12.2025 (Eintragungsdatum)\n\nChB GmbH\nGesellschaft mit beschränkter Haftung\nNeuwied\n\nDen Gläubigern der an dem grenzüberschreitenden Formwechsel beteiligten übernehmenden Rechtsträger (hier: ChB GmbH) ist, wenn sie binnen sechs Monaten nach dem Tag, an dem die Eintragung der Spaltung in das Register des Sitzes desjenigen Rechtsträgers, dessen Gläubiger sie sind, nach § 19 Absatz 3 UmwG als bekanntgemacht gilt, ihren Anspruch nach Grund und Höhe schriftlich anmelden, Sicherheit zu leisten, soweit sie nicht Befriedigung verlangen können.\n\nDieses Recht steht den Gläubigern jedoch nur zu, wenn sie glaubhaft machen, dass durch den Formwechsel die Erfüllung ihrer Forderung gefährdet wird."
    },
    {
      "date": "2025-12-16",
      "id": "140158",
      "original_text": "Registerbekanntmachung nach dem Umwandlungsgesetz\nRheinland-Pfalz Amtsgericht Bad Kreuznach HRB 20636\nMöbelwerke Mastershausen GmbH – Mastershausen",
      "type": "Registerbekanntmachung nach dem Umwandlungsgesetz",
      "state": "Rheinland-Pfalz",
      "amtsgericht": "Amtsgericht Bad Kreuznach",
      "registernummer": "HRB 20636",
      "registerart": "HRB",
      "company_name": "Möbelwerke Mastershausen GmbH",
      "company_seat": "Mastershausen",
      "details": "16.12.2025 (Bekanntmachungsdatum)\n\nRheinland-Pfalz Amtsgericht Bad Kreuznach HRB 20636\nRegisterbekanntmachung nach dem Umwandlungsgesetz 16.12.2025 (Eintragungsdatum)\n\nMöbelwerke Mastershausen GmbH\nGesellschaft mit beschränkter Haftung\nMastershausen\n\nAls nicht eingetragen wird veröffentlicht: Den Gläubigern der an der Verschmelzung beteiligten Rechtsträger ist, wenn sie binnen sechs Monaten nach dem Tag, an dem die Eintragung der Verschmelzung in das Register des Sitzes desjenigen Rechtsträgers, dessen Gläubiger sie sind, nach § 19 Abs. 3 UmwG als bekannt gemacht gilt, ihren Anspruch nach Grund und Höhe schriftlich anmelden, Sicherheit zu leisten, soweit sie nicht Befriedigung verlangen können. Dieses Recht steht den Gläubigern jedoch nur zu, wenn sie glaubhaft machen, dass durch die Verschmelzung die Erfüllung der Forderung gefährdet wird."
    },
    {
      "date": "2025-12-16",
      "id": "140159",
      "original_text": "Registerbekanntmachung nach dem Umwandlungsgesetz\nNordrhein-Westfalen Amtsgericht Hamm HRB 5094\nM&R Recycling Solutions GmbH – Bergkamen",
      "type": "Registerbekanntmachung nach dem Umwandlungsgesetz",
      "state": "Nordrhein-Westfalen",
      "amtsgericht": "Amtsgericht Hamm",
      "registernummer": "HRB 5094",
      "registerart": "HRB",
      "company_name": "M&R Recycling Solutions GmbH",
      "company_seat": "Bergkamen",
      "details": "16.12.2025 (Bekanntmachungsdatum)\n\nNordrhein-Westfalen Amtsgericht Hamm HRB 5094\nRegisterbekanntmachung nach dem Umwandlungsgesetz 11.12.2025 (Eintragungsdatum)\n\nM&R Recycling Solutions GmbH\nGesellschaft mit beschränkter Haftung\nBergkamen\n\nDen Gläubigern der an der Verschmelzung beteiligten Rechtsträger ist, wenn sie binnen sechs Monaten nach dem Tag, an dem die Eintragung der Verschmelzung in das Register des Sitzes derjenigen Rechtsträger deren Gläubiger sie sind, nach § 19 Absatz 3 UmwG als bekanntgemacht gilt, ihren Anspruch nach Grund und Höhe schriftlich anmelden, Sicherheit zu leisten, soweit sie nicht Befriedigung verlangen können. Dieses Recht steht den Gläubigern jedoch nur zu, wenn sie glaubhaft machen, dass durch die Verschmelzung die Erfüllung ihrer Forderung gefährdet wird."
    },
    {
      "date": "2025-12-16",
      "id": "140160",
      "original_text": "Einreichung neuer Dokumente\nNordrhein-Westfalen Amtsgericht Paderborn HRB 18143\nHöner AG – Büren",
      "type": "Einreichung neuer Dokumente",
      "state": "Nordrhein-Westfalen",
      "amtsgericht": "Amtsgericht Paderborn",
      "registernummer": "HRB 18143",
      "registerart": "HRB",
      "company_name": "Höner AG",
      "company_seat": "Büren",
      "details": "16.12.2025 (Bekanntmachungsdatum)\n\nNordrhein-Westfalen Amtsgericht Paderborn HRB 18143\nEinreichung neuer Dokumente\n\nHöner AG\nAktiengesellschaft\nBüren\n\nDem Registergericht ist eine neue Liste der Mitglieder des Aufsichtsrates eingereicht worden."
    },
    {
      "date": "2025-12-16",
      "id": "140161",
      "original_text": "Registerbekanntmachung nach dem Umwandlungsgesetz\nNordrhein-Westfalen Amtsgericht Köln HRB 47551\nMAX BAERMANN HOLDING AG – Bergisch Gladbach",
      "type": "Registerbekanntmachung nach dem Umwandlungsgesetz",
      "state": "Nordrhein-Westfalen",
      "amtsgericht": "Amtsgericht Köln",
      "registernummer": "HRB 47551",
      "registerart": "HRB",
      "company_name": "MAX BAERMANN HOLDING AG",
      "company_seat": "Bergisch Gladbach",
      "details": "16.12.2025 (Bekanntmachungsdatum)\n\nNordrhein-Westfalen Amtsgericht Köln HRB 47551\nRegisterbekanntmachung nach dem Umwandlungsgesetz 16.12.2025 (Eintragungsdatum)\n\nMAX BAERMANN HOLDING AG\nAktiengesellschaft\nBergisch Gladbach\n\nDen Gläubigern der an der formwechselnden Umwandlung beteiligten Rechtsträger ist, wenn sie binnen sechs Monaten nach dem Tag, an dem die Eintragung der formwechselnden Umwandlung in das Register des Sitzes desjenigen Rechtsträgers, dessen Gläubiger sie sind, nach § 19 Absatz 3 UmwG als bekanntgemacht gilt, ihren Anspruch nach Grund und Höhe schriftlich anmelden, Sicherheit zu leisten, soweit sie nicht Befriedigung verlangen können. Dieses Recht steht den Gläubigern jedoch nur zu, wenn sie glaubhaft machen, dass durch die formwechselnden Umwandlung die Erfüllung ihrer Forderung gefährdet wird."
    },
    {
      "date": "2025-12-16",
      "id": "140162",
      "original_text": "Löschungsankündigung\nNordrhein-Westfalen Amtsgericht Gütersloh HRB 11784\nHC-Sportsbar GmbH – Herzebrock-Clarholz",
      "type": "Löschungsankündigung",
      "state": "Nordrhein-Westfalen",
      "amtsgericht": "Amtsgericht Gütersloh",
      "registernummer": "HRB 11784",
      "registerart": "HRB",
      "company_name": "HC-Sportsbar GmbH",
      "company_seat": "Herzebrock-Clarholz",
      "details": "16.12.2025 (Bekanntmachungsdatum)\n\nNordrhein-Westfalen Amtsgericht Gütersloh HRB 11784\nLöschungsankündigung 16.12.2025 (Eintragungsdatum)\n\nHC-Sportsbar GmbH\nGesellschaft mit beschränkter Haftung\nHerzebrock-Clarholz\n\nDas Registergericht beabsichtigt die Gesellschaft von Amts wegen nach § 394 FamFG zu löschen. Die Frist zur Erhebung eines Widerspruchs ist auf einen Monat festgesetzt."
    },
    {
      "date": "2025-12-16",
      "id": "140163",
      "original_text": "Einreichung neuer Dokumente\nNordrhein-Westfalen Amtsgericht Essen HRB 37039\nTKMS AG & Co. KGaA – Essen",
      "type": "Einreichung neuer Dokumente",
      "state": "Nordrhein-Westfalen",
      "amtsgericht": "Amtsgericht Essen",
      "registernummer": "HRB 37039",
      "registerart": "HRB",
      "company_name": "TKMS AG & Co. KGaA",
      "company_seat": "Essen",
      "details": "16.12.2025 (Bekanntmachungsdatum)\n\nNordrhein-Westfalen Amtsgericht Essen HRB 37039\nEinreichung neuer Dokumente\n\nTKMS AG & Co. KGaA\nKommanditgesellschaft auf Aktien\nEssen\n\nDem Registergericht ist eine neue Liste der Mitglieder des Aufsichtsrates eingereicht worden."
    },
    {
      "date": "2025-12-16",
      "id": "140164",
      "original_text": "Löschungsankündigung\nNordrhein-Westfalen Amtsgericht Kleve HRB 13986\nA&C Cars GmbH – Kamp-Lintfort",
      "type": "Löschungsankündigung",
      "state": "Nordrhein-Westfalen",
      "amtsgericht": "Amtsgericht Kleve",
      "registernummer": "HRB 13986",
      "registerart": "HRB",
      "company_name": "A&C Cars GmbH",
      "company_seat": "Kamp-Lintfort",
      "details": "16.12.2025 (Bekanntmachungsdatum)\n\nNordrhein-Westfalen Amtsgericht Kleve HRB 13986\nLöschungsankündigung\n\nA&C Cars GmbH\nGesellschaft mit beschränkter Haftung\nKamp-Lintfort\n\nDas Registergericht beabsichtigt die Gesellschaft von Amts wegen nach § 394 FamFG zu löschen. Die Frist zur Erhebung eines Widerspruchs ist auf einen Monat festgesetzt."
    },
    {
      "date": "2025-12-16",
      "id": "140165",
      "original_text": "Löschungsankündigung\nNordrhein-Westfalen Amtsgericht Düsseldorf HRB 42757\nMarbert Cosmetics GmbH – Düsseldorf",
      "type": "Löschungsankündigung",
      "state": "Nordrhein-Westfalen",
      "amtsgericht": "Amtsgericht Düsseldorf",
      "registernummer": "HRB 42757",
      "registerart": "HRB",
      "company_name": "Marbert Cosmetics GmbH",
      "company_seat": "Düsseldorf",
      "details": "16.12.2025 (Bekanntmachungsdatum)\n\nNordrhein-Westfalen Amtsgericht Düsseldorf HRB 42757\nLöschungsankündigung\n\nMarbert Cosmetics GmbH\nGesellschaft mit beschränkter Haftung\nDüsseldorf\n\nDas Registergericht beabsichtigt die Gesellschaft von Amts wegen nach § 394 FamFG zu löschen. Die Frist zur Erhebung eines Widerspruchs ist auf 3 Wochen festgesetzt.\n\nRechtsbehelfsbelehrung:\nDas Widerspruchsrecht steht jedem zu, der an der Unterlassung der Löschung ein berechtigtes Interesse hat. Der Widerspruch ist bei dem Amtsgericht Düsseldorf -Registergericht-, Werdener Straße 1, 40227 Düsseldorf schriftlich in deutscher Sprache oder zur Niederschrift der Geschäftsstelle einzulegen. Der Widerspruch kann auch zur Niederschrift der Geschäftsstelle eines jeden Amtsgerichtes abgegeben werden. Die Einlegung ist auch durch Übertragung eines elektronischen Dokuments an die elektronische Poststelle des Gerichts möglich. Das elektronische Dokument muss für die Bearbeitung durch das Gericht geeignet und mit einer qualifizierten elektronischen Signatur der verantwortenden Person versehen sein oder von der verantwortenden Person signiert und auf einem sicheren Übermittlungsweg gemäß § 130a ZPO nach näherer Maßgabe der Verordnung über die technischen Rahmenbedingungen des elektronischen Rechtsverkehrs und über das besondere elektronische Behördenpostfach (BGBl. I, S.3803) eingereicht werden. Weitere Informationen erhalten Sie auf der Internetseite www.justiz.de.\nDer Widerspruch muss spätestens innerhalb der gesetzten Frist nach dem Datum der Bekanntmachung der Löschungsankündigung bei dem Amtsgericht - Registergericht - Düsseldorf eingegangen sein.  Dies gilt auch dann, wenn der Widerspruch zur Niederschrift der Geschäftsstelle eines anderen Amtsgerichtes abgegeben wurde. Die Frist beginnt mit dem Tage der Bekanntmachung der Löschungsankündigung in dem für die Bekanntmachung der Eintragungen in das Handelsregister bestimmten elektronischen Informations- und Kommunikationssystem nach § 10 des Handelsgesetzbuches. Fällt das Ende der Frist auf einen Sonntag, einen allgemeinen Feiertag oder Sonnabend, so endet die Frist mit Ablauf des nächsten Werktages.\nDer Widerspruch muss die Bezeichnung der angefochtenen Löschungsankündigung sowie die Erklärung enthalten, dass Widerspruch gegen diese Löschungsankündigung eingelegt wird. Er ist zu unterzeichnen und soll begründet werden."
    },
    {
      "date": "2025-12-16",
      "id": "140166",
      "original_text": "Löschungsankündigung\nNordrhein-Westfalen Amtsgericht Bochum HRB 15405\nDK Verleih UG (haftungsbeschränkt) – Witten",
      "type": "Löschungsankündigung",
      "state": "Nordrhein-Westfalen",
      "amtsgericht": "Amtsgericht Bochum",
      "registernummer": "HRB 15405",
      "registerart": "HRB",
      "company_name": "DK Verleih UG (haftungsbeschränkt)",
      "company_seat": "Witten",
      "details": "16.12.2025 (Bekanntmachungsdatum)\n\nNordrhein-Westfalen Amtsgericht Bochum HRB 15405\nLöschungsankündigung 17.12.2025 (Eintragungsdatum)\n\nDK Verleih UG (haftungsbeschränkt)\nGesellschaft mit beschränkter Haftung\nWitten\n\nDas Registergericht beabsichtigt die Gesellschaft von Amts wegen nach § 394 FamFG zu löschen. Die Frist zur Erhebung eines Widerspruchs ist auf drei Monate festgesetzt."
    },
    {
      "date": "2025-12-16",
      "id": "140167",
      "original_text": "Registerbekanntmachung nach dem Umwandlungsgesetz\nNordrhein-Westfalen Amtsgericht Düsseldorf HRA 25956\nWattner SunAsset Solarkraftwerk 012 GmbH & Co. KG – Monheim am Rhein",
      "type": "Registerbekanntmachung nach dem Umwandlungsgesetz",
      "state": "Nordrhein-Westfalen",
      "amtsgericht": "Amtsgericht Düsseldorf",
      "registernummer": "HRA 25956",
      "registerart": "HRA",
      "company_name": "Wattner SunAsset Solarkraftwerk 012 GmbH & Co. KG",
      "company_seat": "Monheim am Rhein",
      "details": "16.12.2025 (Bekanntmachungsdatum)\n\nNordrhein-Westfalen Amtsgericht Düsseldorf HRA 25956\nRegisterbekanntmachung nach dem Umwandlungsgesetz 16.12.2025 (Eintragungsdatum)\n\nWattner SunAsset Solarkraftwerk 012 GmbH & Co. KG\nKommanditgesellschaft\nMonheim am Rhein\n\nDen Gläubigern der an der Verschmelzung beteiligten Rechtsträger ist, wenn sie binnen sechs Monaten nach dem Tag, an dem die Eintragung der Verschmelzung in das Register des Sitzes desjenigen Rechtsträgers, dessen Gläubiger sie sind, nach § 19 Absatz 3 UmwG als bekanntgemacht gilt, ihren Anspruch nach Grund und Höhe schriftlich anmelden, Sicherheit zu leisten, soweit sie nicht Befriedigung verlangen können. Dieses Recht steht den Gläubigern jedoch nur zu, wenn sie glaubhaft machen, dass durch die Verschmelzung die Erfüllung ihrer Forderung gefährdet wird."
    },
    {
      "date": "2025-12-16",
      "id": "140168",
      "original_text": "Löschungsankündigung\nNordrhein-Westfalen Amtsgericht Kleve HRB 17252\nfairsand GmbH – Neukirchen-Vluyn",
      "type": "Löschungsankündigung",
      "state": "Nordrhein-Westfalen",
      "amtsgericht": "Amtsgericht Kleve",
      "registernummer": "HRB 17252",
      "registerart": "HRB",
      "company_name": "fairsand GmbH",
      "company_seat": "Neukirchen-Vluyn",
      "details": "16.12.2025 (Bekanntmachungsdatum)\n\nNordrhein-Westfalen Amtsgericht Kleve HRB 17252\nLöschungsankündigung\n\nfairsand GmbH\nGesellschaft mit beschränkter Haftung\nNeukirchen-Vluyn\n\nDas Registergericht beabsichtigt die Gesellschaft von Amts wegen nach § 394 FamFG zu löschen. Die Frist zur Erhebung eines Widerspruchs ist auf einen Monat festgesetzt."
    },
    {
      "date": "2025-12-16",
      "id": "140169",
      "original_text": "Registerbekanntmachung nach dem Umwandlungsgesetz\nNordrhein-Westfalen Amtsgericht Hamm HRB 7958\nBK Neutor Galerie Gastro GmbH – Hamm",
      "type": "Registerbekanntmachung nach dem Umwandlungsgesetz",
      "state": "Nordrhein-Westfalen",
      "amtsgericht": "Amtsgericht Hamm",
      "registernummer": "HRB 7958",
      "registerart": "HRB",
      "company_name": "BK Neutor Galerie Gastro GmbH",
      "company_seat": "Hamm",
      "details": "16.12.2025 (Bekanntmachungsdatum)\n\nNordrhein-Westfalen Amtsgericht Hamm HRB 7958\nRegisterbekanntmachung nach dem Umwandlungsgesetz 16.12.2025 (Eintragungsdatum)\n\nBK Neutor Galerie Gastro GmbH\nGesellschaft mit beschränkter Haftung\nHamm\n\nDen Gläubigern der an der Verschmelzung beteiligten Rechtsträger ist, wenn sie binnen sechs Monaten nach dem Tag, an dem die Eintragung der Verschmelzung in das Register des Sitzes derjenigen Rechtsträger deren Gläubiger sie sind, nach § 19 Absatz 3 UmwG als bekanntgemacht gilt, ihren Anspruch nach Grund und Höhe schriftlich anmelden, Sicherheit zu leisten, soweit sie nicht Befriedigung verlangen können. Dieses Recht steht den Gläubigern jedoch nur zu, wenn sie glaubhaft machen, dass durch die Verschmelzung die Erfüllung ihrer Forderung gefährdet wird."
    },
    {
      "date": "2025-12-16",
      "id": "140170",
      "original_text": "Löschungsankündigung\nNordrhein-Westfalen Amtsgericht Dortmund HRB 35291\nMedical Line GmbH Kosmetikschule – Dortmund",
      "type": "Löschungsankündigung",
      "state": "Nordrhein-Westfalen",
      "amtsgericht": "Amtsgericht Dortmund",
      "registernummer": "HRB 35291",
      "registerart": "HRB",
      "company_name": "Medical Line GmbH Kosmetikschule",
      "company_seat": "Dortmund",
      "details": "16.12.2025 (Bekanntmachungsdatum)\n\nNordrhein-Westfalen Amtsgericht Dortmund HRB 35291\nLöschungsankündigung 16.12.2025 (Eintragungsdatum)\n\nMedical Line GmbH Kosmetikschule\nGesellschaft mit beschränkter Haftung\nDortmund\n\nDas Registergericht beabsichtigt die Gesellschaft von Amts wegen nach § 394 FamFG zu löschen. Die Frist zur Erhebung eines Widerspruchs ist auf zwei Monate festgesetzt."
    },
    {
      "date": "2025-12-16",
      "id": "140171",
      "original_text": "Registerbekanntmachung nach dem Umwandlungsgesetz\nNordrhein-Westfalen Amtsgericht Köln HRB 125973\nMAX BAERMANN HOLDING GmbH – Bergisch Gladbach",
      "type": "Registerbekanntmachung nach dem Umwandlungsgesetz",
      "state": "Nordrhein-Westfalen",
      "amtsgericht": "Amtsgericht Köln",
      "registernummer": "HRB 125973",
      "registerart": "HRB",
      "company_name": "MAX BAERMANN HOLDING GmbH",
      "company_seat": "Bergisch Gladbach",
      "details": "16.12.2025 (Bekanntmachungsdatum)\n\nNordrhein-Westfalen Amtsgericht Köln HRB 125973\nRegisterbekanntmachung nach dem Umwandlungsgesetz 16.12.2025 (Eintragungsdatum)\n\nMAX BAERMANN HOLDING GmbH\nGesellschaft mit beschränkter Haftung\nBergisch Gladbach\n\nDen Gläubigern der an der formwechselnden Umwandlung beteiligten Rechtsträger ist, wenn sie binnen sechs Monaten nach dem Tag, an dem die Eintragung der formwechselnden Umwandlung in das Register des Sitzes desjenigen Rechtsträgers, dessen Gläubiger sie sind, nach § 19 Absatz 3 UmwG als bekanntgemacht gilt, ihren Anspruch nach Grund und Höhe schriftlich anmelden, Sicherheit zu leisten, soweit sie nicht Befriedigung verlangen können. Dieses Recht steht den Gläubigern jedoch nur zu, wenn sie glaubhaft machen, dass durch die formwechselnden Umwandlung die Erfüllung ihrer Forderung gefährdet wird."
    },
    {
      "date": "2025-12-16",
      "id": "140172",
      "original_text": "Einreichung neuer Dokumente\nNordrhein-Westfalen Amtsgericht Düsseldorf HRB 35978\nERGO Group AG – Düsseldorf",
      "type": "Einreichung neuer Dokumente",
      "state": "Nordrhein-Westfalen",
      "amtsgericht": "Amtsgericht Düsseldorf",
      "registernummer": "HRB 35978",
      "registerart": "HRB",
      "company_name": "ERGO Group AG",
      "company_seat": "Düsseldorf",
      "details": "16.12.2025 (Bekanntmachungsdatum)\n\nNordrhein-Westfalen Amtsgericht Düsseldorf HRB 35978\nEinreichung neuer Dokumente 16.12.2025 (Eintragungsdatum)\n\nERGO Group AG\nAktiengesellschaft\nDüsseldorf\n\nDem Registergericht ist ein neues Hauptversammlungsprotokoll eingereicht worden."
    },
    {
      "date": "2025-12-16",
      "id": "140173",
      "original_text": "Einreichung neuer Dokumente\nNordrhein-Westfalen Amtsgericht Münster HRB 18790\nBSB-Steuerberatungsgesellschaft mbH – Münster",
      "type": "Einreichung neuer Dokumente",
      "state": "Nordrhein-Westfalen",
      "amtsgericht": "Amtsgericht Münster",
      "registernummer": "HRB 18790",
      "registerart": "HRB",
      "company_name": "BSB-Steuerberatungsgesellschaft mbH",
      "company_seat": "Münster",
      "details": "16.12.2025 (Bekanntmachungsdatum)\n\nNordrhein-Westfalen Amtsgericht Münster HRB 18790\nEinreichung neuer Dokumente\n\nBSB-Steuerberatungsgesellschaft mbH\nGesellschaft mit beschränkter Haftung\nMünster\n\nDem Registergericht ist eine Liste der Mitglieder des Aufsichtsrates eingereicht worden."
    },
    {
      "date": "2025-12-16",
      "id": "140174",
      "original_text": "Löschungsankündigung\nNordrhein-Westfalen Amtsgericht Düsseldorf HRB 92077\nBtele-communication UG (haftungsbeschränkt) – Düsseldorf",
      "type": "Löschungsankündigung",
      "state": "Nordrhein-Westfalen",
      "amtsgericht": "Amtsgericht Düsseldorf",
      "registernummer": "HRB 92077",
      "registerart": "HRB",
      "company_name": "Btele-communication UG (haftungsbeschränkt)",
      "company_seat": "Düsseldorf",
      "details": "16.12.2025 (Bekanntmachungsdatum)\n\nNordrhein-Westfalen Amtsgericht Düsseldorf HRB 92077\nLöschungsankündigung\n\nBtele-communication UG (haftungsbeschränkt)\nGesellschaft mit beschränkter Haftung\nDüsseldorf\n\nDas Registergericht beabsichtigt die Gesellschaft von Amts wegen nach § 394 FamFG zu löschen. Die Frist zur Erhebung eines Widerspruchs ist auf 3 Wochen festgesetzt.\n\nRechtsbehelfsbelehrung:\nDas Widerspruchsrecht steht jedem zu, der an der Unterlassung der Löschung ein berechtigtes Interesse hat. Der Widerspruch ist bei dem Amtsgericht Düsseldorf -Registergericht-, Werdener Straße 1, 40227 Düsseldorf schriftlich in deutscher Sprache oder zur Niederschrift der Geschäftsstelle einzulegen. Der Widerspruch kann auch zur Niederschrift der Geschäftsstelle eines jeden Amtsgerichtes abgegeben werden. Die Einlegung ist auch durch Übertragung eines elektronischen Dokuments an die elektronische Poststelle des Gerichts möglich. Das elektronische Dokument muss für die Bearbeitung durch das Gericht geeignet und mit einer qualifizierten elektronischen Signatur der verantwortenden Person versehen sein oder von der verantwortenden Person signiert und auf einem sicheren Übermittlungsweg gemäß § 130a ZPO nach näherer Maßgabe der Verordnung über die technischen Rahmenbedingungen des elektronischen Rechtsverkehrs und über das besondere elektronische Behördenpostfach (BGBl. I, S.3803) eingereicht werden. Weitere Informationen erhalten Sie auf der Internetseite www.justiz.de.\nDer Widerspruch muss spätestens innerhalb der gesetzten Frist nach dem Datum der Bekanntmachung der Löschungsankündigung bei dem Amtsgericht - Registergericht - Düsseldorf eingegangen sein.  Dies gilt auch dann, wenn der Widerspruch zur Niederschrift der Geschäftsstelle eines anderen Amtsgerichtes abgegeben wurde. Die Frist beginnt mit dem Tage der Bekanntmachung der Löschungsankündigung in dem für die Bekanntmachung der Eintragungen in das Handelsregister bestimmten elektronischen Informations- und Kommunikationssystem nach § 10 des Handelsgesetzbuches. Fällt das Ende der Frist auf einen Sonntag, einen allgemeinen Feiertag oder Sonnabend, so endet die Frist mit Ablauf des nächsten Werktages.\nDer Widerspruch muss die Bezeichnung der angefochtenen Löschungsankündigung sowie die Erklärung enthalten, dass Widerspruch gegen diese Löschungsankündigung eingelegt wird. Er ist zu unterzeichnen und soll begründet werden."
    },
    {
      "date": "2025-12-16",
      "id": "140175",
      "original_text": "Registerbekanntmachung nach dem Umwandlungsgesetz\nNordrhein-Westfalen Amtsgericht Essen HRB 13892\nSalvia Gebäudetechnik West GmbH – Essen",
      "type": "Registerbekanntmachung nach dem Umwandlungsgesetz",
      "state": "Nordrhein-Westfalen",
      "amtsgericht": "Amtsgericht Essen",
      "registernummer": "HRB 13892",
      "registerart": "HRB",
      "company_name": "Salvia Gebäudetechnik West GmbH",
      "company_seat": "Essen",
      "details": "16.12.2025 (Bekanntmachungsdatum)\n\nNordrhein-Westfalen Amtsgericht Essen HRB 13892\nRegisterbekanntmachung nach dem Umwandlungsgesetz 16.12.2025 (Eintragungsdatum)\n\nSalvia Gebäudetechnik West GmbH\nGesellschaft mit beschränkter Haftung\nEssen\n\nDen Gläubigern der an der Verschmelzung beteiligten Rechtsträger ist, wenn sie binnen sechs Monaten nach dem Tag, an dem die Eintragung der Verschmelzung in das Register des Sitzes desjenigen Rechtsträgers, dessen Gläubiger sie sind, nach § 19 Absatz 3 UmwG als bekanntgemacht gilt, ihren Anspruch nach Grund und Höhe schriftlich anmelden, Sicherheit zu leisten, soweit sie nicht Befriedigung verlangen können. Dieses Recht steht den Gläubigern jedoch nur zu, wenn sie glaubhaft machen, dass durch die Verschmelzung die Erfüllung ihrer Forderung gefährdet wird."
    },
    {
      "date": "2025-12-16",
      "id": "140176",
      "original_text": "Einreichung neuer Dokumente\nNordrhein-Westfalen Amtsgericht Köln HRB 26876\nTÜV Rheinland Industrie Service GmbH – Köln",
      "type": "Einreichung neuer Dokumente",
      "state": "Nordrhein-Westfalen",
      "amtsgericht": "Amtsgericht Köln",
      "registernummer": "HRB 26876",
      "registerart": "HRB",
      "company_name": "TÜV Rheinland Industrie Service GmbH",
      "company_seat": "Köln",
      "details": "16.12.2025 (Bekanntmachungsdatum)\n\nNordrhein-Westfalen Amtsgericht Köln HRB 26876\nEinreichung neuer Dokumente\n\nTÜV Rheinland Industrie Service GmbH\nGesellschaft mit beschränkter Haftung\nKöln\n\nDem Registergericht ist eine Liste der Mitglieder des Aufsichtsrates eingereicht worden."
    },
    {
      "date": "2025-12-16",
      "id": "140177",
      "original_text": "Löschungsankündigung\nNordrhein-Westfalen Amtsgericht Kleve HRB 12922\nGuido's Autocenter GmbH – Kalkar",
      "type": "Löschungsankündigung",
      "state": "Nordrhein-Westfalen",
      "amtsgericht": "Amtsgericht Kleve",
      "registernummer": "HRB 12922",
      "registerart": "HRB",
      "company_name": "Guido's Autocenter GmbH",
      "company_seat": "Kalkar",
      "details": "16.12.2025 (Bekanntmachungsdatum)\n\nNordrhein-Westfalen Amtsgericht Kleve HRB 12922\nLöschungsankündigung\n\nGuido's Autocenter GmbH\nGesellschaft mit beschränkter Haftung\nKalkar\n\nDas Registergericht beabsichtigt die Gesellschaft von Amts wegen nach § 394 FamFG zu löschen. Die Frist zur Erhebung eines Widerspruchs ist auf einen Monat festgesetzt."
    },
    {
      "date": "2025-12-16",
      "id": "140178",
      "original_text": "Löschungsankündigung\nNordrhein-Westfalen Amtsgericht Gütersloh HRB 13526\nSCS Logistik GmbH – Herzebrock-Clarholz",
      "type": "Löschungsankündigung",
      "state": "Nordrhein-Westfalen",
      "amtsgericht": "Amtsgericht Gütersloh",
      "registernummer": "HRB 13526",
      "registerart": "HRB",
      "company_name": "SCS Logistik GmbH",
      "company_seat": "Herzebrock-Clarholz",
      "details": "16.12.2025 (Bekanntmachungsdatum)\n\nNordrhein-Westfalen Amtsgericht Gütersloh HRB 13526\nLöschungsankündigung 16.12.2025 (Eintragungsdatum)\n\nSCS Logistik GmbH\nGesellschaft mit beschränkter Haftung\nHerzebrock-Clarholz\n\nDas Registergericht beabsichtigt die Gesellschaft von Amts wegen nach § 394 FamFG zu löschen. Die Frist zur Erhebung eines Widerspruchs ist auf einen Monat festgesetzt."
    },
    {
      "date": "2025-12-16",
      "id": "140179",
      "original_text": "Einreichung neuer Dokumente\nNordrhein-Westfalen Amtsgericht Düsseldorf HRB 48623\nVerbund katholischer Kliniken Düsseldorf gGmbH – Düsseldorf",
      "type": "Einreichung neuer Dokumente",
      "state": "Nordrhein-Westfalen",
      "amtsgericht": "Amtsgericht Düsseldorf",
      "registernummer": "HRB 48623",
      "registerart": "HRB",
      "company_name": "Verbund katholischer Kliniken Düsseldorf gGmbH",
      "company_seat": "Düsseldorf",
      "details": "16.12.2025 (Bekanntmachungsdatum)\n\nNordrhein-Westfalen Amtsgericht Düsseldorf HRB 48623\nEinreichung neuer Dokumente\n\nVerbund katholischer Kliniken Düsseldorf gGmbH\nGesellschaft mit beschränkter Haftung\nDüsseldorf\n\nDem Registergericht ist eine neue Liste der Mitglieder des Aufsichtsrates eingereicht worden."
    },
    {
      "date": "2025-12-16",
      "id": "140180",
      "original_text": "Einreichung neuer Dokumente\nNordrhein-Westfalen Amtsgericht Duisburg HRB 10535\nStadtwerke Wesel Gesellschaft mit beschränkter Haftung – Wesel",
      "type": "Einreichung neuer Dokumente",
      "state": "Nordrhein-Westfalen",
      "amtsgericht": "Amtsgericht Duisburg",
      "registernummer": "HRB 10535",
      "registerart": "HRB",
      "company_name": "Stadtwerke Wesel Gesellschaft mit beschränkter Haftung",
      "company_seat": "Wesel",
      "details": "16.12.2025 (Bekanntmachungsdatum)\n\nNordrhein-Westfalen Amtsgericht Duisburg HRB 10535\nEinreichung neuer Dokumente\n\nStadtwerke Wesel Gesellschaft mit beschränkter Haftung\nGesellschaft mit beschränkter Haftung\nWesel\n\nDem Registergericht ist eine Liste der Mitglieder des Aufsichtsrates eingereicht worden."
    },
    {
      "date": "2025-12-16",
      "id": "140181",
      "original_text": "Löschungsankündigung\nNordrhein-Westfalen Amtsgericht Wuppertal HRA 25899\nREVENTO Baustoffhandelsgesellschaft mbH & Co. KG – Erkrath",
      "type": "Löschungsankündigung",
      "state": "Nordrhein-Westfalen",
      "amtsgericht": "Amtsgericht Wuppertal",
      "registernummer": "HRA 25899",
      "registerart": "HRA",
      "company_name": "REVENTO Baustoffhandelsgesellschaft mbH & Co. KG",
      "company_seat": "Erkrath",
      "details": "16.12.2025 (Bekanntmachungsdatum)\n\nNordrhein-Westfalen Amtsgericht Wuppertal HRA 25899\nLöschungsankündigung\n\nREVENTO Baustoffhandelsgesellschaft mbH & Co. KG\nKommanditgesellschaft\nErkrath\n\nDas Registergericht beabsichtigt die Firma von Amts wegen zu löschen. Die Frist zur Erhebung eines Widerspruchs ist auf drei Monate festgesetzt."
    },
    {
      "date": "2025-12-16",
      "id": "140182",
      "original_text": "Registerbekanntmachung nach dem Umwandlungsgesetz\nNordrhein-Westfalen Amtsgericht Köln HRB 123155\nBolsius Germany Holding GmbH – Köln",
      "type": "Registerbekanntmachung nach dem Umwandlungsgesetz",
      "state": "Nordrhein-Westfalen",
      "amtsgericht": "Amtsgericht Köln",
      "registernummer": "HRB 123155",
      "registerart": "HRB",
      "company_name": "Bolsius Germany Holding GmbH",
      "company_seat": "Köln",
      "details": "16.12.2025 (Bekanntmachungsdatum)\n\nNordrhein-Westfalen Amtsgericht Köln HRB 123155\nRegisterbekanntmachung nach dem Umwandlungsgesetz 16.12.2025 (Eintragungsdatum)\n\nBolsius Germany Holding GmbH\nGesellschaft mit beschränkter Haftung\nKöln\n\nDen Gläubigern der an der Verschmelzung beteiligten Rechtsträger ist, wenn sie binnen sechs Monaten nach dem Tag, an dem die Eintragung der Verschmelzung in das Register des Sitzes desjenigen Rechtsträgers, dessen Gläubiger sie sind, nach § 19 Absatz 3 UmwG als bekanntgemacht gilt, ihren Anspruch nach Grund und Höhe schriftlich anmelden, Sicherheit zu leisten, soweit sie nicht Befriedigung verlangen können. Dieses Recht steht den Gläubigern jedoch nur zu, wenn sie glaubhaft machen, dass durch die Verschmelzung die Erfüllung ihrer Forderung gefährdet wird."
    },
    {
      "date": "2025-12-16",
      "id": "140183",
      "original_text": "Registerbekanntmachung nach dem Umwandlungsgesetz\nNordrhein-Westfalen Amtsgericht Köln HRA 32971\nMartin Metgenberg Immobilienservice GmbH & Co. KG. – Gummersbach",
      "type": "Registerbekanntmachung nach dem Umwandlungsgesetz",
      "state": "Nordrhein-Westfalen",
      "amtsgericht": "Amtsgericht Köln",
      "registernummer": "HRA 32971",
      "registerart": "HRA",
      "company_name": "Martin Metgenberg Immobilienservice GmbH & Co. KG.",
      "company_seat": "Gummersbach",
      "details": "16.12.2025 (Bekanntmachungsdatum)\n\nNordrhein-Westfalen Amtsgericht Köln HRA 32971\nRegisterbekanntmachung nach dem Umwandlungsgesetz 16.12.2025 (Eintragungsdatum)\n\nMartin Metgenberg Immobilienservice GmbH & Co. KG.\nKommanditgesellschaft\nGummersbach\n\nDen Gläubigern der an der formwechselnden Umwandlung beteiligten Rechtsträger ist, wenn sie binnen sechs Monaten nach dem Tag, an dem die Eintragung der formwechselnden Umwandlung in das Register des Sitzes desjenigen Rechtsträgers, dessen Gläubiger sie sind, nach § 19 Absatz 3 UmwG als bekanntgemacht gilt, ihren Anspruch nach Grund und Höhe schriftlich anmelden, Sicherheit zu leisten, soweit sie nicht Befriedigung verlangen können. Dieses Recht steht den Gläubigern jedoch nur zu, wenn sie glaubhaft machen, dass durch die formwechselnden Umwandlung die Erfüllung ihrer Forderung gefährdet wird."
    },
    {
      "date": "2025-12-16",
      "id": "140184",
      "original_text": "Registerbekanntmachung nach dem Umwandlungsgesetz\nNordrhein-Westfalen Amtsgericht Bielefeld HRB 7299\nDr. Crato Gesellschaft mit beschränkter Haftung – Bielefeld",
      "type": "Registerbekanntmachung nach dem Umwandlungsgesetz",
      "state": "Nordrhein-Westfalen",
      "amtsgericht": "Amtsgericht Bielefeld",
      "registernummer": "HRB 7299",
      "registerart": "HRB",
      "company_name": "Dr. Crato Gesellschaft mit beschränkter Haftung",
      "company_seat": "Bielefeld",
      "details": "16.12.2025 (Bekanntmachungsdatum)\n\nNordrhein-Westfalen Amtsgericht Bielefeld HRB 7299\nRegisterbekanntmachung nach dem Umwandlungsgesetz 16.12.2025 (Eintragungsdatum)\n\nDr. Crato Gesellschaft mit beschränkter Haftung\nGesellschaft mit beschränkter Haftung\nBielefeld\n\nDen Gläubigern der an der Verschmelzung beteiligten Rechtsträger ist, wenn sie binnen sechs Monaten nach dem Tag, an dem die Eintragung der Verschmelzung in das Register des Sitzes desjenigen Rechtsträgers, dessen Gläubiger sie sind, nach § 19 Absatz 3 UmwG als bekanntgemacht gilt, ihren Anspruch nach Grund und Höhe schriftlich anmelden, Sicherheit zu leisten, soweit sie nicht Befriedigung verlangen können. Dieses Recht steht den Gläubigern jedoch nur zu, wenn sie glaubhaft machen, dass durch die Verschmelzung die Erfüllung ihrer Forderung gefährdet wird."
    },
    {
      "date": "2025-12-16",
      "id": "140185",
      "original_text": "Löschungsankündigung\nNordrhein-Westfalen Amtsgericht Dortmund HRB 28200\nTechintacto Verwaltungs GmbH – Dortmund",
      "type": "Löschungsankündigung",
      "state": "Nordrhein-Westfalen",
      "amtsgericht": "Amtsgericht Dortmund",
      "registernummer": "HRB 28200",
      "registerart": "HRB",
      "company_name": "Techintacto Verwaltungs GmbH",
      "company_seat": "Dortmund",
      "details": "16.12.2025 (Bekanntmachungsdatum)\n\nNordrhein-Westfalen Amtsgericht Dortmund HRB 28200\nLöschungsankündigung\n\nTechintacto Verwaltungs GmbH\nGesellschaft mit beschränkter Haftung\nDortmund\n\nDas Registergericht beabsichtigt die Gesellschaft von Amts wegen nach § 394 FamFG zu löschen. Die Frist zur Erhebung eines Widerspruchs ist auf zwei Monate festgesetzt."
    },
    {
      "date": "2025-12-16",
      "id": "140186",
      "original_text": "Löschungsankündigung\nNordrhein-Westfalen Amtsgericht Dortmund HRB 26719\nSteinhorst & Löhr UG (haftungsbeschränkt) – Dortmund",
      "type": "Löschungsankündigung",
      "state": "Nordrhein-Westfalen",
      "amtsgericht": "Amtsgericht Dortmund",
      "registernummer": "HRB 26719",
      "registerart": "HRB",
      "company_name": "Steinhorst & Löhr UG (haftungsbeschränkt)",
      "company_seat": "Dortmund",
      "details": "16.12.2025 (Bekanntmachungsdatum)\n\nNordrhein-Westfalen Amtsgericht Dortmund HRB 26719\nLöschungsankündigung 16.12.2025 (Eintragungsdatum)\n\nSteinhorst & Löhr UG (haftungsbeschränkt)\nGesellschaft mit beschränkter Haftung\nDortmund\n\nDas Registergericht beabsichtigt die Gesellschaft von Amts wegen nach § 394 FamFG zu löschen. Die Frist zur Erhebung eines Widerspruchs ist auf zwei Monate festgesetzt."
    },
    {
      "date": "2025-12-16",
      "id": "140187",
      "original_text": "Löschungsankündigung\nNordrhein-Westfalen Amtsgericht Wuppertal HRB 32305\nFacility Management Mondrowsky UG (haftungsbeschränkt) – Remscheid",
      "type": "Löschungsankündigung",
      "state": "Nordrhein-Westfalen",
      "amtsgericht": "Amtsgericht Wuppertal",
      "registernummer": "HRB 32305",
      "registerart": "HRB",
      "company_name": "Facility Management Mondrowsky UG (haftungsbeschränkt)",
      "company_seat": "Remscheid",
      "details": "16.12.2025 (Bekanntmachungsdatum)\n\nNordrhein-Westfalen Amtsgericht Wuppertal HRB 32305\nLöschungsankündigung 15.12.2025 (Eintragungsdatum)\n\nFacility Management Mondrowsky UG (haftungsbeschränkt)\nGesellschaft mit beschränkter Haftung\nRemscheid\n\nDas Registergericht beabsichtigt die Gesellschaft von Amts wegen nach § 394 FamFG zu löschen. Die Frist zur Erhebung eines Widerspruchs ist auf einen Monat festgesetzt."
    },
    {
      "date": "2025-12-16",
      "id": "140188",
      "original_text": "Registerbekanntmachung nach dem Umwandlungsgesetz\nNordrhein-Westfalen Amtsgericht Düsseldorf HRA 25931\nWattner SunAsset Solarkraftwerk 024 GmbH & Co. KG – Monheim am Rhein",
      "type": "Registerbekanntmachung nach dem Umwandlungsgesetz",
      "state": "Nordrhein-Westfalen",
      "amtsgericht": "Amtsgericht Düsseldorf",
      "registernummer": "HRA 25931",
      "registerart": "HRA",
      "company_name": "Wattner SunAsset Solarkraftwerk 024 GmbH & Co. KG",
      "company_seat": "Monheim am Rhein",
      "details": "16.12.2025 (Bekanntmachungsdatum)\n\nNordrhein-Westfalen Amtsgericht Düsseldorf HRA 25931\nRegisterbekanntmachung nach dem Umwandlungsgesetz 16.12.2025 (Eintragungsdatum)\n\nWattner SunAsset Solarkraftwerk 024 GmbH & Co. KG\nKommanditgesellschaft\nMonheim am Rhein\n\nDen Gläubigern der an der Verschmelzung beteiligten Rechtsträger ist, wenn sie binnen sechs Monaten nach dem Tag, an dem die Eintragung der Verschmelzung in das Register des Sitzes desjenigen Rechtsträgers, dessen Gläubiger sie sind, nach § 19 Absatz 3 UmwG als bekanntgemacht gilt, ihren Anspruch nach Grund und Höhe schriftlich anmelden, Sicherheit zu leisten, soweit sie nicht Befriedigung verlangen können. Dieses Recht steht den Gläubigern jedoch nur zu, wenn sie glaubhaft machen, dass durch die Verschmelzung die Erfüllung ihrer Forderung gefährdet wird."
    },
    {
      "date": "2025-12-16",
      "id": "140189",
      "original_text": "Registerbekanntmachung nach dem Umwandlungsgesetz\nNordrhein-Westfalen Amtsgericht Bielefeld HRB 46479\nRudolf A. Oetker GmbH – Bielefeld",
      "type": "Registerbekanntmachung nach dem Umwandlungsgesetz",
      "state": "Nordrhein-Westfalen",
      "amtsgericht": "Amtsgericht Bielefeld",
      "registernummer": "HRB 46479",
      "registerart": "HRB",
      "company_name": "Rudolf A. Oetker GmbH",
      "company_seat": "Bielefeld",
      "details": "16.12.2025 (Bekanntmachungsdatum)\n\nNordrhein-Westfalen Amtsgericht Bielefeld HRB 46479\nRegisterbekanntmachung nach dem Umwandlungsgesetz 16.12.2025 (Eintragungsdatum)\n\nRudolf A. Oetker GmbH\nGesellschaft mit beschränkter Haftung\nBielefeld\n\nDen Gläubigern der an der Verschmelzung beteiligten Rechtsträger ist, wenn sie binnen sechs Monaten nach dem Tag, an dem die Eintragung der Verschmelzung in das Register des Sitzes desjenigen Rechtsträgers, dessen Gläubiger sie sind, nach § 19 Absatz 3 UmwG als bekanntgemacht gilt, ihren Anspruch nach Grund und Höhe schriftlich anmelden, Sicherheit zu leisten, soweit sie nicht Befriedigung verlangen können. Dieses Recht steht den Gläubigern jedoch nur zu, wenn sie glaubhaft machen, dass durch die Verschmelzung die Erfüllung ihrer Forderung gefährdet wird."
    },
    {
      "date": "2025-12-16",
      "id": "140190",
      "original_text": "Löschungsankündigung\nNordrhein-Westfalen Amtsgericht Wuppertal HRA 25896\nTAXbord Beratungsgesellschaft mbH & Co. KG – Wuppertal",
      "type": "Löschungsankündigung",
      "state": "Nordrhein-Westfalen",
      "amtsgericht": "Amtsgericht Wuppertal",
      "registernummer": "HRA 25896",
      "registerart": "HRA",
      "company_name": "TAXbord Beratungsgesellschaft mbH & Co. KG",
      "company_seat": "Wuppertal",
      "details": "16.12.2025 (Bekanntmachungsdatum)\n\nNordrhein-Westfalen Amtsgericht Wuppertal HRA 25896\nLöschungsankündigung\n\nTAXbord Beratungsgesellschaft mbH & Co. KG\nKommanditgesellschaft\nWuppertal\n\nDas Registergericht beabsichtigt die Firma von Amts wegen zu löschen. Die Frist zur Erhebung eines Widerspruchs ist auf drei Monate festgesetzt."
    },
    {
      "date": "2025-12-16",
      "id": "140191",
      "original_text": "Löschungsankündigung\nNordrhein-Westfalen Amtsgericht Dortmund HRB 34507\nBAU-MI GmbH – Dortmund",
      "type": "Löschungsankündigung",
      "state": "Nordrhein-Westfalen",
      "amtsgericht": "Amtsgericht Dortmund",
      "registernummer": "HRB 34507",
      "registerart": "HRB",
      "company_name": "BAU-MI GmbH",
      "company_seat": "Dortmund",
      "details": "16.12.2025 (Bekanntmachungsdatum)\n\nNordrhein-Westfalen Amtsgericht Dortmund HRB 34507\nLöschungsankündigung 16.12.2025 (Eintragungsdatum)\n\nBAU-MI GmbH\nGesellschaft mit beschränkter Haftung\nDortmund\n\nDas Registergericht beabsichtigt die Gesellschaft von Amts wegen nach § 394 FamFG zu löschen. Die Frist zur Erhebung eines Widerspruchs ist auf zwei Monate festgesetzt."
    },
    {
      "date": "2025-12-16",
      "id": "140192",
      "original_text": "Registerbekanntmachung nach dem Umwandlungsgesetz\nNordrhein-Westfalen Amtsgericht Gütersloh HRB 13579\nJOBRI GmbH Computerengineering – Halle (Westf.)",
      "type": "Registerbekanntmachung nach dem Umwandlungsgesetz",
      "state": "Nordrhein-Westfalen",
      "amtsgericht": "Amtsgericht Gütersloh",
      "registernummer": "HRB 13579",
      "registerart": "HRB",
      "company_name": "JOBRI GmbH Computerengineering",
      "company_seat": "Halle (Westf.)",
      "details": "16.12.2025 (Bekanntmachungsdatum)\n\nNordrhein-Westfalen Amtsgericht Gütersloh HRB 13579\nRegisterbekanntmachung nach dem Umwandlungsgesetz 11.12.2025 (Eintragungsdatum)\n\nJOBRI GmbH Computerengineering\nGesellschaft mit beschränkter Haftung\nHalle (Westf.)\n\nDen Gläubigern der an der Verschmelzung beteiligten Rechtsträger ist, wenn sie binnen sechs Monaten nach dem Tag, an dem die Eintragung der Verschmelzung in das Register des Sitzes desjenigen Rechtsträgers, dessen Gläubiger sie sind, nach § 19 Absatz 3 UmwG als bekanntgemacht gilt, ihren Anspruch nach Grund und Höhe schriftlich anmelden, Sicherheit zu leisten, soweit sie nicht Befriedigung verlangen können. Dieses Recht steht den Gläubigern jedoch nur zu, wenn sie glaubhaft machen, dass durch die Verschmelzung die Erfüllung ihrer Forderung gefährdet wird."
    },
    {
      "date": "2025-12-16",
      "id": "140193",
      "original_text": "Registerbekanntmachung nach dem Umwandlungsgesetz\nNordrhein-Westfalen Amtsgericht Bielefeld HRB 46049\nTKKG GmbH – Bielefeld",
      "type": "Registerbekanntmachung nach dem Umwandlungsgesetz",
      "state": "Nordrhein-Westfalen",
      "amtsgericht": "Amtsgericht Bielefeld",
      "registernummer": "HRB 46049",
      "registerart": "HRB",
      "company_name": "TKKG GmbH",
      "company_seat": "Bielefeld",
      "details": "16.12.2025 (Bekanntmachungsdatum)\n\nNordrhein-Westfalen Amtsgericht Bielefeld HRB 46049\nRegisterbekanntmachung nach dem Umwandlungsgesetz 16.12.2025 (Eintragungsdatum)\n\nTKKG GmbH\nGesellschaft mit beschränkter Haftung\nBielefeld\n\nDen Gläubigern der an der Ausgliederung beteiligten Rechtsträger ist, wenn sie binnen sechs Monaten nach dem Tag, an dem die Eintragung der Ausgliederung in das Register des Sitzes desjenigen Rechtsträgers, dessen Gläubiger sie sind, nach § 19 Absatz 3 UmwG als bekanntgemacht gilt, ihren Anspruch nach Grund und Höhe schriftlich anmelden, Sicherheit zu leisten, soweit sie nicht Befriedigung verlangen können. Dieses Recht steht den Gläubigern jedoch nur zu, wenn sie glaubhaft machen, dass durch die Ausgliederung die Erfüllung ihrer Forderung gefährdet wird."
    },
    {
      "date": "2025-12-16",
      "id": "140194",
      "original_text": "Registerbekanntmachung nach dem Umwandlungsgesetz\nHessen Amtsgericht Frankfurt am Main HRB 107832\nGEG Emittent Verwaltungs GmbH – Frankfurt am Main",
      "type": "Registerbekanntmachung nach dem Umwandlungsgesetz",
      "state": "Hessen",
      "amtsgericht": "Amtsgericht Frankfurt am Main",
      "registernummer": "HRB 107832",
      "registerart": "HRB",
      "company_name": "GEG Emittent Verwaltungs GmbH",
      "company_seat": "Frankfurt am Main",
      "details": "16.12.2025 (Bekanntmachungsdatum)\n\nHessen Amtsgericht Frankfurt am Main HRB 107832\nRegisterbekanntmachung nach dem Umwandlungsgesetz 16.12.2025 (Eintragungsdatum)\n\nGEG Emittent Verwaltungs GmbH\nGesellschaft mit beschränkter Haftung\nFrankfurt am Main\n\nDen Gläubigern der an der Verschmelzung beteiligten Rechtsträger ist, wenn sie binnen sechs Monaten nach dem Tag, an dem die Eintragung der Verschmelzung in das Register des Sitzes desjenigen Rechtsträgers, dessen Gläubiger sie sind, nach § 19 Absatz 3 UmwG bekannt gemacht worden ist, ihren Anspruch nach Grund und Höhe schriftlich anmelden, Sicherheit zu leisten, soweit sie nicht Befriedigung verlangen können. Dieses Recht steht den Gläubigern jedoch nur zu, wenn sie glaubhaft machen, dass durch die Verschmelzung die Erfüllung ihrer Forderung gefährdet wird."
    },
    {
      "date": "2025-12-16",
      "id": "140195",
      "original_text": "Löschungsankündigung\nHessen Amtsgericht Offenbach am Main HRB 49564\nÖzer GmbH – Offenbach am Main",
      "type": "Löschungsankündigung",
      "state": "Hessen",
      "amtsgericht": "Amtsgericht Offenbach am Main",
      "registernummer": "HRB 49564",
      "registerart": "HRB",
      "company_name": "Özer GmbH",
      "company_seat": "Offenbach am Main",
      "details": "16.12.2025 (Bekanntmachungsdatum)\n\nHessen Amtsgericht Offenbach am Main HRB 49564\nLöschungsankündigung\n\nÖzer GmbH\nGesellschaft mit beschränkter Haftung\nOffenbach am Main\n\nDas Registergericht beabsichtigt die im Handelsregister eingetragene Gesellschaft von Amts wegen nach § 394 FamFG zu löschen. Die Frist zur Erhebung eines Widerspruchs gegen die beabsichtigte Löschung wird auf 3 Monate festgesetzt."
    },
    {
      "date": "2025-12-16",
      "id": "140196",
      "original_text": "Löschungsankündigung\nHessen Amtsgericht Gießen HRB 5610\nifact Consulting GmbH – Lauterbach (Hessen)",
      "type": "Löschungsankündigung",
      "state": "Hessen",
      "amtsgericht": "Amtsgericht Gießen",
      "registernummer": "HRB 5610",
      "registerart": "HRB",
      "company_name": "ifact Consulting GmbH",
      "company_seat": "Lauterbach (Hessen)",
      "details": "16.12.2025 (Bekanntmachungsdatum)\n\nHessen Amtsgericht Gießen HRB 5610\nLöschungsankündigung\n\nifact Consulting GmbH\nGesellschaft mit beschränkter Haftung\nLauterbach (Hessen)\n\nEs ist beabsichtigt, die Gesellschaft wegen Vermögenslosigkeit gemäß § 394 FamFG auf Antrag der zuständigen Finanzbehörde zu löschen. Hiergegen kann innerhalb von drei Monaten nach dieser Veröffentlichung Widerspruch beim Amtsgericht Gießen eingelegt werden. Sollte Widerspruch eingelegt werden, dürfte dies nur mit Begründung erfolgversprechend sein. Insbesondere sollte vorhandenes Vermögen der Gesellschaft innerhalb der genannten Frist nachgewiesen werden."
    },
    {
      "date": "2025-12-16",
      "id": "140197",
      "original_text": "Löschungsankündigung\nHessen Amtsgericht Offenbach am Main HRB 52161\nSystem Plus Werbegestaltung GmbH – Neu-Isenburg",
      "type": "Löschungsankündigung",
      "state": "Hessen",
      "amtsgericht": "Amtsgericht Offenbach am Main",
      "registernummer": "HRB 52161",
      "registerart": "HRB",
      "company_name": "System Plus Werbegestaltung GmbH",
      "company_seat": "Neu-Isenburg",
      "details": "16.12.2025 (Bekanntmachungsdatum)\n\nHessen Amtsgericht Offenbach am Main HRB 52161\nLöschungsankündigung\n\nSystem Plus Werbegestaltung GmbH\nGesellschaft mit beschränkter Haftung\nNeu-Isenburg\n\nDas Registergericht beabsichtigt die im Handelsregister eingetragene Gesellschaft von Amts wegen nach § 394 FamFG zu löschen. Die Frist zur Erhebung eines Widerspruchs gegen die beabsichtigte Löschung wird auf 3 Monate festgesetzt."
    },
    {
      "date": "2025-12-16",
      "id": "140198",
      "original_text": "Registerbekanntmachung nach dem Umwandlungsgesetz\nHessen Amtsgericht Bad Homburg v.d.H. HRB 15374\nMedicorium GmbH – Friedrichsdorf",
      "type": "Registerbekanntmachung nach dem Umwandlungsgesetz",
      "state": "Hessen",
      "amtsgericht": "Amtsgericht Bad Homburg v.d.H.",
      "registernummer": "HRB 15374",
      "registerart": "HRB",
      "company_name": "Medicorium GmbH",
      "company_seat": "Friedrichsdorf",
      "details": "16.12.2025 (Bekanntmachungsdatum)\n\nHessen Amtsgericht Bad Homburg v.d.H. HRB 15374\nRegisterbekanntmachung nach dem Umwandlungsgesetz 16.12.2025 (Eintragungsdatum)\n\nMedicorium GmbH\nGesellschaft mit beschränkter Haftung\nFriedrichsdorf\n\nDen Gläubigern der an der Verschmelzung beteiligten Rechtsträger ist, wenn sie binnen sechs Monaten nach dem Tag, an dem die Eintragung der Verschmelzung in das Register des Sitzes desjenigen Rechtsträgers, dessen Gläubiger sie sind, nach § 19 Absatz 3 UmwG bekannt gemacht worden ist, ihren Anspruch nach Grund und Höhe schriftlich anmelden, Sicherheit zu leisten, soweit sie nicht Befriedigung verlangen können. Dieses Recht steht den Gläubigern jedoch nur zu, wenn sie glaubhaft machen, dass durch die Verschmelzung die Erfüllung ihrer Forderung gefährdet wird."
    },
    {
      "date": "2025-12-16",
      "id": "140199",
      "original_text": "Registerbekanntmachung nach dem Umwandlungsgesetz\nHessen Amtsgericht Bad Homburg v.d.H. HRB 17002\nMVZ Corius MediCorium GmbH – Oberursel (Taunus)",
      "type": "Registerbekanntmachung nach dem Umwandlungsgesetz",
      "state": "Hessen",
      "amtsgericht": "Amtsgericht Bad Homburg v.d.H.",
      "registernummer": "HRB 17002",
      "registerart": "HRB",
      "company_name": "MVZ Corius MediCorium GmbH",
      "company_seat": "Oberursel (Taunus)",
      "details": "16.12.2025 (Bekanntmachungsdatum)\n\nHessen Amtsgericht Bad Homburg v.d.H. HRB 17002\nRegisterbekanntmachung nach dem Umwandlungsgesetz 16.12.2025 (Eintragungsdatum)\n\nMVZ Corius MediCorium GmbH\nGesellschaft mit beschränkter Haftung\nOberursel (Taunus)\n\nDen Gläubigern der an der Verschmelzung beteiligten Rechtsträger ist, wenn sie binnen sechs Monaten nach dem Tag, an dem die Eintragung der Verschmelzung in das Register des Sitzes desjenigen Rechtsträgers, dessen Gläubiger sie sind, nach § 19 Absatz 3 UmwG bekannt gemacht worden ist, ihren Anspruch nach Grund und Höhe schriftlich anmelden, Sicherheit zu leisten, soweit sie nicht Befriedigung verlangen können. Dieses Recht steht den Gläubigern jedoch nur zu, wenn sie glaubhaft machen, dass durch die Verschmelzung die Erfüllung ihrer Forderung gefährdet wird."
    },
    {
      "date": "2025-12-16",
      "id": "140200",
      "original_text": "Registerbekanntmachung nach dem Umwandlungsgesetz\nHessen Amtsgericht Frankfurt am Main HRB 107831\nGlobal Tower Verwaltungs GmbH – Frankfurt am Main",
      "type": "Registerbekanntmachung nach dem Umwandlungsgesetz",
      "state": "Hessen",
      "amtsgericht": "Amtsgericht Frankfurt am Main",
      "registernummer": "HRB 107831",
      "registerart": "HRB",
      "company_name": "Global Tower Verwaltungs GmbH",
      "company_seat": "Frankfurt am Main",
      "details": "16.12.2025 (Bekanntmachungsdatum)\n\nHessen Amtsgericht Frankfurt am Main HRB 107831\nRegisterbekanntmachung nach dem Umwandlungsgesetz 16.12.2025 (Eintragungsdatum)\n\nGlobal Tower Verwaltungs GmbH\nGesellschaft mit beschränkter Haftung\nFrankfurt am Main\n\nDen Gläubigern der an der Verschmelzung beteiligten Rechtsträger ist, wenn sie binnen sechs Monaten nach dem Tag, an dem die Eintragung der Verschmelzung in das Register des Sitzes desjenigen Rechtsträgers, dessen Gläubiger sie sind, nach § 19 Absatz 3 UmwG bekannt gemacht worden ist, ihren Anspruch nach Grund und Höhe schriftlich anmelden, Sicherheit zu leisten, soweit sie nicht Befriedigung verlangen können. Dieses Recht steht den Gläubigern jedoch nur zu, wenn sie glaubhaft machen, dass durch die Verschmelzung die Erfüllung ihrer Forderung gefährdet wird."
    },
    {
      "date": "2025-12-16",
      "id": "140201",
      "original_text": "Registerbekanntmachung nach dem Umwandlungsgesetz\nHessen Amtsgericht Frankfurt am Main HRB 112198\nGEG Merlion FF&E GmbH – Frankfurt am Main",
      "type": "Registerbekanntmachung nach dem Umwandlungsgesetz",
      "state": "Hessen",
      "amtsgericht": "Amtsgericht Frankfurt am Main",
      "registernummer": "HRB 112198",
      "registerart": "HRB",
      "company_name": "GEG Merlion FF&E GmbH",
      "company_seat": "Frankfurt am Main",
      "details": "16.12.2025 (Bekanntmachungsdatum)\n\nHessen Amtsgericht Frankfurt am Main HRB 112198\nRegisterbekanntmachung nach dem Umwandlungsgesetz 16.12.2025 (Eintragungsdatum)\n\nGEG Merlion FF&E GmbH\nGesellschaft mit beschränkter Haftung\nFrankfurt am Main\n\nDen Gläubigern der an der Verschmelzung beteiligten Rechtsträger ist, wenn sie binnen sechs Monaten nach dem Tag, an dem die Eintragung der Verschmelzung in das Register des Sitzes desjenigen Rechtsträgers, dessen Gläubiger sie sind, nach § 19 Absatz 3 UmwG bekannt gemacht worden ist, ihren Anspruch nach Grund und Höhe schriftlich anmelden, Sicherheit zu leisten, soweit sie nicht Befriedigung verlangen können. Dieses Recht steht den Gläubigern jedoch nur zu, wenn sie glaubhaft machen, dass durch die Verschmelzung die Erfüllung ihrer Forderung gefährdet wird."
    },
    {
      "date": "2025-12-16",
      "id": "140202",
      "original_text": "Löschungsankündigung\nHessen Amtsgericht Frankfurt am Main HRB 116887\nDeluxe Bau GmbH – Eschborn",
      "type": "Löschungsankündigung",
      "state": "Hessen",
      "amtsgericht": "Amtsgericht Frankfurt am Main",
      "registernummer": "HRB 116887",
      "registerart": "HRB",
      "company_name": "Deluxe Bau GmbH",
      "company_seat": "Eschborn",
      "details": "16.12.2025 (Bekanntmachungsdatum)\n\nHessen Amtsgericht Frankfurt am Main HRB 116887\nLöschungsankündigung\n\nDeluxe Bau GmbH\nGesellschaft mit beschränkter Haftung\nEschborn\n\nEs ist beabsichtigt, die Gesellschaft wegen Vermögenslosigkeit gemäß § 394 FamFG von Amts wegen im Handelsregister zu löschen. Hiergegen kann innerhalb eines Monats nach dieser Veröffentlichung Widerspruch bei dem Amtsgericht Frankfurt am Main eingelegt werden."
    },
    {
      "date": "2025-12-16",
      "id": "140203",
      "original_text": "Einreichung neuer Dokumente\nHessen Amtsgericht Hanau HRB 11054\nKreiswerke Main-Kinzig GmbH – Gelnhausen",
      "type": "Einreichung neuer Dokumente",
      "state": "Hessen",
      "amtsgericht": "Amtsgericht Hanau",
      "registernummer": "HRB 11054",
      "registerart": "HRB",
      "company_name": "Kreiswerke Main-Kinzig GmbH",
      "company_seat": "Gelnhausen",
      "details": "16.12.2025 (Bekanntmachungsdatum)\n\nHessen Amtsgericht Hanau HRB 11054\nEinreichung neuer Dokumente\n\nKreiswerke Main-Kinzig GmbH\nGesellschaft mit beschränkter Haftung\nGelnhausen\n\nDurch eine Änderung in den Personen der Aufsichtsratsmitglieder ist eine Liste der Mitglieder des Aufsichtsrates zum Handelsregister eingereicht worden."
    },
    {
      "date": "2025-12-16",
      "id": "140204",
      "original_text": "Löschungsankündigung\nHessen Amtsgericht Frankfurt am Main HRA 52987\nDIC 27 Portfolio GmbH & Co. KG – Frankfurt am Main",
      "type": "Löschungsankündigung",
      "state": "Hessen",
      "amtsgericht": "Amtsgericht Frankfurt am Main",
      "registernummer": "HRA 52987",
      "registerart": "HRA",
      "company_name": "DIC 27 Portfolio GmbH & Co. KG",
      "company_seat": "Frankfurt am Main",
      "details": "16.12.2025 (Bekanntmachungsdatum)\n\nHessen Amtsgericht Frankfurt am Main HRA 52987\nLöschungsankündigung 16.12.2025 (Eintragungsdatum)\n\nDIC 27 Portfolio GmbH & Co. KG\nKommanditgesellschaft\nFrankfurt am Main\n\nDen Gläubigern der an der Verschmelzung beteiligten Rechtsträger ist, wenn sie binnen sechs Monaten nach dem Tag, an dem die Eintragung der Verschmelzung in das Register des Sitzes desjenigen Rechtsträgers, dessen Gläubiger sie sind, nach § 19 Absatz 3 UmwG bekannt gemacht worden ist, ihren Anspruch nach Grund und Höhe schriftlich anmelden, Sicherheit zu leisten, soweit sie nicht Befriedigung verlangen können. Dieses Recht steht den Gläubigern jedoch nur zu, wenn sie glaubhaft machen, dass durch die Verschmelzung die Erfüllung ihrer Forderung gefährdet wird."
    },
    {
      "date": "2025-12-16",
      "id": "140205",
      "original_text": "Registerbekanntmachung nach dem Umwandlungsgesetz\nHessen Amtsgericht Frankfurt am Main HRB 45609\nTele-Auskunft Online GmbH – Frankfurt am Main",
      "type": "Registerbekanntmachung nach dem Umwandlungsgesetz",
      "state": "Hessen",
      "amtsgericht": "Amtsgericht Frankfurt am Main",
      "registernummer": "HRB 45609",
      "registerart": "HRB",
      "company_name": "Tele-Auskunft Online GmbH",
      "company_seat": "Frankfurt am Main",
      "details": "16.12.2025 (Bekanntmachungsdatum)\n\nHessen Amtsgericht Frankfurt am Main HRB 45609\nRegisterbekanntmachung nach dem Umwandlungsgesetz 16.12.2025 (Eintragungsdatum)\n\nTele-Auskunft Online GmbH\nGesellschaft mit beschränkter Haftung\nFrankfurt am Main\n\nDen Gläubigern der an der Verschmelzung beteiligten Rechtsträger ist, wenn sie binnen sechs Monaten nach dem Tag, an dem die Eintragung der Verschmelzung in das Register des Sitzes desjenigen Rechtsträgers, dessen Gläubiger sie sind, nach § 19 Absatz 3 UmwG bekannt gemacht worden ist, ihren Anspruch nach Grund und Höhe schriftlich anmelden, Sicherheit zu leisten, soweit sie nicht Befriedigung verlangen können. Dieses Recht steht den Gläubigern jedoch nur zu, wenn sie glaubhaft machen, dass durch die Verschmelzung die Erfüllung ihrer Forderung gefährdet wird."
    },
    {
      "date": "2025-12-16",
      "id": "140206",
      "original_text": "Registerbekanntmachung nach dem Umwandlungsgesetz\nHessen Amtsgericht Frankfurt am Main HRB 78712\nDIC Berlin Portfolio Objekt Bundesallee GmbH – Frankfurt am Main",
      "type": "Registerbekanntmachung nach dem Umwandlungsgesetz",
      "state": "Hessen",
      "amtsgericht": "Amtsgericht Frankfurt am Main",
      "registernummer": "HRB 78712",
      "registerart": "HRB",
      "company_name": "DIC Berlin Portfolio Objekt Bundesallee GmbH",
      "company_seat": "Frankfurt am Main",
      "details": "16.12.2025 (Bekanntmachungsdatum)\n\nHessen Amtsgericht Frankfurt am Main HRB 78712\nRegisterbekanntmachung nach dem Umwandlungsgesetz 16.12.2025 (Eintragungsdatum)\n\nDIC Berlin Portfolio Objekt Bundesallee GmbH\nGesellschaft mit beschränkter Haftung\nFrankfurt am Main\n\nDen Gläubigern der an der Verschmelzung beteiligten Rechtsträger ist, wenn sie binnen sechs Monaten nach dem Tag, an dem die Eintragung der Verschmelzung in das Register des Sitzes desjenigen Rechtsträgers, dessen Gläubiger sie sind, nach § 19 Absatz 3 UmwG bekannt gemacht worden ist, ihren Anspruch nach Grund und Höhe schriftlich anmelden, Sicherheit zu leisten, soweit sie nicht Befriedigung verlangen können. Dieses Recht steht den Gläubigern jedoch nur zu, wenn sie glaubhaft machen, dass durch die Verschmelzung die Erfüllung ihrer Forderung gefährdet wird."
    },
    {
      "date": "2025-12-16",
      "id": "140207",
      "original_text": "Registerbekanntmachung nach dem Umwandlungsgesetz\nHessen Amtsgericht Frankfurt am Main HRA 52987\nDIC 27 Portfolio GmbH & Co. KG – Frankfurt am Main",
      "type": "Registerbekanntmachung nach dem Umwandlungsgesetz",
      "state": "Hessen",
      "amtsgericht": "Amtsgericht Frankfurt am Main",
      "registernummer": "HRA 52987",
      "registerart": "HRA",
      "company_name": "DIC 27 Portfolio GmbH & Co. KG",
      "company_seat": "Frankfurt am Main",
      "details": "16.12.2025 (Bekanntmachungsdatum)\n\nHessen Amtsgericht Frankfurt am Main HRA 52987\nRegisterbekanntmachung nach dem Umwandlungsgesetz 16.12.2025 (Eintragungsdatum)\n\nDIC 27 Portfolio GmbH & Co. KG\nKommanditgesellschaft\nFrankfurt am Main\n\nDen Gläubigern der an der Verschmelzung beteiligten Rechtsträger ist, wenn sie binnen sechs Monaten nach dem Tag, an dem die Eintragung der Verschmelzung in das Register des Sitzes desjenigen Rechtsträgers, dessen Gläubiger sie sind, nach § 19 Absatz 3 UmwG bekannt gemacht worden ist, ihren Anspruch nach Grund und Höhe schriftlich anmelden, Sicherheit zu leisten, soweit sie nicht Befriedigung verlangen können. Dieses Recht steht den Gläubigern jedoch nur zu, wenn sie glaubhaft machen, dass durch die Verschmelzung die Erfüllung ihrer Forderung gefährdet wird."
    },
    {
      "date": "2025-12-16",
      "id": "140208",
      "original_text": "Registerbekanntmachung nach dem Umwandlungsgesetz\nHessen Amtsgericht Frankfurt am Main HRA 52987\nDIC 27 Portfolio GmbH & Co. KG – Frankfurt am Main",
      "type": "Registerbekanntmachung nach dem Umwandlungsgesetz",
      "state": "Hessen",
      "amtsgericht": "Amtsgericht Frankfurt am Main",
      "registernummer": "HRA 52987",
      "registerart": "HRA",
      "company_name": "DIC 27 Portfolio GmbH & Co. KG",
      "company_seat": "Frankfurt am Main",
      "details": "16.12.2025 (Bekanntmachungsdatum)\n\nHessen Amtsgericht Frankfurt am Main HRA 52987\nRegisterbekanntmachung nach dem Umwandlungsgesetz 16.12.2025 (Eintragungsdatum)\n\nDIC 27 Portfolio GmbH & Co. KG\nKommanditgesellschaft\nFrankfurt am Main\n\nDen Gläubigern der an der Verschmelzung beteiligten Rechtsträger ist, wenn sie binnen sechs Monaten nach dem Tag, an dem die Eintragung der Verschmelzung in das Register des Sitzes desjenigen Rechtsträgers, dessen Gläubiger sie sind, nach § 19 Absatz 3 UmwG bekannt gemacht worden ist, ihren Anspruch nach Grund und Höhe schriftlich anmelden, Sicherheit zu leisten, soweit sie nicht Befriedigung verlangen können. Dieses Recht steht den Gläubigern jedoch nur zu, wenn sie glaubhaft machen, dass durch die Verschmelzung die Erfüllung ihrer Forderung gefährdet wird."
    },
    {
      "date": "2025-12-16",
      "id": "140209",
      "original_text": "Registerbekanntmachung nach dem Umwandlungsgesetz\nHessen Amtsgericht Offenbach am Main HRB 58510\nSENDEN Dienstleistungen GmbH – Offenbach am Main",
      "type": "Registerbekanntmachung nach dem Umwandlungsgesetz",
      "state": "Hessen",
      "amtsgericht": "Amtsgericht Offenbach am Main",
      "registernummer": "HRB 58510",
      "registerart": "HRB",
      "company_name": "SENDEN Dienstleistungen GmbH",
      "company_seat": "Offenbach am Main",
      "details": "16.12.2025 (Bekanntmachungsdatum)\n\nHessen Amtsgericht Offenbach am Main HRB 58510\nRegisterbekanntmachung nach dem Umwandlungsgesetz 16.12.2025 (Eintragungsdatum)\n\nSENDEN Dienstleistungen GmbH\nGesellschaft mit beschränkter Haftung\nOffenbach am Main\n\nDen Gläubigern der an der Ausgliederung beteiligten Rechtsträger ist, wenn sie binnen sechs Monaten nach dem Tag, an dem die Eintragung der Ausgliederung in das Register des Sitzes desjenigen Rechtsträgers, dessen Gläubiger sie sind, nach §§ 125, 19 Absatz 3 UmwG bekannt gemacht worden ist, ihren Anspruch nach Grund und Höhe schriftlich anmelden, Sicherheit zu leisten, soweit sie nicht Befriedigung verlangen können. Dieses Recht steht den Gläubigern jedoch nur zu, wenn sie glaubhaft machen, dass durch die Ausgliederung die Erfüllung ihrer Forderung gefährdet wird."
    },
    {
      "date": "2025-12-16",
      "id": "140210",
      "original_text": "Einreichung neuer Dokumente\nHessen Amtsgericht Hanau HRB 12953\nRegionalverkehr Main-Kinzig GmbH – Gelnhausen",
      "type": "Einreichung neuer Dokumente",
      "state": "Hessen",
      "amtsgericht": "Amtsgericht Hanau",
      "registernummer": "HRB 12953",
      "registerart": "HRB",
      "company_name": "Regionalverkehr Main-Kinzig GmbH",
      "company_seat": "Gelnhausen",
      "details": "16.12.2025 (Bekanntmachungsdatum)\n\nHessen Amtsgericht Hanau HRB 12953\nEinreichung neuer Dokumente\n\nRegionalverkehr Main-Kinzig GmbH\nGesellschaft mit beschränkter Haftung\nGelnhausen\n\nDurch eine Änderung in den Personen der Aufsichtsratsmitglieder ist eine Liste der Mitglieder des Aufsichtsrates zum Handelsregister eingereicht worden."
    },
    {
      "date": "2025-12-16",
      "id": "140211",
      "original_text": "Löschungsankündigung\nHessen Amtsgericht Offenbach am Main HRB 48071\nMain Immofinance GmbH – Neu-Isenburg",
      "type": "Löschungsankündigung",
      "state": "Hessen",
      "amtsgericht": "Amtsgericht Offenbach am Main",
      "registernummer": "HRB 48071",
      "registerart": "HRB",
      "company_name": "Main Immofinance GmbH",
      "company_seat": "Neu-Isenburg",
      "details": "16.12.2025 (Bekanntmachungsdatum)\n\nHessen Amtsgericht Offenbach am Main HRB 48071\nLöschungsankündigung\n\nMain Immofinance GmbH\nGesellschaft mit beschränkter Haftung\nNeu-Isenburg\n\nDas Registergericht beabsichtigt die im Handelsregister eingetragene Gesellschaft von Amts wegen nach § 394 FamFG zu löschen. Die Frist zur Erhebung eines Widerspruchs gegen die beabsichtigte Löschung wird auf 3 Monate festgesetzt."
    },
    {
      "date": "2025-12-16",
      "id": "140212",
      "original_text": "Löschungsankündigung\nHessen Amtsgericht Darmstadt HRB 91345\nLobling Trade and Commercial Services GmbH – Pfungstadt",
      "type": "Löschungsankündigung",
      "state": "Hessen",
      "amtsgericht": "Amtsgericht Darmstadt",
      "registernummer": "HRB 91345",
      "registerart": "HRB",
      "company_name": "Lobling Trade and Commercial Services GmbH",
      "company_seat": "Pfungstadt",
      "details": "16.12.2025 (Bekanntmachungsdatum)\n\nHessen Amtsgericht Darmstadt HRB 91345\nLöschungsankündigung\n\nLobling Trade and Commercial Services GmbH\nGesellschaft mit beschränkter Haftung\nPfungstadt\n\nDas Registergericht beabsichtigt die im Handelsregister eingetragene Gesellschaft von Amts wegen nach § 394 FamFG zu löschen. Die Frist zur Erhebung eines Widerspruchs gegen die beabsichtigte Löschung wird auf 3 Monate festgesetzt."
    },
    {
      "date": "2025-12-16",
      "id": "140213",
      "original_text": "Registerbekanntmachung nach dem Umwandlungsgesetz\nHessen Amtsgericht Frankfurt am Main HRA 52987\nDIC 27 Portfolio GmbH & Co. KG – Frankfurt am Main",
      "type": "Registerbekanntmachung nach dem Umwandlungsgesetz",
      "state": "Hessen",
      "amtsgericht": "Amtsgericht Frankfurt am Main",
      "registernummer": "HRA 52987",
      "registerart": "HRA",
      "company_name": "DIC 27 Portfolio GmbH & Co. KG",
      "company_seat": "Frankfurt am Main",
      "details": "16.12.2025 (Bekanntmachungsdatum)\n\nHessen Amtsgericht Frankfurt am Main HRA 52987\nRegisterbekanntmachung nach dem Umwandlungsgesetz 16.12.2025 (Eintragungsdatum)\n\nDIC 27 Portfolio GmbH & Co. KG\nKommanditgesellschaft\nFrankfurt am Main\n\nDen Gläubigern der an der Verschmelzung beteiligten Rechtsträger ist, wenn sie binnen sechs Monaten nach dem Tag, an dem die Eintragung der Verschmelzung in das Register des Sitzes desjenigen Rechtsträgers, dessen Gläubiger sie sind, nach § 19 Absatz 3 UmwG bekannt gemacht worden ist, ihren Anspruch nach Grund und Höhe schriftlich anmelden, Sicherheit zu leisten, soweit sie nicht Befriedigung verlangen können. Dieses Recht steht den Gläubigern jedoch nur zu, wenn sie glaubhaft machen, dass durch die Verschmelzung die Erfüllung ihrer Forderung gefährdet wird."
    },
    {
      "date": "2025-12-16",
      "id": "140214",
      "original_text": "Registerbekanntmachung nach dem Umwandlungsgesetz\nHessen Amtsgericht Frankfurt am Main HRA 52987\nDIC 27 Portfolio GmbH & Co. KG – Frankfurt am Main",
      "type": "Registerbekanntmachung nach dem Umwandlungsgesetz",
      "state": "Hessen",
      "amtsgericht": "Amtsgericht Frankfurt am Main",
      "registernummer": "HRA 52987",
      "registerart": "HRA",
      "company_name": "DIC 27 Portfolio GmbH & Co. KG",
      "company_seat": "Frankfurt am Main",
      "details": "16.12.2025 (Bekanntmachungsdatum)\n\nHessen Amtsgericht Frankfurt am Main HRA 52987\nRegisterbekanntmachung nach dem Umwandlungsgesetz 16.12.2025 (Eintragungsdatum)\n\nDIC 27 Portfolio GmbH & Co. KG\nKommanditgesellschaft\nFrankfurt am Main\n\nDen Gläubigern der an der Verschmelzung beteiligten Rechtsträger ist, wenn sie binnen sechs Monaten nach dem Tag, an dem die Eintragung der Verschmelzung in das Register des Sitzes desjenigen Rechtsträgers, dessen Gläubiger sie sind, nach § 19 Absatz 3 UmwG bekannt gemacht worden ist, ihren Anspruch nach Grund und Höhe schriftlich anmelden, Sicherheit zu leisten, soweit sie nicht Befriedigung verlangen können. Dieses Recht steht den Gläubigern jedoch nur zu, wenn sie glaubhaft machen, dass durch die Verschmelzung die Erfüllung ihrer Forderung gefährdet wird."
    },
    {
      "date": "2025-12-16",
      "id": "140215",
      "original_text": "Einreichung neuer Dokumente\nHessen Amtsgericht Gießen HRB 7048\nSMK Versicherungsmakler AG – Gießen",
      "type": "Einreichung neuer Dokumente",
      "state": "Hessen",
      "amtsgericht": "Amtsgericht Gießen",
      "registernummer": "HRB 7048",
      "registerart": "HRB",
      "company_name": "SMK Versicherungsmakler AG",
      "company_seat": "Gießen",
      "details": "16.12.2025 (Bekanntmachungsdatum)\n\nHessen Amtsgericht Gießen HRB 7048\nEinreichung neuer Dokumente\n\nSMK Versicherungsmakler AG\nAktiengesellschaft\nGießen\n\nAufgrund einer Änderung in den Personen der Aufsichtsratsmitglieder ist eine Liste der Mitglieder des Aufsichtsrates zum Handelsregister eingereicht worden."
    },
    {
      "date": "2025-12-16",
      "id": "140216",
      "original_text": "Einreichung neuer Dokumente\nHessen Amtsgericht Hanau HRB 7163\nGoodyear Germany GmbH – Hanau",
      "type": "Einreichung neuer Dokumente",
      "state": "Hessen",
      "amtsgericht": "Amtsgericht Hanau",
      "registernummer": "HRB 7163",
      "registerart": "HRB",
      "company_name": "Goodyear Germany GmbH",
      "company_seat": "Hanau",
      "details": "16.12.2025 (Bekanntmachungsdatum)\n\nHessen Amtsgericht Hanau HRB 7163\nEinreichung neuer Dokumente\n\nGoodyear Germany GmbH\nGesellschaft mit beschränkter Haftung\nHanau\n\nDurch eine Änderung in den Personen der Aufsichtsratsmitglieder ist eine Liste der Mitglieder des Aufsichtsrates zum Handelsregister eingereicht worden."
    },
    {
      "date": "2025-12-16",
      "id": "140217",
      "original_text": "Löschungsankündigung\nHessen Amtsgericht Frankfurt am Main HRB 109721\nFainberg Language Academy GmbH – Frankfurt am Main",
      "type": "Löschungsankündigung",
      "state": "Hessen",
      "amtsgericht": "Amtsgericht Frankfurt am Main",
      "registernummer": "HRB 109721",
      "registerart": "HRB",
      "company_name": "Fainberg Language Academy GmbH",
      "company_seat": "Frankfurt am Main",
      "details": "16.12.2025 (Bekanntmachungsdatum)\n\nHessen Amtsgericht Frankfurt am Main HRB 109721\nLöschungsankündigung\n\nFainberg Language Academy GmbH\nGesellschaft mit beschränkter Haftung\nFrankfurt am Main\n\nDas Registergericht beabsichtigt die im Handelsregister eingetragene Gesellschaft von Amts wegen nach § 394 FamFG zu löschen. Die Frist zur Erhebung eines Widerspruchs gegen die beabsichtigte Löschung wird auf 1 Monate festgesetzt."
    },
    {
      "date": "2025-12-16",
      "id": "140218",
      "original_text": "Löschungsankündigung\nHessen Amtsgericht Offenbach am Main HRB 22171\nAzoren Archipel Reiseservice GmbH – Rodgau",
      "type": "Löschungsankündigung",
      "state": "Hessen",
      "amtsgericht": "Amtsgericht Offenbach am Main",
      "registernummer": "HRB 22171",
      "registerart": "HRB",
      "company_name": "Azoren Archipel Reiseservice GmbH",
      "company_seat": "Rodgau",
      "details": "16.12.2025 (Bekanntmachungsdatum)\n\nHessen Amtsgericht Offenbach am Main HRB 22171\nLöschungsankündigung\n\nAzoren Archipel Reiseservice GmbH\nGesellschaft mit beschränkter Haftung\nRodgau\n\nDas Registergericht beabsichtigt die im Handelsregister eingetragene Gesellschaft von Amts wegen nach § 394 FamFG zu löschen. Die Frist zur Erhebung eines Widerspruchs gegen die beabsichtigte Löschung wird auf 3 Monate festgesetzt."
    },
    {
      "date": "2025-12-16",
      "id": "140219",
      "original_text": "Registerbekanntmachung nach dem Umwandlungsgesetz\nHessen Amtsgericht Offenbach am Main HRA 43348\nSENDEN Dienstleistungen e.K. – Offenbach am Main",
      "type": "Registerbekanntmachung nach dem Umwandlungsgesetz",
      "state": "Hessen",
      "amtsgericht": "Amtsgericht Offenbach am Main",
      "registernummer": "HRA 43348",
      "registerart": "HRA",
      "company_name": "SENDEN Dienstleistungen e.K.",
      "company_seat": "Offenbach am Main",
      "details": "16.12.2025 (Bekanntmachungsdatum)\n\nHessen Amtsgericht Offenbach am Main HRA 43348\nRegisterbekanntmachung nach dem Umwandlungsgesetz 16.12.2025 (Eintragungsdatum)\n\nSENDEN Dienstleistungen e.K.\nEinzelkaufmann / Einzelkauffrau\nOffenbach am Main\n\nDen Gläubigern der an der Ausgliederung beteiligten Rechtsträger ist, wenn sie binnen sechs Monaten nach dem Tag, an dem die Eintragung der Ausgliederung in das Register des Sitzes desjenigen Rechtsträgers, dessen Gläubiger sie sind, nach §§ 125, 19 Absatz 3 UmwG bekannt gemacht worden ist, ihren Anspruch nach Grund und Höhe schriftlich anmelden, Sicherheit zu leisten, soweit sie nicht Befriedigung verlangen können. Dieses Recht steht den Gläubigern jedoch nur zu, wenn sie glaubhaft machen, dass durch die Ausgliederung die Erfüllung ihrer Forderung gefährdet wird."
    },
    {
      "date": "2025-12-16",
      "id": "140220",
      "original_text": "Registerbekanntmachung nach dem Umwandlungsgesetz\nHessen Amtsgericht Frankfurt am Main HRB 78432\nDIC Objekt Hemsbach GmbH – Frankfurt am Main",
      "type": "Registerbekanntmachung nach dem Umwandlungsgesetz",
      "state": "Hessen",
      "amtsgericht": "Amtsgericht Frankfurt am Main",
      "registernummer": "HRB 78432",
      "registerart": "HRB",
      "company_name": "DIC Objekt Hemsbach GmbH",
      "company_seat": "Frankfurt am Main",
      "details": "16.12.2025 (Bekanntmachungsdatum)\n\nHessen Amtsgericht Frankfurt am Main HRB 78432\nRegisterbekanntmachung nach dem Umwandlungsgesetz 16.12.2025 (Eintragungsdatum)\n\nDIC Objekt Hemsbach GmbH\nGesellschaft mit beschränkter Haftung\nFrankfurt am Main\n\nDen Gläubigern der an der Verschmelzung beteiligten Rechtsträger ist, wenn sie binnen sechs Monaten nach dem Tag, an dem die Eintragung der Verschmelzung in das Register des Sitzes desjenigen Rechtsträgers, dessen Gläubiger sie sind, nach § 19 Absatz 3 UmwG bekannt gemacht worden ist, ihren Anspruch nach Grund und Höhe schriftlich anmelden, Sicherheit zu leisten, soweit sie nicht Befriedigung verlangen können. Dieses Recht steht den Gläubigern jedoch nur zu, wenn sie glaubhaft machen, dass durch die Verschmelzung die Erfüllung ihrer Forderung gefährdet wird."
    },
    {
      "date": "2025-12-16",
      "id": "140221",
      "original_text": "Registerbekanntmachung nach dem Umwandlungsgesetz\nHessen Amtsgericht Frankfurt am Main HRA 52987\nDIC 27 Portfolio GmbH & Co. KG – Frankfurt am Main",
      "type": "Registerbekanntmachung nach dem Umwandlungsgesetz",
      "state": "Hessen",
      "amtsgericht": "Amtsgericht Frankfurt am Main",
      "registernummer": "HRA 52987",
      "registerart": "HRA",
      "company_name": "DIC 27 Portfolio GmbH & Co. KG",
      "company_seat": "Frankfurt am Main",
      "details": "16.12.2025 (Bekanntmachungsdatum)\n\nHessen Amtsgericht Frankfurt am Main HRA 52987\nRegisterbekanntmachung nach dem Umwandlungsgesetz 16.12.2025 (Eintragungsdatum)\n\nDIC 27 Portfolio GmbH & Co. KG\nKommanditgesellschaft\nFrankfurt am Main\n\nDen Gläubigern der an der Verschmelzung beteiligten Rechtsträger ist, wenn sie binnen sechs Monaten nach dem Tag, an dem die Eintragung der Verschmelzung in das Register des Sitzes desjenigen Rechtsträgers, dessen Gläubiger sie sind, nach § 19 Absatz 3 UmwG bekannt gemacht worden ist, ihren Anspruch nach Grund und Höhe schriftlich anmelden, Sicherheit zu leisten, soweit sie nicht Befriedigung verlangen können. Dieses Recht steht den Gläubigern jedoch nur zu, wenn sie glaubhaft machen, dass durch die Verschmelzung die Erfüllung ihrer Forderung gefährdet wird."
    },
    {
      "date": "2025-12-16",
      "id": "140222",
      "original_text": "Registerbekanntmachung nach dem Umwandlungsgesetz\nHessen Amtsgericht Frankfurt am Main HRB 100506\nGEG Verwaltungs GmbH – Frankfurt am Main",
      "type": "Registerbekanntmachung nach dem Umwandlungsgesetz",
      "state": "Hessen",
      "amtsgericht": "Amtsgericht Frankfurt am Main",
      "registernummer": "HRB 100506",
      "registerart": "HRB",
      "company_name": "GEG Verwaltungs GmbH",
      "company_seat": "Frankfurt am Main",
      "details": "16.12.2025 (Bekanntmachungsdatum)\n\nHessen Amtsgericht Frankfurt am Main HRB 100506\nRegisterbekanntmachung nach dem Umwandlungsgesetz 16.12.2025 (Eintragungsdatum)\n\nGEG Verwaltungs GmbH\nGesellschaft mit beschränkter Haftung\nFrankfurt am Main\n\nDen Gläubigern der an der Verschmelzung beteiligten Rechtsträger ist, wenn sie binnen sechs Monaten nach dem Tag, an dem die Eintragung der Verschmelzung in das Register des Sitzes desjenigen Rechtsträgers, dessen Gläubiger sie sind, nach § 19 Absatz 3 UmwG bekannt gemacht worden ist, ihren Anspruch nach Grund und Höhe schriftlich anmelden, Sicherheit zu leisten, soweit sie nicht Befriedigung verlangen können. Dieses Recht steht den Gläubigern jedoch nur zu, wenn sie glaubhaft machen, dass durch die Verschmelzung die Erfüllung ihrer Forderung gefährdet wird."
    }
  ]
}