{
  "date": "2025-12-04",
  "date_of_scrape": "2025-12-05T04:13:48.972Z",
  "tool_version": "0.2.0",
  "number_of_announcements": 119,
  "announcements": [
    {
      "date": "2025-12-04",
      "id": "139076",
      "original_text": "Löschungsankündigung\nBayern Amtsgericht Hof HRB 5810\nP & C Immobilienmanagement Service UG (haftungsbeschränkt) – Wunsiedel",
      "type": "Löschungsankündigung",
      "state": "Bayern",
      "amtsgericht": "Amtsgericht Hof",
      "registernummer": "HRB 5810",
      "registerart": "HRB",
      "company_name": "P & C Immobilienmanagement Service UG (haftungsbeschränkt)",
      "company_seat": "Wunsiedel",
      "details": "04.12.2025 (Bekanntmachungsdatum)\n\nBayern Amtsgericht Hof HRB 5810\nLöschungsankündigung\n\nP & C Immobilienmanagement Service UG (haftungsbeschränkt)\nGesellschaft mit beschränkter Haftung\nWunsiedel\n\nDas Registergericht beabsichtigt, die im Handelsregister eingetragene Gesellschaft wegen Vermögenslosigkeit von Amts wegen nach § 394 FamFG zu löschen. Die Frist zur Erhebung eines Widerspruchs ist auf sechs Wochen festgesetzt."
    },
    {
      "date": "2025-12-04",
      "id": "139077",
      "original_text": "Registerbekanntmachung nach dem Umwandlungsgesetz\nBayern Amtsgericht Nürnberg HRB 6910\nWerner Seybold Kunstschmiede GmbH – Kirchensittenbach",
      "type": "Registerbekanntmachung nach dem Umwandlungsgesetz",
      "state": "Bayern",
      "amtsgericht": "Amtsgericht Nürnberg",
      "registernummer": "HRB 6910",
      "registerart": "HRB",
      "company_name": "Werner Seybold Kunstschmiede GmbH",
      "company_seat": "Kirchensittenbach",
      "details": "04.12.2025 (Bekanntmachungsdatum)\n\nBayern Amtsgericht Nürnberg HRB 6910\nRegisterbekanntmachung nach dem Umwandlungsgesetz 03.12.2025 (Eintragungsdatum)\n\nWerner Seybold Kunstschmiede GmbH\nGesellschaft mit beschränkter Haftung\nKirchensittenbach\n\nDen Gläubigern der an der Verschmelzung beteiligten Rechtsträger ist, wenn sie binnen sechs Monaten nach dem Tag, an dem die Eintragung der Verschmelzung in das Register des Sitzes desjenigen Rechtsträgers, dessen Gläubiger sie sind, nach § 19 Abs. 3 UmwG als bekannt gemacht gilt, ihren Anspruch nach Grund und Höhe in Textform anmelden, Sicherheit zu leisten, soweit sie nicht Befriedigung verlangen können. Dieses Recht steht den Gläubigern jedoch nur zu, wenn sie glaubhaft machen, dass durch die Verschmelzung die Erfüllung ihrer Forderung gefährdet wird."
    },
    {
      "date": "2025-12-04",
      "id": "139078",
      "original_text": "Löschungsankündigung\nBayern Amtsgericht Ingolstadt HRA 3647\ndisu.INVESTMENTS GmbH & Co. KG – Ingolstadt",
      "type": "Löschungsankündigung",
      "state": "Bayern",
      "amtsgericht": "Amtsgericht Ingolstadt",
      "registernummer": "HRA 3647",
      "registerart": "HRA",
      "company_name": "disu.INVESTMENTS GmbH & Co. KG",
      "company_seat": "Ingolstadt",
      "details": "04.12.2025 (Bekanntmachungsdatum)\n\nBayern Amtsgericht Ingolstadt HRA 3647\nLöschungsankündigung\n\ndisu.INVESTMENTS GmbH & Co. KG\nKommanditgesellschaft\nIngolstadt\n\nDas Registergericht beabsichtigt, die im Handelsregister eingetragene Firma wegen Vermögenslosigkeit von Amts wegen nach § 394 FamFG zu löschen. Die Frist zur Erhebung eines Widerspruchs ist auf einen Monat festgesetzt."
    },
    {
      "date": "2025-12-04",
      "id": "139079",
      "original_text": "Registerbekanntmachung nach dem Umwandlungsgesetz\nBayern Amtsgericht München HRB 307764\nHundepension Kufner GmbH – Oberhaching",
      "type": "Registerbekanntmachung nach dem Umwandlungsgesetz",
      "state": "Bayern",
      "amtsgericht": "Amtsgericht München",
      "registernummer": "HRB 307764",
      "registerart": "HRB",
      "company_name": "Hundepension Kufner GmbH",
      "company_seat": "Oberhaching",
      "details": "04.12.2025 (Bekanntmachungsdatum)\n\nBayern Amtsgericht München HRB 307764\nRegisterbekanntmachung nach dem Umwandlungsgesetz 03.12.2025 (Eintragungsdatum)\n\nHundepension Kufner GmbH\nGesellschaft mit beschränkter Haftung\nOberhaching\n\nDen Gläubigern der an der Ausgliederung beteiligten Rechtsträger ist, wenn sie binnen sechs Monaten nach dem Tag, an dem die Eintragung der Ausgliederung in das Register des Sitzes desjenigen Rechtsträgers, dessen Gläubiger sie sind, nach §§ 125, 19 Abs. 3 UmwG als bekannt gemacht gilt, ihren Anspruch nach Grund und Höhe in Textform anmelden, Sicherheit zu leisten, soweit sie nicht Befriedigung verlangen können. Dieses Recht steht den Gläubigern jedoch nur zu, wenn sie glaubhaft machen, dass durch die Ausgliederung die Erfüllung ihrer Forderung gefährdet wird."
    },
    {
      "date": "2025-12-04",
      "id": "139080",
      "original_text": "Registerbekanntmachung nach dem Umwandlungsgesetz\nBayern Amtsgericht Traunstein HRB 30675\nHEIDENHAIN Infrastruktur GmbH – Traunreut",
      "type": "Registerbekanntmachung nach dem Umwandlungsgesetz",
      "state": "Bayern",
      "amtsgericht": "Amtsgericht Traunstein",
      "registernummer": "HRB 30675",
      "registerart": "HRB",
      "company_name": "HEIDENHAIN Infrastruktur GmbH",
      "company_seat": "Traunreut",
      "details": "04.12.2025 (Bekanntmachungsdatum)\n\nBayern Amtsgericht Traunstein HRB 30675\nRegisterbekanntmachung nach dem Umwandlungsgesetz 03.12.2025 (Eintragungsdatum)\n\nHEIDENHAIN Infrastruktur GmbH\nGesellschaft mit beschränkter Haftung\nTraunreut\n\nDen Gläubigern der an der Verschmelzung beteiligten Rechtsträger ist, wenn sie binnen sechs Monaten nach dem Tag, an dem die Eintragung der Verschmelzung in das Register des Sitzes desjenigen Rechtsträgers, dessen Gläubiger sie sind, nach § 19 Abs. 3 UmwG als bekannt gemacht gilt, ihren Anspruch nach Grund und Höhe in Textform anmelden, Sicherheit zu leisten, soweit sie nicht Befriedigung verlangen können. Dieses Recht steht den Gläubigern jedoch nur zu, wenn sie glaubhaft machen, dass durch die Verschmelzung die Erfüllung ihrer Forderung gefährdet wird."
    },
    {
      "date": "2025-12-04",
      "id": "139081",
      "original_text": "Registerbekanntmachung nach dem Umwandlungsgesetz\nBayern Amtsgericht München HRB 176455\nIntergraph PP&M Deutschland GmbH – Garching b. München",
      "type": "Registerbekanntmachung nach dem Umwandlungsgesetz",
      "state": "Bayern",
      "amtsgericht": "Amtsgericht München",
      "registernummer": "HRB 176455",
      "registerart": "HRB",
      "company_name": "Intergraph PP&M Deutschland GmbH",
      "company_seat": "Garching b. München",
      "details": "04.12.2025 (Bekanntmachungsdatum)\n\nBayern Amtsgericht München HRB 176455\nRegisterbekanntmachung nach dem Umwandlungsgesetz 03.12.2025 (Eintragungsdatum)\n\nIntergraph PP&M Deutschland GmbH\nGesellschaft mit beschränkter Haftung\nGarching b. München\n\nDen Gläubigern der an der Spaltung beteiligten Rechtsträger ist, wenn sie binnen sechs Monaten nach dem Tag, an dem die Eintragung der Spaltung in das Register des Sitzes desjenigen Rechtsträgers, dessen Gläubiger sie sind, nach §§ 125, 19 Abs. 3 UmwG als bekannt gemacht gilt, ihren Anspruch nach Grund und Höhe in Textform anmelden, Sicherheit zu leisten, soweit sie nicht Befriedigung verlangen können. Dieses Recht steht den Gläubigern jedoch nur zu, wenn sie glaubhaft machen, dass durch die Spaltung die Erfüllung ihrer Forderung gefährdet wird."
    },
    {
      "date": "2025-12-04",
      "id": "139082",
      "original_text": "Löschungsankündigung\nBayern Amtsgericht München HRB 236822\nSAROS GmbH – München",
      "type": "Löschungsankündigung",
      "state": "Bayern",
      "amtsgericht": "Amtsgericht München",
      "registernummer": "HRB 236822",
      "registerart": "HRB",
      "company_name": "SAROS GmbH",
      "company_seat": "München",
      "details": "04.12.2025 (Bekanntmachungsdatum)\n\nBayern Amtsgericht München HRB 236822\nLöschungsankündigung 03.12.2025 (Eintragungsdatum)\n\nSAROS GmbH\nGesellschaft mit beschränkter Haftung\nMünchen\n\nDas Registergericht beabsichtigt, die im Handelsregister eingetragene Gesellschaft wegen Vermögenslosigkeit von Amts wegen nach § 394 FamFG zu löschen. Die Frist zur Erhebung eines Widerspruchs ist auf drei Monate festgesetzt."
    },
    {
      "date": "2025-12-04",
      "id": "139083",
      "original_text": "Registerbekanntmachung nach dem Umwandlungsgesetz\nBayern Amtsgericht München HRB 305043\nhabermeyer.therapie GmbH – Polling",
      "type": "Registerbekanntmachung nach dem Umwandlungsgesetz",
      "state": "Bayern",
      "amtsgericht": "Amtsgericht München",
      "registernummer": "HRB 305043",
      "registerart": "HRB",
      "company_name": "habermeyer.therapie GmbH",
      "company_seat": "Polling",
      "details": "04.12.2025 (Bekanntmachungsdatum)\n\nBayern Amtsgericht München HRB 305043\nRegisterbekanntmachung nach dem Umwandlungsgesetz 03.12.2025 (Eintragungsdatum)\n\nhabermeyer.therapie GmbH\nGesellschaft mit beschränkter Haftung\nPolling\n\nDen Gläubigern der an der Spaltung beteiligten Rechtsträger ist, wenn sie binnen sechs Monaten nach dem Tag, an dem die Eintragung der Spaltung in das Register des Sitzes desjenigen Rechtsträgers, dessen Gläubiger sie sind, nach §§ 125, 19 Abs. 3 UmwG als bekannt gemacht gilt, ihren Anspruch nach Grund und Höhe in Textform anmelden, Sicherheit zu leisten, soweit sie nicht Befriedigung verlangen können. Dieses Recht steht den Gläubigern jedoch nur zu, wenn sie glaubhaft machen, dass durch die Spaltung die Erfüllung ihrer Forderung gefährdet wird."
    },
    {
      "date": "2025-12-04",
      "id": "139084",
      "original_text": "Löschungsankündigung\nBayern Amtsgericht München HRB 289573\nTrans Direkt Lieferservice GmbH – München",
      "type": "Löschungsankündigung",
      "state": "Bayern",
      "amtsgericht": "Amtsgericht München",
      "registernummer": "HRB 289573",
      "registerart": "HRB",
      "company_name": "Trans Direkt Lieferservice GmbH",
      "company_seat": "München",
      "details": "04.12.2025 (Bekanntmachungsdatum)\n\nBayern Amtsgericht München HRB 289573\nLöschungsankündigung\n\nTrans Direkt Lieferservice GmbH\nGesellschaft mit beschränkter Haftung\nMünchen\n\nDas Registergericht beabsichtigt, die im Handelsregister eingetragene Gesellschaft wegen Vermögenslosigkeit von Amts wegen nach § 394 FamFG zu löschen. Die Frist zur Erhebung eines Widerspruchs ist auf drei Monate festgesetzt."
    },
    {
      "date": "2025-12-04",
      "id": "139085",
      "original_text": "Löschungsankündigung\nBayern Amtsgericht München HRB 225472\nREM Bau UG (haftungsbeschränkt) – München",
      "type": "Löschungsankündigung",
      "state": "Bayern",
      "amtsgericht": "Amtsgericht München",
      "registernummer": "HRB 225472",
      "registerart": "HRB",
      "company_name": "REM Bau UG (haftungsbeschränkt)",
      "company_seat": "München",
      "details": "04.12.2025 (Bekanntmachungsdatum)\n\nBayern Amtsgericht München HRB 225472\nLöschungsankündigung\n\nREM Bau UG (haftungsbeschränkt)\nGesellschaft mit beschränkter Haftung\nMünchen\n\nDas Registergericht beabsichtigt, die im Handelsregister eingetragene Gesellschaft wegen Vermögenslosigkeit von Amts wegen nach § 394 FamFG zu löschen. Die Frist zur Erhebung eines Widerspruchs ist auf drei Monate festgesetzt."
    },
    {
      "date": "2025-12-04",
      "id": "139086",
      "original_text": "Registerbekanntmachung nach dem Umwandlungsgesetz\nBayern Amtsgericht Traunstein HRB 275\nDR. JOHANNES HEIDENHAIN GmbH – Traunreut",
      "type": "Registerbekanntmachung nach dem Umwandlungsgesetz",
      "state": "Bayern",
      "amtsgericht": "Amtsgericht Traunstein",
      "registernummer": "HRB 275",
      "registerart": "HRB",
      "company_name": "DR. JOHANNES HEIDENHAIN GmbH",
      "company_seat": "Traunreut",
      "details": "04.12.2025 (Bekanntmachungsdatum)\n\nBayern Amtsgericht Traunstein HRB 275\nRegisterbekanntmachung nach dem Umwandlungsgesetz 03.12.2025 (Eintragungsdatum)\n\nDR. JOHANNES HEIDENHAIN GmbH\nGesellschaft mit beschränkter Haftung\nTraunreut\n\nDen Gläubigern der an der Verschmelzung beteiligten Rechtsträger ist, wenn sie binnen sechs Monaten nach dem Tag, an dem die Eintragung der Verschmelzung in das Register des Sitzes desjenigen Rechtsträgers, dessen Gläubiger sie sind, nach § 19 Abs. 3 UmwG als bekannt gemacht gilt, ihren Anspruch nach Grund und Höhe in Textform anmelden, Sicherheit zu leisten, soweit sie nicht Befriedigung verlangen können. Dieses Recht steht den Gläubigern jedoch nur zu, wenn sie glaubhaft machen, dass durch die Verschmelzung die Erfüllung ihrer Forderung gefährdet wird."
    },
    {
      "date": "2025-12-04",
      "id": "139087",
      "original_text": "Registerbekanntmachung nach dem Umwandlungsgesetz\nBayern Amtsgericht München HRB 298329\nINVOX Holding GmbH – München",
      "type": "Registerbekanntmachung nach dem Umwandlungsgesetz",
      "state": "Bayern",
      "amtsgericht": "Amtsgericht München",
      "registernummer": "HRB 298329",
      "registerart": "HRB",
      "company_name": "INVOX Holding GmbH",
      "company_seat": "München",
      "details": "04.12.2025 (Bekanntmachungsdatum)\n\nBayern Amtsgericht München HRB 298329\nRegisterbekanntmachung nach dem Umwandlungsgesetz 03.12.2025 (Eintragungsdatum)\n\nINVOX Holding GmbH\nGesellschaft mit beschränkter Haftung\nMünchen\n\nDen Gläubigern der an der Verschmelzung beteiligten Rechtsträger ist, wenn sie binnen sechs Monaten nach dem Tag, an dem die Eintragung der Verschmelzung in das Register des Sitzes desjenigen Rechtsträgers, dessen Gläubiger sie sind, nach § 19 Abs. 3 UmwG als bekannt gemacht gilt, ihren Anspruch nach Grund und Höhe in Textform anmelden, Sicherheit zu leisten, soweit sie nicht Befriedigung verlangen können. Dieses Recht steht den Gläubigern jedoch nur zu, wenn sie glaubhaft machen, dass durch die Verschmelzung die Erfüllung ihrer Forderung gefährdet wird."
    },
    {
      "date": "2025-12-04",
      "id": "139088",
      "original_text": "Sonstige Registerbekanntmachung\nBayern Amtsgericht München HRB 284973\nAllgeier IT Services GmbH – München",
      "type": "Sonstige Registerbekanntmachung",
      "state": "Bayern",
      "amtsgericht": "Amtsgericht München",
      "registernummer": "HRB 284973",
      "registerart": "HRB",
      "company_name": "Allgeier IT Services GmbH",
      "company_seat": "München",
      "details": "04.12.2025 (Bekanntmachungsdatum)\n\nBayern Amtsgericht München HRB 284973\nSonstige Registerbekanntmachung 03.12.2025 (Eintragungsdatum)\n\nAllgeier IT Services GmbH\nGesellschaft mit beschränkter Haftung\nMünchen\n\nDen Gläubigern der Gesellschaft, deren Forderungen begründet worden sind, bevor die Eintragung der Beendigung des Gewinnabführungsvertrages in das Handelsregister nach § 10 des Handelsgesetzbuches als bekanntgemacht gilt, hat der andere Vertragsteil Sicherheit zu leisten, wenn sie sich binnen sechs Monaten nach der Bekanntmachung der Eintragung zu diesem Zweck bei ihm melden."
    },
    {
      "date": "2025-12-04",
      "id": "139089",
      "original_text": "Registerbekanntmachung nach dem Umwandlungsgesetz\nBayern Amtsgericht München HRB 301787\nAllianz Services Holding GmbH – München",
      "type": "Registerbekanntmachung nach dem Umwandlungsgesetz",
      "state": "Bayern",
      "amtsgericht": "Amtsgericht München",
      "registernummer": "HRB 301787",
      "registerart": "HRB",
      "company_name": "Allianz Services Holding GmbH",
      "company_seat": "München",
      "details": "04.12.2025 (Bekanntmachungsdatum)\n\nBayern Amtsgericht München HRB 301787\nRegisterbekanntmachung nach dem Umwandlungsgesetz 03.12.2025 (Eintragungsdatum)\n\nAllianz Services Holding GmbH\nGesellschaft mit beschränkter Haftung\nMünchen\n\nDen Gläubigern der an der Verschmelzung beteiligten Rechtsträger ist, wenn sie binnen sechs Monaten nach dem Tag, an dem die Eintragung der Verschmelzung in das Register des Sitzes desjenigen Rechtsträgers, dessen Gläubiger sie sind, nach § 19 Abs. 3 UmwG als bekannt gemacht gilt, ihren Anspruch nach Grund und Höhe in Textform anmelden, Sicherheit zu leisten, soweit sie nicht Befriedigung verlangen können. Dieses Recht steht den Gläubigern jedoch nur zu, wenn sie glaubhaft machen, dass durch die Verschmelzung die Erfüllung ihrer Forderung gefährdet wird."
    },
    {
      "date": "2025-12-04",
      "id": "139090",
      "original_text": "Löschungsankündigung\nBayern Amtsgericht Bayreuth HRB 3211\nHummel GmbH – Bayreuth",
      "type": "Löschungsankündigung",
      "state": "Bayern",
      "amtsgericht": "Amtsgericht Bayreuth",
      "registernummer": "HRB 3211",
      "registerart": "HRB",
      "company_name": "Hummel GmbH",
      "company_seat": "Bayreuth",
      "details": "04.12.2025 (Bekanntmachungsdatum)\n\nBayern Amtsgericht Bayreuth HRB 3211\nLöschungsankündigung\n\nHummel GmbH\nGesellschaft mit beschränkter Haftung\nBayreuth\n\nDas Registergericht beabsichtigt, die im Handelsregister eingetragene Gesellschaft wegen Vermögenslosigkeit von Amts wegen nach § 394 FamFG zu löschen. #insert(Text=\"zztb_V_Widerspruchsfrist\")"
    },
    {
      "date": "2025-12-04",
      "id": "139091",
      "original_text": "Registerbekanntmachung nach dem Umwandlungsgesetz\nBayern Amtsgericht Ingolstadt HRB 12636\nRS Service-Center Richter & Ströhmer GmbH – Vohburg a.d. Donau",
      "type": "Registerbekanntmachung nach dem Umwandlungsgesetz",
      "state": "Bayern",
      "amtsgericht": "Amtsgericht Ingolstadt",
      "registernummer": "HRB 12636",
      "registerart": "HRB",
      "company_name": "RS Service-Center Richter & Ströhmer GmbH",
      "company_seat": "Vohburg a.d. Donau",
      "details": "04.12.2025 (Bekanntmachungsdatum)\n\nBayern Amtsgericht Ingolstadt HRB 12636\nRegisterbekanntmachung nach dem Umwandlungsgesetz 03.12.2025 (Eintragungsdatum)\n\nRS Service-Center Richter & Ströhmer GmbH\nGesellschaft mit beschränkter Haftung\nVohburg a.d. Donau\n\nDen Gläubigern der an der Ausgliederung beteiligten Rechtsträger ist, wenn sie binnen sechs Monaten nach dem Tag, an dem die Eintragung der Ausgliederung in das Register des Sitzes desjenigen Rechtsträgers, dessen Gläubiger sie sind, nach §§ 125, 19 Abs. 3 UmwG als bekannt gemacht gilt, ihren Anspruch nach Grund und Höhe in Textform anmelden, Sicherheit zu leisten, soweit sie nicht Befriedigung verlangen können. Dieses Recht steht den Gläubigern jedoch nur zu, wenn sie glaubhaft machen, dass durch die Ausgliederung die Erfüllung ihrer Forderung gefährdet wird."
    },
    {
      "date": "2025-12-04",
      "id": "139092",
      "original_text": "Registerbekanntmachung nach dem Umwandlungsgesetz\nBayern Amtsgericht München HRB 234476\nGlovatskiy Lab GmbH – Grünwald",
      "type": "Registerbekanntmachung nach dem Umwandlungsgesetz",
      "state": "Bayern",
      "amtsgericht": "Amtsgericht München",
      "registernummer": "HRB 234476",
      "registerart": "HRB",
      "company_name": "Glovatskiy Lab GmbH",
      "company_seat": "Grünwald",
      "details": "04.12.2025 (Bekanntmachungsdatum)\n\nBayern Amtsgericht München HRB 234476\nRegisterbekanntmachung nach dem Umwandlungsgesetz 03.12.2025 (Eintragungsdatum)\n\nGlovatskiy Lab GmbH\nGesellschaft mit beschränkter Haftung\nGrünwald\n\nDas Registergericht beabsichtigt, die im Handelsregister eingetragene Gesellschaft wegen Vermögenslosigkeit von Amts wegen nach § 394 FamFG zu löschen. Die Frist zur Erhebung eines Widerspruchs ist auf drei Monate festgesetzt."
    },
    {
      "date": "2025-12-04",
      "id": "139093",
      "original_text": "Löschungsankündigung\nBayern Amtsgericht Nürnberg HRB 16915\nK & K Grundbesitz GmbH – Nürnberg",
      "type": "Löschungsankündigung",
      "state": "Bayern",
      "amtsgericht": "Amtsgericht Nürnberg",
      "registernummer": "HRB 16915",
      "registerart": "HRB",
      "company_name": "K & K Grundbesitz GmbH",
      "company_seat": "Nürnberg",
      "details": "04.12.2025 (Bekanntmachungsdatum)\n\nBayern Amtsgericht Nürnberg HRB 16915\nLöschungsankündigung\n\nK & K Grundbesitz GmbH\nGesellschaft mit beschränkter Haftung\nNürnberg\n\nDas Registergericht beabsichtigt, die im Handelsregister eingetragene Gesellschaft wegen Vermögenslosigkeit von Amts wegen nach § 394 FamFG zu löschen. Die Frist zur Erhebung eines Widerspruchs ist auf einen Monat festgesetzt."
    },
    {
      "date": "2025-12-04",
      "id": "139094",
      "original_text": "Registerbekanntmachung nach dem Umwandlungsgesetz\nBayern Amtsgericht München HRB 153787\nSenator Beteiligungs GmbH – München",
      "type": "Registerbekanntmachung nach dem Umwandlungsgesetz",
      "state": "Bayern",
      "amtsgericht": "Amtsgericht München",
      "registernummer": "HRB 153787",
      "registerart": "HRB",
      "company_name": "Senator Beteiligungs GmbH",
      "company_seat": "München",
      "details": "04.12.2025 (Bekanntmachungsdatum)\n\nBayern Amtsgericht München HRB 153787\nRegisterbekanntmachung nach dem Umwandlungsgesetz 03.12.2025 (Eintragungsdatum)\n\nSenator Beteiligungs GmbH\nGesellschaft mit beschränkter Haftung\nMünchen\n\nDen Gläubigern der an der Verschmelzung beteiligten Rechtsträger ist, wenn sie binnen sechs Monaten nach dem Tag, an dem die Eintragung der Verschmelzung in das Register des Sitzes desjenigen Rechtsträgers, dessen Gläubiger sie sind, nach § 19 Abs. 3 UmwG als bekannt gemacht gilt, ihren Anspruch nach Grund und Höhe in Textform anmelden, Sicherheit zu leisten, soweit sie nicht Befriedigung verlangen können. Dieses Recht steht den Gläubigern jedoch nur zu, wenn sie glaubhaft machen, dass durch die Verschmelzung die Erfüllung ihrer Forderung gefährdet wird."
    },
    {
      "date": "2025-12-04",
      "id": "139095",
      "original_text": "Registerbekanntmachung nach dem Umwandlungsgesetz\nBayern Amtsgericht Nürnberg HRA 20502\nWerner Seybold Kunstschmiede e.K. Inhaber Werner Seybold – Kirchensittenbach",
      "type": "Registerbekanntmachung nach dem Umwandlungsgesetz",
      "state": "Bayern",
      "amtsgericht": "Amtsgericht Nürnberg",
      "registernummer": "HRA 20502",
      "registerart": "HRA",
      "company_name": "Werner Seybold Kunstschmiede e.K. Inhaber Werner Seybold",
      "company_seat": "Kirchensittenbach",
      "details": "04.12.2025 (Bekanntmachungsdatum)\n\nBayern Amtsgericht Nürnberg HRA 20502\nRegisterbekanntmachung nach dem Umwandlungsgesetz 03.12.2025 (Eintragungsdatum)\n\nWerner Seybold Kunstschmiede e.K. Inhaber Werner Seybold\nEinzelkaufmann / Einzelkauffrau\nKirchensittenbach\n\nDen Gläubigern der an der Verschmelzung beteiligten Rechtsträger ist, wenn sie binnen sechs Monaten nach dem Tag, an dem die Eintragung der Verschmelzung in das Register des Sitzes desjenigen Rechtsträgers, dessen Gläubiger sie sind, nach § 19 Abs. 3 UmwG als bekannt gemacht gilt, ihren Anspruch nach Grund und Höhe in Textform anmelden, Sicherheit zu leisten, soweit sie nicht Befriedigung verlangen können. Dieses Recht steht den Gläubigern jedoch nur zu, wenn sie glaubhaft machen, dass durch die Verschmelzung die Erfüllung ihrer Forderung gefährdet wird."
    },
    {
      "date": "2025-12-04",
      "id": "139096",
      "original_text": "Löschungsankündigung\nBayern Amtsgericht Landshut HRB 9091\nLogistics Cargo Service GmbH – Simbach am Inn",
      "type": "Löschungsankündigung",
      "state": "Bayern",
      "amtsgericht": "Amtsgericht Landshut",
      "registernummer": "HRB 9091",
      "registerart": "HRB",
      "company_name": "Logistics Cargo Service GmbH",
      "company_seat": "Simbach am Inn",
      "details": "04.12.2025 (Bekanntmachungsdatum)\n\nBayern Amtsgericht Landshut HRB 9091\nLöschungsankündigung\n\nLogistics Cargo Service GmbH\nGesellschaft mit beschränkter Haftung\nSimbach am Inn\n\nDas Registergericht beabsichtigt, die im Handelsregister eingetragene Gesellschaft wegen Vermögenslosigkeit von Amts wegen nach § 394 FamFG zu löschen. Die Frist zur Erhebung eines Widerspruchs ist auf einen Monat festgesetzt."
    },
    {
      "date": "2025-12-04",
      "id": "139097",
      "original_text": "Registerbekanntmachung nach dem Umwandlungsgesetz\nBayern Amtsgericht Ingolstadt HRB 4442\nRS Service-Center Richter & Ströhmer GmbH – Ingolstadt",
      "type": "Registerbekanntmachung nach dem Umwandlungsgesetz",
      "state": "Bayern",
      "amtsgericht": "Amtsgericht Ingolstadt",
      "registernummer": "HRB 4442",
      "registerart": "HRB",
      "company_name": "RS Service-Center Richter & Ströhmer GmbH",
      "company_seat": "Ingolstadt",
      "details": "04.12.2025 (Bekanntmachungsdatum)\n\nBayern Amtsgericht Ingolstadt HRB 4442\nRegisterbekanntmachung nach dem Umwandlungsgesetz 03.12.2025 (Eintragungsdatum)\n\nRS Service-Center Richter & Ströhmer GmbH\nGesellschaft mit beschränkter Haftung\nIngolstadt\n\nDen Gläubigern der an der Ausgliederung beteiligten Rechtsträger ist, wenn sie binnen sechs Monaten nach dem Tag, an dem die Eintragung der Ausgliederung in das Register des Sitzes desjenigen Rechtsträgers, dessen Gläubiger sie sind, nach §§ 125, 19 Abs. 3 UmwG als bekannt gemacht gilt, ihren Anspruch nach Grund und Höhe in Textform anmelden, Sicherheit zu leisten, soweit sie nicht Befriedigung verlangen können. Dieses Recht steht den Gläubigern jedoch nur zu, wenn sie glaubhaft machen, dass durch die Ausgliederung die Erfüllung ihrer Forderung gefährdet wird."
    },
    {
      "date": "2025-12-04",
      "id": "139098",
      "original_text": "Löschungsankündigung\nBerlin Amtsgericht Berlin (Charlottenburg) HRB 145695\nITREX GmbH – Berlin",
      "type": "Löschungsankündigung",
      "state": "Berlin",
      "amtsgericht": "Amtsgericht Berlin (Charlottenburg)",
      "registernummer": "HRB 145695",
      "registerart": "HRB",
      "company_name": "ITREX GmbH",
      "company_seat": "Berlin",
      "details": "04.12.2025 (Bekanntmachungsdatum)\n\nBerlin Amtsgericht Berlin (Charlottenburg) HRB 145695\nLöschungsankündigung\n\nITREX GmbH\nGesellschaft mit beschränkter Haftung\nBerlin\n\nBei der nachstehenden Gesellschaft wird das Amtslöschungsverfahren gemäß § 394 FamFG eingeleitet. Widerspruchsfrist 6 Wochen"
    },
    {
      "date": "2025-12-04",
      "id": "139099",
      "original_text": "Löschungsankündigung\nSaarland Amtsgericht Saarbrücken HRA 9571\nB u. S Haustechnik OHG Inh. Saltalamacchia u. Cornel – Wallerfangen",
      "type": "Löschungsankündigung",
      "state": "Saarland",
      "amtsgericht": "Amtsgericht Saarbrücken",
      "registernummer": "HRA 9571",
      "registerart": "HRA",
      "company_name": "B u. S Haustechnik OHG Inh. Saltalamacchia u. Cornel",
      "company_seat": "Wallerfangen",
      "details": "04.12.2025 (Bekanntmachungsdatum)\n\nSaarland Amtsgericht Saarbrücken HRA 9571\nLöschungsankündigung\n\nB u. S Haustechnik OHG Inh. Saltalamacchia u. Cornel\nOffene Handelsgesellschaft\nWallerfangen\n\nEs ist beabsichtigt, die Gesellschaft von Amts wegen gemäß § 31  Abs. 2 HGB, § 393 FamFG zu löschen.\nGegen die Löschung von Amts wegen ist das Rechtsmittel des Widerspruchs statthaft. Der Widerspruch ist binnen einer Frist zwei Monaten beginnend mit dem Tag dieser Veröffentlichung durch Einreichen eines Widerspruchsschreibens -schriftlich oder zur Niederschrift der Geschäftsstelle beim Amtsgericht Saarbrücken, -zentrales Handelsregister-, Mainzerstr.178, 66121 Saarbrücken einzulegen.\nDer Widerspruch muss die Bezeichnung der angefochtenen Löschungsankündigung enthalten sowie die Erklärung, dass Widerspruch eingelegt wird. Er ist vom Widerspruchsführer oder seinem Bevollmächtigten zu unterzeichnen.\nDas Widerspruchsschreiben kann auch in der Form eines elektronischen Dokumentes eingereicht werden, das mit einer qualifizierten elektronischen Signatur nach dem Signaturgesetz versehen sein muss (§§ 14 Abs. 2 FamFG, 130a, 298 ZPO)."
    },
    {
      "date": "2025-12-04",
      "id": "139100",
      "original_text": "Registerbekanntmachung nach dem Umwandlungsgesetz\nBaden-Württemberg Amtsgericht Stuttgart HRB 762305\nH&L Grenzenlos UG (haftungsbeschränkt) – Bad Herrenalb",
      "type": "Registerbekanntmachung nach dem Umwandlungsgesetz",
      "state": "Baden-Württemberg",
      "amtsgericht": "Amtsgericht Stuttgart",
      "registernummer": "HRB 762305",
      "registerart": "HRB",
      "company_name": "H&L Grenzenlos UG (haftungsbeschränkt)",
      "company_seat": "Bad Herrenalb",
      "details": "04.12.2025 (Bekanntmachungsdatum)\n\nBaden-Württemberg Amtsgericht Stuttgart HRB 762305\nRegisterbekanntmachung nach dem Umwandlungsgesetz 04.12.2025 (Eintragungsdatum)\n\nH&L Grenzenlos UG (haftungsbeschränkt)\nGesellschaft mit beschränkter Haftung\nBad Herrenalb\n\nDen Gläubigern der an der Verschmelzung beteiligten Rechtsträger ist, wenn sie binnen sechs Monaten nach dem Tag, an dem die Eintragung der Verschmelzung in das Register des Sitzes desjenigen Rechtsträgers, dessen Gläubiger sie sind, nach § 19 Abs. 3 UmwG als bekanntgemacht gilt, ihren Anspruch nach Grund und Höhe schriftlich anmelden, Sicherheit zu leisten, soweit sie nicht Befriedigung verlangen können. Dieses Recht steht den Gläubigern jedoch nur zu, wenn sie glaubhaft machen, dass durch die Verschmelzung die Erfüllung ihrer Forderung gefährdet wird."
    },
    {
      "date": "2025-12-04",
      "id": "139101",
      "original_text": "Löschungsankündigung\nBaden-Württemberg Amtsgericht Mannheim HRB 502105\nModeatelier Bischoff GmbH – Neulingen",
      "type": "Löschungsankündigung",
      "state": "Baden-Württemberg",
      "amtsgericht": "Amtsgericht Mannheim",
      "registernummer": "HRB 502105",
      "registerart": "HRB",
      "company_name": "Modeatelier Bischoff GmbH",
      "company_seat": "Neulingen",
      "details": "04.12.2025 (Bekanntmachungsdatum)\n\nBaden-Württemberg Amtsgericht Mannheim HRB 502105\nLöschungsankündigung\n\nModeatelier Bischoff GmbH\nGesellschaft mit beschränkter Haftung\nNeulingen\n\nAls nicht eingetragen wird bekanntgemacht:\nDas Gericht beabsichtigt, die Gesellschaft wegen Vermögenslosigkeit im Handelsregister von Amts wegen nach § 394 FamFG zu löschen. Die Frist zur Geltendmachung eines Widerspruchs gegen die beabsichtigte Löschung ist auf einen Monat ab Veröffentlichung bestimmt."
    },
    {
      "date": "2025-12-04",
      "id": "139102",
      "original_text": "Einreichung neuer Dokumente\nBaden-Württemberg Amtsgericht Stuttgart HRB 264976\nRMGV, Rems-Murr-Gesundheits-Verwaltungs GmbH – Waiblingen",
      "type": "Einreichung neuer Dokumente",
      "state": "Baden-Württemberg",
      "amtsgericht": "Amtsgericht Stuttgart",
      "registernummer": "HRB 264976",
      "registerart": "HRB",
      "company_name": "RMGV, Rems-Murr-Gesundheits-Verwaltungs GmbH",
      "company_seat": "Waiblingen",
      "details": "04.12.2025 (Bekanntmachungsdatum)\n\nBaden-Württemberg Amtsgericht Stuttgart HRB 264976\nEinreichung neuer Dokumente\n\nRMGV, Rems-Murr-Gesundheits-Verwaltungs GmbH\nGesellschaft mit beschränkter Haftung\nWaiblingen\n\nDie Gesellschaft hat am 02.12.2025 die Liste über die Zusammensetzung des Aufsichtsrats zum Handelsregister eingereicht."
    },
    {
      "date": "2025-12-04",
      "id": "139103",
      "original_text": "Einreichung neuer Dokumente\nBaden-Württemberg Amtsgericht Stuttgart HRB 265091\nRMIM, Rems-Murr-Kreis-Immobilien-Management GmbH – Waiblingen",
      "type": "Einreichung neuer Dokumente",
      "state": "Baden-Württemberg",
      "amtsgericht": "Amtsgericht Stuttgart",
      "registernummer": "HRB 265091",
      "registerart": "HRB",
      "company_name": "RMIM, Rems-Murr-Kreis-Immobilien-Management GmbH",
      "company_seat": "Waiblingen",
      "details": "04.12.2025 (Bekanntmachungsdatum)\n\nBaden-Württemberg Amtsgericht Stuttgart HRB 265091\nEinreichung neuer Dokumente\n\nRMIM, Rems-Murr-Kreis-Immobilien-Management GmbH\nGesellschaft mit beschränkter Haftung\nWaiblingen\n\nAls nicht eingetragen wird bekanntgemacht:\nDie Gesellschaft hat am 02.12.2025 die Liste über die Zusammensetzung des Aufsichtsrats zum Handelsregister eingereicht."
    },
    {
      "date": "2025-12-04",
      "id": "139104",
      "original_text": "Löschungsankündigung\nSchleswig-Holstein Amtsgericht Flensburg HRB 14955\npaxsi.jetzt agentur UG (haftungsbeschränkt) – Sterup",
      "type": "Löschungsankündigung",
      "state": "Schleswig-Holstein",
      "amtsgericht": "Amtsgericht Flensburg",
      "registernummer": "HRB 14955",
      "registerart": "HRB",
      "company_name": "paxsi.jetzt agentur UG (haftungsbeschränkt)",
      "company_seat": "Sterup",
      "details": "04.12.2025 (Bekanntmachungsdatum)\n\nSchleswig-Holstein Amtsgericht Flensburg HRB 14955\nLöschungsankündigung\n\npaxsi.jetzt agentur UG (haftungsbeschränkt)\nGesellschaft mit beschränkter Haftung\nSterup\n\nEs ist die Löschung der nachstehenden Gesellschaft wegen Vermögenslosigkeit gemäß § 394 FamFG beabsichtigt.\nWiderspruchsfrist: 2 Monate"
    },
    {
      "date": "2025-12-04",
      "id": "139105",
      "original_text": "Löschungsankündigung\nSchleswig-Holstein Amtsgericht Lübeck HRB 17551\nproOpus Inhouse-Outsourcing GmbH – Reinbek",
      "type": "Löschungsankündigung",
      "state": "Schleswig-Holstein",
      "amtsgericht": "Amtsgericht Lübeck",
      "registernummer": "HRB 17551",
      "registerart": "HRB",
      "company_name": "proOpus Inhouse-Outsourcing GmbH",
      "company_seat": "Reinbek",
      "details": "04.12.2025 (Bekanntmachungsdatum)\n\nSchleswig-Holstein Amtsgericht Lübeck HRB 17551\nLöschungsankündigung\n\nproOpus Inhouse-Outsourcing GmbH\nGesellschaft mit beschränkter Haftung\nReinbek\n\nEs ist die Löschung der nachstehenden Gesellschaft wegen Vermögenslosigkeit gemäß § 394 FamFG beabsichtigt. Widerspruchsfrist: 1 Monat."
    },
    {
      "date": "2025-12-04",
      "id": "139106",
      "original_text": "Registerbekanntmachung nach dem Umwandlungsgesetz\nBaden-Württemberg Amtsgericht Mannheim HRA 712931\nPro Concept Objekt 5 GmbH & Co. KG – Mannheim",
      "type": "Registerbekanntmachung nach dem Umwandlungsgesetz",
      "state": "Baden-Württemberg",
      "amtsgericht": "Amtsgericht Mannheim",
      "registernummer": "HRA 712931",
      "registerart": "HRA",
      "company_name": "Pro Concept Objekt 5 GmbH & Co. KG",
      "company_seat": "Mannheim",
      "details": "04.12.2025 (Bekanntmachungsdatum)\n\nBaden-Württemberg Amtsgericht Mannheim HRA 712931\nRegisterbekanntmachung nach dem Umwandlungsgesetz 04.12.2025 (Eintragungsdatum)\n\nPro Concept Objekt 5 GmbH & Co. KG\nKommanditgesellschaft\nMannheim\n\nAls nicht eingetragen wird bekanntgemacht: Den Gläubigern des an dem Formwechsel beteiligten Rechtsträgers ist, wenn sie binnen sechs Monaten nach dem Tag, an dem die Eintragung des Formwechsels in das Register des Sitzes desjenigen Rechtsträgers, dessen Gläubiger sie sind, nach § 19 Abs. 3 UmwG als bekanntgemacht gilt, ihren Anspruch nach Grund und Höhe schriftlich anmelden, Sicherheit zu leisten, soweit sie nicht Befriedigung verlangen können. Dieses Recht steht den Gläubigern jedoch nur zu, wenn sie glaubhaft machen, dass durch den Formwechsel die Erfüllung ihrer Forderung gefährdet wird."
    },
    {
      "date": "2025-12-04",
      "id": "139107",
      "original_text": "Registerbekanntmachung nach dem Umwandlungsgesetz\nBaden-Württemberg Amtsgericht Mannheim HRB 734977\nPro Concept Objekt 5 GmbH – Mannheim",
      "type": "Registerbekanntmachung nach dem Umwandlungsgesetz",
      "state": "Baden-Württemberg",
      "amtsgericht": "Amtsgericht Mannheim",
      "registernummer": "HRB 734977",
      "registerart": "HRB",
      "company_name": "Pro Concept Objekt 5 GmbH",
      "company_seat": "Mannheim",
      "details": "04.12.2025 (Bekanntmachungsdatum)\n\nBaden-Württemberg Amtsgericht Mannheim HRB 734977\nRegisterbekanntmachung nach dem Umwandlungsgesetz 04.12.2025 (Eintragungsdatum)\n\nPro Concept Objekt 5 GmbH\nGesellschaft mit beschränkter Haftung\nMannheim\n\nAls nicht eingetragen wird bekanntgemacht:´Den Gläubigern des an dem Formwechsel beteiligten Rechtsträgers ist, wenn sie binnen sechs Monaten nach dem Tag, an dem die Eintragung des Formwechsels in das Register des Sitzes desjenigen Rechtsträgers, dessen Gläubiger sie sind, nach § 19 Abs. 3 UmwG als bekanntgemacht gilt, ihren Anspruch nach Grund und Höhe schriftlich anmelden, Sicherheit zu leisten, soweit sie nicht Befriedigung verlangen können. Dieses Recht steht den Gläubigern jedoch nur zu, wenn sie glaubhaft machen, dass durch den Formwechsel die Erfüllung ihrer Forderung gefährdet wird."
    },
    {
      "date": "2025-12-04",
      "id": "139108",
      "original_text": "Registerbekanntmachung nach dem Umwandlungsgesetz\nNordrhein-Westfalen Amtsgericht Coesfeld HRB 13417\nISS-Automation GmbH – Gronau",
      "type": "Registerbekanntmachung nach dem Umwandlungsgesetz",
      "state": "Nordrhein-Westfalen",
      "amtsgericht": "Amtsgericht Coesfeld",
      "registernummer": "HRB 13417",
      "registerart": "HRB",
      "company_name": "ISS-Automation GmbH",
      "company_seat": "Gronau",
      "details": "04.12.2025 (Bekanntmachungsdatum)\n\nNordrhein-Westfalen Amtsgericht Coesfeld HRB 13417\nRegisterbekanntmachung nach dem Umwandlungsgesetz 04.12.2025 (Eintragungsdatum)\n\nISS-Automation GmbH\nGesellschaft mit beschränkter Haftung\nGronau\n\nDen Gläubigern der an der Verschmelzung beteiligten Rechtsträger ist, wenn sie binnen sechs Monaten nach dem Tag, an dem die Eintragung der Verschmelzung in das Register des Sitzes desjenigen Rechtsträgers, dessen Gläubiger sie sind, nach § 19 Absatz 3 UmwG als bekanntgemacht gilt, ihren Anspruch nach Grund und Höhe schriftlich anmelden, Sicherheit zu leisten, soweit sie nicht Befriedigung verlangen können. Dieses Recht steht den Gläubigern jedoch nur zu, wenn sie glaubhaft machen, dass durch die Verschmelzung die Erfüllung ihrer Forderung gefährdet wird."
    },
    {
      "date": "2025-12-04",
      "id": "139109",
      "original_text": "Löschungsankündigung\nBrandenburg Amtsgericht Neuruppin HRA 3719\nCE Konzept GmbH & Co. KG – Hennigsdorf",
      "type": "Löschungsankündigung",
      "state": "Brandenburg",
      "amtsgericht": "Amtsgericht Neuruppin",
      "registernummer": "HRA 3719",
      "registerart": "HRA",
      "company_name": "CE Konzept GmbH & Co. KG",
      "company_seat": "Hennigsdorf",
      "details": "04.12.2025 (Bekanntmachungsdatum)\n\nBrandenburg Amtsgericht Neuruppin HRA 3719\nLöschungsankündigung\n\nCE Konzept GmbH & Co. KG\nKommanditgesellschaft\nHennigsdorf\n\nBei der nachstehenden Gesellschaft/dem nachstehenden Einzelkaufmann wird das Amtslöschungsverfahren gemäß § 31 Abs. 2 HGB eingeleitet.\nWiderspruchsfrist: 1 Monat."
    },
    {
      "date": "2025-12-04",
      "id": "139110",
      "original_text": "Registerbekanntmachung nach dem Umwandlungsgesetz\nBaden-Württemberg Amtsgericht Mannheim HRB 756526\nJJL Schimscha GmbH – Ravenstein",
      "type": "Registerbekanntmachung nach dem Umwandlungsgesetz",
      "state": "Baden-Württemberg",
      "amtsgericht": "Amtsgericht Mannheim",
      "registernummer": "HRB 756526",
      "registerart": "HRB",
      "company_name": "JJL Schimscha GmbH",
      "company_seat": "Ravenstein",
      "details": "04.12.2025 (Bekanntmachungsdatum)\n\nBaden-Württemberg Amtsgericht Mannheim HRB 756526\nRegisterbekanntmachung nach dem Umwandlungsgesetz 04.12.2025 (Eintragungsdatum)\n\nJJL Schimscha GmbH\nGesellschaft mit beschränkter Haftung\nRavenstein\n\nAls nicht eingetragen wird bekanntgemacht:\nDen Gläubigern des an dem Formwechsel beteiligten Rechtsträgers ist, wenn sie binnen sechs Monaten nach dem Tag, an dem die Eintragung des Formwechsels in das Register des Sitzes desjenigen Rechtsträgers, dessen Gläubiger sie sind, nach § 19 Abs. 3 UmwG als bekanntgemacht gilt, ihren Anspruch nach Grund und Höhe schriftlich anmelden, Sicherheit zu leisten, soweit sie nicht Befriedigung verlangen können. Dieses Recht steht den Gläubigern jedoch nur zu, wenn sie glaubhaft machen, dass durch den Formwechsel die Erfüllung ihrer Forderung gefährdet wird."
    },
    {
      "date": "2025-12-04",
      "id": "139111",
      "original_text": "Registerbekanntmachung nach dem Umwandlungsgesetz\nBaden-Württemberg Amtsgericht Mannheim HRA 712896\nJJL Schimscha UG (haftungsbeschränkt) & Co. KG – Ravenstein",
      "type": "Registerbekanntmachung nach dem Umwandlungsgesetz",
      "state": "Baden-Württemberg",
      "amtsgericht": "Amtsgericht Mannheim",
      "registernummer": "HRA 712896",
      "registerart": "HRA",
      "company_name": "JJL Schimscha UG (haftungsbeschränkt) & Co. KG",
      "company_seat": "Ravenstein",
      "details": "04.12.2025 (Bekanntmachungsdatum)\n\nBaden-Württemberg Amtsgericht Mannheim HRA 712896\nRegisterbekanntmachung nach dem Umwandlungsgesetz 04.12.2025 (Eintragungsdatum)\n\nJJL Schimscha UG (haftungsbeschränkt) & Co. KG\nKommanditgesellschaft\nRavenstein\n\nAls nicht eingetragen wird bekanntgemacht:\nDen Gläubigern des an dem Formwechsel beteiligten Rechtsträgers ist, wenn sie binnen sechs Monaten nach dem Tag, an dem die Eintragung des Formwechsels in das Register des Sitzes desjenigen Rechtsträgers, dessen Gläubiger sie sind, nach § 19 Abs. 3 UmwG als bekanntgemacht gilt, ihren Anspruch nach Grund und Höhe schriftlich anmelden, Sicherheit zu leisten, soweit sie nicht Befriedigung verlangen können. Dieses Recht steht den Gläubigern jedoch nur zu, wenn sie glaubhaft machen, dass durch den Formwechsel die Erfüllung ihrer Forderung gefährdet wird."
    },
    {
      "date": "2025-12-04",
      "id": "139112",
      "original_text": "Registerbekanntmachung nach dem Umwandlungsgesetz\nMecklenburg-Vorpommern Amtsgericht Schwerin HRB 15416\nElbtaler Agrar Krenzlin GmbH – Alt Krenzlin",
      "type": "Registerbekanntmachung nach dem Umwandlungsgesetz",
      "state": "Mecklenburg-Vorpommern",
      "amtsgericht": "Amtsgericht Schwerin",
      "registernummer": "HRB 15416",
      "registerart": "HRB",
      "company_name": "Elbtaler Agrar Krenzlin GmbH",
      "company_seat": "Alt Krenzlin",
      "details": "04.12.2025 (Bekanntmachungsdatum)\n\nMecklenburg-Vorpommern Amtsgericht Schwerin HRB 15416\nRegisterbekanntmachung nach dem Umwandlungsgesetz 04.12.2025 (Eintragungsdatum)\n\nElbtaler Agrar Krenzlin GmbH\nGesellschaft mit beschränkter Haftung\nAlt Krenzlin\n\nDen Gläubigern der am Formwechsel beteiligten Rechtsträger ist, wenn sie binnen sechs Monaten nach dem Tag, an dem die Eintragung des Formwechsels in das Register des Sitzes desjenigen Rechtsträgers, dessen Gläubiger sie sind, nach § 201 UmwG als bekanntgemacht gilt, ihren Anspruch nach Grund und Höhe schriftlich anmelden, Sicherheit zu leisten, soweit sie nicht Befriedigung verlangen können. Dieses Recht steht den Gläubigern jedoch nur zu, wenn sie glaubhaft machen, dass durch den Formwechsel die Erfüllung ihrer Forderung gefährdet wird."
    },
    {
      "date": "2025-12-04",
      "id": "139113",
      "original_text": "Einreichung neuer Dokumente\nSaarland Amtsgericht Saarbrücken HRB 107221\ntimefonds AG – Saarbrücken",
      "type": "Einreichung neuer Dokumente",
      "state": "Saarland",
      "amtsgericht": "Amtsgericht Saarbrücken",
      "registernummer": "HRB 107221",
      "registerart": "HRB",
      "company_name": "timefonds AG",
      "company_seat": "Saarbrücken",
      "details": "04.12.2025 (Bekanntmachungsdatum)\n\nSaarland Amtsgericht Saarbrücken HRB 107221\nEinreichung neuer Dokumente 04.12.2025 (Eintragungsdatum)\n\ntimefonds AG\nAktiengesellschaft\nSaarbrücken\n\nDer Vorstand der Gesellschaft hat eine Liste der Mitglieder des Aufsichtsrats zum Handelsregister eingereicht (§ 106 AktG)."
    },
    {
      "date": "2025-12-04",
      "id": "139114",
      "original_text": "Registerbekanntmachung nach dem Umwandlungsgesetz\nSaarland Amtsgericht Saarbrücken HRB 106063\nAmorphous Metal Solutions GmbH – Homburg",
      "type": "Registerbekanntmachung nach dem Umwandlungsgesetz",
      "state": "Saarland",
      "amtsgericht": "Amtsgericht Saarbrücken",
      "registernummer": "HRB 106063",
      "registerart": "HRB",
      "company_name": "Amorphous Metal Solutions GmbH",
      "company_seat": "Homburg",
      "details": "04.12.2025 (Bekanntmachungsdatum)\n\nSaarland Amtsgericht Saarbrücken HRB 106063\nRegisterbekanntmachung nach dem Umwandlungsgesetz 04.12.2025 (Eintragungsdatum)\n\nAmorphous Metal Solutions GmbH\nGesellschaft mit beschränkter Haftung\nHomburg\n\nAls nicht eingetragen wird bekannt gemacht: Den Gläubigern der an der Verschmelzung beteiligten Gesellschaften ist, wenn sie binnen sechs Monaten nach dem Tag, an dem die Eintragung der Verschmelzung in das Register des Sitzes desjenigen Rechtsträgers, dessen Gläubiger sie sind, nach § 19 Absatz 3 UmwG bekannt gemacht worden ist, ihren Anspruch nach Grund und Höhe schriftlich anmelden, Sicherheit zu leisten, soweit sie nicht Befriedigung verlangen können. Dieses Recht steht den Gläubigern jedoch nur zu, wenn sie glaubhaft machen, dass durch die Verschmelzung die Erfüllung ihrer Forderung gefährdet wird."
    },
    {
      "date": "2025-12-04",
      "id": "139115",
      "original_text": "Löschungsankündigung\nBerlin Amtsgericht Berlin (Charlottenburg) HRA 51171\nMassiv Baurausch GmbH & Co. KG – Berlin",
      "type": "Löschungsankündigung",
      "state": "Berlin",
      "amtsgericht": "Amtsgericht Berlin (Charlottenburg)",
      "registernummer": "HRA 51171",
      "registerart": "HRA",
      "company_name": "Massiv Baurausch GmbH & Co. KG",
      "company_seat": "Berlin",
      "details": "04.12.2025 (Bekanntmachungsdatum)\n\nBerlin Amtsgericht Berlin (Charlottenburg) HRA 51171\nLöschungsankündigung\n\nMassiv Baurausch GmbH & Co. KG\nKommanditgesellschaft\nBerlin\n\nBei dem nachstehenden Unternehmen / der nachstehenden Gesellschaft wird das Amtslöschungsverfahren gemäß § 31 Abs. 2 HGB eingeleitet. Widerspruchsfrist 1 Monat"
    },
    {
      "date": "2025-12-04",
      "id": "139116",
      "original_text": "Registerbekanntmachung nach dem Umwandlungsgesetz\nHamburg Amtsgericht Hamburg VR 18244\nERGO Pensions-Plan Unterstützungskasse e.V. – Hamburg",
      "type": "Registerbekanntmachung nach dem Umwandlungsgesetz",
      "state": "Hamburg",
      "amtsgericht": "Amtsgericht Hamburg",
      "registernummer": "VR 18244",
      "registerart": "VR",
      "company_name": "ERGO Pensions-Plan Unterstützungskasse e.V.",
      "company_seat": "Hamburg",
      "details": "04.12.2025 (Bekanntmachungsdatum)\n\nHamburg Amtsgericht Hamburg VR 18244\nRegisterbekanntmachung nach dem Umwandlungsgesetz 04.12.2025 (Eintragungsdatum)\n\nERGO Pensions-Plan Unterstützungskasse e.V.\neingetragener Verein\nHamburg\n\nAls nicht eingetragen wird bekannt gemacht:\nDen Gläubigern der an der Verschmelzung beteiligten Gesellschaften ist, wenn sie binnen sechs Monaten nach dem Tag, an dem die Eintragung der Verschmelzung in das Register des Sitzes desjenigen Rechtsträgers, dessen Gläubiger sie sind, nach § 19 Absatz 3 UmwG als bekannt gemacht gilt, ihren Anspruch nach Grund und Höhe schriftlich anmelden, Sicherheit zu leisten, soweit sie nicht Befriedigung verlangen können. Dieses Recht steht den Gläubigern jedoch nur zu, wenn sie glaubhaft machen, dass durch die Verschmelzung die Erfüllung ihrer Forderung gefährdet wird."
    },
    {
      "date": "2025-12-04",
      "id": "139117",
      "original_text": "Löschungsankündigung\nBerlin Amtsgericht Berlin (Charlottenburg) HRB 83447\nSimmerl Development delta GmbH – Berlin",
      "type": "Löschungsankündigung",
      "state": "Berlin",
      "amtsgericht": "Amtsgericht Berlin (Charlottenburg)",
      "registernummer": "HRB 83447",
      "registerart": "HRB",
      "company_name": "Simmerl Development delta GmbH",
      "company_seat": "Berlin",
      "details": "04.12.2025 (Bekanntmachungsdatum)\n\nBerlin Amtsgericht Berlin (Charlottenburg) HRB 83447\nLöschungsankündigung\n\nSimmerl Development delta GmbH\nGesellschaft mit beschränkter Haftung\nBerlin\n\nBei der nachstehenden Gesellschaft wird das Amtslöschungsverfahren gemäß § 394 FamFG eingeleitet. Widerspruchsfrist 6 Wochen"
    },
    {
      "date": "2025-12-04",
      "id": "139118",
      "original_text": "Löschungsankündigung\nSchleswig-Holstein Amtsgericht Pinneberg HRB 12077\nküchenfit GmbH – Wedel",
      "type": "Löschungsankündigung",
      "state": "Schleswig-Holstein",
      "amtsgericht": "Amtsgericht Pinneberg",
      "registernummer": "HRB 12077",
      "registerart": "HRB",
      "company_name": "küchenfit GmbH",
      "company_seat": "Wedel",
      "details": "04.12.2025 (Bekanntmachungsdatum)\n\nSchleswig-Holstein Amtsgericht Pinneberg HRB 12077\nLöschungsankündigung\n\nküchenfit GmbH\nGesellschaft mit beschränkter Haftung\nWedel\n\nEs ist die Löschung der nachstehenden Gesellschaft wegen Vermögenslosigkeit gemäß § 394 FamFG beabsichtigt. Widerspruchsfrist: 2 Monate."
    },
    {
      "date": "2025-12-04",
      "id": "139119",
      "original_text": "Registerbekanntmachung nach dem Umwandlungsgesetz\nBerlin Amtsgericht Berlin (Charlottenburg) HRB 222790\nKATEA Holding GmbH – Berlin",
      "type": "Registerbekanntmachung nach dem Umwandlungsgesetz",
      "state": "Berlin",
      "amtsgericht": "Amtsgericht Berlin (Charlottenburg)",
      "registernummer": "HRB 222790",
      "registerart": "HRB",
      "company_name": "KATEA Holding GmbH",
      "company_seat": "Berlin",
      "details": "04.12.2025 (Bekanntmachungsdatum)\n\nBerlin Amtsgericht Berlin (Charlottenburg) HRB 222790\nRegisterbekanntmachung nach dem Umwandlungsgesetz 03.12.2025 (Eintragungsdatum)\n\nKATEA Holding GmbH\nGesellschaft mit beschränkter Haftung\nBerlin\n\nZu Eintragungsnummer 3 vom 03.12.2025 wird als nicht eingetragen veröffentlicht: Den Gläubigern der an der Verschmelzung beteiligten Rechtsträger ist, wenn sie binnen sechs Monaten nach dem Tag, an dem die Eintragung der Verschmelzung in das Register des Sitzes desjenigen Rechtsträgers, dessen Gläubiger sie sind, als bekannt gemacht gilt, ihren Anspruch nach Grund und Höhe schriftlich anmelden, Sicherheit zu leisten, soweit sie nicht Befriedigung verlangen können. Dieses Recht steht den Gläubigern jedoch nur zu, wenn sie glaubhaft machen, dass durch die Verschmelzung die Erfüllung ihrer Forderung gefährdet wird. Das Recht, Sicherheitsleistung zu verlangen, steht Gläubigern nicht zu, die im Falle der Insolvenz ein Recht auf vorzugsweise Befriedigung aus einer Deckungsmasse haben, die nach gesetzlicher Vorschrift zu ihrem Schutz errichtet und staatlich überwacht ist."
    },
    {
      "date": "2025-12-04",
      "id": "139120",
      "original_text": "Registerbekanntmachung nach dem Umwandlungsgesetz\nBerlin Amtsgericht Berlin (Charlottenburg) HRB 222790\nKATEA Holding GmbH – Berlin",
      "type": "Registerbekanntmachung nach dem Umwandlungsgesetz",
      "state": "Berlin",
      "amtsgericht": "Amtsgericht Berlin (Charlottenburg)",
      "registernummer": "HRB 222790",
      "registerart": "HRB",
      "company_name": "KATEA Holding GmbH",
      "company_seat": "Berlin",
      "details": "04.12.2025 (Bekanntmachungsdatum)\n\nBerlin Amtsgericht Berlin (Charlottenburg) HRB 222790\nRegisterbekanntmachung nach dem Umwandlungsgesetz 03.12.2025 (Eintragungsdatum)\n\nKATEA Holding GmbH\nGesellschaft mit beschränkter Haftung\nBerlin\n\nZu Eintragungsnummer 4 vom 03.12.2025 wird als nicht eingetragen veröffentlicht: Den Gläubigern der an der Verschmelzung beteiligten Rechtsträger ist, wenn sie binnen sechs Monaten nach dem Tag, an dem die Eintragung der Verschmelzung in das Register des Sitzes desjenigen Rechtsträgers, dessen Gläubiger sie sind, als bekannt gemacht gilt, ihren Anspruch nach Grund und Höhe schriftlich anmelden, Sicherheit zu leisten, soweit sie nicht Befriedigung verlangen können. Dieses Recht steht den Gläubigern jedoch nur zu, wenn sie glaubhaft machen, dass durch die Verschmelzung die Erfüllung ihrer Forderung gefährdet wird. Das Recht, Sicherheitsleistung zu verlangen, steht Gläubigern nicht zu, die im Falle der Insolvenz ein Recht auf vorzugsweise Befriedigung aus einer Deckungsmasse haben, die nach gesetzlicher Vorschrift zu ihrem Schutz errichtet und staatlich überwacht ist."
    },
    {
      "date": "2025-12-04",
      "id": "139121",
      "original_text": "Registerbekanntmachung nach dem Umwandlungsgesetz\nBerlin Amtsgericht Berlin (Charlottenburg) HRB 223412\nKATEA 15 Objekt GmbH – Berlin",
      "type": "Registerbekanntmachung nach dem Umwandlungsgesetz",
      "state": "Berlin",
      "amtsgericht": "Amtsgericht Berlin (Charlottenburg)",
      "registernummer": "HRB 223412",
      "registerart": "HRB",
      "company_name": "KATEA 15 Objekt GmbH",
      "company_seat": "Berlin",
      "details": "04.12.2025 (Bekanntmachungsdatum)\n\nBerlin Amtsgericht Berlin (Charlottenburg) HRB 223412\nRegisterbekanntmachung nach dem Umwandlungsgesetz 03.12.2025 (Eintragungsdatum)\n\nKATEA 15 Objekt GmbH\nGesellschaft mit beschränkter Haftung\nBerlin\n\nZu Eintragungsnummer 4 vom 03.12.2025 wird als nicht eingetragen veröffentlicht: Den Gläubigern der an der Verschmelzung beteiligten Rechtsträger ist, wenn sie binnen sechs Monaten nach dem Tag, an dem die Eintragung der Verschmelzung in das Register des Sitzes desjenigen Rechtsträgers, dessen Gläubiger sie sind, als bekannt gemacht gilt, ihren Anspruch nach Grund und Höhe schriftlich anmelden, Sicherheit zu leisten, soweit sie nicht Befriedigung verlangen können. Dieses Recht steht den Gläubigern jedoch nur zu, wenn sie glaubhaft machen, dass durch die Verschmelzung die Erfüllung ihrer Forderung gefährdet wird. Das Recht, Sicherheitsleistung zu verlangen, steht Gläubigern nicht zu, die im Falle der Insolvenz ein Recht auf vorzugsweise Befriedigung aus einer Deckungsmasse haben, die nach gesetzlicher Vorschrift zu ihrem Schutz errichtet und staatlich überwacht ist."
    },
    {
      "date": "2025-12-04",
      "id": "139122",
      "original_text": "Registerbekanntmachung nach dem Umwandlungsgesetz\nBaden-Württemberg Amtsgericht Stuttgart HRB 801978\nDr. Stefan Hövel Vermögensverwaltung GmbH – Stuttgart",
      "type": "Registerbekanntmachung nach dem Umwandlungsgesetz",
      "state": "Baden-Württemberg",
      "amtsgericht": "Amtsgericht Stuttgart",
      "registernummer": "HRB 801978",
      "registerart": "HRB",
      "company_name": "Dr. Stefan Hövel Vermögensverwaltung GmbH",
      "company_seat": "Stuttgart",
      "details": "04.12.2025 (Bekanntmachungsdatum)\n\nBaden-Württemberg Amtsgericht Stuttgart HRB 801978\nRegisterbekanntmachung nach dem Umwandlungsgesetz 04.12.2025 (Eintragungsdatum)\n\nDr. Stefan Hövel Vermögensverwaltung GmbH\nGesellschaft mit beschränkter Haftung\nStuttgart\n\nAls nicht eingetragen wird bekanntgemacht:\nDen Gläubigern der an der Verschmelzung beteiligten Rechtsträger ist, wenn sie binnen sechs Monaten nach dem Tag, an dem die Eintragung der Verschmelzung in das Register des Sitzes desjenigen Rechtsträgers, dessen Gläubiger sie sind, nach § 19 Abs. 3 UmwG als bekanntgemacht gilt, ihren Anspruch nach Grund und Höhe schriftlich anmelden, Sicherheit zu leisten, soweit sie nicht Befriedigung verlangen können. Dieses Recht steht den Gläubigern jedoch nur zu, wenn sie glaubhaft machen, dass durch die Verschmelzung die Erfüllung ihrer Forderung gefährdet wird."
    },
    {
      "date": "2025-12-04",
      "id": "139123",
      "original_text": "Löschungsankündigung\nBerlin Amtsgericht Berlin (Charlottenburg) HRB 88691\nPHYSICS - Verwaltungs GmbH – Berlin",
      "type": "Löschungsankündigung",
      "state": "Berlin",
      "amtsgericht": "Amtsgericht Berlin (Charlottenburg)",
      "registernummer": "HRB 88691",
      "registerart": "HRB",
      "company_name": "PHYSICS - Verwaltungs GmbH",
      "company_seat": "Berlin",
      "details": "04.12.2025 (Bekanntmachungsdatum)\n\nBerlin Amtsgericht Berlin (Charlottenburg) HRB 88691\nLöschungsankündigung\n\nPHYSICS - Verwaltungs GmbH\nGesellschaft mit beschränkter Haftung\nBerlin\n\nBei der nachstehenden Gesellschaft wird das Amtslöschungsverfahren gemäß § 394 FamFG eingeleitet. Widerspruchsfrist 6 Wochen"
    },
    {
      "date": "2025-12-04",
      "id": "139124",
      "original_text": "Löschungsankündigung\nBerlin Amtsgericht Berlin (Charlottenburg) HRB 229689\nProton K 5 Bauprojekte GmbH – Berlin",
      "type": "Löschungsankündigung",
      "state": "Berlin",
      "amtsgericht": "Amtsgericht Berlin (Charlottenburg)",
      "registernummer": "HRB 229689",
      "registerart": "HRB",
      "company_name": "Proton K 5 Bauprojekte GmbH",
      "company_seat": "Berlin",
      "details": "04.12.2025 (Bekanntmachungsdatum)\n\nBerlin Amtsgericht Berlin (Charlottenburg) HRB 229689\nLöschungsankündigung\n\nProton K 5 Bauprojekte GmbH\nGesellschaft mit beschränkter Haftung\nBerlin\n\nBei der nachstehenden Gesellschaft wird das Amtslöschungsverfahren gemäß § 394 FamFG eingeleitet. Widerspruchsfrist 6 Wochen"
    },
    {
      "date": "2025-12-04",
      "id": "139125",
      "original_text": "Einreichung neuer Dokumente\nBrandenburg Amtsgericht Neuruppin HRB 1683\nStadtwerke Velten GmbH – Velten",
      "type": "Einreichung neuer Dokumente",
      "state": "Brandenburg",
      "amtsgericht": "Amtsgericht Neuruppin",
      "registernummer": "HRB 1683",
      "registerart": "HRB",
      "company_name": "Stadtwerke Velten GmbH",
      "company_seat": "Velten",
      "details": "04.12.2025 (Bekanntmachungsdatum)\n\nBrandenburg Amtsgericht Neuruppin HRB 1683\nEinreichung neuer Dokumente\n\nStadtwerke Velten GmbH\nGesellschaft mit beschränkter Haftung\nVelten\n\nAls nicht eingetragen wird veröffentlicht: Eine Liste der Mitglieder des Aufsichtsrates wurde zum Handelsregister eingereicht."
    },
    {
      "date": "2025-12-04",
      "id": "139126",
      "original_text": "Löschungsankündigung\nThüringen Amtsgericht Jena HRB 510279\nObermeier Ladenbau GmbH – Altenburg",
      "type": "Löschungsankündigung",
      "state": "Thüringen",
      "amtsgericht": "Amtsgericht Jena",
      "registernummer": "HRB 510279",
      "registerart": "HRB",
      "company_name": "Obermeier Ladenbau GmbH",
      "company_seat": "Altenburg",
      "details": "04.12.2025 (Bekanntmachungsdatum)\n\nThüringen Amtsgericht Jena HRB 510279\nLöschungsankündigung 03.12.2025 (Eintragungsdatum)\n\nObermeier Ladenbau GmbH\nGesellschaft mit beschränkter Haftung\nAltenburg\n\nDie Gesellschaft ist wegen Vermögenslosigkeit gemäß § 394 FamFG gelöscht. Von Amts wegen eingetragen."
    },
    {
      "date": "2025-12-04",
      "id": "139127",
      "original_text": "Löschungsankündigung\nThüringen Amtsgericht Jena HRB 507689\nJoklklug GmbH – Jena",
      "type": "Löschungsankündigung",
      "state": "Thüringen",
      "amtsgericht": "Amtsgericht Jena",
      "registernummer": "HRB 507689",
      "registerart": "HRB",
      "company_name": "Joklklug GmbH",
      "company_seat": "Jena",
      "details": "04.12.2025 (Bekanntmachungsdatum)\n\nThüringen Amtsgericht Jena HRB 507689\nLöschungsankündigung\n\nJoklklug GmbH\nGesellschaft mit beschränkter Haftung\nJena\n\nNicht eingetragen: Bekanntmachungsblatt ist nunmehr der elektronische Bundesanzeiger.Die Gesellschaft ist wegen Vermögenslosigkeit gemäß § 394 FamFG gelöscht. Von Amts wegen eingetragen."
    },
    {
      "date": "2025-12-04",
      "id": "139128",
      "original_text": "Registerbekanntmachung nach dem Umwandlungsgesetz\nHamburg Amtsgericht Hamburg HRB 71098\nEssenceMediacom Hamburg GmbH – Hamburg",
      "type": "Registerbekanntmachung nach dem Umwandlungsgesetz",
      "state": "Hamburg",
      "amtsgericht": "Amtsgericht Hamburg",
      "registernummer": "HRB 71098",
      "registerart": "HRB",
      "company_name": "EssenceMediacom Hamburg GmbH",
      "company_seat": "Hamburg",
      "details": "04.12.2025 (Bekanntmachungsdatum)\n\nHamburg Amtsgericht Hamburg HRB 71098\nRegisterbekanntmachung nach dem Umwandlungsgesetz 04.12.2025 (Eintragungsdatum)\n\nEssenceMediacom Hamburg GmbH\nGesellschaft mit beschränkter Haftung\nHamburg\n\nAls nicht eingetragen wird bekannt gemacht:\nDen Gläubigern der an der Verschmelzung beteiligten Gesellschaften ist, wenn sie binnen sechs Monaten nach dem Tag, an dem die Eintragung der Verschmelzung in das Register des Sitzes desjenigen Rechtsträgers, dessen Gläubiger sie sind, nach § 19 Absatz 3 UmwG als bekannt gemacht gilt, ihren Anspruch nach Grund und Höhe schriftlich anmelden, Sicherheit zu leisten, soweit sie nicht Befriedigung verlangen können. Dieses Recht steht den Gläubigern jedoch nur zu, wenn sie glaubhaft machen, dass durch die Verschmelzung die Erfüllung ihrer Forderung gefährdet wird."
    },
    {
      "date": "2025-12-04",
      "id": "139129",
      "original_text": "Sonstige Registerbekanntmachung\nHamburg Amtsgericht Hamburg HRB 71098\nEssenceMediacom Hamburg GmbH – Hamburg",
      "type": "Sonstige Registerbekanntmachung",
      "state": "Hamburg",
      "amtsgericht": "Amtsgericht Hamburg",
      "registernummer": "HRB 71098",
      "registerart": "HRB",
      "company_name": "EssenceMediacom Hamburg GmbH",
      "company_seat": "Hamburg",
      "details": "04.12.2025 (Bekanntmachungsdatum)\n\nHamburg Amtsgericht Hamburg HRB 71098\nSonstige Registerbekanntmachung 04.12.2025 (Eintragungsdatum)\n\nEssenceMediacom Hamburg GmbH\nGesellschaft mit beschränkter Haftung\nHamburg\n\nAls nicht eingetragen wird bekannt gemacht:  Den Gläubigern der Gesellschaft, deren Forderungen begründet worden sind, bevor die Eintragung der Vertragsbeendigung in das Handelsregister nach § 10 HGB als bekannt gemacht gilt, ist vom anderen Vertragsteil Sicherheit zu leisten, wenn sie sich binnen 6 Monaten nach Bekanntmachung der Eintragung zu diesem Zweck bei ihm melden."
    },
    {
      "date": "2025-12-04",
      "id": "139130",
      "original_text": "Registerbekanntmachung nach dem Umwandlungsgesetz\nSchleswig-Holstein Amtsgericht Lübeck HRB 792\nGrothe Bau GmbH – Lübeck",
      "type": "Registerbekanntmachung nach dem Umwandlungsgesetz",
      "state": "Schleswig-Holstein",
      "amtsgericht": "Amtsgericht Lübeck",
      "registernummer": "HRB 792",
      "registerart": "HRB",
      "company_name": "Grothe Bau GmbH",
      "company_seat": "Lübeck",
      "details": "04.12.2025 (Bekanntmachungsdatum)\n\nSchleswig-Holstein Amtsgericht Lübeck HRB 792\nRegisterbekanntmachung nach dem Umwandlungsgesetz 03.12.2025 (Eintragungsdatum)\n\nGrothe Bau GmbH\nGesellschaft mit beschränkter Haftung\nLübeck\n\nZu Eintragungsnummer 15 vom 03.12.2025 wird als nicht eingetragen veröffentlicht:  Den Gläubigern der an der Verschmelzung beteiligten Rechtsträger ist, wenn sie binnen sechs Monaten nach dem Tag, an dem die Eintragung der Verschmelzung in das Register des Sitzes desjenigen Rechtsträgers, dessen Gläubiger sie sind, als bekannt gemacht gilt, ihren Anspruch nach Grund und Höhe schriftlich anmelden, Sicherheit zu leisten, soweit sie nicht Befriedigung verlangen können. Dieses Recht steht den Gläubigern jedoch nur zu, wenn sie glaubhaft machen, dass durch die Verschmelzung die Erfüllung ihrer Forderung gefährdet wird."
    },
    {
      "date": "2025-12-04",
      "id": "139131",
      "original_text": "Registerbekanntmachung nach dem Umwandlungsgesetz\nBerlin Amtsgericht Berlin (Charlottenburg) HRB 229191\nKATEA 18 Objekt GmbH – Berlin",
      "type": "Registerbekanntmachung nach dem Umwandlungsgesetz",
      "state": "Berlin",
      "amtsgericht": "Amtsgericht Berlin (Charlottenburg)",
      "registernummer": "HRB 229191",
      "registerart": "HRB",
      "company_name": "KATEA 18 Objekt GmbH",
      "company_seat": "Berlin",
      "details": "04.12.2025 (Bekanntmachungsdatum)\n\nBerlin Amtsgericht Berlin (Charlottenburg) HRB 229191\nRegisterbekanntmachung nach dem Umwandlungsgesetz 03.12.2025 (Eintragungsdatum)\n\nKATEA 18 Objekt GmbH\nGesellschaft mit beschränkter Haftung\nBerlin\n\nZu Eintragungsnummer 2 vom 03.12.2025 wird als nicht eingetragen veröffentlicht: Den Gläubigern der an der Verschmelzung beteiligten Rechtsträger ist, wenn sie binnen sechs Monaten nach dem Tag, an dem die Eintragung der Verschmelzung in das Register des Sitzes desjenigen Rechtsträgers, dessen Gläubiger sie sind, als bekannt gemacht gilt, ihren Anspruch nach Grund und Höhe schriftlich anmelden, Sicherheit zu leisten, soweit sie nicht Befriedigung verlangen können. Dieses Recht steht den Gläubigern jedoch nur zu, wenn sie glaubhaft machen, dass durch die Verschmelzung die Erfüllung ihrer Forderung gefährdet wird. Das Recht, Sicherheitsleistung zu verlangen, steht Gläubigern nicht zu, die im Falle der Insolvenz ein Recht auf vorzugsweise Befriedigung aus einer Deckungsmasse haben, die nach gesetzlicher Vorschrift zu ihrem Schutz errichtet und staatlich überwacht ist."
    },
    {
      "date": "2025-12-04",
      "id": "139132",
      "original_text": "Registerbekanntmachung nach dem Umwandlungsgesetz\nBerlin Amtsgericht Berlin (Charlottenburg) HRB 281799\nAlte Feuerwache Berlin-Hohenschönhausen gGmbH – Berlin",
      "type": "Registerbekanntmachung nach dem Umwandlungsgesetz",
      "state": "Berlin",
      "amtsgericht": "Amtsgericht Berlin (Charlottenburg)",
      "registernummer": "HRB 281799",
      "registerart": "HRB",
      "company_name": "Alte Feuerwache Berlin-Hohenschönhausen gGmbH",
      "company_seat": "Berlin",
      "details": "04.12.2025 (Bekanntmachungsdatum)\n\nBerlin Amtsgericht Berlin (Charlottenburg) HRB 281799\nRegisterbekanntmachung nach dem Umwandlungsgesetz 02.12.2025 (Eintragungsdatum)\n\nAlte Feuerwache Berlin-Hohenschönhausen gGmbH\nGesellschaft mit beschränkter Haftung\nBerlin\n\nZu Eintragungsnummer 1 vom 02.12.2025 wird als nicht eingetragen veröffentlicht: Den Gläubigern ist, wenn sie binnen sechs Monaten nach dem Tag, an dem die Eintragung der Umwandlung als bekannt gemacht gilt, ihren Anspruch nach Grund und Höhe schriftlich anmelden, Sicherheit zu leisten, soweit sie nicht Befriedigung verlangen können. Dieses Recht steht den Gläubigern jedoch nur zu, wenn sie glaubhaft machen, dass durch die Umwandlung die Erfüllung ihrer Forderung gefährdet wird. Das Recht, Sicherheitsleistung zu verlangen, steht Gläubigern nicht zu, die im Falle der Insolvenz ein Recht auf vorzugsweise Befriedigung aus einer Deckungsmasse haben, die nach gesetzlicher Vorschrift zu ihrem Schutz errichtet und staatlich überwacht ist."
    },
    {
      "date": "2025-12-04",
      "id": "139133",
      "original_text": "Registerbekanntmachung nach dem Umwandlungsgesetz\nBaden-Württemberg Amtsgericht Mannheim HRB 756534\nwirkaufenihrenabfall.de GmbH – Pforzheim",
      "type": "Registerbekanntmachung nach dem Umwandlungsgesetz",
      "state": "Baden-Württemberg",
      "amtsgericht": "Amtsgericht Mannheim",
      "registernummer": "HRB 756534",
      "registerart": "HRB",
      "company_name": "wirkaufenihrenabfall.de GmbH",
      "company_seat": "Pforzheim",
      "details": "04.12.2025 (Bekanntmachungsdatum)\n\nBaden-Württemberg Amtsgericht Mannheim HRB 756534\nRegisterbekanntmachung nach dem Umwandlungsgesetz 04.12.2025 (Eintragungsdatum)\n\nwirkaufenihrenabfall.de GmbH\nGesellschaft mit beschränkter Haftung\nPforzheim\n\nAls nicht eingetragen wird bekanntgemacht:\nDen Gläubigern des an dem Formwechsel beteiligten Rechtsträgers ist, wenn sie binnen sechs Monaten nach dem Tag, an dem die Eintragung des Formwechsels in das Register des Sitzes desjenigen Rechtsträgers, dessen Gläubiger sie sind, nach § 19 Abs. 3 UmwG als bekanntgemacht gilt, ihren Anspruch nach Grund und Höhe schriftlich anmelden, Sicherheit zu leisten, soweit sie nicht Befriedigung verlangen können. Dieses Recht steht den Gläubigern jedoch nur zu, wenn sie glaubhaft machen, dass durch den Formwechsel die Erfüllung ihrer Forderung gefährdet wird."
    },
    {
      "date": "2025-12-04",
      "id": "139134",
      "original_text": "Registerbekanntmachung nach dem Umwandlungsgesetz\nBaden-Württemberg Amtsgericht Mannheim HRA 708851\nwirkaufenihrenabfall.de GmbH & Co. KG – Pforzheim",
      "type": "Registerbekanntmachung nach dem Umwandlungsgesetz",
      "state": "Baden-Württemberg",
      "amtsgericht": "Amtsgericht Mannheim",
      "registernummer": "HRA 708851",
      "registerart": "HRA",
      "company_name": "wirkaufenihrenabfall.de GmbH & Co. KG",
      "company_seat": "Pforzheim",
      "details": "04.12.2025 (Bekanntmachungsdatum)\n\nBaden-Württemberg Amtsgericht Mannheim HRA 708851\nRegisterbekanntmachung nach dem Umwandlungsgesetz 04.12.2025 (Eintragungsdatum)\n\nwirkaufenihrenabfall.de GmbH & Co. KG\nKommanditgesellschaft\nPforzheim\n\nAls nicht eingetragen wird bekanntgemacht:\nDen Gläubigern des an dem Formwechsel beteiligten Rechtsträgers ist, wenn sie binnen sechs Monaten nach dem Tag, an dem die Eintragung des Formwechsels in das Register des Sitzes desjenigen Rechtsträgers, dessen Gläubiger sie sind, nach § 19 Abs. 3 UmwG als bekanntgemacht gilt, ihren Anspruch nach Grund und Höhe schriftlich anmelden, Sicherheit zu leisten, soweit sie nicht Befriedigung verlangen können. Dieses Recht steht den Gläubigern jedoch nur zu, wenn sie glaubhaft machen, dass durch den Formwechsel die Erfüllung ihrer Forderung gefährdet wird."
    },
    {
      "date": "2025-12-04",
      "id": "139135",
      "original_text": "Löschungsankündigung\nBerlin Amtsgericht Berlin (Charlottenburg) HRB 114424\nBest of the Rest GmbH – Berlin",
      "type": "Löschungsankündigung",
      "state": "Berlin",
      "amtsgericht": "Amtsgericht Berlin (Charlottenburg)",
      "registernummer": "HRB 114424",
      "registerart": "HRB",
      "company_name": "Best of the Rest GmbH",
      "company_seat": "Berlin",
      "details": "04.12.2025 (Bekanntmachungsdatum)\n\nBerlin Amtsgericht Berlin (Charlottenburg) HRB 114424\nLöschungsankündigung\n\nBest of the Rest GmbH\nGesellschaft mit beschränkter Haftung\nBerlin\n\nBei der nachstehenden Gesellschaft wird das Amtslöschungsverfahren gemäß § 394 FamFG eingeleitet. Widerspruchsfrist\n6 Wochen."
    },
    {
      "date": "2025-12-04",
      "id": "139136",
      "original_text": "Löschungsankündigung\nBerlin Amtsgericht Berlin (Charlottenburg) HRB 117278\nG3S Bau- & Projektplanung Unternehmergesellschaft (haftungsbeschränkt) – Berlin",
      "type": "Löschungsankündigung",
      "state": "Berlin",
      "amtsgericht": "Amtsgericht Berlin (Charlottenburg)",
      "registernummer": "HRB 117278",
      "registerart": "HRB",
      "company_name": "G3S Bau- & Projektplanung Unternehmergesellschaft (haftungsbeschränkt)",
      "company_seat": "Berlin",
      "details": "04.12.2025 (Bekanntmachungsdatum)\n\nBerlin Amtsgericht Berlin (Charlottenburg) HRB 117278\nLöschungsankündigung\n\nG3S Bau- & Projektplanung Unternehmergesellschaft (haftungsbeschränkt)\nGesellschaft mit beschränkter Haftung\nBerlin\n\nBei der nachstehenden Gesellschaft wird das Amtslöschungsverfahren gemäß § 394 FamFG eingeleitet. Widerspruchsfrist 6 Wochen"
    },
    {
      "date": "2025-12-04",
      "id": "139137",
      "original_text": "Registerbekanntmachung nach dem Umwandlungsgesetz\nBerlin Amtsgericht Berlin (Charlottenburg) HRB 281008\nTicket B GmbH – Berlin",
      "type": "Registerbekanntmachung nach dem Umwandlungsgesetz",
      "state": "Berlin",
      "amtsgericht": "Amtsgericht Berlin (Charlottenburg)",
      "registernummer": "HRB 281008",
      "registerart": "HRB",
      "company_name": "Ticket B GmbH",
      "company_seat": "Berlin",
      "details": "04.12.2025 (Bekanntmachungsdatum)\n\nBerlin Amtsgericht Berlin (Charlottenburg) HRB 281008\nRegisterbekanntmachung nach dem Umwandlungsgesetz 02.12.2025 (Eintragungsdatum)\n\nTicket B GmbH\nGesellschaft mit beschränkter Haftung\nBerlin\n\nZu Eintragungsnummer 2 vom 02.12.2025 wird als nicht eingetragen veröffentlicht: Den Gläubigern der an der Spaltung beteiligten Rechtsträger ist, wenn sie binnen sechs Monaten nach dem Tag, an dem die Eintragung der Spaltung in das Register des Sitzes desjenigen Rechtsträgers, dessen Gläubiger sie sind, als bekannt gemacht gilt, ihren Anspruch nach Grund und Höhe schriftlich anmelden, Sicherheit zu leisten, soweit sie nicht Befriedigung verlangen können. Dieses Recht steht den Gläubigern jedoch nur zu, wenn sie glaubhaft machen, dass durch die Spaltung die Erfüllung ihrer Forderung gefährdet wird. Das Recht, Sicherheitsleistung zu verlangen, steht Gläubigern nicht zu, die im Falle der Insolvenz ein Recht auf vorzugsweise Befriedigung aus einer Deckungsmasse haben, die nach gesetzlicher Vorschrift zu ihrem Schutz errichtet und staatlich überwacht ist."
    },
    {
      "date": "2025-12-04",
      "id": "139138",
      "original_text": "Löschungsankündigung\nSaarland Amtsgericht Saarbrücken HRB 103616\nDigital Media Transformers UG (haftungsbeschränkt) – Neunkirchen",
      "type": "Löschungsankündigung",
      "state": "Saarland",
      "amtsgericht": "Amtsgericht Saarbrücken",
      "registernummer": "HRB 103616",
      "registerart": "HRB",
      "company_name": "Digital Media Transformers UG (haftungsbeschränkt)",
      "company_seat": "Neunkirchen",
      "details": "04.12.2025 (Bekanntmachungsdatum)\n\nSaarland Amtsgericht Saarbrücken HRB 103616\nLöschungsankündigung\n\nDigital Media Transformers UG (haftungsbeschränkt)\nGesellschaft mit beschränkter Haftung\nNeunkirchen\n\nEs ist beabsichtigt, die Gesellschaft von Amts wegen gemäß § 394 FamFG wegen Vermögenslosigkeit zu löschen.\nGegen die Löschung von Amts wegen ist das Rechtsmittel des Widerspruchs statthaft. Der Widerspruch ist binnen einer Frist zwei Monaten beginnend mit dem Tag dieser Veröffentlichung durch Einreichen eines Widerspruchsschreibens -schriftlich oder zur Niederschrift der Geschäftsstelle beim Amtsgericht Saarbrücken, -zentrales Handelsregister-, Mainzer Str.178, 66121 Saarbrücken einzulegen.\nDer Widerspruch muss die Bezeichnung der angefochtenen Löschungsankündigung enthalten sowie die Erklärung, dass Widerspruch eingelegt wird. Er ist vom Widerspruchsführer oder seinem Bevollmächtigten zu unterzeichnen.\nDas Widerspruchsschreiben kann auch in der Form eines elektronischen Dokumentes eingereicht werden, das mit einer qualifizierten elektronischen Signatur nach dem Signaturgesetz versehen sein muss (§§ 14 Abs. 2 FamFG, 130a, 298 ZPO)."
    },
    {
      "date": "2025-12-04",
      "id": "139139",
      "original_text": "Registerbekanntmachung nach dem Umwandlungsgesetz\nBrandenburg Amtsgericht Potsdam HRB 19312\nDT Digitaltechnik GmbH Leitstellen & Systemtechnik – Blankenfelde-Mahlow",
      "type": "Registerbekanntmachung nach dem Umwandlungsgesetz",
      "state": "Brandenburg",
      "amtsgericht": "Amtsgericht Potsdam",
      "registernummer": "HRB 19312",
      "registerart": "HRB",
      "company_name": "DT Digitaltechnik GmbH Leitstellen & Systemtechnik",
      "company_seat": "Blankenfelde-Mahlow",
      "details": "04.12.2025 (Bekanntmachungsdatum)\n\nBrandenburg Amtsgericht Potsdam HRB 19312\nRegisterbekanntmachung nach dem Umwandlungsgesetz 02.12.2025 (Eintragungsdatum)\n\nDT Digitaltechnik GmbH Leitstellen & Systemtechnik\nGesellschaft mit beschränkter Haftung\nBlankenfelde-Mahlow\n\nZu Eintragungsnummer 6 vom 02.12.2025 wird als nicht eingetragen veröffentlicht: Den Gläubigern der an der Verschmelzung beteiligten Rechtsträger ist, wenn sie binnen sechs Monaten nach dem Tag, an dem die Eintragung der Verschmelzung in das Register des Sitzes desjenigen Rechtsträgers, dessen Gläubiger sie sind, als bekannt gemacht gilt, ihren Anspruch nach Grund und Höhe schriftlich anmelden, Sicherheit zu leisten, soweit sie nicht Befriedigung verlangen können. Dieses Recht steht den Gläubigern jedoch nur zu, wenn sie glaubhaft machen, dass durch die Verschmelzung die Erfüllung ihrer Forderung gefährdet wird."
    },
    {
      "date": "2025-12-04",
      "id": "139140",
      "original_text": "Einreichung neuer Dokumente\nBerlin Amtsgericht Berlin (Charlottenburg) HRB 73846\nPIK AG – Berlin",
      "type": "Einreichung neuer Dokumente",
      "state": "Berlin",
      "amtsgericht": "Amtsgericht Berlin (Charlottenburg)",
      "registernummer": "HRB 73846",
      "registerart": "HRB",
      "company_name": "PIK AG",
      "company_seat": "Berlin",
      "details": "04.12.2025 (Bekanntmachungsdatum)\n\nBerlin Amtsgericht Berlin (Charlottenburg) HRB 73846\nEinreichung neuer Dokumente\n\nPIK AG\nAktiengesellschaft\nBerlin\n\nAls nicht eingetragen wird veröffentlicht:\nEs wurde eine neue Liste der Aufsichtsratsmitglieder eingereicht (§ 106 AktG)."
    },
    {
      "date": "2025-12-04",
      "id": "139141",
      "original_text": "Registerbekanntmachung nach dem Umwandlungsgesetz\nHamburg Amtsgericht Hamburg HRB 160062\nTruck Center Uhl GmbH – Hamburg",
      "type": "Registerbekanntmachung nach dem Umwandlungsgesetz",
      "state": "Hamburg",
      "amtsgericht": "Amtsgericht Hamburg",
      "registernummer": "HRB 160062",
      "registerart": "HRB",
      "company_name": "Truck Center Uhl GmbH",
      "company_seat": "Hamburg",
      "details": "04.12.2025 (Bekanntmachungsdatum)\n\nHamburg Amtsgericht Hamburg HRB 160062\nRegisterbekanntmachung nach dem Umwandlungsgesetz 04.12.2025 (Eintragungsdatum)\n\nTruck Center Uhl GmbH\nGesellschaft mit beschränkter Haftung\nHamburg\n\nAls nicht eingetragen wird bekannt gemacht:\nDen Gläubigern der an der Verschmelzung beteiligten Gesellschaften ist, wenn sie binnen sechs Monaten nach dem Tag, an dem die Eintragung der Verschmelzung in das Register des Sitzes desjenigen Rechtsträgers, dessen Gläubiger sie sind, nach § 19 Absatz 3 UmwG als bekannt gemacht gilt, ihren Anspruch nach Grund und Höhe schriftlich anmelden, Sicherheit zu leisten, soweit sie nicht Befriedigung verlangen können. Dieses Recht steht den Gläubigern jedoch nur zu, wenn sie glaubhaft machen, dass durch die Verschmelzung die Erfüllung ihrer Forderung gefährdet wird."
    },
    {
      "date": "2025-12-04",
      "id": "139142",
      "original_text": "Einreichung neuer Dokumente\nBaden-Württemberg Amtsgericht Ulm HRB 722408\nLebenshilfe für Menschen mit Behinderung Ostalb gemeinnützige GmbH – Aalen",
      "type": "Einreichung neuer Dokumente",
      "state": "Baden-Württemberg",
      "amtsgericht": "Amtsgericht Ulm",
      "registernummer": "HRB 722408",
      "registerart": "HRB",
      "company_name": "Lebenshilfe für Menschen mit Behinderung Ostalb gemeinnützige GmbH",
      "company_seat": "Aalen",
      "details": "04.12.2025 (Bekanntmachungsdatum)\n\nBaden-Württemberg Amtsgericht Ulm HRB 722408\nEinreichung neuer Dokumente\n\nLebenshilfe für Menschen mit Behinderung Ostalb gemeinnützige GmbH\nGesellschaft mit beschränkter Haftung\nAalen\n\nDie Gesellschaft hat am 04.12.2025 die Liste über die Zusammensetzung des Aufsichtsrats zum Handelsregister eingereicht."
    },
    {
      "date": "2025-12-04",
      "id": "139143",
      "original_text": "Löschungsankündigung\nBaden-Württemberg Amtsgericht Ulm HRB 730649\nNebel Factory GmbH – Ulm",
      "type": "Löschungsankündigung",
      "state": "Baden-Württemberg",
      "amtsgericht": "Amtsgericht Ulm",
      "registernummer": "HRB 730649",
      "registerart": "HRB",
      "company_name": "Nebel Factory GmbH",
      "company_seat": "Ulm",
      "details": "04.12.2025 (Bekanntmachungsdatum)\n\nBaden-Württemberg Amtsgericht Ulm HRB 730649\nLöschungsankündigung\n\nNebel Factory GmbH\nGesellschaft mit beschränkter Haftung\nUlm\n\nDas Gericht beabsichtigt, die Gesellschaft wegen Vermögenslosigkeit im Handelsregister von Amts wegen nach § 394 FamFG zu löschen. Die Frist zur Geltendmachung eines Widerspruchs gegen die beabsichtigte Löschung ist auf  einen Monat ab Veröffentlichung bestimmt."
    },
    {
      "date": "2025-12-04",
      "id": "139144",
      "original_text": "Löschungsankündigung\nBrandenburg Amtsgericht Potsdam HRB 30862\nIFAG-Hausverwaltung & Immobilienmanagement GmbH – Blankenfelde-Mahlow",
      "type": "Löschungsankündigung",
      "state": "Brandenburg",
      "amtsgericht": "Amtsgericht Potsdam",
      "registernummer": "HRB 30862",
      "registerart": "HRB",
      "company_name": "IFAG-Hausverwaltung & Immobilienmanagement GmbH",
      "company_seat": "Blankenfelde-Mahlow",
      "details": "04.12.2025 (Bekanntmachungsdatum)\n\nBrandenburg Amtsgericht Potsdam HRB 30862\nLöschungsankündigung\n\nIFAG-Hausverwaltung & Immobilienmanagement GmbH\nGesellschaft mit beschränkter Haftung\nBlankenfelde-Mahlow\n\nBei der nachstehenden Gesellschaft wird das Amtslöschungsverfahren gemäß § 394 FamFG eingeleitet. Widerspruchsfrist: 8 Wochen"
    },
    {
      "date": "2025-12-04",
      "id": "139145",
      "original_text": "Sonstige Registerbekanntmachung\nMecklenburg-Vorpommern Amtsgericht Rostock VR 2126\nsignedROCK e.V. – Rostock",
      "type": "Sonstige Registerbekanntmachung",
      "state": "Mecklenburg-Vorpommern",
      "amtsgericht": "Amtsgericht Rostock",
      "registernummer": "VR 2126",
      "registerart": "VR",
      "company_name": "signedROCK e.V.",
      "company_seat": "Rostock",
      "details": "04.12.2025 (Bekanntmachungsdatum)\n\nMecklenburg-Vorpommern Amtsgericht Rostock VR 2126\nSonstige Registerbekanntmachung\n\nsignedROCK e.V.\neingetragener Verein\nRostock\n\nDas Registergericht beabsichtigt, den im Vereinsregister eingetragenen Verein von Amts wegen nach § 394 FamFG zu löschen. Die Frist zur Erhebung eines Widerspruchs gegen die beabsichtigte Löschung wird auf drei Monate festgesetzt."
    },
    {
      "date": "2025-12-04",
      "id": "139146",
      "original_text": "Löschungsankündigung\nBerlin Amtsgericht Berlin (Charlottenburg) HRA 52157\n11. Premium City-Bauprojektgesellschaft mbH & Co. KG – Berlin",
      "type": "Löschungsankündigung",
      "state": "Berlin",
      "amtsgericht": "Amtsgericht Berlin (Charlottenburg)",
      "registernummer": "HRA 52157",
      "registerart": "HRA",
      "company_name": "11. Premium City-Bauprojektgesellschaft mbH & Co. KG",
      "company_seat": "Berlin",
      "details": "04.12.2025 (Bekanntmachungsdatum)\n\nBerlin Amtsgericht Berlin (Charlottenburg) HRA 52157\nLöschungsankündigung\n\n11. Premium City-Bauprojektgesellschaft mbH & Co. KG\nKommanditgesellschaft\nBerlin\n\nBei dem nachstehenden Unternehmen / der nachstehenden Gesellschaft wird das Amtslöschungsverfahren gemäß § 31 Abs. 2 HGB eingeleitet. Widerspruchsfrist 2 Monate"
    },
    {
      "date": "2025-12-04",
      "id": "139147",
      "original_text": "Einreichung neuer Dokumente\nHamburg Amtsgericht Hamburg HRB 184303\nSTERNPARTNER Management SE – Hamburg",
      "type": "Einreichung neuer Dokumente",
      "state": "Hamburg",
      "amtsgericht": "Amtsgericht Hamburg",
      "registernummer": "HRB 184303",
      "registerart": "HRB",
      "company_name": "STERNPARTNER Management SE",
      "company_seat": "Hamburg",
      "details": "04.12.2025 (Bekanntmachungsdatum)\n\nHamburg Amtsgericht Hamburg HRB 184303\nEinreichung neuer Dokumente 04.12.2025 (Eintragungsdatum)\n\nSTERNPARTNER Management SE\nEuropäische Aktiengesellschaft (SE)\nHamburg\n\nAls nicht eingetragen wird bekannt gemacht: Liste des Aufsichtsrats wurde eingereicht."
    },
    {
      "date": "2025-12-04",
      "id": "139148",
      "original_text": "Registerbekanntmachung nach dem Umwandlungsgesetz\nSachsen-Anhalt Amtsgericht Stendal HRB 34390\nFamilie Schlieker Holding GmbH – Magdeburg",
      "type": "Registerbekanntmachung nach dem Umwandlungsgesetz",
      "state": "Sachsen-Anhalt",
      "amtsgericht": "Amtsgericht Stendal",
      "registernummer": "HRB 34390",
      "registerart": "HRB",
      "company_name": "Familie Schlieker Holding GmbH",
      "company_seat": "Magdeburg",
      "details": "04.12.2025 (Bekanntmachungsdatum)\n\nSachsen-Anhalt Amtsgericht Stendal HRB 34390\nRegisterbekanntmachung nach dem Umwandlungsgesetz 04.12.2025 (Eintragungsdatum)\n\nFamilie Schlieker Holding GmbH\nGesellschaft mit beschränkter Haftung\nMagdeburg\n\nNicht eingetragen:\nDen Gläubigern der an der Spaltung beteiligten Rechtsträger, ist wenn sie binnen sechs Monaten nach dem Tag, an dem die Eintragung der Spaltung nach §§ 125, 19 Abs. 3 UmwG als bekanntgemacht gilt, ihren Anspruch nach Grund und Höhe schriftlich anmelden, Sicherheit zu leisten, soweit sie nicht Befriedigung verlangen können. Dieses Recht steht ihnen jedoch nur zu, wenn sie glaubhaft machen, daß durch die Spaltung die Erfüllung ihrer Forderung gefährdet wird."
    },
    {
      "date": "2025-12-04",
      "id": "139149",
      "original_text": "Einreichung neuer Dokumente\nBaden-Württemberg Amtsgericht Stuttgart HRB 799422\nEnergie Bottwartal GmbH – Großbottwar",
      "type": "Einreichung neuer Dokumente",
      "state": "Baden-Württemberg",
      "amtsgericht": "Amtsgericht Stuttgart",
      "registernummer": "HRB 799422",
      "registerart": "HRB",
      "company_name": "Energie Bottwartal GmbH",
      "company_seat": "Großbottwar",
      "details": "04.12.2025 (Bekanntmachungsdatum)\n\nBaden-Württemberg Amtsgericht Stuttgart HRB 799422\nEinreichung neuer Dokumente\n\nEnergie Bottwartal GmbH\nGesellschaft mit beschränkter Haftung\nGroßbottwar\n\nDie Gesellschaft hat am 03.12.2025 die Liste über die Zusammensetzung des Aufsichtsrats zum Handelsregister eingereicht."
    },
    {
      "date": "2025-12-04",
      "id": "139150",
      "original_text": "Löschungsankündigung\nBrandenburg Amtsgericht Potsdam HRB 32372\nG.D. Electronic GmbH – Brandenburg an der Havel",
      "type": "Löschungsankündigung",
      "state": "Brandenburg",
      "amtsgericht": "Amtsgericht Potsdam",
      "registernummer": "HRB 32372",
      "registerart": "HRB",
      "company_name": "G.D. Electronic GmbH",
      "company_seat": "Brandenburg an der Havel",
      "details": "04.12.2025 (Bekanntmachungsdatum)\n\nBrandenburg Amtsgericht Potsdam HRB 32372\nLöschungsankündigung\n\nG.D. Electronic GmbH\nGesellschaft mit beschränkter Haftung\nBrandenburg an der Havel\n\nBei der nachstehenden Gesellschaft wird das Amtslöschungsverfahren gemäß § 394 FamFG eingeleitet. Widerspruchsfrist: 8 Wochen"
    },
    {
      "date": "2025-12-04",
      "id": "139151",
      "original_text": "Löschungsankündigung\nSachsen Amtsgericht Dresden HRB 37775\nFreie Bachata Akademie gemeinnützige UG (haftungsbeschränkt) – Vierkirchen",
      "type": "Löschungsankündigung",
      "state": "Sachsen",
      "amtsgericht": "Amtsgericht Dresden",
      "registernummer": "HRB 37775",
      "registerart": "HRB",
      "company_name": "Freie Bachata Akademie gemeinnützige UG (haftungsbeschränkt)",
      "company_seat": "Vierkirchen",
      "details": "04.12.2025 (Bekanntmachungsdatum)\n\nSachsen Amtsgericht Dresden HRB 37775\nLöschungsankündigung\n\nFreie Bachata Akademie gemeinnützige UG (haftungsbeschränkt)\nGesellschaft mit beschränkter Haftung\nVierkirchen\n\nDas Registergericht beabsichtigt, die im Handelsregister eingetragene Gesellschaft von Amts wegen nach § 394 FamFG zu löschen. Die Frist zu Erhebung eines Widerspruchs gegen die beabsichtigte Löschung wird auf einen Monat festgesetzt."
    },
    {
      "date": "2025-12-04",
      "id": "139152",
      "original_text": "Einreichung neuer Dokumente\nSachsen Amtsgericht Dresden HRB 8144\nWohnungsbau- und Wärmeversorgungsgesellschaft Neustadt i. Sa. mbH - WWGN - – Neustadt",
      "type": "Einreichung neuer Dokumente",
      "state": "Sachsen",
      "amtsgericht": "Amtsgericht Dresden",
      "registernummer": "HRB 8144",
      "registerart": "HRB",
      "company_name": "Wohnungsbau- und Wärmeversorgungsgesellschaft Neustadt i. Sa. mbH - WWGN -",
      "company_seat": "Neustadt",
      "details": "04.12.2025 (Bekanntmachungsdatum)\n\nSachsen Amtsgericht Dresden HRB 8144\nEinreichung neuer Dokumente\n\nWohnungsbau- und Wärmeversorgungsgesellschaft Neustadt i. Sa. mbH   - WWGN -\nGesellschaft mit beschränkter Haftung\nNeustadt\n\nAm 03.12.2025 wurde beim Handelsregister des Amtsgerichts Dresden die Liste der Mitglieder des Aufsichtsrats gemäß § 52 GmbHG eingereicht."
    },
    {
      "date": "2025-12-04",
      "id": "139153",
      "original_text": "Registerbekanntmachung nach dem Umwandlungsgesetz\nNiedersachsen Amtsgericht Hannover HRB 226462\nGM Consult UG (haftungsbeschränkt) – Hannover",
      "type": "Registerbekanntmachung nach dem Umwandlungsgesetz",
      "state": "Niedersachsen",
      "amtsgericht": "Amtsgericht Hannover",
      "registernummer": "HRB 226462",
      "registerart": "HRB",
      "company_name": "GM Consult UG (haftungsbeschränkt)",
      "company_seat": "Hannover",
      "details": "04.12.2025 (Bekanntmachungsdatum)\n\nNiedersachsen Amtsgericht Hannover HRB 226462\nRegisterbekanntmachung nach dem Umwandlungsgesetz 04.12.2025 (Eintragungsdatum)\n\nGM Consult UG (haftungsbeschränkt)\nGesellschaft mit beschränkter Haftung\nHannover\n\nDen Gläubigern der an der Verschmelzung beteiligten Rechtsträger ist, wenn sie binnen sechs Monaten nach dem Tag, an dem die Eintragung der Verschmelzung in das Register des Sitzes desjenigen Rechtsträgers, dessen Gläubiger sie sind, nach § 19  Abs.  3 UmwG als bekannt gemacht gilt, ihren Anspruch nach Grund und Höhe schriftlich anmelden, Sicherheit zu leisten, soweit sie nicht Befriedigung verlangen können. Dieses Recht steht den Gläubigern jedoch nur zu, wenn sie glaubhaft machen, dass durch die Verschmelzung die Erfüllung der Forderung gefährdet wird."
    },
    {
      "date": "2025-12-04",
      "id": "139154",
      "original_text": "Löschungsankündigung\nNiedersachsen Amtsgericht Oldenburg (Oldenburg) VR 150010\nUnterstützungskasse der Firmen Friedrich Pieper, Oldenburgische Fleischwarenfabrik, Cloppenburg, und Fleischvertrieb Cloppenburg Terjung in Cloppenburg – Cloppenburg",
      "type": "Löschungsankündigung",
      "state": "Niedersachsen",
      "amtsgericht": "Amtsgericht Oldenburg (Oldenburg)",
      "registernummer": "VR 150010",
      "registerart": "VR",
      "company_name": "Unterstützungskasse der Firmen Friedrich Pieper, Oldenburgische Fleischwarenfabrik, Cloppenburg, und Fleischvertrieb Cloppenburg Terjung in Cloppenburg",
      "company_seat": "Cloppenburg",
      "details": "04.12.2025 (Bekanntmachungsdatum)\n\nNiedersachsen Amtsgericht Oldenburg (Oldenburg) VR 150010\nLöschungsankündigung\n\nUnterstützungskasse der Firmen Friedrich Pieper, Oldenburgische Fleischwarenfabrik, Cloppenburg, und Fleischvertrieb Cloppenburg Terjung in Cloppenburg\neingetragener Verein\nCloppenburg\n\nDas Registergericht beabsichtigt, den Verein von Amts wegen nach § 395 FamFG zu löschen. Die Frist zur Erhebung eines Widerspruchs ist auf 1 Monat ab dieser Registerbekanntmachung festgesetzt."
    },
    {
      "date": "2025-12-04",
      "id": "139155",
      "original_text": "Löschungsankündigung\nNiedersachsen Amtsgericht Stadthagen HRB 200412\nFGD Beteiligungs GmbH – Auetal",
      "type": "Löschungsankündigung",
      "state": "Niedersachsen",
      "amtsgericht": "Amtsgericht Stadthagen",
      "registernummer": "HRB 200412",
      "registerart": "HRB",
      "company_name": "FGD Beteiligungs GmbH",
      "company_seat": "Auetal",
      "details": "04.12.2025 (Bekanntmachungsdatum)\n\nNiedersachsen Amtsgericht Stadthagen HRB 200412\nLöschungsankündigung\n\nFGD Beteiligungs GmbH\nGesellschaft mit beschränkter Haftung\nAuetal\n\nDas Registergericht beabsichtigt, die Gesellschaft von Amts wegen nach § 394 FamFG zu löschen. Die Frist zur Erhebung eines Widerspruchs ist auf 1 Monat ab dieser Registerbekanntmachung festgesetzt."
    },
    {
      "date": "2025-12-04",
      "id": "139156",
      "original_text": "Löschungsankündigung\nNiedersachsen Amtsgericht Osnabrück HRB 212713\nCW Power UG (haftungsbeschränkt) – Osnabrück",
      "type": "Löschungsankündigung",
      "state": "Niedersachsen",
      "amtsgericht": "Amtsgericht Osnabrück",
      "registernummer": "HRB 212713",
      "registerart": "HRB",
      "company_name": "CW Power UG (haftungsbeschränkt)",
      "company_seat": "Osnabrück",
      "details": "04.12.2025 (Bekanntmachungsdatum)\n\nNiedersachsen Amtsgericht Osnabrück HRB 212713\nLöschungsankündigung\n\nCW Power UG (haftungsbeschränkt)\nGesellschaft mit beschränkter Haftung\nOsnabrück\n\nDas Registergericht beabsichtigt, die Gesellschaft von Amts wegen nach § 394 FamFG wegen Vermögenslosigkeit zu löschen. Die Frist zur Erhebung eines Widerspruchs ist auf 1 Monat ab dieser Registerbekanntmachung festgesetzt."
    },
    {
      "date": "2025-12-04",
      "id": "139157",
      "original_text": "Registerbekanntmachung nach dem Umwandlungsgesetz\nNiedersachsen Amtsgericht Oldenburg (Oldenburg) HRA 208667\nChristian Müller Software e. K. – Oldenburg",
      "type": "Registerbekanntmachung nach dem Umwandlungsgesetz",
      "state": "Niedersachsen",
      "amtsgericht": "Amtsgericht Oldenburg (Oldenburg)",
      "registernummer": "HRA 208667",
      "registerart": "HRA",
      "company_name": "Christian Müller Software e. K.",
      "company_seat": "Oldenburg",
      "details": "04.12.2025 (Bekanntmachungsdatum)\n\nNiedersachsen Amtsgericht Oldenburg (Oldenburg) HRA 208667\nRegisterbekanntmachung nach dem Umwandlungsgesetz 04.12.2025 (Eintragungsdatum)\n\nChristian Müller Software e. K.\nEinzelkaufmann / Einzelkauffrau\nOldenburg\n\nDen Gläubigern der an der Ausgliederung beteiligten Rechtsträger ist, wenn sie binnen sechs Monaten nach dem Tag, an dem die Eintragung der Ausgliederung in das Register des Sitzes desjenigen Rechtsträgers, dessen Gläubiger sie sind, nach § 19 Abs. 3 UmwG als bekannt gemacht gilt, ihren Anspruch nach Grund und Höhe schriftlich anmelden, Sicherheit zu leisten, soweit sie nicht Befriedigung verlangen können. Dieses Recht steht den Gläubigern jedoch nur zu, wenn sie glaubhaft machen, dass durch die Ausgliederung die Erfüllung der Forderung gefährdet wird."
    },
    {
      "date": "2025-12-04",
      "id": "139158",
      "original_text": "Löschungsankündigung\nNiedersachsen Amtsgericht Lüneburg HRB 211010\nRock in der Mühle GmbH – Ahnsbeck",
      "type": "Löschungsankündigung",
      "state": "Niedersachsen",
      "amtsgericht": "Amtsgericht Lüneburg",
      "registernummer": "HRB 211010",
      "registerart": "HRB",
      "company_name": "Rock in der Mühle GmbH",
      "company_seat": "Ahnsbeck",
      "details": "04.12.2025 (Bekanntmachungsdatum)\n\nNiedersachsen Amtsgericht Lüneburg HRB 211010\nLöschungsankündigung\n\nRock in der Mühle GmbH\nGesellschaft mit beschränkter Haftung\nAhnsbeck\n\nDas Registergericht beabsichtigt, die Gesellschaft von Amts wegen nach § 394 FamFG zu löschen. Die Frist zur Erhebung eines Widerspruchs ist auf 1 Monat ab dieser Registerbekanntmachung festgesetzt."
    },
    {
      "date": "2025-12-04",
      "id": "139159",
      "original_text": "Einreichung neuer Dokumente\nNiedersachsen Amtsgericht Hannover HRB 7628\nNorddeutsche Genossenschaftliche Beteiligungs-Aktiengesellschaft – Hannover",
      "type": "Einreichung neuer Dokumente",
      "state": "Niedersachsen",
      "amtsgericht": "Amtsgericht Hannover",
      "registernummer": "HRB 7628",
      "registerart": "HRB",
      "company_name": "Norddeutsche Genossenschaftliche Beteiligungs-Aktiengesellschaft",
      "company_seat": "Hannover",
      "details": "04.12.2025 (Bekanntmachungsdatum)\n\nNiedersachsen Amtsgericht Hannover HRB 7628\nEinreichung neuer Dokumente\n\nNorddeutsche Genossenschaftliche Beteiligungs-Aktiengesellschaft\nAktiengesellschaft\nHannover\n\nDie Liste der Mitglieder des Aufsichtsrats wurde beim Registergericht eingereicht."
    },
    {
      "date": "2025-12-04",
      "id": "139160",
      "original_text": "Löschungsankündigung\nBremen Amtsgericht Bremen HRB 40173\nmy KÖZ Restaurant GmbH – Bremen",
      "type": "Löschungsankündigung",
      "state": "Bremen",
      "amtsgericht": "Amtsgericht Bremen",
      "registernummer": "HRB 40173",
      "registerart": "HRB",
      "company_name": "my KÖZ Restaurant GmbH",
      "company_seat": "Bremen",
      "details": "04.12.2025 (Bekanntmachungsdatum)\n\nBremen Amtsgericht Bremen HRB 40173\nLöschungsankündigung\n\nmy KÖZ Restaurant GmbH\nGesellschaft mit beschränkter Haftung\nBremen\n\nEs ist beabsichtigt die im Handelsregister eingetragene Gesellschaft von Amts wegen gemäß § 394 FamFG zu löschen. Gegen die Löschung kann beim AG Bremen schriftlich oder zu Protokoll der Geschäftsstelle Widerspruch eingelegt werden. Widerspruchsfrist 4 Wochen."
    },
    {
      "date": "2025-12-04",
      "id": "139161",
      "original_text": "Registerbekanntmachung nach dem Umwandlungsgesetz\nBremen Amtsgericht Bremen HRA 29147\ns c h o l l e 47 GmbH & Co. KG – Bremen",
      "type": "Registerbekanntmachung nach dem Umwandlungsgesetz",
      "state": "Bremen",
      "amtsgericht": "Amtsgericht Bremen",
      "registernummer": "HRA 29147",
      "registerart": "HRA",
      "company_name": "s c h o l l e 47 GmbH & Co. KG",
      "company_seat": "Bremen",
      "details": "04.12.2025 (Bekanntmachungsdatum)\n\nBremen Amtsgericht Bremen HRA 29147\nRegisterbekanntmachung nach dem Umwandlungsgesetz 02.12.2025 (Eintragungsdatum)\n\ns c h o l l e 47 GmbH & Co. KG\nKommanditgesellschaft\nBremen\n\nZu Eintragungsnummer 5 vom 02.12.2025 wird als nicht eingetragen veröffentlicht: Den Gläubigern ist, wenn sie binnen sechs Monaten nach dem Tag, an dem die Eintragung der Umwandlung als bekannt gemacht gilt, ihren Anspruch nach Grund und Höhe schriftlich anmelden, Sicherheit zu leisten, soweit sie nicht Befriedigung verlangen können. Dieses Recht steht den Gläubigern jedoch nur zu, wenn sie glaubhaft machen, dass durch die Umwandlung die Erfüllung ihrer Forderung gefährdet wird. Das Recht, Sicherheitsleistung zu verlangen, steht Gläubigern nicht zu, die im Falle der Insolvenz ein Recht auf vorzugsweise Befriedigung aus einer Deckungsmasse haben, die nach gesetzlicher Vorschrift zu ihrem Schutz errichtet und staatlich überwacht ist."
    },
    {
      "date": "2025-12-04",
      "id": "139162",
      "original_text": "Registerbekanntmachung nach dem Umwandlungsgesetz\nRheinland-Pfalz Amtsgericht Mainz HRB 1241\nRogge Obst und Gemüse GmbH – Mainz",
      "type": "Registerbekanntmachung nach dem Umwandlungsgesetz",
      "state": "Rheinland-Pfalz",
      "amtsgericht": "Amtsgericht Mainz",
      "registernummer": "HRB 1241",
      "registerart": "HRB",
      "company_name": "Rogge Obst und Gemüse GmbH",
      "company_seat": "Mainz",
      "details": "04.12.2025 (Bekanntmachungsdatum)\n\nRheinland-Pfalz Amtsgericht Mainz HRB 1241\nRegisterbekanntmachung nach dem Umwandlungsgesetz 04.12.2025 (Eintragungsdatum)\n\nRogge Obst und Gemüse GmbH\nGesellschaft mit beschränkter Haftung\nMainz\n\nDen Gläubigern der an der Verschmelzung beteiligten Rechtsträger ist, wenn sie binnen sechs Monaten nach dem Tag, an dem die Eintragung der Verschmelzung in das Register des Sitzes desjenigen Rechtsträgers, dessen Gläubiger sie sind, nach § 19 Absatz 3 UmwG als bekanntgemacht gilt, ihren Anspruch nach Grund und Höhe schriftlich anmelden, Sicherheit zu leisten, soweit sie nicht Befriedigung verlangen können. Dieses Recht steht den Gläubigern jedoch nur zu, wenn sie glaubhaft machen, dass durch die Verschmelzung die Erfüllung ihrer Forderung gefährdet wird."
    },
    {
      "date": "2025-12-04",
      "id": "139163",
      "original_text": "Registerbekanntmachung nach dem Umwandlungsgesetz\nRheinland-Pfalz Amtsgericht Mainz HRA 44936\nM & H Fenstermontage e.K. – Gabsheim",
      "type": "Registerbekanntmachung nach dem Umwandlungsgesetz",
      "state": "Rheinland-Pfalz",
      "amtsgericht": "Amtsgericht Mainz",
      "registernummer": "HRA 44936",
      "registerart": "HRA",
      "company_name": "M & H Fenstermontage e.K.",
      "company_seat": "Gabsheim",
      "details": "04.12.2025 (Bekanntmachungsdatum)\n\nRheinland-Pfalz Amtsgericht Mainz HRA 44936\nRegisterbekanntmachung nach dem Umwandlungsgesetz 04.12.2025 (Eintragungsdatum)\n\nM & H Fenstermontage e.K.\nEinzelkaufmann / Einzelkauffrau\nGabsheim\n\nAls nicht eingetragen wird veröffentlicht: Den Gläubigern der an der Ausgliederung beteiligten Rechtsträger ist, wenn sie binnen sechs Monaten nach dem Tag, an dem die Eintragung der Ausgliederung in das Register des Rechtsträgers, dessen Gläubiger sie sind, nach §§ 125, 19 Abs. 3 UmwG als bekannt gemacht gilt, ihren Anspruch nach Grund und Höhe schriftlich anmelden, Sicherheit zu leisten, soweit sie nicht Befriedigung verlangen können. Dieses Recht steht den Gläubigern jedoch nur zu, wenn sie glaubhaft machen, dass durch die Ausgliederung die Erfüllung ihrer Forderung gefährdet wird."
    },
    {
      "date": "2025-12-04",
      "id": "139164",
      "original_text": "Registerbekanntmachung nach dem Umwandlungsgesetz\nRheinland-Pfalz Amtsgericht Mainz HRB 2768\nWeco-Rogge Fruchthandels GmbH – Mainz",
      "type": "Registerbekanntmachung nach dem Umwandlungsgesetz",
      "state": "Rheinland-Pfalz",
      "amtsgericht": "Amtsgericht Mainz",
      "registernummer": "HRB 2768",
      "registerart": "HRB",
      "company_name": "Weco-Rogge Fruchthandels GmbH",
      "company_seat": "Mainz",
      "details": "04.12.2025 (Bekanntmachungsdatum)\n\nRheinland-Pfalz Amtsgericht Mainz HRB 2768\nRegisterbekanntmachung nach dem Umwandlungsgesetz 04.12.2025 (Eintragungsdatum)\n\nWeco-Rogge Fruchthandels GmbH\nGesellschaft mit beschränkter Haftung\nMainz\n\nGläubigern der an der Verschmelzung beteiligten Rechtsträger ist unter den Den Gläubigern der an der Verschmelzung beteiligten Rechtsträger ist, wenn sie binnen sechs Monaten nach dem Tag, an dem die Eintragung der Verschmelzung in das Register des Sitzes desjenigen Rechtsträgers, dessen Gläubiger sie sind, nach § 19 Absatz 3 UmwG als bekanntgemacht gilt, ihren Anspruch nach Grund und Höhe schriftlich anmelden, Sicherheit zu leisten, soweit sie nicht Befriedigung verlangen können. Dieses Recht steht den Gläubigern jedoch nur zu, wenn sie glaubhaft machen, dass durch die Verschmelzung die Erfüllung ihrer Forderung gefährdet wird."
    },
    {
      "date": "2025-12-04",
      "id": "139165",
      "original_text": "Einreichung neuer Dokumente\nNordrhein-Westfalen Amtsgericht Köln HRB 48231\nWGL Wohnungsgesellschaft Leverkusen GmbH – Leverkusen",
      "type": "Einreichung neuer Dokumente",
      "state": "Nordrhein-Westfalen",
      "amtsgericht": "Amtsgericht Köln",
      "registernummer": "HRB 48231",
      "registerart": "HRB",
      "company_name": "WGL Wohnungsgesellschaft Leverkusen GmbH",
      "company_seat": "Leverkusen",
      "details": "04.12.2025 (Bekanntmachungsdatum)\n\nNordrhein-Westfalen Amtsgericht Köln HRB 48231\nEinreichung neuer Dokumente\n\nWGL Wohnungsgesellschaft Leverkusen GmbH\nGesellschaft mit beschränkter Haftung\nLeverkusen\n\nDem Registergericht ist eine neue Liste der Mitglieder des Aufsichtsrates eingereicht worden."
    },
    {
      "date": "2025-12-04",
      "id": "139166",
      "original_text": "Löschungsankündigung\nNordrhein-Westfalen Amtsgericht Krefeld HRB 18250\nFH Car Services GmbH – Krefeld",
      "type": "Löschungsankündigung",
      "state": "Nordrhein-Westfalen",
      "amtsgericht": "Amtsgericht Krefeld",
      "registernummer": "HRB 18250",
      "registerart": "HRB",
      "company_name": "FH Car Services GmbH",
      "company_seat": "Krefeld",
      "details": "04.12.2025 (Bekanntmachungsdatum)\n\nNordrhein-Westfalen Amtsgericht Krefeld HRB 18250\nLöschungsankündigung\n\nFH Car Services GmbH\nGesellschaft mit beschränkter Haftung\nKrefeld\n\nDas Registergericht beabsichtigt die Gesellschaft von Amts wegen nach § 394 FamFG zu löschen. Die Frist zur Erhebung eines Widerspruchs ist auf einen Monat festgesetzt."
    },
    {
      "date": "2025-12-04",
      "id": "139167",
      "original_text": "Einreichung neuer Dokumente\nNordrhein-Westfalen Amtsgericht Gütersloh HRB 4935\nStadtwerke Versmold GmbH – Versmold",
      "type": "Einreichung neuer Dokumente",
      "state": "Nordrhein-Westfalen",
      "amtsgericht": "Amtsgericht Gütersloh",
      "registernummer": "HRB 4935",
      "registerart": "HRB",
      "company_name": "Stadtwerke Versmold GmbH",
      "company_seat": "Versmold",
      "details": "04.12.2025 (Bekanntmachungsdatum)\n\nNordrhein-Westfalen Amtsgericht Gütersloh HRB 4935\nEinreichung neuer Dokumente\n\nStadtwerke Versmold GmbH\nGesellschaft mit beschränkter Haftung\nVersmold\n\nDem Registergericht ist eine neue Liste der Mitglieder des Aufsichtsrates eingereicht worden."
    },
    {
      "date": "2025-12-04",
      "id": "139168",
      "original_text": "Registerbekanntmachung nach dem Umwandlungsgesetz\nNordrhein-Westfalen Amtsgericht Arnsberg HRA 9414\nArtur Wottschel e.K. – Warstein",
      "type": "Registerbekanntmachung nach dem Umwandlungsgesetz",
      "state": "Nordrhein-Westfalen",
      "amtsgericht": "Amtsgericht Arnsberg",
      "registernummer": "HRA 9414",
      "registerart": "HRA",
      "company_name": "Artur Wottschel e.K.",
      "company_seat": "Warstein",
      "details": "04.12.2025 (Bekanntmachungsdatum)\n\nNordrhein-Westfalen Amtsgericht Arnsberg HRA 9414\nRegisterbekanntmachung nach dem Umwandlungsgesetz 04.12.2025 (Eintragungsdatum)\n\nArtur Wottschel e.K.\nEinzelkaufmann / Einzelkauffrau\nWarstein\n\nDen Gläubigern der an der Ausgliederung beteiligten Rechtsträger ist, wenn sie binnen sechs Monaten nach dem Tag, an dem die Eintragung der Ausgliederung in das Register des Sitzes derjenigen Rechtsträger deren Gläubiger sie sind, nach § 19 Absatz 3 UmwG als bekanntgemacht gilt, ihren Anspruch nach Grund und Höhe schriftlich anmelden, Sicherheit zu leisten, soweit sie nicht Befriedigung verlangen können. Dieses Recht steht den Gläubigern jedoch nur zu, wenn sie glaubhaft machen, dass durch die Ausgliederung die Erfüllung ihrer Forderung gefährdet wird."
    },
    {
      "date": "2025-12-04",
      "id": "139169",
      "original_text": "Registerbekanntmachung nach dem Umwandlungsgesetz\nNordrhein-Westfalen Amtsgericht Wuppertal HRB 30249\nCafe Extrablatt Velbert GmbH – Velbert",
      "type": "Registerbekanntmachung nach dem Umwandlungsgesetz",
      "state": "Nordrhein-Westfalen",
      "amtsgericht": "Amtsgericht Wuppertal",
      "registernummer": "HRB 30249",
      "registerart": "HRB",
      "company_name": "Cafe Extrablatt Velbert GmbH",
      "company_seat": "Velbert",
      "details": "04.12.2025 (Bekanntmachungsdatum)\n\nNordrhein-Westfalen Amtsgericht Wuppertal HRB 30249\nRegisterbekanntmachung nach dem Umwandlungsgesetz 04.12.2025 (Eintragungsdatum)\n\nCafe Extrablatt Velbert GmbH\nGesellschaft mit beschränkter Haftung\nVelbert\n\nDen Gläubigern der an der Verschmelzung beteiligten Rechtsträger ist, wenn sie binnen sechs Monaten nach dem Tag, an dem die Eintragung der Verschmelzung in das Register des Sitzes desjenigen Rechtsträgers, dessen Gläubiger sie sind, nach § 19 Absatz 3 UmwG als bekanntgemacht gilt, ihren Anspruch nach Grund und Höhe schriftlich anmelden, Sicherheit zu leisten, soweit sie nicht Befriedigung verlangen können. Dieses Recht steht den Gläubigern jedoch nur zu, wenn sie glaubhaft machen, dass durch die Verschmelzung die Erfüllung ihrer Forderung gefährdet wird."
    },
    {
      "date": "2025-12-04",
      "id": "139170",
      "original_text": "Registerbekanntmachung nach dem Umwandlungsgesetz\nNordrhein-Westfalen Amtsgericht Düsseldorf HRB 76761\nRhein Ruhr Gewerbeimmobilien Beteiligungs GmbH – Düsseldorf",
      "type": "Registerbekanntmachung nach dem Umwandlungsgesetz",
      "state": "Nordrhein-Westfalen",
      "amtsgericht": "Amtsgericht Düsseldorf",
      "registernummer": "HRB 76761",
      "registerart": "HRB",
      "company_name": "Rhein Ruhr Gewerbeimmobilien Beteiligungs GmbH",
      "company_seat": "Düsseldorf",
      "details": "04.12.2025 (Bekanntmachungsdatum)\n\nNordrhein-Westfalen Amtsgericht Düsseldorf HRB 76761\nRegisterbekanntmachung nach dem Umwandlungsgesetz 04.12.2025 (Eintragungsdatum)\n\nRhein Ruhr Gewerbeimmobilien Beteiligungs GmbH\nGesellschaft mit beschränkter Haftung\nDüsseldorf\n\nDen Gläubigern der an der Verschmelzung beteiligten Rechtsträger ist, wenn sie binnen sechs Monaten nach dem Tag, an dem die Eintragung der Verschmelzung in das Register des Sitzes desjenigen Rechtsträgers, dessen Gläubiger sie sind, nach § 19 Absatz 3 UmwG als bekanntgemacht gilt, ihren Anspruch nach Grund und Höhe schriftlich anmelden, Sicherheit zu leisten, soweit sie nicht Befriedigung verlangen können. Dieses Recht steht den Gläubigern jedoch nur zu, wenn sie glaubhaft machen, dass durch die Verschmelzung die Erfüllung ihrer Forderung gefährdet wird."
    },
    {
      "date": "2025-12-04",
      "id": "139171",
      "original_text": "Registerbekanntmachung nach dem Umwandlungsgesetz\nNordrhein-Westfalen Amtsgericht Iserlohn HRA 2723\nListertaler Busbetrieb Anke Hauser – Meinerzhagen",
      "type": "Registerbekanntmachung nach dem Umwandlungsgesetz",
      "state": "Nordrhein-Westfalen",
      "amtsgericht": "Amtsgericht Iserlohn",
      "registernummer": "HRA 2723",
      "registerart": "HRA",
      "company_name": "Listertaler Busbetrieb Anke Hauser",
      "company_seat": "Meinerzhagen",
      "details": "04.12.2025 (Bekanntmachungsdatum)\n\nNordrhein-Westfalen Amtsgericht Iserlohn HRA 2723\nRegisterbekanntmachung nach dem Umwandlungsgesetz 04.12.2025 (Eintragungsdatum)\n\nListertaler Busbetrieb Anke Hauser\nEinzelkaufmann / Einzelkauffrau\nMeinerzhagen\n\nDen Gläubigern der an der Ausgliederung beteiligten Rechtsträger ist, wenn sie binnen sechs Monaten nach dem Tag, an dem die Eintragung der Ausgliederung in das Register des Sitzes desjenigen Rechtsträgers, dessen Gläubiger sie sind, nach § 19 Absatz 3 UmwG als bekanntgemacht gilt, ihren Anspruch nach Grund und Höhe schriftlich anmelden, Sicherheit zu leisten, soweit sie nicht Befriedigung verlangen können. Dieses Recht steht den Gläubigern jedoch nur zu, wenn sie glaubhaft machen, dass durch die Ausgliederung die Erfüllung ihrer Forderung gefährdet wird."
    },
    {
      "date": "2025-12-04",
      "id": "139172",
      "original_text": "Löschungsankündigung\nNordrhein-Westfalen Amtsgericht Dortmund HRB 35205\nAO Eisen UG (haftungsbeschränkt) – Dortmund",
      "type": "Löschungsankündigung",
      "state": "Nordrhein-Westfalen",
      "amtsgericht": "Amtsgericht Dortmund",
      "registernummer": "HRB 35205",
      "registerart": "HRB",
      "company_name": "AO Eisen UG (haftungsbeschränkt)",
      "company_seat": "Dortmund",
      "details": "04.12.2025 (Bekanntmachungsdatum)\n\nNordrhein-Westfalen Amtsgericht Dortmund HRB 35205\nLöschungsankündigung\n\nAO Eisen UG (haftungsbeschränkt)\nGesellschaft mit beschränkter Haftung\nDortmund\n\nDas Registergericht beabsichtigt die Gesellschaft von Amts wegen nach § 394 FamFG zu löschen. Die Frist zur Erhebung eines Widerspruchs ist auf zwei Monate festgesetzt."
    },
    {
      "date": "2025-12-04",
      "id": "139173",
      "original_text": "Löschungsankündigung\nNordrhein-Westfalen Amtsgericht Düsseldorf HRB 93772\nMASIV Company GmbH – Düsseldorf",
      "type": "Löschungsankündigung",
      "state": "Nordrhein-Westfalen",
      "amtsgericht": "Amtsgericht Düsseldorf",
      "registernummer": "HRB 93772",
      "registerart": "HRB",
      "company_name": "MASIV Company GmbH",
      "company_seat": "Düsseldorf",
      "details": "04.12.2025 (Bekanntmachungsdatum)\n\nNordrhein-Westfalen Amtsgericht Düsseldorf HRB 93772\nLöschungsankündigung\n\nMASIV Company GmbH\nGesellschaft mit beschränkter Haftung\nDüsseldorf\n\nDas Registergericht beabsichtigt die Gesellschaft von Amts wegen nach § 394 FamFG zu löschen. Die Frist zur Erhebung eines Widerspruchs ist auf 3 Wochen festgesetzt.\n\nRechtsbehelfsbelehrung:\nDas Widerspruchsrecht steht jedem zu, der an der Unterlassung der Löschung ein berechtigtes Interesse hat. Der Widerspruch ist bei dem Amtsgericht Düsseldorf -Registergericht-, Werdener Straße 1, 40227 Düsseldorf schriftlich in deutscher Sprache oder zur Niederschrift der Geschäftsstelle einzulegen. Der Widerspruch kann auch zur Niederschrift der Geschäftsstelle eines jeden Amtsgerichtes abgegeben werden. Die Einlegung ist auch durch Übertragung eines elektronischen Dokuments an die elektronische Poststelle des Gerichts möglich. Das elektronische Dokument muss für die Bearbeitung durch das Gericht geeignet und mit einer qualifizierten elektronischen Signatur der verantwortenden Person versehen sein oder von der verantwortenden Person signiert und auf einem sicheren Übermittlungsweg gemäß § 130a ZPO nach näherer Maßgabe der Verordnung über die technischen Rahmenbedingungen des elektronischen Rechtsverkehrs und über das besondere elektronische Behördenpostfach (BGBl. I, S.3803) eingereicht werden. Weitere Informationen erhalten Sie auf der Internetseite www.justiz.de.\nDer Widerspruch muss spätestens innerhalb der gesetzten Frist nach dem Datum der Bekanntmachung der Löschungsankündigung bei dem Amtsgericht - Registergericht - Düsseldorf eingegangen sein.  Dies gilt auch dann, wenn der Widerspruch zur Niederschrift der Geschäftsstelle eines anderen Amtsgerichtes abgegeben wurde. Die Frist beginnt mit dem Tage der Bekanntmachung der Löschungsankündigung in dem für die Bekanntmachung der Eintragungen in das Handelsregister bestimmten elektronischen Informations- und Kommunikationssystem nach § 10 des Handelsgesetzbuches. Fällt das Ende der Frist auf einen Sonntag, einen allgemeinen Feiertag oder Sonnabend, so endet die Frist mit Ablauf des nächsten Werktages.\nDer Widerspruch muss die Bezeichnung der angefochtenen Löschungsankündigung sowie die Erklärung enthalten, dass Widerspruch gegen diese Löschungsankündigung eingelegt wird. Er ist zu unterzeichnen und soll begründet werden."
    },
    {
      "date": "2025-12-04",
      "id": "139174",
      "original_text": "Löschungsankündigung\nNordrhein-Westfalen Amtsgericht Dortmund HRB 27141\nEBS European Business Support UG (haftungsbeschränkt) – Dortmund",
      "type": "Löschungsankündigung",
      "state": "Nordrhein-Westfalen",
      "amtsgericht": "Amtsgericht Dortmund",
      "registernummer": "HRB 27141",
      "registerart": "HRB",
      "company_name": "EBS European Business Support UG (haftungsbeschränkt)",
      "company_seat": "Dortmund",
      "details": "04.12.2025 (Bekanntmachungsdatum)\n\nNordrhein-Westfalen Amtsgericht Dortmund HRB 27141\nLöschungsankündigung\n\nEBS European Business Support UG (haftungsbeschränkt)\nGesellschaft mit beschränkter Haftung\nDortmund\n\nDas Registergericht beabsichtigt die Gesellschaft von Amts wegen nach § 394 FamFG zu löschen. Die Frist zur Erhebung eines Widerspruchs ist auf zwei Monate festgesetzt."
    },
    {
      "date": "2025-12-04",
      "id": "139175",
      "original_text": "Löschungsankündigung\nNordrhein-Westfalen Amtsgericht Dortmund HRB 31828\ni.Connect GmbH – Lünen",
      "type": "Löschungsankündigung",
      "state": "Nordrhein-Westfalen",
      "amtsgericht": "Amtsgericht Dortmund",
      "registernummer": "HRB 31828",
      "registerart": "HRB",
      "company_name": "i.Connect GmbH",
      "company_seat": "Lünen",
      "details": "04.12.2025 (Bekanntmachungsdatum)\n\nNordrhein-Westfalen Amtsgericht Dortmund HRB 31828\nLöschungsankündigung\n\ni.Connect GmbH\nGesellschaft mit beschränkter Haftung\nLünen\n\nDas Registergericht beabsichtigt die Gesellschaft von Amts wegen nach § 394 FamFG zu löschen. Die Frist zur Erhebung eines Widerspruchs ist auf zwei Monate festgesetzt."
    },
    {
      "date": "2025-12-04",
      "id": "139176",
      "original_text": "Registerbekanntmachung nach dem Umwandlungsgesetz\nNordrhein-Westfalen Amtsgericht Lemgo HRB 6045\nCWK Beteiligungs-GmbH – Bad Salzuflen",
      "type": "Registerbekanntmachung nach dem Umwandlungsgesetz",
      "state": "Nordrhein-Westfalen",
      "amtsgericht": "Amtsgericht Lemgo",
      "registernummer": "HRB 6045",
      "registerart": "HRB",
      "company_name": "CWK Beteiligungs-GmbH",
      "company_seat": "Bad Salzuflen",
      "details": "04.12.2025 (Bekanntmachungsdatum)\n\nNordrhein-Westfalen Amtsgericht Lemgo HRB 6045\nRegisterbekanntmachung nach dem Umwandlungsgesetz 04.12.2025 (Eintragungsdatum)\n\nCWK Beteiligungs-GmbH\nGesellschaft mit beschränkter Haftung\nBad Salzuflen\n\nDen Gläubigern der an der Verschmelzung beteiligten Rechtsträger ist, wenn sie binnen sechs Monaten nach dem Tag, an dem die Eintragung der Verschmelzung in das Register des Sitzes desjenigen Rechtsträgers, dessen Gläubiger sie sind, nach § 19 Absatz 3 UmwG als bekanntgemacht gilt, ihren Anspruch nach Grund und Höhe schriftlich anmelden, Sicherheit zu leisten, soweit sie nicht Befriedigung verlangen können. Dieses Recht steht den Gläubigern jedoch nur zu, wenn sie glaubhaft machen, dass durch die Verschmelzung die Erfüllung ihrer Forderung gefährdet wird."
    },
    {
      "date": "2025-12-04",
      "id": "139177",
      "original_text": "Einreichung neuer Dokumente\nNordrhein-Westfalen Amtsgericht Köln HRB 78264\ntalentsconnect AG – Köln",
      "type": "Einreichung neuer Dokumente",
      "state": "Nordrhein-Westfalen",
      "amtsgericht": "Amtsgericht Köln",
      "registernummer": "HRB 78264",
      "registerart": "HRB",
      "company_name": "talentsconnect AG",
      "company_seat": "Köln",
      "details": "04.12.2025 (Bekanntmachungsdatum)\n\nNordrhein-Westfalen Amtsgericht Köln HRB 78264\nEinreichung neuer Dokumente\n\ntalentsconnect AG\nAktiengesellschaft\nKöln\n\nDem Registergericht ist eine neue Liste der Mitglieder des Aufsichtsrates eingereicht worden."
    },
    {
      "date": "2025-12-04",
      "id": "139178",
      "original_text": "Registerbekanntmachung nach dem Umwandlungsgesetz\nNordrhein-Westfalen Amtsgericht Bad Oeynhausen HRB 5456\nPriority Aktiengesellschaft – Herford",
      "type": "Registerbekanntmachung nach dem Umwandlungsgesetz",
      "state": "Nordrhein-Westfalen",
      "amtsgericht": "Amtsgericht Bad Oeynhausen",
      "registernummer": "HRB 5456",
      "registerart": "HRB",
      "company_name": "Priority Aktiengesellschaft",
      "company_seat": "Herford",
      "details": "04.12.2025 (Bekanntmachungsdatum)\n\nNordrhein-Westfalen Amtsgericht Bad Oeynhausen HRB 5456\nRegisterbekanntmachung nach dem Umwandlungsgesetz 04.12.2025 (Eintragungsdatum)\n\nPriority Aktiengesellschaft\nAktiengesellschaft\nHerford\n\nDen Gläubigern der an der Abspaltung beteiligten Rechtsträger ist, wenn sie binnen sechs Monaten nach dem Tag, an dem die Eintragung der Abspaltung in das Register des Sitzes derjenigen Rechtsträger deren Gläubiger sie sind, nach § 19 Absatz 3 UmwG als bekanntgemacht gilt, ihren Anspruch nach Grund und Höhe schriftlich anmelden, Sicherheit zu leisten, soweit sie nicht Befriedigung verlangen können. Dieses Recht steht den Gläubigern jedoch nur zu, wenn sie glaubhaft machen, dass durch die Abspaltung die Erfüllung ihrer Forderung gefährdet wird."
    },
    {
      "date": "2025-12-04",
      "id": "139179",
      "original_text": "Löschungsankündigung\nNordrhein-Westfalen Amtsgericht Dortmund HRB 30305\nFolia Vision Dortmund UG (haftungsbeschränkt) – Dortmund",
      "type": "Löschungsankündigung",
      "state": "Nordrhein-Westfalen",
      "amtsgericht": "Amtsgericht Dortmund",
      "registernummer": "HRB 30305",
      "registerart": "HRB",
      "company_name": "Folia Vision Dortmund UG (haftungsbeschränkt)",
      "company_seat": "Dortmund",
      "details": "04.12.2025 (Bekanntmachungsdatum)\n\nNordrhein-Westfalen Amtsgericht Dortmund HRB 30305\nLöschungsankündigung\n\nFolia Vision Dortmund UG (haftungsbeschränkt)\nGesellschaft mit beschränkter Haftung\nDortmund\n\nDas Registergericht beabsichtigt die Gesellschaft von Amts wegen nach § 394 FamFG zu löschen. Die Frist zur Erhebung eines Widerspruchs ist auf zwei Monate festgesetzt."
    },
    {
      "date": "2025-12-04",
      "id": "139180",
      "original_text": "Registerbekanntmachung nach dem Umwandlungsgesetz\nNordrhein-Westfalen Amtsgericht Bonn HRB 8999\nService Gesellschaft mbH des Bundesverbandes privater Anbieter sozialer Dienste e.V. – Bonn",
      "type": "Registerbekanntmachung nach dem Umwandlungsgesetz",
      "state": "Nordrhein-Westfalen",
      "amtsgericht": "Amtsgericht Bonn",
      "registernummer": "HRB 8999",
      "registerart": "HRB",
      "company_name": "Service Gesellschaft mbH des Bundesverbandes privater Anbieter sozialer Dienste e.V.",
      "company_seat": "Bonn",
      "details": "04.12.2025 (Bekanntmachungsdatum)\n\nNordrhein-Westfalen Amtsgericht Bonn HRB 8999\nRegisterbekanntmachung nach dem Umwandlungsgesetz 04.12.2025 (Eintragungsdatum)\n\nService Gesellschaft mbH des Bundesverbandes privater Anbieter sozialer Dienste e.V.\nGesellschaft mit beschränkter Haftung\nBonn\n\nDen Gläubigern der an der Verschmelzung beteiligten Rechtsträger ist, wenn sie binnen sechs Monaten nach dem Tag, an dem die Eintragung der Verschmelzung in das Register des Sitzes desjenigen Rechtsträgers, dessen Gläubiger sie sind, nach § 19 Absatz 3 UmwG als bekanntgemacht gilt, ihren Anspruch nach Grund und Höhe schriftlich anmelden, Sicherheit zu leisten, soweit sie nicht Befriedigung verlangen können. Dieses Recht steht den Gläubigern jedoch nur zu, wenn sie glaubhaft machen, dass durch die Verschmelzung die Erfüllung ihrer Forderung gefährdet wird."
    },
    {
      "date": "2025-12-04",
      "id": "139181",
      "original_text": "Registerbekanntmachung nach dem Umwandlungsgesetz\nNordrhein-Westfalen Amtsgericht Gütersloh HRA 7846\nOnal e.K. – Harsewinkel",
      "type": "Registerbekanntmachung nach dem Umwandlungsgesetz",
      "state": "Nordrhein-Westfalen",
      "amtsgericht": "Amtsgericht Gütersloh",
      "registernummer": "HRA 7846",
      "registerart": "HRA",
      "company_name": "Onal e.K.",
      "company_seat": "Harsewinkel",
      "details": "04.12.2025 (Bekanntmachungsdatum)\n\nNordrhein-Westfalen Amtsgericht Gütersloh HRA 7846\nRegisterbekanntmachung nach dem Umwandlungsgesetz 04.12.2025 (Eintragungsdatum)\n\nOnal e.K.\nEinzelkaufmann / Einzelkauffrau\nHarsewinkel\n\nDen Gläubigern der an der Ausgliederung beteiligten Rechtsträger ist, wenn sie binnen sechs Monaten nach dem Tag, an dem die Eintragung der Ausgliederung in das Register des Sitzes desjenigen Rechtsträgers, dessen Gläubiger sie sind, nach § 19 Absatz 3 UmwG als bekanntgemacht gilt, ihren Anspruch nach Grund und Höhe schriftlich anmelden, Sicherheit zu leisten, soweit sie nicht Befriedigung verlangen können. Dieses Recht steht den Gläubigern jedoch nur zu, wenn sie glaubhaft machen, dass durch die Ausgliederung die Erfüllung ihrer Forderung gefährdet wird."
    },
    {
      "date": "2025-12-04",
      "id": "139182",
      "original_text": "Löschungsankündigung\nNordrhein-Westfalen Amtsgericht Gütersloh HRB 7168\nStöttwig Telekom GmbH – Gütersloh",
      "type": "Löschungsankündigung",
      "state": "Nordrhein-Westfalen",
      "amtsgericht": "Amtsgericht Gütersloh",
      "registernummer": "HRB 7168",
      "registerart": "HRB",
      "company_name": "Stöttwig Telekom GmbH",
      "company_seat": "Gütersloh",
      "details": "04.12.2025 (Bekanntmachungsdatum)\n\nNordrhein-Westfalen Amtsgericht Gütersloh HRB 7168\nLöschungsankündigung 04.12.2025 (Eintragungsdatum)\n\nStöttwig Telekom GmbH\nGesellschaft mit beschränkter Haftung\nGütersloh\n\nDas Registergericht beabsichtigt die Gesellschaft von Amts wegen nach § 394 FamFG zu löschen. Die Frist zur Erhebung eines Widerspruchs ist auf einen Monat festgesetzt."
    },
    {
      "date": "2025-12-04",
      "id": "139183",
      "original_text": "Registerbekanntmachung nach dem Umwandlungsgesetz\nNordrhein-Westfalen Amtsgericht Recklinghausen HRB 7999\nBSG Bildungsinstitut für Soziales und Gesundheit GmbH – Recklinghausen",
      "type": "Registerbekanntmachung nach dem Umwandlungsgesetz",
      "state": "Nordrhein-Westfalen",
      "amtsgericht": "Amtsgericht Recklinghausen",
      "registernummer": "HRB 7999",
      "registerart": "HRB",
      "company_name": "BSG Bildungsinstitut für Soziales und Gesundheit GmbH",
      "company_seat": "Recklinghausen",
      "details": "04.12.2025 (Bekanntmachungsdatum)\n\nNordrhein-Westfalen Amtsgericht Recklinghausen HRB 7999\nRegisterbekanntmachung nach dem Umwandlungsgesetz 28.11.2025 (Eintragungsdatum)\n\nBSG Bildungsinstitut für Soziales und Gesundheit GmbH\nGesellschaft mit beschränkter Haftung\nRecklinghausen\n\nDen Gläubigern der an der Verschmelzung beteiligten Rechtsträger ist, wenn sie binnen sechs Monaten nach dem Tag, an dem die Eintragung der Verschmelzung in das Register des Sitzes desjenigen Rechtsträgers, dessen Gläubiger sie sind, nach § 19 Absatz 3 UmwG als bekanntgemacht gilt, ihren Anspruch nach Grund und Höhe schriftlich anmelden, Sicherheit zu leisten, soweit sie nicht Befriedigung verlangen können. Dieses Recht steht den Gläubigern jedoch nur zu, wenn sie glaubhaft machen, dass durch die Verschmelzung die Erfüllung ihrer Forderung gefährdet wird."
    },
    {
      "date": "2025-12-04",
      "id": "139184",
      "original_text": "Registerbekanntmachung nach dem Umwandlungsgesetz\nNordrhein-Westfalen Amtsgericht Bad Oeynhausen HRB 20655\nOF Beteiligungs GmbH – Herford",
      "type": "Registerbekanntmachung nach dem Umwandlungsgesetz",
      "state": "Nordrhein-Westfalen",
      "amtsgericht": "Amtsgericht Bad Oeynhausen",
      "registernummer": "HRB 20655",
      "registerart": "HRB",
      "company_name": "OF Beteiligungs GmbH",
      "company_seat": "Herford",
      "details": "04.12.2025 (Bekanntmachungsdatum)\n\nNordrhein-Westfalen Amtsgericht Bad Oeynhausen HRB 20655\nRegisterbekanntmachung nach dem Umwandlungsgesetz 04.12.2025 (Eintragungsdatum)\n\nOF Beteiligungs GmbH\nGesellschaft mit beschränkter Haftung\nHerford\n\nDen Gläubigern der an der Abspaltung beteiligten Rechtsträger ist, wenn sie binnen sechs Monaten nach dem Tag, an dem die Eintragung der Abspaltung in das Register des Sitzes derjenigen Rechtsträger deren Gläubiger sie sind, nach § 19 Absatz 3 UmwG als bekanntgemacht gilt, ihren Anspruch nach Grund und Höhe schriftlich anmelden, Sicherheit zu leisten, soweit sie nicht Befriedigung verlangen können. Dieses Recht steht den Gläubigern jedoch nur zu, wenn sie glaubhaft machen, dass durch die Abspaltung die Erfüllung ihrer Forderung gefährdet wird."
    },
    {
      "date": "2025-12-04",
      "id": "139185",
      "original_text": "Registerbekanntmachung nach dem Umwandlungsgesetz\nNordrhein-Westfalen Amtsgericht Düsseldorf HRB 107797\nKüpper Shared Service Center GmbH – Düsseldorf",
      "type": "Registerbekanntmachung nach dem Umwandlungsgesetz",
      "state": "Nordrhein-Westfalen",
      "amtsgericht": "Amtsgericht Düsseldorf",
      "registernummer": "HRB 107797",
      "registerart": "HRB",
      "company_name": "Küpper Shared Service Center GmbH",
      "company_seat": "Düsseldorf",
      "details": "04.12.2025 (Bekanntmachungsdatum)\n\nNordrhein-Westfalen Amtsgericht Düsseldorf HRB 107797\nRegisterbekanntmachung nach dem Umwandlungsgesetz 04.12.2025 (Eintragungsdatum)\n\nKüpper Shared Service Center GmbH\nGesellschaft mit beschränkter Haftung\nDüsseldorf\n\nDen Gläubigern der an der Verschmelzung beteiligten Rechtsträger ist, wenn sie binnen sechs Monaten nach dem Tag, an dem die Eintragung der Verschmelzung in das Register des Sitzes desjenigen Rechtsträgers, dessen Gläubiger sie sind, nach § 19 Absatz 3 UmwG als bekanntgemacht gilt, ihren Anspruch nach Grund und Höhe schriftlich anmelden, Sicherheit zu leisten, soweit sie nicht Befriedigung verlangen können. Dieses Recht steht den Gläubigern jedoch nur zu, wenn sie glaubhaft machen, dass durch die Verschmelzung die Erfüllung ihrer Forderung gefährdet wird."
    },
    {
      "date": "2025-12-04",
      "id": "139186",
      "original_text": "Registerbekanntmachung nach dem Umwandlungsgesetz\nNordrhein-Westfalen Amtsgericht Bonn HRB 23533\nArrowhead Engineered Products GmbH – Euskirchen",
      "type": "Registerbekanntmachung nach dem Umwandlungsgesetz",
      "state": "Nordrhein-Westfalen",
      "amtsgericht": "Amtsgericht Bonn",
      "registernummer": "HRB 23533",
      "registerart": "HRB",
      "company_name": "Arrowhead Engineered Products GmbH",
      "company_seat": "Euskirchen",
      "details": "04.12.2025 (Bekanntmachungsdatum)\n\nNordrhein-Westfalen Amtsgericht Bonn HRB 23533\nRegisterbekanntmachung nach dem Umwandlungsgesetz 04.12.2025 (Eintragungsdatum)\n\nArrowhead Engineered Products GmbH\nGesellschaft mit beschränkter Haftung\nEuskirchen\n\nDen Gläubigern der an der grenzüberschreitenden Verschmelzung beteiligten übernehmenden Rechtsträger ist, wenn sie binnen sechs Monaten nach dem Tag, an dem die Eintragung der Spaltung in das Register des Sitzes desjenigen Rechtsträgers, dessen Gläubiger sie sind, nach § 19 Absatz 3 UmwG als bekanntgemacht gilt, ihren Anspruch nach Grund und Höhe in Textform anmelden, Sicherheit zu leisten, soweit sie nicht Befriedigung verlangen können."
    },
    {
      "date": "2025-12-04",
      "id": "139187",
      "original_text": "Registerbekanntmachung nach dem Umwandlungsgesetz\nNordrhein-Westfalen Amtsgericht Dortmund HRB 14909\naudalis Consulting GmbH – Dortmund",
      "type": "Registerbekanntmachung nach dem Umwandlungsgesetz",
      "state": "Nordrhein-Westfalen",
      "amtsgericht": "Amtsgericht Dortmund",
      "registernummer": "HRB 14909",
      "registerart": "HRB",
      "company_name": "audalis Consulting GmbH",
      "company_seat": "Dortmund",
      "details": "04.12.2025 (Bekanntmachungsdatum)\n\nNordrhein-Westfalen Amtsgericht Dortmund HRB 14909\nRegisterbekanntmachung nach dem Umwandlungsgesetz 26.11.2025 (Eintragungsdatum)\n\naudalis Consulting GmbH\nGesellschaft mit beschränkter Haftung\nDortmund\n\nDen Gläubigern der an der Verschmelzung beteiligten Rechtsträger ist, wenn sie binnen sechs Monaten nach dem Tag, an dem die Eintragung der Verschmelzung in das Register des Sitzes desjenigen Rechtsträgers, dessen Gläubiger sie sind, nach § 19 Absatz 3 UmwG als bekanntgemacht gilt, ihren Anspruch nach Grund und Höhe schriftlich anmelden, Sicherheit zu leisten, soweit sie nicht Befriedigung verlangen können. Dieses Recht steht den Gläubigern jedoch nur zu, wenn sie glaubhaft machen, dass durch die Verschmelzung die Erfüllung ihrer Forderung gefährdet wird."
    },
    {
      "date": "2025-12-04",
      "id": "139188",
      "original_text": "Einreichung neuer Dokumente\nNordrhein-Westfalen Amtsgericht Duisburg HRB 14848\nDr. Beyer Vermögensverwaltung Aktiengesellschaft – Mülheim an der Ruhr",
      "type": "Einreichung neuer Dokumente",
      "state": "Nordrhein-Westfalen",
      "amtsgericht": "Amtsgericht Duisburg",
      "registernummer": "HRB 14848",
      "registerart": "HRB",
      "company_name": "Dr. Beyer Vermögensverwaltung Aktiengesellschaft",
      "company_seat": "Mülheim an der Ruhr",
      "details": "04.12.2025 (Bekanntmachungsdatum)\n\nNordrhein-Westfalen Amtsgericht Duisburg HRB 14848\nEinreichung neuer Dokumente\n\nDr. Beyer Vermögensverwaltung Aktiengesellschaft\nAktiengesellschaft\nMülheim an der Ruhr\n\nDem Registergericht ist eine Liste der Mitglieder des Aufsichtsrates eingereicht worden."
    },
    {
      "date": "2025-12-04",
      "id": "139189",
      "original_text": "Löschungsankündigung\nNordrhein-Westfalen Amtsgericht Düsseldorf HRB 90518\nNE Handels GmbH – Düsseldorf",
      "type": "Löschungsankündigung",
      "state": "Nordrhein-Westfalen",
      "amtsgericht": "Amtsgericht Düsseldorf",
      "registernummer": "HRB 90518",
      "registerart": "HRB",
      "company_name": "NE Handels GmbH",
      "company_seat": "Düsseldorf",
      "details": "04.12.2025 (Bekanntmachungsdatum)\n\nNordrhein-Westfalen Amtsgericht Düsseldorf HRB 90518\nLöschungsankündigung\n\nNE Handels GmbH\nGesellschaft mit beschränkter Haftung\nDüsseldorf\n\nDas Registergericht beabsichtigt die Gesellschaft von Amts wegen nach § 394 FamFG zu löschen. Die Frist zur Erhebung eines Widerspruchs ist auf 3 Wochen festgesetzt.\n\nRechtsbehelfsbelehrung:\nDas Widerspruchsrecht steht jedem zu, der an der Unterlassung der Löschung ein berechtigtes Interesse hat. Der Widerspruch ist bei dem Amtsgericht Düsseldorf -Registergericht-, Werdener Straße 1, 40227 Düsseldorf schriftlich in deutscher Sprache oder zur Niederschrift der Geschäftsstelle einzulegen. Der Widerspruch kann auch zur Niederschrift der Geschäftsstelle eines jeden Amtsgerichtes abgegeben werden. Die Einlegung ist auch durch Übertragung eines elektronischen Dokuments an die elektronische Poststelle des Gerichts möglich. Das elektronische Dokument muss für die Bearbeitung durch das Gericht geeignet und mit einer qualifizierten elektronischen Signatur der verantwortenden Person versehen sein oder von der verantwortenden Person signiert und auf einem sicheren Übermittlungsweg gemäß § 130a ZPO nach näherer Maßgabe der Verordnung über die technischen Rahmenbedingungen des elektronischen Rechtsverkehrs und über das besondere elektronische Behördenpostfach (BGBl. I, S.3803) eingereicht werden. Weitere Informationen erhalten Sie auf der Internetseite www.justiz.de.\nDer Widerspruch muss spätestens innerhalb der gesetzten Frist nach dem Datum der Bekanntmachung der Löschungsankündigung bei dem Amtsgericht - Registergericht - Düsseldorf eingegangen sein.  Dies gilt auch dann, wenn der Widerspruch zur Niederschrift der Geschäftsstelle eines anderen Amtsgerichtes abgegeben wurde. Die Frist beginnt mit dem Tage der Bekanntmachung der Löschungsankündigung in dem für die Bekanntmachung der Eintragungen in das Handelsregister bestimmten elektronischen Informations- und Kommunikationssystem nach § 10 des Handelsgesetzbuches. Fällt das Ende der Frist auf einen Sonntag, einen allgemeinen Feiertag oder Sonnabend, so endet die Frist mit Ablauf des nächsten Werktages.\nDer Widerspruch muss die Bezeichnung der angefochtenen Löschungsankündigung sowie die Erklärung enthalten, dass Widerspruch gegen diese Löschungsankündigung eingelegt wird. Er ist zu unterzeichnen und soll begründet werden."
    },
    {
      "date": "2025-12-04",
      "id": "139190",
      "original_text": "Löschungsankündigung\nNordrhein-Westfalen Amtsgericht Düsseldorf HRB 86050\nPolar Region Products and Services GmbH – Düsseldorf",
      "type": "Löschungsankündigung",
      "state": "Nordrhein-Westfalen",
      "amtsgericht": "Amtsgericht Düsseldorf",
      "registernummer": "HRB 86050",
      "registerart": "HRB",
      "company_name": "Polar Region Products and Services GmbH",
      "company_seat": "Düsseldorf",
      "details": "04.12.2025 (Bekanntmachungsdatum)\n\nNordrhein-Westfalen Amtsgericht Düsseldorf HRB 86050\nLöschungsankündigung\n\nPolar Region Products and Services GmbH\nGesellschaft mit beschränkter Haftung\nDüsseldorf\n\nDas Registergericht beabsichtigt die Gesellschaft von Amts wegen nach § 394  Abs. 1 FamFG zu löschen. Die Frist zur Erhebung eines Widerspruchs ist auf\n3 Wochen festgesetzt.\n\nRechtsbehelfsbelehrung:\nDas Widerspruchsrecht steht jedem zu, der an der Unterlassung der Löschung ein berechtigtes Interesse hat. Der Widerspruch ist bei dem Amtsgericht Düsseldorf -Registergericht-, Werdener Straße 1, 40227 Düsseldorf schriftlich in deutscher Sprache oder zur Niederschrift der Geschäftsstelle einzulegen. Der Widerspruch kann auch zur Niederschrift der Geschäftsstelle eines jeden Amtsgerichtes abgegeben werden. Die Einlegung ist auch durch Übertragung eines elektronischen Dokuments an die elektronische Poststelle des Gerichts möglich. Das elektronische Dokument muss für die Bearbeitung durch das Gericht geeignet und mit einer qualifizierten elektronischen Signatur der verantwortenden Person versehen sein oder von der verantwortenden Person signiert und auf einem sicheren Übermittlungsweg gemäß § 130a ZPO nach näherer Maßgabe der Verordnung über die technischen Rahmenbedingungen des elektronischen Rechtsverkehrs und über das besondere elektronische Behördenpostfach (BGBl. I, S.3803) eingereicht werden. Weitere Informationen erhalten Sie auf der Internetseite www.justiz.de.\nDer Widerspruch muss spätestens innerhalb der gesetzten Frist nach dem Datum der Bekanntmachung der Löschungsankündigung bei dem Amtsgericht - Registergericht - Düsseldorf eingegangen sein.  Dies gilt auch dann, wenn der Widerspruch zur Niederschrift der Geschäftsstelle eines anderen Amtsgerichtes abgegeben wurde. Die Frist beginnt mit dem Tage der Bekanntmachung der Löschungsankündigung in dem für die Bekanntmachung der Eintragungen in das Handelsregister bestimmten elektronischen Informations- und Kommunikationssystem nach § 10 des Handelsgesetzbuches. Fällt das Ende der Frist auf einen Sonntag, einen allgemeinen Feiertag oder Sonnabend, so endet die Frist mit Ablauf des nächsten Werktages.\nDer Widerspruch muss die Bezeichnung der angefochtenen Löschungsankündigung sowie die Erklärung enthalten, dass Widerspruch gegen diese Löschungsankündigung eingelegt wird. Er ist zu unterzeichnen und soll begründet werden."
    },
    {
      "date": "2025-12-04",
      "id": "139191",
      "original_text": "Registerbekanntmachung nach dem Umwandlungsgesetz\nNordrhein-Westfalen Amtsgericht Arnsberg HRB 16199\nWottschel Investment GmbH – Warstein",
      "type": "Registerbekanntmachung nach dem Umwandlungsgesetz",
      "state": "Nordrhein-Westfalen",
      "amtsgericht": "Amtsgericht Arnsberg",
      "registernummer": "HRB 16199",
      "registerart": "HRB",
      "company_name": "Wottschel Investment GmbH",
      "company_seat": "Warstein",
      "details": "04.12.2025 (Bekanntmachungsdatum)\n\nNordrhein-Westfalen Amtsgericht Arnsberg HRB 16199\nRegisterbekanntmachung nach dem Umwandlungsgesetz 04.12.2025 (Eintragungsdatum)\n\nWottschel Investment GmbH\nGesellschaft mit beschränkter Haftung\nWarstein\n\nDen Gläubigern der an der Ausgliederung beteiligten Rechtsträger ist, wenn sie binnen sechs Monaten nach dem Tag, an dem die Eintragung der Ausgliederung in das Register des Sitzes desjenigen Rechtsträgers, dessen Gläubiger sie sind, nach § 19 Absatz 3 UmwG als bekanntgemacht gilt, ihren Anspruch nach Grund und Höhe schriftlich anmelden, Sicherheit zu leisten, soweit sie nicht Befriedigung verlangen können. Dieses Recht steht den Gläubigern jedoch nur zu, wenn sie glaubhaft machen, dass durch die Ausgliederung die Erfüllung ihrer Forderung gefährdet wird."
    },
    {
      "date": "2025-12-04",
      "id": "139192",
      "original_text": "Löschungsankündigung\nThüringen Amtsgericht Jena HRB 516280\nFrank´s Brauerei UG (haftungsbeschränkt) – Gera",
      "type": "Löschungsankündigung",
      "state": "Thüringen",
      "amtsgericht": "Amtsgericht Jena",
      "registernummer": "HRB 516280",
      "registerart": "HRB",
      "company_name": "Frank´s Brauerei UG (haftungsbeschränkt)",
      "company_seat": "Gera",
      "details": "04.12.2025 (Bekanntmachungsdatum)\n\nThüringen Amtsgericht Jena HRB 516280\nLöschungsankündigung\n\nFrank´s Brauerei UG (haftungsbeschränkt)\nGesellschaft mit beschränkter Haftung\nGera\n\nDas Registergericht beabsichtigt, die im Handelsregister eingetragene Gesellschaft wegen Vermögenslosigkeit nach § 394 FamFG von Amts wegen zu löschen. Die Frist zur Erhebung eines Widerspruchs gegen die beabsichtigte Löschung wird auf 6 Wochen festgesetzt."
    },
    {
      "date": "2025-12-04",
      "id": "139193",
      "original_text": "Löschungsankündigung\nHessen Amtsgericht Frankfurt am Main HRB 97124\nRB Bau GmbH – Frankfurt am Main",
      "type": "Löschungsankündigung",
      "state": "Hessen",
      "amtsgericht": "Amtsgericht Frankfurt am Main",
      "registernummer": "HRB 97124",
      "registerart": "HRB",
      "company_name": "RB Bau GmbH",
      "company_seat": "Frankfurt am Main",
      "details": "04.12.2025 (Bekanntmachungsdatum)\n\nHessen Amtsgericht Frankfurt am Main HRB 97124\nLöschungsankündigung\n\nRB Bau GmbH\nGesellschaft mit beschränkter Haftung\nFrankfurt am Main\n\nDas Registergericht beabsichtigt die im Handelsregister eingetragene Gesellschaft von Amts wegen nach § 394 FamFG zu löschen. Die Frist zur Erhebung eines Widerspruchs gegen die beabsichtigte Löschung wird auf 3 Monate festgesetzt."
    },
    {
      "date": "2025-12-04",
      "id": "139194",
      "original_text": "Sonstige Registerbekanntmachung\nHessen Amtsgericht Frankfurt am Main HRB 51854\nDB RegioNetz Infrastruktur GmbH – Frankfurt am Main",
      "type": "Sonstige Registerbekanntmachung",
      "state": "Hessen",
      "amtsgericht": "Amtsgericht Frankfurt am Main",
      "registernummer": "HRB 51854",
      "registerart": "HRB",
      "company_name": "DB RegioNetz Infrastruktur GmbH",
      "company_seat": "Frankfurt am Main",
      "details": "04.12.2025 (Bekanntmachungsdatum)\n\nHessen Amtsgericht Frankfurt am Main HRB 51854\nSonstige Registerbekanntmachung 04.12.2025 (Eintragungsdatum)\n\nDB RegioNetz Infrastruktur GmbH\nGesellschaft mit beschränkter Haftung\nFrankfurt am Main\n\nDurch eine Änderung in den Personen der Aufsichtsratsmitglieder ist eine Liste der Mitglieder des Aufsichtsrates zum Handelsregister eingereicht worden."
    }
  ]
}