{
  "date": "2025-12-19",
  "date_of_scrape": "2025-12-20T04:13:47.546Z",
  "tool_version": "0.2.0",
  "number_of_announcements": 148,
  "announcements": [
    {
      "date": "2025-12-19",
      "id": "140544",
      "original_text": "Sonstige Registerbekanntmachung\nBayern Amtsgericht Fürth HRB 1520\nSchischek GmbH – Langenzenn",
      "type": "Sonstige Registerbekanntmachung",
      "state": "Bayern",
      "amtsgericht": "Amtsgericht Fürth",
      "registernummer": "HRB 1520",
      "registerart": "HRB",
      "company_name": "Schischek GmbH",
      "company_seat": "Langenzenn",
      "details": "19.12.2025 (Bekanntmachungsdatum)\n\nBayern Amtsgericht Fürth HRB 1520\nSonstige Registerbekanntmachung 18.12.2025 (Eintragungsdatum)\n\nSchischek GmbH\nGesellschaft mit beschränkter Haftung\nLangenzenn\n\nDen Gläubigern der Gesellschaft, deren Forderungen begründet worden sind, bevor die Eintragung der Beendigung des Gewinnabführungsvertrages in das Handelsregister nach § 10 des Handelsgesetzbuches als bekanntgemacht gilt, hat der andere Vertragsteil Sicherheit zu leisten, wenn sie sich binnen sechs Monaten nach der Bekanntmachung der Eintragung zu diesem Zweck bei ihm melden."
    },
    {
      "date": "2025-12-19",
      "id": "140545",
      "original_text": "Löschungsankündigung\nBayern Amtsgericht Passau HRB 9568\nAR-BOL ISOBAU UG (haftungsbeschränkt) – Pocking",
      "type": "Löschungsankündigung",
      "state": "Bayern",
      "amtsgericht": "Amtsgericht Passau",
      "registernummer": "HRB 9568",
      "registerart": "HRB",
      "company_name": "AR-BOL ISOBAU UG (haftungsbeschränkt)",
      "company_seat": "Pocking",
      "details": "19.12.2025 (Bekanntmachungsdatum)\n\nBayern Amtsgericht Passau HRB 9568\nLöschungsankündigung\n\nAR-BOL ISOBAU UG (haftungsbeschränkt)\nGesellschaft mit beschränkter Haftung\nPocking\n\nDas Registergericht beabsichtigt, die im Handelsregister eingetragene Gesellschaft wegen Vermögenslosigkeit von Amts wegen nach § 394 FamFG zu löschen. Die Frist zur Erhebung eines Widerspruchs ist auf einen Monat festgesetzt."
    },
    {
      "date": "2025-12-19",
      "id": "140546",
      "original_text": "Registerbekanntmachung nach dem Umwandlungsgesetz\nBayern Amtsgericht München HRB 237593\nASI GmbH – Unterföhring",
      "type": "Registerbekanntmachung nach dem Umwandlungsgesetz",
      "state": "Bayern",
      "amtsgericht": "Amtsgericht München",
      "registernummer": "HRB 237593",
      "registerart": "HRB",
      "company_name": "ASI GmbH",
      "company_seat": "Unterföhring",
      "details": "19.12.2025 (Bekanntmachungsdatum)\n\nBayern Amtsgericht München HRB 237593\nRegisterbekanntmachung nach dem Umwandlungsgesetz 18.12.2025 (Eintragungsdatum)\n\nASI GmbH\nGesellschaft mit beschränkter Haftung\nUnterföhring\n\nDen Gläubigern der an der Verschmelzung beteiligten Rechtsträger ist, wenn sie binnen sechs Monaten nach dem Tag, an dem die Eintragung der Verschmelzung in das Register des Sitzes desjenigen Rechtsträgers, dessen Gläubiger sie sind, nach § 19 Abs. 3 UmwG als bekannt gemacht gilt, ihren Anspruch nach Grund und Höhe in Textform anmelden, Sicherheit zu leisten, soweit sie nicht Befriedigung verlangen können. Dieses Recht steht den Gläubigern jedoch nur zu, wenn sie glaubhaft machen, dass durch die Verschmelzung die Erfüllung ihrer Forderung gefährdet wird."
    },
    {
      "date": "2025-12-19",
      "id": "140547",
      "original_text": "Registerbekanntmachung nach dem Umwandlungsgesetz\nBayern Amtsgericht München HRB 302270\nWEKA Media Holding GmbH – München",
      "type": "Registerbekanntmachung nach dem Umwandlungsgesetz",
      "state": "Bayern",
      "amtsgericht": "Amtsgericht München",
      "registernummer": "HRB 302270",
      "registerart": "HRB",
      "company_name": "WEKA Media Holding GmbH",
      "company_seat": "München",
      "details": "19.12.2025 (Bekanntmachungsdatum)\n\nBayern Amtsgericht München HRB 302270\nRegisterbekanntmachung nach dem Umwandlungsgesetz 18.12.2025 (Eintragungsdatum)\n\nWEKA Media Holding GmbH\nGesellschaft mit beschränkter Haftung\nMünchen\n\nDen Gläubigern der an der Spaltung beteiligten Rechtsträger ist, wenn sie binnen sechs Monaten nach dem Tag, an dem die Eintragung der Spaltung in das Register des Sitzes desjenigen Rechtsträgers, dessen Gläubiger sie sind, nach §§ 125, 19 Abs. 3 UmwG als bekannt gemacht gilt, ihren Anspruch nach Grund und Höhe in Textform anmelden, Sicherheit zu leisten, soweit sie nicht Befriedigung verlangen können. Dieses Recht steht den Gläubigern jedoch nur zu, wenn sie glaubhaft machen, dass durch die Spaltung die Erfüllung ihrer Forderung gefährdet wird."
    },
    {
      "date": "2025-12-19",
      "id": "140548",
      "original_text": "Einreichung neuer Dokumente\nBayern Amtsgericht Nürnberg HRB 21250\nMartha-Maria Service GmbH – Nürnberg",
      "type": "Einreichung neuer Dokumente",
      "state": "Bayern",
      "amtsgericht": "Amtsgericht Nürnberg",
      "registernummer": "HRB 21250",
      "registerart": "HRB",
      "company_name": "Martha-Maria Service GmbH",
      "company_seat": "Nürnberg",
      "details": "19.12.2025 (Bekanntmachungsdatum)\n\nBayern Amtsgericht Nürnberg HRB 21250\nEinreichung neuer Dokumente\n\nMartha-Maria Service GmbH\nGesellschaft mit beschränkter Haftung\nNürnberg\n\nDem Amtsgericht Nürnberg -Registergericht- ist eine Liste der Mitglieder des Aufsichtsrats eingereicht worden, § 52 Abs. 3 S. 2 GmbHG."
    },
    {
      "date": "2025-12-19",
      "id": "140549",
      "original_text": "Registerbekanntmachung nach dem Umwandlungsgesetz\nBayern Amtsgericht Nürnberg HRB 45377\nRSN GmbH – Nürnberg",
      "type": "Registerbekanntmachung nach dem Umwandlungsgesetz",
      "state": "Bayern",
      "amtsgericht": "Amtsgericht Nürnberg",
      "registernummer": "HRB 45377",
      "registerart": "HRB",
      "company_name": "RSN GmbH",
      "company_seat": "Nürnberg",
      "details": "19.12.2025 (Bekanntmachungsdatum)\n\nBayern Amtsgericht Nürnberg HRB 45377\nRegisterbekanntmachung nach dem Umwandlungsgesetz 18.12.2025 (Eintragungsdatum)\n\nRSN GmbH\nGesellschaft mit beschränkter Haftung\nNürnberg\n\nDen Gläubigern der an der Ausgliederung beteiligten Rechtsträger ist, wenn sie binnen sechs Monaten nach dem Tag, an dem die Eintragung der Ausgliederung in das Register des Sitzes desjenigen Rechtsträgers, dessen Gläubiger sie sind, nach §§ 125, 19 Abs. 3 UmwG als bekannt gemacht gilt, ihren Anspruch nach Grund und Höhe in Textform anmelden, Sicherheit zu leisten, soweit sie nicht Befriedigung verlangen können. Dieses Recht steht den Gläubigern jedoch nur zu, wenn sie glaubhaft machen, dass durch die Ausgliederung die Erfüllung ihrer Forderung gefährdet wird."
    },
    {
      "date": "2025-12-19",
      "id": "140550",
      "original_text": "Registerbekanntmachung nach dem Umwandlungsgesetz\nBayern Amtsgericht Fürth HRB 19061\nTrionity GmbH – Fürth",
      "type": "Registerbekanntmachung nach dem Umwandlungsgesetz",
      "state": "Bayern",
      "amtsgericht": "Amtsgericht Fürth",
      "registernummer": "HRB 19061",
      "registerart": "HRB",
      "company_name": "Trionity GmbH",
      "company_seat": "Fürth",
      "details": "19.12.2025 (Bekanntmachungsdatum)\n\nBayern Amtsgericht Fürth HRB 19061\nRegisterbekanntmachung nach dem Umwandlungsgesetz 18.12.2025 (Eintragungsdatum)\n\nTrionity GmbH\nGesellschaft mit beschränkter Haftung\nFürth\n\nDen Gläubigern der an der Verschmelzung beteiligten Rechtsträger ist, wenn sie binnen sechs Monaten nach dem Tag, an dem die Eintragung der Verschmelzung in das Register des Sitzes desjenigen Rechtsträgers, dessen Gläubiger sie sind, nach § 19 Abs. 3 UmwG als bekannt gemacht gilt, ihren Anspruch nach Grund und Höhe in Textform anmelden, Sicherheit zu leisten, soweit sie nicht Befriedigung verlangen können. Dieses Recht steht den Gläubigern jedoch nur zu, wenn sie glaubhaft machen, dass durch die Verschmelzung die Erfüllung ihrer Forderung gefährdet wird."
    },
    {
      "date": "2025-12-19",
      "id": "140551",
      "original_text": "Registerbekanntmachung nach dem Umwandlungsgesetz\nBayern Amtsgericht Fürth HRB 14517\nPegasus Capital Partners GmbH – Erlangen",
      "type": "Registerbekanntmachung nach dem Umwandlungsgesetz",
      "state": "Bayern",
      "amtsgericht": "Amtsgericht Fürth",
      "registernummer": "HRB 14517",
      "registerart": "HRB",
      "company_name": "Pegasus Capital Partners GmbH",
      "company_seat": "Erlangen",
      "details": "19.12.2025 (Bekanntmachungsdatum)\n\nBayern Amtsgericht Fürth HRB 14517\nRegisterbekanntmachung nach dem Umwandlungsgesetz 18.12.2025 (Eintragungsdatum)\n\nPegasus Capital Partners GmbH\nGesellschaft mit beschränkter Haftung\nErlangen\n\nDen Gläubigern der an der Spaltung beteiligten Rechtsträger ist, wenn sie binnen sechs Monaten nach dem Tag, an dem die Eintragung der Spaltung in das Register des Sitzes desjenigen Rechtsträgers, dessen Gläubiger sie sind, nach §§ 125, 19 Abs. 3 UmwG als bekannt gemacht gilt, ihren Anspruch nach Grund und Höhe in Textform anmelden, Sicherheit zu leisten, soweit sie nicht Befriedigung verlangen können. Dieses Recht steht den Gläubigern jedoch nur zu, wenn sie glaubhaft machen, dass durch die Spaltung die Erfüllung ihrer Forderung gefährdet wird."
    },
    {
      "date": "2025-12-19",
      "id": "140552",
      "original_text": "Einreichung neuer Dokumente\nBayern Amtsgericht Memmingen HRB 21145\nCentus AG – Neu-Ulm",
      "type": "Einreichung neuer Dokumente",
      "state": "Bayern",
      "amtsgericht": "Amtsgericht Memmingen",
      "registernummer": "HRB 21145",
      "registerart": "HRB",
      "company_name": "Centus AG",
      "company_seat": "Neu-Ulm",
      "details": "19.12.2025 (Bekanntmachungsdatum)\n\nBayern Amtsgericht Memmingen HRB 21145\nEinreichung neuer Dokumente\n\nCentus AG\nAktiengesellschaft\nNeu-Ulm\n\nDem Amtsgericht Memmingen -Registergericht- ist eine Liste der Mitglieder des Aufsichtsrats eingereicht worden, § 106 AktG."
    },
    {
      "date": "2025-12-19",
      "id": "140553",
      "original_text": "Sonstige Registerbekanntmachung\nBayern Amtsgericht Bayreuth HRB 8600\nWalraven Holding GmbH – Bayreuth",
      "type": "Sonstige Registerbekanntmachung",
      "state": "Bayern",
      "amtsgericht": "Amtsgericht Bayreuth",
      "registernummer": "HRB 8600",
      "registerart": "HRB",
      "company_name": "Walraven Holding GmbH",
      "company_seat": "Bayreuth",
      "details": "19.12.2025 (Bekanntmachungsdatum)\n\nBayern Amtsgericht Bayreuth HRB 8600\nSonstige Registerbekanntmachung 18.12.2025 (Eintragungsdatum)\n\nWalraven Holding GmbH\nGesellschaft mit beschränkter Haftung\nBayreuth\n\nDen Gläubigern des formwechselnden Rechtsträgers ist, wenn sie binnen sechs Monaten nach dem Tag, an dem die Eintragung des Formwechsels nach § 201 UmwG als bekannt gemacht gilt, ihren Anspruch nach Grund und Höhe in Textform anmelden, Sicherheit zu leisten, soweit sie nicht Befriedigung verlangen können. Dieses Recht steht den Gläubigern jedoch nur zu, wenn sie glaubhaft machen, dass durch den Formwechsel die Erfüllung ihrer Forderung gefährdet wird."
    },
    {
      "date": "2025-12-19",
      "id": "140554",
      "original_text": "Registerbekanntmachung nach dem Umwandlungsgesetz\nBayern Amtsgericht Deggendorf HRB 4772\nDGD Verwaltungs GmbH – Deggendorf",
      "type": "Registerbekanntmachung nach dem Umwandlungsgesetz",
      "state": "Bayern",
      "amtsgericht": "Amtsgericht Deggendorf",
      "registernummer": "HRB 4772",
      "registerart": "HRB",
      "company_name": "DGD Verwaltungs GmbH",
      "company_seat": "Deggendorf",
      "details": "19.12.2025 (Bekanntmachungsdatum)\n\nBayern Amtsgericht Deggendorf HRB 4772\nRegisterbekanntmachung nach dem Umwandlungsgesetz 18.12.2025 (Eintragungsdatum)\n\nDGD Verwaltungs GmbH\nGesellschaft mit beschränkter Haftung\nDeggendorf\n\nDen Gläubigern der an der Verschmelzung beteiligten Rechtsträger ist, wenn sie binnen sechs Monaten nach dem Tag, an dem die Eintragung der Verschmelzung in das Register des Sitzes desjenigen Rechtsträgers, dessen Gläubiger sie sind, nach § 19 Abs. 3 UmwG als bekannt gemacht gilt, ihren Anspruch nach Grund und Höhe in Textform anmelden, Sicherheit zu leisten, soweit sie nicht Befriedigung verlangen können. Dieses Recht steht den Gläubigern jedoch nur zu, wenn sie glaubhaft machen, dass durch die Verschmelzung die Erfüllung ihrer Forderung gefährdet wird."
    },
    {
      "date": "2025-12-19",
      "id": "140555",
      "original_text": "Löschungsankündigung\nBayern Amtsgericht München HRB 177492\nVPS Video Protection Service GmbH – München",
      "type": "Löschungsankündigung",
      "state": "Bayern",
      "amtsgericht": "Amtsgericht München",
      "registernummer": "HRB 177492",
      "registerart": "HRB",
      "company_name": "VPS Video Protection Service GmbH",
      "company_seat": "München",
      "details": "19.12.2025 (Bekanntmachungsdatum)\n\nBayern Amtsgericht München HRB 177492\nLöschungsankündigung\n\nVPS Video Protection Service GmbH\nGesellschaft mit beschränkter Haftung\nMünchen\n\nDas Registergericht beabsichtigt, die im Handelsregister eingetragene Gesellschaft wegen Vermögenslosigkeit von Amts wegen nach § 394 FamFG zu löschen. Die Frist zur Erhebung eines Widerspruchs ist auf drei Monate festgesetzt."
    },
    {
      "date": "2025-12-19",
      "id": "140556",
      "original_text": "Einreichung neuer Dokumente\nBayern Amtsgericht Würzburg HRB 12609\nOMB AG Online.Marketing.Berater. – Würzburg",
      "type": "Einreichung neuer Dokumente",
      "state": "Bayern",
      "amtsgericht": "Amtsgericht Würzburg",
      "registernummer": "HRB 12609",
      "registerart": "HRB",
      "company_name": "OMB AG Online.Marketing.Berater.",
      "company_seat": "Würzburg",
      "details": "19.12.2025 (Bekanntmachungsdatum)\n\nBayern Amtsgericht Würzburg HRB 12609\nEinreichung neuer Dokumente\n\nOMB AG Online.Marketing.Berater.\nAktiengesellschaft\nWürzburg\n\nDem Amtsgericht Würzburg -Registergericht- ist eine Liste der Mitglieder des Aufsichtsrats eingereicht worden, § 106 AktG."
    },
    {
      "date": "2025-12-19",
      "id": "140557",
      "original_text": "Registerbekanntmachung nach dem Umwandlungsgesetz\nBayern Amtsgericht Deggendorf HRB 4915\nRSD Grundstücks GmbH – Deggendorf",
      "type": "Registerbekanntmachung nach dem Umwandlungsgesetz",
      "state": "Bayern",
      "amtsgericht": "Amtsgericht Deggendorf",
      "registernummer": "HRB 4915",
      "registerart": "HRB",
      "company_name": "RSD Grundstücks GmbH",
      "company_seat": "Deggendorf",
      "details": "19.12.2025 (Bekanntmachungsdatum)\n\nBayern Amtsgericht Deggendorf HRB 4915\nRegisterbekanntmachung nach dem Umwandlungsgesetz 18.12.2025 (Eintragungsdatum)\n\nRSD Grundstücks GmbH\nGesellschaft mit beschränkter Haftung\nDeggendorf\n\nDen Gläubigern der an der Verschmelzung beteiligten Rechtsträger ist, wenn sie binnen sechs Monaten nach dem Tag, an dem die Eintragung der Verschmelzung in das Register des Sitzes desjenigen Rechtsträgers, dessen Gläubiger sie sind, nach § 19 Abs. 3 UmwG als bekannt gemacht gilt, ihren Anspruch nach Grund und Höhe in Textform anmelden, Sicherheit zu leisten, soweit sie nicht Befriedigung verlangen können. Dieses Recht steht den Gläubigern jedoch nur zu, wenn sie glaubhaft machen, dass durch die Verschmelzung die Erfüllung ihrer Forderung gefährdet wird."
    },
    {
      "date": "2025-12-19",
      "id": "140558",
      "original_text": "Registerbekanntmachung nach dem Umwandlungsgesetz\nBayern Amtsgericht München HRB 237105\nELT TopCo GmbH – Puchheim",
      "type": "Registerbekanntmachung nach dem Umwandlungsgesetz",
      "state": "Bayern",
      "amtsgericht": "Amtsgericht München",
      "registernummer": "HRB 237105",
      "registerart": "HRB",
      "company_name": "ELT TopCo GmbH",
      "company_seat": "Puchheim",
      "details": "19.12.2025 (Bekanntmachungsdatum)\n\nBayern Amtsgericht München HRB 237105\nRegisterbekanntmachung nach dem Umwandlungsgesetz 18.12.2025 (Eintragungsdatum)\n\nELT TopCo GmbH\nGesellschaft mit beschränkter Haftung\nPuchheim\n\nDen Gläubigern der an der Verschmelzung beteiligten Rechtsträger ist, wenn sie binnen sechs Monaten nach dem Tag, an dem die Eintragung der Verschmelzung in das Register des Sitzes desjenigen Rechtsträgers, dessen Gläubiger sie sind, nach § 19 Abs. 3 UmwG als bekannt gemacht gilt, ihren Anspruch nach Grund und Höhe in Textform anmelden, Sicherheit zu leisten, soweit sie nicht Befriedigung verlangen können. Dieses Recht steht den Gläubigern jedoch nur zu, wenn sie glaubhaft machen, dass durch die Verschmelzung die Erfüllung ihrer Forderung gefährdet wird."
    },
    {
      "date": "2025-12-19",
      "id": "140559",
      "original_text": "Löschungsankündigung\nBayern Amtsgericht Hof HRB 5558\nSERAKOM GmbH – Hof",
      "type": "Löschungsankündigung",
      "state": "Bayern",
      "amtsgericht": "Amtsgericht Hof",
      "registernummer": "HRB 5558",
      "registerart": "HRB",
      "company_name": "SERAKOM GmbH",
      "company_seat": "Hof",
      "details": "19.12.2025 (Bekanntmachungsdatum)\n\nBayern Amtsgericht Hof HRB 5558\nLöschungsankündigung\n\nSERAKOM GmbH\nGesellschaft mit beschränkter Haftung\nHof\n\nDas Registergericht beabsichtigt, die im Handelsregister eingetragene Gesellschaft wegen Vermögenslosigkeit von Amts wegen nach § 394 FamFG zu löschen. Die Frist zur Erhebung eines Widerspruchs ist auf sechs Wochen festgesetzt."
    },
    {
      "date": "2025-12-19",
      "id": "140560",
      "original_text": "Löschungsankündigung\nBayern Amtsgericht Hof HRB 6324\nSicherstadt GmbH – Hohenberg",
      "type": "Löschungsankündigung",
      "state": "Bayern",
      "amtsgericht": "Amtsgericht Hof",
      "registernummer": "HRB 6324",
      "registerart": "HRB",
      "company_name": "Sicherstadt GmbH",
      "company_seat": "Hohenberg",
      "details": "19.12.2025 (Bekanntmachungsdatum)\n\nBayern Amtsgericht Hof HRB 6324\nLöschungsankündigung\n\nSicherstadt GmbH\nGesellschaft mit beschränkter Haftung\nHohenberg\n\nDas Registergericht beabsichtigt, die im Handelsregister eingetragene Gesellschaft wegen Vermögenslosigkeit von Amts wegen nach § 394 FamFG zu löschen. Die Frist zur Erhebung eines Widerspruchs ist auf sechs Wochen festgesetzt."
    },
    {
      "date": "2025-12-19",
      "id": "140561",
      "original_text": "Registerbekanntmachung nach dem Umwandlungsgesetz\nBayern Amtsgericht München HRB 289088\nPNZ B24 Beteiligungs UG (haftungsbeschränkt) – München",
      "type": "Registerbekanntmachung nach dem Umwandlungsgesetz",
      "state": "Bayern",
      "amtsgericht": "Amtsgericht München",
      "registernummer": "HRB 289088",
      "registerart": "HRB",
      "company_name": "PNZ B24 Beteiligungs UG (haftungsbeschränkt)",
      "company_seat": "München",
      "details": "19.12.2025 (Bekanntmachungsdatum)\n\nBayern Amtsgericht München HRB 289088\nRegisterbekanntmachung nach dem Umwandlungsgesetz 18.12.2025 (Eintragungsdatum)\n\nPNZ B24 Beteiligungs UG (haftungsbeschränkt)\nGesellschaft mit beschränkter Haftung\nMünchen\n\nDen Gläubigern der an der Verschmelzung beteiligten Rechtsträger ist, wenn sie binnen sechs Monaten nach dem Tag, an dem die Eintragung der Verschmelzung in das Register des Sitzes desjenigen Rechtsträgers, dessen Gläubiger sie sind, nach § 19 Abs. 3 UmwG als bekannt gemacht gilt, ihren Anspruch nach Grund und Höhe in Textform anmelden, Sicherheit zu leisten, soweit sie nicht Befriedigung verlangen können. Dieses Recht steht den Gläubigern jedoch nur zu, wenn sie glaubhaft machen, dass durch die Verschmelzung die Erfüllung ihrer Forderung gefährdet wird."
    },
    {
      "date": "2025-12-19",
      "id": "140562",
      "original_text": "Registerbekanntmachung nach dem Umwandlungsgesetz\nBayern Amtsgericht München HRB 275582\nPhoenix Holographix GmbH – Pliening",
      "type": "Registerbekanntmachung nach dem Umwandlungsgesetz",
      "state": "Bayern",
      "amtsgericht": "Amtsgericht München",
      "registernummer": "HRB 275582",
      "registerart": "HRB",
      "company_name": "Phoenix Holographix GmbH",
      "company_seat": "Pliening",
      "details": "19.12.2025 (Bekanntmachungsdatum)\n\nBayern Amtsgericht München HRB 275582\nRegisterbekanntmachung nach dem Umwandlungsgesetz 18.12.2025 (Eintragungsdatum)\n\nPhoenix Holographix GmbH\nGesellschaft mit beschränkter Haftung\nPliening\n\nDen Gläubigern der an der Verschmelzung beteiligten Rechtsträger ist, wenn sie binnen sechs Monaten nach dem Tag, an dem die Eintragung der Verschmelzung in das Register des Sitzes desjenigen Rechtsträgers, dessen Gläubiger sie sind, nach § 19 Abs. 3 UmwG als bekannt gemacht gilt, ihren Anspruch nach Grund und Höhe in Textform anmelden, Sicherheit zu leisten, soweit sie nicht Befriedigung verlangen können. Dieses Recht steht den Gläubigern jedoch nur zu, wenn sie glaubhaft machen, dass durch die Verschmelzung die Erfüllung ihrer Forderung gefährdet wird."
    },
    {
      "date": "2025-12-19",
      "id": "140563",
      "original_text": "Registerbekanntmachung nach dem Umwandlungsgesetz\nBayern Amtsgericht Bayreuth HRA 3917\nWalraven Holding GmbH & Co.KG – Bayreuth",
      "type": "Registerbekanntmachung nach dem Umwandlungsgesetz",
      "state": "Bayern",
      "amtsgericht": "Amtsgericht Bayreuth",
      "registernummer": "HRA 3917",
      "registerart": "HRA",
      "company_name": "Walraven Holding GmbH & Co.KG",
      "company_seat": "Bayreuth",
      "details": "19.12.2025 (Bekanntmachungsdatum)\n\nBayern Amtsgericht Bayreuth HRA 3917\nRegisterbekanntmachung nach dem Umwandlungsgesetz 18.12.2025 (Eintragungsdatum)\n\nWalraven Holding GmbH & Co.KG\nKommanditgesellschaft\nBayreuth\n\nDen Gläubigern des formwechselnden Rechtsträgers ist, wenn sie binnen sechs Monaten nach dem Tag, an dem die Eintragung des Formwechsels nach § 201 UmwG als bekannt gemacht gilt, ihren Anspruch nach Grund und Höhe in Textform anmelden, Sicherheit zu leisten, soweit sie nicht Befriedigung verlangen können. Dieses Recht steht den Gläubigern jedoch nur zu, wenn sie glaubhaft machen, dass durch den Formwechsel die Erfüllung ihrer Forderung gefährdet wird."
    },
    {
      "date": "2025-12-19",
      "id": "140564",
      "original_text": "Löschungsankündigung\nBayern Amtsgericht Hof HRB 5604\nPPT Professional Photo Traveling UG (haftungsbeschränkt) – Hof",
      "type": "Löschungsankündigung",
      "state": "Bayern",
      "amtsgericht": "Amtsgericht Hof",
      "registernummer": "HRB 5604",
      "registerart": "HRB",
      "company_name": "PPT Professional Photo Traveling UG (haftungsbeschränkt)",
      "company_seat": "Hof",
      "details": "19.12.2025 (Bekanntmachungsdatum)\n\nBayern Amtsgericht Hof HRB 5604\nLöschungsankündigung\n\nPPT Professional Photo Traveling UG (haftungsbeschränkt)\nGesellschaft mit beschränkter Haftung\nHof\n\nDas Registergericht beabsichtigt, die im Handelsregister eingetragene Gesellschaft wegen Vermögenslosigkeit von Amts wegen nach § 394 FamFG zu löschen. #insert(Text=\"zztb_V_Widerspruchsfrist\")"
    },
    {
      "date": "2025-12-19",
      "id": "140565",
      "original_text": "Registerbekanntmachung nach dem Umwandlungsgesetz\nBayern Amtsgericht Nürnberg HRA 18494\nRaul Cuc Aces e.K. – Nürnberg",
      "type": "Registerbekanntmachung nach dem Umwandlungsgesetz",
      "state": "Bayern",
      "amtsgericht": "Amtsgericht Nürnberg",
      "registernummer": "HRA 18494",
      "registerart": "HRA",
      "company_name": "Raul Cuc Aces e.K.",
      "company_seat": "Nürnberg",
      "details": "19.12.2025 (Bekanntmachungsdatum)\n\nBayern Amtsgericht Nürnberg HRA 18494\nRegisterbekanntmachung nach dem Umwandlungsgesetz 18.12.2025 (Eintragungsdatum)\n\nRaul Cuc Aces e.K.\nEinzelkaufmann / Einzelkauffrau\nNürnberg\n\nDen Gläubigern der an der Ausgliederung beteiligten Rechtsträger ist, wenn sie binnen sechs Monaten nach dem Tag, an dem die Eintragung der Ausgliederung in das Register des Sitzes desjenigen Rechtsträgers, dessen Gläubiger sie sind, nach §§ 125, 19 Abs. 3 UmwG als bekannt gemacht gilt, ihren Anspruch nach Grund und Höhe in Textform anmelden, Sicherheit zu leisten, soweit sie nicht Befriedigung verlangen können. Dieses Recht steht den Gläubigern jedoch nur zu, wenn sie glaubhaft machen, dass durch die Ausgliederung die Erfüllung ihrer Forderung gefährdet wird."
    },
    {
      "date": "2025-12-19",
      "id": "140566",
      "original_text": "Einreichung neuer Dokumente\nBayern Amtsgericht München HRB 299436\nVINCORION SE – München",
      "type": "Einreichung neuer Dokumente",
      "state": "Bayern",
      "amtsgericht": "Amtsgericht München",
      "registernummer": "HRB 299436",
      "registerart": "HRB",
      "company_name": "VINCORION SE",
      "company_seat": "München",
      "details": "19.12.2025 (Bekanntmachungsdatum)\n\nBayern Amtsgericht München HRB 299436\nEinreichung neuer Dokumente 18.12.2025 (Eintragungsdatum)\n\nVINCORION SE\nEuropäische Aktiengesellschaft (SE)\nMünchen\n\nDem Amtsgericht München -Registergericht- ist eine Liste der Mitglieder des Aufsichtsrats eingereicht worden, Art. 9 Abs. 1 Buchst. c (ii) SE-VO i.V.m. § 106 AktG."
    },
    {
      "date": "2025-12-19",
      "id": "140567",
      "original_text": "Löschungsankündigung\nBayern Amtsgericht Ansbach HRB 2741\nSOLANTIS ENERGY AG – Langenaltheim",
      "type": "Löschungsankündigung",
      "state": "Bayern",
      "amtsgericht": "Amtsgericht Ansbach",
      "registernummer": "HRB 2741",
      "registerart": "HRB",
      "company_name": "SOLANTIS ENERGY AG",
      "company_seat": "Langenaltheim",
      "details": "19.12.2025 (Bekanntmachungsdatum)\n\nBayern Amtsgericht Ansbach HRB 2741\nLöschungsankündigung\n\nSOLANTIS ENERGY AG\nAktiengesellschaft\nLangenaltheim\n\nDas Registergericht beabsichtigt, die im Handelsregister eingetragene Gesellschaft wegen Vermögenslosigkeit von Amts wegen nach § 394 FamFG zu löschen. Die Frist zur Erhebung eines Widerspruchs ist auf sechs Wochen festgesetzt."
    },
    {
      "date": "2025-12-19",
      "id": "140568",
      "original_text": "Einreichung neuer Dokumente\nBayern Amtsgericht Augsburg HRB 27615\nEVB Energieversorgung Bobingen GmbH – Bobingen",
      "type": "Einreichung neuer Dokumente",
      "state": "Bayern",
      "amtsgericht": "Amtsgericht Augsburg",
      "registernummer": "HRB 27615",
      "registerart": "HRB",
      "company_name": "EVB Energieversorgung Bobingen GmbH",
      "company_seat": "Bobingen",
      "details": "19.12.2025 (Bekanntmachungsdatum)\n\nBayern Amtsgericht Augsburg HRB 27615\nEinreichung neuer Dokumente\n\nEVB Energieversorgung Bobingen GmbH\nGesellschaft mit beschränkter Haftung\nBobingen\n\nDem Amtsgericht Augsburg -Registergericht- ist eine Liste der Mitglieder des Aufsichtsrats eingereicht worden, § 52 Abs. 3 S. 2 GmbHG."
    },
    {
      "date": "2025-12-19",
      "id": "140569",
      "original_text": "Registerbekanntmachung nach dem Umwandlungsgesetz\nBayern Amtsgericht Augsburg HRB 38322\nMilana Marks Holding UG (haftungsbeschränkt) – Augsburg",
      "type": "Registerbekanntmachung nach dem Umwandlungsgesetz",
      "state": "Bayern",
      "amtsgericht": "Amtsgericht Augsburg",
      "registernummer": "HRB 38322",
      "registerart": "HRB",
      "company_name": "Milana Marks Holding UG (haftungsbeschränkt)",
      "company_seat": "Augsburg",
      "details": "19.12.2025 (Bekanntmachungsdatum)\n\nBayern Amtsgericht Augsburg HRB 38322\nRegisterbekanntmachung nach dem Umwandlungsgesetz 18.12.2025 (Eintragungsdatum)\n\nMilana Marks Holding UG (haftungsbeschränkt)\nGesellschaft mit beschränkter Haftung\nAugsburg\n\nDen Gläubigern der an der Verschmelzung beteiligten Rechtsträger ist, wenn sie binnen sechs Monaten nach dem Tag, an dem die Eintragung der Verschmelzung in das Register des Sitzes desjenigen Rechtsträgers, dessen Gläubiger sie sind, nach § 19 Abs. 3 UmwG als bekannt gemacht gilt, ihren Anspruch nach Grund und Höhe in Textform anmelden, Sicherheit zu leisten, soweit sie nicht Befriedigung verlangen können. Dieses Recht steht den Gläubigern jedoch nur zu, wenn sie glaubhaft machen, dass durch die Verschmelzung die Erfüllung ihrer Forderung gefährdet wird."
    },
    {
      "date": "2025-12-19",
      "id": "140570",
      "original_text": "Registerbekanntmachung nach dem Umwandlungsgesetz\nBayern Amtsgericht Augsburg HRB 38864\nDMC Production Germany GmbH – Augsburg",
      "type": "Registerbekanntmachung nach dem Umwandlungsgesetz",
      "state": "Bayern",
      "amtsgericht": "Amtsgericht Augsburg",
      "registernummer": "HRB 38864",
      "registerart": "HRB",
      "company_name": "DMC Production Germany GmbH",
      "company_seat": "Augsburg",
      "details": "19.12.2025 (Bekanntmachungsdatum)\n\nBayern Amtsgericht Augsburg HRB 38864\nRegisterbekanntmachung nach dem Umwandlungsgesetz 18.12.2025 (Eintragungsdatum)\n\nDMC Production Germany GmbH\nGesellschaft mit beschränkter Haftung\nAugsburg\n\nDen Gläubigern der an der Verschmelzung beteiligten Rechtsträger ist, wenn sie binnen sechs Monaten nach dem Tag, an dem die Eintragung der Verschmelzung in das Register des Sitzes desjenigen Rechtsträgers, dessen Gläubiger sie sind, nach § 19 Abs. 3 UmwG als bekannt gemacht gilt, ihren Anspruch nach Grund und Höhe in Textform anmelden, Sicherheit zu leisten, soweit sie nicht Befriedigung verlangen können. Dieses Recht steht den Gläubigern jedoch nur zu, wenn sie glaubhaft machen, dass durch die Verschmelzung die Erfüllung ihrer Forderung gefährdet wird."
    },
    {
      "date": "2025-12-19",
      "id": "140571",
      "original_text": "Einreichung neuer Dokumente\nBayern Amtsgericht München HRB 257065\nGenerali Deutschland Krankenversicherung AG – München",
      "type": "Einreichung neuer Dokumente",
      "state": "Bayern",
      "amtsgericht": "Amtsgericht München",
      "registernummer": "HRB 257065",
      "registerart": "HRB",
      "company_name": "Generali Deutschland Krankenversicherung AG",
      "company_seat": "München",
      "details": "19.12.2025 (Bekanntmachungsdatum)\n\nBayern Amtsgericht München HRB 257065\nEinreichung neuer Dokumente\n\nGenerali Deutschland Krankenversicherung AG\nAktiengesellschaft\nMünchen\n\nDem Amtsgericht München -Registergericht- ist eine Liste der Mitglieder des Aufsichtsrats eingereicht worden, § 106 AktG."
    },
    {
      "date": "2025-12-19",
      "id": "140572",
      "original_text": "Einreichung neuer Dokumente\nBayern Amtsgericht Würzburg HRB 7511\nVersorgungsbetrieb Waldbüttelbrunn GmbH – Waldbüttelbrunn",
      "type": "Einreichung neuer Dokumente",
      "state": "Bayern",
      "amtsgericht": "Amtsgericht Würzburg",
      "registernummer": "HRB 7511",
      "registerart": "HRB",
      "company_name": "Versorgungsbetrieb Waldbüttelbrunn GmbH",
      "company_seat": "Waldbüttelbrunn",
      "details": "19.12.2025 (Bekanntmachungsdatum)\n\nBayern Amtsgericht Würzburg HRB 7511\nEinreichung neuer Dokumente\n\nVersorgungsbetrieb Waldbüttelbrunn GmbH\nGesellschaft mit beschränkter Haftung\nWaldbüttelbrunn\n\nDem #Re.Name ist eine Liste der Mitglieder des Aufsichtsrats eingereicht worden, § 52 Abs. 3 S. 2 GmbHG."
    },
    {
      "date": "2025-12-19",
      "id": "140573",
      "original_text": "Registerbekanntmachung nach dem Umwandlungsgesetz\nBayern Amtsgericht München HRA 119842\nMiet Event e.K. – Gilching",
      "type": "Registerbekanntmachung nach dem Umwandlungsgesetz",
      "state": "Bayern",
      "amtsgericht": "Amtsgericht München",
      "registernummer": "HRA 119842",
      "registerart": "HRA",
      "company_name": "Miet Event e.K.",
      "company_seat": "Gilching",
      "details": "19.12.2025 (Bekanntmachungsdatum)\n\nBayern Amtsgericht München HRA 119842\nRegisterbekanntmachung nach dem Umwandlungsgesetz 18.12.2025 (Eintragungsdatum)\n\nMiet Event e.K.\nEinzelkaufmann / Einzelkauffrau\nGilching\n\nDen Gläubigern der an der Ausgliederung beteiligten Rechtsträger ist, wenn sie binnen sechs Monaten nach dem Tag, an dem die Eintragung der Ausgliederung in das Register des Sitzes desjenigen Rechtsträgers, dessen Gläubiger sie sind, nach §§ 125, 19 Abs. 3 UmwG als bekannt gemacht gilt, ihren Anspruch nach Grund und Höhe in Textform anmelden, Sicherheit zu leisten, soweit sie nicht Befriedigung verlangen können. Dieses Recht steht den Gläubigern jedoch nur zu, wenn sie glaubhaft machen, dass durch die Ausgliederung die Erfüllung ihrer Forderung gefährdet wird."
    },
    {
      "date": "2025-12-19",
      "id": "140574",
      "original_text": "Einreichung neuer Dokumente\nBaden-Württemberg Amtsgericht Mannheim HRB 749695\nMittelbadische Bäderbetriebe GmbH – Bühl",
      "type": "Einreichung neuer Dokumente",
      "state": "Baden-Württemberg",
      "amtsgericht": "Amtsgericht Mannheim",
      "registernummer": "HRB 749695",
      "registerart": "HRB",
      "company_name": "Mittelbadische Bäderbetriebe GmbH",
      "company_seat": "Bühl",
      "details": "19.12.2025 (Bekanntmachungsdatum)\n\nBaden-Württemberg Amtsgericht Mannheim HRB 749695\nEinreichung neuer Dokumente 19.12.2025 (Eintragungsdatum)\n\nMittelbadische Bäderbetriebe GmbH\nGesellschaft mit beschränkter Haftung\nBühl\n\nDie Gesellschaft hat am 18.12.2025 die Liste über die Zusammensetzung des Aufsichtsrats zum Handelsregister eingereicht."
    },
    {
      "date": "2025-12-19",
      "id": "140575",
      "original_text": "Registerbekanntmachung nach dem Umwandlungsgesetz\nBaden-Württemberg Amtsgericht Stuttgart HRA 742683\nPKF WULF EMP GmbH & Co. KG Steuerberatungsgesellschaft – Nagold",
      "type": "Registerbekanntmachung nach dem Umwandlungsgesetz",
      "state": "Baden-Württemberg",
      "amtsgericht": "Amtsgericht Stuttgart",
      "registernummer": "HRA 742683",
      "registerart": "HRA",
      "company_name": "PKF WULF EMP GmbH & Co. KG Steuerberatungsgesellschaft",
      "company_seat": "Nagold",
      "details": "19.12.2025 (Bekanntmachungsdatum)\n\nBaden-Württemberg Amtsgericht Stuttgart HRA 742683\nRegisterbekanntmachung nach dem Umwandlungsgesetz 19.12.2025 (Eintragungsdatum)\n\nPKF WULF EMP GmbH & Co. KG Steuerberatungsgesellschaft\nKommanditgesellschaft\nNagold\n\nAls nicht eingetragen wird bekanntgemacht:\nDen Gläubigern der an der Verschmelzung beteiligten Rechtsträger ist, wenn sie binnen sechs Monaten nach dem Tag, an dem die Eintragung der Verschmelzung in das Register des Sitzes desjenigen Rechtsträgers, dessen Gläubiger sie sind, nach § 19 Abs. 3 UmwG als bekanntgemacht gilt, ihren Anspruch nach Grund und Höhe schriftlich anmelden, Sicherheit zu leisten, soweit sie nicht Befriedigung verlangen können. Dieses Recht steht den Gläubigern jedoch nur zu, wenn sie glaubhaft machen, dass durch die Verschmelzung die Erfüllung ihrer Forderung gefährdet wird."
    },
    {
      "date": "2025-12-19",
      "id": "140576",
      "original_text": "Löschungsankündigung\nBerlin Amtsgericht Berlin (Charlottenburg) HRB 275531\nAnadolu et GmbH – Berlin",
      "type": "Löschungsankündigung",
      "state": "Berlin",
      "amtsgericht": "Amtsgericht Berlin (Charlottenburg)",
      "registernummer": "HRB 275531",
      "registerart": "HRB",
      "company_name": "Anadolu et GmbH",
      "company_seat": "Berlin",
      "details": "19.12.2025 (Bekanntmachungsdatum)\n\nBerlin Amtsgericht Berlin (Charlottenburg) HRB 275531\nLöschungsankündigung\n\nAnadolu et GmbH\nGesellschaft mit beschränkter Haftung\nBerlin\n\nBei der nachstehenden Gesellschaft wird das Amtslöschungsverfahren gemäß § 394 FamFG eingeleitet. Widerspruchsfrist 6 Wochen"
    },
    {
      "date": "2025-12-19",
      "id": "140577",
      "original_text": "Einreichung neuer Dokumente\nBerlin Amtsgericht Berlin (Charlottenburg) HRB 141703\nAmbulantis BSW GmbH – Berlin",
      "type": "Einreichung neuer Dokumente",
      "state": "Berlin",
      "amtsgericht": "Amtsgericht Berlin (Charlottenburg)",
      "registernummer": "HRB 141703",
      "registerart": "HRB",
      "company_name": "Ambulantis BSW GmbH",
      "company_seat": "Berlin",
      "details": "19.12.2025 (Bekanntmachungsdatum)\n\nBerlin Amtsgericht Berlin (Charlottenburg) HRB 141703\nEinreichung neuer Dokumente\n\nAmbulantis BSW GmbH\nGesellschaft mit beschränkter Haftung\nBerlin\n\nAls nicht eingetragen wird veröffentlicht: Es wurde eine neue Liste der Beiratsmitglieder eingereicht (§52 GmbHG)."
    },
    {
      "date": "2025-12-19",
      "id": "140578",
      "original_text": "Löschungsankündigung\nBerlin Amtsgericht Berlin (Charlottenburg) HRB 261713\nSales Mansion UG (haftungsbeschränkt) – Berlin",
      "type": "Löschungsankündigung",
      "state": "Berlin",
      "amtsgericht": "Amtsgericht Berlin (Charlottenburg)",
      "registernummer": "HRB 261713",
      "registerart": "HRB",
      "company_name": "Sales Mansion UG (haftungsbeschränkt)",
      "company_seat": "Berlin",
      "details": "19.12.2025 (Bekanntmachungsdatum)\n\nBerlin Amtsgericht Berlin (Charlottenburg) HRB 261713\nLöschungsankündigung\n\nSales Mansion UG (haftungsbeschränkt)\nGesellschaft mit beschränkter Haftung\nBerlin\n\nBei der nachstehenden Gesellschaft wird das Amtslöschungsverfahren gemäß § 394 FamFG eingeleitet. Widerspruchsfrist 6 Wochen"
    },
    {
      "date": "2025-12-19",
      "id": "140579",
      "original_text": "Löschungsankündigung\nBaden-Württemberg Amtsgericht Mannheim HRB 720676\n@T.E.L.L. Trading house for exclusive luxury labels GmbH – Eberbach",
      "type": "Löschungsankündigung",
      "state": "Baden-Württemberg",
      "amtsgericht": "Amtsgericht Mannheim",
      "registernummer": "HRB 720676",
      "registerart": "HRB",
      "company_name": "@T.E.L.L. Trading house for exclusive luxury labels GmbH",
      "company_seat": "Eberbach",
      "details": "19.12.2025 (Bekanntmachungsdatum)\n\nBaden-Württemberg Amtsgericht Mannheim HRB 720676\nLöschungsankündigung\n\n@T.E.L.L. Trading house for exclusive luxury labels GmbH\nGesellschaft mit beschränkter Haftung\nEberbach\n\nDas Gericht beabsichtigt, die Gesellschaft wegen Vermögenslosigkeit im Handelsregister von Amts wegen nach § 394 FamFG zu löschen. Die Frist zur Geltendmachung eines Widerspruchs gegen die beabsichtigte Löschung ist auf einen Monat ab Veröffentlichung bestimmt."
    },
    {
      "date": "2025-12-19",
      "id": "140580",
      "original_text": "Sonstige Registerbekanntmachung\nHamburg Amtsgericht Hamburg HRB 102468\nBaloise Vertriebsservice AG – Hamburg",
      "type": "Sonstige Registerbekanntmachung",
      "state": "Hamburg",
      "amtsgericht": "Amtsgericht Hamburg",
      "registernummer": "HRB 102468",
      "registerart": "HRB",
      "company_name": "Baloise Vertriebsservice AG",
      "company_seat": "Hamburg",
      "details": "19.12.2025 (Bekanntmachungsdatum)\n\nHamburg Amtsgericht Hamburg HRB 102468\nSonstige Registerbekanntmachung\n\nBaloise Vertriebsservice AG\nAktiengesellschaft\nHamburg\n\nAls nicht eingetragen wird bekannt gemacht: Liste des Aufsichtsrats wurde eingereicht."
    },
    {
      "date": "2025-12-19",
      "id": "140581",
      "original_text": "Löschungsankündigung\nSaarland Amtsgericht Saarbrücken HRB 107485\nDamas Grill UG (haftungsbeschränkt) – Saarbrücken",
      "type": "Löschungsankündigung",
      "state": "Saarland",
      "amtsgericht": "Amtsgericht Saarbrücken",
      "registernummer": "HRB 107485",
      "registerart": "HRB",
      "company_name": "Damas Grill UG (haftungsbeschränkt)",
      "company_seat": "Saarbrücken",
      "details": "19.12.2025 (Bekanntmachungsdatum)\n\nSaarland Amtsgericht Saarbrücken HRB 107485\nLöschungsankündigung 10.12.2024 (Eintragungsdatum)\n\nDamas Grill UG (haftungsbeschränkt)\nGesellschaft mit beschränkter Haftung\nSaarbrücken\n\nEs ist beabsichtigt, die Gesellschaft von Amts wegen gemäß § 394 FamFG wegen Vermögenslosigkeit zu löschen.\nGegen die Löschung von Amts wegen ist das Rechtsmittel des Widerspruchs statthaft. Der Widerspruch ist binnen einer Frist zwei Monaten beginnend mit dem Tag dieser Veröffentlichung durch Einreichen eines Widerspruchsschreibens -schriftlich oder zur Niederschrift der Geschäftsstelle beim Amtsgericht Saarbrücken, -zentrales Handelsregister-, Mainzerstr.178, 66121 Saarbrücken einzulegen.\nDer Widerspruch muss die Bezeichnung der angefochtenen Löschungsankündigung enthalten sowie die Erklärung, dass Widerspruch eingelegt wird. Er ist vom Widerspruchsführer oder seinem Bevollmächtigten zu unterzeichnen.\nDas Widerspruchsschreiben kann auch in der Form eines elektronischen Dokumentes eingereicht werden, das mit einer qualifizierten elektronischen Signatur nach dem Signaturgesetz versehen sein muss (§§ 14 Abs. 2 FamFG, 130a, 298 ZPO)."
    },
    {
      "date": "2025-12-19",
      "id": "140582",
      "original_text": "Registerbekanntmachung nach dem Umwandlungsgesetz\nSchleswig-Holstein Amtsgericht Kiel HRA 12648\nDipl.-Ing. Ralf Perske Bauunternehmen GmbH & Co. KG – Rendsburg",
      "type": "Registerbekanntmachung nach dem Umwandlungsgesetz",
      "state": "Schleswig-Holstein",
      "amtsgericht": "Amtsgericht Kiel",
      "registernummer": "HRA 12648",
      "registerart": "HRA",
      "company_name": "Dipl.-Ing. Ralf Perske Bauunternehmen GmbH & Co. KG",
      "company_seat": "Rendsburg",
      "details": "19.12.2025 (Bekanntmachungsdatum)\n\nSchleswig-Holstein Amtsgericht Kiel HRA 12648\nRegisterbekanntmachung nach dem Umwandlungsgesetz 18.12.2025 (Eintragungsdatum)\n\nDipl.-Ing. Ralf Perske Bauunternehmen GmbH & Co. KG\nKommanditgesellschaft\nRendsburg\n\nZu Eintragungsnummer 2 vom 18.12.2025 wird als nicht eingetragen veröffentlicht: Als nicht eingetragen wird veröffentlicht: Den Gläubigern der an der Spaltung beteiligten Rechtsträger ist, wenn sie binnen sechs Monaten nach dem Tag, an dem die Eintragung der Spaltung in das Register des Sitzes desjenigen Rechtsträgers, dessen Gläubiger sie sind,  bekannt gemacht worden ist, ihren Anspruch nach Grund und Höhe schriftlich anmelden, Sicherheit zu leisten, soweit sie nicht Befriedigung verlangen können. Dieses Recht steht den Gläubigern jedoch nur zu, wenn sie glaubhaft machen, dass durch die Spaltung die Erfüllung ihrer Forderung gefährdet wird."
    },
    {
      "date": "2025-12-19",
      "id": "140583",
      "original_text": "Registerbekanntmachung nach dem Umwandlungsgesetz\nBaden-Württemberg Amtsgericht Mannheim HRB 570062\nRauch Möbelwerke Gesellschaft mit beschränkter Haftung – Freudenberg",
      "type": "Registerbekanntmachung nach dem Umwandlungsgesetz",
      "state": "Baden-Württemberg",
      "amtsgericht": "Amtsgericht Mannheim",
      "registernummer": "HRB 570062",
      "registerart": "HRB",
      "company_name": "Rauch Möbelwerke Gesellschaft mit beschränkter Haftung",
      "company_seat": "Freudenberg",
      "details": "19.12.2025 (Bekanntmachungsdatum)\n\nBaden-Württemberg Amtsgericht Mannheim HRB 570062\nRegisterbekanntmachung nach dem Umwandlungsgesetz 19.12.2025 (Eintragungsdatum)\n\nRauch Möbelwerke Gesellschaft mit beschränkter Haftung\nGesellschaft mit beschränkter Haftung\nFreudenberg\n\nDen Gläubigern der an der Verschmelzung beteiligten Rechtsträger ist, wenn sie binnen sechs Monaten nach dem Tag, an dem die Eintragung der Verschmelzung in das Register des Sitzes desjenigen Rechtsträgers, dessen Gläubiger sie sind, nach § 19 Abs. 3 UmwG als bekanntgemacht gilt, ihren Anspruch nach Grund und Höhe schriftlich anmelden, Sicherheit zu leisten, soweit sie nicht Befriedigung verlangen können. Dieses Recht steht den Gläubigern jedoch nur zu, wenn sie glaubhaft machen, dass durch die Verschmelzung die Erfüllung ihrer Forderung gefährdet wird."
    },
    {
      "date": "2025-12-19",
      "id": "140584",
      "original_text": "Löschungsankündigung\nBaden-Württemberg Amtsgericht Mannheim HRB 703427\nMCS Projekt GmbH – Mannheim",
      "type": "Löschungsankündigung",
      "state": "Baden-Württemberg",
      "amtsgericht": "Amtsgericht Mannheim",
      "registernummer": "HRB 703427",
      "registerart": "HRB",
      "company_name": "MCS Projekt GmbH",
      "company_seat": "Mannheim",
      "details": "19.12.2025 (Bekanntmachungsdatum)\n\nBaden-Württemberg Amtsgericht Mannheim HRB 703427\nLöschungsankündigung\n\nMCS Projekt GmbH\nGesellschaft mit beschränkter Haftung\nMannheim\n\nDas Gericht beabsichtigt, die Gesellschaft wegen Vermögenslosigkeit im Handelsregister von Amts wegen nach § 394 FamFG zu löschen. Die Frist zur Geltendmachung eines Widerspruchs gegen die beabsichtigte Löschung ist auf einen Monat ab Veröffentlichung bestimmt."
    },
    {
      "date": "2025-12-19",
      "id": "140585",
      "original_text": "Löschungsankündigung\nSchleswig-Holstein Amtsgericht Lübeck HRB 20792\nEuH - Energie und Haus GmbH – Sierksdorf",
      "type": "Löschungsankündigung",
      "state": "Schleswig-Holstein",
      "amtsgericht": "Amtsgericht Lübeck",
      "registernummer": "HRB 20792",
      "registerart": "HRB",
      "company_name": "EuH - Energie und Haus GmbH",
      "company_seat": "Sierksdorf",
      "details": "19.12.2025 (Bekanntmachungsdatum)\n\nSchleswig-Holstein Amtsgericht Lübeck HRB 20792\nLöschungsankündigung\n\nEuH - Energie und Haus GmbH\nGesellschaft mit beschränkter Haftung\nSierksdorf\n\nergeben sich aus den mir vorliegenden Unterlagen Anhaltspunkte dafür, dass die Gesellschaft vermögenslos ist:\nDie Gesellschaft ist unter der im Handelsregister eingetragenen Geschäftsanschrift schon lange nicht mehr erreichbar und der Geschäftsführer ist nicht zu ermitteln, da er unbekannt verzogen ist. Ein Gewerbe wird nicht ausgeführt. Bei der IHK besteht ein Beitragsrückstand und etliche Gläubiger haben sich mit ihren Forderungen an das Gericht gewendet.\nIch beabsichtige daher, die Gesellschaft wegen Vermögenslosigkeit gemäß § 394 FamFG zu löschen.\nIch bestimme eine Frist von einem Monat zur Geltendmachung eines Widerspruchs gegen die Löschung, § 394 Abs. 2 S. 1 FamFG.\nWeiter bitte ich Sie, mir binnen derselben Frist mitzuteilen, ob die genannte Gesellschaft noch Vermögen hat, ggf. welche Vermögensgegenstände sie besitzt, ob die Gesellschaft noch Partei eines noch nicht rechtskräftig abgeschlossenen Rechtsstreits ist oder ob sonst noch eine Abwicklung stattfindet.\nNach Fristablauf ohne Widerspruch von Ihnen oder anderer Seite wird die Gesellschaft gelöscht."
    },
    {
      "date": "2025-12-19",
      "id": "140586",
      "original_text": "Registerbekanntmachung nach dem Umwandlungsgesetz\nBaden-Württemberg Amtsgericht Mannheim HRB 722251\nBertrandt Technologie GmbH – Mönsheim",
      "type": "Registerbekanntmachung nach dem Umwandlungsgesetz",
      "state": "Baden-Württemberg",
      "amtsgericht": "Amtsgericht Mannheim",
      "registernummer": "HRB 722251",
      "registerart": "HRB",
      "company_name": "Bertrandt Technologie GmbH",
      "company_seat": "Mönsheim",
      "details": "19.12.2025 (Bekanntmachungsdatum)\n\nBaden-Württemberg Amtsgericht Mannheim HRB 722251\nRegisterbekanntmachung nach dem Umwandlungsgesetz 19.12.2025 (Eintragungsdatum)\n\nBertrandt Technologie GmbH\nGesellschaft mit beschränkter Haftung\nMönsheim\n\nAls nicht eingetragen wird bekanntgemacht:\nDen Gläubigern der an der Verschmelzung beteiligten Rechtsträger ist, wenn sie binnen sechs Monaten nach dem Tag, an dem die Eintragung der Verschmelzung in das Register des Sitzes desjenigen Rechtsträgers, dessen Gläubiger sie sind, nach § 19 Abs. 3 UmwG als bekanntgemacht gilt, ihren Anspruch nach Grund und Höhe schriftlich anmelden, Sicherheit zu leisten, soweit sie nicht Befriedigung verlangen können. Dieses Recht steht den Gläubigern jedoch nur zu, wenn sie glaubhaft machen, dass durch die Verschmelzung die Erfüllung ihrer Forderung gefährdet wird."
    },
    {
      "date": "2025-12-19",
      "id": "140587",
      "original_text": "Sonstige Registerbekanntmachung\nBaden-Württemberg Amtsgericht Mannheim HRB 729616\nGBS Software AG – Karlsruhe",
      "type": "Sonstige Registerbekanntmachung",
      "state": "Baden-Württemberg",
      "amtsgericht": "Amtsgericht Mannheim",
      "registernummer": "HRB 729616",
      "registerart": "HRB",
      "company_name": "GBS Software AG",
      "company_seat": "Karlsruhe",
      "details": "19.12.2025 (Bekanntmachungsdatum)\n\nBaden-Württemberg Amtsgericht Mannheim HRB 729616\nSonstige Registerbekanntmachung 18.12.2025 (Eintragungsdatum)\n\nGBS Software AG\nAktiengesellschaft\nKarlsruhe\n\nAuf das erhöhte Grundkapital werden Sacheinlagen nach Maßgabe der bei Gericht eingereichten Urkunden geleistet."
    },
    {
      "date": "2025-12-19",
      "id": "140588",
      "original_text": "Löschungsankündigung\nBrandenburg Amtsgericht Potsdam HRB 9199\nAxel Heyligenstaedt Herstellung und Vertrieb chemisch-technischer Produkte GmbH – Falkensee",
      "type": "Löschungsankündigung",
      "state": "Brandenburg",
      "amtsgericht": "Amtsgericht Potsdam",
      "registernummer": "HRB 9199",
      "registerart": "HRB",
      "company_name": "Axel Heyligenstaedt Herstellung und Vertrieb chemisch-technischer Produkte GmbH",
      "company_seat": "Falkensee",
      "details": "19.12.2025 (Bekanntmachungsdatum)\n\nBrandenburg Amtsgericht Potsdam HRB 9199\nLöschungsankündigung\n\nAxel Heyligenstaedt Herstellung und Vertrieb chemisch-technischer Produkte GmbH\nGesellschaft mit beschränkter Haftung\nFalkensee\n\nBei der nachstehenden Gesellschaft wird das Amtslöschungsverfahren gemäß § 394 FamFG eingeleitet. Widerspruchsfrist 8 Wochen."
    },
    {
      "date": "2025-12-19",
      "id": "140589",
      "original_text": "Registerbekanntmachung nach dem Umwandlungsgesetz\nSachsen-Anhalt Amtsgericht Stendal HRB 28326\nVKK Standardkessel Verwaltung Köthen GmbH – Köthen (Anhalt)",
      "type": "Registerbekanntmachung nach dem Umwandlungsgesetz",
      "state": "Sachsen-Anhalt",
      "amtsgericht": "Amtsgericht Stendal",
      "registernummer": "HRB 28326",
      "registerart": "HRB",
      "company_name": "VKK Standardkessel Verwaltung Köthen GmbH",
      "company_seat": "Köthen (Anhalt)",
      "details": "19.12.2025 (Bekanntmachungsdatum)\n\nSachsen-Anhalt Amtsgericht Stendal HRB 28326\nRegisterbekanntmachung nach dem Umwandlungsgesetz 19.12.2025 (Eintragungsdatum)\n\nVKK Standardkessel Verwaltung Köthen GmbH\nGesellschaft mit beschränkter Haftung\nKöthen (Anhalt)\n\nNicht eingetragen:\nDen Gläubigern der an der Verschmelzung beteiligten Rechtsträger ist, wenn sie binnen sechs Monaten nach dem Tag, an dem die Eintragung der Verschmelzung nach § 19 Abs. 3 UmwG als bekanntgemacht gilt, ihren Anspruch nach Grund und Höhe schriftlich anmelden, Sicherheit zu leisten, soweit sie nicht Befriedigung verlangen können. Dieses Recht steht ihnen jedoch nur zu, wenn sie glaubhaft machen, dass durch die Verschmelzung die Erfüllung ihrer Forderung gefährdet wird."
    },
    {
      "date": "2025-12-19",
      "id": "140590",
      "original_text": "Registerbekanntmachung nach dem Umwandlungsgesetz\nSachsen-Anhalt Amtsgericht Stendal HRB 26344\nVKK Standardkessel Köthen GmbH – Köthen (Anhalt)",
      "type": "Registerbekanntmachung nach dem Umwandlungsgesetz",
      "state": "Sachsen-Anhalt",
      "amtsgericht": "Amtsgericht Stendal",
      "registernummer": "HRB 26344",
      "registerart": "HRB",
      "company_name": "VKK Standardkessel Köthen GmbH",
      "company_seat": "Köthen (Anhalt)",
      "details": "19.12.2025 (Bekanntmachungsdatum)\n\nSachsen-Anhalt Amtsgericht Stendal HRB 26344\nRegisterbekanntmachung nach dem Umwandlungsgesetz 19.12.2025 (Eintragungsdatum)\n\nVKK Standardkessel Köthen GmbH\nGesellschaft mit beschränkter Haftung\nKöthen (Anhalt)\n\nNicht eingetragen:\nDen Gläubigern der an der Verschmelzung beteiligten Rechtsträger ist, wenn sie binnen sechs Monaten nach dem Tag, an dem die Eintragung der Verschmelzung nach § 19 Abs. 3 UmwG als bekanntgemacht gilt, ihren Anspruch nach Grund und Höhe schriftlich anmelden, Sicherheit zu leisten, soweit sie nicht Befriedigung verlangen können. Dieses Recht steht ihnen jedoch nur zu, wenn sie glaubhaft machen, dass durch die Verschmelzung die Erfüllung ihrer Forderung gefährdet wird."
    },
    {
      "date": "2025-12-19",
      "id": "140591",
      "original_text": "Sonstige Registerbekanntmachung\nBaden-Württemberg Amtsgericht Stuttgart HRB 224568\nPutzmeister Holding GmbH – Aichtal",
      "type": "Sonstige Registerbekanntmachung",
      "state": "Baden-Württemberg",
      "amtsgericht": "Amtsgericht Stuttgart",
      "registernummer": "HRB 224568",
      "registerart": "HRB",
      "company_name": "Putzmeister Holding GmbH",
      "company_seat": "Aichtal",
      "details": "19.12.2025 (Bekanntmachungsdatum)\n\nBaden-Württemberg Amtsgericht Stuttgart HRB 224568\nSonstige Registerbekanntmachung\n\nPutzmeister Holding GmbH\nGesellschaft mit beschränkter Haftung\nAichtal\n\nDie Gesellschaft hat am 18.12.2025 die Liste über die Zusammensetzung des Aufsichtsrats zum Handelsregister eingereicht."
    },
    {
      "date": "2025-12-19",
      "id": "140592",
      "original_text": "Einreichung neuer Dokumente\nBaden-Württemberg Amtsgericht Stuttgart HRB 800307\nY1 Digital AG – Stuttgart",
      "type": "Einreichung neuer Dokumente",
      "state": "Baden-Württemberg",
      "amtsgericht": "Amtsgericht Stuttgart",
      "registernummer": "HRB 800307",
      "registerart": "HRB",
      "company_name": "Y1 Digital AG",
      "company_seat": "Stuttgart",
      "details": "19.12.2025 (Bekanntmachungsdatum)\n\nBaden-Württemberg Amtsgericht Stuttgart HRB 800307\nEinreichung neuer Dokumente\n\nY1 Digital AG\nAktiengesellschaft\nStuttgart\n\nDie Gesellschaft hat am 18.12.2025 die Liste über die Zusammensetzung des Aufsichtsrats zum Handelsregister eingereicht."
    },
    {
      "date": "2025-12-19",
      "id": "140593",
      "original_text": "Einreichung neuer Dokumente\nBaden-Württemberg Amtsgericht Mannheim HRB 700566\nPRO MEDISOFT Software Systeme für das Gesundheitswesen Aktiengesellschaft – Mannheim",
      "type": "Einreichung neuer Dokumente",
      "state": "Baden-Württemberg",
      "amtsgericht": "Amtsgericht Mannheim",
      "registernummer": "HRB 700566",
      "registerart": "HRB",
      "company_name": "PRO MEDISOFT Software Systeme für das Gesundheitswesen Aktiengesellschaft",
      "company_seat": "Mannheim",
      "details": "19.12.2025 (Bekanntmachungsdatum)\n\nBaden-Württemberg Amtsgericht Mannheim HRB 700566\nEinreichung neuer Dokumente 19.12.2025 (Eintragungsdatum)\n\nPRO MEDISOFT Software Systeme für das Gesundheitswesen Aktiengesellschaft\nAktiengesellschaft\nMannheim\n\nDie Gesellschaft hat am 16.12.2025 die Liste über die Zusammensetzung des Aufsichtsrats zum Handelsregister eingereicht."
    },
    {
      "date": "2025-12-19",
      "id": "140594",
      "original_text": "Registerbekanntmachung nach dem Umwandlungsgesetz\nSachsen-Anhalt Amtsgericht Stendal GsR 1019\nLuchsberg eGbR – Quedlinburg OT Bad Suderode",
      "type": "Registerbekanntmachung nach dem Umwandlungsgesetz",
      "state": "Sachsen-Anhalt",
      "amtsgericht": "Amtsgericht Stendal",
      "registernummer": "GsR 1019",
      "registerart": "GsR",
      "company_name": "Luchsberg eGbR",
      "company_seat": "Quedlinburg OT Bad Suderode",
      "details": "19.12.2025 (Bekanntmachungsdatum)\n\nSachsen-Anhalt Amtsgericht Stendal GsR 1019\nRegisterbekanntmachung nach dem Umwandlungsgesetz 19.12.2025 (Eintragungsdatum)\n\nLuchsberg eGbR\nGesellschaft bürgerlichen Rechts\nQuedlinburg OT Bad Suderode\n\nNicht eingetragen:\nDen Gläubigern der an der Ausgliederung beteiligten Rechtsträger, ist wenn sie binnen sechs Monaten nach dem Tag, an dem die Eintragung der Ausgliederung nach §§125, 19 Abs. 3 UmwG als bekanntgemacht gilt, ihren Anspruch nach Grund und Höhe schriftlich anmelden, Sicherheit zu leisten, soweit sie nicht Befriedigung verlangen können. Diese Recht steht ihnen jedoch nur zu, wenn sie glaubhaft machen, dass durch die Ausgliederung die Erfüllung ihrer Forderung gefährdet wird."
    },
    {
      "date": "2025-12-19",
      "id": "140595",
      "original_text": "Registerbekanntmachung nach dem Umwandlungsgesetz\nSachsen-Anhalt Amtsgericht Stendal HRB 36307\nLuchsberg GmbH – Quedlinburg",
      "type": "Registerbekanntmachung nach dem Umwandlungsgesetz",
      "state": "Sachsen-Anhalt",
      "amtsgericht": "Amtsgericht Stendal",
      "registernummer": "HRB 36307",
      "registerart": "HRB",
      "company_name": "Luchsberg GmbH",
      "company_seat": "Quedlinburg",
      "details": "19.12.2025 (Bekanntmachungsdatum)\n\nSachsen-Anhalt Amtsgericht Stendal HRB 36307\nRegisterbekanntmachung nach dem Umwandlungsgesetz 19.12.2025 (Eintragungsdatum)\n\nLuchsberg GmbH\nGesellschaft mit beschränkter Haftung\nQuedlinburg\n\nDie Gesellschaft hat im Wege der Ausgliederung gemäß Ausgliederungsvertrag vom 12.12.2025 sowie Beschluss ihrer Gesellschafterversammlung vom 12.12.2025 und Beschluss der  Gesellschafterversammlung der übertragenden Gesellschaft vom 12.12.2025 Teile des Vermögens   von der Luchsberg eGbR mit dem Sitz in Quedlinburg OT Bad Suderode (Amtsgericht Stendal GsR 1019) übernommen. Die Ausgliederung wurde am 19.12.2025 im Register des Sitzes des übertragenden Rechtsträgers eingetragen. Nicht eingetragen: Den Gläubigern der an der Ausgliederung beteiligten Rechtsträger, ist wenn sie binnen sechs Monaten nach dem Tag, an dem die Eintragung der Ausgliederung nach §§125, 19 Abs. 3 UmwG als bekanntgemacht gilt, ihren Anspruch nach Grund und Höhe schriftlich anmelden, Sicherheit zu leisten, soweit sie nicht Befriedigung verlangen können. Diese Recht steht ihnen jedoch nur zu, wenn sie glaubhaft machen, dass durch die Ausgliederung die Erfüllung ihrer Forderung gefährdet wird."
    },
    {
      "date": "2025-12-19",
      "id": "140596",
      "original_text": "Löschungsankündigung\nThüringen Amtsgericht Jena HRB 507491\nR-I-S Reim Industrie Service GmbH – Eisenberg",
      "type": "Löschungsankündigung",
      "state": "Thüringen",
      "amtsgericht": "Amtsgericht Jena",
      "registernummer": "HRB 507491",
      "registerart": "HRB",
      "company_name": "R-I-S Reim Industrie Service GmbH",
      "company_seat": "Eisenberg",
      "details": "19.12.2025 (Bekanntmachungsdatum)\n\nThüringen Amtsgericht Jena HRB 507491\nLöschungsankündigung\n\nR-I-S Reim Industrie Service GmbH\nGesellschaft mit beschränkter Haftung\nEisenberg\n\nDas Registergericht beabsichtigt, die im Handelsregister eingetragene Gesellschaft wegen Vermögenslosigkeit nach § 394 FamFG von Amts wegen zu löschen. Die Frist zur Erhebung eines Widerspruchs gegen die beabsichtigte Löschung wird auf 6 Wochen festgesetzt."
    },
    {
      "date": "2025-12-19",
      "id": "140597",
      "original_text": "Löschungsankündigung\nThüringen Amtsgericht Jena HRB 513214\nSG-Sicherheit GmbH – Saalfeld/Saale",
      "type": "Löschungsankündigung",
      "state": "Thüringen",
      "amtsgericht": "Amtsgericht Jena",
      "registernummer": "HRB 513214",
      "registerart": "HRB",
      "company_name": "SG-Sicherheit GmbH",
      "company_seat": "Saalfeld/Saale",
      "details": "19.12.2025 (Bekanntmachungsdatum)\n\nThüringen Amtsgericht Jena HRB 513214\nLöschungsankündigung\n\nSG-Sicherheit GmbH\nGesellschaft mit beschränkter Haftung\nSaalfeld/Saale\n\nDas Registergericht beabsichtigt, die im Handelsregister eingetragene Gesellschaft wegen Vermögenslosigkeit nach § 394 FamFG von Amts wegen zu löschen. Die Frist zur Erhebung eines Widerspruchs gegen die beabsichtigte Löschung wird auf 6 Wochen festgesetzt."
    },
    {
      "date": "2025-12-19",
      "id": "140598",
      "original_text": "Löschungsankündigung\nBaden-Württemberg Amtsgericht Mannheim HRB 717576\nTholos Verwaltungsgesellschaft mit beschränkter Haftung – Heidelberg",
      "type": "Löschungsankündigung",
      "state": "Baden-Württemberg",
      "amtsgericht": "Amtsgericht Mannheim",
      "registernummer": "HRB 717576",
      "registerart": "HRB",
      "company_name": "Tholos Verwaltungsgesellschaft mit beschränkter Haftung",
      "company_seat": "Heidelberg",
      "details": "19.12.2025 (Bekanntmachungsdatum)\n\nBaden-Württemberg Amtsgericht Mannheim HRB 717576\nLöschungsankündigung\n\nTholos Verwaltungsgesellschaft mit beschränkter Haftung\nGesellschaft mit beschränkter Haftung\nHeidelberg\n\nDas Gericht beabsichtigt, die Gesellschaft wegen Vermögenslosigkeit im Handelsregister von Amts wegen nach § 394 FamFG zu löschen. Die Frist zur Geltendmachung eines Widerspruchs gegen die beabsichtigte Löschung ist auf einen Monat ab Veröffentlichung bestimmt."
    },
    {
      "date": "2025-12-19",
      "id": "140599",
      "original_text": "Löschungsankündigung\nBerlin Amtsgericht Berlin (Charlottenburg) HRB 149746\nre2you GmbH – Berlin",
      "type": "Löschungsankündigung",
      "state": "Berlin",
      "amtsgericht": "Amtsgericht Berlin (Charlottenburg)",
      "registernummer": "HRB 149746",
      "registerart": "HRB",
      "company_name": "re2you GmbH",
      "company_seat": "Berlin",
      "details": "19.12.2025 (Bekanntmachungsdatum)\n\nBerlin Amtsgericht Berlin (Charlottenburg) HRB 149746\nLöschungsankündigung\n\nre2you GmbH\nGesellschaft mit beschränkter Haftung\nBerlin\n\nBei der nachstehenden Gesellschaft wird das Amtslöschungsverfahren gemäß § 394 FamFG eingeleitet. Widerspruchsfrist 6 Wochen"
    },
    {
      "date": "2025-12-19",
      "id": "140600",
      "original_text": "Registerbekanntmachung nach dem Umwandlungsgesetz\nSchleswig-Holstein Amtsgericht Lübeck HRB 25551\nBARSTEC GmbH – Barsbüttel",
      "type": "Registerbekanntmachung nach dem Umwandlungsgesetz",
      "state": "Schleswig-Holstein",
      "amtsgericht": "Amtsgericht Lübeck",
      "registernummer": "HRB 25551",
      "registerart": "HRB",
      "company_name": "BARSTEC GmbH",
      "company_seat": "Barsbüttel",
      "details": "19.12.2025 (Bekanntmachungsdatum)\n\nSchleswig-Holstein Amtsgericht Lübeck HRB 25551\nRegisterbekanntmachung nach dem Umwandlungsgesetz 18.12.2025 (Eintragungsdatum)\n\nBARSTEC GmbH\nGesellschaft mit beschränkter Haftung\nBarsbüttel\n\nZu Eintragungsnummer 2 vom 18.12.2025 wird als nicht eingetragen veröffentlicht: Als nicht eingetragen wird veröffentlicht: Den Gläubigern der an der Ausgliederung beteiligten Rechtsträger ist, wenn sie binnen sechs Monaten nach dem Tag, an dem die Eintragung der  Ausgliederung in das Register des Sitzes desjenigen Rechtsträgers, dessen Gläubiger sie sind, als bekannt gemacht gilt, ihren Anspruch nach Grund und Höhe schriftlich anmelden, Sicherheit zu leisten, soweit sie nicht Befriedigung verlangen können. Dieses Recht steht den Gläubigern jedoch nur zu, wenn sie glaubhaft machen, dass durch die  Ausgliederung die Erfüllung ihrer Forderung gefährdet wird."
    },
    {
      "date": "2025-12-19",
      "id": "140601",
      "original_text": "Löschungsankündigung\nBrandenburg Amtsgericht Frankfurt/Oder HRB 20359\nZielvoll Handel UG (haftungsbeschränkt) – Bad Freienwalde (Oder)",
      "type": "Löschungsankündigung",
      "state": "Brandenburg",
      "amtsgericht": "Amtsgericht Frankfurt/Oder",
      "registernummer": "HRB 20359",
      "registerart": "HRB",
      "company_name": "Zielvoll Handel UG (haftungsbeschränkt)",
      "company_seat": "Bad Freienwalde (Oder)",
      "details": "19.12.2025 (Bekanntmachungsdatum)\n\nBrandenburg Amtsgericht Frankfurt/Oder HRB 20359\nLöschungsankündigung\n\nZielvoll Handel UG (haftungsbeschränkt)\nGesellschaft mit beschränkter Haftung\nBad Freienwalde (Oder)\n\nBei der nachstehenden Gesellschaft wird das Amtslöschungsverfahren gemäß § 394 FamFG eingeleitet."
    },
    {
      "date": "2025-12-19",
      "id": "140602",
      "original_text": "Registerbekanntmachung nach dem Umwandlungsgesetz\nHamburg Amtsgericht Hamburg HRB 182165\nNordseecluster A GmbH – Hamburg",
      "type": "Registerbekanntmachung nach dem Umwandlungsgesetz",
      "state": "Hamburg",
      "amtsgericht": "Amtsgericht Hamburg",
      "registernummer": "HRB 182165",
      "registerart": "HRB",
      "company_name": "Nordseecluster A GmbH",
      "company_seat": "Hamburg",
      "details": "19.12.2025 (Bekanntmachungsdatum)\n\nHamburg Amtsgericht Hamburg HRB 182165\nRegisterbekanntmachung nach dem Umwandlungsgesetz 19.12.2025 (Eintragungsdatum)\n\nNordseecluster A GmbH\nGesellschaft mit beschränkter Haftung\nHamburg\n\nAls nicht eingetragen wird bekannt gemacht:\nDen Gläubigern der an der formwechselnden Umwandlung beteiligten Gesellschaften ist, wenn sie binnen sechs Monaten nach dem Tag, an dem die Eintragung der formwechselnden Umwandlung in das Register des Sitzes desjenigen Rechtsträgers, dessen Gläubiger sie sind, nach § 19 Absatz 3 UmwG als bekannt gemacht gilt, ihren Anspruch nach Grund und Höhe schriftlich anmelden, Sicherheit zu leisten, soweit sie nicht Befriedigung verlangen können. Dieses Recht steht den Gläubigern jedoch nur zu, wenn sie glaubhaft machen, dass durch die formwechselnde Umwandlung die Erfüllung ihrer Forderung gefährdet wird."
    },
    {
      "date": "2025-12-19",
      "id": "140603",
      "original_text": "Registerbekanntmachung nach dem Umwandlungsgesetz\nHamburg Amtsgericht Hamburg HRA 133096\nNordseecluster A GmbH & Co. KG – Hamburg",
      "type": "Registerbekanntmachung nach dem Umwandlungsgesetz",
      "state": "Hamburg",
      "amtsgericht": "Amtsgericht Hamburg",
      "registernummer": "HRA 133096",
      "registerart": "HRA",
      "company_name": "Nordseecluster A GmbH & Co. KG",
      "company_seat": "Hamburg",
      "details": "19.12.2025 (Bekanntmachungsdatum)\n\nHamburg Amtsgericht Hamburg HRA 133096\nRegisterbekanntmachung nach dem Umwandlungsgesetz 19.12.2025 (Eintragungsdatum)\n\nNordseecluster A GmbH & Co. KG\nKommanditgesellschaft\nHamburg\n\nAls nicht eingetragen wird bekannt gemacht:\nDen Gläubigern der an der formwechselnden Umwandlung beteiligten Gesellschaften ist, wenn sie binnen sechs Monaten nach dem Tag, an dem die Eintragung der formwechselnden Umwandlung in das Register des Sitzes desjenigen Rechtsträgers, dessen Gläubiger sie sind, nach § 19 Absatz 3 UmwG als bekannt gemacht gilt, ihren Anspruch nach Grund und Höhe schriftlich anmelden, Sicherheit zu leisten, soweit sie nicht Befriedigung verlangen können. Dieses Recht steht den Gläubigern jedoch nur zu, wenn sie glaubhaft machen, dass durch die formwechselnde Umwandlung die Erfüllung ihrer Forderung gefährdet wird."
    },
    {
      "date": "2025-12-19",
      "id": "140604",
      "original_text": "Registerbekanntmachung nach dem Umwandlungsgesetz\nBrandenburg Amtsgericht Cottbus HRB 19287\nQuartier Beelitz-Heilstätten zweite Grundstücksgesellschaft mbH – Schönefeld",
      "type": "Registerbekanntmachung nach dem Umwandlungsgesetz",
      "state": "Brandenburg",
      "amtsgericht": "Amtsgericht Cottbus",
      "registernummer": "HRB 19287",
      "registerart": "HRB",
      "company_name": "Quartier Beelitz-Heilstätten zweite Grundstücksgesellschaft mbH",
      "company_seat": "Schönefeld",
      "details": "19.12.2025 (Bekanntmachungsdatum)\n\nBrandenburg Amtsgericht Cottbus HRB 19287\nRegisterbekanntmachung nach dem Umwandlungsgesetz 19.12.2025 (Eintragungsdatum)\n\nQuartier Beelitz-Heilstätten zweite Grundstücksgesellschaft mbH\nGesellschaft mit beschränkter Haftung\nSchönefeld\n\nZu Eintragungsnummer 1 vom 19.12.2025 wird als nicht eingetragen veröffentlicht:\nAls nicht eingetragen wird veröffentlicht:\nDen Gläubigern der an der Spaltung beteiligten Rechtsträger ist, wenn sie binnen sechs Monaten nach dem Tag, an dem die Eintragung der Spaltung in das Register des Sitzes desjenigen Rechtsträgers, dessen Gläubiger sie sind, als bekannt gemacht gilt, ihren Anspruch nach Grund und Höhe schriftlich anmelden, Sicherheit zu leisten, soweit sie nicht Befriedigung verlangen können. Dieses Recht steht den Gläubigern jedoch nur zu, wenn sie glaubhaft machen, dass durch die Spaltung die Erfüllung ihrer Forderung gefährdet wird"
    },
    {
      "date": "2025-12-19",
      "id": "140605",
      "original_text": "Registerbekanntmachung nach dem Umwandlungsgesetz\nBrandenburg Amtsgericht Cottbus HRB 17057\nSaaS.group zenloop GmbH – Schönefeld",
      "type": "Registerbekanntmachung nach dem Umwandlungsgesetz",
      "state": "Brandenburg",
      "amtsgericht": "Amtsgericht Cottbus",
      "registernummer": "HRB 17057",
      "registerart": "HRB",
      "company_name": "SaaS.group zenloop GmbH",
      "company_seat": "Schönefeld",
      "details": "19.12.2025 (Bekanntmachungsdatum)\n\nBrandenburg Amtsgericht Cottbus HRB 17057\nRegisterbekanntmachung nach dem Umwandlungsgesetz 19.12.2025 (Eintragungsdatum)\n\nSaaS.group zenloop GmbH\nGesellschaft mit beschränkter Haftung\nSchönefeld\n\nAls nicht eingetragen wird veröffentlicht:\nDen Gläubigern der an der Verschmelzung beteiligten Rechtsträger ist, wenn sie binnen sechs Monaten nach dem Tag, an dem die Eintragung der Verschmelzung in das Register des Sitzes desjenigen Rechtsträgers, dessen Gläubiger sie sind, als bekannt gemacht gilt, ihren Anspruch nach Grund und Höhe schriftlich anmelden, Sicherheit zu leisten, soweit sie nicht Befriedigung verlangen können. Dieses Recht steht den Gläubigern jedoch nur zu, wenn sie glaubhaft machen, dass durch die Verschmelzung die Erfüllung ihrer Forderung gefährdet wird"
    },
    {
      "date": "2025-12-19",
      "id": "140606",
      "original_text": "Registerbekanntmachung nach dem Umwandlungsgesetz\nBrandenburg Amtsgericht Cottbus HRB 12834\nRefugium Beelitz Quadrant C Grundstücksgesellschaft mbH – Schönefeld",
      "type": "Registerbekanntmachung nach dem Umwandlungsgesetz",
      "state": "Brandenburg",
      "amtsgericht": "Amtsgericht Cottbus",
      "registernummer": "HRB 12834",
      "registerart": "HRB",
      "company_name": "Refugium Beelitz Quadrant C Grundstücksgesellschaft mbH",
      "company_seat": "Schönefeld",
      "details": "19.12.2025 (Bekanntmachungsdatum)\n\nBrandenburg Amtsgericht Cottbus HRB 12834\nRegisterbekanntmachung nach dem Umwandlungsgesetz 19.12.2025 (Eintragungsdatum)\n\nRefugium Beelitz Quadrant C Grundstücksgesellschaft mbH\nGesellschaft mit beschränkter Haftung\nSchönefeld\n\nAls nicht eingetragen wird veröffentlicht:\nDen Gläubigern der an der Spaltung beteiligten Rechtsträger ist, wenn sie binnen sechs Monaten nach dem Tag, an dem die Eintragung der Spaltung in das Register des Sitzes desjenigen Rechtsträgers, dessen Gläubiger sie sind, als bekannt gemacht gilt, ihren Anspruch nach Grund und Höhe schriftlich anmelden, Sicherheit zu leisten, soweit sie nicht Befriedigung verlangen können. Dieses Recht steht den Gläubigern jedoch nur zu, wenn sie glaubhaft machen, dass durch die Spaltung die Erfüllung ihrer Forderung gefährdet wird"
    },
    {
      "date": "2025-12-19",
      "id": "140607",
      "original_text": "Einreichung neuer Dokumente\nHamburg Amtsgericht Hamburg HRB 154959\nImmanuel Albertinen Diakonie gGmbH – Hamburg",
      "type": "Einreichung neuer Dokumente",
      "state": "Hamburg",
      "amtsgericht": "Amtsgericht Hamburg",
      "registernummer": "HRB 154959",
      "registerart": "HRB",
      "company_name": "Immanuel Albertinen Diakonie gGmbH",
      "company_seat": "Hamburg",
      "details": "19.12.2025 (Bekanntmachungsdatum)\n\nHamburg Amtsgericht Hamburg HRB 154959\nEinreichung neuer Dokumente 19.12.2025 (Eintragungsdatum)\n\nImmanuel Albertinen Diakonie gGmbH\nGesellschaft mit beschränkter Haftung\nHamburg\n\nAls nicht eingetragen wird bekannt gemacht: Liste des Aufsichtsrats wurde eingereicht."
    },
    {
      "date": "2025-12-19",
      "id": "140608",
      "original_text": "Registerbekanntmachung nach dem Umwandlungsgesetz\nSchleswig-Holstein Amtsgericht Lübeck HRA 11466\nEDV Organisation Behrmann e. K. – Barsbüttel",
      "type": "Registerbekanntmachung nach dem Umwandlungsgesetz",
      "state": "Schleswig-Holstein",
      "amtsgericht": "Amtsgericht Lübeck",
      "registernummer": "HRA 11466",
      "registerart": "HRA",
      "company_name": "EDV Organisation Behrmann e. K.",
      "company_seat": "Barsbüttel",
      "details": "19.12.2025 (Bekanntmachungsdatum)\n\nSchleswig-Holstein Amtsgericht Lübeck HRA 11466\nRegisterbekanntmachung nach dem Umwandlungsgesetz 18.12.2025 (Eintragungsdatum)\n\nEDV Organisation Behrmann e. K.\nEinzelkaufmann / Einzelkauffrau\nBarsbüttel\n\nZu Eintragungsnummer 2 vom 18.12.2025 wird als nicht eingetragen veröffentlicht:  Als nicht eingetragen wird veröffentlicht: Den Gläubigern ist, wenn sie binnen sechs Monaten nach dem Tag, an dem die Eintragung der Ausgliederung als bekannt gemacht gilt, ihren Anspruch nach Grund und Höhe schriftlich anmelden, Sicherheit zu leisten, soweit sie nicht Befriedigung verlangen können. Dieses Recht steht den Gläubigern jedoch nur zu, wenn sie glaubhaft machen, dass durch die Ausgliederung die Erfüllung ihrer Forderung gefährdet wird."
    },
    {
      "date": "2025-12-19",
      "id": "140609",
      "original_text": "Registerbekanntmachung nach dem Umwandlungsgesetz\nHamburg Amtsgericht Hamburg HRB 125740\nBauer Media Audio Holding GmbH – Hamburg",
      "type": "Registerbekanntmachung nach dem Umwandlungsgesetz",
      "state": "Hamburg",
      "amtsgericht": "Amtsgericht Hamburg",
      "registernummer": "HRB 125740",
      "registerart": "HRB",
      "company_name": "Bauer Media Audio Holding GmbH",
      "company_seat": "Hamburg",
      "details": "19.12.2025 (Bekanntmachungsdatum)\n\nHamburg Amtsgericht Hamburg HRB 125740\nRegisterbekanntmachung nach dem Umwandlungsgesetz 19.12.2025 (Eintragungsdatum)\n\nBauer Media Audio Holding GmbH\nGesellschaft mit beschränkter Haftung\nHamburg\n\nAls nicht eingetragen wird bekannt gemacht:\nDen Gläubigern der an der grenzüberschreitenden Verschmelzung beteiligten übernehmenden Rechtsträger ist, wenn sie binnen sechs Monaten nach dem Tag, an dem die Eintragung der Verschmelzung in das Register des Sitzes desjenigen Rechtsträgers, dessen Gläubiger sie sind, nach § 19 Absatz 3 UmwG als bekanntgemacht gilt, ihren Anspruch nach Grund und Höhe schriftlich anmelden, Sicherheit zu leisten, soweit sie nicht Befriedigung verlangen können.\nDieses Recht steht den Gläubigern jedoch nur zu, wenn sie glaubhaft machen, dass durch die Verschmelzung die Erfüllung ihrer Forderung gefährdet wird.Als nicht eingetragen wird bekannt gemacht:\nDen Gläubigern der an der Verschmelzung beteiligten Gesellschaften ist, wenn sie binnen zwei Monaten nach dem Tag, an dem der gemeinsame Verschmelzungsplan bekannt gemacht worden ist, ihren Anspruch nach Grund und Höhe schriftlich anmelden, Sicherheit zu leisten, soweit sie nicht Befriedigung verlangen können. Dieses Recht steht den Gläubigern jedoch nur zu, wenn sie glaubhaft machen, dass durch die Verschmelzung die Erfüllung ihrer Forderung gefährdet wird, und nur in Hinblick auf solche Forderungen, die vor oder bis zu 15 Tagen nach Bekanntmachung des Verschmelzungsplans entstanden sind."
    },
    {
      "date": "2025-12-19",
      "id": "140610",
      "original_text": "Löschungsankündigung\nBerlin Amtsgericht Berlin (Charlottenburg) HRB 179240\nFepicolon Unternehmergesellschaft (haftungsbeschränkt) – Berlin",
      "type": "Löschungsankündigung",
      "state": "Berlin",
      "amtsgericht": "Amtsgericht Berlin (Charlottenburg)",
      "registernummer": "HRB 179240",
      "registerart": "HRB",
      "company_name": "Fepicolon Unternehmergesellschaft (haftungsbeschränkt)",
      "company_seat": "Berlin",
      "details": "19.12.2025 (Bekanntmachungsdatum)\n\nBerlin Amtsgericht Berlin (Charlottenburg) HRB 179240\nLöschungsankündigung\n\nFepicolon Unternehmergesellschaft (haftungsbeschränkt)\nGesellschaft mit beschränkter Haftung\nBerlin\n\nBei der nachstehenden Gesellschaft wird das Amtslöschungsverfahren gemäß § 394 FamFG eingeleitet. Widerspruchsfrist 6 Wochen"
    },
    {
      "date": "2025-12-19",
      "id": "140611",
      "original_text": "Registerbekanntmachung nach dem Umwandlungsgesetz\nBaden-Württemberg Amtsgericht Stuttgart HRB 758443\nEMP Cramer GmbH Steuerberatungsgesellschaft – Stuttgart",
      "type": "Registerbekanntmachung nach dem Umwandlungsgesetz",
      "state": "Baden-Württemberg",
      "amtsgericht": "Amtsgericht Stuttgart",
      "registernummer": "HRB 758443",
      "registerart": "HRB",
      "company_name": "EMP Cramer GmbH Steuerberatungsgesellschaft",
      "company_seat": "Stuttgart",
      "details": "19.12.2025 (Bekanntmachungsdatum)\n\nBaden-Württemberg Amtsgericht Stuttgart HRB 758443\nRegisterbekanntmachung nach dem Umwandlungsgesetz 04.12.2025 (Eintragungsdatum)\n\nEMP Cramer GmbH Steuerberatungsgesellschaft\nGesellschaft mit beschränkter Haftung\nStuttgart\n\nAls nicht eingetragen wird bekanntgemacht: Den Gläubigern der an der Verschmelzung beteiligten Rechtsträger ist, wenn sie binnen sechs Monaten nach dem Tag, an dem die Eintragung der Verschmelzung in das Register des Sitzes desjenigen Rechtsträgers, dessen Gläubiger sie sind, nach § 19 Abs. 3 UmwG als bekanntgemacht gilt, ihren Anspruch nach Grund und Höhe schriftlich anmelden, Sicherheit zu leisten, soweit sie nicht Befriedigung verlangen können. Dieses Recht steht den Gläubigern jedoch nur zu, wenn sie glaubhaft machen, dass durch die Verschmelzung die Erfüllung ihrer Forderung gefährdet wird."
    },
    {
      "date": "2025-12-19",
      "id": "140612",
      "original_text": "Registerbekanntmachung nach dem Umwandlungsgesetz\nBerlin Amtsgericht Berlin (Charlottenburg) HRB 229707\nGROPYUS Real Estate III UG (haftungsbeschränkt) – Berlin",
      "type": "Registerbekanntmachung nach dem Umwandlungsgesetz",
      "state": "Berlin",
      "amtsgericht": "Amtsgericht Berlin (Charlottenburg)",
      "registernummer": "HRB 229707",
      "registerart": "HRB",
      "company_name": "GROPYUS Real Estate III UG (haftungsbeschränkt)",
      "company_seat": "Berlin",
      "details": "19.12.2025 (Bekanntmachungsdatum)\n\nBerlin Amtsgericht Berlin (Charlottenburg) HRB 229707\nRegisterbekanntmachung nach dem Umwandlungsgesetz 18.12.2025 (Eintragungsdatum)\n\nGROPYUS Real Estate III UG (haftungsbeschränkt)\nGesellschaft mit beschränkter Haftung\nBerlin\n\nZu Eintragungsnummer 6 vom 18.12.2025 wird als nicht eingetragen veröffentlicht: Den Gläubigern der an der Verschmelzung beteiligten Rechtsträger ist, wenn sie binnen sechs Monaten nach dem Tag, an dem die Eintragung der Verschmelzung in das Register des Sitzes desjenigen Rechtsträgers, dessen Gläubiger sie sind, als bekannt gemacht gilt, ihren Anspruch nach Grund und Höhe schriftlich anmelden, Sicherheit zu leisten, soweit sie nicht Befriedigung verlangen können. Dieses Recht steht den Gläubigern jedoch nur zu, wenn sie glaubhaft machen, dass durch die Verschmelzung die Erfüllung ihrer Forderung gefährdet wird. Das Recht, Sicherheitsleistung zu verlangen, steht Gläubigern nicht zu, die im Falle der Insolvenz ein Recht auf vorzugsweise Befriedigung aus einer Deckungsmasse haben, die nach gesetzlicher Vorschrift zu ihrem Schutz errichtet und staatlich überwacht ist."
    },
    {
      "date": "2025-12-19",
      "id": "140613",
      "original_text": "Registerbekanntmachung nach dem Umwandlungsgesetz\nBerlin Amtsgericht Berlin (Charlottenburg) HRB 230515\nGROPYUS Real Estate XI UG (haftungsbeschränkt) – Berlin",
      "type": "Registerbekanntmachung nach dem Umwandlungsgesetz",
      "state": "Berlin",
      "amtsgericht": "Amtsgericht Berlin (Charlottenburg)",
      "registernummer": "HRB 230515",
      "registerart": "HRB",
      "company_name": "GROPYUS Real Estate XI UG (haftungsbeschränkt)",
      "company_seat": "Berlin",
      "details": "19.12.2025 (Bekanntmachungsdatum)\n\nBerlin Amtsgericht Berlin (Charlottenburg) HRB 230515\nRegisterbekanntmachung nach dem Umwandlungsgesetz 18.12.2025 (Eintragungsdatum)\n\nGROPYUS Real Estate XI UG (haftungsbeschränkt)\nGesellschaft mit beschränkter Haftung\nBerlin\n\nZu Eintragungsnummer 5 vom 18.12.2025 wird als nicht eingetragen veröffentlicht: Den Gläubigern der an der Verschmelzung beteiligten Rechtsträger ist, wenn sie binnen sechs Monaten nach dem Tag, an dem die Eintragung der Verschmelzung in das Register des Sitzes desjenigen Rechtsträgers, dessen Gläubiger sie sind, als bekannt gemacht gilt, ihren Anspruch nach Grund und Höhe schriftlich anmelden, Sicherheit zu leisten, soweit sie nicht Befriedigung verlangen können. Dieses Recht steht den Gläubigern jedoch nur zu, wenn sie glaubhaft machen, dass durch die Verschmelzung die Erfüllung ihrer Forderung gefährdet wird. Das Recht, Sicherheitsleistung zu verlangen, steht Gläubigern nicht zu, die im Falle der Insolvenz ein Recht auf vorzugsweise Befriedigung aus einer Deckungsmasse haben, die nach gesetzlicher Vorschrift zu ihrem Schutz errichtet und staatlich überwacht ist."
    },
    {
      "date": "2025-12-19",
      "id": "140614",
      "original_text": "Registerbekanntmachung nach dem Umwandlungsgesetz\nBerlin Amtsgericht Berlin (Charlottenburg) HRB 230560\nGROPYUS Real Estate IX UG (haftungsbeschränkt) – Berlin",
      "type": "Registerbekanntmachung nach dem Umwandlungsgesetz",
      "state": "Berlin",
      "amtsgericht": "Amtsgericht Berlin (Charlottenburg)",
      "registernummer": "HRB 230560",
      "registerart": "HRB",
      "company_name": "GROPYUS Real Estate IX UG (haftungsbeschränkt)",
      "company_seat": "Berlin",
      "details": "19.12.2025 (Bekanntmachungsdatum)\n\nBerlin Amtsgericht Berlin (Charlottenburg) HRB 230560\nRegisterbekanntmachung nach dem Umwandlungsgesetz 18.12.2025 (Eintragungsdatum)\n\nGROPYUS Real Estate IX UG (haftungsbeschränkt)\nGesellschaft mit beschränkter Haftung\nBerlin\n\nZu Eintragungsnummer 5 vom 18.12.2025 wird als nicht eingetragen veröffentlicht: Den Gläubigern der an der Verschmelzung beteiligten Rechtsträger ist, wenn sie binnen sechs Monaten nach dem Tag, an dem die Eintragung der Verschmelzung in das Register des Sitzes desjenigen Rechtsträgers, dessen Gläubiger sie sind, als bekannt gemacht gilt, ihren Anspruch nach Grund und Höhe schriftlich anmelden, Sicherheit zu leisten, soweit sie nicht Befriedigung verlangen können. Dieses Recht steht den Gläubigern jedoch nur zu, wenn sie glaubhaft machen, dass durch die Verschmelzung die Erfüllung ihrer Forderung gefährdet wird. Das Recht, Sicherheitsleistung zu verlangen, steht Gläubigern nicht zu, die im Falle der Insolvenz ein Recht auf vorzugsweise Befriedigung aus einer Deckungsmasse haben, die nach gesetzlicher Vorschrift zu ihrem Schutz errichtet und staatlich überwacht ist."
    },
    {
      "date": "2025-12-19",
      "id": "140615",
      "original_text": "Registerbekanntmachung nach dem Umwandlungsgesetz\nBerlin Amtsgericht Berlin (Charlottenburg) HRB 230801\nGROPYUS Real Estate VII UG (haftungsbeschränkt) – Berlin",
      "type": "Registerbekanntmachung nach dem Umwandlungsgesetz",
      "state": "Berlin",
      "amtsgericht": "Amtsgericht Berlin (Charlottenburg)",
      "registernummer": "HRB 230801",
      "registerart": "HRB",
      "company_name": "GROPYUS Real Estate VII UG (haftungsbeschränkt)",
      "company_seat": "Berlin",
      "details": "19.12.2025 (Bekanntmachungsdatum)\n\nBerlin Amtsgericht Berlin (Charlottenburg) HRB 230801\nRegisterbekanntmachung nach dem Umwandlungsgesetz 18.12.2025 (Eintragungsdatum)\n\nGROPYUS Real Estate VII UG (haftungsbeschränkt)\nGesellschaft mit beschränkter Haftung\nBerlin\n\nZu Eintragungsnummer 5 vom 18.12.2025 wird als nicht eingetragen veröffentlicht: Den Gläubigern der an der Verschmelzung beteiligten Rechtsträger ist, wenn sie binnen sechs Monaten nach dem Tag, an dem die Eintragung der Verschmelzung in das Register des Sitzes desjenigen Rechtsträgers, dessen Gläubiger sie sind, als bekannt gemacht gilt, ihren Anspruch nach Grund und Höhe schriftlich anmelden, Sicherheit zu leisten, soweit sie nicht Befriedigung verlangen können. Dieses Recht steht den Gläubigern jedoch nur zu, wenn sie glaubhaft machen, dass durch die Verschmelzung die Erfüllung ihrer Forderung gefährdet wird. Das Recht, Sicherheitsleistung zu verlangen, steht Gläubigern nicht zu, die im Falle der Insolvenz ein Recht auf vorzugsweise Befriedigung aus einer Deckungsmasse haben, die nach gesetzlicher Vorschrift zu ihrem Schutz errichtet und staatlich überwacht ist."
    },
    {
      "date": "2025-12-19",
      "id": "140616",
      "original_text": "Registerbekanntmachung nach dem Umwandlungsgesetz\nBerlin Amtsgericht Berlin (Charlottenburg) HRB 243684\nSR Spices GmbH – Berlin",
      "type": "Registerbekanntmachung nach dem Umwandlungsgesetz",
      "state": "Berlin",
      "amtsgericht": "Amtsgericht Berlin (Charlottenburg)",
      "registernummer": "HRB 243684",
      "registerart": "HRB",
      "company_name": "SR Spices GmbH",
      "company_seat": "Berlin",
      "details": "19.12.2025 (Bekanntmachungsdatum)\n\nBerlin Amtsgericht Berlin (Charlottenburg) HRB 243684\nRegisterbekanntmachung nach dem Umwandlungsgesetz 17.12.2025 (Eintragungsdatum)\n\nSR Spices GmbH\nGesellschaft mit beschränkter Haftung\nBerlin\n\nZu Eintragungsnummer 3 vom 17.12.2025 wird als nicht eingetragen veröffentlicht: Den Gläubigern der an der Verschmelzung beteiligten Rechtsträger ist, wenn sie binnen sechs Monaten nach dem Tag, an dem die Eintragung der Verschmelzung in das Register des Sitzes desjenigen Rechtsträgers, dessen Gläubiger sie sind, als bekannt gemacht gilt, ihren Anspruch nach Grund und Höhe schriftlich anmelden, Sicherheit zu leisten, soweit sie nicht Befriedigung verlangen können. Dieses Recht steht den Gläubigern jedoch nur zu, wenn sie glaubhaft machen, dass durch die Verschmelzung die Erfüllung ihrer Forderung gefährdet wird. Das Recht, Sicherheitsleistung zu verlangen, steht Gläubigern nicht zu, die im Falle der Insolvenz ein Recht auf vorzugsweise Befriedigung aus einer Deckungsmasse haben, die nach gesetzlicher Vorschrift zu ihrem Schutz errichtet und staatlich überwacht ist."
    },
    {
      "date": "2025-12-19",
      "id": "140617",
      "original_text": "Registerbekanntmachung nach dem Umwandlungsgesetz\nBerlin Amtsgericht Berlin (Charlottenburg) HRB 230380\nGROPYUS Real Estate VIII UG (haftungsbeschränkt) – Berlin",
      "type": "Registerbekanntmachung nach dem Umwandlungsgesetz",
      "state": "Berlin",
      "amtsgericht": "Amtsgericht Berlin (Charlottenburg)",
      "registernummer": "HRB 230380",
      "registerart": "HRB",
      "company_name": "GROPYUS Real Estate VIII UG (haftungsbeschränkt)",
      "company_seat": "Berlin",
      "details": "19.12.2025 (Bekanntmachungsdatum)\n\nBerlin Amtsgericht Berlin (Charlottenburg) HRB 230380\nRegisterbekanntmachung nach dem Umwandlungsgesetz 18.12.2025 (Eintragungsdatum)\n\nGROPYUS Real Estate VIII UG (haftungsbeschränkt)\nGesellschaft mit beschränkter Haftung\nBerlin\n\nZu Eintragungsnummer 5 vom 18.12.2025 wird als nicht eingetragen veröffentlicht: Den Gläubigern der an der Verschmelzung beteiligten Rechtsträger ist, wenn sie binnen sechs Monaten nach dem Tag, an dem die Eintragung der Verschmelzung in das Register des Sitzes desjenigen Rechtsträgers, dessen Gläubiger sie sind, als bekannt gemacht gilt, ihren Anspruch nach Grund und Höhe schriftlich anmelden, Sicherheit zu leisten, soweit sie nicht Befriedigung verlangen können. Dieses Recht steht den Gläubigern jedoch nur zu, wenn sie glaubhaft machen, dass durch die Verschmelzung die Erfüllung ihrer Forderung gefährdet wird. Das Recht, Sicherheitsleistung zu verlangen, steht Gläubigern nicht zu, die im Falle der Insolvenz ein Recht auf vorzugsweise Befriedigung aus einer Deckungsmasse haben, die nach gesetzlicher Vorschrift zu ihrem Schutz errichtet und staatlich überwacht ist."
    },
    {
      "date": "2025-12-19",
      "id": "140618",
      "original_text": "Registerbekanntmachung nach dem Umwandlungsgesetz\nBaden-Württemberg Amtsgericht Stuttgart HRB 740627\nGDT Gründachtechnik GmbH – Unterensingen",
      "type": "Registerbekanntmachung nach dem Umwandlungsgesetz",
      "state": "Baden-Württemberg",
      "amtsgericht": "Amtsgericht Stuttgart",
      "registernummer": "HRB 740627",
      "registerart": "HRB",
      "company_name": "GDT Gründachtechnik GmbH",
      "company_seat": "Unterensingen",
      "details": "19.12.2025 (Bekanntmachungsdatum)\n\nBaden-Württemberg Amtsgericht Stuttgart HRB 740627\nRegisterbekanntmachung nach dem Umwandlungsgesetz 19.12.2025 (Eintragungsdatum)\n\nGDT Gründachtechnik GmbH\nGesellschaft mit beschränkter Haftung\nUnterensingen\n\nAls nicht eingetragen wird bekanntgemacht:\nDen Gläubigern der an der Verschmelzung beteiligten Rechtsträger ist, wenn sie binnen sechs Monaten nach dem Tag, an dem die Eintragung der Verschmelzung in das Register des Sitzes desjenigen Rechtsträgers, dessen Gläubiger sie sind, nach § 19 Abs. 3 UmwG als bekanntgemacht gilt, ihren Anspruch nach Grund und Höhe schriftlich anmelden, Sicherheit zu leisten, soweit sie nicht Befriedigung verlangen können. Dieses Recht steht den Gläubigern jedoch nur zu, wenn sie glaubhaft machen, dass durch die Verschmelzung die Erfüllung ihrer Forderung gefährdet wird."
    },
    {
      "date": "2025-12-19",
      "id": "140619",
      "original_text": "Löschungsankündigung\nBerlin Amtsgericht Berlin (Charlottenburg) HRB 172450\nBlue Moon UG (haftungsbeschränkt) – Berlin",
      "type": "Löschungsankündigung",
      "state": "Berlin",
      "amtsgericht": "Amtsgericht Berlin (Charlottenburg)",
      "registernummer": "HRB 172450",
      "registerart": "HRB",
      "company_name": "Blue Moon UG (haftungsbeschränkt)",
      "company_seat": "Berlin",
      "details": "19.12.2025 (Bekanntmachungsdatum)\n\nBerlin Amtsgericht Berlin (Charlottenburg) HRB 172450\nLöschungsankündigung\n\nBlue Moon UG (haftungsbeschränkt)\nGesellschaft mit beschränkter Haftung\nBerlin\n\nBei der nachstehenden Gesellschaft wird das Amtslöschungsverfahren gemäß § 394 FamFG eingeleitet. Widerspruchsfrist 6 Wochen"
    },
    {
      "date": "2025-12-19",
      "id": "140620",
      "original_text": "Registerbekanntmachung nach dem Umwandlungsgesetz\nBerlin Amtsgericht Berlin (Charlottenburg) HRB 230498\nGROPYUS Real Estate X UG (haftungsbeschränkt) – Berlin",
      "type": "Registerbekanntmachung nach dem Umwandlungsgesetz",
      "state": "Berlin",
      "amtsgericht": "Amtsgericht Berlin (Charlottenburg)",
      "registernummer": "HRB 230498",
      "registerart": "HRB",
      "company_name": "GROPYUS Real Estate X UG (haftungsbeschränkt)",
      "company_seat": "Berlin",
      "details": "19.12.2025 (Bekanntmachungsdatum)\n\nBerlin Amtsgericht Berlin (Charlottenburg) HRB 230498\nRegisterbekanntmachung nach dem Umwandlungsgesetz 18.12.2025 (Eintragungsdatum)\n\nGROPYUS Real Estate X UG (haftungsbeschränkt)\nGesellschaft mit beschränkter Haftung\nBerlin\n\nZu Eintragungsnummer 5 vom 18.12.2025 wird als nicht eingetragen veröffentlicht: Den Gläubigern der an der Verschmelzung beteiligten Rechtsträger ist, wenn sie binnen sechs Monaten nach dem Tag, an dem die Eintragung der Verschmelzung in das Register des Sitzes desjenigen Rechtsträgers, dessen Gläubiger sie sind, als bekannt gemacht gilt, ihren Anspruch nach Grund und Höhe schriftlich anmelden, Sicherheit zu leisten, soweit sie nicht Befriedigung verlangen können. Dieses Recht steht den Gläubigern jedoch nur zu, wenn sie glaubhaft machen, dass durch die Verschmelzung die Erfüllung ihrer Forderung gefährdet wird. Das Recht, Sicherheitsleistung zu verlangen, steht Gläubigern nicht zu, die im Falle der Insolvenz ein Recht auf vorzugsweise Befriedigung aus einer Deckungsmasse haben, die nach gesetzlicher Vorschrift zu ihrem Schutz errichtet und staatlich überwacht ist."
    },
    {
      "date": "2025-12-19",
      "id": "140621",
      "original_text": "Einreichung neuer Dokumente\nSchleswig-Holstein Amtsgericht Kiel HRB 4876 NO\nLüdemann & Zankel AG – Kaltenkirchen",
      "type": "Einreichung neuer Dokumente",
      "state": "Schleswig-Holstein",
      "amtsgericht": "Amtsgericht Kiel",
      "registernummer": "HRB 4876 NO",
      "registerart": "HRB",
      "company_name": "Lüdemann & Zankel AG",
      "company_seat": "Kaltenkirchen",
      "details": "19.12.2025 (Bekanntmachungsdatum)\n\nSchleswig-Holstein Amtsgericht Kiel HRB 4876 NO\nEinreichung neuer Dokumente\n\nLüdemann & Zankel AG\nAktiengesellschaft\nKaltenkirchen\n\nAls nicht eingetragen wird veröffentlicht: Eine neue Liste der Aufsichtsratsmitglieder ist eingereicht worden."
    },
    {
      "date": "2025-12-19",
      "id": "140622",
      "original_text": "Löschungsankündigung\nBaden-Württemberg Amtsgericht Stuttgart HRA 728913\nHLS AG & Co. KG – Metzingen",
      "type": "Löschungsankündigung",
      "state": "Baden-Württemberg",
      "amtsgericht": "Amtsgericht Stuttgart",
      "registernummer": "HRA 728913",
      "registerart": "HRA",
      "company_name": "HLS AG & Co. KG",
      "company_seat": "Metzingen",
      "details": "19.12.2025 (Bekanntmachungsdatum)\n\nBaden-Württemberg Amtsgericht Stuttgart HRA 728913\nLöschungsankündigung\n\nHLS AG & Co. KG\nKommanditgesellschaft\nMetzingen\n\nDas Gericht beabsichtigt, die Gesellschaft wegen Vermögenslosigkeit im Handelsregister von Amts wegen nach § 394 FamFG zu löschen. Die Frist zur Geltendmachung eines Widerspruchs gegen die beabsichtigte Löschung ist auf zwei Monate ab Veröffentlichung bestimmt."
    },
    {
      "date": "2025-12-19",
      "id": "140623",
      "original_text": "Einreichung neuer Dokumente\nBaden-Württemberg Amtsgericht Stuttgart HRB 401197\nAlbstadtwerke GmbH – Albstadt",
      "type": "Einreichung neuer Dokumente",
      "state": "Baden-Württemberg",
      "amtsgericht": "Amtsgericht Stuttgart",
      "registernummer": "HRB 401197",
      "registerart": "HRB",
      "company_name": "Albstadtwerke GmbH",
      "company_seat": "Albstadt",
      "details": "19.12.2025 (Bekanntmachungsdatum)\n\nBaden-Württemberg Amtsgericht Stuttgart HRB 401197\nEinreichung neuer Dokumente\n\nAlbstadtwerke GmbH\nGesellschaft mit beschränkter Haftung\nAlbstadt\n\nDie Gesellschaft hat am 16.12.2025 die Liste über die Zusammensetzung des Aufsichtsrats zum Handelsregister eingereicht."
    },
    {
      "date": "2025-12-19",
      "id": "140624",
      "original_text": "Einreichung neuer Dokumente\nSchleswig-Holstein Amtsgericht Flensburg HRB 11540\nSchleswig-Holsteinische Landesmuseen Service Gesellschaft mbH – Schleswig",
      "type": "Einreichung neuer Dokumente",
      "state": "Schleswig-Holstein",
      "amtsgericht": "Amtsgericht Flensburg",
      "registernummer": "HRB 11540",
      "registerart": "HRB",
      "company_name": "Schleswig-Holsteinische Landesmuseen Service Gesellschaft mbH",
      "company_seat": "Schleswig",
      "details": "19.12.2025 (Bekanntmachungsdatum)\n\nSchleswig-Holstein Amtsgericht Flensburg HRB 11540\nEinreichung neuer Dokumente\n\nSchleswig-Holsteinische Landesmuseen Service Gesellschaft mbH\nGesellschaft mit beschränkter Haftung\nSchleswig\n\nAls nicht eingetragen wird veröffentlicht: Neue Aufsichtsratsliste nach Änderung eingereicht am 18.12.2025."
    },
    {
      "date": "2025-12-19",
      "id": "140625",
      "original_text": "Registerbekanntmachung nach dem Umwandlungsgesetz\nSaarland Amtsgericht Saarbrücken HRB 43082\nJochem Gruppe Holding GmbH – Illingen",
      "type": "Registerbekanntmachung nach dem Umwandlungsgesetz",
      "state": "Saarland",
      "amtsgericht": "Amtsgericht Saarbrücken",
      "registernummer": "HRB 43082",
      "registerart": "HRB",
      "company_name": "Jochem Gruppe Holding GmbH",
      "company_seat": "Illingen",
      "details": "19.12.2025 (Bekanntmachungsdatum)\n\nSaarland Amtsgericht Saarbrücken HRB 43082\nRegisterbekanntmachung nach dem Umwandlungsgesetz 19.12.2025 (Eintragungsdatum)\n\nJochem Gruppe Holding GmbH\nGesellschaft mit beschränkter Haftung\nIllingen\n\nAls nicht eingetragen wird bekannt gemacht: Den Gläubigern der an der Ausgliederung beteiligten Gesellschaften ist, wenn sie binnen sechs Monaten nach dem Tag, an dem die Eintragung der Ausgliederung in das Register des Sitzes desjenigen Rechtsträgers, dessen Gläubiger sie sind, nach § 19 Absatz 3 UmwG bekannt gemacht worden ist, ihren Anspruch nach Grund und Höhe schriftlich anmelden, Sicherheit zu leisten, soweit sie nicht Befriedigung verlangen können. Dieses Recht steht den Gläubigern jedoch nur zu, wenn sie glaubhaft machen, dass durch die Ausgliederung die Erfüllung ihrer Forderung gefährdet wird."
    },
    {
      "date": "2025-12-19",
      "id": "140626",
      "original_text": "Einreichung neuer Dokumente\nSchleswig-Holstein Amtsgericht Flensburg HRB 4831\nFördeland Therme Glücksburg GmbH – Glücksburg",
      "type": "Einreichung neuer Dokumente",
      "state": "Schleswig-Holstein",
      "amtsgericht": "Amtsgericht Flensburg",
      "registernummer": "HRB 4831",
      "registerart": "HRB",
      "company_name": "Fördeland Therme Glücksburg GmbH",
      "company_seat": "Glücksburg",
      "details": "19.12.2025 (Bekanntmachungsdatum)\n\nSchleswig-Holstein Amtsgericht Flensburg HRB 4831\nEinreichung neuer Dokumente\n\nFördeland Therme Glücksburg GmbH\nGesellschaft mit beschränkter Haftung\nGlücksburg\n\nNeue Aufsichtsratsliste nach Änderung eingereicht am 19.12.2025."
    },
    {
      "date": "2025-12-19",
      "id": "140627",
      "original_text": "Löschungsankündigung\nBaden-Württemberg Amtsgericht Stuttgart HRA 728913\nHLS AG & Co. KG – Metzingen",
      "type": "Löschungsankündigung",
      "state": "Baden-Württemberg",
      "amtsgericht": "Amtsgericht Stuttgart",
      "registernummer": "HRA 728913",
      "registerart": "HRA",
      "company_name": "HLS AG & Co. KG",
      "company_seat": "Metzingen",
      "details": "19.12.2025 (Bekanntmachungsdatum)\n\nBaden-Württemberg Amtsgericht Stuttgart HRA 728913\nLöschungsankündigung\n\nHLS AG & Co. KG\nKommanditgesellschaft\nMetzingen\n\nDie Löschungsankündigung vom 19.12.2025 wird aufgehoben."
    },
    {
      "date": "2025-12-19",
      "id": "140628",
      "original_text": "Einreichung neuer Dokumente\nBerlin Amtsgericht Berlin (Charlottenburg) HRB 275546\nCodesphere SE – Berlin",
      "type": "Einreichung neuer Dokumente",
      "state": "Berlin",
      "amtsgericht": "Amtsgericht Berlin (Charlottenburg)",
      "registernummer": "HRB 275546",
      "registerart": "HRB",
      "company_name": "Codesphere SE",
      "company_seat": "Berlin",
      "details": "19.12.2025 (Bekanntmachungsdatum)\n\nBerlin Amtsgericht Berlin (Charlottenburg) HRB 275546\nEinreichung neuer Dokumente\n\nCodesphere SE\nEuropäische Aktiengesellschaft (SE)\nBerlin\n\nAls nicht eingetragen wird veröffentlicht: Es wurde eine neue Liste der Verwaltungsratsmitglieder eingereicht (§ 106 AktG)."
    },
    {
      "date": "2025-12-19",
      "id": "140629",
      "original_text": "Registerbekanntmachung nach dem Umwandlungsgesetz\nBerlin Amtsgericht Berlin (Charlottenburg) HRB 143630\nWB Waschsalons Verwaltungs GmbH – Berlin",
      "type": "Registerbekanntmachung nach dem Umwandlungsgesetz",
      "state": "Berlin",
      "amtsgericht": "Amtsgericht Berlin (Charlottenburg)",
      "registernummer": "HRB 143630",
      "registerart": "HRB",
      "company_name": "WB Waschsalons Verwaltungs GmbH",
      "company_seat": "Berlin",
      "details": "19.12.2025 (Bekanntmachungsdatum)\n\nBerlin Amtsgericht Berlin (Charlottenburg) HRB 143630\nRegisterbekanntmachung nach dem Umwandlungsgesetz 19.12.2025 (Eintragungsdatum)\n\nWB Waschsalons Verwaltungs GmbH\nGesellschaft mit beschränkter Haftung\nBerlin\n\nZu Eintragungsnummer 3 vom 19.12.2025 wird als nicht eingetragen veröffentlicht: Den Gläubigern der an der Verschmelzung beteiligten Rechtsträger ist, wenn sie binnen sechs Monaten nach dem Tag, an dem die Eintragung der Verschmelzung in das Register des Sitzes desjenigen Rechtsträgers, dessen Gläubiger sie sind, als bekannt gemacht gilt, ihren Anspruch nach Grund und Höhe schriftlich anmelden, Sicherheit zu leisten, soweit sie nicht Befriedigung verlangen können. Dieses Recht steht den Gläubigern jedoch nur zu, wenn sie glaubhaft machen, dass durch die Verschmelzung die Erfüllung ihrer Forderung gefährdet wird. Das Recht, Sicherheitsleistung zu verlangen, steht Gläubigern nicht zu, die im Falle der Insolvenz ein Recht auf vorzugsweise Befriedigung aus einer Deckungsmasse haben, die nach gesetzlicher Vorschrift zu ihrem Schutz errichtet und staatlich überwacht ist."
    },
    {
      "date": "2025-12-19",
      "id": "140630",
      "original_text": "Registerbekanntmachung nach dem Umwandlungsgesetz\nBerlin Amtsgericht Berlin (Charlottenburg) HRB 108542\nB & S Waschsalons Verwaltungs GmbH – Berlin",
      "type": "Registerbekanntmachung nach dem Umwandlungsgesetz",
      "state": "Berlin",
      "amtsgericht": "Amtsgericht Berlin (Charlottenburg)",
      "registernummer": "HRB 108542",
      "registerart": "HRB",
      "company_name": "B & S Waschsalons Verwaltungs GmbH",
      "company_seat": "Berlin",
      "details": "19.12.2025 (Bekanntmachungsdatum)\n\nBerlin Amtsgericht Berlin (Charlottenburg) HRB 108542\nRegisterbekanntmachung nach dem Umwandlungsgesetz 19.12.2025 (Eintragungsdatum)\n\nB & S Waschsalons Verwaltungs GmbH\nGesellschaft mit beschränkter Haftung\nBerlin\n\nZu Eintragungsnummer 6 vom 19.12.2025 wird als nicht eingetragen veröffentlicht: Den Gläubigern der an der Verschmelzung beteiligten Rechtsträger ist, wenn sie binnen sechs Monaten nach dem Tag, an dem die Eintragung der Verschmelzung in das Register des Sitzes desjenigen Rechtsträgers, dessen Gläubiger sie sind, als bekannt gemacht gilt, ihren Anspruch nach Grund und Höhe schriftlich anmelden, Sicherheit zu leisten, soweit sie nicht Befriedigung verlangen können. Dieses Recht steht den Gläubigern jedoch nur zu, wenn sie glaubhaft machen, dass durch die Verschmelzung die Erfüllung ihrer Forderung gefährdet wird. Das Recht, Sicherheitsleistung zu verlangen, steht Gläubigern nicht zu, die im Falle der Insolvenz ein Recht auf vorzugsweise Befriedigung aus einer Deckungsmasse haben, die nach gesetzlicher Vorschrift zu ihrem Schutz errichtet und staatlich überwacht ist."
    },
    {
      "date": "2025-12-19",
      "id": "140631",
      "original_text": "Registerbekanntmachung nach dem Umwandlungsgesetz\nSachsen Amtsgericht Chemnitz HRA 10014\nLKWPark Chemnitz GmbH & Co. KG – Limbach-Oberfrohna",
      "type": "Registerbekanntmachung nach dem Umwandlungsgesetz",
      "state": "Sachsen",
      "amtsgericht": "Amtsgericht Chemnitz",
      "registernummer": "HRA 10014",
      "registerart": "HRA",
      "company_name": "LKWPark Chemnitz GmbH & Co. KG",
      "company_seat": "Limbach-Oberfrohna",
      "details": "19.12.2025 (Bekanntmachungsdatum)\n\nSachsen Amtsgericht Chemnitz HRA 10014\nRegisterbekanntmachung nach dem Umwandlungsgesetz 19.12.2025 (Eintragungsdatum)\n\nLKWPark Chemnitz GmbH & Co. KG\nKommanditgesellschaft\nLimbach-Oberfrohna\n\nDen Gläubigern der an der Verschmelzung beteiligten Rechtsträger ist, wenn sie binnen sechs Monaten nach dem Tag, an dem die Eintragung der Verschmelzung in das Register des Sitzes desjenigen Rechtsträgers, dessen Gläubiger sie sind, nach § 19 Abs. 3 UmwG als bekannt gemacht gilt, ihren Anspruch nach Grund und Höhe in Textform anmelden, Sicherheit zu leisten, soweit sie nicht Befriedigung verlangen können. Dieses Recht steht den Gläubigern jedoch nur zu, wenn sie glaubhaft machen, dass durch die Verschmelzung die Erfüllung der Forderung gefährdet wird."
    },
    {
      "date": "2025-12-19",
      "id": "140632",
      "original_text": "Registerbekanntmachung nach dem Umwandlungsgesetz\nSachsen Amtsgericht Dresden HRB 33616\nJuwelier-Scholze-LC UG (haftungsbeschränkt) – Hoyerswerda",
      "type": "Registerbekanntmachung nach dem Umwandlungsgesetz",
      "state": "Sachsen",
      "amtsgericht": "Amtsgericht Dresden",
      "registernummer": "HRB 33616",
      "registerart": "HRB",
      "company_name": "Juwelier-Scholze-LC UG (haftungsbeschränkt)",
      "company_seat": "Hoyerswerda",
      "details": "19.12.2025 (Bekanntmachungsdatum)\n\nSachsen Amtsgericht Dresden HRB 33616\nRegisterbekanntmachung nach dem Umwandlungsgesetz 19.12.2025 (Eintragungsdatum)\n\nJuwelier-Scholze-LC UG (haftungsbeschränkt)\nGesellschaft mit beschränkter Haftung\nHoyerswerda\n\nDen Gläubigern der an der Verschmelzung beteiligten Rechtsträger ist, wenn sie binnen sechs Monaten nach dem Tag, an dem die Eintragung der Verschmelzung in das Register des Sitzes desjenigen Rechtsträgers, dessen Gläubiger sie sind, nach § 19 Abs. 3 UmwG als bekannt gemacht gilt, ihren Anspruch nach Grund und Höhe in Textform anmelden, Sicherheit zu leisten, soweit sie nicht Befriedigung verlangen können. Dieses Recht steht den Gläubigern jedoch nur zu, wenn sie glaubhaft machen, dass durch die Verschmelzung die Erfüllung der Forderung gefährdet wird."
    },
    {
      "date": "2025-12-19",
      "id": "140633",
      "original_text": "Löschungsankündigung\nSachsen Amtsgericht Leipzig HRA 19191\nContiMaxx Grundbesitz GmbH & Co. Wiedtal KG – Schkeuditz",
      "type": "Löschungsankündigung",
      "state": "Sachsen",
      "amtsgericht": "Amtsgericht Leipzig",
      "registernummer": "HRA 19191",
      "registerart": "HRA",
      "company_name": "ContiMaxx Grundbesitz GmbH & Co. Wiedtal KG",
      "company_seat": "Schkeuditz",
      "details": "19.12.2025 (Bekanntmachungsdatum)\n\nSachsen Amtsgericht Leipzig HRA 19191\nLöschungsankündigung\n\nContiMaxx Grundbesitz GmbH & Co. Wiedtal KG\nKommanditgesellschaft\nSchkeuditz\n\nDas Registergericht beabsichtigt, die im Handelsregister eingetragene Firma von Amts wegen nach § 31 Abs. 2 HGB, 393 FamFG zu löschen. Die Frist zur Erhebung eines Widerspruchs gegen die beabsichtigte Löschung wird auf einen Monat festgesetzt."
    },
    {
      "date": "2025-12-19",
      "id": "140634",
      "original_text": "Registerbekanntmachung nach dem Umwandlungsgesetz\nSachsen Amtsgericht Dresden HRB 41855\nJuwelier-Scholze-AMG UG (haftungsbeschränkt) – Dresden",
      "type": "Registerbekanntmachung nach dem Umwandlungsgesetz",
      "state": "Sachsen",
      "amtsgericht": "Amtsgericht Dresden",
      "registernummer": "HRB 41855",
      "registerart": "HRB",
      "company_name": "Juwelier-Scholze-AMG UG (haftungsbeschränkt)",
      "company_seat": "Dresden",
      "details": "19.12.2025 (Bekanntmachungsdatum)\n\nSachsen Amtsgericht Dresden HRB 41855\nRegisterbekanntmachung nach dem Umwandlungsgesetz\n\nJuwelier-Scholze-AMG UG (haftungsbeschränkt)\nGesellschaft mit beschränkter Haftung\nDresden\n\nDen Gläubigern der an der Verschmelzung beteiligten Rechtsträger ist, wenn sie binnen sechs Monaten nach dem Tag, an dem die Eintragung der Verschmelzung in das Register des Sitzes desjenigen Rechtsträgers, dessen Gläubiger sie sind, nach § 19 Abs. 3 UmwG als bekannt gemacht gilt, ihren Anspruch nach Grund und Höhe in Textform anmelden, Sicherheit zu leisten, soweit sie nicht Befriedigung verlangen können. Dieses Recht steht den Gläubigern jedoch nur zu, wenn sie glaubhaft machen, dass durch die Verschmelzung die Erfüllung der Forderung gefährdet wird."
    },
    {
      "date": "2025-12-19",
      "id": "140635",
      "original_text": "Einreichung neuer Dokumente\nSachsen Amtsgericht Chemnitz HRB 24890\nFossa AG Gesellschaft für Softwareentwicklung, -integration und -administration – Chemnitz",
      "type": "Einreichung neuer Dokumente",
      "state": "Sachsen",
      "amtsgericht": "Amtsgericht Chemnitz",
      "registernummer": "HRB 24890",
      "registerart": "HRB",
      "company_name": "Fossa AG Gesellschaft für Softwareentwicklung, -integration und -administration",
      "company_seat": "Chemnitz",
      "details": "19.12.2025 (Bekanntmachungsdatum)\n\nSachsen Amtsgericht Chemnitz HRB 24890\nEinreichung neuer Dokumente\n\nFossa AG Gesellschaft für Softwareentwicklung, -integration und -administration\nAktiengesellschaft\nChemnitz\n\nAm 16.12.2025 wurde beim Handelsregister des Amtsgerichts Chemnitz die Liste der Mitglieder des Aufsichtsrats gemäß § 106 AktG eingereicht."
    },
    {
      "date": "2025-12-19",
      "id": "140636",
      "original_text": "Einreichung neuer Dokumente\nSachsen Amtsgericht Chemnitz HRB 16389\nTechnologie Centrum Chemnitz GmbH – Chemnitz",
      "type": "Einreichung neuer Dokumente",
      "state": "Sachsen",
      "amtsgericht": "Amtsgericht Chemnitz",
      "registernummer": "HRB 16389",
      "registerart": "HRB",
      "company_name": "Technologie Centrum Chemnitz GmbH",
      "company_seat": "Chemnitz",
      "details": "19.12.2025 (Bekanntmachungsdatum)\n\nSachsen Amtsgericht Chemnitz HRB 16389\nEinreichung neuer Dokumente\n\nTechnologie Centrum Chemnitz GmbH\nGesellschaft mit beschränkter Haftung\nChemnitz\n\nAm 18.12.2025 wurde beim Handelsregister des Amtsgerichts Chemnitz die Liste der Mitglieder des Aufsichtsrats gemäß § 52 GmbHG eingereicht."
    },
    {
      "date": "2025-12-19",
      "id": "140637",
      "original_text": "Sonstige Registerbekanntmachung\nSachsen Amtsgericht Dresden HRB 1517\nSachsengarage GmbH – Dresden",
      "type": "Sonstige Registerbekanntmachung",
      "state": "Sachsen",
      "amtsgericht": "Amtsgericht Dresden",
      "registernummer": "HRB 1517",
      "registerart": "HRB",
      "company_name": "Sachsengarage GmbH",
      "company_seat": "Dresden",
      "details": "19.12.2025 (Bekanntmachungsdatum)\n\nSachsen Amtsgericht Dresden HRB 1517\nSonstige Registerbekanntmachung 19.12.2025 (Eintragungsdatum)\n\nSachsengarage GmbH\nGesellschaft mit beschränkter Haftung\nDresden\n\nDen Gläubigern der Gesellschaft, deren Forderungen begründet worden sind bevor die Eintragung der Beendigung des Beherrschungs- und Gewinnabführungsvertrages in das Handelsregister nach § 10 des Handelsgesetzbuches als bekanntgemacht gilt, hat der andere Vertragsteil Sicherheit zu leisten, wenn sie sich binnen sechs Monaten nach der Bekanntmachung der Eintragung zu diesem Zweck bei ihm melden."
    },
    {
      "date": "2025-12-19",
      "id": "140638",
      "original_text": "Registerbekanntmachung nach dem Umwandlungsgesetz\nHessen Amtsgericht Fritzlar HRA 16426\nRauter Immobilienverwaltung GmbH & Co. KG – Homberg (Efze)",
      "type": "Registerbekanntmachung nach dem Umwandlungsgesetz",
      "state": "Hessen",
      "amtsgericht": "Amtsgericht Fritzlar",
      "registernummer": "HRA 16426",
      "registerart": "HRA",
      "company_name": "Rauter Immobilienverwaltung GmbH & Co. KG",
      "company_seat": "Homberg (Efze)",
      "details": "19.12.2025 (Bekanntmachungsdatum)\n\nHessen Amtsgericht Fritzlar HRA 16426\nRegisterbekanntmachung nach dem Umwandlungsgesetz 19.12.2025 (Eintragungsdatum)\n\nRauter Immobilienverwaltung GmbH & Co. KG\nKommanditgesellschaft\nHomberg (Efze)\n\nDen Gläubigern der an der formwechselnden Umwandlung beteiligten Rechtsträger ist, wenn sie binnen sechs Monaten nach dem Tag, an dem die Eintragung der formwechselnden Umwandlung in das Register des Sitzes desjenigen Rechtsträgers, dessen Gläubiger sie sind, nach § 201 UmwG bekannt gemacht worden ist, ihren Anspruch nach Grund und Höhe schriftlich anmelden, Sicherheit zu leisten, soweit sie nicht Befriedigung verlangen können. Dieses Recht steht den Gläubigern jedoch nur zu, wenn sie glaubhaft machen, dass durch die formwechselnden Umwandlung die Erfüllung ihrer Forderung gefährdet wird."
    },
    {
      "date": "2025-12-19",
      "id": "140639",
      "original_text": "Registerbekanntmachung nach dem Umwandlungsgesetz\nHessen Amtsgericht Darmstadt HRB 95904\nKDG 3. Beteiligungs GmbH – Bensheim",
      "type": "Registerbekanntmachung nach dem Umwandlungsgesetz",
      "state": "Hessen",
      "amtsgericht": "Amtsgericht Darmstadt",
      "registernummer": "HRB 95904",
      "registerart": "HRB",
      "company_name": "KDG 3. Beteiligungs GmbH",
      "company_seat": "Bensheim",
      "details": "19.12.2025 (Bekanntmachungsdatum)\n\nHessen Amtsgericht Darmstadt HRB 95904\nRegisterbekanntmachung nach dem Umwandlungsgesetz 19.12.2025 (Eintragungsdatum)\n\nKDG 3. Beteiligungs GmbH\nGesellschaft mit beschränkter Haftung\nBensheim\n\nDen Gläubigern der an der Verschmelzung beteiligten Rechtsträger ist, wenn sie binnen sechs Monaten nach dem Tag, an dem die Eintragung der Verschmelzung in das Register des Sitzes derjenigen Rechtsträger deren Gläubiger sie sind, nach § 19 Absatz 3 UmwG bekannt gemacht worden ist, ihren Anspruch nach Grund und Höhe schriftlich anmelden, Sicherheit zu leisten, soweit sie nicht Befriedigung verlangen können. Dieses Recht steht den Gläubigern jedoch nur zu, wenn sie glaubhaft machen, dass durch die Verschmelzung die Erfüllung ihrer Forderung gefährdet wird."
    },
    {
      "date": "2025-12-19",
      "id": "140640",
      "original_text": "Löschungsankündigung\nHessen Amtsgericht Wiesbaden HRB 25550\nCLARIFON GmbH – Flörsheim",
      "type": "Löschungsankündigung",
      "state": "Hessen",
      "amtsgericht": "Amtsgericht Wiesbaden",
      "registernummer": "HRB 25550",
      "registerart": "HRB",
      "company_name": "CLARIFON GmbH",
      "company_seat": "Flörsheim",
      "details": "19.12.2025 (Bekanntmachungsdatum)\n\nHessen Amtsgericht Wiesbaden HRB 25550\nLöschungsankündigung\n\nCLARIFON GmbH\nGesellschaft mit beschränkter Haftung\nFlörsheim\n\nDas Registergericht beabsichtigt die im Handelsregister eingetragene Gesellschaft von Amts wegen nach § 394 FamFG zu löschen. Die Frist zur Erhebung eines Widerspruchs gegen die beabsichtigte Löschung wird auf 3 Monate festgesetzt."
    },
    {
      "date": "2025-12-19",
      "id": "140641",
      "original_text": "Registerbekanntmachung nach dem Umwandlungsgesetz\nHessen Amtsgericht Fritzlar HRA 14317\nRauter Spedition GmbH & Co. KG – Homberg (Efze)",
      "type": "Registerbekanntmachung nach dem Umwandlungsgesetz",
      "state": "Hessen",
      "amtsgericht": "Amtsgericht Fritzlar",
      "registernummer": "HRA 14317",
      "registerart": "HRA",
      "company_name": "Rauter Spedition GmbH & Co. KG",
      "company_seat": "Homberg (Efze)",
      "details": "19.12.2025 (Bekanntmachungsdatum)\n\nHessen Amtsgericht Fritzlar HRA 14317\nRegisterbekanntmachung nach dem Umwandlungsgesetz 19.12.2025 (Eintragungsdatum)\n\nRauter Spedition GmbH & Co. KG\nKommanditgesellschaft\nHomberg (Efze)\n\nDen Gläubigern der an der formwechselnden Umwandlung beteiligten Rechtsträger ist, wenn sie binnen sechs Monaten nach dem Tag, an dem die Eintragung der formwechselnden Umwandlung in das Register des Sitzes desjenigen Rechtsträgers, dessen Gläubiger sie sind, nach § 201 UmwG bekannt gemacht worden ist, ihren Anspruch nach Grund und Höhe schriftlich anmelden, Sicherheit zu leisten, soweit sie nicht Befriedigung verlangen können. Dieses Recht steht den Gläubigern jedoch nur zu, wenn sie glaubhaft machen, dass durch die formwechselnden Umwandlung die Erfüllung ihrer Forderung gefährdet wird."
    },
    {
      "date": "2025-12-19",
      "id": "140642",
      "original_text": "Einreichung neuer Dokumente\nHessen Amtsgericht Offenbach am Main HRB 11497\nHoneywell Deutschland Holding GmbH – Offenbach am Main",
      "type": "Einreichung neuer Dokumente",
      "state": "Hessen",
      "amtsgericht": "Amtsgericht Offenbach am Main",
      "registernummer": "HRB 11497",
      "registerart": "HRB",
      "company_name": "Honeywell Deutschland Holding GmbH",
      "company_seat": "Offenbach am Main",
      "details": "19.12.2025 (Bekanntmachungsdatum)\n\nHessen Amtsgericht Offenbach am Main HRB 11497\nEinreichung neuer Dokumente 19.12.2025 (Eintragungsdatum)\n\nHoneywell Deutschland Holding GmbH\nGesellschaft mit beschränkter Haftung\nOffenbach am Main\n\nDurch eine Änderung in den Personen der Aufsichtsratsmitglieder ist eine Liste der Mitglieder des Aufsichtsrates zum Handelsregister eingereicht worden."
    },
    {
      "date": "2025-12-19",
      "id": "140643",
      "original_text": "Löschungsankündigung\nHessen Amtsgericht Frankfurt am Main HRB 128650\nOnly Drive GmbH – Frankfurt am Main",
      "type": "Löschungsankündigung",
      "state": "Hessen",
      "amtsgericht": "Amtsgericht Frankfurt am Main",
      "registernummer": "HRB 128650",
      "registerart": "HRB",
      "company_name": "Only Drive GmbH",
      "company_seat": "Frankfurt am Main",
      "details": "19.12.2025 (Bekanntmachungsdatum)\n\nHessen Amtsgericht Frankfurt am Main HRB 128650\nLöschungsankündigung\n\nOnly Drive GmbH\nGesellschaft mit beschränkter Haftung\nFrankfurt am Main\n\nEs ist beabsichtigt, die Gesellschaft wegen Vermögenslosigkeit gemäß § 394 FamFG von Amts wegen im Handelsregister zu löschen. Hiergegen kann innerhalb eines Monats nach dieser Veröffentlichung Widerspruch bei dem Amtsgericht Frankfurt am Main eingelegt werden."
    },
    {
      "date": "2025-12-19",
      "id": "140644",
      "original_text": "Registerbekanntmachung nach dem Umwandlungsgesetz\nHessen Amtsgericht Darmstadt HRB 91011\nDietz Logistik 6. Grundbesitz GmbH – Bensheim",
      "type": "Registerbekanntmachung nach dem Umwandlungsgesetz",
      "state": "Hessen",
      "amtsgericht": "Amtsgericht Darmstadt",
      "registernummer": "HRB 91011",
      "registerart": "HRB",
      "company_name": "Dietz Logistik 6. Grundbesitz GmbH",
      "company_seat": "Bensheim",
      "details": "19.12.2025 (Bekanntmachungsdatum)\n\nHessen Amtsgericht Darmstadt HRB 91011\nRegisterbekanntmachung nach dem Umwandlungsgesetz 19.12.2025 (Eintragungsdatum)\n\nDietz Logistik 6. Grundbesitz GmbH\nGesellschaft mit beschränkter Haftung\nBensheim\n\nDen Gläubigern der an der Verschmelzung beteiligten Rechtsträger ist, wenn sie binnen sechs Monaten nach dem Tag, an dem die Eintragung der Verschmelzung in das Register des Sitzes derjenigen Rechtsträger deren Gläubiger sie sind, nach § 19 Absatz 3 UmwG bekannt gemacht worden ist, ihren Anspruch nach Grund und Höhe schriftlich anmelden, Sicherheit zu leisten, soweit sie nicht Befriedigung verlangen können. Dieses Recht steht den Gläubigern jedoch nur zu, wenn sie glaubhaft machen, dass durch die Verschmelzung die Erfüllung ihrer Forderung gefährdet wird."
    },
    {
      "date": "2025-12-19",
      "id": "140645",
      "original_text": "Sonstige Registerbekanntmachung\nHessen Amtsgericht Limburg VR 1159\nTreffpunkt Dornburg e.V. Handwerk-Handel-Industrie – Frickhofen",
      "type": "Sonstige Registerbekanntmachung",
      "state": "Hessen",
      "amtsgericht": "Amtsgericht Limburg",
      "registernummer": "VR 1159",
      "registerart": "VR",
      "company_name": "Treffpunkt Dornburg e.V. Handwerk-Handel-Industrie",
      "company_seat": "Frickhofen",
      "details": "19.12.2025 (Bekanntmachungsdatum)\n\nHessen Amtsgericht Limburg VR 1159\nSonstige Registerbekanntmachung 19.12.2025 (Eintragungsdatum)\n\nTreffpunkt Dornburg e.V. Handwerk-Handel-Industrie\neingetragener Verein\nFrickhofen\n\nDer Verein ist aufgelöst und liquidationslos erloschen."
    },
    {
      "date": "2025-12-19",
      "id": "140646",
      "original_text": "Löschungsankündigung\nHessen Amtsgericht Frankfurt am Main HRA 49812\nMV-Holding GmbH & Co. KG – Frankfurt am Main",
      "type": "Löschungsankündigung",
      "state": "Hessen",
      "amtsgericht": "Amtsgericht Frankfurt am Main",
      "registernummer": "HRA 49812",
      "registerart": "HRA",
      "company_name": "MV-Holding GmbH & Co. KG",
      "company_seat": "Frankfurt am Main",
      "details": "19.12.2025 (Bekanntmachungsdatum)\n\nHessen Amtsgericht Frankfurt am Main HRA 49812\nLöschungsankündigung 19.12.2025 (Eintragungsdatum)\n\nMV-Holding GmbH & Co. KG\nKommanditgesellschaft\nFrankfurt am Main\n\nEs ist beabsichtigt die Gesellschaft wegen Vermögenslosigkeit gemäß § 394 FamFG von Amts wegen zu löschen. Hiergegen kann innerhalb eines Monats nach dieser Veröffentlichung Widerspruch bei dem Amtsgericht Frankfurt am Main eingelegt werden."
    },
    {
      "date": "2025-12-19",
      "id": "140647",
      "original_text": "Einreichung neuer Dokumente\nHessen Amtsgericht Offenbach am Main HRB 4429\nStadtwerke Offenbach Holding GmbH – Offenbach am Main",
      "type": "Einreichung neuer Dokumente",
      "state": "Hessen",
      "amtsgericht": "Amtsgericht Offenbach am Main",
      "registernummer": "HRB 4429",
      "registerart": "HRB",
      "company_name": "Stadtwerke Offenbach Holding GmbH",
      "company_seat": "Offenbach am Main",
      "details": "19.12.2025 (Bekanntmachungsdatum)\n\nHessen Amtsgericht Offenbach am Main HRB 4429\nEinreichung neuer Dokumente\n\nStadtwerke Offenbach Holding GmbH\nGesellschaft mit beschränkter Haftung\nOffenbach am Main\n\nDurch eine Änderung in den Personen der Aufsichtsratsmitglieder ist eine Liste der Mitglieder des Aufsichtsrates zum Handelsregister eingereicht worden."
    },
    {
      "date": "2025-12-19",
      "id": "140648",
      "original_text": "Einreichung neuer Dokumente\nNiedersachsen Amtsgericht Hildesheim HRB 210473\nBTV braun teleCom AG – Sarstedt",
      "type": "Einreichung neuer Dokumente",
      "state": "Niedersachsen",
      "amtsgericht": "Amtsgericht Hildesheim",
      "registernummer": "HRB 210473",
      "registerart": "HRB",
      "company_name": "BTV braun teleCom AG",
      "company_seat": "Sarstedt",
      "details": "19.12.2025 (Bekanntmachungsdatum)\n\nNiedersachsen Amtsgericht Hildesheim HRB 210473\nEinreichung neuer Dokumente 19.12.2025 (Eintragungsdatum)\n\nBTV braun teleCom AG\nAktiengesellschaft\nSarstedt\n\nDie Liste der Mitglieder des Aufsichtsrats wurde beim Registergericht eingereicht."
    },
    {
      "date": "2025-12-19",
      "id": "140649",
      "original_text": "Löschungsankündigung\nNiedersachsen Amtsgericht Osnabrück HRB 208371\nPower + Efficiency mG Unternehmergesellschaft (haftungsbeschränkt) – Osnabrück",
      "type": "Löschungsankündigung",
      "state": "Niedersachsen",
      "amtsgericht": "Amtsgericht Osnabrück",
      "registernummer": "HRB 208371",
      "registerart": "HRB",
      "company_name": "Power + Efficiency mG Unternehmergesellschaft (haftungsbeschränkt)",
      "company_seat": "Osnabrück",
      "details": "19.12.2025 (Bekanntmachungsdatum)\n\nNiedersachsen Amtsgericht Osnabrück HRB 208371\nLöschungsankündigung\n\nPower + Efficiency mG Unternehmergesellschaft (haftungsbeschränkt)\nGesellschaft mit beschränkter Haftung\nOsnabrück\n\nDas Registergericht beabsichtigt, die Gesellschaft von Amts wegen nach § 394 FamFG wegen Vermögenslosigkeit zu löschen. Die Frist zur Erhebung eines Widerspruchs ist auf 1 Monat ab dieser Registerbekanntmachung festgesetzt."
    },
    {
      "date": "2025-12-19",
      "id": "140650",
      "original_text": "Registerbekanntmachung nach dem Umwandlungsgesetz\nNiedersachsen Amtsgericht Göttingen HRB 201003\nvelonauten UG (haftungsbeschränkt) – Göttingen",
      "type": "Registerbekanntmachung nach dem Umwandlungsgesetz",
      "state": "Niedersachsen",
      "amtsgericht": "Amtsgericht Göttingen",
      "registernummer": "HRB 201003",
      "registerart": "HRB",
      "company_name": "velonauten UG (haftungsbeschränkt)",
      "company_seat": "Göttingen",
      "details": "19.12.2025 (Bekanntmachungsdatum)\n\nNiedersachsen Amtsgericht Göttingen HRB 201003\nRegisterbekanntmachung nach dem Umwandlungsgesetz 19.12.2025 (Eintragungsdatum)\n\nvelonauten UG (haftungsbeschränkt)\nGesellschaft mit beschränkter Haftung\nGöttingen\n\nDen Gläubigern der an der Verschmelzung beteiligten Rechtsträger ist, wenn sie binnen sechs Monaten nach dem Tag, an dem die Eintragung der Verschmelzung in das Register des Sitzes desjenigen Rechtsträgers, dessen Gläubiger sie sind, nach § 19  Abs.  3 UmwG als bekannt gemacht gilt, ihren Anspruch nach Grund und Höhe schriftlich anmelden, Sicherheit zu leisten, soweit sie nicht Befriedigung verlangen können. Dieses Recht steht den Gläubigern jedoch nur zu, wenn sie glaubhaft machen, dass durch die Verschmelzung die Erfüllung der Forderung gefährdet wird."
    },
    {
      "date": "2025-12-19",
      "id": "140651",
      "original_text": "Registerbekanntmachung nach dem Umwandlungsgesetz\nNiedersachsen Amtsgericht Oldenburg (Oldenburg) HRB 215938\nWirko Service & Handels GmbH – Oldenburg",
      "type": "Registerbekanntmachung nach dem Umwandlungsgesetz",
      "state": "Niedersachsen",
      "amtsgericht": "Amtsgericht Oldenburg (Oldenburg)",
      "registernummer": "HRB 215938",
      "registerart": "HRB",
      "company_name": "Wirko Service & Handels GmbH",
      "company_seat": "Oldenburg",
      "details": "19.12.2025 (Bekanntmachungsdatum)\n\nNiedersachsen Amtsgericht Oldenburg (Oldenburg) HRB 215938\nRegisterbekanntmachung nach dem Umwandlungsgesetz 19.12.2025 (Eintragungsdatum)\n\nWirko Service & Handels GmbH\nGesellschaft mit beschränkter Haftung\nOldenburg\n\nDen Gläubigern der an der Verschmelzung beteiligten Rechtsträger ist, wenn sie binnen sechs Monaten nach dem Tag, an dem die Eintragung der Verschmelzung in das Register des Sitzes desjenigen Rechtsträgers, dessen Gläubiger sie sind, nach § 19  Abs.  3 UmwG als bekannt gemacht gilt, ihren Anspruch nach Grund und Höhe schriftlich anmelden, Sicherheit zu leisten, soweit sie nicht Befriedigung verlangen können. Dieses Recht steht den Gläubigern jedoch nur zu, wenn sie glaubhaft machen, dass durch die Verschmelzung die Erfüllung der Forderung gefährdet wird."
    },
    {
      "date": "2025-12-19",
      "id": "140652",
      "original_text": "Registerbekanntmachung nach dem Umwandlungsgesetz\nNiedersachsen Amtsgericht Oldenburg (Oldenburg) HRB 216852\nIN's Bevenhusen Ferienpark GmbH – Oldenburg",
      "type": "Registerbekanntmachung nach dem Umwandlungsgesetz",
      "state": "Niedersachsen",
      "amtsgericht": "Amtsgericht Oldenburg (Oldenburg)",
      "registernummer": "HRB 216852",
      "registerart": "HRB",
      "company_name": "IN's Bevenhusen Ferienpark GmbH",
      "company_seat": "Oldenburg",
      "details": "19.12.2025 (Bekanntmachungsdatum)\n\nNiedersachsen Amtsgericht Oldenburg (Oldenburg) HRB 216852\nRegisterbekanntmachung nach dem Umwandlungsgesetz 19.12.2025 (Eintragungsdatum)\n\nIN's Bevenhusen Ferienpark GmbH\nGesellschaft mit beschränkter Haftung\nOldenburg\n\nDen Gläubigern der an der Verschmelzung beteiligten Rechtsträger ist, wenn sie binnen sechs Monaten nach dem Tag, an dem die Eintragung der Verschmelzung in das Register des Sitzes desjenigen Rechtsträgers, dessen Gläubiger sie sind, nach § 19  Abs.  3 UmwG als bekannt gemacht gilt, ihren Anspruch nach Grund und Höhe schriftlich anmelden, Sicherheit zu leisten, soweit sie nicht Befriedigung verlangen können. Dieses Recht steht den Gläubigern jedoch nur zu, wenn sie glaubhaft machen, dass durch die Verschmelzung die Erfüllung der Forderung gefährdet wird."
    },
    {
      "date": "2025-12-19",
      "id": "140653",
      "original_text": "Registerbekanntmachung nach dem Umwandlungsgesetz\nNiedersachsen Amtsgericht Hannover HRB 111157 früher Amtsgericht Neustadt a. Rbge. (Neustadt)\nBuildingPoint Deutschland Nord GmbH – Wunstorf",
      "type": "Registerbekanntmachung nach dem Umwandlungsgesetz",
      "state": "Niedersachsen",
      "amtsgericht": "Amtsgericht Hannover",
      "registernummer": "HRB 111157",
      "registerart": "HRB",
      "company_name": "BuildingPoint Deutschland Nord GmbH",
      "company_seat": "Wunstorf",
      "former_amtsgericht": "Neustadt a. Rbge. (Neustadt)",
      "details": "19.12.2025 (Bekanntmachungsdatum)\n\nNiedersachsen Amtsgericht Hannover HRB 111157 früher Amtsgericht Neustadt a. Rbge. (Neustadt)\nRegisterbekanntmachung nach dem Umwandlungsgesetz 19.12.2025 (Eintragungsdatum)\n\nBuildingPoint Deutschland Nord GmbH\nGesellschaft mit beschränkter Haftung\nWunstorf\n\nDen Gläubigern der an der Verschmelzung beteiligten Rechtsträger ist, wenn sie binnen sechs Monaten nach dem Tag, an dem die Eintragung der Verschmelzung in das Register des Sitzes desjenigen Rechtsträgers, dessen Gläubiger sie sind, nach § 19  Abs.  3 UmwG als bekannt gemacht gilt, ihren Anspruch nach Grund und Höhe schriftlich anmelden, Sicherheit zu leisten, soweit sie nicht Befriedigung verlangen können. Dieses Recht steht den Gläubigern jedoch nur zu, wenn sie glaubhaft machen, dass durch die Verschmelzung die Erfüllung der Forderung gefährdet wird."
    },
    {
      "date": "2025-12-19",
      "id": "140654",
      "original_text": "Löschungsankündigung\nNiedersachsen Amtsgericht Tostedt HRB 208745\nMagnus Lifttechnik GmbH – Zeven",
      "type": "Löschungsankündigung",
      "state": "Niedersachsen",
      "amtsgericht": "Amtsgericht Tostedt",
      "registernummer": "HRB 208745",
      "registerart": "HRB",
      "company_name": "Magnus Lifttechnik GmbH",
      "company_seat": "Zeven",
      "details": "19.12.2025 (Bekanntmachungsdatum)\n\nNiedersachsen Amtsgericht Tostedt HRB 208745\nLöschungsankündigung\n\nMagnus Lifttechnik GmbH\nGesellschaft mit beschränkter Haftung\nZeven\n\nDas Registergericht beabsichtigt, die Gesellschaft von Amts wegen nach § 394 FamFG zu löschen. Die Frist zur Erhebung eines Widerspruchs ist auf 1 Monat ab dieser Registerbekanntmachung festgesetzt."
    },
    {
      "date": "2025-12-19",
      "id": "140655",
      "original_text": "Registerbekanntmachung nach dem Umwandlungsgesetz\nNiedersachsen Amtsgericht Göttingen HRB 206606\nHartmut Otto Trading GmbH – Göttingen",
      "type": "Registerbekanntmachung nach dem Umwandlungsgesetz",
      "state": "Niedersachsen",
      "amtsgericht": "Amtsgericht Göttingen",
      "registernummer": "HRB 206606",
      "registerart": "HRB",
      "company_name": "Hartmut Otto Trading GmbH",
      "company_seat": "Göttingen",
      "details": "19.12.2025 (Bekanntmachungsdatum)\n\nNiedersachsen Amtsgericht Göttingen HRB 206606\nRegisterbekanntmachung nach dem Umwandlungsgesetz 19.12.2025 (Eintragungsdatum)\n\nHartmut Otto Trading GmbH\nGesellschaft mit beschränkter Haftung\nGöttingen\n\nDen Gläubigern der an der Verschmelzung beteiligten Rechtsträger ist, wenn sie binnen sechs Monaten nach dem Tag, an dem die Eintragung der Verschmelzung in das Register des Sitzes desjenigen Rechtsträgers, dessen Gläubiger sie sind, nach § 19  Abs.  3 UmwG als bekannt gemacht gilt, ihren Anspruch nach Grund und Höhe schriftlich anmelden, Sicherheit zu leisten, soweit sie nicht Befriedigung verlangen können. Dieses Recht steht den Gläubigern jedoch nur zu, wenn sie glaubhaft machen, dass durch die Verschmelzung die Erfüllung der Forderung gefährdet wird."
    },
    {
      "date": "2025-12-19",
      "id": "140656",
      "original_text": "Registerbekanntmachung nach dem Umwandlungsgesetz\nNiedersachsen Amtsgericht Hannover HRB 50373\nMerkur Spielbanken Niedersachsen GmbH – Hannover",
      "type": "Registerbekanntmachung nach dem Umwandlungsgesetz",
      "state": "Niedersachsen",
      "amtsgericht": "Amtsgericht Hannover",
      "registernummer": "HRB 50373",
      "registerart": "HRB",
      "company_name": "Merkur Spielbanken Niedersachsen GmbH",
      "company_seat": "Hannover",
      "details": "19.12.2025 (Bekanntmachungsdatum)\n\nNiedersachsen Amtsgericht Hannover HRB 50373\nRegisterbekanntmachung nach dem Umwandlungsgesetz 19.12.2025 (Eintragungsdatum)\n\nMerkur Spielbanken Niedersachsen GmbH\nGesellschaft mit beschränkter Haftung\nHannover\n\nDen Gläubigern der an der Verschmelzung beteiligten Rechtsträger ist, wenn sie binnen sechs Monaten nach dem Tag, an dem die Eintragung der Verschmelzung in das Register des Sitzes desjenigen Rechtsträgers, dessen Gläubiger sie sind, nach § 19  Abs.  3 UmwG als bekannt gemacht gilt, ihren Anspruch nach Grund und Höhe schriftlich anmelden, Sicherheit zu leisten, soweit sie nicht Befriedigung verlangen können. Dieses Recht steht den Gläubigern jedoch nur zu, wenn sie glaubhaft machen, dass durch die Verschmelzung die Erfüllung der Forderung gefährdet wird."
    },
    {
      "date": "2025-12-19",
      "id": "140657",
      "original_text": "Löschungsankündigung\nRheinland-Pfalz Amtsgericht Montabaur HRB 10582\nGEIST Transportgesellschaft mit beschränkter Haftung – Hilgenroth",
      "type": "Löschungsankündigung",
      "state": "Rheinland-Pfalz",
      "amtsgericht": "Amtsgericht Montabaur",
      "registernummer": "HRB 10582",
      "registerart": "HRB",
      "company_name": "GEIST Transportgesellschaft mit beschränkter Haftung",
      "company_seat": "Hilgenroth",
      "details": "19.12.2025 (Bekanntmachungsdatum)\n\nRheinland-Pfalz Amtsgericht Montabaur HRB 10582\nLöschungsankündigung\n\nGEIST Transportgesellschaft mit beschränkter Haftung\nGesellschaft mit beschränkter Haftung\nHilgenroth\n\nDas Registergericht beabsichtigt die Gesellschaft von Amts wegen nach § 394 FamFG zu löschen. Die Frist zur Erhebung eines Widerspruchs ist auf einen Monat festgesetzt."
    },
    {
      "date": "2025-12-19",
      "id": "140658",
      "original_text": "Registerbekanntmachung nach dem Umwandlungsgesetz\nRheinland-Pfalz Amtsgericht Koblenz HRB 31576\nHahn CMP GmbH – Koblenz",
      "type": "Registerbekanntmachung nach dem Umwandlungsgesetz",
      "state": "Rheinland-Pfalz",
      "amtsgericht": "Amtsgericht Koblenz",
      "registernummer": "HRB 31576",
      "registerart": "HRB",
      "company_name": "Hahn CMP GmbH",
      "company_seat": "Koblenz",
      "details": "19.12.2025 (Bekanntmachungsdatum)\n\nRheinland-Pfalz Amtsgericht Koblenz HRB 31576\nRegisterbekanntmachung nach dem Umwandlungsgesetz 19.12.2025 (Eintragungsdatum)\n\nHahn CMP GmbH\nGesellschaft mit beschränkter Haftung\nKoblenz\n\nAls nicht eingetragen wird veröffentlicht: Den Gläubigern der an der Umwandlung beteiligten Rechtsträger ist, wenn sie binnen sechs Monaten nach dem Tag, an dem die Eintragung der Umwandlung in das Register des Sitzes desjenigen Rechtsträgers, dessen Gläubiger sie sind, nach § 19 Abs. 3 UmwG als bekannt gemacht gilt, ihren Anspruch nach Grund und Höhe schriftlich anmelden, Sicherheit zu leisten, soweit sie nicht Befriedigung verlangen können. Dieses Recht steht den Gläubigern jedoch nur zu, wenn sie glaubhaft machen, dass durch die Umwandlung die Erfüllung der Forderung gefährdet wird."
    },
    {
      "date": "2025-12-19",
      "id": "140659",
      "original_text": "Registerbekanntmachung nach dem Umwandlungsgesetz\nRheinland-Pfalz Amtsgericht Koblenz HRA 23217\nHahn CMP Holding UG (haftungsbeschränkt) & Co. KG – Koblenz",
      "type": "Registerbekanntmachung nach dem Umwandlungsgesetz",
      "state": "Rheinland-Pfalz",
      "amtsgericht": "Amtsgericht Koblenz",
      "registernummer": "HRA 23217",
      "registerart": "HRA",
      "company_name": "Hahn CMP Holding UG (haftungsbeschränkt) & Co. KG",
      "company_seat": "Koblenz",
      "details": "19.12.2025 (Bekanntmachungsdatum)\n\nRheinland-Pfalz Amtsgericht Koblenz HRA 23217\nRegisterbekanntmachung nach dem Umwandlungsgesetz 19.12.2025 (Eintragungsdatum)\n\nHahn CMP Holding UG (haftungsbeschränkt) & Co. KG\nKommanditgesellschaft\nKoblenz\n\nAls nicht eingetragen wird veröffentlicht:\nDen Gläubigern des formwechselnden Rechtsträgers ist, wenn sie binnen sechs Monaten nach dem Tag, an dem die Eintragung des Formwechsels nach § 201 UmwG als bekannt gemacht gilt, ihren Anspruch nach Grund und Höhe schriftlich anmelden, Sicherheit zu leisten, soweit sie nicht Befriedigung verlangen können. Dieses Recht steht den Gläubigern jedoch nur zu, wenn sie glaubhaft machen, dass durch den Formwechsel die Erfüllung der Forderung gefährdet wird."
    },
    {
      "date": "2025-12-19",
      "id": "140660",
      "original_text": "Einreichung neuer Dokumente\nRheinland-Pfalz Amtsgericht Kaiserslautern HRB 3089\nWestpfalz-Klinikum GmbH – Kaiserslautern",
      "type": "Einreichung neuer Dokumente",
      "state": "Rheinland-Pfalz",
      "amtsgericht": "Amtsgericht Kaiserslautern",
      "registernummer": "HRB 3089",
      "registerart": "HRB",
      "company_name": "Westpfalz-Klinikum GmbH",
      "company_seat": "Kaiserslautern",
      "details": "19.12.2025 (Bekanntmachungsdatum)\n\nRheinland-Pfalz Amtsgericht Kaiserslautern HRB 3089\nEinreichung neuer Dokumente 19.12.2025 (Eintragungsdatum)\n\nWestpfalz-Klinikum GmbH\nGesellschaft mit beschränkter Haftung\nKaiserslautern\n\nDem Registergericht ist eine neue Liste der Mitglieder des Aufsichtsrates eingereicht worden."
    },
    {
      "date": "2025-12-19",
      "id": "140661",
      "original_text": "Einreichung neuer Dokumente\nBremen Amtsgericht Bremen HRB 4761\nM3B GmbH – Bremen",
      "type": "Einreichung neuer Dokumente",
      "state": "Bremen",
      "amtsgericht": "Amtsgericht Bremen",
      "registernummer": "HRB 4761",
      "registerart": "HRB",
      "company_name": "M3B GmbH",
      "company_seat": "Bremen",
      "details": "19.12.2025 (Bekanntmachungsdatum)\n\nBremen Amtsgericht Bremen HRB 4761\nEinreichung neuer Dokumente\n\nM3B GmbH\nGesellschaft mit beschränkter Haftung\nBremen\n\nAls nicht eingetragen wird veröffentlicht: Liste des Aufsichtsrats wurde eingereicht."
    },
    {
      "date": "2025-12-19",
      "id": "140662",
      "original_text": "Löschungsankündigung\nBremen Amtsgericht Bremen HRB 35272\nWolf Löwenzahn GmbH – Bremen",
      "type": "Löschungsankündigung",
      "state": "Bremen",
      "amtsgericht": "Amtsgericht Bremen",
      "registernummer": "HRB 35272",
      "registerart": "HRB",
      "company_name": "Wolf Löwenzahn GmbH",
      "company_seat": "Bremen",
      "details": "19.12.2025 (Bekanntmachungsdatum)\n\nBremen Amtsgericht Bremen HRB 35272\nLöschungsankündigung\n\nWolf Löwenzahn GmbH\nGesellschaft mit beschränkter Haftung\nBremen\n\nEs ist beabsichtigt die im Handelsregister eingetragene Gesellschaft von Amts wegen gemäß § 394 FamFG zu löschen. Gegen die Löschung kann beim AG Bremen schriftlich oder zu Protokoll der Geschäftsstelle Widerspruch eingelegt werden. Widerspruchsfrist 4 Wochen."
    },
    {
      "date": "2025-12-19",
      "id": "140663",
      "original_text": "Einreichung neuer Dokumente\nNordrhein-Westfalen Amtsgericht Mönchengladbach HRB 2170\nGemeinnützige Kreisbau Aktiengesellschaft – Mönchengladbach",
      "type": "Einreichung neuer Dokumente",
      "state": "Nordrhein-Westfalen",
      "amtsgericht": "Amtsgericht Mönchengladbach",
      "registernummer": "HRB 2170",
      "registerart": "HRB",
      "company_name": "Gemeinnützige Kreisbau Aktiengesellschaft",
      "company_seat": "Mönchengladbach",
      "details": "19.12.2025 (Bekanntmachungsdatum)\n\nNordrhein-Westfalen Amtsgericht Mönchengladbach HRB 2170\nEinreichung neuer Dokumente 19.11.2025 (Eintragungsdatum)\n\nGemeinnützige Kreisbau Aktiengesellschaft\nAktiengesellschaft\nMönchengladbach\n\nDem Registergericht ist eine neue Liste der Mitglieder des Aufsichtsrates eingereicht worden."
    },
    {
      "date": "2025-12-19",
      "id": "140664",
      "original_text": "Registerbekanntmachung nach dem Umwandlungsgesetz\nNordrhein-Westfalen Amtsgericht Köln HRB 117255\nATVANTAGE GmbH – Köln",
      "type": "Registerbekanntmachung nach dem Umwandlungsgesetz",
      "state": "Nordrhein-Westfalen",
      "amtsgericht": "Amtsgericht Köln",
      "registernummer": "HRB 117255",
      "registerart": "HRB",
      "company_name": "ATVANTAGE GmbH",
      "company_seat": "Köln",
      "details": "19.12.2025 (Bekanntmachungsdatum)\n\nNordrhein-Westfalen Amtsgericht Köln HRB 117255\nRegisterbekanntmachung nach dem Umwandlungsgesetz 19.12.2025 (Eintragungsdatum)\n\nATVANTAGE GmbH\nGesellschaft mit beschränkter Haftung\nKöln\n\nDen Gläubigern der an der Verschmelzung beteiligten Rechtsträger ist, wenn sie binnen sechs Monaten nach dem Tag, an dem die Eintragung der Verschmelzung in das Register des Sitzes desjenigen Rechtsträgers, dessen Gläubiger sie sind, nach § 19 Absatz 3 UmwG als bekanntgemacht gilt, ihren Anspruch nach Grund und Höhe schriftlich anmelden, Sicherheit zu leisten, soweit sie nicht Befriedigung verlangen können. Dieses Recht steht den Gläubigern jedoch nur zu, wenn sie glaubhaft machen, dass durch die Verschmelzung die Erfüllung ihrer Forderung gefährdet wird."
    },
    {
      "date": "2025-12-19",
      "id": "140665",
      "original_text": "Löschungsankündigung\nNordrhein-Westfalen Amtsgericht Gelsenkirchen HRB 19146\nS-A-V-A Bau GmbH – Gelsenkirchen",
      "type": "Löschungsankündigung",
      "state": "Nordrhein-Westfalen",
      "amtsgericht": "Amtsgericht Gelsenkirchen",
      "registernummer": "HRB 19146",
      "registerart": "HRB",
      "company_name": "S-A-V-A Bau GmbH",
      "company_seat": "Gelsenkirchen",
      "details": "19.12.2025 (Bekanntmachungsdatum)\n\nNordrhein-Westfalen Amtsgericht Gelsenkirchen HRB 19146\nLöschungsankündigung\n\nS-A-V-A Bau GmbH\nGesellschaft mit beschränkter Haftung\nGelsenkirchen\n\nDas Gericht beabsichtigt, die im Handelsregister eingetragene S-A-V-A Bau GmbH mit Sitz in Gelsenkirchen, HRB 19146, Amtsgericht Gelsenkirchen, wegen Vermögenslosigkeit zu löschen.\nHiermit wird denjenigen, die an der Unterlassung der Löschung ein berechtigtes Interesse haben, gem. § 394 Abs. 2 FamFG Gelegenheit gegeben, gegen dieses Vorhaben binnen eines Monats nach dieser Bekanntmachung Widerspruch einzulegen. Der Widerspruch kann schriftlich oder zu Protokoll der Geschäftsstelle erhoben werden."
    },
    {
      "date": "2025-12-19",
      "id": "140666",
      "original_text": "Registerbekanntmachung nach dem Umwandlungsgesetz\nNordrhein-Westfalen Amtsgericht Arnsberg HRB 3194\nEberhard Pilz Sportvertriebs-GmbH – Meschede",
      "type": "Registerbekanntmachung nach dem Umwandlungsgesetz",
      "state": "Nordrhein-Westfalen",
      "amtsgericht": "Amtsgericht Arnsberg",
      "registernummer": "HRB 3194",
      "registerart": "HRB",
      "company_name": "Eberhard Pilz Sportvertriebs-GmbH",
      "company_seat": "Meschede",
      "details": "19.12.2025 (Bekanntmachungsdatum)\n\nNordrhein-Westfalen Amtsgericht Arnsberg HRB 3194\nRegisterbekanntmachung nach dem Umwandlungsgesetz 19.12.2025 (Eintragungsdatum)\n\nEberhard Pilz Sportvertriebs-GmbH\nGesellschaft mit beschränkter Haftung\nMeschede\n\nDen Gläubigern der an der Verschmelzung beteiligten Rechtsträger ist, wenn sie binnen sechs Monaten nach dem Tag, an dem die Eintragung der Verschmelzung in das Register des Sitzes desjenigen Rechtsträgers, dessen Gläubiger sie sind, nach § 19 Absatz 3 UmwG als bekanntgemacht gilt, ihren Anspruch nach Grund und Höhe schriftlich anmelden, Sicherheit zu leisten, soweit sie nicht Befriedigung verlangen können. Dieses Recht steht den Gläubigern jedoch nur zu, wenn sie glaubhaft machen, dass durch die Verschmelzung die Erfüllung ihrer Forderung gefährdet wird."
    },
    {
      "date": "2025-12-19",
      "id": "140667",
      "original_text": "Registerbekanntmachung nach dem Umwandlungsgesetz\nNordrhein-Westfalen Amtsgericht Siegen HRB 6908\nLatza GmbH – Attendorn",
      "type": "Registerbekanntmachung nach dem Umwandlungsgesetz",
      "state": "Nordrhein-Westfalen",
      "amtsgericht": "Amtsgericht Siegen",
      "registernummer": "HRB 6908",
      "registerart": "HRB",
      "company_name": "Latza GmbH",
      "company_seat": "Attendorn",
      "details": "19.12.2025 (Bekanntmachungsdatum)\n\nNordrhein-Westfalen Amtsgericht Siegen HRB 6908\nRegisterbekanntmachung nach dem Umwandlungsgesetz 19.12.2025 (Eintragungsdatum)\n\nLatza GmbH\nGesellschaft mit beschränkter Haftung\nAttendorn\n\nDen Gläubigern der an der Verschmelzung beteiligten Rechtsträger ist, wenn sie binnen sechs Monaten nach dem Tag, an dem die Eintragung der Verschmelzung in das Register des Sitzes desjenigen Rechtsträgers, dessen Gläubiger sie sind, nach § 19 Absatz 3 UmwG als bekanntgemacht gilt, ihren Anspruch nach Grund und Höhe schriftlich anmelden, Sicherheit zu leisten, soweit sie nicht Befriedigung verlangen können. Dieses Recht steht den Gläubigern jedoch nur zu, wenn sie glaubhaft machen, dass durch die Verschmelzung die Erfüllung ihrer Forderung gefährdet wird."
    },
    {
      "date": "2025-12-19",
      "id": "140668",
      "original_text": "Einreichung neuer Dokumente\nNordrhein-Westfalen Amtsgericht Köln HRB 98575\nLOGEX Healthcare Analytics AG – Köln",
      "type": "Einreichung neuer Dokumente",
      "state": "Nordrhein-Westfalen",
      "amtsgericht": "Amtsgericht Köln",
      "registernummer": "HRB 98575",
      "registerart": "HRB",
      "company_name": "LOGEX Healthcare Analytics AG",
      "company_seat": "Köln",
      "details": "19.12.2025 (Bekanntmachungsdatum)\n\nNordrhein-Westfalen Amtsgericht Köln HRB 98575\nEinreichung neuer Dokumente 19.12.2025 (Eintragungsdatum)\n\nLOGEX Healthcare Analytics AG\nAktiengesellschaft\nKöln\n\nDem Registergericht ist eine neue Liste der Mitglieder des Aufsichtsrates eingereicht worden."
    },
    {
      "date": "2025-12-19",
      "id": "140669",
      "original_text": "Registerbekanntmachung nach dem Umwandlungsgesetz\nNordrhein-Westfalen Amtsgericht Düsseldorf HRB 110207\nHR Heroes GmbH – Düsseldorf",
      "type": "Registerbekanntmachung nach dem Umwandlungsgesetz",
      "state": "Nordrhein-Westfalen",
      "amtsgericht": "Amtsgericht Düsseldorf",
      "registernummer": "HRB 110207",
      "registerart": "HRB",
      "company_name": "HR Heroes GmbH",
      "company_seat": "Düsseldorf",
      "details": "19.12.2025 (Bekanntmachungsdatum)\n\nNordrhein-Westfalen Amtsgericht Düsseldorf HRB 110207\nRegisterbekanntmachung nach dem Umwandlungsgesetz 19.12.2025 (Eintragungsdatum)\n\nHR Heroes GmbH\nGesellschaft mit beschränkter Haftung\nDüsseldorf\n\nDen Gläubigern der an der Verschmelzung beteiligten Rechtsträger ist, wenn sie binnen sechs Monaten nach dem Tag, an dem die Eintragung der Verschmelzung in das Register des Sitzes desjenigen Rechtsträgers, dessen Gläubiger sie sind, nach § 19 Absatz 3 UmwG als bekanntgemacht gilt, ihren Anspruch nach Grund und Höhe schriftlich anmelden, Sicherheit zu leisten, soweit sie nicht Befriedigung verlangen können. Dieses Recht steht den Gläubigern jedoch nur zu, wenn sie glaubhaft machen, dass durch die Verschmelzung die Erfüllung ihrer Forderung gefährdet wird."
    },
    {
      "date": "2025-12-19",
      "id": "140670",
      "original_text": "Löschungsankündigung\nNordrhein-Westfalen Amtsgericht Düsseldorf HRB 75984\nSocial 1 GmbH – Düsseldorf",
      "type": "Löschungsankündigung",
      "state": "Nordrhein-Westfalen",
      "amtsgericht": "Amtsgericht Düsseldorf",
      "registernummer": "HRB 75984",
      "registerart": "HRB",
      "company_name": "Social 1 GmbH",
      "company_seat": "Düsseldorf",
      "details": "19.12.2025 (Bekanntmachungsdatum)\n\nNordrhein-Westfalen Amtsgericht Düsseldorf HRB 75984\nLöschungsankündigung\n\nSocial 1 GmbH\nGesellschaft mit beschränkter Haftung\nDüsseldorf\n\nDas Registergericht beabsichtigt die Gesellschaft von Amts wegen nach § 394 FamFG zu löschen. Die Frist zur Erhebung eines Widerspruchs ist auf #DV.Fr(Text=\"Bitte wählen Sie die Widerspruchsfrist aus!\",Eingabe=\"einen Monat\",\"zwei Monate\",\"drei Monate\",\"#insert(Text=\"Freitext\")\"|\"freier Text\") festgesetzt.\n\nRechtsbehelfsbelehrung:\nDas Widerspruchsrecht steht jedem zu, der an der Unterlassung der Löschung ein berechtigtes Interesse hat. Der Widerspruch ist bei dem Amtsgericht Düsseldorf -Registergericht-, Werdener Straße 1, 40227 Düsseldorf schriftlich in deutscher Sprache oder zur Niederschrift der Geschäftsstelle einzulegen. Der Widerspruch kann auch zur Niederschrift der Geschäftsstelle eines jeden Amtsgerichtes abgegeben werden. Die Einlegung ist auch durch Übertragung eines elektronischen Dokuments an die elektronische Poststelle des Gerichts möglich. Das elektronische Dokument muss für die Bearbeitung durch das Gericht geeignet und mit einer qualifizierten elektronischen Signatur der verantwortenden Person versehen sein oder von der verantwortenden Person signiert und auf einem sicheren Übermittlungsweg gemäß § 130a ZPO nach näherer Maßgabe der Verordnung über die technischen Rahmenbedingungen des elektronischen Rechtsverkehrs und über das besondere elektronische Behördenpostfach (BGBl. I, S.3803) eingereicht werden. Weitere Informationen erhalten Sie auf der Internetseite www.justiz.de.\nDer Widerspruch muss spätestens innerhalb der gesetzten Frist nach dem Datum der Bekanntmachung der Löschungsankündigung bei dem Amtsgericht - Registergericht - Düsseldorf eingegangen sein.  Dies gilt auch dann, wenn der Widerspruch zur Niederschrift der Geschäftsstelle eines anderen Amtsgerichtes abgegeben wurde. Die Frist beginnt mit dem Tage der Bekanntmachung der Löschungsankündigung in dem für die Bekanntmachung der Eintragungen in das Handelsregister bestimmten elektronischen Informations- und Kommunikationssystem nach § 10 des Handelsgesetzbuches. Fällt das Ende der Frist auf einen Sonntag, einen allgemeinen Feiertag oder Sonnabend, so endet die Frist mit Ablauf des nächsten Werktages.\nDer Widerspruch muss die Bezeichnung der angefochtenen Löschungsankündigung sowie die Erklärung enthalten, dass Widerspruch gegen diese Löschungsankündigung eingelegt wird. Er ist zu unterzeichnen und soll begründet werden."
    },
    {
      "date": "2025-12-19",
      "id": "140671",
      "original_text": "Registerbekanntmachung nach dem Umwandlungsgesetz\nNordrhein-Westfalen Amtsgericht Bielefeld HRA 17455\nTKKG Hausverwaltung e.K. – Bielefeld",
      "type": "Registerbekanntmachung nach dem Umwandlungsgesetz",
      "state": "Nordrhein-Westfalen",
      "amtsgericht": "Amtsgericht Bielefeld",
      "registernummer": "HRA 17455",
      "registerart": "HRA",
      "company_name": "TKKG Hausverwaltung e.K.",
      "company_seat": "Bielefeld",
      "details": "19.12.2025 (Bekanntmachungsdatum)\n\nNordrhein-Westfalen Amtsgericht Bielefeld HRA 17455\nRegisterbekanntmachung nach dem Umwandlungsgesetz 19.12.2025 (Eintragungsdatum)\n\nTKKG Hausverwaltung e.K.\nEinzelkaufmann / Einzelkauffrau\nBielefeld\n\nDen Gläubigern der an der Ausgliederung beteiligten Rechtsträger ist, wenn sie binnen sechs Monaten nach dem Tag, an dem die Eintragung der Ausgliederung in das Register des Sitzes desjenigen Rechtsträgers, dessen Gläubiger sie sind, nach § 19 Absatz 3 UmwG als bekanntgemacht gilt, ihren Anspruch nach Grund und Höhe schriftlich anmelden, Sicherheit zu leisten, soweit sie nicht Befriedigung verlangen können. Dieses Recht steht den Gläubigern jedoch nur zu, wenn sie glaubhaft machen, dass durch die Ausgliederung die Erfüllung ihrer Forderung gefährdet wird."
    },
    {
      "date": "2025-12-19",
      "id": "140672",
      "original_text": "Löschungsankündigung\nNordrhein-Westfalen Amtsgericht Dortmund HRB 25007\nGIMATEC Anlagenbau GmbH – Werne",
      "type": "Löschungsankündigung",
      "state": "Nordrhein-Westfalen",
      "amtsgericht": "Amtsgericht Dortmund",
      "registernummer": "HRB 25007",
      "registerart": "HRB",
      "company_name": "GIMATEC Anlagenbau GmbH",
      "company_seat": "Werne",
      "details": "19.12.2025 (Bekanntmachungsdatum)\n\nNordrhein-Westfalen Amtsgericht Dortmund HRB 25007\nLöschungsankündigung 19.12.2025 (Eintragungsdatum)\n\nGIMATEC Anlagenbau GmbH\nGesellschaft mit beschränkter Haftung\nWerne\n\nDas Registergericht beabsichtigt die Gesellschaft von Amts wegen nach § 394 FamFG zu löschen. Die Frist zur Erhebung eines Widerspruchs ist auf zwei Monate festgesetzt."
    },
    {
      "date": "2025-12-19",
      "id": "140673",
      "original_text": "Registerbekanntmachung nach dem Umwandlungsgesetz\nNordrhein-Westfalen Amtsgericht Steinfurt HRB 10811\nCafe Extrablatt Grünstraße GmbH – Emsdetten",
      "type": "Registerbekanntmachung nach dem Umwandlungsgesetz",
      "state": "Nordrhein-Westfalen",
      "amtsgericht": "Amtsgericht Steinfurt",
      "registernummer": "HRB 10811",
      "registerart": "HRB",
      "company_name": "Cafe Extrablatt Grünstraße GmbH",
      "company_seat": "Emsdetten",
      "details": "19.12.2025 (Bekanntmachungsdatum)\n\nNordrhein-Westfalen Amtsgericht Steinfurt HRB 10811\nRegisterbekanntmachung nach dem Umwandlungsgesetz 19.12.2025 (Eintragungsdatum)\n\nCafe Extrablatt Grünstraße GmbH\nGesellschaft mit beschränkter Haftung\nEmsdetten\n\nDen Gläubigern der an der Verschmelzung beteiligten Rechtsträger ist, wenn sie binnen sechs Monaten nach dem Tag, an dem die Eintragung der Verschmelzung in das Register des Sitzes derjenigen Rechtsträger deren Gläubiger sie sind, nach § 19 Absatz 3 UmwG als bekanntgemacht gilt, ihren Anspruch nach Grund und Höhe schriftlich anmelden, Sicherheit zu leisten, soweit sie nicht Befriedigung verlangen können. Dieses Recht steht den Gläubigern jedoch nur zu, wenn sie glaubhaft machen, dass durch die Verschmelzung die Erfüllung ihrer Forderung gefährdet wird."
    },
    {
      "date": "2025-12-19",
      "id": "140674",
      "original_text": "Löschungsankündigung\nNordrhein-Westfalen Amtsgericht Siegen HRB 6889\nAWS Spritzgießtechnik Wüllner GmbH – Attendorn-Mecklinghausen",
      "type": "Löschungsankündigung",
      "state": "Nordrhein-Westfalen",
      "amtsgericht": "Amtsgericht Siegen",
      "registernummer": "HRB 6889",
      "registerart": "HRB",
      "company_name": "AWS Spritzgießtechnik Wüllner GmbH",
      "company_seat": "Attendorn-Mecklinghausen",
      "details": "19.12.2025 (Bekanntmachungsdatum)\n\nNordrhein-Westfalen Amtsgericht Siegen HRB 6889\nLöschungsankündigung\n\nAWS Spritzgießtechnik Wüllner GmbH\nGesellschaft mit beschränkter Haftung\nAttendorn-Mecklinghausen\n\nDas Registergericht beabsichtigt die Gesellschaft von Amts wegen nach § 394 FamFG zu löschen. Die Frist zur Erhebung eines Widerspruchs ist auf drei Monate festgesetzt."
    },
    {
      "date": "2025-12-19",
      "id": "140675",
      "original_text": "Registerbekanntmachung nach dem Umwandlungsgesetz\nNordrhein-Westfalen Amtsgericht Steinfurt HRB 9258\nCafe Extrablatt VermietungsGmbH – Emsdetten",
      "type": "Registerbekanntmachung nach dem Umwandlungsgesetz",
      "state": "Nordrhein-Westfalen",
      "amtsgericht": "Amtsgericht Steinfurt",
      "registernummer": "HRB 9258",
      "registerart": "HRB",
      "company_name": "Cafe Extrablatt VermietungsGmbH",
      "company_seat": "Emsdetten",
      "details": "19.12.2025 (Bekanntmachungsdatum)\n\nNordrhein-Westfalen Amtsgericht Steinfurt HRB 9258\nRegisterbekanntmachung nach dem Umwandlungsgesetz 19.12.2025 (Eintragungsdatum)\n\nCafe Extrablatt VermietungsGmbH\nGesellschaft mit beschränkter Haftung\nEmsdetten\n\nDen Gläubigern der an der Verschmelzung beteiligten Rechtsträger ist, wenn sie binnen sechs Monaten nach dem Tag, an dem die Eintragung der Verschmelzung in das Register des Sitzes derjenigen Rechtsträger deren Gläubiger sie sind, nach § 19 Absatz 3 UmwG als bekanntgemacht gilt, ihren Anspruch nach Grund und Höhe schriftlich anmelden, Sicherheit zu leisten, soweit sie nicht Befriedigung verlangen können. Dieses Recht steht den Gläubigern jedoch nur zu, wenn sie glaubhaft machen, dass durch die Verschmelzung die Erfüllung ihrer Forderung gefährdet wird."
    },
    {
      "date": "2025-12-19",
      "id": "140676",
      "original_text": "Löschungsankündigung\nNordrhein-Westfalen Amtsgericht Münster HRB 22035\nZVG Zentrale I Unternehmergesellschaft (haftungsbeschränkt) – Münster",
      "type": "Löschungsankündigung",
      "state": "Nordrhein-Westfalen",
      "amtsgericht": "Amtsgericht Münster",
      "registernummer": "HRB 22035",
      "registerart": "HRB",
      "company_name": "ZVG Zentrale I Unternehmergesellschaft (haftungsbeschränkt)",
      "company_seat": "Münster",
      "details": "19.12.2025 (Bekanntmachungsdatum)\n\nNordrhein-Westfalen Amtsgericht Münster HRB 22035\nLöschungsankündigung\n\nZVG Zentrale I Unternehmergesellschaft (haftungsbeschränkt)\nGesellschaft mit beschränkter Haftung\nMünster\n\nDas Registergericht beabsichtigt die Gesellschaft von Amts wegen nach § 394 FamFG zu löschen. Die Frist zur Erhebung eines Widerspruchs ist auf 3 Wochen festgesetzt."
    },
    {
      "date": "2025-12-19",
      "id": "140677",
      "original_text": "Registerbekanntmachung nach dem Umwandlungsgesetz\nNordrhein-Westfalen Amtsgericht Düsseldorf VR 20215 früher Amtsgericht Ratingen\nAero-Club Ratingen e.V. – Ratingen",
      "type": "Registerbekanntmachung nach dem Umwandlungsgesetz",
      "state": "Nordrhein-Westfalen",
      "amtsgericht": "Amtsgericht Düsseldorf",
      "registernummer": "VR 20215",
      "registerart": "VR",
      "company_name": "Aero-Club Ratingen e.V.",
      "company_seat": "Ratingen",
      "former_amtsgericht": "Ratingen",
      "details": "19.12.2025 (Bekanntmachungsdatum)\n\nNordrhein-Westfalen Amtsgericht Düsseldorf VR 20215 früher Amtsgericht Ratingen\nRegisterbekanntmachung nach dem Umwandlungsgesetz 19.12.2025 (Eintragungsdatum)\n\nAero-Club Ratingen e.V.\neingetragener Verein\nRatingen\n\nDen Gläubigern der an der Verschmelzung beteiligten Rechtsträger ist, wenn sie binnen sechs Monaten nach dem Tag, an dem die Eintragung der Verschmelzung in das Register des Sitzes desjenigen Rechtsträgers, dessen Gläubiger sie sind, nach § 19 Absatz 3 UmwG als bekanntgemacht gilt, ihren Anspruch nach Grund und Höhe schriftlich anmelden, Sicherheit zu leisten, soweit sie nicht Befriedigung verlangen können. Dieses Recht steht den Gläubigern jedoch nur zu, wenn sie glaubhaft machen, dass durch die Verschmelzung die Erfüllung ihrer Forderung gefährdet wird."
    },
    {
      "date": "2025-12-19",
      "id": "140678",
      "original_text": "Registerbekanntmachung nach dem Umwandlungsgesetz\nNordrhein-Westfalen Amtsgericht Steinfurt HRB 12103\nco:listic GmbH – Rheine",
      "type": "Registerbekanntmachung nach dem Umwandlungsgesetz",
      "state": "Nordrhein-Westfalen",
      "amtsgericht": "Amtsgericht Steinfurt",
      "registernummer": "HRB 12103",
      "registerart": "HRB",
      "company_name": "co:listic GmbH",
      "company_seat": "Rheine",
      "details": "19.12.2025 (Bekanntmachungsdatum)\n\nNordrhein-Westfalen Amtsgericht Steinfurt HRB 12103\nRegisterbekanntmachung nach dem Umwandlungsgesetz 19.12.2025 (Eintragungsdatum)\n\nco:listic GmbH\nGesellschaft mit beschränkter Haftung\nRheine\n\nDen Gläubigern der an der Verschmelzung beteiligten Rechtsträger ist, wenn sie binnen sechs Monaten nach dem Tag, an dem die Eintragung der Verschmelzung in das Register des Sitzes desjenigen Rechtsträgers, dessen Gläubiger sie sind, nach § 19 Absatz 3 UmwG als bekanntgemacht gilt, ihren Anspruch nach Grund und Höhe schriftlich anmelden, Sicherheit zu leisten, soweit sie nicht Befriedigung verlangen können. Dieses Recht steht den Gläubigern jedoch nur zu, wenn sie glaubhaft machen, dass durch die Verschmelzung die Erfüllung ihrer Forderung gefährdet wird."
    },
    {
      "date": "2025-12-19",
      "id": "140679",
      "original_text": "Registerbekanntmachung nach dem Umwandlungsgesetz\nNordrhein-Westfalen Amtsgericht Düsseldorf HRB 26170\nLindner Hotels Aktiengesellschaft – Düsseldorf",
      "type": "Registerbekanntmachung nach dem Umwandlungsgesetz",
      "state": "Nordrhein-Westfalen",
      "amtsgericht": "Amtsgericht Düsseldorf",
      "registernummer": "HRB 26170",
      "registerart": "HRB",
      "company_name": "Lindner Hotels Aktiengesellschaft",
      "company_seat": "Düsseldorf",
      "details": "19.12.2025 (Bekanntmachungsdatum)\n\nNordrhein-Westfalen Amtsgericht Düsseldorf HRB 26170\nRegisterbekanntmachung nach dem Umwandlungsgesetz 19.12.2025 (Eintragungsdatum)\n\nLindner Hotels Aktiengesellschaft\nAktiengesellschaft\nDüsseldorf\n\nDen Gläubigern der an der Verschmelzung beteiligten Rechtsträger ist, wenn sie binnen sechs Monaten nach dem Tag, an dem die Eintragung der Verschmelzung in das Register des Sitzes desjenigen Rechtsträgers, dessen Gläubiger sie sind, nach § 19 Absatz 3 UmwG als bekanntgemacht gilt, ihren Anspruch nach Grund und Höhe schriftlich anmelden, Sicherheit zu leisten, soweit sie nicht Befriedigung verlangen können. Dieses Recht steht den Gläubigern jedoch nur zu, wenn sie glaubhaft machen, dass durch die Verschmelzung die Erfüllung ihrer Forderung gefährdet wird."
    },
    {
      "date": "2025-12-19",
      "id": "140680",
      "original_text": "Löschungsankündigung\nNordrhein-Westfalen Amtsgericht Siegen HRB 11098\nPBW Handels- und Beratungs GmbH – Wilnsdorf",
      "type": "Löschungsankündigung",
      "state": "Nordrhein-Westfalen",
      "amtsgericht": "Amtsgericht Siegen",
      "registernummer": "HRB 11098",
      "registerart": "HRB",
      "company_name": "PBW Handels- und Beratungs GmbH",
      "company_seat": "Wilnsdorf",
      "details": "19.12.2025 (Bekanntmachungsdatum)\n\nNordrhein-Westfalen Amtsgericht Siegen HRB 11098\nLöschungsankündigung\n\nPBW Handels- und Beratungs GmbH\nGesellschaft mit beschränkter Haftung\nWilnsdorf\n\nDas Registergericht beabsichtigt die Gesellschaft von Amts wegen nach § 394 FamFG zu löschen. Die Frist zur Erhebung eines Widerspruchs ist auf drei Monate festgesetzt."
    },
    {
      "date": "2025-12-19",
      "id": "140681",
      "original_text": "Löschungsankündigung\nNordrhein-Westfalen Amtsgericht Essen HRB 30541\nZur Glocke UG (haftungsbeschränkt) – Hattingen",
      "type": "Löschungsankündigung",
      "state": "Nordrhein-Westfalen",
      "amtsgericht": "Amtsgericht Essen",
      "registernummer": "HRB 30541",
      "registerart": "HRB",
      "company_name": "Zur Glocke UG (haftungsbeschränkt)",
      "company_seat": "Hattingen",
      "details": "19.12.2025 (Bekanntmachungsdatum)\n\nNordrhein-Westfalen Amtsgericht Essen HRB 30541\nLöschungsankündigung\n\nZur Glocke UG (haftungsbeschränkt)\nGesellschaft mit beschränkter Haftung\nHattingen\n\nDas Registergericht beabsichtigt die Gesellschaft von Amts wegen nach § 394 FamFG zu löschen. Die Frist zur Erhebung eines Widerspruchs ist auf einen Monat festgesetzt."
    },
    {
      "date": "2025-12-19",
      "id": "140682",
      "original_text": "Einreichung neuer Dokumente\nNordrhein-Westfalen Amtsgericht Düsseldorf HRB 91148\nSmart Concepts AG – Düsseldorf",
      "type": "Einreichung neuer Dokumente",
      "state": "Nordrhein-Westfalen",
      "amtsgericht": "Amtsgericht Düsseldorf",
      "registernummer": "HRB 91148",
      "registerart": "HRB",
      "company_name": "Smart Concepts AG",
      "company_seat": "Düsseldorf",
      "details": "19.12.2025 (Bekanntmachungsdatum)\n\nNordrhein-Westfalen Amtsgericht Düsseldorf HRB 91148\nEinreichung neuer Dokumente 19.12.2025 (Eintragungsdatum)\n\nSmart Concepts AG\nAktiengesellschaft\nDüsseldorf\n\nDem Registergericht ist ein neues Hauptversammlungsprotokoll eingereicht worden."
    },
    {
      "date": "2025-12-19",
      "id": "140683",
      "original_text": "Löschungsankündigung\nNordrhein-Westfalen Amtsgericht Siegburg HRB 18100\nFinflowing GmbH – Siegburg",
      "type": "Löschungsankündigung",
      "state": "Nordrhein-Westfalen",
      "amtsgericht": "Amtsgericht Siegburg",
      "registernummer": "HRB 18100",
      "registerart": "HRB",
      "company_name": "Finflowing GmbH",
      "company_seat": "Siegburg",
      "details": "19.12.2025 (Bekanntmachungsdatum)\n\nNordrhein-Westfalen Amtsgericht Siegburg HRB 18100\nLöschungsankündigung\n\nFinflowing GmbH\nGesellschaft mit beschränkter Haftung\nSiegburg\n\nDas Registergericht hat glaubhafte Kenntnis erlangt, dass die Gesellschaft vermögenslos geworden ist, da ein Insolvenzeröffnungsantrag mangels Masse nach § 26 InsO zurückgewiesen wurde.\n\nEs ist daher beabsichtigt, die Gesellschaft nach § 394 FamFG im Handelsregister wegen Vermögenslosigkeit zu löschen.\nEinwände gegen die Löschung sind durch Widerspruch binnen einer Frist von 3 Monaten geltend zu machen, andernfalls die Löschung erfolgen wird.\n\nEinzulegen ist der Widerspruch bei dem Amtsgericht Siegburg, Neue Poststraße 16, 53721 Siegburg, und zwar entweder schriftlich in deutscher Sprache oder mündlich zur Niederschrift der Geschäftsstelle. Der Widerspruch kann auch zur Niederschrift der Geschäftsstelle eines jeden Amtsgerichts abgegeben werden. Der Widerspruch ist binnen der in der Verfügung bestimmten Frist einzulegen. Die Frist ist nur gewahrt, wenn der Widerspruch rechtzeitig bei dem Amtsgericht Siegburg eingeht, auch wenn der Widerspruch zur Niederschrift der Geschäftsstelle eines anderen Amtsgerichts abgegeben wurde. Die Frist beginnt jeweils mit der schriftlichen Bekanntgabe der Verfügung an die Beteiligten. Kann die schriftliche Bekanntgabe an einen Beteiligten nicht bewirkt werden, beginnt die Frist spätestens mit Ablauf von fünf Monaten nach Erlass der Verfügung. Die Bekanntgabe ist entweder durch Zustellung oder am dritten Tage nach Aufgabe zur Post bewirkt. Sofern die Löschung noch nicht erfolgt ist, kann der Widerspruch auch noch nach Ablauf der Frist eingelegt werden. Fällt das Ende der Frist auf einen Sonnabend, einen Sonntag oder einen allgemeinen Feiertag, endet die Frist mit Ablauf des nächsten Werktages. Der Widerspruch ist zu unterzeichnen. Eine Begründung des Widerspruchs ist nicht vorgeschrieben."
    },
    {
      "date": "2025-12-19",
      "id": "140684",
      "original_text": "Registerbekanntmachung nach dem Umwandlungsgesetz\nNordrhein-Westfalen Amtsgericht Steinfurt HRB 15549\nKlemens-Pablo-Gastronomie GmbH – Emsdetten",
      "type": "Registerbekanntmachung nach dem Umwandlungsgesetz",
      "state": "Nordrhein-Westfalen",
      "amtsgericht": "Amtsgericht Steinfurt",
      "registernummer": "HRB 15549",
      "registerart": "HRB",
      "company_name": "Klemens-Pablo-Gastronomie GmbH",
      "company_seat": "Emsdetten",
      "details": "19.12.2025 (Bekanntmachungsdatum)\n\nNordrhein-Westfalen Amtsgericht Steinfurt HRB 15549\nRegisterbekanntmachung nach dem Umwandlungsgesetz 19.12.2025 (Eintragungsdatum)\n\nKlemens-Pablo-Gastronomie GmbH\nGesellschaft mit beschränkter Haftung\nEmsdetten\n\nDen Gläubigern der an der Verschmelzung beteiligten Rechtsträger ist, wenn sie binnen sechs Monaten nach dem Tag, an dem die Eintragung der Verschmelzung in das Register des Sitzes derjenigen Rechtsträger deren Gläubiger sie sind, nach § 19 Absatz 3 UmwG als bekanntgemacht gilt, ihren Anspruch nach Grund und Höhe schriftlich anmelden, Sicherheit zu leisten, soweit sie nicht Befriedigung verlangen können. Dieses Recht steht den Gläubigern jedoch nur zu, wenn sie glaubhaft machen, dass durch die Verschmelzung die Erfüllung ihrer Forderung gefährdet wird."
    },
    {
      "date": "2025-12-19",
      "id": "140685",
      "original_text": "Registerbekanntmachung nach dem Umwandlungsgesetz\nNordrhein-Westfalen Amtsgericht Düsseldorf HRB 62930\nGREY germany GmbH – Düsseldorf",
      "type": "Registerbekanntmachung nach dem Umwandlungsgesetz",
      "state": "Nordrhein-Westfalen",
      "amtsgericht": "Amtsgericht Düsseldorf",
      "registernummer": "HRB 62930",
      "registerart": "HRB",
      "company_name": "GREY germany GmbH",
      "company_seat": "Düsseldorf",
      "details": "19.12.2025 (Bekanntmachungsdatum)\n\nNordrhein-Westfalen Amtsgericht Düsseldorf HRB 62930\nRegisterbekanntmachung nach dem Umwandlungsgesetz 19.12.2025 (Eintragungsdatum)\n\nGREY germany GmbH\nGesellschaft mit beschränkter Haftung\nDüsseldorf\n\nDen Gläubigern der an der Verschmelzung beteiligten Rechtsträger ist, wenn sie binnen sechs Monaten nach dem Tag, an dem die Eintragung der Verschmelzung in das Register des Sitzes desjenigen Rechtsträgers, dessen Gläubiger sie sind, nach § 19 Absatz 3 UmwG als bekanntgemacht gilt, ihren Anspruch nach Grund und Höhe schriftlich anmelden, Sicherheit zu leisten, soweit sie nicht Befriedigung verlangen können. Dieses Recht steht den Gläubigern jedoch nur zu, wenn sie glaubhaft machen, dass durch die Verschmelzung die Erfüllung ihrer Forderung gefährdet wird."
    },
    {
      "date": "2025-12-19",
      "id": "140686",
      "original_text": "Registerbekanntmachung nach dem Umwandlungsgesetz\nNordrhein-Westfalen Amtsgericht Düsseldorf HRB 79362\nLH Hotel Management GmbH – Düsseldorf",
      "type": "Registerbekanntmachung nach dem Umwandlungsgesetz",
      "state": "Nordrhein-Westfalen",
      "amtsgericht": "Amtsgericht Düsseldorf",
      "registernummer": "HRB 79362",
      "registerart": "HRB",
      "company_name": "LH Hotel Management GmbH",
      "company_seat": "Düsseldorf",
      "details": "19.12.2025 (Bekanntmachungsdatum)\n\nNordrhein-Westfalen Amtsgericht Düsseldorf HRB 79362\nRegisterbekanntmachung nach dem Umwandlungsgesetz 19.12.2025 (Eintragungsdatum)\n\nLH Hotel Management GmbH\nGesellschaft mit beschränkter Haftung\nDüsseldorf\n\nDen Gläubigern der an der Verschmelzung beteiligten Rechtsträger ist, wenn sie binnen sechs Monaten nach dem Tag, an dem die Eintragung der Verschmelzung in das Register des Sitzes desjenigen Rechtsträgers, dessen Gläubiger sie sind, nach § 19 Absatz 3 UmwG als bekanntgemacht gilt, ihren Anspruch nach Grund und Höhe schriftlich anmelden, Sicherheit zu leisten, soweit sie nicht Befriedigung verlangen können. Dieses Recht steht den Gläubigern jedoch nur zu, wenn sie glaubhaft machen, dass durch die Verschmelzung die Erfüllung ihrer Forderung gefährdet wird."
    },
    {
      "date": "2025-12-19",
      "id": "140687",
      "original_text": "Einreichung neuer Dokumente\nNordrhein-Westfalen Amtsgericht Bonn HRB 14654\nPostbank Filialvertrieb AG – Bonn",
      "type": "Einreichung neuer Dokumente",
      "state": "Nordrhein-Westfalen",
      "amtsgericht": "Amtsgericht Bonn",
      "registernummer": "HRB 14654",
      "registerart": "HRB",
      "company_name": "Postbank Filialvertrieb AG",
      "company_seat": "Bonn",
      "details": "19.12.2025 (Bekanntmachungsdatum)\n\nNordrhein-Westfalen Amtsgericht Bonn HRB 14654\nEinreichung neuer Dokumente\n\nPostbank Filialvertrieb AG\nAktiengesellschaft\nBonn\n\nDem Registergericht ist eine neue Liste der Mitglieder des Aufsichtsrates eingereicht worden."
    },
    {
      "date": "2025-12-19",
      "id": "140688",
      "original_text": "Einreichung neuer Dokumente\nNordrhein-Westfalen Amtsgericht Münster HRB 22062\nRatiodata SE – Münster",
      "type": "Einreichung neuer Dokumente",
      "state": "Nordrhein-Westfalen",
      "amtsgericht": "Amtsgericht Münster",
      "registernummer": "HRB 22062",
      "registerart": "HRB",
      "company_name": "Ratiodata SE",
      "company_seat": "Münster",
      "details": "19.12.2025 (Bekanntmachungsdatum)\n\nNordrhein-Westfalen Amtsgericht Münster HRB 22062\nEinreichung neuer Dokumente 18.12.2025 (Eintragungsdatum)\n\nRatiodata SE\nEuropäische Aktiengesellschaft (SE)\nMünster\n\nDem Registergericht ist eine neue Liste der Mitglieder des Aufsichtsrates eingereicht worden."
    },
    {
      "date": "2025-12-19",
      "id": "140689",
      "original_text": "Registerbekanntmachung nach dem Umwandlungsgesetz\nNordrhein-Westfalen Amtsgericht Steinfurt HRB 9258\nCafe Extrablatt VermietungsGmbH – Emsdetten",
      "type": "Registerbekanntmachung nach dem Umwandlungsgesetz",
      "state": "Nordrhein-Westfalen",
      "amtsgericht": "Amtsgericht Steinfurt",
      "registernummer": "HRB 9258",
      "registerart": "HRB",
      "company_name": "Cafe Extrablatt VermietungsGmbH",
      "company_seat": "Emsdetten",
      "details": "19.12.2025 (Bekanntmachungsdatum)\n\nNordrhein-Westfalen Amtsgericht Steinfurt HRB 9258\nRegisterbekanntmachung nach dem Umwandlungsgesetz 19.12.2025 (Eintragungsdatum)\n\nCafe Extrablatt VermietungsGmbH\nGesellschaft mit beschränkter Haftung\nEmsdetten\n\nDen Gläubigern der an der Verschmelzung beteiligten Rechtsträger ist, wenn sie binnen sechs Monaten nach dem Tag, an dem die Eintragung der Verschmelzung in das Register des Sitzes derjenigen Rechtsträger deren Gläubiger sie sind, nach § 19 Absatz 3 UmwG als bekanntgemacht gilt, ihren Anspruch nach Grund und Höhe schriftlich anmelden, Sicherheit zu leisten, soweit sie nicht Befriedigung verlangen können. Dieses Recht steht den Gläubigern jedoch nur zu, wenn sie glaubhaft machen, dass durch die Verschmelzung die Erfüllung ihrer Forderung gefährdet wird."
    },
    {
      "date": "2025-12-19",
      "id": "140690",
      "original_text": "Löschungsankündigung\nNordrhein-Westfalen Amtsgericht Gelsenkirchen VR 1708\nSchwimmverein Seestern Dorsten 2009 e.V. – Dorsten",
      "type": "Löschungsankündigung",
      "state": "Nordrhein-Westfalen",
      "amtsgericht": "Amtsgericht Gelsenkirchen",
      "registernummer": "VR 1708",
      "registerart": "VR",
      "company_name": "Schwimmverein Seestern Dorsten 2009 e.V.",
      "company_seat": "Dorsten",
      "details": "19.12.2025 (Bekanntmachungsdatum)\n\nNordrhein-Westfalen Amtsgericht Gelsenkirchen VR 1708\nLöschungsankündigung\n\nSchwimmverein Seestern Dorsten 2009 e.V.\neingetragener Verein\nDorsten\n\nDas Registergericht beabsichtigt, den im Vereinsregister eingetragenen Verein\nSchwimmverein Seestern Dorsten 2009 e.V. mit Sitz in Dorsten gemäß § 395 FamFG wegen Wegfall sämtlicher Mitglieder von Amts wegen zu löschen.\n\nGegen diese Verfügung kann Widerspruch eingelegt werden. Die Frist zur Erhebung eines Widerspruchs gegen die beabsichtigte Löschung von Amts wegen ist auf einen Monat festgesetzt.\n\nRechtsbehelfsbelehrung:\n\nGegen diese Verfügung können Sie Widerspruch einlegen.\n\nDer Widerspruch ist bei dem Amtsgericht Gelsenkirchen, Bochumer Straße 79, 45886 Gelsenkirchen schriftlich in deutscher Sprache oder zur Niederschrift der Geschäftsstelle einzulegen. Der Widerspruch kann auch zur Niederschrift der Geschäftsstelle eines jeden Amtsgerichtes abgegeben werden.\n\nDer Widerspruch muss spätestens innerhalb der gesetzten Frist bei dem Amtsgericht Gelsenkirchen eingegangen sein. Dies gilt auch dann, wenn der Widerspruch zur Niederschrift der Geschäftsstelle eines anderen Amtsgerichtes abgegeben wurde. Die Frist beginnt mit der Veröffentlichung. Fällt das Ende der Frist auf einen Sonntag, einen allgemeinen Feiertag oder Sonnabend, so endet die Frist mit Ablauf des nächsten Werktages.\n\nDer Widerspruch muss die Bezeichnung der angefochtenen Verfügung sowie die Erklärung enthalten, dass Widerspruch gegen diese Verfügung eingelegt wird. Er ist zu unterzeichnen und soll begründet werden.\n\nHinweis zum elektronischen Rechtsverkehr:\nDie Einlegung ist auch durch Übertragung eines elektronischen Dokuments an die elektronische Poststelle des Gerichts möglich. Das elektronische Dokument muss für die Bearbeitung durch das Gericht geeignet und mit einer qualifizierten elektronischen Signatur der verantwortenden Person versehen sein oder von der verantwortenden Person signiert und auf einem sicheren Übermittlungsweg gemäß § 130a ZPO nach näherer Maßgabe der Verordnung über die technischen Rahmenbedingungen des elektronischen Rechtsverkehrs und über das besondere elektronische Behördenpostfach (BGBl. 2017 I, S. 3803) eingereicht werden. Auf die Pflicht zur elektronischen Einreichung durch professionelle Einreicher/innen ab dem 01.01.2022 durch das Gesetz zum Ausbau des elektronischen Rechtsverkehrs mit den Gerichten vom 10. Oktober 2013, das Gesetz zur Einführung der elektronischen Akte in der Justiz und zur weiteren Förderung des elektronischen Rechtsverkehrs vom 5. Juli 2017 und das Gesetz zum Ausbau des elektronischen Rechtsverkehrs mit den Gerichten und zur Änderung weiterer Vorschriften vom 05.10.2021 wird hingewiesen.\nWeitere Informationen erhalten Sie auf der Internetseite www.justiz.de."
    },
    {
      "date": "2025-12-19",
      "id": "140691",
      "original_text": "Einreichung neuer Dokumente\nNordrhein-Westfalen Amtsgericht Düsseldorf HRB 87043\nAttikon Finanz Aktiengesellschaft – Düsseldorf",
      "type": "Einreichung neuer Dokumente",
      "state": "Nordrhein-Westfalen",
      "amtsgericht": "Amtsgericht Düsseldorf",
      "registernummer": "HRB 87043",
      "registerart": "HRB",
      "company_name": "Attikon Finanz Aktiengesellschaft",
      "company_seat": "Düsseldorf",
      "details": "19.12.2025 (Bekanntmachungsdatum)\n\nNordrhein-Westfalen Amtsgericht Düsseldorf HRB 87043\nEinreichung neuer Dokumente\n\nAttikon Finanz Aktiengesellschaft\nAktiengesellschaft\nDüsseldorf\n\nDem Registergericht ist eine neue Liste der Mitglieder des Aufsichtsrates eingereicht worden."
    }
  ]
}