{
  "date": "2025-12-17",
  "date_of_scrape": "2025-12-18T04:18:33.857Z",
  "tool_version": "0.2.0",
  "number_of_announcements": 156,
  "announcements": [
    {
      "date": "2025-12-17",
      "id": "140223",
      "original_text": "Registerbekanntmachung nach dem Umwandlungsgesetz\nBayern Amtsgericht Deggendorf HRB 2231\nOTS Informationstechnologie AG – Offenberg",
      "type": "Registerbekanntmachung nach dem Umwandlungsgesetz",
      "state": "Bayern",
      "amtsgericht": "Amtsgericht Deggendorf",
      "registernummer": "HRB 2231",
      "registerart": "HRB",
      "company_name": "OTS Informationstechnologie AG",
      "company_seat": "Offenberg",
      "details": "17.12.2025 (Bekanntmachungsdatum)\n\nBayern Amtsgericht Deggendorf HRB 2231\nRegisterbekanntmachung nach dem Umwandlungsgesetz 16.12.2025 (Eintragungsdatum)\n\nOTS Informationstechnologie AG\nAktiengesellschaft\nOffenberg\n\nDen Gläubigern des formwechselnden Rechtsträgers ist, wenn sie binnen sechs Monaten nach dem Tag, an dem die Eintragung des Formwechsels nach § 201 UmwG als bekannt gemacht gilt, ihren Anspruch nach Grund und Höhe in Textform anmelden, Sicherheit zu leisten, soweit sie nicht Befriedigung verlangen können. Dieses Recht steht den Gläubigern jedoch nur zu, wenn sie glaubhaft machen, dass durch den Formwechsel die Erfüllung ihrer Forderung gefährdet wird."
    },
    {
      "date": "2025-12-17",
      "id": "140224",
      "original_text": "Registerbekanntmachung nach dem Umwandlungsgesetz\nBayern Amtsgericht München HRB 302270\nWEKA Media Holding GmbH – München",
      "type": "Registerbekanntmachung nach dem Umwandlungsgesetz",
      "state": "Bayern",
      "amtsgericht": "Amtsgericht München",
      "registernummer": "HRB 302270",
      "registerart": "HRB",
      "company_name": "WEKA Media Holding GmbH",
      "company_seat": "München",
      "details": "17.12.2025 (Bekanntmachungsdatum)\n\nBayern Amtsgericht München HRB 302270\nRegisterbekanntmachung nach dem Umwandlungsgesetz 16.12.2025 (Eintragungsdatum)\n\nWEKA Media Holding GmbH\nGesellschaft mit beschränkter Haftung\nMünchen\n\nDen Gläubigern der an der Spaltung beteiligten Rechtsträger ist, wenn sie binnen sechs Monaten nach dem Tag, an dem die Eintragung der Spaltung in das Register des Sitzes desjenigen Rechtsträgers, dessen Gläubiger sie sind, nach §§ 125, 19 Abs. 3 UmwG als bekannt gemacht gilt, ihren Anspruch nach Grund und Höhe in Textform anmelden, Sicherheit zu leisten, soweit sie nicht Befriedigung verlangen können. Dieses Recht steht den Gläubigern jedoch nur zu, wenn sie glaubhaft machen, dass durch die Spaltung die Erfüllung ihrer Forderung gefährdet wird."
    },
    {
      "date": "2025-12-17",
      "id": "140225",
      "original_text": "Registerbekanntmachung nach dem Umwandlungsgesetz\nBayern Amtsgericht München HRB 165119\nBioClinica GmbH – München",
      "type": "Registerbekanntmachung nach dem Umwandlungsgesetz",
      "state": "Bayern",
      "amtsgericht": "Amtsgericht München",
      "registernummer": "HRB 165119",
      "registerart": "HRB",
      "company_name": "BioClinica GmbH",
      "company_seat": "München",
      "details": "17.12.2025 (Bekanntmachungsdatum)\n\nBayern Amtsgericht München HRB 165119\nRegisterbekanntmachung nach dem Umwandlungsgesetz 16.12.2025 (Eintragungsdatum)\n\nBioClinica GmbH\nGesellschaft mit beschränkter Haftung\nMünchen\n\nDen Gläubigern der an der Verschmelzung beteiligten Rechtsträger ist, wenn sie binnen sechs Monaten nach dem Tag, an dem die Eintragung der Verschmelzung in das Register des Sitzes desjenigen Rechtsträgers, dessen Gläubiger sie sind, nach § 19 Abs. 3 UmwG als bekannt gemacht gilt, ihren Anspruch nach Grund und Höhe in Textform anmelden, Sicherheit zu leisten, soweit sie nicht Befriedigung verlangen können. Dieses Recht steht den Gläubigern jedoch nur zu, wenn sie glaubhaft machen, dass durch die Verschmelzung die Erfüllung ihrer Forderung gefährdet wird."
    },
    {
      "date": "2025-12-17",
      "id": "140226",
      "original_text": "Registerbekanntmachung nach dem Umwandlungsgesetz\nBayern Amtsgericht Aschaffenburg HRB 15234\nMesseblick Projektentwicklungs GmbH – Großostheim",
      "type": "Registerbekanntmachung nach dem Umwandlungsgesetz",
      "state": "Bayern",
      "amtsgericht": "Amtsgericht Aschaffenburg",
      "registernummer": "HRB 15234",
      "registerart": "HRB",
      "company_name": "Messeblick Projektentwicklungs GmbH",
      "company_seat": "Großostheim",
      "details": "17.12.2025 (Bekanntmachungsdatum)\n\nBayern Amtsgericht Aschaffenburg HRB 15234\nRegisterbekanntmachung nach dem Umwandlungsgesetz 16.12.2025 (Eintragungsdatum)\n\nMesseblick Projektentwicklungs GmbH\nGesellschaft mit beschränkter Haftung\nGroßostheim\n\nDen Gläubigern der an der Verschmelzung beteiligten Rechtsträger ist, wenn sie binnen sechs Monaten nach dem Tag, an dem die Eintragung der Verschmelzung in das Register des Sitzes desjenigen Rechtsträgers, dessen Gläubiger sie sind, nach § 19 Abs. 3 UmwG als bekannt gemacht gilt, ihren Anspruch nach Grund und Höhe in Textform anmelden, Sicherheit zu leisten, soweit sie nicht Befriedigung verlangen können. Dieses Recht steht den Gläubigern jedoch nur zu, wenn sie glaubhaft machen, dass durch die Verschmelzung die Erfüllung ihrer Forderung gefährdet wird."
    },
    {
      "date": "2025-12-17",
      "id": "140227",
      "original_text": "Löschungsankündigung\nBayern Amtsgericht Nürnberg HRB 14214\nMühl Product & Service Nürnberg GmbH – Nürnberg",
      "type": "Löschungsankündigung",
      "state": "Bayern",
      "amtsgericht": "Amtsgericht Nürnberg",
      "registernummer": "HRB 14214",
      "registerart": "HRB",
      "company_name": "Mühl Product & Service Nürnberg GmbH",
      "company_seat": "Nürnberg",
      "details": "17.12.2025 (Bekanntmachungsdatum)\n\nBayern Amtsgericht Nürnberg HRB 14214\nLöschungsankündigung\n\nMühl Product & Service Nürnberg GmbH\nGesellschaft mit beschränkter Haftung\nNürnberg\n\nDas Registergericht beabsichtigt, die im Handelsregister eingetragene Gesellschaft wegen Vermögenslosigkeit von Amts wegen nach § 394 FamFG zu löschen. Die Frist zur Erhebung eines Widerspruchs ist auf einen Monat festgesetzt."
    },
    {
      "date": "2025-12-17",
      "id": "140228",
      "original_text": "Registerbekanntmachung nach dem Umwandlungsgesetz\nBayern Amtsgericht Fürth HRB 15488\nAREVA Renewables GmbH – Erlangen",
      "type": "Registerbekanntmachung nach dem Umwandlungsgesetz",
      "state": "Bayern",
      "amtsgericht": "Amtsgericht Fürth",
      "registernummer": "HRB 15488",
      "registerart": "HRB",
      "company_name": "AREVA Renewables GmbH",
      "company_seat": "Erlangen",
      "details": "17.12.2025 (Bekanntmachungsdatum)\n\nBayern Amtsgericht Fürth HRB 15488\nRegisterbekanntmachung nach dem Umwandlungsgesetz 16.12.2025 (Eintragungsdatum)\n\nAREVA Renewables GmbH\nGesellschaft mit beschränkter Haftung\nErlangen\n\nDen Gläubigern der an der Ausgliederung beteiligten Rechtsträger ist, wenn sie binnen sechs Monaten nach dem Tag, an dem die Eintragung der Ausgliederung in das Register des Sitzes desjenigen Rechtsträgers, dessen Gläubiger sie sind, nach §§ 125, 19 Abs. 3 UmwG als bekannt gemacht gilt, ihren Anspruch nach Grund und Höhe in Textform anmelden, Sicherheit zu leisten, soweit sie nicht Befriedigung verlangen können. Dieses Recht steht den Gläubigern jedoch nur zu, wenn sie glaubhaft machen, dass durch die Ausgliederung die Erfüllung ihrer Forderung gefährdet wird."
    },
    {
      "date": "2025-12-17",
      "id": "140229",
      "original_text": "Einreichung neuer Dokumente\nBayern Amtsgericht München HRB 214729\nLufthansa CityLine GmbH – München",
      "type": "Einreichung neuer Dokumente",
      "state": "Bayern",
      "amtsgericht": "Amtsgericht München",
      "registernummer": "HRB 214729",
      "registerart": "HRB",
      "company_name": "Lufthansa CityLine GmbH",
      "company_seat": "München",
      "details": "17.12.2025 (Bekanntmachungsdatum)\n\nBayern Amtsgericht München HRB 214729\nEinreichung neuer Dokumente 16.12.2025 (Eintragungsdatum)\n\nLufthansa CityLine GmbH\nGesellschaft mit beschränkter Haftung\nMünchen\n\nDem Amtsgericht München -Registergericht- ist eine Liste der Mitglieder des Aufsichtsrats eingereicht worden, § 52 Abs. 3 S. 2 GmbHG."
    },
    {
      "date": "2025-12-17",
      "id": "140230",
      "original_text": "Registerbekanntmachung nach dem Umwandlungsgesetz\nBayern Amtsgericht Würzburg HRA 8928\nJürgen Rösch Verpachtungsunternehmen e.K. – Neubrunn",
      "type": "Registerbekanntmachung nach dem Umwandlungsgesetz",
      "state": "Bayern",
      "amtsgericht": "Amtsgericht Würzburg",
      "registernummer": "HRA 8928",
      "registerart": "HRA",
      "company_name": "Jürgen Rösch Verpachtungsunternehmen e.K.",
      "company_seat": "Neubrunn",
      "details": "17.12.2025 (Bekanntmachungsdatum)\n\nBayern Amtsgericht Würzburg HRA 8928\nRegisterbekanntmachung nach dem Umwandlungsgesetz 16.12.2025 (Eintragungsdatum)\n\nJürgen Rösch Verpachtungsunternehmen e.K.\nEinzelkaufmann / Einzelkauffrau\nNeubrunn\n\nDen Gläubigern der an der Ausgliederung beteiligten Rechtsträger ist, wenn sie binnen sechs Monaten nach dem Tag, an dem die Eintragung der Ausgliederung in das Register des Sitzes desjenigen Rechtsträgers, dessen Gläubiger sie sind, nach §§ 125, 19 Abs. 3 UmwG als bekannt gemacht gilt, ihren Anspruch nach Grund und Höhe in Textform anmelden, Sicherheit zu leisten, soweit sie nicht Befriedigung verlangen können. Dieses Recht steht den Gläubigern jedoch nur zu, wenn sie glaubhaft machen, dass durch die Ausgliederung die Erfüllung ihrer Forderung gefährdet wird."
    },
    {
      "date": "2025-12-17",
      "id": "140231",
      "original_text": "Registerbekanntmachung nach dem Umwandlungsgesetz\nBayern Amtsgericht Fürth HRB 7817\nAREVA GmbH – Erlangen",
      "type": "Registerbekanntmachung nach dem Umwandlungsgesetz",
      "state": "Bayern",
      "amtsgericht": "Amtsgericht Fürth",
      "registernummer": "HRB 7817",
      "registerart": "HRB",
      "company_name": "AREVA GmbH",
      "company_seat": "Erlangen",
      "details": "17.12.2025 (Bekanntmachungsdatum)\n\nBayern Amtsgericht Fürth HRB 7817\nRegisterbekanntmachung nach dem Umwandlungsgesetz 16.12.2025 (Eintragungsdatum)\n\nAREVA GmbH\nGesellschaft mit beschränkter Haftung\nErlangen\n\nDen Gläubigern der an der Spaltung beteiligten Rechtsträger ist, wenn sie binnen sechs Monaten nach dem Tag, an dem die Eintragung der Spaltung in das Register des Sitzes desjenigen Rechtsträgers, dessen Gläubiger sie sind, nach §§ 125, 19 Abs. 3 UmwG als bekannt gemacht gilt, ihren Anspruch nach Grund und Höhe in Textform anmelden, Sicherheit zu leisten, soweit sie nicht Befriedigung verlangen können. Dieses Recht steht den Gläubigern jedoch nur zu, wenn sie glaubhaft machen, dass durch die Spaltung die Erfüllung ihrer Forderung gefährdet wird."
    },
    {
      "date": "2025-12-17",
      "id": "140232",
      "original_text": "Löschungsankündigung\nBayern Amtsgericht Kempten (Allgäu) HRB 17443\nLI Bau GmbH – Weißensberg",
      "type": "Löschungsankündigung",
      "state": "Bayern",
      "amtsgericht": "Amtsgericht Kempten (Allgäu)",
      "registernummer": "HRB 17443",
      "registerart": "HRB",
      "company_name": "LI Bau GmbH",
      "company_seat": "Weißensberg",
      "details": "17.12.2025 (Bekanntmachungsdatum)\n\nBayern Amtsgericht Kempten (Allgäu) HRB 17443\nLöschungsankündigung\n\nLI Bau GmbH\nGesellschaft mit beschränkter Haftung\nWeißensberg\n\nDas Registergericht beabsichtigt, die im Handelsregister eingetragene Gesellschaft wegen Vermögenslosigkeit von Amts wegen nach § 394 FamFG zu löschen. Die Frist zur Erhebung eines Widerspruchs ist auf einen Monat festgesetzt."
    },
    {
      "date": "2025-12-17",
      "id": "140233",
      "original_text": "Löschungsankündigung\nBayern Amtsgericht Nürnberg HRB 35116\nfrankenBAU r.u.H. GmbH – Nürnberg",
      "type": "Löschungsankündigung",
      "state": "Bayern",
      "amtsgericht": "Amtsgericht Nürnberg",
      "registernummer": "HRB 35116",
      "registerart": "HRB",
      "company_name": "frankenBAU r.u.H. GmbH",
      "company_seat": "Nürnberg",
      "details": "17.12.2025 (Bekanntmachungsdatum)\n\nBayern Amtsgericht Nürnberg HRB 35116\nLöschungsankündigung\n\nfrankenBAU r.u.H. GmbH\nGesellschaft mit beschränkter Haftung\nNürnberg\n\nDas Registergericht beabsichtigt, die im Handelsregister eingetragene Gesellschaft wegen Vermögenslosigkeit von Amts wegen nach § 394 FamFG zu löschen. Die Frist zur Erhebung eines Widerspruchs ist auf einen Monat festgesetzt."
    },
    {
      "date": "2025-12-17",
      "id": "140234",
      "original_text": "Löschungsankündigung\nBayern Amtsgericht Nürnberg HRB 24861\nHorst Lieb Transport GmbH – Nürnberg",
      "type": "Löschungsankündigung",
      "state": "Bayern",
      "amtsgericht": "Amtsgericht Nürnberg",
      "registernummer": "HRB 24861",
      "registerart": "HRB",
      "company_name": "Horst Lieb Transport GmbH",
      "company_seat": "Nürnberg",
      "details": "17.12.2025 (Bekanntmachungsdatum)\n\nBayern Amtsgericht Nürnberg HRB 24861\nLöschungsankündigung\n\nHorst Lieb Transport GmbH\nGesellschaft mit beschränkter Haftung\nNürnberg\n\nDas Registergericht beabsichtigt, die im Handelsregister eingetragene Gesellschaft wegen Vermögenslosigkeit von Amts wegen nach § 394 FamFG zu löschen. Die Frist zur Erhebung eines Widerspruchs ist auf einen Monat festgesetzt."
    },
    {
      "date": "2025-12-17",
      "id": "140235",
      "original_text": "Registerbekanntmachung nach dem Umwandlungsgesetz\nBayern Amtsgericht München HRB 253429\nKSW 05 GmbH – Starnberg",
      "type": "Registerbekanntmachung nach dem Umwandlungsgesetz",
      "state": "Bayern",
      "amtsgericht": "Amtsgericht München",
      "registernummer": "HRB 253429",
      "registerart": "HRB",
      "company_name": "KSW 05 GmbH",
      "company_seat": "Starnberg",
      "details": "17.12.2025 (Bekanntmachungsdatum)\n\nBayern Amtsgericht München HRB 253429\nRegisterbekanntmachung nach dem Umwandlungsgesetz 16.12.2025 (Eintragungsdatum)\n\nKSW 05 GmbH\nGesellschaft mit beschränkter Haftung\nStarnberg\n\nDen Gläubigern der an der Verschmelzung beteiligten Rechtsträger ist, wenn sie binnen sechs Monaten nach dem Tag, an dem die Eintragung der Verschmelzung in das Register des Sitzes desjenigen Rechtsträgers, dessen Gläubiger sie sind, nach § 19 Abs. 3 UmwG als bekannt gemacht gilt, ihren Anspruch nach Grund und Höhe in Textform anmelden, Sicherheit zu leisten, soweit sie nicht Befriedigung verlangen können. Dieses Recht steht den Gläubigern jedoch nur zu, wenn sie glaubhaft machen, dass durch die Verschmelzung die Erfüllung ihrer Forderung gefährdet wird."
    },
    {
      "date": "2025-12-17",
      "id": "140236",
      "original_text": "Einreichung neuer Dokumente\nBayern Amtsgericht München HRB 105386\nMünchner Volkshochschule GmbH, Akademie für Erwachsenenbildung – München",
      "type": "Einreichung neuer Dokumente",
      "state": "Bayern",
      "amtsgericht": "Amtsgericht München",
      "registernummer": "HRB 105386",
      "registerart": "HRB",
      "company_name": "Münchner Volkshochschule GmbH, Akademie für Erwachsenenbildung",
      "company_seat": "München",
      "details": "17.12.2025 (Bekanntmachungsdatum)\n\nBayern Amtsgericht München HRB 105386\nEinreichung neuer Dokumente 16.12.2025 (Eintragungsdatum)\n\nMünchner Volkshochschule GmbH, Akademie für Erwachsenenbildung\nGesellschaft mit beschränkter Haftung\nMünchen\n\nDem Amtsgericht München -Registergericht- sind zwei Listen der Mitglieder des Aufsichtsrats eingereicht worden, § 52 Abs. 3 S. 2 GmbHG."
    },
    {
      "date": "2025-12-17",
      "id": "140237",
      "original_text": "Registerbekanntmachung nach dem Umwandlungsgesetz\nBayern Amtsgericht München HRB 95802\nAllianz Direct Versicherungs-AG – München",
      "type": "Registerbekanntmachung nach dem Umwandlungsgesetz",
      "state": "Bayern",
      "amtsgericht": "Amtsgericht München",
      "registernummer": "HRB 95802",
      "registerart": "HRB",
      "company_name": "Allianz Direct Versicherungs-AG",
      "company_seat": "München",
      "details": "17.12.2025 (Bekanntmachungsdatum)\n\nBayern Amtsgericht München HRB 95802\nRegisterbekanntmachung nach dem Umwandlungsgesetz 16.12.2025 (Eintragungsdatum)\n\nAllianz Direct Versicherungs-AG\nAktiengesellschaft\nMünchen\n\nDen Gläubigern der an der Verschmelzung beteiligten Rechtsträger ist, wenn sie binnen sechs Monaten nach dem Tag, an dem die Eintragung der Verschmelzung in das Register des Sitzes desjenigen Rechtsträgers, dessen Gläubiger sie sind, nach § 19 Abs. 3 UmwG als bekannt gemacht gilt, ihren Anspruch nach Grund und Höhe in Textform anmelden, Sicherheit zu leisten, soweit sie nicht Befriedigung verlangen können. Dieses Recht steht den Gläubigern jedoch nur zu, wenn sie glaubhaft machen, dass durch die Verschmelzung die Erfüllung ihrer Forderung gefährdet wird."
    },
    {
      "date": "2025-12-17",
      "id": "140238",
      "original_text": "Registerbekanntmachung nach dem Umwandlungsgesetz\nBayern Amtsgericht München HRB 230554\nIKEA Customer Support Center GmbH – München",
      "type": "Registerbekanntmachung nach dem Umwandlungsgesetz",
      "state": "Bayern",
      "amtsgericht": "Amtsgericht München",
      "registernummer": "HRB 230554",
      "registerart": "HRB",
      "company_name": "IKEA Customer Support Center GmbH",
      "company_seat": "München",
      "details": "17.12.2025 (Bekanntmachungsdatum)\n\nBayern Amtsgericht München HRB 230554\nRegisterbekanntmachung nach dem Umwandlungsgesetz 16.12.2025 (Eintragungsdatum)\n\nIKEA Customer Support Center GmbH\nGesellschaft mit beschränkter Haftung\nMünchen\n\nDen Gläubigern der an der Verschmelzung beteiligten Rechtsträger ist, wenn sie binnen sechs Monaten nach dem Tag, an dem die Eintragung der Verschmelzung in das Register des Sitzes desjenigen Rechtsträgers, dessen Gläubiger sie sind, nach § 19 Abs. 3 UmwG als bekannt gemacht gilt, ihren Anspruch nach Grund und Höhe in Textform anmelden, Sicherheit zu leisten, soweit sie nicht Befriedigung verlangen können. Dieses Recht steht den Gläubigern jedoch nur zu, wenn sie glaubhaft machen, dass durch die Verschmelzung die Erfüllung ihrer Forderung gefährdet wird."
    },
    {
      "date": "2025-12-17",
      "id": "140239",
      "original_text": "Registerbekanntmachung nach dem Umwandlungsgesetz\nBayern Amtsgericht Fürth HRA 12652\nLindner Gebäudereinigung GmbH & Co. KG – Erlangen",
      "type": "Registerbekanntmachung nach dem Umwandlungsgesetz",
      "state": "Bayern",
      "amtsgericht": "Amtsgericht Fürth",
      "registernummer": "HRA 12652",
      "registerart": "HRA",
      "company_name": "Lindner Gebäudereinigung GmbH & Co. KG",
      "company_seat": "Erlangen",
      "details": "17.12.2025 (Bekanntmachungsdatum)\n\nBayern Amtsgericht Fürth HRA 12652\nRegisterbekanntmachung nach dem Umwandlungsgesetz 16.12.2025 (Eintragungsdatum)\n\nLindner Gebäudereinigung GmbH & Co. KG\nKommanditgesellschaft\nErlangen\n\nDen Gläubigern der an der Ausgliederung beteiligten Rechtsträger ist, wenn sie binnen sechs Monaten nach dem Tag, an dem die Eintragung der Ausgliederung in das Register des Sitzes desjenigen Rechtsträgers, dessen Gläubiger sie sind, nach §§ 125, 19 Abs. 3 UmwG als bekannt gemacht gilt, ihren Anspruch nach Grund und Höhe in Textform anmelden, Sicherheit zu leisten, soweit sie nicht Befriedigung verlangen können. Dieses Recht steht den Gläubigern jedoch nur zu, wenn sie glaubhaft machen, dass durch die Ausgliederung die Erfüllung ihrer Forderung gefährdet wird."
    },
    {
      "date": "2025-12-17",
      "id": "140240",
      "original_text": "Registerbekanntmachung nach dem Umwandlungsgesetz\nBayern Amtsgericht München HRB 224640\nFelMi Gastro GmbH – München",
      "type": "Registerbekanntmachung nach dem Umwandlungsgesetz",
      "state": "Bayern",
      "amtsgericht": "Amtsgericht München",
      "registernummer": "HRB 224640",
      "registerart": "HRB",
      "company_name": "FelMi Gastro GmbH",
      "company_seat": "München",
      "details": "17.12.2025 (Bekanntmachungsdatum)\n\nBayern Amtsgericht München HRB 224640\nRegisterbekanntmachung nach dem Umwandlungsgesetz 16.12.2025 (Eintragungsdatum)\n\nFelMi Gastro GmbH\nGesellschaft mit beschränkter Haftung\nMünchen\n\nDen Gläubigern der an der Verschmelzung beteiligten Rechtsträger ist, wenn sie binnen sechs Monaten nach dem Tag, an dem die Eintragung der Verschmelzung in das Register des Sitzes desjenigen Rechtsträgers, dessen Gläubiger sie sind, nach § 19 Abs. 3 UmwG als bekannt gemacht gilt, ihren Anspruch nach Grund und Höhe in Textform anmelden, Sicherheit zu leisten, soweit sie nicht Befriedigung verlangen können. Dieses Recht steht den Gläubigern jedoch nur zu, wenn sie glaubhaft machen, dass durch die Verschmelzung die Erfüllung ihrer Forderung gefährdet wird."
    },
    {
      "date": "2025-12-17",
      "id": "140241",
      "original_text": "Registerbekanntmachung nach dem Umwandlungsgesetz\nBayern Amtsgericht München HRB 184184\nAuer Immobilien GmbH – München",
      "type": "Registerbekanntmachung nach dem Umwandlungsgesetz",
      "state": "Bayern",
      "amtsgericht": "Amtsgericht München",
      "registernummer": "HRB 184184",
      "registerart": "HRB",
      "company_name": "Auer Immobilien GmbH",
      "company_seat": "München",
      "details": "17.12.2025 (Bekanntmachungsdatum)\n\nBayern Amtsgericht München HRB 184184\nRegisterbekanntmachung nach dem Umwandlungsgesetz 16.12.2025 (Eintragungsdatum)\n\nAuer Immobilien GmbH\nGesellschaft mit beschränkter Haftung\nMünchen\n\nDen Gläubigern der an der Spaltung beteiligten Rechtsträger ist, wenn sie binnen sechs Monaten nach dem Tag, an dem die Eintragung der Spaltung in das Register des Sitzes desjenigen Rechtsträgers, dessen Gläubiger sie sind, nach §§ 125, 19 Abs. 3 UmwG als bekannt gemacht gilt, ihren Anspruch nach Grund und Höhe in Textform anmelden, Sicherheit zu leisten, soweit sie nicht Befriedigung verlangen können. Dieses Recht steht den Gläubigern jedoch nur zu, wenn sie glaubhaft machen, dass durch die Spaltung die Erfüllung ihrer Forderung gefährdet wird."
    },
    {
      "date": "2025-12-17",
      "id": "140242",
      "original_text": "Registerbekanntmachung nach dem Umwandlungsgesetz\nBayern Amtsgericht München HRB 222222\nZEDORA 129 Verwaltung GmbH – München",
      "type": "Registerbekanntmachung nach dem Umwandlungsgesetz",
      "state": "Bayern",
      "amtsgericht": "Amtsgericht München",
      "registernummer": "HRB 222222",
      "registerart": "HRB",
      "company_name": "ZEDORA 129 Verwaltung GmbH",
      "company_seat": "München",
      "details": "17.12.2025 (Bekanntmachungsdatum)\n\nBayern Amtsgericht München HRB 222222\nRegisterbekanntmachung nach dem Umwandlungsgesetz 16.12.2025 (Eintragungsdatum)\n\nZEDORA 129 Verwaltung GmbH\nGesellschaft mit beschränkter Haftung\nMünchen\n\nDen Gläubigern der an der Verschmelzung beteiligten Rechtsträger ist, wenn sie binnen sechs Monaten nach dem Tag, an dem die Eintragung der Verschmelzung in das Register des Sitzes desjenigen Rechtsträgers, dessen Gläubiger sie sind, nach § 19 Abs. 3 UmwG als bekannt gemacht gilt, ihren Anspruch nach Grund und Höhe in Textform anmelden, Sicherheit zu leisten, soweit sie nicht Befriedigung verlangen können. Dieses Recht steht den Gläubigern jedoch nur zu, wenn sie glaubhaft machen, dass durch die Verschmelzung die Erfüllung ihrer Forderung gefährdet wird."
    },
    {
      "date": "2025-12-17",
      "id": "140243",
      "original_text": "Registerbekanntmachung nach dem Umwandlungsgesetz\nBayern Amtsgericht Fürth HRB 22229\nAREVA Pensionärsgesellschaft mbH – Erlangen",
      "type": "Registerbekanntmachung nach dem Umwandlungsgesetz",
      "state": "Bayern",
      "amtsgericht": "Amtsgericht Fürth",
      "registernummer": "HRB 22229",
      "registerart": "HRB",
      "company_name": "AREVA Pensionärsgesellschaft mbH",
      "company_seat": "Erlangen",
      "details": "17.12.2025 (Bekanntmachungsdatum)\n\nBayern Amtsgericht Fürth HRB 22229\nRegisterbekanntmachung nach dem Umwandlungsgesetz 16.12.2025 (Eintragungsdatum)\n\nAREVA Pensionärsgesellschaft mbH\nGesellschaft mit beschränkter Haftung\nErlangen\n\nDen Gläubigern der an der Spaltung beteiligten Rechtsträger ist, wenn sie binnen sechs Monaten nach dem Tag, an dem die Eintragung der Spaltung in das Register des Sitzes desjenigen Rechtsträgers, dessen Gläubiger sie sind, nach §§ 125, 19 Abs. 3 UmwG als bekannt gemacht gilt, ihren Anspruch nach Grund und Höhe in Textform anmelden, Sicherheit zu leisten, soweit sie nicht Befriedigung verlangen können. Dieses Recht steht den Gläubigern jedoch nur zu, wenn sie glaubhaft machen, dass durch die Spaltung die Erfüllung ihrer Forderung gefährdet wird.\nDen Gläubigern der an der Ausgliederung beteiligten Rechtsträger ist, wenn sie binnen sechs Monaten nach dem Tag, an dem die Eintragung der Ausgliederung in das Register des Sitzes desjenigen Rechtsträgers, dessen Gläubiger sie sind, nach §§ 125, 19 Abs. 3 UmwG als bekannt gemacht gilt, ihren Anspruch nach Grund und Höhe in Textform anmelden, Sicherheit zu leisten, soweit sie nicht Befriedigung verlangen können. Dieses Recht steht den Gläubigern jedoch nur zu, wenn sie glaubhaft machen, dass durch die Ausgliederung die Erfüllung ihrer Forderung gefährdet wird."
    },
    {
      "date": "2025-12-17",
      "id": "140244",
      "original_text": "Einreichung neuer Dokumente\nBayern Amtsgericht München HRB 138143\nSyngenio Aktiengesellschaft – München",
      "type": "Einreichung neuer Dokumente",
      "state": "Bayern",
      "amtsgericht": "Amtsgericht München",
      "registernummer": "HRB 138143",
      "registerart": "HRB",
      "company_name": "Syngenio Aktiengesellschaft",
      "company_seat": "München",
      "details": "17.12.2025 (Bekanntmachungsdatum)\n\nBayern Amtsgericht München HRB 138143\nEinreichung neuer Dokumente 16.12.2025 (Eintragungsdatum)\n\nSyngenio Aktiengesellschaft\nAktiengesellschaft\nMünchen\n\nDem Amtsgericht München -Registergericht- ist eine Liste der Mitglieder des Aufsichtsrats eingereicht worden, § 106 AktG."
    },
    {
      "date": "2025-12-17",
      "id": "140245",
      "original_text": "Einreichung neuer Dokumente\nBayern Amtsgericht München HRB 307114\nFIixTrain Holding SE – München",
      "type": "Einreichung neuer Dokumente",
      "state": "Bayern",
      "amtsgericht": "Amtsgericht München",
      "registernummer": "HRB 307114",
      "registerart": "HRB",
      "company_name": "FIixTrain Holding SE",
      "company_seat": "München",
      "details": "17.12.2025 (Bekanntmachungsdatum)\n\nBayern Amtsgericht München HRB 307114\nEinreichung neuer Dokumente 16.12.2025 (Eintragungsdatum)\n\nFIixTrain Holding SE\nEuropäische Aktiengesellschaft (SE)\nMünchen\n\nDem Amtsgericht München -Registergericht- ist eine Liste der Mitglieder des Aufsichtsrats eingereicht worden, Art. 9 Abs. 1 Buchst. c (ii) SE-VO i.V.m. § 106 AktG."
    },
    {
      "date": "2025-12-17",
      "id": "140246",
      "original_text": "Löschungsankündigung\nBayern Amtsgericht Bayreuth HRB 4872\nKonrad Micro Drill GmbH – Kulmbach",
      "type": "Löschungsankündigung",
      "state": "Bayern",
      "amtsgericht": "Amtsgericht Bayreuth",
      "registernummer": "HRB 4872",
      "registerart": "HRB",
      "company_name": "Konrad Micro Drill GmbH",
      "company_seat": "Kulmbach",
      "details": "17.12.2025 (Bekanntmachungsdatum)\n\nBayern Amtsgericht Bayreuth HRB 4872\nLöschungsankündigung\n\nKonrad Micro Drill GmbH\nGesellschaft mit beschränkter Haftung\nKulmbach\n\nDas Registergericht beabsichtigt, den im Handelsregister eingetragenen Geschäftsführer Martin Grillenberger nach § 395 FamFG von Amts wegen zu löschen. Die Frist zur Erhebung eines Widerspruchs ist auf einen Monat ab Zustellung/Veröffentlichung dieser Ankündigung festgesetzt."
    },
    {
      "date": "2025-12-17",
      "id": "140247",
      "original_text": "Löschungsankündigung\nBayern Amtsgericht Nürnberg HRB 31429\nXPCOM-SYSTEMS UG (haftungsbeschränkt) – Nürnberg",
      "type": "Löschungsankündigung",
      "state": "Bayern",
      "amtsgericht": "Amtsgericht Nürnberg",
      "registernummer": "HRB 31429",
      "registerart": "HRB",
      "company_name": "XPCOM-SYSTEMS UG (haftungsbeschränkt)",
      "company_seat": "Nürnberg",
      "details": "17.12.2025 (Bekanntmachungsdatum)\n\nBayern Amtsgericht Nürnberg HRB 31429\nLöschungsankündigung\n\nXPCOM-SYSTEMS UG (haftungsbeschränkt)\nGesellschaft mit beschränkter Haftung\nNürnberg\n\nDas Registergericht beabsichtigt, die im Handelsregister eingetragene Gesellschaft wegen Vermögenslosigkeit von Amts wegen nach § 394 FamFG zu löschen. Die Frist zur Erhebung eines Widerspruchs ist auf einen Monat festgesetzt."
    },
    {
      "date": "2025-12-17",
      "id": "140248",
      "original_text": "Registerbekanntmachung nach dem Umwandlungsgesetz\nBayern Amtsgericht Würzburg HRA 8993\nRösch Verpachtungs UG (haftungsbeschränkt) & Co. KG – Neubrunn",
      "type": "Registerbekanntmachung nach dem Umwandlungsgesetz",
      "state": "Bayern",
      "amtsgericht": "Amtsgericht Würzburg",
      "registernummer": "HRA 8993",
      "registerart": "HRA",
      "company_name": "Rösch Verpachtungs UG (haftungsbeschränkt) & Co. KG",
      "company_seat": "Neubrunn",
      "details": "17.12.2025 (Bekanntmachungsdatum)\n\nBayern Amtsgericht Würzburg HRA 8993\nRegisterbekanntmachung nach dem Umwandlungsgesetz 16.12.2025 (Eintragungsdatum)\n\nRösch Verpachtungs UG (haftungsbeschränkt) & Co. KG\nKommanditgesellschaft\nNeubrunn\n\nDen Gläubigern der an der Ausgliederung beteiligten Rechtsträger ist, wenn sie binnen sechs Monaten nach dem Tag, an dem die Eintragung der Ausgliederung in das Register des Sitzes desjenigen Rechtsträgers, dessen Gläubiger sie sind, nach §§ 125, 19 Abs. 3 UmwG als bekannt gemacht gilt, ihren Anspruch nach Grund und Höhe in Textform anmelden, Sicherheit zu leisten, soweit sie nicht Befriedigung verlangen können. Dieses Recht steht den Gläubigern jedoch nur zu, wenn sie glaubhaft machen, dass durch die Ausgliederung die Erfüllung ihrer Forderung gefährdet wird."
    },
    {
      "date": "2025-12-17",
      "id": "140249",
      "original_text": "Sonstige Registerbekanntmachung\nBayern Amtsgericht München HRB 132917\n4SC AG – Planegg",
      "type": "Sonstige Registerbekanntmachung",
      "state": "Bayern",
      "amtsgericht": "Amtsgericht München",
      "registernummer": "HRB 132917",
      "registerart": "HRB",
      "company_name": "4SC AG",
      "company_seat": "Planegg",
      "details": "17.12.2025 (Bekanntmachungsdatum)\n\nBayern Amtsgericht München HRB 132917\nSonstige Registerbekanntmachung 16.12.2025 (Eintragungsdatum)\n\n4SC AG\nAktiengesellschaft\nPlanegg\n\nDen Gläubigern der Gesellschaft, deren Forderungen begründet worden sind, bevor die Eintragung des Beschlusses bekanntgemacht worden ist, ist, wenn sie sich binnen sechs Monaten nach der Bekanntmachung zu diesem Zweck melden, Sicherheit zu leisten, soweit sie nicht Befriedigung verlangen können. Das Recht, Sicherheitsleistung zu verlangen, steht Gläubigern nicht zu, die im Fall des Insolvenzverfahrens ein Recht auf vorzugsweise Befriedigung aus einer Deckungsmasse haben, die nach gesetzlicher Vorschrift zu ihrem Schutz errichtet und staatlich überwacht ist."
    },
    {
      "date": "2025-12-17",
      "id": "140250",
      "original_text": "Sonstige Registerbekanntmachung\nBayern Amtsgericht Nürnberg HRB 25498\nWeatherdock AG – Nürnberg",
      "type": "Sonstige Registerbekanntmachung",
      "state": "Bayern",
      "amtsgericht": "Amtsgericht Nürnberg",
      "registernummer": "HRB 25498",
      "registerart": "HRB",
      "company_name": "Weatherdock AG",
      "company_seat": "Nürnberg",
      "details": "17.12.2025 (Bekanntmachungsdatum)\n\nBayern Amtsgericht Nürnberg HRB 25498\nSonstige Registerbekanntmachung\n\nWeatherdock AG\nAktiengesellschaft\nNürnberg\n\nDem Amtsgericht Nürnberg -Registergericht- ist eine Liste der Mitglieder des Aufsichtsrats eingereicht worden, § 106 AktG."
    },
    {
      "date": "2025-12-17",
      "id": "140251",
      "original_text": "Registerbekanntmachung nach dem Umwandlungsgesetz\nBayern Amtsgericht Fürth HRA 12636\nLindner Gebäudereinigung, Inh. Jürgen Lindner e.K. – Erlangen",
      "type": "Registerbekanntmachung nach dem Umwandlungsgesetz",
      "state": "Bayern",
      "amtsgericht": "Amtsgericht Fürth",
      "registernummer": "HRA 12636",
      "registerart": "HRA",
      "company_name": "Lindner Gebäudereinigung, Inh. Jürgen Lindner e.K.",
      "company_seat": "Erlangen",
      "details": "17.12.2025 (Bekanntmachungsdatum)\n\nBayern Amtsgericht Fürth HRA 12636\nRegisterbekanntmachung nach dem Umwandlungsgesetz 16.12.2025 (Eintragungsdatum)\n\nLindner Gebäudereinigung, Inh. Jürgen Lindner e.K.\nEinzelkaufmann / Einzelkauffrau\nErlangen\n\nDen Gläubigern der an der Ausgliederung beteiligten Rechtsträger ist, wenn sie binnen sechs Monaten nach dem Tag, an dem die Eintragung der Ausgliederung in das Register des Sitzes desjenigen Rechtsträgers, dessen Gläubiger sie sind, nach §§ 125, 19 Abs. 3 UmwG als bekannt gemacht gilt, ihren Anspruch nach Grund und Höhe in Textform anmelden, Sicherheit zu leisten, soweit sie nicht Befriedigung verlangen können. Dieses Recht steht den Gläubigern jedoch nur zu, wenn sie glaubhaft machen, dass durch die Ausgliederung die Erfüllung ihrer Forderung gefährdet wird."
    },
    {
      "date": "2025-12-17",
      "id": "140252",
      "original_text": "Löschungsankündigung\nBaden-Württemberg Amtsgericht Mannheim HRB 749261\nSERT UG (haftungsbeschränkt) – Rastatt",
      "type": "Löschungsankündigung",
      "state": "Baden-Württemberg",
      "amtsgericht": "Amtsgericht Mannheim",
      "registernummer": "HRB 749261",
      "registerart": "HRB",
      "company_name": "SERT UG (haftungsbeschränkt)",
      "company_seat": "Rastatt",
      "details": "17.12.2025 (Bekanntmachungsdatum)\n\nBaden-Württemberg Amtsgericht Mannheim HRB 749261\nLöschungsankündigung\n\nSERT UG (haftungsbeschränkt)\nGesellschaft mit beschränkter Haftung\nRastatt\n\nAls nicht eingetragen wird bekanntgemacht:\nDas Gericht beabsichtigt, die Gesellschaft wegen Vermögenslosigkeit im Handelsregister von Amts wegen nach § 394 FamFG zu löschen. Die Frist zur Geltendmachung eines Widerspruchs gegen die beabsichtigte Löschung ist auf einen Monat ab Veröffentlichung bestimmt."
    },
    {
      "date": "2025-12-17",
      "id": "140253",
      "original_text": "Löschungsankündigung\nMecklenburg-Vorpommern Amtsgericht Rostock HRB 14535\nGemütliche Wärme AHT UG (haftungsbeschränkt) – Hoppenrade",
      "type": "Löschungsankündigung",
      "state": "Mecklenburg-Vorpommern",
      "amtsgericht": "Amtsgericht Rostock",
      "registernummer": "HRB 14535",
      "registerart": "HRB",
      "company_name": "Gemütliche Wärme AHT UG (haftungsbeschränkt)",
      "company_seat": "Hoppenrade",
      "details": "17.12.2025 (Bekanntmachungsdatum)\n\nMecklenburg-Vorpommern Amtsgericht Rostock HRB 14535\nLöschungsankündigung\n\nGemütliche Wärme AHT UG (haftungsbeschränkt)\nGesellschaft mit beschränkter Haftung\nHoppenrade\n\nDas Registergericht beabsichtigt, die im Handelsregister eingetragene Gesellschaft von Amts wegen nach § 394 FamFG zu löschen. Die Frist zur Erhebung eines Widerspruchs gegen die beabsichtigte Löschung wird auf einen Monat festgesetzt."
    },
    {
      "date": "2025-12-17",
      "id": "140254",
      "original_text": "Registerbekanntmachung nach dem Umwandlungsgesetz\nBerlin Amtsgericht Berlin (Charlottenburg) HRB 281285\ntrlyr 12 UG (haftungsbeschränkt) – Berlin",
      "type": "Registerbekanntmachung nach dem Umwandlungsgesetz",
      "state": "Berlin",
      "amtsgericht": "Amtsgericht Berlin (Charlottenburg)",
      "registernummer": "HRB 281285",
      "registerart": "HRB",
      "company_name": "trlyr 12 UG (haftungsbeschränkt)",
      "company_seat": "Berlin",
      "details": "17.12.2025 (Bekanntmachungsdatum)\n\nBerlin Amtsgericht Berlin (Charlottenburg) HRB 281285\nRegisterbekanntmachung nach dem Umwandlungsgesetz 12.12.2025 (Eintragungsdatum)\n\ntrlyr 12 UG (haftungsbeschränkt)\nGesellschaft mit beschränkter Haftung\nBerlin\n\nZu Eintragungsnummer 2 vom 12.12.2025 wird als nicht eingetragen veröffentlicht: Den Gläubigern ist, wenn sie binnen sechs Monaten nach dem Tag, an dem die Eintragung der Umwandlung als bekannt gemacht gilt, ihren Anspruch nach Grund und Höhe schriftlich anmelden, Sicherheit zu leisten, soweit sie nicht Befriedigung verlangen können. Dieses Recht steht den Gläubigern jedoch nur zu, wenn sie glaubhaft machen, dass durch die Umwandlung die Erfüllung ihrer Forderung gefährdet wird. Das Recht, Sicherheitsleistung zu verlangen, steht Gläubigern nicht zu, die im Falle der Insolvenz ein Recht auf vorzugsweise Befriedigung aus einer Deckungsmasse haben, die nach gesetzlicher Vorschrift zu ihrem Schutz errichtet und staatlich überwacht ist."
    },
    {
      "date": "2025-12-17",
      "id": "140255",
      "original_text": "Registerbekanntmachung nach dem Umwandlungsgesetz\nBerlin Amtsgericht Berlin (Charlottenburg) HRA 65040\ntrlyr 12 GmbH & Co. KG – Berlin",
      "type": "Registerbekanntmachung nach dem Umwandlungsgesetz",
      "state": "Berlin",
      "amtsgericht": "Amtsgericht Berlin (Charlottenburg)",
      "registernummer": "HRA 65040",
      "registerart": "HRA",
      "company_name": "trlyr 12 GmbH & Co. KG",
      "company_seat": "Berlin",
      "details": "17.12.2025 (Bekanntmachungsdatum)\n\nBerlin Amtsgericht Berlin (Charlottenburg) HRA 65040\nRegisterbekanntmachung nach dem Umwandlungsgesetz 12.12.2025 (Eintragungsdatum)\n\ntrlyr 12 GmbH & Co. KG\nKommanditgesellschaft\nBerlin\n\nZu Eintragungsnummer 1 vom 12.12.2025 wird als nicht eingetragen veröffentlicht: Den Gläubigern ist, wenn sie binnen sechs Monaten nach dem Tag, an dem die Eintragung der Umwandlung als bekannt gemacht gilt, ihren Anspruch nach Grund und Höhe schriftlich anmelden, Sicherheit zu leisten, soweit sie nicht Befriedigung verlangen können. Dieses Recht steht den Gläubigern jedoch nur zu, wenn sie glaubhaft machen, dass durch die Umwandlung die Erfüllung ihrer Forderung gefährdet wird. Das Recht, Sicherheitsleistung zu verlangen, steht Gläubigern nicht zu, die im Falle der Insolvenz ein Recht auf vorzugsweise Befriedigung aus einer Deckungsmasse haben, die nach gesetzlicher Vorschrift zu ihrem Schutz errichtet und staatlich überwacht ist."
    },
    {
      "date": "2025-12-17",
      "id": "140256",
      "original_text": "Registerbekanntmachung nach dem Umwandlungsgesetz\nSaarland Amtsgericht Saarbrücken GsR 469\nW & B eGbR – Saarbrücken",
      "type": "Registerbekanntmachung nach dem Umwandlungsgesetz",
      "state": "Saarland",
      "amtsgericht": "Amtsgericht Saarbrücken",
      "registernummer": "GsR 469",
      "registerart": "GsR",
      "company_name": "W & B eGbR",
      "company_seat": "Saarbrücken",
      "details": "17.12.2025 (Bekanntmachungsdatum)\n\nSaarland Amtsgericht Saarbrücken GsR 469\nRegisterbekanntmachung nach dem Umwandlungsgesetz 17.12.2025 (Eintragungsdatum)\n\nW & B eGbR\nGesellschaft bürgerlichen Rechts\nSaarbrücken\n\nAls nicht eingetragen wird bekannt gemacht: Den Gläubigern der an der Verschmelzung beteiligten Gesellschaften ist, wenn sie binnen sechs Monaten nach dem Tag, an dem die Eintragung der Verschmelzung in das Register des Sitzes desjenigen Rechtsträgers, dessen Gläubiger sie sind, nach § 19 Absatz 3 UmwG bekannt gemacht worden ist, ihren Anspruch nach Grund und Höhe schriftlich anmelden, Sicherheit zu leisten, soweit sie nicht Befriedigung verlangen können. Dieses Recht steht den Gläubigern jedoch nur zu, wenn sie glaubhaft machen, dass durch die Verschmelzung die Erfüllung ihrer Forderung gefährdet wird."
    },
    {
      "date": "2025-12-17",
      "id": "140257",
      "original_text": "Registerbekanntmachung nach dem Umwandlungsgesetz\nSaarland Amtsgericht Saarbrücken HRB 111003\nWeber & Boumrifak GmbH – Saarbrücken",
      "type": "Registerbekanntmachung nach dem Umwandlungsgesetz",
      "state": "Saarland",
      "amtsgericht": "Amtsgericht Saarbrücken",
      "registernummer": "HRB 111003",
      "registerart": "HRB",
      "company_name": "Weber & Boumrifak GmbH",
      "company_seat": "Saarbrücken",
      "details": "17.12.2025 (Bekanntmachungsdatum)\n\nSaarland Amtsgericht Saarbrücken HRB 111003\nRegisterbekanntmachung nach dem Umwandlungsgesetz 17.12.2025 (Eintragungsdatum)\n\nWeber & Boumrifak GmbH\nGesellschaft mit beschränkter Haftung\nSaarbrücken\n\nAls nicht eingetragen wird bekannt gemacht: Den Gläubigern der an der Verschmelzung beteiligten Gesellschaften ist, wenn sie binnen sechs Monaten nach dem Tag, an dem die Eintragung der Verschmelzung in das Register des Sitzes desjenigen Rechtsträgers, dessen Gläubiger sie sind, nach § 19 Absatz 3 UmwG bekannt gemacht worden ist, ihren Anspruch nach Grund und Höhe schriftlich anmelden, Sicherheit zu leisten, soweit sie nicht Befriedigung verlangen können. Dieses Recht steht den Gläubigern jedoch nur zu, wenn sie glaubhaft machen, dass durch die Verschmelzung die Erfüllung ihrer Forderung gefährdet wird."
    },
    {
      "date": "2025-12-17",
      "id": "140258",
      "original_text": "Registerbekanntmachung nach dem Umwandlungsgesetz\nSaarland Amtsgericht Saarbrücken HRB 106430\nMadera Ventures GmbH – St. Ingbert",
      "type": "Registerbekanntmachung nach dem Umwandlungsgesetz",
      "state": "Saarland",
      "amtsgericht": "Amtsgericht Saarbrücken",
      "registernummer": "HRB 106430",
      "registerart": "HRB",
      "company_name": "Madera Ventures GmbH",
      "company_seat": "St. Ingbert",
      "details": "17.12.2025 (Bekanntmachungsdatum)\n\nSaarland Amtsgericht Saarbrücken HRB 106430\nRegisterbekanntmachung nach dem Umwandlungsgesetz 17.12.2025 (Eintragungsdatum)\n\nMadera Ventures GmbH\nGesellschaft mit beschränkter Haftung\nSt. Ingbert\n\nAls nicht eingetragen wird bekannt gemacht: Den Gläubigern der an der Verschmelzung beteiligten Gesellschaften ist, wenn sie binnen sechs Monaten nach dem Tag, an dem die Eintragung der Verschmelzung in das Register des Sitzes desjenigen Rechtsträgers, dessen Gläubiger sie sind, nach § 19 Absatz 3 UmwG bekannt gemacht worden ist, ihren Anspruch nach Grund und Höhe schriftlich anmelden, Sicherheit zu leisten, soweit sie nicht Befriedigung verlangen können. Dieses Recht steht den Gläubigern jedoch nur zu, wenn sie glaubhaft machen, dass durch die Verschmelzung die Erfüllung ihrer Forderung gefährdet wird."
    },
    {
      "date": "2025-12-17",
      "id": "140259",
      "original_text": "Registerbekanntmachung nach dem Umwandlungsgesetz\nSaarland Amtsgericht Saarbrücken HRB 100952\nKIOBIS GmbH – St. Ingbert",
      "type": "Registerbekanntmachung nach dem Umwandlungsgesetz",
      "state": "Saarland",
      "amtsgericht": "Amtsgericht Saarbrücken",
      "registernummer": "HRB 100952",
      "registerart": "HRB",
      "company_name": "KIOBIS GmbH",
      "company_seat": "St. Ingbert",
      "details": "17.12.2025 (Bekanntmachungsdatum)\n\nSaarland Amtsgericht Saarbrücken HRB 100952\nRegisterbekanntmachung nach dem Umwandlungsgesetz 17.12.2025 (Eintragungsdatum)\n\nKIOBIS GmbH\nGesellschaft mit beschränkter Haftung\nSt. Ingbert\n\nAls nicht eingetragen wird bekannt gemacht: Den Gläubigern der an der Verschmelzung beteiligten Gesellschaften ist, wenn sie binnen sechs Monaten nach dem Tag, an dem die Eintragung der Verschmelzung in das Register des Sitzes desjenigen Rechtsträgers, dessen Gläubiger sie sind, nach § 19 Absatz 3 UmwG bekannt gemacht worden ist, ihren Anspruch nach Grund und Höhe schriftlich anmelden, Sicherheit zu leisten, soweit sie nicht Befriedigung verlangen können. Dieses Recht steht den Gläubigern jedoch nur zu, wenn sie glaubhaft machen, dass durch die Verschmelzung die Erfüllung ihrer Forderung gefährdet wird."
    },
    {
      "date": "2025-12-17",
      "id": "140260",
      "original_text": "Registerbekanntmachung nach dem Umwandlungsgesetz\nBaden-Württemberg Amtsgericht Stuttgart HRA 742558\nMaler und Stuckateur Michael Lehmann e.K. – Remshalden",
      "type": "Registerbekanntmachung nach dem Umwandlungsgesetz",
      "state": "Baden-Württemberg",
      "amtsgericht": "Amtsgericht Stuttgart",
      "registernummer": "HRA 742558",
      "registerart": "HRA",
      "company_name": "Maler und Stuckateur Michael Lehmann e.K.",
      "company_seat": "Remshalden",
      "details": "17.12.2025 (Bekanntmachungsdatum)\n\nBaden-Württemberg Amtsgericht Stuttgart HRA 742558\nRegisterbekanntmachung nach dem Umwandlungsgesetz 17.12.2025 (Eintragungsdatum)\n\nMaler und Stuckateur Michael Lehmann e.K.\nEinzelkaufmann / Einzelkauffrau\nRemshalden\n\nAls nicht eingetragen wird bekanntgemacht:\nDen Gläubigern der an der Ausgliederung beteiligten Rechtsträger ist, wenn sie binnen sechs Monaten nach dem Tag, an dem die Eintragung der Ausgliederung in das Register des Sitzes desjenigen Rechtsträgers, dessen Gläubiger sie sind, nach § 19 Abs. 3 UmwG als bekanntgemacht gilt, ihren Anspruch nach Grund und Höhe schriftlich anmelden, Sicherheit zu leisten, soweit sie nicht Befriedigung verlangen können. Dieses Recht steht den Gläubigern jedoch nur zu, wenn sie glaubhaft machen, dass durch die Ausgliederung die Erfüllung ihrer Forderung gefährdet wird."
    },
    {
      "date": "2025-12-17",
      "id": "140261",
      "original_text": "Löschungsankündigung\nBaden-Württemberg Amtsgericht Mannheim HRB 730253\nADVANTAGE Social Media Marketing UG (haftungsbeschränkt) – Mühlhausen",
      "type": "Löschungsankündigung",
      "state": "Baden-Württemberg",
      "amtsgericht": "Amtsgericht Mannheim",
      "registernummer": "HRB 730253",
      "registerart": "HRB",
      "company_name": "ADVANTAGE Social Media Marketing UG (haftungsbeschränkt)",
      "company_seat": "Mühlhausen",
      "details": "17.12.2025 (Bekanntmachungsdatum)\n\nBaden-Württemberg Amtsgericht Mannheim HRB 730253\nLöschungsankündigung 17.12.2025 (Eintragungsdatum)\n\nADVANTAGE Social Media Marketing UG (haftungsbeschränkt)\nGesellschaft mit beschränkter Haftung\nMühlhausen\n\nDas Gericht beabsichtigt, die Gesellschaft wegen Vermögenslosigkeit im Handelsregister von Amts wegen nach § 394 FamFG zu löschen. Die Frist zur Geltendmachung eines Widerspruchs gegen die beabsichtigte Löschung ist auf einen Monat ab Veröffentlichung bestimmt."
    },
    {
      "date": "2025-12-17",
      "id": "140262",
      "original_text": "Registerbekanntmachung nach dem Umwandlungsgesetz\nSaarland Amtsgericht Saarbrücken HRB 107558\nCKos GmbH & Co. KGaA – Saarbrücken",
      "type": "Registerbekanntmachung nach dem Umwandlungsgesetz",
      "state": "Saarland",
      "amtsgericht": "Amtsgericht Saarbrücken",
      "registernummer": "HRB 107558",
      "registerart": "HRB",
      "company_name": "CKos GmbH & Co. KGaA",
      "company_seat": "Saarbrücken",
      "details": "17.12.2025 (Bekanntmachungsdatum)\n\nSaarland Amtsgericht Saarbrücken HRB 107558\nRegisterbekanntmachung nach dem Umwandlungsgesetz 17.12.2025 (Eintragungsdatum)\n\nCKos GmbH & Co. KGaA\nKommanditgesellschaft auf Aktien\nSaarbrücken\n\nAls nicht eingetragen wird bekannt gemacht: Den Gläubigern der an der Verschmelzung beteiligten Gesellschaften ist, wenn sie binnen sechs Monaten nach dem Tag, an dem die Eintragung der Verschmelzung in das Register des Sitzes derjenigen Rechtsträger deren Gläubiger sie sind, nach § 19 Absatz 3 UmwG bekannt gemacht worden ist, ihren Anspruch nach Grund und Höhe schriftlich anmelden, Sicherheit zu leisten, soweit sie nicht Befriedigung verlangen können. Dieses Recht steht den Gläubigern jedoch nur zu, wenn sie glaubhaft machen, dass durch die Verschmelzung die Erfüllung ihrer Forderung gefährdet wird."
    },
    {
      "date": "2025-12-17",
      "id": "140263",
      "original_text": "Registerbekanntmachung nach dem Umwandlungsgesetz\nSaarland Amtsgericht Saarbrücken HRB 106520\nSO-Akademie GmbH – Saarlouis",
      "type": "Registerbekanntmachung nach dem Umwandlungsgesetz",
      "state": "Saarland",
      "amtsgericht": "Amtsgericht Saarbrücken",
      "registernummer": "HRB 106520",
      "registerart": "HRB",
      "company_name": "SO-Akademie GmbH",
      "company_seat": "Saarlouis",
      "details": "17.12.2025 (Bekanntmachungsdatum)\n\nSaarland Amtsgericht Saarbrücken HRB 106520\nRegisterbekanntmachung nach dem Umwandlungsgesetz 17.12.2025 (Eintragungsdatum)\n\nSO-Akademie GmbH\nGesellschaft mit beschränkter Haftung\nSaarlouis\n\nAls nicht eingetragen wird bekannt gemacht: Den Gläubigern der an der Verschmelzung beteiligten Gesellschaften ist, wenn sie binnen sechs Monaten nach dem Tag, an dem die Eintragung der Verschmelzung in das Register des Sitzes derjenigen Rechtsträger deren Gläubiger sie sind, nach § 19 Absatz 3 UmwG bekannt gemacht worden ist, ihren Anspruch nach Grund und Höhe schriftlich anmelden, Sicherheit zu leisten, soweit sie nicht Befriedigung verlangen können. Dieses Recht steht den Gläubigern jedoch nur zu, wenn sie glaubhaft machen, dass durch die Verschmelzung die Erfüllung ihrer Forderung gefährdet wird."
    },
    {
      "date": "2025-12-17",
      "id": "140264",
      "original_text": "Sonstige Registerbekanntmachung\nBaden-Württemberg Amtsgericht Stuttgart HRB 786475\nCureVac SE – Tübingen",
      "type": "Sonstige Registerbekanntmachung",
      "state": "Baden-Württemberg",
      "amtsgericht": "Amtsgericht Stuttgart",
      "registernummer": "HRB 786475",
      "registerart": "HRB",
      "company_name": "CureVac SE",
      "company_seat": "Tübingen",
      "details": "17.12.2025 (Bekanntmachungsdatum)\n\nBaden-Württemberg Amtsgericht Stuttgart HRB 786475\nSonstige Registerbekanntmachung\n\nCureVac SE\nEuropäische Aktiengesellschaft (SE)\nTübingen\n\nDie Gesellschaft hat am 12.12.2025 die Liste über die Zusammensetzung des Aufsichtsrats zum Handelsregister eingereicht."
    },
    {
      "date": "2025-12-17",
      "id": "140265",
      "original_text": "Löschungsankündigung\nSaarland Amtsgericht Saarbrücken HRB 26503\nTeam Repro, Gesellschaft für elektronische Druckvorlagenherstellung mbH – Wadgassen",
      "type": "Löschungsankündigung",
      "state": "Saarland",
      "amtsgericht": "Amtsgericht Saarbrücken",
      "registernummer": "HRB 26503",
      "registerart": "HRB",
      "company_name": "Team Repro, Gesellschaft für elektronische Druckvorlagenherstellung mbH",
      "company_seat": "Wadgassen",
      "details": "17.12.2025 (Bekanntmachungsdatum)\n\nSaarland Amtsgericht Saarbrücken HRB 26503\nLöschungsankündigung\n\nTeam Repro, Gesellschaft für elektronische Druckvorlagenherstellung mbH\nGesellschaft mit beschränkter Haftung\nWadgassen\n\nEs ist beabsichtigt, die Gesellschaft von Amts wegen gemäß § 394 FamFG wegen Vermögenslosigkeit zu löschen.\nGegen die Löschung von Amts wegen ist das Rechtsmittel des Widerspruchs statthaft. Der Widerspruch ist binnen einer Frist zwei Monaten beginnend mit dem Tag dieser Veröffentlichung durch Einreichen eines Widerspruchsschreibens -schriftlich oder zur Niederschrift der Geschäftsstelle beim Amtsgericht Saarbrücken, -zentrales Handelsregister-, Mainzerstr.178, 66121 Saarbrücken einzulegen.\nDer Widerspruch muss die Bezeichnung der angefochtenen Löschungsankündigung enthalten sowie die Erklärung, dass Widerspruch eingelegt wird. Er ist vom Widerspruchsführer oder seinem Bevollmächtigten zu unterzeichnen.\nDas Widerspruchsschreiben kann auch in der Form eines elektronischen Dokumentes eingereicht werden, das mit einer qualifizierten elektronischen Signatur nach dem Signaturgesetz versehen sein muss (§§ 14 Abs. 2 FamFG, 130a, 298 ZPO)."
    },
    {
      "date": "2025-12-17",
      "id": "140266",
      "original_text": "Löschungsankündigung\nBaden-Württemberg Amtsgericht Freiburg HRB 721533\nSentinel Security UG (haftungsbeschränkt) – Konstanz",
      "type": "Löschungsankündigung",
      "state": "Baden-Württemberg",
      "amtsgericht": "Amtsgericht Freiburg",
      "registernummer": "HRB 721533",
      "registerart": "HRB",
      "company_name": "Sentinel Security UG (haftungsbeschränkt)",
      "company_seat": "Konstanz",
      "details": "17.12.2025 (Bekanntmachungsdatum)\n\nBaden-Württemberg Amtsgericht Freiburg HRB 721533\nLöschungsankündigung\n\nSentinel Security UG (haftungsbeschränkt)\nGesellschaft mit beschränkter Haftung\nKonstanz\n\nDas Gericht beabsichtigt, die Gesellschaft wegen Vermögenslosigkeit im Handelsregister von Amts wegen nach § 394 FamFG zu löschen. Die Frist zur Geltendmachung eines Widerspruchs gegen die beabsichtigte Löschung ist auf einen Monat ab Veröffentlichung bestimmt."
    },
    {
      "date": "2025-12-17",
      "id": "140267",
      "original_text": "Registerbekanntmachung nach dem Umwandlungsgesetz\nBaden-Württemberg Amtsgericht Mannheim HRB 107907\nmedavis GmbH – Karlsruhe",
      "type": "Registerbekanntmachung nach dem Umwandlungsgesetz",
      "state": "Baden-Württemberg",
      "amtsgericht": "Amtsgericht Mannheim",
      "registernummer": "HRB 107907",
      "registerart": "HRB",
      "company_name": "medavis GmbH",
      "company_seat": "Karlsruhe",
      "details": "17.12.2025 (Bekanntmachungsdatum)\n\nBaden-Württemberg Amtsgericht Mannheim HRB 107907\nRegisterbekanntmachung nach dem Umwandlungsgesetz 17.12.2025 (Eintragungsdatum)\n\nmedavis GmbH\nGesellschaft mit beschränkter Haftung\nKarlsruhe\n\nDen Gläubigern der an der Verschmelzung beteiligten Rechtsträger ist, wenn sie binnen sechs Monaten nach dem Tag, an dem die Eintragung der Verschmelzung in das Register des Sitzes desjenigen Rechtsträgers, dessen Gläubiger sie sind, nach § 19 Abs. 3 UmwG als bekanntgemacht gilt, ihren Anspruch nach Grund und Höhe schriftlich anmelden, Sicherheit zu leisten, soweit sie nicht Befriedigung verlangen können. Dieses Recht steht den Gläubigern jedoch nur zu, wenn sie glaubhaft machen, dass durch die Verschmelzung die Erfüllung ihrer Forderung gefährdet wird."
    },
    {
      "date": "2025-12-17",
      "id": "140268",
      "original_text": "Löschungsankündigung\nBaden-Württemberg Amtsgericht Stuttgart HRB 470268\nHaus & Geld Vermittlungs-GmbH – Rottweil",
      "type": "Löschungsankündigung",
      "state": "Baden-Württemberg",
      "amtsgericht": "Amtsgericht Stuttgart",
      "registernummer": "HRB 470268",
      "registerart": "HRB",
      "company_name": "Haus & Geld Vermittlungs-GmbH",
      "company_seat": "Rottweil",
      "details": "17.12.2025 (Bekanntmachungsdatum)\n\nBaden-Württemberg Amtsgericht Stuttgart HRB 470268\nLöschungsankündigung\n\nHaus & Geld Vermittlungs-GmbH\nGesellschaft mit beschränkter Haftung\nRottweil\n\nDas Gericht beabsichtigt, die Gesellschaft wegen Vermögenslosigkeit im Handelsregister von Amts wegen nach § 394 FamFG zu löschen. Die Frist zur Geltendmachung eines Widerspruchs gegen die beabsichtigte Löschung ist auf zwei Monate ab Veröffentlichung bestimmt."
    },
    {
      "date": "2025-12-17",
      "id": "140269",
      "original_text": "Löschungsankündigung\nSchleswig-Holstein Amtsgericht Lübeck HRB 26397\nWSL-Bau und Logistik UG (haftungsbeschränkt) – Reinfeld",
      "type": "Löschungsankündigung",
      "state": "Schleswig-Holstein",
      "amtsgericht": "Amtsgericht Lübeck",
      "registernummer": "HRB 26397",
      "registerart": "HRB",
      "company_name": "WSL-Bau und Logistik UG (haftungsbeschränkt)",
      "company_seat": "Reinfeld",
      "details": "17.12.2025 (Bekanntmachungsdatum)\n\nSchleswig-Holstein Amtsgericht Lübeck HRB 26397\nLöschungsankündigung\n\nWSL-Bau und Logistik UG (haftungsbeschränkt)\nGesellschaft mit beschränkter Haftung\nReinfeld\n\nErgeben sich aus den mir vorliegenden Unterlagen Anhaltspunkte dafür, dass die Gesellschaft vermögenslos ist:\nDie Gesellschaft hat kein Gewerbe angemeldet und ist unter der im Handelsregister eingetragenen Geschäftsanschrift nicht zu erreichen. Die Anschrift des Geschäftsführer ist nicht zu ermitteln.\nIch beabsichtige daher, die Gesellschaft wegen Vermögenslosigkeit gemäß § 394 FamFG zu löschen.\nIch bestimme eine Frist von einem Monat zur Geltendmachung eines Widerspruchs gegen die Löschung, § 394 Abs. 2 S. 1 FamFG.\nWeiter bitte ich Sie, mir binnen derselben Frist mitzuteilen, ob die genannte Gesellschaft noch Vermögen hat, ggf. welche Vermögensgegenstände sie besitzt, ob die Gesellschaft noch Partei eines noch nicht rechtskräftig abgeschlossenen Rechtsstreits ist oder ob sonst noch eine Abwicklung stattfindet.\nNach Fristablauf ohne Widerspruch von Ihnen oder anderer Seite wird die Gesellschaft gelöscht."
    },
    {
      "date": "2025-12-17",
      "id": "140270",
      "original_text": "Registerbekanntmachung nach dem Umwandlungsgesetz\nSaarland Amtsgericht Saarbrücken HRB 13607\nWagner Gesellschaft mit beschränkter Haftung – Neunkirchen",
      "type": "Registerbekanntmachung nach dem Umwandlungsgesetz",
      "state": "Saarland",
      "amtsgericht": "Amtsgericht Saarbrücken",
      "registernummer": "HRB 13607",
      "registerart": "HRB",
      "company_name": "Wagner Gesellschaft mit beschränkter Haftung",
      "company_seat": "Neunkirchen",
      "details": "17.12.2025 (Bekanntmachungsdatum)\n\nSaarland Amtsgericht Saarbrücken HRB 13607\nRegisterbekanntmachung nach dem Umwandlungsgesetz 17.12.2025 (Eintragungsdatum)\n\nWagner Gesellschaft mit beschränkter Haftung\nGesellschaft mit beschränkter Haftung\nNeunkirchen\n\nAls nicht eingetragen wird bekannt gemacht: Den Gläubigern der an der formwechselnden Umwandlung beteiligten Gesellschaften ist, wenn sie binnen sechs Monaten nach dem Tag, an dem die Eintragung der formwechselnden Umwandlung in das Register des Sitzes desjenigen Rechtsträgers, dessen Gläubiger sie sind, nach § 19 Absatz 3 UmwG bekannt gemacht worden ist, ihren Anspruch nach Grund und Höhe schriftlich anmelden, Sicherheit zu leisten, soweit sie nicht Befriedigung verlangen können. Dieses Recht steht den Gläubigern jedoch nur zu, wenn sie glaubhaft machen, dass durch die formwechselnden Umwandlung die Erfüllung ihrer Forderung gefährdet wird."
    },
    {
      "date": "2025-12-17",
      "id": "140271",
      "original_text": "Einreichung neuer Dokumente\nBrandenburg Amtsgericht Potsdam HRB 2221\nMercedes-Benz Ludwigsfelde GmbH – Ludwigsfelde",
      "type": "Einreichung neuer Dokumente",
      "state": "Brandenburg",
      "amtsgericht": "Amtsgericht Potsdam",
      "registernummer": "HRB 2221",
      "registerart": "HRB",
      "company_name": "Mercedes-Benz Ludwigsfelde GmbH",
      "company_seat": "Ludwigsfelde",
      "details": "17.12.2025 (Bekanntmachungsdatum)\n\nBrandenburg Amtsgericht Potsdam HRB 2221\nEinreichung neuer Dokumente\n\nMercedes-Benz Ludwigsfelde GmbH\nGesellschaft mit beschränkter Haftung\nLudwigsfelde\n\nAls nicht eingetragen wird bekanntgemacht : Eine Liste der Mitglieder des Aufsichtsrates wurde zum Handelsregister eingereicht."
    },
    {
      "date": "2025-12-17",
      "id": "140272",
      "original_text": "Löschungsankündigung\nSchleswig-Holstein Amtsgericht Pinneberg HRB 4084\nMERKURENT Kapitalvertriebs GmbH – Ellerbek",
      "type": "Löschungsankündigung",
      "state": "Schleswig-Holstein",
      "amtsgericht": "Amtsgericht Pinneberg",
      "registernummer": "HRB 4084",
      "registerart": "HRB",
      "company_name": "MERKURENT Kapitalvertriebs GmbH",
      "company_seat": "Ellerbek",
      "details": "17.12.2025 (Bekanntmachungsdatum)\n\nSchleswig-Holstein Amtsgericht Pinneberg HRB 4084\nLöschungsankündigung\n\nMERKURENT Kapitalvertriebs GmbH\nGesellschaft mit beschränkter Haftung\nEllerbek\n\nEs ist die Löschung der nachstehenden Gesellschaft wegen Vermögenslosigkeit gemäß § 394 FamFG beabsichtigt. Widerspruchsfrist: 2 Monate."
    },
    {
      "date": "2025-12-17",
      "id": "140273",
      "original_text": "Registerbekanntmachung nach dem Umwandlungsgesetz\nBaden-Württemberg Amtsgericht Stuttgart HRB 224272\nGDT Gründach Technik GmbH Südwest – Unterensingen",
      "type": "Registerbekanntmachung nach dem Umwandlungsgesetz",
      "state": "Baden-Württemberg",
      "amtsgericht": "Amtsgericht Stuttgart",
      "registernummer": "HRB 224272",
      "registerart": "HRB",
      "company_name": "GDT Gründach Technik GmbH Südwest",
      "company_seat": "Unterensingen",
      "details": "17.12.2025 (Bekanntmachungsdatum)\n\nBaden-Württemberg Amtsgericht Stuttgart HRB 224272\nRegisterbekanntmachung nach dem Umwandlungsgesetz 17.12.2025 (Eintragungsdatum)\n\nGDT Gründach Technik GmbH Südwest\nGesellschaft mit beschränkter Haftung\nUnterensingen\n\nAls nicht eingetragen wird bekanntgemacht:\nDen Gläubigern der an der Verschmelzung beteiligten Rechtsträger ist, wenn sie binnen sechs Monaten nach dem Tag, an dem die Eintragung der Verschmelzung in das Register des Sitzes desjenigen Rechtsträgers, dessen Gläubiger sie sind, nach § 19 Abs. 3 UmwG als bekanntgemacht gilt, ihren Anspruch nach Grund und Höhe schriftlich anmelden, Sicherheit zu leisten, soweit sie nicht Befriedigung verlangen können. Dieses Recht steht den Gläubigern jedoch nur zu, wenn sie glaubhaft machen, dass durch die Verschmelzung die Erfüllung ihrer Forderung gefährdet wird."
    },
    {
      "date": "2025-12-17",
      "id": "140274",
      "original_text": "Sonstige Registerbekanntmachung\nHamburg Amtsgericht Hamburg HRB 2753\nThalia Theater Gesellschaft mit beschränkter Haftung – Hamburg",
      "type": "Sonstige Registerbekanntmachung",
      "state": "Hamburg",
      "amtsgericht": "Amtsgericht Hamburg",
      "registernummer": "HRB 2753",
      "registerart": "HRB",
      "company_name": "Thalia Theater Gesellschaft mit beschränkter Haftung",
      "company_seat": "Hamburg",
      "details": "17.12.2025 (Bekanntmachungsdatum)\n\nHamburg Amtsgericht Hamburg HRB 2753\nSonstige Registerbekanntmachung 17.12.2025 (Eintragungsdatum)\n\nThalia Theater Gesellschaft mit beschränkter Haftung\nGesellschaft mit beschränkter Haftung\nHamburg\n\nAls nicht eingetragen wird bekannt gemacht: Listen des Aufsichtsrats wurden eingereicht."
    },
    {
      "date": "2025-12-17",
      "id": "140275",
      "original_text": "Einreichung neuer Dokumente\nBerlin Amtsgericht Berlin (Charlottenburg) HRB 142663\nMontredo GmbH – Berlin",
      "type": "Einreichung neuer Dokumente",
      "state": "Berlin",
      "amtsgericht": "Amtsgericht Berlin (Charlottenburg)",
      "registernummer": "HRB 142663",
      "registerart": "HRB",
      "company_name": "Montredo GmbH",
      "company_seat": "Berlin",
      "details": "17.12.2025 (Bekanntmachungsdatum)\n\nBerlin Amtsgericht Berlin (Charlottenburg) HRB 142663\nEinreichung neuer Dokumente\n\nMontredo GmbH\nGesellschaft mit beschränkter Haftung\nBerlin\n\nAls nicht eingetragen wird veröffentlicht: Es wurde eine neue Liste der Aufsichtsratsmitglieder eingereicht (§52 GmbHG)."
    },
    {
      "date": "2025-12-17",
      "id": "140276",
      "original_text": "Löschungsankündigung\nBrandenburg Amtsgericht Frankfurt/Oder HRB 20332\nDenova Dienstleistungs GmbH – Eberswalde",
      "type": "Löschungsankündigung",
      "state": "Brandenburg",
      "amtsgericht": "Amtsgericht Frankfurt/Oder",
      "registernummer": "HRB 20332",
      "registerart": "HRB",
      "company_name": "Denova Dienstleistungs GmbH",
      "company_seat": "Eberswalde",
      "details": "17.12.2025 (Bekanntmachungsdatum)\n\nBrandenburg Amtsgericht Frankfurt/Oder HRB 20332\nLöschungsankündigung\n\nDenova Dienstleistungs GmbH\nGesellschaft mit beschränkter Haftung\nEberswalde\n\nBei der nachstehenden Gesellschaft wird das Amtslöschungsverfahren gemäß § 394 FamFG eingeleitet."
    },
    {
      "date": "2025-12-17",
      "id": "140277",
      "original_text": "Löschungsankündigung\nBerlin Amtsgericht Berlin (Charlottenburg) HRB 233233\nWF Objekt 01 GmbH – Berlin",
      "type": "Löschungsankündigung",
      "state": "Berlin",
      "amtsgericht": "Amtsgericht Berlin (Charlottenburg)",
      "registernummer": "HRB 233233",
      "registerart": "HRB",
      "company_name": "WF Objekt 01 GmbH",
      "company_seat": "Berlin",
      "details": "17.12.2025 (Bekanntmachungsdatum)\n\nBerlin Amtsgericht Berlin (Charlottenburg) HRB 233233\nLöschungsankündigung\n\nWF Objekt 01 GmbH\nGesellschaft mit beschränkter Haftung\nBerlin\n\nBei der nachstehenden Gesellschaft wird das Amtslöschungsverfahren gemäß § 394 FamFG eingeleitet. Widerspruchsfrist 6 Wochen"
    },
    {
      "date": "2025-12-17",
      "id": "140278",
      "original_text": "Registerbekanntmachung nach dem Umwandlungsgesetz\nBaden-Württemberg Amtsgericht Stuttgart HRB 803047\nMesa Events GmbH – Schömberg",
      "type": "Registerbekanntmachung nach dem Umwandlungsgesetz",
      "state": "Baden-Württemberg",
      "amtsgericht": "Amtsgericht Stuttgart",
      "registernummer": "HRB 803047",
      "registerart": "HRB",
      "company_name": "Mesa Events GmbH",
      "company_seat": "Schömberg",
      "details": "17.12.2025 (Bekanntmachungsdatum)\n\nBaden-Württemberg Amtsgericht Stuttgart HRB 803047\nRegisterbekanntmachung nach dem Umwandlungsgesetz 17.12.2025 (Eintragungsdatum)\n\nMesa Events GmbH\nGesellschaft mit beschränkter Haftung\nSchömberg\n\nAls nicht eingetragen wird bekanntgemacht:\nDen Gläubigern der an der Ausgliederung beteiligten Rechtsträger ist, wenn sie binnen sechs Monaten nach dem Tag, an dem die Eintragung der Ausgliederung in das Register des Sitzes desjenigen Rechtsträgers, dessen Gläubiger sie sind, nach § 19 Abs. 3 UmwG als bekanntgemacht gilt, ihren Anspruch nach Grund und Höhe schriftlich anmelden, Sicherheit zu leisten, soweit sie nicht Befriedigung verlangen können. Dieses Recht steht den Gläubigern jedoch nur zu, wenn sie glaubhaft machen, dass durch die Ausgliederung die Erfüllung ihrer Forderung gefährdet wird."
    },
    {
      "date": "2025-12-17",
      "id": "140279",
      "original_text": "Registerbekanntmachung nach dem Umwandlungsgesetz\nSachsen-Anhalt Amtsgericht Stendal HRB 24127\ntecando GmbH – Bitterfeld-Wolfen",
      "type": "Registerbekanntmachung nach dem Umwandlungsgesetz",
      "state": "Sachsen-Anhalt",
      "amtsgericht": "Amtsgericht Stendal",
      "registernummer": "HRB 24127",
      "registerart": "HRB",
      "company_name": "tecando GmbH",
      "company_seat": "Bitterfeld-Wolfen",
      "details": "17.12.2025 (Bekanntmachungsdatum)\n\nSachsen-Anhalt Amtsgericht Stendal HRB 24127\nRegisterbekanntmachung nach dem Umwandlungsgesetz 17.12.2025 (Eintragungsdatum)\n\ntecando GmbH\nGesellschaft mit beschränkter Haftung\nBitterfeld-Wolfen\n\nDie Gesellschaft ist auf Grund des Verschmelzungsvertrages vom 27.11.2025, dem Beschluss der Gesellschafterversammlung vom selben Tag und der Zustimmung des Alleingesellschafters mit dem Vermögen des Alleingesellschafters Rainer Georg Engel, * 19.06.1974, wohnhaft Elbe-Parey OT Parey, verschmolzen. Nicht eingetragen: Den Gläubigern der an der Verschmelzung beteiligten Rechtsträger ist, wenn sie binnen sechs Monaten nach dem Tag, an dem die Eintragung der Verschmelzung nach § 19 Abs. 3 UmwG als bekanntgemacht gilt, ihren Anspruch nach Grund und Höhe schriftlich anmelden, Sicherheit zu leisten, soweit sie nicht Befriedigung verlangen können. Dieses Recht steht ihnen jedoch nur zu, wenn sie glaubhaft machen, dass durch die Verschmelzung die Erfüllung ihrer Forderung gefährdet wird."
    },
    {
      "date": "2025-12-17",
      "id": "140280",
      "original_text": "Löschungsankündigung\nBerlin Amtsgericht Berlin (Charlottenburg) HRB 225589\nNavarra Lab GmbH – Berlin",
      "type": "Löschungsankündigung",
      "state": "Berlin",
      "amtsgericht": "Amtsgericht Berlin (Charlottenburg)",
      "registernummer": "HRB 225589",
      "registerart": "HRB",
      "company_name": "Navarra Lab GmbH",
      "company_seat": "Berlin",
      "details": "17.12.2025 (Bekanntmachungsdatum)\n\nBerlin Amtsgericht Berlin (Charlottenburg) HRB 225589\nLöschungsankündigung\n\nNavarra Lab GmbH\nGesellschaft mit beschränkter Haftung\nBerlin\n\nBei der nachstehenden Gesellschaft wird das Amtslöschungsverfahren gemäß § 394 FamFG eingeleitet. Widerspruchsfrist 6 Wochen"
    },
    {
      "date": "2025-12-17",
      "id": "140281",
      "original_text": "Löschungsankündigung\nThüringen Amtsgericht Jena HRB 210514\nJ+M Raubold Automobile Gesellschaft mit beschränkter Haftung – Windischleuba",
      "type": "Löschungsankündigung",
      "state": "Thüringen",
      "amtsgericht": "Amtsgericht Jena",
      "registernummer": "HRB 210514",
      "registerart": "HRB",
      "company_name": "J+M Raubold Automobile Gesellschaft mit beschränkter Haftung",
      "company_seat": "Windischleuba",
      "details": "17.12.2025 (Bekanntmachungsdatum)\n\nThüringen Amtsgericht Jena HRB 210514\nLöschungsankündigung\n\nJ+M Raubold Automobile Gesellschaft mit beschränkter Haftung\nGesellschaft mit beschränkter Haftung\nWindischleuba\n\nDas Registergericht beabsichtigt, die im Handelsregister eingetragene Gesellschaft wegen Vermögenslosigkeit nach § 394 FamFG von Amts wegen zu löschen. Die Frist zur Erhebung eines Widerspruchs gegen die beabsichtigte Löschung wird auf 6 Wochen festgesetzt."
    },
    {
      "date": "2025-12-17",
      "id": "140282",
      "original_text": "Löschungsankündigung\nBerlin Amtsgericht Berlin (Charlottenburg) HRB 243733\nGigant Print GmbH – Berlin",
      "type": "Löschungsankündigung",
      "state": "Berlin",
      "amtsgericht": "Amtsgericht Berlin (Charlottenburg)",
      "registernummer": "HRB 243733",
      "registerart": "HRB",
      "company_name": "Gigant Print GmbH",
      "company_seat": "Berlin",
      "details": "17.12.2025 (Bekanntmachungsdatum)\n\nBerlin Amtsgericht Berlin (Charlottenburg) HRB 243733\nLöschungsankündigung\n\nGigant Print GmbH\nGesellschaft mit beschränkter Haftung\nBerlin\n\nBei der nachstehenden Gesellschaft wird das Amtslöschungsverfahren gemäß § 394 FamFG eingeleitet. Widerspruchsfrist 6 Wochen"
    },
    {
      "date": "2025-12-17",
      "id": "140283",
      "original_text": "Registerbekanntmachung nach dem Umwandlungsgesetz\nBaden-Württemberg Amtsgericht Stuttgart HRB 762972\nAUDERE Growth Funds No. 2 GmbH – Fellbach",
      "type": "Registerbekanntmachung nach dem Umwandlungsgesetz",
      "state": "Baden-Württemberg",
      "amtsgericht": "Amtsgericht Stuttgart",
      "registernummer": "HRB 762972",
      "registerart": "HRB",
      "company_name": "AUDERE Growth Funds No. 2 GmbH",
      "company_seat": "Fellbach",
      "details": "17.12.2025 (Bekanntmachungsdatum)\n\nBaden-Württemberg Amtsgericht Stuttgart HRB 762972\nRegisterbekanntmachung nach dem Umwandlungsgesetz 17.12.2025 (Eintragungsdatum)\n\nAUDERE Growth Funds No. 2 GmbH\nGesellschaft mit beschränkter Haftung\nFellbach\n\nAls nicht eingetragen wird bekanntgemacht:\nDen Gläubigern der an der Verschmelzung beteiligten Rechtsträger ist, wenn sie binnen sechs Monaten nach dem Tag, an dem die Eintragung der Verschmelzung in das Register des Sitzes desjenigen Rechtsträgers, dessen Gläubiger sie sind, nach § 19 Abs. 3 UmwG als bekanntgemacht gilt, ihren Anspruch nach Grund und Höhe schriftlich anmelden, Sicherheit zu leisten, soweit sie nicht Befriedigung verlangen können. Dieses Recht steht den Gläubigern jedoch nur zu, wenn sie glaubhaft machen, dass durch die Verschmelzung die Erfüllung ihrer Forderung gefährdet wird."
    },
    {
      "date": "2025-12-17",
      "id": "140284",
      "original_text": "Einreichung neuer Dokumente\nBerlin Amtsgericht Berlin (Charlottenburg) HRB 33240\ninab - Ausbildungs- und Beschäftigungsgesellschaft des bfw mbH – Berlin",
      "type": "Einreichung neuer Dokumente",
      "state": "Berlin",
      "amtsgericht": "Amtsgericht Berlin (Charlottenburg)",
      "registernummer": "HRB 33240",
      "registerart": "HRB",
      "company_name": "inab - Ausbildungs- und Beschäftigungsgesellschaft des bfw mbH",
      "company_seat": "Berlin",
      "details": "17.12.2025 (Bekanntmachungsdatum)\n\nBerlin Amtsgericht Berlin (Charlottenburg) HRB 33240\nEinreichung neuer Dokumente\n\ninab - Ausbildungs- und Beschäftigungsgesellschaft des bfw mbH\nGesellschaft mit beschränkter Haftung\nBerlin\n\nAls nicht eingetragen wird veröffentlicht:Es wurde eine neue Liste der Aufsichtsratsmitglieder eingereicht (§52 GmbHG)."
    },
    {
      "date": "2025-12-17",
      "id": "140285",
      "original_text": "Registerbekanntmachung nach dem Umwandlungsgesetz\nSchleswig-Holstein Amtsgericht Flensburg HRB 6219\nHCKP Immobilien GmbH – Flensburg",
      "type": "Registerbekanntmachung nach dem Umwandlungsgesetz",
      "state": "Schleswig-Holstein",
      "amtsgericht": "Amtsgericht Flensburg",
      "registernummer": "HRB 6219",
      "registerart": "HRB",
      "company_name": "HCKP Immobilien GmbH",
      "company_seat": "Flensburg",
      "details": "17.12.2025 (Bekanntmachungsdatum)\n\nSchleswig-Holstein Amtsgericht Flensburg HRB 6219\nRegisterbekanntmachung nach dem Umwandlungsgesetz\n\nHCKP Immobilien GmbH\nGesellschaft mit beschränkter Haftung\nFlensburg\n\nAls nicht eingetragen wird veröffentlicht:\n\n1. Es wird darauf hingewiesen, dass der Entwurf eines Formwechselplans beim Handelsregister eingereicht worden ist.\n\n2. Die formwechselnde Gesellschaft ist eine deutsche Gesellschaft mit beschränkter Haftung unter der Firma HCKP Immobilien GmbH, errichtet und bestehend nach deutschem Recht, mit Sitz in Flensburg. Die Gesellschaft soll im Wege eines grenzüberschreitenden Formwechsels unter Beibehaltung ihrer Rechtspersönlichkeit in eine dänische Gesellschaft mit beschränkter Haftung (Anpartsselskab) unter Sitzverlegung der Gesellschaft nach Odense und Verlegung der Geschäftsanschrift nach C/O Jan Knudsen, Rosenvænget 1c, Dalum, 5250 Odense SV umgewandelt werden.\n\n3. Die formwechselnde Gesellschaft ist im Handelsregister des Amtsgerichts Flensburg unter HRB 6219 FL eingetragen. Die Firma wird nach dem Formwechsel „HCKP Immobilien ApS“ lauten und im dänischen zentralen Unternehmensregister (Centrale Virksomhedsregister „CVR\") eingetragen werden.\n\n4. Dem Gesellschafter und den Gläubigern der Gesellschaft wird mitgeteilt, dass sie der Gesellschaft spätestens fünf Tage vor der am 20. Januar 2026 stattfindenden Gesellschafterversammlung Bemerkungen zu dem beim Handelsregister eingereichten Entwurf des Formwechselplans übermitteln können.\n\n5. Die Gesellschaft hat keine Arbeitnehmer und verfügt über keinen Betriebsrat oder eine sonstige Arbeitnehmervertretung.\n\n6. Die Rechte der Gläubiger der formwechselnden Gesellschaft ergeben sich aus §§ 341, 314 UmwG. Danach ist den Gläubigern der formwechselnden Gesellschaft Sicherheit zu leisten, soweit sich nicht Befriedigung verlangen können, wenn die neue Rechtsform nicht dem deutschen Recht unterliegt. Dieses Recht steht den Gläubigern jedoch nur zu, wenn sie binnen drei Monaten nach dem Tag, an dem der Formwechselplan (oder sein Entwurf) bekannt gemacht worden ist, ihre Ansprüche gerichtlich geltend machen. Dieses Recht auf Sicherheitsleistung steht Gläubigern nur im Hinblick auf solche Forderungen zu, die vor der Bekanntmachung des Formwechselplans oder seines Entwurfs entstanden, aber im Zeitpunkt der Bekanntmachung noch nicht fällig geworden sind, und deren Erfüllung durch den Formwechsel gefährdet wird."
    },
    {
      "date": "2025-12-17",
      "id": "140286",
      "original_text": "Registerbekanntmachung nach dem Umwandlungsgesetz\nBaden-Württemberg Amtsgericht Stuttgart HRB 245420\nRenoPlan GmbH – Jettingen",
      "type": "Registerbekanntmachung nach dem Umwandlungsgesetz",
      "state": "Baden-Württemberg",
      "amtsgericht": "Amtsgericht Stuttgart",
      "registernummer": "HRB 245420",
      "registerart": "HRB",
      "company_name": "RenoPlan GmbH",
      "company_seat": "Jettingen",
      "details": "17.12.2025 (Bekanntmachungsdatum)\n\nBaden-Württemberg Amtsgericht Stuttgart HRB 245420\nRegisterbekanntmachung nach dem Umwandlungsgesetz 17.12.2025 (Eintragungsdatum)\n\nRenoPlan GmbH\nGesellschaft mit beschränkter Haftung\nJettingen\n\nAls nicht eingetragen wird bekanntgemacht:\nDen Gläubigern der an der Verschmelzung beteiligten Rechtsträger ist, wenn sie binnen sechs Monaten nach dem Tag, an dem die Eintragung der Verschmelzung in das Register des Sitzes desjenigen Rechtsträgers, dessen Gläubiger sie sind, nach § 19 Abs. 3 UmwG als bekanntgemacht gilt, ihren Anspruch nach Grund und Höhe schriftlich anmelden, Sicherheit zu leisten, soweit sie nicht Befriedigung verlangen können. Dieses Recht steht den Gläubigern jedoch nur zu, wenn sie glaubhaft machen, dass durch die Verschmelzung die Erfüllung ihrer Forderung gefährdet wird."
    },
    {
      "date": "2025-12-17",
      "id": "140287",
      "original_text": "Registerbekanntmachung nach dem Umwandlungsgesetz\nBaden-Württemberg Amtsgericht Stuttgart HRB 242769\nDIETER GEIGLE GMBH – Jettingen",
      "type": "Registerbekanntmachung nach dem Umwandlungsgesetz",
      "state": "Baden-Württemberg",
      "amtsgericht": "Amtsgericht Stuttgart",
      "registernummer": "HRB 242769",
      "registerart": "HRB",
      "company_name": "DIETER GEIGLE GMBH",
      "company_seat": "Jettingen",
      "details": "17.12.2025 (Bekanntmachungsdatum)\n\nBaden-Württemberg Amtsgericht Stuttgart HRB 242769\nRegisterbekanntmachung nach dem Umwandlungsgesetz 17.12.2025 (Eintragungsdatum)\n\nDIETER GEIGLE GMBH\nGesellschaft mit beschränkter Haftung\nJettingen\n\nDen Gläubigern der an der Verschmelzung beteiligten Rechtsträger ist, wenn sie binnen sechs Monaten nach dem Tag, an dem die Eintragung der Verschmelzung in das Register des Sitzes desjenigen Rechtsträgers, dessen Gläubiger sie sind, nach § 19 Abs. 3 UmwG als bekanntgemacht gilt, ihren Anspruch nach Grund und Höhe schriftlich anmelden, Sicherheit zu leisten, soweit sie nicht Befriedigung verlangen können. Dieses Recht steht den Gläubigern jedoch nur zu, wenn sie glaubhaft machen, dass durch die Verschmelzung die Erfüllung ihrer Forderung gefährdet wird."
    },
    {
      "date": "2025-12-17",
      "id": "140288",
      "original_text": "Registerbekanntmachung nach dem Umwandlungsgesetz\nSchleswig-Holstein Amtsgericht Pinneberg HRB 8250\nEC Europ Coating GmbH – Hohenlockstedt",
      "type": "Registerbekanntmachung nach dem Umwandlungsgesetz",
      "state": "Schleswig-Holstein",
      "amtsgericht": "Amtsgericht Pinneberg",
      "registernummer": "HRB 8250",
      "registerart": "HRB",
      "company_name": "EC Europ Coating GmbH",
      "company_seat": "Hohenlockstedt",
      "details": "17.12.2025 (Bekanntmachungsdatum)\n\nSchleswig-Holstein Amtsgericht Pinneberg HRB 8250\nRegisterbekanntmachung nach dem Umwandlungsgesetz 13.11.2025 (Eintragungsdatum)\n\nEC Europ Coating GmbH\nGesellschaft mit beschränkter Haftung\nHohenlockstedt\n\nZu Eintragungsnummer 8 vom 13.11.2025 wird als nicht eingetragen veröffentlicht: Den Gläubigern der an der Verschmelzung beteiligten Rechtsträger ist, wenn sie binnen sechs Monaten nach dem Tag, an dem die Eintragung der Verschmelzung in das Register des Sitzes desjenigen Rechtsträgers, dessen Gläubiger sie sind, als bekannt gemacht gilt, ihren Anspruch nach Grund und Höhe schriftlich anmelden, Sicherheit zu leisten, soweit sie nicht Befriedigung verlangen können. Dieses Recht steht den Gläubigern jedoch nur zu, wenn sie glaubhaft machen, dass durch die Verschmelzung die Erfüllung ihrer Forderung gefährdet wird. Das Recht, Sicherheitsleistung zu verlangen, steht Gläubigern nicht zu, die im Falle der Insolvenz ein Recht auf vorzugsweise Befriedigung aus einer Deckungsmasse haben, die nach gesetzlicher Vorschrift zu ihrem Schutz errichtet und staatlich überwacht ist."
    },
    {
      "date": "2025-12-17",
      "id": "140289",
      "original_text": "Sonstige Registerbekanntmachung\nSachsen-Anhalt Amtsgericht Stendal HRB 23769\nPflegeheim Binnengärten GmbH – Bitterfeld-Wolfen",
      "type": "Sonstige Registerbekanntmachung",
      "state": "Sachsen-Anhalt",
      "amtsgericht": "Amtsgericht Stendal",
      "registernummer": "HRB 23769",
      "registerart": "HRB",
      "company_name": "Pflegeheim Binnengärten GmbH",
      "company_seat": "Bitterfeld-Wolfen",
      "details": "17.12.2025 (Bekanntmachungsdatum)\n\nSachsen-Anhalt Amtsgericht Stendal HRB 23769\nSonstige Registerbekanntmachung 17.12.2025 (Eintragungsdatum)\n\nPflegeheim Binnengärten GmbH\nGesellschaft mit beschränkter Haftung\nBitterfeld-Wolfen\n\nNicht eingetragen:\nAls nicht eingetragen wird veröffentlicht: Den Gläubigern der Gesellschaft, deren Forderungen begründet worden sind bevor die Eintragung der Beendigung des #DV.Art(Text=\"Art des Vertrages auswählen\",Eingabe=\"Beherrschungs- und Gewinnabführungsvertrages\",\"Beherrschungsvertrages\",\"Gewinnabführungsvertrages\",\"Teilgewinnabführungsvertrages\")  in das Handelsregister nach § 10 des Handelsgesetzbuches als bekanntgemacht gilt, hat der andere Vertragsteil Sicherheit zu leisten, wenn sie sich binnen sechs Monaten nach der Bekanntmachung der Eintragung zu diesem Zweck bei ihm melden."
    },
    {
      "date": "2025-12-17",
      "id": "140290",
      "original_text": "Einreichung neuer Dokumente\nBerlin Amtsgericht Berlin (Charlottenburg) HRB 80443\nBundesdruckerei Gruppe GmbH – Berlin",
      "type": "Einreichung neuer Dokumente",
      "state": "Berlin",
      "amtsgericht": "Amtsgericht Berlin (Charlottenburg)",
      "registernummer": "HRB 80443",
      "registerart": "HRB",
      "company_name": "Bundesdruckerei Gruppe GmbH",
      "company_seat": "Berlin",
      "details": "17.12.2025 (Bekanntmachungsdatum)\n\nBerlin Amtsgericht Berlin (Charlottenburg) HRB 80443\nEinreichung neuer Dokumente\n\nBundesdruckerei Gruppe GmbH\nGesellschaft mit beschränkter Haftung\nBerlin\n\nAls nicht eingetragen wird veröffentlicht:Es wurde eine neue Liste der Aufsichtsratsmitglieder eingereicht (§52 GmbHG)."
    },
    {
      "date": "2025-12-17",
      "id": "140291",
      "original_text": "Registerbekanntmachung nach dem Umwandlungsgesetz\nSchleswig-Holstein Amtsgericht Pinneberg HRB 12846\nKnüppel und Partner Steuerberatungsgesellschaft mbH – Elmshorn",
      "type": "Registerbekanntmachung nach dem Umwandlungsgesetz",
      "state": "Schleswig-Holstein",
      "amtsgericht": "Amtsgericht Pinneberg",
      "registernummer": "HRB 12846",
      "registerart": "HRB",
      "company_name": "Knüppel und Partner Steuerberatungsgesellschaft mbH",
      "company_seat": "Elmshorn",
      "details": "17.12.2025 (Bekanntmachungsdatum)\n\nSchleswig-Holstein Amtsgericht Pinneberg HRB 12846\nRegisterbekanntmachung nach dem Umwandlungsgesetz 12.12.2025 (Eintragungsdatum)\n\nKnüppel und Partner Steuerberatungsgesellschaft mbH\nGesellschaft mit beschränkter Haftung\nElmshorn\n\nZu Eintragungsnummer 4 vom 12.12.2025 wird als nicht eingetragen veröffentlicht: Den Gläubigern der an der Spaltung beteiligten Rechtsträger ist, wenn sie binnen sechs Monaten nach dem Tag, an dem die Eintragung der Spaltung in das Register des Sitzes desjenigen Rechtsträgers, dessen Gläubiger sie sind, als bekannt gemacht gilt, ihren Anspruch nach Grund und Höhe schriftlich anmelden, Sicherheit zu leisten, soweit sie nicht Befriedigung verlangen können. Dieses Recht steht den Gläubigern jedoch nur zu, wenn sie glaubhaft machen, dass durch die Spaltung die Erfüllung ihrer Forderung gefährdet wird. Das Recht, Sicherheitsleistung zu verlangen, steht Gläubigern nicht zu, die im Falle der Insolvenz ein Recht auf vorzugsweise Befriedigung aus einer Deckungsmasse haben, die nach gesetzlicher Vorschrift zu ihrem Schutz errichtet und staatlich überwacht ist."
    },
    {
      "date": "2025-12-17",
      "id": "140292",
      "original_text": "Registerbekanntmachung nach dem Umwandlungsgesetz\nNordrhein-Westfalen Amtsgericht Coesfeld HRA 5775\nLaborbau Systeme Hemling GmbH & Co. Kommanditgesellschaft – Ahaus",
      "type": "Registerbekanntmachung nach dem Umwandlungsgesetz",
      "state": "Nordrhein-Westfalen",
      "amtsgericht": "Amtsgericht Coesfeld",
      "registernummer": "HRA 5775",
      "registerart": "HRA",
      "company_name": "Laborbau Systeme Hemling GmbH & Co. Kommanditgesellschaft",
      "company_seat": "Ahaus",
      "details": "17.12.2025 (Bekanntmachungsdatum)\n\nNordrhein-Westfalen Amtsgericht Coesfeld HRA 5775\nRegisterbekanntmachung nach dem Umwandlungsgesetz 17.12.2025 (Eintragungsdatum)\n\nLaborbau Systeme Hemling GmbH & Co. Kommanditgesellschaft\nKommanditgesellschaft\nAhaus\n\nDen Gläubigern des an dem Formwechsel beteiligten Rechtsträgers ist, wenn sie binnen sechs Monaten nach dem Tag, an dem die Eintragung des Formwechsels in das Register des Sitzes derjenigen Rechtsträger deren Gläubiger sie sind, nach § 19 Absatz 3 UmwG als bekanntgemacht gilt, ihren Anspruch nach Grund und Höhe schriftlich anmelden, Sicherheit zu leisten, soweit sie nicht Befriedigung verlangen können. Dieses Recht steht den Gläubigern jedoch nur zu, wenn sie glaubhaft machen, dass durch den Formwechsel die Erfüllung ihrer Forderung gefährdet wird."
    },
    {
      "date": "2025-12-17",
      "id": "140293",
      "original_text": "Registerbekanntmachung nach dem Umwandlungsgesetz\nBaden-Württemberg Amtsgericht Stuttgart HRB 742562\nHWS Treuhand Verwaltungs-GmbH Wirtschaftsprüfungsgesellschaft Steuerberatungsgesellschaft – Stuttgart",
      "type": "Registerbekanntmachung nach dem Umwandlungsgesetz",
      "state": "Baden-Württemberg",
      "amtsgericht": "Amtsgericht Stuttgart",
      "registernummer": "HRB 742562",
      "registerart": "HRB",
      "company_name": "HWS Treuhand Verwaltungs-GmbH Wirtschaftsprüfungsgesellschaft Steuerberatungsgesellschaft",
      "company_seat": "Stuttgart",
      "details": "17.12.2025 (Bekanntmachungsdatum)\n\nBaden-Württemberg Amtsgericht Stuttgart HRB 742562\nRegisterbekanntmachung nach dem Umwandlungsgesetz 17.12.2025 (Eintragungsdatum)\n\nHWS Treuhand Verwaltungs-GmbH Wirtschaftsprüfungsgesellschaft Steuerberatungsgesellschaft\nGesellschaft mit beschränkter Haftung\nStuttgart\n\nAls nicht eingetragen wird bekanntgemacht:\nDen Gläubigern der an der Verschmelzung beteiligten Rechtsträger ist, wenn sie binnen sechs Monaten nach dem Tag, an dem die Eintragung der Verschmelzung in das Register des Sitzes desjenigen Rechtsträgers, dessen Gläubiger sie sind, nach § 19 Abs. 3 UmwG als bekanntgemacht gilt, ihren Anspruch nach Grund und Höhe schriftlich anmelden, Sicherheit zu leisten, soweit sie nicht Befriedigung verlangen können. Dieses Recht steht den Gläubigern jedoch nur zu, wenn sie glaubhaft machen, dass durch die Verschmelzung die Erfüllung ihrer Forderung gefährdet wird."
    },
    {
      "date": "2025-12-17",
      "id": "140294",
      "original_text": "Löschungsankündigung\nBaden-Württemberg Amtsgericht Mannheim HRB 714888\nVN Video Notion GmbH – Mannheim",
      "type": "Löschungsankündigung",
      "state": "Baden-Württemberg",
      "amtsgericht": "Amtsgericht Mannheim",
      "registernummer": "HRB 714888",
      "registerart": "HRB",
      "company_name": "VN Video Notion GmbH",
      "company_seat": "Mannheim",
      "details": "17.12.2025 (Bekanntmachungsdatum)\n\nBaden-Württemberg Amtsgericht Mannheim HRB 714888\nLöschungsankündigung\n\nVN Video Notion GmbH\nGesellschaft mit beschränkter Haftung\nMannheim\n\nDas Gericht beabsichtigt, die Gesellschaft wegen Vermögenslosigkeit im Handelsregister von Amts wegen nach § 394 FamFG zu löschen. Die Frist zur Geltendmachung eines Widerspruchs gegen die beabsichtigte Löschung ist auf einen Monat ab Veröffentlichung bestimmt."
    },
    {
      "date": "2025-12-17",
      "id": "140295",
      "original_text": "Einreichung neuer Dokumente\nSachsen Amtsgericht Dresden HRB 23641\nVerkehrsmuseum Dresden gGmbH – Dresden",
      "type": "Einreichung neuer Dokumente",
      "state": "Sachsen",
      "amtsgericht": "Amtsgericht Dresden",
      "registernummer": "HRB 23641",
      "registerart": "HRB",
      "company_name": "Verkehrsmuseum Dresden gGmbH",
      "company_seat": "Dresden",
      "details": "17.12.2025 (Bekanntmachungsdatum)\n\nSachsen Amtsgericht Dresden HRB 23641\nEinreichung neuer Dokumente\n\nVerkehrsmuseum Dresden gGmbH\nGesellschaft mit beschränkter Haftung\nDresden\n\nAm 16.12.2025 wurde beim Handelsregister des Amtsgerichts Dresden die Liste der Mitglieder des Aufsichtsrats gemäß § 52 GmbHG eingereicht."
    },
    {
      "date": "2025-12-17",
      "id": "140296",
      "original_text": "Löschungsankündigung\nSachsen Amtsgericht Chemnitz HRB 26289\nSMZ Stahl- und Metallbearbeitung Zwickau UG (haftungsbeschränkt) – Zwickau",
      "type": "Löschungsankündigung",
      "state": "Sachsen",
      "amtsgericht": "Amtsgericht Chemnitz",
      "registernummer": "HRB 26289",
      "registerart": "HRB",
      "company_name": "SMZ Stahl- und Metallbearbeitung Zwickau UG (haftungsbeschränkt)",
      "company_seat": "Zwickau",
      "details": "17.12.2025 (Bekanntmachungsdatum)\n\nSachsen Amtsgericht Chemnitz HRB 26289\nLöschungsankündigung\n\nSMZ Stahl- und Metallbearbeitung Zwickau UG (haftungsbeschränkt)\nGesellschaft mit beschränkter Haftung\nZwickau\n\nDas Registergericht beabsichtigt, die im Handelsregister eingetragene Gesellschaft von Amts wegen nach § 394 FamFG zu löschen. Die Frist zu Erhebung eines Widerspruchs gegen die beabsichtigte Löschung wird auf einen Monat festgesetzt."
    },
    {
      "date": "2025-12-17",
      "id": "140297",
      "original_text": "Einreichung neuer Dokumente\nSachsen Amtsgericht Leipzig HRB 7735\nHHL gemeinnützige GmbH – Leipzig",
      "type": "Einreichung neuer Dokumente",
      "state": "Sachsen",
      "amtsgericht": "Amtsgericht Leipzig",
      "registernummer": "HRB 7735",
      "registerart": "HRB",
      "company_name": "HHL gemeinnützige GmbH",
      "company_seat": "Leipzig",
      "details": "17.12.2025 (Bekanntmachungsdatum)\n\nSachsen Amtsgericht Leipzig HRB 7735\nEinreichung neuer Dokumente\n\nHHL gemeinnützige GmbH\nGesellschaft mit beschränkter Haftung\nLeipzig\n\nAm 01.12.2025 wurde beim Handelsregister des Amtsgerichts Leipzig die Liste der Mitglieder des Aufsichtsrats gemäß § 52 GmbHG eingereicht."
    },
    {
      "date": "2025-12-17",
      "id": "140298",
      "original_text": "Registerbekanntmachung nach dem Umwandlungsgesetz\nSachsen Amtsgericht Dresden HRB 19545\nFischbach Verwaltungs GmbH – Großenhain",
      "type": "Registerbekanntmachung nach dem Umwandlungsgesetz",
      "state": "Sachsen",
      "amtsgericht": "Amtsgericht Dresden",
      "registernummer": "HRB 19545",
      "registerart": "HRB",
      "company_name": "Fischbach Verwaltungs GmbH",
      "company_seat": "Großenhain",
      "details": "17.12.2025 (Bekanntmachungsdatum)\n\nSachsen Amtsgericht Dresden HRB 19545\nRegisterbekanntmachung nach dem Umwandlungsgesetz 17.12.2025 (Eintragungsdatum)\n\nFischbach Verwaltungs GmbH\nGesellschaft mit beschränkter Haftung\nGroßenhain\n\nDen Gläubigern der an der Verschmelzung beteiligten Rechtsträger ist, wenn sie binnen sechs Monaten nach dem Tag, an dem die Eintragung der Verschmelzung in das Register des Sitzes desjenigen Rechtsträgers, dessen Gläubiger sie sind, nach § 19 Abs. 3 UmwG als bekannt gemacht gilt, ihren Anspruch nach Grund und Höhe in Textform anmelden, Sicherheit zu leisten, soweit sie nicht Befriedigung verlangen können. Dieses Recht steht den Gläubigern jedoch nur zu, wenn sie glaubhaft machen, dass durch die Verschmelzung die Erfüllung der Forderung gefährdet wird."
    },
    {
      "date": "2025-12-17",
      "id": "140299",
      "original_text": "Registerbekanntmachung nach dem Umwandlungsgesetz\nSachsen Amtsgericht Chemnitz HRB 5964\nOst - West - Management GmbH – Wilkau-Haßlau",
      "type": "Registerbekanntmachung nach dem Umwandlungsgesetz",
      "state": "Sachsen",
      "amtsgericht": "Amtsgericht Chemnitz",
      "registernummer": "HRB 5964",
      "registerart": "HRB",
      "company_name": "Ost - West - Management GmbH",
      "company_seat": "Wilkau-Haßlau",
      "details": "17.12.2025 (Bekanntmachungsdatum)\n\nSachsen Amtsgericht Chemnitz HRB 5964\nRegisterbekanntmachung nach dem Umwandlungsgesetz 17.12.2025 (Eintragungsdatum)\n\nOst - West - Management GmbH\nGesellschaft mit beschränkter Haftung\nWilkau-Haßlau\n\nDen Gläubigern der an der Verschmelzung beteiligten Rechtsträger ist, wenn sie binnen sechs Monaten nach dem Tag, an dem die Eintragung der Verschmelzung in das Register des Sitzes desjenigen Rechtsträgers, dessen Gläubiger sie sind, nach § 19 Abs. 3 UmwG als bekannt gemacht gilt, ihren Anspruch nach Grund und Höhe in Textform anmelden, Sicherheit zu leisten, soweit sie nicht Befriedigung verlangen können. Dieses Recht steht den Gläubigern jedoch nur zu, wenn sie glaubhaft machen, dass durch die Verschmelzung die Erfüllung der Forderung gefährdet wird."
    },
    {
      "date": "2025-12-17",
      "id": "140300",
      "original_text": "Löschungsankündigung\nSachsen Amtsgericht Dresden HRA 8605\ncogado UG (haftungsbeschränkt) & Co. KG – Dresden",
      "type": "Löschungsankündigung",
      "state": "Sachsen",
      "amtsgericht": "Amtsgericht Dresden",
      "registernummer": "HRA 8605",
      "registerart": "HRA",
      "company_name": "cogado UG (haftungsbeschränkt) & Co. KG",
      "company_seat": "Dresden",
      "details": "17.12.2025 (Bekanntmachungsdatum)\n\nSachsen Amtsgericht Dresden HRA 8605\nLöschungsankündigung\n\ncogado UG (haftungsbeschränkt) & Co. KG\nKommanditgesellschaft\nDresden\n\nDas Registergericht beabsichtigt, die im Handelsregister eingetragene Firma von Amts wegen nach § 31 Abs. 2 HGB, 393 FamFG zu löschen. Die Frist zur Erhebung eines Widerspruchs gegen die beabsichtigte Löschung wird auf einen Monat festgesetzt."
    },
    {
      "date": "2025-12-17",
      "id": "140301",
      "original_text": "Registerbekanntmachung nach dem Umwandlungsgesetz\nSachsen Amtsgericht Dresden HRB 42792\nUKA IPP GmbH – Meißen",
      "type": "Registerbekanntmachung nach dem Umwandlungsgesetz",
      "state": "Sachsen",
      "amtsgericht": "Amtsgericht Dresden",
      "registernummer": "HRB 42792",
      "registerart": "HRB",
      "company_name": "UKA IPP GmbH",
      "company_seat": "Meißen",
      "details": "17.12.2025 (Bekanntmachungsdatum)\n\nSachsen Amtsgericht Dresden HRB 42792\nRegisterbekanntmachung nach dem Umwandlungsgesetz 17.12.2025 (Eintragungsdatum)\n\nUKA IPP GmbH\nGesellschaft mit beschränkter Haftung\nMeißen\n\nDen Gläubigern der an der Verschmelzung beteiligten Rechtsträger ist, wenn sie binnen sechs Monaten nach dem Tag, an dem die Eintragung der Verschmelzung in das Register des Sitzes desjenigen Rechtsträgers, dessen Gläubiger sie sind, nach § 19 Abs. 3 UmwG als bekannt gemacht gilt, ihren Anspruch nach Grund und Höhe in Textform anmelden, Sicherheit zu leisten, soweit sie nicht Befriedigung verlangen können. Dieses Recht steht den Gläubigern jedoch nur zu, wenn sie glaubhaft machen, dass durch die Verschmelzung die Erfüllung der Forderung gefährdet wird."
    },
    {
      "date": "2025-12-17",
      "id": "140302",
      "original_text": "Registerbekanntmachung nach dem Umwandlungsgesetz\nSachsen Amtsgericht Dresden HRB 45966\nWindpark Drosa Beteiligungs GmbH – Meißen",
      "type": "Registerbekanntmachung nach dem Umwandlungsgesetz",
      "state": "Sachsen",
      "amtsgericht": "Amtsgericht Dresden",
      "registernummer": "HRB 45966",
      "registerart": "HRB",
      "company_name": "Windpark Drosa Beteiligungs GmbH",
      "company_seat": "Meißen",
      "details": "17.12.2025 (Bekanntmachungsdatum)\n\nSachsen Amtsgericht Dresden HRB 45966\nRegisterbekanntmachung nach dem Umwandlungsgesetz 17.12.2025 (Eintragungsdatum)\n\nWindpark Drosa Beteiligungs GmbH\nGesellschaft mit beschränkter Haftung\nMeißen\n\nDen Gläubigern der an der Verschmelzung beteiligten Rechtsträger ist, wenn sie binnen sechs Monaten nach dem Tag, an dem die Eintragung der Verschmelzung in das Register des Sitzes desjenigen Rechtsträgers, dessen Gläubiger sie sind, nach § 19 Abs. 3 UmwG als bekannt gemacht gilt, ihren Anspruch nach Grund und Höhe in Textform anmelden, Sicherheit zu leisten, soweit sie nicht Befriedigung verlangen können. Dieses Recht steht den Gläubigern jedoch nur zu, wenn sie glaubhaft machen, dass durch die Verschmelzung die Erfüllung der Forderung gefährdet wird."
    },
    {
      "date": "2025-12-17",
      "id": "140303",
      "original_text": "Registerbekanntmachung nach dem Umwandlungsgesetz\nSachsen Amtsgericht Dresden HRB 42792\nUKA IPP GmbH – Meißen",
      "type": "Registerbekanntmachung nach dem Umwandlungsgesetz",
      "state": "Sachsen",
      "amtsgericht": "Amtsgericht Dresden",
      "registernummer": "HRB 42792",
      "registerart": "HRB",
      "company_name": "UKA IPP GmbH",
      "company_seat": "Meißen",
      "details": "17.12.2025 (Bekanntmachungsdatum)\n\nSachsen Amtsgericht Dresden HRB 42792\nRegisterbekanntmachung nach dem Umwandlungsgesetz 17.12.2025 (Eintragungsdatum)\n\nUKA IPP GmbH\nGesellschaft mit beschränkter Haftung\nMeißen\n\nDen Gläubigern der an der Verschmelzung beteiligten Rechtsträger ist, wenn sie binnen sechs Monaten nach dem Tag, an dem die Eintragung der Verschmelzung in das Register des Sitzes desjenigen Rechtsträgers, dessen Gläubiger sie sind, nach § 19 Abs. 3 UmwG als bekannt gemacht gilt, ihren Anspruch nach Grund und Höhe in Textform anmelden, Sicherheit zu leisten, soweit sie nicht Befriedigung verlangen können. Dieses Recht steht den Gläubigern jedoch nur zu, wenn sie glaubhaft machen, dass durch die Verschmelzung die Erfüllung der Forderung gefährdet wird."
    },
    {
      "date": "2025-12-17",
      "id": "140304",
      "original_text": "Einreichung neuer Dokumente\nSachsen Amtsgericht Chemnitz HRB 2373\nwohnen in chemnitz gmbh – Chemnitz",
      "type": "Einreichung neuer Dokumente",
      "state": "Sachsen",
      "amtsgericht": "Amtsgericht Chemnitz",
      "registernummer": "HRB 2373",
      "registerart": "HRB",
      "company_name": "wohnen in chemnitz gmbh",
      "company_seat": "Chemnitz",
      "details": "17.12.2025 (Bekanntmachungsdatum)\n\nSachsen Amtsgericht Chemnitz HRB 2373\nEinreichung neuer Dokumente\n\nwohnen in chemnitz gmbh\nGesellschaft mit beschränkter Haftung\nChemnitz\n\nAm  15.12.2025 wurde beim Handelsregister des Amtsgerichts Chemnitz die Liste der Mitglieder des Aufsichtsrats gemäß § 52 GmbHG eingereicht."
    },
    {
      "date": "2025-12-17",
      "id": "140305",
      "original_text": "Registerbekanntmachung nach dem Umwandlungsgesetz\nSachsen Amtsgericht Dresden HRB 41218\nUKA Windenergie Portfolio 46 GmbH – Meißen",
      "type": "Registerbekanntmachung nach dem Umwandlungsgesetz",
      "state": "Sachsen",
      "amtsgericht": "Amtsgericht Dresden",
      "registernummer": "HRB 41218",
      "registerart": "HRB",
      "company_name": "UKA Windenergie Portfolio 46 GmbH",
      "company_seat": "Meißen",
      "details": "17.12.2025 (Bekanntmachungsdatum)\n\nSachsen Amtsgericht Dresden HRB 41218\nRegisterbekanntmachung nach dem Umwandlungsgesetz 17.12.2025 (Eintragungsdatum)\n\nUKA Windenergie Portfolio 46 GmbH\nGesellschaft mit beschränkter Haftung\nMeißen\n\nDen Gläubigern der an der Verschmelzung beteiligten Rechtsträger ist, wenn sie binnen sechs Monaten nach dem Tag, an dem die Eintragung der Verschmelzung in das Register des Sitzes desjenigen Rechtsträgers, dessen Gläubiger sie sind, nach § 19 Abs. 3 UmwG als bekannt gemacht gilt, ihren Anspruch nach Grund und Höhe in Textform anmelden, Sicherheit zu leisten, soweit sie nicht Befriedigung verlangen können. Dieses Recht steht den Gläubigern jedoch nur zu, wenn sie glaubhaft machen, dass durch die Verschmelzung die Erfüllung der Forderung gefährdet wird."
    },
    {
      "date": "2025-12-17",
      "id": "140306",
      "original_text": "Registerbekanntmachung nach dem Umwandlungsgesetz\nSachsen Amtsgericht Chemnitz HRB 31176\nS.L.P. Vertriebsservice AG Gesellschaft für Versicherungsvermittlung, Marketing und Vertriebslogistik – Chemnitz",
      "type": "Registerbekanntmachung nach dem Umwandlungsgesetz",
      "state": "Sachsen",
      "amtsgericht": "Amtsgericht Chemnitz",
      "registernummer": "HRB 31176",
      "registerart": "HRB",
      "company_name": "S.L.P. Vertriebsservice AG Gesellschaft für Versicherungsvermittlung, Marketing und Vertriebslogistik",
      "company_seat": "Chemnitz",
      "details": "17.12.2025 (Bekanntmachungsdatum)\n\nSachsen Amtsgericht Chemnitz HRB 31176\nRegisterbekanntmachung nach dem Umwandlungsgesetz 17.12.2025 (Eintragungsdatum)\n\nS.L.P. Vertriebsservice AG Gesellschaft für Versicherungsvermittlung, Marketing und Vertriebslogistik\nAktiengesellschaft\nChemnitz\n\nDen Gläubigern der an der Spaltung beteiligten Rechtsträger ist, wenn sie binnen sechs Monaten nach dem Tag, an dem die Eintragung der Spaltung in das Register des Sitzes desjenigen Rechtsträgers, dessen Gläubiger sie sind, nach § 19 Abs. 3 UmwG als bekannt gemacht gilt, ihren Anspruch nach Grund und Höhe in Textform anmelden, Sicherheit zu leisten, soweit sie nicht Befriedigung verlangen können. Dieses Recht steht den Gläubigern jedoch nur zu, wenn sie glaubhaft machen, dass durch die Spaltung die Erfüllung der Forderung gefährdet wird."
    },
    {
      "date": "2025-12-17",
      "id": "140307",
      "original_text": "Registerbekanntmachung nach dem Umwandlungsgesetz\nSachsen Amtsgericht Dresden HRB 41220\nUKA Windenergie Portfolio 37 GmbH – Meißen",
      "type": "Registerbekanntmachung nach dem Umwandlungsgesetz",
      "state": "Sachsen",
      "amtsgericht": "Amtsgericht Dresden",
      "registernummer": "HRB 41220",
      "registerart": "HRB",
      "company_name": "UKA Windenergie Portfolio 37 GmbH",
      "company_seat": "Meißen",
      "details": "17.12.2025 (Bekanntmachungsdatum)\n\nSachsen Amtsgericht Dresden HRB 41220\nRegisterbekanntmachung nach dem Umwandlungsgesetz 17.12.2025 (Eintragungsdatum)\n\nUKA Windenergie Portfolio 37 GmbH\nGesellschaft mit beschränkter Haftung\nMeißen\n\nDen Gläubigern der an der Verschmelzung beteiligten Rechtsträger ist, wenn sie binnen sechs Monaten nach dem Tag, an dem die Eintragung der Verschmelzung in das Register des Sitzes desjenigen Rechtsträgers, dessen Gläubiger sie sind, nach § 19 Abs. 3 UmwG als bekannt gemacht gilt, ihren Anspruch nach Grund und Höhe in Textform anmelden, Sicherheit zu leisten, soweit sie nicht Befriedigung verlangen können. Dieses Recht steht den Gläubigern jedoch nur zu, wenn sie glaubhaft machen, dass durch die Verschmelzung die Erfüllung der Forderung gefährdet wird."
    },
    {
      "date": "2025-12-17",
      "id": "140308",
      "original_text": "Registerbekanntmachung nach dem Umwandlungsgesetz\nSachsen Amtsgericht Chemnitz HRB 35166\nVhite Rabbit XR UG (haftungsbeschränkt) – Chemnitz",
      "type": "Registerbekanntmachung nach dem Umwandlungsgesetz",
      "state": "Sachsen",
      "amtsgericht": "Amtsgericht Chemnitz",
      "registernummer": "HRB 35166",
      "registerart": "HRB",
      "company_name": "Vhite Rabbit XR UG (haftungsbeschränkt)",
      "company_seat": "Chemnitz",
      "details": "17.12.2025 (Bekanntmachungsdatum)\n\nSachsen Amtsgericht Chemnitz HRB 35166\nRegisterbekanntmachung nach dem Umwandlungsgesetz 17.12.2025 (Eintragungsdatum)\n\nVhite Rabbit XR UG (haftungsbeschränkt)\nGesellschaft mit beschränkter Haftung\nChemnitz\n\nDen Gläubigern der an der Verschmelzung beteiligten Rechtsträger ist, wenn sie binnen sechs Monaten nach dem Tag, an dem die Eintragung der Verschmelzung in das Register des Sitzes desjenigen Rechtsträgers, dessen Gläubiger sie sind, nach § 19 Abs. 3 UmwG als bekannt gemacht gilt, ihren Anspruch nach Grund und Höhe in Textform anmelden, Sicherheit zu leisten, soweit sie nicht Befriedigung verlangen können. Dieses Recht steht den Gläubigern jedoch nur zu, wenn sie glaubhaft machen, dass durch die Verschmelzung die Erfüllung der Forderung gefährdet wird."
    },
    {
      "date": "2025-12-17",
      "id": "140309",
      "original_text": "Registerbekanntmachung nach dem Umwandlungsgesetz\nSachsen Amtsgericht Dresden HRB 42792\nUKA IPP GmbH – Meißen",
      "type": "Registerbekanntmachung nach dem Umwandlungsgesetz",
      "state": "Sachsen",
      "amtsgericht": "Amtsgericht Dresden",
      "registernummer": "HRB 42792",
      "registerart": "HRB",
      "company_name": "UKA IPP GmbH",
      "company_seat": "Meißen",
      "details": "17.12.2025 (Bekanntmachungsdatum)\n\nSachsen Amtsgericht Dresden HRB 42792\nRegisterbekanntmachung nach dem Umwandlungsgesetz 17.12.2025 (Eintragungsdatum)\n\nUKA IPP GmbH\nGesellschaft mit beschränkter Haftung\nMeißen\n\nDen Gläubigern der an der Verschmelzung beteiligten Rechtsträger ist, wenn sie binnen sechs Monaten nach dem Tag, an dem die Eintragung der Verschmelzung in das Register des Sitzes desjenigen Rechtsträgers, dessen Gläubiger sie sind, nach § 19 Abs. 3 UmwG als bekannt gemacht gilt, ihren Anspruch nach Grund und Höhe in Textform anmelden, Sicherheit zu leisten, soweit sie nicht Befriedigung verlangen können. Dieses Recht steht den Gläubigern jedoch nur zu, wenn sie glaubhaft machen, dass durch die Verschmelzung die Erfüllung der Forderung gefährdet wird."
    },
    {
      "date": "2025-12-17",
      "id": "140310",
      "original_text": "Registerbekanntmachung nach dem Umwandlungsgesetz\nSachsen Amtsgericht Dresden HRB 42792\nUKA IPP GmbH – Meißen",
      "type": "Registerbekanntmachung nach dem Umwandlungsgesetz",
      "state": "Sachsen",
      "amtsgericht": "Amtsgericht Dresden",
      "registernummer": "HRB 42792",
      "registerart": "HRB",
      "company_name": "UKA IPP GmbH",
      "company_seat": "Meißen",
      "details": "17.12.2025 (Bekanntmachungsdatum)\n\nSachsen Amtsgericht Dresden HRB 42792\nRegisterbekanntmachung nach dem Umwandlungsgesetz 17.12.2025 (Eintragungsdatum)\n\nUKA IPP GmbH\nGesellschaft mit beschränkter Haftung\nMeißen\n\nDen Gläubigern der an der Verschmelzung beteiligten Rechtsträger ist, wenn sie binnen sechs Monaten nach dem Tag, an dem die Eintragung der Verschmelzung in das Register des Sitzes desjenigen Rechtsträgers, dessen Gläubiger sie sind, nach § 19 Abs. 3 UmwG als bekannt gemacht gilt, ihren Anspruch nach Grund und Höhe in Textform anmelden, Sicherheit zu leisten, soweit sie nicht Befriedigung verlangen können. Dieses Recht steht den Gläubigern jedoch nur zu, wenn sie glaubhaft machen, dass durch die Verschmelzung die Erfüllung der Forderung gefährdet wird."
    },
    {
      "date": "2025-12-17",
      "id": "140311",
      "original_text": "Registerbekanntmachung nach dem Umwandlungsgesetz\nSachsen Amtsgericht Chemnitz HRB 37933\nSLP Vertriebsservice GmbH – Chemnitz",
      "type": "Registerbekanntmachung nach dem Umwandlungsgesetz",
      "state": "Sachsen",
      "amtsgericht": "Amtsgericht Chemnitz",
      "registernummer": "HRB 37933",
      "registerart": "HRB",
      "company_name": "SLP Vertriebsservice GmbH",
      "company_seat": "Chemnitz",
      "details": "17.12.2025 (Bekanntmachungsdatum)\n\nSachsen Amtsgericht Chemnitz HRB 37933\nRegisterbekanntmachung nach dem Umwandlungsgesetz 17.12.2025 (Eintragungsdatum)\n\nSLP Vertriebsservice GmbH\nGesellschaft mit beschränkter Haftung\nChemnitz\n\nDen Gläubigern der an der Ausgliederung beteiligten Rechtsträger ist, wenn sie binnen sechs Monaten nach dem Tag, an dem die Eintragung der Ausgliederung in das Register des Sitzes desjenigen Rechtsträgers, dessen Gläubiger sie sind, nach § 19 Abs. 3 UmwG als bekannt gemacht gilt, ihren Anspruch nach Grund und Höhe in Textform anmelden, Sicherheit zu leisten, soweit sie nicht Befriedigung verlangen können. Dieses Recht steht den Gläubigern jedoch nur zu, wenn sie glaubhaft machen, dass durch die Ausgliederung die Erfüllung der Forderung gefährdet wird."
    },
    {
      "date": "2025-12-17",
      "id": "140312",
      "original_text": "Registerbekanntmachung nach dem Umwandlungsgesetz\nSachsen Amtsgericht Dresden HRB 38053\nUKA Windenergie Portfolio 4 GmbH – Meißen",
      "type": "Registerbekanntmachung nach dem Umwandlungsgesetz",
      "state": "Sachsen",
      "amtsgericht": "Amtsgericht Dresden",
      "registernummer": "HRB 38053",
      "registerart": "HRB",
      "company_name": "UKA Windenergie Portfolio 4 GmbH",
      "company_seat": "Meißen",
      "details": "17.12.2025 (Bekanntmachungsdatum)\n\nSachsen Amtsgericht Dresden HRB 38053\nRegisterbekanntmachung nach dem Umwandlungsgesetz 17.12.2025 (Eintragungsdatum)\n\nUKA Windenergie Portfolio 4 GmbH\nGesellschaft mit beschränkter Haftung\nMeißen\n\nDen Gläubigern der an der Verschmelzung beteiligten Rechtsträger ist, wenn sie binnen sechs Monaten nach dem Tag, an dem die Eintragung der Verschmelzung in das Register des Sitzes desjenigen Rechtsträgers, dessen Gläubiger sie sind, nach § 19 Abs. 3 UmwG als bekannt gemacht gilt, ihren Anspruch nach Grund und Höhe in Textform anmelden, Sicherheit zu leisten, soweit sie nicht Befriedigung verlangen können. Dieses Recht steht den Gläubigern jedoch nur zu, wenn sie glaubhaft machen, dass durch die Verschmelzung die Erfüllung der Forderung gefährdet wird."
    },
    {
      "date": "2025-12-17",
      "id": "140313",
      "original_text": "Registerbekanntmachung nach dem Umwandlungsgesetz\nSachsen Amtsgericht Dresden HRB 42792\nUKA IPP GmbH – Meißen",
      "type": "Registerbekanntmachung nach dem Umwandlungsgesetz",
      "state": "Sachsen",
      "amtsgericht": "Amtsgericht Dresden",
      "registernummer": "HRB 42792",
      "registerart": "HRB",
      "company_name": "UKA IPP GmbH",
      "company_seat": "Meißen",
      "details": "17.12.2025 (Bekanntmachungsdatum)\n\nSachsen Amtsgericht Dresden HRB 42792\nRegisterbekanntmachung nach dem Umwandlungsgesetz 17.12.2025 (Eintragungsdatum)\n\nUKA IPP GmbH\nGesellschaft mit beschränkter Haftung\nMeißen\n\nDen Gläubigern der an der Verschmelzung beteiligten Rechtsträger ist, wenn sie binnen sechs Monaten nach dem Tag, an dem die Eintragung der Verschmelzung in das Register des Sitzes desjenigen Rechtsträgers, dessen Gläubiger sie sind, nach § 19 Abs. 3 UmwG als bekannt gemacht gilt, ihren Anspruch nach Grund und Höhe in Textform anmelden, Sicherheit zu leisten, soweit sie nicht Befriedigung verlangen können. Dieses Recht steht den Gläubigern jedoch nur zu, wenn sie glaubhaft machen, dass durch die Verschmelzung die Erfüllung der Forderung gefährdet wird."
    },
    {
      "date": "2025-12-17",
      "id": "140314",
      "original_text": "Registerbekanntmachung nach dem Umwandlungsgesetz\nSachsen Amtsgericht Dresden HRB 38033\nUKA Windenergie Portfolio 10 GmbH – Meißen",
      "type": "Registerbekanntmachung nach dem Umwandlungsgesetz",
      "state": "Sachsen",
      "amtsgericht": "Amtsgericht Dresden",
      "registernummer": "HRB 38033",
      "registerart": "HRB",
      "company_name": "UKA Windenergie Portfolio 10 GmbH",
      "company_seat": "Meißen",
      "details": "17.12.2025 (Bekanntmachungsdatum)\n\nSachsen Amtsgericht Dresden HRB 38033\nRegisterbekanntmachung nach dem Umwandlungsgesetz 17.12.2025 (Eintragungsdatum)\n\nUKA Windenergie Portfolio 10 GmbH\nGesellschaft mit beschränkter Haftung\nMeißen\n\nDen Gläubigern der an der Verschmelzung beteiligten Rechtsträger ist, wenn sie binnen sechs Monaten nach dem Tag, an dem die Eintragung der Verschmelzung in das Register des Sitzes desjenigen Rechtsträgers, dessen Gläubiger sie sind, nach § 19 Abs. 3 UmwG als bekannt gemacht gilt, ihren Anspruch nach Grund und Höhe in Textform anmelden, Sicherheit zu leisten, soweit sie nicht Befriedigung verlangen können. Dieses Recht steht den Gläubigern jedoch nur zu, wenn sie glaubhaft machen, dass durch die Verschmelzung die Erfüllung der Forderung gefährdet wird."
    },
    {
      "date": "2025-12-17",
      "id": "140315",
      "original_text": "Registerbekanntmachung nach dem Umwandlungsgesetz\nSachsen Amtsgericht Dresden HRB 42792\nUKA IPP GmbH – Meißen",
      "type": "Registerbekanntmachung nach dem Umwandlungsgesetz",
      "state": "Sachsen",
      "amtsgericht": "Amtsgericht Dresden",
      "registernummer": "HRB 42792",
      "registerart": "HRB",
      "company_name": "UKA IPP GmbH",
      "company_seat": "Meißen",
      "details": "17.12.2025 (Bekanntmachungsdatum)\n\nSachsen Amtsgericht Dresden HRB 42792\nRegisterbekanntmachung nach dem Umwandlungsgesetz 17.12.2025 (Eintragungsdatum)\n\nUKA IPP GmbH\nGesellschaft mit beschränkter Haftung\nMeißen\n\nDen Gläubigern der an der Verschmelzung beteiligten Rechtsträger ist, wenn sie binnen sechs Monaten nach dem Tag, an dem die Eintragung der Verschmelzung in das Register des Sitzes desjenigen Rechtsträgers, dessen Gläubiger sie sind, nach § 19 Abs. 3 UmwG als bekannt gemacht gilt, ihren Anspruch nach Grund und Höhe in Textform anmelden, Sicherheit zu leisten, soweit sie nicht Befriedigung verlangen können. Dieses Recht steht den Gläubigern jedoch nur zu, wenn sie glaubhaft machen, dass durch die Verschmelzung die Erfüllung der Forderung gefährdet wird."
    },
    {
      "date": "2025-12-17",
      "id": "140316",
      "original_text": "Löschungsankündigung\nSachsen Amtsgericht Dresden HRB 42035\nsignseeing GmbH – Dresden",
      "type": "Löschungsankündigung",
      "state": "Sachsen",
      "amtsgericht": "Amtsgericht Dresden",
      "registernummer": "HRB 42035",
      "registerart": "HRB",
      "company_name": "signseeing GmbH",
      "company_seat": "Dresden",
      "details": "17.12.2025 (Bekanntmachungsdatum)\n\nSachsen Amtsgericht Dresden HRB 42035\nLöschungsankündigung\n\nsignseeing GmbH\nGesellschaft mit beschränkter Haftung\nDresden\n\nDas Registergericht beabsichtigt, die im Handelsregister eingetragene Gesellschaft von Amts wegen nach § 394 FamFG zu löschen. Die Frist zu Erhebung eines Widerspruchs gegen die beabsichtigte Löschung wird auf einen Monat festgesetzt."
    },
    {
      "date": "2025-12-17",
      "id": "140317",
      "original_text": "Löschungsankündigung\nSachsen Amtsgericht Dresden HRB 39988\nMarin Bau GmbH – Ottendorf-Okrilla",
      "type": "Löschungsankündigung",
      "state": "Sachsen",
      "amtsgericht": "Amtsgericht Dresden",
      "registernummer": "HRB 39988",
      "registerart": "HRB",
      "company_name": "Marin Bau GmbH",
      "company_seat": "Ottendorf-Okrilla",
      "details": "17.12.2025 (Bekanntmachungsdatum)\n\nSachsen Amtsgericht Dresden HRB 39988\nLöschungsankündigung\n\nMarin Bau GmbH\nGesellschaft mit beschränkter Haftung\nOttendorf-Okrilla\n\nDas Registergericht beabsichtigt, die im Handelsregister eingetragene Gesellschaft von Amts wegen nach § 394 FamFG zu löschen. Die Frist zu Erhebung eines Widerspruchs gegen die beabsichtigte Löschung wird auf einen Monat festgesetzt."
    },
    {
      "date": "2025-12-17",
      "id": "140318",
      "original_text": "Registerbekanntmachung nach dem Umwandlungsgesetz\nSachsen Amtsgericht Dresden HRB 41143\nUKA Windenergie Portfolio 44 GmbH – Meißen",
      "type": "Registerbekanntmachung nach dem Umwandlungsgesetz",
      "state": "Sachsen",
      "amtsgericht": "Amtsgericht Dresden",
      "registernummer": "HRB 41143",
      "registerart": "HRB",
      "company_name": "UKA Windenergie Portfolio 44 GmbH",
      "company_seat": "Meißen",
      "details": "17.12.2025 (Bekanntmachungsdatum)\n\nSachsen Amtsgericht Dresden HRB 41143\nRegisterbekanntmachung nach dem Umwandlungsgesetz 17.12.2025 (Eintragungsdatum)\n\nUKA Windenergie Portfolio 44 GmbH\nGesellschaft mit beschränkter Haftung\nMeißen\n\nDen Gläubigern der an der Verschmelzung beteiligten Rechtsträger ist, wenn sie binnen sechs Monaten nach dem Tag, an dem die Eintragung der Verschmelzung in das Register des Sitzes desjenigen Rechtsträgers, dessen Gläubiger sie sind, nach § 19 Abs. 3 UmwG als bekannt gemacht gilt, ihren Anspruch nach Grund und Höhe in Textform anmelden, Sicherheit zu leisten, soweit sie nicht Befriedigung verlangen können. Dieses Recht steht den Gläubigern jedoch nur zu, wenn sie glaubhaft machen, dass durch die Verschmelzung die Erfüllung der Forderung gefährdet wird."
    },
    {
      "date": "2025-12-17",
      "id": "140319",
      "original_text": "Löschungsankündigung\nNiedersachsen Amtsgericht Lüneburg HRB 206163\nIPron UG (haftungsbeschränkt) – Tripkau",
      "type": "Löschungsankündigung",
      "state": "Niedersachsen",
      "amtsgericht": "Amtsgericht Lüneburg",
      "registernummer": "HRB 206163",
      "registerart": "HRB",
      "company_name": "IPron UG (haftungsbeschränkt)",
      "company_seat": "Tripkau",
      "details": "17.12.2025 (Bekanntmachungsdatum)\n\nNiedersachsen Amtsgericht Lüneburg HRB 206163\nLöschungsankündigung\n\nIPron UG (haftungsbeschränkt)\nGesellschaft mit beschränkter Haftung\nTripkau\n\nDas Registergericht beabsichtigt, die Gesellschaft von Amts wegen nach § 394 FamFG zu löschen. Die Frist zur Erhebung eines Widerspruchs ist auf 1 Monat ab dieser Registerbekanntmachung festgesetzt."
    },
    {
      "date": "2025-12-17",
      "id": "140320",
      "original_text": "Löschungsankündigung\nNiedersachsen Amtsgericht Aurich HRA 111481 früher Amtsgericht Leer (Ostfriesland) (Leer)\nAtlas Trampship Reederei GmbH & Co. MS \"HUSUM\" KG – Leer",
      "type": "Löschungsankündigung",
      "state": "Niedersachsen",
      "amtsgericht": "Amtsgericht Aurich",
      "registernummer": "HRA 111481",
      "registerart": "HRA",
      "company_name": "Atlas Trampship Reederei GmbH & Co. MS \"HUSUM\" KG",
      "company_seat": "Leer",
      "former_amtsgericht": "Leer (Ostfriesland) (Leer)",
      "details": "17.12.2025 (Bekanntmachungsdatum)\n\nNiedersachsen Amtsgericht Aurich HRA 111481 früher Amtsgericht Leer (Ostfriesland) (Leer)\nLöschungsankündigung 17.12.2025 (Eintragungsdatum)\n\nAtlas Trampship Reederei GmbH & Co. MS \"HUSUM\" KG\nKommanditgesellschaft\nLeer\n\nDas Registergericht beabsichtigt, die Firma von Amts wegen nach § 394 FamFG zu löschen. Die Frist zur Erhebung eines Widerspruchs ist auf 3 Monate ab dieser Registerbekanntmachung festgesetzt."
    },
    {
      "date": "2025-12-17",
      "id": "140321",
      "original_text": "Registerbekanntmachung nach dem Umwandlungsgesetz\nNiedersachsen Amtsgericht Osnabrück VR 200375\nKatholische Erwachsenenbildung im Dekanat Twistringen e.V. – Osnabrück",
      "type": "Registerbekanntmachung nach dem Umwandlungsgesetz",
      "state": "Niedersachsen",
      "amtsgericht": "Amtsgericht Osnabrück",
      "registernummer": "VR 200375",
      "registerart": "VR",
      "company_name": "Katholische Erwachsenenbildung im Dekanat Twistringen e.V.",
      "company_seat": "Osnabrück",
      "details": "17.12.2025 (Bekanntmachungsdatum)\n\nNiedersachsen Amtsgericht Osnabrück VR 200375\nRegisterbekanntmachung nach dem Umwandlungsgesetz 17.12.2025 (Eintragungsdatum)\n\nKatholische Erwachsenenbildung im Dekanat Twistringen e.V.\neingetragener Verein\nOsnabrück\n\nDen Gläubigern der an der Verschmelzung beteiligten Rechtsträger ist, wenn sie binnen sechs Monaten nach dem Tag, an dem die Eintragung der Verschmelzung in das Register des Sitzes desjenigen Rechtsträgers, dessen Gläubiger sie sind, nach § 19  Abs.  3 UmwG als bekannt gemacht gilt, ihren Anspruch nach Grund und Höhe schriftlich anmelden, Sicherheit zu leisten, soweit sie nicht Befriedigung verlangen können. Dieses Recht steht den Gläubigern jedoch nur zu, wenn sie glaubhaft machen, dass durch die Verschmelzung die Erfüllung der Forderung gefährdet wird."
    },
    {
      "date": "2025-12-17",
      "id": "140322",
      "original_text": "Löschungsankündigung\nNiedersachsen Amtsgericht Braunschweig HRB 4206\nTIABB Handelsgesellschaft mbH – Braunschweig",
      "type": "Löschungsankündigung",
      "state": "Niedersachsen",
      "amtsgericht": "Amtsgericht Braunschweig",
      "registernummer": "HRB 4206",
      "registerart": "HRB",
      "company_name": "TIABB Handelsgesellschaft mbH",
      "company_seat": "Braunschweig",
      "details": "17.12.2025 (Bekanntmachungsdatum)\n\nNiedersachsen Amtsgericht Braunschweig HRB 4206\nLöschungsankündigung 17.12.2025 (Eintragungsdatum)\n\nTIABB Handelsgesellschaft mbH\nGesellschaft mit beschränkter Haftung\nBraunschweig\n\nDas Registergericht beabsichtigt, die Gesellschaft von Amts wegen nach § 394 FamFG zu löschen. Die Frist zur Erhebung eines Widerspruchs ist auf 1 Monat ab dieser Registerbekanntmachung festgesetzt."
    },
    {
      "date": "2025-12-17",
      "id": "140323",
      "original_text": "Löschungsankündigung\nNiedersachsen Amtsgericht Lüneburg HRB 110014 früher Amtsgericht Winsen\nFurnierwerk Winsen GmbH – Winsen/Luhe",
      "type": "Löschungsankündigung",
      "state": "Niedersachsen",
      "amtsgericht": "Amtsgericht Lüneburg",
      "registernummer": "HRB 110014",
      "registerart": "HRB",
      "company_name": "Furnierwerk Winsen GmbH",
      "company_seat": "Winsen/Luhe",
      "former_amtsgericht": "Winsen",
      "details": "17.12.2025 (Bekanntmachungsdatum)\n\nNiedersachsen Amtsgericht Lüneburg HRB 110014 früher Amtsgericht Winsen\nLöschungsankündigung\n\nFurnierwerk Winsen GmbH\nGesellschaft mit beschränkter Haftung\nWinsen/Luhe\n\nDas Registergericht beabsichtigt, die Gesellschaft von Amts wegen nach § 394 FamFG zu löschen. Die Frist zur Erhebung eines Widerspruchs ist auf 1 Monat ab dieser Registerbekanntmachung festgesetzt."
    },
    {
      "date": "2025-12-17",
      "id": "140324",
      "original_text": "Sonstige Registerbekanntmachung\nNiedersachsen Amtsgericht Hannover HRB 213895\nGFEI Aktiengesellschaft – Hannover",
      "type": "Sonstige Registerbekanntmachung",
      "state": "Niedersachsen",
      "amtsgericht": "Amtsgericht Hannover",
      "registernummer": "HRB 213895",
      "registerart": "HRB",
      "company_name": "GFEI Aktiengesellschaft",
      "company_seat": "Hannover",
      "details": "17.12.2025 (Bekanntmachungsdatum)\n\nNiedersachsen Amtsgericht Hannover HRB 213895\nSonstige Registerbekanntmachung\n\nGFEI Aktiengesellschaft\nAktiengesellschaft\nHannover\n\nDie Liste der Mitglieder des Aufsichtsrats wurde beim Registergericht eingereicht."
    },
    {
      "date": "2025-12-17",
      "id": "140325",
      "original_text": "Registerbekanntmachung nach dem Umwandlungsgesetz\nRheinland-Pfalz Amtsgericht Koblenz HRB 27463\nFOX Projektbau GmbH – Koblenz",
      "type": "Registerbekanntmachung nach dem Umwandlungsgesetz",
      "state": "Rheinland-Pfalz",
      "amtsgericht": "Amtsgericht Koblenz",
      "registernummer": "HRB 27463",
      "registerart": "HRB",
      "company_name": "FOX Projektbau GmbH",
      "company_seat": "Koblenz",
      "details": "17.12.2025 (Bekanntmachungsdatum)\n\nRheinland-Pfalz Amtsgericht Koblenz HRB 27463\nRegisterbekanntmachung nach dem Umwandlungsgesetz 17.12.2025 (Eintragungsdatum)\n\nFOX Projektbau GmbH\nGesellschaft mit beschränkter Haftung\nKoblenz\n\nAls nicht eingetragen wird veröffentlicht: Den Gläubigern der an der Verschmelzung beteiligten Rechtsträger ist, wenn sie binnen sechs Monaten nach dem Tag, an dem die Eintragung der Verschmelzung in das Register des Sitzes desjenigen Rechtsträgers,dessen Gläubiger sie sind, nach § 19 Abs. 3 UmwG als bekannt gemacht gilt, ihren Anspruch nach Grund und Höhe schriftlich anmelden, Sicherheit zu leisten, soweit sie nicht Befriedigung verlangen können. Dieses Recht steht den Gläubigern jedoch nur zu, wenn sie glaubhaft machen, dass durch die Verschmelzung die Erfüllungd er Forderung gefährdet wird."
    },
    {
      "date": "2025-12-17",
      "id": "140326",
      "original_text": "Registerbekanntmachung nach dem Umwandlungsgesetz\nRheinland-Pfalz Amtsgericht Koblenz HRB 26142\nAnanya Machandaeng Traditionelle Thaimassage Spa & Wellness GmbH – Remagen",
      "type": "Registerbekanntmachung nach dem Umwandlungsgesetz",
      "state": "Rheinland-Pfalz",
      "amtsgericht": "Amtsgericht Koblenz",
      "registernummer": "HRB 26142",
      "registerart": "HRB",
      "company_name": "Ananya Machandaeng Traditionelle Thaimassage Spa & Wellness GmbH",
      "company_seat": "Remagen",
      "details": "17.12.2025 (Bekanntmachungsdatum)\n\nRheinland-Pfalz Amtsgericht Koblenz HRB 26142\nRegisterbekanntmachung nach dem Umwandlungsgesetz 17.12.2025 (Eintragungsdatum)\n\nAnanya Machandaeng Traditionelle Thaimassage Spa & Wellness GmbH\nGesellschaft mit beschränkter Haftung\nRemagen\n\nAls nicht eingetragen wird veröffentlicht: Den Gläubigern der an der Umwandlung beteiligten Rechtsträger ist, wenn sie binnen sechs Monaten nach dem Tag, an dem die Eintragung der Umwandlung in das Register des Sitzes desjenigen Rechtsträgers, dessen Gläubiger sie sind, nach § 19 Abs. 3 UmwG als bekannt gemacht gilt, ihren Anspruch nach Grund und Höhe schriftlich anmelden, Sicherheit zu leisten, soweit sie nicht Befriedigung verlangen können. Dieses Recht steht den Gläubigern jedoch nur zu, wenn sie glaubhaft machen, dass durch die Umwandlung die Erfüllung der Forderung gefährdet wird."
    },
    {
      "date": "2025-12-17",
      "id": "140327",
      "original_text": "Registerbekanntmachung nach dem Umwandlungsgesetz\nRheinland-Pfalz Amtsgericht Wittlich HRA 42233\nThome u. Bormann Besitz GmbH & Co. KG – Lützkampen",
      "type": "Registerbekanntmachung nach dem Umwandlungsgesetz",
      "state": "Rheinland-Pfalz",
      "amtsgericht": "Amtsgericht Wittlich",
      "registernummer": "HRA 42233",
      "registerart": "HRA",
      "company_name": "Thome u. Bormann Besitz GmbH & Co. KG",
      "company_seat": "Lützkampen",
      "details": "17.12.2025 (Bekanntmachungsdatum)\n\nRheinland-Pfalz Amtsgericht Wittlich HRA 42233\nRegisterbekanntmachung nach dem Umwandlungsgesetz 17.12.2025 (Eintragungsdatum)\n\nThome u. Bormann Besitz GmbH & Co. KG\nKommanditgesellschaft\nLützkampen\n\nAls nicht eingetragen wird veröffentlicht: Den Gläubigern der an der Ausgliederung beteiligten Rechtsträger ist, wenn sie binnen sechs Monaten nach dem Tag, an dem die Eintragung der Ausgliederung in das Register des Sitzes desjenigen Rechtsträgers, dessen Gläubiger sie sind, nach § 19 Abs. 3 UmwG als bekannt gemacht gilt, ihren Anspruch nach Grund und Höhe schriftlich anmelden, Sicherheit zu leisten, soweit sie nicht Befriedigung verlangen können. Dieses Recht steht den Gläubigern jedoch nur zu, wenn sie glaubhaft machen, dass durch die Ausgliederung die Erfüllung der Forderung gefährdet wird."
    },
    {
      "date": "2025-12-17",
      "id": "140328",
      "original_text": "Registerbekanntmachung nach dem Umwandlungsgesetz\nRheinland-Pfalz Amtsgericht Koblenz GsR 876\nAnanya Machandaeng Traditionelle Thaimassage Spa & Wellness eGbR – Remagen",
      "type": "Registerbekanntmachung nach dem Umwandlungsgesetz",
      "state": "Rheinland-Pfalz",
      "amtsgericht": "Amtsgericht Koblenz",
      "registernummer": "GsR 876",
      "registerart": "GsR",
      "company_name": "Ananya Machandaeng Traditionelle Thaimassage Spa & Wellness eGbR",
      "company_seat": "Remagen",
      "details": "17.12.2025 (Bekanntmachungsdatum)\n\nRheinland-Pfalz Amtsgericht Koblenz GsR 876\nRegisterbekanntmachung nach dem Umwandlungsgesetz 17.12.2025 (Eintragungsdatum)\n\nAnanya Machandaeng Traditionelle Thaimassage Spa & Wellness eGbR\nGesellschaft bürgerlichen Rechts\nRemagen\n\nAls nicht eingetragen wird veröffentlicht: Den Gläubigern der an der Umwandlung beteiligten Rechtsträger ist, wenn sie binnen sechs Monaten nach dem Tag, an dem die Eintragung der Umwandlung in das Register des Sitzes desjenigen Rechtsträgers, dessen Gläubiger sie sind, nach § 19 Abs. 3 UmwG als bekannt gemacht gilt, ihren Anspruch nach Grund und Höhe schriftlich anmelden, Sicherheit zu leisten, soweit sie nicht Befriedigung verlangen können. Dieses Recht steht den Gläubigern jedoch nur zu, wenn sie glaubhaft machen, dass durch die Umwandlung die Erfüllung der Forderung gefährdet wird."
    },
    {
      "date": "2025-12-17",
      "id": "140329",
      "original_text": "Registerbekanntmachung nach dem Umwandlungsgesetz\nRheinland-Pfalz Amtsgericht Wittlich HRA 42250\nMettler Packaging KG – Morbach",
      "type": "Registerbekanntmachung nach dem Umwandlungsgesetz",
      "state": "Rheinland-Pfalz",
      "amtsgericht": "Amtsgericht Wittlich",
      "registernummer": "HRA 42250",
      "registerart": "HRA",
      "company_name": "Mettler Packaging KG",
      "company_seat": "Morbach",
      "details": "17.12.2025 (Bekanntmachungsdatum)\n\nRheinland-Pfalz Amtsgericht Wittlich HRA 42250\nRegisterbekanntmachung nach dem Umwandlungsgesetz 17.12.2025 (Eintragungsdatum)\n\nMettler Packaging KG\nKommanditgesellschaft\nMorbach\n\nAls nicht eingetragen wird veröffentlicht:\nDen Gläubigern des formwechselnden Rechtsträgers ist, wenn sie binnen sechs Monaten nach dem Tag, an dem die Eintragung des Formwechsels nach § 201 UmwG als bekannt gemacht gilt, ihren Anspruch nach Grund und Höhe schriftlich anmelden, Sicherheit zu leisten, soweit sie nicht Befriedigung verlangen können. Dieses Recht steht den Gläubigern jedoch nur zu, wenn sie glaubhaft machen, dass durch den Formwechsel die Erfüllung der Forderung gefährdet wird."
    },
    {
      "date": "2025-12-17",
      "id": "140330",
      "original_text": "Registerbekanntmachung nach dem Umwandlungsgesetz\nRheinland-Pfalz Amtsgericht Koblenz HRA 22558\nFOX Lagerpark GmbH & Co. KG – Koblenz",
      "type": "Registerbekanntmachung nach dem Umwandlungsgesetz",
      "state": "Rheinland-Pfalz",
      "amtsgericht": "Amtsgericht Koblenz",
      "registernummer": "HRA 22558",
      "registerart": "HRA",
      "company_name": "FOX Lagerpark GmbH & Co. KG",
      "company_seat": "Koblenz",
      "details": "17.12.2025 (Bekanntmachungsdatum)\n\nRheinland-Pfalz Amtsgericht Koblenz HRA 22558\nRegisterbekanntmachung nach dem Umwandlungsgesetz 17.12.2025 (Eintragungsdatum)\n\nFOX Lagerpark GmbH & Co. KG\nKommanditgesellschaft\nKoblenz\n\nAls nicht eingetragen wird veröffentlicht: Den Gläubigern der an der Verschmelzung beteiligten Rechtsträger ist, wenn sie binnen sechs Monaten nach dem Tag, an dem die Eintragung der Verschmelzung in das Register des Sitzes desjenigen Rechtsträgers,dessen Gläubiger sie sind, nach § 19 Abs. 3 UmwG als bekannt gemacht gilt, ihren Anspruch nach Grund und Höhe schriftlich anmelden, Sicherheit zu leisten, soweit sie nicht Befriedigung verlangen können. Dieses Recht steht den Gläubigern jedoch nur zu, wenn sie glaubhaft machen, dass durch die Verschmelzung die Erfüllungd er Forderung gefährdet wird."
    },
    {
      "date": "2025-12-17",
      "id": "140331",
      "original_text": "Registerbekanntmachung nach dem Umwandlungsgesetz\nBremen Amtsgericht Bremen HRB 41626\nReinmakers GmbH – Bremen",
      "type": "Registerbekanntmachung nach dem Umwandlungsgesetz",
      "state": "Bremen",
      "amtsgericht": "Amtsgericht Bremen",
      "registernummer": "HRB 41626",
      "registerart": "HRB",
      "company_name": "Reinmakers GmbH",
      "company_seat": "Bremen",
      "details": "17.12.2025 (Bekanntmachungsdatum)\n\nBremen Amtsgericht Bremen HRB 41626\nRegisterbekanntmachung nach dem Umwandlungsgesetz 16.12.2025 (Eintragungsdatum)\n\nReinmakers GmbH\nGesellschaft mit beschränkter Haftung\nBremen\n\nAls nicht eingetragen wird veröffentlicht: Den Gläubigern der an der Spaltung beteiligten Rechtsträger ist, wenn sie binnen sechs Monaten nach dem Tag, an dem die Eintragung der Spaltung in das Register des Sitzes desjenigen Rechtsträgers, dessen Gläubiger sie sind, als bekannt gemacht gilt, ihren Anspruch nach Grund und Höhe schriftlich anmelden, Sicherheit zu leisten, soweit sie nicht Befriedigung verlangen können. Dieses Recht steht den Gläubigern jedoch nur zu, wenn sie glaubhaft machen, dass durch die Spaltung die Erfüllung ihrer Forderung gefährdet wird. Das Recht, Sicherheitsleistung zu verlangen, steht Gläubigern nicht zu, die im Falle der Insolvenz ein Recht auf vorzugsweise Befriedigung aus einer Deckungsmasse haben, die nach gesetzlicher Vorschrift zu ihrem Schutz errichtet und staatlich überwacht ist."
    },
    {
      "date": "2025-12-17",
      "id": "140332",
      "original_text": "Löschungsankündigung\nBremen Amtsgericht Bremen HRB 38150\nLevel 2 GmbH – Bremen",
      "type": "Löschungsankündigung",
      "state": "Bremen",
      "amtsgericht": "Amtsgericht Bremen",
      "registernummer": "HRB 38150",
      "registerart": "HRB",
      "company_name": "Level 2 GmbH",
      "company_seat": "Bremen",
      "details": "17.12.2025 (Bekanntmachungsdatum)\n\nBremen Amtsgericht Bremen HRB 38150\nLöschungsankündigung\n\nLevel 2 GmbH\nGesellschaft mit beschränkter Haftung\nBremen\n\nEs ist beabsichtigt die im Handelsregister eingetragene Gesellschaft von Amts wegen gemäß § 394 FamFG zu löschen. Gegen die Löschung kann beim AG Bremen schriftlich oder zu Protokoll der Geschäftsstelle Widerspruch eingelegt werden. Widerspruchsfrist 4 Wochen."
    },
    {
      "date": "2025-12-17",
      "id": "140333",
      "original_text": "Einreichung neuer Dokumente\nNordrhein-Westfalen Amtsgericht Duisburg HRB 9326\nThyssenKrupp Steel Europe AG – Duisburg",
      "type": "Einreichung neuer Dokumente",
      "state": "Nordrhein-Westfalen",
      "amtsgericht": "Amtsgericht Duisburg",
      "registernummer": "HRB 9326",
      "registerart": "HRB",
      "company_name": "ThyssenKrupp Steel Europe AG",
      "company_seat": "Duisburg",
      "details": "17.12.2025 (Bekanntmachungsdatum)\n\nNordrhein-Westfalen Amtsgericht Duisburg HRB 9326\nEinreichung neuer Dokumente\n\nThyssenKrupp Steel Europe AG\nAktiengesellschaft\nDuisburg\n\nDem Registergericht ist eine Liste der Mitglieder des Aufsichtsrates eingereicht worden."
    },
    {
      "date": "2025-12-17",
      "id": "140334",
      "original_text": "Löschungsankündigung\nNordrhein-Westfalen Amtsgericht Gelsenkirchen HRB 16547\nLettco GmbH – Bottrop",
      "type": "Löschungsankündigung",
      "state": "Nordrhein-Westfalen",
      "amtsgericht": "Amtsgericht Gelsenkirchen",
      "registernummer": "HRB 16547",
      "registerart": "HRB",
      "company_name": "Lettco GmbH",
      "company_seat": "Bottrop",
      "details": "17.12.2025 (Bekanntmachungsdatum)\n\nNordrhein-Westfalen Amtsgericht Gelsenkirchen HRB 16547\nLöschungsankündigung\n\nLettco GmbH\nGesellschaft mit beschränkter Haftung\nBottrop\n\nDas Gericht beabsichtigt, die im Handelsregister eingetragene Lettco GmbH mit Sitz in Bottrop, HRB 16547, Amtsgericht Gelsenkirchen, wegen Vermögenslosigkeit zu löschen.\nHiermit wird denjenigen, die an der Unterlassung der Löschung ein berechtigtes Interesse haben, gem. § 394 Abs. 2 FamFG Gelegenheit gegeben, gegen dieses Vorhaben binnen eines Monats nach dieser Bekanntmachung Widerspruch einzulegen. Der Widerspruch kann schriftlich oder zu Protokoll der Geschäftsstelle erhoben werden."
    },
    {
      "date": "2025-12-17",
      "id": "140335",
      "original_text": "Löschungsankündigung\nNordrhein-Westfalen Amtsgericht Siegen HRB 10603\nGIP Innovation Tools GmbH – Siegen",
      "type": "Löschungsankündigung",
      "state": "Nordrhein-Westfalen",
      "amtsgericht": "Amtsgericht Siegen",
      "registernummer": "HRB 10603",
      "registerart": "HRB",
      "company_name": "GIP Innovation Tools GmbH",
      "company_seat": "Siegen",
      "details": "17.12.2025 (Bekanntmachungsdatum)\n\nNordrhein-Westfalen Amtsgericht Siegen HRB 10603\nLöschungsankündigung\n\nGIP Innovation Tools GmbH\nGesellschaft mit beschränkter Haftung\nSiegen\n\nDas Registergericht beabsichtigt die Gesellschaft von Amts wegen nach § 394 FamFG zu löschen. Die Frist zur Erhebung eines Widerspruchs ist auf drei Monate festgesetzt."
    },
    {
      "date": "2025-12-17",
      "id": "140336",
      "original_text": "Registerbekanntmachung nach dem Umwandlungsgesetz\nNordrhein-Westfalen Amtsgericht Münster HRA 12126\nWilhelm Horstmann e.K. – Sassenberg",
      "type": "Registerbekanntmachung nach dem Umwandlungsgesetz",
      "state": "Nordrhein-Westfalen",
      "amtsgericht": "Amtsgericht Münster",
      "registernummer": "HRA 12126",
      "registerart": "HRA",
      "company_name": "Wilhelm Horstmann e.K.",
      "company_seat": "Sassenberg",
      "details": "17.12.2025 (Bekanntmachungsdatum)\n\nNordrhein-Westfalen Amtsgericht Münster HRA 12126\nRegisterbekanntmachung nach dem Umwandlungsgesetz 17.12.2025 (Eintragungsdatum)\n\nWilhelm Horstmann e.K.\nEinzelkaufmann / Einzelkauffrau\nSassenberg\n\nDen Gläubigern der an der Ausgliederung beteiligten Rechtsträger ist, wenn sie binnen sechs Monaten nach dem Tag, an dem die Eintragung der Ausgliederung in das Register des Sitzes desjenigen Rechtsträgers, dessen Gläubiger sie sind, nach § 19 Absatz 3 UmwG als bekanntgemacht gilt, ihren Anspruch nach Grund und Höhe schriftlich anmelden, Sicherheit zu leisten, soweit sie nicht Befriedigung verlangen können. Dieses Recht steht den Gläubigern jedoch nur zu, wenn sie glaubhaft machen, dass durch die Ausgliederung die Erfüllung ihrer Forderung gefährdet wird."
    },
    {
      "date": "2025-12-17",
      "id": "140337",
      "original_text": "Registerbekanntmachung nach dem Umwandlungsgesetz\nNordrhein-Westfalen Amtsgericht Düsseldorf HRB 15607\nT & S Versicherungsmakler GmbH – Düsseldorf",
      "type": "Registerbekanntmachung nach dem Umwandlungsgesetz",
      "state": "Nordrhein-Westfalen",
      "amtsgericht": "Amtsgericht Düsseldorf",
      "registernummer": "HRB 15607",
      "registerart": "HRB",
      "company_name": "T & S Versicherungsmakler GmbH",
      "company_seat": "Düsseldorf",
      "details": "17.12.2025 (Bekanntmachungsdatum)\n\nNordrhein-Westfalen Amtsgericht Düsseldorf HRB 15607\nRegisterbekanntmachung nach dem Umwandlungsgesetz 17.12.2025 (Eintragungsdatum)\n\nT & S Versicherungsmakler GmbH\nGesellschaft mit beschränkter Haftung\nDüsseldorf\n\nDen Gläubigern der an der Verschmelzung beteiligten Rechtsträger ist, wenn sie binnen sechs Monaten nach dem Tag, an dem die Eintragung der Verschmelzung in das Register des Sitzes desjenigen Rechtsträgers, dessen Gläubiger sie sind, nach § 19 Absatz 3 UmwG als bekanntgemacht gilt, ihren Anspruch nach Grund und Höhe schriftlich anmelden, Sicherheit zu leisten, soweit sie nicht Befriedigung verlangen können. Dieses Recht steht den Gläubigern jedoch nur zu, wenn sie glaubhaft machen, dass durch die Verschmelzung die Erfüllung ihrer Forderung gefährdet wird."
    },
    {
      "date": "2025-12-17",
      "id": "140338",
      "original_text": "Sonstige Registerbekanntmachung\nNordrhein-Westfalen Amtsgericht Gelsenkirchen HRB 3693\nVTA Verfahrenstechnik und Automatisierung GmbH – Gelsenkirchen",
      "type": "Sonstige Registerbekanntmachung",
      "state": "Nordrhein-Westfalen",
      "amtsgericht": "Amtsgericht Gelsenkirchen",
      "registernummer": "HRB 3693",
      "registerart": "HRB",
      "company_name": "VTA Verfahrenstechnik und Automatisierung GmbH",
      "company_seat": "Gelsenkirchen",
      "details": "17.12.2025 (Bekanntmachungsdatum)\n\nNordrhein-Westfalen Amtsgericht Gelsenkirchen HRB 3693\nSonstige Registerbekanntmachung 17.12.2025 (Eintragungsdatum)\n\nVTA Verfahrenstechnik und Automatisierung GmbH\nGesellschaft mit beschränkter Haftung\nGelsenkirchen\n\nAls nicht eingetragen wird veröffentlicht: Den Gläubigern der Gesellschaft, deren Forderungen begründet worden sind bevor die Eintragung der Beendigung des Beherrschungs- und Gewinnabführungsvertrages  in das Handelsregister nach § 10 des Handelsgesetzbuches als bekanntgemacht gilt, hat der andere Vertragsteil Sicherheit zu leisten, wenn sie sich binnen sechs Monaten nach der Bekanntmachung der Eintragung zu diesem Zweck bei ihm melden."
    },
    {
      "date": "2025-12-17",
      "id": "140339",
      "original_text": "Löschungsankündigung\nNordrhein-Westfalen Amtsgericht Dortmund HRB 35692\nGOLDEN HORN GmbH – Dortmund",
      "type": "Löschungsankündigung",
      "state": "Nordrhein-Westfalen",
      "amtsgericht": "Amtsgericht Dortmund",
      "registernummer": "HRB 35692",
      "registerart": "HRB",
      "company_name": "GOLDEN HORN GmbH",
      "company_seat": "Dortmund",
      "details": "17.12.2025 (Bekanntmachungsdatum)\n\nNordrhein-Westfalen Amtsgericht Dortmund HRB 35692\nLöschungsankündigung 17.12.2025 (Eintragungsdatum)\n\nGOLDEN HORN GmbH\nGesellschaft mit beschränkter Haftung\nDortmund\n\nDas Registergericht beabsichtigt die Gesellschaft von Amts wegen nach § 394 FamFG zu löschen. Die Frist zur Erhebung eines Widerspruchs ist auf zwei Monate festgesetzt."
    },
    {
      "date": "2025-12-17",
      "id": "140340",
      "original_text": "Einreichung neuer Dokumente\nNordrhein-Westfalen Amtsgericht Essen HRB 279\nHOCHTIEF Aktiengesellschaft – Essen",
      "type": "Einreichung neuer Dokumente",
      "state": "Nordrhein-Westfalen",
      "amtsgericht": "Amtsgericht Essen",
      "registernummer": "HRB 279",
      "registerart": "HRB",
      "company_name": "HOCHTIEF Aktiengesellschaft",
      "company_seat": "Essen",
      "details": "17.12.2025 (Bekanntmachungsdatum)\n\nNordrhein-Westfalen Amtsgericht Essen HRB 279\nEinreichung neuer Dokumente\n\nHOCHTIEF Aktiengesellschaft\nAktiengesellschaft\nEssen\n\nDem Registergericht ist eine neue Liste der Mitglieder des Aufsichtsrates eingereicht worden."
    },
    {
      "date": "2025-12-17",
      "id": "140341",
      "original_text": "Registerbekanntmachung nach dem Umwandlungsgesetz\nNordrhein-Westfalen Amtsgericht Essen HRB 33150\nAW Holding SE – Essen",
      "type": "Registerbekanntmachung nach dem Umwandlungsgesetz",
      "state": "Nordrhein-Westfalen",
      "amtsgericht": "Amtsgericht Essen",
      "registernummer": "HRB 33150",
      "registerart": "HRB",
      "company_name": "AW Holding SE",
      "company_seat": "Essen",
      "details": "17.12.2025 (Bekanntmachungsdatum)\n\nNordrhein-Westfalen Amtsgericht Essen HRB 33150\nRegisterbekanntmachung nach dem Umwandlungsgesetz 17.12.2025 (Eintragungsdatum)\n\nAW Holding SE\nEuropäische Aktiengesellschaft (SE)\nEssen\n\nDen Gläubigern der an der Verschmelzung beteiligten Rechtsträger ist, wenn sie binnen sechs Monaten nach dem Tag, an dem die Eintragung der Verschmelzung in das Register des Sitzes desjenigen Rechtsträgers, dessen Gläubiger sie sind, nach § 19 Absatz 3 UmwG als bekanntgemacht gilt, ihren Anspruch nach Grund und Höhe schriftlich anmelden, Sicherheit zu leisten, soweit sie nicht Befriedigung verlangen können. Dieses Recht steht den Gläubigern jedoch nur zu, wenn sie glaubhaft machen, dass durch die Verschmelzung die Erfüllung ihrer Forderung gefährdet wird."
    },
    {
      "date": "2025-12-17",
      "id": "140342",
      "original_text": "Registerbekanntmachung nach dem Umwandlungsgesetz\nNordrhein-Westfalen Amtsgericht Düsseldorf HRB 79825\nSecuRat Die Versicherungsmakler Aktiengesellschaft – Ratingen",
      "type": "Registerbekanntmachung nach dem Umwandlungsgesetz",
      "state": "Nordrhein-Westfalen",
      "amtsgericht": "Amtsgericht Düsseldorf",
      "registernummer": "HRB 79825",
      "registerart": "HRB",
      "company_name": "SecuRat Die Versicherungsmakler Aktiengesellschaft",
      "company_seat": "Ratingen",
      "details": "17.12.2025 (Bekanntmachungsdatum)\n\nNordrhein-Westfalen Amtsgericht Düsseldorf HRB 79825\nRegisterbekanntmachung nach dem Umwandlungsgesetz 17.12.2025 (Eintragungsdatum)\n\nSecuRat Die Versicherungsmakler Aktiengesellschaft\nAktiengesellschaft\nRatingen\n\nDen Gläubigern der an der Verschmelzung beteiligten Rechtsträger ist, wenn sie binnen sechs Monaten nach dem Tag, an dem die Eintragung der Verschmelzung in das Register des Sitzes desjenigen Rechtsträgers, dessen Gläubiger sie sind, nach § 19 Absatz 3 UmwG als bekanntgemacht gilt, ihren Anspruch nach Grund und Höhe schriftlich anmelden, Sicherheit zu leisten, soweit sie nicht Befriedigung verlangen können. Dieses Recht steht den Gläubigern jedoch nur zu, wenn sie glaubhaft machen, dass durch die Verschmelzung die Erfüllung ihrer Forderung gefährdet wird."
    },
    {
      "date": "2025-12-17",
      "id": "140343",
      "original_text": "Einreichung neuer Dokumente\nNordrhein-Westfalen Amtsgericht Dortmund HRB 2186\nDOGEWO Dortmunder Gesellschaft für Wohnen mbH – Dortmund",
      "type": "Einreichung neuer Dokumente",
      "state": "Nordrhein-Westfalen",
      "amtsgericht": "Amtsgericht Dortmund",
      "registernummer": "HRB 2186",
      "registerart": "HRB",
      "company_name": "DOGEWO Dortmunder Gesellschaft für Wohnen mbH",
      "company_seat": "Dortmund",
      "details": "17.12.2025 (Bekanntmachungsdatum)\n\nNordrhein-Westfalen Amtsgericht Dortmund HRB 2186\nEinreichung neuer Dokumente\n\nDOGEWO Dortmunder Gesellschaft für Wohnen mbH\nGesellschaft mit beschränkter Haftung\nDortmund\n\nDem Registergericht ist eine neue Liste der Mitglieder des Aufsichtsrates eingereicht worden."
    },
    {
      "date": "2025-12-17",
      "id": "140344",
      "original_text": "Sonstige Registerbekanntmachung\nNordrhein-Westfalen Amtsgericht Düsseldorf HRB 108219\nbioXXmed AG – Düsseldorf",
      "type": "Sonstige Registerbekanntmachung",
      "state": "Nordrhein-Westfalen",
      "amtsgericht": "Amtsgericht Düsseldorf",
      "registernummer": "HRB 108219",
      "registerart": "HRB",
      "company_name": "bioXXmed AG",
      "company_seat": "Düsseldorf",
      "details": "17.12.2025 (Bekanntmachungsdatum)\n\nNordrhein-Westfalen Amtsgericht Düsseldorf HRB 108219\nSonstige Registerbekanntmachung 17.12.2025 (Eintragungsdatum)\n\nbioXXmed AG\nAktiengesellschaft\nDüsseldorf\n\nDen Gläubigern der Gesellschaft, deren Forderungen begründet worden sind, bevor die Eintragung des Kapitalherabsetzungsbeschlusses bekannt gemacht worden ist, ist, wenn sie sich binnen sechs Monaten nach dieser Bekanntmachung zu diesem Zweck melden, Sicherheit zu leisten, soweit sie nicht Befriedigung verlangen können."
    },
    {
      "date": "2025-12-17",
      "id": "140345",
      "original_text": "Löschungsankündigung\nNordrhein-Westfalen Amtsgericht Siegen HRB 11082\nWAGA-Tec GmbH – Kreuztal",
      "type": "Löschungsankündigung",
      "state": "Nordrhein-Westfalen",
      "amtsgericht": "Amtsgericht Siegen",
      "registernummer": "HRB 11082",
      "registerart": "HRB",
      "company_name": "WAGA-Tec GmbH",
      "company_seat": "Kreuztal",
      "details": "17.12.2025 (Bekanntmachungsdatum)\n\nNordrhein-Westfalen Amtsgericht Siegen HRB 11082\nLöschungsankündigung\n\nWAGA-Tec GmbH\nGesellschaft mit beschränkter Haftung\nKreuztal\n\nDas Registergericht beabsichtigt die Gesellschaft von Amts wegen nach § 394 FamFG zu löschen. Die Frist zur Erhebung eines Widerspruchs ist auf drei Monate festgesetzt."
    },
    {
      "date": "2025-12-17",
      "id": "140346",
      "original_text": "Registerbekanntmachung nach dem Umwandlungsgesetz\nNordrhein-Westfalen Amtsgericht Düsseldorf HRB 62054\nstudio grüngrau GmbH – Düsseldorf",
      "type": "Registerbekanntmachung nach dem Umwandlungsgesetz",
      "state": "Nordrhein-Westfalen",
      "amtsgericht": "Amtsgericht Düsseldorf",
      "registernummer": "HRB 62054",
      "registerart": "HRB",
      "company_name": "studio grüngrau GmbH",
      "company_seat": "Düsseldorf",
      "details": "17.12.2025 (Bekanntmachungsdatum)\n\nNordrhein-Westfalen Amtsgericht Düsseldorf HRB 62054\nRegisterbekanntmachung nach dem Umwandlungsgesetz 17.12.2025 (Eintragungsdatum)\n\nstudio grüngrau GmbH\nGesellschaft mit beschränkter Haftung\nDüsseldorf\n\nDen Gläubigern der an der Verschmelzung beteiligten Rechtsträger ist, wenn sie binnen sechs Monaten nach dem Tag, an dem die Eintragung der Verschmelzung in das Register des Sitzes desjenigen Rechtsträgers, dessen Gläubiger sie sind, nach § 19 Absatz 3 UmwG als bekanntgemacht gilt, ihren Anspruch nach Grund und Höhe schriftlich anmelden, Sicherheit zu leisten, soweit sie nicht Befriedigung verlangen können. Dieses Recht steht den Gläubigern jedoch nur zu, wenn sie glaubhaft machen, dass durch die Verschmelzung die Erfüllung ihrer Forderung gefährdet wird."
    },
    {
      "date": "2025-12-17",
      "id": "140347",
      "original_text": "Löschungsankündigung\nNordrhein-Westfalen Amtsgericht Siegen HRB 11823\nLos Brothers GmbH – Siegen",
      "type": "Löschungsankündigung",
      "state": "Nordrhein-Westfalen",
      "amtsgericht": "Amtsgericht Siegen",
      "registernummer": "HRB 11823",
      "registerart": "HRB",
      "company_name": "Los Brothers GmbH",
      "company_seat": "Siegen",
      "details": "17.12.2025 (Bekanntmachungsdatum)\n\nNordrhein-Westfalen Amtsgericht Siegen HRB 11823\nLöschungsankündigung\n\nLos Brothers GmbH\nGesellschaft mit beschränkter Haftung\nSiegen\n\nDas Registergericht beabsichtigt die Gesellschaft von Amts wegen nach § 394 FamFG zu löschen. Die Frist zur Erhebung eines Widerspruchs ist auf drei Monate festgesetzt."
    },
    {
      "date": "2025-12-17",
      "id": "140348",
      "original_text": "Registerbekanntmachung nach dem Umwandlungsgesetz\nNordrhein-Westfalen Amtsgericht Köln HRB 90672\nBarry Callebaut Deutschland GmbH – Köln",
      "type": "Registerbekanntmachung nach dem Umwandlungsgesetz",
      "state": "Nordrhein-Westfalen",
      "amtsgericht": "Amtsgericht Köln",
      "registernummer": "HRB 90672",
      "registerart": "HRB",
      "company_name": "Barry Callebaut Deutschland GmbH",
      "company_seat": "Köln",
      "details": "17.12.2025 (Bekanntmachungsdatum)\n\nNordrhein-Westfalen Amtsgericht Köln HRB 90672\nRegisterbekanntmachung nach dem Umwandlungsgesetz\n\nBarry Callebaut Deutschland GmbH\nGesellschaft mit beschränkter Haftung\nKöln\n\nDem Registergericht ist der Entwurf eines Verschmelzungsplan über die geplante Verschmelzung der Naamlose Vennootschap (Aktiengesellschaft nach belgischem Recht) unter Firma Barry Callebaut Belgium NV mit Sitz in Lebbeke (Rechtspersonenregister Gent, afdeling Dendermonde, onder het nummer 0438.950.833) als übernehmender Gesellschaft mit der Gesellschaft mit beschränkter Haftung nach deutschem Recht unter Firma Barry Callebaut Deutschland GmbH mit Sitz in Köln (Amtsgericht Köln, HRB 90672) als übertragender Gesellschaft eingereicht worden.\nDie Anteilsinhaber, die Gläubiger sowie die Arbeitnehmer werden darauf hingewiesen, dass sie spätestens fünf Arbeitstage vor dem Tag der geplanten Gesellschaftsversammlung, die über die Zustimmung zu dem Verschmelzungsplan beschließt, bzw. vor der geplanten Beurkundung des Verschmelzungsplans, Bemerkungen zum Verschmelzungsplan übermitteln können. Da gemäß § 308 Abs. 2 i.V.m. §§ 312 Abs. 2, 307 Abs. 3 UmwG ein Verschmelzungsbeschluss der Anteilsinhaber der übertragenden Gesellschaft entfällt, sind entsprechend der gesetzlichen Regelung Bemerkungen zum Verschmelzungsplan bis zur Beurkundung des Verschmelzungsplans zu übermitteln. Die Beurkundung ist für den 26.03.2026 vorgesehen, Bemerkungen sind damit spätestens bis zum 21.03.2026 an die Gesellschaft unter der folgenden Anschrift zu übermitteln: Barry Callebau Deutschland GmbH, Kaiser-Wilhelm-Ring 27-29, 50672 Köln oder per email an alexia_caeymaex@barry-callebaut.com. Die Rechte der Gläubiger der übertragenden Gesellschaft ergeben sich aus §§ 307 Abs. 2 Nr. 14, 314 UmwG. Danach besteht für die Gläubiger der an der Verschmelzung beteiligten Barry Callebaut Deutschland GmbH ein Anspruch auf Sicherheitsleistung, wenn er innerhalb von drei Monaten ab Bekanntmachung des Verschmelzungsplans gemäß § 308 UmwG gerichtlich geltend gemacht worden ist. Dieser Anspruch steht den Gläubigern nur zu, wenn sie glaubhaft machen, dass die Forderung vor der Bekanntmachung des Verschmelzungsplans oder seines Entwurfs entstanden, aber im Zeitpunkt der Bekanntmachung noch nicht fällig geworden ist, und dass durch die Verschmelzung die Erfüllung ihrer Forderung gefährdet wird. Das Recht Sicherheitsleistung zu verlangen, steht Gläubigern nicht zu, die im Fall der Insolvenz ein Recht auf vorzugsweise Befriedigung aus einer Deckungsmasse haben, die nach gesetzlicher Vorschrift zu ihrem Schutz errichtet und staatlich überwacht ist. Die Firma Barry Callebaut Deutschland hat keine Außenstehende Minderheitsgesellschafter, so dass Angaben über die Ausübung von deren Rechten entfallen.. Die vollständigen Auskünfte über diese Modalitäten können kostenlos eingeholt werden bei Barry Callebaut Deutschland GmbH, Kaiser-Wilhelm-Ring 27-29, 50672 Köln."
    },
    {
      "date": "2025-12-17",
      "id": "140349",
      "original_text": "Registerbekanntmachung nach dem Umwandlungsgesetz\nThüringen Amtsgericht Jena HRB 524021\nContemporary Amperex Technology Thuringia SE – Arnstadt",
      "type": "Registerbekanntmachung nach dem Umwandlungsgesetz",
      "state": "Thüringen",
      "amtsgericht": "Amtsgericht Jena",
      "registernummer": "HRB 524021",
      "registerart": "HRB",
      "company_name": "Contemporary Amperex Technology Thuringia SE",
      "company_seat": "Arnstadt",
      "details": "17.12.2025 (Bekanntmachungsdatum)\n\nThüringen Amtsgericht Jena HRB 524021\nRegisterbekanntmachung nach dem Umwandlungsgesetz 17.12.2025 (Eintragungsdatum)\n\nContemporary Amperex Technology Thuringia SE\nEuropäische Aktiengesellschaft (SE)\nArnstadt\n\nNicht eingetragen: Den Gläubigern der an der Verschmelzung beteiligten Rechtsträger, ist wenn sie binnen sechs Monaten nach dem Tag, an dem die Eintragung der Verschmelzung in das Register des Sitzes desjenigen Rechtsträgers, dessen Gläubiger sie sind,  nach § 19 Abs. 3 UmwG als bekanntgemacht gilt, ihren Anspruch nach Grund und Höhe schriftlich anmelden, Sicherheit zu leisten, soweit sie nicht Befriedigung verlangen können. Dieses Recht steht ihnen jedoch nur zu, wenn sie glaubhaft machen, daß durch die Verschmelzung die Erfüllung ihrer Forderung gefährdet wird."
    },
    {
      "date": "2025-12-17",
      "id": "140350",
      "original_text": "Registerbekanntmachung nach dem Umwandlungsgesetz\nThüringen Amtsgericht Jena HRB 522460\nContemporary Amperex Technology Thuringia AG – Arnstadt",
      "type": "Registerbekanntmachung nach dem Umwandlungsgesetz",
      "state": "Thüringen",
      "amtsgericht": "Amtsgericht Jena",
      "registernummer": "HRB 522460",
      "registerart": "HRB",
      "company_name": "Contemporary Amperex Technology Thuringia AG",
      "company_seat": "Arnstadt",
      "details": "17.12.2025 (Bekanntmachungsdatum)\n\nThüringen Amtsgericht Jena HRB 522460\nRegisterbekanntmachung nach dem Umwandlungsgesetz 17.12.2025 (Eintragungsdatum)\n\nContemporary Amperex Technology Thuringia AG\nAktiengesellschaft\nArnstadt\n\nNicht eingetragen: Den Gläubigern der an der Verschmelzung beteiligten Rechtsträger, ist wenn sie binnen sechs Monaten nach dem Tag, an dem die Eintragung der Verschmelzung in das Register des Sitzes desjenigen Rechtsträgers, dessen Gläubiger sie sind,  nach § 19 Abs. 3 UmwG als bekanntgemacht gilt, ihren Anspruch nach Grund und Höhe schriftlich anmelden, Sicherheit zu leisten, soweit sie nicht Befriedigung verlangen können. Dieses Recht steht ihnen jedoch nur zu, wenn sie glaubhaft machen, daß durch die Verschmelzung die Erfüllung ihrer Forderung gefährdet wird."
    },
    {
      "date": "2025-12-17",
      "id": "140351",
      "original_text": "Löschungsankündigung\nHessen Amtsgericht Offenbach am Main HRB 50431\nMANOBAU UG (haftungsbeschränkt) – Dreieich",
      "type": "Löschungsankündigung",
      "state": "Hessen",
      "amtsgericht": "Amtsgericht Offenbach am Main",
      "registernummer": "HRB 50431",
      "registerart": "HRB",
      "company_name": "MANOBAU UG (haftungsbeschränkt)",
      "company_seat": "Dreieich",
      "details": "17.12.2025 (Bekanntmachungsdatum)\n\nHessen Amtsgericht Offenbach am Main HRB 50431\nLöschungsankündigung\n\nMANOBAU UG (haftungsbeschränkt)\nGesellschaft mit beschränkter Haftung\nDreieich\n\nDas Registergericht beabsichtigt, den eingetragenen Geschäftsführer Herr Teklic nach erfolgter Gewerbeuntersagung nach § 35 Gewerbeordnung durch das Regierungspräsidium Darmstadt nun gemäß § 395 FamFG von Amts wegen im Handelsregister zu löschen.\nWer an der Unterlassung der Löschung ein berechtigtes Interesse hat, kann innerhalb eines Monats ab Bekanntmachung Widerspruch beim Amtsgericht Offenbach am Main einlegen."
    },
    {
      "date": "2025-12-17",
      "id": "140352",
      "original_text": "Sonstige Registerbekanntmachung\nHessen Amtsgericht Wetzlar VR 4628\nFörderverein Waldhof Elgershausen e.V. – Greifenstein",
      "type": "Sonstige Registerbekanntmachung",
      "state": "Hessen",
      "amtsgericht": "Amtsgericht Wetzlar",
      "registernummer": "VR 4628",
      "registerart": "VR",
      "company_name": "Förderverein Waldhof Elgershausen e.V.",
      "company_seat": "Greifenstein",
      "details": "17.12.2025 (Bekanntmachungsdatum)\n\nHessen Amtsgericht Wetzlar VR 4628\nSonstige Registerbekanntmachung 17.12.2025 (Eintragungsdatum)\n\nFörderverein Waldhof Elgershausen e.V.\neingetragener Verein\nGreifenstein\n\nDer Verein ist aufgelöst."
    },
    {
      "date": "2025-12-17",
      "id": "140353",
      "original_text": "Löschungsankündigung\nHessen Amtsgericht Offenbach am Main HRB 44851\nEXTRA Express-Transport UG (haftungsbeschränkt) – Offenbach am Main",
      "type": "Löschungsankündigung",
      "state": "Hessen",
      "amtsgericht": "Amtsgericht Offenbach am Main",
      "registernummer": "HRB 44851",
      "registerart": "HRB",
      "company_name": "EXTRA Express-Transport UG (haftungsbeschränkt)",
      "company_seat": "Offenbach am Main",
      "details": "17.12.2025 (Bekanntmachungsdatum)\n\nHessen Amtsgericht Offenbach am Main HRB 44851\nLöschungsankündigung\n\nEXTRA Express-Transport UG (haftungsbeschränkt)\nGesellschaft mit beschränkter Haftung\nOffenbach am Main\n\nDas Registergericht beabsichtigt die im Handelsregister eingetragene Gesellschaft von Amts wegen nach § 394 FamFG zu löschen. Die Frist zur Erhebung eines Widerspruchs gegen die beabsichtigte Löschung wird auf 3 Monate festgesetzt."
    },
    {
      "date": "2025-12-17",
      "id": "140354",
      "original_text": "Sonstige Registerbekanntmachung\nHessen Amtsgericht Kassel VR 5278\nHundesportfreunde Staufenberg e.V. – Kassel",
      "type": "Sonstige Registerbekanntmachung",
      "state": "Hessen",
      "amtsgericht": "Amtsgericht Kassel",
      "registernummer": "VR 5278",
      "registerart": "VR",
      "company_name": "Hundesportfreunde Staufenberg e.V.",
      "company_seat": "Kassel",
      "details": "17.12.2025 (Bekanntmachungsdatum)\n\nHessen Amtsgericht Kassel VR 5278\nSonstige Registerbekanntmachung 17.12.2025 (Eintragungsdatum)\n\nHundesportfreunde Staufenberg e.V.\neingetragener Verein\nKassel\n\nDer Verein ist aufgelöst."
    },
    {
      "date": "2025-12-17",
      "id": "140355",
      "original_text": "Löschungsankündigung\nHessen Amtsgericht Offenbach am Main HRB 42170\nHASEEB-Moden GmbH – Dreieich",
      "type": "Löschungsankündigung",
      "state": "Hessen",
      "amtsgericht": "Amtsgericht Offenbach am Main",
      "registernummer": "HRB 42170",
      "registerart": "HRB",
      "company_name": "HASEEB-Moden GmbH",
      "company_seat": "Dreieich",
      "details": "17.12.2025 (Bekanntmachungsdatum)\n\nHessen Amtsgericht Offenbach am Main HRB 42170\nLöschungsankündigung\n\nHASEEB-Moden GmbH\nGesellschaft mit beschränkter Haftung\nDreieich\n\nDas Registergericht beabsichtigt die im Handelsregister eingetragene Gesellschaft von Amts wegen nach § 394 FamFG zu löschen. Die Frist zur Erhebung eines Widerspruchs gegen die beabsichtigte Löschung wird auf 3 Monate festgesetzt."
    },
    {
      "date": "2025-12-17",
      "id": "140356",
      "original_text": "Einreichung neuer Dokumente\nHessen Amtsgericht Bad Homburg v.d.H. HRB 16402\nKED-Seals Aktiengesellschaft – Steinbach (Taunus)",
      "type": "Einreichung neuer Dokumente",
      "state": "Hessen",
      "amtsgericht": "Amtsgericht Bad Homburg v.d.H.",
      "registernummer": "HRB 16402",
      "registerart": "HRB",
      "company_name": "KED-Seals Aktiengesellschaft",
      "company_seat": "Steinbach (Taunus)",
      "details": "17.12.2025 (Bekanntmachungsdatum)\n\nHessen Amtsgericht Bad Homburg v.d.H. HRB 16402\nEinreichung neuer Dokumente 31.10.2025 (Eintragungsdatum)\n\nKED-Seals Aktiengesellschaft\nAktiengesellschaft\nSteinbach (Taunus)\n\nDurch eine Änderung in den Personen der Aufsichtsratsmitglieder ist eine Liste der Mitglieder des Aufsichtsrates zum Handelsregister eingereicht worden."
    },
    {
      "date": "2025-12-17",
      "id": "140357",
      "original_text": "Registerbekanntmachung nach dem Umwandlungsgesetz\nHessen Amtsgericht Frankfurt am Main HRB 91044\nIsofa Metallbau GmbH – Frankfurt am Main",
      "type": "Registerbekanntmachung nach dem Umwandlungsgesetz",
      "state": "Hessen",
      "amtsgericht": "Amtsgericht Frankfurt am Main",
      "registernummer": "HRB 91044",
      "registerart": "HRB",
      "company_name": "Isofa Metallbau GmbH",
      "company_seat": "Frankfurt am Main",
      "details": "17.12.2025 (Bekanntmachungsdatum)\n\nHessen Amtsgericht Frankfurt am Main HRB 91044\nRegisterbekanntmachung nach dem Umwandlungsgesetz 17.12.2025 (Eintragungsdatum)\n\nIsofa Metallbau GmbH\nGesellschaft mit beschränkter Haftung\nFrankfurt am Main\n\nDen Gläubigern der an der Verschmelzung beteiligten Rechtsträger ist, wenn sie binnen sechs Monaten nach dem Tag, an dem die Eintragung der Verschmelzung in das Register des Sitzes desjenigen Rechtsträgers, dessen Gläubiger sie sind, nach § 19 Absatz 3 UmwG bekannt gemacht worden ist, ihren Anspruch nach Grund und Höhe schriftlich anmelden, Sicherheit zu leisten, soweit sie nicht Befriedigung verlangen können. Dieses Recht steht den Gläubigern jedoch nur zu, wenn sie glaubhaft machen, dass durch die Verschmelzung die Erfüllung ihrer Forderung gefährdet wird."
    },
    {
      "date": "2025-12-17",
      "id": "140358",
      "original_text": "Löschungsankündigung\nHessen Amtsgericht Offenbach am Main HRB 48500\nRein Service UG (haftungsbeschränkt) – Offenbach am Main",
      "type": "Löschungsankündigung",
      "state": "Hessen",
      "amtsgericht": "Amtsgericht Offenbach am Main",
      "registernummer": "HRB 48500",
      "registerart": "HRB",
      "company_name": "Rein Service UG (haftungsbeschränkt)",
      "company_seat": "Offenbach am Main",
      "details": "17.12.2025 (Bekanntmachungsdatum)\n\nHessen Amtsgericht Offenbach am Main HRB 48500\nLöschungsankündigung\n\nRein Service UG (haftungsbeschränkt)\nGesellschaft mit beschränkter Haftung\nOffenbach am Main\n\nDas Registergericht beabsichtigt die im Handelsregister eingetragene Gesellschaft von Amts wegen nach § 394 FamFG zu löschen. Die Frist zur Erhebung eines Widerspruchs gegen die beabsichtigte Löschung wird auf 3 Monate festgesetzt."
    },
    {
      "date": "2025-12-17",
      "id": "140359",
      "original_text": "Löschungsankündigung\nHessen Amtsgericht Offenbach am Main HRB 54201\nRoll Green Trans UG (haftungsbeschränkt) – Heusenstamm",
      "type": "Löschungsankündigung",
      "state": "Hessen",
      "amtsgericht": "Amtsgericht Offenbach am Main",
      "registernummer": "HRB 54201",
      "registerart": "HRB",
      "company_name": "Roll Green Trans UG (haftungsbeschränkt)",
      "company_seat": "Heusenstamm",
      "details": "17.12.2025 (Bekanntmachungsdatum)\n\nHessen Amtsgericht Offenbach am Main HRB 54201\nLöschungsankündigung\n\nRoll Green Trans UG (haftungsbeschränkt)\nGesellschaft mit beschränkter Haftung\nHeusenstamm\n\nDas Registergericht beabsichtigt die im Handelsregister eingetragene Gesellschaft von Amts wegen nach § 394 FamFG zu löschen. Die Frist zur Erhebung eines Widerspruchs gegen die beabsichtigte Löschung wird auf 3 Monate festgesetzt."
    },
    {
      "date": "2025-12-17",
      "id": "140360",
      "original_text": "Löschungsankündigung\nHessen Amtsgericht Darmstadt HRB 54142\nWEKEM GmbH – Viernheim",
      "type": "Löschungsankündigung",
      "state": "Hessen",
      "amtsgericht": "Amtsgericht Darmstadt",
      "registernummer": "HRB 54142",
      "registerart": "HRB",
      "company_name": "WEKEM GmbH",
      "company_seat": "Viernheim",
      "details": "17.12.2025 (Bekanntmachungsdatum)\n\nHessen Amtsgericht Darmstadt HRB 54142\nLöschungsankündigung\n\nWEKEM GmbH\nGesellschaft mit beschränkter Haftung\nViernheim\n\nDas Registergericht beabsichtigt die im Handelsregister eingetragene Gesellschaft von Amts wegen nach § 394 FamFG zu löschen. Die Frist zur Erhebung eines Widerspruchs gegen die beabsichtigte Löschung wird auf drei Monate festgesetzt."
    },
    {
      "date": "2025-12-17",
      "id": "140361",
      "original_text": "Einreichung neuer Dokumente\nHessen Amtsgericht Frankfurt am Main HRB 107941\nLCC Reisebüro Aktiengesellschaft – Frankfurt am Main",
      "type": "Einreichung neuer Dokumente",
      "state": "Hessen",
      "amtsgericht": "Amtsgericht Frankfurt am Main",
      "registernummer": "HRB 107941",
      "registerart": "HRB",
      "company_name": "LCC Reisebüro Aktiengesellschaft",
      "company_seat": "Frankfurt am Main",
      "details": "17.12.2025 (Bekanntmachungsdatum)\n\nHessen Amtsgericht Frankfurt am Main HRB 107941\nEinreichung neuer Dokumente\n\nLCC Reisebüro Aktiengesellschaft\nAktiengesellschaft\nFrankfurt am Main\n\nDurch eine Änderung in den Personen der Aufsichtsratsmitglieder ist eine Liste der Mitglieder des Aufsichtsrates zum Handelsregister eingereicht worden."
    },
    {
      "date": "2025-12-17",
      "id": "140362",
      "original_text": "Registerbekanntmachung nach dem Umwandlungsgesetz\nHessen Amtsgericht Kassel HRB 15345\nFinmacS Verwaltungs-GmbH – Kassel",
      "type": "Registerbekanntmachung nach dem Umwandlungsgesetz",
      "state": "Hessen",
      "amtsgericht": "Amtsgericht Kassel",
      "registernummer": "HRB 15345",
      "registerart": "HRB",
      "company_name": "FinmacS Verwaltungs-GmbH",
      "company_seat": "Kassel",
      "details": "17.12.2025 (Bekanntmachungsdatum)\n\nHessen Amtsgericht Kassel HRB 15345\nRegisterbekanntmachung nach dem Umwandlungsgesetz 17.12.2025 (Eintragungsdatum)\n\nFinmacS Verwaltungs-GmbH\nGesellschaft mit beschränkter Haftung\nKassel\n\nDen Gläubigern der an der Verschmelzung beteiligten Rechtsträger ist, wenn sie binnen sechs Monaten nach dem Tag, an dem die Eintragung der Verschmelzung in das Register des Sitzes desjenigen Rechtsträgers, dessen Gläubiger sie sind, nach § 19 Absatz 3 UmwG bekannt gemacht worden ist, ihren Anspruch nach Grund und Höhe schriftlich anmelden, Sicherheit zu leisten, soweit sie nicht Befriedigung verlangen können. Dieses Recht steht den Gläubigern jedoch nur zu, wenn sie glaubhaft machen, dass durch die Verschmelzung die Erfüllung ihrer Forderung gefährdet wird."
    },
    {
      "date": "2025-12-17",
      "id": "140363",
      "original_text": "Registerbekanntmachung nach dem Umwandlungsgesetz\nHessen Amtsgericht Frankfurt am Main HRB 35037\nWeroba-Ingenieurgesellschaft mbH – Frankfurt am Main",
      "type": "Registerbekanntmachung nach dem Umwandlungsgesetz",
      "state": "Hessen",
      "amtsgericht": "Amtsgericht Frankfurt am Main",
      "registernummer": "HRB 35037",
      "registerart": "HRB",
      "company_name": "Weroba-Ingenieurgesellschaft mbH",
      "company_seat": "Frankfurt am Main",
      "details": "17.12.2025 (Bekanntmachungsdatum)\n\nHessen Amtsgericht Frankfurt am Main HRB 35037\nRegisterbekanntmachung nach dem Umwandlungsgesetz 17.12.2025 (Eintragungsdatum)\n\nWeroba-Ingenieurgesellschaft mbH\nGesellschaft mit beschränkter Haftung\nFrankfurt am Main\n\nDen Gläubigern der an der Verschmelzung beteiligten Rechtsträger ist, wenn sie binnen sechs Monaten nach dem Tag, an dem die Eintragung der Verschmelzung in das Register des Sitzes desjenigen Rechtsträgers, dessen Gläubiger sie sind, nach § 19 Absatz 3 UmwG bekannt gemacht worden ist, ihren Anspruch nach Grund und Höhe schriftlich anmelden, Sicherheit zu leisten, soweit sie nicht Befriedigung verlangen können. Dieses Recht steht den Gläubigern jedoch nur zu, wenn sie glaubhaft machen, dass durch die Verschmelzung die Erfüllung ihrer Forderung gefährdet wird."
    },
    {
      "date": "2025-12-17",
      "id": "140364",
      "original_text": "Löschungsankündigung\nHessen Amtsgericht Darmstadt HRB 91405\nDISKUS Dreihundertvierundneunzigste GmbH – Fischbachtal",
      "type": "Löschungsankündigung",
      "state": "Hessen",
      "amtsgericht": "Amtsgericht Darmstadt",
      "registernummer": "HRB 91405",
      "registerart": "HRB",
      "company_name": "DISKUS Dreihundertvierundneunzigste GmbH",
      "company_seat": "Fischbachtal",
      "details": "17.12.2025 (Bekanntmachungsdatum)\n\nHessen Amtsgericht Darmstadt HRB 91405\nLöschungsankündigung\n\nDISKUS Dreihundertvierundneunzigste GmbH\nGesellschaft mit beschränkter Haftung\nFischbachtal\n\nDas Registergericht beabsichtigt die im Handelsregister eingetragene Gesellschaft von Amts wegen nach § 394 FamFG zu löschen. Die Frist zur Erhebung eines Widerspruchs gegen die beabsichtigte Löschung wird auf 3 Monate festgesetzt."
    },
    {
      "date": "2025-12-17",
      "id": "140365",
      "original_text": "Sonstige Registerbekanntmachung\nHessen Amtsgericht Frankfurt am Main HRB 52086\nDFL Deutsche Fußball Liga GmbH – Frankfurt am Main",
      "type": "Sonstige Registerbekanntmachung",
      "state": "Hessen",
      "amtsgericht": "Amtsgericht Frankfurt am Main",
      "registernummer": "HRB 52086",
      "registerart": "HRB",
      "company_name": "DFL Deutsche Fußball Liga GmbH",
      "company_seat": "Frankfurt am Main",
      "details": "17.12.2025 (Bekanntmachungsdatum)\n\nHessen Amtsgericht Frankfurt am Main HRB 52086\nSonstige Registerbekanntmachung 17.12.2025 (Eintragungsdatum)\n\nDFL Deutsche Fußball Liga GmbH\nGesellschaft mit beschränkter Haftung\nFrankfurt am Main\n\nDurch eine Änderung in den Personen der Aufsichtsratsmitglieder ist eine Liste der Mitglieder des Aufsichtsrates zum Handelsregister eingereicht worden."
    },
    {
      "date": "2025-12-17",
      "id": "140366",
      "original_text": "Löschungsankündigung\nHessen Amtsgericht Offenbach am Main HRB 9300\nRS Airfreight Service Spedition Gesellschaft mit beschränkter Haftung – Neu-Isenburg",
      "type": "Löschungsankündigung",
      "state": "Hessen",
      "amtsgericht": "Amtsgericht Offenbach am Main",
      "registernummer": "HRB 9300",
      "registerart": "HRB",
      "company_name": "RS Airfreight Service Spedition Gesellschaft mit beschränkter Haftung",
      "company_seat": "Neu-Isenburg",
      "details": "17.12.2025 (Bekanntmachungsdatum)\n\nHessen Amtsgericht Offenbach am Main HRB 9300\nLöschungsankündigung\n\nRS Airfreight Service Spedition Gesellschaft mit beschränkter Haftung\nGesellschaft mit beschränkter Haftung\nNeu-Isenburg\n\nDas Registergericht beabsichtigt die im Handelsregister eingetragene Gesellschaft von Amts wegen nach § 394 FamFG zu löschen. Die Frist zur Erhebung eines Widerspruchs gegen die beabsichtigte Löschung wird auf 3 Monate festgesetzt."
    },
    {
      "date": "2025-12-17",
      "id": "140367",
      "original_text": "Löschungsankündigung\nHessen Amtsgericht Offenbach am Main HRA 41141\nRoyal Reifen und Fahrzeugtechnik GmbH & Co KG – Neu-Isenburg",
      "type": "Löschungsankündigung",
      "state": "Hessen",
      "amtsgericht": "Amtsgericht Offenbach am Main",
      "registernummer": "HRA 41141",
      "registerart": "HRA",
      "company_name": "Royal Reifen und Fahrzeugtechnik GmbH & Co KG",
      "company_seat": "Neu-Isenburg",
      "details": "17.12.2025 (Bekanntmachungsdatum)\n\nHessen Amtsgericht Offenbach am Main HRA 41141\nLöschungsankündigung\n\nRoyal Reifen und Fahrzeugtechnik GmbH & Co KG\nKommanditgesellschaft\nNeu-Isenburg\n\nDas Registergericht beabsichtigt die im Handelsregister eingetragene Firma von Amts wegen nach § 394 FamFG zu löschen. Die Frist zur Erhebung eines Widerspruchs gegen die beabsichtigte Löschung wird auf 3 Monate festgesetzt."
    },
    {
      "date": "2025-12-17",
      "id": "140368",
      "original_text": "Löschungsankündigung\nHessen Amtsgericht Wiesbaden HRB 34280\nELEGANCE Bauservice GmbH – Wiesbaden",
      "type": "Löschungsankündigung",
      "state": "Hessen",
      "amtsgericht": "Amtsgericht Wiesbaden",
      "registernummer": "HRB 34280",
      "registerart": "HRB",
      "company_name": "ELEGANCE Bauservice GmbH",
      "company_seat": "Wiesbaden",
      "details": "17.12.2025 (Bekanntmachungsdatum)\n\nHessen Amtsgericht Wiesbaden HRB 34280\nLöschungsankündigung\n\nELEGANCE Bauservice GmbH\nGesellschaft mit beschränkter Haftung\nWiesbaden\n\nDas Registergericht beabsichtigt die im Handelsregister eingetragene Gesellschaft von Amts wegen nach § 394 FamFG zu löschen. Die Frist zur Erhebung eines Widerspruchs gegen die beabsichtigte Löschung wird auf 3 Monate festgesetzt."
    },
    {
      "date": "2025-12-17",
      "id": "140369",
      "original_text": "Einreichung neuer Dokumente\nHessen Amtsgericht Frankfurt am Main HRB 139004\nTechem Holding GmbH – Frankfurt am Main",
      "type": "Einreichung neuer Dokumente",
      "state": "Hessen",
      "amtsgericht": "Amtsgericht Frankfurt am Main",
      "registernummer": "HRB 139004",
      "registerart": "HRB",
      "company_name": "Techem Holding GmbH",
      "company_seat": "Frankfurt am Main",
      "details": "17.12.2025 (Bekanntmachungsdatum)\n\nHessen Amtsgericht Frankfurt am Main HRB 139004\nEinreichung neuer Dokumente 15.12.2025 (Eintragungsdatum)\n\nTechem Holding GmbH\nGesellschaft mit beschränkter Haftung\nFrankfurt am Main\n\nDie Gesellschaft hat den Entwurf eines Verschmelzungsplanes über eine\ngrenzüberschreitende Verschmelzung zum Handelsregister eingereicht.\n2. An der grenzüberschreitenden Verschmelzung sind beteiligt:\na. Als übertragende Gesellschaft die Luxembourg Investment Company 261 S.a r.l.,\neine nach dem Recht des Grossherzogtums Luxemburg errichtete societe a\nresponsabilite limitee mit Sitz in 35D Avenue J.F. Kennedy, 1855 Luxembourg;\nb. Als übernehmende Gesellschaft die Techem Holding GmbH, mit ihrem\nGesellschaftssitz in Frankfurt an Main, Bundesrepublik Deutschland und mit der\nGeschäftsanschrift Eschersheimer Landstrasse 14, 60322 Frankfurt am Main.\n3. Die Gesellschaften sind wie folgt eingetragen:\nc. Die Luxembourg Investment Company 261 S.a r.l., ist im Luxemburgischen\nHandels- und Gesellschaftsregister - Registre de Commerce et des Societes unter\nder Handelsregisternummer B222373 eingetragen.\nd. Die Techem Holding GmbH ist im Handelsregister des Amtsgerichts Frankfurt am\nMain unter der Handelsregisternummer 139004 eingetragen.\n4. Ferner wird auf Folgendes hingewiesen:\na. Die Anteilsinhaber und Gläubiger der übertragenden Gesellschaft Luxembourg\nInvestment Company 261 S.a r.l. und der übernehmenden Gesellschaft Techem\nHolding GmbH können bis spätestens fünf Arbeitstage vor dem Tag der\nGesellschafterversammlung Bemerkungen zum Verschmelzungsplan übermitteln.\nb. Weder die übertragende Gesellschaft Luxembourg Investment Company 261 S.a r.l.\nnoch die übernehmende Gesellschaft Techem Holding GmbH beschäftigen\nArbeitnehmer, es bestehen somit auch keine Gesamtbetriebsräte, Betriebsräte oder\nanderweitige Arbeitnehmervertretungsorgane bei den an der Verschmelzung\nbeteiligten Gesellschaften. Ein Hinweis an die entsprechenden Personen, dass sie\nBemerkungen zum Verschmelzungsplan übermitteln können, entfällt somit.\nErgänzend wird auf Folgendes hingewiesen:\nc. Die Gesellschafterversammlung der übernehmenden Gesellschaft Techem Holding\nGmbH wird nicht vor Ablauf eines Monats nach Bekanntmachung dieses\nHinweises gemäss Paragraph 10 HGB, voraussichtlich am 14. Januar 2026, über\ndie grenzüberschreitende Verschmelzung durch Aufnahme der Luxembourg\nInvestment Company 261 S.a r.l. als übertragende Gesellschaft auf die Techem\nHolding GmbH als übernehmende Gesellschaft beschliessen. Bemerkungen können\ndaher voraussichtlich bis zum 7. Januar 2026, 24:00 Uhr MEZ an die Techem\nHolding GmbH, z.Hdn. der Geschäftsleitung,\n- postalisch an die Geschäftsanschrift der übernehmenden Gesellschaft:\nEschersheimer Landstrasse 14, 60322 Frankfurt am Main, Deutschland,\nübermittelt oder\n- per E-Mail an data-roomattechem.de gesendet werden\nUnter diesen Kontaktdaten können im Übrigen vollständige Auskünfte über die\nModalitäten für die Ausübung der Rechte der Gläubiger und Arbeitnehmer eingeholt\nwerden.\nd. Die Gesellschafterversammlung der übertragenden Gesellschaft Luxembourg\nInvestment Company 261 S.a r.l. wird nicht vor Ablauf eines Monats nach\nBekanntmachung des nach den betreffenden Vorschriften Luxemburgischen Rechts\nzu veröffentlichenden Hinweises im Amtsblatt des Grossherzogtums Luxemburg -\nMemorial, Journal Officiel du Grand-Duche de Luxembourg, voraussichtlich\nebenfalls am 14. Januar 2026, über die grenzüberschreitende Verschmelzung\ndurch Aufnahme der Luxembourg Investment Company 261 S.a r.l. als\nübertragende Gesellschaft auf die Techem Holding GmbH als übernehmende\nGesellschaft beschliessen. Bemerkungen können daher ebenfalls voraussichtlich bis\nzum 7. Januar 2026, 24:00 Uhr MEZ an die Luxembourg Investment Company 261\nS.a r.l., z.Hdn. der Geschäftsleitung - Board of Directors,\n- postalisch an die Geschäftsanschrift der übertragenden Gesellschaft:\n35D Avenue J.F. Kennedy, 1855 Luxembourg, Deutschland, übermittelt\noder\n- per Email an data-roomattechem gesendet werden.\nUnter diesen Kontaktdaten können im Übrigen vollständige Auskünfte über die\nModalitäten für die Ausübung der Rechte der Gläubiger und Arbeitnehmer eingeholt\nwerden."
    },
    {
      "date": "2025-12-17",
      "id": "140370",
      "original_text": "Löschungsankündigung\nHessen Amtsgericht Offenbach am Main HRB 51001\nTriple iii Trading UG (haftungsbeschränkt) – Rödermark",
      "type": "Löschungsankündigung",
      "state": "Hessen",
      "amtsgericht": "Amtsgericht Offenbach am Main",
      "registernummer": "HRB 51001",
      "registerart": "HRB",
      "company_name": "Triple iii Trading UG (haftungsbeschränkt)",
      "company_seat": "Rödermark",
      "details": "17.12.2025 (Bekanntmachungsdatum)\n\nHessen Amtsgericht Offenbach am Main HRB 51001\nLöschungsankündigung\n\nTriple iii Trading UG (haftungsbeschränkt)\nGesellschaft mit beschränkter Haftung\nRödermark\n\nDas Registergericht beabsichtigt die im Handelsregister eingetragene Gesellschaft von Amts wegen nach § 394 FamFG zu löschen. Die Frist zur Erhebung eines Widerspruchs gegen die beabsichtigte Löschung wird auf 3 Monate festgesetzt."
    },
    {
      "date": "2025-12-17",
      "id": "140371",
      "original_text": "Löschungsankündigung\nHessen Amtsgericht Offenbach am Main HRB 52784\nMina Dienstleistung GmbH – Langen (Hessen)",
      "type": "Löschungsankündigung",
      "state": "Hessen",
      "amtsgericht": "Amtsgericht Offenbach am Main",
      "registernummer": "HRB 52784",
      "registerart": "HRB",
      "company_name": "Mina Dienstleistung GmbH",
      "company_seat": "Langen (Hessen)",
      "details": "17.12.2025 (Bekanntmachungsdatum)\n\nHessen Amtsgericht Offenbach am Main HRB 52784\nLöschungsankündigung\n\nMina Dienstleistung GmbH\nGesellschaft mit beschränkter Haftung\nLangen (Hessen)\n\nDas Registergericht beabsichtigt die im Handelsregister eingetragene Gesellschaft von Amts wegen nach § 394 FamFG zu löschen. Die Frist zur Erhebung eines Widerspruchs gegen die beabsichtigte Löschung wird auf 3 Monate festgesetzt."
    },
    {
      "date": "2025-12-17",
      "id": "140372",
      "original_text": "Löschungsankündigung\nHessen Amtsgericht Darmstadt HRB 104410\nFritsch Dienstleistungs GmbH – Darmstadt",
      "type": "Löschungsankündigung",
      "state": "Hessen",
      "amtsgericht": "Amtsgericht Darmstadt",
      "registernummer": "HRB 104410",
      "registerart": "HRB",
      "company_name": "Fritsch Dienstleistungs GmbH",
      "company_seat": "Darmstadt",
      "details": "17.12.2025 (Bekanntmachungsdatum)\n\nHessen Amtsgericht Darmstadt HRB 104410\nLöschungsankündigung\n\nFritsch Dienstleistungs GmbH\nGesellschaft mit beschränkter Haftung\nDarmstadt\n\nDas Registergericht beabsichtigt die im Handelsregister eingetragene Gesellschaft von Amts wegen nach § 394 FamFG zu löschen. Die Frist zur Erhebung eines Widerspruchs gegen die beabsichtigte Löschung wird auf 3 Monate festgesetzt."
    },
    {
      "date": "2025-12-17",
      "id": "140373",
      "original_text": "Registerbekanntmachung nach dem Umwandlungsgesetz\nHessen Amtsgericht Kassel HRA 16999\nFinmacS GmbH & Co. KG – Niestetal",
      "type": "Registerbekanntmachung nach dem Umwandlungsgesetz",
      "state": "Hessen",
      "amtsgericht": "Amtsgericht Kassel",
      "registernummer": "HRA 16999",
      "registerart": "HRA",
      "company_name": "FinmacS GmbH & Co. KG",
      "company_seat": "Niestetal",
      "details": "17.12.2025 (Bekanntmachungsdatum)\n\nHessen Amtsgericht Kassel HRA 16999\nRegisterbekanntmachung nach dem Umwandlungsgesetz 17.12.2025 (Eintragungsdatum)\n\nFinmacS GmbH & Co. KG\nKommanditgesellschaft\nNiestetal\n\nDen Gläubigern der an der Verschmelzung beteiligten Rechtsträger ist, wenn sie binnen sechs Monaten nach dem Tag, an dem die Eintragung der Verschmelzung in das Register des Sitzes desjenigen Rechtsträgers, dessen Gläubiger sie sind, nach § 19 Absatz 3 UmwG bekannt gemacht worden ist, ihren Anspruch nach Grund und Höhe schriftlich anmelden, Sicherheit zu leisten, soweit sie nicht Befriedigung verlangen können. Dieses Recht steht den Gläubigern jedoch nur zu, wenn sie glaubhaft machen, dass durch die Verschmelzung die Erfüllung ihrer Forderung gefährdet wird."
    },
    {
      "date": "2025-12-17",
      "id": "140374",
      "original_text": "Sonstige Registerbekanntmachung\nHessen Amtsgericht Wetzlar VR 4378\nMissionstreetwork e.V. – Eschenburg",
      "type": "Sonstige Registerbekanntmachung",
      "state": "Hessen",
      "amtsgericht": "Amtsgericht Wetzlar",
      "registernummer": "VR 4378",
      "registerart": "VR",
      "company_name": "Missionstreetwork e.V.",
      "company_seat": "Eschenburg",
      "details": "17.12.2025 (Bekanntmachungsdatum)\n\nHessen Amtsgericht Wetzlar VR 4378\nSonstige Registerbekanntmachung 17.12.2025 (Eintragungsdatum)\n\nMissionstreetwork e.V.\neingetragener Verein\nEschenburg\n\nDer Verein ist aufgelöst."
    },
    {
      "date": "2025-12-17",
      "id": "140375",
      "original_text": "Registerbekanntmachung nach dem Umwandlungsgesetz\nHessen Amtsgericht Kassel HRB 19164\nEVB GmbH – Niestetal",
      "type": "Registerbekanntmachung nach dem Umwandlungsgesetz",
      "state": "Hessen",
      "amtsgericht": "Amtsgericht Kassel",
      "registernummer": "HRB 19164",
      "registerart": "HRB",
      "company_name": "EVB GmbH",
      "company_seat": "Niestetal",
      "details": "17.12.2025 (Bekanntmachungsdatum)\n\nHessen Amtsgericht Kassel HRB 19164\nRegisterbekanntmachung nach dem Umwandlungsgesetz 17.12.2025 (Eintragungsdatum)\n\nEVB GmbH\nGesellschaft mit beschränkter Haftung\nNiestetal\n\nDen Gläubigern der an der Verschmelzung beteiligten Rechtsträger ist, wenn sie binnen sechs Monaten nach dem Tag, an dem die Eintragung der Verschmelzung in das Register des Sitzes desjenigen Rechtsträgers, dessen Gläubiger sie sind, nach § 19 Absatz 3 UmwG bekannt gemacht worden ist, ihren Anspruch nach Grund und Höhe schriftlich anmelden, Sicherheit zu leisten, soweit sie nicht Befriedigung verlangen können. Dieses Recht steht den Gläubigern jedoch nur zu, wenn sie glaubhaft machen, dass durch die Verschmelzung die Erfüllung ihrer Forderung gefährdet wird."
    },
    {
      "date": "2025-12-17",
      "id": "140376",
      "original_text": "Löschungsankündigung\nHessen Amtsgericht Offenbach am Main HRA 43071\nH & K Logistik GmbH & Co. KG – Neu-Isenburg",
      "type": "Löschungsankündigung",
      "state": "Hessen",
      "amtsgericht": "Amtsgericht Offenbach am Main",
      "registernummer": "HRA 43071",
      "registerart": "HRA",
      "company_name": "H & K Logistik GmbH & Co. KG",
      "company_seat": "Neu-Isenburg",
      "details": "17.12.2025 (Bekanntmachungsdatum)\n\nHessen Amtsgericht Offenbach am Main HRA 43071\nLöschungsankündigung\n\nH & K Logistik GmbH & Co. KG\nKommanditgesellschaft\nNeu-Isenburg\n\nDas Registergericht beabsichtigt die im Handelsregister eingetragene Firma von Amts wegen nach § 394 FamFG zu löschen. Die Frist zur Erhebung eines Widerspruchs gegen die beabsichtigte Löschung wird auf 3 Monate festgesetzt."
    },
    {
      "date": "2025-12-17",
      "id": "140377",
      "original_text": "Löschungsankündigung\nHessen Amtsgericht Hanau HRB 96272\nWertpappe Ba. UG (haftungsbeschränkt) – Gründau",
      "type": "Löschungsankündigung",
      "state": "Hessen",
      "amtsgericht": "Amtsgericht Hanau",
      "registernummer": "HRB 96272",
      "registerart": "HRB",
      "company_name": "Wertpappe Ba. UG (haftungsbeschränkt)",
      "company_seat": "Gründau",
      "details": "17.12.2025 (Bekanntmachungsdatum)\n\nHessen Amtsgericht Hanau HRB 96272\nLöschungsankündigung\n\nWertpappe Ba. UG (haftungsbeschränkt)\nGesellschaft mit beschränkter Haftung\nGründau\n\nDas Registergericht beabsichtigt die im Handelsregister eingetragene Gesellschaft von Amts wegen nach § 394 FamFG zu löschen. Die Frist zur Erhebung eines Widerspruchs gegen die beabsichtigte Löschung wird auf 3 Monate festgesetzt."
    },
    {
      "date": "2025-12-17",
      "id": "140378",
      "original_text": "Einreichung neuer Dokumente\nHessen Amtsgericht Hanau HRB 6900\nStadtverkehr Maintal GmbH – Maintal",
      "type": "Einreichung neuer Dokumente",
      "state": "Hessen",
      "amtsgericht": "Amtsgericht Hanau",
      "registernummer": "HRB 6900",
      "registerart": "HRB",
      "company_name": "Stadtverkehr Maintal GmbH",
      "company_seat": "Maintal",
      "details": "17.12.2025 (Bekanntmachungsdatum)\n\nHessen Amtsgericht Hanau HRB 6900\nEinreichung neuer Dokumente\n\nStadtverkehr Maintal GmbH\nGesellschaft mit beschränkter Haftung\nMaintal\n\nDurch eine Änderung in den Personen der Aufsichtsratsmitglieder ist eine Liste der Mitglieder des Aufsichtsrates zum Handelsregister eingereicht worden."
    }
  ]
}