{
  "date": "2025-12-15",
  "date_of_scrape": "2025-12-16T04:18:57.830Z",
  "tool_version": "0.2.0",
  "number_of_announcements": 119,
  "announcements": [
    {
      "date": "2025-12-15",
      "id": "139923",
      "original_text": "Registerbekanntmachung nach dem Umwandlungsgesetz\nBerlin Amtsgericht Berlin (Charlottenburg) HRB 267481\nVetagnos GmbH – Berlin",
      "type": "Registerbekanntmachung nach dem Umwandlungsgesetz",
      "state": "Berlin",
      "amtsgericht": "Amtsgericht Berlin (Charlottenburg)",
      "registernummer": "HRB 267481",
      "registerart": "HRB",
      "company_name": "Vetagnos GmbH",
      "company_seat": "Berlin",
      "details": "15.12.2025 (Bekanntmachungsdatum)\n\nBerlin Amtsgericht Berlin (Charlottenburg) HRB 267481\nRegisterbekanntmachung nach dem Umwandlungsgesetz 11.12.2025 (Eintragungsdatum)\n\nVetagnos GmbH\nGesellschaft mit beschränkter Haftung\nBerlin\n\nZu Eintragungsnummer 5 vom 11.12.2025 wird als nicht eingetragen veröffentlicht: Den Gläubigern der an der Verschmelzung beteiligten Rechtsträger ist, wenn sie binnen sechs Monaten nach dem Tag, an dem die Eintragung der Verschmelzung in das Register des Sitzes desjenigen Rechtsträgers, dessen Gläubiger sie sind, als bekannt gemacht gilt, ihren Anspruch nach Grund und Höhe schriftlich anmelden, Sicherheit zu leisten, soweit sie nicht Befriedigung verlangen können. Dieses Recht steht den Gläubigern jedoch nur zu, wenn sie glaubhaft machen, dass durch die Verschmelzung die Erfüllung ihrer Forderung gefährdet wird. Das Recht, Sicherheitsleistung zu verlangen, steht Gläubigern nicht zu, die im Falle der Insolvenz ein Recht auf vorzugsweise Befriedigung aus einer Deckungsmasse haben, die nach gesetzlicher Vorschrift zu ihrem Schutz errichtet und staatlich überwacht ist."
    },
    {
      "date": "2025-12-15",
      "id": "139924",
      "original_text": "Löschungsankündigung\nBerlin Amtsgericht Berlin (Charlottenburg) HRB 85417\nBMC - Business and Management Consultant GmbH – Berlin",
      "type": "Löschungsankündigung",
      "state": "Berlin",
      "amtsgericht": "Amtsgericht Berlin (Charlottenburg)",
      "registernummer": "HRB 85417",
      "registerart": "HRB",
      "company_name": "BMC - Business and Management Consultant GmbH",
      "company_seat": "Berlin",
      "details": "15.12.2025 (Bekanntmachungsdatum)\n\nBerlin Amtsgericht Berlin (Charlottenburg) HRB 85417\nLöschungsankündigung\n\nBMC - Business and Management Consultant GmbH\nGesellschaft mit beschränkter Haftung\nBerlin\n\nBei der nachstehenden Gesellschaft wird das Amtslöschungsverfahren gemäß § 394 FamFG eingeleitet. Widerspruchsfrist\n6 Wochen."
    },
    {
      "date": "2025-12-15",
      "id": "139925",
      "original_text": "Löschungsankündigung\nBerlin Amtsgericht Berlin (Charlottenburg) HRB 163424\nBaucubic GmbH – Berlin",
      "type": "Löschungsankündigung",
      "state": "Berlin",
      "amtsgericht": "Amtsgericht Berlin (Charlottenburg)",
      "registernummer": "HRB 163424",
      "registerart": "HRB",
      "company_name": "Baucubic GmbH",
      "company_seat": "Berlin",
      "details": "15.12.2025 (Bekanntmachungsdatum)\n\nBerlin Amtsgericht Berlin (Charlottenburg) HRB 163424\nLöschungsankündigung\n\nBaucubic GmbH\nGesellschaft mit beschränkter Haftung\nBerlin\n\nBei der nachstehenden Gesellschaft wird das Amtslöschungsverfahren gemäß § 394 FamFG eingeleitet. Widerspruchsfrist\n6 Wochen."
    },
    {
      "date": "2025-12-15",
      "id": "139926",
      "original_text": "Registerbekanntmachung nach dem Umwandlungsgesetz\nBerlin Amtsgericht Berlin (Charlottenburg) HRB 37953\nRAW Value 1 GmbH – Berlin",
      "type": "Registerbekanntmachung nach dem Umwandlungsgesetz",
      "state": "Berlin",
      "amtsgericht": "Amtsgericht Berlin (Charlottenburg)",
      "registernummer": "HRB 37953",
      "registerart": "HRB",
      "company_name": "RAW Value 1 GmbH",
      "company_seat": "Berlin",
      "details": "15.12.2025 (Bekanntmachungsdatum)\n\nBerlin Amtsgericht Berlin (Charlottenburg) HRB 37953\nRegisterbekanntmachung nach dem Umwandlungsgesetz 13.12.2025 (Eintragungsdatum)\n\nRAW Value 1 GmbH\nGesellschaft mit beschränkter Haftung\nBerlin\n\nZu Eintragungsnummer 15 vom 13.12.2025 wird als nicht eingetragen veröffentlicht:\n\nDen Gläubigern der an den jeweiligen Verschmelzungen beteiligten Rechtsträgern ist, wenn sie binnen sechs Monaten nach dem Tag, an dem die Eintragung der jeweiligen Verschmelzung in das Register des Sitzes desjenigen Rechtsträgers, dessen Gläubiger sie sind, als bekannt gemacht gilt, ihren Anspruch nach Grund und Höhe schriftlich anmelden, Sicherheit zu leisten, soweit sie nicht Befriedigung verlangen können. Dieses Recht steht den Gläubigern jedoch nur zu, wenn sie glaubhaft machen, dass durch die Verschmelzung die Erfüllung ihrer Forderung gefährdet wird. Das Recht, Sicherheitsleistung zu verlangen, steht Gläubigern nicht zu, die im Falle der Insolvenz ein Recht auf vorzugsweise Befriedigung aus einer Deckungsmasse haben, die nach gesetzlicher Vorschrift zu ihrem Schutz errichtet und staatlich überwacht ist."
    },
    {
      "date": "2025-12-15",
      "id": "139927",
      "original_text": "Registerbekanntmachung nach dem Umwandlungsgesetz\nBerlin Amtsgericht Berlin (Charlottenburg) HRB 156650\nMETRONOM Verwaltungsgesellschaft mbH – Berlin",
      "type": "Registerbekanntmachung nach dem Umwandlungsgesetz",
      "state": "Berlin",
      "amtsgericht": "Amtsgericht Berlin (Charlottenburg)",
      "registernummer": "HRB 156650",
      "registerart": "HRB",
      "company_name": "METRONOM Verwaltungsgesellschaft mbH",
      "company_seat": "Berlin",
      "details": "15.12.2025 (Bekanntmachungsdatum)\n\nBerlin Amtsgericht Berlin (Charlottenburg) HRB 156650\nRegisterbekanntmachung nach dem Umwandlungsgesetz 13.12.2025 (Eintragungsdatum)\n\nMETRONOM Verwaltungsgesellschaft mbH\nGesellschaft mit beschränkter Haftung\nBerlin\n\nZu Eintragungsnummer 6 vom 13.12.2025 wird als nicht eingetragen veröffentlicht:\n\nDen Gläubigern der an der Verschmelzung beteiligten Rechtsträger ist, wenn sie binnen sechs Monaten nach dem Tag, an dem die Eintragung der Verschmelzung in das Register des Sitzes desjenigen Rechtsträgers, dessen Gläubiger sie sind, als bekannt gemacht gilt, ihren Anspruch nach Grund und Höhe schriftlich anmelden, Sicherheit zu leisten, soweit sie nicht Befriedigung verlangen können. Dieses Recht steht den Gläubigern jedoch nur zu, wenn sie glaubhaft machen, dass durch die Verschmelzung die Erfüllung ihrer Forderung gefährdet wird. Das Recht, Sicherheitsleistung zu verlangen, steht Gläubigern nicht zu, die im Falle der Insolvenz ein Recht auf vorzugsweise Befriedigung aus einer Deckungsmasse haben, die nach gesetzlicher Vorschrift zu ihrem Schutz errichtet und staatlich überwacht ist."
    },
    {
      "date": "2025-12-15",
      "id": "139928",
      "original_text": "Löschungsankündigung\nBaden-Württemberg Amtsgericht Freiburg HRB 724544\nAvantgarde Capital GmbH – Konstanz",
      "type": "Löschungsankündigung",
      "state": "Baden-Württemberg",
      "amtsgericht": "Amtsgericht Freiburg",
      "registernummer": "HRB 724544",
      "registerart": "HRB",
      "company_name": "Avantgarde Capital GmbH",
      "company_seat": "Konstanz",
      "details": "15.12.2025 (Bekanntmachungsdatum)\n\nBaden-Württemberg Amtsgericht Freiburg HRB 724544\nLöschungsankündigung 15.12.2025 (Eintragungsdatum)\n\nAvantgarde Capital GmbH\nGesellschaft mit beschränkter Haftung\nKonstanz\n\nAls nicht eingetragen wird bekanntgemacht:\nDas Gericht beabsichtigt, die Gesellschaft wegen Vermögenslosigkeit im Handelsregister von Amts wegen nach § 394 FamFG zu löschen. Die Frist zur Geltendmachung eines Widerspruchs gegen die beabsichtigte Löschung ist auf einen Monat ab Veröffentlichung bestimmt."
    },
    {
      "date": "2025-12-15",
      "id": "139929",
      "original_text": "Registerbekanntmachung nach dem Umwandlungsgesetz\nBerlin Amtsgericht Berlin (Charlottenburg) HRB 151924\nTRIADE I. Verwaltungsgesellschaft mbH – Berlin",
      "type": "Registerbekanntmachung nach dem Umwandlungsgesetz",
      "state": "Berlin",
      "amtsgericht": "Amtsgericht Berlin (Charlottenburg)",
      "registernummer": "HRB 151924",
      "registerart": "HRB",
      "company_name": "TRIADE I. Verwaltungsgesellschaft mbH",
      "company_seat": "Berlin",
      "details": "15.12.2025 (Bekanntmachungsdatum)\n\nBerlin Amtsgericht Berlin (Charlottenburg) HRB 151924\nRegisterbekanntmachung nach dem Umwandlungsgesetz 13.12.2025 (Eintragungsdatum)\n\nTRIADE I. Verwaltungsgesellschaft mbH\nGesellschaft mit beschränkter Haftung\nBerlin\n\nZu Eintragungsnummer 6 vom 13.12.2025 wird als nicht eingetragen veröffentlicht:\n\nDen Gläubigern der an der Verschmelzung beteiligten Rechtsträger ist, wenn sie binnen sechs Monaten nach dem Tag, an dem die Eintragung der Verschmelzung in das Register des Sitzes desjenigen Rechtsträgers, dessen Gläubiger sie sind, als bekannt gemacht gilt, ihren Anspruch nach Grund und Höhe schriftlich anmelden, Sicherheit zu leisten, soweit sie nicht Befriedigung verlangen können. Dieses Recht steht den Gläubigern jedoch nur zu, wenn sie glaubhaft machen, dass durch die Verschmelzung die Erfüllung ihrer Forderung gefährdet wird. Das Recht, Sicherheitsleistung zu verlangen, steht Gläubigern nicht zu, die im Falle der Insolvenz ein Recht auf vorzugsweise Befriedigung aus einer Deckungsmasse haben, die nach gesetzlicher Vorschrift zu ihrem Schutz errichtet und staatlich überwacht ist."
    },
    {
      "date": "2025-12-15",
      "id": "139930",
      "original_text": "Einreichung neuer Dokumente\nSaarland Amtsgericht Saarbrücken HRB 14913\nBeschäftigungs- und Qualifizierungsgesellschaft im Landkreis Saarlouis - Gemeinnützige Gesellschaft mit beschränkter Haftung – Saarlouis",
      "type": "Einreichung neuer Dokumente",
      "state": "Saarland",
      "amtsgericht": "Amtsgericht Saarbrücken",
      "registernummer": "HRB 14913",
      "registerart": "HRB",
      "company_name": "Beschäftigungs- und Qualifizierungsgesellschaft im Landkreis Saarlouis - Gemeinnützige Gesellschaft mit beschränkter Haftung",
      "company_seat": "Saarlouis",
      "details": "15.12.2025 (Bekanntmachungsdatum)\n\nSaarland Amtsgericht Saarbrücken HRB 14913\nEinreichung neuer Dokumente\n\nBeschäftigungs- und Qualifizierungsgesellschaft im Landkreis Saarlouis - Gemeinnützige Gesellschaft mit beschränkter Haftung\nGesellschaft mit beschränkter Haftung\nSaarlouis\n\nDie Geschäftsführung der Gesellschaft hat eine Liste der Mitglieder des Aufsichtsrats zum Handelsregister eingereicht (§ 52 Abs. 3 Satz 2 GmbHG)."
    },
    {
      "date": "2025-12-15",
      "id": "139931",
      "original_text": "Löschungsankündigung\nBerlin Amtsgericht Berlin (Charlottenburg) HRB 171315\nA & A Events UG (haftungsbeschränkt) – Berlin",
      "type": "Löschungsankündigung",
      "state": "Berlin",
      "amtsgericht": "Amtsgericht Berlin (Charlottenburg)",
      "registernummer": "HRB 171315",
      "registerart": "HRB",
      "company_name": "A & A Events UG (haftungsbeschränkt)",
      "company_seat": "Berlin",
      "details": "15.12.2025 (Bekanntmachungsdatum)\n\nBerlin Amtsgericht Berlin (Charlottenburg) HRB 171315\nLöschungsankündigung\n\nA & A Events UG (haftungsbeschränkt)\nGesellschaft mit beschränkter Haftung\nBerlin\n\nBei der nachstehenden Gesellschaft wird das Amtslöschungsverfahren gemäß § 394 FamFG eingeleitet. Widerspruchsfrist 6 Wochen"
    },
    {
      "date": "2025-12-15",
      "id": "139932",
      "original_text": "Registerbekanntmachung nach dem Umwandlungsgesetz\nBaden-Württemberg Amtsgericht Freiburg HRB 720195\ne.optimum Energieservice GmbH – Offenburg",
      "type": "Registerbekanntmachung nach dem Umwandlungsgesetz",
      "state": "Baden-Württemberg",
      "amtsgericht": "Amtsgericht Freiburg",
      "registernummer": "HRB 720195",
      "registerart": "HRB",
      "company_name": "e.optimum Energieservice GmbH",
      "company_seat": "Offenburg",
      "details": "15.12.2025 (Bekanntmachungsdatum)\n\nBaden-Württemberg Amtsgericht Freiburg HRB 720195\nRegisterbekanntmachung nach dem Umwandlungsgesetz 15.12.2025 (Eintragungsdatum)\n\ne.optimum Energieservice GmbH\nGesellschaft mit beschränkter Haftung\nOffenburg\n\nAls nicht eingetragen wird bekanntgemacht:\nDen Gläubigern der an der Verschmelzung beteiligten Rechtsträger ist, wenn sie binnen sechs Monaten nach dem Tag, an dem die Eintragung der Verschmelzung in das Register des Sitzes desjenigen Rechtsträgers, dessen Gläubiger sie sind, nach § 19 Abs. 3 UmwG als bekanntgemacht gilt, ihren Anspruch nach Grund und Höhe schriftlich anmelden, Sicherheit zu leisten, soweit sie nicht Befriedigung verlangen können. Dieses Recht steht den Gläubigern jedoch nur zu, wenn sie glaubhaft machen, dass durch die Verschmelzung die Erfüllung ihrer Forderung gefährdet wird."
    },
    {
      "date": "2025-12-15",
      "id": "139933",
      "original_text": "Sonstige Registerbekanntmachung\nBaden-Württemberg Amtsgericht Ulm HRB 660426\nMaschinenbau Lohse GmbH – Heidenheim an der Brenz",
      "type": "Sonstige Registerbekanntmachung",
      "state": "Baden-Württemberg",
      "amtsgericht": "Amtsgericht Ulm",
      "registernummer": "HRB 660426",
      "registerart": "HRB",
      "company_name": "Maschinenbau Lohse GmbH",
      "company_seat": "Heidenheim an der Brenz",
      "details": "15.12.2025 (Bekanntmachungsdatum)\n\nBaden-Württemberg Amtsgericht Ulm HRB 660426\nSonstige Registerbekanntmachung 15.12.2025 (Eintragungsdatum)\n\nMaschinenbau Lohse GmbH\nGesellschaft mit beschränkter Haftung\nHeidenheim an der Brenz\n\nAls nicht eingetragen wird bekanntgemacht:\nDen Gläubigern der Gesellschaft, deren Forderungen begründet worden sind, bevor die Eintragung der Beendigung des Vertrages in das Handelsregister nach § 10 HGB als bekanntgemacht gilt, ist vom anderen Vertragsteil Sicherheit zu leisten, wenn sie sich binnen sechs Monaten nach der Bekanntmachung zu diesem Zweck bei ihm melden."
    },
    {
      "date": "2025-12-15",
      "id": "139934",
      "original_text": "Registerbekanntmachung nach dem Umwandlungsgesetz\nMecklenburg-Vorpommern Amtsgericht Rostock HRA 5569\nChristian Wendt KfZ-Werkstatt e.K. – Sarmstorf",
      "type": "Registerbekanntmachung nach dem Umwandlungsgesetz",
      "state": "Mecklenburg-Vorpommern",
      "amtsgericht": "Amtsgericht Rostock",
      "registernummer": "HRA 5569",
      "registerart": "HRA",
      "company_name": "Christian Wendt KfZ-Werkstatt e.K.",
      "company_seat": "Sarmstorf",
      "details": "15.12.2025 (Bekanntmachungsdatum)\n\nMecklenburg-Vorpommern Amtsgericht Rostock HRA 5569\nRegisterbekanntmachung nach dem Umwandlungsgesetz 15.12.2025 (Eintragungsdatum)\n\nChristian Wendt KfZ-Werkstatt e.K.\nEinzelkaufmann / Einzelkauffrau\nSarmstorf\n\nAls nicht eingetragen wird veröffentlicht: Den Gläubigern der an der Umwandlung beteiligten Rechtsträger ist, wenn sie binnen sechs\nMonaten nach dem Tag, an dem die Eintragung der Umwandlung in das Register des Sitzes desjenigen Rechtsträgers, dessen Gläubiger sie sind, nach § 19 Abs. 3 UmwG als bekannt gemacht gilt, ihren Anspruch nach Grund und Höhe in Textform anmelden, Sicherheit zu leisten, soweit sie nicht Befriedigung verlangen können. Dieses Recht steht den Gläubigern jedoch nur zu, wenn sie glaubhaft machen, dass durch die Umwandlung die Erfüllung der Forderung gefährdet wird."
    },
    {
      "date": "2025-12-15",
      "id": "139935",
      "original_text": "Registerbekanntmachung nach dem Umwandlungsgesetz\nMecklenburg-Vorpommern Amtsgericht Rostock HRA 5616\nKFZ Meisterbetrieb Wendt GmbH & Co. KG – Sarmstorf",
      "type": "Registerbekanntmachung nach dem Umwandlungsgesetz",
      "state": "Mecklenburg-Vorpommern",
      "amtsgericht": "Amtsgericht Rostock",
      "registernummer": "HRA 5616",
      "registerart": "HRA",
      "company_name": "KFZ Meisterbetrieb Wendt GmbH & Co. KG",
      "company_seat": "Sarmstorf",
      "details": "15.12.2025 (Bekanntmachungsdatum)\n\nMecklenburg-Vorpommern Amtsgericht Rostock HRA 5616\nRegisterbekanntmachung nach dem Umwandlungsgesetz 15.12.2025 (Eintragungsdatum)\n\nKFZ Meisterbetrieb Wendt GmbH & Co. KG\nKommanditgesellschaft\nSarmstorf\n\nAls nicht eingetragen wird veröffentlicht: Den Gläubigern der an der Ausgliederung beteiligten Rechtsträger ist, wenn sie binnen sechs Monaten nach dem Tag, an dem die Eintragung der Ausgliederung in das Register des Sitzes desjenigen Rechtsträgers, dessen Gläubiger sie sind, nach § 19 Abs. 3 UmwG als bekannt gemacht gilt, ihren Anspruch nach Grund und Höhe in Textform anmelden,\nSicherheit zu leisten, soweit sie nicht Befriedigung verlangen können. Dieses Recht steht den Gläubigern jedoch nur zu, wenn sie glaubhaft machen, dass durch die Ausgliederung die Erfüllung der Forderung gefährdet wird."
    },
    {
      "date": "2025-12-15",
      "id": "139936",
      "original_text": "Löschungsankündigung\nBaden-Württemberg Amtsgericht Mannheim HRB 722461\nKewo Chemical Trading GmbH – Mannheim",
      "type": "Löschungsankündigung",
      "state": "Baden-Württemberg",
      "amtsgericht": "Amtsgericht Mannheim",
      "registernummer": "HRB 722461",
      "registerart": "HRB",
      "company_name": "Kewo Chemical Trading GmbH",
      "company_seat": "Mannheim",
      "details": "15.12.2025 (Bekanntmachungsdatum)\n\nBaden-Württemberg Amtsgericht Mannheim HRB 722461\nLöschungsankündigung\n\nKewo Chemical Trading GmbH\nGesellschaft mit beschränkter Haftung\nMannheim\n\nAls nicht eingetragen wird bekanntgemacht:\nDas Gericht beabsichtigt, die Gesellschaft wegen Vermögenslosigkeit im Handelsregister von Amts wegen nach § 394 FamFG zu löschen. Die Frist zur Geltendmachung eines Widerspruchs gegen die beabsichtigte Löschung ist auf einen Monat ab Veröffentlichung bestimmt."
    },
    {
      "date": "2025-12-15",
      "id": "139937",
      "original_text": "Löschungsankündigung\nSaarland Amtsgericht Saarbrücken HRB 103236\nH&B liefert GmbH – Saarbrücken",
      "type": "Löschungsankündigung",
      "state": "Saarland",
      "amtsgericht": "Amtsgericht Saarbrücken",
      "registernummer": "HRB 103236",
      "registerart": "HRB",
      "company_name": "H&B liefert GmbH",
      "company_seat": "Saarbrücken",
      "details": "15.12.2025 (Bekanntmachungsdatum)\n\nSaarland Amtsgericht Saarbrücken HRB 103236\nLöschungsankündigung 08.01.2020 (Eintragungsdatum)\n\nH&B liefert GmbH\nGesellschaft mit beschränkter Haftung\nSaarbrücken\n\nEs ist beabsichtigt, die Gesellschaft von Amts wegen gemäß § 394 FamFG wegen Vermögenslosigkeit zu löschen.\nGegen die Löschung von Amts wegen ist das Rechtsmittel des Widerspruchs statthaft. Der Widerspruch ist binnen einer Frist zwei Monaten beginnend mit dem Tag dieser Veröffentlichung durch Einreichen eines Widerspruchsschreibens -schriftlich oder zur Niederschrift der Geschäftsstelle beim Amtsgericht Saarbrücken, -zentrales Handelsregister-, Mainzerstr.178, 66121 Saarbrücken einzulegen.\nDer Widerspruch muss die Bezeichnung der angefochtenen Löschungsankündigung enthalten sowie die Erklärung, dass Widerspruch eingelegt wird. Er ist vom Widerspruchsführer oder seinem Bevollmächtigten zu unterzeichnen.\nDas Widerspruchsschreiben kann auch in der Form eines elektronischen Dokumentes eingereicht werden, das mit einer qualifizierten elektronischen Signatur nach dem Signaturgesetz versehen sein muss (§§ 14 Abs. 2 FamFG, 130a, 298 ZPO)."
    },
    {
      "date": "2025-12-15",
      "id": "139938",
      "original_text": "Löschungsankündigung\nBerlin Amtsgericht Berlin (Charlottenburg) HRB 215236\nHuestle UG (haftungsbeschränkt) – Berlin",
      "type": "Löschungsankündigung",
      "state": "Berlin",
      "amtsgericht": "Amtsgericht Berlin (Charlottenburg)",
      "registernummer": "HRB 215236",
      "registerart": "HRB",
      "company_name": "Huestle UG (haftungsbeschränkt)",
      "company_seat": "Berlin",
      "details": "15.12.2025 (Bekanntmachungsdatum)\n\nBerlin Amtsgericht Berlin (Charlottenburg) HRB 215236\nLöschungsankündigung\n\nHuestle UG (haftungsbeschränkt)\nGesellschaft mit beschränkter Haftung\nBerlin\n\nBei der nachstehenden Gesellschaft wird das Amtslöschungsverfahren gemäß § 394 FamFG eingeleitet. Widerspruchsfrist 6 Wochen"
    },
    {
      "date": "2025-12-15",
      "id": "139939",
      "original_text": "Löschungsankündigung\nBerlin Amtsgericht Berlin (Charlottenburg) HRB 189290\nZaisan Consultancy GmbH – Berlin",
      "type": "Löschungsankündigung",
      "state": "Berlin",
      "amtsgericht": "Amtsgericht Berlin (Charlottenburg)",
      "registernummer": "HRB 189290",
      "registerart": "HRB",
      "company_name": "Zaisan Consultancy GmbH",
      "company_seat": "Berlin",
      "details": "15.12.2025 (Bekanntmachungsdatum)\n\nBerlin Amtsgericht Berlin (Charlottenburg) HRB 189290\nLöschungsankündigung\n\nZaisan Consultancy GmbH\nGesellschaft mit beschränkter Haftung\nBerlin\n\nBei der nachstehenden Gesellschaft wird das Amtslöschungsverfahren gemäß § 394 FamFG eingeleitet. Widerspruchsfrist: 6 Wochen."
    },
    {
      "date": "2025-12-15",
      "id": "139940",
      "original_text": "Einreichung neuer Dokumente\nBerlin Amtsgericht Berlin (Charlottenburg) HRB 5484\nMesse Berlin GmbH – Berlin",
      "type": "Einreichung neuer Dokumente",
      "state": "Berlin",
      "amtsgericht": "Amtsgericht Berlin (Charlottenburg)",
      "registernummer": "HRB 5484",
      "registerart": "HRB",
      "company_name": "Messe Berlin GmbH",
      "company_seat": "Berlin",
      "details": "15.12.2025 (Bekanntmachungsdatum)\n\nBerlin Amtsgericht Berlin (Charlottenburg) HRB 5484\nEinreichung neuer Dokumente\n\nMesse Berlin GmbH\nGesellschaft mit beschränkter Haftung\nBerlin\n\nAls nicht eingetragen wird veröffentlicht: Es wurde eine neue Liste der Aufsichtsratsmitglieder eingereicht (§52 GmbHG)."
    },
    {
      "date": "2025-12-15",
      "id": "139941",
      "original_text": "Registerbekanntmachung nach dem Umwandlungsgesetz\nBaden-Württemberg Amtsgericht Stuttgart HRB 245108\nBertrandt Technikum GmbH – Ehningen",
      "type": "Registerbekanntmachung nach dem Umwandlungsgesetz",
      "state": "Baden-Württemberg",
      "amtsgericht": "Amtsgericht Stuttgart",
      "registernummer": "HRB 245108",
      "registerart": "HRB",
      "company_name": "Bertrandt Technikum GmbH",
      "company_seat": "Ehningen",
      "details": "15.12.2025 (Bekanntmachungsdatum)\n\nBaden-Württemberg Amtsgericht Stuttgart HRB 245108\nRegisterbekanntmachung nach dem Umwandlungsgesetz 15.12.2025 (Eintragungsdatum)\n\nBertrandt Technikum GmbH\nGesellschaft mit beschränkter Haftung\nEhningen\n\nDen Gläubigern der an der Verschmelzung beteiligten Rechtsträger ist, wenn sie binnen sechs Monaten nach dem Tag, an dem die Eintragung der Verschmelzung in das Register des Sitzes desjenigen Rechtsträgers, dessen Gläubiger sie sind, nach § 19 Abs. 3 UmwG als bekanntgemacht gilt, ihren Anspruch nach Grund und Höhe schriftlich anmelden, Sicherheit zu leisten, soweit sie nicht Befriedigung verlangen können. Dieses Recht steht den Gläubigern jedoch nur zu, wenn sie glaubhaft machen, dass durch die Verschmelzung die Erfüllung ihrer Forderung gefährdet wird."
    },
    {
      "date": "2025-12-15",
      "id": "139942",
      "original_text": "Einreichung neuer Dokumente\nSaarland Amtsgericht Saarbrücken HRB 11219\nSaar-Lor-Lux Umweltzentrum GmbH – Saarbrücken",
      "type": "Einreichung neuer Dokumente",
      "state": "Saarland",
      "amtsgericht": "Amtsgericht Saarbrücken",
      "registernummer": "HRB 11219",
      "registerart": "HRB",
      "company_name": "Saar-Lor-Lux Umweltzentrum GmbH",
      "company_seat": "Saarbrücken",
      "details": "15.12.2025 (Bekanntmachungsdatum)\n\nSaarland Amtsgericht Saarbrücken HRB 11219\nEinreichung neuer Dokumente 15.12.2025 (Eintragungsdatum)\n\nSaar-Lor-Lux Umweltzentrum GmbH\nGesellschaft mit beschränkter Haftung\nSaarbrücken\n\nDie Geschäftsführung der Gesellschaft hat eine Liste der Mitglieder des Aufsichtsrats zum Handelsregister eingereicht (§ 52 Abs. 3 Satz 2 GmbHG)."
    },
    {
      "date": "2025-12-15",
      "id": "139943",
      "original_text": "Registerbekanntmachung nach dem Umwandlungsgesetz\nBerlin Amtsgericht Berlin (Charlottenburg) HRB 120719\nFloragärten Beteiligungs-GmbH – Berlin",
      "type": "Registerbekanntmachung nach dem Umwandlungsgesetz",
      "state": "Berlin",
      "amtsgericht": "Amtsgericht Berlin (Charlottenburg)",
      "registernummer": "HRB 120719",
      "registerart": "HRB",
      "company_name": "Floragärten Beteiligungs-GmbH",
      "company_seat": "Berlin",
      "details": "15.12.2025 (Bekanntmachungsdatum)\n\nBerlin Amtsgericht Berlin (Charlottenburg) HRB 120719\nRegisterbekanntmachung nach dem Umwandlungsgesetz 15.12.2025 (Eintragungsdatum)\n\nFloragärten Beteiligungs-GmbH\nGesellschaft mit beschränkter Haftung\nBerlin\n\nZu Eintragungsnummer 7 vom 15.12.2025 wird als nicht eingetragen veröffentlicht:\n\nDen Gläubigern der an der Verschmelzung beteiligten Rechtsträger ist, wenn sie binnen sechs Monaten nach dem Tag, an dem die Eintragung der Verschmelzung in das Register des Sitzes desjenigen Rechtsträgers, dessen Gläubiger sie sind, als bekannt gemacht gilt, ihren Anspruch nach Grund und Höhe schriftlich anmelden, Sicherheit zu leisten, soweit sie nicht Befriedigung verlangen können. Dieses Recht steht den Gläubigern jedoch nur zu, wenn sie glaubhaft machen, dass durch die Verschmelzung die Erfüllung ihrer Forderung gefährdet wird. Das Recht, Sicherheitsleistung zu verlangen, steht Gläubigern nicht zu, die im Falle der Insolvenz ein Recht auf vorzugsweise Befriedigung aus einer Deckungsmasse haben, die nach gesetzlicher Vorschrift zu ihrem Schutz errichtet und staatlich überwacht ist."
    },
    {
      "date": "2025-12-15",
      "id": "139944",
      "original_text": "Sonstige Registerbekanntmachung\nMecklenburg-Vorpommern Amtsgericht Rostock HRB 3414\nLandwirtschaftliche Lohn GmbH Eschenbarg – Jennewitz",
      "type": "Sonstige Registerbekanntmachung",
      "state": "Mecklenburg-Vorpommern",
      "amtsgericht": "Amtsgericht Rostock",
      "registernummer": "HRB 3414",
      "registerart": "HRB",
      "company_name": "Landwirtschaftliche Lohn GmbH Eschenbarg",
      "company_seat": "Jennewitz",
      "details": "15.12.2025 (Bekanntmachungsdatum)\n\nMecklenburg-Vorpommern Amtsgericht Rostock HRB 3414\nSonstige Registerbekanntmachung\n\nLandwirtschaftliche Lohn GmbH Eschenbarg\nGesellschaft mit beschränkter Haftung\nJennewitz\n\nDen Gläubigern der Gesellschaft, deren Forderungen begründet worden sind, bevor die Eintragung der Beendigung des Vertrages in das Handelsregister nach § 10 des Handelsgesetzbuches als bekanntgemacht gilt, hat der andere Vertragsteil Sicherheit zu leisten, wenn sie sich binnen sechs Monaten nach der Bekanntmachung der Eintragung zu diesem Zweck bei ihm melden."
    },
    {
      "date": "2025-12-15",
      "id": "139945",
      "original_text": "Registerbekanntmachung nach dem Umwandlungsgesetz\nSchleswig-Holstein Amtsgericht Kiel HRA 12872\nHeinrich Knievel Großhandel GmbH & Co. KG – Kiel",
      "type": "Registerbekanntmachung nach dem Umwandlungsgesetz",
      "state": "Schleswig-Holstein",
      "amtsgericht": "Amtsgericht Kiel",
      "registernummer": "HRA 12872",
      "registerart": "HRA",
      "company_name": "Heinrich Knievel Großhandel GmbH & Co. KG",
      "company_seat": "Kiel",
      "details": "15.12.2025 (Bekanntmachungsdatum)\n\nSchleswig-Holstein Amtsgericht Kiel HRA 12872\nRegisterbekanntmachung nach dem Umwandlungsgesetz 12.12.2025 (Eintragungsdatum)\n\nHeinrich Knievel Großhandel GmbH & Co. KG\nKommanditgesellschaft\nKiel\n\nZu Eintragungsnummer 2 vom 12.12.2025 wird als nicht eingetragen veröffentlicht: Den Gläubigern der an der Spaltung beteiligten Rechtsträger ist, wenn sie binnen sechs Monaten nach dem Tag, an dem die Eintragung der Spaltung in das Register des Sitzes desjenigen Rechtsträgers, dessen Gläubiger sie sind,  bekannt gemacht worden ist, ihren Anspruch nach Grund und Höhe schriftlich anmelden, Sicherheit zu leisten, soweit sie nicht Befriedigung verlangen können. Dieses Recht steht den Gläubigern jedoch nur zu, wenn sie glaubhaft machen, dass durch die Spaltung die Erfüllung ihrer Forderung gefährdet wird."
    },
    {
      "date": "2025-12-15",
      "id": "139946",
      "original_text": "Registerbekanntmachung nach dem Umwandlungsgesetz\nBerlin Amtsgericht Berlin (Charlottenburg) HRB 201110\nRAW Value 2 GmbH – Berlin",
      "type": "Registerbekanntmachung nach dem Umwandlungsgesetz",
      "state": "Berlin",
      "amtsgericht": "Amtsgericht Berlin (Charlottenburg)",
      "registernummer": "HRB 201110",
      "registerart": "HRB",
      "company_name": "RAW Value 2 GmbH",
      "company_seat": "Berlin",
      "details": "15.12.2025 (Bekanntmachungsdatum)\n\nBerlin Amtsgericht Berlin (Charlottenburg) HRB 201110\nRegisterbekanntmachung nach dem Umwandlungsgesetz 12.12.2025 (Eintragungsdatum)\n\nRAW Value 2 GmbH\nGesellschaft mit beschränkter Haftung\nBerlin\n\nZu Eintragungsnummer 11 vom 12.12.2025 wird als nicht eingetragen veröffentlicht: Den Gläubigern der an der Verschmelzung beteiligten Rechtsträger ist, wenn sie binnen sechs Monaten nach dem Tag, an dem die Eintragung der Verschmelzung in das Register des Sitzes desjenigen Rechtsträgers, dessen Gläubiger sie sind, als bekannt gemacht gilt, ihren Anspruch nach Grund und Höhe schriftlich anmelden, Sicherheit zu leisten, soweit sie nicht Befriedigung verlangen können. Dieses Recht steht den Gläubigern jedoch nur zu, wenn sie glaubhaft machen, dass durch die Verschmelzung die Erfüllung ihrer Forderung gefährdet wird. Das Recht, Sicherheitsleistung zu verlangen, steht Gläubigern nicht zu, die im Falle der Insolvenz ein Recht auf vorzugsweise Befriedigung aus einer Deckungsmasse haben, die nach gesetzlicher Vorschrift zu ihrem Schutz errichtet und staatlich überwacht ist."
    },
    {
      "date": "2025-12-15",
      "id": "139947",
      "original_text": "Registerbekanntmachung nach dem Umwandlungsgesetz\nBerlin Amtsgericht Berlin (Charlottenburg) HRB 8906\nDorland Werbeagentur GmbH – Berlin",
      "type": "Registerbekanntmachung nach dem Umwandlungsgesetz",
      "state": "Berlin",
      "amtsgericht": "Amtsgericht Berlin (Charlottenburg)",
      "registernummer": "HRB 8906",
      "registerart": "HRB",
      "company_name": "Dorland Werbeagentur GmbH",
      "company_seat": "Berlin",
      "details": "15.12.2025 (Bekanntmachungsdatum)\n\nBerlin Amtsgericht Berlin (Charlottenburg) HRB 8906\nRegisterbekanntmachung nach dem Umwandlungsgesetz 14.12.2025 (Eintragungsdatum)\n\nDorland Werbeagentur GmbH\nGesellschaft mit beschränkter Haftung\nBerlin\n\nZu Eintragungsnummer 22 vom 14.12.2025 wird als nicht eingetragen veröffentlicht:\n\nDen Gläubigern der an der Verschmelzung beteiligten Rechtsträger ist, wenn sie binnen sechs Monaten nach dem Tag, an dem die Eintragung der Verschmelzung in das Register des Sitzes desjenigen Rechtsträgers, dessen Gläubiger sie sind, als bekannt gemacht gilt, ihren Anspruch nach Grund und Höhe schriftlich anmelden, Sicherheit zu leisten, soweit sie nicht Befriedigung verlangen können. Dieses Recht steht den Gläubigern jedoch nur zu, wenn sie glaubhaft machen, dass durch die Verschmelzung die Erfüllung ihrer Forderung gefährdet wird. Das Recht, Sicherheitsleistung zu verlangen, steht Gläubigern nicht zu, die im Falle der Insolvenz ein Recht auf vorzugsweise Befriedigung aus einer Deckungsmasse haben, die nach gesetzlicher Vorschrift zu ihrem Schutz errichtet und staatlich überwacht ist."
    },
    {
      "date": "2025-12-15",
      "id": "139948",
      "original_text": "Löschungsankündigung\nBaden-Württemberg Amtsgericht Mannheim HRB 5559\nCIG GmbH Industriehandel, Export und Import, Firmenvertretungen – Mannheim",
      "type": "Löschungsankündigung",
      "state": "Baden-Württemberg",
      "amtsgericht": "Amtsgericht Mannheim",
      "registernummer": "HRB 5559",
      "registerart": "HRB",
      "company_name": "CIG GmbH Industriehandel, Export und Import, Firmenvertretungen",
      "company_seat": "Mannheim",
      "details": "15.12.2025 (Bekanntmachungsdatum)\n\nBaden-Württemberg Amtsgericht Mannheim HRB 5559\nLöschungsankündigung\n\nCIG GmbH Industriehandel, Export und Import, Firmenvertretungen\nGesellschaft mit beschränkter Haftung\nMannheim\n\nAls nicht eingetragen wird bekanntgemacht:\nDas Gericht beabsichtigt, die Gesellschaft wegen Vermögenslosigkeit im Handelsregister von Amts wegen nach § 394 FamFG zu löschen. Die Frist zur Geltendmachung eines Widerspruchs gegen die beabsichtigte Löschung ist auf drei Monate ab Veröffentlichung bestimmt."
    },
    {
      "date": "2025-12-15",
      "id": "139949",
      "original_text": "Einreichung neuer Dokumente\nBaden-Württemberg Amtsgericht Ulm HRB 510552\nVersorgungs- und Bädergesellschaft Ellwangen mbH – Ellwangen Jagst",
      "type": "Einreichung neuer Dokumente",
      "state": "Baden-Württemberg",
      "amtsgericht": "Amtsgericht Ulm",
      "registernummer": "HRB 510552",
      "registerart": "HRB",
      "company_name": "Versorgungs- und Bädergesellschaft Ellwangen mbH",
      "company_seat": "Ellwangen Jagst",
      "details": "15.12.2025 (Bekanntmachungsdatum)\n\nBaden-Württemberg Amtsgericht Ulm HRB 510552\nEinreichung neuer Dokumente\n\nVersorgungs- und Bädergesellschaft Ellwangen mbH\nGesellschaft mit beschränkter Haftung\nEllwangen Jagst\n\nDie Gesellschaft hat am 12.12.2025 die Liste über die Zusammensetzung des Aufsichtsrats zum Handelsregister eingereicht."
    },
    {
      "date": "2025-12-15",
      "id": "139950",
      "original_text": "Löschungsankündigung\nBerlin Amtsgericht Berlin (Charlottenburg) HRA 44044\nHFS Global Trade Invest KG – Berlin",
      "type": "Löschungsankündigung",
      "state": "Berlin",
      "amtsgericht": "Amtsgericht Berlin (Charlottenburg)",
      "registernummer": "HRA 44044",
      "registerart": "HRA",
      "company_name": "HFS Global Trade Invest KG",
      "company_seat": "Berlin",
      "details": "15.12.2025 (Bekanntmachungsdatum)\n\nBerlin Amtsgericht Berlin (Charlottenburg) HRA 44044\nLöschungsankündigung\n\nHFS Global Trade Invest KG\nKommanditgesellschaft\nBerlin\n\nBei dem nachstehenden Unternehmen / der nachstehenden Gesellschaft wird das Amtslöschungsverfahren gemäß § 31 Abs. 2 HGB eingeleitet. Widerspruchsfrist 1 Monat"
    },
    {
      "date": "2025-12-15",
      "id": "139951",
      "original_text": "Löschungsankündigung\nBerlin Amtsgericht Berlin (Charlottenburg) HRB 245934\nIT-Iconium GmbH – Berlin",
      "type": "Löschungsankündigung",
      "state": "Berlin",
      "amtsgericht": "Amtsgericht Berlin (Charlottenburg)",
      "registernummer": "HRB 245934",
      "registerart": "HRB",
      "company_name": "IT-Iconium GmbH",
      "company_seat": "Berlin",
      "details": "15.12.2025 (Bekanntmachungsdatum)\n\nBerlin Amtsgericht Berlin (Charlottenburg) HRB 245934\nLöschungsankündigung\n\nIT-Iconium GmbH\nGesellschaft mit beschränkter Haftung\nBerlin\n\nBei der nachstehenden Gesellschaft wird das Amtslöschungsverfahren gemäß § 394 FamFG eingeleitet. Widerspruchsfrist 6 Wochen"
    },
    {
      "date": "2025-12-15",
      "id": "139952",
      "original_text": "Registerbekanntmachung nach dem Umwandlungsgesetz\nBerlin Amtsgericht Berlin (Charlottenburg) HRB 99457\nFreund & Partner GmbH Steuerberatungsgesellschaft – Berlin",
      "type": "Registerbekanntmachung nach dem Umwandlungsgesetz",
      "state": "Berlin",
      "amtsgericht": "Amtsgericht Berlin (Charlottenburg)",
      "registernummer": "HRB 99457",
      "registerart": "HRB",
      "company_name": "Freund & Partner GmbH Steuerberatungsgesellschaft",
      "company_seat": "Berlin",
      "details": "15.12.2025 (Bekanntmachungsdatum)\n\nBerlin Amtsgericht Berlin (Charlottenburg) HRB 99457\nRegisterbekanntmachung nach dem Umwandlungsgesetz 12.12.2025 (Eintragungsdatum)\n\nFreund & Partner GmbH Steuerberatungsgesellschaft\nGesellschaft mit beschränkter Haftung\nBerlin\n\nZu Eintragungsnummer 37 vom 12.12.2025 wird als nicht eingetragen veröffentlicht:\n\nDen Gläubigern der an der Verschmelzung beteiligten Rechtsträger ist, wenn sie binnen sechs Monaten nach dem Tag, an dem die Eintragung der Verschmelzung in das Register des Sitzes desjenigen Rechtsträgers, dessen Gläubiger sie sind, als bekannt gemacht gilt, ihren Anspruch nach Grund und Höhe schriftlich anmelden, Sicherheit zu leisten, soweit sie nicht Befriedigung verlangen können. Dieses Recht steht den Gläubigern jedoch nur zu, wenn sie glaubhaft machen, dass durch die Verschmelzung die Erfüllung ihrer Forderung gefährdet wird. Das Recht, Sicherheitsleistung zu verlangen, steht Gläubigern nicht zu, die im Falle der Insolvenz ein Recht auf vorzugsweise Befriedigung aus einer Deckungsmasse haben, die nach gesetzlicher Vorschrift zu ihrem Schutz errichtet und staatlich überwacht ist."
    },
    {
      "date": "2025-12-15",
      "id": "139953",
      "original_text": "Einreichung neuer Dokumente\nBaden-Württemberg Amtsgericht Stuttgart HRB 800733\nEnergie Althengstett GmbH – Althengstett",
      "type": "Einreichung neuer Dokumente",
      "state": "Baden-Württemberg",
      "amtsgericht": "Amtsgericht Stuttgart",
      "registernummer": "HRB 800733",
      "registerart": "HRB",
      "company_name": "Energie Althengstett GmbH",
      "company_seat": "Althengstett",
      "details": "15.12.2025 (Bekanntmachungsdatum)\n\nBaden-Württemberg Amtsgericht Stuttgart HRB 800733\nEinreichung neuer Dokumente\n\nEnergie Althengstett GmbH\nGesellschaft mit beschränkter Haftung\nAlthengstett\n\nDie Gesellschaft hat am 12.12.2025 die Liste über die Zusammensetzung des Aufsichtsrats zum Handelsregister eingereicht."
    },
    {
      "date": "2025-12-15",
      "id": "139954",
      "original_text": "Einreichung neuer Dokumente\nHamburg Amtsgericht Hamburg HRB 16106\nHGV Hamburger Gesellschaft für Vermögens- und Beteiligungsmanagement mbH – Hamburg",
      "type": "Einreichung neuer Dokumente",
      "state": "Hamburg",
      "amtsgericht": "Amtsgericht Hamburg",
      "registernummer": "HRB 16106",
      "registerart": "HRB",
      "company_name": "HGV Hamburger Gesellschaft für Vermögens- und Beteiligungsmanagement mbH",
      "company_seat": "Hamburg",
      "details": "15.12.2025 (Bekanntmachungsdatum)\n\nHamburg Amtsgericht Hamburg HRB 16106\nEinreichung neuer Dokumente\n\nHGV Hamburger Gesellschaft für Vermögens- und Beteiligungsmanagement mbH\nGesellschaft mit beschränkter Haftung\nHamburg\n\nAls nicht eingetragen wird bekannt gemacht: Liste des Aufsichtsrats wurde eingereicht."
    },
    {
      "date": "2025-12-15",
      "id": "139955",
      "original_text": "Einreichung neuer Dokumente\nSachsen-Anhalt Amtsgericht Stendal HRB 206996\nStadtwerke Merseburg GmbH – Merseburg",
      "type": "Einreichung neuer Dokumente",
      "state": "Sachsen-Anhalt",
      "amtsgericht": "Amtsgericht Stendal",
      "registernummer": "HRB 206996",
      "registerart": "HRB",
      "company_name": "Stadtwerke Merseburg GmbH",
      "company_seat": "Merseburg",
      "details": "15.12.2025 (Bekanntmachungsdatum)\n\nSachsen-Anhalt Amtsgericht Stendal HRB 206996\nEinreichung neuer Dokumente\n\nStadtwerke Merseburg GmbH\nGesellschaft mit beschränkter Haftung\nMerseburg\n\nEine Liste der Mitglieder des Aufsichtsrates wurde zum Handelsregister eingereicht."
    },
    {
      "date": "2025-12-15",
      "id": "139956",
      "original_text": "Löschungsankündigung\nBaden-Württemberg Amtsgericht Mannheim HRB 362783\nJuvana Medica GmbH – Baden-Baden",
      "type": "Löschungsankündigung",
      "state": "Baden-Württemberg",
      "amtsgericht": "Amtsgericht Mannheim",
      "registernummer": "HRB 362783",
      "registerart": "HRB",
      "company_name": "Juvana Medica GmbH",
      "company_seat": "Baden-Baden",
      "details": "15.12.2025 (Bekanntmachungsdatum)\n\nBaden-Württemberg Amtsgericht Mannheim HRB 362783\nLöschungsankündigung\n\nJuvana Medica GmbH\nGesellschaft mit beschränkter Haftung\nBaden-Baden\n\nDas Gericht beabsichtigt, die Gesellschaft wegen Vermögenslosigkeit im Handelsregister von Amts wegen nach § 394 FamFG zu löschen. Die Frist zur Geltendmachung eines Widerspruchs gegen die beabsichtigte Löschung ist auf einen Monat ab Veröffentlichung bestimmt."
    },
    {
      "date": "2025-12-15",
      "id": "139957",
      "original_text": "Registerbekanntmachung nach dem Umwandlungsgesetz\nSchleswig-Holstein Amtsgericht Lübeck HRB 22235\nGlobal Invest Worldwide UG (haftungsbeschränkt) – Ahrensburg",
      "type": "Registerbekanntmachung nach dem Umwandlungsgesetz",
      "state": "Schleswig-Holstein",
      "amtsgericht": "Amtsgericht Lübeck",
      "registernummer": "HRB 22235",
      "registerart": "HRB",
      "company_name": "Global Invest Worldwide UG (haftungsbeschränkt)",
      "company_seat": "Ahrensburg",
      "details": "15.12.2025 (Bekanntmachungsdatum)\n\nSchleswig-Holstein Amtsgericht Lübeck HRB 22235\nRegisterbekanntmachung nach dem Umwandlungsgesetz 15.12.2025 (Eintragungsdatum)\n\nGlobal Invest Worldwide UG (haftungsbeschränkt)\nGesellschaft mit beschränkter Haftung\nAhrensburg\n\nZu Eintragungsnummer 6 vom 15.12.2025 wird als nicht eingetragen veröffentlicht:  Den Gläubigern der an der Verschmelzung beteiligten Rechtsträger ist, wenn sie binnen sechs Monaten nach dem Tag, an dem die Eintragung der Verschmelzung in das Register des Sitzes desjenigen Rechtsträgers, dessen Gläubiger sie sind, als bekannt gemacht gilt, ihren Anspruch nach Grund und Höhe schriftlich anmelden, Sicherheit zu leisten, soweit sie nicht Befriedigung verlangen können. Dieses Recht steht den Gläubigern jedoch nur zu, wenn sie glaubhaft machen, dass durch die Verschmelzung die Erfüllung ihrer Forderung gefährdet wird."
    },
    {
      "date": "2025-12-15",
      "id": "139958",
      "original_text": "Löschungsankündigung\nBerlin Amtsgericht Berlin (Charlottenburg) HRB 156519\nVia Auto Vertriebs UG (haftungsbeschränkt) – Berlin",
      "type": "Löschungsankündigung",
      "state": "Berlin",
      "amtsgericht": "Amtsgericht Berlin (Charlottenburg)",
      "registernummer": "HRB 156519",
      "registerart": "HRB",
      "company_name": "Via Auto Vertriebs UG (haftungsbeschränkt)",
      "company_seat": "Berlin",
      "details": "15.12.2025 (Bekanntmachungsdatum)\n\nBerlin Amtsgericht Berlin (Charlottenburg) HRB 156519\nLöschungsankündigung\n\nVia Auto Vertriebs UG (haftungsbeschränkt)\nGesellschaft mit beschränkter Haftung\nBerlin\n\nBei der nachstehenden Gesellschaft wird das Amtslöschungsverfahren gemäß § 394 FamFG eingeleitet. Widerspruchsfrist 6 Wochen"
    },
    {
      "date": "2025-12-15",
      "id": "139959",
      "original_text": "Löschungsankündigung\nBerlin Amtsgericht Berlin (Charlottenburg) HRB 209518\nREP Development UG (haftungsbeschränkt) – Berlin",
      "type": "Löschungsankündigung",
      "state": "Berlin",
      "amtsgericht": "Amtsgericht Berlin (Charlottenburg)",
      "registernummer": "HRB 209518",
      "registerart": "HRB",
      "company_name": "REP Development UG (haftungsbeschränkt)",
      "company_seat": "Berlin",
      "details": "15.12.2025 (Bekanntmachungsdatum)\n\nBerlin Amtsgericht Berlin (Charlottenburg) HRB 209518\nLöschungsankündigung\n\nREP Development UG (haftungsbeschränkt)\nGesellschaft mit beschränkter Haftung\nBerlin\n\nBei der nachstehenden Gesellschaft wird das Amtslöschungsverfahren gemäß § 394 FamFG eingeleitet. Widerspruchsfrist 6 Wochen"
    },
    {
      "date": "2025-12-15",
      "id": "139960",
      "original_text": "Einreichung neuer Dokumente\nBaden-Württemberg Amtsgericht Stuttgart HRB 224982\nBecker-Schoell Aktiengesellschaft – Ilsfeld",
      "type": "Einreichung neuer Dokumente",
      "state": "Baden-Württemberg",
      "amtsgericht": "Amtsgericht Stuttgart",
      "registernummer": "HRB 224982",
      "registerart": "HRB",
      "company_name": "Becker-Schoell Aktiengesellschaft",
      "company_seat": "Ilsfeld",
      "details": "15.12.2025 (Bekanntmachungsdatum)\n\nBaden-Württemberg Amtsgericht Stuttgart HRB 224982\nEinreichung neuer Dokumente 15.12.2025 (Eintragungsdatum)\n\nBecker-Schoell Aktiengesellschaft\nAktiengesellschaft\nIlsfeld\n\nDie Gesellschaft hat am 12.12.2025 die Liste über die Zusammensetzung des Aufsichtsrats zum Handelsregister eingereicht."
    },
    {
      "date": "2025-12-15",
      "id": "139961",
      "original_text": "Löschungsankündigung\nBerlin Amtsgericht Berlin (Charlottenburg) HRB 244953\nFINABRIDGE GERMANY GmbH – Berlin",
      "type": "Löschungsankündigung",
      "state": "Berlin",
      "amtsgericht": "Amtsgericht Berlin (Charlottenburg)",
      "registernummer": "HRB 244953",
      "registerart": "HRB",
      "company_name": "FINABRIDGE GERMANY GmbH",
      "company_seat": "Berlin",
      "details": "15.12.2025 (Bekanntmachungsdatum)\n\nBerlin Amtsgericht Berlin (Charlottenburg) HRB 244953\nLöschungsankündigung\n\nFINABRIDGE GERMANY GmbH\nGesellschaft mit beschränkter Haftung\nBerlin\n\nBei der nachstehenden Gesellschaft wird das Amtslöschungsverfahren gemäß § 394 FamFG eingeleitet. Widerspruchsfrist 6 Wochen"
    },
    {
      "date": "2025-12-15",
      "id": "139962",
      "original_text": "Löschungsankündigung\nMecklenburg-Vorpommern Amtsgericht Neubrandenburg HRB 20878\nMSU Unternehmensberatung GmbH Industrie- und Handelsvertretungen – Schwarz",
      "type": "Löschungsankündigung",
      "state": "Mecklenburg-Vorpommern",
      "amtsgericht": "Amtsgericht Neubrandenburg",
      "registernummer": "HRB 20878",
      "registerart": "HRB",
      "company_name": "MSU Unternehmensberatung GmbH Industrie- und Handelsvertretungen",
      "company_seat": "Schwarz",
      "details": "15.12.2025 (Bekanntmachungsdatum)\n\nMecklenburg-Vorpommern Amtsgericht Neubrandenburg HRB 20878\nLöschungsankündigung 15.12.2025 (Eintragungsdatum)\n\nMSU Unternehmensberatung GmbH Industrie- und Handelsvertretungen\nGesellschaft mit beschränkter Haftung\nSchwarz\n\nDas Registergericht beabsichtigt, die im Handelsregister eingetragene Gesellschaft von Amts wegen nach § 394 FamFG zu löschen. Die Frist zur Erhebung eines Widerspruchs gegen die beabsichtigte Löschung wird auf drei Monate festgesetzt."
    },
    {
      "date": "2025-12-15",
      "id": "139963",
      "original_text": "Registerbekanntmachung nach dem Umwandlungsgesetz\nBaden-Württemberg Amtsgericht Stuttgart HRB 221500\nMaier Erdbau, Transport und Landschaftsbau GmbH – Neuffen",
      "type": "Registerbekanntmachung nach dem Umwandlungsgesetz",
      "state": "Baden-Württemberg",
      "amtsgericht": "Amtsgericht Stuttgart",
      "registernummer": "HRB 221500",
      "registerart": "HRB",
      "company_name": "Maier Erdbau, Transport und Landschaftsbau GmbH",
      "company_seat": "Neuffen",
      "details": "15.12.2025 (Bekanntmachungsdatum)\n\nBaden-Württemberg Amtsgericht Stuttgart HRB 221500\nRegisterbekanntmachung nach dem Umwandlungsgesetz 15.12.2025 (Eintragungsdatum)\n\nMaier Erdbau, Transport und Landschaftsbau GmbH\nGesellschaft mit beschränkter Haftung\nNeuffen\n\nAls nicht eingetragen wird bekanntgemacht:\nDen Gläubigern der an der Verschmelzung beteiligten Rechtsträger ist, wenn sie binnen sechs Monaten nach dem Tag, an dem die Eintragung der Verschmelzung in das Register des Sitzes desjenigen Rechtsträgers, dessen Gläubiger sie sind, nach § 19 Abs. 3 UmwG als bekanntgemacht gilt, ihren Anspruch nach Grund und Höhe schriftlich anmelden, Sicherheit zu leisten, soweit sie nicht Befriedigung verlangen können. Dieses Recht steht den Gläubigern jedoch nur zu, wenn sie glaubhaft machen, dass durch die Verschmelzung die Erfüllung ihrer Forderung gefährdet wird."
    },
    {
      "date": "2025-12-15",
      "id": "139964",
      "original_text": "Sonstige Registerbekanntmachung\nBerlin Amtsgericht Berlin (Charlottenburg) HRB 96548\nBERINTREG GmbH – Berlin",
      "type": "Sonstige Registerbekanntmachung",
      "state": "Berlin",
      "amtsgericht": "Amtsgericht Berlin (Charlottenburg)",
      "registernummer": "HRB 96548",
      "registerart": "HRB",
      "company_name": "BERINTREG GmbH",
      "company_seat": "Berlin",
      "details": "15.12.2025 (Bekanntmachungsdatum)\n\nBerlin Amtsgericht Berlin (Charlottenburg) HRB 96548\nSonstige Registerbekanntmachung\n\nBERINTREG GmbH\nGesellschaft mit beschränkter Haftung\nBerlin\n\nAls nicht eingetragen wird veröffentlicht: Dem Registergericht liegt ein Antrag vom 24.07.2025 auf Bestellung eines Nachtragsliquidators (§ 273 AktG analog) für die bereits 05.01.2021 gelöschte Gesellschaft in Firma BERINTREG GmbH vom 15.10.2025 vor.\nEs ist beabsichtigt, Herrn Rechtsanwalt Sascha Borowksi, c/o Buchalik Brömmekamp Rechtsanwaltsgesellschaft mbH, Prinzenallee 15, 40549 Düsseldorf, als Nachtragsliquidator für die gelöschte Gesellschaft mit folgendem Wirkungskreis zu bestellen:\nDer Wirkungskreis des Nachtragsliquidators Herrn Rechtsanwalt Sascha Borowski ist beschränkt auf die Vertretung und die Wahrnehmung der Rechte der gelöschten Gesellschaft, der Berintreg GmbH, hinsichtlich der Zustimmung zur Freigabe des bei dem Amtsgericht München, Hinterlegungsstelle, unter dem Aktenzeichen 38 HL 1269/07 hinterlegten Geldbetrages in Höhe von\n2.543,06 €.\nEtwaige Widersprüche gegen die beabsichtigte Bestellung sind binnen eines Monats ab Bekanntmachung schriftlich beim Amtsgericht Charlottenburg (zur HR-Nr. HRB 96548) zu erklären. Der Widerspruch ist zu begründen."
    },
    {
      "date": "2025-12-15",
      "id": "139965",
      "original_text": "Registerbekanntmachung nach dem Umwandlungsgesetz\nBrandenburg Amtsgericht Cottbus HRB 12834\nRefugium Beelitz Quadrant C Grundstücksgesellschaft mbH – Schönefeld",
      "type": "Registerbekanntmachung nach dem Umwandlungsgesetz",
      "state": "Brandenburg",
      "amtsgericht": "Amtsgericht Cottbus",
      "registernummer": "HRB 12834",
      "registerart": "HRB",
      "company_name": "Refugium Beelitz Quadrant C Grundstücksgesellschaft mbH",
      "company_seat": "Schönefeld",
      "details": "15.12.2025 (Bekanntmachungsdatum)\n\nBrandenburg Amtsgericht Cottbus HRB 12834\nRegisterbekanntmachung nach dem Umwandlungsgesetz 15.12.2025 (Eintragungsdatum)\n\nRefugium Beelitz Quadrant C Grundstücksgesellschaft mbH\nGesellschaft mit beschränkter Haftung\nSchönefeld\n\nAls nicht eingetragen wird veröffentlicht:\nDen Gläubigern der an der Spaltung beteiligten Rechtsträger ist, wenn sie binnen sechs Monaten nach dem Tag, an dem die Eintragung der Spaltung in das Register des Sitzes desjenigen Rechtsträgers, dessen Gläubiger sie sind, als bekannt gemacht gilt, ihren Anspruch nach Grund und Höhe schriftlich anmelden, Sicherheit zu leisten, soweit sie nicht Befriedigung verlangen können. Dieses Recht steht den Gläubigern jedoch nur zu, wenn sie glaubhaft machen, dass durch die Spaltung die Erfüllung ihrer Forderung gefährdet wird"
    },
    {
      "date": "2025-12-15",
      "id": "139966",
      "original_text": "Einreichung neuer Dokumente\nBaden-Württemberg Amtsgericht Stuttgart HRB 382196\nscience + computing Aktiengesellschaft – Tübingen",
      "type": "Einreichung neuer Dokumente",
      "state": "Baden-Württemberg",
      "amtsgericht": "Amtsgericht Stuttgart",
      "registernummer": "HRB 382196",
      "registerart": "HRB",
      "company_name": "science + computing Aktiengesellschaft",
      "company_seat": "Tübingen",
      "details": "15.12.2025 (Bekanntmachungsdatum)\n\nBaden-Württemberg Amtsgericht Stuttgart HRB 382196\nEinreichung neuer Dokumente\n\nscience + computing Aktiengesellschaft\nAktiengesellschaft\nTübingen\n\nDie Gesellschaft hat am 10.12.2025 die Liste über die Zusammensetzung des Aufsichtsrats zum Handelsregister eingereicht."
    },
    {
      "date": "2025-12-15",
      "id": "139967",
      "original_text": "Registerbekanntmachung nach dem Umwandlungsgesetz\nBaden-Württemberg Amtsgericht Ulm HRB 751027\nMobiler Pflegedienst und Intensivpflege De Giuli GmbH – Ehingen Donau",
      "type": "Registerbekanntmachung nach dem Umwandlungsgesetz",
      "state": "Baden-Württemberg",
      "amtsgericht": "Amtsgericht Ulm",
      "registernummer": "HRB 751027",
      "registerart": "HRB",
      "company_name": "Mobiler Pflegedienst und Intensivpflege De Giuli GmbH",
      "company_seat": "Ehingen Donau",
      "details": "15.12.2025 (Bekanntmachungsdatum)\n\nBaden-Württemberg Amtsgericht Ulm HRB 751027\nRegisterbekanntmachung nach dem Umwandlungsgesetz 15.12.2025 (Eintragungsdatum)\n\nMobiler Pflegedienst und Intensivpflege De Giuli GmbH\nGesellschaft mit beschränkter Haftung\nEhingen Donau\n\nAls nicht eingetragen wird bekanntgemacht:\nDen Gläubigern der an der Ausgliederung beteiligten Rechtsträger ist, wenn sie binnen sechs Monaten nach dem Tag, an dem die Eintragung der Ausgliederung in das Register des Sitzes desjenigen Rechtsträgers, dessen Gläubiger sie sind, nach § 19 Abs. 3 UmwG als bekanntgemacht gilt, ihren Anspruch nach Grund und Höhe schriftlich anmelden, Sicherheit zu leisten, soweit sie nicht Befriedigung verlangen können. Dieses Recht steht den Gläubigern jedoch nur zu, wenn sie glaubhaft machen, dass durch die Ausgliederung die Erfüllung ihrer Forderung gefährdet wird."
    },
    {
      "date": "2025-12-15",
      "id": "139968",
      "original_text": "Registerbekanntmachung nach dem Umwandlungsgesetz\nBrandenburg Amtsgericht Potsdam HRA 8753\nJCK Dienstleistungen - Julius Kuhlmei e.K. – Zossen",
      "type": "Registerbekanntmachung nach dem Umwandlungsgesetz",
      "state": "Brandenburg",
      "amtsgericht": "Amtsgericht Potsdam",
      "registernummer": "HRA 8753",
      "registerart": "HRA",
      "company_name": "JCK Dienstleistungen - Julius Kuhlmei e.K.",
      "company_seat": "Zossen",
      "details": "15.12.2025 (Bekanntmachungsdatum)\n\nBrandenburg Amtsgericht Potsdam HRA 8753\nRegisterbekanntmachung nach dem Umwandlungsgesetz 12.12.2025 (Eintragungsdatum)\n\nJCK Dienstleistungen - Julius Kuhlmei e.K.\nEinzelkaufmann / Einzelkauffrau\nZossen\n\nZu Eintragungsnummer 3 vom 12.12.2025 wird als nicht eingetragen veröffentlicht:\nDen Gläubigern der an der Ausgliederung beteiligten Rechtsträger ist, wenn sie binnen sechs Monaten nach dem Tag, an dem die Eintragung der Ausgliederung in das Register des Sitzes desjenigen Rechtsträgers, dessen Gläubiger sie sind, als bekannt gemacht gilt, ihren Anspruch nach Grund und Höhe schriftlich anmelden, Sicherheit zu leisten, soweit sie nicht Befriedigung verlangen können. Dieses Recht steht den Gläubigern jedoch nur zu, wenn sie glaubhaft machen, dass durch die Ausgliederung die Erfüllung ihrer Forderung gefährdet wird"
    },
    {
      "date": "2025-12-15",
      "id": "139969",
      "original_text": "Löschungsankündigung\nBerlin Amtsgericht Berlin (Charlottenburg) HRB 245517\nWEB Wasserstoff Equipment Berlin UG (haftungsbeschränkt) – Berlin",
      "type": "Löschungsankündigung",
      "state": "Berlin",
      "amtsgericht": "Amtsgericht Berlin (Charlottenburg)",
      "registernummer": "HRB 245517",
      "registerart": "HRB",
      "company_name": "WEB Wasserstoff Equipment Berlin UG (haftungsbeschränkt)",
      "company_seat": "Berlin",
      "details": "15.12.2025 (Bekanntmachungsdatum)\n\nBerlin Amtsgericht Berlin (Charlottenburg) HRB 245517\nLöschungsankündigung\n\nWEB Wasserstoff Equipment Berlin UG (haftungsbeschränkt)\nGesellschaft mit beschränkter Haftung\nBerlin\n\nBei der nachstehenden Gesellschaft wird das Amtslöschungsverfahren gemäß § 394 FamFG eingeleitet. Widerspruchsfrist 6 Wochen"
    },
    {
      "date": "2025-12-15",
      "id": "139970",
      "original_text": "Löschungsankündigung\nBerlin Amtsgericht Berlin (Charlottenburg) HRB 86521\nReal Vermögensverwaltung GmbH – Berlin",
      "type": "Löschungsankündigung",
      "state": "Berlin",
      "amtsgericht": "Amtsgericht Berlin (Charlottenburg)",
      "registernummer": "HRB 86521",
      "registerart": "HRB",
      "company_name": "Real Vermögensverwaltung GmbH",
      "company_seat": "Berlin",
      "details": "15.12.2025 (Bekanntmachungsdatum)\n\nBerlin Amtsgericht Berlin (Charlottenburg) HRB 86521\nLöschungsankündigung\n\nReal Vermögensverwaltung GmbH\nGesellschaft mit beschränkter Haftung\nBerlin\n\nBei der nachstehenden Gesellschaft wird das Amtslöschungsverfahren gemäß § 394 FamFG eingeleitet. Widerspruchsfrist 6 Wochen"
    },
    {
      "date": "2025-12-15",
      "id": "139971",
      "original_text": "Registerbekanntmachung nach dem Umwandlungsgesetz\nBrandenburg Amtsgericht Cottbus HRB 19273\nQuartier Beelitz-Heilstätten dritte Grundstücksgesellschaft mbH – Schönefeld",
      "type": "Registerbekanntmachung nach dem Umwandlungsgesetz",
      "state": "Brandenburg",
      "amtsgericht": "Amtsgericht Cottbus",
      "registernummer": "HRB 19273",
      "registerart": "HRB",
      "company_name": "Quartier Beelitz-Heilstätten dritte Grundstücksgesellschaft mbH",
      "company_seat": "Schönefeld",
      "details": "15.12.2025 (Bekanntmachungsdatum)\n\nBrandenburg Amtsgericht Cottbus HRB 19273\nRegisterbekanntmachung nach dem Umwandlungsgesetz 15.12.2025 (Eintragungsdatum)\n\nQuartier Beelitz-Heilstätten dritte Grundstücksgesellschaft mbH\nGesellschaft mit beschränkter Haftung\nSchönefeld\n\nZu Eintragungsnummer 1 vom 15.12.2025 wird als nicht eingetragen veröffentlicht:\nAls nicht eingetragen wird veröffentlicht:\nDen Gläubigern der an der Spaltung beteiligten Rechtsträger ist, wenn sie binnen sechs Monaten nach dem Tag, an dem die Eintragung der Spaltung in das Register des Sitzes desjenigen Rechtsträgers, dessen Gläubiger sie sind, als bekannt gemacht gilt, ihren Anspruch nach Grund und Höhe schriftlich anmelden, Sicherheit zu leisten, soweit sie nicht Befriedigung verlangen können. Dieses Recht steht den Gläubigern jedoch nur zu, wenn sie glaubhaft machen, dass durch die Spaltung die Erfüllung ihrer Forderung gefährdet wird"
    },
    {
      "date": "2025-12-15",
      "id": "139972",
      "original_text": "Registerbekanntmachung nach dem Umwandlungsgesetz\nSachsen Amtsgericht Chemnitz HRA 10223\nFreddy Fresh Chemnitz West e.K. – Chemnitz",
      "type": "Registerbekanntmachung nach dem Umwandlungsgesetz",
      "state": "Sachsen",
      "amtsgericht": "Amtsgericht Chemnitz",
      "registernummer": "HRA 10223",
      "registerart": "HRA",
      "company_name": "Freddy Fresh Chemnitz West e.K.",
      "company_seat": "Chemnitz",
      "details": "15.12.2025 (Bekanntmachungsdatum)\n\nSachsen Amtsgericht Chemnitz HRA 10223\nRegisterbekanntmachung nach dem Umwandlungsgesetz 15.12.2025 (Eintragungsdatum)\n\nFreddy Fresh Chemnitz West e.K.\nEinzelkaufmann / Einzelkauffrau\nChemnitz\n\nDen Gläubigern der an der Ausgliederung beteiligten Rechtsträger ist, wenn sie binnen sechs Monaten nach dem Tag, an dem die Eintragung der Ausgliederung in das Register des Sitzes desjenigen Rechtsträgers, dessen Gläubiger sie sind, nach § 19 Abs. 3 UmwG als bekannt gemacht gilt, ihren Anspruch nach Grund und Höhe in Textform anmelden, Sicherheit zu leisten, soweit sie nicht Befriedigung verlangen können. Dieses Recht steht den Gläubigern jedoch nur zu, wenn sie glaubhaft machen, dass durch die Ausgliederung die Erfüllung der Forderung gefährdet wird."
    },
    {
      "date": "2025-12-15",
      "id": "139973",
      "original_text": "Registerbekanntmachung nach dem Umwandlungsgesetz\nSachsen Amtsgericht Chemnitz HRA 10224\nFreddy Fresh Chemnitz Mitte e.K. – Chemnitz",
      "type": "Registerbekanntmachung nach dem Umwandlungsgesetz",
      "state": "Sachsen",
      "amtsgericht": "Amtsgericht Chemnitz",
      "registernummer": "HRA 10224",
      "registerart": "HRA",
      "company_name": "Freddy Fresh Chemnitz Mitte e.K.",
      "company_seat": "Chemnitz",
      "details": "15.12.2025 (Bekanntmachungsdatum)\n\nSachsen Amtsgericht Chemnitz HRA 10224\nRegisterbekanntmachung nach dem Umwandlungsgesetz 15.12.2025 (Eintragungsdatum)\n\nFreddy Fresh Chemnitz Mitte e.K.\nEinzelkaufmann / Einzelkauffrau\nChemnitz\n\nDen Gläubigern der an der Ausgliederung beteiligten Rechtsträger ist, wenn sie binnen sechs Monaten nach dem Tag, an dem die Eintragung der Ausgliederung in das Register des Sitzes desjenigen Rechtsträgers, dessen Gläubiger sie sind, nach § 19 Abs. 3 UmwG als bekannt gemacht gilt, ihren Anspruch nach Grund und Höhe in Textform anmelden, Sicherheit zu leisten, soweit sie nicht Befriedigung verlangen können. Dieses Recht steht den Gläubigern jedoch nur zu, wenn sie glaubhaft machen, dass durch die Ausgliederung die Erfüllung der Forderung gefährdet wird."
    },
    {
      "date": "2025-12-15",
      "id": "139974",
      "original_text": "Löschungsankündigung\nSachsen Amtsgericht Dresden HRB 25419\nElektro Bürger GmbH – Dresden",
      "type": "Löschungsankündigung",
      "state": "Sachsen",
      "amtsgericht": "Amtsgericht Dresden",
      "registernummer": "HRB 25419",
      "registerart": "HRB",
      "company_name": "Elektro Bürger GmbH",
      "company_seat": "Dresden",
      "details": "15.12.2025 (Bekanntmachungsdatum)\n\nSachsen Amtsgericht Dresden HRB 25419\nLöschungsankündigung\n\nElektro Bürger GmbH\nGesellschaft mit beschränkter Haftung\nDresden\n\nDas Registergericht beabsichtigt, die im Handelsregister eingetragene Gesellschaft von Amts wegen nach § 394 FamFG zu löschen. Die Frist zu Erhebung eines Widerspruchs gegen die beabsichtigte Löschung wird auf einen Monat festgesetzt."
    },
    {
      "date": "2025-12-15",
      "id": "139975",
      "original_text": "Registerbekanntmachung nach dem Umwandlungsgesetz\nSachsen Amtsgericht Chemnitz HRA 10225\nSlezak und Kadalla OHG – Chemnitz",
      "type": "Registerbekanntmachung nach dem Umwandlungsgesetz",
      "state": "Sachsen",
      "amtsgericht": "Amtsgericht Chemnitz",
      "registernummer": "HRA 10225",
      "registerart": "HRA",
      "company_name": "Slezak und Kadalla OHG",
      "company_seat": "Chemnitz",
      "details": "15.12.2025 (Bekanntmachungsdatum)\n\nSachsen Amtsgericht Chemnitz HRA 10225\nRegisterbekanntmachung nach dem Umwandlungsgesetz 15.12.2025 (Eintragungsdatum)\n\nSlezak und Kadalla OHG\nOffene Handelsgesellschaft\nChemnitz\n\nDen Gläubigern der an der Ausgliederung beteiligten Rechtsträger ist, wenn sie binnen sechs Monaten nach dem Tag, an dem die Eintragung der Ausgliederung in das Register des Sitzes desjenigen Rechtsträgers, dessen Gläubiger sie sind, nach § 19 Abs. 3 UmwG als bekannt gemacht gilt, ihren Anspruch nach Grund und Höhe in Textform anmelden, Sicherheit zu leisten, soweit sie nicht Befriedigung verlangen können. Dieses Recht steht den Gläubigern jedoch nur zu, wenn sie glaubhaft machen, dass durch die Ausgliederung die Erfüllung der Forderung gefährdet wird."
    },
    {
      "date": "2025-12-15",
      "id": "139976",
      "original_text": "Registerbekanntmachung nach dem Umwandlungsgesetz\nSachsen Amtsgericht Chemnitz HRA 10225\nSlezak und Kadalla OHG – Chemnitz",
      "type": "Registerbekanntmachung nach dem Umwandlungsgesetz",
      "state": "Sachsen",
      "amtsgericht": "Amtsgericht Chemnitz",
      "registernummer": "HRA 10225",
      "registerart": "HRA",
      "company_name": "Slezak und Kadalla OHG",
      "company_seat": "Chemnitz",
      "details": "15.12.2025 (Bekanntmachungsdatum)\n\nSachsen Amtsgericht Chemnitz HRA 10225\nRegisterbekanntmachung nach dem Umwandlungsgesetz 15.12.2025 (Eintragungsdatum)\n\nSlezak und Kadalla OHG\nOffene Handelsgesellschaft\nChemnitz\n\nDen Gläubigern der an der Ausgliederung beteiligten Rechtsträger ist, wenn sie binnen sechs Monaten nach dem Tag, an dem die Eintragung der Ausgliederung in das Register des Sitzes desjenigen Rechtsträgers, dessen Gläubiger sie sind, nach § 19 Abs. 3 UmwG als bekannt gemacht gilt, ihren Anspruch nach Grund und Höhe in Textform anmelden, Sicherheit zu leisten, soweit sie nicht Befriedigung verlangen können. Dieses Recht steht den Gläubigern jedoch nur zu, wenn sie glaubhaft machen, dass durch die Ausgliederung die Erfüllung der Forderung gefährdet wird."
    },
    {
      "date": "2025-12-15",
      "id": "139977",
      "original_text": "Registerbekanntmachung nach dem Umwandlungsgesetz\nBaden-Württemberg Amtsgericht Stuttgart HRB 765724\ntrip to evolution GmbH – Stuttgart",
      "type": "Registerbekanntmachung nach dem Umwandlungsgesetz",
      "state": "Baden-Württemberg",
      "amtsgericht": "Amtsgericht Stuttgart",
      "registernummer": "HRB 765724",
      "registerart": "HRB",
      "company_name": "trip to evolution GmbH",
      "company_seat": "Stuttgart",
      "details": "15.12.2025 (Bekanntmachungsdatum)\n\nBaden-Württemberg Amtsgericht Stuttgart HRB 765724\nRegisterbekanntmachung nach dem Umwandlungsgesetz 15.12.2025 (Eintragungsdatum)\n\ntrip to evolution GmbH\nGesellschaft mit beschränkter Haftung\nStuttgart\n\nAls nicht eingetragen wird bekanntgemacht:\nDen Gläubigern der an der Verschmelzung beteiligten Rechtsträger ist, wenn sie binnen sechs Monaten nach dem Tag, an dem die Eintragung der Verschmelzung in das Register des Sitzes desjenigen Rechtsträgers, dessen Gläubiger sie sind, nach § 19 Abs. 3 UmwG als bekanntgemacht gilt, ihren Anspruch nach Grund und Höhe schriftlich anmelden, Sicherheit zu leisten, soweit sie nicht Befriedigung verlangen können. Dieses Recht steht den Gläubigern jedoch nur zu, wenn sie glaubhaft machen, dass durch die Verschmelzung die Erfüllung ihrer Forderung gefährdet wird."
    },
    {
      "date": "2025-12-15",
      "id": "139978",
      "original_text": "Löschungsankündigung\nNiedersachsen Amtsgericht Osnabrück HRB 206197\nABBA GmbH – Bissendorf",
      "type": "Löschungsankündigung",
      "state": "Niedersachsen",
      "amtsgericht": "Amtsgericht Osnabrück",
      "registernummer": "HRB 206197",
      "registerart": "HRB",
      "company_name": "ABBA GmbH",
      "company_seat": "Bissendorf",
      "details": "15.12.2025 (Bekanntmachungsdatum)\n\nNiedersachsen Amtsgericht Osnabrück HRB 206197\nLöschungsankündigung\n\nABBA GmbH\nGesellschaft mit beschränkter Haftung\nBissendorf\n\nDas Registergericht beabsichtigt, die Gesellschaft von Amts wegen nach § 394 FamFG wegen Vermögenslosigkeit zu löschen. Die Frist zur Erhebung eines Widerspruchs ist auf 1 Monat ab dieser Registerbekanntmachung festgesetzt."
    },
    {
      "date": "2025-12-15",
      "id": "139979",
      "original_text": "Registerbekanntmachung nach dem Umwandlungsgesetz\nNiedersachsen Amtsgericht Aurich HRA 203851\nSand Schröder Inhaber Arno Schröder e. K. – Moormerland",
      "type": "Registerbekanntmachung nach dem Umwandlungsgesetz",
      "state": "Niedersachsen",
      "amtsgericht": "Amtsgericht Aurich",
      "registernummer": "HRA 203851",
      "registerart": "HRA",
      "company_name": "Sand Schröder Inhaber Arno Schröder e. K.",
      "company_seat": "Moormerland",
      "details": "15.12.2025 (Bekanntmachungsdatum)\n\nNiedersachsen Amtsgericht Aurich HRA 203851\nRegisterbekanntmachung nach dem Umwandlungsgesetz 15.12.2025 (Eintragungsdatum)\n\nSand Schröder Inhaber Arno Schröder e. K.\nEinzelkaufmann / Einzelkauffrau\nMoormerland\n\nDen Gläubigern der an der Ausgliederung beteiligten Rechtsträger ist, wenn sie binnen sechs Monaten nach dem Tag, an dem die Eintragung der Ausgliederung in das Register des Sitzes desjenigen Rechtsträgers, dessen Gläubiger sie sind, nach § 19 Abs. 3 UmwG als bekannt gemacht gilt, ihren Anspruch nach Grund und Höhe schriftlich anmelden, Sicherheit zu leisten, soweit sie nicht Befriedigung verlangen können. Dieses Recht steht den Gläubigern jedoch nur zu, wenn sie glaubhaft machen, dass durch die Ausgliederung die Erfüllung der Forderung gefährdet wird."
    },
    {
      "date": "2025-12-15",
      "id": "139980",
      "original_text": "Sonstige Registerbekanntmachung\nNiedersachsen Amtsgericht Hannover HRB 223315\nFaurecia Automotive GmbH – Hannover",
      "type": "Sonstige Registerbekanntmachung",
      "state": "Niedersachsen",
      "amtsgericht": "Amtsgericht Hannover",
      "registernummer": "HRB 223315",
      "registerart": "HRB",
      "company_name": "Faurecia Automotive GmbH",
      "company_seat": "Hannover",
      "details": "15.12.2025 (Bekanntmachungsdatum)\n\nNiedersachsen Amtsgericht Hannover HRB 223315\nSonstige Registerbekanntmachung\n\nFaurecia Automotive GmbH\nGesellschaft mit beschränkter Haftung\nHannover\n\nDie Liste der Mitglieder des Aufsichtsrats wurde beim Registergericht eingereicht."
    },
    {
      "date": "2025-12-15",
      "id": "139981",
      "original_text": "Registerbekanntmachung nach dem Umwandlungsgesetz\nNiedersachsen Amtsgericht Oldenburg (Oldenburg) HRA 205113\nWEBE Beteiligungs GmbH & Co. KG – Garrel",
      "type": "Registerbekanntmachung nach dem Umwandlungsgesetz",
      "state": "Niedersachsen",
      "amtsgericht": "Amtsgericht Oldenburg (Oldenburg)",
      "registernummer": "HRA 205113",
      "registerart": "HRA",
      "company_name": "WEBE Beteiligungs GmbH & Co. KG",
      "company_seat": "Garrel",
      "details": "15.12.2025 (Bekanntmachungsdatum)\n\nNiedersachsen Amtsgericht Oldenburg (Oldenburg) HRA 205113\nRegisterbekanntmachung nach dem Umwandlungsgesetz 15.12.2025 (Eintragungsdatum)\n\nWEBE Beteiligungs GmbH & Co. KG\nKommanditgesellschaft\nGarrel\n\nDen Gläubigern der an der Verschmelzung beteiligten Rechtsträger ist, wenn sie binnen sechs Monaten nach dem Tag, an dem die Eintragung der Verschmelzung in das Register des Sitzes desjenigen Rechtsträgers, dessen Gläubiger sie sind, nach § 19  Abs.  3 UmwG als bekannt gemacht gilt, ihren Anspruch nach Grund und Höhe schriftlich anmelden, Sicherheit zu leisten, soweit sie nicht Befriedigung verlangen können. Dieses Recht steht den Gläubigern jedoch nur zu, wenn sie glaubhaft machen, dass durch die Verschmelzung die Erfüllung der Forderung gefährdet wird."
    },
    {
      "date": "2025-12-15",
      "id": "139982",
      "original_text": "Registerbekanntmachung nach dem Umwandlungsgesetz\nNiedersachsen Amtsgericht Oldenburg (Oldenburg) HRB 211380\nUBG Beteiligungen GmbH & Co. KGaA – Garrel",
      "type": "Registerbekanntmachung nach dem Umwandlungsgesetz",
      "state": "Niedersachsen",
      "amtsgericht": "Amtsgericht Oldenburg (Oldenburg)",
      "registernummer": "HRB 211380",
      "registerart": "HRB",
      "company_name": "UBG Beteiligungen GmbH & Co. KGaA",
      "company_seat": "Garrel",
      "details": "15.12.2025 (Bekanntmachungsdatum)\n\nNiedersachsen Amtsgericht Oldenburg (Oldenburg) HRB 211380\nRegisterbekanntmachung nach dem Umwandlungsgesetz 15.12.2025 (Eintragungsdatum)\n\nUBG Beteiligungen GmbH & Co. KGaA\nKommanditgesellschaft auf Aktien\nGarrel\n\nDen Gläubigern der an der Verschmelzung beteiligten Rechtsträger ist, wenn sie binnen sechs Monaten nach dem Tag, an dem die Eintragung der Verschmelzung in das Register des Sitzes desjenigen Rechtsträgers, dessen Gläubiger sie sind, nach § 19  Abs.  3 UmwG als bekannt gemacht gilt, ihren Anspruch nach Grund und Höhe schriftlich anmelden, Sicherheit zu leisten, soweit sie nicht Befriedigung verlangen können. Dieses Recht steht den Gläubigern jedoch nur zu, wenn sie glaubhaft machen, dass durch die Verschmelzung die Erfüllung der Forderung gefährdet wird."
    },
    {
      "date": "2025-12-15",
      "id": "139983",
      "original_text": "Registerbekanntmachung nach dem Umwandlungsgesetz\nNiedersachsen Amtsgericht Osnabrück HRB 215135\nMomentum by Tea Time GmbH – Lingen (Ems)",
      "type": "Registerbekanntmachung nach dem Umwandlungsgesetz",
      "state": "Niedersachsen",
      "amtsgericht": "Amtsgericht Osnabrück",
      "registernummer": "HRB 215135",
      "registerart": "HRB",
      "company_name": "Momentum by Tea Time GmbH",
      "company_seat": "Lingen (Ems)",
      "details": "15.12.2025 (Bekanntmachungsdatum)\n\nNiedersachsen Amtsgericht Osnabrück HRB 215135\nRegisterbekanntmachung nach dem Umwandlungsgesetz 15.12.2025 (Eintragungsdatum)\n\nMomentum by Tea Time GmbH\nGesellschaft mit beschränkter Haftung\nLingen (Ems)\n\nDen Gläubigern der an der Verschmelzung beteiligten Rechtsträger ist, wenn sie binnen sechs Monaten nach dem Tag, an dem die Eintragung der Verschmelzung in das Register des Sitzes desjenigen Rechtsträgers, dessen Gläubiger sie sind, nach § 19  Abs.  3 UmwG als bekannt gemacht gilt, ihren Anspruch nach Grund und Höhe schriftlich anmelden, Sicherheit zu leisten, soweit sie nicht Befriedigung verlangen können. Dieses Recht steht den Gläubigern jedoch nur zu, wenn sie glaubhaft machen, dass durch die Verschmelzung die Erfüllung der Forderung gefährdet wird."
    },
    {
      "date": "2025-12-15",
      "id": "139984",
      "original_text": "Löschungsankündigung\nNiedersachsen Amtsgericht Lüneburg HRB 204820\nH & S Transporte GmbH – Seevetal",
      "type": "Löschungsankündigung",
      "state": "Niedersachsen",
      "amtsgericht": "Amtsgericht Lüneburg",
      "registernummer": "HRB 204820",
      "registerart": "HRB",
      "company_name": "H & S Transporte GmbH",
      "company_seat": "Seevetal",
      "details": "15.12.2025 (Bekanntmachungsdatum)\n\nNiedersachsen Amtsgericht Lüneburg HRB 204820\nLöschungsankündigung\n\nH & S Transporte GmbH\nGesellschaft mit beschränkter Haftung\nSeevetal\n\nDas Registergericht beabsichtigt, die Gesellschaft von Amts wegen nach § 394 FamFG zu löschen. Die Frist zur Erhebung eines Widerspruchs ist auf 1 Monat ab dieser Registerbekanntmachung festgesetzt."
    },
    {
      "date": "2025-12-15",
      "id": "139985",
      "original_text": "Löschungsankündigung\nNiedersachsen Amtsgericht Aurich HRB 100583 früher Amtsgericht Emden\nMS \"Frisian Star\" Verwaltungs GmbH – Emden",
      "type": "Löschungsankündigung",
      "state": "Niedersachsen",
      "amtsgericht": "Amtsgericht Aurich",
      "registernummer": "HRB 100583",
      "registerart": "HRB",
      "company_name": "MS \"Frisian Star\" Verwaltungs GmbH",
      "company_seat": "Emden",
      "former_amtsgericht": "Emden",
      "details": "15.12.2025 (Bekanntmachungsdatum)\n\nNiedersachsen Amtsgericht Aurich HRB 100583 früher Amtsgericht Emden\nLöschungsankündigung 15.12.2025 (Eintragungsdatum)\n\nMS \"Frisian Star\" Verwaltungs GmbH\nGesellschaft mit beschränkter Haftung\nEmden\n\nDas Registergericht beabsichtigt, die Gesellschaft von Amts wegen nach § 394 FamFG zu löschen. Die Frist zur Erhebung eines Widerspruchs ist auf 1 Monat ab dieser Registerbekanntmachung festgesetzt."
    },
    {
      "date": "2025-12-15",
      "id": "139986",
      "original_text": "Einreichung neuer Dokumente\nNiedersachsen Amtsgericht Osnabrück HRB 20081\nGeo-Tex Recycling AktiengeselIschaft – Quakenbrück",
      "type": "Einreichung neuer Dokumente",
      "state": "Niedersachsen",
      "amtsgericht": "Amtsgericht Osnabrück",
      "registernummer": "HRB 20081",
      "registerart": "HRB",
      "company_name": "Geo-Tex Recycling AktiengeselIschaft",
      "company_seat": "Quakenbrück",
      "details": "15.12.2025 (Bekanntmachungsdatum)\n\nNiedersachsen Amtsgericht Osnabrück HRB 20081\nEinreichung neuer Dokumente\n\nGeo-Tex Recycling AktiengeselIschaft\nAktiengesellschaft\nQuakenbrück\n\nDie Liste der Mitglieder des Aufsichtsrats wurde beim Registergericht eingereicht."
    },
    {
      "date": "2025-12-15",
      "id": "139987",
      "original_text": "Registerbekanntmachung nach dem Umwandlungsgesetz\nNiedersachsen Amtsgericht Aurich HRA 203791\nSand Schröder GmbH & Co. KG – Moormerland",
      "type": "Registerbekanntmachung nach dem Umwandlungsgesetz",
      "state": "Niedersachsen",
      "amtsgericht": "Amtsgericht Aurich",
      "registernummer": "HRA 203791",
      "registerart": "HRA",
      "company_name": "Sand Schröder GmbH & Co. KG",
      "company_seat": "Moormerland",
      "details": "15.12.2025 (Bekanntmachungsdatum)\n\nNiedersachsen Amtsgericht Aurich HRA 203791\nRegisterbekanntmachung nach dem Umwandlungsgesetz 15.12.2025 (Eintragungsdatum)\n\nSand Schröder GmbH & Co. KG\nKommanditgesellschaft\nMoormerland\n\nDen Gläubigern der an der Ausgliederung beteiligten Rechtsträger ist, wenn sie binnen sechs Monaten nach dem Tag, an dem die Eintragung der Ausgliederung in das Register des Sitzes desjenigen Rechtsträgers, dessen Gläubiger sie sind, nach § 19 Abs. 3 UmwG als bekannt gemacht gilt, ihren Anspruch nach Grund und Höhe schriftlich anmelden, Sicherheit zu leisten, soweit sie nicht Befriedigung verlangen können. Dieses Recht steht den Gläubigern jedoch nur zu, wenn sie glaubhaft machen, dass durch die Ausgliederung die Erfüllung der Forderung gefährdet wird."
    },
    {
      "date": "2025-12-15",
      "id": "139988",
      "original_text": "Sonstige Registerbekanntmachung\nNiedersachsen Amtsgericht Hannover HRB 101998 früher Amtsgericht Hameln\nWeserbergland Aktiengesellschaft – Hameln",
      "type": "Sonstige Registerbekanntmachung",
      "state": "Niedersachsen",
      "amtsgericht": "Amtsgericht Hannover",
      "registernummer": "HRB 101998",
      "registerart": "HRB",
      "company_name": "Weserbergland Aktiengesellschaft",
      "company_seat": "Hameln",
      "former_amtsgericht": "Hameln",
      "details": "15.12.2025 (Bekanntmachungsdatum)\n\nNiedersachsen Amtsgericht Hannover HRB 101998 früher Amtsgericht Hameln\nSonstige Registerbekanntmachung\n\nWeserbergland Aktiengesellschaft\nAktiengesellschaft\nHameln\n\nDie Liste der Mitglieder des Aufsichtsrats wurde beim Registergericht eingereicht."
    },
    {
      "date": "2025-12-15",
      "id": "139989",
      "original_text": "Löschungsankündigung\nNiedersachsen Amtsgericht Osnabrück HRB 214910\nKW Beteiligungs GmbH – Werlte",
      "type": "Löschungsankündigung",
      "state": "Niedersachsen",
      "amtsgericht": "Amtsgericht Osnabrück",
      "registernummer": "HRB 214910",
      "registerart": "HRB",
      "company_name": "KW Beteiligungs GmbH",
      "company_seat": "Werlte",
      "details": "15.12.2025 (Bekanntmachungsdatum)\n\nNiedersachsen Amtsgericht Osnabrück HRB 214910\nLöschungsankündigung\n\nKW Beteiligungs GmbH\nGesellschaft mit beschränkter Haftung\nWerlte\n\nDas Registergericht beabsichtigt, die Gesellschaft von Amts wegen nach § 394 FamFG wegen Vermögenslosigkeit zu löschen. Die Frist zur Erhebung eines Widerspruchs ist auf 1 Monat ab dieser Registerbekanntmachung festgesetzt."
    },
    {
      "date": "2025-12-15",
      "id": "139990",
      "original_text": "Registerbekanntmachung nach dem Umwandlungsgesetz\nRheinland-Pfalz Amtsgericht Mainz HRB 53047\nevoila Germany GmbH – Mainz",
      "type": "Registerbekanntmachung nach dem Umwandlungsgesetz",
      "state": "Rheinland-Pfalz",
      "amtsgericht": "Amtsgericht Mainz",
      "registernummer": "HRB 53047",
      "registerart": "HRB",
      "company_name": "evoila Germany GmbH",
      "company_seat": "Mainz",
      "details": "15.12.2025 (Bekanntmachungsdatum)\n\nRheinland-Pfalz Amtsgericht Mainz HRB 53047\nRegisterbekanntmachung nach dem Umwandlungsgesetz 15.12.2025 (Eintragungsdatum)\n\nevoila Germany GmbH\nGesellschaft mit beschränkter Haftung\nMainz\n\nDie Verschmelzung der evoila Germany Gmbh ist am 15.12.2025 in das Handelsregister eingetragen worden. Die Gläubiger der an der Verschmelzung beteiligten Rechtsträger werden hiermit gemäß § 22 UmwG aufgefordert, ihre Ansprüche nach Grund und Höhe innerhalb von sechs Monaten ab dem Tag dieser Bekanntmachung in Textform anzumelden. Den Gläubigern ist auf Verlangen Sicherheit zu leisten, soweit sie nicht Befriedigung verlangen können und glaubhaft machen, dass durch die Verschmelzung die Erfüllung ihrer Forderung gefährdet wird."
    },
    {
      "date": "2025-12-15",
      "id": "139991",
      "original_text": "Löschungsankündigung\nRheinland-Pfalz Amtsgericht Ludwigshafen a.Rhein (Ludwigshafen) HRB 68680\nGhost Consulting GmbH – Bad Dürkheim",
      "type": "Löschungsankündigung",
      "state": "Rheinland-Pfalz",
      "amtsgericht": "Amtsgericht Ludwigshafen a.Rhein (Ludwigshafen)",
      "registernummer": "HRB 68680",
      "registerart": "HRB",
      "company_name": "Ghost Consulting GmbH",
      "company_seat": "Bad Dürkheim",
      "details": "15.12.2025 (Bekanntmachungsdatum)\n\nRheinland-Pfalz Amtsgericht Ludwigshafen a.Rhein (Ludwigshafen) HRB 68680\nLöschungsankündigung\n\nGhost Consulting GmbH\nGesellschaft mit beschränkter Haftung\nBad Dürkheim\n\nDas Registergericht beabsichtigt die Gesellschaft von Amts wegen nach § 394 FamFG zu löschen. Die Frist zur Erhebung eines Widerspruchs ist auf einen Monat festgesetzt."
    },
    {
      "date": "2025-12-15",
      "id": "139992",
      "original_text": "Löschungsankündigung\nRheinland-Pfalz Amtsgericht Wittlich HRB 44726\nPrestige Autos GmbH – Trier",
      "type": "Löschungsankündigung",
      "state": "Rheinland-Pfalz",
      "amtsgericht": "Amtsgericht Wittlich",
      "registernummer": "HRB 44726",
      "registerart": "HRB",
      "company_name": "Prestige Autos GmbH",
      "company_seat": "Trier",
      "details": "15.12.2025 (Bekanntmachungsdatum)\n\nRheinland-Pfalz Amtsgericht Wittlich HRB 44726\nLöschungsankündigung\n\nPrestige Autos GmbH\nGesellschaft mit beschränkter Haftung\nTrier\n\nDas Registergericht beabsichtigt die Gesellschaft von Amts wegen nach § 394 FamFG zu löschen. Die Frist zur Erhebung eines Widerspruchs ist auf einen Monat festgesetzt."
    },
    {
      "date": "2025-12-15",
      "id": "139993",
      "original_text": "Löschungsankündigung\nRheinland-Pfalz Amtsgericht Mainz HRB 51641\nIvanova Speedclean GmbH – Bingen am Rhein",
      "type": "Löschungsankündigung",
      "state": "Rheinland-Pfalz",
      "amtsgericht": "Amtsgericht Mainz",
      "registernummer": "HRB 51641",
      "registerart": "HRB",
      "company_name": "Ivanova Speedclean GmbH",
      "company_seat": "Bingen am Rhein",
      "details": "15.12.2025 (Bekanntmachungsdatum)\n\nRheinland-Pfalz Amtsgericht Mainz HRB 51641\nLöschungsankündigung\n\nIvanova Speedclean GmbH\nGesellschaft mit beschränkter Haftung\nBingen am Rhein\n\nDas Registergericht beabsichtigt die Gesellschaft von Amts wegen nach § 394 FamFG zu löschen. Die Frist zur Erhebung eines Widerspruchs ist auf einen Monat festgesetzt."
    },
    {
      "date": "2025-12-15",
      "id": "139994",
      "original_text": "Löschungsankündigung\nNordrhein-Westfalen Amtsgericht Düsseldorf HRA 7881\nMEDICO-FONDS Nr. 6 M F Management GmbH & Co. Kommanditgesellschaft – Düsseldorf",
      "type": "Löschungsankündigung",
      "state": "Nordrhein-Westfalen",
      "amtsgericht": "Amtsgericht Düsseldorf",
      "registernummer": "HRA 7881",
      "registerart": "HRA",
      "company_name": "MEDICO-FONDS Nr. 6 M F Management GmbH & Co. Kommanditgesellschaft",
      "company_seat": "Düsseldorf",
      "details": "15.12.2025 (Bekanntmachungsdatum)\n\nNordrhein-Westfalen Amtsgericht Düsseldorf HRA 7881\nLöschungsankündigung\n\nMEDICO-FONDS Nr. 6 M F Management GmbH & Co. Kommanditgesellschaft\nKommanditgesellschaft\nDüsseldorf\n\nDas Registergericht beabsichtigt die Firma von Amts wegen nach § 394 Abs. 4  FamFG zu löschen, da offenbar keine Vermögenswerte mehr vorhanden sind und bereits die persönlich haftende Gesellschafterin wegen Vermögenslosigkeit gelöscht worden ist. Die Frist zur Erhebung eines Widerspruchs ist auf einen Monat festgesetzt.\n\nRechtsbehelfsbelehrung:\nDas Widerspruchsrecht steht jedem zu, der an der Unterlassung der Löschung ein berechtigtes Interesse hat. Der Widerspruch ist bei dem Amtsgericht Düsseldorf -Registergericht-, Werdener Straße 1, 40227 Düsseldorf schriftlich in deutscher Sprache oder zur Niederschrift der Geschäftsstelle einzulegen. Der Widerspruch kann auch zur Niederschrift der Geschäftsstelle eines jeden Amtsgerichtes abgegeben werden. Die Einlegung ist auch durch Übertragung eines elektronischen Dokuments an die elektronische Poststelle des Gerichts möglich. Das elektronische Dokument muss für die Bearbeitung durch das Gericht geeignet und mit einer qualifizierten elektronischen Signatur der verantwortenden Person versehen sein oder von der verantwortenden Person signiert und auf einem sicheren Übermittlungsweg gemäß § 130a ZPO nach näherer Maßgabe der Verordnung über die technischen Rahmenbedingungen des elektronischen Rechtsverkehrs und über das besondere elektronische Behördenpostfach (BGBl. I, S.3803) eingereicht werden. Weitere Informationen erhalten Sie auf der Internetseite www.justiz.de.\nDer Widerspruch muss spätestens innerhalb der gesetzten Frist nach dem Datum der Bekanntmachung der Löschungsankündigung bei dem Amtsgericht - Registergericht - Düsseldorf eingegangen sein.  Dies gilt auch dann, wenn der Widerspruch zur Niederschrift der Geschäftsstelle eines anderen Amtsgerichtes abgegeben wurde. Die Frist beginnt mit dem Tage der Bekanntmachung der Löschungsankündigung in dem für die Bekanntmachung der Eintragungen in das Handelsregister bestimmten elektronischen Informations- und Kommunikationssystem nach § 10 des Handelsgesetzbuches. Fällt das Ende der Frist auf einen Sonntag, einen allgemeinen Feiertag oder Sonnabend, so endet die Frist mit Ablauf des nächsten Werktages.\nDer Widerspruch muss die Bezeichnung der angefochtenen Löschungsankündigung sowie die Erklärung enthalten, dass Widerspruch gegen diese Löschungsankündigung eingelegt wird. Er ist zu unterzeichnen und soll begründet werden."
    },
    {
      "date": "2025-12-15",
      "id": "139995",
      "original_text": "Löschungsankündigung\nNordrhein-Westfalen Amtsgericht Köln HRA 16376\nPeter Hafke Transporte e.K. – Radevormwald",
      "type": "Löschungsankündigung",
      "state": "Nordrhein-Westfalen",
      "amtsgericht": "Amtsgericht Köln",
      "registernummer": "HRA 16376",
      "registerart": "HRA",
      "company_name": "Peter Hafke Transporte e.K.",
      "company_seat": "Radevormwald",
      "details": "15.12.2025 (Bekanntmachungsdatum)\n\nNordrhein-Westfalen Amtsgericht Köln HRA 16376\nLöschungsankündigung 15.12.2025 (Eintragungsdatum)\n\nPeter Hafke Transporte e.K.\nEinzelkaufmann / Einzelkauffrau\nRadevormwald\n\nDas Registergericht beabsichtigt die Firma von Amts wegen nach § 31 Abs. 2 HGB, § 393 FamFG zu löschen. Die Frist zur Erhebung eines Widerspruchs ist auf einen Monat festgesetzt."
    },
    {
      "date": "2025-12-15",
      "id": "139996",
      "original_text": "Registerbekanntmachung nach dem Umwandlungsgesetz\nNordrhein-Westfalen Amtsgericht Düsseldorf HRB 111263\nThe Platform Group SE & Co. KGaA – Düsseldorf",
      "type": "Registerbekanntmachung nach dem Umwandlungsgesetz",
      "state": "Nordrhein-Westfalen",
      "amtsgericht": "Amtsgericht Düsseldorf",
      "registernummer": "HRB 111263",
      "registerart": "HRB",
      "company_name": "The Platform Group SE & Co. KGaA",
      "company_seat": "Düsseldorf",
      "details": "15.12.2025 (Bekanntmachungsdatum)\n\nNordrhein-Westfalen Amtsgericht Düsseldorf HRB 111263\nRegisterbekanntmachung nach dem Umwandlungsgesetz 15.12.2025 (Eintragungsdatum)\n\nThe Platform Group SE & Co. KGaA\nKommanditgesellschaft auf Aktien\nDüsseldorf\n\nDen Gläubigern der an der formwechselnden Umwandlung beteiligten Rechtsträger ist, wenn sie binnen sechs Monaten nach dem Tag, an dem die Eintragung der formwechselnden Umwandlung in das Register des Sitzes desjenigen Rechtsträgers, dessen Gläubiger sie sind, nach § 19 Absatz 3 UmwG als bekanntgemacht gilt, ihren Anspruch nach Grund und Höhe schriftlich anmelden, Sicherheit zu leisten, soweit sie nicht Befriedigung verlangen können. Dieses Recht steht den Gläubigern jedoch nur zu, wenn sie glaubhaft machen, dass durch die formwechselnden Umwandlung die Erfüllung ihrer Forderung gefährdet wird."
    },
    {
      "date": "2025-12-15",
      "id": "139997",
      "original_text": "Einreichung neuer Dokumente\nNordrhein-Westfalen Amtsgericht Iserlohn HRB 5096\nWohnungsgesellschaft Werdohl GmbH – Werdohl",
      "type": "Einreichung neuer Dokumente",
      "state": "Nordrhein-Westfalen",
      "amtsgericht": "Amtsgericht Iserlohn",
      "registernummer": "HRB 5096",
      "registerart": "HRB",
      "company_name": "Wohnungsgesellschaft Werdohl GmbH",
      "company_seat": "Werdohl",
      "details": "15.12.2025 (Bekanntmachungsdatum)\n\nNordrhein-Westfalen Amtsgericht Iserlohn HRB 5096\nEinreichung neuer Dokumente 15.12.2025 (Eintragungsdatum)\n\nWohnungsgesellschaft Werdohl GmbH\nGesellschaft mit beschränkter Haftung\nWerdohl\n\nDem Registergericht ist eine neue Liste der Mitglieder des Aufsichtsrates eingereicht worden."
    },
    {
      "date": "2025-12-15",
      "id": "139998",
      "original_text": "Registerbekanntmachung nach dem Umwandlungsgesetz\nNordrhein-Westfalen Amtsgericht Bonn HRB 29484\nGFI - Euskirchen GmbH – Euskirchen",
      "type": "Registerbekanntmachung nach dem Umwandlungsgesetz",
      "state": "Nordrhein-Westfalen",
      "amtsgericht": "Amtsgericht Bonn",
      "registernummer": "HRB 29484",
      "registerart": "HRB",
      "company_name": "GFI - Euskirchen GmbH",
      "company_seat": "Euskirchen",
      "details": "15.12.2025 (Bekanntmachungsdatum)\n\nNordrhein-Westfalen Amtsgericht Bonn HRB 29484\nRegisterbekanntmachung nach dem Umwandlungsgesetz 15.12.2025 (Eintragungsdatum)\n\nGFI - Euskirchen GmbH\nGesellschaft mit beschränkter Haftung\nEuskirchen\n\nDen Gläubigern der an der Verschmelzung beteiligten Rechtsträger ist, wenn sie binnen sechs Monaten nach dem Tag, an dem die Eintragung der Verschmelzung in das Register des Sitzes desjenigen Rechtsträgers, dessen Gläubiger sie sind, nach § 19 Absatz 3 UmwG als bekanntgemacht gilt, ihren Anspruch nach Grund und Höhe schriftlich anmelden, Sicherheit zu leisten, soweit sie nicht Befriedigung verlangen können. Dieses Recht steht den Gläubigern jedoch nur zu, wenn sie glaubhaft machen, dass durch die Verschmelzung die Erfüllung ihrer Forderung gefährdet wird."
    },
    {
      "date": "2025-12-15",
      "id": "139999",
      "original_text": "Registerbekanntmachung nach dem Umwandlungsgesetz\nNordrhein-Westfalen Amtsgericht Siegen HRB 12595\nWayma GmbH – Olpe",
      "type": "Registerbekanntmachung nach dem Umwandlungsgesetz",
      "state": "Nordrhein-Westfalen",
      "amtsgericht": "Amtsgericht Siegen",
      "registernummer": "HRB 12595",
      "registerart": "HRB",
      "company_name": "Wayma GmbH",
      "company_seat": "Olpe",
      "details": "15.12.2025 (Bekanntmachungsdatum)\n\nNordrhein-Westfalen Amtsgericht Siegen HRB 12595\nRegisterbekanntmachung nach dem Umwandlungsgesetz 15.12.2025 (Eintragungsdatum)\n\nWayma GmbH\nGesellschaft mit beschränkter Haftung\nOlpe\n\nDen Gläubigern der an der Verschmelzung beteiligten Rechtsträger ist, wenn sie binnen sechs Monaten nach dem Tag, an dem die Eintragung der Verschmelzung in das Register des Sitzes derjenigen Rechtsträger deren Gläubiger sie sind, nach § 19 Absatz 3 UmwG als bekanntgemacht gilt, ihren Anspruch nach Grund und Höhe schriftlich anmelden, Sicherheit zu leisten, soweit sie nicht Befriedigung verlangen können. Dieses Recht steht den Gläubigern jedoch nur zu, wenn sie glaubhaft machen, dass durch die Verschmelzung die Erfüllung ihrer Forderung gefährdet wird."
    },
    {
      "date": "2025-12-15",
      "id": "140000",
      "original_text": "Registerbekanntmachung nach dem Umwandlungsgesetz\nNordrhein-Westfalen Amtsgericht Siegen HRB 11370\nDelutions GmbH – Olpe",
      "type": "Registerbekanntmachung nach dem Umwandlungsgesetz",
      "state": "Nordrhein-Westfalen",
      "amtsgericht": "Amtsgericht Siegen",
      "registernummer": "HRB 11370",
      "registerart": "HRB",
      "company_name": "Delutions GmbH",
      "company_seat": "Olpe",
      "details": "15.12.2025 (Bekanntmachungsdatum)\n\nNordrhein-Westfalen Amtsgericht Siegen HRB 11370\nRegisterbekanntmachung nach dem Umwandlungsgesetz 15.12.2025 (Eintragungsdatum)\n\nDelutions GmbH\nGesellschaft mit beschränkter Haftung\nOlpe\n\nDen Gläubigern der an der Verschmelzung beteiligten Rechtsträger ist, wenn sie binnen sechs Monaten nach dem Tag, an dem die Eintragung der Verschmelzung in das Register des Sitzes derjenigen Rechtsträger deren Gläubiger sie sind, nach § 19 Absatz 3 UmwG als bekanntgemacht gilt, ihren Anspruch nach Grund und Höhe schriftlich anmelden, Sicherheit zu leisten, soweit sie nicht Befriedigung verlangen können. Dieses Recht steht den Gläubigern jedoch nur zu, wenn sie glaubhaft machen, dass durch die Verschmelzung die Erfüllung ihrer Forderung gefährdet wird."
    },
    {
      "date": "2025-12-15",
      "id": "140001",
      "original_text": "Einreichung neuer Dokumente\nNordrhein-Westfalen Amtsgericht Münster HRB 2452\nGesellschaft für Buchführung und Hilfeleistung in Steuersachen für land- und forstwirtschaftliche Betriebe Westfalen-Lippe mbH – Münster",
      "type": "Einreichung neuer Dokumente",
      "state": "Nordrhein-Westfalen",
      "amtsgericht": "Amtsgericht Münster",
      "registernummer": "HRB 2452",
      "registerart": "HRB",
      "company_name": "Gesellschaft für Buchführung und Hilfeleistung in Steuersachen für land- und forstwirtschaftliche Betriebe Westfalen-Lippe mbH",
      "company_seat": "Münster",
      "details": "15.12.2025 (Bekanntmachungsdatum)\n\nNordrhein-Westfalen Amtsgericht Münster HRB 2452\nEinreichung neuer Dokumente\n\nGesellschaft für Buchführung und Hilfeleistung in Steuersachen für land- und forstwirtschaftliche Betriebe Westfalen-Lippe mbH\nGesellschaft mit beschränkter Haftung\nMünster\n\nDem Registergericht ist eine neue Liste der Mitglieder des Aufsichtsrates eingereicht worden."
    },
    {
      "date": "2025-12-15",
      "id": "140002",
      "original_text": "Löschungsankündigung\nNordrhein-Westfalen Amtsgericht Bonn VR 4914\nStiftung zur Förderung der Deutschen Gesellschaft für Ernährung e.V. – Bonn",
      "type": "Löschungsankündigung",
      "state": "Nordrhein-Westfalen",
      "amtsgericht": "Amtsgericht Bonn",
      "registernummer": "VR 4914",
      "registerart": "VR",
      "company_name": "Stiftung zur Förderung der Deutschen Gesellschaft für Ernährung e.V.",
      "company_seat": "Bonn",
      "details": "15.12.2025 (Bekanntmachungsdatum)\n\nNordrhein-Westfalen Amtsgericht Bonn VR 4914\nLöschungsankündigung\n\nStiftung zur Förderung  der Deutschen Gesellschaft für Ernährung e.V.\neingetragener Verein\nBonn\n\nDas Registergericht beabsichtigt, den im Vereinsregister eingetragenen Verein gemäß § 395 FamFG wegen Wegfalls sämtlicher Mitglieder von Amts wegen zu löschen.\n\nGegen diese Verfügung kann Widerspruch eingelegt werden. Die Frist zur Erhebung eines Widerspruchs gegen die beabsichtigte Löschung von Amts wegen ist auf einen Monat festgesetzt.\n\nRechtsbehelfsbelehrung:\n\nGegen diese Verfügung können Sie Widerspruch einlegen.\n\nDer Widerspruch ist bei dem Amtsgericht Bonn, Wilhelmstr. 21, 53111 Bonn schriftlich in deutscher Sprache oder zur Niederschrift der Geschäftsstelle einzulegen. Der Widerspruch kann auch zur Niederschrift der Geschäftsstelle eines jeden Amtsgerichtes abgegeben werden.\nDie Einlegung ist auch durch Übertragung eines elektronischen Dokuments an die elektronische Poststelle des Gerichts möglich. Das elektronische Dokument muss für die Bearbeitung durch das Gericht geeignet und mit einer qualifizierten elektronischen Signatur der verantwortenden Person versehen sein oder von der verantwortenden Person signiert und auf einem sicheren Übermittlungsweg gemäß\n§ 130a ZPO nach näherer Maßgabe der Verordnung über die technischen Rahmenbedingungen des elektronischen Rechtsverkehrs und über das besondere elektronische Behördenpostfach (BGBl. I, S.3803) eingereicht werden. Weitere Informationen erhalten Sie auf der Internetseite www.justiz.de.\n\nDer Widerspruch muss spätestens innerhalb der gesetzten Frist bei dem Amtsgericht Bonn eingegangen sein. Dies gilt auch dann, wenn der Widerspruch zur Niederschrift der Geschäftsstelle eines anderen Amtsgerichtes abgegeben wurde. Die Frist beginnt mit der Veröffentlichung. Fällt das Ende der Frist auf einen Sonntag, einen allgemeinen Feiertag oder Sonnabend, so endet die Frist mit Ablauf des nächsten Werktages.\n\nDer Widerspruch muss die Bezeichnung der angefochtenen Verfügung sowie die Erklärung enthalten, dass Widerspruch gegen diese Verfügung eingelegt wird. Er ist zu unterzeichnen und soll begründet werden."
    },
    {
      "date": "2025-12-15",
      "id": "140003",
      "original_text": "Registerbekanntmachung nach dem Umwandlungsgesetz\nNordrhein-Westfalen Amtsgericht Bad Oeynhausen HRA 10331\nMerkur Spielbanken Niedersachsen GmbH & Co. KG – Espelkamp",
      "type": "Registerbekanntmachung nach dem Umwandlungsgesetz",
      "state": "Nordrhein-Westfalen",
      "amtsgericht": "Amtsgericht Bad Oeynhausen",
      "registernummer": "HRA 10331",
      "registerart": "HRA",
      "company_name": "Merkur Spielbanken Niedersachsen GmbH & Co. KG",
      "company_seat": "Espelkamp",
      "details": "15.12.2025 (Bekanntmachungsdatum)\n\nNordrhein-Westfalen Amtsgericht Bad Oeynhausen HRA 10331\nRegisterbekanntmachung nach dem Umwandlungsgesetz 15.12.2025 (Eintragungsdatum)\n\nMerkur Spielbanken Niedersachsen GmbH & Co. KG\nKommanditgesellschaft\nEspelkamp\n\nDen Gläubigern der an der Verschmelzung beteiligten Rechtsträger ist, wenn sie binnen sechs Monaten nach dem Tag, an dem die Eintragung der Verschmelzung in das Register des Sitzes desjenigen Rechtsträgers, dessen Gläubiger sie sind, nach § 19 Absatz 3 UmwG als bekanntgemacht gilt, ihren Anspruch nach Grund und Höhe schriftlich anmelden, Sicherheit zu leisten, soweit sie nicht Befriedigung verlangen können. Dieses Recht steht den Gläubigern jedoch nur zu, wenn sie glaubhaft machen, dass durch die Verschmelzung die Erfüllung ihrer Forderung gefährdet wird."
    },
    {
      "date": "2025-12-15",
      "id": "140004",
      "original_text": "Löschungsankündigung\nNordrhein-Westfalen Amtsgericht Mönchengladbach HRB 15780\nAZ Bau GmbH – Mönchengladbach",
      "type": "Löschungsankündigung",
      "state": "Nordrhein-Westfalen",
      "amtsgericht": "Amtsgericht Mönchengladbach",
      "registernummer": "HRB 15780",
      "registerart": "HRB",
      "company_name": "AZ Bau GmbH",
      "company_seat": "Mönchengladbach",
      "details": "15.12.2025 (Bekanntmachungsdatum)\n\nNordrhein-Westfalen Amtsgericht Mönchengladbach HRB 15780\nLöschungsankündigung 15.12.2025 (Eintragungsdatum)\n\nAZ Bau GmbH\nGesellschaft mit beschränkter Haftung\nMönchengladbach\n\nDas Registergericht beabsichtigt die Gesellschaft von Amts wegen nach § 394 FamFG zu löschen. Die Frist zur Erhebung eines Widerspruchs ist auf drei Monate festgesetzt."
    },
    {
      "date": "2025-12-15",
      "id": "140005",
      "original_text": "Registerbekanntmachung nach dem Umwandlungsgesetz\nNordrhein-Westfalen Amtsgericht Gelsenkirchen HRB 13007\nJosef Buller GmbH – Gelsenkirchen",
      "type": "Registerbekanntmachung nach dem Umwandlungsgesetz",
      "state": "Nordrhein-Westfalen",
      "amtsgericht": "Amtsgericht Gelsenkirchen",
      "registernummer": "HRB 13007",
      "registerart": "HRB",
      "company_name": "Josef Buller GmbH",
      "company_seat": "Gelsenkirchen",
      "details": "15.12.2025 (Bekanntmachungsdatum)\n\nNordrhein-Westfalen Amtsgericht Gelsenkirchen HRB 13007\nRegisterbekanntmachung nach dem Umwandlungsgesetz 15.12.2025 (Eintragungsdatum)\n\nJosef Buller GmbH\nGesellschaft mit beschränkter Haftung\nGelsenkirchen\n\nDen Gläubigern der an der Verschmelzung beteiligten Rechtsträger ist, wenn sie binnen sechs Monaten nach dem Tag, an dem die Eintragung der Verschmelzung in das Register des Sitzes desjenigen Rechtsträgers, dessen Gläubiger sie sind, nach § 19 Absatz 3 UmwG als bekanntgemacht gilt, ihren Anspruch nach Grund und Höhe schriftlich anmelden, Sicherheit zu leisten, soweit sie nicht Befriedigung verlangen können. Dieses Recht steht den Gläubigern jedoch nur zu, wenn sie glaubhaft machen, dass durch die Verschmelzung die Erfüllung ihrer Forderung gefährdet wird."
    },
    {
      "date": "2025-12-15",
      "id": "140006",
      "original_text": "Einreichung neuer Dokumente\nNordrhein-Westfalen Amtsgericht Iserlohn HRB 10334\nOTTO FUCHS Beteiligungen Verwaltungs SE – Meinerzhagen",
      "type": "Einreichung neuer Dokumente",
      "state": "Nordrhein-Westfalen",
      "amtsgericht": "Amtsgericht Iserlohn",
      "registernummer": "HRB 10334",
      "registerart": "HRB",
      "company_name": "OTTO FUCHS Beteiligungen Verwaltungs SE",
      "company_seat": "Meinerzhagen",
      "details": "15.12.2025 (Bekanntmachungsdatum)\n\nNordrhein-Westfalen Amtsgericht Iserlohn HRB 10334\nEinreichung neuer Dokumente 15.12.2025 (Eintragungsdatum)\n\nOTTO FUCHS Beteiligungen Verwaltungs SE\nEuropäische Aktiengesellschaft (SE)\nMeinerzhagen\n\nDem Registergericht ist eine neue Liste der Mitglieder des Aufsichtsrates eingereicht worden."
    },
    {
      "date": "2025-12-15",
      "id": "140007",
      "original_text": "Löschungsankündigung\nNordrhein-Westfalen Amtsgericht Düsseldorf HRB 99412\nM & B Logistik GmbH – Monheim am Rhein",
      "type": "Löschungsankündigung",
      "state": "Nordrhein-Westfalen",
      "amtsgericht": "Amtsgericht Düsseldorf",
      "registernummer": "HRB 99412",
      "registerart": "HRB",
      "company_name": "M & B Logistik GmbH",
      "company_seat": "Monheim am Rhein",
      "details": "15.12.2025 (Bekanntmachungsdatum)\n\nNordrhein-Westfalen Amtsgericht Düsseldorf HRB 99412\nLöschungsankündigung\n\nM & B Logistik GmbH\nGesellschaft mit beschränkter Haftung\nMonheim am Rhein\n\nDas Registergericht beabsichtigt die Gesellschaft von Amts wegen nach § 394 FamFG zu löschen. Die Frist zur Erhebung eines Widerspruchs ist auf 3 Wochen festgesetzt.\n\nRechtsbehelfsbelehrung:\nDas Widerspruchsrecht steht jedem zu, der an der Unterlassung der Löschung ein berechtigtes Interesse hat. Der Widerspruch ist bei dem Amtsgericht Düsseldorf -Registergericht-, Werdener Straße 1, 40227 Düsseldorf schriftlich in deutscher Sprache oder zur Niederschrift der Geschäftsstelle einzulegen. Der Widerspruch kann auch zur Niederschrift der Geschäftsstelle eines jeden Amtsgerichtes abgegeben werden. Die Einlegung ist auch durch Übertragung eines elektronischen Dokuments an die elektronische Poststelle des Gerichts möglich. Das elektronische Dokument muss für die Bearbeitung durch das Gericht geeignet und mit einer qualifizierten elektronischen Signatur der verantwortenden Person versehen sein oder von der verantwortenden Person signiert und auf einem sicheren Übermittlungsweg gemäß § 130a ZPO nach näherer Maßgabe der Verordnung über die technischen Rahmenbedingungen des elektronischen Rechtsverkehrs und über das besondere elektronische Behördenpostfach (BGBl. I, S.3803) eingereicht werden. Weitere Informationen erhalten Sie auf der Internetseite www.justiz.de.\nDer Widerspruch muss spätestens innerhalb der gesetzten Frist nach dem Datum der Bekanntmachung der Löschungsankündigung bei dem Amtsgericht - Registergericht - Düsseldorf eingegangen sein.  Dies gilt auch dann, wenn der Widerspruch zur Niederschrift der Geschäftsstelle eines anderen Amtsgerichtes abgegeben wurde. Die Frist beginnt mit dem Tage der Bekanntmachung der Löschungsankündigung in dem für die Bekanntmachung der Eintragungen in das Handelsregister bestimmten elektronischen Informations- und Kommunikationssystem nach § 10 des Handelsgesetzbuches. Fällt das Ende der Frist auf einen Sonntag, einen allgemeinen Feiertag oder Sonnabend, so endet die Frist mit Ablauf des nächsten Werktages.\nDer Widerspruch muss die Bezeichnung der angefochtenen Löschungsankündigung sowie die Erklärung enthalten, dass Widerspruch gegen diese Löschungsankündigung eingelegt wird. Er ist zu unterzeichnen und soll begründet werden."
    },
    {
      "date": "2025-12-15",
      "id": "140008",
      "original_text": "Registerbekanntmachung nach dem Umwandlungsgesetz\nNordrhein-Westfalen Amtsgericht Düsseldorf HRB 91139\nThe Platform Group AG – Düsseldorf",
      "type": "Registerbekanntmachung nach dem Umwandlungsgesetz",
      "state": "Nordrhein-Westfalen",
      "amtsgericht": "Amtsgericht Düsseldorf",
      "registernummer": "HRB 91139",
      "registerart": "HRB",
      "company_name": "The Platform Group AG",
      "company_seat": "Düsseldorf",
      "details": "15.12.2025 (Bekanntmachungsdatum)\n\nNordrhein-Westfalen Amtsgericht Düsseldorf HRB 91139\nRegisterbekanntmachung nach dem Umwandlungsgesetz 15.12.2025 (Eintragungsdatum)\n\nThe Platform Group AG\nAktiengesellschaft\nDüsseldorf\n\nDen Gläubigern der an der formwechselnden Umwandlung beteiligten Rechtsträger ist, wenn sie binnen sechs Monaten nach dem Tag, an dem die Eintragung der formwechselnden Umwandlung in das Register des Sitzes desjenigen Rechtsträgers, dessen Gläubiger sie sind, nach § 19 Absatz 3 UmwG als bekanntgemacht gilt, ihren Anspruch nach Grund und Höhe schriftlich anmelden, Sicherheit zu leisten, soweit sie nicht Befriedigung verlangen können. Dieses Recht steht den Gläubigern jedoch nur zu, wenn sie glaubhaft machen, dass durch die formwechselnden Umwandlung die Erfüllung ihrer Forderung gefährdet wird."
    },
    {
      "date": "2025-12-15",
      "id": "140009",
      "original_text": "Löschungsankündigung\nNordrhein-Westfalen Amtsgericht Gütersloh HRB 5469\nW. u. F. Fleischerservice GmbH – Versmold",
      "type": "Löschungsankündigung",
      "state": "Nordrhein-Westfalen",
      "amtsgericht": "Amtsgericht Gütersloh",
      "registernummer": "HRB 5469",
      "registerart": "HRB",
      "company_name": "W. u. F. Fleischerservice GmbH",
      "company_seat": "Versmold",
      "details": "15.12.2025 (Bekanntmachungsdatum)\n\nNordrhein-Westfalen Amtsgericht Gütersloh HRB 5469\nLöschungsankündigung\n\nW. u. F. Fleischerservice GmbH\nGesellschaft mit beschränkter Haftung\nVersmold\n\nDas Registergericht beabsichtigt die Gesellschaft von Amts wegen nach § 394 FamFG zu löschen. Die Frist zur Erhebung eines Widerspruchs ist auf einen Monat festgesetzt."
    },
    {
      "date": "2025-12-15",
      "id": "140010",
      "original_text": "Löschungsankündigung\nNordrhein-Westfalen Amtsgericht Düsseldorf HRB 78681\nOmega plus Personal & Service UG (haftungsbeschränkt) – Düsseldorf",
      "type": "Löschungsankündigung",
      "state": "Nordrhein-Westfalen",
      "amtsgericht": "Amtsgericht Düsseldorf",
      "registernummer": "HRB 78681",
      "registerart": "HRB",
      "company_name": "Omega plus Personal & Service UG (haftungsbeschränkt)",
      "company_seat": "Düsseldorf",
      "details": "15.12.2025 (Bekanntmachungsdatum)\n\nNordrhein-Westfalen Amtsgericht Düsseldorf HRB 78681\nLöschungsankündigung\n\nOmega plus Personal & Service UG (haftungsbeschränkt)\nGesellschaft mit beschränkter Haftung\nDüsseldorf\n\nDas Registergericht beabsichtigt die Gesellschaft von Amts wegen nach § 394 FamFG zu löschen. Die Frist zur Erhebung eines Widerspruchs ist auf 3 Wochen festgesetzt.\n\nRechtsbehelfsbelehrung:\nDas Widerspruchsrecht steht jedem zu, der an der Unterlassung der Löschung ein berechtigtes Interesse hat. Der Widerspruch ist bei dem Amtsgericht Düsseldorf -Registergericht-, Werdener Straße 1, 40227 Düsseldorf schriftlich in deutscher Sprache oder zur Niederschrift der Geschäftsstelle einzulegen. Der Widerspruch kann auch zur Niederschrift der Geschäftsstelle eines jeden Amtsgerichtes abgegeben werden. Die Einlegung ist auch durch Übertragung eines elektronischen Dokuments an die elektronische Poststelle des Gerichts möglich. Das elektronische Dokument muss für die Bearbeitung durch das Gericht geeignet und mit einer qualifizierten elektronischen Signatur der verantwortenden Person versehen sein oder von der verantwortenden Person signiert und auf einem sicheren Übermittlungsweg gemäß § 130a ZPO nach näherer Maßgabe der Verordnung über die technischen Rahmenbedingungen des elektronischen Rechtsverkehrs und über das besondere elektronische Behördenpostfach (BGBl. I, S.3803) eingereicht werden. Weitere Informationen erhalten Sie auf der Internetseite www.justiz.de.\nDer Widerspruch muss spätestens innerhalb der gesetzten Frist nach dem Datum der Bekanntmachung der Löschungsankündigung bei dem Amtsgericht - Registergericht - Düsseldorf eingegangen sein.  Dies gilt auch dann, wenn der Widerspruch zur Niederschrift der Geschäftsstelle eines anderen Amtsgerichtes abgegeben wurde. Die Frist beginnt mit dem Tage der Bekanntmachung der Löschungsankündigung in dem für die Bekanntmachung der Eintragungen in das Handelsregister bestimmten elektronischen Informations- und Kommunikationssystem nach § 10 des Handelsgesetzbuches. Fällt das Ende der Frist auf einen Sonntag, einen allgemeinen Feiertag oder Sonnabend, so endet die Frist mit Ablauf des nächsten Werktages.\nDer Widerspruch muss die Bezeichnung der angefochtenen Löschungsankündigung sowie die Erklärung enthalten, dass Widerspruch gegen diese Löschungsankündigung eingelegt wird. Er ist zu unterzeichnen und soll begründet werden."
    },
    {
      "date": "2025-12-15",
      "id": "140011",
      "original_text": "Löschungsankündigung\nNordrhein-Westfalen Amtsgericht Kleve HRB 15874\nR.S. Roos UG (haftungsbeschränkt) – Moers",
      "type": "Löschungsankündigung",
      "state": "Nordrhein-Westfalen",
      "amtsgericht": "Amtsgericht Kleve",
      "registernummer": "HRB 15874",
      "registerart": "HRB",
      "company_name": "R.S. Roos UG (haftungsbeschränkt)",
      "company_seat": "Moers",
      "details": "15.12.2025 (Bekanntmachungsdatum)\n\nNordrhein-Westfalen Amtsgericht Kleve HRB 15874\nLöschungsankündigung\n\nR.S. Roos UG (haftungsbeschränkt)\nGesellschaft mit beschränkter Haftung\nMoers\n\nDas Registergericht beabsichtigt die Gesellschaft von Amts wegen nach § 394 FamFG zu löschen. Die Frist zur Erhebung eines Widerspruchs ist auf einen Monat festgesetzt."
    },
    {
      "date": "2025-12-15",
      "id": "140012",
      "original_text": "Registerbekanntmachung nach dem Umwandlungsgesetz\nNordrhein-Westfalen Amtsgericht Essen HRB 19095\nF&P B GmbH Steuerberatungsgesellschaft – Essen",
      "type": "Registerbekanntmachung nach dem Umwandlungsgesetz",
      "state": "Nordrhein-Westfalen",
      "amtsgericht": "Amtsgericht Essen",
      "registernummer": "HRB 19095",
      "registerart": "HRB",
      "company_name": "F&P B GmbH Steuerberatungsgesellschaft",
      "company_seat": "Essen",
      "details": "15.12.2025 (Bekanntmachungsdatum)\n\nNordrhein-Westfalen Amtsgericht Essen HRB 19095\nRegisterbekanntmachung nach dem Umwandlungsgesetz 15.12.2025 (Eintragungsdatum)\n\nF&P B GmbH Steuerberatungsgesellschaft\nGesellschaft mit beschränkter Haftung\nEssen\n\nDen Gläubigern der an der Verschmelzung beteiligten Rechtsträger ist, wenn sie binnen sechs Monaten nach dem Tag, an dem die Eintragung der Verschmelzung in das Register des Sitzes desjenigen Rechtsträgers, dessen Gläubiger sie sind, nach § 19 Absatz 3 UmwG als bekanntgemacht gilt, ihren Anspruch nach Grund und Höhe schriftlich anmelden, Sicherheit zu leisten, soweit sie nicht Befriedigung verlangen können. Dieses Recht steht den Gläubigern jedoch nur zu, wenn sie glaubhaft machen, dass durch die Verschmelzung die Erfüllung ihrer Forderung gefährdet wird."
    },
    {
      "date": "2025-12-15",
      "id": "140013",
      "original_text": "Einreichung neuer Dokumente\nNordrhein-Westfalen Amtsgericht Köln HRB 34845\nTÜV WEST Aktiengesellschaft – Köln",
      "type": "Einreichung neuer Dokumente",
      "state": "Nordrhein-Westfalen",
      "amtsgericht": "Amtsgericht Köln",
      "registernummer": "HRB 34845",
      "registerart": "HRB",
      "company_name": "TÜV WEST Aktiengesellschaft",
      "company_seat": "Köln",
      "details": "15.12.2025 (Bekanntmachungsdatum)\n\nNordrhein-Westfalen Amtsgericht Köln HRB 34845\nEinreichung neuer Dokumente 15.12.2025 (Eintragungsdatum)\n\nTÜV WEST Aktiengesellschaft\nAktiengesellschaft\nKöln\n\nDem Registergericht ist eine neue Liste der Mitglieder des Aufsichtsrates eingereicht worden."
    },
    {
      "date": "2025-12-15",
      "id": "140014",
      "original_text": "Sonstige Registerbekanntmachung\nNordrhein-Westfalen Amtsgericht Gelsenkirchen HRB 650\nH & G Hegmanns Ingenieurgesellschaft mbH – Gelsenkirchen",
      "type": "Sonstige Registerbekanntmachung",
      "state": "Nordrhein-Westfalen",
      "amtsgericht": "Amtsgericht Gelsenkirchen",
      "registernummer": "HRB 650",
      "registerart": "HRB",
      "company_name": "H & G Hegmanns Ingenieurgesellschaft mbH",
      "company_seat": "Gelsenkirchen",
      "details": "15.12.2025 (Bekanntmachungsdatum)\n\nNordrhein-Westfalen Amtsgericht Gelsenkirchen HRB 650\nSonstige Registerbekanntmachung 15.12.2025 (Eintragungsdatum)\n\nH & G Hegmanns Ingenieurgesellschaft mbH\nGesellschaft mit beschränkter Haftung\nGelsenkirchen\n\nAls nicht eingetragen wird veröffentlicht: Den Gläubigern der Gesellschaft, deren Forderungen begründet worden sind bevor die Eintragung der Beendigung des Beherrschungs- und Gewinnabführungsvertrages  in das Handelsregister nach § 10 des Handelsgesetzbuches als bekanntgemacht gilt, hat der andere Vertragsteil Sicherheit zu leisten, wenn sie sich binnen sechs Monaten nach der Bekanntmachung der Eintragung zu diesem Zweck bei ihm melden."
    },
    {
      "date": "2025-12-15",
      "id": "140015",
      "original_text": "Löschungsankündigung\nNordrhein-Westfalen Amtsgericht Mönchengladbach HRB 20554\nInovoHub UG (haftungsbeschränkt) – Mönchengladbach",
      "type": "Löschungsankündigung",
      "state": "Nordrhein-Westfalen",
      "amtsgericht": "Amtsgericht Mönchengladbach",
      "registernummer": "HRB 20554",
      "registerart": "HRB",
      "company_name": "InovoHub UG (haftungsbeschränkt)",
      "company_seat": "Mönchengladbach",
      "details": "15.12.2025 (Bekanntmachungsdatum)\n\nNordrhein-Westfalen Amtsgericht Mönchengladbach HRB 20554\nLöschungsankündigung 15.12.2025 (Eintragungsdatum)\n\nInovoHub UG (haftungsbeschränkt)\nGesellschaft mit beschränkter Haftung\nMönchengladbach\n\nDas Registergericht beabsichtigt die Gesellschaft von Amts wegen nach § 394 FamFG zu löschen. Die Frist zur Erhebung eines Widerspruchs ist auf drei Monate festgesetzt."
    },
    {
      "date": "2025-12-15",
      "id": "140016",
      "original_text": "Einreichung neuer Dokumente\nNordrhein-Westfalen Amtsgericht Siegburg HRB 6640\nBad Honnef Aktiengesellschaft – Bad Honnef",
      "type": "Einreichung neuer Dokumente",
      "state": "Nordrhein-Westfalen",
      "amtsgericht": "Amtsgericht Siegburg",
      "registernummer": "HRB 6640",
      "registerart": "HRB",
      "company_name": "Bad Honnef Aktiengesellschaft",
      "company_seat": "Bad Honnef",
      "details": "15.12.2025 (Bekanntmachungsdatum)\n\nNordrhein-Westfalen Amtsgericht Siegburg HRB 6640\nEinreichung neuer Dokumente 03.12.2025 (Eintragungsdatum)\n\nBad Honnef Aktiengesellschaft\nAktiengesellschaft\nBad Honnef\n\nDem Registergericht ist eine neue Liste der Mitglieder des Aufsichtsrates eingereicht worden."
    },
    {
      "date": "2025-12-15",
      "id": "140017",
      "original_text": "Registerbekanntmachung nach dem Umwandlungsgesetz\nNordrhein-Westfalen Amtsgericht Essen HRB 23669\nADVISA S & D GmbH Steuerberatungsgesellschaft – Essen",
      "type": "Registerbekanntmachung nach dem Umwandlungsgesetz",
      "state": "Nordrhein-Westfalen",
      "amtsgericht": "Amtsgericht Essen",
      "registernummer": "HRB 23669",
      "registerart": "HRB",
      "company_name": "ADVISA S & D GmbH Steuerberatungsgesellschaft",
      "company_seat": "Essen",
      "details": "15.12.2025 (Bekanntmachungsdatum)\n\nNordrhein-Westfalen Amtsgericht Essen HRB 23669\nRegisterbekanntmachung nach dem Umwandlungsgesetz 15.12.2025 (Eintragungsdatum)\n\nADVISA S & D GmbH Steuerberatungsgesellschaft\nGesellschaft mit beschränkter Haftung\nEssen\n\nDen Gläubigern der an der Verschmelzung beteiligten Rechtsträger ist, wenn sie binnen sechs Monaten nach dem Tag, an dem die Eintragung der Verschmelzung in das Register des Sitzes desjenigen Rechtsträgers, dessen Gläubiger sie sind, nach § 19 Absatz 3 UmwG als bekanntgemacht gilt, ihren Anspruch nach Grund und Höhe schriftlich anmelden, Sicherheit zu leisten, soweit sie nicht Befriedigung verlangen können. Dieses Recht steht den Gläubigern jedoch nur zu, wenn sie glaubhaft machen, dass durch die Verschmelzung die Erfüllung ihrer Forderung gefährdet wird."
    },
    {
      "date": "2025-12-15",
      "id": "140018",
      "original_text": "Einreichung neuer Dokumente\nNordrhein-Westfalen Amtsgericht Gütersloh HRB 4935\nStadtwerke Versmold GmbH – Versmold",
      "type": "Einreichung neuer Dokumente",
      "state": "Nordrhein-Westfalen",
      "amtsgericht": "Amtsgericht Gütersloh",
      "registernummer": "HRB 4935",
      "registerart": "HRB",
      "company_name": "Stadtwerke Versmold GmbH",
      "company_seat": "Versmold",
      "details": "15.12.2025 (Bekanntmachungsdatum)\n\nNordrhein-Westfalen Amtsgericht Gütersloh HRB 4935\nEinreichung neuer Dokumente\n\nStadtwerke Versmold GmbH\nGesellschaft mit beschränkter Haftung\nVersmold\n\nDem Registergericht ist eine neue Liste der Mitglieder des Aufsichtsrates eingereicht worden."
    },
    {
      "date": "2025-12-15",
      "id": "140019",
      "original_text": "Löschungsankündigung\nNordrhein-Westfalen Amtsgericht Bonn HRB 29790\nCeri Gebäudereinigung GmbH – Zülpich",
      "type": "Löschungsankündigung",
      "state": "Nordrhein-Westfalen",
      "amtsgericht": "Amtsgericht Bonn",
      "registernummer": "HRB 29790",
      "registerart": "HRB",
      "company_name": "Ceri Gebäudereinigung GmbH",
      "company_seat": "Zülpich",
      "details": "15.12.2025 (Bekanntmachungsdatum)\n\nNordrhein-Westfalen Amtsgericht Bonn HRB 29790\nLöschungsankündigung\n\nCeri Gebäudereinigung GmbH\nGesellschaft mit beschränkter Haftung\nZülpich\n\nDas Registergericht beabsichtigt die Gesellschaft von Amts wegen nach § 394 FamFG zu löschen. Die Frist zur Erhebung eines Widerspruchs ist auf einen Monat festgesetzt."
    },
    {
      "date": "2025-12-15",
      "id": "140020",
      "original_text": "Registerbekanntmachung nach dem Umwandlungsgesetz\nHessen Amtsgericht Frankfurt am Main HRB 113842\nAutomation Management Verwaltungs GmbH – Frankfurt am Main",
      "type": "Registerbekanntmachung nach dem Umwandlungsgesetz",
      "state": "Hessen",
      "amtsgericht": "Amtsgericht Frankfurt am Main",
      "registernummer": "HRB 113842",
      "registerart": "HRB",
      "company_name": "Automation Management Verwaltungs GmbH",
      "company_seat": "Frankfurt am Main",
      "details": "15.12.2025 (Bekanntmachungsdatum)\n\nHessen Amtsgericht Frankfurt am Main HRB 113842\nRegisterbekanntmachung nach dem Umwandlungsgesetz 15.12.2025 (Eintragungsdatum)\n\nAutomation Management Verwaltungs GmbH\nGesellschaft mit beschränkter Haftung\nFrankfurt am Main\n\nDen Gläubigern der an der Verschmelzung beteiligten Rechtsträger ist, wenn sie binnen sechs Monaten nach dem Tag, an dem die Eintragung der Verschmelzung in das Register des Sitzes desjenigen Rechtsträgers, dessen Gläubiger sie sind, nach § 19 Absatz 3 UmwG bekannt gemacht worden ist, ihren Anspruch nach Grund und Höhe schriftlich anmelden, Sicherheit zu leisten, soweit sie nicht Befriedigung verlangen können. Dieses Recht steht den Gläubigern jedoch nur zu, wenn sie glaubhaft machen, dass durch die Verschmelzung die Erfüllung ihrer Forderung gefährdet wird."
    },
    {
      "date": "2025-12-15",
      "id": "140021",
      "original_text": "Registerbekanntmachung nach dem Umwandlungsgesetz\nHessen Amtsgericht Frankfurt am Main HRB 10297\nDVG Deutsche Vermögensverwaltungs-Gesellschaft mit beschränkter Haftung – Frankfurt am Main",
      "type": "Registerbekanntmachung nach dem Umwandlungsgesetz",
      "state": "Hessen",
      "amtsgericht": "Amtsgericht Frankfurt am Main",
      "registernummer": "HRB 10297",
      "registerart": "HRB",
      "company_name": "DVG Deutsche Vermögensverwaltungs-Gesellschaft mit beschränkter Haftung",
      "company_seat": "Frankfurt am Main",
      "details": "15.12.2025 (Bekanntmachungsdatum)\n\nHessen Amtsgericht Frankfurt am Main HRB 10297\nRegisterbekanntmachung nach dem Umwandlungsgesetz 15.12.2025 (Eintragungsdatum)\n\nDVG Deutsche Vermögensverwaltungs-Gesellschaft mit beschränkter Haftung\nGesellschaft mit beschränkter Haftung\nFrankfurt am Main\n\nDen Gläubigern der an der Verschmelzung beteiligten Rechtsträger ist, wenn sie binnen sechs Monaten nach dem Tag, an dem die Eintragung der Verschmelzung in das Register des Sitzes desjenigen Rechtsträgers, dessen Gläubiger sie sind, nach § 19 Absatz 3 UmwG bekannt gemacht worden ist, ihren Anspruch nach Grund und Höhe schriftlich anmelden, Sicherheit zu leisten, soweit sie nicht Befriedigung verlangen können. Dieses Recht steht den Gläubigern jedoch nur zu, wenn sie glaubhaft machen, dass durch die Verschmelzung die Erfüllung ihrer Forderung gefährdet wird."
    },
    {
      "date": "2025-12-15",
      "id": "140022",
      "original_text": "Sonstige Registerbekanntmachung\nHessen Amtsgericht Frankfurt am Main HRB 56436\nPagemachine Aktiengesellschaft – Frankfurt am Main",
      "type": "Sonstige Registerbekanntmachung",
      "state": "Hessen",
      "amtsgericht": "Amtsgericht Frankfurt am Main",
      "registernummer": "HRB 56436",
      "registerart": "HRB",
      "company_name": "Pagemachine Aktiengesellschaft",
      "company_seat": "Frankfurt am Main",
      "details": "15.12.2025 (Bekanntmachungsdatum)\n\nHessen Amtsgericht Frankfurt am Main HRB 56436\nSonstige Registerbekanntmachung\n\nPagemachine Aktiengesellschaft\nAktiengesellschaft\nFrankfurt am Main\n\nDurch eine Änderung in den Personen der Aufsichtsratsmitglieder ist eine Liste der Mitglieder des Aufsichtsrates zum Handelsregister eingereicht worden."
    },
    {
      "date": "2025-12-15",
      "id": "140023",
      "original_text": "Registerbekanntmachung nach dem Umwandlungsgesetz\nHessen Amtsgericht Offenbach am Main HRB 49047\nEVO Ressourcen GmbH – Offenbach am Main",
      "type": "Registerbekanntmachung nach dem Umwandlungsgesetz",
      "state": "Hessen",
      "amtsgericht": "Amtsgericht Offenbach am Main",
      "registernummer": "HRB 49047",
      "registerart": "HRB",
      "company_name": "EVO Ressourcen GmbH",
      "company_seat": "Offenbach am Main",
      "details": "15.12.2025 (Bekanntmachungsdatum)\n\nHessen Amtsgericht Offenbach am Main HRB 49047\nRegisterbekanntmachung nach dem Umwandlungsgesetz 15.12.2025 (Eintragungsdatum)\n\nEVO Ressourcen GmbH\nGesellschaft mit beschränkter Haftung\nOffenbach am Main\n\nDen Gläubigern der an der Verschmelzung beteiligten Rechtsträger ist, wenn sie binnen sechs Monaten nach dem Tag, an dem die Eintragung der Verschmelzung in das Register des Sitzes desjenigen Rechtsträgers, dessen Gläubiger sie sind, nach § 19 Absatz 3 UmwG bekannt gemacht worden ist, ihren Anspruch nach Grund und Höhe schriftlich anmelden, Sicherheit zu leisten, soweit sie nicht Befriedigung verlangen können. Dieses Recht steht den Gläubigern jedoch nur zu, wenn sie glaubhaft machen, dass durch die Verschmelzung die Erfüllung ihrer Forderung gefährdet wird."
    },
    {
      "date": "2025-12-15",
      "id": "140024",
      "original_text": "Registerbekanntmachung nach dem Umwandlungsgesetz\nHessen Amtsgericht Darmstadt HRA 87723\nGrabmale Hochhaus GmbH & Co.KG – Groß-Rohrheim",
      "type": "Registerbekanntmachung nach dem Umwandlungsgesetz",
      "state": "Hessen",
      "amtsgericht": "Amtsgericht Darmstadt",
      "registernummer": "HRA 87723",
      "registerart": "HRA",
      "company_name": "Grabmale Hochhaus GmbH & Co.KG",
      "company_seat": "Groß-Rohrheim",
      "details": "15.12.2025 (Bekanntmachungsdatum)\n\nHessen Amtsgericht Darmstadt HRA 87723\nRegisterbekanntmachung nach dem Umwandlungsgesetz 14.12.2025 (Eintragungsdatum)\n\nGrabmale Hochhaus GmbH & Co.KG\nKommanditgesellschaft\nGroß-Rohrheim\n\nDen Gläubigern der an der Ausgliederung beteiligten Rechtsträger ist, wenn sie binnen sechs Monaten nach dem Tag, an dem die Eintragung der Ausgliederung in das Register des Sitzes derjenigen Rechtsträger deren Gläubiger sie sind, nach §§ 125, 19 Absatz 3 UmwG bekannt gemacht worden ist, ihren Anspruch nach Grund und Höhe schriftlich anmelden, Sicherheit zu leisten, soweit sie nicht Befriedigung verlangen können. Dieses Recht steht den Gläubigern jedoch nur zu, wenn sie glaubhaft machen, dass durch die Ausgliederung die Erfüllung ihrer Forderung gefährdet wird."
    },
    {
      "date": "2025-12-15",
      "id": "140025",
      "original_text": "Sonstige Registerbekanntmachung\nHessen Amtsgericht Bad Homburg v.d.H. HRB 7503\nDana Motion Systems Deutschland GmbH – Bad Homburg v. d. Höhe",
      "type": "Sonstige Registerbekanntmachung",
      "state": "Hessen",
      "amtsgericht": "Amtsgericht Bad Homburg v.d.H.",
      "registernummer": "HRB 7503",
      "registerart": "HRB",
      "company_name": "Dana Motion Systems Deutschland GmbH",
      "company_seat": "Bad Homburg v. d. Höhe",
      "details": "15.12.2025 (Bekanntmachungsdatum)\n\nHessen Amtsgericht Bad Homburg v.d.H. HRB 7503\nSonstige Registerbekanntmachung 15.12.2025 (Eintragungsdatum)\n\nDana Motion Systems Deutschland GmbH\nGesellschaft mit beschränkter Haftung\nBad Homburg v. d. Höhe\n\nDen Gläubigern der Gesellschaft, deren Forderungen begründet worden sind, bevor die Eintragung der Beendigung des Vertrags in das Handelsregister nach § 10 HGB bekannt gemacht worden ist, ist vom anderen Vertragsteil Sicherheit zu leisten, wenn sie sich binnen sechs Monaten nach dieser Bekanntmachung zu diesem Zweck bei ihm melden."
    },
    {
      "date": "2025-12-15",
      "id": "140026",
      "original_text": "Registerbekanntmachung nach dem Umwandlungsgesetz\nHessen Amtsgericht Frankfurt am Main HRB 130845\nNTK Immobilien GmbH – Frankfurt am Main",
      "type": "Registerbekanntmachung nach dem Umwandlungsgesetz",
      "state": "Hessen",
      "amtsgericht": "Amtsgericht Frankfurt am Main",
      "registernummer": "HRB 130845",
      "registerart": "HRB",
      "company_name": "NTK Immobilien GmbH",
      "company_seat": "Frankfurt am Main",
      "details": "15.12.2025 (Bekanntmachungsdatum)\n\nHessen Amtsgericht Frankfurt am Main HRB 130845\nRegisterbekanntmachung nach dem Umwandlungsgesetz 15.12.2025 (Eintragungsdatum)\n\nNTK Immobilien GmbH\nGesellschaft mit beschränkter Haftung\nFrankfurt am Main\n\nDen Gläubigern der an der Verschmelzung beteiligten Rechtsträger ist, wenn sie binnen sechs Monaten nach dem Tag, an dem die Eintragung der Verschmelzung in das Register des Sitzes desjenigen Rechtsträgers, dessen Gläubiger sie sind, nach § 19 Absatz 3 UmwG bekannt gemacht worden ist, ihren Anspruch nach Grund und Höhe schriftlich anmelden, Sicherheit zu leisten, soweit sie nicht Befriedigung verlangen können. Dieses Recht steht den Gläubigern jedoch nur zu, wenn sie glaubhaft machen, dass durch die Verschmelzung die Erfüllung ihrer Forderung gefährdet wird."
    },
    {
      "date": "2025-12-15",
      "id": "140027",
      "original_text": "Löschungsankündigung\nHessen Amtsgericht Wiesbaden HRA 10814\nd.i.i. 200 Immobilien GmbH & Co. KG – Wiesbaden",
      "type": "Löschungsankündigung",
      "state": "Hessen",
      "amtsgericht": "Amtsgericht Wiesbaden",
      "registernummer": "HRA 10814",
      "registerart": "HRA",
      "company_name": "d.i.i. 200 Immobilien GmbH & Co. KG",
      "company_seat": "Wiesbaden",
      "details": "15.12.2025 (Bekanntmachungsdatum)\n\nHessen Amtsgericht Wiesbaden HRA 10814\nLöschungsankündigung\n\nd.i.i. 200 Immobilien GmbH & Co. KG\nKommanditgesellschaft\nWiesbaden\n\nDas Registergericht beabsichtigt die im Handelsregister eingetragene Firma von Amts wegen nach § 395 FamFG zu löschen. Die Frist zur Erhebung eines Widerspruchs gegen die beabsichtigte Löschung wird auf 3 Monate festgesetzt."
    },
    {
      "date": "2025-12-15",
      "id": "140028",
      "original_text": "Registerbekanntmachung nach dem Umwandlungsgesetz\nHessen Amtsgericht Frankfurt am Main HRB 101805\nForsthaus Verwaltungs GmbH – Frankfurt am Main",
      "type": "Registerbekanntmachung nach dem Umwandlungsgesetz",
      "state": "Hessen",
      "amtsgericht": "Amtsgericht Frankfurt am Main",
      "registernummer": "HRB 101805",
      "registerart": "HRB",
      "company_name": "Forsthaus Verwaltungs GmbH",
      "company_seat": "Frankfurt am Main",
      "details": "15.12.2025 (Bekanntmachungsdatum)\n\nHessen Amtsgericht Frankfurt am Main HRB 101805\nRegisterbekanntmachung nach dem Umwandlungsgesetz 15.12.2025 (Eintragungsdatum)\n\nForsthaus Verwaltungs GmbH\nGesellschaft mit beschränkter Haftung\nFrankfurt am Main\n\nDen Gläubigern der an der Verschmelzung beteiligten Rechtsträger ist, wenn sie binnen sechs Monaten nach dem Tag, an dem die Eintragung der Verschmelzung in das Register des Sitzes desjenigen Rechtsträgers, dessen Gläubiger sie sind, nach § 19 Absatz 3 UmwG bekannt gemacht worden ist, ihren Anspruch nach Grund und Höhe schriftlich anmelden, Sicherheit zu leisten, soweit sie nicht Befriedigung verlangen können. Dieses Recht steht den Gläubigern jedoch nur zu, wenn sie glaubhaft machen, dass durch die Verschmelzung die Erfüllung ihrer Forderung gefährdet wird."
    },
    {
      "date": "2025-12-15",
      "id": "140029",
      "original_text": "Registerbekanntmachung nach dem Umwandlungsgesetz\nHessen Amtsgericht Wiesbaden HRB 36307\nConcept Sanierung BWS GmbH – Walluf",
      "type": "Registerbekanntmachung nach dem Umwandlungsgesetz",
      "state": "Hessen",
      "amtsgericht": "Amtsgericht Wiesbaden",
      "registernummer": "HRB 36307",
      "registerart": "HRB",
      "company_name": "Concept Sanierung BWS GmbH",
      "company_seat": "Walluf",
      "details": "15.12.2025 (Bekanntmachungsdatum)\n\nHessen Amtsgericht Wiesbaden HRB 36307\nRegisterbekanntmachung nach dem Umwandlungsgesetz 15.12.2025 (Eintragungsdatum)\n\nConcept Sanierung BWS GmbH\nGesellschaft mit beschränkter Haftung\nWalluf\n\nDen Gläubigern der an der Ausgliederung beteiligten Rechtsträger ist, wenn sie binnen sechs Monaten nach dem Tag, an dem die Eintragung der Ausgliederung in das Register des Sitzes derjenigen Rechtsträger deren Gläubiger sie sind, nach §§ 125, 19 Absatz 3 UmwG bekannt gemacht worden ist, ihren Anspruch nach Grund und Höhe schriftlich anmelden, Sicherheit zu leisten, soweit sie nicht Befriedigung verlangen können. Dieses Recht steht den Gläubigern jedoch nur zu, wenn sie glaubhaft machen, dass durch die Ausgliederung die Erfüllung ihrer Forderung gefährdet wird."
    },
    {
      "date": "2025-12-15",
      "id": "140030",
      "original_text": "Einreichung neuer Dokumente\nHessen Amtsgericht Kassel HRB 6602\nOctaVIA Organisationsentwicklung, Software- & Technologieberatungs Aktiengesellschaft – Kassel",
      "type": "Einreichung neuer Dokumente",
      "state": "Hessen",
      "amtsgericht": "Amtsgericht Kassel",
      "registernummer": "HRB 6602",
      "registerart": "HRB",
      "company_name": "OctaVIA Organisationsentwicklung, Software- & Technologieberatungs Aktiengesellschaft",
      "company_seat": "Kassel",
      "details": "15.12.2025 (Bekanntmachungsdatum)\n\nHessen Amtsgericht Kassel HRB 6602\nEinreichung neuer Dokumente\n\nOctaVIA Organisationsentwicklung, Software- & Technologieberatungs Aktiengesellschaft\nAktiengesellschaft\nKassel\n\nDurch eine Änderung in den Personen der Aufsichtsratsmitglieder ist eine Liste der Mitglieder des Aufsichtsrates zum Handelsregister eingereicht worden."
    },
    {
      "date": "2025-12-15",
      "id": "140031",
      "original_text": "Löschungsankündigung\nHessen Amtsgericht Frankfurt am Main HRB 92327\nSVEMA Group GmbH – Kriftel",
      "type": "Löschungsankündigung",
      "state": "Hessen",
      "amtsgericht": "Amtsgericht Frankfurt am Main",
      "registernummer": "HRB 92327",
      "registerart": "HRB",
      "company_name": "SVEMA Group GmbH",
      "company_seat": "Kriftel",
      "details": "15.12.2025 (Bekanntmachungsdatum)\n\nHessen Amtsgericht Frankfurt am Main HRB 92327\nLöschungsankündigung\n\nSVEMA Group GmbH\nGesellschaft mit beschränkter Haftung\nKriftel\n\nEs ist beabsichtig, die Gesellschaft wegen Vermögenslosigkeit gemäß § 394 FamFG von Amts wegen im Handelsregister zu löschen. Hiergegen kann innerhalb eines Zeitraums von 1 Monat nach dieser Veröffentlichung Widerspruch bei dem Amtsgericht Frankfurt am Main eingelegt werden."
    },
    {
      "date": "2025-12-15",
      "id": "140032",
      "original_text": "Registerbekanntmachung nach dem Umwandlungsgesetz\nHessen Amtsgericht Wiesbaden HRA 7935\nConcept Sanierung, Holger Maurer e.K. – Walluf",
      "type": "Registerbekanntmachung nach dem Umwandlungsgesetz",
      "state": "Hessen",
      "amtsgericht": "Amtsgericht Wiesbaden",
      "registernummer": "HRA 7935",
      "registerart": "HRA",
      "company_name": "Concept Sanierung, Holger Maurer e.K.",
      "company_seat": "Walluf",
      "details": "15.12.2025 (Bekanntmachungsdatum)\n\nHessen Amtsgericht Wiesbaden HRA 7935\nRegisterbekanntmachung nach dem Umwandlungsgesetz 15.12.2025 (Eintragungsdatum)\n\nConcept Sanierung, Holger Maurer e.K.\nEinzelkaufmann / Einzelkauffrau\nWalluf\n\nDen Gläubigern der an der Ausgliederung beteiligten Rechtsträger ist, wenn sie binnen sechs Monaten nach dem Tag, an dem die Eintragung der Ausgliederung in das Register des Sitzes derjenigen Rechtsträger deren Gläubiger sie sind, nach §§ 125, 19 Absatz 3 UmwG bekannt gemacht worden ist, ihren Anspruch nach Grund und Höhe schriftlich anmelden, Sicherheit zu leisten, soweit sie nicht Befriedigung verlangen können. Dieses Recht steht den Gläubigern jedoch nur zu, wenn sie glaubhaft machen, dass durch die Ausgliederung die Erfüllung ihrer Forderung gefährdet wird."
    },
    {
      "date": "2025-12-15",
      "id": "140033",
      "original_text": "Sonstige Registerbekanntmachung\nHessen Amtsgericht Frankfurt am Main HRB 8610\nBWG Frankfurt am Main Bundesbahn-Wohnungsgesellschaft mbH – Frankfurt am Main",
      "type": "Sonstige Registerbekanntmachung",
      "state": "Hessen",
      "amtsgericht": "Amtsgericht Frankfurt am Main",
      "registernummer": "HRB 8610",
      "registerart": "HRB",
      "company_name": "BWG Frankfurt am Main Bundesbahn-Wohnungsgesellschaft mbH",
      "company_seat": "Frankfurt am Main",
      "details": "15.12.2025 (Bekanntmachungsdatum)\n\nHessen Amtsgericht Frankfurt am Main HRB 8610\nSonstige Registerbekanntmachung\n\nBWG Frankfurt am Main Bundesbahn-Wohnungsgesellschaft mbH\nGesellschaft mit beschränkter Haftung\nFrankfurt am Main\n\nDurch eine Änderung in den Personen der Aufsichtsratsmitglieder ist eine Liste der Mitglieder des Aufsichtsrates zum Handelsregister eingereicht worden."
    },
    {
      "date": "2025-12-15",
      "id": "140034",
      "original_text": "Einreichung neuer Dokumente\nHessen Amtsgericht Frankfurt am Main HRB 51799\nDB RegioNetz Verkehrs GmbH – Frankfurt am Main",
      "type": "Einreichung neuer Dokumente",
      "state": "Hessen",
      "amtsgericht": "Amtsgericht Frankfurt am Main",
      "registernummer": "HRB 51799",
      "registerart": "HRB",
      "company_name": "DB RegioNetz Verkehrs GmbH",
      "company_seat": "Frankfurt am Main",
      "details": "15.12.2025 (Bekanntmachungsdatum)\n\nHessen Amtsgericht Frankfurt am Main HRB 51799\nEinreichung neuer Dokumente\n\nDB RegioNetz Verkehrs GmbH\nGesellschaft mit beschränkter Haftung\nFrankfurt am Main\n\nDurch eine Änderung in den Personen der Aufsichtsratsmitglieder ist eine Liste der Mitglieder des Aufsichtsrates zum Handelsregister eingereicht worden."
    },
    {
      "date": "2025-12-15",
      "id": "140035",
      "original_text": "Sonstige Registerbekanntmachung\nHessen Amtsgericht Frankfurt am Main HRB 128726\nLLCP Franchise GmbH – Frankfurt am Main",
      "type": "Sonstige Registerbekanntmachung",
      "state": "Hessen",
      "amtsgericht": "Amtsgericht Frankfurt am Main",
      "registernummer": "HRB 128726",
      "registerart": "HRB",
      "company_name": "LLCP Franchise GmbH",
      "company_seat": "Frankfurt am Main",
      "details": "15.12.2025 (Bekanntmachungsdatum)\n\nHessen Amtsgericht Frankfurt am Main HRB 128726\nSonstige Registerbekanntmachung 15.12.2025 (Eintragungsdatum)\n\nLLCP Franchise GmbH\nGesellschaft mit beschränkter Haftung\nFrankfurt am Main\n\nDen Gläubigern der Gesellschaft, deren Forderungen begründet worden sind, bevor die Eintragung der Beendigung des Vertrags in das Handelsregister nach § 10 HGB bekannt gemacht worden ist, ist vom anderen Vertragsteil Sicherheit zu leisten, wenn sie sich binnen sechs Monaten nach dieser Bekanntmachung zu diesem Zweck bei ihm melden."
    },
    {
      "date": "2025-12-15",
      "id": "140036",
      "original_text": "Löschungsankündigung\nHessen Amtsgericht Frankfurt am Main HRA 52870\ntreevest europe GmbH & Co. KG – Frankfurt am Main",
      "type": "Löschungsankündigung",
      "state": "Hessen",
      "amtsgericht": "Amtsgericht Frankfurt am Main",
      "registernummer": "HRA 52870",
      "registerart": "HRA",
      "company_name": "treevest europe GmbH & Co. KG",
      "company_seat": "Frankfurt am Main",
      "details": "15.12.2025 (Bekanntmachungsdatum)\n\nHessen Amtsgericht Frankfurt am Main HRA 52870\nLöschungsankündigung\n\ntreevest europe GmbH & Co. KG\nKommanditgesellschaft\nFrankfurt am Main\n\nEs ist beabsichtigt, die Gesellschaft wegen Vermögenslosigkeit gemäß § 394 FamFG von Amts wegen im Handelsregister zu löschen. Hiergegen kann innerhalb eines Monats nach dieser Veröffentlichung Widerspruch bei dem Amtsgericht Frankfurt am Main eingelegt werden."
    },
    {
      "date": "2025-12-15",
      "id": "140037",
      "original_text": "Registerbekanntmachung nach dem Umwandlungsgesetz\nHessen Amtsgericht Frankfurt am Main HRB 120788\nAXA Energy 1 GmbH – Frankfurt am Main",
      "type": "Registerbekanntmachung nach dem Umwandlungsgesetz",
      "state": "Hessen",
      "amtsgericht": "Amtsgericht Frankfurt am Main",
      "registernummer": "HRB 120788",
      "registerart": "HRB",
      "company_name": "AXA Energy 1 GmbH",
      "company_seat": "Frankfurt am Main",
      "details": "15.12.2025 (Bekanntmachungsdatum)\n\nHessen Amtsgericht Frankfurt am Main HRB 120788\nRegisterbekanntmachung nach dem Umwandlungsgesetz\n\nAXA Energy 1 GmbH\nGesellschaft mit beschränkter Haftung\nFrankfurt am Main\n\nDer Entwurf des Verschmelzungsplans ist beim Handelsregister eingereicht worden.\n\nAn der grenzüberschreitenden Verschmelzung sind beteiligt (a) AXA Energy 1 GmbH, eine deutsche Gesellschaft mit beschränkter Haftung, gegründet und bestehend nach deutschem Recht, mit Sitz Frankfurt am Main, Deutschland, als übertragende Gesellschaft, und (b) AXA PIE Lux 7 S.à.r.l., eine nach dem Recht des Großherzogtums Luxemburg gegründete und bestehende Gesellschaft mit beschränkter Haftung mit Sitz in Luxemburg, Großherzogtum Luxemburg. Die AXA Energy 1 GmbH ist eine 100-prozentige Tochtergesellschaft der AXA PIE Lux 7 S.à r.l.\n\nDie an der grenzüberschreitenden Verschmelzung beteiligten Gesellschaften sind in folgenden Registern eingetragen: Die übertragende AXA Energy 1 GmbH ist eingetragen im Handelsregister des Amtsgerichts Frankfurt am Main unter HRB 120788. Die übernehmende AXA PIE Lux 7 S.à r.l. ist eingetragen im Handels- und Gesellschaftsregister Luxemburg unter der Nummer B 276832.\n\nDie Anteilsinhaber und Gläubiger der an der grenzüberschreitenden Verschmelzung beteiligten Gesellschaften werden darauf hingewiesen, dass sie der jeweiligen Gesellschaft spätestens fünf Arbeitstage vor Ablauf eines Monats nach Bekanntmachung des Verschmelzungsplans im Handelsregister Bemerkungen zum Verschmelzungsplan übermitteln können.\n\nBei den an der grenzüberschreitenden Verschmelzung beteiligten Gesellschaften gibt es keine Arbeitnehmer und keinen Betriebsrat."
    },
    {
      "date": "2025-12-15",
      "id": "140038",
      "original_text": "Registerbekanntmachung nach dem Umwandlungsgesetz\nHessen Amtsgericht Offenbach am Main HRB 43452\nBiokraft Naturbrennstoffe GmbH – Offenbach",
      "type": "Registerbekanntmachung nach dem Umwandlungsgesetz",
      "state": "Hessen",
      "amtsgericht": "Amtsgericht Offenbach am Main",
      "registernummer": "HRB 43452",
      "registerart": "HRB",
      "company_name": "Biokraft Naturbrennstoffe GmbH",
      "company_seat": "Offenbach",
      "details": "15.12.2025 (Bekanntmachungsdatum)\n\nHessen Amtsgericht Offenbach am Main HRB 43452\nRegisterbekanntmachung nach dem Umwandlungsgesetz 15.12.2025 (Eintragungsdatum)\n\nBiokraft Naturbrennstoffe GmbH\nGesellschaft mit beschränkter Haftung\nOffenbach\n\nDen Gläubigern der an der Verschmelzung beteiligten Rechtsträger ist, wenn sie binnen sechs Monaten nach dem Tag, an dem die Eintragung der Verschmelzung in das Register des Sitzes desjenigen Rechtsträgers, dessen Gläubiger sie sind, nach § 19 Absatz 3 UmwG bekannt gemacht worden ist, ihren Anspruch nach Grund und Höhe schriftlich anmelden, Sicherheit zu leisten, soweit sie nicht Befriedigung verlangen können. Dieses Recht steht den Gläubigern jedoch nur zu, wenn sie glaubhaft machen, dass durch die Verschmelzung die Erfüllung ihrer Forderung gefährdet wird."
    },
    {
      "date": "2025-12-15",
      "id": "140039",
      "original_text": "Registerbekanntmachung nach dem Umwandlungsgesetz\nHessen Amtsgericht Frankfurt am Main HRB 91088\nTeamplate Service Deutschland GmbH – Frankfurt am Main",
      "type": "Registerbekanntmachung nach dem Umwandlungsgesetz",
      "state": "Hessen",
      "amtsgericht": "Amtsgericht Frankfurt am Main",
      "registernummer": "HRB 91088",
      "registerart": "HRB",
      "company_name": "Teamplate Service Deutschland GmbH",
      "company_seat": "Frankfurt am Main",
      "details": "15.12.2025 (Bekanntmachungsdatum)\n\nHessen Amtsgericht Frankfurt am Main HRB 91088\nRegisterbekanntmachung nach dem Umwandlungsgesetz 15.12.2025 (Eintragungsdatum)\n\nTeamplate Service Deutschland GmbH\nGesellschaft mit beschränkter Haftung\nFrankfurt am Main\n\nDen Gläubigern der an der formwechselnden Umwandlung beteiligten Rechtsträger ist, wenn sie binnen sechs Monaten nach dem Tag, an dem die Eintragung der formwechselnden Umwandlung in das Register des Sitzes desjenigen Rechtsträgers, dessen Gläubiger sie sind, nach § 201 UmwG bekannt gemacht worden ist, ihren Anspruch nach Grund und Höhe schriftlich anmelden, Sicherheit zu leisten, soweit sie nicht Befriedigung verlangen können. Dieses Recht steht den Gläubigern jedoch nur zu, wenn sie glaubhaft machen, dass durch die formwechselnden Umwandlung die Erfüllung ihrer Forderung gefährdet wird."
    },
    {
      "date": "2025-12-15",
      "id": "140040",
      "original_text": "Registerbekanntmachung nach dem Umwandlungsgesetz\nHessen Amtsgericht Frankfurt am Main HRA 54484\nData Inuvum GmbH & Co. KG – Frankfurt am Main",
      "type": "Registerbekanntmachung nach dem Umwandlungsgesetz",
      "state": "Hessen",
      "amtsgericht": "Amtsgericht Frankfurt am Main",
      "registernummer": "HRA 54484",
      "registerart": "HRA",
      "company_name": "Data Inuvum GmbH & Co. KG",
      "company_seat": "Frankfurt am Main",
      "details": "15.12.2025 (Bekanntmachungsdatum)\n\nHessen Amtsgericht Frankfurt am Main HRA 54484\nRegisterbekanntmachung nach dem Umwandlungsgesetz 15.12.2025 (Eintragungsdatum)\n\nData Inuvum GmbH & Co. KG\nKommanditgesellschaft\nFrankfurt am Main\n\nDen Gläubigern der an der formwechselnden Umwandlung beteiligten Rechtsträger ist, wenn sie binnen sechs Monaten nach dem Tag, an dem die Eintragung der formwechselnden Umwandlung in das Register des Sitzes desjenigen Rechtsträgers, dessen Gläubiger sie sind, nach § 201 UmwG bekannt gemacht worden ist, ihren Anspruch nach Grund und Höhe schriftlich anmelden, Sicherheit zu leisten, soweit sie nicht Befriedigung verlangen können. Dieses Recht steht den Gläubigern jedoch nur zu, wenn sie glaubhaft machen, dass durch die formwechselnden Umwandlung die Erfüllung ihrer Forderung gefährdet wird."
    },
    {
      "date": "2025-12-15",
      "id": "140041",
      "original_text": "Registerbekanntmachung nach dem Umwandlungsgesetz\nHessen Amtsgericht Darmstadt HRA 87690\nSteinmetzmeister Marcus Hochhaus e.K. – Groß-Rohrheim",
      "type": "Registerbekanntmachung nach dem Umwandlungsgesetz",
      "state": "Hessen",
      "amtsgericht": "Amtsgericht Darmstadt",
      "registernummer": "HRA 87690",
      "registerart": "HRA",
      "company_name": "Steinmetzmeister Marcus Hochhaus e.K.",
      "company_seat": "Groß-Rohrheim",
      "details": "15.12.2025 (Bekanntmachungsdatum)\n\nHessen Amtsgericht Darmstadt HRA 87690\nRegisterbekanntmachung nach dem Umwandlungsgesetz 14.12.2025 (Eintragungsdatum)\n\nSteinmetzmeister Marcus Hochhaus e.K.\nEinzelkaufmann / Einzelkauffrau\nGroß-Rohrheim\n\nDen Gläubigern der an der Ausgliederung beteiligten Rechtsträger ist, wenn sie binnen sechs Monaten nach dem Tag, an dem die Eintragung der Ausgliederung in das Register des Sitzes derjenigen Rechtsträger deren Gläubiger sie sind, nach §§ 125, 19 Absatz 3 UmwG bekannt gemacht worden ist, ihren Anspruch nach Grund und Höhe schriftlich anmelden, Sicherheit zu leisten, soweit sie nicht Befriedigung verlangen können. Dieses Recht steht den Gläubigern jedoch nur zu, wenn sie glaubhaft machen, dass durch die Ausgliederung die Erfüllung ihrer Forderung gefährdet wird."
    }
  ]
}