{
  "date": "2025-12-09",
  "date_of_scrape": "2025-12-10T04:17:33.559Z",
  "tool_version": "0.2.0",
  "number_of_announcements": 135,
  "announcements": [
    {
      "date": "2025-12-09",
      "id": "139447",
      "original_text": "Registerbekanntmachung nach dem Umwandlungsgesetz\nBayern Amtsgericht München HRB 203027\nSavecall ICT Solutions GmbH – Grünwald",
      "type": "Registerbekanntmachung nach dem Umwandlungsgesetz",
      "state": "Bayern",
      "amtsgericht": "Amtsgericht München",
      "registernummer": "HRB 203027",
      "registerart": "HRB",
      "company_name": "Savecall ICT Solutions GmbH",
      "company_seat": "Grünwald",
      "details": "09.12.2025 (Bekanntmachungsdatum)\n\nBayern Amtsgericht München HRB 203027\nRegisterbekanntmachung nach dem Umwandlungsgesetz 08.12.2025 (Eintragungsdatum)\n\nSavecall ICT Solutions GmbH\nGesellschaft mit beschränkter Haftung\nGrünwald\n\nDen Gläubigern der an der Verschmelzung beteiligten Rechtsträger ist, wenn sie binnen sechs Monaten nach dem Tag, an dem die Eintragung der Verschmelzung in das Register des Sitzes desjenigen Rechtsträgers, dessen Gläubiger sie sind, nach § 19 Abs. 3 UmwG als bekannt gemacht gilt, ihren Anspruch nach Grund und Höhe in Textform anmelden, Sicherheit zu leisten, soweit sie nicht Befriedigung verlangen können. Dieses Recht steht den Gläubigern jedoch nur zu, wenn sie glaubhaft machen, dass durch die Verschmelzung die Erfüllung ihrer Forderung gefährdet wird."
    },
    {
      "date": "2025-12-09",
      "id": "139448",
      "original_text": "Löschungsankündigung\nBayern Amtsgericht Nürnberg HRB 32907\nGMR Holzhaus Handel u. Montagen UG (haftungsbeschränkt) – Schwarzenbruck",
      "type": "Löschungsankündigung",
      "state": "Bayern",
      "amtsgericht": "Amtsgericht Nürnberg",
      "registernummer": "HRB 32907",
      "registerart": "HRB",
      "company_name": "GMR Holzhaus Handel u. Montagen UG (haftungsbeschränkt)",
      "company_seat": "Schwarzenbruck",
      "details": "09.12.2025 (Bekanntmachungsdatum)\n\nBayern Amtsgericht Nürnberg HRB 32907\nLöschungsankündigung\n\nGMR Holzhaus Handel u. Montagen UG (haftungsbeschränkt)\nGesellschaft mit beschränkter Haftung\nSchwarzenbruck\n\nDas Registergericht beabsichtigt, die im Handelsregister eingetragene Gesellschaft wegen Vermögenslosigkeit von Amts wegen nach § 394 FamFG zu löschen. Die Frist zur Erhebung eines Widerspruchs ist auf einen Monat festgesetzt."
    },
    {
      "date": "2025-12-09",
      "id": "139449",
      "original_text": "Löschungsankündigung\nBayern Amtsgericht München HRB 267854\nUbi Sunt Energy UG (haftungsbeschränkt) – München",
      "type": "Löschungsankündigung",
      "state": "Bayern",
      "amtsgericht": "Amtsgericht München",
      "registernummer": "HRB 267854",
      "registerart": "HRB",
      "company_name": "Ubi Sunt Energy UG (haftungsbeschränkt)",
      "company_seat": "München",
      "details": "09.12.2025 (Bekanntmachungsdatum)\n\nBayern Amtsgericht München HRB 267854\nLöschungsankündigung\n\nUbi Sunt Energy UG (haftungsbeschränkt)\nGesellschaft mit beschränkter Haftung\nMünchen\n\nDas Registergericht beabsichtigt, die im Handelsregister eingetragene Gesellschaft wegen Vermögenslosigkeit von Amts wegen nach § 394 FamFG zu löschen. Die Frist zur Erhebung eines Widerspruchs ist auf drei Monate festgesetzt."
    },
    {
      "date": "2025-12-09",
      "id": "139450",
      "original_text": "Löschungsankündigung\nBayern Amtsgericht Bayreuth VR 200156\nOpti-med Bayreuth e.V. mein Gesundheitsnetzwerk – Bayreuth",
      "type": "Löschungsankündigung",
      "state": "Bayern",
      "amtsgericht": "Amtsgericht Bayreuth",
      "registernummer": "VR 200156",
      "registerart": "VR",
      "company_name": "Opti-med Bayreuth e.V. mein Gesundheitsnetzwerk",
      "company_seat": "Bayreuth",
      "details": "09.12.2025 (Bekanntmachungsdatum)\n\nBayern Amtsgericht Bayreuth VR 200156\nLöschungsankündigung\n\nOpti-med Bayreuth e.V. mein Gesundheitsnetzwerk\neingetragener Verein\nBayreuth\n\nDas Registergericht beabsichtigt, den im Vereinsregister eingetragenen Verein von Amts wegen nach § 395 FamFG wegen Wegfalls aller Mitglieder zu löschen. Die Frist zur Erhebung eines Widerspruchs ist auf zwei Monate festgesetzt."
    },
    {
      "date": "2025-12-09",
      "id": "139451",
      "original_text": "Registerbekanntmachung nach dem Umwandlungsgesetz\nBayern Amtsgericht München HRB 218136\nZEDORA 124 Verwaltung GmbH – München",
      "type": "Registerbekanntmachung nach dem Umwandlungsgesetz",
      "state": "Bayern",
      "amtsgericht": "Amtsgericht München",
      "registernummer": "HRB 218136",
      "registerart": "HRB",
      "company_name": "ZEDORA 124 Verwaltung GmbH",
      "company_seat": "München",
      "details": "09.12.2025 (Bekanntmachungsdatum)\n\nBayern Amtsgericht München HRB 218136\nRegisterbekanntmachung nach dem Umwandlungsgesetz 08.12.2025 (Eintragungsdatum)\n\nZEDORA 124 Verwaltung GmbH\nGesellschaft mit beschränkter Haftung\nMünchen\n\nDen Gläubigern der an der Verschmelzung beteiligten Rechtsträger ist, wenn sie binnen sechs Monaten nach dem Tag, an dem die Eintragung der Verschmelzung in das Register des Sitzes desjenigen Rechtsträgers, dessen Gläubiger sie sind, nach § 19 Abs. 3 UmwG als bekannt gemacht gilt, ihren Anspruch nach Grund und Höhe in Textform anmelden, Sicherheit zu leisten, soweit sie nicht Befriedigung verlangen können. Dieses Recht steht den Gläubigern jedoch nur zu, wenn sie glaubhaft machen, dass durch die Verschmelzung die Erfüllung ihrer Forderung gefährdet wird."
    },
    {
      "date": "2025-12-09",
      "id": "139452",
      "original_text": "Löschungsankündigung\nBayern Amtsgericht München HRA 109291\nKottmaier CNC-Zerspanungstechnik GmbH & Co. KG – Sulzemoos",
      "type": "Löschungsankündigung",
      "state": "Bayern",
      "amtsgericht": "Amtsgericht München",
      "registernummer": "HRA 109291",
      "registerart": "HRA",
      "company_name": "Kottmaier CNC-Zerspanungstechnik GmbH & Co. KG",
      "company_seat": "Sulzemoos",
      "details": "09.12.2025 (Bekanntmachungsdatum)\n\nBayern Amtsgericht München HRA 109291\nLöschungsankündigung\n\nKottmaier CNC-Zerspanungstechnik GmbH & Co. KG\nKommanditgesellschaft\nSulzemoos\n\nDas Registergericht beabsichtigt, die im Handelsregister eingetragene Firma von Amts wegen nach § 31 Abs. 2 HGB zu löschen. Die Frist zur Erhebung eines Widerspruchs ist auf drei Monate festgesetzt."
    },
    {
      "date": "2025-12-09",
      "id": "139453",
      "original_text": "Einreichung neuer Dokumente\nBayern Amtsgericht München HRB 151738\nSSS Asset Management AG – München",
      "type": "Einreichung neuer Dokumente",
      "state": "Bayern",
      "amtsgericht": "Amtsgericht München",
      "registernummer": "HRB 151738",
      "registerart": "HRB",
      "company_name": "SSS Asset Management AG",
      "company_seat": "München",
      "details": "09.12.2025 (Bekanntmachungsdatum)\n\nBayern Amtsgericht München HRB 151738\nEinreichung neuer Dokumente\n\nSSS Asset Management AG\nAktiengesellschaft\nMünchen\n\nDem Amtsgericht München -Registergericht- ist eine Liste der Mitglieder des Aufsichtsrats eingereicht worden, § 106 AktG."
    },
    {
      "date": "2025-12-09",
      "id": "139454",
      "original_text": "Einreichung neuer Dokumente\nBayern Amtsgericht Regensburg HRB 10634\nGerresheimer Regensburg GmbH – Regensburg",
      "type": "Einreichung neuer Dokumente",
      "state": "Bayern",
      "amtsgericht": "Amtsgericht Regensburg",
      "registernummer": "HRB 10634",
      "registerart": "HRB",
      "company_name": "Gerresheimer Regensburg GmbH",
      "company_seat": "Regensburg",
      "details": "09.12.2025 (Bekanntmachungsdatum)\n\nBayern Amtsgericht Regensburg HRB 10634\nEinreichung neuer Dokumente\n\nGerresheimer Regensburg GmbH\nGesellschaft mit beschränkter Haftung\nRegensburg\n\nDem Amtsgericht Regensburg -Registergericht- ist eine Liste der Mitglieder des Aufsichtsrats eingereicht worden, § 52 Abs. 3 S. 2 GmbHG."
    },
    {
      "date": "2025-12-09",
      "id": "139455",
      "original_text": "Registerbekanntmachung nach dem Umwandlungsgesetz\nBayern Amtsgericht Fürth HRB 21980\nPegasus Real Estate Partners GmbH – Erlangen",
      "type": "Registerbekanntmachung nach dem Umwandlungsgesetz",
      "state": "Bayern",
      "amtsgericht": "Amtsgericht Fürth",
      "registernummer": "HRB 21980",
      "registerart": "HRB",
      "company_name": "Pegasus Real Estate Partners GmbH",
      "company_seat": "Erlangen",
      "details": "09.12.2025 (Bekanntmachungsdatum)\n\nBayern Amtsgericht Fürth HRB 21980\nRegisterbekanntmachung nach dem Umwandlungsgesetz 08.12.2025 (Eintragungsdatum)\n\nPegasus Real Estate Partners GmbH\nGesellschaft mit beschränkter Haftung\nErlangen\n\nDen Gläubigern der an der Spaltung beteiligten Rechtsträger ist, wenn sie binnen sechs Monaten nach dem Tag, an dem die Eintragung der Spaltung in das Register des Sitzes desjenigen Rechtsträgers, dessen Gläubiger sie sind, nach §§ 125, 19 Abs. 3 UmwG als bekannt gemacht gilt, ihren Anspruch nach Grund und Höhe in Textform anmelden, Sicherheit zu leisten, soweit sie nicht Befriedigung verlangen können. Dieses Recht steht den Gläubigern jedoch nur zu, wenn sie glaubhaft machen, dass durch die Spaltung die Erfüllung ihrer Forderung gefährdet wird."
    },
    {
      "date": "2025-12-09",
      "id": "139456",
      "original_text": "Registerbekanntmachung nach dem Umwandlungsgesetz\nBayern Amtsgericht München HRB 299687\nBloomergym GmbH – Mauern",
      "type": "Registerbekanntmachung nach dem Umwandlungsgesetz",
      "state": "Bayern",
      "amtsgericht": "Amtsgericht München",
      "registernummer": "HRB 299687",
      "registerart": "HRB",
      "company_name": "Bloomergym GmbH",
      "company_seat": "Mauern",
      "details": "09.12.2025 (Bekanntmachungsdatum)\n\nBayern Amtsgericht München HRB 299687\nRegisterbekanntmachung nach dem Umwandlungsgesetz 08.12.2025 (Eintragungsdatum)\n\nBloomergym GmbH\nGesellschaft mit beschränkter Haftung\nMauern\n\nDen Gläubigern der an der Ausgliederung beteiligten Rechtsträger ist, wenn sie binnen sechs Monaten nach dem Tag, an dem die Eintragung der Ausgliederung in das Register des Sitzes desjenigen Rechtsträgers, dessen Gläubiger sie sind, nach §§ 125, 19 Abs. 3 UmwG als bekannt gemacht gilt, ihren Anspruch nach Grund und Höhe in Textform anmelden, Sicherheit zu leisten, soweit sie nicht Befriedigung verlangen können. Dieses Recht steht den Gläubigern jedoch nur zu, wenn sie glaubhaft machen, dass durch die Ausgliederung die Erfüllung ihrer Forderung gefährdet wird."
    },
    {
      "date": "2025-12-09",
      "id": "139457",
      "original_text": "Löschungsankündigung\nBayern Amtsgericht München HRB 178150\nPROMPT Technologies GmbH – Bad Tölz",
      "type": "Löschungsankündigung",
      "state": "Bayern",
      "amtsgericht": "Amtsgericht München",
      "registernummer": "HRB 178150",
      "registerart": "HRB",
      "company_name": "PROMPT Technologies GmbH",
      "company_seat": "Bad Tölz",
      "details": "09.12.2025 (Bekanntmachungsdatum)\n\nBayern Amtsgericht München HRB 178150\nLöschungsankündigung\n\nPROMPT Technologies GmbH\nGesellschaft mit beschränkter Haftung\nBad Tölz\n\nDas Registergericht beabsichtigt, die im Handelsregister eingetragene Gesellschaft wegen Vermögenslosigkeit von Amts wegen nach § 394 FamFG zu löschen. Die Frist zur Erhebung eines Widerspruchs ist auf drei Monate festgesetzt."
    },
    {
      "date": "2025-12-09",
      "id": "139458",
      "original_text": "Registerbekanntmachung nach dem Umwandlungsgesetz\nBayern Amtsgericht München HRB 109726\nPeter Amberger Verwaltungs GmbH – Tegernsee",
      "type": "Registerbekanntmachung nach dem Umwandlungsgesetz",
      "state": "Bayern",
      "amtsgericht": "Amtsgericht München",
      "registernummer": "HRB 109726",
      "registerart": "HRB",
      "company_name": "Peter Amberger Verwaltungs GmbH",
      "company_seat": "Tegernsee",
      "details": "09.12.2025 (Bekanntmachungsdatum)\n\nBayern Amtsgericht München HRB 109726\nRegisterbekanntmachung nach dem Umwandlungsgesetz 06.12.2025 (Eintragungsdatum)\n\nPeter Amberger Verwaltungs GmbH\nGesellschaft mit beschränkter Haftung\nTegernsee\n\nDen Gläubigern der an der Verschmelzung beteiligten Rechtsträger ist, wenn sie binnen sechs Monaten nach dem Tag, an dem die Eintragung der Verschmelzung in das Register des Sitzes desjenigen Rechtsträgers, dessen Gläubiger sie sind, nach § 19 Abs. 3 UmwG als bekannt gemacht gilt, ihren Anspruch nach Grund und Höhe in Textform anmelden, Sicherheit zu leisten, soweit sie nicht Befriedigung verlangen können. Dieses Recht steht den Gläubigern jedoch nur zu, wenn sie glaubhaft machen, dass durch die Verschmelzung die Erfüllung ihrer Forderung gefährdet wird."
    },
    {
      "date": "2025-12-09",
      "id": "139459",
      "original_text": "Löschungsankündigung\nBayern Amtsgericht München HRB 277053\nMEAS GmbH – München",
      "type": "Löschungsankündigung",
      "state": "Bayern",
      "amtsgericht": "Amtsgericht München",
      "registernummer": "HRB 277053",
      "registerart": "HRB",
      "company_name": "MEAS GmbH",
      "company_seat": "München",
      "details": "09.12.2025 (Bekanntmachungsdatum)\n\nBayern Amtsgericht München HRB 277053\nLöschungsankündigung\n\nMEAS GmbH\nGesellschaft mit beschränkter Haftung\nMünchen\n\nDas Registergericht beabsichtigt, die im Handelsregister eingetragene Gesellschaft wegen Vermögenslosigkeit von Amts wegen nach § 394 FamFG zu löschen. Die Frist zur Erhebung eines Widerspruchs ist auf drei Monate festgesetzt."
    },
    {
      "date": "2025-12-09",
      "id": "139460",
      "original_text": "Sonstige Registerbekanntmachung\nBayern Amtsgericht München HRB 79506\nScheidl-Baywobau Bauträger Verwaltungs-GmbH – Grünwald",
      "type": "Sonstige Registerbekanntmachung",
      "state": "Bayern",
      "amtsgericht": "Amtsgericht München",
      "registernummer": "HRB 79506",
      "registerart": "HRB",
      "company_name": "Scheidl-Baywobau Bauträger Verwaltungs-GmbH",
      "company_seat": "Grünwald",
      "details": "09.12.2025 (Bekanntmachungsdatum)\n\nBayern Amtsgericht München HRB 79506\nSonstige Registerbekanntmachung 08.12.2025 (Eintragungsdatum)\n\nScheidl-Baywobau Bauträger Verwaltungs-GmbH\nGesellschaft mit beschränkter Haftung\nGrünwald\n\nDen Gläubigern der an der Verschmelzung beteiligten Rechtsträger ist, wenn sie binnen sechs Monaten nach dem Tag, an dem die Eintragung der Verschmelzung in das Register des Sitzes desjenigen Rechtsträgers, dessen Gläubiger sie sind, nach § 19 Abs. 3 UmwG als bekannt gemacht gilt, ihren Anspruch nach Grund und Höhe in Textform anmelden, Sicherheit zu leisten, soweit sie nicht Befriedigung verlangen können. Dieses Recht steht den Gläubigern jedoch nur zu, wenn sie glaubhaft machen, dass durch die Verschmelzung die Erfüllung ihrer Forderung gefährdet wird."
    },
    {
      "date": "2025-12-09",
      "id": "139461",
      "original_text": "Löschungsankündigung\nBayern Amtsgericht München HRB 86650\nDomenico Carano GmbH – Baldham, Gemeinde Vaterstetten",
      "type": "Löschungsankündigung",
      "state": "Bayern",
      "amtsgericht": "Amtsgericht München",
      "registernummer": "HRB 86650",
      "registerart": "HRB",
      "company_name": "Domenico Carano GmbH",
      "company_seat": "Baldham, Gemeinde Vaterstetten",
      "details": "09.12.2025 (Bekanntmachungsdatum)\n\nBayern Amtsgericht München HRB 86650\nLöschungsankündigung\n\nDomenico Carano GmbH\nGesellschaft mit beschränkter Haftung\nBaldham, Gemeinde Vaterstetten\n\nDas Registergericht beabsichtigt, den im Handelsregister eingetragenen Geschäftsführer Domenico Carano, Friseur, nach § 395 FamFG zu löschen, da er verstorben ist. Die Frist zur Erhebung eines Widerspruchs ist auf drei Monate festgesetzt."
    },
    {
      "date": "2025-12-09",
      "id": "139462",
      "original_text": "Löschungsankündigung\nBayern Amtsgericht München HRB 215853\nMercatura Handels GmbH – München",
      "type": "Löschungsankündigung",
      "state": "Bayern",
      "amtsgericht": "Amtsgericht München",
      "registernummer": "HRB 215853",
      "registerart": "HRB",
      "company_name": "Mercatura Handels GmbH",
      "company_seat": "München",
      "details": "09.12.2025 (Bekanntmachungsdatum)\n\nBayern Amtsgericht München HRB 215853\nLöschungsankündigung\n\nMercatura Handels GmbH\nGesellschaft mit beschränkter Haftung\nMünchen\n\nDas Registergericht beabsichtigt, die im Handelsregister eingetragene Gesellschaft wegen Vermögenslosigkeit von Amts wegen nach § 394 FamFG zu löschen. Die Frist zur Erhebung eines Widerspruchs ist auf drei Monate festgesetzt."
    },
    {
      "date": "2025-12-09",
      "id": "139463",
      "original_text": "Registerbekanntmachung nach dem Umwandlungsgesetz\nBayern Amtsgericht München HRB 286282\nasthenis medical GmbH – Aschheim",
      "type": "Registerbekanntmachung nach dem Umwandlungsgesetz",
      "state": "Bayern",
      "amtsgericht": "Amtsgericht München",
      "registernummer": "HRB 286282",
      "registerart": "HRB",
      "company_name": "asthenis medical GmbH",
      "company_seat": "Aschheim",
      "details": "09.12.2025 (Bekanntmachungsdatum)\n\nBayern Amtsgericht München HRB 286282\nRegisterbekanntmachung nach dem Umwandlungsgesetz 08.12.2025 (Eintragungsdatum)\n\nasthenis medical GmbH\nGesellschaft mit beschränkter Haftung\nAschheim\n\nDen Gläubigern der an der Verschmelzung beteiligten Rechtsträger ist, wenn sie binnen sechs Monaten nach dem Tag, an dem die Eintragung der Verschmelzung in das Register des Sitzes desjenigen Rechtsträgers, dessen Gläubiger sie sind, nach § 19 Abs. 3 UmwG als bekannt gemacht gilt, ihren Anspruch nach Grund und Höhe in Textform anmelden, Sicherheit zu leisten, soweit sie nicht Befriedigung verlangen können. Dieses Recht steht den Gläubigern jedoch nur zu, wenn sie glaubhaft machen, dass durch die Verschmelzung die Erfüllung ihrer Forderung gefährdet wird."
    },
    {
      "date": "2025-12-09",
      "id": "139464",
      "original_text": "Registerbekanntmachung nach dem Umwandlungsgesetz\nBayern Amtsgericht Landshut HRB 15122\nM&M Wurzel einer gemeinsamen Vision GmbH – Eggenfelden",
      "type": "Registerbekanntmachung nach dem Umwandlungsgesetz",
      "state": "Bayern",
      "amtsgericht": "Amtsgericht Landshut",
      "registernummer": "HRB 15122",
      "registerart": "HRB",
      "company_name": "M&M Wurzel einer gemeinsamen Vision GmbH",
      "company_seat": "Eggenfelden",
      "details": "09.12.2025 (Bekanntmachungsdatum)\n\nBayern Amtsgericht Landshut HRB 15122\nRegisterbekanntmachung nach dem Umwandlungsgesetz 08.12.2025 (Eintragungsdatum)\n\nM&M Wurzel einer gemeinsamen Vision GmbH\nGesellschaft mit beschränkter Haftung\nEggenfelden\n\nDen Gläubigern der an der Ausgliederung beteiligten Rechtsträger ist, wenn sie binnen sechs Monaten nach dem Tag, an dem die Eintragung der Ausgliederung in das Register des Sitzes desjenigen Rechtsträgers, dessen Gläubiger sie sind, nach §§ 125, 19 Abs. 3 UmwG als bekannt gemacht gilt, ihren Anspruch nach Grund und Höhe in Textform anmelden, Sicherheit zu leisten, soweit sie nicht Befriedigung verlangen können. Dieses Recht steht den Gläubigern jedoch nur zu, wenn sie glaubhaft machen, dass durch die Ausgliederung die Erfüllung ihrer Forderung gefährdet wird."
    },
    {
      "date": "2025-12-09",
      "id": "139465",
      "original_text": "Löschungsankündigung\nBayern Amtsgericht München HRB 232061\nCarboil Performance Polymers GmbH – München",
      "type": "Löschungsankündigung",
      "state": "Bayern",
      "amtsgericht": "Amtsgericht München",
      "registernummer": "HRB 232061",
      "registerart": "HRB",
      "company_name": "Carboil Performance Polymers GmbH",
      "company_seat": "München",
      "details": "09.12.2025 (Bekanntmachungsdatum)\n\nBayern Amtsgericht München HRB 232061\nLöschungsankündigung\n\nCarboil Performance Polymers GmbH\nGesellschaft mit beschränkter Haftung\nMünchen\n\nDas Registergericht beabsichtigt, die im Handelsregister eingetragene Gesellschaft wegen Vermögenslosigkeit von Amts wegen nach § 394 FamFG zu löschen. Die Frist zur Erhebung eines Widerspruchs ist auf drei Monate festgesetzt."
    },
    {
      "date": "2025-12-09",
      "id": "139466",
      "original_text": "Löschungsankündigung\nBerlin Amtsgericht Berlin (Charlottenburg) HRB 153639\nD.G.B. Dienstleistungsgruppe Berlin GmbH – Berlin",
      "type": "Löschungsankündigung",
      "state": "Berlin",
      "amtsgericht": "Amtsgericht Berlin (Charlottenburg)",
      "registernummer": "HRB 153639",
      "registerart": "HRB",
      "company_name": "D.G.B. Dienstleistungsgruppe Berlin GmbH",
      "company_seat": "Berlin",
      "details": "09.12.2025 (Bekanntmachungsdatum)\n\nBerlin Amtsgericht Berlin (Charlottenburg) HRB 153639\nLöschungsankündigung\n\nD.G.B. Dienstleistungsgruppe Berlin GmbH\nGesellschaft mit beschränkter Haftung\nBerlin\n\nBei der nachstehenden Gesellschaft wird das Amtslöschungsverfahren gemäß § 394 FamFG eingeleitet. Widerspruchsfrist 6 Wochen"
    },
    {
      "date": "2025-12-09",
      "id": "139467",
      "original_text": "Registerbekanntmachung nach dem Umwandlungsgesetz\nSchleswig-Holstein Amtsgericht Flensburg HRA 11517\nth-Coaching e. K. – Risum-Lindholm",
      "type": "Registerbekanntmachung nach dem Umwandlungsgesetz",
      "state": "Schleswig-Holstein",
      "amtsgericht": "Amtsgericht Flensburg",
      "registernummer": "HRA 11517",
      "registerart": "HRA",
      "company_name": "th-Coaching e. K.",
      "company_seat": "Risum-Lindholm",
      "details": "09.12.2025 (Bekanntmachungsdatum)\n\nSchleswig-Holstein Amtsgericht Flensburg HRA 11517\nRegisterbekanntmachung nach dem Umwandlungsgesetz\n\nth-Coaching e. K.\nEinzelkaufmann / Einzelkauffrau\nRisum-Lindholm\n\nAls nicht eingetragen wird veröffentlicht: Den Gläubigern der an der Spaltung beteiligten Rechtsträger ist, wenn sie binnen sechs Monaten nach dem Tag, an dem die Eintragung der Spaltung in das Register des Sitzes desjenigen Rechtsträgers, dessen Gläubiger sie sind, als bekannt gemacht gilt, ihren Anspruch nach Grund und Höhe schriftlich anmelden, Sicherheit zu leisten, soweit sie nicht Befriedigung verlangen können. Dieses Recht steht den Gläubigern jedoch nur zu, wenn sie glaubhaft machen, dass durch die Spaltung die Erfüllung ihrer Forderung gefährdet wird. Das Recht, Sicherheitsleistung zu verlangen, steht Gläubigern nicht zu, die im Falle der Insolvenz ein Recht auf vorzugsweise Befriedigung aus einer Deckungsmasse haben, die nach gesetzlicher Vorschrift zu ihrem Schutz errichtet und staatlich überwacht ist."
    },
    {
      "date": "2025-12-09",
      "id": "139468",
      "original_text": "Registerbekanntmachung nach dem Umwandlungsgesetz\nBaden-Württemberg Amtsgericht Stuttgart HRB 207256\nKYOCERA UNIMERCO Fastening GmbH – Esslingen am Neckar",
      "type": "Registerbekanntmachung nach dem Umwandlungsgesetz",
      "state": "Baden-Württemberg",
      "amtsgericht": "Amtsgericht Stuttgart",
      "registernummer": "HRB 207256",
      "registerart": "HRB",
      "company_name": "KYOCERA UNIMERCO Fastening GmbH",
      "company_seat": "Esslingen am Neckar",
      "details": "09.12.2025 (Bekanntmachungsdatum)\n\nBaden-Württemberg Amtsgericht Stuttgart HRB 207256\nRegisterbekanntmachung nach dem Umwandlungsgesetz 09.12.2025 (Eintragungsdatum)\n\nKYOCERA UNIMERCO Fastening GmbH\nGesellschaft mit beschränkter Haftung\nEsslingen am Neckar\n\nDen Gläubigern der an der Verschmelzung beteiligten Rechtsträger ist, wenn sie binnen sechs Monaten nach dem Tag, an dem die Eintragung der Verschmelzung in das Register des Sitzes desjenigen Rechtsträgers, dessen Gläubiger sie sind, nach § 19 Abs. 3 UmwG als bekanntgemacht gilt, ihren Anspruch nach Grund und Höhe schriftlich anmelden, Sicherheit zu leisten, soweit sie nicht Befriedigung verlangen können. Dieses Recht steht den Gläubigern jedoch nur zu, wenn sie glaubhaft machen, dass durch die Verschmelzung die Erfüllung ihrer Forderung gefährdet wird."
    },
    {
      "date": "2025-12-09",
      "id": "139469",
      "original_text": "Löschungsankündigung\nBrandenburg Amtsgericht Potsdam HRB 28374\ndropnostix GmbH – Potsdam",
      "type": "Löschungsankündigung",
      "state": "Brandenburg",
      "amtsgericht": "Amtsgericht Potsdam",
      "registernummer": "HRB 28374",
      "registerart": "HRB",
      "company_name": "dropnostix GmbH",
      "company_seat": "Potsdam",
      "details": "09.12.2025 (Bekanntmachungsdatum)\n\nBrandenburg Amtsgericht Potsdam HRB 28374\nLöschungsankündigung\n\ndropnostix GmbH\nGesellschaft mit beschränkter Haftung\nPotsdam\n\nBei der nachstehenden Gesellschaft wird das Amtslöschungsverfahren gemäß § 394 FamFG eingeleitet. Widerspruchsfrist 8 Wochen."
    },
    {
      "date": "2025-12-09",
      "id": "139470",
      "original_text": "Registerbekanntmachung nach dem Umwandlungsgesetz\nBerlin Amtsgericht Berlin (Charlottenburg) HRB 219368\nCJH Capital UG (haftungsbeschränkt) – Berlin",
      "type": "Registerbekanntmachung nach dem Umwandlungsgesetz",
      "state": "Berlin",
      "amtsgericht": "Amtsgericht Berlin (Charlottenburg)",
      "registernummer": "HRB 219368",
      "registerart": "HRB",
      "company_name": "CJH Capital UG (haftungsbeschränkt)",
      "company_seat": "Berlin",
      "details": "09.12.2025 (Bekanntmachungsdatum)\n\nBerlin Amtsgericht Berlin (Charlottenburg) HRB 219368\nRegisterbekanntmachung nach dem Umwandlungsgesetz 08.12.2025 (Eintragungsdatum)\n\nCJH Capital UG (haftungsbeschränkt)\nGesellschaft mit beschränkter Haftung\nBerlin\n\nZu Eintragungsnummer 2 vom 08.12.2025 wird als nicht eingetragen veröffentlicht: Den Gläubigern der an der Verschmelzung beteiligten Rechtsträger ist, wenn sie binnen sechs Monaten nach dem Tag, an dem die Eintragung der Verschmelzung in das Register des Sitzes desjenigen Rechtsträgers, dessen Gläubiger sie sind, als bekannt gemacht gilt, ihren Anspruch nach Grund und Höhe schriftlich anmelden, Sicherheit zu leisten, soweit sie nicht Befriedigung verlangen können. Dieses Recht steht den Gläubigern jedoch nur zu, wenn sie glaubhaft machen, dass durch die Verschmelzung die Erfüllung ihrer Forderung gefährdet wird. Das Recht, Sicherheitsleistung zu verlangen, steht Gläubigern nicht zu, die im Falle der Insolvenz ein Recht auf vorzugsweise Befriedigung aus einer Deckungsmasse haben, die nach gesetzlicher Vorschrift zu ihrem Schutz errichtet und staatlich überwacht ist."
    },
    {
      "date": "2025-12-09",
      "id": "139471",
      "original_text": "Registerbekanntmachung nach dem Umwandlungsgesetz\nBaden-Württemberg Amtsgericht Stuttgart HRB 21657\nWTS Advisory AG – Stuttgart",
      "type": "Registerbekanntmachung nach dem Umwandlungsgesetz",
      "state": "Baden-Württemberg",
      "amtsgericht": "Amtsgericht Stuttgart",
      "registernummer": "HRB 21657",
      "registerart": "HRB",
      "company_name": "WTS Advisory AG",
      "company_seat": "Stuttgart",
      "details": "09.12.2025 (Bekanntmachungsdatum)\n\nBaden-Württemberg Amtsgericht Stuttgart HRB 21657\nRegisterbekanntmachung nach dem Umwandlungsgesetz 09.12.2025 (Eintragungsdatum)\n\nWTS Advisory AG\nAktiengesellschaft\nStuttgart\n\nAls nicht eingetragen wird bekanntgemacht:\nDen Gläubigern des an dem Formwechsel beteiligten Rechtsträgers ist, wenn sie binnen sechs Monaten nach dem Tag, an dem die Eintragung des Formwechsels in das Register des Sitzes desjenigen Rechtsträgers, dessen Gläubiger sie sind, nach § 19 Abs. 3 UmwG als bekanntgemacht gilt, ihren Anspruch nach Grund und Höhe schriftlich anmelden, Sicherheit zu leisten, soweit sie nicht Befriedigung verlangen können. Dieses Recht steht den Gläubigern jedoch nur zu, wenn sie glaubhaft machen, dass durch den Formwechsel die Erfüllung ihrer Forderung gefährdet wird."
    },
    {
      "date": "2025-12-09",
      "id": "139472",
      "original_text": "Registerbekanntmachung nach dem Umwandlungsgesetz\nSchleswig-Holstein Amtsgericht Lübeck HRB 24878\nWWS-Bau UG (haftungsbeschränkt) – Geesthacht",
      "type": "Registerbekanntmachung nach dem Umwandlungsgesetz",
      "state": "Schleswig-Holstein",
      "amtsgericht": "Amtsgericht Lübeck",
      "registernummer": "HRB 24878",
      "registerart": "HRB",
      "company_name": "WWS-Bau UG (haftungsbeschränkt)",
      "company_seat": "Geesthacht",
      "details": "09.12.2025 (Bekanntmachungsdatum)\n\nSchleswig-Holstein Amtsgericht Lübeck HRB 24878\nRegisterbekanntmachung nach dem Umwandlungsgesetz 08.12.2025 (Eintragungsdatum)\n\nWWS-Bau UG (haftungsbeschränkt)\nGesellschaft mit beschränkter Haftung\nGeesthacht\n\nZu Eintragungsnummer 2 vom 08.12.2025 wird als nicht eingetragen veröffentlicht: Den Gläubigern der an der Verschmelzung beteiligten Rechtsträger ist, wenn sie binnen sechs Monaten nach dem Tag, an dem die Eintragung der Verschmelzung in das Register des Sitzes desjenigen Rechtsträgers, dessen Gläubiger sie sind, als bekannt gemacht gilt, ihren Anspruch nach Grund und Höhe schriftlich anmelden, Sicherheit zu leisten, soweit sie nicht Befriedigung verlangen können. Dieses Recht steht den Gläubigern jedoch nur zu, wenn sie glaubhaft machen, dass durch die Verschmelzung die Erfüllung ihrer Forderung gefährdet wird."
    },
    {
      "date": "2025-12-09",
      "id": "139473",
      "original_text": "Sonstige Registerbekanntmachung\nHamburg Amtsgericht Hamburg HRB 132883\nJOBLINGE gemeinnützige AG Hanse – Hamburg",
      "type": "Sonstige Registerbekanntmachung",
      "state": "Hamburg",
      "amtsgericht": "Amtsgericht Hamburg",
      "registernummer": "HRB 132883",
      "registerart": "HRB",
      "company_name": "JOBLINGE gemeinnützige AG Hanse",
      "company_seat": "Hamburg",
      "details": "09.12.2025 (Bekanntmachungsdatum)\n\nHamburg Amtsgericht Hamburg HRB 132883\nSonstige Registerbekanntmachung 09.12.2025 (Eintragungsdatum)\n\nJOBLINGE gemeinnützige AG Hanse\nAktiengesellschaft\nHamburg\n\nAls nicht eingetragen wird bekannt gemacht: Liste des Aufsichtsrats wurde eingereicht."
    },
    {
      "date": "2025-12-09",
      "id": "139474",
      "original_text": "Registerbekanntmachung nach dem Umwandlungsgesetz\nBaden-Württemberg Amtsgericht Freiburg HRB 723367\nAccess Tankstelle Neuried UG (haftungsbeschränkt) – Neuried",
      "type": "Registerbekanntmachung nach dem Umwandlungsgesetz",
      "state": "Baden-Württemberg",
      "amtsgericht": "Amtsgericht Freiburg",
      "registernummer": "HRB 723367",
      "registerart": "HRB",
      "company_name": "Access Tankstelle Neuried UG (haftungsbeschränkt)",
      "company_seat": "Neuried",
      "details": "09.12.2025 (Bekanntmachungsdatum)\n\nBaden-Württemberg Amtsgericht Freiburg HRB 723367\nRegisterbekanntmachung nach dem Umwandlungsgesetz 09.12.2025 (Eintragungsdatum)\n\nAccess Tankstelle Neuried UG (haftungsbeschränkt)\nGesellschaft mit beschränkter Haftung\nNeuried\n\nAls nicht eingetragen wird bekanntgemacht:\nDen Gläubigern der an der Verschmelzung beteiligten Rechtsträger ist, wenn sie binnen sechs Monaten nach dem Tag, an dem die Eintragung der Verschmelzung in das Register des Sitzes desjenigen Rechtsträgers, dessen Gläubiger sie sind, nach § 19 Abs. 3 UmwG als bekanntgemacht gilt, ihren Anspruch nach Grund und Höhe schriftlich anmelden, Sicherheit zu leisten, soweit sie nicht Befriedigung verlangen können. Dieses Recht steht den Gläubigern jedoch nur zu, wenn sie glaubhaft machen, dass durch die Verschmelzung die Erfüllung ihrer Forderung gefährdet wird."
    },
    {
      "date": "2025-12-09",
      "id": "139475",
      "original_text": "Registerbekanntmachung nach dem Umwandlungsgesetz\nBaden-Württemberg Amtsgericht Stuttgart HRA 742882\nRobert Wurtz e.K. – Leonberg",
      "type": "Registerbekanntmachung nach dem Umwandlungsgesetz",
      "state": "Baden-Württemberg",
      "amtsgericht": "Amtsgericht Stuttgart",
      "registernummer": "HRA 742882",
      "registerart": "HRA",
      "company_name": "Robert Wurtz e.K.",
      "company_seat": "Leonberg",
      "details": "09.12.2025 (Bekanntmachungsdatum)\n\nBaden-Württemberg Amtsgericht Stuttgart HRA 742882\nRegisterbekanntmachung nach dem Umwandlungsgesetz 09.12.2025 (Eintragungsdatum)\n\nRobert Wurtz e.K.\nEinzelkaufmann / Einzelkauffrau\nLeonberg\n\nAls nicht eingetragen wird bekanntgemacht:\nDen Gläubigern der an der Ausgliederung beteiligten Rechtsträger ist, wenn sie binnen sechs Monaten nach dem Tag, an dem die Eintragung der Ausgliederung in das Register des Sitzes desjenigen Rechtsträgers, dessen Gläubiger sie sind, nach § 19 Abs. 3 UmwG als bekanntgemacht gilt, ihren Anspruch nach Grund und Höhe schriftlich anmelden, Sicherheit zu leisten, soweit sie nicht Befriedigung verlangen können. Dieses Recht steht den Gläubigern jedoch nur zu, wenn sie glaubhaft machen, dass durch die Ausgliederung die Erfüllung ihrer Forderung gefährdet wird."
    },
    {
      "date": "2025-12-09",
      "id": "139476",
      "original_text": "Einreichung neuer Dokumente\nSaarland Amtsgericht Saarbrücken HRB 13201\nGHMT AG – Bexbach",
      "type": "Einreichung neuer Dokumente",
      "state": "Saarland",
      "amtsgericht": "Amtsgericht Saarbrücken",
      "registernummer": "HRB 13201",
      "registerart": "HRB",
      "company_name": "GHMT AG",
      "company_seat": "Bexbach",
      "details": "09.12.2025 (Bekanntmachungsdatum)\n\nSaarland Amtsgericht Saarbrücken HRB 13201\nEinreichung neuer Dokumente 09.12.2025 (Eintragungsdatum)\n\nGHMT AG\nAktiengesellschaft\nBexbach\n\nDer Vorstand der Gesellschaft hat eine Liste der Mitglieder des Aufsichtsrats zum Handelsregister eingereicht (§ 106 AktG)."
    },
    {
      "date": "2025-12-09",
      "id": "139477",
      "original_text": "Registerbekanntmachung nach dem Umwandlungsgesetz\nBaden-Württemberg Amtsgericht Mannheim HRB 723242\nFrico GmbH – Boxberg",
      "type": "Registerbekanntmachung nach dem Umwandlungsgesetz",
      "state": "Baden-Württemberg",
      "amtsgericht": "Amtsgericht Mannheim",
      "registernummer": "HRB 723242",
      "registerart": "HRB",
      "company_name": "Frico GmbH",
      "company_seat": "Boxberg",
      "details": "09.12.2025 (Bekanntmachungsdatum)\n\nBaden-Württemberg Amtsgericht Mannheim HRB 723242\nRegisterbekanntmachung nach dem Umwandlungsgesetz 09.12.2025 (Eintragungsdatum)\n\nFrico GmbH\nGesellschaft mit beschränkter Haftung\nBoxberg\n\nAls nicht eingetragen wird bekanntgemacht:\nDen Gläubigern der an der Verschmelzung beteiligten Rechtsträger ist, wenn sie binnen sechs Monaten nach dem Tag, an dem die Eintragung der Verschmelzung in das Register des Sitzes desjenigen Rechtsträgers, dessen Gläubiger sie sind, nach § 19 Abs. 3 UmwG als bekanntgemacht gilt, ihren Anspruch nach Grund und Höhe schriftlich anmelden, Sicherheit zu leisten, soweit sie nicht Befriedigung verlangen können. Dieses Recht steht den Gläubigern jedoch nur zu, wenn sie glaubhaft machen, dass durch die Verschmelzung die Erfüllung ihrer Forderung gefährdet wird."
    },
    {
      "date": "2025-12-09",
      "id": "139478",
      "original_text": "Löschungsankündigung\nSchleswig-Holstein Amtsgericht Flensburg HRA 4661\nPhilipp & Reuben Rotermund GmbH & Co. KG – Flensburg",
      "type": "Löschungsankündigung",
      "state": "Schleswig-Holstein",
      "amtsgericht": "Amtsgericht Flensburg",
      "registernummer": "HRA 4661",
      "registerart": "HRA",
      "company_name": "Philipp & Reuben Rotermund GmbH & Co. KG",
      "company_seat": "Flensburg",
      "details": "09.12.2025 (Bekanntmachungsdatum)\n\nSchleswig-Holstein Amtsgericht Flensburg HRA 4661\nLöschungsankündigung\n\nPhilipp & Reuben Rotermund GmbH & Co. KG\nKommanditgesellschaft\nFlensburg\n\nEs ist die Löschung der nachstehenden Gesellschaft wegen Vermögenslosigkeit gemäß § 394 FamFG von Amts wegen beabsichtigt.\nWiderspruchsfrist: 2 Monate"
    },
    {
      "date": "2025-12-09",
      "id": "139479",
      "original_text": "Löschungsankündigung\nSchleswig-Holstein Amtsgericht Kiel HRB 7959\nRR Electronic GmbH – Kiel",
      "type": "Löschungsankündigung",
      "state": "Schleswig-Holstein",
      "amtsgericht": "Amtsgericht Kiel",
      "registernummer": "HRB 7959",
      "registerart": "HRB",
      "company_name": "RR Electronic GmbH",
      "company_seat": "Kiel",
      "details": "09.12.2025 (Bekanntmachungsdatum)\n\nSchleswig-Holstein Amtsgericht Kiel HRB 7959\nLöschungsankündigung\n\nRR Electronic GmbH\nGesellschaft mit beschränkter Haftung\nKiel\n\nEs ist die Löschung der nachstehenden Gesellschaft wegen Vermögenslosigkeit gemäß § 394 FamFG beabsichtigt. Widerspruchsfrist: 1 Monat."
    },
    {
      "date": "2025-12-09",
      "id": "139480",
      "original_text": "Löschungsankündigung\nBerlin Amtsgericht Berlin (Charlottenburg) HRB 174784\nPension Adam & Eve GmbH – Berlin",
      "type": "Löschungsankündigung",
      "state": "Berlin",
      "amtsgericht": "Amtsgericht Berlin (Charlottenburg)",
      "registernummer": "HRB 174784",
      "registerart": "HRB",
      "company_name": "Pension Adam & Eve GmbH",
      "company_seat": "Berlin",
      "details": "09.12.2025 (Bekanntmachungsdatum)\n\nBerlin Amtsgericht Berlin (Charlottenburg) HRB 174784\nLöschungsankündigung\n\nPension Adam & Eve GmbH\nGesellschaft mit beschränkter Haftung\nBerlin\n\nBei der nachstehenden Gesellschaft wird das Amtslöschungsverfahren gemäß § 394 FamFG eingeleitet. Widerspruchsfrist 6 Wochen"
    },
    {
      "date": "2025-12-09",
      "id": "139481",
      "original_text": "Registerbekanntmachung nach dem Umwandlungsgesetz\nBaden-Württemberg Amtsgericht Mannheim HRB 756576\nErnst Projektbau GmbH – Bühl",
      "type": "Registerbekanntmachung nach dem Umwandlungsgesetz",
      "state": "Baden-Württemberg",
      "amtsgericht": "Amtsgericht Mannheim",
      "registernummer": "HRB 756576",
      "registerart": "HRB",
      "company_name": "Ernst Projektbau GmbH",
      "company_seat": "Bühl",
      "details": "09.12.2025 (Bekanntmachungsdatum)\n\nBaden-Württemberg Amtsgericht Mannheim HRB 756576\nRegisterbekanntmachung nach dem Umwandlungsgesetz 09.12.2025 (Eintragungsdatum)\n\nErnst Projektbau GmbH\nGesellschaft mit beschränkter Haftung\nBühl\n\nAls nicht eingetragen wird bekanntgemacht:\nDen Gläubigern des an dem Formwechsel beteiligten Rechtsträgers ist, wenn sie binnen sechs Monaten nach dem Tag, an dem die Eintragung des Formwechsels in das Register des Sitzes desjenigen Rechtsträgers, dessen Gläubiger sie sind, nach § 19 Abs. 3 UmwG als bekanntgemacht gilt, ihren Anspruch nach Grund und Höhe schriftlich anmelden, Sicherheit zu leisten, soweit sie nicht Befriedigung verlangen können. Dieses Recht steht den Gläubigern jedoch nur zu, wenn sie glaubhaft machen, dass durch den Formwechsel die Erfüllung ihrer Forderung gefährdet wird."
    },
    {
      "date": "2025-12-09",
      "id": "139482",
      "original_text": "Löschungsankündigung\nBaden-Württemberg Amtsgericht Mannheim HRB 728037\nM + V Immo GmbH – Mannheim",
      "type": "Löschungsankündigung",
      "state": "Baden-Württemberg",
      "amtsgericht": "Amtsgericht Mannheim",
      "registernummer": "HRB 728037",
      "registerart": "HRB",
      "company_name": "M + V Immo GmbH",
      "company_seat": "Mannheim",
      "details": "09.12.2025 (Bekanntmachungsdatum)\n\nBaden-Württemberg Amtsgericht Mannheim HRB 728037\nLöschungsankündigung\n\nM + V Immo GmbH\nGesellschaft mit beschränkter Haftung\nMannheim\n\nDas Gericht beabsichtigt, die Gesellschaft wegen Vermögenslosigkeit im Handelsregister von Amts wegen nach § 394 FamFG zu löschen. Die Frist zur Geltendmachung eines Widerspruchs gegen die beabsichtigte Löschung ist auf einen Monat ab Veröffentlichung bestimmt."
    },
    {
      "date": "2025-12-09",
      "id": "139483",
      "original_text": "Registerbekanntmachung nach dem Umwandlungsgesetz\nBaden-Württemberg Amtsgericht Mannheim HRA 707295\nErnst Projektbau GmbH & Co. KG – Bühl",
      "type": "Registerbekanntmachung nach dem Umwandlungsgesetz",
      "state": "Baden-Württemberg",
      "amtsgericht": "Amtsgericht Mannheim",
      "registernummer": "HRA 707295",
      "registerart": "HRA",
      "company_name": "Ernst Projektbau GmbH & Co. KG",
      "company_seat": "Bühl",
      "details": "09.12.2025 (Bekanntmachungsdatum)\n\nBaden-Württemberg Amtsgericht Mannheim HRA 707295\nRegisterbekanntmachung nach dem Umwandlungsgesetz 09.12.2025 (Eintragungsdatum)\n\nErnst Projektbau GmbH & Co. KG\nKommanditgesellschaft\nBühl\n\nAls nicht eingetragen wird bekanntgemacht:\nDen Gläubigern des an dem Formwechsel beteiligten Rechtsträgers ist, wenn sie binnen sechs Monaten nach dem Tag, an dem die Eintragung des Formwechsels in das Register des Sitzes desjenigen Rechtsträgers, dessen Gläubiger sie sind, nach § 19 Abs. 3 UmwG als bekanntgemacht gilt, ihren Anspruch nach Grund und Höhe schriftlich anmelden, Sicherheit zu leisten, soweit sie nicht Befriedigung verlangen können. Dieses Recht steht den Gläubigern jedoch nur zu, wenn sie glaubhaft machen, dass durch den Formwechsel die Erfüllung ihrer Forderung gefährdet wird."
    },
    {
      "date": "2025-12-09",
      "id": "139484",
      "original_text": "Einreichung neuer Dokumente\nHamburg Amtsgericht Hamburg HRB 102614\nDURAG Holding AG – Hamburg",
      "type": "Einreichung neuer Dokumente",
      "state": "Hamburg",
      "amtsgericht": "Amtsgericht Hamburg",
      "registernummer": "HRB 102614",
      "registerart": "HRB",
      "company_name": "DURAG Holding AG",
      "company_seat": "Hamburg",
      "details": "09.12.2025 (Bekanntmachungsdatum)\n\nHamburg Amtsgericht Hamburg HRB 102614\nEinreichung neuer Dokumente\n\nDURAG Holding AG\nAktiengesellschaft\nHamburg\n\nAls nicht eingetragen wird bekannt gemacht: Liste des Aufsichtsrats wurde eingereicht."
    },
    {
      "date": "2025-12-09",
      "id": "139485",
      "original_text": "Registerbekanntmachung nach dem Umwandlungsgesetz\nSchleswig-Holstein Amtsgericht Flensburg HRB 17594\nNordisch Vital GmbH – Süderlügum",
      "type": "Registerbekanntmachung nach dem Umwandlungsgesetz",
      "state": "Schleswig-Holstein",
      "amtsgericht": "Amtsgericht Flensburg",
      "registernummer": "HRB 17594",
      "registerart": "HRB",
      "company_name": "Nordisch Vital GmbH",
      "company_seat": "Süderlügum",
      "details": "09.12.2025 (Bekanntmachungsdatum)\n\nSchleswig-Holstein Amtsgericht Flensburg HRB 17594\nRegisterbekanntmachung nach dem Umwandlungsgesetz 08.12.2025 (Eintragungsdatum)\n\nNordisch Vital GmbH\nGesellschaft mit beschränkter Haftung\nSüderlügum\n\nAls nicht eingetragen wird veröffentlicht: Den Gläubigern der an der Spaltung beteiligten Rechtsträger ist, wenn sie binnen sechs Monaten nach dem Tag, an dem die Eintragung der Spaltung in das Register des Sitzes desjenigen Rechtsträgers, dessen Gläubiger sie sind, als bekannt gemacht gilt, ihren Anspruch nach Grund und Höhe schriftlich anmelden, Sicherheit zu leisten, soweit sie nicht Befriedigung verlangen können. Dieses Recht steht den Gläubigern jedoch nur zu, wenn sie glaubhaft machen, dass durch die Spaltung die Erfüllung ihrer Forderung gefährdet wird. Das Recht, Sicherheitsleistung zu verlangen, steht Gläubigern nicht zu, die im Falle der Insolvenz ein Recht auf vorzugsweise Befriedigung aus einer Deckungsmasse haben, die nach gesetzlicher Vorschrift zu ihrem Schutz errichtet und staatlich überwacht ist."
    },
    {
      "date": "2025-12-09",
      "id": "139486",
      "original_text": "Einreichung neuer Dokumente\nHamburg Amtsgericht Hamburg HRB 51682\nTutech Innovation Gesellschaft mit beschränkter Haftung – Hamburg",
      "type": "Einreichung neuer Dokumente",
      "state": "Hamburg",
      "amtsgericht": "Amtsgericht Hamburg",
      "registernummer": "HRB 51682",
      "registerart": "HRB",
      "company_name": "Tutech Innovation Gesellschaft mit beschränkter Haftung",
      "company_seat": "Hamburg",
      "details": "09.12.2025 (Bekanntmachungsdatum)\n\nHamburg Amtsgericht Hamburg HRB 51682\nEinreichung neuer Dokumente\n\nTutech Innovation Gesellschaft mit beschränkter Haftung\nGesellschaft mit beschränkter Haftung\nHamburg\n\nAls nicht eingetragen wird bekannt gemacht: Liste des Aufsichtsrats wurde eingereicht."
    },
    {
      "date": "2025-12-09",
      "id": "139487",
      "original_text": "Registerbekanntmachung nach dem Umwandlungsgesetz\nBaden-Württemberg Amtsgericht Stuttgart HRB 4112\nDEKRA Claims Services GmbH – Stuttgart",
      "type": "Registerbekanntmachung nach dem Umwandlungsgesetz",
      "state": "Baden-Württemberg",
      "amtsgericht": "Amtsgericht Stuttgart",
      "registernummer": "HRB 4112",
      "registerart": "HRB",
      "company_name": "DEKRA Claims Services GmbH",
      "company_seat": "Stuttgart",
      "details": "09.12.2025 (Bekanntmachungsdatum)\n\nBaden-Württemberg Amtsgericht Stuttgart HRB 4112\nRegisterbekanntmachung nach dem Umwandlungsgesetz 09.12.2025 (Eintragungsdatum)\n\nDEKRA Claims Services GmbH\nGesellschaft mit beschränkter Haftung\nStuttgart\n\nAls nicht eingetragen wird bekanntgemacht:\nDen Gläubigern der an der Abspaltung beteiligten Rechtsträger ist, wenn sie binnen sechs Monaten nach dem Tag, an dem die Eintragung der Abspaltung in das Register des Sitzes desjenigen Rechtsträgers, dessen Gläubiger sie sind, nach § 19 Abs. 3 UmwG als bekanntgemacht gilt, ihren Anspruch nach Grund und Höhe schriftlich anmelden, Sicherheit zu leisten, soweit sie nicht Befriedigung verlangen können. Dieses Recht steht den Gläubigern jedoch nur zu, wenn sie glaubhaft machen, dass durch die Abspaltung die Erfüllung ihrer Forderung gefährdet wird."
    },
    {
      "date": "2025-12-09",
      "id": "139488",
      "original_text": "Registerbekanntmachung nach dem Umwandlungsgesetz\nBaden-Württemberg Amtsgericht Mannheim HRB 722251\nBertrandt Technologie GmbH – Mönsheim",
      "type": "Registerbekanntmachung nach dem Umwandlungsgesetz",
      "state": "Baden-Württemberg",
      "amtsgericht": "Amtsgericht Mannheim",
      "registernummer": "HRB 722251",
      "registerart": "HRB",
      "company_name": "Bertrandt Technologie GmbH",
      "company_seat": "Mönsheim",
      "details": "09.12.2025 (Bekanntmachungsdatum)\n\nBaden-Württemberg Amtsgericht Mannheim HRB 722251\nRegisterbekanntmachung nach dem Umwandlungsgesetz 09.12.2025 (Eintragungsdatum)\n\nBertrandt Technologie GmbH\nGesellschaft mit beschränkter Haftung\nMönsheim\n\nAls nicht eingetragen wird bekanntgemacht:\nDen Gläubigern der an der Verschmelzung beteiligten Rechtsträger ist, wenn sie binnen sechs Monaten nach dem Tag, an dem die Eintragung der Verschmelzung in das Register des Sitzes desjenigen Rechtsträgers, dessen Gläubiger sie sind, nach § 19 Abs. 3 UmwG als bekanntgemacht gilt, ihren Anspruch nach Grund und Höhe schriftlich anmelden, Sicherheit zu leisten, soweit sie nicht Befriedigung verlangen können. Dieses Recht steht den Gläubigern jedoch nur zu, wenn sie glaubhaft machen, dass durch die Verschmelzung die Erfüllung ihrer Forderung gefährdet wird."
    },
    {
      "date": "2025-12-09",
      "id": "139489",
      "original_text": "Registerbekanntmachung nach dem Umwandlungsgesetz\nBaden-Württemberg Amtsgericht Mannheim HRA 503693\nK - Versand Holding OHG – Pforzheim",
      "type": "Registerbekanntmachung nach dem Umwandlungsgesetz",
      "state": "Baden-Württemberg",
      "amtsgericht": "Amtsgericht Mannheim",
      "registernummer": "HRA 503693",
      "registerart": "HRA",
      "company_name": "K - Versand Holding OHG",
      "company_seat": "Pforzheim",
      "details": "09.12.2025 (Bekanntmachungsdatum)\n\nBaden-Württemberg Amtsgericht Mannheim HRA 503693\nRegisterbekanntmachung nach dem Umwandlungsgesetz 09.12.2025 (Eintragungsdatum)\n\nK - Versand Holding OHG\nOffene Handelsgesellschaft\nPforzheim\n\nAls nicht eingetragen wird bekanntgemacht:\nDen Gläubigern der an der Verschmelzung beteiligten Rechtsträger ist, wenn sie binnen sechs Monaten nach dem Tag, an dem die Eintragung der Verschmelzung in das Register des Sitzes desjenigen Rechtsträgers, dessen Gläubiger sie sind, nach § 19 Abs. 3 UmwG als bekanntgemacht gilt, ihren Anspruch nach Grund und Höhe schriftlich anmelden, Sicherheit zu leisten, soweit sie nicht Befriedigung verlangen können. Dieses Recht steht den Gläubigern jedoch nur zu, wenn sie glaubhaft machen, dass durch die Verschmelzung die Erfüllung ihrer Forderung gefährdet wird."
    },
    {
      "date": "2025-12-09",
      "id": "139490",
      "original_text": "Registerbekanntmachung nach dem Umwandlungsgesetz\nBaden-Württemberg Amtsgericht Mannheim HRB 751045\nK-Invest Pool 1 GmbH – Pforzheim",
      "type": "Registerbekanntmachung nach dem Umwandlungsgesetz",
      "state": "Baden-Württemberg",
      "amtsgericht": "Amtsgericht Mannheim",
      "registernummer": "HRB 751045",
      "registerart": "HRB",
      "company_name": "K-Invest Pool 1 GmbH",
      "company_seat": "Pforzheim",
      "details": "09.12.2025 (Bekanntmachungsdatum)\n\nBaden-Württemberg Amtsgericht Mannheim HRB 751045\nRegisterbekanntmachung nach dem Umwandlungsgesetz 09.12.2025 (Eintragungsdatum)\n\nK-Invest Pool 1 GmbH\nGesellschaft mit beschränkter Haftung\nPforzheim\n\nAls nicht eingetragen wird bekanntgemacht:\nDen Gläubigern der an der Verschmelzung beteiligten Rechtsträger ist, wenn sie binnen sechs Monaten nach dem Tag, an dem die Eintragung der Verschmelzung in das Register des Sitzes desjenigen Rechtsträgers, dessen Gläubiger sie sind, nach § 19 Abs. 3 UmwG als bekanntgemacht gilt, ihren Anspruch nach Grund und Höhe schriftlich anmelden, Sicherheit zu leisten, soweit sie nicht Befriedigung verlangen können. Dieses Recht steht den Gläubigern jedoch nur zu, wenn sie glaubhaft machen, dass durch die Verschmelzung die Erfüllung ihrer Forderung gefährdet wird."
    },
    {
      "date": "2025-12-09",
      "id": "139491",
      "original_text": "Registerbekanntmachung nach dem Umwandlungsgesetz\nNordrhein-Westfalen Amtsgericht Coesfeld HRB 8992\nTBP Gewerbebau Komplementär GmbH – Bocholt",
      "type": "Registerbekanntmachung nach dem Umwandlungsgesetz",
      "state": "Nordrhein-Westfalen",
      "amtsgericht": "Amtsgericht Coesfeld",
      "registernummer": "HRB 8992",
      "registerart": "HRB",
      "company_name": "TBP Gewerbebau Komplementär GmbH",
      "company_seat": "Bocholt",
      "details": "09.12.2025 (Bekanntmachungsdatum)\n\nNordrhein-Westfalen Amtsgericht Coesfeld HRB 8992\nRegisterbekanntmachung nach dem Umwandlungsgesetz 09.12.2025 (Eintragungsdatum)\n\nTBP Gewerbebau Komplementär GmbH\nGesellschaft mit beschränkter Haftung\nBocholt\n\nDen Gläubigern der an der Verschmelzung beteiligten Rechtsträger ist, wenn sie binnen sechs Monaten nach dem Tag, an dem die Eintragung der Verschmelzung in das Register des Sitzes derjenigen Rechtsträger deren Gläubiger sie sind, nach § 19 Absatz 3 UmwG als bekanntgemacht gilt, ihren Anspruch nach Grund und Höhe schriftlich anmelden, Sicherheit zu leisten, soweit sie nicht Befriedigung verlangen können. Dieses Recht steht den Gläubigern jedoch nur zu, wenn sie glaubhaft machen, dass durch die Verschmelzung die Erfüllung ihrer Forderung gefährdet wird."
    },
    {
      "date": "2025-12-09",
      "id": "139492",
      "original_text": "Einreichung neuer Dokumente\nBaden-Württemberg Amtsgericht Mannheim HRB 232313\nefeuCampus Bruchsal GmbH – Bruchsal",
      "type": "Einreichung neuer Dokumente",
      "state": "Baden-Württemberg",
      "amtsgericht": "Amtsgericht Mannheim",
      "registernummer": "HRB 232313",
      "registerart": "HRB",
      "company_name": "efeuCampus Bruchsal GmbH",
      "company_seat": "Bruchsal",
      "details": "09.12.2025 (Bekanntmachungsdatum)\n\nBaden-Württemberg Amtsgericht Mannheim HRB 232313\nEinreichung neuer Dokumente 09.12.2025 (Eintragungsdatum)\n\nefeuCampus Bruchsal GmbH\nGesellschaft mit beschränkter Haftung\nBruchsal\n\nDie Gesellschaft hat am 05.12.2025 die Liste über die Zusammensetzung des Aufsichtsrats zum Handelsregister eingereicht."
    },
    {
      "date": "2025-12-09",
      "id": "139493",
      "original_text": "Registerbekanntmachung nach dem Umwandlungsgesetz\nBerlin Amtsgericht Berlin (Charlottenburg) HRA 64222\nVG Immobilien Köpi 613 GmbH & Co. KG – Berlin",
      "type": "Registerbekanntmachung nach dem Umwandlungsgesetz",
      "state": "Berlin",
      "amtsgericht": "Amtsgericht Berlin (Charlottenburg)",
      "registernummer": "HRA 64222",
      "registerart": "HRA",
      "company_name": "VG Immobilien Köpi 613 GmbH & Co. KG",
      "company_seat": "Berlin",
      "details": "09.12.2025 (Bekanntmachungsdatum)\n\nBerlin Amtsgericht Berlin (Charlottenburg) HRA 64222\nRegisterbekanntmachung nach dem Umwandlungsgesetz 08.12.2025 (Eintragungsdatum)\n\nVG Immobilien Köpi 613 GmbH & Co. KG\nKommanditgesellschaft\nBerlin\n\nZu Eintragungsnummer 3 vom 08.12.2025 wird als nicht eingetragen veröffentlicht: Den Gläubigern ist, wenn sie binnen sechs Monaten nach dem Tag, an dem die Eintragung der Umwandlung als bekannt gemacht gilt, ihren Anspruch nach Grund und Höhe schriftlich anmelden, Sicherheit zu leisten, soweit sie nicht Befriedigung verlangen können. Dieses Recht steht den Gläubigern jedoch nur zu, wenn sie glaubhaft machen, dass durch die Umwandlung die Erfüllung ihrer Forderung gefährdet wird. Das Recht, Sicherheitsleistung zu verlangen, steht Gläubigern nicht zu, die im Falle der Insolvenz ein Recht auf vorzugsweise Befriedigung aus einer Deckungsmasse haben, die nach gesetzlicher Vorschrift zu ihrem Schutz errichtet und staatlich überwacht ist."
    },
    {
      "date": "2025-12-09",
      "id": "139494",
      "original_text": "Registerbekanntmachung nach dem Umwandlungsgesetz\nHamburg Amtsgericht Hamburg HRB 171509\nVattenfall Solar Juliusburg GmbH – Hamburg",
      "type": "Registerbekanntmachung nach dem Umwandlungsgesetz",
      "state": "Hamburg",
      "amtsgericht": "Amtsgericht Hamburg",
      "registernummer": "HRB 171509",
      "registerart": "HRB",
      "company_name": "Vattenfall Solar Juliusburg GmbH",
      "company_seat": "Hamburg",
      "details": "09.12.2025 (Bekanntmachungsdatum)\n\nHamburg Amtsgericht Hamburg HRB 171509\nRegisterbekanntmachung nach dem Umwandlungsgesetz 09.12.2025 (Eintragungsdatum)\n\nVattenfall Solar Juliusburg GmbH\nGesellschaft mit beschränkter Haftung\nHamburg\n\nAls nicht eingetragen wird bekannt gemacht:\nDen Gläubigern der an der formwechselnden Umwandlung beteiligten Gesellschaften ist, wenn sie binnen sechs Monaten nach dem Tag, an dem die Eintragung der formwechselnden Umwandlung in das Register des Sitzes desjenigen Rechtsträgers, dessen Gläubiger sie sind, nach § 19 Absatz 3 UmwG als bekannt gemacht gilt, ihren Anspruch nach Grund und Höhe schriftlich anmelden, Sicherheit zu leisten, soweit sie nicht Befriedigung verlangen können. Dieses Recht steht den Gläubigern jedoch nur zu, wenn sie glaubhaft machen, dass durch die formwechselnde Umwandlung die Erfüllung ihrer Forderung gefährdet wird."
    },
    {
      "date": "2025-12-09",
      "id": "139495",
      "original_text": "Registerbekanntmachung nach dem Umwandlungsgesetz\nBerlin Amtsgericht Berlin (Charlottenburg) HRB 222790\nKATEA Holding GmbH – Berlin",
      "type": "Registerbekanntmachung nach dem Umwandlungsgesetz",
      "state": "Berlin",
      "amtsgericht": "Amtsgericht Berlin (Charlottenburg)",
      "registernummer": "HRB 222790",
      "registerart": "HRB",
      "company_name": "KATEA Holding GmbH",
      "company_seat": "Berlin",
      "details": "09.12.2025 (Bekanntmachungsdatum)\n\nBerlin Amtsgericht Berlin (Charlottenburg) HRB 222790\nRegisterbekanntmachung nach dem Umwandlungsgesetz 08.12.2025 (Eintragungsdatum)\n\nKATEA Holding GmbH\nGesellschaft mit beschränkter Haftung\nBerlin\n\nZu Eintragungsnummer 5 vom 08.12.2025 wird als nicht eingetragen veröffentlicht: Den Gläubigern der an der Verschmelzung beteiligten Rechtsträger ist, wenn sie binnen sechs Monaten nach dem Tag, an dem die Eintragung der Verschmelzung in das Register des Sitzes desjenigen Rechtsträgers, dessen Gläubiger sie sind, als bekannt gemacht gilt, ihren Anspruch nach Grund und Höhe schriftlich anmelden, Sicherheit zu leisten, soweit sie nicht Befriedigung verlangen können. Dieses Recht steht den Gläubigern jedoch nur zu, wenn sie glaubhaft machen, dass durch die Verschmelzung die Erfüllung ihrer Forderung gefährdet wird. Das Recht, Sicherheitsleistung zu verlangen, steht Gläubigern nicht zu, die im Falle der Insolvenz ein Recht auf vorzugsweise Befriedigung aus einer Deckungsmasse haben, die nach gesetzlicher Vorschrift zu ihrem Schutz errichtet und staatlich überwacht ist."
    },
    {
      "date": "2025-12-09",
      "id": "139496",
      "original_text": "Löschungsankündigung\nBerlin Amtsgericht Berlin (Charlottenburg) HRB 238660\nFürch Bauconsulting GmbH – Berlin",
      "type": "Löschungsankündigung",
      "state": "Berlin",
      "amtsgericht": "Amtsgericht Berlin (Charlottenburg)",
      "registernummer": "HRB 238660",
      "registerart": "HRB",
      "company_name": "Fürch Bauconsulting GmbH",
      "company_seat": "Berlin",
      "details": "09.12.2025 (Bekanntmachungsdatum)\n\nBerlin Amtsgericht Berlin (Charlottenburg) HRB 238660\nLöschungsankündigung\n\nFürch Bauconsulting GmbH\nGesellschaft mit beschränkter Haftung\nBerlin\n\nBei der nachstehenden Gesellschaft wird das Amtslöschungsverfahren gemäß § 394 FamFG eingeleitet. Widerspruchsfrist 6 Wochen"
    },
    {
      "date": "2025-12-09",
      "id": "139497",
      "original_text": "Löschungsankündigung\nBerlin Amtsgericht Berlin (Charlottenburg) HRB 239679\nMarki Bau GmbH – Berlin",
      "type": "Löschungsankündigung",
      "state": "Berlin",
      "amtsgericht": "Amtsgericht Berlin (Charlottenburg)",
      "registernummer": "HRB 239679",
      "registerart": "HRB",
      "company_name": "Marki Bau GmbH",
      "company_seat": "Berlin",
      "details": "09.12.2025 (Bekanntmachungsdatum)\n\nBerlin Amtsgericht Berlin (Charlottenburg) HRB 239679\nLöschungsankündigung\n\nMarki Bau GmbH\nGesellschaft mit beschränkter Haftung\nBerlin\n\nBei der nachstehenden Gesellschaft wird das Amtslöschungsverfahren gemäß § 394 FamFG eingeleitet. Widerspruchsfrist 6 Wochen"
    },
    {
      "date": "2025-12-09",
      "id": "139498",
      "original_text": "Löschungsankündigung\nBerlin Amtsgericht Berlin (Charlottenburg) HRB 253418\nKnol Dienstleistungs UG (haftungsbeschränkt) – Berlin",
      "type": "Löschungsankündigung",
      "state": "Berlin",
      "amtsgericht": "Amtsgericht Berlin (Charlottenburg)",
      "registernummer": "HRB 253418",
      "registerart": "HRB",
      "company_name": "Knol Dienstleistungs UG (haftungsbeschränkt)",
      "company_seat": "Berlin",
      "details": "09.12.2025 (Bekanntmachungsdatum)\n\nBerlin Amtsgericht Berlin (Charlottenburg) HRB 253418\nLöschungsankündigung\n\nKnol Dienstleistungs UG (haftungsbeschränkt)\nGesellschaft mit beschränkter Haftung\nBerlin\n\nBei der nachstehenden Gesellschaft wird das Amtslöschungsverfahren gemäß § 394 FamFG eingeleitet. Widerspruchsfrist\n6 Wochen."
    },
    {
      "date": "2025-12-09",
      "id": "139499",
      "original_text": "Einreichung neuer Dokumente\nSachsen-Anhalt Amtsgericht Stendal HRB 31785\nTESVOLT AG – Lutherstadt Wittenberg",
      "type": "Einreichung neuer Dokumente",
      "state": "Sachsen-Anhalt",
      "amtsgericht": "Amtsgericht Stendal",
      "registernummer": "HRB 31785",
      "registerart": "HRB",
      "company_name": "TESVOLT AG",
      "company_seat": "Lutherstadt Wittenberg",
      "details": "09.12.2025 (Bekanntmachungsdatum)\n\nSachsen-Anhalt Amtsgericht Stendal HRB 31785\nEinreichung neuer Dokumente\n\nTESVOLT AG\nAktiengesellschaft\nLutherstadt Wittenberg\n\nEine Liste der Mitglieder des Aufsichtsrates wurde zum Handelsregister eingereicht.\nGem. § 221 Abs. 2 S.2 AktG hat der Vorstand und der Vorsitzende des Aufsichtsrates den Beschluss der Hauptversammlung vom 24.08.2023 über die Ausgabe der Wandelschuldverschreibung, sowie die Erklärung vom 13.11.2025 über deren Ausgabe beim Handelsregister hinterlegt."
    },
    {
      "date": "2025-12-09",
      "id": "139500",
      "original_text": "Löschungsankündigung\nBaden-Württemberg Amtsgericht Mannheim HRB 700246\nHERITUS 20. Objektgesellschaft mbH – Mannheim",
      "type": "Löschungsankündigung",
      "state": "Baden-Württemberg",
      "amtsgericht": "Amtsgericht Mannheim",
      "registernummer": "HRB 700246",
      "registerart": "HRB",
      "company_name": "HERITUS 20. Objektgesellschaft mbH",
      "company_seat": "Mannheim",
      "details": "09.12.2025 (Bekanntmachungsdatum)\n\nBaden-Württemberg Amtsgericht Mannheim HRB 700246\nLöschungsankündigung\n\nHERITUS 20. Objektgesellschaft mbH\nGesellschaft mit beschränkter Haftung\nMannheim\n\nDas Gericht beabsichtigt, die Gesellschaft wegen Vermögenslosigkeit im Handelsregister von Amts wegen nach § 394 FamFG zu löschen. Die Frist zur Geltendmachung eines Widerspruchs gegen die beabsichtigte Löschung ist auf einen Monat ab Veröffentlichung bestimmt."
    },
    {
      "date": "2025-12-09",
      "id": "139501",
      "original_text": "Einreichung neuer Dokumente\nBerlin Amtsgericht Berlin (Charlottenburg) HRB 78654\nAMD TÜV Arbeitsmedizinische Dienste GmbH TÜV Rheinland Group – Berlin",
      "type": "Einreichung neuer Dokumente",
      "state": "Berlin",
      "amtsgericht": "Amtsgericht Berlin (Charlottenburg)",
      "registernummer": "HRB 78654",
      "registerart": "HRB",
      "company_name": "AMD TÜV Arbeitsmedizinische Dienste GmbH TÜV Rheinland Group",
      "company_seat": "Berlin",
      "details": "09.12.2025 (Bekanntmachungsdatum)\n\nBerlin Amtsgericht Berlin (Charlottenburg) HRB 78654\nEinreichung neuer Dokumente\n\nAMD TÜV Arbeitsmedizinische Dienste GmbH TÜV Rheinland Group\nGesellschaft mit beschränkter Haftung\nBerlin\n\nAls nicht eingetragen wird veröffentlicht: Es wurde eine neue Liste der Aufsichtsratsmitglieder eingereicht (§52 GmbHG)."
    },
    {
      "date": "2025-12-09",
      "id": "139502",
      "original_text": "Registerbekanntmachung nach dem Umwandlungsgesetz\nBerlin Amtsgericht Berlin (Charlottenburg) HRB 202381\nGrover Finance II GmbH – Berlin",
      "type": "Registerbekanntmachung nach dem Umwandlungsgesetz",
      "state": "Berlin",
      "amtsgericht": "Amtsgericht Berlin (Charlottenburg)",
      "registernummer": "HRB 202381",
      "registerart": "HRB",
      "company_name": "Grover Finance II GmbH",
      "company_seat": "Berlin",
      "details": "09.12.2025 (Bekanntmachungsdatum)\n\nBerlin Amtsgericht Berlin (Charlottenburg) HRB 202381\nRegisterbekanntmachung nach dem Umwandlungsgesetz 08.12.2025 (Eintragungsdatum)\n\nGrover Finance II GmbH\nGesellschaft mit beschränkter Haftung\nBerlin\n\nZu Eintragungsnummer 11 vom 08.12.2025 wird als nicht eingetragen veröffentlicht: Den Gläubigern der an der Verschmelzung beteiligten Rechtsträger ist, wenn sie binnen sechs Monaten nach dem Tag, an dem die Eintragung der Verschmelzung in das Register des Sitzes desjenigen Rechtsträgers, dessen Gläubiger sie sind, als bekannt gemacht gilt, ihren Anspruch nach Grund und Höhe schriftlich anmelden, Sicherheit zu leisten, soweit sie nicht Befriedigung verlangen können. Dieses Recht steht den Gläubigern jedoch nur zu, wenn sie glaubhaft machen, dass durch die Verschmelzung die Erfüllung ihrer Forderung gefährdet wird. Das Recht, Sicherheitsleistung zu verlangen, steht Gläubigern nicht zu, die im Falle der Insolvenz ein Recht auf vorzugsweise Befriedigung aus einer Deckungsmasse haben, die nach gesetzlicher Vorschrift zu ihrem Schutz errichtet und staatlich überwacht ist."
    },
    {
      "date": "2025-12-09",
      "id": "139503",
      "original_text": "Löschungsankündigung\nBaden-Württemberg Amtsgericht Stuttgart HRA 220968\nAG Maschinenvermietung GmbH & Co. KG – Nürtingen",
      "type": "Löschungsankündigung",
      "state": "Baden-Württemberg",
      "amtsgericht": "Amtsgericht Stuttgart",
      "registernummer": "HRA 220968",
      "registerart": "HRA",
      "company_name": "AG Maschinenvermietung GmbH & Co. KG",
      "company_seat": "Nürtingen",
      "details": "09.12.2025 (Bekanntmachungsdatum)\n\nBaden-Württemberg Amtsgericht Stuttgart HRA 220968\nLöschungsankündigung\n\nAG Maschinenvermietung GmbH & Co. KG\nKommanditgesellschaft\nNürtingen\n\nDas Gericht beabsichtigt, die Gesellschaft wegen Vermögenslosigkeit im Handelsregister von Amts wegen nach § 394 FamFG zu löschen. Die Frist zur Geltendmachung eines Widerspruchs gegen die beabsichtigte Löschung ist auf einen Monat ab Veröffentlichung bestimmt."
    },
    {
      "date": "2025-12-09",
      "id": "139504",
      "original_text": "Registerbekanntmachung nach dem Umwandlungsgesetz\nBerlin Amtsgericht Berlin (Charlottenburg) HRB 254909\nGrover Group Trust UG (haftungsbeschränkt) – Berlin",
      "type": "Registerbekanntmachung nach dem Umwandlungsgesetz",
      "state": "Berlin",
      "amtsgericht": "Amtsgericht Berlin (Charlottenburg)",
      "registernummer": "HRB 254909",
      "registerart": "HRB",
      "company_name": "Grover Group Trust UG (haftungsbeschränkt)",
      "company_seat": "Berlin",
      "details": "09.12.2025 (Bekanntmachungsdatum)\n\nBerlin Amtsgericht Berlin (Charlottenburg) HRB 254909\nRegisterbekanntmachung nach dem Umwandlungsgesetz 08.12.2025 (Eintragungsdatum)\n\nGrover Group Trust UG (haftungsbeschränkt)\nGesellschaft mit beschränkter Haftung\nBerlin\n\nZu Eintragungsnummer 6 vom 08.12.2025 wird als nicht eingetragen veröffentlicht: Den Gläubigern der an der Verschmelzung beteiligten Rechtsträger ist, wenn sie binnen sechs Monaten nach dem Tag, an dem die Eintragung der Verschmelzung in das Register des Sitzes desjenigen Rechtsträgers, dessen Gläubiger sie sind, als bekannt gemacht gilt, ihren Anspruch nach Grund und Höhe schriftlich anmelden, Sicherheit zu leisten, soweit sie nicht Befriedigung verlangen können. Dieses Recht steht den Gläubigern jedoch nur zu, wenn sie glaubhaft machen, dass durch die Verschmelzung die Erfüllung ihrer Forderung gefährdet wird. Das Recht, Sicherheitsleistung zu verlangen, steht Gläubigern nicht zu, die im Falle der Insolvenz ein Recht auf vorzugsweise Befriedigung aus einer Deckungsmasse haben, die nach gesetzlicher Vorschrift zu ihrem Schutz errichtet und staatlich überwacht ist."
    },
    {
      "date": "2025-12-09",
      "id": "139505",
      "original_text": "Einreichung neuer Dokumente\nBrandenburg Amtsgericht Frankfurt/Oder HRB 261\nWohnungswirtschaft Frankfurt (Oder) Gesellschaft mit beschränkter Haftung – Frankfurt (Oder)",
      "type": "Einreichung neuer Dokumente",
      "state": "Brandenburg",
      "amtsgericht": "Amtsgericht Frankfurt/Oder",
      "registernummer": "HRB 261",
      "registerart": "HRB",
      "company_name": "Wohnungswirtschaft Frankfurt (Oder) Gesellschaft mit beschränkter Haftung",
      "company_seat": "Frankfurt (Oder)",
      "details": "09.12.2025 (Bekanntmachungsdatum)\n\nBrandenburg Amtsgericht Frankfurt/Oder HRB 261\nEinreichung neuer Dokumente\n\nWohnungswirtschaft Frankfurt (Oder) Gesellschaft mit beschränkter Haftung\nGesellschaft mit beschränkter Haftung\nFrankfurt (Oder)\n\nAls nicht eingetragen wird veröffentlicht: Die Gesellschaft hat Änderungen im Aufsichtsrat angezeigt."
    },
    {
      "date": "2025-12-09",
      "id": "139506",
      "original_text": "Registerbekanntmachung nach dem Umwandlungsgesetz\nBerlin Amtsgericht Berlin (Charlottenburg) HRB 237567\nGrover Europe SE – Berlin",
      "type": "Registerbekanntmachung nach dem Umwandlungsgesetz",
      "state": "Berlin",
      "amtsgericht": "Amtsgericht Berlin (Charlottenburg)",
      "registernummer": "HRB 237567",
      "registerart": "HRB",
      "company_name": "Grover Europe SE",
      "company_seat": "Berlin",
      "details": "09.12.2025 (Bekanntmachungsdatum)\n\nBerlin Amtsgericht Berlin (Charlottenburg) HRB 237567\nRegisterbekanntmachung nach dem Umwandlungsgesetz 08.12.2025 (Eintragungsdatum)\n\nGrover Europe SE\nEuropäische Aktiengesellschaft (SE)\nBerlin\n\nZu Eintragungsnummer 7 vom 08.12.2025 wird als nicht eingetragen veröffentlicht: Den Gläubigern der an der Verschmelzung beteiligten Rechtsträger ist, wenn sie binnen sechs Monaten nach dem Tag, an dem die Eintragung der Verschmelzung in das Register des Sitzes desjenigen Rechtsträgers, dessen Gläubiger sie sind, als bekannt gemacht gilt, ihren Anspruch nach Grund und Höhe schriftlich anmelden, Sicherheit zu leisten, soweit sie nicht Befriedigung verlangen können. Dieses Recht steht den Gläubigern jedoch nur zu, wenn sie glaubhaft machen, dass durch die Verschmelzung die Erfüllung ihrer Forderung gefährdet wird. Das Recht, Sicherheitsleistung zu verlangen, steht Gläubigern nicht zu, die im Falle der Insolvenz ein Recht auf vorzugsweise Befriedigung aus einer Deckungsmasse haben, die nach gesetzlicher Vorschrift zu ihrem Schutz errichtet und staatlich überwacht ist."
    },
    {
      "date": "2025-12-09",
      "id": "139507",
      "original_text": "Einreichung neuer Dokumente\nHamburg Amtsgericht Hamburg HRB 133192\nHolsten-Brauerei Aktiengesellschaft – Hamburg",
      "type": "Einreichung neuer Dokumente",
      "state": "Hamburg",
      "amtsgericht": "Amtsgericht Hamburg",
      "registernummer": "HRB 133192",
      "registerart": "HRB",
      "company_name": "Holsten-Brauerei Aktiengesellschaft",
      "company_seat": "Hamburg",
      "details": "09.12.2025 (Bekanntmachungsdatum)\n\nHamburg Amtsgericht Hamburg HRB 133192\nEinreichung neuer Dokumente\n\nHolsten-Brauerei Aktiengesellschaft\nAktiengesellschaft\nHamburg\n\nAls nicht eingetragen wird bekannt gemacht: Liste des Aufsichtsrats wurde eingereicht."
    },
    {
      "date": "2025-12-09",
      "id": "139508",
      "original_text": "Registerbekanntmachung nach dem Umwandlungsgesetz\nSchleswig-Holstein Amtsgericht Flensburg HRA 4669\nWindpark Schafflundfeld GmbH & Co. Erweiterungs KG – Schafflund",
      "type": "Registerbekanntmachung nach dem Umwandlungsgesetz",
      "state": "Schleswig-Holstein",
      "amtsgericht": "Amtsgericht Flensburg",
      "registernummer": "HRA 4669",
      "registerart": "HRA",
      "company_name": "Windpark Schafflundfeld GmbH & Co. Erweiterungs KG",
      "company_seat": "Schafflund",
      "details": "09.12.2025 (Bekanntmachungsdatum)\n\nSchleswig-Holstein Amtsgericht Flensburg HRA 4669\nRegisterbekanntmachung nach dem Umwandlungsgesetz 09.12.2025 (Eintragungsdatum)\n\nWindpark Schafflundfeld GmbH & Co. Erweiterungs KG\nKommanditgesellschaft\nSchafflund\n\nZu Eintragungsnummer 14 vom 09.12.2025 wird als nicht eingetragen veröffentlicht: Den Gläubigern der an der Verschmelzung beteiligten Rechtsträger ist, wenn sie binnen sechs Monaten nach dem Tag, an dem die Eintragung der Verschmelzung in das Register des Sitzes desjenigen Rechtsträgers, dessen Gläubiger sie sind, als bekannt gemacht gilt, ihren Anspruch nach Grund und Höhe in Textform anmelden, Sicherheit zu leisten, soweit sie nicht Befriedigung verlangen können. Dieses Recht steht den Gläubigern jedoch nur zu, wenn sie glaubhaft machen, dass durch die Verschmelzung die Erfüllung ihrer Forderung gefährdet wird."
    },
    {
      "date": "2025-12-09",
      "id": "139509",
      "original_text": "Registerbekanntmachung nach dem Umwandlungsgesetz\nSchleswig-Holstein Amtsgericht Flensburg HRA 3970\nWindpark Schafflundfeld GmbH & Co. KG – Schafflund",
      "type": "Registerbekanntmachung nach dem Umwandlungsgesetz",
      "state": "Schleswig-Holstein",
      "amtsgericht": "Amtsgericht Flensburg",
      "registernummer": "HRA 3970",
      "registerart": "HRA",
      "company_name": "Windpark Schafflundfeld GmbH & Co. KG",
      "company_seat": "Schafflund",
      "details": "09.12.2025 (Bekanntmachungsdatum)\n\nSchleswig-Holstein Amtsgericht Flensburg HRA 3970\nRegisterbekanntmachung nach dem Umwandlungsgesetz 09.12.2025 (Eintragungsdatum)\n\nWindpark Schafflundfeld GmbH & Co. KG\nKommanditgesellschaft\nSchafflund\n\nZu Eintragungsnummer 17 vom 09.12.2025 wird als nicht eingetragen veröffentlicht: Den Gläubigern der an der Verschmelzung beteiligten Rechtsträger ist, wenn sie binnen sechs Monaten nach dem Tag, an dem die Eintragung der Verschmelzung in das Register des Sitzes desjenigen Rechtsträgers, dessen Gläubiger sie sind, als bekannt gemacht gilt, ihren Anspruch nach Grund und Höhe in Textform anmelden, Sicherheit zu leisten, soweit sie nicht Befriedigung verlangen können. Dieses Recht steht den Gläubigern jedoch nur zu, wenn sie glaubhaft machen, dass durch die Verschmelzung die Erfüllung ihrer Forderung gefährdet wird."
    },
    {
      "date": "2025-12-09",
      "id": "139510",
      "original_text": "Registerbekanntmachung nach dem Umwandlungsgesetz\nBerlin Amtsgericht Berlin (Charlottenburg) HRB 202381\nGrover Finance II GmbH – Berlin",
      "type": "Registerbekanntmachung nach dem Umwandlungsgesetz",
      "state": "Berlin",
      "amtsgericht": "Amtsgericht Berlin (Charlottenburg)",
      "registernummer": "HRB 202381",
      "registerart": "HRB",
      "company_name": "Grover Finance II GmbH",
      "company_seat": "Berlin",
      "details": "09.12.2025 (Bekanntmachungsdatum)\n\nBerlin Amtsgericht Berlin (Charlottenburg) HRB 202381\nRegisterbekanntmachung nach dem Umwandlungsgesetz 08.12.2025 (Eintragungsdatum)\n\nGrover Finance II GmbH\nGesellschaft mit beschränkter Haftung\nBerlin\n\nZu Eintragungsnummer 10 vom 08.12.2025 wird als nicht eingetragen veröffentlicht: Den Gläubigern der an der Verschmelzung beteiligten Rechtsträger ist, wenn sie binnen sechs Monaten nach dem Tag, an dem die Eintragung der Verschmelzung in das Register des Sitzes desjenigen Rechtsträgers, dessen Gläubiger sie sind, als bekannt gemacht gilt, ihren Anspruch nach Grund und Höhe schriftlich anmelden, Sicherheit zu leisten, soweit sie nicht Befriedigung verlangen können. Dieses Recht steht den Gläubigern jedoch nur zu, wenn sie glaubhaft machen, dass durch die Verschmelzung die Erfüllung ihrer Forderung gefährdet wird. Das Recht, Sicherheitsleistung zu verlangen, steht Gläubigern nicht zu, die im Falle der Insolvenz ein Recht auf vorzugsweise Befriedigung aus einer Deckungsmasse haben, die nach gesetzlicher Vorschrift zu ihrem Schutz errichtet und staatlich überwacht ist."
    },
    {
      "date": "2025-12-09",
      "id": "139511",
      "original_text": "Einreichung neuer Dokumente\nBerlin Amtsgericht Berlin (Charlottenburg) HRB 111928\nE.G.E. European Green Exhibitions GmbH – Berlin",
      "type": "Einreichung neuer Dokumente",
      "state": "Berlin",
      "amtsgericht": "Amtsgericht Berlin (Charlottenburg)",
      "registernummer": "HRB 111928",
      "registerart": "HRB",
      "company_name": "E.G.E. European Green Exhibitions GmbH",
      "company_seat": "Berlin",
      "details": "09.12.2025 (Bekanntmachungsdatum)\n\nBerlin Amtsgericht Berlin (Charlottenburg) HRB 111928\nEinreichung neuer Dokumente\n\nE.G.E. European Green Exhibitions GmbH\nGesellschaft mit beschränkter Haftung\nBerlin\n\nAls nicht eingetragen wird veröffentlicht:\n\nEs wurde eine neue Liste der Aufsichtsratsmitglieder eingereicht (§52 GmbHG)."
    },
    {
      "date": "2025-12-09",
      "id": "139512",
      "original_text": "Registerbekanntmachung nach dem Umwandlungsgesetz\nBerlin Amtsgericht Berlin (Charlottenburg) HRB 237635\nGrover Holding SE – Berlin",
      "type": "Registerbekanntmachung nach dem Umwandlungsgesetz",
      "state": "Berlin",
      "amtsgericht": "Amtsgericht Berlin (Charlottenburg)",
      "registernummer": "HRB 237635",
      "registerart": "HRB",
      "company_name": "Grover Holding SE",
      "company_seat": "Berlin",
      "details": "09.12.2025 (Bekanntmachungsdatum)\n\nBerlin Amtsgericht Berlin (Charlottenburg) HRB 237635\nRegisterbekanntmachung nach dem Umwandlungsgesetz 08.12.2025 (Eintragungsdatum)\n\nGrover Holding SE\nEuropäische Aktiengesellschaft (SE)\nBerlin\n\nZu Eintragungsnummer 7 vom 08.12.2025 wird als nicht eingetragen veröffentlicht: Den Gläubigern der an der Verschmelzung beteiligten Rechtsträger ist, wenn sie binnen sechs Monaten nach dem Tag, an dem die Eintragung der Verschmelzung in das Register des Sitzes desjenigen Rechtsträgers, dessen Gläubiger sie sind, als bekannt gemacht gilt, ihren Anspruch nach Grund und Höhe schriftlich anmelden, Sicherheit zu leisten, soweit sie nicht Befriedigung verlangen können. Dieses Recht steht den Gläubigern jedoch nur zu, wenn sie glaubhaft machen, dass durch die Verschmelzung die Erfüllung ihrer Forderung gefährdet wird. Das Recht, Sicherheitsleistung zu verlangen, steht Gläubigern nicht zu, die im Falle der Insolvenz ein Recht auf vorzugsweise Befriedigung aus einer Deckungsmasse haben, die nach gesetzlicher Vorschrift zu ihrem Schutz errichtet und staatlich überwacht ist."
    },
    {
      "date": "2025-12-09",
      "id": "139513",
      "original_text": "Löschungsankündigung\nBerlin Amtsgericht Berlin (Charlottenburg) HRB 215015\nPPE Germany Services GmbH – Berlin",
      "type": "Löschungsankündigung",
      "state": "Berlin",
      "amtsgericht": "Amtsgericht Berlin (Charlottenburg)",
      "registernummer": "HRB 215015",
      "registerart": "HRB",
      "company_name": "PPE Germany Services GmbH",
      "company_seat": "Berlin",
      "details": "09.12.2025 (Bekanntmachungsdatum)\n\nBerlin Amtsgericht Berlin (Charlottenburg) HRB 215015\nLöschungsankündigung\n\nPPE Germany Services GmbH\nGesellschaft mit beschränkter Haftung\nBerlin\n\nBei der nachstehenden Gesellschaft wird das Amtslöschungsverfahren gemäß § 394 FamFG eingeleitet. Widerspruchsfrist 6 Wochen"
    },
    {
      "date": "2025-12-09",
      "id": "139514",
      "original_text": "Löschungsankündigung\nBaden-Württemberg Amtsgericht Mannheim HRB 723387\nOtto-Immoconcept GmbH – Altlußheim",
      "type": "Löschungsankündigung",
      "state": "Baden-Württemberg",
      "amtsgericht": "Amtsgericht Mannheim",
      "registernummer": "HRB 723387",
      "registerart": "HRB",
      "company_name": "Otto-Immoconcept GmbH",
      "company_seat": "Altlußheim",
      "details": "09.12.2025 (Bekanntmachungsdatum)\n\nBaden-Württemberg Amtsgericht Mannheim HRB 723387\nLöschungsankündigung\n\nOtto-Immoconcept GmbH\nGesellschaft mit beschränkter Haftung\nAltlußheim\n\nDas Gericht beabsichtigt, die Gesellschaft wegen Vermögenslosigkeit im Handelsregister von Amts wegen nach § 394 FamFG zu löschen. Die Frist zur Geltendmachung eines Widerspruchs gegen die beabsichtigte Löschung ist auf einen Monat ab Veröffentlichung bestimmt."
    },
    {
      "date": "2025-12-09",
      "id": "139515",
      "original_text": "Einreichung neuer Dokumente\nBaden-Württemberg Amtsgericht Stuttgart HRB 250329\nGEZE GmbH – Leonberg",
      "type": "Einreichung neuer Dokumente",
      "state": "Baden-Württemberg",
      "amtsgericht": "Amtsgericht Stuttgart",
      "registernummer": "HRB 250329",
      "registerart": "HRB",
      "company_name": "GEZE GmbH",
      "company_seat": "Leonberg",
      "details": "09.12.2025 (Bekanntmachungsdatum)\n\nBaden-Württemberg Amtsgericht Stuttgart HRB 250329\nEinreichung neuer Dokumente\n\nGEZE GmbH\nGesellschaft mit beschränkter Haftung\nLeonberg\n\nDie Gesellschaft hat am 09.12.2025 die Liste über die Zusammensetzung des Aufsichtsrats zum Handelsregister eingereicht."
    },
    {
      "date": "2025-12-09",
      "id": "139516",
      "original_text": "Registerbekanntmachung nach dem Umwandlungsgesetz\nBerlin Amtsgericht Berlin (Charlottenburg) HRB 202381\nGrover Finance II GmbH – Berlin",
      "type": "Registerbekanntmachung nach dem Umwandlungsgesetz",
      "state": "Berlin",
      "amtsgericht": "Amtsgericht Berlin (Charlottenburg)",
      "registernummer": "HRB 202381",
      "registerart": "HRB",
      "company_name": "Grover Finance II GmbH",
      "company_seat": "Berlin",
      "details": "09.12.2025 (Bekanntmachungsdatum)\n\nBerlin Amtsgericht Berlin (Charlottenburg) HRB 202381\nRegisterbekanntmachung nach dem Umwandlungsgesetz 08.12.2025 (Eintragungsdatum)\n\nGrover Finance II GmbH\nGesellschaft mit beschränkter Haftung\nBerlin\n\nZu Eintragungsnummer 9 vom 08.12.2025 wird als nicht eingetragen veröffentlicht: Den Gläubigern der an der Verschmelzung beteiligten Rechtsträger ist, wenn sie binnen sechs Monaten nach dem Tag, an dem die Eintragung der Verschmelzung in das Register des Sitzes desjenigen Rechtsträgers, dessen Gläubiger sie sind, als bekannt gemacht gilt, ihren Anspruch nach Grund und Höhe schriftlich anmelden, Sicherheit zu leisten, soweit sie nicht Befriedigung verlangen können. Dieses Recht steht den Gläubigern jedoch nur zu, wenn sie glaubhaft machen, dass durch die Verschmelzung die Erfüllung ihrer Forderung gefährdet wird. Das Recht, Sicherheitsleistung zu verlangen, steht Gläubigern nicht zu, die im Falle der Insolvenz ein Recht auf vorzugsweise Befriedigung aus einer Deckungsmasse haben, die nach gesetzlicher Vorschrift zu ihrem Schutz errichtet und staatlich überwacht ist."
    },
    {
      "date": "2025-12-09",
      "id": "139517",
      "original_text": "Löschungsankündigung\nBerlin Amtsgericht Berlin (Charlottenburg) HRB 249016\nCARDUX UG (haftungsbeschränkt) – Berlin",
      "type": "Löschungsankündigung",
      "state": "Berlin",
      "amtsgericht": "Amtsgericht Berlin (Charlottenburg)",
      "registernummer": "HRB 249016",
      "registerart": "HRB",
      "company_name": "CARDUX UG (haftungsbeschränkt)",
      "company_seat": "Berlin",
      "details": "09.12.2025 (Bekanntmachungsdatum)\n\nBerlin Amtsgericht Berlin (Charlottenburg) HRB 249016\nLöschungsankündigung\n\nCARDUX UG (haftungsbeschränkt)\nGesellschaft mit beschränkter Haftung\nBerlin\n\nBei der nachstehenden Gesellschaft wird das Amtslöschungsverfahren gemäß § 394 FamFG eingeleitet. Widerspruchsfrist 6 Wochen"
    },
    {
      "date": "2025-12-09",
      "id": "139518",
      "original_text": "Registerbekanntmachung nach dem Umwandlungsgesetz\nBerlin Amtsgericht Berlin (Charlottenburg) HRB 202381\nGrover Finance II GmbH – Berlin",
      "type": "Registerbekanntmachung nach dem Umwandlungsgesetz",
      "state": "Berlin",
      "amtsgericht": "Amtsgericht Berlin (Charlottenburg)",
      "registernummer": "HRB 202381",
      "registerart": "HRB",
      "company_name": "Grover Finance II GmbH",
      "company_seat": "Berlin",
      "details": "09.12.2025 (Bekanntmachungsdatum)\n\nBerlin Amtsgericht Berlin (Charlottenburg) HRB 202381\nRegisterbekanntmachung nach dem Umwandlungsgesetz 08.12.2025 (Eintragungsdatum)\n\nGrover Finance II GmbH\nGesellschaft mit beschränkter Haftung\nBerlin\n\nZu Eintragungsnummer 9 vom 08.12.2025 wird als nicht eingetragen veröffentlicht: Den Gläubigern der an der Verschmelzung beteiligten Rechtsträger ist, wenn sie binnen sechs Monaten nach dem Tag, an dem die Eintragung der Verschmelzung in das Register des Sitzes desjenigen Rechtsträgers, dessen Gläubiger sie sind, als bekannt gemacht gilt, ihren Anspruch nach Grund und Höhe schriftlich anmelden, Sicherheit zu leisten, soweit sie nicht Befriedigung verlangen können. Dieses Recht steht den Gläubigern jedoch nur zu, wenn sie glaubhaft machen, dass durch die Verschmelzung die Erfüllung ihrer Forderung gefährdet wird. Das Recht, Sicherheitsleistung zu verlangen, steht Gläubigern nicht zu, die im Falle der Insolvenz ein Recht auf vorzugsweise Befriedigung aus einer Deckungsmasse haben, die nach gesetzlicher Vorschrift zu ihrem Schutz errichtet und staatlich überwacht ist."
    },
    {
      "date": "2025-12-09",
      "id": "139519",
      "original_text": "Registerbekanntmachung nach dem Umwandlungsgesetz\nBaden-Württemberg Amtsgericht Stuttgart HRB 721511\nARCHONIC GmbH – Bietigheim-Bissingen",
      "type": "Registerbekanntmachung nach dem Umwandlungsgesetz",
      "state": "Baden-Württemberg",
      "amtsgericht": "Amtsgericht Stuttgart",
      "registernummer": "HRB 721511",
      "registerart": "HRB",
      "company_name": "ARCHONIC GmbH",
      "company_seat": "Bietigheim-Bissingen",
      "details": "09.12.2025 (Bekanntmachungsdatum)\n\nBaden-Württemberg Amtsgericht Stuttgart HRB 721511\nRegisterbekanntmachung nach dem Umwandlungsgesetz 09.12.2025 (Eintragungsdatum)\n\nARCHONIC GmbH\nGesellschaft mit beschränkter Haftung\nBietigheim-Bissingen\n\nAls nicht eingetragen wird bekanntgemacht:\nDen Gläubigern der an der Verschmelzung beteiligten Rechtsträger ist, wenn sie binnen sechs Monaten nach dem Tag, an dem die Eintragung der Verschmelzung in das Register des Sitzes desjenigen Rechtsträgers, dessen Gläubiger sie sind, nach § 19 Abs. 3 UmwG als bekanntgemacht gilt, ihren Anspruch nach Grund und Höhe schriftlich anmelden, Sicherheit zu leisten, soweit sie nicht Befriedigung verlangen können. Dieses Recht steht den Gläubigern jedoch nur zu, wenn sie glaubhaft machen, dass durch die Verschmelzung die Erfüllung ihrer Forderung gefährdet wird."
    },
    {
      "date": "2025-12-09",
      "id": "139520",
      "original_text": "Registerbekanntmachung nach dem Umwandlungsgesetz\nBaden-Württemberg Amtsgericht Stuttgart HRB 19583\nMPS ARCHONIC GmbH – Stuttgart",
      "type": "Registerbekanntmachung nach dem Umwandlungsgesetz",
      "state": "Baden-Württemberg",
      "amtsgericht": "Amtsgericht Stuttgart",
      "registernummer": "HRB 19583",
      "registerart": "HRB",
      "company_name": "MPS ARCHONIC GmbH",
      "company_seat": "Stuttgart",
      "details": "09.12.2025 (Bekanntmachungsdatum)\n\nBaden-Württemberg Amtsgericht Stuttgart HRB 19583\nRegisterbekanntmachung nach dem Umwandlungsgesetz 09.12.2025 (Eintragungsdatum)\n\nMPS ARCHONIC GmbH\nGesellschaft mit beschränkter Haftung\nStuttgart\n\nDen Gläubigern dern an der grenzüberschreitenden Verschmelzung beteiligten übernehmenden Rechtsträger ist, wenn sie binnen sechs Monaten nach dem Tag, an dem die Eintragung der Verschmelzung in das Register des Sitzes desjenigen Rechtsträgers, dessen Gläubiger sie sind, nach § 19 Absatz 3 UmwG als bekanntgemacht gilt, ihren Anspruch nach Grund und Höhe schriftlich anmelden, Sicherheit zu leisten, soweit sie nicht Befriedigung verlangen können. Dieses Recht steht den Gläubigern jedoch nur zu, wenn sie glaubhaft machen, dass durch die Verschmelzung die Erfüllung ihrer Forderung gefährdet wird.  Als nicht eingetragen wird bekanntgemacht:\nDen Gläubigern der an der Verschmelzung beteiligten Rechtsträger ist, wenn sie binnen sechs Monaten nach dem Tag, an dem die Eintragung der Verschmelzung in das Register des Sitzes desjenigen Rechtsträgers, dessen Gläubiger sie sind, nach § 19 Abs. 3 UmwG als bekanntgemacht gilt, ihren Anspruch nach Grund und Höhe schriftlich anmelden, Sicherheit zu leisten, soweit sie nicht Befriedigung verlangen können. Dieses Recht steht den Gläubigern jedoch nur zu, wenn sie glaubhaft machen, dass durch die Verschmelzung die Erfüllung ihrer Forderung gefährdet wird."
    },
    {
      "date": "2025-12-09",
      "id": "139521",
      "original_text": "Löschungsankündigung\nBerlin Amtsgericht Berlin (Charlottenburg) HRB 256901\nM.A.S.T.A.L. Bau GmbH – Berlin",
      "type": "Löschungsankündigung",
      "state": "Berlin",
      "amtsgericht": "Amtsgericht Berlin (Charlottenburg)",
      "registernummer": "HRB 256901",
      "registerart": "HRB",
      "company_name": "M.A.S.T.A.L. Bau GmbH",
      "company_seat": "Berlin",
      "details": "09.12.2025 (Bekanntmachungsdatum)\n\nBerlin Amtsgericht Berlin (Charlottenburg) HRB 256901\nLöschungsankündigung\n\nM.A.S.T.A.L. Bau GmbH\nGesellschaft mit beschränkter Haftung\nBerlin\n\nBei der nachstehenden Gesellschaft wird das Amtslöschungsverfahren gemäß § 394 FamFG eingeleitet. Widerspruchsfrist 6 Wochen"
    },
    {
      "date": "2025-12-09",
      "id": "139522",
      "original_text": "Einreichung neuer Dokumente\nBerlin Amtsgericht Berlin (Charlottenburg) HRB 76350\nLiegenschaftsfonds Berlin Verwaltungsgesellschaft mbH – Berlin",
      "type": "Einreichung neuer Dokumente",
      "state": "Berlin",
      "amtsgericht": "Amtsgericht Berlin (Charlottenburg)",
      "registernummer": "HRB 76350",
      "registerart": "HRB",
      "company_name": "Liegenschaftsfonds Berlin Verwaltungsgesellschaft mbH",
      "company_seat": "Berlin",
      "details": "09.12.2025 (Bekanntmachungsdatum)\n\nBerlin Amtsgericht Berlin (Charlottenburg) HRB 76350\nEinreichung neuer Dokumente\n\nLiegenschaftsfonds Berlin Verwaltungsgesellschaft mbH\nGesellschaft mit beschränkter Haftung\nBerlin\n\nAls nicht eingetragen wird veröffentlicht: Es wurde eine neue Liste der Aufsichtsratsmitglieder eingereicht (§52 GmbHG)."
    },
    {
      "date": "2025-12-09",
      "id": "139523",
      "original_text": "Registerbekanntmachung nach dem Umwandlungsgesetz\nBaden-Württemberg Amtsgericht Stuttgart HRB 765256\nTW-O Management GmbH – Hemmingen",
      "type": "Registerbekanntmachung nach dem Umwandlungsgesetz",
      "state": "Baden-Württemberg",
      "amtsgericht": "Amtsgericht Stuttgart",
      "registernummer": "HRB 765256",
      "registerart": "HRB",
      "company_name": "TW-O Management GmbH",
      "company_seat": "Hemmingen",
      "details": "09.12.2025 (Bekanntmachungsdatum)\n\nBaden-Württemberg Amtsgericht Stuttgart HRB 765256\nRegisterbekanntmachung nach dem Umwandlungsgesetz 09.12.2025 (Eintragungsdatum)\n\nTW-O Management GmbH\nGesellschaft mit beschränkter Haftung\nHemmingen\n\nDen Gläubigern des an dem Formwechsel beteiligten Rechtsträgers ist, wenn sie binnen sechs Monaten nach dem Tag, an dem die Eintragung des Formwechsels in das Register des Sitzes desjenigen Rechtsträgers, dessen Gläubiger sie sind, nach § 19 Abs. 3 UmwG als bekanntgemacht gilt, ihren Anspruch nach Grund und Höhe schriftlich anmelden, Sicherheit zu leisten, soweit sie nicht Befriedigung verlangen können. Dieses Recht steht den Gläubigern jedoch nur zu, wenn sie glaubhaft machen, dass durch den Formwechsel die Erfüllung ihrer Forderung gefährdet wird."
    },
    {
      "date": "2025-12-09",
      "id": "139524",
      "original_text": "Löschungsankündigung\nBaden-Württemberg Amtsgericht Stuttgart HRB 101821\nHans Clemens GmbH Gesellschaft für die Herstellung und den Vertrieb von Spielwaren, mit beschränkter Haftung – Kirchardt",
      "type": "Löschungsankündigung",
      "state": "Baden-Württemberg",
      "amtsgericht": "Amtsgericht Stuttgart",
      "registernummer": "HRB 101821",
      "registerart": "HRB",
      "company_name": "Hans Clemens GmbH Gesellschaft für die Herstellung und den Vertrieb von Spielwaren, mit beschränkter Haftung",
      "company_seat": "Kirchardt",
      "details": "09.12.2025 (Bekanntmachungsdatum)\n\nBaden-Württemberg Amtsgericht Stuttgart HRB 101821\nLöschungsankündigung\n\nHans Clemens GmbH Gesellschaft für die Herstellung und den Vertrieb von Spielwaren, mit beschränkter Haftung\nGesellschaft mit beschränkter Haftung\nKirchardt\n\nAls nicht eingetragen wird bekanntgemacht:\nDas Gericht beabsichtigt, die Gesellschaft wegen Vermögenslosigkeit im Handelsregister von Amts wegen nach § 394 FamFG zu löschen. Die Frist zur Geltendmachung eines Widerspruchs gegen die beabsichtigte Löschung ist auf zwei Monate ab Veröffentlichung bestimmt."
    },
    {
      "date": "2025-12-09",
      "id": "139525",
      "original_text": "Einreichung neuer Dokumente\nNiedersachsen Amtsgericht Walsrode HRB 100108\nWOHNBAU DIEPHOLZ GMBH – Diepholz",
      "type": "Einreichung neuer Dokumente",
      "state": "Niedersachsen",
      "amtsgericht": "Amtsgericht Walsrode",
      "registernummer": "HRB 100108",
      "registerart": "HRB",
      "company_name": "WOHNBAU DIEPHOLZ GMBH",
      "company_seat": "Diepholz",
      "details": "09.12.2025 (Bekanntmachungsdatum)\n\nNiedersachsen Amtsgericht Walsrode HRB 100108\nEinreichung neuer Dokumente 09.12.2025 (Eintragungsdatum)\n\nWOHNBAU DIEPHOLZ GMBH\nGesellschaft mit beschränkter Haftung\nDiepholz\n\nDie Liste der Mitglieder des Aufsichtsrats wurde beim Registergericht eingereicht."
    },
    {
      "date": "2025-12-09",
      "id": "139526",
      "original_text": "Löschungsankündigung\nNiedersachsen Amtsgericht Stadthagen HRB 201804\nBredemeyer Verwaltungs GmbH – Stadthagen",
      "type": "Löschungsankündigung",
      "state": "Niedersachsen",
      "amtsgericht": "Amtsgericht Stadthagen",
      "registernummer": "HRB 201804",
      "registerart": "HRB",
      "company_name": "Bredemeyer Verwaltungs GmbH",
      "company_seat": "Stadthagen",
      "details": "09.12.2025 (Bekanntmachungsdatum)\n\nNiedersachsen Amtsgericht Stadthagen HRB 201804\nLöschungsankündigung\n\nBredemeyer Verwaltungs GmbH\nGesellschaft mit beschränkter Haftung\nStadthagen\n\nDas Registergericht beabsichtigt, die Gesellschaft von Amts wegen nach § 394 FamFG zu löschen. Die Frist zur Erhebung eines Widerspruchs ist auf 1 Monat ab dieser Registerbekanntmachung festgesetzt."
    },
    {
      "date": "2025-12-09",
      "id": "139527",
      "original_text": "Löschungsankündigung\nNiedersachsen Amtsgericht Stadthagen HRB 201804\nBredemeyer Verwaltungs GmbH – Stadthagen",
      "type": "Löschungsankündigung",
      "state": "Niedersachsen",
      "amtsgericht": "Amtsgericht Stadthagen",
      "registernummer": "HRB 201804",
      "registerart": "HRB",
      "company_name": "Bredemeyer Verwaltungs GmbH",
      "company_seat": "Stadthagen",
      "details": "09.12.2025 (Bekanntmachungsdatum)\n\nNiedersachsen Amtsgericht Stadthagen HRB 201804\nLöschungsankündigung\n\nBredemeyer Verwaltungs GmbH\nGesellschaft mit beschränkter Haftung\nStadthagen\n\nDas Registergericht beabsichtigt, die Gesellschaft von Amts wegen nach § 394 FamFG zu löschen. Die Frist zur Erhebung eines Widerspruchs ist auf 1 Monat ab dieser Registerbekanntmachung festgesetzt."
    },
    {
      "date": "2025-12-09",
      "id": "139528",
      "original_text": "Registerbekanntmachung nach dem Umwandlungsgesetz\nNiedersachsen Amtsgericht Tostedt VR 201863\nAgrarberatung Unterweser e.V. – Beverstedt",
      "type": "Registerbekanntmachung nach dem Umwandlungsgesetz",
      "state": "Niedersachsen",
      "amtsgericht": "Amtsgericht Tostedt",
      "registernummer": "VR 201863",
      "registerart": "VR",
      "company_name": "Agrarberatung Unterweser e.V.",
      "company_seat": "Beverstedt",
      "details": "09.12.2025 (Bekanntmachungsdatum)\n\nNiedersachsen Amtsgericht Tostedt VR 201863\nRegisterbekanntmachung nach dem Umwandlungsgesetz 09.12.2025 (Eintragungsdatum)\n\nAgrarberatung Unterweser e.V.\neingetragener Verein\nBeverstedt\n\nDen Gläubigern der an der Verschmelzung beteiligten Rechtsträger ist, wenn sie binnen sechs Monaten nach dem Tag, an dem die Eintragung der Verschmelzung in das Register des Sitzes desjenigen Rechtsträgers, dessen Gläubiger sie sind, nach § 19  Abs.  3 UmwG als bekannt gemacht gilt, ihren Anspruch nach Grund und Höhe schriftlich anmelden, Sicherheit zu leisten, soweit sie nicht Befriedigung verlangen können. Dieses Recht steht den Gläubigern jedoch nur zu, wenn sie glaubhaft machen, dass durch die Verschmelzung die Erfüllung der Forderung gefährdet wird."
    },
    {
      "date": "2025-12-09",
      "id": "139529",
      "original_text": "Einreichung neuer Dokumente\nNiedersachsen Amtsgericht Stadthagen HRB 1185\nNBB Dienstleistungssysteme AG – Rodenberg",
      "type": "Einreichung neuer Dokumente",
      "state": "Niedersachsen",
      "amtsgericht": "Amtsgericht Stadthagen",
      "registernummer": "HRB 1185",
      "registerart": "HRB",
      "company_name": "NBB Dienstleistungssysteme AG",
      "company_seat": "Rodenberg",
      "details": "09.12.2025 (Bekanntmachungsdatum)\n\nNiedersachsen Amtsgericht Stadthagen HRB 1185\nEinreichung neuer Dokumente 19.11.2025 (Eintragungsdatum)\n\nNBB Dienstleistungssysteme AG\nAktiengesellschaft\nRodenberg\n\nDie Liste der Mitglieder des Aufsichtsrats wurde beim Registergericht eingereicht."
    },
    {
      "date": "2025-12-09",
      "id": "139530",
      "original_text": "Registerbekanntmachung nach dem Umwandlungsgesetz\nNiedersachsen Amtsgericht Tostedt VR 110012\nBeratungsring Beverstedt und Umgebung e. V. – Beverstedt",
      "type": "Registerbekanntmachung nach dem Umwandlungsgesetz",
      "state": "Niedersachsen",
      "amtsgericht": "Amtsgericht Tostedt",
      "registernummer": "VR 110012",
      "registerart": "VR",
      "company_name": "Beratungsring Beverstedt und Umgebung e. V.",
      "company_seat": "Beverstedt",
      "details": "09.12.2025 (Bekanntmachungsdatum)\n\nNiedersachsen Amtsgericht Tostedt VR 110012\nRegisterbekanntmachung nach dem Umwandlungsgesetz 09.12.2025 (Eintragungsdatum)\n\nBeratungsring Beverstedt und Umgebung e. V.\neingetragener Verein\nBeverstedt\n\nDen Gläubigern der an der Verschmelzung beteiligten Rechtsträger ist, wenn sie binnen sechs Monaten nach dem Tag, an dem die Eintragung der Verschmelzung in das Register des Sitzes desjenigen Rechtsträgers, dessen Gläubiger sie sind, nach § 19  Abs.  3 UmwG als bekannt gemacht gilt, ihren Anspruch nach Grund und Höhe schriftlich anmelden, Sicherheit zu leisten, soweit sie nicht Befriedigung verlangen können. Dieses Recht steht den Gläubigern jedoch nur zu, wenn sie glaubhaft machen, dass durch die Verschmelzung die Erfüllung der Forderung gefährdet wird."
    },
    {
      "date": "2025-12-09",
      "id": "139531",
      "original_text": "Registerbekanntmachung nach dem Umwandlungsgesetz\nNiedersachsen Amtsgericht Tostedt VR 110195\nBeratungsring Hagen-Stubben e.V. – Hagen",
      "type": "Registerbekanntmachung nach dem Umwandlungsgesetz",
      "state": "Niedersachsen",
      "amtsgericht": "Amtsgericht Tostedt",
      "registernummer": "VR 110195",
      "registerart": "VR",
      "company_name": "Beratungsring Hagen-Stubben e.V.",
      "company_seat": "Hagen",
      "details": "09.12.2025 (Bekanntmachungsdatum)\n\nNiedersachsen Amtsgericht Tostedt VR 110195\nRegisterbekanntmachung nach dem Umwandlungsgesetz 09.12.2025 (Eintragungsdatum)\n\nBeratungsring Hagen-Stubben e.V.\neingetragener Verein\nHagen\n\nDen Gläubigern der an der Verschmelzung beteiligten Rechtsträger ist, wenn sie binnen sechs Monaten nach dem Tag, an dem die Eintragung der Verschmelzung in das Register des Sitzes desjenigen Rechtsträgers, dessen Gläubiger sie sind, nach § 19  Abs.  3 UmwG als bekannt gemacht gilt, ihren Anspruch nach Grund und Höhe schriftlich anmelden, Sicherheit zu leisten, soweit sie nicht Befriedigung verlangen können. Dieses Recht steht den Gläubigern jedoch nur zu, wenn sie glaubhaft machen, dass durch die Verschmelzung die Erfüllung der Forderung gefährdet wird."
    },
    {
      "date": "2025-12-09",
      "id": "139532",
      "original_text": "Löschungsankündigung\nNiedersachsen Amtsgericht Aurich HRB 110814 früher Amtsgericht Leer (Ostfriesland) (Leer)\nPlatte GmbH – Rhauderfehn",
      "type": "Löschungsankündigung",
      "state": "Niedersachsen",
      "amtsgericht": "Amtsgericht Aurich",
      "registernummer": "HRB 110814",
      "registerart": "HRB",
      "company_name": "Platte GmbH",
      "company_seat": "Rhauderfehn",
      "former_amtsgericht": "Leer (Ostfriesland) (Leer)",
      "details": "09.12.2025 (Bekanntmachungsdatum)\n\nNiedersachsen Amtsgericht Aurich HRB 110814 früher Amtsgericht Leer (Ostfriesland) (Leer)\nLöschungsankündigung 09.12.2025 (Eintragungsdatum)\n\nPlatte GmbH\nGesellschaft mit beschränkter Haftung\nRhauderfehn\n\nDas Registergericht beabsichtigt, die Gesellschaft von Amts wegen nach § 394 FamFG zu löschen. Die Frist zur Erhebung eines Widerspruchs ist auf 3 Monate ab dieser Registerbekanntmachung festgesetzt."
    },
    {
      "date": "2025-12-09",
      "id": "139533",
      "original_text": "Löschungsankündigung\nNiedersachsen Amtsgericht Walsrode HRB 205879\ntn.events GmbH – Nienburg",
      "type": "Löschungsankündigung",
      "state": "Niedersachsen",
      "amtsgericht": "Amtsgericht Walsrode",
      "registernummer": "HRB 205879",
      "registerart": "HRB",
      "company_name": "tn.events GmbH",
      "company_seat": "Nienburg",
      "details": "09.12.2025 (Bekanntmachungsdatum)\n\nNiedersachsen Amtsgericht Walsrode HRB 205879\nLöschungsankündigung 09.12.2025 (Eintragungsdatum)\n\ntn.events GmbH\nGesellschaft mit beschränkter Haftung\nNienburg\n\nDas Registergericht beabsichtigt, die Gesellschaft von Amts wegen nach § 395 FamFG wegen Vermögenslosigkeit zu löschen. Die Frist zur Erhebung eines Widerspruchs ist auf 3 Monat ab dieser Registerbekanntmachung festgesetzt. ."
    },
    {
      "date": "2025-12-09",
      "id": "139534",
      "original_text": "Löschungsankündigung\nRheinland-Pfalz Amtsgericht Ludwigshafen a.Rhein (Ludwigshafen) HRB 60232\nLehner Elektrotechnik Vertriebsgesellschaft mbH – Birkenheide",
      "type": "Löschungsankündigung",
      "state": "Rheinland-Pfalz",
      "amtsgericht": "Amtsgericht Ludwigshafen a.Rhein (Ludwigshafen)",
      "registernummer": "HRB 60232",
      "registerart": "HRB",
      "company_name": "Lehner Elektrotechnik Vertriebsgesellschaft mbH",
      "company_seat": "Birkenheide",
      "details": "09.12.2025 (Bekanntmachungsdatum)\n\nRheinland-Pfalz Amtsgericht Ludwigshafen a.Rhein (Ludwigshafen) HRB 60232\nLöschungsankündigung\n\nLehner Elektrotechnik Vertriebsgesellschaft mbH\nGesellschaft mit beschränkter Haftung\nBirkenheide\n\nDas Registergericht beabsichtigt die Gesellschaft von Amts wegen nach § 394 FamFG zu löschen. Die Frist zur Erhebung eines Widerspruchs ist auf einen Monat festgesetzt."
    },
    {
      "date": "2025-12-09",
      "id": "139535",
      "original_text": "Löschungsankündigung\nRheinland-Pfalz Amtsgericht Montabaur HRB 23127\nCASA TERMICA UG (haftungsbeschränkt) – Burglahr",
      "type": "Löschungsankündigung",
      "state": "Rheinland-Pfalz",
      "amtsgericht": "Amtsgericht Montabaur",
      "registernummer": "HRB 23127",
      "registerart": "HRB",
      "company_name": "CASA TERMICA UG (haftungsbeschränkt)",
      "company_seat": "Burglahr",
      "details": "09.12.2025 (Bekanntmachungsdatum)\n\nRheinland-Pfalz Amtsgericht Montabaur HRB 23127\nLöschungsankündigung\n\nCASA TERMICA UG (haftungsbeschränkt)\nGesellschaft mit beschränkter Haftung\nBurglahr\n\nDas Registergericht beabsichtigt die Gesellschaft von Amts wegen nach § 394 FamFG zu löschen. Die Frist zur Erhebung eines Widerspruchs ist auf einen Monat festgesetzt."
    },
    {
      "date": "2025-12-09",
      "id": "139536",
      "original_text": "Löschungsankündigung\nRheinland-Pfalz Amtsgericht Ludwigshafen a.Rhein (Ludwigshafen) HRB 67459\nTD Transporte UG (haftungsbeschränkt) – Lambrecht",
      "type": "Löschungsankündigung",
      "state": "Rheinland-Pfalz",
      "amtsgericht": "Amtsgericht Ludwigshafen a.Rhein (Ludwigshafen)",
      "registernummer": "HRB 67459",
      "registerart": "HRB",
      "company_name": "TD Transporte UG (haftungsbeschränkt)",
      "company_seat": "Lambrecht",
      "details": "09.12.2025 (Bekanntmachungsdatum)\n\nRheinland-Pfalz Amtsgericht Ludwigshafen a.Rhein (Ludwigshafen) HRB 67459\nLöschungsankündigung 09.12.2025 (Eintragungsdatum)\n\nTD Transporte UG (haftungsbeschränkt)\nGesellschaft mit beschränkter Haftung\nLambrecht\n\nDas Registergericht beabsichtigt die Gesellschaft von Amts wegen nach § 394 FamFG zu löschen. Die Frist zur Erhebung eines Widerspruchs ist auf einen Monat festgesetzt."
    },
    {
      "date": "2025-12-09",
      "id": "139537",
      "original_text": "Registerbekanntmachung nach dem Umwandlungsgesetz\nNordrhein-Westfalen Amtsgericht Düsseldorf HRA 28470\nBeautyCase Cosmetics e.K. – Düsseldorf",
      "type": "Registerbekanntmachung nach dem Umwandlungsgesetz",
      "state": "Nordrhein-Westfalen",
      "amtsgericht": "Amtsgericht Düsseldorf",
      "registernummer": "HRA 28470",
      "registerart": "HRA",
      "company_name": "BeautyCase Cosmetics e.K.",
      "company_seat": "Düsseldorf",
      "details": "09.12.2025 (Bekanntmachungsdatum)\n\nNordrhein-Westfalen Amtsgericht Düsseldorf HRA 28470\nRegisterbekanntmachung nach dem Umwandlungsgesetz 09.12.2025 (Eintragungsdatum)\n\nBeautyCase Cosmetics e.K.\nEinzelkaufmann / Einzelkauffrau\nDüsseldorf\n\nDen Gläubigern der an der Verschmelzung beteiligten Rechtsträger ist, wenn sie binnen sechs Monaten nach dem Tag, an dem die Eintragung der Verschmelzung in das Register des Sitzes desjenigen Rechtsträgers, dessen Gläubiger sie sind, nach § 19 Absatz 3 UmwG als bekanntgemacht gilt, ihren Anspruch nach Grund und Höhe schriftlich anmelden, Sicherheit zu leisten, soweit sie nicht Befriedigung verlangen können. Dieses Recht steht den Gläubigern jedoch nur zu, wenn sie glaubhaft machen, dass durch die Verschmelzung die Erfüllung ihrer Forderung gefährdet wird."
    },
    {
      "date": "2025-12-09",
      "id": "139538",
      "original_text": "Einreichung neuer Dokumente\nNordrhein-Westfalen Amtsgericht Düren HRB 2915\nGKD - Gebr. Kufferath AG. – Düren",
      "type": "Einreichung neuer Dokumente",
      "state": "Nordrhein-Westfalen",
      "amtsgericht": "Amtsgericht Düren",
      "registernummer": "HRB 2915",
      "registerart": "HRB",
      "company_name": "GKD - Gebr. Kufferath AG.",
      "company_seat": "Düren",
      "details": "09.12.2025 (Bekanntmachungsdatum)\n\nNordrhein-Westfalen Amtsgericht Düren HRB 2915\nEinreichung neuer Dokumente 09.12.2025 (Eintragungsdatum)\n\nGKD - Gebr. Kufferath AG.\nAktiengesellschaft\nDüren\n\nDem Registergericht ist eine neue Liste der Mitglieder des Aufsichtsrates eingereicht worden."
    },
    {
      "date": "2025-12-09",
      "id": "139539",
      "original_text": "Einreichung neuer Dokumente\nNordrhein-Westfalen Amtsgericht Essen HRB 4308\nEssener Versorgungs- und Verkehrsgesellschaft mbH (EVV) – Essen",
      "type": "Einreichung neuer Dokumente",
      "state": "Nordrhein-Westfalen",
      "amtsgericht": "Amtsgericht Essen",
      "registernummer": "HRB 4308",
      "registerart": "HRB",
      "company_name": "Essener Versorgungs- und Verkehrsgesellschaft mbH (EVV)",
      "company_seat": "Essen",
      "details": "09.12.2025 (Bekanntmachungsdatum)\n\nNordrhein-Westfalen Amtsgericht Essen HRB 4308\nEinreichung neuer Dokumente\n\nEssener Versorgungs- und Verkehrsgesellschaft mbH (EVV)\nGesellschaft mit beschränkter Haftung\nEssen\n\nDem Registergericht ist eine neue Liste der Mitglieder des Aufsichtsrates eingereicht worden."
    },
    {
      "date": "2025-12-09",
      "id": "139540",
      "original_text": "Registerbekanntmachung nach dem Umwandlungsgesetz\nNordrhein-Westfalen Amtsgericht Düsseldorf HRB 82394\nBeautyCase Cosmetics GmbH – Düsseldorf",
      "type": "Registerbekanntmachung nach dem Umwandlungsgesetz",
      "state": "Nordrhein-Westfalen",
      "amtsgericht": "Amtsgericht Düsseldorf",
      "registernummer": "HRB 82394",
      "registerart": "HRB",
      "company_name": "BeautyCase Cosmetics GmbH",
      "company_seat": "Düsseldorf",
      "details": "09.12.2025 (Bekanntmachungsdatum)\n\nNordrhein-Westfalen Amtsgericht Düsseldorf HRB 82394\nRegisterbekanntmachung nach dem Umwandlungsgesetz 09.12.2025 (Eintragungsdatum)\n\nBeautyCase Cosmetics GmbH\nGesellschaft mit beschränkter Haftung\nDüsseldorf\n\nDen Gläubigern der an der Verschmelzung beteiligten Rechtsträger ist, wenn sie binnen sechs Monaten nach dem Tag, an dem die Eintragung der Verschmelzung in das Register des Sitzes desjenigen Rechtsträgers, dessen Gläubiger sie sind, nach § 19 Absatz 3 UmwG als bekanntgemacht gilt, ihren Anspruch nach Grund und Höhe schriftlich anmelden, Sicherheit zu leisten, soweit sie nicht Befriedigung verlangen können. Dieses Recht steht den Gläubigern jedoch nur zu, wenn sie glaubhaft machen, dass durch die Verschmelzung die Erfüllung ihrer Forderung gefährdet wird."
    },
    {
      "date": "2025-12-09",
      "id": "139541",
      "original_text": "Löschungsankündigung\nNordrhein-Westfalen Amtsgericht Krefeld HRB 17402\nLeusina GmbH – Krefeld",
      "type": "Löschungsankündigung",
      "state": "Nordrhein-Westfalen",
      "amtsgericht": "Amtsgericht Krefeld",
      "registernummer": "HRB 17402",
      "registerart": "HRB",
      "company_name": "Leusina GmbH",
      "company_seat": "Krefeld",
      "details": "09.12.2025 (Bekanntmachungsdatum)\n\nNordrhein-Westfalen Amtsgericht Krefeld HRB 17402\nLöschungsankündigung\n\nLeusina GmbH\nGesellschaft mit beschränkter Haftung\nKrefeld\n\nDas Registergericht beabsichtigt die Gesellschaft von Amts wegen nach § 394 FamFG zu löschen. Die Frist zur Erhebung eines Widerspruchs ist auf einen Monat festgesetzt."
    },
    {
      "date": "2025-12-09",
      "id": "139542",
      "original_text": "Löschungsankündigung\nNordrhein-Westfalen Amtsgericht Gelsenkirchen HRB 14058\nRP-WOOD GmbH – Gelsenkirchen",
      "type": "Löschungsankündigung",
      "state": "Nordrhein-Westfalen",
      "amtsgericht": "Amtsgericht Gelsenkirchen",
      "registernummer": "HRB 14058",
      "registerart": "HRB",
      "company_name": "RP-WOOD GmbH",
      "company_seat": "Gelsenkirchen",
      "details": "09.12.2025 (Bekanntmachungsdatum)\n\nNordrhein-Westfalen Amtsgericht Gelsenkirchen HRB 14058\nLöschungsankündigung\n\nRP-WOOD GmbH\nGesellschaft mit beschränkter Haftung\nGelsenkirchen\n\nDas Gericht beabsichtigt, die RP-WOOD GmbH mit Sitz in Gelsenkirchen, HRB 14058, Amtsgericht Gelsenkirchen, wegen Vermögenslosigkeit zu löschen.\nHiermit wird denjenigen, die an der Unterlassung der Löschung ein berechtigtes Interesse haben, gem. § 394 Abs. 2 FamFG Gelegenheit gegeben, gegen dieses Vorhaben binnen eines Monats nach dieser Bekanntmachung Widerspruch einzulegen. Der Widerspruch kann schriftlich oder zu Protokoll der Geschäftsstelle erhoben werden."
    },
    {
      "date": "2025-12-09",
      "id": "139543",
      "original_text": "Löschungsankündigung\nNordrhein-Westfalen Amtsgericht Duisburg HRB 34326\nVS Car GmbH – Duisburg",
      "type": "Löschungsankündigung",
      "state": "Nordrhein-Westfalen",
      "amtsgericht": "Amtsgericht Duisburg",
      "registernummer": "HRB 34326",
      "registerart": "HRB",
      "company_name": "VS Car GmbH",
      "company_seat": "Duisburg",
      "details": "09.12.2025 (Bekanntmachungsdatum)\n\nNordrhein-Westfalen Amtsgericht Duisburg HRB 34326\nLöschungsankündigung\n\nVS Car GmbH\nGesellschaft mit beschränkter Haftung\nDuisburg\n\nAmtsgericht Duisburg\nHRB 34326\nVS Car GmbH, Duisburg\nDas Registergericht beabsichtigt, die im Handelsregister eingetragene Gesellschaft gemäß § 394 Absatz 1 FamFG wegen Vermögenslosigkeit von Amts wegen zu löschen. Gegen diese Verfügung kann Widerspruch eingelegt werden. Die Frist zur Erhebung eines Widerspruchs gegen die beabsichtigte Löschung von Amts wegen ist auf drei Monate festgesetzt. Rechtsbehelfsbelehrung Der Widerspruch ist bei dem Amtsgericht Duisburg, Kardinal-Galen-Str. 124-132, 47058 Duisburg schriftlich in deutscher Sprache oder zur Niederschrift der Geschäftsstelle einzulegen. Der Widerspruch kann auch zur Niederschrift der Geschäftsstelle eines jeden Amtsgerichtes abgegeben werden. Die Einlegung ist auch durch Übertragung eines elektronischen Dokuments an die elektronische Poststelle des Gerichts möglich. Das elektronische Dokument muss für die Bearbeitung durch das Gericht geeignet und mit einer qualifizierten elektronischen Signatur der verantwortenden Person versehen sein oder von der verantwortenden Person signiert und auf einem sicheren Übermittlungsweg gemäß § 130 a ZPO nach näherer Maßgabe der Verordnung über die technischen Rahmenbedingungen des elektronischen Rechtsverkehrs und über das besondere elektronische Behördenpostfach (BGBl. I, S. 3803) eingereicht werden. Weitere Informationen erhalten Sie auf der Internetseite www.justiz.de <http://www.justiz.de>. Der Widerspruch muss spätestens innerhalb der gesetzten Frist bei dem Amtsgericht Duisburg eingegangen sein. Dies gilt auch dann, wenn der Widerspruch zur Niederschrift der Geschäftsstelle eines anderen Amtsgerichtes abgegeben wurde. Die Frist beginnt mit der Veröffentlichung. Fällt das Ende der Frist auf einen Sonntag, einen allgemeinen Feiertag oder Sonnabend, so endet die Frist mit Ablauf des nächsten Werktages. Der Widerspruch muss die Bezeichnung der angefochtenen Verfügung sowie die Erklärung enthalten, dass Widerspruch gegen diese Verfügung eingelegt wird. Er ist zu unterzeichnen und soll begründet werden."
    },
    {
      "date": "2025-12-09",
      "id": "139544",
      "original_text": "Einreichung neuer Dokumente\nNordrhein-Westfalen Amtsgericht Duisburg HRB 16142\nCUBION Immobilien AG – Mülheim an der Ruhr",
      "type": "Einreichung neuer Dokumente",
      "state": "Nordrhein-Westfalen",
      "amtsgericht": "Amtsgericht Duisburg",
      "registernummer": "HRB 16142",
      "registerart": "HRB",
      "company_name": "CUBION Immobilien AG",
      "company_seat": "Mülheim an der Ruhr",
      "details": "09.12.2025 (Bekanntmachungsdatum)\n\nNordrhein-Westfalen Amtsgericht Duisburg HRB 16142\nEinreichung neuer Dokumente\n\nCUBION Immobilien AG\nAktiengesellschaft\nMülheim an der Ruhr\n\nDem Registergericht ist eine neue Liste der Mitglieder des Aufsichtsrates eingereicht worden."
    },
    {
      "date": "2025-12-09",
      "id": "139545",
      "original_text": "Registerbekanntmachung nach dem Umwandlungsgesetz\nNordrhein-Westfalen Amtsgericht Iserlohn HRB 11397\nVicent Industrievertretungen GmbH – Lüdenscheid",
      "type": "Registerbekanntmachung nach dem Umwandlungsgesetz",
      "state": "Nordrhein-Westfalen",
      "amtsgericht": "Amtsgericht Iserlohn",
      "registernummer": "HRB 11397",
      "registerart": "HRB",
      "company_name": "Vicent Industrievertretungen GmbH",
      "company_seat": "Lüdenscheid",
      "details": "09.12.2025 (Bekanntmachungsdatum)\n\nNordrhein-Westfalen Amtsgericht Iserlohn HRB 11397\nRegisterbekanntmachung nach dem Umwandlungsgesetz 04.12.2025 (Eintragungsdatum)\n\nVicent Industrievertretungen GmbH\nGesellschaft mit beschränkter Haftung\nLüdenscheid\n\nDen Gläubigern der an der Ausgliederung beteiligten Rechtsträger ist, wenn sie binnen sechs Monaten nach dem Tag, an dem die Eintragung der Ausgliederung in das Register des Sitzes desjenigen Rechtsträgers, dessen Gläubiger sie sind, nach § 19 Absatz 3 UmwG als bekanntgemacht gilt, ihren Anspruch nach Grund und Höhe schriftlich anmelden, Sicherheit zu leisten, soweit sie nicht Befriedigung verlangen können. Dieses Recht steht den Gläubigern jedoch nur zu, wenn sie glaubhaft machen, dass durch die Ausgliederung die Erfüllung ihrer Forderung gefährdet wird."
    },
    {
      "date": "2025-12-09",
      "id": "139546",
      "original_text": "Einreichung neuer Dokumente\nNordrhein-Westfalen Amtsgericht Iserlohn HRB 10771\nKOSTAL Industry Holding SE – Lüdenscheid",
      "type": "Einreichung neuer Dokumente",
      "state": "Nordrhein-Westfalen",
      "amtsgericht": "Amtsgericht Iserlohn",
      "registernummer": "HRB 10771",
      "registerart": "HRB",
      "company_name": "KOSTAL Industry Holding SE",
      "company_seat": "Lüdenscheid",
      "details": "09.12.2025 (Bekanntmachungsdatum)\n\nNordrhein-Westfalen Amtsgericht Iserlohn HRB 10771\nEinreichung neuer Dokumente 09.12.2025 (Eintragungsdatum)\n\nKOSTAL Industry Holding SE\nEuropäische Aktiengesellschaft (SE)\nLüdenscheid\n\nDem Registergericht ist eine neue Liste der Mitglieder des Aufsichtsrates eingereicht worden."
    },
    {
      "date": "2025-12-09",
      "id": "139547",
      "original_text": "Löschungsankündigung\nNordrhein-Westfalen Amtsgericht Hamm HRB 10175\nMahzen Weinhandel und Getränke Dogan GmbH – Hamm",
      "type": "Löschungsankündigung",
      "state": "Nordrhein-Westfalen",
      "amtsgericht": "Amtsgericht Hamm",
      "registernummer": "HRB 10175",
      "registerart": "HRB",
      "company_name": "Mahzen Weinhandel und Getränke Dogan GmbH",
      "company_seat": "Hamm",
      "details": "09.12.2025 (Bekanntmachungsdatum)\n\nNordrhein-Westfalen Amtsgericht Hamm HRB 10175\nLöschungsankündigung\n\nMahzen Weinhandel und Getränke Dogan GmbH\nGesellschaft mit beschränkter Haftung\nHamm\n\nDas Registergericht beabsichtigt die Gesellschaft von Amts wegen nach § 394 FamFG zu löschen. Die Frist zur Erhebung eines Widerspruchs ist auf drei Monate festgesetzt."
    },
    {
      "date": "2025-12-09",
      "id": "139548",
      "original_text": "Einreichung neuer Dokumente\nNordrhein-Westfalen Amtsgericht Köln HRB 75958\nOBI Group Holding SE & Co. KGaA – Wermelskirchen",
      "type": "Einreichung neuer Dokumente",
      "state": "Nordrhein-Westfalen",
      "amtsgericht": "Amtsgericht Köln",
      "registernummer": "HRB 75958",
      "registerart": "HRB",
      "company_name": "OBI Group Holding SE & Co. KGaA",
      "company_seat": "Wermelskirchen",
      "details": "09.12.2025 (Bekanntmachungsdatum)\n\nNordrhein-Westfalen Amtsgericht Köln HRB 75958\nEinreichung neuer Dokumente 09.12.2025 (Eintragungsdatum)\n\nOBI Group Holding SE & Co. KGaA\nKommanditgesellschaft auf Aktien\nWermelskirchen\n\nDem Registergericht ist eine neue Liste der Mitglieder des Aufsichtsrates eingereicht worden."
    },
    {
      "date": "2025-12-09",
      "id": "139549",
      "original_text": "Löschungsankündigung\nNordrhein-Westfalen Amtsgericht Düsseldorf HRB 84255\nAnda Verlag GmbH – Ratingen",
      "type": "Löschungsankündigung",
      "state": "Nordrhein-Westfalen",
      "amtsgericht": "Amtsgericht Düsseldorf",
      "registernummer": "HRB 84255",
      "registerart": "HRB",
      "company_name": "Anda Verlag GmbH",
      "company_seat": "Ratingen",
      "details": "09.12.2025 (Bekanntmachungsdatum)\n\nNordrhein-Westfalen Amtsgericht Düsseldorf HRB 84255\nLöschungsankündigung\n\nAnda Verlag GmbH\nGesellschaft mit beschränkter Haftung\nRatingen\n\nBetr.: Anda Verlag GmbH, Kokkolastr. 5-7, 40882 Ratingen\n\nDas Registergericht beabsichtigt die Gesellschaft von Amts wegen nach § 394 FamFG zu löschen. Die Frist zur Erhebung eines Widerspruchs ist auf 3 Wochen festgesetzt.\n\nRechtsbehelfsbelehrung:\n\nDas Widerspruchsrecht steht jedem zu, der an der Unterlassung der Löschung ein berechtigtes Interesse hat. Der Widerspruch ist bei dem Amtsgericht Düsseldorf -Registergericht-, Werdener Straße 1, 40227 Düsseldorf schriftlich in deutscher Sprache oder zur Niederschrift der Geschäftsstelle einzulegen. Der Widerspruch kann auch zur Niederschrift der Geschäftsstelle eines jeden Amtsgerichtes abgegeben werden. Die Einlegung ist auch durch Übertragung eines elektronischen Dokuments an die elektronische Poststelle des Gerichts möglich. Das elektronische Dokument muss für die Bearbeitung durch das Gericht geeignet und mit einer qualifizierten elektronischen Signatur der verantwortenden Person versehen sein oder von der verantwortenden Person signiert und auf einem sicheren Übermittlungsweg gemäß § 130a ZPO nach näherer Maßgabe der Verordnung über die technischen Rahmenbedingungen des elektronischen Rechtsverkehrs und über das besondere elektronische Behördenpostfach (BGBl. I, S.3803) eingereicht werden. Weitere Informationen erhalten Sie auf der Internetseite www.justiz.de.\nDer Widerspruch muss spätestens innerhalb der gesetzten Frist nach dem Datum der Bekanntmachung der Löschungsankündigung bei dem Amtsgericht - Registergericht - Düsseldorf eingegangen sein.  Dies gilt auch dann, wenn der Widerspruch zur Niederschrift der Geschäftsstelle eines anderen Amtsgerichtes abgegeben wurde. Die Frist beginnt mit dem Tage der Bekanntmachung der Löschungsankündigung in dem für die Bekanntmachung der Eintragungen in das Handelsregister bestimmten elektronischen Informations- und Kommunikationssystem nach § 10 des Handelsgesetzbuches. Fällt das Ende der Frist auf einen Sonntag, einen allgemeinen Feiertag oder Sonnabend, so endet die Frist mit Ablauf des nächsten Werktages.\nDer Widerspruch muss die Bezeichnung der angefochtenen Löschungsankündigung sowie die Erklärung enthalten, dass Widerspruch gegen diese Löschungsankündigung eingelegt wird. Er ist zu unterzeichnen und soll begründet werden."
    },
    {
      "date": "2025-12-09",
      "id": "139550",
      "original_text": "Löschungsankündigung\nNordrhein-Westfalen Amtsgericht Düsseldorf HRA 13061\nWidder Apotheke Inhaberin Manuela Bergmann e.K. – Düsseldorf",
      "type": "Löschungsankündigung",
      "state": "Nordrhein-Westfalen",
      "amtsgericht": "Amtsgericht Düsseldorf",
      "registernummer": "HRA 13061",
      "registerart": "HRA",
      "company_name": "Widder Apotheke Inhaberin Manuela Bergmann e.K.",
      "company_seat": "Düsseldorf",
      "details": "09.12.2025 (Bekanntmachungsdatum)\n\nNordrhein-Westfalen Amtsgericht Düsseldorf HRA 13061\nLöschungsankündigung\n\nWidder Apotheke Inhaberin Manuela Bergmann e.K.\nEinzelkaufmann / Einzelkauffrau\nDüsseldorf\n\nDas Registergericht beabsichtigt die Firma von Amts wegen nach § 31 Abs. 2 HGB, § 393 FamFG zu löschen. Die Frist zur Erhebung eines Widerspruchs ist auf drei Monate festgesetzt."
    },
    {
      "date": "2025-12-09",
      "id": "139551",
      "original_text": "Löschungsankündigung\nNordrhein-Westfalen Amtsgericht Düsseldorf HRB 91453\nReifchamp GmbH – Düsseldorf",
      "type": "Löschungsankündigung",
      "state": "Nordrhein-Westfalen",
      "amtsgericht": "Amtsgericht Düsseldorf",
      "registernummer": "HRB 91453",
      "registerart": "HRB",
      "company_name": "Reifchamp GmbH",
      "company_seat": "Düsseldorf",
      "details": "09.12.2025 (Bekanntmachungsdatum)\n\nNordrhein-Westfalen Amtsgericht Düsseldorf HRB 91453\nLöschungsankündigung\n\nReifchamp GmbH\nGesellschaft mit beschränkter Haftung\nDüsseldorf\n\nBetr.: Reifchamp GmbH, Beedstr. 54, 40468 Düsseldorf\n\nDas Registergericht beabsichtigt die Gesellschaft von Amts wegen nach § 394 FamFG zu löschen. Die Frist zur Erhebung eines Widerspruchs ist auf 3 Wochen festgesetzt.\n\nRechtsbehelfsbelehrung:\n\nDas Widerspruchsrecht steht jedem zu, der an der Unterlassung der Löschung ein berechtigtes Interesse hat. Der Widerspruch ist bei dem Amtsgericht Düsseldorf -Registergericht-, Werdener Straße 1, 40227 Düsseldorf schriftlich in deutscher Sprache oder zur Niederschrift der Geschäftsstelle einzulegen. Der Widerspruch kann auch zur Niederschrift der Geschäftsstelle eines jeden Amtsgerichtes abgegeben werden. Die Einlegung ist auch durch Übertragung eines elektronischen Dokuments an die elektronische Poststelle des Gerichts möglich. Das elektronische Dokument muss für die Bearbeitung durch das Gericht geeignet und mit einer qualifizierten elektronischen Signatur der verantwortenden Person versehen sein oder von der verantwortenden Person signiert und auf einem sicheren Übermittlungsweg gemäß § 130a ZPO nach näherer Maßgabe der Verordnung über die technischen Rahmenbedingungen des elektronischen Rechtsverkehrs und über das besondere elektronische Behördenpostfach (BGBl. I, S.3803) eingereicht werden. Weitere Informationen erhalten Sie auf der Internetseite www.justiz.de.\nDer Widerspruch muss spätestens innerhalb der gesetzten Frist nach dem Datum der Bekanntmachung der Löschungsankündigung bei dem Amtsgericht - Registergericht - Düsseldorf eingegangen sein.  Dies gilt auch dann, wenn der Widerspruch zur Niederschrift der Geschäftsstelle eines anderen Amtsgerichtes abgegeben wurde. Die Frist beginnt mit dem Tage der Bekanntmachung der Löschungsankündigung in dem für die Bekanntmachung der Eintragungen in das Handelsregister bestimmten elektronischen Informations- und Kommunikationssystem nach § 10 des Handelsgesetzbuches. Fällt das Ende der Frist auf einen Sonntag, einen allgemeinen Feiertag oder Sonnabend, so endet die Frist mit Ablauf des nächsten Werktages.\nDer Widerspruch muss die Bezeichnung der angefochtenen Löschungsankündigung sowie die Erklärung enthalten, dass Widerspruch gegen diese Löschungsankündigung eingelegt wird. Er ist zu unterzeichnen und soll begründet werden."
    },
    {
      "date": "2025-12-09",
      "id": "139552",
      "original_text": "Löschungsankündigung\nNordrhein-Westfalen Amtsgericht Siegen HRB 9095\nWilmes Verwaltungs GmbH – Attendorn",
      "type": "Löschungsankündigung",
      "state": "Nordrhein-Westfalen",
      "amtsgericht": "Amtsgericht Siegen",
      "registernummer": "HRB 9095",
      "registerart": "HRB",
      "company_name": "Wilmes Verwaltungs GmbH",
      "company_seat": "Attendorn",
      "details": "09.12.2025 (Bekanntmachungsdatum)\n\nNordrhein-Westfalen Amtsgericht Siegen HRB 9095\nLöschungsankündigung\n\nWilmes Verwaltungs GmbH\nGesellschaft mit beschränkter Haftung\nAttendorn\n\nDas Registergericht beabsichtigt die Gesellschaft von Amts wegen nach § 394 FamFG zu löschen. Die Frist zur Erhebung eines Widerspruchs ist auf drei Monate festgesetzt."
    },
    {
      "date": "2025-12-09",
      "id": "139553",
      "original_text": "Registerbekanntmachung nach dem Umwandlungsgesetz\nNordrhein-Westfalen Amtsgericht Wuppertal HRB 17238\nLüttgens-Verwaltungsgesellschaft mit beschränkter Haftung – Heiligenhaus",
      "type": "Registerbekanntmachung nach dem Umwandlungsgesetz",
      "state": "Nordrhein-Westfalen",
      "amtsgericht": "Amtsgericht Wuppertal",
      "registernummer": "HRB 17238",
      "registerart": "HRB",
      "company_name": "Lüttgens-Verwaltungsgesellschaft mit beschränkter Haftung",
      "company_seat": "Heiligenhaus",
      "details": "09.12.2025 (Bekanntmachungsdatum)\n\nNordrhein-Westfalen Amtsgericht Wuppertal HRB 17238\nRegisterbekanntmachung nach dem Umwandlungsgesetz 09.12.2025 (Eintragungsdatum)\n\nLüttgens-Verwaltungsgesellschaft mit beschränkter Haftung\nGesellschaft mit beschränkter Haftung\nHeiligenhaus\n\nDen Gläubigern der an der Verschmelzung beteiligten Rechtsträger ist, wenn sie binnen sechs Monaten nach dem Tag, an dem die Eintragung der Verschmelzung in das Register des Sitzes derjenigen Rechtsträger deren Gläubiger sie sind, nach § 19 Absatz 3 UmwG als bekanntgemacht gilt, ihren Anspruch nach Grund und Höhe schriftlich anmelden, Sicherheit zu leisten, soweit sie nicht Befriedigung verlangen können. Dieses Recht steht den Gläubigern jedoch nur zu, wenn sie glaubhaft machen, dass durch die Verschmelzung die Erfüllung ihrer Forderung gefährdet wird."
    },
    {
      "date": "2025-12-09",
      "id": "139554",
      "original_text": "Registerbekanntmachung nach dem Umwandlungsgesetz\nNordrhein-Westfalen Amtsgericht Köln HRA 25283\nFERCHAU Holding GmbH & Co. KG – Gummersbach",
      "type": "Registerbekanntmachung nach dem Umwandlungsgesetz",
      "state": "Nordrhein-Westfalen",
      "amtsgericht": "Amtsgericht Köln",
      "registernummer": "HRA 25283",
      "registerart": "HRA",
      "company_name": "FERCHAU Holding GmbH & Co. KG",
      "company_seat": "Gummersbach",
      "details": "09.12.2025 (Bekanntmachungsdatum)\n\nNordrhein-Westfalen Amtsgericht Köln HRA 25283\nRegisterbekanntmachung nach dem Umwandlungsgesetz 09.12.2025 (Eintragungsdatum)\n\nFERCHAU Holding GmbH & Co. KG\nKommanditgesellschaft\nGummersbach\n\nDen Gläubigern der an der formwechselnden Umwandlung beteiligten Rechtsträger ist, wenn sie binnen sechs Monaten nach dem Tag, an dem die Eintragung der formwechselnden Umwandlung in das Register des Sitzes desjenigen Rechtsträgers, dessen Gläubiger sie sind, nach § 19 Absatz 3 UmwG als bekanntgemacht gilt, ihren Anspruch nach Grund und Höhe schriftlich anmelden, Sicherheit zu leisten, soweit sie nicht Befriedigung verlangen können. Dieses Recht steht den Gläubigern jedoch nur zu, wenn sie glaubhaft machen, dass durch die formwechselnden Umwandlung die Erfüllung ihrer Forderung gefährdet wird."
    },
    {
      "date": "2025-12-09",
      "id": "139555",
      "original_text": "Löschungsankündigung\nNordrhein-Westfalen Amtsgericht Wuppertal HRB 24773\nAutohaus M. Westendorp GmbH – Wuppertal",
      "type": "Löschungsankündigung",
      "state": "Nordrhein-Westfalen",
      "amtsgericht": "Amtsgericht Wuppertal",
      "registernummer": "HRB 24773",
      "registerart": "HRB",
      "company_name": "Autohaus M. Westendorp GmbH",
      "company_seat": "Wuppertal",
      "details": "09.12.2025 (Bekanntmachungsdatum)\n\nNordrhein-Westfalen Amtsgericht Wuppertal HRB 24773\nLöschungsankündigung\n\nAutohaus M. Westendorp GmbH\nGesellschaft mit beschränkter Haftung\nWuppertal\n\nDas Registergericht beabsichtigt die Gesellschaft von Amts wegen nach § 394 FamFG zu löschen. Die Frist zur Erhebung eines Widerspruchs ist auf #DV.Fr(Text=\"Bitte wählen Sie die Widerspruchsfrist aus!\",Eingabe=\"einen Monat\",\"zwei Monate\",\"drei Monate\",\"#insert(Text=\"Freitext\")\"|\"freier Text\") festgesetzt."
    },
    {
      "date": "2025-12-09",
      "id": "139556",
      "original_text": "Einreichung neuer Dokumente\nNordrhein-Westfalen Amtsgericht Kleve HRB 7019\nImmobilienentwicklungs- und Wohnungsbaugesellschaft der Stadt Kamp-Lintfort mbH – Kamp-Lintfort",
      "type": "Einreichung neuer Dokumente",
      "state": "Nordrhein-Westfalen",
      "amtsgericht": "Amtsgericht Kleve",
      "registernummer": "HRB 7019",
      "registerart": "HRB",
      "company_name": "Immobilienentwicklungs- und Wohnungsbaugesellschaft der Stadt Kamp-Lintfort mbH",
      "company_seat": "Kamp-Lintfort",
      "details": "09.12.2025 (Bekanntmachungsdatum)\n\nNordrhein-Westfalen Amtsgericht Kleve HRB 7019\nEinreichung neuer Dokumente\n\nImmobilienentwicklungs- und Wohnungsbaugesellschaft der Stadt Kamp-Lintfort mbH\nGesellschaft mit beschränkter Haftung\nKamp-Lintfort\n\nDem Registergericht ist eine Liste der Mitglieder des Aufsichtsrates eingereicht worden."
    },
    {
      "date": "2025-12-09",
      "id": "139557",
      "original_text": "Einreichung neuer Dokumente\nNordrhein-Westfalen Amtsgericht Düsseldorf HRB 71360\nMount Street Portfolio Advisers GmbH – Düsseldorf",
      "type": "Einreichung neuer Dokumente",
      "state": "Nordrhein-Westfalen",
      "amtsgericht": "Amtsgericht Düsseldorf",
      "registernummer": "HRB 71360",
      "registerart": "HRB",
      "company_name": "Mount Street Portfolio Advisers GmbH",
      "company_seat": "Düsseldorf",
      "details": "09.12.2025 (Bekanntmachungsdatum)\n\nNordrhein-Westfalen Amtsgericht Düsseldorf HRB 71360\nEinreichung neuer Dokumente\n\nMount Street Portfolio Advisers GmbH\nGesellschaft mit beschränkter Haftung\nDüsseldorf\n\nDem Registergericht ist eine neue Liste der Mitglieder des Aufsichtsrates eingereicht worden."
    },
    {
      "date": "2025-12-09",
      "id": "139558",
      "original_text": "Löschungsankündigung\nNordrhein-Westfalen Amtsgericht Düren HRB 8778\nPure Nuts Impex GmbH – Düren",
      "type": "Löschungsankündigung",
      "state": "Nordrhein-Westfalen",
      "amtsgericht": "Amtsgericht Düren",
      "registernummer": "HRB 8778",
      "registerart": "HRB",
      "company_name": "Pure Nuts Impex GmbH",
      "company_seat": "Düren",
      "details": "09.12.2025 (Bekanntmachungsdatum)\n\nNordrhein-Westfalen Amtsgericht Düren HRB 8778\nLöschungsankündigung\n\nPure Nuts Impex GmbH\nGesellschaft mit beschränkter Haftung\nDüren\n\nDas Registergericht beabsichtigt die Gesellschaft von Amts wegen nach § 394 FamFG zu löschen. Die Frist zur Erhebung eines Widerspruchs ist auf drei Monate festgesetzt."
    },
    {
      "date": "2025-12-09",
      "id": "139559",
      "original_text": "Registerbekanntmachung nach dem Umwandlungsgesetz\nNordrhein-Westfalen Amtsgericht Iserlohn HRB 11485\nRasche Umformtechnik GmbH – Plettenberg",
      "type": "Registerbekanntmachung nach dem Umwandlungsgesetz",
      "state": "Nordrhein-Westfalen",
      "amtsgericht": "Amtsgericht Iserlohn",
      "registernummer": "HRB 11485",
      "registerart": "HRB",
      "company_name": "Rasche Umformtechnik GmbH",
      "company_seat": "Plettenberg",
      "details": "09.12.2025 (Bekanntmachungsdatum)\n\nNordrhein-Westfalen Amtsgericht Iserlohn HRB 11485\nRegisterbekanntmachung nach dem Umwandlungsgesetz 09.12.2025 (Eintragungsdatum)\n\nRasche Umformtechnik GmbH\nGesellschaft mit beschränkter Haftung\nPlettenberg\n\nDen Gläubigern der an der formwechselnden Umwandlung beteiligten Rechtsträger ist, wenn sie binnen sechs Monaten nach dem Tag, an dem die Eintragung der formwechselnden Umwandlung in das Register des Sitzes desjenigen Rechtsträgers, dessen Gläubiger sie sind, nach § 19 Absatz 3 UmwG als bekanntgemacht gilt, ihren Anspruch nach Grund und Höhe schriftlich anmelden, Sicherheit zu leisten, soweit sie nicht Befriedigung verlangen können. Dieses Recht steht den Gläubigern jedoch nur zu, wenn sie glaubhaft machen, dass durch die formwechselnden Umwandlung die Erfüllung ihrer Forderung gefährdet wird."
    },
    {
      "date": "2025-12-09",
      "id": "139560",
      "original_text": "Löschungsankündigung\nBremen Amtsgericht Bremen HRB 41670\nSOT GmbH – Bremen",
      "type": "Löschungsankündigung",
      "state": "Bremen",
      "amtsgericht": "Amtsgericht Bremen",
      "registernummer": "HRB 41670",
      "registerart": "HRB",
      "company_name": "SOT GmbH",
      "company_seat": "Bremen",
      "details": "09.12.2025 (Bekanntmachungsdatum)\n\nBremen Amtsgericht Bremen HRB 41670\nLöschungsankündigung\n\nSOT GmbH\nGesellschaft mit beschränkter Haftung\nBremen\n\nEs ist beabsichtigt die im Handelsregister eingetragene Gesellschaft von Amts wegen gemäß § 394 FamFG zu löschen. Gegen die Löschung kann beim AG Bremen schriftlich oder zu Protokoll der Geschäftsstelle Widerspruch eingelegt werden. Widerspruchsfrist 4 Wochen."
    },
    {
      "date": "2025-12-09",
      "id": "139561",
      "original_text": "Einreichung neuer Dokumente\nBremen Amtsgericht Bremen HRB 17148\nVerkehrsverbund Bremen/Niedersachsen GmbH (VBN) – Bremen",
      "type": "Einreichung neuer Dokumente",
      "state": "Bremen",
      "amtsgericht": "Amtsgericht Bremen",
      "registernummer": "HRB 17148",
      "registerart": "HRB",
      "company_name": "Verkehrsverbund Bremen/Niedersachsen GmbH (VBN)",
      "company_seat": "Bremen",
      "details": "09.12.2025 (Bekanntmachungsdatum)\n\nBremen Amtsgericht Bremen HRB 17148\nEinreichung neuer Dokumente\n\nVerkehrsverbund Bremen/Niedersachsen GmbH (VBN)\nGesellschaft mit beschränkter Haftung\nBremen\n\nAls nicht eingetragen wird veröffentlicht: Liste des Aufsichtsrats wurde eingereicht."
    },
    {
      "date": "2025-12-09",
      "id": "139562",
      "original_text": "Löschungsankündigung\nBremen Amtsgericht Bremen HRB 37799\nBCC Biser Consulting Connection GmbH – Bremen",
      "type": "Löschungsankündigung",
      "state": "Bremen",
      "amtsgericht": "Amtsgericht Bremen",
      "registernummer": "HRB 37799",
      "registerart": "HRB",
      "company_name": "BCC Biser Consulting Connection GmbH",
      "company_seat": "Bremen",
      "details": "09.12.2025 (Bekanntmachungsdatum)\n\nBremen Amtsgericht Bremen HRB 37799\nLöschungsankündigung\n\nBCC Biser Consulting Connection GmbH\nGesellschaft mit beschränkter Haftung\nBremen\n\nEs ist beabsichtigt die im Handelsregister eingetragene Gesellschaft von Amts wegen gemäß § 394 FamFG zu löschen. Gegen die Löschung kann beim AG Bremen schriftlich oder zu Protokoll der Geschäftsstelle Widerspruch eingelegt werden. Widerspruchsfrist 4 Wochen."
    },
    {
      "date": "2025-12-09",
      "id": "139563",
      "original_text": "Löschungsankündigung\nNordrhein-Westfalen Amtsgericht Bochum HRB 15625\nHa-Be Transporte GmbH – Witten",
      "type": "Löschungsankündigung",
      "state": "Nordrhein-Westfalen",
      "amtsgericht": "Amtsgericht Bochum",
      "registernummer": "HRB 15625",
      "registerart": "HRB",
      "company_name": "Ha-Be Transporte GmbH",
      "company_seat": "Witten",
      "details": "09.12.2025 (Bekanntmachungsdatum)\n\nNordrhein-Westfalen Amtsgericht Bochum HRB 15625\nLöschungsankündigung 10.12.2025 (Eintragungsdatum)\n\nHa-Be Transporte GmbH\nGesellschaft mit beschränkter Haftung\nWitten\n\nDas Registergericht beabsichtigt die Gesellschaft von Amts wegen nach § 394 FamFG zu löschen. Die Frist zur Erhebung eines Widerspruchs ist auf drei Monate festgesetzt."
    },
    {
      "date": "2025-12-09",
      "id": "139564",
      "original_text": "Löschungsankündigung\nNordrhein-Westfalen Amtsgericht Bochum HRB 15625\nHa-Be Transporte GmbH – Witten",
      "type": "Löschungsankündigung",
      "state": "Nordrhein-Westfalen",
      "amtsgericht": "Amtsgericht Bochum",
      "registernummer": "HRB 15625",
      "registerart": "HRB",
      "company_name": "Ha-Be Transporte GmbH",
      "company_seat": "Witten",
      "details": "09.12.2025 (Bekanntmachungsdatum)\n\nNordrhein-Westfalen Amtsgericht Bochum HRB 15625\nLöschungsankündigung 10.12.2025 (Eintragungsdatum)\n\nHa-Be Transporte GmbH\nGesellschaft mit beschränkter Haftung\nWitten\n\nDas Registergericht beabsichtigt die Gesellschaft von Amts wegen nach § 394 FamFG zu löschen. Die Frist zur Erhebung eines Widerspruchs ist auf drei Monate festgesetzt."
    },
    {
      "date": "2025-12-09",
      "id": "139565",
      "original_text": "Löschungsankündigung\nNordrhein-Westfalen Amtsgericht Krefeld HRB 11645\nKuBRé Automotive & Industrie Parts GmbH – Krefeld",
      "type": "Löschungsankündigung",
      "state": "Nordrhein-Westfalen",
      "amtsgericht": "Amtsgericht Krefeld",
      "registernummer": "HRB 11645",
      "registerart": "HRB",
      "company_name": "KuBRé Automotive & Industrie Parts GmbH",
      "company_seat": "Krefeld",
      "details": "09.12.2025 (Bekanntmachungsdatum)\n\nNordrhein-Westfalen Amtsgericht Krefeld HRB 11645\nLöschungsankündigung\n\nKuBRé Automotive & Industrie Parts GmbH\nGesellschaft mit beschränkter Haftung\nKrefeld\n\nDas Registergericht beabsichtigt die Gesellschaft von Amts wegen nach § 394 FamFG zu löschen. Die Frist zur Erhebung eines Widerspruchs ist auf einen Monat festgesetzt."
    },
    {
      "date": "2025-12-09",
      "id": "139566",
      "original_text": "Löschungsankündigung\nNordrhein-Westfalen Amtsgericht Siegen HRB 7646\ndemic TS GmbH – Siegen",
      "type": "Löschungsankündigung",
      "state": "Nordrhein-Westfalen",
      "amtsgericht": "Amtsgericht Siegen",
      "registernummer": "HRB 7646",
      "registerart": "HRB",
      "company_name": "demic TS GmbH",
      "company_seat": "Siegen",
      "details": "09.12.2025 (Bekanntmachungsdatum)\n\nNordrhein-Westfalen Amtsgericht Siegen HRB 7646\nLöschungsankündigung\n\ndemic TS GmbH\nGesellschaft mit beschränkter Haftung\nSiegen\n\nDas Registergericht beabsichtigt die Gesellschaft von Amts wegen nach § 394 FamFG zu löschen. Die Frist zur Erhebung eines Widerspruchs ist auf drei Monate festgesetzt."
    },
    {
      "date": "2025-12-09",
      "id": "139567",
      "original_text": "Einreichung neuer Dokumente\nNordrhein-Westfalen Amtsgericht Köln HRB 98792\nDHI Dorint Hospitality & Innovation GmbH – Köln",
      "type": "Einreichung neuer Dokumente",
      "state": "Nordrhein-Westfalen",
      "amtsgericht": "Amtsgericht Köln",
      "registernummer": "HRB 98792",
      "registerart": "HRB",
      "company_name": "DHI Dorint Hospitality & Innovation GmbH",
      "company_seat": "Köln",
      "details": "09.12.2025 (Bekanntmachungsdatum)\n\nNordrhein-Westfalen Amtsgericht Köln HRB 98792\nEinreichung neuer Dokumente\n\nDHI Dorint Hospitality & Innovation GmbH\nGesellschaft mit beschränkter Haftung\nKöln\n\nDem Registergericht ist eine Liste der Mitglieder des Aufsichtsrates eingereicht worden."
    },
    {
      "date": "2025-12-09",
      "id": "139568",
      "original_text": "Löschungsankündigung\nThüringen Amtsgericht Jena HRB 209455\nF & S Automobilchemie GmbH – Saalfeld/Saale",
      "type": "Löschungsankündigung",
      "state": "Thüringen",
      "amtsgericht": "Amtsgericht Jena",
      "registernummer": "HRB 209455",
      "registerart": "HRB",
      "company_name": "F & S Automobilchemie GmbH",
      "company_seat": "Saalfeld/Saale",
      "details": "09.12.2025 (Bekanntmachungsdatum)\n\nThüringen Amtsgericht Jena HRB 209455\nLöschungsankündigung 04.12.2025 (Eintragungsdatum)\n\nF & S Automobilchemie GmbH\nGesellschaft mit beschränkter Haftung\nSaalfeld/Saale\n\nDas Registergericht beabsichtigt, die im Handelsregister eingetragene Gesellschaft wegen Vermögenslosigkeit nach § 394 FamFG von Amts wegen zu löschen. Die Frist zur Erhebung eines Widerspruchs gegen die beabsichtigte Löschung wird auf 6 Wochen festgesetzt."
    },
    {
      "date": "2025-12-09",
      "id": "139569",
      "original_text": "Löschungsankündigung\nThüringen Amtsgericht Jena HRB 306348\nKerzenmanufaktur Fuldatal GmbH – Unterbreizbach",
      "type": "Löschungsankündigung",
      "state": "Thüringen",
      "amtsgericht": "Amtsgericht Jena",
      "registernummer": "HRB 306348",
      "registerart": "HRB",
      "company_name": "Kerzenmanufaktur Fuldatal GmbH",
      "company_seat": "Unterbreizbach",
      "details": "09.12.2025 (Bekanntmachungsdatum)\n\nThüringen Amtsgericht Jena HRB 306348\nLöschungsankündigung\n\nKerzenmanufaktur Fuldatal GmbH\nGesellschaft mit beschränkter Haftung\nUnterbreizbach\n\nDas Registergericht beabsichtigt, die im Handelsregister eingetragene Gesellschaft wegen Vermögenslosigkeit nach § 394 FamFG von Amts wegen zu löschen. Die Frist zur Erhebung eines Widerspruchs gegen die beabsichtigte Löschung wird auf 6 Wochen festgesetzt."
    },
    {
      "date": "2025-12-09",
      "id": "139570",
      "original_text": "Löschungsankündigung\nThüringen Amtsgericht Jena HRB 521318\nFocus Logistics UG (haftungsbeschränkt) – St. Gangloff",
      "type": "Löschungsankündigung",
      "state": "Thüringen",
      "amtsgericht": "Amtsgericht Jena",
      "registernummer": "HRB 521318",
      "registerart": "HRB",
      "company_name": "Focus Logistics UG (haftungsbeschränkt)",
      "company_seat": "St. Gangloff",
      "details": "09.12.2025 (Bekanntmachungsdatum)\n\nThüringen Amtsgericht Jena HRB 521318\nLöschungsankündigung\n\nFocus Logistics UG (haftungsbeschränkt)\nGesellschaft mit beschränkter Haftung\nSt. Gangloff\n\nDas Registergericht beabsichtigt, die im Handelsregister eingetragene Gesellschaft wegen Vermögenslosigkeit nach § 394 FamFG von Amts wegen zu löschen. Die Frist zur Erhebung eines Widerspruchs gegen die beabsichtigte Löschung wird auf 6 Wochen festgesetzt."
    },
    {
      "date": "2025-12-09",
      "id": "139571",
      "original_text": "Registerbekanntmachung nach dem Umwandlungsgesetz\nThüringen Amtsgericht Jena HRA 504080\nR34 GmbH & Co. KG – Erfurt",
      "type": "Registerbekanntmachung nach dem Umwandlungsgesetz",
      "state": "Thüringen",
      "amtsgericht": "Amtsgericht Jena",
      "registernummer": "HRA 504080",
      "registerart": "HRA",
      "company_name": "R34 GmbH & Co. KG",
      "company_seat": "Erfurt",
      "details": "09.12.2025 (Bekanntmachungsdatum)\n\nThüringen Amtsgericht Jena HRA 504080\nRegisterbekanntmachung nach dem Umwandlungsgesetz 09.12.2025 (Eintragungsdatum)\n\nR34 GmbH & Co. KG\nKommanditgesellschaft\nErfurt\n\nNicht eingetragen: Den Gläubigern des formwechselnden  Rechtsträgers, ist wenn sie binnen sechs Monaten nach dem Tag, an dem die Eintragung des Formwechsels nach § 201 UmwG als bekanntgemacht gilt, ihren Anspruch nach Grund und Höhe schriftlich anmelden, Sicherheit zu leisten, soweit sie nicht Befriedigung verlangen können. Dieses Recht steht ihnen jedoch nur zu, wenn sie glaubhaft machen, daß durch den Formwechsel die Erfüllung ihrer Forderung gefährdet wird."
    },
    {
      "date": "2025-12-09",
      "id": "139572",
      "original_text": "Registerbekanntmachung nach dem Umwandlungsgesetz\nThüringen Amtsgericht Jena HRB 517231\nWMZ Group GmbH – Grabfeld",
      "type": "Registerbekanntmachung nach dem Umwandlungsgesetz",
      "state": "Thüringen",
      "amtsgericht": "Amtsgericht Jena",
      "registernummer": "HRB 517231",
      "registerart": "HRB",
      "company_name": "WMZ Group GmbH",
      "company_seat": "Grabfeld",
      "details": "09.12.2025 (Bekanntmachungsdatum)\n\nThüringen Amtsgericht Jena HRB 517231\nRegisterbekanntmachung nach dem Umwandlungsgesetz 09.12.2025 (Eintragungsdatum)\n\nWMZ Group GmbH\nGesellschaft mit beschränkter Haftung\nGrabfeld\n\nNicht eingetragen: Den Gläubigern der an der Verschmelzung beteiligten Rechtsträger, ist wenn sie binnen sechs Monaten nach dem Tag, an dem die Eintragung der Verschmelzung in das Register des Sitzes desjenigen Rechtsträgers, dessen Gläubiger sie sind,  nach § 19 Abs. 3 UmwG als bekanntgemacht gilt, ihren Anspruch nach Grund und Höhe schriftlich anmelden, Sicherheit zu leisten, soweit sie nicht Befriedigung verlangen können. Dieses Recht steht ihnen jedoch nur zu, wenn sie glaubhaft machen, daß durch die Verschmelzung die Erfüllung ihrer Forderung gefährdet wird."
    },
    {
      "date": "2025-12-09",
      "id": "139573",
      "original_text": "Löschungsankündigung\nHessen Amtsgericht Frankfurt am Main HRB 109776\nE-CO Bau GmbH – Frankfurt am Main",
      "type": "Löschungsankündigung",
      "state": "Hessen",
      "amtsgericht": "Amtsgericht Frankfurt am Main",
      "registernummer": "HRB 109776",
      "registerart": "HRB",
      "company_name": "E-CO Bau GmbH",
      "company_seat": "Frankfurt am Main",
      "details": "09.12.2025 (Bekanntmachungsdatum)\n\nHessen Amtsgericht Frankfurt am Main HRB 109776\nLöschungsankündigung\n\nE-CO Bau GmbH\nGesellschaft mit beschränkter Haftung\nFrankfurt am Main\n\nDas Registergericht beabsichtigt die im Handelsregister eingetragene Gesellschaft von Amts wegen nach § 394 FamFG zu löschen. Die Frist zur Erhebung eines Widerspruchs gegen die beabsichtigte Löschung wird auf 1 Monate festgesetzt."
    },
    {
      "date": "2025-12-09",
      "id": "139574",
      "original_text": "Registerbekanntmachung nach dem Umwandlungsgesetz\nHessen Amtsgericht Fulda HRB 8837\nLUQOM Holding GmbH – Fulda",
      "type": "Registerbekanntmachung nach dem Umwandlungsgesetz",
      "state": "Hessen",
      "amtsgericht": "Amtsgericht Fulda",
      "registernummer": "HRB 8837",
      "registerart": "HRB",
      "company_name": "LUQOM Holding GmbH",
      "company_seat": "Fulda",
      "details": "09.12.2025 (Bekanntmachungsdatum)\n\nHessen Amtsgericht Fulda HRB 8837\nRegisterbekanntmachung nach dem Umwandlungsgesetz 09.12.2025 (Eintragungsdatum)\n\nLUQOM Holding GmbH\nGesellschaft mit beschränkter Haftung\nFulda\n\nDen Gläubigern der an der Verschmelzung beteiligten Rechtsträger ist, wenn sie binnen sechs Monaten nach dem Tag, an dem die Eintragung der Verschmelzung in das Register des Sitzes desjenigen Rechtsträgers, dessen Gläubiger sie sind, nach § 19 Absatz 3 UmwG bekannt gemacht worden ist, ihren Anspruch nach Grund und Höhe schriftlich anmelden, Sicherheit zu leisten, soweit sie nicht Befriedigung verlangen können. Dieses Recht steht den Gläubigern jedoch nur zu, wenn sie glaubhaft machen, dass durch die Verschmelzung die Erfüllung ihrer Forderung gefährdet wird."
    },
    {
      "date": "2025-12-09",
      "id": "139575",
      "original_text": "Löschungsankündigung\nHessen Amtsgericht Frankfurt am Main HRB 104046\nVERIANOS Advisory GmbH – Frankfurt am Main",
      "type": "Löschungsankündigung",
      "state": "Hessen",
      "amtsgericht": "Amtsgericht Frankfurt am Main",
      "registernummer": "HRB 104046",
      "registerart": "HRB",
      "company_name": "VERIANOS Advisory GmbH",
      "company_seat": "Frankfurt am Main",
      "details": "09.12.2025 (Bekanntmachungsdatum)\n\nHessen Amtsgericht Frankfurt am Main HRB 104046\nLöschungsankündigung\n\nVERIANOS Advisory GmbH\nGesellschaft mit beschränkter Haftung\nFrankfurt am Main\n\nEs ist beabsichtigt die Gesellschaft wegen Vermögenslosigkeit gemäß § 394 FamFG von Amts wegen zu löschen. Hiergegen kann innerhalb eines Monats nach dieser Veröffentlichung Widerspruch bei dem Amtsgericht Frankfurt am Main eingelegt werden."
    },
    {
      "date": "2025-12-09",
      "id": "139576",
      "original_text": "Registerbekanntmachung nach dem Umwandlungsgesetz\nHessen Amtsgericht Bad Homburg v.d.H. HRB 15700\nEndreß Ingenieurgesellschaft mbH Brandschutzsachverständige – Bad Homburg v. d. Höhe",
      "type": "Registerbekanntmachung nach dem Umwandlungsgesetz",
      "state": "Hessen",
      "amtsgericht": "Amtsgericht Bad Homburg v.d.H.",
      "registernummer": "HRB 15700",
      "registerart": "HRB",
      "company_name": "Endreß Ingenieurgesellschaft mbH Brandschutzsachverständige",
      "company_seat": "Bad Homburg v. d. Höhe",
      "details": "09.12.2025 (Bekanntmachungsdatum)\n\nHessen Amtsgericht Bad Homburg v.d.H. HRB 15700\nRegisterbekanntmachung nach dem Umwandlungsgesetz 09.12.2025 (Eintragungsdatum)\n\nEndreß Ingenieurgesellschaft mbH Brandschutzsachverständige\nGesellschaft mit beschränkter Haftung\nBad Homburg v. d. Höhe\n\nDen Gläubigern der an der Verschmelzung beteiligten Rechtsträger ist, wenn sie binnen sechs Monaten nach dem Tag, an dem die Eintragung der Verschmelzung in das Register des Sitzes desjenigen Rechtsträgers, dessen Gläubiger sie sind, nach § 19 Absatz 3 UmwG bekannt gemacht worden ist, ihren Anspruch nach Grund und Höhe schriftlich anmelden, Sicherheit zu leisten, soweit sie nicht Befriedigung verlangen können. Dieses Recht steht den Gläubigern jedoch nur zu, wenn sie glaubhaft machen, dass durch die Verschmelzung die Erfüllung ihrer Forderung gefährdet wird."
    },
    {
      "date": "2025-12-09",
      "id": "139577",
      "original_text": "Einreichung neuer Dokumente\nHessen Amtsgericht Hanau HRB 94473\nNORMA Group SE – Maintal",
      "type": "Einreichung neuer Dokumente",
      "state": "Hessen",
      "amtsgericht": "Amtsgericht Hanau",
      "registernummer": "HRB 94473",
      "registerart": "HRB",
      "company_name": "NORMA Group SE",
      "company_seat": "Maintal",
      "details": "09.12.2025 (Bekanntmachungsdatum)\n\nHessen Amtsgericht Hanau HRB 94473\nEinreichung neuer Dokumente\n\nNORMA Group SE\nEuropäische Aktiengesellschaft (SE)\nMaintal\n\nDurch eine Änderung in den Personen der Aufsichtsratsmitglieder ist eine Liste der Mitglieder des Aufsichtsrates zum Handelsregister eingereicht worden."
    },
    {
      "date": "2025-12-09",
      "id": "139578",
      "original_text": "Registerbekanntmachung nach dem Umwandlungsgesetz\nHessen Amtsgericht Offenbach am Main HRA 43543\nFahrschule Boost e.K. – Offenbach am Main",
      "type": "Registerbekanntmachung nach dem Umwandlungsgesetz",
      "state": "Hessen",
      "amtsgericht": "Amtsgericht Offenbach am Main",
      "registernummer": "HRA 43543",
      "registerart": "HRA",
      "company_name": "Fahrschule Boost e.K.",
      "company_seat": "Offenbach am Main",
      "details": "09.12.2025 (Bekanntmachungsdatum)\n\nHessen Amtsgericht Offenbach am Main HRA 43543\nRegisterbekanntmachung nach dem Umwandlungsgesetz 09.12.2025 (Eintragungsdatum)\n\nFahrschule Boost e.K.\nEinzelkaufmann / Einzelkauffrau\nOffenbach am Main\n\nDen Gläubigern der an der Ausgliederung beteiligten Rechtsträger ist, wenn sie binnen sechs Monaten nach dem Tag, an dem die Eintragung der Ausgliederung in das Register des Sitzes desjenigen Rechtsträgers, dessen Gläubiger sie sind, nach §§ 125, 19 Absatz 3 UmwG bekannt gemacht worden ist, ihren Anspruch nach Grund und Höhe schriftlich anmelden, Sicherheit zu leisten, soweit sie nicht Befriedigung verlangen können. Dieses Recht steht den Gläubigern jedoch nur zu, wenn sie glaubhaft machen, dass durch die Ausgliederung die Erfüllung ihrer Forderung gefährdet wird."
    },
    {
      "date": "2025-12-09",
      "id": "139579",
      "original_text": "Löschungsankündigung\nHessen Amtsgericht Gießen HRB 8850\nJann Systembau GmbH – Grünberg",
      "type": "Löschungsankündigung",
      "state": "Hessen",
      "amtsgericht": "Amtsgericht Gießen",
      "registernummer": "HRB 8850",
      "registerart": "HRB",
      "company_name": "Jann Systembau GmbH",
      "company_seat": "Grünberg",
      "details": "09.12.2025 (Bekanntmachungsdatum)\n\nHessen Amtsgericht Gießen HRB 8850\nLöschungsankündigung\n\nJann Systembau GmbH\nGesellschaft mit beschränkter Haftung\nGrünberg\n\nEs ist beabsichtigt, die Gesellschaft wegen Vermögenslosigkeit gemäß § 394 FamFG von Amts wegen zu löschen. Hiergegen kann innerhalb von drei Monaten nach dieser Veröffentlichung Widerspruch beim Amtsgericht Gießen eingelegt werden. Sollte Widerspruch eingelegt werden, dürfte dies nur mit Begründung erfolgversprechend sein. Insbesondere sollte vorhandenes Vermögen der Gesellschaft innerhalb der genannten Frist nachgewiesen werden."
    },
    {
      "date": "2025-12-09",
      "id": "139580",
      "original_text": "Löschungsankündigung\nHessen Amtsgericht Offenbach am Main HRB 45618\nG & P Projekt GmbH – Dreieich",
      "type": "Löschungsankündigung",
      "state": "Hessen",
      "amtsgericht": "Amtsgericht Offenbach am Main",
      "registernummer": "HRB 45618",
      "registerart": "HRB",
      "company_name": "G & P Projekt GmbH",
      "company_seat": "Dreieich",
      "details": "09.12.2025 (Bekanntmachungsdatum)\n\nHessen Amtsgericht Offenbach am Main HRB 45618\nLöschungsankündigung\n\nG & P Projekt GmbH\nGesellschaft mit beschränkter Haftung\nDreieich\n\nDas Registergericht beabsichtigt die im Handelsregister eingetragene Gesellschaft von Amts wegen nach § 394 FamFG zu löschen. Die Frist zur Erhebung eines Widerspruchs gegen die beabsichtigte Löschung wird auf 3 Monate festgesetzt."
    },
    {
      "date": "2025-12-09",
      "id": "139581",
      "original_text": "Registerbekanntmachung nach dem Umwandlungsgesetz\nHessen Amtsgericht Offenbach am Main HRB 58209\nFahrschule Boost und Bildungszentrum GmbH – Offenbach am Main",
      "type": "Registerbekanntmachung nach dem Umwandlungsgesetz",
      "state": "Hessen",
      "amtsgericht": "Amtsgericht Offenbach am Main",
      "registernummer": "HRB 58209",
      "registerart": "HRB",
      "company_name": "Fahrschule Boost und Bildungszentrum GmbH",
      "company_seat": "Offenbach am Main",
      "details": "09.12.2025 (Bekanntmachungsdatum)\n\nHessen Amtsgericht Offenbach am Main HRB 58209\nRegisterbekanntmachung nach dem Umwandlungsgesetz 09.12.2025 (Eintragungsdatum)\n\nFahrschule Boost und Bildungszentrum GmbH\nGesellschaft mit beschränkter Haftung\nOffenbach am Main\n\nDen Gläubigern der an der Ausgliederung beteiligten Rechtsträger ist, wenn sie binnen sechs Monaten nach dem Tag, an dem die Eintragung der Ausgliederung in das Register des Sitzes desjenigen Rechtsträgers, dessen Gläubiger sie sind, nach §§ 125, 19 Absatz 3 UmwG bekannt gemacht worden ist, ihren Anspruch nach Grund und Höhe schriftlich anmelden, Sicherheit zu leisten, soweit sie nicht Befriedigung verlangen können. Dieses Recht steht den Gläubigern jedoch nur zu, wenn sie glaubhaft machen, dass durch die Ausgliederung die Erfüllung ihrer Forderung gefährdet wird."
    }
  ]
}