{
  "date": "2025-12-29",
  "date_of_scrape": "2025-12-30T04:21:51.887Z",
  "tool_version": "0.2.0",
  "number_of_announcements": 112,
  "announcements": [
    {
      "date": "2025-12-29",
      "id": "141037",
      "original_text": "Registerbekanntmachung nach dem Umwandlungsgesetz\nBerlin Amtsgericht Berlin (Charlottenburg) HRB 136865\nProjekt Itaca GmbH – Berlin",
      "type": "Registerbekanntmachung nach dem Umwandlungsgesetz",
      "state": "Berlin",
      "amtsgericht": "Amtsgericht Berlin (Charlottenburg)",
      "registernummer": "HRB 136865",
      "registerart": "HRB",
      "company_name": "Projekt Itaca GmbH",
      "company_seat": "Berlin",
      "details": "29.12.2025 (Bekanntmachungsdatum)\n\nBerlin Amtsgericht Berlin (Charlottenburg) HRB 136865\nRegisterbekanntmachung nach dem Umwandlungsgesetz\n\nProjekt Itaca GmbH\nGesellschaft mit beschränkter Haftung\nBerlin\n\nAls nicht eingetragen wird veröffentlicht:\n\nDie Gesellschaft hat den Entwurf des Formwechselplans betreffend den grenzüberschreitenden Formwechsel im Wege des Herausformwechsels ohne Abwicklung und Auflösung von einer deutschen GmbH in eine reine societe responsabilite limitee (S.a.r.l)  luxemburgischen Rechts mit gleichzeitiger Verlegung des Satzungssitzes nach Luxemburg, Großherzogtum Luxemburg,\nbeim Handelsregister des Amtsgerichts Charlottenburg gemäß § 336 UmwG in Verbindung mit § 308 Abs. 1 Satz 2 Nr. 1 UmwG\neingereicht.\nAn dem grenzüberschreitenden Formwechsel ist die Projekt Itaca GmbH mit Satzungssitz in Berlin, Deutschland, eine nach deutschem Recht bestehende Gesellschaft mit beschränkter Haftung, beteiligt.\nNach dem grenzüberschreitenden Formwechsel wird die Gesellschaft die Rechtsform einer reinen Societe a responsabilite limitee (S.a.r.l.), eine Gesellschaft mit beschränkter Haftung nach dem Recht des Großherzogtums Luxemburg annehmen und als Projekt Itaca S.a.r.l. mit Satzungssitz in Luxemburg, Großherzogtum Luxemburg firmieren.\nDie Gesellschaft ist im Handelsregister des Amtsgerichts Charlottenburg unter der Handelsregisternummer HRB 136865 B eingetragen.\nDie Gesellschaft ist zudem im Handels- und Gesellschaftsregister von Luxemburg (Registre de commerce et des societes Luxembourg) unter der Nummer B231977 eingetragen, welche auch künftig fortbestehen wird.\nDie Gesellschafterversammlung zum Beschluss des grenzüberschreitenden Formwechsels ist für den Tag geplant, der auf den Ablauf von einem Monat nach dem Tag der Registerbekanntmachung des Formwechselplans folgt, oder ggfs. den nächsten Arbeitstag (wobei Samstage, Sonntage und bundesweite Feiertage nicht als Arbeitstage zählen).\nDie Anteilsinhaber und die Gläubiger der Gesellschaft erhalten den Hinweis, dass sie spätestens fünf Arbeitstage vor dem Tag der Gesellschafterversammlung der Gesellschaft Bemerkungen zum Formwechselplan übermitteln können.\nEinen Betriebsrat gibt es nicht, die Gesellschaft hat keine Arbeitnehmer. Der guten Ordnung halber erfolgt gleichwohl der Hinweis, dass die zuständigen Betriebsräte der Gesellschaft oder, soweit es keinen Betriebsrat gibt, die Arbeitnehmer der Gesellschaft, spätestens fünf Arbeitstage vor dem Tag der Gesellschafterversammlung der Gesellschaft Bemrkungen zum Formwechselplan übermitteln können."
    },
    {
      "date": "2025-12-29",
      "id": "141038",
      "original_text": "Registerbekanntmachung nach dem Umwandlungsgesetz\nSchleswig-Holstein Amtsgericht Flensburg HRA 9388\nLübke Lasertechnik GmbH & Co. KG – Handewitt",
      "type": "Registerbekanntmachung nach dem Umwandlungsgesetz",
      "state": "Schleswig-Holstein",
      "amtsgericht": "Amtsgericht Flensburg",
      "registernummer": "HRA 9388",
      "registerart": "HRA",
      "company_name": "Lübke Lasertechnik GmbH & Co. KG",
      "company_seat": "Handewitt",
      "details": "29.12.2025 (Bekanntmachungsdatum)\n\nSchleswig-Holstein Amtsgericht Flensburg HRA 9388\nRegisterbekanntmachung nach dem Umwandlungsgesetz 23.12.2025 (Eintragungsdatum)\n\nLübke Lasertechnik GmbH & Co. KG\nKommanditgesellschaft\nHandewitt\n\nZu Eintragungsnummer 6 vom 23.12.2025 wird als nicht eingetragen veröffentlicht: Den Gläubigern der an der Verschmelzung beteiligten Rechtsträger ist, wenn sie binnen sechs Monaten nach dem Tag, an dem die Eintragung der Verschmelzung in das Register des Sitzes desjenigen Rechtsträgers, dessen Gläubiger sie sind, als bekannt gemacht gilt, ihren Anspruch nach Grund und Höhe schriftlich anmelden, Sicherheit zu leisten, soweit sie nicht Befriedigung verlangen können. Dieses Recht steht den Gläubigern jedoch nur zu, wenn sie glaubhaft machen, dass durch die Verschmelzung die Erfüllung ihrer Forderung gefährdet wird. Das Recht, Sicherheitsleistung zu verlangen, steht Gläubigern nicht zu, die im Falle der Insolvenz ein Recht auf vorzugsweise Befriedigung aus einer Deckungsmasse haben, die nach gesetzlicher Vorschrift zu ihrem Schutz errichtet und staatlich überwacht ist."
    },
    {
      "date": "2025-12-29",
      "id": "141039",
      "original_text": "Sonstige Registerbekanntmachung\nBaden-Württemberg Amtsgericht Stuttgart HRB 727364\nDEHOGA Beratung GmbH – Stuttgart",
      "type": "Sonstige Registerbekanntmachung",
      "state": "Baden-Württemberg",
      "amtsgericht": "Amtsgericht Stuttgart",
      "registernummer": "HRB 727364",
      "registerart": "HRB",
      "company_name": "DEHOGA Beratung GmbH",
      "company_seat": "Stuttgart",
      "details": "29.12.2025 (Bekanntmachungsdatum)\n\nBaden-Württemberg Amtsgericht Stuttgart HRB 727364\nSonstige Registerbekanntmachung\n\nDEHOGA Beratung GmbH\nGesellschaft mit beschränkter Haftung\nStuttgart\n\nDie Gesellschaft hat am 22.12.2025 die Liste über die Zusammensetzung des Aufsichtsrats zum Handelsregister eingereicht."
    },
    {
      "date": "2025-12-29",
      "id": "141040",
      "original_text": "Löschungsankündigung\nBerlin Amtsgericht Berlin (Charlottenburg) HRB 190053\nBogelgroup GmbH – Berlin",
      "type": "Löschungsankündigung",
      "state": "Berlin",
      "amtsgericht": "Amtsgericht Berlin (Charlottenburg)",
      "registernummer": "HRB 190053",
      "registerart": "HRB",
      "company_name": "Bogelgroup GmbH",
      "company_seat": "Berlin",
      "details": "29.12.2025 (Bekanntmachungsdatum)\n\nBerlin Amtsgericht Berlin (Charlottenburg) HRB 190053\nLöschungsankündigung\n\nBogelgroup GmbH\nGesellschaft mit beschränkter Haftung\nBerlin\n\nBei der nachstehenden Gesellschaft wird das Amtslöschungsverfahren gemäß § 394 FamFG eingeleitet. Widerspruchsfrist 6 Wochen"
    },
    {
      "date": "2025-12-29",
      "id": "141041",
      "original_text": "Löschungsankündigung\nBerlin Amtsgericht Berlin (Charlottenburg) HRB 231049\nIOS Consulting UG (haftungsbeschränkt) – Berlin",
      "type": "Löschungsankündigung",
      "state": "Berlin",
      "amtsgericht": "Amtsgericht Berlin (Charlottenburg)",
      "registernummer": "HRB 231049",
      "registerart": "HRB",
      "company_name": "IOS Consulting UG (haftungsbeschränkt)",
      "company_seat": "Berlin",
      "details": "29.12.2025 (Bekanntmachungsdatum)\n\nBerlin Amtsgericht Berlin (Charlottenburg) HRB 231049\nLöschungsankündigung\n\nIOS Consulting UG (haftungsbeschränkt)\nGesellschaft mit beschränkter Haftung\nBerlin\n\nBei der nachstehenden Gesellschaft wird das Amtslöschungsverfahren gemäß § 394 FamFG eingeleitet. Widerspruchsfrist 6 Wochen"
    },
    {
      "date": "2025-12-29",
      "id": "141042",
      "original_text": "Einreichung neuer Dokumente\nSachsen-Anhalt Amtsgericht Stendal HRB 33773\nBenefits-Manager AG – Magdeburg",
      "type": "Einreichung neuer Dokumente",
      "state": "Sachsen-Anhalt",
      "amtsgericht": "Amtsgericht Stendal",
      "registernummer": "HRB 33773",
      "registerart": "HRB",
      "company_name": "Benefits-Manager AG",
      "company_seat": "Magdeburg",
      "details": "29.12.2025 (Bekanntmachungsdatum)\n\nSachsen-Anhalt Amtsgericht Stendal HRB 33773\nEinreichung neuer Dokumente\n\nBenefits-Manager AG\nAktiengesellschaft\nMagdeburg\n\nEine Liste der Mitglieder des Aufsichtsrates wurde zum Handelsregister eingereicht."
    },
    {
      "date": "2025-12-29",
      "id": "141043",
      "original_text": "Sonstige Registerbekanntmachung\nBaden-Württemberg Amtsgericht Stuttgart HRB 264602\nSchreurs Tools GmbH – Kernen im Remstal",
      "type": "Sonstige Registerbekanntmachung",
      "state": "Baden-Württemberg",
      "amtsgericht": "Amtsgericht Stuttgart",
      "registernummer": "HRB 264602",
      "registerart": "HRB",
      "company_name": "Schreurs Tools GmbH",
      "company_seat": "Kernen im Remstal",
      "details": "29.12.2025 (Bekanntmachungsdatum)\n\nBaden-Württemberg Amtsgericht Stuttgart HRB 264602\nSonstige Registerbekanntmachung 29.12.2025 (Eintragungsdatum)\n\nSchreurs Tools GmbH\nGesellschaft mit beschränkter Haftung\nKernen im Remstal\n\nDen Gläubigern der Gesellschaft, deren Forderungen begründet worden sind, bevor die Eintragung der Beendigung des Vertrages in das Handelsregister nach § 10 HGB als bekanntgemacht gilt, ist vom anderen Vertragsteil Sicherheit zu leisten, wenn sie sich binnen sechs Monaten nach der Bekanntmachung zu diesem Zweck bei ihm melden."
    },
    {
      "date": "2025-12-29",
      "id": "141044",
      "original_text": "Sonstige Registerbekanntmachung\nBerlin Amtsgericht Berlin (Charlottenburg) HRB 234032\nPatient 21 SE – Berlin",
      "type": "Sonstige Registerbekanntmachung",
      "state": "Berlin",
      "amtsgericht": "Amtsgericht Berlin (Charlottenburg)",
      "registernummer": "HRB 234032",
      "registerart": "HRB",
      "company_name": "Patient 21 SE",
      "company_seat": "Berlin",
      "details": "29.12.2025 (Bekanntmachungsdatum)\n\nBerlin Amtsgericht Berlin (Charlottenburg) HRB 234032\nSonstige Registerbekanntmachung\n\nPatient 21 SE\nEuropäische Aktiengesellschaft (SE)\nBerlin\n\nAls nicht eingetragen wird veröffentlicht:Es wurde eine neue Liste der Aufsichtsratsmitglieder eingereicht (§ 106 AktG)."
    },
    {
      "date": "2025-12-29",
      "id": "141045",
      "original_text": "Registerbekanntmachung nach dem Umwandlungsgesetz\nBrandenburg Amtsgericht Neuruppin HRB 11735\nHAI Fuels Shares GmbH – Schwedt/Oder",
      "type": "Registerbekanntmachung nach dem Umwandlungsgesetz",
      "state": "Brandenburg",
      "amtsgericht": "Amtsgericht Neuruppin",
      "registernummer": "HRB 11735",
      "registerart": "HRB",
      "company_name": "HAI Fuels Shares GmbH",
      "company_seat": "Schwedt/Oder",
      "details": "29.12.2025 (Bekanntmachungsdatum)\n\nBrandenburg Amtsgericht Neuruppin HRB 11735\nRegisterbekanntmachung nach dem Umwandlungsgesetz 23.12.2025 (Eintragungsdatum)\n\nHAI Fuels Shares GmbH\nGesellschaft mit beschränkter Haftung\nSchwedt/Oder\n\nZu Eintragungsnummer 3 vom 23.12.2025 wird als nicht eingetragen veröffentlicht:\nDen Gläubigern der an der Vershmelzung beteiligten Rechtsträger ist, wenn sie binnen sechs Monaten nach dem Tag, an dem die Eintragung der Verschmelzung in das Register des Sitzes desjenigen Rechtsträgers, dessen Gläubiger sie sind, als bekannt gemacht gilt, ihren Anspruch nach Grund und Höhe schriftlich anmelden, Sicherheit zu leisten, soweit sie nicht Befriedigung verlangen können. Dieses Recht steht den Gläubigern jedoch nur zu, wenn sie glaubhaft machen, dass durch die Verschmelzung die Erfüllung ihrer Forderung gefährdet wird"
    },
    {
      "date": "2025-12-29",
      "id": "141046",
      "original_text": "Einreichung neuer Dokumente\nBrandenburg Amtsgericht Neuruppin HRB 4999\nco:bios Innovation GmbH – Hennigsdorf",
      "type": "Einreichung neuer Dokumente",
      "state": "Brandenburg",
      "amtsgericht": "Amtsgericht Neuruppin",
      "registernummer": "HRB 4999",
      "registerart": "HRB",
      "company_name": "co:bios Innovation GmbH",
      "company_seat": "Hennigsdorf",
      "details": "29.12.2025 (Bekanntmachungsdatum)\n\nBrandenburg Amtsgericht Neuruppin HRB 4999\nEinreichung neuer Dokumente\n\nco:bios Innovation GmbH\nGesellschaft mit beschränkter Haftung\nHennigsdorf\n\nAls nicht eingetragen wird veröffentlicht: Eine Liste der Mitglieder des Aufsichtsrates wurde zum Handelsregister eingereicht."
    },
    {
      "date": "2025-12-29",
      "id": "141047",
      "original_text": "Sonstige Registerbekanntmachung\nHamburg Amtsgericht Hamburg HRB 99926\nEurofins Product Testing Verwaltungs GmbH – Hamburg",
      "type": "Sonstige Registerbekanntmachung",
      "state": "Hamburg",
      "amtsgericht": "Amtsgericht Hamburg",
      "registernummer": "HRB 99926",
      "registerart": "HRB",
      "company_name": "Eurofins Product Testing Verwaltungs GmbH",
      "company_seat": "Hamburg",
      "details": "29.12.2025 (Bekanntmachungsdatum)\n\nHamburg Amtsgericht Hamburg HRB 99926\nSonstige Registerbekanntmachung 29.12.2025 (Eintragungsdatum)\n\nEurofins Product Testing Verwaltungs GmbH\nGesellschaft mit beschränkter Haftung\nHamburg\n\nAls nicht eingetragen wird bekannt gemacht:  Den Gläubigern der Gesellschaft, deren Forderungen begründet worden sind, bevor die Eintragung der Vertragsbeendigung in das Handelsregister nach § 10 HGB als bekannt gemacht gilt, ist vom anderen Vertragsteil Sicherheit zu leisten, wenn sie sich binnen 6 Monaten nach Bekanntmachung der Eintragung zu diesem Zweck bei ihm melden."
    },
    {
      "date": "2025-12-29",
      "id": "141048",
      "original_text": "Löschungsankündigung\nSchleswig-Holstein Amtsgericht Flensburg HRB 10213\nLiquid Fruit GmbH – Flensburg",
      "type": "Löschungsankündigung",
      "state": "Schleswig-Holstein",
      "amtsgericht": "Amtsgericht Flensburg",
      "registernummer": "HRB 10213",
      "registerart": "HRB",
      "company_name": "Liquid Fruit GmbH",
      "company_seat": "Flensburg",
      "details": "29.12.2025 (Bekanntmachungsdatum)\n\nSchleswig-Holstein Amtsgericht Flensburg HRB 10213\nLöschungsankündigung\n\nLiquid Fruit GmbH\nGesellschaft mit beschränkter Haftung\nFlensburg\n\nEs ist die Löschung der nachstehenden Gesellschaft wegen Vermögenslosigkeit gemäß § 394 FamFG von Amts wegen beabsichtigt.\nWiderspruchsfrist: 2 Monate"
    },
    {
      "date": "2025-12-29",
      "id": "141049",
      "original_text": "Einreichung neuer Dokumente\nSaarland Amtsgericht Saarbrücken HRB 12702\nEnergie SaarLorLux AG – Saarbrücken",
      "type": "Einreichung neuer Dokumente",
      "state": "Saarland",
      "amtsgericht": "Amtsgericht Saarbrücken",
      "registernummer": "HRB 12702",
      "registerart": "HRB",
      "company_name": "Energie SaarLorLux AG",
      "company_seat": "Saarbrücken",
      "details": "29.12.2025 (Bekanntmachungsdatum)\n\nSaarland Amtsgericht Saarbrücken HRB 12702\nEinreichung neuer Dokumente\n\nEnergie SaarLorLux AG\nAktiengesellschaft\nSaarbrücken\n\nDer Vorstand der Gesellschaft hat eine Liste der Mitglieder des Aufsichtsrats zum Handelsregister eingereicht (§ 106 AktG)."
    },
    {
      "date": "2025-12-29",
      "id": "141050",
      "original_text": "Löschungsankündigung\nBerlin Amtsgericht Berlin (Charlottenburg) HRB 239791\nKAMILO Personalmanagement UG (haftungsbeschränkt) – Berlin",
      "type": "Löschungsankündigung",
      "state": "Berlin",
      "amtsgericht": "Amtsgericht Berlin (Charlottenburg)",
      "registernummer": "HRB 239791",
      "registerart": "HRB",
      "company_name": "KAMILO Personalmanagement UG (haftungsbeschränkt)",
      "company_seat": "Berlin",
      "details": "29.12.2025 (Bekanntmachungsdatum)\n\nBerlin Amtsgericht Berlin (Charlottenburg) HRB 239791\nLöschungsankündigung\n\nKAMILO Personalmanagement UG (haftungsbeschränkt)\nGesellschaft mit beschränkter Haftung\nBerlin\n\nBei der nachstehenden Gesellschaft wird das Amtslöschungsverfahren gemäß § 394 FamFG eingeleitet. Widerspruchsfrist 6 Wochen"
    },
    {
      "date": "2025-12-29",
      "id": "141051",
      "original_text": "Löschungsankündigung\nBrandenburg Amtsgericht Potsdam HRB 30692\nfat-Bau GmbH – Falkensee",
      "type": "Löschungsankündigung",
      "state": "Brandenburg",
      "amtsgericht": "Amtsgericht Potsdam",
      "registernummer": "HRB 30692",
      "registerart": "HRB",
      "company_name": "fat-Bau GmbH",
      "company_seat": "Falkensee",
      "details": "29.12.2025 (Bekanntmachungsdatum)\n\nBrandenburg Amtsgericht Potsdam HRB 30692\nLöschungsankündigung\n\nfat-Bau GmbH\nGesellschaft mit beschränkter Haftung\nFalkensee\n\nBei der nachstehenden Gesellschaft wird das Amtslöschungsverfahren gemäß § 394 FamFG eingeleitet. Widerspruchsfrist: 8 Wochen"
    },
    {
      "date": "2025-12-29",
      "id": "141052",
      "original_text": "Einreichung neuer Dokumente\nBaden-Württemberg Amtsgericht Freiburg HRB 732627\nStadtwerke Mobilität GmbH – Radolfzell am Bodensee",
      "type": "Einreichung neuer Dokumente",
      "state": "Baden-Württemberg",
      "amtsgericht": "Amtsgericht Freiburg",
      "registernummer": "HRB 732627",
      "registerart": "HRB",
      "company_name": "Stadtwerke Mobilität GmbH",
      "company_seat": "Radolfzell am Bodensee",
      "details": "29.12.2025 (Bekanntmachungsdatum)\n\nBaden-Württemberg Amtsgericht Freiburg HRB 732627\nEinreichung neuer Dokumente\n\nStadtwerke Mobilität GmbH\nGesellschaft mit beschränkter Haftung\nRadolfzell am Bodensee\n\nDie Gesellschaft hat am 23.12.2025 die Liste über die Zusammensetzung des Aufsichtsrats zum Handelsregister eingereicht."
    },
    {
      "date": "2025-12-29",
      "id": "141053",
      "original_text": "Sonstige Registerbekanntmachung\nBaden-Württemberg Amtsgericht Mannheim HRB 756789\nEnergie Friolzheim GmbH – Friolzheim",
      "type": "Sonstige Registerbekanntmachung",
      "state": "Baden-Württemberg",
      "amtsgericht": "Amtsgericht Mannheim",
      "registernummer": "HRB 756789",
      "registerart": "HRB",
      "company_name": "Energie Friolzheim GmbH",
      "company_seat": "Friolzheim",
      "details": "29.12.2025 (Bekanntmachungsdatum)\n\nBaden-Württemberg Amtsgericht Mannheim HRB 756789\nSonstige Registerbekanntmachung 29.12.2025 (Eintragungsdatum)\n\nEnergie Friolzheim GmbH\nGesellschaft mit beschränkter Haftung\nFriolzheim\n\nDie Gesellschaft hat am 23.12.2025 die Liste über die Zusammensetzung des Aufsichtsrats zum Handelsregister eingereicht."
    },
    {
      "date": "2025-12-29",
      "id": "141054",
      "original_text": "Registerbekanntmachung nach dem Umwandlungsgesetz\nBrandenburg Amtsgericht Neuruppin HRB 10213\nHAI Fuels GmbH – Schwedt/Oder",
      "type": "Registerbekanntmachung nach dem Umwandlungsgesetz",
      "state": "Brandenburg",
      "amtsgericht": "Amtsgericht Neuruppin",
      "registernummer": "HRB 10213",
      "registerart": "HRB",
      "company_name": "HAI Fuels GmbH",
      "company_seat": "Schwedt/Oder",
      "details": "29.12.2025 (Bekanntmachungsdatum)\n\nBrandenburg Amtsgericht Neuruppin HRB 10213\nRegisterbekanntmachung nach dem Umwandlungsgesetz 23.12.2025 (Eintragungsdatum)\n\nHAI Fuels GmbH\nGesellschaft mit beschränkter Haftung\nSchwedt/Oder\n\nZu Eintragungsnummer 12 vom 23.12.2025 wird als nicht eingetragen veröffentlicht:\n\nDen Gläubigern der an der Umwandlung beteiligten Rechtsträger ist, wenn sie binnen sechs Monaten nach dem Tag, an dem die Eintragung der Umwandlung in das Register des Sitzes desjenigen Rechtsträgers, dessen Gläubiger sie sind, als bekannt gemacht gilt, ihren Anspruch nach Grund und Höhe schriftlich anmelden, Sicherheit zu leisten, soweit sie nicht Befriedigung verlangen können. Dieses Recht steht den Gläubigern jedoch nur zu, wenn sie glaubhaft machen, dass durch die Umwandlung die Erfüllung ihrer Forderung gefährdet wird."
    },
    {
      "date": "2025-12-29",
      "id": "141055",
      "original_text": "Löschungsankündigung\nBaden-Württemberg Amtsgericht Mannheim HRB 723330\nAbacus Solar GmbH – Wiesloch",
      "type": "Löschungsankündigung",
      "state": "Baden-Württemberg",
      "amtsgericht": "Amtsgericht Mannheim",
      "registernummer": "HRB 723330",
      "registerart": "HRB",
      "company_name": "Abacus Solar GmbH",
      "company_seat": "Wiesloch",
      "details": "29.12.2025 (Bekanntmachungsdatum)\n\nBaden-Württemberg Amtsgericht Mannheim HRB 723330\nLöschungsankündigung\n\nAbacus Solar GmbH\nGesellschaft mit beschränkter Haftung\nWiesloch\n\nDas Gericht beabsichtigt, die Eintragung der Gesellschaft im Handelsregister wegen des Mangels einer wesentlichen Voraussetzung von Amts wegen nach § 395 FamFG als unzulässig zu löschen. Die Frist zur Geltendmachung eines Widerspruchs gegen die beabsichtigte Löschung ist auf einen Monat ab Veröffentlichung bestimmt."
    },
    {
      "date": "2025-12-29",
      "id": "141056",
      "original_text": "Löschungsankündigung\nBerlin Amtsgericht Berlin (Charlottenburg) HRB 206612\nHydroport Energy + Infrastructure Beteiligungs GmbH – Berlin",
      "type": "Löschungsankündigung",
      "state": "Berlin",
      "amtsgericht": "Amtsgericht Berlin (Charlottenburg)",
      "registernummer": "HRB 206612",
      "registerart": "HRB",
      "company_name": "Hydroport Energy + Infrastructure Beteiligungs GmbH",
      "company_seat": "Berlin",
      "details": "29.12.2025 (Bekanntmachungsdatum)\n\nBerlin Amtsgericht Berlin (Charlottenburg) HRB 206612\nLöschungsankündigung\n\nHydroport Energy + Infrastructure Beteiligungs GmbH\nGesellschaft mit beschränkter Haftung\nBerlin\n\nBei der nachstehenden Gesellschaft wird das Amtslöschungsverfahren gemäß § 394 FamFG eingeleitet. Widerspruchsfrist 6 Wochen"
    },
    {
      "date": "2025-12-29",
      "id": "141057",
      "original_text": "Löschungsankündigung\nSaarland Amtsgericht Saarbrücken HRB 107673\nZUMA Bau GmbH – Bexbach",
      "type": "Löschungsankündigung",
      "state": "Saarland",
      "amtsgericht": "Amtsgericht Saarbrücken",
      "registernummer": "HRB 107673",
      "registerart": "HRB",
      "company_name": "ZUMA Bau GmbH",
      "company_seat": "Bexbach",
      "details": "29.12.2025 (Bekanntmachungsdatum)\n\nSaarland Amtsgericht Saarbrücken HRB 107673\nLöschungsankündigung\n\nZUMA Bau GmbH\nGesellschaft mit beschränkter Haftung\nBexbach\n\nEs ist beabsichtigt, die Gesellschaft von Amts wegen gemäß § 394 FamFG wegen Vermögenslosigkeit zu löschen.\nGegen die Löschung von Amts wegen ist das Rechtsmittel des Widerspruchs statthaft. Der Widerspruch ist binnen einer Frist drei Monaten beginnend mit dem Tag dieser Veröffentlichung durch Einreichen eines Widerspruchsschreibens -schriftlich oder zur Niederschrift der Geschäftsstelle beim Amtsgericht Saarbrücken, -zentrales Handelsregister-, Mainzerstr.178, 66121 Saarbrücken einzulegen.\nDer Widerspruch muss die Bezeichnung der angefochtenen Löschungsankündigung enthalten sowie die Erklärung, dass Widerspruch eingelegt wird. Er ist vom Widerspruchsführer oder seinem Bevollmächtigten zu unterzeichnen.\nDas Widerspruchsschreiben kann auch in der Form eines elektronischen Dokumentes eingereicht werden, das mit einer qualifizierten elektronischen Signatur nach dem Signaturgesetz versehen sein muss (§§ 14 Abs. 2 FamFG, 130a, 298 ZPO)."
    },
    {
      "date": "2025-12-29",
      "id": "141058",
      "original_text": "Löschungsankündigung\nBerlin Amtsgericht Berlin (Charlottenburg) HRB 195532\nLorro - Galabau UG (haftungsbeschränkt) – Berlin",
      "type": "Löschungsankündigung",
      "state": "Berlin",
      "amtsgericht": "Amtsgericht Berlin (Charlottenburg)",
      "registernummer": "HRB 195532",
      "registerart": "HRB",
      "company_name": "Lorro - Galabau UG (haftungsbeschränkt)",
      "company_seat": "Berlin",
      "details": "29.12.2025 (Bekanntmachungsdatum)\n\nBerlin Amtsgericht Berlin (Charlottenburg) HRB 195532\nLöschungsankündigung\n\nLorro - Galabau UG (haftungsbeschränkt)\nGesellschaft mit beschränkter Haftung\nBerlin\n\nBei der nachstehenden Gesellschaft wird das Amtslöschungsverfahren gemäß § 394 FamFG eingeleitet. Widerspruchsfrist 6 Wochen"
    },
    {
      "date": "2025-12-29",
      "id": "141059",
      "original_text": "Registerbekanntmachung nach dem Umwandlungsgesetz\nSachsen-Anhalt Amtsgericht Stendal HRB 33711\nI:TECS Event-Production GmbH – Dessau-Roßlau",
      "type": "Registerbekanntmachung nach dem Umwandlungsgesetz",
      "state": "Sachsen-Anhalt",
      "amtsgericht": "Amtsgericht Stendal",
      "registernummer": "HRB 33711",
      "registerart": "HRB",
      "company_name": "I:TECS Event-Production GmbH",
      "company_seat": "Dessau-Roßlau",
      "details": "29.12.2025 (Bekanntmachungsdatum)\n\nSachsen-Anhalt Amtsgericht Stendal HRB 33711\nRegisterbekanntmachung nach dem Umwandlungsgesetz 29.12.2025 (Eintragungsdatum)\n\nI:TECS Event-Production GmbH\nGesellschaft mit beschränkter Haftung\nDessau-Roßlau\n\nNicht eingetragen:\nDen Gläubigern der an der Spaltung beteiligten Rechtsträger, ist wenn sie binnen sechs Monaten nach dem Tag, an dem die Eintragung der Spaltung nach §§ 125, 19 Abs. 3 UmwG als bekanntgemacht gilt, ihren Anspruch nach Grund und Höhe schriftlich anmelden, Sicherheit zu leisten, soweit sie nicht Befriedigung verlangen können. Dieses Recht steht ihnen jedoch nur zu, wenn sie glaubhaft machen, daß durch die Spaltung die Erfüllung ihrer Forderung gefährdet wird."
    },
    {
      "date": "2025-12-29",
      "id": "141060",
      "original_text": "Registerbekanntmachung nach dem Umwandlungsgesetz\nSachsen-Anhalt Amtsgericht Stendal HRA 12193\ni-TECS GmbH & Co. KG – Dessau-Roßlau",
      "type": "Registerbekanntmachung nach dem Umwandlungsgesetz",
      "state": "Sachsen-Anhalt",
      "amtsgericht": "Amtsgericht Stendal",
      "registernummer": "HRA 12193",
      "registerart": "HRA",
      "company_name": "i-TECS GmbH & Co. KG",
      "company_seat": "Dessau-Roßlau",
      "details": "29.12.2025 (Bekanntmachungsdatum)\n\nSachsen-Anhalt Amtsgericht Stendal HRA 12193\nRegisterbekanntmachung nach dem Umwandlungsgesetz 29.12.2025 (Eintragungsdatum)\n\ni-TECS GmbH & Co. KG\nKommanditgesellschaft\nDessau-Roßlau\n\nNicht eingetragen:\nDen Gläubigern der an der Spaltung beteiligten Rechtsträger, ist wenn sie binnen sechs Monaten nach dem Tag, an dem die Eintragung der Spaltung nach §§ 125, 19 Abs. 3 UmwG als bekanntgemacht gilt, ihren Anspruch nach Grund und Höhe schriftlich anmelden, Sicherheit zu leisten, soweit sie nicht Befriedigung verlangen können. Dieses Recht steht ihnen jedoch nur zu, wenn sie glaubhaft machen, daß durch die Spaltung die Erfüllung ihrer Forderung gefährdet wird."
    },
    {
      "date": "2025-12-29",
      "id": "141061",
      "original_text": "Registerbekanntmachung nach dem Umwandlungsgesetz\nSchleswig-Holstein Amtsgericht Flensburg HRA 10823\nLübke Industrietechnik GmbH & Co. KG – Harrislee",
      "type": "Registerbekanntmachung nach dem Umwandlungsgesetz",
      "state": "Schleswig-Holstein",
      "amtsgericht": "Amtsgericht Flensburg",
      "registernummer": "HRA 10823",
      "registerart": "HRA",
      "company_name": "Lübke Industrietechnik GmbH & Co. KG",
      "company_seat": "Harrislee",
      "details": "29.12.2025 (Bekanntmachungsdatum)\n\nSchleswig-Holstein Amtsgericht Flensburg HRA 10823\nRegisterbekanntmachung nach dem Umwandlungsgesetz 23.12.2025 (Eintragungsdatum)\n\nLübke Industrietechnik GmbH & Co. KG\nKommanditgesellschaft\nHarrislee\n\nZu Eintragungsnummer 4 vom 23.12.2025 wird als nicht eingetragen veröffentlicht: Den Gläubigern der an der Verschmelzung beteiligten Rechtsträger ist, wenn sie binnen sechs Monaten nach dem Tag, an dem die Eintragung der Verschmelzung in das Register des Sitzes desjenigen Rechtsträgers, dessen Gläubiger sie sind, als bekannt gemacht gilt, ihren Anspruch nach Grund und Höhe schriftlich anmelden, Sicherheit zu leisten, soweit sie nicht Befriedigung verlangen können. Dieses Recht steht den Gläubigern jedoch nur zu, wenn sie glaubhaft machen, dass durch die Verschmelzung die Erfüllung ihrer Forderung gefährdet wird. Das Recht, Sicherheitsleistung zu verlangen, steht Gläubigern nicht zu, die im Falle der Insolvenz ein Recht auf vorzugsweise Befriedigung aus einer Deckungsmasse haben, die nach gesetzlicher Vorschrift zu ihrem Schutz errichtet und staatlich überwacht ist."
    },
    {
      "date": "2025-12-29",
      "id": "141062",
      "original_text": "Löschungsankündigung\nBerlin Amtsgericht Berlin (Charlottenburg) PR 591\nSPS Sedlaczek Prüllage Schwinger Steuerberater Rechtsanwalt Partnerschaft mbB – Berlin",
      "type": "Löschungsankündigung",
      "state": "Berlin",
      "amtsgericht": "Amtsgericht Berlin (Charlottenburg)",
      "registernummer": "PR 591",
      "registerart": "PR",
      "company_name": "SPS Sedlaczek Prüllage Schwinger Steuerberater Rechtsanwalt Partnerschaft mbB",
      "company_seat": "Berlin",
      "details": "29.12.2025 (Bekanntmachungsdatum)\n\nBerlin Amtsgericht Berlin (Charlottenburg) PR 591\nLöschungsankündigung\n\nSPS Sedlaczek Prüllage Schwinger Steuerberater Rechtsanwalt Partnerschaft mbB\nPartnerschaftsgesellschaft\nBerlin\n\nEs ist beabsichtigt, die Eintragung wegen Mangels einer wesentlichen Voraussetzung gemäß § 395 FamFG von Amts wegen zu löschen. Widerspruchsfrist 1 Monat."
    },
    {
      "date": "2025-12-29",
      "id": "141063",
      "original_text": "Einreichung neuer Dokumente\nBaden-Württemberg Amtsgericht Freiburg HRB 718606\nGesundheitscampus Bad Säckingen GmbH – Bad Säckingen",
      "type": "Einreichung neuer Dokumente",
      "state": "Baden-Württemberg",
      "amtsgericht": "Amtsgericht Freiburg",
      "registernummer": "HRB 718606",
      "registerart": "HRB",
      "company_name": "Gesundheitscampus Bad Säckingen GmbH",
      "company_seat": "Bad Säckingen",
      "details": "29.12.2025 (Bekanntmachungsdatum)\n\nBaden-Württemberg Amtsgericht Freiburg HRB 718606\nEinreichung neuer Dokumente\n\nGesundheitscampus Bad Säckingen GmbH\nGesellschaft mit beschränkter Haftung\nBad Säckingen\n\nDie Gesellschaft hat am #Fall.Eingang die Liste über die Zusammensetzung des Aufsichtsrats zum Handelsregister eingereicht."
    },
    {
      "date": "2025-12-29",
      "id": "141064",
      "original_text": "Einreichung neuer Dokumente\nBaden-Württemberg Amtsgericht Freiburg HRB 718606\nGesundheitscampus Bad Säckingen GmbH – Bad Säckingen",
      "type": "Einreichung neuer Dokumente",
      "state": "Baden-Württemberg",
      "amtsgericht": "Amtsgericht Freiburg",
      "registernummer": "HRB 718606",
      "registerart": "HRB",
      "company_name": "Gesundheitscampus Bad Säckingen GmbH",
      "company_seat": "Bad Säckingen",
      "details": "29.12.2025 (Bekanntmachungsdatum)\n\nBaden-Württemberg Amtsgericht Freiburg HRB 718606\nEinreichung neuer Dokumente\n\nGesundheitscampus Bad Säckingen GmbH\nGesellschaft mit beschränkter Haftung\nBad Säckingen\n\nDie Gesellschaft hat am 23.12.2025 die Liste über die Zusammensetzung des Aufsichtsrats zum Handelsregister eingereicht."
    },
    {
      "date": "2025-12-29",
      "id": "141065",
      "original_text": "Löschungsankündigung\nBerlin Amtsgericht Berlin (Charlottenburg) HRB 225839\nfursax bau GmbH – Berlin",
      "type": "Löschungsankündigung",
      "state": "Berlin",
      "amtsgericht": "Amtsgericht Berlin (Charlottenburg)",
      "registernummer": "HRB 225839",
      "registerart": "HRB",
      "company_name": "fursax bau GmbH",
      "company_seat": "Berlin",
      "details": "29.12.2025 (Bekanntmachungsdatum)\n\nBerlin Amtsgericht Berlin (Charlottenburg) HRB 225839\nLöschungsankündigung\n\nfursax bau GmbH\nGesellschaft mit beschränkter Haftung\nBerlin\n\nBei der nachstehenden Gesellschaft wird das Amtslöschungsverfahren gemäß § 394 FamFG eingeleitet. Widerspruchsfrist 6 Wochen"
    },
    {
      "date": "2025-12-29",
      "id": "141066",
      "original_text": "Registerbekanntmachung nach dem Umwandlungsgesetz\nBaden-Württemberg Amtsgericht Mannheim HRB 704547\nBlue Yonder GmbH – Karlsruhe",
      "type": "Registerbekanntmachung nach dem Umwandlungsgesetz",
      "state": "Baden-Württemberg",
      "amtsgericht": "Amtsgericht Mannheim",
      "registernummer": "HRB 704547",
      "registerart": "HRB",
      "company_name": "Blue Yonder GmbH",
      "company_seat": "Karlsruhe",
      "details": "29.12.2025 (Bekanntmachungsdatum)\n\nBaden-Württemberg Amtsgericht Mannheim HRB 704547\nRegisterbekanntmachung nach dem Umwandlungsgesetz 29.12.2025 (Eintragungsdatum)\n\nBlue Yonder GmbH\nGesellschaft mit beschränkter Haftung\nKarlsruhe\n\nDen Gläubigern der an der Verschmelzung beteiligten Rechtsträger ist, wenn sie binnen sechs Monaten nach dem Tag, an dem die Eintragung der Verschmelzung in das Register des Sitzes desjenigen Rechtsträgers, dessen Gläubiger sie sind, nach § 19 Abs. 3 UmwG als bekanntgemacht gilt, ihren Anspruch nach Grund und Höhe schriftlich anmelden, Sicherheit zu leisten, soweit sie nicht Befriedigung verlangen können. Dieses Recht steht den Gläubigern jedoch nur zu, wenn sie glaubhaft machen, dass durch die Verschmelzung die Erfüllung ihrer Forderung gefährdet wird."
    },
    {
      "date": "2025-12-29",
      "id": "141067",
      "original_text": "Registerbekanntmachung nach dem Umwandlungsgesetz\nThüringen Amtsgericht Jena HRB 210323\nThetmann Immobilien Services GmbH – Gera",
      "type": "Registerbekanntmachung nach dem Umwandlungsgesetz",
      "state": "Thüringen",
      "amtsgericht": "Amtsgericht Jena",
      "registernummer": "HRB 210323",
      "registerart": "HRB",
      "company_name": "Thetmann Immobilien Services GmbH",
      "company_seat": "Gera",
      "details": "29.12.2025 (Bekanntmachungsdatum)\n\nThüringen Amtsgericht Jena HRB 210323\nRegisterbekanntmachung nach dem Umwandlungsgesetz 29.12.2025 (Eintragungsdatum)\n\nThetmann Immobilien Services GmbH\nGesellschaft mit beschränkter Haftung\nGera\n\nNicht eingetragen: Den Gläubigern der an der Verschmelzung beteiligten Rechtsträger, ist wenn sie binnen sechs Monaten nach dem Tag, an dem die Eintragung der Verschmelzung in das Register des Sitzes desjenigen Rechtsträgers, dessen Gläubiger sie sind,  nach § 19 Abs. 3 UmwG als bekanntgemacht gilt, ihren Anspruch nach Grund und Höhe schriftlich anmelden, Sicherheit zu leisten, soweit sie nicht Befriedigung verlangen können. Dieses Recht steht ihnen jedoch nur zu, wenn sie glaubhaft machen, daß durch die Verschmelzung die Erfüllung ihrer Forderung gefährdet wird."
    },
    {
      "date": "2025-12-29",
      "id": "141068",
      "original_text": "Einreichung neuer Dokumente\nThüringen Amtsgericht Jena HRB 205623\nCarl Zeiss Meditec AG – Jena",
      "type": "Einreichung neuer Dokumente",
      "state": "Thüringen",
      "amtsgericht": "Amtsgericht Jena",
      "registernummer": "HRB 205623",
      "registerart": "HRB",
      "company_name": "Carl Zeiss Meditec AG",
      "company_seat": "Jena",
      "details": "29.12.2025 (Bekanntmachungsdatum)\n\nThüringen Amtsgericht Jena HRB 205623\nEinreichung neuer Dokumente 29.12.2025 (Eintragungsdatum)\n\nCarl Zeiss Meditec AG\nAktiengesellschaft\nJena\n\nBekanntmachung gem. § 106 AktG: Aufgrund einer Veränderung in den Personen der Aufsichtsratsmitglieder ist durch den Vorstand eine neue Liste zum Handelsregister eingereicht worden."
    },
    {
      "date": "2025-12-29",
      "id": "141069",
      "original_text": "Löschungsankündigung\nMecklenburg-Vorpommern Amtsgericht Rostock HRB 12719\nBaltic Management GmbH Projektentwicklung – Graal-Müritz",
      "type": "Löschungsankündigung",
      "state": "Mecklenburg-Vorpommern",
      "amtsgericht": "Amtsgericht Rostock",
      "registernummer": "HRB 12719",
      "registerart": "HRB",
      "company_name": "Baltic Management GmbH Projektentwicklung",
      "company_seat": "Graal-Müritz",
      "details": "29.12.2025 (Bekanntmachungsdatum)\n\nMecklenburg-Vorpommern Amtsgericht Rostock HRB 12719\nLöschungsankündigung\n\nBaltic Management GmbH Projektentwicklung\nGesellschaft mit beschränkter Haftung\nGraal-Müritz\n\nDas Registergericht beabsichtigt, die im Handelsregister eingetragene Gesellschaft von Amts wegen nach § 394 FamFG zu löschen. Die Frist zur Erhebung eines Widerspruchs gegen die beabsichtigte Löschung wird auf einen Monat festgesetzt."
    },
    {
      "date": "2025-12-29",
      "id": "141070",
      "original_text": "Registerbekanntmachung nach dem Umwandlungsgesetz\nSaarland Amtsgericht Saarbrücken HRB 92164\nKRUMMENAUER Anlagenbau GmbH – Neunkirchen",
      "type": "Registerbekanntmachung nach dem Umwandlungsgesetz",
      "state": "Saarland",
      "amtsgericht": "Amtsgericht Saarbrücken",
      "registernummer": "HRB 92164",
      "registerart": "HRB",
      "company_name": "KRUMMENAUER Anlagenbau GmbH",
      "company_seat": "Neunkirchen",
      "details": "29.12.2025 (Bekanntmachungsdatum)\n\nSaarland Amtsgericht Saarbrücken HRB 92164\nRegisterbekanntmachung nach dem Umwandlungsgesetz 29.12.2025 (Eintragungsdatum)\n\nKRUMMENAUER Anlagenbau GmbH\nGesellschaft mit beschränkter Haftung\nNeunkirchen\n\nAls nicht eingetragen wird bekannt gemacht: Den Gläubigern der an der Verschmelzung beteiligten Gesellschaften ist, wenn sie binnen sechs Monaten nach dem Tag, an dem die Eintragung der Verschmelzung in das Register des Sitzes desjenigen Rechtsträgers, dessen Gläubiger sie sind, nach § 19 Absatz 3 UmwG bekannt gemacht worden ist, ihren Anspruch nach Grund und Höhe schriftlich anmelden, Sicherheit zu leisten, soweit sie nicht Befriedigung verlangen können. Dieses Recht steht den Gläubigern jedoch nur zu, wenn sie glaubhaft machen, dass durch die Verschmelzung die Erfüllung ihrer Forderung gefährdet wird."
    },
    {
      "date": "2025-12-29",
      "id": "141071",
      "original_text": "Registerbekanntmachung nach dem Umwandlungsgesetz\nSaarland Amtsgericht Saarbrücken HRB 13228\nK2S GmbH – Neunkirchen",
      "type": "Registerbekanntmachung nach dem Umwandlungsgesetz",
      "state": "Saarland",
      "amtsgericht": "Amtsgericht Saarbrücken",
      "registernummer": "HRB 13228",
      "registerart": "HRB",
      "company_name": "K2S GmbH",
      "company_seat": "Neunkirchen",
      "details": "29.12.2025 (Bekanntmachungsdatum)\n\nSaarland Amtsgericht Saarbrücken HRB 13228\nRegisterbekanntmachung nach dem Umwandlungsgesetz 29.12.2025 (Eintragungsdatum)\n\nK2S GmbH\nGesellschaft mit beschränkter Haftung\nNeunkirchen\n\nAls nicht eingetragen wird bekannt gemacht: Den Gläubigern der an der Verschmelzung beteiligten Gesellschaften ist, wenn sie binnen sechs Monaten nach dem Tag, an dem die Eintragung der Verschmelzung in das Register des Sitzes desjenigen Rechtsträgers, dessen Gläubiger sie sind, nach § 19 Absatz 3 UmwG bekannt gemacht worden ist, ihren Anspruch nach Grund und Höhe schriftlich anmelden, Sicherheit zu leisten, soweit sie nicht Befriedigung verlangen können. Dieses Recht steht den Gläubigern jedoch nur zu, wenn sie glaubhaft machen, dass durch die Verschmelzung die Erfüllung ihrer Forderung gefährdet wird."
    },
    {
      "date": "2025-12-29",
      "id": "141072",
      "original_text": "Einreichung neuer Dokumente\nBerlin Amtsgericht Berlin (Charlottenburg) HRB 193711\nOldenburger Straße Betreuungs GmbH – Berlin",
      "type": "Einreichung neuer Dokumente",
      "state": "Berlin",
      "amtsgericht": "Amtsgericht Berlin (Charlottenburg)",
      "registernummer": "HRB 193711",
      "registerart": "HRB",
      "company_name": "Oldenburger Straße Betreuungs GmbH",
      "company_seat": "Berlin",
      "details": "29.12.2025 (Bekanntmachungsdatum)\n\nBerlin Amtsgericht Berlin (Charlottenburg) HRB 193711\nEinreichung neuer Dokumente\n\nOldenburger Straße Betreuungs GmbH\nGesellschaft mit beschränkter Haftung\nBerlin\n\nAls nicht eingetragen wird veröffentlicht:\n1.\nDie Gesellschaft hat den Entwurf eines Formwechselplans vom 15.12.2025 betreffend ihren grenzüberschreitenden Formwechsel nach Luxemburg, Luxemburg, zum Handelsregister eingereicht.\n\n2.\nDie an dem Formwechsel beteiligte Gesellschaft ist die „Oldenburger Straße Betreuungs GmbH“ mit Sitz in Berlin, Deutschland. Durch den Formwechsel soll sie die Rechtsform einer Societé à responsabilité limitée (S.à r.l.) luxemburgischen Rechts erhalten und unter „Oldenburger Straße Betreuungs S.à r.l.“ firmieren.\n\n3.\nDie formwechselnde Gesellschaft ist eingetragen im Handelsregister des Amtsgerichts Charlottenburg mit der Nummer HRB 193711 B und ist bereits eingetragen im Handels- und\nGesellschaftsregister von Luxemburg (Registre de commerce et des sociétés\nLuxembourg) unter der Nummer B228410. In Luxemburg soll sie im genannten luxemburgischen Gesellschaftsregister unter der genannten Nummer eingetragen bleiben.\n\n4.\nEs ergeht Hinweis an folgende Personen, dass sie der Gesellschaft spätestens fünf Arbeitstage vor dem Tag der Gesellschafterversammlung der Gesellschaft, die über die Zustimmung zum Formwechselplan entscheidet, Bemerkungen zum Formwechselplan übermitteln können:\n\na) die Anteilsinhaber und Gläubiger der an dem grenzüberschreitenden Formwechsel beteiligten Gesellschaft sowie\n\nb) die zuständigen Betriebsräte der an dem grenzüberschreitenden Formwechsel beteiligten\nGesellschaft oder, soweit es keinen Betriebsrat gibt, die Arbeitnehmer der an dem\ngrenzüberschreitenden Formwechsel beteiligten Gesellschaft.\n\nDie Gesellschafterversammlung darf erst einen Monat nach der Bekanntmachung des Formwechselplans über ihre Zustimmung zu dem Formwechselplan beschließen. Die Gesellschafterversammlung ist für den Tag geplant, der auf den Ablauf eines Monats nach dem Tag der Bekanntmachung des Formwechselplans folgt, ggfs. für den nächsten Arbeitstag (wobei Samstage, Sonntage und bundesweite Feiertage nicht als Arbeitstage zählen.\n\nDie Gesellschaft hat mitgeteilt, dass sie keine Arbeitnehmer und keinen Betriebsrat hat."
    },
    {
      "date": "2025-12-29",
      "id": "141073",
      "original_text": "Einreichung neuer Dokumente\nBerlin Amtsgericht Berlin (Charlottenburg) HRB 191696\nSt. Bonifatius Wohnungsbaugesellschaft mbH – Berlin",
      "type": "Einreichung neuer Dokumente",
      "state": "Berlin",
      "amtsgericht": "Amtsgericht Berlin (Charlottenburg)",
      "registernummer": "HRB 191696",
      "registerart": "HRB",
      "company_name": "St. Bonifatius Wohnungsbaugesellschaft mbH",
      "company_seat": "Berlin",
      "details": "29.12.2025 (Bekanntmachungsdatum)\n\nBerlin Amtsgericht Berlin (Charlottenburg) HRB 191696\nEinreichung neuer Dokumente\n\nSt. Bonifatius Wohnungsbaugesellschaft mbH\nGesellschaft mit beschränkter Haftung\nBerlin\n\nAls nicht eingetragen wird veröffentlicht:\n\n1.\nDie Gesellschaft hat den Entwurf eines Formwechselplans vom 15.12.2025 betreffend ihren grenzüberschreitenden Formwechsel nach Luxemburg, Luxemburg, zum Handelsregister eingereicht.\n\n2.\nDie an dem Formwechsel beteiligte Gesellschaft ist die „St. Bonifatius Wohnungsbaugesellschaft mbH“ mit Sitz in Berlin, Deutschland. Durch den Formwechsel soll sie die Rechtsform einer Societé à responsabilité limitée (S.à r.l.) luxemburgischen Rechts erhalten und unter „St. Bonifatius Wohnungsbaugesellschaft S.à r.l.“ firmieren.\n\n3.\nDie formwechselnde Gesellschaft ist eingetragen im Handelsregister des Amtsgerichts Charlottenburg mit der Nummer HRB 191696 B und ist bereits eingetragen im Handels- und\nGesellschaftsregister von Luxemburg (Registre de commerce et des sociétés\nLuxembourg) unter der Nummer B228414. In Luxemburg soll sie im genannten luxemburgischen Gesellschaftsregister unter der genannten Nummer eingetragen bleiben.\n\n4.\nEs ergeht Hinweis an folgende Personen, dass sie der Gesellschaft spätestens fünf Arbeitstage vor dem Tag der Gesellschafterversammlung der Gesellschaft, die über die Zustimmung zum Formwechselplan entscheidet, Bemerkungen zum Formwechselplan übermitteln können:\n\na) die Anteilsinhaber und Gläubiger der an dem grenzüberschreitenden Formwechsel beteiligten Gesellschaft sowie\n\nb) die zuständigen Betriebsräte der an dem grenzüberschreitenden Formwechsel beteiligten\nGesellschaft oder, soweit es keinen Betriebsrat gibt, die Arbeitnehmer der an dem\ngrenzüberschreitenden Formwechsel beteiligten Gesellschaft.\n\nDie Gesellschafterversammlung darf erst einen Monat nach der Bekanntmachung des Formwechselplans über ihre Zustimmung zu dem Formwechselplan beschließen. Die Gesellschafterversammlung ist für den Tag geplant, der auf den Ablauf eines Monats nach dem Tag der Bekanntmachung des Formwechselplans folgt, ggfs. für den nächsten Arbeitstag (wobei Samstage, Sonntage und bundesweite Feiertage nicht als Arbeitstage zählen.\n\nDie Gesellschaft hat mitgeteilt, dass sie keine Arbeitnehmer und keinen Betriebsrat hat."
    },
    {
      "date": "2025-12-29",
      "id": "141074",
      "original_text": "Registerbekanntmachung nach dem Umwandlungsgesetz\nBaden-Württemberg Amtsgericht Stuttgart HRA 742841\nRAV Ackermann e.K. – Rietheim-Weilheim",
      "type": "Registerbekanntmachung nach dem Umwandlungsgesetz",
      "state": "Baden-Württemberg",
      "amtsgericht": "Amtsgericht Stuttgart",
      "registernummer": "HRA 742841",
      "registerart": "HRA",
      "company_name": "RAV Ackermann e.K.",
      "company_seat": "Rietheim-Weilheim",
      "details": "29.12.2025 (Bekanntmachungsdatum)\n\nBaden-Württemberg Amtsgericht Stuttgart HRA 742841\nRegisterbekanntmachung nach dem Umwandlungsgesetz 29.12.2025 (Eintragungsdatum)\n\nRAV Ackermann e.K.\nEinzelkaufmann / Einzelkauffrau\nRietheim-Weilheim\n\nAls nicht eingetragen wird bekanntgemacht: Den Gläubigern der an der Ausgliederung beteiligten Rechtsträger ist, wenn sie binnen sechs Monaten nach dem Tag, an dem die Eintragung der Ausgliederung in das Register des Sitzes desjenigen Rechtsträgers, dessen Gläubiger sie sind, nach § 19 Abs. 3 UmwG als bekanntgemacht gilt, ihren Anspruch nach Grund und Höhe schriftlich anmelden, Sicherheit zu leisten, soweit sie nicht Befriedigung verlangen können. Dieses Recht steht den Gläubigern jedoch nur zu, wenn sie glaubhaft machen, dass durch die Ausgliederung die Erfüllung ihrer Forderung gefährdet wird."
    },
    {
      "date": "2025-12-29",
      "id": "141075",
      "original_text": "Einreichung neuer Dokumente\nBerlin Amtsgericht Berlin (Charlottenburg) HRB 177710\nSummer Propco 2 GmbH – Berlin",
      "type": "Einreichung neuer Dokumente",
      "state": "Berlin",
      "amtsgericht": "Amtsgericht Berlin (Charlottenburg)",
      "registernummer": "HRB 177710",
      "registerart": "HRB",
      "company_name": "Summer Propco 2 GmbH",
      "company_seat": "Berlin",
      "details": "29.12.2025 (Bekanntmachungsdatum)\n\nBerlin Amtsgericht Berlin (Charlottenburg) HRB 177710\nEinreichung neuer Dokumente\n\nSummer Propco 2 GmbH\nGesellschaft mit beschränkter Haftung\nBerlin\n\nAls nicht eingetragen wird veröffentlicht:\n\n1.\nDie Gesellschaft hat den Entwurf eines Formwechselplans vom 15.12.2025 betreffend ihren grenzüberschreitenden Formwechsel nach Luxemburg, Luxemburg, zum Handelsregister eingereicht.\n\n2.\nDie an dem Formwechsel beteiligte Gesellschaft ist die „Summer Propco 2 GmbH“ mit Sitz in Berlin, Deutschland. Durch den Formwechsel soll sie die Rechtsform einer Societé à responsabilité limitée (S.à r.l.) luxemburgischen Rechts erhalten und unter „Summer Propco 2 S.à r.l.“ firmieren.\n\n3.\nDie formwechselnde Gesellschaft ist eingetragen im Handelsregister des Amtsgerichts Charlottenburg mit der Nummer HRB 177710 B und ist bereits eingetragen im Handels- und\nGesellschaftsregister von Luxemburg (Registre de commerce et des sociétés\nLuxembourg) unter der Nummer B228281. In Luxemburg soll sie im genannten luxemburgischen Gesellschaftsregister unter der genannten Nummer eingetragen bleiben.\n\n4.\nEs ergeht Hinweis an folgende Personen, dass sie der Gesellschaft spätestens fünf Arbeitstage vor dem Tag der Gesellschafterversammlung der Gesellschaft, die über die Zustimmung zum Formwechselplan entscheidet, Bemerkungen zum Formwechselplan übermitteln können:\n\na) die Anteilsinhaber und Gläubiger der an dem grenzüberschreitenden Formwechsel beteiligten Gesellschaft sowie\n\nb) die zuständigen Betriebsräte der an dem grenzüberschreitenden Formwechsel beteiligten\nGesellschaft oder, soweit es keinen Betriebsrat gibt, die Arbeitnehmer der an dem\ngrenzüberschreitenden Formwechsel beteiligten Gesellschaft.\n\nDie Gesellschafterversammlung darf erst einen Monat nach der Bekanntmachung des Formwechselplans über ihre Zustimmung zu dem Formwechselplan beschließen. Die Gesellschafterversammlung ist für den Tag geplant, der auf den Ablauf eines Monats nach dem Tag der Bekanntmachung des Formwechselplans folgt, ggfs. für den nächsten Arbeitstag (wobei Samstage, Sonntage und bundesweite Feiertage nicht als Arbeitstage zählen.\nDie Gesellschaft hat mitgeteilt, dass sie keine Arbeitnehmer und keinen Betriebsrat hat."
    },
    {
      "date": "2025-12-29",
      "id": "141076",
      "original_text": "Löschungsankündigung\nBerlin Amtsgericht Berlin (Charlottenburg) HRB 149628\nA&A Taxi GmbH – Berlin",
      "type": "Löschungsankündigung",
      "state": "Berlin",
      "amtsgericht": "Amtsgericht Berlin (Charlottenburg)",
      "registernummer": "HRB 149628",
      "registerart": "HRB",
      "company_name": "A&A Taxi GmbH",
      "company_seat": "Berlin",
      "details": "29.12.2025 (Bekanntmachungsdatum)\n\nBerlin Amtsgericht Berlin (Charlottenburg) HRB 149628\nLöschungsankündigung\n\nA&A Taxi GmbH\nGesellschaft mit beschränkter Haftung\nBerlin\n\nBei der nachstehenden Gesellschaft wird das Amtslöschungsverfahren gemäß § 394 FamFG eingeleitet. Widerspruchsfrist 6 Wochen"
    },
    {
      "date": "2025-12-29",
      "id": "141077",
      "original_text": "Löschungsankündigung\nBerlin Amtsgericht Berlin (Charlottenburg) HRB 173628\nNAZAR IS REHBERI GmbH – Berlin",
      "type": "Löschungsankündigung",
      "state": "Berlin",
      "amtsgericht": "Amtsgericht Berlin (Charlottenburg)",
      "registernummer": "HRB 173628",
      "registerart": "HRB",
      "company_name": "NAZAR IS REHBERI GmbH",
      "company_seat": "Berlin",
      "details": "29.12.2025 (Bekanntmachungsdatum)\n\nBerlin Amtsgericht Berlin (Charlottenburg) HRB 173628\nLöschungsankündigung\n\nNAZAR IS REHBERI GmbH\nGesellschaft mit beschränkter Haftung\nBerlin\n\nBei der nachstehenden Gesellschaft wird das Amtslöschungsverfahren gemäß § 394 FamFG eingeleitet. Widerspruchsfrist 6 Wochen"
    },
    {
      "date": "2025-12-29",
      "id": "141078",
      "original_text": "Löschungsankündigung\nBerlin Amtsgericht Berlin (Charlottenburg) HRB 256625\nZAF Bauservice GmbH – Berlin",
      "type": "Löschungsankündigung",
      "state": "Berlin",
      "amtsgericht": "Amtsgericht Berlin (Charlottenburg)",
      "registernummer": "HRB 256625",
      "registerart": "HRB",
      "company_name": "ZAF Bauservice GmbH",
      "company_seat": "Berlin",
      "details": "29.12.2025 (Bekanntmachungsdatum)\n\nBerlin Amtsgericht Berlin (Charlottenburg) HRB 256625\nLöschungsankündigung\n\nZAF Bauservice GmbH\nGesellschaft mit beschränkter Haftung\nBerlin\n\nBei der nachstehenden Gesellschaft wird das Amtslöschungsverfahren gemäß § 394 FamFG eingeleitet. Widerspruchsfrist 6 Wochen"
    },
    {
      "date": "2025-12-29",
      "id": "141079",
      "original_text": "Registerbekanntmachung nach dem Umwandlungsgesetz\nBerlin Amtsgericht Berlin (Charlottenburg) HRB 108910\nThird Raglan GmbH – Berlin",
      "type": "Registerbekanntmachung nach dem Umwandlungsgesetz",
      "state": "Berlin",
      "amtsgericht": "Amtsgericht Berlin (Charlottenburg)",
      "registernummer": "HRB 108910",
      "registerart": "HRB",
      "company_name": "Third Raglan GmbH",
      "company_seat": "Berlin",
      "details": "29.12.2025 (Bekanntmachungsdatum)\n\nBerlin Amtsgericht Berlin (Charlottenburg) HRB 108910\nRegisterbekanntmachung nach dem Umwandlungsgesetz 23.12.2025 (Eintragungsdatum)\n\nThird Raglan GmbH\nGesellschaft mit beschränkter Haftung\nBerlin\n\nZu Eintragungsnummer 10 vom 23.12.2025 wird als nicht eingetragen veröffentlicht:\n\nDen Gläubigern der an der Verschmelzung beteiligten Rechtsträger ist, wenn sie binnen sechs Monaten nach dem Tag, an dem die Eintragung der Verschmelzung in das Register des Sitzes desjenigen Rechtsträgers, dessen Gläubiger sie sind, als bekannt gemacht gilt, ihren Anspruch nach Grund und Höhe schriftlich anmelden, Sicherheit zu leisten, soweit sie nicht Befriedigung verlangen können. Dieses Recht steht den Gläubigern jedoch nur zu, wenn sie glaubhaft machen, dass durch die Verschmelzung die Erfüllung ihrer Forderung gefährdet wird. Das Recht, Sicherheitsleistung zu verlangen, steht Gläubigern nicht zu, die im Falle der Insolvenz ein Recht auf vorzugsweise Befriedigung aus einer Deckungsmasse haben, die nach gesetzlicher Vorschrift zu ihrem Schutz errichtet und staatlich überwacht ist."
    },
    {
      "date": "2025-12-29",
      "id": "141080",
      "original_text": "Registerbekanntmachung nach dem Umwandlungsgesetz\nSchleswig-Holstein Amtsgericht Flensburg HRA 9150\nKO-MET Metalltechnik GmbH & Co. KG – Harrislee",
      "type": "Registerbekanntmachung nach dem Umwandlungsgesetz",
      "state": "Schleswig-Holstein",
      "amtsgericht": "Amtsgericht Flensburg",
      "registernummer": "HRA 9150",
      "registerart": "HRA",
      "company_name": "KO-MET Metalltechnik GmbH & Co. KG",
      "company_seat": "Harrislee",
      "details": "29.12.2025 (Bekanntmachungsdatum)\n\nSchleswig-Holstein Amtsgericht Flensburg HRA 9150\nRegisterbekanntmachung nach dem Umwandlungsgesetz 23.12.2025 (Eintragungsdatum)\n\nKO-MET Metalltechnik GmbH & Co. KG\nKommanditgesellschaft\nHarrislee\n\nZu Eintragungsnummer 8 vom 23.12.2025 wird als nicht eingetragen veröffentlicht:  Den Gläubigern der an der Verschmelzung beteiligten Rechtsträger ist, wenn sie binnen sechs Monaten nach dem Tag, an dem die Eintragung der Verschmelzung in das Register des Sitzes desjenigen Rechtsträgers, dessen Gläubiger sie sind, als bekannt gemacht gilt, ihren Anspruch nach Grund und Höhe schriftlich anmelden, Sicherheit zu leisten, soweit sie nicht Befriedigung verlangen können. Dieses Recht steht den Gläubigern jedoch nur zu, wenn sie glaubhaft machen, dass durch die Verschmelzung die Erfüllung ihrer Forderung gefährdet wird. Das Recht, Sicherheitsleistung zu verlangen, steht Gläubigern nicht zu, die im Falle der Insolvenz ein Recht auf vorzugsweise Befriedigung aus einer Deckungsmasse haben, die nach gesetzlicher Vorschrift zu ihrem Schutz errichtet und staatlich überwacht ist."
    },
    {
      "date": "2025-12-29",
      "id": "141081",
      "original_text": "Einreichung neuer Dokumente\nSachsen-Anhalt Amtsgericht Stendal HRB 210574\nMartha-Maria Krankenhaus Halle-Dölau gemeinnützige GmbH – Halle/Saale",
      "type": "Einreichung neuer Dokumente",
      "state": "Sachsen-Anhalt",
      "amtsgericht": "Amtsgericht Stendal",
      "registernummer": "HRB 210574",
      "registerart": "HRB",
      "company_name": "Martha-Maria Krankenhaus Halle-Dölau gemeinnützige GmbH",
      "company_seat": "Halle/Saale",
      "details": "29.12.2025 (Bekanntmachungsdatum)\n\nSachsen-Anhalt Amtsgericht Stendal HRB 210574\nEinreichung neuer Dokumente 29.12.2025 (Eintragungsdatum)\n\nMartha-Maria Krankenhaus Halle-Dölau gemeinnützige GmbH\nGesellschaft mit beschränkter Haftung\nHalle/Saale\n\nEine Liste der Mitglieder des Aufsichtsrates wurde zum Handelsregister eingereicht."
    },
    {
      "date": "2025-12-29",
      "id": "141082",
      "original_text": "Registerbekanntmachung nach dem Umwandlungsgesetz\nBerlin Amtsgericht Berlin (Charlottenburg) HRB 161398\nYamaha Motor Antriebstechnik Verwaltungsgesellschaft mbH – Berlin",
      "type": "Registerbekanntmachung nach dem Umwandlungsgesetz",
      "state": "Berlin",
      "amtsgericht": "Amtsgericht Berlin (Charlottenburg)",
      "registernummer": "HRB 161398",
      "registerart": "HRB",
      "company_name": "Yamaha Motor Antriebstechnik Verwaltungsgesellschaft mbH",
      "company_seat": "Berlin",
      "details": "29.12.2025 (Bekanntmachungsdatum)\n\nBerlin Amtsgericht Berlin (Charlottenburg) HRB 161398\nRegisterbekanntmachung nach dem Umwandlungsgesetz 22.12.2025 (Eintragungsdatum)\n\nYamaha Motor Antriebstechnik Verwaltungsgesellschaft mbH\nGesellschaft mit beschränkter Haftung\nBerlin\n\nZu Eintragungsnummer 24 vom 22.12.2025 wird als nicht eingetragen veröffentlicht: Den Gläubigern der an der Verschmelzung beteiligten Rechtsträger ist, wenn sie binnen sechs Monaten nach dem Tag, an dem die Eintragung der Verschmelzung in das Register des Sitzes desjenigen Rechtsträgers, dessen Gläubiger sie sind, als bekannt gemacht gilt, ihren Anspruch nach Grund und Höhe schriftlich anmelden, Sicherheit zu leisten, soweit sie nicht Befriedigung verlangen können. Dieses Recht steht den Gläubigern jedoch nur zu, wenn sie glaubhaft machen, dass durch die Verschmelzung die Erfüllung ihrer Forderung gefährdet wird. Das Recht, Sicherheitsleistung zu verlangen, steht Gläubigern nicht zu, die im Falle der Insolvenz ein Recht auf vorzugsweise Befriedigung aus einer Deckungsmasse haben, die nach gesetzlicher Vorschrift zu ihrem Schutz errichtet und staatlich überwacht ist."
    },
    {
      "date": "2025-12-29",
      "id": "141083",
      "original_text": "Einreichung neuer Dokumente\nBaden-Württemberg Amtsgericht Stuttgart HRB 732997\ne-mobil BW GmbH – Stuttgart",
      "type": "Einreichung neuer Dokumente",
      "state": "Baden-Württemberg",
      "amtsgericht": "Amtsgericht Stuttgart",
      "registernummer": "HRB 732997",
      "registerart": "HRB",
      "company_name": "e-mobil BW GmbH",
      "company_seat": "Stuttgart",
      "details": "29.12.2025 (Bekanntmachungsdatum)\n\nBaden-Württemberg Amtsgericht Stuttgart HRB 732997\nEinreichung neuer Dokumente\n\ne-mobil BW GmbH\nGesellschaft mit beschränkter Haftung\nStuttgart\n\nDie Gesellschaft hat am 22.12.2025 die Liste über die Zusammensetzung des Aufsichtsrats zum Handelsregister eingereicht."
    },
    {
      "date": "2025-12-29",
      "id": "141084",
      "original_text": "Einreichung neuer Dokumente\nBaden-Württemberg Amtsgericht Freiburg HRB 540034\nConstellium Singen GmbH – Singen Hohentwiel",
      "type": "Einreichung neuer Dokumente",
      "state": "Baden-Württemberg",
      "amtsgericht": "Amtsgericht Freiburg",
      "registernummer": "HRB 540034",
      "registerart": "HRB",
      "company_name": "Constellium Singen GmbH",
      "company_seat": "Singen Hohentwiel",
      "details": "29.12.2025 (Bekanntmachungsdatum)\n\nBaden-Württemberg Amtsgericht Freiburg HRB 540034\nEinreichung neuer Dokumente\n\nConstellium Singen GmbH\nGesellschaft mit beschränkter Haftung\nSingen Hohentwiel\n\nDie Gesellschaft hat am 24.12.2025 die Liste über die Zusammensetzung des Aufsichtsrats zum Handelsregister eingereicht."
    },
    {
      "date": "2025-12-29",
      "id": "141085",
      "original_text": "Löschungsankündigung\nSachsen-Anhalt Amtsgericht Stendal HRB 14481\nMIH Mitteldeutsche Immobillienhandelsfonds Verwaltungsgesellschaft mbH – Halle (Saale)",
      "type": "Löschungsankündigung",
      "state": "Sachsen-Anhalt",
      "amtsgericht": "Amtsgericht Stendal",
      "registernummer": "HRB 14481",
      "registerart": "HRB",
      "company_name": "MIH Mitteldeutsche Immobillienhandelsfonds Verwaltungsgesellschaft mbH",
      "company_seat": "Halle (Saale)",
      "details": "29.12.2025 (Bekanntmachungsdatum)\n\nSachsen-Anhalt Amtsgericht Stendal HRB 14481\nLöschungsankündigung\n\nMIH Mitteldeutsche Immobillienhandelsfonds Verwaltungsgesellschaft mbH\nGesellschaft mit beschränkter Haftung\nHalle (Saale)\n\nDas Registergericht beabsichtigt, nachfolgende Gesellschaften wegen Vermögenslosigkeit von Amts wegen nach § 394 FamFG zu löschen. Die Frist zur Erhebung eines Widerspruchs gegen die beabsichtigte Löschung wird auf drei Monate festgesetzt."
    },
    {
      "date": "2025-12-29",
      "id": "141086",
      "original_text": "Löschungsankündigung\nBrandenburg Amtsgericht Neuruppin HRB 12966\nTister ImmobilienVerwaltungs GmbH – Neuruppin",
      "type": "Löschungsankündigung",
      "state": "Brandenburg",
      "amtsgericht": "Amtsgericht Neuruppin",
      "registernummer": "HRB 12966",
      "registerart": "HRB",
      "company_name": "Tister ImmobilienVerwaltungs GmbH",
      "company_seat": "Neuruppin",
      "details": "29.12.2025 (Bekanntmachungsdatum)\n\nBrandenburg Amtsgericht Neuruppin HRB 12966\nLöschungsankündigung\n\nTister ImmobilienVerwaltungs  GmbH\nGesellschaft mit beschränkter Haftung\nNeuruppin\n\nBei der nachstehenden Gesellschaft wird das Amtslöschungsverfahren gemäß § 394 FamFG eingeleitet.\nWiderspruchsfrist: 1 Monat"
    },
    {
      "date": "2025-12-29",
      "id": "141087",
      "original_text": "Einreichung neuer Dokumente\nBerlin Amtsgericht Berlin (Charlottenburg) HRB 71484\nAlogis AG – Berlin",
      "type": "Einreichung neuer Dokumente",
      "state": "Berlin",
      "amtsgericht": "Amtsgericht Berlin (Charlottenburg)",
      "registernummer": "HRB 71484",
      "registerart": "HRB",
      "company_name": "Alogis AG",
      "company_seat": "Berlin",
      "details": "29.12.2025 (Bekanntmachungsdatum)\n\nBerlin Amtsgericht Berlin (Charlottenburg) HRB 71484\nEinreichung neuer Dokumente\n\nAlogis AG\nAktiengesellschaft\nBerlin\n\nAls nicht eingetragen wird veröffentlicht: Es wurde eine neue Liste der Aufsichtsratsmitglieder eingereicht (§ 106 AktG)."
    },
    {
      "date": "2025-12-29",
      "id": "141088",
      "original_text": "Löschungsankündigung\nBaden-Württemberg Amtsgericht Freiburg HRB 320455\nBlust Kommunaltechnik GmbH – Grafenhausen",
      "type": "Löschungsankündigung",
      "state": "Baden-Württemberg",
      "amtsgericht": "Amtsgericht Freiburg",
      "registernummer": "HRB 320455",
      "registerart": "HRB",
      "company_name": "Blust Kommunaltechnik GmbH",
      "company_seat": "Grafenhausen",
      "details": "29.12.2025 (Bekanntmachungsdatum)\n\nBaden-Württemberg Amtsgericht Freiburg HRB 320455\nLöschungsankündigung\n\nBlust Kommunaltechnik GmbH\nGesellschaft mit beschränkter Haftung\nGrafenhausen\n\nDurch Beschluss des Amtsgerichts Waldshut-Tiengen vom 06.11.2025 wurde das Insolvenzverfahren über das Vermögen der Gesellschaft aufgehoben.\n\nDas Gericht beabsichtigt daher, die Gesellschaft wegen Vermögenslosigkeit im Handelsregister von Amts wegen nach § 394 FamFG zu löschen. Die Frist zur Geltendmachung eines Widerspruchs gegen die beabsichtigte Löschung ist auf einen Monat ab Veröffentlichung bestimmt."
    },
    {
      "date": "2025-12-29",
      "id": "141089",
      "original_text": "Registerbekanntmachung nach dem Umwandlungsgesetz\nBaden-Württemberg Amtsgericht Mannheim HRB 756720\nEssity Hygiene Holding 2 GmbH – Mannheim",
      "type": "Registerbekanntmachung nach dem Umwandlungsgesetz",
      "state": "Baden-Württemberg",
      "amtsgericht": "Amtsgericht Mannheim",
      "registernummer": "HRB 756720",
      "registerart": "HRB",
      "company_name": "Essity Hygiene Holding 2 GmbH",
      "company_seat": "Mannheim",
      "details": "29.12.2025 (Bekanntmachungsdatum)\n\nBaden-Württemberg Amtsgericht Mannheim HRB 756720\nRegisterbekanntmachung nach dem Umwandlungsgesetz 18.12.2025 (Eintragungsdatum)\n\nEssity Hygiene Holding 2 GmbH\nGesellschaft mit beschränkter Haftung\nMannheim\n\nDen Gläubigern des an dem Formwechsel beteiligten Rechtsträgers ist, wenn sie binnen sechs Monaten nach dem Tag, an dem die Eintragung des Formwechsels in das Register des Sitzes desjenigen Rechtsträgers, dessen Gläubiger sie sind, nach § 19 Abs. 3 UmwG als bekanntgemacht gilt, ihren Anspruch nach Grund und Höhe schriftlich anmelden, Sicherheit zu leisten, soweit sie nicht Befriedigung verlangen können. Dieses Recht steht den Gläubigern jedoch nur zu, wenn sie glaubhaft machen, dass durch den Formwechsel die Erfüllung ihrer Forderung gefährdet wird."
    },
    {
      "date": "2025-12-29",
      "id": "141090",
      "original_text": "Löschungsankündigung\nBrandenburg Amtsgericht Potsdam HRB 31116\nDUB PARTICIPATION HOLDING LIMITED – Zossen",
      "type": "Löschungsankündigung",
      "state": "Brandenburg",
      "amtsgericht": "Amtsgericht Potsdam",
      "registernummer": "HRB 31116",
      "registerart": "HRB",
      "company_name": "DUB PARTICIPATION HOLDING LIMITED",
      "company_seat": "Zossen",
      "details": "29.12.2025 (Bekanntmachungsdatum)\n\nBrandenburg Amtsgericht Potsdam HRB 31116\nLöschungsankündigung\n\nDUB PARTICIPATION HOLDING LIMITED\nRechtsform ausländischen Rechts HRB\nZossen\n\nBei der nachstehenden Gesellschaft/dem nachstehenden Verein wird das Amtslöschungsverfahren gemäß § 395 FamFG eingeleitet. Widerspruchsfrist: 4 Wochen."
    },
    {
      "date": "2025-12-29",
      "id": "141091",
      "original_text": "Einreichung neuer Dokumente\nBerlin Amtsgericht Berlin (Charlottenburg) HRB 91791\nVivantes Service GmbH – Berlin",
      "type": "Einreichung neuer Dokumente",
      "state": "Berlin",
      "amtsgericht": "Amtsgericht Berlin (Charlottenburg)",
      "registernummer": "HRB 91791",
      "registerart": "HRB",
      "company_name": "Vivantes Service GmbH",
      "company_seat": "Berlin",
      "details": "29.12.2025 (Bekanntmachungsdatum)\n\nBerlin Amtsgericht Berlin (Charlottenburg) HRB 91791\nEinreichung neuer Dokumente\n\nVivantes Service GmbH\nGesellschaft mit beschränkter Haftung\nBerlin\n\nAls nicht eingetragen wird veröffentlicht:\n\nEs wurde eine neue Liste der Aufsichtsratsmitglieder eingereicht (§52 GmbHG)."
    },
    {
      "date": "2025-12-29",
      "id": "141092",
      "original_text": "Löschungsankündigung\nBerlin Amtsgericht Berlin (Charlottenburg) HRB 213014\nFIA Bau GmbH – Berlin",
      "type": "Löschungsankündigung",
      "state": "Berlin",
      "amtsgericht": "Amtsgericht Berlin (Charlottenburg)",
      "registernummer": "HRB 213014",
      "registerart": "HRB",
      "company_name": "FIA Bau GmbH",
      "company_seat": "Berlin",
      "details": "29.12.2025 (Bekanntmachungsdatum)\n\nBerlin Amtsgericht Berlin (Charlottenburg) HRB 213014\nLöschungsankündigung\n\nFIA Bau GmbH\nGesellschaft mit beschränkter Haftung\nBerlin\n\nBei der nachstehenden Gesellschaft wird das Amtslöschungsverfahren gemäß § 394 FamFG eingeleitet. Widerspruchsfrist 6 Wochen"
    },
    {
      "date": "2025-12-29",
      "id": "141093",
      "original_text": "Einreichung neuer Dokumente\nSachsen Amtsgericht Dresden HRB 33839\nImmobilienwert Sachsen Aktiengesellschaft – Radebeul",
      "type": "Einreichung neuer Dokumente",
      "state": "Sachsen",
      "amtsgericht": "Amtsgericht Dresden",
      "registernummer": "HRB 33839",
      "registerart": "HRB",
      "company_name": "Immobilienwert Sachsen Aktiengesellschaft",
      "company_seat": "Radebeul",
      "details": "29.12.2025 (Bekanntmachungsdatum)\n\nSachsen Amtsgericht Dresden HRB 33839\nEinreichung neuer Dokumente\n\nImmobilienwert Sachsen Aktiengesellschaft\nAktiengesellschaft\nRadebeul\n\nAm 22.12.2025 wurde beim Handelsregister des Amtsgerichts Dresden die Liste der Mitglieder des Aufsichtsrats gemäß § 106 AktG eingereicht."
    },
    {
      "date": "2025-12-29",
      "id": "141094",
      "original_text": "Löschungsankündigung\nSachsen Amtsgericht Leipzig VR 5713\nTiritiTram e.V. – Leipzig",
      "type": "Löschungsankündigung",
      "state": "Sachsen",
      "amtsgericht": "Amtsgericht Leipzig",
      "registernummer": "VR 5713",
      "registerart": "VR",
      "company_name": "TiritiTram e.V.",
      "company_seat": "Leipzig",
      "details": "29.12.2025 (Bekanntmachungsdatum)\n\nSachsen Amtsgericht Leipzig VR 5713\nLöschungsankündigung\n\nTiritiTram e.V.\neingetragener Verein\nLeipzig\n\nDas Gericht beabsichtigt, gemäß § 4 Absatz 2 Ziffer 1 der Verordnung über das Vereinsregister das Registerblatt  des Vereins zu schließen, da nach den Ermittlungen des Gerichts sämtliche Mitglieder aus dem Verein ausgeschieden sind. Zur Geltendmachung eines Widerspruchs gegen die beabsichtigte Schließung wird eine Frist von einem Monat nach der Veröffentlichung bestimmt."
    },
    {
      "date": "2025-12-29",
      "id": "141095",
      "original_text": "Registerbekanntmachung nach dem Umwandlungsgesetz\nNiedersachsen Amtsgericht Hildesheim HRB 207927\nA & S Recycling GmbH – Lehrte",
      "type": "Registerbekanntmachung nach dem Umwandlungsgesetz",
      "state": "Niedersachsen",
      "amtsgericht": "Amtsgericht Hildesheim",
      "registernummer": "HRB 207927",
      "registerart": "HRB",
      "company_name": "A & S Recycling GmbH",
      "company_seat": "Lehrte",
      "details": "29.12.2025 (Bekanntmachungsdatum)\n\nNiedersachsen Amtsgericht Hildesheim HRB 207927\nRegisterbekanntmachung nach dem Umwandlungsgesetz 29.12.2025 (Eintragungsdatum)\n\nA & S Recycling GmbH\nGesellschaft mit beschränkter Haftung\nLehrte\n\nDen Gläubigern der an der Ausgliederung beteiligten Rechtsträger ist, wenn sie binnen sechs Monaten nach dem Tag, an dem die Eintragung der Ausgliederung in das Register des Sitzes desjenigen Rechtsträgers, dessen Gläubiger sie sind, nach § 19 Abs. 3 UmwG als bekannt gemacht gilt, ihren Anspruch nach Grund und Höhe schriftlich anmelden, Sicherheit zu leisten, soweit sie nicht Befriedigung verlangen können. Dieses Recht steht den Gläubigern jedoch nur zu, wenn sie glaubhaft machen, dass durch die Ausgliederung die Erfüllung der Forderung gefährdet wird."
    },
    {
      "date": "2025-12-29",
      "id": "141096",
      "original_text": "Einreichung neuer Dokumente\nNiedersachsen Amtsgericht Hannover HRB 7610\nNORD/FM Norddeutsche Facility-Management GmbH – Hannover",
      "type": "Einreichung neuer Dokumente",
      "state": "Niedersachsen",
      "amtsgericht": "Amtsgericht Hannover",
      "registernummer": "HRB 7610",
      "registerart": "HRB",
      "company_name": "NORD/FM Norddeutsche Facility-Management GmbH",
      "company_seat": "Hannover",
      "details": "29.12.2025 (Bekanntmachungsdatum)\n\nNiedersachsen Amtsgericht Hannover HRB 7610\nEinreichung neuer Dokumente\n\nNORD/FM Norddeutsche Facility-Management GmbH\nGesellschaft mit beschränkter Haftung\nHannover\n\nDie Liste der Mitglieder des Aufsichtsrats wurde beim Registergericht eingereicht."
    },
    {
      "date": "2025-12-29",
      "id": "141097",
      "original_text": "Registerbekanntmachung nach dem Umwandlungsgesetz\nNiedersachsen Amtsgericht Hildesheim HRB 201230\nC & P Immobilien GmbH – Sarstedt",
      "type": "Registerbekanntmachung nach dem Umwandlungsgesetz",
      "state": "Niedersachsen",
      "amtsgericht": "Amtsgericht Hildesheim",
      "registernummer": "HRB 201230",
      "registerart": "HRB",
      "company_name": "C & P Immobilien GmbH",
      "company_seat": "Sarstedt",
      "details": "29.12.2025 (Bekanntmachungsdatum)\n\nNiedersachsen Amtsgericht Hildesheim HRB 201230\nRegisterbekanntmachung nach dem Umwandlungsgesetz 29.12.2025 (Eintragungsdatum)\n\nC & P Immobilien GmbH\nGesellschaft mit beschränkter Haftung\nSarstedt\n\nDen Gläubigern der an der Abspaltung beteiligten Rechtsträger ist, wenn sie binnen sechs Monaten nach dem Tag, an dem die Eintragung der Abspaltung in das Register des Sitzes desjenigen Rechtsträgers, dessen Gläubiger sie sind, nach § 19 Abs. 3 UmwG als bekannt gemacht gilt, ihren Anspruch nach Grund und Höhe schriftlich anmelden, Sicherheit zu leisten, soweit sie nicht Befriedigung verlangen können. Dieses Recht steht den Gläubigern jedoch nur zu, wenn sie glaubhaft machen, dass durch die Abspaltung die Erfüllung der Forderung gefährdet wird."
    },
    {
      "date": "2025-12-29",
      "id": "141098",
      "original_text": "Registerbekanntmachung nach dem Umwandlungsgesetz\nNiedersachsen Amtsgericht Osnabrück HRB 206985\nMUUUH! Next GmbH – Osnabrück",
      "type": "Registerbekanntmachung nach dem Umwandlungsgesetz",
      "state": "Niedersachsen",
      "amtsgericht": "Amtsgericht Osnabrück",
      "registernummer": "HRB 206985",
      "registerart": "HRB",
      "company_name": "MUUUH! Next GmbH",
      "company_seat": "Osnabrück",
      "details": "29.12.2025 (Bekanntmachungsdatum)\n\nNiedersachsen Amtsgericht Osnabrück HRB 206985\nRegisterbekanntmachung nach dem Umwandlungsgesetz 29.12.2025 (Eintragungsdatum)\n\nMUUUH! Next GmbH\nGesellschaft mit beschränkter Haftung\nOsnabrück\n\nDen Gläubigern der an der Verschmelzung beteiligten Rechtsträger ist, wenn sie binnen sechs Monaten nach dem Tag, an dem die Eintragung der Verschmelzung in das Register des Sitzes desjenigen Rechtsträgers, dessen Gläubiger sie sind, nach § 19  Abs.  3 UmwG als bekannt gemacht gilt, ihren Anspruch nach Grund und Höhe schriftlich anmelden, Sicherheit zu leisten, soweit sie nicht Befriedigung verlangen können. Dieses Recht steht den Gläubigern jedoch nur zu, wenn sie glaubhaft machen, dass durch die Verschmelzung die Erfüllung der Forderung gefährdet wird."
    },
    {
      "date": "2025-12-29",
      "id": "141099",
      "original_text": "Einreichung neuer Dokumente\nNiedersachsen Amtsgericht Hildesheim HRB 3664\nVolkshochschule (VHS) Hildesheim gGmbH – Hildesheim",
      "type": "Einreichung neuer Dokumente",
      "state": "Niedersachsen",
      "amtsgericht": "Amtsgericht Hildesheim",
      "registernummer": "HRB 3664",
      "registerart": "HRB",
      "company_name": "Volkshochschule (VHS) Hildesheim gGmbH",
      "company_seat": "Hildesheim",
      "details": "29.12.2025 (Bekanntmachungsdatum)\n\nNiedersachsen Amtsgericht Hildesheim HRB 3664\nEinreichung neuer Dokumente\n\nVolkshochschule (VHS) Hildesheim gGmbH\nGesellschaft mit beschränkter Haftung\nHildesheim\n\nDie Liste der Mitglieder des Aufsichtsrats wurde beim Registergericht eingereicht."
    },
    {
      "date": "2025-12-29",
      "id": "141100",
      "original_text": "Registerbekanntmachung nach dem Umwandlungsgesetz\nNiedersachsen Amtsgericht Hildesheim HRA 203213\nA & S Diepenau Abbruch GmbH & Co. KG – Lehrte",
      "type": "Registerbekanntmachung nach dem Umwandlungsgesetz",
      "state": "Niedersachsen",
      "amtsgericht": "Amtsgericht Hildesheim",
      "registernummer": "HRA 203213",
      "registerart": "HRA",
      "company_name": "A & S Diepenau Abbruch GmbH & Co. KG",
      "company_seat": "Lehrte",
      "details": "29.12.2025 (Bekanntmachungsdatum)\n\nNiedersachsen Amtsgericht Hildesheim HRA 203213\nRegisterbekanntmachung nach dem Umwandlungsgesetz 29.12.2025 (Eintragungsdatum)\n\nA & S Diepenau Abbruch GmbH & Co. KG\nKommanditgesellschaft\nLehrte\n\nDen Gläubigern der an der Ausgliederung beteiligten Rechtsträger ist, wenn sie binnen sechs Monaten nach dem Tag, an dem die Eintragung der Ausgliederung in das Register des Sitzes desjenigen Rechtsträgers, dessen Gläubiger sie sind, nach § 19 Abs. 3 UmwG als bekannt gemacht gilt, ihren Anspruch nach Grund und Höhe schriftlich anmelden, Sicherheit zu leisten, soweit sie nicht Befriedigung verlangen können. Dieses Recht steht den Gläubigern jedoch nur zu, wenn sie glaubhaft machen, dass durch die Ausgliederung die Erfüllung der Forderung gefährdet wird."
    },
    {
      "date": "2025-12-29",
      "id": "141101",
      "original_text": "Löschungsankündigung\nNiedersachsen Amtsgericht Hildesheim HRB 208407\nEdana-Transport und Logistik UG (haftungsbeschränkt) – Uetze",
      "type": "Löschungsankündigung",
      "state": "Niedersachsen",
      "amtsgericht": "Amtsgericht Hildesheim",
      "registernummer": "HRB 208407",
      "registerart": "HRB",
      "company_name": "Edana-Transport und Logistik UG (haftungsbeschränkt)",
      "company_seat": "Uetze",
      "details": "29.12.2025 (Bekanntmachungsdatum)\n\nNiedersachsen Amtsgericht Hildesheim HRB 208407\nLöschungsankündigung\n\nEdana-Transport und Logistik UG (haftungsbeschränkt)\nGesellschaft mit beschränkter Haftung\nUetze\n\nDas Registergericht beabsichtigt, die Gesellschaft von Amts wegen nach § 394 FamFG zu löschen. Die Frist zur Erhebung eines Widerspruchs ist auf 1 Monat ab dieser Registerbekanntmachung festgesetzt."
    },
    {
      "date": "2025-12-29",
      "id": "141102",
      "original_text": "Löschungsankündigung\nNiedersachsen Amtsgericht Hildesheim HRB 203129\nNB-Projektmanagement GmbH – Bad Salzdetfurth",
      "type": "Löschungsankündigung",
      "state": "Niedersachsen",
      "amtsgericht": "Amtsgericht Hildesheim",
      "registernummer": "HRB 203129",
      "registerart": "HRB",
      "company_name": "NB-Projektmanagement GmbH",
      "company_seat": "Bad Salzdetfurth",
      "details": "29.12.2025 (Bekanntmachungsdatum)\n\nNiedersachsen Amtsgericht Hildesheim HRB 203129\nLöschungsankündigung 12.06.2025 (Eintragungsdatum)\n\nNB-Projektmanagement GmbH\nGesellschaft mit beschränkter Haftung\nBad Salzdetfurth\n\nDas Registergericht beabsichtigt, die Gesellschaft von Amts wegen nach § 394 FamFG zu löschen. Die Frist zur Erhebung eines Widerspruchs ist auf 1 Monat ab dieser Registerbekanntmachung festgesetzt."
    },
    {
      "date": "2025-12-29",
      "id": "141103",
      "original_text": "Löschungsankündigung\nNiedersachsen Amtsgericht Hildesheim HRB 202839\nClusterVision GmbH – Stadtoldendorf",
      "type": "Löschungsankündigung",
      "state": "Niedersachsen",
      "amtsgericht": "Amtsgericht Hildesheim",
      "registernummer": "HRB 202839",
      "registerart": "HRB",
      "company_name": "ClusterVision GmbH",
      "company_seat": "Stadtoldendorf",
      "details": "29.12.2025 (Bekanntmachungsdatum)\n\nNiedersachsen Amtsgericht Hildesheim HRB 202839\nLöschungsankündigung\n\nClusterVision GmbH\nGesellschaft mit beschränkter Haftung\nStadtoldendorf\n\nDas Registergericht beabsichtigt, die Gesellschaft von Amts wegen nach § 394 FamFG zu löschen. Die Frist zur Erhebung eines Widerspruchs ist auf 1 Monat ab dieser Registerbekanntmachung festgesetzt."
    },
    {
      "date": "2025-12-29",
      "id": "141104",
      "original_text": "Löschungsankündigung\nNiedersachsen Amtsgericht Hildesheim HRB 206349\nSport-Generation Fitness Unternehmergesellschaft (haftungsbeschränkt) – Lehrte",
      "type": "Löschungsankündigung",
      "state": "Niedersachsen",
      "amtsgericht": "Amtsgericht Hildesheim",
      "registernummer": "HRB 206349",
      "registerart": "HRB",
      "company_name": "Sport-Generation Fitness Unternehmergesellschaft (haftungsbeschränkt)",
      "company_seat": "Lehrte",
      "details": "29.12.2025 (Bekanntmachungsdatum)\n\nNiedersachsen Amtsgericht Hildesheim HRB 206349\nLöschungsankündigung\n\nSport-Generation Fitness Unternehmergesellschaft (haftungsbeschränkt)\nGesellschaft mit beschränkter Haftung\nLehrte\n\nDas Registergericht beabsichtigt, die Gesellschaft von Amts wegen nach § 394 FamFG zu löschen. Die Frist zur Erhebung eines Widerspruchs ist auf 1 Monat ab dieser Registerbekanntmachung festgesetzt."
    },
    {
      "date": "2025-12-29",
      "id": "141105",
      "original_text": "Sonstige Registerbekanntmachung\nRheinland-Pfalz Amtsgericht Mainz HRA 1384\nMainzer Schlüsselladen Peter Bangert e.K. – Mainz",
      "type": "Sonstige Registerbekanntmachung",
      "state": "Rheinland-Pfalz",
      "amtsgericht": "Amtsgericht Mainz",
      "registernummer": "HRA 1384",
      "registerart": "HRA",
      "company_name": "Mainzer Schlüsselladen Peter Bangert e.K.",
      "company_seat": "Mainz",
      "details": "29.12.2025 (Bekanntmachungsdatum)\n\nRheinland-Pfalz Amtsgericht Mainz HRA 1384\nSonstige Registerbekanntmachung 29.12.2025 (Eintragungsdatum)\n\nMainzer Schlüsselladen Peter Bangert e.K.\nEinzelkaufmann / Einzelkauffrau\nMainz\n\nAls nicht eingetragen wird veröffentlicht: Den Gläubigern der an der Ausgliederung beteiligten Rechtsträger ist, wenn sie binnen sechs Monaten nach dem Tag, an dem die Eintragung der Ausgliederung in das Register des Sitzes desjenigen Rechtsträgers, dessen Gläubiger sie sind, nach §§ 125, 19 Abs. 3 UmwG als bekannt gemacht gilt, ihren Anspruch nach Grund und Höhe schriftlich anmelden, Sicherheit zu leisten, soweit sie nicht Befriedigung verlangen können. Dieses Recht steht den Gläubigern jedoch nur zu, wenn sie glaubhaft machen, dass durch die Ausgliederung die Erfüllung der Forderung gefährdet wird."
    },
    {
      "date": "2025-12-29",
      "id": "141106",
      "original_text": "Einreichung neuer Dokumente\nBremen Amtsgericht Bremen HRB 24359\nRheinmetall Technical Publications GmbH – Bremen",
      "type": "Einreichung neuer Dokumente",
      "state": "Bremen",
      "amtsgericht": "Amtsgericht Bremen",
      "registernummer": "HRB 24359",
      "registerart": "HRB",
      "company_name": "Rheinmetall Technical Publications GmbH",
      "company_seat": "Bremen",
      "details": "29.12.2025 (Bekanntmachungsdatum)\n\nBremen Amtsgericht Bremen HRB 24359\nEinreichung neuer Dokumente\n\nRheinmetall Technical Publications GmbH\nGesellschaft mit beschränkter Haftung\nBremen\n\nAls nicht eingetragen wird bekannt gemacht: Liste des Aufsichtsrats wurde eingereicht."
    },
    {
      "date": "2025-12-29",
      "id": "141107",
      "original_text": "Einreichung neuer Dokumente\nNordrhein-Westfalen Amtsgericht Köln HRB 72608\nDFL Digital Sports GmbH – Köln",
      "type": "Einreichung neuer Dokumente",
      "state": "Nordrhein-Westfalen",
      "amtsgericht": "Amtsgericht Köln",
      "registernummer": "HRB 72608",
      "registerart": "HRB",
      "company_name": "DFL Digital Sports GmbH",
      "company_seat": "Köln",
      "details": "29.12.2025 (Bekanntmachungsdatum)\n\nNordrhein-Westfalen Amtsgericht Köln HRB 72608\nEinreichung neuer Dokumente\n\nDFL Digital Sports GmbH\nGesellschaft mit beschränkter Haftung\nKöln\n\nDem Registergericht ist eine Liste der Mitglieder des Aufsichtsrates eingereicht worden."
    },
    {
      "date": "2025-12-29",
      "id": "141108",
      "original_text": "Registerbekanntmachung nach dem Umwandlungsgesetz\nNordrhein-Westfalen Amtsgericht Düsseldorf HRB 102436\nISOMAX Energiesysteme GmbH – Monheim am Rhein",
      "type": "Registerbekanntmachung nach dem Umwandlungsgesetz",
      "state": "Nordrhein-Westfalen",
      "amtsgericht": "Amtsgericht Düsseldorf",
      "registernummer": "HRB 102436",
      "registerart": "HRB",
      "company_name": "ISOMAX Energiesysteme GmbH",
      "company_seat": "Monheim am Rhein",
      "details": "29.12.2025 (Bekanntmachungsdatum)\n\nNordrhein-Westfalen Amtsgericht Düsseldorf HRB 102436\nRegisterbekanntmachung nach dem Umwandlungsgesetz 29.12.2025 (Eintragungsdatum)\n\nISOMAX Energiesysteme GmbH\nGesellschaft mit beschränkter Haftung\nMonheim am Rhein\n\nDen Gläubigern der an der Verschmelzung beteiligten Rechtsträger ist, wenn sie binnen sechs Monaten nach dem Tag, an dem die Eintragung der Verschmelzung in das Register des Sitzes desjenigen Rechtsträgers, dessen Gläubiger sie sind, nach § 19 Absatz 3 UmwG als bekanntgemacht gilt, ihren Anspruch nach Grund und Höhe schriftlich anmelden, Sicherheit zu leisten, soweit sie nicht Befriedigung verlangen können. Dieses Recht steht den Gläubigern jedoch nur zu, wenn sie glaubhaft machen, dass durch die Verschmelzung die Erfüllung ihrer Forderung gefährdet wird."
    },
    {
      "date": "2025-12-29",
      "id": "141109",
      "original_text": "Einreichung neuer Dokumente\nNordrhein-Westfalen Amtsgericht Köln HRB 120760\nDEVK Psi Aktiengesellschaft – Köln",
      "type": "Einreichung neuer Dokumente",
      "state": "Nordrhein-Westfalen",
      "amtsgericht": "Amtsgericht Köln",
      "registernummer": "HRB 120760",
      "registerart": "HRB",
      "company_name": "DEVK Psi Aktiengesellschaft",
      "company_seat": "Köln",
      "details": "29.12.2025 (Bekanntmachungsdatum)\n\nNordrhein-Westfalen Amtsgericht Köln HRB 120760\nEinreichung neuer Dokumente\n\nDEVK Psi Aktiengesellschaft\nAktiengesellschaft\nKöln\n\nDem Registergericht ist eine neue Liste der Mitglieder des Aufsichtsrates eingereicht worden."
    },
    {
      "date": "2025-12-29",
      "id": "141110",
      "original_text": "Löschungsankündigung\nNordrhein-Westfalen Amtsgericht Dortmund HRB 32895\nRooch Sonnenschutzmontagen UG (haftungsbeschänkt) – Selm",
      "type": "Löschungsankündigung",
      "state": "Nordrhein-Westfalen",
      "amtsgericht": "Amtsgericht Dortmund",
      "registernummer": "HRB 32895",
      "registerart": "HRB",
      "company_name": "Rooch Sonnenschutzmontagen UG (haftungsbeschänkt)",
      "company_seat": "Selm",
      "details": "29.12.2025 (Bekanntmachungsdatum)\n\nNordrhein-Westfalen Amtsgericht Dortmund HRB 32895\nLöschungsankündigung\n\nRooch Sonnenschutzmontagen UG (haftungsbeschänkt)\nGesellschaft mit beschränkter Haftung\nSelm\n\nDas Registergericht beabsichtigt die Gesellschaft von Amts wegen nach § 394 FamFG zu löschen. Die Frist zur Erhebung eines Widerspruchs ist auf zwei Monate festgesetzt."
    },
    {
      "date": "2025-12-29",
      "id": "141111",
      "original_text": "Einreichung neuer Dokumente\nNordrhein-Westfalen Amtsgericht Paderborn HRB 17061\nBREMER SE – Paderborn",
      "type": "Einreichung neuer Dokumente",
      "state": "Nordrhein-Westfalen",
      "amtsgericht": "Amtsgericht Paderborn",
      "registernummer": "HRB 17061",
      "registerart": "HRB",
      "company_name": "BREMER SE",
      "company_seat": "Paderborn",
      "details": "29.12.2025 (Bekanntmachungsdatum)\n\nNordrhein-Westfalen Amtsgericht Paderborn HRB 17061\nEinreichung neuer Dokumente\n\nBREMER SE\nEuropäische Aktiengesellschaft (SE)\nPaderborn\n\nDem Registergericht ist eine Liste der Mitglieder des Aufsichtsrates eingereicht worden."
    },
    {
      "date": "2025-12-29",
      "id": "141112",
      "original_text": "Einreichung neuer Dokumente\nNordrhein-Westfalen Amtsgericht Duisburg HRB 20299\nThyssenKrupp MillServices & Systems GmbH – Duisburg",
      "type": "Einreichung neuer Dokumente",
      "state": "Nordrhein-Westfalen",
      "amtsgericht": "Amtsgericht Duisburg",
      "registernummer": "HRB 20299",
      "registerart": "HRB",
      "company_name": "ThyssenKrupp MillServices & Systems GmbH",
      "company_seat": "Duisburg",
      "details": "29.12.2025 (Bekanntmachungsdatum)\n\nNordrhein-Westfalen Amtsgericht Duisburg HRB 20299\nEinreichung neuer Dokumente\n\nThyssenKrupp MillServices & Systems GmbH\nGesellschaft mit beschränkter Haftung\nDuisburg\n\nDem Registergericht ist eine Liste der Mitglieder des Aufsichtsrates eingereicht worden."
    },
    {
      "date": "2025-12-29",
      "id": "141113",
      "original_text": "Einreichung neuer Dokumente\nNordrhein-Westfalen Amtsgericht Düsseldorf HRB 42975\nPortigon AG – Düsseldorf",
      "type": "Einreichung neuer Dokumente",
      "state": "Nordrhein-Westfalen",
      "amtsgericht": "Amtsgericht Düsseldorf",
      "registernummer": "HRB 42975",
      "registerart": "HRB",
      "company_name": "Portigon AG",
      "company_seat": "Düsseldorf",
      "details": "29.12.2025 (Bekanntmachungsdatum)\n\nNordrhein-Westfalen Amtsgericht Düsseldorf HRB 42975\nEinreichung neuer Dokumente\n\nPortigon AG\nAktiengesellschaft\nDüsseldorf\n\nDem Registergericht ist eine Liste der Mitglieder des Aufsichtsrates eingereicht worden."
    },
    {
      "date": "2025-12-29",
      "id": "141114",
      "original_text": "Löschungsankündigung\nNordrhein-Westfalen Amtsgericht Dortmund HRB 32288\nHD Bauunternehmen GmbH – Dortmund",
      "type": "Löschungsankündigung",
      "state": "Nordrhein-Westfalen",
      "amtsgericht": "Amtsgericht Dortmund",
      "registernummer": "HRB 32288",
      "registerart": "HRB",
      "company_name": "HD Bauunternehmen GmbH",
      "company_seat": "Dortmund",
      "details": "29.12.2025 (Bekanntmachungsdatum)\n\nNordrhein-Westfalen Amtsgericht Dortmund HRB 32288\nLöschungsankündigung\n\nHD Bauunternehmen GmbH\nGesellschaft mit beschränkter Haftung\nDortmund\n\nDas Registergericht beabsichtigt die Gesellschaft von Amts wegen nach § 394 FamFG zu löschen. Die Frist zur Erhebung eines Widerspruchs ist auf zwei Monate festgesetzt."
    },
    {
      "date": "2025-12-29",
      "id": "141115",
      "original_text": "Löschungsankündigung\nNordrhein-Westfalen Amtsgericht Köln HRB 121767\nMS Montage und Sanierung GmbH – Köln",
      "type": "Löschungsankündigung",
      "state": "Nordrhein-Westfalen",
      "amtsgericht": "Amtsgericht Köln",
      "registernummer": "HRB 121767",
      "registerart": "HRB",
      "company_name": "MS Montage und Sanierung GmbH",
      "company_seat": "Köln",
      "details": "29.12.2025 (Bekanntmachungsdatum)\n\nNordrhein-Westfalen Amtsgericht Köln HRB 121767\nLöschungsankündigung\n\nMS Montage und Sanierung GmbH\nGesellschaft mit beschränkter Haftung\nKöln\n\nDas Registergericht beabsichtigt, die im Handelsregister eingetragene Gesellschaft gemäß § 394 Absatz 1 FamFG wegen Vermögenslosigkeit von Amts wegen zu löschen. Gegen diese Verfügung kann Widerspruch eingelegt werden. Die Frist zur Erhebung eines Widerspruchs gegen die beabsichtigte Löschung von Amts wegen ist auf einen Monat festgesetzt. Rechtsbehelfsbelehrung: Gegen diese Verfügung können Sie Widerspruch einlegen. Der Widerspruch ist bei dem Amtsgericht Köln, Reichenspergerplatz 1, 50670 Köln schriftlich in deutscher Sprache oder zur Niederschrift der Geschäftsstelle einzulegen. Der Widerspruch kann auch zur Niederschrift der Geschäftsstelle eines jeden Amtsgerichtes abgegeben werden. Die Einlegung ist auch durch Übertragung eines elektronischen Dokuments an die elektronische Poststelle des Gerichts möglich. Das elektronische Dokument muss für die Bearbeitung durch das Gericht geeignet und mit einer qualifizierten elektronischen Signatur der verantwortenden Person versehen sein oder von der verantwortenden Person signiert und auf einem sicheren Übermittlungsweg gemäß § 130a ZPO nach näherer Maßgabe der Verordnung über die technischen Rahmenbedingungen des elektronischen Rechtsverkehrs und über das besondere elektronische Behördenpostfach (BGBl. I, S.3803) eingereicht werden. Weitere Informationen erhalten Sie auf der Internetseite www.justiz.de.Der Widerspruch muss spätestens innerhalb der gesetzten Frist bei dem Amtsgericht Köln eingegangen sein. Dies gilt auch dann, wenn der Widerspruch zur Niederschrift der Geschäftsstelle eines anderen Amtsgerichtes abgegeben wurde. Die Frist beginnt mit der Veröffentlichung. Fällt das Ende der Frist auf einen Sonntag, einen allgemeinen Feiertag oder Sonnabend, so endet die Frist mit Ablauf des nächsten Werktages.\n\nDer Widerspruch muss die Bezeichnung der angefochtenen Verfügung sowie die Erklärung enthalten, dass Widerspruch gegen diese Verfügung eingelegt wird. Er ist zu unterzeichnen und soll begründet werden."
    },
    {
      "date": "2025-12-29",
      "id": "141116",
      "original_text": "Löschungsankündigung\nNordrhein-Westfalen Amtsgericht Kleve HRB 13986\nA&C Cars GmbH – Kamp-Lintfort",
      "type": "Löschungsankündigung",
      "state": "Nordrhein-Westfalen",
      "amtsgericht": "Amtsgericht Kleve",
      "registernummer": "HRB 13986",
      "registerart": "HRB",
      "company_name": "A&C Cars GmbH",
      "company_seat": "Kamp-Lintfort",
      "details": "29.12.2025 (Bekanntmachungsdatum)\n\nNordrhein-Westfalen Amtsgericht Kleve HRB 13986\nLöschungsankündigung\n\nA&C Cars GmbH\nGesellschaft mit beschränkter Haftung\nKamp-Lintfort\n\nDas Registergericht beabsichtigt die Gesellschaft von Amts wegen nach § 394 FamFG zu löschen. Die Frist zur Erhebung eines Widerspruchs ist auf einen Monat festgesetzt."
    },
    {
      "date": "2025-12-29",
      "id": "141117",
      "original_text": "Registerbekanntmachung nach dem Umwandlungsgesetz\nNordrhein-Westfalen Amtsgericht Iserlohn HRB 11278\nBIO-LABOR Hemer GmbH – Hemer",
      "type": "Registerbekanntmachung nach dem Umwandlungsgesetz",
      "state": "Nordrhein-Westfalen",
      "amtsgericht": "Amtsgericht Iserlohn",
      "registernummer": "HRB 11278",
      "registerart": "HRB",
      "company_name": "BIO-LABOR Hemer GmbH",
      "company_seat": "Hemer",
      "details": "29.12.2025 (Bekanntmachungsdatum)\n\nNordrhein-Westfalen Amtsgericht Iserlohn HRB 11278\nRegisterbekanntmachung nach dem Umwandlungsgesetz 17.12.2025 (Eintragungsdatum)\n\nBIO-LABOR Hemer GmbH\nGesellschaft mit beschränkter Haftung\nHemer\n\nDen Gläubigern der an der Abspaltung beteiligten Rechtsträger ist, wenn sie binnen sechs Monaten nach dem Tag, an dem die Eintragung der Abspaltung in das Register des Sitzes desjenigen Rechtsträgers, dessen Gläubiger sie sind, nach § 19 Absatz 3 UmwG als bekanntgemacht gilt, ihren Anspruch nach Grund und Höhe schriftlich anmelden, Sicherheit zu leisten, soweit sie nicht Befriedigung verlangen können. Dieses Recht steht den Gläubigern jedoch nur zu, wenn sie glaubhaft machen, dass durch die Abspaltung die Erfüllung ihrer Forderung gefährdet wird."
    },
    {
      "date": "2025-12-29",
      "id": "141118",
      "original_text": "Registerbekanntmachung nach dem Umwandlungsgesetz\nNordrhein-Westfalen Amtsgericht Düsseldorf HRB 57721\nFusion Invest GmbH – Düsseldorf",
      "type": "Registerbekanntmachung nach dem Umwandlungsgesetz",
      "state": "Nordrhein-Westfalen",
      "amtsgericht": "Amtsgericht Düsseldorf",
      "registernummer": "HRB 57721",
      "registerart": "HRB",
      "company_name": "Fusion Invest GmbH",
      "company_seat": "Düsseldorf",
      "details": "29.12.2025 (Bekanntmachungsdatum)\n\nNordrhein-Westfalen Amtsgericht Düsseldorf HRB 57721\nRegisterbekanntmachung nach dem Umwandlungsgesetz 29.12.2025 (Eintragungsdatum)\n\nFusion Invest GmbH\nGesellschaft mit beschränkter Haftung\nDüsseldorf\n\nDen Gläubigern der an der Verschmelzung beteiligten Rechtsträger ist, wenn sie binnen sechs Monaten nach dem Tag, an dem die Eintragung der Verschmelzung in das Register des Sitzes desjenigen Rechtsträgers, dessen Gläubiger sie sind, nach § 19 Absatz 3 UmwG als bekanntgemacht gilt, ihren Anspruch nach Grund und Höhe schriftlich anmelden, Sicherheit zu leisten, soweit sie nicht Befriedigung verlangen können. Dieses Recht steht den Gläubigern jedoch nur zu, wenn sie glaubhaft machen, dass durch die Verschmelzung die Erfüllung ihrer Forderung gefährdet wird."
    },
    {
      "date": "2025-12-29",
      "id": "141119",
      "original_text": "Registerbekanntmachung nach dem Umwandlungsgesetz\nNordrhein-Westfalen Amtsgericht Essen HRA 10923\nTextation Group GmbH & Co. KG – Sprockhövel",
      "type": "Registerbekanntmachung nach dem Umwandlungsgesetz",
      "state": "Nordrhein-Westfalen",
      "amtsgericht": "Amtsgericht Essen",
      "registernummer": "HRA 10923",
      "registerart": "HRA",
      "company_name": "Textation Group GmbH & Co. KG",
      "company_seat": "Sprockhövel",
      "details": "29.12.2025 (Bekanntmachungsdatum)\n\nNordrhein-Westfalen Amtsgericht Essen HRA 10923\nRegisterbekanntmachung nach dem Umwandlungsgesetz 29.12.2025 (Eintragungsdatum)\n\nTextation Group GmbH & Co. KG\nKommanditgesellschaft\nSprockhövel\n\nDen Gläubigern der an der Verschmelzung beteiligten Rechtsträger ist, wenn sie binnen sechs Monaten nach dem Tag, an dem die Eintragung der Verschmelzung in das Register des Sitzes desjenigen Rechtsträgers, dessen Gläubiger sie sind, nach § 19 Absatz 3 UmwG als bekanntgemacht gilt, ihren Anspruch nach Grund und Höhe schriftlich anmelden, Sicherheit zu leisten, soweit sie nicht Befriedigung verlangen können. Dieses Recht steht den Gläubigern jedoch nur zu, wenn sie glaubhaft machen, dass durch die Verschmelzung die Erfüllung ihrer Forderung gefährdet wird."
    },
    {
      "date": "2025-12-29",
      "id": "141120",
      "original_text": "Löschungsankündigung\nNordrhein-Westfalen Amtsgericht Düsseldorf HRB 102657\nG.V.I. Berlin, Karl-Marx-Str. 92-98 GmbH – Düsseldorf",
      "type": "Löschungsankündigung",
      "state": "Nordrhein-Westfalen",
      "amtsgericht": "Amtsgericht Düsseldorf",
      "registernummer": "HRB 102657",
      "registerart": "HRB",
      "company_name": "G.V.I. Berlin, Karl-Marx-Str. 92-98 GmbH",
      "company_seat": "Düsseldorf",
      "details": "29.12.2025 (Bekanntmachungsdatum)\n\nNordrhein-Westfalen Amtsgericht Düsseldorf HRB 102657\nLöschungsankündigung\n\nG.V.I. Berlin, Karl-Marx-Str. 92-98 GmbH\nGesellschaft mit beschränkter Haftung\nDüsseldorf\n\nDas Registergericht beabsichtigt die Gesellschaft von Amts wegen nach § 394 FamFG zu löschen. Die Frist zur Erhebung eines Widerspruchs ist auf 3 Wochen festgesetzt.\n\nRechtsbehelfsbelehrung:\nDas Widerspruchsrecht steht jedem zu, der an der Unterlassung der Löschung ein berechtigtes Interesse hat. Der Widerspruch ist bei dem Amtsgericht Düsseldorf -Registergericht-, Werdener Straße 1, 40227 Düsseldorf schriftlich in deutscher Sprache oder zur Niederschrift der Geschäftsstelle einzulegen. Der Widerspruch kann auch zur Niederschrift der Geschäftsstelle eines jeden Amtsgerichtes abgegeben werden. Die Einlegung ist auch durch Übertragung eines elektronischen Dokuments an die elektronische Poststelle des Gerichts möglich. Das elektronische Dokument muss für die Bearbeitung durch das Gericht geeignet und mit einer qualifizierten elektronischen Signatur der verantwortenden Person versehen sein oder von der verantwortenden Person signiert und auf einem sicheren Übermittlungsweg gemäß § 130a ZPO nach näherer Maßgabe der Verordnung über die technischen Rahmenbedingungen des elektronischen Rechtsverkehrs und über das besondere elektronische Behördenpostfach (BGBl. I, S.3803) eingereicht werden. Weitere Informationen erhalten Sie auf der Internetseite www.justiz.de.\nDer Widerspruch muss spätestens innerhalb der gesetzten Frist nach dem Datum der Bekanntmachung der Löschungsankündigung bei dem Amtsgericht - Registergericht - Düsseldorf eingegangen sein.  Dies gilt auch dann, wenn der Widerspruch zur Niederschrift der Geschäftsstelle eines anderen Amtsgerichtes abgegeben wurde. Die Frist beginnt mit dem Tage der Bekanntmachung der Löschungsankündigung in dem für die Bekanntmachung der Eintragungen in das Handelsregister bestimmten elektronischen Informations- und Kommunikationssystem nach § 10 des Handelsgesetzbuches. Fällt das Ende der Frist auf einen Sonntag, einen allgemeinen Feiertag oder Sonnabend, so endet die Frist mit Ablauf des nächsten Werktages.\nDer Widerspruch muss die Bezeichnung der angefochtenen Löschungsankündigung sowie die Erklärung enthalten, dass Widerspruch gegen diese Löschungsankündigung eingelegt wird. Er ist zu unterzeichnen und soll begründet werden."
    },
    {
      "date": "2025-12-29",
      "id": "141121",
      "original_text": "Registerbekanntmachung nach dem Umwandlungsgesetz\nNordrhein-Westfalen Amtsgericht Siegburg HRB 16344\nGFI - Rheinland GmbH – Sankt Augustin",
      "type": "Registerbekanntmachung nach dem Umwandlungsgesetz",
      "state": "Nordrhein-Westfalen",
      "amtsgericht": "Amtsgericht Siegburg",
      "registernummer": "HRB 16344",
      "registerart": "HRB",
      "company_name": "GFI - Rheinland GmbH",
      "company_seat": "Sankt Augustin",
      "details": "29.12.2025 (Bekanntmachungsdatum)\n\nNordrhein-Westfalen Amtsgericht Siegburg HRB 16344\nRegisterbekanntmachung nach dem Umwandlungsgesetz 29.12.2025 (Eintragungsdatum)\n\nGFI - Rheinland GmbH\nGesellschaft mit beschränkter Haftung\nSankt Augustin\n\nDen Gläubigern der an der Verschmelzung beteiligten Rechtsträger ist, wenn sie binnen sechs Monaten nach dem Tag, an dem die Eintragung der Verschmelzung in das Register des Sitzes desjenigen Rechtsträgers, dessen Gläubiger sie sind, nach § 19 Absatz 3 UmwG als bekanntgemacht gilt, ihren Anspruch nach Grund und Höhe schriftlich anmelden, Sicherheit zu leisten, soweit sie nicht Befriedigung verlangen können. Dieses Recht steht den Gläubigern jedoch nur zu, wenn sie glaubhaft machen, dass durch die Verschmelzung die Erfüllung ihrer Forderung gefährdet wird."
    },
    {
      "date": "2025-12-29",
      "id": "141122",
      "original_text": "Registerbekanntmachung nach dem Umwandlungsgesetz\nNordrhein-Westfalen Amtsgericht Düsseldorf HRB 15585\nTECHDATA VDI-MEDIEN-VERTRIEBS-GESELLSCHAFT MBH – Düsseldorf",
      "type": "Registerbekanntmachung nach dem Umwandlungsgesetz",
      "state": "Nordrhein-Westfalen",
      "amtsgericht": "Amtsgericht Düsseldorf",
      "registernummer": "HRB 15585",
      "registerart": "HRB",
      "company_name": "TECHDATA VDI-MEDIEN-VERTRIEBS-GESELLSCHAFT MBH",
      "company_seat": "Düsseldorf",
      "details": "29.12.2025 (Bekanntmachungsdatum)\n\nNordrhein-Westfalen Amtsgericht Düsseldorf HRB 15585\nRegisterbekanntmachung nach dem Umwandlungsgesetz 29.12.2025 (Eintragungsdatum)\n\nTECHDATA VDI-MEDIEN-VERTRIEBS-GESELLSCHAFT MBH\nGesellschaft mit beschränkter Haftung\nDüsseldorf\n\nDen Gläubigern der an der Verschmelzung beteiligten Rechtsträger ist, wenn sie binnen sechs Monaten nach dem Tag, an dem die Eintragung der Verschmelzung in das Register des Sitzes desjenigen Rechtsträgers, dessen Gläubiger sie sind, nach § 19 Absatz 3 UmwG als bekanntgemacht gilt, ihren Anspruch nach Grund und Höhe schriftlich anmelden, Sicherheit zu leisten, soweit sie nicht Befriedigung verlangen können. Dieses Recht steht den Gläubigern jedoch nur zu, wenn sie glaubhaft machen, dass durch die Verschmelzung die Erfüllung ihrer Forderung gefährdet wird."
    },
    {
      "date": "2025-12-29",
      "id": "141123",
      "original_text": "Löschungsankündigung\nNordrhein-Westfalen Amtsgericht Recklinghausen HRB 9518\n123German Rail Service UG (haftungsbeschränkt) – Recklinghausen",
      "type": "Löschungsankündigung",
      "state": "Nordrhein-Westfalen",
      "amtsgericht": "Amtsgericht Recklinghausen",
      "registernummer": "HRB 9518",
      "registerart": "HRB",
      "company_name": "123German Rail Service UG (haftungsbeschränkt)",
      "company_seat": "Recklinghausen",
      "details": "29.12.2025 (Bekanntmachungsdatum)\n\nNordrhein-Westfalen Amtsgericht Recklinghausen HRB 9518\nLöschungsankündigung\n\n123German Rail Service UG (haftungsbeschränkt)\nGesellschaft mit beschränkter Haftung\nRecklinghausen\n\nDas Registergericht beabsichtigt die Gesellschaft von Amts wegen nach § 394 FamFG zu löschen. Die Frist zur Erhebung eines Widerspruchs ist auf zwei Monate festgesetzt."
    },
    {
      "date": "2025-12-29",
      "id": "141124",
      "original_text": "Sonstige Registerbekanntmachung\nNordrhein-Westfalen Amtsgericht Düsseldorf HRB 75951\nWEBA Services GmbH – Düsseldorf",
      "type": "Sonstige Registerbekanntmachung",
      "state": "Nordrhein-Westfalen",
      "amtsgericht": "Amtsgericht Düsseldorf",
      "registernummer": "HRB 75951",
      "registerart": "HRB",
      "company_name": "WEBA Services GmbH",
      "company_seat": "Düsseldorf",
      "details": "29.12.2025 (Bekanntmachungsdatum)\n\nNordrhein-Westfalen Amtsgericht Düsseldorf HRB 75951\nSonstige Registerbekanntmachung 29.12.2025 (Eintragungsdatum)\n\nWEBA Services GmbH\nGesellschaft mit beschränkter Haftung\nDüsseldorf\n\nAls nicht eingetragen wird veröffentlicht: Den Gläubigern der Gesellschaft, deren Forderungen begründet worden sind bevor die Eintragung der Beendigung des Beherrschungs- und Gewinnabführungsvertrages  in das Handelsregister nach § 10 des Handelsgesetzbuches als bekanntgemacht gilt, hat der andere Vertragsteil Sicherheit zu leisten, wenn sie sich binnen sechs Monaten nach der Bekanntmachung der Eintragung zu diesem Zweck bei ihm melden."
    },
    {
      "date": "2025-12-29",
      "id": "141125",
      "original_text": "Löschungsankündigung\nNordrhein-Westfalen Amtsgericht Köln HRB 93407\nMelody bit UG (haftungsbeschränkt) – Köln",
      "type": "Löschungsankündigung",
      "state": "Nordrhein-Westfalen",
      "amtsgericht": "Amtsgericht Köln",
      "registernummer": "HRB 93407",
      "registerart": "HRB",
      "company_name": "Melody bit UG (haftungsbeschränkt)",
      "company_seat": "Köln",
      "details": "29.12.2025 (Bekanntmachungsdatum)\n\nNordrhein-Westfalen Amtsgericht Köln HRB 93407\nLöschungsankündigung\n\nMelody bit UG (haftungsbeschränkt)\nGesellschaft mit beschränkter Haftung\nKöln\n\nDas Registergericht beabsichtigt die Gesellschaft von Amts wegen nach § 394 FamFG zu löschen. Die Frist zur Erhebung eines Widerspruchs ist auf einen Monat festgesetzt."
    },
    {
      "date": "2025-12-29",
      "id": "141126",
      "original_text": "Einreichung neuer Dokumente\nNordrhein-Westfalen Amtsgericht Köln HRB 85281\nCovestro AG – Leverkusen",
      "type": "Einreichung neuer Dokumente",
      "state": "Nordrhein-Westfalen",
      "amtsgericht": "Amtsgericht Köln",
      "registernummer": "HRB 85281",
      "registerart": "HRB",
      "company_name": "Covestro AG",
      "company_seat": "Leverkusen",
      "details": "29.12.2025 (Bekanntmachungsdatum)\n\nNordrhein-Westfalen Amtsgericht Köln HRB 85281\nEinreichung neuer Dokumente\n\nCovestro AG\nAktiengesellschaft\nLeverkusen\n\nDem Registergericht ist eine Liste der Mitglieder des Aufsichtsrates eingereicht worden."
    },
    {
      "date": "2025-12-29",
      "id": "141127",
      "original_text": "Löschungsankündigung\nThüringen Amtsgericht Jena HRB 209147\nHommel Vermessungssysteme GmbH – Jena",
      "type": "Löschungsankündigung",
      "state": "Thüringen",
      "amtsgericht": "Amtsgericht Jena",
      "registernummer": "HRB 209147",
      "registerart": "HRB",
      "company_name": "Hommel Vermessungssysteme GmbH",
      "company_seat": "Jena",
      "details": "29.12.2025 (Bekanntmachungsdatum)\n\nThüringen Amtsgericht Jena HRB 209147\nLöschungsankündigung\n\nHommel Vermessungssysteme GmbH\nGesellschaft mit beschränkter Haftung\nJena\n\nDas Registergericht beabsichtigt, die im Handelsregister eingetragene Gesellschaft wegen Vermögenslosigkeit nach § 394 FamFG von Amts wegen zu löschen. Die Frist zur Erhebung eines Widerspruchs gegen die beabsichtigte Löschung wird auf 6 Wochen festgesetzt."
    },
    {
      "date": "2025-12-29",
      "id": "141128",
      "original_text": "Registerbekanntmachung nach dem Umwandlungsgesetz\nThüringen Amtsgericht Jena HRB 400060\nBaugeschäft Burkhardt GmbH – Mühlhausen/Thüringen",
      "type": "Registerbekanntmachung nach dem Umwandlungsgesetz",
      "state": "Thüringen",
      "amtsgericht": "Amtsgericht Jena",
      "registernummer": "HRB 400060",
      "registerart": "HRB",
      "company_name": "Baugeschäft Burkhardt GmbH",
      "company_seat": "Mühlhausen/Thüringen",
      "details": "29.12.2025 (Bekanntmachungsdatum)\n\nThüringen Amtsgericht Jena HRB 400060\nRegisterbekanntmachung nach dem Umwandlungsgesetz 29.12.2025 (Eintragungsdatum)\n\nBaugeschäft Burkhardt GmbH\nGesellschaft mit beschränkter Haftung\nMühlhausen/Thüringen\n\nNicht eingetragen: Den Gläubigern der an der Spaltung beteiligten Rechtsträger, ist wenn sie binnen sechs Monaten nach dem Tag, an dem die Eintragung der Spaltung in das Register des Sitzes desjenigen Rechtsträgers, dessen Gläubiger sie sind,  nach §§ 125, 19 Abs. 3 UmwG als bekanntgemacht gilt, ihren Anspruch nach Grund und Höhe schriftlich anmelden, Sicherheit zu leisten, soweit sie nicht Befriedigung verlangen können. Dieses Recht steht ihnen jedoch nur zu, wenn sie glaubhaft machen, daß durch die Spaltung die Erfüllung ihrer Forderung gefährdet wird."
    },
    {
      "date": "2025-12-29",
      "id": "141129",
      "original_text": "Registerbekanntmachung nach dem Umwandlungsgesetz\nHessen Amtsgericht Frankfurt am Main HRB 52269\nGerefin GmbH – Frankfurt am Main",
      "type": "Registerbekanntmachung nach dem Umwandlungsgesetz",
      "state": "Hessen",
      "amtsgericht": "Amtsgericht Frankfurt am Main",
      "registernummer": "HRB 52269",
      "registerart": "HRB",
      "company_name": "Gerefin GmbH",
      "company_seat": "Frankfurt am Main",
      "details": "29.12.2025 (Bekanntmachungsdatum)\n\nHessen Amtsgericht Frankfurt am Main HRB 52269\nRegisterbekanntmachung nach dem Umwandlungsgesetz\n\nGerefin GmbH\nGesellschaft mit beschränkter Haftung\nFrankfurt am Main\n\nDem Registergericht ist der Entwurf eines Verschmelzungsplans über die geplante grenzüberschreitende Verschmelzung eingereicht worden.\nDie Gerefin GmbH mit Sitz in Frankfurt am Main, Deutschland, eingetragen im Handelsregister des Amtsgerichts Frankfurt am Main unter HRB 52269, soll als übertragender Rechtsträger im Wege einer grenzüberschreitenden Verschmelzung durch Aufnahme auf die Agache S.C.A., eine nach französischem Recht gegründete und bestehendeKommanditgesellschaft auf Aktien (société en commandite par actions) mit Sitz in Paris, Frankreich, eingetragen im französischen Handels- und Gesellschaftsregister beim Registergericht des Handelsgerichts Paris (Registre du commerce et des sociétés) unter der Nummer 314 685 454, als übernehmendem Rechtsträger im Wege der Verschmelzung durch Aufnahme (ohne Liquidation) gemäß §§ 305 ff. UmwG und gemäß den Artikeln L 236-1 ff. und R 236-1 ff. des französischen Handelsgesetzbuchs in seiner aktuellen Fassung (Code de commerce) verschmolzen werden.\nGemäß § 308 UmwG wird hiermit der Entwurf des gemeinsamen Verschmelzungsplans für die grenzüberschreitende Verschmelzung der Gerefin GmbH auf die Agache S.C.A. zum Handelsregister eingereicht mit der Bitte um unverzügliche Bekanntmachung nach § 308 Abs. 1 Satz 2 UmwG in Verbindung mit § 10 Handelsgesetzbuch (HGB). Hiermit wird gemäß § 308 Abs. 1 Satz 3 UmwG der folgende Inhalt der gemäß § 308 Abs. 1 Satz 2 UmwG bekannt zu machenden Angaben mitgeteilt:\na) Zu § 308 Abs. 1 Satz 2 Nr. 1 UmwG: Der Entwurf des gemeinsamen Verschmelzungsplans einschließlich der Satzung der übernehmenden Gesellschaft wurde beim Handelsregister Frankfurt am Main eingereicht.\nb) Zu § 308 Abs. 1 Satz 2 Nr. 2 UmwG: An der Verschmelzung sind folgende Rechtsträger beteiligt:\naa) Gerefin GmbH mit Sitz in Frankfurt am Main, Deutschland, eingetragen im Handelsregister des Amtsgerichts Frankfurt am Main unter HRB 52269 als übertragende Gesellschaft;\nbb) Agache S.C.A., eine nach französischem Recht gegründete und bestehende Kommanditgesellschaft auf Aktien (société en commandite par actions), mit Sitz in Paris, Frankreich, eingetragen in Frankreich im Handels- und Gesellschaftsregister beim Registergericht des Handelsgerichts Paris (Registre du commerce et des sociétés) unter der Nummer 314 685 454 als übernehmende Gesellschaft.\nc) Zu § 308 Abs. 1 Satz 2 Nr. 3 UmwG: Die Registerangaben zu den beteiligten Gesellschaften lauten wie folgt:\naa) Gerefin GmbH, die übertragende Gesellschaft, ist im Handelsregister des Amtsgerichts Frankfurt am Main unter Nummer HRB 52269 eingetragen.\nbb) Agache S.C.A., die übernehmende Gesellschaft, ist im Handels- und Gesellschaftsregister beim Registergericht des Handelsgerichts Paris (Registre du commerce et des sociétés) unterNummer 314 685 454 eingetragen.\nd) Zu § 308 Abs. 1 Satz 2 Nr. 4 UmwG:\nDie Anteilsinhaber und Gläubiger der an der Verschmelzung beteiligten Gesellschaften sowie die zuständigen Betriebsräte (bzw. soweit es keinen Betriebsrat gibt, die Arbeitnehmer der an der Verschmelzung beteiligten Gesellschaften), können etwaige Bemerkungen und Stellungnahmen zum Verschmelzungsplan bis spätestens fünf Arbeitstage vor dem Tag der Gesellschafterversammlung bzw. Hauptversammlung der an der Verschmelzung beteiligten Gesellschaften, die über die grenzüberschreitende Verschmelzung beschließen (bzw. bei Entbehrlichkeit eines Zustimmungsbeschlusses der Anteilsinhaber des Termins der Beurkundung des Verschmelzungsplans; bei der Gerefin GmbH ist kein Zustimmungsbeschluss der Anteilsinhaber erforderlich), übermitteln.\nDie Beurkundung des Verschmelzungsplans und die außerordentliche Hauptversammlung der Agache S.C.A., in der über die Zustimmung zum Verschmelzungsplan Beschluss gefasst werden soll, sollen voraussichtlich am (und jedenfalls nicht vor dem) 9. April 2026 stattfinden.\n\nDie Bemerkungen und Stellungnahmen von Anteilsinhabern, Gläubigern und Arbeitnehmern der Gerefin GmbH und der der Agache S.C.A. können wie folgt adressiert werden: Gerefin GmbH Wiesenhüttenstraße 11, 60329 Frankfurt am Main Germany oder per E-Mail ancontact@gerefin.com oder wahlweise auch an die Agache S.C.A.Agache S.C.A.41, avenue Montaigne75008 Paris/France."
    },
    {
      "date": "2025-12-29",
      "id": "141130",
      "original_text": "Registerbekanntmachung nach dem Umwandlungsgesetz\nHessen Amtsgericht Frankfurt am Main HRB 103516\nflatexDEGIRO AG – Frankfurt am Main",
      "type": "Registerbekanntmachung nach dem Umwandlungsgesetz",
      "state": "Hessen",
      "amtsgericht": "Amtsgericht Frankfurt am Main",
      "registernummer": "HRB 103516",
      "registerart": "HRB",
      "company_name": "flatexDEGIRO AG",
      "company_seat": "Frankfurt am Main",
      "details": "29.12.2025 (Bekanntmachungsdatum)\n\nHessen Amtsgericht Frankfurt am Main HRB 103516\nRegisterbekanntmachung nach dem Umwandlungsgesetz 29.12.2025 (Eintragungsdatum)\n\nflatexDEGIRO AG\nAktiengesellschaft\nFrankfurt am Main\n\nDen Gläubigern der an der formwechselnden Umwandlung beteiligten Rechtsträger ist, wenn sie binnen sechs Monaten nach dem Tag, an dem die Eintragung der formwechselnden Umwandlung in das Register des Sitzes desjenigen Rechtsträgers, dessen Gläubiger sie sind, nach § 201 UmwG bekannt gemacht worden ist, ihren Anspruch nach Grund und Höhe schriftlich anmelden, Sicherheit zu leisten, soweit sie nicht Befriedigung verlangen können. Dieses Recht steht den Gläubigern jedoch nur zu, wenn sie glaubhaft machen, dass durch die formwechselnden Umwandlung die Erfüllung ihrer Forderung gefährdet wird."
    },
    {
      "date": "2025-12-29",
      "id": "141131",
      "original_text": "Einreichung neuer Dokumente\nHessen Amtsgericht Frankfurt am Main HRB 7920\nGWH Wohnungsgesellschaft mbH Hessen – Frankfurt am Main",
      "type": "Einreichung neuer Dokumente",
      "state": "Hessen",
      "amtsgericht": "Amtsgericht Frankfurt am Main",
      "registernummer": "HRB 7920",
      "registerart": "HRB",
      "company_name": "GWH Wohnungsgesellschaft mbH Hessen",
      "company_seat": "Frankfurt am Main",
      "details": "29.12.2025 (Bekanntmachungsdatum)\n\nHessen Amtsgericht Frankfurt am Main HRB 7920\nEinreichung neuer Dokumente\n\nGWH Wohnungsgesellschaft mbH Hessen\nGesellschaft mit beschränkter Haftung\nFrankfurt am Main\n\nDurch eine Änderung in den Personen der Aufsichtsratsmitglieder ist eine Liste der Mitglieder des Aufsichtsrates zum Handelsregister eingereicht worden."
    },
    {
      "date": "2025-12-29",
      "id": "141132",
      "original_text": "Registerbekanntmachung nach dem Umwandlungsgesetz\nHessen Amtsgericht Bad Homburg v.d.H. HRA 6433\nKlaas Elektrotechnik e.K. – Oberursel (Taunus)",
      "type": "Registerbekanntmachung nach dem Umwandlungsgesetz",
      "state": "Hessen",
      "amtsgericht": "Amtsgericht Bad Homburg v.d.H.",
      "registernummer": "HRA 6433",
      "registerart": "HRA",
      "company_name": "Klaas Elektrotechnik e.K.",
      "company_seat": "Oberursel (Taunus)",
      "details": "29.12.2025 (Bekanntmachungsdatum)\n\nHessen Amtsgericht Bad Homburg v.d.H. HRA 6433\nRegisterbekanntmachung nach dem Umwandlungsgesetz 29.12.2025 (Eintragungsdatum)\n\nKlaas Elektrotechnik e.K.\nEinzelkaufmann / Einzelkauffrau\nOberursel (Taunus)\n\nDen Gläubigern der an der Ausgliederung beteiligten Rechtsträger ist, wenn sie binnen sechs Monaten nach dem Tag, an dem die Eintragung der Ausgliederung in das Register des Sitzes desjenigen Rechtsträgers, dessen Gläubiger sie sind, nach §§ 125, 19 Absatz 3 UmwG bekannt gemacht worden ist, ihren Anspruch nach Grund und Höhe schriftlich anmelden, Sicherheit zu leisten, soweit sie nicht Befriedigung verlangen können. Dieses Recht steht den Gläubigern jedoch nur zu, wenn sie glaubhaft machen, dass durch die Ausgliederung die Erfüllung ihrer Forderung gefährdet wird."
    },
    {
      "date": "2025-12-29",
      "id": "141133",
      "original_text": "Registerbekanntmachung nach dem Umwandlungsgesetz\nHessen Amtsgericht Fulda HRA 6723\nAutowelt Fulda - eingetragener Kaufmann - – Fulda",
      "type": "Registerbekanntmachung nach dem Umwandlungsgesetz",
      "state": "Hessen",
      "amtsgericht": "Amtsgericht Fulda",
      "registernummer": "HRA 6723",
      "registerart": "HRA",
      "company_name": "Autowelt Fulda - eingetragener Kaufmann -",
      "company_seat": "Fulda",
      "details": "29.12.2025 (Bekanntmachungsdatum)\n\nHessen Amtsgericht Fulda HRA 6723\nRegisterbekanntmachung nach dem Umwandlungsgesetz 29.12.2025 (Eintragungsdatum)\n\nAutowelt Fulda - eingetragener Kaufmann -\nEinzelkaufmann / Einzelkauffrau\nFulda\n\nDen Gläubigern der an der Ausgliederung beteiligten Rechtsträger ist, wenn sie binnen sechs Monaten nach dem Tag, an dem die Eintragung der Ausgliederung in das Register des Sitzes desjenigen Rechtsträgers, dessen Gläubiger sie sind, nach §§ 125, 19 Absatz 3 UmwG bekannt gemacht worden ist, ihren Anspruch nach Grund und Höhe schriftlich anmelden, Sicherheit zu leisten, soweit sie nicht Befriedigung verlangen können. Dieses Recht steht den Gläubigern jedoch nur zu, wenn sie glaubhaft machen, dass durch die Ausgliederung die Erfüllung ihrer Forderung gefährdet wird."
    },
    {
      "date": "2025-12-29",
      "id": "141134",
      "original_text": "Löschungsankündigung\nHessen Amtsgericht Fulda HRB 8157\nSMG Royal Holding GmbH – Fulda",
      "type": "Löschungsankündigung",
      "state": "Hessen",
      "amtsgericht": "Amtsgericht Fulda",
      "registernummer": "HRB 8157",
      "registerart": "HRB",
      "company_name": "SMG Royal Holding GmbH",
      "company_seat": "Fulda",
      "details": "29.12.2025 (Bekanntmachungsdatum)\n\nHessen Amtsgericht Fulda HRB 8157\nLöschungsankündigung 11.09.2025 (Eintragungsdatum)\n\nSMG Royal Holding GmbH\nGesellschaft mit beschränkter Haftung\nFulda\n\nDas Registergericht beabsichtigt die im Handelsregister eingetragene Gesellschaft von Amts wegen nach § 394 FamFG zu löschen. Die Frist zur Erhebung eines Widerspruchs gegen die beabsichtigte Löschung wird auf 3 Monate festgesetzt."
    },
    {
      "date": "2025-12-29",
      "id": "141135",
      "original_text": "Registerbekanntmachung nach dem Umwandlungsgesetz\nHessen Amtsgericht Frankfurt am Main HRB 141306\nflatexDEGIRO SE – Frankfurt am Main",
      "type": "Registerbekanntmachung nach dem Umwandlungsgesetz",
      "state": "Hessen",
      "amtsgericht": "Amtsgericht Frankfurt am Main",
      "registernummer": "HRB 141306",
      "registerart": "HRB",
      "company_name": "flatexDEGIRO SE",
      "company_seat": "Frankfurt am Main",
      "details": "29.12.2025 (Bekanntmachungsdatum)\n\nHessen Amtsgericht Frankfurt am Main HRB 141306\nRegisterbekanntmachung nach dem Umwandlungsgesetz 29.12.2025 (Eintragungsdatum)\n\nflatexDEGIRO SE\nEuropäische Aktiengesellschaft (SE)\nFrankfurt am Main\n\nDen Gläubigern der an der formwechselnden Umwandlung beteiligten Rechtsträger ist, wenn sie binnen sechs Monaten nach dem Tag, an dem die Eintragung der formwechselnden Umwandlung in das Register des Sitzes desjenigen Rechtsträgers, dessen Gläubiger sie sind, nach § 201 UmwG bekannt gemacht worden ist, ihren Anspruch nach Grund und Höhe schriftlich anmelden, Sicherheit zu leisten, soweit sie nicht Befriedigung verlangen können. Dieses Recht steht den Gläubigern jedoch nur zu, wenn sie glaubhaft machen, dass durch die formwechselnden Umwandlung die Erfüllung ihrer Forderung gefährdet wird."
    },
    {
      "date": "2025-12-29",
      "id": "141136",
      "original_text": "Einreichung neuer Dokumente\nHessen Amtsgericht Frankfurt am Main HRB 119746\nDeutschlandtarifverbund-GmbH (DTVG) – Frankfurt am Main",
      "type": "Einreichung neuer Dokumente",
      "state": "Hessen",
      "amtsgericht": "Amtsgericht Frankfurt am Main",
      "registernummer": "HRB 119746",
      "registerart": "HRB",
      "company_name": "Deutschlandtarifverbund-GmbH (DTVG)",
      "company_seat": "Frankfurt am Main",
      "details": "29.12.2025 (Bekanntmachungsdatum)\n\nHessen Amtsgericht Frankfurt am Main HRB 119746\nEinreichung neuer Dokumente\n\nDeutschlandtarifverbund-GmbH (DTVG)\nGesellschaft mit beschränkter Haftung\nFrankfurt am Main\n\nDurch eine Änderung in den Personen der Aufsichtsratsmitglieder ist eine Liste der Mitglieder des Aufsichtsrates zum Handelsregister eingereicht worden."
    },
    {
      "date": "2025-12-29",
      "id": "141137",
      "original_text": "Einreichung neuer Dokumente\nHessen Amtsgericht Frankfurt am Main HRB 133760\nLufthansa Group .IO SE – Frankfurt am Main",
      "type": "Einreichung neuer Dokumente",
      "state": "Hessen",
      "amtsgericht": "Amtsgericht Frankfurt am Main",
      "registernummer": "HRB 133760",
      "registerart": "HRB",
      "company_name": "Lufthansa Group .IO SE",
      "company_seat": "Frankfurt am Main",
      "details": "29.12.2025 (Bekanntmachungsdatum)\n\nHessen Amtsgericht Frankfurt am Main HRB 133760\nEinreichung neuer Dokumente 27.12.2025 (Eintragungsdatum)\n\nLufthansa Group .IO SE\nEuropäische Aktiengesellschaft (SE)\nFrankfurt am Main\n\nDurch eine Änderung in den Personen der Aufsichtsratsmitglieder ist eine Liste der Mitglieder des Aufsichtsrates zum Handelsregister eingereicht worden."
    },
    {
      "date": "2025-12-29",
      "id": "141138",
      "original_text": "Registerbekanntmachung nach dem Umwandlungsgesetz\nHessen Amtsgericht Frankfurt am Main HRB 124780\nStinett Verwaltungs GmbH – Frankfurt am Main",
      "type": "Registerbekanntmachung nach dem Umwandlungsgesetz",
      "state": "Hessen",
      "amtsgericht": "Amtsgericht Frankfurt am Main",
      "registernummer": "HRB 124780",
      "registerart": "HRB",
      "company_name": "Stinett Verwaltungs GmbH",
      "company_seat": "Frankfurt am Main",
      "details": "29.12.2025 (Bekanntmachungsdatum)\n\nHessen Amtsgericht Frankfurt am Main HRB 124780\nRegisterbekanntmachung nach dem Umwandlungsgesetz 29.12.2025 (Eintragungsdatum)\n\nStinett Verwaltungs GmbH\nGesellschaft mit beschränkter Haftung\nFrankfurt am Main\n\nDen Gläubigern der an der Verschmelzung beteiligten Rechtsträger ist, wenn sie binnen sechs Monaten nach dem Tag, an dem die Eintragung der Verschmelzung in das Register des Sitzes desjenigen Rechtsträgers, dessen Gläubiger sie sind, nach § 19 Absatz 3 UmwG bekannt gemacht worden ist, ihren Anspruch nach Grund und Höhe schriftlich anmelden, Sicherheit zu leisten, soweit sie nicht Befriedigung verlangen können. Dieses Recht steht den Gläubigern jedoch nur zu, wenn sie glaubhaft machen, dass durch die Verschmelzung die Erfüllung ihrer Forderung gefährdet wird."
    },
    {
      "date": "2025-12-29",
      "id": "141139",
      "original_text": "Einreichung neuer Dokumente\nHessen Amtsgericht Eschwege HRB 2132\nDeutsches Rotes Kreuz Rettungsdienst Werra-Meißner gGmbH – Witzenhausen",
      "type": "Einreichung neuer Dokumente",
      "state": "Hessen",
      "amtsgericht": "Amtsgericht Eschwege",
      "registernummer": "HRB 2132",
      "registerart": "HRB",
      "company_name": "Deutsches Rotes Kreuz Rettungsdienst Werra-Meißner gGmbH",
      "company_seat": "Witzenhausen",
      "details": "29.12.2025 (Bekanntmachungsdatum)\n\nHessen Amtsgericht Eschwege HRB 2132\nEinreichung neuer Dokumente 29.12.2025 (Eintragungsdatum)\n\nDeutsches Rotes Kreuz Rettungsdienst Werra-Meißner gGmbH\nGesellschaft mit beschränkter Haftung\nWitzenhausen\n\nDurch eine Änderung in den Personen der Aufsichtsratsmitglieder ist eine Liste der Mitglieder des Aufsichtsrates zum Handelsregister eingereicht worden."
    },
    {
      "date": "2025-12-29",
      "id": "141140",
      "original_text": "Löschungsankündigung\nHessen Amtsgericht Frankfurt am Main HRB 83731\nParticipa Solutions GmbH – Frankfurt am Main",
      "type": "Löschungsankündigung",
      "state": "Hessen",
      "amtsgericht": "Amtsgericht Frankfurt am Main",
      "registernummer": "HRB 83731",
      "registerart": "HRB",
      "company_name": "Participa Solutions GmbH",
      "company_seat": "Frankfurt am Main",
      "details": "29.12.2025 (Bekanntmachungsdatum)\n\nHessen Amtsgericht Frankfurt am Main HRB 83731\nLöschungsankündigung\n\nParticipa Solutions GmbH\nGesellschaft mit beschränkter Haftung\nFrankfurt am Main\n\nDas Registergericht beabsichtigt die im Handelsregister eingetragene Gesellschaft von Amts wegen nach § 394 FamFG zu löschen. Die Frist zur Erhebung eines Widerspruchs gegen die beabsichtigte Löschung wird auf 1 Monat festgesetzt."
    },
    {
      "date": "2025-12-29",
      "id": "141141",
      "original_text": "Löschungsankündigung\nHessen Amtsgericht Darmstadt HRB 100561\nSPW Eventagentur UG (haftungsbeschränkt) – Bürstadt",
      "type": "Löschungsankündigung",
      "state": "Hessen",
      "amtsgericht": "Amtsgericht Darmstadt",
      "registernummer": "HRB 100561",
      "registerart": "HRB",
      "company_name": "SPW Eventagentur UG (haftungsbeschränkt)",
      "company_seat": "Bürstadt",
      "details": "29.12.2025 (Bekanntmachungsdatum)\n\nHessen Amtsgericht Darmstadt HRB 100561\nLöschungsankündigung 29.12.2025 (Eintragungsdatum)\n\nSPW Eventagentur UG (haftungsbeschränkt)\nGesellschaft mit beschränkter Haftung\nBürstadt\n\nDas Registergericht beabsichtigt die im Handelsregister eingetragene Gesellschaft von Amts wegen nach § 394 FamFG zu löschen. Die Frist zur Erhebung eines Widerspruchs gegen die beabsichtigte Löschung wird auf 3 Monate festgesetzt."
    },
    {
      "date": "2025-12-29",
      "id": "141142",
      "original_text": "Registerbekanntmachung nach dem Umwandlungsgesetz\nHessen Amtsgericht Wiesbaden VR 6679\nSocial Business Women e.V. – Wiesbaden",
      "type": "Registerbekanntmachung nach dem Umwandlungsgesetz",
      "state": "Hessen",
      "amtsgericht": "Amtsgericht Wiesbaden",
      "registernummer": "VR 6679",
      "registerart": "VR",
      "company_name": "Social Business Women e.V.",
      "company_seat": "Wiesbaden",
      "details": "29.12.2025 (Bekanntmachungsdatum)\n\nHessen Amtsgericht Wiesbaden VR 6679\nRegisterbekanntmachung nach dem Umwandlungsgesetz 29.12.2025 (Eintragungsdatum)\n\nSocial Business Women e.V.\neingetragener Verein\nWiesbaden\n\nDen Gläubigern der an der Verschmelzung beteiligten Rechtsträger ist, wenn sie binnen sechs Monaten nach dem Tag, an dem die Eintragung der Verschmelzung in das Register des Sitzes derjenigen Rechtsträger deren Gläubiger sie sind, nach § 19 Absatz 3 UmwG bekannt gemacht worden ist, ihren Anspruch nach Grund und Höhe schriftlich anmelden, Sicherheit zu leisten, soweit sie nicht Befriedigung verlangen können. Dieses Recht steht den Gläubigern jedoch nur zu, wenn sie glaubhaft machen, dass durch die Verschmelzung die Erfüllung ihrer Forderung gefährdet wird."
    },
    {
      "date": "2025-12-29",
      "id": "141143",
      "original_text": "Registerbekanntmachung nach dem Umwandlungsgesetz\nHessen Amtsgericht Bad Homburg v.d.H. HRB 7195\nEnterprise Education Gesellschaft für Informationstechnologie- und Managementtraining mbH – Bad Homburg v. d. Höhe",
      "type": "Registerbekanntmachung nach dem Umwandlungsgesetz",
      "state": "Hessen",
      "amtsgericht": "Amtsgericht Bad Homburg v.d.H.",
      "registernummer": "HRB 7195",
      "registerart": "HRB",
      "company_name": "Enterprise Education Gesellschaft für Informationstechnologie- und Managementtraining mbH",
      "company_seat": "Bad Homburg v. d. Höhe",
      "details": "29.12.2025 (Bekanntmachungsdatum)\n\nHessen Amtsgericht Bad Homburg v.d.H. HRB 7195\nRegisterbekanntmachung nach dem Umwandlungsgesetz 29.12.2025 (Eintragungsdatum)\n\nEnterprise Education Gesellschaft für Informationstechnologie- und Managementtraining mbH\nGesellschaft mit beschränkter Haftung\nBad Homburg v. d. Höhe\n\nDen Gläubigern der an der Verschmelzung beteiligten Rechtsträger ist, wenn sie binnen sechs Monaten nach dem Tag, an dem die Eintragung der Verschmelzung in das Register des Sitzes desjenigen Rechtsträgers, dessen Gläubiger sie sind, nach § 19 Absatz 3 UmwG bekannt gemacht worden ist, ihren Anspruch nach Grund und Höhe schriftlich anmelden, Sicherheit zu leisten, soweit sie nicht Befriedigung verlangen können. Dieses Recht steht den Gläubigern jedoch nur zu, wenn sie glaubhaft machen, dass durch die Verschmelzung die Erfüllung ihrer Forderung gefährdet wird."
    },
    {
      "date": "2025-12-29",
      "id": "141144",
      "original_text": "Sonstige Registerbekanntmachung\nHessen Amtsgericht Gießen HRB 9705\nAlberg Immobilien GmbH – Gießen",
      "type": "Sonstige Registerbekanntmachung",
      "state": "Hessen",
      "amtsgericht": "Amtsgericht Gießen",
      "registernummer": "HRB 9705",
      "registerart": "HRB",
      "company_name": "Alberg Immobilien GmbH",
      "company_seat": "Gießen",
      "details": "29.12.2025 (Bekanntmachungsdatum)\n\nHessen Amtsgericht Gießen HRB 9705\nSonstige Registerbekanntmachung 29.12.2025 (Eintragungsdatum)\n\nAlberg Immobilien GmbH\nGesellschaft mit beschränkter Haftung\nGießen\n\nDen Gläubigern der Gesellschaft, deren Forderungen begründet worden sind, bevor die Eintragung der Beendigung des Vertrags in das Handelsregister nach § 10 HGB bekannt gemacht worden ist, ist vom anderen Vertragsteil Sicherheit zu leisten, wenn sie sich binnen sechs Monaten nach dieser Bekanntmachung zu diesem Zweck bei ihm melden."
    },
    {
      "date": "2025-12-29",
      "id": "141145",
      "original_text": "Registerbekanntmachung nach dem Umwandlungsgesetz\nHessen Amtsgericht Bad Homburg v.d.H. HRA 6442\nKlaas Elektrotechnik GmbH & Co. KG – Oberursel (Taunus)",
      "type": "Registerbekanntmachung nach dem Umwandlungsgesetz",
      "state": "Hessen",
      "amtsgericht": "Amtsgericht Bad Homburg v.d.H.",
      "registernummer": "HRA 6442",
      "registerart": "HRA",
      "company_name": "Klaas Elektrotechnik GmbH & Co. KG",
      "company_seat": "Oberursel (Taunus)",
      "details": "29.12.2025 (Bekanntmachungsdatum)\n\nHessen Amtsgericht Bad Homburg v.d.H. HRA 6442\nRegisterbekanntmachung nach dem Umwandlungsgesetz 29.12.2025 (Eintragungsdatum)\n\nKlaas Elektrotechnik GmbH & Co. KG\nKommanditgesellschaft\nOberursel (Taunus)\n\nDen Gläubigern der an der Ausgliederung beteiligten Rechtsträger ist, wenn sie binnen sechs Monaten nach dem Tag, an dem die Eintragung der Ausgliederung in das Register des Sitzes desjenigen Rechtsträgers, dessen Gläubiger sie sind, nach §§ 125, 19 Absatz 3 UmwG bekannt gemacht worden ist, ihren Anspruch nach Grund und Höhe schriftlich anmelden, Sicherheit zu leisten, soweit sie nicht Befriedigung verlangen können. Dieses Recht steht den Gläubigern jedoch nur zu, wenn sie glaubhaft machen, dass durch die Ausgliederung die Erfüllung ihrer Forderung gefährdet wird."
    },
    {
      "date": "2025-12-29",
      "id": "141146",
      "original_text": "Einreichung neuer Dokumente\nHessen Amtsgericht Limburg HRB 6308\nTM Real Estate AG – Limburg an der Lahn",
      "type": "Einreichung neuer Dokumente",
      "state": "Hessen",
      "amtsgericht": "Amtsgericht Limburg",
      "registernummer": "HRB 6308",
      "registerart": "HRB",
      "company_name": "TM Real Estate AG",
      "company_seat": "Limburg an der Lahn",
      "details": "29.12.2025 (Bekanntmachungsdatum)\n\nHessen Amtsgericht Limburg HRB 6308\nEinreichung neuer Dokumente\n\nTM Real Estate AG\nAktiengesellschaft\nLimburg an der Lahn\n\nDurch eine Änderung in den Personen der Aufsichtsratsmitglieder ist eine Liste der Mitglieder des Aufsichtsrates zum Handelsregister eingereicht worden."
    },
    {
      "date": "2025-12-29",
      "id": "141147",
      "original_text": "Registerbekanntmachung nach dem Umwandlungsgesetz\nHessen Amtsgericht Kassel HRB 18602\nBolero Kassel Gastro GmbH – Kassel",
      "type": "Registerbekanntmachung nach dem Umwandlungsgesetz",
      "state": "Hessen",
      "amtsgericht": "Amtsgericht Kassel",
      "registernummer": "HRB 18602",
      "registerart": "HRB",
      "company_name": "Bolero Kassel Gastro GmbH",
      "company_seat": "Kassel",
      "details": "29.12.2025 (Bekanntmachungsdatum)\n\nHessen Amtsgericht Kassel HRB 18602\nRegisterbekanntmachung nach dem Umwandlungsgesetz 29.12.2025 (Eintragungsdatum)\n\nBolero Kassel Gastro GmbH\nGesellschaft mit beschränkter Haftung\nKassel\n\nDen Gläubigern der an der Verschmelzung beteiligten Rechtsträger ist, wenn sie binnen sechs Monaten nach dem Tag, an dem die Eintragung der Verschmelzung in das Register des Sitzes desjenigen Rechtsträgers, dessen Gläubiger sie sind, nach § 19 Absatz 3 UmwG bekannt gemacht worden ist, ihren Anspruch nach Grund und Höhe schriftlich anmelden, Sicherheit zu leisten, soweit sie nicht Befriedigung verlangen können. Dieses Recht steht den Gläubigern jedoch nur zu, wenn sie glaubhaft machen, dass durch die Verschmelzung die Erfüllung ihrer Forderung gefährdet wird."
    },
    {
      "date": "2025-12-29",
      "id": "141148",
      "original_text": "Registerbekanntmachung nach dem Umwandlungsgesetz\nHessen Amtsgericht Frankfurt am Main HRB 103516\nflatexDEGIRO AG – Frankfurt am Main",
      "type": "Registerbekanntmachung nach dem Umwandlungsgesetz",
      "state": "Hessen",
      "amtsgericht": "Amtsgericht Frankfurt am Main",
      "registernummer": "HRB 103516",
      "registerart": "HRB",
      "company_name": "flatexDEGIRO AG",
      "company_seat": "Frankfurt am Main",
      "details": "29.12.2025 (Bekanntmachungsdatum)\n\nHessen Amtsgericht Frankfurt am Main HRB 103516\nRegisterbekanntmachung nach dem Umwandlungsgesetz 29.12.2025 (Eintragungsdatum)\n\nflatexDEGIRO AG\nAktiengesellschaft\nFrankfurt am Main\n\nDen Gläubigern der an der grenzüberschreitenden Verschmelzung beteiligten übernehmenden Rechtsträger ist, wenn sie binnen sechs Monaten nach dem Tag, an dem die Eintragung der Verschmelzung in das Register des Sitzes desjenigen Rechtsträgers, dessen Gläubiger sie sind, nach § 19 Absatz 3 UmwG als bekanntgemacht gilt, ihren Anspruch nach Grund und Höhe schriftlich anmelden, Sicherheit zu leisten, soweit sie nicht Befriedigung verlangen können.\n\nDieses Recht steht den Gläubigern jedoch nur zu, wenn sie glaubhaft machen, dass durch die Verschmelzung die Erfüllung ihrer Forderung gefährdet wird."
    }
  ]
}