{
  "date": "2025-12-31",
  "date_of_scrape": "2026-01-01T04:24:04.599Z",
  "tool_version": "0.2.0",
  "number_of_announcements": 27,
  "announcements": [
    {
      "date": "2025-12-31",
      "id": "141273",
      "original_text": "Registerbekanntmachung nach dem Umwandlungsgesetz\nBayern Amtsgericht Nürnberg HRB 38734\nBloss-Immobilien GmbH – Wendelstein",
      "type": "Registerbekanntmachung nach dem Umwandlungsgesetz",
      "state": "Bayern",
      "amtsgericht": "Amtsgericht Nürnberg",
      "registernummer": "HRB 38734",
      "registerart": "HRB",
      "company_name": "Bloss-Immobilien GmbH",
      "company_seat": "Wendelstein",
      "details": "31.12.2025 (Bekanntmachungsdatum)\n\nBayern Amtsgericht Nürnberg HRB 38734\nRegisterbekanntmachung nach dem Umwandlungsgesetz 30.12.2025 (Eintragungsdatum)\n\nBloss-Immobilien GmbH\nGesellschaft mit beschränkter Haftung\nWendelstein\n\nDen Gläubigern der an der Verschmelzung beteiligten Rechtsträger ist, wenn sie binnen sechs Monaten nach dem Tag, an dem die Eintragung der Verschmelzung in das Register des Sitzes desjenigen Rechtsträgers, dessen Gläubiger sie sind, nach § 19 Abs. 3 UmwG als bekannt gemacht gilt, ihren Anspruch nach Grund und Höhe in Textform anmelden, Sicherheit zu leisten, soweit sie nicht Befriedigung verlangen können. Dieses Recht steht den Gläubigern jedoch nur zu, wenn sie glaubhaft machen, dass durch die Verschmelzung die Erfüllung ihrer Forderung gefährdet wird."
    },
    {
      "date": "2025-12-31",
      "id": "141274",
      "original_text": "Registerbekanntmachung nach dem Umwandlungsgesetz\nBayern Amtsgericht Ingolstadt HRA 2629\nPV SEA 1 GmbH & Co. KG – Pfaffenhofen a.d. Ilm",
      "type": "Registerbekanntmachung nach dem Umwandlungsgesetz",
      "state": "Bayern",
      "amtsgericht": "Amtsgericht Ingolstadt",
      "registernummer": "HRA 2629",
      "registerart": "HRA",
      "company_name": "PV SEA 1 GmbH & Co. KG",
      "company_seat": "Pfaffenhofen a.d. Ilm",
      "details": "31.12.2025 (Bekanntmachungsdatum)\n\nBayern Amtsgericht Ingolstadt HRA 2629\nRegisterbekanntmachung nach dem Umwandlungsgesetz 30.12.2025 (Eintragungsdatum)\n\nPV SEA 1 GmbH & Co. KG\nKommanditgesellschaft\nPfaffenhofen a.d. Ilm\n\nDen Gläubigern der an der Verschmelzung beteiligten Rechtsträger ist, wenn sie binnen sechs Monaten nach dem Tag, an dem die Eintragung der Verschmelzung in das Register des Sitzes desjenigen Rechtsträgers, dessen Gläubiger sie sind, nach § 19 Abs. 3 UmwG als bekannt gemacht gilt, ihren Anspruch nach Grund und Höhe in Textform anmelden, Sicherheit zu leisten, soweit sie nicht Befriedigung verlangen können. Dieses Recht steht den Gläubigern jedoch nur zu, wenn sie glaubhaft machen, dass durch die Verschmelzung die Erfüllung ihrer Forderung gefährdet wird."
    },
    {
      "date": "2025-12-31",
      "id": "141275",
      "original_text": "Löschungsankündigung\nBayern Amtsgericht Traunstein HRB 27364\nDM ELEKTROTECHNIK GmbH – Taching a.See",
      "type": "Löschungsankündigung",
      "state": "Bayern",
      "amtsgericht": "Amtsgericht Traunstein",
      "registernummer": "HRB 27364",
      "registerart": "HRB",
      "company_name": "DM ELEKTROTECHNIK GmbH",
      "company_seat": "Taching a.See",
      "details": "31.12.2025 (Bekanntmachungsdatum)\n\nBayern Amtsgericht Traunstein HRB 27364\nLöschungsankündigung 30.12.2025 (Eintragungsdatum)\n\nDM ELEKTROTECHNIK GmbH\nGesellschaft mit beschränkter Haftung\nTaching a.See\n\nDas Registergericht beabsichtigt, die im Handelsregister eingetragene Gesellschaft wegen Vermögenslosigkeit von Amts wegen nach § 394 FamFG zu löschen. Die Frist zur Erhebung eines Widerspruchs ist auf einen Monat festgesetzt."
    },
    {
      "date": "2025-12-31",
      "id": "141276",
      "original_text": "Sonstige Registerbekanntmachung\nBayern Amtsgericht Bayreuth HRB 5462\nWalraven Holding Verwaltungs GmbH – Bayreuth",
      "type": "Sonstige Registerbekanntmachung",
      "state": "Bayern",
      "amtsgericht": "Amtsgericht Bayreuth",
      "registernummer": "HRB 5462",
      "registerart": "HRB",
      "company_name": "Walraven Holding Verwaltungs GmbH",
      "company_seat": "Bayreuth",
      "details": "31.12.2025 (Bekanntmachungsdatum)\n\nBayern Amtsgericht Bayreuth HRB 5462\nSonstige Registerbekanntmachung 30.12.2025 (Eintragungsdatum)\n\nWalraven Holding Verwaltungs GmbH\nGesellschaft mit beschränkter Haftung\nBayreuth\n\nDen Gläubigern der an der Verschmelzung beteiligten Rechtsträger ist, wenn sie binnen sechs Monaten nach dem Tag, an dem die Eintragung der Verschmelzung in das Register des Sitzes desjenigen Rechtsträgers, dessen Gläubiger sie sind, nach § 19 Abs. 3 UmwG als bekannt gemacht gilt, ihren Anspruch nach Grund und Höhe in Textform anmelden, Sicherheit zu leisten, soweit sie nicht Befriedigung verlangen können. Dieses Recht steht den Gläubigern jedoch nur zu, wenn sie glaubhaft machen, dass durch die Verschmelzung die Erfüllung ihrer Forderung gefährdet wird."
    },
    {
      "date": "2025-12-31",
      "id": "141277",
      "original_text": "Registerbekanntmachung nach dem Umwandlungsgesetz\nBayern Amtsgericht München HRB 83442\nDeloitte GmbH Wirtschaftsprüfungsgesellschaft – München",
      "type": "Registerbekanntmachung nach dem Umwandlungsgesetz",
      "state": "Bayern",
      "amtsgericht": "Amtsgericht München",
      "registernummer": "HRB 83442",
      "registerart": "HRB",
      "company_name": "Deloitte GmbH Wirtschaftsprüfungsgesellschaft",
      "company_seat": "München",
      "details": "31.12.2025 (Bekanntmachungsdatum)\n\nBayern Amtsgericht München HRB 83442\nRegisterbekanntmachung nach dem Umwandlungsgesetz 30.12.2025 (Eintragungsdatum)\n\nDeloitte GmbH Wirtschaftsprüfungsgesellschaft\nGesellschaft mit beschränkter Haftung\nMünchen\n\nDen Gläubigern der an der Verschmelzung beteiligten Rechtsträger ist, wenn sie binnen sechs Monaten nach dem Tag, an dem die Eintragung der Verschmelzung in das Register des Sitzes desjenigen Rechtsträgers, dessen Gläubiger sie sind, nach § 19 Abs. 3 UmwG als bekannt gemacht gilt, ihren Anspruch nach Grund und Höhe in Textform anmelden, Sicherheit zu leisten, soweit sie nicht Befriedigung verlangen können. Dieses Recht steht den Gläubigern jedoch nur zu, wenn sie glaubhaft machen, dass durch die Verschmelzung die Erfüllung ihrer Forderung gefährdet wird."
    },
    {
      "date": "2025-12-31",
      "id": "141278",
      "original_text": "Registerbekanntmachung nach dem Umwandlungsgesetz\nBayern Amtsgericht Kempten (Allgäu) HRB 14445\nMG Vermietung UG (haftungsbeschränkt) – Kaufbeuren",
      "type": "Registerbekanntmachung nach dem Umwandlungsgesetz",
      "state": "Bayern",
      "amtsgericht": "Amtsgericht Kempten (Allgäu)",
      "registernummer": "HRB 14445",
      "registerart": "HRB",
      "company_name": "MG Vermietung UG (haftungsbeschränkt)",
      "company_seat": "Kaufbeuren",
      "details": "31.12.2025 (Bekanntmachungsdatum)\n\nBayern Amtsgericht Kempten (Allgäu) HRB 14445\nRegisterbekanntmachung nach dem Umwandlungsgesetz 30.12.2025 (Eintragungsdatum)\n\nMG Vermietung UG (haftungsbeschränkt)\nGesellschaft mit beschränkter Haftung\nKaufbeuren\n\nDen Gläubigern der an der Verschmelzung beteiligten Rechtsträger ist, wenn sie binnen sechs Monaten nach dem Tag, an dem die Eintragung der Verschmelzung in das Register des Sitzes desjenigen Rechtsträgers, dessen Gläubiger sie sind, nach § 19 Abs. 3 UmwG als bekannt gemacht gilt, ihren Anspruch nach Grund und Höhe in Textform anmelden, Sicherheit zu leisten, soweit sie nicht Befriedigung verlangen können. Dieses Recht steht den Gläubigern jedoch nur zu, wenn sie glaubhaft machen, dass durch die Verschmelzung die Erfüllung ihrer Forderung gefährdet wird."
    },
    {
      "date": "2025-12-31",
      "id": "141279",
      "original_text": "Sonstige Registerbekanntmachung\nBayern Amtsgericht Nürnberg HRB 15867\nHelmsauer & Kollegen Assekuranzmakler Aktiengesellschaft – Nürnberg",
      "type": "Sonstige Registerbekanntmachung",
      "state": "Bayern",
      "amtsgericht": "Amtsgericht Nürnberg",
      "registernummer": "HRB 15867",
      "registerart": "HRB",
      "company_name": "Helmsauer & Kollegen Assekuranzmakler Aktiengesellschaft",
      "company_seat": "Nürnberg",
      "details": "31.12.2025 (Bekanntmachungsdatum)\n\nBayern Amtsgericht Nürnberg HRB 15867\nSonstige Registerbekanntmachung 30.12.2025 (Eintragungsdatum)\n\nHelmsauer & Kollegen Assekuranzmakler Aktiengesellschaft\nAktiengesellschaft\nNürnberg\n\nDem Amtsgericht Nürnberg -Registergericht- ist eine Liste der Mitglieder des Aufsichtsrats eingereicht worden, § 106 AktG."
    },
    {
      "date": "2025-12-31",
      "id": "141280",
      "original_text": "Einreichung neuer Dokumente\nBayern Amtsgericht Augsburg HRB 2005\nCPU Softwarehouse AG – Augsburg",
      "type": "Einreichung neuer Dokumente",
      "state": "Bayern",
      "amtsgericht": "Amtsgericht Augsburg",
      "registernummer": "HRB 2005",
      "registerart": "HRB",
      "company_name": "CPU Softwarehouse AG",
      "company_seat": "Augsburg",
      "details": "31.12.2025 (Bekanntmachungsdatum)\n\nBayern Amtsgericht Augsburg HRB 2005\nEinreichung neuer Dokumente 30.12.2025 (Eintragungsdatum)\n\nCPU Softwarehouse AG\nAktiengesellschaft\nAugsburg\n\nDem Amtsgericht Augsburg -Registergericht- ist eine Liste der Mitglieder des Aufsichtsrats eingereicht worden, § 106 AktG."
    },
    {
      "date": "2025-12-31",
      "id": "141281",
      "original_text": "Sonstige Registerbekanntmachung\nBayern Amtsgericht Bayreuth HRB 8600\nWalraven Holding GmbH – Bayreuth",
      "type": "Sonstige Registerbekanntmachung",
      "state": "Bayern",
      "amtsgericht": "Amtsgericht Bayreuth",
      "registernummer": "HRB 8600",
      "registerart": "HRB",
      "company_name": "Walraven Holding GmbH",
      "company_seat": "Bayreuth",
      "details": "31.12.2025 (Bekanntmachungsdatum)\n\nBayern Amtsgericht Bayreuth HRB 8600\nSonstige Registerbekanntmachung 30.12.2025 (Eintragungsdatum)\n\nWalraven Holding GmbH\nGesellschaft mit beschränkter Haftung\nBayreuth\n\nDen Gläubigern der an der Verschmelzung beteiligten Rechtsträger ist, wenn sie binnen sechs Monaten nach dem Tag, an dem die Eintragung der Verschmelzung in das Register des Sitzes desjenigen Rechtsträgers, dessen Gläubiger sie sind, nach § 19 Abs. 3 UmwG als bekannt gemacht gilt, ihren Anspruch nach Grund und Höhe in Textform anmelden, Sicherheit zu leisten, soweit sie nicht Befriedigung verlangen können. Dieses Recht steht den Gläubigern jedoch nur zu, wenn sie glaubhaft machen, dass durch die Verschmelzung die Erfüllung ihrer Forderung gefährdet wird."
    },
    {
      "date": "2025-12-31",
      "id": "141282",
      "original_text": "Registerbekanntmachung nach dem Umwandlungsgesetz\nBayern Amtsgericht Deggendorf HRB 4915\nRSD Grundstücks GmbH – Deggendorf",
      "type": "Registerbekanntmachung nach dem Umwandlungsgesetz",
      "state": "Bayern",
      "amtsgericht": "Amtsgericht Deggendorf",
      "registernummer": "HRB 4915",
      "registerart": "HRB",
      "company_name": "RSD Grundstücks GmbH",
      "company_seat": "Deggendorf",
      "details": "31.12.2025 (Bekanntmachungsdatum)\n\nBayern Amtsgericht Deggendorf HRB 4915\nRegisterbekanntmachung nach dem Umwandlungsgesetz 30.12.2025 (Eintragungsdatum)\n\nRSD Grundstücks GmbH\nGesellschaft mit beschränkter Haftung\nDeggendorf\n\nDen Gläubigern der an der Verschmelzung beteiligten Rechtsträger ist, wenn sie binnen sechs Monaten nach dem Tag, an dem die Eintragung der Verschmelzung in das Register des Sitzes desjenigen Rechtsträgers, dessen Gläubiger sie sind, nach § 19 Abs. 3 UmwG als bekannt gemacht gilt, ihren Anspruch nach Grund und Höhe in Textform anmelden, Sicherheit zu leisten, soweit sie nicht Befriedigung verlangen können. Dieses Recht steht den Gläubigern jedoch nur zu, wenn sie glaubhaft machen, dass durch die Verschmelzung die Erfüllung ihrer Forderung gefährdet wird."
    },
    {
      "date": "2025-12-31",
      "id": "141283",
      "original_text": "Registerbekanntmachung nach dem Umwandlungsgesetz\nBayern Amtsgericht Deggendorf HRB 3775\nSüddeutsche Immobilien Verwaltungs GmbH – Deggendorf",
      "type": "Registerbekanntmachung nach dem Umwandlungsgesetz",
      "state": "Bayern",
      "amtsgericht": "Amtsgericht Deggendorf",
      "registernummer": "HRB 3775",
      "registerart": "HRB",
      "company_name": "Süddeutsche Immobilien Verwaltungs GmbH",
      "company_seat": "Deggendorf",
      "details": "31.12.2025 (Bekanntmachungsdatum)\n\nBayern Amtsgericht Deggendorf HRB 3775\nRegisterbekanntmachung nach dem Umwandlungsgesetz 30.12.2025 (Eintragungsdatum)\n\nSüddeutsche Immobilien Verwaltungs GmbH\nGesellschaft mit beschränkter Haftung\nDeggendorf\n\nDen Gläubigern der an der Verschmelzung beteiligten Rechtsträger ist, wenn sie binnen sechs Monaten nach dem Tag, an dem die Eintragung der Verschmelzung in das Register des Sitzes desjenigen Rechtsträgers, dessen Gläubiger sie sind, nach § 19 Abs. 3 UmwG als bekannt gemacht gilt, ihren Anspruch nach Grund und Höhe in Textform anmelden, Sicherheit zu leisten, soweit sie nicht Befriedigung verlangen können. Dieses Recht steht den Gläubigern jedoch nur zu, wenn sie glaubhaft machen, dass durch die Verschmelzung die Erfüllung ihrer Forderung gefährdet wird."
    },
    {
      "date": "2025-12-31",
      "id": "141284",
      "original_text": "Registerbekanntmachung nach dem Umwandlungsgesetz\nBayern Amtsgericht München HRB 237452\nFinis UG (haftungsbeschränkt) – München",
      "type": "Registerbekanntmachung nach dem Umwandlungsgesetz",
      "state": "Bayern",
      "amtsgericht": "Amtsgericht München",
      "registernummer": "HRB 237452",
      "registerart": "HRB",
      "company_name": "Finis UG (haftungsbeschränkt)",
      "company_seat": "München",
      "details": "31.12.2025 (Bekanntmachungsdatum)\n\nBayern Amtsgericht München HRB 237452\nRegisterbekanntmachung nach dem Umwandlungsgesetz 30.12.2025 (Eintragungsdatum)\n\nFinis UG (haftungsbeschränkt)\nGesellschaft mit beschränkter Haftung\nMünchen\n\nDen Gläubigern der an der Verschmelzung beteiligten Rechtsträger ist, wenn sie binnen sechs Monaten nach dem Tag, an dem die Eintragung der Verschmelzung in das Register des Sitzes desjenigen Rechtsträgers, dessen Gläubiger sie sind, nach § 19 Abs. 3 UmwG als bekannt gemacht gilt, ihren Anspruch nach Grund und Höhe in Textform anmelden, Sicherheit zu leisten, soweit sie nicht Befriedigung verlangen können. Dieses Recht steht den Gläubigern jedoch nur zu, wenn sie glaubhaft machen, dass durch die Verschmelzung die Erfüllung ihrer Forderung gefährdet wird."
    },
    {
      "date": "2025-12-31",
      "id": "141285",
      "original_text": "Einreichung neuer Dokumente\nBayern Amtsgericht Memmingen HRB 6974\nNUWOG - Wohnungsgesellschaft der Stadt Neu-Ulm GmbH – Neu-Ulm",
      "type": "Einreichung neuer Dokumente",
      "state": "Bayern",
      "amtsgericht": "Amtsgericht Memmingen",
      "registernummer": "HRB 6974",
      "registerart": "HRB",
      "company_name": "NUWOG - Wohnungsgesellschaft der Stadt Neu-Ulm GmbH",
      "company_seat": "Neu-Ulm",
      "details": "31.12.2025 (Bekanntmachungsdatum)\n\nBayern Amtsgericht Memmingen HRB 6974\nEinreichung neuer Dokumente\n\nNUWOG - Wohnungsgesellschaft der Stadt Neu-Ulm GmbH\nGesellschaft mit beschränkter Haftung\nNeu-Ulm\n\nDem Amtsgericht Memmingen -Registergericht- ist eine Liste der Mitglieder des Aufsichtsrats eingereicht worden, § 52 Abs. 3 S. 2 GmbHG."
    },
    {
      "date": "2025-12-31",
      "id": "141286",
      "original_text": "Löschungsankündigung\nBayern Amtsgericht Deggendorf HRB 5748\nNEWDAY GIDA INSAAT SANAYI TICARET LIMITED SIRKETI Zweigniederlassung Deggendorf – Deggendorf",
      "type": "Löschungsankündigung",
      "state": "Bayern",
      "amtsgericht": "Amtsgericht Deggendorf",
      "registernummer": "HRB 5748",
      "registerart": "HRB",
      "company_name": "NEWDAY GIDA INSAAT SANAYI TICARET LIMITED SIRKETI Zweigniederlassung Deggendorf",
      "company_seat": "Deggendorf",
      "details": "31.12.2025 (Bekanntmachungsdatum)\n\nBayern Amtsgericht Deggendorf HRB 5748\nLöschungsankündigung\n\nNEWDAY GIDA INSAAT SANAYI TICARET LIMITED SIRKETI Zweigniederlassung Deggendorf\nRechtsform ausländischen Rechts HRB\nDeggendorf\n\nDas Registergericht beabsichtigt, die im Handelsregister B eingetragene Zweigniederlassung von Amts wegen nach § 395 FamFG zu löschen. Die Frist zur Erhebung eines Widerspruchs ist auf einen Monat festgesetzt."
    },
    {
      "date": "2025-12-31",
      "id": "141287",
      "original_text": "Registerbekanntmachung nach dem Umwandlungsgesetz\nBayern Amtsgericht Nürnberg HRB 28638\nKlärschlammverwertung Region Nürnberg GmbH – Nürnberg",
      "type": "Registerbekanntmachung nach dem Umwandlungsgesetz",
      "state": "Bayern",
      "amtsgericht": "Amtsgericht Nürnberg",
      "registernummer": "HRB 28638",
      "registerart": "HRB",
      "company_name": "Klärschlammverwertung Region Nürnberg GmbH",
      "company_seat": "Nürnberg",
      "details": "31.12.2025 (Bekanntmachungsdatum)\n\nBayern Amtsgericht Nürnberg HRB 28638\nRegisterbekanntmachung nach dem Umwandlungsgesetz 30.12.2025 (Eintragungsdatum)\n\nKlärschlammverwertung Region Nürnberg GmbH\nGesellschaft mit beschränkter Haftung\nNürnberg\n\nDen Gläubigern der an der Verschmelzung beteiligten Rechtsträger ist, wenn sie binnen sechs Monaten nach dem Tag, an dem die Eintragung der Verschmelzung in das Register des Sitzes desjenigen Rechtsträgers, dessen Gläubiger sie sind, nach § 19 Abs. 3 UmwG als bekannt gemacht gilt, ihren Anspruch nach Grund und Höhe in Textform anmelden, Sicherheit zu leisten, soweit sie nicht Befriedigung verlangen können. Dieses Recht steht den Gläubigern jedoch nur zu, wenn sie glaubhaft machen, dass durch die Verschmelzung die Erfüllung ihrer Forderung gefährdet wird."
    },
    {
      "date": "2025-12-31",
      "id": "141288",
      "original_text": "Registerbekanntmachung nach dem Umwandlungsgesetz\nBayern Amtsgericht Ingolstadt HRA 2631\nPV SEA 3 GmbH & Co. KG – Pfaffenhofen a.d. Ilm",
      "type": "Registerbekanntmachung nach dem Umwandlungsgesetz",
      "state": "Bayern",
      "amtsgericht": "Amtsgericht Ingolstadt",
      "registernummer": "HRA 2631",
      "registerart": "HRA",
      "company_name": "PV SEA 3 GmbH & Co. KG",
      "company_seat": "Pfaffenhofen a.d. Ilm",
      "details": "31.12.2025 (Bekanntmachungsdatum)\n\nBayern Amtsgericht Ingolstadt HRA 2631\nRegisterbekanntmachung nach dem Umwandlungsgesetz 30.12.2025 (Eintragungsdatum)\n\nPV SEA 3 GmbH & Co. KG\nKommanditgesellschaft\nPfaffenhofen a.d. Ilm\n\nDen Gläubigern der an der Verschmelzung beteiligten Rechtsträger ist, wenn sie binnen sechs Monaten nach dem Tag, an dem die Eintragung der Verschmelzung in das Register des Sitzes desjenigen Rechtsträgers, dessen Gläubiger sie sind, nach § 19 Abs. 3 UmwG als bekannt gemacht gilt, ihren Anspruch nach Grund und Höhe in Textform anmelden, Sicherheit zu leisten, soweit sie nicht Befriedigung verlangen können. Dieses Recht steht den Gläubigern jedoch nur zu, wenn sie glaubhaft machen, dass durch die Verschmelzung die Erfüllung ihrer Forderung gefährdet wird."
    },
    {
      "date": "2025-12-31",
      "id": "141289",
      "original_text": "Registerbekanntmachung nach dem Umwandlungsgesetz\nBayern Amtsgericht Nürnberg HRB 38460\nBloss Corporation GmbH – Wendelstein",
      "type": "Registerbekanntmachung nach dem Umwandlungsgesetz",
      "state": "Bayern",
      "amtsgericht": "Amtsgericht Nürnberg",
      "registernummer": "HRB 38460",
      "registerart": "HRB",
      "company_name": "Bloss Corporation GmbH",
      "company_seat": "Wendelstein",
      "details": "31.12.2025 (Bekanntmachungsdatum)\n\nBayern Amtsgericht Nürnberg HRB 38460\nRegisterbekanntmachung nach dem Umwandlungsgesetz 30.12.2025 (Eintragungsdatum)\n\nBloss Corporation GmbH\nGesellschaft mit beschränkter Haftung\nWendelstein\n\nDen Gläubigern der an der Verschmelzung beteiligten Rechtsträger ist, wenn sie binnen sechs Monaten nach dem Tag, an dem die Eintragung der Verschmelzung in das Register des Sitzes desjenigen Rechtsträgers, dessen Gläubiger sie sind, nach § 19 Abs. 3 UmwG als bekannt gemacht gilt, ihren Anspruch nach Grund und Höhe in Textform anmelden, Sicherheit zu leisten, soweit sie nicht Befriedigung verlangen können. Dieses Recht steht den Gläubigern jedoch nur zu, wenn sie glaubhaft machen, dass durch die Verschmelzung die Erfüllung ihrer Forderung gefährdet wird."
    },
    {
      "date": "2025-12-31",
      "id": "141290",
      "original_text": "Löschungsankündigung\nBayern Amtsgericht Regensburg HRB 19662\nÉN, Magam Kft. Zweigniederlassung – Neutraubling",
      "type": "Löschungsankündigung",
      "state": "Bayern",
      "amtsgericht": "Amtsgericht Regensburg",
      "registernummer": "HRB 19662",
      "registerart": "HRB",
      "company_name": "ÉN, Magam Kft. Zweigniederlassung",
      "company_seat": "Neutraubling",
      "details": "31.12.2025 (Bekanntmachungsdatum)\n\nBayern Amtsgericht Regensburg HRB 19662\nLöschungsankündigung\n\nÉN, Magam Kft. Zweigniederlassung\nRechtsform ausländischen Rechts HRB\nNeutraubling\n\nDas Registergericht beabsichtigt, die im Handelsregister B eingetragene Zweigniederlassung von Amts wegen nach § 395 FamFG zu löschen. Die Frist zur Erhebung eines Widerspruchs ist auf einen Monat festgesetzt."
    },
    {
      "date": "2025-12-31",
      "id": "141291",
      "original_text": "Löschungsankündigung\nBayern Amtsgericht Nürnberg HRB 27598\nDritte Solarinvest GmbH – Nürnberg",
      "type": "Löschungsankündigung",
      "state": "Bayern",
      "amtsgericht": "Amtsgericht Nürnberg",
      "registernummer": "HRB 27598",
      "registerart": "HRB",
      "company_name": "Dritte Solarinvest GmbH",
      "company_seat": "Nürnberg",
      "details": "31.12.2025 (Bekanntmachungsdatum)\n\nBayern Amtsgericht Nürnberg HRB 27598\nLöschungsankündigung\n\nDritte Solarinvest GmbH\nGesellschaft mit beschränkter Haftung\nNürnberg\n\nDas Registergericht beabsichtigt, die im Handelsregister eingetragene Gesellschaft wegen Vermögenslosigkeit von Amts wegen nach § 394 FamFG zu löschen. Die Frist zur Erhebung eines Widerspruchs ist auf einen Monat festgesetzt."
    },
    {
      "date": "2025-12-31",
      "id": "141292",
      "original_text": "Einreichung neuer Dokumente\nBayern Amtsgericht Memmingen HRB 7394\nNUWOG - Dienstleistungs- und Betreuungs-GmbH – Neu-Ulm",
      "type": "Einreichung neuer Dokumente",
      "state": "Bayern",
      "amtsgericht": "Amtsgericht Memmingen",
      "registernummer": "HRB 7394",
      "registerart": "HRB",
      "company_name": "NUWOG - Dienstleistungs- und Betreuungs-GmbH",
      "company_seat": "Neu-Ulm",
      "details": "31.12.2025 (Bekanntmachungsdatum)\n\nBayern Amtsgericht Memmingen HRB 7394\nEinreichung neuer Dokumente\n\nNUWOG - Dienstleistungs- und Betreuungs-GmbH\nGesellschaft mit beschränkter Haftung\nNeu-Ulm\n\nDem Amtsgericht Memmingen -Registergericht- ist eine Liste der Mitglieder des Aufsichtsrats eingereicht worden, § 52 Abs. 3 S. 2 GmbHG."
    },
    {
      "date": "2025-12-31",
      "id": "141293",
      "original_text": "Registerbekanntmachung nach dem Umwandlungsgesetz\nBayern Amtsgericht Memmingen HRA 14356\nMaximilian Huber Immobilien e. K. – Wiedergeltingen",
      "type": "Registerbekanntmachung nach dem Umwandlungsgesetz",
      "state": "Bayern",
      "amtsgericht": "Amtsgericht Memmingen",
      "registernummer": "HRA 14356",
      "registerart": "HRA",
      "company_name": "Maximilian Huber Immobilien e. K.",
      "company_seat": "Wiedergeltingen",
      "details": "31.12.2025 (Bekanntmachungsdatum)\n\nBayern Amtsgericht Memmingen HRA 14356\nRegisterbekanntmachung nach dem Umwandlungsgesetz 30.12.2025 (Eintragungsdatum)\n\nMaximilian Huber Immobilien e. K.\nEinzelkaufmann / Einzelkauffrau\nWiedergeltingen\n\nDen Gläubigern der an der Ausgliederung beteiligten Rechtsträger ist, wenn sie binnen sechs Monaten nach dem Tag, an dem die Eintragung der Ausgliederung in das Register des Sitzes desjenigen Rechtsträgers, dessen Gläubiger sie sind, nach §§ 125, 19 Abs. 3 UmwG als bekannt gemacht gilt, ihren Anspruch nach Grund und Höhe in Textform anmelden, Sicherheit zu leisten, soweit sie nicht Befriedigung verlangen können. Dieses Recht steht den Gläubigern jedoch nur zu, wenn sie glaubhaft machen, dass durch die Ausgliederung die Erfüllung ihrer Forderung gefährdet wird."
    },
    {
      "date": "2025-12-31",
      "id": "141294",
      "original_text": "Löschungsankündigung\nBayern Amtsgericht Fürth HRA 5191\nL. Abwicklung GmbH & Co. KG – Zirndorf",
      "type": "Löschungsankündigung",
      "state": "Bayern",
      "amtsgericht": "Amtsgericht Fürth",
      "registernummer": "HRA 5191",
      "registerart": "HRA",
      "company_name": "L. Abwicklung GmbH & Co. KG",
      "company_seat": "Zirndorf",
      "details": "31.12.2025 (Bekanntmachungsdatum)\n\nBayern Amtsgericht Fürth HRA 5191\nLöschungsankündigung\n\nL. Abwicklung GmbH & Co. KG\nKommanditgesellschaft\nZirndorf\n\nDas Registergericht beabsichtigt, die im Handelsregister eingetragene Firma von Amts wegen nach § 31 Abs. 2 HGB zu löschen. Die Frist zur Erhebung eines Widerspruchs ist auf einen Monat festgesetzt."
    },
    {
      "date": "2025-12-31",
      "id": "141295",
      "original_text": "Registerbekanntmachung nach dem Umwandlungsgesetz\nBayern Amtsgericht München HRB 285046\nKWP III Sindersdorf UG (haftungsbeschränkt) – München",
      "type": "Registerbekanntmachung nach dem Umwandlungsgesetz",
      "state": "Bayern",
      "amtsgericht": "Amtsgericht München",
      "registernummer": "HRB 285046",
      "registerart": "HRB",
      "company_name": "KWP III Sindersdorf UG (haftungsbeschränkt)",
      "company_seat": "München",
      "details": "31.12.2025 (Bekanntmachungsdatum)\n\nBayern Amtsgericht München HRB 285046\nRegisterbekanntmachung nach dem Umwandlungsgesetz 30.12.2025 (Eintragungsdatum)\n\nKWP III Sindersdorf UG (haftungsbeschränkt)\nGesellschaft mit beschränkter Haftung\nMünchen\n\nDen Gläubigern der an der Verschmelzung beteiligten Rechtsträger ist, wenn sie binnen sechs Monaten nach dem Tag, an dem die Eintragung der Verschmelzung in das Register des Sitzes desjenigen Rechtsträgers, dessen Gläubiger sie sind, nach § 19 Abs. 3 UmwG als bekannt gemacht gilt, ihren Anspruch nach Grund und Höhe in Textform anmelden, Sicherheit zu leisten, soweit sie nicht Befriedigung verlangen können. Dieses Recht steht den Gläubigern jedoch nur zu, wenn sie glaubhaft machen, dass durch die Verschmelzung die Erfüllung ihrer Forderung gefährdet wird."
    },
    {
      "date": "2025-12-31",
      "id": "141296",
      "original_text": "Registerbekanntmachung nach dem Umwandlungsgesetz\nBayern Amtsgericht München HRB 231468\nWojtech UG (haftungsbeschränkt) – München",
      "type": "Registerbekanntmachung nach dem Umwandlungsgesetz",
      "state": "Bayern",
      "amtsgericht": "Amtsgericht München",
      "registernummer": "HRB 231468",
      "registerart": "HRB",
      "company_name": "Wojtech UG (haftungsbeschränkt)",
      "company_seat": "München",
      "details": "31.12.2025 (Bekanntmachungsdatum)\n\nBayern Amtsgericht München HRB 231468\nRegisterbekanntmachung nach dem Umwandlungsgesetz 30.12.2025 (Eintragungsdatum)\n\nWojtech UG (haftungsbeschränkt)\nGesellschaft mit beschränkter Haftung\nMünchen\n\nDen Gläubigern der an der Verschmelzung beteiligten Rechtsträger ist, wenn sie binnen sechs Monaten nach dem Tag, an dem die Eintragung der Verschmelzung in das Register des Sitzes desjenigen Rechtsträgers, dessen Gläubiger sie sind, nach § 19 Abs. 3 UmwG als bekannt gemacht gilt, ihren Anspruch nach Grund und Höhe in Textform anmelden, Sicherheit zu leisten, soweit sie nicht Befriedigung verlangen können. Dieses Recht steht den Gläubigern jedoch nur zu, wenn sie glaubhaft machen, dass durch die Verschmelzung die Erfüllung ihrer Forderung gefährdet wird."
    },
    {
      "date": "2025-12-31",
      "id": "141297",
      "original_text": "Registerbekanntmachung nach dem Umwandlungsgesetz\nBayern Amtsgericht Nürnberg HRA 20327\nisamco e.K. Inh. Michael Hochgesang – Nürnberg",
      "type": "Registerbekanntmachung nach dem Umwandlungsgesetz",
      "state": "Bayern",
      "amtsgericht": "Amtsgericht Nürnberg",
      "registernummer": "HRA 20327",
      "registerart": "HRA",
      "company_name": "isamco e.K. Inh. Michael Hochgesang",
      "company_seat": "Nürnberg",
      "details": "31.12.2025 (Bekanntmachungsdatum)\n\nBayern Amtsgericht Nürnberg HRA 20327\nRegisterbekanntmachung nach dem Umwandlungsgesetz 30.12.2025 (Eintragungsdatum)\n\nisamco e.K. Inh. Michael Hochgesang\nEinzelkaufmann / Einzelkauffrau\nNürnberg\n\nDen Gläubigern der an der Ausgliederung beteiligten Rechtsträger ist, wenn sie binnen sechs Monaten nach dem Tag, an dem die Eintragung der Ausgliederung in das Register des Sitzes desjenigen Rechtsträgers, dessen Gläubiger sie sind, nach §§ 125, 19 Abs. 3 UmwG als bekannt gemacht gilt, ihren Anspruch nach Grund und Höhe in Textform anmelden, Sicherheit zu leisten, soweit sie nicht Befriedigung verlangen können. Dieses Recht steht den Gläubigern jedoch nur zu, wenn sie glaubhaft machen, dass durch die Ausgliederung die Erfüllung ihrer Forderung gefährdet wird."
    },
    {
      "date": "2025-12-31",
      "id": "141298",
      "original_text": "Registerbekanntmachung nach dem Umwandlungsgesetz\nBaden-Württemberg Amtsgericht Stuttgart HRB 762873\nMercedes-Benz AG – Stuttgart",
      "type": "Registerbekanntmachung nach dem Umwandlungsgesetz",
      "state": "Baden-Württemberg",
      "amtsgericht": "Amtsgericht Stuttgart",
      "registernummer": "HRB 762873",
      "registerart": "HRB",
      "company_name": "Mercedes-Benz AG",
      "company_seat": "Stuttgart",
      "details": "31.12.2025 (Bekanntmachungsdatum)\n\nBaden-Württemberg Amtsgericht Stuttgart HRB 762873\nRegisterbekanntmachung nach dem Umwandlungsgesetz 31.12.2025 (Eintragungsdatum)\n\nMercedes-Benz AG\nAktiengesellschaft\nStuttgart\n\nDen Gläubigern der an der Verschmelzung beteiligten Rechtsträger ist, wenn sie binnen sechs Monaten nach dem Tag, an dem die Eintragung der Verschmelzung in das Register des Sitzes desjenigen Rechtsträgers, dessen Gläubiger sie sind, nach § 19 Abs. 3 UmwG als bekanntgemacht gilt, ihren Anspruch nach Grund und Höhe schriftlich anmelden, Sicherheit zu leisten, soweit sie nicht Befriedigung verlangen können. Dieses Recht steht den Gläubigern jedoch nur zu, wenn sie glaubhaft machen, dass durch die Verschmelzung die Erfüllung ihrer Forderung gefährdet wird."
    },
    {
      "date": "2025-12-31",
      "id": "141299",
      "original_text": "Sonstige Registerbekanntmachung\nNordrhein-Westfalen Amtsgericht Steinfurt HRB 10463\nfarmermobil GmbH – Laer",
      "type": "Sonstige Registerbekanntmachung",
      "state": "Nordrhein-Westfalen",
      "amtsgericht": "Amtsgericht Steinfurt",
      "registernummer": "HRB 10463",
      "registerart": "HRB",
      "company_name": "farmermobil GmbH",
      "company_seat": "Laer",
      "details": "31.12.2025 (Bekanntmachungsdatum)\n\nNordrhein-Westfalen Amtsgericht Steinfurt HRB 10463\nSonstige Registerbekanntmachung 31.12.2025 (Eintragungsdatum)\n\nfarmermobil GmbH\nGesellschaft mit beschränkter Haftung\nLaer\n\nAls nicht eingetragen wird veröffentlicht: Den Gläubigern der Gesellschaft, deren Forderungen begründet worden sind bevor die Eintragung der Beendigung des Gewinnabführungsvertrages  in das Handelsregister nach § 10 des Handelsgesetzbuches als bekanntgemacht gilt, hat der andere Vertragsteil Sicherheit zu leisten, wenn sie sich binnen sechs Monaten nach der Bekanntmachung der Eintragung zu diesem Zweck bei ihm melden."
    }
  ]
}