{
  "date": "2025-12-03",
  "date_of_scrape": "2025-12-04T04:15:32.813Z",
  "tool_version": "0.2.0",
  "number_of_announcements": 153,
  "announcements": [
    {
      "date": "2025-12-03",
      "id": "138923",
      "original_text": "Löschungsankündigung\nBayern Amtsgericht Coburg HRB 6321\nMontageTEAM & Fulfilment CK UG (haftungsbeschränkt) – Lichtenfels",
      "type": "Löschungsankündigung",
      "state": "Bayern",
      "amtsgericht": "Amtsgericht Coburg",
      "registernummer": "HRB 6321",
      "registerart": "HRB",
      "company_name": "MontageTEAM & Fulfilment CK UG (haftungsbeschränkt)",
      "company_seat": "Lichtenfels",
      "details": "03.12.2025 (Bekanntmachungsdatum)\n\nBayern Amtsgericht Coburg HRB 6321\nLöschungsankündigung 19.11.2025 (Eintragungsdatum)\n\nMontageTEAM & Fulfilment CK UG (haftungsbeschränkt)\nGesellschaft mit beschränkter Haftung\nLichtenfels\n\nDas Registergericht beabsichtigt, die im Handelsregister eingetragene Gesellschaft wegen Vermögenslosigkeit von Amts wegen nach § 394 FamFG zu löschen. Die Frist zur Erhebung eines Widerspruchs ist auf sechs Wochen festgesetzt."
    },
    {
      "date": "2025-12-03",
      "id": "138924",
      "original_text": "Registerbekanntmachung nach dem Umwandlungsgesetz\nBayern Amtsgericht München HRB 296937\nSeelenklarheit UG (haftungsbeschränkt) – Olching",
      "type": "Registerbekanntmachung nach dem Umwandlungsgesetz",
      "state": "Bayern",
      "amtsgericht": "Amtsgericht München",
      "registernummer": "HRB 296937",
      "registerart": "HRB",
      "company_name": "Seelenklarheit UG (haftungsbeschränkt)",
      "company_seat": "Olching",
      "details": "03.12.2025 (Bekanntmachungsdatum)\n\nBayern Amtsgericht München HRB 296937\nRegisterbekanntmachung nach dem Umwandlungsgesetz 02.12.2025 (Eintragungsdatum)\n\nSeelenklarheit UG (haftungsbeschränkt)\nGesellschaft mit beschränkter Haftung\nOlching\n\nDen Gläubigern der an der Verschmelzung beteiligten Rechtsträger ist, wenn sie binnen sechs Monaten nach dem Tag, an dem die Eintragung der Verschmelzung in das Register des Sitzes desjenigen Rechtsträgers, dessen Gläubiger sie sind, nach § 19 Abs. 3 UmwG als bekannt gemacht gilt, ihren Anspruch nach Grund und Höhe in Textform anmelden, Sicherheit zu leisten, soweit sie nicht Befriedigung verlangen können. Dieses Recht steht den Gläubigern jedoch nur zu, wenn sie glaubhaft machen, dass durch die Verschmelzung die Erfüllung ihrer Forderung gefährdet wird."
    },
    {
      "date": "2025-12-03",
      "id": "138925",
      "original_text": "Registerbekanntmachung nach dem Umwandlungsgesetz\nBayern Amtsgericht München HRB 270847\nHELMECA Immobilien GmbH – München",
      "type": "Registerbekanntmachung nach dem Umwandlungsgesetz",
      "state": "Bayern",
      "amtsgericht": "Amtsgericht München",
      "registernummer": "HRB 270847",
      "registerart": "HRB",
      "company_name": "HELMECA Immobilien GmbH",
      "company_seat": "München",
      "details": "03.12.2025 (Bekanntmachungsdatum)\n\nBayern Amtsgericht München HRB 270847\nRegisterbekanntmachung nach dem Umwandlungsgesetz 02.12.2025 (Eintragungsdatum)\n\nHELMECA Immobilien GmbH\nGesellschaft mit beschränkter Haftung\nMünchen\n\nDen Gläubigern der an der Verschmelzung beteiligten Rechtsträger ist, wenn sie binnen sechs Monaten nach dem Tag, an dem die Eintragung der Verschmelzung in das Register des Sitzes desjenigen Rechtsträgers, dessen Gläubiger sie sind, nach § 19 Abs. 3 UmwG als bekannt gemacht gilt, ihren Anspruch nach Grund und Höhe in Textform anmelden, Sicherheit zu leisten, soweit sie nicht Befriedigung verlangen können. Dieses Recht steht den Gläubigern jedoch nur zu, wenn sie glaubhaft machen, dass durch die Verschmelzung die Erfüllung ihrer Forderung gefährdet wird."
    },
    {
      "date": "2025-12-03",
      "id": "138926",
      "original_text": "Registerbekanntmachung nach dem Umwandlungsgesetz\nBayern Amtsgericht München HRB 87693\nBertrandt Systems & Consulting GmbH – Taufkirchen",
      "type": "Registerbekanntmachung nach dem Umwandlungsgesetz",
      "state": "Bayern",
      "amtsgericht": "Amtsgericht München",
      "registernummer": "HRB 87693",
      "registerart": "HRB",
      "company_name": "Bertrandt Systems & Consulting GmbH",
      "company_seat": "Taufkirchen",
      "details": "03.12.2025 (Bekanntmachungsdatum)\n\nBayern Amtsgericht München HRB 87693\nRegisterbekanntmachung nach dem Umwandlungsgesetz 02.12.2025 (Eintragungsdatum)\n\nBertrandt Systems & Consulting GmbH\nGesellschaft mit beschränkter Haftung\nTaufkirchen\n\nDen Gläubigern der an der Verschmelzung beteiligten Rechtsträger ist, wenn sie binnen sechs Monaten nach dem Tag, an dem die Eintragung der Verschmelzung in das Register des Sitzes desjenigen Rechtsträgers, dessen Gläubiger sie sind, nach § 19 Abs. 3 UmwG als bekannt gemacht gilt, ihren Anspruch nach Grund und Höhe in Textform anmelden, Sicherheit zu leisten, soweit sie nicht Befriedigung verlangen können. Dieses Recht steht den Gläubigern jedoch nur zu, wenn sie glaubhaft machen, dass durch die Verschmelzung die Erfüllung ihrer Forderung gefährdet wird."
    },
    {
      "date": "2025-12-03",
      "id": "138927",
      "original_text": "Registerbekanntmachung nach dem Umwandlungsgesetz\nBayern Amtsgericht München HRB 225535\nElla Holding GmbH – Puchheim",
      "type": "Registerbekanntmachung nach dem Umwandlungsgesetz",
      "state": "Bayern",
      "amtsgericht": "Amtsgericht München",
      "registernummer": "HRB 225535",
      "registerart": "HRB",
      "company_name": "Ella Holding GmbH",
      "company_seat": "Puchheim",
      "details": "03.12.2025 (Bekanntmachungsdatum)\n\nBayern Amtsgericht München HRB 225535\nRegisterbekanntmachung nach dem Umwandlungsgesetz 02.12.2025 (Eintragungsdatum)\n\nElla Holding GmbH\nGesellschaft mit beschränkter Haftung\nPuchheim\n\nDen Gläubigern der an der Verschmelzung beteiligten Rechtsträger ist, wenn sie binnen sechs Monaten nach dem Tag, an dem die Eintragung der Verschmelzung in das Register des Sitzes desjenigen Rechtsträgers, dessen Gläubiger sie sind, nach § 19 Abs. 3 UmwG als bekannt gemacht gilt, ihren Anspruch nach Grund und Höhe in Textform anmelden, Sicherheit zu leisten, soweit sie nicht Befriedigung verlangen können. Dieses Recht steht den Gläubigern jedoch nur zu, wenn sie glaubhaft machen, dass durch die Verschmelzung die Erfüllung ihrer Forderung gefährdet wird."
    },
    {
      "date": "2025-12-03",
      "id": "138928",
      "original_text": "Einreichung neuer Dokumente\nBayern Amtsgericht München HRB 574\nBaugesellschaft Bayern mbH – München",
      "type": "Einreichung neuer Dokumente",
      "state": "Bayern",
      "amtsgericht": "Amtsgericht München",
      "registernummer": "HRB 574",
      "registerart": "HRB",
      "company_name": "Baugesellschaft Bayern mbH",
      "company_seat": "München",
      "details": "03.12.2025 (Bekanntmachungsdatum)\n\nBayern Amtsgericht München HRB 574\nEinreichung neuer Dokumente\n\nBaugesellschaft Bayern mbH\nGesellschaft mit beschränkter Haftung\nMünchen\n\nDem Amtsgericht München -Registergericht- ist eine Liste der Mitglieder des Aufsichtsrats eingereicht worden, § 52 Abs. 3 S. 2 GmbHG."
    },
    {
      "date": "2025-12-03",
      "id": "138929",
      "original_text": "Einreichung neuer Dokumente\nBayern Amtsgericht Augsburg HRB 6067\nEisenbahn-Siedlungsgesellschaft Augsburg mbH (Siegau) – Augsburg",
      "type": "Einreichung neuer Dokumente",
      "state": "Bayern",
      "amtsgericht": "Amtsgericht Augsburg",
      "registernummer": "HRB 6067",
      "registerart": "HRB",
      "company_name": "Eisenbahn-Siedlungsgesellschaft Augsburg mbH (Siegau)",
      "company_seat": "Augsburg",
      "details": "03.12.2025 (Bekanntmachungsdatum)\n\nBayern Amtsgericht Augsburg HRB 6067\nEinreichung neuer Dokumente\n\nEisenbahn-Siedlungsgesellschaft Augsburg mbH (Siegau)\nGesellschaft mit beschränkter Haftung\nAugsburg\n\nDem Amtsgericht Augsburg -Registergericht- ist eine Liste der Mitglieder des Aufsichtsrats eingereicht worden, § 52 Abs. 3 S. 2 GmbHG."
    },
    {
      "date": "2025-12-03",
      "id": "138930",
      "original_text": "Einreichung neuer Dokumente\nBayern Amtsgericht Nürnberg HRB 461\nEisenbahn-Wohnungsbaugesellschaft Nürnberg GmbH – Nürnberg",
      "type": "Einreichung neuer Dokumente",
      "state": "Bayern",
      "amtsgericht": "Amtsgericht Nürnberg",
      "registernummer": "HRB 461",
      "registerart": "HRB",
      "company_name": "Eisenbahn-Wohnungsbaugesellschaft Nürnberg GmbH",
      "company_seat": "Nürnberg",
      "details": "03.12.2025 (Bekanntmachungsdatum)\n\nBayern Amtsgericht Nürnberg HRB 461\nEinreichung neuer Dokumente\n\nEisenbahn-Wohnungsbaugesellschaft Nürnberg GmbH\nGesellschaft mit beschränkter Haftung\nNürnberg\n\nDem Amtsgericht Nürnberg -Registergericht- ist eine Liste der Mitglieder des Aufsichtsrats eingereicht worden, § 52 Abs. 3 S. 2 GmbHG."
    },
    {
      "date": "2025-12-03",
      "id": "138931",
      "original_text": "Löschungsankündigung\nBayern Amtsgericht Nürnberg HRB 31892\nMSI GmbH – Rohr",
      "type": "Löschungsankündigung",
      "state": "Bayern",
      "amtsgericht": "Amtsgericht Nürnberg",
      "registernummer": "HRB 31892",
      "registerart": "HRB",
      "company_name": "MSI GmbH",
      "company_seat": "Rohr",
      "details": "03.12.2025 (Bekanntmachungsdatum)\n\nBayern Amtsgericht Nürnberg HRB 31892\nLöschungsankündigung\n\nMSI GmbH\nGesellschaft mit beschränkter Haftung\nRohr\n\nDas Registergericht beabsichtigt, die im Handelsregister eingetragene Gesellschaft wegen Vermögenslosigkeit von Amts wegen nach § 394 FamFG zu löschen. Die Frist zur Erhebung eines Widerspruchs ist auf einen Monat festgesetzt."
    },
    {
      "date": "2025-12-03",
      "id": "138932",
      "original_text": "Einreichung neuer Dokumente\nBayern Amtsgericht Nürnberg HRB 20609\nElectrolux Rothenburg GmbH Factory and Development – Nürnberg",
      "type": "Einreichung neuer Dokumente",
      "state": "Bayern",
      "amtsgericht": "Amtsgericht Nürnberg",
      "registernummer": "HRB 20609",
      "registerart": "HRB",
      "company_name": "Electrolux Rothenburg GmbH Factory and Development",
      "company_seat": "Nürnberg",
      "details": "03.12.2025 (Bekanntmachungsdatum)\n\nBayern Amtsgericht Nürnberg HRB 20609\nEinreichung neuer Dokumente 02.12.2025 (Eintragungsdatum)\n\nElectrolux Rothenburg GmbH Factory and Development\nGesellschaft mit beschränkter Haftung\nNürnberg\n\nDem Amtsgericht Nürnberg -Registergericht- ist eine Liste der Mitglieder des Aufsichtsrats eingereicht worden, § 52 Abs. 3 S. 2 GmbHG."
    },
    {
      "date": "2025-12-03",
      "id": "138933",
      "original_text": "Registerbekanntmachung nach dem Umwandlungsgesetz\nBayern Amtsgericht Passau HRB 1406\nLang GmbH – Grafenau",
      "type": "Registerbekanntmachung nach dem Umwandlungsgesetz",
      "state": "Bayern",
      "amtsgericht": "Amtsgericht Passau",
      "registernummer": "HRB 1406",
      "registerart": "HRB",
      "company_name": "Lang GmbH",
      "company_seat": "Grafenau",
      "details": "03.12.2025 (Bekanntmachungsdatum)\n\nBayern Amtsgericht Passau HRB 1406\nRegisterbekanntmachung nach dem Umwandlungsgesetz 02.12.2025 (Eintragungsdatum)\n\nLang GmbH\nGesellschaft mit beschränkter Haftung\nGrafenau\n\nDen Gläubigern des formwechselnden Rechtsträgers ist, wenn sie binnen sechs Monaten nach dem Tag, an dem die Eintragung des Formwechsels nach § 201 UmwG als bekannt gemacht gilt, ihren Anspruch nach Grund und Höhe in Textform anmelden, Sicherheit zu leisten, soweit sie nicht Befriedigung verlangen können. Dieses Recht steht den Gläubigern jedoch nur zu, wenn sie glaubhaft machen, dass durch den Formwechsel die Erfüllung ihrer Forderung gefährdet wird."
    },
    {
      "date": "2025-12-03",
      "id": "138934",
      "original_text": "Löschungsankündigung\nBayern Amtsgericht München HRB 92645\n\"Porto Pino\" Restaurant GmbH – Unterschleißheim",
      "type": "Löschungsankündigung",
      "state": "Bayern",
      "amtsgericht": "Amtsgericht München",
      "registernummer": "HRB 92645",
      "registerart": "HRB",
      "company_name": "\"Porto Pino\" Restaurant GmbH",
      "company_seat": "Unterschleißheim",
      "details": "03.12.2025 (Bekanntmachungsdatum)\n\nBayern Amtsgericht München HRB 92645\nLöschungsankündigung 02.12.2025 (Eintragungsdatum)\n\n\"Porto Pino\" Restaurant GmbH\nGesellschaft mit beschränkter Haftung\nUnterschleißheim\n\nDas Registergericht beabsichtigt, die im Handelsregister eingetragene Gesellschaft wegen Vermögenslosigkeit von Amts wegen nach § 394 FamFG zu löschen. Die Frist zur Erhebung eines Widerspruchs ist auf drei Monate festgesetzt."
    },
    {
      "date": "2025-12-03",
      "id": "138935",
      "original_text": "Löschungsankündigung\nBayern Amtsgericht Nürnberg HRB 36484\nGAWEB INVEST GmbH – Nürnberg",
      "type": "Löschungsankündigung",
      "state": "Bayern",
      "amtsgericht": "Amtsgericht Nürnberg",
      "registernummer": "HRB 36484",
      "registerart": "HRB",
      "company_name": "GAWEB INVEST GmbH",
      "company_seat": "Nürnberg",
      "details": "03.12.2025 (Bekanntmachungsdatum)\n\nBayern Amtsgericht Nürnberg HRB 36484\nLöschungsankündigung\n\nGAWEB INVEST GmbH\nGesellschaft mit beschränkter Haftung\nNürnberg\n\nDas Registergericht beabsichtigt, die im Handelsregister eingetragene Gesellschaft wegen Vermögenslosigkeit von Amts wegen nach § 394 FamFG zu löschen. Die Frist zur Erhebung eines Widerspruchs ist auf einen Monat festgesetzt."
    },
    {
      "date": "2025-12-03",
      "id": "138936",
      "original_text": "Einreichung neuer Dokumente\nBayern Amtsgericht München HRB 270969\nCETUS Beteiligungs- und Verwaltungsgesellschaft AG – Holzkirchen",
      "type": "Einreichung neuer Dokumente",
      "state": "Bayern",
      "amtsgericht": "Amtsgericht München",
      "registernummer": "HRB 270969",
      "registerart": "HRB",
      "company_name": "CETUS Beteiligungs- und Verwaltungsgesellschaft AG",
      "company_seat": "Holzkirchen",
      "details": "03.12.2025 (Bekanntmachungsdatum)\n\nBayern Amtsgericht München HRB 270969\nEinreichung neuer Dokumente\n\nCETUS Beteiligungs- und Verwaltungsgesellschaft AG\nAktiengesellschaft\nHolzkirchen\n\nDem Amtsgericht München -Registergericht- ist eine Liste der Mitglieder des Aufsichtsrats eingereicht worden, § 106 AktG."
    },
    {
      "date": "2025-12-03",
      "id": "138937",
      "original_text": "Einreichung neuer Dokumente\nBayern Amtsgericht München HRB 292066\nAgile Robots SE – München",
      "type": "Einreichung neuer Dokumente",
      "state": "Bayern",
      "amtsgericht": "Amtsgericht München",
      "registernummer": "HRB 292066",
      "registerart": "HRB",
      "company_name": "Agile Robots SE",
      "company_seat": "München",
      "details": "03.12.2025 (Bekanntmachungsdatum)\n\nBayern Amtsgericht München HRB 292066\nEinreichung neuer Dokumente\n\nAgile Robots SE\nEuropäische Aktiengesellschaft (SE)\nMünchen\n\nDem Amtsgericht München -Registergericht- ist eine Liste der Mitglieder des Aufsichtsrats eingereicht worden, Art. 9 Abs. 1 Buchst. c (ii) SE-VO i.V.m. § 106 AktG."
    },
    {
      "date": "2025-12-03",
      "id": "138938",
      "original_text": "Einreichung neuer Dokumente\nBayern Amtsgericht Nürnberg HRB 20635\nElectrolux Deutschland GmbH – Nürnberg",
      "type": "Einreichung neuer Dokumente",
      "state": "Bayern",
      "amtsgericht": "Amtsgericht Nürnberg",
      "registernummer": "HRB 20635",
      "registerart": "HRB",
      "company_name": "Electrolux Deutschland GmbH",
      "company_seat": "Nürnberg",
      "details": "03.12.2025 (Bekanntmachungsdatum)\n\nBayern Amtsgericht Nürnberg HRB 20635\nEinreichung neuer Dokumente\n\nElectrolux Deutschland GmbH\nGesellschaft mit beschränkter Haftung\nNürnberg\n\nDem Amtsgericht Nürnberg -Registergericht- ist eine Liste der Mitglieder des Aufsichtsrats eingereicht worden, § 52 Abs. 3 S. 2 GmbHG."
    },
    {
      "date": "2025-12-03",
      "id": "138939",
      "original_text": "Löschungsankündigung\nBayern Amtsgericht Bayreuth VR 1135\nBayerischer Wohnungs- und Grundeigentümerverband, Kreisverband Bayreuth e.V. – Bayreuth",
      "type": "Löschungsankündigung",
      "state": "Bayern",
      "amtsgericht": "Amtsgericht Bayreuth",
      "registernummer": "VR 1135",
      "registerart": "VR",
      "company_name": "Bayerischer Wohnungs- und Grundeigentümerverband, Kreisverband Bayreuth e.V.",
      "company_seat": "Bayreuth",
      "details": "03.12.2025 (Bekanntmachungsdatum)\n\nBayern Amtsgericht Bayreuth VR 1135\nLöschungsankündigung\n\nBayerischer Wohnungs- und Grundeigentümerverband, Kreisverband Bayreuth e.V.\neingetragener Verein\nBayreuth\n\nDas Registergericht beabsichtigt, den im Vereinsregister eingetragenen Verein von Amts wegen nach § 395 FamFG wegen Wegfalls aller Mitglieder zu löschen. Die Frist zur Erhebung eines Widerspruchs ist auf sechs Wochen festgesetzt."
    },
    {
      "date": "2025-12-03",
      "id": "138940",
      "original_text": "Löschungsankündigung\nBayern Amtsgericht Würzburg HRB 14470\nWD GmbH – Höchberg",
      "type": "Löschungsankündigung",
      "state": "Bayern",
      "amtsgericht": "Amtsgericht Würzburg",
      "registernummer": "HRB 14470",
      "registerart": "HRB",
      "company_name": "WD GmbH",
      "company_seat": "Höchberg",
      "details": "03.12.2025 (Bekanntmachungsdatum)\n\nBayern Amtsgericht Würzburg HRB 14470\nLöschungsankündigung\n\nWD GmbH\nGesellschaft mit beschränkter Haftung\nHöchberg\n\nDas Registergericht beabsichtigt, die im Handelsregister eingetragene Gesellschaft wegen Vermögenslosigkeit von Amts wegen nach § 394 FamFG zu löschen. Die Frist zur Erhebung eines Widerspruchs ist auf drei Monate festgesetzt."
    },
    {
      "date": "2025-12-03",
      "id": "138941",
      "original_text": "Löschungsankündigung\nBerlin Amtsgericht Berlin (Charlottenburg) HRB 222612\nHobrecht52ELIF UG (haftungsbeschränkt) – Berlin",
      "type": "Löschungsankündigung",
      "state": "Berlin",
      "amtsgericht": "Amtsgericht Berlin (Charlottenburg)",
      "registernummer": "HRB 222612",
      "registerart": "HRB",
      "company_name": "Hobrecht52ELIF UG (haftungsbeschränkt)",
      "company_seat": "Berlin",
      "details": "03.12.2025 (Bekanntmachungsdatum)\n\nBerlin Amtsgericht Berlin (Charlottenburg) HRB 222612\nLöschungsankündigung\n\nHobrecht52ELIF UG (haftungsbeschränkt)\nGesellschaft mit beschränkter Haftung\nBerlin\n\nBei der nachstehenden Gesellschaft wird das Amtslöschungsverfahren gemäß § 394 FamFG eingeleitet. Widerspruchsfrist 6 Wochen"
    },
    {
      "date": "2025-12-03",
      "id": "138942",
      "original_text": "Sonstige Registerbekanntmachung\nBaden-Württemberg Amtsgericht Ulm GnR 660051\nVolksbank Brenztal eG – Giengen an der Brenz",
      "type": "Sonstige Registerbekanntmachung",
      "state": "Baden-Württemberg",
      "amtsgericht": "Amtsgericht Ulm",
      "registernummer": "GnR 660051",
      "registerart": "GnR",
      "company_name": "Volksbank Brenztal eG",
      "company_seat": "Giengen an der Brenz",
      "details": "03.12.2025 (Bekanntmachungsdatum)\n\nBaden-Württemberg Amtsgericht Ulm GnR 660051\nSonstige Registerbekanntmachung 03.12.2025 (Eintragungsdatum)\n\nVolksbank Brenztal eG\neingetragene Genossenschaft\nGiengen an der Brenz\n\nDie Verpflichtung der Genossen, Nachschüsse zur Insolvenzmasse zu leisten, wurde aufgehoben. Den Gläubigern der Genossenschaft ist, wenn sie sich binnen sechs Monaten nach der Bekanntmachung bei der Genossenschaft zu diesem Zweck melden, Sicherheit zu leisten, soweit sie nicht Befriedigung verlangen können."
    },
    {
      "date": "2025-12-03",
      "id": "138943",
      "original_text": "Löschungsankündigung\nBaden-Württemberg Amtsgericht Mannheim HRB 745002\nGUBETAX Projektgesellschaft GmbH – Malsch",
      "type": "Löschungsankündigung",
      "state": "Baden-Württemberg",
      "amtsgericht": "Amtsgericht Mannheim",
      "registernummer": "HRB 745002",
      "registerart": "HRB",
      "company_name": "GUBETAX Projektgesellschaft GmbH",
      "company_seat": "Malsch",
      "details": "03.12.2025 (Bekanntmachungsdatum)\n\nBaden-Württemberg Amtsgericht Mannheim HRB 745002\nLöschungsankündigung\n\nGUBETAX Projektgesellschaft GmbH\nGesellschaft mit beschränkter Haftung\nMalsch\n\nDas Gericht beabsichtigt, die Gesellschaft wegen Vermögenslosigkeit im Handelsregister von Amts wegen nach § 394 FamFG zu löschen. Die Frist zur Geltendmachung eines Widerspruchs gegen die beabsichtigte Löschung ist auf einen Monat ab Veröffentlichung bestimmt."
    },
    {
      "date": "2025-12-03",
      "id": "138944",
      "original_text": "Löschungsankündigung\nBaden-Württemberg Amtsgericht Stuttgart HRA 723691\nBVL Blechtechnik GmbH & Co. KG – Bad Rappenau",
      "type": "Löschungsankündigung",
      "state": "Baden-Württemberg",
      "amtsgericht": "Amtsgericht Stuttgart",
      "registernummer": "HRA 723691",
      "registerart": "HRA",
      "company_name": "BVL Blechtechnik GmbH & Co. KG",
      "company_seat": "Bad Rappenau",
      "details": "03.12.2025 (Bekanntmachungsdatum)\n\nBaden-Württemberg Amtsgericht Stuttgart HRA 723691\nLöschungsankündigung\n\nBVL Blechtechnik GmbH & Co. KG\nKommanditgesellschaft\nBad Rappenau\n\nAls nicht eingetragen wird bekanntgemacht:\nDas Gericht beabsichtigt, die Gesellschaft wegen Vermögenslosigkeit im Handelsregister von Amts wegen nach § 394 FamFG zu löschen. Die Frist zur Geltendmachung eines Widerspruchs gegen die beabsichtigte Löschung ist auf zwei Monate ab Veröffentlichung bestimmt."
    },
    {
      "date": "2025-12-03",
      "id": "138945",
      "original_text": "Löschungsankündigung\nBrandenburg Amtsgericht Potsdam HRB 40469\nVolteure UG (haftungsbeschränkt) – Brieselang",
      "type": "Löschungsankündigung",
      "state": "Brandenburg",
      "amtsgericht": "Amtsgericht Potsdam",
      "registernummer": "HRB 40469",
      "registerart": "HRB",
      "company_name": "Volteure UG (haftungsbeschränkt)",
      "company_seat": "Brieselang",
      "details": "03.12.2025 (Bekanntmachungsdatum)\n\nBrandenburg Amtsgericht Potsdam HRB 40469\nLöschungsankündigung\n\nVolteure UG (haftungsbeschränkt)\nGesellschaft mit beschränkter Haftung\nBrieselang\n\nBei der nachstehenden Gesellschaft wird das Amtslöschungsverfahren gemäß § 394 FamFG eingeleitet. Widerspruchsfrist 8 Wochen."
    },
    {
      "date": "2025-12-03",
      "id": "138946",
      "original_text": "Einreichung neuer Dokumente\nSaarland Amtsgericht Saarbrücken HRB 4751\nCOSMOS Lebensversicherungs-Aktiengesellschaft – Saarbrücken",
      "type": "Einreichung neuer Dokumente",
      "state": "Saarland",
      "amtsgericht": "Amtsgericht Saarbrücken",
      "registernummer": "HRB 4751",
      "registerart": "HRB",
      "company_name": "COSMOS Lebensversicherungs-Aktiengesellschaft",
      "company_seat": "Saarbrücken",
      "details": "03.12.2025 (Bekanntmachungsdatum)\n\nSaarland Amtsgericht Saarbrücken HRB 4751\nEinreichung neuer Dokumente\n\nCOSMOS Lebensversicherungs-Aktiengesellschaft\nAktiengesellschaft\nSaarbrücken\n\nDer Vorstand der Gesellschaft hat eine Liste der Mitglieder des Aufsichtsrats zum Handelsregister eingereicht (§ 106 AktG)."
    },
    {
      "date": "2025-12-03",
      "id": "138947",
      "original_text": "Einreichung neuer Dokumente\nHamburg Amtsgericht Hamburg HRB 171306\nAirbus Aerostructures GmbH – Hamburg",
      "type": "Einreichung neuer Dokumente",
      "state": "Hamburg",
      "amtsgericht": "Amtsgericht Hamburg",
      "registernummer": "HRB 171306",
      "registerart": "HRB",
      "company_name": "Airbus Aerostructures GmbH",
      "company_seat": "Hamburg",
      "details": "03.12.2025 (Bekanntmachungsdatum)\n\nHamburg Amtsgericht Hamburg HRB 171306\nEinreichung neuer Dokumente 27.11.2025 (Eintragungsdatum)\n\nAirbus Aerostructures GmbH\nGesellschaft mit beschränkter Haftung\nHamburg\n\nAls nicht eingetragen wird bekannt gemacht: Liste des Aufsichtsrats wurde eingereicht."
    },
    {
      "date": "2025-12-03",
      "id": "138948",
      "original_text": "Registerbekanntmachung nach dem Umwandlungsgesetz\nNordrhein-Westfalen Amtsgericht Coesfeld HRA 10279\nHasan Kabadayi Kiosk Tabak Shop De Grens e.K. – Gronau (Westfalen)",
      "type": "Registerbekanntmachung nach dem Umwandlungsgesetz",
      "state": "Nordrhein-Westfalen",
      "amtsgericht": "Amtsgericht Coesfeld",
      "registernummer": "HRA 10279",
      "registerart": "HRA",
      "company_name": "Hasan Kabadayi Kiosk Tabak Shop De Grens e.K.",
      "company_seat": "Gronau (Westfalen)",
      "details": "03.12.2025 (Bekanntmachungsdatum)\n\nNordrhein-Westfalen Amtsgericht Coesfeld HRA 10279\nRegisterbekanntmachung nach dem Umwandlungsgesetz 03.12.2025 (Eintragungsdatum)\n\nHasan Kabadayi Kiosk Tabak Shop De Grens e.K.\nEinzelkaufmann\nGronau (Westfalen)\n\nDen Gläubigern der an der Ausgliederung beteiligten Rechtsträger ist, wenn sie binnen sechs Monaten nach dem Tag, an dem die Eintragung der Ausgliederung in das Register des Sitzes desjenigen Rechtsträgers, dessen Gläubiger sie sind, nach § 19 Absatz 3 UmwG als bekanntgemacht gilt, ihren Anspruch nach Grund und Höhe schriftlich anmelden, Sicherheit zu leisten, soweit sie nicht Befriedigung verlangen können. Dieses Recht steht den Gläubigern jedoch nur zu, wenn sie glaubhaft machen, dass durch die Ausgliederung die Erfüllung ihrer Forderung gefährdet wird."
    },
    {
      "date": "2025-12-03",
      "id": "138949",
      "original_text": "Löschungsankündigung\nSaarland Amtsgericht Saarbrücken HRB 106300\nVITALSWISS UG (haftungsbeschränkt) – Saarbrücken",
      "type": "Löschungsankündigung",
      "state": "Saarland",
      "amtsgericht": "Amtsgericht Saarbrücken",
      "registernummer": "HRB 106300",
      "registerart": "HRB",
      "company_name": "VITALSWISS UG (haftungsbeschränkt)",
      "company_seat": "Saarbrücken",
      "details": "03.12.2025 (Bekanntmachungsdatum)\n\nSaarland Amtsgericht Saarbrücken HRB 106300\nLöschungsankündigung\n\nVITALSWISS UG (haftungsbeschränkt)\nGesellschaft mit beschränkter Haftung\nSaarbrücken\n\nEs ist beabsichtigt, die Gesellschaft von Amts wegen gemäß § 394 FamFG wegen Vermögenslosigkeit zu löschen.\nGegen die Löschung von Amts wegen ist das Rechtsmittel des Widerspruchs statthaft. Der Widerspruch ist binnen einer Frist einem Monat beginnend mit dem Tag dieser Veröffentlichung durch Einreichen eines Widerspruchsschreibens -schriftlich oder zur Niederschrift der Geschäftsstelle beim Amtsgericht Saarbrücken, -zentrales Handelsregister-, Mainzerstr.178, 66121 Saarbrücken einzulegen.\nDer Widerspruch muss die Bezeichnung der angefochtenen Löschungsankündigung enthalten sowie die Erklärung, dass Widerspruch eingelegt wird. Er ist vom Widerspruchsführer oder seinem Bevollmächtigten zu unterzeichnen.\nDas Widerspruchsschreiben kann auch in der Form eines elektronischen Dokumentes eingereicht werden, das mit einer qualifizierten elektronischen Signatur nach dem Signaturgesetz versehen sein muss (§§ 14 Abs. 2 FamFG, 130a, 298 ZPO)."
    },
    {
      "date": "2025-12-03",
      "id": "138950",
      "original_text": "Einreichung neuer Dokumente\nHamburg Amtsgericht Hamburg HRB 78475\nSasol Germany GmbH – Hamburg",
      "type": "Einreichung neuer Dokumente",
      "state": "Hamburg",
      "amtsgericht": "Amtsgericht Hamburg",
      "registernummer": "HRB 78475",
      "registerart": "HRB",
      "company_name": "Sasol Germany GmbH",
      "company_seat": "Hamburg",
      "details": "03.12.2025 (Bekanntmachungsdatum)\n\nHamburg Amtsgericht Hamburg HRB 78475\nEinreichung neuer Dokumente\n\nSasol Germany GmbH\nGesellschaft mit beschränkter Haftung\nHamburg\n\nAls nicht eingetragen wird bekannt gemacht: Liste des Aufsichtsrats wurde eingereicht."
    },
    {
      "date": "2025-12-03",
      "id": "138951",
      "original_text": "Registerbekanntmachung nach dem Umwandlungsgesetz\nBerlin Amtsgericht Berlin (Charlottenburg) HRB 245468\nFT Beteiligung GmbH – Berlin",
      "type": "Registerbekanntmachung nach dem Umwandlungsgesetz",
      "state": "Berlin",
      "amtsgericht": "Amtsgericht Berlin (Charlottenburg)",
      "registernummer": "HRB 245468",
      "registerart": "HRB",
      "company_name": "FT Beteiligung GmbH",
      "company_seat": "Berlin",
      "details": "03.12.2025 (Bekanntmachungsdatum)\n\nBerlin Amtsgericht Berlin (Charlottenburg) HRB 245468\nRegisterbekanntmachung nach dem Umwandlungsgesetz 02.12.2025 (Eintragungsdatum)\n\nFT Beteiligung GmbH\nGesellschaft mit beschränkter Haftung\nBerlin\n\nZu Eintragungsnummer 10 vom 02.12.2025 wird als nicht eingetragen veröffentlicht: Den Gläubigern der an der Verschmelzung beteiligten Rechtsträger ist, wenn sie binnen sechs Monaten nach dem Tag, an dem die Eintragung der Verschmelzung in das Register des Sitzes desjenigen Rechtsträgers, dessen Gläubiger sie sind, als bekannt gemacht gilt, ihren Anspruch nach Grund und Höhe schriftlich anmelden, Sicherheit zu leisten, soweit sie nicht Befriedigung verlangen können. Dieses Recht steht den Gläubigern jedoch nur zu, wenn sie glaubhaft machen, dass durch die Verschmelzung die Erfüllung ihrer Forderung gefährdet wird. Das Recht, Sicherheitsleistung zu verlangen, steht Gläubigern nicht zu, die im Falle der Insolvenz ein Recht auf vorzugsweise Befriedigung aus einer Deckungsmasse haben, die nach gesetzlicher Vorschrift zu ihrem Schutz errichtet und staatlich überwacht ist."
    },
    {
      "date": "2025-12-03",
      "id": "138952",
      "original_text": "Löschungsankündigung\nBaden-Württemberg Amtsgericht Stuttgart HRB 764886\nMedikids GmbH – Eppingen",
      "type": "Löschungsankündigung",
      "state": "Baden-Württemberg",
      "amtsgericht": "Amtsgericht Stuttgart",
      "registernummer": "HRB 764886",
      "registerart": "HRB",
      "company_name": "Medikids GmbH",
      "company_seat": "Eppingen",
      "details": "03.12.2025 (Bekanntmachungsdatum)\n\nBaden-Württemberg Amtsgericht Stuttgart HRB 764886\nLöschungsankündigung\n\nMedikids GmbH\nGesellschaft mit beschränkter Haftung\nEppingen\n\nAls nicht eingetragen wird bekanntgemacht:\nDas Gericht beabsichtigt, die Gesellschaft wegen Vermögenslosigkeit im Handelsregister von Amts wegen nach § 394 FamFG zu löschen. Die Frist zur Geltendmachung eines Widerspruchs gegen die beabsichtigte Löschung ist auf zwei Monate ab Veröffentlichung bestimmt."
    },
    {
      "date": "2025-12-03",
      "id": "138953",
      "original_text": "Löschungsankündigung\nBaden-Württemberg Amtsgericht Stuttgart HRB 774885\nPDND Music Europe GmbH – Stuttgart",
      "type": "Löschungsankündigung",
      "state": "Baden-Württemberg",
      "amtsgericht": "Amtsgericht Stuttgart",
      "registernummer": "HRB 774885",
      "registerart": "HRB",
      "company_name": "PDND Music Europe GmbH",
      "company_seat": "Stuttgart",
      "details": "03.12.2025 (Bekanntmachungsdatum)\n\nBaden-Württemberg Amtsgericht Stuttgart HRB 774885\nLöschungsankündigung\n\nPDND Music Europe GmbH\nGesellschaft mit beschränkter Haftung\nStuttgart\n\nAls nicht eingetragen wird bekanntgemacht:\nDas Gericht beabsichtigt, die Gesellschaft wegen Vermögenslosigkeit im Handelsregister von Amts wegen nach § 394 FamFG zu löschen. Die Frist zur Geltendmachung eines Widerspruchs gegen die beabsichtigte Löschung ist auf zwei Monate ab Veröffentlichung bestimmt."
    },
    {
      "date": "2025-12-03",
      "id": "138954",
      "original_text": "Registerbekanntmachung nach dem Umwandlungsgesetz\nBerlin Amtsgericht Berlin (Charlottenburg) HRB 254432\nSmart & Green Timber GmbH – Berlin",
      "type": "Registerbekanntmachung nach dem Umwandlungsgesetz",
      "state": "Berlin",
      "amtsgericht": "Amtsgericht Berlin (Charlottenburg)",
      "registernummer": "HRB 254432",
      "registerart": "HRB",
      "company_name": "Smart & Green Timber GmbH",
      "company_seat": "Berlin",
      "details": "03.12.2025 (Bekanntmachungsdatum)\n\nBerlin Amtsgericht Berlin (Charlottenburg) HRB 254432\nRegisterbekanntmachung nach dem Umwandlungsgesetz 02.12.2025 (Eintragungsdatum)\n\nSmart & Green Timber GmbH\nGesellschaft mit beschränkter Haftung\nBerlin\n\nZu Eintragungsnummer 4 vom 02.12.2025 wird als nicht eingetragen veröffentlicht: Den Gläubigern der an der Verschmelzung beteiligten Rechtsträger ist, wenn sie binnen sechs Monaten nach dem Tag, an dem die Eintragung der Verschmelzung in das Register des Sitzes desjenigen Rechtsträgers, dessen Gläubiger sie sind, als bekannt gemacht gilt, ihren Anspruch nach Grund und Höhe schriftlich anmelden, Sicherheit zu leisten, soweit sie nicht Befriedigung verlangen können. Dieses Recht steht den Gläubigern jedoch nur zu, wenn sie glaubhaft machen, dass durch die Verschmelzung die Erfüllung ihrer Forderung gefährdet wird. Das Recht, Sicherheitsleistung zu verlangen, steht Gläubigern nicht zu, die im Falle der Insolvenz ein Recht auf vorzugsweise Befriedigung aus einer Deckungsmasse haben, die nach gesetzlicher Vorschrift zu ihrem Schutz errichtet und staatlich überwacht ist."
    },
    {
      "date": "2025-12-03",
      "id": "138955",
      "original_text": "Einreichung neuer Dokumente\nBaden-Württemberg Amtsgericht Stuttgart HRB 260035\nKreisbaugesellschaft Waiblingen mit beschränkter Haftung – Waiblingen",
      "type": "Einreichung neuer Dokumente",
      "state": "Baden-Württemberg",
      "amtsgericht": "Amtsgericht Stuttgart",
      "registernummer": "HRB 260035",
      "registerart": "HRB",
      "company_name": "Kreisbaugesellschaft Waiblingen mit beschränkter Haftung",
      "company_seat": "Waiblingen",
      "details": "03.12.2025 (Bekanntmachungsdatum)\n\nBaden-Württemberg Amtsgericht Stuttgart HRB 260035\nEinreichung neuer Dokumente\n\nKreisbaugesellschaft Waiblingen mit beschränkter Haftung\nGesellschaft mit beschränkter Haftung\nWaiblingen\n\nDie Gesellschaft hat am 02.12.2025 die Liste über die Zusammensetzung des Aufsichtsrats zum Handelsregister eingereicht."
    },
    {
      "date": "2025-12-03",
      "id": "138956",
      "original_text": "Einreichung neuer Dokumente\nSachsen-Anhalt Amtsgericht Stendal HRB 10761\nIPS Immobilien- und Projektmanagementgesellschaft Sachsen-Anhalt mbH – Magdeburg",
      "type": "Einreichung neuer Dokumente",
      "state": "Sachsen-Anhalt",
      "amtsgericht": "Amtsgericht Stendal",
      "registernummer": "HRB 10761",
      "registerart": "HRB",
      "company_name": "IPS Immobilien- und Projektmanagementgesellschaft Sachsen-Anhalt mbH",
      "company_seat": "Magdeburg",
      "details": "03.12.2025 (Bekanntmachungsdatum)\n\nSachsen-Anhalt Amtsgericht Stendal HRB 10761\nEinreichung neuer Dokumente\n\nIPS Immobilien- und Projektmanagementgesellschaft Sachsen-Anhalt mbH\nGesellschaft mit beschränkter Haftung\nMagdeburg\n\nEine Liste der Mitglieder des Aufsichtsrates wurde zum Handelsregister eingereicht."
    },
    {
      "date": "2025-12-03",
      "id": "138957",
      "original_text": "Einreichung neuer Dokumente\nSachsen-Anhalt Amtsgericht Stendal HRB 10761\nIPS Immobilien- und Projektmanagementgesellschaft Sachsen-Anhalt mbH – Magdeburg",
      "type": "Einreichung neuer Dokumente",
      "state": "Sachsen-Anhalt",
      "amtsgericht": "Amtsgericht Stendal",
      "registernummer": "HRB 10761",
      "registerart": "HRB",
      "company_name": "IPS Immobilien- und Projektmanagementgesellschaft Sachsen-Anhalt mbH",
      "company_seat": "Magdeburg",
      "details": "03.12.2025 (Bekanntmachungsdatum)\n\nSachsen-Anhalt Amtsgericht Stendal HRB 10761\nEinreichung neuer Dokumente\n\nIPS Immobilien- und Projektmanagementgesellschaft Sachsen-Anhalt mbH\nGesellschaft mit beschränkter Haftung\nMagdeburg\n\nEine Liste der Mitglieder des Aufsichtsrates wurde zum Handelsregister eingereicht."
    },
    {
      "date": "2025-12-03",
      "id": "138958",
      "original_text": "Einreichung neuer Dokumente\nHamburg Amtsgericht Hamburg HRB 139449\nHolcim (Deutschland) GmbH – Hamburg",
      "type": "Einreichung neuer Dokumente",
      "state": "Hamburg",
      "amtsgericht": "Amtsgericht Hamburg",
      "registernummer": "HRB 139449",
      "registerart": "HRB",
      "company_name": "Holcim (Deutschland) GmbH",
      "company_seat": "Hamburg",
      "details": "03.12.2025 (Bekanntmachungsdatum)\n\nHamburg Amtsgericht Hamburg HRB 139449\nEinreichung neuer Dokumente\n\nHolcim (Deutschland) GmbH\nGesellschaft mit beschränkter Haftung\nHamburg\n\nAls nicht eingetragen wird bekannt gemacht: Liste des Aufsichtsrats wurde eingereicht."
    },
    {
      "date": "2025-12-03",
      "id": "138959",
      "original_text": "Registerbekanntmachung nach dem Umwandlungsgesetz\nBaden-Württemberg Amtsgericht Mannheim HRB 560379\nNoor GmbH Verpackungstechnik und Transporthilfen – Grünsfeld",
      "type": "Registerbekanntmachung nach dem Umwandlungsgesetz",
      "state": "Baden-Württemberg",
      "amtsgericht": "Amtsgericht Mannheim",
      "registernummer": "HRB 560379",
      "registerart": "HRB",
      "company_name": "Noor GmbH Verpackungstechnik und Transporthilfen",
      "company_seat": "Grünsfeld",
      "details": "03.12.2025 (Bekanntmachungsdatum)\n\nBaden-Württemberg Amtsgericht Mannheim HRB 560379\nRegisterbekanntmachung nach dem Umwandlungsgesetz 03.12.2025 (Eintragungsdatum)\n\nNoor GmbH Verpackungstechnik und Transporthilfen\nGesellschaft mit beschränkter Haftung\nGrünsfeld\n\nAls nicht eingetragen wird bekanntgemacht:\nDen Gläubigern der an der Verschmelzung beteiligten Rechtsträger ist, wenn sie binnen sechs Monaten nach dem Tag, an dem die Eintragung der Verschmelzung in das Register des Sitzes desjenigen Rechtsträgers, dessen Gläubiger sie sind, nach § 19 Abs. 3 UmwG als bekanntgemacht gilt, ihren Anspruch nach Grund und Höhe schriftlich anmelden, Sicherheit zu leisten, soweit sie nicht Befriedigung verlangen können. Dieses Recht steht den Gläubigern jedoch nur zu, wenn sie glaubhaft machen, dass durch die Verschmelzung die Erfüllung ihrer Forderung gefährdet wird."
    },
    {
      "date": "2025-12-03",
      "id": "138960",
      "original_text": "Löschungsankündigung\nBerlin Amtsgericht Berlin (Charlottenburg) HRB 236737\nHadrian VV31 GmbH – Berlin",
      "type": "Löschungsankündigung",
      "state": "Berlin",
      "amtsgericht": "Amtsgericht Berlin (Charlottenburg)",
      "registernummer": "HRB 236737",
      "registerart": "HRB",
      "company_name": "Hadrian VV31 GmbH",
      "company_seat": "Berlin",
      "details": "03.12.2025 (Bekanntmachungsdatum)\n\nBerlin Amtsgericht Berlin (Charlottenburg) HRB 236737\nLöschungsankündigung\n\nHadrian VV31 GmbH\nGesellschaft mit beschränkter Haftung\nBerlin\n\nBei der nachstehenden Gesellschaft wird das Amtslöschungsverfahren gemäß § 394 FamFG eingeleitet. Widerspruchsfrist 6 Wochen"
    },
    {
      "date": "2025-12-03",
      "id": "138961",
      "original_text": "Löschungsankündigung\nBerlin Amtsgericht Berlin (Charlottenburg) HRB 198133\nHucKEPack Logistics UG (haftungsbeschränkt) – Berlin",
      "type": "Löschungsankündigung",
      "state": "Berlin",
      "amtsgericht": "Amtsgericht Berlin (Charlottenburg)",
      "registernummer": "HRB 198133",
      "registerart": "HRB",
      "company_name": "HucKEPack Logistics UG (haftungsbeschränkt)",
      "company_seat": "Berlin",
      "details": "03.12.2025 (Bekanntmachungsdatum)\n\nBerlin Amtsgericht Berlin (Charlottenburg) HRB 198133\nLöschungsankündigung\n\nHucKEPack Logistics UG (haftungsbeschränkt)\nGesellschaft mit beschränkter Haftung\nBerlin\n\nBei der nachstehenden Gesellschaft wird das Amtslöschungsverfahren gemäß § 394 FamFG eingeleitet. Widerspruchsfrist 6 Wochen"
    },
    {
      "date": "2025-12-03",
      "id": "138962",
      "original_text": "Löschungsankündigung\nBerlin Amtsgericht Berlin (Charlottenburg) HRB 205384\nIC7 GmbH – Berlin",
      "type": "Löschungsankündigung",
      "state": "Berlin",
      "amtsgericht": "Amtsgericht Berlin (Charlottenburg)",
      "registernummer": "HRB 205384",
      "registerart": "HRB",
      "company_name": "IC7 GmbH",
      "company_seat": "Berlin",
      "details": "03.12.2025 (Bekanntmachungsdatum)\n\nBerlin Amtsgericht Berlin (Charlottenburg) HRB 205384\nLöschungsankündigung\n\nIC7 GmbH\nGesellschaft mit beschränkter Haftung\nBerlin\n\nBei der nachstehenden Gesellschaft wird das Amtslöschungsverfahren gemäß § 394 FamFG eingeleitet. Widerspruchsfrist 6 Wochen"
    },
    {
      "date": "2025-12-03",
      "id": "138963",
      "original_text": "Löschungsankündigung\nBerlin Amtsgericht Berlin (Charlottenburg) HRB 235395\nPohl Direkt Bauservice GmbH – Berlin",
      "type": "Löschungsankündigung",
      "state": "Berlin",
      "amtsgericht": "Amtsgericht Berlin (Charlottenburg)",
      "registernummer": "HRB 235395",
      "registerart": "HRB",
      "company_name": "Pohl Direkt Bauservice GmbH",
      "company_seat": "Berlin",
      "details": "03.12.2025 (Bekanntmachungsdatum)\n\nBerlin Amtsgericht Berlin (Charlottenburg) HRB 235395\nLöschungsankündigung\n\nPohl Direkt Bauservice GmbH\nGesellschaft mit beschränkter Haftung\nBerlin\n\nBei der nachstehenden Gesellschaft wird das Amtslöschungsverfahren gemäß § 394 FamFG eingeleitet. Widerspruchsfrist 6 Wochen"
    },
    {
      "date": "2025-12-03",
      "id": "138964",
      "original_text": "Registerbekanntmachung nach dem Umwandlungsgesetz\nMecklenburg-Vorpommern Amtsgericht Schwerin HRB 11449\nDipl.-Kfm. Reinhard Voigt GmbH Steuerberatungsgesellschaft – Lüttow-Valluhn OT Valluhn",
      "type": "Registerbekanntmachung nach dem Umwandlungsgesetz",
      "state": "Mecklenburg-Vorpommern",
      "amtsgericht": "Amtsgericht Schwerin",
      "registernummer": "HRB 11449",
      "registerart": "HRB",
      "company_name": "Dipl.-Kfm. Reinhard Voigt GmbH Steuerberatungsgesellschaft",
      "company_seat": "Lüttow-Valluhn OT Valluhn",
      "details": "03.12.2025 (Bekanntmachungsdatum)\n\nMecklenburg-Vorpommern Amtsgericht Schwerin HRB 11449\nRegisterbekanntmachung nach dem Umwandlungsgesetz 03.12.2025 (Eintragungsdatum)\n\nDipl.-Kfm. Reinhard Voigt GmbH Steuerberatungsgesellschaft\nGesellschaft mit beschränkter Haftung\nLüttow-Valluhn OT Valluhn\n\nDen Gläubigern der an der Verschmelzung beteiligten Gesellschaft ist, wenn sie binnen sechs Monaten nach dem Tag, an dem die Eintragung der Verschmelzungen in das Register des Sitzes des Rechtsträgers, dessen Gläubiger sie sind, nach § 19 Absatz 3 UmwG als bekanntgemacht gilt, ihren Anspruch nach Grund und Höhe schriftlich anmelden, Sicherheit zu leisten, soweit sie nicht Befriedigung verlangen können. Dieses Recht steht den Gläubigern jedoch nur zu, wenn sie glaubhaft machen, dass durch die Verschmelzung die Erfüllung ihrer Forderung gefährdet wird."
    },
    {
      "date": "2025-12-03",
      "id": "138965",
      "original_text": "Löschungsankündigung\nBerlin Amtsgericht Berlin (Charlottenburg) HRB 212662\nDARYD Bauunternehmen GmbH – Berlin",
      "type": "Löschungsankündigung",
      "state": "Berlin",
      "amtsgericht": "Amtsgericht Berlin (Charlottenburg)",
      "registernummer": "HRB 212662",
      "registerart": "HRB",
      "company_name": "DARYD Bauunternehmen GmbH",
      "company_seat": "Berlin",
      "details": "03.12.2025 (Bekanntmachungsdatum)\n\nBerlin Amtsgericht Berlin (Charlottenburg) HRB 212662\nLöschungsankündigung\n\nDARYD Bauunternehmen GmbH\nGesellschaft mit beschränkter Haftung\nBerlin\n\nBei der nachstehenden Gesellschaft wird das Amtslöschungsverfahren gemäß § 394 FamFG eingeleitet. Widerspruchsfrist 6 Wochen"
    },
    {
      "date": "2025-12-03",
      "id": "138966",
      "original_text": "Sonstige Registerbekanntmachung\nHamburg Amtsgericht Hamburg HRB 16798\nJET Tankstellen Deutschland GmbH – Hamburg",
      "type": "Sonstige Registerbekanntmachung",
      "state": "Hamburg",
      "amtsgericht": "Amtsgericht Hamburg",
      "registernummer": "HRB 16798",
      "registerart": "HRB",
      "company_name": "JET Tankstellen Deutschland GmbH",
      "company_seat": "Hamburg",
      "details": "03.12.2025 (Bekanntmachungsdatum)\n\nHamburg Amtsgericht Hamburg HRB 16798\nSonstige Registerbekanntmachung 03.12.2025 (Eintragungsdatum)\n\nJET Tankstellen Deutschland GmbH\nGesellschaft mit beschränkter Haftung\nHamburg\n\nAls nicht eingetragen wird bekannt gemacht:  Den Gläubigern der Gesellschaft, deren Forderungen begründet worden sind, bevor die Eintragung der Vertragsbeendigung in das Handelsregister nach § 10 HGB als bekannt gemacht gilt, ist vom anderen Vertragsteil Sicherheit zu leisten, wenn sie sich binnen 6 Monaten nach Bekanntmachung der Eintragung zu diesem Zweck bei ihm melden."
    },
    {
      "date": "2025-12-03",
      "id": "138967",
      "original_text": "Registerbekanntmachung nach dem Umwandlungsgesetz\nBerlin Amtsgericht Berlin (Charlottenburg) HRA 27871\nHans-Dieter Laubinger Schaustellerbetrieb – Berlin",
      "type": "Registerbekanntmachung nach dem Umwandlungsgesetz",
      "state": "Berlin",
      "amtsgericht": "Amtsgericht Berlin (Charlottenburg)",
      "registernummer": "HRA 27871",
      "registerart": "HRA",
      "company_name": "Hans-Dieter Laubinger Schaustellerbetrieb",
      "company_seat": "Berlin",
      "details": "03.12.2025 (Bekanntmachungsdatum)\n\nBerlin Amtsgericht Berlin (Charlottenburg) HRA 27871\nRegisterbekanntmachung nach dem Umwandlungsgesetz 02.12.2025 (Eintragungsdatum)\n\nHans-Dieter Laubinger Schaustellerbetrieb\nEinzelkaufmann / Einzelkauffrau\nBerlin\n\nZu Eintragungsnummer 3 vom 02.12.2025 wird als nicht eingetragen veröffentlicht: Den Gläubigern der an der Spaltung beteiligten Rechtsträger ist, wenn sie binnen sechs Monaten nach dem Tag, an dem die Eintragung der Spaltung in das Register des Sitzes desjenigen Rechtsträgers, dessen Gläubiger sie sind, als bekannt gemacht gilt, ihren Anspruch nach Grund und Höhe schriftlich anmelden, Sicherheit zu leisten, soweit sie nicht Befriedigung verlangen können. Dieses Recht steht den Gläubigern jedoch nur zu, wenn sie glaubhaft machen, dass durch die Spaltung die Erfüllung ihrer Forderung gefährdet wird. Das Recht, Sicherheitsleistung zu verlangen, steht Gläubigern nicht zu, die im Falle der Insolvenz ein Recht auf vorzugsweise Befriedigung aus einer Deckungsmasse haben, die nach gesetzlicher Vorschrift zu ihrem Schutz errichtet und staatlich überwacht ist."
    },
    {
      "date": "2025-12-03",
      "id": "138968",
      "original_text": "Registerbekanntmachung nach dem Umwandlungsgesetz\nBerlin Amtsgericht Berlin (Charlottenburg) HRB 199406\nLaubinger Event GmbH – Berlin",
      "type": "Registerbekanntmachung nach dem Umwandlungsgesetz",
      "state": "Berlin",
      "amtsgericht": "Amtsgericht Berlin (Charlottenburg)",
      "registernummer": "HRB 199406",
      "registerart": "HRB",
      "company_name": "Laubinger Event GmbH",
      "company_seat": "Berlin",
      "details": "03.12.2025 (Bekanntmachungsdatum)\n\nBerlin Amtsgericht Berlin (Charlottenburg) HRB 199406\nRegisterbekanntmachung nach dem Umwandlungsgesetz 02.12.2025 (Eintragungsdatum)\n\nLaubinger Event GmbH\nGesellschaft mit beschränkter Haftung\nBerlin\n\nZu Eintragungsnummer 3 vom 02.12.2025 wird als nicht eingetragen veröffentlicht: Den Gläubigern der an der Spaltung beteiligten Rechtsträger ist, wenn sie binnen sechs Monaten nach dem Tag, an dem die Eintragung der Spaltung in das Register des Sitzes desjenigen Rechtsträgers, dessen Gläubiger sie sind, als bekannt gemacht gilt, ihren Anspruch nach Grund und Höhe schriftlich anmelden, Sicherheit zu leisten, soweit sie nicht Befriedigung verlangen können. Dieses Recht steht den Gläubigern jedoch nur zu, wenn sie glaubhaft machen, dass durch die Spaltung die Erfüllung ihrer Forderung gefährdet wird. Das Recht, Sicherheitsleistung zu verlangen, steht Gläubigern nicht zu, die im Falle der Insolvenz ein Recht auf vorzugsweise Befriedigung aus einer Deckungsmasse haben, die nach gesetzlicher Vorschrift zu ihrem Schutz errichtet und staatlich überwacht ist."
    },
    {
      "date": "2025-12-03",
      "id": "138969",
      "original_text": "Löschungsankündigung\nBerlin Amtsgericht Berlin (Charlottenburg) HRA 34966\nSchleicher Electronic GmbH & Co. KG – Berlin",
      "type": "Löschungsankündigung",
      "state": "Berlin",
      "amtsgericht": "Amtsgericht Berlin (Charlottenburg)",
      "registernummer": "HRA 34966",
      "registerart": "HRA",
      "company_name": "Schleicher Electronic GmbH & Co. KG",
      "company_seat": "Berlin",
      "details": "03.12.2025 (Bekanntmachungsdatum)\n\nBerlin Amtsgericht Berlin (Charlottenburg) HRA 34966\nLöschungsankündigung\n\nSchleicher Electronic GmbH & Co. KG\nKommanditgesellschaft\nBerlin\n\nBei dem nachstehenden Unternehmen / der nachstehenden Gesellschaft wird das Amtslöschungsverfahren gemäß § 31 Abs. 2 HGB eingeleitet. Widerspruchsfrist 1 Monat"
    },
    {
      "date": "2025-12-03",
      "id": "138970",
      "original_text": "Registerbekanntmachung nach dem Umwandlungsgesetz\nBaden-Württemberg Amtsgericht Freiburg HRB 734476\nFIA Immobilien GmbH – Merzhausen",
      "type": "Registerbekanntmachung nach dem Umwandlungsgesetz",
      "state": "Baden-Württemberg",
      "amtsgericht": "Amtsgericht Freiburg",
      "registernummer": "HRB 734476",
      "registerart": "HRB",
      "company_name": "FIA Immobilien GmbH",
      "company_seat": "Merzhausen",
      "details": "03.12.2025 (Bekanntmachungsdatum)\n\nBaden-Württemberg Amtsgericht Freiburg HRB 734476\nRegisterbekanntmachung nach dem Umwandlungsgesetz 03.12.2025 (Eintragungsdatum)\n\nFIA Immobilien GmbH\nGesellschaft mit beschränkter Haftung\nMerzhausen\n\nDen Gläubigern der an der Ausgliederung beteiligten Rechtsträger ist, wenn sie binnen sechs Monaten nach dem Tag, an dem die Eintragung der Ausgliederung in das Register des Sitzes desjenigen Rechtsträgers, dessen Gläubiger sie sind, nach § 19 Abs. 3 UmwG als bekanntgemacht gilt, ihren Anspruch nach Grund und Höhe schriftlich anmelden, Sicherheit zu leisten, soweit sie nicht Befriedigung verlangen können. Dieses Recht steht den Gläubigern jedoch nur zu, wenn sie glaubhaft machen, dass durch die Ausgliederung die Erfüllung ihrer Forderung gefährdet wird."
    },
    {
      "date": "2025-12-03",
      "id": "138971",
      "original_text": "Einreichung neuer Dokumente\nBerlin Amtsgericht Berlin (Charlottenburg) HRB 162426\nICE International Copyright Enterprise Germany GmbH – Berlin",
      "type": "Einreichung neuer Dokumente",
      "state": "Berlin",
      "amtsgericht": "Amtsgericht Berlin (Charlottenburg)",
      "registernummer": "HRB 162426",
      "registerart": "HRB",
      "company_name": "ICE International Copyright Enterprise Germany GmbH",
      "company_seat": "Berlin",
      "details": "03.12.2025 (Bekanntmachungsdatum)\n\nBerlin Amtsgericht Berlin (Charlottenburg) HRB 162426\nEinreichung neuer Dokumente\n\nICE International Copyright Enterprise Germany GmbH\nGesellschaft mit beschränkter Haftung\nBerlin\n\nAls nicht eingetragen wird veröffentlicht: Es wurde eine neue Liste der Aufsichtsratsmitglieder eingereicht (§ 52 III GmbHG)."
    },
    {
      "date": "2025-12-03",
      "id": "138972",
      "original_text": "Registerbekanntmachung nach dem Umwandlungsgesetz\nSchleswig-Holstein Amtsgericht Kiel HRB 18025\nBreedijk Real Estate GmbH – Plön",
      "type": "Registerbekanntmachung nach dem Umwandlungsgesetz",
      "state": "Schleswig-Holstein",
      "amtsgericht": "Amtsgericht Kiel",
      "registernummer": "HRB 18025",
      "registerart": "HRB",
      "company_name": "Breedijk Real Estate GmbH",
      "company_seat": "Plön",
      "details": "03.12.2025 (Bekanntmachungsdatum)\n\nSchleswig-Holstein Amtsgericht Kiel HRB 18025\nRegisterbekanntmachung nach dem Umwandlungsgesetz 28.11.2025 (Eintragungsdatum)\n\nBreedijk Real Estate GmbH\nGesellschaft mit beschränkter Haftung\nPlön\n\nZu Eintragungsnummer 5 vom 28.11.2025 wird als nicht eingetragen veröffentlicht: Den Gläubigern der an der Verschmelzung beteiligten Rechtsträger ist, wenn sie binnen sechs Monaten nach dem Tag, an dem die Eintragung der Verschmelzung in das Register des Sitzes desjenigen Rechtsträgers, dessen Gläubiger sie sind, nach § 19 Abs. 3 UmwG bekannt gemacht worden ist, ihren Anspruch nach Grund und Höhe schriftlich anmelden, Sicherheit zu leisten, soweit sie nicht Befriedigung verlangen können. Dieses Recht steht den Gläubigern jedoch nur zu, wenn sie glaubhaft machen, dass durch die Verschmelzung die Erfüllung ihrer Forderung gefährdet wird."
    },
    {
      "date": "2025-12-03",
      "id": "138973",
      "original_text": "Registerbekanntmachung nach dem Umwandlungsgesetz\nBerlin Amtsgericht Berlin (Charlottenburg) HRA 63998\nMANOR UG (haftungsbeschränkt) & Co. KG – Berlin",
      "type": "Registerbekanntmachung nach dem Umwandlungsgesetz",
      "state": "Berlin",
      "amtsgericht": "Amtsgericht Berlin (Charlottenburg)",
      "registernummer": "HRA 63998",
      "registerart": "HRA",
      "company_name": "MANOR UG (haftungsbeschränkt) & Co. KG",
      "company_seat": "Berlin",
      "details": "03.12.2025 (Bekanntmachungsdatum)\n\nBerlin Amtsgericht Berlin (Charlottenburg) HRA 63998\nRegisterbekanntmachung nach dem Umwandlungsgesetz 02.12.2025 (Eintragungsdatum)\n\nMANOR UG (haftungsbeschränkt) & Co. KG\nKommanditgesellschaft\nBerlin\n\nZu Eintragungsnummer 4 vom 02.12.2025 wird als nicht eingetragen veröffentlicht:\nDen Gläubigern der an der Verschmelzung beteiligten Rechtsträger ist, wenn sie binnen sechs Monaten nach dem Tag, an dem die Eintragung der Verschmelzung in das Register des Sitzes desjenigen Rechtsträgers, dessen Gläubiger sie sind, als bekannt gemacht gilt, ihren Anspruch nach Grund und Höhe schriftlich anmelden, Sicherheit zu leisten, soweit sie nicht Befriedigung verlangen können. Dieses Recht steht den Gläubigern jedoch nur zu, wenn sie glaubhaft machen, dass durch die Verschmelzung die Erfüllung ihrer Forderung gefährdet wird. Das Recht, Sicherheitsleistung zu verlangen, steht Gläubigern nicht zu, die im Falle der Insolvenz ein Recht auf vorzugsweise Befriedigung aus einer Deckungsmasse haben, die nach gesetzlicher Vorschrift zu ihrem Schutz errichtet und staatlich überwacht ist."
    },
    {
      "date": "2025-12-03",
      "id": "138974",
      "original_text": "Registerbekanntmachung nach dem Umwandlungsgesetz\nBerlin Amtsgericht Berlin (Charlottenburg) HRB 210898\nReal KW SS2 GmbH – Berlin",
      "type": "Registerbekanntmachung nach dem Umwandlungsgesetz",
      "state": "Berlin",
      "amtsgericht": "Amtsgericht Berlin (Charlottenburg)",
      "registernummer": "HRB 210898",
      "registerart": "HRB",
      "company_name": "Real KW SS2 GmbH",
      "company_seat": "Berlin",
      "details": "03.12.2025 (Bekanntmachungsdatum)\n\nBerlin Amtsgericht Berlin (Charlottenburg) HRB 210898\nRegisterbekanntmachung nach dem Umwandlungsgesetz 02.12.2025 (Eintragungsdatum)\n\nReal KW SS2 GmbH\nGesellschaft mit beschränkter Haftung\nBerlin\n\nZu Eintragungsnummer 5 vom 02.12.2025 wird als nicht eingetragen veröffentlicht:\nDen Gläubigern der an der Verschmelzung beteiligten Rechtsträger ist, wenn sie binnen sechs Monaten nach dem Tag, an dem die Eintragung der Verschmelzung in das Register des Sitzes desjenigen Rechtsträgers, dessen Gläubiger sie sind, als bekannt gemacht gilt, ihren Anspruch nach Grund und Höhe schriftlich anmelden, Sicherheit zu leisten, soweit sie nicht Befriedigung verlangen können. Dieses Recht steht den Gläubigern jedoch nur zu, wenn sie glaubhaft machen, dass durch die Verschmelzung die Erfüllung ihrer Forderung gefährdet wird. Das Recht, Sicherheitsleistung zu verlangen, steht Gläubigern nicht zu, die im Falle der Insolvenz ein Recht auf vorzugsweise Befriedigung aus einer Deckungsmasse haben, die nach gesetzlicher Vorschrift zu ihrem Schutz errichtet und staatlich überwacht ist."
    },
    {
      "date": "2025-12-03",
      "id": "138975",
      "original_text": "Registerbekanntmachung nach dem Umwandlungsgesetz\nBerlin Amtsgericht Berlin (Charlottenburg) HRB 210898\nReal KW SS2 GmbH – Berlin",
      "type": "Registerbekanntmachung nach dem Umwandlungsgesetz",
      "state": "Berlin",
      "amtsgericht": "Amtsgericht Berlin (Charlottenburg)",
      "registernummer": "HRB 210898",
      "registerart": "HRB",
      "company_name": "Real KW SS2 GmbH",
      "company_seat": "Berlin",
      "details": "03.12.2025 (Bekanntmachungsdatum)\n\nBerlin Amtsgericht Berlin (Charlottenburg) HRB 210898\nRegisterbekanntmachung nach dem Umwandlungsgesetz 02.12.2025 (Eintragungsdatum)\n\nReal KW SS2 GmbH\nGesellschaft mit beschränkter Haftung\nBerlin\n\nZu Eintragungsnummer 6 vom 02.12.2025 wird als nicht eingetragen veröffentlicht:\nDer andere Vertragsteil hat den Gläubigern dieses Rechtsträgers, deren Forderungen begründet worden sind, bevor die Eintragung der Beendigung dieses Vertrages in das Handelsregister nach § 10 des Handelsgesetzbuches als bekannt gemacht gilt, Sicherheit zu leisten, wenn sie sich binnen sechs Monaten nach der Bekanntmachung der Eintragung zu diesem Zweck bei ihm melden. Dieses Recht steht den Gläubigern nicht zu, die im Fall des Insolvenzverfahrens ein Recht auf vorzugsweise Befriedigung aus der Deckungsmasse haben, die nach gesetzlicher Vorschrift zu ihrem Schutz errichtet und staatlich überwacht ist."
    },
    {
      "date": "2025-12-03",
      "id": "138976",
      "original_text": "Registerbekanntmachung nach dem Umwandlungsgesetz\nBaden-Württemberg Amtsgericht Ulm HRB 740710\nDDOXX GmbH – Berghülen",
      "type": "Registerbekanntmachung nach dem Umwandlungsgesetz",
      "state": "Baden-Württemberg",
      "amtsgericht": "Amtsgericht Ulm",
      "registernummer": "HRB 740710",
      "registerart": "HRB",
      "company_name": "DDOXX GmbH",
      "company_seat": "Berghülen",
      "details": "03.12.2025 (Bekanntmachungsdatum)\n\nBaden-Württemberg Amtsgericht Ulm HRB 740710\nRegisterbekanntmachung nach dem Umwandlungsgesetz 03.12.2025 (Eintragungsdatum)\n\nDDOXX GmbH\nGesellschaft mit beschränkter Haftung\nBerghülen\n\nAls nicht eingetragen wird bekanntgemacht:\nDen Gläubigern der an der Verschmelzung beteiligten Rechtsträger ist, wenn sie binnen sechs Monaten nach dem Tag, an dem die Eintragung der Verschmelzung in das Register des Sitzes desjenigen Rechtsträgers, dessen Gläubiger sie sind, nach § 19 Abs. 3 UmwG als bekanntgemacht gilt, ihren Anspruch nach Grund und Höhe schriftlich anmelden, Sicherheit zu leisten, soweit sie nicht Befriedigung verlangen können. Dieses Recht steht den Gläubigern jedoch nur zu, wenn sie glaubhaft machen, dass durch die Verschmelzung die Erfüllung ihrer Forderung gefährdet wird."
    },
    {
      "date": "2025-12-03",
      "id": "138977",
      "original_text": "Löschungsankündigung\nSaarland Amtsgericht Saarbrücken HRB 103386\nBTN Solutions Services GmbH – Saarbrücken",
      "type": "Löschungsankündigung",
      "state": "Saarland",
      "amtsgericht": "Amtsgericht Saarbrücken",
      "registernummer": "HRB 103386",
      "registerart": "HRB",
      "company_name": "BTN Solutions Services GmbH",
      "company_seat": "Saarbrücken",
      "details": "03.12.2025 (Bekanntmachungsdatum)\n\nSaarland Amtsgericht Saarbrücken HRB 103386\nLöschungsankündigung\n\nBTN Solutions Services GmbH\nGesellschaft mit beschränkter Haftung\nSaarbrücken\n\nEs ist beabsichtigt, die Gesellschaft von Amts wegen gemäß § 394 FamFG wegen Vermögenslosigkeit zu löschen.\nGegen die Löschung von Amts wegen ist das Rechtsmittel des Widerspruchs statthaft. Der Widerspruch ist binnen einer Frist zwei Monaten beginnend mit dem Tag dieser Veröffentlichung durch Einreichen eines Widerspruchsschreibens -schriftlich oder zur Niederschrift der Geschäftsstelle beim Amtsgericht Saarbrücken, -zentrales Handelsregister-, Mainzerstr.178, 66121 Saarbrücken einzulegen.\nDer Widerspruch muss die Bezeichnung der angefochtenen Löschungsankündigung enthalten sowie die Erklärung, dass Widerspruch eingelegt wird. Er ist vom Widerspruchsführer oder seinem Bevollmächtigten zu unterzeichnen.\nDas Widerspruchsschreiben kann auch in der Form eines elektronischen Dokumentes eingereicht werden, das mit einer qualifizierten elektronischen Signatur nach dem Signaturgesetz versehen sein muss (§§ 14 Abs. 2 FamFG, 130a, 298 ZPO)."
    },
    {
      "date": "2025-12-03",
      "id": "138978",
      "original_text": "Registerbekanntmachung nach dem Umwandlungsgesetz\nBaden-Württemberg Amtsgericht Freiburg HRB 713253\nFIA Holding GmbH – Merzhausen",
      "type": "Registerbekanntmachung nach dem Umwandlungsgesetz",
      "state": "Baden-Württemberg",
      "amtsgericht": "Amtsgericht Freiburg",
      "registernummer": "HRB 713253",
      "registerart": "HRB",
      "company_name": "FIA Holding GmbH",
      "company_seat": "Merzhausen",
      "details": "03.12.2025 (Bekanntmachungsdatum)\n\nBaden-Württemberg Amtsgericht Freiburg HRB 713253\nRegisterbekanntmachung nach dem Umwandlungsgesetz 03.12.2025 (Eintragungsdatum)\n\nFIA Holding GmbH\nGesellschaft mit beschränkter Haftung\nMerzhausen\n\nDen Gläubigern der an der Ausgliederung beteiligten Rechtsträger ist, wenn sie binnen sechs Monaten nach dem Tag, an dem die Eintragung der Ausgliederung in das Register des Sitzes desjenigen Rechtsträgers, dessen Gläubiger sie sind, nach § 19 Abs. 3 UmwG als bekanntgemacht gilt, ihren Anspruch nach Grund und Höhe schriftlich anmelden, Sicherheit zu leisten, soweit sie nicht Befriedigung verlangen können. Dieses Recht steht den Gläubigern jedoch nur zu, wenn sie glaubhaft machen, dass durch die Ausgliederung die Erfüllung ihrer Forderung gefährdet wird."
    },
    {
      "date": "2025-12-03",
      "id": "138979",
      "original_text": "Einreichung neuer Dokumente\nSachsen-Anhalt Amtsgericht Stendal HRB 115211\nSHP Steriltechnik AG – Haldensleben",
      "type": "Einreichung neuer Dokumente",
      "state": "Sachsen-Anhalt",
      "amtsgericht": "Amtsgericht Stendal",
      "registernummer": "HRB 115211",
      "registerart": "HRB",
      "company_name": "SHP Steriltechnik AG",
      "company_seat": "Haldensleben",
      "details": "03.12.2025 (Bekanntmachungsdatum)\n\nSachsen-Anhalt Amtsgericht Stendal HRB 115211\nEinreichung neuer Dokumente\n\nSHP Steriltechnik AG\nAktiengesellschaft\nHaldensleben\n\nEine Liste der Mitglieder des Aufsichtsrates wurde zum Handelsregister eingereicht."
    },
    {
      "date": "2025-12-03",
      "id": "138980",
      "original_text": "Löschungsankündigung\nBaden-Württemberg Amtsgericht Freiburg HRB 725908\nBlackBoxX Holding UG (haftungsbeschränkt) – Lörrach",
      "type": "Löschungsankündigung",
      "state": "Baden-Württemberg",
      "amtsgericht": "Amtsgericht Freiburg",
      "registernummer": "HRB 725908",
      "registerart": "HRB",
      "company_name": "BlackBoxX Holding UG (haftungsbeschränkt)",
      "company_seat": "Lörrach",
      "details": "03.12.2025 (Bekanntmachungsdatum)\n\nBaden-Württemberg Amtsgericht Freiburg HRB 725908\nLöschungsankündigung 03.12.2025 (Eintragungsdatum)\n\nBlackBoxX Holding UG (haftungsbeschränkt)\nGesellschaft mit beschränkter Haftung\nLörrach\n\nAls nicht eingetragen wird bekanntgemacht:\nDas Gericht beabsichtigt, die Gesellschaft wegen Vermögenslosigkeit im Handelsregister von Amts wegen nach § 394 FamFG zu löschen. Die Frist zur Geltendmachung eines Widerspruchs gegen die beabsichtigte Löschung ist auf einen Monat ab Veröffentlichung bestimmt."
    },
    {
      "date": "2025-12-03",
      "id": "138981",
      "original_text": "Einreichung neuer Dokumente\nBaden-Württemberg Amtsgericht Mannheim HRB 706917\nBaden-Baden Award GmbH – Baden-Baden",
      "type": "Einreichung neuer Dokumente",
      "state": "Baden-Württemberg",
      "amtsgericht": "Amtsgericht Mannheim",
      "registernummer": "HRB 706917",
      "registerart": "HRB",
      "company_name": "Baden-Baden Award GmbH",
      "company_seat": "Baden-Baden",
      "details": "03.12.2025 (Bekanntmachungsdatum)\n\nBaden-Württemberg Amtsgericht Mannheim HRB 706917\nEinreichung neuer Dokumente\n\nBaden-Baden Award GmbH\nGesellschaft mit beschränkter Haftung\nBaden-Baden\n\nDie Gesellschaft hat am 28.11.2025 die Liste über die Zusammensetzung des Aufsichtsrats zum Handelsregister eingereicht."
    },
    {
      "date": "2025-12-03",
      "id": "138982",
      "original_text": "Löschungsankündigung\nBrandenburg Amtsgericht Frankfurt/Oder HRB 16628\nGTC Trade GmbH – Frankfurt (Oder)",
      "type": "Löschungsankündigung",
      "state": "Brandenburg",
      "amtsgericht": "Amtsgericht Frankfurt/Oder",
      "registernummer": "HRB 16628",
      "registerart": "HRB",
      "company_name": "GTC Trade GmbH",
      "company_seat": "Frankfurt (Oder)",
      "details": "03.12.2025 (Bekanntmachungsdatum)\n\nBrandenburg Amtsgericht Frankfurt/Oder HRB 16628\nLöschungsankündigung\n\nGTC Trade GmbH\nGesellschaft mit beschränkter Haftung\nFrankfurt (Oder)\n\nBei der nachstehenden Gesellschaft wird das Amtslöschungsverfahren gemäß § 394 FamFG eingeleitet."
    },
    {
      "date": "2025-12-03",
      "id": "138983",
      "original_text": "Löschungsankündigung\nBaden-Württemberg Amtsgericht Freiburg HRB 580832\nNiels von Eisenhart Rothe - Top Executive Training GmbH – Meersburg",
      "type": "Löschungsankündigung",
      "state": "Baden-Württemberg",
      "amtsgericht": "Amtsgericht Freiburg",
      "registernummer": "HRB 580832",
      "registerart": "HRB",
      "company_name": "Niels von Eisenhart Rothe - Top Executive Training GmbH",
      "company_seat": "Meersburg",
      "details": "03.12.2025 (Bekanntmachungsdatum)\n\nBaden-Württemberg Amtsgericht Freiburg HRB 580832\nLöschungsankündigung\n\nNiels von Eisenhart Rothe - Top Executive Training GmbH\nGesellschaft mit beschränkter Haftung\nMeersburg\n\nDas Gericht beabsichtigt, die Gesellschaft wegen Vermögenslosigkeit im Handelsregister von Amts wegen nach § 394 FamFG zu löschen. Die Frist zur Geltendmachung eines Widerspruchs gegen die beabsichtigte Löschung ist auf einen Monat ab Veröffentlichung bestimmt."
    },
    {
      "date": "2025-12-03",
      "id": "138984",
      "original_text": "Registerbekanntmachung nach dem Umwandlungsgesetz\nBaden-Württemberg Amtsgericht Freiburg HRB 724807\nGeba Breisgau GmbH – Herrischried",
      "type": "Registerbekanntmachung nach dem Umwandlungsgesetz",
      "state": "Baden-Württemberg",
      "amtsgericht": "Amtsgericht Freiburg",
      "registernummer": "HRB 724807",
      "registerart": "HRB",
      "company_name": "Geba Breisgau GmbH",
      "company_seat": "Herrischried",
      "details": "03.12.2025 (Bekanntmachungsdatum)\n\nBaden-Württemberg Amtsgericht Freiburg HRB 724807\nRegisterbekanntmachung nach dem Umwandlungsgesetz 03.12.2025 (Eintragungsdatum)\n\nGeba Breisgau GmbH\nGesellschaft mit beschränkter Haftung\nHerrischried\n\nDie Gesellschaft ist zur Aufnahme auf die \"GeBa Wärme GmbH\" (Amtsgericht Freiburg, HRB 717458) gem Verschmelzungsvertrag vom 04.11.2025 verschmolzen. Den Gläubigern der an der Verschmelzung beteiligten Rechtsträger ist, wenn sie binnen sechs Monaten nach dem Tag, an dem die Eintragung der Verschmelzung in das Register des Sitzes desjenigen Rechtsträgers, dessen Gläubiger sie sind, nach § 19 Abs. 3 UmwG als bekanntgemacht gilt, ihren Anspruch nach Grund und Höhe schriftlich anmelden, Sicherheit zu leisten, soweit sie nicht Befriedigung verlangen können. Dieses Recht steht den Gläubigern jedoch nur zu, wenn sie glaubhaft machen, dass durch die Verschmelzung die Erfüllung ihrer Forderung gefährdet wird."
    },
    {
      "date": "2025-12-03",
      "id": "138985",
      "original_text": "Registerbekanntmachung nach dem Umwandlungsgesetz\nBaden-Württemberg Amtsgericht Freiburg HRB 717458\nGeBa Wärme GmbH – Herrischried",
      "type": "Registerbekanntmachung nach dem Umwandlungsgesetz",
      "state": "Baden-Württemberg",
      "amtsgericht": "Amtsgericht Freiburg",
      "registernummer": "HRB 717458",
      "registerart": "HRB",
      "company_name": "GeBa Wärme GmbH",
      "company_seat": "Herrischried",
      "details": "03.12.2025 (Bekanntmachungsdatum)\n\nBaden-Württemberg Amtsgericht Freiburg HRB 717458\nRegisterbekanntmachung nach dem Umwandlungsgesetz 03.12.2025 (Eintragungsdatum)\n\nGeBa Wärme GmbH\nGesellschaft mit beschränkter Haftung\nHerrischried\n\nDie \"Geba Breisgau GmbH\" (Amtsgericht Freiburg, HRB 724807) ist mit dieser Gesellschaft zur Aufnahme verschmolzen. Den Gläubigern der an der Verschmelzung beteiligten Rechtsträger ist, wenn sie binnen sechs Monaten nach dem Tag, an dem die Eintragung der Verschmelzung in das Register des Sitzes desjenigen Rechtsträgers, dessen Gläubiger sie sind, nach § 19 Abs. 3 UmwG als bekanntgemacht gilt, ihren Anspruch nach Grund und Höhe schriftlich anmelden, Sicherheit zu leisten, soweit sie nicht Befriedigung verlangen können. Dieses Recht steht den Gläubigern jedoch nur zu, wenn sie glaubhaft machen, dass durch die Verschmelzung die Erfüllung ihrer Forderung gefährdet wird."
    },
    {
      "date": "2025-12-03",
      "id": "138986",
      "original_text": "Löschungsankündigung\nBerlin Amtsgericht Berlin (Charlottenburg) HRB 209353\nZAMBAK GmbH – Berlin",
      "type": "Löschungsankündigung",
      "state": "Berlin",
      "amtsgericht": "Amtsgericht Berlin (Charlottenburg)",
      "registernummer": "HRB 209353",
      "registerart": "HRB",
      "company_name": "ZAMBAK GmbH",
      "company_seat": "Berlin",
      "details": "03.12.2025 (Bekanntmachungsdatum)\n\nBerlin Amtsgericht Berlin (Charlottenburg) HRB 209353\nLöschungsankündigung\n\nZAMBAK GmbH\nGesellschaft mit beschränkter Haftung\nBerlin\n\nBei der nachstehenden Gesellschaft wird das Amtslöschungsverfahren gemäß § 394 FamFG eingeleitet. Widerspruchsfrist 6 Wochen"
    },
    {
      "date": "2025-12-03",
      "id": "138987",
      "original_text": "Einreichung neuer Dokumente\nSchleswig-Holstein Amtsgericht Kiel HRB 6960\nTKMS GmbH – Kiel",
      "type": "Einreichung neuer Dokumente",
      "state": "Schleswig-Holstein",
      "amtsgericht": "Amtsgericht Kiel",
      "registernummer": "HRB 6960",
      "registerart": "HRB",
      "company_name": "TKMS GmbH",
      "company_seat": "Kiel",
      "details": "03.12.2025 (Bekanntmachungsdatum)\n\nSchleswig-Holstein Amtsgericht Kiel HRB 6960\nEinreichung neuer Dokumente\n\nTKMS GmbH\nGesellschaft mit beschränkter Haftung\nKiel\n\nEine neue Liste der Aufsichtsratsmitglieder ist eingereicht worden."
    },
    {
      "date": "2025-12-03",
      "id": "138988",
      "original_text": "Löschungsankündigung\nBerlin Amtsgericht Berlin (Charlottenburg) HRB 236068\nEMT Hochbau GmbH – Berlin",
      "type": "Löschungsankündigung",
      "state": "Berlin",
      "amtsgericht": "Amtsgericht Berlin (Charlottenburg)",
      "registernummer": "HRB 236068",
      "registerart": "HRB",
      "company_name": "EMT Hochbau GmbH",
      "company_seat": "Berlin",
      "details": "03.12.2025 (Bekanntmachungsdatum)\n\nBerlin Amtsgericht Berlin (Charlottenburg) HRB 236068\nLöschungsankündigung\n\nEMT Hochbau GmbH\nGesellschaft mit beschränkter Haftung\nBerlin\n\nEs ist beabsichtigt, die am 24.10.2025 erfolgte Eintragung der geänderten Geschäftsanschrift wegen des Mangels einer wesentlichen Voraussetzung von Amts wegen nach § 395 FamFG zu löschen. Widerspruchsfrist: 3 Wochen."
    },
    {
      "date": "2025-12-03",
      "id": "138989",
      "original_text": "Einreichung neuer Dokumente\nBaden-Württemberg Amtsgericht Mannheim HRB 703091\nTIB Chemicals AG – Mannheim",
      "type": "Einreichung neuer Dokumente",
      "state": "Baden-Württemberg",
      "amtsgericht": "Amtsgericht Mannheim",
      "registernummer": "HRB 703091",
      "registerart": "HRB",
      "company_name": "TIB Chemicals AG",
      "company_seat": "Mannheim",
      "details": "03.12.2025 (Bekanntmachungsdatum)\n\nBaden-Württemberg Amtsgericht Mannheim HRB 703091\nEinreichung neuer Dokumente\n\nTIB Chemicals AG\nAktiengesellschaft\nMannheim\n\nDie Gesellschaft hat am 22.10.2025 die Liste über die Zusammensetzung des Aufsichtsrats zum Handelsregister eingereicht."
    },
    {
      "date": "2025-12-03",
      "id": "138990",
      "original_text": "Löschungsankündigung\nSaarland Amtsgericht Saarbrücken HRB 14714\nSKS Transport GmbH – Saarbrücken",
      "type": "Löschungsankündigung",
      "state": "Saarland",
      "amtsgericht": "Amtsgericht Saarbrücken",
      "registernummer": "HRB 14714",
      "registerart": "HRB",
      "company_name": "SKS Transport GmbH",
      "company_seat": "Saarbrücken",
      "details": "03.12.2025 (Bekanntmachungsdatum)\n\nSaarland Amtsgericht Saarbrücken HRB 14714\nLöschungsankündigung\n\nSKS Transport GmbH\nGesellschaft mit beschränkter Haftung\nSaarbrücken\n\nEs ist beabsichtigt, die Gesellschaft von Amts wegen gemäß § 394 FamFG wegen Vermögenslosigkeit zu löschen.\nGegen die Löschung von Amts wegen ist das Rechtsmittel des Widerspruchs statthaft. Der Widerspruch ist binnen einer Frist zwei Monaten beginnend mit dem Tag dieser Veröffentlichung durch Einreichen eines Widerspruchsschreibens -schriftlich oder zur Niederschrift der Geschäftsstelle beim Amtsgericht Saarbrücken, -zentrales Handelsregister-, Mainzer Str.178, 66121 Saarbrücken einzulegen.\nDer Widerspruch muss die Bezeichnung der angefochtenen Löschungsankündigung enthalten sowie die Erklärung, dass Widerspruch eingelegt wird. Er ist vom Widerspruchsführer oder seinem Bevollmächtigten zu unterzeichnen.\nDas Widerspruchsschreiben kann auch in der Form eines elektronischen Dokumentes eingereicht werden, das mit einer qualifizierten elektronischen Signatur nach dem Signaturgesetz versehen sein muss (§§ 14 Abs. 2 FamFG, 130a, 298 ZPO)."
    },
    {
      "date": "2025-12-03",
      "id": "138991",
      "original_text": "Einreichung neuer Dokumente\nBerlin Amtsgericht Berlin (Charlottenburg) HRB 102442\nVitanas Holding GmbH – Berlin",
      "type": "Einreichung neuer Dokumente",
      "state": "Berlin",
      "amtsgericht": "Amtsgericht Berlin (Charlottenburg)",
      "registernummer": "HRB 102442",
      "registerart": "HRB",
      "company_name": "Vitanas Holding GmbH",
      "company_seat": "Berlin",
      "details": "03.12.2025 (Bekanntmachungsdatum)\n\nBerlin Amtsgericht Berlin (Charlottenburg) HRB 102442\nEinreichung neuer Dokumente\n\nVitanas Holding GmbH\nGesellschaft mit beschränkter Haftung\nBerlin\n\nAls nicht eingetragen wird veröffentlicht: Es wurde eine neue Liste der Aufsichtsratsmitglieder eingereicht (§52 GmbHG)."
    },
    {
      "date": "2025-12-03",
      "id": "138992",
      "original_text": "Registerbekanntmachung nach dem Umwandlungsgesetz\nSchleswig-Holstein Amtsgericht Pinneberg HRB 6875\nErnst Günter Albers GmbH – Meldorf",
      "type": "Registerbekanntmachung nach dem Umwandlungsgesetz",
      "state": "Schleswig-Holstein",
      "amtsgericht": "Amtsgericht Pinneberg",
      "registernummer": "HRB 6875",
      "registerart": "HRB",
      "company_name": "Ernst Günter Albers GmbH",
      "company_seat": "Meldorf",
      "details": "03.12.2025 (Bekanntmachungsdatum)\n\nSchleswig-Holstein Amtsgericht Pinneberg HRB 6875\nRegisterbekanntmachung nach dem Umwandlungsgesetz 03.12.2025 (Eintragungsdatum)\n\nErnst Günter Albers GmbH\nGesellschaft mit beschränkter Haftung\nMeldorf\n\nZu Eintragungsnummer 12 vom 03.12.2025 wird als nicht eingetragen veröffentlicht:  Als nicht eingetragen wird veröffentlicht: Den Gläubigern der an der Spaltung beteiligten Rechtsträger ist, wenn sie binnen sechs Monaten nach dem Tag, an dem die Eintragung der Spaltung in das Register des Sitzes desjenigen Rechtsträgers, dessen Gläubiger sie sind, als bekannt gemacht gilt, ihren Anspruch nach Grund und Höhe schriftlich anmelden, Sicherheit zu leisten, soweit sie nicht Befriedigung verlangen können. Dieses Recht steht den Gläubigern jedoch nur zu, wenn sie glaubhaft machen, dass durch die Spaltung die Erfüllung ihrer Forderung gefährdet wird. Das Recht, Sicherheitsleistung zu verlangen, steht Gläubigern nicht zu, die im Falle der Insolvenz ein Recht auf vorzugsweise Befriedigung aus einer Deckungsmasse haben, die nach gesetzlicher Vorschrift zu ihrem Schutz errichtet und staatlich überwacht ist."
    },
    {
      "date": "2025-12-03",
      "id": "138993",
      "original_text": "Registerbekanntmachung nach dem Umwandlungsgesetz\nBerlin Amtsgericht Berlin (Charlottenburg) HRB 230153\nVOQUZ Labs Aktiengesellschaft – Berlin",
      "type": "Registerbekanntmachung nach dem Umwandlungsgesetz",
      "state": "Berlin",
      "amtsgericht": "Amtsgericht Berlin (Charlottenburg)",
      "registernummer": "HRB 230153",
      "registerart": "HRB",
      "company_name": "VOQUZ Labs Aktiengesellschaft",
      "company_seat": "Berlin",
      "details": "03.12.2025 (Bekanntmachungsdatum)\n\nBerlin Amtsgericht Berlin (Charlottenburg) HRB 230153\nRegisterbekanntmachung nach dem Umwandlungsgesetz 27.11.2025 (Eintragungsdatum)\n\nVOQUZ Labs Aktiengesellschaft\nAktiengesellschaft\nBerlin\n\nZu Eintragungsnummer 10 vom 27.11.2025 wird als nicht eingetragen veröffentlicht: Den Gläubigern ist, wenn sie binnen sechs Monaten nach dem Tag, an dem die Eintragung der Umwandlung als bekannt gemacht gilt, ihren Anspruch nach Grund und Höhe schriftlich anmelden, Sicherheit zu leisten, soweit sie nicht Befriedigung verlangen können. Dieses Recht steht den Gläubigern jedoch nur zu, wenn sie glaubhaft machen, dass durch die Umwandlung die Erfüllung ihrer Forderung gefährdet wird. Das Recht, Sicherheitsleistung zu verlangen, steht Gläubigern nicht zu, die im Falle der Insolvenz ein Recht auf vorzugsweise Befriedigung aus einer Deckungsmasse haben, die nach gesetzlicher Vorschrift zu ihrem Schutz errichtet und staatlich überwacht ist."
    },
    {
      "date": "2025-12-03",
      "id": "138994",
      "original_text": "Registerbekanntmachung nach dem Umwandlungsgesetz\nBerlin Amtsgericht Berlin (Charlottenburg) HRB 230153\nVOQUZ Labs Aktiengesellschaft – Berlin",
      "type": "Registerbekanntmachung nach dem Umwandlungsgesetz",
      "state": "Berlin",
      "amtsgericht": "Amtsgericht Berlin (Charlottenburg)",
      "registernummer": "HRB 230153",
      "registerart": "HRB",
      "company_name": "VOQUZ Labs Aktiengesellschaft",
      "company_seat": "Berlin",
      "details": "03.12.2025 (Bekanntmachungsdatum)\n\nBerlin Amtsgericht Berlin (Charlottenburg) HRB 230153\nRegisterbekanntmachung nach dem Umwandlungsgesetz 28.11.2025 (Eintragungsdatum)\n\nVOQUZ Labs Aktiengesellschaft\nAktiengesellschaft\nBerlin\n\nZu Eintragungsnummer 11 vom 28.11.2025 wird als nicht eingetragen veröffentlicht: Den Gläubigern ist, wenn sie binnen sechs Monaten nach dem Tag, an dem die Eintragung der Umwandlung als bekannt gemacht gilt, ihren Anspruch nach Grund und Höhe schriftlich anmelden, Sicherheit zu leisten, soweit sie nicht Befriedigung verlangen können. Dieses Recht steht den Gläubigern jedoch nur zu, wenn sie glaubhaft machen, dass durch die Umwandlung die Erfüllung ihrer Forderung gefährdet wird. Das Recht, Sicherheitsleistung zu verlangen, steht Gläubigern nicht zu, die im Falle der Insolvenz ein Recht auf vorzugsweise Befriedigung aus einer Deckungsmasse haben, die nach gesetzlicher Vorschrift zu ihrem Schutz errichtet und staatlich überwacht ist."
    },
    {
      "date": "2025-12-03",
      "id": "138995",
      "original_text": "Löschungsankündigung\nBaden-Württemberg Amtsgericht Mannheim HRB 754974\nQQ Handels GmbH – Heidelberg",
      "type": "Löschungsankündigung",
      "state": "Baden-Württemberg",
      "amtsgericht": "Amtsgericht Mannheim",
      "registernummer": "HRB 754974",
      "registerart": "HRB",
      "company_name": "QQ Handels GmbH",
      "company_seat": "Heidelberg",
      "details": "03.12.2025 (Bekanntmachungsdatum)\n\nBaden-Württemberg Amtsgericht Mannheim HRB 754974\nLöschungsankündigung\n\nQQ Handels GmbH\nGesellschaft mit beschränkter Haftung\nHeidelberg\n\nDas Gericht beabsichtigt, die Eintragung der Gesellschaft im Handelsregister wegen des Mangels einer wesentlichen Voraussetzung von Amts wegen nach § 395 FamFG als unzulässig zu löschen. Die Frist zur Geltendmachung eines Widerspruchs gegen die beabsichtigte Löschung ist auf einen Monat ab Veröffentlichung bestimmt."
    },
    {
      "date": "2025-12-03",
      "id": "138996",
      "original_text": "Löschungsankündigung\nBerlin Amtsgericht Berlin (Charlottenburg) HRB 253491\nBACRO Fenster GmbH – Berlin",
      "type": "Löschungsankündigung",
      "state": "Berlin",
      "amtsgericht": "Amtsgericht Berlin (Charlottenburg)",
      "registernummer": "HRB 253491",
      "registerart": "HRB",
      "company_name": "BACRO Fenster GmbH",
      "company_seat": "Berlin",
      "details": "03.12.2025 (Bekanntmachungsdatum)\n\nBerlin Amtsgericht Berlin (Charlottenburg) HRB 253491\nLöschungsankündigung\n\nBACRO Fenster GmbH\nGesellschaft mit beschränkter Haftung\nBerlin\n\nBei der nachstehenden Gesellschaft wird das Amtslöschungsverfahren gemäß § 394 FamFG eingeleitet. Widerspruchsfrist 6 Wochen"
    },
    {
      "date": "2025-12-03",
      "id": "138997",
      "original_text": "Löschungsankündigung\nBerlin Amtsgericht Berlin (Charlottenburg) HRB 191647\nCongion Consulting GmbH – Berlin",
      "type": "Löschungsankündigung",
      "state": "Berlin",
      "amtsgericht": "Amtsgericht Berlin (Charlottenburg)",
      "registernummer": "HRB 191647",
      "registerart": "HRB",
      "company_name": "Congion Consulting GmbH",
      "company_seat": "Berlin",
      "details": "03.12.2025 (Bekanntmachungsdatum)\n\nBerlin Amtsgericht Berlin (Charlottenburg) HRB 191647\nLöschungsankündigung\n\nCongion Consulting GmbH\nGesellschaft mit beschränkter Haftung\nBerlin\n\nBei der nachstehenden Gesellschaft wird das Amtslöschungsverfahren gemäß § 394 FamFG eingeleitet. Widerspruchsfrist 6 Wochen"
    },
    {
      "date": "2025-12-03",
      "id": "138998",
      "original_text": "Registerbekanntmachung nach dem Umwandlungsgesetz\nMecklenburg-Vorpommern Amtsgericht Stralsund HRB 22665\nECHT Gastro Partner Regio GmbH – Stralsund",
      "type": "Registerbekanntmachung nach dem Umwandlungsgesetz",
      "state": "Mecklenburg-Vorpommern",
      "amtsgericht": "Amtsgericht Stralsund",
      "registernummer": "HRB 22665",
      "registerart": "HRB",
      "company_name": "ECHT Gastro Partner Regio GmbH",
      "company_seat": "Stralsund",
      "details": "03.12.2025 (Bekanntmachungsdatum)\n\nMecklenburg-Vorpommern Amtsgericht Stralsund HRB 22665\nRegisterbekanntmachung nach dem Umwandlungsgesetz 03.12.2025 (Eintragungsdatum)\n\nECHT Gastro Partner Regio GmbH\nGesellschaft mit beschränkter Haftung\nStralsund\n\nAls nicht eingetragen wird veröffentlicht: Den Gläubigern der an der Verschmelzung beteiligten Rechtsträger ist, wenn sie binnen sechs Monaten nach dem Tag, an dem die Eintragung der Verschmelzung in das Register des Sitzes desjenigen Rechtsträgers, dessen Gläubiger sie sind, nach § 19 Abs. 3 UmwG als bekannt gemacht gilt,\nihren Anspruch nach Grund und Höhe in Textform anmelden, Sicherheit zu leisten, soweit sie nicht Befriedigung verlangen können. Dieses Recht steht den Gläubigern jedoch nur zu, wenn sie glaubhaft machen, dass durch die Verschmelzung die Erfüllung der Forderung gefährdet wird."
    },
    {
      "date": "2025-12-03",
      "id": "138999",
      "original_text": "Registerbekanntmachung nach dem Umwandlungsgesetz\nBerlin Amtsgericht Berlin (Charlottenburg) HRB 233599\nSyntax GmbH für Aus- und Weiterbildung – Berlin",
      "type": "Registerbekanntmachung nach dem Umwandlungsgesetz",
      "state": "Berlin",
      "amtsgericht": "Amtsgericht Berlin (Charlottenburg)",
      "registernummer": "HRB 233599",
      "registerart": "HRB",
      "company_name": "Syntax GmbH für Aus- und Weiterbildung",
      "company_seat": "Berlin",
      "details": "03.12.2025 (Bekanntmachungsdatum)\n\nBerlin Amtsgericht Berlin (Charlottenburg) HRB 233599\nRegisterbekanntmachung nach dem Umwandlungsgesetz 02.12.2025 (Eintragungsdatum)\n\nSyntax GmbH für Aus- und Weiterbildung\nGesellschaft mit beschränkter Haftung\nBerlin\n\nZu Eintragungsnummer 8 vom 02.12.2025 wird als nicht eingetragen veröffentlicht: Den Gläubigern der an der Verschmelzung beteiligten Rechtsträger ist, wenn sie binnen sechs Monaten nach dem Tag, an dem die Eintragung der Verschmelzung in das Register des Sitzes desjenigen Rechtsträgers, dessen Gläubiger sie sind, als bekannt gemacht gilt, ihren Anspruch nach Grund und Höhe schriftlich anmelden, Sicherheit zu leisten, soweit sie nicht Befriedigung verlangen können. Dieses Recht steht den Gläubigern jedoch nur zu, wenn sie glaubhaft machen, dass durch die Verschmelzung die Erfüllung ihrer Forderung gefährdet wird. Das Recht, Sicherheitsleistung zu verlangen, steht Gläubigern nicht zu, die im Falle der Insolvenz ein Recht auf vorzugsweise Befriedigung aus einer Deckungsmasse haben, die nach gesetzlicher Vorschrift zu ihrem Schutz errichtet und staatlich überwacht ist."
    },
    {
      "date": "2025-12-03",
      "id": "139000",
      "original_text": "Registerbekanntmachung nach dem Umwandlungsgesetz\nBerlin Amtsgericht Berlin (Charlottenburg) HRB 124695\nRAW Value 3 GmbH – Berlin",
      "type": "Registerbekanntmachung nach dem Umwandlungsgesetz",
      "state": "Berlin",
      "amtsgericht": "Amtsgericht Berlin (Charlottenburg)",
      "registernummer": "HRB 124695",
      "registerart": "HRB",
      "company_name": "RAW Value 3 GmbH",
      "company_seat": "Berlin",
      "details": "03.12.2025 (Bekanntmachungsdatum)\n\nBerlin Amtsgericht Berlin (Charlottenburg) HRB 124695\nRegisterbekanntmachung nach dem Umwandlungsgesetz 02.12.2025 (Eintragungsdatum)\n\nRAW Value 3 GmbH\nGesellschaft mit beschränkter Haftung\nBerlin\n\nZu Eintragungsnummer 11 vom 02.12.2025 wird als nicht eingetragen veröffentlicht: Den Gläubigern der an der Verschmelzung beteiligten Rechtsträger ist, wenn sie binnen sechs Monaten nach dem Tag, an dem die Eintragung der Verschmelzung in das Register des Sitzes desjenigen Rechtsträgers, dessen Gläubiger sie sind, als bekannt gemacht gilt, ihren Anspruch nach Grund und Höhe schriftlich anmelden, Sicherheit zu leisten, soweit sie nicht Befriedigung verlangen können. Dieses Recht steht den Gläubigern jedoch nur zu, wenn sie glaubhaft machen, dass durch die Verschmelzung die Erfüllung ihrer Forderung gefährdet wird. Das Recht, Sicherheitsleistung zu verlangen, steht Gläubigern nicht zu, die im Falle der Insolvenz ein Recht auf vorzugsweise Befriedigung aus einer Deckungsmasse haben, die nach gesetzlicher Vorschrift zu ihrem Schutz errichtet und staatlich überwacht ist."
    },
    {
      "date": "2025-12-03",
      "id": "139001",
      "original_text": "Löschungsankündigung\nSaarland Amtsgericht Saarbrücken HRB 10386\nBOGO Metallbau Abwicklungsgesellschaft mbH – Saarbrücken",
      "type": "Löschungsankündigung",
      "state": "Saarland",
      "amtsgericht": "Amtsgericht Saarbrücken",
      "registernummer": "HRB 10386",
      "registerart": "HRB",
      "company_name": "BOGO Metallbau Abwicklungsgesellschaft mbH",
      "company_seat": "Saarbrücken",
      "details": "03.12.2025 (Bekanntmachungsdatum)\n\nSaarland Amtsgericht Saarbrücken HRB 10386\nLöschungsankündigung\n\nBOGO Metallbau Abwicklungsgesellschaft mbH\nGesellschaft mit beschränkter Haftung\nSaarbrücken\n\nEs ist beabsichtigt, die Gesellschaft von Amts wegen gemäß § 394 FamFG wegen Vermögenslosigkeit zu löschen.\nGegen die Löschung von Amts wegen ist das Rechtsmittel des Widerspruchs statthaft. Der Widerspruch ist binnen einer Frist zwei Monaten beginnend mit dem Tag dieser Veröffentlichung durch Einreichen eines Widerspruchsschreibens -schriftlich oder zur Niederschrift der Geschäftsstelle beim Amtsgericht Saarbrücken, -zentrales Handelsregister-, Mainzerstr.178, 66121 Saarbrücken einzulegen.\nDer Widerspruch muss die Bezeichnung der angefochtenen Löschungsankündigung enthalten sowie die Erklärung, dass Widerspruch eingelegt wird. Er ist vom Widerspruchsführer oder seinem Bevollmächtigten zu unterzeichnen.\nDas Widerspruchsschreiben kann auch in der Form eines elektronischen Dokumentes eingereicht werden, das mit einer qualifizierten elektronischen Signatur nach dem Signaturgesetz versehen sein muss (§§ 14 Abs. 2 FamFG, 130a, 298 ZPO)."
    },
    {
      "date": "2025-12-03",
      "id": "139002",
      "original_text": "Registerbekanntmachung nach dem Umwandlungsgesetz\nBerlin Amtsgericht Berlin (Charlottenburg) HRB 176599\nH/P Executive Consulting GmbH – Berlin",
      "type": "Registerbekanntmachung nach dem Umwandlungsgesetz",
      "state": "Berlin",
      "amtsgericht": "Amtsgericht Berlin (Charlottenburg)",
      "registernummer": "HRB 176599",
      "registerart": "HRB",
      "company_name": "H/P Executive Consulting GmbH",
      "company_seat": "Berlin",
      "details": "03.12.2025 (Bekanntmachungsdatum)\n\nBerlin Amtsgericht Berlin (Charlottenburg) HRB 176599\nRegisterbekanntmachung nach dem Umwandlungsgesetz 02.12.2025 (Eintragungsdatum)\n\nH/P Executive Consulting GmbH\nGesellschaft mit beschränkter Haftung\nBerlin\n\nZu Eintragungsnummer 9 vom 02.12.2025 wird als nicht eingetragen veröffentlicht: Den Gläubigern der an der Verschmelzung beteiligten Rechtsträger ist, wenn sie binnen sechs Monaten nach dem Tag, an dem die Eintragung der Verschmelzung in das Register des Sitzes desjenigen Rechtsträgers, dessen Gläubiger sie sind, als bekannt gemacht gilt, ihren Anspruch nach Grund und Höhe schriftlich anmelden, Sicherheit zu leisten, soweit sie nicht Befriedigung verlangen können. Dieses Recht steht den Gläubigern jedoch nur zu, wenn sie glaubhaft machen, dass durch die Verschmelzung die Erfüllung ihrer Forderung gefährdet wird. Das Recht, Sicherheitsleistung zu verlangen, steht Gläubigern nicht zu, die im Falle der Insolvenz ein Recht auf vorzugsweise Befriedigung aus einer Deckungsmasse haben, die nach gesetzlicher Vorschrift zu ihrem Schutz errichtet und staatlich überwacht ist."
    },
    {
      "date": "2025-12-03",
      "id": "139003",
      "original_text": "Registerbekanntmachung nach dem Umwandlungsgesetz\nBerlin Amtsgericht Berlin (Charlottenburg) HRB 261473\nNetsrot Vermögensverwaltung GmbH – Berlin",
      "type": "Registerbekanntmachung nach dem Umwandlungsgesetz",
      "state": "Berlin",
      "amtsgericht": "Amtsgericht Berlin (Charlottenburg)",
      "registernummer": "HRB 261473",
      "registerart": "HRB",
      "company_name": "Netsrot Vermögensverwaltung GmbH",
      "company_seat": "Berlin",
      "details": "03.12.2025 (Bekanntmachungsdatum)\n\nBerlin Amtsgericht Berlin (Charlottenburg) HRB 261473\nRegisterbekanntmachung nach dem Umwandlungsgesetz 03.12.2025 (Eintragungsdatum)\n\nNetsrot Vermögensverwaltung GmbH\nGesellschaft mit beschränkter Haftung\nBerlin\n\nZu Eintragungsnummer 2 vom 03.12.2025 wird als nicht eingetragen veröffentlicht:Den Gläubigern der an der Verschmelzung beteiligten Rechtsträger ist, wenn sie binnen sechs Monaten nach dem Tag, an dem die Eintragung der Verschmelzung in das Register des Sitzes desjenigen Rechtsträgers, dessen Gläubiger sie sind, als bekannt gemacht gilt, ihren Anspruch nach Grund und Höhe schriftlich anmelden, Sicherheit zu leisten, soweit sie nicht Befriedigung verlangen können. Dieses Recht steht den Gläubigern jedoch nur zu, wenn sie glaubhaft machen, dass durch die Verschmelzung die Erfüllung ihrer Forderung gefährdet wird. Das Recht, Sicherheitsleistung zu verlangen, steht Gläubigern nicht zu, die im Falle der Insolvenz ein Recht auf vorzugsweise Befriedigung aus einer Deckungsmasse haben, die nach gesetzlicher Vorschrift zu ihrem Schutz errichtet und staatlich überwacht ist."
    },
    {
      "date": "2025-12-03",
      "id": "139004",
      "original_text": "Registerbekanntmachung nach dem Umwandlungsgesetz\nSchleswig-Holstein Amtsgericht Lübeck HRB 5479\nGrothe Vermögens- und Beteiligungsgesellschaft mbH – Lübeck",
      "type": "Registerbekanntmachung nach dem Umwandlungsgesetz",
      "state": "Schleswig-Holstein",
      "amtsgericht": "Amtsgericht Lübeck",
      "registernummer": "HRB 5479",
      "registerart": "HRB",
      "company_name": "Grothe Vermögens- und Beteiligungsgesellschaft mbH",
      "company_seat": "Lübeck",
      "details": "03.12.2025 (Bekanntmachungsdatum)\n\nSchleswig-Holstein Amtsgericht Lübeck HRB 5479\nRegisterbekanntmachung nach dem Umwandlungsgesetz 03.12.2025 (Eintragungsdatum)\n\nGrothe Vermögens- und Beteiligungsgesellschaft mbH\nGesellschaft mit beschränkter Haftung\nLübeck\n\nZu Eintragungsnummer 13 vom 03.12.2025 wird als nicht eingetragen veröffentlicht:\nDen Gläubigern der an der Verschmelzung beteiligten Rechtsträger ist, wenn sie binnen sechs Monaten nach dem Tag, an dem die Eintragung der Verschmelzung in das Register des Sitzes desjenigen Rechtsträgers, dessen Gläubiger sie sind, als bekannt gemacht gilt, ihren Anspruch nach Grund und Höhe schriftlich anmelden, Sicherheit zu leisten, soweit sie nicht Befriedigung verlangen können. Dieses Recht steht den Gläubigern jedoch nur zu, wenn sie glaubhaft machen, dass durch die Verschmelzung die Erfüllung ihrer Forderung gefährdet wird."
    },
    {
      "date": "2025-12-03",
      "id": "139005",
      "original_text": "Registerbekanntmachung nach dem Umwandlungsgesetz\nBerlin Amtsgericht Berlin (Charlottenburg) HRB 248867\nH/P Immobilien GmbH – Berlin",
      "type": "Registerbekanntmachung nach dem Umwandlungsgesetz",
      "state": "Berlin",
      "amtsgericht": "Amtsgericht Berlin (Charlottenburg)",
      "registernummer": "HRB 248867",
      "registerart": "HRB",
      "company_name": "H/P Immobilien GmbH",
      "company_seat": "Berlin",
      "details": "03.12.2025 (Bekanntmachungsdatum)\n\nBerlin Amtsgericht Berlin (Charlottenburg) HRB 248867\nRegisterbekanntmachung nach dem Umwandlungsgesetz 02.12.2025 (Eintragungsdatum)\n\nH/P Immobilien GmbH\nGesellschaft mit beschränkter Haftung\nBerlin\n\nZu Eintragungsnummer 2 vom 02.12.2025 wird als nicht eingetragen veröffentlicht: Den Gläubigern der an der Verschmelzung beteiligten Rechtsträger ist, wenn sie binnen sechs Monaten nach dem Tag, an dem die Eintragung der Verschmelzung in das Register des Sitzes desjenigen Rechtsträgers, dessen Gläubiger sie sind, als bekannt gemacht gilt, ihren Anspruch nach Grund und Höhe schriftlich anmelden, Sicherheit zu leisten, soweit sie nicht Befriedigung verlangen können. Dieses Recht steht den Gläubigern jedoch nur zu, wenn sie glaubhaft machen, dass durch die Verschmelzung die Erfüllung ihrer Forderung gefährdet wird. Das Recht, Sicherheitsleistung zu verlangen, steht Gläubigern nicht zu, die im Falle der Insolvenz ein Recht auf vorzugsweise Befriedigung aus einer Deckungsmasse haben, die nach gesetzlicher Vorschrift zu ihrem Schutz errichtet und staatlich überwacht ist."
    },
    {
      "date": "2025-12-03",
      "id": "139006",
      "original_text": "Löschungsankündigung\nSachsen Amtsgericht Dresden HRB 29511\nPro Ratio Bau UG (haftungsbeschränkt) – Dresden",
      "type": "Löschungsankündigung",
      "state": "Sachsen",
      "amtsgericht": "Amtsgericht Dresden",
      "registernummer": "HRB 29511",
      "registerart": "HRB",
      "company_name": "Pro Ratio Bau UG (haftungsbeschränkt)",
      "company_seat": "Dresden",
      "details": "03.12.2025 (Bekanntmachungsdatum)\n\nSachsen Amtsgericht Dresden HRB 29511\nLöschungsankündigung\n\nPro Ratio Bau UG (haftungsbeschränkt)\nGesellschaft mit beschränkter Haftung\nDresden\n\nDas Registergericht beabsichtigt, die im Handelsregister eingetragene Gesellschaft von Amts wegen nach § 394 FamFG zu löschen. Die Frist zu Erhebung eines Widerspruchs gegen die beabsichtigte Löschung wird auf einen Monat festgesetzt."
    },
    {
      "date": "2025-12-03",
      "id": "139007",
      "original_text": "Registerbekanntmachung nach dem Umwandlungsgesetz\nSachsen Amtsgericht Chemnitz HRB 21183\nHIEMER Getränkefachgroßhandel für Gastronomie GmbH – Reichenbach im Vogtland",
      "type": "Registerbekanntmachung nach dem Umwandlungsgesetz",
      "state": "Sachsen",
      "amtsgericht": "Amtsgericht Chemnitz",
      "registernummer": "HRB 21183",
      "registerart": "HRB",
      "company_name": "HIEMER Getränkefachgroßhandel für Gastronomie GmbH",
      "company_seat": "Reichenbach im Vogtland",
      "details": "03.12.2025 (Bekanntmachungsdatum)\n\nSachsen Amtsgericht Chemnitz HRB 21183\nRegisterbekanntmachung nach dem Umwandlungsgesetz 03.12.2025 (Eintragungsdatum)\n\nHIEMER Getränkefachgroßhandel für Gastronomie GmbH\nGesellschaft mit beschränkter Haftung\nReichenbach im Vogtland\n\nDen Gläubigern der an der Verschmelzung beteiligten Rechtsträger ist, wenn sie binnen sechs Monaten nach dem Tag, an dem die Eintragung der Verschmelzung in das Register des Sitzes desjenigen Rechtsträgers, dessen Gläubiger sie sind, nach § 19 Abs. 3 UmwG als bekannt gemacht gilt, ihren Anspruch nach Grund und Höhe in Textform anmelden, Sicherheit zu leisten, soweit sie nicht Befriedigung verlangen können. Dieses Recht steht den Gläubigern jedoch nur zu, wenn sie glaubhaft machen, dass durch die Verschmelzung die Erfüllung der Forderung gefährdet wird."
    },
    {
      "date": "2025-12-03",
      "id": "139008",
      "original_text": "Registerbekanntmachung nach dem Umwandlungsgesetz\nSachsen Amtsgericht Chemnitz HRA 10185\nSirko Hornung e.K. – Limbach-Oberfrohna",
      "type": "Registerbekanntmachung nach dem Umwandlungsgesetz",
      "state": "Sachsen",
      "amtsgericht": "Amtsgericht Chemnitz",
      "registernummer": "HRA 10185",
      "registerart": "HRA",
      "company_name": "Sirko Hornung e.K.",
      "company_seat": "Limbach-Oberfrohna",
      "details": "03.12.2025 (Bekanntmachungsdatum)\n\nSachsen Amtsgericht Chemnitz HRA 10185\nRegisterbekanntmachung nach dem Umwandlungsgesetz 03.12.2025 (Eintragungsdatum)\n\nSirko Hornung e.K.\nEinzelkaufmann / Einzelkauffrau\nLimbach-Oberfrohna\n\nDen Gläubigern der an der Ausgliederung beteiligten Rechtsträger ist, wenn sie binnen sechs Monaten nach dem Tag, an dem die Eintragung der Ausgliederung in das Register des Sitzes desjenigen Rechtsträgers, dessen Gläubiger sie sind, nach § 19 Abs. 3 UmwG als bekannt gemacht gilt, ihren Anspruch nach Grund und Höhe in Textform anmelden, Sicherheit zu leisten, soweit sie nicht Befriedigung verlangen können. Dieses Recht steht den Gläubigern jedoch nur zu, wenn sie glaubhaft machen, dass durch die Ausgliederung die Erfüllung der Forderung gefährdet wird."
    },
    {
      "date": "2025-12-03",
      "id": "139009",
      "original_text": "Registerbekanntmachung nach dem Umwandlungsgesetz\nSachsen Amtsgericht Chemnitz HRB 27129\nGetränkeland Oberreichenbach UG (haftungsbeschränkt) – Reichenbach im Vogtland",
      "type": "Registerbekanntmachung nach dem Umwandlungsgesetz",
      "state": "Sachsen",
      "amtsgericht": "Amtsgericht Chemnitz",
      "registernummer": "HRB 27129",
      "registerart": "HRB",
      "company_name": "Getränkeland Oberreichenbach UG (haftungsbeschränkt)",
      "company_seat": "Reichenbach im Vogtland",
      "details": "03.12.2025 (Bekanntmachungsdatum)\n\nSachsen Amtsgericht Chemnitz HRB 27129\nRegisterbekanntmachung nach dem Umwandlungsgesetz 03.12.2025 (Eintragungsdatum)\n\nGetränkeland Oberreichenbach UG (haftungsbeschränkt)\nGesellschaft mit beschränkter Haftung\nReichenbach im Vogtland\n\nDen Gläubigern der an der Verschmelzung beteiligten Rechtsträger ist, wenn sie binnen sechs Monaten nach dem Tag, an dem die Eintragung der Verschmelzung in das Register des Sitzes desjenigen Rechtsträgers, dessen Gläubiger sie sind, nach § 19 Abs. 3 UmwG als bekannt gemacht gilt, ihren Anspruch nach Grund und Höhe in Textform anmelden, Sicherheit zu leisten, soweit sie nicht Befriedigung verlangen können. Dieses Recht steht den Gläubigern jedoch nur zu, wenn sie glaubhaft machen, dass durch die Verschmelzung die Erfüllung der Forderung gefährdet wird."
    },
    {
      "date": "2025-12-03",
      "id": "139010",
      "original_text": "Registerbekanntmachung nach dem Umwandlungsgesetz\nSachsen Amtsgericht Chemnitz HRB 27088\nGruner Waidhas GmbH – Chemnitz",
      "type": "Registerbekanntmachung nach dem Umwandlungsgesetz",
      "state": "Sachsen",
      "amtsgericht": "Amtsgericht Chemnitz",
      "registernummer": "HRB 27088",
      "registerart": "HRB",
      "company_name": "Gruner Waidhas GmbH",
      "company_seat": "Chemnitz",
      "details": "03.12.2025 (Bekanntmachungsdatum)\n\nSachsen Amtsgericht Chemnitz HRB 27088\nRegisterbekanntmachung nach dem Umwandlungsgesetz 03.12.2025 (Eintragungsdatum)\n\nGruner Waidhas GmbH\nGesellschaft mit beschränkter Haftung\nChemnitz\n\nDen Gläubigern der an der Verschmelzung beteiligten Rechtsträger ist, wenn sie binnen sechs Monaten nach dem Tag, an dem die Eintragung der Verschmelzung in das Register des Sitzes desjenigen Rechtsträgers, dessen Gläubiger sie sind, nach § 19 Abs. 3 UmwG als bekannt gemacht gilt, ihren Anspruch nach Grund und Höhe in Textform anmelden, Sicherheit zu leisten, soweit sie nicht Befriedigung verlangen können. Dieses Recht steht den Gläubigern jedoch nur zu, wenn sie glaubhaft machen, dass durch die Verschmelzung die Erfüllung der Forderung gefährdet wird."
    },
    {
      "date": "2025-12-03",
      "id": "139011",
      "original_text": "Registerbekanntmachung nach dem Umwandlungsgesetz\nSachsen Amtsgericht Chemnitz HRA 10192\nAlte Schäferei Wolkenburg KG – Limbach-Oberfrohna",
      "type": "Registerbekanntmachung nach dem Umwandlungsgesetz",
      "state": "Sachsen",
      "amtsgericht": "Amtsgericht Chemnitz",
      "registernummer": "HRA 10192",
      "registerart": "HRA",
      "company_name": "Alte Schäferei Wolkenburg KG",
      "company_seat": "Limbach-Oberfrohna",
      "details": "03.12.2025 (Bekanntmachungsdatum)\n\nSachsen Amtsgericht Chemnitz HRA 10192\nRegisterbekanntmachung nach dem Umwandlungsgesetz 03.12.2025 (Eintragungsdatum)\n\nAlte Schäferei Wolkenburg KG\nKommanditgesellschaft\nLimbach-Oberfrohna\n\nDen Gläubigern der an der Ausgliederung beteiligten Rechtsträger ist, wenn sie binnen sechs Monaten nach dem Tag, an dem die Eintragung der Ausgliederung in das Register des Sitzes desjenigen Rechtsträgers, dessen Gläubiger sie sind, nach § 19 Abs. 3 UmwG als bekannt gemacht gilt, ihren Anspruch nach Grund und Höhe in Textform anmelden, Sicherheit zu leisten, soweit sie nicht Befriedigung verlangen können. Dieses Recht steht den Gläubigern jedoch nur zu, wenn sie glaubhaft machen, dass durch die Ausgliederung die Erfüllung der Forderung gefährdet wird."
    },
    {
      "date": "2025-12-03",
      "id": "139012",
      "original_text": "Sonstige Registerbekanntmachung\nNiedersachsen Amtsgericht Hannover HRB 57814\nE.ON Digital Technology GmbH – Hannover",
      "type": "Sonstige Registerbekanntmachung",
      "state": "Niedersachsen",
      "amtsgericht": "Amtsgericht Hannover",
      "registernummer": "HRB 57814",
      "registerart": "HRB",
      "company_name": "E.ON Digital Technology GmbH",
      "company_seat": "Hannover",
      "details": "03.12.2025 (Bekanntmachungsdatum)\n\nNiedersachsen Amtsgericht Hannover HRB 57814\nSonstige Registerbekanntmachung\n\nE.ON Digital Technology GmbH\nGesellschaft mit beschränkter Haftung\nHannover\n\nDie Liste der Mitglieder des Aufsichtsrats wurde beim Registergericht eingereicht."
    },
    {
      "date": "2025-12-03",
      "id": "139013",
      "original_text": "Löschungsankündigung\nNiedersachsen Amtsgericht Stadthagen HRB 200876\nRedCat UG (haftungsbeschränkt) – Rinteln",
      "type": "Löschungsankündigung",
      "state": "Niedersachsen",
      "amtsgericht": "Amtsgericht Stadthagen",
      "registernummer": "HRB 200876",
      "registerart": "HRB",
      "company_name": "RedCat UG (haftungsbeschränkt)",
      "company_seat": "Rinteln",
      "details": "03.12.2025 (Bekanntmachungsdatum)\n\nNiedersachsen Amtsgericht Stadthagen HRB 200876\nLöschungsankündigung\n\nRedCat UG (haftungsbeschränkt)\nGesellschaft mit beschränkter Haftung\nRinteln\n\nDas Registergericht beabsichtigt, die Gesellschaft von Amts wegen nach § 394 FamFG zu löschen. Die Frist zur Erhebung eines Widerspruchs ist auf 1 Monat ab dieser Registerbekanntmachung festgesetzt."
    },
    {
      "date": "2025-12-03",
      "id": "139014",
      "original_text": "Registerbekanntmachung nach dem Umwandlungsgesetz\nNiedersachsen Amtsgericht Tostedt HRB 110608 früher Amtsgericht Langen\nK & V GmbH – Cuxhaven",
      "type": "Registerbekanntmachung nach dem Umwandlungsgesetz",
      "state": "Niedersachsen",
      "amtsgericht": "Amtsgericht Tostedt",
      "registernummer": "HRB 110608",
      "registerart": "HRB",
      "company_name": "K & V GmbH",
      "company_seat": "Cuxhaven",
      "former_amtsgericht": "Langen",
      "details": "03.12.2025 (Bekanntmachungsdatum)\n\nNiedersachsen Amtsgericht Tostedt HRB 110608 früher Amtsgericht Langen\nRegisterbekanntmachung nach dem Umwandlungsgesetz 03.12.2025 (Eintragungsdatum)\n\nK & V GmbH\nGesellschaft mit beschränkter Haftung\nCuxhaven\n\nDen Gläubigern der an der Verschmelzung beteiligten Rechtsträger ist, wenn sie binnen sechs Monaten nach dem Tag, an dem die Eintragung der Verschmelzung in das Register des Sitzes desjenigen Rechtsträgers, dessen Gläubiger sie sind, nach § 19  Abs.  3 UmwG als bekannt gemacht gilt, ihren Anspruch nach Grund und Höhe schriftlich anmelden, Sicherheit zu leisten, soweit sie nicht Befriedigung verlangen können. Dieses Recht steht den Gläubigern jedoch nur zu, wenn sie glaubhaft machen, dass durch die Verschmelzung die Erfüllung der Forderung gefährdet wird."
    },
    {
      "date": "2025-12-03",
      "id": "139015",
      "original_text": "Löschungsankündigung\nNiedersachsen Amtsgericht Hildesheim HRB 204176\nMeteor GmbH – Bockenem",
      "type": "Löschungsankündigung",
      "state": "Niedersachsen",
      "amtsgericht": "Amtsgericht Hildesheim",
      "registernummer": "HRB 204176",
      "registerart": "HRB",
      "company_name": "Meteor GmbH",
      "company_seat": "Bockenem",
      "details": "03.12.2025 (Bekanntmachungsdatum)\n\nNiedersachsen Amtsgericht Hildesheim HRB 204176\nLöschungsankündigung 03.12.2025 (Eintragungsdatum)\n\nMeteor GmbH\nGesellschaft mit beschränkter Haftung\nBockenem\n\nDas Registergericht beabsichtigt, die Eintragung des Geschäftsführers Christopher Babel, München, geboren am 23.11.1982, von Amts wegen nach § 395 FamFG zu löschen. Die Frist zur Erhebung eines Widerspruchs ist auf 1 Monat ab dieser Registerbekanntmachung festgesetzt."
    },
    {
      "date": "2025-12-03",
      "id": "139016",
      "original_text": "Löschungsankündigung\nNiedersachsen Amtsgericht Osnabrück HRB 201883\nSchaaij Immobilien GmbH – Nordhorn",
      "type": "Löschungsankündigung",
      "state": "Niedersachsen",
      "amtsgericht": "Amtsgericht Osnabrück",
      "registernummer": "HRB 201883",
      "registerart": "HRB",
      "company_name": "Schaaij Immobilien GmbH",
      "company_seat": "Nordhorn",
      "details": "03.12.2025 (Bekanntmachungsdatum)\n\nNiedersachsen Amtsgericht Osnabrück HRB 201883\nLöschungsankündigung\n\nSchaaij Immobilien GmbH\nGesellschaft mit beschränkter Haftung\nNordhorn\n\nDas Registergericht beabsichtigt, die Gesellschaft von Amts wegen nach § 394 FamFG wegen Vermögenslosigkeit zu löschen. Die Frist zur Erhebung eines Widerspruchs ist auf 1 Monat ab dieser Registerbekanntmachung festgesetzt."
    },
    {
      "date": "2025-12-03",
      "id": "139017",
      "original_text": "Löschungsankündigung\nNiedersachsen Amtsgericht Walsrode HRB 209039\nCreative Solutions Group GmbH – Ottersberg",
      "type": "Löschungsankündigung",
      "state": "Niedersachsen",
      "amtsgericht": "Amtsgericht Walsrode",
      "registernummer": "HRB 209039",
      "registerart": "HRB",
      "company_name": "Creative Solutions Group GmbH",
      "company_seat": "Ottersberg",
      "details": "03.12.2025 (Bekanntmachungsdatum)\n\nNiedersachsen Amtsgericht Walsrode HRB 209039\nLöschungsankündigung 03.12.2025 (Eintragungsdatum)\n\nCreative Solutions Group GmbH\nGesellschaft mit beschränkter Haftung\nOttersberg\n\nDas Registergericht beabsichtigt, die Gesellschaft von Amts wegen nach § 395 FamFG zu löschen. Die Frist zur Erhebung eines Widerspruchs ist auf 2 Monat ab dieser Registerbekanntmachung festgesetzt."
    },
    {
      "date": "2025-12-03",
      "id": "139018",
      "original_text": "Löschungsankündigung\nNiedersachsen Amtsgericht Osnabrück HRB 217697\nGoGo-Gastronomie-Betriebsstätten UG (haftungsbeschränkt) – Lingen (Ems)",
      "type": "Löschungsankündigung",
      "state": "Niedersachsen",
      "amtsgericht": "Amtsgericht Osnabrück",
      "registernummer": "HRB 217697",
      "registerart": "HRB",
      "company_name": "GoGo-Gastronomie-Betriebsstätten UG (haftungsbeschränkt)",
      "company_seat": "Lingen (Ems)",
      "details": "03.12.2025 (Bekanntmachungsdatum)\n\nNiedersachsen Amtsgericht Osnabrück HRB 217697\nLöschungsankündigung\n\nGoGo-Gastronomie-Betriebsstätten UG (haftungsbeschränkt)\nGesellschaft mit beschränkter Haftung\nLingen (Ems)\n\nDas Registergericht beabsichtigt, die Gesellschaft von Amts wegen nach § 394 FamFG wegen Vermögenslosigkeit zu löschen. Die Frist zur Erhebung eines Widerspruchs ist auf 1 Monat ab dieser Registerbekanntmachung festgesetzt."
    },
    {
      "date": "2025-12-03",
      "id": "139019",
      "original_text": "Registerbekanntmachung nach dem Umwandlungsgesetz\nNiedersachsen Amtsgericht Oldenburg (Oldenburg) GsR 1086\nVerkehrsregion Nahverkehr Ems-Jade eGbR – Jever",
      "type": "Registerbekanntmachung nach dem Umwandlungsgesetz",
      "state": "Niedersachsen",
      "amtsgericht": "Amtsgericht Oldenburg (Oldenburg)",
      "registernummer": "GsR 1086",
      "registerart": "GsR",
      "company_name": "Verkehrsregion Nahverkehr Ems-Jade eGbR",
      "company_seat": "Jever",
      "details": "03.12.2025 (Bekanntmachungsdatum)\n\nNiedersachsen Amtsgericht Oldenburg (Oldenburg) GsR 1086\nRegisterbekanntmachung nach dem Umwandlungsgesetz 03.12.2025 (Eintragungsdatum)\n\nVerkehrsregion Nahverkehr Ems-Jade eGbR\nGesellschaft bürgerlichen Rechts\nJever\n\nDen Gläubigern der an der formwechselnden Umwandlung beteiligten Rechtsträger ist, wenn sie binnen sechs Monaten nach dem Tag, an dem die Eintragung der Umwandlung in das Register des Sitzes desjenigen Rechtsträgers, dessen Gläubiger sie sind, nach § 19 Abs. 3 UmwG als bekannt gemacht gilt, ihren Anspruch nach Grund und Höhe schriftlich anmelden, Sicherheit zu leisten, soweit sie nicht Befriedigung verlangen können. Dieses Recht steht den Gläubigern jedoch nur zu, wenn sie glaubhaft machen, dass durch die formwechselnde Umwandlung die Erfüllung der Forderung gefährdet wird."
    },
    {
      "date": "2025-12-03",
      "id": "139020",
      "original_text": "Löschungsankündigung\nNiedersachsen Amtsgericht Hildesheim VR 201221\nSeniorenservice Hildesheim e.V. – Hildesheim",
      "type": "Löschungsankündigung",
      "state": "Niedersachsen",
      "amtsgericht": "Amtsgericht Hildesheim",
      "registernummer": "VR 201221",
      "registerart": "VR",
      "company_name": "Seniorenservice Hildesheim e.V.",
      "company_seat": "Hildesheim",
      "details": "03.12.2025 (Bekanntmachungsdatum)\n\nNiedersachsen Amtsgericht Hildesheim VR 201221\nLöschungsankündigung\n\nSeniorenservice Hildesheim e.V.\neingetragener Verein\nHildesheim\n\nDas Registergericht beabsichtigt, den Verein von Amts wegen nach § 395 FamFG zu löschen. Die Frist zur Erhebung eines Widerspruchs ist auf 1 Monat ab dieser Registerbekanntmachung festgesetzt."
    },
    {
      "date": "2025-12-03",
      "id": "139021",
      "original_text": "Registerbekanntmachung nach dem Umwandlungsgesetz\nNiedersachsen Amtsgericht Tostedt HRB 110894 früher Amtsgericht Langen\n\"Kristin\" Fischereigesellschaft mbH – Cuxhaven",
      "type": "Registerbekanntmachung nach dem Umwandlungsgesetz",
      "state": "Niedersachsen",
      "amtsgericht": "Amtsgericht Tostedt",
      "registernummer": "HRB 110894",
      "registerart": "HRB",
      "company_name": "\"Kristin\" Fischereigesellschaft mbH",
      "company_seat": "Cuxhaven",
      "former_amtsgericht": "Langen",
      "details": "03.12.2025 (Bekanntmachungsdatum)\n\nNiedersachsen Amtsgericht Tostedt HRB 110894 früher Amtsgericht Langen\nRegisterbekanntmachung nach dem Umwandlungsgesetz 03.12.2025 (Eintragungsdatum)\n\n\"Kristin\" Fischereigesellschaft mbH\nGesellschaft mit beschränkter Haftung\nCuxhaven\n\nDen Gläubigern der an der Verschmelzung beteiligten Rechtsträger ist, wenn sie binnen sechs Monaten nach dem Tag, an dem die Eintragung der Verschmelzung in das Register des Sitzes desjenigen Rechtsträgers, dessen Gläubiger sie sind, nach § 19  Abs.  3 UmwG als bekannt gemacht gilt, ihren Anspruch nach Grund und Höhe schriftlich anmelden, Sicherheit zu leisten, soweit sie nicht Befriedigung verlangen können. Dieses Recht steht den Gläubigern jedoch nur zu, wenn sie glaubhaft machen, dass durch die Verschmelzung die Erfüllung der Forderung gefährdet wird."
    },
    {
      "date": "2025-12-03",
      "id": "139022",
      "original_text": "Einreichung neuer Dokumente\nRheinland-Pfalz Amtsgericht Kaiserslautern HRB 3658\nKammgarn GmbH – Kaiserslautern",
      "type": "Einreichung neuer Dokumente",
      "state": "Rheinland-Pfalz",
      "amtsgericht": "Amtsgericht Kaiserslautern",
      "registernummer": "HRB 3658",
      "registerart": "HRB",
      "company_name": "Kammgarn GmbH",
      "company_seat": "Kaiserslautern",
      "details": "03.12.2025 (Bekanntmachungsdatum)\n\nRheinland-Pfalz Amtsgericht Kaiserslautern HRB 3658\nEinreichung neuer Dokumente 03.12.2025 (Eintragungsdatum)\n\nKammgarn GmbH\nGesellschaft mit beschränkter Haftung\nKaiserslautern\n\nDem Registergericht ist eine neue Liste der Mitglieder des Aufsichtsrates eingereicht worden."
    },
    {
      "date": "2025-12-03",
      "id": "139023",
      "original_text": "Registerbekanntmachung nach dem Umwandlungsgesetz\nRheinland-Pfalz Amtsgericht Wittlich HRB 1924\nBernhard Rütz, Gesellschaft mit beschränkter Haftung – Konz",
      "type": "Registerbekanntmachung nach dem Umwandlungsgesetz",
      "state": "Rheinland-Pfalz",
      "amtsgericht": "Amtsgericht Wittlich",
      "registernummer": "HRB 1924",
      "registerart": "HRB",
      "company_name": "Bernhard Rütz, Gesellschaft mit beschränkter Haftung",
      "company_seat": "Konz",
      "details": "03.12.2025 (Bekanntmachungsdatum)\n\nRheinland-Pfalz Amtsgericht Wittlich HRB 1924\nRegisterbekanntmachung nach dem Umwandlungsgesetz 03.12.2025 (Eintragungsdatum)\n\nBernhard Rütz, Gesellschaft mit beschränkter Haftung\nGesellschaft mit beschränkter Haftung\nKonz\n\nAls nicht eingetragen wird veröffentlicht: Den Gläubigern der an der Verschmelzung beteiligten Rechtsträger ist, wenn sie binnen sechs Monaten nach dem Tag, an dem die Eintragung der Verschmelzung in das Register des Sitzes desjenigen Rechtsträgers,dessen Gläubiger sie sind, nach § 19 Abs. 3 UmwG als bekannt gemacht gilt, ihren Anspruch nach Grund und Höhe schriftlich anmelden, Sicherheit zu leisten, soweit sie nicht Befriedigung verlangen können. Dieses Recht steht den Gläubigern jedoch nur zu, wenn sie glaubhaft machen, dass durch die Verschmelzung die Erfüllung der Forderung gefährdet wird."
    },
    {
      "date": "2025-12-03",
      "id": "139024",
      "original_text": "Einreichung neuer Dokumente\nRheinland-Pfalz Amtsgericht Wittlich HRB 1149\nHochwald Foods GmbH – Thalfang",
      "type": "Einreichung neuer Dokumente",
      "state": "Rheinland-Pfalz",
      "amtsgericht": "Amtsgericht Wittlich",
      "registernummer": "HRB 1149",
      "registerart": "HRB",
      "company_name": "Hochwald Foods GmbH",
      "company_seat": "Thalfang",
      "details": "03.12.2025 (Bekanntmachungsdatum)\n\nRheinland-Pfalz Amtsgericht Wittlich HRB 1149\nEinreichung neuer Dokumente\n\nHochwald Foods GmbH\nGesellschaft mit beschränkter Haftung\nThalfang\n\nDem Registergericht ist eine neue Liste der Mitglieder des Aufsichtsrates eingereicht worden."
    },
    {
      "date": "2025-12-03",
      "id": "139025",
      "original_text": "Registerbekanntmachung nach dem Umwandlungsgesetz\nNordrhein-Westfalen Amtsgericht Bonn HRB 3462\nCPM Verlag GmbH – Bonn",
      "type": "Registerbekanntmachung nach dem Umwandlungsgesetz",
      "state": "Nordrhein-Westfalen",
      "amtsgericht": "Amtsgericht Bonn",
      "registernummer": "HRB 3462",
      "registerart": "HRB",
      "company_name": "CPM Verlag GmbH",
      "company_seat": "Bonn",
      "details": "03.12.2025 (Bekanntmachungsdatum)\n\nNordrhein-Westfalen Amtsgericht Bonn HRB 3462\nRegisterbekanntmachung nach dem Umwandlungsgesetz 03.12.2025 (Eintragungsdatum)\n\nCPM Verlag GmbH\nGesellschaft mit beschränkter Haftung\nBonn\n\nDen Gläubigern der an der Ausgliederung beteiligten Rechtsträger ist, wenn sie binnen sechs Monaten nach dem Tag, an dem die Eintragung der Ausgliederung in das Register des Sitzes desjenigen Rechtsträgers, dessen Gläubiger sie sind, nach § 19 Absatz 3 UmwG als bekanntgemacht gilt, ihren Anspruch nach Grund und Höhe schriftlich anmelden, Sicherheit zu leisten, soweit sie nicht Befriedigung verlangen können. Dieses Recht steht den Gläubigern jedoch nur zu, wenn sie glaubhaft machen, dass durch die Ausgliederung die Erfüllung ihrer Forderung gefährdet wird."
    },
    {
      "date": "2025-12-03",
      "id": "139026",
      "original_text": "Registerbekanntmachung nach dem Umwandlungsgesetz\nNordrhein-Westfalen Amtsgericht Bonn HRB 24687\nF.A.K.T. Holding GmbH – Bonn",
      "type": "Registerbekanntmachung nach dem Umwandlungsgesetz",
      "state": "Nordrhein-Westfalen",
      "amtsgericht": "Amtsgericht Bonn",
      "registernummer": "HRB 24687",
      "registerart": "HRB",
      "company_name": "F.A.K.T. Holding GmbH",
      "company_seat": "Bonn",
      "details": "03.12.2025 (Bekanntmachungsdatum)\n\nNordrhein-Westfalen Amtsgericht Bonn HRB 24687\nRegisterbekanntmachung nach dem Umwandlungsgesetz 03.12.2025 (Eintragungsdatum)\n\nF.A.K.T. Holding GmbH\nGesellschaft mit beschränkter Haftung\nBonn\n\nDen Gläubigern der an der Ausgliederung beteiligten Rechtsträger ist, wenn sie binnen sechs Monaten nach dem Tag, an dem die Eintragung der Ausgliederung in das Register des Sitzes desjenigen Rechtsträgers, dessen Gläubiger sie sind, nach § 19 Absatz 3 UmwG als bekanntgemacht gilt, ihren Anspruch nach Grund und Höhe schriftlich anmelden, Sicherheit zu leisten, soweit sie nicht Befriedigung verlangen können. Dieses Recht steht den Gläubigern jedoch nur zu, wenn sie glaubhaft machen, dass durch die Ausgliederung die Erfüllung ihrer Forderung gefährdet wird."
    },
    {
      "date": "2025-12-03",
      "id": "139027",
      "original_text": "Einreichung neuer Dokumente\nNordrhein-Westfalen Amtsgericht Köln HRB 1167\nEisenbahn-Wohnungsbaugesellschaft Köln mbH – Köln",
      "type": "Einreichung neuer Dokumente",
      "state": "Nordrhein-Westfalen",
      "amtsgericht": "Amtsgericht Köln",
      "registernummer": "HRB 1167",
      "registerart": "HRB",
      "company_name": "Eisenbahn-Wohnungsbaugesellschaft Köln mbH",
      "company_seat": "Köln",
      "details": "03.12.2025 (Bekanntmachungsdatum)\n\nNordrhein-Westfalen Amtsgericht Köln HRB 1167\nEinreichung neuer Dokumente\n\nEisenbahn-Wohnungsbaugesellschaft Köln mbH\nGesellschaft mit beschränkter Haftung\nKöln\n\nDem Registergericht ist eine Liste der Mitglieder des Aufsichtsrates eingereicht worden."
    },
    {
      "date": "2025-12-03",
      "id": "139028",
      "original_text": "Registerbekanntmachung nach dem Umwandlungsgesetz\nNordrhein-Westfalen Amtsgericht Duisburg HRA 13762\nTornetta Besitz GmbH – Wesel",
      "type": "Registerbekanntmachung nach dem Umwandlungsgesetz",
      "state": "Nordrhein-Westfalen",
      "amtsgericht": "Amtsgericht Duisburg",
      "registernummer": "HRA 13762",
      "registerart": "HRA",
      "company_name": "Tornetta Besitz GmbH",
      "company_seat": "Wesel",
      "details": "03.12.2025 (Bekanntmachungsdatum)\n\nNordrhein-Westfalen Amtsgericht Duisburg HRA 13762\nRegisterbekanntmachung nach dem Umwandlungsgesetz 03.12.2025 (Eintragungsdatum)\n\nTornetta Besitz GmbH\nKommanditgesellschaft\nWesel\n\nDie Gesellschaft hat Gläubigern, deren Forderungen vor dieser Bekanntmachung begründet worden sind, Sicherheit zu leisten, soweit sie nicht Befriedigung verlangen können, wenn sie sich binnen sechs Monaten zu diesem Zweck melden."
    },
    {
      "date": "2025-12-03",
      "id": "139029",
      "original_text": "Löschungsankündigung\nNordrhein-Westfalen Amtsgericht Düsseldorf HRB 79355\nRestaurante Bandido-Mexicano GmbH – Düsseldorf",
      "type": "Löschungsankündigung",
      "state": "Nordrhein-Westfalen",
      "amtsgericht": "Amtsgericht Düsseldorf",
      "registernummer": "HRB 79355",
      "registerart": "HRB",
      "company_name": "Restaurante Bandido-Mexicano GmbH",
      "company_seat": "Düsseldorf",
      "details": "03.12.2025 (Bekanntmachungsdatum)\n\nNordrhein-Westfalen Amtsgericht Düsseldorf HRB 79355\nLöschungsankündigung\n\nRestaurante Bandido-Mexicano GmbH\nGesellschaft mit beschränkter Haftung\nDüsseldorf\n\nBetr.: Restaurante Bandido-Mexicano GmbH, Frankenstr. 17, 40476 Düsseldorf\n\nDas Registergericht beabsichtigt die Gesellschaft von Amts wegen nach § 394 FamFG zu löschen. Die Frist zur Erhebung eines Widerspruchs ist auf 3 Wochen festgesetzt.\n\nRechtsbehelfsbelehrung:\n\nDas Widerspruchsrecht steht jedem zu, der an der Unterlassung der Löschung ein berechtigtes Interesse hat. Der Widerspruch ist bei dem Amtsgericht Düsseldorf -Registergericht-, Werdener Straße 1, 40227 Düsseldorf schriftlich in deutscher Sprache oder zur Niederschrift der Geschäftsstelle einzulegen. Der Widerspruch kann auch zur Niederschrift der Geschäftsstelle eines jeden Amtsgerichtes abgegeben werden. Die Einlegung ist auch durch Übertragung eines elektronischen Dokuments an die elektronische Poststelle des Gerichts möglich. Das elektronische Dokument muss für die Bearbeitung durch das Gericht geeignet und mit einer qualifizierten elektronischen Signatur der verantwortenden Person versehen sein oder von der verantwortenden Person signiert und auf einem sicheren Übermittlungsweg gemäß § 130a ZPO nach näherer Maßgabe der Verordnung über die technischen Rahmenbedingungen des elektronischen Rechtsverkehrs und über das besondere elektronische Behördenpostfach (BGBl. I, S.3803) eingereicht werden. Weitere Informationen erhalten Sie auf der Internetseite www.justiz.de.\nDer Widerspruch muss spätestens innerhalb der gesetzten Frist nach dem Datum der Bekanntmachung der Löschungsankündigung bei dem Amtsgericht - Registergericht - Düsseldorf eingegangen sein.  Dies gilt auch dann, wenn der Widerspruch zur Niederschrift der Geschäftsstelle eines anderen Amtsgerichtes abgegeben wurde. Die Frist beginnt mit dem Tage der Bekanntmachung der Löschungsankündigung in dem für die Bekanntmachung der Eintragungen in das Handelsregister bestimmten elektronischen Informations- und Kommunikationssystem nach § 10 des Handelsgesetzbuches. Fällt das Ende der Frist auf einen Sonntag, einen allgemeinen Feiertag oder Sonnabend, so endet die Frist mit Ablauf des nächsten Werktages.\nDer Widerspruch muss die Bezeichnung der angefochtenen Löschungsankündigung sowie die Erklärung enthalten, dass Widerspruch gegen diese Löschungsankündigung eingelegt wird. Er ist zu unterzeichnen und soll begründet werden."
    },
    {
      "date": "2025-12-03",
      "id": "139030",
      "original_text": "Löschungsankündigung\nNordrhein-Westfalen Amtsgericht Dortmund HRB 25606\nNewdiver GmbH – Dortmund",
      "type": "Löschungsankündigung",
      "state": "Nordrhein-Westfalen",
      "amtsgericht": "Amtsgericht Dortmund",
      "registernummer": "HRB 25606",
      "registerart": "HRB",
      "company_name": "Newdiver GmbH",
      "company_seat": "Dortmund",
      "details": "03.12.2025 (Bekanntmachungsdatum)\n\nNordrhein-Westfalen Amtsgericht Dortmund HRB 25606\nLöschungsankündigung\n\nNewdiver GmbH\nGesellschaft mit beschränkter Haftung\nDortmund\n\nDas Registergericht beabsichtigt die Gesellschaft von Amts wegen nach § 394 FamFG zu löschen. Die Frist zur Erhebung eines Widerspruchs ist auf zwei Monate festgesetzt."
    },
    {
      "date": "2025-12-03",
      "id": "139031",
      "original_text": "Löschungsankündigung\nNordrhein-Westfalen Amtsgericht Neuss HRB 19126\nD & M Franchise GmbH – Korschenbroich",
      "type": "Löschungsankündigung",
      "state": "Nordrhein-Westfalen",
      "amtsgericht": "Amtsgericht Neuss",
      "registernummer": "HRB 19126",
      "registerart": "HRB",
      "company_name": "D & M Franchise GmbH",
      "company_seat": "Korschenbroich",
      "details": "03.12.2025 (Bekanntmachungsdatum)\n\nNordrhein-Westfalen Amtsgericht Neuss HRB 19126\nLöschungsankündigung 03.12.2025 (Eintragungsdatum)\n\nD & M Franchise GmbH\nGesellschaft mit beschränkter Haftung\nKorschenbroich\n\nDas Registergericht beabsichtigt die Gesellschaft von Amts wegen nach § 394 FamFG zu löschen. Die Frist zur Erhebung eines Widerspruchs ist auf einen Monat festgesetzt. Rechtsbehelfsbelehrung: Gegen diese Verfügung können Sie Widerspruch einlegen. Der Widerspruch ist bei dem Amtsgericht Neuss - Registergericht -, Breite Str. 48, 41460 Neuss schriftlich in deutscher Sprache oder zur Niederschrift der Geschäftsstelle einzulegen.Der Widerspruch kann auch zur Niederschrift der Geschäftsstelle eines jeden Amtsgerichtes abgegeben werden. Die Einlegung ist auch durch Übertragung eines elektronischen Dokuments an die elektronische Poststelle des Gerichts möglich. Das elektronische Dokument muss für die Bearbeitung durch das Gericht geeignet und mit einer qualifizierten elektronischen Signatur der verantwortenden Person versehen sein oder von der verantwortenden Person signiert und auf einem sicheren Übermittlungsweg gemäß § 130a ZPO nach näherer Maßgabe der Verordnung über die technischen Rahmenbedingungen des elektronischen Rechtsverkehrs und über das besondere elektronische Behördenpostfach (BGBl. I, S.3803) eingereicht werden. Weitere Informationen erhalten Sie auf der Internetseite www.justiz.de. Der Widerspruch muss spätestens innerhalb der gesetzten Frist nach der schriftlichen Bekanntgabe der Verfügung bei dem Amtsgericht - Registergericht - Neuss eingegangen sein. Dies gilt auch dann, wenn der Widerspruch zur Niederschrift der Geschäftsstelle eines anderen Amtsgerichtes abgegeben wurde. Die Frist beginnt mit der schriftlichen Bekanntgabe der Verfügung. Die Bekanntgabe ist entweder durch Zustellung oder am dritten Tage nach Aufgabe zur Post bewirkt. Fällt das Ende der Frist auf einen Sonntag, einen allgemeinen Feiertag oder Sonnabend, so endet die Frist mit Ablauf des nächsten Werktages. Der Widerspruch muss die Bezeichnung der angefochtenen Verfügung sowie die Erklärung enthalten, dass Widerspruch gegen diese Verfügung eingelegt wird. Er ist zu unterzeichnen und soll begründet werden."
    },
    {
      "date": "2025-12-03",
      "id": "139032",
      "original_text": "Registerbekanntmachung nach dem Umwandlungsgesetz\nNordrhein-Westfalen Amtsgericht Köln HRB 113268\nAntas GmbH – Köln",
      "type": "Registerbekanntmachung nach dem Umwandlungsgesetz",
      "state": "Nordrhein-Westfalen",
      "amtsgericht": "Amtsgericht Köln",
      "registernummer": "HRB 113268",
      "registerart": "HRB",
      "company_name": "Antas GmbH",
      "company_seat": "Köln",
      "details": "03.12.2025 (Bekanntmachungsdatum)\n\nNordrhein-Westfalen Amtsgericht Köln HRB 113268\nRegisterbekanntmachung nach dem Umwandlungsgesetz 03.12.2025 (Eintragungsdatum)\n\nAntas GmbH\nGesellschaft mit beschränkter Haftung\nKöln\n\nDen Gläubigern der an der Verschmelzung beteiligten Rechtsträger ist, wenn sie binnen sechs Monaten nach dem Tag, an dem die Eintragung der Verschmelzung in das Register des Sitzes desjenigen Rechtsträgers, dessen Gläubiger sie sind, nach § 19 Absatz 3 UmwG als bekanntgemacht gilt, ihren Anspruch nach Grund und Höhe schriftlich anmelden, Sicherheit zu leisten, soweit sie nicht Befriedigung verlangen können. Dieses Recht steht den Gläubigern jedoch nur zu, wenn sie glaubhaft machen, dass durch die Verschmelzung die Erfüllung ihrer Forderung gefährdet wird."
    },
    {
      "date": "2025-12-03",
      "id": "139033",
      "original_text": "Löschungsankündigung\nNordrhein-Westfalen Amtsgericht Wuppertal HRB 5774\nA T Getriebeinstandsetzung GmbH – Wuppertal",
      "type": "Löschungsankündigung",
      "state": "Nordrhein-Westfalen",
      "amtsgericht": "Amtsgericht Wuppertal",
      "registernummer": "HRB 5774",
      "registerart": "HRB",
      "company_name": "A T Getriebeinstandsetzung GmbH",
      "company_seat": "Wuppertal",
      "details": "03.12.2025 (Bekanntmachungsdatum)\n\nNordrhein-Westfalen Amtsgericht Wuppertal HRB 5774\nLöschungsankündigung\n\nA T Getriebeinstandsetzung GmbH\nGesellschaft mit beschränkter Haftung\nWuppertal\n\nDas Registergericht beabsichtigt die Gesellschaft von Amts wegen nach § 394 FamFG zu löschen. Die Frist zur Erhebung eines Widerspruchs ist auf einen Monat festgesetzt."
    },
    {
      "date": "2025-12-03",
      "id": "139034",
      "original_text": "Registerbekanntmachung nach dem Umwandlungsgesetz\nNordrhein-Westfalen Amtsgericht Duisburg HRB 39830\nNicolosi Besitz GmbH – Wesel",
      "type": "Registerbekanntmachung nach dem Umwandlungsgesetz",
      "state": "Nordrhein-Westfalen",
      "amtsgericht": "Amtsgericht Duisburg",
      "registernummer": "HRB 39830",
      "registerart": "HRB",
      "company_name": "Nicolosi Besitz GmbH",
      "company_seat": "Wesel",
      "details": "03.12.2025 (Bekanntmachungsdatum)\n\nNordrhein-Westfalen Amtsgericht Duisburg HRB 39830\nRegisterbekanntmachung nach dem Umwandlungsgesetz 03.12.2025 (Eintragungsdatum)\n\nNicolosi Besitz GmbH\nGesellschaft mit beschränkter Haftung\nWesel\n\nDie Gesellschaft hat Gläubigern, deren Forderungen vor dieser Bekanntmachung begründet worden sind, Sicherheit zu leisten, soweit sie nicht Befriedigung verlangen können, wenn sie sich binnen sechs Monaten zu diesem Zweck melden."
    },
    {
      "date": "2025-12-03",
      "id": "139035",
      "original_text": "Löschungsankündigung\nNordrhein-Westfalen Amtsgericht Gelsenkirchen HRB 9971\nder sponsorenring UG (haftungsbeschränkt) – Bottrop",
      "type": "Löschungsankündigung",
      "state": "Nordrhein-Westfalen",
      "amtsgericht": "Amtsgericht Gelsenkirchen",
      "registernummer": "HRB 9971",
      "registerart": "HRB",
      "company_name": "der sponsorenring UG (haftungsbeschränkt)",
      "company_seat": "Bottrop",
      "details": "03.12.2025 (Bekanntmachungsdatum)\n\nNordrhein-Westfalen Amtsgericht Gelsenkirchen HRB 9971\nLöschungsankündigung\n\nder sponsorenring UG (haftungsbeschränkt)\nGesellschaft mit beschränkter Haftung\nBottrop\n\nDas Gericht beabsichtigt, die Gesellschaft der sponsorenring UG (haftungsbeschränkt) mit Sitz in Bottrop, HRB 9971 Amtsgericht Gelsenkirchen, wegen Vermögenslosigkeit zu löschen.\n\nHiermit wird denjenigen, die an der Unterlassung der Löschung ein berechtigtes Interesse haben, gem. § 394 Abs. 2 FamFG Gelegenheit gegeben, gegen dieses Vorhaben binnen eines Monats nach dieser Bekanntmachung Widerspruch einzulegen. Der Widerspruch kann schriftlich oder zu Protokoll der Geschäftsstelle erhoben werden."
    },
    {
      "date": "2025-12-03",
      "id": "139036",
      "original_text": "Löschungsankündigung\nNordrhein-Westfalen Amtsgericht Wuppertal HRB 29977\nPrestige Bauelemente GmbH – Wuppertal",
      "type": "Löschungsankündigung",
      "state": "Nordrhein-Westfalen",
      "amtsgericht": "Amtsgericht Wuppertal",
      "registernummer": "HRB 29977",
      "registerart": "HRB",
      "company_name": "Prestige Bauelemente GmbH",
      "company_seat": "Wuppertal",
      "details": "03.12.2025 (Bekanntmachungsdatum)\n\nNordrhein-Westfalen Amtsgericht Wuppertal HRB 29977\nLöschungsankündigung\n\nPrestige Bauelemente GmbH\nGesellschaft mit beschränkter Haftung\nWuppertal\n\nDas Registergericht beabsichtigt die Gesellschaft von Amts wegen nach § 394 FamFG zu löschen. Die Frist zur Erhebung eines Widerspruchs ist auf einen Monat festgesetzt."
    },
    {
      "date": "2025-12-03",
      "id": "139037",
      "original_text": "Registerbekanntmachung nach dem Umwandlungsgesetz\nNordrhein-Westfalen Amtsgericht Düsseldorf GsR 1160\nChristiaan Kocks und Maximilian Ciupka eGbR – Düsseldorf",
      "type": "Registerbekanntmachung nach dem Umwandlungsgesetz",
      "state": "Nordrhein-Westfalen",
      "amtsgericht": "Amtsgericht Düsseldorf",
      "registernummer": "GsR 1160",
      "registerart": "GsR",
      "company_name": "Christiaan Kocks und Maximilian Ciupka eGbR",
      "company_seat": "Düsseldorf",
      "details": "03.12.2025 (Bekanntmachungsdatum)\n\nNordrhein-Westfalen Amtsgericht Düsseldorf GsR 1160\nRegisterbekanntmachung nach dem Umwandlungsgesetz 03.12.2025 (Eintragungsdatum)\n\nChristiaan Kocks und Maximilian Ciupka eGbR\nGesellschaft bürgerlichen Rechts\nDüsseldorf\n\nDen Gläubigern der an der formwechselnden Umwandlung beteiligten Rechtsträger ist, wenn sie binnen sechs Monaten nach dem Tag, an dem die Eintragung der formwechselnden Umwandlung in das Register des Sitzes desjenigen Rechtsträgers, dessen Gläubiger sie sind, nach § 19 Absatz 3 UmwG als bekanntgemacht gilt, ihren Anspruch nach Grund und Höhe schriftlich anmelden, Sicherheit zu leisten, soweit sie nicht Befriedigung verlangen können. Dieses Recht steht den Gläubigern jedoch nur zu, wenn sie glaubhaft machen, dass durch die formwechselnden Umwandlung die Erfüllung ihrer Forderung gefährdet wird."
    },
    {
      "date": "2025-12-03",
      "id": "139038",
      "original_text": "Löschungsankündigung\nNordrhein-Westfalen Amtsgericht Aachen HRB 19200\nHOMITRANS GmbH – Herzogenrath",
      "type": "Löschungsankündigung",
      "state": "Nordrhein-Westfalen",
      "amtsgericht": "Amtsgericht Aachen",
      "registernummer": "HRB 19200",
      "registerart": "HRB",
      "company_name": "HOMITRANS GmbH",
      "company_seat": "Herzogenrath",
      "details": "03.12.2025 (Bekanntmachungsdatum)\n\nNordrhein-Westfalen Amtsgericht Aachen HRB 19200\nLöschungsankündigung\n\nHOMITRANS GmbH\nGesellschaft mit beschränkter Haftung\nHerzogenrath\n\nDas Registergericht beabsichtigt, von Amts wegen die Gesellschaft wegen Vermögenslosigkeit nach § 394 FamFG zu löschen, weil das Insolvenzverfahren Amtsgericht Aachen (92 IN 26/25) beendet und Vermögen der Gesellschaft nicht mehr erkennbar ist. Zur Geltendmachung des Widerspruchs gegen die beabsichtigte Löschung wird hiermit eine Frist von einem Monat ab Veröffentlichung dieser Ankündigung bestimmt.\nRechtsbehelfsbelehrung:\nGegen diese Verfügung kann Widerspruch eingelegt werden. Zum Widerspruch ist jeder berechtigt, der an der Unterlassung der Löschung ein berechtigtes Interesse hat.\nDer Widerspruch ist bei dem Amtsgericht Aachen, Adalbertsteinweg 92, 52070 Aachen schriftlich in deutscher Sprache oder zur Niederschrift der Geschäftsstelle einzulegen. Der Widerspruch kann auch zur Niederschrift der Geschäftsstelle eines jeden Amtsgerichtes abgegeben werden.\nDer Widerspruch muss spätestens innerhalb der gesetzten Frist nach der Bekanntgabe der Verfügung bei dem Amtsgericht Aachen eingegangen sein. Dies gilt auch dann, wenn der Widerspruch zur Niederschrift der Geschäftsstelle eines anderen Amtsgerichtes abgegeben wurde. Die Frist beginnt mit der Bekanntgabe der Verfügung durch Veröffentlichung. Fällt das Ende der Frist auf einen Sonntag, einen allgemeinen Feiertag oder Sonnabend, so endet die Frist mit Ablauf des nächsten Werktages.\nDer Widerspruch muss die Bezeichnung der angefochtenen Verfügung sowie die Erklärung enthalten, dass Widerspruch gegen diese Verfügung eingelegt wird. Er ist zu unterzeichnen und soll begründet werden.\nDie Einlegung ist auch durch Übertragung eines elektronischen Dokuments an die elektronische Poststelle des Gerichts möglich. Das elektronische Dokument muss für die Bearbeitung durch das Gericht geeignet und mit einer qualifizierten elektronischen Signatur der verantwortenden Person versehen sein oder von der verantwortenden Person signiert und auf einem sicheren Übermittlungsweg gemäß § 130 a ZPO nach näherer Maßgabe der Verordnung über die technischen Rahmenbedingungen des elektronischen Rechtsverkehrs und über das besondere elektronische Behördenpostfach (BGBl. I, S. 3803) eingereicht werden. Weitere Informationen erhalten Sie auf der Internetseite www.justiz.de."
    },
    {
      "date": "2025-12-03",
      "id": "139039",
      "original_text": "Einreichung neuer Dokumente\nNordrhein-Westfalen Amtsgericht Köln HRB 32677\nDSGF Deutsche Servicegesellschaft für Finanzdienstleister mbH – Köln",
      "type": "Einreichung neuer Dokumente",
      "state": "Nordrhein-Westfalen",
      "amtsgericht": "Amtsgericht Köln",
      "registernummer": "HRB 32677",
      "registerart": "HRB",
      "company_name": "DSGF Deutsche Servicegesellschaft für Finanzdienstleister mbH",
      "company_seat": "Köln",
      "details": "03.12.2025 (Bekanntmachungsdatum)\n\nNordrhein-Westfalen Amtsgericht Köln HRB 32677\nEinreichung neuer Dokumente\n\nDSGF Deutsche Servicegesellschaft für Finanzdienstleister mbH\nGesellschaft mit beschränkter Haftung\nKöln\n\nDem Registergericht ist eine Liste der Mitglieder des Aufsichtsrates eingereicht worden."
    },
    {
      "date": "2025-12-03",
      "id": "139040",
      "original_text": "Registerbekanntmachung nach dem Umwandlungsgesetz\nBremen Amtsgericht Bremen HRA 24062\nFriedel & Frische GmbH & Co. KG – Bremen",
      "type": "Registerbekanntmachung nach dem Umwandlungsgesetz",
      "state": "Bremen",
      "amtsgericht": "Amtsgericht Bremen",
      "registernummer": "HRA 24062",
      "registerart": "HRA",
      "company_name": "Friedel & Frische GmbH & Co. KG",
      "company_seat": "Bremen",
      "details": "03.12.2025 (Bekanntmachungsdatum)\n\nBremen Amtsgericht Bremen HRA 24062\nRegisterbekanntmachung nach dem Umwandlungsgesetz 02.12.2025 (Eintragungsdatum)\n\nFriedel & Frische GmbH & Co. KG\nKommanditgesellschaft\nBremen\n\nAls nicht eingetragen wird veröffentlicht: Den Gläubigern der an der Verschmelzung beteiligten Rechtsträger ist, wenn sie binnen sechs Monaten nach dem Tag, an dem die Eintragung der Verschmelzung in das Register des Sitzes desjenigen Rechtsträgers, dessen Gläubiger sie sind, als bekannt gemacht gilt, ihren Anspruch nach Grund und Höhe schriftlich anmelden, Sicherheit zu leisten, soweit sie nicht Befriedigung verlangen können. Dieses Recht steht den Gläubigern jedoch nur zu, wenn sie glaubhaft machen, dass durch die Verschmelzung die Erfüllung ihrer Forderung gefährdet wird. Das Recht, Sicherheitsleistung zu verlangen, steht Gläubigern nicht zu, die im Falle der Insolvenz ein Recht auf vorzugsweise Befriedigung aus einer Deckungsmasse haben, die nach gesetzlicher Vorschrift zu ihrem Schutz errichtet und staatlich überwacht ist."
    },
    {
      "date": "2025-12-03",
      "id": "139041",
      "original_text": "Löschungsankündigung\nBremen Amtsgericht Bremen HRB 36734\nEH Personal GmbH – Bremen",
      "type": "Löschungsankündigung",
      "state": "Bremen",
      "amtsgericht": "Amtsgericht Bremen",
      "registernummer": "HRB 36734",
      "registerart": "HRB",
      "company_name": "EH Personal GmbH",
      "company_seat": "Bremen",
      "details": "03.12.2025 (Bekanntmachungsdatum)\n\nBremen Amtsgericht Bremen HRB 36734\nLöschungsankündigung\n\nEH Personal GmbH\nGesellschaft mit beschränkter Haftung\nBremen\n\nEs ist beabsichtigt die im Handelsregister eingetragene Gesellschaft von Amts wegen gemäß § 394 FamFG zu löschen. Gegen die Löschung kann beim AG Bremen schriftlich oder zu Protokoll der Geschäftsstelle Widerspruch eingelegt werden. Widerspruchsfrist 4 Wochen."
    },
    {
      "date": "2025-12-03",
      "id": "139042",
      "original_text": "Registerbekanntmachung nach dem Umwandlungsgesetz\nBremen Amtsgericht Bremen HRB 36264\nDistrelec Deutschland GmbH – Bremen",
      "type": "Registerbekanntmachung nach dem Umwandlungsgesetz",
      "state": "Bremen",
      "amtsgericht": "Amtsgericht Bremen",
      "registernummer": "HRB 36264",
      "registerart": "HRB",
      "company_name": "Distrelec Deutschland GmbH",
      "company_seat": "Bremen",
      "details": "03.12.2025 (Bekanntmachungsdatum)\n\nBremen Amtsgericht Bremen HRB 36264\nRegisterbekanntmachung nach dem Umwandlungsgesetz 01.12.2025 (Eintragungsdatum)\n\nDistrelec Deutschland GmbH\nGesellschaft mit beschränkter Haftung\nBremen\n\nZu Eintragungsnummer 7 vom 01.12.2025 wird als nicht eingetragen veröffentlicht: Den Gläubigern der an der Verschmelzung beteiligten Rechtsträger ist, wenn sie binnen sechs Monaten nach dem Tag, an dem die Eintragung der Verschmelzung in das Register des Sitzes desjenigen Rechtsträgers, dessen Gläubiger sie sind, als bekannt gemacht gilt, ihren Anspruch nach Grund und Höhe schriftlich anmelden, Sicherheit zu leisten, soweit sie nicht Befriedigung verlangen können. Dieses Recht steht den Gläubigern jedoch nur zu, wenn sie glaubhaft machen, dass durch die Verschmelzung die Erfüllung ihrer Forderung gefährdet wird. Das Recht, Sicherheitsleistung zu verlangen, steht Gläubigern nicht zu, die im Falle der Insolvenz ein Recht auf vorzugsweise Befriedigung aus einer Deckungsmasse haben, die nach gesetzlicher Vorschrift zu ihrem Schutz errichtet und staatlich überwacht ist."
    },
    {
      "date": "2025-12-03",
      "id": "139043",
      "original_text": "Einreichung neuer Dokumente\nBremen Amtsgericht Bremen HRB 19116\nePhilos Aktiengesellschaft – Bremen",
      "type": "Einreichung neuer Dokumente",
      "state": "Bremen",
      "amtsgericht": "Amtsgericht Bremen",
      "registernummer": "HRB 19116",
      "registerart": "HRB",
      "company_name": "ePhilos Aktiengesellschaft",
      "company_seat": "Bremen",
      "details": "03.12.2025 (Bekanntmachungsdatum)\n\nBremen Amtsgericht Bremen HRB 19116\nEinreichung neuer Dokumente\n\nePhilos Aktiengesellschaft\nAktiengesellschaft\nBremen\n\nAls nicht eingetragen wird veröffentlicht: Liste des Aufsichtsrats wurde eingereicht."
    },
    {
      "date": "2025-12-03",
      "id": "139044",
      "original_text": "Einreichung neuer Dokumente\nBremen Amtsgericht Bremen HRB 3354\nWFB Wirtschaftsförderung Bremen GmbH – Bremen",
      "type": "Einreichung neuer Dokumente",
      "state": "Bremen",
      "amtsgericht": "Amtsgericht Bremen",
      "registernummer": "HRB 3354",
      "registerart": "HRB",
      "company_name": "WFB Wirtschaftsförderung Bremen GmbH",
      "company_seat": "Bremen",
      "details": "03.12.2025 (Bekanntmachungsdatum)\n\nBremen Amtsgericht Bremen HRB 3354\nEinreichung neuer Dokumente\n\nWFB Wirtschaftsförderung Bremen GmbH\nGesellschaft mit beschränkter Haftung\nBremen\n\nAls nicht eingetragen wird veröffentlicht: Liste des Aufsichtsrats wurde eingereicht."
    },
    {
      "date": "2025-12-03",
      "id": "139045",
      "original_text": "Registerbekanntmachung nach dem Umwandlungsgesetz\nBremen Amtsgericht Bremen HRB 32357\nDFF Business Services GmbH – Bremen",
      "type": "Registerbekanntmachung nach dem Umwandlungsgesetz",
      "state": "Bremen",
      "amtsgericht": "Amtsgericht Bremen",
      "registernummer": "HRB 32357",
      "registerart": "HRB",
      "company_name": "DFF Business Services GmbH",
      "company_seat": "Bremen",
      "details": "03.12.2025 (Bekanntmachungsdatum)\n\nBremen Amtsgericht Bremen HRB 32357\nRegisterbekanntmachung nach dem Umwandlungsgesetz 02.12.2025 (Eintragungsdatum)\n\nDFF Business Services GmbH\nGesellschaft mit beschränkter Haftung\nBremen\n\nZu Eintragungsnummer 3 vom 02.12.2025 wird als nicht eingetragen veröffentlicht: Den Gläubigern der an der Verschmelzung beteiligten Rechtsträger ist, wenn sie binnen sechs Monaten nach dem Tag, an dem die Eintragung der Verschmelzung in das Register des Sitzes desjenigen Rechtsträgers, dessen Gläubiger sie sind, als bekannt gemacht gilt, ihren Anspruch nach Grund und Höhe schriftlich anmelden, Sicherheit zu leisten, soweit sie nicht Befriedigung verlangen können. Dieses Recht steht den Gläubigern jedoch nur zu, wenn sie glaubhaft machen, dass durch die Verschmelzung die Erfüllung ihrer Forderung gefährdet wird. Das Recht, Sicherheitsleistung zu verlangen, steht Gläubigern nicht zu, die im Falle der Insolvenz ein Recht auf vorzugsweise Befriedigung aus einer Deckungsmasse haben, die nach gesetzlicher Vorschrift zu ihrem Schutz errichtet und staatlich überwacht ist."
    },
    {
      "date": "2025-12-03",
      "id": "139046",
      "original_text": "Registerbekanntmachung nach dem Umwandlungsgesetz\nNordrhein-Westfalen Amtsgericht Duisburg HRA 13138\nNicolosi Besitz UG (haftungsbeschränkt) & Co. KG – Wesel",
      "type": "Registerbekanntmachung nach dem Umwandlungsgesetz",
      "state": "Nordrhein-Westfalen",
      "amtsgericht": "Amtsgericht Duisburg",
      "registernummer": "HRA 13138",
      "registerart": "HRA",
      "company_name": "Nicolosi Besitz UG (haftungsbeschränkt) & Co. KG",
      "company_seat": "Wesel",
      "details": "03.12.2025 (Bekanntmachungsdatum)\n\nNordrhein-Westfalen Amtsgericht Duisburg HRA 13138\nRegisterbekanntmachung nach dem Umwandlungsgesetz 03.12.2025 (Eintragungsdatum)\n\nNicolosi Besitz UG (haftungsbeschränkt) & Co. KG\nKommanditgesellschaft\nWesel\n\nDie Gesellschaft hat Gläubigern, deren Forderungen vor dieser Bekanntmachung begründet worden sind, Sicherheit zu leisten, soweit sie nicht Befriedigung verlangen können, wenn sie sich binnen sechs Monaten zu diesem Zweck melden."
    },
    {
      "date": "2025-12-03",
      "id": "139047",
      "original_text": "Löschungsankündigung\nBremen Amtsgericht Bremen HRB 40835\nAbed ELBE Services UG (haftungsbeschränkt) – Bremen",
      "type": "Löschungsankündigung",
      "state": "Bremen",
      "amtsgericht": "Amtsgericht Bremen",
      "registernummer": "HRB 40835",
      "registerart": "HRB",
      "company_name": "Abed ELBE Services UG (haftungsbeschränkt)",
      "company_seat": "Bremen",
      "details": "03.12.2025 (Bekanntmachungsdatum)\n\nBremen Amtsgericht Bremen HRB 40835\nLöschungsankündigung\n\nAbed ELBE Services UG (haftungsbeschränkt)\nGesellschaft mit beschränkter Haftung\nBremen\n\nEs ist beabsichtigt die im Handelsregister eingetragene Gesellschaft von Amts wegen gemäß § 394 FamFG zu löschen. Gegen die Löschung kann beim AG Bremen schriftlich oder zu Protokoll der Geschäftsstelle Widerspruch eingelegt werden. Widerspruchsfrist 4 Wochen."
    },
    {
      "date": "2025-12-03",
      "id": "139048",
      "original_text": "Löschungsankündigung\nBremen Amtsgericht Bremen HRB 34329\nA & A Trading (Germany) GmbH – Bremen",
      "type": "Löschungsankündigung",
      "state": "Bremen",
      "amtsgericht": "Amtsgericht Bremen",
      "registernummer": "HRB 34329",
      "registerart": "HRB",
      "company_name": "A & A Trading (Germany) GmbH",
      "company_seat": "Bremen",
      "details": "03.12.2025 (Bekanntmachungsdatum)\n\nBremen Amtsgericht Bremen HRB 34329\nLöschungsankündigung\n\nA & A Trading (Germany) GmbH\nGesellschaft mit beschränkter Haftung\nBremen\n\nEs ist beabsichtigt die im Handelsregister eingetragene Gesellschaft von Amts wegen gemäß § 394 FamFG zu löschen. Gegen die Löschung kann beim AG Bremen schriftlich oder zu Protokoll der Geschäftsstelle Widerspruch eingelegt werden. Widerspruchsfrist 4 Wochen."
    },
    {
      "date": "2025-12-03",
      "id": "139049",
      "original_text": "Löschungsankündigung\nBremen Amtsgericht Bremen HRB 28814\nImmo-Unit-GmbH – Bremerhaven",
      "type": "Löschungsankündigung",
      "state": "Bremen",
      "amtsgericht": "Amtsgericht Bremen",
      "registernummer": "HRB 28814",
      "registerart": "HRB",
      "company_name": "Immo-Unit-GmbH",
      "company_seat": "Bremerhaven",
      "details": "03.12.2025 (Bekanntmachungsdatum)\n\nBremen Amtsgericht Bremen HRB 28814\nLöschungsankündigung\n\nImmo-Unit-GmbH\nGesellschaft mit beschränkter Haftung\nBremerhaven\n\nEs ist beabsichtigt die im Handelsregister eingetragene Gesellschaft von Amts wegen gemäß § 394 FamFG zu löschen. Gegen die Löschung kann beim AG Bremen schriftlich oder zu Protokoll der Geschäftsstelle Widerspruch eingelegt werden. Widerspruchsfrist 4 Wochen."
    },
    {
      "date": "2025-12-03",
      "id": "139050",
      "original_text": "Löschungsankündigung\nBremen Amtsgericht Bremen HRB 39435\nEfebio GmbH – Bremen",
      "type": "Löschungsankündigung",
      "state": "Bremen",
      "amtsgericht": "Amtsgericht Bremen",
      "registernummer": "HRB 39435",
      "registerart": "HRB",
      "company_name": "Efebio GmbH",
      "company_seat": "Bremen",
      "details": "03.12.2025 (Bekanntmachungsdatum)\n\nBremen Amtsgericht Bremen HRB 39435\nLöschungsankündigung\n\nEfebio GmbH\nGesellschaft mit beschränkter Haftung\nBremen\n\nEs ist beabsichtigt die im Handelsregister eingetragene Gesellschaft von Amts wegen gemäß § 394 FamFG zu löschen. Gegen die Löschung kann beim AG Bremen schriftlich oder zu Protokoll der Geschäftsstelle Widerspruch eingelegt werden. Widerspruchsfrist 4 Wochen."
    },
    {
      "date": "2025-12-03",
      "id": "139051",
      "original_text": "Löschungsankündigung\nBremen Amtsgericht Bremen HRB 26593\nLa Méche GmbH – Bremen",
      "type": "Löschungsankündigung",
      "state": "Bremen",
      "amtsgericht": "Amtsgericht Bremen",
      "registernummer": "HRB 26593",
      "registerart": "HRB",
      "company_name": "La Méche GmbH",
      "company_seat": "Bremen",
      "details": "03.12.2025 (Bekanntmachungsdatum)\n\nBremen Amtsgericht Bremen HRB 26593\nLöschungsankündigung\n\nLa Méche GmbH\nGesellschaft mit beschränkter Haftung\nBremen\n\nEs ist beabsichtigt die im Handelsregister eingetragene Gesellschaft von Amts wegen gemäß § 394 FamFG zu löschen. Gegen die Löschung kann beim AG Bremen schriftlich oder zu Protokoll der Geschäftsstelle Widerspruch eingelegt werden. Widerspruchsfrist 4 Wochen."
    },
    {
      "date": "2025-12-03",
      "id": "139052",
      "original_text": "Löschungsankündigung\nNordrhein-Westfalen Amtsgericht Düsseldorf HRB 94799\nAS Luxury Holding UG (haftungsbeschränkt) – Monheim am Rhein",
      "type": "Löschungsankündigung",
      "state": "Nordrhein-Westfalen",
      "amtsgericht": "Amtsgericht Düsseldorf",
      "registernummer": "HRB 94799",
      "registerart": "HRB",
      "company_name": "AS Luxury Holding UG (haftungsbeschränkt)",
      "company_seat": "Monheim am Rhein",
      "details": "03.12.2025 (Bekanntmachungsdatum)\n\nNordrhein-Westfalen Amtsgericht Düsseldorf HRB 94799\nLöschungsankündigung\n\nAS Luxury Holding UG (haftungsbeschränkt)\nGesellschaft mit beschränkter Haftung\nMonheim am Rhein\n\nDas Registergericht beabsichtigt die Gesellschaft von Amts wegen nach § 394 FamFG zu löschen. Die Frist zur Erhebung eines Widerspruchs ist auf 3 Wochen festgesetzt.\n\nRechtsbehelfsbelehrung:\nDas Widerspruchsrecht steht jedem zu, der an der Unterlassung der Löschung ein berechtigtes Interesse hat. Der Widerspruch ist bei dem Amtsgericht Düsseldorf -Registergericht-, Werdener Straße 1, 40227 Düsseldorf schriftlich in deutscher Sprache oder zur Niederschrift der Geschäftsstelle einzulegen. Der Widerspruch kann auch zur Niederschrift der Geschäftsstelle eines jeden Amtsgerichtes abgegeben werden. Die Einlegung ist auch durch Übertragung eines elektronischen Dokuments an die elektronische Poststelle des Gerichts möglich. Das elektronische Dokument muss für die Bearbeitung durch das Gericht geeignet und mit einer qualifizierten elektronischen Signatur der verantwortenden Person versehen sein oder von der verantwortenden Person signiert und auf einem sicheren Übermittlungsweg gemäß § 130a ZPO nach näherer Maßgabe der Verordnung über die technischen Rahmenbedingungen des elektronischen Rechtsverkehrs und über das besondere elektronische Behördenpostfach (BGBl. I, S.3803) eingereicht werden. Weitere Informationen erhalten Sie auf der Internetseite www.justiz.de.\nDer Widerspruch muss spätestens innerhalb der gesetzten Frist nach dem Datum der Bekanntmachung der Löschungsankündigung bei dem Amtsgericht - Registergericht - Düsseldorf eingegangen sein.  Dies gilt auch dann, wenn der Widerspruch zur Niederschrift der Geschäftsstelle eines anderen Amtsgerichtes abgegeben wurde. Die Frist beginnt mit dem Tage der Bekanntmachung der Löschungsankündigung in dem für die Bekanntmachung der Eintragungen in das Handelsregister bestimmten elektronischen Informations- und Kommunikationssystem nach § 10 des Handelsgesetzbuches. Fällt das Ende der Frist auf einen Sonntag, einen allgemeinen Feiertag oder Sonnabend, so endet die Frist mit Ablauf des nächsten Werktages.\nDer Widerspruch muss die Bezeichnung der angefochtenen Löschungsankündigung sowie die Erklärung enthalten, dass Widerspruch gegen diese Löschungsankündigung eingelegt wird. Er ist zu unterzeichnen und soll begründet werden."
    },
    {
      "date": "2025-12-03",
      "id": "139053",
      "original_text": "Löschungsankündigung\nNordrhein-Westfalen Amtsgericht Köln HRA 28136\nDB Kurierdienst UG (haftungsbeschränkt) & Co KG – Bergneustadt",
      "type": "Löschungsankündigung",
      "state": "Nordrhein-Westfalen",
      "amtsgericht": "Amtsgericht Köln",
      "registernummer": "HRA 28136",
      "registerart": "HRA",
      "company_name": "DB Kurierdienst UG (haftungsbeschränkt) & Co KG",
      "company_seat": "Bergneustadt",
      "details": "03.12.2025 (Bekanntmachungsdatum)\n\nNordrhein-Westfalen Amtsgericht Köln HRA 28136\nLöschungsankündigung\n\nDB Kurierdienst UG (haftungsbeschränkt) & Co KG\nKommanditgesellschaft\nBergneustadt\n\nDas Registergericht beabsichtigt die Firma von Amts wegen nach § 394 FamFG zu löschen. Die Frist zur Erhebung eines Widerspruchs ist auf einen Monat festgesetzt."
    },
    {
      "date": "2025-12-03",
      "id": "139054",
      "original_text": "Löschungsankündigung\nNordrhein-Westfalen Amtsgericht Duisburg HRB 38400\nBlitz Bahngleissicherung GmbH – Oberhausen",
      "type": "Löschungsankündigung",
      "state": "Nordrhein-Westfalen",
      "amtsgericht": "Amtsgericht Duisburg",
      "registernummer": "HRB 38400",
      "registerart": "HRB",
      "company_name": "Blitz Bahngleissicherung GmbH",
      "company_seat": "Oberhausen",
      "details": "03.12.2025 (Bekanntmachungsdatum)\n\nNordrhein-Westfalen Amtsgericht Duisburg HRB 38400\nLöschungsankündigung\n\nBlitz Bahngleissicherung GmbH\nGesellschaft mit beschränkter Haftung\nOberhausen\n\nHR B 38400\nBlitz Bahngleissicherung GmbH,\nOberhausen,\nBottroper Straße 111,\n46117 Oberhausen.\nDas Registergericht beabsichtigt, die im Handelsregister eingetragene Gesellschaft gemäß § 394 Absatz 1 FamFG wegen Vermögenslosigkeit von Amts wegen zu löschen. Gegen diese Verfügung kann Widerspruch eingelegt werden. Die Frist zur Erhebung eines Widerspruchs gegen die beabsichtigte Löschung von Amts wegen ist auf drei Monate festgesetzt. Rechtsbehelfsbelehrung Der Widerspruch ist bei dem Amtsgericht Duisburg, Kardinal-Galen-Str. 124-132, 47058 Duisburg schriftlich in deutscher Sprache oder zur Niederschrift der Geschäftsstelle einzulegen. Der Widerspruch kann auch zur Niederschrift der Geschäftsstelle eines jeden Amtsgerichtes abgegeben werden. Die Einlegung ist auch durch Übertragung eines elektronischen Dokuments an die elektronische Poststelle des Gerichts möglich. Das elektronische Dokument muss für die Bearbeitung durch das Gericht geeignet und mit einer qualifizierten elektronischen Signatur der verantwortenden Person versehen sein oder von der verantwortenden Person signiert und auf einem sicheren Übermittlungsweg gemäß § 130 a ZPO nach näherer Maßgabe der Verordnung über die technischen Rahmenbedingungen des elektronischen Rechtsverkehrs und über das besondere elektronische Behördenpostfach (BGBl. I, S. 3803) eingereicht werden. Weitere Informationen erhalten Sie auf der Internetseite www.justiz.de <http://www.justiz.de>. Der Widerspruch muss spätestens innerhalb der gesetzten Frist bei dem Amtsgericht Duisburg eingegangen sein. Dies gilt auch dann, wenn der Widerspruch zur Niederschrift der Geschäftsstelle eines anderen Amtsgerichtes abgegeben wurde. Die Frist beginnt mit der Veröffentlichung. Fällt das Ende der Frist auf einen Sonntag, einen allgemeinen Feiertag oder Sonnabend, so endet die Frist mit Ablauf des nächsten Werktages. Der Widerspruch muss die Bezeichnung der angefochtenen Verfügung sowie die Erklärung enthalten, dass Widerspruch gegen diese Verfügung eingelegt wird. Er ist zu unterzeichnen und soll begründet werden."
    },
    {
      "date": "2025-12-03",
      "id": "139055",
      "original_text": "Registerbekanntmachung nach dem Umwandlungsgesetz\nNordrhein-Westfalen Amtsgericht Duisburg HRA 13137\nTornetta Besitz UG (haftungsbeschränkt) & Co. KG – Wesel",
      "type": "Registerbekanntmachung nach dem Umwandlungsgesetz",
      "state": "Nordrhein-Westfalen",
      "amtsgericht": "Amtsgericht Duisburg",
      "registernummer": "HRA 13137",
      "registerart": "HRA",
      "company_name": "Tornetta Besitz UG (haftungsbeschränkt) & Co. KG",
      "company_seat": "Wesel",
      "details": "03.12.2025 (Bekanntmachungsdatum)\n\nNordrhein-Westfalen Amtsgericht Duisburg HRA 13137\nRegisterbekanntmachung nach dem Umwandlungsgesetz 03.12.2025 (Eintragungsdatum)\n\nTornetta Besitz UG (haftungsbeschränkt) & Co. KG\nKommanditgesellschaft\nWesel\n\nDie Gesellschaft hat Gläubigern, deren Forderungen vor dieser Bekanntmachung begründet worden sind, Sicherheit zu leisten, soweit sie nicht Befriedigung verlangen können, wenn sie sich binnen sechs Monaten zu diesem Zweck melden."
    },
    {
      "date": "2025-12-03",
      "id": "139056",
      "original_text": "Einreichung neuer Dokumente\nNordrhein-Westfalen Amtsgericht Köln HRB 86922\nStröer SE & Co. KGaA – Köln",
      "type": "Einreichung neuer Dokumente",
      "state": "Nordrhein-Westfalen",
      "amtsgericht": "Amtsgericht Köln",
      "registernummer": "HRB 86922",
      "registerart": "HRB",
      "company_name": "Ströer SE & Co. KGaA",
      "company_seat": "Köln",
      "details": "03.12.2025 (Bekanntmachungsdatum)\n\nNordrhein-Westfalen Amtsgericht Köln HRB 86922\nEinreichung neuer Dokumente\n\nStröer SE & Co. KGaA\nKommanditgesellschaft auf Aktien\nKöln\n\nDem Registergericht ist eine Liste der Mitglieder des Aufsichtsrates eingereicht worden."
    },
    {
      "date": "2025-12-03",
      "id": "139057",
      "original_text": "Löschungsankündigung\nNordrhein-Westfalen Amtsgericht Duisburg HRA 10001\nWeseler Stahlbau Industriemontagen GmbH und Co. KG – Voerde",
      "type": "Löschungsankündigung",
      "state": "Nordrhein-Westfalen",
      "amtsgericht": "Amtsgericht Duisburg",
      "registernummer": "HRA 10001",
      "registerart": "HRA",
      "company_name": "Weseler Stahlbau Industriemontagen GmbH und Co. KG",
      "company_seat": "Voerde",
      "details": "03.12.2025 (Bekanntmachungsdatum)\n\nNordrhein-Westfalen Amtsgericht Duisburg HRA 10001\nLöschungsankündigung\n\nWeseler Stahlbau Industriemontagen GmbH und Co. KG\nKommanditgesellschaft\nVoerde\n\nHRA 10001\nWeseler Stahlbau Industriemontagen GmbH und Co. KG\nsoll von Amts wegen gem. § 394 FamFG wegen Vermögenslosigkeit gelöscht werden. Widerspruchsfrist: 3 Monate.\n\nRechtsbehelfsbelehrung\nDer Widerspruch ist bei dem Amtsgericht Duisburg, Registergericht, Kardinal-Galen-Straße 124-132, 47058 Duisburg, schriftlich einzulegen. Der Widerspruch kann auch zur Niederschrift der Geschäftsstelle eines jeden Amtsgerichts abgegeben werden.\nDie Einlegung ist auch durch Übertragung eines elektronischen Dokuments an die elektronische Poststelle des Gerichts möglich. Das elektronische Dokument muss für die Bearbeitung durch das Gericht geeignet und mit einer qualifizierten elektronischen Signatur der verantwortenden Person versehen sein oder von der verantwortenden Person signiert und auf einem sicheren Übermittlungsweg gemäß § 130 a ZPO nach näherer Maßgabe der Verordnung über die technischen Rahmenbedingungen des elektronischen Rechtsverkehrs und über das besondere elektronische Behördenpostfach (BGBl. I, S. 3803) eingereicht werden. Weitere Informationen erhalten Sie auf der Internetseite www.justiz.de.\n\nDer Widerspruch muss spätestens innerhalb der gesetzten Frist bei dem Amtsgericht Duisburg eingegangen sein. Dies gilt auch dann, wenn der Widerspruch zur Niederschrift der Geschäftsstelle eines anderen Amtsgerichtes abgegeben wurde. Die Frist beginnt mit der Veröffentlichung. Fällt das Ende der Frist auf einen Sonntag, einen allgemeinen Feiertag oder Sonnabend, so endet die Frist mit Ablauf des nächsten Werktages.\n\nDer Widerspruch muss die Bezeichnung der angefochtenen Verfügung sowie die Erklärung enthalten, dass Widerspruch gegen diese Verfügung eingelegt wird. Er ist zu unterzeichnen und soll begründet werden."
    },
    {
      "date": "2025-12-03",
      "id": "139058",
      "original_text": "Einreichung neuer Dokumente\nNordrhein-Westfalen Amtsgericht Köln HRB 94207\nJPR KGaA – Köln",
      "type": "Einreichung neuer Dokumente",
      "state": "Nordrhein-Westfalen",
      "amtsgericht": "Amtsgericht Köln",
      "registernummer": "HRB 94207",
      "registerart": "HRB",
      "company_name": "JPR KGaA",
      "company_seat": "Köln",
      "details": "03.12.2025 (Bekanntmachungsdatum)\n\nNordrhein-Westfalen Amtsgericht Köln HRB 94207\nEinreichung neuer Dokumente\n\nJPR KGaA\nKommanditgesellschaft auf Aktien\nKöln\n\nDem Registergericht ist eine Liste der Mitglieder des Aufsichtsrates eingereicht worden."
    },
    {
      "date": "2025-12-03",
      "id": "139059",
      "original_text": "Löschungsankündigung\nNordrhein-Westfalen Amtsgericht Bonn HRB 24486\nB&G Management und Consulting GmbH – Bonn",
      "type": "Löschungsankündigung",
      "state": "Nordrhein-Westfalen",
      "amtsgericht": "Amtsgericht Bonn",
      "registernummer": "HRB 24486",
      "registerart": "HRB",
      "company_name": "B&G Management und Consulting GmbH",
      "company_seat": "Bonn",
      "details": "03.12.2025 (Bekanntmachungsdatum)\n\nNordrhein-Westfalen Amtsgericht Bonn HRB 24486\nLöschungsankündigung\n\nB&G Management und Consulting GmbH\nGesellschaft mit beschränkter Haftung\nBonn\n\nDas Registergericht beabsichtigt die Gesellschaft von Amts wegen nach § 394 FamFG zu löschen. Die Frist zur Erhebung eines Widerspruchs ist auf einen Monat festgesetzt."
    },
    {
      "date": "2025-12-03",
      "id": "139060",
      "original_text": "Registerbekanntmachung nach dem Umwandlungsgesetz\nThüringen Amtsgericht Jena HRB 406216\nBIPONTINA Stahlhandelsgesellschaft mit beschränkter Haftung – Nordhausen",
      "type": "Registerbekanntmachung nach dem Umwandlungsgesetz",
      "state": "Thüringen",
      "amtsgericht": "Amtsgericht Jena",
      "registernummer": "HRB 406216",
      "registerart": "HRB",
      "company_name": "BIPONTINA Stahlhandelsgesellschaft mit beschränkter Haftung",
      "company_seat": "Nordhausen",
      "details": "03.12.2025 (Bekanntmachungsdatum)\n\nThüringen Amtsgericht Jena HRB 406216\nRegisterbekanntmachung nach dem Umwandlungsgesetz 03.12.2025 (Eintragungsdatum)\n\nBIPONTINA Stahlhandelsgesellschaft mit beschränkter Haftung\nGesellschaft mit beschränkter Haftung\nNordhausen\n\nNicht eingetragen: Den Gläubigern der an der Verschmelzung beteiligten Rechtsträger, ist wenn sie binnen sechs Monaten nach dem Tag, an dem die Eintragung der Verschmelzung in das Register des Sitzes desjenigen Rechtsträgers, dessen Gläubiger sie sind,  nach § 19 Abs. 3 UmwG als bekanntgemacht gilt, ihren Anspruch nach Grund und Höhe schriftlich anmelden, Sicherheit zu leisten, soweit sie nicht Befriedigung verlangen können. Dieses Recht steht ihnen jedoch nur zu, wenn sie glaubhaft machen, daß durch die Verschmelzung die Erfüllung ihrer Forderung gefährdet wird."
    },
    {
      "date": "2025-12-03",
      "id": "139061",
      "original_text": "Registerbekanntmachung nach dem Umwandlungsgesetz\nThüringen Amtsgericht Jena HRB 401626\nNordhäuser Stahl GmbH – Nordhausen",
      "type": "Registerbekanntmachung nach dem Umwandlungsgesetz",
      "state": "Thüringen",
      "amtsgericht": "Amtsgericht Jena",
      "registernummer": "HRB 401626",
      "registerart": "HRB",
      "company_name": "Nordhäuser Stahl GmbH",
      "company_seat": "Nordhausen",
      "details": "03.12.2025 (Bekanntmachungsdatum)\n\nThüringen Amtsgericht Jena HRB 401626\nRegisterbekanntmachung nach dem Umwandlungsgesetz 03.12.2025 (Eintragungsdatum)\n\nNordhäuser Stahl GmbH\nGesellschaft mit beschränkter Haftung\nNordhausen\n\nNicht eingetragen: Den Gläubigern der an der Verschmelzung beteiligten Rechtsträger, ist wenn sie binnen sechs Monaten nach dem Tag, an dem die Eintragung der Verschmelzung in das Register des Sitzes desjenigen Rechtsträgers, dessen Gläubiger sie sind,  nach § 19 Abs. 3 UmwG als bekanntgemacht gilt, ihren Anspruch nach Grund und Höhe schriftlich anmelden, Sicherheit zu leisten, soweit sie nicht Befriedigung verlangen können. Dieses Recht steht ihnen jedoch nur zu, wenn sie glaubhaft machen, daß durch die Verschmelzung die Erfüllung ihrer Forderung gefährdet wird."
    },
    {
      "date": "2025-12-03",
      "id": "139062",
      "original_text": "Registerbekanntmachung nach dem Umwandlungsgesetz\nThüringen Amtsgericht Jena HRB 515800\nHD Versicherungsmakler GmbH – Jena",
      "type": "Registerbekanntmachung nach dem Umwandlungsgesetz",
      "state": "Thüringen",
      "amtsgericht": "Amtsgericht Jena",
      "registernummer": "HRB 515800",
      "registerart": "HRB",
      "company_name": "HD Versicherungsmakler GmbH",
      "company_seat": "Jena",
      "details": "03.12.2025 (Bekanntmachungsdatum)\n\nThüringen Amtsgericht Jena HRB 515800\nRegisterbekanntmachung nach dem Umwandlungsgesetz 17.11.2025 (Eintragungsdatum)\n\nHD Versicherungsmakler GmbH\nGesellschaft mit beschränkter Haftung\nJena\n\nNicht eingetragen: Den Gläubigern der an der Verschmelzung beteiligten Rechtsträger, ist wenn sie binnen sechs Monaten nach dem Tag, an dem die Eintragung der Verschmelzung in das Register des Sitzes desjenigen Rechtsträgers, dessen Gläubiger sie sind,  nach § 19 Abs. 3 UmwG als bekanntgemacht gilt, ihren Anspruch nach Grund und Höhe schriftlich anmelden, Sicherheit zu leisten, soweit sie nicht Befriedigung verlangen können. Dieses Recht steht ihnen jedoch nur zu, wenn sie glaubhaft machen, daß durch die Verschmelzung die Erfüllung ihrer Forderung gefährdet wird."
    },
    {
      "date": "2025-12-03",
      "id": "139063",
      "original_text": "Registerbekanntmachung nach dem Umwandlungsgesetz\nThüringen Amtsgericht Jena HRA 507174\n969 Bulgo, Inh. Anh Tiên Kiêu eK – Jena",
      "type": "Registerbekanntmachung nach dem Umwandlungsgesetz",
      "state": "Thüringen",
      "amtsgericht": "Amtsgericht Jena",
      "registernummer": "HRA 507174",
      "registerart": "HRA",
      "company_name": "969 Bulgo, Inh. Anh Tiên Kiêu eK",
      "company_seat": "Jena",
      "details": "03.12.2025 (Bekanntmachungsdatum)\n\nThüringen Amtsgericht Jena HRA 507174\nRegisterbekanntmachung nach dem Umwandlungsgesetz 03.12.2025 (Eintragungsdatum)\n\n969 Bulgo, Inh. Anh Tiên Kiêu eK\nEinzelkaufmann / Einzelkauffrau\nJena\n\nNicht eingetragen: Den Gläubigern der an der Ausgliederung beteiligten Rechtsträger, ist wenn sie binnen sechs Monaten nach dem Tag, an dem die Eintragung der Ausgliederung in das Register des Sitzes desjenigen Rechtsträgers, dessen Gläubiger sie sind, nach §§125, 19 Abs. 3 UmwG als bekanntgemacht gilt, ihren Anspruch nach Grund und Höhe schriftlich anmelden, Sicherheit zu leisten, soweit sie nicht Befriedigung verlangen können. Dieses Recht steht ihnen jedoch nur zu, wenn sie glaubhaft machen, daß durch die Ausgliederung die Erfüllung ihrer Forderung gefährdet wird."
    },
    {
      "date": "2025-12-03",
      "id": "139064",
      "original_text": "Löschungsankündigung\nThüringen Amtsgericht Jena HRB 508086\nWAK Verteilerdienst GmbH – Bad Salzungen",
      "type": "Löschungsankündigung",
      "state": "Thüringen",
      "amtsgericht": "Amtsgericht Jena",
      "registernummer": "HRB 508086",
      "registerart": "HRB",
      "company_name": "WAK Verteilerdienst GmbH",
      "company_seat": "Bad Salzungen",
      "details": "03.12.2025 (Bekanntmachungsdatum)\n\nThüringen Amtsgericht Jena HRB 508086\nLöschungsankündigung\n\nWAK Verteilerdienst GmbH\nGesellschaft mit beschränkter Haftung\nBad Salzungen\n\nDas Registergericht beabsichtigt, die im Handelsregister eingetragene Gesellschaft wegen Vermögenslosigkeit nach § 394 FamFG von Amts wegen zu löschen. Die Frist zur Erhebung eines Widerspruchs gegen die beabsichtigte Löschung wird auf 6 Wochen festgesetzt."
    },
    {
      "date": "2025-12-03",
      "id": "139065",
      "original_text": "Registerbekanntmachung nach dem Umwandlungsgesetz\nThüringen Amtsgericht Jena HRB 522010\n969 Kyoto GmbH – Jena",
      "type": "Registerbekanntmachung nach dem Umwandlungsgesetz",
      "state": "Thüringen",
      "amtsgericht": "Amtsgericht Jena",
      "registernummer": "HRB 522010",
      "registerart": "HRB",
      "company_name": "969 Kyoto GmbH",
      "company_seat": "Jena",
      "details": "03.12.2025 (Bekanntmachungsdatum)\n\nThüringen Amtsgericht Jena HRB 522010\nRegisterbekanntmachung nach dem Umwandlungsgesetz 03.12.2025 (Eintragungsdatum)\n\n969 Kyoto GmbH\nGesellschaft mit beschränkter Haftung\nJena\n\nNicht eingetragen: Den Gläubigern der an der Ausgliederung beteiligten Rechtsträger, ist wenn sie binnen sechs Monaten nach dem Tag, an dem die Eintragung der Ausgliederung in das Register des Sitzes desjenigen Rechtsträgers, dessen Gläubiger sie sind, nach §§125, 19 Abs. 3 UmwG als bekanntgemacht gilt, ihren Anspruch nach Grund und Höhe schriftlich anmelden, Sicherheit zu leisten, soweit sie nicht Befriedigung verlangen können. Dieses Recht steht ihnen jedoch nur zu, wenn sie glaubhaft machen, daß durch die Ausgliederung die Erfüllung ihrer Forderung gefährdet wird."
    },
    {
      "date": "2025-12-03",
      "id": "139066",
      "original_text": "Löschungsankündigung\nNordrhein-Westfalen Amtsgericht Köln HRB 54995\nPHOTO STAR Gesellschaft für fotografische Produkte mbH – Bergheim",
      "type": "Löschungsankündigung",
      "state": "Nordrhein-Westfalen",
      "amtsgericht": "Amtsgericht Köln",
      "registernummer": "HRB 54995",
      "registerart": "HRB",
      "company_name": "PHOTO STAR Gesellschaft für fotografische Produkte mbH",
      "company_seat": "Bergheim",
      "details": "03.12.2025 (Bekanntmachungsdatum)\n\nNordrhein-Westfalen Amtsgericht Köln HRB 54995\nLöschungsankündigung 07.03.2025 (Eintragungsdatum)\n\nPHOTO STAR Gesellschaft für fotografische Produkte mbH\nGesellschaft mit beschränkter Haftung\nBergheim\n\nDas Registergericht beabsichtigt die Gesellschaft von Amts wegen nach § 394 FamFG zu löschen. Die Frist zur Erhebung eines Widerspruchs ist auf einen Monat festgesetzt."
    },
    {
      "date": "2025-12-03",
      "id": "139067",
      "original_text": "Registerbekanntmachung nach dem Umwandlungsgesetz\nHessen Amtsgericht Marburg HRA 2126\nHotel Gasthaus \"Zur Sonne\" Enrico Tontara – Marburg",
      "type": "Registerbekanntmachung nach dem Umwandlungsgesetz",
      "state": "Hessen",
      "amtsgericht": "Amtsgericht Marburg",
      "registernummer": "HRA 2126",
      "registerart": "HRA",
      "company_name": "Hotel Gasthaus \"Zur Sonne\" Enrico Tontara",
      "company_seat": "Marburg",
      "details": "03.12.2025 (Bekanntmachungsdatum)\n\nHessen Amtsgericht Marburg HRA 2126\nRegisterbekanntmachung nach dem Umwandlungsgesetz 03.12.2025 (Eintragungsdatum)\n\nHotel Gasthaus \"Zur Sonne\" Enrico Tontara\nEinzelkaufmann / Einzelkauffrau\nMarburg\n\nDen Gläubigern der an der Ausgliederung beteiligten Rechtsträger ist, wenn sie binnen sechs Monaten nach dem Tag, an dem die Eintragung der Ausgliederung in das Register des Sitzes desjenigen Rechtsträgers, dessen Gläubiger sie sind, nach §§ 125, 19 Absatz 3 UmwG bekannt gemacht worden ist, ihren Anspruch nach Grund und Höhe schriftlich anmelden, Sicherheit zu leisten, soweit sie nicht Befriedigung verlangen können. Dieses Recht steht den Gläubigern jedoch nur zu, wenn sie glaubhaft machen, dass durch die Ausgliederung die Erfüllung ihrer Forderung gefährdet wird."
    },
    {
      "date": "2025-12-03",
      "id": "139068",
      "original_text": "Einreichung neuer Dokumente\nHessen Amtsgericht Frankfurt am Main HRB 50977\nDB Regio Aktiengesellschaft – Frankfurt am Main",
      "type": "Einreichung neuer Dokumente",
      "state": "Hessen",
      "amtsgericht": "Amtsgericht Frankfurt am Main",
      "registernummer": "HRB 50977",
      "registerart": "HRB",
      "company_name": "DB Regio Aktiengesellschaft",
      "company_seat": "Frankfurt am Main",
      "details": "03.12.2025 (Bekanntmachungsdatum)\n\nHessen Amtsgericht Frankfurt am Main HRB 50977\nEinreichung neuer Dokumente 03.12.2025 (Eintragungsdatum)\n\nDB Regio Aktiengesellschaft\nAktiengesellschaft\nFrankfurt am Main\n\nDurch eine Änderung in den Personen der Aufsichtsratsmitglieder ist eine Liste der Mitglieder des Aufsichtsrates zum Handelsregister eingereicht worden."
    },
    {
      "date": "2025-12-03",
      "id": "139069",
      "original_text": "Registerbekanntmachung nach dem Umwandlungsgesetz\nHessen Amtsgericht Frankfurt am Main HRB 115792\nBAWAG Group Advisors International GmbH – Eschborn",
      "type": "Registerbekanntmachung nach dem Umwandlungsgesetz",
      "state": "Hessen",
      "amtsgericht": "Amtsgericht Frankfurt am Main",
      "registernummer": "HRB 115792",
      "registerart": "HRB",
      "company_name": "BAWAG Group Advisors International GmbH",
      "company_seat": "Eschborn",
      "details": "03.12.2025 (Bekanntmachungsdatum)\n\nHessen Amtsgericht Frankfurt am Main HRB 115792\nRegisterbekanntmachung nach dem Umwandlungsgesetz 03.12.2025 (Eintragungsdatum)\n\nBAWAG Group Advisors International GmbH\nGesellschaft mit beschränkter Haftung\nEschborn\n\nDen Gläubigern der an der Verschmelzung beteiligten Rechtsträger ist, wenn sie binnen sechs Monaten nach dem Tag, an dem die Eintragung der Verschmelzung in das Register des Sitzes desjenigen Rechtsträgers, dessen Gläubiger sie sind, nach § 19 Absatz 3 UmwG bekannt gemacht worden ist, ihren Anspruch nach Grund und Höhe schriftlich anmelden, Sicherheit zu leisten, soweit sie nicht Befriedigung verlangen können. Dieses Recht steht den Gläubigern jedoch nur zu, wenn sie glaubhaft machen, dass durch die Verschmelzung die Erfüllung ihrer Forderung gefährdet wird."
    },
    {
      "date": "2025-12-03",
      "id": "139070",
      "original_text": "Registerbekanntmachung nach dem Umwandlungsgesetz\nHessen Amtsgericht Offenbach am Main HRB 49045\nEVO Ressourcen GmbH – Offenbach am Main",
      "type": "Registerbekanntmachung nach dem Umwandlungsgesetz",
      "state": "Hessen",
      "amtsgericht": "Amtsgericht Offenbach am Main",
      "registernummer": "HRB 49045",
      "registerart": "HRB",
      "company_name": "EVO Ressourcen GmbH",
      "company_seat": "Offenbach am Main",
      "details": "03.12.2025 (Bekanntmachungsdatum)\n\nHessen Amtsgericht Offenbach am Main HRB 49045\nRegisterbekanntmachung nach dem Umwandlungsgesetz 03.12.2025 (Eintragungsdatum)\n\nEVO Ressourcen GmbH\nGesellschaft mit beschränkter Haftung\nOffenbach am Main\n\nDen Gläubigern der an der Verschmelzung beteiligten Rechtsträger ist, wenn sie binnen sechs Monaten nach dem Tag, an dem die Eintragung der Verschmelzung in das Register des Sitzes desjenigen Rechtsträgers, dessen Gläubiger sie sind, nach § 19 Absatz 3 UmwG bekannt gemacht worden ist, ihren Anspruch nach Grund und Höhe schriftlich anmelden, Sicherheit zu leisten, soweit sie nicht Befriedigung verlangen können. Dieses Recht steht den Gläubigern jedoch nur zu, wenn sie glaubhaft machen, dass durch die Verschmelzung die Erfüllung ihrer Forderung gefährdet wird."
    },
    {
      "date": "2025-12-03",
      "id": "139071",
      "original_text": "Registerbekanntmachung nach dem Umwandlungsgesetz\nHessen Amtsgericht Wiesbaden HRB 33509\nGFI - Rhein-Main GmbH – Wiesbaden",
      "type": "Registerbekanntmachung nach dem Umwandlungsgesetz",
      "state": "Hessen",
      "amtsgericht": "Amtsgericht Wiesbaden",
      "registernummer": "HRB 33509",
      "registerart": "HRB",
      "company_name": "GFI - Rhein-Main GmbH",
      "company_seat": "Wiesbaden",
      "details": "03.12.2025 (Bekanntmachungsdatum)\n\nHessen Amtsgericht Wiesbaden HRB 33509\nRegisterbekanntmachung nach dem Umwandlungsgesetz 03.12.2025 (Eintragungsdatum)\n\nGFI - Rhein-Main GmbH\nGesellschaft mit beschränkter Haftung\nWiesbaden\n\nDen Gläubigern der an der Verschmelzung beteiligten Rechtsträger ist, wenn sie binnen sechs Monaten nach dem Tag, an dem die Eintragung der Verschmelzung in das Register des Sitzes derjenigen Rechtsträger deren Gläubiger sie sind, nach § 19 Absatz 3 UmwG bekannt gemacht worden ist, ihren Anspruch nach Grund und Höhe schriftlich anmelden, Sicherheit zu leisten, soweit sie nicht Befriedigung verlangen können. Dieses Recht steht den Gläubigern jedoch nur zu, wenn sie glaubhaft machen, dass durch die Verschmelzung die Erfüllung ihrer Forderung gefährdet wird."
    },
    {
      "date": "2025-12-03",
      "id": "139072",
      "original_text": "Registerbekanntmachung nach dem Umwandlungsgesetz\nHessen Amtsgericht Offenbach am Main HRB 43452\nBiokraft Naturbrennstoffe GmbH – Offenbach",
      "type": "Registerbekanntmachung nach dem Umwandlungsgesetz",
      "state": "Hessen",
      "amtsgericht": "Amtsgericht Offenbach am Main",
      "registernummer": "HRB 43452",
      "registerart": "HRB",
      "company_name": "Biokraft Naturbrennstoffe GmbH",
      "company_seat": "Offenbach",
      "details": "03.12.2025 (Bekanntmachungsdatum)\n\nHessen Amtsgericht Offenbach am Main HRB 43452\nRegisterbekanntmachung nach dem Umwandlungsgesetz 03.12.2025 (Eintragungsdatum)\n\nBiokraft Naturbrennstoffe GmbH\nGesellschaft mit beschränkter Haftung\nOffenbach\n\nDen Gläubigern der an der Verschmelzung beteiligten Rechtsträger ist, wenn sie binnen sechs Monaten nach dem Tag, an dem die Eintragung der Verschmelzung in das Register des Sitzes desjenigen Rechtsträgers, dessen Gläubiger sie sind, nach § 19 Absatz 3 UmwG bekannt gemacht worden ist, ihren Anspruch nach Grund und Höhe schriftlich anmelden, Sicherheit zu leisten, soweit sie nicht Befriedigung verlangen können. Dieses Recht steht den Gläubigern jedoch nur zu, wenn sie glaubhaft machen, dass durch die Verschmelzung die Erfüllung ihrer Forderung gefährdet wird."
    },
    {
      "date": "2025-12-03",
      "id": "139073",
      "original_text": "Registerbekanntmachung nach dem Umwandlungsgesetz\nHessen Amtsgericht Hanau HRA 94386\nKanalreinigung Weisgerber KG – Birstein",
      "type": "Registerbekanntmachung nach dem Umwandlungsgesetz",
      "state": "Hessen",
      "amtsgericht": "Amtsgericht Hanau",
      "registernummer": "HRA 94386",
      "registerart": "HRA",
      "company_name": "Kanalreinigung Weisgerber KG",
      "company_seat": "Birstein",
      "details": "03.12.2025 (Bekanntmachungsdatum)\n\nHessen Amtsgericht Hanau HRA 94386\nRegisterbekanntmachung nach dem Umwandlungsgesetz 03.12.2025 (Eintragungsdatum)\n\nKanalreinigung Weisgerber KG\nKommanditgesellschaft\nBirstein\n\nDen Gläubigern der an der Ausgliederung beteiligten Rechtsträger ist, wenn sie binnen sechs Monaten nach dem Tag, an dem die Eintragung der Ausgliederung in das Register des Sitzes desjenigen Rechtsträgers, dessen Gläubiger sie sind, nach §§ 125, 19 Absatz 3 UmwG bekannt gemacht worden ist, ihren Anspruch nach Grund und Höhe schriftlich anmelden, Sicherheit zu leisten, soweit sie nicht Befriedigung verlangen können. Dieses Recht steht den Gläubigern jedoch nur zu, wenn sie glaubhaft machen, dass durch die Ausgliederung die Erfüllung ihrer Forderung gefährdet wird."
    },
    {
      "date": "2025-12-03",
      "id": "139074",
      "original_text": "Einreichung neuer Dokumente\nHessen Amtsgericht Wetzlar HRB 13\nBosch Thermotechnik GmbH – Wetzlar",
      "type": "Einreichung neuer Dokumente",
      "state": "Hessen",
      "amtsgericht": "Amtsgericht Wetzlar",
      "registernummer": "HRB 13",
      "registerart": "HRB",
      "company_name": "Bosch Thermotechnik GmbH",
      "company_seat": "Wetzlar",
      "details": "03.12.2025 (Bekanntmachungsdatum)\n\nHessen Amtsgericht Wetzlar HRB 13\nEinreichung neuer Dokumente\n\nBosch Thermotechnik GmbH\nGesellschaft mit beschränkter Haftung\nWetzlar\n\nDurch eine Änderung in den Personen der Aufsichtsratsmitglieder ist eine Liste der Mitglieder des Aufsichtsrates zum Handelsregister eingereicht worden."
    },
    {
      "date": "2025-12-03",
      "id": "139075",
      "original_text": "Registerbekanntmachung nach dem Umwandlungsgesetz\nHessen Amtsgericht Hanau HRA 12095\nKanalreinigung Weisgerber e.K. – Brachttal",
      "type": "Registerbekanntmachung nach dem Umwandlungsgesetz",
      "state": "Hessen",
      "amtsgericht": "Amtsgericht Hanau",
      "registernummer": "HRA 12095",
      "registerart": "HRA",
      "company_name": "Kanalreinigung Weisgerber e.K.",
      "company_seat": "Brachttal",
      "details": "03.12.2025 (Bekanntmachungsdatum)\n\nHessen Amtsgericht Hanau HRA 12095\nRegisterbekanntmachung nach dem Umwandlungsgesetz 03.12.2025 (Eintragungsdatum)\n\nKanalreinigung Weisgerber e.K.\nEinzelkaufmann / Einzelkauffrau\nBrachttal\n\nDen Gläubigern der an der Ausgliederung beteiligten Rechtsträger ist, wenn sie binnen sechs Monaten nach dem Tag, an dem die Eintragung der Ausgliederung in das Register des Sitzes desjenigen Rechtsträgers, dessen Gläubiger sie sind, nach §§ 125, 19 Absatz 3 UmwG bekannt gemacht worden ist, ihren Anspruch nach Grund und Höhe schriftlich anmelden, Sicherheit zu leisten, soweit sie nicht Befriedigung verlangen können. Dieses Recht steht den Gläubigern jedoch nur zu, wenn sie glaubhaft machen, dass durch die Ausgliederung die Erfüllung ihrer Forderung gefährdet wird."
    }
  ]
}