{
  "date": "2025-12-23",
  "date_of_scrape": "2025-12-24T04:19:36.538Z",
  "tool_version": "0.2.0",
  "number_of_announcements": 134,
  "announcements": [
    {
      "date": "2025-12-23",
      "id": "140860",
      "original_text": "Löschungsankündigung\nBayern Amtsgericht München HRA 112582\nKLAR BAU KG – Dachau",
      "type": "Löschungsankündigung",
      "state": "Bayern",
      "amtsgericht": "Amtsgericht München",
      "registernummer": "HRA 112582",
      "registerart": "HRA",
      "company_name": "KLAR BAU KG",
      "company_seat": "Dachau",
      "details": "23.12.2025 (Bekanntmachungsdatum)\n\nBayern Amtsgericht München HRA 112582\nLöschungsankündigung 22.12.2025 (Eintragungsdatum)\n\nKLAR BAU KG\nKommanditgesellschaft\nDachau\n\nDas Registergericht beabsichtigt, die im Handelsregister eingetragene Firma von Amts wegen nach § 31 Abs. 2 HGB zu löschen. Die Frist zur Erhebung eines Widerspruchs ist auf drei Monate festgesetzt."
    },
    {
      "date": "2025-12-23",
      "id": "140861",
      "original_text": "Löschungsankündigung\nBayern Amtsgericht Bayreuth HRB 7996\nAnubis Cosplay UG (haftungsbeschränkt) – Himmelkron",
      "type": "Löschungsankündigung",
      "state": "Bayern",
      "amtsgericht": "Amtsgericht Bayreuth",
      "registernummer": "HRB 7996",
      "registerart": "HRB",
      "company_name": "Anubis Cosplay UG (haftungsbeschränkt)",
      "company_seat": "Himmelkron",
      "details": "23.12.2025 (Bekanntmachungsdatum)\n\nBayern Amtsgericht Bayreuth HRB 7996\nLöschungsankündigung\n\nAnubis Cosplay UG (haftungsbeschränkt)\nGesellschaft mit beschränkter Haftung\nHimmelkron\n\nDas Registergericht beabsichtigt, die im Handelsregister eingetragene Gesellschaft wegen Vermögenslosigkeit von Amts wegen nach § 394 FamFG zu löschen. Die Frist zur Erhebung eines Widerspruchs ist auf einen Monat festgesetzt."
    },
    {
      "date": "2025-12-23",
      "id": "140862",
      "original_text": "Registerbekanntmachung nach dem Umwandlungsgesetz\nBayern Amtsgericht München HRB 193405\nAUF Vermögensverwaltung GmbH – Kirchseeon",
      "type": "Registerbekanntmachung nach dem Umwandlungsgesetz",
      "state": "Bayern",
      "amtsgericht": "Amtsgericht München",
      "registernummer": "HRB 193405",
      "registerart": "HRB",
      "company_name": "AUF Vermögensverwaltung GmbH",
      "company_seat": "Kirchseeon",
      "details": "23.12.2025 (Bekanntmachungsdatum)\n\nBayern Amtsgericht München HRB 193405\nRegisterbekanntmachung nach dem Umwandlungsgesetz 22.12.2025 (Eintragungsdatum)\n\nAUF Vermögensverwaltung GmbH\nGesellschaft mit beschränkter Haftung\nKirchseeon\n\nDen Gläubigern der an der Spaltung beteiligten Rechtsträger ist, wenn sie binnen sechs Monaten nach dem Tag, an dem die Eintragung der Spaltung in das Register des Sitzes desjenigen Rechtsträgers, dessen Gläubiger sie sind, nach §§ 125, 19 Abs. 3 UmwG als bekannt gemacht gilt, ihren Anspruch nach Grund und Höhe in Textform anmelden, Sicherheit zu leisten, soweit sie nicht Befriedigung verlangen können. Dieses Recht steht den Gläubigern jedoch nur zu, wenn sie glaubhaft machen, dass durch die Spaltung die Erfüllung ihrer Forderung gefährdet wird."
    },
    {
      "date": "2025-12-23",
      "id": "140863",
      "original_text": "Löschungsankündigung\nBayern Amtsgericht München HRB 177024\nFlorange GmbH – Ismaning",
      "type": "Löschungsankündigung",
      "state": "Bayern",
      "amtsgericht": "Amtsgericht München",
      "registernummer": "HRB 177024",
      "registerart": "HRB",
      "company_name": "Florange GmbH",
      "company_seat": "Ismaning",
      "details": "23.12.2025 (Bekanntmachungsdatum)\n\nBayern Amtsgericht München HRB 177024\nLöschungsankündigung\n\nFlorange GmbH\nGesellschaft mit beschränkter Haftung\nIsmaning\n\nDas Registergericht beabsichtigt, die im Handelsregister eingetragene Gesellschaft wegen Vermögenslosigkeit von Amts wegen nach § 394 FamFG zu löschen. Die Frist zur Erhebung eines Widerspruchs ist auf drei Monate festgesetzt."
    },
    {
      "date": "2025-12-23",
      "id": "140864",
      "original_text": "Einreichung neuer Dokumente\nBayern Amtsgericht Ingolstadt HRB 4516\nGVB Service-Makler AG Geldanlagen Versicherungen Bausparverträge – Geisenfeld",
      "type": "Einreichung neuer Dokumente",
      "state": "Bayern",
      "amtsgericht": "Amtsgericht Ingolstadt",
      "registernummer": "HRB 4516",
      "registerart": "HRB",
      "company_name": "GVB Service-Makler AG Geldanlagen Versicherungen Bausparverträge",
      "company_seat": "Geisenfeld",
      "details": "23.12.2025 (Bekanntmachungsdatum)\n\nBayern Amtsgericht Ingolstadt HRB 4516\nEinreichung neuer Dokumente\n\nGVB Service-Makler AG Geldanlagen Versicherungen Bausparverträge\nAktiengesellschaft\nGeisenfeld\n\nDem Amtsgericht Ingolstadt -Registergericht- ist eine Liste der Mitglieder des Aufsichtsrats eingereicht worden, § 106 AktG."
    },
    {
      "date": "2025-12-23",
      "id": "140865",
      "original_text": "Einreichung neuer Dokumente\nBayern Amtsgericht Ingolstadt HRB 90\nSt. Gundekar-Werk Eichstätt Wohnungs- und Städtebaugesellschaft mbH – Eichstätt",
      "type": "Einreichung neuer Dokumente",
      "state": "Bayern",
      "amtsgericht": "Amtsgericht Ingolstadt",
      "registernummer": "HRB 90",
      "registerart": "HRB",
      "company_name": "St. Gundekar-Werk Eichstätt Wohnungs- und Städtebaugesellschaft mbH",
      "company_seat": "Eichstätt",
      "details": "23.12.2025 (Bekanntmachungsdatum)\n\nBayern Amtsgericht Ingolstadt HRB 90\nEinreichung neuer Dokumente\n\nSt. Gundekar-Werk Eichstätt Wohnungs- und Städtebaugesellschaft mbH\nGesellschaft mit beschränkter Haftung\nEichstätt\n\nDem Amtsgericht Ingolstadt -Registergericht- ist eine Liste der Mitglieder des Aufsichtsrats eingereicht worden, § 52 Abs. 3 S. 2 GmbHG."
    },
    {
      "date": "2025-12-23",
      "id": "140866",
      "original_text": "Einreichung neuer Dokumente\nBayern Amtsgericht München HRB 184046\nBioworks AG – Putzbrunn",
      "type": "Einreichung neuer Dokumente",
      "state": "Bayern",
      "amtsgericht": "Amtsgericht München",
      "registernummer": "HRB 184046",
      "registerart": "HRB",
      "company_name": "Bioworks AG",
      "company_seat": "Putzbrunn",
      "details": "23.12.2025 (Bekanntmachungsdatum)\n\nBayern Amtsgericht München HRB 184046\nEinreichung neuer Dokumente\n\nBioworks AG\nAktiengesellschaft\nPutzbrunn\n\nDem Amtsgericht München -Registergericht- ist eine Liste der Mitglieder des Aufsichtsrats eingereicht worden, § 106 AktG."
    },
    {
      "date": "2025-12-23",
      "id": "140867",
      "original_text": "Registerbekanntmachung nach dem Umwandlungsgesetz\nBayern Amtsgericht Fürth HRB 21980\nPegasus Real Estate Partners GmbH – Erlangen",
      "type": "Registerbekanntmachung nach dem Umwandlungsgesetz",
      "state": "Bayern",
      "amtsgericht": "Amtsgericht Fürth",
      "registernummer": "HRB 21980",
      "registerart": "HRB",
      "company_name": "Pegasus Real Estate Partners GmbH",
      "company_seat": "Erlangen",
      "details": "23.12.2025 (Bekanntmachungsdatum)\n\nBayern Amtsgericht Fürth HRB 21980\nRegisterbekanntmachung nach dem Umwandlungsgesetz 22.12.2025 (Eintragungsdatum)\n\nPegasus Real Estate Partners GmbH\nGesellschaft mit beschränkter Haftung\nErlangen\n\nDen Gläubigern der an der Spaltung beteiligten Rechtsträger ist, wenn sie binnen sechs Monaten nach dem Tag, an dem die Eintragung der Spaltung in das Register des Sitzes desjenigen Rechtsträgers, dessen Gläubiger sie sind, nach §§ 125, 19 Abs. 3 UmwG als bekannt gemacht gilt, ihren Anspruch nach Grund und Höhe in Textform anmelden, Sicherheit zu leisten, soweit sie nicht Befriedigung verlangen können. Dieses Recht steht den Gläubigern jedoch nur zu, wenn sie glaubhaft machen, dass durch die Spaltung die Erfüllung ihrer Forderung gefährdet wird."
    },
    {
      "date": "2025-12-23",
      "id": "140868",
      "original_text": "Registerbekanntmachung nach dem Umwandlungsgesetz\nBayern Amtsgericht München HRB 193405\nAUF Vermögensverwaltung GmbH – Kirchseeon",
      "type": "Registerbekanntmachung nach dem Umwandlungsgesetz",
      "state": "Bayern",
      "amtsgericht": "Amtsgericht München",
      "registernummer": "HRB 193405",
      "registerart": "HRB",
      "company_name": "AUF Vermögensverwaltung GmbH",
      "company_seat": "Kirchseeon",
      "details": "23.12.2025 (Bekanntmachungsdatum)\n\nBayern Amtsgericht München HRB 193405\nRegisterbekanntmachung nach dem Umwandlungsgesetz 22.12.2025 (Eintragungsdatum)\n\nAUF Vermögensverwaltung GmbH\nGesellschaft mit beschränkter Haftung\nKirchseeon\n\nDen Gläubigern der an der Spaltung beteiligten Rechtsträger ist, wenn sie binnen sechs Monaten nach dem Tag, an dem die Eintragung der Spaltung in das Register des Sitzes desjenigen Rechtsträgers, dessen Gläubiger sie sind, nach §§ 125, 19 Abs. 3 UmwG als bekannt gemacht gilt, ihren Anspruch nach Grund und Höhe in Textform anmelden, Sicherheit zu leisten, soweit sie nicht Befriedigung verlangen können. Dieses Recht steht den Gläubigern jedoch nur zu, wenn sie glaubhaft machen, dass durch die Spaltung die Erfüllung ihrer Forderung gefährdet wird."
    },
    {
      "date": "2025-12-23",
      "id": "140869",
      "original_text": "Registerbekanntmachung nach dem Umwandlungsgesetz\nBayern Amtsgericht Nürnberg HRB 10903\nFrank GmbH – Greding, Ortsteil Obermässing",
      "type": "Registerbekanntmachung nach dem Umwandlungsgesetz",
      "state": "Bayern",
      "amtsgericht": "Amtsgericht Nürnberg",
      "registernummer": "HRB 10903",
      "registerart": "HRB",
      "company_name": "Frank GmbH",
      "company_seat": "Greding, Ortsteil Obermässing",
      "details": "23.12.2025 (Bekanntmachungsdatum)\n\nBayern Amtsgericht Nürnberg HRB 10903\nRegisterbekanntmachung nach dem Umwandlungsgesetz 22.12.2025 (Eintragungsdatum)\n\nFrank GmbH\nGesellschaft mit beschränkter Haftung\nGreding, Ortsteil Obermässing\n\nDen Gläubigern der an der Verschmelzung beteiligten Rechtsträger ist, wenn sie binnen sechs Monaten nach dem Tag, an dem die Eintragung der Verschmelzung in das Register des Sitzes desjenigen Rechtsträgers, dessen Gläubiger sie sind, nach § 19 Abs. 3 UmwG als bekannt gemacht gilt, ihren Anspruch nach Grund und Höhe in Textform anmelden, Sicherheit zu leisten, soweit sie nicht Befriedigung verlangen können. Dieses Recht steht den Gläubigern jedoch nur zu, wenn sie glaubhaft machen, dass durch die Verschmelzung die Erfüllung ihrer Forderung gefährdet wird."
    },
    {
      "date": "2025-12-23",
      "id": "140870",
      "original_text": "Einreichung neuer Dokumente\nBayern Amtsgericht München HRB 109326\nTÜV SÜD Aktiengesellschaft – München",
      "type": "Einreichung neuer Dokumente",
      "state": "Bayern",
      "amtsgericht": "Amtsgericht München",
      "registernummer": "HRB 109326",
      "registerart": "HRB",
      "company_name": "TÜV SÜD Aktiengesellschaft",
      "company_seat": "München",
      "details": "23.12.2025 (Bekanntmachungsdatum)\n\nBayern Amtsgericht München HRB 109326\nEinreichung neuer Dokumente 22.12.2025 (Eintragungsdatum)\n\nTÜV SÜD Aktiengesellschaft\nAktiengesellschaft\nMünchen\n\nDem Amtsgericht München -Registergericht- ist eine Liste der Mitglieder des Aufsichtsrats eingereicht worden, § 106 AktG."
    },
    {
      "date": "2025-12-23",
      "id": "140871",
      "original_text": "Sonstige Registerbekanntmachung\nBayern Amtsgericht Augsburg HRB 37218\nCloudCommand GmbH – Augsburg",
      "type": "Sonstige Registerbekanntmachung",
      "state": "Bayern",
      "amtsgericht": "Amtsgericht Augsburg",
      "registernummer": "HRB 37218",
      "registerart": "HRB",
      "company_name": "CloudCommand GmbH",
      "company_seat": "Augsburg",
      "details": "23.12.2025 (Bekanntmachungsdatum)\n\nBayern Amtsgericht Augsburg HRB 37218\nSonstige Registerbekanntmachung 22.12.2025 (Eintragungsdatum)\n\nCloudCommand GmbH\nGesellschaft mit beschränkter Haftung\nAugsburg\n\nDen Gläubigern der Gesellschaft, deren Forderungen begründet worden sind, bevor die Eintragung der Beendigung des\n\"Beherrschungs- und Gewinnabführungsvertrages\",\nin das Handelsregister nach § 10 des Handelsgesetzbuches als bekanntgemacht gilt, hat der andere Vertragsteil Sicherheit zu leisten, wenn sie sich binnen sechs Monaten nach der Bekanntmachung der Eintragung zu diesem Zweck bei ihm melden."
    },
    {
      "date": "2025-12-23",
      "id": "140872",
      "original_text": "Registerbekanntmachung nach dem Umwandlungsgesetz\nBayern Amtsgericht Nürnberg HRB 15036\nFrank GmbH – Greding, Ortsteil Obermässing",
      "type": "Registerbekanntmachung nach dem Umwandlungsgesetz",
      "state": "Bayern",
      "amtsgericht": "Amtsgericht Nürnberg",
      "registernummer": "HRB 15036",
      "registerart": "HRB",
      "company_name": "Frank GmbH",
      "company_seat": "Greding, Ortsteil Obermässing",
      "details": "23.12.2025 (Bekanntmachungsdatum)\n\nBayern Amtsgericht Nürnberg HRB 15036\nRegisterbekanntmachung nach dem Umwandlungsgesetz 22.12.2025 (Eintragungsdatum)\n\nFrank GmbH\nGesellschaft mit beschränkter Haftung\nGreding, Ortsteil Obermässing\n\nDen Gläubigern der an der Verschmelzung beteiligten Rechtsträger ist, wenn sie binnen sechs Monaten nach dem Tag, an dem die Eintragung der Verschmelzung in das Register des Sitzes desjenigen Rechtsträgers, dessen Gläubiger sie sind, nach § 19 Abs. 3 UmwG als bekannt gemacht gilt, ihren Anspruch nach Grund und Höhe in Textform anmelden, Sicherheit zu leisten, soweit sie nicht Befriedigung verlangen können. Dieses Recht steht den Gläubigern jedoch nur zu, wenn sie glaubhaft machen, dass durch die Verschmelzung die Erfüllung ihrer Forderung gefährdet wird."
    },
    {
      "date": "2025-12-23",
      "id": "140873",
      "original_text": "Einreichung neuer Dokumente\nBayern Amtsgericht Traunstein HRB 30610\nboerse.de Group AG – Rosenheim",
      "type": "Einreichung neuer Dokumente",
      "state": "Bayern",
      "amtsgericht": "Amtsgericht Traunstein",
      "registernummer": "HRB 30610",
      "registerart": "HRB",
      "company_name": "boerse.de Group AG",
      "company_seat": "Rosenheim",
      "details": "23.12.2025 (Bekanntmachungsdatum)\n\nBayern Amtsgericht Traunstein HRB 30610\nEinreichung neuer Dokumente\n\nboerse.de Group AG\nAktiengesellschaft\nRosenheim\n\nDem Amtsgericht Traunstein -Registergericht- ist eine Liste der Mitglieder des Aufsichtsrats eingereicht worden, § 106 AktG."
    },
    {
      "date": "2025-12-23",
      "id": "140874",
      "original_text": "Registerbekanntmachung nach dem Umwandlungsgesetz\nBayern Amtsgericht München HRB 237105\nELT TopCo GmbH – Puchheim",
      "type": "Registerbekanntmachung nach dem Umwandlungsgesetz",
      "state": "Bayern",
      "amtsgericht": "Amtsgericht München",
      "registernummer": "HRB 237105",
      "registerart": "HRB",
      "company_name": "ELT TopCo GmbH",
      "company_seat": "Puchheim",
      "details": "23.12.2025 (Bekanntmachungsdatum)\n\nBayern Amtsgericht München HRB 237105\nRegisterbekanntmachung nach dem Umwandlungsgesetz 22.12.2025 (Eintragungsdatum)\n\nELT TopCo GmbH\nGesellschaft mit beschränkter Haftung\nPuchheim\n\nDen Gläubigern der an der Verschmelzung beteiligten Rechtsträger ist, wenn sie binnen sechs Monaten nach dem Tag, an dem die Eintragung der Verschmelzung in das Register des Sitzes desjenigen Rechtsträgers, dessen Gläubiger sie sind, nach § 19 Abs. 3 UmwG als bekannt gemacht gilt, ihren Anspruch nach Grund und Höhe in Textform anmelden, Sicherheit zu leisten, soweit sie nicht Befriedigung verlangen können. Dieses Recht steht den Gläubigern jedoch nur zu, wenn sie glaubhaft machen, dass durch die Verschmelzung die Erfüllung ihrer Forderung gefährdet wird."
    },
    {
      "date": "2025-12-23",
      "id": "140875",
      "original_text": "Einreichung neuer Dokumente\nBayern Amtsgericht München HRB 173388\nAllianz Technology SE – München",
      "type": "Einreichung neuer Dokumente",
      "state": "Bayern",
      "amtsgericht": "Amtsgericht München",
      "registernummer": "HRB 173388",
      "registerart": "HRB",
      "company_name": "Allianz Technology SE",
      "company_seat": "München",
      "details": "23.12.2025 (Bekanntmachungsdatum)\n\nBayern Amtsgericht München HRB 173388\nEinreichung neuer Dokumente\n\nAllianz Technology SE\nEuropäische Aktiengesellschaft (SE)\nMünchen\n\nDem #Re.Name ist eine Liste der Mitglieder des Aufsichtsrats eingereicht worden, Art. 9 Abs. 1 Buchst. c (ii) SE-VO i.V.m. § 106 AktG."
    },
    {
      "date": "2025-12-23",
      "id": "140876",
      "original_text": "Einreichung neuer Dokumente\nBayern Amtsgericht Würzburg HRB 17104\nSecure Cloud Services AG – Würzburg",
      "type": "Einreichung neuer Dokumente",
      "state": "Bayern",
      "amtsgericht": "Amtsgericht Würzburg",
      "registernummer": "HRB 17104",
      "registerart": "HRB",
      "company_name": "Secure Cloud Services AG",
      "company_seat": "Würzburg",
      "details": "23.12.2025 (Bekanntmachungsdatum)\n\nBayern Amtsgericht Würzburg HRB 17104\nEinreichung neuer Dokumente\n\nSecure Cloud Services AG\nAktiengesellschaft\nWürzburg\n\nDem Amtsgericht Würzburg -Registergericht- ist eine Liste der Mitglieder des Aufsichtsrats eingereicht worden, § 106 AktG."
    },
    {
      "date": "2025-12-23",
      "id": "140877",
      "original_text": "Registerbekanntmachung nach dem Umwandlungsgesetz\nMecklenburg-Vorpommern Amtsgericht Neubrandenburg HRB 5611\nKomesker Verwaltungs GmbH – Röckwitz",
      "type": "Registerbekanntmachung nach dem Umwandlungsgesetz",
      "state": "Mecklenburg-Vorpommern",
      "amtsgericht": "Amtsgericht Neubrandenburg",
      "registernummer": "HRB 5611",
      "registerart": "HRB",
      "company_name": "Komesker Verwaltungs GmbH",
      "company_seat": "Röckwitz",
      "details": "23.12.2025 (Bekanntmachungsdatum)\n\nMecklenburg-Vorpommern Amtsgericht Neubrandenburg HRB 5611\nRegisterbekanntmachung nach dem Umwandlungsgesetz 22.12.2025 (Eintragungsdatum)\n\nKomesker Verwaltungs GmbH\nGesellschaft mit beschränkter Haftung\nRöckwitz\n\nAls nicht eingetragen wird veröffentlicht: Den Gläubigern der an der Spaltung beteiligten Rechtsträger ist, wenn sie binnen sechs Monaten nach dem Tag, an dem die Eintragung der Spaltung in das Register des Sitzes desjenigen Rechtsträgers, dessen Gläubiger sie sind, nach § 19 Abs. 3 UmwG als bekannt gemacht gilt, ihren Anspruch nach Grund und Höhe schriftlich anmelden, Sicherheit zu leisten, soweit sie nicht Befriedigung verlangen können. Dieses Recht steht den Gläubigern jedoch nur zu, wenn sie glaubhaft machen, dass durch die Spaltung die Erfüllung der Forderung gefährdet wird."
    },
    {
      "date": "2025-12-23",
      "id": "140878",
      "original_text": "Sonstige Registerbekanntmachung\nMecklenburg-Vorpommern Amtsgericht Schwerin HRB 14509\nBIOCEN AG & Co. KGaA – Wismar",
      "type": "Sonstige Registerbekanntmachung",
      "state": "Mecklenburg-Vorpommern",
      "amtsgericht": "Amtsgericht Schwerin",
      "registernummer": "HRB 14509",
      "registerart": "HRB",
      "company_name": "BIOCEN AG & Co. KGaA",
      "company_seat": "Wismar",
      "details": "23.12.2025 (Bekanntmachungsdatum)\n\nMecklenburg-Vorpommern Amtsgericht Schwerin HRB 14509\nSonstige Registerbekanntmachung 08.12.2025 (Eintragungsdatum)\n\nBIOCEN AG & Co. KGaA\nKommanditgesellschaft auf Aktien\nWismar\n\nEine Liste der Aufsichtsratsmitglieder ist zum Handelsregister eingereicht worden."
    },
    {
      "date": "2025-12-23",
      "id": "140879",
      "original_text": "Registerbekanntmachung nach dem Umwandlungsgesetz\nMecklenburg-Vorpommern Amtsgericht Neubrandenburg HRB 22555\nKomesker Holding GmbH – Tützpatz",
      "type": "Registerbekanntmachung nach dem Umwandlungsgesetz",
      "state": "Mecklenburg-Vorpommern",
      "amtsgericht": "Amtsgericht Neubrandenburg",
      "registernummer": "HRB 22555",
      "registerart": "HRB",
      "company_name": "Komesker Holding GmbH",
      "company_seat": "Tützpatz",
      "details": "23.12.2025 (Bekanntmachungsdatum)\n\nMecklenburg-Vorpommern Amtsgericht Neubrandenburg HRB 22555\nRegisterbekanntmachung nach dem Umwandlungsgesetz 22.12.2025 (Eintragungsdatum)\n\nKomesker Holding GmbH\nGesellschaft mit beschränkter Haftung\nTützpatz\n\nAls nicht eingetragen wird veröffentlicht: Den Gläubigern der an der Ausgliederung beteiligten Rechtsträger ist, wenn sie binnen sechs Monaten nach dem Tag, an dem die Eintragung der Ausgliederung in das Register des Sitzes desjenigen Rechtsträgers, dessen Gläubiger sie sind, nach § 19 Abs. 3 UmwG als bekannt gemacht gilt, ihren Anspruch nach Grund und Höhe in Textform anmelden,\nSicherheit zu leisten, soweit sie nicht Befriedigung verlangen können. Dieses Recht steht den Gläubigern jedoch nur zu, wenn sie glaubhaft machen, dass durch die Ausgliederung die Erfüllung der Forderung gefährdet wird."
    },
    {
      "date": "2025-12-23",
      "id": "140880",
      "original_text": "Registerbekanntmachung nach dem Umwandlungsgesetz\nMecklenburg-Vorpommern Amtsgericht Schwerin HRB 15350\nMerker Beteiligungsgesellschaft mbH – Dalberg-Wendelstorf",
      "type": "Registerbekanntmachung nach dem Umwandlungsgesetz",
      "state": "Mecklenburg-Vorpommern",
      "amtsgericht": "Amtsgericht Schwerin",
      "registernummer": "HRB 15350",
      "registerart": "HRB",
      "company_name": "Merker Beteiligungsgesellschaft mbH",
      "company_seat": "Dalberg-Wendelstorf",
      "details": "23.12.2025 (Bekanntmachungsdatum)\n\nMecklenburg-Vorpommern Amtsgericht Schwerin HRB 15350\nRegisterbekanntmachung nach dem Umwandlungsgesetz 22.12.2025 (Eintragungsdatum)\n\nMerker Beteiligungsgesellschaft mbH\nGesellschaft mit beschränkter Haftung\nDalberg-Wendelstorf\n\nDen Gläubigern der an der Verschmelzung beteiligten Gesellschaften ist, wenn sie binnen sechs Monaten nach dem Tag, an dem die Eintragung der Verschmelzungen in das Register des Sitzes desjenigen Rechtsträgers, dessen Gläubiger sie sind, nach § 19 Absatz 3 UmwG als bekanntgemacht gilt, ihren Anspruch nach Grund und Höhe schriftlich anmelden, Sicherheit zu leisten, soweit sie nicht Befriedigung verlangen können. Dieses Recht steht den Gläubigern jedoch nur zu, wenn sie glaubhaft machen, dass durch die Verschmelzung die Erfüllung ihrer Forderung gefährdet wird."
    },
    {
      "date": "2025-12-23",
      "id": "140881",
      "original_text": "Registerbekanntmachung nach dem Umwandlungsgesetz\nMecklenburg-Vorpommern Amtsgericht Stralsund VR 342\nCHAMÄLEON Stralsund e.V. – Sundhagen OT Bremerhagen",
      "type": "Registerbekanntmachung nach dem Umwandlungsgesetz",
      "state": "Mecklenburg-Vorpommern",
      "amtsgericht": "Amtsgericht Stralsund",
      "registernummer": "VR 342",
      "registerart": "VR",
      "company_name": "CHAMÄLEON Stralsund e.V.",
      "company_seat": "Sundhagen OT Bremerhagen",
      "details": "23.12.2025 (Bekanntmachungsdatum)\n\nMecklenburg-Vorpommern Amtsgericht Stralsund VR 342\nRegisterbekanntmachung nach dem Umwandlungsgesetz 22.12.2025 (Eintragungsdatum)\n\nCHAMÄLEON Stralsund e.V.\neingetragener Verein\nSundhagen OT Bremerhagen\n\nAls nicht eingetragen wird veröffentlicht: Den Gläubigern der an der Umwandlung beteiligten Rechtsträger ist, wenn sie binnen sechs\nMonaten nach dem Tag, an dem die Eintragung der Umwandlung in das Register des Sitzes desjenigen Rechtsträgers, dessen Gläubiger sie sind, nach § 19 Abs. 3 UmwG als bekannt gemacht gilt, ihren Anspruch nach Grund und Höhe in Textform anmelden, Sicherheit zu leisten, soweit sie nicht Befriedigung verlangen können. Dieses Recht steht den Gläubigern jedoch nur zu, wenn sie glaubhaft machen, dass durch die Umwandlung die Erfüllung der Forderung gefährdet wird."
    },
    {
      "date": "2025-12-23",
      "id": "140882",
      "original_text": "Registerbekanntmachung nach dem Umwandlungsgesetz\nMecklenburg-Vorpommern Amtsgericht Schwerin HRB 15288\nMerker Verwaltungsgesellschaft mbH – Dalberg-Wendelstorf",
      "type": "Registerbekanntmachung nach dem Umwandlungsgesetz",
      "state": "Mecklenburg-Vorpommern",
      "amtsgericht": "Amtsgericht Schwerin",
      "registernummer": "HRB 15288",
      "registerart": "HRB",
      "company_name": "Merker Verwaltungsgesellschaft mbH",
      "company_seat": "Dalberg-Wendelstorf",
      "details": "23.12.2025 (Bekanntmachungsdatum)\n\nMecklenburg-Vorpommern Amtsgericht Schwerin HRB 15288\nRegisterbekanntmachung nach dem Umwandlungsgesetz 22.12.2025 (Eintragungsdatum)\n\nMerker Verwaltungsgesellschaft mbH\nGesellschaft mit beschränkter Haftung\nDalberg-Wendelstorf\n\nDen Gläubigern der an der Verschmelzung beteiligten Gesellschaften ist, wenn sie binnen sechs Monaten nach dem Tag, an dem die Eintragung der Verschmelzungen in das Register des Sitzes desjenigen Rechtsträgers, dessen Gläubiger sie sind, nach § 19 Absatz 3 UmwG als bekanntgemacht gilt, ihren Anspruch nach Grund und Höhe schriftlich anmelden, Sicherheit zu leisten, soweit sie nicht Befriedigung verlangen können. Dieses Recht steht den Gläubigern jedoch nur zu, wenn sie glaubhaft machen, dass durch die Verschmelzung die Erfüllung ihrer Forderung gefährdet wird."
    },
    {
      "date": "2025-12-23",
      "id": "140883",
      "original_text": "Löschungsankündigung\nMecklenburg-Vorpommern Amtsgericht Schwerin HRB 13129\nAgrophil GmbH – Schwerin",
      "type": "Löschungsankündigung",
      "state": "Mecklenburg-Vorpommern",
      "amtsgericht": "Amtsgericht Schwerin",
      "registernummer": "HRB 13129",
      "registerart": "HRB",
      "company_name": "Agrophil GmbH",
      "company_seat": "Schwerin",
      "details": "23.12.2025 (Bekanntmachungsdatum)\n\nMecklenburg-Vorpommern Amtsgericht Schwerin HRB 13129\nLöschungsankündigung\n\nAgrophil GmbH\nGesellschaft mit beschränkter Haftung\nSchwerin\n\nDas Amtsgericht Schwerin, Handelsregister, beabsichtigt, die o.g. Gesellschaft gemäß § 394 des Gesetzes über das Verfahren in Familiensachen und in den Angelegenheiten der freiwilligen Gerichtsbarkeit (FamFG) wegen \tVermögenslosigkeit zu löschen, wenn nicht binnen eines Monats nach dieser Bekanntmachung dagegen Widerspruch erhoben wird."
    },
    {
      "date": "2025-12-23",
      "id": "140884",
      "original_text": "Löschungsankündigung\nSaarland Amtsgericht Saarbrücken HRB 104101\nMORE Institute GmbH – Saarlouis",
      "type": "Löschungsankündigung",
      "state": "Saarland",
      "amtsgericht": "Amtsgericht Saarbrücken",
      "registernummer": "HRB 104101",
      "registerart": "HRB",
      "company_name": "MORE Institute GmbH",
      "company_seat": "Saarlouis",
      "details": "23.12.2025 (Bekanntmachungsdatum)\n\nSaarland Amtsgericht Saarbrücken HRB 104101\nLöschungsankündigung\n\nMORE Institute GmbH\nGesellschaft mit beschränkter Haftung\nSaarlouis\n\nEs ist beabsichtigt, die Gesellschaft von Amts wegen gemäß § 394 FamFG wegen Vermögenslosigkeit zu löschen.\nGegen die Löschung von Amts wegen ist das Rechtsmittel des Widerspruchs statthaft. Der Widerspruch ist binnen einer Frist einem Monat beginnend mit dem Tag dieser Veröffentlichung durch Einreichen eines Widerspruchsschreibens -schriftlich oder zur Niederschrift der Geschäftsstelle beim Amtsgericht Saarbrücken, -zentrales Handelsregister-, Mainzerstr.178, 66121 Saarbrücken einzulegen.\nDer Widerspruch muss die Bezeichnung der angefochtenen Löschungsankündigung enthalten sowie die Erklärung, dass Widerspruch eingelegt wird. Er ist vom Widerspruchsführer oder seinem Bevollmächtigten zu unterzeichnen.\nDas Widerspruchsschreiben kann auch in der Form eines elektronischen Dokumentes eingereicht werden, das mit einer qualifizierten elektronischen Signatur nach dem Signaturgesetz versehen sein muss (§§ 14 Abs. 2 FamFG, 130a, 298 ZPO)."
    },
    {
      "date": "2025-12-23",
      "id": "140885",
      "original_text": "Registerbekanntmachung nach dem Umwandlungsgesetz\nSchleswig-Holstein Amtsgericht Lübeck HRB 10736\nBÖWE SYSTEC GmbH – Lübeck",
      "type": "Registerbekanntmachung nach dem Umwandlungsgesetz",
      "state": "Schleswig-Holstein",
      "amtsgericht": "Amtsgericht Lübeck",
      "registernummer": "HRB 10736",
      "registerart": "HRB",
      "company_name": "BÖWE SYSTEC GmbH",
      "company_seat": "Lübeck",
      "details": "23.12.2025 (Bekanntmachungsdatum)\n\nSchleswig-Holstein Amtsgericht Lübeck HRB 10736\nRegisterbekanntmachung nach dem Umwandlungsgesetz 18.12.2025 (Eintragungsdatum)\n\nBÖWE SYSTEC GmbH\nGesellschaft mit beschränkter Haftung\nLübeck\n\nAls nicht eingetragen wird veröffentlicht: Den Gläubigern der an der Verschmelzung beteiligten Rechtsträger ist, wenn sie binnen sechs Monaten nach dem Tag, an dem die Eintragung der Verschmelzung in das Register des Sitzes desjenigen Rechtsträgers, dessen Gläubiger sie sind, als bekannt gemacht gilt, ihren Anspruch nach Grund und Höhe schriftlich anmelden, Sicherheit zu leisten, soweit sie nicht Befriedigung verlangen können. Dieses Recht steht den Gläubigern jedoch nur zu, wenn sie glaubhaft machen, dass durch die Verschmelzung die Erfüllung ihrer Forderung gefährdet wird."
    },
    {
      "date": "2025-12-23",
      "id": "140886",
      "original_text": "Löschungsankündigung\nBerlin Amtsgericht Berlin (Charlottenburg) HRB 169401\nShrana Online GmbH – Berlin",
      "type": "Löschungsankündigung",
      "state": "Berlin",
      "amtsgericht": "Amtsgericht Berlin (Charlottenburg)",
      "registernummer": "HRB 169401",
      "registerart": "HRB",
      "company_name": "Shrana Online GmbH",
      "company_seat": "Berlin",
      "details": "23.12.2025 (Bekanntmachungsdatum)\n\nBerlin Amtsgericht Berlin (Charlottenburg) HRB 169401\nLöschungsankündigung\n\nShrana Online GmbH\nGesellschaft mit beschränkter Haftung\nBerlin\n\nBei der nachstehenden Gesellschaft wird das Amtslöschungsverfahren gemäß § 394 FamFG eingeleitet. Widerspruchsfrist 6 Wochen"
    },
    {
      "date": "2025-12-23",
      "id": "140887",
      "original_text": "Registerbekanntmachung nach dem Umwandlungsgesetz\nSaarland Amtsgericht Saarbrücken HRB 12202\nPCCell GmbH – Marpingen",
      "type": "Registerbekanntmachung nach dem Umwandlungsgesetz",
      "state": "Saarland",
      "amtsgericht": "Amtsgericht Saarbrücken",
      "registernummer": "HRB 12202",
      "registerart": "HRB",
      "company_name": "PCCell GmbH",
      "company_seat": "Marpingen",
      "details": "23.12.2025 (Bekanntmachungsdatum)\n\nSaarland Amtsgericht Saarbrücken HRB 12202\nRegisterbekanntmachung nach dem Umwandlungsgesetz 23.12.2025 (Eintragungsdatum)\n\nPCCell GmbH\nGesellschaft mit beschränkter Haftung\nMarpingen\n\nAls nicht eingetragen wird bekannt gemacht: Den Gläubigern der an der Verschmelzung beteiligten Gesellschaften ist, wenn sie binnen sechs Monaten nach dem Tag, an dem die Eintragung der Verschmelzung in das Register des Sitzes desjenigen Rechtsträgers, dessen Gläubiger sie sind, nach § 19 Absatz 3 UmwG bekannt gemacht worden ist, ihren Anspruch nach Grund und Höhe schriftlich anmelden, Sicherheit zu leisten, soweit sie nicht Befriedigung verlangen können. Dieses Recht steht den Gläubigern jedoch nur zu, wenn sie glaubhaft machen, dass durch die Verschmelzung die Erfüllung ihrer Forderung gefährdet wird."
    },
    {
      "date": "2025-12-23",
      "id": "140888",
      "original_text": "Registerbekanntmachung nach dem Umwandlungsgesetz\nSaarland Amtsgericht Saarbrücken HRB 12201\nPCA - Polymerchemie Altmeier GmbH – Heusweiler",
      "type": "Registerbekanntmachung nach dem Umwandlungsgesetz",
      "state": "Saarland",
      "amtsgericht": "Amtsgericht Saarbrücken",
      "registernummer": "HRB 12201",
      "registerart": "HRB",
      "company_name": "PCA - Polymerchemie Altmeier GmbH",
      "company_seat": "Heusweiler",
      "details": "23.12.2025 (Bekanntmachungsdatum)\n\nSaarland Amtsgericht Saarbrücken HRB 12201\nRegisterbekanntmachung nach dem Umwandlungsgesetz 23.12.2025 (Eintragungsdatum)\n\nPCA - Polymerchemie Altmeier GmbH\nGesellschaft mit beschränkter Haftung\nHeusweiler\n\nAls nicht eingetragen wird bekannt gemacht: Den Gläubigern der an der Verschmelzung beteiligten Gesellschaften ist, wenn sie binnen sechs Monaten nach dem Tag, an dem die Eintragung der Verschmelzung in das Register des Sitzes desjenigen Rechtsträgers, dessen Gläubiger sie sind, nach § 19 Absatz 3 UmwG bekannt gemacht worden ist, ihren Anspruch nach Grund und Höhe schriftlich anmelden, Sicherheit zu leisten, soweit sie nicht Befriedigung verlangen können. Dieses Recht steht den Gläubigern jedoch nur zu, wenn sie glaubhaft machen, dass durch die Verschmelzung die Erfüllung ihrer Forderung gefährdet wird."
    },
    {
      "date": "2025-12-23",
      "id": "140889",
      "original_text": "Registerbekanntmachung nach dem Umwandlungsgesetz\nBrandenburg Amtsgericht Potsdam HRB 37072\nDO WHAT YOU LOVE GmbH – Rangsdorf",
      "type": "Registerbekanntmachung nach dem Umwandlungsgesetz",
      "state": "Brandenburg",
      "amtsgericht": "Amtsgericht Potsdam",
      "registernummer": "HRB 37072",
      "registerart": "HRB",
      "company_name": "DO WHAT YOU LOVE GmbH",
      "company_seat": "Rangsdorf",
      "details": "23.12.2025 (Bekanntmachungsdatum)\n\nBrandenburg Amtsgericht Potsdam HRB 37072\nRegisterbekanntmachung nach dem Umwandlungsgesetz 22.12.2025 (Eintragungsdatum)\n\nDO WHAT YOU LOVE GmbH\nGesellschaft mit beschränkter Haftung\nRangsdorf\n\nZu Eintragungsnummer 4 vom 22.12.2025 wird als nicht eingetragen veröffentlicht: Den Gläubigern der an der Umwandlung beteiligten Rechtsträger ist, wenn sie binnen sechs Monaten nach dem Tag, an dem die Eintragung der Umwandlung in das Register des Sitzes desjenigen Rechtsträgers, dessen Gläubiger sie sind, als bekannt gemacht gilt, ihren Anspruch nach Grund und Höhe schriftlich anmelden, Sicherheit zu leisten, soweit sie nicht Befriedigung verlangen können. Dieses Recht steht den Gläubigern jedoch nur zu, wenn sie glaubhaft machen, dass durch die Umwandlung die Erfüllung ihrer Forderung gefährdet wird."
    },
    {
      "date": "2025-12-23",
      "id": "140890",
      "original_text": "Registerbekanntmachung nach dem Umwandlungsgesetz\nHamburg Amtsgericht Hamburg HRB 176889\nLiedtke Invest GmbH – Hamburg",
      "type": "Registerbekanntmachung nach dem Umwandlungsgesetz",
      "state": "Hamburg",
      "amtsgericht": "Amtsgericht Hamburg",
      "registernummer": "HRB 176889",
      "registerart": "HRB",
      "company_name": "Liedtke Invest GmbH",
      "company_seat": "Hamburg",
      "details": "23.12.2025 (Bekanntmachungsdatum)\n\nHamburg Amtsgericht Hamburg HRB 176889\nRegisterbekanntmachung nach dem Umwandlungsgesetz 23.12.2025 (Eintragungsdatum)\n\nLiedtke Invest GmbH\nGesellschaft mit beschränkter Haftung\nHamburg\n\nAls nicht eingetragen wird bekannt gemacht:\nDen Gläubigern der an der Verschmelzung beteiligten Gesellschaften ist, wenn sie binnen sechs Monaten nach dem Tag, an dem die Eintragung der Verschmelzung in das Register des Sitzes desjenigen Rechtsträgers, dessen Gläubiger sie sind, nach § 19 Absatz 3 UmwG als bekannt gemacht gilt, ihren Anspruch nach Grund und Höhe schriftlich anmelden, Sicherheit zu leisten, soweit sie nicht Befriedigung verlangen können. Dieses Recht steht den Gläubigern jedoch nur zu, wenn sie glaubhaft machen, dass durch die Verschmelzung die Erfüllung ihrer Forderung gefährdet wird."
    },
    {
      "date": "2025-12-23",
      "id": "140891",
      "original_text": "Löschungsankündigung\nBaden-Württemberg Amtsgericht Freiburg HRB 726026\nParfait Inter Renovierung UG (haftungsbeschränkt) – Kehl",
      "type": "Löschungsankündigung",
      "state": "Baden-Württemberg",
      "amtsgericht": "Amtsgericht Freiburg",
      "registernummer": "HRB 726026",
      "registerart": "HRB",
      "company_name": "Parfait Inter Renovierung UG (haftungsbeschränkt)",
      "company_seat": "Kehl",
      "details": "23.12.2025 (Bekanntmachungsdatum)\n\nBaden-Württemberg Amtsgericht Freiburg HRB 726026\nLöschungsankündigung\n\nParfait Inter Renovierung UG (haftungsbeschränkt)\nGesellschaft mit beschränkter Haftung\nKehl\n\nDas Gericht beabsichtigt, die Gesellschaft wegen Vermögenslosigkeit im Handelsregister von Amts wegen nach § 394 FamFG zu löschen. Die Frist zur Geltendmachung eines Widerspruchs gegen die beabsichtigte Löschung ist auf einen Monat ab Veröffentlichung bestimmt."
    },
    {
      "date": "2025-12-23",
      "id": "140892",
      "original_text": "Löschungsankündigung\nSaarland Amtsgericht Saarbrücken HRB 108458\nTime Spirit \"Ihr Brillenuniversum\" UG (haftungsbeschränkt) – Saarbrücken",
      "type": "Löschungsankündigung",
      "state": "Saarland",
      "amtsgericht": "Amtsgericht Saarbrücken",
      "registernummer": "HRB 108458",
      "registerart": "HRB",
      "company_name": "Time Spirit \"Ihr Brillenuniversum\" UG (haftungsbeschränkt)",
      "company_seat": "Saarbrücken",
      "details": "23.12.2025 (Bekanntmachungsdatum)\n\nSaarland Amtsgericht Saarbrücken HRB 108458\nLöschungsankündigung 23.12.2025 (Eintragungsdatum)\n\nTime Spirit \"Ihr Brillenuniversum\" UG (haftungsbeschränkt)\nGesellschaft mit beschränkter Haftung\nSaarbrücken\n\nEs ist beabsichtigt, die Gesellschaft von Amts wegen gemäß § 394 FamFG wegen Vermögenslosigkeit zu löschen. Gegen die Löschung von Amts wegen ist das Rechtsmittel des Widerspruchs statthaft. Der Widerspruch ist binnen einer Frist von 2 Monaten beginnend mit dem Tag dieser Veröffentlichung durch Einreichen eines Widerspruchsschreibens -schriftlich oder zur Niederschrift der Geschäftsstelle- beim Amtsgericht Saarbrücken, -zentrales Handelsregister-, Mainzerstr.178, 66121 Saarbrücken einzulegen. Der Widerspruch muss die Bezeichnung der angefochtenen Löschungsankündigung enthalten sowie die Erklärung, dass Widerspruch eingelegt wird. Er ist vom Widerspruchsführer oder seinem Bevollmächtigten zu unterzeichnen."
    },
    {
      "date": "2025-12-23",
      "id": "140893",
      "original_text": "Löschungsankündigung\nBerlin Amtsgericht Berlin (Charlottenburg) HRB 210881\nHANSA-INDUSTRIESERVICE GmbH – Berlin",
      "type": "Löschungsankündigung",
      "state": "Berlin",
      "amtsgericht": "Amtsgericht Berlin (Charlottenburg)",
      "registernummer": "HRB 210881",
      "registerart": "HRB",
      "company_name": "HANSA-INDUSTRIESERVICE GmbH",
      "company_seat": "Berlin",
      "details": "23.12.2025 (Bekanntmachungsdatum)\n\nBerlin Amtsgericht Berlin (Charlottenburg) HRB 210881\nLöschungsankündigung\n\nHANSA-INDUSTRIESERVICE GmbH\nGesellschaft mit beschränkter Haftung\nBerlin\n\nBei der nachstehenden Gesellschaft wird das Amtslöschungsverfahren gemäß § 394 FamFG eingeleitet. Widerspruchsfrist 6 Wochen"
    },
    {
      "date": "2025-12-23",
      "id": "140894",
      "original_text": "Einreichung neuer Dokumente\nSchleswig-Holstein Amtsgericht Lübeck HRB 25853\nMV Holding GmbH – Bad Oldesloe",
      "type": "Einreichung neuer Dokumente",
      "state": "Schleswig-Holstein",
      "amtsgericht": "Amtsgericht Lübeck",
      "registernummer": "HRB 25853",
      "registerart": "HRB",
      "company_name": "MV Holding GmbH",
      "company_seat": "Bad Oldesloe",
      "details": "23.12.2025 (Bekanntmachungsdatum)\n\nSchleswig-Holstein Amtsgericht Lübeck HRB 25853\nEinreichung neuer Dokumente\n\nMV Holding GmbH\nGesellschaft mit beschränkter Haftung\nBad Oldesloe\n\nAls nicht eingetragen wird veröffentlicht: Die Gesellschaft hat eine aktuelle Liste der Aufsichtsratsmitglieder zum Handelsregister eingereicht."
    },
    {
      "date": "2025-12-23",
      "id": "140895",
      "original_text": "Sonstige Registerbekanntmachung\nMecklenburg-Vorpommern Amtsgericht Schwerin HRB 13129\nAgrophil GmbH – Schwerin",
      "type": "Sonstige Registerbekanntmachung",
      "state": "Mecklenburg-Vorpommern",
      "amtsgericht": "Amtsgericht Schwerin",
      "registernummer": "HRB 13129",
      "registerart": "HRB",
      "company_name": "Agrophil GmbH",
      "company_seat": "Schwerin",
      "details": "23.12.2025 (Bekanntmachungsdatum)\n\nMecklenburg-Vorpommern Amtsgericht Schwerin HRB 13129\nSonstige Registerbekanntmachung\n\nAgrophil GmbH\nGesellschaft mit beschränkter Haftung\nSchwerin\n\nDas Amtsgericht Schwerin, Handelsregister, beabsichtigt, die o.g. Gesellschaft gemäß § 394 des Gesetzes über das Verfahren in Familiensachen und in den Angelegenheiten der freiwilligen Gerichtsbarkeit (FamFG) wegen \tVermögenslosigkeit zu löschen, wenn nicht binnen eines Monats nach dieser Bekanntmachung dagegen Widerspruch erhoben wird."
    },
    {
      "date": "2025-12-23",
      "id": "140896",
      "original_text": "Registerbekanntmachung nach dem Umwandlungsgesetz\nSachsen-Anhalt Amtsgericht Stendal VR 49250\nBetreuungsverein \"Anima Zeitz e.V.\" – Zeitz",
      "type": "Registerbekanntmachung nach dem Umwandlungsgesetz",
      "state": "Sachsen-Anhalt",
      "amtsgericht": "Amtsgericht Stendal",
      "registernummer": "VR 49250",
      "registerart": "VR",
      "company_name": "Betreuungsverein \"Anima Zeitz e.V.\"",
      "company_seat": "Zeitz",
      "details": "23.12.2025 (Bekanntmachungsdatum)\n\nSachsen-Anhalt Amtsgericht Stendal VR 49250\nRegisterbekanntmachung nach dem Umwandlungsgesetz 23.12.2025 (Eintragungsdatum)\n\nBetreuungsverein \"Anima Zeitz e.V.\"\neingetragener Verein\nZeitz\n\nNicht eingetragen:\nDen Gläubigern der an der Verschmelzung beteiligten Rechtsträger ist, wenn sie binnen sechs Monaten nach dem Tag, an dem die Eintragung der Verschmelzung nach § 19 Abs. 3 UmwG als bekanntgemacht gilt, ihren Anspruch nach Grund und Höhe schriftlich anmelden, Sicherheit zu leisten, soweit sie nicht Befriedigung verlangen können. Dieses Recht steht ihnen jedoch nur zu, wenn sie glaubhaft machen, dass durch die Verschmelzung die Erfüllung ihrer Forderung gefährdet wird."
    },
    {
      "date": "2025-12-23",
      "id": "140897",
      "original_text": "Registerbekanntmachung nach dem Umwandlungsgesetz\nSachsen-Anhalt Amtsgericht Stendal VR 46336\nBetreuungsverein Merseburg e. V. – Merseburg",
      "type": "Registerbekanntmachung nach dem Umwandlungsgesetz",
      "state": "Sachsen-Anhalt",
      "amtsgericht": "Amtsgericht Stendal",
      "registernummer": "VR 46336",
      "registerart": "VR",
      "company_name": "Betreuungsverein Merseburg e. V.",
      "company_seat": "Merseburg",
      "details": "23.12.2025 (Bekanntmachungsdatum)\n\nSachsen-Anhalt Amtsgericht Stendal VR 46336\nRegisterbekanntmachung nach dem Umwandlungsgesetz 23.12.2025 (Eintragungsdatum)\n\nBetreuungsverein Merseburg e. V.\neingetragener Verein\nMerseburg\n\nNicht eingetragen:\nDen Gläubigern der an der Verschmelzung beteiligten Rechtsträger ist, wenn sie binnen sechs Monaten nach dem Tag, an dem die Eintragung der Verschmelzung nach § 19 Abs. 3 UmwG als bekanntgemacht gilt, ihren Anspruch nach Grund und Höhe schriftlich anmelden, Sicherheit zu leisten, soweit sie nicht Befriedigung verlangen können. Dieses Recht steht ihnen jedoch nur zu, wenn sie glaubhaft machen, dass durch die Verschmelzung die Erfüllung ihrer Forderung gefährdet wird."
    },
    {
      "date": "2025-12-23",
      "id": "140898",
      "original_text": "Registerbekanntmachung nach dem Umwandlungsgesetz\nBaden-Württemberg Amtsgericht Stuttgart HRB 754578\nEnsslen Montage & Service GmbH – Ebhausen",
      "type": "Registerbekanntmachung nach dem Umwandlungsgesetz",
      "state": "Baden-Württemberg",
      "amtsgericht": "Amtsgericht Stuttgart",
      "registernummer": "HRB 754578",
      "registerart": "HRB",
      "company_name": "Ensslen Montage & Service GmbH",
      "company_seat": "Ebhausen",
      "details": "23.12.2025 (Bekanntmachungsdatum)\n\nBaden-Württemberg Amtsgericht Stuttgart HRB 754578\nRegisterbekanntmachung nach dem Umwandlungsgesetz 23.12.2025 (Eintragungsdatum)\n\nEnsslen Montage & Service GmbH\nGesellschaft mit beschränkter Haftung\nEbhausen\n\nAls nicht eingetragen wird bekanntgemacht:\nDen Gläubigern der an der Verschmelzung beteiligten Rechtsträger ist, wenn sie binnen sechs Monaten nach dem Tag, an dem die Eintragung der Verschmelzung in das Register des Sitzes desjenigen Rechtsträgers, dessen Gläubiger sie sind, nach § 19 Abs. 3 UmwG als bekanntgemacht gilt, ihren Anspruch nach Grund und Höhe schriftlich anmelden, Sicherheit zu leisten, soweit sie nicht Befriedigung verlangen können. Dieses Recht steht den Gläubigern jedoch nur zu, wenn sie glaubhaft machen, dass durch die Verschmelzung die Erfüllung ihrer Forderung gefährdet wird."
    },
    {
      "date": "2025-12-23",
      "id": "140899",
      "original_text": "Registerbekanntmachung nach dem Umwandlungsgesetz\nBaden-Württemberg Amtsgericht Stuttgart HRB 768914\nCue Solutions GmbH – Ebhausen",
      "type": "Registerbekanntmachung nach dem Umwandlungsgesetz",
      "state": "Baden-Württemberg",
      "amtsgericht": "Amtsgericht Stuttgart",
      "registernummer": "HRB 768914",
      "registerart": "HRB",
      "company_name": "Cue Solutions GmbH",
      "company_seat": "Ebhausen",
      "details": "23.12.2025 (Bekanntmachungsdatum)\n\nBaden-Württemberg Amtsgericht Stuttgart HRB 768914\nRegisterbekanntmachung nach dem Umwandlungsgesetz 23.12.2025 (Eintragungsdatum)\n\nCue Solutions GmbH\nGesellschaft mit beschränkter Haftung\nEbhausen\n\nDen Gläubigern der an der Verschmelzung beteiligten Rechtsträger ist, wenn sie binnen sechs Monaten nach dem Tag, an dem die Eintragung der Verschmelzung in das Register des Sitzes desjenigen Rechtsträgers, dessen Gläubiger sie sind, nach § 19 Abs. 3 UmwG als bekanntgemacht gilt, ihren Anspruch nach Grund und Höhe schriftlich anmelden, Sicherheit zu leisten, soweit sie nicht Befriedigung verlangen können. Dieses Recht steht den Gläubigern jedoch nur zu, wenn sie glaubhaft machen, dass durch die Verschmelzung die Erfüllung ihrer Forderung gefährdet wird."
    },
    {
      "date": "2025-12-23",
      "id": "140900",
      "original_text": "Registerbekanntmachung nach dem Umwandlungsgesetz\nSachsen-Anhalt Amtsgericht Stendal HRB 35805\nPflegezentrum Möhlau GmbH – Gräfenhainichen",
      "type": "Registerbekanntmachung nach dem Umwandlungsgesetz",
      "state": "Sachsen-Anhalt",
      "amtsgericht": "Amtsgericht Stendal",
      "registernummer": "HRB 35805",
      "registerart": "HRB",
      "company_name": "Pflegezentrum Möhlau GmbH",
      "company_seat": "Gräfenhainichen",
      "details": "23.12.2025 (Bekanntmachungsdatum)\n\nSachsen-Anhalt Amtsgericht Stendal HRB 35805\nRegisterbekanntmachung nach dem Umwandlungsgesetz 23.12.2025 (Eintragungsdatum)\n\nPflegezentrum Möhlau GmbH\nGesellschaft mit beschränkter Haftung\nGräfenhainichen\n\nNicht eingetragen:\nDen Gläubigern der an der Ausgliederung beteiligten Rechtsträger, ist wenn sie binnen sechs Monaten nach dem Tag, an dem die Eintragung der Ausgliederung nach §§125, 19 Abs. 3 UmwG als bekanntgemacht gilt, ihren Anspruch nach Grund und Höhe schriftlich anmelden, Sicherheit zu leisten, soweit sie nicht Befriedigung verlangen können. Diese Recht steht ihnen jedoch nur zu, wenn sie glaubhaft machen, dass durch die Ausgliederung die Erfüllung ihrer Forderung gefährdet wird."
    },
    {
      "date": "2025-12-23",
      "id": "140901",
      "original_text": "Registerbekanntmachung nach dem Umwandlungsgesetz\nSachsen-Anhalt Amtsgericht Stendal HRA 8356\nPflegedienst Ilona Wudel e.K. – Gräfenhainichen",
      "type": "Registerbekanntmachung nach dem Umwandlungsgesetz",
      "state": "Sachsen-Anhalt",
      "amtsgericht": "Amtsgericht Stendal",
      "registernummer": "HRA 8356",
      "registerart": "HRA",
      "company_name": "Pflegedienst Ilona Wudel e.K.",
      "company_seat": "Gräfenhainichen",
      "details": "23.12.2025 (Bekanntmachungsdatum)\n\nSachsen-Anhalt Amtsgericht Stendal HRA 8356\nRegisterbekanntmachung nach dem Umwandlungsgesetz 23.12.2025 (Eintragungsdatum)\n\nPflegedienst Ilona Wudel e.K.\nEinzelkaufmann / Einzelkauffrau\nGräfenhainichen\n\nNicht eingetragen:\nDen Gläubigern der an der Ausgliederung beteiligten Rechtsträger, ist wenn sie binnen sechs Monaten nach dem Tag, an dem die Eintragung der Ausgliederung nach §§125, 19 Abs. 3 UmwG als bekanntgemacht gilt, ihren Anspruch nach Grund und Höhe schriftlich anmelden, Sicherheit zu leisten, soweit sie nicht Befriedigung verlangen können. Diese Recht steht ihnen jedoch nur zu, wenn sie glaubhaft machen, dass durch die Ausgliederung die Erfüllung ihrer Forderung gefährdet wird."
    },
    {
      "date": "2025-12-23",
      "id": "140902",
      "original_text": "Einreichung neuer Dokumente\nBaden-Württemberg Amtsgericht Mannheim HRB 351795\nSAD Sonderabfall-Deponiegesellschaft Baden-Württemberg mbH – Malsch",
      "type": "Einreichung neuer Dokumente",
      "state": "Baden-Württemberg",
      "amtsgericht": "Amtsgericht Mannheim",
      "registernummer": "HRB 351795",
      "registerart": "HRB",
      "company_name": "SAD Sonderabfall-Deponiegesellschaft Baden-Württemberg mbH",
      "company_seat": "Malsch",
      "details": "23.12.2025 (Bekanntmachungsdatum)\n\nBaden-Württemberg Amtsgericht Mannheim HRB 351795\nEinreichung neuer Dokumente\n\nSAD Sonderabfall-Deponiegesellschaft Baden-Württemberg mbH\nGesellschaft mit beschränkter Haftung\nMalsch\n\nDie Gesellschaft hat am 10.12.2025 die Liste über die Zusammensetzung des Aufsichtsrats zum Handelsregister eingereicht."
    },
    {
      "date": "2025-12-23",
      "id": "140903",
      "original_text": "Registerbekanntmachung nach dem Umwandlungsgesetz\nMecklenburg-Vorpommern Amtsgericht Neubrandenburg HRB 16108 früher Amtsgericht Stralsund\nBiogas Anklam Verwaltungs-GmbH – Anklam",
      "type": "Registerbekanntmachung nach dem Umwandlungsgesetz",
      "state": "Mecklenburg-Vorpommern",
      "amtsgericht": "Amtsgericht Neubrandenburg",
      "registernummer": "HRB 16108",
      "registerart": "HRB",
      "company_name": "Biogas Anklam Verwaltungs-GmbH",
      "company_seat": "Anklam",
      "former_amtsgericht": "Stralsund",
      "details": "23.12.2025 (Bekanntmachungsdatum)\n\nMecklenburg-Vorpommern Amtsgericht Neubrandenburg HRB 16108 früher Amtsgericht Stralsund\nRegisterbekanntmachung nach dem Umwandlungsgesetz 23.12.2025 (Eintragungsdatum)\n\nBiogas Anklam Verwaltungs-GmbH\nGesellschaft mit beschränkter Haftung\nAnklam\n\nAls nicht eingetragen wird veröffentlicht: Den Gläubigern der an der Verschmelzung beteiligten Rechtsträger ist, wenn sie binnen sechs Monaten nach dem Tag, an dem die Eintragung der Verschmelzung in das Register des Sitzes desjenigen Rechtsträgers, dessen Gläubiger sie sind, nach § 19 Abs. 3 UmwG als bekannt gemacht gilt,\nihren Anspruch nach Grund und Höhe in Textform anmelden, Sicherheit zu leisten, soweit sie nicht Befriedigung verlangen können. Dieses Recht steht den Gläubigern jedoch nur zu, wenn sie glaubhaft machen, dass durch die Verschmelzung die Erfüllung der Forderung gefährdet wird."
    },
    {
      "date": "2025-12-23",
      "id": "140904",
      "original_text": "Registerbekanntmachung nach dem Umwandlungsgesetz\nBaden-Württemberg Amtsgericht Freiburg HRA 709254\nSchieß GmbH & Co. KG – Konstanz",
      "type": "Registerbekanntmachung nach dem Umwandlungsgesetz",
      "state": "Baden-Württemberg",
      "amtsgericht": "Amtsgericht Freiburg",
      "registernummer": "HRA 709254",
      "registerart": "HRA",
      "company_name": "Schieß GmbH & Co. KG",
      "company_seat": "Konstanz",
      "details": "23.12.2025 (Bekanntmachungsdatum)\n\nBaden-Württemberg Amtsgericht Freiburg HRA 709254\nRegisterbekanntmachung nach dem Umwandlungsgesetz 23.12.2025 (Eintragungsdatum)\n\nSchieß GmbH & Co. KG\nKommanditgesellschaft\nKonstanz\n\nDen Gläubigern der an der Ausgliederung beteiligten Rechtsträger ist, wenn sie binnen sechs Monaten nach dem Tag, an dem die Eintragung der Ausgliederung in das Register des Sitzes desjenigen Rechtsträgers, dessen Gläubiger sie sind, nach § 19 Abs. 3 UmwG als bekanntgemacht gilt, ihren Anspruch nach Grund und Höhe schriftlich anmelden, Sicherheit zu leisten, soweit sie nicht Befriedigung verlangen können. Dieses Recht steht den Gläubigern jedoch nur zu, wenn sie glaubhaft machen, dass durch die Ausgliederung die Erfüllung ihrer Forderung gefährdet wird."
    },
    {
      "date": "2025-12-23",
      "id": "140905",
      "original_text": "Löschungsankündigung\nBerlin Amtsgericht Berlin (Charlottenburg) HRB 265855\nSimay Haushaltshilfe UG (haftungsbeschränkt) – Berlin",
      "type": "Löschungsankündigung",
      "state": "Berlin",
      "amtsgericht": "Amtsgericht Berlin (Charlottenburg)",
      "registernummer": "HRB 265855",
      "registerart": "HRB",
      "company_name": "Simay Haushaltshilfe UG (haftungsbeschränkt)",
      "company_seat": "Berlin",
      "details": "23.12.2025 (Bekanntmachungsdatum)\n\nBerlin Amtsgericht Berlin (Charlottenburg) HRB 265855\nLöschungsankündigung\n\nSimay Haushaltshilfe UG (haftungsbeschränkt)\nGesellschaft mit beschränkter Haftung\nBerlin\n\nBei der nachstehenden Gesellschaft wird das Amtslöschungsverfahren gemäß § 394 FamFG eingeleitet. Widerspruchsfrist 6 Wochen"
    },
    {
      "date": "2025-12-23",
      "id": "140906",
      "original_text": "Registerbekanntmachung nach dem Umwandlungsgesetz\nBaden-Württemberg Amtsgericht Freiburg HRA 709234\nDetlev Schieß e. K. – Konstanz",
      "type": "Registerbekanntmachung nach dem Umwandlungsgesetz",
      "state": "Baden-Württemberg",
      "amtsgericht": "Amtsgericht Freiburg",
      "registernummer": "HRA 709234",
      "registerart": "HRA",
      "company_name": "Detlev Schieß e. K.",
      "company_seat": "Konstanz",
      "details": "23.12.2025 (Bekanntmachungsdatum)\n\nBaden-Württemberg Amtsgericht Freiburg HRA 709234\nRegisterbekanntmachung nach dem Umwandlungsgesetz 23.12.2025 (Eintragungsdatum)\n\nDetlev Schieß e. K.\nEinzelkaufmann / Einzelkauffrau\nKonstanz\n\nAls nicht eingetragen wird bekanntgemacht:\nDen Gläubigern der an der Ausgliederung beteiligten Rechtsträger ist, wenn sie binnen sechs Monaten nach dem Tag, an dem die Eintragung der Ausgliederung in das Register des Sitzes desjenigen Rechtsträgers, dessen Gläubiger sie sind, nach § 19 Abs. 3 UmwG als bekanntgemacht gilt, ihren Anspruch nach Grund und Höhe schriftlich anmelden, Sicherheit zu leisten, soweit sie nicht Befriedigung verlangen können. Dieses Recht steht den Gläubigern jedoch nur zu, wenn sie glaubhaft machen, dass durch die Ausgliederung die Erfüllung ihrer Forderung gefährdet wird."
    },
    {
      "date": "2025-12-23",
      "id": "140907",
      "original_text": "Einreichung neuer Dokumente\nBaden-Württemberg Amtsgericht Stuttgart HRB 740510\nTransnetBW GmbH – Stuttgart",
      "type": "Einreichung neuer Dokumente",
      "state": "Baden-Württemberg",
      "amtsgericht": "Amtsgericht Stuttgart",
      "registernummer": "HRB 740510",
      "registerart": "HRB",
      "company_name": "TransnetBW GmbH",
      "company_seat": "Stuttgart",
      "details": "23.12.2025 (Bekanntmachungsdatum)\n\nBaden-Württemberg Amtsgericht Stuttgart HRB 740510\nEinreichung neuer Dokumente\n\nTransnetBW GmbH\nGesellschaft mit beschränkter Haftung\nStuttgart\n\nDie Gesellschaft hat am 20.12.2025 die Liste über die Zusammensetzung des Aufsichtsrats zum Handelsregister eingereicht."
    },
    {
      "date": "2025-12-23",
      "id": "140908",
      "original_text": "Registerbekanntmachung nach dem Umwandlungsgesetz\nBaden-Württemberg Amtsgericht Mannheim HRB 756777\nProFashion GmbH – Nußloch",
      "type": "Registerbekanntmachung nach dem Umwandlungsgesetz",
      "state": "Baden-Württemberg",
      "amtsgericht": "Amtsgericht Mannheim",
      "registernummer": "HRB 756777",
      "registerart": "HRB",
      "company_name": "ProFashion GmbH",
      "company_seat": "Nußloch",
      "details": "23.12.2025 (Bekanntmachungsdatum)\n\nBaden-Württemberg Amtsgericht Mannheim HRB 756777\nRegisterbekanntmachung nach dem Umwandlungsgesetz 23.12.2025 (Eintragungsdatum)\n\nProFashion GmbH\nGesellschaft mit beschränkter Haftung\nNußloch\n\nDen Gläubigern der an der Verschmelzung beteiligten Rechtsträger ist, wenn sie binnen sechs Monaten nach dem Tag, an dem die Eintragung der Verschmelzung in das Register des Sitzes desjenigen Rechtsträgers, dessen Gläubiger sie sind, nach § 19 Abs. 3 UmwG als bekanntgemacht gilt, ihren Anspruch nach Grund und Höhe schriftlich anmelden, Sicherheit zu leisten, soweit sie nicht Befriedigung verlangen können. Dieses Recht steht den Gläubigern jedoch nur zu, wenn sie glaubhaft machen, dass durch die Verschmelzung die Erfüllung ihrer Forderung gefährdet wird."
    },
    {
      "date": "2025-12-23",
      "id": "140909",
      "original_text": "Registerbekanntmachung nach dem Umwandlungsgesetz\nBaden-Württemberg Amtsgericht Mannheim HRB 337468\nProFashion GmbH – Nußloch",
      "type": "Registerbekanntmachung nach dem Umwandlungsgesetz",
      "state": "Baden-Württemberg",
      "amtsgericht": "Amtsgericht Mannheim",
      "registernummer": "HRB 337468",
      "registerart": "HRB",
      "company_name": "ProFashion GmbH",
      "company_seat": "Nußloch",
      "details": "23.12.2025 (Bekanntmachungsdatum)\n\nBaden-Württemberg Amtsgericht Mannheim HRB 337468\nRegisterbekanntmachung nach dem Umwandlungsgesetz 23.12.2025 (Eintragungsdatum)\n\nProFashion GmbH\nGesellschaft mit beschränkter Haftung\nNußloch\n\nAls nicht eingetragen wird bekanntgemacht: Den Gläubigern der an der Verschmelzung beteiligten Rechtsträger ist, wenn sie binnen sechs Monaten nach dem Tag, an dem die Eintragung der Verschmelzung in das Register des Sitzes desjenigen Rechtsträgers, dessen Gläubiger sie sind, nach § 19 Abs. 3 UmwG als bekanntgemacht gilt, ihren Anspruch nach Grund und Höhe schriftlich anmelden, Sicherheit zu leisten, soweit sie nicht Befriedigung verlangen können. Dieses Recht steht den Gläubigern jedoch nur zu, wenn sie glaubhaft machen, dass durch die Verschmelzung die Erfüllung ihrer Forderung gefährdet wird."
    },
    {
      "date": "2025-12-23",
      "id": "140910",
      "original_text": "Einreichung neuer Dokumente\nSachsen-Anhalt Amtsgericht Stendal HRB 110853\nthyssenkrupp Dynamic Components GmbH – Ilsenburg (Harz)",
      "type": "Einreichung neuer Dokumente",
      "state": "Sachsen-Anhalt",
      "amtsgericht": "Amtsgericht Stendal",
      "registernummer": "HRB 110853",
      "registerart": "HRB",
      "company_name": "thyssenkrupp Dynamic Components GmbH",
      "company_seat": "Ilsenburg (Harz)",
      "details": "23.12.2025 (Bekanntmachungsdatum)\n\nSachsen-Anhalt Amtsgericht Stendal HRB 110853\nEinreichung neuer Dokumente\n\nthyssenkrupp Dynamic Components GmbH\nGesellschaft mit beschränkter Haftung\nIlsenburg (Harz)\n\nEine Liste der Mitglieder des Aufsichtsrates wurde zum Handelsregister eingereicht."
    },
    {
      "date": "2025-12-23",
      "id": "140911",
      "original_text": "Einreichung neuer Dokumente\nBaden-Württemberg Amtsgericht Stuttgart HRB 17967\nDEHOGA Tourismus Baden-Württemberg GmbH – Stuttgart",
      "type": "Einreichung neuer Dokumente",
      "state": "Baden-Württemberg",
      "amtsgericht": "Amtsgericht Stuttgart",
      "registernummer": "HRB 17967",
      "registerart": "HRB",
      "company_name": "DEHOGA Tourismus Baden-Württemberg GmbH",
      "company_seat": "Stuttgart",
      "details": "23.12.2025 (Bekanntmachungsdatum)\n\nBaden-Württemberg Amtsgericht Stuttgart HRB 17967\nEinreichung neuer Dokumente\n\nDEHOGA Tourismus Baden-Württemberg GmbH\nGesellschaft mit beschränkter Haftung\nStuttgart\n\nDie Gesellschaft hat am 22.12.2025 die Liste über die Zusammensetzung des Aufsichtsrats zum Handelsregister eingereicht."
    },
    {
      "date": "2025-12-23",
      "id": "140912",
      "original_text": "Löschungsankündigung\nBerlin Amtsgericht Berlin (Charlottenburg) HRB 90313\nProti Beteiligungsgesellschaft mbH – Berlin",
      "type": "Löschungsankündigung",
      "state": "Berlin",
      "amtsgericht": "Amtsgericht Berlin (Charlottenburg)",
      "registernummer": "HRB 90313",
      "registerart": "HRB",
      "company_name": "Proti Beteiligungsgesellschaft mbH",
      "company_seat": "Berlin",
      "details": "23.12.2025 (Bekanntmachungsdatum)\n\nBerlin Amtsgericht Berlin (Charlottenburg) HRB 90313\nLöschungsankündigung\n\nProti Beteiligungsgesellschaft mbH\nGesellschaft mit beschränkter Haftung\nBerlin\n\nBei der nachstehenden Gesellschaft wird das Amtslöschungsverfahren gemäß § 394 FamFG eingeleitet. Widerspruchsfrist 6 Wochen"
    },
    {
      "date": "2025-12-23",
      "id": "140913",
      "original_text": "Registerbekanntmachung nach dem Umwandlungsgesetz\nSchleswig-Holstein Amtsgericht Pinneberg HRB 12110\nKuchel Verwaltungs GmbH – Heide",
      "type": "Registerbekanntmachung nach dem Umwandlungsgesetz",
      "state": "Schleswig-Holstein",
      "amtsgericht": "Amtsgericht Pinneberg",
      "registernummer": "HRB 12110",
      "registerart": "HRB",
      "company_name": "Kuchel Verwaltungs GmbH",
      "company_seat": "Heide",
      "details": "23.12.2025 (Bekanntmachungsdatum)\n\nSchleswig-Holstein Amtsgericht Pinneberg HRB 12110\nRegisterbekanntmachung nach dem Umwandlungsgesetz 23.12.2025 (Eintragungsdatum)\n\nKuchel Verwaltungs GmbH\nGesellschaft mit beschränkter Haftung\nHeide\n\nZu Eintragungsnummer 2 vom 23.12.2025 wird als nicht eingetragen veröffentlicht: Den Gläubigern der an der Verschmelzung beteiligten Rechtsträger ist, wenn sie binnen sechs Monaten nach dem Tag, an dem die Eintragung der Verschmelzung in das Register des Sitzes desjenigen Rechtsträgers, dessen Gläubiger sie sind, als bekannt gemacht gilt, ihren Anspruch nach Grund und Höhe schriftlich anmelden, Sicherheit zu leisten, soweit sie nicht Befriedigung verlangen können. Dieses Recht steht den Gläubigern jedoch nur zu, wenn sie glaubhaft machen, dass durch die Verschmelzung die Erfüllung ihrer Forderung gefährdet wird. Das Recht, Sicherheitsleistung zu verlangen, steht Gläubigern nicht zu, die im Falle der Insolvenz ein Recht auf vorzugsweise Befriedigung aus einer Deckungsmasse haben, die nach gesetzlicher Vorschrift zu ihrem Schutz errichtet und staatlich überwacht ist."
    },
    {
      "date": "2025-12-23",
      "id": "140914",
      "original_text": "Registerbekanntmachung nach dem Umwandlungsgesetz\nHamburg Amtsgericht Hamburg HRB 181011\nRyan Specialty Europe GmbH – Hamburg",
      "type": "Registerbekanntmachung nach dem Umwandlungsgesetz",
      "state": "Hamburg",
      "amtsgericht": "Amtsgericht Hamburg",
      "registernummer": "HRB 181011",
      "registerart": "HRB",
      "company_name": "Ryan Specialty Europe GmbH",
      "company_seat": "Hamburg",
      "details": "23.12.2025 (Bekanntmachungsdatum)\n\nHamburg Amtsgericht Hamburg HRB 181011\nRegisterbekanntmachung nach dem Umwandlungsgesetz 23.12.2025 (Eintragungsdatum)\n\nRyan Specialty Europe GmbH\nGesellschaft mit beschränkter Haftung\nHamburg\n\nAls nicht eingetragen wird bekannt gemacht:\nDen Gläubigern der an der grenzüberschreitenden Verschmelzung beteiligten übernehmenden Rechtsträger ist, wenn sie binnen sechs Monaten nach dem Tag, an dem die Eintragung der Verschmelzung in das Register des Sitzes desjenigen Rechtsträgers, dessen Gläubiger sie sind, nach § 19 Absatz 3 UmwG als bekanntgemacht gilt, ihren Anspruch nach Grund und Höhe schriftlich anmelden, Sicherheit zu leisten, soweit sie nicht Befriedigung verlangen können.\nDieses Recht steht den Gläubigern jedoch nur zu, wenn sie glaubhaft machen, dass durch die Verschmelzung die Erfüllung ihrer Forderung gefährdet wird."
    },
    {
      "date": "2025-12-23",
      "id": "140915",
      "original_text": "Registerbekanntmachung nach dem Umwandlungsgesetz\nHamburg Amtsgericht Hamburg HRB 181011\nRyan Specialty Europe GmbH – Hamburg",
      "type": "Registerbekanntmachung nach dem Umwandlungsgesetz",
      "state": "Hamburg",
      "amtsgericht": "Amtsgericht Hamburg",
      "registernummer": "HRB 181011",
      "registerart": "HRB",
      "company_name": "Ryan Specialty Europe GmbH",
      "company_seat": "Hamburg",
      "details": "23.12.2025 (Bekanntmachungsdatum)\n\nHamburg Amtsgericht Hamburg HRB 181011\nRegisterbekanntmachung nach dem Umwandlungsgesetz 23.12.2025 (Eintragungsdatum)\n\nRyan Specialty Europe GmbH\nGesellschaft mit beschränkter Haftung\nHamburg\n\nAls nicht eingetragen wird bekannt gemacht:\nDen Gläubigern der an der grenzüberschreitenden Verschmelzung beteiligten übernehmenden Rechtsträger ist, wenn sie binnen sechs Monaten nach dem Tag, an dem die Eintragung der Verschmelzung in das Register des Sitzes desjenigen Rechtsträgers, dessen Gläubiger sie sind, nach § 19 Absatz 3 UmwG als bekanntgemacht gilt, ihren Anspruch nach Grund und Höhe schriftlich anmelden, Sicherheit zu leisten, soweit sie nicht Befriedigung verlangen können.\nDieses Recht steht den Gläubigern jedoch nur zu, wenn sie glaubhaft machen, dass durch die Verschmelzung die Erfüllung ihrer Forderung gefährdet wird."
    },
    {
      "date": "2025-12-23",
      "id": "140916",
      "original_text": "Sonstige Registerbekanntmachung\nMecklenburg-Vorpommern Amtsgericht Schwerin HRB 12837\nFINVEST Capital AG – Plate",
      "type": "Sonstige Registerbekanntmachung",
      "state": "Mecklenburg-Vorpommern",
      "amtsgericht": "Amtsgericht Schwerin",
      "registernummer": "HRB 12837",
      "registerart": "HRB",
      "company_name": "FINVEST Capital AG",
      "company_seat": "Plate",
      "details": "23.12.2025 (Bekanntmachungsdatum)\n\nMecklenburg-Vorpommern Amtsgericht Schwerin HRB 12837\nSonstige Registerbekanntmachung 23.12.2025 (Eintragungsdatum)\n\nFINVEST Capital AG\nAktiengesellschaft\nPlate\n\nEine Liste der Mitglieder des Aufsichtsrats ist zum Handelsregister eingereicht worden."
    },
    {
      "date": "2025-12-23",
      "id": "140917",
      "original_text": "Registerbekanntmachung nach dem Umwandlungsgesetz\nBerlin Amtsgericht Berlin (Charlottenburg) HRB 126422\nRB Immo-Expertise GmbH – Berlin",
      "type": "Registerbekanntmachung nach dem Umwandlungsgesetz",
      "state": "Berlin",
      "amtsgericht": "Amtsgericht Berlin (Charlottenburg)",
      "registernummer": "HRB 126422",
      "registerart": "HRB",
      "company_name": "RB Immo-Expertise GmbH",
      "company_seat": "Berlin",
      "details": "23.12.2025 (Bekanntmachungsdatum)\n\nBerlin Amtsgericht Berlin (Charlottenburg) HRB 126422\nRegisterbekanntmachung nach dem Umwandlungsgesetz 18.12.2025 (Eintragungsdatum)\n\nRB Immo-Expertise GmbH\nGesellschaft mit beschränkter Haftung\nBerlin\n\nZu Eintragungsnummer 6 vom 18.12.2025 wird als nicht eingetragen veröffentlicht: Den Gläubigern der an der Verschmelzung beteiligten Rechtsträger ist, wenn sie binnen sechs Monaten nach dem Tag, an dem die Eintragung der Verschmelzung in das Register des Sitzes desjenigen Rechtsträgers, dessen Gläubiger sie sind, als bekannt gemacht gilt, ihren Anspruch nach Grund und Höhe schriftlich anmelden, Sicherheit zu leisten, soweit sie nicht Befriedigung verlangen können. Dieses Recht steht den Gläubigern jedoch nur zu, wenn sie glaubhaft machen, dass durch die Verschmelzung die Erfüllung ihrer Forderung gefährdet wird. Das Recht, Sicherheitsleistung zu verlangen, steht Gläubigern nicht zu, die im Falle der Insolvenz ein Recht auf vorzugsweise Befriedigung aus einer Deckungsmasse haben, die nach gesetzlicher Vorschrift zu ihrem Schutz errichtet und staatlich überwacht ist."
    },
    {
      "date": "2025-12-23",
      "id": "140918",
      "original_text": "Sonstige Registerbekanntmachung\nMecklenburg-Vorpommern Amtsgericht Schwerin HRB 14177\nAbfallwirtschaftsgesellschaft Ludwigslust-Parchim mbH – Ludwigslust",
      "type": "Sonstige Registerbekanntmachung",
      "state": "Mecklenburg-Vorpommern",
      "amtsgericht": "Amtsgericht Schwerin",
      "registernummer": "HRB 14177",
      "registerart": "HRB",
      "company_name": "Abfallwirtschaftsgesellschaft Ludwigslust-Parchim mbH",
      "company_seat": "Ludwigslust",
      "details": "23.12.2025 (Bekanntmachungsdatum)\n\nMecklenburg-Vorpommern Amtsgericht Schwerin HRB 14177\nSonstige Registerbekanntmachung 23.12.2025 (Eintragungsdatum)\n\nAbfallwirtschaftsgesellschaft Ludwigslust-Parchim mbH\nGesellschaft mit beschränkter Haftung\nLudwigslust\n\nEine Liste der Mitglieder des Aufsichtsrats ist zum Handelsregister eingereicht worden."
    },
    {
      "date": "2025-12-23",
      "id": "140919",
      "original_text": "Löschungsankündigung\nBerlin Amtsgericht Berlin (Charlottenburg) HRB 250010\nPhysiotherapie Relax GmbH – Berlin",
      "type": "Löschungsankündigung",
      "state": "Berlin",
      "amtsgericht": "Amtsgericht Berlin (Charlottenburg)",
      "registernummer": "HRB 250010",
      "registerart": "HRB",
      "company_name": "Physiotherapie Relax GmbH",
      "company_seat": "Berlin",
      "details": "23.12.2025 (Bekanntmachungsdatum)\n\nBerlin Amtsgericht Berlin (Charlottenburg) HRB 250010\nLöschungsankündigung\n\nPhysiotherapie Relax GmbH\nGesellschaft mit beschränkter Haftung\nBerlin\n\nBei der nachstehenden Gesellschaft wird das Amtslöschungsverfahren gemäß § 394 FamFG eingeleitet. Widerspruchsfrist 6 Wochen"
    },
    {
      "date": "2025-12-23",
      "id": "140920",
      "original_text": "Einreichung neuer Dokumente\nThüringen Amtsgericht Jena HRB 209127\nBöttcher AG – Jena",
      "type": "Einreichung neuer Dokumente",
      "state": "Thüringen",
      "amtsgericht": "Amtsgericht Jena",
      "registernummer": "HRB 209127",
      "registerart": "HRB",
      "company_name": "Böttcher AG",
      "company_seat": "Jena",
      "details": "23.12.2025 (Bekanntmachungsdatum)\n\nThüringen Amtsgericht Jena HRB 209127\nEinreichung neuer Dokumente\n\nBöttcher AG\nAktiengesellschaft\nJena\n\nBekanntmachung gem. § 106 AktG: Aufgrund einer Veränderung in den Personen der Aufsichtsratsmitglieder ist durch den Vorstand eine neue Liste zum Handelsregister eingereicht worden."
    },
    {
      "date": "2025-12-23",
      "id": "140921",
      "original_text": "Registerbekanntmachung nach dem Umwandlungsgesetz\nBerlin Amtsgericht Berlin (Charlottenburg) HRB 188816\nSpeyerer Straße 3 Immobilienverwaltung GmbH – Berlin",
      "type": "Registerbekanntmachung nach dem Umwandlungsgesetz",
      "state": "Berlin",
      "amtsgericht": "Amtsgericht Berlin (Charlottenburg)",
      "registernummer": "HRB 188816",
      "registerart": "HRB",
      "company_name": "Speyerer Straße 3 Immobilienverwaltung GmbH",
      "company_seat": "Berlin",
      "details": "23.12.2025 (Bekanntmachungsdatum)\n\nBerlin Amtsgericht Berlin (Charlottenburg) HRB 188816\nRegisterbekanntmachung nach dem Umwandlungsgesetz\n\nSpeyerer Straße 3 Immobilienverwaltung GmbH\nGesellschaft mit beschränkter Haftung\nBerlin\n\nAls nicht eingetragen wird veröffentlicht:\n\nDie Gesellschaft hat den Entwurf eines Formwechselplans betreffend den grenzüberschreitenden, identitätswahrenden Formwechsel unter gleichzeitiger Verlegung des Satzungssitzes der Gesellschaft nach Luxemburg gemäß §§ 333 ff. UmwG zum Handelsregister des Amtsgerichts Charlottenburg eingereicht.\n\n1. § 336 UmwG i.V.m. § 308 Abs. 1 S. 2 Nr. 1 UmwG:\n\nDie Gesellschaft hat den Entwurf des Formwechselplans betreffend den grenzüberschreitenden Formwechsel im Wege des Herausformwechsels ohne Abwicklung und Auflösung von einer deutschen GmbH in eine reine Société à responsabilité\nlimitée (S.à r.l.) luxemburgischen Rechts mit gleichzeitiger Verlegung des Satzungssitzes nach Luxemburg, Großherzogtum Luxemburg, beim Handelsregister des Amtsgerichts Berlin (Charlottenburg) gemäß § 336 UmwG in Verbindung mit § 308 Abs. 1 Satz 2 Nr. 1 UmwG eingereicht.\n\n2. § 336 UmwG i.V.m. § 308 Abs. 1 S. 2 Nr. 2 UmwG:\n\nAn dem grenzüberschreitenden Formwechsel ist die Speyerer Straße 3 Immobilienverwaltung GmbH mit Satzungssitz in Berlin, Deutschland, eine nach deutschem Recht bestehende Gesellschaft mit beschränkter Haftung, beteiligt. Nach dem grenzüberschreitenden Formwechsel wird die Gesellschaft die Rechtsform einer reinen Société à responsabilité limitée (S.à r.l.),\neine Gesellschaft mit beschränkter Haftung nach dem Recht des Großherzogtums Luxemburg, annehmen und als Speyerer Straße 3 Immobilienverwaltung S.à. r.l mit Satzungssitz in Luxemburg, Großherzogtum Luxemburg firmieren.\n\n3. § 336 UmwG i.V.m. § 308 Abs. 1 S. 2 Nr. 3 UmwG:\n\nDie Gesellschaft ist im Handelsregister des Amtsgerichts Berlin (Charlottenburg) unter der Handelsregistemummer HRB 188816 B\neingetragen. Die Gesellschaft ist zudem im Handels- und Gesellschaftsregister von Luxemburg (Registre de commerce et des sociétés Luxembourg) unter der Nummer B228415 eingetragen, welche auch künftig fortbestehen wird.\n\n4. § 336 UmwG i.V.m. § 308 Abs. 1 S. 2 Nr. 4 UmwG:\n\nDie Gesellschafterversammlung zum Beschluss des grenzüberschreitenden Formwechsels ist für den Tag geplant, der auf den Ablauf von einem Monat nach dem Tag der Registerbekanntmachung des Formwechselplans folgt, oder ggfs. den nächsten Arbeitstag (wobei Samstage, Sonntage und bundesweite Feiertage nicht als Arbeitstage zählen).\n\na) Die Anteilsinhaber und die Gläubiger der Gesellschaft erhalten den Hinweis, dass sie spätestens fünf Arbeitstage vor dem Tag der Gesellschafterversammlung der Gesellschaft Bemerkungen zum Formwechselplan übermitteln können.\n\nb) Einen Betriebsrat gibt es nicht, die Gesellschaft hat keine Arbeitnehmer. Der guten Ordnung halber erfolgt gleichwohl der Hinweis, dass die zuständigen Betriebsräte der Gesellschaft oder, soweit es keinen Betriebsrat gibt, die Arbeitnehmer der Gesellschaft, spätestens fünf Arbeitstage vor dem Tag der Gesellschafterversammlung der Gesellschaft Bemerkungen zum Formwechselplan übermitteln können."
    },
    {
      "date": "2025-12-23",
      "id": "140922",
      "original_text": "Registerbekanntmachung nach dem Umwandlungsgesetz\nBerlin Amtsgericht Berlin (Charlottenburg) HRA 13539\nINDIA Tastenfabrik Berlin Thomas Dreusicke Kunststoffverarbeitung, Oberflächentechnik, Baugruppen – Berlin",
      "type": "Registerbekanntmachung nach dem Umwandlungsgesetz",
      "state": "Berlin",
      "amtsgericht": "Amtsgericht Berlin (Charlottenburg)",
      "registernummer": "HRA 13539",
      "registerart": "HRA",
      "company_name": "INDIA Tastenfabrik Berlin Thomas Dreusicke Kunststoffverarbeitung, Oberflächentechnik, Baugruppen",
      "company_seat": "Berlin",
      "details": "23.12.2025 (Bekanntmachungsdatum)\n\nBerlin Amtsgericht Berlin (Charlottenburg) HRA 13539\nRegisterbekanntmachung nach dem Umwandlungsgesetz 22.12.2025 (Eintragungsdatum)\n\nINDIA Tastenfabrik Berlin Thomas Dreusicke Kunststoffverarbeitung, Oberflächentechnik, Baugruppen\nEinzelkaufmann / Einzelkauffrau\nBerlin\n\nZu Eintragungsnummer 5 vom 22.12.2025 wird als nicht eingetragen veröffentlicht:\nDen Gläubigern der an der Spaltung beteiligten Rechtsträger ist, wenn sie binnen sechs Monaten nach dem Tag, an dem die Eintragung der Spaltung in das Register des Sitzes desjenigen Rechtsträgers, dessen Gläubiger sie sind, als bekannt gemacht gilt, ihren Anspruch nach Grund und Höhe schriftlich anmelden, Sicherheit zu leisten, soweit sie nicht Befriedigung verlangen können. Dieses Recht steht den Gläubigern jedoch nur zu, wenn sie glaubhaft machen, dass durch die Spaltung die Erfüllung ihrer Forderung gefährdet wird. Das Recht, Sicherheitsleistung zu verlangen, steht Gläubigern nicht zu, die im Falle der Insolvenz ein Recht auf vorzugsweise Befriedigung aus einer Deckungsmasse haben, die nach gesetzlicher Vorschrift zu ihrem Schutz errichtet und staatlich überwacht ist."
    },
    {
      "date": "2025-12-23",
      "id": "140923",
      "original_text": "Registerbekanntmachung nach dem Umwandlungsgesetz\nBerlin Amtsgericht Berlin (Charlottenburg) HRB 277668\nI.N.D.I.A. Kunststofftechnik GmbH – Berlin",
      "type": "Registerbekanntmachung nach dem Umwandlungsgesetz",
      "state": "Berlin",
      "amtsgericht": "Amtsgericht Berlin (Charlottenburg)",
      "registernummer": "HRB 277668",
      "registerart": "HRB",
      "company_name": "I.N.D.I.A. Kunststofftechnik GmbH",
      "company_seat": "Berlin",
      "details": "23.12.2025 (Bekanntmachungsdatum)\n\nBerlin Amtsgericht Berlin (Charlottenburg) HRB 277668\nRegisterbekanntmachung nach dem Umwandlungsgesetz 22.12.2025 (Eintragungsdatum)\n\nI.N.D.I.A. Kunststofftechnik GmbH\nGesellschaft mit beschränkter Haftung\nBerlin\n\nZu Eintragungsnummer 3 vom 22.12.2025 wird als nicht eingetragen veröffentlicht:\nDen Gläubigern der an der Spaltung beteiligten Rechtsträger ist, wenn sie binnen sechs Monaten nach dem Tag, an dem die Eintragung der Spaltung in das Register des Sitzes desjenigen Rechtsträgers, dessen Gläubiger sie sind, als bekannt gemacht gilt, ihren Anspruch nach Grund und Höhe schriftlich anmelden, Sicherheit zu leisten, soweit sie nicht Befriedigung verlangen können. Dieses Recht steht den Gläubigern jedoch nur zu, wenn sie glaubhaft machen, dass durch die Spaltung die Erfüllung ihrer Forderung gefährdet wird. Das Recht, Sicherheitsleistung zu verlangen, steht Gläubigern nicht zu, die im Falle der Insolvenz ein Recht auf vorzugsweise Befriedigung aus einer Deckungsmasse haben, die nach gesetzlicher Vorschrift zu ihrem Schutz errichtet und staatlich überwacht ist."
    },
    {
      "date": "2025-12-23",
      "id": "140924",
      "original_text": "Löschungsankündigung\nBaden-Württemberg Amtsgericht Freiburg HRA 704832\nSATIVA GmbH & Co. KG – Hilzingen",
      "type": "Löschungsankündigung",
      "state": "Baden-Württemberg",
      "amtsgericht": "Amtsgericht Freiburg",
      "registernummer": "HRA 704832",
      "registerart": "HRA",
      "company_name": "SATIVA GmbH & Co. KG",
      "company_seat": "Hilzingen",
      "details": "23.12.2025 (Bekanntmachungsdatum)\n\nBaden-Württemberg Amtsgericht Freiburg HRA 704832\nLöschungsankündigung\n\nSATIVA GmbH & Co. KG\nKommanditgesellschaft\nHilzingen\n\nAls nicht eingetragen wird bekanntgemacht:\nDas Gericht beabsichtigt, die Gesellschaft wegen Vermögenslosigkeit im Handelsregister von Amts wegen nach § 394 FamFG zu löschen. Die Frist zur Geltendmachung eines Widerspruchs gegen die beabsichtigte Löschung ist auf einen Monat ab Veröffentlichung bestimmt."
    },
    {
      "date": "2025-12-23",
      "id": "140925",
      "original_text": "Löschungsankündigung\nBerlin Amtsgericht Berlin (Charlottenburg) HRB 132516\nTravel Care GmbH – Berlin",
      "type": "Löschungsankündigung",
      "state": "Berlin",
      "amtsgericht": "Amtsgericht Berlin (Charlottenburg)",
      "registernummer": "HRB 132516",
      "registerart": "HRB",
      "company_name": "Travel Care GmbH",
      "company_seat": "Berlin",
      "details": "23.12.2025 (Bekanntmachungsdatum)\n\nBerlin Amtsgericht Berlin (Charlottenburg) HRB 132516\nLöschungsankündigung\n\nTravel Care GmbH\nGesellschaft mit beschränkter Haftung\nBerlin\n\nBei der nachstehenden Gesellschaft wird das Amtslöschungsverfahren gemäß § 394 FamFG eingeleitet. Widerspruchsfrist 6 Wochen"
    },
    {
      "date": "2025-12-23",
      "id": "140926",
      "original_text": "Einreichung neuer Dokumente\nSchleswig-Holstein Amtsgericht Lübeck HRB 4090 AH\nBasler Aktiengesellschaft – Ahrensburg",
      "type": "Einreichung neuer Dokumente",
      "state": "Schleswig-Holstein",
      "amtsgericht": "Amtsgericht Lübeck",
      "registernummer": "HRB 4090 AH",
      "registerart": "HRB",
      "company_name": "Basler Aktiengesellschaft",
      "company_seat": "Ahrensburg",
      "details": "23.12.2025 (Bekanntmachungsdatum)\n\nSchleswig-Holstein Amtsgericht Lübeck HRB 4090 AH\nEinreichung neuer Dokumente\n\nBasler Aktiengesellschaft\nAktiengesellschaft\nAhrensburg\n\nEine neue Liste der Aufsichtsratmitglieder wurde zum Handelsregister gereicht."
    },
    {
      "date": "2025-12-23",
      "id": "140927",
      "original_text": "Registerbekanntmachung nach dem Umwandlungsgesetz\nBaden-Württemberg Amtsgericht Freiburg VR 836\nMusikverein Holzhausen e.V. – March",
      "type": "Registerbekanntmachung nach dem Umwandlungsgesetz",
      "state": "Baden-Württemberg",
      "amtsgericht": "Amtsgericht Freiburg",
      "registernummer": "VR 836",
      "registerart": "VR",
      "company_name": "Musikverein Holzhausen e.V.",
      "company_seat": "March",
      "details": "23.12.2025 (Bekanntmachungsdatum)\n\nBaden-Württemberg Amtsgericht Freiburg VR 836\nRegisterbekanntmachung nach dem Umwandlungsgesetz 23.12.2025 (Eintragungsdatum)\n\nMusikverein Holzhausen e.V.\neingetragener Verein\nMarch\n\nAls nicht eingetragen wird bekanntgemacht:\nDen Gläubigern der an der Verschmelzung beteiligten Rechtsträger ist, wenn sie binnen sechs Monaten nach dem Tag, an dem die Eintragung der Verschmelzung in das Register des Sitzes desjenigen Rechtsträgers, dessen Gläubiger sie sind, nach § 19 Abs. 3 UmwG als bekanntgemacht gilt, ihren Anspruch nach Grund und Höhe schriftlich anmelden, Sicherheit zu leisten, soweit sie nicht Befriedigung verlangen können. Dieses Recht steht den Gläubigern jedoch nur zu, wenn sie glaubhaft machen, dass durch die Verschmelzung die Erfüllung ihrer Forderung gefährdet wird."
    },
    {
      "date": "2025-12-23",
      "id": "140928",
      "original_text": "Registerbekanntmachung nach dem Umwandlungsgesetz\nBaden-Württemberg Amtsgericht Freiburg VR 1137\nMusikverein Neuershausen e.V. – March",
      "type": "Registerbekanntmachung nach dem Umwandlungsgesetz",
      "state": "Baden-Württemberg",
      "amtsgericht": "Amtsgericht Freiburg",
      "registernummer": "VR 1137",
      "registerart": "VR",
      "company_name": "Musikverein Neuershausen e.V.",
      "company_seat": "March",
      "details": "23.12.2025 (Bekanntmachungsdatum)\n\nBaden-Württemberg Amtsgericht Freiburg VR 1137\nRegisterbekanntmachung nach dem Umwandlungsgesetz 23.12.2025 (Eintragungsdatum)\n\nMusikverein Neuershausen e.V.\neingetragener Verein\nMarch\n\nAls nicht eingetragen wird bekanntgemacht:\nDen Gläubigern der an der Verschmelzung beteiligten Rechtsträger ist, wenn sie binnen sechs Monaten nach dem Tag, an dem die Eintragung der Verschmelzung in das Register des Sitzes desjenigen Rechtsträgers, dessen Gläubiger sie sind, nach § 19 Abs. 3 UmwG als bekanntgemacht gilt, ihren Anspruch nach Grund und Höhe schriftlich anmelden, Sicherheit zu leisten, soweit sie nicht Befriedigung verlangen können. Dieses Recht steht den Gläubigern jedoch nur zu, wenn sie glaubhaft machen, dass durch die Verschmelzung die Erfüllung ihrer Forderung gefährdet wird."
    },
    {
      "date": "2025-12-23",
      "id": "140929",
      "original_text": "Einreichung neuer Dokumente\nBerlin Amtsgericht Berlin (Charlottenburg) HRB 126625\nADAMMA Home GmbH – Berlin",
      "type": "Einreichung neuer Dokumente",
      "state": "Berlin",
      "amtsgericht": "Amtsgericht Berlin (Charlottenburg)",
      "registernummer": "HRB 126625",
      "registerart": "HRB",
      "company_name": "ADAMMA Home GmbH",
      "company_seat": "Berlin",
      "details": "23.12.2025 (Bekanntmachungsdatum)\n\nBerlin Amtsgericht Berlin (Charlottenburg) HRB 126625\nEinreichung neuer Dokumente\n\nADAMMA Home GmbH\nGesellschaft mit beschränkter Haftung\nBerlin\n\nAls nicht eingetragen wird veröffentlicht:  Die Gesellschaft hat den Entwurf eines Formwechselplans betreffend den grenzüberschreitenden, identitätswahrenden Formwechsel unter gleichzeitiger Verlegung des Satzungssitzes der Gesellschaft nach Luxemburg gemäß §§ 333 ff. UmwG zum Handelsregister des Amtsgerichts Charlottenburg eingereicht.\n\n1. § 336 UmwG i.V.m. § 308 Abs. 1 S. 2 Nr. 1 UmwG:\n\nDie Gesellschaft hat den Entwurf des Formwechselplans\nbetreffend den grenziiberschreitenden Formwechsel im Wege des Herausformwechsels ohne Abwicklung und Auflösung von einer deutschen GmbH in eine reine Société à responsabilité limitée (S.à r.l.)\nluxemburgischen Rechts  mit gleichzeitiger Verlegung des Satzungssitzes nach Luxemburg, Großherzogtum Luxemburg, beim\nHandelsregister des Amtsgerichts Berlin (Charlottenburg) gemäß § 336 UmwG in Verbindung mit § 308 Abs. 1 Satz 2 Nr. 1 UmwG eingereicht.\n\n2. § 336 UmwG i.V.m. § 308 Abs. 1 S. 2 Nr. 2 UmwG:\n\nAn dem grenziiberschreitenden Formwechsel ist die ADAMMA Home GmbH mit Satzungssitz in Berlin, Deutschland, eine nach deutschem Recht bestehende Gesellschaft mit beschränkter Haftung, beteiligt. Nach dem grenzüberschreitenden Formwechsel wird die Gesellschaft die Rechtsform einer reinen Société à responsabilité limitée (S.a r.l.), eine Gesellschaft mit beschränkter Haftung nach dem Recht des Großherzogtums Luxemburg annehmen und als ADAMMA Home S.à r.l. mit Satzungssitz in Luxemburg, Großherzogtum Luxemburg firmieren.\n\n3. § 336 UmwG i.V.m. § 308 Abs. 1 S. 2 Nr. 3 UmwG:\n\nDie Gesellschaft ist im Handelsregister des Amtsgerichts Berlin (Charlottenburg) unter der Handelsregisternummer HRB 126625 B eingetragen. Die Gesellschaft ist zudem im Handels- und Gesellschaftsregister von Luxemburg (Registre de commerce et des sociétés Luxembourg) unter der Nummer B228409 eingetragen, welche auch künftig fortbestehen wird.\n\n4. § 336 UmwG i.V.m. § 308 Abs. 1 S. 2 Nr. 4 UmwG:\n\nDie Gesellschafterversammlung zum Beschluss des grenzüberschreitenden Formwechsels ist für den Tag geplant, der auf den Ablauf von einem Monat nach dem Tag der Registerbekanntmachung des Formwechselplans folgt, oder ggfs. den nächsten Arbeitstag (wobei Samstage, Sonntage und bundesweite Feiertage nicht als Arbeitstage zählen).\n\na) Die Anteilsinhaber and die Glaubiger der Gesellschaft erhalten den Hinweis, dass sie spatestens fiinf Arbeitstage vor dem Tag der Gesellschafterversammlung der Gesellschaft Bemerkungen zum Formwechselplan übermitteln können.\n\nb) Einen Betriebsrat gibt es nicht, die Gesellschaft hat keine Arbeitnehmer. Der guten Ordnung halber erfolgt gleichwohl der Hinweis, dass die zuständigen Betriebsräte der Gesellschaft oder, soweit es keinen Betriebsrat gibt, die Arbeitnehmer der Gesellschaft, spätestens fünf Arbeitstage vor dem Tag der Gesellschafterversammlung der Gesellschaft Bermerkungen zum Formwechselplan übermitteln können."
    },
    {
      "date": "2025-12-23",
      "id": "140930",
      "original_text": "Einreichung neuer Dokumente\nBerlin Amtsgericht Berlin (Charlottenburg) HRB 178679\nSummer Propco 1 GmbH – Berlin",
      "type": "Einreichung neuer Dokumente",
      "state": "Berlin",
      "amtsgericht": "Amtsgericht Berlin (Charlottenburg)",
      "registernummer": "HRB 178679",
      "registerart": "HRB",
      "company_name": "Summer Propco 1 GmbH",
      "company_seat": "Berlin",
      "details": "23.12.2025 (Bekanntmachungsdatum)\n\nBerlin Amtsgericht Berlin (Charlottenburg) HRB 178679\nEinreichung neuer Dokumente\n\nSummer Propco 1 GmbH\nGesellschaft mit beschränkter Haftung\nBerlin\n\nAls nicht eingetragen wird veröffentlicht:\n\n1.\nDie Gesellschaft hat den Entwurf eines Formwechselplans vom 15.12.2025 betreffend ihren grenzüberschreitenden Formwechsel nach Luxemburg, Luxemburg, zum Handelsregister eingereicht.\n\n2.\nDie an dem Formwechsel beteiligte Gesellschaft ist die „Summer Propco 1 GmbH“ mit Sitz in Berlin, Deutschland. Durch den Formwechsel soll sie die Rechtsform einer Societé à responsabilité limitée (S.à r.l.) luxemburgischen Rechts erhalten und unter „Summer Propco 1 S.à r.l.“ firmieren.\n\n3.\nDie formwechselnde Gesellschaft ist eingetragen im Handelsregister des Amtsgerichts Charlottenburg mit der Nummer HRB 178679 B und ist bereits eingetragen im Handels- und\nGesellschaftsregister von Luxemburg (Registre de commerce et des sociétés\nLuxembourg) unter der Nummer B228391. In Luxemburg soll sie im genannten luxemburgischen Gesellschaftsregister unter der genannten Nummer eingetragen bleiben.\n\n4.\nEs ergeht Hinweis an folgende Personen, dass sie der Gesellschaft spätestens fünf Arbeitstage vor dem Tag der Gesellschafterversammlung der Gesellschaft, die über die Zustimmung zum Formwechselplan entscheidet, Bemerkungen zum Formwechselplan übermitteln können:\n\na) die Anteilsinhaber und Gläubiger der an dem grenzüberschreitenden Formwechsel beteiligten Gesellschaft sowie\n\nb) die zuständigen Betriebsräte der an dem grenzüberschreitenden Formwechsel beteiligten\nGesellschaft oder, soweit es keinen Betriebsrat gibt, die Arbeitnehmer der an dem\ngrenzüberschreitenden Formwechsel beteiligten Gesellschaft.\n\nDie Gesellschafterversammlung darf erst einen Monat nach der Bekanntmachung des Formwechselplans über ihre Zustimmung zu dem Formwechselplan beschließen. Die Gesellschafterversammlung ist für den Tag geplant, der auf den Ablauf eines Monats nach dem Tag der Bekanntmachung des Formwechselplans folgt, ggfs. für den nächsten Arbeitstag (wobei Samstage, Sonntage und bundesweite Feiertage nicht als Arbeitstage zählen.\n\nDie Gesellschaft hat mitgeteilt, dass sie keine Arbeitnehmer und keinen Betriebsrat hat."
    },
    {
      "date": "2025-12-23",
      "id": "140931",
      "original_text": "Registerbekanntmachung nach dem Umwandlungsgesetz\nBerlin Amtsgericht Berlin (Charlottenburg) HRB 280521\ntrlyr 33 UG (haftungsbeschränkt) – Berlin",
      "type": "Registerbekanntmachung nach dem Umwandlungsgesetz",
      "state": "Berlin",
      "amtsgericht": "Amtsgericht Berlin (Charlottenburg)",
      "registernummer": "HRB 280521",
      "registerart": "HRB",
      "company_name": "trlyr 33 UG (haftungsbeschränkt)",
      "company_seat": "Berlin",
      "details": "23.12.2025 (Bekanntmachungsdatum)\n\nBerlin Amtsgericht Berlin (Charlottenburg) HRB 280521\nRegisterbekanntmachung nach dem Umwandlungsgesetz 22.12.2025 (Eintragungsdatum)\n\ntrlyr 33 UG (haftungsbeschränkt)\nGesellschaft mit beschränkter Haftung\nBerlin\n\nZu Eintragungsnummer 3 vom 22.12.2025 wird als nicht eingetragen veröffentlicht:\n\nDen Gläubigern ist, wenn sie binnen sechs Monaten nach dem Tag, an dem die Eintragung der Umwandlung als bekannt gemacht gilt, ihren Anspruch nach Grund und Höhe schriftlich anmelden, Sicherheit zu leisten, soweit sie nicht Befriedigung verlangen können. Dieses Recht steht den Gläubigern jedoch nur zu, wenn sie glaubhaft machen, dass durch die Umwandlung die Erfüllung ihrer Forderung gefährdet wird. Das Recht, Sicherheitsleistung zu verlangen, steht Gläubigern nicht zu, die im Falle der Insolvenz ein Recht auf vorzugsweise Befriedigung aus einer Deckungsmasse haben, die nach gesetzlicher Vorschrift zu ihrem Schutz errichtet und staatlich überwacht ist."
    },
    {
      "date": "2025-12-23",
      "id": "140932",
      "original_text": "Registerbekanntmachung nach dem Umwandlungsgesetz\nBerlin Amtsgericht Berlin (Charlottenburg) HRA 65061\ntrlyr 33 GmbH & Co. KG – Berlin",
      "type": "Registerbekanntmachung nach dem Umwandlungsgesetz",
      "state": "Berlin",
      "amtsgericht": "Amtsgericht Berlin (Charlottenburg)",
      "registernummer": "HRA 65061",
      "registerart": "HRA",
      "company_name": "trlyr 33 GmbH & Co. KG",
      "company_seat": "Berlin",
      "details": "23.12.2025 (Bekanntmachungsdatum)\n\nBerlin Amtsgericht Berlin (Charlottenburg) HRA 65061\nRegisterbekanntmachung nach dem Umwandlungsgesetz 22.12.2025 (Eintragungsdatum)\n\ntrlyr 33 GmbH & Co. KG\nKommanditgesellschaft\nBerlin\n\nZu Eintragungsnummer 1 vom 22.12.2025 wird als nicht eingetragen veröffentlicht:\n\nDen Gläubigern ist, wenn sie binnen sechs Monaten nach dem Tag, an dem die Eintragung der Umwandlung als bekannt gemacht gilt, ihren Anspruch nach Grund und Höhe schriftlich anmelden, Sicherheit zu leisten, soweit sie nicht Befriedigung verlangen können. Dieses Recht steht den Gläubigern jedoch nur zu, wenn sie glaubhaft machen, dass durch die Umwandlung die Erfüllung ihrer Forderung gefährdet wird. Das Recht, Sicherheitsleistung zu verlangen, steht Gläubigern nicht zu, die im Falle der Insolvenz ein Recht auf vorzugsweise Befriedigung aus einer Deckungsmasse haben, die nach gesetzlicher Vorschrift zu ihrem Schutz errichtet und staatlich überwacht ist."
    },
    {
      "date": "2025-12-23",
      "id": "140933",
      "original_text": "Einreichung neuer Dokumente\nBaden-Württemberg Amtsgericht Ulm HRB 726560\nPommersche Provinzial-Zuckersiederei Aktiengesellschaft – Ulm",
      "type": "Einreichung neuer Dokumente",
      "state": "Baden-Württemberg",
      "amtsgericht": "Amtsgericht Ulm",
      "registernummer": "HRB 726560",
      "registerart": "HRB",
      "company_name": "Pommersche Provinzial-Zuckersiederei Aktiengesellschaft",
      "company_seat": "Ulm",
      "details": "23.12.2025 (Bekanntmachungsdatum)\n\nBaden-Württemberg Amtsgericht Ulm HRB 726560\nEinreichung neuer Dokumente\n\nPommersche Provinzial-Zuckersiederei Aktiengesellschaft\nAktiengesellschaft\nUlm\n\nDie Gesellschaft hat am 18.12.2025 die Liste über die Zusammensetzung des Aufsichtsrats zum Handelsregister eingereicht."
    },
    {
      "date": "2025-12-23",
      "id": "140934",
      "original_text": "Einreichung neuer Dokumente\nBaden-Württemberg Amtsgericht Stuttgart HRB 2195\nDEHOGA Baden-Württemberg Servicegesellschaft mbH – Stuttgart",
      "type": "Einreichung neuer Dokumente",
      "state": "Baden-Württemberg",
      "amtsgericht": "Amtsgericht Stuttgart",
      "registernummer": "HRB 2195",
      "registerart": "HRB",
      "company_name": "DEHOGA Baden-Württemberg Servicegesellschaft mbH",
      "company_seat": "Stuttgart",
      "details": "23.12.2025 (Bekanntmachungsdatum)\n\nBaden-Württemberg Amtsgericht Stuttgart HRB 2195\nEinreichung neuer Dokumente\n\nDEHOGA Baden-Württemberg Servicegesellschaft mbH\nGesellschaft mit beschränkter Haftung\nStuttgart\n\nDie Gesellschaft hat am 22.12.2025 die Liste über die Zusammensetzung des Aufsichtsrats zum Handelsregister eingereicht."
    },
    {
      "date": "2025-12-23",
      "id": "140935",
      "original_text": "Löschungsankündigung\nSchleswig-Holstein Amtsgericht Lübeck HRB 13603\nWirtschaftsberatung zur Vermögenssicherung UG (haftungsbeschränkt) – Lübeck",
      "type": "Löschungsankündigung",
      "state": "Schleswig-Holstein",
      "amtsgericht": "Amtsgericht Lübeck",
      "registernummer": "HRB 13603",
      "registerart": "HRB",
      "company_name": "Wirtschaftsberatung zur Vermögenssicherung UG (haftungsbeschränkt)",
      "company_seat": "Lübeck",
      "details": "23.12.2025 (Bekanntmachungsdatum)\n\nSchleswig-Holstein Amtsgericht Lübeck HRB 13603\nLöschungsankündigung\n\nWirtschaftsberatung zur Vermögenssicherung UG (haftungsbeschränkt)\nGesellschaft mit beschränkter Haftung\nLübeck\n\nEs ist die Löschung der nachstehenden Gesellschaft wegen Vermögenslosigkeit gemäß § 394 FamFG beabsichtigt."
    },
    {
      "date": "2025-12-23",
      "id": "140936",
      "original_text": "Registerbekanntmachung nach dem Umwandlungsgesetz\nBaden-Württemberg Amtsgericht Freiburg HRA 709292\nAllgemeiner Betreuungs- & Pflegedienst Hans-Peter Wöhrlin e.K. – Emmendingen",
      "type": "Registerbekanntmachung nach dem Umwandlungsgesetz",
      "state": "Baden-Württemberg",
      "amtsgericht": "Amtsgericht Freiburg",
      "registernummer": "HRA 709292",
      "registerart": "HRA",
      "company_name": "Allgemeiner Betreuungs- & Pflegedienst Hans-Peter Wöhrlin e.K.",
      "company_seat": "Emmendingen",
      "details": "23.12.2025 (Bekanntmachungsdatum)\n\nBaden-Württemberg Amtsgericht Freiburg HRA 709292\nRegisterbekanntmachung nach dem Umwandlungsgesetz 23.12.2025 (Eintragungsdatum)\n\nAllgemeiner Betreuungs- & Pflegedienst Hans-Peter Wöhrlin e.K.\nEinzelkaufmann / Einzelkauffrau\nEmmendingen\n\nAls nicht eingetragen wird bekanntgemacht:\nDen Gläubigern der an der Ausgliederung beteiligten Rechtsträger ist, wenn sie binnen sechs Monaten nach dem Tag, an dem die Eintragung der Ausgliederung in das Register des Sitzes desjenigen Rechtsträgers, dessen Gläubiger sie sind, nach § 19 Abs. 3 UmwG als bekanntgemacht gilt, ihren Anspruch nach Grund und Höhe schriftlich anmelden, Sicherheit zu leisten, soweit sie nicht Befriedigung verlangen können. Dieses Recht steht den Gläubigern jedoch nur zu, wenn sie glaubhaft machen, dass durch die Ausgliederung die Erfüllung ihrer Forderung gefährdet wird."
    },
    {
      "date": "2025-12-23",
      "id": "140937",
      "original_text": "Registerbekanntmachung nach dem Umwandlungsgesetz\nBrandenburg Amtsgericht Neuruppin HRB 15422\nHAI Fuels neu GmbH – Schwedt/Oder",
      "type": "Registerbekanntmachung nach dem Umwandlungsgesetz",
      "state": "Brandenburg",
      "amtsgericht": "Amtsgericht Neuruppin",
      "registernummer": "HRB 15422",
      "registerart": "HRB",
      "company_name": "HAI Fuels neu GmbH",
      "company_seat": "Schwedt/Oder",
      "details": "23.12.2025 (Bekanntmachungsdatum)\n\nBrandenburg Amtsgericht Neuruppin HRB 15422\nRegisterbekanntmachung nach dem Umwandlungsgesetz 23.12.2025 (Eintragungsdatum)\n\nHAI Fuels neu GmbH\nGesellschaft mit beschränkter Haftung\nSchwedt/Oder\n\nZu Eintragungsnummer 2 vom 23.12.2025 wird als nicht eingetragen veröffentlicht:\nDen Gläubigern der an der Umwandlung beteiligten Rechtsträger ist, wenn sie binnen sechs Monaten nach dem Tag, an dem die Eintragung der Umwandlung in das Register des Sitzes desjenigen Rechtsträgers, dessen Gläubiger sie sind, als bekannt gemacht gilt, ihren Anspruch nach Grund und Höhe schriftlich anmelden, Sicherheit zu leisten, soweit sie nicht Befriedigung verlangen können. Dieses Recht steht den Gläubigern jedoch nur zu, wenn sie glaubhaft machen, dass durch die Umwandlung die Erfüllung ihrer Forderung gefährdet wird"
    },
    {
      "date": "2025-12-23",
      "id": "140938",
      "original_text": "Registerbekanntmachung nach dem Umwandlungsgesetz\nBrandenburg Amtsgericht Neuruppin HRA 2906\nHAI Fuels Step 2 oHG – Schwedt/Oder",
      "type": "Registerbekanntmachung nach dem Umwandlungsgesetz",
      "state": "Brandenburg",
      "amtsgericht": "Amtsgericht Neuruppin",
      "registernummer": "HRA 2906",
      "registerart": "HRA",
      "company_name": "HAI Fuels Step 2 oHG",
      "company_seat": "Schwedt/Oder",
      "details": "23.12.2025 (Bekanntmachungsdatum)\n\nBrandenburg Amtsgericht Neuruppin HRA 2906\nRegisterbekanntmachung nach dem Umwandlungsgesetz 23.12.2025 (Eintragungsdatum)\n\nHAI Fuels Step 2 oHG\nOffene Handelsgesellschaft\nSchwedt/Oder\n\nZu Eintragungsnummer 7 vom 23.12.2025 wird als nicht eingetragen veröffentlicht:\nDen Gläubigern der an der Umwandlung beteiligten Rechtsträger ist, wenn sie binnen sechs Monaten nach dem Tag, an dem die Eintragung der Umwandlung in das Register des Sitzes desjenigen Rechtsträgers, dessen Gläubiger sie sind, als bekannt gemacht gilt, ihren Anspruch nach Grund und Höhe schriftlich anmelden, Sicherheit zu leisten, soweit sie nicht Befriedigung verlangen können. Dieses Recht steht den Gläubigern jedoch nur zu, wenn sie glaubhaft machen, dass durch die Umwandlung die Erfüllung ihrer Forderung gefährdet wird"
    },
    {
      "date": "2025-12-23",
      "id": "140939",
      "original_text": "Registerbekanntmachung nach dem Umwandlungsgesetz\nSachsen Amtsgericht Leipzig HRB 32309\nElektronische Kassensysteme Thomas Holtze GmbH – Leipzig",
      "type": "Registerbekanntmachung nach dem Umwandlungsgesetz",
      "state": "Sachsen",
      "amtsgericht": "Amtsgericht Leipzig",
      "registernummer": "HRB 32309",
      "registerart": "HRB",
      "company_name": "Elektronische Kassensysteme Thomas Holtze GmbH",
      "company_seat": "Leipzig",
      "details": "23.12.2025 (Bekanntmachungsdatum)\n\nSachsen Amtsgericht Leipzig HRB 32309\nRegisterbekanntmachung nach dem Umwandlungsgesetz 23.12.2025 (Eintragungsdatum)\n\nElektronische Kassensysteme Thomas Holtze GmbH\nGesellschaft mit beschränkter Haftung\nLeipzig\n\nDen Gläubigern der an der Verschmelzung beteiligten Rechtsträger ist, wenn sie binnen sechs Monaten nach dem Tag, an dem die Eintragung der Verschmelzung in das Register des Sitzes desjenigen Rechtsträgers, dessen Gläubiger sie sind, nach § 19 Abs. 3 UmwG als bekannt gemacht gilt, ihren Anspruch nach Grund und Höhe in Textform anmelden, Sicherheit zu leisten, soweit sie nicht Befriedigung verlangen können. Dieses Recht steht den Gläubigern jedoch nur zu, wenn sie glaubhaft machen, dass durch die Verschmelzung die Erfüllung der Forderung gefährdet wird."
    },
    {
      "date": "2025-12-23",
      "id": "140940",
      "original_text": "Registerbekanntmachung nach dem Umwandlungsgesetz\nSachsen Amtsgericht Leipzig HRB 15420\nMenke Gebäudeservice GmbH – Leipzig",
      "type": "Registerbekanntmachung nach dem Umwandlungsgesetz",
      "state": "Sachsen",
      "amtsgericht": "Amtsgericht Leipzig",
      "registernummer": "HRB 15420",
      "registerart": "HRB",
      "company_name": "Menke Gebäudeservice GmbH",
      "company_seat": "Leipzig",
      "details": "23.12.2025 (Bekanntmachungsdatum)\n\nSachsen Amtsgericht Leipzig HRB 15420\nRegisterbekanntmachung nach dem Umwandlungsgesetz 23.12.2025 (Eintragungsdatum)\n\nMenke Gebäudeservice GmbH\nGesellschaft mit beschränkter Haftung\nLeipzig\n\nDen Gläubigern der an der Verschmelzung beteiligten Rechtsträger ist, wenn sie binnen sechs Monaten nach dem Tag, an dem die Eintragung der Verschmelzung in das Register des Sitzes desjenigen Rechtsträgers, dessen Gläubiger sie sind, nach § 19 Abs. 3 UmwG als bekannt gemacht gilt, ihren Anspruch nach Grund und Höhe in Textform anmelden, Sicherheit zu leisten, soweit sie nicht Befriedigung verlangen können. Dieses Recht steht den Gläubigern jedoch nur zu, wenn sie glaubhaft machen, dass durch die Verschmelzung die Erfüllung der Forderung gefährdet wird."
    },
    {
      "date": "2025-12-23",
      "id": "140941",
      "original_text": "Löschungsankündigung\nSachsen Amtsgericht Chemnitz HRB 34976\nLEKU Bau GmbH – Jahnsdorf/Erzgeb.",
      "type": "Löschungsankündigung",
      "state": "Sachsen",
      "amtsgericht": "Amtsgericht Chemnitz",
      "registernummer": "HRB 34976",
      "registerart": "HRB",
      "company_name": "LEKU Bau GmbH",
      "company_seat": "Jahnsdorf/Erzgeb.",
      "details": "23.12.2025 (Bekanntmachungsdatum)\n\nSachsen Amtsgericht Chemnitz HRB 34976\nLöschungsankündigung 23.12.2025 (Eintragungsdatum)\n\nLEKU Bau GmbH\nGesellschaft mit beschränkter Haftung\nJahnsdorf/Erzgeb.\n\nDas Registergericht beabsichtigt, die im Handelsregister eingetragene Gesellschaft von Amts wegen nach § 394 FamFG zu löschen. Die Frist zu Erhebung eines Widerspruchs gegen die beabsichtigte Löschung wird auf einen Monat festgesetzt."
    },
    {
      "date": "2025-12-23",
      "id": "140942",
      "original_text": "Löschungsankündigung\nSachsen Amtsgericht Dresden HRB 34834\nsystemarena GmbH – Ottendorf-Okrilla",
      "type": "Löschungsankündigung",
      "state": "Sachsen",
      "amtsgericht": "Amtsgericht Dresden",
      "registernummer": "HRB 34834",
      "registerart": "HRB",
      "company_name": "systemarena GmbH",
      "company_seat": "Ottendorf-Okrilla",
      "details": "23.12.2025 (Bekanntmachungsdatum)\n\nSachsen Amtsgericht Dresden HRB 34834\nLöschungsankündigung\n\nsystemarena GmbH\nGesellschaft mit beschränkter Haftung\nOttendorf-Okrilla\n\nDas Registergericht beabsichtigt, die im Handelsregister eingetragene Gesellschaft von Amts wegen nach § 394 FamFG zu löschen. Die Frist zu Erhebung eines Widerspruchs gegen die beabsichtigte Löschung wird auf einen Monat festgesetzt."
    },
    {
      "date": "2025-12-23",
      "id": "140943",
      "original_text": "Löschungsankündigung\nSachsen Amtsgericht Chemnitz HRB 27293\naliVe United GmbH – Chemnitz",
      "type": "Löschungsankündigung",
      "state": "Sachsen",
      "amtsgericht": "Amtsgericht Chemnitz",
      "registernummer": "HRB 27293",
      "registerart": "HRB",
      "company_name": "aliVe United GmbH",
      "company_seat": "Chemnitz",
      "details": "23.12.2025 (Bekanntmachungsdatum)\n\nSachsen Amtsgericht Chemnitz HRB 27293\nLöschungsankündigung 23.12.2025 (Eintragungsdatum)\n\naliVe United GmbH\nGesellschaft mit beschränkter Haftung\nChemnitz\n\nDas Registergericht beabsichtigt, die im Handelsregister eingetragene Gesellschaft von Amts wegen nach § 394 FamFG zu löschen. Die Frist zu Erhebung eines Widerspruchs gegen die beabsichtigte Löschung wird auf einen Monat festgesetzt."
    },
    {
      "date": "2025-12-23",
      "id": "140944",
      "original_text": "Registerbekanntmachung nach dem Umwandlungsgesetz\nSachsen Amtsgericht Dresden HRB 33816\nSabel Freital gAG – Freital",
      "type": "Registerbekanntmachung nach dem Umwandlungsgesetz",
      "state": "Sachsen",
      "amtsgericht": "Amtsgericht Dresden",
      "registernummer": "HRB 33816",
      "registerart": "HRB",
      "company_name": "Sabel Freital gAG",
      "company_seat": "Freital",
      "details": "23.12.2025 (Bekanntmachungsdatum)\n\nSachsen Amtsgericht Dresden HRB 33816\nRegisterbekanntmachung nach dem Umwandlungsgesetz 23.12.2025 (Eintragungsdatum)\n\nSabel Freital gAG\nAktiengesellschaft\nFreital\n\nDen Gläubigern der an der Umwandlung beteiligten Rechtsträger ist, wenn sie binnen sechs Monaten nach dem Tag, an dem die Eintragung der Umwandlung in das Register des Sitzes desjenigen Rechtsträgers, dessen Gläubiger sie sind, nach § 19 Abs. 3 UmwG als bekannt gemacht gilt, ihren Anspruch nach Grund und Höhe in Textform anmelden, Sicherheit zu leisten, soweit sie nicht Befriedigung verlangen können. Dieses Recht steht den Gläubigern jedoch nur zu, wenn sie glaubhaft machen, dass durch die Umwandlung die Erfüllung der Forderung gefährdet wird."
    },
    {
      "date": "2025-12-23",
      "id": "140945",
      "original_text": "Löschungsankündigung\nSachsen Amtsgericht Dresden HRB 37887\nStolpener Service GmbH – Stolpen",
      "type": "Löschungsankündigung",
      "state": "Sachsen",
      "amtsgericht": "Amtsgericht Dresden",
      "registernummer": "HRB 37887",
      "registerart": "HRB",
      "company_name": "Stolpener Service GmbH",
      "company_seat": "Stolpen",
      "details": "23.12.2025 (Bekanntmachungsdatum)\n\nSachsen Amtsgericht Dresden HRB 37887\nLöschungsankündigung\n\nStolpener Service GmbH\nGesellschaft mit beschränkter Haftung\nStolpen\n\nDas Registergericht beabsichtigt, die im Handelsregister eingetragene Gesellschaft von Amts wegen nach § 394 FamFG zu löschen. Die Frist zu Erhebung eines Widerspruchs gegen die beabsichtigte Löschung wird auf einen Monat festgesetzt."
    },
    {
      "date": "2025-12-23",
      "id": "140946",
      "original_text": "Einreichung neuer Dokumente\nSachsen Amtsgericht Chemnitz HRB 26203\nKommunale Versorgungsdienstleistungsgesellschaft Chemnitz mbH – Chemnitz",
      "type": "Einreichung neuer Dokumente",
      "state": "Sachsen",
      "amtsgericht": "Amtsgericht Chemnitz",
      "registernummer": "HRB 26203",
      "registerart": "HRB",
      "company_name": "Kommunale Versorgungsdienstleistungsgesellschaft Chemnitz mbH",
      "company_seat": "Chemnitz",
      "details": "23.12.2025 (Bekanntmachungsdatum)\n\nSachsen Amtsgericht Chemnitz HRB 26203\nEinreichung neuer Dokumente\n\nKommunale Versorgungsdienstleistungsgesellschaft Chemnitz mbH\nGesellschaft mit beschränkter Haftung\nChemnitz\n\nAm 22.12.2025 wurde beim Handelsregister des Amtsgerichts Chemnitz die Liste der Mitglieder des Aufsichtsrats gemäß § 52 GmbHG eingereicht."
    },
    {
      "date": "2025-12-23",
      "id": "140947",
      "original_text": "Löschungsankündigung\nSachsen Amtsgericht Dresden HRB 16471\nTBS Fahrzeug-Service24 GmbH – Weißwasser",
      "type": "Löschungsankündigung",
      "state": "Sachsen",
      "amtsgericht": "Amtsgericht Dresden",
      "registernummer": "HRB 16471",
      "registerart": "HRB",
      "company_name": "TBS Fahrzeug-Service24 GmbH",
      "company_seat": "Weißwasser",
      "details": "23.12.2025 (Bekanntmachungsdatum)\n\nSachsen Amtsgericht Dresden HRB 16471\nLöschungsankündigung\n\nTBS Fahrzeug-Service24 GmbH\nGesellschaft mit beschränkter Haftung\nWeißwasser\n\nDas Registergericht beabsichtigt, die im Handelsregister eingetragene Gesellschaft von Amts wegen nach § 394 FamFG zu löschen. Die Frist zu Erhebung eines Widerspruchs gegen die beabsichtigte Löschung wird auf einen Monat festgesetzt."
    },
    {
      "date": "2025-12-23",
      "id": "140948",
      "original_text": "Registerbekanntmachung nach dem Umwandlungsgesetz\nSachsen Amtsgericht Leipzig HRA 19811\nElektronische Kassensysteme Thomas Holtze e.K. – Leipzig",
      "type": "Registerbekanntmachung nach dem Umwandlungsgesetz",
      "state": "Sachsen",
      "amtsgericht": "Amtsgericht Leipzig",
      "registernummer": "HRA 19811",
      "registerart": "HRA",
      "company_name": "Elektronische Kassensysteme Thomas Holtze e.K.",
      "company_seat": "Leipzig",
      "details": "23.12.2025 (Bekanntmachungsdatum)\n\nSachsen Amtsgericht Leipzig HRA 19811\nRegisterbekanntmachung nach dem Umwandlungsgesetz 23.12.2025 (Eintragungsdatum)\n\nElektronische Kassensysteme Thomas Holtze e.K.\nEinzelkaufmann / Einzelkauffrau\nLeipzig\n\nDen Gläubigern der an der Verschmelzung beteiligten Rechtsträger ist, wenn sie binnen sechs Monaten nach dem Tag, an dem die Eintragung der Verschmelzung in das Register des Sitzes desjenigen Rechtsträgers, dessen Gläubiger sie sind, nach § 19 Abs. 3 UmwG als bekannt gemacht gilt, ihren Anspruch nach Grund und Höhe in Textform anmelden, Sicherheit zu leisten, soweit sie nicht Befriedigung verlangen können. Dieses Recht steht den Gläubigern jedoch nur zu, wenn sie glaubhaft machen, dass durch die Verschmelzung die Erfüllung der Forderung gefährdet wird."
    },
    {
      "date": "2025-12-23",
      "id": "140949",
      "original_text": "Einreichung neuer Dokumente\nSachsen Amtsgericht Chemnitz HRB 18699\nMYFACT AG – Chemnitz",
      "type": "Einreichung neuer Dokumente",
      "state": "Sachsen",
      "amtsgericht": "Amtsgericht Chemnitz",
      "registernummer": "HRB 18699",
      "registerart": "HRB",
      "company_name": "MYFACT AG",
      "company_seat": "Chemnitz",
      "details": "23.12.2025 (Bekanntmachungsdatum)\n\nSachsen Amtsgericht Chemnitz HRB 18699\nEinreichung neuer Dokumente\n\nMYFACT AG\nAktiengesellschaft\nChemnitz\n\nAm 19.12.2025 wurde beim Handelsregister des Amtsgerichts Chemnitz die Liste der Mitglieder des Aufsichtsrats gemäß § 106 AktG eingereicht."
    },
    {
      "date": "2025-12-23",
      "id": "140950",
      "original_text": "Registerbekanntmachung nach dem Umwandlungsgesetz\nNiedersachsen Amtsgericht Göttingen HRB 130841 früher Amtsgericht Northeim\nWeitemeyer by Kassebeer GmbH – Northeim",
      "type": "Registerbekanntmachung nach dem Umwandlungsgesetz",
      "state": "Niedersachsen",
      "amtsgericht": "Amtsgericht Göttingen",
      "registernummer": "HRB 130841",
      "registerart": "HRB",
      "company_name": "Weitemeyer by Kassebeer GmbH",
      "company_seat": "Northeim",
      "former_amtsgericht": "Northeim",
      "details": "23.12.2025 (Bekanntmachungsdatum)\n\nNiedersachsen Amtsgericht Göttingen HRB 130841 früher Amtsgericht Northeim\nRegisterbekanntmachung nach dem Umwandlungsgesetz 23.12.2025 (Eintragungsdatum)\n\nWeitemeyer by Kassebeer GmbH\nGesellschaft mit beschränkter Haftung\nNortheim\n\nDen Gläubigern der an der Verschmelzung beteiligten Rechtsträger ist, wenn sie binnen sechs Monaten nach dem Tag, an dem die Eintragung der Verschmelzung in das Register des Sitzes desjenigen Rechtsträgers, dessen Gläubiger sie sind, nach § 19  Abs.  3 UmwG als bekannt gemacht gilt, ihren Anspruch nach Grund und Höhe schriftlich anmelden, Sicherheit zu leisten, soweit sie nicht Befriedigung verlangen können. Dieses Recht steht den Gläubigern jedoch nur zu, wenn sie glaubhaft machen, dass durch die Verschmelzung die Erfüllung der Forderung gefährdet wird."
    },
    {
      "date": "2025-12-23",
      "id": "140951",
      "original_text": "Registerbekanntmachung nach dem Umwandlungsgesetz\nNiedersachsen Amtsgericht Oldenburg (Oldenburg) HRB 213830\nMust + Riedel GmbH – Cloppenburg",
      "type": "Registerbekanntmachung nach dem Umwandlungsgesetz",
      "state": "Niedersachsen",
      "amtsgericht": "Amtsgericht Oldenburg (Oldenburg)",
      "registernummer": "HRB 213830",
      "registerart": "HRB",
      "company_name": "Must + Riedel GmbH",
      "company_seat": "Cloppenburg",
      "details": "23.12.2025 (Bekanntmachungsdatum)\n\nNiedersachsen Amtsgericht Oldenburg (Oldenburg) HRB 213830\nRegisterbekanntmachung nach dem Umwandlungsgesetz 23.12.2025 (Eintragungsdatum)\n\nMust + Riedel GmbH\nGesellschaft mit beschränkter Haftung\nCloppenburg\n\nDen Gläubigern der an der Verschmelzung beteiligten Rechtsträger ist, wenn sie binnen sechs Monaten nach dem Tag, an dem die Eintragung der Verschmelzung in das Register des Sitzes desjenigen Rechtsträgers, dessen Gläubiger sie sind, nach § 19  Abs.  3 UmwG als bekannt gemacht gilt, ihren Anspruch nach Grund und Höhe schriftlich anmelden, Sicherheit zu leisten, soweit sie nicht Befriedigung verlangen können. Dieses Recht steht den Gläubigern jedoch nur zu, wenn sie glaubhaft machen, dass durch die Verschmelzung die Erfüllung der Forderung gefährdet wird."
    },
    {
      "date": "2025-12-23",
      "id": "140952",
      "original_text": "Löschungsankündigung\nNiedersachsen Amtsgericht Hildesheim HRB 208136\nHana Bau UG (haftungsbeschränkt) – Gifhorn",
      "type": "Löschungsankündigung",
      "state": "Niedersachsen",
      "amtsgericht": "Amtsgericht Hildesheim",
      "registernummer": "HRB 208136",
      "registerart": "HRB",
      "company_name": "Hana Bau UG (haftungsbeschränkt)",
      "company_seat": "Gifhorn",
      "details": "23.12.2025 (Bekanntmachungsdatum)\n\nNiedersachsen Amtsgericht Hildesheim HRB 208136\nLöschungsankündigung 23.12.2025 (Eintragungsdatum)\n\nHana Bau UG (haftungsbeschränkt)\nGesellschaft mit beschränkter Haftung\nGifhorn\n\nDas Registergericht beabsichtigt, die Gesellschaft von Amts wegen nach § 394 FamFG zu löschen. Die Frist zur Erhebung eines Widerspruchs ist auf 1 Monat ab dieser Registerbekanntmachung festgesetzt."
    },
    {
      "date": "2025-12-23",
      "id": "140953",
      "original_text": "Registerbekanntmachung nach dem Umwandlungsgesetz\nNiedersachsen Amtsgericht Hannover VR 5759\nVerein für betreuendes Wohnen und Tagesstrukturierung psychisch Gesundender e.V. – Hannover",
      "type": "Registerbekanntmachung nach dem Umwandlungsgesetz",
      "state": "Niedersachsen",
      "amtsgericht": "Amtsgericht Hannover",
      "registernummer": "VR 5759",
      "registerart": "VR",
      "company_name": "Verein für betreuendes Wohnen und Tagesstrukturierung psychisch Gesundender e.V.",
      "company_seat": "Hannover",
      "details": "23.12.2025 (Bekanntmachungsdatum)\n\nNiedersachsen Amtsgericht Hannover VR 5759\nRegisterbekanntmachung nach dem Umwandlungsgesetz 23.12.2025 (Eintragungsdatum)\n\nVerein für betreuendes Wohnen und Tagesstrukturierung psychisch Gesundender e.V.\neingetragener Verein\nHannover\n\nDen Gläubigern der an der formwechselnden Umwandlung beteiligten Rechtsträger ist, wenn sie binnen sechs Monaten nach dem Tag, an dem die Eintragung der Umwandlung in das Register des Sitzes desjenigen Rechtsträgers, dessen Gläubiger sie sind, nach § 19 Abs. 3 UmwG als bekannt gemacht gilt, ihren Anspruch nach Grund und Höhe schriftlich anmelden, Sicherheit zu leisten, soweit sie nicht Befriedigung verlangen können. Dieses Recht steht den Gläubigern jedoch nur zu, wenn sie glaubhaft machen, dass durch die formwechselnde Umwandlung die Erfüllung der Forderung gefährdet wird."
    },
    {
      "date": "2025-12-23",
      "id": "140954",
      "original_text": "Löschungsankündigung\nNiedersachsen Amtsgericht Osnabrück HRB 207684\nHolz- und Konstruktionsbau Pasbrig UG (haftungsbeschränkt) – Lengerich",
      "type": "Löschungsankündigung",
      "state": "Niedersachsen",
      "amtsgericht": "Amtsgericht Osnabrück",
      "registernummer": "HRB 207684",
      "registerart": "HRB",
      "company_name": "Holz- und Konstruktionsbau Pasbrig UG (haftungsbeschränkt)",
      "company_seat": "Lengerich",
      "details": "23.12.2025 (Bekanntmachungsdatum)\n\nNiedersachsen Amtsgericht Osnabrück HRB 207684\nLöschungsankündigung 23.12.2025 (Eintragungsdatum)\n\nHolz- und Konstruktionsbau Pasbrig UG (haftungsbeschränkt)\nGesellschaft mit beschränkter Haftung\nLengerich\n\nDas Registergericht beabsichtigt, die Gesellschaft von Amts wegen nach § 394 FamFG wegen Vermögenslosigkeit zu löschen. Die Frist zur Erhebung eines Widerspruchs ist auf 1 Monat ab dieser Registerbekanntmachung festgesetzt."
    },
    {
      "date": "2025-12-23",
      "id": "140955",
      "original_text": "Registerbekanntmachung nach dem Umwandlungsgesetz\nNiedersachsen Amtsgericht Hannover HRB 230007\nbeta89 gGmbH – Hannover",
      "type": "Registerbekanntmachung nach dem Umwandlungsgesetz",
      "state": "Niedersachsen",
      "amtsgericht": "Amtsgericht Hannover",
      "registernummer": "HRB 230007",
      "registerart": "HRB",
      "company_name": "beta89 gGmbH",
      "company_seat": "Hannover",
      "details": "23.12.2025 (Bekanntmachungsdatum)\n\nNiedersachsen Amtsgericht Hannover HRB 230007\nRegisterbekanntmachung nach dem Umwandlungsgesetz 23.12.2025 (Eintragungsdatum)\n\nbeta89 gGmbH\nGesellschaft mit beschränkter Haftung\nHannover\n\nDen Gläubigern der an der formwechselnden Umwandlung beteiligten Rechtsträger ist, wenn sie binnen sechs Monaten nach dem Tag, an dem die Eintragung der Umwandlung in das Register des Sitzes desjenigen Rechtsträgers, dessen Gläubiger sie sind, nach § 19 Abs. 3 UmwG als bekannt gemacht gilt, ihren Anspruch nach Grund und Höhe schriftlich anmelden, Sicherheit zu leisten, soweit sie nicht Befriedigung verlangen können. Dieses Recht steht den Gläubigern jedoch nur zu, wenn sie glaubhaft machen, dass durch die formwechselnde Umwandlung die Erfüllung der Forderung gefährdet wird."
    },
    {
      "date": "2025-12-23",
      "id": "140956",
      "original_text": "Löschungsankündigung\nNiedersachsen Amtsgericht Hannover HRB 223603\nled-tec Beteiligungs GmbH – Hannover",
      "type": "Löschungsankündigung",
      "state": "Niedersachsen",
      "amtsgericht": "Amtsgericht Hannover",
      "registernummer": "HRB 223603",
      "registerart": "HRB",
      "company_name": "led-tec Beteiligungs GmbH",
      "company_seat": "Hannover",
      "details": "23.12.2025 (Bekanntmachungsdatum)\n\nNiedersachsen Amtsgericht Hannover HRB 223603\nLöschungsankündigung\n\nled-tec Beteiligungs GmbH\nGesellschaft mit beschränkter Haftung\nHannover\n\nDas Registergericht beabsichtigt, die Gesellschaft von Amts wegen nach § 394 FamFG zu löschen. Die Frist zur Erhebung eines Widerspruchs ist auf 1 Monat ab dieser Registerbekanntmachung festgesetzt."
    },
    {
      "date": "2025-12-23",
      "id": "140957",
      "original_text": "Registerbekanntmachung nach dem Umwandlungsgesetz\nNiedersachsen Amtsgericht Oldenburg (Oldenburg) HRB 207618\nPetri Vertriebs-GmbH – Cloppenburg",
      "type": "Registerbekanntmachung nach dem Umwandlungsgesetz",
      "state": "Niedersachsen",
      "amtsgericht": "Amtsgericht Oldenburg (Oldenburg)",
      "registernummer": "HRB 207618",
      "registerart": "HRB",
      "company_name": "Petri Vertriebs-GmbH",
      "company_seat": "Cloppenburg",
      "details": "23.12.2025 (Bekanntmachungsdatum)\n\nNiedersachsen Amtsgericht Oldenburg (Oldenburg) HRB 207618\nRegisterbekanntmachung nach dem Umwandlungsgesetz 23.12.2025 (Eintragungsdatum)\n\nPetri Vertriebs-GmbH\nGesellschaft mit beschränkter Haftung\nCloppenburg\n\nDen Gläubigern der an der Verschmelzung beteiligten Rechtsträger ist, wenn sie binnen sechs Monaten nach dem Tag, an dem die Eintragung der Verschmelzung in das Register des Sitzes desjenigen Rechtsträgers, dessen Gläubiger sie sind, nach § 19  Abs.  3 UmwG als bekannt gemacht gilt, ihren Anspruch nach Grund und Höhe schriftlich anmelden, Sicherheit zu leisten, soweit sie nicht Befriedigung verlangen können. Dieses Recht steht den Gläubigern jedoch nur zu, wenn sie glaubhaft machen, dass durch die Verschmelzung die Erfüllung der Forderung gefährdet wird."
    },
    {
      "date": "2025-12-23",
      "id": "140958",
      "original_text": "Registerbekanntmachung nach dem Umwandlungsgesetz\nNiedersachsen Amtsgericht Oldenburg (Oldenburg) HRA 208879\nWurbs Versicherungsmakler GmbH & Co. KG – Vechta",
      "type": "Registerbekanntmachung nach dem Umwandlungsgesetz",
      "state": "Niedersachsen",
      "amtsgericht": "Amtsgericht Oldenburg (Oldenburg)",
      "registernummer": "HRA 208879",
      "registerart": "HRA",
      "company_name": "Wurbs Versicherungsmakler GmbH & Co. KG",
      "company_seat": "Vechta",
      "details": "23.12.2025 (Bekanntmachungsdatum)\n\nNiedersachsen Amtsgericht Oldenburg (Oldenburg) HRA 208879\nRegisterbekanntmachung nach dem Umwandlungsgesetz 23.12.2025 (Eintragungsdatum)\n\nWurbs Versicherungsmakler GmbH & Co. KG\nKommanditgesellschaft\nVechta\n\nDen Gläubigern der an der Ausgliederung beteiligten Rechtsträger ist, wenn sie binnen sechs Monaten nach dem Tag, an dem die Eintragung der Ausgliederung in das Register des Sitzes desjenigen Rechtsträgers, dessen Gläubiger sie sind, nach § 19 Abs. 3 UmwG als bekannt gemacht gilt, ihren Anspruch nach Grund und Höhe schriftlich anmelden, Sicherheit zu leisten, soweit sie nicht Befriedigung verlangen können. Dieses Recht steht den Gläubigern jedoch nur zu, wenn sie glaubhaft machen, dass durch die Ausgliederung die Erfüllung der Forderung gefährdet wird."
    },
    {
      "date": "2025-12-23",
      "id": "140959",
      "original_text": "Registerbekanntmachung nach dem Umwandlungsgesetz\nNiedersachsen Amtsgericht Oldenburg (Oldenburg) HRA 208829\nLukas Wurbs Versicherungsmakler e.K. – Vechta",
      "type": "Registerbekanntmachung nach dem Umwandlungsgesetz",
      "state": "Niedersachsen",
      "amtsgericht": "Amtsgericht Oldenburg (Oldenburg)",
      "registernummer": "HRA 208829",
      "registerart": "HRA",
      "company_name": "Lukas Wurbs Versicherungsmakler e.K.",
      "company_seat": "Vechta",
      "details": "23.12.2025 (Bekanntmachungsdatum)\n\nNiedersachsen Amtsgericht Oldenburg (Oldenburg) HRA 208829\nRegisterbekanntmachung nach dem Umwandlungsgesetz 23.12.2025 (Eintragungsdatum)\n\nLukas Wurbs Versicherungsmakler e.K.\nEinzelkaufmann / Einzelkauffrau\nVechta\n\nDen Gläubigern der an der Ausgliederung beteiligten Rechtsträger ist, wenn sie binnen sechs Monaten nach dem Tag, an dem die Eintragung der Ausgliederung in das Register des Sitzes desjenigen Rechtsträgers, dessen Gläubiger sie sind, nach § 19 Abs. 3 UmwG als bekannt gemacht gilt, ihren Anspruch nach Grund und Höhe schriftlich anmelden, Sicherheit zu leisten, soweit sie nicht Befriedigung verlangen können. Dieses Recht steht den Gläubigern jedoch nur zu, wenn sie glaubhaft machen, dass durch die Ausgliederung die Erfüllung der Forderung gefährdet wird."
    },
    {
      "date": "2025-12-23",
      "id": "140960",
      "original_text": "Registerbekanntmachung nach dem Umwandlungsgesetz\nNiedersachsen Amtsgericht Osnabrück VR 110473\nStadtmarketing Georgsmarienhütte e.V. – Georgsmarienhütte",
      "type": "Registerbekanntmachung nach dem Umwandlungsgesetz",
      "state": "Niedersachsen",
      "amtsgericht": "Amtsgericht Osnabrück",
      "registernummer": "VR 110473",
      "registerart": "VR",
      "company_name": "Stadtmarketing Georgsmarienhütte e.V.",
      "company_seat": "Georgsmarienhütte",
      "details": "23.12.2025 (Bekanntmachungsdatum)\n\nNiedersachsen Amtsgericht Osnabrück VR 110473\nRegisterbekanntmachung nach dem Umwandlungsgesetz 23.12.2025 (Eintragungsdatum)\n\nStadtmarketing Georgsmarienhütte e.V.\neingetragener Verein\nGeorgsmarienhütte\n\nDen Gläubigern der an der formwechselnden Umwandlung beteiligten Rechtsträger ist, wenn sie binnen sechs Monaten nach dem Tag, an dem die Eintragung der Umwandlung in das Register des Sitzes desjenigen Rechtsträgers, dessen Gläubiger sie sind, nach § 19 Abs. 3 UmwG als bekannt gemacht gilt, ihren Anspruch nach Grund und Höhe schriftlich anmelden, Sicherheit zu leisten, soweit sie nicht Befriedigung verlangen können. Dieses Recht steht den Gläubigern jedoch nur zu, wenn sie glaubhaft machen, dass durch die formwechselnde Umwandlung die Erfüllung der Forderung gefährdet wird."
    },
    {
      "date": "2025-12-23",
      "id": "140961",
      "original_text": "Registerbekanntmachung nach dem Umwandlungsgesetz\nNiedersachsen Amtsgericht Göttingen HRB 1771\nDirk Weitemeyer GmbH – Northeim",
      "type": "Registerbekanntmachung nach dem Umwandlungsgesetz",
      "state": "Niedersachsen",
      "amtsgericht": "Amtsgericht Göttingen",
      "registernummer": "HRB 1771",
      "registerart": "HRB",
      "company_name": "Dirk Weitemeyer GmbH",
      "company_seat": "Northeim",
      "details": "23.12.2025 (Bekanntmachungsdatum)\n\nNiedersachsen Amtsgericht Göttingen HRB 1771\nRegisterbekanntmachung nach dem Umwandlungsgesetz 23.12.2025 (Eintragungsdatum)\n\nDirk Weitemeyer GmbH\nGesellschaft mit beschränkter Haftung\nNortheim\n\nDen Gläubigern der an der Verschmelzung beteiligten Rechtsträger ist, wenn sie binnen sechs Monaten nach dem Tag, an dem die Eintragung der Verschmelzung in das Register des Sitzes desjenigen Rechtsträgers, dessen Gläubiger sie sind, nach § 19  Abs.  3 UmwG als bekannt gemacht gilt, ihren Anspruch nach Grund und Höhe schriftlich anmelden, Sicherheit zu leisten, soweit sie nicht Befriedigung verlangen können. Dieses Recht steht den Gläubigern jedoch nur zu, wenn sie glaubhaft machen, dass durch die Verschmelzung die Erfüllung der Forderung gefährdet wird."
    },
    {
      "date": "2025-12-23",
      "id": "140962",
      "original_text": "Registerbekanntmachung nach dem Umwandlungsgesetz\nRheinland-Pfalz Amtsgericht Ludwigshafen a.Rhein (Ludwigshafen) HRB 70568\nThomas Prichta Betriebsverpachtung GmbH – Ludwigshafen am Rhein",
      "type": "Registerbekanntmachung nach dem Umwandlungsgesetz",
      "state": "Rheinland-Pfalz",
      "amtsgericht": "Amtsgericht Ludwigshafen a.Rhein (Ludwigshafen)",
      "registernummer": "HRB 70568",
      "registerart": "HRB",
      "company_name": "Thomas Prichta Betriebsverpachtung GmbH",
      "company_seat": "Ludwigshafen am Rhein",
      "details": "23.12.2025 (Bekanntmachungsdatum)\n\nRheinland-Pfalz Amtsgericht Ludwigshafen a.Rhein (Ludwigshafen) HRB 70568\nRegisterbekanntmachung nach dem Umwandlungsgesetz 23.12.2025 (Eintragungsdatum)\n\nThomas Prichta Betriebsverpachtung GmbH\nGesellschaft mit beschränkter Haftung\nLudwigshafen am Rhein\n\nAls nicht eingetragen wird veröffentlicht: Den Gläubigern der an der Ausgliederung beteiligten Rechtsträger ist, wenn sie binnen sechs Monaten nach dem Tag, an dem die Eintragung der Ausgliederung in das Register des Sitzes desjenigen Rechtsträgers, dessen Gläubiger sie sind, nach § 19 Abs. 3 UmwG als bekannt gemacht gilt, ihren Anspruch nach Grund und Höhe schriftlich anmelden, Sicherheit zu leisten, soweit sie nicht Befriedigung verlangen können. Dieses Recht steht den Gläubigern jedoch nur zu, wenn sie glaubhaft machen, dass durch die Ausgliederung die Erfüllung der Forderung gefährdet wird."
    },
    {
      "date": "2025-12-23",
      "id": "140963",
      "original_text": "Registerbekanntmachung nach dem Umwandlungsgesetz\nBremen Amtsgericht Bremen HRB 38208\nHIAMO AG – Bremen",
      "type": "Registerbekanntmachung nach dem Umwandlungsgesetz",
      "state": "Bremen",
      "amtsgericht": "Amtsgericht Bremen",
      "registernummer": "HRB 38208",
      "registerart": "HRB",
      "company_name": "HIAMO AG",
      "company_seat": "Bremen",
      "details": "23.12.2025 (Bekanntmachungsdatum)\n\nBremen Amtsgericht Bremen HRB 38208\nRegisterbekanntmachung nach dem Umwandlungsgesetz 16.12.2025 (Eintragungsdatum)\n\nHIAMO AG\nAktiengesellschaft\nBremen\n\nZu Eintragungsnummer 2 vom 16.12.2025 wird als nicht eingetragen veröffentlicht:  Als nicht eingetragen wird veröffentlicht: Den Gläubigern ist, wenn sie binnen sechs Monaten nach dem Tag, an dem die Eintragung der Umwandlung als bekannt gemacht gilt, ihren Anspruch nach Grund und Höhe schriftlich anmelden, Sicherheit zu leisten, soweit sie nicht Befriedigung verlangen können. Dieses Recht steht den Gläubigern jedoch nur zu, wenn sie glaubhaft machen, dass durch die Umwandlung die Erfüllung ihrer Forderung gefährdet wird. Das Recht, Sicherheitsleistung zu verlangen, steht Gläubigern nicht zu, die im Falle der Insolvenz ein Recht auf vorzugsweise Befriedigung aus einer Deckungsmasse haben, die nach gesetzlicher Vorschrift zu ihrem Schutz errichtet und staatlich überwacht ist."
    },
    {
      "date": "2025-12-23",
      "id": "140964",
      "original_text": "Löschungsankündigung\nBremen Amtsgericht Bremen HRA 2203 BHV\nGustav W. Rogge GmbH & Co. KG Bauunternehmung – Bremerhaven",
      "type": "Löschungsankündigung",
      "state": "Bremen",
      "amtsgericht": "Amtsgericht Bremen",
      "registernummer": "HRA 2203 BHV",
      "registerart": "HRA",
      "company_name": "Gustav W. Rogge GmbH & Co. KG Bauunternehmung",
      "company_seat": "Bremerhaven",
      "details": "23.12.2025 (Bekanntmachungsdatum)\n\nBremen Amtsgericht Bremen HRA 2203 BHV\nLöschungsankündigung\n\nGustav W. Rogge GmbH & Co. KG Bauunternehmung\nKommanditgesellschaft\nBremerhaven\n\nEs ist beabsichtigt die im Handelsregister eingetragene Gesellschaft von Amts wegen gemäß § 394 FamFG zu löschen. Gegen die Löschung kann beim AG Bremen schriftlich oder zu Protokoll der Geschäftsstelle Widerspruch eingelegt werden. Widerspruchsfrist 4 Wochen."
    },
    {
      "date": "2025-12-23",
      "id": "140965",
      "original_text": "Registerbekanntmachung nach dem Umwandlungsgesetz\nRheinland-Pfalz Amtsgericht Montabaur HRA 22176\nComputerTechnik Kremer GmbH & Co. KG – Weitefeld",
      "type": "Registerbekanntmachung nach dem Umwandlungsgesetz",
      "state": "Rheinland-Pfalz",
      "amtsgericht": "Amtsgericht Montabaur",
      "registernummer": "HRA 22176",
      "registerart": "HRA",
      "company_name": "ComputerTechnik Kremer GmbH & Co. KG",
      "company_seat": "Weitefeld",
      "details": "23.12.2025 (Bekanntmachungsdatum)\n\nRheinland-Pfalz Amtsgericht Montabaur HRA 22176\nRegisterbekanntmachung nach dem Umwandlungsgesetz 23.12.2025 (Eintragungsdatum)\n\nComputerTechnik Kremer GmbH & Co. KG\nKommanditgesellschaft\nWeitefeld\n\nAls nicht eingetragen wird veröffentlicht: Den Gläubigern der an der Verschmelzung beteiligten Rechtsträger ist, wenn sie binnen sechs Monaten nach dem Tag, an dem die Eintragung der Verschmelzung in das Register des Sitzes desjenigen Rechtsträgers, dessen Gläubiger sie sind, nach § 19 Abs. 3 UmwG als bekannt gemacht gilt, ihren Anspruch nach Grund und Höhe schriftlich anmelden, Sicherheit zu leisten, soweit sie nicht Befriedigung verlangen können. Dieses Recht steht den Gläubigern jedoch nur zu, wenn sie glaubhaft machen, dass durch die Verschmelzung die Erfüllung der Forderung gefährdet wird."
    },
    {
      "date": "2025-12-23",
      "id": "140966",
      "original_text": "Registerbekanntmachung nach dem Umwandlungsgesetz\nRheinland-Pfalz Amtsgericht Ludwigshafen a.Rhein (Ludwigshafen) HRA 62407\nThomas Prichta Betriebsverpachtung e.K. – Weisenheim am Sand",
      "type": "Registerbekanntmachung nach dem Umwandlungsgesetz",
      "state": "Rheinland-Pfalz",
      "amtsgericht": "Amtsgericht Ludwigshafen a.Rhein (Ludwigshafen)",
      "registernummer": "HRA 62407",
      "registerart": "HRA",
      "company_name": "Thomas Prichta Betriebsverpachtung e.K.",
      "company_seat": "Weisenheim am Sand",
      "details": "23.12.2025 (Bekanntmachungsdatum)\n\nRheinland-Pfalz Amtsgericht Ludwigshafen a.Rhein (Ludwigshafen) HRA 62407\nRegisterbekanntmachung nach dem Umwandlungsgesetz 23.12.2025 (Eintragungsdatum)\n\nThomas Prichta Betriebsverpachtung e.K.\nEinzelkaufmann / Einzelkauffrau\nWeisenheim am Sand\n\nAls nicht eingetragen wird veröffentlicht: Den Gläubigern der an der Ausgliederung beteiligten Rechtsträger ist, wenn sie binnen sechs Monaten nach dem Tag, an dem die Eintragung der Ausgliederung in das Register des Sitzes desjenigen Rechtsträgers, dessen Gläubiger sie sind, nach § 19 Abs. 3 UmwG als bekannt gemacht gilt, ihren Anspruch nach Grund und Höhe schriftlich anmelden, Sicherheit zu leisten, soweit sie nicht Befriedigung verlangen können. Dieses Recht steht den Gläubigern jedoch nur zu, wenn sie glaubhaft machen, dass durch die Ausgliederung die Erfüllung der Forderung gefährdet wird."
    },
    {
      "date": "2025-12-23",
      "id": "140967",
      "original_text": "Registerbekanntmachung nach dem Umwandlungsgesetz\nNordrhein-Westfalen Amtsgericht Bad Oeynhausen HRA 10646\nSven Klatt e. K. – Löhne",
      "type": "Registerbekanntmachung nach dem Umwandlungsgesetz",
      "state": "Nordrhein-Westfalen",
      "amtsgericht": "Amtsgericht Bad Oeynhausen",
      "registernummer": "HRA 10646",
      "registerart": "HRA",
      "company_name": "Sven Klatt e. K.",
      "company_seat": "Löhne",
      "details": "23.12.2025 (Bekanntmachungsdatum)\n\nNordrhein-Westfalen Amtsgericht Bad Oeynhausen HRA 10646\nRegisterbekanntmachung nach dem Umwandlungsgesetz 23.12.2025 (Eintragungsdatum)\n\nSven Klatt e. K.\nEinzelkaufmann / Einzelkauffrau\nLöhne\n\nDen Gläubigern der an der Verschmelzung beteiligten Rechtsträger ist, wenn sie binnen sechs Monaten nach dem Tag, an dem die Eintragung der Verschmelzung in das Register des Sitzes desjenigen Rechtsträgers, dessen Gläubiger sie sind, nach § 19 Absatz 3 UmwG als bekanntgemacht gilt, ihren Anspruch nach Grund und Höhe schriftlich anmelden, Sicherheit zu leisten, soweit sie nicht Befriedigung verlangen können. Dieses Recht steht den Gläubigern jedoch nur zu, wenn sie glaubhaft machen, dass durch die Verschmelzung die Erfüllung ihrer Forderung gefährdet wird."
    },
    {
      "date": "2025-12-23",
      "id": "140968",
      "original_text": "Registerbekanntmachung nach dem Umwandlungsgesetz\nNordrhein-Westfalen Amtsgericht Siegen HRB 10632\nProfi. S Gesellschaft für logistische Softwareentwicklung und Operations Research mbH – Wenden",
      "type": "Registerbekanntmachung nach dem Umwandlungsgesetz",
      "state": "Nordrhein-Westfalen",
      "amtsgericht": "Amtsgericht Siegen",
      "registernummer": "HRB 10632",
      "registerart": "HRB",
      "company_name": "Profi. S Gesellschaft für logistische Softwareentwicklung und Operations Research mbH",
      "company_seat": "Wenden",
      "details": "23.12.2025 (Bekanntmachungsdatum)\n\nNordrhein-Westfalen Amtsgericht Siegen HRB 10632\nRegisterbekanntmachung nach dem Umwandlungsgesetz 23.12.2025 (Eintragungsdatum)\n\nProfi. S Gesellschaft für logistische Softwareentwicklung und Operations Research mbH\nGesellschaft mit beschränkter Haftung\nWenden\n\nDen Gläubigern der an der Verschmelzung beteiligten Rechtsträger ist, wenn sie binnen sechs Monaten nach dem Tag, an dem die Eintragung der Verschmelzung in das Register des Sitzes derjenigen Rechtsträger deren Gläubiger sie sind, nach § 19 Absatz 3 UmwG als bekanntgemacht gilt, ihren Anspruch nach Grund und Höhe schriftlich anmelden, Sicherheit zu leisten, soweit sie nicht Befriedigung verlangen können. Dieses Recht steht den Gläubigern jedoch nur zu, wenn sie glaubhaft machen, dass durch die Verschmelzung die Erfüllung ihrer Forderung gefährdet wird."
    },
    {
      "date": "2025-12-23",
      "id": "140969",
      "original_text": "Einreichung neuer Dokumente\nNordrhein-Westfalen Amtsgericht Köln HRB 93308\nSTRABAG AG – Köln",
      "type": "Einreichung neuer Dokumente",
      "state": "Nordrhein-Westfalen",
      "amtsgericht": "Amtsgericht Köln",
      "registernummer": "HRB 93308",
      "registerart": "HRB",
      "company_name": "STRABAG AG",
      "company_seat": "Köln",
      "details": "23.12.2025 (Bekanntmachungsdatum)\n\nNordrhein-Westfalen Amtsgericht Köln HRB 93308\nEinreichung neuer Dokumente\n\nSTRABAG AG\nAktiengesellschaft\nKöln\n\nDem Registergericht ist eine Liste der Mitglieder des Aufsichtsrates eingereicht worden."
    },
    {
      "date": "2025-12-23",
      "id": "140970",
      "original_text": "Einreichung neuer Dokumente\nNordrhein-Westfalen Amtsgericht Hagen HRB 5008\nHerdecker Gemeinnützige Wohnungsgesellschaft mit beschränkter Haftung – Herdecke",
      "type": "Einreichung neuer Dokumente",
      "state": "Nordrhein-Westfalen",
      "amtsgericht": "Amtsgericht Hagen",
      "registernummer": "HRB 5008",
      "registerart": "HRB",
      "company_name": "Herdecker Gemeinnützige Wohnungsgesellschaft mit beschränkter Haftung",
      "company_seat": "Herdecke",
      "details": "23.12.2025 (Bekanntmachungsdatum)\n\nNordrhein-Westfalen Amtsgericht Hagen HRB 5008\nEinreichung neuer Dokumente\n\nHerdecker Gemeinnützige Wohnungsgesellschaft mit beschränkter Haftung\nGesellschaft mit beschränkter Haftung\nHerdecke\n\nDem Registergericht ist eine neue Liste der Mitglieder des Aufsichtsrates eingereicht worden."
    },
    {
      "date": "2025-12-23",
      "id": "140971",
      "original_text": "Löschungsankündigung\nNordrhein-Westfalen Amtsgericht Duisburg HRB 37389\nBeta Connect GmbH – Oberhausen",
      "type": "Löschungsankündigung",
      "state": "Nordrhein-Westfalen",
      "amtsgericht": "Amtsgericht Duisburg",
      "registernummer": "HRB 37389",
      "registerart": "HRB",
      "company_name": "Beta Connect GmbH",
      "company_seat": "Oberhausen",
      "details": "23.12.2025 (Bekanntmachungsdatum)\n\nNordrhein-Westfalen Amtsgericht Duisburg HRB 37389\nLöschungsankündigung 23.12.2025 (Eintragungsdatum)\n\nBeta Connect GmbH\nGesellschaft mit beschränkter Haftung\nOberhausen\n\nHRB 37389:\nBeta Connect GmbH, Oberhausen\nSchmachtendorfer Straße 5, 46147 Oberhausen.\nDas Registergericht beabsichtigt, die im Handelsregister eingetragene Gesellschaft gemäß § 394 FamFG wegen Vermögenslosigkeit von Amts wegen zu löschen. Gegen diese Verfügung kann Widerspruch eingelegt werden. Die Frist zur Erhebung eines Widerspruchs gegen die beabsichtigte Löschung von Amts wegen ist auf drei Monate festgesetzt.\nRechtsbehelfsbelehrung Der Widerspruch ist bei dem Amtsgericht Duisburg, Kardinal-Galen-Str. 124-132, 47058 Duisburg schriftlich in deutscher Sprache oder zur Niederschrift der Geschäftsstelle einzulegen. Der Widerspruch kann auch zur Niederschrift der Geschäftsstelle eines jeden Amtsgerichtes abgegeben werden. Die Einlegung ist auch durch Übertragung eines elektronischen Dokuments an die elektronische Poststelle des Gerichts möglich. Das elektronische Dokument muss für die Bearbeitung durch das Gericht geeignet und mit einer qualifizierten elektronischen Signatur der verantwortenden Person versehen sein oder von der verantwortenden Person signiert und auf einem sicheren Übermittlungsweg gemäß § 130 a ZPO nach näherer Maßgabe der Verordnung über die technischen Rahmenbedingungen des elektronischen Rechtsverkehrs und über das besondere elektronische Behördenpostfach (BGBl. I, S. 3803) eingereicht werden. Weitere Informationen erhalten Sie auf der Internetseite www.justiz.de. Der Widerspruch muss spätestens innerhalb der gesetzten Frist bei dem Amtsgericht Duisburg eingegangen sein. Dies gilt auch dann, wenn der Widerspruch zur Niederschrift der Geschäftsstelle eines anderen Amtsgerichtes abgegeben wurde. Die Frist beginnt mit der Veröffentlichung. Fällt das Ende der Frist auf einen Sonntag, einen allgemeinen Feiertag oder Sonnabend, so endet die Frist mit Ablauf des nächsten Werktages. Der Widerspruch muss die Bezeichnung der angefochtenen Verfügung sowie die Erklärung enthalten, dass Widerspruch gegen diese Verfügung eingelegt wird. Er ist zu unterzeichnen und soll begründet werden."
    },
    {
      "date": "2025-12-23",
      "id": "140972",
      "original_text": "Löschungsankündigung\nNordrhein-Westfalen Amtsgericht Düsseldorf HRB 87590\nShengeng Interior Design GmbH – Düsseldorf",
      "type": "Löschungsankündigung",
      "state": "Nordrhein-Westfalen",
      "amtsgericht": "Amtsgericht Düsseldorf",
      "registernummer": "HRB 87590",
      "registerart": "HRB",
      "company_name": "Shengeng Interior Design GmbH",
      "company_seat": "Düsseldorf",
      "details": "23.12.2025 (Bekanntmachungsdatum)\n\nNordrhein-Westfalen Amtsgericht Düsseldorf HRB 87590\nLöschungsankündigung\n\nShengeng Interior Design GmbH\nGesellschaft mit beschränkter Haftung\nDüsseldorf\n\nDas Registergericht beabsichtigt die Gesellschaft von Amts wegen nach § 394 FamFG zu löschen. Die Frist zur Erhebung eines Widerspruchs ist auf 3 Wochen festgesetzt.\n\nRechtsbehelfsbelehrung:\nDas Widerspruchsrecht steht jedem zu, der an der Unterlassung der Löschung ein berechtigtes Interesse hat. Der Widerspruch ist bei dem Amtsgericht Düsseldorf -Registergericht-, Werdener Straße 1, 40227 Düsseldorf schriftlich in deutscher Sprache oder zur Niederschrift der Geschäftsstelle einzulegen. Der Widerspruch kann auch zur Niederschrift der Geschäftsstelle eines jeden Amtsgerichtes abgegeben werden. Die Einlegung ist auch durch Übertragung eines elektronischen Dokuments an die elektronische Poststelle des Gerichts möglich. Das elektronische Dokument muss für die Bearbeitung durch das Gericht geeignet und mit einer qualifizierten elektronischen Signatur der verantwortenden Person versehen sein oder von der verantwortenden Person signiert und auf einem sicheren Übermittlungsweg gemäß § 130a ZPO nach näherer Maßgabe der Verordnung über die technischen Rahmenbedingungen des elektronischen Rechtsverkehrs und über das besondere elektronische Behördenpostfach (BGBl. I, S.3803) eingereicht werden. Weitere Informationen erhalten Sie auf der Internetseite www.justiz.de.\nDer Widerspruch muss spätestens innerhalb der gesetzten Frist nach dem Datum der Bekanntmachung der Löschungsankündigung bei dem Amtsgericht - Registergericht - Düsseldorf eingegangen sein.  Dies gilt auch dann, wenn der Widerspruch zur Niederschrift der Geschäftsstelle eines anderen Amtsgerichtes abgegeben wurde. Die Frist beginnt mit dem Tage der Bekanntmachung der Löschungsankündigung in dem für die Bekanntmachung der Eintragungen in das Handelsregister bestimmten elektronischen Informations- und Kommunikationssystem nach § 10 des Handelsgesetzbuches. Fällt das Ende der Frist auf einen Sonntag, einen allgemeinen Feiertag oder Sonnabend, so endet die Frist mit Ablauf des nächsten Werktages.\nDer Widerspruch muss die Bezeichnung der angefochtenen Löschungsankündigung sowie die Erklärung enthalten, dass Widerspruch gegen diese Löschungsankündigung eingelegt wird. Er ist zu unterzeichnen und soll begründet werden."
    },
    {
      "date": "2025-12-23",
      "id": "140973",
      "original_text": "Löschungsankündigung\nNordrhein-Westfalen Amtsgericht Düsseldorf HRB 91166\nRontmaston UG (haftungsbeschränkt) – Düsseldorf",
      "type": "Löschungsankündigung",
      "state": "Nordrhein-Westfalen",
      "amtsgericht": "Amtsgericht Düsseldorf",
      "registernummer": "HRB 91166",
      "registerart": "HRB",
      "company_name": "Rontmaston UG (haftungsbeschränkt)",
      "company_seat": "Düsseldorf",
      "details": "23.12.2025 (Bekanntmachungsdatum)\n\nNordrhein-Westfalen Amtsgericht Düsseldorf HRB 91166\nLöschungsankündigung\n\nRontmaston UG (haftungsbeschränkt)\nGesellschaft mit beschränkter Haftung\nDüsseldorf\n\nDas Registergericht beabsichtigt die Gesellschaft von Amts wegen nach § 394 Abs. 1 FamFG zu löschen. Die Frist zur Erhebung eines Widerspruchs ist auf 3 Wochen festgesetzt.\n\nRechtsbehelfsbelehrung:\nDas Widerspruchsrecht steht jedem zu, der an der Unterlassung der Löschung ein berechtigtes Interesse hat. Der Widerspruch ist bei dem Amtsgericht Düsseldorf -Registergericht-, Werdener Straße 1, 40227 Düsseldorf schriftlich in deutscher Sprache oder zur Niederschrift der Geschäftsstelle einzulegen. Der Widerspruch kann auch zur Niederschrift der Geschäftsstelle eines jeden Amtsgerichtes abgegeben werden. Die Einlegung ist auch durch Übertragung eines elektronischen Dokuments an die elektronische Poststelle des Gerichts möglich. Das elektronische Dokument muss für die Bearbeitung durch das Gericht geeignet und mit einer qualifizierten elektronischen Signatur der verantwortenden Person versehen sein oder von der verantwortenden Person signiert und auf einem sicheren Übermittlungsweg gemäß § 130a ZPO nach näherer Maßgabe der Verordnung über die technischen Rahmenbedingungen des elektronischen Rechtsverkehrs und über das besondere elektronische Behördenpostfach (BGBl. I, S.3803) eingereicht werden. Weitere Informationen erhalten Sie auf der Internetseite www.justiz.de.\nDer Widerspruch muss spätestens innerhalb der gesetzten Frist nach dem Datum der Bekanntmachung der Löschungsankündigung bei dem Amtsgericht - Registergericht - Düsseldorf eingegangen sein.  Dies gilt auch dann, wenn der Widerspruch zur Niederschrift der Geschäftsstelle eines anderen Amtsgerichtes abgegeben wurde. Die Frist beginnt mit dem Tage der Bekanntmachung der Löschungsankündigung in dem für die Bekanntmachung der Eintragungen in das Handelsregister bestimmten elektronischen Informations- und Kommunikationssystem nach § 10 des Handelsgesetzbuches. Fällt das Ende der Frist auf einen Sonntag, einen allgemeinen Feiertag oder Sonnabend, so endet die Frist mit Ablauf des nächsten Werktages.\nDer Widerspruch muss die Bezeichnung der angefochtenen Löschungsankündigung sowie die Erklärung enthalten, dass Widerspruch gegen diese Löschungsankündigung eingelegt wird. Er ist zu unterzeichnen und soll begründet werden."
    },
    {
      "date": "2025-12-23",
      "id": "140974",
      "original_text": "Löschungsankündigung\nNordrhein-Westfalen Amtsgericht Wuppertal HRB 31311\nF-B-N Montage GmbH – Wuppertal",
      "type": "Löschungsankündigung",
      "state": "Nordrhein-Westfalen",
      "amtsgericht": "Amtsgericht Wuppertal",
      "registernummer": "HRB 31311",
      "registerart": "HRB",
      "company_name": "F-B-N Montage GmbH",
      "company_seat": "Wuppertal",
      "details": "23.12.2025 (Bekanntmachungsdatum)\n\nNordrhein-Westfalen Amtsgericht Wuppertal HRB 31311\nLöschungsankündigung 22.12.2025 (Eintragungsdatum)\n\nF-B-N Montage GmbH\nGesellschaft mit beschränkter Haftung\nWuppertal\n\nDas Registergericht beabsichtigt die Gesellschaft von Amts wegen nach § 394 FamFG zu löschen. Die Frist zur Erhebung eines Widerspruchs ist auf einen Monat festgesetzt."
    },
    {
      "date": "2025-12-23",
      "id": "140975",
      "original_text": "Sonstige Registerbekanntmachung\nNordrhein-Westfalen Amtsgericht Mönchengladbach HRB 14843\nPOLO Motorrad und Sportswear GmbH – Jüchen",
      "type": "Sonstige Registerbekanntmachung",
      "state": "Nordrhein-Westfalen",
      "amtsgericht": "Amtsgericht Mönchengladbach",
      "registernummer": "HRB 14843",
      "registerart": "HRB",
      "company_name": "POLO Motorrad und Sportswear GmbH",
      "company_seat": "Jüchen",
      "details": "23.12.2025 (Bekanntmachungsdatum)\n\nNordrhein-Westfalen Amtsgericht Mönchengladbach HRB 14843\nSonstige Registerbekanntmachung 23.12.2025 (Eintragungsdatum)\n\nPOLO Motorrad und Sportswear GmbH\nGesellschaft mit beschränkter Haftung\nJüchen\n\nAls nicht eingetragen wird veröffentlicht: Den Gläubigern der Gesellschaft, deren Forderungen begründet worden sind bevor die Eintragung der Beendigung des Gewinnabführungsvertrages  in das Handelsregister nach § 10 des Handelsgesetzbuches als bekanntgemacht gilt, hat der andere Vertragsteil Sicherheit zu leisten, wenn sie sich binnen sechs Monaten nach der Bekanntmachung der Eintragung zu diesem Zweck bei ihm melden."
    },
    {
      "date": "2025-12-23",
      "id": "140976",
      "original_text": "Löschungsankündigung\nNordrhein-Westfalen Amtsgericht Gelsenkirchen HRB 4972\nVARIO GmbH Mischtechnik – Dorsten",
      "type": "Löschungsankündigung",
      "state": "Nordrhein-Westfalen",
      "amtsgericht": "Amtsgericht Gelsenkirchen",
      "registernummer": "HRB 4972",
      "registerart": "HRB",
      "company_name": "VARIO GmbH Mischtechnik",
      "company_seat": "Dorsten",
      "details": "23.12.2025 (Bekanntmachungsdatum)\n\nNordrhein-Westfalen Amtsgericht Gelsenkirchen HRB 4972\nLöschungsankündigung\n\nVARIO GmbH Mischtechnik\nGesellschaft mit beschränkter Haftung\nDorsten\n\nDas Gericht beabsichtigt, die Gesellschaft VARIO GmbH Mischtechnik mit Sitz in Dorsten, HRB 4972 Amtsgericht Gelsenkirchen, wegen Vermögenslosigkeit zu löschen.\n\nHiermit wird denjenigen, die an der Unterlassung der Löschung ein berechtigtes Interesse haben, gem. § 394 Abs. 2 FamFG Gelegenheit gegeben, gegen dieses Vorhaben binnen eines Monats nach dieser Bekanntmachung Widerspruch einzulegen. Der Widerspruch kann schriftlich oder zu Protokoll der Geschäftsstelle erhoben werden."
    },
    {
      "date": "2025-12-23",
      "id": "140977",
      "original_text": "Einreichung neuer Dokumente\nNordrhein-Westfalen Amtsgericht Bad Oeynhausen HRB 12096\nMindener Stadtwerke GmbH – Minden",
      "type": "Einreichung neuer Dokumente",
      "state": "Nordrhein-Westfalen",
      "amtsgericht": "Amtsgericht Bad Oeynhausen",
      "registernummer": "HRB 12096",
      "registerart": "HRB",
      "company_name": "Mindener Stadtwerke GmbH",
      "company_seat": "Minden",
      "details": "23.12.2025 (Bekanntmachungsdatum)\n\nNordrhein-Westfalen Amtsgericht Bad Oeynhausen HRB 12096\nEinreichung neuer Dokumente 23.12.2025 (Eintragungsdatum)\n\nMindener Stadtwerke GmbH\nGesellschaft mit beschränkter Haftung\nMinden\n\nDem Registergericht ist eine neue Liste der Mitglieder des Aufsichtsrates eingereicht worden."
    },
    {
      "date": "2025-12-23",
      "id": "140978",
      "original_text": "Löschungsankündigung\nNordrhein-Westfalen Amtsgericht Köln HRB 97082\nTOK GmbH – Köln",
      "type": "Löschungsankündigung",
      "state": "Nordrhein-Westfalen",
      "amtsgericht": "Amtsgericht Köln",
      "registernummer": "HRB 97082",
      "registerart": "HRB",
      "company_name": "TOK GmbH",
      "company_seat": "Köln",
      "details": "23.12.2025 (Bekanntmachungsdatum)\n\nNordrhein-Westfalen Amtsgericht Köln HRB 97082\nLöschungsankündigung\n\nTOK GmbH\nGesellschaft mit beschränkter Haftung\nKöln\n\nDas Registergericht beabsichtigt die Gesellschaft von Amts wegen nach § 394 FamFG zu löschen. Die Frist zur Erhebung eines Widerspruchs ist auf einen Monat festgesetzt."
    },
    {
      "date": "2025-12-23",
      "id": "140979",
      "original_text": "Registerbekanntmachung nach dem Umwandlungsgesetz\nNordrhein-Westfalen Amtsgericht Bad Oeynhausen VR 21132 früher Amtsgericht Herford\nMieterverein Herford – Herford",
      "type": "Registerbekanntmachung nach dem Umwandlungsgesetz",
      "state": "Nordrhein-Westfalen",
      "amtsgericht": "Amtsgericht Bad Oeynhausen",
      "registernummer": "VR 21132",
      "registerart": "VR",
      "company_name": "Mieterverein Herford",
      "company_seat": "Herford",
      "former_amtsgericht": "Herford",
      "details": "23.12.2025 (Bekanntmachungsdatum)\n\nNordrhein-Westfalen Amtsgericht Bad Oeynhausen VR 21132 früher Amtsgericht Herford\nRegisterbekanntmachung nach dem Umwandlungsgesetz 23.12.2025 (Eintragungsdatum)\n\nMieterverein Herford\neingetragener Verein\nHerford\n\nDen Gläubigern der an der Verschmelzung beteiligten Rechtsträger ist, wenn sie binnen sechs Monaten nach dem Tag, an dem die Eintragung der Verschmelzung in das Register des Sitzes desjenigen Rechtsträgers, dessen Gläubiger sie sind, nach § 19 Absatz 3 UmwG als bekanntgemacht gilt, ihren Anspruch nach Grund und Höhe schriftlich anmelden, Sicherheit zu leisten, soweit sie nicht Befriedigung verlangen können. Dieses Recht steht den Gläubigern jedoch nur zu, wenn sie glaubhaft machen, dass durch die Verschmelzung die Erfüllung ihrer Forderung gefährdet wird."
    },
    {
      "date": "2025-12-23",
      "id": "140980",
      "original_text": "Löschungsankündigung\nNordrhein-Westfalen Amtsgericht Paderborn HRB 11615\nLippstädter Baugesellschaft GmbH – Lippstadt",
      "type": "Löschungsankündigung",
      "state": "Nordrhein-Westfalen",
      "amtsgericht": "Amtsgericht Paderborn",
      "registernummer": "HRB 11615",
      "registerart": "HRB",
      "company_name": "Lippstädter Baugesellschaft GmbH",
      "company_seat": "Lippstadt",
      "details": "23.12.2025 (Bekanntmachungsdatum)\n\nNordrhein-Westfalen Amtsgericht Paderborn HRB 11615\nLöschungsankündigung 23.12.2025 (Eintragungsdatum)\n\nLippstädter Baugesellschaft GmbH\nGesellschaft mit beschränkter Haftung\nLippstadt\n\nDas Registergericht beabsichtigt die Gesellschaft von Amts wegen nach § 394 FamFG zu löschen. Die Frist zur Erhebung eines Widerspruchs ist auf einen Monat festgesetzt."
    },
    {
      "date": "2025-12-23",
      "id": "140981",
      "original_text": "Löschungsankündigung\nNordrhein-Westfalen Amtsgericht Hamm HRB 9228\nSimplifysoft GmbH – Bönen",
      "type": "Löschungsankündigung",
      "state": "Nordrhein-Westfalen",
      "amtsgericht": "Amtsgericht Hamm",
      "registernummer": "HRB 9228",
      "registerart": "HRB",
      "company_name": "Simplifysoft GmbH",
      "company_seat": "Bönen",
      "details": "23.12.2025 (Bekanntmachungsdatum)\n\nNordrhein-Westfalen Amtsgericht Hamm HRB 9228\nLöschungsankündigung\n\nSimplifysoft GmbH\nGesellschaft mit beschränkter Haftung\nBönen\n\nDas Registergericht beabsichtigt die Gesellschaft von Amts wegen nach § 394 FamFG zu löschen. Die Frist zur Erhebung eines Widerspruchs ist auf #DV.Fr(Text=\"Bitte wählen Sie die Widerspruchsfrist aus!\",Eingabe=\"einen Monat\",\"zwei Monate\",\"drei Monate\",\"#insert(Text=\"Freitext\")\"|\"freier Text\") festgesetzt."
    },
    {
      "date": "2025-12-23",
      "id": "140982",
      "original_text": "Löschungsankündigung\nNordrhein-Westfalen Amtsgericht Hamm HRB 9228\nSimplifysoft GmbH – Bönen",
      "type": "Löschungsankündigung",
      "state": "Nordrhein-Westfalen",
      "amtsgericht": "Amtsgericht Hamm",
      "registernummer": "HRB 9228",
      "registerart": "HRB",
      "company_name": "Simplifysoft GmbH",
      "company_seat": "Bönen",
      "details": "23.12.2025 (Bekanntmachungsdatum)\n\nNordrhein-Westfalen Amtsgericht Hamm HRB 9228\nLöschungsankündigung\n\nSimplifysoft GmbH\nGesellschaft mit beschränkter Haftung\nBönen\n\nDas Registergericht beabsichtigt die Gesellschaft von Amts wegen nach § 394 FamFG zu löschen. Die Frist zur Erhebung eines Widerspruchs ist auf drei Monate festgesetzt."
    },
    {
      "date": "2025-12-23",
      "id": "140983",
      "original_text": "Löschungsankündigung\nNordrhein-Westfalen Amtsgericht Düsseldorf HRB 99032\nWWOO GmbH – Düsseldorf",
      "type": "Löschungsankündigung",
      "state": "Nordrhein-Westfalen",
      "amtsgericht": "Amtsgericht Düsseldorf",
      "registernummer": "HRB 99032",
      "registerart": "HRB",
      "company_name": "WWOO GmbH",
      "company_seat": "Düsseldorf",
      "details": "23.12.2025 (Bekanntmachungsdatum)\n\nNordrhein-Westfalen Amtsgericht Düsseldorf HRB 99032\nLöschungsankündigung\n\nWWOO GmbH\nGesellschaft mit beschränkter Haftung\nDüsseldorf\n\nDas Registergericht beabsichtigt die Gesellschaft von Amts wegen nach § 394 FamFG zu löschen. Die Frist zur Erhebung eines Widerspruchs ist auf 3 Wochen festgesetzt.\n\nRechtsbehelfsbelehrung:\nDas Widerspruchsrecht steht jedem zu, der an der Unterlassung der Löschung ein berechtigtes Interesse hat. Der Widerspruch ist bei dem Amtsgericht Düsseldorf -Registergericht-, Werdener Straße 1, 40227 Düsseldorf schriftlich in deutscher Sprache oder zur Niederschrift der Geschäftsstelle einzulegen. Der Widerspruch kann auch zur Niederschrift der Geschäftsstelle eines jeden Amtsgerichtes abgegeben werden. Die Einlegung ist auch durch Übertragung eines elektronischen Dokuments an die elektronische Poststelle des Gerichts möglich. Das elektronische Dokument muss für die Bearbeitung durch das Gericht geeignet und mit einer qualifizierten elektronischen Signatur der verantwortenden Person versehen sein oder von der verantwortenden Person signiert und auf einem sicheren Übermittlungsweg gemäß § 130a ZPO nach näherer Maßgabe der Verordnung über die technischen Rahmenbedingungen des elektronischen Rechtsverkehrs und über das besondere elektronische Behördenpostfach (BGBl. I, S.3803) eingereicht werden. Weitere Informationen erhalten Sie auf der Internetseite www.justiz.de.\nDer Widerspruch muss spätestens innerhalb der gesetzten Frist nach dem Datum der Bekanntmachung der Löschungsankündigung bei dem Amtsgericht - Registergericht - Düsseldorf eingegangen sein.  Dies gilt auch dann, wenn der Widerspruch zur Niederschrift der Geschäftsstelle eines anderen Amtsgerichtes abgegeben wurde. Die Frist beginnt mit dem Tage der Bekanntmachung der Löschungsankündigung in dem für die Bekanntmachung der Eintragungen in das Handelsregister bestimmten elektronischen Informations- und Kommunikationssystem nach § 10 des Handelsgesetzbuches. Fällt das Ende der Frist auf einen Sonntag, einen allgemeinen Feiertag oder Sonnabend, so endet die Frist mit Ablauf des nächsten Werktages.\nDer Widerspruch muss die Bezeichnung der angefochtenen Löschungsankündigung sowie die Erklärung enthalten, dass Widerspruch gegen diese Löschungsankündigung eingelegt wird. Er ist zu unterzeichnen und soll begründet werden."
    },
    {
      "date": "2025-12-23",
      "id": "140984",
      "original_text": "Sonstige Registerbekanntmachung\nNordrhein-Westfalen Amtsgericht Lemgo HRB 6319\nStolcomfort GmbH – Lemgo",
      "type": "Sonstige Registerbekanntmachung",
      "state": "Nordrhein-Westfalen",
      "amtsgericht": "Amtsgericht Lemgo",
      "registernummer": "HRB 6319",
      "registerart": "HRB",
      "company_name": "Stolcomfort GmbH",
      "company_seat": "Lemgo",
      "details": "23.12.2025 (Bekanntmachungsdatum)\n\nNordrhein-Westfalen Amtsgericht Lemgo HRB 6319\nSonstige Registerbekanntmachung 22.12.2025 (Eintragungsdatum)\n\nStolcomfort GmbH\nGesellschaft mit beschränkter Haftung\nLemgo\n\nAls nicht eingetragen wird veröffentlicht: Den Gläubigern der Gesellschaft, deren Forderungen begründet worden sind bevor die Eintragung der Beendigung des Gewinnabführungsvertrages  in das Handelsregister nach § 10 des Handelsgesetzbuches als bekanntgemacht gilt, hat der andere Vertragsteil Sicherheit zu leisten, wenn sie sich binnen sechs Monaten nach der Bekanntmachung der Eintragung zu diesem Zweck bei ihm melden."
    },
    {
      "date": "2025-12-23",
      "id": "140985",
      "original_text": "Löschungsankündigung\nNordrhein-Westfalen Amtsgericht Düsseldorf HRB 87450\nMAGtec Technik & Consulting GmbH – Düsseldorf",
      "type": "Löschungsankündigung",
      "state": "Nordrhein-Westfalen",
      "amtsgericht": "Amtsgericht Düsseldorf",
      "registernummer": "HRB 87450",
      "registerart": "HRB",
      "company_name": "MAGtec Technik & Consulting GmbH",
      "company_seat": "Düsseldorf",
      "details": "23.12.2025 (Bekanntmachungsdatum)\n\nNordrhein-Westfalen Amtsgericht Düsseldorf HRB 87450\nLöschungsankündigung\n\nMAGtec Technik & Consulting GmbH\nGesellschaft mit beschränkter Haftung\nDüsseldorf\n\nDas Registergericht beabsichtigt die Gesellschaft von Amts wegen nach § 394 Abs. 1 FamFG zu löschen. Die Frist zur Erhebung eines Widerspruchs ist auf 3 Wochen festgesetzt.\n\nRechtsbehelfsbelehrung:\nDas Widerspruchsrecht steht jedem zu, der an der Unterlassung der Löschung ein berechtigtes Interesse hat. Der Widerspruch ist bei dem Amtsgericht Düsseldorf -Registergericht-, Werdener Straße 1, 40227 Düsseldorf schriftlich in deutscher Sprache oder zur Niederschrift der Geschäftsstelle einzulegen. Der Widerspruch kann auch zur Niederschrift der Geschäftsstelle eines jeden Amtsgerichtes abgegeben werden. Die Einlegung ist auch durch Übertragung eines elektronischen Dokuments an die elektronische Poststelle des Gerichts möglich. Das elektronische Dokument muss für die Bearbeitung durch das Gericht geeignet und mit einer qualifizierten elektronischen Signatur der verantwortenden Person versehen sein oder von der verantwortenden Person signiert und auf einem sicheren Übermittlungsweg gemäß § 130a ZPO nach näherer Maßgabe der Verordnung über die technischen Rahmenbedingungen des elektronischen Rechtsverkehrs und über das besondere elektronische Behördenpostfach (BGBl. I, S.3803) eingereicht werden. Weitere Informationen erhalten Sie auf der Internetseite www.justiz.de.\nDer Widerspruch muss spätestens innerhalb der gesetzten Frist nach dem Datum der Bekanntmachung der Löschungsankündigung bei dem Amtsgericht - Registergericht - Düsseldorf eingegangen sein.  Dies gilt auch dann, wenn der Widerspruch zur Niederschrift der Geschäftsstelle eines anderen Amtsgerichtes abgegeben wurde. Die Frist beginnt mit dem Tage der Bekanntmachung der Löschungsankündigung in dem für die Bekanntmachung der Eintragungen in das Handelsregister bestimmten elektronischen Informations- und Kommunikationssystem nach § 10 des Handelsgesetzbuches. Fällt das Ende der Frist auf einen Sonntag, einen allgemeinen Feiertag oder Sonnabend, so endet die Frist mit Ablauf des nächsten Werktages.\nDer Widerspruch muss die Bezeichnung der angefochtenen Löschungsankündigung sowie die Erklärung enthalten, dass Widerspruch gegen diese Löschungsankündigung eingelegt wird. Er ist zu unterzeichnen und soll begründet werden."
    },
    {
      "date": "2025-12-23",
      "id": "140986",
      "original_text": "Löschungsankündigung\nNordrhein-Westfalen Amtsgericht Siegburg HRB 17103\nVeX GmbH – Troisdorf",
      "type": "Löschungsankündigung",
      "state": "Nordrhein-Westfalen",
      "amtsgericht": "Amtsgericht Siegburg",
      "registernummer": "HRB 17103",
      "registerart": "HRB",
      "company_name": "VeX GmbH",
      "company_seat": "Troisdorf",
      "details": "23.12.2025 (Bekanntmachungsdatum)\n\nNordrhein-Westfalen Amtsgericht Siegburg HRB 17103\nLöschungsankündigung\n\nVeX GmbH\nGesellschaft mit beschränkter Haftung\nTroisdorf\n\nDas Registergericht hat glaubhafte Kenntnis erlangt, dass die Gesellschaft vermögenslos geworden ist, da ein Insolvenzeröffnungsantrag mangels Masse nach § 26 InsO zurückgewiesen wurde.\n\nEs ist daher beabsichtigt, die Gesellschaft nach § 394 FamFG im Handelsregister wegen Vermögenslosigkeit zu löschen.\nEinwände gegen die Löschung sind durch Widerspruch binnen einer Frist von 3 Monaten geltend zu machen, andernfalls die Löschung erfolgen wird.\nEinzulegen ist der Widerspruch bei dem Amtsgericht Siegburg, Neue Poststraße 16, 53721 Siegburg, und zwar entweder schriftlich in deutscher Sprache oder mündlich zur Niederschrift der Geschäftsstelle. Der Widerspruch kann auch zur Niederschrift der Geschäftsstelle eines jeden Amtsgerichts abgegeben werden. Der Widerspruch ist binnen der in der Verfügung bestimmten Frist einzulegen. Die Frist ist nur gewahrt, wenn der Widerspruch rechtzeitig bei dem Amtsgericht Siegburg eingeht, auch wenn der Widerspruch zur Niederschrift der Geschäftsstelle eines anderen Amtsgerichts abgegeben wurde. Die\nFrist beginnt jeweils mit der schriftlichen Bekanntgabe der Verfügung an die Beteiligten. Kann die schriftliche Bekanntgabe an einen Beteiligten nicht bewirkt werden, beginnt die Frist spätestens mit Ablauf von fünf Monaten nach Erlass der Verfügung. Die Bekanntgabe ist entweder durch Zustellung oder am dritten Tage nach Aufgabe zur Post bewirkt. Sofern die Löschung noch nicht erfolgt ist, kann der Widerspruch auch noch nach Ablauf der Frist\neingelegt werden. Fällt das Ende der Frist auf einen Sonnabend, einen Sonntag oder einen allgemeinen Feiertag, endet die Frist mit Ablauf des nächsten Werktages. Der Widerspruch ist zu unterzeichnen. Eine Begründung des Widerspruchs ist nicht vorgeschrieben."
    },
    {
      "date": "2025-12-23",
      "id": "140987",
      "original_text": "Einreichung neuer Dokumente\nNordrhein-Westfalen Amtsgericht Düsseldorf HRB 99481\nWIIT Aktiengesellschaft – Düsseldorf",
      "type": "Einreichung neuer Dokumente",
      "state": "Nordrhein-Westfalen",
      "amtsgericht": "Amtsgericht Düsseldorf",
      "registernummer": "HRB 99481",
      "registerart": "HRB",
      "company_name": "WIIT Aktiengesellschaft",
      "company_seat": "Düsseldorf",
      "details": "23.12.2025 (Bekanntmachungsdatum)\n\nNordrhein-Westfalen Amtsgericht Düsseldorf HRB 99481\nEinreichung neuer Dokumente\n\nWIIT Aktiengesellschaft\nAktiengesellschaft\nDüsseldorf\n\nDem Registergericht ist eine neue Liste der Mitglieder des Aufsichtsrates eingereicht worden."
    },
    {
      "date": "2025-12-23",
      "id": "140988",
      "original_text": "Registerbekanntmachung nach dem Umwandlungsgesetz\nNordrhein-Westfalen Amtsgericht Düsseldorf HRB 84844\nDENSO WAVE EUROPE GmbH – Düsseldorf",
      "type": "Registerbekanntmachung nach dem Umwandlungsgesetz",
      "state": "Nordrhein-Westfalen",
      "amtsgericht": "Amtsgericht Düsseldorf",
      "registernummer": "HRB 84844",
      "registerart": "HRB",
      "company_name": "DENSO WAVE EUROPE GmbH",
      "company_seat": "Düsseldorf",
      "details": "23.12.2025 (Bekanntmachungsdatum)\n\nNordrhein-Westfalen Amtsgericht Düsseldorf HRB 84844\nRegisterbekanntmachung nach dem Umwandlungsgesetz\n\nDENSO WAVE EUROPE GmbH\nGesellschaft mit beschränkter Haftung\nDüsseldorf\n\nDem Register ist ein Entwurf für einen Verschmelzungsplan eingereicht worden. Es werden gemäß § 308 Absatz 1 Satz 2 UmwG folgende Angaben bekannt gemacht:\n\n1. Der zur Durchführung der Verschmelzung aufgestellte Entwurf des\nVerschmelzungsplans ist beim Handelsregister des Amtsgerichts Düsseldorf\neingereicht worden ( 308 Abs. 1 S. 2 Nr. 1 UmwG).\n2. An der Verschmelzung sind beteiligt ( 308 Abs. 1 S. 2 Nr. 2 UmwG):\na) DENSO WAVE EUROPE GmbH, eine Gesellschaft mit beschränkter Haftung\ndeutschen Rechts, mit Sitz in Düsseldorf Deutschland, als übertragende\nGesellschaft; und\nb) DENSO EUROPE B.V., eine Gesellschaft mit beschränkter Haftung (besloten\nvennootschap) nach dem Recht der Niederlande, mit eingetragenem Sitz in Weesp,\nNiederlande, als übernehmende Gesellschaft,\n3. Die an der Verschmelzung beteiligten Gesellschaften sind wie folgt eingetragen\n( 308 Abs. 1 S. 2 Nr. 3 UmwG):\na) DENSO WAVE EUROPE GmbH ist im Handelsregister des Amtsgerichts\nDüsseldorf unter HRB 84844 eingetragen.\nb) DENSO EUROPE B.V. ist im Handelsregister der niederländischen\nHandelskammer (Kamer van Koophandel) unter der Nummer 32050077\neingetragen.\n4. Bei der DENSO WAVE. EUROPE GmbH besteht kein Betriebsrat. Alle\nArbeitsverhältnisse mit Arbeitnehmern der DENSO WAVE EUROPE GmbH\nwurden beendet. Bei der DENSO EUROPE B.V. besteht ein Betriebsrat.\nEin Zustimmungsbeschluss der Anteilsinhaber der DENSO WAVE EUROPE GmbH\nist gemäß § 308 Abs. 2 UmwG in Verbindung mit § 312 Abs. 2, 307 Abs. 3 Nr. 1\nUmwG nicht erforderlich, da sich alle Anteile der Gesellschaft in der Hand der\nDENSO EUROPE B.V. befinden. Die Beurkundung des Verschmelzungsplanes ist\nfür den 16. Februar 2025 geplant.\nVor diesem Hintergrund wurde darum gebeten, einen Hinweis an die Anteilsinhaber\nund die Gläubiger der DENSO WAVE EUROPE GmbH und der DENSO EUROPE\nB.V. und an den Betriebsrat der DENSO EUROPE B.V. bekannt zu machen, dass\nsie der jeweiligen Gesellschaft spätestens fünf Arbeitstage vor dem Tag der\nBeurkundung des Verschmelzungsplans ( 308 Abs. 1 S. 2 Nr. 4, Abs. 2 UmwG)\nBemerkungen zum Verschmelzungsplan (insbesondere an die beim Handelsregister\neingetragene Geschäftsanschrift der DENSO WAVE EUROPE GmbH bzw. an die\nbei der Kamer van Koophandel eingetragene Geschäftsanschrift der DENSO\nEUROPE B.V.) übermitteln können. Der Verschmelzungsplan soll am 16. Februar\n2026 (in keinem Fall aber vor dem Ablauf der Monatsfrist gemäß § 308 Abs. 2\nUmwG beginnend mit der Bekanntmachung des Registergerichts) beurkundet\nwerden."
    },
    {
      "date": "2025-12-23",
      "id": "140989",
      "original_text": "Einreichung neuer Dokumente\nNordrhein-Westfalen Amtsgericht Hagen HRB 1\nHagener Straßenbahn Aktiengesellschaft – Hagen",
      "type": "Einreichung neuer Dokumente",
      "state": "Nordrhein-Westfalen",
      "amtsgericht": "Amtsgericht Hagen",
      "registernummer": "HRB 1",
      "registerart": "HRB",
      "company_name": "Hagener Straßenbahn Aktiengesellschaft",
      "company_seat": "Hagen",
      "details": "23.12.2025 (Bekanntmachungsdatum)\n\nNordrhein-Westfalen Amtsgericht Hagen HRB 1\nEinreichung neuer Dokumente\n\nHagener Straßenbahn Aktiengesellschaft\nAktiengesellschaft\nHagen\n\nDie gesetzlichen Vertreter der Gesellschaft haben eine aktuelle Liste der Aufsichtsratsmitglieder zum Handelsregister eingereicht."
    },
    {
      "date": "2025-12-23",
      "id": "140990",
      "original_text": "Registerbekanntmachung nach dem Umwandlungsgesetz\nNordrhein-Westfalen Amtsgericht Aachen GsR 726\nKMV Immobilien eGbR – Simmerath",
      "type": "Registerbekanntmachung nach dem Umwandlungsgesetz",
      "state": "Nordrhein-Westfalen",
      "amtsgericht": "Amtsgericht Aachen",
      "registernummer": "GsR 726",
      "registerart": "GsR",
      "company_name": "KMV Immobilien eGbR",
      "company_seat": "Simmerath",
      "details": "23.12.2025 (Bekanntmachungsdatum)\n\nNordrhein-Westfalen Amtsgericht Aachen GsR 726\nRegisterbekanntmachung nach dem Umwandlungsgesetz 23.12.2025 (Eintragungsdatum)\n\nKMV Immobilien eGbR\nGesellschaft bürgerlichen Rechts\nSimmerath\n\nDen Gläubigern der an der formwechselnden Umwandlung beteiligten Rechtsträger ist, wenn sie binnen sechs Monaten nach dem Tag, an dem die Eintragung der formwechselnden Umwandlung in das Register des Sitzes desjenigen Rechtsträgers, dessen Gläubiger sie sind, nach § 19 Absatz 3 UmwG als bekanntgemacht gilt, ihren Anspruch nach Grund und Höhe schriftlich anmelden, Sicherheit zu leisten, soweit sie nicht Befriedigung verlangen können. Dieses Recht steht den Gläubigern jedoch nur zu, wenn sie glaubhaft machen, dass durch die formwechselnden Umwandlung die Erfüllung ihrer Forderung gefährdet wird."
    },
    {
      "date": "2025-12-23",
      "id": "140991",
      "original_text": "Löschungsankündigung\nNordrhein-Westfalen Amtsgericht Düsseldorf HRB 62345\nORfinance MT DE GmbH – Düsseldorf",
      "type": "Löschungsankündigung",
      "state": "Nordrhein-Westfalen",
      "amtsgericht": "Amtsgericht Düsseldorf",
      "registernummer": "HRB 62345",
      "registerart": "HRB",
      "company_name": "ORfinance MT DE GmbH",
      "company_seat": "Düsseldorf",
      "details": "23.12.2025 (Bekanntmachungsdatum)\n\nNordrhein-Westfalen Amtsgericht Düsseldorf HRB 62345\nLöschungsankündigung\n\nORfinance MT DE GmbH\nGesellschaft mit beschränkter Haftung\nDüsseldorf\n\nBetr.: ORfinance MT DE GmbH, Kaiserswerther Str. 115, 40880 Ratingen\n\nDas Registergericht beabsichtigt die Gesellschaft von Amts wegen nach § 394 FamFG zu löschen. Die Frist zur Erhebung eines Widerspruchs ist auf 3 Wochen festgesetzt.\n\nRechtsbehelfsbelehrung:\n\nDas Widerspruchsrecht steht jedem zu, der an der Unterlassung der Löschung ein berechtigtes Interesse hat. Der Widerspruch ist bei dem Amtsgericht Düsseldorf -Registergericht-, Werdener Straße 1, 40227 Düsseldorf schriftlich in deutscher Sprache oder zur Niederschrift der Geschäftsstelle einzulegen. Der Widerspruch kann auch zur Niederschrift der Geschäftsstelle eines jeden Amtsgerichtes abgegeben werden. Die Einlegung ist auch durch Übertragung eines elektronischen Dokuments an die elektronische Poststelle des Gerichts möglich. Das elektronische Dokument muss für die Bearbeitung durch das Gericht geeignet und mit einer qualifizierten elektronischen Signatur der verantwortenden Person versehen sein oder von der verantwortenden Person signiert und auf einem sicheren Übermittlungsweg gemäß § 130a ZPO nach näherer Maßgabe der Verordnung über die technischen Rahmenbedingungen des elektronischen Rechtsverkehrs und über das besondere elektronische Behördenpostfach (BGBl. I, S.3803) eingereicht werden. Weitere Informationen erhalten Sie auf der Internetseite www.justiz.de.\nDer Widerspruch muss spätestens innerhalb der gesetzten Frist nach dem Datum der Bekanntmachung der Löschungsankündigung bei dem Amtsgericht - Registergericht - Düsseldorf eingegangen sein.  Dies gilt auch dann, wenn der Widerspruch zur Niederschrift der Geschäftsstelle eines anderen Amtsgerichtes abgegeben wurde. Die Frist beginnt mit dem Tage der Bekanntmachung der Löschungsankündigung in dem für die Bekanntmachung der Eintragungen in das Handelsregister bestimmten elektronischen Informations- und Kommunikationssystem nach § 10 des Handelsgesetzbuches. Fällt das Ende der Frist auf einen Sonntag, einen allgemeinen Feiertag oder Sonnabend, so endet die Frist mit Ablauf des nächsten Werktages.\nDer Widerspruch muss die Bezeichnung der angefochtenen Löschungsankündigung sowie die Erklärung enthalten, dass Widerspruch gegen diese Löschungsankündigung eingelegt wird. Er ist zu unterzeichnen und soll begründet werden."
    },
    {
      "date": "2025-12-23",
      "id": "140992",
      "original_text": "Sonstige Registerbekanntmachung\nHessen Amtsgericht Darmstadt VR 80321\nFörderkreis für behinderte Menschen e.V. - Raunheim – Raunheim",
      "type": "Sonstige Registerbekanntmachung",
      "state": "Hessen",
      "amtsgericht": "Amtsgericht Darmstadt",
      "registernummer": "VR 80321",
      "registerart": "VR",
      "company_name": "Förderkreis für behinderte Menschen e.V. - Raunheim",
      "company_seat": "Raunheim",
      "details": "23.12.2025 (Bekanntmachungsdatum)\n\nHessen Amtsgericht Darmstadt VR 80321\nSonstige Registerbekanntmachung 23.12.2025 (Eintragungsdatum)\n\nFörderkreis für behinderte Menschen e.V. - Raunheim\neingetragener Verein\nRaunheim\n\nDer Verein ist aufgelöst."
    },
    {
      "date": "2025-12-23",
      "id": "140993",
      "original_text": "Löschungsankündigung\nHessen Amtsgericht Darmstadt HRB 32951\nGB Renovierungssystem - Bauwerksabdichtung GmbH - BSS Bierbaum Service System – Groß-Umstadt",
      "type": "Löschungsankündigung",
      "state": "Hessen",
      "amtsgericht": "Amtsgericht Darmstadt",
      "registernummer": "HRB 32951",
      "registerart": "HRB",
      "company_name": "GB Renovierungssystem - Bauwerksabdichtung GmbH - BSS Bierbaum Service System",
      "company_seat": "Groß-Umstadt",
      "details": "23.12.2025 (Bekanntmachungsdatum)\n\nHessen Amtsgericht Darmstadt HRB 32951\nLöschungsankündigung\n\nGB Renovierungssystem - Bauwerksabdichtung GmbH - BSS Bierbaum Service System\nGesellschaft mit beschränkter Haftung\nGroß-Umstadt\n\nDas Registergericht beabsichtigt die im Handelsregister eingetragene Gesellschaft von Amts wegen nach § 394 FamFG zu löschen. Die Frist zur Erhebung eines Widerspruchs gegen die beabsichtigte Löschung wird auf 3 Monate festgesetzt."
    }
  ]
}