{
  "date": "2024-09-28",
  "date_of_scrape": "2024-11-22",
  "tool_version": "0.1.0",
  "announcements": [
    {
      "date": "2024-09-28",
      "original_text": "Löschungsankündigung\nBayern Amtsgericht Nürnberg HRB 31611\nALBA OPUS GMBH – Nürnberg",
      "type": "Löschungsankündigung",
      "state": "Bayern",
      "amtsgericht": "Amtsgericht Nürnberg",
      "registernummer": "HRB 31611",
      "registerart": "HRB",
      "company_name": "ALBA OPUS GMBH",
      "company_seat": "Nürnberg",
      "details": "28.09.2024 (Bekanntmachungsdatum)\n\nBayern Amtsgericht Nürnberg HRB 31611\nLöschungsankündigung\n\nALBA OPUS GMBH\nGesellschaft mit beschränkter Haftung\nNürnberg\n\nDas Registergericht beabsichtigt, die im Handelsregister eingetragene Gesellschaft wegen Vermögenslosigkeit von Amts wegen nach § 394 FamFG zu löschen. Die Frist zur Erhebung eines Widerspruchs ist auf einen Monat festgesetzt."
    },
    {
      "date": "2024-09-28",
      "original_text": "Löschungsankündigung\nBayern Amtsgericht München HRB 242651\nAMS Reisevermittlungs GmbH – München",
      "type": "Löschungsankündigung",
      "state": "Bayern",
      "amtsgericht": "Amtsgericht München",
      "registernummer": "HRB 242651",
      "registerart": "HRB",
      "company_name": "AMS Reisevermittlungs GmbH",
      "company_seat": "München",
      "details": "28.09.2024 (Bekanntmachungsdatum)\n\nBayern Amtsgericht München HRB 242651\nLöschungsankündigung 27.09.2024 (Eintragungsdatum)\n\nAMS Reisevermittlungs GmbH\nGesellschaft mit beschränkter Haftung\nMünchen\n\nDas Registergericht beabsichtigt, die im Handelsregister eingetragene Gesellschaft von Amts wegen nach § 395 FamFG zu löschen. Die Frist zur Erhebung eines Widerspruchs ist auf drei Monate festgesetzt."
    },
    {
      "date": "2024-09-28",
      "original_text": "Registerbekanntmachung nach dem Umwandlungsgesetz\nBayern Amtsgericht Coburg HRB 4340\nAVC GmbH Assekuranz- und Vorsorgemakler Coburg – Coburg",
      "type": "Registerbekanntmachung nach dem Umwandlungsgesetz",
      "state": "Bayern",
      "amtsgericht": "Amtsgericht Coburg",
      "registernummer": "HRB 4340",
      "registerart": "HRB",
      "company_name": "AVC GmbH Assekuranz- und Vorsorgemakler Coburg",
      "company_seat": "Coburg",
      "details": "28.09.2024 (Bekanntmachungsdatum)\n\nBayern Amtsgericht Coburg HRB 4340\nRegisterbekanntmachung nach dem Umwandlungsgesetz 16.09.2024 (Eintragungsdatum)\n\nAVC GmbH Assekuranz- und Vorsorgemakler Coburg\nGesellschaft mit beschränkter Haftung\nCoburg\n\nDen Gläubigern der an der Verschmelzung beteiligten Rechtsträger ist, wenn sie binnen sechs Monaten nach dem Tag, an dem die Eintragung der Verschmelzung in das Register des Sitzes desjenigen Rechtsträgers, dessen Gläubiger sie sind, nach § 19 Abs. 3 UmwG als bekannt gemacht gilt, ihren Anspruch nach Grund und Höhe schriftlich anmelden, Sicherheit zu leisten, soweit sie nicht Befriedigung verlangen können. Dieses Recht steht den Gläubigern jedoch nur zu, wenn sie glaubhaft machen, dass durch die Verschmelzung die Erfüllung ihrer Forderung gefährdet wird."
    },
    {
      "date": "2024-09-28",
      "original_text": "Registerbekanntmachung nach dem Umwandlungsgesetz\nBayern Amtsgericht Traunstein HRA 14521\nAgentur Kröll - DIE WIRTSCHAFTSEXPERTEN GmbH & Co. KG – Feldkirchen-Westerham",
      "type": "Registerbekanntmachung nach dem Umwandlungsgesetz",
      "state": "Bayern",
      "amtsgericht": "Amtsgericht Traunstein",
      "registernummer": "HRA 14521",
      "registerart": "HRA",
      "company_name": "Agentur Kröll - DIE WIRTSCHAFTSEXPERTEN GmbH & Co. KG",
      "company_seat": "Feldkirchen-Westerham",
      "details": "28.09.2024 (Bekanntmachungsdatum)\n\nBayern Amtsgericht Traunstein HRA 14521\nRegisterbekanntmachung nach dem Umwandlungsgesetz 27.09.2024 (Eintragungsdatum)\n\nAgentur Kröll - DIE WIRTSCHAFTSEXPERTEN GmbH & Co. KG\nKommanditgesellschaft\nFeldkirchen-Westerham\n\nDen Gläubigern der an der Ausgliederung beteiligten Rechtsträger ist, wenn sie binnen sechs Monaten nach dem Tag, an dem die Eintragung der Ausgliederung in das Register des Sitzes desjenigen Rechtsträgers, dessen Gläubiger sie sind, nach §§ 125, 19 Abs. 3 UmwG als bekannt gemacht gilt, ihren Anspruch nach Grund und Höhe schriftlich anmelden, Sicherheit zu leisten, soweit sie nicht Befriedigung verlangen können. Dieses Recht steht den Gläubigern jedoch nur zu, wenn sie glaubhaft machen, dass durch die Ausgliederung die Erfüllung ihrer Forderung gefährdet wird."
    },
    {
      "date": "2024-09-28",
      "original_text": "Registerbekanntmachung nach dem Umwandlungsgesetz\nBayern Amtsgericht München VR 60805\nArbeiterwohlfahrt Kreisverband Miesbach-Tegernsee e.V. – Hausham",
      "type": "Registerbekanntmachung nach dem Umwandlungsgesetz",
      "state": "Bayern",
      "amtsgericht": "Amtsgericht München",
      "registernummer": "VR 60805",
      "registerart": "VR",
      "company_name": "Arbeiterwohlfahrt Kreisverband Miesbach-Tegernsee e.V.",
      "company_seat": "Hausham",
      "details": "28.09.2024 (Bekanntmachungsdatum)\n\nBayern Amtsgericht München VR 60805\nRegisterbekanntmachung nach dem Umwandlungsgesetz 27.09.2024 (Eintragungsdatum)\n\nArbeiterwohlfahrt Kreisverband Miesbach-Tegernsee e.V.\neingetragener Verein\nHausham\n\nDen Gläubigern der an der Verschmelzung beteiligten Rechtsträger ist, wenn sie binnen sechs Monaten nach dem Tag, an dem die Eintragung der Verschmelzung in das Register des Sitzes desjenigen Rechtsträgers, dessen Gläubiger sie sind, nach § 19 Abs. 3 UmwG als bekannt gemacht gilt, ihren Anspruch nach Grund und Höhe schriftlich anmelden, Sicherheit zu leisten, soweit sie nicht Befriedigung verlangen können. Dieses Recht steht den Gläubigern jedoch nur zu, wenn sie glaubhaft machen, dass durch die Verschmelzung die Erfüllung ihrer Forderung gefährdet wird."
    },
    {
      "date": "2024-09-28",
      "original_text": "Registerbekanntmachung nach dem Umwandlungsgesetz\nBayern Amtsgericht Bamberg HRB 11778\nBadum Garten- & Landschaftsbau GmbH – Bamberg",
      "type": "Registerbekanntmachung nach dem Umwandlungsgesetz",
      "state": "Bayern",
      "amtsgericht": "Amtsgericht Bamberg",
      "registernummer": "HRB 11778",
      "registerart": "HRB",
      "company_name": "Badum Garten- & Landschaftsbau GmbH",
      "company_seat": "Bamberg",
      "details": "28.09.2024 (Bekanntmachungsdatum)\n\nBayern Amtsgericht Bamberg HRB 11778\nRegisterbekanntmachung nach dem Umwandlungsgesetz 27.09.2024 (Eintragungsdatum)\n\nBadum Garten- & Landschaftsbau GmbH\nGesellschaft mit beschränkter Haftung\nBamberg\n\nDen Gläubigern der an der Ausgliederung beteiligten Rechtsträger ist, wenn sie binnen sechs Monaten nach dem Tag, an dem die Eintragung der Ausgliederung in das Register des Sitzes desjenigen Rechtsträgers, dessen Gläubiger sie sind, nach §§ 125, 19 Abs. 3 UmwG als bekannt gemacht gilt, ihren Anspruch nach Grund und Höhe schriftlich anmelden, Sicherheit zu leisten, soweit sie nicht Befriedigung verlangen können. Dieses Recht steht den Gläubigern jedoch nur zu, wenn sie glaubhaft machen, dass durch die Ausgliederung die Erfüllung ihrer Forderung gefährdet wird."
    },
    {
      "date": "2024-09-28",
      "original_text": "Registerbekanntmachung nach dem Umwandlungsgesetz\nBayern Amtsgericht Bamberg HRA 13253\nBadum Garten- & Landschaftsbau Inh. Nikolaus Badum e.K. – Bamberg",
      "type": "Registerbekanntmachung nach dem Umwandlungsgesetz",
      "state": "Bayern",
      "amtsgericht": "Amtsgericht Bamberg",
      "registernummer": "HRA 13253",
      "registerart": "HRA",
      "company_name": "Badum Garten- & Landschaftsbau Inh. Nikolaus Badum e.K.",
      "company_seat": "Bamberg",
      "details": "28.09.2024 (Bekanntmachungsdatum)\n\nBayern Amtsgericht Bamberg HRA 13253\nRegisterbekanntmachung nach dem Umwandlungsgesetz 27.09.2024 (Eintragungsdatum)\n\nBadum Garten- & Landschaftsbau Inh. Nikolaus Badum e.K.\nEinzelkaufmann / Einzelkauffrau\nBamberg\n\nDen Gläubigern der an der Ausgliederung beteiligten Rechtsträger ist, wenn sie binnen sechs Monaten nach dem Tag, an dem die Eintragung der Ausgliederung in das Register des Sitzes desjenigen Rechtsträgers, dessen Gläubiger sie sind, nach §§ 125, 19 Abs. 3 UmwG als bekannt gemacht gilt, ihren Anspruch nach Grund und Höhe schriftlich anmelden, Sicherheit zu leisten, soweit sie nicht Befriedigung verlangen können. Dieses Recht steht den Gläubigern jedoch nur zu, wenn sie glaubhaft machen, dass durch die Ausgliederung die Erfüllung ihrer Forderung gefährdet wird."
    },
    {
      "date": "2024-09-28",
      "original_text": "Registerbekanntmachung nach dem Umwandlungsgesetz\nNordrhein-Westfalen Amtsgericht Gelsenkirchen HRB 18089\nBlumen Jörgens Dienstleistungs GmbH – Bottrop",
      "type": "Registerbekanntmachung nach dem Umwandlungsgesetz",
      "state": "Nordrhein-Westfalen",
      "amtsgericht": "Amtsgericht Gelsenkirchen",
      "registernummer": "HRB 18089",
      "registerart": "HRB",
      "company_name": "Blumen Jörgens Dienstleistungs GmbH",
      "company_seat": "Bottrop",
      "details": "28.09.2024 (Bekanntmachungsdatum)\n\nNordrhein-Westfalen Amtsgericht Gelsenkirchen HRB 18089\nRegisterbekanntmachung nach dem Umwandlungsgesetz 28.09.2024 (Eintragungsdatum)\n\nBlumen Jörgens Dienstleistungs GmbH\nGesellschaft mit beschränkter Haftung\nBottrop\n\nDen Gläubigern der an der Verschmelzung beteiligten Rechtsträger ist, wenn sie binnen sechs Monaten nach dem Tag, an dem die Eintragung der Verschmelzung in das Register des Sitzes desjenigen Rechtsträgers, dessen Gläubiger sie sind, nach § 19 Absatz 3 UmwG als bekanntgemacht gilt, ihren Anspruch nach Grund und Höhe schriftlich anmelden, Sicherheit zu leisten, soweit sie nicht Befriedigung verlangen können. Dieses Recht steht den Gläubigern jedoch nur zu, wenn sie glaubhaft machen, dass durch die Verschmelzung die Erfüllung ihrer Forderung gefährdet wird."
    },
    {
      "date": "2024-09-28",
      "original_text": "Registerbekanntmachung nach dem Umwandlungsgesetz\nBayern Amtsgericht Traunstein HRA 10576\nDie Wirtschaftsexperten e.K. – Oberaudorf",
      "type": "Registerbekanntmachung nach dem Umwandlungsgesetz",
      "state": "Bayern",
      "amtsgericht": "Amtsgericht Traunstein",
      "registernummer": "HRA 10576",
      "registerart": "HRA",
      "company_name": "Die Wirtschaftsexperten e.K.",
      "company_seat": "Oberaudorf",
      "details": "28.09.2024 (Bekanntmachungsdatum)\n\nBayern Amtsgericht Traunstein HRA 10576\nRegisterbekanntmachung nach dem Umwandlungsgesetz 27.09.2024 (Eintragungsdatum)\n\nDie Wirtschaftsexperten e.K.\nEinzelkaufmann / Einzelkauffrau\nOberaudorf\n\nDen Gläubigern der an der Ausgliederung beteiligten Rechtsträger ist, wenn sie binnen sechs Monaten nach dem Tag, an dem die Eintragung der Ausgliederung in das Register des Sitzes desjenigen Rechtsträgers, dessen Gläubiger sie sind, nach §§ 125, 19 Abs. 3 UmwG als bekannt gemacht gilt, ihren Anspruch nach Grund und Höhe schriftlich anmelden, Sicherheit zu leisten, soweit sie nicht Befriedigung verlangen können. Dieses Recht steht den Gläubigern jedoch nur zu, wenn sie glaubhaft machen, dass durch die Ausgliederung die Erfüllung ihrer Forderung gefährdet wird."
    },
    {
      "date": "2024-09-28",
      "original_text": "Löschungsankündigung\nBayern Amtsgericht Nürnberg HRB 7912\nEntner GmbH Bäckerei und Konditorei – Wendelstein",
      "type": "Löschungsankündigung",
      "state": "Bayern",
      "amtsgericht": "Amtsgericht Nürnberg",
      "registernummer": "HRB 7912",
      "registerart": "HRB",
      "company_name": "Entner GmbH Bäckerei und Konditorei",
      "company_seat": "Wendelstein",
      "details": "28.09.2024 (Bekanntmachungsdatum)\n\nBayern Amtsgericht Nürnberg HRB 7912\nLöschungsankündigung\n\nEntner GmbH Bäckerei und Konditorei\nGesellschaft mit beschränkter Haftung\nWendelstein\n\nDas Registergericht beabsichtigt, die im Handelsregister eingetragene Gesellschaft wegen Vermögenslosigkeit von Amts wegen nach § 394 FamFG zu löschen. Die Frist zur Erhebung eines Widerspruchs ist auf einen Monat festgesetzt."
    },
    {
      "date": "2024-09-28",
      "original_text": "Registerbekanntmachung nach dem Umwandlungsgesetz\nNordrhein-Westfalen Amtsgericht Gelsenkirchen HRB 5086\nGerd Ostrowitzki GmbH – Bottrop",
      "type": "Registerbekanntmachung nach dem Umwandlungsgesetz",
      "state": "Nordrhein-Westfalen",
      "amtsgericht": "Amtsgericht Gelsenkirchen",
      "registernummer": "HRB 5086",
      "registerart": "HRB",
      "company_name": "Gerd Ostrowitzki GmbH",
      "company_seat": "Bottrop",
      "details": "28.09.2024 (Bekanntmachungsdatum)\n\nNordrhein-Westfalen Amtsgericht Gelsenkirchen HRB 5086\nRegisterbekanntmachung nach dem Umwandlungsgesetz 28.09.2024 (Eintragungsdatum)\n\nGerd Ostrowitzki GmbH\nGesellschaft mit beschränkter Haftung\nBottrop\n\nDen Gläubigern der an der Verschmelzung beteiligten Rechtsträger ist, wenn sie binnen sechs Monaten nach dem Tag, an dem die Eintragung der Verschmelzung in das Register des Sitzes desjenigen Rechtsträgers, dessen Gläubiger sie sind, nach § 19 Absatz 3 UmwG als bekanntgemacht gilt, ihren Anspruch nach Grund und Höhe schriftlich anmelden, Sicherheit zu leisten, soweit sie nicht Befriedigung verlangen können. Dieses Recht steht den Gläubigern jedoch nur zu, wenn sie glaubhaft machen, dass durch die Verschmelzung die Erfüllung ihrer Forderung gefährdet wird."
    },
    {
      "date": "2024-09-28",
      "original_text": "Registerbekanntmachung nach dem Umwandlungsgesetz\nBayern Amtsgericht Amberg HRB 7272\nHahn Softwareentwicklung GmbH – Maxhütte-Haidhof",
      "type": "Registerbekanntmachung nach dem Umwandlungsgesetz",
      "state": "Bayern",
      "amtsgericht": "Amtsgericht Amberg",
      "registernummer": "HRB 7272",
      "registerart": "HRB",
      "company_name": "Hahn Softwareentwicklung GmbH",
      "company_seat": "Maxhütte-Haidhof",
      "details": "28.09.2024 (Bekanntmachungsdatum)\n\nBayern Amtsgericht Amberg HRB 7272\nRegisterbekanntmachung nach dem Umwandlungsgesetz 27.09.2024 (Eintragungsdatum)\n\nHahn Softwareentwicklung GmbH\nGesellschaft mit beschränkter Haftung\nMaxhütte-Haidhof\n\nDen Gläubigern der an der Verschmelzung beteiligten Rechtsträger ist, wenn sie binnen sechs Monaten nach dem Tag, an dem die Eintragung der Verschmelzung in das Register des Sitzes desjenigen Rechtsträgers, dessen Gläubiger sie sind, nach § 19 Abs. 3 UmwG als bekannt gemacht gilt, ihren Anspruch nach Grund und Höhe schriftlich anmelden, Sicherheit zu leisten, soweit sie nicht Befriedigung verlangen können. Dieses Recht steht den Gläubigern jedoch nur zu, wenn sie glaubhaft machen, dass durch die Verschmelzung die Erfüllung ihrer Forderung gefährdet wird."
    },
    {
      "date": "2024-09-28",
      "original_text": "Registerbekanntmachung nach dem Umwandlungsgesetz\nBayern Amtsgericht Augsburg HRA 18559\nHaug Bürsten KG – Königsbrunn",
      "type": "Registerbekanntmachung nach dem Umwandlungsgesetz",
      "state": "Bayern",
      "amtsgericht": "Amtsgericht Augsburg",
      "registernummer": "HRA 18559",
      "registerart": "HRA",
      "company_name": "Haug Bürsten KG",
      "company_seat": "Königsbrunn",
      "details": "28.09.2024 (Bekanntmachungsdatum)\n\nBayern Amtsgericht Augsburg HRA 18559\nRegisterbekanntmachung nach dem Umwandlungsgesetz 27.09.2024 (Eintragungsdatum)\n\nHaug Bürsten KG\nKommanditgesellschaft\nKönigsbrunn\n\nDen Gläubigern der an der Verschmelzung beteiligten Rechtsträger ist, wenn sie binnen sechs Monaten nach dem Tag, an dem die Eintragung der Verschmelzung in das Register des Sitzes desjenigen Rechtsträgers, dessen Gläubiger sie sind, nach § 19 Abs. 3 UmwG als bekannt gemacht gilt, ihren Anspruch nach Grund und Höhe schriftlich anmelden, Sicherheit zu leisten, soweit sie nicht Befriedigung verlangen können. Dieses Recht steht den Gläubigern jedoch nur zu, wenn sie glaubhaft machen, dass durch die Verschmelzung die Erfüllung ihrer Forderung gefährdet wird."
    },
    {
      "date": "2024-09-28",
      "original_text": "Registerbekanntmachung nach dem Umwandlungsgesetz\nBayern Amtsgericht Augsburg HRB 29782\nHaug Bürsten Verwaltungs UG (haftungsbeschränkt) – Königsbrunn",
      "type": "Registerbekanntmachung nach dem Umwandlungsgesetz",
      "state": "Bayern",
      "amtsgericht": "Amtsgericht Augsburg",
      "registernummer": "HRB 29782",
      "registerart": "HRB",
      "company_name": "Haug Bürsten Verwaltungs UG (haftungsbeschränkt)",
      "company_seat": "Königsbrunn",
      "details": "28.09.2024 (Bekanntmachungsdatum)\n\nBayern Amtsgericht Augsburg HRB 29782\nRegisterbekanntmachung nach dem Umwandlungsgesetz 27.09.2024 (Eintragungsdatum)\n\nHaug Bürsten Verwaltungs UG (haftungsbeschränkt)\nGesellschaft mit beschränkter Haftung\nKönigsbrunn\n\nDen Gläubigern der an der Verschmelzung beteiligten Rechtsträger ist, wenn sie binnen sechs Monaten nach dem Tag, an dem die Eintragung der Verschmelzung in das Register des Sitzes desjenigen Rechtsträgers, dessen Gläubiger sie sind, nach § 19 Abs. 3 UmwG als bekannt gemacht gilt, ihren Anspruch nach Grund und Höhe schriftlich anmelden, Sicherheit zu leisten, soweit sie nicht Befriedigung verlangen können. Dieses Recht steht den Gläubigern jedoch nur zu, wenn sie glaubhaft machen, dass durch die Verschmelzung die Erfüllung ihrer Forderung gefährdet wird."
    },
    {
      "date": "2024-09-28",
      "original_text": "Löschungsankündigung\nBayern Amtsgericht Landshut HRB 4996\nISOFLOCK Landau Gesellschaft für elektrostatische Beflockung mbH – Landau",
      "type": "Löschungsankündigung",
      "state": "Bayern",
      "amtsgericht": "Amtsgericht Landshut",
      "registernummer": "HRB 4996",
      "registerart": "HRB",
      "company_name": "ISOFLOCK Landau Gesellschaft für elektrostatische Beflockung mbH",
      "company_seat": "Landau",
      "details": "28.09.2024 (Bekanntmachungsdatum)\n\nBayern Amtsgericht Landshut HRB 4996\nLöschungsankündigung\n\nISOFLOCK  Landau Gesellschaft für elektrostatische Beflockung mbH\nGesellschaft mit beschränkter Haftung\nLandau\n\nDas Registergericht beabsichtigt, die im Handelsregister eingetragene Gesellschaft wegen Vermögenslosigkeit von Amts wegen nach § 394 FamFG zu löschen. Die Frist zur Erhebung eines Widerspruchs ist auf einen Monat festgesetzt."
    },
    {
      "date": "2024-09-28",
      "original_text": "Registerbekanntmachung nach dem Umwandlungsgesetz\nBayern Amtsgericht Bamberg HRB 8992\nMedienkraft Verstärker GmbH – Bamberg",
      "type": "Registerbekanntmachung nach dem Umwandlungsgesetz",
      "state": "Bayern",
      "amtsgericht": "Amtsgericht Bamberg",
      "registernummer": "HRB 8992",
      "registerart": "HRB",
      "company_name": "Medienkraft Verstärker GmbH",
      "company_seat": "Bamberg",
      "details": "28.09.2024 (Bekanntmachungsdatum)\n\nBayern Amtsgericht Bamberg HRB 8992\nRegisterbekanntmachung nach dem Umwandlungsgesetz 27.09.2024 (Eintragungsdatum)\n\nMedienkraft Verstärker GmbH\nGesellschaft mit beschränkter Haftung\nBamberg\n\nDen Gläubigern der an der Verschmelzung beteiligten Rechtsträger ist, wenn sie binnen sechs Monaten nach dem Tag, an dem die Eintragung der Verschmelzung in das Register des Sitzes desjenigen Rechtsträgers, dessen Gläubiger sie sind, nach § 19 Abs. 3 UmwG als bekannt gemacht gilt, ihren Anspruch nach Grund und Höhe schriftlich anmelden, Sicherheit zu leisten, soweit sie nicht Befriedigung verlangen können. Dieses Recht steht den Gläubigern jedoch nur zu, wenn sie glaubhaft machen, dass durch die Verschmelzung die Erfüllung ihrer Forderung gefährdet wird."
    },
    {
      "date": "2024-09-28",
      "original_text": "Registerbekanntmachung nach dem Umwandlungsgesetz\nBayern Amtsgericht München HRB 289088\nPNZ B24 Beteiligungs UG (haftungsbeschränkt) – München",
      "type": "Registerbekanntmachung nach dem Umwandlungsgesetz",
      "state": "Bayern",
      "amtsgericht": "Amtsgericht München",
      "registernummer": "HRB 289088",
      "registerart": "HRB",
      "company_name": "PNZ B24 Beteiligungs UG (haftungsbeschränkt)",
      "company_seat": "München",
      "details": "28.09.2024 (Bekanntmachungsdatum)\n\nBayern Amtsgericht München HRB 289088\nRegisterbekanntmachung nach dem Umwandlungsgesetz 27.09.2024 (Eintragungsdatum)\n\nPNZ B24 Beteiligungs UG (haftungsbeschränkt)\nGesellschaft mit beschränkter Haftung\nMünchen\n\nDen Gläubigern der an der Verschmelzung beteiligten Rechtsträger ist, wenn sie binnen sechs Monaten nach dem Tag, an dem die Eintragung der Verschmelzung in das Register des Sitzes desjenigen Rechtsträgers, dessen Gläubiger sie sind, nach § 19 Abs. 3 UmwG als bekannt gemacht gilt, ihren Anspruch nach Grund und Höhe schriftlich anmelden, Sicherheit zu leisten, soweit sie nicht Befriedigung verlangen können. Dieses Recht steht den Gläubigern jedoch nur zu, wenn sie glaubhaft machen, dass durch die Verschmelzung die Erfüllung ihrer Forderung gefährdet wird."
    },
    {
      "date": "2024-09-28",
      "original_text": "Registerbekanntmachung nach dem Umwandlungsgesetz\nBrandenburg Amtsgericht Potsdam HRB 28207\nPSI Prognos Energy GmbH – Potsdam",
      "type": "Registerbekanntmachung nach dem Umwandlungsgesetz",
      "state": "Brandenburg",
      "amtsgericht": "Amtsgericht Potsdam",
      "registernummer": "HRB 28207",
      "registerart": "HRB",
      "company_name": "PSI Prognos Energy GmbH",
      "company_seat": "Potsdam",
      "details": "28.09.2024 (Bekanntmachungsdatum)\n\nBrandenburg Amtsgericht Potsdam HRB 28207\nRegisterbekanntmachung nach dem Umwandlungsgesetz 20.09.2024 (Eintragungsdatum)\n\nPSI Prognos Energy GmbH\nGesellschaft mit beschränkter Haftung\nPotsdam\n\nZu Eintragungsnummer 4 vom 20.09.2024 wird als nicht eingetragen veröffentlicht:\nDen Gläubigern der an der Verschmelzung beteiligten Rechtsträger ist, wenn sie binnen sechs Monaten nach dem Tag, an dem die Eintragung der Verschmelzung in das Register des Sitzes desjenigen Rechtsträgers, dessen Gläubiger sie sind, als bekannt gemacht gilt, ihren Anspruch nach Grund und Höhe schriftlich anmelden, Sicherheit zu leisten, soweit sie nicht Befriedigung verlangen können. Dieses Recht steht den Gläubigern jedoch nur zu, wenn sie glaubhaft machen, dass durch die Verschmelzung die Erfüllung ihrer Forderung gefährdet wird."
    },
    {
      "date": "2024-09-28",
      "original_text": "Löschungsankündigung\nBayern Amtsgericht Augsburg HRB 20839\nReTec GmbH – Thierhaupten",
      "type": "Löschungsankündigung",
      "state": "Bayern",
      "amtsgericht": "Amtsgericht Augsburg",
      "registernummer": "HRB 20839",
      "registerart": "HRB",
      "company_name": "ReTec GmbH",
      "company_seat": "Thierhaupten",
      "details": "28.09.2024 (Bekanntmachungsdatum)\n\nBayern Amtsgericht Augsburg HRB 20839\nLöschungsankündigung\n\nReTec GmbH\nGesellschaft mit beschränkter Haftung\nThierhaupten\n\nDas Registergericht beabsichtigt, die im Handelsregister eingetragene Gesellschaft wegen Vermögenslosigkeit von Amts wegen nach § 394 FamFG zu löschen. Die Frist zur Erhebung eines Widerspruchs ist auf einen Monat festgesetzt."
    },
    {
      "date": "2024-09-28",
      "original_text": "Registerbekanntmachung nach dem Umwandlungsgesetz\nBayern Amtsgericht Augsburg HRA 14712\nRottmair KG – Augsburg",
      "type": "Registerbekanntmachung nach dem Umwandlungsgesetz",
      "state": "Bayern",
      "amtsgericht": "Amtsgericht Augsburg",
      "registernummer": "HRA 14712",
      "registerart": "HRA",
      "company_name": "Rottmair KG",
      "company_seat": "Augsburg",
      "details": "28.09.2024 (Bekanntmachungsdatum)\n\nBayern Amtsgericht Augsburg HRA 14712\nRegisterbekanntmachung nach dem Umwandlungsgesetz 27.09.2024 (Eintragungsdatum)\n\nRottmair KG\nKommanditgesellschaft\nAugsburg\n\nDen Gläubigern der an der Verschmelzung beteiligten Rechtsträger ist, wenn sie binnen sechs Monaten nach dem Tag, an dem die Eintragung der Verschmelzung in das Register des Sitzes desjenigen Rechtsträgers, dessen Gläubiger sie sind, nach § 19 Abs. 3 UmwG als bekannt gemacht gilt, ihren Anspruch nach Grund und Höhe schriftlich anmelden, Sicherheit zu leisten, soweit sie nicht Befriedigung verlangen können. Dieses Recht steht den Gläubigern jedoch nur zu, wenn sie glaubhaft machen, dass durch die Verschmelzung die Erfüllung ihrer Forderung gefährdet wird."
    },
    {
      "date": "2024-09-28",
      "original_text": "Registerbekanntmachung nach dem Umwandlungsgesetz\nBayern Amtsgericht Augsburg HRB 20157\nRottmair Verwaltungs GmbH – Augsburg",
      "type": "Registerbekanntmachung nach dem Umwandlungsgesetz",
      "state": "Bayern",
      "amtsgericht": "Amtsgericht Augsburg",
      "registernummer": "HRB 20157",
      "registerart": "HRB",
      "company_name": "Rottmair Verwaltungs GmbH",
      "company_seat": "Augsburg",
      "details": "28.09.2024 (Bekanntmachungsdatum)\n\nBayern Amtsgericht Augsburg HRB 20157\nRegisterbekanntmachung nach dem Umwandlungsgesetz 27.09.2024 (Eintragungsdatum)\n\nRottmair Verwaltungs GmbH\nGesellschaft mit beschränkter Haftung\nAugsburg\n\nDen Gläubigern der an der Verschmelzung beteiligten Rechtsträger ist, wenn sie binnen sechs Monaten nach dem Tag, an dem die Eintragung der Verschmelzung in das Register des Sitzes desjenigen Rechtsträgers, dessen Gläubiger sie sind, nach § 19 Abs. 3 UmwG als bekannt gemacht gilt, ihren Anspruch nach Grund und Höhe schriftlich anmelden, Sicherheit zu leisten, soweit sie nicht Befriedigung verlangen können. Dieses Recht steht den Gläubigern jedoch nur zu, wenn sie glaubhaft machen, dass durch die Verschmelzung die Erfüllung ihrer Forderung gefährdet wird."
    },
    {
      "date": "2024-09-28",
      "original_text": "Registerbekanntmachung nach dem Umwandlungsgesetz\nBayern Amtsgericht München HRB 196436\nS & R Industrie Assekuranzmakler GmbH – München",
      "type": "Registerbekanntmachung nach dem Umwandlungsgesetz",
      "state": "Bayern",
      "amtsgericht": "Amtsgericht München",
      "registernummer": "HRB 196436",
      "registerart": "HRB",
      "company_name": "S & R Industrie Assekuranzmakler GmbH",
      "company_seat": "München",
      "details": "28.09.2024 (Bekanntmachungsdatum)\n\nBayern Amtsgericht München HRB 196436\nRegisterbekanntmachung nach dem Umwandlungsgesetz 27.09.2024 (Eintragungsdatum)\n\nS & R Industrie Assekuranzmakler GmbH\nGesellschaft mit beschränkter Haftung\nMünchen\n\nDen Gläubigern der an der Verschmelzung beteiligten Rechtsträger ist, wenn sie binnen sechs Monaten nach dem Tag, an dem die Eintragung der Verschmelzung in das Register des Sitzes desjenigen Rechtsträgers, dessen Gläubiger sie sind, nach § 19 Abs. 3 UmwG als bekannt gemacht gilt, ihren Anspruch nach Grund und Höhe schriftlich anmelden, Sicherheit zu leisten, soweit sie nicht Befriedigung verlangen können. Dieses Recht steht den Gläubigern jedoch nur zu, wenn sie glaubhaft machen, dass durch die Verschmelzung die Erfüllung ihrer Forderung gefährdet wird."
    },
    {
      "date": "2024-09-28",
      "original_text": "Sonstige Registerbekanntmachung\nBayern Amtsgericht Augsburg HRB 2054\nSMC InformationsTechnologien Aktiengesellschaft – Gersthofen",
      "type": "Sonstige Registerbekanntmachung",
      "state": "Bayern",
      "amtsgericht": "Amtsgericht Augsburg",
      "registernummer": "HRB 2054",
      "registerart": "HRB",
      "company_name": "SMC InformationsTechnologien Aktiengesellschaft",
      "company_seat": "Gersthofen",
      "details": "28.09.2024 (Bekanntmachungsdatum)\n\nBayern Amtsgericht Augsburg HRB 2054\nSonstige Registerbekanntmachung 27.09.2024 (Eintragungsdatum)\n\nSMC InformationsTechnologien Aktiengesellschaft\nAktiengesellschaft\nGersthofen\n\nDen Gläubigern der Gesellschaft, deren Forderungen begründet worden sind, bevor die Eintragung der Beendigung des Teilgewinnabführungsvertrages in das Handelsregister nach § 10 des Handelsgesetzbuches als bekanntgemacht gilt, hat der andere Vertragsteil Sicherheit zu leisten, wenn sie sich binnen sechs Monaten nach der Bekanntmachung der Eintragung zu diesem Zweck bei ihm melden."
    },
    {
      "date": "2024-09-28",
      "original_text": "Registerbekanntmachung nach dem Umwandlungsgesetz\nBayern Amtsgericht München HRB 187004\nSaki Europe GmbH – München",
      "type": "Registerbekanntmachung nach dem Umwandlungsgesetz",
      "state": "Bayern",
      "amtsgericht": "Amtsgericht München",
      "registernummer": "HRB 187004",
      "registerart": "HRB",
      "company_name": "Saki Europe GmbH",
      "company_seat": "München",
      "details": "28.09.2024 (Bekanntmachungsdatum)\n\nBayern Amtsgericht München HRB 187004\nRegisterbekanntmachung nach dem Umwandlungsgesetz\n\nSaki Europe GmbH\nGesellschaft mit beschränkter Haftung\nMünchen\n\nEs wird darauf hingewiesen, dass ein Formwechselplan oder sein Entwurf über einen grenzüberschreitenden Formwechsel in die Saki Europe s.r.o.  mit Sitz in Orech, Tschechische Republik, einer Gesellschaft mit beschränkter Haftung nach dem Recht der Tschechischen Republik (spolecnost s rucenim omezenym, s. r. o),  beim Handelsregister eingereicht worden ist.\nDie Anteilsinhaber, die Gläubiger sowie die zuständigen Betriebsräte der an dem grenzüberschreitenden Formwechsel beteiligten Gesellschaft oder, soweit es keinen Betriebsrat gibt, die Arbeitnehmer der an dem grenzüberschreitenden Formwechsel beteiligten Gesellschaft, können der Gesellschaft spätestens fünf Arbeitstage vor dem Tag der Gesellschafterversammlung Bemerkungen zum Formwechselplan übermitteln."
    },
    {
      "date": "2024-09-28",
      "original_text": "Registerbekanntmachung nach dem Umwandlungsgesetz\nBayern Amtsgericht Coburg HRB 3236\nSchreppel GmbH – Lichtenfels",
      "type": "Registerbekanntmachung nach dem Umwandlungsgesetz",
      "state": "Bayern",
      "amtsgericht": "Amtsgericht Coburg",
      "registernummer": "HRB 3236",
      "registerart": "HRB",
      "company_name": "Schreppel GmbH",
      "company_seat": "Lichtenfels",
      "details": "28.09.2024 (Bekanntmachungsdatum)\n\nBayern Amtsgericht Coburg HRB 3236\nRegisterbekanntmachung nach dem Umwandlungsgesetz 16.09.2024 (Eintragungsdatum)\n\nSchreppel GmbH\nGesellschaft mit beschränkter Haftung\nLichtenfels\n\nDen Gläubigern der an der Verschmelzung beteiligten Rechtsträger ist, wenn sie binnen sechs Monaten nach dem Tag, an dem die Eintragung der Verschmelzung in das Register des Sitzes desjenigen Rechtsträgers, dessen Gläubiger sie sind, nach § 19 Abs. 3 UmwG als bekannt gemacht gilt, ihren Anspruch nach Grund und Höhe schriftlich anmelden, Sicherheit zu leisten, soweit sie nicht Befriedigung verlangen können. Dieses Recht steht den Gläubigern jedoch nur zu, wenn sie glaubhaft machen, dass durch die Verschmelzung die Erfüllung ihrer Forderung gefährdet wird."
    },
    {
      "date": "2024-09-28",
      "original_text": "Registerbekanntmachung nach dem Umwandlungsgesetz\nBayern Amtsgericht München HRA 119844\nSchöne Haus Projekt LLC & Co. KG – München",
      "type": "Registerbekanntmachung nach dem Umwandlungsgesetz",
      "state": "Bayern",
      "amtsgericht": "Amtsgericht München",
      "registernummer": "HRA 119844",
      "registerart": "HRA",
      "company_name": "Schöne Haus Projekt LLC & Co. KG",
      "company_seat": "München",
      "details": "28.09.2024 (Bekanntmachungsdatum)\n\nBayern Amtsgericht München HRA 119844\nRegisterbekanntmachung nach dem Umwandlungsgesetz 27.09.2024 (Eintragungsdatum)\n\nSchöne Haus Projekt LLC & Co. KG\nKommanditgesellschaft\nMünchen\n\nDen Gläubigern der an der Verschmelzung beteiligten Rechtsträger ist, wenn sie binnen sechs Monaten nach dem Tag, an dem die Eintragung der Verschmelzung in das Register des Sitzes desjenigen Rechtsträgers, dessen Gläubiger sie sind, nach § 19 Abs. 3 UmwG als bekannt gemacht gilt, ihren Anspruch nach Grund und Höhe schriftlich anmelden, Sicherheit zu leisten, soweit sie nicht Befriedigung verlangen können. Dieses Recht steht den Gläubigern jedoch nur zu, wenn sie glaubhaft machen, dass durch die Verschmelzung die Erfüllung ihrer Forderung gefährdet wird."
    },
    {
      "date": "2024-09-28",
      "original_text": "Löschungsankündigung\nBayern Amtsgericht München HRB 250350\nTravel Lions GmbH – München",
      "type": "Löschungsankündigung",
      "state": "Bayern",
      "amtsgericht": "Amtsgericht München",
      "registernummer": "HRB 250350",
      "registerart": "HRB",
      "company_name": "Travel Lions GmbH",
      "company_seat": "München",
      "details": "28.09.2024 (Bekanntmachungsdatum)\n\nBayern Amtsgericht München HRB 250350\nLöschungsankündigung 27.09.2024 (Eintragungsdatum)\n\nTravel Lions GmbH\nGesellschaft mit beschränkter Haftung\nMünchen\n\nDas Registergericht beabsichtigt, die im Handelsregister eingetragene Gesellschaft wegen Vermögenslosigkeit von Amts wegen nach § 394 FamFG zu löschen. Die Frist zur Erhebung eines Widerspruchs ist auf drei Monate festgesetzt."
    },
    {
      "date": "2024-09-28",
      "original_text": "Registerbekanntmachung nach dem Umwandlungsgesetz\nNordrhein-Westfalen Amtsgericht Siegburg HRB 10249\nWS Beratung und Beteiligungen GmbH – Troisdorf",
      "type": "Registerbekanntmachung nach dem Umwandlungsgesetz",
      "state": "Nordrhein-Westfalen",
      "amtsgericht": "Amtsgericht Siegburg",
      "registernummer": "HRB 10249",
      "registerart": "HRB",
      "company_name": "WS Beratung und Beteiligungen GmbH",
      "company_seat": "Troisdorf",
      "details": "28.09.2024 (Bekanntmachungsdatum)\n\nNordrhein-Westfalen Amtsgericht Siegburg HRB 10249\nRegisterbekanntmachung nach dem Umwandlungsgesetz 28.09.2024 (Eintragungsdatum)\n\nWS Beratung und Beteiligungen GmbH\nGesellschaft mit beschränkter Haftung\nTroisdorf\n\nDen Gläubigern der an der Verschmelzung beteiligten Rechtsträger ist, wenn sie binnen sechs Monaten nach dem Tag, an dem die Eintragung der Verschmelzung in das Register des Sitzes desjenigen Rechtsträgers, dessen Gläubiger sie sind, nach § 19 Absatz 3 UmwG als bekanntgemacht gilt, ihren Anspruch nach Grund und Höhe schriftlich anmelden, Sicherheit zu leisten, soweit sie nicht Befriedigung verlangen können. Dieses Recht steht den Gläubigern jedoch nur zu, wenn sie glaubhaft machen, dass durch die Verschmelzung die Erfüllung ihrer Forderung gefährdet wird."
    },
    {
      "date": "2024-09-28",
      "original_text": "Registerbekanntmachung nach dem Umwandlungsgesetz\nBayern Amtsgericht München HRB 277313\nZAR PG XXXIV GmbH – München",
      "type": "Registerbekanntmachung nach dem Umwandlungsgesetz",
      "state": "Bayern",
      "amtsgericht": "Amtsgericht München",
      "registernummer": "HRB 277313",
      "registerart": "HRB",
      "company_name": "ZAR PG XXXIV GmbH",
      "company_seat": "München",
      "details": "28.09.2024 (Bekanntmachungsdatum)\n\nBayern Amtsgericht München HRB 277313\nRegisterbekanntmachung nach dem Umwandlungsgesetz 27.09.2024 (Eintragungsdatum)\n\nZAR PG XXXIV GmbH\nGesellschaft mit beschränkter Haftung\nMünchen\n\nDen Gläubigern der an der Verschmelzung beteiligten Rechtsträger ist, wenn sie binnen sechs Monaten nach dem Tag, an dem die Eintragung der Verschmelzung in das Register des Sitzes desjenigen Rechtsträgers, dessen Gläubiger sie sind, nach § 19 Abs. 3 UmwG als bekannt gemacht gilt, ihren Anspruch nach Grund und Höhe schriftlich anmelden, Sicherheit zu leisten, soweit sie nicht Befriedigung verlangen können. Dieses Recht steht den Gläubigern jedoch nur zu, wenn sie glaubhaft machen, dass durch die Verschmelzung die Erfüllung ihrer Forderung gefährdet wird."
    },
    {
      "date": "2024-09-28",
      "original_text": "Registerbekanntmachung nach dem Umwandlungsgesetz\nBayern Amtsgericht Bamberg HRA 11055\nmgo Lokale Medien GmbH & Co. KG – Bamberg",
      "type": "Registerbekanntmachung nach dem Umwandlungsgesetz",
      "state": "Bayern",
      "amtsgericht": "Amtsgericht Bamberg",
      "registernummer": "HRA 11055",
      "registerart": "HRA",
      "company_name": "mgo Lokale Medien GmbH & Co. KG",
      "company_seat": "Bamberg",
      "details": "28.09.2024 (Bekanntmachungsdatum)\n\nBayern Amtsgericht Bamberg HRA 11055\nRegisterbekanntmachung nach dem Umwandlungsgesetz 27.09.2024 (Eintragungsdatum)\n\nmgo Lokale Medien GmbH & Co. KG\nKommanditgesellschaft\nBamberg\n\nDen Gläubigern der an der Verschmelzung beteiligten Rechtsträger ist, wenn sie binnen sechs Monaten nach dem Tag, an dem die Eintragung der Verschmelzung in das Register des Sitzes desjenigen Rechtsträgers, dessen Gläubiger sie sind, nach § 19 Abs. 3 UmwG als bekannt gemacht gilt, ihren Anspruch nach Grund und Höhe schriftlich anmelden, Sicherheit zu leisten, soweit sie nicht Befriedigung verlangen können. Dieses Recht steht den Gläubigern jedoch nur zu, wenn sie glaubhaft machen, dass durch die Verschmelzung die Erfüllung ihrer Forderung gefährdet wird."
    }
  ]
}