{
  "date": "2024-09-27",
  "date_of_scrape": "2024-11-22",
  "tool_version": "0.1.0",
  "announcements": [
    {
      "date": "2024-09-27",
      "original_text": "Registerbekanntmachung nach dem Umwandlungsgesetz\nNordrhein-Westfalen Amtsgericht Mönchengladbach HRB 9471\n2 plus Projekt 22 GmbH – Mönchengladbach",
      "type": "Registerbekanntmachung nach dem Umwandlungsgesetz",
      "state": "Nordrhein-Westfalen",
      "amtsgericht": "Amtsgericht Mönchengladbach",
      "registernummer": "HRB 9471",
      "registerart": "HRB",
      "company_name": "2 plus Projekt 22 GmbH",
      "company_seat": "Mönchengladbach",
      "details": "27.09.2024 (Bekanntmachungsdatum)\n\nNordrhein-Westfalen Amtsgericht Mönchengladbach HRB 9471\nRegisterbekanntmachung nach dem Umwandlungsgesetz 27.09.2024 (Eintragungsdatum)\n\n2 plus Projekt 22 GmbH\nGesellschaft mit beschränkter Haftung\nMönchengladbach\n\nDen Gläubigern der an der formwechselnden Umwandlung beteiligten Rechtsträger ist, wenn sie binnen sechs Monaten nach dem Tag, an dem die Eintragung der formwechselnden Umwandlung in das Register des Sitzes desjenigen Rechtsträgers, dessen Gläubiger sie sind, nach § 19 Absatz 3 UmwG als bekanntgemacht gilt, ihren Anspruch nach Grund und Höhe schriftlich anmelden, Sicherheit zu leisten, soweit sie nicht Befriedigung verlangen können. Dieses Recht steht den Gläubigern jedoch nur zu, wenn sie glaubhaft machen, dass durch die formwechselnden Umwandlung die Erfüllung ihrer Forderung gefährdet wird."
    },
    {
      "date": "2024-09-27",
      "original_text": "Registerbekanntmachung nach dem Umwandlungsgesetz\nNordrhein-Westfalen Amtsgericht Mönchengladbach HRA 10098\n2 plus Projekt 22 GmbH & Co. KG – Mönchengladbach",
      "type": "Registerbekanntmachung nach dem Umwandlungsgesetz",
      "state": "Nordrhein-Westfalen",
      "amtsgericht": "Amtsgericht Mönchengladbach",
      "registernummer": "HRA 10098",
      "registerart": "HRA",
      "company_name": "2 plus Projekt 22 GmbH & Co. KG",
      "company_seat": "Mönchengladbach",
      "details": "27.09.2024 (Bekanntmachungsdatum)\n\nNordrhein-Westfalen Amtsgericht Mönchengladbach HRA 10098\nRegisterbekanntmachung nach dem Umwandlungsgesetz 27.09.2024 (Eintragungsdatum)\n\n2 plus Projekt 22 GmbH & Co. KG\nKommanditgesellschaft\nMönchengladbach\n\nDen Gläubigern der an der formwechselnden Umwandlung beteiligten Rechtsträger ist, wenn sie binnen sechs Monaten nach dem Tag, an dem die Eintragung der formwechselnden Umwandlung in das Register des Sitzes desjenigen Rechtsträgers, dessen Gläubiger sie sind, nach § 19 Absatz 3 UmwG als bekanntgemacht gilt, ihren Anspruch nach Grund und Höhe schriftlich anmelden, Sicherheit zu leisten, soweit sie nicht Befriedigung verlangen können. Dieses Recht steht den Gläubigern jedoch nur zu, wenn sie glaubhaft machen, dass durch die formwechselnden Umwandlung die Erfüllung ihrer Forderung gefährdet wird."
    },
    {
      "date": "2024-09-27",
      "original_text": "Löschungsankündigung\nRheinland-Pfalz Amtsgericht Wittlich HRA 41680\nA Eins Kabelleitungsbau und Tiefbau GmbH & Co. KG – Wittlich",
      "type": "Löschungsankündigung",
      "state": "Rheinland-Pfalz",
      "amtsgericht": "Amtsgericht Wittlich",
      "registernummer": "HRA 41680",
      "registerart": "HRA",
      "company_name": "A Eins Kabelleitungsbau und Tiefbau GmbH & Co. KG",
      "company_seat": "Wittlich",
      "details": "27.09.2024 (Bekanntmachungsdatum)\n\nRheinland-Pfalz Amtsgericht Wittlich HRA 41680\nLöschungsankündigung\n\nA Eins Kabelleitungsbau und Tiefbau GmbH & Co. KG\nKommanditgesellschaft\nWittlich\n\nDas Registergericht beabsichtigt die Firma von Amts wegen nach § 394 FamFG zu löschen. Die Frist zur Erhebung eines Widerspruchs ist auf einen Monat festgesetzt."
    },
    {
      "date": "2024-09-27",
      "original_text": "Löschungsankündigung\nBayern Amtsgericht Nürnberg HRB 12204\nABC UNIX RENT GmbH – Nürnberg",
      "type": "Löschungsankündigung",
      "state": "Bayern",
      "amtsgericht": "Amtsgericht Nürnberg",
      "registernummer": "HRB 12204",
      "registerart": "HRB",
      "company_name": "ABC UNIX RENT GmbH",
      "company_seat": "Nürnberg",
      "details": "27.09.2024 (Bekanntmachungsdatum)\n\nBayern Amtsgericht Nürnberg HRB 12204\nLöschungsankündigung\n\nABC UNIX RENT GmbH\nGesellschaft mit beschränkter Haftung\nNürnberg\n\nDas Registergericht beabsichtigt, die im Handelsregister eingetragene Gesellschaft von Amts wegen nach § 395 FamFG zu löschen. Die Frist zur Erhebung eines Widerspruchs ist auf einen Monat festgesetzt."
    },
    {
      "date": "2024-09-27",
      "original_text": "Löschungsankündigung\nRheinland-Pfalz Amtsgericht Bad Kreuznach HRB 20152\nAHG Rhein-Hunsrück GmbH – Simmern",
      "type": "Löschungsankündigung",
      "state": "Rheinland-Pfalz",
      "amtsgericht": "Amtsgericht Bad Kreuznach",
      "registernummer": "HRB 20152",
      "registerart": "HRB",
      "company_name": "AHG Rhein-Hunsrück GmbH",
      "company_seat": "Simmern",
      "details": "27.09.2024 (Bekanntmachungsdatum)\n\nRheinland-Pfalz Amtsgericht Bad Kreuznach HRB 20152\nLöschungsankündigung\n\nAHG Rhein-Hunsrück GmbH\nGesellschaft mit beschränkter Haftung\nSimmern\n\nDas Registergericht beabsichtigt die Gesellschaft wegen Vermögenslosigkeit im Handelsregister von Amts wegen nach § 394 FamFG zu löschen. Die Frist zur Erhebung eines Widerspruchs gegen die beabsichtigte Löschung ist auf einen Monat ab Veröffentlichung bestimmt."
    },
    {
      "date": "2024-09-27",
      "original_text": "Registerbekanntmachung nach dem Umwandlungsgesetz\nSchleswig-Holstein Amtsgericht Lübeck HRB 22516\nAJE Beteiligungsgesellschaft mbH – Ratzeburg",
      "type": "Registerbekanntmachung nach dem Umwandlungsgesetz",
      "state": "Schleswig-Holstein",
      "amtsgericht": "Amtsgericht Lübeck",
      "registernummer": "HRB 22516",
      "registerart": "HRB",
      "company_name": "AJE Beteiligungsgesellschaft mbH",
      "company_seat": "Ratzeburg",
      "details": "27.09.2024 (Bekanntmachungsdatum)\n\nSchleswig-Holstein Amtsgericht Lübeck HRB 22516\nRegisterbekanntmachung nach dem Umwandlungsgesetz 27.09.2024 (Eintragungsdatum)\n\nAJE Beteiligungsgesellschaft mbH\nGesellschaft mit beschränkter Haftung\nRatzeburg\n\nZu Eintragungsnummer 2 vom 27.09.2024 wird als nicht eingetragen veröffentlicht:\nDen Gläubigern der an der Verschmelzung beteiligten Rechtsträger ist, wenn sie binnen sechs Monaten nach dem Tag, an dem die Eintragung der Verschmelzung in das Register des Sitzes desjenigen Rechtsträgers, dessen Gläubiger sie sind, als bekannt gemacht gilt, ihren Anspruch nach Grund und Höhe schriftlich anmelden, Sicherheit zu leisten, soweit sie nicht Befriedigung verlangen können. Dieses Recht steht den Gläubigern jedoch nur zu, wenn sie glaubhaft machen, dass durch die Verschmelzung die Erfüllung ihrer Forderung gefährdet wird."
    },
    {
      "date": "2024-09-27",
      "original_text": "Registerbekanntmachung nach dem Umwandlungsgesetz\nBayern Amtsgericht Bamberg HRB 11775\nALEVPA GmbH – Buttenheim",
      "type": "Registerbekanntmachung nach dem Umwandlungsgesetz",
      "state": "Bayern",
      "amtsgericht": "Amtsgericht Bamberg",
      "registernummer": "HRB 11775",
      "registerart": "HRB",
      "company_name": "ALEVPA GmbH",
      "company_seat": "Buttenheim",
      "details": "27.09.2024 (Bekanntmachungsdatum)\n\nBayern Amtsgericht Bamberg HRB 11775\nRegisterbekanntmachung nach dem Umwandlungsgesetz 26.09.2024 (Eintragungsdatum)\n\nALEVPA GmbH\nGesellschaft mit beschränkter Haftung\nButtenheim\n\nDen Gläubigern der an der Ausgliederung beteiligten Rechtsträger ist, wenn sie binnen sechs Monaten nach dem Tag, an dem die Eintragung der Ausgliederung in das Register des Sitzes desjenigen Rechtsträgers, dessen Gläubiger sie sind, nach §§ 125, 19 Abs. 3 UmwG als bekannt gemacht gilt, ihren Anspruch nach Grund und Höhe schriftlich anmelden, Sicherheit zu leisten, soweit sie nicht Befriedigung verlangen können. Dieses Recht steht den Gläubigern jedoch nur zu, wenn sie glaubhaft machen, dass durch die Ausgliederung die Erfüllung ihrer Forderung gefährdet wird."
    },
    {
      "date": "2024-09-27",
      "original_text": "Registerbekanntmachung nach dem Umwandlungsgesetz\nSchleswig-Holstein Amtsgericht Lübeck HRA 11276\nAVIA - Tankstelle Christian Fabian e.K. – Ratzeburg",
      "type": "Registerbekanntmachung nach dem Umwandlungsgesetz",
      "state": "Schleswig-Holstein",
      "amtsgericht": "Amtsgericht Lübeck",
      "registernummer": "HRA 11276",
      "registerart": "HRA",
      "company_name": "AVIA - Tankstelle Christian Fabian e.K.",
      "company_seat": "Ratzeburg",
      "details": "27.09.2024 (Bekanntmachungsdatum)\n\nSchleswig-Holstein Amtsgericht Lübeck HRA 11276\nRegisterbekanntmachung nach dem Umwandlungsgesetz 26.09.2024 (Eintragungsdatum)\n\nAVIA - Tankstelle Christian Fabian  e.K.\nEinzelkaufmann / Einzelkauffrau\nRatzeburg\n\nZu Eintragungsnummer 2 vom 26.09.2024 wird als nicht eingetragen veröffentlicht: Den Gläubigern der an der Ausgliederung beteiligten Rechtsträger ist, wenn sie binnen sechs Monaten nach dem Tag, an dem die Eintragung der Ausgliederung in das Register des Sitzes desjenigen Rechtsträgers, dessen Gläubiger sie sind, als bekannt gemacht gilt, ihren Anspruch nach Grund und Höhe schriftlich anmelden, Sicherheit zu leisten, soweit sie nicht Befriedigung verlangen können. Dieses Recht steht den Gläubigern jedoch nur zu, wenn sie glaubhaft machen, dass durch die Ausgliederung die Erfüllung ihrer Forderung gefährdet wird."
    },
    {
      "date": "2024-09-27",
      "original_text": "Einreichung neuer Dokumente\nBayern Amtsgericht München HRB 122852\nAVIAREPS AG – München",
      "type": "Einreichung neuer Dokumente",
      "state": "Bayern",
      "amtsgericht": "Amtsgericht München",
      "registernummer": "HRB 122852",
      "registerart": "HRB",
      "company_name": "AVIAREPS AG",
      "company_seat": "München",
      "details": "27.09.2024 (Bekanntmachungsdatum)\n\nBayern Amtsgericht München HRB 122852\nEinreichung neuer Dokumente 26.09.2024 (Eintragungsdatum)\n\nAVIAREPS AG\nAktiengesellschaft\nMünchen\n\nDem Amtsgericht München -Registergericht- ist eine Liste der Mitglieder des Aufsichtsrats eingereicht worden, § 106 AktG."
    },
    {
      "date": "2024-09-27",
      "original_text": "Registerbekanntmachung nach dem Umwandlungsgesetz\nRheinland-Pfalz Amtsgericht Kaiserslautern HRA 11431\nAgrimedia GmbH Gartenbaubedarf & Co.KG – Eisenberg",
      "type": "Registerbekanntmachung nach dem Umwandlungsgesetz",
      "state": "Rheinland-Pfalz",
      "amtsgericht": "Amtsgericht Kaiserslautern",
      "registernummer": "HRA 11431",
      "registerart": "HRA",
      "company_name": "Agrimedia GmbH Gartenbaubedarf & Co.KG",
      "company_seat": "Eisenberg",
      "details": "27.09.2024 (Bekanntmachungsdatum)\n\nRheinland-Pfalz Amtsgericht Kaiserslautern HRA 11431\nRegisterbekanntmachung nach dem Umwandlungsgesetz 27.09.2024 (Eintragungsdatum)\n\nAgrimedia GmbH Gartenbaubedarf & Co.KG\nKommanditgesellschaft\nEisenberg\n\nAls nicht eingetragen wird veröffentlicht: Den Gläubigern der an der Verschmelzung beteiligten Rechtsträger ist, wenn sie binnen sechs Monaten nach dem Tag, an dem die Eintragung der Verschmelzung in das Register des Sitzes desjenigen Rechtsträgers,dessen Gläubiger sie sind, nach § 19 Abs. 3 UmwG als bekannt gemacht gilt, ihren Anspruch nach Grund und Höhe schriftlich anmelden, Sicherheit zu leisten, soweit sie nicht Befriedigung verlangen können. Dieses Recht steht den Gläubigern jedoch nur zu, wenn sie glaubhaft machen, dass durch die Verschmelzung die Erfüllung der Forderung gefährdet wird."
    },
    {
      "date": "2024-09-27",
      "original_text": "Registerbekanntmachung nach dem Umwandlungsgesetz\nBremen Amtsgericht Bremen VR 4098\nAirbus Sportgemeinschaft Bremen e.V. – Bremen",
      "type": "Registerbekanntmachung nach dem Umwandlungsgesetz",
      "state": "Bremen",
      "amtsgericht": "Amtsgericht Bremen",
      "registernummer": "VR 4098",
      "registerart": "VR",
      "company_name": "Airbus Sportgemeinschaft Bremen e.V.",
      "company_seat": "Bremen",
      "details": "27.09.2024 (Bekanntmachungsdatum)\n\nBremen Amtsgericht Bremen VR 4098\nRegisterbekanntmachung nach dem Umwandlungsgesetz 25.09.2024 (Eintragungsdatum)\n\nAirbus Sportgemeinschaft Bremen e.V.\neingetragener Verein\nBremen\n\nZu Eintragungsnummer 8 vom 25.09.2024 wird als nicht eingetragen veröffentlicht:\nDen Gläubigern der an der Verschmelzung beteiligten Rechtsträger ist, wenn sie binnen sechs Monaten nach dem Tag, an dem die Eintragung der Verschmelzung in das Register des Sitzes desjenigen Rechtsträgers, dessen Gläubiger sie sind, als bekannt gemacht gilt, ihren Anspruch nach Grund und Höhe schriftlich anmelden, Sicherheit zu leisten, soweit sie nicht Befriedigung verlangen können. Dieses Recht steht den Gläubigern jedoch nur zu, wenn sie glaubhaft machen, dass durch die Verschmelzung die Erfüllung ihrer Forderung gefährdet wird. Das Recht, Sicherheitsleistung zu verlangen, steht Gläubigern nicht zu, die im Falle der Insolvenz ein Recht auf vorzugsweise Befriedigung aus einer Deckungsmasse haben, die nach gesetzlicher Vorschrift zu ihrem Schutz errichtet und staatlich überwacht ist."
    },
    {
      "date": "2024-09-27",
      "original_text": "Sonstige Registerbekanntmachung\nBerlin Amtsgericht Berlin (Charlottenburg) HRB 65321\nAltis Baubetreuung GmbH – Berlin",
      "type": "Sonstige Registerbekanntmachung",
      "state": "Berlin",
      "amtsgericht": "Amtsgericht Berlin (Charlottenburg)",
      "registernummer": "HRB 65321",
      "registerart": "HRB",
      "company_name": "Altis Baubetreuung GmbH",
      "company_seat": "Berlin",
      "details": "27.09.2024 (Bekanntmachungsdatum)\n\nBerlin Amtsgericht Berlin (Charlottenburg) HRB 65321\nSonstige Registerbekanntmachung\n\nAltis Baubetreuung GmbH\nGesellschaft mit beschränkter Haftung\nBerlin\n\nAls nicht eingetragen wird veröffentlicht:\n\nIn dem unternehmensrechtlichen Verfahren der Altis Baubetreuung GmbH, HRB 65321 B\n\nliegt dem Registergericht aktuell ein Antrag vom 22.08.2024 des Rechtsanwalts Christoph Schrall, Kanzlei Scheidle & Partner, Grottenau 6, 86150 Augsburg, mit folgendem Inhalt vor:\n\n,[...] beantragen wir hiermit:\n\nFrau Rechtsanwältin Nina Haverkamp,\nKaiser-Wilhelm-Ring 34,\n50672 Köln (AHS Rechtsanwälte)\n\nzur Nachtragsliquidatorin der wegen Vermögenlosigkeit aus dem Handelsregister gelöschten Altis Baubetreuung GmbH, HRB 65321 B, zu bestellen, wobei der Wirkungskreis beschränkt ist auf die Abgabe einer Löschungsbewilligung für die Altis Baubetreuung GmbH, aus dem Grundbuch der Einheit \"K19\" (Blatt 4338) des Wohnungseigentums Kleeanger 2,4, 10a (FlNr. 444/30) des Buchungsbezirks Stadtbergen (7283) des zuständigen Grundbuchamtes Augsburg.\n\nDas Registergericht beabsichtigt zum jetzigen Zeitpunkt, diesem Antrag stattzugeben, soweit nicht binnen einer Frist von einem Monat ab Veröffentlichung Widerspruch erhoben wird.\nEin Widerspruch ist entsprechend schriftlich oder elektronisch bei dem Amtsgericht Charlottenburg, DG Hardenbergstraße 31, 10623 Berlin, zum o.g. Aktenzeichen einzureichen. Der Widerspruch ist zu begründen, da eine Berücksichtigung im Verfahren andernfalls nicht erfolgen kann."
    },
    {
      "date": "2024-09-27",
      "original_text": "Registerbekanntmachung nach dem Umwandlungsgesetz\nBayern Amtsgericht Bamberg HRA 13266\nAlwin Engert Besitzunternehmen e.K. – Buttenheim",
      "type": "Registerbekanntmachung nach dem Umwandlungsgesetz",
      "state": "Bayern",
      "amtsgericht": "Amtsgericht Bamberg",
      "registernummer": "HRA 13266",
      "registerart": "HRA",
      "company_name": "Alwin Engert Besitzunternehmen e.K.",
      "company_seat": "Buttenheim",
      "details": "27.09.2024 (Bekanntmachungsdatum)\n\nBayern Amtsgericht Bamberg HRA 13266\nRegisterbekanntmachung nach dem Umwandlungsgesetz 26.09.2024 (Eintragungsdatum)\n\nAlwin Engert Besitzunternehmen e.K.\nEinzelkaufmann / Einzelkauffrau\nButtenheim\n\nDen Gläubigern der an der Ausgliederung beteiligten Rechtsträger ist, wenn sie binnen sechs Monaten nach dem Tag, an dem die Eintragung der Ausgliederung in das Register des Sitzes desjenigen Rechtsträgers, dessen Gläubiger sie sind, nach §§ 125, 19 Abs. 3 UmwG als bekannt gemacht gilt, ihren Anspruch nach Grund und Höhe schriftlich anmelden, Sicherheit zu leisten, soweit sie nicht Befriedigung verlangen können. Dieses Recht steht den Gläubigern jedoch nur zu, wenn sie glaubhaft machen, dass durch die Ausgliederung die Erfüllung ihrer Forderung gefährdet wird."
    },
    {
      "date": "2024-09-27",
      "original_text": "Registerbekanntmachung nach dem Umwandlungsgesetz\nNiedersachsen Amtsgericht Hannover HRB 213030\nArbeit und Leben Niedersachsen gGmbH – Hannover",
      "type": "Registerbekanntmachung nach dem Umwandlungsgesetz",
      "state": "Niedersachsen",
      "amtsgericht": "Amtsgericht Hannover",
      "registernummer": "HRB 213030",
      "registerart": "HRB",
      "company_name": "Arbeit und Leben Niedersachsen gGmbH",
      "company_seat": "Hannover",
      "details": "27.09.2024 (Bekanntmachungsdatum)\n\nNiedersachsen Amtsgericht Hannover HRB 213030\nRegisterbekanntmachung nach dem Umwandlungsgesetz 27.09.2024 (Eintragungsdatum)\n\nArbeit und Leben Niedersachsen gGmbH\nGesellschaft mit beschränkter Haftung\nHannover\n\nDen Gläubigern der an der Verschmelzung beteiligten Rechtsträger ist, wenn sie binnen sechs Monaten nach dem Tag, an dem die Eintragung der Verschmelzung in das Register des Sitzes desjenigen Rechtsträgers, dessen Gläubiger sie sind, nach § 19  Abs.  3 UmwG als bekannt gemacht gilt, ihren Anspruch nach Grund und Höhe schriftlich anmelden, Sicherheit zu leisten, soweit sie nicht Befriedigung verlangen können. Dieses Recht steht den Gläubigern jedoch nur zu, wenn sie glaubhaft machen, dass durch die Verschmelzung die Erfüllung der Forderung gefährdet wird."
    },
    {
      "date": "2024-09-27",
      "original_text": "Löschungsankündigung\nBremen Amtsgericht Bremen HRB 38817\nArchon Gastro UG (haftungsbeschränkt) – Bremen",
      "type": "Löschungsankündigung",
      "state": "Bremen",
      "amtsgericht": "Amtsgericht Bremen",
      "registernummer": "HRB 38817",
      "registerart": "HRB",
      "company_name": "Archon Gastro UG (haftungsbeschränkt)",
      "company_seat": "Bremen",
      "details": "27.09.2024 (Bekanntmachungsdatum)\n\nBremen Amtsgericht Bremen HRB 38817\nLöschungsankündigung\n\nArchon Gastro UG (haftungsbeschränkt)\nGesellschaft mit beschränkter Haftung\nBremen\n\nEs ist beabsichtigt die im Handelsregister eingetragene Gesellschaft von Amts wegen gemäß § 394 FamFG zu löschen. Gegen die Löschung kann beim AG Bremen schriftlich oder zu Protokoll der Geschäftsstelle Widerspruch eingelegt werden. Widerspruchsfrist 4 Wochen."
    },
    {
      "date": "2024-09-27",
      "original_text": "Registerbekanntmachung nach dem Umwandlungsgesetz\nBayern Amtsgericht München HRA 119993\nAssistenz Service Franzmann e.K. – München",
      "type": "Registerbekanntmachung nach dem Umwandlungsgesetz",
      "state": "Bayern",
      "amtsgericht": "Amtsgericht München",
      "registernummer": "HRA 119993",
      "registerart": "HRA",
      "company_name": "Assistenz Service Franzmann e.K.",
      "company_seat": "München",
      "details": "27.09.2024 (Bekanntmachungsdatum)\n\nBayern Amtsgericht München HRA 119993\nRegisterbekanntmachung nach dem Umwandlungsgesetz 26.09.2024 (Eintragungsdatum)\n\nAssistenz Service Franzmann e.K.\nEinzelkaufmann / Einzelkauffrau\nMünchen\n\nDen Gläubigern der an der Verschmelzung beteiligten Rechtsträger ist, wenn sie binnen sechs Monaten nach dem Tag, an dem die Eintragung der Verschmelzung in das Register des Sitzes desjenigen Rechtsträgers, dessen Gläubiger sie sind, nach § 19 Abs. 3 UmwG als bekannt gemacht gilt, ihren Anspruch nach Grund und Höhe schriftlich anmelden, Sicherheit zu leisten, soweit sie nicht Befriedigung verlangen können. Dieses Recht steht den Gläubigern jedoch nur zu, wenn sie glaubhaft machen, dass durch die Verschmelzung die Erfüllung ihrer Forderung gefährdet wird."
    },
    {
      "date": "2024-09-27",
      "original_text": "Löschungsankündigung\nBerlin Amtsgericht Berlin (Charlottenburg) HRB 162728\nAurelia Callas Media Berlin GmbH – Berlin",
      "type": "Löschungsankündigung",
      "state": "Berlin",
      "amtsgericht": "Amtsgericht Berlin (Charlottenburg)",
      "registernummer": "HRB 162728",
      "registerart": "HRB",
      "company_name": "Aurelia Callas Media Berlin GmbH",
      "company_seat": "Berlin",
      "details": "27.09.2024 (Bekanntmachungsdatum)\n\nBerlin Amtsgericht Berlin (Charlottenburg) HRB 162728\nLöschungsankündigung\n\nAurelia Callas Media Berlin GmbH\nGesellschaft mit beschränkter Haftung\nBerlin\n\nBei der nachstehenden Gesellschaft wird das Amtslöschungsverfahren gemäß § 394 FamFG eingeleitet. Widerspruchsfrist 6 Wochen"
    },
    {
      "date": "2024-09-27",
      "original_text": "Registerbekanntmachung nach dem Umwandlungsgesetz\nBaden-Württemberg Amtsgericht Mannheim HRB 420891\nAutohaus Hahn am Ring GmbH – Hockenheim",
      "type": "Registerbekanntmachung nach dem Umwandlungsgesetz",
      "state": "Baden-Württemberg",
      "amtsgericht": "Amtsgericht Mannheim",
      "registernummer": "HRB 420891",
      "registerart": "HRB",
      "company_name": "Autohaus Hahn am Ring GmbH",
      "company_seat": "Hockenheim",
      "details": "27.09.2024 (Bekanntmachungsdatum)\n\nBaden-Württemberg Amtsgericht Mannheim HRB 420891\nRegisterbekanntmachung nach dem Umwandlungsgesetz 27.09.2024 (Eintragungsdatum)\n\nAutohaus Hahn am Ring GmbH\nGesellschaft mit beschränkter Haftung\nHockenheim\n\nAls nicht eingetragen wird bekanntgemacht:\nDen Gläubigern der an der Verschmelzung beteiligten Rechtsträger ist, wenn sie binnen sechs Monaten nach dem Tag, an dem die Eintragung der Verschmelzung in das Register des Sitzes desjenigen Rechtsträgers, dessen Gläubiger sie sind, nach § 19 Abs. 3 UmwG als bekanntgemacht gilt, ihren Anspruch nach Grund und Höhe schriftlich anmelden, Sicherheit zu leisten, soweit sie nicht Befriedigung verlangen können. Dieses Recht steht den Gläubigern jedoch nur zu, wenn sie glaubhaft machen, dass durch die Verschmelzung die Erfüllung ihrer Forderung gefährdet wird."
    },
    {
      "date": "2024-09-27",
      "original_text": "Löschungsankündigung\nBayern Amtsgericht München HRB 215232\nBLOKS.GmbH – München",
      "type": "Löschungsankündigung",
      "state": "Bayern",
      "amtsgericht": "Amtsgericht München",
      "registernummer": "HRB 215232",
      "registerart": "HRB",
      "company_name": "BLOKS.GmbH",
      "company_seat": "München",
      "details": "27.09.2024 (Bekanntmachungsdatum)\n\nBayern Amtsgericht München HRB 215232\nLöschungsankündigung 26.09.2024 (Eintragungsdatum)\n\nBLOKS.GmbH\nGesellschaft mit beschränkter Haftung\nMünchen\n\nDas Registergericht beabsichtigt, die im Handelsregister eingetragene Gesellschaft wegen Vermögenslosigkeit von Amts wegen nach § 394 FamFG zu löschen. Die Frist zur Erhebung eines Widerspruchs ist auf drei Monate festgesetzt."
    },
    {
      "date": "2024-09-27",
      "original_text": "Registerbekanntmachung nach dem Umwandlungsgesetz\nNordrhein-Westfalen Amtsgericht Köln HRB 120267\nBRAVE GmbH – Leverkusen",
      "type": "Registerbekanntmachung nach dem Umwandlungsgesetz",
      "state": "Nordrhein-Westfalen",
      "amtsgericht": "Amtsgericht Köln",
      "registernummer": "HRB 120267",
      "registerart": "HRB",
      "company_name": "BRAVE GmbH",
      "company_seat": "Leverkusen",
      "details": "27.09.2024 (Bekanntmachungsdatum)\n\nNordrhein-Westfalen Amtsgericht Köln HRB 120267\nRegisterbekanntmachung nach dem Umwandlungsgesetz 27.09.2024 (Eintragungsdatum)\n\nBRAVE GmbH\nGesellschaft mit beschränkter Haftung\nLeverkusen\n\nDen Gläubigern der an der Ausgliederung beteiligten Rechtsträger ist, wenn sie binnen sechs Monaten nach dem Tag, an dem die Eintragung der Ausgliederung in das Register des Sitzes desjenigen Rechtsträgers, dessen Gläubiger sie sind, nach § 19 Absatz 3 UmwG als bekanntgemacht gilt, ihren Anspruch nach Grund und Höhe schriftlich anmelden, Sicherheit zu leisten, soweit sie nicht Befriedigung verlangen können. Dieses Recht steht den Gläubigern jedoch nur zu, wenn sie glaubhaft machen, dass durch die Ausgliederung die Erfüllung ihrer Forderung gefährdet wird."
    },
    {
      "date": "2024-09-27",
      "original_text": "Löschungsankündigung\nBayern Amtsgericht München HRB 263663\nBellfort Real Estate S23a GmbH – München",
      "type": "Löschungsankündigung",
      "state": "Bayern",
      "amtsgericht": "Amtsgericht München",
      "registernummer": "HRB 263663",
      "registerart": "HRB",
      "company_name": "Bellfort Real Estate S23a GmbH",
      "company_seat": "München",
      "details": "27.09.2024 (Bekanntmachungsdatum)\n\nBayern Amtsgericht München HRB 263663\nLöschungsankündigung 26.09.2024 (Eintragungsdatum)\n\nBellfort Real Estate S23a GmbH\nGesellschaft mit beschränkter Haftung\nMünchen\n\nDas Registergericht beabsichtigt, die im Handelsregister eingetragene Gesellschaft wegen Vermögenslosigkeit von Amts wegen nach § 394 FamFG zu löschen. Die Frist zur Erhebung eines Widerspruchs ist auf drei Monate festgesetzt."
    },
    {
      "date": "2024-09-27",
      "original_text": "Einreichung neuer Dokumente\nBerlin Amtsgericht Berlin (Charlottenburg) HRB 38874\nBeta Systems Software Aktiengesellschaft – Berlin",
      "type": "Einreichung neuer Dokumente",
      "state": "Berlin",
      "amtsgericht": "Amtsgericht Berlin (Charlottenburg)",
      "registernummer": "HRB 38874",
      "registerart": "HRB",
      "company_name": "Beta Systems Software Aktiengesellschaft",
      "company_seat": "Berlin",
      "details": "27.09.2024 (Bekanntmachungsdatum)\n\nBerlin Amtsgericht Berlin (Charlottenburg) HRB 38874\nEinreichung neuer Dokumente\n\nBeta Systems Software Aktiengesellschaft\nAktiengesellschaft\nBerlin\n\nAls nicht eingetragen wird veröffentlicht:\nEs wurde eine neue Liste der Aufsichtsratsmitglieder eingereicht (§ 106 AktG)."
    },
    {
      "date": "2024-09-27",
      "original_text": "Registerbekanntmachung nach dem Umwandlungsgesetz\nNiedersachsen Amtsgericht Hannover HRB 57576\nBildungsvereinigung ARBEIT UND LEBEN Niedersachsen Mitte gemeinnützige Gesellschaft mit beschränkter Haftung – Hannover",
      "type": "Registerbekanntmachung nach dem Umwandlungsgesetz",
      "state": "Niedersachsen",
      "amtsgericht": "Amtsgericht Hannover",
      "registernummer": "HRB 57576",
      "registerart": "HRB",
      "company_name": "Bildungsvereinigung ARBEIT UND LEBEN Niedersachsen Mitte gemeinnützige Gesellschaft mit beschränkter Haftung",
      "company_seat": "Hannover",
      "details": "27.09.2024 (Bekanntmachungsdatum)\n\nNiedersachsen Amtsgericht Hannover HRB 57576\nRegisterbekanntmachung nach dem Umwandlungsgesetz 27.09.2024 (Eintragungsdatum)\n\nBildungsvereinigung ARBEIT UND LEBEN Niedersachsen Mitte gemeinnützige Gesellschaft mit beschränkter Haftung\nGesellschaft mit beschränkter Haftung\nHannover\n\nDen Gläubigern der an der Verschmelzung beteiligten Rechtsträger ist, wenn sie binnen sechs Monaten nach dem Tag, an dem die Eintragung der Verschmelzung in das Register des Sitzes desjenigen Rechtsträgers, dessen Gläubiger sie sind, nach § 19  Abs.  3 UmwG als bekannt gemacht gilt, ihren Anspruch nach Grund und Höhe schriftlich anmelden, Sicherheit zu leisten, soweit sie nicht Befriedigung verlangen können. Dieses Recht steht den Gläubigern jedoch nur zu, wenn sie glaubhaft machen, dass durch die Verschmelzung die Erfüllung der Forderung gefährdet wird."
    },
    {
      "date": "2024-09-27",
      "original_text": "Registerbekanntmachung nach dem Umwandlungsgesetz\nNiedersachsen Amtsgericht Hannover HRB 61929\nBildungsvereinigung ARBEIT UND LEBEN Niedersachsen Ost gGmbH – Hannover",
      "type": "Registerbekanntmachung nach dem Umwandlungsgesetz",
      "state": "Niedersachsen",
      "amtsgericht": "Amtsgericht Hannover",
      "registernummer": "HRB 61929",
      "registerart": "HRB",
      "company_name": "Bildungsvereinigung ARBEIT UND LEBEN Niedersachsen Ost gGmbH",
      "company_seat": "Hannover",
      "details": "27.09.2024 (Bekanntmachungsdatum)\n\nNiedersachsen Amtsgericht Hannover HRB 61929\nRegisterbekanntmachung nach dem Umwandlungsgesetz 27.09.2024 (Eintragungsdatum)\n\nBildungsvereinigung ARBEIT UND LEBEN Niedersachsen Ost gGmbH\nGesellschaft mit beschränkter Haftung\nHannover\n\nDen Gläubigern der an der Verschmelzung beteiligten Rechtsträger ist, wenn sie binnen sechs Monaten nach dem Tag, an dem die Eintragung der Verschmelzung in das Register des Sitzes desjenigen Rechtsträgers, dessen Gläubiger sie sind, nach § 19  Abs.  3 UmwG als bekannt gemacht gilt, ihren Anspruch nach Grund und Höhe schriftlich anmelden, Sicherheit zu leisten, soweit sie nicht Befriedigung verlangen können. Dieses Recht steht den Gläubigern jedoch nur zu, wenn sie glaubhaft machen, dass durch die Verschmelzung die Erfüllung der Forderung gefährdet wird."
    },
    {
      "date": "2024-09-27",
      "original_text": "Registerbekanntmachung nach dem Umwandlungsgesetz\nNiedersachsen Amtsgericht Hannover HRB 61927\nBildungsvereinigung ARBEIT UND LEBEN Niedersachsen Süd gGmbH – Hannover",
      "type": "Registerbekanntmachung nach dem Umwandlungsgesetz",
      "state": "Niedersachsen",
      "amtsgericht": "Amtsgericht Hannover",
      "registernummer": "HRB 61927",
      "registerart": "HRB",
      "company_name": "Bildungsvereinigung ARBEIT UND LEBEN Niedersachsen Süd gGmbH",
      "company_seat": "Hannover",
      "details": "27.09.2024 (Bekanntmachungsdatum)\n\nNiedersachsen Amtsgericht Hannover HRB 61927\nRegisterbekanntmachung nach dem Umwandlungsgesetz 27.09.2024 (Eintragungsdatum)\n\nBildungsvereinigung ARBEIT UND LEBEN Niedersachsen Süd gGmbH\nGesellschaft mit beschränkter Haftung\nHannover\n\nDen Gläubigern der an der Verschmelzung beteiligten Rechtsträger ist, wenn sie binnen sechs Monaten nach dem Tag, an dem die Eintragung der Verschmelzung in das Register des Sitzes desjenigen Rechtsträgers, dessen Gläubiger sie sind, nach § 19  Abs.  3 UmwG als bekannt gemacht gilt, ihren Anspruch nach Grund und Höhe schriftlich anmelden, Sicherheit zu leisten, soweit sie nicht Befriedigung verlangen können. Dieses Recht steht den Gläubigern jedoch nur zu, wenn sie glaubhaft machen, dass durch die Verschmelzung die Erfüllung der Forderung gefährdet wird."
    },
    {
      "date": "2024-09-27",
      "original_text": "Registerbekanntmachung nach dem Umwandlungsgesetz\nSachsen Amtsgericht Leipzig HRB 34020\nBloc 3 UG (haftungsbeschränkt) – Leipzig",
      "type": "Registerbekanntmachung nach dem Umwandlungsgesetz",
      "state": "Sachsen",
      "amtsgericht": "Amtsgericht Leipzig",
      "registernummer": "HRB 34020",
      "registerart": "HRB",
      "company_name": "Bloc 3 UG (haftungsbeschränkt)",
      "company_seat": "Leipzig",
      "details": "27.09.2024 (Bekanntmachungsdatum)\n\nSachsen Amtsgericht Leipzig HRB 34020\nRegisterbekanntmachung nach dem Umwandlungsgesetz 27.09.2024 (Eintragungsdatum)\n\nBloc 3 UG (haftungsbeschränkt)\nGesellschaft mit beschränkter Haftung\nLeipzig\n\nDen Gläubigern der an der Verschmelzung beteiligten Rechtsträger ist, wenn sie binnen sechs Monaten nach dem Tag, an dem die Eintragung der Verschmelzung in das Register des Sitzes desjenigen Rechtsträgers, dessen Gläubiger sie sind, nach § 19 Abs. 3 UmwG als bekannt gemacht gilt, ihren Anspruch nach Grund und Höhe schriftlich anmelden, Sicherheit zu leisten, soweit sie nicht Befriedigung verlangen können. Dieses Recht steht den Gläubigern jedoch nur zu, wenn sie glaubhaft machen, dass durch die Verschmelzung die Erfüllung der Forderung gefährdet wird."
    },
    {
      "date": "2024-09-27",
      "original_text": "Registerbekanntmachung nach dem Umwandlungsgesetz\nRheinland-Pfalz Amtsgericht Mainz HRB 22239\nBoehringer Ingelheim Europe GmbH – Ingelheim am Rhein",
      "type": "Registerbekanntmachung nach dem Umwandlungsgesetz",
      "state": "Rheinland-Pfalz",
      "amtsgericht": "Amtsgericht Mainz",
      "registernummer": "HRB 22239",
      "registerart": "HRB",
      "company_name": "Boehringer Ingelheim Europe GmbH",
      "company_seat": "Ingelheim am Rhein",
      "details": "27.09.2024 (Bekanntmachungsdatum)\n\nRheinland-Pfalz Amtsgericht Mainz HRB 22239\nRegisterbekanntmachung nach dem Umwandlungsgesetz 27.09.2024 (Eintragungsdatum)\n\nBoehringer Ingelheim Europe GmbH\nGesellschaft mit beschränkter Haftung\nIngelheim am Rhein\n\nAls nicht eingetragen wird veröffentlicht: Den Gläubigern der an der Verschmelzung beteiligten Rechtsträger ist, wenn sie binnen sechs Monaten nach dem Tag, an dem die Eintragung der Verschmelzung in das Register des Sitzes desjenigen Rechtsträgers,dessen Gläubiger sie sind, nach § 19 Abs. 3 UmwG als bekannt gemacht gilt, ihren Anspruch nach Grund und Höhe schriftlich anmelden, Sicherheit zu leisten, soweit sie nicht Befriedigung verlangen können. Dieses Recht steht den Gläubigern jedoch nur zu, wenn sie glaubhaft machen, dass durch die Verschmelzung die Erfüllung der Forderung gefährdet wird."
    },
    {
      "date": "2024-09-27",
      "original_text": "Registerbekanntmachung nach dem Umwandlungsgesetz\nRheinland-Pfalz Amtsgericht Mainz HRB 21068\nBoehringer Ingelheim Finanzierungs GmbH – Ingelheim",
      "type": "Registerbekanntmachung nach dem Umwandlungsgesetz",
      "state": "Rheinland-Pfalz",
      "amtsgericht": "Amtsgericht Mainz",
      "registernummer": "HRB 21068",
      "registerart": "HRB",
      "company_name": "Boehringer Ingelheim Finanzierungs GmbH",
      "company_seat": "Ingelheim",
      "details": "27.09.2024 (Bekanntmachungsdatum)\n\nRheinland-Pfalz Amtsgericht Mainz HRB 21068\nRegisterbekanntmachung nach dem Umwandlungsgesetz 27.09.2024 (Eintragungsdatum)\n\nBoehringer Ingelheim Finanzierungs GmbH\nGesellschaft mit beschränkter Haftung\nIngelheim\n\nAls nicht eingetragen wird veröffentlicht: Den Gläubigern der an der Verschmelzung beteiligten Rechtsträger ist, wenn sie binnen sechs Monaten nach dem Tag, an dem die Eintragung der Verschmelzung in das Register des Sitzes desjenigen Rechtsträgers,dessen Gläubiger sie sind, nach § 19 Abs. 3 UmwG als bekannt gemacht gilt, ihren Anspruch nach Grund und Höhe schriftlich anmelden, Sicherheit zu leisten, soweit sie nicht Befriedigung verlangen können. Dieses Recht steht den Gläubigern jedoch nur zu, wenn sie glaubhaft machen, dass durch die Verschmelzung die Erfüllung der Forderung gefährdet wird."
    },
    {
      "date": "2024-09-27",
      "original_text": "Registerbekanntmachung nach dem Umwandlungsgesetz\nHamburg Amtsgericht Hamburg HRB 188288\nBrain Based Movement GmbH – Hamburg",
      "type": "Registerbekanntmachung nach dem Umwandlungsgesetz",
      "state": "Hamburg",
      "amtsgericht": "Amtsgericht Hamburg",
      "registernummer": "HRB 188288",
      "registerart": "HRB",
      "company_name": "Brain Based Movement GmbH",
      "company_seat": "Hamburg",
      "details": "27.09.2024 (Bekanntmachungsdatum)\n\nHamburg Amtsgericht Hamburg HRB 188288\nRegisterbekanntmachung nach dem Umwandlungsgesetz 27.09.2024 (Eintragungsdatum)\n\nBrain Based Movement GmbH\nGesellschaft mit beschränkter Haftung\nHamburg\n\nAls nicht eingetragen wird bekannt gemacht:\nDen Gläubigern der an der Ausgliederung beteiligten Gesellschaften ist, wenn sie binnen sechs Monaten nach dem Tag, an dem die Eintragung der Ausgliederung in das Register des Sitzes desjenigen Rechtsträgers, dessen Gläubiger sie sind, nach § 19 Absatz 3 UmwG als bekannt gemacht gilt, ihren Anspruch nach Grund und Höhe schriftlich anmelden, Sicherheit zu leisten, soweit sie nicht Befriedigung verlangen können. Dieses Recht steht den Gläubigern jedoch nur zu, wenn sie glaubhaft machen, dass durch die Ausgliederung die Erfüllung ihrer Forderung gefährdet wird."
    },
    {
      "date": "2024-09-27",
      "original_text": "Registerbekanntmachung nach dem Umwandlungsgesetz\nSchleswig-Holstein Amtsgericht Lübeck HRB 15132\nCONPLUS Mittelstandslösungen GmbH – Ahrensburg",
      "type": "Registerbekanntmachung nach dem Umwandlungsgesetz",
      "state": "Schleswig-Holstein",
      "amtsgericht": "Amtsgericht Lübeck",
      "registernummer": "HRB 15132",
      "registerart": "HRB",
      "company_name": "CONPLUS Mittelstandslösungen GmbH",
      "company_seat": "Ahrensburg",
      "details": "27.09.2024 (Bekanntmachungsdatum)\n\nSchleswig-Holstein Amtsgericht Lübeck HRB 15132\nRegisterbekanntmachung nach dem Umwandlungsgesetz 27.09.2024 (Eintragungsdatum)\n\nCONPLUS Mittelstandslösungen GmbH\nGesellschaft mit beschränkter Haftung\nAhrensburg\n\nZu Eintragungsnummer 3 vom 27.09.2024 wird als nicht eingetragen veröffentlicht:\nDen Gläubigern der an der Verschmelzung beteiligten Rechtsträger ist, wenn sie binnen sechs Monaten nach dem Tag, an dem die Eintragung der Verschmelzung in das Register des Sitzes desjenigen Rechtsträgers, dessen Gläubiger sie sind, als bekannt gemacht gilt, ihren Anspruch nach Grund und Höhe schriftlich anmelden, Sicherheit zu leisten, soweit sie nicht Befriedigung verlangen können. Dieses Recht steht den Gläubigern jedoch nur zu, wenn sie glaubhaft machen, dass durch die Verschmelzung die Erfüllung ihrer Forderung gefährdet wird."
    },
    {
      "date": "2024-09-27",
      "original_text": "Registerbekanntmachung nach dem Umwandlungsgesetz\nSchleswig-Holstein Amtsgericht Lübeck HRA 8201\nCREMER ERZKONTOR GmbH & Co. KG – Lübeck",
      "type": "Registerbekanntmachung nach dem Umwandlungsgesetz",
      "state": "Schleswig-Holstein",
      "amtsgericht": "Amtsgericht Lübeck",
      "registernummer": "HRA 8201",
      "registerart": "HRA",
      "company_name": "CREMER ERZKONTOR GmbH & Co. KG",
      "company_seat": "Lübeck",
      "details": "27.09.2024 (Bekanntmachungsdatum)\n\nSchleswig-Holstein Amtsgericht Lübeck HRA 8201\nRegisterbekanntmachung nach dem Umwandlungsgesetz 26.09.2024 (Eintragungsdatum)\n\nCREMER ERZKONTOR GmbH & Co. KG\nKommanditgesellschaft\nLübeck\n\nAls nicht eingetragen wird veröffentlicht: Den Gläubigern der an der Verschmelzung beteiligten Rechtsträger ist, wenn sie binnen sechs Monaten nach dem Tag, an dem die Eintragung der Verschmelzung in das Register des Sitzes desjenigen Rechtsträgers, dessen Gläubiger sie sind, als bekannt gemacht gilt, ihren Anspruch nach Grund und Höhe schriftlich anmelden, Sicherheit zu leisten, soweit sie nicht Befriedigung verlangen können. Dieses Recht steht den Gläubigern jedoch nur zu, wenn sie glaubhaft machen, dass durch die Verschmelzung die Erfüllung ihrer Forderung gefährdet wird."
    },
    {
      "date": "2024-09-27",
      "original_text": "Registerbekanntmachung nach dem Umwandlungsgesetz\nSchleswig-Holstein Amtsgericht Lübeck HRB 25402\nCREMER Erzkontor GmbH – Lübeck",
      "type": "Registerbekanntmachung nach dem Umwandlungsgesetz",
      "state": "Schleswig-Holstein",
      "amtsgericht": "Amtsgericht Lübeck",
      "registernummer": "HRB 25402",
      "registerart": "HRB",
      "company_name": "CREMER Erzkontor GmbH",
      "company_seat": "Lübeck",
      "details": "27.09.2024 (Bekanntmachungsdatum)\n\nSchleswig-Holstein Amtsgericht Lübeck HRB 25402\nRegisterbekanntmachung nach dem Umwandlungsgesetz 26.09.2024 (Eintragungsdatum)\n\nCREMER Erzkontor GmbH\nGesellschaft mit beschränkter Haftung\nLübeck\n\nZu Eintragungsnummer 1 vom 26.09.2024 wird als nicht eingetragen veröffentlicht:\nAls nicht eingetragen wird veröffentlicht: Den Gläubigern ist, wenn sie binnen sechs Monaten nach dem Tag, an dem die Eintragung des Formwechsels als bekannt gemacht gilt, ihren Anspruch nach Grund und Höhe schriftlich anmelden, Sicherheit zu leisten, soweit sie nicht Befriedigung verlangen können. Dieses Recht steht den Gläubigern jedoch nur zu, wenn sie glaubhaft machen, dass durch den Formwechsel die Erfüllung ihrer Forderung gefährdet wird."
    },
    {
      "date": "2024-09-27",
      "original_text": "Einreichung neuer Dokumente\nBerlin Amtsgericht Berlin (Charlottenburg) HRB 106185\nCamera Work AG – Berlin",
      "type": "Einreichung neuer Dokumente",
      "state": "Berlin",
      "amtsgericht": "Amtsgericht Berlin (Charlottenburg)",
      "registernummer": "HRB 106185",
      "registerart": "HRB",
      "company_name": "Camera Work AG",
      "company_seat": "Berlin",
      "details": "27.09.2024 (Bekanntmachungsdatum)\n\nBerlin Amtsgericht Berlin (Charlottenburg) HRB 106185\nEinreichung neuer Dokumente\n\nCamera Work AG\nAktiengesellschaft\nBerlin\n\nAls nicht eingetragen wird veröffentlicht:Es wurde eine neue Liste der Aufsichtsratsmitglieder eingereicht (§ 106 AktG)."
    },
    {
      "date": "2024-09-27",
      "original_text": "Registerbekanntmachung nach dem Umwandlungsgesetz\nNordrhein-Westfalen Amtsgericht Köln HRA 36934\nCarlos Lourenco Hausmeisterservice e.K. – Kerpen",
      "type": "Registerbekanntmachung nach dem Umwandlungsgesetz",
      "state": "Nordrhein-Westfalen",
      "amtsgericht": "Amtsgericht Köln",
      "registernummer": "HRA 36934",
      "registerart": "HRA",
      "company_name": "Carlos Lourenco Hausmeisterservice e.K.",
      "company_seat": "Kerpen",
      "details": "27.09.2024 (Bekanntmachungsdatum)\n\nNordrhein-Westfalen Amtsgericht Köln HRA 36934\nRegisterbekanntmachung nach dem Umwandlungsgesetz 27.09.2024 (Eintragungsdatum)\n\nCarlos Lourenco Hausmeisterservice e.K.\nEinzelkaufmann / Einzelkauffrau\nKerpen\n\nDen Gläubigern der an der Ausgliederung beteiligten Rechtsträger ist, wenn sie binnen sechs Monaten nach dem Tag, an dem die Eintragung der Ausgliederung in das Register des Sitzes desjenigen Rechtsträgers, dessen Gläubiger sie sind, nach § 19 Absatz 3 UmwG als bekanntgemacht gilt, ihren Anspruch nach Grund und Höhe schriftlich anmelden, Sicherheit zu leisten, soweit sie nicht Befriedigung verlangen können. Dieses Recht steht den Gläubigern jedoch nur zu, wenn sie glaubhaft machen, dass durch die Ausgliederung die Erfüllung ihrer Forderung gefährdet wird."
    },
    {
      "date": "2024-09-27",
      "original_text": "Registerbekanntmachung nach dem Umwandlungsgesetz\nNordrhein-Westfalen Amtsgericht Gütersloh GsR 156\nChristel und Michael Venne eGbR – Verl",
      "type": "Registerbekanntmachung nach dem Umwandlungsgesetz",
      "state": "Nordrhein-Westfalen",
      "amtsgericht": "Amtsgericht Gütersloh",
      "registernummer": "GsR 156",
      "registerart": "GsR",
      "company_name": "Christel und Michael Venne eGbR",
      "company_seat": "Verl",
      "details": "27.09.2024 (Bekanntmachungsdatum)\n\nNordrhein-Westfalen Amtsgericht Gütersloh GsR 156\nRegisterbekanntmachung nach dem Umwandlungsgesetz 27.09.2024 (Eintragungsdatum)\n\nChristel und Michael Venne eGbR\nGesellschaft bürgerlichen Rechts\nVerl\n\nDen Gläubigern der an der formwechselnden Umwandlung beteiligten Rechtsträger ist, wenn sie binnen sechs Monaten nach dem Tag, an dem die Eintragung der formwechselnden Umwandlung in das Register des Sitzes derjenigen Rechtsträger deren Gläubiger sie sind, nach § 19 Absatz 3 UmwG als bekanntgemacht gilt, ihren Anspruch nach Grund und Höhe schriftlich anmelden, Sicherheit zu leisten, soweit sie nicht Befriedigung verlangen können. Dieses Recht steht den Gläubigern jedoch nur zu, wenn sie glaubhaft machen, dass durch die formwechselnden Umwandlung die Erfüllung ihrer Forderung gefährdet wird."
    },
    {
      "date": "2024-09-27",
      "original_text": "Löschungsankündigung\nBayern Amtsgericht München HRB 218260\nCoolPeople GmbH – München",
      "type": "Löschungsankündigung",
      "state": "Bayern",
      "amtsgericht": "Amtsgericht München",
      "registernummer": "HRB 218260",
      "registerart": "HRB",
      "company_name": "CoolPeople GmbH",
      "company_seat": "München",
      "details": "27.09.2024 (Bekanntmachungsdatum)\n\nBayern Amtsgericht München HRB 218260\nLöschungsankündigung 26.09.2024 (Eintragungsdatum)\n\nCoolPeople GmbH\nGesellschaft mit beschränkter Haftung\nMünchen\n\nDas Registergericht beabsichtigt, die im Handelsregister eingetragene Gesellschaft wegen Vermögenslosigkeit von Amts wegen nach § 394 FamFG zu löschen. Die Frist zur Erhebung eines Widerspruchs ist auf drei Monate festgesetzt."
    },
    {
      "date": "2024-09-27",
      "original_text": "Löschungsankündigung\nHessen Amtsgericht Frankfurt am Main HRB 129789\nCorona TestTeam GmbH – Frankfurt am Main",
      "type": "Löschungsankündigung",
      "state": "Hessen",
      "amtsgericht": "Amtsgericht Frankfurt am Main",
      "registernummer": "HRB 129789",
      "registerart": "HRB",
      "company_name": "Corona TestTeam GmbH",
      "company_seat": "Frankfurt am Main",
      "details": "27.09.2024 (Bekanntmachungsdatum)\n\nHessen Amtsgericht Frankfurt am Main HRB 129789\nLöschungsankündigung\n\nCorona TestTeam GmbH\nGesellschaft mit beschränkter Haftung\nFrankfurt am Main\n\nDas Registergericht beabsichtigt die im Handelsregister eingetragene Gesellschaft von Amts wegen nach § 394 FamFG zu löschen. Die Frist zur Erhebung eines Widerspruchs gegen die beabsichtigte Löschung wird auf 1 Monat festgesetzt."
    },
    {
      "date": "2024-09-27",
      "original_text": "Registerbekanntmachung nach dem Umwandlungsgesetz\nNordrhein-Westfalen Amtsgericht Gütersloh HRB 4257\nCoventya Americas GmbH – Gütersloh",
      "type": "Registerbekanntmachung nach dem Umwandlungsgesetz",
      "state": "Nordrhein-Westfalen",
      "amtsgericht": "Amtsgericht Gütersloh",
      "registernummer": "HRB 4257",
      "registerart": "HRB",
      "company_name": "Coventya Americas GmbH",
      "company_seat": "Gütersloh",
      "details": "27.09.2024 (Bekanntmachungsdatum)\n\nNordrhein-Westfalen Amtsgericht Gütersloh HRB 4257\nRegisterbekanntmachung nach dem Umwandlungsgesetz 27.09.2024 (Eintragungsdatum)\n\nCoventya Americas GmbH\nGesellschaft mit beschränkter Haftung\nGütersloh\n\nDen Gläubigern der an der Verschmelzung beteiligten Rechtsträger ist, wenn sie binnen sechs Monaten nach dem Tag, an dem die Eintragung der Verschmelzung in das Register des Sitzes derjenigen Rechtsträger deren Gläubiger sie sind, nach § 19 Absatz 3 UmwG als bekanntgemacht gilt, ihren Anspruch nach Grund und Höhe schriftlich anmelden, Sicherheit zu leisten, soweit sie nicht Befriedigung verlangen können. Dieses Recht steht den Gläubigern jedoch nur zu, wenn sie glaubhaft machen, dass durch die Verschmelzung die Erfüllung ihrer Forderung gefährdet wird."
    },
    {
      "date": "2024-09-27",
      "original_text": "Registerbekanntmachung nach dem Umwandlungsgesetz\nNordrhein-Westfalen Amtsgericht Gütersloh HRB 4075\nCoventya International GmbH – Gütersloh",
      "type": "Registerbekanntmachung nach dem Umwandlungsgesetz",
      "state": "Nordrhein-Westfalen",
      "amtsgericht": "Amtsgericht Gütersloh",
      "registernummer": "HRB 4075",
      "registerart": "HRB",
      "company_name": "Coventya International GmbH",
      "company_seat": "Gütersloh",
      "details": "27.09.2024 (Bekanntmachungsdatum)\n\nNordrhein-Westfalen Amtsgericht Gütersloh HRB 4075\nRegisterbekanntmachung nach dem Umwandlungsgesetz 27.09.2024 (Eintragungsdatum)\n\nCoventya International GmbH\nGesellschaft mit beschränkter Haftung\nGütersloh\n\nDen Gläubigern der an der Verschmelzung beteiligten Rechtsträger ist, wenn sie binnen sechs Monaten nach dem Tag, an dem die Eintragung der Verschmelzung in das Register des Sitzes derjenigen Rechtsträger deren Gläubiger sie sind, nach § 19 Absatz 3 UmwG als bekanntgemacht gilt, ihren Anspruch nach Grund und Höhe schriftlich anmelden, Sicherheit zu leisten, soweit sie nicht Befriedigung verlangen können. Dieses Recht steht den Gläubigern jedoch nur zu, wenn sie glaubhaft machen, dass durch die Verschmelzung die Erfüllung ihrer Forderung gefährdet wird."
    },
    {
      "date": "2024-09-27",
      "original_text": "Registerbekanntmachung nach dem Umwandlungsgesetz\nBrandenburg Amtsgericht Cottbus HRA 4001\nCovid-19-Testzentrum Meergans GmbH & Co. KG – Senftenberg",
      "type": "Registerbekanntmachung nach dem Umwandlungsgesetz",
      "state": "Brandenburg",
      "amtsgericht": "Amtsgericht Cottbus",
      "registernummer": "HRA 4001",
      "registerart": "HRA",
      "company_name": "Covid-19-Testzentrum Meergans GmbH & Co. KG",
      "company_seat": "Senftenberg",
      "details": "27.09.2024 (Bekanntmachungsdatum)\n\nBrandenburg Amtsgericht Cottbus HRA 4001\nRegisterbekanntmachung nach dem Umwandlungsgesetz 26.09.2024 (Eintragungsdatum)\n\nCovid-19-Testzentrum Meergans GmbH & Co. KG\nKommanditgesellschaft\nSenftenberg\n\nZu Eintragungsnummer 2 vom 26.09.2024 wird als nicht eingetragen veröffentlicht:\nDen Gläubigern der an der Verschmelzung beteiligten Rechtsträger ist, wenn sie binnen sechs Monaten nach dem Tag, an dem die Eintragung der Verschmelzung in das Register des Sitzes desjenigen Rechtsträgers, dessen Gläubiger sie sind, als bekannt gemacht gilt, ihren Anspruch nach Grund und Höhe schriftlich anmelden, Sicherheit zu leisten, soweit sie nicht Befriedigung verlangen können. Dieses Recht steht den Gläubigern jedoch nur zu, wenn sie glaubhaft machen, dass durch die Verschmelzung die Erfüllung ihrer Forderung gefährdet wird"
    },
    {
      "date": "2024-09-27",
      "original_text": "Registerbekanntmachung nach dem Umwandlungsgesetz\nRheinland-Pfalz Amtsgericht Wittlich HRB 40523\nDEVEKO GmbH – Trier",
      "type": "Registerbekanntmachung nach dem Umwandlungsgesetz",
      "state": "Rheinland-Pfalz",
      "amtsgericht": "Amtsgericht Wittlich",
      "registernummer": "HRB 40523",
      "registerart": "HRB",
      "company_name": "DEVEKO GmbH",
      "company_seat": "Trier",
      "details": "27.09.2024 (Bekanntmachungsdatum)\n\nRheinland-Pfalz Amtsgericht Wittlich HRB 40523\nRegisterbekanntmachung nach dem Umwandlungsgesetz 27.09.2024 (Eintragungsdatum)\n\nDEVEKO GmbH\nGesellschaft mit beschränkter Haftung\nTrier\n\nAls nicht eingetragen wird veröffentlicht: Den Gläubigern der an der Umwandlungbeteiligten Rechtsträger ist, wenn sie binnen sechs Monaten nach dem Tag, an dem die Eintragung der Umwandlung in das Register des Sitzes desjenigen Rechtsträgers, dessen Gläubiger sie sind, nach § 19 Abs. 3 UmwG als bekannt gemacht gilt, ihren Anspruch nach Grund und Höhe schriftlich anmelden, Sicherheit zu leisten, soweit sie nicht Befriedigung verlangen können. Dieses Recht steht den Gläubigern jedoch nur zu, wenn sie glaubhaft machen, dass durch die Umwandlung die Erfüllung der Forderung gefährdet wird."
    },
    {
      "date": "2024-09-27",
      "original_text": "Einreichung neuer Dokumente\nBaden-Württemberg Amtsgericht Freiburg HRB 413176\nDSM Nutritional Products GmbH – Grenzach-Wyhlen",
      "type": "Einreichung neuer Dokumente",
      "state": "Baden-Württemberg",
      "amtsgericht": "Amtsgericht Freiburg",
      "registernummer": "HRB 413176",
      "registerart": "HRB",
      "company_name": "DSM Nutritional Products GmbH",
      "company_seat": "Grenzach-Wyhlen",
      "details": "27.09.2024 (Bekanntmachungsdatum)\n\nBaden-Württemberg Amtsgericht Freiburg HRB 413176\nEinreichung neuer Dokumente 27.09.2024 (Eintragungsdatum)\n\nDSM Nutritional Products GmbH\nGesellschaft mit beschränkter Haftung\nGrenzach-Wyhlen\n\nDie Gesellschaft hat am 25.09.2024 die Liste über die Zusammensetzung des Aufsichtsrats zum Handelsregister eingereicht."
    },
    {
      "date": "2024-09-27",
      "original_text": "Sonstige Registerbekanntmachung\nNordrhein-Westfalen Amtsgericht Düsseldorf HRB 88699\nDZK Deutsche Zahnklinik GmbH – Düsseldorf",
      "type": "Sonstige Registerbekanntmachung",
      "state": "Nordrhein-Westfalen",
      "amtsgericht": "Amtsgericht Düsseldorf",
      "registernummer": "HRB 88699",
      "registerart": "HRB",
      "company_name": "DZK Deutsche Zahnklinik GmbH",
      "company_seat": "Düsseldorf",
      "details": "27.09.2024 (Bekanntmachungsdatum)\n\nNordrhein-Westfalen Amtsgericht Düsseldorf HRB 88699\nSonstige Registerbekanntmachung 27.09.2024 (Eintragungsdatum)\n\nDZK Deutsche Zahnklinik GmbH\nGesellschaft mit beschränkter Haftung\nDüsseldorf\n\nAls nicht eingetragen wird veröffentlicht: Den Gläubigern der Gesellschaft, deren Forderungen begründet worden sind bevor die Eintragung der Beendigung des Beherrschungs- und Gewinnabführungsvertrages  in das Handelsregister nach § 10 des Handelsgesetzbuches als bekanntgemacht gilt, hat der andere Vertragsteil Sicherheit zu leisten, wenn sie sich binnen sechs Monaten nach der Bekanntmachung der Eintragung zu diesem Zweck bei ihm melden."
    },
    {
      "date": "2024-09-27",
      "original_text": "Löschungsankündigung\nMecklenburg-Vorpommern Amtsgericht Schwerin HRA 2443\nDachbegrünung Züsow UG (haftungsbeschränkt) & Co. KG – Züsow",
      "type": "Löschungsankündigung",
      "state": "Mecklenburg-Vorpommern",
      "amtsgericht": "Amtsgericht Schwerin",
      "registernummer": "HRA 2443",
      "registerart": "HRA",
      "company_name": "Dachbegrünung Züsow UG (haftungsbeschränkt) & Co. KG",
      "company_seat": "Züsow",
      "details": "27.09.2024 (Bekanntmachungsdatum)\n\nMecklenburg-Vorpommern Amtsgericht Schwerin HRA 2443\nLöschungsankündigung\n\nDachbegrünung Züsow UG (haftungsbeschränkt) & Co. KG\nKommanditgesellschaft\nZüsow\n\nDas Registergericht beabsichtigt, die im Handelsregister eingetragene Gesellschaft von Amts wegen nach § 394 FamFG zu löschen. Die Frist zur Erhebung eines Widerspruchs gegen die beabsichtigte Löschung wird auf 1Monat festgesetzt."
    },
    {
      "date": "2024-09-27",
      "original_text": "Registerbekanntmachung nach dem Umwandlungsgesetz\nBaden-Württemberg Amtsgericht Mannheim HRB 708518\nDeVilbiss Healthcare GmbH – Mannheim",
      "type": "Registerbekanntmachung nach dem Umwandlungsgesetz",
      "state": "Baden-Württemberg",
      "amtsgericht": "Amtsgericht Mannheim",
      "registernummer": "HRB 708518",
      "registerart": "HRB",
      "company_name": "DeVilbiss Healthcare GmbH",
      "company_seat": "Mannheim",
      "details": "27.09.2024 (Bekanntmachungsdatum)\n\nBaden-Württemberg Amtsgericht Mannheim HRB 708518\nRegisterbekanntmachung nach dem Umwandlungsgesetz 27.09.2024 (Eintragungsdatum)\n\nDeVilbiss Healthcare GmbH\nGesellschaft mit beschränkter Haftung\nMannheim\n\nDen Gläubigern der an der Verschmelzung beteiligten Rechtsträger ist, wenn sie binnen sechs Monaten nach dem Tag, an dem die Eintragung der Verschmelzung in das Register des Sitzes desjenigen Rechtsträgers, dessen Gläubiger sie sind, nach § 19 Abs. 3 UmwG als bekanntgemacht gilt, ihren Anspruch nach Grund und Höhe schriftlich anmelden, Sicherheit zu leisten, soweit sie nicht Befriedigung verlangen können. Dieses Recht steht den Gläubigern jedoch nur zu, wenn sie glaubhaft machen, dass durch die Verschmelzung die Erfüllung ihrer Forderung gefährdet wird."
    },
    {
      "date": "2024-09-27",
      "original_text": "Sonstige Registerbekanntmachung\nNordrhein-Westfalen Amtsgericht Köln HRB 623\nDelvag Versicherungs-AG – Köln",
      "type": "Sonstige Registerbekanntmachung",
      "state": "Nordrhein-Westfalen",
      "amtsgericht": "Amtsgericht Köln",
      "registernummer": "HRB 623",
      "registerart": "HRB",
      "company_name": "Delvag Versicherungs-AG",
      "company_seat": "Köln",
      "details": "27.09.2024 (Bekanntmachungsdatum)\n\nNordrhein-Westfalen Amtsgericht Köln HRB 623\nSonstige Registerbekanntmachung\n\nDelvag Versicherungs-AG\nAktiengesellschaft\nKöln\n\nDem Registergericht ist eine Liste der Mitglieder des Aufsichtsrates eingereicht worden."
    },
    {
      "date": "2024-09-27",
      "original_text": "Registerbekanntmachung nach dem Umwandlungsgesetz\nBayern Amtsgericht München HRA 119734\nE. L. Eder Versicherungsmakler GmbH & Co. KG – Vaterstetten",
      "type": "Registerbekanntmachung nach dem Umwandlungsgesetz",
      "state": "Bayern",
      "amtsgericht": "Amtsgericht München",
      "registernummer": "HRA 119734",
      "registerart": "HRA",
      "company_name": "E. L. Eder Versicherungsmakler GmbH & Co. KG",
      "company_seat": "Vaterstetten",
      "details": "27.09.2024 (Bekanntmachungsdatum)\n\nBayern Amtsgericht München HRA 119734\nRegisterbekanntmachung nach dem Umwandlungsgesetz 26.09.2024 (Eintragungsdatum)\n\nE. L. Eder Versicherungsmakler GmbH & Co. KG\nKommanditgesellschaft\nVaterstetten\n\nDen Gläubigern der an der Ausgliederung beteiligten Rechtsträger ist, wenn sie binnen sechs Monaten nach dem Tag, an dem die Eintragung der Ausgliederung in das Register des Sitzes desjenigen Rechtsträgers, dessen Gläubiger sie sind, nach §§ 125, 19 Abs. 3 UmwG als bekannt gemacht gilt, ihren Anspruch nach Grund und Höhe schriftlich anmelden, Sicherheit zu leisten, soweit sie nicht Befriedigung verlangen können. Dieses Recht steht den Gläubigern jedoch nur zu, wenn sie glaubhaft machen, dass durch die Ausgliederung die Erfüllung ihrer Forderung gefährdet wird."
    },
    {
      "date": "2024-09-27",
      "original_text": "Einreichung neuer Dokumente\nBayern Amtsgericht Bayreuth HRB 3381\nENERGENT AG – Bayreuth",
      "type": "Einreichung neuer Dokumente",
      "state": "Bayern",
      "amtsgericht": "Amtsgericht Bayreuth",
      "registernummer": "HRB 3381",
      "registerart": "HRB",
      "company_name": "ENERGENT AG",
      "company_seat": "Bayreuth",
      "details": "27.09.2024 (Bekanntmachungsdatum)\n\nBayern Amtsgericht Bayreuth HRB 3381\nEinreichung neuer Dokumente 26.09.2024 (Eintragungsdatum)\n\nENERGENT AG\nAktiengesellschaft\nBayreuth\n\nDem Amtsgericht Bayreuth -Registergericht- ist eine Liste der Mitglieder des Aufsichtsrats eingereicht worden, § 106 AktG."
    },
    {
      "date": "2024-09-27",
      "original_text": "Registerbekanntmachung nach dem Umwandlungsgesetz\nHessen Amtsgericht Frankfurt am Main HRA 53643\nEckhardt Dachdeckermeister GmbH & Co. KG – Bad Vilbel",
      "type": "Registerbekanntmachung nach dem Umwandlungsgesetz",
      "state": "Hessen",
      "amtsgericht": "Amtsgericht Frankfurt am Main",
      "registernummer": "HRA 53643",
      "registerart": "HRA",
      "company_name": "Eckhardt Dachdeckermeister GmbH & Co. KG",
      "company_seat": "Bad Vilbel",
      "details": "27.09.2024 (Bekanntmachungsdatum)\n\nHessen Amtsgericht Frankfurt am Main HRA 53643\nRegisterbekanntmachung nach dem Umwandlungsgesetz 27.09.2024 (Eintragungsdatum)\n\nEckhardt Dachdeckermeister GmbH & Co. KG\nKommanditgesellschaft\nBad Vilbel\n\nDen Gläubigern der an der Ausgliederung beteiligten Rechtsträger ist, wenn sie binnen sechs Monaten nach dem Tag, an dem die Eintragung der Ausgliederung in das Register des Sitzes derjenigen Rechtsträger deren Gläubiger sie sind, nach §§ 125, 19 Absatz 3 UmwG bekannt gemacht worden ist, ihren Anspruch nach Grund und Höhe schriftlich anmelden, Sicherheit zu leisten, soweit sie nicht Befriedigung verlangen können. Dieses Recht steht den Gläubigern jedoch nur zu, wenn sie glaubhaft machen, dass durch die Ausgliederung die Erfüllung ihrer Forderung gefährdet wird."
    },
    {
      "date": "2024-09-27",
      "original_text": "Registerbekanntmachung nach dem Umwandlungsgesetz\nBaden-Württemberg Amtsgericht Mannheim HRA 711977\nElektro Eichler GmbH & Co. KG – Schriesheim",
      "type": "Registerbekanntmachung nach dem Umwandlungsgesetz",
      "state": "Baden-Württemberg",
      "amtsgericht": "Amtsgericht Mannheim",
      "registernummer": "HRA 711977",
      "registerart": "HRA",
      "company_name": "Elektro Eichler GmbH & Co. KG",
      "company_seat": "Schriesheim",
      "details": "27.09.2024 (Bekanntmachungsdatum)\n\nBaden-Württemberg Amtsgericht Mannheim HRA 711977\nRegisterbekanntmachung nach dem Umwandlungsgesetz 27.09.2024 (Eintragungsdatum)\n\nElektro Eichler GmbH & Co. KG\nKommanditgesellschaft\nSchriesheim\n\nDen Gläubigern der an der Ausgliederung beteiligten Rechtsträger ist, wenn sie binnen sechs Monaten nach dem Tag, an dem die Eintragung der Ausgliederung in das Register des Sitzes desjenigen Rechtsträgers, dessen Gläubiger sie sind, nach § 19 Abs. 3 UmwG als bekanntgemacht gilt, ihren Anspruch nach Grund und Höhe schriftlich anmelden, Sicherheit zu leisten, soweit sie nicht Befriedigung verlangen können. Dieses Recht steht den Gläubigern jedoch nur zu, wenn sie glaubhaft machen, dass durch die Ausgliederung die Erfüllung ihrer Forderung gefährdet wird."
    },
    {
      "date": "2024-09-27",
      "original_text": "Registerbekanntmachung nach dem Umwandlungsgesetz\nBaden-Württemberg Amtsgericht Mannheim HRB 752238\nElektro Menrath GmbH – Leimen",
      "type": "Registerbekanntmachung nach dem Umwandlungsgesetz",
      "state": "Baden-Württemberg",
      "amtsgericht": "Amtsgericht Mannheim",
      "registernummer": "HRB 752238",
      "registerart": "HRB",
      "company_name": "Elektro Menrath GmbH",
      "company_seat": "Leimen",
      "details": "27.09.2024 (Bekanntmachungsdatum)\n\nBaden-Württemberg Amtsgericht Mannheim HRB 752238\nRegisterbekanntmachung nach dem Umwandlungsgesetz 27.09.2024 (Eintragungsdatum)\n\nElektro Menrath GmbH\nGesellschaft mit beschränkter Haftung\nLeimen\n\nDen Gläubigern der an der grenzüberschreitenden Ausgliederung beteiligten übernehmenden Rechtsträger ist, wenn sie binnen sechs Monaten nach dem Tag, an dem die Eintragung der Spaltung in das Register des Sitzes desjenigen Rechtsträgers, dessen Gläubiger sie sind, nach § 19 Absatz 3 UmwG als bekanntgemacht gilt, ihren Anspruch nach Grund und Höhe schriftlich anmelden, Sicherheit zu leisten, soweit sie nicht Befriedigung verlangen können.\nDieses Recht steht den Gläubigern jedoch nur zu, wenn sie glaubhaft machen, dass durch die Spaltung die Erfüllung ihrer Forderung gefährdet wird.  Den Gläubigern der an der Ausgliederung beteiligten Rechtsträger ist, wenn sie binnen sechs Monaten nach dem Tag, an dem die Eintragung der Ausgliederung in das Register des Sitzes desjenigen Rechtsträgers, dessen Gläubiger sie sind, nach § 19 Abs. 3 UmwG als bekanntgemacht gilt, ihren Anspruch nach Grund und Höhe schriftlich anmelden, Sicherheit zu leisten, soweit sie nicht Befriedigung verlangen können. Dieses Recht steht den Gläubigern jedoch nur zu, wenn sie glaubhaft machen, dass durch die Ausgliederung die Erfüllung ihrer Forderung gefährdet wird."
    },
    {
      "date": "2024-09-27",
      "original_text": "Registerbekanntmachung nach dem Umwandlungsgesetz\nBaden-Württemberg Amtsgericht Mannheim HRA 701389\nElektrotechnik Michael Eichler e. K. – Schriesheim",
      "type": "Registerbekanntmachung nach dem Umwandlungsgesetz",
      "state": "Baden-Württemberg",
      "amtsgericht": "Amtsgericht Mannheim",
      "registernummer": "HRA 701389",
      "registerart": "HRA",
      "company_name": "Elektrotechnik Michael Eichler e. K.",
      "company_seat": "Schriesheim",
      "details": "27.09.2024 (Bekanntmachungsdatum)\n\nBaden-Württemberg Amtsgericht Mannheim HRA 701389\nRegisterbekanntmachung nach dem Umwandlungsgesetz 27.09.2024 (Eintragungsdatum)\n\nElektrotechnik Michael Eichler e. K.\nEinzelkaufmann / Einzelkauffrau\nSchriesheim\n\nAls nicht eingetragen wird bekanntgemacht:\nDen Gläubigern der an der Ausgliederung beteiligten Rechtsträger ist, wenn sie binnen sechs Monaten nach dem Tag, an dem die Eintragung der Ausgliederung in das Register des Sitzes desjenigen Rechtsträgers, dessen Gläubiger sie sind, nach § 19 Abs. 3 UmwG als bekanntgemacht gilt, ihren Anspruch nach Grund und Höhe schriftlich anmelden, Sicherheit zu leisten, soweit sie nicht Befriedigung verlangen können. Dieses Recht steht den Gläubigern jedoch nur zu, wenn sie glaubhaft machen, dass durch die Ausgliederung die Erfüllung ihrer Forderung gefährdet wird."
    },
    {
      "date": "2024-09-27",
      "original_text": "Einreichung neuer Dokumente\nRheinland-Pfalz Amtsgericht Kaiserslautern HRB 31374\nEnergieagentur Rheinland-Pfalz GmbH – Kaiserslautern",
      "type": "Einreichung neuer Dokumente",
      "state": "Rheinland-Pfalz",
      "amtsgericht": "Amtsgericht Kaiserslautern",
      "registernummer": "HRB 31374",
      "registerart": "HRB",
      "company_name": "Energieagentur Rheinland-Pfalz GmbH",
      "company_seat": "Kaiserslautern",
      "details": "27.09.2024 (Bekanntmachungsdatum)\n\nRheinland-Pfalz Amtsgericht Kaiserslautern HRB 31374\nEinreichung neuer Dokumente\n\nEnergieagentur Rheinland-Pfalz GmbH\nGesellschaft mit beschränkter Haftung\nKaiserslautern\n\nDem Registergericht ist eine Liste der Mitglieder des Aufsichtsrates eingereicht worden."
    },
    {
      "date": "2024-09-27",
      "original_text": "Registerbekanntmachung nach dem Umwandlungsgesetz\nSchleswig-Holstein Amtsgericht Lübeck HRA 11242\nEntwicklungsgesgesellschaft Neue Teerhofinsel Besitz- und Verwaltungs GmbH & Co. KG – Bargteheide",
      "type": "Registerbekanntmachung nach dem Umwandlungsgesetz",
      "state": "Schleswig-Holstein",
      "amtsgericht": "Amtsgericht Lübeck",
      "registernummer": "HRA 11242",
      "registerart": "HRA",
      "company_name": "Entwicklungsgesgesellschaft Neue Teerhofinsel Besitz- und Verwaltungs GmbH & Co. KG",
      "company_seat": "Bargteheide",
      "details": "27.09.2024 (Bekanntmachungsdatum)\n\nSchleswig-Holstein Amtsgericht Lübeck HRA 11242\nRegisterbekanntmachung nach dem Umwandlungsgesetz 25.09.2024 (Eintragungsdatum)\n\nEntwicklungsgesgesellschaft Neue Teerhofinsel Besitz- und Verwaltungs GmbH & Co. KG\nKommanditgesellschaft\nBargteheide\n\nAls nicht eingetragen wird veröffentlicht: Den Gläubigern der an der Verschmelzung beteiligten Rechtsträger ist, wenn sie binnen sechs Monaten nach dem Tag, an dem die Eintragung der Verschmelzung in das Register des Sitzes desjenigen Rechtsträgers, dessen Gläubiger sie sind, als bekannt gemacht gilt, ihren Anspruch nach Grund und Höhe schriftlich anmelden, Sicherheit zu leisten, soweit sie nicht Befriedigung verlangen können. Dieses Recht steht den Gläubigern jedoch nur zu, wenn sie glaubhaft machen, dass durch die Verschmelzung die Erfüllung ihrer Forderung gefährdet wird."
    },
    {
      "date": "2024-09-27",
      "original_text": "Löschungsankündigung\nNordrhein-Westfalen Amtsgericht Düren HRB 8816\nEt Köbes GmbH – Jülich",
      "type": "Löschungsankündigung",
      "state": "Nordrhein-Westfalen",
      "amtsgericht": "Amtsgericht Düren",
      "registernummer": "HRB 8816",
      "registerart": "HRB",
      "company_name": "Et Köbes GmbH",
      "company_seat": "Jülich",
      "details": "27.09.2024 (Bekanntmachungsdatum)\n\nNordrhein-Westfalen Amtsgericht Düren HRB 8816\nLöschungsankündigung\n\nEt Köbes GmbH\nGesellschaft mit beschränkter Haftung\nJülich\n\nDas Registergericht beabsichtigt die Gesellschaft von Amts wegen nach § 394 FamFG zu löschen. Die Frist zur Erhebung eines Widerspruchs ist auf drei Monate festgesetzt."
    },
    {
      "date": "2024-09-27",
      "original_text": "Sonstige Registerbekanntmachung\nBaden-Württemberg Amtsgericht Mannheim HRB 201995\nEurAka Baden-Baden gGmbH – Baden-Baden",
      "type": "Sonstige Registerbekanntmachung",
      "state": "Baden-Württemberg",
      "amtsgericht": "Amtsgericht Mannheim",
      "registernummer": "HRB 201995",
      "registerart": "HRB",
      "company_name": "EurAka Baden-Baden gGmbH",
      "company_seat": "Baden-Baden",
      "details": "27.09.2024 (Bekanntmachungsdatum)\n\nBaden-Württemberg Amtsgericht Mannheim HRB 201995\nSonstige Registerbekanntmachung\n\nEurAka Baden-Baden gGmbH\nGesellschaft mit beschränkter Haftung\nBaden-Baden\n\nDie Gesellschaft hat am 27.09.2024 die Liste über die Zusammensetzung des Aufsichtsrats zum Handelsregister eingereicht."
    },
    {
      "date": "2024-09-27",
      "original_text": "Registerbekanntmachung nach dem Umwandlungsgesetz\nSchleswig-Holstein Amtsgericht Flensburg HRA 9120\nF 40 Bekleidungsgeschäft e. K. – Kappeln",
      "type": "Registerbekanntmachung nach dem Umwandlungsgesetz",
      "state": "Schleswig-Holstein",
      "amtsgericht": "Amtsgericht Flensburg",
      "registernummer": "HRA 9120",
      "registerart": "HRA",
      "company_name": "F 40 Bekleidungsgeschäft e. K.",
      "company_seat": "Kappeln",
      "details": "27.09.2024 (Bekanntmachungsdatum)\n\nSchleswig-Holstein Amtsgericht Flensburg HRA 9120\nRegisterbekanntmachung nach dem Umwandlungsgesetz 27.09.2024 (Eintragungsdatum)\n\nF 40 Bekleidungsgeschäft e. K.\nEinzelkaufmann / Einzelkauffrau\nKappeln\n\nZu Eintragungsnummer 2 vom 27.09.2024 wird als nicht eingetragen veröffentlicht: Den Gläubigern der an der Spaltung beteiligten Rechtsträger ist, wenn sie binnen sechs Monaten nach dem Tag, an dem die Eintragung der Spaltung in das Register des Sitzes desjenigen Rechtsträgers, dessen Gläubiger sie sind, als bekannt gemacht gilt, ihren Anspruch nach Grund und Höhe schriftlich anmelden, Sicherheit zu leisten, soweit sie nicht Befriedigung verlangen können. Dieses Recht steht den Gläubigern jedoch nur zu, wenn sie glaubhaft machen, dass durch die Spaltung die Erfüllung ihrer Forderung gefährdet wird."
    },
    {
      "date": "2024-09-27",
      "original_text": "Registerbekanntmachung nach dem Umwandlungsgesetz\nNiedersachsen Amtsgericht Hannover HRA 206525\nFMC Metalltechnik GmbH & Co.KG – Coppenbrügge",
      "type": "Registerbekanntmachung nach dem Umwandlungsgesetz",
      "state": "Niedersachsen",
      "amtsgericht": "Amtsgericht Hannover",
      "registernummer": "HRA 206525",
      "registerart": "HRA",
      "company_name": "FMC Metalltechnik GmbH & Co.KG",
      "company_seat": "Coppenbrügge",
      "details": "27.09.2024 (Bekanntmachungsdatum)\n\nNiedersachsen Amtsgericht Hannover HRA 206525\nRegisterbekanntmachung nach dem Umwandlungsgesetz 27.09.2024 (Eintragungsdatum)\n\nFMC Metalltechnik GmbH & Co.KG\nKommanditgesellschaft\nCoppenbrügge\n\nDen Gläubigern der an der formwechselnden Umwandlung beteiligten Rechtsträger ist, wenn sie binnen sechs Monaten nach dem Tag, an dem die Eintragung der Umwandlung in das Register des Sitzes desjenigen Rechtsträgers, dessen Gläubiger sie sind, nach § 19 Abs. 3 UmwG als bekannt gemacht gilt, ihren Anspruch nach Grund und Höhe schriftlich anmelden, Sicherheit zu leisten, soweit sie nicht Befriedigung verlangen können. Dieses Recht steht den Gläubigern jedoch nur zu, wenn sie glaubhaft machen, dass durch die formwechselnde Umwandlung die Erfüllung der Forderung gefährdet wird."
    },
    {
      "date": "2024-09-27",
      "original_text": "Registerbekanntmachung nach dem Umwandlungsgesetz\nNiedersachsen Amtsgericht Hannover HRB 100116 früher Amtsgericht Hameln\nFMC-Metalltechnik GmbH – Coppenbrügge - Marienau",
      "type": "Registerbekanntmachung nach dem Umwandlungsgesetz",
      "state": "Niedersachsen",
      "amtsgericht": "Amtsgericht Hannover",
      "registernummer": "HRB 100116",
      "registerart": "HRB",
      "company_name": "FMC-Metalltechnik GmbH",
      "company_seat": "Coppenbrügge - Marienau",
      "former_amtsgericht": "Hameln",
      "details": "27.09.2024 (Bekanntmachungsdatum)\n\nNiedersachsen Amtsgericht Hannover HRB 100116 früher Amtsgericht Hameln\nRegisterbekanntmachung nach dem Umwandlungsgesetz 27.09.2024 (Eintragungsdatum)\n\nFMC-Metalltechnik GmbH\nGesellschaft mit beschränkter Haftung\nCoppenbrügge - Marienau\n\nDen Gläubigern der an der formwechselnden Umwandlung beteiligten Rechtsträger ist, wenn sie binnen sechs Monaten nach dem Tag, an dem die Eintragung der Umwandlung in das Register des Sitzes desjenigen Rechtsträgers, dessen Gläubiger sie sind, nach § 19 Abs. 3 UmwG als bekannt gemacht gilt, ihren Anspruch nach Grund und Höhe schriftlich anmelden, Sicherheit zu leisten, soweit sie nicht Befriedigung verlangen können. Dieses Recht steht den Gläubigern jedoch nur zu, wenn sie glaubhaft machen, dass durch die formwechselnde Umwandlung die Erfüllung der Forderung gefährdet wird."
    },
    {
      "date": "2024-09-27",
      "original_text": "Registerbekanntmachung nach dem Umwandlungsgesetz\nNordrhein-Westfalen Amtsgericht Gütersloh HRB 2367\nFV Fliesen-Verlege GmbH – Verl",
      "type": "Registerbekanntmachung nach dem Umwandlungsgesetz",
      "state": "Nordrhein-Westfalen",
      "amtsgericht": "Amtsgericht Gütersloh",
      "registernummer": "HRB 2367",
      "registerart": "HRB",
      "company_name": "FV Fliesen-Verlege GmbH",
      "company_seat": "Verl",
      "details": "27.09.2024 (Bekanntmachungsdatum)\n\nNordrhein-Westfalen Amtsgericht Gütersloh HRB 2367\nRegisterbekanntmachung nach dem Umwandlungsgesetz 27.09.2024 (Eintragungsdatum)\n\nFV Fliesen-Verlege GmbH\nGesellschaft mit beschränkter Haftung\nVerl\n\nDen Gläubigern der an der formwechselnden Umwandlung beteiligten Rechtsträger ist, wenn sie binnen sechs Monaten nach dem Tag, an dem die Eintragung der formwechselnden Umwandlung in das Register des Sitzes derjenigen Rechtsträger deren Gläubiger sie sind, nach § 19 Absatz 3 UmwG als bekanntgemacht gilt, ihren Anspruch nach Grund und Höhe schriftlich anmelden, Sicherheit zu leisten, soweit sie nicht Befriedigung verlangen können. Dieses Recht steht den Gläubigern jedoch nur zu, wenn sie glaubhaft machen, dass durch die formwechselnden Umwandlung die Erfüllung ihrer Forderung gefährdet wird."
    },
    {
      "date": "2024-09-27",
      "original_text": "Registerbekanntmachung nach dem Umwandlungsgesetz\nHamburg Amtsgericht Hamburg HRB 96405\nFaltschachtel Hamburg dyecut GmbH – Hamburg",
      "type": "Registerbekanntmachung nach dem Umwandlungsgesetz",
      "state": "Hamburg",
      "amtsgericht": "Amtsgericht Hamburg",
      "registernummer": "HRB 96405",
      "registerart": "HRB",
      "company_name": "Faltschachtel Hamburg dyecut GmbH",
      "company_seat": "Hamburg",
      "details": "27.09.2024 (Bekanntmachungsdatum)\n\nHamburg Amtsgericht Hamburg HRB 96405\nRegisterbekanntmachung nach dem Umwandlungsgesetz 27.09.2024 (Eintragungsdatum)\n\nFaltschachtel Hamburg dyecut GmbH\nGesellschaft mit beschränkter Haftung\nHamburg\n\nAls nicht eingetragen wird bekannt gemacht:\nDen Gläubigern der an der Verschmelzung beteiligten Gesellschaften ist, wenn sie binnen sechs Monaten nach dem Tag, an dem die Eintragung der Verschmelzung in das Register des Sitzes desjenigen Rechtsträgers, dessen Gläubiger sie sind, nach § 19 Absatz 3 UmwG als bekannt gemacht gilt, ihren Anspruch nach Grund und Höhe schriftlich anmelden, Sicherheit zu leisten, soweit sie nicht Befriedigung verlangen können. Dieses Recht steht den Gläubigern jedoch nur zu, wenn sie glaubhaft machen, dass durch die Verschmelzung die Erfüllung ihrer Forderung gefährdet wird."
    },
    {
      "date": "2024-09-27",
      "original_text": "Löschungsankündigung\nNiedersachsen Amtsgericht Lüneburg HRB 209456\nFeinfood24 UG (haftungsbeschränkt) – Bergen",
      "type": "Löschungsankündigung",
      "state": "Niedersachsen",
      "amtsgericht": "Amtsgericht Lüneburg",
      "registernummer": "HRB 209456",
      "registerart": "HRB",
      "company_name": "Feinfood24 UG (haftungsbeschränkt)",
      "company_seat": "Bergen",
      "details": "27.09.2024 (Bekanntmachungsdatum)\n\nNiedersachsen Amtsgericht Lüneburg HRB 209456\nLöschungsankündigung\n\nFeinfood24 UG (haftungsbeschränkt)\nGesellschaft mit beschränkter Haftung\nBergen\n\nDas Registergericht beabsichtigt, die Gesellschaft von Amts wegen nach § 394 FamFG zu löschen. Die Frist zur Erhebung eines Widerspruchs ist auf 1 Monat ab dieser Registerbekanntmachung festgesetzt."
    },
    {
      "date": "2024-09-27",
      "original_text": "Registerbekanntmachung nach dem Umwandlungsgesetz\nNiedersachsen Amtsgericht Oldenburg (Oldenburg) HRB 215245\nFlorado GmbH – Bad Zwischenahn",
      "type": "Registerbekanntmachung nach dem Umwandlungsgesetz",
      "state": "Niedersachsen",
      "amtsgericht": "Amtsgericht Oldenburg (Oldenburg)",
      "registernummer": "HRB 215245",
      "registerart": "HRB",
      "company_name": "Florado GmbH",
      "company_seat": "Bad Zwischenahn",
      "details": "27.09.2024 (Bekanntmachungsdatum)\n\nNiedersachsen Amtsgericht Oldenburg (Oldenburg) HRB 215245\nRegisterbekanntmachung nach dem Umwandlungsgesetz 27.09.2024 (Eintragungsdatum)\n\nFlorado GmbH\nGesellschaft mit beschränkter Haftung\nBad Zwischenahn\n\nDen Gläubigern der an der Verschmelzung beteiligten Rechtsträger ist, wenn sie binnen sechs Monaten nach dem Tag, an dem die Eintragung der Verschmelzung in das Register des Sitzes desjenigen Rechtsträgers, dessen Gläubiger sie sind, nach § 19  Abs.  3 UmwG als bekannt gemacht gilt, ihren Anspruch nach Grund und Höhe schriftlich anmelden, Sicherheit zu leisten, soweit sie nicht Befriedigung verlangen können. Dieses Recht steht den Gläubigern jedoch nur zu, wenn sie glaubhaft machen, dass durch die Verschmelzung die Erfüllung der Forderung gefährdet wird."
    },
    {
      "date": "2024-09-27",
      "original_text": "Registerbekanntmachung nach dem Umwandlungsgesetz\nBayern Amtsgericht Nürnberg HRB 29130\nFranken Stuck Müller GmbH – Nürnberg",
      "type": "Registerbekanntmachung nach dem Umwandlungsgesetz",
      "state": "Bayern",
      "amtsgericht": "Amtsgericht Nürnberg",
      "registernummer": "HRB 29130",
      "registerart": "HRB",
      "company_name": "Franken Stuck Müller GmbH",
      "company_seat": "Nürnberg",
      "details": "27.09.2024 (Bekanntmachungsdatum)\n\nBayern Amtsgericht Nürnberg HRB 29130\nRegisterbekanntmachung nach dem Umwandlungsgesetz 26.09.2024 (Eintragungsdatum)\n\nFranken Stuck Müller GmbH\nGesellschaft mit beschränkter Haftung\nNürnberg\n\nDen Gläubigern der an der Verschmelzung beteiligten Rechtsträger ist, wenn sie binnen sechs Monaten nach dem Tag, an dem die Eintragung der Verschmelzung in das Register des Sitzes desjenigen Rechtsträgers, dessen Gläubiger sie sind, nach § 19 Abs. 3 UmwG als bekannt gemacht gilt, ihren Anspruch nach Grund und Höhe schriftlich anmelden, Sicherheit zu leisten, soweit sie nicht Befriedigung verlangen können. Dieses Recht steht den Gläubigern jedoch nur zu, wenn sie glaubhaft machen, dass durch die Verschmelzung die Erfüllung ihrer Forderung gefährdet wird."
    },
    {
      "date": "2024-09-27",
      "original_text": "Registerbekanntmachung nach dem Umwandlungsgesetz\nNordrhein-Westfalen Amtsgericht Köln HRB 40240\nGALVACHEM Chemiehandelsgesellschaft mbH – Kerpen",
      "type": "Registerbekanntmachung nach dem Umwandlungsgesetz",
      "state": "Nordrhein-Westfalen",
      "amtsgericht": "Amtsgericht Köln",
      "registernummer": "HRB 40240",
      "registerart": "HRB",
      "company_name": "GALVACHEM Chemiehandelsgesellschaft mbH",
      "company_seat": "Kerpen",
      "details": "27.09.2024 (Bekanntmachungsdatum)\n\nNordrhein-Westfalen Amtsgericht Köln HRB 40240\nRegisterbekanntmachung nach dem Umwandlungsgesetz 27.09.2024 (Eintragungsdatum)\n\nGALVACHEM Chemiehandelsgesellschaft mbH\nGesellschaft mit beschränkter Haftung\nKerpen\n\nDen Gläubigern der an der Verschmelzung beteiligten Rechtsträger ist, wenn sie binnen sechs Monaten nach dem Tag, an dem die Eintragung der Verschmelzung in das Register des Sitzes desjenigen Rechtsträgers, dessen Gläubiger sie sind, nach § 19 Absatz 3 UmwG als bekanntgemacht gilt, ihren Anspruch nach Grund und Höhe schriftlich anmelden, Sicherheit zu leisten, soweit sie nicht Befriedigung verlangen können. Dieses Recht steht den Gläubigern jedoch nur zu, wenn sie glaubhaft machen, dass durch die Verschmelzung die Erfüllung ihrer Forderung gefährdet wird."
    },
    {
      "date": "2024-09-27",
      "original_text": "Einreichung neuer Dokumente\nHessen Amtsgericht Wetzlar HRB 15\nGEWOBAU - Gesellschaft für Wohnen und Bauen mbH – Wetzlar",
      "type": "Einreichung neuer Dokumente",
      "state": "Hessen",
      "amtsgericht": "Amtsgericht Wetzlar",
      "registernummer": "HRB 15",
      "registerart": "HRB",
      "company_name": "GEWOBAU - Gesellschaft für Wohnen und Bauen mbH",
      "company_seat": "Wetzlar",
      "details": "27.09.2024 (Bekanntmachungsdatum)\n\nHessen Amtsgericht Wetzlar HRB 15\nEinreichung neuer Dokumente\n\nGEWOBAU - Gesellschaft für Wohnen und Bauen mbH\nGesellschaft mit beschränkter Haftung\nWetzlar\n\nDurch eine Änderung in den Personen der Aufsichtsratsmitglieder ist eine Liste der Mitglieder des Aufsichtsrates zum Handelsregister eingereicht worden."
    },
    {
      "date": "2024-09-27",
      "original_text": "Registerbekanntmachung nach dem Umwandlungsgesetz\nNordrhein-Westfalen Amtsgericht Bonn HRB 20946\nGKM GmbH Steuerberatungsgesellschaft – Bonn",
      "type": "Registerbekanntmachung nach dem Umwandlungsgesetz",
      "state": "Nordrhein-Westfalen",
      "amtsgericht": "Amtsgericht Bonn",
      "registernummer": "HRB 20946",
      "registerart": "HRB",
      "company_name": "GKM GmbH Steuerberatungsgesellschaft",
      "company_seat": "Bonn",
      "details": "27.09.2024 (Bekanntmachungsdatum)\n\nNordrhein-Westfalen Amtsgericht Bonn HRB 20946\nRegisterbekanntmachung nach dem Umwandlungsgesetz 27.09.2024 (Eintragungsdatum)\n\nGKM GmbH Steuerberatungsgesellschaft\nGesellschaft mit beschränkter Haftung\nBonn\n\nDen Gläubigern der an der Verschmelzung beteiligten Rechtsträger ist, wenn sie binnen sechs Monaten nach dem Tag, an dem die Eintragung der Verschmelzung in das Register des Sitzes desjenigen Rechtsträgers, dessen Gläubiger sie sind, nach § 19 Absatz 3 UmwG als bekanntgemacht gilt, ihren Anspruch nach Grund und Höhe schriftlich anmelden, Sicherheit zu leisten, soweit sie nicht Befriedigung verlangen können. Dieses Recht steht den Gläubigern jedoch nur zu, wenn sie glaubhaft machen, dass durch die Verschmelzung die Erfüllung ihrer Forderung gefährdet wird."
    },
    {
      "date": "2024-09-27",
      "original_text": "Registerbekanntmachung nach dem Umwandlungsgesetz\nNordrhein-Westfalen Amtsgericht Bonn HRB 20945\nGKM Holding GmbH Steuerberatungsgesellschaft – Bonn",
      "type": "Registerbekanntmachung nach dem Umwandlungsgesetz",
      "state": "Nordrhein-Westfalen",
      "amtsgericht": "Amtsgericht Bonn",
      "registernummer": "HRB 20945",
      "registerart": "HRB",
      "company_name": "GKM Holding GmbH Steuerberatungsgesellschaft",
      "company_seat": "Bonn",
      "details": "27.09.2024 (Bekanntmachungsdatum)\n\nNordrhein-Westfalen Amtsgericht Bonn HRB 20945\nRegisterbekanntmachung nach dem Umwandlungsgesetz 27.09.2024 (Eintragungsdatum)\n\nGKM Holding GmbH Steuerberatungsgesellschaft\nGesellschaft mit beschränkter Haftung\nBonn\n\nDen Gläubigern der an der Verschmelzung beteiligten Rechtsträger ist, wenn sie binnen sechs Monaten nach dem Tag, an dem die Eintragung der Verschmelzung in das Register des Sitzes desjenigen Rechtsträgers, dessen Gläubiger sie sind, nach § 19 Absatz 3 UmwG als bekanntgemacht gilt, ihren Anspruch nach Grund und Höhe schriftlich anmelden, Sicherheit zu leisten, soweit sie nicht Befriedigung verlangen können. Dieses Recht steht den Gläubigern jedoch nur zu, wenn sie glaubhaft machen, dass durch die Verschmelzung die Erfüllung ihrer Forderung gefährdet wird."
    },
    {
      "date": "2024-09-27",
      "original_text": "Registerbekanntmachung nach dem Umwandlungsgesetz\nHamburg Amtsgericht Hamburg HRB 148320\nGRG Immobilien GmbH – Hamburg",
      "type": "Registerbekanntmachung nach dem Umwandlungsgesetz",
      "state": "Hamburg",
      "amtsgericht": "Amtsgericht Hamburg",
      "registernummer": "HRB 148320",
      "registerart": "HRB",
      "company_name": "GRG Immobilien GmbH",
      "company_seat": "Hamburg",
      "details": "27.09.2024 (Bekanntmachungsdatum)\n\nHamburg Amtsgericht Hamburg HRB 148320\nRegisterbekanntmachung nach dem Umwandlungsgesetz 27.09.2024 (Eintragungsdatum)\n\nGRG Immobilien GmbH\nGesellschaft mit beschränkter Haftung\nHamburg\n\nAls nicht eingetragen wird bekannt gemacht:\nDen Gläubigern der an der Verschmelzung beteiligten Gesellschaften ist, wenn sie binnen sechs Monaten nach dem Tag, an dem die Eintragung der Verschmelzung in das Register des Sitzes desjenigen Rechtsträgers, dessen Gläubiger sie sind, nach § 19 Absatz 3 UmwG als bekannt gemacht gilt, ihren Anspruch nach Grund und Höhe schriftlich anmelden, Sicherheit zu leisten, soweit sie nicht Befriedigung verlangen können. Dieses Recht steht den Gläubigern jedoch nur zu, wenn sie glaubhaft machen, dass durch die Verschmelzung die Erfüllung ihrer Forderung gefährdet wird."
    },
    {
      "date": "2024-09-27",
      "original_text": "Sonstige Registerbekanntmachung\nBayern Amtsgericht Kempten (Allgäu) HRB 13498\nGabler-Saliter Bankgeschäft AG – Obergünzburg",
      "type": "Sonstige Registerbekanntmachung",
      "state": "Bayern",
      "amtsgericht": "Amtsgericht Kempten (Allgäu)",
      "registernummer": "HRB 13498",
      "registerart": "HRB",
      "company_name": "Gabler-Saliter Bankgeschäft AG",
      "company_seat": "Obergünzburg",
      "details": "27.09.2024 (Bekanntmachungsdatum)\n\nBayern Amtsgericht Kempten (Allgäu) HRB 13498\nSonstige Registerbekanntmachung 28.08.2024 (Eintragungsdatum)\n\nGabler-Saliter Bankgeschäft AG\nAktiengesellschaft\nObergünzburg\n\nDen Gläubigern der Gesellschaft, deren Forderungen begründet worden sind, bevor die Eintragung des Beschlusses bekanntgemacht worden ist, ist, wenn sie sich binnen sechs Monaten nach der Bekanntmachung zu diesem Zweck melden, Sicherheit zu leisten, soweit sie nicht Befriedigung verlangen können. Das Recht, Sicherheitsleistung zu verlangen, steht Gläubigern nicht zu, die im Fall des Insolvenzverfahrens ein Recht auf vorzugsweise Befriedigung aus einer Deckungsmasse haben, die nach gesetzlicher Vorschrift zu ihrem Schutz errichtet und staatlich überwacht ist."
    },
    {
      "date": "2024-09-27",
      "original_text": "Registerbekanntmachung nach dem Umwandlungsgesetz\nBayern Amtsgericht München HRA 119867\nGabriele Eser e.K. – Odelzhausen",
      "type": "Registerbekanntmachung nach dem Umwandlungsgesetz",
      "state": "Bayern",
      "amtsgericht": "Amtsgericht München",
      "registernummer": "HRA 119867",
      "registerart": "HRA",
      "company_name": "Gabriele Eser e.K.",
      "company_seat": "Odelzhausen",
      "details": "27.09.2024 (Bekanntmachungsdatum)\n\nBayern Amtsgericht München HRA 119867\nRegisterbekanntmachung nach dem Umwandlungsgesetz 26.09.2024 (Eintragungsdatum)\n\nGabriele Eser e.K.\nEinzelkaufmann / Einzelkauffrau\nOdelzhausen\n\nDen Gläubigern der an der Ausgliederung beteiligten Rechtsträger ist, wenn sie binnen sechs Monaten nach dem Tag, an dem die Eintragung der Ausgliederung in das Register des Sitzes desjenigen Rechtsträgers, dessen Gläubiger sie sind, nach §§ 125, 19 Abs. 3 UmwG als bekannt gemacht gilt, ihren Anspruch nach Grund und Höhe schriftlich anmelden, Sicherheit zu leisten, soweit sie nicht Befriedigung verlangen können. Dieses Recht steht den Gläubigern jedoch nur zu, wenn sie glaubhaft machen, dass durch die Ausgliederung die Erfüllung ihrer Forderung gefährdet wird."
    },
    {
      "date": "2024-09-27",
      "original_text": "Einreichung neuer Dokumente\nNiedersachsen Amtsgericht Walsrode HRB 211647\nGemeinnützige Gesellschaft für Service und Dienstleistungen des DRK Kreisverbandes Fallingbostel mbH – Walsrode",
      "type": "Einreichung neuer Dokumente",
      "state": "Niedersachsen",
      "amtsgericht": "Amtsgericht Walsrode",
      "registernummer": "HRB 211647",
      "registerart": "HRB",
      "company_name": "Gemeinnützige Gesellschaft für Service und Dienstleistungen des DRK Kreisverbandes Fallingbostel mbH",
      "company_seat": "Walsrode",
      "details": "27.09.2024 (Bekanntmachungsdatum)\n\nNiedersachsen Amtsgericht Walsrode HRB 211647\nEinreichung neuer Dokumente\n\nGemeinnützige Gesellschaft für Service und Dienstleistungen des DRK Kreisverbandes Fallingbostel mbH\nGesellschaft mit beschränkter Haftung\nWalsrode\n\nDie Liste der Mitglieder des Aufsichtsrats wurde beim Registergericht eingereicht."
    },
    {
      "date": "2024-09-27",
      "original_text": "Registerbekanntmachung nach dem Umwandlungsgesetz\nNiedersachsen Amtsgericht Oldenburg (Oldenburg) HRB 208499\nGreen Solutions Datenservice GmbH – Bad Zwischenahn",
      "type": "Registerbekanntmachung nach dem Umwandlungsgesetz",
      "state": "Niedersachsen",
      "amtsgericht": "Amtsgericht Oldenburg (Oldenburg)",
      "registernummer": "HRB 208499",
      "registerart": "HRB",
      "company_name": "Green Solutions Datenservice GmbH",
      "company_seat": "Bad Zwischenahn",
      "details": "27.09.2024 (Bekanntmachungsdatum)\n\nNiedersachsen Amtsgericht Oldenburg (Oldenburg) HRB 208499\nRegisterbekanntmachung nach dem Umwandlungsgesetz 27.09.2024 (Eintragungsdatum)\n\nGreen Solutions Datenservice GmbH\nGesellschaft mit beschränkter Haftung\nBad Zwischenahn\n\nDen Gläubigern der an der Verschmelzung beteiligten Rechtsträger ist, wenn sie binnen sechs Monaten nach dem Tag, an dem die Eintragung der Verschmelzung in das Register des Sitzes desjenigen Rechtsträgers, dessen Gläubiger sie sind, nach § 19  Abs.  3 UmwG als bekannt gemacht gilt, ihren Anspruch nach Grund und Höhe schriftlich anmelden, Sicherheit zu leisten, soweit sie nicht Befriedigung verlangen können. Dieses Recht steht den Gläubigern jedoch nur zu, wenn sie glaubhaft machen, dass durch die Verschmelzung die Erfüllung der Forderung gefährdet wird."
    },
    {
      "date": "2024-09-27",
      "original_text": "Registerbekanntmachung nach dem Umwandlungsgesetz\nNiedersachsen Amtsgericht Oldenburg (Oldenburg) HRB 206510\nGreen Solutions Marketing GmbH – Bad Zwischenahn",
      "type": "Registerbekanntmachung nach dem Umwandlungsgesetz",
      "state": "Niedersachsen",
      "amtsgericht": "Amtsgericht Oldenburg (Oldenburg)",
      "registernummer": "HRB 206510",
      "registerart": "HRB",
      "company_name": "Green Solutions Marketing GmbH",
      "company_seat": "Bad Zwischenahn",
      "details": "27.09.2024 (Bekanntmachungsdatum)\n\nNiedersachsen Amtsgericht Oldenburg (Oldenburg) HRB 206510\nRegisterbekanntmachung nach dem Umwandlungsgesetz 27.09.2024 (Eintragungsdatum)\n\nGreen Solutions Marketing GmbH\nGesellschaft mit beschränkter Haftung\nBad Zwischenahn\n\nDen Gläubigern der an der Verschmelzung beteiligten Rechtsträger ist, wenn sie binnen sechs Monaten nach dem Tag, an dem die Eintragung der Verschmelzung in das Register des Sitzes desjenigen Rechtsträgers, dessen Gläubiger sie sind, nach § 19  Abs.  3 UmwG als bekannt gemacht gilt, ihren Anspruch nach Grund und Höhe schriftlich anmelden, Sicherheit zu leisten, soweit sie nicht Befriedigung verlangen können. Dieses Recht steht den Gläubigern jedoch nur zu, wenn sie glaubhaft machen, dass durch die Verschmelzung die Erfüllung der Forderung gefährdet wird."
    },
    {
      "date": "2024-09-27",
      "original_text": "Registerbekanntmachung nach dem Umwandlungsgesetz\nNiedersachsen Amtsgericht Oldenburg (Oldenburg) HRB 215319\nGreen Solutions Online GmbH – Bad Zwischenahn",
      "type": "Registerbekanntmachung nach dem Umwandlungsgesetz",
      "state": "Niedersachsen",
      "amtsgericht": "Amtsgericht Oldenburg (Oldenburg)",
      "registernummer": "HRB 215319",
      "registerart": "HRB",
      "company_name": "Green Solutions Online GmbH",
      "company_seat": "Bad Zwischenahn",
      "details": "27.09.2024 (Bekanntmachungsdatum)\n\nNiedersachsen Amtsgericht Oldenburg (Oldenburg) HRB 215319\nRegisterbekanntmachung nach dem Umwandlungsgesetz 27.09.2024 (Eintragungsdatum)\n\nGreen Solutions Online GmbH\nGesellschaft mit beschränkter Haftung\nBad Zwischenahn\n\nDen Gläubigern der an der Verschmelzung beteiligten Rechtsträger ist, wenn sie binnen sechs Monaten nach dem Tag, an dem die Eintragung der Verschmelzung in das Register des Sitzes desjenigen Rechtsträgers, dessen Gläubiger sie sind, nach § 19  Abs.  3 UmwG als bekannt gemacht gilt, ihren Anspruch nach Grund und Höhe schriftlich anmelden, Sicherheit zu leisten, soweit sie nicht Befriedigung verlangen können. Dieses Recht steht den Gläubigern jedoch nur zu, wenn sie glaubhaft machen, dass durch die Verschmelzung die Erfüllung der Forderung gefährdet wird."
    },
    {
      "date": "2024-09-27",
      "original_text": "Registerbekanntmachung nach dem Umwandlungsgesetz\nNiedersachsen Amtsgericht Oldenburg (Oldenburg) HRB 206744\nGreen Solutions Software GmbH – Bad Zwischenahn",
      "type": "Registerbekanntmachung nach dem Umwandlungsgesetz",
      "state": "Niedersachsen",
      "amtsgericht": "Amtsgericht Oldenburg (Oldenburg)",
      "registernummer": "HRB 206744",
      "registerart": "HRB",
      "company_name": "Green Solutions Software GmbH",
      "company_seat": "Bad Zwischenahn",
      "details": "27.09.2024 (Bekanntmachungsdatum)\n\nNiedersachsen Amtsgericht Oldenburg (Oldenburg) HRB 206744\nRegisterbekanntmachung nach dem Umwandlungsgesetz 27.09.2024 (Eintragungsdatum)\n\nGreen Solutions Software GmbH\nGesellschaft mit beschränkter Haftung\nBad Zwischenahn\n\nDen Gläubigern der an der Verschmelzung beteiligten Rechtsträger ist, wenn sie binnen sechs Monaten nach dem Tag, an dem die Eintragung der Verschmelzung in das Register des Sitzes desjenigen Rechtsträgers, dessen Gläubiger sie sind, nach § 19  Abs.  3 UmwG als bekannt gemacht gilt, ihren Anspruch nach Grund und Höhe schriftlich anmelden, Sicherheit zu leisten, soweit sie nicht Befriedigung verlangen können. Dieses Recht steht den Gläubigern jedoch nur zu, wenn sie glaubhaft machen, dass durch die Verschmelzung die Erfüllung der Forderung gefährdet wird."
    },
    {
      "date": "2024-09-27",
      "original_text": "Registerbekanntmachung nach dem Umwandlungsgesetz\nNiedersachsen Amtsgericht Oldenburg (Oldenburg) HRB 206744\nGreen Solutions Software GmbH – Bad Zwischenahn",
      "type": "Registerbekanntmachung nach dem Umwandlungsgesetz",
      "state": "Niedersachsen",
      "amtsgericht": "Amtsgericht Oldenburg (Oldenburg)",
      "registernummer": "HRB 206744",
      "registerart": "HRB",
      "company_name": "Green Solutions Software GmbH",
      "company_seat": "Bad Zwischenahn",
      "details": "27.09.2024 (Bekanntmachungsdatum)\n\nNiedersachsen Amtsgericht Oldenburg (Oldenburg) HRB 206744\nRegisterbekanntmachung nach dem Umwandlungsgesetz 27.09.2024 (Eintragungsdatum)\n\nGreen Solutions Software GmbH\nGesellschaft mit beschränkter Haftung\nBad Zwischenahn\n\nDen Gläubigern der an der Verschmelzung beteiligten Rechtsträger ist, wenn sie binnen sechs Monaten nach dem Tag, an dem die Eintragung der Verschmelzung in das Register des Sitzes desjenigen Rechtsträgers, dessen Gläubiger sie sind, nach § 19  Abs.  3 UmwG als bekannt gemacht gilt, ihren Anspruch nach Grund und Höhe schriftlich anmelden, Sicherheit zu leisten, soweit sie nicht Befriedigung verlangen können. Dieses Recht steht den Gläubigern jedoch nur zu, wenn sie glaubhaft machen, dass durch die Verschmelzung die Erfüllung der Forderung gefährdet wird."
    },
    {
      "date": "2024-09-27",
      "original_text": "Registerbekanntmachung nach dem Umwandlungsgesetz\nNiedersachsen Amtsgericht Oldenburg (Oldenburg) HRB 206744\nGreen Solutions Software GmbH – Bad Zwischenahn",
      "type": "Registerbekanntmachung nach dem Umwandlungsgesetz",
      "state": "Niedersachsen",
      "amtsgericht": "Amtsgericht Oldenburg (Oldenburg)",
      "registernummer": "HRB 206744",
      "registerart": "HRB",
      "company_name": "Green Solutions Software GmbH",
      "company_seat": "Bad Zwischenahn",
      "details": "27.09.2024 (Bekanntmachungsdatum)\n\nNiedersachsen Amtsgericht Oldenburg (Oldenburg) HRB 206744\nRegisterbekanntmachung nach dem Umwandlungsgesetz 27.09.2024 (Eintragungsdatum)\n\nGreen Solutions Software GmbH\nGesellschaft mit beschränkter Haftung\nBad Zwischenahn\n\nDen Gläubigern der an der Verschmelzung beteiligten Rechtsträger ist, wenn sie binnen sechs Monaten nach dem Tag, an dem die Eintragung der Verschmelzung in das Register des Sitzes desjenigen Rechtsträgers, dessen Gläubiger sie sind, nach § 19  Abs.  3 UmwG als bekannt gemacht gilt, ihren Anspruch nach Grund und Höhe schriftlich anmelden, Sicherheit zu leisten, soweit sie nicht Befriedigung verlangen können. Dieses Recht steht den Gläubigern jedoch nur zu, wenn sie glaubhaft machen, dass durch die Verschmelzung die Erfüllung der Forderung gefährdet wird."
    },
    {
      "date": "2024-09-27",
      "original_text": "Registerbekanntmachung nach dem Umwandlungsgesetz\nNiedersachsen Amtsgericht Oldenburg (Oldenburg) HRB 206744\nGreen Solutions Software GmbH – Bad Zwischenahn",
      "type": "Registerbekanntmachung nach dem Umwandlungsgesetz",
      "state": "Niedersachsen",
      "amtsgericht": "Amtsgericht Oldenburg (Oldenburg)",
      "registernummer": "HRB 206744",
      "registerart": "HRB",
      "company_name": "Green Solutions Software GmbH",
      "company_seat": "Bad Zwischenahn",
      "details": "27.09.2024 (Bekanntmachungsdatum)\n\nNiedersachsen Amtsgericht Oldenburg (Oldenburg) HRB 206744\nRegisterbekanntmachung nach dem Umwandlungsgesetz 27.09.2024 (Eintragungsdatum)\n\nGreen Solutions Software GmbH\nGesellschaft mit beschränkter Haftung\nBad Zwischenahn\n\nDen Gläubigern der an der Verschmelzung beteiligten Rechtsträger ist, wenn sie binnen sechs Monaten nach dem Tag, an dem die Eintragung der Verschmelzung in das Register des Sitzes desjenigen Rechtsträgers, dessen Gläubiger sie sind, nach § 19  Abs.  3 UmwG als bekannt gemacht gilt, ihren Anspruch nach Grund und Höhe schriftlich anmelden, Sicherheit zu leisten, soweit sie nicht Befriedigung verlangen können. Dieses Recht steht den Gläubigern jedoch nur zu, wenn sie glaubhaft machen, dass durch die Verschmelzung die Erfüllung der Forderung gefährdet wird."
    },
    {
      "date": "2024-09-27",
      "original_text": "Registerbekanntmachung nach dem Umwandlungsgesetz\nRheinland-Pfalz Amtsgericht Ludwigshafen a.Rhein (Ludwigshafen) HRB 69753\nGuteDaten GmbH – Ludwigshafen am Rhein",
      "type": "Registerbekanntmachung nach dem Umwandlungsgesetz",
      "state": "Rheinland-Pfalz",
      "amtsgericht": "Amtsgericht Ludwigshafen a.Rhein (Ludwigshafen)",
      "registernummer": "HRB 69753",
      "registerart": "HRB",
      "company_name": "GuteDaten GmbH",
      "company_seat": "Ludwigshafen am Rhein",
      "details": "27.09.2024 (Bekanntmachungsdatum)\n\nRheinland-Pfalz Amtsgericht Ludwigshafen a.Rhein (Ludwigshafen) HRB 69753\nRegisterbekanntmachung nach dem Umwandlungsgesetz 27.09.2024 (Eintragungsdatum)\n\nGuteDaten GmbH\nGesellschaft mit beschränkter Haftung\nLudwigshafen am Rhein\n\nAls nicht eingetragen wird veröffentlicht: Den Gläubigern der an der Ausgliederung beteiligten Rechtsträger ist, wenn sie binnen sechs Monaten nach dem Tag, an dem die Eintragung der Ausgliederung in das Register des Sitzes desjenigen Rechtsträgers,dessen Gläubiger sie sind, nach § 19 Abs. 3 UmwG als bekannt gemacht gilt, ihren Anspruch nach Grund und Höhe schriftlich anmelden, Sicherheit zu leisten, soweit sie nicht Befriedigung verlangen können. Dieses Recht steht den Gläubigern jedoch nur zu, wenn sie glaubhaft machen, dass durch die Ausgliederung die Erfüllung der Forderung gefährdet wird."
    },
    {
      "date": "2024-09-27",
      "original_text": "Registerbekanntmachung nach dem Umwandlungsgesetz\nSachsen Amtsgericht Dresden HRA 11545\nGünter Prötzig Familien KG – Rothenburg/Oberlausitz",
      "type": "Registerbekanntmachung nach dem Umwandlungsgesetz",
      "state": "Sachsen",
      "amtsgericht": "Amtsgericht Dresden",
      "registernummer": "HRA 11545",
      "registerart": "HRA",
      "company_name": "Günter Prötzig Familien KG",
      "company_seat": "Rothenburg/Oberlausitz",
      "details": "27.09.2024 (Bekanntmachungsdatum)\n\nSachsen Amtsgericht Dresden HRA 11545\nRegisterbekanntmachung nach dem Umwandlungsgesetz 27.09.2024 (Eintragungsdatum)\n\nGünter Prötzig Familien KG\nKommanditgesellschaft\nRothenburg/Oberlausitz\n\nDen Gläubigern der an der Ausgliederung beteiligten Rechtsträger ist, wenn sie binnen sechs Monaten nach dem Tag, an dem die Eintragung der Ausgliederung in das Register des Sitzes desjenigen Rechtsträgers, dessen Gläubiger sie sind, nach § 19 Abs. 3 UmwG als bekannt gemacht gilt, ihren Anspruch nach Grund und Höhe schriftlich anmelden, Sicherheit zu leisten, soweit sie nicht Befriedigung verlangen können. Dieses Recht steht den Gläubigern jedoch nur zu, wenn sie glaubhaft machen, dass durch die Ausgliederung die Erfüllung der Forderung gefährdet wird."
    },
    {
      "date": "2024-09-27",
      "original_text": "Registerbekanntmachung nach dem Umwandlungsgesetz\nBaden-Württemberg Amtsgericht Ulm HRB 745054\nHA&SE UG (haftungsbeschränkt) – Wört",
      "type": "Registerbekanntmachung nach dem Umwandlungsgesetz",
      "state": "Baden-Württemberg",
      "amtsgericht": "Amtsgericht Ulm",
      "registernummer": "HRB 745054",
      "registerart": "HRB",
      "company_name": "HA&SE UG (haftungsbeschränkt)",
      "company_seat": "Wört",
      "details": "27.09.2024 (Bekanntmachungsdatum)\n\nBaden-Württemberg Amtsgericht Ulm HRB 745054\nRegisterbekanntmachung nach dem Umwandlungsgesetz 27.09.2024 (Eintragungsdatum)\n\nHA&SE UG (haftungsbeschränkt)\nGesellschaft mit beschränkter Haftung\nWört\n\nAls nicht eingetragen wird bekanntgemacht:\nDen Gläubigern der an der Verschmelzung beteiligten Rechtsträger ist, wenn sie binnen sechs Monaten nach dem Tag, an dem die Eintragung der Verschmelzung in das Register des Sitzes desjenigen Rechtsträgers, dessen Gläubiger sie sind, nach § 19 Abs. 3 UmwG als bekanntgemacht gilt, ihren Anspruch nach Grund und Höhe schriftlich anmelden, Sicherheit zu leisten, soweit sie nicht Befriedigung verlangen können. Dieses Recht steht den Gläubigern jedoch nur zu, wenn sie glaubhaft machen, dass durch die Verschmelzung die Erfüllung ihrer Forderung gefährdet wird."
    },
    {
      "date": "2024-09-27",
      "original_text": "Einreichung neuer Dokumente\nBerlin Amtsgericht Berlin (Charlottenburg) HRB 142168\nHELIOS Beteiligungs Aktiengesellschaft – Berlin",
      "type": "Einreichung neuer Dokumente",
      "state": "Berlin",
      "amtsgericht": "Amtsgericht Berlin (Charlottenburg)",
      "registernummer": "HRB 142168",
      "registerart": "HRB",
      "company_name": "HELIOS Beteiligungs Aktiengesellschaft",
      "company_seat": "Berlin",
      "details": "27.09.2024 (Bekanntmachungsdatum)\n\nBerlin Amtsgericht Berlin (Charlottenburg) HRB 142168\nEinreichung neuer Dokumente\n\nHELIOS Beteiligungs Aktiengesellschaft\nAktiengesellschaft\nBerlin\n\nAls nicht eingetragen wird veröffentlicht: Es wurde eine neue Liste der Aufsichtsratsmitglieder eingereicht (§ 106 AktG)."
    },
    {
      "date": "2024-09-27",
      "original_text": "Löschungsankündigung\nHessen Amtsgericht Offenbach am Main HRB 52157\nHM GmbH – Obertshausen",
      "type": "Löschungsankündigung",
      "state": "Hessen",
      "amtsgericht": "Amtsgericht Offenbach am Main",
      "registernummer": "HRB 52157",
      "registerart": "HRB",
      "company_name": "HM GmbH",
      "company_seat": "Obertshausen",
      "details": "27.09.2024 (Bekanntmachungsdatum)\n\nHessen Amtsgericht Offenbach am Main HRB 52157\nLöschungsankündigung\n\nHM GmbH\nGesellschaft mit beschränkter Haftung\nObertshausen\n\nDas Registergericht beabsichtigt die im Handelsregister eingetragene Gesellschaft von Amts wegen nach § 394 FamFG zu löschen. Die Frist zur Erhebung eines Widerspruchs gegen die beabsichtigte Löschung wird auf 3 Monate festgesetzt."
    },
    {
      "date": "2024-09-27",
      "original_text": "Registerbekanntmachung nach dem Umwandlungsgesetz\nHamburg Amtsgericht Hamburg HRB 133069\nHMB Hamburg Marine Insurance Brokers GmbH – Hamburg",
      "type": "Registerbekanntmachung nach dem Umwandlungsgesetz",
      "state": "Hamburg",
      "amtsgericht": "Amtsgericht Hamburg",
      "registernummer": "HRB 133069",
      "registerart": "HRB",
      "company_name": "HMB Hamburg Marine Insurance Brokers GmbH",
      "company_seat": "Hamburg",
      "details": "27.09.2024 (Bekanntmachungsdatum)\n\nHamburg Amtsgericht Hamburg HRB 133069\nRegisterbekanntmachung nach dem Umwandlungsgesetz 27.09.2024 (Eintragungsdatum)\n\nHMB Hamburg Marine Insurance Brokers GmbH\nGesellschaft mit beschränkter Haftung\nHamburg\n\nAls nicht eingetragen wird bekannt gemacht:\nDen Gläubigern der an der Verschmelzung beteiligten Gesellschaften ist, wenn sie binnen sechs Monaten nach dem Tag, an dem die Eintragung der Verschmelzung in das Register des Sitzes desjenigen Rechtsträgers, dessen Gläubiger sie sind, nach § 19 Absatz 3 UmwG als bekannt gemacht gilt, ihren Anspruch nach Grund und Höhe schriftlich anmelden, Sicherheit zu leisten, soweit sie nicht Befriedigung verlangen können. Dieses Recht steht den Gläubigern jedoch nur zu, wenn sie glaubhaft machen, dass durch die Verschmelzung die Erfüllung ihrer Forderung gefährdet wird."
    },
    {
      "date": "2024-09-27",
      "original_text": "Einreichung neuer Dokumente\nBaden-Württemberg Amtsgericht Mannheim HRB 330004\nHeidelberger Druckmaschinen Aktiengesellschaft – Heidelberg",
      "type": "Einreichung neuer Dokumente",
      "state": "Baden-Württemberg",
      "amtsgericht": "Amtsgericht Mannheim",
      "registernummer": "HRB 330004",
      "registerart": "HRB",
      "company_name": "Heidelberger Druckmaschinen Aktiengesellschaft",
      "company_seat": "Heidelberg",
      "details": "27.09.2024 (Bekanntmachungsdatum)\n\nBaden-Württemberg Amtsgericht Mannheim HRB 330004\nEinreichung neuer Dokumente\n\nHeidelberger Druckmaschinen Aktiengesellschaft\nAktiengesellschaft\nHeidelberg\n\nDie Gesellschaft hat am 26.09.2024 die Liste über die Zusammensetzung des Aufsichtsrats zum Handelsregister eingereicht."
    },
    {
      "date": "2024-09-27",
      "original_text": "Registerbekanntmachung nach dem Umwandlungsgesetz\nThüringen Amtsgericht Jena HRB 510596\nHelios Logistik Mitte GmbH – Erfurt",
      "type": "Registerbekanntmachung nach dem Umwandlungsgesetz",
      "state": "Thüringen",
      "amtsgericht": "Amtsgericht Jena",
      "registernummer": "HRB 510596",
      "registerart": "HRB",
      "company_name": "Helios Logistik Mitte GmbH",
      "company_seat": "Erfurt",
      "details": "27.09.2024 (Bekanntmachungsdatum)\n\nThüringen Amtsgericht Jena HRB 510596\nRegisterbekanntmachung nach dem Umwandlungsgesetz 27.09.2024 (Eintragungsdatum)\n\nHelios Logistik Mitte GmbH\nGesellschaft mit beschränkter Haftung\nErfurt\n\nNicht eingetragen: Den Gläubigern der an der Verschmelzung beteiligten Rechtsträger, ist wenn sie binnen sechs Monaten nach dem Tag, an dem die Eintragung der Verschmelzung in das Register des Sitzes desjenigen Rechtsträgers, dessen Gläubiger sie sind,  nach § 19 Abs. 3 UmwG als bekanntgemacht gilt, ihren Anspruch nach Grund und Höhe schriftlich anmelden, Sicherheit zu leisten, soweit sie nicht Befriedigung verlangen können. Dieses Recht steht ihnen jedoch nur zu, wenn sie glaubhaft machen, daß durch die Verschmelzung die Erfüllung ihrer Forderung gefährdet wird."
    },
    {
      "date": "2024-09-27",
      "original_text": "Registerbekanntmachung nach dem Umwandlungsgesetz\nThüringen Amtsgericht Jena HRB 510596\nHelios Logistik Mitte GmbH – Erfurt",
      "type": "Registerbekanntmachung nach dem Umwandlungsgesetz",
      "state": "Thüringen",
      "amtsgericht": "Amtsgericht Jena",
      "registernummer": "HRB 510596",
      "registerart": "HRB",
      "company_name": "Helios Logistik Mitte GmbH",
      "company_seat": "Erfurt",
      "details": "27.09.2024 (Bekanntmachungsdatum)\n\nThüringen Amtsgericht Jena HRB 510596\nRegisterbekanntmachung nach dem Umwandlungsgesetz 27.09.2024 (Eintragungsdatum)\n\nHelios Logistik Mitte GmbH\nGesellschaft mit beschränkter Haftung\nErfurt\n\nNicht eingetragen: Den Gläubigern der an der Verschmelzung beteiligten Rechtsträger, ist wenn sie binnen sechs Monaten nach dem Tag, an dem die Eintragung der Verschmelzung in das Register des Sitzes desjenigen Rechtsträgers, dessen Gläubiger sie sind,  nach § 19 Abs. 3 UmwG als bekanntgemacht gilt, ihren Anspruch nach Grund und Höhe schriftlich anmelden, Sicherheit zu leisten, soweit sie nicht Befriedigung verlangen können. Dieses Recht steht ihnen jedoch nur zu, wenn sie glaubhaft machen, daß durch die Verschmelzung die Erfüllung ihrer Forderung gefährdet wird."
    },
    {
      "date": "2024-09-27",
      "original_text": "Registerbekanntmachung nach dem Umwandlungsgesetz\nThüringen Amtsgericht Jena HRB 510596\nHelios Logistik Mitte GmbH – Erfurt",
      "type": "Registerbekanntmachung nach dem Umwandlungsgesetz",
      "state": "Thüringen",
      "amtsgericht": "Amtsgericht Jena",
      "registernummer": "HRB 510596",
      "registerart": "HRB",
      "company_name": "Helios Logistik Mitte GmbH",
      "company_seat": "Erfurt",
      "details": "27.09.2024 (Bekanntmachungsdatum)\n\nThüringen Amtsgericht Jena HRB 510596\nRegisterbekanntmachung nach dem Umwandlungsgesetz 27.09.2024 (Eintragungsdatum)\n\nHelios Logistik Mitte GmbH\nGesellschaft mit beschränkter Haftung\nErfurt\n\nNicht eingetragen: Den Gläubigern der an der Verschmelzung beteiligten Rechtsträger, ist wenn sie binnen sechs Monaten nach dem Tag, an dem die Eintragung der Verschmelzung in das Register des Sitzes desjenigen Rechtsträgers, dessen Gläubiger sie sind,  nach § 19 Abs. 3 UmwG als bekanntgemacht gilt, ihren Anspruch nach Grund und Höhe schriftlich anmelden, Sicherheit zu leisten, soweit sie nicht Befriedigung verlangen können. Dieses Recht steht ihnen jedoch nur zu, wenn sie glaubhaft machen, daß durch die Verschmelzung die Erfüllung ihrer Forderung gefährdet wird."
    },
    {
      "date": "2024-09-27",
      "original_text": "Registerbekanntmachung nach dem Umwandlungsgesetz\nThüringen Amtsgericht Jena HRB 510596\nHelios Logistik Mitte GmbH – Erfurt",
      "type": "Registerbekanntmachung nach dem Umwandlungsgesetz",
      "state": "Thüringen",
      "amtsgericht": "Amtsgericht Jena",
      "registernummer": "HRB 510596",
      "registerart": "HRB",
      "company_name": "Helios Logistik Mitte GmbH",
      "company_seat": "Erfurt",
      "details": "27.09.2024 (Bekanntmachungsdatum)\n\nThüringen Amtsgericht Jena HRB 510596\nRegisterbekanntmachung nach dem Umwandlungsgesetz 27.09.2024 (Eintragungsdatum)\n\nHelios Logistik Mitte GmbH\nGesellschaft mit beschränkter Haftung\nErfurt\n\nNicht eingetragen: Den Gläubigern der an der Verschmelzung beteiligten Rechtsträger, ist wenn sie binnen sechs Monaten nach dem Tag, an dem die Eintragung der Verschmelzung in das Register des Sitzes desjenigen Rechtsträgers, dessen Gläubiger sie sind,  nach § 19 Abs. 3 UmwG als bekanntgemacht gilt, ihren Anspruch nach Grund und Höhe schriftlich anmelden, Sicherheit zu leisten, soweit sie nicht Befriedigung verlangen können. Dieses Recht steht ihnen jedoch nur zu, wenn sie glaubhaft machen, daß durch die Verschmelzung die Erfüllung ihrer Forderung gefährdet wird."
    },
    {
      "date": "2024-09-27",
      "original_text": "Registerbekanntmachung nach dem Umwandlungsgesetz\nThüringen Amtsgericht Jena HRB 510596\nHelios Logistik Mitte GmbH – Erfurt",
      "type": "Registerbekanntmachung nach dem Umwandlungsgesetz",
      "state": "Thüringen",
      "amtsgericht": "Amtsgericht Jena",
      "registernummer": "HRB 510596",
      "registerart": "HRB",
      "company_name": "Helios Logistik Mitte GmbH",
      "company_seat": "Erfurt",
      "details": "27.09.2024 (Bekanntmachungsdatum)\n\nThüringen Amtsgericht Jena HRB 510596\nRegisterbekanntmachung nach dem Umwandlungsgesetz 27.09.2024 (Eintragungsdatum)\n\nHelios Logistik Mitte GmbH\nGesellschaft mit beschränkter Haftung\nErfurt\n\nNicht eingetragen: Den Gläubigern der an der Verschmelzung beteiligten Rechtsträger, ist wenn sie binnen sechs Monaten nach dem Tag, an dem die Eintragung der Verschmelzung in das Register des Sitzes desjenigen Rechtsträgers, dessen Gläubiger sie sind,  nach § 19 Abs. 3 UmwG als bekanntgemacht gilt, ihren Anspruch nach Grund und Höhe schriftlich anmelden, Sicherheit zu leisten, soweit sie nicht Befriedigung verlangen können. Dieses Recht steht ihnen jedoch nur zu, wenn sie glaubhaft machen, daß durch die Verschmelzung die Erfüllung ihrer Forderung gefährdet wird."
    },
    {
      "date": "2024-09-27",
      "original_text": "Registerbekanntmachung nach dem Umwandlungsgesetz\nThüringen Amtsgericht Jena HRB 510596\nHelios Logistik Mitte GmbH – Erfurt",
      "type": "Registerbekanntmachung nach dem Umwandlungsgesetz",
      "state": "Thüringen",
      "amtsgericht": "Amtsgericht Jena",
      "registernummer": "HRB 510596",
      "registerart": "HRB",
      "company_name": "Helios Logistik Mitte GmbH",
      "company_seat": "Erfurt",
      "details": "27.09.2024 (Bekanntmachungsdatum)\n\nThüringen Amtsgericht Jena HRB 510596\nRegisterbekanntmachung nach dem Umwandlungsgesetz 27.09.2024 (Eintragungsdatum)\n\nHelios Logistik Mitte GmbH\nGesellschaft mit beschränkter Haftung\nErfurt\n\nNicht eingetragen: Den Gläubigern der an der Verschmelzung beteiligten Rechtsträger, ist wenn sie binnen sechs Monaten nach dem Tag, an dem die Eintragung der Verschmelzung in das Register des Sitzes desjenigen Rechtsträgers, dessen Gläubiger sie sind,  nach § 19 Abs. 3 UmwG als bekanntgemacht gilt, ihren Anspruch nach Grund und Höhe schriftlich anmelden, Sicherheit zu leisten, soweit sie nicht Befriedigung verlangen können. Dieses Recht steht ihnen jedoch nur zu, wenn sie glaubhaft machen, daß durch die Verschmelzung die Erfüllung ihrer Forderung gefährdet wird."
    },
    {
      "date": "2024-09-27",
      "original_text": "Registerbekanntmachung nach dem Umwandlungsgesetz\nThüringen Amtsgericht Jena HRB 510596\nHelios Logistik Mitte GmbH – Erfurt",
      "type": "Registerbekanntmachung nach dem Umwandlungsgesetz",
      "state": "Thüringen",
      "amtsgericht": "Amtsgericht Jena",
      "registernummer": "HRB 510596",
      "registerart": "HRB",
      "company_name": "Helios Logistik Mitte GmbH",
      "company_seat": "Erfurt",
      "details": "27.09.2024 (Bekanntmachungsdatum)\n\nThüringen Amtsgericht Jena HRB 510596\nRegisterbekanntmachung nach dem Umwandlungsgesetz 27.09.2024 (Eintragungsdatum)\n\nHelios Logistik Mitte GmbH\nGesellschaft mit beschränkter Haftung\nErfurt\n\nNicht eingetragen: Den Gläubigern der an der Verschmelzung beteiligten Rechtsträger, ist wenn sie binnen sechs Monaten nach dem Tag, an dem die Eintragung der Verschmelzung in das Register des Sitzes desjenigen Rechtsträgers, dessen Gläubiger sie sind,  nach § 19 Abs. 3 UmwG als bekanntgemacht gilt, ihren Anspruch nach Grund und Höhe schriftlich anmelden, Sicherheit zu leisten, soweit sie nicht Befriedigung verlangen können. Dieses Recht steht ihnen jedoch nur zu, wenn sie glaubhaft machen, daß durch die Verschmelzung die Erfüllung ihrer Forderung gefährdet wird."
    },
    {
      "date": "2024-09-27",
      "original_text": "Registerbekanntmachung nach dem Umwandlungsgesetz\nThüringen Amtsgericht Jena HRB 511775\nHelios Logistik Services Süd GmbH – Erfurt",
      "type": "Registerbekanntmachung nach dem Umwandlungsgesetz",
      "state": "Thüringen",
      "amtsgericht": "Amtsgericht Jena",
      "registernummer": "HRB 511775",
      "registerart": "HRB",
      "company_name": "Helios Logistik Services Süd GmbH",
      "company_seat": "Erfurt",
      "details": "27.09.2024 (Bekanntmachungsdatum)\n\nThüringen Amtsgericht Jena HRB 511775\nRegisterbekanntmachung nach dem Umwandlungsgesetz 27.09.2024 (Eintragungsdatum)\n\nHelios Logistik Services Süd GmbH\nGesellschaft mit beschränkter Haftung\nErfurt\n\nNicht eingetragen: Den Gläubigern der an der Verschmelzung beteiligten Rechtsträger, ist wenn sie binnen sechs Monaten nach dem Tag, an dem die Eintragung der Verschmelzung in das Register des Sitzes desjenigen Rechtsträgers, dessen Gläubiger sie sind,  nach § 19 Abs. 3 UmwG als bekanntgemacht gilt, ihren Anspruch nach Grund und Höhe schriftlich anmelden, Sicherheit zu leisten, soweit sie nicht Befriedigung verlangen können. Dieses Recht steht ihnen jedoch nur zu, wenn sie glaubhaft machen, daß durch die Verschmelzung die Erfüllung ihrer Forderung gefährdet wird."
    },
    {
      "date": "2024-09-27",
      "original_text": "Registerbekanntmachung nach dem Umwandlungsgesetz\nHessen Amtsgericht Frankfurt am Main HRA 41371\nHermann Eckhardt Söhne Nachf. Wilhelm Eckardt jun. – Bad Vilbel",
      "type": "Registerbekanntmachung nach dem Umwandlungsgesetz",
      "state": "Hessen",
      "amtsgericht": "Amtsgericht Frankfurt am Main",
      "registernummer": "HRA 41371",
      "registerart": "HRA",
      "company_name": "Hermann Eckhardt Söhne Nachf. Wilhelm Eckardt jun.",
      "company_seat": "Bad Vilbel",
      "details": "27.09.2024 (Bekanntmachungsdatum)\n\nHessen Amtsgericht Frankfurt am Main HRA 41371\nRegisterbekanntmachung nach dem Umwandlungsgesetz 27.09.2024 (Eintragungsdatum)\n\nHermann Eckhardt Söhne Nachf. Wilhelm Eckardt jun.\nEinzelkaufmann / Einzelkauffrau\nBad Vilbel\n\nDen Gläubigern der an der Ausgliederung beteiligten Rechtsträger ist, wenn sie binnen sechs Monaten nach dem Tag, an dem die Eintragung der Ausgliederung in das Register des Sitzes derjenigen Rechtsträger deren Gläubiger sie sind, nach §§ 125, 19 Absatz 3 UmwG bekannt gemacht worden ist, ihren Anspruch nach Grund und Höhe schriftlich anmelden, Sicherheit zu leisten, soweit sie nicht Befriedigung verlangen können. Dieses Recht steht den Gläubigern jedoch nur zu, wenn sie glaubhaft machen, dass durch die Ausgliederung die Erfüllung ihrer Forderung gefährdet wird."
    },
    {
      "date": "2024-09-27",
      "original_text": "Registerbekanntmachung nach dem Umwandlungsgesetz\nNordrhein-Westfalen Amtsgericht Kleve HRB 11859\nHydreco Hydraulics GmbH – Straelen",
      "type": "Registerbekanntmachung nach dem Umwandlungsgesetz",
      "state": "Nordrhein-Westfalen",
      "amtsgericht": "Amtsgericht Kleve",
      "registernummer": "HRB 11859",
      "registerart": "HRB",
      "company_name": "Hydreco Hydraulics GmbH",
      "company_seat": "Straelen",
      "details": "27.09.2024 (Bekanntmachungsdatum)\n\nNordrhein-Westfalen Amtsgericht Kleve HRB 11859\nRegisterbekanntmachung nach dem Umwandlungsgesetz 27.09.2024 (Eintragungsdatum)\n\nHydreco Hydraulics GmbH\nGesellschaft mit beschränkter Haftung\nStraelen\n\nDen Gläubigern der an der Verschmelzung beteiligten Rechtsträger ist, wenn sie binnen sechs Monaten nach dem Tag, an dem die Eintragung der Verschmelzung in das Register des Sitzes desjenigen Rechtsträgers, dessen Gläubiger sie sind, nach § 19 Absatz 3 UmwG als bekanntgemacht gilt, ihren Anspruch nach Grund und Höhe schriftlich anmelden, Sicherheit zu leisten, soweit sie nicht Befriedigung verlangen können. Dieses Recht steht den Gläubigern jedoch nur zu, wenn sie glaubhaft machen, dass durch die Verschmelzung die Erfüllung ihrer Forderung gefährdet wird."
    },
    {
      "date": "2024-09-27",
      "original_text": "Löschungsankündigung\nHessen Amtsgericht Frankfurt am Main HRB 104331\nI&A GmbH – Frankfurt am Main",
      "type": "Löschungsankündigung",
      "state": "Hessen",
      "amtsgericht": "Amtsgericht Frankfurt am Main",
      "registernummer": "HRB 104331",
      "registerart": "HRB",
      "company_name": "I&A GmbH",
      "company_seat": "Frankfurt am Main",
      "details": "27.09.2024 (Bekanntmachungsdatum)\n\nHessen Amtsgericht Frankfurt am Main HRB 104331\nLöschungsankündigung\n\nI&A GmbH\nGesellschaft mit beschränkter Haftung\nFrankfurt am Main\n\nEs ist beabsichtigt die Gesellschaft wegen Vermögenslosigkeit gemäß § 394 FamFG von Amts wegen zu löschen. Hiergegen kann innerhalb eines Monats nach dieser Veröffentlichung Widerspruch bei dem Amtsgericht Frankfurt am Main eingelegt werden."
    },
    {
      "date": "2024-09-27",
      "original_text": "Löschungsankündigung\nBaden-Württemberg Amtsgericht Mannheim HRB 729479\nICM Inner Circle Marketing UG (haftungsbeschränkt) – Walzbachtal",
      "type": "Löschungsankündigung",
      "state": "Baden-Württemberg",
      "amtsgericht": "Amtsgericht Mannheim",
      "registernummer": "HRB 729479",
      "registerart": "HRB",
      "company_name": "ICM Inner Circle Marketing UG (haftungsbeschränkt)",
      "company_seat": "Walzbachtal",
      "details": "27.09.2024 (Bekanntmachungsdatum)\n\nBaden-Württemberg Amtsgericht Mannheim HRB 729479\nLöschungsankündigung\n\nICM Inner Circle Marketing UG (haftungsbeschränkt)\nGesellschaft mit beschränkter Haftung\nWalzbachtal\n\nDas Gericht beabsichtigt, die Gesellschaft wegen Vermögenslosigkeit im Handelsregister von Amts wegen nach § 394 FamFG zu löschen. Die Frist zur Geltendmachung eines Widerspruchs gegen die beabsichtigte Löschung ist auf einen Monat ab Veröffentlichung bestimmt."
    },
    {
      "date": "2024-09-27",
      "original_text": "Registerbekanntmachung nach dem Umwandlungsgesetz\nSchleswig-Holstein Amtsgericht Lübeck HRB 21707\nJADE Holding GmbH – Ratzeburg",
      "type": "Registerbekanntmachung nach dem Umwandlungsgesetz",
      "state": "Schleswig-Holstein",
      "amtsgericht": "Amtsgericht Lübeck",
      "registernummer": "HRB 21707",
      "registerart": "HRB",
      "company_name": "JADE Holding GmbH",
      "company_seat": "Ratzeburg",
      "details": "27.09.2024 (Bekanntmachungsdatum)\n\nSchleswig-Holstein Amtsgericht Lübeck HRB 21707\nRegisterbekanntmachung nach dem Umwandlungsgesetz 27.09.2024 (Eintragungsdatum)\n\nJADE Holding GmbH\nGesellschaft mit beschränkter Haftung\nRatzeburg\n\nZu Eintragungsnummer 2 vom 27.09.2024 wird als nicht eingetragen veröffentlicht: Den Gläubigern der an der Verschmelzung beteiligten Rechtsträger ist, wenn sie binnen sechs Monaten nach dem Tag, an dem die Eintragung der Verschmelzung in das Register des Sitzes desjenigen Rechtsträgers, dessen Gläubiger sie sind, als bekannt gemacht gilt, ihren Anspruch nach Grund und Höhe schriftlich anmelden, Sicherheit zu leisten, soweit sie nicht Befriedigung verlangen können. Dieses Recht steht den Gläubigern jedoch nur zu, wenn sie glaubhaft machen, dass durch die Verschmelzung die Erfüllung ihrer Forderung gefährdet wird."
    },
    {
      "date": "2024-09-27",
      "original_text": "Löschungsankündigung\nNordrhein-Westfalen Amtsgericht Gelsenkirchen HRB 17874\nJBT Transport und Verwaltung GmbH – Gelsenkirchen",
      "type": "Löschungsankündigung",
      "state": "Nordrhein-Westfalen",
      "amtsgericht": "Amtsgericht Gelsenkirchen",
      "registernummer": "HRB 17874",
      "registerart": "HRB",
      "company_name": "JBT Transport und Verwaltung GmbH",
      "company_seat": "Gelsenkirchen",
      "details": "27.09.2024 (Bekanntmachungsdatum)\n\nNordrhein-Westfalen Amtsgericht Gelsenkirchen HRB 17874\nLöschungsankündigung\n\nJBT Transport und Verwaltung GmbH\nGesellschaft mit beschränkter Haftung\nGelsenkirchen\n\nDas Gericht beabsichtigt, die Gesellschaft JBT Transport und Verwaltung GmbH mit Sitz in Gelsenkirchen, HRB 17874 Amtsgericht Gelsenkirchen, wegen Vermögenslosigkeit zu löschen.\n\nHiermit wird denjenigen, die an der Unterlassung der Löschung ein berechtigtes Interesse haben, gem. § 394 Abs. 2 FamFG Gelegenheit gegeben, gegen dieses Vorhaben binnen eines Monats nach dieser Bekanntmachung Widerspruch einzulegen. Der Widerspruch kann schriftlich oder zu Protokoll der Geschäftsstelle erhoben werden."
    },
    {
      "date": "2024-09-27",
      "original_text": "Einreichung neuer Dokumente\nBerlin Amtsgericht Berlin (Charlottenburg) HRB 85793\nJacobs Objekt AG – Berlin",
      "type": "Einreichung neuer Dokumente",
      "state": "Berlin",
      "amtsgericht": "Amtsgericht Berlin (Charlottenburg)",
      "registernummer": "HRB 85793",
      "registerart": "HRB",
      "company_name": "Jacobs Objekt AG",
      "company_seat": "Berlin",
      "details": "27.09.2024 (Bekanntmachungsdatum)\n\nBerlin Amtsgericht Berlin (Charlottenburg) HRB 85793\nEinreichung neuer Dokumente\n\nJacobs Objekt AG\nAktiengesellschaft\nBerlin\n\nAls nicht eingetragen wird veröffentlicht:\n\nEs wurde eine neue Liste der Aufsichtsratsmitglieder eingereicht (§ 106 AktG)."
    },
    {
      "date": "2024-09-27",
      "original_text": "Registerbekanntmachung nach dem Umwandlungsgesetz\nBayern Amtsgericht Augsburg HRB 24976\nKFZ Zafer GmbH – Augsburg",
      "type": "Registerbekanntmachung nach dem Umwandlungsgesetz",
      "state": "Bayern",
      "amtsgericht": "Amtsgericht Augsburg",
      "registernummer": "HRB 24976",
      "registerart": "HRB",
      "company_name": "KFZ Zafer GmbH",
      "company_seat": "Augsburg",
      "details": "27.09.2024 (Bekanntmachungsdatum)\n\nBayern Amtsgericht Augsburg HRB 24976\nRegisterbekanntmachung nach dem Umwandlungsgesetz 26.09.2024 (Eintragungsdatum)\n\nKFZ Zafer GmbH\nGesellschaft mit beschränkter Haftung\nAugsburg\n\nDen Gläubigern der an der Verschmelzung beteiligten Rechtsträger ist, wenn sie binnen sechs Monaten nach dem Tag, an dem die Eintragung der Verschmelzung in das Register des Sitzes desjenigen Rechtsträgers, dessen Gläubiger sie sind, nach § 19 Abs. 3 UmwG als bekannt gemacht gilt, ihren Anspruch nach Grund und Höhe schriftlich anmelden, Sicherheit zu leisten, soweit sie nicht Befriedigung verlangen können. Dieses Recht steht den Gläubigern jedoch nur zu, wenn sie glaubhaft machen, dass durch die Verschmelzung die Erfüllung ihrer Forderung gefährdet wird."
    },
    {
      "date": "2024-09-27",
      "original_text": "Registerbekanntmachung nach dem Umwandlungsgesetz\nHessen Amtsgericht Darmstadt HRA 87611\nKiller Sports GmbH & Co. KG – Groß-Zimmern",
      "type": "Registerbekanntmachung nach dem Umwandlungsgesetz",
      "state": "Hessen",
      "amtsgericht": "Amtsgericht Darmstadt",
      "registernummer": "HRA 87611",
      "registerart": "HRA",
      "company_name": "Killer Sports GmbH & Co. KG",
      "company_seat": "Groß-Zimmern",
      "details": "27.09.2024 (Bekanntmachungsdatum)\n\nHessen Amtsgericht Darmstadt HRA 87611\nRegisterbekanntmachung nach dem Umwandlungsgesetz 27.09.2024 (Eintragungsdatum)\n\nKiller Sports GmbH & Co. KG\nKommanditgesellschaft\nGroß-Zimmern\n\nDen Gläubigern der an der Ausgliederung beteiligten Rechtsträger ist, wenn sie binnen sechs Monaten nach dem Tag, an dem die Eintragung der Ausgliederung in das Register des Sitzes derjenigen Rechtsträger deren Gläubiger sie sind, nach §§ 125, 19 Absatz 3 UmwG bekannt gemacht worden ist, ihren Anspruch nach Grund und Höhe schriftlich anmelden, Sicherheit zu leisten, soweit sie nicht Befriedigung verlangen können. Dieses Recht steht den Gläubigern jedoch nur zu, wenn sie glaubhaft machen, dass durch die Ausgliederung die Erfüllung ihrer Forderung gefährdet wird."
    },
    {
      "date": "2024-09-27",
      "original_text": "Löschungsankündigung\nNordrhein-Westfalen Amtsgericht Bochum HRB 15578\nKnüppelknifte System GmbH – Bochum",
      "type": "Löschungsankündigung",
      "state": "Nordrhein-Westfalen",
      "amtsgericht": "Amtsgericht Bochum",
      "registernummer": "HRB 15578",
      "registerart": "HRB",
      "company_name": "Knüppelknifte System GmbH",
      "company_seat": "Bochum",
      "details": "27.09.2024 (Bekanntmachungsdatum)\n\nNordrhein-Westfalen Amtsgericht Bochum HRB 15578\nLöschungsankündigung\n\nKnüppelknifte System GmbH\nGesellschaft mit beschränkter Haftung\nBochum\n\nDas Registergericht beabsichtigt die Gesellschaft von Amts wegen nach § 394 FamFG zu löschen. Die Frist zur Erhebung eines Widerspruchs ist auf drei Monate festgesetzt."
    },
    {
      "date": "2024-09-27",
      "original_text": "Registerbekanntmachung nach dem Umwandlungsgesetz\nBaden-Württemberg Amtsgericht Stuttgart HRA 741716\nKostanzer Holzbau e.K. – Bisingen",
      "type": "Registerbekanntmachung nach dem Umwandlungsgesetz",
      "state": "Baden-Württemberg",
      "amtsgericht": "Amtsgericht Stuttgart",
      "registernummer": "HRA 741716",
      "registerart": "HRA",
      "company_name": "Kostanzer Holzbau e.K.",
      "company_seat": "Bisingen",
      "details": "27.09.2024 (Bekanntmachungsdatum)\n\nBaden-Württemberg Amtsgericht Stuttgart HRA 741716\nRegisterbekanntmachung nach dem Umwandlungsgesetz 27.09.2024 (Eintragungsdatum)\n\nKostanzer Holzbau e.K.\nEinzelkaufmann / Einzelkauffrau\nBisingen\n\nDen Gläubigern der an der Verschmelzung beteiligten Rechtsträger ist, wenn sie binnen sechs Monaten nach dem Tag, an dem die Eintragung der Verschmelzung in das Register des Sitzes desjenigen Rechtsträgers, dessen Gläubiger sie sind, nach § 19 Abs. 3 UmwG als bekanntgemacht gilt, ihren Anspruch nach Grund und Höhe schriftlich anmelden, Sicherheit zu leisten, soweit sie nicht Befriedigung verlangen können. Dieses Recht steht den Gläubigern jedoch nur zu, wenn sie glaubhaft machen, dass durch die Verschmelzung die Erfüllung ihrer Forderung gefährdet wird."
    },
    {
      "date": "2024-09-27",
      "original_text": "Einreichung neuer Dokumente\nBayern Amtsgericht München HRB 258614\nKyros C AG – München",
      "type": "Einreichung neuer Dokumente",
      "state": "Bayern",
      "amtsgericht": "Amtsgericht München",
      "registernummer": "HRB 258614",
      "registerart": "HRB",
      "company_name": "Kyros C AG",
      "company_seat": "München",
      "details": "27.09.2024 (Bekanntmachungsdatum)\n\nBayern Amtsgericht München HRB 258614\nEinreichung neuer Dokumente\n\nKyros C AG\nAktiengesellschaft\nMünchen\n\nDem Amtsgericht München -Registergericht- ist eine Liste der Mitglieder des Aufsichtsrats eingereicht worden, § 106 AktG."
    },
    {
      "date": "2024-09-27",
      "original_text": "Registerbekanntmachung nach dem Umwandlungsgesetz\nNiedersachsen Amtsgericht Göttingen HRA 202308\nKÖNIG Fachpersonal GmbH & Co KG – Moringen",
      "type": "Registerbekanntmachung nach dem Umwandlungsgesetz",
      "state": "Niedersachsen",
      "amtsgericht": "Amtsgericht Göttingen",
      "registernummer": "HRA 202308",
      "registerart": "HRA",
      "company_name": "KÖNIG Fachpersonal GmbH & Co KG",
      "company_seat": "Moringen",
      "details": "27.09.2024 (Bekanntmachungsdatum)\n\nNiedersachsen Amtsgericht Göttingen HRA 202308\nRegisterbekanntmachung nach dem Umwandlungsgesetz 27.09.2024 (Eintragungsdatum)\n\nKÖNIG Fachpersonal GmbH & Co KG\nKommanditgesellschaft\nMoringen\n\nDen Gläubigern der an der Ausgliederung beteiligten Rechtsträger ist, wenn sie binnen sechs Monaten nach dem Tag, an dem die Eintragung der Ausgliederung in das Register des Sitzes desjenigen Rechtsträgers, dessen Gläubiger sie sind, nach § 19 Abs. 3 UmwG als bekannt gemacht gilt, ihren Anspruch nach Grund und Höhe schriftlich anmelden, Sicherheit zu leisten, soweit sie nicht Befriedigung verlangen können. Dieses Recht steht den Gläubigern jedoch nur zu, wenn sie glaubhaft machen, dass durch die Ausgliederung die Erfüllung der Forderung gefährdet wird."
    },
    {
      "date": "2024-09-27",
      "original_text": "Löschungsankündigung\nBaden-Württemberg Amtsgericht Ulm HRB 744531\nLF Automaten GmbH – Oberkochen",
      "type": "Löschungsankündigung",
      "state": "Baden-Württemberg",
      "amtsgericht": "Amtsgericht Ulm",
      "registernummer": "HRB 744531",
      "registerart": "HRB",
      "company_name": "LF Automaten GmbH",
      "company_seat": "Oberkochen",
      "details": "27.09.2024 (Bekanntmachungsdatum)\n\nBaden-Württemberg Amtsgericht Ulm HRB 744531\nLöschungsankündigung\n\nLF Automaten GmbH\nGesellschaft mit beschränkter Haftung\nOberkochen\n\nDas Gericht beabsichtigt, die Gesellschaft wegen Vermögenslosigkeit im Handelsregister von Amts wegen nach § 394 FamFG zu löschen. Die Frist zur Geltendmachung eines Widerspruchs gegen die beabsichtigte Löschung ist auf  einen Monat ab Veröffentlichung bestimmt."
    },
    {
      "date": "2024-09-27",
      "original_text": "Registerbekanntmachung nach dem Umwandlungsgesetz\nNiedersachsen Amtsgericht Göttingen HRB 204711\nLMJ GmbH – Bilshausen",
      "type": "Registerbekanntmachung nach dem Umwandlungsgesetz",
      "state": "Niedersachsen",
      "amtsgericht": "Amtsgericht Göttingen",
      "registernummer": "HRB 204711",
      "registerart": "HRB",
      "company_name": "LMJ GmbH",
      "company_seat": "Bilshausen",
      "details": "27.09.2024 (Bekanntmachungsdatum)\n\nNiedersachsen Amtsgericht Göttingen HRB 204711\nRegisterbekanntmachung nach dem Umwandlungsgesetz 27.09.2024 (Eintragungsdatum)\n\nLMJ GmbH\nGesellschaft mit beschränkter Haftung\nBilshausen\n\nDen Gläubigern der an der Verschmelzung beteiligten Rechtsträger ist, wenn sie binnen sechs Monaten nach dem Tag, an dem die Eintragung der Verschmelzung in das Register des Sitzes desjenigen Rechtsträgers, dessen Gläubiger sie sind, nach § 19  Abs.  3 UmwG als bekannt gemacht gilt, ihren Anspruch nach Grund und Höhe schriftlich anmelden, Sicherheit zu leisten, soweit sie nicht Befriedigung verlangen können. Dieses Recht steht den Gläubigern jedoch nur zu, wenn sie glaubhaft machen, dass durch die Verschmelzung die Erfüllung der Forderung gefährdet wird."
    },
    {
      "date": "2024-09-27",
      "original_text": "Registerbekanntmachung nach dem Umwandlungsgesetz\nNiedersachsen Amtsgericht Göttingen HRB 207406\nLMJ Jacobi GmbH – Bilshausen",
      "type": "Registerbekanntmachung nach dem Umwandlungsgesetz",
      "state": "Niedersachsen",
      "amtsgericht": "Amtsgericht Göttingen",
      "registernummer": "HRB 207406",
      "registerart": "HRB",
      "company_name": "LMJ Jacobi GmbH",
      "company_seat": "Bilshausen",
      "details": "27.09.2024 (Bekanntmachungsdatum)\n\nNiedersachsen Amtsgericht Göttingen HRB 207406\nRegisterbekanntmachung nach dem Umwandlungsgesetz 27.09.2024 (Eintragungsdatum)\n\nLMJ Jacobi GmbH\nGesellschaft mit beschränkter Haftung\nBilshausen\n\nDen Gläubigern der an der Verschmelzung beteiligten Rechtsträger ist, wenn sie binnen sechs Monaten nach dem Tag, an dem die Eintragung der Verschmelzung in das Register des Sitzes desjenigen Rechtsträgers, dessen Gläubiger sie sind, nach § 19  Abs.  3 UmwG als bekannt gemacht gilt, ihren Anspruch nach Grund und Höhe schriftlich anmelden, Sicherheit zu leisten, soweit sie nicht Befriedigung verlangen können. Dieses Recht steht den Gläubigern jedoch nur zu, wenn sie glaubhaft machen, dass durch die Verschmelzung die Erfüllung der Forderung gefährdet wird."
    },
    {
      "date": "2024-09-27",
      "original_text": "Löschungsankündigung\nBerlin Amtsgericht Berlin (Charlottenburg) HRB 123400\nLOGOTRANS LI-BOR GmbH – Berlin",
      "type": "Löschungsankündigung",
      "state": "Berlin",
      "amtsgericht": "Amtsgericht Berlin (Charlottenburg)",
      "registernummer": "HRB 123400",
      "registerart": "HRB",
      "company_name": "LOGOTRANS LI-BOR GmbH",
      "company_seat": "Berlin",
      "details": "27.09.2024 (Bekanntmachungsdatum)\n\nBerlin Amtsgericht Berlin (Charlottenburg) HRB 123400\nLöschungsankündigung\n\nLOGOTRANS LI-BOR GmbH\nGesellschaft mit beschränkter Haftung\nBerlin\n\nBei der nachstehenden Gesellschaft wird das Amtslöschungsverfahren gemäß § 394 FamFG eingeleitet. Widerspruchsfrist: 6 Wochen."
    },
    {
      "date": "2024-09-27",
      "original_text": "Registerbekanntmachung nach dem Umwandlungsgesetz\nHamburg Amtsgericht Hamburg HRB 74739\nLabann Display & Kartonagen GmbH – Hamburg",
      "type": "Registerbekanntmachung nach dem Umwandlungsgesetz",
      "state": "Hamburg",
      "amtsgericht": "Amtsgericht Hamburg",
      "registernummer": "HRB 74739",
      "registerart": "HRB",
      "company_name": "Labann Display & Kartonagen GmbH",
      "company_seat": "Hamburg",
      "details": "27.09.2024 (Bekanntmachungsdatum)\n\nHamburg Amtsgericht Hamburg HRB 74739\nRegisterbekanntmachung nach dem Umwandlungsgesetz 27.09.2024 (Eintragungsdatum)\n\nLabann Display & Kartonagen GmbH\nGesellschaft mit beschränkter Haftung\nHamburg\n\nAls nicht eingetragen wird bekannt gemacht:\nDen Gläubigern der an der Verschmelzung beteiligten Gesellschaften ist, wenn sie binnen sechs Monaten nach dem Tag, an dem die Eintragung der Verschmelzung in das Register des Sitzes desjenigen Rechtsträgers, dessen Gläubiger sie sind, nach § 19 Absatz 3 UmwG als bekannt gemacht gilt, ihren Anspruch nach Grund und Höhe schriftlich anmelden, Sicherheit zu leisten, soweit sie nicht Befriedigung verlangen können. Dieses Recht steht den Gläubigern jedoch nur zu, wenn sie glaubhaft machen, dass durch die Verschmelzung die Erfüllung ihrer Forderung gefährdet wird."
    },
    {
      "date": "2024-09-27",
      "original_text": "Löschungsankündigung\nSchleswig-Holstein Amtsgericht Lübeck HRB 21791\nLamija Bauunternehmen GmbH – Oststeinbek",
      "type": "Löschungsankündigung",
      "state": "Schleswig-Holstein",
      "amtsgericht": "Amtsgericht Lübeck",
      "registernummer": "HRB 21791",
      "registerart": "HRB",
      "company_name": "Lamija Bauunternehmen GmbH",
      "company_seat": "Oststeinbek",
      "details": "27.09.2024 (Bekanntmachungsdatum)\n\nSchleswig-Holstein Amtsgericht Lübeck HRB 21791\nLöschungsankündigung\n\nLamija Bauunternehmen GmbH\nGesellschaft mit beschränkter Haftung\nOststeinbek\n\nEs ist die Löschung der nachstehenden Gesellschaft wegen Vermögenslosigkeit gemäß § 394 FamFG beabsichtigt."
    },
    {
      "date": "2024-09-27",
      "original_text": "Registerbekanntmachung nach dem Umwandlungsgesetz\nHamburg Amtsgericht Hamburg HRB 26989\nLangebartels+Jürgens Hamburg GmbH – Hamburg",
      "type": "Registerbekanntmachung nach dem Umwandlungsgesetz",
      "state": "Hamburg",
      "amtsgericht": "Amtsgericht Hamburg",
      "registernummer": "HRB 26989",
      "registerart": "HRB",
      "company_name": "Langebartels+Jürgens Hamburg GmbH",
      "company_seat": "Hamburg",
      "details": "27.09.2024 (Bekanntmachungsdatum)\n\nHamburg Amtsgericht Hamburg HRB 26989\nRegisterbekanntmachung nach dem Umwandlungsgesetz 27.09.2024 (Eintragungsdatum)\n\nLangebartels+Jürgens Hamburg GmbH\nGesellschaft mit beschränkter Haftung\nHamburg\n\nAls nicht eingetragen wird bekannt gemacht:\nDen Gläubigern der an der Verschmelzung beteiligten Gesellschaften ist, wenn sie binnen sechs Monaten nach dem Tag, an dem die Eintragung der Verschmelzung in das Register des Sitzes desjenigen Rechtsträgers, dessen Gläubiger sie sind, nach § 19 Absatz 3 UmwG als bekannt gemacht gilt, ihren Anspruch nach Grund und Höhe schriftlich anmelden, Sicherheit zu leisten, soweit sie nicht Befriedigung verlangen können. Dieses Recht steht den Gläubigern jedoch nur zu, wenn sie glaubhaft machen, dass durch die Verschmelzung die Erfüllung ihrer Forderung gefährdet wird."
    },
    {
      "date": "2024-09-27",
      "original_text": "Registerbekanntmachung nach dem Umwandlungsgesetz\nHessen Amtsgericht Darmstadt HRB 53602\nLear Corporation GmbH – Ginsheim-Gustavsburg",
      "type": "Registerbekanntmachung nach dem Umwandlungsgesetz",
      "state": "Hessen",
      "amtsgericht": "Amtsgericht Darmstadt",
      "registernummer": "HRB 53602",
      "registerart": "HRB",
      "company_name": "Lear Corporation GmbH",
      "company_seat": "Ginsheim-Gustavsburg",
      "details": "27.09.2024 (Bekanntmachungsdatum)\n\nHessen Amtsgericht Darmstadt HRB 53602\nRegisterbekanntmachung nach dem Umwandlungsgesetz 27.09.2024 (Eintragungsdatum)\n\nLear Corporation GmbH\nGesellschaft mit beschränkter Haftung\nGinsheim-Gustavsburg\n\nDen Gläubigern der an der Verschmelzung beteiligten Rechtsträger ist, wenn sie binnen sechs Monaten nach dem Tag, an dem die Eintragung der Verschmelzung in das Register des Sitzes derjenigen Rechtsträger deren Gläubiger sie sind, nach § 19 Absatz 3 UmwG bekannt gemacht worden ist, ihren Anspruch nach Grund und Höhe schriftlich anmelden, Sicherheit zu leisten, soweit sie nicht Befriedigung verlangen können. Dieses Recht steht den Gläubigern jedoch nur zu, wenn sie glaubhaft machen, dass durch die Verschmelzung die Erfüllung ihrer Forderung gefährdet wird."
    },
    {
      "date": "2024-09-27",
      "original_text": "Registerbekanntmachung nach dem Umwandlungsgesetz\nBerlin Amtsgericht Berlin (Charlottenburg) HRA 63208\nLeonardo Dilßner e.K. – Berlin",
      "type": "Registerbekanntmachung nach dem Umwandlungsgesetz",
      "state": "Berlin",
      "amtsgericht": "Amtsgericht Berlin (Charlottenburg)",
      "registernummer": "HRA 63208",
      "registerart": "HRA",
      "company_name": "Leonardo Dilßner e.K.",
      "company_seat": "Berlin",
      "details": "27.09.2024 (Bekanntmachungsdatum)\n\nBerlin Amtsgericht Berlin (Charlottenburg) HRA 63208\nRegisterbekanntmachung nach dem Umwandlungsgesetz 26.09.2024 (Eintragungsdatum)\n\nLeonardo Dilßner e.K.\nEinzelkaufmann / Einzelkauffrau\nBerlin\n\nZu Eintragungsnummer 2 vom 26.09.2024 wird als nicht eingetragen veröffentlicht: Den Gläubigern ist, wenn sie binnen sechs Monaten nach dem Tag, an dem die Eintragung der Umwandlung als bekannt gemacht gilt, ihren Anspruch nach Grund und Höhe schriftlich anmelden, Sicherheit zu leisten, soweit sie nicht Befriedigung verlangen können. Dieses Recht steht den Gläubigern jedoch nur zu, wenn sie glaubhaft machen, dass durch die Umwandlung die Erfüllung ihrer Forderung gefährdet wird. Das Recht, Sicherheitsleistung zu verlangen, steht Gläubigern nicht zu, die im Falle der Insolvenz ein Recht auf vorzugsweise Befriedigung aus einer Deckungsmasse haben, die nach gesetzlicher Vorschrift zu ihrem Schutz errichtet und staatlich überwacht ist."
    },
    {
      "date": "2024-09-27",
      "original_text": "Registerbekanntmachung nach dem Umwandlungsgesetz\nBayern Amtsgericht München HRA 90668\nLeonhard Eder, Versicherungsmakler e.K. – Vaterstetten",
      "type": "Registerbekanntmachung nach dem Umwandlungsgesetz",
      "state": "Bayern",
      "amtsgericht": "Amtsgericht München",
      "registernummer": "HRA 90668",
      "registerart": "HRA",
      "company_name": "Leonhard Eder, Versicherungsmakler e.K.",
      "company_seat": "Vaterstetten",
      "details": "27.09.2024 (Bekanntmachungsdatum)\n\nBayern Amtsgericht München HRA 90668\nRegisterbekanntmachung nach dem Umwandlungsgesetz 26.09.2024 (Eintragungsdatum)\n\nLeonhard Eder, Versicherungsmakler e.K.\nEinzelkaufmann / Einzelkauffrau\nVaterstetten\n\nDen Gläubigern der an der Ausgliederung beteiligten Rechtsträger ist, wenn sie binnen sechs Monaten nach dem Tag, an dem die Eintragung der Ausgliederung in das Register des Sitzes desjenigen Rechtsträgers, dessen Gläubiger sie sind, nach §§ 125, 19 Abs. 3 UmwG als bekannt gemacht gilt, ihren Anspruch nach Grund und Höhe schriftlich anmelden, Sicherheit zu leisten, soweit sie nicht Befriedigung verlangen können. Dieses Recht steht den Gläubigern jedoch nur zu, wenn sie glaubhaft machen, dass durch die Ausgliederung die Erfüllung ihrer Forderung gefährdet wird."
    },
    {
      "date": "2024-09-27",
      "original_text": "Registerbekanntmachung nach dem Umwandlungsgesetz\nRheinland-Pfalz Amtsgericht Zweibrücken HRA 30786\nLisa Reinheimer e.Kfr. – Zweibrücken",
      "type": "Registerbekanntmachung nach dem Umwandlungsgesetz",
      "state": "Rheinland-Pfalz",
      "amtsgericht": "Amtsgericht Zweibrücken",
      "registernummer": "HRA 30786",
      "registerart": "HRA",
      "company_name": "Lisa Reinheimer e.Kfr.",
      "company_seat": "Zweibrücken",
      "details": "27.09.2024 (Bekanntmachungsdatum)\n\nRheinland-Pfalz Amtsgericht Zweibrücken HRA 30786\nRegisterbekanntmachung nach dem Umwandlungsgesetz 27.09.2024 (Eintragungsdatum)\n\nLisa Reinheimer e.Kfr.\nEinzelkaufmann / Einzelkauffrau\nZweibrücken\n\nAls nicht eingetragen wird veröffentlicht: Den Gläubigern der an der Ausgliederung beteiligten Rechtsträger ist, wenn sie binnen sechs Monaten nac hdem Tag, an dem die Eintragung der Ausgliederung in das Register des Sitzes desjenigen Rechtsträgers,dessen Gläubiger sie sind, nach § 19 Abs. 3 UmwG als bekannt gemacht gilt, ihren Anspruch nach Grund und Höhe schriftlich anmelden, Sicherheit zu leisten, soweit sie nicht Befriedigung verlangen können. Dieses Recht steht den Gläubigern jedoch nur zu, wenn sie glaubhaft machen, dass durch die Ausgliederung die Erfüllung der Forderung gefährdet wird."
    },
    {
      "date": "2024-09-27",
      "original_text": "Registerbekanntmachung nach dem Umwandlungsgesetz\nNordrhein-Westfalen Amtsgericht Bad Oeynhausen HRB 17499\nLymas Ventures Verwaltungs GmbH – Porta Westfalica",
      "type": "Registerbekanntmachung nach dem Umwandlungsgesetz",
      "state": "Nordrhein-Westfalen",
      "amtsgericht": "Amtsgericht Bad Oeynhausen",
      "registernummer": "HRB 17499",
      "registerart": "HRB",
      "company_name": "Lymas Ventures Verwaltungs GmbH",
      "company_seat": "Porta Westfalica",
      "details": "27.09.2024 (Bekanntmachungsdatum)\n\nNordrhein-Westfalen Amtsgericht Bad Oeynhausen HRB 17499\nRegisterbekanntmachung nach dem Umwandlungsgesetz 27.09.2024 (Eintragungsdatum)\n\nLymas Ventures Verwaltungs GmbH\nGesellschaft mit beschränkter Haftung\nPorta Westfalica\n\nDen Gläubigern der an der Verschmelzung beteiligten Rechtsträger ist, wenn sie binnen sechs Monaten nach dem Tag, an dem die Eintragung der Verschmelzung in das Register des Sitzes desjenigen Rechtsträgers, dessen Gläubiger sie sind, nach § 19 Absatz 3 UmwG als bekanntgemacht gilt, ihren Anspruch nach Grund und Höhe schriftlich anmelden, Sicherheit zu leisten, soweit sie nicht Befriedigung verlangen können. Dieses Recht steht den Gläubigern jedoch nur zu, wenn sie glaubhaft machen, dass durch die Verschmelzung die Erfüllung ihrer Forderung gefährdet wird."
    },
    {
      "date": "2024-09-27",
      "original_text": "Registerbekanntmachung nach dem Umwandlungsgesetz\nNiedersachsen Amtsgericht Lüneburg HRB 212364\nLüne Elektro GmbH – Lüneburg",
      "type": "Registerbekanntmachung nach dem Umwandlungsgesetz",
      "state": "Niedersachsen",
      "amtsgericht": "Amtsgericht Lüneburg",
      "registernummer": "HRB 212364",
      "registerart": "HRB",
      "company_name": "Lüne Elektro GmbH",
      "company_seat": "Lüneburg",
      "details": "27.09.2024 (Bekanntmachungsdatum)\n\nNiedersachsen Amtsgericht Lüneburg HRB 212364\nRegisterbekanntmachung nach dem Umwandlungsgesetz 27.09.2024 (Eintragungsdatum)\n\nLüne Elektro GmbH\nGesellschaft mit beschränkter Haftung\nLüneburg\n\nDen Gläubigern der an der Ausgliederung beteiligten Rechtsträger ist, wenn sie binnen sechs Monaten nach dem Tag, an dem die Eintragung der Ausgliederung in das Register des Sitzes desjenigen Rechtsträgers, dessen Gläubiger sie sind, nach § 19 Abs. 3 UmwG als bekannt gemacht gilt, ihren Anspruch nach Grund und Höhe schriftlich anmelden, Sicherheit zu leisten, soweit sie nicht Befriedigung verlangen können. Dieses Recht steht den Gläubigern jedoch nur zu, wenn sie glaubhaft machen, dass durch die Ausgliederung die Erfüllung der Forderung gefährdet wird."
    },
    {
      "date": "2024-09-27",
      "original_text": "Einreichung neuer Dokumente\nBaden-Württemberg Amtsgericht Stuttgart HRB 727844\nMARQUARDT SERVICE GmbH – Rietheim-Weilheim",
      "type": "Einreichung neuer Dokumente",
      "state": "Baden-Württemberg",
      "amtsgericht": "Amtsgericht Stuttgart",
      "registernummer": "HRB 727844",
      "registerart": "HRB",
      "company_name": "MARQUARDT SERVICE GmbH",
      "company_seat": "Rietheim-Weilheim",
      "details": "27.09.2024 (Bekanntmachungsdatum)\n\nBaden-Württemberg Amtsgericht Stuttgart HRB 727844\nEinreichung neuer Dokumente 27.09.2024 (Eintragungsdatum)\n\nMARQUARDT SERVICE GmbH\nGesellschaft mit beschränkter Haftung\nRietheim-Weilheim\n\nDie Gesellschaft hat am 26.09.2024 die Liste über die Zusammensetzung des Beirats zum Handelsregister eingereicht."
    },
    {
      "date": "2024-09-27",
      "original_text": "Registerbekanntmachung nach dem Umwandlungsgesetz\nNiedersachsen Amtsgericht Braunschweig HRB 201679\nMATEC MANAGEMENT GmbH – Braunschweig",
      "type": "Registerbekanntmachung nach dem Umwandlungsgesetz",
      "state": "Niedersachsen",
      "amtsgericht": "Amtsgericht Braunschweig",
      "registernummer": "HRB 201679",
      "registerart": "HRB",
      "company_name": "MATEC MANAGEMENT GmbH",
      "company_seat": "Braunschweig",
      "details": "27.09.2024 (Bekanntmachungsdatum)\n\nNiedersachsen Amtsgericht Braunschweig HRB 201679\nRegisterbekanntmachung nach dem Umwandlungsgesetz 27.09.2024 (Eintragungsdatum)\n\nMATEC MANAGEMENT GmbH\nGesellschaft mit beschränkter Haftung\nBraunschweig\n\nDen Gläubigern der an der Verschmelzung beteiligten Rechtsträger ist, wenn sie binnen sechs Monaten nach dem Tag, an dem die Eintragung der Verschmelzung in das Register des Sitzes desjenigen Rechtsträgers, dessen Gläubiger sie sind, nach § 19  Abs.  3 UmwG als bekannt gemacht gilt, ihren Anspruch nach Grund und Höhe schriftlich anmelden, Sicherheit zu leisten, soweit sie nicht Befriedigung verlangen können. Dieses Recht steht den Gläubigern jedoch nur zu, wenn sie glaubhaft machen, dass durch die Verschmelzung die Erfüllung der Forderung gefährdet wird."
    },
    {
      "date": "2024-09-27",
      "original_text": "Registerbekanntmachung nach dem Umwandlungsgesetz\nNiedersachsen Amtsgericht Braunschweig HRB 209947\nMATEC® ENGINEERING GmbH – Braunschweig",
      "type": "Registerbekanntmachung nach dem Umwandlungsgesetz",
      "state": "Niedersachsen",
      "amtsgericht": "Amtsgericht Braunschweig",
      "registernummer": "HRB 209947",
      "registerart": "HRB",
      "company_name": "MATEC® ENGINEERING GmbH",
      "company_seat": "Braunschweig",
      "details": "27.09.2024 (Bekanntmachungsdatum)\n\nNiedersachsen Amtsgericht Braunschweig HRB 209947\nRegisterbekanntmachung nach dem Umwandlungsgesetz 27.09.2024 (Eintragungsdatum)\n\nMATEC® ENGINEERING GmbH\nGesellschaft mit beschränkter Haftung\nBraunschweig\n\nDen Gläubigern der an der Verschmelzung beteiligten Rechtsträger ist, wenn sie binnen sechs Monaten nach dem Tag, an dem die Eintragung der Verschmelzung in das Register des Sitzes desjenigen Rechtsträgers, dessen Gläubiger sie sind, nach § 19  Abs.  3 UmwG als bekannt gemacht gilt, ihren Anspruch nach Grund und Höhe schriftlich anmelden, Sicherheit zu leisten, soweit sie nicht Befriedigung verlangen können. Dieses Recht steht den Gläubigern jedoch nur zu, wenn sie glaubhaft machen, dass durch die Verschmelzung die Erfüllung der Forderung gefährdet wird."
    },
    {
      "date": "2024-09-27",
      "original_text": "Registerbekanntmachung nach dem Umwandlungsgesetz\nHessen Amtsgericht Wiesbaden HRB 33491\nMEWA Textil-Service SE – Wiesbaden",
      "type": "Registerbekanntmachung nach dem Umwandlungsgesetz",
      "state": "Hessen",
      "amtsgericht": "Amtsgericht Wiesbaden",
      "registernummer": "HRB 33491",
      "registerart": "HRB",
      "company_name": "MEWA Textil-Service SE",
      "company_seat": "Wiesbaden",
      "details": "27.09.2024 (Bekanntmachungsdatum)\n\nHessen Amtsgericht Wiesbaden HRB 33491\nRegisterbekanntmachung nach dem Umwandlungsgesetz 27.09.2024 (Eintragungsdatum)\n\nMEWA Textil-Service SE\nEuropäische Aktiengesellschaft (SE)\nWiesbaden\n\nDen Gläubigern der an der Verschmelzung beteiligten Rechtsträger ist, wenn sie binnen sechs Monaten nach dem Tag, an dem die Eintragung der Verschmelzung in das Register des Sitzes desjenigen Rechtsträgers, dessen Gläubiger sie sind, nach § 19 Absatz 3 UmwG bekannt gemacht worden ist, ihren Anspruch nach Grund und Höhe schriftlich anmelden, Sicherheit zu leisten, soweit sie nicht Befriedigung verlangen können. Dieses Recht steht den Gläubigern jedoch nur zu, wenn sie glaubhaft machen, dass durch die Verschmelzung die Erfüllung ihrer Forderung gefährdet wird."
    },
    {
      "date": "2024-09-27",
      "original_text": "Löschungsankündigung\nNordrhein-Westfalen Amtsgericht Duisburg HRB 32532\nMTT Transporte GmbH – Oberhausen",
      "type": "Löschungsankündigung",
      "state": "Nordrhein-Westfalen",
      "amtsgericht": "Amtsgericht Duisburg",
      "registernummer": "HRB 32532",
      "registerart": "HRB",
      "company_name": "MTT Transporte GmbH",
      "company_seat": "Oberhausen",
      "details": "27.09.2024 (Bekanntmachungsdatum)\n\nNordrhein-Westfalen Amtsgericht Duisburg HRB 32532\nLöschungsankündigung\n\nMTT Transporte GmbH\nGesellschaft mit beschränkter Haftung\nOberhausen\n\nDas Registergericht beabsichtigt, die im Handelsregister unter HRB 32532  eingetragene Gesellschaft MTT Transporte GmbH  gemäß § 394 FamFG wegen Vermögenslosigkeit von Amts wegen zu löschen. Gegen diese Verfügung kann Widerspruch eingelegt werden. Die Frist zur Erhebung eines Widerspruchs gegen die beabsichtigte Löschung von Amts wegen ist auf drei Monate festgesetzt. Rechtsbehelfsbelehrung Der Widerspruch ist bei dem Amtsgericht Duisburg, Kardinal-Galen-Str. 124-132, 47058 Duisburg schriftlich in deutscher Sprache oder zur Niederschrift der Geschäftsstelle einzulegen. Der Widerspruch kann auch zur Niederschrift der Geschäftsstelle eines jeden Amtsgerichtes abgegeben werden. Die Einlegung ist auch durch Übertragung eines elektronischen Dokuments an die elektronische Poststelle des Gerichts möglich. Das elektronische Dokument muss für die Bearbeitung durch das Gericht geeignet und mit einer qualifizierten elektronischen Signatur der verantwortenden Person versehen sein oder von der verantwortenden Person signiert und auf einem sicheren Übermittlungsweg gemäß § 130 a ZPO nach näherer Maßgabe der Verordnung über die technischen Rahmenbedingungen des elektronischen Rechtsverkehrs und über das besondere elektronische Behördenpostfach (BGBl. I, S. 3803) eingereicht werden. Weitere Informationen erhalten Sie auf der Internetseite www.justiz.de <http://www.justiz.de>. Der Widerspruch muss spätestens innerhalb der gesetzten Frist bei dem Amtsgericht Duisburg eingegangen sein. Dies gilt auch dann, wenn der Widerspruch zur Niederschrift der Geschäftsstelle eines anderen Amtsgerichtes abgegeben wurde. Die Frist beginnt mit der Veröffentlichung. Fällt das Ende der Frist auf einen Sonntag, einen allgemeinen Feiertag oder Sonnabend, so endet die Frist mit Ablauf des nächsten Werktages. Der Widerspruch muss die Bezeichnung der angefochtenen Verfügung sowie die Erklärung enthalten, dass Widerspruch gegen diese Verfügung eingelegt wird. Er ist zu unterzeichnen und soll begründet werden."
    },
    {
      "date": "2024-09-27",
      "original_text": "Registerbekanntmachung nach dem Umwandlungsgesetz\nBaden-Württemberg Amtsgericht Stuttgart HRB 771486\nMVZ Dr. Dilling & Dr. Dr. Watanpour GmbH – Neckarwestheim",
      "type": "Registerbekanntmachung nach dem Umwandlungsgesetz",
      "state": "Baden-Württemberg",
      "amtsgericht": "Amtsgericht Stuttgart",
      "registernummer": "HRB 771486",
      "registerart": "HRB",
      "company_name": "MVZ Dr. Dilling & Dr. Dr. Watanpour GmbH",
      "company_seat": "Neckarwestheim",
      "details": "27.09.2024 (Bekanntmachungsdatum)\n\nBaden-Württemberg Amtsgericht Stuttgart HRB 771486\nRegisterbekanntmachung nach dem Umwandlungsgesetz 27.09.2024 (Eintragungsdatum)\n\nMVZ Dr. Dilling & Dr. Dr. Watanpour GmbH\nGesellschaft mit beschränkter Haftung\nNeckarwestheim\n\nAls nicht eingetragen wird bekanntgemacht:\nDen Gläubigern der an der Verschmelzung beteiligten Rechtsträger ist, wenn sie binnen sechs Monaten nach dem Tag, an dem die Eintragung der Verschmelzung in das Register des Sitzes desjenigen Rechtsträgers, dessen Gläubiger sie sind, nach § 19 Abs. 3 UmwG als bekanntgemacht gilt, ihren Anspruch nach Grund und Höhe schriftlich anmelden, Sicherheit zu leisten, soweit sie nicht Befriedigung verlangen können. Dieses Recht steht den Gläubigern jedoch nur zu, wenn sie glaubhaft machen, dass durch die Verschmelzung die Erfüllung ihrer Forderung gefährdet wird."
    },
    {
      "date": "2024-09-27",
      "original_text": "Registerbekanntmachung nach dem Umwandlungsgesetz\nHamburg Amtsgericht Hamburg HRA 131529\nMarina Wrede e.K. – Hamburg",
      "type": "Registerbekanntmachung nach dem Umwandlungsgesetz",
      "state": "Hamburg",
      "amtsgericht": "Amtsgericht Hamburg",
      "registernummer": "HRA 131529",
      "registerart": "HRA",
      "company_name": "Marina Wrede e.K.",
      "company_seat": "Hamburg",
      "details": "27.09.2024 (Bekanntmachungsdatum)\n\nHamburg Amtsgericht Hamburg HRA 131529\nRegisterbekanntmachung nach dem Umwandlungsgesetz 27.09.2024 (Eintragungsdatum)\n\nMarina Wrede e.K.\nEinzelkaufmann\nHamburg\n\nAls nicht eingetragen wird bekannt gemacht:\nDen Gläubigern der an der Ausgliederung beteiligten Gesellschaften ist, wenn sie binnen sechs Monaten nach dem Tag, an dem die Eintragung der Ausgliederung in das Register des Sitzes desjenigen Rechtsträgers, dessen Gläubiger sie sind, nach § 19 Absatz 3 UmwG als bekannt gemacht gilt, ihren Anspruch nach Grund und Höhe schriftlich anmelden, Sicherheit zu leisten, soweit sie nicht Befriedigung verlangen können. Dieses Recht steht den Gläubigern jedoch nur zu, wenn sie glaubhaft machen, dass durch die Ausgliederung die Erfüllung ihrer Forderung gefährdet wird."
    },
    {
      "date": "2024-09-27",
      "original_text": "Registerbekanntmachung nach dem Umwandlungsgesetz\nRheinland-Pfalz Amtsgericht Ludwigshafen a.Rhein (Ludwigshafen) HRA 62171\nMark Becker IT-Dienstleistungen e. K. – Ludwigshafen am Rhein",
      "type": "Registerbekanntmachung nach dem Umwandlungsgesetz",
      "state": "Rheinland-Pfalz",
      "amtsgericht": "Amtsgericht Ludwigshafen a.Rhein (Ludwigshafen)",
      "registernummer": "HRA 62171",
      "registerart": "HRA",
      "company_name": "Mark Becker IT-Dienstleistungen e. K.",
      "company_seat": "Ludwigshafen am Rhein",
      "details": "27.09.2024 (Bekanntmachungsdatum)\n\nRheinland-Pfalz Amtsgericht Ludwigshafen a.Rhein (Ludwigshafen) HRA 62171\nRegisterbekanntmachung nach dem Umwandlungsgesetz 27.09.2024 (Eintragungsdatum)\n\nMark Becker IT-Dienstleistungen e. K.\nEinzelkaufmann / Einzelkauffrau\nLudwigshafen am Rhein\n\nAls nicht eingetragen wird veröffentlicht: Den Gläubigern der an der Ausgliederung beteiligten Rechtsträger ist, wenn sie binnen sechs Monaten nach dem Tag, an dem die Eintragung der Ausgliederung in das Register des Sitzes desjenigen Rechtsträgers,dessen Gläubiger sie sind, nach § 19 Abs. 3 UmwG als bekannt gemacht gilt, ihren Anspruch nach Grund und Höhe schriftlich anmelden, Sicherheit zu leisten, soweit sie nicht Befriedigung verlangen können. Dieses Recht steht den Gläubigern jedoch nur zu, wenn sie glaubhaft machen, dass durch die Ausgliederung die Erfüllung der Forderung gefährdet wird."
    },
    {
      "date": "2024-09-27",
      "original_text": "Registerbekanntmachung nach dem Umwandlungsgesetz\nHessen Amtsgericht Darmstadt HRA 86170\nMaximilian Michael Prinz von Anhalt e.K. – Groß-Zimmern",
      "type": "Registerbekanntmachung nach dem Umwandlungsgesetz",
      "state": "Hessen",
      "amtsgericht": "Amtsgericht Darmstadt",
      "registernummer": "HRA 86170",
      "registerart": "HRA",
      "company_name": "Maximilian Michael Prinz von Anhalt e.K.",
      "company_seat": "Groß-Zimmern",
      "details": "27.09.2024 (Bekanntmachungsdatum)\n\nHessen Amtsgericht Darmstadt HRA 86170\nRegisterbekanntmachung nach dem Umwandlungsgesetz 27.09.2024 (Eintragungsdatum)\n\nMaximilian Michael Prinz von Anhalt e.K.\nEinzelkaufmann / Einzelkauffrau\nGroß-Zimmern\n\nDen Gläubigern der an der Ausgliederung beteiligten Rechtsträger ist, wenn sie binnen sechs Monaten nach dem Tag, an dem die Eintragung der Ausgliederung in das Register des Sitzes derjenigen Rechtsträger deren Gläubiger sie sind, nach §§ 125, 19 Absatz 3 UmwG bekannt gemacht worden ist, ihren Anspruch nach Grund und Höhe schriftlich anmelden, Sicherheit zu leisten, soweit sie nicht Befriedigung verlangen können. Dieses Recht steht den Gläubigern jedoch nur zu, wenn sie glaubhaft machen, dass durch die Ausgliederung die Erfüllung ihrer Forderung gefährdet wird."
    },
    {
      "date": "2024-09-27",
      "original_text": "Registerbekanntmachung nach dem Umwandlungsgesetz\nBayern Amtsgericht Augsburg HRB 36028\nMedandra GmbH – Schwabmünchen",
      "type": "Registerbekanntmachung nach dem Umwandlungsgesetz",
      "state": "Bayern",
      "amtsgericht": "Amtsgericht Augsburg",
      "registernummer": "HRB 36028",
      "registerart": "HRB",
      "company_name": "Medandra GmbH",
      "company_seat": "Schwabmünchen",
      "details": "27.09.2024 (Bekanntmachungsdatum)\n\nBayern Amtsgericht Augsburg HRB 36028\nRegisterbekanntmachung nach dem Umwandlungsgesetz 26.09.2024 (Eintragungsdatum)\n\nMedandra GmbH\nGesellschaft mit beschränkter Haftung\nSchwabmünchen\n\nDen Gläubigern des formwechselnden Rechtsträgers ist, wenn sie binnen sechs Monaten nach dem Tag, an dem die Eintragung des Formwechsels nach § 201 UmwG als bekannt gemacht gilt, ihren Anspruch nach Grund und Höhe schriftlich anmelden, Sicherheit zu leisten, soweit sie nicht Befriedigung verlangen können. Dieses Recht steht den Gläubigern jedoch nur zu, wenn sie glaubhaft machen, dass durch den Formwechsel die Erfüllung ihrer Forderung gefährdet wird."
    },
    {
      "date": "2024-09-27",
      "original_text": "Registerbekanntmachung nach dem Umwandlungsgesetz\nBrandenburg Amtsgericht Cottbus HRA 3887\nMeergans rooms GmbH & Co. KG – Senftenberg",
      "type": "Registerbekanntmachung nach dem Umwandlungsgesetz",
      "state": "Brandenburg",
      "amtsgericht": "Amtsgericht Cottbus",
      "registernummer": "HRA 3887",
      "registerart": "HRA",
      "company_name": "Meergans rooms GmbH & Co. KG",
      "company_seat": "Senftenberg",
      "details": "27.09.2024 (Bekanntmachungsdatum)\n\nBrandenburg Amtsgericht Cottbus HRA 3887\nRegisterbekanntmachung nach dem Umwandlungsgesetz 26.09.2024 (Eintragungsdatum)\n\nMeergans rooms GmbH & Co. KG\nKommanditgesellschaft\nSenftenberg\n\nAls nicht eingetragen wird veröffentlicht:\nDen Gläubigern der an der Verschmelzung beteiligten Rechtsträger ist, wenn sie binnen sechs Monaten nach dem Tag, an dem die Eintragung der Verschmelzung in das Register des Sitzes desjenigen Rechtsträgers, dessen Gläubiger sie sind, als bekannt gemacht gilt, ihren Anspruch nach Grund und Höhe schriftlich anmelden, Sicherheit zu leisten, soweit sie nicht Befriedigung verlangen können. Dieses Recht steht den Gläubigern jedoch nur zu, wenn sie glaubhaft machen, dass durch die Verschmelzung die Erfüllung ihrer Forderung gefährdet wird"
    },
    {
      "date": "2024-09-27",
      "original_text": "Registerbekanntmachung nach dem Umwandlungsgesetz\nNordrhein-Westfalen Amtsgericht Siegburg HRB 10023\nMerchandise - Investment - Marketing Bleifeld GmbH – Siegburg",
      "type": "Registerbekanntmachung nach dem Umwandlungsgesetz",
      "state": "Nordrhein-Westfalen",
      "amtsgericht": "Amtsgericht Siegburg",
      "registernummer": "HRB 10023",
      "registerart": "HRB",
      "company_name": "Merchandise - Investment - Marketing Bleifeld GmbH",
      "company_seat": "Siegburg",
      "details": "27.09.2024 (Bekanntmachungsdatum)\n\nNordrhein-Westfalen Amtsgericht Siegburg HRB 10023\nRegisterbekanntmachung nach dem Umwandlungsgesetz 27.09.2024 (Eintragungsdatum)\n\nMerchandise - Investment - Marketing Bleifeld GmbH\nGesellschaft mit beschränkter Haftung\nSiegburg\n\nDen Gläubigern der an der Verschmelzung beteiligten Rechtsträger ist, wenn sie binnen sechs Monaten nach dem Tag, an dem die Eintragung der Verschmelzung in das Register des Sitzes desjenigen Rechtsträgers, dessen Gläubiger sie sind, nach § 19 Absatz 3 UmwG als bekanntgemacht gilt, ihren Anspruch nach Grund und Höhe schriftlich anmelden, Sicherheit zu leisten, soweit sie nicht Befriedigung verlangen können. Dieses Recht steht den Gläubigern jedoch nur zu, wenn sie glaubhaft machen, dass durch die Verschmelzung die Erfüllung ihrer Forderung gefährdet wird."
    },
    {
      "date": "2024-09-27",
      "original_text": "Einreichung neuer Dokumente\nBayern Amtsgericht München HRB 172019\nMünchner Wohnen Immobilien 2 GmbH – München",
      "type": "Einreichung neuer Dokumente",
      "state": "Bayern",
      "amtsgericht": "Amtsgericht München",
      "registernummer": "HRB 172019",
      "registerart": "HRB",
      "company_name": "Münchner Wohnen Immobilien 2 GmbH",
      "company_seat": "München",
      "details": "27.09.2024 (Bekanntmachungsdatum)\n\nBayern Amtsgericht München HRB 172019\nEinreichung neuer Dokumente 26.09.2024 (Eintragungsdatum)\n\nMünchner Wohnen Immobilien 2 GmbH\nGesellschaft mit beschränkter Haftung\nMünchen\n\nDem Amtsgericht München -Registergericht- ist eine Liste der Mitglieder des Aufsichtsrats eingereicht worden, § 52 Abs. 3 S. 2 GmbHG."
    },
    {
      "date": "2024-09-27",
      "original_text": "Registerbekanntmachung nach dem Umwandlungsgesetz\nBerlin Amtsgericht Berlin (Charlottenburg) HRB 246779\nNETN GmbH – Berlin",
      "type": "Registerbekanntmachung nach dem Umwandlungsgesetz",
      "state": "Berlin",
      "amtsgericht": "Amtsgericht Berlin (Charlottenburg)",
      "registernummer": "HRB 246779",
      "registerart": "HRB",
      "company_name": "NETN GmbH",
      "company_seat": "Berlin",
      "details": "27.09.2024 (Bekanntmachungsdatum)\n\nBerlin Amtsgericht Berlin (Charlottenburg) HRB 246779\nRegisterbekanntmachung nach dem Umwandlungsgesetz 26.09.2024 (Eintragungsdatum)\n\nNETN GmbH\nGesellschaft mit beschränkter Haftung\nBerlin\n\nZu Eintragungsnummer 5 vom 26.09.2024 wird als nicht eingetragen veröffentlicht:\n\nDen Gläubigern der an der Verschmelzung beteiligten Rechtsträger ist, wenn sie binnen sechs Monaten nach dem Tag, an dem die Eintragung der Verschmelzung in das Register des Sitzes desjenigen Rechtsträgers, dessen Gläubiger sie sind, als bekannt gemacht gilt, ihren Anspruch nach Grund und Höhe schriftlich anmelden, Sicherheit zu leisten, soweit sie nicht Befriedigung verlangen können. Dieses Recht steht den Gläubigern jedoch nur zu, wenn sie glaubhaft machen, dass durch die Verschmelzung die Erfüllung ihrer Forderung gefährdet wird. Das Recht, Sicherheitsleistung zu verlangen, steht Gläubigern nicht zu, die im Falle der Insolvenz ein Recht auf vorzugsweise Befriedigung aus einer Deckungsmasse haben, die nach gesetzlicher Vorschrift zu ihrem Schutz errichtet und staatlich überwacht ist."
    },
    {
      "date": "2024-09-27",
      "original_text": "Registerbekanntmachung nach dem Umwandlungsgesetz\nBayern Amtsgericht Augsburg HRB 39542\nNO COLOUR GmbH – Höchstädt a.d.Donau",
      "type": "Registerbekanntmachung nach dem Umwandlungsgesetz",
      "state": "Bayern",
      "amtsgericht": "Amtsgericht Augsburg",
      "registernummer": "HRB 39542",
      "registerart": "HRB",
      "company_name": "NO COLOUR GmbH",
      "company_seat": "Höchstädt a.d.Donau",
      "details": "27.09.2024 (Bekanntmachungsdatum)\n\nBayern Amtsgericht Augsburg HRB 39542\nRegisterbekanntmachung nach dem Umwandlungsgesetz 26.09.2024 (Eintragungsdatum)\n\nNO COLOUR GmbH\nGesellschaft mit beschränkter Haftung\nHöchstädt a.d.Donau\n\nDen Gläubigern der an der Ausgliederung beteiligten Rechtsträger ist, wenn sie binnen sechs Monaten nach dem Tag, an dem die Eintragung der Ausgliederung in das Register des Sitzes desjenigen Rechtsträgers, dessen Gläubiger sie sind, nach §§ 125, 19 Abs. 3 UmwG als bekannt gemacht gilt, ihren Anspruch nach Grund und Höhe schriftlich anmelden, Sicherheit zu leisten, soweit sie nicht Befriedigung verlangen können. Dieses Recht steht den Gläubigern jedoch nur zu, wenn sie glaubhaft machen, dass durch die Ausgliederung die Erfüllung ihrer Forderung gefährdet wird."
    },
    {
      "date": "2024-09-27",
      "original_text": "Löschungsankündigung\nBayern Amtsgericht Nürnberg HRB 33468\nNiche Bars Meistertrunk UG (haftungsbeschränkt) – Nürnberg",
      "type": "Löschungsankündigung",
      "state": "Bayern",
      "amtsgericht": "Amtsgericht Nürnberg",
      "registernummer": "HRB 33468",
      "registerart": "HRB",
      "company_name": "Niche Bars Meistertrunk UG (haftungsbeschränkt)",
      "company_seat": "Nürnberg",
      "details": "27.09.2024 (Bekanntmachungsdatum)\n\nBayern Amtsgericht Nürnberg HRB 33468\nLöschungsankündigung\n\nNiche Bars Meistertrunk UG (haftungsbeschränkt)\nGesellschaft mit beschränkter Haftung\nNürnberg\n\nDas Registergericht beabsichtigt, die im Handelsregister eingetragene Gesellschaft wegen Vermögenslosigkeit von Amts wegen nach § 394 FamFG zu löschen. Die Frist zur Erhebung eines Widerspruchs ist auf einen Monat festgesetzt."
    },
    {
      "date": "2024-09-27",
      "original_text": "Einreichung neuer Dokumente\nNordrhein-Westfalen Amtsgericht Dortmund HRB 26278\nNordrheinische Erdgastransportleitungs-Verwaltungs-GmbH – Dortmund",
      "type": "Einreichung neuer Dokumente",
      "state": "Nordrhein-Westfalen",
      "amtsgericht": "Amtsgericht Dortmund",
      "registernummer": "HRB 26278",
      "registerart": "HRB",
      "company_name": "Nordrheinische Erdgastransportleitungs-Verwaltungs-GmbH",
      "company_seat": "Dortmund",
      "details": "27.09.2024 (Bekanntmachungsdatum)\n\nNordrhein-Westfalen Amtsgericht Dortmund HRB 26278\nEinreichung neuer Dokumente\n\nNordrheinische Erdgastransportleitungs-Verwaltungs-GmbH\nGesellschaft mit beschränkter Haftung\nDortmund\n\nDem Registergericht ist eine neue Liste der Mitglieder des Aufsichtsrates eingereicht worden."
    },
    {
      "date": "2024-09-27",
      "original_text": "Einreichung neuer Dokumente\nBayern Amtsgericht Nürnberg HRB 1321\nNÜRNBERGER BEAMTEN ALLGEMEINE VERSICHERUNG AKTIENGESELLSCHAFT – Nürnberg",
      "type": "Einreichung neuer Dokumente",
      "state": "Bayern",
      "amtsgericht": "Amtsgericht Nürnberg",
      "registernummer": "HRB 1321",
      "registerart": "HRB",
      "company_name": "NÜRNBERGER BEAMTEN ALLGEMEINE VERSICHERUNG AKTIENGESELLSCHAFT",
      "company_seat": "Nürnberg",
      "details": "27.09.2024 (Bekanntmachungsdatum)\n\nBayern Amtsgericht Nürnberg HRB 1321\nEinreichung neuer Dokumente\n\nNÜRNBERGER BEAMTEN ALLGEMEINE VERSICHERUNG AKTIENGESELLSCHAFT\nAktiengesellschaft\nNürnberg\n\nDem Amtsgericht Nürnberg -Registergericht- ist eine Liste der Mitglieder des Aufsichtsrats eingereicht worden, § 106 AktG."
    },
    {
      "date": "2024-09-27",
      "original_text": "Registerbekanntmachung nach dem Umwandlungsgesetz\nSachsen Amtsgericht Leipzig HRB 41064\nO.tech GmbH – Leipzig",
      "type": "Registerbekanntmachung nach dem Umwandlungsgesetz",
      "state": "Sachsen",
      "amtsgericht": "Amtsgericht Leipzig",
      "registernummer": "HRB 41064",
      "registerart": "HRB",
      "company_name": "O.tech GmbH",
      "company_seat": "Leipzig",
      "details": "27.09.2024 (Bekanntmachungsdatum)\n\nSachsen Amtsgericht Leipzig HRB 41064\nRegisterbekanntmachung nach dem Umwandlungsgesetz 27.09.2024 (Eintragungsdatum)\n\nO.tech GmbH\nGesellschaft mit beschränkter Haftung\nLeipzig\n\nDen Gläubigern der Gesellschaft, deren Forderungen begründet worden sind bevor die Eintragung der Beendigung des Beherrschungs- und Gewinnabführungsvertrages in das Handelsregister nach § 10 des Handelsgesetzbuches als bekanntgemacht gilt, hat der andere Vertragsteil Sicherheit zu leisten, wenn sie sich binnen sechs Monaten nach der Bekanntmachung der Eintragung zu diesem Zweck bei ihm melden."
    },
    {
      "date": "2024-09-27",
      "original_text": "Registerbekanntmachung nach dem Umwandlungsgesetz\nBayern Amtsgericht Augsburg HRB 37706\nObeKo Wohnen GmbH – Aichach",
      "type": "Registerbekanntmachung nach dem Umwandlungsgesetz",
      "state": "Bayern",
      "amtsgericht": "Amtsgericht Augsburg",
      "registernummer": "HRB 37706",
      "registerart": "HRB",
      "company_name": "ObeKo Wohnen GmbH",
      "company_seat": "Aichach",
      "details": "27.09.2024 (Bekanntmachungsdatum)\n\nBayern Amtsgericht Augsburg HRB 37706\nRegisterbekanntmachung nach dem Umwandlungsgesetz 26.09.2024 (Eintragungsdatum)\n\nObeKo Wohnen GmbH\nGesellschaft mit beschränkter Haftung\nAichach\n\nDen Gläubigern des formwechselnden Rechtsträgers ist, wenn sie binnen sechs Monaten nach dem Tag, an dem die Eintragung des Formwechsels nach § 201 UmwG als bekannt gemacht gilt, ihren Anspruch nach Grund und Höhe schriftlich anmelden, Sicherheit zu leisten, soweit sie nicht Befriedigung verlangen können. Dieses Recht steht den Gläubigern jedoch nur zu, wenn sie glaubhaft machen, dass durch den Formwechsel die Erfüllung ihrer Forderung gefährdet wird."
    },
    {
      "date": "2024-09-27",
      "original_text": "Registerbekanntmachung nach dem Umwandlungsgesetz\nBayern Amtsgericht Augsburg GsR 306\nObeKo Wohnen eGbR – Aichach",
      "type": "Registerbekanntmachung nach dem Umwandlungsgesetz",
      "state": "Bayern",
      "amtsgericht": "Amtsgericht Augsburg",
      "registernummer": "GsR 306",
      "registerart": "GsR",
      "company_name": "ObeKo Wohnen eGbR",
      "company_seat": "Aichach",
      "details": "27.09.2024 (Bekanntmachungsdatum)\n\nBayern Amtsgericht Augsburg GsR 306\nRegisterbekanntmachung nach dem Umwandlungsgesetz 26.09.2024 (Eintragungsdatum)\n\nObeKo Wohnen eGbR\nGesellschaft bürgerlichen Rechts\nAichach\n\nDen Gläubigern des formwechselnden Rechtsträgers ist, wenn sie binnen sechs Monaten nach dem Tag, an dem die Eintragung des Formwechsels nach § 201 UmwG als bekannt gemacht gilt, ihren Anspruch nach Grund und Höhe schriftlich anmelden, Sicherheit zu leisten, soweit sie nicht Befriedigung verlangen können. Dieses Recht steht den Gläubigern jedoch nur zu, wenn sie glaubhaft machen, dass durch den Formwechsel die Erfüllung ihrer Forderung gefährdet wird."
    },
    {
      "date": "2024-09-27",
      "original_text": "Löschungsankündigung\nSachsen Amtsgericht Dresden HRB 41793\nPHERKA Solutions GmbH – Zittau",
      "type": "Löschungsankündigung",
      "state": "Sachsen",
      "amtsgericht": "Amtsgericht Dresden",
      "registernummer": "HRB 41793",
      "registerart": "HRB",
      "company_name": "PHERKA Solutions GmbH",
      "company_seat": "Zittau",
      "details": "27.09.2024 (Bekanntmachungsdatum)\n\nSachsen Amtsgericht Dresden HRB 41793\nLöschungsankündigung\n\nPHERKA Solutions GmbH\nGesellschaft mit beschränkter Haftung\nZittau\n\nDas Registergericht beabsichtigt, die im Handelsregister eingetragene Gesellschaft von Amts wegen nach § 394 FamFG zu löschen. Die Frist zu Erhebung eines Widerspruchs gegen die beabsichtigte Löschung wird auf einen Monat festgesetzt."
    },
    {
      "date": "2024-09-27",
      "original_text": "Registerbekanntmachung nach dem Umwandlungsgesetz\nBerlin Amtsgericht Berlin (Charlottenburg) HRB 16992\nPSI Automotive & Industry GmbH – Berlin",
      "type": "Registerbekanntmachung nach dem Umwandlungsgesetz",
      "state": "Berlin",
      "amtsgericht": "Amtsgericht Berlin (Charlottenburg)",
      "registernummer": "HRB 16992",
      "registerart": "HRB",
      "company_name": "PSI Automotive & Industry GmbH",
      "company_seat": "Berlin",
      "details": "27.09.2024 (Bekanntmachungsdatum)\n\nBerlin Amtsgericht Berlin (Charlottenburg) HRB 16992\nRegisterbekanntmachung nach dem Umwandlungsgesetz 26.09.2024 (Eintragungsdatum)\n\nPSI Automotive & Industry GmbH\nGesellschaft mit beschränkter Haftung\nBerlin\n\nZu Eintragungsnummer 39 vom 26.09.2024 wird als nicht eingetragen veröffentlicht: Den Gläubigern der an der Verschmelzung beteiligten Rechtsträger ist, wenn sie binnen sechs Monaten nach dem Tag, an dem die Eintragung der Verschmelzung in das Register des Sitzes desjenigen Rechtsträgers, dessen Gläubiger sie sind, als bekannt gemacht gilt, ihren Anspruch nach Grund und Höhe schriftlich anmelden, Sicherheit zu leisten, soweit sie nicht Befriedigung verlangen können. Dieses Recht steht den Gläubigern jedoch nur zu, wenn sie glaubhaft machen, dass durch die Verschmelzung die Erfüllung ihrer Forderung gefährdet wird. Das Recht, Sicherheitsleistung zu verlangen, steht Gläubigern nicht zu, die im Falle der Insolvenz ein Recht auf vorzugsweise Befriedigung aus einer Deckungsmasse haben, die nach gesetzlicher Vorschrift zu ihrem Schutz errichtet und staatlich überwacht ist."
    },
    {
      "date": "2024-09-27",
      "original_text": "Registerbekanntmachung nach dem Umwandlungsgesetz\nBerlin Amtsgericht Berlin (Charlottenburg) HRB 255242\nPSI Software SE – Berlin",
      "type": "Registerbekanntmachung nach dem Umwandlungsgesetz",
      "state": "Berlin",
      "amtsgericht": "Amtsgericht Berlin (Charlottenburg)",
      "registernummer": "HRB 255242",
      "registerart": "HRB",
      "company_name": "PSI Software SE",
      "company_seat": "Berlin",
      "details": "27.09.2024 (Bekanntmachungsdatum)\n\nBerlin Amtsgericht Berlin (Charlottenburg) HRB 255242\nRegisterbekanntmachung nach dem Umwandlungsgesetz 26.09.2024 (Eintragungsdatum)\n\nPSI Software SE\nEuropäische Aktiengesellschaft (SE)\nBerlin\n\nZu Eintragungsnummer 14 vom 26.09.2024 wird als nicht eingetragen veröffentlicht: Den Gläubigern der an der Verschmelzung beteiligten Rechtsträger ist, wenn sie binnen sechs Monaten nach dem Tag, an dem die Eintragung der Verschmelzung in das Register des Sitzes desjenigen Rechtsträgers, dessen Gläubiger sie sind, als bekannt gemacht gilt, ihren Anspruch nach Grund und Höhe schriftlich anmelden, Sicherheit zu leisten, soweit sie nicht Befriedigung verlangen können. Dieses Recht steht den Gläubigern jedoch nur zu, wenn sie glaubhaft machen, dass durch die Verschmelzung die Erfüllung ihrer Forderung gefährdet wird. Das Recht, Sicherheitsleistung zu verlangen, steht Gläubigern nicht zu, die im Falle der Insolvenz ein Recht auf vorzugsweise Befriedigung aus einer Deckungsmasse haben, die nach gesetzlicher Vorschrift zu ihrem Schutz errichtet und staatlich überwacht ist."
    },
    {
      "date": "2024-09-27",
      "original_text": "Registerbekanntmachung nach dem Umwandlungsgesetz\nSachsen Amtsgericht Leipzig HRB 31899\nPan Asia Properties GmbH – Leipzig",
      "type": "Registerbekanntmachung nach dem Umwandlungsgesetz",
      "state": "Sachsen",
      "amtsgericht": "Amtsgericht Leipzig",
      "registernummer": "HRB 31899",
      "registerart": "HRB",
      "company_name": "Pan Asia Properties GmbH",
      "company_seat": "Leipzig",
      "details": "27.09.2024 (Bekanntmachungsdatum)\n\nSachsen Amtsgericht Leipzig HRB 31899\nRegisterbekanntmachung nach dem Umwandlungsgesetz 27.09.2024 (Eintragungsdatum)\n\nPan Asia Properties GmbH\nGesellschaft mit beschränkter Haftung\nLeipzig\n\nDen Gläubigern der an der #DV.Auswahl(Text=\"Betreffende Alternative auswählen\",Eingabe=\"Verschmelzung beteiligten Rechtsträger ist, wenn sie binnen sechs Monaten nach dem Tag, an dem die Eintragung der Verschmelzung in das Register des Sitzes desjenigen Rechtsträgers, dessen Gläubiger sie sind, nach § 19 Abs. 3 UmwG als bekannt gemacht gilt, ihren Anspruch nach Grund und Höhe schriftlich anmelden, Sicherheit zu leisten, soweit sie nicht Befriedigung verlangen können. Dieses Recht steht den Gläubigern jedoch nur zu, wenn sie glaubhaft machen, dass durch die Verschmelzung die Erfüllung der Forderung gefährdet wird.\"|\"Verschmelzung\",\"Spaltung beteiligten Rechtsträger ist, wenn sie binnen sechs Monaten nach dem Tag, an dem die Eintragung der Spaltung in das Register des Sitzes desjenigen Rechtsträgers, dessen Gläubiger sie sind, nach § 19 Abs. 3 UmwG als bekannt gemacht gilt, ihren Anspruch nach Grund und Höhe schriftlich anmelden, Sicherheit zu leisten, soweit sie nicht Befriedigung verlangen können. Dieses Recht steht den Gläubigern jedoch nur zu, wenn sie glaubhaft machen, dass durch die Spaltung die Erfüllung der Forderung gefährdet wird.\"|\"Spaltung\",\"Umwandlung beteiligten Rechtsträger ist, wenn sie binnen sechs Monaten nach dem Tag, an dem die Eintragung der Umwandlung  in das Register des Sitzes desjenigen Rechtsträgers, dessen Gläubiger sie sind, nach § 19 Abs. 3 UmwG als bekannt gemacht gilt, ihren Anspruch nach Grund und Höhe schriftlich anmelden, Sicherheit zu leisten, soweit sie nicht Befriedigung verlangen können. Dieses Recht steht den Gläubigern jedoch nur zu, wenn sie glaubhaft machen, dass durch die Umwandlung die Erfüllung der Forderung gefährdet wird.\"|\"Umwandlung\",\"Ausgliederung beteiligten Rechtsträger ist, wenn sie binnen sechs Monaten nach dem Tag, an dem die Eintragung der Ausgliederung in das Register des Sitzes desjenigen Rechtsträgers, dessen Gläubiger sie sind, nach § 19 Abs. 3 UmwG als bekannt gemacht gilt, ihren Anspruch nach Grund und Höhe schriftlich anmelden, Sicherheit zu leisten, soweit sie nicht Befriedigung verlangen können. Dieses Recht steht den Gläubigern jedoch nur zu, wenn sie glaubhaft machen, dass durch die Ausgliederung die Erfüllung der Forderung gefährdet wird.\"|\"Ausgliederung\")"
    },
    {
      "date": "2024-09-27",
      "original_text": "Registerbekanntmachung nach dem Umwandlungsgesetz\nHamburg Amtsgericht Hamburg HRB 152730\nPi55 Energie UG (haftungsbeschränkt) – Hamburg",
      "type": "Registerbekanntmachung nach dem Umwandlungsgesetz",
      "state": "Hamburg",
      "amtsgericht": "Amtsgericht Hamburg",
      "registernummer": "HRB 152730",
      "registerart": "HRB",
      "company_name": "Pi55 Energie UG (haftungsbeschränkt)",
      "company_seat": "Hamburg",
      "details": "27.09.2024 (Bekanntmachungsdatum)\n\nHamburg Amtsgericht Hamburg HRB 152730\nRegisterbekanntmachung nach dem Umwandlungsgesetz 27.09.2024 (Eintragungsdatum)\n\nPi55 Energie UG (haftungsbeschränkt)\nGesellschaft mit beschränkter Haftung\nHamburg\n\nAls nicht eingetragen wird bekannt gemacht:\nDen Gläubigern der an der Verschmelzung beteiligten Gesellschaften ist, wenn sie binnen sechs Monaten nach dem Tag, an dem die Eintragung der Verschmelzung in das Register des Sitzes desjenigen Rechtsträgers, dessen Gläubiger sie sind, nach § 19 Absatz 3 UmwG als bekannt gemacht gilt, ihren Anspruch nach Grund und Höhe schriftlich anmelden, Sicherheit zu leisten, soweit sie nicht Befriedigung verlangen können. Dieses Recht steht den Gläubigern jedoch nur zu, wenn sie glaubhaft machen, dass durch die Verschmelzung die Erfüllung ihrer Forderung gefährdet wird."
    },
    {
      "date": "2024-09-27",
      "original_text": "Einreichung neuer Dokumente\nBerlin Amtsgericht Berlin (Charlottenburg) HRB 73354\nPolfrucht Aktiengesellschaft – Berlin",
      "type": "Einreichung neuer Dokumente",
      "state": "Berlin",
      "amtsgericht": "Amtsgericht Berlin (Charlottenburg)",
      "registernummer": "HRB 73354",
      "registerart": "HRB",
      "company_name": "Polfrucht Aktiengesellschaft",
      "company_seat": "Berlin",
      "details": "27.09.2024 (Bekanntmachungsdatum)\n\nBerlin Amtsgericht Berlin (Charlottenburg) HRB 73354\nEinreichung neuer Dokumente\n\nPolfrucht Aktiengesellschaft\nAktiengesellschaft\nBerlin\n\nAls nicht eingetragen wird veröffentlicht: Es wurde eine neue Liste der Aufsichtsratsmitglieder eingereicht (§ 106 AktG)."
    },
    {
      "date": "2024-09-27",
      "original_text": "Registerbekanntmachung nach dem Umwandlungsgesetz\nNordrhein-Westfalen Amtsgericht Düsseldorf HRA 27734\nPositio Pharma - Inh. Dipl.-Betriebsw. Frank Adler e.K. – Düsseldorf",
      "type": "Registerbekanntmachung nach dem Umwandlungsgesetz",
      "state": "Nordrhein-Westfalen",
      "amtsgericht": "Amtsgericht Düsseldorf",
      "registernummer": "HRA 27734",
      "registerart": "HRA",
      "company_name": "Positio Pharma - Inh. Dipl.-Betriebsw. Frank Adler e.K.",
      "company_seat": "Düsseldorf",
      "details": "27.09.2024 (Bekanntmachungsdatum)\n\nNordrhein-Westfalen Amtsgericht Düsseldorf HRA 27734\nRegisterbekanntmachung nach dem Umwandlungsgesetz 27.09.2024 (Eintragungsdatum)\n\nPositio Pharma - Inh. Dipl.-Betriebsw. Frank Adler e.K.\nEinzelkaufmann / Einzelkauffrau\nDüsseldorf\n\nDen Gläubigern der an der Ausgliederung beteiligten Rechtsträger ist, wenn sie binnen sechs Monaten nach dem Tag, an dem die Eintragung der Ausgliederung in das Register des Sitzes desjenigen Rechtsträgers, dessen Gläubiger sie sind, nach § 19 Absatz 3 UmwG als bekanntgemacht gilt, ihren Anspruch nach Grund und Höhe schriftlich anmelden, Sicherheit zu leisten, soweit sie nicht Befriedigung verlangen können. Dieses Recht steht den Gläubigern jedoch nur zu, wenn sie glaubhaft machen, dass durch die Ausgliederung die Erfüllung ihrer Forderung gefährdet wird."
    },
    {
      "date": "2024-09-27",
      "original_text": "Registerbekanntmachung nach dem Umwandlungsgesetz\nNordrhein-Westfalen Amtsgericht Düsseldorf HRA 27939\nPositio Pharma GmbH & Co. KG – Düsseldorf",
      "type": "Registerbekanntmachung nach dem Umwandlungsgesetz",
      "state": "Nordrhein-Westfalen",
      "amtsgericht": "Amtsgericht Düsseldorf",
      "registernummer": "HRA 27939",
      "registerart": "HRA",
      "company_name": "Positio Pharma GmbH & Co. KG",
      "company_seat": "Düsseldorf",
      "details": "27.09.2024 (Bekanntmachungsdatum)\n\nNordrhein-Westfalen Amtsgericht Düsseldorf HRA 27939\nRegisterbekanntmachung nach dem Umwandlungsgesetz 27.09.2024 (Eintragungsdatum)\n\nPositio Pharma GmbH & Co. KG\nKommanditgesellschaft\nDüsseldorf\n\nDen Gläubigern der an der Ausgliederung beteiligten Rechtsträger ist, wenn sie binnen sechs Monaten nach dem Tag, an dem die Eintragung der Ausgliederung in das Register des Sitzes desjenigen Rechtsträgers, dessen Gläubiger sie sind, nach § 19 Absatz 3 UmwG als bekanntgemacht gilt, ihren Anspruch nach Grund und Höhe schriftlich anmelden, Sicherheit zu leisten, soweit sie nicht Befriedigung verlangen können. Dieses Recht steht den Gläubigern jedoch nur zu, wenn sie glaubhaft machen, dass durch die Ausgliederung die Erfüllung ihrer Forderung gefährdet wird."
    },
    {
      "date": "2024-09-27",
      "original_text": "Löschungsankündigung\nBerlin Amtsgericht Berlin (Charlottenburg) HRB 79761\nPrimanus Steuerberatungsgesellschaft mbH – Berlin",
      "type": "Löschungsankündigung",
      "state": "Berlin",
      "amtsgericht": "Amtsgericht Berlin (Charlottenburg)",
      "registernummer": "HRB 79761",
      "registerart": "HRB",
      "company_name": "Primanus Steuerberatungsgesellschaft mbH",
      "company_seat": "Berlin",
      "details": "27.09.2024 (Bekanntmachungsdatum)\n\nBerlin Amtsgericht Berlin (Charlottenburg) HRB 79761\nLöschungsankündigung\n\nPrimanus Steuerberatungsgesellschaft mbH\nGesellschaft mit beschränkter Haftung\nBerlin\n\nBei der nachstehenden Gesellschaft wird das Amtslöschungsverfahren gemäß § 394 FamFG eingeleitet. Widerspruchsfrist 8 Wochen"
    },
    {
      "date": "2024-09-27",
      "original_text": "Registerbekanntmachung nach dem Umwandlungsgesetz\nBayern Amtsgericht München HRB 205831\nProjektentwicklung Kreiller214 GmbH – München",
      "type": "Registerbekanntmachung nach dem Umwandlungsgesetz",
      "state": "Bayern",
      "amtsgericht": "Amtsgericht München",
      "registernummer": "HRB 205831",
      "registerart": "HRB",
      "company_name": "Projektentwicklung Kreiller214 GmbH",
      "company_seat": "München",
      "details": "27.09.2024 (Bekanntmachungsdatum)\n\nBayern Amtsgericht München HRB 205831\nRegisterbekanntmachung nach dem Umwandlungsgesetz 26.09.2024 (Eintragungsdatum)\n\nProjektentwicklung Kreiller214 GmbH\nGesellschaft mit beschränkter Haftung\nMünchen\n\nDen Gläubigern der an der Verschmelzung beteiligten Rechtsträger ist, wenn sie binnen sechs Monaten nach dem Tag, an dem die Eintragung der Verschmelzung in das Register des Sitzes desjenigen Rechtsträgers, dessen Gläubiger sie sind, nach § 19 Abs. 3 UmwG als bekannt gemacht gilt, ihren Anspruch nach Grund und Höhe schriftlich anmelden, Sicherheit zu leisten, soweit sie nicht Befriedigung verlangen können. Dieses Recht steht den Gläubigern jedoch nur zu, wenn sie glaubhaft machen, dass durch die Verschmelzung die Erfüllung ihrer Forderung gefährdet wird."
    },
    {
      "date": "2024-09-27",
      "original_text": "Löschungsankündigung\nBerlin Amtsgericht Berlin (Charlottenburg) HRB 251364\nQoup GmbH – Berlin",
      "type": "Löschungsankündigung",
      "state": "Berlin",
      "amtsgericht": "Amtsgericht Berlin (Charlottenburg)",
      "registernummer": "HRB 251364",
      "registerart": "HRB",
      "company_name": "Qoup GmbH",
      "company_seat": "Berlin",
      "details": "27.09.2024 (Bekanntmachungsdatum)\n\nBerlin Amtsgericht Berlin (Charlottenburg) HRB 251364\nLöschungsankündigung\n\nQoup GmbH\nGesellschaft mit beschränkter Haftung\nBerlin\n\nBei der nachstehenden Gesellschaft wird das Amtslöschungsverfahren gemäß § 394 FamFG eingeleitet. Widerspruchsfrist 6 Wochen"
    },
    {
      "date": "2024-09-27",
      "original_text": "Registerbekanntmachung nach dem Umwandlungsgesetz\nNordrhein-Westfalen Amtsgericht Dortmund HRB 17334 früher Amtsgericht Lünen\nREMONDIS Medison GmbH – Lünen",
      "type": "Registerbekanntmachung nach dem Umwandlungsgesetz",
      "state": "Nordrhein-Westfalen",
      "amtsgericht": "Amtsgericht Dortmund",
      "registernummer": "HRB 17334",
      "registerart": "HRB",
      "company_name": "REMONDIS Medison GmbH",
      "company_seat": "Lünen",
      "former_amtsgericht": "Lünen",
      "details": "27.09.2024 (Bekanntmachungsdatum)\n\nNordrhein-Westfalen Amtsgericht Dortmund HRB 17334 früher Amtsgericht Lünen\nRegisterbekanntmachung nach dem Umwandlungsgesetz 26.09.2024 (Eintragungsdatum)\n\nREMONDIS Medison GmbH\nGesellschaft mit beschränkter Haftung\nLünen\n\nDen Gläubigern der an der Verschmelzung beteiligten Rechtsträger ist, wenn sie binnen sechs Monaten nach dem Tag, an dem die Eintragung der Verschmelzung in das Register des Sitzes desjenigen Rechtsträgers, dessen Gläubiger sie sind, nach § 19 Absatz 3 UmwG als bekanntgemacht gilt, ihren Anspruch nach Grund und Höhe schriftlich anmelden, Sicherheit zu leisten, soweit sie nicht Befriedigung verlangen können. Dieses Recht steht den Gläubigern jedoch nur zu, wenn sie glaubhaft machen, dass durch die Verschmelzung die Erfüllung ihrer Forderung gefährdet wird."
    },
    {
      "date": "2024-09-27",
      "original_text": "Löschungsankündigung\nNiedersachsen Amtsgericht Lüneburg HRB 205103\nRaven Bauprojektgesellschaft mbH – Brackel",
      "type": "Löschungsankündigung",
      "state": "Niedersachsen",
      "amtsgericht": "Amtsgericht Lüneburg",
      "registernummer": "HRB 205103",
      "registerart": "HRB",
      "company_name": "Raven Bauprojektgesellschaft mbH",
      "company_seat": "Brackel",
      "details": "27.09.2024 (Bekanntmachungsdatum)\n\nNiedersachsen Amtsgericht Lüneburg HRB 205103\nLöschungsankündigung\n\nRaven Bauprojektgesellschaft mbH\nGesellschaft mit beschränkter Haftung\nBrackel\n\nDas Registergericht beabsichtigt, die Gesellschaft von Amts wegen nach § 394 FamFG zu löschen. Die Frist zur Erhebung eines Widerspruchs ist auf 1 Monat ab dieser Registerbekanntmachung festgesetzt."
    },
    {
      "date": "2024-09-27",
      "original_text": "Registerbekanntmachung nach dem Umwandlungsgesetz\nBerlin Amtsgericht Berlin (Charlottenburg) HRB 224342\nRazor Group Acquisition I GmbH – Berlin",
      "type": "Registerbekanntmachung nach dem Umwandlungsgesetz",
      "state": "Berlin",
      "amtsgericht": "Amtsgericht Berlin (Charlottenburg)",
      "registernummer": "HRB 224342",
      "registerart": "HRB",
      "company_name": "Razor Group Acquisition I GmbH",
      "company_seat": "Berlin",
      "details": "27.09.2024 (Bekanntmachungsdatum)\n\nBerlin Amtsgericht Berlin (Charlottenburg) HRB 224342\nRegisterbekanntmachung nach dem Umwandlungsgesetz 26.09.2024 (Eintragungsdatum)\n\nRazor Group Acquisition I GmbH\nGesellschaft mit beschränkter Haftung\nBerlin\n\nZu Eintragungsnummer 12 vom 26.09.2024 wird als nicht eingetragen veröffentlicht:\n\nDen Gläubigern der an der Verschmelzung beteiligten Rechtsträger ist, wenn sie binnen sechs Monaten nach dem Tag, an dem die Eintragung der Verschmelzung in das Register des Sitzes desjenigen Rechtsträgers, dessen Gläubiger sie sind, als bekannt gemacht gilt, ihren Anspruch nach Grund und Höhe schriftlich anmelden, Sicherheit zu leisten, soweit sie nicht Befriedigung verlangen können. Dieses Recht steht den Gläubigern jedoch nur zu, wenn sie glaubhaft machen, dass durch die Verschmelzung die Erfüllung ihrer Forderung gefährdet wird. Das Recht, Sicherheitsleistung zu verlangen, steht Gläubigern nicht zu, die im Falle der Insolvenz ein Recht auf vorzugsweise Befriedigung aus einer Deckungsmasse haben, die nach gesetzlicher Vorschrift zu ihrem Schutz errichtet und staatlich überwacht ist."
    },
    {
      "date": "2024-09-27",
      "original_text": "Registerbekanntmachung nach dem Umwandlungsgesetz\nHessen Amtsgericht Frankfurt am Main HRB 119362\nRazor Group Acquisition VI UG (haftungsbeschränkt) – Frankfurt am Main",
      "type": "Registerbekanntmachung nach dem Umwandlungsgesetz",
      "state": "Hessen",
      "amtsgericht": "Amtsgericht Frankfurt am Main",
      "registernummer": "HRB 119362",
      "registerart": "HRB",
      "company_name": "Razor Group Acquisition VI UG (haftungsbeschränkt)",
      "company_seat": "Frankfurt am Main",
      "details": "27.09.2024 (Bekanntmachungsdatum)\n\nHessen Amtsgericht Frankfurt am Main HRB 119362\nRegisterbekanntmachung nach dem Umwandlungsgesetz 27.09.2024 (Eintragungsdatum)\n\nRazor Group Acquisition VI UG (haftungsbeschränkt)\nGesellschaft mit beschränkter Haftung\nFrankfurt am Main\n\nDen Gläubigern der an der Verschmelzung beteiligten Rechtsträger ist, wenn sie binnen sechs Monaten nach dem Tag, an dem die Eintragung der Verschmelzung in das Register des Sitzes desjenigen Rechtsträgers, dessen Gläubiger sie sind, nach § 19 Absatz 3 UmwG bekannt gemacht worden ist, ihren Anspruch nach Grund und Höhe schriftlich anmelden, Sicherheit zu leisten, soweit sie nicht Befriedigung verlangen können. Dieses Recht steht den Gläubigern jedoch nur zu, wenn sie glaubhaft machen, dass durch die Verschmelzung die Erfüllung ihrer Forderung gefährdet wird."
    },
    {
      "date": "2024-09-27",
      "original_text": "Löschungsankündigung\nNordrhein-Westfalen Amtsgericht Duisburg HRB 31061\nRenova LN GmbH – Mülheim an der Ruhr",
      "type": "Löschungsankündigung",
      "state": "Nordrhein-Westfalen",
      "amtsgericht": "Amtsgericht Duisburg",
      "registernummer": "HRB 31061",
      "registerart": "HRB",
      "company_name": "Renova LN GmbH",
      "company_seat": "Mülheim an der Ruhr",
      "details": "27.09.2024 (Bekanntmachungsdatum)\n\nNordrhein-Westfalen Amtsgericht Duisburg HRB 31061\nLöschungsankündigung\n\nRenova LN GmbH\nGesellschaft mit beschränkter Haftung\nMülheim an der Ruhr\n\nDas Registergericht beabsichtigt, die im Handelsregister unter HRB 31061  eingetragene Gesellschaft Renova LN GmbH  gemäß § 394 FamFG wegen Vermögenslosigkeit von Amts wegen zu löschen. Gegen diese Verfügung kann Widerspruch eingelegt werden. Die Frist zur Erhebung eines Widerspruchs gegen die beabsichtigte Löschung von Amts wegen ist auf drei Monate festgesetzt. Rechtsbehelfsbelehrung Der Widerspruch ist bei dem Amtsgericht Duisburg, Kardinal-Galen-Str. 124-132, 47058 Duisburg schriftlich in deutscher Sprache oder zur Niederschrift der Geschäftsstelle einzulegen. Der Widerspruch kann auch zur Niederschrift der Geschäftsstelle eines jeden Amtsgerichtes abgegeben werden. Die Einlegung ist auch durch Übertragung eines elektronischen Dokuments an die elektronische Poststelle des Gerichts möglich. Das elektronische Dokument muss für die Bearbeitung durch das Gericht geeignet und mit einer qualifizierten elektronischen Signatur der verantwortenden Person versehen sein oder von der verantwortenden Person signiert und auf einem sicheren Übermittlungsweg gemäß § 130 a ZPO nach näherer Maßgabe der Verordnung über die technischen Rahmenbedingungen des elektronischen Rechtsverkehrs und über das besondere elektronische Behördenpostfach (BGBl. I, S. 3803) eingereicht werden. Weitere Informationen erhalten Sie auf der Internetseite www.justiz.de <http://www.justiz.de>. Der Widerspruch muss spätestens innerhalb der gesetzten Frist bei dem Amtsgericht Duisburg eingegangen sein. Dies gilt auch dann, wenn der Widerspruch zur Niederschrift der Geschäftsstelle eines anderen Amtsgerichtes abgegeben wurde. Die Frist beginnt mit der Veröffentlichung. Fällt das Ende der Frist auf einen Sonntag, einen allgemeinen Feiertag oder Sonnabend, so endet die Frist mit Ablauf des nächsten Werktages. Der Widerspruch muss die Bezeichnung der angefochtenen Verfügung sowie die Erklärung enthalten, dass Widerspruch gegen diese Verfügung eingelegt wird. Er ist zu unterzeichnen und soll begründet werden."
    },
    {
      "date": "2024-09-27",
      "original_text": "Registerbekanntmachung nach dem Umwandlungsgesetz\nSachsen Amtsgericht Dresden HRB 16371\nRönsch GmbH, Heizung-, Gas- und Wasserinstallation – Pesterwitz",
      "type": "Registerbekanntmachung nach dem Umwandlungsgesetz",
      "state": "Sachsen",
      "amtsgericht": "Amtsgericht Dresden",
      "registernummer": "HRB 16371",
      "registerart": "HRB",
      "company_name": "Rönsch GmbH, Heizung-, Gas- und Wasserinstallation",
      "company_seat": "Pesterwitz",
      "details": "27.09.2024 (Bekanntmachungsdatum)\n\nSachsen Amtsgericht Dresden HRB 16371\nRegisterbekanntmachung nach dem Umwandlungsgesetz 27.09.2024 (Eintragungsdatum)\n\nRönsch GmbH, Heizung-, Gas- und Wasserinstallation\nGesellschaft mit beschränkter Haftung\nPesterwitz\n\nDen Gläubigern der an der Verschmelzung beteiligten Rechtsträger ist, wenn sie binnen sechs Monaten nach dem Tag, an dem die Eintragung der Verschmelzung in das Register des Sitzes desjenigen Rechtsträgers, dessen Gläubiger sie sind, nach § 19 Abs. 3 UmwG als bekannt gemacht gilt, ihren Anspruch nach Grund und Höhe schriftlich anmelden, Sicherheit zu leisten, soweit sie nicht Befriedigung verlangen können. Dieses Recht steht den Gläubigern jedoch nur zu, wenn sie glaubhaft machen, dass durch die Verschmelzung die Erfüllung der Forderung gefährdet wird."
    },
    {
      "date": "2024-09-27",
      "original_text": "Registerbekanntmachung nach dem Umwandlungsgesetz\nBayern Amtsgericht Nürnberg HRB 37529\nS.A.S Security UG (haftungsbeschränkt) – Heideck",
      "type": "Registerbekanntmachung nach dem Umwandlungsgesetz",
      "state": "Bayern",
      "amtsgericht": "Amtsgericht Nürnberg",
      "registernummer": "HRB 37529",
      "registerart": "HRB",
      "company_name": "S.A.S Security UG (haftungsbeschränkt)",
      "company_seat": "Heideck",
      "details": "27.09.2024 (Bekanntmachungsdatum)\n\nBayern Amtsgericht Nürnberg HRB 37529\nRegisterbekanntmachung nach dem Umwandlungsgesetz 26.09.2024 (Eintragungsdatum)\n\nS.A.S Security UG (haftungsbeschränkt)\nGesellschaft mit beschränkter Haftung\nHeideck\n\nDen Gläubigern der an der Ausgliederung beteiligten Rechtsträger ist, wenn sie binnen sechs Monaten nach dem Tag, an dem die Eintragung der Ausgliederung in das Register des Sitzes desjenigen Rechtsträgers, dessen Gläubiger sie sind, nach §§ 125, 19 Abs. 3 UmwG als bekannt gemacht gilt, ihren Anspruch nach Grund und Höhe schriftlich anmelden, Sicherheit zu leisten, soweit sie nicht Befriedigung verlangen können. Dieses Recht steht den Gläubigern jedoch nur zu, wenn sie glaubhaft machen, dass durch die Ausgliederung die Erfüllung ihrer Forderung gefährdet wird."
    },
    {
      "date": "2024-09-27",
      "original_text": "Registerbekanntmachung nach dem Umwandlungsgesetz\nBayern Amtsgericht Nürnberg HRA 20184\nS.A.S Security e.K. – Heideck",
      "type": "Registerbekanntmachung nach dem Umwandlungsgesetz",
      "state": "Bayern",
      "amtsgericht": "Amtsgericht Nürnberg",
      "registernummer": "HRA 20184",
      "registerart": "HRA",
      "company_name": "S.A.S Security e.K.",
      "company_seat": "Heideck",
      "details": "27.09.2024 (Bekanntmachungsdatum)\n\nBayern Amtsgericht Nürnberg HRA 20184\nRegisterbekanntmachung nach dem Umwandlungsgesetz 26.09.2024 (Eintragungsdatum)\n\nS.A.S Security e.K.\nEinzelkaufmann / Einzelkauffrau\nHeideck\n\nDen Gläubigern der an der Ausgliederung beteiligten Rechtsträger ist, wenn sie binnen sechs Monaten nach dem Tag, an dem die Eintragung der Ausgliederung in das Register des Sitzes desjenigen Rechtsträgers, dessen Gläubiger sie sind, nach §§ 125, 19 Abs. 3 UmwG als bekannt gemacht gilt, ihren Anspruch nach Grund und Höhe schriftlich anmelden, Sicherheit zu leisten, soweit sie nicht Befriedigung verlangen können. Dieses Recht steht den Gläubigern jedoch nur zu, wenn sie glaubhaft machen, dass durch die Ausgliederung die Erfüllung ihrer Forderung gefährdet wird."
    },
    {
      "date": "2024-09-27",
      "original_text": "Löschungsankündigung\nBrandenburg Amtsgericht Potsdam HRB 32736\nS.Claudia Pflege- und Betreuungs UG (haftungsbeschränkt) – Zossen",
      "type": "Löschungsankündigung",
      "state": "Brandenburg",
      "amtsgericht": "Amtsgericht Potsdam",
      "registernummer": "HRB 32736",
      "registerart": "HRB",
      "company_name": "S.Claudia Pflege- und Betreuungs UG (haftungsbeschränkt)",
      "company_seat": "Zossen",
      "details": "27.09.2024 (Bekanntmachungsdatum)\n\nBrandenburg Amtsgericht Potsdam HRB 32736\nLöschungsankündigung\n\nS.Claudia Pflege- und Betreuungs UG (haftungsbeschränkt)\nGesellschaft mit beschränkter Haftung\nZossen\n\nBei der nachstehenden Gesellschaft wird das Amtslöschungsverfahren gemäß § 394 FamFG eingeleitet. Widerspruchsfrist: 8 Wochen"
    },
    {
      "date": "2024-09-27",
      "original_text": "Registerbekanntmachung nach dem Umwandlungsgesetz\nBrandenburg Amtsgericht Cottbus HRB 14181\nSERVISA Baustoffe GmbH – Mittenwalde",
      "type": "Registerbekanntmachung nach dem Umwandlungsgesetz",
      "state": "Brandenburg",
      "amtsgericht": "Amtsgericht Cottbus",
      "registernummer": "HRB 14181",
      "registerart": "HRB",
      "company_name": "SERVISA Baustoffe GmbH",
      "company_seat": "Mittenwalde",
      "details": "27.09.2024 (Bekanntmachungsdatum)\n\nBrandenburg Amtsgericht Cottbus HRB 14181\nRegisterbekanntmachung nach dem Umwandlungsgesetz 27.09.2024 (Eintragungsdatum)\n\nSERVISA Baustoffe GmbH\nGesellschaft mit beschränkter Haftung\nMittenwalde\n\nZu Eintragungsnummer 6 vom 27.09.2024 wird als nicht eingetragen veröffentlicht:\nDen Gläubigern der an der Verschmelzung beteiligten Rechtsträger ist, wenn sie binnen sechs Monaten nach dem Tag, an dem die Eintragung der Verschmelzung in das Register des Sitzes desjenigen Rechtsträgers, dessen Gläubiger sie sind, als bekannt gemacht gilt, ihren Anspruch nach Grund und Höhe schriftlich anmelden, Sicherheit zu leisten, soweit sie nicht Befriedigung verlangen können. Dieses Recht steht den Gläubigern jedoch nur zu, wenn sie glaubhaft machen, dass durch die Verschmelzung die Erfüllung ihrer Forderung gefährdet wird"
    },
    {
      "date": "2024-09-27",
      "original_text": "Registerbekanntmachung nach dem Umwandlungsgesetz\nSchleswig-Holstein Amtsgericht Lübeck HRB 25399\nSI Beteiligungs-GmbH – Bad Schwartau",
      "type": "Registerbekanntmachung nach dem Umwandlungsgesetz",
      "state": "Schleswig-Holstein",
      "amtsgericht": "Amtsgericht Lübeck",
      "registernummer": "HRB 25399",
      "registerart": "HRB",
      "company_name": "SI Beteiligungs-GmbH",
      "company_seat": "Bad Schwartau",
      "details": "27.09.2024 (Bekanntmachungsdatum)\n\nSchleswig-Holstein Amtsgericht Lübeck HRB 25399\nRegisterbekanntmachung nach dem Umwandlungsgesetz 26.09.2024 (Eintragungsdatum)\n\nSI Beteiligungs-GmbH\nGesellschaft mit beschränkter Haftung\nBad Schwartau\n\nZu Eintragungsnummer 1 vom 26.09.2024 wird als nicht eingetragen veröffentlicht: Den Gläubigern der an der Spaltung beteiligten Rechtsträger ist, wenn sie binnen sechs Monaten nach dem Tag, an dem die Eintragung der Spaltung in das Register des Sitzes desjenigen Rechtsträgers, dessen Gläubiger sie sind, als bekannt gemacht gilt, ihren Anspruch nach Grund und Höhe schriftlich anmelden, Sicherheit zu leisten, soweit sie nicht Befriedigung verlangen können. Dieses Recht steht den Gläubigern jedoch nur zu, wenn sie glaubhaft machen, dass durch die Spaltung die Erfüllung ihrer Forderung gefährdet wird."
    },
    {
      "date": "2024-09-27",
      "original_text": "Registerbekanntmachung nach dem Umwandlungsgesetz\nHessen Amtsgericht Wetzlar HRB 6093\nSIEMAG TECBERG GmbH – Haiger",
      "type": "Registerbekanntmachung nach dem Umwandlungsgesetz",
      "state": "Hessen",
      "amtsgericht": "Amtsgericht Wetzlar",
      "registernummer": "HRB 6093",
      "registerart": "HRB",
      "company_name": "SIEMAG TECBERG GmbH",
      "company_seat": "Haiger",
      "details": "27.09.2024 (Bekanntmachungsdatum)\n\nHessen Amtsgericht Wetzlar HRB 6093\nRegisterbekanntmachung nach dem Umwandlungsgesetz 27.09.2024 (Eintragungsdatum)\n\nSIEMAG TECBERG GmbH\nGesellschaft mit beschränkter Haftung\nHaiger\n\nDen Gläubigern der an der Verschmelzung beteiligten Rechtsträger ist, wenn sie binnen sechs Monaten nach dem Tag, an dem die Eintragung der Verschmelzung in das Register des Sitzes desjenigen Rechtsträgers, dessen Gläubiger sie sind, nach § 19 Absatz 3 UmwG bekannt gemacht worden ist, ihren Anspruch nach Grund und Höhe schriftlich anmelden, Sicherheit zu leisten, soweit sie nicht Befriedigung verlangen können. Dieses Recht steht den Gläubigern jedoch nur zu, wenn sie glaubhaft machen, dass durch die Verschmelzung die Erfüllung ihrer Forderung gefährdet wird."
    },
    {
      "date": "2024-09-27",
      "original_text": "Registerbekanntmachung nach dem Umwandlungsgesetz\nHessen Amtsgericht Wetzlar HRB 5913\nSIEMAG TECBERG Group GmbH – Haiger-Kalteiche",
      "type": "Registerbekanntmachung nach dem Umwandlungsgesetz",
      "state": "Hessen",
      "amtsgericht": "Amtsgericht Wetzlar",
      "registernummer": "HRB 5913",
      "registerart": "HRB",
      "company_name": "SIEMAG TECBERG Group GmbH",
      "company_seat": "Haiger-Kalteiche",
      "details": "27.09.2024 (Bekanntmachungsdatum)\n\nHessen Amtsgericht Wetzlar HRB 5913\nRegisterbekanntmachung nach dem Umwandlungsgesetz 27.09.2024 (Eintragungsdatum)\n\nSIEMAG TECBERG Group GmbH\nGesellschaft mit beschränkter Haftung\nHaiger-Kalteiche\n\nDen Gläubigern der an der Verschmelzung beteiligten Rechtsträger ist, wenn sie binnen sechs Monaten nach dem Tag, an dem die Eintragung der Verschmelzung in das Register des Sitzes desjenigen Rechtsträgers, dessen Gläubiger sie sind, nach § 19 Absatz 3 UmwG bekannt gemacht worden ist, ihren Anspruch nach Grund und Höhe schriftlich anmelden, Sicherheit zu leisten, soweit sie nicht Befriedigung verlangen können. Dieses Recht steht den Gläubigern jedoch nur zu, wenn sie glaubhaft machen, dass durch die Verschmelzung die Erfüllung ihrer Forderung gefährdet wird."
    },
    {
      "date": "2024-09-27",
      "original_text": "Registerbekanntmachung nach dem Umwandlungsgesetz\nBayern Amtsgericht Nürnberg HRB 36957\nSP Projektentwicklung Projekt XII GmbH – Nürnberg",
      "type": "Registerbekanntmachung nach dem Umwandlungsgesetz",
      "state": "Bayern",
      "amtsgericht": "Amtsgericht Nürnberg",
      "registernummer": "HRB 36957",
      "registerart": "HRB",
      "company_name": "SP Projektentwicklung Projekt XII GmbH",
      "company_seat": "Nürnberg",
      "details": "27.09.2024 (Bekanntmachungsdatum)\n\nBayern Amtsgericht Nürnberg HRB 36957\nRegisterbekanntmachung nach dem Umwandlungsgesetz 26.09.2024 (Eintragungsdatum)\n\nSP Projektentwicklung Projekt XII GmbH\nGesellschaft mit beschränkter Haftung\nNürnberg\n\nDen Gläubigern der an der Verschmelzung beteiligten Rechtsträger ist, wenn sie binnen sechs Monaten nach dem Tag, an dem die Eintragung der Verschmelzung in das Register des Sitzes desjenigen Rechtsträgers, dessen Gläubiger sie sind, nach § 19 Abs. 3 UmwG als bekannt gemacht gilt, ihren Anspruch nach Grund und Höhe schriftlich anmelden, Sicherheit zu leisten, soweit sie nicht Befriedigung verlangen können. Dieses Recht steht den Gläubigern jedoch nur zu, wenn sie glaubhaft machen, dass durch die Verschmelzung die Erfüllung ihrer Forderung gefährdet wird."
    },
    {
      "date": "2024-09-27",
      "original_text": "Registerbekanntmachung nach dem Umwandlungsgesetz\nBayern Amtsgericht Augsburg HRA 21564\nSchimpp Daniel e. K. – Höchstädt a.d.Donau",
      "type": "Registerbekanntmachung nach dem Umwandlungsgesetz",
      "state": "Bayern",
      "amtsgericht": "Amtsgericht Augsburg",
      "registernummer": "HRA 21564",
      "registerart": "HRA",
      "company_name": "Schimpp Daniel e. K.",
      "company_seat": "Höchstädt a.d.Donau",
      "details": "27.09.2024 (Bekanntmachungsdatum)\n\nBayern Amtsgericht Augsburg HRA 21564\nRegisterbekanntmachung nach dem Umwandlungsgesetz 26.09.2024 (Eintragungsdatum)\n\nSchimpp Daniel e. K.\nEinzelkaufmann / Einzelkauffrau\nHöchstädt a.d.Donau\n\nDen Gläubigern der an der Ausgliederung beteiligten Rechtsträger ist, wenn sie binnen sechs Monaten nach dem Tag, an dem die Eintragung der Ausgliederung in das Register des Sitzes desjenigen Rechtsträgers, dessen Gläubiger sie sind, nach §§ 125, 19 Abs. 3 UmwG als bekannt gemacht gilt, ihren Anspruch nach Grund und Höhe schriftlich anmelden, Sicherheit zu leisten, soweit sie nicht Befriedigung verlangen können. Dieses Recht steht den Gläubigern jedoch nur zu, wenn sie glaubhaft machen, dass durch die Ausgliederung die Erfüllung ihrer Forderung gefährdet wird."
    },
    {
      "date": "2024-09-27",
      "original_text": "Registerbekanntmachung nach dem Umwandlungsgesetz\nBayern Amtsgericht München HRA 42260\nSchloßbrauerei Odelzhausen Hans & Maria Eser - GmbH & Co. KG – Odelzhausen",
      "type": "Registerbekanntmachung nach dem Umwandlungsgesetz",
      "state": "Bayern",
      "amtsgericht": "Amtsgericht München",
      "registernummer": "HRA 42260",
      "registerart": "HRA",
      "company_name": "Schloßbrauerei Odelzhausen Hans & Maria Eser - GmbH & Co. KG",
      "company_seat": "Odelzhausen",
      "details": "27.09.2024 (Bekanntmachungsdatum)\n\nBayern Amtsgericht München HRA 42260\nRegisterbekanntmachung nach dem Umwandlungsgesetz 26.09.2024 (Eintragungsdatum)\n\nSchloßbrauerei Odelzhausen Hans & Maria Eser - GmbH & Co. KG\nKommanditgesellschaft\nOdelzhausen\n\nDen Gläubigern der an der Ausgliederung beteiligten Rechtsträger ist, wenn sie binnen sechs Monaten nach dem Tag, an dem die Eintragung der Ausgliederung in das Register des Sitzes desjenigen Rechtsträgers, dessen Gläubiger sie sind, nach §§ 125, 19 Abs. 3 UmwG als bekannt gemacht gilt, ihren Anspruch nach Grund und Höhe schriftlich anmelden, Sicherheit zu leisten, soweit sie nicht Befriedigung verlangen können. Dieses Recht steht den Gläubigern jedoch nur zu, wenn sie glaubhaft machen, dass durch die Ausgliederung die Erfüllung ihrer Forderung gefährdet wird."
    },
    {
      "date": "2024-09-27",
      "original_text": "Registerbekanntmachung nach dem Umwandlungsgesetz\nNiedersachsen Amtsgericht Aurich HRB 207403\nSchmidt & Ites GmbH – Krummhörn",
      "type": "Registerbekanntmachung nach dem Umwandlungsgesetz",
      "state": "Niedersachsen",
      "amtsgericht": "Amtsgericht Aurich",
      "registernummer": "HRB 207403",
      "registerart": "HRB",
      "company_name": "Schmidt & Ites GmbH",
      "company_seat": "Krummhörn",
      "details": "27.09.2024 (Bekanntmachungsdatum)\n\nNiedersachsen Amtsgericht Aurich HRB 207403\nRegisterbekanntmachung nach dem Umwandlungsgesetz 27.09.2024 (Eintragungsdatum)\n\nSchmidt & Ites GmbH\nGesellschaft mit beschränkter Haftung\nKrummhörn\n\nDen Gläubigern der an der formwechselnden Umwandlung beteiligten Rechtsträger ist, wenn sie binnen sechs Monaten nach dem Tag, an dem die Eintragung der Umwandlung in das Register des Sitzes desjenigen Rechtsträgers, dessen Gläubiger sie sind, nach § 19 Abs. 3 UmwG als bekannt gemacht gilt, ihren Anspruch nach Grund und Höhe schriftlich anmelden, Sicherheit zu leisten, soweit sie nicht Befriedigung verlangen können. Dieses Recht steht den Gläubigern jedoch nur zu, wenn sie glaubhaft machen, dass durch die formwechselnde Umwandlung die Erfüllung der Forderung gefährdet wird."
    },
    {
      "date": "2024-09-27",
      "original_text": "Sonstige Registerbekanntmachung\nBerlin Amtsgericht Berlin (Charlottenburg) HRB 177620\nSchneeweiss Holding GmbH – Berlin",
      "type": "Sonstige Registerbekanntmachung",
      "state": "Berlin",
      "amtsgericht": "Amtsgericht Berlin (Charlottenburg)",
      "registernummer": "HRB 177620",
      "registerart": "HRB",
      "company_name": "Schneeweiss Holding GmbH",
      "company_seat": "Berlin",
      "details": "27.09.2024 (Bekanntmachungsdatum)\n\nBerlin Amtsgericht Berlin (Charlottenburg) HRB 177620\nSonstige Registerbekanntmachung\n\nSchneeweiss Holding GmbH\nGesellschaft mit beschränkter Haftung\nBerlin\n\nAls nicht eingetragen wird veröffentlicht: Den Gläubigern der an der Verschmelzung beteiligten Rechtsträger ist, wenn sie binnen sechs Monaten nach dem Tag, an dem die Eintragung der Verschmelzung in das Register des Sitzes desjenigen Rechtsträgers, dessen Gläubiger sie sind, als bekannt gemacht gilt, ihren Anspruch nach Grund und Höhe schriftlich anmelden, Sicherheit zu leisten, soweit sie nicht Befriedigung verlangen können. Dieses Recht steht den Gläubigern jedoch nur zu, wenn sie glaubhaft machen, dass durch die Verschmelzung die Erfüllung ihrer Forderung gefährdet wird. Das Recht, Sicherheitsleistung zu verlangen, steht Gläubigern nicht zu, die im Falle der Insolvenz ein Recht auf vorzugsweise Befriedigung aus einer Deckungsmasse haben, die nach gesetzlicher Vorschrift zu ihrem Schutz errichtet und staatlich überwacht ist."
    },
    {
      "date": "2024-09-27",
      "original_text": "Registerbekanntmachung nach dem Umwandlungsgesetz\nBayern Amtsgericht Memmingen HRA 14167\nSchreinerei Jonas Wörz e.K. – Offingen",
      "type": "Registerbekanntmachung nach dem Umwandlungsgesetz",
      "state": "Bayern",
      "amtsgericht": "Amtsgericht Memmingen",
      "registernummer": "HRA 14167",
      "registerart": "HRA",
      "company_name": "Schreinerei Jonas Wörz e.K.",
      "company_seat": "Offingen",
      "details": "27.09.2024 (Bekanntmachungsdatum)\n\nBayern Amtsgericht Memmingen HRA 14167\nRegisterbekanntmachung nach dem Umwandlungsgesetz 26.09.2024 (Eintragungsdatum)\n\nSchreinerei Jonas Wörz e.K.\nEinzelkaufmann / Einzelkauffrau\nOffingen\n\nDen Gläubigern der an der Ausgliederung beteiligten Rechtsträger ist, wenn sie binnen sechs Monaten nach dem Tag, an dem die Eintragung der Ausgliederung in das Register des Sitzes desjenigen Rechtsträgers, dessen Gläubiger sie sind, nach §§ 125, 19 Abs. 3 UmwG als bekannt gemacht gilt, ihren Anspruch nach Grund und Höhe schriftlich anmelden, Sicherheit zu leisten, soweit sie nicht Befriedigung verlangen können. Dieses Recht steht den Gläubigern jedoch nur zu, wenn sie glaubhaft machen, dass durch die Ausgliederung die Erfüllung ihrer Forderung gefährdet wird."
    },
    {
      "date": "2024-09-27",
      "original_text": "Registerbekanntmachung nach dem Umwandlungsgesetz\nBayern Amtsgericht Memmingen HRB 21224\nSchreinerei Wörz GmbH – Offingen",
      "type": "Registerbekanntmachung nach dem Umwandlungsgesetz",
      "state": "Bayern",
      "amtsgericht": "Amtsgericht Memmingen",
      "registernummer": "HRB 21224",
      "registerart": "HRB",
      "company_name": "Schreinerei Wörz GmbH",
      "company_seat": "Offingen",
      "details": "27.09.2024 (Bekanntmachungsdatum)\n\nBayern Amtsgericht Memmingen HRB 21224\nRegisterbekanntmachung nach dem Umwandlungsgesetz 26.09.2024 (Eintragungsdatum)\n\nSchreinerei Wörz GmbH\nGesellschaft mit beschränkter Haftung\nOffingen\n\nDen Gläubigern der an der Ausgliederung beteiligten Rechtsträger ist, wenn sie binnen sechs Monaten nach dem Tag, an dem die Eintragung der Ausgliederung in das Register des Sitzes desjenigen Rechtsträgers, dessen Gläubiger sie sind, nach §§ 125, 19 Abs. 3 UmwG als bekannt gemacht gilt, ihren Anspruch nach Grund und Höhe schriftlich anmelden, Sicherheit zu leisten, soweit sie nicht Befriedigung verlangen können. Dieses Recht steht den Gläubigern jedoch nur zu, wenn sie glaubhaft machen, dass durch die Ausgliederung die Erfüllung ihrer Forderung gefährdet wird."
    },
    {
      "date": "2024-09-27",
      "original_text": "Sonstige Registerbekanntmachung\nMecklenburg-Vorpommern Amtsgericht Schwerin HRB 948\nSchweriner Abfallentsorgungs- und Straßenreinigungsgesellschaft mbH – Schwerin",
      "type": "Sonstige Registerbekanntmachung",
      "state": "Mecklenburg-Vorpommern",
      "amtsgericht": "Amtsgericht Schwerin",
      "registernummer": "HRB 948",
      "registerart": "HRB",
      "company_name": "Schweriner Abfallentsorgungs- und Straßenreinigungsgesellschaft mbH",
      "company_seat": "Schwerin",
      "details": "27.09.2024 (Bekanntmachungsdatum)\n\nMecklenburg-Vorpommern Amtsgericht Schwerin HRB 948\nSonstige Registerbekanntmachung 26.09.2024 (Eintragungsdatum)\n\nSchweriner Abfallentsorgungs- und Straßenreinigungsgesellschaft mbH\nGesellschaft mit beschränkter Haftung\nSchwerin\n\nEine Liste der Mitglieder des Aufsichtsrats ist zum Handelsregister eingereicht worden."
    },
    {
      "date": "2024-09-27",
      "original_text": "Registerbekanntmachung nach dem Umwandlungsgesetz\nHamburg Amtsgericht Hamburg HRB 112636\nSport Duwe Hamburg GmbH – Hamburg",
      "type": "Registerbekanntmachung nach dem Umwandlungsgesetz",
      "state": "Hamburg",
      "amtsgericht": "Amtsgericht Hamburg",
      "registernummer": "HRB 112636",
      "registerart": "HRB",
      "company_name": "Sport Duwe Hamburg GmbH",
      "company_seat": "Hamburg",
      "details": "27.09.2024 (Bekanntmachungsdatum)\n\nHamburg Amtsgericht Hamburg HRB 112636\nRegisterbekanntmachung nach dem Umwandlungsgesetz 27.09.2024 (Eintragungsdatum)\n\nSport Duwe Hamburg GmbH\nGesellschaft mit beschränkter Haftung\nHamburg\n\nAls nicht eingetragen wird bekannt gemacht:\nDen Gläubigern der an der Verschmelzung beteiligten Gesellschaften ist, wenn sie binnen sechs Monaten nach dem Tag, an dem die Eintragung der Verschmelzung in das Register des Sitzes desjenigen Rechtsträgers, dessen Gläubiger sie sind, nach § 19 Absatz 3 UmwG als bekannt gemacht gilt, ihren Anspruch nach Grund und Höhe schriftlich anmelden, Sicherheit zu leisten, soweit sie nicht Befriedigung verlangen können. Dieses Recht steht den Gläubigern jedoch nur zu, wenn sie glaubhaft machen, dass durch die Verschmelzung die Erfüllung ihrer Forderung gefährdet wird."
    },
    {
      "date": "2024-09-27",
      "original_text": "Registerbekanntmachung nach dem Umwandlungsgesetz\nBremen Amtsgericht Bremen VR 4201\nSport-Gemeinschaft ERNO Bremen e.V. – Bremen",
      "type": "Registerbekanntmachung nach dem Umwandlungsgesetz",
      "state": "Bremen",
      "amtsgericht": "Amtsgericht Bremen",
      "registernummer": "VR 4201",
      "registerart": "VR",
      "company_name": "Sport-Gemeinschaft ERNO Bremen e.V.",
      "company_seat": "Bremen",
      "details": "27.09.2024 (Bekanntmachungsdatum)\n\nBremen Amtsgericht Bremen VR 4201\nRegisterbekanntmachung nach dem Umwandlungsgesetz 25.09.2024 (Eintragungsdatum)\n\nSport-Gemeinschaft ERNO Bremen e.V.\neingetragener Verein\nBremen\n\nZu Eintragungsnummer 6 vom 25.09.2024 wird als nicht eingetragen veröffentlicht:\nDen Gläubigern der an der Verschmelzung beteiligten Rechtsträger ist, wenn sie binnen sechs Monaten nach dem Tag, an dem die Eintragung der Verschmelzung in das Register des Sitzes desjenigen Rechtsträgers, dessen Gläubiger sie sind, als bekannt gemacht gilt, ihren Anspruch nach Grund und Höhe schriftlich anmelden, Sicherheit zu leisten, soweit sie nicht Befriedigung verlangen können. Dieses Recht steht den Gläubigern jedoch nur zu, wenn sie glaubhaft machen, dass durch die Verschmelzung die Erfüllung ihrer Forderung gefährdet wird. Das Recht, Sicherheitsleistung zu verlangen, steht Gläubigern nicht zu, die im Falle der Insolvenz ein Recht auf vorzugsweise Befriedigung aus einer Deckungsmasse haben, die nach gesetzlicher Vorschrift zu ihrem Schutz errichtet und staatlich überwacht ist."
    },
    {
      "date": "2024-09-27",
      "original_text": "Sonstige Registerbekanntmachung\nRheinland-Pfalz Amtsgericht Ludwigshafen a.Rhein (Ludwigshafen) HRB 42037\nStadtwerke Lambrecht (Pfalz) GmbH – Lambrecht",
      "type": "Sonstige Registerbekanntmachung",
      "state": "Rheinland-Pfalz",
      "amtsgericht": "Amtsgericht Ludwigshafen a.Rhein (Ludwigshafen)",
      "registernummer": "HRB 42037",
      "registerart": "HRB",
      "company_name": "Stadtwerke Lambrecht (Pfalz) GmbH",
      "company_seat": "Lambrecht",
      "details": "27.09.2024 (Bekanntmachungsdatum)\n\nRheinland-Pfalz Amtsgericht Ludwigshafen a.Rhein (Ludwigshafen) HRB 42037\nSonstige Registerbekanntmachung\n\nStadtwerke Lambrecht (Pfalz) GmbH\nGesellschaft mit beschränkter Haftung\nLambrecht\n\nDem Registergericht ist eine geänderte Liste der Mitglieder des Aufsichtsrates eingereicht worden."
    },
    {
      "date": "2024-09-27",
      "original_text": "Registerbekanntmachung nach dem Umwandlungsgesetz\nNiedersachsen Amtsgericht Walsrode HRB 212239\nStebah GmbH – Stuhr",
      "type": "Registerbekanntmachung nach dem Umwandlungsgesetz",
      "state": "Niedersachsen",
      "amtsgericht": "Amtsgericht Walsrode",
      "registernummer": "HRB 212239",
      "registerart": "HRB",
      "company_name": "Stebah GmbH",
      "company_seat": "Stuhr",
      "details": "27.09.2024 (Bekanntmachungsdatum)\n\nNiedersachsen Amtsgericht Walsrode HRB 212239\nRegisterbekanntmachung nach dem Umwandlungsgesetz 27.09.2024 (Eintragungsdatum)\n\nStebah GmbH\nGesellschaft mit beschränkter Haftung\nStuhr\n\nDen Gläubigern der an der formwechselnden Umwandlung beteiligten Rechtsträger ist, wenn sie binnen sechs Monaten nach dem Tag, an dem die Eintragung der Umwandlung in das Register des Sitzes desjenigen Rechtsträgers, dessen Gläubiger sie sind, nach § 19 Abs. 3 UmwG als bekannt gemacht gilt, ihren Anspruch nach Grund und Höhe schriftlich anmelden, Sicherheit zu leisten, soweit sie nicht Befriedigung verlangen können. Dieses Recht steht den Gläubigern jedoch nur zu, wenn sie glaubhaft machen, dass durch die formwechselnde Umwandlung die Erfüllung der Forderung gefährdet wird."
    },
    {
      "date": "2024-09-27",
      "original_text": "Registerbekanntmachung nach dem Umwandlungsgesetz\nNiedersachsen Amtsgericht Walsrode HRA 201341\nStebah GmbH & Co. KG – Stuhr",
      "type": "Registerbekanntmachung nach dem Umwandlungsgesetz",
      "state": "Niedersachsen",
      "amtsgericht": "Amtsgericht Walsrode",
      "registernummer": "HRA 201341",
      "registerart": "HRA",
      "company_name": "Stebah GmbH & Co. KG",
      "company_seat": "Stuhr",
      "details": "27.09.2024 (Bekanntmachungsdatum)\n\nNiedersachsen Amtsgericht Walsrode HRA 201341\nRegisterbekanntmachung nach dem Umwandlungsgesetz 27.09.2024 (Eintragungsdatum)\n\nStebah GmbH & Co. KG\nKommanditgesellschaft\nStuhr\n\nDen Gläubigern der an der formwechselnden Umwandlung beteiligten Rechtsträger ist, wenn sie binnen sechs Monaten nach dem Tag, an dem die Eintragung der Umwandlung in das Register des Sitzes desjenigen Rechtsträgers, dessen Gläubiger sie sind, nach § 19 Abs. 3 UmwG als bekannt gemacht gilt, ihren Anspruch nach Grund und Höhe schriftlich anmelden, Sicherheit zu leisten, soweit sie nicht Befriedigung verlangen können. Dieses Recht steht den Gläubigern jedoch nur zu, wenn sie glaubhaft machen, dass durch die formwechselnde Umwandlung die Erfüllung der Forderung gefährdet wird."
    },
    {
      "date": "2024-09-27",
      "original_text": "Registerbekanntmachung nach dem Umwandlungsgesetz\nMecklenburg-Vorpommern Amtsgericht Stralsund HRA 20909\nStefan Köppke Erlebnismühle Ahrenshoop e.K. – Ahrenshoop",
      "type": "Registerbekanntmachung nach dem Umwandlungsgesetz",
      "state": "Mecklenburg-Vorpommern",
      "amtsgericht": "Amtsgericht Stralsund",
      "registernummer": "HRA 20909",
      "registerart": "HRA",
      "company_name": "Stefan Köppke Erlebnismühle Ahrenshoop e.K.",
      "company_seat": "Ahrenshoop",
      "details": "27.09.2024 (Bekanntmachungsdatum)\n\nMecklenburg-Vorpommern Amtsgericht Stralsund HRA 20909\nRegisterbekanntmachung nach dem Umwandlungsgesetz 27.09.2024 (Eintragungsdatum)\n\nStefan Köppke Erlebnismühle Ahrenshoop e.K.\nEinzelkaufmann / Einzelkauffrau\nAhrenshoop\n\nAls nicht eingetragen wird veröffentlicht: Den Gläubigern der an der Ausgliederung beteiligten Rechtsträger ist, wenn sie binnen sechs Monaten nach dem Tag, an dem die Eintragung der Ausgliederung in das Register des Sitzes desjenigen Rechtsträgers, dessen Gläubiger sie sind, nach § 19 Abs. 3 UmwG als bekannt gemacht gilt, ihren Anspruch nach Grund und Höhe schriftlich anmelden,\nSicherheit zu leisten, soweit sie nicht Befriedigung verlangen können. Dieses Recht steht den Gläubigern jedoch nur zu, wenn sie glaubhaft machen, dass durch die Ausgliederung die Erfüllung der Forderung gefährdet wird."
    },
    {
      "date": "2024-09-27",
      "original_text": "Registerbekanntmachung nach dem Umwandlungsgesetz\nNordrhein-Westfalen Amtsgericht Köln HRA 37474\nSteffen Patzer Karriere Fabrik e.K. – Leverkusen",
      "type": "Registerbekanntmachung nach dem Umwandlungsgesetz",
      "state": "Nordrhein-Westfalen",
      "amtsgericht": "Amtsgericht Köln",
      "registernummer": "HRA 37474",
      "registerart": "HRA",
      "company_name": "Steffen Patzer Karriere Fabrik e.K.",
      "company_seat": "Leverkusen",
      "details": "27.09.2024 (Bekanntmachungsdatum)\n\nNordrhein-Westfalen Amtsgericht Köln HRA 37474\nRegisterbekanntmachung nach dem Umwandlungsgesetz 27.09.2024 (Eintragungsdatum)\n\nSteffen Patzer Karriere Fabrik e.K.\nEinzelkaufmann / Einzelkauffrau\nLeverkusen\n\nDen Gläubigern der an der Ausgliederung beteiligten Rechtsträger ist, wenn sie binnen sechs Monaten nach dem Tag, an dem die Eintragung der Ausgliederung in das Register des Sitzes desjenigen Rechtsträgers, dessen Gläubiger sie sind, nach § 19 Absatz 3 UmwG als bekanntgemacht gilt, ihren Anspruch nach Grund und Höhe schriftlich anmelden, Sicherheit zu leisten, soweit sie nicht Befriedigung verlangen können. Dieses Recht steht den Gläubigern jedoch nur zu, wenn sie glaubhaft machen, dass durch die Ausgliederung die Erfüllung ihrer Forderung gefährdet wird."
    },
    {
      "date": "2024-09-27",
      "original_text": "Registerbekanntmachung nach dem Umwandlungsgesetz\nSchleswig-Holstein Amtsgericht Lübeck HRB 25403\nTS36 GmbH – Ratzeburg",
      "type": "Registerbekanntmachung nach dem Umwandlungsgesetz",
      "state": "Schleswig-Holstein",
      "amtsgericht": "Amtsgericht Lübeck",
      "registernummer": "HRB 25403",
      "registerart": "HRB",
      "company_name": "TS36 GmbH",
      "company_seat": "Ratzeburg",
      "details": "27.09.2024 (Bekanntmachungsdatum)\n\nSchleswig-Holstein Amtsgericht Lübeck HRB 25403\nRegisterbekanntmachung nach dem Umwandlungsgesetz 26.09.2024 (Eintragungsdatum)\n\nTS36 GmbH\nGesellschaft mit beschränkter Haftung\nRatzeburg\n\nZu Eintragungsnummer 1 vom 26.09.2024 wird als nicht eingetragen veröffentlicht: Den Gläubigern der an der Ausgliederung beteiligten Rechtsträger ist, wenn sie binnen sechs Monaten nach dem Tag, an dem die Eintragung der Ausgliederung in das Register des Sitzes desjenigen Rechtsträgers, dessen Gläubiger sie sind, als bekannt gemacht gilt, ihren Anspruch nach Grund und Höhe schriftlich anmelden, Sicherheit zu leisten, soweit sie nicht Befriedigung verlangen können. Dieses Recht steht den Gläubigern jedoch nur zu, wenn sie glaubhaft machen, dass durch die Ausgliederung die Erfüllung ihrer Forderung gefährdet wird."
    },
    {
      "date": "2024-09-27",
      "original_text": "Löschungsankündigung\nBerlin Amtsgericht Berlin (Charlottenburg) HRB 212234\nTSA System Gastro GmbH – Berlin",
      "type": "Löschungsankündigung",
      "state": "Berlin",
      "amtsgericht": "Amtsgericht Berlin (Charlottenburg)",
      "registernummer": "HRB 212234",
      "registerart": "HRB",
      "company_name": "TSA System Gastro GmbH",
      "company_seat": "Berlin",
      "details": "27.09.2024 (Bekanntmachungsdatum)\n\nBerlin Amtsgericht Berlin (Charlottenburg) HRB 212234\nLöschungsankündigung\n\nTSA System Gastro GmbH\nGesellschaft mit beschränkter Haftung\nBerlin\n\nBei der nachstehenden Gesellschaft wird das Amtslöschungsverfahren gemäß § 394 FamFG eingeleitet. Widerspruchsfrist 6 Wochen"
    },
    {
      "date": "2024-09-27",
      "original_text": "Registerbekanntmachung nach dem Umwandlungsgesetz\nBerlin Amtsgericht Berlin (Charlottenburg) HRB 214555\nTaurecon Invest IX GmbH – Berlin",
      "type": "Registerbekanntmachung nach dem Umwandlungsgesetz",
      "state": "Berlin",
      "amtsgericht": "Amtsgericht Berlin (Charlottenburg)",
      "registernummer": "HRB 214555",
      "registerart": "HRB",
      "company_name": "Taurecon Invest IX GmbH",
      "company_seat": "Berlin",
      "details": "27.09.2024 (Bekanntmachungsdatum)\n\nBerlin Amtsgericht Berlin (Charlottenburg) HRB 214555\nRegisterbekanntmachung nach dem Umwandlungsgesetz 27.09.2024 (Eintragungsdatum)\n\nTaurecon Invest IX GmbH\nGesellschaft mit beschränkter Haftung\nBerlin\n\nZu Eintragungsnummer 5 vom 27.09.2024 wird als nicht eingetragen veröffentlicht: Den Gläubigern der an der Verschmelzung beteiligten Rechtsträger ist, wenn sie binnen sechs Monaten nach dem Tag, an dem die Eintragung der Verschmelzung in das Register des Sitzes desjenigen Rechtsträgers, dessen Gläubiger sie sind, als bekannt gemacht gilt, ihren Anspruch nach Grund und Höhe schriftlich anmelden, Sicherheit zu leisten, soweit sie nicht Befriedigung verlangen können. Dieses Recht steht den Gläubigern jedoch nur zu, wenn sie glaubhaft machen, dass durch die Verschmelzung die Erfüllung ihrer Forderung gefährdet wird. Das Recht, Sicherheitsleistung zu verlangen, steht Gläubigern nicht zu, die im Falle der Insolvenz ein Recht auf vorzugsweise Befriedigung aus einer Deckungsmasse haben, die nach gesetzlicher Vorschrift zu ihrem Schutz errichtet und staatlich überwacht ist."
    },
    {
      "date": "2024-09-27",
      "original_text": "Registerbekanntmachung nach dem Umwandlungsgesetz\nBerlin Amtsgericht Berlin (Charlottenburg) HRB 197801\nTaurecon Invest VII GmbH – Berlin",
      "type": "Registerbekanntmachung nach dem Umwandlungsgesetz",
      "state": "Berlin",
      "amtsgericht": "Amtsgericht Berlin (Charlottenburg)",
      "registernummer": "HRB 197801",
      "registerart": "HRB",
      "company_name": "Taurecon Invest VII GmbH",
      "company_seat": "Berlin",
      "details": "27.09.2024 (Bekanntmachungsdatum)\n\nBerlin Amtsgericht Berlin (Charlottenburg) HRB 197801\nRegisterbekanntmachung nach dem Umwandlungsgesetz 27.09.2024 (Eintragungsdatum)\n\nTaurecon Invest VII GmbH\nGesellschaft mit beschränkter Haftung\nBerlin\n\nZu Eintragungsnummer 5 vom 27.09.2024 wird als nicht eingetragen veröffentlicht: Den Gläubigern der an der Verschmelzung beteiligten Rechtsträger ist, wenn sie binnen sechs Monaten nach dem Tag, an dem die Eintragung der Verschmelzung in das Register des Sitzes desjenigen Rechtsträgers, dessen Gläubiger sie sind, als bekannt gemacht gilt, ihren Anspruch nach Grund und Höhe schriftlich anmelden, Sicherheit zu leisten, soweit sie nicht Befriedigung verlangen können. Dieses Recht steht den Gläubigern jedoch nur zu, wenn sie glaubhaft machen, dass durch die Verschmelzung die Erfüllung ihrer Forderung gefährdet wird. Das Recht, Sicherheitsleistung zu verlangen, steht Gläubigern nicht zu, die im Falle der Insolvenz ein Recht auf vorzugsweise Befriedigung aus einer Deckungsmasse haben, die nach gesetzlicher Vorschrift zu ihrem Schutz errichtet und staatlich überwacht ist."
    },
    {
      "date": "2024-09-27",
      "original_text": "Registerbekanntmachung nach dem Umwandlungsgesetz\nBerlin Amtsgericht Berlin (Charlottenburg) HRB 227040\nTaurecon Invest XIII GmbH – Berlin",
      "type": "Registerbekanntmachung nach dem Umwandlungsgesetz",
      "state": "Berlin",
      "amtsgericht": "Amtsgericht Berlin (Charlottenburg)",
      "registernummer": "HRB 227040",
      "registerart": "HRB",
      "company_name": "Taurecon Invest XIII GmbH",
      "company_seat": "Berlin",
      "details": "27.09.2024 (Bekanntmachungsdatum)\n\nBerlin Amtsgericht Berlin (Charlottenburg) HRB 227040\nRegisterbekanntmachung nach dem Umwandlungsgesetz 27.09.2024 (Eintragungsdatum)\n\nTaurecon Invest XIII GmbH\nGesellschaft mit beschränkter Haftung\nBerlin\n\nZu Eintragungsnummer 5 vom 27.09.2024 wird als nicht eingetragen veröffentlicht: Den Gläubigern der an der Verschmelzung beteiligten Rechtsträger ist, wenn sie binnen sechs Monaten nach dem Tag, an dem die Eintragung der Verschmelzung in das Register des Sitzes desjenigen Rechtsträgers, dessen Gläubiger sie sind, als bekannt gemacht gilt, ihren Anspruch nach Grund und Höhe schriftlich anmelden, Sicherheit zu leisten, soweit sie nicht Befriedigung verlangen können. Dieses Recht steht den Gläubigern jedoch nur zu, wenn sie glaubhaft machen, dass durch die Verschmelzung die Erfüllung ihrer Forderung gefährdet wird. Das Recht, Sicherheitsleistung zu verlangen, steht Gläubigern nicht zu, die im Falle der Insolvenz ein Recht auf vorzugsweise Befriedigung aus einer Deckungsmasse haben, die nach gesetzlicher Vorschrift zu ihrem Schutz errichtet und staatlich überwacht ist."
    },
    {
      "date": "2024-09-27",
      "original_text": "Registerbekanntmachung nach dem Umwandlungsgesetz\nBayern Amtsgericht Ansbach HRB 5282\nTaxizentrale BZ GmbH – Weißenburg i.Bay.",
      "type": "Registerbekanntmachung nach dem Umwandlungsgesetz",
      "state": "Bayern",
      "amtsgericht": "Amtsgericht Ansbach",
      "registernummer": "HRB 5282",
      "registerart": "HRB",
      "company_name": "Taxizentrale BZ GmbH",
      "company_seat": "Weißenburg i.Bay.",
      "details": "27.09.2024 (Bekanntmachungsdatum)\n\nBayern Amtsgericht Ansbach HRB 5282\nRegisterbekanntmachung nach dem Umwandlungsgesetz 26.09.2024 (Eintragungsdatum)\n\nTaxizentrale BZ GmbH\nGesellschaft mit beschränkter Haftung\nWeißenburg i.Bay.\n\nDen Gläubigern der an der Verschmelzung beteiligten Rechtsträger ist, wenn sie binnen sechs Monaten nach dem Tag, an dem die Eintragung der Verschmelzung in das Register des Sitzes desjenigen Rechtsträgers, dessen Gläubiger sie sind, nach § 19 Abs. 3 UmwG als bekannt gemacht gilt, ihren Anspruch nach Grund und Höhe schriftlich anmelden, Sicherheit zu leisten, soweit sie nicht Befriedigung verlangen können. Dieses Recht steht den Gläubigern jedoch nur zu, wenn sie glaubhaft machen, dass durch die Verschmelzung die Erfüllung ihrer Forderung gefährdet wird."
    },
    {
      "date": "2024-09-27",
      "original_text": "Registerbekanntmachung nach dem Umwandlungsgesetz\nBayern Amtsgericht Ansbach HRB 4873\nTaxizentrale Treuchtlingen GmbH – Treuchtlingen",
      "type": "Registerbekanntmachung nach dem Umwandlungsgesetz",
      "state": "Bayern",
      "amtsgericht": "Amtsgericht Ansbach",
      "registernummer": "HRB 4873",
      "registerart": "HRB",
      "company_name": "Taxizentrale Treuchtlingen GmbH",
      "company_seat": "Treuchtlingen",
      "details": "27.09.2024 (Bekanntmachungsdatum)\n\nBayern Amtsgericht Ansbach HRB 4873\nRegisterbekanntmachung nach dem Umwandlungsgesetz 26.09.2024 (Eintragungsdatum)\n\nTaxizentrale Treuchtlingen GmbH\nGesellschaft mit beschränkter Haftung\nTreuchtlingen\n\nDen Gläubigern der an der Verschmelzung beteiligten Rechtsträger ist, wenn sie binnen sechs Monaten nach dem Tag, an dem die Eintragung der Verschmelzung in das Register des Sitzes desjenigen Rechtsträgers, dessen Gläubiger sie sind, nach § 19 Abs. 3 UmwG als bekannt gemacht gilt, ihren Anspruch nach Grund und Höhe schriftlich anmelden, Sicherheit zu leisten, soweit sie nicht Befriedigung verlangen können. Dieses Recht steht den Gläubigern jedoch nur zu, wenn sie glaubhaft machen, dass durch die Verschmelzung die Erfüllung ihrer Forderung gefährdet wird."
    },
    {
      "date": "2024-09-27",
      "original_text": "Sonstige Registerbekanntmachung\nBaden-Württemberg Amtsgericht Ulm HRB 745906\nTeamViewer SE – Göppingen",
      "type": "Sonstige Registerbekanntmachung",
      "state": "Baden-Württemberg",
      "amtsgericht": "Amtsgericht Ulm",
      "registernummer": "HRB 745906",
      "registerart": "HRB",
      "company_name": "TeamViewer SE",
      "company_seat": "Göppingen",
      "details": "27.09.2024 (Bekanntmachungsdatum)\n\nBaden-Württemberg Amtsgericht Ulm HRB 745906\nSonstige Registerbekanntmachung 27.09.2024 (Eintragungsdatum)\n\nTeamViewer SE\nEuropäische Aktiengesellschaft (SE)\nGöppingen\n\nAls nicht eingetragen wird bekanntgemacht:\nDen Gläubigern, deren Forderungen begründet worden sind, bevor die Eintragung des Beschlusses bekanntgemacht worden ist, ist, wenn sie sich binnen sechs Monaten nach der Bekanntmachung zu diesem Zweck melden, Sicherheit zu leisten, soweit sie nicht Befriedigung verlangen können."
    },
    {
      "date": "2024-09-27",
      "original_text": "Registerbekanntmachung nach dem Umwandlungsgesetz\nHessen Amtsgericht Marburg HRB 8348\nTerrible Ideas GmbH – Marburg",
      "type": "Registerbekanntmachung nach dem Umwandlungsgesetz",
      "state": "Hessen",
      "amtsgericht": "Amtsgericht Marburg",
      "registernummer": "HRB 8348",
      "registerart": "HRB",
      "company_name": "Terrible Ideas GmbH",
      "company_seat": "Marburg",
      "details": "27.09.2024 (Bekanntmachungsdatum)\n\nHessen Amtsgericht Marburg HRB 8348\nRegisterbekanntmachung nach dem Umwandlungsgesetz 27.09.2024 (Eintragungsdatum)\n\nTerrible Ideas GmbH\nGesellschaft mit beschränkter Haftung\nMarburg\n\nDen Gläubigern der an der Verschmelzung beteiligten Rechtsträger ist, wenn sie binnen sechs Monaten nach dem Tag, an dem die Eintragung der Verschmelzung in das Register des Sitzes desjenigen Rechtsträgers, dessen Gläubiger sie sind, nach § 19 Absatz 3 UmwG bekannt gemacht worden ist, ihren Anspruch nach Grund und Höhe schriftlich anmelden, Sicherheit zu leisten, soweit sie nicht Befriedigung verlangen können. Dieses Recht steht den Gläubigern jedoch nur zu, wenn sie glaubhaft machen, dass durch die Verschmelzung die Erfüllung ihrer Forderung gefährdet wird."
    },
    {
      "date": "2024-09-27",
      "original_text": "Registerbekanntmachung nach dem Umwandlungsgesetz\nRheinland-Pfalz Amtsgericht Montabaur HRA 23095\nTitzmann und Geiter OHG – Oberneisen",
      "type": "Registerbekanntmachung nach dem Umwandlungsgesetz",
      "state": "Rheinland-Pfalz",
      "amtsgericht": "Amtsgericht Montabaur",
      "registernummer": "HRA 23095",
      "registerart": "HRA",
      "company_name": "Titzmann und Geiter OHG",
      "company_seat": "Oberneisen",
      "details": "27.09.2024 (Bekanntmachungsdatum)\n\nRheinland-Pfalz Amtsgericht Montabaur HRA 23095\nRegisterbekanntmachung nach dem Umwandlungsgesetz 27.09.2024 (Eintragungsdatum)\n\nTitzmann und Geiter OHG\nOffene Handelsgesellschaft\nOberneisen\n\nAls nicht eingetragen wird veröffentlicht: Den Gläubigern der an der Ausgliederung beteiligten Rechtsträger ist, wenn sie binnen sechs Monaten nach dem Tag, an dem die Eintragung der Ausgliederung in das Register des Sitzes desjenigen Rechtsträgers, dessen Gläubiger sie sind, nach § 19 Abs. 3 UmwG als bekannt gemacht gilt, ihren Anspruch nach Grund und Höhe schriftlich anmelden, Sicherheit zu leisten, soweit sie nicht Befriedigung verlangen können. Dieses Recht steht den Gläubigern jedoch nur zu, wenn sie glaubhaft machen, dass durch die Ausgliederung die Erfüllung der Forderung gefährdet wird."
    },
    {
      "date": "2024-09-27",
      "original_text": "Löschungsankündigung\nNiedersachsen Amtsgericht Osnabrück HRB 209057\nVrieler Bauservice UG (haftungsbeschränkt) – Bissendorf",
      "type": "Löschungsankündigung",
      "state": "Niedersachsen",
      "amtsgericht": "Amtsgericht Osnabrück",
      "registernummer": "HRB 209057",
      "registerart": "HRB",
      "company_name": "Vrieler Bauservice UG (haftungsbeschränkt)",
      "company_seat": "Bissendorf",
      "details": "27.09.2024 (Bekanntmachungsdatum)\n\nNiedersachsen Amtsgericht Osnabrück HRB 209057\nLöschungsankündigung\n\nVrieler Bauservice UG (haftungsbeschränkt)\nGesellschaft mit beschränkter Haftung\nBissendorf\n\nDas Registergericht beabsichtigt, die Gesellschaft von Amts wegen nach § 394 FamFG wegen Vermögenslosigkeit zu löschen. Die Frist zur Erhebung eines Widerspruchs ist auf 1 Monat ab dieser Registerbekanntmachung festgesetzt."
    },
    {
      "date": "2024-09-27",
      "original_text": "Löschungsankündigung\nBayern Amtsgericht München HRB 201405\nVural Logistik GmbH – München",
      "type": "Löschungsankündigung",
      "state": "Bayern",
      "amtsgericht": "Amtsgericht München",
      "registernummer": "HRB 201405",
      "registerart": "HRB",
      "company_name": "Vural Logistik GmbH",
      "company_seat": "München",
      "details": "27.09.2024 (Bekanntmachungsdatum)\n\nBayern Amtsgericht München HRB 201405\nLöschungsankündigung 26.09.2024 (Eintragungsdatum)\n\nVural Logistik GmbH\nGesellschaft mit beschränkter Haftung\nMünchen\n\nDas Registergericht beabsichtigt, die im Handelsregister eingetragene Gesellschaft wegen Vermögenslosigkeit von Amts wegen nach § 394 FamFG zu löschen. Die Frist zur Erhebung eines Widerspruchs ist auf drei Monate festgesetzt."
    },
    {
      "date": "2024-09-27",
      "original_text": "Registerbekanntmachung nach dem Umwandlungsgesetz\nNordrhein-Westfalen Amtsgericht Essen HRA 11475\nWS Immobilien GmbH & Co. KG – Essen",
      "type": "Registerbekanntmachung nach dem Umwandlungsgesetz",
      "state": "Nordrhein-Westfalen",
      "amtsgericht": "Amtsgericht Essen",
      "registernummer": "HRA 11475",
      "registerart": "HRA",
      "company_name": "WS Immobilien GmbH & Co. KG",
      "company_seat": "Essen",
      "details": "27.09.2024 (Bekanntmachungsdatum)\n\nNordrhein-Westfalen Amtsgericht Essen HRA 11475\nRegisterbekanntmachung nach dem Umwandlungsgesetz 27.09.2024 (Eintragungsdatum)\n\nWS Immobilien GmbH & Co. KG\nKommanditgesellschaft\nEssen\n\nAls nicht eingetragen wird bekanntgemacht:\nDen Gläubigern der an der Ausgliederung beteiligten Rechtsträger ist, wenn sie binnen sechs Monaten nach dem Tag, an dem die Eintragung der Ausgliederung in das Register des Sitzes desjenigen Rechtsträgers, dessen Gläubiger sie sind, nach § 19 Absatz 3 UmwG als bekanntgemacht gilt, ihren Anspruch nach Grund und Höhe schriftlich anmelden, Sicherheit zu leisten, soweit sie nicht Befriedigung verlangen können. Dieses Recht steht den Gläubigern jedoch nur zu, wenn sie glaubhaft machen, dass durch die Ausgliederung die Erfüllung ihrer Forderung gefährdet wird."
    },
    {
      "date": "2024-09-27",
      "original_text": "Registerbekanntmachung nach dem Umwandlungsgesetz\nNordrhein-Westfalen Amtsgericht Siegen HRB 8516\nWabentechnik GmbH – Freudenberg",
      "type": "Registerbekanntmachung nach dem Umwandlungsgesetz",
      "state": "Nordrhein-Westfalen",
      "amtsgericht": "Amtsgericht Siegen",
      "registernummer": "HRB 8516",
      "registerart": "HRB",
      "company_name": "Wabentechnik GmbH",
      "company_seat": "Freudenberg",
      "details": "27.09.2024 (Bekanntmachungsdatum)\n\nNordrhein-Westfalen Amtsgericht Siegen HRB 8516\nRegisterbekanntmachung nach dem Umwandlungsgesetz 05.09.2024 (Eintragungsdatum)\n\nWabentechnik GmbH\nGesellschaft mit beschränkter Haftung\nFreudenberg\n\nDen Gläubigern der an der Verschmelzung beteiligten Rechtsträger ist, wenn sie binnen sechs Monaten nach dem Tag, an dem die Eintragung der Verschmelzung in das Register des Sitzes desjenigen Rechtsträgers, dessen Gläubiger sie sind, nach § 19 Absatz 3 UmwG als bekanntgemacht gilt, ihren Anspruch nach Grund und Höhe schriftlich anmelden, Sicherheit zu leisten, soweit sie nicht Befriedigung verlangen können. Dieses Recht steht den Gläubigern jedoch nur zu, wenn sie glaubhaft machen, dass durch die Verschmelzung die Erfüllung ihrer Forderung gefährdet wird."
    },
    {
      "date": "2024-09-27",
      "original_text": "Registerbekanntmachung nach dem Umwandlungsgesetz\nBaden-Württemberg Amtsgericht Stuttgart HRB 791091\nWirtschaftskanzlei AUL GmbH – Kornwestheim",
      "type": "Registerbekanntmachung nach dem Umwandlungsgesetz",
      "state": "Baden-Württemberg",
      "amtsgericht": "Amtsgericht Stuttgart",
      "registernummer": "HRB 791091",
      "registerart": "HRB",
      "company_name": "Wirtschaftskanzlei AUL GmbH",
      "company_seat": "Kornwestheim",
      "details": "27.09.2024 (Bekanntmachungsdatum)\n\nBaden-Württemberg Amtsgericht Stuttgart HRB 791091\nRegisterbekanntmachung nach dem Umwandlungsgesetz 27.09.2024 (Eintragungsdatum)\n\nWirtschaftskanzlei AUL GmbH\nGesellschaft mit beschränkter Haftung\nKornwestheim\n\nAls nicht eingetragen wird bekanntgemacht:\nDen Gläubigern der an der Ausgliederung beteiligten Rechtsträger ist, wenn sie binnen sechs Monaten nach dem Tag, an dem die Eintragung der Ausgliederung in das Register des Sitzes desjenigen Rechtsträgers, dessen Gläubiger sie sind, nach § 19 Abs. 3 UmwG als bekanntgemacht gilt, ihren Anspruch nach Grund und Höhe schriftlich anmelden, Sicherheit zu leisten, soweit sie nicht Befriedigung verlangen können. Dieses Recht steht den Gläubigern jedoch nur zu, wenn sie glaubhaft machen, dass durch die Ausgliederung die Erfüllung ihrer Forderung gefährdet wird."
    },
    {
      "date": "2024-09-27",
      "original_text": "Registerbekanntmachung nach dem Umwandlungsgesetz\nBaden-Württemberg Amtsgericht Stuttgart HRA 737834\nWirtschaftskanzlei AUL e.K. – Kornwestheim",
      "type": "Registerbekanntmachung nach dem Umwandlungsgesetz",
      "state": "Baden-Württemberg",
      "amtsgericht": "Amtsgericht Stuttgart",
      "registernummer": "HRA 737834",
      "registerart": "HRA",
      "company_name": "Wirtschaftskanzlei AUL e.K.",
      "company_seat": "Kornwestheim",
      "details": "27.09.2024 (Bekanntmachungsdatum)\n\nBaden-Württemberg Amtsgericht Stuttgart HRA 737834\nRegisterbekanntmachung nach dem Umwandlungsgesetz 27.09.2024 (Eintragungsdatum)\n\nWirtschaftskanzlei AUL e.K.\nEinzelkaufmann / Einzelkauffrau\nKornwestheim\n\nDen Gläubigern der an der Ausgliederung beteiligten Rechtsträger ist, wenn sie binnen sechs Monaten nach dem Tag, an dem die Eintragung der Ausgliederung in das Register des Sitzes desjenigen Rechtsträgers, dessen Gläubiger sie sind, nach § 19 Abs. 3 UmwG als bekanntgemacht gilt, ihren Anspruch nach Grund und Höhe schriftlich anmelden, Sicherheit zu leisten, soweit sie nicht Befriedigung verlangen können. Dieses Recht steht den Gläubigern jedoch nur zu, wenn sie glaubhaft machen, dass durch die Ausgliederung die Erfüllung ihrer Forderung gefährdet wird."
    },
    {
      "date": "2024-09-27",
      "original_text": "Einreichung neuer Dokumente\nNiedersachsen Amtsgericht Hildesheim HRB 109\nWohnungsbau-Aktiengesellschaft Hildesheim – Hildesheim",
      "type": "Einreichung neuer Dokumente",
      "state": "Niedersachsen",
      "amtsgericht": "Amtsgericht Hildesheim",
      "registernummer": "HRB 109",
      "registerart": "HRB",
      "company_name": "Wohnungsbau-Aktiengesellschaft Hildesheim",
      "company_seat": "Hildesheim",
      "details": "27.09.2024 (Bekanntmachungsdatum)\n\nNiedersachsen Amtsgericht Hildesheim HRB 109\nEinreichung neuer Dokumente\n\nWohnungsbau-Aktiengesellschaft Hildesheim\nAktiengesellschaft\nHildesheim\n\nDie Liste der Mitglieder des Aufsichtsrats wurde beim Registergericht eingereicht."
    },
    {
      "date": "2024-09-27",
      "original_text": "Einreichung neuer Dokumente\nSachsen-Anhalt Amtsgericht Stendal HRB 201857\nWohnungsbaugesellschaft mbH Querfurt – Querfurt",
      "type": "Einreichung neuer Dokumente",
      "state": "Sachsen-Anhalt",
      "amtsgericht": "Amtsgericht Stendal",
      "registernummer": "HRB 201857",
      "registerart": "HRB",
      "company_name": "Wohnungsbaugesellschaft mbH Querfurt",
      "company_seat": "Querfurt",
      "details": "27.09.2024 (Bekanntmachungsdatum)\n\nSachsen-Anhalt Amtsgericht Stendal HRB 201857\nEinreichung neuer Dokumente\n\nWohnungsbaugesellschaft mbH Querfurt\nGesellschaft mit beschränkter Haftung\nQuerfurt\n\nEine Liste der Mitglieder des Aufsichtsrates wurde zum Handelsregister eingereicht."
    },
    {
      "date": "2024-09-27",
      "original_text": "Registerbekanntmachung nach dem Umwandlungsgesetz\nBaden-Württemberg Amtsgericht Mannheim HRB 334200\nWohnwelt Menrath GmbH – Leimen",
      "type": "Registerbekanntmachung nach dem Umwandlungsgesetz",
      "state": "Baden-Württemberg",
      "amtsgericht": "Amtsgericht Mannheim",
      "registernummer": "HRB 334200",
      "registerart": "HRB",
      "company_name": "Wohnwelt Menrath GmbH",
      "company_seat": "Leimen",
      "details": "27.09.2024 (Bekanntmachungsdatum)\n\nBaden-Württemberg Amtsgericht Mannheim HRB 334200\nRegisterbekanntmachung nach dem Umwandlungsgesetz 27.09.2024 (Eintragungsdatum)\n\nWohnwelt Menrath GmbH\nGesellschaft mit beschränkter Haftung\nLeimen\n\nAls nicht eingetragen wird bekanntgemacht:\nDen Gläubigern der an der Ausgliederung beteiligten Rechtsträger ist, wenn sie binnen sechs Monaten nach dem Tag, an dem die Eintragung der Ausgliederung in das Register des Sitzes desjenigen Rechtsträgers, dessen Gläubiger sie sind, nach § 19 Abs. 3 UmwG als bekanntgemacht gilt, ihren Anspruch nach Grund und Höhe schriftlich anmelden, Sicherheit zu leisten, soweit sie nicht Befriedigung verlangen können. Dieses Recht steht den Gläubigern jedoch nur zu, wenn sie glaubhaft machen, dass durch die Ausgliederung die Erfüllung ihrer Forderung gefährdet wird."
    },
    {
      "date": "2024-09-27",
      "original_text": "Registerbekanntmachung nach dem Umwandlungsgesetz\nBaden-Württemberg Amtsgericht Ulm HRA 729147\nXP Marcus Steffen Metallbau e.K. – Rot am See",
      "type": "Registerbekanntmachung nach dem Umwandlungsgesetz",
      "state": "Baden-Württemberg",
      "amtsgericht": "Amtsgericht Ulm",
      "registernummer": "HRA 729147",
      "registerart": "HRA",
      "company_name": "XP Marcus Steffen Metallbau e.K.",
      "company_seat": "Rot am See",
      "details": "27.09.2024 (Bekanntmachungsdatum)\n\nBaden-Württemberg Amtsgericht Ulm HRA 729147\nRegisterbekanntmachung nach dem Umwandlungsgesetz 27.09.2024 (Eintragungsdatum)\n\nXP Marcus Steffen Metallbau e.K.\nEinzelkaufmann / Einzelkauffrau\nRot am See\n\nAls nicht eingetragen wird bekanntgemacht:\nDen Gläubigern der an der Ausgliederung beteiligten Rechtsträger ist, wenn sie binnen sechs Monaten nach dem Tag, an dem die Eintragung der Ausgliederung in das Register des Sitzes desjenigen Rechtsträgers, dessen Gläubiger sie sind, nach § 19 Abs. 3 UmwG als bekanntgemacht gilt, ihren Anspruch nach Grund und Höhe schriftlich anmelden, Sicherheit zu leisten, soweit sie nicht Befriedigung verlangen können. Dieses Recht steht den Gläubigern jedoch nur zu, wenn sie glaubhaft machen, dass durch die Ausgliederung die Erfüllung ihrer Forderung gefährdet wird."
    },
    {
      "date": "2024-09-27",
      "original_text": "Registerbekanntmachung nach dem Umwandlungsgesetz\nBaden-Württemberg Amtsgericht Ulm HRA 729182\nXP Vermögensverwaltungs GmbH & Co. KG – Rot am See",
      "type": "Registerbekanntmachung nach dem Umwandlungsgesetz",
      "state": "Baden-Württemberg",
      "amtsgericht": "Amtsgericht Ulm",
      "registernummer": "HRA 729182",
      "registerart": "HRA",
      "company_name": "XP Vermögensverwaltungs GmbH & Co. KG",
      "company_seat": "Rot am See",
      "details": "27.09.2024 (Bekanntmachungsdatum)\n\nBaden-Württemberg Amtsgericht Ulm HRA 729182\nRegisterbekanntmachung nach dem Umwandlungsgesetz 27.09.2024 (Eintragungsdatum)\n\nXP Vermögensverwaltungs GmbH & Co. KG\nKommanditgesellschaft\nRot am See\n\nAls nicht eingetragen wird bekanntgemacht:\nDen Gläubigern der an der Ausgliederung beteiligten Rechtsträger ist, wenn sie binnen sechs Monaten nach dem Tag, an dem die Eintragung der Ausgliederung in das Register des Sitzes desjenigen Rechtsträgers, dessen Gläubiger sie sind, nach § 19 Abs. 3 UmwG als bekanntgemacht gilt, ihren Anspruch nach Grund und Höhe schriftlich anmelden, Sicherheit zu leisten, soweit sie nicht Befriedigung verlangen können. Dieses Recht steht den Gläubigern jedoch nur zu, wenn sie glaubhaft machen, dass durch die Ausgliederung die Erfüllung ihrer Forderung gefährdet wird."
    },
    {
      "date": "2024-09-27",
      "original_text": "Sonstige Registerbekanntmachung\nBerlin Amtsgericht Berlin (Charlottenburg) HRB 165086\nXProductions GmbH – Berlin",
      "type": "Sonstige Registerbekanntmachung",
      "state": "Berlin",
      "amtsgericht": "Amtsgericht Berlin (Charlottenburg)",
      "registernummer": "HRB 165086",
      "registerart": "HRB",
      "company_name": "XProductions GmbH",
      "company_seat": "Berlin",
      "details": "27.09.2024 (Bekanntmachungsdatum)\n\nBerlin Amtsgericht Berlin (Charlottenburg) HRB 165086\nSonstige Registerbekanntmachung\n\nXProductions GmbH\nGesellschaft mit beschränkter Haftung\nBerlin\n\nAls nicht eingetragen wird veröffentlicht: Den Gläubigern der an der Verschmelzung beteiligten Rechtsträger ist, wenn sie binnen sechs Monaten nach dem Tag, an dem die Eintragung der Verschmelzung in das Register des Sitzes desjenigen Rechtsträgers, dessen Gläubiger sie sind, als bekannt gemacht gilt, ihren Anspruch nach Grund und Höhe schriftlich anmelden, Sicherheit zu leisten, soweit sie nicht Befriedigung verlangen können. Dieses Recht steht den Gläubigern jedoch nur zu, wenn sie glaubhaft machen, dass durch die Verschmelzung die Erfüllung ihrer Forderung gefährdet wird. Das Recht, Sicherheitsleistung zu verlangen, steht Gläubigern nicht zu, die im Falle der Insolvenz ein Recht auf vorzugsweise Befriedigung aus einer Deckungsmasse haben, die nach gesetzlicher Vorschrift zu ihrem Schutz errichtet und staatlich überwacht ist."
    },
    {
      "date": "2024-09-27",
      "original_text": "Registerbekanntmachung nach dem Umwandlungsgesetz\nSachsen Amtsgericht Dresden HRA 12096\nZH2 Agentur e.K. Inhaber Bernd Zimmermann – Zittau",
      "type": "Registerbekanntmachung nach dem Umwandlungsgesetz",
      "state": "Sachsen",
      "amtsgericht": "Amtsgericht Dresden",
      "registernummer": "HRA 12096",
      "registerart": "HRA",
      "company_name": "ZH2 Agentur e.K. Inhaber Bernd Zimmermann",
      "company_seat": "Zittau",
      "details": "27.09.2024 (Bekanntmachungsdatum)\n\nSachsen Amtsgericht Dresden HRA 12096\nRegisterbekanntmachung nach dem Umwandlungsgesetz 27.09.2024 (Eintragungsdatum)\n\nZH2 Agentur e.K. Inhaber Bernd Zimmermann\nEinzelkaufmann / Einzelkauffrau\nZittau\n\nDen Gläubigern der an der Ausgliederung beteiligten Rechtsträger ist, wenn sie binnen sechs Monaten nach dem Tag, an dem die Eintragung der Ausgliederung in das Register des Sitzes desjenigen Rechtsträgers, dessen Gläubiger sie sind, nach § 19 Abs. 3 UmwG als bekannt gemacht gilt, ihren Anspruch nach Grund und Höhe schriftlich anmelden, Sicherheit zu leisten, soweit sie nicht Befriedigung verlangen können. Dieses Recht steht den Gläubigern jedoch nur zu, wenn sie glaubhaft machen, dass durch die Ausgliederung die Erfüllung der Forderung gefährdet wird."
    },
    {
      "date": "2024-09-27",
      "original_text": "Registerbekanntmachung nach dem Umwandlungsgesetz\nSachsen Amtsgericht Dresden HRB 44659\nZH2 GmbH – Zittau",
      "type": "Registerbekanntmachung nach dem Umwandlungsgesetz",
      "state": "Sachsen",
      "amtsgericht": "Amtsgericht Dresden",
      "registernummer": "HRB 44659",
      "registerart": "HRB",
      "company_name": "ZH2 GmbH",
      "company_seat": "Zittau",
      "details": "27.09.2024 (Bekanntmachungsdatum)\n\nSachsen Amtsgericht Dresden HRB 44659\nRegisterbekanntmachung nach dem Umwandlungsgesetz 27.09.2024 (Eintragungsdatum)\n\nZH2 GmbH\nGesellschaft mit beschränkter Haftung\nZittau\n\nDen Gläubigern der an der Ausgliederung beteiligten Rechtsträger ist, wenn sie binnen sechs Monaten nach dem Tag, an dem die Eintragung der Ausgliederung in das Register des Sitzes desjenigen Rechtsträgers, dessen Gläubiger sie sind, nach § 19 Abs. 3 UmwG als bekannt gemacht gilt, ihren Anspruch nach Grund und Höhe schriftlich anmelden, Sicherheit zu leisten, soweit sie nicht Befriedigung verlangen können. Dieses Recht steht den Gläubigern jedoch nur zu, wenn sie glaubhaft machen, dass durch die Ausgliederung die Erfüllung der Forderung gefährdet wird."
    },
    {
      "date": "2024-09-27",
      "original_text": "Registerbekanntmachung nach dem Umwandlungsgesetz\nSchleswig-Holstein Amtsgericht Lübeck HRB 3741 AH\ncplus Informationssysteme und -beratung GmbH – Ahrensburg",
      "type": "Registerbekanntmachung nach dem Umwandlungsgesetz",
      "state": "Schleswig-Holstein",
      "amtsgericht": "Amtsgericht Lübeck",
      "registernummer": "HRB 3741 AH",
      "registerart": "HRB",
      "company_name": "cplus Informationssysteme und -beratung GmbH",
      "company_seat": "Ahrensburg",
      "details": "27.09.2024 (Bekanntmachungsdatum)\n\nSchleswig-Holstein Amtsgericht Lübeck HRB 3741 AH\nRegisterbekanntmachung nach dem Umwandlungsgesetz 27.09.2024 (Eintragungsdatum)\n\ncplus Informationssysteme und -beratung GmbH\nGesellschaft mit beschränkter Haftung\nAhrensburg\n\nAls nicht eingetragen wird veröffentlicht: Den Gläubigern der an der Verschmelzung beteiligten Rechtsträger ist, wenn sie binnen sechs Monaten nach dem Tag, an dem die Eintragung der Verschmelzung in das Register des Sitzes desjenigen Rechtsträgers, dessen Gläubiger sie sind, als bekannt gemacht gilt, ihren Anspruch nach Grund und Höhe schriftlich anmelden, Sicherheit zu leisten, soweit sie nicht Befriedigung verlangen können. Dieses Recht steht den Gläubigern jedoch nur zu, wenn sie glaubhaft machen, dass durch die Verschmelzung die Erfüllung ihrer Forderung gefährdet wird."
    },
    {
      "date": "2024-09-27",
      "original_text": "Registerbekanntmachung nach dem Umwandlungsgesetz\nNiedersachsen Amtsgericht Lüneburg HRA 204233\nenerix-Lüneburg - Photovoltaik & Stromspeicher e. K. – Lüneburg",
      "type": "Registerbekanntmachung nach dem Umwandlungsgesetz",
      "state": "Niedersachsen",
      "amtsgericht": "Amtsgericht Lüneburg",
      "registernummer": "HRA 204233",
      "registerart": "HRA",
      "company_name": "enerix-Lüneburg - Photovoltaik & Stromspeicher e. K.",
      "company_seat": "Lüneburg",
      "details": "27.09.2024 (Bekanntmachungsdatum)\n\nNiedersachsen Amtsgericht Lüneburg HRA 204233\nRegisterbekanntmachung nach dem Umwandlungsgesetz 27.09.2024 (Eintragungsdatum)\n\nenerix-Lüneburg - Photovoltaik & Stromspeicher e. K.\nEinzelkaufmann / Einzelkauffrau\nLüneburg\n\nDen Gläubigern der an der Ausgliederung beteiligten Rechtsträger ist, wenn sie binnen sechs Monaten nach dem Tag, an dem die Eintragung der Ausgliederung in das Register des Sitzes desjenigen Rechtsträgers, dessen Gläubiger sie sind, nach § 19 Abs. 3 UmwG als bekannt gemacht gilt, ihren Anspruch nach Grund und Höhe schriftlich anmelden, Sicherheit zu leisten, soweit sie nicht Befriedigung verlangen können. Dieses Recht steht den Gläubigern jedoch nur zu, wenn sie glaubhaft machen, dass durch die Ausgliederung die Erfüllung der Forderung gefährdet wird."
    },
    {
      "date": "2024-09-27",
      "original_text": "Registerbekanntmachung nach dem Umwandlungsgesetz\nHamburg Amtsgericht Hamburg HRB 122405\neverii Germany GmbH – Hamburg",
      "type": "Registerbekanntmachung nach dem Umwandlungsgesetz",
      "state": "Hamburg",
      "amtsgericht": "Amtsgericht Hamburg",
      "registernummer": "HRB 122405",
      "registerart": "HRB",
      "company_name": "everii Germany GmbH",
      "company_seat": "Hamburg",
      "details": "27.09.2024 (Bekanntmachungsdatum)\n\nHamburg Amtsgericht Hamburg HRB 122405\nRegisterbekanntmachung nach dem Umwandlungsgesetz 27.09.2024 (Eintragungsdatum)\n\neverii Germany GmbH\nGesellschaft mit beschränkter Haftung\nHamburg\n\nAls nicht eingetragen wird bekannt gemacht:\nDen Gläubigern der an der Verschmelzung beteiligten Gesellschaften ist, wenn sie binnen sechs Monaten nach dem Tag, an dem die Eintragung der Verschmelzung in das Register des Sitzes desjenigen Rechtsträgers, dessen Gläubiger sie sind, nach § 19 Absatz 3 UmwG als bekannt gemacht gilt, ihren Anspruch nach Grund und Höhe schriftlich anmelden, Sicherheit zu leisten, soweit sie nicht Befriedigung verlangen können. Dieses Recht steht den Gläubigern jedoch nur zu, wenn sie glaubhaft machen, dass durch die Verschmelzung die Erfüllung ihrer Forderung gefährdet wird."
    },
    {
      "date": "2024-09-27",
      "original_text": "Registerbekanntmachung nach dem Umwandlungsgesetz\nNiedersachsen Amtsgericht Oldenburg (Oldenburg) HRB 141339 früher Amtsgericht Delmenhorst\ninvest-urban GmbH – Delmenhorst",
      "type": "Registerbekanntmachung nach dem Umwandlungsgesetz",
      "state": "Niedersachsen",
      "amtsgericht": "Amtsgericht Oldenburg (Oldenburg)",
      "registernummer": "HRB 141339",
      "registerart": "HRB",
      "company_name": "invest-urban GmbH",
      "company_seat": "Delmenhorst",
      "former_amtsgericht": "Delmenhorst",
      "details": "27.09.2024 (Bekanntmachungsdatum)\n\nNiedersachsen Amtsgericht Oldenburg (Oldenburg) HRB 141339 früher Amtsgericht Delmenhorst\nRegisterbekanntmachung nach dem Umwandlungsgesetz 27.09.2024 (Eintragungsdatum)\n\ninvest-urban GmbH\nGesellschaft mit beschränkter Haftung\nDelmenhorst\n\nDen Gläubigern der an der formwechselnden Umwandlung beteiligten Rechtsträger ist, wenn sie binnen sechs Monaten nach dem Tag, an dem die Eintragung der Umwandlung in das Register des Sitzes desjenigen Rechtsträgers, dessen Gläubiger sie sind, nach § 19 Abs. 3 UmwG als bekannt gemacht gilt, ihren Anspruch nach Grund und Höhe schriftlich anmelden, Sicherheit zu leisten, soweit sie nicht Befriedigung verlangen können. Dieses Recht steht den Gläubigern jedoch nur zu, wenn sie glaubhaft machen, dass durch die formwechselnde Umwandlung die Erfüllung der Forderung gefährdet wird."
    },
    {
      "date": "2024-09-27",
      "original_text": "Registerbekanntmachung nach dem Umwandlungsgesetz\nRheinland-Pfalz Amtsgericht Zweibrücken HRB 33051\nklassenheld GmbH – Zweibrücken",
      "type": "Registerbekanntmachung nach dem Umwandlungsgesetz",
      "state": "Rheinland-Pfalz",
      "amtsgericht": "Amtsgericht Zweibrücken",
      "registernummer": "HRB 33051",
      "registerart": "HRB",
      "company_name": "klassenheld GmbH",
      "company_seat": "Zweibrücken",
      "details": "27.09.2024 (Bekanntmachungsdatum)\n\nRheinland-Pfalz Amtsgericht Zweibrücken HRB 33051\nRegisterbekanntmachung nach dem Umwandlungsgesetz 27.09.2024 (Eintragungsdatum)\n\nklassenheld GmbH\nGesellschaft mit beschränkter Haftung\nZweibrücken\n\nAls nicht eingetragen wird veröffentlicht: Den Gläubigern der an der Ausgliederung beteiligten Rechtsträger ist, wenn sie binnen sechs Monaten nac hdem Tag, an dem die Eintragung der Ausgliederung in das Register des Sitzes desjenigen Rechtsträgers,dessen Gläubiger sie sind, nach § 19 Abs. 3 UmwG als bekannt gemacht gilt, ihren Anspruch nach Grund und Höhe schriftlich anmelden, Sicherheit zu leisten, soweit sie nicht Befriedigung verlangen können. Dieses Recht steht den Gläubigern jedoch nur zu, wenn sie glaubhaft machen, dass durch die Ausgliederung die Erfüllung der Forderung gefährdet wird."
    },
    {
      "date": "2024-09-27",
      "original_text": "Einreichung neuer Dokumente\nBayern Amtsgericht München HRB 179714\nmutares Holding-02 AG – Bad Wiessee",
      "type": "Einreichung neuer Dokumente",
      "state": "Bayern",
      "amtsgericht": "Amtsgericht München",
      "registernummer": "HRB 179714",
      "registerart": "HRB",
      "company_name": "mutares Holding-02 AG",
      "company_seat": "Bad Wiessee",
      "details": "27.09.2024 (Bekanntmachungsdatum)\n\nBayern Amtsgericht München HRB 179714\nEinreichung neuer Dokumente\n\nmutares Holding-02 AG\nAktiengesellschaft\nBad Wiessee\n\nDem Amtsgericht München -Registergericht- ist eine Liste der Mitglieder des Aufsichtsrats eingereicht worden, § 106 AktG."
    },
    {
      "date": "2024-09-27",
      "original_text": "Löschungsankündigung\nBerlin Amtsgericht Berlin (Charlottenburg) HRB 194263\n³KonzeptBau GmbH – Berlin",
      "type": "Löschungsankündigung",
      "state": "Berlin",
      "amtsgericht": "Amtsgericht Berlin (Charlottenburg)",
      "registernummer": "HRB 194263",
      "registerart": "HRB",
      "company_name": "³KonzeptBau GmbH",
      "company_seat": "Berlin",
      "details": "27.09.2024 (Bekanntmachungsdatum)\n\nBerlin Amtsgericht Berlin (Charlottenburg) HRB 194263\nLöschungsankündigung\n\n³KonzeptBau GmbH\nGesellschaft mit beschränkter Haftung\nBerlin\n\nBei der nachstehenden Gesellschaft wird das Amtslöschungsverfahren gemäß § 394 FamFG eingeleitet. Widerspruchsfrist 6 Wochen"
    }
  ]
}