{
  "date": "2025-04-22",
  "date_of_scrape": "2025-05-31T06:29:31.797Z",
  "tool_version": "0.2.0",
  "number_of_announcements": 113,
  "announcements": [
    {
      "date": "2025-04-22",
      "id": "106983",
      "original_text": "Einreichung neuer Dokumente\nSaarland Amtsgericht Saarbrücken HRB 4444\nGEKOBA - Gesellschaft für Gewerbe- und Kommunalbauten mit beschränkter Haftung – Saarbrücken",
      "type": "Einreichung neuer Dokumente",
      "state": "Saarland",
      "amtsgericht": "Amtsgericht Saarbrücken",
      "registernummer": "HRB 4444",
      "registerart": "HRB",
      "company_name": "GEKOBA - Gesellschaft für Gewerbe- und Kommunalbauten mit beschränkter Haftung",
      "company_seat": "Saarbrücken",
      "details": "22.04.2025 (Bekanntmachungsdatum)\n\nSaarland Amtsgericht Saarbrücken HRB 4444\nEinreichung neuer Dokumente\n\nGEKOBA - Gesellschaft für Gewerbe- und Kommunalbauten mit beschränkter Haftung\nGesellschaft mit beschränkter Haftung\nSaarbrücken\n\nDie Geschäftsführung der Gesellschaft hat eine Liste der Mitglieder des Aufsichtsrats zum Handelsregister eingereicht (§ 52 Abs. 3 Satz 2 GmbHG)."
    },
    {
      "date": "2025-04-22",
      "id": "106984",
      "original_text": "Löschungsankündigung\nBaden-Württemberg Amtsgericht Mannheim HRB 713480\nVMP Trockenbau UG (haftungsbeschränkt) – Mannheim",
      "type": "Löschungsankündigung",
      "state": "Baden-Württemberg",
      "amtsgericht": "Amtsgericht Mannheim",
      "registernummer": "HRB 713480",
      "registerart": "HRB",
      "company_name": "VMP Trockenbau UG (haftungsbeschränkt)",
      "company_seat": "Mannheim",
      "details": "22.04.2025 (Bekanntmachungsdatum)\n\nBaden-Württemberg Amtsgericht Mannheim HRB 713480\nLöschungsankündigung\n\nVMP Trockenbau UG (haftungsbeschränkt)\nGesellschaft mit beschränkter Haftung\nMannheim\n\nAls nicht eingetragen wird bekanntgemacht:\nDas Gericht beabsichtigt, die Gesellschaft wegen Vermögenslosigkeit im Handelsregister von Amts wegen nach § 394 FamFG zu löschen. Die Frist zur Geltendmachung eines Widerspruchs gegen die beabsichtigte Löschung ist auf einen Monat ab Veröffentlichung bestimmt."
    },
    {
      "date": "2025-04-22",
      "id": "106985",
      "original_text": "Löschungsankündigung\nBerlin Amtsgericht Berlin (Charlottenburg) HRB 186298\nDADAS & SEIBOLD EstrichBau GmbH – Berlin",
      "type": "Löschungsankündigung",
      "state": "Berlin",
      "amtsgericht": "Amtsgericht Berlin (Charlottenburg)",
      "registernummer": "HRB 186298",
      "registerart": "HRB",
      "company_name": "DADAS & SEIBOLD EstrichBau GmbH",
      "company_seat": "Berlin",
      "details": "22.04.2025 (Bekanntmachungsdatum)\n\nBerlin Amtsgericht Berlin (Charlottenburg) HRB 186298\nLöschungsankündigung\n\nDADAS & SEIBOLD EstrichBau GmbH\nGesellschaft mit beschränkter Haftung\nBerlin\n\nBei der nachstehenden Gesellschaft wird das Amtslöschungsverfahren gemäß § 394 FamFG eingeleitet. Widerspruchsfrist 6 Wochen"
    },
    {
      "date": "2025-04-22",
      "id": "106986",
      "original_text": "Sonstige Registerbekanntmachung\nBaden-Württemberg Amtsgericht Stuttgart HRB 749282\nSeitz glutenfrei GmbH – Spaichingen",
      "type": "Sonstige Registerbekanntmachung",
      "state": "Baden-Württemberg",
      "amtsgericht": "Amtsgericht Stuttgart",
      "registernummer": "HRB 749282",
      "registerart": "HRB",
      "company_name": "Seitz glutenfrei GmbH",
      "company_seat": "Spaichingen",
      "details": "22.04.2025 (Bekanntmachungsdatum)\n\nBaden-Württemberg Amtsgericht Stuttgart HRB 749282\nSonstige Registerbekanntmachung 22.04.2025 (Eintragungsdatum)\n\nSeitz glutenfrei GmbH\nGesellschaft mit beschränkter Haftung\nSpaichingen\n\nAls nicht eingetragen wird bekanntgemacht:\nDen Gläubigern der Gesellschaft, deren Forderungen begründet worden sind, bevor die Eintragung der Beendigung des Vertrages in das Handelsregister nach § 10 HGB als bekanntgemacht gilt, ist vom anderen Vertragsteil Sicherheit zu leisten, wenn sie sich binnen sechs Monaten nach der Bekanntmachung zu diesem Zweck bei ihm melden."
    },
    {
      "date": "2025-04-22",
      "id": "106987",
      "original_text": "Registerbekanntmachung nach dem Umwandlungsgesetz\nBaden-Württemberg Amtsgericht Mannheim HRA 570326\nAH Gastro Consult GmbH & Co KG – Wertheim",
      "type": "Registerbekanntmachung nach dem Umwandlungsgesetz",
      "state": "Baden-Württemberg",
      "amtsgericht": "Amtsgericht Mannheim",
      "registernummer": "HRA 570326",
      "registerart": "HRA",
      "company_name": "AH Gastro Consult GmbH & Co KG",
      "company_seat": "Wertheim",
      "details": "22.04.2025 (Bekanntmachungsdatum)\n\nBaden-Württemberg Amtsgericht Mannheim HRA 570326\nRegisterbekanntmachung nach dem Umwandlungsgesetz 22.04.2025 (Eintragungsdatum)\n\nAH Gastro Consult GmbH & Co KG\nKommanditgesellschaft\nWertheim\n\nDen Gläubigern der an der Verschmelzung beteiligten Rechtsträger ist, wenn sie binnen sechs Monaten nach dem Tag, an dem die Eintragung der Verschmelzung in das Register des Sitzes desjenigen Rechtsträgers, dessen Gläubiger sie sind, nach § 19 Abs. 3 UmwG als bekanntgemacht gilt, ihren Anspruch nach Grund und Höhe schriftlich anmelden, Sicherheit zu leisten, soweit sie nicht Befriedigung verlangen können. Dieses Recht steht den Gläubigern jedoch nur zu, wenn sie glaubhaft machen, dass durch die Verschmelzung die Erfüllung ihrer Forderung gefährdet wird."
    },
    {
      "date": "2025-04-22",
      "id": "106988",
      "original_text": "Registerbekanntmachung nach dem Umwandlungsgesetz\nBaden-Württemberg Amtsgericht Stuttgart HRB 797782\nFGS GmbH – Sindelfingen",
      "type": "Registerbekanntmachung nach dem Umwandlungsgesetz",
      "state": "Baden-Württemberg",
      "amtsgericht": "Amtsgericht Stuttgart",
      "registernummer": "HRB 797782",
      "registerart": "HRB",
      "company_name": "FGS GmbH",
      "company_seat": "Sindelfingen",
      "details": "22.04.2025 (Bekanntmachungsdatum)\n\nBaden-Württemberg Amtsgericht Stuttgart HRB 797782\nRegisterbekanntmachung nach dem Umwandlungsgesetz 22.04.2025 (Eintragungsdatum)\n\nFGS GmbH\nGesellschaft mit beschränkter Haftung\nSindelfingen\n\nAls nicht eingetragen wird bekanntgemacht:\nDen Gläubigern der an der Ausgliederung beteiligten Rechtsträger ist, wenn sie binnen sechs Monaten nach dem Tag, an dem die Eintragung der Ausgliederung in das Register des Sitzes desjenigen Rechtsträgers, dessen Gläubiger sie sind, nach § 19 Abs. 3 UmwG als bekanntgemacht gilt, ihren Anspruch nach Grund und Höhe schriftlich anmelden, Sicherheit zu leisten, soweit sie nicht Befriedigung verlangen können. Dieses Recht steht den Gläubigern jedoch nur zu, wenn sie glaubhaft machen, dass durch die Ausgliederung die Erfüllung ihrer Forderung gefährdet wird."
    },
    {
      "date": "2025-04-22",
      "id": "106989",
      "original_text": "Löschungsankündigung\nBerlin Amtsgericht Berlin (Charlottenburg) HRB 174308\nMinid Finance UG (haftungsbeschränkt) – Berlin",
      "type": "Löschungsankündigung",
      "state": "Berlin",
      "amtsgericht": "Amtsgericht Berlin (Charlottenburg)",
      "registernummer": "HRB 174308",
      "registerart": "HRB",
      "company_name": "Minid Finance UG (haftungsbeschränkt)",
      "company_seat": "Berlin",
      "details": "22.04.2025 (Bekanntmachungsdatum)\n\nBerlin Amtsgericht Berlin (Charlottenburg) HRB 174308\nLöschungsankündigung\n\nMinid Finance UG (haftungsbeschränkt)\nGesellschaft mit beschränkter Haftung\nBerlin\n\nBei der nachstehenden Gesellschaft wird das Amtslöschungsverfahren gemäß § 394 FamFG eingeleitet. Widerspruchsfrist 6 Wochen"
    },
    {
      "date": "2025-04-22",
      "id": "106990",
      "original_text": "Registerbekanntmachung nach dem Umwandlungsgesetz\nBaden-Württemberg Amtsgericht Stuttgart HRA 12576\nLinden Apotheke Dorothee Seils – Stuttgart",
      "type": "Registerbekanntmachung nach dem Umwandlungsgesetz",
      "state": "Baden-Württemberg",
      "amtsgericht": "Amtsgericht Stuttgart",
      "registernummer": "HRA 12576",
      "registerart": "HRA",
      "company_name": "Linden Apotheke Dorothee Seils",
      "company_seat": "Stuttgart",
      "details": "22.04.2025 (Bekanntmachungsdatum)\n\nBaden-Württemberg Amtsgericht Stuttgart HRA 12576\nRegisterbekanntmachung nach dem Umwandlungsgesetz 22.04.2025 (Eintragungsdatum)\n\nLinden Apotheke Dorothee Seils\nEinzelkaufmann / Einzelkauffrau\nStuttgart\n\nDen Gläubigern der an der Ausgliederung beteiligten Rechtsträger ist, wenn sie binnen sechs Monaten nach dem Tag, an dem die Eintragung der Ausgliederung in das Register des Sitzes desjenigen Rechtsträgers, dessen Gläubiger sie sind, nach § 19 Abs. 3 UmwG als bekanntgemacht gilt, ihren Anspruch nach Grund und Höhe schriftlich anmelden, Sicherheit zu leisten, soweit sie nicht Befriedigung verlangen können. Dieses Recht steht den Gläubigern jedoch nur zu, wenn sie glaubhaft machen, dass durch die Ausgliederung die Erfüllung ihrer Forderung gefährdet wird."
    },
    {
      "date": "2025-04-22",
      "id": "106991",
      "original_text": "Registerbekanntmachung nach dem Umwandlungsgesetz\nBaden-Württemberg Amtsgericht Stuttgart HRA 741923\nSeils Laier OHG – Stuttgart",
      "type": "Registerbekanntmachung nach dem Umwandlungsgesetz",
      "state": "Baden-Württemberg",
      "amtsgericht": "Amtsgericht Stuttgart",
      "registernummer": "HRA 741923",
      "registerart": "HRA",
      "company_name": "Seils Laier OHG",
      "company_seat": "Stuttgart",
      "details": "22.04.2025 (Bekanntmachungsdatum)\n\nBaden-Württemberg Amtsgericht Stuttgart HRA 741923\nRegisterbekanntmachung nach dem Umwandlungsgesetz 22.04.2025 (Eintragungsdatum)\n\nSeils Laier OHG\nOffene Handelsgesellschaft\nStuttgart\n\nAls nicht eingetragen wird bekanntgemacht:\nDen Gläubigern der an der Ausgliederung beteiligten Rechtsträger ist, wenn sie binnen sechs Monaten nach dem Tag, an dem die Eintragung der Ausgliederung in das Register des Sitzes desjenigen Rechtsträgers, dessen Gläubiger sie sind, nach § 19 Abs. 3 UmwG als bekanntgemacht gilt, ihren Anspruch nach Grund und Höhe schriftlich anmelden, Sicherheit zu leisten, soweit sie nicht Befriedigung verlangen können. Dieses Recht steht den Gläubigern jedoch nur zu, wenn sie glaubhaft machen, dass durch die Ausgliederung die Erfüllung ihrer Forderung gefährdet wird."
    },
    {
      "date": "2025-04-22",
      "id": "106992",
      "original_text": "Registerbekanntmachung nach dem Umwandlungsgesetz\nBaden-Württemberg Amtsgericht Stuttgart HRA 741987\nMate Cvitanov e.K. – Sindelfingen",
      "type": "Registerbekanntmachung nach dem Umwandlungsgesetz",
      "state": "Baden-Württemberg",
      "amtsgericht": "Amtsgericht Stuttgart",
      "registernummer": "HRA 741987",
      "registerart": "HRA",
      "company_name": "Mate Cvitanov e.K.",
      "company_seat": "Sindelfingen",
      "details": "22.04.2025 (Bekanntmachungsdatum)\n\nBaden-Württemberg Amtsgericht Stuttgart HRA 741987\nRegisterbekanntmachung nach dem Umwandlungsgesetz 22.04.2025 (Eintragungsdatum)\n\nMate Cvitanov e.K.\nEinzelkaufmann / Einzelkauffrau\nSindelfingen\n\nDen Gläubigern der an der Ausgliederung beteiligten Rechtsträger ist, wenn sie binnen sechs Monaten nach dem Tag, an dem die Eintragung der Ausgliederung in das Register des Sitzes desjenigen Rechtsträgers, dessen Gläubiger sie sind, nach § 19 Abs. 3 UmwG als bekanntgemacht gilt, ihren Anspruch nach Grund und Höhe schriftlich anmelden, Sicherheit zu leisten, soweit sie nicht Befriedigung verlangen können. Dieses Recht steht den Gläubigern jedoch nur zu, wenn sie glaubhaft machen, dass durch die Ausgliederung die Erfüllung ihrer Forderung gefährdet wird."
    },
    {
      "date": "2025-04-22",
      "id": "106993",
      "original_text": "Einreichung neuer Dokumente\nHamburg Amtsgericht Hamburg HRB 17543\nAVW Versicherungsmakler GmbH – Hamburg",
      "type": "Einreichung neuer Dokumente",
      "state": "Hamburg",
      "amtsgericht": "Amtsgericht Hamburg",
      "registernummer": "HRB 17543",
      "registerart": "HRB",
      "company_name": "AVW Versicherungsmakler GmbH",
      "company_seat": "Hamburg",
      "details": "22.04.2025 (Bekanntmachungsdatum)\n\nHamburg Amtsgericht Hamburg HRB 17543\nEinreichung neuer Dokumente\n\nAVW Versicherungsmakler GmbH\nGesellschaft mit beschränkter Haftung\nHamburg\n\nAls nicht eingetragen wird bekannt gemacht: Liste des Aufsichtsrats wurde eingereicht."
    },
    {
      "date": "2025-04-22",
      "id": "106994",
      "original_text": "Registerbekanntmachung nach dem Umwandlungsgesetz\nHamburg Amtsgericht Hamburg HRB 80834\nAngewandte Informatik für medizinisches Controlling-InMed GmbH – Hamburg",
      "type": "Registerbekanntmachung nach dem Umwandlungsgesetz",
      "state": "Hamburg",
      "amtsgericht": "Amtsgericht Hamburg",
      "registernummer": "HRB 80834",
      "registerart": "HRB",
      "company_name": "Angewandte Informatik für medizinisches Controlling-InMed GmbH",
      "company_seat": "Hamburg",
      "details": "22.04.2025 (Bekanntmachungsdatum)\n\nHamburg Amtsgericht Hamburg HRB 80834\nRegisterbekanntmachung nach dem Umwandlungsgesetz 22.04.2025 (Eintragungsdatum)\n\nAngewandte Informatik für medizinisches Controlling-InMed GmbH\nGesellschaft mit beschränkter Haftung\nHamburg\n\nAls nicht eingetragen wird bekannt gemacht:\nDen Gläubigern der an der Verschmelzung beteiligten Gesellschaften ist, wenn sie binnen sechs Monaten nach dem Tag, an dem die Eintragung der Verschmelzung in das Register des Sitzes desjenigen Rechtsträgers, dessen Gläubiger sie sind, nach § 19 Absatz 3 UmwG als bekannt gemacht gilt, ihren Anspruch nach Grund und Höhe schriftlich anmelden, Sicherheit zu leisten, soweit sie nicht Befriedigung verlangen können. Dieses Recht steht den Gläubigern jedoch nur zu, wenn sie glaubhaft machen, dass durch die Verschmelzung die Erfüllung ihrer Forderung gefährdet wird."
    },
    {
      "date": "2025-04-22",
      "id": "106995",
      "original_text": "Löschungsankündigung\nBaden-Württemberg Amtsgericht Mannheim HRB 723913\nProfit Transport GmbH – Mannheim",
      "type": "Löschungsankündigung",
      "state": "Baden-Württemberg",
      "amtsgericht": "Amtsgericht Mannheim",
      "registernummer": "HRB 723913",
      "registerart": "HRB",
      "company_name": "Profit Transport GmbH",
      "company_seat": "Mannheim",
      "details": "22.04.2025 (Bekanntmachungsdatum)\n\nBaden-Württemberg Amtsgericht Mannheim HRB 723913\nLöschungsankündigung 22.04.2025 (Eintragungsdatum)\n\nProfit Transport GmbH\nGesellschaft mit beschränkter Haftung\nMannheim\n\nAls nicht eingetragen wird bekanntgemacht:\nDas Gericht beabsichtigt, die Gesellschaft wegen Vermögenslosigkeit im Handelsregister von Amts wegen nach § 394 FamFG zu löschen. Die Frist zur Geltendmachung eines Widerspruchs gegen die beabsichtigte Löschung ist auf einen Monat ab Veröffentlichung bestimmt."
    },
    {
      "date": "2025-04-22",
      "id": "106996",
      "original_text": "Registerbekanntmachung nach dem Umwandlungsgesetz\nSchleswig-Holstein Amtsgericht Kiel HRB 24843\nHT Ahlers Verwaltungs GmbH – Seedorf-Hornsmühlen",
      "type": "Registerbekanntmachung nach dem Umwandlungsgesetz",
      "state": "Schleswig-Holstein",
      "amtsgericht": "Amtsgericht Kiel",
      "registernummer": "HRB 24843",
      "registerart": "HRB",
      "company_name": "HT Ahlers Verwaltungs GmbH",
      "company_seat": "Seedorf-Hornsmühlen",
      "details": "22.04.2025 (Bekanntmachungsdatum)\n\nSchleswig-Holstein Amtsgericht Kiel HRB 24843\nRegisterbekanntmachung nach dem Umwandlungsgesetz 17.04.2025 (Eintragungsdatum)\n\nHT Ahlers Verwaltungs GmbH\nGesellschaft mit beschränkter Haftung\nSeedorf-Hornsmühlen\n\nZu Eintragungsnummer 2 vom 17.04.2025 wird als nicht eingetragen veröffentlicht:  Den Gläubigern der an der Verschmelzung beteiligten Rechtsträger ist, wenn sie binnen sechs Monaten nach dem Tag, an dem die Eintragung der Verschmelzung in das Register des Sitzes desjenigen Rechtsträgers, dessen Gläubiger sie sind, nach § 19 Abs. 3 UmwG bekannt gemacht worden ist, ihren Anspruch nach Grund und Höhe schriftlich anmelden, Sicherheit zu leisten, soweit sie nicht Befriedigung verlangen können. Dieses Recht steht den Gläubigern jedoch nur zu, wenn sie glaubhaft machen, dass durch die Verschmelzung die Erfüllung ihrer Forderung gefährdet wird."
    },
    {
      "date": "2025-04-22",
      "id": "106997",
      "original_text": "Registerbekanntmachung nach dem Umwandlungsgesetz\nBerlin Amtsgericht Berlin (Charlottenburg) HRB 195366\nA&R Hand in Hand gUG (haftungsbeschränkt) – Berlin",
      "type": "Registerbekanntmachung nach dem Umwandlungsgesetz",
      "state": "Berlin",
      "amtsgericht": "Amtsgericht Berlin (Charlottenburg)",
      "registernummer": "HRB 195366",
      "registerart": "HRB",
      "company_name": "A&R Hand in Hand gUG (haftungsbeschränkt)",
      "company_seat": "Berlin",
      "details": "22.04.2025 (Bekanntmachungsdatum)\n\nBerlin Amtsgericht Berlin (Charlottenburg) HRB 195366\nRegisterbekanntmachung nach dem Umwandlungsgesetz 17.04.2025 (Eintragungsdatum)\n\nA&R Hand in Hand gUG (haftungsbeschränkt)\nGesellschaft mit beschränkter Haftung\nBerlin\n\nZu Eintragungsnummer 3 vom 17.04.2025 wird als nicht eingetragen veröffentlicht: Den Gläubigern der an der Verschmelzung beteiligten Rechtsträger ist, wenn sie binnen sechs Monaten nach dem Tag, an dem die Eintragung der Verschmelzung in das Register des Sitzes desjenigen Rechtsträgers, dessen Gläubiger sie sind, als bekannt gemacht gilt, ihren Anspruch nach Grund und Höhe schriftlich anmelden, Sicherheit zu leisten, soweit sie nicht Befriedigung verlangen können. Dieses Recht steht den Gläubigern jedoch nur zu, wenn sie glaubhaft machen, dass durch die Verschmelzung die Erfüllung ihrer Forderung gefährdet wird. Das Recht, Sicherheitsleistung zu verlangen, steht Gläubigern nicht zu, die im Falle der Insolvenz ein Recht auf vorzugsweise Befriedigung aus einer Deckungsmasse haben, die nach gesetzlicher Vorschrift zu ihrem Schutz errichtet und staatlich überwacht ist."
    },
    {
      "date": "2025-04-22",
      "id": "106998",
      "original_text": "Einreichung neuer Dokumente\nBaden-Württemberg Amtsgericht Stuttgart HRB 421001\nGambro Dialysatoren GmbH – Hechingen",
      "type": "Einreichung neuer Dokumente",
      "state": "Baden-Württemberg",
      "amtsgericht": "Amtsgericht Stuttgart",
      "registernummer": "HRB 421001",
      "registerart": "HRB",
      "company_name": "Gambro Dialysatoren GmbH",
      "company_seat": "Hechingen",
      "details": "22.04.2025 (Bekanntmachungsdatum)\n\nBaden-Württemberg Amtsgericht Stuttgart HRB 421001\nEinreichung neuer Dokumente\n\nGambro Dialysatoren GmbH\nGesellschaft mit beschränkter Haftung\nHechingen\n\nDie Gesellschaft hat am 31.03.2025 die Liste über die Zusammensetzung des Aufsichtsrats zum Handelsregister eingereicht."
    },
    {
      "date": "2025-04-22",
      "id": "106999",
      "original_text": "Registerbekanntmachung nach dem Umwandlungsgesetz\nBaden-Württemberg Amtsgericht Freiburg HRB 705733\nSCHNEEWEISS interior GmbH – Kippenheim",
      "type": "Registerbekanntmachung nach dem Umwandlungsgesetz",
      "state": "Baden-Württemberg",
      "amtsgericht": "Amtsgericht Freiburg",
      "registernummer": "HRB 705733",
      "registerart": "HRB",
      "company_name": "SCHNEEWEISS interior GmbH",
      "company_seat": "Kippenheim",
      "details": "22.04.2025 (Bekanntmachungsdatum)\n\nBaden-Württemberg Amtsgericht Freiburg HRB 705733\nRegisterbekanntmachung nach dem Umwandlungsgesetz 22.04.2025 (Eintragungsdatum)\n\nSCHNEEWEISS interior GmbH\nGesellschaft mit beschränkter Haftung\nKippenheim\n\nDen Gläubigern der an der Verschmelzung beteiligten Rechtsträger ist, wenn sie binnen sechs Monaten nach dem Tag, an dem die Eintragung der Verschmelzung in das Register des Sitzes desjenigen Rechtsträgers, dessen Gläubiger sie sind, nach § 19 Abs. 3 UmwG als bekanntgemacht gilt, ihren Anspruch nach Grund und Höhe schriftlich anmelden, Sicherheit zu leisten, soweit sie nicht Befriedigung verlangen können. Dieses Recht steht den Gläubigern jedoch nur zu, wenn sie glaubhaft machen, dass durch die Verschmelzung die Erfüllung ihrer Forderung gefährdet wird."
    },
    {
      "date": "2025-04-22",
      "id": "107000",
      "original_text": "Löschungsankündigung\nBerlin Amtsgericht Berlin (Charlottenburg) HRB 138307\nRalf Grzesiek SHK GmbH – Berlin",
      "type": "Löschungsankündigung",
      "state": "Berlin",
      "amtsgericht": "Amtsgericht Berlin (Charlottenburg)",
      "registernummer": "HRB 138307",
      "registerart": "HRB",
      "company_name": "Ralf Grzesiek SHK GmbH",
      "company_seat": "Berlin",
      "details": "22.04.2025 (Bekanntmachungsdatum)\n\nBerlin Amtsgericht Berlin (Charlottenburg) HRB 138307\nLöschungsankündigung\n\nRalf Grzesiek SHK GmbH\nGesellschaft mit beschränkter Haftung\nBerlin\n\nBei der nachstehenden Gesellschaft wird das Amtslöschungsverfahren gemäß § 394 FamFG eingeleitet. Widerspruchsfrist 6 Wochen"
    },
    {
      "date": "2025-04-22",
      "id": "107001",
      "original_text": "Registerbekanntmachung nach dem Umwandlungsgesetz\nHamburg Amtsgericht Hamburg PR 312\nKöchling & Krahnefeld Rechtsanwälte Partnerschaft mbB – Hamburg",
      "type": "Registerbekanntmachung nach dem Umwandlungsgesetz",
      "state": "Hamburg",
      "amtsgericht": "Amtsgericht Hamburg",
      "registernummer": "PR 312",
      "registerart": "PR",
      "company_name": "Köchling & Krahnefeld Rechtsanwälte Partnerschaft mbB",
      "company_seat": "Hamburg",
      "details": "22.04.2025 (Bekanntmachungsdatum)\n\nHamburg Amtsgericht Hamburg PR 312\nRegisterbekanntmachung nach dem Umwandlungsgesetz 22.04.2025 (Eintragungsdatum)\n\nKöchling & Krahnefeld Rechtsanwälte Partnerschaft mbB\nPartnerschaft\nHamburg\n\nAls nicht eingetragen wird bekannt gemacht:\nDen Gläubigern der an der Verschmelzung beteiligten Gesellschaften ist, wenn sie binnen sechs Monaten nach dem Tag, an dem die Eintragung der Verschmelzung in das Register des Sitzes desjenigen Rechtsträgers, dessen Gläubiger sie sind, nach § 19 Absatz 3 UmwG als bekannt gemacht gilt, ihren Anspruch nach Grund und Höhe schriftlich anmelden, Sicherheit zu leisten, soweit sie nicht Befriedigung verlangen können. Dieses Recht steht den Gläubigern jedoch nur zu, wenn sie glaubhaft machen, dass durch die Verschmelzung die Erfüllung ihrer Forderung gefährdet wird."
    },
    {
      "date": "2025-04-22",
      "id": "107002",
      "original_text": "Registerbekanntmachung nach dem Umwandlungsgesetz\nHamburg Amtsgericht Hamburg PR 433\nBRL BOEGE ROHDE LUEBBEHUESEN Partnerschaft von Rechtsanwälten, Wirtschaftsprüfern, Steuerberatern mbB – Hamburg",
      "type": "Registerbekanntmachung nach dem Umwandlungsgesetz",
      "state": "Hamburg",
      "amtsgericht": "Amtsgericht Hamburg",
      "registernummer": "PR 433",
      "registerart": "PR",
      "company_name": "BRL BOEGE ROHDE LUEBBEHUESEN Partnerschaft von Rechtsanwälten, Wirtschaftsprüfern, Steuerberatern mbB",
      "company_seat": "Hamburg",
      "details": "22.04.2025 (Bekanntmachungsdatum)\n\nHamburg Amtsgericht Hamburg PR 433\nRegisterbekanntmachung nach dem Umwandlungsgesetz 22.04.2025 (Eintragungsdatum)\n\nBRL BOEGE ROHDE LUEBBEHUESEN Partnerschaft von Rechtsanwälten, Wirtschaftsprüfern, Steuerberatern mbB\nPartnerschaft\nHamburg\n\nAls nicht eingetragen wird bekannt gemacht:\nDen Gläubigern der an der Verschmelzung beteiligten Gesellschaften ist, wenn sie binnen sechs Monaten nach dem Tag, an dem die Eintragung der Verschmelzung in das Register des Sitzes desjenigen Rechtsträgers, dessen Gläubiger sie sind, nach § 19 Absatz 3 UmwG als bekannt gemacht gilt, ihren Anspruch nach Grund und Höhe schriftlich anmelden, Sicherheit zu leisten, soweit sie nicht Befriedigung verlangen können. Dieses Recht steht den Gläubigern jedoch nur zu, wenn sie glaubhaft machen, dass durch die Verschmelzung die Erfüllung ihrer Forderung gefährdet wird."
    },
    {
      "date": "2025-04-22",
      "id": "107003",
      "original_text": "Registerbekanntmachung nach dem Umwandlungsgesetz\nBaden-Württemberg Amtsgericht Freiburg HRB 711237\nrosconi GmbH – Kippenheim",
      "type": "Registerbekanntmachung nach dem Umwandlungsgesetz",
      "state": "Baden-Württemberg",
      "amtsgericht": "Amtsgericht Freiburg",
      "registernummer": "HRB 711237",
      "registerart": "HRB",
      "company_name": "rosconi GmbH",
      "company_seat": "Kippenheim",
      "details": "22.04.2025 (Bekanntmachungsdatum)\n\nBaden-Württemberg Amtsgericht Freiburg HRB 711237\nRegisterbekanntmachung nach dem Umwandlungsgesetz 22.04.2025 (Eintragungsdatum)\n\nrosconi GmbH\nGesellschaft mit beschränkter Haftung\nKippenheim\n\nDen Gläubigern der an der Verschmelzung beteiligten Rechtsträger ist, wenn sie binnen sechs Monaten nach dem Tag, an dem die Eintragung der Verschmelzung in das Register des Sitzes desjenigen Rechtsträgers, dessen Gläubiger sie sind, nach § 19 Abs. 3 UmwG als bekanntgemacht gilt, ihren Anspruch nach Grund und Höhe schriftlich anmelden, Sicherheit zu leisten, soweit sie nicht Befriedigung verlangen können. Dieses Recht steht den Gläubigern jedoch nur zu, wenn sie glaubhaft machen, dass durch die Verschmelzung die Erfüllung ihrer Forderung gefährdet wird."
    },
    {
      "date": "2025-04-22",
      "id": "107004",
      "original_text": "Einreichung neuer Dokumente\nBaden-Württemberg Amtsgericht Freiburg HRB 310017\nKur und Bäder GmbH Bad Krozingen – Bad Krozingen",
      "type": "Einreichung neuer Dokumente",
      "state": "Baden-Württemberg",
      "amtsgericht": "Amtsgericht Freiburg",
      "registernummer": "HRB 310017",
      "registerart": "HRB",
      "company_name": "Kur und Bäder GmbH Bad Krozingen",
      "company_seat": "Bad Krozingen",
      "details": "22.04.2025 (Bekanntmachungsdatum)\n\nBaden-Württemberg Amtsgericht Freiburg HRB 310017\nEinreichung neuer Dokumente 22.04.2025 (Eintragungsdatum)\n\nKur und Bäder GmbH Bad Krozingen\nGesellschaft mit beschränkter Haftung\nBad Krozingen\n\nAls nicht eingetragen wird bekanntgemacht:\nDie Gesellschaft hat am 16.04.2025 die Liste über die Zusammensetzung des Aufsichtsrats zum Handelsregister eingereicht."
    },
    {
      "date": "2025-04-22",
      "id": "107005",
      "original_text": "Einreichung neuer Dokumente\nBaden-Württemberg Amtsgericht Stuttgart HRB 779714\nEKONAMI SE – Irndorf",
      "type": "Einreichung neuer Dokumente",
      "state": "Baden-Württemberg",
      "amtsgericht": "Amtsgericht Stuttgart",
      "registernummer": "HRB 779714",
      "registerart": "HRB",
      "company_name": "EKONAMI SE",
      "company_seat": "Irndorf",
      "details": "22.04.2025 (Bekanntmachungsdatum)\n\nBaden-Württemberg Amtsgericht Stuttgart HRB 779714\nEinreichung neuer Dokumente\n\nEKONAMI SE\nEuropäische Aktiengesellschaft (SE)\nIrndorf\n\nDie Gesellschaft hat am 16.04.2025 die Liste über die Zusammensetzung des Aufsichtsrats zum Handelsregister eingereicht."
    },
    {
      "date": "2025-04-22",
      "id": "107006",
      "original_text": "Löschungsankündigung\nThüringen Amtsgericht Jena HRB 507449\nEUROPEYARN GmbH – Leinefelde-Worbis",
      "type": "Löschungsankündigung",
      "state": "Thüringen",
      "amtsgericht": "Amtsgericht Jena",
      "registernummer": "HRB 507449",
      "registerart": "HRB",
      "company_name": "EUROPEYARN GmbH",
      "company_seat": "Leinefelde-Worbis",
      "details": "22.04.2025 (Bekanntmachungsdatum)\n\nThüringen Amtsgericht Jena HRB 507449\nLöschungsankündigung\n\nEUROPEYARN GmbH\nGesellschaft mit beschränkter Haftung\nLeinefelde-Worbis\n\nDas Registergericht beabsichtigt, die im Handelsregister eingetragene Gesellschaft wegen Vermögenslosigkeit nach § 394 FamFG von Amts wegen zu löschen. Die Frist zur Erhebung eines Widerspruchs gegen die beabsichtigte Löschung wird auf 6 Wochen festgesetzt."
    },
    {
      "date": "2025-04-22",
      "id": "107007",
      "original_text": "Einreichung neuer Dokumente\nSchleswig-Holstein Amtsgericht Pinneberg HRB 901 ME\nAbwasserentsorgung Brunsbüttel GmbH (ABG) – Brunsbüttel",
      "type": "Einreichung neuer Dokumente",
      "state": "Schleswig-Holstein",
      "amtsgericht": "Amtsgericht Pinneberg",
      "registernummer": "HRB 901 ME",
      "registerart": "HRB",
      "company_name": "Abwasserentsorgung Brunsbüttel GmbH (ABG)",
      "company_seat": "Brunsbüttel",
      "details": "22.04.2025 (Bekanntmachungsdatum)\n\nSchleswig-Holstein Amtsgericht Pinneberg HRB 901 ME\nEinreichung neuer Dokumente\n\nAbwasserentsorgung Brunsbüttel GmbH (ABG)\nGesellschaft mit beschränkter Haftung\nBrunsbüttel\n\nAls nicht eingetragen wird veröffentlicht: Eine Liste der Aufsichtsratsmitglieder wurde zum Handelsregister eingereicht."
    },
    {
      "date": "2025-04-22",
      "id": "107008",
      "original_text": "Löschungsankündigung\nHamburg Amtsgericht Hamburg HRB 122510\nAbnorma-Stahl Produktionsgesellschaft mbH – Hamburg",
      "type": "Löschungsankündigung",
      "state": "Hamburg",
      "amtsgericht": "Amtsgericht Hamburg",
      "registernummer": "HRB 122510",
      "registerart": "HRB",
      "company_name": "Abnorma-Stahl Produktionsgesellschaft mbH",
      "company_seat": "Hamburg",
      "details": "22.04.2025 (Bekanntmachungsdatum)\n\nHamburg Amtsgericht Hamburg HRB 122510\nLöschungsankündigung\n\nAbnorma-Stahl Produktionsgesellschaft mbH\nGesellschaft mit beschränkter Haftung\nHamburg\n\nDas Registergericht beabsichtigt, die im Handelsregister eingetragene Gesellschaft von Amts wegen nach § 394 FamFG zu löschen. Die Frist zur Erhebung eines Widerspruchs gegen die beabsichtigte Löschung wird auf 3 Monate festgesetzt."
    },
    {
      "date": "2025-04-22",
      "id": "107009",
      "original_text": "Löschungsankündigung\nHamburg Amtsgericht Hamburg HRB 161161\nSNS Energy GmbH – Hamburg",
      "type": "Löschungsankündigung",
      "state": "Hamburg",
      "amtsgericht": "Amtsgericht Hamburg",
      "registernummer": "HRB 161161",
      "registerart": "HRB",
      "company_name": "SNS Energy GmbH",
      "company_seat": "Hamburg",
      "details": "22.04.2025 (Bekanntmachungsdatum)\n\nHamburg Amtsgericht Hamburg HRB 161161\nLöschungsankündigung\n\nSNS Energy GmbH\nGesellschaft mit beschränkter Haftung\nHamburg\n\nDas Registergericht beabsichtigt, die im Handelsregister eingetragene Gesellschaft von Amts wegen nach § 394 FamFG zu löschen. Die Frist zur Erhebung eines Widerspruchs gegen die beabsichtigte Löschung wird auf 3 Monate festgesetzt."
    },
    {
      "date": "2025-04-22",
      "id": "107010",
      "original_text": "Löschungsankündigung\nHamburg Amtsgericht Hamburg HRB 173831\nDRE DIANA Real Estate GmbH – Hamburg",
      "type": "Löschungsankündigung",
      "state": "Hamburg",
      "amtsgericht": "Amtsgericht Hamburg",
      "registernummer": "HRB 173831",
      "registerart": "HRB",
      "company_name": "DRE DIANA Real Estate GmbH",
      "company_seat": "Hamburg",
      "details": "22.04.2025 (Bekanntmachungsdatum)\n\nHamburg Amtsgericht Hamburg HRB 173831\nLöschungsankündigung\n\nDRE DIANA Real Estate GmbH\nGesellschaft mit beschränkter Haftung\nHamburg\n\nDas Registergericht beabsichtigt, die im Handelsregister eingetragene Gesellschaft von Amts wegen nach § 394 FamFG zu löschen. Die Frist zur Erhebung eines Widerspruchs gegen die beabsichtigte Löschung wird auf 3 Monate festgesetzt."
    },
    {
      "date": "2025-04-22",
      "id": "107011",
      "original_text": "Löschungsankündigung\nHamburg Amtsgericht Hamburg HRB 179003\nMW Performance GmbH – Hamburg",
      "type": "Löschungsankündigung",
      "state": "Hamburg",
      "amtsgericht": "Amtsgericht Hamburg",
      "registernummer": "HRB 179003",
      "registerart": "HRB",
      "company_name": "MW Performance GmbH",
      "company_seat": "Hamburg",
      "details": "22.04.2025 (Bekanntmachungsdatum)\n\nHamburg Amtsgericht Hamburg HRB 179003\nLöschungsankündigung\n\nMW Performance GmbH\nGesellschaft mit beschränkter Haftung\nHamburg\n\nDas Registergericht beabsichtigt, die im Handelsregister eingetragene Gesellschaft von Amts wegen nach § 394 FamFG zu löschen. Die Frist zur Erhebung eines Widerspruchs gegen die beabsichtigte Löschung wird auf 3 Monate festgesetzt."
    },
    {
      "date": "2025-04-22",
      "id": "107012",
      "original_text": "Löschungsankündigung\nHamburg Amtsgericht Hamburg HRB 143027\ndeificus Art UG (haftungsbeschränkt) – Hamburg",
      "type": "Löschungsankündigung",
      "state": "Hamburg",
      "amtsgericht": "Amtsgericht Hamburg",
      "registernummer": "HRB 143027",
      "registerart": "HRB",
      "company_name": "deificus Art UG (haftungsbeschränkt)",
      "company_seat": "Hamburg",
      "details": "22.04.2025 (Bekanntmachungsdatum)\n\nHamburg Amtsgericht Hamburg HRB 143027\nLöschungsankündigung\n\ndeificus Art UG (haftungsbeschränkt)\nGesellschaft mit beschränkter Haftung\nHamburg\n\nDas Registergericht beabsichtigt, die im Handelsregister eingetragene Gesellschaft von Amts wegen nach § 394 FamFG zu löschen. Die Frist zur Erhebung eines Widerspruchs gegen die beabsichtigte Löschung wird auf 3 Monate festgesetzt."
    },
    {
      "date": "2025-04-22",
      "id": "107013",
      "original_text": "Löschungsankündigung\nHamburg Amtsgericht Hamburg HRB 163716\nZaki & Partner Bauservice GmbH – Hamburg",
      "type": "Löschungsankündigung",
      "state": "Hamburg",
      "amtsgericht": "Amtsgericht Hamburg",
      "registernummer": "HRB 163716",
      "registerart": "HRB",
      "company_name": "Zaki & Partner Bauservice GmbH",
      "company_seat": "Hamburg",
      "details": "22.04.2025 (Bekanntmachungsdatum)\n\nHamburg Amtsgericht Hamburg HRB 163716\nLöschungsankündigung\n\nZaki & Partner Bauservice GmbH\nGesellschaft mit beschränkter Haftung\nHamburg\n\nDas Registergericht beabsichtigt, die im Handelsregister eingetragene Gesellschaft von Amts wegen nach § 394 FamFG zu löschen. Die Frist zur Erhebung eines Widerspruchs gegen die beabsichtigte Löschung wird auf 3 Monate festgesetzt."
    },
    {
      "date": "2025-04-22",
      "id": "107014",
      "original_text": "Löschungsankündigung\nHamburg Amtsgericht Hamburg HRB 178179\nIgnaqus GmbH – Hamburg",
      "type": "Löschungsankündigung",
      "state": "Hamburg",
      "amtsgericht": "Amtsgericht Hamburg",
      "registernummer": "HRB 178179",
      "registerart": "HRB",
      "company_name": "Ignaqus GmbH",
      "company_seat": "Hamburg",
      "details": "22.04.2025 (Bekanntmachungsdatum)\n\nHamburg Amtsgericht Hamburg HRB 178179\nLöschungsankündigung\n\nIgnaqus GmbH\nGesellschaft mit beschränkter Haftung\nHamburg\n\nDas Registergericht beabsichtigt, die im Handelsregister eingetragene Gesellschaft von Amts wegen nach § 394 FamFG zu löschen. Die Frist zur Erhebung eines Widerspruchs gegen die beabsichtigte Löschung wird auf 3 Monate festgesetzt."
    },
    {
      "date": "2025-04-22",
      "id": "107015",
      "original_text": "Löschungsankündigung\nHamburg Amtsgericht Hamburg HRB 179088\nDaKA Service GmbH – Hamburg",
      "type": "Löschungsankündigung",
      "state": "Hamburg",
      "amtsgericht": "Amtsgericht Hamburg",
      "registernummer": "HRB 179088",
      "registerart": "HRB",
      "company_name": "DaKA Service GmbH",
      "company_seat": "Hamburg",
      "details": "22.04.2025 (Bekanntmachungsdatum)\n\nHamburg Amtsgericht Hamburg HRB 179088\nLöschungsankündigung\n\nDaKA Service GmbH\nGesellschaft mit beschränkter Haftung\nHamburg\n\nDas Registergericht beabsichtigt, die im Handelsregister eingetragene Gesellschaft von Amts wegen nach § 394 FamFG zu löschen. Die Frist zur Erhebung eines Widerspruchs gegen die beabsichtigte Löschung wird auf 3 Monate festgesetzt."
    },
    {
      "date": "2025-04-22",
      "id": "107016",
      "original_text": "Löschungsankündigung\nHamburg Amtsgericht Hamburg HRB 184777\nDS-K Consulting GmbH – Hamburg",
      "type": "Löschungsankündigung",
      "state": "Hamburg",
      "amtsgericht": "Amtsgericht Hamburg",
      "registernummer": "HRB 184777",
      "registerart": "HRB",
      "company_name": "DS-K Consulting GmbH",
      "company_seat": "Hamburg",
      "details": "22.04.2025 (Bekanntmachungsdatum)\n\nHamburg Amtsgericht Hamburg HRB 184777\nLöschungsankündigung\n\nDS-K Consulting GmbH\nGesellschaft mit beschränkter Haftung\nHamburg\n\nDas Registergericht beabsichtigt, die im Handelsregister eingetragene Gesellschaft von Amts wegen nach § 394 FamFG zu löschen. Die Frist zur Erhebung eines Widerspruchs gegen die beabsichtigte Löschung wird auf 3 Monate festgesetzt."
    },
    {
      "date": "2025-04-22",
      "id": "107017",
      "original_text": "Löschungsankündigung\nHamburg Amtsgericht Hamburg HRB 181289\nF-P Gastronomie GmbH – Hamburg",
      "type": "Löschungsankündigung",
      "state": "Hamburg",
      "amtsgericht": "Amtsgericht Hamburg",
      "registernummer": "HRB 181289",
      "registerart": "HRB",
      "company_name": "F-P Gastronomie GmbH",
      "company_seat": "Hamburg",
      "details": "22.04.2025 (Bekanntmachungsdatum)\n\nHamburg Amtsgericht Hamburg HRB 181289\nLöschungsankündigung\n\nF-P Gastronomie GmbH\nGesellschaft mit beschränkter Haftung\nHamburg\n\nDas Registergericht beabsichtigt, die im Handelsregister eingetragene Gesellschaft von Amts wegen nach § 394 FamFG zu löschen. Die Frist zur Erhebung eines Widerspruchs gegen die beabsichtigte Löschung wird auf 3 Monate festgesetzt."
    },
    {
      "date": "2025-04-22",
      "id": "107018",
      "original_text": "Löschungsankündigung\nHamburg Amtsgericht Hamburg HRB 180308\nWuGos GmbH – Hamburg",
      "type": "Löschungsankündigung",
      "state": "Hamburg",
      "amtsgericht": "Amtsgericht Hamburg",
      "registernummer": "HRB 180308",
      "registerart": "HRB",
      "company_name": "WuGos GmbH",
      "company_seat": "Hamburg",
      "details": "22.04.2025 (Bekanntmachungsdatum)\n\nHamburg Amtsgericht Hamburg HRB 180308\nLöschungsankündigung\n\nWuGos GmbH\nGesellschaft mit beschränkter Haftung\nHamburg\n\nDas Registergericht beabsichtigt, die im Handelsregister eingetragene Gesellschaft von Amts wegen nach § 394 FamFG zu löschen. Die Frist zur Erhebung eines Widerspruchs gegen die beabsichtigte Löschung wird auf 3 Monate festgesetzt."
    },
    {
      "date": "2025-04-22",
      "id": "107019",
      "original_text": "Einreichung neuer Dokumente\nBrandenburg Amtsgericht Cottbus HRB 1925\nASG Spremberg GmbH – Spremberg",
      "type": "Einreichung neuer Dokumente",
      "state": "Brandenburg",
      "amtsgericht": "Amtsgericht Cottbus",
      "registernummer": "HRB 1925",
      "registerart": "HRB",
      "company_name": "ASG Spremberg GmbH",
      "company_seat": "Spremberg",
      "details": "22.04.2025 (Bekanntmachungsdatum)\n\nBrandenburg Amtsgericht Cottbus HRB 1925\nEinreichung neuer Dokumente\n\nASG Spremberg GmbH\nGesellschaft mit beschränkter Haftung\nSpremberg\n\nAls nicht eingetragen wird veröffentlicht:\nDie aktuelle Liste der Aufsichtsratsmitglieder wurde zum Handelsregister gem. § 52 Abs. 3 GmbHG eingereicht."
    },
    {
      "date": "2025-04-22",
      "id": "107020",
      "original_text": "Löschungsankündigung\nBaden-Württemberg Amtsgericht Freiburg HRB 725805\nD.M Impress GmbH – Jestetten",
      "type": "Löschungsankündigung",
      "state": "Baden-Württemberg",
      "amtsgericht": "Amtsgericht Freiburg",
      "registernummer": "HRB 725805",
      "registerart": "HRB",
      "company_name": "D.M Impress GmbH",
      "company_seat": "Jestetten",
      "details": "22.04.2025 (Bekanntmachungsdatum)\n\nBaden-Württemberg Amtsgericht Freiburg HRB 725805\nLöschungsankündigung\n\nD.M Impress GmbH\nGesellschaft mit beschränkter Haftung\nJestetten\n\nAls nicht eingetragen wird bekanntgemacht:\nDas Gericht beabsichtigt, die Gesellschaft wegen Vermögenslosigkeit im Handelsregister von Amts wegen nach § 394 FamFG zu löschen. Die Frist zur Geltendmachung eines Widerspruchs gegen die beabsichtigte Löschung ist auf einen Monat ab Veröffentlichung bestimmt."
    },
    {
      "date": "2025-04-22",
      "id": "107021",
      "original_text": "Registerbekanntmachung nach dem Umwandlungsgesetz\nBerlin Amtsgericht Berlin (Charlottenburg) HRA 62225\nMolnár-Institute for applied chromatography, Dr. Imre Molnár e.K. – Berlin",
      "type": "Registerbekanntmachung nach dem Umwandlungsgesetz",
      "state": "Berlin",
      "amtsgericht": "Amtsgericht Berlin (Charlottenburg)",
      "registernummer": "HRA 62225",
      "registerart": "HRA",
      "company_name": "Molnár-Institute for applied chromatography, Dr. Imre Molnár e.K.",
      "company_seat": "Berlin",
      "details": "22.04.2025 (Bekanntmachungsdatum)\n\nBerlin Amtsgericht Berlin (Charlottenburg) HRA 62225\nRegisterbekanntmachung nach dem Umwandlungsgesetz 17.04.2025 (Eintragungsdatum)\n\nMolnár-Institute for applied chromatography, Dr. Imre Molnár e.K.\nEinzelkaufmann / Einzelkauffrau\nBerlin\n\nZu Eintragungsnummer 2 vom 17.04.2025 wird als nicht eingetragen veröffentlicht: Den Gläubigern der an der Spaltung beteiligten Rechtsträger ist, wenn sie binnen sechs Monaten nach dem Tag, an dem die Eintragung der Spaltung in das Register des Sitzes desjenigen Rechtsträgers, dessen Gläubiger sie sind, als bekannt gemacht gilt, ihren Anspruch nach Grund und Höhe schriftlich anmelden, Sicherheit zu leisten, soweit sie nicht Befriedigung verlangen können. Dieses Recht steht den Gläubigern jedoch nur zu, wenn sie glaubhaft machen, dass durch die Spaltung die Erfüllung ihrer Forderung gefährdet wird. Das Recht, Sicherheitsleistung zu verlangen, steht Gläubigern nicht zu, die im Falle der Insolvenz ein Recht auf vorzugsweise Befriedigung aus einer Deckungsmasse haben, die nach gesetzlicher Vorschrift zu ihrem Schutz errichtet und staatlich überwacht ist."
    },
    {
      "date": "2025-04-22",
      "id": "107022",
      "original_text": "Registerbekanntmachung nach dem Umwandlungsgesetz\nBerlin Amtsgericht Berlin (Charlottenburg) HRA 63715\nMolnár-Institute for applied chromatography GmbH & Co. KG – Berlin",
      "type": "Registerbekanntmachung nach dem Umwandlungsgesetz",
      "state": "Berlin",
      "amtsgericht": "Amtsgericht Berlin (Charlottenburg)",
      "registernummer": "HRA 63715",
      "registerart": "HRA",
      "company_name": "Molnár-Institute for applied chromatography GmbH & Co. KG",
      "company_seat": "Berlin",
      "details": "22.04.2025 (Bekanntmachungsdatum)\n\nBerlin Amtsgericht Berlin (Charlottenburg) HRA 63715\nRegisterbekanntmachung nach dem Umwandlungsgesetz 17.04.2025 (Eintragungsdatum)\n\nMolnár-Institute for applied chromatography GmbH & Co. KG\nKommanditgesellschaft\nBerlin\n\nZu Eintragungsnummer 3 vom 17.04.2025 wird als nicht eingetragen veröffentlicht: Den Gläubigern der an der Spaltung beteiligten Rechtsträger ist, wenn sie binnen sechs Monaten nach dem Tag, an dem die Eintragung der Spaltung in das Register des Sitzes desjenigen Rechtsträgers, dessen Gläubiger sie sind, als bekannt gemacht gilt, ihren Anspruch nach Grund und Höhe schriftlich anmelden, Sicherheit zu leisten, soweit sie nicht Befriedigung verlangen können. Dieses Recht steht den Gläubigern jedoch nur zu, wenn sie glaubhaft machen, dass durch die Spaltung die Erfüllung ihrer Forderung gefährdet wird. Das Recht, Sicherheitsleistung zu verlangen, steht Gläubigern nicht zu, die im Falle der Insolvenz ein Recht auf vorzugsweise Befriedigung aus einer Deckungsmasse haben, die nach gesetzlicher Vorschrift zu ihrem Schutz errichtet und staatlich überwacht ist."
    },
    {
      "date": "2025-04-22",
      "id": "107023",
      "original_text": "Einreichung neuer Dokumente\nBaden-Württemberg Amtsgericht Mannheim HRB 104238\ndm-drogerie markt Verwaltungs-GmbH – Karlsruhe",
      "type": "Einreichung neuer Dokumente",
      "state": "Baden-Württemberg",
      "amtsgericht": "Amtsgericht Mannheim",
      "registernummer": "HRB 104238",
      "registerart": "HRB",
      "company_name": "dm-drogerie markt Verwaltungs-GmbH",
      "company_seat": "Karlsruhe",
      "details": "22.04.2025 (Bekanntmachungsdatum)\n\nBaden-Württemberg Amtsgericht Mannheim HRB 104238\nEinreichung neuer Dokumente 22.04.2025 (Eintragungsdatum)\n\ndm-drogerie markt Verwaltungs-GmbH\nGesellschaft mit beschränkter Haftung\nKarlsruhe\n\nDie Gesellschaft hat am 14.04.2025 die Liste über die Zusammensetzung des Aufsichtsrats zum Handelsregister eingereicht."
    },
    {
      "date": "2025-04-22",
      "id": "107024",
      "original_text": "Löschungsankündigung\nHamburg Amtsgericht Hamburg HRB 162503\nTV Bau & Transport GmbH – Hamburg",
      "type": "Löschungsankündigung",
      "state": "Hamburg",
      "amtsgericht": "Amtsgericht Hamburg",
      "registernummer": "HRB 162503",
      "registerart": "HRB",
      "company_name": "TV Bau & Transport GmbH",
      "company_seat": "Hamburg",
      "details": "22.04.2025 (Bekanntmachungsdatum)\n\nHamburg Amtsgericht Hamburg HRB 162503\nLöschungsankündigung\n\nTV Bau & Transport GmbH\nGesellschaft mit beschränkter Haftung\nHamburg\n\nDas Registergericht beabsichtigt, die im Handelsregister eingetragene Gesellschaft von Amts wegen nach § 394 FamFG zu löschen. Die Frist zur Erhebung eines Widerspruchs gegen die beabsichtigte Löschung wird auf 3 Monate festgesetzt."
    },
    {
      "date": "2025-04-22",
      "id": "107025",
      "original_text": "Löschungsankündigung\nHamburg Amtsgericht Hamburg HRB 162787\nMEAS Hansa GmbH – Hamburg",
      "type": "Löschungsankündigung",
      "state": "Hamburg",
      "amtsgericht": "Amtsgericht Hamburg",
      "registernummer": "HRB 162787",
      "registerart": "HRB",
      "company_name": "MEAS Hansa GmbH",
      "company_seat": "Hamburg",
      "details": "22.04.2025 (Bekanntmachungsdatum)\n\nHamburg Amtsgericht Hamburg HRB 162787\nLöschungsankündigung\n\nMEAS Hansa GmbH\nGesellschaft mit beschränkter Haftung\nHamburg\n\nDas Registergericht beabsichtigt, die im Handelsregister eingetragene Gesellschaft von Amts wegen nach § 394 FamFG zu löschen. Die Frist zur Erhebung eines Widerspruchs gegen die beabsichtigte Löschung wird auf 3 Monate festgesetzt."
    },
    {
      "date": "2025-04-22",
      "id": "107026",
      "original_text": "Löschungsankündigung\nHamburg Amtsgericht Hamburg HRB 183483\nOx&Rye Brechler.Sauer UG (haftungsbeschränkt) – Hamburg",
      "type": "Löschungsankündigung",
      "state": "Hamburg",
      "amtsgericht": "Amtsgericht Hamburg",
      "registernummer": "HRB 183483",
      "registerart": "HRB",
      "company_name": "Ox&Rye Brechler.Sauer UG (haftungsbeschränkt)",
      "company_seat": "Hamburg",
      "details": "22.04.2025 (Bekanntmachungsdatum)\n\nHamburg Amtsgericht Hamburg HRB 183483\nLöschungsankündigung\n\nOx&Rye Brechler.Sauer UG (haftungsbeschränkt)\nGesellschaft mit beschränkter Haftung\nHamburg\n\nDas Registergericht beabsichtigt, die im Handelsregister eingetragene Gesellschaft von Amts wegen nach § 394 FamFG zu löschen. Die Frist zur Erhebung eines Widerspruchs gegen die beabsichtigte Löschung wird auf 3 Monate festgesetzt."
    },
    {
      "date": "2025-04-22",
      "id": "107027",
      "original_text": "Löschungsankündigung\nHamburg Amtsgericht Hamburg HRB 164086\nNWCrew GmbH – Hamburg",
      "type": "Löschungsankündigung",
      "state": "Hamburg",
      "amtsgericht": "Amtsgericht Hamburg",
      "registernummer": "HRB 164086",
      "registerart": "HRB",
      "company_name": "NWCrew GmbH",
      "company_seat": "Hamburg",
      "details": "22.04.2025 (Bekanntmachungsdatum)\n\nHamburg Amtsgericht Hamburg HRB 164086\nLöschungsankündigung\n\nNWCrew GmbH\nGesellschaft mit beschränkter Haftung\nHamburg\n\nNach Mitteilung des Bezirksamtes Harburg wurde Stanimir Simeonov durch Bescheid vom 10.09.2024, bestandskräftig seit dem 09.01.2025 (Gesch.Nr. H/VS 41), der Betrieb eines  Gewerbes \"Die Verwaltung eigenen Vermögens, Dienstleistungen im Bereich Sicherheit und Bewachung gemäß § 34 a GewO und § 6 Bewacherordnung, Übernahme einer Detektei und Auskunftei, usw.\" sowie jeden Gewerbes, für das § 35 Gewerbeordnung (GewO) gilt, sowie Ihnen auch die Tätigkeit als mit der Leitung eines Gewerbebetriebes und als Vertretungsberechtigter eines Gewerbetreibenden untersagt.\n\nGemäß § 6 Abs. 2 S. 2 Nr. 2 des Gesetzes betreffend die Gesellschaften mit beschränkter Haftung (GmbHG) können Sie infolgedessen kein Geschäftsführer der NWCrew GmbH mehr sein.\n\nDie Eintragung des Stanimir Simeonov als Geschäftsführer ist damit wegen des Mangels einer wesentlichen Voraussetzung unzulässig geworden.\n\nDas Registergericht beabsichtigt daher, die Eintragung des Geschäftsführers gemäß § 395 des Gesetzes über das Verfahren in Familiensachen und in Angelegenheiten der freiwilligen Gerichtsbarkeit (FamFG) von Amts wegen aus dem Handelsregister zu löschen.\n\nGegen die beabsichtigte Löschung innerhalb eines Monats seit dieser Bekanntmachung Widerspruch beim\n\nAmtsgericht Hamburg - Registergericht -, Caffamacherreihe 20, 20355 Hamburg,\n\nschriftlich oder zur Niederschrift der Geschäftsstelle oder des Rechtspflegers einzulegen.\nDer Widerspruch kann auch zu Protokoll der Geschäftsstelle eines anderen Amtsgerichtes erfolgen. In diesem Falle ist die Frist nur dann gewahrt, wenn das den Widerspruch enthaltende Protokoll innerhalb der Frist bei dem Registergericht eingeht.\n\nSofern hier binnen der genannten Frist kein Widerspruch eingeht, wird das Gericht die genannte Eintragung von Amts wegen löschen."
    },
    {
      "date": "2025-04-22",
      "id": "107028",
      "original_text": "Registerbekanntmachung nach dem Umwandlungsgesetz\nBaden-Württemberg Amtsgericht Mannheim HRB 109578\nConsileon Business Consultancy GmbH – Karlsruhe",
      "type": "Registerbekanntmachung nach dem Umwandlungsgesetz",
      "state": "Baden-Württemberg",
      "amtsgericht": "Amtsgericht Mannheim",
      "registernummer": "HRB 109578",
      "registerart": "HRB",
      "company_name": "Consileon Business Consultancy GmbH",
      "company_seat": "Karlsruhe",
      "details": "22.04.2025 (Bekanntmachungsdatum)\n\nBaden-Württemberg Amtsgericht Mannheim HRB 109578\nRegisterbekanntmachung nach dem Umwandlungsgesetz 22.04.2025 (Eintragungsdatum)\n\nConsileon Business Consultancy GmbH\nGesellschaft mit beschränkter Haftung\nKarlsruhe\n\nAls nicht eingetragen wird bekanntgemacht: Den Gläubigern der an der Verschmelzung beteiligten Rechtsträger ist, wenn sie binnen sechs Monaten nach dem Tag, an dem die Eintragung der Verschmelzung in das Register des Sitzes desjenigen Rechtsträgers, dessen Gläubiger sie sind, nach § 19 Abs. 3 UmwG als bekanntgemacht gilt, ihren Anspruch nach Grund und Höhe schriftlich anmelden, Sicherheit zu leisten, soweit sie nicht Befriedigung verlangen können. Dieses Recht steht den Gläubigern jedoch nur zu, wenn sie glaubhaft machen, dass durch die Verschmelzung die Erfüllung ihrer Forderung gefährdet wird."
    },
    {
      "date": "2025-04-22",
      "id": "107029",
      "original_text": "Registerbekanntmachung nach dem Umwandlungsgesetz\nBerlin Amtsgericht Berlin (Charlottenburg) HRA 63195\nGebrüder Michels GmbH & Co. KG – Berlin",
      "type": "Registerbekanntmachung nach dem Umwandlungsgesetz",
      "state": "Berlin",
      "amtsgericht": "Amtsgericht Berlin (Charlottenburg)",
      "registernummer": "HRA 63195",
      "registerart": "HRA",
      "company_name": "Gebrüder Michels GmbH & Co. KG",
      "company_seat": "Berlin",
      "details": "22.04.2025 (Bekanntmachungsdatum)\n\nBerlin Amtsgericht Berlin (Charlottenburg) HRA 63195\nRegisterbekanntmachung nach dem Umwandlungsgesetz 16.04.2025 (Eintragungsdatum)\n\nGebrüder Michels GmbH & Co. KG\nKommanditgesellschaft\nBerlin\n\nZu Eintragungsnummer 8 vom 16.04.2025 wird als nicht eingetragen veröffentlicht: Den Gläubigern der an der Verschmelzung beteiligten Rechtsträger ist, wenn sie binnen sechs Monaten nach dem Tag, an dem die Eintragung der Verschmelzung in das Register des Sitzes desjenigen Rechtsträgers, dessen Gläubiger sie sind, als bekannt gemacht gilt, ihren Anspruch nach Grund und Höhe schriftlich anmelden, Sicherheit zu leisten, soweit sie nicht Befriedigung verlangen können. Dieses Recht steht den Gläubigern jedoch nur zu, wenn sie glaubhaft machen, dass durch die Verschmelzung die Erfüllung ihrer Forderung gefährdet wird. Das Recht, Sicherheitsleistung zu verlangen, steht Gläubigern nicht zu, die im Falle der Insolvenz ein Recht auf vorzugsweise Befriedigung aus einer Deckungsmasse haben, die nach gesetzlicher Vorschrift zu ihrem Schutz errichtet und staatlich überwacht ist."
    },
    {
      "date": "2025-04-22",
      "id": "107030",
      "original_text": "Löschungsankündigung\nBaden-Württemberg Amtsgericht Stuttgart HRB 744269\nOneTech GmbH – Stuttgart",
      "type": "Löschungsankündigung",
      "state": "Baden-Württemberg",
      "amtsgericht": "Amtsgericht Stuttgart",
      "registernummer": "HRB 744269",
      "registerart": "HRB",
      "company_name": "OneTech GmbH",
      "company_seat": "Stuttgart",
      "details": "22.04.2025 (Bekanntmachungsdatum)\n\nBaden-Württemberg Amtsgericht Stuttgart HRB 744269\nLöschungsankündigung\n\nOneTech GmbH\nGesellschaft mit beschränkter Haftung\nStuttgart\n\nDas Gericht beabsichtigt, die Gesellschaft wegen Vermögenslosigkeit im Handelsregister von Amts wegen nach § 394 FamFG zu löschen. Die Frist zur Geltendmachung eines Widerspruchs gegen die beabsichtigte Löschung ist auf einen Monat ab Veröffentlichung bestimmt."
    },
    {
      "date": "2025-04-22",
      "id": "107031",
      "original_text": "Einreichung neuer Dokumente\nBrandenburg Amtsgericht Frankfurt/Oder HRB 16028\nB.S.D. Security & Services UG (haftungsbeschränkt) – Bernau bei Berlin",
      "type": "Einreichung neuer Dokumente",
      "state": "Brandenburg",
      "amtsgericht": "Amtsgericht Frankfurt/Oder",
      "registernummer": "HRB 16028",
      "registerart": "HRB",
      "company_name": "B.S.D. Security & Services UG (haftungsbeschränkt)",
      "company_seat": "Bernau bei Berlin",
      "details": "22.04.2025 (Bekanntmachungsdatum)\n\nBrandenburg Amtsgericht Frankfurt/Oder HRB 16028\nEinreichung neuer Dokumente\n\nB.S.D. Security & Services UG (haftungsbeschränkt)\nGesellschaft mit beschränkter Haftung\nBernau bei Berlin\n\nAls nicht eingetragen wird veröffentlicht: Der Insolvenzverwalter hat die Rückkehr zum satzungsmäßigen Geschäftsjahr angezeigt."
    },
    {
      "date": "2025-04-22",
      "id": "107032",
      "original_text": "Löschungsankündigung\nSachsen-Anhalt Amtsgericht Stendal HRA 31623\nWERTCYCLINA Wertstoffrecyclinganlage LEUNA GmbH & Co. KG Leuna – Leuna",
      "type": "Löschungsankündigung",
      "state": "Sachsen-Anhalt",
      "amtsgericht": "Amtsgericht Stendal",
      "registernummer": "HRA 31623",
      "registerart": "HRA",
      "company_name": "WERTCYCLINA Wertstoffrecyclinganlage LEUNA GmbH & Co. KG Leuna",
      "company_seat": "Leuna",
      "details": "22.04.2025 (Bekanntmachungsdatum)\n\nSachsen-Anhalt Amtsgericht Stendal HRA 31623\nLöschungsankündigung\n\nWERTCYCLINA Wertstoffrecyclinganlage LEUNA GmbH & Co. KG Leuna\nKommanditgesellschaft\nLeuna\n\nDas Registergericht beabsichtigt, nachfolgende im Handelregister eingetragenen Firmen von Amts wegen nach § 394 FamFG zu löschen. Die Frist zu Erhebung eines Widerspruchs wird auf drei Monate festgesetzt."
    },
    {
      "date": "2025-04-22",
      "id": "107033",
      "original_text": "Registerbekanntmachung nach dem Umwandlungsgesetz\nBerlin Amtsgericht Berlin (Charlottenburg) HRB 12127\nECONTEL Economy Hotel Verwaltungs-GmbH. – Berlin",
      "type": "Registerbekanntmachung nach dem Umwandlungsgesetz",
      "state": "Berlin",
      "amtsgericht": "Amtsgericht Berlin (Charlottenburg)",
      "registernummer": "HRB 12127",
      "registerart": "HRB",
      "company_name": "ECONTEL Economy Hotel Verwaltungs-GmbH.",
      "company_seat": "Berlin",
      "details": "22.04.2025 (Bekanntmachungsdatum)\n\nBerlin Amtsgericht Berlin (Charlottenburg) HRB 12127\nRegisterbekanntmachung nach dem Umwandlungsgesetz 17.04.2025 (Eintragungsdatum)\n\nECONTEL Economy Hotel Verwaltungs-GmbH.\nGesellschaft mit beschränkter Haftung\nBerlin\n\nZu Eintragungsnummer 11 vom 17.04.2025 wird als nicht eingetragen veröffentlicht: Den Gläubigern der an der Verschmelzung beteiligten Rechtsträger ist, wenn sie binnen sechs Monaten nach dem Tag, an dem die Eintragung der Verschmelzung in das Register des Sitzes desjenigen Rechtsträgers, dessen Gläubiger sie sind, als bekannt gemacht gilt, ihren Anspruch nach Grund und Höhe schriftlich anmelden, Sicherheit zu leisten, soweit sie nicht Befriedigung verlangen können. Dieses Recht steht den Gläubigern jedoch nur zu, wenn sie glaubhaft machen, dass durch die Verschmelzung die Erfüllung ihrer Forderung gefährdet wird. Das Recht, Sicherheitsleistung zu verlangen, steht Gläubigern nicht zu, die im Falle der Insolvenz ein Recht auf vorzugsweise Befriedigung aus einer Deckungsmasse haben, die nach gesetzlicher Vorschrift zu ihrem Schutz errichtet und staatlich überwacht ist."
    },
    {
      "date": "2025-04-22",
      "id": "107034",
      "original_text": "Registerbekanntmachung nach dem Umwandlungsgesetz\nBaden-Württemberg Amtsgericht Freiburg HRB 721702\nALDI Donaueschingen Verwaltungs-SE – Donaueschingen",
      "type": "Registerbekanntmachung nach dem Umwandlungsgesetz",
      "state": "Baden-Württemberg",
      "amtsgericht": "Amtsgericht Freiburg",
      "registernummer": "HRB 721702",
      "registerart": "HRB",
      "company_name": "ALDI Donaueschingen Verwaltungs-SE",
      "company_seat": "Donaueschingen",
      "details": "22.04.2025 (Bekanntmachungsdatum)\n\nBaden-Württemberg Amtsgericht Freiburg HRB 721702\nRegisterbekanntmachung nach dem Umwandlungsgesetz\n\nALDI Donaueschingen Verwaltungs-SE\nEuropäische Aktiengesellschaft (SE)\nDonaueschingen\n\nDie Gesellschaft hat am 17.04.2025 den Entwurf des Verschmelzungsvertrages zwischen \"ALDI Bingen Verwaltungs-SE\", Bingen am Rhein (Amtsgericht Amtsgericht Mainz HRB 50443) und der hiesigen Gesellschaft (übertragender Rechtsträger) zum Handelsregister eingereicht."
    },
    {
      "date": "2025-04-22",
      "id": "107035",
      "original_text": "Registerbekanntmachung nach dem Umwandlungsgesetz\nBaden-Württemberg Amtsgericht Freiburg HRB 621294\nAllTerra Deutschland West GmbH – Grafenhausen",
      "type": "Registerbekanntmachung nach dem Umwandlungsgesetz",
      "state": "Baden-Württemberg",
      "amtsgericht": "Amtsgericht Freiburg",
      "registernummer": "HRB 621294",
      "registerart": "HRB",
      "company_name": "AllTerra Deutschland West GmbH",
      "company_seat": "Grafenhausen",
      "details": "22.04.2025 (Bekanntmachungsdatum)\n\nBaden-Württemberg Amtsgericht Freiburg HRB 621294\nRegisterbekanntmachung nach dem Umwandlungsgesetz 22.04.2025 (Eintragungsdatum)\n\nAllTerra Deutschland West GmbH\nGesellschaft mit beschränkter Haftung\nGrafenhausen\n\nAls nicht eingetragen wird bekanntgemacht:\nDen Gläubigern der an der Verschmelzung beteiligten Rechtsträger ist, wenn sie binnen sechs Monaten nach dem Tag, an dem die Eintragung der Verschmelzung in das Register des Sitzes desjenigen Rechtsträgers, dessen Gläubiger sie sind, nach § 19 Abs. 3 UmwG als bekanntgemacht gilt, ihren Anspruch nach Grund und Höhe schriftlich anmelden, Sicherheit zu leisten, soweit sie nicht Befriedigung verlangen können. Dieses Recht steht den Gläubigern jedoch nur zu, wenn sie glaubhaft machen, dass durch die Verschmelzung die Erfüllung ihrer Forderung gefährdet wird."
    },
    {
      "date": "2025-04-22",
      "id": "107036",
      "original_text": "Registerbekanntmachung nach dem Umwandlungsgesetz\nMecklenburg-Vorpommern Amtsgericht Stralsund HRB 612 früher Amtsgericht Rostock\nHahn Nutzfahrzeuge GmbH – Kemnitz",
      "type": "Registerbekanntmachung nach dem Umwandlungsgesetz",
      "state": "Mecklenburg-Vorpommern",
      "amtsgericht": "Amtsgericht Stralsund",
      "registernummer": "HRB 612",
      "registerart": "HRB",
      "company_name": "Hahn Nutzfahrzeuge GmbH",
      "company_seat": "Kemnitz",
      "former_amtsgericht": "Rostock",
      "details": "22.04.2025 (Bekanntmachungsdatum)\n\nMecklenburg-Vorpommern Amtsgericht Stralsund HRB 612 früher Amtsgericht Rostock\nRegisterbekanntmachung nach dem Umwandlungsgesetz 22.04.2025 (Eintragungsdatum)\n\nHahn Nutzfahrzeuge GmbH\nGesellschaft mit beschränkter Haftung\nKemnitz\n\nAls nicht eingetragen wird veröffentlicht: Den Gläubigern der an der Verschmelzung beteiligten Rechtsträger ist, wenn sie binnen sechs Monaten nach dem Tag, an dem die Eintragung der Verschmelzung in das Register des Sitzes desjenigen Rechtsträgers, dessen Gläubiger sie sind, nach § 19 Abs. 3 UmwG als bekannt gemacht gilt,\nihren Anspruch nach Grund und Höhe in Textform anmelden, Sicherheit zu leisten, soweit sie nicht Befriedigung verlangen können. Dieses Recht steht den Gläubigern jedoch nur zu, wenn sie glaubhaft machen, dass durch die Verschmelzung die Erfüllung der Forderung gefährdet wird."
    },
    {
      "date": "2025-04-22",
      "id": "107037",
      "original_text": "Registerbekanntmachung nach dem Umwandlungsgesetz\nBrandenburg Amtsgericht Frankfurt/Oder HRB 12082\nSeefeld Verwaltungsgesellschaft mbH – Werneuchen",
      "type": "Registerbekanntmachung nach dem Umwandlungsgesetz",
      "state": "Brandenburg",
      "amtsgericht": "Amtsgericht Frankfurt/Oder",
      "registernummer": "HRB 12082",
      "registerart": "HRB",
      "company_name": "Seefeld Verwaltungsgesellschaft mbH",
      "company_seat": "Werneuchen",
      "details": "22.04.2025 (Bekanntmachungsdatum)\n\nBrandenburg Amtsgericht Frankfurt/Oder HRB 12082\nRegisterbekanntmachung nach dem Umwandlungsgesetz 12.04.2025 (Eintragungsdatum)\n\nSeefeld Verwaltungsgesellschaft mbH\nGesellschaft mit beschränkter Haftung\nWerneuchen\n\nZu Eintragungsnummer 5 vom 12.04.2025 wird als nicht eingetragen veröffentlicht:\nDen Gläubigern der an der Verschmelzung beteiligten Rechtsträger ist, wenn sie binnen sechs Monaten nach dem Tag, an dem die Eintragung der Verschmelzung in das Register des Sitzes desjenigen Rechtsträgers, dessen Gläubiger sie sind, als bekannt gemacht gilt, ihren Anspruch nach Grund und Höhe schriftlich anmelden, Sicherheit zu leisten, soweit sie nicht Befriedigung verlangen können. Dieses Recht steht den Gläubigern jedoch nur zu, wenn sie glaubhaft machen, dass durch die Verschmelzung die Erfüllung ihrer Forderung gefährdet wird."
    },
    {
      "date": "2025-04-22",
      "id": "107038",
      "original_text": "Einreichung neuer Dokumente\nBaden-Württemberg Amtsgericht Stuttgart HRB 3993\nPRÄSCHU Verpachtung GmbH – Stuttgart",
      "type": "Einreichung neuer Dokumente",
      "state": "Baden-Württemberg",
      "amtsgericht": "Amtsgericht Stuttgart",
      "registernummer": "HRB 3993",
      "registerart": "HRB",
      "company_name": "PRÄSCHU Verpachtung GmbH",
      "company_seat": "Stuttgart",
      "details": "22.04.2025 (Bekanntmachungsdatum)\n\nBaden-Württemberg Amtsgericht Stuttgart HRB 3993\nEinreichung neuer Dokumente\n\nPRÄSCHU Verpachtung GmbH\nGesellschaft mit beschränkter Haftung\nStuttgart\n\nDie Gesellschaft hat am 22.04.2025 die Liste über die Zusammensetzung des Aufsichtsrats zum Handelsregister eingereicht."
    },
    {
      "date": "2025-04-22",
      "id": "107039",
      "original_text": "Sonstige Registerbekanntmachung\nHamburg Amtsgericht Hamburg HRB 111705\nLichtBlick ZuhauseKraftwerk GmbH – Hamburg",
      "type": "Sonstige Registerbekanntmachung",
      "state": "Hamburg",
      "amtsgericht": "Amtsgericht Hamburg",
      "registernummer": "HRB 111705",
      "registerart": "HRB",
      "company_name": "LichtBlick ZuhauseKraftwerk GmbH",
      "company_seat": "Hamburg",
      "details": "22.04.2025 (Bekanntmachungsdatum)\n\nHamburg Amtsgericht Hamburg HRB 111705\nSonstige Registerbekanntmachung 22.04.2025 (Eintragungsdatum)\n\nLichtBlick ZuhauseKraftwerk GmbH\nGesellschaft mit beschränkter Haftung\nHamburg\n\nAls nicht eingetragen wird bekannt gemacht:  Den Gläubigern der Gesellschaft, deren Forderungen begründet worden sind, bevor die Eintragung der Vertragsbeendigung in das Handelsregister nach § 10 HGB als bekannt gemacht gilt, ist vom anderen Vertragsteil Sicherheit zu leisten, wenn sie sich binnen 6 Monaten nach Bekanntmachung der Eintragung zu diesem Zweck bei ihm melden."
    },
    {
      "date": "2025-04-22",
      "id": "107040",
      "original_text": "Sonstige Registerbekanntmachung\nBaden-Württemberg Amtsgericht Freiburg HRB 706320\nHAHN Automation Group Engen GmbH – Engen",
      "type": "Sonstige Registerbekanntmachung",
      "state": "Baden-Württemberg",
      "amtsgericht": "Amtsgericht Freiburg",
      "registernummer": "HRB 706320",
      "registerart": "HRB",
      "company_name": "HAHN Automation Group Engen GmbH",
      "company_seat": "Engen",
      "details": "22.04.2025 (Bekanntmachungsdatum)\n\nBaden-Württemberg Amtsgericht Freiburg HRB 706320\nSonstige Registerbekanntmachung 22.04.2025 (Eintragungsdatum)\n\nHAHN Automation Group Engen GmbH\nGesellschaft mit beschränkter Haftung\nEngen\n\nAls nicht eingetragen wird bekanntgemacht:\nDen Gläubigern der Gesellschaft, deren Forderungen begründet worden sind, bevor die Eintragung der Beendigung des Vertrages in das Handelsregister nach § 10 HGB als bekanntgemacht gilt, ist vom anderen Vertragsteil Sicherheit zu leisten, wenn sie sich binnen sechs Monaten nach der Bekanntmachung zu diesem Zweck bei ihm melden."
    },
    {
      "date": "2025-04-22",
      "id": "107041",
      "original_text": "Einreichung neuer Dokumente\nSachsen Amtsgericht Dresden HRB 13834\nTechnische Werke Ostritz GmbH – Ostritz",
      "type": "Einreichung neuer Dokumente",
      "state": "Sachsen",
      "amtsgericht": "Amtsgericht Dresden",
      "registernummer": "HRB 13834",
      "registerart": "HRB",
      "company_name": "Technische Werke Ostritz GmbH",
      "company_seat": "Ostritz",
      "details": "22.04.2025 (Bekanntmachungsdatum)\n\nSachsen Amtsgericht Dresden HRB 13834\nEinreichung neuer Dokumente 22.04.2025 (Eintragungsdatum)\n\nTechnische Werke Ostritz GmbH\nGesellschaft mit beschränkter Haftung\nOstritz\n\nAm 17.04.2025 wurde beim Handelsregister des Amtsgerichts Dresden die Liste der Mitglieder des Aufsichtsrats gemäß § 52 GmbHG eingereicht."
    },
    {
      "date": "2025-04-22",
      "id": "107042",
      "original_text": "Löschungsankündigung\nSachsen Amtsgericht Dresden HRB 35291\nEuroimport Marko UG (haftungsbeschränkt) – Weißwasser",
      "type": "Löschungsankündigung",
      "state": "Sachsen",
      "amtsgericht": "Amtsgericht Dresden",
      "registernummer": "HRB 35291",
      "registerart": "HRB",
      "company_name": "Euroimport Marko UG (haftungsbeschränkt)",
      "company_seat": "Weißwasser",
      "details": "22.04.2025 (Bekanntmachungsdatum)\n\nSachsen Amtsgericht Dresden HRB 35291\nLöschungsankündigung\n\nEuroimport Marko UG (haftungsbeschränkt)\nGesellschaft mit beschränkter Haftung\nWeißwasser\n\nDas Registergericht beabsichtigt, die im Handelsregister eingetragene Gesellschaft von Amts wegen nach § 394 FamFG zu löschen. Die Frist zu Erhebung eines Widerspruchs gegen die beabsichtigte Löschung wird auf einen Monat festgesetzt."
    },
    {
      "date": "2025-04-22",
      "id": "107043",
      "original_text": "Registerbekanntmachung nach dem Umwandlungsgesetz\nSachsen Amtsgericht Chemnitz HRB 28848\nBacchus GmbH – Oelsnitz/Vogtl",
      "type": "Registerbekanntmachung nach dem Umwandlungsgesetz",
      "state": "Sachsen",
      "amtsgericht": "Amtsgericht Chemnitz",
      "registernummer": "HRB 28848",
      "registerart": "HRB",
      "company_name": "Bacchus GmbH",
      "company_seat": "Oelsnitz/Vogtl",
      "details": "22.04.2025 (Bekanntmachungsdatum)\n\nSachsen Amtsgericht Chemnitz HRB 28848\nRegisterbekanntmachung nach dem Umwandlungsgesetz 22.04.2025 (Eintragungsdatum)\n\nBacchus GmbH\nGesellschaft mit beschränkter Haftung\nOelsnitz/Vogtl\n\nDen Gläubigern der an der Verschmelzung beteiligten Rechtsträger ist, wenn sie binnen sechs Monaten nach dem Tag, an dem die Eintragung der Verschmelzung in das Register des Sitzes desjenigen Rechtsträgers, dessen Gläubiger sie sind, nach § 19 Abs. 3 UmwG als bekannt gemacht gilt, ihren Anspruch nach Grund und Höhe in Textform anmelden, Sicherheit zu leisten, soweit sie nicht Befriedigung verlangen können. Dieses Recht steht den Gläubigern jedoch nur zu, wenn sie glaubhaft machen, dass durch die Verschmelzung die Erfüllung der Forderung gefährdet wird."
    },
    {
      "date": "2025-04-22",
      "id": "107044",
      "original_text": "Registerbekanntmachung nach dem Umwandlungsgesetz\nSachsen Amtsgericht Dresden HRA 12239\nZaun- und Metallbau Dresden GmbH & Co. KG – Dresden",
      "type": "Registerbekanntmachung nach dem Umwandlungsgesetz",
      "state": "Sachsen",
      "amtsgericht": "Amtsgericht Dresden",
      "registernummer": "HRA 12239",
      "registerart": "HRA",
      "company_name": "Zaun- und Metallbau Dresden GmbH & Co. KG",
      "company_seat": "Dresden",
      "details": "22.04.2025 (Bekanntmachungsdatum)\n\nSachsen Amtsgericht Dresden HRA 12239\nRegisterbekanntmachung nach dem Umwandlungsgesetz 22.04.2025 (Eintragungsdatum)\n\nZaun- und Metallbau Dresden GmbH & Co. KG\nKommanditgesellschaft\nDresden\n\nDen Gläubigern der an der Ausgliederung beteiligten Rechtsträger ist, wenn sie binnen sechs Monaten nach dem Tag, an dem die Eintragung der Ausgliederung in das Register des Sitzes desjenigen Rechtsträgers, dessen Gläubiger sie sind, nach § 19 Abs. 3 UmwG als bekannt gemacht gilt, ihren Anspruch nach Grund und Höhe in Textform anmelden, Sicherheit zu leisten, soweit sie nicht Befriedigung verlangen können. Dieses Recht steht den Gläubigern jedoch nur zu, wenn sie glaubhaft machen, dass durch die Ausgliederung die Erfüllung der Forderung gefährdet wird."
    },
    {
      "date": "2025-04-22",
      "id": "107045",
      "original_text": "Einreichung neuer Dokumente\nSachsen Amtsgericht Leipzig HRB 6824\nLESG Gesellschaft der Stadt Leipzig zur Erschließung, Entwicklung und Sanierung von Baugebieten mit beschränkter Haftung – Leipzig",
      "type": "Einreichung neuer Dokumente",
      "state": "Sachsen",
      "amtsgericht": "Amtsgericht Leipzig",
      "registernummer": "HRB 6824",
      "registerart": "HRB",
      "company_name": "LESG Gesellschaft der Stadt Leipzig zur Erschließung, Entwicklung und Sanierung von Baugebieten mit beschränkter Haftung",
      "company_seat": "Leipzig",
      "details": "22.04.2025 (Bekanntmachungsdatum)\n\nSachsen Amtsgericht Leipzig HRB 6824\nEinreichung neuer Dokumente\n\nLESG Gesellschaft der Stadt Leipzig zur Erschließung, Entwicklung und Sanierung von Baugebieten mit beschränkter Haftung\nGesellschaft mit beschränkter Haftung\nLeipzig\n\nAm 15.04.2025 wurde beim Handelsregister des Amtsgerichts Leipzig die Liste der Mitglieder des Aufsichtsrats gemäß § 52 GmbHG eingereicht.Am 15.04.2025 wurde beim Handelsregister des Amtsgerichts Leipzig die Liste der Mitglieder des Aufsichtsrats gemäß § 52 GmbHG eingereicht."
    },
    {
      "date": "2025-04-22",
      "id": "107046",
      "original_text": "Registerbekanntmachung nach dem Umwandlungsgesetz\nSachsen Amtsgericht Dresden HRA 12235\nZaun- und Metallbau Dresden e.K. Kristin und Alexandra Neuwirth in ungeteilter Erbengemeinschaft – Dresden",
      "type": "Registerbekanntmachung nach dem Umwandlungsgesetz",
      "state": "Sachsen",
      "amtsgericht": "Amtsgericht Dresden",
      "registernummer": "HRA 12235",
      "registerart": "HRA",
      "company_name": "Zaun- und Metallbau Dresden e.K. Kristin und Alexandra Neuwirth in ungeteilter Erbengemeinschaft",
      "company_seat": "Dresden",
      "details": "22.04.2025 (Bekanntmachungsdatum)\n\nSachsen Amtsgericht Dresden HRA 12235\nRegisterbekanntmachung nach dem Umwandlungsgesetz 22.04.2025 (Eintragungsdatum)\n\nZaun- und Metallbau Dresden e.K. Kristin und Alexandra Neuwirth in ungeteilter Erbengemeinschaft\nEinzelkaufmann / Einzelkauffrau\nDresden\n\nDen Gläubigern der an der Ausgliederung beteiligten Rechtsträger ist, wenn sie binnen sechs Monaten nach dem Tag, an dem die Eintragung der Ausgliederung in das Register des Sitzes desjenigen Rechtsträgers, dessen Gläubiger sie sind, nach § 19 Abs. 3 UmwG als bekannt gemacht gilt, ihren Anspruch nach Grund und Höhe in Textform anmelden, Sicherheit zu leisten, soweit sie nicht Befriedigung verlangen können. Dieses Recht steht den Gläubigern jedoch nur zu, wenn sie glaubhaft machen, dass durch die Ausgliederung die Erfüllung der Forderung gefährdet wird."
    },
    {
      "date": "2025-04-22",
      "id": "107047",
      "original_text": "Einreichung neuer Dokumente\nNiedersachsen Amtsgericht Hannover HRB 202148\nHDI Global Network AG – Hannover",
      "type": "Einreichung neuer Dokumente",
      "state": "Niedersachsen",
      "amtsgericht": "Amtsgericht Hannover",
      "registernummer": "HRB 202148",
      "registerart": "HRB",
      "company_name": "HDI Global Network AG",
      "company_seat": "Hannover",
      "details": "22.04.2025 (Bekanntmachungsdatum)\n\nNiedersachsen Amtsgericht Hannover HRB 202148\nEinreichung neuer Dokumente\n\nHDI Global Network AG\nAktiengesellschaft\nHannover\n\nDie Liste der Mitglieder des Aufsichtsrats wurde beim Registergericht eingereicht."
    },
    {
      "date": "2025-04-22",
      "id": "107048",
      "original_text": "Registerbekanntmachung nach dem Umwandlungsgesetz\nNiedersachsen Amtsgericht Hannover HRB 216899\ntecRacer Project Management GmbH – Hannover",
      "type": "Registerbekanntmachung nach dem Umwandlungsgesetz",
      "state": "Niedersachsen",
      "amtsgericht": "Amtsgericht Hannover",
      "registernummer": "HRB 216899",
      "registerart": "HRB",
      "company_name": "tecRacer Project Management GmbH",
      "company_seat": "Hannover",
      "details": "22.04.2025 (Bekanntmachungsdatum)\n\nNiedersachsen Amtsgericht Hannover HRB 216899\nRegisterbekanntmachung nach dem Umwandlungsgesetz 22.04.2025 (Eintragungsdatum)\n\ntecRacer Project Management GmbH\nGesellschaft mit beschränkter Haftung\nHannover\n\nDen Gläubigern der an der Verschmelzung beteiligten Rechtsträger ist, wenn sie binnen sechs Monaten nach dem Tag, an dem die Eintragung der Verschmelzung in das Register des Sitzes desjenigen Rechtsträgers, dessen Gläubiger sie sind, nach § 19  Abs.  3 UmwG als bekannt gemacht gilt, ihren Anspruch nach Grund und Höhe schriftlich anmelden, Sicherheit zu leisten, soweit sie nicht Befriedigung verlangen können. Dieses Recht steht den Gläubigern jedoch nur zu, wenn sie glaubhaft machen, dass durch die Verschmelzung die Erfüllung der Forderung gefährdet wird."
    },
    {
      "date": "2025-04-22",
      "id": "107049",
      "original_text": "Registerbekanntmachung nach dem Umwandlungsgesetz\nNiedersachsen Amtsgericht Hannover VR 4171\nFachvereinigung Krankenhaustechnik e.V. (FKT) – Hannover",
      "type": "Registerbekanntmachung nach dem Umwandlungsgesetz",
      "state": "Niedersachsen",
      "amtsgericht": "Amtsgericht Hannover",
      "registernummer": "VR 4171",
      "registerart": "VR",
      "company_name": "Fachvereinigung Krankenhaustechnik e.V. (FKT)",
      "company_seat": "Hannover",
      "details": "22.04.2025 (Bekanntmachungsdatum)\n\nNiedersachsen Amtsgericht Hannover VR 4171\nRegisterbekanntmachung nach dem Umwandlungsgesetz 22.04.2025 (Eintragungsdatum)\n\nFachvereinigung Krankenhaustechnik e.V. (FKT)\neingetragener Verein\nHannover\n\nDen Gläubigern der an der Verschmelzung beteiligten Rechtsträger ist, wenn sie binnen sechs Monaten nach dem Tag, an dem die Eintragung der Verschmelzung in das Register des Sitzes desjenigen Rechtsträgers, dessen Gläubiger sie sind, nach § 19  Abs.  3 UmwG als bekannt gemacht gilt, ihren Anspruch nach Grund und Höhe schriftlich anmelden, Sicherheit zu leisten, soweit sie nicht Befriedigung verlangen können. Dieses Recht steht den Gläubigern jedoch nur zu, wenn sie glaubhaft machen, dass durch die Verschmelzung die Erfüllung der Forderung gefährdet wird."
    },
    {
      "date": "2025-04-22",
      "id": "107050",
      "original_text": "Löschungsankündigung\nNiedersachsen Amtsgericht Osnabrück HRB 211336\nOSNALED Displaytechnik GmbH – Osnabrück",
      "type": "Löschungsankündigung",
      "state": "Niedersachsen",
      "amtsgericht": "Amtsgericht Osnabrück",
      "registernummer": "HRB 211336",
      "registerart": "HRB",
      "company_name": "OSNALED Displaytechnik GmbH",
      "company_seat": "Osnabrück",
      "details": "22.04.2025 (Bekanntmachungsdatum)\n\nNiedersachsen Amtsgericht Osnabrück HRB 211336\nLöschungsankündigung\n\nOSNALED Displaytechnik GmbH\nGesellschaft mit beschränkter Haftung\nOsnabrück\n\nDas Registergericht beabsichtigt, die Gesellschaft von Amts wegen nach § 394 FamFG wegen Vermögenslosigkeit zu löschen. Die Frist zur Erhebung eines Widerspruchs ist auf 1 Monat ab dieser Registerbekanntmachung festgesetzt."
    },
    {
      "date": "2025-04-22",
      "id": "107051",
      "original_text": "Löschungsankündigung\nNiedersachsen Amtsgericht Osnabrück HRB 18651\nHoltmeyer GmbH – Osnabrück",
      "type": "Löschungsankündigung",
      "state": "Niedersachsen",
      "amtsgericht": "Amtsgericht Osnabrück",
      "registernummer": "HRB 18651",
      "registerart": "HRB",
      "company_name": "Holtmeyer GmbH",
      "company_seat": "Osnabrück",
      "details": "22.04.2025 (Bekanntmachungsdatum)\n\nNiedersachsen Amtsgericht Osnabrück HRB 18651\nLöschungsankündigung\n\nHoltmeyer GmbH\nGesellschaft mit beschränkter Haftung\nOsnabrück\n\nDas Registergericht beabsichtigt, die Gesellschaft von Amts wegen nach § 394 FamFG wegen Vermögenslosigkeit zu löschen. Die Frist zur Erhebung eines Widerspruchs ist auf 1 Monat ab dieser Registerbekanntmachung festgesetzt."
    },
    {
      "date": "2025-04-22",
      "id": "107052",
      "original_text": "Registerbekanntmachung nach dem Umwandlungsgesetz\nNiedersachsen Amtsgericht Göttingen HRB 205722\nKWS SAAT SE & Co. KGaA – Einbeck",
      "type": "Registerbekanntmachung nach dem Umwandlungsgesetz",
      "state": "Niedersachsen",
      "amtsgericht": "Amtsgericht Göttingen",
      "registernummer": "HRB 205722",
      "registerart": "HRB",
      "company_name": "KWS SAAT SE & Co. KGaA",
      "company_seat": "Einbeck",
      "details": "22.04.2025 (Bekanntmachungsdatum)\n\nNiedersachsen Amtsgericht Göttingen HRB 205722\nRegisterbekanntmachung nach dem Umwandlungsgesetz 22.04.2025 (Eintragungsdatum)\n\nKWS SAAT SE & Co. KGaA\nKommanditgesellschaft auf Aktien\nEinbeck\n\nDen Gläubigern der an der Verschmelzung beteiligten Rechtsträger ist, wenn sie binnen sechs Monaten nach dem Tag, an dem die Eintragung der Verschmelzung in das Register des Sitzes desjenigen Rechtsträgers, dessen Gläubiger sie sind, nach § 19  Abs.  3 UmwG als bekannt gemacht gilt, ihren Anspruch nach Grund und Höhe schriftlich anmelden, Sicherheit zu leisten, soweit sie nicht Befriedigung verlangen können. Dieses Recht steht den Gläubigern jedoch nur zu, wenn sie glaubhaft machen, dass durch die Verschmelzung die Erfüllung der Forderung gefährdet wird."
    },
    {
      "date": "2025-04-22",
      "id": "107053",
      "original_text": "Registerbekanntmachung nach dem Umwandlungsgesetz\nNiedersachsen Amtsgericht Braunschweig HRB 202947\nle focomi GmbH – Braunschweig",
      "type": "Registerbekanntmachung nach dem Umwandlungsgesetz",
      "state": "Niedersachsen",
      "amtsgericht": "Amtsgericht Braunschweig",
      "registernummer": "HRB 202947",
      "registerart": "HRB",
      "company_name": "le focomi GmbH",
      "company_seat": "Braunschweig",
      "details": "22.04.2025 (Bekanntmachungsdatum)\n\nNiedersachsen Amtsgericht Braunschweig HRB 202947\nRegisterbekanntmachung nach dem Umwandlungsgesetz 22.04.2025 (Eintragungsdatum)\n\nle focomi GmbH\nGesellschaft mit beschränkter Haftung\nBraunschweig\n\nDen Gläubigern der an der Verschmelzung beteiligten Rechtsträger ist, wenn sie binnen sechs Monaten nach dem Tag, an dem die Eintragung der Verschmelzung in das Register des Sitzes desjenigen Rechtsträgers, dessen Gläubiger sie sind, nach § 19  Abs.  3 UmwG als bekannt gemacht gilt, ihren Anspruch nach Grund und Höhe schriftlich anmelden, Sicherheit zu leisten, soweit sie nicht Befriedigung verlangen können. Dieses Recht steht den Gläubigern jedoch nur zu, wenn sie glaubhaft machen, dass durch die Verschmelzung die Erfüllung der Forderung gefährdet wird."
    },
    {
      "date": "2025-04-22",
      "id": "107054",
      "original_text": "Löschungsankündigung\nNiedersachsen Amtsgericht Braunschweig HRA 201557\nDeparso GmbH & Co. KG – Braunschweig",
      "type": "Löschungsankündigung",
      "state": "Niedersachsen",
      "amtsgericht": "Amtsgericht Braunschweig",
      "registernummer": "HRA 201557",
      "registerart": "HRA",
      "company_name": "Deparso GmbH & Co. KG",
      "company_seat": "Braunschweig",
      "details": "22.04.2025 (Bekanntmachungsdatum)\n\nNiedersachsen Amtsgericht Braunschweig HRA 201557\nLöschungsankündigung\n\nDeparso GmbH & Co. KG\nKommanditgesellschaft\nBraunschweig\n\nDas Registergericht beabsichtigt, die Firma von Amts wegen nach § 394 FamFG zu löschen. Die Frist zur Erhebung eines Widerspruchs ist auf 1 Monat ab dieser Registerbekanntmachung festgesetzt."
    },
    {
      "date": "2025-04-22",
      "id": "107055",
      "original_text": "Registerbekanntmachung nach dem Umwandlungsgesetz\nNiedersachsen Amtsgericht Hannover HRB 212493\ntecRacer Germany GmbH – Hannover",
      "type": "Registerbekanntmachung nach dem Umwandlungsgesetz",
      "state": "Niedersachsen",
      "amtsgericht": "Amtsgericht Hannover",
      "registernummer": "HRB 212493",
      "registerart": "HRB",
      "company_name": "tecRacer Germany GmbH",
      "company_seat": "Hannover",
      "details": "22.04.2025 (Bekanntmachungsdatum)\n\nNiedersachsen Amtsgericht Hannover HRB 212493\nRegisterbekanntmachung nach dem Umwandlungsgesetz 22.04.2025 (Eintragungsdatum)\n\ntecRacer Germany GmbH\nGesellschaft mit beschränkter Haftung\nHannover\n\nDen Gläubigern der an der Verschmelzung beteiligten Rechtsträger ist, wenn sie binnen sechs Monaten nach dem Tag, an dem die Eintragung der Verschmelzung in das Register des Sitzes desjenigen Rechtsträgers, dessen Gläubiger sie sind, nach § 19  Abs.  3 UmwG als bekannt gemacht gilt, ihren Anspruch nach Grund und Höhe schriftlich anmelden, Sicherheit zu leisten, soweit sie nicht Befriedigung verlangen können. Dieses Recht steht den Gläubigern jedoch nur zu, wenn sie glaubhaft machen, dass durch die Verschmelzung die Erfüllung der Forderung gefährdet wird."
    },
    {
      "date": "2025-04-22",
      "id": "107056",
      "original_text": "Registerbekanntmachung nach dem Umwandlungsgesetz\nRheinland-Pfalz Amtsgericht Mainz HRB 50443\nALDI Bingen Verwaltungs-SE – Bingen am Rhein",
      "type": "Registerbekanntmachung nach dem Umwandlungsgesetz",
      "state": "Rheinland-Pfalz",
      "amtsgericht": "Amtsgericht Mainz",
      "registernummer": "HRB 50443",
      "registerart": "HRB",
      "company_name": "ALDI Bingen Verwaltungs-SE",
      "company_seat": "Bingen am Rhein",
      "details": "22.04.2025 (Bekanntmachungsdatum)\n\nRheinland-Pfalz Amtsgericht Mainz HRB 50443\nRegisterbekanntmachung nach dem Umwandlungsgesetz\n\nALDI Bingen Verwaltungs-SE\nEuropäische Aktiengesellschaft (SE)\nBingen am Rhein\n\nDem Registergericht ist der Entwurf eines Verschmelzungsplanes über die geplante Verschmelzung der Europäischen Aktiengesellschaften (Societas Europaea) unter den Firmen\na) ALDI Aichtal Verwaltungs-SE mit dem Sitz in Aichtal eingetragen im Handelsregister des Amtsgerichts Stuttgart unter HRB 779059\nb) ALDI Baus Verwaltungs-SE mit dem Sitz in Baus eingetragen im Handelsregister des Amtsgerichts Saarbrücken unter HRB 107744\nc) ALDI Donaueschingen Verwaltungs-SE mit dem Sitz in Donaueschingen eingetragen im Handelsregister des Amtsgerichts Freiburg unter HRB 721702\nd) ALDI Dormagen Verwaltungs-SE mit dem Sitz in Dormagen eingetragen im Handelsregister des Amtsgerichts Neuss unter HRB 20974\ne) ALDI Heimstadt Verwaltungs-SE mit dem Sitz in Heimstadt eingetragen im Handelsregister des Amtsgerichts Würzburg unter HRB 15712\nf) ALDI Langenfeld Verwaltungs-SE mit dem Sitz in Langenfeld eingetragen im Handelsregister des Amtsgerichts Düsseldorf unter HRB 87317\ng) ALDI West Verwaltungs-SE mit dem Sitz in Eschweiler eingetragen im Handelsregister des Amtsgerichts Aachen unter HRB 24967\nmit der ALDI Bingen Verwaltungs-SE mit Sitz in Bingen am Rhein (Amtsgericht Mainz HRB 50443) eingereicht worden."
    },
    {
      "date": "2025-04-22",
      "id": "107057",
      "original_text": "Löschungsankündigung\nNordrhein-Westfalen Amtsgericht Dortmund HRB 22298\nSTARZ Sales Promotions GmbH – Dortmund",
      "type": "Löschungsankündigung",
      "state": "Nordrhein-Westfalen",
      "amtsgericht": "Amtsgericht Dortmund",
      "registernummer": "HRB 22298",
      "registerart": "HRB",
      "company_name": "STARZ Sales Promotions GmbH",
      "company_seat": "Dortmund",
      "details": "22.04.2025 (Bekanntmachungsdatum)\n\nNordrhein-Westfalen Amtsgericht Dortmund HRB 22298\nLöschungsankündigung\n\nSTARZ Sales Promotions GmbH\nGesellschaft mit beschränkter Haftung\nDortmund\n\nDas Registergericht beabsichtigt die Gesellschaft von Amts wegen nach § 394 FamFG zu löschen. Die Frist zur Erhebung eines Widerspruchs ist auf zwei Monate festgesetzt."
    },
    {
      "date": "2025-04-22",
      "id": "107058",
      "original_text": "Registerbekanntmachung nach dem Umwandlungsgesetz\nNordrhein-Westfalen Amtsgericht Essen HRB 12237\nStiftung Mercator GmbH – Essen",
      "type": "Registerbekanntmachung nach dem Umwandlungsgesetz",
      "state": "Nordrhein-Westfalen",
      "amtsgericht": "Amtsgericht Essen",
      "registernummer": "HRB 12237",
      "registerart": "HRB",
      "company_name": "Stiftung Mercator GmbH",
      "company_seat": "Essen",
      "details": "22.04.2025 (Bekanntmachungsdatum)\n\nNordrhein-Westfalen Amtsgericht Essen HRB 12237\nRegisterbekanntmachung nach dem Umwandlungsgesetz 22.04.2025 (Eintragungsdatum)\n\nStiftung Mercator GmbH\nGesellschaft mit beschränkter Haftung\nEssen\n\nDen Gläubigern der an der Verschmelzung beteiligten Rechtsträger ist, wenn sie binnen sechs Monaten nach dem Tag, an dem die Eintragung der Verschmelzung in das Register des Sitzes derjenigen Rechtsträger deren Gläubiger sie sind, nach § 19 Absatz 3 UmwG als bekanntgemacht gilt, ihren Anspruch nach Grund und Höhe schriftlich anmelden, Sicherheit zu leisten, soweit sie nicht Befriedigung verlangen können. Dieses Recht steht den Gläubigern jedoch nur zu, wenn sie glaubhaft machen, dass durch die Verschmelzung die Erfüllung ihrer Forderung gefährdet wird."
    },
    {
      "date": "2025-04-22",
      "id": "107059",
      "original_text": "Einreichung neuer Dokumente\nNordrhein-Westfalen Amtsgericht Köln HRB 68228\nGlobal Invest Holding AG – Köln",
      "type": "Einreichung neuer Dokumente",
      "state": "Nordrhein-Westfalen",
      "amtsgericht": "Amtsgericht Köln",
      "registernummer": "HRB 68228",
      "registerart": "HRB",
      "company_name": "Global Invest Holding AG",
      "company_seat": "Köln",
      "details": "22.04.2025 (Bekanntmachungsdatum)\n\nNordrhein-Westfalen Amtsgericht Köln HRB 68228\nEinreichung neuer Dokumente 22.04.2025 (Eintragungsdatum)\n\nGlobal Invest Holding AG\nAktiengesellschaft\nKöln\n\nDem Registergericht ist eine neue Liste der Mitglieder des Aufsichtsrates eingereicht worden."
    },
    {
      "date": "2025-04-22",
      "id": "107060",
      "original_text": "Registerbekanntmachung nach dem Umwandlungsgesetz\nNordrhein-Westfalen Amtsgericht Köln HRA 37960\nBenedikt Berntges e.K. – Bergisch Gladbach",
      "type": "Registerbekanntmachung nach dem Umwandlungsgesetz",
      "state": "Nordrhein-Westfalen",
      "amtsgericht": "Amtsgericht Köln",
      "registernummer": "HRA 37960",
      "registerart": "HRA",
      "company_name": "Benedikt Berntges e.K.",
      "company_seat": "Bergisch Gladbach",
      "details": "22.04.2025 (Bekanntmachungsdatum)\n\nNordrhein-Westfalen Amtsgericht Köln HRA 37960\nRegisterbekanntmachung nach dem Umwandlungsgesetz 22.04.2025 (Eintragungsdatum)\n\nBenedikt Berntges e.K.\nEinzelkaufmann / Einzelkauffrau\nBergisch Gladbach\n\nDen Gläubigern der an der Ausgliederung beteiligten Rechtsträger ist, wenn sie binnen sechs Monaten nach dem Tag, an dem die Eintragung der Ausgliederung in das Register des Sitzes desjenigen Rechtsträgers, dessen Gläubiger sie sind, nach § 19 Absatz 3 UmwG als bekanntgemacht gilt, ihren Anspruch nach Grund und Höhe schriftlich anmelden, Sicherheit zu leisten, soweit sie nicht Befriedigung verlangen können. Dieses Recht steht den Gläubigern jedoch nur zu, wenn sie glaubhaft machen, dass durch die Ausgliederung die Erfüllung ihrer Forderung gefährdet wird."
    },
    {
      "date": "2025-04-22",
      "id": "107061",
      "original_text": "Löschungsankündigung\nNordrhein-Westfalen Amtsgericht Paderborn HRB 4036\nDiscVision GmbH – Paderborn",
      "type": "Löschungsankündigung",
      "state": "Nordrhein-Westfalen",
      "amtsgericht": "Amtsgericht Paderborn",
      "registernummer": "HRB 4036",
      "registerart": "HRB",
      "company_name": "DiscVision GmbH",
      "company_seat": "Paderborn",
      "details": "22.04.2025 (Bekanntmachungsdatum)\n\nNordrhein-Westfalen Amtsgericht Paderborn HRB 4036\nLöschungsankündigung 22.04.2025 (Eintragungsdatum)\n\nDiscVision GmbH\nGesellschaft mit beschränkter Haftung\nPaderborn\n\nDas Registergericht beabsichtigt die Gesellschaft von Amts wegen nach § 394 FamFG zu löschen. Die Frist zur Erhebung eines Widerspruchs ist auf einen Monat festgesetzt."
    },
    {
      "date": "2025-04-22",
      "id": "107062",
      "original_text": "Löschungsankündigung\nNordrhein-Westfalen Amtsgericht Wuppertal HRB 21121\naltronic Deutschland GmbH – Wuppertal",
      "type": "Löschungsankündigung",
      "state": "Nordrhein-Westfalen",
      "amtsgericht": "Amtsgericht Wuppertal",
      "registernummer": "HRB 21121",
      "registerart": "HRB",
      "company_name": "altronic Deutschland GmbH",
      "company_seat": "Wuppertal",
      "details": "22.04.2025 (Bekanntmachungsdatum)\n\nNordrhein-Westfalen Amtsgericht Wuppertal HRB 21121\nLöschungsankündigung 17.04.2025 (Eintragungsdatum)\n\naltronic Deutschland GmbH\nGesellschaft mit beschränkter Haftung\nWuppertal\n\nDas Registergericht beabsichtigt die Gesellschaft von Amts wegen nach § 394 FamFG zu löschen. Die Frist zur Erhebung eines Widerspruchs ist auf einen Monat festgesetzt."
    },
    {
      "date": "2025-04-22",
      "id": "107063",
      "original_text": "Löschungsankündigung\nNordrhein-Westfalen Amtsgericht Köln HRB 110592\nAdno Trading GmbH – Köln",
      "type": "Löschungsankündigung",
      "state": "Nordrhein-Westfalen",
      "amtsgericht": "Amtsgericht Köln",
      "registernummer": "HRB 110592",
      "registerart": "HRB",
      "company_name": "Adno Trading GmbH",
      "company_seat": "Köln",
      "details": "22.04.2025 (Bekanntmachungsdatum)\n\nNordrhein-Westfalen Amtsgericht Köln HRB 110592\nLöschungsankündigung\n\nAdno Trading GmbH\nGesellschaft mit beschränkter Haftung\nKöln\n\nDas Registergericht beabsichtigt die Gesellschaft von Amts wegen nach § 394 FamFG zu löschen. Die Frist zur Erhebung eines Widerspruchs ist auf einen Monat festgesetzt."
    },
    {
      "date": "2025-04-22",
      "id": "107064",
      "original_text": "Löschungsankündigung\nNordrhein-Westfalen Amtsgericht Aachen HRB 20583\nJOVIDA Büro & IT Service UG (haftungsbeschränkt) – Übach-Palenberg",
      "type": "Löschungsankündigung",
      "state": "Nordrhein-Westfalen",
      "amtsgericht": "Amtsgericht Aachen",
      "registernummer": "HRB 20583",
      "registerart": "HRB",
      "company_name": "JOVIDA Büro & IT Service UG (haftungsbeschränkt)",
      "company_seat": "Übach-Palenberg",
      "details": "22.04.2025 (Bekanntmachungsdatum)\n\nNordrhein-Westfalen Amtsgericht Aachen HRB 20583\nLöschungsankündigung\n\nJOVIDA Büro & IT Service UG (haftungsbeschränkt)\nGesellschaft mit beschränkter Haftung\nÜbach-Palenberg\n\ndas Registergericht beabsichtigt, von Amts wegen folgende Eintragung wegen Unzulässigkeit nach § 395 FamFG zu löschen:\nDie Eintragung von Herrn Richard  Gerullies als Geschäftsführer.\nDer Geschäftsführer Richard Gerullies ist verstorben.\nGemäß § 395 FamFG kann eine Eintragung im Handelsregister von Amts wegen gelöscht werden, wenn sie wegen des Mangels einer wesentlichen Voraussetzung unzulässig ist. Dies ist hier der Fall.\n\nZur Geltendmachung des Widerspruchs gegen die beabsichtigte Löschung wird hiermit eine Frist von einem Monat ab Veröffentlichung dieser Ankündigung bestimmt.\n\nRechtsbehelfsbelehrung:\n\nGegen diese Verfügung kann Widerspruch eingelegt werden. Zum Widerspruch ist jeder berechtigt, der an der Unterlassung der Löschung ein berechtigtes Interesse hat.\n\nDer Widerspruch ist bei dem Amtsgericht Aachen, Adalbertsteinweg 92, 52070 Aachen schriftlich in deutscher Sprache oder zur Niederschrift der Geschäftsstelle einzulegen. Der Widerspruch kann auch zur Niederschrift der Geschäftsstelle eines jeden Amtsgerichtes abgegeben werden.\n\nDer Widerspruch muss spätestens innerhalb der gesetzten Frist nach der Bekanntgabe der Verfügung bei dem Amtsgericht Aachen eingegangen sein. Dies gilt auch dann, wenn der Widerspruch zur Niederschrift der Geschäftsstelle eines anderen Amtsgerichtes abgegeben wurde. Die Frist beginnt mit der Bekanntgabe der Verfügung durch Veröffentlichung. Fällt das Ende der Frist auf einen Sonntag, einen allgemeinen Feiertag oder Sonnabend, so endet die Frist mit Ablauf des nächsten Werktages.\n\nDer Widerspruch muss die Bezeichnung der angefochtenen Verfügung sowie die Erklärung enthalten, dass Widerspruch gegen diese Verfügung eingelegt wird. Er ist zu unterzeichnen und soll begründet werden.\n\nDie Einlegung ist auch durch Übertragung eines elektronischen Dokuments an die elektronische Poststelle des Gerichts möglich. Das elektronische Dokument muss für die Bearbeitung durch das Gericht geeignet und mit einer qualifizierten elektronischen Signatur der verantwortenden Person versehen sein oder von der verantwortenden Person signiert und auf einem sicheren Übermittlungsweg gemäß § 130 a ZPO nach näherer Maßgabe der Verordnung über die technischen Rahmenbedingungen des elektronischen Rechtsverkehrs und über das besondere elektronische Behördenpostfach (BGBl. I, S. 3803) eingereicht werden. Weitere Informationen erhalten Sie auf der Internetseite www.justiz.de."
    },
    {
      "date": "2025-04-22",
      "id": "107065",
      "original_text": "Registerbekanntmachung nach dem Umwandlungsgesetz\nNordrhein-Westfalen Amtsgericht Bonn HRB 8363\nRheinwerk Verlag GmbH – Bonn",
      "type": "Registerbekanntmachung nach dem Umwandlungsgesetz",
      "state": "Nordrhein-Westfalen",
      "amtsgericht": "Amtsgericht Bonn",
      "registernummer": "HRB 8363",
      "registerart": "HRB",
      "company_name": "Rheinwerk Verlag GmbH",
      "company_seat": "Bonn",
      "details": "22.04.2025 (Bekanntmachungsdatum)\n\nNordrhein-Westfalen Amtsgericht Bonn HRB 8363\nRegisterbekanntmachung nach dem Umwandlungsgesetz 22.04.2025 (Eintragungsdatum)\n\nRheinwerk Verlag GmbH\nGesellschaft mit beschränkter Haftung\nBonn\n\nDen Gläubigern der an der Verschmelzung beteiligten Rechtsträger ist, wenn sie binnen sechs Monaten nach dem Tag, an dem die Eintragung der Verschmelzung in das Register des Sitzes desjenigen Rechtsträgers, dessen Gläubiger sie sind, nach § 19 Absatz 3 UmwG als bekanntgemacht gilt, ihren Anspruch nach Grund und Höhe schriftlich anmelden, Sicherheit zu leisten, soweit sie nicht Befriedigung verlangen können. Dieses Recht steht den Gläubigern jedoch nur zu, wenn sie glaubhaft machen, dass durch die Verschmelzung die Erfüllung ihrer Forderung gefährdet wird."
    },
    {
      "date": "2025-04-22",
      "id": "107066",
      "original_text": "Registerbekanntmachung nach dem Umwandlungsgesetz\nNordrhein-Westfalen Amtsgericht Arnsberg VR 10033 früher Amtsgericht Brilon\nSt. Sebastian - Schützenbruderschaft Nieder-Alme eingetragener Verein – Brilon",
      "type": "Registerbekanntmachung nach dem Umwandlungsgesetz",
      "state": "Nordrhein-Westfalen",
      "amtsgericht": "Amtsgericht Arnsberg",
      "registernummer": "VR 10033",
      "registerart": "VR",
      "company_name": "St. Sebastian - Schützenbruderschaft Nieder-Alme eingetragener Verein",
      "company_seat": "Brilon",
      "former_amtsgericht": "Brilon",
      "details": "22.04.2025 (Bekanntmachungsdatum)\n\nNordrhein-Westfalen Amtsgericht Arnsberg VR 10033 früher Amtsgericht Brilon\nRegisterbekanntmachung nach dem Umwandlungsgesetz 22.04.2025 (Eintragungsdatum)\n\nSt. Sebastian - Schützenbruderschaft Nieder-Alme eingetragener Verein\neingetragener Verein\nBrilon\n\nDen Gläubigern der an der Verschmelzung beteiligten Rechtsträger ist, wenn sie binnen sechs Monaten nach dem Tag, an dem die Eintragung der Verschmelzung in das Register des Sitzes derjenigen Rechtsträger deren Gläubiger sie sind, nach § 19 Absatz 3 UmwG als bekanntgemacht gilt, ihren Anspruch nach Grund und Höhe schriftlich anmelden, Sicherheit zu leisten, soweit sie nicht Befriedigung verlangen können. Dieses Recht steht den Gläubigern jedoch nur zu, wenn sie glaubhaft machen, dass durch die Verschmelzung die Erfüllung ihrer Forderung gefährdet wird."
    },
    {
      "date": "2025-04-22",
      "id": "107067",
      "original_text": "Registerbekanntmachung nach dem Umwandlungsgesetz\nNordrhein-Westfalen Amtsgericht Düsseldorf HRB 25234\nCheckpoint Computer GmbH – Hilden",
      "type": "Registerbekanntmachung nach dem Umwandlungsgesetz",
      "state": "Nordrhein-Westfalen",
      "amtsgericht": "Amtsgericht Düsseldorf",
      "registernummer": "HRB 25234",
      "registerart": "HRB",
      "company_name": "Checkpoint Computer GmbH",
      "company_seat": "Hilden",
      "details": "22.04.2025 (Bekanntmachungsdatum)\n\nNordrhein-Westfalen Amtsgericht Düsseldorf HRB 25234\nRegisterbekanntmachung nach dem Umwandlungsgesetz 22.04.2025 (Eintragungsdatum)\n\nCheckpoint Computer GmbH\nGesellschaft mit beschränkter Haftung\nHilden\n\nDen Gläubigern der an der Verschmelzung beteiligten Rechtsträger ist, wenn sie binnen sechs Monaten nach dem Tag, an dem die Eintragung der Verschmelzung in das Register des Sitzes desjenigen Rechtsträgers, dessen Gläubiger sie sind, nach § 19 Absatz 3 UmwG als bekanntgemacht gilt, ihren Anspruch nach Grund und Höhe schriftlich anmelden, Sicherheit zu leisten, soweit sie nicht Befriedigung verlangen können. Dieses Recht steht den Gläubigern jedoch nur zu, wenn sie glaubhaft machen, dass durch die Verschmelzung die Erfüllung ihrer Forderung gefährdet wird."
    },
    {
      "date": "2025-04-22",
      "id": "107068",
      "original_text": "Registerbekanntmachung nach dem Umwandlungsgesetz\nNordrhein-Westfalen Amtsgericht Bad Oeynhausen HRB 5808\nimos-NET Aktiengesellschaft – Herford",
      "type": "Registerbekanntmachung nach dem Umwandlungsgesetz",
      "state": "Nordrhein-Westfalen",
      "amtsgericht": "Amtsgericht Bad Oeynhausen",
      "registernummer": "HRB 5808",
      "registerart": "HRB",
      "company_name": "imos-NET Aktiengesellschaft",
      "company_seat": "Herford",
      "details": "22.04.2025 (Bekanntmachungsdatum)\n\nNordrhein-Westfalen Amtsgericht Bad Oeynhausen HRB 5808\nRegisterbekanntmachung nach dem Umwandlungsgesetz 22.04.2025 (Eintragungsdatum)\n\nimos-NET Aktiengesellschaft\nAktiengesellschaft\nHerford\n\nDen Gläubigern der an der Verschmelzung beteiligten Rechtsträger ist, wenn sie binnen sechs Monaten nach dem Tag, an dem die Eintragung der Verschmelzung in das Register des Sitzes desjenigen Rechtsträgers, dessen Gläubiger sie sind, nach § 19 Absatz 3 UmwG als bekanntgemacht gilt, ihren Anspruch nach Grund und Höhe schriftlich anmelden, Sicherheit zu leisten, soweit sie nicht Befriedigung verlangen können. Dieses Recht steht den Gläubigern jedoch nur zu, wenn sie glaubhaft machen, dass durch die Verschmelzung die Erfüllung ihrer Forderung gefährdet wird."
    },
    {
      "date": "2025-04-22",
      "id": "107069",
      "original_text": "Löschungsankündigung\nNordrhein-Westfalen Amtsgericht Aachen HRB 7006\nGecko-Consulting GmbH, Gesundheit mit Konzept – Aachen",
      "type": "Löschungsankündigung",
      "state": "Nordrhein-Westfalen",
      "amtsgericht": "Amtsgericht Aachen",
      "registernummer": "HRB 7006",
      "registerart": "HRB",
      "company_name": "Gecko-Consulting GmbH, Gesundheit mit Konzept",
      "company_seat": "Aachen",
      "details": "22.04.2025 (Bekanntmachungsdatum)\n\nNordrhein-Westfalen Amtsgericht Aachen HRB 7006\nLöschungsankündigung\n\nGecko-Consulting GmbH, Gesundheit mit Konzept\nGesellschaft mit beschränkter Haftung\nAachen\n\nDas Registergericht beabsichtigt, von Amts wegen die Gesellschaft wegen Vermögenslosigkeit nach § 394 FamFG zu löschen weil das Finanzamt Aachen-Stadt Umstände mitgeteilt hat, aufgrund derer das Gericht davon überzeugt ist, dass die Gesellschaft vollständig vermögenslos ist.\n\nZur Geltendmachung des Widerspruchs gegen die beabsichtigte Löschung wird hiermit eine Frist von einem Monat ab Veröffentlichung dieser Ankündigung bestimmt.\n\nRechtsbehelfsbelehrung:\n\nGegen diese Verfügung kann Widerspruch eingelegt werden. Zum Widerspruch ist jeder berechtigt, der an der Unterlassung der Löschung ein berechtigtes Interesse hat.\n\nDer Widerspruch ist bei dem Amtsgericht Aachen, Adalbertsteinweg 92, 52070 Aachen schriftlich in deutscher Sprache oder zur Niederschrift der Geschäftsstelle einzulegen. Der Widerspruch kann auch zur Niederschrift der Geschäftsstelle eines jeden Amtsgerichtes abgegeben werden.\n\nDer Widerspruch muss spätestens innerhalb der gesetzten Frist nach der Bekanntgabe der Verfügung bei dem Amtsgericht Aachen eingegangen sein. Dies gilt auch dann, wenn der Widerspruch zur Niederschrift der Geschäftsstelle eines anderen Amtsgerichtes abgegeben wurde. Die Frist beginnt mit der Bekanntgabe der Verfügung durch Veröffentlichung. Fällt das Ende der Frist auf einen Sonntag, einen allgemeinen Feiertag oder Sonnabend, so endet die Frist mit Ablauf des nächsten Werktages.\n\nDer Widerspruch muss die Bezeichnung der angefochtenen Verfügung sowie die Erklärung enthalten, dass Widerspruch gegen diese Verfügung eingelegt wird. Er ist zu unterzeichnen und soll begründet werden.\n\nDie Einlegung ist auch durch Übertragung eines elektronischen Dokuments an die elektronische Poststelle des Gerichts möglich. Das elektronische Dokument muss für die Bearbeitung durch das Gericht geeignet und mit einer qualifizierten elektronischen Signatur der verantwortenden Person versehen sein oder von der verantwortenden Person signiert und auf einem sicheren Übermittlungsweg gemäß § 130 a ZPO nach näherer Maßgabe der Verordnung über die technischen Rahmenbedingungen des elektronischen Rechtsverkehrs und über das besondere elektronische Behördenpostfach (BGBl. I, S. 3803) eingereicht werden. Weitere Informationen erhalten Sie auf der Internetseite www.justiz.de."
    },
    {
      "date": "2025-04-22",
      "id": "107070",
      "original_text": "Einreichung neuer Dokumente\nNordrhein-Westfalen Amtsgericht Iserlohn HRB 5726\nGrohe AG – Hemer",
      "type": "Einreichung neuer Dokumente",
      "state": "Nordrhein-Westfalen",
      "amtsgericht": "Amtsgericht Iserlohn",
      "registernummer": "HRB 5726",
      "registerart": "HRB",
      "company_name": "Grohe AG",
      "company_seat": "Hemer",
      "details": "22.04.2025 (Bekanntmachungsdatum)\n\nNordrhein-Westfalen Amtsgericht Iserlohn HRB 5726\nEinreichung neuer Dokumente\n\nGrohe AG\nAktiengesellschaft\nHemer\n\nDem Registergericht ist eine neue Liste der Mitglieder des Aufsichtsrates eingereicht worden."
    },
    {
      "date": "2025-04-22",
      "id": "107071",
      "original_text": "Registerbekanntmachung nach dem Umwandlungsgesetz\nNordrhein-Westfalen Amtsgericht Arnsberg VR 10008 früher Amtsgericht Brilon\nSt. Ludgerus-Schützenbruderschaft Alme 1901 e. V. – Brilon",
      "type": "Registerbekanntmachung nach dem Umwandlungsgesetz",
      "state": "Nordrhein-Westfalen",
      "amtsgericht": "Amtsgericht Arnsberg",
      "registernummer": "VR 10008",
      "registerart": "VR",
      "company_name": "St. Ludgerus-Schützenbruderschaft Alme 1901 e. V.",
      "company_seat": "Brilon",
      "former_amtsgericht": "Brilon",
      "details": "22.04.2025 (Bekanntmachungsdatum)\n\nNordrhein-Westfalen Amtsgericht Arnsberg VR 10008 früher Amtsgericht Brilon\nRegisterbekanntmachung nach dem Umwandlungsgesetz 22.04.2025 (Eintragungsdatum)\n\nSt. Ludgerus-Schützenbruderschaft Alme 1901 e. V.\neingetragener Verein\nBrilon\n\nDen Gläubigern der an der Verschmelzung beteiligten Rechtsträger ist, wenn sie binnen sechs Monaten nach dem Tag, an dem die Eintragung der Verschmelzung in das Register des Sitzes derjenigen Rechtsträger deren Gläubiger sie sind, nach § 19 Absatz 3 UmwG als bekanntgemacht gilt, ihren Anspruch nach Grund und Höhe schriftlich anmelden, Sicherheit zu leisten, soweit sie nicht Befriedigung verlangen können. Dieses Recht steht den Gläubigern jedoch nur zu, wenn sie glaubhaft machen, dass durch die Verschmelzung die Erfüllung ihrer Forderung gefährdet wird."
    },
    {
      "date": "2025-04-22",
      "id": "107072",
      "original_text": "Löschungsankündigung\nNordrhein-Westfalen Amtsgericht Mönchengladbach HRB 18995\nDJ Invest GmbH – Mönchengladbach",
      "type": "Löschungsankündigung",
      "state": "Nordrhein-Westfalen",
      "amtsgericht": "Amtsgericht Mönchengladbach",
      "registernummer": "HRB 18995",
      "registerart": "HRB",
      "company_name": "DJ Invest GmbH",
      "company_seat": "Mönchengladbach",
      "details": "22.04.2025 (Bekanntmachungsdatum)\n\nNordrhein-Westfalen Amtsgericht Mönchengladbach HRB 18995\nLöschungsankündigung\n\nDJ Invest GmbH\nGesellschaft mit beschränkter Haftung\nMönchengladbach\n\nDJ Invest GmbH, Mönchengladbach (Amtsgericht Mönchengladbach, HRB 18995)\nDas Registergericht beabsichtigt, die im Handelsregister eingetragene Gesellschaft gemäß § 394 Absatz 1 FamFG wegen Vermögenslosigkeit von Amts wegen zu löschen. Gegen diese Verfügung kann Widerspruch eingelegt werden. Die Frist zur Erhebung eines Widerspruchs gegen die beabsichtigte Löschung von Amts wegen ist auf drei Monate festgesetzt."
    },
    {
      "date": "2025-04-22",
      "id": "107073",
      "original_text": "Registerbekanntmachung nach dem Umwandlungsgesetz\nNordrhein-Westfalen Amtsgericht Köln HRB 120271\nRehaSleep GmbH – Köln",
      "type": "Registerbekanntmachung nach dem Umwandlungsgesetz",
      "state": "Nordrhein-Westfalen",
      "amtsgericht": "Amtsgericht Köln",
      "registernummer": "HRB 120271",
      "registerart": "HRB",
      "company_name": "RehaSleep GmbH",
      "company_seat": "Köln",
      "details": "22.04.2025 (Bekanntmachungsdatum)\n\nNordrhein-Westfalen Amtsgericht Köln HRB 120271\nRegisterbekanntmachung nach dem Umwandlungsgesetz 22.04.2025 (Eintragungsdatum)\n\nRehaSleep GmbH\nGesellschaft mit beschränkter Haftung\nKöln\n\nDen Gläubigern der an der Ausgliederung beteiligten Rechtsträger ist, wenn sie binnen sechs Monaten nach dem Tag, an dem die Eintragung der Ausgliederung in das Register des Sitzes desjenigen Rechtsträgers, dessen Gläubiger sie sind, nach § 19 Absatz 3 UmwG als bekanntgemacht gilt, ihren Anspruch nach Grund und Höhe schriftlich anmelden, Sicherheit zu leisten, soweit sie nicht Befriedigung verlangen können. Dieses Recht steht den Gläubigern jedoch nur zu, wenn sie glaubhaft machen, dass durch die Ausgliederung die Erfüllung ihrer Forderung gefährdet wird."
    },
    {
      "date": "2025-04-22",
      "id": "107074",
      "original_text": "Löschungsankündigung\nNordrhein-Westfalen Amtsgericht Köln HRA 33617\nTrodatec OHG – Köln",
      "type": "Löschungsankündigung",
      "state": "Nordrhein-Westfalen",
      "amtsgericht": "Amtsgericht Köln",
      "registernummer": "HRA 33617",
      "registerart": "HRA",
      "company_name": "Trodatec OHG",
      "company_seat": "Köln",
      "details": "22.04.2025 (Bekanntmachungsdatum)\n\nNordrhein-Westfalen Amtsgericht Köln HRA 33617\nLöschungsankündigung\n\nTrodatec OHG\nOffene Handelsgesellschaft\nKöln\n\nDas Registergericht beabsichtigt die Firma von Amts wegen Aufgabe des Geschäftsbetriebes nach §§ 6 I, 31 II HTGB, 393 FamFG zu löschen. Die Frist zur Erhebung eines Widerspruchs ist auf einen Monat festgesetzt."
    },
    {
      "date": "2025-04-22",
      "id": "107075",
      "original_text": "Löschungsankündigung\nNordrhein-Westfalen Amtsgericht Köln HRB 100882\nChris GmbH – Bergheim",
      "type": "Löschungsankündigung",
      "state": "Nordrhein-Westfalen",
      "amtsgericht": "Amtsgericht Köln",
      "registernummer": "HRB 100882",
      "registerart": "HRB",
      "company_name": "Chris GmbH",
      "company_seat": "Bergheim",
      "details": "22.04.2025 (Bekanntmachungsdatum)\n\nNordrhein-Westfalen Amtsgericht Köln HRB 100882\nLöschungsankündigung\n\nChris GmbH\nGesellschaft mit beschränkter Haftung\nBergheim\n\nDas Registergericht beabsichtigt die Gesellschaft von Amts wegen nach § 394 FamFG zu löschen. Die Frist zur Erhebung eines Widerspruchs ist auf einen Monat festgesetzt."
    },
    {
      "date": "2025-04-22",
      "id": "107076",
      "original_text": "Löschungsankündigung\nNordrhein-Westfalen Amtsgericht Düsseldorf HRB 89746\nKamikaze Zaya GmbH – Düsseldorf",
      "type": "Löschungsankündigung",
      "state": "Nordrhein-Westfalen",
      "amtsgericht": "Amtsgericht Düsseldorf",
      "registernummer": "HRB 89746",
      "registerart": "HRB",
      "company_name": "Kamikaze Zaya GmbH",
      "company_seat": "Düsseldorf",
      "details": "22.04.2025 (Bekanntmachungsdatum)\n\nNordrhein-Westfalen Amtsgericht Düsseldorf HRB 89746\nLöschungsankündigung\n\nKamikaze Zaya GmbH\nGesellschaft mit beschränkter Haftung\nDüsseldorf\n\nDas Registergericht beabsichtigt die Gesellschaft von Amts wegen nach § 394 Abs. 1 FamFG zu löschen. Die Frist zur Erhebung eines Widerspruchs ist auf einen Monat festgesetzt.\n\nRechtsbehelfsbelehrung:\nDas Widerspruchsrecht steht jedem zu, der an der Unterlassung der Löschung ein berechtigtes Interesse hat. Der Widerspruch ist bei dem Amtsgericht Düsseldorf -Registergericht-, Werdener Straße 1, 40227 Düsseldorf schriftlich in deutscher Sprache oder zur Niederschrift der Geschäftsstelle einzulegen. Der Widerspruch kann auch zur Niederschrift der Geschäftsstelle eines jeden Amtsgerichtes abgegeben werden. Die Einlegung ist auch durch Übertragung eines elektronischen Dokuments an die elektronische Poststelle des Gerichts möglich. Das elektronische Dokument muss für die Bearbeitung durch das Gericht geeignet und mit einer qualifizierten elektronischen Signatur der verantwortenden Person versehen sein oder von der verantwortenden Person signiert und auf einem sicheren Übermittlungsweg gemäß § 130a ZPO nach näherer Maßgabe der Verordnung über die technischen Rahmenbedingungen des elektronischen Rechtsverkehrs und über das besondere elektronische Behördenpostfach (BGBl. I, S.3803) eingereicht werden. Weitere Informationen erhalten Sie auf der Internetseite www.justiz.de.\nDer Widerspruch muss spätestens innerhalb der gesetzten Frist nach dem Datum der Bekanntmachung der Löschungsankündigung bei dem Amtsgericht - Registergericht - Düsseldorf eingegangen sein.  Dies gilt auch dann, wenn der Widerspruch zur Niederschrift der Geschäftsstelle eines anderen Amtsgerichtes abgegeben wurde. Die Frist beginnt mit dem Tage der Bekanntmachung der Löschungsankündigung in dem für die Bekanntmachung der Eintragungen in das Handelsregister bestimmten elektronischen Informations- und Kommunikationssystem nach § 10 des Handelsgesetzbuches. Fällt das Ende der Frist auf einen Sonntag, einen allgemeinen Feiertag oder Sonnabend, so endet die Frist mit Ablauf des nächsten Werktages.\nDer Widerspruch muss die Bezeichnung der angefochtenen Löschungsankündigung sowie die Erklärung enthalten, dass Widerspruch gegen diese Löschungsankündigung eingelegt wird. Er ist zu unterzeichnen und soll begründet werden."
    },
    {
      "date": "2025-04-22",
      "id": "107077",
      "original_text": "Registerbekanntmachung nach dem Umwandlungsgesetz\nNordrhein-Westfalen Amtsgericht Köln HRA 37714\nFelipe Perez e. K. – Köln",
      "type": "Registerbekanntmachung nach dem Umwandlungsgesetz",
      "state": "Nordrhein-Westfalen",
      "amtsgericht": "Amtsgericht Köln",
      "registernummer": "HRA 37714",
      "registerart": "HRA",
      "company_name": "Felipe Perez e. K.",
      "company_seat": "Köln",
      "details": "22.04.2025 (Bekanntmachungsdatum)\n\nNordrhein-Westfalen Amtsgericht Köln HRA 37714\nRegisterbekanntmachung nach dem Umwandlungsgesetz 22.04.2025 (Eintragungsdatum)\n\nFelipe Perez e. K.\nEinzelkaufmann / Einzelkauffrau\nKöln\n\nDen Gläubigern der an der Ausgliederung beteiligten Rechtsträger ist, wenn sie binnen sechs Monaten nach dem Tag, an dem die Eintragung der Ausgliederung in das Register des Sitzes desjenigen Rechtsträgers, dessen Gläubiger sie sind, nach § 19 Absatz 3 UmwG als bekanntgemacht gilt, ihren Anspruch nach Grund und Höhe schriftlich anmelden, Sicherheit zu leisten, soweit sie nicht Befriedigung verlangen können. Dieses Recht steht den Gläubigern jedoch nur zu, wenn sie glaubhaft machen, dass durch die Ausgliederung die Erfüllung ihrer Forderung gefährdet wird."
    },
    {
      "date": "2025-04-22",
      "id": "107078",
      "original_text": "Löschungsankündigung\nNordrhein-Westfalen Amtsgericht Bad Oeynhausen HRA 5096\nWK Abwicklungs GmbH & Co. KG – Bünde",
      "type": "Löschungsankündigung",
      "state": "Nordrhein-Westfalen",
      "amtsgericht": "Amtsgericht Bad Oeynhausen",
      "registernummer": "HRA 5096",
      "registerart": "HRA",
      "company_name": "WK Abwicklungs GmbH & Co. KG",
      "company_seat": "Bünde",
      "details": "22.04.2025 (Bekanntmachungsdatum)\n\nNordrhein-Westfalen Amtsgericht Bad Oeynhausen HRA 5096\nLöschungsankündigung\n\nWK Abwicklungs GmbH & Co. KG\nKommanditgesellschaft\nBünde\n\nDas Registergericht beabsichtigt die Firma von Amts wegen nach § 394 FamFG zu löschen. Die Frist zur Erhebung eines Widerspruchs ist auf einen Monat festgesetzt."
    },
    {
      "date": "2025-04-22",
      "id": "107079",
      "original_text": "Sonstige Registerbekanntmachung\nNordrhein-Westfalen Amtsgericht Bonn HRB 6794\nDeutsche Telekom AG – Bonn",
      "type": "Sonstige Registerbekanntmachung",
      "state": "Nordrhein-Westfalen",
      "amtsgericht": "Amtsgericht Bonn",
      "registernummer": "HRB 6794",
      "registerart": "HRB",
      "company_name": "Deutsche Telekom AG",
      "company_seat": "Bonn",
      "details": "22.04.2025 (Bekanntmachungsdatum)\n\nNordrhein-Westfalen Amtsgericht Bonn HRB 6794\nSonstige Registerbekanntmachung\n\nDeutsche Telekom AG\nAktiengesellschaft\nBonn\n\nDem Registergericht ist eine Liste der Mitglieder des Aufsichtsrates eingereicht worden."
    },
    {
      "date": "2025-04-22",
      "id": "107080",
      "original_text": "Registerbekanntmachung nach dem Umwandlungsgesetz\nNordrhein-Westfalen Amtsgericht Dortmund HRB 27279\nNEORY GmbH – Dortmund",
      "type": "Registerbekanntmachung nach dem Umwandlungsgesetz",
      "state": "Nordrhein-Westfalen",
      "amtsgericht": "Amtsgericht Dortmund",
      "registernummer": "HRB 27279",
      "registerart": "HRB",
      "company_name": "NEORY GmbH",
      "company_seat": "Dortmund",
      "details": "22.04.2025 (Bekanntmachungsdatum)\n\nNordrhein-Westfalen Amtsgericht Dortmund HRB 27279\nRegisterbekanntmachung nach dem Umwandlungsgesetz 17.04.2025 (Eintragungsdatum)\n\nNEORY GmbH\nGesellschaft mit beschränkter Haftung\nDortmund\n\nDen Gläubigern der an der Verschmelzung beteiligten Rechtsträger ist, wenn sie binnen sechs Monaten nach dem Tag, an dem die Eintragung der Verschmelzung in das Register des Sitzes desjenigen Rechtsträgers, dessen Gläubiger sie sind, nach § 19 Absatz 3 UmwG als bekanntgemacht gilt, ihren Anspruch nach Grund und Höhe schriftlich anmelden, Sicherheit zu leisten, soweit sie nicht Befriedigung verlangen können. Dieses Recht steht den Gläubigern jedoch nur zu, wenn sie glaubhaft machen, dass durch die Verschmelzung die Erfüllung ihrer Forderung gefährdet wird."
    },
    {
      "date": "2025-04-22",
      "id": "107081",
      "original_text": "Registerbekanntmachung nach dem Umwandlungsgesetz\nNordrhein-Westfalen Amtsgericht Aachen HRA 4819\nManfred Scherf Holzfachhandel GmbH & Co KG – Simmerath",
      "type": "Registerbekanntmachung nach dem Umwandlungsgesetz",
      "state": "Nordrhein-Westfalen",
      "amtsgericht": "Amtsgericht Aachen",
      "registernummer": "HRA 4819",
      "registerart": "HRA",
      "company_name": "Manfred Scherf Holzfachhandel GmbH & Co KG",
      "company_seat": "Simmerath",
      "details": "22.04.2025 (Bekanntmachungsdatum)\n\nNordrhein-Westfalen Amtsgericht Aachen HRA 4819\nRegisterbekanntmachung nach dem Umwandlungsgesetz 22.04.2025 (Eintragungsdatum)\n\nManfred Scherf Holzfachhandel GmbH & Co KG\nKommanditgesellschaft\nSimmerath\n\nDen Gläubigern der an der Verschmelzung beteiligten Rechtsträger ist, wenn sie binnen sechs Monaten nach dem Tag, an dem die Eintragung der Verschmelzung in das Register des Sitzes derjenigen Rechtsträger deren Gläubiger sie sind, nach § 19 Absatz 3 UmwG als bekanntgemacht gilt, ihren Anspruch nach Grund und Höhe schriftlich anmelden, Sicherheit zu leisten, soweit sie nicht Befriedigung verlangen können. Dieses Recht steht den Gläubigern jedoch nur zu, wenn sie glaubhaft machen, dass durch die Verschmelzung die Erfüllung ihrer Forderung gefährdet wird."
    },
    {
      "date": "2025-04-22",
      "id": "107082",
      "original_text": "Einreichung neuer Dokumente\nNordrhein-Westfalen Amtsgericht Düsseldorf HRB 53554\nVodafone Group Services GmbH – Düsseldorf",
      "type": "Einreichung neuer Dokumente",
      "state": "Nordrhein-Westfalen",
      "amtsgericht": "Amtsgericht Düsseldorf",
      "registernummer": "HRB 53554",
      "registerart": "HRB",
      "company_name": "Vodafone Group Services GmbH",
      "company_seat": "Düsseldorf",
      "details": "22.04.2025 (Bekanntmachungsdatum)\n\nNordrhein-Westfalen Amtsgericht Düsseldorf HRB 53554\nEinreichung neuer Dokumente\n\nVodafone Group Services GmbH\nGesellschaft mit beschränkter Haftung\nDüsseldorf\n\nDem Registergericht ist eine neue Liste der Mitglieder des Aufsichtsrates eingereicht worden."
    },
    {
      "date": "2025-04-22",
      "id": "107083",
      "original_text": "Registerbekanntmachung nach dem Umwandlungsgesetz\nNordrhein-Westfalen Amtsgericht Bad Oeynhausen HRB 5451\nIMOS Aktiengesellschaft – Herford",
      "type": "Registerbekanntmachung nach dem Umwandlungsgesetz",
      "state": "Nordrhein-Westfalen",
      "amtsgericht": "Amtsgericht Bad Oeynhausen",
      "registernummer": "HRB 5451",
      "registerart": "HRB",
      "company_name": "IMOS Aktiengesellschaft",
      "company_seat": "Herford",
      "details": "22.04.2025 (Bekanntmachungsdatum)\n\nNordrhein-Westfalen Amtsgericht Bad Oeynhausen HRB 5451\nRegisterbekanntmachung nach dem Umwandlungsgesetz 22.04.2025 (Eintragungsdatum)\n\nIMOS Aktiengesellschaft\nAktiengesellschaft\nHerford\n\nDen Gläubigern der an der Verschmelzung beteiligten Rechtsträger ist, wenn sie binnen sechs Monaten nach dem Tag, an dem die Eintragung der Verschmelzung in das Register des Sitzes desjenigen Rechtsträgers, dessen Gläubiger sie sind, nach § 19 Absatz 3 UmwG als bekanntgemacht gilt, ihren Anspruch nach Grund und Höhe schriftlich anmelden, Sicherheit zu leisten, soweit sie nicht Befriedigung verlangen können. Dieses Recht steht den Gläubigern jedoch nur zu, wenn sie glaubhaft machen, dass durch die Verschmelzung die Erfüllung ihrer Forderung gefährdet wird."
    },
    {
      "date": "2025-04-22",
      "id": "107084",
      "original_text": "Registerbekanntmachung nach dem Umwandlungsgesetz\nNordrhein-Westfalen Amtsgericht Münster HRB 7815\nHeinrich Winkelmann Vermögensverwaltung GmbH – Ahlen",
      "type": "Registerbekanntmachung nach dem Umwandlungsgesetz",
      "state": "Nordrhein-Westfalen",
      "amtsgericht": "Amtsgericht Münster",
      "registernummer": "HRB 7815",
      "registerart": "HRB",
      "company_name": "Heinrich Winkelmann Vermögensverwaltung GmbH",
      "company_seat": "Ahlen",
      "details": "22.04.2025 (Bekanntmachungsdatum)\n\nNordrhein-Westfalen Amtsgericht Münster HRB 7815\nRegisterbekanntmachung nach dem Umwandlungsgesetz 22.04.2025 (Eintragungsdatum)\n\nHeinrich Winkelmann Vermögensverwaltung GmbH\nGesellschaft mit beschränkter Haftung\nAhlen\n\nDen Gläubigern der an der Verschmelzung beteiligten Rechtsträger ist, wenn sie binnen sechs Monaten nach dem Tag, an dem die Eintragung der Verschmelzung in das Register des Sitzes desjenigen Rechtsträgers, dessen Gläubiger sie sind, nach § 19 Absatz 3 UmwG als bekanntgemacht gilt, ihren Anspruch nach Grund und Höhe schriftlich anmelden, Sicherheit zu leisten, soweit sie nicht Befriedigung verlangen können. Dieses Recht steht den Gläubigern jedoch nur zu, wenn sie glaubhaft machen, dass durch die Verschmelzung die Erfüllung ihrer Forderung gefährdet wird."
    },
    {
      "date": "2025-04-22",
      "id": "107085",
      "original_text": "Registerbekanntmachung nach dem Umwandlungsgesetz\nThüringen Amtsgericht Jena HRB 401681\nTUPAG Agrar Nord GmbH – Unstruttal",
      "type": "Registerbekanntmachung nach dem Umwandlungsgesetz",
      "state": "Thüringen",
      "amtsgericht": "Amtsgericht Jena",
      "registernummer": "HRB 401681",
      "registerart": "HRB",
      "company_name": "TUPAG Agrar Nord GmbH",
      "company_seat": "Unstruttal",
      "details": "22.04.2025 (Bekanntmachungsdatum)\n\nThüringen Amtsgericht Jena HRB 401681\nRegisterbekanntmachung nach dem Umwandlungsgesetz 22.04.2025 (Eintragungsdatum)\n\nTUPAG Agrar Nord GmbH\nGesellschaft mit beschränkter Haftung\nUnstruttal\n\nNicht eingetragen: Den Gläubigern der an der Verschmelzung beteiligten Rechtsträger, ist wenn sie binnen sechs Monaten nach dem Tag, an dem die Eintragung der Verschmelzung in das Register des Sitzes desjenigen Rechtsträgers, dessen Gläubiger sie sind,  nach § 19 Abs. 3 UmwG als bekanntgemacht gilt, ihren Anspruch nach Grund und Höhe schriftlich anmelden, Sicherheit zu leisten, soweit sie nicht Befriedigung verlangen können. Dieses Recht steht ihnen jedoch nur zu, wenn sie glaubhaft machen, daß durch die Verschmelzung die Erfüllung ihrer Forderung gefährdet wird."
    },
    {
      "date": "2025-04-22",
      "id": "107086",
      "original_text": "Registerbekanntmachung nach dem Umwandlungsgesetz\nThüringen Amtsgericht Jena HRB 402719\nAgrar GmbH Küllstedt – Küllstedt",
      "type": "Registerbekanntmachung nach dem Umwandlungsgesetz",
      "state": "Thüringen",
      "amtsgericht": "Amtsgericht Jena",
      "registernummer": "HRB 402719",
      "registerart": "HRB",
      "company_name": "Agrar GmbH Küllstedt",
      "company_seat": "Küllstedt",
      "details": "22.04.2025 (Bekanntmachungsdatum)\n\nThüringen Amtsgericht Jena HRB 402719\nRegisterbekanntmachung nach dem Umwandlungsgesetz 22.04.2025 (Eintragungsdatum)\n\nAgrar GmbH Küllstedt\nGesellschaft mit beschränkter Haftung\nKüllstedt\n\nNicht eingetragen: Den Gläubigern der an der Verschmelzung beteiligten Rechtsträger, ist wenn sie binnen sechs Monaten nach dem Tag, an dem die Eintragung der Verschmelzung in das Register des Sitzes desjenigen Rechtsträgers, dessen Gläubiger sie sind,  nach § 19 Abs. 3 UmwG als bekanntgemacht gilt, ihren Anspruch nach Grund und Höhe schriftlich anmelden, Sicherheit zu leisten, soweit sie nicht Befriedigung verlangen können. Dieses Recht steht ihnen jedoch nur zu, wenn sie glaubhaft machen, daß durch die Verschmelzung die Erfüllung ihrer Forderung gefährdet wird."
    },
    {
      "date": "2025-04-22",
      "id": "107087",
      "original_text": "Registerbekanntmachung nach dem Umwandlungsgesetz\nHessen Amtsgericht Frankfurt am Main HRB 129116\nSchüßler-Plan infratec GmbH – Frankfurt am Main",
      "type": "Registerbekanntmachung nach dem Umwandlungsgesetz",
      "state": "Hessen",
      "amtsgericht": "Amtsgericht Frankfurt am Main",
      "registernummer": "HRB 129116",
      "registerart": "HRB",
      "company_name": "Schüßler-Plan infratec GmbH",
      "company_seat": "Frankfurt am Main",
      "details": "22.04.2025 (Bekanntmachungsdatum)\n\nHessen Amtsgericht Frankfurt am Main HRB 129116\nRegisterbekanntmachung nach dem Umwandlungsgesetz 22.04.2025 (Eintragungsdatum)\n\nSchüßler-Plan infratec GmbH\nGesellschaft mit beschränkter Haftung\nFrankfurt am Main\n\nDen Gläubigern der an der Verschmelzung beteiligten Rechtsträger ist, wenn sie binnen sechs Monaten nach dem Tag, an dem die Eintragung der Verschmelzung in das Register des Sitzes desjenigen Rechtsträgers, dessen Gläubiger sie sind, nach § 19 Absatz 3 UmwG bekannt gemacht worden ist, ihren Anspruch nach Grund und Höhe schriftlich anmelden, Sicherheit zu leisten, soweit sie nicht Befriedigung verlangen können. Dieses Recht steht den Gläubigern jedoch nur zu, wenn sie glaubhaft machen, dass durch die Verschmelzung die Erfüllung ihrer Forderung gefährdet wird."
    },
    {
      "date": "2025-04-22",
      "id": "107088",
      "original_text": "Löschungsankündigung\nHessen Amtsgericht Frankfurt am Main HRB 47861\nBDI Business Development International GmbH – Frankfurt am Main",
      "type": "Löschungsankündigung",
      "state": "Hessen",
      "amtsgericht": "Amtsgericht Frankfurt am Main",
      "registernummer": "HRB 47861",
      "registerart": "HRB",
      "company_name": "BDI Business Development International GmbH",
      "company_seat": "Frankfurt am Main",
      "details": "22.04.2025 (Bekanntmachungsdatum)\n\nHessen Amtsgericht Frankfurt am Main HRB 47861\nLöschungsankündigung\n\nBDI Business Development International GmbH\nGesellschaft mit beschränkter Haftung\nFrankfurt am Main\n\nEs ist beabsichtigt, die Gesellschaft wegen Vermögenslosigkeit gemäß § 394 FamFG von Amts wegen im Handelsregister zu löschen. Hiergegen kann innerhalb eines Monats nach dieser Veröffentlichung Widerspruch bei dem Amtsgericht Frankfurt am Main eingelegt werden."
    },
    {
      "date": "2025-04-22",
      "id": "107089",
      "original_text": "Löschungsankündigung\nHessen Amtsgericht Friedberg HRB 7094\nMeve Ltd. – Florstadt",
      "type": "Löschungsankündigung",
      "state": "Hessen",
      "amtsgericht": "Amtsgericht Friedberg",
      "registernummer": "HRB 7094",
      "registerart": "HRB",
      "company_name": "Meve Ltd.",
      "company_seat": "Florstadt",
      "details": "22.04.2025 (Bekanntmachungsdatum)\n\nHessen Amtsgericht Friedberg HRB 7094\nLöschungsankündigung\n\nMeve Ltd.\nRechtsform ausländischen Rechts HRB\nFlorstadt\n\nDas Registergericht beabsichtigt die im Handelsregister eingetragene Zweigniederlassung von Amts wegen nach § 395 FamFG zu löschen. Die Frist zur Erhebung eines Widerspruchs gegen die beabsichtigte Löschung wird auf 3 Monate festgesetzt."
    },
    {
      "date": "2025-04-22",
      "id": "107090",
      "original_text": "Registerbekanntmachung nach dem Umwandlungsgesetz\nHessen Amtsgericht Frankfurt am Main HRB 101387\nHofgut Liederbach Service GmbH – Liederbach",
      "type": "Registerbekanntmachung nach dem Umwandlungsgesetz",
      "state": "Hessen",
      "amtsgericht": "Amtsgericht Frankfurt am Main",
      "registernummer": "HRB 101387",
      "registerart": "HRB",
      "company_name": "Hofgut Liederbach Service GmbH",
      "company_seat": "Liederbach",
      "details": "22.04.2025 (Bekanntmachungsdatum)\n\nHessen Amtsgericht Frankfurt am Main HRB 101387\nRegisterbekanntmachung nach dem Umwandlungsgesetz 22.04.2025 (Eintragungsdatum)\n\nHofgut Liederbach Service GmbH\nGesellschaft mit beschränkter Haftung\nLiederbach\n\nDen Gläubigern der an der Verschmelzung beteiligten Rechtsträger ist, wenn sie binnen sechs Monaten nach dem Tag, an dem die Eintragung der Verschmelzung in das Register des Sitzes desjenigen Rechtsträgers, dessen Gläubiger sie sind, nach § 19 Absatz 3 UmwG bekannt gemacht worden ist, ihren Anspruch nach Grund und Höhe schriftlich anmelden, Sicherheit zu leisten, soweit sie nicht Befriedigung verlangen können. Dieses Recht steht den Gläubigern jedoch nur zu, wenn sie glaubhaft machen, dass durch die Verschmelzung die Erfüllung ihrer Forderung gefährdet wird."
    },
    {
      "date": "2025-04-22",
      "id": "107091",
      "original_text": "Registerbekanntmachung nach dem Umwandlungsgesetz\nHessen Amtsgericht Frankfurt am Main HRA 48268\nRHL Grundstücksverwaltungs-GmbH & Co KG – Liederbach",
      "type": "Registerbekanntmachung nach dem Umwandlungsgesetz",
      "state": "Hessen",
      "amtsgericht": "Amtsgericht Frankfurt am Main",
      "registernummer": "HRA 48268",
      "registerart": "HRA",
      "company_name": "RHL Grundstücksverwaltungs-GmbH & Co KG",
      "company_seat": "Liederbach",
      "details": "22.04.2025 (Bekanntmachungsdatum)\n\nHessen Amtsgericht Frankfurt am Main HRA 48268\nRegisterbekanntmachung nach dem Umwandlungsgesetz 22.04.2025 (Eintragungsdatum)\n\nRHL Grundstücksverwaltungs-GmbH & Co KG\nKommanditgesellschaft\nLiederbach\n\nDen Gläubigern der an der Verschmelzung beteiligten Rechtsträger ist, wenn sie binnen sechs Monaten nach dem Tag, an dem die Eintragung der Verschmelzung in das Register des Sitzes desjenigen Rechtsträgers, dessen Gläubiger sie sind, nach § 19 Absatz 3 UmwG bekannt gemacht worden ist, ihren Anspruch nach Grund und Höhe schriftlich anmelden, Sicherheit zu leisten, soweit sie nicht Befriedigung verlangen können. Dieses Recht steht den Gläubigern jedoch nur zu, wenn sie glaubhaft machen, dass durch die Verschmelzung die Erfüllung ihrer Forderung gefährdet wird."
    },
    {
      "date": "2025-04-22",
      "id": "107092",
      "original_text": "Löschungsankündigung\nHessen Amtsgericht Königstein HRB 10680\nHeld Dienstleistungs GmbH – Schwalbach am Taunus",
      "type": "Löschungsankündigung",
      "state": "Hessen",
      "amtsgericht": "Amtsgericht Königstein",
      "registernummer": "HRB 10680",
      "registerart": "HRB",
      "company_name": "Held Dienstleistungs GmbH",
      "company_seat": "Schwalbach am Taunus",
      "details": "22.04.2025 (Bekanntmachungsdatum)\n\nHessen Amtsgericht Königstein HRB 10680\nLöschungsankündigung\n\nHeld Dienstleistungs GmbH\nGesellschaft mit beschränkter Haftung\nSchwalbach am Taunus\n\nDas Registergericht beabsichtigt die im Handelsregister eingetragene Gesellschaft von Amts wegen nach § 394 FamFG zu löschen. Die Frist zur Erhebung eines Widerspruchs gegen die beabsichtigte Löschung wird auf 3 Monate festgesetzt."
    },
    {
      "date": "2025-04-22",
      "id": "107093",
      "original_text": "Sonstige Registerbekanntmachung\nHessen Amtsgericht Korbach HRB 2209\nTHE Konzept- und Beteiligungs-GmbH – Bad Arolsen",
      "type": "Sonstige Registerbekanntmachung",
      "state": "Hessen",
      "amtsgericht": "Amtsgericht Korbach",
      "registernummer": "HRB 2209",
      "registerart": "HRB",
      "company_name": "THE Konzept- und Beteiligungs-GmbH",
      "company_seat": "Bad Arolsen",
      "details": "22.04.2025 (Bekanntmachungsdatum)\n\nHessen Amtsgericht Korbach HRB 2209\nSonstige Registerbekanntmachung 22.04.2025 (Eintragungsdatum)\n\nTHE Konzept- und Beteiligungs-GmbH\nGesellschaft mit beschränkter Haftung\nBad Arolsen\n\nDie Gesellschaft hat Gläubigern, deren Forderungen vor dieser Bekanntmachung begründet worden sind, Sicherheit zu leisten, soweit sie nicht Befriedigung verlangen können, wenn sie sich binnen sechs Monaten nach dieser Bekanntmachung zu diesem Zweck melden."
    },
    {
      "date": "2025-04-22",
      "id": "107094",
      "original_text": "Löschungsankündigung\nHessen Amtsgericht Wiesbaden HRB 12270\nGerd Müller GmbH, Innen- und Außenputz – Wiesbaden",
      "type": "Löschungsankündigung",
      "state": "Hessen",
      "amtsgericht": "Amtsgericht Wiesbaden",
      "registernummer": "HRB 12270",
      "registerart": "HRB",
      "company_name": "Gerd Müller GmbH, Innen- und Außenputz",
      "company_seat": "Wiesbaden",
      "details": "22.04.2025 (Bekanntmachungsdatum)\n\nHessen Amtsgericht Wiesbaden HRB 12270\nLöschungsankündigung\n\nGerd Müller GmbH, Innen- und Außenputz\nGesellschaft mit beschränkter Haftung\nWiesbaden\n\nDas Registergericht beabsichtigt die im Handelsregister eingetragene Gesellschaft von Amts wegen nach § 394 FamFG zu löschen. Die Frist zur Erhebung eines Widerspruchs gegen die beabsichtigte Löschung wird auf 3 Monate festgesetzt."
    },
    {
      "date": "2025-04-22",
      "id": "107095",
      "original_text": "Löschungsankündigung\nHessen Amtsgericht Frankfurt am Main HRB 110428\nBox 44 Living GmbH – Frankfurt am Main",
      "type": "Löschungsankündigung",
      "state": "Hessen",
      "amtsgericht": "Amtsgericht Frankfurt am Main",
      "registernummer": "HRB 110428",
      "registerart": "HRB",
      "company_name": "Box 44 Living GmbH",
      "company_seat": "Frankfurt am Main",
      "details": "22.04.2025 (Bekanntmachungsdatum)\n\nHessen Amtsgericht Frankfurt am Main HRB 110428\nLöschungsankündigung\n\nBox 44 Living GmbH\nGesellschaft mit beschränkter Haftung\nFrankfurt am Main\n\nEs ist beabsichtig, die Gesellschaft wegen Vermögenslosigkeit gemäß § 394 FamFG von Amts wegen im Handelsregister zu löschen. Hiergegen kann innerhalb eines Zeitraums von 1 Monat nach dieser Veröffentlichung Widerspruch bei dem Amtsgericht Frankfurt am Main eingelegt werden."
    }
  ]
}