{
  "date": "2025-04-25",
  "date_of_scrape": "2025-05-31T06:58:28.088Z",
  "tool_version": "0.2.0",
  "number_of_announcements": 101,
  "announcements": [
    {
      "date": "2025-04-25",
      "id": "107337",
      "original_text": "Löschungsankündigung\nBayern Amtsgericht Regensburg HRB 19729\nKöstler Holding UG (haftungsbeschränkt) – Regensburg",
      "type": "Löschungsankündigung",
      "state": "Bayern",
      "amtsgericht": "Amtsgericht Regensburg",
      "registernummer": "HRB 19729",
      "registerart": "HRB",
      "company_name": "Köstler Holding UG (haftungsbeschränkt)",
      "company_seat": "Regensburg",
      "details": "25.04.2025 (Bekanntmachungsdatum)\n\nBayern Amtsgericht Regensburg HRB 19729\nLöschungsankündigung\n\nKöstler Holding UG (haftungsbeschränkt)\nGesellschaft mit beschränkter Haftung\nRegensburg\n\nDas Registergericht beabsichtigt, die im Handelsregister eingetragene Gesellschaft wegen Vermögenslosigkeit von Amts wegen nach § 394 FamFG zu löschen. Die Frist zur Erhebung eines Widerspruchs ist auf einen Monat festgesetzt."
    },
    {
      "date": "2025-04-25",
      "id": "107338",
      "original_text": "Einreichung neuer Dokumente\nBayern Amtsgericht München HRB 228434\nPlastic Omnium Automotive Exteriors GmbH – München",
      "type": "Einreichung neuer Dokumente",
      "state": "Bayern",
      "amtsgericht": "Amtsgericht München",
      "registernummer": "HRB 228434",
      "registerart": "HRB",
      "company_name": "Plastic Omnium Automotive Exteriors GmbH",
      "company_seat": "München",
      "details": "25.04.2025 (Bekanntmachungsdatum)\n\nBayern Amtsgericht München HRB 228434\nEinreichung neuer Dokumente\n\nPlastic Omnium Automotive Exteriors GmbH\nGesellschaft mit beschränkter Haftung\nMünchen\n\nDem Amtsgericht München -Registergericht- ist eine Liste der Mitglieder des Aufsichtsrats eingereicht worden, § 52 Abs. 3 S. 2 GmbHG."
    },
    {
      "date": "2025-04-25",
      "id": "107339",
      "original_text": "Registerbekanntmachung nach dem Umwandlungsgesetz\nBayern Amtsgericht Würzburg VR 1621\nUnterfränkischer Dart Verband (UDV) e.V. – Würzburg",
      "type": "Registerbekanntmachung nach dem Umwandlungsgesetz",
      "state": "Bayern",
      "amtsgericht": "Amtsgericht Würzburg",
      "registernummer": "VR 1621",
      "registerart": "VR",
      "company_name": "Unterfränkischer Dart Verband (UDV) e.V.",
      "company_seat": "Würzburg",
      "details": "25.04.2025 (Bekanntmachungsdatum)\n\nBayern Amtsgericht Würzburg VR 1621\nRegisterbekanntmachung nach dem Umwandlungsgesetz 24.04.2025 (Eintragungsdatum)\n\nUnterfränkischer Dart Verband (UDV) e.V.\neingetragener Verein\nWürzburg\n\nDen Gläubigern der an der Verschmelzung beteiligten Rechtsträger ist, wenn sie binnen sechs Monaten nach dem Tag, an dem die Eintragung der Verschmelzung in das Register des Sitzes desjenigen Rechtsträgers, dessen Gläubiger sie sind, nach § 19 Abs. 3 UmwG als bekannt gemacht gilt, ihren Anspruch nach Grund und Höhe in Textform anmelden, Sicherheit zu leisten, soweit sie nicht Befriedigung verlangen können. Dieses Recht steht den Gläubigern jedoch nur zu, wenn sie glaubhaft machen, dass durch die Verschmelzung die Erfüllung ihrer Forderung gefährdet wird."
    },
    {
      "date": "2025-04-25",
      "id": "107340",
      "original_text": "Löschungsankündigung\nBayern Amtsgericht Aschaffenburg HRB 14859\nDURMAZ Transport UG (haftungsbeschränkt) – Aschaffenburg",
      "type": "Löschungsankündigung",
      "state": "Bayern",
      "amtsgericht": "Amtsgericht Aschaffenburg",
      "registernummer": "HRB 14859",
      "registerart": "HRB",
      "company_name": "DURMAZ Transport UG (haftungsbeschränkt)",
      "company_seat": "Aschaffenburg",
      "details": "25.04.2025 (Bekanntmachungsdatum)\n\nBayern Amtsgericht Aschaffenburg HRB 14859\nLöschungsankündigung\n\nDURMAZ Transport UG (haftungsbeschränkt)\nGesellschaft mit beschränkter Haftung\nAschaffenburg\n\nDas Registergericht beabsichtigt, die im Handelsregister eingetragene Gesellschaft wegen Vermögenslosigkeit von Amts wegen nach § 394 FamFG zu löschen. Die Frist zur Erhebung eines Widerspruchs ist auf drei Monate festgesetzt."
    },
    {
      "date": "2025-04-25",
      "id": "107341",
      "original_text": "Löschungsankündigung\nBayern Amtsgericht München HRB 207861\nCenturion Computers GmbH – München",
      "type": "Löschungsankündigung",
      "state": "Bayern",
      "amtsgericht": "Amtsgericht München",
      "registernummer": "HRB 207861",
      "registerart": "HRB",
      "company_name": "Centurion Computers GmbH",
      "company_seat": "München",
      "details": "25.04.2025 (Bekanntmachungsdatum)\n\nBayern Amtsgericht München HRB 207861\nLöschungsankündigung 24.04.2025 (Eintragungsdatum)\n\nCenturion Computers GmbH\nGesellschaft mit beschränkter Haftung\nMünchen\n\nDas Registergericht beabsichtigt, die im Handelsregister eingetragene Gesellschaft wegen Vermögenslosigkeit von Amts wegen nach § 394 FamFG zu löschen. Die Frist zur Erhebung eines Widerspruchs ist auf drei Monate festgesetzt."
    },
    {
      "date": "2025-04-25",
      "id": "107342",
      "original_text": "Löschungsankündigung\nBayern Amtsgericht Ingolstadt HRB 8695\nBEE appliance GmbH – Beilngries",
      "type": "Löschungsankündigung",
      "state": "Bayern",
      "amtsgericht": "Amtsgericht Ingolstadt",
      "registernummer": "HRB 8695",
      "registerart": "HRB",
      "company_name": "BEE appliance GmbH",
      "company_seat": "Beilngries",
      "details": "25.04.2025 (Bekanntmachungsdatum)\n\nBayern Amtsgericht Ingolstadt HRB 8695\nLöschungsankündigung\n\nBEE appliance GmbH\nGesellschaft mit beschränkter Haftung\nBeilngries\n\nDas Registergericht beabsichtigt, die im Handelsregister eingetragene Gesellschaft wegen Vermögenslosigkeit von Amts wegen nach § 394 FamFG zu löschen. Die Frist zur Erhebung eines Widerspruchs ist auf einen Monat festgesetzt."
    },
    {
      "date": "2025-04-25",
      "id": "107343",
      "original_text": "Löschungsankündigung\nBayern Amtsgericht Kempten (Allgäu) HRB 13008\nSYRINX Components GmbH – Weißensberg",
      "type": "Löschungsankündigung",
      "state": "Bayern",
      "amtsgericht": "Amtsgericht Kempten (Allgäu)",
      "registernummer": "HRB 13008",
      "registerart": "HRB",
      "company_name": "SYRINX Components GmbH",
      "company_seat": "Weißensberg",
      "details": "25.04.2025 (Bekanntmachungsdatum)\n\nBayern Amtsgericht Kempten (Allgäu) HRB 13008\nLöschungsankündigung\n\nSYRINX Components GmbH\nGesellschaft mit beschränkter Haftung\nWeißensberg\n\nDas Registergericht beabsichtigt, die im Handelsregister eingetragene Gesellschaft wegen Vermögenslosigkeit von Amts wegen nach § 394 FamFG zu löschen. Die Frist zur Erhebung eines Widerspruchs ist auf einen Monat festgesetzt."
    },
    {
      "date": "2025-04-25",
      "id": "107344",
      "original_text": "Löschungsankündigung\nBayern Amtsgericht Aschaffenburg HRB 15127\nBrontox GmbH – Haibach",
      "type": "Löschungsankündigung",
      "state": "Bayern",
      "amtsgericht": "Amtsgericht Aschaffenburg",
      "registernummer": "HRB 15127",
      "registerart": "HRB",
      "company_name": "Brontox GmbH",
      "company_seat": "Haibach",
      "details": "25.04.2025 (Bekanntmachungsdatum)\n\nBayern Amtsgericht Aschaffenburg HRB 15127\nLöschungsankündigung\n\nBrontox GmbH\nGesellschaft mit beschränkter Haftung\nHaibach\n\nDas Registergericht beabsichtigt, die im Handelsregister eingetragene Gesellschaft wegen Vermögenslosigkeit von Amts wegen nach § 394 FamFG zu löschen. Die Frist zur Erhebung eines Widerspruchs ist auf drei Monate festgesetzt."
    },
    {
      "date": "2025-04-25",
      "id": "107345",
      "original_text": "Registerbekanntmachung nach dem Umwandlungsgesetz\nBayern Amtsgericht München HRB 189294\nAutohaus Kuttendreier GmbH – München",
      "type": "Registerbekanntmachung nach dem Umwandlungsgesetz",
      "state": "Bayern",
      "amtsgericht": "Amtsgericht München",
      "registernummer": "HRB 189294",
      "registerart": "HRB",
      "company_name": "Autohaus Kuttendreier GmbH",
      "company_seat": "München",
      "details": "25.04.2025 (Bekanntmachungsdatum)\n\nBayern Amtsgericht München HRB 189294\nRegisterbekanntmachung nach dem Umwandlungsgesetz 24.04.2025 (Eintragungsdatum)\n\nAutohaus Kuttendreier GmbH\nGesellschaft mit beschränkter Haftung\nMünchen\n\nDen Gläubigern der an der Verschmelzung beteiligten Rechtsträger ist, wenn sie binnen sechs Monaten nach dem Tag, an dem die Eintragung der Verschmelzung in das Register des Sitzes desjenigen Rechtsträgers, dessen Gläubiger sie sind, nach § 19 Abs. 3 UmwG als bekannt gemacht gilt, ihren Anspruch nach Grund und Höhe in Textform anmelden, Sicherheit zu leisten, soweit sie nicht Befriedigung verlangen können. Dieses Recht steht den Gläubigern jedoch nur zu, wenn sie glaubhaft machen, dass durch die Verschmelzung die Erfüllung ihrer Forderung gefährdet wird."
    },
    {
      "date": "2025-04-25",
      "id": "107346",
      "original_text": "Registerbekanntmachung nach dem Umwandlungsgesetz\nBayern Amtsgericht München HRB 242321\nJuno Therapeutics GmbH – München",
      "type": "Registerbekanntmachung nach dem Umwandlungsgesetz",
      "state": "Bayern",
      "amtsgericht": "Amtsgericht München",
      "registernummer": "HRB 242321",
      "registerart": "HRB",
      "company_name": "Juno Therapeutics GmbH",
      "company_seat": "München",
      "details": "25.04.2025 (Bekanntmachungsdatum)\n\nBayern Amtsgericht München HRB 242321\nRegisterbekanntmachung nach dem Umwandlungsgesetz 24.04.2025 (Eintragungsdatum)\n\nJuno Therapeutics GmbH\nGesellschaft mit beschränkter Haftung\nMünchen\n\nDen Gläubigern der an der Spaltung beteiligten Rechtsträger ist, wenn sie binnen sechs Monaten nach dem Tag, an dem die Eintragung der Spaltung in das Register des Sitzes desjenigen Rechtsträgers, dessen Gläubiger sie sind, nach §§ 125, 19 Abs. 3 UmwG als bekannt gemacht gilt, ihren Anspruch nach Grund und Höhe in Textform anmelden, Sicherheit zu leisten, soweit sie nicht Befriedigung verlangen können. Dieses Recht steht den Gläubigern jedoch nur zu, wenn sie glaubhaft machen, dass durch die Spaltung die Erfüllung ihrer Forderung gefährdet wird."
    },
    {
      "date": "2025-04-25",
      "id": "107347",
      "original_text": "Registerbekanntmachung nach dem Umwandlungsgesetz\nBayern Amtsgericht München HRB 294773\nSilk Road HoldCo GmbH – München",
      "type": "Registerbekanntmachung nach dem Umwandlungsgesetz",
      "state": "Bayern",
      "amtsgericht": "Amtsgericht München",
      "registernummer": "HRB 294773",
      "registerart": "HRB",
      "company_name": "Silk Road HoldCo GmbH",
      "company_seat": "München",
      "details": "25.04.2025 (Bekanntmachungsdatum)\n\nBayern Amtsgericht München HRB 294773\nRegisterbekanntmachung nach dem Umwandlungsgesetz 24.04.2025 (Eintragungsdatum)\n\nSilk Road HoldCo GmbH\nGesellschaft mit beschränkter Haftung\nMünchen\n\nDen Gläubigern der an der Verschmelzung beteiligten Rechtsträger ist, wenn sie binnen sechs Monaten nach dem Tag, an dem die Eintragung der Verschmelzung in das Register des Sitzes desjenigen Rechtsträgers, dessen Gläubiger sie sind, nach § 19 Abs. 3 UmwG als bekannt gemacht gilt, ihren Anspruch nach Grund und Höhe in Textform anmelden, Sicherheit zu leisten, soweit sie nicht Befriedigung verlangen können. Dieses Recht steht den Gläubigern jedoch nur zu, wenn sie glaubhaft machen, dass durch die Verschmelzung die Erfüllung ihrer Forderung gefährdet wird."
    },
    {
      "date": "2025-04-25",
      "id": "107348",
      "original_text": "Löschungsankündigung\nBayern Amtsgericht Bayreuth HRB 4460\nDK Metallbearbeitung GmbH – Goldkronach",
      "type": "Löschungsankündigung",
      "state": "Bayern",
      "amtsgericht": "Amtsgericht Bayreuth",
      "registernummer": "HRB 4460",
      "registerart": "HRB",
      "company_name": "DK Metallbearbeitung GmbH",
      "company_seat": "Goldkronach",
      "details": "25.04.2025 (Bekanntmachungsdatum)\n\nBayern Amtsgericht Bayreuth HRB 4460\nLöschungsankündigung\n\nDK Metallbearbeitung GmbH\nGesellschaft mit beschränkter Haftung\nGoldkronach\n\nDas Registergericht beabsichtigt, die im Handelsregister eingetragene Gesellschaft wegen Vermögenslosigkeit von Amts wegen nach § 394 FamFG zu löschen. Die Frist zur Erhebung eines Widerspruchs ist auf drei Monate festgesetzt."
    },
    {
      "date": "2025-04-25",
      "id": "107349",
      "original_text": "Einreichung neuer Dokumente\nBayern Amtsgericht München HRB 254403\nsdm SE – München",
      "type": "Einreichung neuer Dokumente",
      "state": "Bayern",
      "amtsgericht": "Amtsgericht München",
      "registernummer": "HRB 254403",
      "registerart": "HRB",
      "company_name": "sdm SE",
      "company_seat": "München",
      "details": "25.04.2025 (Bekanntmachungsdatum)\n\nBayern Amtsgericht München HRB 254403\nEinreichung neuer Dokumente\n\nsdm SE\nEuropäische Aktiengesellschaft (SE)\nMünchen\n\nDem Amtsgericht München -Registergericht- ist eine Liste der Mitglieder des Aufsichtsrats eingereicht worden, Art. 9 Abs. 1 Buchst. c (ii) SE-VO i.V.m. § 106 AktG."
    },
    {
      "date": "2025-04-25",
      "id": "107350",
      "original_text": "Löschungsankündigung\nBayern Amtsgericht München HRB 217960\nEmden GmbH – München",
      "type": "Löschungsankündigung",
      "state": "Bayern",
      "amtsgericht": "Amtsgericht München",
      "registernummer": "HRB 217960",
      "registerart": "HRB",
      "company_name": "Emden GmbH",
      "company_seat": "München",
      "details": "25.04.2025 (Bekanntmachungsdatum)\n\nBayern Amtsgericht München HRB 217960\nLöschungsankündigung 24.04.2025 (Eintragungsdatum)\n\nEmden GmbH\nGesellschaft mit beschränkter Haftung\nMünchen\n\nDas Registergericht beabsichtigt, die im Handelsregister eingetragene Gesellschaft wegen Vermögenslosigkeit von Amts wegen nach § 394 FamFG zu löschen. Die Frist zur Erhebung eines Widerspruchs ist auf drei Monate festgesetzt."
    },
    {
      "date": "2025-04-25",
      "id": "107351",
      "original_text": "Sonstige Registerbekanntmachung\nBayern Amtsgericht Regensburg HRB 13461\nVautron Rechenzentrum AG – Regensburg",
      "type": "Sonstige Registerbekanntmachung",
      "state": "Bayern",
      "amtsgericht": "Amtsgericht Regensburg",
      "registernummer": "HRB 13461",
      "registerart": "HRB",
      "company_name": "Vautron Rechenzentrum AG",
      "company_seat": "Regensburg",
      "details": "25.04.2025 (Bekanntmachungsdatum)\n\nBayern Amtsgericht Regensburg HRB 13461\nSonstige Registerbekanntmachung 24.04.2025 (Eintragungsdatum)\n\nVautron Rechenzentrum AG\nAktiengesellschaft\nRegensburg\n\nDen Gläubigern der Gesellschaft, deren Forderungen begründet worden sind, bevor die Eintragung des Beschlusses bekanntgemacht worden ist, ist, wenn sie sich binnen sechs Monaten nach der Bekanntmachung zu diesem Zweck melden, Sicherheit zu leisten, soweit sie nicht Befriedigung verlangen können. Das Recht, Sicherheitsleistung zu verlangen, steht Gläubigern nicht zu, die im Fall des Insolvenzverfahrens ein Recht auf vorzugsweise Befriedigung aus einer Deckungsmasse haben, die nach gesetzlicher Vorschrift zu ihrem Schutz errichtet und staatlich überwacht ist."
    },
    {
      "date": "2025-04-25",
      "id": "107352",
      "original_text": "Einreichung neuer Dokumente\nBayern Amtsgericht Fürth HRB 9523\nSpielvereinigung Greuther Fürth GmbH & Co. KGaA. – Fürth",
      "type": "Einreichung neuer Dokumente",
      "state": "Bayern",
      "amtsgericht": "Amtsgericht Fürth",
      "registernummer": "HRB 9523",
      "registerart": "HRB",
      "company_name": "Spielvereinigung Greuther Fürth GmbH & Co. KGaA.",
      "company_seat": "Fürth",
      "details": "25.04.2025 (Bekanntmachungsdatum)\n\nBayern Amtsgericht Fürth HRB 9523\nEinreichung neuer Dokumente\n\nSpielvereinigung Greuther Fürth GmbH & Co. KGaA.\nKommanditgesellschaft auf Aktien\nFürth\n\nDem Amtsgericht Fürth -Registergericht- ist eine Liste der Mitglieder des Aufsichtsrats eingereicht worden, §§ 278 Abs. 3, 106 AktG."
    },
    {
      "date": "2025-04-25",
      "id": "107353",
      "original_text": "Registerbekanntmachung nach dem Umwandlungsgesetz\nBayern Amtsgericht München HRB 221705\nCACEIS Fonds Service GmbH – München",
      "type": "Registerbekanntmachung nach dem Umwandlungsgesetz",
      "state": "Bayern",
      "amtsgericht": "Amtsgericht München",
      "registernummer": "HRB 221705",
      "registerart": "HRB",
      "company_name": "CACEIS Fonds Service GmbH",
      "company_seat": "München",
      "details": "25.04.2025 (Bekanntmachungsdatum)\n\nBayern Amtsgericht München HRB 221705\nRegisterbekanntmachung nach dem Umwandlungsgesetz\n\nCACEIS Fonds Service GmbH\nGesellschaft mit beschränkter Haftung\nMünchen\n\nEs wird darauf hingewiesen, dass ein Verschmelzungsplan oder sein Entwurf über eine grenzüberschreitende Verschmelzung auf die CACEIS Bank mit Sitz in Montrouge/Frankreich (Registre du Commerce et des Sociétés de Nanterre 692024722) (Société d´Exercice Libéral à Forme Anonyme - Gesellschaft zur Ausübung eines freien Berufs als Aktiengesellschaft nach französischem Recht) beim Handelsregister eingereicht worden ist.\nDie Anteilsinhaber, die Gläubiger sowie die zuständigen Betriebsräte der an der grenzüberschreitenden Verschmelzung beteiligten Gesellschaften oder, soweit es keinen Betriebsrat gibt, die Arbeitnehmer der an der grenzüberschreitenden Verschmelzung beteiligten Gesellschaften, können der jeweiligen Gesellschaft spätestens fünf Arbeitstage vor Beurkundung des Verschmelzungsplans Bemerkungen zum Verschmelzungsplan übermitteln."
    },
    {
      "date": "2025-04-25",
      "id": "107354",
      "original_text": "Einreichung neuer Dokumente\nBayern Amtsgericht Regensburg HRB 18679\nNeoPredics AG – Regensburg",
      "type": "Einreichung neuer Dokumente",
      "state": "Bayern",
      "amtsgericht": "Amtsgericht Regensburg",
      "registernummer": "HRB 18679",
      "registerart": "HRB",
      "company_name": "NeoPredics AG",
      "company_seat": "Regensburg",
      "details": "25.04.2025 (Bekanntmachungsdatum)\n\nBayern Amtsgericht Regensburg HRB 18679\nEinreichung neuer Dokumente 24.04.2025 (Eintragungsdatum)\n\nNeoPredics AG\nAktiengesellschaft\nRegensburg\n\nDem Amtsgericht Regensburg -Registergericht- ist eine Liste der Mitglieder des Aufsichtsrats eingereicht worden, § 106 AktG."
    },
    {
      "date": "2025-04-25",
      "id": "107355",
      "original_text": "Einreichung neuer Dokumente\nBayern Amtsgericht Traunstein HRB 22205\nROFA INDUSTRIAL AUTOMATION AG – Kolbermoor",
      "type": "Einreichung neuer Dokumente",
      "state": "Bayern",
      "amtsgericht": "Amtsgericht Traunstein",
      "registernummer": "HRB 22205",
      "registerart": "HRB",
      "company_name": "ROFA INDUSTRIAL AUTOMATION AG",
      "company_seat": "Kolbermoor",
      "details": "25.04.2025 (Bekanntmachungsdatum)\n\nBayern Amtsgericht Traunstein HRB 22205\nEinreichung neuer Dokumente\n\nROFA INDUSTRIAL AUTOMATION AG\nAktiengesellschaft\nKolbermoor\n\nDem Amtsgericht Traunstein -Registergericht- ist eine Liste der Mitglieder des Aufsichtsrats eingereicht worden, § 106 AktG."
    },
    {
      "date": "2025-04-25",
      "id": "107356",
      "original_text": "Registerbekanntmachung nach dem Umwandlungsgesetz\nBayern Amtsgericht München HRB 113308\nFsas Technologies GmbH – München",
      "type": "Registerbekanntmachung nach dem Umwandlungsgesetz",
      "state": "Bayern",
      "amtsgericht": "Amtsgericht München",
      "registernummer": "HRB 113308",
      "registerart": "HRB",
      "company_name": "Fsas Technologies GmbH",
      "company_seat": "München",
      "details": "25.04.2025 (Bekanntmachungsdatum)\n\nBayern Amtsgericht München HRB 113308\nRegisterbekanntmachung nach dem Umwandlungsgesetz 24.04.2025 (Eintragungsdatum)\n\nFsas Technologies GmbH\nGesellschaft mit beschränkter Haftung\nMünchen\n\nDen Gläubigern der an der Spaltung beteiligten Rechtsträger ist, wenn sie binnen sechs Monaten nach dem Tag, an dem die Eintragung der Spaltung in das Register des Sitzes desjenigen Rechtsträgers, dessen Gläubiger sie sind, nach §§ 125, 19 Abs. 3 UmwG als bekannt gemacht gilt, ihren Anspruch nach Grund und Höhe in Textform anmelden, Sicherheit zu leisten, soweit sie nicht Befriedigung verlangen können. Dieses Recht steht den Gläubigern jedoch nur zu, wenn sie glaubhaft machen, dass durch die Spaltung die Erfüllung ihrer Forderung gefährdet wird."
    },
    {
      "date": "2025-04-25",
      "id": "107357",
      "original_text": "Einreichung neuer Dokumente\nBayern Amtsgericht München HRB 268672\nALLES.AUTO AG – München",
      "type": "Einreichung neuer Dokumente",
      "state": "Bayern",
      "amtsgericht": "Amtsgericht München",
      "registernummer": "HRB 268672",
      "registerart": "HRB",
      "company_name": "ALLES.AUTO AG",
      "company_seat": "München",
      "details": "25.04.2025 (Bekanntmachungsdatum)\n\nBayern Amtsgericht München HRB 268672\nEinreichung neuer Dokumente\n\nALLES.AUTO AG\nAktiengesellschaft\nMünchen\n\nDem Amtsgericht München -Registergericht- ist eine Liste der Mitglieder des Aufsichtsrats eingereicht worden, § 106 AktG."
    },
    {
      "date": "2025-04-25",
      "id": "107358",
      "original_text": "Registerbekanntmachung nach dem Umwandlungsgesetz\nBayern Amtsgericht München HRB 242321\nJuno Therapeutics GmbH – München",
      "type": "Registerbekanntmachung nach dem Umwandlungsgesetz",
      "state": "Bayern",
      "amtsgericht": "Amtsgericht München",
      "registernummer": "HRB 242321",
      "registerart": "HRB",
      "company_name": "Juno Therapeutics GmbH",
      "company_seat": "München",
      "details": "25.04.2025 (Bekanntmachungsdatum)\n\nBayern Amtsgericht München HRB 242321\nRegisterbekanntmachung nach dem Umwandlungsgesetz 24.04.2025 (Eintragungsdatum)\n\nJuno Therapeutics GmbH\nGesellschaft mit beschränkter Haftung\nMünchen\n\nDen Gläubigern der an der Spaltung beteiligten Rechtsträger ist, wenn sie binnen sechs Monaten nach dem Tag, an dem die Eintragung der Spaltung in das Register des Sitzes desjenigen Rechtsträgers, dessen Gläubiger sie sind, nach §§ 125, 19 Abs. 3 UmwG als bekannt gemacht gilt, ihren Anspruch nach Grund und Höhe in Textform anmelden, Sicherheit zu leisten, soweit sie nicht Befriedigung verlangen können. Dieses Recht steht den Gläubigern jedoch nur zu, wenn sie glaubhaft machen, dass durch die Spaltung die Erfüllung ihrer Forderung gefährdet wird."
    },
    {
      "date": "2025-04-25",
      "id": "107359",
      "original_text": "Löschungsankündigung\nBayern Amtsgericht Kempten (Allgäu) HRB 15129\nHeba Verwaltungs GmbH – Kaufbeuren",
      "type": "Löschungsankündigung",
      "state": "Bayern",
      "amtsgericht": "Amtsgericht Kempten (Allgäu)",
      "registernummer": "HRB 15129",
      "registerart": "HRB",
      "company_name": "Heba Verwaltungs GmbH",
      "company_seat": "Kaufbeuren",
      "details": "25.04.2025 (Bekanntmachungsdatum)\n\nBayern Amtsgericht Kempten (Allgäu) HRB 15129\nLöschungsankündigung\n\nHeba Verwaltungs GmbH\nGesellschaft mit beschränkter Haftung\nKaufbeuren\n\nDas Registergericht beabsichtigt, die im Handelsregister eingetragene Gesellschaft wegen Vermögenslosigkeit von Amts wegen nach § 394 FamFG zu löschen. Die Frist zur Erhebung eines Widerspruchs ist auf einen Monat festgesetzt."
    },
    {
      "date": "2025-04-25",
      "id": "107360",
      "original_text": "Löschungsankündigung\nBayern Amtsgericht München HRB 220162\nBADU Verwaltungs GmbH – München",
      "type": "Löschungsankündigung",
      "state": "Bayern",
      "amtsgericht": "Amtsgericht München",
      "registernummer": "HRB 220162",
      "registerart": "HRB",
      "company_name": "BADU Verwaltungs GmbH",
      "company_seat": "München",
      "details": "25.04.2025 (Bekanntmachungsdatum)\n\nBayern Amtsgericht München HRB 220162\nLöschungsankündigung 24.04.2025 (Eintragungsdatum)\n\nBADU Verwaltungs GmbH\nGesellschaft mit beschränkter Haftung\nMünchen\n\nDas Registergericht beabsichtigt, die im Handelsregister eingetragene Gesellschaft wegen Vermögenslosigkeit von Amts wegen nach § 394 FamFG zu löschen. #insert(Text=\"zztb_V_Widerspruchsfrist\")"
    },
    {
      "date": "2025-04-25",
      "id": "107361",
      "original_text": "Registerbekanntmachung nach dem Umwandlungsgesetz\nBayern Amtsgericht Amberg VR 259\nDiakonisches Werk des Evangelisch-Lutherischen Dekanatsbezirkes Sulzbach-Rosenberg e.V. – Sulzbach-Rosenberg",
      "type": "Registerbekanntmachung nach dem Umwandlungsgesetz",
      "state": "Bayern",
      "amtsgericht": "Amtsgericht Amberg",
      "registernummer": "VR 259",
      "registerart": "VR",
      "company_name": "Diakonisches Werk des Evangelisch-Lutherischen Dekanatsbezirkes Sulzbach-Rosenberg e.V.",
      "company_seat": "Sulzbach-Rosenberg",
      "details": "25.04.2025 (Bekanntmachungsdatum)\n\nBayern Amtsgericht Amberg VR 259\nRegisterbekanntmachung nach dem Umwandlungsgesetz 24.04.2025 (Eintragungsdatum)\n\nDiakonisches Werk des Evangelisch-Lutherischen Dekanatsbezirkes Sulzbach-Rosenberg e.V.\neingetragener Verein\nSulzbach-Rosenberg\n\nDen Gläubigern des formwechselnden Rechtsträgers ist, wenn sie binnen sechs Monaten nach dem Tag, an dem die Eintragung des Formwechsels nach § 201 UmwG als bekannt gemacht gilt, ihren Anspruch nach Grund und Höhe in Textform anmelden, Sicherheit zu leisten, soweit sie nicht Befriedigung verlangen können. Dieses Recht steht den Gläubigern jedoch nur zu, wenn sie glaubhaft machen, dass durch den Formwechsel die Erfüllung ihrer Forderung gefährdet wird."
    },
    {
      "date": "2025-04-25",
      "id": "107362",
      "original_text": "Einreichung neuer Dokumente\nBayern Amtsgericht München HRB 214356\nGoldvertise Media GmbH – Unterföhring",
      "type": "Einreichung neuer Dokumente",
      "state": "Bayern",
      "amtsgericht": "Amtsgericht München",
      "registernummer": "HRB 214356",
      "registerart": "HRB",
      "company_name": "Goldvertise Media GmbH",
      "company_seat": "Unterföhring",
      "details": "25.04.2025 (Bekanntmachungsdatum)\n\nBayern Amtsgericht München HRB 214356\nEinreichung neuer Dokumente 24.04.2025 (Eintragungsdatum)\n\nGoldvertise Media GmbH\nGesellschaft mit beschränkter Haftung\nUnterföhring\n\nDem Amtsgericht München -Registergericht- ist eine Liste der Mitglieder des Aufsichtsrats eingereicht worden, § 52 Abs. 3 S. 2 GmbHG."
    },
    {
      "date": "2025-04-25",
      "id": "107363",
      "original_text": "Registerbekanntmachung nach dem Umwandlungsgesetz\nBayern Amtsgericht München HRB 168889\nConstantin Television GmbH – München",
      "type": "Registerbekanntmachung nach dem Umwandlungsgesetz",
      "state": "Bayern",
      "amtsgericht": "Amtsgericht München",
      "registernummer": "HRB 168889",
      "registerart": "HRB",
      "company_name": "Constantin Television GmbH",
      "company_seat": "München",
      "details": "25.04.2025 (Bekanntmachungsdatum)\n\nBayern Amtsgericht München HRB 168889\nRegisterbekanntmachung nach dem Umwandlungsgesetz 24.04.2025 (Eintragungsdatum)\n\nConstantin Television GmbH\nGesellschaft mit beschränkter Haftung\nMünchen\n\nDen Gläubigern der an der Verschmelzung beteiligten Rechtsträger ist, wenn sie binnen sechs Monaten nach dem Tag, an dem die Eintragung der Verschmelzung in das Register des Sitzes desjenigen Rechtsträgers, dessen Gläubiger sie sind, nach § 19 Abs. 3 UmwG als bekannt gemacht gilt, ihren Anspruch nach Grund und Höhe in Textform anmelden, Sicherheit zu leisten, soweit sie nicht Befriedigung verlangen können. Dieses Recht steht den Gläubigern jedoch nur zu, wenn sie glaubhaft machen, dass durch die Verschmelzung die Erfüllung ihrer Forderung gefährdet wird."
    },
    {
      "date": "2025-04-25",
      "id": "107364",
      "original_text": "Registerbekanntmachung nach dem Umwandlungsgesetz\nBayern Amtsgericht München HRB 189295\nAutomobilforum Kuttendreier GmbH – München",
      "type": "Registerbekanntmachung nach dem Umwandlungsgesetz",
      "state": "Bayern",
      "amtsgericht": "Amtsgericht München",
      "registernummer": "HRB 189295",
      "registerart": "HRB",
      "company_name": "Automobilforum Kuttendreier GmbH",
      "company_seat": "München",
      "details": "25.04.2025 (Bekanntmachungsdatum)\n\nBayern Amtsgericht München HRB 189295\nRegisterbekanntmachung nach dem Umwandlungsgesetz 24.04.2025 (Eintragungsdatum)\n\nAutomobilforum Kuttendreier GmbH\nGesellschaft mit beschränkter Haftung\nMünchen\n\nDen Gläubigern der an der Verschmelzung beteiligten Rechtsträger ist, wenn sie binnen sechs Monaten nach dem Tag, an dem die Eintragung der Verschmelzung in das Register des Sitzes desjenigen Rechtsträgers, dessen Gläubiger sie sind, nach § 19 Abs. 3 UmwG als bekannt gemacht gilt, ihren Anspruch nach Grund und Höhe in Textform anmelden, Sicherheit zu leisten, soweit sie nicht Befriedigung verlangen können. Dieses Recht steht den Gläubigern jedoch nur zu, wenn sie glaubhaft machen, dass durch die Verschmelzung die Erfüllung ihrer Forderung gefährdet wird."
    },
    {
      "date": "2025-04-25",
      "id": "107365",
      "original_text": "Löschungsankündigung\nBaden-Württemberg Amtsgericht Stuttgart HRB 778791\nT. I. P. GmbH – Böblingen",
      "type": "Löschungsankündigung",
      "state": "Baden-Württemberg",
      "amtsgericht": "Amtsgericht Stuttgart",
      "registernummer": "HRB 778791",
      "registerart": "HRB",
      "company_name": "T. I. P. GmbH",
      "company_seat": "Böblingen",
      "details": "25.04.2025 (Bekanntmachungsdatum)\n\nBaden-Württemberg Amtsgericht Stuttgart HRB 778791\nLöschungsankündigung\n\nT. I. P. GmbH\nGesellschaft mit beschränkter Haftung\nBöblingen\n\nAls nicht eingetragen wird bekanntgemacht:\nDas Gericht beabsichtigt, die Gesellschaft wegen Vermögenslosigkeit im Handelsregister von Amts wegen nach § 394 FamFG zu löschen. Die Frist zur Geltendmachung eines Widerspruchs gegen die beabsichtigte Löschung ist auf zwei Monate ab Veröffentlichung bestimmt."
    },
    {
      "date": "2025-04-25",
      "id": "107366",
      "original_text": "Registerbekanntmachung nach dem Umwandlungsgesetz\nBerlin Amtsgericht Berlin (Charlottenburg) HRB 47488\nBerlinerLuft. Holding GmbH – Berlin",
      "type": "Registerbekanntmachung nach dem Umwandlungsgesetz",
      "state": "Berlin",
      "amtsgericht": "Amtsgericht Berlin (Charlottenburg)",
      "registernummer": "HRB 47488",
      "registerart": "HRB",
      "company_name": "BerlinerLuft. Holding GmbH",
      "company_seat": "Berlin",
      "details": "25.04.2025 (Bekanntmachungsdatum)\n\nBerlin Amtsgericht Berlin (Charlottenburg) HRB 47488\nRegisterbekanntmachung nach dem Umwandlungsgesetz 22.04.2025 (Eintragungsdatum)\n\nBerlinerLuft. Holding GmbH\nGesellschaft mit beschränkter Haftung\nBerlin\n\nZu Eintragungsnummer 24 vom 22.04.2025 wird als nicht eingetragen veröffentlicht: Den Gläubigern der an der Verschmelzung beteiligten Rechtsträger ist, wenn sie binnen sechs Monaten nach dem Tag, an dem die Eintragung der Verschmelzung in das Register des Sitzes desjenigen Rechtsträgers, dessen Gläubiger sie sind, als bekannt gemacht gilt, ihren Anspruch nach Grund und Höhe schriftlich anmelden, Sicherheit zu leisten, soweit sie nicht Befriedigung verlangen können. Dieses Recht steht den Gläubigern jedoch nur zu, wenn sie glaubhaft machen, dass durch die Verschmelzung die Erfüllung ihrer Forderung gefährdet wird. Das Recht, Sicherheitsleistung zu verlangen, steht Gläubigern nicht zu, die im Falle der Insolvenz ein Recht auf vorzugsweise Befriedigung aus einer Deckungsmasse haben, die nach gesetzlicher Vorschrift zu ihrem Schutz errichtet und staatlich überwacht ist."
    },
    {
      "date": "2025-04-25",
      "id": "107367",
      "original_text": "Registerbekanntmachung nach dem Umwandlungsgesetz\nBerlin Amtsgericht Berlin (Charlottenburg) HRB 118887\nAAM Alpha Asset Management UG (haftungsbeschränkt) – Berlin",
      "type": "Registerbekanntmachung nach dem Umwandlungsgesetz",
      "state": "Berlin",
      "amtsgericht": "Amtsgericht Berlin (Charlottenburg)",
      "registernummer": "HRB 118887",
      "registerart": "HRB",
      "company_name": "AAM Alpha Asset Management UG (haftungsbeschränkt)",
      "company_seat": "Berlin",
      "details": "25.04.2025 (Bekanntmachungsdatum)\n\nBerlin Amtsgericht Berlin (Charlottenburg) HRB 118887\nRegisterbekanntmachung nach dem Umwandlungsgesetz 22.04.2025 (Eintragungsdatum)\n\nAAM Alpha Asset Management UG (haftungsbeschränkt)\nGesellschaft mit beschränkter Haftung\nBerlin\n\nZu Eintragungsnummer 4 vom 22.04.2025 wird als nicht eingetragen veröffentlicht: Den Gläubigern der an der Verschmelzung beteiligten Rechtsträger ist, wenn sie binnen sechs Monaten nach dem Tag, an dem die Eintragung der Verschmelzung in das Register des Sitzes desjenigen Rechtsträgers, dessen Gläubiger sie sind, als bekannt gemacht gilt, ihren Anspruch nach Grund und Höhe schriftlich anmelden, Sicherheit zu leisten, soweit sie nicht Befriedigung verlangen können. Dieses Recht steht den Gläubigern jedoch nur zu, wenn sie glaubhaft machen, dass durch die Verschmelzung die Erfüllung ihrer Forderung gefährdet wird. Das Recht, Sicherheitsleistung zu verlangen, steht Gläubigern nicht zu, die im Falle der Insolvenz ein Recht auf vorzugsweise Befriedigung aus einer Deckungsmasse haben, die nach gesetzlicher Vorschrift zu ihrem Schutz errichtet und staatlich überwacht ist."
    },
    {
      "date": "2025-04-25",
      "id": "107368",
      "original_text": "Löschungsankündigung\nMecklenburg-Vorpommern Amtsgericht Rostock HRB 11111\nCET - Central European Transportation GmbH – Rostock",
      "type": "Löschungsankündigung",
      "state": "Mecklenburg-Vorpommern",
      "amtsgericht": "Amtsgericht Rostock",
      "registernummer": "HRB 11111",
      "registerart": "HRB",
      "company_name": "CET - Central European Transportation GmbH",
      "company_seat": "Rostock",
      "details": "25.04.2025 (Bekanntmachungsdatum)\n\nMecklenburg-Vorpommern Amtsgericht Rostock HRB 11111\nLöschungsankündigung\n\nCET - Central European Transportation GmbH\nGesellschaft mit beschränkter Haftung\nRostock\n\nDas Registergericht beabsichtigt, die im Handelsregister eingetragene Gesellschaft von Amts wegen nach § 394 FamFG zu löschen. Die Frist zur Erhebung eines Widerspruchs gegen die beabsichtigte Löschung wird auf einen Monat festgesetzt."
    },
    {
      "date": "2025-04-25",
      "id": "107369",
      "original_text": "Einreichung neuer Dokumente\nBaden-Württemberg Amtsgericht Stuttgart HRB 3993\nPRÄSCHU Verpachtung GmbH – Stuttgart",
      "type": "Einreichung neuer Dokumente",
      "state": "Baden-Württemberg",
      "amtsgericht": "Amtsgericht Stuttgart",
      "registernummer": "HRB 3993",
      "registerart": "HRB",
      "company_name": "PRÄSCHU Verpachtung GmbH",
      "company_seat": "Stuttgart",
      "details": "25.04.2025 (Bekanntmachungsdatum)\n\nBaden-Württemberg Amtsgericht Stuttgart HRB 3993\nEinreichung neuer Dokumente\n\nPRÄSCHU Verpachtung GmbH\nGesellschaft mit beschränkter Haftung\nStuttgart\n\nDie Gesellschaft hat am 24.04.2025 die Liste über die Zusammensetzung des Aufsichtsrats zum Handelsregister eingereicht."
    },
    {
      "date": "2025-04-25",
      "id": "107370",
      "original_text": "Sonstige Registerbekanntmachung\nHamburg Amtsgericht Hamburg HRB 87975\nTÜV Hanse GmbH TÜV SÜD Gruppe – Hamburg",
      "type": "Sonstige Registerbekanntmachung",
      "state": "Hamburg",
      "amtsgericht": "Amtsgericht Hamburg",
      "registernummer": "HRB 87975",
      "registerart": "HRB",
      "company_name": "TÜV Hanse GmbH TÜV SÜD Gruppe",
      "company_seat": "Hamburg",
      "details": "25.04.2025 (Bekanntmachungsdatum)\n\nHamburg Amtsgericht Hamburg HRB 87975\nSonstige Registerbekanntmachung\n\nTÜV Hanse GmbH TÜV SÜD Gruppe\nGesellschaft mit beschränkter Haftung\nHamburg\n\nAls nicht eingetragen wird bekannt gemacht: Liste des Aufsichtsrats wurde eingereicht."
    },
    {
      "date": "2025-04-25",
      "id": "107371",
      "original_text": "Registerbekanntmachung nach dem Umwandlungsgesetz\nSachsen-Anhalt Amtsgericht Stendal HRA 608\nT.M.G. Furche GmbH & Co. KG – Salzwedel",
      "type": "Registerbekanntmachung nach dem Umwandlungsgesetz",
      "state": "Sachsen-Anhalt",
      "amtsgericht": "Amtsgericht Stendal",
      "registernummer": "HRA 608",
      "registerart": "HRA",
      "company_name": "T.M.G. Furche GmbH & Co. KG",
      "company_seat": "Salzwedel",
      "details": "25.04.2025 (Bekanntmachungsdatum)\n\nSachsen-Anhalt Amtsgericht Stendal HRA 608\nRegisterbekanntmachung nach dem Umwandlungsgesetz 25.04.2025 (Eintragungsdatum)\n\nT.M.G. Furche GmbH & Co. KG\nKommanditgesellschaft\nSalzwedel\n\nNicht eingetragen:\nDen Gläubigern der an der Verschmelzung beteiligten Rechtsträger ist, wenn sie binnen sechs Monaten nach dem Tag, an dem die Eintragung der Verschmelzung nach § 19 Abs. 3 UmwG als bekanntgemacht gilt, ihren Anspruch nach Grund und Höhe schriftlich anmelden, Sicherheit zu leisten, soweit sie nicht Befriedigung verlangen können. Dieses Recht steht ihnen jedoch nur zu, wenn sie glaubhaft machen, dass durch die Verschmelzung die Erfüllung ihrer Forderung gefährdet wird."
    },
    {
      "date": "2025-04-25",
      "id": "107372",
      "original_text": "Registerbekanntmachung nach dem Umwandlungsgesetz\nSachsen-Anhalt Amtsgericht Stendal HRA 297\nGünter Furche Fuhrunternehmen und Baggerbetrieb GmbH & Co. KG – Chüttlitz",
      "type": "Registerbekanntmachung nach dem Umwandlungsgesetz",
      "state": "Sachsen-Anhalt",
      "amtsgericht": "Amtsgericht Stendal",
      "registernummer": "HRA 297",
      "registerart": "HRA",
      "company_name": "Günter Furche Fuhrunternehmen und Baggerbetrieb GmbH & Co. KG",
      "company_seat": "Chüttlitz",
      "details": "25.04.2025 (Bekanntmachungsdatum)\n\nSachsen-Anhalt Amtsgericht Stendal HRA 297\nRegisterbekanntmachung nach dem Umwandlungsgesetz 25.04.2025 (Eintragungsdatum)\n\nGünter Furche Fuhrunternehmen und Baggerbetrieb GmbH & Co. KG\nKommanditgesellschaft\nChüttlitz\n\nNicht eingetragen:\nDen Gläubigern der an der Verschmelzung beteiligten Rechtsträger ist, wenn sie binnen sechs Monaten nach dem Tag, an dem die Eintragung der Verschmelzung nach § 19 Abs. 3 UmwG als bekanntgemacht gilt, ihren Anspruch nach Grund und Höhe schriftlich anmelden, Sicherheit zu leisten, soweit sie nicht Befriedigung verlangen können. Dieses Recht steht ihnen jedoch nur zu, wenn sie glaubhaft machen, dass durch die Verschmelzung die Erfüllung ihrer Forderung gefährdet wird."
    },
    {
      "date": "2025-04-25",
      "id": "107373",
      "original_text": "Löschungsankündigung\nBerlin Amtsgericht Berlin (Charlottenburg) HRB 217196\nAH Boutique Logistik GmbH – Berlin",
      "type": "Löschungsankündigung",
      "state": "Berlin",
      "amtsgericht": "Amtsgericht Berlin (Charlottenburg)",
      "registernummer": "HRB 217196",
      "registerart": "HRB",
      "company_name": "AH Boutique Logistik GmbH",
      "company_seat": "Berlin",
      "details": "25.04.2025 (Bekanntmachungsdatum)\n\nBerlin Amtsgericht Berlin (Charlottenburg) HRB 217196\nLöschungsankündigung\n\nAH Boutique Logistik GmbH\nGesellschaft mit beschränkter Haftung\nBerlin\n\nBei der nachstehenden Gesellschaft wird das Amtslöschungsverfahren gemäß § 394 FamFG eingeleitet. Widerspruchsfrist 6 Wochen"
    },
    {
      "date": "2025-04-25",
      "id": "107374",
      "original_text": "Löschungsankündigung\nSachsen-Anhalt Amtsgericht Stendal HRB 28703\nB.G.K Bundesgüter Kraftverkehr GmbH – Magdeburg",
      "type": "Löschungsankündigung",
      "state": "Sachsen-Anhalt",
      "amtsgericht": "Amtsgericht Stendal",
      "registernummer": "HRB 28703",
      "registerart": "HRB",
      "company_name": "B.G.K Bundesgüter Kraftverkehr GmbH",
      "company_seat": "Magdeburg",
      "details": "25.04.2025 (Bekanntmachungsdatum)\n\nSachsen-Anhalt Amtsgericht Stendal HRB 28703\nLöschungsankündigung\n\nB.G.K Bundesgüter Kraftverkehr GmbH\nGesellschaft mit beschränkter Haftung\nMagdeburg\n\nDas Registergericht beabsichtigt, nachfolgende Gesellschaften wegen Vermögenslosigkeit von Amts wegen nach § 394 FamFG zu löschen. Die Frist zur Erhebung eines Widerspruchs gegen die beabsichtigte Löschung wird auf drei Monate festgesetzt."
    },
    {
      "date": "2025-04-25",
      "id": "107375",
      "original_text": "Registerbekanntmachung nach dem Umwandlungsgesetz\nSachsen-Anhalt Amtsgericht Stendal HRA 8143\nPflegedienst Alina Stefan e.Kfr. – Bitterfeld-Wolfen",
      "type": "Registerbekanntmachung nach dem Umwandlungsgesetz",
      "state": "Sachsen-Anhalt",
      "amtsgericht": "Amtsgericht Stendal",
      "registernummer": "HRA 8143",
      "registerart": "HRA",
      "company_name": "Pflegedienst Alina Stefan e.Kfr.",
      "company_seat": "Bitterfeld-Wolfen",
      "details": "25.04.2025 (Bekanntmachungsdatum)\n\nSachsen-Anhalt Amtsgericht Stendal HRA 8143\nRegisterbekanntmachung nach dem Umwandlungsgesetz 25.04.2025 (Eintragungsdatum)\n\nPflegedienst Alina Stefan e.Kfr.\nEinzelkaufmann / Einzelkauffrau\nBitterfeld-Wolfen\n\nNicht eingetragen:\nDen Gläubigern der an der Ausgliederung beteiligten Rechtsträger, ist wenn sie binnen sechs Monaten nach dem Tag, an dem die Eintragung der Ausgliederung nach §§125, 19 Abs. 3 UmwG als bekanntgemacht gilt, ihren Anspruch nach Grund und Höhe schriftlich anmelden, Sicherheit zu leisten, soweit sie nicht Befriedigung verlangen können. Diese Recht steht ihnen jedoch nur zu, wenn sie glaubhaft machen, dass durch die Ausgliederung die Erfüllung ihrer Forderung gefährdet wird."
    },
    {
      "date": "2025-04-25",
      "id": "107376",
      "original_text": "Sonstige Registerbekanntmachung\nMecklenburg-Vorpommern Amtsgericht Rostock HRB 3756\nStadtwerke Güstrow GmbH – Güstrow",
      "type": "Sonstige Registerbekanntmachung",
      "state": "Mecklenburg-Vorpommern",
      "amtsgericht": "Amtsgericht Rostock",
      "registernummer": "HRB 3756",
      "registerart": "HRB",
      "company_name": "Stadtwerke Güstrow GmbH",
      "company_seat": "Güstrow",
      "details": "25.04.2025 (Bekanntmachungsdatum)\n\nMecklenburg-Vorpommern Amtsgericht Rostock HRB 3756\nSonstige Registerbekanntmachung\n\nStadtwerke Güstrow GmbH\nGesellschaft mit beschränkter Haftung\nGüstrow\n\nEine Liste der Mitglieder des Aufsichtsrats ist zum Handelsregister eingereicht worden."
    },
    {
      "date": "2025-04-25",
      "id": "107377",
      "original_text": "Sonstige Registerbekanntmachung\nHamburg Amtsgericht Hamburg HRB 59378\nCarlsberg Supply Company Deutschland GmbH – Hamburg",
      "type": "Sonstige Registerbekanntmachung",
      "state": "Hamburg",
      "amtsgericht": "Amtsgericht Hamburg",
      "registernummer": "HRB 59378",
      "registerart": "HRB",
      "company_name": "Carlsberg Supply Company Deutschland GmbH",
      "company_seat": "Hamburg",
      "details": "25.04.2025 (Bekanntmachungsdatum)\n\nHamburg Amtsgericht Hamburg HRB 59378\nSonstige Registerbekanntmachung\n\nCarlsberg Supply Company Deutschland GmbH\nGesellschaft mit beschränkter Haftung\nHamburg\n\nAls nicht eingetragen wird bekannt gemacht: Liste des Aufsichtsrats wurde eingereicht."
    },
    {
      "date": "2025-04-25",
      "id": "107378",
      "original_text": "Löschungsankündigung\nBrandenburg Amtsgericht Potsdam HRB 17848\nApel Catering GmbH – Hohenseefeld",
      "type": "Löschungsankündigung",
      "state": "Brandenburg",
      "amtsgericht": "Amtsgericht Potsdam",
      "registernummer": "HRB 17848",
      "registerart": "HRB",
      "company_name": "Apel Catering GmbH",
      "company_seat": "Hohenseefeld",
      "details": "25.04.2025 (Bekanntmachungsdatum)\n\nBrandenburg Amtsgericht Potsdam HRB 17848\nLöschungsankündigung\n\nApel Catering GmbH\nGesellschaft mit beschränkter Haftung\nHohenseefeld\n\nBei der nachstehenden Gesellschaft wird das Amtslöschungsverfahren gemäß § 394 FamFG eingeleitet. Widerspruchsfrist: 8 Wochen."
    },
    {
      "date": "2025-04-25",
      "id": "107379",
      "original_text": "Registerbekanntmachung nach dem Umwandlungsgesetz\nHamburg Amtsgericht Hamburg HRB 168273\nRamboll Deutschland GmbH – Hamburg",
      "type": "Registerbekanntmachung nach dem Umwandlungsgesetz",
      "state": "Hamburg",
      "amtsgericht": "Amtsgericht Hamburg",
      "registernummer": "HRB 168273",
      "registerart": "HRB",
      "company_name": "Ramboll Deutschland GmbH",
      "company_seat": "Hamburg",
      "details": "25.04.2025 (Bekanntmachungsdatum)\n\nHamburg Amtsgericht Hamburg HRB 168273\nRegisterbekanntmachung nach dem Umwandlungsgesetz 25.04.2025 (Eintragungsdatum)\n\nRamboll Deutschland GmbH\nGesellschaft mit beschränkter Haftung\nHamburg\n\nAls nicht eingetragen wird bekannt gemacht:\nDen Gläubigern der an der Verschmelzung beteiligten Gesellschaften ist, wenn sie binnen sechs Monaten nach dem Tag, an dem die Eintragung der Verschmelzung in das Register des Sitzes desjenigen Rechtsträgers, dessen Gläubiger sie sind, nach § 19 Absatz 3 UmwG als bekannt gemacht gilt, ihren Anspruch nach Grund und Höhe schriftlich anmelden, Sicherheit zu leisten, soweit sie nicht Befriedigung verlangen können. Dieses Recht steht den Gläubigern jedoch nur zu, wenn sie glaubhaft machen, dass durch die Verschmelzung die Erfüllung ihrer Forderung gefährdet wird."
    },
    {
      "date": "2025-04-25",
      "id": "107380",
      "original_text": "Registerbekanntmachung nach dem Umwandlungsgesetz\nHamburg Amtsgericht Hamburg HRB 112254\nK2 Management GmbH – Hamburg",
      "type": "Registerbekanntmachung nach dem Umwandlungsgesetz",
      "state": "Hamburg",
      "amtsgericht": "Amtsgericht Hamburg",
      "registernummer": "HRB 112254",
      "registerart": "HRB",
      "company_name": "K2 Management GmbH",
      "company_seat": "Hamburg",
      "details": "25.04.2025 (Bekanntmachungsdatum)\n\nHamburg Amtsgericht Hamburg HRB 112254\nRegisterbekanntmachung nach dem Umwandlungsgesetz 25.04.2025 (Eintragungsdatum)\n\nK2 Management GmbH\nGesellschaft mit beschränkter Haftung\nHamburg\n\nAls nicht eingetragen wird bekannt gemacht:\nDen Gläubigern der an der Verschmelzung beteiligten Gesellschaften ist, wenn sie binnen sechs Monaten nach dem Tag, an dem die Eintragung der Verschmelzung in das Register des Sitzes desjenigen Rechtsträgers, dessen Gläubiger sie sind, nach § 19 Absatz 3 UmwG als bekannt gemacht gilt, ihren Anspruch nach Grund und Höhe schriftlich anmelden, Sicherheit zu leisten, soweit sie nicht Befriedigung verlangen können. Dieses Recht steht den Gläubigern jedoch nur zu, wenn sie glaubhaft machen, dass durch die Verschmelzung die Erfüllung ihrer Forderung gefährdet wird."
    },
    {
      "date": "2025-04-25",
      "id": "107381",
      "original_text": "Einreichung neuer Dokumente\nBrandenburg Amtsgericht Frankfurt/Oder HRB 21082\nESTARA AG – Ahrensfelde",
      "type": "Einreichung neuer Dokumente",
      "state": "Brandenburg",
      "amtsgericht": "Amtsgericht Frankfurt/Oder",
      "registernummer": "HRB 21082",
      "registerart": "HRB",
      "company_name": "ESTARA AG",
      "company_seat": "Ahrensfelde",
      "details": "25.04.2025 (Bekanntmachungsdatum)\n\nBrandenburg Amtsgericht Frankfurt/Oder HRB 21082\nEinreichung neuer Dokumente\n\nESTARA AG\nAktiengesellschaft\nAhrensfelde\n\nAls nicht eingetragen wird veröffentlicht:  Die Gesellschaft hat Änderungen in der Zusammensetzung des Aufsichtsrates bekannt gegeben."
    },
    {
      "date": "2025-04-25",
      "id": "107382",
      "original_text": "Registerbekanntmachung nach dem Umwandlungsgesetz\nHamburg Amtsgericht Hamburg HRA 112301\nGrundstücksbeteiligungsgesellschaft Hamburger Senioren Domizile mbH & Co. KG – Hamburg",
      "type": "Registerbekanntmachung nach dem Umwandlungsgesetz",
      "state": "Hamburg",
      "amtsgericht": "Amtsgericht Hamburg",
      "registernummer": "HRA 112301",
      "registerart": "HRA",
      "company_name": "Grundstücksbeteiligungsgesellschaft Hamburger Senioren Domizile mbH & Co. KG",
      "company_seat": "Hamburg",
      "details": "25.04.2025 (Bekanntmachungsdatum)\n\nHamburg Amtsgericht Hamburg HRA 112301\nRegisterbekanntmachung nach dem Umwandlungsgesetz 25.04.2025 (Eintragungsdatum)\n\nGrundstücksbeteiligungsgesellschaft Hamburger Senioren Domizile mbH & Co. KG\nKommanditgesellschaft\nHamburg\n\nAls nicht eingetragen wird bekannt gemacht:\nDen Gläubigern der an der Verschmelzung beteiligten Gesellschaften ist, wenn sie binnen sechs Monaten nach dem Tag, an dem die Eintragung der Verschmelzung in das Register des Sitzes desjenigen Rechtsträgers, dessen Gläubiger sie sind, nach § 19 Absatz 3 UmwG als bekannt gemacht gilt, ihren Anspruch nach Grund und Höhe schriftlich anmelden, Sicherheit zu leisten, soweit sie nicht Befriedigung verlangen können. Dieses Recht steht den Gläubigern jedoch nur zu, wenn sie glaubhaft machen, dass durch die Verschmelzung die Erfüllung ihrer Forderung gefährdet wird."
    },
    {
      "date": "2025-04-25",
      "id": "107383",
      "original_text": "Registerbekanntmachung nach dem Umwandlungsgesetz\nBaden-Württemberg Amtsgericht Mannheim HRB 733123\nPedalcargo GmbH – Mannheim",
      "type": "Registerbekanntmachung nach dem Umwandlungsgesetz",
      "state": "Baden-Württemberg",
      "amtsgericht": "Amtsgericht Mannheim",
      "registernummer": "HRB 733123",
      "registerart": "HRB",
      "company_name": "Pedalcargo GmbH",
      "company_seat": "Mannheim",
      "details": "25.04.2025 (Bekanntmachungsdatum)\n\nBaden-Württemberg Amtsgericht Mannheim HRB 733123\nRegisterbekanntmachung nach dem Umwandlungsgesetz 25.04.2025 (Eintragungsdatum)\n\nPedalcargo GmbH\nGesellschaft mit beschränkter Haftung\nMannheim\n\nDen Gläubigern der an der Ausgliederung beteiligten Rechtsträger ist, wenn sie binnen sechs Monaten nach dem Tag, an dem die Eintragung der Ausgliederung in das Register des Sitzes desjenigen Rechtsträgers, dessen Gläubiger sie sind, nach § 19 Abs. 3 UmwG als bekanntgemacht gilt, ihren Anspruch nach Grund und Höhe schriftlich anmelden, Sicherheit zu leisten, soweit sie nicht Befriedigung verlangen können. Dieses Recht steht den Gläubigern jedoch nur zu, wenn sie glaubhaft machen, dass durch die Ausgliederung die Erfüllung ihrer Forderung gefährdet wird."
    },
    {
      "date": "2025-04-25",
      "id": "107384",
      "original_text": "Registerbekanntmachung nach dem Umwandlungsgesetz\nHamburg Amtsgericht Hamburg HRB 42045\nVerwaltung Reichsbahnstraße Grundstücksgesellschaft mbH – Hamburg",
      "type": "Registerbekanntmachung nach dem Umwandlungsgesetz",
      "state": "Hamburg",
      "amtsgericht": "Amtsgericht Hamburg",
      "registernummer": "HRB 42045",
      "registerart": "HRB",
      "company_name": "Verwaltung Reichsbahnstraße Grundstücksgesellschaft mbH",
      "company_seat": "Hamburg",
      "details": "25.04.2025 (Bekanntmachungsdatum)\n\nHamburg Amtsgericht Hamburg HRB 42045\nRegisterbekanntmachung nach dem Umwandlungsgesetz 25.04.2025 (Eintragungsdatum)\n\nVerwaltung Reichsbahnstraße Grundstücksgesellschaft mbH\nGesellschaft mit beschränkter Haftung\nHamburg\n\nAls nicht eingetragen wird bekannt gemacht:\nDen Gläubigern der an der Verschmelzung beteiligten Gesellschaften ist, wenn sie binnen sechs Monaten nach dem Tag, an dem die Eintragung der Verschmelzung in das Register des Sitzes desjenigen Rechtsträgers, dessen Gläubiger sie sind, nach § 19 Absatz 3 UmwG als bekannt gemacht gilt, ihren Anspruch nach Grund und Höhe schriftlich anmelden, Sicherheit zu leisten, soweit sie nicht Befriedigung verlangen können. Dieses Recht steht den Gläubigern jedoch nur zu, wenn sie glaubhaft machen, dass durch die Verschmelzung die Erfüllung ihrer Forderung gefährdet wird."
    },
    {
      "date": "2025-04-25",
      "id": "107385",
      "original_text": "Registerbekanntmachung nach dem Umwandlungsgesetz\nBaden-Württemberg Amtsgericht Mannheim HRA 712554\nLastenbyke - Fahrrad und Sportartikel Verkauf und Verleih Schmellenkamp e.K. – Mannheim",
      "type": "Registerbekanntmachung nach dem Umwandlungsgesetz",
      "state": "Baden-Württemberg",
      "amtsgericht": "Amtsgericht Mannheim",
      "registernummer": "HRA 712554",
      "registerart": "HRA",
      "company_name": "Lastenbyke - Fahrrad und Sportartikel Verkauf und Verleih Schmellenkamp e.K.",
      "company_seat": "Mannheim",
      "details": "25.04.2025 (Bekanntmachungsdatum)\n\nBaden-Württemberg Amtsgericht Mannheim HRA 712554\nRegisterbekanntmachung nach dem Umwandlungsgesetz 25.04.2025 (Eintragungsdatum)\n\nLastenbyke - Fahrrad und Sportartikel Verkauf und Verleih Schmellenkamp e.K.\nEinzelkaufmann / Einzelkauffrau\nMannheim\n\nAls nicht eingetragen wird bekanntgemacht: Den Gläubigern der an der Verschmelzung beteiligten Rechtsträger ist, wenn sie binnen sechs Monaten nach dem Tag, an dem die Eintragung der Verschmelzung in das Register des Sitzes desjenigen Rechtsträgers, dessen Gläubiger sie sind, nach § 19 Abs. 3 UmwG als bekanntgemacht gilt, ihren Anspruch nach Grund und Höhe schriftlich anmelden, Sicherheit zu leisten, soweit sie nicht Befriedigung verlangen können. Dieses Recht steht den Gläubigern jedoch nur zu, wenn sie glaubhaft machen, dass durch die Verschmelzung die Erfüllung ihrer Forderung gefährdet wird."
    },
    {
      "date": "2025-04-25",
      "id": "107386",
      "original_text": "Registerbekanntmachung nach dem Umwandlungsgesetz\nBerlin Amtsgericht Berlin (Charlottenburg) HRB 240598\nAudioRent Clair GmbH – Berlin",
      "type": "Registerbekanntmachung nach dem Umwandlungsgesetz",
      "state": "Berlin",
      "amtsgericht": "Amtsgericht Berlin (Charlottenburg)",
      "registernummer": "HRB 240598",
      "registerart": "HRB",
      "company_name": "AudioRent Clair GmbH",
      "company_seat": "Berlin",
      "details": "25.04.2025 (Bekanntmachungsdatum)\n\nBerlin Amtsgericht Berlin (Charlottenburg) HRB 240598\nRegisterbekanntmachung nach dem Umwandlungsgesetz 25.04.2025 (Eintragungsdatum)\n\nAudioRent Clair GmbH\nGesellschaft mit beschränkter Haftung\nBerlin\n\nZu Eintragungsnummer 2 vom 25.04.2025 wird als nicht eingetragen veröffentlicht: Den Gläubigern der an der Verschmelzung beteiligten Rechtsträger ist, wenn sie binnen sechs Monaten nach dem Tag, an dem die Eintragung der Verschmelzung in das Register des Sitzes desjenigen Rechtsträgers, dessen Gläubiger sie sind, als bekannt gemacht gilt, ihren Anspruch nach Grund und Höhe schriftlich anmelden, Sicherheit zu leisten, soweit sie nicht Befriedigung verlangen können. Dieses Recht steht den Gläubigern jedoch nur zu, wenn sie glaubhaft machen, dass durch die Verschmelzung die Erfüllung ihrer Forderung gefährdet wird. Das Recht, Sicherheitsleistung zu verlangen, steht Gläubigern nicht zu, die im Falle der Insolvenz ein Recht auf vorzugsweise Befriedigung aus einer Deckungsmasse haben, die nach gesetzlicher Vorschrift zu ihrem Schutz errichtet und staatlich überwacht ist."
    },
    {
      "date": "2025-04-25",
      "id": "107387",
      "original_text": "Registerbekanntmachung nach dem Umwandlungsgesetz\nNordrhein-Westfalen Amtsgericht Coesfeld HRA 10096\nLisa Schlütter PeopleFirst e.K. – Bocholt",
      "type": "Registerbekanntmachung nach dem Umwandlungsgesetz",
      "state": "Nordrhein-Westfalen",
      "amtsgericht": "Amtsgericht Coesfeld",
      "registernummer": "HRA 10096",
      "registerart": "HRA",
      "company_name": "Lisa Schlütter PeopleFirst e.K.",
      "company_seat": "Bocholt",
      "details": "25.04.2025 (Bekanntmachungsdatum)\n\nNordrhein-Westfalen Amtsgericht Coesfeld HRA 10096\nRegisterbekanntmachung nach dem Umwandlungsgesetz 25.04.2025 (Eintragungsdatum)\n\nLisa Schlütter PeopleFirst e.K.\nEinzelkaufmann\nBocholt\n\nDen Gläubigern der an der Ausgliederung beteiligten Rechtsträger ist, wenn sie binnen sechs Monaten nach dem Tag, an dem die Eintragung der Ausgliederung in das Register des Sitzes desjenigen Rechtsträgers, dessen Gläubiger sie sind, nach § 19 Absatz 3 UmwG als bekanntgemacht gilt, ihren Anspruch nach Grund und Höhe schriftlich anmelden, Sicherheit zu leisten, soweit sie nicht Befriedigung verlangen können. Dieses Recht steht den Gläubigern jedoch nur zu, wenn sie glaubhaft machen, dass durch die Ausgliederung die Erfüllung ihrer Forderung gefährdet wird."
    },
    {
      "date": "2025-04-25",
      "id": "107388",
      "original_text": "Registerbekanntmachung nach dem Umwandlungsgesetz\nBaden-Württemberg Amtsgericht Freiburg HRB 713958\nconsus.health GmbH – Freiburg im Breisgau",
      "type": "Registerbekanntmachung nach dem Umwandlungsgesetz",
      "state": "Baden-Württemberg",
      "amtsgericht": "Amtsgericht Freiburg",
      "registernummer": "HRB 713958",
      "registerart": "HRB",
      "company_name": "consus.health GmbH",
      "company_seat": "Freiburg im Breisgau",
      "details": "25.04.2025 (Bekanntmachungsdatum)\n\nBaden-Württemberg Amtsgericht Freiburg HRB 713958\nRegisterbekanntmachung nach dem Umwandlungsgesetz 25.04.2025 (Eintragungsdatum)\n\nconsus.health GmbH\nGesellschaft mit beschränkter Haftung\nFreiburg im Breisgau\n\nDie Gesellschaft ist aufgrund Vertrag und Beschlüssen vom 22.04.2025 auf die \"Accenture GmbH\" (Amtsgericht Königstein im Taunus, HRB 5920) verschmolzen. Den Gläubigern der an der Verschmelzung beteiligten Rechtsträger ist, wenn sie binnen sechs Monaten nach dem Tag, an dem die Eintragung der Verschmelzung in das Register des Sitzes desjenigen Rechtsträgers, dessen Gläubiger sie sind, nach § 19 Abs. 3 UmwG als bekanntgemacht gilt, ihren Anspruch nach Grund und Höhe schriftlich anmelden, Sicherheit zu leisten, soweit sie nicht Befriedigung verlangen können. Dieses Recht steht den Gläubigern jedoch nur zu, wenn sie glaubhaft machen, dass durch die Verschmelzung die Erfüllung ihrer Forderung gefährdet wird."
    },
    {
      "date": "2025-04-25",
      "id": "107389",
      "original_text": "Registerbekanntmachung nach dem Umwandlungsgesetz\nThüringen Amtsgericht Jena HRB 401102\nLandwirtschaft-Niederdorla GmbH – Vogtei",
      "type": "Registerbekanntmachung nach dem Umwandlungsgesetz",
      "state": "Thüringen",
      "amtsgericht": "Amtsgericht Jena",
      "registernummer": "HRB 401102",
      "registerart": "HRB",
      "company_name": "Landwirtschaft-Niederdorla GmbH",
      "company_seat": "Vogtei",
      "details": "25.04.2025 (Bekanntmachungsdatum)\n\nThüringen Amtsgericht Jena HRB 401102\nRegisterbekanntmachung nach dem Umwandlungsgesetz 25.04.2025 (Eintragungsdatum)\n\nLandwirtschaft-Niederdorla GmbH\nGesellschaft mit beschränkter Haftung\nVogtei\n\nNicht eingetragen: Den Gläubigern der an der Verschmelzung beteiligten Rechtsträger, ist wenn sie binnen sechs Monaten nach dem Tag, an dem die Eintragung der Verschmelzung in das Register des Sitzes desjenigen Rechtsträgers, dessen Gläubiger sie sind,  nach § 19 Abs. 3 UmwG als bekanntgemacht gilt, ihren Anspruch nach Grund und Höhe schriftlich anmelden, Sicherheit zu leisten, soweit sie nicht Befriedigung verlangen können. Dieses Recht steht ihnen jedoch nur zu, wenn sie glaubhaft machen, daß durch die Verschmelzung die Erfüllung ihrer Forderung gefährdet wird."
    },
    {
      "date": "2025-04-25",
      "id": "107390",
      "original_text": "Registerbekanntmachung nach dem Umwandlungsgesetz\nThüringen Amtsgericht Jena HRB 401830\nTM Pflanzen-Produktion Vogtei GmbH – Vogtei",
      "type": "Registerbekanntmachung nach dem Umwandlungsgesetz",
      "state": "Thüringen",
      "amtsgericht": "Amtsgericht Jena",
      "registernummer": "HRB 401830",
      "registerart": "HRB",
      "company_name": "TM Pflanzen-Produktion Vogtei GmbH",
      "company_seat": "Vogtei",
      "details": "25.04.2025 (Bekanntmachungsdatum)\n\nThüringen Amtsgericht Jena HRB 401830\nRegisterbekanntmachung nach dem Umwandlungsgesetz 25.04.2025 (Eintragungsdatum)\n\nTM Pflanzen-Produktion Vogtei GmbH\nGesellschaft mit beschränkter Haftung\nVogtei\n\nNicht eingetragen: Den Gläubigern der an der Verschmelzung beteiligten Rechtsträger, ist wenn sie binnen sechs Monaten nach dem Tag, an dem die Eintragung der Verschmelzung in das Register des Sitzes desjenigen Rechtsträgers, dessen Gläubiger sie sind,  nach § 19 Abs. 3 UmwG als bekanntgemacht gilt, ihren Anspruch nach Grund und Höhe schriftlich anmelden, Sicherheit zu leisten, soweit sie nicht Befriedigung verlangen können. Dieses Recht steht ihnen jedoch nur zu, wenn sie glaubhaft machen, daß durch die Verschmelzung die Erfüllung ihrer Forderung gefährdet wird."
    },
    {
      "date": "2025-04-25",
      "id": "107391",
      "original_text": "Löschungsankündigung\nBaden-Württemberg Amtsgericht Freiburg VR 703850\nFUTURA DELLE TRE FRONTIERE- 50 plus e.V. – Weil am Rhein",
      "type": "Löschungsankündigung",
      "state": "Baden-Württemberg",
      "amtsgericht": "Amtsgericht Freiburg",
      "registernummer": "VR 703850",
      "registerart": "VR",
      "company_name": "FUTURA DELLE TRE FRONTIERE- 50 plus e.V.",
      "company_seat": "Weil am Rhein",
      "details": "25.04.2025 (Bekanntmachungsdatum)\n\nBaden-Württemberg Amtsgericht Freiburg VR 703850\nLöschungsankündigung\n\nFUTURA DELLE TRE FRONTIERE- 50 plus e.V.\neingetragener Verein\nWeil am Rhein\n\nDas Gericht beabsichtigt, die Eintragung des Vereins im Vereinsregister wegen des Mangels einer wesentlichen Voraussetzung von Amts wegen als unzulässig zu löschen. Die Frist zur Geltendmachung eines Widerspruchs gegen die beabsichtigte Löschung ist auf einen Monat ab Veröffentlichung bestimmt."
    },
    {
      "date": "2025-04-25",
      "id": "107392",
      "original_text": "Registerbekanntmachung nach dem Umwandlungsgesetz\nNiedersachsen Amtsgericht Walsrode HRA 110319\nAlois Dallmayr Automaten-Service GmbH & Co. KG – Stuhr",
      "type": "Registerbekanntmachung nach dem Umwandlungsgesetz",
      "state": "Niedersachsen",
      "amtsgericht": "Amtsgericht Walsrode",
      "registernummer": "HRA 110319",
      "registerart": "HRA",
      "company_name": "Alois Dallmayr Automaten-Service GmbH & Co. KG",
      "company_seat": "Stuhr",
      "details": "25.04.2025 (Bekanntmachungsdatum)\n\nNiedersachsen Amtsgericht Walsrode HRA 110319\nRegisterbekanntmachung nach dem Umwandlungsgesetz 25.04.2025 (Eintragungsdatum)\n\nAlois Dallmayr Automaten-Service GmbH & Co. KG\nKommanditgesellschaft\nStuhr\n\nDen Gläubigern der an der Verschmelzung beteiligten Rechtsträger ist, wenn sie binnen sechs Monaten nach dem Tag, an dem die Eintragung der Verschmelzung in das Register des Sitzes desjenigen Rechtsträgers, dessen Gläubiger sie sind, nach § 19  Abs.  3 UmwG als bekannt gemacht gilt, ihren Anspruch nach Grund und Höhe schriftlich anmelden, Sicherheit zu leisten, soweit sie nicht Befriedigung verlangen können. Dieses Recht steht den Gläubigern jedoch nur zu, wenn sie glaubhaft machen, dass durch die Verschmelzung die Erfüllung der Forderung gefährdet wird."
    },
    {
      "date": "2025-04-25",
      "id": "107393",
      "original_text": "Löschungsankündigung\nNiedersachsen Amtsgericht Lüneburg HRB 208180\nPacifico GmbH – Stelle",
      "type": "Löschungsankündigung",
      "state": "Niedersachsen",
      "amtsgericht": "Amtsgericht Lüneburg",
      "registernummer": "HRB 208180",
      "registerart": "HRB",
      "company_name": "Pacifico GmbH",
      "company_seat": "Stelle",
      "details": "25.04.2025 (Bekanntmachungsdatum)\n\nNiedersachsen Amtsgericht Lüneburg HRB 208180\nLöschungsankündigung\n\nPacifico GmbH\nGesellschaft mit beschränkter Haftung\nStelle\n\nDas Registergericht beabsichtigt, vorstehende Gesellschaft von Amts wegen nach § 394 FamFG zu löschen. Die Frist zur Erhebung eines Widerspruchs ist auf 1 Monat ab Veröffentlichung festgesetzt."
    },
    {
      "date": "2025-04-25",
      "id": "107394",
      "original_text": "Löschungsankündigung\nNiedersachsen Amtsgericht Lüneburg HRB 205767\nGBS Wendland GmbH – Waddeweitz",
      "type": "Löschungsankündigung",
      "state": "Niedersachsen",
      "amtsgericht": "Amtsgericht Lüneburg",
      "registernummer": "HRB 205767",
      "registerart": "HRB",
      "company_name": "GBS Wendland GmbH",
      "company_seat": "Waddeweitz",
      "details": "25.04.2025 (Bekanntmachungsdatum)\n\nNiedersachsen Amtsgericht Lüneburg HRB 205767\nLöschungsankündigung\n\nGBS Wendland GmbH\nGesellschaft mit beschränkter Haftung\nWaddeweitz\n\nDas Registergericht beabsichtigt, die Gesellschaft von Amts wegen nach § 394 FamFG zu löschen. Die Frist zur Erhebung eines Widerspruchs ist auf 1 Monat ab dieser Registerbekanntmachung festgesetzt."
    },
    {
      "date": "2025-04-25",
      "id": "107395",
      "original_text": "Registerbekanntmachung nach dem Umwandlungsgesetz\nNiedersachsen Amtsgericht Osnabrück HRB 210366\nKRONE Commercial Vehicle SE – Werlte",
      "type": "Registerbekanntmachung nach dem Umwandlungsgesetz",
      "state": "Niedersachsen",
      "amtsgericht": "Amtsgericht Osnabrück",
      "registernummer": "HRB 210366",
      "registerart": "HRB",
      "company_name": "KRONE Commercial Vehicle SE",
      "company_seat": "Werlte",
      "details": "25.04.2025 (Bekanntmachungsdatum)\n\nNiedersachsen Amtsgericht Osnabrück HRB 210366\nRegisterbekanntmachung nach dem Umwandlungsgesetz 25.04.2025 (Eintragungsdatum)\n\nKRONE Commercial Vehicle SE\nEuropäische Aktiengesellschaft (SE)\nWerlte\n\nDen Gläubigern der an der Ausgliederung beteiligten Rechtsträger ist, wenn sie binnen sechs Monaten nach dem Tag, an dem die Eintragung der Ausgliederung in das Register des Sitzes desjenigen Rechtsträgers, dessen Gläubiger sie sind, nach § 19 Abs. 3 UmwG als bekannt gemacht gilt, ihren Anspruch nach Grund und Höhe schriftlich anmelden, Sicherheit zu leisten, soweit sie nicht Befriedigung verlangen können. Dieses Recht steht den Gläubigern jedoch nur zu, wenn sie glaubhaft machen, dass durch die Ausgliederung die Erfüllung der Forderung gefährdet wird."
    },
    {
      "date": "2025-04-25",
      "id": "107396",
      "original_text": "Löschungsankündigung\nNiedersachsen Amtsgericht Aurich HRB 206347\nM&J Trockenbau GmbH – Emden",
      "type": "Löschungsankündigung",
      "state": "Niedersachsen",
      "amtsgericht": "Amtsgericht Aurich",
      "registernummer": "HRB 206347",
      "registerart": "HRB",
      "company_name": "M&J Trockenbau GmbH",
      "company_seat": "Emden",
      "details": "25.04.2025 (Bekanntmachungsdatum)\n\nNiedersachsen Amtsgericht Aurich HRB 206347\nLöschungsankündigung\n\nM&J Trockenbau GmbH\nGesellschaft mit beschränkter Haftung\nEmden\n\nDas Registergericht beabsichtigt, die Gesellschaft von Amts wegen nach § 394 FamFG zu löschen. Die Frist zur Erhebung eines Widerspruchs ist auf 1 Monat ab dieser Registerbekanntmachung festgesetzt."
    },
    {
      "date": "2025-04-25",
      "id": "107397",
      "original_text": "Löschungsankündigung\nNiedersachsen Amtsgericht Osnabrück HRB 212035\nFT Fair Trading UG (haftungsbeschränkt) – Osnabrück",
      "type": "Löschungsankündigung",
      "state": "Niedersachsen",
      "amtsgericht": "Amtsgericht Osnabrück",
      "registernummer": "HRB 212035",
      "registerart": "HRB",
      "company_name": "FT Fair Trading UG (haftungsbeschränkt)",
      "company_seat": "Osnabrück",
      "details": "25.04.2025 (Bekanntmachungsdatum)\n\nNiedersachsen Amtsgericht Osnabrück HRB 212035\nLöschungsankündigung\n\nFT Fair Trading UG (haftungsbeschränkt)\nGesellschaft mit beschränkter Haftung\nOsnabrück\n\nDas Registergericht beabsichtigt, die Gesellschaft von Amts wegen nach § 394 FamFG wegen Vermögenslosigkeit zu löschen. Die Frist zur Erhebung eines Widerspruchs ist auf 1 Monat ab dieser Registerbekanntmachung festgesetzt."
    },
    {
      "date": "2025-04-25",
      "id": "107398",
      "original_text": "Registerbekanntmachung nach dem Umwandlungsgesetz\nNiedersachsen Amtsgericht Hannover HRB 206561\nMedia-Manufaktur GmbH – Pattensen",
      "type": "Registerbekanntmachung nach dem Umwandlungsgesetz",
      "state": "Niedersachsen",
      "amtsgericht": "Amtsgericht Hannover",
      "registernummer": "HRB 206561",
      "registerart": "HRB",
      "company_name": "Media-Manufaktur GmbH",
      "company_seat": "Pattensen",
      "details": "25.04.2025 (Bekanntmachungsdatum)\n\nNiedersachsen Amtsgericht Hannover HRB 206561\nRegisterbekanntmachung nach dem Umwandlungsgesetz 25.04.2025 (Eintragungsdatum)\n\nMedia-Manufaktur GmbH\nGesellschaft mit beschränkter Haftung\nPattensen\n\nDen Gläubigern der an der Verschmelzung beteiligten Rechtsträger ist, wenn sie binnen sechs Monaten nach dem Tag, an dem die Eintragung der Verschmelzung in das Register des Sitzes desjenigen Rechtsträgers, dessen Gläubiger sie sind, nach § 19  Abs.  3 UmwG als bekannt gemacht gilt, ihren Anspruch nach Grund und Höhe schriftlich anmelden, Sicherheit zu leisten, soweit sie nicht Befriedigung verlangen können. Dieses Recht steht den Gläubigern jedoch nur zu, wenn sie glaubhaft machen, dass durch die Verschmelzung die Erfüllung der Forderung gefährdet wird."
    },
    {
      "date": "2025-04-25",
      "id": "107399",
      "original_text": "Registerbekanntmachung nach dem Umwandlungsgesetz\nNordrhein-Westfalen Amtsgericht Coesfeld GnR 186\nGFS-Genossenschaft zur Förderung der Schweinehaltung eG – Ascheberg",
      "type": "Registerbekanntmachung nach dem Umwandlungsgesetz",
      "state": "Nordrhein-Westfalen",
      "amtsgericht": "Amtsgericht Coesfeld",
      "registernummer": "GnR 186",
      "registerart": "GnR",
      "company_name": "GFS-Genossenschaft zur Förderung der Schweinehaltung eG",
      "company_seat": "Ascheberg",
      "details": "25.04.2025 (Bekanntmachungsdatum)\n\nNordrhein-Westfalen Amtsgericht Coesfeld GnR 186\nRegisterbekanntmachung nach dem Umwandlungsgesetz\n\nGFS-Genossenschaft zur Förderung der Schweinehaltung eG\neingetragene Genossenschaft\nAscheberg\n\nEin Verschmelzungsplan vom 19.03.2025 über die geplante grenzüberschreitende Verschmelzung zur Aufnahme der Cooperatieve Vereniging voor Kunstmatige Inseminatie bij Varkens `Twenthe´ UA Fleringen, Niederlande, in die GFS-Genossenschaft zur Förderung der Schweiehaltung eG, mit Sitz in Ascheberg, Deutschland unter gleichzeitiger Annahme der Rechtsfom einer Europäischen Genossenschaft (SCE Societas Cooperativa Europaea) GFS-Genossenschaft zur Förderung der Schweinehaltung SCE mit beschränkter Haftung ist eingereicht."
    },
    {
      "date": "2025-04-25",
      "id": "107400",
      "original_text": "Löschungsankündigung\nBrandenburg Amtsgericht Potsdam HRB 16982\nTAXIFUNK Brandenburg a.d.H. GmbH – Brandenburg an der Havel",
      "type": "Löschungsankündigung",
      "state": "Brandenburg",
      "amtsgericht": "Amtsgericht Potsdam",
      "registernummer": "HRB 16982",
      "registerart": "HRB",
      "company_name": "TAXIFUNK Brandenburg a.d.H. GmbH",
      "company_seat": "Brandenburg an der Havel",
      "details": "25.04.2025 (Bekanntmachungsdatum)\n\nBrandenburg Amtsgericht Potsdam HRB 16982\nLöschungsankündigung\n\nTAXIFUNK Brandenburg a.d.H. GmbH\nGesellschaft mit beschränkter Haftung\nBrandenburg an der Havel\n\nBei der nachstehenden Gesellschaft wird das Amtslöschungsverfahren gemäß § 394 FamFG eingeleitet. Widerspruchsfrist: 8 Wochen."
    },
    {
      "date": "2025-04-25",
      "id": "107401",
      "original_text": "Registerbekanntmachung nach dem Umwandlungsgesetz\nSachsen Amtsgericht Chemnitz HRA 10112\nRonny Vogel e.K. – Oberlungwitz",
      "type": "Registerbekanntmachung nach dem Umwandlungsgesetz",
      "state": "Sachsen",
      "amtsgericht": "Amtsgericht Chemnitz",
      "registernummer": "HRA 10112",
      "registerart": "HRA",
      "company_name": "Ronny Vogel e.K.",
      "company_seat": "Oberlungwitz",
      "details": "25.04.2025 (Bekanntmachungsdatum)\n\nSachsen Amtsgericht Chemnitz HRA 10112\nRegisterbekanntmachung nach dem Umwandlungsgesetz 25.04.2025 (Eintragungsdatum)\n\nRonny Vogel e.K.\nEinzelkaufmann / Einzelkauffrau\nOberlungwitz\n\nDen Gläubigern der an der Ausgliederung beteiligten Rechtsträger ist, wenn sie binnen sechs Monaten nach dem Tag, an dem die Eintragung der Ausgliederung in das Register des Sitzes desjenigen Rechtsträgers, dessen Gläubiger sie sind, nach § 19 Abs. 3 UmwG als bekannt gemacht gilt, ihren Anspruch nach Grund und Höhe in Textform anmelden, Sicherheit zu leisten, soweit sie nicht Befriedigung verlangen können. Dieses Recht steht den Gläubigern jedoch nur zu, wenn sie glaubhaft machen, dass durch die Ausgliederung die Erfüllung der Forderung gefährdet wird."
    },
    {
      "date": "2025-04-25",
      "id": "107402",
      "original_text": "Löschungsankündigung\nSachsen Amtsgericht Leipzig HRB 19067\nTRALYCO GmbH Leipzig – Leipzig",
      "type": "Löschungsankündigung",
      "state": "Sachsen",
      "amtsgericht": "Amtsgericht Leipzig",
      "registernummer": "HRB 19067",
      "registerart": "HRB",
      "company_name": "TRALYCO GmbH Leipzig",
      "company_seat": "Leipzig",
      "details": "25.04.2025 (Bekanntmachungsdatum)\n\nSachsen Amtsgericht Leipzig HRB 19067\nLöschungsankündigung\n\nTRALYCO GmbH Leipzig\nGesellschaft mit beschränkter Haftung\nLeipzig\n\nDas Registergericht beabsichtigt, die im Handelsregister eingetragene Gesellschaft von Amts wegen nach § 394 FamFG zu löschen. Die Frist zu Erhebung eines Widerspruchs gegen die beabsichtigte Löschung wird auf einen Monat festgesetzt."
    },
    {
      "date": "2025-04-25",
      "id": "107403",
      "original_text": "Löschungsankündigung\nSachsen Amtsgericht Dresden HRB 30637\nDentaltechnik Zahn(los) UG (haftungsbeschränkt) – Moritzburg",
      "type": "Löschungsankündigung",
      "state": "Sachsen",
      "amtsgericht": "Amtsgericht Dresden",
      "registernummer": "HRB 30637",
      "registerart": "HRB",
      "company_name": "Dentaltechnik Zahn(los) UG (haftungsbeschränkt)",
      "company_seat": "Moritzburg",
      "details": "25.04.2025 (Bekanntmachungsdatum)\n\nSachsen Amtsgericht Dresden HRB 30637\nLöschungsankündigung\n\nDentaltechnik Zahn(los) UG (haftungsbeschränkt)\nGesellschaft mit beschränkter Haftung\nMoritzburg\n\nDas Registergericht beabsichtigt, die im Handelsregister eingetragene Gesellschaft von Amts wegen nach § 394 FamFG zu löschen. Die Frist zu Erhebung eines Widerspruchs gegen die beabsichtigte Löschung wird auf einen Monat festgesetzt."
    },
    {
      "date": "2025-04-25",
      "id": "107404",
      "original_text": "Löschungsankündigung\nSachsen Amtsgericht Leipzig VR 30816\nFußballspielvereinigung (FSV) Kursdorf 58 e.V. – Kursdorf",
      "type": "Löschungsankündigung",
      "state": "Sachsen",
      "amtsgericht": "Amtsgericht Leipzig",
      "registernummer": "VR 30816",
      "registerart": "VR",
      "company_name": "Fußballspielvereinigung (FSV) Kursdorf 58 e.V.",
      "company_seat": "Kursdorf",
      "details": "25.04.2025 (Bekanntmachungsdatum)\n\nSachsen Amtsgericht Leipzig VR 30816\nLöschungsankündigung\n\nFußballspielvereinigung (FSV) Kursdorf 58 e.V.\neingetragener Verein\nKursdorf\n\nDas Gericht beabsichtigt, gemäß § 4 Absatz 2 Ziffer 1 der Verordnung über das Vereinsregister das Registerblatt  des Vereins zu schließen, da nach Mitteilung des bisherigen Vorstandes sämtliche Mitglieder aus dem Verein ausgeschieden sind. Zur Geltendmachung eines Widerspruchs gegen die beabsichtigte Schließung wird eine Frist von einem Monat nach der Veröffentlichung bestimmt."
    },
    {
      "date": "2025-04-25",
      "id": "107405",
      "original_text": "Einreichung neuer Dokumente\nBremen Amtsgericht Bremen HRB 22594\nencoway GmbH – Bremen",
      "type": "Einreichung neuer Dokumente",
      "state": "Bremen",
      "amtsgericht": "Amtsgericht Bremen",
      "registernummer": "HRB 22594",
      "registerart": "HRB",
      "company_name": "encoway GmbH",
      "company_seat": "Bremen",
      "details": "25.04.2025 (Bekanntmachungsdatum)\n\nBremen Amtsgericht Bremen HRB 22594\nEinreichung neuer Dokumente\n\nencoway GmbH\nGesellschaft mit beschränkter Haftung\nBremen\n\nAls nicht eingetragen wird bekannt gemacht: Liste des Aufsichtsrats wurde eingereicht."
    },
    {
      "date": "2025-04-25",
      "id": "107406",
      "original_text": "Registerbekanntmachung nach dem Umwandlungsgesetz\nRheinland-Pfalz Amtsgericht Mainz GsR 339\nFORM Onlinemarketing eGbR – Jugenheim",
      "type": "Registerbekanntmachung nach dem Umwandlungsgesetz",
      "state": "Rheinland-Pfalz",
      "amtsgericht": "Amtsgericht Mainz",
      "registernummer": "GsR 339",
      "registerart": "GsR",
      "company_name": "FORM Onlinemarketing eGbR",
      "company_seat": "Jugenheim",
      "details": "25.04.2025 (Bekanntmachungsdatum)\n\nRheinland-Pfalz Amtsgericht Mainz GsR 339\nRegisterbekanntmachung nach dem Umwandlungsgesetz 25.04.2025 (Eintragungsdatum)\n\nFORM Onlinemarketing eGbR\nGesellschaft bürgerlichen Rechts\nJugenheim\n\nAls nicht eingetragen wird veröffentlicht:\nDen Gläubigern des formwechselnden Rechtsträgers ist, wenn sie binnen sechs Monaten nach dem Tag, an dem die Eintragung des Formwechsels nach § 201 UmwG als bekannt gemacht gilt, ihren Anspruch nach Grund und Höhe schriftlich anmelden, Sicherheit zu leisten, soweit sie nicht Befriedigung verlangen können. Dieses Recht steht den Gläubigern jedoch nur zu, wenn sie glaubhaft machen, dass durch den Formwechsel die Erfüllung der Forderung gefährdet wird."
    },
    {
      "date": "2025-04-25",
      "id": "107407",
      "original_text": "Registerbekanntmachung nach dem Umwandlungsgesetz\nRheinland-Pfalz Amtsgericht Mainz GsR 297\nV-Rent eGbR – Mainz",
      "type": "Registerbekanntmachung nach dem Umwandlungsgesetz",
      "state": "Rheinland-Pfalz",
      "amtsgericht": "Amtsgericht Mainz",
      "registernummer": "GsR 297",
      "registerart": "GsR",
      "company_name": "V-Rent eGbR",
      "company_seat": "Mainz",
      "details": "25.04.2025 (Bekanntmachungsdatum)\n\nRheinland-Pfalz Amtsgericht Mainz GsR 297\nRegisterbekanntmachung nach dem Umwandlungsgesetz 25.04.2025 (Eintragungsdatum)\n\nV-Rent eGbR\nGesellschaft bürgerlichen Rechts\nMainz\n\nAls nicht eingetragen wird veröffentlicht:\nDen Gläubigern des formwechselnden Rechtsträgers ist, wenn sie binnen sechs Monaten nach dem Tag, an dem die Eintragung des Formwechsels nach § 201 UmwG als bekannt gemacht gilt, ihren Anspruch nach Grund und Höhe schriftlich anmelden, Sicherheit zu leisten, soweit sie nicht Befriedigung verlangen können. Dieses Recht steht den Gläubigern jedoch nur zu, wenn sie glaubhaft machen, dass durch den Formwechsel die Erfüllung der Forderung gefährdet wird."
    },
    {
      "date": "2025-04-25",
      "id": "107408",
      "original_text": "Registerbekanntmachung nach dem Umwandlungsgesetz\nRheinland-Pfalz Amtsgericht Bad Kreuznach VR 1290\nLandesverband Gartenbau Rheinland-Pfalz e.V – Bad Kreuznach",
      "type": "Registerbekanntmachung nach dem Umwandlungsgesetz",
      "state": "Rheinland-Pfalz",
      "amtsgericht": "Amtsgericht Bad Kreuznach",
      "registernummer": "VR 1290",
      "registerart": "VR",
      "company_name": "Landesverband Gartenbau Rheinland-Pfalz e.V",
      "company_seat": "Bad Kreuznach",
      "details": "25.04.2025 (Bekanntmachungsdatum)\n\nRheinland-Pfalz Amtsgericht Bad Kreuznach VR 1290\nRegisterbekanntmachung nach dem Umwandlungsgesetz 25.04.2025 (Eintragungsdatum)\n\nLandesverband Gartenbau Rheinland-Pfalz e.V\neingetragener Verein\nBad Kreuznach\n\nAls nicht eingetragen wird veröffentlicht: Den Gläubigern der an der Verschmelzung beteiligten Rechtsträger ist, wenn sie binnen sechs Monaten nach dem Tag, an dem die Eintragung der Verschmelzung in das Register des Sitzes desjenigen Rechtsträgers, dessen Gläubiger sie sind, nach § 19 Abs. 3 UmwG als bekannt gemacht gilt, ihren Anspruch nach Grund und Höhe schriftlich anmelden, Sicherheit zu leisten, soweit sie nicht Befriedigung verlangen können. Dieses Recht steht den Gläubigern jedoch nur zu, wenn sie glaubhaft machen, dass durch die Verschmelzung die Erfüllung der Forderung gefährdet wird."
    },
    {
      "date": "2025-04-25",
      "id": "107409",
      "original_text": "Löschungsankündigung\nNordrhein-Westfalen Amtsgericht Aachen GnR 265\nFVE Fleischversorgung Eschweiler eG – Eschweiler",
      "type": "Löschungsankündigung",
      "state": "Nordrhein-Westfalen",
      "amtsgericht": "Amtsgericht Aachen",
      "registernummer": "GnR 265",
      "registerart": "GnR",
      "company_name": "FVE Fleischversorgung Eschweiler eG",
      "company_seat": "Eschweiler",
      "details": "25.04.2025 (Bekanntmachungsdatum)\n\nNordrhein-Westfalen Amtsgericht Aachen GnR 265\nLöschungsankündigung\n\nFVE Fleischversorgung Eschweiler eG\neingetragene Genossenschaft\nEschweiler\n\nDas Registergericht beabsichtigt, von Amts wegen die Gesellschaft wegen Vermögenslosigkeit nach § 394 FamFG zu löschen, weil das Insolvenzverfahren Amtsgericht Aachen (91 IN 371/16)) beendet und Vermögen der Gesellschaft nicht mehr erkennbar ist.\n\nZur Geltendmachung des Widerspruchs gegen die beabsichtigte Löschung wird hiermit eine Frist von einem Monat ab Veröffentlichung dieser Ankündigung bestimmt.\n\nRechtsbehelfsbelehrung:\n\nGegen diese Verfügung kann Widerspruch eingelegt werden. Zum Widerspruch ist jeder berechtigt, der an der Unterlassung der Löschung ein berechtigtes Interesse hat.\n\nDer Widerspruch ist bei dem Amtsgericht Aachen, Adalbertsteinweg 92, 52070 Aachen schriftlich in deutscher Sprache oder zur Niederschrift der Geschäftsstelle einzulegen. Der Widerspruch kann auch zur Niederschrift der Geschäftsstelle eines jeden Amtsgerichtes abgegeben werden.\n\nDer Widerspruch muss spätestens innerhalb der gesetzten Frist nach der Bekanntgabe der Verfügung bei dem Amtsgericht Aachen eingegangen sein. Dies gilt auch dann, wenn der Widerspruch zur Niederschrift der Geschäftsstelle eines anderen Amtsgerichtes abgegeben wurde. Die Frist beginnt mit der Bekanntgabe der Verfügung durch Veröffentlichung. Fällt das Ende der Frist auf einen Sonntag, einen allgemeinen Feiertag oder Sonnabend, so endet die Frist mit Ablauf des nächsten Werktages.\n\nDer Widerspruch muss die Bezeichnung der angefochtenen Verfügung sowie die Erklärung enthalten, dass Widerspruch gegen diese Verfügung eingelegt wird. Er ist zu unterzeichnen und soll begründet werden.\n\nDie Einlegung ist auch durch Übertragung eines elektronischen Dokuments an die elektronische Poststelle des Gerichts möglich. Das elektronische Dokument muss für die Bearbeitung durch das Gericht geeignet und mit einer qualifizierten elektronischen Signatur der verantwortenden Person versehen sein oder von der verantwortenden Person signiert und auf einem sicheren Übermittlungsweg gemäß § 130 a ZPO nach näherer Maßgabe der Verordnung über die technischen Rahmenbedingungen des elektronischen Rechtsverkehrs und über das besondere elektronische Behördenpostfach (BGBl. I, S. 3803) eingereicht werden. Weitere Informationen erhalten Sie auf der Internetseite www.justiz.de."
    },
    {
      "date": "2025-04-25",
      "id": "107410",
      "original_text": "Löschungsankündigung\nNordrhein-Westfalen Amtsgericht Siegburg HRB 18067\nHermys Holding UG (haftungsbeschränkt) – Niederkassel",
      "type": "Löschungsankündigung",
      "state": "Nordrhein-Westfalen",
      "amtsgericht": "Amtsgericht Siegburg",
      "registernummer": "HRB 18067",
      "registerart": "HRB",
      "company_name": "Hermys Holding UG (haftungsbeschränkt)",
      "company_seat": "Niederkassel",
      "details": "25.04.2025 (Bekanntmachungsdatum)\n\nNordrhein-Westfalen Amtsgericht Siegburg HRB 18067\nLöschungsankündigung\n\nHermys Holding UG (haftungsbeschränkt)\nGesellschaft mit beschränkter Haftung\nNiederkassel\n\nDas Registergericht hat glaubhafte Kenntnis erlangt, dass die Gesellschaft vermögenslos geworden ist.\n\nEs ist daher beabsichtigt, die Gesellschaft nach § 394 FamFG im Handelsregister wegen Vermögenslosigkeit zu löschen.\nEinwände gegen die Löschung sind durch Widerspruch binnen einer Frist von 3 Monaten geltend zu machen, andernfalls die Löschung erfolgen wird.\n\nEinzulegen ist der Widerspruch bei dem Amtsgericht Siegburg, Neue Poststraße 16, 53721 Siegburg, und zwar entweder schriftlich in deutscher Sprache oder mündlich zur Niederschrift der Geschäftsstelle. Der Widerspruch kann auch zur Niederschrift der Geschäftsstelle eines jeden Amtsgerichts abgegeben werden. Der Widerspruch ist binnen der in der Verfügung bestimmten Frist einzulegen. Die Frist ist nur gewahrt, wenn der Widerspruch rechtzeitig bei dem Amtsgericht Siegburg eingeht, auch wenn der Widerspruch zur Niederschrift der Geschäftsstelle eines anderen Amtsgerichts abgegeben wurde. Die Frist beginnt jeweils mit der schriftlichen Bekanntgabe der Verfügung an die Beteiligten. Kann die schriftliche Bekanntgabe an einen Beteiligten nicht bewirkt werden, beginnt die Frist spätestens mit Ablauf von fünf Monaten nach Erlass der Verfügung. Die Bekanntgabe ist entweder durch Zustellung oder am dritten Tage nach Aufgabe zur Post bewirkt. Sofern die Löschung noch nicht erfolgt ist, kann der Widerspruch auch noch nach Ablauf der Frist eingelegt werden. Fällt das Ende der Frist auf einen Sonnabend, einen Sonntag oder einen allgemeinen Feiertag, endet die Frist mit Ablauf des nächsten Werktages. Der Widerspruch ist zu unterzeichnen. Eine Begründung des Widerspruchs ist nicht vorgeschrieben."
    },
    {
      "date": "2025-04-25",
      "id": "107411",
      "original_text": "Löschungsankündigung\nNordrhein-Westfalen Amtsgericht Krefeld HRB 18113\nMerkur Investment und Development GmbH – Krefeld",
      "type": "Löschungsankündigung",
      "state": "Nordrhein-Westfalen",
      "amtsgericht": "Amtsgericht Krefeld",
      "registernummer": "HRB 18113",
      "registerart": "HRB",
      "company_name": "Merkur Investment und Development GmbH",
      "company_seat": "Krefeld",
      "details": "25.04.2025 (Bekanntmachungsdatum)\n\nNordrhein-Westfalen Amtsgericht Krefeld HRB 18113\nLöschungsankündigung\n\nMerkur Investment und Development GmbH\nGesellschaft mit beschränkter Haftung\nKrefeld\n\nDas Registergericht beabsichtigt die Gesellschaft von Amts wegen nach § 394 FamFG zu löschen. Die Frist zur Erhebung eines Widerspruchs ist auf einen Monat festgesetzt."
    },
    {
      "date": "2025-04-25",
      "id": "107412",
      "original_text": "Sonstige Registerbekanntmachung\nNordrhein-Westfalen Amtsgericht Köln HRB 52059\nENVIVAS Krankenversicherung Aktiengesellschaft – Köln",
      "type": "Sonstige Registerbekanntmachung",
      "state": "Nordrhein-Westfalen",
      "amtsgericht": "Amtsgericht Köln",
      "registernummer": "HRB 52059",
      "registerart": "HRB",
      "company_name": "ENVIVAS Krankenversicherung Aktiengesellschaft",
      "company_seat": "Köln",
      "details": "25.04.2025 (Bekanntmachungsdatum)\n\nNordrhein-Westfalen Amtsgericht Köln HRB 52059\nSonstige Registerbekanntmachung\n\nENVIVAS Krankenversicherung Aktiengesellschaft\nAktiengesellschaft\nKöln\n\nDem Registergericht ist eine Liste der Mitglieder des Aufsichtsrates eingereicht worden."
    },
    {
      "date": "2025-04-25",
      "id": "107413",
      "original_text": "Löschungsankündigung\nNordrhein-Westfalen Amtsgericht Duisburg HRB 37511\nFURICON Grosshandel GmbH – Duisburg",
      "type": "Löschungsankündigung",
      "state": "Nordrhein-Westfalen",
      "amtsgericht": "Amtsgericht Duisburg",
      "registernummer": "HRB 37511",
      "registerart": "HRB",
      "company_name": "FURICON Grosshandel GmbH",
      "company_seat": "Duisburg",
      "details": "25.04.2025 (Bekanntmachungsdatum)\n\nNordrhein-Westfalen Amtsgericht Duisburg HRB 37511\nLöschungsankündigung\n\nFURICON Grosshandel GmbH\nGesellschaft mit beschränkter Haftung\nDuisburg\n\nDas Registergericht beabsichtigt, die im Handelsregister unter HRB 37511 eingetragene Gesellschaft FURICON Grosshandel GmbH gemäß § 394 FamFG wegen Vermögenslosigkeit von Amts wegen zu löschen. Gegen diese Verfügung kann Widerspruch eingelegt werden. Die Frist zur Erhebung eines Widerspruchs gegen die beabsichtigte Löschung von Amts wegen ist auf drei Monate festgesetzt. Rechtsbehelfsbelehrung Der Widerspruch ist bei dem Amtsgericht Duisburg, Kardinal-Galen-Str. 124-132, 47058 Duisburg schriftlich in deutscher Sprache oder zur Niederschrift der Geschäftsstelle einzulegen. Der Widerspruch kann auch zur Niederschrift der Geschäftsstelle eines jeden Amtsgerichtes abgegeben werden. Die Einlegung ist auch durch Übertragung eines elektronischen Dokuments an die elektronische Poststelle des Gerichts möglich. Das elektronische Dokument muss für die Bearbeitung durch das Gericht geeignet und mit einer qualifizierten elektronischen Signatur der verantwortenden Person versehen sein oder von der verantwortenden Person signiert und auf einem sicheren Übermittlungsweg gemäß § 130 a ZPO nach näherer Maßgabe der Verordnung über die technischen Rahmenbedingungen des elektronischen Rechtsverkehrs und über das besondere elektronische Behördenpostfach (BGBl. I, S. 3803) eingereicht werden. Weitere Informationen erhalten Sie auf der Internetseite www.justiz.de <http://www.justiz.de>. Der Widerspruch muss spätestens innerhalb der gesetzten Frist bei dem Amtsgericht Duisburg eingegangen sein. Dies gilt auch dann, wenn der Widerspruch zur Niederschrift der Geschäftsstelle eines anderen Amtsgerichtes abgegeben wurde. Die Frist beginnt mit der Veröffentlichung. Fällt das Ende der Frist auf einen Sonntag, einen allgemeinen Feiertag oder Sonnabend, so endet die Frist mit Ablauf des nächsten Werktages. Der Widerspruch muss die Bezeichnung der angefochtenen Verfügung sowie die Erklärung enthalten, dass Widerspruch gegen diese Verfügung eingelegt wird. Er ist zu unterzeichnen und soll begründet werden."
    },
    {
      "date": "2025-04-25",
      "id": "107414",
      "original_text": "Löschungsankündigung\nNordrhein-Westfalen Amtsgericht Duisburg HRB 27561\nFidus Handelsgesellschaft mbH – Duisburg",
      "type": "Löschungsankündigung",
      "state": "Nordrhein-Westfalen",
      "amtsgericht": "Amtsgericht Duisburg",
      "registernummer": "HRB 27561",
      "registerart": "HRB",
      "company_name": "Fidus Handelsgesellschaft mbH",
      "company_seat": "Duisburg",
      "details": "25.04.2025 (Bekanntmachungsdatum)\n\nNordrhein-Westfalen Amtsgericht Duisburg HRB 27561\nLöschungsankündigung\n\nFidus Handelsgesellschaft mbH\nGesellschaft mit beschränkter Haftung\nDuisburg\n\nDas Registergericht beabsichtigt, die im Handelsregister unter HRB 27561 eingetragene Gesellschaft Fidus Handelsgesellschaft mbH  gemäß § 394 FamFG wegen Vermögenslosigkeit von Amts wegen zu löschen. Gegen diese Verfügung kann Widerspruch eingelegt werden. Die Frist zur Erhebung eines Widerspruchs gegen die beabsichtigte Löschung von Amts wegen ist auf drei Monate festgesetzt. Rechtsbehelfsbelehrung Der Widerspruch ist bei dem Amtsgericht Duisburg, Kardinal-Galen-Str. 124-132, 47058 Duisburg schriftlich in deutscher Sprache oder zur Niederschrift der Geschäftsstelle einzulegen. Der Widerspruch kann auch zur Niederschrift der Geschäftsstelle eines jeden Amtsgerichtes abgegeben werden. Die Einlegung ist auch durch Übertragung eines elektronischen Dokuments an die elektronische Poststelle des Gerichts möglich. Das elektronische Dokument muss für die Bearbeitung durch das Gericht geeignet und mit einer qualifizierten elektronischen Signatur der verantwortenden Person versehen sein oder von der verantwortenden Person signiert und auf einem sicheren Übermittlungsweg gemäß § 130 a ZPO nach näherer Maßgabe der Verordnung über die technischen Rahmenbedingungen des elektronischen Rechtsverkehrs und über das besondere elektronische Behördenpostfach (BGBl. I, S. 3803) eingereicht werden. Weitere Informationen erhalten Sie auf der Internetseite www.justiz.de <http://www.justiz.de>. Der Widerspruch muss spätestens innerhalb der gesetzten Frist bei dem Amtsgericht Duisburg eingegangen sein. Dies gilt auch dann, wenn der Widerspruch zur Niederschrift der Geschäftsstelle eines anderen Amtsgerichtes abgegeben wurde. Die Frist beginnt mit der Veröffentlichung. Fällt das Ende der Frist auf einen Sonntag, einen allgemeinen Feiertag oder Sonnabend, so endet die Frist mit Ablauf des nächsten Werktages. Der Widerspruch muss die Bezeichnung der angefochtenen Verfügung sowie die Erklärung enthalten, dass Widerspruch gegen diese Verfügung eingelegt wird. Er ist zu unterzeichnen und soll begründet werden."
    },
    {
      "date": "2025-04-25",
      "id": "107415",
      "original_text": "Löschungsankündigung\nNordrhein-Westfalen Amtsgericht Bochum HRB 18017\nMATI Modellbau UG (haftungsbeschränkt) – Herne",
      "type": "Löschungsankündigung",
      "state": "Nordrhein-Westfalen",
      "amtsgericht": "Amtsgericht Bochum",
      "registernummer": "HRB 18017",
      "registerart": "HRB",
      "company_name": "MATI Modellbau UG (haftungsbeschränkt)",
      "company_seat": "Herne",
      "details": "25.04.2025 (Bekanntmachungsdatum)\n\nNordrhein-Westfalen Amtsgericht Bochum HRB 18017\nLöschungsankündigung\n\nMATI Modellbau UG (haftungsbeschränkt)\nGesellschaft mit beschränkter Haftung\nHerne\n\nDas Registergericht beabsichtigt die Gesellschaft von Amts wegen nach § 394 FamFG zu löschen. Die Frist zur Erhebung eines Widerspruchs ist auf drei Monate festgesetzt."
    },
    {
      "date": "2025-04-25",
      "id": "107416",
      "original_text": "Einreichung neuer Dokumente\nNordrhein-Westfalen Amtsgericht Köln HRB 63888\nStuditemps GmbH – Köln",
      "type": "Einreichung neuer Dokumente",
      "state": "Nordrhein-Westfalen",
      "amtsgericht": "Amtsgericht Köln",
      "registernummer": "HRB 63888",
      "registerart": "HRB",
      "company_name": "Studitemps GmbH",
      "company_seat": "Köln",
      "details": "25.04.2025 (Bekanntmachungsdatum)\n\nNordrhein-Westfalen Amtsgericht Köln HRB 63888\nEinreichung neuer Dokumente 25.04.2025 (Eintragungsdatum)\n\nStuditemps GmbH\nGesellschaft mit beschränkter Haftung\nKöln\n\nDem Registergericht ist eine neue Liste der Mitglieder des Aufsichtsrates eingereicht worden."
    },
    {
      "date": "2025-04-25",
      "id": "107417",
      "original_text": "Löschungsankündigung\nNordrhein-Westfalen Amtsgericht Essen HRB 25885\nTHT GmbH – Essen",
      "type": "Löschungsankündigung",
      "state": "Nordrhein-Westfalen",
      "amtsgericht": "Amtsgericht Essen",
      "registernummer": "HRB 25885",
      "registerart": "HRB",
      "company_name": "THT GmbH",
      "company_seat": "Essen",
      "details": "25.04.2025 (Bekanntmachungsdatum)\n\nNordrhein-Westfalen Amtsgericht Essen HRB 25885\nLöschungsankündigung\n\nTHT GmbH\nGesellschaft mit beschränkter Haftung\nEssen\n\nDas Registergericht beabsichtigt die Gesellschaft von Amts wegen nach § 394 FamFG zu löschen. Die Frist zur Erhebung eines Widerspruchs ist auf einen Monat festgesetzt."
    },
    {
      "date": "2025-04-25",
      "id": "107418",
      "original_text": "Registerbekanntmachung nach dem Umwandlungsgesetz\nNordrhein-Westfalen Amtsgericht Köln HRA 37810\nAKZ-Hauskrankenpflege GmbH & Co. KG – Köln",
      "type": "Registerbekanntmachung nach dem Umwandlungsgesetz",
      "state": "Nordrhein-Westfalen",
      "amtsgericht": "Amtsgericht Köln",
      "registernummer": "HRA 37810",
      "registerart": "HRA",
      "company_name": "AKZ-Hauskrankenpflege GmbH & Co. KG",
      "company_seat": "Köln",
      "details": "25.04.2025 (Bekanntmachungsdatum)\n\nNordrhein-Westfalen Amtsgericht Köln HRA 37810\nRegisterbekanntmachung nach dem Umwandlungsgesetz 25.04.2025 (Eintragungsdatum)\n\nAKZ-Hauskrankenpflege GmbH & Co. KG\nKommanditgesellschaft\nKöln\n\nDen Gläubigern der an der Ausgliederung beteiligten Rechtsträger ist, wenn sie binnen sechs Monaten nach dem Tag, an dem die Eintragung der Ausgliederung in das Register des Sitzes desjenigen Rechtsträgers, dessen Gläubiger sie sind, nach § 19 Absatz 3 UmwG als bekanntgemacht gilt, ihren Anspruch nach Grund und Höhe schriftlich anmelden, Sicherheit zu leisten, soweit sie nicht Befriedigung verlangen können. Dieses Recht steht den Gläubigern jedoch nur zu, wenn sie glaubhaft machen, dass durch die Ausgliederung die Erfüllung ihrer Forderung gefährdet wird."
    },
    {
      "date": "2025-04-25",
      "id": "107419",
      "original_text": "Registerbekanntmachung nach dem Umwandlungsgesetz\nNordrhein-Westfalen Amtsgericht Köln HRA 37767\nAKZ-Hauskrankenpflege Maria Gräler e.K. – Köln",
      "type": "Registerbekanntmachung nach dem Umwandlungsgesetz",
      "state": "Nordrhein-Westfalen",
      "amtsgericht": "Amtsgericht Köln",
      "registernummer": "HRA 37767",
      "registerart": "HRA",
      "company_name": "AKZ-Hauskrankenpflege Maria Gräler e.K.",
      "company_seat": "Köln",
      "details": "25.04.2025 (Bekanntmachungsdatum)\n\nNordrhein-Westfalen Amtsgericht Köln HRA 37767\nRegisterbekanntmachung nach dem Umwandlungsgesetz 25.04.2025 (Eintragungsdatum)\n\nAKZ-Hauskrankenpflege Maria Gräler e.K.\nEinzelkaufmann / Einzelkauffrau\nKöln\n\nDen Gläubigern der an der Ausgliederung beteiligten Rechtsträger ist, wenn sie binnen sechs Monaten nach dem Tag, an dem die Eintragung der Ausgliederung in das Register des Sitzes desjenigen Rechtsträgers, dessen Gläubiger sie sind, nach § 19 Absatz 3 UmwG als bekanntgemacht gilt, ihren Anspruch nach Grund und Höhe schriftlich anmelden, Sicherheit zu leisten, soweit sie nicht Befriedigung verlangen können. Dieses Recht steht den Gläubigern jedoch nur zu, wenn sie glaubhaft machen, dass durch die Ausgliederung die Erfüllung ihrer Forderung gefährdet wird."
    },
    {
      "date": "2025-04-25",
      "id": "107420",
      "original_text": "Löschungsankündigung\nNordrhein-Westfalen Amtsgericht Hamm HRB 4949\nRatte Fahrzeugtechnik GmbH – Bergkamen",
      "type": "Löschungsankündigung",
      "state": "Nordrhein-Westfalen",
      "amtsgericht": "Amtsgericht Hamm",
      "registernummer": "HRB 4949",
      "registerart": "HRB",
      "company_name": "Ratte Fahrzeugtechnik GmbH",
      "company_seat": "Bergkamen",
      "details": "25.04.2025 (Bekanntmachungsdatum)\n\nNordrhein-Westfalen Amtsgericht Hamm HRB 4949\nLöschungsankündigung\n\nRatte Fahrzeugtechnik GmbH\nGesellschaft mit beschränkter Haftung\nBergkamen\n\nDas Registergericht beabsichtigt die Gesellschaft von Amts wegen nach § 394 FamFG zu löschen. Die Frist zur Erhebung eines Widerspruchs ist auf drei Monate festgesetzt."
    },
    {
      "date": "2025-04-25",
      "id": "107421",
      "original_text": "Löschungsankündigung\nBremen Amtsgericht Bremen HRB 38899\nTAG Immobilienbau und Dienstleistungen GmbH – Bremen",
      "type": "Löschungsankündigung",
      "state": "Bremen",
      "amtsgericht": "Amtsgericht Bremen",
      "registernummer": "HRB 38899",
      "registerart": "HRB",
      "company_name": "TAG Immobilienbau und Dienstleistungen GmbH",
      "company_seat": "Bremen",
      "details": "25.04.2025 (Bekanntmachungsdatum)\n\nBremen Amtsgericht Bremen HRB 38899\nLöschungsankündigung\n\nTAG Immobilienbau und Dienstleistungen GmbH\nGesellschaft mit beschränkter Haftung\nBremen\n\nEs ist beabsichtigt die im Handelsregister eingetragene Gesellschaft von Amts wegen gemäß § 394 FamFG zu löschen. Gegen die Löschung kann beim AG Bremen schriftlich oder zu Protokoll der Geschäftsstelle Widerspruch eingelegt werden. Widerspruchsfrist 4 Wochen."
    },
    {
      "date": "2025-04-25",
      "id": "107422",
      "original_text": "Löschungsankündigung\nBremen Amtsgericht Bremen HRB 34971\nT+A Nord GmbH – Bremerhaven",
      "type": "Löschungsankündigung",
      "state": "Bremen",
      "amtsgericht": "Amtsgericht Bremen",
      "registernummer": "HRB 34971",
      "registerart": "HRB",
      "company_name": "T+A Nord GmbH",
      "company_seat": "Bremerhaven",
      "details": "25.04.2025 (Bekanntmachungsdatum)\n\nBremen Amtsgericht Bremen HRB 34971\nLöschungsankündigung\n\nT+A Nord GmbH\nGesellschaft mit beschränkter Haftung\nBremerhaven\n\nEs ist beabsichtigt die im Handelsregister eingetragene Gesellschaft von Amts wegen gemäß § 394 FamFG zu löschen. Gegen die Löschung kann beim AG Bremen schriftlich oder zu Protokoll der Geschäftsstelle Widerspruch eingelegt werden. Widerspruchsfrist 4 Wochen."
    },
    {
      "date": "2025-04-25",
      "id": "107423",
      "original_text": "Löschungsankündigung\nBremen Amtsgericht Bremen HRA 29606\nA.K Service e.K. – Bremen",
      "type": "Löschungsankündigung",
      "state": "Bremen",
      "amtsgericht": "Amtsgericht Bremen",
      "registernummer": "HRA 29606",
      "registerart": "HRA",
      "company_name": "A.K Service e.K.",
      "company_seat": "Bremen",
      "details": "25.04.2025 (Bekanntmachungsdatum)\n\nBremen Amtsgericht Bremen HRA 29606\nLöschungsankündigung\n\nA.K Service e.K.\nEinzelkaufmann / Einzelkauffrau\nBremen\n\nEs ist beabsichtigt die im Handelsregister eingetragene Firma von Amts wegen gemäß § 31 Abs.2 HGB zu löschen. Gegen die Löschung kann beim AG Bremen schriftlich oder zu Protokoll der Geschäftsstelle Widerspruch eingelegt werden. Widerspruchsfrist 4 Wochen."
    },
    {
      "date": "2025-04-25",
      "id": "107424",
      "original_text": "Einreichung neuer Dokumente\nBremen Amtsgericht Bremen HRB 21071\nSikora Aktiengesellschaft – Bremen",
      "type": "Einreichung neuer Dokumente",
      "state": "Bremen",
      "amtsgericht": "Amtsgericht Bremen",
      "registernummer": "HRB 21071",
      "registerart": "HRB",
      "company_name": "Sikora Aktiengesellschaft",
      "company_seat": "Bremen",
      "details": "25.04.2025 (Bekanntmachungsdatum)\n\nBremen Amtsgericht Bremen HRB 21071\nEinreichung neuer Dokumente\n\nSikora Aktiengesellschaft\nAktiengesellschaft\nBremen\n\nAls nicht eingetragen wird bekannt gemacht: Liste des Aufsichtsrats wurde eingereicht."
    },
    {
      "date": "2025-04-25",
      "id": "107425",
      "original_text": "Einreichung neuer Dokumente\nThüringen Amtsgericht Jena HRB 210572\nsmartfiber AG – Rudolstadt",
      "type": "Einreichung neuer Dokumente",
      "state": "Thüringen",
      "amtsgericht": "Amtsgericht Jena",
      "registernummer": "HRB 210572",
      "registerart": "HRB",
      "company_name": "smartfiber AG",
      "company_seat": "Rudolstadt",
      "details": "25.04.2025 (Bekanntmachungsdatum)\n\nThüringen Amtsgericht Jena HRB 210572\nEinreichung neuer Dokumente 25.04.2025 (Eintragungsdatum)\n\nsmartfiber AG\nAktiengesellschaft\nRudolstadt\n\nBekanntmachung gem. § 106 AktG: Aufgrund einer Veränderung in den Personen der Aufsichtsratsmitglieder ist durch den Vorstand eine neue Liste zum Handelsregister eingereicht worden."
    },
    {
      "date": "2025-04-25",
      "id": "107426",
      "original_text": "Sonstige Registerbekanntmachung\nHessen Amtsgericht Frankfurt am Main HRB 89384\nHouse of Logistics & Mobility (HOLM) GmbH – Frankfurt am Main",
      "type": "Sonstige Registerbekanntmachung",
      "state": "Hessen",
      "amtsgericht": "Amtsgericht Frankfurt am Main",
      "registernummer": "HRB 89384",
      "registerart": "HRB",
      "company_name": "House of Logistics & Mobility (HOLM) GmbH",
      "company_seat": "Frankfurt am Main",
      "details": "25.04.2025 (Bekanntmachungsdatum)\n\nHessen Amtsgericht Frankfurt am Main HRB 89384\nSonstige Registerbekanntmachung 25.04.2025 (Eintragungsdatum)\n\nHouse of Logistics & Mobility (HOLM) GmbH\nGesellschaft mit beschränkter Haftung\nFrankfurt am Main\n\nDurch eine Änderung in den Personen der Aufsichtsratsmitglieder ist eine Liste der Mitglieder des Aufsichtsrates zum Handelsregister eingereicht worden."
    },
    {
      "date": "2025-04-25",
      "id": "107427",
      "original_text": "Registerbekanntmachung nach dem Umwandlungsgesetz\nHessen Amtsgericht Bad Homburg v.d.H. HRB 16657\nSRK Germany UG (haftungsbeschränkt) – Friedrichsdorf",
      "type": "Registerbekanntmachung nach dem Umwandlungsgesetz",
      "state": "Hessen",
      "amtsgericht": "Amtsgericht Bad Homburg v.d.H.",
      "registernummer": "HRB 16657",
      "registerart": "HRB",
      "company_name": "SRK Germany UG (haftungsbeschränkt)",
      "company_seat": "Friedrichsdorf",
      "details": "25.04.2025 (Bekanntmachungsdatum)\n\nHessen Amtsgericht Bad Homburg v.d.H. HRB 16657\nRegisterbekanntmachung nach dem Umwandlungsgesetz 25.04.2025 (Eintragungsdatum)\n\nSRK Germany UG (haftungsbeschränkt)\nGesellschaft mit beschränkter Haftung\nFriedrichsdorf\n\nDen Gläubigern der Gesellschaft, deren Forderungen begründet worden sind, bevor die Eintragung der Beendigung des Vertrags in das Handelsregister nach § 10 HGB bekannt gemacht worden ist, ist vom anderen Vertragsteil Sicherheit zu leisten, wenn sie sich binnen sechs Monaten nach dieser Bekanntmachung zu diesem Zweck bei ihm melden.Den Gläubigern der an der Verschmelzung beteiligten Rechtsträger ist, wenn sie binnen sechs Monaten nach dem Tag, an dem die Eintragung der Verschmelzung in das Register des Sitzes derjenigen Rechtsträger deren Gläubiger sie sind, nach § 19 Absatz 3 UmwG bekannt gemacht worden ist, ihren Anspruch nach Grund und Höhe schriftlich anmelden, Sicherheit zu leisten, soweit sie nicht Befriedigung verlangen können. Dieses Recht steht den Gläubigern jedoch nur zu, wenn sie glaubhaft machen, dass durch die Verschmelzung die Erfüllung ihrer Forderung gefährdet wird."
    },
    {
      "date": "2025-04-25",
      "id": "107428",
      "original_text": "Löschungsankündigung\nHessen Amtsgericht Eschwege HRB 3246\nHenning Bau GmbH – Herleshausen",
      "type": "Löschungsankündigung",
      "state": "Hessen",
      "amtsgericht": "Amtsgericht Eschwege",
      "registernummer": "HRB 3246",
      "registerart": "HRB",
      "company_name": "Henning Bau GmbH",
      "company_seat": "Herleshausen",
      "details": "25.04.2025 (Bekanntmachungsdatum)\n\nHessen Amtsgericht Eschwege HRB 3246\nLöschungsankündigung\n\nHenning Bau GmbH\nGesellschaft mit beschränkter Haftung\nHerleshausen\n\nDas Registergericht beabsichtigt die im Handelsregister eingetragene Gesellschaft von Amts wegen nach § 394 FamFG zu löschen. Die Frist zur Erhebung eines Widerspruchs gegen die beabsichtigte Löschung wird auf 3 Monate festgesetzt."
    },
    {
      "date": "2025-04-25",
      "id": "107429",
      "original_text": "Registerbekanntmachung nach dem Umwandlungsgesetz\nHessen Amtsgericht Bad Homburg v.d.H. HRB 16682\nColumbus Trading UG (haftungsbeschränkt) – Friedrichsdorf",
      "type": "Registerbekanntmachung nach dem Umwandlungsgesetz",
      "state": "Hessen",
      "amtsgericht": "Amtsgericht Bad Homburg v.d.H.",
      "registernummer": "HRB 16682",
      "registerart": "HRB",
      "company_name": "Columbus Trading UG (haftungsbeschränkt)",
      "company_seat": "Friedrichsdorf",
      "details": "25.04.2025 (Bekanntmachungsdatum)\n\nHessen Amtsgericht Bad Homburg v.d.H. HRB 16682\nRegisterbekanntmachung nach dem Umwandlungsgesetz 25.04.2025 (Eintragungsdatum)\n\nColumbus Trading UG (haftungsbeschränkt)\nGesellschaft mit beschränkter Haftung\nFriedrichsdorf\n\nDen Gläubigern der an der Verschmelzung beteiligten Rechtsträger ist, wenn sie binnen sechs Monaten nach dem Tag, an dem die Eintragung der Verschmelzung in das Register des Sitzes derjenigen Rechtsträger deren Gläubiger sie sind, nach § 19 Absatz 3 UmwG bekannt gemacht worden ist, ihren Anspruch nach Grund und Höhe schriftlich anmelden, Sicherheit zu leisten, soweit sie nicht Befriedigung verlangen können. Dieses Recht steht den Gläubigern jedoch nur zu, wenn sie glaubhaft machen, dass durch die Verschmelzung die Erfüllung ihrer Forderung gefährdet wird."
    },
    {
      "date": "2025-04-25",
      "id": "107430",
      "original_text": "Registerbekanntmachung nach dem Umwandlungsgesetz\nHessen Amtsgericht Bad Homburg v.d.H. HRB 16681\nMain Handels UG (haftungsbeschränkt) – Friedrichsdorf",
      "type": "Registerbekanntmachung nach dem Umwandlungsgesetz",
      "state": "Hessen",
      "amtsgericht": "Amtsgericht Bad Homburg v.d.H.",
      "registernummer": "HRB 16681",
      "registerart": "HRB",
      "company_name": "Main Handels UG (haftungsbeschränkt)",
      "company_seat": "Friedrichsdorf",
      "details": "25.04.2025 (Bekanntmachungsdatum)\n\nHessen Amtsgericht Bad Homburg v.d.H. HRB 16681\nRegisterbekanntmachung nach dem Umwandlungsgesetz 25.04.2025 (Eintragungsdatum)\n\nMain Handels UG (haftungsbeschränkt)\nGesellschaft mit beschränkter Haftung\nFriedrichsdorf\n\nDen Gläubigern der an der Verschmelzung beteiligten Rechtsträger ist, wenn sie binnen sechs Monaten nach dem Tag, an dem die Eintragung der Verschmelzung in das Register des Sitzes derjenigen Rechtsträger deren Gläubiger sie sind, nach § 19 Absatz 3 UmwG bekannt gemacht worden ist, ihren Anspruch nach Grund und Höhe schriftlich anmelden, Sicherheit zu leisten, soweit sie nicht Befriedigung verlangen können. Dieses Recht steht den Gläubigern jedoch nur zu, wenn sie glaubhaft machen, dass durch die Verschmelzung die Erfüllung ihrer Forderung gefährdet wird."
    },
    {
      "date": "2025-04-25",
      "id": "107431",
      "original_text": "Registerbekanntmachung nach dem Umwandlungsgesetz\nHessen Amtsgericht Bad Homburg v.d.H. HRB 16638\nMAIN Management UG (haftungsbeschränkt) – Friedrichsdorf",
      "type": "Registerbekanntmachung nach dem Umwandlungsgesetz",
      "state": "Hessen",
      "amtsgericht": "Amtsgericht Bad Homburg v.d.H.",
      "registernummer": "HRB 16638",
      "registerart": "HRB",
      "company_name": "MAIN Management UG (haftungsbeschränkt)",
      "company_seat": "Friedrichsdorf",
      "details": "25.04.2025 (Bekanntmachungsdatum)\n\nHessen Amtsgericht Bad Homburg v.d.H. HRB 16638\nRegisterbekanntmachung nach dem Umwandlungsgesetz 25.04.2025 (Eintragungsdatum)\n\nMAIN Management UG (haftungsbeschränkt)\nGesellschaft mit beschränkter Haftung\nFriedrichsdorf\n\nDen Gläubigern der an der Verschmelzung beteiligten Rechtsträger ist, wenn sie binnen sechs Monaten nach dem Tag, an dem die Eintragung der Verschmelzung in das Register des Sitzes derjenigen Rechtsträger deren Gläubiger sie sind, nach § 19 Absatz 3 UmwG bekannt gemacht worden ist, ihren Anspruch nach Grund und Höhe schriftlich anmelden, Sicherheit zu leisten, soweit sie nicht Befriedigung verlangen können. Dieses Recht steht den Gläubigern jedoch nur zu, wenn sie glaubhaft machen, dass durch die Verschmelzung die Erfüllung ihrer Forderung gefährdet wird."
    },
    {
      "date": "2025-04-25",
      "id": "107432",
      "original_text": "Löschungsankündigung\nHessen Amtsgericht Darmstadt HRA 52735\nDörr, Stahlhandel, Elektro und Sanitär KG – Mörfelden-Walldorf",
      "type": "Löschungsankündigung",
      "state": "Hessen",
      "amtsgericht": "Amtsgericht Darmstadt",
      "registernummer": "HRA 52735",
      "registerart": "HRA",
      "company_name": "Dörr, Stahlhandel, Elektro und Sanitär KG",
      "company_seat": "Mörfelden-Walldorf",
      "details": "25.04.2025 (Bekanntmachungsdatum)\n\nHessen Amtsgericht Darmstadt HRA 52735\nLöschungsankündigung\n\nDörr, Stahlhandel, Elektro und Sanitär KG\nKommanditgesellschaft\nMörfelden-Walldorf\n\nDas Registergericht beabsichtigt die im Handelsregister eingetragene Firma von Amts wegen nach § 394 FamFG zu löschen. Die Frist zur Erhebung eines Widerspruchs gegen die beabsichtigte Löschung wird auf 3 Monate festgesetzt."
    },
    {
      "date": "2025-04-25",
      "id": "107433",
      "original_text": "Löschungsankündigung\nHessen Amtsgericht Frankfurt am Main HRB 99003\nB & R Bau GmbH – Frankfurt am Main",
      "type": "Löschungsankündigung",
      "state": "Hessen",
      "amtsgericht": "Amtsgericht Frankfurt am Main",
      "registernummer": "HRB 99003",
      "registerart": "HRB",
      "company_name": "B & R Bau GmbH",
      "company_seat": "Frankfurt am Main",
      "details": "25.04.2025 (Bekanntmachungsdatum)\n\nHessen Amtsgericht Frankfurt am Main HRB 99003\nLöschungsankündigung\n\nB & R Bau GmbH\nGesellschaft mit beschränkter Haftung\nFrankfurt am Main\n\nDas Registergericht beabsichtigt die im Handelsregister eingetragene Gesellschaft von Amts wegen nach § 394 FamFG zu löschen. Die Frist zur Erhebung eines Widerspruchs gegen die beabsichtigte Löschung wird auf 1 Monat festgesetzt."
    },
    {
      "date": "2025-04-25",
      "id": "107434",
      "original_text": "Sonstige Registerbekanntmachung\nHessen Amtsgericht Wiesbaden VR 6875\nFördergesellschaft Samurai-Programm e. V. – Wiesbaden",
      "type": "Sonstige Registerbekanntmachung",
      "state": "Hessen",
      "amtsgericht": "Amtsgericht Wiesbaden",
      "registernummer": "VR 6875",
      "registerart": "VR",
      "company_name": "Fördergesellschaft Samurai-Programm e. V.",
      "company_seat": "Wiesbaden",
      "details": "25.04.2025 (Bekanntmachungsdatum)\n\nHessen Amtsgericht Wiesbaden VR 6875\nSonstige Registerbekanntmachung 25.04.2025 (Eintragungsdatum)\n\nFördergesellschaft Samurai-Programm e. V.\neingetragener Verein\nWiesbaden\n\nDer Verein ist aufgelöst."
    },
    {
      "date": "2025-04-25",
      "id": "107435",
      "original_text": "Löschungsankündigung\nHessen Amtsgericht Frankfurt am Main HRB 115572\nY&N Gebäudeservice GmbH – Hattersheim am Main",
      "type": "Löschungsankündigung",
      "state": "Hessen",
      "amtsgericht": "Amtsgericht Frankfurt am Main",
      "registernummer": "HRB 115572",
      "registerart": "HRB",
      "company_name": "Y&N Gebäudeservice GmbH",
      "company_seat": "Hattersheim am Main",
      "details": "25.04.2025 (Bekanntmachungsdatum)\n\nHessen Amtsgericht Frankfurt am Main HRB 115572\nLöschungsankündigung\n\nY&N Gebäudeservice GmbH\nGesellschaft mit beschränkter Haftung\nHattersheim am Main\n\nEs ist beabsichtig, die Gesellschaft wegen Vermögenslosigkeit gemäß § 394 FamFG von Amts wegen im Handelsregister zu löschen. Hiergegen kann innerhalb eines Zeitraums von 1 Monat nach dieser Veröffentlichung Widerspruch bei dem Amtsgericht Frankfurt am Main eingelegt werden."
    },
    {
      "date": "2025-04-25",
      "id": "107436",
      "original_text": "Sonstige Registerbekanntmachung\nHessen Amtsgericht Wetzlar HRB 8836\nNatStruct AG – Wetzlar",
      "type": "Sonstige Registerbekanntmachung",
      "state": "Hessen",
      "amtsgericht": "Amtsgericht Wetzlar",
      "registernummer": "HRB 8836",
      "registerart": "HRB",
      "company_name": "NatStruct AG",
      "company_seat": "Wetzlar",
      "details": "25.04.2025 (Bekanntmachungsdatum)\n\nHessen Amtsgericht Wetzlar HRB 8836\nSonstige Registerbekanntmachung\n\nNatStruct AG\nAktiengesellschaft\nWetzlar\n\nDurch eine Änderung in den Personen der Aufsichtsratsmitglieder ist eine Liste der Mitglieder des Aufsichtsrates zum Handelsregister eingereicht worden."
    },
    {
      "date": "2025-04-25",
      "id": "107437",
      "original_text": "Registerbekanntmachung nach dem Umwandlungsgesetz\nHessen Amtsgericht Bad Homburg v.d.H. HRB 16625\nMAIN Business Services UG (haftungsbeschränkt) – Friedrichsdorf",
      "type": "Registerbekanntmachung nach dem Umwandlungsgesetz",
      "state": "Hessen",
      "amtsgericht": "Amtsgericht Bad Homburg v.d.H.",
      "registernummer": "HRB 16625",
      "registerart": "HRB",
      "company_name": "MAIN Business Services UG (haftungsbeschränkt)",
      "company_seat": "Friedrichsdorf",
      "details": "25.04.2025 (Bekanntmachungsdatum)\n\nHessen Amtsgericht Bad Homburg v.d.H. HRB 16625\nRegisterbekanntmachung nach dem Umwandlungsgesetz 25.04.2025 (Eintragungsdatum)\n\nMAIN Business Services UG (haftungsbeschränkt)\nGesellschaft mit beschränkter Haftung\nFriedrichsdorf\n\nDen Gläubigern der an der Verschmelzung beteiligten Rechtsträger ist, wenn sie binnen sechs Monaten nach dem Tag, an dem die Eintragung der Verschmelzung in das Register des Sitzes derjenigen Rechtsträger deren Gläubiger sie sind, nach § 19 Absatz 3 UmwG bekannt gemacht worden ist, ihren Anspruch nach Grund und Höhe schriftlich anmelden, Sicherheit zu leisten, soweit sie nicht Befriedigung verlangen können. Dieses Recht steht den Gläubigern jedoch nur zu, wenn sie glaubhaft machen, dass durch die Verschmelzung die Erfüllung ihrer Forderung gefährdet wird."
    }
  ]
}