{
  "date": "2025-04-23",
  "date_of_scrape": "2025-05-31T06:35:39.327Z",
  "tool_version": "0.2.0",
  "number_of_announcements": 125,
  "announcements": [
    {
      "date": "2025-04-23",
      "id": "107096",
      "original_text": "Registerbekanntmachung nach dem Umwandlungsgesetz\nBayern Amtsgericht München HRB 289088\nPNZ B24 Beteiligungs UG (haftungsbeschränkt) – München",
      "type": "Registerbekanntmachung nach dem Umwandlungsgesetz",
      "state": "Bayern",
      "amtsgericht": "Amtsgericht München",
      "registernummer": "HRB 289088",
      "registerart": "HRB",
      "company_name": "PNZ B24 Beteiligungs UG (haftungsbeschränkt)",
      "company_seat": "München",
      "details": "23.04.2025 (Bekanntmachungsdatum)\n\nBayern Amtsgericht München HRB 289088\nRegisterbekanntmachung nach dem Umwandlungsgesetz 22.04.2025 (Eintragungsdatum)\n\nPNZ B24 Beteiligungs UG (haftungsbeschränkt)\nGesellschaft mit beschränkter Haftung\nMünchen\n\nDen Gläubigern der an der Verschmelzung beteiligten Rechtsträger ist, wenn sie binnen sechs Monaten nach dem Tag, an dem die Eintragung der Verschmelzung in das Register des Sitzes desjenigen Rechtsträgers, dessen Gläubiger sie sind, nach § 19 Abs. 3 UmwG als bekannt gemacht gilt, ihren Anspruch nach Grund und Höhe in Textform anmelden, Sicherheit zu leisten, soweit sie nicht Befriedigung verlangen können. Dieses Recht steht den Gläubigern jedoch nur zu, wenn sie glaubhaft machen, dass durch die Verschmelzung die Erfüllung ihrer Forderung gefährdet wird."
    },
    {
      "date": "2025-04-23",
      "id": "107097",
      "original_text": "Einreichung neuer Dokumente\nBayern Amtsgericht München HRB 294069\nVentrifossa BidCo AG – München",
      "type": "Einreichung neuer Dokumente",
      "state": "Bayern",
      "amtsgericht": "Amtsgericht München",
      "registernummer": "HRB 294069",
      "registerart": "HRB",
      "company_name": "Ventrifossa BidCo AG",
      "company_seat": "München",
      "details": "23.04.2025 (Bekanntmachungsdatum)\n\nBayern Amtsgericht München HRB 294069\nEinreichung neuer Dokumente\n\nVentrifossa BidCo AG\nAktiengesellschaft\nMünchen\n\nDem Amtsgericht München -Registergericht- ist eine Liste der Mitglieder des Aufsichtsrats eingereicht worden, § 106 AktG."
    },
    {
      "date": "2025-04-23",
      "id": "107098",
      "original_text": "Registerbekanntmachung nach dem Umwandlungsgesetz\nBayern Amtsgericht Augsburg HRB 10222\nProSale Handelsgesellschaft mbH – Königsbrunn",
      "type": "Registerbekanntmachung nach dem Umwandlungsgesetz",
      "state": "Bayern",
      "amtsgericht": "Amtsgericht Augsburg",
      "registernummer": "HRB 10222",
      "registerart": "HRB",
      "company_name": "ProSale Handelsgesellschaft mbH",
      "company_seat": "Königsbrunn",
      "details": "23.04.2025 (Bekanntmachungsdatum)\n\nBayern Amtsgericht Augsburg HRB 10222\nRegisterbekanntmachung nach dem Umwandlungsgesetz 22.04.2025 (Eintragungsdatum)\n\nProSale Handelsgesellschaft mbH\nGesellschaft mit beschränkter Haftung\nKönigsbrunn\n\nDen Gläubigern der an der Verschmelzung beteiligten Rechtsträger ist, wenn sie binnen sechs Monaten nach dem Tag, an dem die Eintragung der Verschmelzung in das Register des Sitzes desjenigen Rechtsträgers, dessen Gläubiger sie sind, nach § 19 Abs. 3 UmwG als bekannt gemacht gilt, ihren Anspruch nach Grund und Höhe in Textform anmelden, Sicherheit zu leisten, soweit sie nicht Befriedigung verlangen können. Dieses Recht steht den Gläubigern jedoch nur zu, wenn sie glaubhaft machen, dass durch die Verschmelzung die Erfüllung ihrer Forderung gefährdet wird."
    },
    {
      "date": "2025-04-23",
      "id": "107099",
      "original_text": "Registerbekanntmachung nach dem Umwandlungsgesetz\nBayern Amtsgericht Traunstein HRA 13001\nSteiner Obst und Gemüse Inh. Günter Steiner e.K. – Raubling",
      "type": "Registerbekanntmachung nach dem Umwandlungsgesetz",
      "state": "Bayern",
      "amtsgericht": "Amtsgericht Traunstein",
      "registernummer": "HRA 13001",
      "registerart": "HRA",
      "company_name": "Steiner Obst und Gemüse Inh. Günter Steiner e.K.",
      "company_seat": "Raubling",
      "details": "23.04.2025 (Bekanntmachungsdatum)\n\nBayern Amtsgericht Traunstein HRA 13001\nRegisterbekanntmachung nach dem Umwandlungsgesetz 22.04.2025 (Eintragungsdatum)\n\nSteiner Obst und Gemüse Inh. Günter Steiner e.K.\nEinzelkaufmann / Einzelkauffrau\nRaubling\n\nDen Gläubigern der an der Ausgliederung beteiligten Rechtsträger ist, wenn sie binnen sechs Monaten nach dem Tag, an dem die Eintragung der Ausgliederung in das Register des Sitzes desjenigen Rechtsträgers, dessen Gläubiger sie sind, nach §§ 125, 19 Abs. 3 UmwG als bekannt gemacht gilt, ihren Anspruch nach Grund und Höhe in Textform anmelden, Sicherheit zu leisten, soweit sie nicht Befriedigung verlangen können. Dieses Recht steht den Gläubigern jedoch nur zu, wenn sie glaubhaft machen, dass durch die Ausgliederung die Erfüllung ihrer Forderung gefährdet wird."
    },
    {
      "date": "2025-04-23",
      "id": "107100",
      "original_text": "Einreichung neuer Dokumente\nBayern Amtsgericht Regensburg HRB 18841\nVitesco Technologies GmbH – Regensburg",
      "type": "Einreichung neuer Dokumente",
      "state": "Bayern",
      "amtsgericht": "Amtsgericht Regensburg",
      "registernummer": "HRB 18841",
      "registerart": "HRB",
      "company_name": "Vitesco Technologies GmbH",
      "company_seat": "Regensburg",
      "details": "23.04.2025 (Bekanntmachungsdatum)\n\nBayern Amtsgericht Regensburg HRB 18841\nEinreichung neuer Dokumente\n\nVitesco Technologies GmbH\nGesellschaft mit beschränkter Haftung\nRegensburg\n\nDem Amtsgericht Regensburg -Registergericht- ist eine Liste der Mitglieder des Aufsichtsrats eingereicht worden, § 52 Abs. 3 S. 2 GmbHG."
    },
    {
      "date": "2025-04-23",
      "id": "107101",
      "original_text": "Löschungsankündigung\nBayern Amtsgericht München HRB 272602\nAid Garten- und Landschaftsbau GmbH – München",
      "type": "Löschungsankündigung",
      "state": "Bayern",
      "amtsgericht": "Amtsgericht München",
      "registernummer": "HRB 272602",
      "registerart": "HRB",
      "company_name": "Aid Garten- und Landschaftsbau GmbH",
      "company_seat": "München",
      "details": "23.04.2025 (Bekanntmachungsdatum)\n\nBayern Amtsgericht München HRB 272602\nLöschungsankündigung 22.04.2025 (Eintragungsdatum)\n\nAid Garten- und Landschaftsbau GmbH\nGesellschaft mit beschränkter Haftung\nMünchen\n\nDas Registergericht beabsichtigt, den im Handelsregister eingetragenen Geschäftsführer Bilali Djevat wegen fehlender Eignung nach § 395 FamFG zu löschen. Die Frist zur Erhebung eines Widerspruchs ist auf drei Monate festgesetzt."
    },
    {
      "date": "2025-04-23",
      "id": "107102",
      "original_text": "Registerbekanntmachung nach dem Umwandlungsgesetz\nBayern Amtsgericht München HRB 168889\nConstantin Television GmbH – München",
      "type": "Registerbekanntmachung nach dem Umwandlungsgesetz",
      "state": "Bayern",
      "amtsgericht": "Amtsgericht München",
      "registernummer": "HRB 168889",
      "registerart": "HRB",
      "company_name": "Constantin Television GmbH",
      "company_seat": "München",
      "details": "23.04.2025 (Bekanntmachungsdatum)\n\nBayern Amtsgericht München HRB 168889\nRegisterbekanntmachung nach dem Umwandlungsgesetz 22.04.2025 (Eintragungsdatum)\n\nConstantin Television GmbH\nGesellschaft mit beschränkter Haftung\nMünchen\n\nDen Gläubigern der an der Verschmelzung beteiligten Rechtsträger ist, wenn sie binnen sechs Monaten nach dem Tag, an dem die Eintragung der Verschmelzung in das Register des Sitzes desjenigen Rechtsträgers, dessen Gläubiger sie sind, nach § 19 Abs. 3 UmwG als bekannt gemacht gilt, ihren Anspruch nach Grund und Höhe in Textform anmelden, Sicherheit zu leisten, soweit sie nicht Befriedigung verlangen können. Dieses Recht steht den Gläubigern jedoch nur zu, wenn sie glaubhaft machen, dass durch die Verschmelzung die Erfüllung ihrer Forderung gefährdet wird."
    },
    {
      "date": "2025-04-23",
      "id": "107103",
      "original_text": "Löschungsankündigung\nBayern Amtsgericht München HRB 252623\nHolmija GmbH – München",
      "type": "Löschungsankündigung",
      "state": "Bayern",
      "amtsgericht": "Amtsgericht München",
      "registernummer": "HRB 252623",
      "registerart": "HRB",
      "company_name": "Holmija GmbH",
      "company_seat": "München",
      "details": "23.04.2025 (Bekanntmachungsdatum)\n\nBayern Amtsgericht München HRB 252623\nLöschungsankündigung 22.04.2025 (Eintragungsdatum)\n\nHolmija GmbH\nGesellschaft mit beschränkter Haftung\nMünchen\n\nDas Registergericht beabsichtigt, die im Handelsregister eingetragene Gesellschaft wegen Vermögenslosigkeit von Amts wegen nach § 394 FamFG zu löschen. Die Frist zur Erhebung eines Widerspruchs ist auf drei Monate festgesetzt."
    },
    {
      "date": "2025-04-23",
      "id": "107104",
      "original_text": "Registerbekanntmachung nach dem Umwandlungsgesetz\nBayern Amtsgericht Würzburg HRB 17858\nMatthews Marking Systems Management GmbH – Estenfeld",
      "type": "Registerbekanntmachung nach dem Umwandlungsgesetz",
      "state": "Bayern",
      "amtsgericht": "Amtsgericht Würzburg",
      "registernummer": "HRB 17858",
      "registerart": "HRB",
      "company_name": "Matthews Marking Systems Management GmbH",
      "company_seat": "Estenfeld",
      "details": "23.04.2025 (Bekanntmachungsdatum)\n\nBayern Amtsgericht Würzburg HRB 17858\nRegisterbekanntmachung nach dem Umwandlungsgesetz 22.04.2025 (Eintragungsdatum)\n\nMatthews Marking Systems Management GmbH\nGesellschaft mit beschränkter Haftung\nEstenfeld\n\nDen Gläubigern der an der Verschmelzung beteiligten Rechtsträger ist, wenn sie binnen sechs Monaten nach dem Tag, an dem die Eintragung der Verschmelzung in das Register des Sitzes desjenigen Rechtsträgers, dessen Gläubiger sie sind, nach § 19 Abs. 3 UmwG als bekannt gemacht gilt, ihren Anspruch nach Grund und Höhe in Textform anmelden, Sicherheit zu leisten, soweit sie nicht Befriedigung verlangen können. Dieses Recht steht den Gläubigern jedoch nur zu, wenn sie glaubhaft machen, dass durch die Verschmelzung die Erfüllung ihrer Forderung gefährdet wird."
    },
    {
      "date": "2025-04-23",
      "id": "107105",
      "original_text": "Registerbekanntmachung nach dem Umwandlungsgesetz\nBayern Amtsgericht Nürnberg HRB 26754\nDr. Storg GmbH Wirtschaftsprüfungsgesellschaft Steuerberatungsgesellschaft – Nürnberg",
      "type": "Registerbekanntmachung nach dem Umwandlungsgesetz",
      "state": "Bayern",
      "amtsgericht": "Amtsgericht Nürnberg",
      "registernummer": "HRB 26754",
      "registerart": "HRB",
      "company_name": "Dr. Storg GmbH Wirtschaftsprüfungsgesellschaft Steuerberatungsgesellschaft",
      "company_seat": "Nürnberg",
      "details": "23.04.2025 (Bekanntmachungsdatum)\n\nBayern Amtsgericht Nürnberg HRB 26754\nRegisterbekanntmachung nach dem Umwandlungsgesetz 22.04.2025 (Eintragungsdatum)\n\nDr. Storg GmbH Wirtschaftsprüfungsgesellschaft Steuerberatungsgesellschaft\nGesellschaft mit beschränkter Haftung\nNürnberg\n\nDen Gläubigern der an der Verschmelzung beteiligten Rechtsträger ist, wenn sie binnen sechs Monaten nach dem Tag, an dem die Eintragung der Verschmelzung in das Register des Sitzes desjenigen Rechtsträgers, dessen Gläubiger sie sind, nach § 19 Abs. 3 UmwG als bekannt gemacht gilt, ihren Anspruch nach Grund und Höhe in Textform anmelden, Sicherheit zu leisten, soweit sie nicht Befriedigung verlangen können. Dieses Recht steht den Gläubigern jedoch nur zu, wenn sie glaubhaft machen, dass durch die Verschmelzung die Erfüllung ihrer Forderung gefährdet wird."
    },
    {
      "date": "2025-04-23",
      "id": "107106",
      "original_text": "Einreichung neuer Dokumente\nBayern Amtsgericht Regensburg HRB 1081\nKatholisches Wohnungsbau- und Siedlungswerk der Diözese Regensburg GmbH – Regensburg",
      "type": "Einreichung neuer Dokumente",
      "state": "Bayern",
      "amtsgericht": "Amtsgericht Regensburg",
      "registernummer": "HRB 1081",
      "registerart": "HRB",
      "company_name": "Katholisches Wohnungsbau- und Siedlungswerk der Diözese Regensburg GmbH",
      "company_seat": "Regensburg",
      "details": "23.04.2025 (Bekanntmachungsdatum)\n\nBayern Amtsgericht Regensburg HRB 1081\nEinreichung neuer Dokumente 16.04.2025 (Eintragungsdatum)\n\nKatholisches Wohnungsbau- und Siedlungswerk der Diözese Regensburg GmbH\nGesellschaft mit beschränkter Haftung\nRegensburg\n\nDem #Re.Name ist eine Liste der Mitglieder des Aufsichtsrats eingereicht worden, § 52 Abs. 3 S. 2 GmbHG."
    },
    {
      "date": "2025-04-23",
      "id": "107107",
      "original_text": "Einreichung neuer Dokumente\nBayern Amtsgericht Regensburg HRB 1055\nBundesbahn-Wohnungsbaugesellschaft Regensburg mbH – Regensburg",
      "type": "Einreichung neuer Dokumente",
      "state": "Bayern",
      "amtsgericht": "Amtsgericht Regensburg",
      "registernummer": "HRB 1055",
      "registerart": "HRB",
      "company_name": "Bundesbahn-Wohnungsbaugesellschaft Regensburg mbH",
      "company_seat": "Regensburg",
      "details": "23.04.2025 (Bekanntmachungsdatum)\n\nBayern Amtsgericht Regensburg HRB 1055\nEinreichung neuer Dokumente\n\nBundesbahn-Wohnungsbaugesellschaft Regensburg mbH\nGesellschaft mit beschränkter Haftung\nRegensburg\n\nDem Amtsgericht Regensburg -Registergericht- ist eine Liste der Mitglieder des Aufsichtsrats eingereicht worden, § 52 Abs. 3 S. 2 GmbHG."
    },
    {
      "date": "2025-04-23",
      "id": "107108",
      "original_text": "Registerbekanntmachung nach dem Umwandlungsgesetz\nBayern Amtsgericht München HRB 274394\nInformation Builders (Deutschland) GmbH – München",
      "type": "Registerbekanntmachung nach dem Umwandlungsgesetz",
      "state": "Bayern",
      "amtsgericht": "Amtsgericht München",
      "registernummer": "HRB 274394",
      "registerart": "HRB",
      "company_name": "Information Builders (Deutschland) GmbH",
      "company_seat": "München",
      "details": "23.04.2025 (Bekanntmachungsdatum)\n\nBayern Amtsgericht München HRB 274394\nRegisterbekanntmachung nach dem Umwandlungsgesetz 22.04.2025 (Eintragungsdatum)\n\nInformation Builders (Deutschland) GmbH\nGesellschaft mit beschränkter Haftung\nMünchen\n\nDen Gläubigern der an der Verschmelzung beteiligten Rechtsträger ist, wenn sie binnen sechs Monaten nach dem Tag, an dem die Eintragung der Verschmelzung in das Register des Sitzes desjenigen Rechtsträgers, dessen Gläubiger sie sind, nach § 19 Abs. 3 UmwG als bekannt gemacht gilt, ihren Anspruch nach Grund und Höhe in Textform anmelden, Sicherheit zu leisten, soweit sie nicht Befriedigung verlangen können. Dieses Recht steht den Gläubigern jedoch nur zu, wenn sie glaubhaft machen, dass durch die Verschmelzung die Erfüllung ihrer Forderung gefährdet wird."
    },
    {
      "date": "2025-04-23",
      "id": "107109",
      "original_text": "Einreichung neuer Dokumente\nBayern Amtsgericht München HRB 199550\nHANNOVER LEASING Investment GmbH – Pullach i. Isartal",
      "type": "Einreichung neuer Dokumente",
      "state": "Bayern",
      "amtsgericht": "Amtsgericht München",
      "registernummer": "HRB 199550",
      "registerart": "HRB",
      "company_name": "HANNOVER LEASING Investment GmbH",
      "company_seat": "Pullach i. Isartal",
      "details": "23.04.2025 (Bekanntmachungsdatum)\n\nBayern Amtsgericht München HRB 199550\nEinreichung neuer Dokumente\n\nHANNOVER LEASING Investment GmbH\nGesellschaft mit beschränkter Haftung\nPullach i. Isartal\n\nDem Amtsgericht München -Registergericht- ist eine Liste der Mitglieder des Aufsichtsrats eingereicht worden, § 52 Abs. 3 S. 2 GmbHG."
    },
    {
      "date": "2025-04-23",
      "id": "107110",
      "original_text": "Einreichung neuer Dokumente\nBayern Amtsgericht München HRB 111650\nBayerische Beamtenkrankenkasse Aktiengesellschaft – München",
      "type": "Einreichung neuer Dokumente",
      "state": "Bayern",
      "amtsgericht": "Amtsgericht München",
      "registernummer": "HRB 111650",
      "registerart": "HRB",
      "company_name": "Bayerische Beamtenkrankenkasse Aktiengesellschaft",
      "company_seat": "München",
      "details": "23.04.2025 (Bekanntmachungsdatum)\n\nBayern Amtsgericht München HRB 111650\nEinreichung neuer Dokumente\n\nBayerische Beamtenkrankenkasse Aktiengesellschaft\nAktiengesellschaft\nMünchen\n\nDem Amtsgericht München -Registergericht- ist eine Liste der Mitglieder des Aufsichtsrats eingereicht worden, § 106 AktG."
    },
    {
      "date": "2025-04-23",
      "id": "107111",
      "original_text": "Löschungsankündigung\nBayern Amtsgericht München HRB 278604\nNRR CONSTRUCTION GmbH – München",
      "type": "Löschungsankündigung",
      "state": "Bayern",
      "amtsgericht": "Amtsgericht München",
      "registernummer": "HRB 278604",
      "registerart": "HRB",
      "company_name": "NRR CONSTRUCTION GmbH",
      "company_seat": "München",
      "details": "23.04.2025 (Bekanntmachungsdatum)\n\nBayern Amtsgericht München HRB 278604\nLöschungsankündigung 22.04.2025 (Eintragungsdatum)\n\nNRR CONSTRUCTION GmbH\nGesellschaft mit beschränkter Haftung\nMünchen\n\nDas Registergericht beabsichtigt, den im Handelsregister eingetragenen Geschäftsführer Horia Boran wegen fehlender Eignung nach § 395 FamFG zu löschen. Die Frist zur Erhebung eines Widerspruchs ist auf drei Monate festgesetzt."
    },
    {
      "date": "2025-04-23",
      "id": "107112",
      "original_text": "Registerbekanntmachung nach dem Umwandlungsgesetz\nBaden-Württemberg Amtsgericht Mannheim HRB 753390\nFunding Solutions Pensions GmbH – Walldorf",
      "type": "Registerbekanntmachung nach dem Umwandlungsgesetz",
      "state": "Baden-Württemberg",
      "amtsgericht": "Amtsgericht Mannheim",
      "registernummer": "HRB 753390",
      "registerart": "HRB",
      "company_name": "Funding Solutions Pensions GmbH",
      "company_seat": "Walldorf",
      "details": "23.04.2025 (Bekanntmachungsdatum)\n\nBaden-Württemberg Amtsgericht Mannheim HRB 753390\nRegisterbekanntmachung nach dem Umwandlungsgesetz 23.04.2025 (Eintragungsdatum)\n\nFunding Solutions Pensions GmbH\nGesellschaft mit beschränkter Haftung\nWalldorf\n\nAls nicht eingetragen wird bekanntgemacht:\nDen Gläubigern der an der Abspaltung beteiligten Rechtsträger ist, wenn sie binnen sechs Monaten nach dem Tag, an dem die Eintragung der Abspaltung in das Register des Sitzes desjenigen Rechtsträgers, dessen Gläubiger sie sind, nach § 19 Abs. 3 UmwG als bekanntgemacht gilt, ihren Anspruch nach Grund und Höhe schriftlich anmelden, Sicherheit zu leisten, soweit sie nicht Befriedigung verlangen können. Dieses Recht steht den Gläubigern jedoch nur zu, wenn sie glaubhaft machen, dass durch die Abspaltung die Erfüllung ihrer Forderung gefährdet wird."
    },
    {
      "date": "2025-04-23",
      "id": "107113",
      "original_text": "Registerbekanntmachung nach dem Umwandlungsgesetz\nBaden-Württemberg Amtsgericht Stuttgart HRB 779059\nALDI Aichtal Verwaltungs-SE – Aichtal",
      "type": "Registerbekanntmachung nach dem Umwandlungsgesetz",
      "state": "Baden-Württemberg",
      "amtsgericht": "Amtsgericht Stuttgart",
      "registernummer": "HRB 779059",
      "registerart": "HRB",
      "company_name": "ALDI Aichtal Verwaltungs-SE",
      "company_seat": "Aichtal",
      "details": "23.04.2025 (Bekanntmachungsdatum)\n\nBaden-Württemberg Amtsgericht Stuttgart HRB 779059\nRegisterbekanntmachung nach dem Umwandlungsgesetz\n\nALDI Aichtal Verwaltungs-SE\nEuropäische Aktiengesellschaft (SE)\nAichtal\n\nDie Gesellschaft hat am 17.04.2025 den Entwurf des Verschmelzungsvertrages zwischen \"ALDI Bingen Verwaltungs-SE\", Bingen (Amtsgericht Mainz HRB 50443)\nund der hiesigen Gesellschaft (übertragender Rechtsträger) zum Handelsregister eingereicht."
    },
    {
      "date": "2025-04-23",
      "id": "107114",
      "original_text": "Einreichung neuer Dokumente\nBaden-Württemberg Amtsgericht Stuttgart HRB 590730\nJAKO AG – Mulfingen",
      "type": "Einreichung neuer Dokumente",
      "state": "Baden-Württemberg",
      "amtsgericht": "Amtsgericht Stuttgart",
      "registernummer": "HRB 590730",
      "registerart": "HRB",
      "company_name": "JAKO AG",
      "company_seat": "Mulfingen",
      "details": "23.04.2025 (Bekanntmachungsdatum)\n\nBaden-Württemberg Amtsgericht Stuttgart HRB 590730\nEinreichung neuer Dokumente\n\nJAKO AG\nAktiengesellschaft\nMulfingen\n\nDie Gesellschaft hat am 17.04.2025 die Liste über die Zusammensetzung des Aufsichtsrats zum Handelsregister eingereicht."
    },
    {
      "date": "2025-04-23",
      "id": "107115",
      "original_text": "Löschungsankündigung\nBrandenburg Amtsgericht Potsdam HRB 24953\nFSB Flugschule Berlin GmbH – Trebbin",
      "type": "Löschungsankündigung",
      "state": "Brandenburg",
      "amtsgericht": "Amtsgericht Potsdam",
      "registernummer": "HRB 24953",
      "registerart": "HRB",
      "company_name": "FSB Flugschule Berlin GmbH",
      "company_seat": "Trebbin",
      "details": "23.04.2025 (Bekanntmachungsdatum)\n\nBrandenburg Amtsgericht Potsdam HRB 24953\nLöschungsankündigung\n\nFSB Flugschule Berlin GmbH\nGesellschaft mit beschränkter Haftung\nTrebbin\n\nBei der nachstehenden Gesellschaft wird das Amtslöschungsverfahren gemäß § 394 FamFG eingeleitet. Widerspruchsfrist: 8 Wochen."
    },
    {
      "date": "2025-04-23",
      "id": "107116",
      "original_text": "Einreichung neuer Dokumente\nBaden-Württemberg Amtsgericht Mannheim HRB 100565\nKerntechnische Entsorgung Karlsruhe GmbH – Eggenstein-Leopoldshafen",
      "type": "Einreichung neuer Dokumente",
      "state": "Baden-Württemberg",
      "amtsgericht": "Amtsgericht Mannheim",
      "registernummer": "HRB 100565",
      "registerart": "HRB",
      "company_name": "Kerntechnische Entsorgung Karlsruhe GmbH",
      "company_seat": "Eggenstein-Leopoldshafen",
      "details": "23.04.2025 (Bekanntmachungsdatum)\n\nBaden-Württemberg Amtsgericht Mannheim HRB 100565\nEinreichung neuer Dokumente\n\nKerntechnische Entsorgung Karlsruhe GmbH\nGesellschaft mit beschränkter Haftung\nEggenstein-Leopoldshafen\n\nDie Gesellschaft hat am 16.04.2025 die Liste über die Zusammensetzung des Aufsichtsrats zum Handelsregister eingereicht."
    },
    {
      "date": "2025-04-23",
      "id": "107117",
      "original_text": "Registerbekanntmachung nach dem Umwandlungsgesetz\nHamburg Amtsgericht Hamburg HRA 132294\nAirH Hamburg GmbH & Co. KG – Hamburg",
      "type": "Registerbekanntmachung nach dem Umwandlungsgesetz",
      "state": "Hamburg",
      "amtsgericht": "Amtsgericht Hamburg",
      "registernummer": "HRA 132294",
      "registerart": "HRA",
      "company_name": "AirH Hamburg GmbH & Co. KG",
      "company_seat": "Hamburg",
      "details": "23.04.2025 (Bekanntmachungsdatum)\n\nHamburg Amtsgericht Hamburg HRA 132294\nRegisterbekanntmachung nach dem Umwandlungsgesetz 23.04.2025 (Eintragungsdatum)\n\nAirH Hamburg GmbH & Co. KG\nKommanditgesellschaft\nHamburg\n\nAls nicht eingetragen wird bekannt gemacht:\nDen Gläubigern der an der formwechselnden Umwandlung beteiligten Gesellschaften ist, wenn sie binnen sechs Monaten nach dem Tag, an dem die Eintragung der formwechselnden Umwandlung in das Register des Sitzes desjenigen Rechtsträgers, dessen Gläubiger sie sind, nach § 19 Absatz 3 UmwG als bekannt gemacht gilt, ihren Anspruch nach Grund und Höhe schriftlich anmelden, Sicherheit zu leisten, soweit sie nicht Befriedigung verlangen können. Dieses Recht steht den Gläubigern jedoch nur zu, wenn sie glaubhaft machen, dass durch die formwechselnde Umwandlung die Erfüllung ihrer Forderung gefährdet wird."
    },
    {
      "date": "2025-04-23",
      "id": "107118",
      "original_text": "Registerbekanntmachung nach dem Umwandlungsgesetz\nHamburg Amtsgericht Hamburg HRB 102616\nAirH Hamburg GmbH – Hamburg",
      "type": "Registerbekanntmachung nach dem Umwandlungsgesetz",
      "state": "Hamburg",
      "amtsgericht": "Amtsgericht Hamburg",
      "registernummer": "HRB 102616",
      "registerart": "HRB",
      "company_name": "AirH Hamburg GmbH",
      "company_seat": "Hamburg",
      "details": "23.04.2025 (Bekanntmachungsdatum)\n\nHamburg Amtsgericht Hamburg HRB 102616\nRegisterbekanntmachung nach dem Umwandlungsgesetz 23.04.2025 (Eintragungsdatum)\n\nAirH Hamburg GmbH\nGesellschaft mit beschränkter Haftung\nHamburg\n\nAls nicht eingetragen wird bekannt gemacht:\nDen Gläubigern der an der formwechselnden Umwandlung beteiligten Gesellschaften ist, wenn sie binnen sechs Monaten nach dem Tag, an dem die Eintragung der formwechselnden Umwandlung in das Register des Sitzes desjenigen Rechtsträgers, dessen Gläubiger sie sind, nach § 19 Absatz 3 UmwG als bekannt gemacht gilt, ihren Anspruch nach Grund und Höhe schriftlich anmelden, Sicherheit zu leisten, soweit sie nicht Befriedigung verlangen können. Dieses Recht steht den Gläubigern jedoch nur zu, wenn sie glaubhaft machen, dass durch die formwechselnde Umwandlung die Erfüllung ihrer Forderung gefährdet wird."
    },
    {
      "date": "2025-04-23",
      "id": "107119",
      "original_text": "Löschungsankündigung\nSchleswig-Holstein Amtsgericht Flensburg HRB 11142\nMEB more-e-business GmbH – Flensburg",
      "type": "Löschungsankündigung",
      "state": "Schleswig-Holstein",
      "amtsgericht": "Amtsgericht Flensburg",
      "registernummer": "HRB 11142",
      "registerart": "HRB",
      "company_name": "MEB more-e-business GmbH",
      "company_seat": "Flensburg",
      "details": "23.04.2025 (Bekanntmachungsdatum)\n\nSchleswig-Holstein Amtsgericht Flensburg HRB 11142\nLöschungsankündigung\n\nMEB more-e-business GmbH\nGesellschaft mit beschränkter Haftung\nFlensburg\n\nEs ist die Löschung der nachstehenden Gesellschaft wegen Vermögenslosigkeit gemäß § 394 FamFG beabsichtigt.\nWiderspruchsfrist: 2 Monate"
    },
    {
      "date": "2025-04-23",
      "id": "107120",
      "original_text": "Löschungsankündigung\nSchleswig-Holstein Amtsgericht Lübeck HRB 22719\nSCM Food Invest GmbH – Ahrensburg",
      "type": "Löschungsankündigung",
      "state": "Schleswig-Holstein",
      "amtsgericht": "Amtsgericht Lübeck",
      "registernummer": "HRB 22719",
      "registerart": "HRB",
      "company_name": "SCM Food Invest GmbH",
      "company_seat": "Ahrensburg",
      "details": "23.04.2025 (Bekanntmachungsdatum)\n\nSchleswig-Holstein Amtsgericht Lübeck HRB 22719\nLöschungsankündigung\n\nSCM Food Invest GmbH\nGesellschaft mit beschränkter Haftung\nAhrensburg\n\nHerrn\nLenuta Negru\n\nPer Veröffentlichung\n\nDatum: 22.04.2025\n\nSehr geehrter Herr Negru,\n\nin der Handelsregistersache der\nSCM Food Invest GmbH\n\nergeben sich aus den mir vorliegenden Unterlagen Anhaltspunkte dafür, dass die Gesellschaft, als deren Geschäftsführer Sie noch eingetragen sind, vermögenslos ist.\n\nEs ist daher beabsichtigt, die Gesellschaft wegen Vermögenslosigkeit gemäß § 394 FamFG zu löschen.\n\nEs wird eine Frist von drei Monaten zur Geltendmachung eines Widerspruchs gegen die Löschung bestimmt, § 394 Abs. 2 S. 1 FamFG.\n\nNach Fristablauf ohne Widerspruch von Ihnen oder anderer Seite wird die Gesellschaft gelöscht.\n\nSchuppenhauer\nDipl.-Rechtspflegerin (FH)"
    },
    {
      "date": "2025-04-23",
      "id": "107121",
      "original_text": "Registerbekanntmachung nach dem Umwandlungsgesetz\nBaden-Württemberg Amtsgericht Stuttgart HRB 780474\nPlaza Group Real A Betriebsgesellschaft mbH – Heilbronn",
      "type": "Registerbekanntmachung nach dem Umwandlungsgesetz",
      "state": "Baden-Württemberg",
      "amtsgericht": "Amtsgericht Stuttgart",
      "registernummer": "HRB 780474",
      "registerart": "HRB",
      "company_name": "Plaza Group Real A Betriebsgesellschaft mbH",
      "company_seat": "Heilbronn",
      "details": "23.04.2025 (Bekanntmachungsdatum)\n\nBaden-Württemberg Amtsgericht Stuttgart HRB 780474\nRegisterbekanntmachung nach dem Umwandlungsgesetz 23.04.2025 (Eintragungsdatum)\n\nPlaza Group Real A Betriebsgesellschaft mbH\nGesellschaft mit beschränkter Haftung\nHeilbronn\n\nDen Gläubigern der an der Verschmelzung beteiligten Rechtsträger ist, wenn sie binnen sechs Monaten nach dem Tag, an dem die Eintragung der Verschmelzung in das Register des Sitzes desjenigen Rechtsträgers, dessen Gläubiger sie sind, nach § 19 Abs. 3 UmwG als bekanntgemacht gilt, ihren Anspruch nach Grund und Höhe schriftlich anmelden, Sicherheit zu leisten, soweit sie nicht Befriedigung verlangen können. Dieses Recht steht den Gläubigern jedoch nur zu, wenn sie glaubhaft machen, dass durch die Verschmelzung die Erfüllung ihrer Forderung gefährdet wird."
    },
    {
      "date": "2025-04-23",
      "id": "107122",
      "original_text": "Einreichung neuer Dokumente\nBrandenburg Amtsgericht Cottbus HRB 687\nBASF Schwarzheide GmbH – Schwarzheide",
      "type": "Einreichung neuer Dokumente",
      "state": "Brandenburg",
      "amtsgericht": "Amtsgericht Cottbus",
      "registernummer": "HRB 687",
      "registerart": "HRB",
      "company_name": "BASF Schwarzheide GmbH",
      "company_seat": "Schwarzheide",
      "details": "23.04.2025 (Bekanntmachungsdatum)\n\nBrandenburg Amtsgericht Cottbus HRB 687\nEinreichung neuer Dokumente\n\nBASF Schwarzheide GmbH\nGesellschaft mit beschränkter Haftung\nSchwarzheide\n\nDer Geschäftsführer hat eine Liste der Aufsichtsratsmitglieder gem. § 52 Abs. 2 Satz 2 GmbHG zum Handelsregister eingereicht."
    },
    {
      "date": "2025-04-23",
      "id": "107123",
      "original_text": "Löschungsankündigung\nBerlin Amtsgericht Berlin (Charlottenburg) HRB 151346\nInke International GmbH – Berlin",
      "type": "Löschungsankündigung",
      "state": "Berlin",
      "amtsgericht": "Amtsgericht Berlin (Charlottenburg)",
      "registernummer": "HRB 151346",
      "registerart": "HRB",
      "company_name": "Inke International GmbH",
      "company_seat": "Berlin",
      "details": "23.04.2025 (Bekanntmachungsdatum)\n\nBerlin Amtsgericht Berlin (Charlottenburg) HRB 151346\nLöschungsankündigung\n\nInke International GmbH\nGesellschaft mit beschränkter Haftung\nBerlin\n\nBei der nachstehenden Gesellschaft wird das Amtslöschungsverfahren gemäß § 394 FamFG eingeleitet. Widerspruchsfrist 6 Wochen"
    },
    {
      "date": "2025-04-23",
      "id": "107124",
      "original_text": "Registerbekanntmachung nach dem Umwandlungsgesetz\nBaden-Württemberg Amtsgericht Stuttgart HRB 780474\nPlaza Group Real A Betriebsgesellschaft mbH – Heilbronn",
      "type": "Registerbekanntmachung nach dem Umwandlungsgesetz",
      "state": "Baden-Württemberg",
      "amtsgericht": "Amtsgericht Stuttgart",
      "registernummer": "HRB 780474",
      "registerart": "HRB",
      "company_name": "Plaza Group Real A Betriebsgesellschaft mbH",
      "company_seat": "Heilbronn",
      "details": "23.04.2025 (Bekanntmachungsdatum)\n\nBaden-Württemberg Amtsgericht Stuttgart HRB 780474\nRegisterbekanntmachung nach dem Umwandlungsgesetz 23.04.2025 (Eintragungsdatum)\n\nPlaza Group Real A Betriebsgesellschaft mbH\nGesellschaft mit beschränkter Haftung\nHeilbronn\n\nDen Gläubigern der an der Verschmelzung beteiligten Rechtsträger ist, wenn sie binnen sechs Monaten nach dem Tag, an dem die Eintragung der Verschmelzung in das Register des Sitzes desjenigen Rechtsträgers, dessen Gläubiger sie sind, nach § 19 Abs. 3 UmwG als bekanntgemacht gilt, ihren Anspruch nach Grund und Höhe schriftlich anmelden, Sicherheit zu leisten, soweit sie nicht Befriedigung verlangen können. Dieses Recht steht den Gläubigern jedoch nur zu, wenn sie glaubhaft machen, dass durch die Verschmelzung die Erfüllung ihrer Forderung gefährdet wird."
    },
    {
      "date": "2025-04-23",
      "id": "107125",
      "original_text": "Löschungsankündigung\nBerlin Amtsgericht Berlin (Charlottenburg) HRB 172674\nLider Cup GmbH – Berlin",
      "type": "Löschungsankündigung",
      "state": "Berlin",
      "amtsgericht": "Amtsgericht Berlin (Charlottenburg)",
      "registernummer": "HRB 172674",
      "registerart": "HRB",
      "company_name": "Lider Cup GmbH",
      "company_seat": "Berlin",
      "details": "23.04.2025 (Bekanntmachungsdatum)\n\nBerlin Amtsgericht Berlin (Charlottenburg) HRB 172674\nLöschungsankündigung\n\nLider Cup GmbH\nGesellschaft mit beschränkter Haftung\nBerlin\n\nBei der nachstehenden Gesellschaft wird das Amtslöschungsverfahren gemäß § 394 FamFG eingeleitet. Widerspruchsfrist 6 Wochen"
    },
    {
      "date": "2025-04-23",
      "id": "107126",
      "original_text": "Registerbekanntmachung nach dem Umwandlungsgesetz\nHamburg Amtsgericht Hamburg HRB 103619\nB & L RE Invest GmbH – Hamburg",
      "type": "Registerbekanntmachung nach dem Umwandlungsgesetz",
      "state": "Hamburg",
      "amtsgericht": "Amtsgericht Hamburg",
      "registernummer": "HRB 103619",
      "registerart": "HRB",
      "company_name": "B & L RE Invest GmbH",
      "company_seat": "Hamburg",
      "details": "23.04.2025 (Bekanntmachungsdatum)\n\nHamburg Amtsgericht Hamburg HRB 103619\nRegisterbekanntmachung nach dem Umwandlungsgesetz 23.04.2025 (Eintragungsdatum)\n\nB & L RE Invest GmbH\nGesellschaft mit beschränkter Haftung\nHamburg\n\nAls nicht eingetragen wird bekannt gemacht:\nDen Gläubigern der an der Verschmelzung beteiligten Gesellschaften ist, wenn sie binnen sechs Monaten nach dem Tag, an dem die Eintragung der Verschmelzung in das Register des Sitzes desjenigen Rechtsträgers, dessen Gläubiger sie sind, nach § 19 Absatz 3 UmwG als bekannt gemacht gilt, ihren Anspruch nach Grund und Höhe schriftlich anmelden, Sicherheit zu leisten, soweit sie nicht Befriedigung verlangen können. Dieses Recht steht den Gläubigern jedoch nur zu, wenn sie glaubhaft machen, dass durch die Verschmelzung die Erfüllung ihrer Forderung gefährdet wird."
    },
    {
      "date": "2025-04-23",
      "id": "107127",
      "original_text": "Registerbekanntmachung nach dem Umwandlungsgesetz\nHamburg Amtsgericht Hamburg HRB 129528\nB & L Erste Investitions GmbH – Hamburg",
      "type": "Registerbekanntmachung nach dem Umwandlungsgesetz",
      "state": "Hamburg",
      "amtsgericht": "Amtsgericht Hamburg",
      "registernummer": "HRB 129528",
      "registerart": "HRB",
      "company_name": "B & L Erste Investitions GmbH",
      "company_seat": "Hamburg",
      "details": "23.04.2025 (Bekanntmachungsdatum)\n\nHamburg Amtsgericht Hamburg HRB 129528\nRegisterbekanntmachung nach dem Umwandlungsgesetz 23.04.2025 (Eintragungsdatum)\n\nB & L Erste Investitions GmbH\nGesellschaft mit beschränkter Haftung\nHamburg\n\nAls nicht eingetragen wird bekannt gemacht:\nDen Gläubigern der an der Verschmelzung beteiligten Gesellschaften ist, wenn sie binnen sechs Monaten nach dem Tag, an dem die Eintragung der Verschmelzung in das Register des Sitzes desjenigen Rechtsträgers, dessen Gläubiger sie sind, nach § 19 Absatz 3 UmwG als bekannt gemacht gilt, ihren Anspruch nach Grund und Höhe schriftlich anmelden, Sicherheit zu leisten, soweit sie nicht Befriedigung verlangen können. Dieses Recht steht den Gläubigern jedoch nur zu, wenn sie glaubhaft machen, dass durch die Verschmelzung die Erfüllung ihrer Forderung gefährdet wird."
    },
    {
      "date": "2025-04-23",
      "id": "107128",
      "original_text": "Registerbekanntmachung nach dem Umwandlungsgesetz\nSachsen-Anhalt Amtsgericht Stendal HRB 112661\nRothenseer Rotorblattfertigung GmbH – Magdeburg",
      "type": "Registerbekanntmachung nach dem Umwandlungsgesetz",
      "state": "Sachsen-Anhalt",
      "amtsgericht": "Amtsgericht Stendal",
      "registernummer": "HRB 112661",
      "registerart": "HRB",
      "company_name": "Rothenseer Rotorblattfertigung GmbH",
      "company_seat": "Magdeburg",
      "details": "23.04.2025 (Bekanntmachungsdatum)\n\nSachsen-Anhalt Amtsgericht Stendal HRB 112661\nRegisterbekanntmachung nach dem Umwandlungsgesetz 23.04.2025 (Eintragungsdatum)\n\nRothenseer Rotorblattfertigung GmbH\nGesellschaft mit beschränkter Haftung\nMagdeburg\n\nNicht eingetragen:\nDen Gläubigern der an der Verschmelzung beteiligten Rechtsträger ist, wenn sie binnen sechs Monaten nach dem Tag, an dem die Eintragung der Verschmelzung nach § 19 Abs. 3 UmwG als bekanntgemacht gilt, ihren Anspruch nach Grund und Höhe schriftlich anmelden, Sicherheit zu leisten, soweit sie nicht Befriedigung verlangen können. Dieses Recht steht ihnen jedoch nur zu, wenn sie glaubhaft machen, dass durch die Verschmelzung die Erfüllung ihrer Forderung gefährdet wird."
    },
    {
      "date": "2025-04-23",
      "id": "107129",
      "original_text": "Sonstige Registerbekanntmachung\nBaden-Württemberg Amtsgericht Mannheim HRB 202531\nGRENKEFACTORING GmbH – Baden-Baden",
      "type": "Sonstige Registerbekanntmachung",
      "state": "Baden-Württemberg",
      "amtsgericht": "Amtsgericht Mannheim",
      "registernummer": "HRB 202531",
      "registerart": "HRB",
      "company_name": "GRENKEFACTORING GmbH",
      "company_seat": "Baden-Baden",
      "details": "23.04.2025 (Bekanntmachungsdatum)\n\nBaden-Württemberg Amtsgericht Mannheim HRB 202531\nSonstige Registerbekanntmachung 23.04.2025 (Eintragungsdatum)\n\nGRENKEFACTORING GmbH\nGesellschaft mit beschränkter Haftung\nBaden-Baden\n\nDen Gläubigern der Gesellschaft, deren Forderungen begründet worden sind, bevor die Eintragung der Beendigung des Vertrages in das Handelsregister nach § 10 HGB als bekanntgemacht gilt, ist vom anderen Vertragsteil Sicherheit zu leisten, wenn sie sich binnen sechs Monaten nach der Bekanntmachung zu diesem Zweck bei ihm melden."
    },
    {
      "date": "2025-04-23",
      "id": "107130",
      "original_text": "Sonstige Registerbekanntmachung\nBerlin Amtsgericht Berlin (Charlottenburg) VR 30384\nKinderladen Pankow/Weißensee e. V. – Berlin",
      "type": "Sonstige Registerbekanntmachung",
      "state": "Berlin",
      "amtsgericht": "Amtsgericht Berlin (Charlottenburg)",
      "registernummer": "VR 30384",
      "registerart": "VR",
      "company_name": "Kinderladen Pankow/Weißensee e. V.",
      "company_seat": "Berlin",
      "details": "23.04.2025 (Bekanntmachungsdatum)\n\nBerlin Amtsgericht Berlin (Charlottenburg) VR 30384\nSonstige Registerbekanntmachung\n\nKinderladen Pankow/Weißensee e. V.\neingetragener Verein\nBerlin\n\nAls nicht eingetragen wird veröffentlicht: Den Gläubigern der an der Verschmelzung beteiligten Rechtsträger ist, wenn sie binnen sechs Monaten nach dem Tag, an dem die Eintragung der Verschmelzung in das Register des Sitzes desjenigen Rechtsträgers, dessen Gläubiger sie sind, als bekannt gemacht gilt, ihren Anspruch nach Grund und Höhe schriftlich anmelden, Sicherheit zu leisten, soweit sie nicht Befriedigung verlangen können. Dieses Recht steht den Gläubigern jedoch nur zu, wenn sie glaubhaft machen, dass durch die Verschmelzung die Erfüllung ihrer Forderung gefährdet wird. Das Recht, Sicherheitsleistung zu verlangen, steht Gläubigern nicht zu, die im Falle der Insolvenz ein Recht auf vorzugsweise Befriedigung aus einer Deckungsmasse haben, die nach gesetzlicher Vorschrift zu ihrem Schutz errichtet und staatlich überwacht ist."
    },
    {
      "date": "2025-04-23",
      "id": "107131",
      "original_text": "Löschungsankündigung\nBerlin Amtsgericht Berlin (Charlottenburg) HRB 129121\ndapd Korrespondenz und Recherche GmbH – Berlin",
      "type": "Löschungsankündigung",
      "state": "Berlin",
      "amtsgericht": "Amtsgericht Berlin (Charlottenburg)",
      "registernummer": "HRB 129121",
      "registerart": "HRB",
      "company_name": "dapd Korrespondenz und Recherche GmbH",
      "company_seat": "Berlin",
      "details": "23.04.2025 (Bekanntmachungsdatum)\n\nBerlin Amtsgericht Berlin (Charlottenburg) HRB 129121\nLöschungsankündigung\n\ndapd Korrespondenz und Recherche GmbH\nGesellschaft mit beschränkter Haftung\nBerlin\n\nBei der nachstehenden Gesellschaft wird das Amtslöschungsverfahren gemäß § 394 FamFG eingeleitet. Widerspruchsfrist 6 Wochen"
    },
    {
      "date": "2025-04-23",
      "id": "107132",
      "original_text": "Registerbekanntmachung nach dem Umwandlungsgesetz\nBaden-Württemberg Amtsgericht Stuttgart GsR 3080\nKlingbeil Immobilien eGbR – Pleidelsheim",
      "type": "Registerbekanntmachung nach dem Umwandlungsgesetz",
      "state": "Baden-Württemberg",
      "amtsgericht": "Amtsgericht Stuttgart",
      "registernummer": "GsR 3080",
      "registerart": "GsR",
      "company_name": "Klingbeil Immobilien eGbR",
      "company_seat": "Pleidelsheim",
      "details": "23.04.2025 (Bekanntmachungsdatum)\n\nBaden-Württemberg Amtsgericht Stuttgart GsR 3080\nRegisterbekanntmachung nach dem Umwandlungsgesetz 23.04.2025 (Eintragungsdatum)\n\nKlingbeil Immobilien eGbR\nGesellschaft bürgerlichen Rechts\nPleidelsheim\n\nAls nicht eingetragen wird bekanntgemacht:\nDen Gläubigern des an dem Formwechsel beteiligten Rechtsträgers ist, wenn sie binnen sechs Monaten nach dem Tag, an dem die Eintragung des Formwechsels in das Register des Sitzes desjenigen Rechtsträgers, dessen Gläubiger sie sind, nach § 19 Abs. 3 UmwG als bekanntgemacht gilt, ihren Anspruch nach Grund und Höhe schriftlich anmelden, Sicherheit zu leisten, soweit sie nicht Befriedigung verlangen können. Dieses Recht steht den Gläubigern jedoch nur zu, wenn sie glaubhaft machen, dass durch den Formwechsel die Erfüllung ihrer Forderung gefährdet wird."
    },
    {
      "date": "2025-04-23",
      "id": "107133",
      "original_text": "Registerbekanntmachung nach dem Umwandlungsgesetz\nBaden-Württemberg Amtsgericht Stuttgart HRB 790249\nKlingbeil Immobilien GmbH – Ilsfeld",
      "type": "Registerbekanntmachung nach dem Umwandlungsgesetz",
      "state": "Baden-Württemberg",
      "amtsgericht": "Amtsgericht Stuttgart",
      "registernummer": "HRB 790249",
      "registerart": "HRB",
      "company_name": "Klingbeil Immobilien GmbH",
      "company_seat": "Ilsfeld",
      "details": "23.04.2025 (Bekanntmachungsdatum)\n\nBaden-Württemberg Amtsgericht Stuttgart HRB 790249\nRegisterbekanntmachung nach dem Umwandlungsgesetz 23.04.2025 (Eintragungsdatum)\n\nKlingbeil Immobilien GmbH\nGesellschaft mit beschränkter Haftung\nIlsfeld\n\nAls nicht eingetragen wird bekanntgemacht:\nDen Gläubigern des an dem Formwechsel beteiligten Rechtsträgers ist, wenn sie binnen sechs Monaten nach dem Tag, an dem die Eintragung des Formwechsels in das Register des Sitzes desjenigen Rechtsträgers, dessen Gläubiger sie sind, nach § 19 Abs. 3 UmwG als bekanntgemacht gilt, ihren Anspruch nach Grund und Höhe schriftlich anmelden, Sicherheit zu leisten, soweit sie nicht Befriedigung verlangen können. Dieses Recht steht den Gläubigern jedoch nur zu, wenn sie glaubhaft machen, dass durch den Formwechsel die Erfüllung ihrer Forderung gefährdet wird."
    },
    {
      "date": "2025-04-23",
      "id": "107134",
      "original_text": "Einreichung neuer Dokumente\nBrandenburg Amtsgericht Frankfurt/Oder HRB 12588\nAgraraktiengesellschaft Albrecht Daniel Thaer – Wriezen",
      "type": "Einreichung neuer Dokumente",
      "state": "Brandenburg",
      "amtsgericht": "Amtsgericht Frankfurt/Oder",
      "registernummer": "HRB 12588",
      "registerart": "HRB",
      "company_name": "Agraraktiengesellschaft Albrecht Daniel Thaer",
      "company_seat": "Wriezen",
      "details": "23.04.2025 (Bekanntmachungsdatum)\n\nBrandenburg Amtsgericht Frankfurt/Oder HRB 12588\nEinreichung neuer Dokumente\n\nAgraraktiengesellschaft Albrecht Daniel Thaer\nAktiengesellschaft\nWriezen\n\nAls nicht eingetragen wird veröffentlicht: Die Liste der Aufsichtsratsmitglieder vom 24.03.2025 ist zum Handelsregister eingereicht worden."
    },
    {
      "date": "2025-04-23",
      "id": "107135",
      "original_text": "Löschungsankündigung\nBrandenburg Amtsgericht Frankfurt/Oder HRB 16531\nRenata Dienstleistungen UG (haftungsbeschränkt) – Frankfurt (Oder)",
      "type": "Löschungsankündigung",
      "state": "Brandenburg",
      "amtsgericht": "Amtsgericht Frankfurt/Oder",
      "registernummer": "HRB 16531",
      "registerart": "HRB",
      "company_name": "Renata Dienstleistungen UG (haftungsbeschränkt)",
      "company_seat": "Frankfurt (Oder)",
      "details": "23.04.2025 (Bekanntmachungsdatum)\n\nBrandenburg Amtsgericht Frankfurt/Oder HRB 16531\nLöschungsankündigung\n\nRenata Dienstleistungen UG (haftungsbeschränkt)\nGesellschaft mit beschränkter Haftung\nFrankfurt (Oder)\n\nBei der nachstehenden Gesellschaft wird das Amtslöschungsverfahren gemäß § 394 FamFG eingeleitet."
    },
    {
      "date": "2025-04-23",
      "id": "107136",
      "original_text": "Registerbekanntmachung nach dem Umwandlungsgesetz\nBaden-Württemberg Amtsgericht Stuttgart HRB 771158\nAUDERE Growth Funds No. 3 GmbH – Gerlingen",
      "type": "Registerbekanntmachung nach dem Umwandlungsgesetz",
      "state": "Baden-Württemberg",
      "amtsgericht": "Amtsgericht Stuttgart",
      "registernummer": "HRB 771158",
      "registerart": "HRB",
      "company_name": "AUDERE Growth Funds No. 3 GmbH",
      "company_seat": "Gerlingen",
      "details": "23.04.2025 (Bekanntmachungsdatum)\n\nBaden-Württemberg Amtsgericht Stuttgart HRB 771158\nRegisterbekanntmachung nach dem Umwandlungsgesetz 23.04.2025 (Eintragungsdatum)\n\nAUDERE Growth Funds No. 3 GmbH\nGesellschaft mit beschränkter Haftung\nGerlingen\n\nAls nicht eingetragen wird bekanntgemacht:\nDen Gläubigern der an der Verschmelzung beteiligten Rechtsträger ist, wenn sie binnen sechs Monaten nach dem Tag, an dem die Eintragung der Verschmelzung in das Register des Sitzes desjenigen Rechtsträgers, dessen Gläubiger sie sind, nach § 19 Abs. 3 UmwG als bekanntgemacht gilt, ihren Anspruch nach Grund und Höhe schriftlich anmelden, Sicherheit zu leisten, soweit sie nicht Befriedigung verlangen können. Dieses Recht steht den Gläubigern jedoch nur zu, wenn sie glaubhaft machen, dass durch die Verschmelzung die Erfüllung ihrer Forderung gefährdet wird."
    },
    {
      "date": "2025-04-23",
      "id": "107137",
      "original_text": "Registerbekanntmachung nach dem Umwandlungsgesetz\nHamburg Amtsgericht Hamburg HRA 132033\nBorris Knoll e.K. – Hamburg",
      "type": "Registerbekanntmachung nach dem Umwandlungsgesetz",
      "state": "Hamburg",
      "amtsgericht": "Amtsgericht Hamburg",
      "registernummer": "HRA 132033",
      "registerart": "HRA",
      "company_name": "Borris Knoll e.K.",
      "company_seat": "Hamburg",
      "details": "23.04.2025 (Bekanntmachungsdatum)\n\nHamburg Amtsgericht Hamburg HRA 132033\nRegisterbekanntmachung nach dem Umwandlungsgesetz 23.04.2025 (Eintragungsdatum)\n\nBorris Knoll e.K.\nEinzelkaufmann\nHamburg\n\nAls nicht eingetragen wird bekannt gemacht:\nDen Gläubigern der an der Ausgliederung beteiligten Gesellschaften ist, wenn sie binnen sechs Monaten nach dem Tag, an dem die Eintragung der Ausgliederung in das Register des Sitzes desjenigen Rechtsträgers, dessen Gläubiger sie sind, nach § 19 Absatz 3 UmwG als bekannt gemacht gilt, ihren Anspruch nach Grund und Höhe schriftlich anmelden, Sicherheit zu leisten, soweit sie nicht Befriedigung verlangen können. Dieses Recht steht den Gläubigern jedoch nur zu, wenn sie glaubhaft machen, dass durch die Ausgliederung die Erfüllung ihrer Forderung gefährdet wird."
    },
    {
      "date": "2025-04-23",
      "id": "107138",
      "original_text": "Registerbekanntmachung nach dem Umwandlungsgesetz\nHamburg Amtsgericht Hamburg HRB 190980\nPflegedienst Knoll GmbH – Hamburg",
      "type": "Registerbekanntmachung nach dem Umwandlungsgesetz",
      "state": "Hamburg",
      "amtsgericht": "Amtsgericht Hamburg",
      "registernummer": "HRB 190980",
      "registerart": "HRB",
      "company_name": "Pflegedienst Knoll GmbH",
      "company_seat": "Hamburg",
      "details": "23.04.2025 (Bekanntmachungsdatum)\n\nHamburg Amtsgericht Hamburg HRB 190980\nRegisterbekanntmachung nach dem Umwandlungsgesetz 23.04.2025 (Eintragungsdatum)\n\nPflegedienst Knoll GmbH\nGesellschaft mit beschränkter Haftung\nHamburg\n\nAls nicht eingetragen wird bekannt gemacht:\nDen Gläubigern der an der Ausgliederung beteiligten Gesellschaften ist, wenn sie binnen sechs Monaten nach dem Tag, an dem die Eintragung der Ausgliederung in das Register des Sitzes desjenigen Rechtsträgers, dessen Gläubiger sie sind, nach § 19 Absatz 3 UmwG als bekannt gemacht gilt, ihren Anspruch nach Grund und Höhe schriftlich anmelden, Sicherheit zu leisten, soweit sie nicht Befriedigung verlangen können. Dieses Recht steht den Gläubigern jedoch nur zu, wenn sie glaubhaft machen, dass durch die Ausgliederung die Erfüllung ihrer Forderung gefährdet wird."
    },
    {
      "date": "2025-04-23",
      "id": "107139",
      "original_text": "Löschungsankündigung\nBaden-Württemberg Amtsgericht Stuttgart HRB 735681\nBillinger Transporte GmbH – Unterreichenbach",
      "type": "Löschungsankündigung",
      "state": "Baden-Württemberg",
      "amtsgericht": "Amtsgericht Stuttgart",
      "registernummer": "HRB 735681",
      "registerart": "HRB",
      "company_name": "Billinger Transporte GmbH",
      "company_seat": "Unterreichenbach",
      "details": "23.04.2025 (Bekanntmachungsdatum)\n\nBaden-Württemberg Amtsgericht Stuttgart HRB 735681\nLöschungsankündigung\n\nBillinger Transporte GmbH\nGesellschaft mit beschränkter Haftung\nUnterreichenbach\n\nDas Gericht beabsichtigt, die Gesellschaft wegen Vermögenslosigkeit im Handelsregister von Amts wegen nach § 394 FamFG zu löschen. Die Frist zur Geltendmachung eines Widerspruchs gegen die beabsichtigte Löschung ist auf zwei Monate ab Veröffentlichung bestimmt."
    },
    {
      "date": "2025-04-23",
      "id": "107140",
      "original_text": "Sonstige Registerbekanntmachung\nHamburg Amtsgericht Hamburg HRB 89408\nWärtsilä SAM Electronics GmbH – Hamburg",
      "type": "Sonstige Registerbekanntmachung",
      "state": "Hamburg",
      "amtsgericht": "Amtsgericht Hamburg",
      "registernummer": "HRB 89408",
      "registerart": "HRB",
      "company_name": "Wärtsilä SAM Electronics GmbH",
      "company_seat": "Hamburg",
      "details": "23.04.2025 (Bekanntmachungsdatum)\n\nHamburg Amtsgericht Hamburg HRB 89408\nSonstige Registerbekanntmachung\n\nWärtsilä SAM Electronics GmbH\nGesellschaft mit beschränkter Haftung\nHamburg\n\nAls nicht eingetragen wird bekannt gemacht: Liste des Aufsichtsrats wurde eingereicht."
    },
    {
      "date": "2025-04-23",
      "id": "107141",
      "original_text": "Registerbekanntmachung nach dem Umwandlungsgesetz\nHamburg Amtsgericht Hamburg HRB 146568\nEPG Service GmbH – Hamburg",
      "type": "Registerbekanntmachung nach dem Umwandlungsgesetz",
      "state": "Hamburg",
      "amtsgericht": "Amtsgericht Hamburg",
      "registernummer": "HRB 146568",
      "registerart": "HRB",
      "company_name": "EPG Service GmbH",
      "company_seat": "Hamburg",
      "details": "23.04.2025 (Bekanntmachungsdatum)\n\nHamburg Amtsgericht Hamburg HRB 146568\nRegisterbekanntmachung nach dem Umwandlungsgesetz 23.04.2025 (Eintragungsdatum)\n\nEPG Service GmbH\nGesellschaft mit beschränkter Haftung\nHamburg\n\nAls nicht eingetragen wird bekannt gemacht:\nDen Gläubigern der an der Verschmelzung beteiligten Gesellschaften ist, wenn sie binnen sechs Monaten nach dem Tag, an dem die Eintragung der Verschmelzung in das Register des Sitzes desjenigen Rechtsträgers, dessen Gläubiger sie sind, nach § 19 Absatz 3 UmwG als bekannt gemacht gilt, ihren Anspruch nach Grund und Höhe schriftlich anmelden, Sicherheit zu leisten, soweit sie nicht Befriedigung verlangen können. Dieses Recht steht den Gläubigern jedoch nur zu, wenn sie glaubhaft machen, dass durch die Verschmelzung die Erfüllung ihrer Forderung gefährdet wird."
    },
    {
      "date": "2025-04-23",
      "id": "107142",
      "original_text": "Registerbekanntmachung nach dem Umwandlungsgesetz\nHamburg Amtsgericht Hamburg HRB 95671\nF. Dau & Sohn GmbH – Hamburg",
      "type": "Registerbekanntmachung nach dem Umwandlungsgesetz",
      "state": "Hamburg",
      "amtsgericht": "Amtsgericht Hamburg",
      "registernummer": "HRB 95671",
      "registerart": "HRB",
      "company_name": "F. Dau & Sohn GmbH",
      "company_seat": "Hamburg",
      "details": "23.04.2025 (Bekanntmachungsdatum)\n\nHamburg Amtsgericht Hamburg HRB 95671\nRegisterbekanntmachung nach dem Umwandlungsgesetz 23.04.2025 (Eintragungsdatum)\n\nF. Dau & Sohn GmbH\nGesellschaft mit beschränkter Haftung\nHamburg\n\nAls nicht eingetragen wird bekannt gemacht:\nDen Gläubigern der an der Verschmelzung beteiligten Gesellschaften ist, wenn sie binnen sechs Monaten nach dem Tag, an dem die Eintragung der Verschmelzung in das Register des Sitzes desjenigen Rechtsträgers, dessen Gläubiger sie sind, nach § 19 Absatz 3 UmwG als bekannt gemacht gilt, ihren Anspruch nach Grund und Höhe schriftlich anmelden, Sicherheit zu leisten, soweit sie nicht Befriedigung verlangen können. Dieses Recht steht den Gläubigern jedoch nur zu, wenn sie glaubhaft machen, dass durch die Verschmelzung die Erfüllung ihrer Forderung gefährdet wird."
    },
    {
      "date": "2025-04-23",
      "id": "107143",
      "original_text": "Einreichung neuer Dokumente\nBrandenburg Amtsgericht Potsdam HRB 8633\nSBB Sonderabfallgesellschaft Brandenburg/Berlin mbH – Potsdam",
      "type": "Einreichung neuer Dokumente",
      "state": "Brandenburg",
      "amtsgericht": "Amtsgericht Potsdam",
      "registernummer": "HRB 8633",
      "registerart": "HRB",
      "company_name": "SBB Sonderabfallgesellschaft Brandenburg/Berlin mbH",
      "company_seat": "Potsdam",
      "details": "23.04.2025 (Bekanntmachungsdatum)\n\nBrandenburg Amtsgericht Potsdam HRB 8633\nEinreichung neuer Dokumente\n\nSBB Sonderabfallgesellschaft Brandenburg/Berlin mbH\nGesellschaft mit beschränkter Haftung\nPotsdam\n\nAls nicht eingetragen wird veröffentlicht: Eine Liste der Mitglieder des Aufsichtsrates wurde zum Handelsregister eingereicht."
    },
    {
      "date": "2025-04-23",
      "id": "107144",
      "original_text": "Registerbekanntmachung nach dem Umwandlungsgesetz\nBaden-Württemberg Amtsgericht Stuttgart HRB 762402\nATS-Hero Fördertechnik GmbH – Holzgerlingen",
      "type": "Registerbekanntmachung nach dem Umwandlungsgesetz",
      "state": "Baden-Württemberg",
      "amtsgericht": "Amtsgericht Stuttgart",
      "registernummer": "HRB 762402",
      "registerart": "HRB",
      "company_name": "ATS-Hero Fördertechnik GmbH",
      "company_seat": "Holzgerlingen",
      "details": "23.04.2025 (Bekanntmachungsdatum)\n\nBaden-Württemberg Amtsgericht Stuttgart HRB 762402\nRegisterbekanntmachung nach dem Umwandlungsgesetz 23.04.2025 (Eintragungsdatum)\n\nATS-Hero Fördertechnik GmbH\nGesellschaft mit beschränkter Haftung\nHolzgerlingen\n\nDen Gläubigern der an der Verschmelzung beteiligten Rechtsträger ist, wenn sie binnen sechs Monaten nach dem Tag, an dem die Eintragung der Verschmelzung in das Register des Sitzes desjenigen Rechtsträgers, dessen Gläubiger sie sind, nach § 19 Abs. 3 UmwG als bekanntgemacht gilt, ihren Anspruch nach Grund und Höhe schriftlich anmelden, Sicherheit zu leisten, soweit sie nicht Befriedigung verlangen können. Dieses Recht steht den Gläubigern jedoch nur zu, wenn sie glaubhaft machen, dass durch die Verschmelzung die Erfüllung ihrer Forderung gefährdet wird."
    },
    {
      "date": "2025-04-23",
      "id": "107145",
      "original_text": "Registerbekanntmachung nach dem Umwandlungsgesetz\nBaden-Württemberg Amtsgericht Stuttgart HRB 241814\nHERO Fördertechnik Verwaltungs-GmbH – Holzgerlingen",
      "type": "Registerbekanntmachung nach dem Umwandlungsgesetz",
      "state": "Baden-Württemberg",
      "amtsgericht": "Amtsgericht Stuttgart",
      "registernummer": "HRB 241814",
      "registerart": "HRB",
      "company_name": "HERO Fördertechnik Verwaltungs-GmbH",
      "company_seat": "Holzgerlingen",
      "details": "23.04.2025 (Bekanntmachungsdatum)\n\nBaden-Württemberg Amtsgericht Stuttgart HRB 241814\nRegisterbekanntmachung nach dem Umwandlungsgesetz 23.04.2025 (Eintragungsdatum)\n\nHERO Fördertechnik Verwaltungs-GmbH\nGesellschaft mit beschränkter Haftung\nHolzgerlingen\n\nAls nicht eingetragen wird bekanntgemacht:\nDen Gläubigern der an der Verschmelzung beteiligten Rechtsträger ist, wenn sie binnen sechs Monaten nach dem Tag, an dem die Eintragung der Verschmelzung in das Register des Sitzes desjenigen Rechtsträgers, dessen Gläubiger sie sind, nach § 19 Abs. 3 UmwG als bekanntgemacht gilt, ihren Anspruch nach Grund und Höhe schriftlich anmelden, Sicherheit zu leisten, soweit sie nicht Befriedigung verlangen können. Dieses Recht steht den Gläubigern jedoch nur zu, wenn sie glaubhaft machen, dass durch die Verschmelzung die Erfüllung ihrer Forderung gefährdet wird."
    },
    {
      "date": "2025-04-23",
      "id": "107146",
      "original_text": "Registerbekanntmachung nach dem Umwandlungsgesetz\nBaden-Württemberg Amtsgericht Stuttgart HRA 742085\nmaiwald.design Inhaber Thomas Maiwald e.K. – Stuttgart",
      "type": "Registerbekanntmachung nach dem Umwandlungsgesetz",
      "state": "Baden-Württemberg",
      "amtsgericht": "Amtsgericht Stuttgart",
      "registernummer": "HRA 742085",
      "registerart": "HRA",
      "company_name": "maiwald.design Inhaber Thomas Maiwald e.K.",
      "company_seat": "Stuttgart",
      "details": "23.04.2025 (Bekanntmachungsdatum)\n\nBaden-Württemberg Amtsgericht Stuttgart HRA 742085\nRegisterbekanntmachung nach dem Umwandlungsgesetz 23.04.2025 (Eintragungsdatum)\n\nmaiwald.design Inhaber Thomas Maiwald e.K.\nEinzelkaufmann / Einzelkauffrau\nStuttgart\n\nAls nicht eingetragen wird bekanntgemacht:\nDen Gläubigern der an der Ausgliederung beteiligten Rechtsträger ist, wenn sie binnen sechs Monaten nach dem Tag, an dem die Eintragung der Ausgliederung in das Register des Sitzes desjenigen Rechtsträgers, dessen Gläubiger sie sind, nach § 19 Abs. 3 UmwG als bekanntgemacht gilt, ihren Anspruch nach Grund und Höhe schriftlich anmelden, Sicherheit zu leisten, soweit sie nicht Befriedigung verlangen können. Dieses Recht steht den Gläubigern jedoch nur zu, wenn sie glaubhaft machen, dass durch die Ausgliederung die Erfüllung ihrer Forderung gefährdet wird."
    },
    {
      "date": "2025-04-23",
      "id": "107147",
      "original_text": "Registerbekanntmachung nach dem Umwandlungsgesetz\nBaden-Württemberg Amtsgericht Stuttgart HRA 742257\nmaiwald & mates GmbH & Co. KG – Stuttgart",
      "type": "Registerbekanntmachung nach dem Umwandlungsgesetz",
      "state": "Baden-Württemberg",
      "amtsgericht": "Amtsgericht Stuttgart",
      "registernummer": "HRA 742257",
      "registerart": "HRA",
      "company_name": "maiwald & mates GmbH & Co. KG",
      "company_seat": "Stuttgart",
      "details": "23.04.2025 (Bekanntmachungsdatum)\n\nBaden-Württemberg Amtsgericht Stuttgart HRA 742257\nRegisterbekanntmachung nach dem Umwandlungsgesetz 23.04.2025 (Eintragungsdatum)\n\nmaiwald & mates GmbH & Co. KG\nKommanditgesellschaft\nStuttgart\n\nAls nicht eingetragen wird bekanntgemacht:\nDen Gläubigern der an der Ausgliederung beteiligten Rechtsträger ist, wenn sie binnen sechs Monaten nach dem Tag, an dem die Eintragung der Ausgliederung in das Register des Sitzes desjenigen Rechtsträgers, dessen Gläubiger sie sind, nach § 19 Abs. 3 UmwG als bekanntgemacht gilt, ihren Anspruch nach Grund und Höhe schriftlich anmelden, Sicherheit zu leisten, soweit sie nicht Befriedigung verlangen können. Dieses Recht steht den Gläubigern jedoch nur zu, wenn sie glaubhaft machen, dass durch die Ausgliederung die Erfüllung ihrer Forderung gefährdet wird."
    },
    {
      "date": "2025-04-23",
      "id": "107148",
      "original_text": "Löschungsankündigung\nBaden-Württemberg Amtsgericht Mannheim HRB 751370\nMurtezani Dachbau GmbH – Mannheim",
      "type": "Löschungsankündigung",
      "state": "Baden-Württemberg",
      "amtsgericht": "Amtsgericht Mannheim",
      "registernummer": "HRB 751370",
      "registerart": "HRB",
      "company_name": "Murtezani Dachbau GmbH",
      "company_seat": "Mannheim",
      "details": "23.04.2025 (Bekanntmachungsdatum)\n\nBaden-Württemberg Amtsgericht Mannheim HRB 751370\nLöschungsankündigung\n\nMurtezani Dachbau GmbH\nGesellschaft mit beschränkter Haftung\nMannheim\n\nDas Gericht beabsichtigt, die Gesellschaft wegen Vermögenslosigkeit im Handelsregister von Amts wegen nach § 394 FamFG zu löschen. Die Frist zur Geltendmachung eines Widerspruchs gegen die beabsichtigte Löschung ist auf einen Monat ab Veröffentlichung bestimmt."
    },
    {
      "date": "2025-04-23",
      "id": "107149",
      "original_text": "Einreichung neuer Dokumente\nBaden-Württemberg Amtsgericht Stuttgart HRB 638\nMAHLE GmbH – Stuttgart",
      "type": "Einreichung neuer Dokumente",
      "state": "Baden-Württemberg",
      "amtsgericht": "Amtsgericht Stuttgart",
      "registernummer": "HRB 638",
      "registerart": "HRB",
      "company_name": "MAHLE GmbH",
      "company_seat": "Stuttgart",
      "details": "23.04.2025 (Bekanntmachungsdatum)\n\nBaden-Württemberg Amtsgericht Stuttgart HRB 638\nEinreichung neuer Dokumente\n\nMAHLE GmbH\nGesellschaft mit beschränkter Haftung\nStuttgart\n\nDie Gesellschaft hat am 22.04.2025 die Liste über die Zusammensetzung des Aufsichtsrats zum Handelsregister eingereicht."
    },
    {
      "date": "2025-04-23",
      "id": "107150",
      "original_text": "Einreichung neuer Dokumente\nHamburg Amtsgericht Hamburg HRB 63197\nENCAVIS AG – Hamburg",
      "type": "Einreichung neuer Dokumente",
      "state": "Hamburg",
      "amtsgericht": "Amtsgericht Hamburg",
      "registernummer": "HRB 63197",
      "registerart": "HRB",
      "company_name": "ENCAVIS AG",
      "company_seat": "Hamburg",
      "details": "23.04.2025 (Bekanntmachungsdatum)\n\nHamburg Amtsgericht Hamburg HRB 63197\nEinreichung neuer Dokumente\n\nENCAVIS AG\nAktiengesellschaft\nHamburg\n\nAls nicht eingetragen wird bekannt gemacht: Liste des Aufsichtsrats wurde eingereicht."
    },
    {
      "date": "2025-04-23",
      "id": "107151",
      "original_text": "Löschungsankündigung\nSchleswig-Holstein Amtsgericht Kiel HRB 21120\nHanse Horizont GmbH – Norderstedt",
      "type": "Löschungsankündigung",
      "state": "Schleswig-Holstein",
      "amtsgericht": "Amtsgericht Kiel",
      "registernummer": "HRB 21120",
      "registerart": "HRB",
      "company_name": "Hanse Horizont GmbH",
      "company_seat": "Norderstedt",
      "details": "23.04.2025 (Bekanntmachungsdatum)\n\nSchleswig-Holstein Amtsgericht Kiel HRB 21120\nLöschungsankündigung\n\nHanse Horizont GmbH\nGesellschaft mit beschränkter Haftung\nNorderstedt\n\nEs ist die Löschung der nachstehenden Gesellschaft wegen Vermögenslosigkeit gemäß § 394 FamFG beabsichtigt. Widerspruchsfrist: 2 Monate."
    },
    {
      "date": "2025-04-23",
      "id": "107152",
      "original_text": "Löschungsankündigung\nBrandenburg Amtsgericht Potsdam HRB 20760\nTomic Bau GmbH – Teltow",
      "type": "Löschungsankündigung",
      "state": "Brandenburg",
      "amtsgericht": "Amtsgericht Potsdam",
      "registernummer": "HRB 20760",
      "registerart": "HRB",
      "company_name": "Tomic Bau GmbH",
      "company_seat": "Teltow",
      "details": "23.04.2025 (Bekanntmachungsdatum)\n\nBrandenburg Amtsgericht Potsdam HRB 20760\nLöschungsankündigung\n\nTomic Bau GmbH\nGesellschaft mit beschränkter Haftung\nTeltow\n\nBei der nachstehenden Gesellschaft wird das Amtslöschungsverfahren gemäß § 394 FamFG eingeleitet. Widerspruchsfrist: 8 Wochen."
    },
    {
      "date": "2025-04-23",
      "id": "107153",
      "original_text": "Löschungsankündigung\nBaden-Württemberg Amtsgericht Mannheim HRB 700387\nDolzer Mannheim GmbH – Mannheim",
      "type": "Löschungsankündigung",
      "state": "Baden-Württemberg",
      "amtsgericht": "Amtsgericht Mannheim",
      "registernummer": "HRB 700387",
      "registerart": "HRB",
      "company_name": "Dolzer Mannheim GmbH",
      "company_seat": "Mannheim",
      "details": "23.04.2025 (Bekanntmachungsdatum)\n\nBaden-Württemberg Amtsgericht Mannheim HRB 700387\nLöschungsankündigung\n\nDolzer Mannheim GmbH\nGesellschaft mit beschränkter Haftung\nMannheim\n\nDas Gericht beabsichtigt, die Gesellschaft wegen Vermögenslosigkeit im Handelsregister von Amts wegen nach § 394 FamFG zu löschen. Die Frist zur Geltendmachung eines Widerspruchs gegen die beabsichtigte Löschung ist auf einen Monat ab Veröffentlichung bestimmt."
    },
    {
      "date": "2025-04-23",
      "id": "107154",
      "original_text": "Löschungsankündigung\nBrandenburg Amtsgericht Potsdam HRB 36700\nSOM Passivbau Kleinmachnow GmbH – Kleinmachnow",
      "type": "Löschungsankündigung",
      "state": "Brandenburg",
      "amtsgericht": "Amtsgericht Potsdam",
      "registernummer": "HRB 36700",
      "registerart": "HRB",
      "company_name": "SOM Passivbau Kleinmachnow GmbH",
      "company_seat": "Kleinmachnow",
      "details": "23.04.2025 (Bekanntmachungsdatum)\n\nBrandenburg Amtsgericht Potsdam HRB 36700\nLöschungsankündigung\n\nSOM Passivbau Kleinmachnow GmbH\nGesellschaft mit beschränkter Haftung\nKleinmachnow\n\nBei der nachstehenden Gesellschaft wird das Amtslöschungsverfahren gemäß § 394 FamFG eingeleitet. Widerspruchsfrist: 8 Wochen."
    },
    {
      "date": "2025-04-23",
      "id": "107155",
      "original_text": "Registerbekanntmachung nach dem Umwandlungsgesetz\nBaden-Württemberg Amtsgericht Mannheim HRB 331024\n\"dpunkt.verlag GmbH\" – Heidelberg",
      "type": "Registerbekanntmachung nach dem Umwandlungsgesetz",
      "state": "Baden-Württemberg",
      "amtsgericht": "Amtsgericht Mannheim",
      "registernummer": "HRB 331024",
      "registerart": "HRB",
      "company_name": "\"dpunkt.verlag GmbH\"",
      "company_seat": "Heidelberg",
      "details": "23.04.2025 (Bekanntmachungsdatum)\n\nBaden-Württemberg Amtsgericht Mannheim HRB 331024\nRegisterbekanntmachung nach dem Umwandlungsgesetz 23.04.2025 (Eintragungsdatum)\n\n\"dpunkt.verlag GmbH\"\nGesellschaft mit beschränkter Haftung\nHeidelberg\n\nDen Gläubigern der an der Verschmelzung beteiligten Rechtsträger ist, wenn sie binnen sechs Monaten nach dem Tag, an dem die Eintragung der Verschmelzung in das Register des Sitzes desjenigen Rechtsträgers, dessen Gläubiger sie sind, nach § 19 Abs. 3 UmwG als bekanntgemacht gilt, ihren Anspruch nach Grund und Höhe schriftlich anmelden, Sicherheit zu leisten, soweit sie nicht Befriedigung verlangen können. Dieses Recht steht den Gläubigern jedoch nur zu, wenn sie glaubhaft machen, dass durch die Verschmelzung die Erfüllung ihrer Forderung gefährdet wird."
    },
    {
      "date": "2025-04-23",
      "id": "107156",
      "original_text": "Löschungsankündigung\nBaden-Württemberg Amtsgericht Stuttgart HRB 720387\neCCOMES GmbH – Stuttgart",
      "type": "Löschungsankündigung",
      "state": "Baden-Württemberg",
      "amtsgericht": "Amtsgericht Stuttgart",
      "registernummer": "HRB 720387",
      "registerart": "HRB",
      "company_name": "eCCOMES GmbH",
      "company_seat": "Stuttgart",
      "details": "23.04.2025 (Bekanntmachungsdatum)\n\nBaden-Württemberg Amtsgericht Stuttgart HRB 720387\nLöschungsankündigung\n\neCCOMES GmbH\nGesellschaft mit beschränkter Haftung\nStuttgart\n\nDas Gericht beabsichtigt, die Gesellschaft wegen Vermögenslosigkeit im Handelsregister von Amts wegen nach § 394 FamFG zu löschen. Die Frist zur Geltendmachung eines Widerspruchs gegen die beabsichtigte Löschung ist auf zwei Monate ab Veröffentlichung bestimmt."
    },
    {
      "date": "2025-04-23",
      "id": "107157",
      "original_text": "Registerbekanntmachung nach dem Umwandlungsgesetz\nMecklenburg-Vorpommern Amtsgericht Rostock HRB 5096\nEx-Si-Ro Gesellschaft für externe Sicherheitsdienste und Sicherheitstechnik mbH Rostock – Rostock",
      "type": "Registerbekanntmachung nach dem Umwandlungsgesetz",
      "state": "Mecklenburg-Vorpommern",
      "amtsgericht": "Amtsgericht Rostock",
      "registernummer": "HRB 5096",
      "registerart": "HRB",
      "company_name": "Ex-Si-Ro Gesellschaft für externe Sicherheitsdienste und Sicherheitstechnik mbH Rostock",
      "company_seat": "Rostock",
      "details": "23.04.2025 (Bekanntmachungsdatum)\n\nMecklenburg-Vorpommern Amtsgericht Rostock HRB 5096\nRegisterbekanntmachung nach dem Umwandlungsgesetz 23.04.2025 (Eintragungsdatum)\n\nEx-Si-Ro Gesellschaft für externe Sicherheitsdienste und Sicherheitstechnik mbH Rostock\nGesellschaft mit beschränkter Haftung\nRostock\n\nAls nicht eingetragen wird veröffentlicht: Den Gläubigern der an der Spaltung beteiligten Rechtsträger ist, wenn sie binnen sechs Monaten nach dem Tag, an dem die Eintragung der Spaltung in das Register des Sitzes desjenigen Rechtsträgers, dessen Gläubiger sie sind, nach § 19 Abs. 3 UmwG als bekannt gemacht gilt, ihren Anspruch nach Grund und Höhe schriftlich anmelden, Sicherheit zu leisten, soweit sie nicht Befriedigung verlangen können. Dieses Recht steht den Gläubigern jedoch nur zu, wenn sie glaubhaft machen, dass durch die Spaltung die Erfüllung der Forderung gefährdet wird."
    },
    {
      "date": "2025-04-23",
      "id": "107158",
      "original_text": "Sonstige Registerbekanntmachung\nHamburg Amtsgericht Hamburg HRB 136433\nE.ON Grid Solutions GmbH – Hamburg",
      "type": "Sonstige Registerbekanntmachung",
      "state": "Hamburg",
      "amtsgericht": "Amtsgericht Hamburg",
      "registernummer": "HRB 136433",
      "registerart": "HRB",
      "company_name": "E.ON Grid Solutions GmbH",
      "company_seat": "Hamburg",
      "details": "23.04.2025 (Bekanntmachungsdatum)\n\nHamburg Amtsgericht Hamburg HRB 136433\nSonstige Registerbekanntmachung\n\nE.ON Grid Solutions GmbH\nGesellschaft mit beschränkter Haftung\nHamburg\n\nAls nicht eingetragen wird bekannt gemacht: Liste des Aufsichtsrats wurde eingereicht."
    },
    {
      "date": "2025-04-23",
      "id": "107159",
      "original_text": "Einreichung neuer Dokumente\nNiedersachsen Amtsgericht Braunschweig HRB 206866\nDiakonische Dienste beraten und begleiten Goslar gemeinnützige GmbH – Goslar",
      "type": "Einreichung neuer Dokumente",
      "state": "Niedersachsen",
      "amtsgericht": "Amtsgericht Braunschweig",
      "registernummer": "HRB 206866",
      "registerart": "HRB",
      "company_name": "Diakonische Dienste beraten und begleiten Goslar gemeinnützige GmbH",
      "company_seat": "Goslar",
      "details": "23.04.2025 (Bekanntmachungsdatum)\n\nNiedersachsen Amtsgericht Braunschweig HRB 206866\nEinreichung neuer Dokumente 23.04.2025 (Eintragungsdatum)\n\nDiakonische Dienste beraten und begleiten Goslar gemeinnützige GmbH\nGesellschaft mit beschränkter Haftung\nGoslar\n\nDie Liste der Mitglieder des Aufsichtsrats wurde beim Registergericht eingereicht."
    },
    {
      "date": "2025-04-23",
      "id": "107160",
      "original_text": "Registerbekanntmachung nach dem Umwandlungsgesetz\nNiedersachsen Amtsgericht Oldenburg (Oldenburg) HRA 208752\nVitalcenter e.K. – Löningen",
      "type": "Registerbekanntmachung nach dem Umwandlungsgesetz",
      "state": "Niedersachsen",
      "amtsgericht": "Amtsgericht Oldenburg (Oldenburg)",
      "registernummer": "HRA 208752",
      "registerart": "HRA",
      "company_name": "Vitalcenter e.K.",
      "company_seat": "Löningen",
      "details": "23.04.2025 (Bekanntmachungsdatum)\n\nNiedersachsen Amtsgericht Oldenburg (Oldenburg) HRA 208752\nRegisterbekanntmachung nach dem Umwandlungsgesetz 23.04.2025 (Eintragungsdatum)\n\nVitalcenter e.K.\nEinzelkaufmann / Einzelkauffrau\nLöningen\n\nDen Gläubigern der an der Ausgliederung beteiligten Rechtsträger ist, wenn sie binnen sechs Monaten nach dem Tag, an dem die Eintragung der Ausgliederung in das Register des Sitzes desjenigen Rechtsträgers, dessen Gläubiger sie sind, nach § 19 Abs. 3 UmwG als bekannt gemacht gilt, ihren Anspruch nach Grund und Höhe schriftlich anmelden, Sicherheit zu leisten, soweit sie nicht Befriedigung verlangen können. Dieses Recht steht den Gläubigern jedoch nur zu, wenn sie glaubhaft machen, dass durch die Ausgliederung die Erfüllung der Forderung gefährdet wird."
    },
    {
      "date": "2025-04-23",
      "id": "107161",
      "original_text": "Löschungsankündigung\nNiedersachsen Amtsgericht Braunschweig HRB 201975\nFriseur-Innovationen Alles für den Friseur - alles für Ihr Haar GmbH – Wittmar",
      "type": "Löschungsankündigung",
      "state": "Niedersachsen",
      "amtsgericht": "Amtsgericht Braunschweig",
      "registernummer": "HRB 201975",
      "registerart": "HRB",
      "company_name": "Friseur-Innovationen Alles für den Friseur - alles für Ihr Haar GmbH",
      "company_seat": "Wittmar",
      "details": "23.04.2025 (Bekanntmachungsdatum)\n\nNiedersachsen Amtsgericht Braunschweig HRB 201975\nLöschungsankündigung 23.04.2025 (Eintragungsdatum)\n\nFriseur-Innovationen Alles für den Friseur - alles für Ihr Haar GmbH\nGesellschaft mit beschränkter Haftung\nWittmar\n\nDas Registergericht beabsichtigt, den Geschäftsführer Gerhard Zelenka von Amts wegen nach § 395 FamFG zu löschen. Die Frist zur Erhebung eines Widerspruchs ist auf 1 Monat ab dieser Registerbekanntmachung festgesetzt."
    },
    {
      "date": "2025-04-23",
      "id": "107162",
      "original_text": "Löschungsankündigung\nNiedersachsen Amtsgericht Hannover HRB 219938\nHelene Gisy gemeinnützige GmbH – Hannover",
      "type": "Löschungsankündigung",
      "state": "Niedersachsen",
      "amtsgericht": "Amtsgericht Hannover",
      "registernummer": "HRB 219938",
      "registerart": "HRB",
      "company_name": "Helene Gisy gemeinnützige GmbH",
      "company_seat": "Hannover",
      "details": "23.04.2025 (Bekanntmachungsdatum)\n\nNiedersachsen Amtsgericht Hannover HRB 219938\nLöschungsankündigung 23.04.2025 (Eintragungsdatum)\n\nHelene Gisy gemeinnützige GmbH\nGesellschaft mit beschränkter Haftung\nHannover\n\nDas Registergericht beabsichtigt, die Gesellschaft von Amts wegen nach § 394 FamFG zu löschen. Die Frist zur Erhebung eines Widerspruchs ist auf 1 Monat ab dieser Registerbekanntmachung festgesetzt."
    },
    {
      "date": "2025-04-23",
      "id": "107163",
      "original_text": "Löschungsankündigung\nNiedersachsen Amtsgericht Oldenburg (Oldenburg) HRB 202767\nAchtundzwanzigste DT BIOGAS Beteiligungsgesellschaft mbH – Friesoythe",
      "type": "Löschungsankündigung",
      "state": "Niedersachsen",
      "amtsgericht": "Amtsgericht Oldenburg (Oldenburg)",
      "registernummer": "HRB 202767",
      "registerart": "HRB",
      "company_name": "Achtundzwanzigste DT BIOGAS Beteiligungsgesellschaft mbH",
      "company_seat": "Friesoythe",
      "details": "23.04.2025 (Bekanntmachungsdatum)\n\nNiedersachsen Amtsgericht Oldenburg (Oldenburg) HRB 202767\nLöschungsankündigung\n\nAchtundzwanzigste DT BIOGAS Beteiligungsgesellschaft mbH\nGesellschaft mit beschränkter Haftung\nFriesoythe\n\nDas Registergericht beabsichtigt, die Gesellschaft von Amts wegen nach § 394 FamFG zu löschen. Die Frist zur Erhebung eines Widerspruchs ist auf 1 Monat ab dieser Registerbekanntmachung festgesetzt."
    },
    {
      "date": "2025-04-23",
      "id": "107164",
      "original_text": "Sonstige Registerbekanntmachung\nNiedersachsen Amtsgericht Hannover HRB 227088\nPaladin Langfrist GmbH & Co. KGaA – Hannover",
      "type": "Sonstige Registerbekanntmachung",
      "state": "Niedersachsen",
      "amtsgericht": "Amtsgericht Hannover",
      "registernummer": "HRB 227088",
      "registerart": "HRB",
      "company_name": "Paladin Langfrist GmbH & Co. KGaA",
      "company_seat": "Hannover",
      "details": "23.04.2025 (Bekanntmachungsdatum)\n\nNiedersachsen Amtsgericht Hannover HRB 227088\nSonstige Registerbekanntmachung\n\nPaladin Langfrist GmbH & Co. KGaA\nKommanditgesellschaft auf Aktien\nHannover\n\nDie Liste der Mitglieder des Aufsichtsrats wurde beim Registergericht eingereicht."
    },
    {
      "date": "2025-04-23",
      "id": "107165",
      "original_text": "Registerbekanntmachung nach dem Umwandlungsgesetz\nNiedersachsen Amtsgericht Braunschweig HRB 212208\nKonzertagentur Piekert GmbH – Salzgitter",
      "type": "Registerbekanntmachung nach dem Umwandlungsgesetz",
      "state": "Niedersachsen",
      "amtsgericht": "Amtsgericht Braunschweig",
      "registernummer": "HRB 212208",
      "registerart": "HRB",
      "company_name": "Konzertagentur Piekert GmbH",
      "company_seat": "Salzgitter",
      "details": "23.04.2025 (Bekanntmachungsdatum)\n\nNiedersachsen Amtsgericht Braunschweig HRB 212208\nRegisterbekanntmachung nach dem Umwandlungsgesetz 23.04.2025 (Eintragungsdatum)\n\nKonzertagentur Piekert GmbH\nGesellschaft mit beschränkter Haftung\nSalzgitter\n\nDen Gläubigern der an der Ausgliederung beteiligten Rechtsträger ist, wenn sie binnen sechs Monaten nach dem Tag, an dem die Eintragung der Ausgliederung in das Register des Sitzes desjenigen Rechtsträgers, dessen Gläubiger sie sind, nach § 19 Abs. 3 UmwG als bekannt gemacht gilt, ihren Anspruch nach Grund und Höhe schriftlich anmelden, Sicherheit zu leisten, soweit sie nicht Befriedigung verlangen können. Dieses Recht steht den Gläubigern jedoch nur zu, wenn sie glaubhaft machen, dass durch die Ausgliederung die Erfüllung der Forderung gefährdet wird."
    },
    {
      "date": "2025-04-23",
      "id": "107166",
      "original_text": "Registerbekanntmachung nach dem Umwandlungsgesetz\nNiedersachsen Amtsgericht Oldenburg (Oldenburg) HRB 221952\nindigus GmbH – Löningen",
      "type": "Registerbekanntmachung nach dem Umwandlungsgesetz",
      "state": "Niedersachsen",
      "amtsgericht": "Amtsgericht Oldenburg (Oldenburg)",
      "registernummer": "HRB 221952",
      "registerart": "HRB",
      "company_name": "indigus GmbH",
      "company_seat": "Löningen",
      "details": "23.04.2025 (Bekanntmachungsdatum)\n\nNiedersachsen Amtsgericht Oldenburg (Oldenburg) HRB 221952\nRegisterbekanntmachung nach dem Umwandlungsgesetz 23.04.2025 (Eintragungsdatum)\n\nindigus GmbH\nGesellschaft mit beschränkter Haftung\nLöningen\n\nDen Gläubigern der an der Ausgliederung beteiligten Rechtsträger ist, wenn sie binnen sechs Monaten nach dem Tag, an dem die Eintragung der Ausgliederung in das Register des Sitzes desjenigen Rechtsträgers, dessen Gläubiger sie sind, nach § 19 Abs. 3 UmwG als bekannt gemacht gilt, ihren Anspruch nach Grund und Höhe schriftlich anmelden, Sicherheit zu leisten, soweit sie nicht Befriedigung verlangen können. Dieses Recht steht den Gläubigern jedoch nur zu, wenn sie glaubhaft machen, dass durch die Ausgliederung die Erfüllung der Forderung gefährdet wird."
    },
    {
      "date": "2025-04-23",
      "id": "107167",
      "original_text": "Registerbekanntmachung nach dem Umwandlungsgesetz\nNiedersachsen Amtsgericht Braunschweig HRA 202553\nKonzertagentur Piekert e.K. – Salzgitter",
      "type": "Registerbekanntmachung nach dem Umwandlungsgesetz",
      "state": "Niedersachsen",
      "amtsgericht": "Amtsgericht Braunschweig",
      "registernummer": "HRA 202553",
      "registerart": "HRA",
      "company_name": "Konzertagentur Piekert e.K.",
      "company_seat": "Salzgitter",
      "details": "23.04.2025 (Bekanntmachungsdatum)\n\nNiedersachsen Amtsgericht Braunschweig HRA 202553\nRegisterbekanntmachung nach dem Umwandlungsgesetz 23.04.2025 (Eintragungsdatum)\n\nKonzertagentur Piekert e.K.\nEinzelkaufmann / Einzelkauffrau\nSalzgitter\n\nDen Gläubigern der an der Ausgliederung beteiligten Rechtsträger ist, wenn sie binnen sechs Monaten nach dem Tag, an dem die Eintragung der Ausgliederung in das Register des Sitzes desjenigen Rechtsträgers, dessen Gläubiger sie sind, nach § 19 Abs. 3 UmwG als bekannt gemacht gilt, ihren Anspruch nach Grund und Höhe schriftlich anmelden, Sicherheit zu leisten, soweit sie nicht Befriedigung verlangen können. Dieses Recht steht den Gläubigern jedoch nur zu, wenn sie glaubhaft machen, dass durch die Ausgliederung die Erfüllung der Forderung gefährdet wird."
    },
    {
      "date": "2025-04-23",
      "id": "107168",
      "original_text": "Registerbekanntmachung nach dem Umwandlungsgesetz\nBremen Amtsgericht Bremen HRB 11118\nULG Universal Leaf Germany GmbH – Bremen",
      "type": "Registerbekanntmachung nach dem Umwandlungsgesetz",
      "state": "Bremen",
      "amtsgericht": "Amtsgericht Bremen",
      "registernummer": "HRB 11118",
      "registerart": "HRB",
      "company_name": "ULG Universal Leaf Germany GmbH",
      "company_seat": "Bremen",
      "details": "23.04.2025 (Bekanntmachungsdatum)\n\nBremen Amtsgericht Bremen HRB 11118\nRegisterbekanntmachung nach dem Umwandlungsgesetz 17.04.2025 (Eintragungsdatum)\n\nULG Universal Leaf Germany GmbH\nGesellschaft mit beschränkter Haftung\nBremen\n\nZu Eintragungsnummer 6 vom 17.04.2025 wird als nicht eingetragen veröffentlicht: Den Gläubigern der an der Verschmelzung beteiligten Rechtsträger ist, wenn sie binnen sechs Monaten nach dem Tag, an dem die Eintragung der Verschmelzung in das Register des Sitzes desjenigen Rechtsträgers, dessen Gläubiger sie sind, als bekannt gemacht gilt, ihren Anspruch nach Grund und Höhe schriftlich anmelden, Sicherheit zu leisten, soweit sie nicht Befriedigung verlangen können. Dieses Recht steht den Gläubigern jedoch nur zu, wenn sie glaubhaft machen, dass durch die Verschmelzung die Erfüllung ihrer Forderung gefährdet wird. Das Recht, Sicherheitsleistung zu verlangen, steht Gläubigern nicht zu, die im Falle der Insolvenz ein Recht auf vorzugsweise Befriedigung aus einer Deckungsmasse haben, die nach gesetzlicher Vorschrift zu ihrem Schutz errichtet und staatlich überwacht ist."
    },
    {
      "date": "2025-04-23",
      "id": "107169",
      "original_text": "Registerbekanntmachung nach dem Umwandlungsgesetz\nBremen Amtsgericht Bremen HRB 21768\nSweco GmbH – Bremen",
      "type": "Registerbekanntmachung nach dem Umwandlungsgesetz",
      "state": "Bremen",
      "amtsgericht": "Amtsgericht Bremen",
      "registernummer": "HRB 21768",
      "registerart": "HRB",
      "company_name": "Sweco GmbH",
      "company_seat": "Bremen",
      "details": "23.04.2025 (Bekanntmachungsdatum)\n\nBremen Amtsgericht Bremen HRB 21768\nRegisterbekanntmachung nach dem Umwandlungsgesetz 17.04.2025 (Eintragungsdatum)\n\nSweco GmbH\nGesellschaft mit beschränkter Haftung\nBremen\n\nAls nicht eingetragen wird veröffentlicht: Den Gläubigern der an der Verschmelzung beteiligten Rechtsträger ist, wenn sie binnen sechs Monaten nach dem Tag, an dem die Eintragung der Verschmelzung in das Register des Sitzes desjenigen Rechtsträgers, dessen Gläubiger sie sind, als bekannt gemacht gilt, ihren Anspruch nach Grund und Höhe schriftlich anmelden, Sicherheit zu leisten, soweit sie nicht Befriedigung verlangen können. Dieses Recht steht den Gläubigern jedoch nur zu, wenn sie glaubhaft machen, dass durch die Verschmelzung die Erfüllung ihrer Forderung gefährdet wird. Das Recht, Sicherheitsleistung zu verlangen, steht Gläubigern nicht zu, die im Falle der Insolvenz ein Recht auf vorzugsweise Befriedigung aus einer Deckungsmasse haben, die nach gesetzlicher Vorschrift zu ihrem Schutz errichtet und staatlich überwacht ist."
    },
    {
      "date": "2025-04-23",
      "id": "107170",
      "original_text": "Löschungsankündigung\nBremen Amtsgericht Bremen HRA 29447\nCanaLine Shop Bremen e. K. – Bremen",
      "type": "Löschungsankündigung",
      "state": "Bremen",
      "amtsgericht": "Amtsgericht Bremen",
      "registernummer": "HRA 29447",
      "registerart": "HRA",
      "company_name": "CanaLine Shop Bremen e. K.",
      "company_seat": "Bremen",
      "details": "23.04.2025 (Bekanntmachungsdatum)\n\nBremen Amtsgericht Bremen HRA 29447\nLöschungsankündigung\n\nCanaLine Shop Bremen e. K.\nEinzelkaufmann / Einzelkauffrau\nBremen\n\nEs ist beabsichtigt die im Handelsregister eingetragene Firma von Amts wegen gemäß § 31 Abs.2 HGB zu löschen. Gegen die Löschung kann beim AG Bremen schriftlich oder zu Protokoll der Geschäftsstelle Widerspruch eingelegt werden. Widerspruchsfrist 4 Wochen."
    },
    {
      "date": "2025-04-23",
      "id": "107171",
      "original_text": "Registerbekanntmachung nach dem Umwandlungsgesetz\nBremen Amtsgericht Bremen HRB 19207\nIF-Com GmbH – Bremen",
      "type": "Registerbekanntmachung nach dem Umwandlungsgesetz",
      "state": "Bremen",
      "amtsgericht": "Amtsgericht Bremen",
      "registernummer": "HRB 19207",
      "registerart": "HRB",
      "company_name": "IF-Com GmbH",
      "company_seat": "Bremen",
      "details": "23.04.2025 (Bekanntmachungsdatum)\n\nBremen Amtsgericht Bremen HRB 19207\nRegisterbekanntmachung nach dem Umwandlungsgesetz 22.04.2025 (Eintragungsdatum)\n\nIF-Com GmbH\nGesellschaft mit beschränkter Haftung\nBremen\n\nZu Eintragungsnummer 6 vom 22.04.2025 wird als nicht eingetragen veröffentlicht: Den Gläubigern der an der Verschmelzung beteiligten Rechtsträger ist, wenn sie binnen sechs Monaten nach dem Tag, an dem die Eintragung der Verschmelzung in das Register des Sitzes desjenigen Rechtsträgers, dessen Gläubiger sie sind, als bekannt gemacht gilt, ihren Anspruch nach Grund und Höhe schriftlich anmelden, Sicherheit zu leisten, soweit sie nicht Befriedigung verlangen können. Dieses Recht steht den Gläubigern jedoch nur zu, wenn sie glaubhaft machen, dass durch die Verschmelzung die Erfüllung ihrer Forderung gefährdet wird. Das Recht, Sicherheitsleistung zu verlangen, steht Gläubigern nicht zu, die im Falle der Insolvenz ein Recht auf vorzugsweise Befriedigung aus einer Deckungsmasse haben, die nach gesetzlicher Vorschrift zu ihrem Schutz errichtet und staatlich überwacht ist."
    },
    {
      "date": "2025-04-23",
      "id": "107172",
      "original_text": "Löschungsankündigung\nRheinland-Pfalz Amtsgericht Ludwigshafen a.Rhein (Ludwigshafen) HRB 65109\nHLS European Solutions GmbH – Ludwigshafen",
      "type": "Löschungsankündigung",
      "state": "Rheinland-Pfalz",
      "amtsgericht": "Amtsgericht Ludwigshafen a.Rhein (Ludwigshafen)",
      "registernummer": "HRB 65109",
      "registerart": "HRB",
      "company_name": "HLS European Solutions GmbH",
      "company_seat": "Ludwigshafen",
      "details": "23.04.2025 (Bekanntmachungsdatum)\n\nRheinland-Pfalz Amtsgericht Ludwigshafen a.Rhein (Ludwigshafen) HRB 65109\nLöschungsankündigung 23.04.2025 (Eintragungsdatum)\n\nHLS European Solutions GmbH\nGesellschaft mit beschränkter Haftung\nLudwigshafen\n\nDas Registergericht beabsichtigt die Gesellschaft von Amts wegen nach § 394 FamFG zu löschen. Die Frist zur Erhebung eines Widerspruchs ist auf einen Monat festgesetzt."
    },
    {
      "date": "2025-04-23",
      "id": "107173",
      "original_text": "Einreichung neuer Dokumente\nRheinland-Pfalz Amtsgericht Kaiserslautern HRB 31781\nALZURA AG – Kaiserslautern",
      "type": "Einreichung neuer Dokumente",
      "state": "Rheinland-Pfalz",
      "amtsgericht": "Amtsgericht Kaiserslautern",
      "registernummer": "HRB 31781",
      "registerart": "HRB",
      "company_name": "ALZURA AG",
      "company_seat": "Kaiserslautern",
      "details": "23.04.2025 (Bekanntmachungsdatum)\n\nRheinland-Pfalz Amtsgericht Kaiserslautern HRB 31781\nEinreichung neuer Dokumente 23.04.2025 (Eintragungsdatum)\n\nALZURA AG\nAktiengesellschaft\nKaiserslautern\n\nDem Registergericht ist eine neue Liste der Mitglieder des Aufsichtsrates eingereicht worden."
    },
    {
      "date": "2025-04-23",
      "id": "107174",
      "original_text": "Löschungsankündigung\nRheinland-Pfalz Amtsgericht Koblenz HRB 26377\nDesyncra Visual Neuromodulation GmbH – Bad Neuenahr-Ahrweiler",
      "type": "Löschungsankündigung",
      "state": "Rheinland-Pfalz",
      "amtsgericht": "Amtsgericht Koblenz",
      "registernummer": "HRB 26377",
      "registerart": "HRB",
      "company_name": "Desyncra Visual Neuromodulation GmbH",
      "company_seat": "Bad Neuenahr-Ahrweiler",
      "details": "23.04.2025 (Bekanntmachungsdatum)\n\nRheinland-Pfalz Amtsgericht Koblenz HRB 26377\nLöschungsankündigung\n\nDesyncra Visual Neuromodulation GmbH\nGesellschaft mit beschränkter Haftung\nBad Neuenahr-Ahrweiler\n\nDas Registergericht beabsichtigt die Gesellschaft wegen Vermögenslosigkeit von Amts wegen gemäß § 394 FamFG zu löschen. Die Frist zur Erhebung eines Widerspruchs ist auf einen Monat festgesetzt."
    },
    {
      "date": "2025-04-23",
      "id": "107175",
      "original_text": "Löschungsankündigung\nRheinland-Pfalz Amtsgericht Mainz HRB 51820\nYashar Logistik GmbH – Ingelheim am Rhein",
      "type": "Löschungsankündigung",
      "state": "Rheinland-Pfalz",
      "amtsgericht": "Amtsgericht Mainz",
      "registernummer": "HRB 51820",
      "registerart": "HRB",
      "company_name": "Yashar Logistik GmbH",
      "company_seat": "Ingelheim am Rhein",
      "details": "23.04.2025 (Bekanntmachungsdatum)\n\nRheinland-Pfalz Amtsgericht Mainz HRB 51820\nLöschungsankündigung\n\nYashar Logistik GmbH\nGesellschaft mit beschränkter Haftung\nIngelheim am Rhein\n\nDas Registergericht beabsichtigt die Gesellschaft von Amts wegen nach § 394 FamFG zu löschen. Die Frist zur Erhebung eines Widerspruchs ist auf einen Monat festgesetzt."
    },
    {
      "date": "2025-04-23",
      "id": "107176",
      "original_text": "Löschungsankündigung\nRheinland-Pfalz Amtsgericht Montabaur HRB 27609\nWesterwald-Reifen GmbH – Altenkirchen",
      "type": "Löschungsankündigung",
      "state": "Rheinland-Pfalz",
      "amtsgericht": "Amtsgericht Montabaur",
      "registernummer": "HRB 27609",
      "registerart": "HRB",
      "company_name": "Westerwald-Reifen GmbH",
      "company_seat": "Altenkirchen",
      "details": "23.04.2025 (Bekanntmachungsdatum)\n\nRheinland-Pfalz Amtsgericht Montabaur HRB 27609\nLöschungsankündigung\n\nWesterwald-Reifen GmbH\nGesellschaft mit beschränkter Haftung\nAltenkirchen\n\nDas Registergericht beabsichtigt die Gesellschaft von Amts wegen nach § 394 FamFG zu löschen. Die Frist zur Erhebung eines Widerspruchs ist auf einen Monat festgesetzt."
    },
    {
      "date": "2025-04-23",
      "id": "107177",
      "original_text": "Löschungsankündigung\nRheinland-Pfalz Amtsgericht Ludwigshafen a.Rhein (Ludwigshafen) HRB 66539\nArsim & Besim UG (haftungsbeschränkt) – Neustadt",
      "type": "Löschungsankündigung",
      "state": "Rheinland-Pfalz",
      "amtsgericht": "Amtsgericht Ludwigshafen a.Rhein (Ludwigshafen)",
      "registernummer": "HRB 66539",
      "registerart": "HRB",
      "company_name": "Arsim & Besim UG (haftungsbeschränkt)",
      "company_seat": "Neustadt",
      "details": "23.04.2025 (Bekanntmachungsdatum)\n\nRheinland-Pfalz Amtsgericht Ludwigshafen a.Rhein (Ludwigshafen) HRB 66539\nLöschungsankündigung 23.04.2025 (Eintragungsdatum)\n\nArsim & Besim UG (haftungsbeschränkt)\nGesellschaft mit beschränkter Haftung\nNeustadt\n\nDas Registergericht beabsichtigt die Gesellschaft von Amts wegen nach § 394 FamFG zu löschen. Die Frist zur Erhebung eines Widerspruchs ist auf einen Monat festgesetzt."
    },
    {
      "date": "2025-04-23",
      "id": "107178",
      "original_text": "Einreichung neuer Dokumente\nRheinland-Pfalz Amtsgericht Mainz HRB 41936\nGemeinnützige Gesellschaft für Ausbildung, Qualifizierung und Arbeit des Arbeiter-Samariter-Bund mbH – Mainz",
      "type": "Einreichung neuer Dokumente",
      "state": "Rheinland-Pfalz",
      "amtsgericht": "Amtsgericht Mainz",
      "registernummer": "HRB 41936",
      "registerart": "HRB",
      "company_name": "Gemeinnützige Gesellschaft für Ausbildung, Qualifizierung und Arbeit des Arbeiter-Samariter-Bund mbH",
      "company_seat": "Mainz",
      "details": "23.04.2025 (Bekanntmachungsdatum)\n\nRheinland-Pfalz Amtsgericht Mainz HRB 41936\nEinreichung neuer Dokumente\n\nGemeinnützige Gesellschaft für Ausbildung, Qualifizierung und Arbeit des Arbeiter-Samariter-Bund mbH\nGesellschaft mit beschränkter Haftung\nMainz\n\nDem Registergericht ist eine neue Liste der Mitglieder des Aufsichtsrates eingereicht worden."
    },
    {
      "date": "2025-04-23",
      "id": "107179",
      "original_text": "Einreichung neuer Dokumente\nRheinland-Pfalz Amtsgericht Mainz HRB 51230\nSCHOTT Pharma AG & Co. KGaA – Mainz",
      "type": "Einreichung neuer Dokumente",
      "state": "Rheinland-Pfalz",
      "amtsgericht": "Amtsgericht Mainz",
      "registernummer": "HRB 51230",
      "registerart": "HRB",
      "company_name": "SCHOTT Pharma AG & Co. KGaA",
      "company_seat": "Mainz",
      "details": "23.04.2025 (Bekanntmachungsdatum)\n\nRheinland-Pfalz Amtsgericht Mainz HRB 51230\nEinreichung neuer Dokumente\n\nSCHOTT Pharma AG & Co. KGaA\nKommanditgesellschaft auf Aktien\nMainz\n\nDem Registergericht ist eine Liste der Mitglieder des Aufsichtsrates eingereicht worden."
    },
    {
      "date": "2025-04-23",
      "id": "107180",
      "original_text": "Löschungsankündigung\nRheinland-Pfalz Amtsgericht Bad Kreuznach HRB 23297\nBG - Transporte UG (haftungsbeschränkt) – Kirn",
      "type": "Löschungsankündigung",
      "state": "Rheinland-Pfalz",
      "amtsgericht": "Amtsgericht Bad Kreuznach",
      "registernummer": "HRB 23297",
      "registerart": "HRB",
      "company_name": "BG - Transporte UG (haftungsbeschränkt)",
      "company_seat": "Kirn",
      "details": "23.04.2025 (Bekanntmachungsdatum)\n\nRheinland-Pfalz Amtsgericht Bad Kreuznach HRB 23297\nLöschungsankündigung\n\nBG - Transporte UG (haftungsbeschränkt)\nGesellschaft mit beschränkter Haftung\nKirn\n\nDas Registergericht beabsichtigt die Gesellschaft wegen Vermögenslosigkeit im Handelsregister von Amts wegen nach § 394 FamFG zu löschen. Die Frist zur Erhebung eines Widerspruchs gegen die beabsichtigte Löschung ist auf einen Monat ab Veröffentlichung bestimmt."
    },
    {
      "date": "2025-04-23",
      "id": "107181",
      "original_text": "Löschungsankündigung\nRheinland-Pfalz Amtsgericht Montabaur HRB 27609\nWesterwald-Reifen GmbH – Altenkirchen",
      "type": "Löschungsankündigung",
      "state": "Rheinland-Pfalz",
      "amtsgericht": "Amtsgericht Montabaur",
      "registernummer": "HRB 27609",
      "registerart": "HRB",
      "company_name": "Westerwald-Reifen GmbH",
      "company_seat": "Altenkirchen",
      "details": "23.04.2025 (Bekanntmachungsdatum)\n\nRheinland-Pfalz Amtsgericht Montabaur HRB 27609\nLöschungsankündigung\n\nWesterwald-Reifen GmbH\nGesellschaft mit beschränkter Haftung\nAltenkirchen\n\nDas Registergericht beabsichtigt die Gesellschaft von Amts wegen nach § 394 Abs. 1  FamFG zu löschen. Die Frist zur Erhebung eines Widerspruchs ist auf einen Monat festgesetzt."
    },
    {
      "date": "2025-04-23",
      "id": "107182",
      "original_text": "Löschungsankündigung\nRheinland-Pfalz Amtsgericht Mainz HRB 49434\nPANORA.BLACK Verwaltungen GmbH – Mainz",
      "type": "Löschungsankündigung",
      "state": "Rheinland-Pfalz",
      "amtsgericht": "Amtsgericht Mainz",
      "registernummer": "HRB 49434",
      "registerart": "HRB",
      "company_name": "PANORA.BLACK Verwaltungen GmbH",
      "company_seat": "Mainz",
      "details": "23.04.2025 (Bekanntmachungsdatum)\n\nRheinland-Pfalz Amtsgericht Mainz HRB 49434\nLöschungsankündigung\n\nPANORA.BLACK Verwaltungen GmbH\nGesellschaft mit beschränkter Haftung\nMainz\n\nDas Registergericht beabsichtigt die Gesellschaft von Amts wegen nach § 394 FamFG zu löschen. Die Frist zur Erhebung eines Widerspruchs ist auf einen Monat festgesetzt."
    },
    {
      "date": "2025-04-23",
      "id": "107183",
      "original_text": "Löschungsankündigung\nNordrhein-Westfalen Amtsgericht Dortmund HRB 31394\nMR Bautec GmbH – Dortmund",
      "type": "Löschungsankündigung",
      "state": "Nordrhein-Westfalen",
      "amtsgericht": "Amtsgericht Dortmund",
      "registernummer": "HRB 31394",
      "registerart": "HRB",
      "company_name": "MR Bautec GmbH",
      "company_seat": "Dortmund",
      "details": "23.04.2025 (Bekanntmachungsdatum)\n\nNordrhein-Westfalen Amtsgericht Dortmund HRB 31394\nLöschungsankündigung\n\nMR Bautec GmbH\nGesellschaft mit beschränkter Haftung\nDortmund\n\nDas Registergericht beabsichtigt die Gesellschaft von Amts wegen nach § 394 FamFG zu löschen. Die Frist zur Erhebung eines Widerspruchs ist auf zwei Monate festgesetzt."
    },
    {
      "date": "2025-04-23",
      "id": "107184",
      "original_text": "Löschungsankündigung\nNordrhein-Westfalen Amtsgericht Essen HRB 22057\nNahrungs- und Verpackungsfachhandel Wronka UG (haftungsbeschränkt) – Essen",
      "type": "Löschungsankündigung",
      "state": "Nordrhein-Westfalen",
      "amtsgericht": "Amtsgericht Essen",
      "registernummer": "HRB 22057",
      "registerart": "HRB",
      "company_name": "Nahrungs- und Verpackungsfachhandel Wronka UG (haftungsbeschränkt)",
      "company_seat": "Essen",
      "details": "23.04.2025 (Bekanntmachungsdatum)\n\nNordrhein-Westfalen Amtsgericht Essen HRB 22057\nLöschungsankündigung\n\nNahrungs- und Verpackungsfachhandel Wronka UG (haftungsbeschränkt)\nGesellschaft mit beschränkter Haftung\nEssen\n\nDas Registergericht beabsichtigt die Gesellschaft von Amts wegen nach § 394 FamFG zu löschen. Die Frist zur Erhebung eines Widerspruchs ist auf einen Monat festgesetzt."
    },
    {
      "date": "2025-04-23",
      "id": "107185",
      "original_text": "Registerbekanntmachung nach dem Umwandlungsgesetz\nNordrhein-Westfalen Amtsgericht Essen HRB 36761\nBlitstein & Wiese Real Estate GmbH – Essen",
      "type": "Registerbekanntmachung nach dem Umwandlungsgesetz",
      "state": "Nordrhein-Westfalen",
      "amtsgericht": "Amtsgericht Essen",
      "registernummer": "HRB 36761",
      "registerart": "HRB",
      "company_name": "Blitstein & Wiese Real Estate GmbH",
      "company_seat": "Essen",
      "details": "23.04.2025 (Bekanntmachungsdatum)\n\nNordrhein-Westfalen Amtsgericht Essen HRB 36761\nRegisterbekanntmachung nach dem Umwandlungsgesetz 23.04.2025 (Eintragungsdatum)\n\nBlitstein & Wiese Real Estate GmbH\nGesellschaft mit beschränkter Haftung\nEssen\n\nDen Gläubigern der an der formwechselnden Umwandlung beteiligten Rechtsträger ist, wenn sie binnen sechs Monaten nach dem Tag, an dem die Eintragung der formwechselnden Umwandlung in das Register des Sitzes derjenigen Rechtsträger deren Gläubiger sie sind, nach § 19 Absatz 3 UmwG als bekanntgemacht gilt, ihren Anspruch nach Grund und Höhe schriftlich anmelden, Sicherheit zu leisten, soweit sie nicht Befriedigung verlangen können. Dieses Recht steht den Gläubigern jedoch nur zu, wenn sie glaubhaft machen, dass durch die formwechselnden Umwandlung die Erfüllung ihrer Forderung gefährdet wird."
    },
    {
      "date": "2025-04-23",
      "id": "107186",
      "original_text": "Löschungsankündigung\nNordrhein-Westfalen Amtsgericht Essen HRB 34765\nGPE Solar Connection UG (haftungsbeschränkt) – Essen",
      "type": "Löschungsankündigung",
      "state": "Nordrhein-Westfalen",
      "amtsgericht": "Amtsgericht Essen",
      "registernummer": "HRB 34765",
      "registerart": "HRB",
      "company_name": "GPE Solar Connection UG (haftungsbeschränkt)",
      "company_seat": "Essen",
      "details": "23.04.2025 (Bekanntmachungsdatum)\n\nNordrhein-Westfalen Amtsgericht Essen HRB 34765\nLöschungsankündigung\n\nGPE Solar Connection UG (haftungsbeschränkt)\nGesellschaft mit beschränkter Haftung\nEssen\n\nDas Registergericht beabsichtigt die Gesellschaft von Amts wegen nach § 394 FamFG zu löschen. Die Frist zur Erhebung eines Widerspruchs ist auf einen Monat festgesetzt."
    },
    {
      "date": "2025-04-23",
      "id": "107187",
      "original_text": "Löschungsankündigung\nNordrhein-Westfalen Amtsgericht Neuss HRB 19901\nH & G GmbH – Neuss",
      "type": "Löschungsankündigung",
      "state": "Nordrhein-Westfalen",
      "amtsgericht": "Amtsgericht Neuss",
      "registernummer": "HRB 19901",
      "registerart": "HRB",
      "company_name": "H & G GmbH",
      "company_seat": "Neuss",
      "details": "23.04.2025 (Bekanntmachungsdatum)\n\nNordrhein-Westfalen Amtsgericht Neuss HRB 19901\nLöschungsankündigung\n\nH & G GmbH\nGesellschaft mit beschränkter Haftung\nNeuss\n\nEs ist beabsichtigt, die Gesellschaft wegen Vermögenslosigkeit aufgrund des § 394 Abs. 1 FamFG zu löschen. Frist zur Geltendmachung eines Widerspruchs: 1 Monat.\n\nRechtsbehelfsbelehrung:\nGegen diese Verfügung können Sie Widerspruch einlegen.\nDer Widerspruch ist bei dem Amtsgericht Neuss - Registergericht -, Breite Str. 48, 41460 Neuss schriftlich in deutscher Sprache oder zur Niederschrift der Geschäftsstelle einzulegen.\nDer Widerspruch kann auch zur Niederschrift der Geschäftsstelle eines jeden Amtsgerichtes abgegeben werden.\nDie Einlegung ist auch durch Übertragung eines elektronischen Dokuments an die elektronische Poststelle des Gerichts möglich. Das elektronische Dokument muss für die Bearbeitung durch das Gericht geeignet und mit einer qualifizierten elektronischen Signatur der verantwortenden Person versehen sein oder von der verantwortenden Person signiert und auf einem sicheren Übermittlungsweg gemäß § 130a ZPO nach näherer Maßgabe der Verordnung über die technischen Rahmenbedingungen des elektronischen Rechtsverkehrs und über das besondere elektronische Behördenpostfach (BGBl. I, S.3803) eingereicht werden. Weitere Informationen erhalten Sie auf der Internetseite www.justiz.de.\nDer Widerspruch muss spätestens innerhalb der gesetzten Frist nach der schriftlichen Bekanntgabe der Verfügung bei dem Amtsgericht - Registergericht - Neuss eingegangen sein. Dies gilt auch dann, wenn der Widerspruch zur Niederschrift der Geschäftsstelle eines anderen Amtsgerichtes abgegeben wurde. Die Frist beginnt mit der schriftlichen Bekanntgabe der Verfügung. Die Bekanntgabe ist entweder durch Zustellung oder am dritten Tage nach Aufgabe zur Post bewirkt. Fällt das Ende der Frist auf einen Sonntag, einen allgemeinen Feiertag oder Sonnabend, so endet die Frist mit Ablauf des nächsten Werktages.\n\nDer Widerspruch muss die Bezeichnung der angefochtenen Verfügung sowie die Erklärung enthalten, dass Widerspruch gegen diese Verfügung eingelegt wird. Er ist zu unterzeichnen und soll begründet werden."
    },
    {
      "date": "2025-04-23",
      "id": "107188",
      "original_text": "Löschungsankündigung\nNordrhein-Westfalen Amtsgericht Hamm HRB 10315\nCollector's Pocket UG (haftungsbeschränkt) – Hamm",
      "type": "Löschungsankündigung",
      "state": "Nordrhein-Westfalen",
      "amtsgericht": "Amtsgericht Hamm",
      "registernummer": "HRB 10315",
      "registerart": "HRB",
      "company_name": "Collector's Pocket UG (haftungsbeschränkt)",
      "company_seat": "Hamm",
      "details": "23.04.2025 (Bekanntmachungsdatum)\n\nNordrhein-Westfalen Amtsgericht Hamm HRB 10315\nLöschungsankündigung\n\nCollector's Pocket UG (haftungsbeschränkt)\nGesellschaft mit beschränkter Haftung\nHamm\n\nDas Registergericht beabsichtigt die Gesellschaft von Amts wegen nach § 394 FamFG zu löschen. Die Frist zur Erhebung eines Widerspruchs ist auf drei Monate festgesetzt."
    },
    {
      "date": "2025-04-23",
      "id": "107189",
      "original_text": "Löschungsankündigung\nNordrhein-Westfalen Amtsgericht Hamm HRB 10721\nKraft Bau GmbH – Bergkamen",
      "type": "Löschungsankündigung",
      "state": "Nordrhein-Westfalen",
      "amtsgericht": "Amtsgericht Hamm",
      "registernummer": "HRB 10721",
      "registerart": "HRB",
      "company_name": "Kraft Bau GmbH",
      "company_seat": "Bergkamen",
      "details": "23.04.2025 (Bekanntmachungsdatum)\n\nNordrhein-Westfalen Amtsgericht Hamm HRB 10721\nLöschungsankündigung\n\nKraft Bau GmbH\nGesellschaft mit beschränkter Haftung\nBergkamen\n\nDas Registergericht beabsichtigt die Gesellschaft von Amts wegen nach § 394 FamFG zu löschen. Die Frist zur Erhebung eines Widerspruchs ist auf drei Monate festgesetzt."
    },
    {
      "date": "2025-04-23",
      "id": "107190",
      "original_text": "Registerbekanntmachung nach dem Umwandlungsgesetz\nNordrhein-Westfalen Amtsgericht Paderborn HRB 12842\nMichael Lemken Einrichtungen GmbH – Lippstadt",
      "type": "Registerbekanntmachung nach dem Umwandlungsgesetz",
      "state": "Nordrhein-Westfalen",
      "amtsgericht": "Amtsgericht Paderborn",
      "registernummer": "HRB 12842",
      "registerart": "HRB",
      "company_name": "Michael Lemken Einrichtungen GmbH",
      "company_seat": "Lippstadt",
      "details": "23.04.2025 (Bekanntmachungsdatum)\n\nNordrhein-Westfalen Amtsgericht Paderborn HRB 12842\nRegisterbekanntmachung nach dem Umwandlungsgesetz 23.04.2025 (Eintragungsdatum)\n\nMichael Lemken Einrichtungen GmbH\nGesellschaft mit beschränkter Haftung\nLippstadt\n\nDen Gläubigern der an der Verschmelzung beteiligten Rechtsträger ist, wenn sie binnen sechs Monaten nach dem Tag, an dem die Eintragung der Verschmelzung in das Register des Sitzes desjenigen Rechtsträgers, dessen Gläubiger sie sind, nach § 19 Absatz 3 UmwG als bekanntgemacht gilt, ihren Anspruch nach Grund und Höhe schriftlich anmelden, Sicherheit zu leisten, soweit sie nicht Befriedigung verlangen können. Dieses Recht steht den Gläubigern jedoch nur zu, wenn sie glaubhaft machen, dass durch die Verschmelzung die Erfüllung ihrer Forderung gefährdet wird."
    },
    {
      "date": "2025-04-23",
      "id": "107191",
      "original_text": "Löschungsankündigung\nNordrhein-Westfalen Amtsgericht Essen HRB 28494\nVVB GmbH – Essen",
      "type": "Löschungsankündigung",
      "state": "Nordrhein-Westfalen",
      "amtsgericht": "Amtsgericht Essen",
      "registernummer": "HRB 28494",
      "registerart": "HRB",
      "company_name": "VVB GmbH",
      "company_seat": "Essen",
      "details": "23.04.2025 (Bekanntmachungsdatum)\n\nNordrhein-Westfalen Amtsgericht Essen HRB 28494\nLöschungsankündigung\n\nVVB GmbH\nGesellschaft mit beschränkter Haftung\nEssen\n\nDas Registergericht beabsichtigt die Gesellschaft von Amts wegen nach § 394 FamFG zu löschen. Die Frist zur Erhebung eines Widerspruchs ist auf zwei Monate festgesetzt."
    },
    {
      "date": "2025-04-23",
      "id": "107192",
      "original_text": "Registerbekanntmachung nach dem Umwandlungsgesetz\nNordrhein-Westfalen Amtsgericht Düsseldorf HRB 67815\nSend Verwaltung GmbH – Düsseldorf",
      "type": "Registerbekanntmachung nach dem Umwandlungsgesetz",
      "state": "Nordrhein-Westfalen",
      "amtsgericht": "Amtsgericht Düsseldorf",
      "registernummer": "HRB 67815",
      "registerart": "HRB",
      "company_name": "Send Verwaltung GmbH",
      "company_seat": "Düsseldorf",
      "details": "23.04.2025 (Bekanntmachungsdatum)\n\nNordrhein-Westfalen Amtsgericht Düsseldorf HRB 67815\nRegisterbekanntmachung nach dem Umwandlungsgesetz 23.04.2025 (Eintragungsdatum)\n\nSend Verwaltung GmbH\nGesellschaft mit beschränkter Haftung\nDüsseldorf\n\nDen Gläubigern der an der Ausgliederung beteiligten Rechtsträger ist, wenn sie binnen sechs Monaten nach dem Tag, an dem die Eintragung der Ausgliederung in das Register des Sitzes desjenigen Rechtsträgers, dessen Gläubiger sie sind, nach § 19 Absatz 3 UmwG als bekanntgemacht gilt, ihren Anspruch nach Grund und Höhe schriftlich anmelden, Sicherheit zu leisten, soweit sie nicht Befriedigung verlangen können. Dieses Recht steht den Gläubigern jedoch nur zu, wenn sie glaubhaft machen, dass durch die Ausgliederung die Erfüllung ihrer Forderung gefährdet wird."
    },
    {
      "date": "2025-04-23",
      "id": "107193",
      "original_text": "Löschungsankündigung\nNordrhein-Westfalen Amtsgericht Hamm HRB 11135\nL-T-S GmbH – Hamm",
      "type": "Löschungsankündigung",
      "state": "Nordrhein-Westfalen",
      "amtsgericht": "Amtsgericht Hamm",
      "registernummer": "HRB 11135",
      "registerart": "HRB",
      "company_name": "L-T-S GmbH",
      "company_seat": "Hamm",
      "details": "23.04.2025 (Bekanntmachungsdatum)\n\nNordrhein-Westfalen Amtsgericht Hamm HRB 11135\nLöschungsankündigung\n\nL-T-S GmbH\nGesellschaft mit beschränkter Haftung\nHamm\n\nDas Registergericht beabsichtigt die Gesellschaft von Amts wegen nach § 394 FamFG zu löschen. Die Frist zur Erhebung eines Widerspruchs ist auf drei Monate festgesetzt."
    },
    {
      "date": "2025-04-23",
      "id": "107194",
      "original_text": "Registerbekanntmachung nach dem Umwandlungsgesetz\nNordrhein-Westfalen Amtsgericht Düsseldorf HRB 81556\nDeutsche Investitions- und Förderberatung GmbH – Düsseldorf",
      "type": "Registerbekanntmachung nach dem Umwandlungsgesetz",
      "state": "Nordrhein-Westfalen",
      "amtsgericht": "Amtsgericht Düsseldorf",
      "registernummer": "HRB 81556",
      "registerart": "HRB",
      "company_name": "Deutsche Investitions- und Förderberatung GmbH",
      "company_seat": "Düsseldorf",
      "details": "23.04.2025 (Bekanntmachungsdatum)\n\nNordrhein-Westfalen Amtsgericht Düsseldorf HRB 81556\nRegisterbekanntmachung nach dem Umwandlungsgesetz 23.04.2025 (Eintragungsdatum)\n\nDeutsche Investitions- und Förderberatung GmbH\nGesellschaft mit beschränkter Haftung\nDüsseldorf\n\nDen Gläubigern der an der formwechselnden Umwandlung beteiligten Rechtsträger ist, wenn sie binnen sechs Monaten nach dem Tag, an dem die Eintragung der formwechselnden Umwandlung in das Register des Sitzes desjenigen Rechtsträgers, dessen Gläubiger sie sind, nach § 19 Absatz 3 UmwG als bekanntgemacht gilt, ihren Anspruch nach Grund und Höhe schriftlich anmelden, Sicherheit zu leisten, soweit sie nicht Befriedigung verlangen können. Dieses Recht steht den Gläubigern jedoch nur zu, wenn sie glaubhaft machen, dass durch die formwechselnden Umwandlung die Erfüllung ihrer Forderung gefährdet wird."
    },
    {
      "date": "2025-04-23",
      "id": "107195",
      "original_text": "Löschungsankündigung\nNordrhein-Westfalen Amtsgericht Hamm HRB 9922\nWir sind Hammer-Reifen UG (haftungsbeschränkt) – Unna",
      "type": "Löschungsankündigung",
      "state": "Nordrhein-Westfalen",
      "amtsgericht": "Amtsgericht Hamm",
      "registernummer": "HRB 9922",
      "registerart": "HRB",
      "company_name": "Wir sind Hammer-Reifen UG (haftungsbeschränkt)",
      "company_seat": "Unna",
      "details": "23.04.2025 (Bekanntmachungsdatum)\n\nNordrhein-Westfalen Amtsgericht Hamm HRB 9922\nLöschungsankündigung\n\nWir sind Hammer-Reifen UG (haftungsbeschränkt)\nGesellschaft mit beschränkter Haftung\nUnna\n\nDas Registergericht beabsichtigt die Gesellschaft von Amts wegen nach § 394 FamFG zu löschen. Die Frist zur Erhebung eines Widerspruchs ist auf drei Monate festgesetzt."
    },
    {
      "date": "2025-04-23",
      "id": "107196",
      "original_text": "Registerbekanntmachung nach dem Umwandlungsgesetz\nNordrhein-Westfalen Amtsgericht Gütersloh HRB 5041\nDataciders cth GmbH – Halle (Westf.)",
      "type": "Registerbekanntmachung nach dem Umwandlungsgesetz",
      "state": "Nordrhein-Westfalen",
      "amtsgericht": "Amtsgericht Gütersloh",
      "registernummer": "HRB 5041",
      "registerart": "HRB",
      "company_name": "Dataciders cth GmbH",
      "company_seat": "Halle (Westf.)",
      "details": "23.04.2025 (Bekanntmachungsdatum)\n\nNordrhein-Westfalen Amtsgericht Gütersloh HRB 5041\nRegisterbekanntmachung nach dem Umwandlungsgesetz 23.04.2025 (Eintragungsdatum)\n\nDataciders cth GmbH\nGesellschaft mit beschränkter Haftung\nHalle (Westf.)\n\nDen Gläubigern der an der Verschmelzung beteiligten Rechtsträger ist, wenn sie binnen sechs Monaten nach dem Tag, an dem die Eintragung der Verschmelzung in das Register des Sitzes desjenigen Rechtsträgers, dessen Gläubiger sie sind, nach § 19 Absatz 3 UmwG als bekanntgemacht gilt, ihren Anspruch nach Grund und Höhe schriftlich anmelden, Sicherheit zu leisten, soweit sie nicht Befriedigung verlangen können. Dieses Recht steht den Gläubigern jedoch nur zu, wenn sie glaubhaft machen, dass durch die Verschmelzung die Erfüllung ihrer Forderung gefährdet wird."
    },
    {
      "date": "2025-04-23",
      "id": "107197",
      "original_text": "Einreichung neuer Dokumente\nNordrhein-Westfalen Amtsgericht Dortmund HRB 15940\nAmprion GmbH – Dortmund",
      "type": "Einreichung neuer Dokumente",
      "state": "Nordrhein-Westfalen",
      "amtsgericht": "Amtsgericht Dortmund",
      "registernummer": "HRB 15940",
      "registerart": "HRB",
      "company_name": "Amprion GmbH",
      "company_seat": "Dortmund",
      "details": "23.04.2025 (Bekanntmachungsdatum)\n\nNordrhein-Westfalen Amtsgericht Dortmund HRB 15940\nEinreichung neuer Dokumente\n\nAmprion GmbH\nGesellschaft mit beschränkter Haftung\nDortmund\n\nDem Registergericht ist eine neue Liste der Mitglieder des Aufsichtsrates eingereicht worden."
    },
    {
      "date": "2025-04-23",
      "id": "107198",
      "original_text": "Löschungsankündigung\nNordrhein-Westfalen Amtsgericht Gelsenkirchen VR 20357 früher Amtsgericht Gelsenkirchen-Buer (Gelsenkirchen)\nBurhofschützen Scholven 1826 e.V. – Gelsenkirchen",
      "type": "Löschungsankündigung",
      "state": "Nordrhein-Westfalen",
      "amtsgericht": "Amtsgericht Gelsenkirchen",
      "registernummer": "VR 20357",
      "registerart": "VR",
      "company_name": "Burhofschützen Scholven 1826 e.V.",
      "company_seat": "Gelsenkirchen",
      "former_amtsgericht": "Gelsenkirchen-Buer (Gelsenkirchen)",
      "details": "23.04.2025 (Bekanntmachungsdatum)\n\nNordrhein-Westfalen Amtsgericht Gelsenkirchen VR 20357 früher Amtsgericht Gelsenkirchen-Buer (Gelsenkirchen)\nLöschungsankündigung\n\nBurhofschützen Scholven 1826 e.V.\neingetragener Verein\nGelsenkirchen\n\nDas Registergericht beabsichtigt, den im Vereinsregister eingetragenen Verein gemäß § 394 FamFG von Amts wegen zu löschen.\n\nGegen diese Verfügung kann Widerspruch eingelegt werden. Die Frist zur Erhebung eines Widerspruchs gegen die beabsichtigte Löschung von Amts wegen ist auf einen Monat festgesetzt.\n\nRechtsbehelfsbelehrung:\n\nGegen diese Verfügung können Sie Widerspruch einlegen.\n\nDer Widerspruch ist bei dem Amtsgericht Gelsenkirchen, Bochumer Straße 79, 45886 Gelsenkirchen schriftlich in deutscher Sprache oder zur Niederschrift der Geschäftsstelle einzulegen. Der Widerspruch kann auch zur Niederschrift der Geschäftsstelle eines jeden Amtsgerichtes abgegeben werden.\nDie Einlegung ist auch durch Übertragung eines elektronischen Dokuments an die elektronische Poststelle des Gerichts möglich. Das elektronische Dokument muss für die Bearbeitung durch das Gericht geeignet und mit einer qualifizierten elektronischen Signatur der verantwortenden Person versehen sein oder von der verantwortenden Person signiert und auf einem sicheren Übermittlungsweg gemäß § 130a ZPO nach näherer Maßgabe der Verordnung über die technischen Rahmenbedingungen des elektronischen Rechtsverkehrs und über das besondere elektronische Behördenpostfach (BGBl. I, S.3803) eingereicht werden. Weitere Informationen erhalten Sie auf der Internetseite www.justiz.de.\n\nDer Widerspruch muss spätestens innerhalb der gesetzten Frist bei dem Amtsgericht Gelsenkirchen eingegangen sein. Dies gilt auch dann, wenn der Widerspruch zur Niederschrift der Geschäftsstelle eines anderen Amtsgerichtes abgegeben wurde. Die Frist beginnt mit der Veröffentlichung. Fällt das Ende der Frist auf einen Sonntag, einen allgemeinen Feiertag oder Sonnabend, so endet die Frist mit Ablauf des nächsten Werktages.\n\nDer Widerspruch muss die Bezeichnung der angefochtenen Verfügung sowie die Erklärung enthalten, dass Widerspruch gegen diese Verfügung eingelegt wird. Er ist zu unterzeichnen und soll begründet werden."
    },
    {
      "date": "2025-04-23",
      "id": "107199",
      "original_text": "Sonstige Registerbekanntmachung\nNordrhein-Westfalen Amtsgericht Lemgo HRB 3525\nStadtwerke Lage GmbH – Lage",
      "type": "Sonstige Registerbekanntmachung",
      "state": "Nordrhein-Westfalen",
      "amtsgericht": "Amtsgericht Lemgo",
      "registernummer": "HRB 3525",
      "registerart": "HRB",
      "company_name": "Stadtwerke Lage GmbH",
      "company_seat": "Lage",
      "details": "23.04.2025 (Bekanntmachungsdatum)\n\nNordrhein-Westfalen Amtsgericht Lemgo HRB 3525\nSonstige Registerbekanntmachung\n\nStadtwerke Lage GmbH\nGesellschaft mit beschränkter Haftung\nLage\n\nDem Registergericht ist eine Liste der Mitglieder des Aufsichtsrates eingereicht worden."
    },
    {
      "date": "2025-04-23",
      "id": "107200",
      "original_text": "Registerbekanntmachung nach dem Umwandlungsgesetz\nNordrhein-Westfalen Amtsgericht Düsseldorf HRB 25274\nSEGRO Germany GmbH – Düsseldorf",
      "type": "Registerbekanntmachung nach dem Umwandlungsgesetz",
      "state": "Nordrhein-Westfalen",
      "amtsgericht": "Amtsgericht Düsseldorf",
      "registernummer": "HRB 25274",
      "registerart": "HRB",
      "company_name": "SEGRO Germany GmbH",
      "company_seat": "Düsseldorf",
      "details": "23.04.2025 (Bekanntmachungsdatum)\n\nNordrhein-Westfalen Amtsgericht Düsseldorf HRB 25274\nRegisterbekanntmachung nach dem Umwandlungsgesetz 23.04.2025 (Eintragungsdatum)\n\nSEGRO Germany GmbH\nGesellschaft mit beschränkter Haftung\nDüsseldorf\n\nDen Gläubigern der an der Verschmelzung beteiligten Rechtsträger ist, wenn sie binnen sechs Monaten nach dem Tag, an dem die Eintragung der Verschmelzung in das Register des Sitzes derjenigen Rechtsträger deren Gläubiger sie sind, nach § 19 Absatz 3 UmwG als bekanntgemacht gilt, ihren Anspruch nach Grund und Höhe schriftlich anmelden, Sicherheit zu leisten, soweit sie nicht Befriedigung verlangen können. Dieses Recht steht den Gläubigern jedoch nur zu, wenn sie glaubhaft machen, dass durch die Verschmelzung die Erfüllung ihrer Forderung gefährdet wird."
    },
    {
      "date": "2025-04-23",
      "id": "107201",
      "original_text": "Registerbekanntmachung nach dem Umwandlungsgesetz\nBaden-Württemberg Amtsgericht Freiburg HRB 733067\nSpitzmüller Vermögensverwaltung GmbH – Freiburg im Breisgau",
      "type": "Registerbekanntmachung nach dem Umwandlungsgesetz",
      "state": "Baden-Württemberg",
      "amtsgericht": "Amtsgericht Freiburg",
      "registernummer": "HRB 733067",
      "registerart": "HRB",
      "company_name": "Spitzmüller Vermögensverwaltung GmbH",
      "company_seat": "Freiburg im Breisgau",
      "details": "23.04.2025 (Bekanntmachungsdatum)\n\nBaden-Württemberg Amtsgericht Freiburg HRB 733067\nRegisterbekanntmachung nach dem Umwandlungsgesetz 23.04.2025 (Eintragungsdatum)\n\nSpitzmüller Vermögensverwaltung GmbH\nGesellschaft mit beschränkter Haftung\nFreiburg im Breisgau\n\nAls nicht eingetragen wird bekanntgemacht:\nDen Gläubigern des an dem Formwechsel beteiligten Rechtsträgers ist, wenn sie binnen sechs Monaten nach dem Tag, an dem die Eintragung des Formwechsels in das Register des Sitzes desjenigen Rechtsträgers, dessen Gläubiger sie sind, nach § 19 Abs. 3 UmwG als bekanntgemacht gilt, ihren Anspruch nach Grund und Höhe schriftlich anmelden, Sicherheit zu leisten, soweit sie nicht Befriedigung verlangen können. Dieses Recht steht den Gläubigern jedoch nur zu, wenn sie glaubhaft machen, dass durch den Formwechsel die Erfüllung ihrer Forderung gefährdet wird."
    },
    {
      "date": "2025-04-23",
      "id": "107202",
      "original_text": "Einreichung neuer Dokumente\nThüringen Amtsgericht Jena HRB 401130\nStädtische Wohnungsbaugesellschaft mbH Nordhausen – Nordhausen",
      "type": "Einreichung neuer Dokumente",
      "state": "Thüringen",
      "amtsgericht": "Amtsgericht Jena",
      "registernummer": "HRB 401130",
      "registerart": "HRB",
      "company_name": "Städtische Wohnungsbaugesellschaft mbH Nordhausen",
      "company_seat": "Nordhausen",
      "details": "23.04.2025 (Bekanntmachungsdatum)\n\nThüringen Amtsgericht Jena HRB 401130\nEinreichung neuer Dokumente\n\nStädtische Wohnungsbaugesellschaft mbH Nordhausen\nGesellschaft mit beschränkter Haftung\nNordhausen\n\nBekanntmachung gem. § 52 Abs. 3 Satz 2 GmbHG: Aufgrund Veränderungen in den Personen der Aufsichtsratsmitglieder sind durch die Geschäftsführerin neue Listen zum Handelsregister eingereicht worden."
    },
    {
      "date": "2025-04-23",
      "id": "107203",
      "original_text": "Löschungsankündigung\nThüringen Amtsgericht Jena HRB 517666\nImpulswerkstatt UG (haftungsbeschränkt) – Südeichsfeld",
      "type": "Löschungsankündigung",
      "state": "Thüringen",
      "amtsgericht": "Amtsgericht Jena",
      "registernummer": "HRB 517666",
      "registerart": "HRB",
      "company_name": "Impulswerkstatt UG (haftungsbeschränkt)",
      "company_seat": "Südeichsfeld",
      "details": "23.04.2025 (Bekanntmachungsdatum)\n\nThüringen Amtsgericht Jena HRB 517666\nLöschungsankündigung\n\nImpulswerkstatt UG (haftungsbeschränkt)\nGesellschaft mit beschränkter Haftung\nSüdeichsfeld\n\nDas Registergericht beabsichtigt, die im Handelsregister eingetragene Gesellschaft wegen Vermögenslosigkeit nach § 394 FamFG von Amts wegen zu löschen. Die Frist zur Erhebung eines Widerspruchs gegen die beabsichtigte Löschung wird auf 6 Wochen festgesetzt."
    },
    {
      "date": "2025-04-23",
      "id": "107204",
      "original_text": "Einreichung neuer Dokumente\nHessen Amtsgericht Wiesbaden HRB 22028\nR+V PENSIONSKASSE AKTIENGESELLSCHAFT – Wiesbaden",
      "type": "Einreichung neuer Dokumente",
      "state": "Hessen",
      "amtsgericht": "Amtsgericht Wiesbaden",
      "registernummer": "HRB 22028",
      "registerart": "HRB",
      "company_name": "R+V PENSIONSKASSE AKTIENGESELLSCHAFT",
      "company_seat": "Wiesbaden",
      "details": "23.04.2025 (Bekanntmachungsdatum)\n\nHessen Amtsgericht Wiesbaden HRB 22028\nEinreichung neuer Dokumente 23.04.2025 (Eintragungsdatum)\n\nR+V PENSIONSKASSE AKTIENGESELLSCHAFT\nAktiengesellschaft\nWiesbaden\n\nDurch eine Änderung in den Personen der Aufsichtsratsmitglieder ist eine Liste der Mitglieder des Aufsichtsrates zum Handelsregister eingereicht worden."
    },
    {
      "date": "2025-04-23",
      "id": "107205",
      "original_text": "Registerbekanntmachung nach dem Umwandlungsgesetz\nHessen Amtsgericht Frankfurt am Main HRB 28163\nNestlé Deutschland Aktiengesellschaft – Frankfurt am Main",
      "type": "Registerbekanntmachung nach dem Umwandlungsgesetz",
      "state": "Hessen",
      "amtsgericht": "Amtsgericht Frankfurt am Main",
      "registernummer": "HRB 28163",
      "registerart": "HRB",
      "company_name": "Nestlé Deutschland Aktiengesellschaft",
      "company_seat": "Frankfurt am Main",
      "details": "23.04.2025 (Bekanntmachungsdatum)\n\nHessen Amtsgericht Frankfurt am Main HRB 28163\nRegisterbekanntmachung nach dem Umwandlungsgesetz\n\nNestlé Deutschland Aktiengesellschaft\nAktiengesellschaft\nFrankfurt am Main\n\nDie Gesellschaft hat den Entwurf des Verschmelzungsvertrages zwischen ihr und der Terra Canis Grundstücksverwaltungs GmbH, Petershausen (Amtsgericht München HRB 198465) beim Amtsgericht München (Registergericht) zur Einsichtnahme eingereicht."
    },
    {
      "date": "2025-04-23",
      "id": "107206",
      "original_text": "Löschungsankündigung\nHessen Amtsgericht Frankfurt am Main HRB 81273\nHammer & Associates Management GmbH – Frankfurt am Main",
      "type": "Löschungsankündigung",
      "state": "Hessen",
      "amtsgericht": "Amtsgericht Frankfurt am Main",
      "registernummer": "HRB 81273",
      "registerart": "HRB",
      "company_name": "Hammer & Associates Management GmbH",
      "company_seat": "Frankfurt am Main",
      "details": "23.04.2025 (Bekanntmachungsdatum)\n\nHessen Amtsgericht Frankfurt am Main HRB 81273\nLöschungsankündigung\n\nHammer & Associates Management GmbH\nGesellschaft mit beschränkter Haftung\nFrankfurt am Main\n\nEs ist beabsichtig, die Gesellschaft wegen Vermögenslosigkeit gemäß § 394 FamFG von Amts wegen im Handelsregister zu löschen. Hiergegen kann innerhalb eines Zeitraums von 1 Monat nach dieser Veröffentlichung Widerspruch bei dem Amtsgericht Frankfurt am Main eingelegt werden."
    },
    {
      "date": "2025-04-23",
      "id": "107207",
      "original_text": "Registerbekanntmachung nach dem Umwandlungsgesetz\nHessen Amtsgericht Korbach HRA 1916\nJubilist e.K. – Korbach",
      "type": "Registerbekanntmachung nach dem Umwandlungsgesetz",
      "state": "Hessen",
      "amtsgericht": "Amtsgericht Korbach",
      "registernummer": "HRA 1916",
      "registerart": "HRA",
      "company_name": "Jubilist e.K.",
      "company_seat": "Korbach",
      "details": "23.04.2025 (Bekanntmachungsdatum)\n\nHessen Amtsgericht Korbach HRA 1916\nRegisterbekanntmachung nach dem Umwandlungsgesetz 23.04.2025 (Eintragungsdatum)\n\nJubilist e.K.\nEinzelkaufmann / Einzelkauffrau\nKorbach\n\nDen Gläubigern der an der Verschmelzung beteiligten Rechtsträger ist, wenn sie binnen sechs Monaten nach dem Tag, an dem die Eintragung der Verschmelzung in das Register des Sitzes derjenigen Rechtsträger deren Gläubiger sie sind, nach § 19 Absatz 3 UmwG bekannt gemacht worden ist, ihren Anspruch nach Grund und Höhe schriftlich anmelden, Sicherheit zu leisten, soweit sie nicht Befriedigung verlangen können. Dieses Recht steht den Gläubigern jedoch nur zu, wenn sie glaubhaft machen, dass durch die Verschmelzung die Erfüllung ihrer Forderung gefährdet wird."
    },
    {
      "date": "2025-04-23",
      "id": "107208",
      "original_text": "Löschungsankündigung\nHessen Amtsgericht Wiesbaden HRB 25921\nRTF Bau UG (haftungsbeschränkt) – Wiesbaden",
      "type": "Löschungsankündigung",
      "state": "Hessen",
      "amtsgericht": "Amtsgericht Wiesbaden",
      "registernummer": "HRB 25921",
      "registerart": "HRB",
      "company_name": "RTF Bau UG (haftungsbeschränkt)",
      "company_seat": "Wiesbaden",
      "details": "23.04.2025 (Bekanntmachungsdatum)\n\nHessen Amtsgericht Wiesbaden HRB 25921\nLöschungsankündigung\n\nRTF Bau UG (haftungsbeschränkt)\nGesellschaft mit beschränkter Haftung\nWiesbaden\n\nDas Registergericht beabsichtigt die im Handelsregister eingetragene Gesellschaft von Amts wegen nach § 394 FamFG zu löschen. Die Frist zur Erhebung eines Widerspruchs gegen die beabsichtigte Löschung wird auf 3 Monate festgesetzt."
    },
    {
      "date": "2025-04-23",
      "id": "107209",
      "original_text": "Löschungsankündigung\nHessen Amtsgericht Bad Homburg v.d.H. HRB 12308\nTuV Treuhand und Verwaltung GmbH – Bad Homburg v. d. Höhe",
      "type": "Löschungsankündigung",
      "state": "Hessen",
      "amtsgericht": "Amtsgericht Bad Homburg v.d.H.",
      "registernummer": "HRB 12308",
      "registerart": "HRB",
      "company_name": "TuV Treuhand und Verwaltung GmbH",
      "company_seat": "Bad Homburg v. d. Höhe",
      "details": "23.04.2025 (Bekanntmachungsdatum)\n\nHessen Amtsgericht Bad Homburg v.d.H. HRB 12308\nLöschungsankündigung 23.04.2025 (Eintragungsdatum)\n\nTuV Treuhand und Verwaltung GmbH\nGesellschaft mit beschränkter Haftung\nBad Homburg v. d. Höhe\n\nDas Registergericht beabsichtigt die im Handelsregister eingetragene Gesellschaft von Amts wegen nach § 394 FamFG zu löschen. Die Frist zur Erhebung eines Widerspruchs gegen die beabsichtigte Löschung wird auf 3 Monate festgesetzt."
    },
    {
      "date": "2025-04-23",
      "id": "107210",
      "original_text": "Registerbekanntmachung nach dem Umwandlungsgesetz\nHessen Amtsgericht Wiesbaden HRB 35766\nSQMatic GmbH – Wiesbaden",
      "type": "Registerbekanntmachung nach dem Umwandlungsgesetz",
      "state": "Hessen",
      "amtsgericht": "Amtsgericht Wiesbaden",
      "registernummer": "HRB 35766",
      "registerart": "HRB",
      "company_name": "SQMatic GmbH",
      "company_seat": "Wiesbaden",
      "details": "23.04.2025 (Bekanntmachungsdatum)\n\nHessen Amtsgericht Wiesbaden HRB 35766\nRegisterbekanntmachung nach dem Umwandlungsgesetz 23.04.2025 (Eintragungsdatum)\n\nSQMatic GmbH\nGesellschaft mit beschränkter Haftung\nWiesbaden\n\nDen Gläubigern der an der Ausgliederung beteiligten Rechtsträger ist, wenn sie binnen sechs Monaten nach dem Tag, an dem die Eintragung der Ausgliederung in das Register des Sitzes desjenigen Rechtsträgers, dessen Gläubiger sie sind, nach §§ 125, 19 Absatz 3 UmwG bekannt gemacht worden ist, ihren Anspruch nach Grund und Höhe schriftlich anmelden, Sicherheit zu leisten, soweit sie nicht Befriedigung verlangen können. Dieses Recht steht den Gläubigern jedoch nur zu, wenn sie glaubhaft machen, dass durch die Ausgliederung die Erfüllung ihrer Forderung gefährdet wird."
    },
    {
      "date": "2025-04-23",
      "id": "107211",
      "original_text": "Registerbekanntmachung nach dem Umwandlungsgesetz\nHessen Amtsgericht Korbach HRB 2264\nSchmidts Teks GmbH – Korbach",
      "type": "Registerbekanntmachung nach dem Umwandlungsgesetz",
      "state": "Hessen",
      "amtsgericht": "Amtsgericht Korbach",
      "registernummer": "HRB 2264",
      "registerart": "HRB",
      "company_name": "Schmidts Teks GmbH",
      "company_seat": "Korbach",
      "details": "23.04.2025 (Bekanntmachungsdatum)\n\nHessen Amtsgericht Korbach HRB 2264\nRegisterbekanntmachung nach dem Umwandlungsgesetz 23.04.2025 (Eintragungsdatum)\n\nSchmidts Teks GmbH\nGesellschaft mit beschränkter Haftung\nKorbach\n\nDen Gläubigern der an der Verschmelzung beteiligten Rechtsträger ist, wenn sie binnen sechs Monaten nach dem Tag, an dem die Eintragung der Verschmelzung in das Register des Sitzes derjenigen Rechtsträger deren Gläubiger sie sind, nach § 19 Absatz 3 UmwG bekannt gemacht worden ist, ihren Anspruch nach Grund und Höhe schriftlich anmelden, Sicherheit zu leisten, soweit sie nicht Befriedigung verlangen können. Dieses Recht steht den Gläubigern jedoch nur zu, wenn sie glaubhaft machen, dass durch die Verschmelzung die Erfüllung ihrer Forderung gefährdet wird."
    },
    {
      "date": "2025-04-23",
      "id": "107212",
      "original_text": "Sonstige Registerbekanntmachung\nHessen Amtsgericht Darmstadt HRB 4915\nTÜV Technische Überwachung Hessen GmbH – Darmstadt",
      "type": "Sonstige Registerbekanntmachung",
      "state": "Hessen",
      "amtsgericht": "Amtsgericht Darmstadt",
      "registernummer": "HRB 4915",
      "registerart": "HRB",
      "company_name": "TÜV Technische Überwachung Hessen GmbH",
      "company_seat": "Darmstadt",
      "details": "23.04.2025 (Bekanntmachungsdatum)\n\nHessen Amtsgericht Darmstadt HRB 4915\nSonstige Registerbekanntmachung 27.03.2025 (Eintragungsdatum)\n\nTÜV Technische Überwachung Hessen GmbH\nGesellschaft mit beschränkter Haftung\nDarmstadt\n\nDurch eine Änderung in den Personen der Aufsichtsratsmitglieder ist eine Liste der Mitglieder des Aufsichtsrates zum Handelsregister eingereicht worden."
    },
    {
      "date": "2025-04-23",
      "id": "107213",
      "original_text": "Registerbekanntmachung nach dem Umwandlungsgesetz\nHessen Amtsgericht Frankfurt am Main HRB 112041\nMizuho Securities Europe GmbH – Frankfurt am Main",
      "type": "Registerbekanntmachung nach dem Umwandlungsgesetz",
      "state": "Hessen",
      "amtsgericht": "Amtsgericht Frankfurt am Main",
      "registernummer": "HRB 112041",
      "registerart": "HRB",
      "company_name": "Mizuho Securities Europe GmbH",
      "company_seat": "Frankfurt am Main",
      "details": "23.04.2025 (Bekanntmachungsdatum)\n\nHessen Amtsgericht Frankfurt am Main HRB 112041\nRegisterbekanntmachung nach dem Umwandlungsgesetz 23.04.2025 (Eintragungsdatum)\n\nMizuho Securities Europe GmbH\nGesellschaft mit beschränkter Haftung\nFrankfurt am Main\n\nDen Gläubigern der an der grenzüberschreitenden Verschmelzung beteiligten übernehmenden Rechtsträger ist, wenn sie binnen sechs Monaten nach dem Tag, an dem die Eintragung der Verschmelzung in das Register des Sitzes desjenigen Rechtsträgers, dessen Gläubiger sie sind, nach § 19 Absatz 3 UmwG als bekanntgemacht gilt, ihren Anspruch nach Grund und Höhe schriftlich anmelden, Sicherheit zu leisten, soweit sie nicht Befriedigung verlangen können.\n\nDieses Recht steht den Gläubigern jedoch nur zu, wenn sie glaubhaft machen, dass durch die Verschmelzung die Erfüllung ihrer Forderung gefährdet wird."
    },
    {
      "date": "2025-04-23",
      "id": "107214",
      "original_text": "Registerbekanntmachung nach dem Umwandlungsgesetz\nHessen Amtsgericht Bad Homburg v.d.H. HRA 5331\nPrilep GmbH & Co. KG – Bad Homburg v. d. Höhe",
      "type": "Registerbekanntmachung nach dem Umwandlungsgesetz",
      "state": "Hessen",
      "amtsgericht": "Amtsgericht Bad Homburg v.d.H.",
      "registernummer": "HRA 5331",
      "registerart": "HRA",
      "company_name": "Prilep GmbH & Co. KG",
      "company_seat": "Bad Homburg v. d. Höhe",
      "details": "23.04.2025 (Bekanntmachungsdatum)\n\nHessen Amtsgericht Bad Homburg v.d.H. HRA 5331\nRegisterbekanntmachung nach dem Umwandlungsgesetz 23.04.2025 (Eintragungsdatum)\n\nPrilep GmbH & Co. KG\nKommanditgesellschaft\nBad Homburg v. d. Höhe\n\nDen Gläubigern der an der Verschmelzung beteiligten Rechtsträger ist, wenn sie binnen sechs Monaten nach dem Tag, an dem die Eintragung der Verschmelzung in das Register des Sitzes desjenigen Rechtsträgers, dessen Gläubiger sie sind, nach § 19 Absatz 3 UmwG bekannt gemacht worden ist, ihren Anspruch nach Grund und Höhe schriftlich anmelden, Sicherheit zu leisten, soweit sie nicht Befriedigung verlangen können. Dieses Recht steht den Gläubigern jedoch nur zu, wenn sie glaubhaft machen, dass durch die Verschmelzung die Erfüllung ihrer Forderung gefährdet wird."
    },
    {
      "date": "2025-04-23",
      "id": "107215",
      "original_text": "Sonstige Registerbekanntmachung\nHessen Amtsgericht Kassel VR 5334\nTapriza Deutschland e.V. – Kassel",
      "type": "Sonstige Registerbekanntmachung",
      "state": "Hessen",
      "amtsgericht": "Amtsgericht Kassel",
      "registernummer": "VR 5334",
      "registerart": "VR",
      "company_name": "Tapriza Deutschland e.V.",
      "company_seat": "Kassel",
      "details": "23.04.2025 (Bekanntmachungsdatum)\n\nHessen Amtsgericht Kassel VR 5334\nSonstige Registerbekanntmachung 16.04.2025 (Eintragungsdatum)\n\nTapriza Deutschland e.V.\neingetragener Verein\nKassel\n\nDer Verein ist aufgelöst."
    },
    {
      "date": "2025-04-23",
      "id": "107216",
      "original_text": "Registerbekanntmachung nach dem Umwandlungsgesetz\nHessen Amtsgericht Frankfurt am Main HRB 125702\nSechsundzwanzigste K.G.R. Real Estate GmbH – Frankfurt am Main",
      "type": "Registerbekanntmachung nach dem Umwandlungsgesetz",
      "state": "Hessen",
      "amtsgericht": "Amtsgericht Frankfurt am Main",
      "registernummer": "HRB 125702",
      "registerart": "HRB",
      "company_name": "Sechsundzwanzigste K.G.R. Real Estate GmbH",
      "company_seat": "Frankfurt am Main",
      "details": "23.04.2025 (Bekanntmachungsdatum)\n\nHessen Amtsgericht Frankfurt am Main HRB 125702\nRegisterbekanntmachung nach dem Umwandlungsgesetz 23.04.2025 (Eintragungsdatum)\n\nSechsundzwanzigste K.G.R. Real Estate GmbH\nGesellschaft mit beschränkter Haftung\nFrankfurt am Main\n\nDen Gläubigern der an der Verschmelzung beteiligten Rechtsträger ist, wenn sie binnen sechs Monaten nach dem Tag, an dem die Eintragung der Verschmelzung in das Register des Sitzes desjenigen Rechtsträgers, dessen Gläubiger sie sind, nach § 19 Absatz 3 UmwG bekannt gemacht worden ist, ihren Anspruch nach Grund und Höhe schriftlich anmelden, Sicherheit zu leisten, soweit sie nicht Befriedigung verlangen können. Dieses Recht steht den Gläubigern jedoch nur zu, wenn sie glaubhaft machen, dass durch die Verschmelzung die Erfüllung ihrer Forderung gefährdet wird."
    },
    {
      "date": "2025-04-23",
      "id": "107217",
      "original_text": "Registerbekanntmachung nach dem Umwandlungsgesetz\nHessen Amtsgericht Frankfurt am Main HRB 112041\nMizuho Securities Europe GmbH – Frankfurt am Main",
      "type": "Registerbekanntmachung nach dem Umwandlungsgesetz",
      "state": "Hessen",
      "amtsgericht": "Amtsgericht Frankfurt am Main",
      "registernummer": "HRB 112041",
      "registerart": "HRB",
      "company_name": "Mizuho Securities Europe GmbH",
      "company_seat": "Frankfurt am Main",
      "details": "23.04.2025 (Bekanntmachungsdatum)\n\nHessen Amtsgericht Frankfurt am Main HRB 112041\nRegisterbekanntmachung nach dem Umwandlungsgesetz 24.02.2025 (Eintragungsdatum)\n\nMizuho Securities Europe GmbH\nGesellschaft mit beschränkter Haftung\nFrankfurt am Main\n\nDen Gläubigern der an der grenzüberschreitenden Verschmelzung beteiligten übernehmenden Rechtsträger ist, wenn sie binnen sechs Monaten nach dem Tag, an dem die Eintragung der Verschmelzung in das Register des Sitzes desjenigen Rechtsträgers, dessen Gläubiger sie sind, nach § 19 Absatz 3 UmwG als bekanntgemacht gilt, ihren Anspruch nach Grund und Höhe schriftlich anmelden, Sicherheit zu leisten, soweit sie nicht Befriedigung verlangen können.\n\nDieses Recht steht den Gläubigern jedoch nur zu, wenn sie glaubhaft machen, dass durch die Verschmelzung die Erfüllung ihrer Forderung gefährdet wird."
    },
    {
      "date": "2025-04-23",
      "id": "107218",
      "original_text": "Registerbekanntmachung nach dem Umwandlungsgesetz\nHessen Amtsgericht Frankfurt am Main HRB 52467\nSüwag Energie AG – Frankfurt am Main",
      "type": "Registerbekanntmachung nach dem Umwandlungsgesetz",
      "state": "Hessen",
      "amtsgericht": "Amtsgericht Frankfurt am Main",
      "registernummer": "HRB 52467",
      "registerart": "HRB",
      "company_name": "Süwag Energie AG",
      "company_seat": "Frankfurt am Main",
      "details": "23.04.2025 (Bekanntmachungsdatum)\n\nHessen Amtsgericht Frankfurt am Main HRB 52467\nRegisterbekanntmachung nach dem Umwandlungsgesetz\n\nSüwag Energie AG\nAktiengesellschaft\nFrankfurt am Main\n\nDie Gesellschaft hat den Entwurf des Ausgliederungs- und Übernahmevertrages zwischen ihr und der Süwag Grüne Energien und Wasser AG & Co. KG, Frankfurt am Main (Amtsgericht Frankfurt am Main HRA 50866) beim Amtsgericht Frankfurt am Main (Registergericht) zur Einsichtnahme eingereicht."
    },
    {
      "date": "2025-04-23",
      "id": "107219",
      "original_text": "Löschungsankündigung\nHessen Amtsgericht Darmstadt HRB 94718\nHAYZIL ING BAU GmbH – Erzhausen",
      "type": "Löschungsankündigung",
      "state": "Hessen",
      "amtsgericht": "Amtsgericht Darmstadt",
      "registernummer": "HRB 94718",
      "registerart": "HRB",
      "company_name": "HAYZIL ING BAU GmbH",
      "company_seat": "Erzhausen",
      "details": "23.04.2025 (Bekanntmachungsdatum)\n\nHessen Amtsgericht Darmstadt HRB 94718\nLöschungsankündigung\n\nHAYZIL ING BAU GmbH\nGesellschaft mit beschränkter Haftung\nErzhausen\n\nDas Registergericht beabsichtigt die im Handelsregister eingetragene Gesellschaft von Amts wegen nach § 394 FamFG zu löschen. Die Frist zur Erhebung eines Widerspruchs gegen die beabsichtigte Löschung wird auf 3 Monate festgesetzt."
    },
    {
      "date": "2025-04-23",
      "id": "107220",
      "original_text": "Einreichung neuer Dokumente\nHessen Amtsgericht Frankfurt am Main HRB 38158\nATLAS Dienstleistungen für Vermögensberatung GmbH – Frankfurt am Main",
      "type": "Einreichung neuer Dokumente",
      "state": "Hessen",
      "amtsgericht": "Amtsgericht Frankfurt am Main",
      "registernummer": "HRB 38158",
      "registerart": "HRB",
      "company_name": "ATLAS Dienstleistungen für Vermögensberatung GmbH",
      "company_seat": "Frankfurt am Main",
      "details": "23.04.2025 (Bekanntmachungsdatum)\n\nHessen Amtsgericht Frankfurt am Main HRB 38158\nEinreichung neuer Dokumente 23.04.2025 (Eintragungsdatum)\n\nATLAS Dienstleistungen für Vermögensberatung GmbH\nGesellschaft mit beschränkter Haftung\nFrankfurt am Main\n\nDurch eine Änderung in den Personen der Aufsichtsratsmitglieder ist eine Liste der Mitglieder des Aufsichtsrates zum Handelsregister eingereicht worden."
    }
  ]
}