{
  "date": "2025-04-05",
  "date_of_scrape": "2025-05-30T11:00:21.224Z",
  "tool_version": "0.2.0",
  "number_of_announcements": 20,
  "announcements": [
    {
      "date": "2025-04-05",
      "id": "105759",
      "original_text": "Löschungsankündigung\nBayern Amtsgericht Regensburg HRA 9658\nGarten Green UG (haftungsbeschränkt) & Co. KG – Cham",
      "type": "Löschungsankündigung",
      "state": "Bayern",
      "amtsgericht": "Amtsgericht Regensburg",
      "registernummer": "HRA 9658",
      "registerart": "HRA",
      "company_name": "Garten Green UG (haftungsbeschränkt) & Co. KG",
      "company_seat": "Cham",
      "details": "05.04.2025 (Bekanntmachungsdatum)\n\nBayern Amtsgericht Regensburg HRA 9658\nLöschungsankündigung\n\nGarten Green UG (haftungsbeschränkt) & Co. KG\nKommanditgesellschaft\nCham\n\nDas Registergericht beabsichtigt, die im Handelsregister eingetragene Firma wegen Vermögenslosigkeit von Amts wegen nach § 394 FamFG zu löschen. Die Frist zur Erhebung eines Widerspruchs ist auf einen Monat festgesetzt."
    },
    {
      "date": "2025-04-05",
      "id": "105760",
      "original_text": "Sonstige Registerbekanntmachung\nBayern Amtsgericht München HRB 125619\nLady Skin Vertriebs GmbH – München",
      "type": "Sonstige Registerbekanntmachung",
      "state": "Bayern",
      "amtsgericht": "Amtsgericht München",
      "registernummer": "HRB 125619",
      "registerart": "HRB",
      "company_name": "Lady Skin Vertriebs GmbH",
      "company_seat": "München",
      "details": "05.04.2025 (Bekanntmachungsdatum)\n\nBayern Amtsgericht München HRB 125619\nSonstige Registerbekanntmachung 04.04.2025 (Eintragungsdatum)\n\nLady Skin Vertriebs GmbH\nGesellschaft mit beschränkter Haftung\nMünchen\n\nDen Gläubigern der Gesellschaft, deren Forderungen begründet worden sind, bevor die Eintragung der Beendigung des Beherrschungs- und Gewinnabführungsvertrages in das Handelsregister nach § 10 des Handelsgesetzbuches als bekanntgemacht gilt, hat der andere Vertragsteil Sicherheit zu leisten, wenn sie sich binnen sechs Monaten nach der Bekanntmachung der Eintragung zu diesem Zweck bei ihm melden."
    },
    {
      "date": "2025-04-05",
      "id": "105761",
      "original_text": "Einreichung neuer Dokumente\nBayern Amtsgericht München HRB 283006\ninnoscripta AG – München",
      "type": "Einreichung neuer Dokumente",
      "state": "Bayern",
      "amtsgericht": "Amtsgericht München",
      "registernummer": "HRB 283006",
      "registerart": "HRB",
      "company_name": "innoscripta AG",
      "company_seat": "München",
      "details": "05.04.2025 (Bekanntmachungsdatum)\n\nBayern Amtsgericht München HRB 283006\nEinreichung neuer Dokumente 04.04.2025 (Eintragungsdatum)\n\ninnoscripta AG\nAktiengesellschaft\nMünchen\n\nDem Amtsgericht München -Registergericht- ist eine Liste der Mitglieder des Aufsichtsrats eingereicht worden, § 106 AktG."
    },
    {
      "date": "2025-04-05",
      "id": "105762",
      "original_text": "Registerbekanntmachung nach dem Umwandlungsgesetz\nBayern Amtsgericht München HRB 239201\nATAI Life Sciences AG – München",
      "type": "Registerbekanntmachung nach dem Umwandlungsgesetz",
      "state": "Bayern",
      "amtsgericht": "Amtsgericht München",
      "registernummer": "HRB 239201",
      "registerart": "HRB",
      "company_name": "ATAI Life Sciences AG",
      "company_seat": "München",
      "details": "05.04.2025 (Bekanntmachungsdatum)\n\nBayern Amtsgericht München HRB 239201\nRegisterbekanntmachung nach dem Umwandlungsgesetz 04.04.2025 (Eintragungsdatum)\n\nATAI Life Sciences AG\nAktiengesellschaft\nMünchen\n\nDen Gläubigern des formwechselnden Rechtsträgers ist, wenn sie binnen sechs Monaten nach dem Tag, an dem die Eintragung des Formwechsels nach § 201 UmwG als bekannt gemacht gilt, ihren Anspruch nach Grund und Höhe in Textform anmelden, Sicherheit zu leisten, soweit sie nicht Befriedigung verlangen können. Dieses Recht steht den Gläubigern jedoch nur zu, wenn sie glaubhaft machen, dass durch den Formwechsel die Erfüllung ihrer Forderung gefährdet wird."
    },
    {
      "date": "2025-04-05",
      "id": "105763",
      "original_text": "Einreichung neuer Dokumente\nBayern Amtsgericht München HRB 203845\nCANCOM SE – München",
      "type": "Einreichung neuer Dokumente",
      "state": "Bayern",
      "amtsgericht": "Amtsgericht München",
      "registernummer": "HRB 203845",
      "registerart": "HRB",
      "company_name": "CANCOM SE",
      "company_seat": "München",
      "details": "05.04.2025 (Bekanntmachungsdatum)\n\nBayern Amtsgericht München HRB 203845\nEinreichung neuer Dokumente\n\nCANCOM SE\nEuropäische Aktiengesellschaft (SE)\nMünchen\n\nDem Amtsgericht München -Registergericht- ist eine Liste der Mitglieder des Aufsichtsrats eingereicht worden, Art. 9 Abs. 1 Buchst. c (ii) SE-VO i.V.m. § 106 AktG."
    },
    {
      "date": "2025-04-05",
      "id": "105764",
      "original_text": "Sonstige Registerbekanntmachung\nBayern Amtsgericht München HRB 155832\nKET Projektservice GmbH – München",
      "type": "Sonstige Registerbekanntmachung",
      "state": "Bayern",
      "amtsgericht": "Amtsgericht München",
      "registernummer": "HRB 155832",
      "registerart": "HRB",
      "company_name": "KET Projektservice GmbH",
      "company_seat": "München",
      "details": "05.04.2025 (Bekanntmachungsdatum)\n\nBayern Amtsgericht München HRB 155832\nSonstige Registerbekanntmachung 04.04.2025 (Eintragungsdatum)\n\nKET Projektservice GmbH\nGesellschaft mit beschränkter Haftung\nMünchen\n\nDen Gläubigern der Gesellschaft, deren Forderungen begründet worden sind, bevor die Eintragung der Beendigung des Gewinnabführungsvertrages in das Handelsregister nach § 10 des Handelsgesetzbuches als bekanntgemacht gilt, hat der andere Vertragsteil Sicherheit zu leisten, wenn sie sich binnen sechs Monaten nach der Bekanntmachung der Eintragung zu diesem Zweck bei ihm melden."
    },
    {
      "date": "2025-04-05",
      "id": "105765",
      "original_text": "Einreichung neuer Dokumente\nBayern Amtsgericht München HRB 133419\nBank Vontobel Europe AG – München",
      "type": "Einreichung neuer Dokumente",
      "state": "Bayern",
      "amtsgericht": "Amtsgericht München",
      "registernummer": "HRB 133419",
      "registerart": "HRB",
      "company_name": "Bank Vontobel Europe AG",
      "company_seat": "München",
      "details": "05.04.2025 (Bekanntmachungsdatum)\n\nBayern Amtsgericht München HRB 133419\nEinreichung neuer Dokumente 04.04.2025 (Eintragungsdatum)\n\nBank Vontobel Europe AG\nAktiengesellschaft\nMünchen\n\nDem Amtsgericht München -Registergericht- ist eine Liste der Mitglieder des Aufsichtsrats eingereicht worden, § 106 AktG."
    },
    {
      "date": "2025-04-05",
      "id": "105766",
      "original_text": "Registerbekanntmachung nach dem Umwandlungsgesetz\nBayern Amtsgericht München HRB 270769\nCodetopia GmbH – München",
      "type": "Registerbekanntmachung nach dem Umwandlungsgesetz",
      "state": "Bayern",
      "amtsgericht": "Amtsgericht München",
      "registernummer": "HRB 270769",
      "registerart": "HRB",
      "company_name": "Codetopia GmbH",
      "company_seat": "München",
      "details": "05.04.2025 (Bekanntmachungsdatum)\n\nBayern Amtsgericht München HRB 270769\nRegisterbekanntmachung nach dem Umwandlungsgesetz 04.04.2025 (Eintragungsdatum)\n\nCodetopia GmbH\nGesellschaft mit beschränkter Haftung\nMünchen\n\nDen Gläubigern der an der Verschmelzung beteiligten Rechtsträger ist, wenn sie binnen sechs Monaten nach dem Tag, an dem die Eintragung der Verschmelzung in das Register des Sitzes desjenigen Rechtsträgers, dessen Gläubiger sie sind, nach § 19 Abs. 3 UmwG als bekannt gemacht gilt, ihren Anspruch nach Grund und Höhe in Textform anmelden, Sicherheit zu leisten, soweit sie nicht Befriedigung verlangen können. Dieses Recht steht den Gläubigern jedoch nur zu, wenn sie glaubhaft machen, dass durch die Verschmelzung die Erfüllung ihrer Forderung gefährdet wird."
    },
    {
      "date": "2025-04-05",
      "id": "105767",
      "original_text": "Löschungsankündigung\nBayern Amtsgericht Nürnberg HRB 19998\nKRAMER ELASTICS GmbH – Neunkirchen a. Sand",
      "type": "Löschungsankündigung",
      "state": "Bayern",
      "amtsgericht": "Amtsgericht Nürnberg",
      "registernummer": "HRB 19998",
      "registerart": "HRB",
      "company_name": "KRAMER ELASTICS GmbH",
      "company_seat": "Neunkirchen a. Sand",
      "details": "05.04.2025 (Bekanntmachungsdatum)\n\nBayern Amtsgericht Nürnberg HRB 19998\nLöschungsankündigung\n\nKRAMER ELASTICS GmbH\nGesellschaft mit beschränkter Haftung\nNeunkirchen a. Sand\n\nDas Registergericht beabsichtigt, die im Handelsregister eingetragene Gesellschaft wegen Vermögenslosigkeit von Amts wegen nach § 394 FamFG zu löschen. Die Frist zur Erhebung eines Widerspruchs ist auf einen Monat festgesetzt."
    },
    {
      "date": "2025-04-05",
      "id": "105768",
      "original_text": "Löschungsankündigung\nBayern Amtsgericht Nürnberg HRB 19998\nKRAMER ELASTICS GmbH – Neunkirchen a. Sand",
      "type": "Löschungsankündigung",
      "state": "Bayern",
      "amtsgericht": "Amtsgericht Nürnberg",
      "registernummer": "HRB 19998",
      "registerart": "HRB",
      "company_name": "KRAMER ELASTICS GmbH",
      "company_seat": "Neunkirchen a. Sand",
      "details": "05.04.2025 (Bekanntmachungsdatum)\n\nBayern Amtsgericht Nürnberg HRB 19998\nLöschungsankündigung\n\nKRAMER ELASTICS GmbH\nGesellschaft mit beschränkter Haftung\nNeunkirchen a. Sand\n\nDas Registergericht beabsichtigt, die im Handelsregister eingetragene Gesellschaft wegen Vermögenslosigkeit von Amts wegen nach § 394 FamFG zu löschen. Die Frist zur Erhebung eines Widerspruchs ist auf einen Monat festgesetzt."
    },
    {
      "date": "2025-04-05",
      "id": "105769",
      "original_text": "Einreichung neuer Dokumente\nBayern Amtsgericht München HRB 187005\nDaldrup & Söhne Aktiengesellschaft – Oberhaching",
      "type": "Einreichung neuer Dokumente",
      "state": "Bayern",
      "amtsgericht": "Amtsgericht München",
      "registernummer": "HRB 187005",
      "registerart": "HRB",
      "company_name": "Daldrup & Söhne Aktiengesellschaft",
      "company_seat": "Oberhaching",
      "details": "05.04.2025 (Bekanntmachungsdatum)\n\nBayern Amtsgericht München HRB 187005\nEinreichung neuer Dokumente\n\nDaldrup & Söhne Aktiengesellschaft\nAktiengesellschaft\nOberhaching\n\nDem Amtsgericht München -Registergericht- ist eine Liste der Mitglieder des Aufsichtsrats eingereicht worden, § 106 AktG."
    },
    {
      "date": "2025-04-05",
      "id": "105770",
      "original_text": "Registerbekanntmachung nach dem Umwandlungsgesetz\nBayern Amtsgericht Fürth HRB 14768\nGBI Wohnungsbau Omikron GmbH – Erlangen",
      "type": "Registerbekanntmachung nach dem Umwandlungsgesetz",
      "state": "Bayern",
      "amtsgericht": "Amtsgericht Fürth",
      "registernummer": "HRB 14768",
      "registerart": "HRB",
      "company_name": "GBI Wohnungsbau Omikron GmbH",
      "company_seat": "Erlangen",
      "details": "05.04.2025 (Bekanntmachungsdatum)\n\nBayern Amtsgericht Fürth HRB 14768\nRegisterbekanntmachung nach dem Umwandlungsgesetz 04.04.2025 (Eintragungsdatum)\n\nGBI Wohnungsbau Omikron GmbH\nGesellschaft mit beschränkter Haftung\nErlangen\n\nDen Gläubigern der an der Verschmelzung beteiligten Rechtsträger ist, wenn sie binnen sechs Monaten nach dem Tag, an dem die Eintragung der Verschmelzung in das Register des Sitzes desjenigen Rechtsträgers, dessen Gläubiger sie sind, nach § 19 Abs. 3 UmwG als bekannt gemacht gilt, ihren Anspruch nach Grund und Höhe in Textform anmelden, Sicherheit zu leisten, soweit sie nicht Befriedigung verlangen können. Dieses Recht steht den Gläubigern jedoch nur zu, wenn sie glaubhaft machen, dass durch die Verschmelzung die Erfüllung ihrer Forderung gefährdet wird."
    },
    {
      "date": "2025-04-05",
      "id": "105771",
      "original_text": "Löschungsankündigung\nBayern Amtsgericht München HRB 256753\nRunVentures GmbH – München",
      "type": "Löschungsankündigung",
      "state": "Bayern",
      "amtsgericht": "Amtsgericht München",
      "registernummer": "HRB 256753",
      "registerart": "HRB",
      "company_name": "RunVentures GmbH",
      "company_seat": "München",
      "details": "05.04.2025 (Bekanntmachungsdatum)\n\nBayern Amtsgericht München HRB 256753\nLöschungsankündigung 04.04.2025 (Eintragungsdatum)\n\nRunVentures GmbH\nGesellschaft mit beschränkter Haftung\nMünchen\n\nDas Registergericht beabsichtigt, die im Handelsregister eingetragene Gesellschaft wegen Vermögenslosigkeit von Amts wegen nach § 394 FamFG zu löschen. Die Frist zur Erhebung eines Widerspruchs ist auf drei Monate festgesetzt."
    },
    {
      "date": "2025-04-05",
      "id": "105772",
      "original_text": "Löschungsankündigung\nBayern Amtsgericht Augsburg HRB 33193\nBBA Baubüro GmbH – Nördlingen",
      "type": "Löschungsankündigung",
      "state": "Bayern",
      "amtsgericht": "Amtsgericht Augsburg",
      "registernummer": "HRB 33193",
      "registerart": "HRB",
      "company_name": "BBA Baubüro GmbH",
      "company_seat": "Nördlingen",
      "details": "05.04.2025 (Bekanntmachungsdatum)\n\nBayern Amtsgericht Augsburg HRB 33193\nLöschungsankündigung\n\nBBA Baubüro GmbH\nGesellschaft mit beschränkter Haftung\nNördlingen\n\nDas Registergericht beabsichtigt, die im Handelsregister eingetragene Gesellschaft wegen Vermögenslosigkeit von Amts wegen nach § 394 FamFG zu löschen. Die Frist zur Erhebung eines Widerspruchs ist auf einen Monat festgesetzt."
    },
    {
      "date": "2025-04-05",
      "id": "105773",
      "original_text": "Löschungsankündigung\nBayern Amtsgericht München HRB 206405\nVidro Bauträger & Immobilien GmbH – München",
      "type": "Löschungsankündigung",
      "state": "Bayern",
      "amtsgericht": "Amtsgericht München",
      "registernummer": "HRB 206405",
      "registerart": "HRB",
      "company_name": "Vidro Bauträger & Immobilien GmbH",
      "company_seat": "München",
      "details": "05.04.2025 (Bekanntmachungsdatum)\n\nBayern Amtsgericht München HRB 206405\nLöschungsankündigung 04.04.2025 (Eintragungsdatum)\n\nVidro Bauträger & Immobilien GmbH\nGesellschaft mit beschränkter Haftung\nMünchen\n\nDas Registergericht beabsichtigt, die im Handelsregister eingetragene Gesellschaft wegen Vermögenslosigkeit von Amts wegen nach § 394 FamFG zu löschen. Die Frist zur Erhebung eines Widerspruchs ist auf drei Monate festgesetzt."
    },
    {
      "date": "2025-04-05",
      "id": "105774",
      "original_text": "Registerbekanntmachung nach dem Umwandlungsgesetz\nBayern Amtsgericht München HRB 122988\nBau + Plan Ingenieurgesellschaft mbH – München",
      "type": "Registerbekanntmachung nach dem Umwandlungsgesetz",
      "state": "Bayern",
      "amtsgericht": "Amtsgericht München",
      "registernummer": "HRB 122988",
      "registerart": "HRB",
      "company_name": "Bau + Plan Ingenieurgesellschaft mbH",
      "company_seat": "München",
      "details": "05.04.2025 (Bekanntmachungsdatum)\n\nBayern Amtsgericht München HRB 122988\nRegisterbekanntmachung nach dem Umwandlungsgesetz 04.04.2025 (Eintragungsdatum)\n\nBau + Plan Ingenieurgesellschaft mbH\nGesellschaft mit beschränkter Haftung\nMünchen\n\nDen Gläubigern der an der Verschmelzung beteiligten Rechtsträger ist, wenn sie binnen sechs Monaten nach dem Tag, an dem die Eintragung der Verschmelzung in das Register des Sitzes desjenigen Rechtsträgers, dessen Gläubiger sie sind, nach § 19 Abs. 3 UmwG als bekannt gemacht gilt, ihren Anspruch nach Grund und Höhe in Textform anmelden, Sicherheit zu leisten, soweit sie nicht Befriedigung verlangen können. Dieses Recht steht den Gläubigern jedoch nur zu, wenn sie glaubhaft machen, dass durch die Verschmelzung die Erfüllung ihrer Forderung gefährdet wird."
    },
    {
      "date": "2025-04-05",
      "id": "105775",
      "original_text": "Sonstige Registerbekanntmachung\nBayern Amtsgericht München HRB 220660\nLiving Lab GmbH – München",
      "type": "Sonstige Registerbekanntmachung",
      "state": "Bayern",
      "amtsgericht": "Amtsgericht München",
      "registernummer": "HRB 220660",
      "registerart": "HRB",
      "company_name": "Living Lab GmbH",
      "company_seat": "München",
      "details": "05.04.2025 (Bekanntmachungsdatum)\n\nBayern Amtsgericht München HRB 220660\nSonstige Registerbekanntmachung 04.04.2025 (Eintragungsdatum)\n\nLiving Lab GmbH\nGesellschaft mit beschränkter Haftung\nMünchen\n\nDen Gläubigern der Gesellschaft, deren Forderungen begründet worden sind, bevor die Eintragung der Beendigung des Beherrschungs- und Gewinnabführungsvertrages in das Handelsregister nach § 10 des Handelsgesetzbuches als bekanntgemacht gilt, hat der andere Vertragsteil Sicherheit zu leisten, wenn sie sich binnen sechs Monaten nach der Bekanntmachung der Eintragung zu diesem Zweck bei ihm melden."
    },
    {
      "date": "2025-04-05",
      "id": "105776",
      "original_text": "Registerbekanntmachung nach dem Umwandlungsgesetz\nBayern Amtsgericht Traunstein HRB 33574\nESD Wertdienstleistungen GmbH – Mühldorf a.Inn",
      "type": "Registerbekanntmachung nach dem Umwandlungsgesetz",
      "state": "Bayern",
      "amtsgericht": "Amtsgericht Traunstein",
      "registernummer": "HRB 33574",
      "registerart": "HRB",
      "company_name": "ESD Wertdienstleistungen GmbH",
      "company_seat": "Mühldorf a.Inn",
      "details": "05.04.2025 (Bekanntmachungsdatum)\n\nBayern Amtsgericht Traunstein HRB 33574\nRegisterbekanntmachung nach dem Umwandlungsgesetz 04.04.2025 (Eintragungsdatum)\n\nESD Wertdienstleistungen GmbH\nGesellschaft mit beschränkter Haftung\nMühldorf a.Inn\n\nDen Gläubigern der an der Spaltung beteiligten Rechtsträger ist, wenn sie binnen sechs Monaten nach dem Tag, an dem die Eintragung der Spaltung in das Register des Sitzes desjenigen Rechtsträgers, dessen Gläubiger sie sind, nach §§ 125, 19 Abs. 3 UmwG als bekannt gemacht gilt, ihren Anspruch nach Grund und Höhe in Textform anmelden, Sicherheit zu leisten, soweit sie nicht Befriedigung verlangen können. Dieses Recht steht den Gläubigern jedoch nur zu, wenn sie glaubhaft machen, dass durch die Spaltung die Erfüllung ihrer Forderung gefährdet wird."
    },
    {
      "date": "2025-04-05",
      "id": "105777",
      "original_text": "Registerbekanntmachung nach dem Umwandlungsgesetz\nBayern Amtsgericht Aschaffenburg HRB 13915\nHanses Wartung und Service GmbH – Aschaffenburg",
      "type": "Registerbekanntmachung nach dem Umwandlungsgesetz",
      "state": "Bayern",
      "amtsgericht": "Amtsgericht Aschaffenburg",
      "registernummer": "HRB 13915",
      "registerart": "HRB",
      "company_name": "Hanses Wartung und Service GmbH",
      "company_seat": "Aschaffenburg",
      "details": "05.04.2025 (Bekanntmachungsdatum)\n\nBayern Amtsgericht Aschaffenburg HRB 13915\nRegisterbekanntmachung nach dem Umwandlungsgesetz 04.04.2025 (Eintragungsdatum)\n\nHanses Wartung und Service GmbH\nGesellschaft mit beschränkter Haftung\nAschaffenburg\n\nDen Gläubigern der an der Verschmelzung beteiligten Rechtsträger ist, wenn sie binnen sechs Monaten nach dem Tag, an dem die Eintragung der Verschmelzung in das Register des Sitzes desjenigen Rechtsträgers, dessen Gläubiger sie sind, nach § 19 Abs. 3 UmwG als bekannt gemacht gilt, ihren Anspruch nach Grund und Höhe in Textform anmelden, Sicherheit zu leisten, soweit sie nicht Befriedigung verlangen können. Dieses Recht steht den Gläubigern jedoch nur zu, wenn sie glaubhaft machen, dass durch die Verschmelzung die Erfüllung ihrer Forderung gefährdet wird."
    },
    {
      "date": "2025-04-05",
      "id": "105778",
      "original_text": "Registerbekanntmachung nach dem Umwandlungsgesetz\nNordrhein-Westfalen Amtsgericht Siegburg HRB 15955\nAeroMates GmbH – Niederkassel",
      "type": "Registerbekanntmachung nach dem Umwandlungsgesetz",
      "state": "Nordrhein-Westfalen",
      "amtsgericht": "Amtsgericht Siegburg",
      "registernummer": "HRB 15955",
      "registerart": "HRB",
      "company_name": "AeroMates GmbH",
      "company_seat": "Niederkassel",
      "details": "05.04.2025 (Bekanntmachungsdatum)\n\nNordrhein-Westfalen Amtsgericht Siegburg HRB 15955\nRegisterbekanntmachung nach dem Umwandlungsgesetz 05.04.2025 (Eintragungsdatum)\n\nAeroMates GmbH\nGesellschaft mit beschränkter Haftung\nNiederkassel\n\nDen Gläubigern der an der Verschmelzung beteiligten Rechtsträger ist, wenn sie binnen sechs Monaten nach dem Tag, an dem die Eintragung der Verschmelzung in das Register des Sitzes desjenigen Rechtsträgers, dessen Gläubiger sie sind, nach § 19 Absatz 3 UmwG als bekanntgemacht gilt, ihren Anspruch nach Grund und Höhe schriftlich anmelden, Sicherheit zu leisten, soweit sie nicht Befriedigung verlangen können. Dieses Recht steht den Gläubigern jedoch nur zu, wenn sie glaubhaft machen, dass durch die Verschmelzung die Erfüllung ihrer Forderung gefährdet wird."
    }
  ]
}