{
  "date": "2025-04-24",
  "date_of_scrape": "2025-05-31T06:40:57.576Z",
  "tool_version": "0.2.0",
  "number_of_announcements": 116,
  "announcements": [
    {
      "date": "2025-04-24",
      "id": "107221",
      "original_text": "Löschungsankündigung\nBayern Amtsgericht Fürth HRB 16898\nASBURG GmbH – Fürth",
      "type": "Löschungsankündigung",
      "state": "Bayern",
      "amtsgericht": "Amtsgericht Fürth",
      "registernummer": "HRB 16898",
      "registerart": "HRB",
      "company_name": "ASBURG GmbH",
      "company_seat": "Fürth",
      "details": "24.04.2025 (Bekanntmachungsdatum)\n\nBayern Amtsgericht Fürth HRB 16898\nLöschungsankündigung\n\nASBURG GmbH\nGesellschaft mit beschränkter Haftung\nFürth\n\nDas Registergericht beabsichtigt, die im Handelsregister eingetragene Gesellschaft wegen Vermögenslosigkeit von Amts wegen nach § 394 FamFG zu löschen. Die Frist zur Erhebung eines Widerspruchs ist auf drei Monate festgesetzt."
    },
    {
      "date": "2025-04-24",
      "id": "107222",
      "original_text": "Registerbekanntmachung nach dem Umwandlungsgesetz\nBayern Amtsgericht München HRB 130261\nFujitsu Germany GmbH – München",
      "type": "Registerbekanntmachung nach dem Umwandlungsgesetz",
      "state": "Bayern",
      "amtsgericht": "Amtsgericht München",
      "registernummer": "HRB 130261",
      "registerart": "HRB",
      "company_name": "Fujitsu Germany GmbH",
      "company_seat": "München",
      "details": "24.04.2025 (Bekanntmachungsdatum)\n\nBayern Amtsgericht München HRB 130261\nRegisterbekanntmachung nach dem Umwandlungsgesetz 23.04.2025 (Eintragungsdatum)\n\nFujitsu Germany GmbH\nGesellschaft mit beschränkter Haftung\nMünchen\n\nDen Gläubigern der an der Spaltung beteiligten Rechtsträger ist, wenn sie binnen sechs Monaten nach dem Tag, an dem die Eintragung der Spaltung in das Register des Sitzes desjenigen Rechtsträgers, dessen Gläubiger sie sind, nach §§ 125, 19 Abs. 3 UmwG als bekannt gemacht gilt, ihren Anspruch nach Grund und Höhe in Textform anmelden, Sicherheit zu leisten, soweit sie nicht Befriedigung verlangen können. Dieses Recht steht den Gläubigern jedoch nur zu, wenn sie glaubhaft machen, dass durch die Spaltung die Erfüllung ihrer Forderung gefährdet wird."
    },
    {
      "date": "2025-04-24",
      "id": "107223",
      "original_text": "Löschungsankündigung\nBayern Amtsgericht München HRB 213421\nNatur & Ich UG (haftungsbeschränkt) – München",
      "type": "Löschungsankündigung",
      "state": "Bayern",
      "amtsgericht": "Amtsgericht München",
      "registernummer": "HRB 213421",
      "registerart": "HRB",
      "company_name": "Natur & Ich UG (haftungsbeschränkt)",
      "company_seat": "München",
      "details": "24.04.2025 (Bekanntmachungsdatum)\n\nBayern Amtsgericht München HRB 213421\nLöschungsankündigung 23.04.2025 (Eintragungsdatum)\n\nNatur & Ich UG (haftungsbeschränkt)\nGesellschaft mit beschränkter Haftung\nMünchen\n\nDas Registergericht beabsichtigt, die im Handelsregister eingetragene Gesellschaft wegen Vermögenslosigkeit von Amts wegen nach § 394 FamFG zu löschen. Die Frist zur Erhebung eines Widerspruchs ist auf drei Monate festgesetzt."
    },
    {
      "date": "2025-04-24",
      "id": "107224",
      "original_text": "Löschungsankündigung\nBayern Amtsgericht München HRB 166849\nG & S Nutzfahrzeuge GmbH – München",
      "type": "Löschungsankündigung",
      "state": "Bayern",
      "amtsgericht": "Amtsgericht München",
      "registernummer": "HRB 166849",
      "registerart": "HRB",
      "company_name": "G & S Nutzfahrzeuge GmbH",
      "company_seat": "München",
      "details": "24.04.2025 (Bekanntmachungsdatum)\n\nBayern Amtsgericht München HRB 166849\nLöschungsankündigung 16.04.2025 (Eintragungsdatum)\n\nG & S Nutzfahrzeuge GmbH\nGesellschaft mit beschränkter Haftung\nMünchen\n\nDas Registergericht beabsichtigt, die im Handelsregister eingetragene Gesellschaft wegen Vermögenslosigkeit von Amts wegen nach § 394 FamFG zu löschen. Die Frist zur Erhebung eines Widerspruchs ist auf drei Monate festgesetzt."
    },
    {
      "date": "2025-04-24",
      "id": "107225",
      "original_text": "Registerbekanntmachung nach dem Umwandlungsgesetz\nBayern Amtsgericht Coburg HRB 6024\nNetwork4Experts GmbH – Altenkunstadt",
      "type": "Registerbekanntmachung nach dem Umwandlungsgesetz",
      "state": "Bayern",
      "amtsgericht": "Amtsgericht Coburg",
      "registernummer": "HRB 6024",
      "registerart": "HRB",
      "company_name": "Network4Experts GmbH",
      "company_seat": "Altenkunstadt",
      "details": "24.04.2025 (Bekanntmachungsdatum)\n\nBayern Amtsgericht Coburg HRB 6024\nRegisterbekanntmachung nach dem Umwandlungsgesetz 23.04.2025 (Eintragungsdatum)\n\nNetwork4Experts GmbH\nGesellschaft mit beschränkter Haftung\nAltenkunstadt\n\nDas Registergericht beabsichtigt, die im Handelsregister eingetragene Gesellschaft wegen Vermögenslosigkeit von Amts wegen nach § 394 FamFG zu löschen. Die Frist zur Erhebung eines Widerspruchs ist auf sechs Wochen festgesetzt."
    },
    {
      "date": "2025-04-24",
      "id": "107226",
      "original_text": "Löschungsankündigung\nBayern Amtsgericht Nürnberg HRB 12287\nGebrüder Weidner GmbH Ringmanufaktur – Schwabach",
      "type": "Löschungsankündigung",
      "state": "Bayern",
      "amtsgericht": "Amtsgericht Nürnberg",
      "registernummer": "HRB 12287",
      "registerart": "HRB",
      "company_name": "Gebrüder Weidner GmbH Ringmanufaktur",
      "company_seat": "Schwabach",
      "details": "24.04.2025 (Bekanntmachungsdatum)\n\nBayern Amtsgericht Nürnberg HRB 12287\nLöschungsankündigung\n\nGebrüder Weidner GmbH Ringmanufaktur\nGesellschaft mit beschränkter Haftung\nSchwabach\n\nDas Registergericht beabsichtigt, die im Handelsregister eingetragene Gesellschaft wegen Vermögenslosigkeit von Amts wegen nach § 394 FamFG zu löschen. Die Frist zur Erhebung eines Widerspruchs ist auf einen Monat festgesetzt."
    },
    {
      "date": "2025-04-24",
      "id": "107227",
      "original_text": "Löschungsankündigung\nBayern Amtsgericht Nürnberg HRB 28447\nTSS Solar GmbH – Wendelstein",
      "type": "Löschungsankündigung",
      "state": "Bayern",
      "amtsgericht": "Amtsgericht Nürnberg",
      "registernummer": "HRB 28447",
      "registerart": "HRB",
      "company_name": "TSS Solar GmbH",
      "company_seat": "Wendelstein",
      "details": "24.04.2025 (Bekanntmachungsdatum)\n\nBayern Amtsgericht Nürnberg HRB 28447\nLöschungsankündigung\n\nTSS Solar GmbH\nGesellschaft mit beschränkter Haftung\nWendelstein\n\nDas Registergericht beabsichtigt, die im Handelsregister eingetragene Gesellschaft wegen Vermögenslosigkeit von Amts wegen nach § 394 FamFG zu löschen. Die Frist zur Erhebung eines Widerspruchs ist auf einen Monat festgesetzt."
    },
    {
      "date": "2025-04-24",
      "id": "107228",
      "original_text": "Registerbekanntmachung nach dem Umwandlungsgesetz\nBayern Amtsgericht München HRB 55385\nConstantin Film Produktion GmbH – München",
      "type": "Registerbekanntmachung nach dem Umwandlungsgesetz",
      "state": "Bayern",
      "amtsgericht": "Amtsgericht München",
      "registernummer": "HRB 55385",
      "registerart": "HRB",
      "company_name": "Constantin Film Produktion GmbH",
      "company_seat": "München",
      "details": "24.04.2025 (Bekanntmachungsdatum)\n\nBayern Amtsgericht München HRB 55385\nRegisterbekanntmachung nach dem Umwandlungsgesetz 23.04.2025 (Eintragungsdatum)\n\nConstantin Film Produktion GmbH\nGesellschaft mit beschränkter Haftung\nMünchen\n\nDen Gläubigern der an der Verschmelzung beteiligten Rechtsträger ist, wenn sie binnen sechs Monaten nach dem Tag, an dem die Eintragung der Verschmelzung in das Register des Sitzes desjenigen Rechtsträgers, dessen Gläubiger sie sind, nach § 19 Abs. 3 UmwG als bekannt gemacht gilt, ihren Anspruch nach Grund und Höhe in Textform anmelden, Sicherheit zu leisten, soweit sie nicht Befriedigung verlangen können. Dieses Recht steht den Gläubigern jedoch nur zu, wenn sie glaubhaft machen, dass durch die Verschmelzung die Erfüllung ihrer Forderung gefährdet wird."
    },
    {
      "date": "2025-04-24",
      "id": "107229",
      "original_text": "Löschungsankündigung\nBayern Amtsgericht München HRB 236535\nWobbit UG (haftungsbeschränkt) – München",
      "type": "Löschungsankündigung",
      "state": "Bayern",
      "amtsgericht": "Amtsgericht München",
      "registernummer": "HRB 236535",
      "registerart": "HRB",
      "company_name": "Wobbit UG (haftungsbeschränkt)",
      "company_seat": "München",
      "details": "24.04.2025 (Bekanntmachungsdatum)\n\nBayern Amtsgericht München HRB 236535\nLöschungsankündigung 17.04.2025 (Eintragungsdatum)\n\nWobbit UG (haftungsbeschränkt)\nGesellschaft mit beschränkter Haftung\nMünchen\n\nDas Registergericht beabsichtigt, die im Handelsregister eingetragene Gesellschaft wegen Vermögenslosigkeit von Amts wegen nach § 394 FamFG zu löschen. Die Frist zur Erhebung eines Widerspruchs ist auf drei Monate festgesetzt."
    },
    {
      "date": "2025-04-24",
      "id": "107230",
      "original_text": "Löschungsankündigung\nBayern Amtsgericht München HRA 110838\nPRIMUS Concept Pflegeimmobilien Hundsangen GmbH & Co. KG – Markt Indersdorf",
      "type": "Löschungsankündigung",
      "state": "Bayern",
      "amtsgericht": "Amtsgericht München",
      "registernummer": "HRA 110838",
      "registerart": "HRA",
      "company_name": "PRIMUS Concept Pflegeimmobilien Hundsangen GmbH & Co. KG",
      "company_seat": "Markt Indersdorf",
      "details": "24.04.2025 (Bekanntmachungsdatum)\n\nBayern Amtsgericht München HRA 110838\nLöschungsankündigung 22.04.2025 (Eintragungsdatum)\n\nPRIMUS Concept Pflegeimmobilien Hundsangen GmbH & Co. KG\nKommanditgesellschaft\nMarkt Indersdorf\n\nDas Registergericht beabsichtigt, die im Handelsregister eingetragene Gesellschaft wegen Vermögenslosigkeit von Amts wegen nach § 394 FamFG zu löschen. Die Frist zur Erhebung eines Widerspruchs ist auf drei Monate festgesetzt."
    },
    {
      "date": "2025-04-24",
      "id": "107231",
      "original_text": "Sonstige Registerbekanntmachung\nBayern Amtsgericht Landshut HRB 8839\nFlottweg SE – Vilsbiburg",
      "type": "Sonstige Registerbekanntmachung",
      "state": "Bayern",
      "amtsgericht": "Amtsgericht Landshut",
      "registernummer": "HRB 8839",
      "registerart": "HRB",
      "company_name": "Flottweg SE",
      "company_seat": "Vilsbiburg",
      "details": "24.04.2025 (Bekanntmachungsdatum)\n\nBayern Amtsgericht Landshut HRB 8839\nSonstige Registerbekanntmachung\n\nFlottweg SE\nEuropäische Aktiengesellschaft (SE)\nVilsbiburg\n\nDem Amtsgericht Landshut -Registergericht- ist eine Liste der Mitglieder des Aufsichtsrats eingereicht worden, Art. 9 Abs. 1 Buchst. c (ii) SE-VO i.V.m. § 106 AktG."
    },
    {
      "date": "2025-04-24",
      "id": "107232",
      "original_text": "Löschungsankündigung\nBayern Amtsgericht München HRB 252760\nCyberSolutions VSSP Gesellschaft für kommunikative Datentechnik AG – Hohenbrunn",
      "type": "Löschungsankündigung",
      "state": "Bayern",
      "amtsgericht": "Amtsgericht München",
      "registernummer": "HRB 252760",
      "registerart": "HRB",
      "company_name": "CyberSolutions VSSP Gesellschaft für kommunikative Datentechnik AG",
      "company_seat": "Hohenbrunn",
      "details": "24.04.2025 (Bekanntmachungsdatum)\n\nBayern Amtsgericht München HRB 252760\nLöschungsankündigung 23.04.2025 (Eintragungsdatum)\n\nCyberSolutions VSSP Gesellschaft für kommunikative Datentechnik AG\nAktiengesellschaft\nHohenbrunn\n\nDas Registergericht beabsichtigt, den im Handelsregister eingetragenen Vorstand Vavra Stephan, 11.10.1968,  wegen fehlender Eignung nach § 395 FamFG zu löschen. Die Frist zur Erhebung eines Widerspruchs ist auf drei Monate festgesetzt."
    },
    {
      "date": "2025-04-24",
      "id": "107233",
      "original_text": "Löschungsankündigung\nBayern Amtsgericht Nürnberg HRB 26453\nGFE Production GmbH – Nürnberg",
      "type": "Löschungsankündigung",
      "state": "Bayern",
      "amtsgericht": "Amtsgericht Nürnberg",
      "registernummer": "HRB 26453",
      "registerart": "HRB",
      "company_name": "GFE Production GmbH",
      "company_seat": "Nürnberg",
      "details": "24.04.2025 (Bekanntmachungsdatum)\n\nBayern Amtsgericht Nürnberg HRB 26453\nLöschungsankündigung\n\nGFE Production GmbH\nGesellschaft mit beschränkter Haftung\nNürnberg\n\nDas Registergericht beabsichtigt, die im Handelsregister eingetragene Gesellschaft wegen Vermögenslosigkeit von Amts wegen nach § 394 FamFG zu löschen. Die Frist zur Erhebung eines Widerspruchs ist auf einen Monat festgesetzt."
    },
    {
      "date": "2025-04-24",
      "id": "107234",
      "original_text": "Registerbekanntmachung nach dem Umwandlungsgesetz\nBayern Amtsgericht Würzburg HRB 15712\nALDI Helmstadt Verwaltungs-SE – Helmstadt",
      "type": "Registerbekanntmachung nach dem Umwandlungsgesetz",
      "state": "Bayern",
      "amtsgericht": "Amtsgericht Würzburg",
      "registernummer": "HRB 15712",
      "registerart": "HRB",
      "company_name": "ALDI Helmstadt Verwaltungs-SE",
      "company_seat": "Helmstadt",
      "details": "24.04.2025 (Bekanntmachungsdatum)\n\nBayern Amtsgericht Würzburg HRB 15712\nRegisterbekanntmachung nach dem Umwandlungsgesetz 23.04.2025 (Eintragungsdatum)\n\nALDI Helmstadt Verwaltungs-SE\nEuropäische Aktiengesellschaft (SE)\nHelmstadt\n\nDem Amtsgericht Würzburg -Registergericht- ist der Entwurf eines Verschmelzungsvertrages zwischen der ALDI Bingen Verwaltungs-SE, Bingen (Amtsgericht Mainz HRB 50443) und der Gesellschaft als übertragendem Rechtsträger zur Einsichtnahme eingereicht worden."
    },
    {
      "date": "2025-04-24",
      "id": "107235",
      "original_text": "Registerbekanntmachung nach dem Umwandlungsgesetz\nBayern Amtsgericht München HRB 247162\nVM Transport & Logistik GmbH – München",
      "type": "Registerbekanntmachung nach dem Umwandlungsgesetz",
      "state": "Bayern",
      "amtsgericht": "Amtsgericht München",
      "registernummer": "HRB 247162",
      "registerart": "HRB",
      "company_name": "VM Transport & Logistik GmbH",
      "company_seat": "München",
      "details": "24.04.2025 (Bekanntmachungsdatum)\n\nBayern Amtsgericht München HRB 247162\nRegisterbekanntmachung nach dem Umwandlungsgesetz 23.04.2025 (Eintragungsdatum)\n\nVM Transport & Logistik GmbH\nGesellschaft mit beschränkter Haftung\nMünchen\n\nDen Gläubigern der an der Verschmelzung beteiligten Rechtsträger ist, wenn sie binnen sechs Monaten nach dem Tag, an dem die Eintragung der Verschmelzung in das Register des Sitzes desjenigen Rechtsträgers, dessen Gläubiger sie sind, nach § 19 Abs. 3 UmwG als bekannt gemacht gilt, ihren Anspruch nach Grund und Höhe in Textform anmelden, Sicherheit zu leisten, soweit sie nicht Befriedigung verlangen können. Dieses Recht steht den Gläubigern jedoch nur zu, wenn sie glaubhaft machen, dass durch die Verschmelzung die Erfüllung ihrer Forderung gefährdet wird."
    },
    {
      "date": "2025-04-24",
      "id": "107236",
      "original_text": "Löschungsankündigung\nBayern Amtsgericht München HRB 64664\nJacob Schuh GmbH – München",
      "type": "Löschungsankündigung",
      "state": "Bayern",
      "amtsgericht": "Amtsgericht München",
      "registernummer": "HRB 64664",
      "registerart": "HRB",
      "company_name": "Jacob Schuh GmbH",
      "company_seat": "München",
      "details": "24.04.2025 (Bekanntmachungsdatum)\n\nBayern Amtsgericht München HRB 64664\nLöschungsankündigung 23.04.2025 (Eintragungsdatum)\n\nJacob Schuh GmbH\nGesellschaft mit beschränkter Haftung\nMünchen\n\nDas Registergericht beabsichtigt, die im Handelsregister eingetragene Gesellschaft wegen Vermögenslosigkeit von Amts wegen nach § 394 FamFG zu löschen. Die Frist zur Erhebung eines Widerspruchs ist auf drei Monate festgesetzt."
    },
    {
      "date": "2025-04-24",
      "id": "107237",
      "original_text": "Löschungsankündigung\nBayern Amtsgericht Würzburg HRB 12402\nLisbau GmbH – Rothenfels",
      "type": "Löschungsankündigung",
      "state": "Bayern",
      "amtsgericht": "Amtsgericht Würzburg",
      "registernummer": "HRB 12402",
      "registerart": "HRB",
      "company_name": "Lisbau GmbH",
      "company_seat": "Rothenfels",
      "details": "24.04.2025 (Bekanntmachungsdatum)\n\nBayern Amtsgericht Würzburg HRB 12402\nLöschungsankündigung\n\nLisbau GmbH\nGesellschaft mit beschränkter Haftung\nRothenfels\n\nDas Registergericht beabsichtigt, die im Handelsregister eingetragene Gesellschaft wegen Vermögenslosigkeit von Amts wegen nach § 394 FamFG zu löschen. Die Frist zur Geltendmachung eines Widerspruchs gegen die beabsichtigte Löschung wird auf 3 Monate festgesetzt."
    },
    {
      "date": "2025-04-24",
      "id": "107238",
      "original_text": "Löschungsankündigung\nBayern Amtsgericht München HRB 150547\nrhino´s energy drink and food GmbH Abwicklungsgesellschaft – Oberding",
      "type": "Löschungsankündigung",
      "state": "Bayern",
      "amtsgericht": "Amtsgericht München",
      "registernummer": "HRB 150547",
      "registerart": "HRB",
      "company_name": "rhino´s energy drink and food GmbH Abwicklungsgesellschaft",
      "company_seat": "Oberding",
      "details": "24.04.2025 (Bekanntmachungsdatum)\n\nBayern Amtsgericht München HRB 150547\nLöschungsankündigung 23.04.2025 (Eintragungsdatum)\n\nrhino´s energy drink and food GmbH Abwicklungsgesellschaft\nGesellschaft mit beschränkter Haftung\nOberding\n\nDas Registergericht beabsichtigt, die im Handelsregister eingetragene Gesellschaft wegen Vermögenslosigkeit von Amts wegen nach § 394 FamFG zu löschen. Die Frist zur Erhebung eines Widerspruchs ist auf drei Monate festgesetzt."
    },
    {
      "date": "2025-04-24",
      "id": "107239",
      "original_text": "Registerbekanntmachung nach dem Umwandlungsgesetz\nBayern Amtsgericht München HRB 218686\nAMEET Verlag GmbH – München",
      "type": "Registerbekanntmachung nach dem Umwandlungsgesetz",
      "state": "Bayern",
      "amtsgericht": "Amtsgericht München",
      "registernummer": "HRB 218686",
      "registerart": "HRB",
      "company_name": "AMEET Verlag GmbH",
      "company_seat": "München",
      "details": "24.04.2025 (Bekanntmachungsdatum)\n\nBayern Amtsgericht München HRB 218686\nRegisterbekanntmachung nach dem Umwandlungsgesetz 23.04.2025 (Eintragungsdatum)\n\nAMEET Verlag GmbH\nGesellschaft mit beschränkter Haftung\nMünchen\n\nEs wird darauf hingewiesen, dass ein Verschmelzungsplan oder sein Entwurf über eine grenzüberschreitende Verschmelzung zur Aufnahme mit der Ameet Spółka z ograniczoną odpowiedzialnością mit Sitz in Łódź/Polen (Krajowy Rejestr Sądowy Ameet Spółka z ograniczoną odpowiedzialnością) (spółka z ograniczoną odpowiedzialnością - Gesellschaft mit beschränkter Haftung nach polnischem Recht) beim Handelsregister eingereicht worden ist.\nDie Anteilsinhaber, die Gläubiger sowie die zuständigen Betriebsräte der an der grenzüberschreitenden Verschmelzung beteiligten Gesellschaften oder, soweit es keinen Betriebsrat gibt, die Arbeitnehmer der an der grenzüberschreitenden Verschmelzung beteiligten Gesellschaften, können der jeweiligen Gesellschaft spätestens fünf Arbeitstage vor dem Tag der Gesellschafterversammlung Bemerkungen zum Verschmelzungsplan übermitteln."
    },
    {
      "date": "2025-04-24",
      "id": "107240",
      "original_text": "Einreichung neuer Dokumente\nBayern Amtsgericht Augsburg HRB 2093\nWiest Aktiengesellschaft – Neusäß",
      "type": "Einreichung neuer Dokumente",
      "state": "Bayern",
      "amtsgericht": "Amtsgericht Augsburg",
      "registernummer": "HRB 2093",
      "registerart": "HRB",
      "company_name": "Wiest Aktiengesellschaft",
      "company_seat": "Neusäß",
      "details": "24.04.2025 (Bekanntmachungsdatum)\n\nBayern Amtsgericht Augsburg HRB 2093\nEinreichung neuer Dokumente\n\nWiest Aktiengesellschaft\nAktiengesellschaft\nNeusäß\n\nDem Amtsgericht Augsburg -Registergericht- ist eine Liste der Mitglieder des Aufsichtsrats eingereicht worden, § 106 AktG."
    },
    {
      "date": "2025-04-24",
      "id": "107241",
      "original_text": "Registerbekanntmachung nach dem Umwandlungsgesetz\nBayern Amtsgericht München HRB 110265\nFRISIUS Verwaltungsgesellschaft mbH – München",
      "type": "Registerbekanntmachung nach dem Umwandlungsgesetz",
      "state": "Bayern",
      "amtsgericht": "Amtsgericht München",
      "registernummer": "HRB 110265",
      "registerart": "HRB",
      "company_name": "FRISIUS Verwaltungsgesellschaft mbH",
      "company_seat": "München",
      "details": "24.04.2025 (Bekanntmachungsdatum)\n\nBayern Amtsgericht München HRB 110265\nRegisterbekanntmachung nach dem Umwandlungsgesetz 23.04.2025 (Eintragungsdatum)\n\nFRISIUS Verwaltungsgesellschaft mbH\nGesellschaft mit beschränkter Haftung\nMünchen\n\nDen Gläubigern der an der Verschmelzung beteiligten Rechtsträger ist, wenn sie binnen sechs Monaten nach dem Tag, an dem die Eintragung der Verschmelzung in das Register des Sitzes desjenigen Rechtsträgers, dessen Gläubiger sie sind, nach § 19 Abs. 3 UmwG als bekannt gemacht gilt, ihren Anspruch nach Grund und Höhe in Textform anmelden, Sicherheit zu leisten, soweit sie nicht Befriedigung verlangen können. Dieses Recht steht den Gläubigern jedoch nur zu, wenn sie glaubhaft machen, dass durch die Verschmelzung die Erfüllung ihrer Forderung gefährdet wird."
    },
    {
      "date": "2025-04-24",
      "id": "107242",
      "original_text": "Registerbekanntmachung nach dem Umwandlungsgesetz\nBayern Amtsgericht Traunstein HRB 29241\nRöckl Flachdachbau GmbH – Raubling",
      "type": "Registerbekanntmachung nach dem Umwandlungsgesetz",
      "state": "Bayern",
      "amtsgericht": "Amtsgericht Traunstein",
      "registernummer": "HRB 29241",
      "registerart": "HRB",
      "company_name": "Röckl Flachdachbau GmbH",
      "company_seat": "Raubling",
      "details": "24.04.2025 (Bekanntmachungsdatum)\n\nBayern Amtsgericht Traunstein HRB 29241\nRegisterbekanntmachung nach dem Umwandlungsgesetz 23.04.2025 (Eintragungsdatum)\n\nRöckl Flachdachbau GmbH\nGesellschaft mit beschränkter Haftung\nRaubling\n\nDen Gläubigern der an der Verschmelzung beteiligten Rechtsträger ist, wenn sie binnen sechs Monaten nach dem Tag, an dem die Eintragung der Verschmelzung in das Register des Sitzes desjenigen Rechtsträgers, dessen Gläubiger sie sind, nach § 19 Abs. 3 UmwG als bekannt gemacht gilt, ihren Anspruch nach Grund und Höhe in Textform anmelden, Sicherheit zu leisten, soweit sie nicht Befriedigung verlangen können. Dieses Recht steht den Gläubigern jedoch nur zu, wenn sie glaubhaft machen, dass durch die Verschmelzung die Erfüllung ihrer Forderung gefährdet wird."
    },
    {
      "date": "2025-04-24",
      "id": "107243",
      "original_text": "Löschungsankündigung\nBayern Amtsgericht München HRB 115864\nData Consult GmbH Prof. Schreiber – München",
      "type": "Löschungsankündigung",
      "state": "Bayern",
      "amtsgericht": "Amtsgericht München",
      "registernummer": "HRB 115864",
      "registerart": "HRB",
      "company_name": "Data Consult GmbH Prof. Schreiber",
      "company_seat": "München",
      "details": "24.04.2025 (Bekanntmachungsdatum)\n\nBayern Amtsgericht München HRB 115864\nLöschungsankündigung 23.04.2025 (Eintragungsdatum)\n\nData Consult GmbH Prof. Schreiber\nGesellschaft mit beschränkter Haftung\nMünchen\n\nDas Registergericht beabsichtigt, die im Handelsregister eingetragene Gesellschaft wegen Vermögenslosigkeit von Amts wegen nach § 394 FamFG zu löschen. Die Frist zur Erhebung eines Widerspruchs ist auf drei Monate festgesetzt."
    },
    {
      "date": "2025-04-24",
      "id": "107244",
      "original_text": "Registerbekanntmachung nach dem Umwandlungsgesetz\nBaden-Württemberg Amtsgericht Mannheim HRA 711189\nMaximilian Uhlitzsch e.K. – Mannheim",
      "type": "Registerbekanntmachung nach dem Umwandlungsgesetz",
      "state": "Baden-Württemberg",
      "amtsgericht": "Amtsgericht Mannheim",
      "registernummer": "HRA 711189",
      "registerart": "HRA",
      "company_name": "Maximilian Uhlitzsch e.K.",
      "company_seat": "Mannheim",
      "details": "24.04.2025 (Bekanntmachungsdatum)\n\nBaden-Württemberg Amtsgericht Mannheim HRA 711189\nRegisterbekanntmachung nach dem Umwandlungsgesetz 24.04.2025 (Eintragungsdatum)\n\nMaximilian Uhlitzsch e.K.\nEinzelkaufmann / Einzelkauffrau\nMannheim\n\nAls nicht eingetragen wird bekanntgemacht:\nDen Gläubigern der an der Ausgliederung beteiligten Rechtsträger ist, wenn sie binnen sechs Monaten nach dem Tag, an dem die Eintragung der Ausgliederung in das Register des Sitzes desjenigen Rechtsträgers, dessen Gläubiger sie sind, nach § 19 Abs. 3 UmwG als bekanntgemacht gilt, ihren Anspruch nach Grund und Höhe schriftlich anmelden, Sicherheit zu leisten, soweit sie nicht Befriedigung verlangen können. Dieses Recht steht den Gläubigern jedoch nur zu, wenn sie glaubhaft machen, dass durch die Ausgliederung die Erfüllung ihrer Forderung gefährdet wird."
    },
    {
      "date": "2025-04-24",
      "id": "107245",
      "original_text": "Einreichung neuer Dokumente\nBaden-Württemberg Amtsgericht Mannheim HRB 705372\nTENESO Europe SE – Karlsruhe",
      "type": "Einreichung neuer Dokumente",
      "state": "Baden-Württemberg",
      "amtsgericht": "Amtsgericht Mannheim",
      "registernummer": "HRB 705372",
      "registerart": "HRB",
      "company_name": "TENESO Europe SE",
      "company_seat": "Karlsruhe",
      "details": "24.04.2025 (Bekanntmachungsdatum)\n\nBaden-Württemberg Amtsgericht Mannheim HRB 705372\nEinreichung neuer Dokumente\n\nTENESO Europe SE\nEuropäische Aktiengesellschaft (SE)\nKarlsruhe\n\nDie Gesellschaft hat am 23.04.2025 die Liste über die Zusammensetzung des Aufsichtsrats zum Handelsregister eingereicht."
    },
    {
      "date": "2025-04-24",
      "id": "107246",
      "original_text": "Einreichung neuer Dokumente\nBerlin Amtsgericht Berlin (Charlottenburg) HRB 56655\nDB Engineering & Consulting GmbH – Berlin",
      "type": "Einreichung neuer Dokumente",
      "state": "Berlin",
      "amtsgericht": "Amtsgericht Berlin (Charlottenburg)",
      "registernummer": "HRB 56655",
      "registerart": "HRB",
      "company_name": "DB Engineering & Consulting GmbH",
      "company_seat": "Berlin",
      "details": "24.04.2025 (Bekanntmachungsdatum)\n\nBerlin Amtsgericht Berlin (Charlottenburg) HRB 56655\nEinreichung neuer Dokumente\n\nDB Engineering & Consulting GmbH\nGesellschaft mit beschränkter Haftung\nBerlin\n\nAls nicht eingetragen wird veröffentlicht: Es wurde eine neue Liste der Aufsichtsratsmitglieder eingereicht (§52 GmbHG)."
    },
    {
      "date": "2025-04-24",
      "id": "107247",
      "original_text": "Löschungsankündigung\nSchleswig-Holstein Amtsgericht Pinneberg HRB 18511\nGrand Dienstleistung GmbH – Elmshorn",
      "type": "Löschungsankündigung",
      "state": "Schleswig-Holstein",
      "amtsgericht": "Amtsgericht Pinneberg",
      "registernummer": "HRB 18511",
      "registerart": "HRB",
      "company_name": "Grand Dienstleistung GmbH",
      "company_seat": "Elmshorn",
      "details": "24.04.2025 (Bekanntmachungsdatum)\n\nSchleswig-Holstein Amtsgericht Pinneberg HRB 18511\nLöschungsankündigung\n\nGrand Dienstleistung GmbH\nGesellschaft mit beschränkter Haftung\nElmshorn\n\nEs ist die Löschung der nachstehenden Gesellschaft wegen Vermögenslosigkeit gemäß § 394 FamFG beabsichtigt. Widerspruchsfrist: 2 Monate."
    },
    {
      "date": "2025-04-24",
      "id": "107248",
      "original_text": "Sonstige Registerbekanntmachung\nBaden-Württemberg Amtsgericht Stuttgart HRA 728913\nHLS AG & Co. KG – Metzingen",
      "type": "Sonstige Registerbekanntmachung",
      "state": "Baden-Württemberg",
      "amtsgericht": "Amtsgericht Stuttgart",
      "registernummer": "HRA 728913",
      "registerart": "HRA",
      "company_name": "HLS AG & Co. KG",
      "company_seat": "Metzingen",
      "details": "24.04.2025 (Bekanntmachungsdatum)\n\nBaden-Württemberg Amtsgericht Stuttgart HRA 728913\nSonstige Registerbekanntmachung 24.04.2025 (Eintragungsdatum)\n\nHLS AG & Co. KG\nKommanditgesellschaft\nMetzingen\n\nDurch Beschluss des Amtsgerichts Tübingen vom\n01.12.2023 (1 IN 16/15) ist das Insolvenzverfahren\naufgehoben."
    },
    {
      "date": "2025-04-24",
      "id": "107249",
      "original_text": "Löschungsankündigung\nBrandenburg Amtsgericht Neuruppin HRB 14659\nX2024 Patente UG (haftungsbeschränkt) – Velten",
      "type": "Löschungsankündigung",
      "state": "Brandenburg",
      "amtsgericht": "Amtsgericht Neuruppin",
      "registernummer": "HRB 14659",
      "registerart": "HRB",
      "company_name": "X2024 Patente UG (haftungsbeschränkt)",
      "company_seat": "Velten",
      "details": "24.04.2025 (Bekanntmachungsdatum)\n\nBrandenburg Amtsgericht Neuruppin HRB 14659\nLöschungsankündigung\n\nX2024 Patente UG (haftungsbeschränkt)\nGesellschaft mit beschränkter Haftung\nVelten\n\nBei der nachstehenden Gesellschaft wird das Amtslöschungsverfahren gemäß § 394 FamFG eingeleitet.\nWiderspruchsfrist: 1 Monat"
    },
    {
      "date": "2025-04-24",
      "id": "107250",
      "original_text": "Registerbekanntmachung nach dem Umwandlungsgesetz\nBerlin Amtsgericht Berlin (Charlottenburg) GsR 3107\nFaraj & Faraj Kunstatelier eGbR – Berlin",
      "type": "Registerbekanntmachung nach dem Umwandlungsgesetz",
      "state": "Berlin",
      "amtsgericht": "Amtsgericht Berlin (Charlottenburg)",
      "registernummer": "GsR 3107",
      "registerart": "GsR",
      "company_name": "Faraj & Faraj Kunstatelier eGbR",
      "company_seat": "Berlin",
      "details": "24.04.2025 (Bekanntmachungsdatum)\n\nBerlin Amtsgericht Berlin (Charlottenburg) GsR 3107\nRegisterbekanntmachung nach dem Umwandlungsgesetz 22.04.2025 (Eintragungsdatum)\n\nFaraj & Faraj Kunstatelier eGbR\nGesellschaft bürgerlichen Rechts\nBerlin\n\nZu Eintragungsnummer 3 vom 22.04.2025 wird als nicht eingetragen veröffentlicht: Den Gläubigern ist, wenn sie binnen sechs Monaten nach dem Tag, an dem die Eintragung der Umwandlung als bekannt gemacht gilt, ihren Anspruch nach Grund und Höhe schriftlich anmelden, Sicherheit zu leisten, soweit sie nicht Befriedigung verlangen können. Dieses Recht steht den Gläubigern jedoch nur zu, wenn sie glaubhaft machen, dass durch die Umwandlung die Erfüllung ihrer Forderung gefährdet wird. Das Recht, Sicherheitsleistung zu verlangen, steht Gläubigern nicht zu, die im Falle der Insolvenz ein Recht auf vorzugsweise Befriedigung aus einer Deckungsmasse haben, die nach gesetzlicher Vorschrift zu ihrem Schutz errichtet und staatlich überwacht ist."
    },
    {
      "date": "2025-04-24",
      "id": "107251",
      "original_text": "Einreichung neuer Dokumente\nSachsen-Anhalt Amtsgericht Stendal HRB 5922\nHalloren Schokoladenfabrik Aktiengesellschaft – Halle / Saale",
      "type": "Einreichung neuer Dokumente",
      "state": "Sachsen-Anhalt",
      "amtsgericht": "Amtsgericht Stendal",
      "registernummer": "HRB 5922",
      "registerart": "HRB",
      "company_name": "Halloren Schokoladenfabrik Aktiengesellschaft",
      "company_seat": "Halle / Saale",
      "details": "24.04.2025 (Bekanntmachungsdatum)\n\nSachsen-Anhalt Amtsgericht Stendal HRB 5922\nEinreichung neuer Dokumente\n\nHalloren Schokoladenfabrik Aktiengesellschaft\nAktiengesellschaft\nHalle / Saale\n\nEine Liste der Mitglieder des Aufsichtsrates wurde zum Handelsregister eingereicht."
    },
    {
      "date": "2025-04-24",
      "id": "107252",
      "original_text": "Löschungsankündigung\nBerlin Amtsgericht Berlin (Charlottenburg) HRB 227805\nB+B Bau- und Montageservice GmbH – Berlin",
      "type": "Löschungsankündigung",
      "state": "Berlin",
      "amtsgericht": "Amtsgericht Berlin (Charlottenburg)",
      "registernummer": "HRB 227805",
      "registerart": "HRB",
      "company_name": "B+B Bau- und Montageservice GmbH",
      "company_seat": "Berlin",
      "details": "24.04.2025 (Bekanntmachungsdatum)\n\nBerlin Amtsgericht Berlin (Charlottenburg) HRB 227805\nLöschungsankündigung\n\nB+B Bau- und Montageservice GmbH\nGesellschaft mit beschränkter Haftung\nBerlin\n\nBei der nachstehenden Gesellschaft wird das Amtslöschungsverfahren gemäß § 394 FamFG eingeleitet. Widerspruchsfrist 6 Wochen"
    },
    {
      "date": "2025-04-24",
      "id": "107253",
      "original_text": "Löschungsankündigung\nBerlin Amtsgericht Berlin (Charlottenburg) HRB 105880\nPostado Deutschland GmbH – Berlin",
      "type": "Löschungsankündigung",
      "state": "Berlin",
      "amtsgericht": "Amtsgericht Berlin (Charlottenburg)",
      "registernummer": "HRB 105880",
      "registerart": "HRB",
      "company_name": "Postado Deutschland GmbH",
      "company_seat": "Berlin",
      "details": "24.04.2025 (Bekanntmachungsdatum)\n\nBerlin Amtsgericht Berlin (Charlottenburg) HRB 105880\nLöschungsankündigung\n\nPostado Deutschland GmbH\nGesellschaft mit beschränkter Haftung\nBerlin\n\nBei der nachstehenden Gesellschaft wird das Amtslöschungsverfahren gemäß § 394 FamFG eingeleitet. Widerspruchsfrist 6 Wochen"
    },
    {
      "date": "2025-04-24",
      "id": "107254",
      "original_text": "Registerbekanntmachung nach dem Umwandlungsgesetz\nBaden-Württemberg Amtsgericht Freiburg HRB 720243\nconsus infratech GmbH – Freiburg im Breisgau",
      "type": "Registerbekanntmachung nach dem Umwandlungsgesetz",
      "state": "Baden-Württemberg",
      "amtsgericht": "Amtsgericht Freiburg",
      "registernummer": "HRB 720243",
      "registerart": "HRB",
      "company_name": "consus infratech GmbH",
      "company_seat": "Freiburg im Breisgau",
      "details": "24.04.2025 (Bekanntmachungsdatum)\n\nBaden-Württemberg Amtsgericht Freiburg HRB 720243\nRegisterbekanntmachung nach dem Umwandlungsgesetz 24.04.2025 (Eintragungsdatum)\n\nconsus infratech GmbH\nGesellschaft mit beschränkter Haftung\nFreiburg im Breisgau\n\nAls nicht eingetragen wird bekanntgemacht:\nDen Gläubigern der an der Verschmelzung beteiligten Rechtsträger ist, wenn sie binnen sechs Monaten nach dem Tag, an dem die Eintragung der Verschmelzung in das Register des Sitzes desjenigen Rechtsträgers, dessen Gläubiger sie sind, nach § 19 Abs. 3 UmwG als bekanntgemacht gilt, ihren Anspruch nach Grund und Höhe schriftlich anmelden, Sicherheit zu leisten, soweit sie nicht Befriedigung verlangen können. Dieses Recht steht den Gläubigern jedoch nur zu, wenn sie glaubhaft machen, dass durch die Verschmelzung die Erfüllung ihrer Forderung gefährdet wird."
    },
    {
      "date": "2025-04-24",
      "id": "107255",
      "original_text": "Registerbekanntmachung nach dem Umwandlungsgesetz\nBaden-Württemberg Amtsgericht Freiburg HRB 713958\nconsus.health GmbH – Freiburg im Breisgau",
      "type": "Registerbekanntmachung nach dem Umwandlungsgesetz",
      "state": "Baden-Württemberg",
      "amtsgericht": "Amtsgericht Freiburg",
      "registernummer": "HRB 713958",
      "registerart": "HRB",
      "company_name": "consus.health GmbH",
      "company_seat": "Freiburg im Breisgau",
      "details": "24.04.2025 (Bekanntmachungsdatum)\n\nBaden-Württemberg Amtsgericht Freiburg HRB 713958\nRegisterbekanntmachung nach dem Umwandlungsgesetz 24.04.2025 (Eintragungsdatum)\n\nconsus.health GmbH\nGesellschaft mit beschränkter Haftung\nFreiburg im Breisgau\n\nDie \"consus infratech GmbH\" (Amtsgericht Freiburg, HRB 720243) ist durch Vertrag und Beschluss vom 22.04.2025 auf diese Gesellschaft zur Aufnahme verschmolzen. Den Gläubigern der an der Verschmelzung beteiligten Rechtsträger ist, wenn sie binnen sechs Monaten nach dem Tag, an dem die Eintragung der Verschmelzung in das Register des Sitzes desjenigen Rechtsträgers, dessen Gläubiger sie sind, nach § 19 Abs. 3 UmwG als bekanntgemacht gilt, ihren Anspruch nach Grund und Höhe schriftlich anmelden, Sicherheit zu leisten, soweit sie nicht Befriedigung verlangen können. Dieses Recht steht den Gläubigern jedoch nur zu, wenn sie glaubhaft machen, dass durch die Verschmelzung die Erfüllung ihrer Forderung gefährdet wird."
    },
    {
      "date": "2025-04-24",
      "id": "107256",
      "original_text": "Registerbekanntmachung nach dem Umwandlungsgesetz\nBaden-Württemberg Amtsgericht Stuttgart HRB 787134\nAUDERE KiTa Solutions GmbH – Fellbach",
      "type": "Registerbekanntmachung nach dem Umwandlungsgesetz",
      "state": "Baden-Württemberg",
      "amtsgericht": "Amtsgericht Stuttgart",
      "registernummer": "HRB 787134",
      "registerart": "HRB",
      "company_name": "AUDERE KiTa Solutions GmbH",
      "company_seat": "Fellbach",
      "details": "24.04.2025 (Bekanntmachungsdatum)\n\nBaden-Württemberg Amtsgericht Stuttgart HRB 787134\nRegisterbekanntmachung nach dem Umwandlungsgesetz 24.04.2025 (Eintragungsdatum)\n\nAUDERE KiTa Solutions GmbH\nGesellschaft mit beschränkter Haftung\nFellbach\n\nAls nicht eingetragen wird bekanntgemacht:\nDen Gläubigern der an der Verschmelzung beteiligten Rechtsträger ist, wenn sie binnen sechs Monaten nach dem Tag, an dem die Eintragung der Verschmelzung in das Register des Sitzes desjenigen Rechtsträgers, dessen Gläubiger sie sind, nach § 19 Abs. 3 UmwG als bekanntgemacht gilt, ihren Anspruch nach Grund und Höhe schriftlich anmelden, Sicherheit zu leisten, soweit sie nicht Befriedigung verlangen können. Dieses Recht steht den Gläubigern jedoch nur zu, wenn sie glaubhaft machen, dass durch die Verschmelzung die Erfüllung ihrer Forderung gefährdet wird."
    },
    {
      "date": "2025-04-24",
      "id": "107257",
      "original_text": "Registerbekanntmachung nach dem Umwandlungsgesetz\nBaden-Württemberg Amtsgericht Stuttgart HRB 778267\nPlaza Group Betriebsgesellschaft TI GmbH – Heilbronn",
      "type": "Registerbekanntmachung nach dem Umwandlungsgesetz",
      "state": "Baden-Württemberg",
      "amtsgericht": "Amtsgericht Stuttgart",
      "registernummer": "HRB 778267",
      "registerart": "HRB",
      "company_name": "Plaza Group Betriebsgesellschaft TI GmbH",
      "company_seat": "Heilbronn",
      "details": "24.04.2025 (Bekanntmachungsdatum)\n\nBaden-Württemberg Amtsgericht Stuttgart HRB 778267\nRegisterbekanntmachung nach dem Umwandlungsgesetz 24.04.2025 (Eintragungsdatum)\n\nPlaza Group Betriebsgesellschaft TI GmbH\nGesellschaft mit beschränkter Haftung\nHeilbronn\n\nDen Gläubigern der an der Verschmelzung beteiligten Rechtsträger ist, wenn sie binnen sechs Monaten nach dem Tag, an dem die Eintragung der Verschmelzung in das Register des Sitzes desjenigen Rechtsträgers, dessen Gläubiger sie sind, nach § 19 Abs. 3 UmwG als bekanntgemacht gilt, ihren Anspruch nach Grund und Höhe schriftlich anmelden, Sicherheit zu leisten, soweit sie nicht Befriedigung verlangen können. Dieses Recht steht den Gläubigern jedoch nur zu, wenn sie glaubhaft machen, dass durch die Verschmelzung die Erfüllung ihrer Forderung gefährdet wird."
    },
    {
      "date": "2025-04-24",
      "id": "107258",
      "original_text": "Registerbekanntmachung nach dem Umwandlungsgesetz\nHamburg Amtsgericht Hamburg HRB 62761\nOTTO-CHEER Beteiligungs-Verwaltungsgesellschaft mbH – Hamburg",
      "type": "Registerbekanntmachung nach dem Umwandlungsgesetz",
      "state": "Hamburg",
      "amtsgericht": "Amtsgericht Hamburg",
      "registernummer": "HRB 62761",
      "registerart": "HRB",
      "company_name": "OTTO-CHEER Beteiligungs-Verwaltungsgesellschaft mbH",
      "company_seat": "Hamburg",
      "details": "24.04.2025 (Bekanntmachungsdatum)\n\nHamburg Amtsgericht Hamburg HRB 62761\nRegisterbekanntmachung nach dem Umwandlungsgesetz 23.04.2025 (Eintragungsdatum)\n\nOTTO-CHEER Beteiligungs-Verwaltungsgesellschaft mbH\nGesellschaft mit beschränkter Haftung\nHamburg\n\nAls nicht eingetragen wird bekannt gemacht:\nDen Gläubigern der an der Verschmelzung beteiligten Gesellschaften ist, wenn sie binnen sechs Monaten nach dem Tag, an dem die Eintragung der Verschmelzung in das Register des Sitzes desjenigen Rechtsträgers, dessen Gläubiger sie sind, nach § 19 Absatz 3 UmwG als bekannt gemacht gilt, ihren Anspruch nach Grund und Höhe schriftlich anmelden, Sicherheit zu leisten, soweit sie nicht Befriedigung verlangen können. Dieses Recht steht den Gläubigern jedoch nur zu, wenn sie glaubhaft machen, dass durch die Verschmelzung die Erfüllung ihrer Forderung gefährdet wird."
    },
    {
      "date": "2025-04-24",
      "id": "107259",
      "original_text": "Löschungsankündigung\nBerlin Amtsgericht Berlin (Charlottenburg) HRB 215721\nIM-CAB Taxi GmbH – Berlin",
      "type": "Löschungsankündigung",
      "state": "Berlin",
      "amtsgericht": "Amtsgericht Berlin (Charlottenburg)",
      "registernummer": "HRB 215721",
      "registerart": "HRB",
      "company_name": "IM-CAB Taxi GmbH",
      "company_seat": "Berlin",
      "details": "24.04.2025 (Bekanntmachungsdatum)\n\nBerlin Amtsgericht Berlin (Charlottenburg) HRB 215721\nLöschungsankündigung\n\nIM-CAB Taxi GmbH\nGesellschaft mit beschränkter Haftung\nBerlin\n\nBei der nachstehenden Gesellschaft wird das Amtslöschungsverfahren gemäß § 394 FamFG eingeleitet. Widerspruchsfrist 6 Wochen"
    },
    {
      "date": "2025-04-24",
      "id": "107260",
      "original_text": "Löschungsankündigung\nBerlin Amtsgericht Berlin (Charlottenburg) HRB 257705\nGalant Modern Living UG (haftungsbeschränkt) – Berlin",
      "type": "Löschungsankündigung",
      "state": "Berlin",
      "amtsgericht": "Amtsgericht Berlin (Charlottenburg)",
      "registernummer": "HRB 257705",
      "registerart": "HRB",
      "company_name": "Galant Modern Living UG (haftungsbeschränkt)",
      "company_seat": "Berlin",
      "details": "24.04.2025 (Bekanntmachungsdatum)\n\nBerlin Amtsgericht Berlin (Charlottenburg) HRB 257705\nLöschungsankündigung\n\nGalant Modern Living UG (haftungsbeschränkt)\nGesellschaft mit beschränkter Haftung\nBerlin\n\nBei der nachstehenden Gesellschaft wird das Amtslöschungsverfahren gemäß § 394 FamFG eingeleitet. Widerspruchsfrist 6 Wochen"
    },
    {
      "date": "2025-04-24",
      "id": "107261",
      "original_text": "Einreichung neuer Dokumente\nHamburg Amtsgericht Hamburg HRB 11168\nSTILL Gesellschaft mit beschränkter Haftung – Hamburg",
      "type": "Einreichung neuer Dokumente",
      "state": "Hamburg",
      "amtsgericht": "Amtsgericht Hamburg",
      "registernummer": "HRB 11168",
      "registerart": "HRB",
      "company_name": "STILL Gesellschaft mit beschränkter Haftung",
      "company_seat": "Hamburg",
      "details": "24.04.2025 (Bekanntmachungsdatum)\n\nHamburg Amtsgericht Hamburg HRB 11168\nEinreichung neuer Dokumente\n\nSTILL Gesellschaft mit beschränkter Haftung\nGesellschaft mit beschränkter Haftung\nHamburg\n\nAls nicht eingetragen wird bekannt gemacht: Liste des Aufsichtsrats wurde eingereicht."
    },
    {
      "date": "2025-04-24",
      "id": "107262",
      "original_text": "Registerbekanntmachung nach dem Umwandlungsgesetz\nBrandenburg Amtsgericht Potsdam HRB 25282\nSolarpark Anton-Saefkow-Allee GmbH – Brandenburg an der Havel",
      "type": "Registerbekanntmachung nach dem Umwandlungsgesetz",
      "state": "Brandenburg",
      "amtsgericht": "Amtsgericht Potsdam",
      "registernummer": "HRB 25282",
      "registerart": "HRB",
      "company_name": "Solarpark Anton-Saefkow-Allee GmbH",
      "company_seat": "Brandenburg an der Havel",
      "details": "24.04.2025 (Bekanntmachungsdatum)\n\nBrandenburg Amtsgericht Potsdam HRB 25282\nRegisterbekanntmachung nach dem Umwandlungsgesetz 07.04.2025 (Eintragungsdatum)\n\nSolarpark Anton-Saefkow-Allee GmbH\nGesellschaft mit beschränkter Haftung\nBrandenburg an der Havel\n\nZu Eintragungsnummer 5 vom 07.04.2025 wird als nicht eingetragen veröffentlicht:\nDer andere Vertragsteil hat den Gläubigern dieses Rechtsträgers, dessen Forderungen begründet worden sind, bevor die Eintragung der Beendigung dieses Vertrages in das Handelsregister nach § 10 des Handelsgesetzbuches als bekannt gemacht gilt, Sicherheit zu leisten, wenn sie sich binnen sechs Monaten nach der Bekanntmachung der Eintragung zu diesem Zweck bei ihm melden"
    },
    {
      "date": "2025-04-24",
      "id": "107263",
      "original_text": "Löschungsankündigung\nBerlin Amtsgericht Berlin (Charlottenburg) HRB 153050\nVR-Trailer UG (haftungsbeschränkt) – Berlin",
      "type": "Löschungsankündigung",
      "state": "Berlin",
      "amtsgericht": "Amtsgericht Berlin (Charlottenburg)",
      "registernummer": "HRB 153050",
      "registerart": "HRB",
      "company_name": "VR-Trailer UG (haftungsbeschränkt)",
      "company_seat": "Berlin",
      "details": "24.04.2025 (Bekanntmachungsdatum)\n\nBerlin Amtsgericht Berlin (Charlottenburg) HRB 153050\nLöschungsankündigung\n\nVR-Trailer UG (haftungsbeschränkt)\nGesellschaft mit beschränkter Haftung\nBerlin\n\nBei der nachstehenden Gesellschaft wird das Amtslöschungsverfahren gemäß § 394 FamFG eingeleitet. Widerspruchsfrist 6 Wochen"
    },
    {
      "date": "2025-04-24",
      "id": "107264",
      "original_text": "Registerbekanntmachung nach dem Umwandlungsgesetz\nBaden-Württemberg Amtsgericht Stuttgart HRB 780474\nPlaza Group Real A Betriebsgesellschaft mbH – Heilbronn",
      "type": "Registerbekanntmachung nach dem Umwandlungsgesetz",
      "state": "Baden-Württemberg",
      "amtsgericht": "Amtsgericht Stuttgart",
      "registernummer": "HRB 780474",
      "registerart": "HRB",
      "company_name": "Plaza Group Real A Betriebsgesellschaft mbH",
      "company_seat": "Heilbronn",
      "details": "24.04.2025 (Bekanntmachungsdatum)\n\nBaden-Württemberg Amtsgericht Stuttgart HRB 780474\nRegisterbekanntmachung nach dem Umwandlungsgesetz 24.04.2025 (Eintragungsdatum)\n\nPlaza Group Real A Betriebsgesellschaft mbH\nGesellschaft mit beschränkter Haftung\nHeilbronn\n\nDen Gläubigern der an der Verschmelzung beteiligten Rechtsträger ist, wenn sie binnen sechs Monaten nach dem Tag, an dem die Eintragung der Verschmelzung in das Register des Sitzes desjenigen Rechtsträgers, dessen Gläubiger sie sind, nach § 19 Abs. 3 UmwG als bekanntgemacht gilt, ihren Anspruch nach Grund und Höhe schriftlich anmelden, Sicherheit zu leisten, soweit sie nicht Befriedigung verlangen können. Dieses Recht steht den Gläubigern jedoch nur zu, wenn sie glaubhaft machen, dass durch die Verschmelzung die Erfüllung ihrer Forderung gefährdet wird."
    },
    {
      "date": "2025-04-24",
      "id": "107265",
      "original_text": "Registerbekanntmachung nach dem Umwandlungsgesetz\nSachsen-Anhalt Amtsgericht Stendal HRB 35799\nRadiologie Mansfelder Land MVZ GmbH – Hettstedt",
      "type": "Registerbekanntmachung nach dem Umwandlungsgesetz",
      "state": "Sachsen-Anhalt",
      "amtsgericht": "Amtsgericht Stendal",
      "registernummer": "HRB 35799",
      "registerart": "HRB",
      "company_name": "Radiologie Mansfelder Land MVZ GmbH",
      "company_seat": "Hettstedt",
      "details": "24.04.2025 (Bekanntmachungsdatum)\n\nSachsen-Anhalt Amtsgericht Stendal HRB 35799\nRegisterbekanntmachung nach dem Umwandlungsgesetz 24.04.2025 (Eintragungsdatum)\n\nRadiologie Mansfelder Land MVZ GmbH\nGesellschaft mit beschränkter Haftung\nHettstedt\n\nEntstanden durch formwechselnde Umwandlung der Partnerschaftsgesellschaft Radiologisches Zentrum Mansfelder Land Dipl. med. Dietmar Handro, Henning Mingramm und Lutz Müller Ärztepartnergesellschaft mit dem Sitz in Hettstedt (Amtsgericht Stendal PR 323). Nicht eingetragen: Den Gläubigern des formwechselnden  Rechtsträgers, ist wenn sie binnen sechs Monaten nach dem Tag, an dem die Eintragung des Formwechsels nach § 201 UmwG als bekanntgemacht gilt, ihren Anspruch nach Grund und Höhe schriftlich anmelden, Sicherheit zu leisten, soweit sie nicht Befriedigung verlangen können. Dieses Recht steht ihnen jedoch nur zu, wenn sie glaubhaft machen, dass durch den Formwechsel die Erfüllung ihrer Forderung gefährdet wird."
    },
    {
      "date": "2025-04-24",
      "id": "107266",
      "original_text": "Registerbekanntmachung nach dem Umwandlungsgesetz\nSchleswig-Holstein Amtsgericht Lübeck HRB 3930 AH\nedding International GmbH – Ahrensburg",
      "type": "Registerbekanntmachung nach dem Umwandlungsgesetz",
      "state": "Schleswig-Holstein",
      "amtsgericht": "Amtsgericht Lübeck",
      "registernummer": "HRB 3930 AH",
      "registerart": "HRB",
      "company_name": "edding International GmbH",
      "company_seat": "Ahrensburg",
      "details": "24.04.2025 (Bekanntmachungsdatum)\n\nSchleswig-Holstein Amtsgericht Lübeck HRB 3930 AH\nRegisterbekanntmachung nach dem Umwandlungsgesetz 23.04.2025 (Eintragungsdatum)\n\nedding International GmbH\nGesellschaft mit beschränkter Haftung\nAhrensburg\n\nZu Eintragungsnummer 48 vom 23.04.2025 wird als nicht eingetragen veröffentlicht:  Den Gläubigern der an der Verschmelzung beteiligten Rechtsträger ist, wenn sie binnen sechs Monaten nach dem Tag, an dem die Eintragung der Verschmelzung in das Register des Sitzes desjenigen Rechtsträgers, dessen Gläubiger sie sind, als bekannt gemacht gilt, ihren Anspruch nach Grund und Höhe schriftlich anmelden, Sicherheit zu leisten, soweit sie nicht Befriedigung verlangen können. Dieses Recht steht den Gläubigern jedoch nur zu, wenn sie glaubhaft machen, dass durch die Verschmelzung die Erfüllung ihrer Forderung gefährdet wird."
    },
    {
      "date": "2025-04-24",
      "id": "107267",
      "original_text": "Registerbekanntmachung nach dem Umwandlungsgesetz\nSachsen-Anhalt Amtsgericht Stendal PR 323\nPartnerschaftsgesellschaft Radiologisches Zentrum Mansfelder Land Dipl. med. Dietmar Handro, Henning Mingramm und Lutz Müller Ärztepartnergesellschaft – Hettstedt",
      "type": "Registerbekanntmachung nach dem Umwandlungsgesetz",
      "state": "Sachsen-Anhalt",
      "amtsgericht": "Amtsgericht Stendal",
      "registernummer": "PR 323",
      "registerart": "PR",
      "company_name": "Partnerschaftsgesellschaft Radiologisches Zentrum Mansfelder Land Dipl. med. Dietmar Handro, Henning Mingramm und Lutz Müller Ärztepartnergesellschaft",
      "company_seat": "Hettstedt",
      "details": "24.04.2025 (Bekanntmachungsdatum)\n\nSachsen-Anhalt Amtsgericht Stendal PR 323\nRegisterbekanntmachung nach dem Umwandlungsgesetz 24.04.2025 (Eintragungsdatum)\n\nPartnerschaftsgesellschaft Radiologisches Zentrum Mansfelder Land Dipl. med. Dietmar Handro, Henning Mingramm und Lutz Müller Ärztepartnergesellschaft\nPartnerschaftsgesellschaft\nHettstedt\n\nNicht eingetragen:\nDen Gläubigern des formwechselnden  Rechtsträgers, ist wenn sie binnen sechs Monaten nach dem Tag, an dem die Eintragung des Formwechsels nach § 201 UmwG als bekanntgemacht gilt, ihren Anspruch nach Grund und Höhe schriftlich anmelden, Sicherheit zu leisten, soweit sie nicht Befriedigung verlangen können. Dieses Recht steht ihnen jedoch nur zu, wenn sie glaubhaft machen, dass durch den Formwechsel die Erfüllung ihrer Forderung gefährdet wird."
    },
    {
      "date": "2025-04-24",
      "id": "107268",
      "original_text": "Löschungsankündigung\nBerlin Amtsgericht Berlin (Charlottenburg) HRB 222059\nHN Electrical Solutions GER GmbH – Berlin",
      "type": "Löschungsankündigung",
      "state": "Berlin",
      "amtsgericht": "Amtsgericht Berlin (Charlottenburg)",
      "registernummer": "HRB 222059",
      "registerart": "HRB",
      "company_name": "HN Electrical Solutions GER GmbH",
      "company_seat": "Berlin",
      "details": "24.04.2025 (Bekanntmachungsdatum)\n\nBerlin Amtsgericht Berlin (Charlottenburg) HRB 222059\nLöschungsankündigung\n\nHN Electrical Solutions GER GmbH\nGesellschaft mit beschränkter Haftung\nBerlin\n\nBei der nachstehenden Gesellschaft wird das Amtslöschungsverfahren gemäß § 394 FamFG eingeleitet. Widerspruchsfrist 6 Wochen"
    },
    {
      "date": "2025-04-24",
      "id": "107269",
      "original_text": "Registerbekanntmachung nach dem Umwandlungsgesetz\nSachsen-Anhalt Amtsgericht Stendal HRB 22328\nLive.on UG (haftungsbeschränkt) – Staßfurt",
      "type": "Registerbekanntmachung nach dem Umwandlungsgesetz",
      "state": "Sachsen-Anhalt",
      "amtsgericht": "Amtsgericht Stendal",
      "registernummer": "HRB 22328",
      "registerart": "HRB",
      "company_name": "Live.on UG (haftungsbeschränkt)",
      "company_seat": "Staßfurt",
      "details": "24.04.2025 (Bekanntmachungsdatum)\n\nSachsen-Anhalt Amtsgericht Stendal HRB 22328\nRegisterbekanntmachung nach dem Umwandlungsgesetz 24.04.2025 (Eintragungsdatum)\n\nLive.on UG (haftungsbeschränkt)\nGesellschaft mit beschränkter Haftung\nStaßfurt\n\nDie Gesellschaft ist auf Grund des Verschmelzungsvertrages vom 18.03.2025 sowie der Beschlüsse der Gesellschafterversammlungen vom selben Tag mit der NOMOS Capital GmbH mit dem Sitz in Staßfurt (Amtsgericht Stendal HRB 17565) verschmolzen. Die Verschmelzung ist mit der Eintragung der Verschmelzung in das Handelsregister der übernehmenden Gesellschaft am 24.04.2025 wirksam geworden.Nicht eingetragen: Den Gläubigern der an der Verschmelzung beteiligten Rechtsträger ist, wenn sie binnen sechs Monaten nach dem Tag, an dem die Eintragung der Verschmelzung nach § 19 Abs. 3 UmwG als bekanntgemacht gilt, ihren Anspruch nach Grund und Höhe schriftlich anmelden, Sicherheit zu leisten, soweit sie nicht Befriedigung verlangen können. Dieses Recht steht ihnen jedoch nur zu, wenn sie glaubhaft machen, dass durch die Verschmelzung die Erfüllung ihrer Forderung gefährdet wird."
    },
    {
      "date": "2025-04-24",
      "id": "107270",
      "original_text": "Registerbekanntmachung nach dem Umwandlungsgesetz\nSachsen-Anhalt Amtsgericht Stendal HRB 17565\nNOMOS Capital GMBH – Staßfurt",
      "type": "Registerbekanntmachung nach dem Umwandlungsgesetz",
      "state": "Sachsen-Anhalt",
      "amtsgericht": "Amtsgericht Stendal",
      "registernummer": "HRB 17565",
      "registerart": "HRB",
      "company_name": "NOMOS Capital GMBH",
      "company_seat": "Staßfurt",
      "details": "24.04.2025 (Bekanntmachungsdatum)\n\nSachsen-Anhalt Amtsgericht Stendal HRB 17565\nRegisterbekanntmachung nach dem Umwandlungsgesetz 24.04.2025 (Eintragungsdatum)\n\nNOMOS Capital GMBH\nGesellschaft mit beschränkter Haftung\nStaßfurt\n\nDie Live.on UG (haftungsbeschränkt) mit dem Sitz in Staßfurt (Amtsgericht Stendal HRB 22328) ist auf Grund des Verschmelzungsvertrages vom 18.03.2025 und der Beschlüsse der Gesellschafterversammlungen vom selben Tag mit der Gesellschaft verschmolzen.Nicht eingetragen: Den Gläubigern der an der Verschmelzung beteiligten Rechtsträger ist, wenn sie binnen sechs Monaten nach dem Tag, an dem die Eintragung der Verschmelzung nach § 19 Abs. 3 UmwG als bekanntgemacht gilt, ihren Anspruch nach Grund und Höhe schriftlich anmelden, Sicherheit zu leisten, soweit sie nicht Befriedigung verlangen können. Dieses Recht steht ihnen jedoch nur zu, wenn sie glaubhaft machen, dass durch die Verschmelzung die Erfüllung ihrer Forderung gefährdet wird."
    },
    {
      "date": "2025-04-24",
      "id": "107271",
      "original_text": "Registerbekanntmachung nach dem Umwandlungsgesetz\nSchleswig-Holstein Amtsgericht Lübeck HRB 25429\nLEUCHTTURM1917 GmbH – Geesthacht",
      "type": "Registerbekanntmachung nach dem Umwandlungsgesetz",
      "state": "Schleswig-Holstein",
      "amtsgericht": "Amtsgericht Lübeck",
      "registernummer": "HRB 25429",
      "registerart": "HRB",
      "company_name": "LEUCHTTURM1917 GmbH",
      "company_seat": "Geesthacht",
      "details": "24.04.2025 (Bekanntmachungsdatum)\n\nSchleswig-Holstein Amtsgericht Lübeck HRB 25429\nRegisterbekanntmachung nach dem Umwandlungsgesetz 23.04.2025 (Eintragungsdatum)\n\nLEUCHTTURM1917 GmbH\nGesellschaft mit beschränkter Haftung\nGeesthacht\n\nZu Eintragungsnummer 4 vom 23.04.2025 wird als nicht eingetragen veröffentlicht: Den Gläubigern der an der Ausgliederung beteiligten Rechtsträger ist, wenn sie binnen sechs Monaten nach dem Tag, an dem die Eintragung der Ausgliederung in das Register des Sitzes desjenigen Rechtsträgers, dessen Gläubiger sie sind, als bekannt gemacht gilt, ihren Anspruch nach Grund und Höhe schriftlich anmelden, Sicherheit zu leisten, soweit sie nicht Befriedigung verlangen können. Dieses Recht steht den Gläubigern jedoch nur zu, wenn sie glaubhaft machen, dass durch die Ausgliederung die Erfüllung ihrer Forderung gefährdet wird."
    },
    {
      "date": "2025-04-24",
      "id": "107272",
      "original_text": "Registerbekanntmachung nach dem Umwandlungsgesetz\nSchleswig-Holstein Amtsgericht Lübeck HRA 6 GE\nLeuchtturm Gruppe GmbH & Co. KG – Geesthacht",
      "type": "Registerbekanntmachung nach dem Umwandlungsgesetz",
      "state": "Schleswig-Holstein",
      "amtsgericht": "Amtsgericht Lübeck",
      "registernummer": "HRA 6 GE",
      "registerart": "HRA",
      "company_name": "Leuchtturm Gruppe GmbH & Co. KG",
      "company_seat": "Geesthacht",
      "details": "24.04.2025 (Bekanntmachungsdatum)\n\nSchleswig-Holstein Amtsgericht Lübeck HRA 6 GE\nRegisterbekanntmachung nach dem Umwandlungsgesetz 23.04.2025 (Eintragungsdatum)\n\nLeuchtturm Gruppe GmbH & Co. KG\nKommanditgesellschaft\nGeesthacht\n\nZu Eintragungsnummer 30 vom 23.04.2025 wird als nicht eingetragen veröffentlicht:  Den Gläubigern der an der Ausgliederung beteiligten Rechtsträger ist, wenn sie binnen sechs Monaten nach dem Tag, an dem die Eintragung der Ausgliederung in das Register des Sitzes desjenigen Rechtsträgers, dessen Gläubiger sie sind, als bekannt gemacht gilt, ihren Anspruch nach Grund und Höhe schriftlich anmelden, Sicherheit zu leisten, soweit sie nicht Befriedigung verlangen können. Dieses Recht steht den Gläubigern jedoch nur zu, wenn sie glaubhaft machen, dass durch die Ausgliederung die Erfüllung ihrer Forderung gefährdet wird."
    },
    {
      "date": "2025-04-24",
      "id": "107273",
      "original_text": "Einreichung neuer Dokumente\nBrandenburg Amtsgericht Potsdam HRB 1574\nGemeindliche Wohnungsgesellschaft Kleinmachnow mbh -gewog- – Kleinmachnow",
      "type": "Einreichung neuer Dokumente",
      "state": "Brandenburg",
      "amtsgericht": "Amtsgericht Potsdam",
      "registernummer": "HRB 1574",
      "registerart": "HRB",
      "company_name": "Gemeindliche Wohnungsgesellschaft Kleinmachnow mbh -gewog-",
      "company_seat": "Kleinmachnow",
      "details": "24.04.2025 (Bekanntmachungsdatum)\n\nBrandenburg Amtsgericht Potsdam HRB 1574\nEinreichung neuer Dokumente\n\nGemeindliche Wohnungsgesellschaft Kleinmachnow mbh -gewog-\nGesellschaft mit beschränkter Haftung\nKleinmachnow\n\nAls nicht eingetragen wird veröffentlicht: Eine Liste der Mitglieder des Aufsichtsrates wurde zum Handelsregister eingereicht."
    },
    {
      "date": "2025-04-24",
      "id": "107274",
      "original_text": "Registerbekanntmachung nach dem Umwandlungsgesetz\nBaden-Württemberg Amtsgericht Stuttgart HRB 739501\nmo-tech GmbH – Filderstadt",
      "type": "Registerbekanntmachung nach dem Umwandlungsgesetz",
      "state": "Baden-Württemberg",
      "amtsgericht": "Amtsgericht Stuttgart",
      "registernummer": "HRB 739501",
      "registerart": "HRB",
      "company_name": "mo-tech GmbH",
      "company_seat": "Filderstadt",
      "details": "24.04.2025 (Bekanntmachungsdatum)\n\nBaden-Württemberg Amtsgericht Stuttgart HRB 739501\nRegisterbekanntmachung nach dem Umwandlungsgesetz 24.04.2025 (Eintragungsdatum)\n\nmo-tech GmbH\nGesellschaft mit beschränkter Haftung\nFilderstadt\n\nAls nicht eingetragen wird bekanntgemacht:\nDen Gläubigern der an der Verschmelzung beteiligten Rechtsträger ist, wenn sie binnen sechs Monaten nach dem Tag, an dem die Eintragung der Verschmelzung in das Register des Sitzes desjenigen Rechtsträgers, dessen Gläubiger sie sind, nach § 19 Abs. 3 UmwG als bekanntgemacht gilt, ihren Anspruch nach Grund und Höhe schriftlich anmelden, Sicherheit zu leisten, soweit sie nicht Befriedigung verlangen können. Dieses Recht steht den Gläubigern jedoch nur zu, wenn sie glaubhaft machen, dass durch die Verschmelzung die Erfüllung ihrer Forderung gefährdet wird."
    },
    {
      "date": "2025-04-24",
      "id": "107275",
      "original_text": "Registerbekanntmachung nach dem Umwandlungsgesetz\nMecklenburg-Vorpommern Amtsgericht Neubrandenburg HRB 10194 früher Amtsgericht Stralsund\nLandtechnik-Maschinenbau-Handel Gesellschaft mit beschränkter Haftung LAMAHA – Anklam",
      "type": "Registerbekanntmachung nach dem Umwandlungsgesetz",
      "state": "Mecklenburg-Vorpommern",
      "amtsgericht": "Amtsgericht Neubrandenburg",
      "registernummer": "HRB 10194",
      "registerart": "HRB",
      "company_name": "Landtechnik-Maschinenbau-Handel Gesellschaft mit beschränkter Haftung LAMAHA",
      "company_seat": "Anklam",
      "former_amtsgericht": "Stralsund",
      "details": "24.04.2025 (Bekanntmachungsdatum)\n\nMecklenburg-Vorpommern Amtsgericht Neubrandenburg HRB 10194 früher Amtsgericht Stralsund\nRegisterbekanntmachung nach dem Umwandlungsgesetz 24.04.2025 (Eintragungsdatum)\n\nLandtechnik-Maschinenbau-Handel Gesellschaft mit beschränkter Haftung LAMAHA\nGesellschaft mit beschränkter Haftung\nAnklam\n\nAls nicht eingetragen wird veröffentlicht: Den Gläubigern der an der Verschmelzung beteiligten Rechtsträger ist, wenn sie binnen sechs Monaten nach dem Tag, an dem die Eintragung der Verschmelzung in das Register des Sitzes desjenigen Rechtsträgers, dessen Gläubiger sie sind, nach § 19 Abs. 3 UmwG als bekannt gemacht gilt,\nihren Anspruch nach Grund und Höhe in Textform anmelden, Sicherheit zu leisten, soweit sie nicht Befriedigung verlangen können. Dieses Recht steht den Gläubigern jedoch nur zu, wenn sie glaubhaft machen, dass durch die Verschmelzung die Erfüllung der Forderung gefährdet wird."
    },
    {
      "date": "2025-04-24",
      "id": "107276",
      "original_text": "Registerbekanntmachung nach dem Umwandlungsgesetz\nBaden-Württemberg Amtsgericht Stuttgart HRB 789010\nDigital Transformation & Investment (DTI) GmbH – Leonberg",
      "type": "Registerbekanntmachung nach dem Umwandlungsgesetz",
      "state": "Baden-Württemberg",
      "amtsgericht": "Amtsgericht Stuttgart",
      "registernummer": "HRB 789010",
      "registerart": "HRB",
      "company_name": "Digital Transformation & Investment (DTI) GmbH",
      "company_seat": "Leonberg",
      "details": "24.04.2025 (Bekanntmachungsdatum)\n\nBaden-Württemberg Amtsgericht Stuttgart HRB 789010\nRegisterbekanntmachung nach dem Umwandlungsgesetz 24.04.2025 (Eintragungsdatum)\n\nDigital Transformation & Investment (DTI) GmbH\nGesellschaft mit beschränkter Haftung\nLeonberg\n\nDen Gläubigern der an der Verschmelzung beteiligten Rechtsträger ist, wenn sie binnen sechs Monaten nach dem Tag, an dem die Eintragung der Verschmelzung in das Register des Sitzes desjenigen Rechtsträgers, dessen Gläubiger sie sind, nach § 19 Abs. 3 UmwG als bekanntgemacht gilt, ihren Anspruch nach Grund und Höhe schriftlich anmelden, Sicherheit zu leisten, soweit sie nicht Befriedigung verlangen können. Dieses Recht steht den Gläubigern jedoch nur zu, wenn sie glaubhaft machen, dass durch die Verschmelzung die Erfüllung ihrer Forderung gefährdet wird."
    },
    {
      "date": "2025-04-24",
      "id": "107277",
      "original_text": "Registerbekanntmachung nach dem Umwandlungsgesetz\nBaden-Württemberg Amtsgericht Stuttgart HRB 785452\nDigital Transformation & Investment (DTI) GmbH – Leonberg",
      "type": "Registerbekanntmachung nach dem Umwandlungsgesetz",
      "state": "Baden-Württemberg",
      "amtsgericht": "Amtsgericht Stuttgart",
      "registernummer": "HRB 785452",
      "registerart": "HRB",
      "company_name": "Digital Transformation & Investment (DTI) GmbH",
      "company_seat": "Leonberg",
      "details": "24.04.2025 (Bekanntmachungsdatum)\n\nBaden-Württemberg Amtsgericht Stuttgart HRB 785452\nRegisterbekanntmachung nach dem Umwandlungsgesetz 24.04.2025 (Eintragungsdatum)\n\nDigital Transformation & Investment (DTI) GmbH\nGesellschaft mit beschränkter Haftung\nLeonberg\n\nDen Gläubigern der an der Verschmelzung beteiligten Rechtsträger ist, wenn sie binnen sechs Monaten nach dem Tag, an dem die Eintragung der Verschmelzung in das Register des Sitzes desjenigen Rechtsträgers, dessen Gläubiger sie sind, nach § 19 Abs. 3 UmwG als bekanntgemacht gilt, ihren Anspruch nach Grund und Höhe schriftlich anmelden, Sicherheit zu leisten, soweit sie nicht Befriedigung verlangen können. Dieses Recht steht den Gläubigern jedoch nur zu, wenn sie glaubhaft machen, dass durch die Verschmelzung die Erfüllung ihrer Forderung gefährdet wird."
    },
    {
      "date": "2025-04-24",
      "id": "107278",
      "original_text": "Einreichung neuer Dokumente\nBaden-Württemberg Amtsgericht Mannheim HRB 750135\nGreenScore Network SE – Karlsruhe",
      "type": "Einreichung neuer Dokumente",
      "state": "Baden-Württemberg",
      "amtsgericht": "Amtsgericht Mannheim",
      "registernummer": "HRB 750135",
      "registerart": "HRB",
      "company_name": "GreenScore Network SE",
      "company_seat": "Karlsruhe",
      "details": "24.04.2025 (Bekanntmachungsdatum)\n\nBaden-Württemberg Amtsgericht Mannheim HRB 750135\nEinreichung neuer Dokumente\n\nGreenScore Network SE\nEuropäische Aktiengesellschaft (SE)\nKarlsruhe\n\nDie Gesellschaft hat am 23.04.2025 die Liste über die Zusammensetzung des Aufsichtsrats zum Handelsregister eingereicht."
    },
    {
      "date": "2025-04-24",
      "id": "107279",
      "original_text": "Löschungsankündigung\nBaden-Württemberg Amtsgericht Mannheim HRB 738191\nWebmotion.cloud GmbH – Hambrücken",
      "type": "Löschungsankündigung",
      "state": "Baden-Württemberg",
      "amtsgericht": "Amtsgericht Mannheim",
      "registernummer": "HRB 738191",
      "registerart": "HRB",
      "company_name": "Webmotion.cloud GmbH",
      "company_seat": "Hambrücken",
      "details": "24.04.2025 (Bekanntmachungsdatum)\n\nBaden-Württemberg Amtsgericht Mannheim HRB 738191\nLöschungsankündigung\n\nWebmotion.cloud GmbH\nGesellschaft mit beschränkter Haftung\nHambrücken\n\nAls nicht eingetragen wird bekanntgemacht:\nDas Gericht beabsichtigt, die Gesellschaft wegen Vermögenslosigkeit im Handelsregister von Amts wegen nach § 394 FamFG zu löschen. Die Frist zur Geltendmachung eines Widerspruchs gegen die beabsichtigte Löschung ist auf einen Monat ab Veröffentlichung bestimmt."
    },
    {
      "date": "2025-04-24",
      "id": "107280",
      "original_text": "Registerbekanntmachung nach dem Umwandlungsgesetz\nSchleswig-Holstein Amtsgericht Lübeck HRB 17758\nedding Expressive Skin GmbH – Ahrensburg",
      "type": "Registerbekanntmachung nach dem Umwandlungsgesetz",
      "state": "Schleswig-Holstein",
      "amtsgericht": "Amtsgericht Lübeck",
      "registernummer": "HRB 17758",
      "registerart": "HRB",
      "company_name": "edding Expressive Skin GmbH",
      "company_seat": "Ahrensburg",
      "details": "24.04.2025 (Bekanntmachungsdatum)\n\nSchleswig-Holstein Amtsgericht Lübeck HRB 17758\nRegisterbekanntmachung nach dem Umwandlungsgesetz 23.04.2025 (Eintragungsdatum)\n\nedding Expressive Skin GmbH\nGesellschaft mit beschränkter Haftung\nAhrensburg\n\nZu Eintragungsnummer 17 vom 23.04.2025 wird als nicht eingetragen veröffentlicht:  Den Gläubigern der an der Verschmelzung beteiligten Rechtsträger ist, wenn sie binnen sechs Monaten nach dem Tag, an dem die Eintragung der Verschmelzung in das Register des Sitzes desjenigen Rechtsträgers, dessen Gläubiger sie sind, als bekannt gemacht gilt, ihren Anspruch nach Grund und Höhe schriftlich anmelden, Sicherheit zu leisten, soweit sie nicht Befriedigung verlangen können. Dieses Recht steht den Gläubigern jedoch nur zu, wenn sie glaubhaft machen, dass durch die Verschmelzung die Erfüllung ihrer Forderung gefährdet wird."
    },
    {
      "date": "2025-04-24",
      "id": "107281",
      "original_text": "Einreichung neuer Dokumente\nBaden-Württemberg Amtsgericht Ulm HRB 552371\nColumbus Holding Aktiengesellschaft – Ravensburg",
      "type": "Einreichung neuer Dokumente",
      "state": "Baden-Württemberg",
      "amtsgericht": "Amtsgericht Ulm",
      "registernummer": "HRB 552371",
      "registerart": "HRB",
      "company_name": "Columbus Holding Aktiengesellschaft",
      "company_seat": "Ravensburg",
      "details": "24.04.2025 (Bekanntmachungsdatum)\n\nBaden-Württemberg Amtsgericht Ulm HRB 552371\nEinreichung neuer Dokumente\n\nColumbus Holding Aktiengesellschaft\nAktiengesellschaft\nRavensburg\n\nDie Gesellschaft hat am 23.04.2025 die Liste über die Zusammensetzung des Aufsichtsrats zum Handelsregister eingereicht."
    },
    {
      "date": "2025-04-24",
      "id": "107282",
      "original_text": "Löschungsankündigung\nSachsen Amtsgericht Dresden HRB 39127\nHaack Verwaltungs-GmbH – Dohna",
      "type": "Löschungsankündigung",
      "state": "Sachsen",
      "amtsgericht": "Amtsgericht Dresden",
      "registernummer": "HRB 39127",
      "registerart": "HRB",
      "company_name": "Haack Verwaltungs-GmbH",
      "company_seat": "Dohna",
      "details": "24.04.2025 (Bekanntmachungsdatum)\n\nSachsen Amtsgericht Dresden HRB 39127\nLöschungsankündigung\n\nHaack Verwaltungs-GmbH\nGesellschaft mit beschränkter Haftung\nDohna\n\nDas Registergericht beabsichtigt, die im Handelsregister eingetragene Gesellschaft von Amts wegen nach § 394 FamFG zu löschen. Die Frist zu Erhebung eines Widerspruchs gegen die beabsichtigte Löschung wird auf einen Monat festgesetzt."
    },
    {
      "date": "2025-04-24",
      "id": "107283",
      "original_text": "Registerbekanntmachung nach dem Umwandlungsgesetz\nSachsen Amtsgericht Dresden HRA 12247\nHermann Scherer GmbH & Co. KG – Dresden",
      "type": "Registerbekanntmachung nach dem Umwandlungsgesetz",
      "state": "Sachsen",
      "amtsgericht": "Amtsgericht Dresden",
      "registernummer": "HRA 12247",
      "registerart": "HRA",
      "company_name": "Hermann Scherer GmbH & Co. KG",
      "company_seat": "Dresden",
      "details": "24.04.2025 (Bekanntmachungsdatum)\n\nSachsen Amtsgericht Dresden HRA 12247\nRegisterbekanntmachung nach dem Umwandlungsgesetz 24.04.2025 (Eintragungsdatum)\n\nHermann Scherer GmbH & Co. KG\nKommanditgesellschaft\nDresden\n\nDen Gläubigern der an der Umwandlung beteiligten Rechtsträger ist, wenn sie binnen sechs Monaten nach dem Tag, an dem die Eintragung der Umwandlung in das Register des Sitzes desjenigen Rechtsträgers, dessen Gläubiger sie sind, nach § 19 Abs. 3 UmwG als bekannt gemacht gilt, ihren Anspruch nach Grund und Höhe in Textform anmelden, Sicherheit zu leisten, soweit sie nicht Befriedigung verlangen können. Dieses Recht steht den Gläubigern jedoch nur zu, wenn sie glaubhaft machen, dass durch die Umwandlung die Erfüllung der Forderung gefährdet wird."
    },
    {
      "date": "2025-04-24",
      "id": "107284",
      "original_text": "Registerbekanntmachung nach dem Umwandlungsgesetz\nSachsen Amtsgericht Dresden HRB 45663\nHermann Scherer GmbH – Dresden",
      "type": "Registerbekanntmachung nach dem Umwandlungsgesetz",
      "state": "Sachsen",
      "amtsgericht": "Amtsgericht Dresden",
      "registernummer": "HRB 45663",
      "registerart": "HRB",
      "company_name": "Hermann Scherer GmbH",
      "company_seat": "Dresden",
      "details": "24.04.2025 (Bekanntmachungsdatum)\n\nSachsen Amtsgericht Dresden HRB 45663\nRegisterbekanntmachung nach dem Umwandlungsgesetz 24.04.2025 (Eintragungsdatum)\n\nHermann Scherer GmbH\nGesellschaft mit beschränkter Haftung\nDresden\n\nDen Gläubigern der an der Umwandlung beteiligten Rechtsträger ist, wenn sie binnen sechs Monaten nach dem Tag, an dem die Eintragung der Umwandlung in das Register des Sitzes desjenigen Rechtsträgers, dessen Gläubiger sie sind, nach § 19 Abs. 3 UmwG als bekannt gemacht gilt, ihren Anspruch nach Grund und Höhe in Textform anmelden, Sicherheit zu leisten, soweit sie nicht Befriedigung verlangen können. Dieses Recht steht den Gläubigern jedoch nur zu, wenn sie glaubhaft machen, dass durch die Umwandlung die Erfüllung der Forderung gefährdet wird."
    },
    {
      "date": "2025-04-24",
      "id": "107285",
      "original_text": "Löschungsankündigung\nSachsen Amtsgericht Leipzig HRB 42866\nLos Visionarios Music UG (haftungsbeschränkt) – Leipzig",
      "type": "Löschungsankündigung",
      "state": "Sachsen",
      "amtsgericht": "Amtsgericht Leipzig",
      "registernummer": "HRB 42866",
      "registerart": "HRB",
      "company_name": "Los Visionarios Music UG (haftungsbeschränkt)",
      "company_seat": "Leipzig",
      "details": "24.04.2025 (Bekanntmachungsdatum)\n\nSachsen Amtsgericht Leipzig HRB 42866\nLöschungsankündigung\n\nLos Visionarios Music UG (haftungsbeschränkt)\nGesellschaft mit beschränkter Haftung\nLeipzig\n\nDas Registergericht beabsichtigt, die im Handelsregister eingetragene Gesellschaft von Amts wegen nach § 394 FamFG zu löschen. Die Frist zu Erhebung eines Widerspruchs gegen die beabsichtigte Löschung wird auf einen Monat festgesetzt."
    },
    {
      "date": "2025-04-24",
      "id": "107286",
      "original_text": "Einreichung neuer Dokumente\nNiedersachsen Amtsgericht Hannover HRA 26227\nLandschaftliche Brandkasse Hannover – Hannover",
      "type": "Einreichung neuer Dokumente",
      "state": "Niedersachsen",
      "amtsgericht": "Amtsgericht Hannover",
      "registernummer": "HRA 26227",
      "registerart": "HRA",
      "company_name": "Landschaftliche Brandkasse Hannover",
      "company_seat": "Hannover",
      "details": "24.04.2025 (Bekanntmachungsdatum)\n\nNiedersachsen Amtsgericht Hannover HRA 26227\nEinreichung neuer Dokumente\n\nLandschaftliche Brandkasse Hannover\nSonstige juristische Person\nHannover\n\nBeim Handelsregister wurde eine Aufsichtsratsliste vom 16.04.2025 eingereicht."
    },
    {
      "date": "2025-04-24",
      "id": "107287",
      "original_text": "Einreichung neuer Dokumente\nNiedersachsen Amtsgericht Hannover HRB 6117\nE+S Rückversicherung AG – Hannover",
      "type": "Einreichung neuer Dokumente",
      "state": "Niedersachsen",
      "amtsgericht": "Amtsgericht Hannover",
      "registernummer": "HRB 6117",
      "registerart": "HRB",
      "company_name": "E+S Rückversicherung AG",
      "company_seat": "Hannover",
      "details": "24.04.2025 (Bekanntmachungsdatum)\n\nNiedersachsen Amtsgericht Hannover HRB 6117\nEinreichung neuer Dokumente\n\nE+S Rückversicherung AG\nAktiengesellschaft\nHannover\n\nBeim Handelsregister ist der Entwurf eines Verschmelzungsvertrages vom 17.04.2025 eingereicht worden. Danach soll die Gesellschaft  - als übernehmende Gesellschaft - mit der E+S Private Equity Beteiligungen GmbH mit Sitz in Hannover (Amtsgericht Hannover HRB 227526) verschmolzen werden."
    },
    {
      "date": "2025-04-24",
      "id": "107288",
      "original_text": "Registerbekanntmachung nach dem Umwandlungsgesetz\nNiedersachsen Amtsgericht Hannover HRB 226211\nAUMASTO GmbH – Hannover",
      "type": "Registerbekanntmachung nach dem Umwandlungsgesetz",
      "state": "Niedersachsen",
      "amtsgericht": "Amtsgericht Hannover",
      "registernummer": "HRB 226211",
      "registerart": "HRB",
      "company_name": "AUMASTO GmbH",
      "company_seat": "Hannover",
      "details": "24.04.2025 (Bekanntmachungsdatum)\n\nNiedersachsen Amtsgericht Hannover HRB 226211\nRegisterbekanntmachung nach dem Umwandlungsgesetz 24.04.2025 (Eintragungsdatum)\n\nAUMASTO GmbH\nGesellschaft mit beschränkter Haftung\nHannover\n\nDen Gläubigern der an der #DV.Auswahl(Text=\"Betreffende Alternative auswählen\",Eingabe=\"Verschmelzung beteiligten Rechtsträger ist, wenn sie binnen sechs Monaten nach dem Tag, an dem die Eintragung der Verschmelzung in das Register des Sitzes desjenigen Rechtsträgers, dessen Gläubiger sie sind, nach § 19  Abs.  3 UmwG als bekannt gemacht gilt, ihren Anspruch nach Grund und Höhe schriftlich anmelden, Sicherheit zu leisten, soweit sie nicht Befriedigung verlangen können. Dieses Recht steht den Gläubigern jedoch nur zu, wenn sie glaubhaft machen, dass durch die Verschmelzung die Erfüllung der Forderung gefährdet wird.\"|\"Verschmelzung\",\"Abspaltung beteiligten Rechtsträger ist, wenn sie binnen sechs Monaten nach dem Tag, an dem die Eintragung der Abspaltung in das Register des Sitzes desjenigen Rechtsträgers, dessen Gläubiger sie sind, nach § 19 Abs. 3 UmwG als bekannt gemacht gilt, ihren Anspruch nach Grund und Höhe schriftlich anmelden, Sicherheit zu leisten, soweit sie nicht Befriedigung verlangen können. Dieses Recht steht den Gläubigern jedoch nur zu, wenn sie glaubhaft machen, dass durch die Abspaltung die Erfüllung der Forderung gefährdet wird.\"|\"Abspaltung\",\"Aufspaltung beteiligten Rechtsträger ist, wenn sie binnen sechs Monaten nach dem Tag, an dem die Eintragung der Aufspaltung in das Register des Sitzes desjenigen Rechtsträgers, dessen Gläubiger sie sind, nach § 19 Abs. 3 UmwG als bekannt gemacht gilt, ihren Anspruch nach Grund und Höhe schriftlich anmelden, Sicherheit zu leisten, soweit sie nicht Befriedigung verlangen können. Dieses Recht steht den Gläubigern jedoch nur zu, wenn sie glaubhaft machen, dass durch die Aufspaltung die Erfüllung der Forderung gefährdet wird.\"|\"Aufspaltung\",\"formwechselnden Umwandlung beteiligten Rechtsträger ist, wenn sie binnen sechs Monaten nach dem Tag, an dem die Eintragung der Umwandlung in das Register des Sitzes desjenigen Rechtsträgers, dessen Gläubiger sie sind, nach § 19 Abs. 3 UmwG als bekannt gemacht gilt, ihren Anspruch nach Grund und Höhe schriftlich anmelden, Sicherheit zu leisten, soweit sie nicht Befriedigung verlangen können. Dieses Recht steht den Gläubigern jedoch nur zu, wenn sie glaubhaft machen, dass durch die formwechselnde Umwandlung die Erfüllung der Forderung gefährdet wird.\"|\"formwechselnden Umwandlung\",\"Ausgliederung beteiligten Rechtsträger ist, wenn sie binnen sechs Monaten nach dem Tag, an dem die Eintragung der Ausgliederung in das Register des Sitzes desjenigen Rechtsträgers, dessen Gläubiger sie sind, nach § 19 Abs. 3 UmwG als bekannt gemacht gilt, ihren Anspruch nach Grund und Höhe schriftlich anmelden, Sicherheit zu leisten, soweit sie nicht Befriedigung verlangen können. Dieses Recht steht den Gläubigern jedoch nur zu, wenn sie glaubhaft machen, dass durch die Ausgliederung die Erfüllung der Forderung gefährdet wird.\"|\"Ausgliederung\",\"Vermögensübertragung beteiligten Rechtsträger ist, wenn sie binnen sechs Monaten nach dem Tag, an dem die Eintragung der Spaltung in das Register des Sitzes desjenigen Rechtsträgers, dessen Gläubiger sie sind, nach § 19 Abs. 3 UmwG als bekannt gemacht gilt, ihren Anspruch nach Grund und Höhe schriftlich anmelden, Sicherheit zu leisten, soweit sie nicht Befriedigung verlangen können. Dieses Recht steht den Gläubigern jedoch nur zu, wenn sie glaubhaft machen, dass durch die Spaltung die Erfüllung der Forderung gefährdet wird.\"|\"Vermögensübertragung\")"
    },
    {
      "date": "2025-04-24",
      "id": "107289",
      "original_text": "Löschungsankündigung\nNiedersachsen Amtsgericht Hannover HRA 19506\nHahn-Druckerei GmbH & Co. – Hannover",
      "type": "Löschungsankündigung",
      "state": "Niedersachsen",
      "amtsgericht": "Amtsgericht Hannover",
      "registernummer": "HRA 19506",
      "registerart": "HRA",
      "company_name": "Hahn-Druckerei GmbH & Co.",
      "company_seat": "Hannover",
      "details": "24.04.2025 (Bekanntmachungsdatum)\n\nNiedersachsen Amtsgericht Hannover HRA 19506\nLöschungsankündigung\n\nHahn-Druckerei GmbH & Co.\nKommanditgesellschaft\nHannover\n\nDas Registergericht beabsichtigt, die Firma von Amts wegen nach § 394 Abs. 4 FamFG zu löschen. Die Frist zur Erhebung eines Widerspruchs ist auf 1 Monat ab dieser Registerbekanntmachung festgesetzt."
    },
    {
      "date": "2025-04-24",
      "id": "107290",
      "original_text": "Registerbekanntmachung nach dem Umwandlungsgesetz\nNiedersachsen Amtsgericht Hannover HRB 120460 früher Amtsgericht Burgwedel\nGlasfischer Glastechnik GmbH – Isernhagen",
      "type": "Registerbekanntmachung nach dem Umwandlungsgesetz",
      "state": "Niedersachsen",
      "amtsgericht": "Amtsgericht Hannover",
      "registernummer": "HRB 120460",
      "registerart": "HRB",
      "company_name": "Glasfischer Glastechnik GmbH",
      "company_seat": "Isernhagen",
      "former_amtsgericht": "Burgwedel",
      "details": "24.04.2025 (Bekanntmachungsdatum)\n\nNiedersachsen Amtsgericht Hannover HRB 120460 früher Amtsgericht Burgwedel\nRegisterbekanntmachung nach dem Umwandlungsgesetz 24.04.2025 (Eintragungsdatum)\n\nGlasfischer Glastechnik GmbH\nGesellschaft mit beschränkter Haftung\nIsernhagen\n\nDen Gläubigern der an der #DV.Auswahl(Text=\"Betreffende Alternative auswählen\",Eingabe=\"Verschmelzung beteiligten Rechtsträger ist, wenn sie binnen sechs Monaten nach dem Tag, an dem die Eintragung der Verschmelzung in das Register des Sitzes desjenigen Rechtsträgers, dessen Gläubiger sie sind, nach § 19  Abs.  3 UmwG als bekannt gemacht gilt, ihren Anspruch nach Grund und Höhe schriftlich anmelden, Sicherheit zu leisten, soweit sie nicht Befriedigung verlangen können. Dieses Recht steht den Gläubigern jedoch nur zu, wenn sie glaubhaft machen, dass durch die Verschmelzung die Erfüllung der Forderung gefährdet wird.\"|\"Verschmelzung\",\"Abspaltung beteiligten Rechtsträger ist, wenn sie binnen sechs Monaten nach dem Tag, an dem die Eintragung der Abspaltung in das Register des Sitzes desjenigen Rechtsträgers, dessen Gläubiger sie sind, nach § 19 Abs. 3 UmwG als bekannt gemacht gilt, ihren Anspruch nach Grund und Höhe schriftlich anmelden, Sicherheit zu leisten, soweit sie nicht Befriedigung verlangen können. Dieses Recht steht den Gläubigern jedoch nur zu, wenn sie glaubhaft machen, dass durch die Abspaltung die Erfüllung der Forderung gefährdet wird.\"|\"Abspaltung\",\"Aufspaltung beteiligten Rechtsträger ist, wenn sie binnen sechs Monaten nach dem Tag, an dem die Eintragung der Aufspaltung in das Register des Sitzes desjenigen Rechtsträgers, dessen Gläubiger sie sind, nach § 19 Abs. 3 UmwG als bekannt gemacht gilt, ihren Anspruch nach Grund und Höhe schriftlich anmelden, Sicherheit zu leisten, soweit sie nicht Befriedigung verlangen können. Dieses Recht steht den Gläubigern jedoch nur zu, wenn sie glaubhaft machen, dass durch die Aufspaltung die Erfüllung der Forderung gefährdet wird.\"|\"Aufspaltung\",\"formwechselnden Umwandlung beteiligten Rechtsträger ist, wenn sie binnen sechs Monaten nach dem Tag, an dem die Eintragung der Umwandlung in das Register des Sitzes desjenigen Rechtsträgers, dessen Gläubiger sie sind, nach § 19 Abs. 3 UmwG als bekannt gemacht gilt, ihren Anspruch nach Grund und Höhe schriftlich anmelden, Sicherheit zu leisten, soweit sie nicht Befriedigung verlangen können. Dieses Recht steht den Gläubigern jedoch nur zu, wenn sie glaubhaft machen, dass durch die formwechselnde Umwandlung die Erfüllung der Forderung gefährdet wird.\"|\"formwechselnden Umwandlung\",\"Ausgliederung beteiligten Rechtsträger ist, wenn sie binnen sechs Monaten nach dem Tag, an dem die Eintragung der Ausgliederung in das Register des Sitzes desjenigen Rechtsträgers, dessen Gläubiger sie sind, nach § 19 Abs. 3 UmwG als bekannt gemacht gilt, ihren Anspruch nach Grund und Höhe schriftlich anmelden, Sicherheit zu leisten, soweit sie nicht Befriedigung verlangen können. Dieses Recht steht den Gläubigern jedoch nur zu, wenn sie glaubhaft machen, dass durch die Ausgliederung die Erfüllung der Forderung gefährdet wird.\"|\"Ausgliederung\",\"Vermögensübertragung beteiligten Rechtsträger ist, wenn sie binnen sechs Monaten nach dem Tag, an dem die Eintragung der Spaltung in das Register des Sitzes desjenigen Rechtsträgers, dessen Gläubiger sie sind, nach § 19 Abs. 3 UmwG als bekannt gemacht gilt, ihren Anspruch nach Grund und Höhe schriftlich anmelden, Sicherheit zu leisten, soweit sie nicht Befriedigung verlangen können. Dieses Recht steht den Gläubigern jedoch nur zu, wenn sie glaubhaft machen, dass durch die Spaltung die Erfüllung der Forderung gefährdet wird.\"|\"Vermögensübertragung\")"
    },
    {
      "date": "2025-04-24",
      "id": "107291",
      "original_text": "Einreichung neuer Dokumente\nNiedersachsen Amtsgericht Hannover HRB 61011\nHannoversche Lebensversicherung AG – Hannover",
      "type": "Einreichung neuer Dokumente",
      "state": "Niedersachsen",
      "amtsgericht": "Amtsgericht Hannover",
      "registernummer": "HRB 61011",
      "registerart": "HRB",
      "company_name": "Hannoversche Lebensversicherung AG",
      "company_seat": "Hannover",
      "details": "24.04.2025 (Bekanntmachungsdatum)\n\nNiedersachsen Amtsgericht Hannover HRB 61011\nEinreichung neuer Dokumente\n\nHannoversche Lebensversicherung AG\nAktiengesellschaft\nHannover\n\nDie Liste der Mitglieder des Aufsichtsrats wurde beim Registergericht eingereicht."
    },
    {
      "date": "2025-04-24",
      "id": "107292",
      "original_text": "Registerbekanntmachung nach dem Umwandlungsgesetz\nNiedersachsen Amtsgericht Osnabrück HRB 206969\nMT Anlagen und Entwicklungs GmbH – Nordhorn",
      "type": "Registerbekanntmachung nach dem Umwandlungsgesetz",
      "state": "Niedersachsen",
      "amtsgericht": "Amtsgericht Osnabrück",
      "registernummer": "HRB 206969",
      "registerart": "HRB",
      "company_name": "MT Anlagen und Entwicklungs GmbH",
      "company_seat": "Nordhorn",
      "details": "24.04.2025 (Bekanntmachungsdatum)\n\nNiedersachsen Amtsgericht Osnabrück HRB 206969\nRegisterbekanntmachung nach dem Umwandlungsgesetz\n\nMT Anlagen und Entwicklungs GmbH\nGesellschaft mit beschränkter Haftung\nNordhorn\n\nDas Registergericht beabsichtigt, die Gesellschaft von Amts wegen nach § 394 FamFG wegen Vermögenslosigkeit zu löschen. Die Frist zur Erhebung eines Widerspruchs ist auf 1 Monat ab dieser Registerbekanntmachung festgesetzt."
    },
    {
      "date": "2025-04-24",
      "id": "107293",
      "original_text": "Einreichung neuer Dokumente\nRheinland-Pfalz Amtsgericht Montabaur HRB 6685\nCHAMAELEON - Aktiengesellschaft für innovative Netzlösungen – Montabaur",
      "type": "Einreichung neuer Dokumente",
      "state": "Rheinland-Pfalz",
      "amtsgericht": "Amtsgericht Montabaur",
      "registernummer": "HRB 6685",
      "registerart": "HRB",
      "company_name": "CHAMAELEON - Aktiengesellschaft für innovative Netzlösungen",
      "company_seat": "Montabaur",
      "details": "24.04.2025 (Bekanntmachungsdatum)\n\nRheinland-Pfalz Amtsgericht Montabaur HRB 6685\nEinreichung neuer Dokumente\n\nCHAMAELEON - Aktiengesellschaft für innovative Netzlösungen\nAktiengesellschaft\nMontabaur\n\nDem Registergericht ist eine neue Liste der Mitglieder des Aufsichtsrates eingereicht worden."
    },
    {
      "date": "2025-04-24",
      "id": "107294",
      "original_text": "Löschungsankündigung\nRheinland-Pfalz Amtsgericht Landau HRB 31280\nDeutsches Weintor Gastronomie GmbH – Schweigen-Rechtenbach",
      "type": "Löschungsankündigung",
      "state": "Rheinland-Pfalz",
      "amtsgericht": "Amtsgericht Landau",
      "registernummer": "HRB 31280",
      "registerart": "HRB",
      "company_name": "Deutsches Weintor Gastronomie GmbH",
      "company_seat": "Schweigen-Rechtenbach",
      "details": "24.04.2025 (Bekanntmachungsdatum)\n\nRheinland-Pfalz Amtsgericht Landau HRB 31280\nLöschungsankündigung\n\nDeutsches Weintor Gastronomie GmbH\nGesellschaft mit beschränkter Haftung\nSchweigen-Rechtenbach\n\nDas Registergericht beabsichtigt die Gesellschaft von Amts wegen nach § 394 FamFG zu löschen. Die Frist zur Erhebung eines Widerspruchs ist auf einen Monat festgesetzt."
    },
    {
      "date": "2025-04-24",
      "id": "107295",
      "original_text": "Registerbekanntmachung nach dem Umwandlungsgesetz\nNordrhein-Westfalen Amtsgericht Köln HRB 123016\nKohlgraf Consulting GmbH – Köln",
      "type": "Registerbekanntmachung nach dem Umwandlungsgesetz",
      "state": "Nordrhein-Westfalen",
      "amtsgericht": "Amtsgericht Köln",
      "registernummer": "HRB 123016",
      "registerart": "HRB",
      "company_name": "Kohlgraf Consulting GmbH",
      "company_seat": "Köln",
      "details": "24.04.2025 (Bekanntmachungsdatum)\n\nNordrhein-Westfalen Amtsgericht Köln HRB 123016\nRegisterbekanntmachung nach dem Umwandlungsgesetz 24.04.2025 (Eintragungsdatum)\n\nKohlgraf Consulting GmbH\nGesellschaft mit beschränkter Haftung\nKöln\n\nDen Gläubigern der an der Ausgliederung beteiligten Rechtsträger ist, wenn sie binnen sechs Monaten nach dem Tag, an dem die Eintragung der Ausgliederung in das Register des Sitzes desjenigen Rechtsträgers, dessen Gläubiger sie sind, nach § 19 Absatz 3 UmwG als bekanntgemacht gilt, ihren Anspruch nach Grund und Höhe schriftlich anmelden, Sicherheit zu leisten, soweit sie nicht Befriedigung verlangen können. Dieses Recht steht den Gläubigern jedoch nur zu, wenn sie glaubhaft machen, dass durch die Ausgliederung die Erfüllung ihrer Forderung gefährdet wird."
    },
    {
      "date": "2025-04-24",
      "id": "107296",
      "original_text": "Löschungsankündigung\nNordrhein-Westfalen Amtsgericht Mönchengladbach HRB 17980\nAFA Maschinen Handel GmbH – Hückelhoven",
      "type": "Löschungsankündigung",
      "state": "Nordrhein-Westfalen",
      "amtsgericht": "Amtsgericht Mönchengladbach",
      "registernummer": "HRB 17980",
      "registerart": "HRB",
      "company_name": "AFA Maschinen Handel GmbH",
      "company_seat": "Hückelhoven",
      "details": "24.04.2025 (Bekanntmachungsdatum)\n\nNordrhein-Westfalen Amtsgericht Mönchengladbach HRB 17980\nLöschungsankündigung 24.04.2025 (Eintragungsdatum)\n\nAFA Maschinen Handel GmbH\nGesellschaft mit beschränkter Haftung\nHückelhoven\n\nDas Registergericht beabsichtigt die Gesellschaft von Amts wegen nach § 394 FamFG zu löschen. Die Frist zur Erhebung eines Widerspruchs ist auf drei Monate festgesetzt."
    },
    {
      "date": "2025-04-24",
      "id": "107297",
      "original_text": "Registerbekanntmachung nach dem Umwandlungsgesetz\nBremen Amtsgericht Bremen HRB 23427\nGebrüder Kulenkampff GmbH – Bremen",
      "type": "Registerbekanntmachung nach dem Umwandlungsgesetz",
      "state": "Bremen",
      "amtsgericht": "Amtsgericht Bremen",
      "registernummer": "HRB 23427",
      "registerart": "HRB",
      "company_name": "Gebrüder Kulenkampff GmbH",
      "company_seat": "Bremen",
      "details": "24.04.2025 (Bekanntmachungsdatum)\n\nBremen Amtsgericht Bremen HRB 23427\nRegisterbekanntmachung nach dem Umwandlungsgesetz 17.04.2025 (Eintragungsdatum)\n\nGebrüder Kulenkampff GmbH\nGesellschaft mit beschränkter Haftung\nBremen\n\nZu Eintragungsnummer 11 vom 17.04.2025 wird als nicht eingetragen veröffentlicht: Den Gläubigern der an der Verschmelzung beteiligten Rechtsträger ist, wenn sie binnen sechs Monaten nach dem Tag, an dem die Eintragung der Verschmelzung in das Register des Sitzes desjenigen Rechtsträgers, dessen Gläubiger sie sind, als bekannt gemacht gilt, ihren Anspruch nach Grund und Höhe schriftlich anmelden, Sicherheit zu leisten, soweit sie nicht Befriedigung verlangen können. Dieses Recht steht den Gläubigern jedoch nur zu, wenn sie glaubhaft machen, dass durch die Verschmelzung die Erfüllung ihrer Forderung gefährdet wird. Das Recht, Sicherheitsleistung zu verlangen, steht Gläubigern nicht zu, die im Falle der Insolvenz ein Recht auf vorzugsweise Befriedigung aus einer Deckungsmasse haben, die nach gesetzlicher Vorschrift zu ihrem Schutz errichtet und staatlich überwacht ist."
    },
    {
      "date": "2025-04-24",
      "id": "107298",
      "original_text": "Registerbekanntmachung nach dem Umwandlungsgesetz\nBremen Amtsgericht Bremen HRB 29963\nMPW Industrial Supply GmbH – Bremen",
      "type": "Registerbekanntmachung nach dem Umwandlungsgesetz",
      "state": "Bremen",
      "amtsgericht": "Amtsgericht Bremen",
      "registernummer": "HRB 29963",
      "registerart": "HRB",
      "company_name": "MPW Industrial Supply GmbH",
      "company_seat": "Bremen",
      "details": "24.04.2025 (Bekanntmachungsdatum)\n\nBremen Amtsgericht Bremen HRB 29963\nRegisterbekanntmachung nach dem Umwandlungsgesetz 22.04.2025 (Eintragungsdatum)\n\nMPW Industrial Supply GmbH\nGesellschaft mit beschränkter Haftung\nBremen\n\nZu Eintragungsnummer 3 vom 22.04.2025 wird als nicht eingetragen veröffentlicht: Den Gläubigern der an der Verschmelzung beteiligten Rechtsträger ist, wenn sie binnen sechs Monaten nach dem Tag, an dem die Eintragung der Verschmelzung in das Register des Sitzes desjenigen Rechtsträgers, dessen Gläubiger sie sind, als bekannt gemacht gilt, ihren Anspruch nach Grund und Höhe schriftlich anmelden, Sicherheit zu leisten, soweit sie nicht Befriedigung verlangen können. Dieses Recht steht den Gläubigern jedoch nur zu, wenn sie glaubhaft machen, dass durch die Verschmelzung die Erfüllung ihrer Forderung gefährdet wird. Das Recht, Sicherheitsleistung zu verlangen, steht Gläubigern nicht zu, die im Falle der Insolvenz ein Recht auf vorzugsweise Befriedigung aus einer Deckungsmasse haben, die nach gesetzlicher Vorschrift zu ihrem Schutz errichtet und staatlich überwacht ist."
    },
    {
      "date": "2025-04-24",
      "id": "107299",
      "original_text": "Registerbekanntmachung nach dem Umwandlungsgesetz\nBremen Amtsgericht Bremen HRB 34743\nDettmer Asset Holding GmbH – Bremen",
      "type": "Registerbekanntmachung nach dem Umwandlungsgesetz",
      "state": "Bremen",
      "amtsgericht": "Amtsgericht Bremen",
      "registernummer": "HRB 34743",
      "registerart": "HRB",
      "company_name": "Dettmer Asset Holding GmbH",
      "company_seat": "Bremen",
      "details": "24.04.2025 (Bekanntmachungsdatum)\n\nBremen Amtsgericht Bremen HRB 34743\nRegisterbekanntmachung nach dem Umwandlungsgesetz 22.04.2025 (Eintragungsdatum)\n\nDettmer Asset Holding GmbH\nGesellschaft mit beschränkter Haftung\nBremen\n\nZu Eintragungsnummer 10 vom 22.04.2025 wird als nicht eingetragen veröffentlicht:\nDen Gläubigern der an der Verschmelzung beteiligten Rechtsträger ist, wenn sie binnen sechs Monaten nach dem Tag, an dem die Eintragung der Verschmelzung in das Register des Sitzes desjenigen Rechtsträgers, dessen Gläubiger sie sind, als bekannt gemacht gilt, ihren Anspruch nach Grund und Höhe schriftlich anmelden, Sicherheit zu leisten, soweit sie nicht Befriedigung verlangen können. Dieses Recht steht den Gläubigern jedoch nur zu, wenn sie glaubhaft machen, dass durch die Verschmelzung die Erfüllung ihrer Forderung gefährdet wird. Das Recht, Sicherheitsleistung zu verlangen, steht Gläubigern nicht zu, die im Falle der Insolvenz ein Recht auf vorzugsweise Befriedigung aus einer Deckungsmasse haben, die nach gesetzlicher Vorschrift zu ihrem Schutz errichtet und staatlich überwacht ist."
    },
    {
      "date": "2025-04-24",
      "id": "107300",
      "original_text": "Löschungsankündigung\nBremen Amtsgericht Bremen HRB 37421\nBorgward Villa GmbH – Bremen",
      "type": "Löschungsankündigung",
      "state": "Bremen",
      "amtsgericht": "Amtsgericht Bremen",
      "registernummer": "HRB 37421",
      "registerart": "HRB",
      "company_name": "Borgward Villa GmbH",
      "company_seat": "Bremen",
      "details": "24.04.2025 (Bekanntmachungsdatum)\n\nBremen Amtsgericht Bremen HRB 37421\nLöschungsankündigung\n\nBorgward Villa GmbH\nGesellschaft mit beschränkter Haftung\nBremen\n\nEs ist beabsichtigt die im Handelsregister eingetragene Gesellschaft von Amts wegen gemäß § 394 FamFG zu löschen. Gegen die Löschung kann beim AG Bremen schriftlich oder zu Protokoll der Geschäftsstelle Widerspruch eingelegt werden. Widerspruchsfrist 4 Wochen."
    },
    {
      "date": "2025-04-24",
      "id": "107301",
      "original_text": "Löschungsankündigung\nBremen Amtsgericht Bremen HRB 30379\nAlbrecht und R GmbH – Bremen",
      "type": "Löschungsankündigung",
      "state": "Bremen",
      "amtsgericht": "Amtsgericht Bremen",
      "registernummer": "HRB 30379",
      "registerart": "HRB",
      "company_name": "Albrecht und R GmbH",
      "company_seat": "Bremen",
      "details": "24.04.2025 (Bekanntmachungsdatum)\n\nBremen Amtsgericht Bremen HRB 30379\nLöschungsankündigung\n\nAlbrecht und R GmbH\nGesellschaft mit beschränkter Haftung\nBremen\n\nEs ist beabsichtigt die im Handelsregister eingetragene Gesellschaft von Amts wegen gemäß § 394 FamFG zu löschen. Gegen die Löschung kann beim AG Bremen schriftlich oder zu Protokoll der Geschäftsstelle Widerspruch eingelegt werden. Widerspruchsfrist 4 Wochen."
    },
    {
      "date": "2025-04-24",
      "id": "107302",
      "original_text": "Löschungsankündigung\nBremen Amtsgericht Bremen HRB 31860\nABCD Dies Das GmbH – Bremen",
      "type": "Löschungsankündigung",
      "state": "Bremen",
      "amtsgericht": "Amtsgericht Bremen",
      "registernummer": "HRB 31860",
      "registerart": "HRB",
      "company_name": "ABCD Dies Das GmbH",
      "company_seat": "Bremen",
      "details": "24.04.2025 (Bekanntmachungsdatum)\n\nBremen Amtsgericht Bremen HRB 31860\nLöschungsankündigung\n\nABCD Dies Das GmbH\nGesellschaft mit beschränkter Haftung\nBremen\n\nEs ist beabsichtigt die im Handelsregister eingetragene Gesellschaft von Amts wegen gemäß § 394 FamFG zu löschen. Gegen die Löschung kann beim AG Bremen schriftlich oder zu Protokoll der Geschäftsstelle Widerspruch eingelegt werden. Widerspruchsfrist 4 Wochen."
    },
    {
      "date": "2025-04-24",
      "id": "107303",
      "original_text": "Löschungsankündigung\nBremen Amtsgericht Bremen HRB 24428\nL + P Ingenieurtechnik GmbH – Bremen",
      "type": "Löschungsankündigung",
      "state": "Bremen",
      "amtsgericht": "Amtsgericht Bremen",
      "registernummer": "HRB 24428",
      "registerart": "HRB",
      "company_name": "L + P Ingenieurtechnik GmbH",
      "company_seat": "Bremen",
      "details": "24.04.2025 (Bekanntmachungsdatum)\n\nBremen Amtsgericht Bremen HRB 24428\nLöschungsankündigung\n\nL + P Ingenieurtechnik GmbH\nGesellschaft mit beschränkter Haftung\nBremen\n\nEs ist beabsichtigt die im Handelsregister eingetragene Gesellschaft von Amts wegen gemäß § 394 FamFG zu löschen. Gegen die Löschung kann beim AG Bremen schriftlich oder zu Protokoll der Geschäftsstelle Widerspruch eingelegt werden. Widerspruchsfrist 4 Wochen."
    },
    {
      "date": "2025-04-24",
      "id": "107304",
      "original_text": "Löschungsankündigung\nNordrhein-Westfalen Amtsgericht Aachen HRB 25447\nYEMEQ Spezialitätenhandel GmbH – Aachen",
      "type": "Löschungsankündigung",
      "state": "Nordrhein-Westfalen",
      "amtsgericht": "Amtsgericht Aachen",
      "registernummer": "HRB 25447",
      "registerart": "HRB",
      "company_name": "YEMEQ Spezialitätenhandel GmbH",
      "company_seat": "Aachen",
      "details": "24.04.2025 (Bekanntmachungsdatum)\n\nNordrhein-Westfalen Amtsgericht Aachen HRB 25447\nLöschungsankündigung\n\nYEMEQ Spezialitätenhandel GmbH\nGesellschaft mit beschränkter Haftung\nAachen\n\nDas Registergericht beabsichtigt, von Amts wegen die Gesellschaft wegen Vermögenslosigkeit nach § 394 FamFG zu löschen,  weil das Finanzamt Aachen-Stadt  mit Schreiben vom 02.04.2025 Umstände mitgeteilt hat, aufgrund derer das Gericht davon überzeugt ist, dass die Gesellschaft vollständig vermögenslos ist.\n\nZur Geltendmachung des Widerspruchs gegen die beabsichtigte Löschung wird hiermit eine Frist von einem Monat ab Veröffentlichung dieser Ankündigung bestimmt.\n\nRechtsbehelfsbelehrung:\n\nGegen diese Verfügung kann Widerspruch eingelegt werden. Zum Widerspruch ist jeder berechtigt, der an der Unterlassung der Löschung ein berechtigtes Interesse hat.\n\nDer Widerspruch ist bei dem Amtsgericht Aachen, Adalbertsteinweg 92, 52070 Aachen schriftlich in deutscher Sprache oder zur Niederschrift der Geschäftsstelle einzulegen. Der Widerspruch kann auch zur Niederschrift der Geschäftsstelle eines jeden Amtsgerichtes abgegeben werden.\n\nDer Widerspruch muss spätestens innerhalb der gesetzten Frist nach der Bekanntgabe der Verfügung bei dem Amtsgericht Aachen eingegangen sein. Dies gilt auch dann, wenn der Widerspruch zur Niederschrift der Geschäftsstelle eines anderen Amtsgerichtes abgegeben wurde. Die Frist beginnt mit der Bekanntgabe der Verfügung durch Veröffentlichung. Fällt das Ende der Frist auf einen Sonntag, einen allgemeinen Feiertag oder Sonnabend, so endet die Frist mit Ablauf des nächsten Werktages.\n\nDer Widerspruch muss die Bezeichnung der angefochtenen Verfügung sowie die Erklärung enthalten, dass Widerspruch gegen diese Verfügung eingelegt wird. Er ist zu unterzeichnen und soll begründet werden.\n\nDie Einlegung ist auch durch Übertragung eines elektronischen Dokuments an die elektronische Poststelle des Gerichts möglich. Das elektronische Dokument muss für die Bearbeitung durch das Gericht geeignet und mit einer qualifizierten elektronischen Signatur der verantwortenden Person versehen sein oder von der verantwortenden Person signiert und auf einem sicheren Übermittlungsweg gemäß § 130 a ZPO nach näherer Maßgabe der Verordnung über die technischen Rahmenbedingungen des elektronischen Rechtsverkehrs und über das besondere elektronische Behördenpostfach (BGBl. I, S. 3803) eingereicht werden. Weitere Informationen erhalten Sie auf der Internetseite www.justiz.de."
    },
    {
      "date": "2025-04-24",
      "id": "107305",
      "original_text": "Löschungsankündigung\nNordrhein-Westfalen Amtsgericht Mönchengladbach HRB 23004\nCG Realty Consulting UG (haftungsbeschränkt) – Mönchengladbach",
      "type": "Löschungsankündigung",
      "state": "Nordrhein-Westfalen",
      "amtsgericht": "Amtsgericht Mönchengladbach",
      "registernummer": "HRB 23004",
      "registerart": "HRB",
      "company_name": "CG Realty Consulting UG (haftungsbeschränkt)",
      "company_seat": "Mönchengladbach",
      "details": "24.04.2025 (Bekanntmachungsdatum)\n\nNordrhein-Westfalen Amtsgericht Mönchengladbach HRB 23004\nLöschungsankündigung 24.04.2025 (Eintragungsdatum)\n\nCG Realty Consulting UG (haftungsbeschränkt)\nGesellschaft mit beschränkter Haftung\nMönchengladbach\n\nDas Registergericht beabsichtigt die Gesellschaft von Amts wegen nach § 394 FamFG zu löschen. Die Frist zur Erhebung eines Widerspruchs ist auf drei Monate festgesetzt."
    },
    {
      "date": "2025-04-24",
      "id": "107306",
      "original_text": "Löschungsankündigung\nNordrhein-Westfalen Amtsgericht Mönchengladbach HRB 20065\nacv next GmbH – Erkelenz",
      "type": "Löschungsankündigung",
      "state": "Nordrhein-Westfalen",
      "amtsgericht": "Amtsgericht Mönchengladbach",
      "registernummer": "HRB 20065",
      "registerart": "HRB",
      "company_name": "acv next GmbH",
      "company_seat": "Erkelenz",
      "details": "24.04.2025 (Bekanntmachungsdatum)\n\nNordrhein-Westfalen Amtsgericht Mönchengladbach HRB 20065\nLöschungsankündigung\n\nacv next GmbH\nGesellschaft mit beschränkter Haftung\nErkelenz\n\nacv next GmbH, Erkelenz (Amtsgericht Mönchengladbach, HRB 20065)\nDas Registergericht beabsichtigt, die im Handelsregister eingetragene Gesellschaft gemäß § 394 Absatz 1 FamFG wegen Vermögenslosigkeit von Amts wegen zu löschen. Gegen diese Verfügung kann Widerspruch eingelegt werden. Die Frist zur Erhebung eines Widerspruchs gegen die beabsichtigte Löschung von Amts wegen ist auf drei Monate festgesetzt."
    },
    {
      "date": "2025-04-24",
      "id": "107307",
      "original_text": "Registerbekanntmachung nach dem Umwandlungsgesetz\nNordrhein-Westfalen Amtsgericht Münster HRA 12030\nDegener & Friends e.K. – Oelde",
      "type": "Registerbekanntmachung nach dem Umwandlungsgesetz",
      "state": "Nordrhein-Westfalen",
      "amtsgericht": "Amtsgericht Münster",
      "registernummer": "HRA 12030",
      "registerart": "HRA",
      "company_name": "Degener & Friends e.K.",
      "company_seat": "Oelde",
      "details": "24.04.2025 (Bekanntmachungsdatum)\n\nNordrhein-Westfalen Amtsgericht Münster HRA 12030\nRegisterbekanntmachung nach dem Umwandlungsgesetz 24.04.2025 (Eintragungsdatum)\n\nDegener & Friends e.K.\nEinzelkaufmann / Einzelkauffrau\nOelde\n\nDen Gläubigern der an der Ausgliederung beteiligten Rechtsträger ist, wenn sie binnen sechs Monaten nach dem Tag, an dem die Eintragung der Ausgliederung in das Register des Sitzes derjenigen Rechtsträger deren Gläubiger sie sind, nach § 19 Absatz 3 UmwG als bekanntgemacht gilt, ihren Anspruch nach Grund und Höhe schriftlich anmelden, Sicherheit zu leisten, soweit sie nicht Befriedigung verlangen können. Dieses Recht steht den Gläubigern jedoch nur zu, wenn sie glaubhaft machen, dass durch die Ausgliederung die Erfüllung ihrer Forderung gefährdet wird."
    },
    {
      "date": "2025-04-24",
      "id": "107308",
      "original_text": "Löschungsankündigung\nNordrhein-Westfalen Amtsgericht Siegburg HRB 15451\nBraddy´s Laredo´s GmbH – Siegburg",
      "type": "Löschungsankündigung",
      "state": "Nordrhein-Westfalen",
      "amtsgericht": "Amtsgericht Siegburg",
      "registernummer": "HRB 15451",
      "registerart": "HRB",
      "company_name": "Braddy´s Laredo´s GmbH",
      "company_seat": "Siegburg",
      "details": "24.04.2025 (Bekanntmachungsdatum)\n\nNordrhein-Westfalen Amtsgericht Siegburg HRB 15451\nLöschungsankündigung\n\nBraddy´s Laredo´s GmbH\nGesellschaft mit beschränkter Haftung\nSiegburg\n\nDas Registergericht hat glaubhafte Kenntnis erlangt, dass die Gesellschaft vermögenslos geworden ist, da Zwangsvollstreckungsmaßnahmen des Finanzamtes Siegburg erfolglos geblieben sind.\n\nEs ist daher beabsichtigt, die Gesellschaft nach § 394 FamFG im Handelsregister wegen Vermögenslosigkeit zu löschen.\nEinwände gegen die Löschung sind durch Widerspruch binnen einer Frist von 3 Monaten geltend zu machen, andernfalls die Löschung erfolgen wird.\n\nEinzulegen ist der Widerspruch bei dem Amtsgericht Siegburg, Neue Poststraße 16, 53721 Siegburg, und zwar entweder schriftlich in deutscher Sprache oder mündlich zur Niederschrift der Geschäftsstelle. Der Widerspruch kann auch zur Niederschrift der Geschäftsstelle eines jeden Amtsgerichts abgegeben werden. Der Widerspruch ist binnen der in der Verfügung bestimmten Frist einzulegen. Die Frist ist nur gewahrt, wenn der Widerspruch rechtzeitig bei dem Amtsgericht Siegburg eingeht, auch wenn der Widerspruch zur Niederschrift der Geschäftsstelle eines anderen Amtsgerichts abgegeben wurde. Die Frist beginnt jeweils mit der schriftlichen Bekanntgabe der Verfügung an die Beteiligten. Kann die schriftliche Bekanntgabe an einen Beteiligten nicht bewirkt werden, beginnt die Frist spätestens mit Ablauf von fünf Monaten nach Erlass der Verfügung. Die Bekanntgabe ist entweder durch Zustellung oder am dritten Tage nach Aufgabe zur Post bewirkt. Sofern die Löschung noch nicht erfolgt ist, kann der Widerspruch auch noch nach Ablauf der Frist eingelegt werden. Fällt das Ende der Frist auf einen Sonnabend, einen Sonntag oder einen allgemeinen Feiertag, endet die Frist mit Ablauf des nächsten Werktages. Der Widerspruch ist zu unterzeichnen. Eine Begründung des Widerspruchs ist nicht vorgeschrieben."
    },
    {
      "date": "2025-04-24",
      "id": "107309",
      "original_text": "Einreichung neuer Dokumente\nNordrhein-Westfalen Amtsgericht Dortmund HRB 28571\nTop Tagungszentren AG – Dortmund",
      "type": "Einreichung neuer Dokumente",
      "state": "Nordrhein-Westfalen",
      "amtsgericht": "Amtsgericht Dortmund",
      "registernummer": "HRB 28571",
      "registerart": "HRB",
      "company_name": "Top Tagungszentren AG",
      "company_seat": "Dortmund",
      "details": "24.04.2025 (Bekanntmachungsdatum)\n\nNordrhein-Westfalen Amtsgericht Dortmund HRB 28571\nEinreichung neuer Dokumente\n\nTop Tagungszentren AG\nAktiengesellschaft\nDortmund\n\nDem Registergericht ist eine Liste der Mitglieder des Aufsichtsrates eingereicht worden."
    },
    {
      "date": "2025-04-24",
      "id": "107310",
      "original_text": "Einreichung neuer Dokumente\nNordrhein-Westfalen Amtsgericht Köln HRB 49892\nCovestro Deutschland AG – Leverkusen",
      "type": "Einreichung neuer Dokumente",
      "state": "Nordrhein-Westfalen",
      "amtsgericht": "Amtsgericht Köln",
      "registernummer": "HRB 49892",
      "registerart": "HRB",
      "company_name": "Covestro Deutschland AG",
      "company_seat": "Leverkusen",
      "details": "24.04.2025 (Bekanntmachungsdatum)\n\nNordrhein-Westfalen Amtsgericht Köln HRB 49892\nEinreichung neuer Dokumente\n\nCovestro Deutschland AG\nAktiengesellschaft\nLeverkusen\n\nDem Registergericht ist eine Liste der Mitglieder des Aufsichtsrates eingereicht worden."
    },
    {
      "date": "2025-04-24",
      "id": "107311",
      "original_text": "Registerbekanntmachung nach dem Umwandlungsgesetz\nNordrhein-Westfalen Amtsgericht Düsseldorf HRB 98067\nKilian Tiefbohren GmbH – Langenfeld",
      "type": "Registerbekanntmachung nach dem Umwandlungsgesetz",
      "state": "Nordrhein-Westfalen",
      "amtsgericht": "Amtsgericht Düsseldorf",
      "registernummer": "HRB 98067",
      "registerart": "HRB",
      "company_name": "Kilian Tiefbohren GmbH",
      "company_seat": "Langenfeld",
      "details": "24.04.2025 (Bekanntmachungsdatum)\n\nNordrhein-Westfalen Amtsgericht Düsseldorf HRB 98067\nRegisterbekanntmachung nach dem Umwandlungsgesetz 24.04.2025 (Eintragungsdatum)\n\nKilian Tiefbohren GmbH\nGesellschaft mit beschränkter Haftung\nLangenfeld\n\nDen Gläubigern der an der Verschmelzung beteiligten Rechtsträger ist, wenn sie binnen sechs Monaten nach dem Tag, an dem die Eintragung der Verschmelzung in das Register des Sitzes desjenigen Rechtsträgers, dessen Gläubiger sie sind, nach § 19 Absatz 3 UmwG als bekanntgemacht gilt, ihren Anspruch nach Grund und Höhe schriftlich anmelden, Sicherheit zu leisten, soweit sie nicht Befriedigung verlangen können. Dieses Recht steht den Gläubigern jedoch nur zu, wenn sie glaubhaft machen, dass durch die Verschmelzung die Erfüllung ihrer Forderung gefährdet wird."
    },
    {
      "date": "2025-04-24",
      "id": "107312",
      "original_text": "Löschungsankündigung\nNordrhein-Westfalen Amtsgericht Mönchengladbach HRB 2652\nAMBIENTE Fashion GmbH – Mönchengladbach",
      "type": "Löschungsankündigung",
      "state": "Nordrhein-Westfalen",
      "amtsgericht": "Amtsgericht Mönchengladbach",
      "registernummer": "HRB 2652",
      "registerart": "HRB",
      "company_name": "AMBIENTE Fashion GmbH",
      "company_seat": "Mönchengladbach",
      "details": "24.04.2025 (Bekanntmachungsdatum)\n\nNordrhein-Westfalen Amtsgericht Mönchengladbach HRB 2652\nLöschungsankündigung 24.04.2025 (Eintragungsdatum)\n\nAMBIENTE Fashion GmbH\nGesellschaft mit beschränkter Haftung\nMönchengladbach\n\nDas Registergericht beabsichtigt die Gesellschaft von Amts wegen nach § 394 FamFG zu löschen. Die Frist zur Erhebung eines Widerspruchs ist auf drei Monate festgesetzt."
    },
    {
      "date": "2025-04-24",
      "id": "107313",
      "original_text": "Registerbekanntmachung nach dem Umwandlungsgesetz\nNordrhein-Westfalen Amtsgericht Neuss HRB 23203\nGeiger Germany GmbH – Neuss",
      "type": "Registerbekanntmachung nach dem Umwandlungsgesetz",
      "state": "Nordrhein-Westfalen",
      "amtsgericht": "Amtsgericht Neuss",
      "registernummer": "HRB 23203",
      "registerart": "HRB",
      "company_name": "Geiger Germany GmbH",
      "company_seat": "Neuss",
      "details": "24.04.2025 (Bekanntmachungsdatum)\n\nNordrhein-Westfalen Amtsgericht Neuss HRB 23203\nRegisterbekanntmachung nach dem Umwandlungsgesetz 24.04.2025 (Eintragungsdatum)\n\nGeiger Germany GmbH\nGesellschaft mit beschränkter Haftung\nNeuss\n\nDen Gläubigern der an der Verschmelzung beteiligten Rechtsträger ist, wenn sie binnen sechs Monaten nach dem Tag, an dem die Eintragung der Verschmelzung in das Register des Sitzes derjenigen Rechtsträger deren Gläubiger sie sind, nach § 19 Absatz 3 UmwG als bekanntgemacht gilt, ihren Anspruch nach Grund und Höhe schriftlich anmelden, Sicherheit zu leisten, soweit sie nicht Befriedigung verlangen können. Dieses Recht steht den Gläubigern jedoch nur zu, wenn sie glaubhaft machen, dass durch die Verschmelzung die Erfüllung ihrer Forderung gefährdet wird."
    },
    {
      "date": "2025-04-24",
      "id": "107314",
      "original_text": "Einreichung neuer Dokumente\nNordrhein-Westfalen Amtsgericht Köln HRB 121485\nneoshare AG – Köln",
      "type": "Einreichung neuer Dokumente",
      "state": "Nordrhein-Westfalen",
      "amtsgericht": "Amtsgericht Köln",
      "registernummer": "HRB 121485",
      "registerart": "HRB",
      "company_name": "neoshare AG",
      "company_seat": "Köln",
      "details": "24.04.2025 (Bekanntmachungsdatum)\n\nNordrhein-Westfalen Amtsgericht Köln HRB 121485\nEinreichung neuer Dokumente 24.04.2025 (Eintragungsdatum)\n\nneoshare AG\nAktiengesellschaft\nKöln\n\nDem Registergericht ist eine neue Liste der Mitglieder des Aufsichtsrates eingereicht worden."
    },
    {
      "date": "2025-04-24",
      "id": "107315",
      "original_text": "Registerbekanntmachung nach dem Umwandlungsgesetz\nNordrhein-Westfalen Amtsgericht Siegburg HRB 5732\nNEUTRALOX Umwelttechnik GmbH – Hennef (Sieg)",
      "type": "Registerbekanntmachung nach dem Umwandlungsgesetz",
      "state": "Nordrhein-Westfalen",
      "amtsgericht": "Amtsgericht Siegburg",
      "registernummer": "HRB 5732",
      "registerart": "HRB",
      "company_name": "NEUTRALOX Umwelttechnik GmbH",
      "company_seat": "Hennef (Sieg)",
      "details": "24.04.2025 (Bekanntmachungsdatum)\n\nNordrhein-Westfalen Amtsgericht Siegburg HRB 5732\nRegisterbekanntmachung nach dem Umwandlungsgesetz 24.04.2025 (Eintragungsdatum)\n\nNEUTRALOX Umwelttechnik GmbH\nGesellschaft mit beschränkter Haftung\nHennef (Sieg)\n\nDen Gläubigern der an der Verschmelzung beteiligten Rechtsträger ist, wenn sie binnen sechs Monaten nach dem Tag, an dem die Eintragung der Verschmelzung in das Register des Sitzes desjenigen Rechtsträgers, dessen Gläubiger sie sind, nach § 19 Absatz 3 UmwG als bekanntgemacht gilt, ihren Anspruch nach Grund und Höhe schriftlich anmelden, Sicherheit zu leisten, soweit sie nicht Befriedigung verlangen können. Dieses Recht steht den Gläubigern jedoch nur zu, wenn sie glaubhaft machen, dass durch die Verschmelzung die Erfüllung ihrer Forderung gefährdet wird."
    },
    {
      "date": "2025-04-24",
      "id": "107316",
      "original_text": "Löschungsankündigung\nNordrhein-Westfalen Amtsgericht Mönchengladbach VR 5637\nTierhilfe West e.V. – Jüchen",
      "type": "Löschungsankündigung",
      "state": "Nordrhein-Westfalen",
      "amtsgericht": "Amtsgericht Mönchengladbach",
      "registernummer": "VR 5637",
      "registerart": "VR",
      "company_name": "Tierhilfe West e.V.",
      "company_seat": "Jüchen",
      "details": "24.04.2025 (Bekanntmachungsdatum)\n\nNordrhein-Westfalen Amtsgericht Mönchengladbach VR 5637\nLöschungsankündigung 24.04.2025 (Eintragungsdatum)\n\nTierhilfe West e.V.\neingetragener Verein\nJüchen\n\nDas Registergericht beabsichtigt, den Verein von Amts wegen aus dem Vereinsregister zu löschen, da davon ausgegangen wird, dass der Verein keine Mitglieder mehr hat.\nEs wird hiermit eine Frist von drei Monaten eingeräumt, um einen Widerspruch gegen die beabsichtigte Löschung geltend zu machen. Diesen Widerspruch können Sie nur damit begründen, dass der Verein noch über mehr Mitglieder verfügt oder alsbald wieder verfügen wird. Entsprechende Angaben sind glaubhaft zu machen."
    },
    {
      "date": "2025-04-24",
      "id": "107317",
      "original_text": "Löschungsankündigung\nNordrhein-Westfalen Amtsgericht Dortmund HRB 32952\ninfinity-personal UG (haftungsbeschränkt) – Dortmund",
      "type": "Löschungsankündigung",
      "state": "Nordrhein-Westfalen",
      "amtsgericht": "Amtsgericht Dortmund",
      "registernummer": "HRB 32952",
      "registerart": "HRB",
      "company_name": "infinity-personal UG (haftungsbeschränkt)",
      "company_seat": "Dortmund",
      "details": "24.04.2025 (Bekanntmachungsdatum)\n\nNordrhein-Westfalen Amtsgericht Dortmund HRB 32952\nLöschungsankündigung 24.04.2025 (Eintragungsdatum)\n\ninfinity-personal UG (haftungsbeschränkt)\nGesellschaft mit beschränkter Haftung\nDortmund\n\nDas Registergericht beabsichtigt die Gesellschaft von Amts wegen nach § 394 FamFG zu löschen. Die Frist zur Erhebung eines Widerspruchs ist auf zwei Monate festgesetzt."
    },
    {
      "date": "2025-04-24",
      "id": "107318",
      "original_text": "Registerbekanntmachung nach dem Umwandlungsgesetz\nNordrhein-Westfalen Amtsgericht Münster HRA 8605\nDegener & Friends GmbH & Co KG – Oelde",
      "type": "Registerbekanntmachung nach dem Umwandlungsgesetz",
      "state": "Nordrhein-Westfalen",
      "amtsgericht": "Amtsgericht Münster",
      "registernummer": "HRA 8605",
      "registerart": "HRA",
      "company_name": "Degener & Friends GmbH & Co KG",
      "company_seat": "Oelde",
      "details": "24.04.2025 (Bekanntmachungsdatum)\n\nNordrhein-Westfalen Amtsgericht Münster HRA 8605\nRegisterbekanntmachung nach dem Umwandlungsgesetz 24.04.2025 (Eintragungsdatum)\n\nDegener & Friends GmbH & Co KG\nKommanditgesellschaft\nOelde\n\nDen Gläubigern der an der Ausgliederung beteiligten Rechtsträger ist, wenn sie binnen sechs Monaten nach dem Tag, an dem die Eintragung der Ausgliederung in das Register des Sitzes derjenigen Rechtsträger deren Gläubiger sie sind, nach § 19 Absatz 3 UmwG als bekanntgemacht gilt, ihren Anspruch nach Grund und Höhe schriftlich anmelden, Sicherheit zu leisten, soweit sie nicht Befriedigung verlangen können. Dieses Recht steht den Gläubigern jedoch nur zu, wenn sie glaubhaft machen, dass durch die Ausgliederung die Erfüllung ihrer Forderung gefährdet wird."
    },
    {
      "date": "2025-04-24",
      "id": "107319",
      "original_text": "Löschungsankündigung\nNordrhein-Westfalen Amtsgericht Wuppertal HRB 30829\nAlexi Gastronomia UG (haftungsbeschränkt) – Velbert",
      "type": "Löschungsankündigung",
      "state": "Nordrhein-Westfalen",
      "amtsgericht": "Amtsgericht Wuppertal",
      "registernummer": "HRB 30829",
      "registerart": "HRB",
      "company_name": "Alexi Gastronomia UG (haftungsbeschränkt)",
      "company_seat": "Velbert",
      "details": "24.04.2025 (Bekanntmachungsdatum)\n\nNordrhein-Westfalen Amtsgericht Wuppertal HRB 30829\nLöschungsankündigung\n\nAlexi Gastronomia UG (haftungsbeschränkt)\nGesellschaft mit beschränkter Haftung\nVelbert\n\nDas Registergericht beabsichtigt die Gesellschaft von Amts wegen nach § 394 FamFG zu löschen. Die Frist zur Erhebung eines Widerspruchs ist auf einen Monat festgesetzt."
    },
    {
      "date": "2025-04-24",
      "id": "107320",
      "original_text": "Registerbekanntmachung nach dem Umwandlungsgesetz\nNordrhein-Westfalen Amtsgericht Düsseldorf HRB 56272\nAxonics GmbH – Ratingen",
      "type": "Registerbekanntmachung nach dem Umwandlungsgesetz",
      "state": "Nordrhein-Westfalen",
      "amtsgericht": "Amtsgericht Düsseldorf",
      "registernummer": "HRB 56272",
      "registerart": "HRB",
      "company_name": "Axonics GmbH",
      "company_seat": "Ratingen",
      "details": "24.04.2025 (Bekanntmachungsdatum)\n\nNordrhein-Westfalen Amtsgericht Düsseldorf HRB 56272\nRegisterbekanntmachung nach dem Umwandlungsgesetz 24.04.2025 (Eintragungsdatum)\n\nAxonics GmbH\nGesellschaft mit beschränkter Haftung\nRatingen\n\nDen Gläubigern der an der Verschmelzung beteiligten Rechtsträger ist, wenn sie binnen sechs Monaten nach dem Tag, an dem die Eintragung der Verschmelzung in das Register des Sitzes desjenigen Rechtsträgers, dessen Gläubiger sie sind, nach § 19 Absatz 3 UmwG als bekanntgemacht gilt, ihren Anspruch nach Grund und Höhe schriftlich anmelden, Sicherheit zu leisten, soweit sie nicht Befriedigung verlangen können. Dieses Recht steht den Gläubigern jedoch nur zu, wenn sie glaubhaft machen, dass durch die Verschmelzung die Erfüllung ihrer Forderung gefährdet wird."
    },
    {
      "date": "2025-04-24",
      "id": "107321",
      "original_text": "Registerbekanntmachung nach dem Umwandlungsgesetz\nNordrhein-Westfalen Amtsgericht Neuss HRB 20974\nALDI Dormagen Verwaltungs-SE – Dormagen",
      "type": "Registerbekanntmachung nach dem Umwandlungsgesetz",
      "state": "Nordrhein-Westfalen",
      "amtsgericht": "Amtsgericht Neuss",
      "registernummer": "HRB 20974",
      "registerart": "HRB",
      "company_name": "ALDI Dormagen Verwaltungs-SE",
      "company_seat": "Dormagen",
      "details": "24.04.2025 (Bekanntmachungsdatum)\n\nNordrhein-Westfalen Amtsgericht Neuss HRB 20974\nRegisterbekanntmachung nach dem Umwandlungsgesetz\n\nALDI Dormagen Verwaltungs-SE\nEuropäische Aktiengesellschaft (SE)\nDormagen\n\nDem Registergericht ist der Entwurf eines Vertrages über die geplante Verschmelzung der ALDI Dormagen Verwaltungs-SE mit der ALDI Bingen Verwaltungs-SE (eingetragen beim AG Mainz unter HRB 50443), als aufnehmender Gesellschaft eingereicht worden."
    },
    {
      "date": "2025-04-24",
      "id": "107322",
      "original_text": "Löschungsankündigung\nNordrhein-Westfalen Amtsgericht Hamm HRB 8473\nIker GmbH – Bergkamen",
      "type": "Löschungsankündigung",
      "state": "Nordrhein-Westfalen",
      "amtsgericht": "Amtsgericht Hamm",
      "registernummer": "HRB 8473",
      "registerart": "HRB",
      "company_name": "Iker GmbH",
      "company_seat": "Bergkamen",
      "details": "24.04.2025 (Bekanntmachungsdatum)\n\nNordrhein-Westfalen Amtsgericht Hamm HRB 8473\nLöschungsankündigung\n\nIker GmbH\nGesellschaft mit beschränkter Haftung\nBergkamen\n\nDas Registergericht beabsichtigt die Gesellschaft von Amts wegen nach § 394 FamFG zu löschen. Die Frist zur Erhebung eines Widerspruchs ist auf drei Monate festgesetzt."
    },
    {
      "date": "2025-04-24",
      "id": "107323",
      "original_text": "Registerbekanntmachung nach dem Umwandlungsgesetz\nNordrhein-Westfalen Amtsgericht Köln HRA 37982\nKohlgraf Consulting e.K. – Köln",
      "type": "Registerbekanntmachung nach dem Umwandlungsgesetz",
      "state": "Nordrhein-Westfalen",
      "amtsgericht": "Amtsgericht Köln",
      "registernummer": "HRA 37982",
      "registerart": "HRA",
      "company_name": "Kohlgraf Consulting e.K.",
      "company_seat": "Köln",
      "details": "24.04.2025 (Bekanntmachungsdatum)\n\nNordrhein-Westfalen Amtsgericht Köln HRA 37982\nRegisterbekanntmachung nach dem Umwandlungsgesetz 24.04.2025 (Eintragungsdatum)\n\nKohlgraf Consulting e.K.\nEinzelkaufmann / Einzelkauffrau\nKöln\n\nDen Gläubigern der an der Ausgliederung beteiligten Rechtsträger ist, wenn sie binnen sechs Monaten nach dem Tag, an dem die Eintragung der Ausgliederung in das Register des Sitzes desjenigen Rechtsträgers, dessen Gläubiger sie sind, nach § 19 Absatz 3 UmwG als bekanntgemacht gilt, ihren Anspruch nach Grund und Höhe schriftlich anmelden, Sicherheit zu leisten, soweit sie nicht Befriedigung verlangen können. Dieses Recht steht den Gläubigern jedoch nur zu, wenn sie glaubhaft machen, dass durch die Ausgliederung die Erfüllung ihrer Forderung gefährdet wird."
    },
    {
      "date": "2025-04-24",
      "id": "107324",
      "original_text": "Registerbekanntmachung nach dem Umwandlungsgesetz\nThüringen Amtsgericht Jena HRB 506966\nQSIL GmbH Quarzschmelze Ilmenau – Ilmenau",
      "type": "Registerbekanntmachung nach dem Umwandlungsgesetz",
      "state": "Thüringen",
      "amtsgericht": "Amtsgericht Jena",
      "registernummer": "HRB 506966",
      "registerart": "HRB",
      "company_name": "QSIL GmbH Quarzschmelze Ilmenau",
      "company_seat": "Ilmenau",
      "details": "24.04.2025 (Bekanntmachungsdatum)\n\nThüringen Amtsgericht Jena HRB 506966\nRegisterbekanntmachung nach dem Umwandlungsgesetz 24.04.2025 (Eintragungsdatum)\n\nQSIL GmbH Quarzschmelze Ilmenau\nGesellschaft mit beschränkter Haftung\nIlmenau\n\nNicht eingetragen: Den Gläubigern der an der Verschmelzung beteiligten Rechtsträger, ist wenn sie binnen sechs Monaten nach dem Tag, an dem die Eintragung der Verschmelzung in das Register des Sitzes desjenigen Rechtsträgers, dessen Gläubiger sie sind,  nach § 19 Abs. 3 UmwG als bekanntgemacht gilt, ihren Anspruch nach Grund und Höhe schriftlich anmelden, Sicherheit zu leisten, soweit sie nicht Befriedigung verlangen können. Dieses Recht steht ihnen jedoch nur zu, wenn sie glaubhaft machen, daß durch die Verschmelzung die Erfüllung ihrer Forderung gefährdet wird."
    },
    {
      "date": "2025-04-24",
      "id": "107325",
      "original_text": "Registerbekanntmachung nach dem Umwandlungsgesetz\nNiedersachsen Amtsgericht Hannover HRB 6117\nE+S Rückversicherung AG – Hannover",
      "type": "Registerbekanntmachung nach dem Umwandlungsgesetz",
      "state": "Niedersachsen",
      "amtsgericht": "Amtsgericht Hannover",
      "registernummer": "HRB 6117",
      "registerart": "HRB",
      "company_name": "E+S Rückversicherung AG",
      "company_seat": "Hannover",
      "details": "24.04.2025 (Bekanntmachungsdatum)\n\nNiedersachsen Amtsgericht Hannover HRB 6117\nRegisterbekanntmachung nach dem Umwandlungsgesetz\n\nE+S Rückversicherung AG\nAktiengesellschaft\nHannover\n\n(Wiederholte Veröffentlichung) Beim Handelsregister ist der Entwurf eines Verschmelzungsvertrages vom 17.04.2025 eingereicht worden. Danach soll die Gesellschaft  - als übernehmende Gesellschaft - mit der E+S Private Equity Beteiligungen GmbH (Amtsgericht Hannover HRB 227526) verschmolzen werden."
    },
    {
      "date": "2025-04-24",
      "id": "107326",
      "original_text": "Einreichung neuer Dokumente\nHessen Amtsgericht Frankfurt am Main HRB 42397\nABG FRANKFURT HOLDING Wohnungsbau- und Beteiligungsgesellschaft mit beschränkter Haftung – Frankfurt am Main",
      "type": "Einreichung neuer Dokumente",
      "state": "Hessen",
      "amtsgericht": "Amtsgericht Frankfurt am Main",
      "registernummer": "HRB 42397",
      "registerart": "HRB",
      "company_name": "ABG FRANKFURT HOLDING Wohnungsbau- und Beteiligungsgesellschaft mit beschränkter Haftung",
      "company_seat": "Frankfurt am Main",
      "details": "24.04.2025 (Bekanntmachungsdatum)\n\nHessen Amtsgericht Frankfurt am Main HRB 42397\nEinreichung neuer Dokumente 24.04.2025 (Eintragungsdatum)\n\nABG FRANKFURT HOLDING Wohnungsbau- und Beteiligungsgesellschaft mit beschränkter Haftung\nGesellschaft mit beschränkter Haftung\nFrankfurt am Main\n\nDurch eine Änderung in den Personen der Aufsichtsratsmitglieder ist eine Liste der Mitglieder des Aufsichtsrates zum Handelsregister eingereicht worden."
    },
    {
      "date": "2025-04-24",
      "id": "107327",
      "original_text": "Löschungsankündigung\nHessen Amtsgericht Hanau HRB 95938\nMyMobile Store GmbH – Maintal",
      "type": "Löschungsankündigung",
      "state": "Hessen",
      "amtsgericht": "Amtsgericht Hanau",
      "registernummer": "HRB 95938",
      "registerart": "HRB",
      "company_name": "MyMobile Store GmbH",
      "company_seat": "Maintal",
      "details": "24.04.2025 (Bekanntmachungsdatum)\n\nHessen Amtsgericht Hanau HRB 95938\nLöschungsankündigung\n\nMyMobile Store GmbH\nGesellschaft mit beschränkter Haftung\nMaintal\n\nDas Registergericht beabsichtigt die im Handelsregister eingetragene Gesellschaft von Amts wegen nach § 394 FamFG zu löschen. Die Frist zur Erhebung eines Widerspruchs gegen die beabsichtigte Löschung wird auf 3 Monate festgesetzt."
    },
    {
      "date": "2025-04-24",
      "id": "107328",
      "original_text": "Sonstige Registerbekanntmachung\nHessen Amtsgericht Wiesbaden GnR 301\nWiesbadener Volksbank eG – Wiesbaden",
      "type": "Sonstige Registerbekanntmachung",
      "state": "Hessen",
      "amtsgericht": "Amtsgericht Wiesbaden",
      "registernummer": "GnR 301",
      "registerart": "GnR",
      "company_name": "Wiesbadener Volksbank eG",
      "company_seat": "Wiesbaden",
      "details": "24.04.2025 (Bekanntmachungsdatum)\n\nHessen Amtsgericht Wiesbaden GnR 301\nSonstige Registerbekanntmachung 03.06.2024 (Eintragungsdatum)\n\nWiesbadener Volksbank eG\neingetragene Genossenschaft\nWiesbaden\n\nNeue Regelung: § 46 (Nachschusspflicht) - Entfall der Nachschusspflicht. Den Gläubigern der Genossenschaft ist, wenn sie sich binnen sechs Monaten nach dieser Bekanntmachung zu diesem Zweck bei der Genossenschaft melden, Sicherheit zu leisten, soweit sie nicht Befriedigung verlangen können."
    },
    {
      "date": "2025-04-24",
      "id": "107329",
      "original_text": "Registerbekanntmachung nach dem Umwandlungsgesetz\nHessen Amtsgericht Wiesbaden HRB 26026\nQuinta 60. Verwaltungs UG (haftungsbeschränkt) – Wiesbaden",
      "type": "Registerbekanntmachung nach dem Umwandlungsgesetz",
      "state": "Hessen",
      "amtsgericht": "Amtsgericht Wiesbaden",
      "registernummer": "HRB 26026",
      "registerart": "HRB",
      "company_name": "Quinta 60. Verwaltungs UG (haftungsbeschränkt)",
      "company_seat": "Wiesbaden",
      "details": "24.04.2025 (Bekanntmachungsdatum)\n\nHessen Amtsgericht Wiesbaden HRB 26026\nRegisterbekanntmachung nach dem Umwandlungsgesetz 24.04.2025 (Eintragungsdatum)\n\nQuinta 60. Verwaltungs UG (haftungsbeschränkt)\nGesellschaft mit beschränkter Haftung\nWiesbaden\n\nDen Gläubigern der an der Verschmelzung beteiligten Rechtsträger ist, wenn sie binnen sechs Monaten nach dem Tag, an dem die Eintragung der Verschmelzung in das Register des Sitzes derjenigen Rechtsträger deren Gläubiger sie sind, nach § 19 Absatz 3 UmwG bekannt gemacht worden ist, ihren Anspruch nach Grund und Höhe schriftlich anmelden, Sicherheit zu leisten, soweit sie nicht Befriedigung verlangen können. Dieses Recht steht den Gläubigern jedoch nur zu, wenn sie glaubhaft machen, dass durch die Verschmelzung die Erfüllung ihrer Forderung gefährdet wird."
    },
    {
      "date": "2025-04-24",
      "id": "107330",
      "original_text": "Löschungsankündigung\nHessen Amtsgericht Korbach HRB 346\nDialogo Werbeagentur GmbH – Willingen",
      "type": "Löschungsankündigung",
      "state": "Hessen",
      "amtsgericht": "Amtsgericht Korbach",
      "registernummer": "HRB 346",
      "registerart": "HRB",
      "company_name": "Dialogo Werbeagentur GmbH",
      "company_seat": "Willingen",
      "details": "24.04.2025 (Bekanntmachungsdatum)\n\nHessen Amtsgericht Korbach HRB 346\nLöschungsankündigung 24.04.2025 (Eintragungsdatum)\n\nDialogo Werbeagentur GmbH\nGesellschaft mit beschränkter Haftung\nWillingen\n\nDas Registergericht beabsichtigt die im Handelsregister eingetragene Gesellschaft von Amts wegen nach § 394 FamFG zu löschen. Die Frist zur Erhebung eines Widerspruchs gegen die beabsichtigte Löschung wird auf 3 Monate festgesetzt."
    },
    {
      "date": "2025-04-24",
      "id": "107331",
      "original_text": "Sonstige Registerbekanntmachung\nHessen Amtsgericht Wiesbaden HRB 23433\nR+V Direktversicherung AG – Wiesbaden",
      "type": "Sonstige Registerbekanntmachung",
      "state": "Hessen",
      "amtsgericht": "Amtsgericht Wiesbaden",
      "registernummer": "HRB 23433",
      "registerart": "HRB",
      "company_name": "R+V Direktversicherung AG",
      "company_seat": "Wiesbaden",
      "details": "24.04.2025 (Bekanntmachungsdatum)\n\nHessen Amtsgericht Wiesbaden HRB 23433\nSonstige Registerbekanntmachung 24.04.2025 (Eintragungsdatum)\n\nR+V Direktversicherung AG\nAktiengesellschaft\nWiesbaden\n\nDurch eine Änderung in den Personen der Aufsichtsratsmitglieder ist eine Liste der Mitglieder des Aufsichtsrates zum Handelsregister eingereicht worden."
    },
    {
      "date": "2025-04-24",
      "id": "107332",
      "original_text": "Registerbekanntmachung nach dem Umwandlungsgesetz\nHessen Amtsgericht Wiesbaden HRA 11705\nIT-CONSULTING HFK KRAIBOOJ e.K. – Wiesbaden",
      "type": "Registerbekanntmachung nach dem Umwandlungsgesetz",
      "state": "Hessen",
      "amtsgericht": "Amtsgericht Wiesbaden",
      "registernummer": "HRA 11705",
      "registerart": "HRA",
      "company_name": "IT-CONSULTING HFK KRAIBOOJ e.K.",
      "company_seat": "Wiesbaden",
      "details": "24.04.2025 (Bekanntmachungsdatum)\n\nHessen Amtsgericht Wiesbaden HRA 11705\nRegisterbekanntmachung nach dem Umwandlungsgesetz 24.04.2025 (Eintragungsdatum)\n\nIT-CONSULTING HFK KRAIBOOJ e.K.\nEinzelkaufmann / Einzelkauffrau\nWiesbaden\n\nDen Gläubigern der an der formwechselnden Umwandlung beteiligten Rechtsträger ist, wenn sie binnen sechs Monaten nach dem Tag, an dem die Eintragung der formwechselnden Umwandlung in das Register des Sitzes derjenigen Rechtsträger deren Gläubiger sie sind, nach § 201 UmwG bekannt gemacht worden ist, ihren Anspruch nach Grund und Höhe schriftlich anmelden, Sicherheit zu leisten, soweit sie nicht Befriedigung verlangen können. Dieses Recht steht den Gläubigern jedoch nur zu, wenn sie glaubhaft machen, dass durch die formwechselnden Umwandlung die Erfüllung ihrer Forderung gefährdet wird."
    },
    {
      "date": "2025-04-24",
      "id": "107333",
      "original_text": "Sonstige Registerbekanntmachung\nHessen Amtsgericht Fritzlar VR 1292\nVK-Taekwon-Do Homberg e.V. – Homberg (Efze)",
      "type": "Sonstige Registerbekanntmachung",
      "state": "Hessen",
      "amtsgericht": "Amtsgericht Fritzlar",
      "registernummer": "VR 1292",
      "registerart": "VR",
      "company_name": "VK-Taekwon-Do Homberg e.V.",
      "company_seat": "Homberg (Efze)",
      "details": "24.04.2025 (Bekanntmachungsdatum)\n\nHessen Amtsgericht Fritzlar VR 1292\nSonstige Registerbekanntmachung 24.04.2025 (Eintragungsdatum)\n\nVK-Taekwon-Do Homberg e.V.\neingetragener Verein\nHomberg (Efze)\n\nDer Verein ist aufgelöst."
    },
    {
      "date": "2025-04-24",
      "id": "107334",
      "original_text": "Sonstige Registerbekanntmachung\nHessen Amtsgericht Darmstadt VR 84438\nInvades eSports e.V. – Ober-Ramstadt",
      "type": "Sonstige Registerbekanntmachung",
      "state": "Hessen",
      "amtsgericht": "Amtsgericht Darmstadt",
      "registernummer": "VR 84438",
      "registerart": "VR",
      "company_name": "Invades eSports e.V.",
      "company_seat": "Ober-Ramstadt",
      "details": "24.04.2025 (Bekanntmachungsdatum)\n\nHessen Amtsgericht Darmstadt VR 84438\nSonstige Registerbekanntmachung 24.04.2025 (Eintragungsdatum)\n\nInvades eSports e.V.\neingetragener Verein\nOber-Ramstadt\n\nDer Verein ist aufgelöst."
    },
    {
      "date": "2025-04-24",
      "id": "107335",
      "original_text": "Registerbekanntmachung nach dem Umwandlungsgesetz\nHessen Amtsgericht Gießen HRB 8076\nHolzland Gießen GmbH – Gießen",
      "type": "Registerbekanntmachung nach dem Umwandlungsgesetz",
      "state": "Hessen",
      "amtsgericht": "Amtsgericht Gießen",
      "registernummer": "HRB 8076",
      "registerart": "HRB",
      "company_name": "Holzland Gießen GmbH",
      "company_seat": "Gießen",
      "details": "24.04.2025 (Bekanntmachungsdatum)\n\nHessen Amtsgericht Gießen HRB 8076\nRegisterbekanntmachung nach dem Umwandlungsgesetz 24.04.2025 (Eintragungsdatum)\n\nHolzland Gießen GmbH\nGesellschaft mit beschränkter Haftung\nGießen\n\nDen Gläubigern der an der Verschmelzung beteiligten Rechtsträger ist, wenn sie binnen sechs Monaten nach dem Tag, an dem die Eintragung der Verschmelzung in das Register des Sitzes desjenigen Rechtsträgers, dessen Gläubiger sie sind, nach § 19 Absatz 3 UmwG bekannt gemacht worden ist, ihren Anspruch nach Grund und Höhe schriftlich anmelden, Sicherheit zu leisten, soweit sie nicht Befriedigung verlangen können. Dieses Recht steht den Gläubigern jedoch nur zu, wenn sie glaubhaft machen, dass durch die Verschmelzung die Erfüllung ihrer Forderung gefährdet wird."
    },
    {
      "date": "2025-04-24",
      "id": "107336",
      "original_text": "Registerbekanntmachung nach dem Umwandlungsgesetz\nHessen Amtsgericht Gießen HRB 5487\nAutohaus Hartwich & Kress GmbH – Lauterbach (Hessen)",
      "type": "Registerbekanntmachung nach dem Umwandlungsgesetz",
      "state": "Hessen",
      "amtsgericht": "Amtsgericht Gießen",
      "registernummer": "HRB 5487",
      "registerart": "HRB",
      "company_name": "Autohaus Hartwich & Kress GmbH",
      "company_seat": "Lauterbach (Hessen)",
      "details": "24.04.2025 (Bekanntmachungsdatum)\n\nHessen Amtsgericht Gießen HRB 5487\nRegisterbekanntmachung nach dem Umwandlungsgesetz 24.04.2025 (Eintragungsdatum)\n\nAutohaus Hartwich & Kress GmbH\nGesellschaft mit beschränkter Haftung\nLauterbach (Hessen)\n\nDen Gläubigern der an der Verschmelzung beteiligten Rechtsträger ist, wenn sie binnen sechs Monaten nach dem Tag, an dem die Eintragung der Verschmelzung in das Register des Sitzes desjenigen Rechtsträgers, dessen Gläubiger sie sind, nach § 19 Absatz 3 UmwG bekannt gemacht worden ist, ihren Anspruch nach Grund und Höhe schriftlich anmelden, Sicherheit zu leisten, soweit sie nicht Befriedigung verlangen können. Dieses Recht steht den Gläubigern jedoch nur zu, wenn sie glaubhaft machen, dass durch die Verschmelzung die Erfüllung ihrer Forderung gefährdet wird."
    }
  ]
}