{
  "date": "2025-04-29",
  "date_of_scrape": "2025-05-31T07:17:18.262Z",
  "tool_version": "0.2.0",
  "number_of_announcements": 141,
  "announcements": [
    {
      "date": "2025-04-29",
      "id": "107563",
      "original_text": "Registerbekanntmachung nach dem Umwandlungsgesetz\nBayern Amtsgericht München HRB 148179\nGBV Grundbesitzverwaltung 20 GmbH – Erding",
      "type": "Registerbekanntmachung nach dem Umwandlungsgesetz",
      "state": "Bayern",
      "amtsgericht": "Amtsgericht München",
      "registernummer": "HRB 148179",
      "registerart": "HRB",
      "company_name": "GBV Grundbesitzverwaltung 20 GmbH",
      "company_seat": "Erding",
      "details": "29.04.2025 (Bekanntmachungsdatum)\n\nBayern Amtsgericht München HRB 148179\nRegisterbekanntmachung nach dem Umwandlungsgesetz 28.04.2025 (Eintragungsdatum)\n\nGBV Grundbesitzverwaltung 20 GmbH\nGesellschaft mit beschränkter Haftung\nErding\n\nDen Gläubigern der an der Verschmelzung beteiligten Rechtsträger ist, wenn sie binnen sechs Monaten nach dem Tag, an dem die Eintragung der Verschmelzung in das Register des Sitzes desjenigen Rechtsträgers, dessen Gläubiger sie sind, nach § 19 Abs. 3 UmwG als bekannt gemacht gilt, ihren Anspruch nach Grund und Höhe in Textform anmelden, Sicherheit zu leisten, soweit sie nicht Befriedigung verlangen können. Dieses Recht steht den Gläubigern jedoch nur zu, wenn sie glaubhaft machen, dass durch die Verschmelzung die Erfüllung ihrer Forderung gefährdet wird."
    },
    {
      "date": "2025-04-29",
      "id": "107564",
      "original_text": "Registerbekanntmachung nach dem Umwandlungsgesetz\nBayern Amtsgericht München HRA 120851\nProSale Handelsgesellschaft LLC & Co. KG – München",
      "type": "Registerbekanntmachung nach dem Umwandlungsgesetz",
      "state": "Bayern",
      "amtsgericht": "Amtsgericht München",
      "registernummer": "HRA 120851",
      "registerart": "HRA",
      "company_name": "ProSale Handelsgesellschaft LLC & Co. KG",
      "company_seat": "München",
      "details": "29.04.2025 (Bekanntmachungsdatum)\n\nBayern Amtsgericht München HRA 120851\nRegisterbekanntmachung nach dem Umwandlungsgesetz 28.04.2025 (Eintragungsdatum)\n\nProSale Handelsgesellschaft LLC & Co. KG\nKommanditgesellschaft\nMünchen\n\nDen Gläubigern der an der Verschmelzung beteiligten Rechtsträger ist, wenn sie binnen sechs Monaten nach dem Tag, an dem die Eintragung der Verschmelzung in das Register des Sitzes desjenigen Rechtsträgers, dessen Gläubiger sie sind, nach § 19 Abs. 3 UmwG als bekannt gemacht gilt, ihren Anspruch nach Grund und Höhe in Textform anmelden, Sicherheit zu leisten, soweit sie nicht Befriedigung verlangen können. Dieses Recht steht den Gläubigern jedoch nur zu, wenn sie glaubhaft machen, dass durch die Verschmelzung die Erfüllung ihrer Forderung gefährdet wird."
    },
    {
      "date": "2025-04-29",
      "id": "107565",
      "original_text": "Registerbekanntmachung nach dem Umwandlungsgesetz\nBayern Amtsgericht München HRB 282603\nPNZ A23 Beteiligungs GmbH – München",
      "type": "Registerbekanntmachung nach dem Umwandlungsgesetz",
      "state": "Bayern",
      "amtsgericht": "Amtsgericht München",
      "registernummer": "HRB 282603",
      "registerart": "HRB",
      "company_name": "PNZ A23 Beteiligungs GmbH",
      "company_seat": "München",
      "details": "29.04.2025 (Bekanntmachungsdatum)\n\nBayern Amtsgericht München HRB 282603\nRegisterbekanntmachung nach dem Umwandlungsgesetz 28.04.2025 (Eintragungsdatum)\n\nPNZ A23 Beteiligungs GmbH\nGesellschaft mit beschränkter Haftung\nMünchen\n\nDen Gläubigern der an der Verschmelzung beteiligten Rechtsträger ist, wenn sie binnen sechs Monaten nach dem Tag, an dem die Eintragung der Verschmelzung in das Register des Sitzes desjenigen Rechtsträgers, dessen Gläubiger sie sind, nach § 19 Abs. 3 UmwG als bekannt gemacht gilt, ihren Anspruch nach Grund und Höhe in Textform anmelden, Sicherheit zu leisten, soweit sie nicht Befriedigung verlangen können. Dieses Recht steht den Gläubigern jedoch nur zu, wenn sie glaubhaft machen, dass durch die Verschmelzung die Erfüllung ihrer Forderung gefährdet wird."
    },
    {
      "date": "2025-04-29",
      "id": "107566",
      "original_text": "Registerbekanntmachung nach dem Umwandlungsgesetz\nBayern Amtsgericht München HRB 110694\nFranz Weber GmbH – Bad Tölz",
      "type": "Registerbekanntmachung nach dem Umwandlungsgesetz",
      "state": "Bayern",
      "amtsgericht": "Amtsgericht München",
      "registernummer": "HRB 110694",
      "registerart": "HRB",
      "company_name": "Franz Weber GmbH",
      "company_seat": "Bad Tölz",
      "details": "29.04.2025 (Bekanntmachungsdatum)\n\nBayern Amtsgericht München HRB 110694\nRegisterbekanntmachung nach dem Umwandlungsgesetz 28.04.2025 (Eintragungsdatum)\n\nFranz Weber GmbH\nGesellschaft mit beschränkter Haftung\nBad Tölz\n\nDen Gläubigern der an der Verschmelzung beteiligten Rechtsträger ist, wenn sie binnen sechs Monaten nach dem Tag, an dem die Eintragung der Verschmelzung in das Register des Sitzes desjenigen Rechtsträgers, dessen Gläubiger sie sind, nach § 19 Abs. 3 UmwG als bekannt gemacht gilt, ihren Anspruch nach Grund und Höhe in Textform anmelden, Sicherheit zu leisten, soweit sie nicht Befriedigung verlangen können. Dieses Recht steht den Gläubigern jedoch nur zu, wenn sie glaubhaft machen, dass durch die Verschmelzung die Erfüllung ihrer Forderung gefährdet wird."
    },
    {
      "date": "2025-04-29",
      "id": "107567",
      "original_text": "Sonstige Registerbekanntmachung\nBayern Amtsgericht Regensburg HRB 21529\nblick-store GmbH – Regensburg",
      "type": "Sonstige Registerbekanntmachung",
      "state": "Bayern",
      "amtsgericht": "Amtsgericht Regensburg",
      "registernummer": "HRB 21529",
      "registerart": "HRB",
      "company_name": "blick-store GmbH",
      "company_seat": "Regensburg",
      "details": "29.04.2025 (Bekanntmachungsdatum)\n\nBayern Amtsgericht Regensburg HRB 21529\nSonstige Registerbekanntmachung 28.04.2025 (Eintragungsdatum)\n\nblick-store GmbH\nGesellschaft mit beschränkter Haftung\nRegensburg\n\nDen Gläubigern der Gesellschaft, deren Forderungen begründet worden sind, bevor die Eintragung der Beendigung des Gewinnabführungsvertrages in das Handelsregister nach § 10 des Handelsgesetzbuches als bekanntgemacht gilt, hat der andere Vertragsteil Sicherheit zu leisten, wenn sie sich binnen sechs Monaten nach der Bekanntmachung der Eintragung zu diesem Zweck bei ihm melden."
    },
    {
      "date": "2025-04-29",
      "id": "107568",
      "original_text": "Einreichung neuer Dokumente\nBayern Amtsgericht München HRB 241858\nAkarion AG – München",
      "type": "Einreichung neuer Dokumente",
      "state": "Bayern",
      "amtsgericht": "Amtsgericht München",
      "registernummer": "HRB 241858",
      "registerart": "HRB",
      "company_name": "Akarion AG",
      "company_seat": "München",
      "details": "29.04.2025 (Bekanntmachungsdatum)\n\nBayern Amtsgericht München HRB 241858\nEinreichung neuer Dokumente 28.04.2025 (Eintragungsdatum)\n\nAkarion AG\nAktiengesellschaft\nMünchen\n\nDem Amtsgericht München -Registergericht- ist eine Liste der Mitglieder des Aufsichtsrats eingereicht worden, § 106 AktG."
    },
    {
      "date": "2025-04-29",
      "id": "107569",
      "original_text": "Löschungsankündigung\nBayern Amtsgericht Kempten (Allgäu) HRB 8181\nKanzlei für wirtschaftliche Beratung und Vermittlungs-GmbH Kempten – Kempten (Allgäu)",
      "type": "Löschungsankündigung",
      "state": "Bayern",
      "amtsgericht": "Amtsgericht Kempten (Allgäu)",
      "registernummer": "HRB 8181",
      "registerart": "HRB",
      "company_name": "Kanzlei für wirtschaftliche Beratung und Vermittlungs-GmbH Kempten",
      "company_seat": "Kempten (Allgäu)",
      "details": "29.04.2025 (Bekanntmachungsdatum)\n\nBayern Amtsgericht Kempten (Allgäu) HRB 8181\nLöschungsankündigung\n\nKanzlei für wirtschaftliche Beratung und Vermittlungs-GmbH Kempten\nGesellschaft mit beschränkter Haftung\nKempten (Allgäu)\n\nDas Registergericht beabsichtigt, die im Handelsregister eingetragene Gesellschaft wegen Vermögenslosigkeit von Amts wegen nach § 394 FamFG zu löschen. Die Frist zur Erhebung eines Widerspruchs ist auf einen Monat festgesetzt."
    },
    {
      "date": "2025-04-29",
      "id": "107570",
      "original_text": "Registerbekanntmachung nach dem Umwandlungsgesetz\nBayern Amtsgericht Würzburg HRB 1615\nGEHA Wohnbau GmbH – Marktheidenfeld",
      "type": "Registerbekanntmachung nach dem Umwandlungsgesetz",
      "state": "Bayern",
      "amtsgericht": "Amtsgericht Würzburg",
      "registernummer": "HRB 1615",
      "registerart": "HRB",
      "company_name": "GEHA Wohnbau GmbH",
      "company_seat": "Marktheidenfeld",
      "details": "29.04.2025 (Bekanntmachungsdatum)\n\nBayern Amtsgericht Würzburg HRB 1615\nRegisterbekanntmachung nach dem Umwandlungsgesetz 28.04.2025 (Eintragungsdatum)\n\nGEHA Wohnbau GmbH\nGesellschaft mit beschränkter Haftung\nMarktheidenfeld\n\nDen Gläubigern der an der Verschmelzung beteiligten Rechtsträger ist, wenn sie binnen sechs Monaten nach dem Tag, an dem die Eintragung der Verschmelzung in das Register des Sitzes desjenigen Rechtsträgers, dessen Gläubiger sie sind, nach § 19 Abs. 3 UmwG als bekannt gemacht gilt, ihren Anspruch nach Grund und Höhe in Textform anmelden, Sicherheit zu leisten, soweit sie nicht Befriedigung verlangen können. Dieses Recht steht den Gläubigern jedoch nur zu, wenn sie glaubhaft machen, dass durch die Verschmelzung die Erfüllung ihrer Forderung gefährdet wird."
    },
    {
      "date": "2025-04-29",
      "id": "107571",
      "original_text": "Registerbekanntmachung nach dem Umwandlungsgesetz\nBayern Amtsgericht München HRB 301977\nLxpro GmbH – Moosburg a.d.Isar",
      "type": "Registerbekanntmachung nach dem Umwandlungsgesetz",
      "state": "Bayern",
      "amtsgericht": "Amtsgericht München",
      "registernummer": "HRB 301977",
      "registerart": "HRB",
      "company_name": "Lxpro GmbH",
      "company_seat": "Moosburg a.d.Isar",
      "details": "29.04.2025 (Bekanntmachungsdatum)\n\nBayern Amtsgericht München HRB 301977\nRegisterbekanntmachung nach dem Umwandlungsgesetz 28.04.2025 (Eintragungsdatum)\n\nLxpro GmbH\nGesellschaft mit beschränkter Haftung\nMoosburg a.d.Isar\n\nDen Gläubigern der an der Verschmelzung beteiligten Rechtsträger ist, wenn sie binnen sechs Monaten nach dem Tag, an dem die Eintragung der Verschmelzung in das Register des Sitzes desjenigen Rechtsträgers, dessen Gläubiger sie sind, nach § 19 Abs. 3 UmwG als bekannt gemacht gilt, ihren Anspruch nach Grund und Höhe in Textform anmelden, Sicherheit zu leisten, soweit sie nicht Befriedigung verlangen können. Dieses Recht steht den Gläubigern jedoch nur zu, wenn sie glaubhaft machen, dass durch die Verschmelzung die Erfüllung ihrer Forderung gefährdet wird."
    },
    {
      "date": "2025-04-29",
      "id": "107572",
      "original_text": "Registerbekanntmachung nach dem Umwandlungsgesetz\nBayern Amtsgericht München HRB 229208\nJansen Equity UG (haftungsbeschränkt) – München",
      "type": "Registerbekanntmachung nach dem Umwandlungsgesetz",
      "state": "Bayern",
      "amtsgericht": "Amtsgericht München",
      "registernummer": "HRB 229208",
      "registerart": "HRB",
      "company_name": "Jansen Equity UG (haftungsbeschränkt)",
      "company_seat": "München",
      "details": "29.04.2025 (Bekanntmachungsdatum)\n\nBayern Amtsgericht München HRB 229208\nRegisterbekanntmachung nach dem Umwandlungsgesetz 28.04.2025 (Eintragungsdatum)\n\nJansen Equity UG (haftungsbeschränkt)\nGesellschaft mit beschränkter Haftung\nMünchen\n\nDen Gläubigern der an der Verschmelzung beteiligten Rechtsträger ist, wenn sie binnen sechs Monaten nach dem Tag, an dem die Eintragung der Verschmelzung in das Register des Sitzes desjenigen Rechtsträgers, dessen Gläubiger sie sind, nach § 19 Abs. 3 UmwG als bekannt gemacht gilt, ihren Anspruch nach Grund und Höhe in Textform anmelden, Sicherheit zu leisten, soweit sie nicht Befriedigung verlangen können. Dieses Recht steht den Gläubigern jedoch nur zu, wenn sie glaubhaft machen, dass durch die Verschmelzung die Erfüllung ihrer Forderung gefährdet wird."
    },
    {
      "date": "2025-04-29",
      "id": "107573",
      "original_text": "Löschungsankündigung\nSchleswig-Holstein Amtsgericht Kiel HRB 22551\nAverie GmbH – Norderstedt",
      "type": "Löschungsankündigung",
      "state": "Schleswig-Holstein",
      "amtsgericht": "Amtsgericht Kiel",
      "registernummer": "HRB 22551",
      "registerart": "HRB",
      "company_name": "Averie GmbH",
      "company_seat": "Norderstedt",
      "details": "29.04.2025 (Bekanntmachungsdatum)\n\nSchleswig-Holstein Amtsgericht Kiel HRB 22551\nLöschungsankündigung\n\nAverie GmbH\nGesellschaft mit beschränkter Haftung\nNorderstedt\n\nEs ist die Löschung der nachstehenden Gesellschaft wegen Vermögenslosigkeit gemäß § 394 FamFG beabsichtigt. Widerspruchsfrist: 2 Monate."
    },
    {
      "date": "2025-04-29",
      "id": "107574",
      "original_text": "Löschungsankündigung\nBaden-Württemberg Amtsgericht Mannheim HRB 712066\neGO Group GmbH – Karlsruhe",
      "type": "Löschungsankündigung",
      "state": "Baden-Württemberg",
      "amtsgericht": "Amtsgericht Mannheim",
      "registernummer": "HRB 712066",
      "registerart": "HRB",
      "company_name": "eGO Group GmbH",
      "company_seat": "Karlsruhe",
      "details": "29.04.2025 (Bekanntmachungsdatum)\n\nBaden-Württemberg Amtsgericht Mannheim HRB 712066\nLöschungsankündigung\n\neGO Group GmbH\nGesellschaft mit beschränkter Haftung\nKarlsruhe\n\nAls nicht eingetragen wird bekanntgemacht:\nDas Gericht beabsichtigt, die Gesellschaft wegen Vermögenslosigkeit im Handelsregister von Amts wegen nach § 394 FamFG zu löschen. Die Frist zur Geltendmachung eines Widerspruchs gegen die beabsichtigte Löschung ist auf einen Monat ab Veröffentlichung bestimmt."
    },
    {
      "date": "2025-04-29",
      "id": "107575",
      "original_text": "Registerbekanntmachung nach dem Umwandlungsgesetz\nBaden-Württemberg Amtsgericht Stuttgart HRB 754728\nAutohaus Schmieg GmbH – Mulfingen",
      "type": "Registerbekanntmachung nach dem Umwandlungsgesetz",
      "state": "Baden-Württemberg",
      "amtsgericht": "Amtsgericht Stuttgart",
      "registernummer": "HRB 754728",
      "registerart": "HRB",
      "company_name": "Autohaus Schmieg GmbH",
      "company_seat": "Mulfingen",
      "details": "29.04.2025 (Bekanntmachungsdatum)\n\nBaden-Württemberg Amtsgericht Stuttgart HRB 754728\nRegisterbekanntmachung nach dem Umwandlungsgesetz 29.04.2025 (Eintragungsdatum)\n\nAutohaus Schmieg GmbH\nGesellschaft mit beschränkter Haftung\nMulfingen\n\nDen Gläubigern der an der Verschmelzung beteiligten Rechtsträger ist, wenn sie binnen sechs Monaten nach dem Tag, an dem die Eintragung der Verschmelzung in das Register des Sitzes desjenigen Rechtsträgers, dessen Gläubiger sie sind, nach § 19 Abs. 3 UmwG als bekanntgemacht gilt, ihren Anspruch nach Grund und Höhe schriftlich anmelden, Sicherheit zu leisten, soweit sie nicht Befriedigung verlangen können. Dieses Recht steht den Gläubigern jedoch nur zu, wenn sie glaubhaft machen, dass durch die Verschmelzung die Erfüllung ihrer Forderung gefährdet wird."
    },
    {
      "date": "2025-04-29",
      "id": "107576",
      "original_text": "Löschungsankündigung\nBaden-Württemberg Amtsgericht Stuttgart HRB 760311\nAdlerwerke GmbH – Weinstadt",
      "type": "Löschungsankündigung",
      "state": "Baden-Württemberg",
      "amtsgericht": "Amtsgericht Stuttgart",
      "registernummer": "HRB 760311",
      "registerart": "HRB",
      "company_name": "Adlerwerke GmbH",
      "company_seat": "Weinstadt",
      "details": "29.04.2025 (Bekanntmachungsdatum)\n\nBaden-Württemberg Amtsgericht Stuttgart HRB 760311\nLöschungsankündigung\n\nAdlerwerke GmbH\nGesellschaft mit beschränkter Haftung\nWeinstadt\n\nAls nicht eingetragen wird bekanntgemacht:\nDas Gericht beabsichtigt, die Gesellschaft wegen Vermögenslosigkeit im Handelsregister von Amts wegen nach § 394 FamFG zu löschen. Die Frist zur Geltendmachung eines Widerspruchs gegen die beabsichtigte Löschung ist auf zwei Monate ab Veröffentlichung bestimmt."
    },
    {
      "date": "2025-04-29",
      "id": "107577",
      "original_text": "Einreichung neuer Dokumente\nSachsen-Anhalt Amtsgericht Stendal HRB 108558\nBAL Stadtentwicklungsgesellschaft mbH – Ballenstedt",
      "type": "Einreichung neuer Dokumente",
      "state": "Sachsen-Anhalt",
      "amtsgericht": "Amtsgericht Stendal",
      "registernummer": "HRB 108558",
      "registerart": "HRB",
      "company_name": "BAL Stadtentwicklungsgesellschaft mbH",
      "company_seat": "Ballenstedt",
      "details": "29.04.2025 (Bekanntmachungsdatum)\n\nSachsen-Anhalt Amtsgericht Stendal HRB 108558\nEinreichung neuer Dokumente 16.12.2024 (Eintragungsdatum)\n\nBAL Stadtentwicklungsgesellschaft mbH\nGesellschaft mit beschränkter Haftung\nBallenstedt\n\nEine Liste der Mitglieder des Aufsichtsrates wurde zum Handelsregister eingereicht."
    },
    {
      "date": "2025-04-29",
      "id": "107578",
      "original_text": "Löschungsankündigung\nBaden-Württemberg Amtsgericht Mannheim HRB 231480\nES Gaststättenbetriebs GmbH – Bruchsal",
      "type": "Löschungsankündigung",
      "state": "Baden-Württemberg",
      "amtsgericht": "Amtsgericht Mannheim",
      "registernummer": "HRB 231480",
      "registerart": "HRB",
      "company_name": "ES Gaststättenbetriebs GmbH",
      "company_seat": "Bruchsal",
      "details": "29.04.2025 (Bekanntmachungsdatum)\n\nBaden-Württemberg Amtsgericht Mannheim HRB 231480\nLöschungsankündigung\n\nES Gaststättenbetriebs GmbH\nGesellschaft mit beschränkter Haftung\nBruchsal\n\nDas Gericht beabsichtigt, die Gesellschaft wegen Vermögenslosigkeit im Handelsregister von Amts wegen nach § 394 FamFG zu löschen. Die Frist zur Geltendmachung eines Widerspruchs gegen die beabsichtigte Löschung ist auf einen Monat ab Veröffentlichung bestimmt."
    },
    {
      "date": "2025-04-29",
      "id": "107579",
      "original_text": "Löschungsankündigung\nBerlin Amtsgericht Berlin (Charlottenburg) HRB 221681\nColories GmbH, Meisterbetrieb für Karosserie und Lackierung – Berlin",
      "type": "Löschungsankündigung",
      "state": "Berlin",
      "amtsgericht": "Amtsgericht Berlin (Charlottenburg)",
      "registernummer": "HRB 221681",
      "registerart": "HRB",
      "company_name": "Colories GmbH, Meisterbetrieb für Karosserie und Lackierung",
      "company_seat": "Berlin",
      "details": "29.04.2025 (Bekanntmachungsdatum)\n\nBerlin Amtsgericht Berlin (Charlottenburg) HRB 221681\nLöschungsankündigung\n\nColories GmbH, Meisterbetrieb für Karosserie und Lackierung\nGesellschaft mit beschränkter Haftung\nBerlin\n\nBei der nachstehenden Gesellschaft wird das Amtslöschungsverfahren gemäß § 394 FamFG eingeleitet. Widerspruchsfrist 6 Wochen"
    },
    {
      "date": "2025-04-29",
      "id": "107580",
      "original_text": "Registerbekanntmachung nach dem Umwandlungsgesetz\nBaden-Württemberg Amtsgericht Mannheim HRB 108946\nHaagener Grundstücksverwaltungsgesellschaft mit beschränkter Haftung – Rheinstetten",
      "type": "Registerbekanntmachung nach dem Umwandlungsgesetz",
      "state": "Baden-Württemberg",
      "amtsgericht": "Amtsgericht Mannheim",
      "registernummer": "HRB 108946",
      "registerart": "HRB",
      "company_name": "Haagener Grundstücksverwaltungsgesellschaft mit beschränkter Haftung",
      "company_seat": "Rheinstetten",
      "details": "29.04.2025 (Bekanntmachungsdatum)\n\nBaden-Württemberg Amtsgericht Mannheim HRB 108946\nRegisterbekanntmachung nach dem Umwandlungsgesetz 29.04.2025 (Eintragungsdatum)\n\nHaagener Grundstücksverwaltungsgesellschaft mit beschränkter Haftung\nGesellschaft mit beschränkter Haftung\nRheinstetten\n\nDen Gläubigern der an der Verschmelzung beteiligten Rechtsträger ist, wenn sie binnen sechs Monaten nach dem Tag, an dem die Eintragung der Verschmelzung in das Register des Sitzes desjenigen Rechtsträgers, dessen Gläubiger sie sind, nach § 19 Abs. 3 UmwG als bekanntgemacht gilt, ihren Anspruch nach Grund und Höhe schriftlich anmelden, Sicherheit zu leisten, soweit sie nicht Befriedigung verlangen können. Dieses Recht steht den Gläubigern jedoch nur zu, wenn sie glaubhaft machen, dass durch die Verschmelzung die Erfüllung ihrer Forderung gefährdet wird."
    },
    {
      "date": "2025-04-29",
      "id": "107581",
      "original_text": "Registerbekanntmachung nach dem Umwandlungsgesetz\nBaden-Württemberg Amtsgericht Mannheim HRA 102980\nSW SÜDSTROM Wasserkraftwerke GmbH und Co. KG – Rheinstetten",
      "type": "Registerbekanntmachung nach dem Umwandlungsgesetz",
      "state": "Baden-Württemberg",
      "amtsgericht": "Amtsgericht Mannheim",
      "registernummer": "HRA 102980",
      "registerart": "HRA",
      "company_name": "SW SÜDSTROM Wasserkraftwerke GmbH und Co. KG",
      "company_seat": "Rheinstetten",
      "details": "29.04.2025 (Bekanntmachungsdatum)\n\nBaden-Württemberg Amtsgericht Mannheim HRA 102980\nRegisterbekanntmachung nach dem Umwandlungsgesetz 29.04.2025 (Eintragungsdatum)\n\nSW SÜDSTROM Wasserkraftwerke GmbH und Co. KG\nKommanditgesellschaft\nRheinstetten\n\nDen Gläubigern der an der Verschmelzung beteiligten Rechtsträger ist, wenn sie binnen sechs Monaten nach dem Tag, an dem die Eintragung der Verschmelzung in das Register des Sitzes desjenigen Rechtsträgers, dessen Gläubiger sie sind, nach § 19 Abs. 3 UmwG als bekanntgemacht gilt, ihren Anspruch nach Grund und Höhe schriftlich anmelden, Sicherheit zu leisten, soweit sie nicht Befriedigung verlangen können. Dieses Recht steht den Gläubigern jedoch nur zu, wenn sie glaubhaft machen, dass durch die Verschmelzung die Erfüllung ihrer Forderung gefährdet wird."
    },
    {
      "date": "2025-04-29",
      "id": "107582",
      "original_text": "Registerbekanntmachung nach dem Umwandlungsgesetz\nBrandenburg Amtsgericht Cottbus HRB 15264\nKHK Verwaltung GmbH – Schönefeld",
      "type": "Registerbekanntmachung nach dem Umwandlungsgesetz",
      "state": "Brandenburg",
      "amtsgericht": "Amtsgericht Cottbus",
      "registernummer": "HRB 15264",
      "registerart": "HRB",
      "company_name": "KHK Verwaltung GmbH",
      "company_seat": "Schönefeld",
      "details": "29.04.2025 (Bekanntmachungsdatum)\n\nBrandenburg Amtsgericht Cottbus HRB 15264\nRegisterbekanntmachung nach dem Umwandlungsgesetz 28.04.2025 (Eintragungsdatum)\n\nKHK Verwaltung GmbH\nGesellschaft mit beschränkter Haftung\nSchönefeld\n\nDen Gläubigern der an der Verschmelzung beteiligten Rechtsträger ist, wenn sie binnen sechs Monaten nach dem Tag, an dem die Eintragung der Verschmelzung in das Register des Sitzes desjenigen Rechtsträgers, dessen Gläubiger sie sind, als bekannt gemacht gilt, ihren Anspruch nach Grund und Höhe schriftlich anmelden, Sicherheit zu leisten, soweit sie nicht Befriedigung verlangen können. Dieses Recht steht den Gläubigern jedoch nur zu, wenn sie glaubhaft machen, dass durch die Verschmelzung die Erfüllung ihrer Forderung gefährdet wird."
    },
    {
      "date": "2025-04-29",
      "id": "107583",
      "original_text": "Registerbekanntmachung nach dem Umwandlungsgesetz\nSachsen-Anhalt Amtsgericht Stendal HRB 13326\nMAM Maschinen- und Anlagenbau Magdeburg GmbH – Magdeburg",
      "type": "Registerbekanntmachung nach dem Umwandlungsgesetz",
      "state": "Sachsen-Anhalt",
      "amtsgericht": "Amtsgericht Stendal",
      "registernummer": "HRB 13326",
      "registerart": "HRB",
      "company_name": "MAM Maschinen- und Anlagenbau Magdeburg GmbH",
      "company_seat": "Magdeburg",
      "details": "29.04.2025 (Bekanntmachungsdatum)\n\nSachsen-Anhalt Amtsgericht Stendal HRB 13326\nRegisterbekanntmachung nach dem Umwandlungsgesetz 29.04.2025 (Eintragungsdatum)\n\nMAM Maschinen- und Anlagenbau Magdeburg GmbH\nGesellschaft mit beschränkter Haftung\nMagdeburg\n\nNicht eingetragen:\nDen Gläubigern der an der Verschmelzung beteiligten Rechtsträger ist, wenn sie binnen sechs Monaten nach dem Tag, an dem die Eintragung der Verschmelzung nach § 19 Abs. 3 UmwG als bekanntgemacht gilt, ihren Anspruch nach Grund und Höhe schriftlich anmelden, Sicherheit zu leisten, soweit sie nicht Befriedigung verlangen können. Dieses Recht steht ihnen jedoch nur zu, wenn sie glaubhaft machen, dass durch die Verschmelzung die Erfüllung ihrer Forderung gefährdet wird."
    },
    {
      "date": "2025-04-29",
      "id": "107584",
      "original_text": "Registerbekanntmachung nach dem Umwandlungsgesetz\nSchleswig-Holstein Amtsgericht Kiel VR 2092\nBankenverband Schleswig-Holstein e.V. – Kiel",
      "type": "Registerbekanntmachung nach dem Umwandlungsgesetz",
      "state": "Schleswig-Holstein",
      "amtsgericht": "Amtsgericht Kiel",
      "registernummer": "VR 2092",
      "registerart": "VR",
      "company_name": "Bankenverband Schleswig-Holstein e.V.",
      "company_seat": "Kiel",
      "details": "29.04.2025 (Bekanntmachungsdatum)\n\nSchleswig-Holstein Amtsgericht Kiel VR 2092\nRegisterbekanntmachung nach dem Umwandlungsgesetz 28.04.2025 (Eintragungsdatum)\n\nBankenverband Schleswig-Holstein e.V.\neingetragener Verein\nKiel\n\nZu Eintragungsnummer 13 vom 28.04.2025 wird als nicht eingetragen veröffentlicht:\nDen Gläubigern der an der Verschmelzung beteiligten Rechtsträger ist, wenn sie binnen sechs Monaten nach dem Tag, an dem die Eintragung der Verschmelzung in das Register des Sitzes desjenigen Rechtsträgers, dessen Gläubiger sie sind, nach § 19 Abs. 3 UmwG bekannt gemacht worden ist, ihren Anspruch nach Grund und Höhe schriftlich anmelden, Sicherheit zu leisten, soweit sie nicht Befriedigung verlangen können. Dieses Recht steht den Gläubigern jedoch nur zu, wenn sie glaubhaft machen, dass durch die Verschmelzung die Erfüllung ihrer Forderung gefährdet wird."
    },
    {
      "date": "2025-04-29",
      "id": "107585",
      "original_text": "Löschungsankündigung\nBaden-Württemberg Amtsgericht Mannheim HRB 708041\nPrisma - ReinHage GmbH – Mannheim",
      "type": "Löschungsankündigung",
      "state": "Baden-Württemberg",
      "amtsgericht": "Amtsgericht Mannheim",
      "registernummer": "HRB 708041",
      "registerart": "HRB",
      "company_name": "Prisma - ReinHage GmbH",
      "company_seat": "Mannheim",
      "details": "29.04.2025 (Bekanntmachungsdatum)\n\nBaden-Württemberg Amtsgericht Mannheim HRB 708041\nLöschungsankündigung\n\nPrisma - ReinHage GmbH\nGesellschaft mit beschränkter Haftung\nMannheim\n\nDas Gericht beabsichtigt, die Gesellschaft wegen Vermögenslosigkeit im Handelsregister von Amts wegen nach § 394 FamFG zu löschen. Die Frist zur Geltendmachung eines Widerspruchs gegen die beabsichtigte Löschung ist auf einen Monat ab Veröffentlichung bestimmt."
    },
    {
      "date": "2025-04-29",
      "id": "107586",
      "original_text": "Einreichung neuer Dokumente\nBerlin Amtsgericht Berlin (Charlottenburg) HRB 264222\nKaDeWe GmbH – Berlin",
      "type": "Einreichung neuer Dokumente",
      "state": "Berlin",
      "amtsgericht": "Amtsgericht Berlin (Charlottenburg)",
      "registernummer": "HRB 264222",
      "registerart": "HRB",
      "company_name": "KaDeWe GmbH",
      "company_seat": "Berlin",
      "details": "29.04.2025 (Bekanntmachungsdatum)\n\nBerlin Amtsgericht Berlin (Charlottenburg) HRB 264222\nEinreichung neuer Dokumente\n\nKaDeWe GmbH\nGesellschaft mit beschränkter Haftung\nBerlin\n\nAls nicht eingetragen wird veröffentlicht: Es wurde eine neue Liste der Aufsichtsratsmitglieder eingereicht (§ 106 AktG)."
    },
    {
      "date": "2025-04-29",
      "id": "107587",
      "original_text": "Registerbekanntmachung nach dem Umwandlungsgesetz\nBrandenburg Amtsgericht Cottbus HRB 15527\nSW Verwaltung GmbH – Schönefeld",
      "type": "Registerbekanntmachung nach dem Umwandlungsgesetz",
      "state": "Brandenburg",
      "amtsgericht": "Amtsgericht Cottbus",
      "registernummer": "HRB 15527",
      "registerart": "HRB",
      "company_name": "SW Verwaltung GmbH",
      "company_seat": "Schönefeld",
      "details": "29.04.2025 (Bekanntmachungsdatum)\n\nBrandenburg Amtsgericht Cottbus HRB 15527\nRegisterbekanntmachung nach dem Umwandlungsgesetz 28.04.2025 (Eintragungsdatum)\n\nSW Verwaltung GmbH\nGesellschaft mit beschränkter Haftung\nSchönefeld\n\nDen Gläubigern der an der Verschmelzung beteiligten Rechtsträger ist, wenn sie binnen sechs Monaten nach dem Tag, an dem die Eintragung der Verschmelzung in das Register des Sitzes desjenigen Rechtsträgers, dessen Gläubiger sie sind, als bekannt gemacht gilt, ihren Anspruch nach Grund und Höhe schriftlich anmelden, Sicherheit zu leisten, soweit sie nicht Befriedigung verlangen können. Dieses Recht steht den Gläubigern jedoch nur zu, wenn sie glaubhaft machen, dass durch die Verschmelzung die Erfüllung ihrer Forderung gefährdet wird."
    },
    {
      "date": "2025-04-29",
      "id": "107588",
      "original_text": "Registerbekanntmachung nach dem Umwandlungsgesetz\nBaden-Württemberg Amtsgericht Mannheim HRB 362343\nBrach & Gräßer GmbH Metallverarbeitung – Malsch",
      "type": "Registerbekanntmachung nach dem Umwandlungsgesetz",
      "state": "Baden-Württemberg",
      "amtsgericht": "Amtsgericht Mannheim",
      "registernummer": "HRB 362343",
      "registerart": "HRB",
      "company_name": "Brach & Gräßer GmbH Metallverarbeitung",
      "company_seat": "Malsch",
      "details": "29.04.2025 (Bekanntmachungsdatum)\n\nBaden-Württemberg Amtsgericht Mannheim HRB 362343\nRegisterbekanntmachung nach dem Umwandlungsgesetz 29.04.2025 (Eintragungsdatum)\n\nBrach & Gräßer GmbH Metallverarbeitung\nGesellschaft mit beschränkter Haftung\nMalsch\n\nDen Gläubigern des an dem Formwechsel beteiligten Rechtsträgers ist, wenn sie binnen sechs Monaten nach dem Tag, an dem die Eintragung des Formwechsels in das Register des Sitzes desjenigen Rechtsträgers, dessen Gläubiger sie sind, nach § 19 Abs. 3 UmwG als bekanntgemacht gilt, ihren Anspruch nach Grund und Höhe schriftlich anmelden, Sicherheit zu leisten, soweit sie nicht Befriedigung verlangen können. Dieses Recht steht den Gläubigern jedoch nur zu, wenn sie glaubhaft machen, dass durch den Formwechsel die Erfüllung ihrer Forderung gefährdet wird."
    },
    {
      "date": "2025-04-29",
      "id": "107589",
      "original_text": "Einreichung neuer Dokumente\nSaarland Amtsgericht Saarbrücken HRA 10541\nStadtwerke Lebach GmbH & Co. KG – Lebach",
      "type": "Einreichung neuer Dokumente",
      "state": "Saarland",
      "amtsgericht": "Amtsgericht Saarbrücken",
      "registernummer": "HRA 10541",
      "registerart": "HRA",
      "company_name": "Stadtwerke Lebach GmbH & Co. KG",
      "company_seat": "Lebach",
      "details": "29.04.2025 (Bekanntmachungsdatum)\n\nSaarland Amtsgericht Saarbrücken HRA 10541\nEinreichung neuer Dokumente\n\nStadtwerke Lebach GmbH & Co. KG\nKommanditgesellschaft\nLebach\n\nDie Gesellschaft hat eine Liste der Aufsichtsratsmitglieder zum Handelsregister eingereicht."
    },
    {
      "date": "2025-04-29",
      "id": "107590",
      "original_text": "Löschungsankündigung\nBerlin Amtsgericht Berlin (Charlottenburg) HRB 232577\nCreative Compackt Bau GmbH – Berlin",
      "type": "Löschungsankündigung",
      "state": "Berlin",
      "amtsgericht": "Amtsgericht Berlin (Charlottenburg)",
      "registernummer": "HRB 232577",
      "registerart": "HRB",
      "company_name": "Creative Compackt Bau GmbH",
      "company_seat": "Berlin",
      "details": "29.04.2025 (Bekanntmachungsdatum)\n\nBerlin Amtsgericht Berlin (Charlottenburg) HRB 232577\nLöschungsankündigung\n\nCreative Compackt Bau GmbH\nGesellschaft mit beschränkter Haftung\nBerlin\n\nBei der nachstehenden Gesellschaft wird das Amtslöschungsverfahren gemäß § 394 FamFG eingeleitet. Widerspruchsfrist 6 Wochen"
    },
    {
      "date": "2025-04-29",
      "id": "107591",
      "original_text": "Löschungsankündigung\nMecklenburg-Vorpommern Amtsgericht Rostock HRB 10841\nSANIERUNGSBAU ROSTOCK GmbH – Lambrechtshagen",
      "type": "Löschungsankündigung",
      "state": "Mecklenburg-Vorpommern",
      "amtsgericht": "Amtsgericht Rostock",
      "registernummer": "HRB 10841",
      "registerart": "HRB",
      "company_name": "SANIERUNGSBAU ROSTOCK GmbH",
      "company_seat": "Lambrechtshagen",
      "details": "29.04.2025 (Bekanntmachungsdatum)\n\nMecklenburg-Vorpommern Amtsgericht Rostock HRB 10841\nLöschungsankündigung\n\nSANIERUNGSBAU ROSTOCK GmbH\nGesellschaft mit beschränkter Haftung\nLambrechtshagen\n\nDas Registergericht beabsichtigt, die im Handelsregister eingetragene Gesellschaft von Amts wegen nach § 394 FamFG zu löschen. Die Frist zur Erhebung eines Widerspruchs gegen die beabsichtigte Löschung wird auf 1 Monat festgesetzt."
    },
    {
      "date": "2025-04-29",
      "id": "107592",
      "original_text": "Löschungsankündigung\nBerlin Amtsgericht Berlin (Charlottenburg) HRB 209734\nKarakaya Bau GmbH – Berlin",
      "type": "Löschungsankündigung",
      "state": "Berlin",
      "amtsgericht": "Amtsgericht Berlin (Charlottenburg)",
      "registernummer": "HRB 209734",
      "registerart": "HRB",
      "company_name": "Karakaya Bau GmbH",
      "company_seat": "Berlin",
      "details": "29.04.2025 (Bekanntmachungsdatum)\n\nBerlin Amtsgericht Berlin (Charlottenburg) HRB 209734\nLöschungsankündigung\n\nKarakaya Bau GmbH\nGesellschaft mit beschränkter Haftung\nBerlin\n\nBei der nachstehenden Gesellschaft wird das Amtslöschungsverfahren gemäß § 394 FamFG eingeleitet. Widerspruchsfrist 6 Wochen"
    },
    {
      "date": "2025-04-29",
      "id": "107593",
      "original_text": "Löschungsankündigung\nMecklenburg-Vorpommern Amtsgericht Rostock HRB 14153\nCovalero UG (haftungsbeschränkt) – Rostock",
      "type": "Löschungsankündigung",
      "state": "Mecklenburg-Vorpommern",
      "amtsgericht": "Amtsgericht Rostock",
      "registernummer": "HRB 14153",
      "registerart": "HRB",
      "company_name": "Covalero UG (haftungsbeschränkt)",
      "company_seat": "Rostock",
      "details": "29.04.2025 (Bekanntmachungsdatum)\n\nMecklenburg-Vorpommern Amtsgericht Rostock HRB 14153\nLöschungsankündigung\n\nCovalero UG (haftungsbeschränkt)\nGesellschaft mit beschränkter Haftung\nRostock\n\nDas Registergericht beabsichtigt, die im Handelsregister eingetragene Gesellschaft von Amts wegen nach § 394 FamFG zu löschen. Die Frist zur Erhebung eines Widerspruchs gegen die beabsichtigte Löschung wird auf 1 Monat festgesetzt."
    },
    {
      "date": "2025-04-29",
      "id": "107594",
      "original_text": "Registerbekanntmachung nach dem Umwandlungsgesetz\nHamburg Amtsgericht Hamburg HRB 135885\nMÜNZwohnen Hamburg GmbH – Hamburg",
      "type": "Registerbekanntmachung nach dem Umwandlungsgesetz",
      "state": "Hamburg",
      "amtsgericht": "Amtsgericht Hamburg",
      "registernummer": "HRB 135885",
      "registerart": "HRB",
      "company_name": "MÜNZwohnen Hamburg GmbH",
      "company_seat": "Hamburg",
      "details": "29.04.2025 (Bekanntmachungsdatum)\n\nHamburg Amtsgericht Hamburg HRB 135885\nRegisterbekanntmachung nach dem Umwandlungsgesetz 28.04.2025 (Eintragungsdatum)\n\nMÜNZwohnen Hamburg GmbH\nGesellschaft mit beschränkter Haftung\nHamburg\n\nAls nicht eingetragen wird bekannt gemacht:\nDen Gläubigern der an der Verschmelzung beteiligten Gesellschaften ist, wenn sie binnen sechs Monaten nach dem Tag, an dem die Eintragung der Verschmelzung in das Register des Sitzes desjenigen Rechtsträgers, dessen Gläubiger sie sind, nach § 19 Absatz 3 UmwG als bekannt gemacht gilt, ihren Anspruch nach Grund und Höhe schriftlich anmelden, Sicherheit zu leisten, soweit sie nicht Befriedigung verlangen können. Dieses Recht steht den Gläubigern jedoch nur zu, wenn sie glaubhaft machen, dass durch die Verschmelzung die Erfüllung ihrer Forderung gefährdet wird."
    },
    {
      "date": "2025-04-29",
      "id": "107595",
      "original_text": "Registerbekanntmachung nach dem Umwandlungsgesetz\nBaden-Württemberg Amtsgericht Freiburg HRB 4115\nWandres GmbH – Stegen",
      "type": "Registerbekanntmachung nach dem Umwandlungsgesetz",
      "state": "Baden-Württemberg",
      "amtsgericht": "Amtsgericht Freiburg",
      "registernummer": "HRB 4115",
      "registerart": "HRB",
      "company_name": "Wandres GmbH",
      "company_seat": "Stegen",
      "details": "29.04.2025 (Bekanntmachungsdatum)\n\nBaden-Württemberg Amtsgericht Freiburg HRB 4115\nRegisterbekanntmachung nach dem Umwandlungsgesetz 29.04.2025 (Eintragungsdatum)\n\nWandres GmbH\nGesellschaft mit beschränkter Haftung\nStegen\n\nAls nicht eingetragen wird bekanntgemacht:\nDen Gläubigern der an der Verschmelzung beteiligten Rechtsträger ist, wenn sie binnen sechs Monaten nach dem Tag, an dem die Eintragung der Verschmelzung in das Register des Sitzes desjenigen Rechtsträgers, dessen Gläubiger sie sind, nach § 19 Abs. 3 UmwG als bekanntgemacht gilt, ihren Anspruch nach Grund und Höhe schriftlich anmelden, Sicherheit zu leisten, soweit sie nicht Befriedigung verlangen können. Dieses Recht steht den Gläubigern jedoch nur zu, wenn sie glaubhaft machen, dass durch die Verschmelzung die Erfüllung ihrer Forderung gefährdet wird."
    },
    {
      "date": "2025-04-29",
      "id": "107596",
      "original_text": "Registerbekanntmachung nach dem Umwandlungsgesetz\nBaden-Württemberg Amtsgericht Freiburg HRB 7251\nWandres Brush-Hitec GmbH – Stegen",
      "type": "Registerbekanntmachung nach dem Umwandlungsgesetz",
      "state": "Baden-Württemberg",
      "amtsgericht": "Amtsgericht Freiburg",
      "registernummer": "HRB 7251",
      "registerart": "HRB",
      "company_name": "Wandres Brush-Hitec GmbH",
      "company_seat": "Stegen",
      "details": "29.04.2025 (Bekanntmachungsdatum)\n\nBaden-Württemberg Amtsgericht Freiburg HRB 7251\nRegisterbekanntmachung nach dem Umwandlungsgesetz 29.04.2025 (Eintragungsdatum)\n\nWandres Brush-Hitec GmbH\nGesellschaft mit beschränkter Haftung\nStegen\n\nDen Gläubigern der an der Verschmelzung beteiligten Rechtsträger ist, wenn sie binnen sechs Monaten nach dem Tag, an dem die Eintragung der Verschmelzung in das Register des Sitzes desjenigen Rechtsträgers, dessen Gläubiger sie sind, nach § 19 Abs. 3 UmwG als bekanntgemacht gilt, ihren Anspruch nach Grund und Höhe schriftlich anmelden, Sicherheit zu leisten, soweit sie nicht Befriedigung verlangen können. Dieses Recht steht den Gläubigern jedoch nur zu, wenn sie glaubhaft machen, dass durch die Verschmelzung die Erfüllung ihrer Forderung gefährdet wird."
    },
    {
      "date": "2025-04-29",
      "id": "107597",
      "original_text": "Registerbekanntmachung nach dem Umwandlungsgesetz\nBaden-Württemberg Amtsgericht Stuttgart HRB 766101\nDürr thermea GmbH – Bietigheim-Bissingen",
      "type": "Registerbekanntmachung nach dem Umwandlungsgesetz",
      "state": "Baden-Württemberg",
      "amtsgericht": "Amtsgericht Stuttgart",
      "registernummer": "HRB 766101",
      "registerart": "HRB",
      "company_name": "Dürr thermea GmbH",
      "company_seat": "Bietigheim-Bissingen",
      "details": "29.04.2025 (Bekanntmachungsdatum)\n\nBaden-Württemberg Amtsgericht Stuttgart HRB 766101\nRegisterbekanntmachung nach dem Umwandlungsgesetz 29.04.2025 (Eintragungsdatum)\n\nDürr thermea GmbH\nGesellschaft mit beschränkter Haftung\nBietigheim-Bissingen\n\nAls nicht eingetragen wird bekanntgemacht:\nDen Gläubigern der an der Verschmelzung beteiligten Rechtsträger ist, wenn sie binnen sechs Monaten nach dem Tag, an dem die Eintragung der Verschmelzung in das Register des Sitzes desjenigen Rechtsträgers, dessen Gläubiger sie sind, nach § 19 Abs. 3 UmwG als bekanntgemacht gilt, ihren Anspruch nach Grund und Höhe schriftlich anmelden, Sicherheit zu leisten, soweit sie nicht Befriedigung verlangen können. Dieses Recht steht den Gläubigern jedoch nur zu, wenn sie glaubhaft machen, dass durch die Verschmelzung die Erfüllung ihrer Forderung gefährdet wird."
    },
    {
      "date": "2025-04-29",
      "id": "107598",
      "original_text": "Registerbekanntmachung nach dem Umwandlungsgesetz\nBaden-Württemberg Amtsgericht Stuttgart HRB 771692\nEFO - Eder Family Office GmbH – Gerlingen",
      "type": "Registerbekanntmachung nach dem Umwandlungsgesetz",
      "state": "Baden-Württemberg",
      "amtsgericht": "Amtsgericht Stuttgart",
      "registernummer": "HRB 771692",
      "registerart": "HRB",
      "company_name": "EFO - Eder Family Office GmbH",
      "company_seat": "Gerlingen",
      "details": "29.04.2025 (Bekanntmachungsdatum)\n\nBaden-Württemberg Amtsgericht Stuttgart HRB 771692\nRegisterbekanntmachung nach dem Umwandlungsgesetz 29.04.2025 (Eintragungsdatum)\n\nEFO - Eder Family Office GmbH\nGesellschaft mit beschränkter Haftung\nGerlingen\n\nAls nicht eingetragen wird bekanntgemacht:\nDen Gläubigern der an der Verschmelzung beteiligten Rechtsträger ist, wenn sie binnen sechs Monaten nach dem Tag, an dem die Eintragung der Verschmelzung in das Register des Sitzes desjenigen Rechtsträgers, dessen Gläubiger sie sind, nach § 19 Abs. 3 UmwG als bekanntgemacht gilt, ihren Anspruch nach Grund und Höhe schriftlich anmelden, Sicherheit zu leisten, soweit sie nicht Befriedigung verlangen können. Dieses Recht steht den Gläubigern jedoch nur zu, wenn sie glaubhaft machen, dass durch die Verschmelzung die Erfüllung ihrer Forderung gefährdet wird."
    },
    {
      "date": "2025-04-29",
      "id": "107599",
      "original_text": "Sonstige Registerbekanntmachung\nHamburg Amtsgericht Hamburg HRB 166096\nENERPARC Solar Invest 223 GmbH – Hamburg",
      "type": "Sonstige Registerbekanntmachung",
      "state": "Hamburg",
      "amtsgericht": "Amtsgericht Hamburg",
      "registernummer": "HRB 166096",
      "registerart": "HRB",
      "company_name": "ENERPARC Solar Invest 223 GmbH",
      "company_seat": "Hamburg",
      "details": "29.04.2025 (Bekanntmachungsdatum)\n\nHamburg Amtsgericht Hamburg HRB 166096\nSonstige Registerbekanntmachung 25.04.2025 (Eintragungsdatum)\n\nENERPARC Solar Invest 223 GmbH\nGesellschaft mit beschränkter Haftung\nHamburg\n\nAls nicht eingetragen wird bekannt gemacht:  Den Gläubigern der Gesellschaft, deren Forderungen begründet worden sind, bevor die Eintragung der Vertragsbeendigung in das Handelsregister nach § 10 HGB als bekannt gemacht gilt, ist vom anderen Vertragsteil Sicherheit zu leisten, wenn sie sich binnen 6 Monaten nach Bekanntmachung der Eintragung zu diesem Zweck bei ihm melden."
    },
    {
      "date": "2025-04-29",
      "id": "107600",
      "original_text": "Registerbekanntmachung nach dem Umwandlungsgesetz\nBaden-Württemberg Amtsgericht Mannheim HRB 711465\nBalaton Agro Invest AG – Heidelberg",
      "type": "Registerbekanntmachung nach dem Umwandlungsgesetz",
      "state": "Baden-Württemberg",
      "amtsgericht": "Amtsgericht Mannheim",
      "registernummer": "HRB 711465",
      "registerart": "HRB",
      "company_name": "Balaton Agro Invest AG",
      "company_seat": "Heidelberg",
      "details": "29.04.2025 (Bekanntmachungsdatum)\n\nBaden-Württemberg Amtsgericht Mannheim HRB 711465\nRegisterbekanntmachung nach dem Umwandlungsgesetz 29.04.2025 (Eintragungsdatum)\n\nBalaton Agro Invest AG\nAktiengesellschaft\nHeidelberg\n\nAls nicht eingetragen wird bekanntgemacht:\nDen Gläubigern der Gesellschaft, deren Forderungen begründet worden sind, bevor die Eintragung der Beendigung des Vertrages in das Handelsregister nach § 10 HGB als bekanntgemacht gilt, ist vom anderen Vertragsteil Sicherheit zu leisten, wenn sie sich binnen sechs Monaten nach der Bekanntmachung zu diesem Zweck bei ihm melden.\nDen Gläubigern der an der Verschmelzung beteiligten Rechtsträger ist, wenn sie binnen sechs Monaten nach dem Tag, an dem die Eintragung der Verschmelzung in das Register des Sitzes desjenigen Rechtsträgers, dessen Gläubiger sie sind, nach § 19 Abs. 3 UmwG als bekanntgemacht gilt, ihren Anspruch nach Grund und Höhe schriftlich anmelden, Sicherheit zu leisten, soweit sie nicht Befriedigung verlangen können. Dieses Recht steht den Gläubigern jedoch nur zu, wenn sie glaubhaft machen, dass durch die Verschmelzung die Erfüllung ihrer Forderung gefährdet wird."
    },
    {
      "date": "2025-04-29",
      "id": "107601",
      "original_text": "Löschungsankündigung\nBerlin Amtsgericht Berlin (Charlottenburg) HRB 135023\nD.P.S. Altbausanierung GmbH – Berlin",
      "type": "Löschungsankündigung",
      "state": "Berlin",
      "amtsgericht": "Amtsgericht Berlin (Charlottenburg)",
      "registernummer": "HRB 135023",
      "registerart": "HRB",
      "company_name": "D.P.S. Altbausanierung GmbH",
      "company_seat": "Berlin",
      "details": "29.04.2025 (Bekanntmachungsdatum)\n\nBerlin Amtsgericht Berlin (Charlottenburg) HRB 135023\nLöschungsankündigung\n\nD.P.S. Altbausanierung GmbH\nGesellschaft mit beschränkter Haftung\nBerlin\n\nBei der nachstehenden Gesellschaft wird das Amtslöschungsverfahren gemäß § 394 FamFG eingeleitet. Widerspruchsfrist 6 Wochen"
    },
    {
      "date": "2025-04-29",
      "id": "107602",
      "original_text": "Registerbekanntmachung nach dem Umwandlungsgesetz\nBaden-Württemberg Amtsgericht Mannheim HRB 338172\nDeutsche Balaton Aktiengesellschaft – Heidelberg",
      "type": "Registerbekanntmachung nach dem Umwandlungsgesetz",
      "state": "Baden-Württemberg",
      "amtsgericht": "Amtsgericht Mannheim",
      "registernummer": "HRB 338172",
      "registerart": "HRB",
      "company_name": "Deutsche Balaton Aktiengesellschaft",
      "company_seat": "Heidelberg",
      "details": "29.04.2025 (Bekanntmachungsdatum)\n\nBaden-Württemberg Amtsgericht Mannheim HRB 338172\nRegisterbekanntmachung nach dem Umwandlungsgesetz 29.04.2025 (Eintragungsdatum)\n\nDeutsche Balaton Aktiengesellschaft\nAktiengesellschaft\nHeidelberg\n\nAls nicht eingetragen wird bekanntgemacht:\nDen Gläubigern der an der Verschmelzung beteiligten Rechtsträger ist, wenn sie binnen sechs Monaten nach dem Tag, an dem die Eintragung der Verschmelzung in das Register des Sitzes desjenigen Rechtsträgers, dessen Gläubiger sie sind, nach § 19 Abs. 3 UmwG als bekanntgemacht gilt, ihren Anspruch nach Grund und Höhe schriftlich anmelden, Sicherheit zu leisten, soweit sie nicht Befriedigung verlangen können. Dieses Recht steht den Gläubigern jedoch nur zu, wenn sie glaubhaft machen, dass durch die Verschmelzung die Erfüllung ihrer Forderung gefährdet wird."
    },
    {
      "date": "2025-04-29",
      "id": "107603",
      "original_text": "Löschungsankündigung\nBrandenburg Amtsgericht Potsdam HRB 25759\nK-Automotiv GmbH Motorentechnik – Schönwalde-Glien",
      "type": "Löschungsankündigung",
      "state": "Brandenburg",
      "amtsgericht": "Amtsgericht Potsdam",
      "registernummer": "HRB 25759",
      "registerart": "HRB",
      "company_name": "K-Automotiv GmbH Motorentechnik",
      "company_seat": "Schönwalde-Glien",
      "details": "29.04.2025 (Bekanntmachungsdatum)\n\nBrandenburg Amtsgericht Potsdam HRB 25759\nLöschungsankündigung\n\nK-Automotiv GmbH Motorentechnik\nGesellschaft mit beschränkter Haftung\nSchönwalde-Glien\n\nBei der nachstehenden Gesellschaft wird das Amtslöschungsverfahren gemäß § 394 FamFG eingeleitet. Widerspruchsfrist 8 Wochen."
    },
    {
      "date": "2025-04-29",
      "id": "107604",
      "original_text": "Löschungsankündigung\nBerlin Amtsgericht Berlin (Charlottenburg) HRB 204693\nMehr - Entwicklung und Bildung UG (haftungsbeschränkt) – Berlin",
      "type": "Löschungsankündigung",
      "state": "Berlin",
      "amtsgericht": "Amtsgericht Berlin (Charlottenburg)",
      "registernummer": "HRB 204693",
      "registerart": "HRB",
      "company_name": "Mehr - Entwicklung und Bildung UG (haftungsbeschränkt)",
      "company_seat": "Berlin",
      "details": "29.04.2025 (Bekanntmachungsdatum)\n\nBerlin Amtsgericht Berlin (Charlottenburg) HRB 204693\nLöschungsankündigung\n\nMehr - Entwicklung und Bildung UG (haftungsbeschränkt)\nGesellschaft mit beschränkter Haftung\nBerlin\n\nBei der nachstehenden Gesellschaft wird das Amtslöschungsverfahren gemäß § 394 FamFG eingeleitet. Widerspruchsfrist 6 Wochen"
    },
    {
      "date": "2025-04-29",
      "id": "107605",
      "original_text": "Löschungsankündigung\nBerlin Amtsgericht Berlin (Charlottenburg) HRA 50185\nDritte Krynos Wohnungsbaugesellschaft GmbH & Co. KG – Berlin",
      "type": "Löschungsankündigung",
      "state": "Berlin",
      "amtsgericht": "Amtsgericht Berlin (Charlottenburg)",
      "registernummer": "HRA 50185",
      "registerart": "HRA",
      "company_name": "Dritte Krynos Wohnungsbaugesellschaft GmbH & Co. KG",
      "company_seat": "Berlin",
      "details": "29.04.2025 (Bekanntmachungsdatum)\n\nBerlin Amtsgericht Berlin (Charlottenburg) HRA 50185\nLöschungsankündigung\n\nDritte Krynos Wohnungsbaugesellschaft GmbH & Co. KG\nKommanditgesellschaft\nBerlin\n\nBei dem nachstehenden Unternehmen / der nachstehenden Gesellschaft wird das Amtslöschungsverfahren gemäß § 31 Abs. 2 HGB eingeleitet. Widerspruchsfrist 1 Monat"
    },
    {
      "date": "2025-04-29",
      "id": "107606",
      "original_text": "Registerbekanntmachung nach dem Umwandlungsgesetz\nHamburg Amtsgericht Hamburg HRB 189926\nBiesterfeld SE – Hamburg",
      "type": "Registerbekanntmachung nach dem Umwandlungsgesetz",
      "state": "Hamburg",
      "amtsgericht": "Amtsgericht Hamburg",
      "registernummer": "HRB 189926",
      "registerart": "HRB",
      "company_name": "Biesterfeld SE",
      "company_seat": "Hamburg",
      "details": "29.04.2025 (Bekanntmachungsdatum)\n\nHamburg Amtsgericht Hamburg HRB 189926\nRegisterbekanntmachung nach dem Umwandlungsgesetz 29.04.2025 (Eintragungsdatum)\n\nBiesterfeld SE\nEuropäische Aktiengesellschaft (SE)\nHamburg\n\nAls nicht eingetragen wird bekannt gemacht:\nDen Gläubigern der an der Verschmelzung beteiligten Gesellschaften ist, wenn sie binnen sechs Monaten nach dem Tag, an dem die Eintragung der Verschmelzung in das Register des Sitzes desjenigen Rechtsträgers, dessen Gläubiger sie sind, nach § 19 Absatz 3 UmwG als bekannt gemacht gilt, ihren Anspruch nach Grund und Höhe schriftlich anmelden, Sicherheit zu leisten, soweit sie nicht Befriedigung verlangen können. Dieses Recht steht den Gläubigern jedoch nur zu, wenn sie glaubhaft machen, dass durch die Verschmelzung die Erfüllung ihrer Forderung gefährdet wird."
    },
    {
      "date": "2025-04-29",
      "id": "107607",
      "original_text": "Registerbekanntmachung nach dem Umwandlungsgesetz\nHamburg Amtsgericht Hamburg HRB 102258\nBiesterfeld ChemLogS GmbH – Hamburg",
      "type": "Registerbekanntmachung nach dem Umwandlungsgesetz",
      "state": "Hamburg",
      "amtsgericht": "Amtsgericht Hamburg",
      "registernummer": "HRB 102258",
      "registerart": "HRB",
      "company_name": "Biesterfeld ChemLogS GmbH",
      "company_seat": "Hamburg",
      "details": "29.04.2025 (Bekanntmachungsdatum)\n\nHamburg Amtsgericht Hamburg HRB 102258\nRegisterbekanntmachung nach dem Umwandlungsgesetz 29.04.2025 (Eintragungsdatum)\n\nBiesterfeld ChemLogS GmbH\nGesellschaft mit beschränkter Haftung\nHamburg\n\nAls nicht eingetragen wird bekannt gemacht:\nDen Gläubigern der an der Verschmelzung beteiligten Gesellschaften ist, wenn sie binnen sechs Monaten nach dem Tag, an dem die Eintragung der Verschmelzung in das Register des Sitzes desjenigen Rechtsträgers, dessen Gläubiger sie sind, nach § 19 Absatz 3 UmwG als bekannt gemacht gilt, ihren Anspruch nach Grund und Höhe schriftlich anmelden, Sicherheit zu leisten, soweit sie nicht Befriedigung verlangen können. Dieses Recht steht den Gläubigern jedoch nur zu, wenn sie glaubhaft machen, dass durch die Verschmelzung die Erfüllung ihrer Forderung gefährdet wird."
    },
    {
      "date": "2025-04-29",
      "id": "107608",
      "original_text": "Registerbekanntmachung nach dem Umwandlungsgesetz\nHamburg Amtsgericht Hamburg HRB 76432\nBIT-SERV GmbH – Hamburg",
      "type": "Registerbekanntmachung nach dem Umwandlungsgesetz",
      "state": "Hamburg",
      "amtsgericht": "Amtsgericht Hamburg",
      "registernummer": "HRB 76432",
      "registerart": "HRB",
      "company_name": "BIT-SERV GmbH",
      "company_seat": "Hamburg",
      "details": "29.04.2025 (Bekanntmachungsdatum)\n\nHamburg Amtsgericht Hamburg HRB 76432\nRegisterbekanntmachung nach dem Umwandlungsgesetz 29.04.2025 (Eintragungsdatum)\n\nBIT-SERV GmbH\nGesellschaft mit beschränkter Haftung\nHamburg\n\nAls nicht eingetragen wird bekannt gemacht:\nDen Gläubigern der an der Verschmelzung beteiligten Gesellschaften ist, wenn sie binnen sechs Monaten nach dem Tag, an dem die Eintragung der Verschmelzung in das Register des Sitzes desjenigen Rechtsträgers, dessen Gläubiger sie sind, nach § 19 Absatz 3 UmwG als bekannt gemacht gilt, ihren Anspruch nach Grund und Höhe schriftlich anmelden, Sicherheit zu leisten, soweit sie nicht Befriedigung verlangen können. Dieses Recht steht den Gläubigern jedoch nur zu, wenn sie glaubhaft machen, dass durch die Verschmelzung die Erfüllung ihrer Forderung gefährdet wird."
    },
    {
      "date": "2025-04-29",
      "id": "107609",
      "original_text": "Einreichung neuer Dokumente\nThüringen Amtsgericht Jena HRB 504079\nMesse Erfurt GmbH – Erfurt",
      "type": "Einreichung neuer Dokumente",
      "state": "Thüringen",
      "amtsgericht": "Amtsgericht Jena",
      "registernummer": "HRB 504079",
      "registerart": "HRB",
      "company_name": "Messe Erfurt GmbH",
      "company_seat": "Erfurt",
      "details": "29.04.2025 (Bekanntmachungsdatum)\n\nThüringen Amtsgericht Jena HRB 504079\nEinreichung neuer Dokumente 01.03.2025 (Eintragungsdatum)\n\nMesse Erfurt GmbH\nGesellschaft mit beschränkter Haftung\nErfurt\n\nBekanntmachung gem. § 52 Abs. 3 Satz 2 GmbHG: Aufgrund einer Veränderung in den Personen der Aufsichtsratsmitglieder ist durch die Geschäftsführer eine neue Liste zum Handelsregister eingereicht worden."
    },
    {
      "date": "2025-04-29",
      "id": "107610",
      "original_text": "Löschungsankündigung\nThüringen Amtsgericht Jena HRA 500981\nCK! Zustellservice GmbH & Co. KG – Gera",
      "type": "Löschungsankündigung",
      "state": "Thüringen",
      "amtsgericht": "Amtsgericht Jena",
      "registernummer": "HRA 500981",
      "registerart": "HRA",
      "company_name": "CK! Zustellservice GmbH & Co. KG",
      "company_seat": "Gera",
      "details": "29.04.2025 (Bekanntmachungsdatum)\n\nThüringen Amtsgericht Jena HRA 500981\nLöschungsankündigung\n\nCK! Zustellservice GmbH & Co. KG\nKommanditgesellschaft\nGera\n\nDas Registergericht beabsichtigt, die im Handelsregister eingetragene Gesellschaft wegen Vermögenslosigkeit nach § 394 FamFG von Amts wegen zu löschen. Die Frist zur Erhebung eines Widerspruchs gegen die beabsichtigte Löschung wird auf 6 Wochen festgesetzt."
    },
    {
      "date": "2025-04-29",
      "id": "107611",
      "original_text": "Registerbekanntmachung nach dem Umwandlungsgesetz\nBerlin Amtsgericht Berlin (Charlottenburg) HRB 189058\nPEAHI GmbH – Berlin",
      "type": "Registerbekanntmachung nach dem Umwandlungsgesetz",
      "state": "Berlin",
      "amtsgericht": "Amtsgericht Berlin (Charlottenburg)",
      "registernummer": "HRB 189058",
      "registerart": "HRB",
      "company_name": "PEAHI GmbH",
      "company_seat": "Berlin",
      "details": "29.04.2025 (Bekanntmachungsdatum)\n\nBerlin Amtsgericht Berlin (Charlottenburg) HRB 189058\nRegisterbekanntmachung nach dem Umwandlungsgesetz 28.04.2025 (Eintragungsdatum)\n\nPEAHI GmbH\nGesellschaft mit beschränkter Haftung\nBerlin\n\nZu Eintragungsnummer 3 vom 28.04.2025 wird als nicht eingetragen veröffentlicht:Den Gläubigern der an der Verschmelzung beteiligten Rechtsträger ist, wenn sie binnen sechs Monaten nach dem Tag, an dem die Eintragung der Verschmelzung in das Register des Sitzes desjenigen Rechtsträgers, dessen Gläubiger sie sind, als bekannt gemacht gilt, ihren Anspruch nach Grund und Höhe schriftlich anmelden, Sicherheit zu leisten, soweit sie nicht Befriedigung verlangen können. Dieses Recht steht den Gläubigern jedoch nur zu, wenn sie glaubhaft machen, dass durch die Verschmelzung die Erfüllung ihrer Forderung gefährdet wird. Das Recht, Sicherheitsleistung zu verlangen, steht Gläubigern nicht zu, die im Falle der Insolvenz ein Recht auf vorzugsweise Befriedigung aus einer Deckungsmasse haben, die nach gesetzlicher Vorschrift zu ihrem Schutz errichtet und staatlich überwacht ist."
    },
    {
      "date": "2025-04-29",
      "id": "107612",
      "original_text": "Löschungsankündigung\nSchleswig-Holstein Amtsgericht Lübeck HRB 13551\netvice Consulting GmbH – Jersbek",
      "type": "Löschungsankündigung",
      "state": "Schleswig-Holstein",
      "amtsgericht": "Amtsgericht Lübeck",
      "registernummer": "HRB 13551",
      "registerart": "HRB",
      "company_name": "etvice Consulting GmbH",
      "company_seat": "Jersbek",
      "details": "29.04.2025 (Bekanntmachungsdatum)\n\nSchleswig-Holstein Amtsgericht Lübeck HRB 13551\nLöschungsankündigung\n\netvice Consulting GmbH\nGesellschaft mit beschränkter Haftung\nJersbek\n\nEs ist die Löschung der nachstehenden Gesellschaft wegen Vermögenslosigkeit gemäß § 394 FamFG beabsichtigt.\nWiderspruchsfrist: 1 Monat"
    },
    {
      "date": "2025-04-29",
      "id": "107613",
      "original_text": "Löschungsankündigung\nBaden-Württemberg Amtsgericht Stuttgart HRA 380588\nGebrüder Hartmann e. K. – Tübingen",
      "type": "Löschungsankündigung",
      "state": "Baden-Württemberg",
      "amtsgericht": "Amtsgericht Stuttgart",
      "registernummer": "HRA 380588",
      "registerart": "HRA",
      "company_name": "Gebrüder Hartmann e. K.",
      "company_seat": "Tübingen",
      "details": "29.04.2025 (Bekanntmachungsdatum)\n\nBaden-Württemberg Amtsgericht Stuttgart HRA 380588\nLöschungsankündigung\n\nGebrüder Hartmann e. K.\nEinzelkaufmann / Einzelkauffrau\nTübingen\n\nDas Registergericht beabsichtigt, die Firma im Handelsregister von Amts wegen nach § 31 Abs. 2 HGB zu löschen. Die Frist zur Geltendmachung eines Widerspruchs gegen die beabsichtigte Löschung ist auf einen Monat ab Veröffentlichung bestimmt."
    },
    {
      "date": "2025-04-29",
      "id": "107614",
      "original_text": "Registerbekanntmachung nach dem Umwandlungsgesetz\nSchleswig-Holstein Amtsgericht Kiel HRB 24113\nFördeVermögenInvest GmbH – Eckernförde",
      "type": "Registerbekanntmachung nach dem Umwandlungsgesetz",
      "state": "Schleswig-Holstein",
      "amtsgericht": "Amtsgericht Kiel",
      "registernummer": "HRB 24113",
      "registerart": "HRB",
      "company_name": "FördeVermögenInvest GmbH",
      "company_seat": "Eckernförde",
      "details": "29.04.2025 (Bekanntmachungsdatum)\n\nSchleswig-Holstein Amtsgericht Kiel HRB 24113\nRegisterbekanntmachung nach dem Umwandlungsgesetz 29.04.2025 (Eintragungsdatum)\n\nFördeVermögenInvest GmbH\nGesellschaft mit beschränkter Haftung\nEckernförde\n\nZu Eintragungsnummer 2 vom 29.04.2025 wird als nicht eingetragen veröffentlicht:  Den Gläubigern der an der Verschmelzung beteiligten Rechtsträger ist, wenn sie binnen sechs Monaten nach dem Tag, an dem die Eintragung der Verschmelzung in das Register des Sitzes desjenigen Rechtsträgers, dessen Gläubiger sie sind, nach § 19 Abs. 3 UmwG bekannt gemacht worden ist, ihren Anspruch nach Grund und Höhe schriftlich anmelden, Sicherheit zu leisten, soweit sie nicht Befriedigung verlangen können. Dieses Recht steht den Gläubigern jedoch nur zu, wenn sie glaubhaft machen, dass durch die Verschmelzung die Erfüllung ihrer Forderung gefährdet wird."
    },
    {
      "date": "2025-04-29",
      "id": "107615",
      "original_text": "Registerbekanntmachung nach dem Umwandlungsgesetz\nBaden-Württemberg Amtsgericht Mannheim HRB 753774\nReith-IT GmbH – Mannheim",
      "type": "Registerbekanntmachung nach dem Umwandlungsgesetz",
      "state": "Baden-Württemberg",
      "amtsgericht": "Amtsgericht Mannheim",
      "registernummer": "HRB 753774",
      "registerart": "HRB",
      "company_name": "Reith-IT GmbH",
      "company_seat": "Mannheim",
      "details": "29.04.2025 (Bekanntmachungsdatum)\n\nBaden-Württemberg Amtsgericht Mannheim HRB 753774\nRegisterbekanntmachung nach dem Umwandlungsgesetz 29.04.2025 (Eintragungsdatum)\n\nReith-IT GmbH\nGesellschaft mit beschränkter Haftung\nMannheim\n\nDen Gläubigern der an der Ausgliederung beteiligten Rechtsträger ist, wenn sie binnen sechs Monaten nach dem Tag, an dem die Eintragung der Ausgliederung in das Register des Sitzes desjenigen Rechtsträgers, dessen Gläubiger sie sind, nach § 19 Abs. 3 UmwG als bekanntgemacht gilt, ihren Anspruch nach Grund und Höhe schriftlich anmelden, Sicherheit zu leisten, soweit sie nicht Befriedigung verlangen können. Dieses Recht steht den Gläubigern jedoch nur zu, wenn sie glaubhaft machen, dass durch die Ausgliederung die Erfüllung ihrer Forderung gefährdet wird."
    },
    {
      "date": "2025-04-29",
      "id": "107616",
      "original_text": "Löschungsankündigung\nBerlin Amtsgericht Berlin (Charlottenburg) HRB 231701\nseedz.Germany GmbH – Berlin",
      "type": "Löschungsankündigung",
      "state": "Berlin",
      "amtsgericht": "Amtsgericht Berlin (Charlottenburg)",
      "registernummer": "HRB 231701",
      "registerart": "HRB",
      "company_name": "seedz.Germany GmbH",
      "company_seat": "Berlin",
      "details": "29.04.2025 (Bekanntmachungsdatum)\n\nBerlin Amtsgericht Berlin (Charlottenburg) HRB 231701\nLöschungsankündigung\n\nseedz.Germany GmbH\nGesellschaft mit beschränkter Haftung\nBerlin\n\nBei der nachstehenden Gesellschaft wird das Amtslöschungsverfahren gemäß § 394 FamFG eingeleitet. Widerspruchsfrist 6 Wochen"
    },
    {
      "date": "2025-04-29",
      "id": "107617",
      "original_text": "Registerbekanntmachung nach dem Umwandlungsgesetz\nBaden-Württemberg Amtsgericht Mannheim HRA 711571\nFlorian Reith IT-Dienstleistungen e.K. – Leimen",
      "type": "Registerbekanntmachung nach dem Umwandlungsgesetz",
      "state": "Baden-Württemberg",
      "amtsgericht": "Amtsgericht Mannheim",
      "registernummer": "HRA 711571",
      "registerart": "HRA",
      "company_name": "Florian Reith IT-Dienstleistungen e.K.",
      "company_seat": "Leimen",
      "details": "29.04.2025 (Bekanntmachungsdatum)\n\nBaden-Württemberg Amtsgericht Mannheim HRA 711571\nRegisterbekanntmachung nach dem Umwandlungsgesetz 29.04.2025 (Eintragungsdatum)\n\nFlorian Reith IT-Dienstleistungen e.K.\nEinzelkaufmann / Einzelkauffrau\nLeimen\n\nAls nicht eingetragen wird bekanntgemacht: Den Gläubigern der an der Ausgliederung beteiligten Rechtsträger ist, wenn sie binnen sechs Monaten nach dem Tag, an dem die Eintragung der Ausgliederung in das Register des Sitzes desjenigen Rechtsträgers, dessen Gläubiger sie sind, nach § 19 Abs. 3 UmwG als bekanntgemacht gilt, ihren Anspruch nach Grund und Höhe schriftlich anmelden, Sicherheit zu leisten, soweit sie nicht Befriedigung verlangen können. Dieses Recht steht den Gläubigern jedoch nur zu, wenn sie glaubhaft machen, dass durch die Ausgliederung die Erfüllung ihrer Forderung gefährdet wird."
    },
    {
      "date": "2025-04-29",
      "id": "107618",
      "original_text": "Registerbekanntmachung nach dem Umwandlungsgesetz\nBaden-Württemberg Amtsgericht Stuttgart HRB 581192\nM-E-K Technik GmbH – Öhringen",
      "type": "Registerbekanntmachung nach dem Umwandlungsgesetz",
      "state": "Baden-Württemberg",
      "amtsgericht": "Amtsgericht Stuttgart",
      "registernummer": "HRB 581192",
      "registerart": "HRB",
      "company_name": "M-E-K Technik GmbH",
      "company_seat": "Öhringen",
      "details": "29.04.2025 (Bekanntmachungsdatum)\n\nBaden-Württemberg Amtsgericht Stuttgart HRB 581192\nRegisterbekanntmachung nach dem Umwandlungsgesetz 29.04.2025 (Eintragungsdatum)\n\nM-E-K Technik GmbH\nGesellschaft mit beschränkter Haftung\nÖhringen\n\nAls nicht eingetragen wird bekanntgemacht:\nDen Gläubigern der an der Verschmelzung beteiligten Rechtsträger ist, wenn sie binnen sechs Monaten nach dem Tag, an dem die Eintragung der Verschmelzung in das Register des Sitzes desjenigen Rechtsträgers, dessen Gläubiger sie sind, nach § 19 Abs. 3 UmwG als bekanntgemacht gilt, ihren Anspruch nach Grund und Höhe schriftlich anmelden, Sicherheit zu leisten, soweit sie nicht Befriedigung verlangen können. Dieses Recht steht den Gläubigern jedoch nur zu, wenn sie glaubhaft machen, dass durch die Verschmelzung die Erfüllung ihrer Forderung gefährdet wird."
    },
    {
      "date": "2025-04-29",
      "id": "107619",
      "original_text": "Registerbekanntmachung nach dem Umwandlungsgesetz\nBaden-Württemberg Amtsgericht Stuttgart HRB 580337\nM-E-K Electric Gesellschaft mit beschränkter Haftung – Öhringen",
      "type": "Registerbekanntmachung nach dem Umwandlungsgesetz",
      "state": "Baden-Württemberg",
      "amtsgericht": "Amtsgericht Stuttgart",
      "registernummer": "HRB 580337",
      "registerart": "HRB",
      "company_name": "M-E-K Electric Gesellschaft mit beschränkter Haftung",
      "company_seat": "Öhringen",
      "details": "29.04.2025 (Bekanntmachungsdatum)\n\nBaden-Württemberg Amtsgericht Stuttgart HRB 580337\nRegisterbekanntmachung nach dem Umwandlungsgesetz 29.04.2025 (Eintragungsdatum)\n\nM-E-K Electric Gesellschaft mit beschränkter Haftung\nGesellschaft mit beschränkter Haftung\nÖhringen\n\nDen Gläubigern der an der Verschmelzung beteiligten Rechtsträger ist, wenn sie binnen sechs Monaten nach dem Tag, an dem die Eintragung der Verschmelzung in das Register des Sitzes desjenigen Rechtsträgers, dessen Gläubiger sie sind, nach § 19 Abs. 3 UmwG als bekanntgemacht gilt, ihren Anspruch nach Grund und Höhe schriftlich anmelden, Sicherheit zu leisten, soweit sie nicht Befriedigung verlangen können. Dieses Recht steht den Gläubigern jedoch nur zu, wenn sie glaubhaft machen, dass durch die Verschmelzung die Erfüllung ihrer Forderung gefährdet wird."
    },
    {
      "date": "2025-04-29",
      "id": "107620",
      "original_text": "Registerbekanntmachung nach dem Umwandlungsgesetz\nSchleswig-Holstein Amtsgericht Kiel HRB 21942\nFörde Vermögensverwaltungs GmbH – Eckernförde",
      "type": "Registerbekanntmachung nach dem Umwandlungsgesetz",
      "state": "Schleswig-Holstein",
      "amtsgericht": "Amtsgericht Kiel",
      "registernummer": "HRB 21942",
      "registerart": "HRB",
      "company_name": "Förde Vermögensverwaltungs GmbH",
      "company_seat": "Eckernförde",
      "details": "29.04.2025 (Bekanntmachungsdatum)\n\nSchleswig-Holstein Amtsgericht Kiel HRB 21942\nRegisterbekanntmachung nach dem Umwandlungsgesetz 29.04.2025 (Eintragungsdatum)\n\nFörde Vermögensverwaltungs GmbH\nGesellschaft mit beschränkter Haftung\nEckernförde\n\nZu Eintragungsnummer 2 vom 29.04.2025 wird als nicht eingetragen veröffentlicht:\nDen Gläubigern der an der Verschmelzung beteiligten Rechtsträger ist, wenn sie binnen sechs Monaten nach dem Tag, an dem die Eintragung der Verschmelzung in das Register des Sitzes desjenigen Rechtsträgers, dessen Gläubiger sie sind, nach § 19 Abs. 3 UmwG bekannt gemacht worden ist, ihren Anspruch nach Grund und Höhe schriftlich anmelden, Sicherheit zu leisten, soweit sie nicht Befriedigung verlangen können. Dieses Recht steht den Gläubigern jedoch nur zu, wenn sie glaubhaft machen, dass durch die Verschmelzung die Erfüllung ihrer Forderung gefährdet wird."
    },
    {
      "date": "2025-04-29",
      "id": "107621",
      "original_text": "Registerbekanntmachung nach dem Umwandlungsgesetz\nBaden-Württemberg Amtsgericht Ulm HRA 541045\nKai Greising e.K. – Amstetten",
      "type": "Registerbekanntmachung nach dem Umwandlungsgesetz",
      "state": "Baden-Württemberg",
      "amtsgericht": "Amtsgericht Ulm",
      "registernummer": "HRA 541045",
      "registerart": "HRA",
      "company_name": "Kai Greising e.K.",
      "company_seat": "Amstetten",
      "details": "29.04.2025 (Bekanntmachungsdatum)\n\nBaden-Württemberg Amtsgericht Ulm HRA 541045\nRegisterbekanntmachung nach dem Umwandlungsgesetz 29.04.2025 (Eintragungsdatum)\n\nKai Greising e.K.\nEinzelkaufmann / Einzelkauffrau\nAmstetten\n\nAls nicht eingetragen wird bekanntgemacht:\nDen Gläubigern der an der Ausgliederung beteiligten Rechtsträger ist, wenn sie binnen sechs Monaten nach dem Tag, an dem die Eintragung der Ausgliederung in das Register des Sitzes desjenigen Rechtsträgers, dessen Gläubiger sie sind, nach § 19 Abs. 3 UmwG als bekanntgemacht gilt, ihren Anspruch nach Grund und Höhe schriftlich anmelden, Sicherheit zu leisten, soweit sie nicht Befriedigung verlangen können. Dieses Recht steht den Gläubigern jedoch nur zu, wenn sie glaubhaft machen, dass durch die Ausgliederung die Erfüllung ihrer Forderung gefährdet wird."
    },
    {
      "date": "2025-04-29",
      "id": "107622",
      "original_text": "Registerbekanntmachung nach dem Umwandlungsgesetz\nBaden-Württemberg Amtsgericht Ulm HRB 749825\nKai Greising GmbH – Amstetten",
      "type": "Registerbekanntmachung nach dem Umwandlungsgesetz",
      "state": "Baden-Württemberg",
      "amtsgericht": "Amtsgericht Ulm",
      "registernummer": "HRB 749825",
      "registerart": "HRB",
      "company_name": "Kai Greising GmbH",
      "company_seat": "Amstetten",
      "details": "29.04.2025 (Bekanntmachungsdatum)\n\nBaden-Württemberg Amtsgericht Ulm HRB 749825\nRegisterbekanntmachung nach dem Umwandlungsgesetz 29.04.2025 (Eintragungsdatum)\n\nKai Greising GmbH\nGesellschaft mit beschränkter Haftung\nAmstetten\n\nAls nicht eingetragen wird bekanntgemacht:\nDen Gläubigern der an der Ausgliederung beteiligten Rechtsträger ist, wenn sie binnen sechs Monaten nach dem Tag, an dem die Eintragung der Ausgliederung in das Register des Sitzes desjenigen Rechtsträgers, dessen Gläubiger sie sind, nach § 19 Abs. 3 UmwG als bekanntgemacht gilt, ihren Anspruch nach Grund und Höhe schriftlich anmelden, Sicherheit zu leisten, soweit sie nicht Befriedigung verlangen können. Dieses Recht steht den Gläubigern jedoch nur zu, wenn sie glaubhaft machen, dass durch die Ausgliederung die Erfüllung ihrer Forderung gefährdet wird."
    },
    {
      "date": "2025-04-29",
      "id": "107623",
      "original_text": "Registerbekanntmachung nach dem Umwandlungsgesetz\nMecklenburg-Vorpommern Amtsgericht Stralsund HRB 612 früher Amtsgericht Rostock\nHahn Nutzfahrzeuge GmbH – Kemnitz",
      "type": "Registerbekanntmachung nach dem Umwandlungsgesetz",
      "state": "Mecklenburg-Vorpommern",
      "amtsgericht": "Amtsgericht Stralsund",
      "registernummer": "HRB 612",
      "registerart": "HRB",
      "company_name": "Hahn Nutzfahrzeuge GmbH",
      "company_seat": "Kemnitz",
      "former_amtsgericht": "Rostock",
      "details": "29.04.2025 (Bekanntmachungsdatum)\n\nMecklenburg-Vorpommern Amtsgericht Stralsund HRB 612 früher Amtsgericht Rostock\nRegisterbekanntmachung nach dem Umwandlungsgesetz 29.04.2025 (Eintragungsdatum)\n\nHahn Nutzfahrzeuge GmbH\nGesellschaft mit beschränkter Haftung\nKemnitz\n\nAls nicht eingetragen wird veröffentlicht: Den Gläubigern der an der Verschmelzung beteiligten Rechtsträger ist, wenn sie binnen sechs Monaten nach dem Tag, an dem die Eintragung der Verschmelzung in das Register des Sitzes desjenigen Rechtsträgers, dessen Gläubiger sie sind, nach § 19 Abs. 3 UmwG als bekannt gemacht gilt,\nihren Anspruch nach Grund und Höhe in Textform anmelden, Sicherheit zu leisten, soweit sie nicht Befriedigung verlangen können. Dieses Recht steht den Gläubigern jedoch nur zu, wenn sie glaubhaft machen, dass durch die Verschmelzung die Erfüllung der Forderung gefährdet wird."
    },
    {
      "date": "2025-04-29",
      "id": "107624",
      "original_text": "Registerbekanntmachung nach dem Umwandlungsgesetz\nBaden-Württemberg Amtsgericht Mannheim HRB 6895\nHirsch und Ille Hifi-Laden Verwaltungs GmbH – Mannheim",
      "type": "Registerbekanntmachung nach dem Umwandlungsgesetz",
      "state": "Baden-Württemberg",
      "amtsgericht": "Amtsgericht Mannheim",
      "registernummer": "HRB 6895",
      "registerart": "HRB",
      "company_name": "Hirsch und Ille Hifi-Laden Verwaltungs GmbH",
      "company_seat": "Mannheim",
      "details": "29.04.2025 (Bekanntmachungsdatum)\n\nBaden-Württemberg Amtsgericht Mannheim HRB 6895\nRegisterbekanntmachung nach dem Umwandlungsgesetz 29.04.2025 (Eintragungsdatum)\n\nHirsch und Ille Hifi-Laden Verwaltungs GmbH\nGesellschaft mit beschränkter Haftung\nMannheim\n\nDen Gläubigern der an der Ausgliederung beteiligten Rechtsträger ist, wenn sie binnen sechs Monaten nach dem Tag, an dem die Eintragung der Ausgliederung in das Register des Sitzes desjenigen Rechtsträgers, dessen Gläubiger sie sind, nach § 19 Abs. 3 UmwG als bekanntgemacht gilt, ihren Anspruch nach Grund und Höhe schriftlich anmelden, Sicherheit zu leisten, soweit sie nicht Befriedigung verlangen können. Dieses Recht steht den Gläubigern jedoch nur zu, wenn sie glaubhaft machen, dass durch die Ausgliederung die Erfüllung ihrer Forderung gefährdet wird."
    },
    {
      "date": "2025-04-29",
      "id": "107625",
      "original_text": "Registerbekanntmachung nach dem Umwandlungsgesetz\nBaden-Württemberg Amtsgericht Mannheim HRA 711830\nWolfgang Hirsch e. K. – Mannheim",
      "type": "Registerbekanntmachung nach dem Umwandlungsgesetz",
      "state": "Baden-Württemberg",
      "amtsgericht": "Amtsgericht Mannheim",
      "registernummer": "HRA 711830",
      "registerart": "HRA",
      "company_name": "Wolfgang Hirsch e. K.",
      "company_seat": "Mannheim",
      "details": "29.04.2025 (Bekanntmachungsdatum)\n\nBaden-Württemberg Amtsgericht Mannheim HRA 711830\nRegisterbekanntmachung nach dem Umwandlungsgesetz 29.04.2025 (Eintragungsdatum)\n\nWolfgang Hirsch e. K.\nEinzelkaufmann / Einzelkauffrau\nMannheim\n\nDen Gläubigern der an der Ausgliederung beteiligten Rechtsträger ist, wenn sie binnen sechs Monaten nach dem Tag, an dem die Eintragung der Ausgliederung in das Register des Sitzes desjenigen Rechtsträgers, dessen Gläubiger sie sind, nach § 19 Abs. 3 UmwG als bekanntgemacht gilt, ihren Anspruch nach Grund und Höhe schriftlich anmelden, Sicherheit zu leisten, soweit sie nicht Befriedigung verlangen können. Dieses Recht steht den Gläubigern jedoch nur zu, wenn sie glaubhaft machen, dass durch die Ausgliederung die Erfüllung ihrer Forderung gefährdet wird."
    },
    {
      "date": "2025-04-29",
      "id": "107626",
      "original_text": "Löschungsankündigung\nBaden-Württemberg Amtsgericht Mannheim HRA 3858\nApotheke im Schönau-Center e.K. – Mannheim",
      "type": "Löschungsankündigung",
      "state": "Baden-Württemberg",
      "amtsgericht": "Amtsgericht Mannheim",
      "registernummer": "HRA 3858",
      "registerart": "HRA",
      "company_name": "Apotheke im Schönau-Center e.K.",
      "company_seat": "Mannheim",
      "details": "29.04.2025 (Bekanntmachungsdatum)\n\nBaden-Württemberg Amtsgericht Mannheim HRA 3858\nLöschungsankündigung\n\nApotheke im Schönau-Center e.K.\nEinzelkaufmann / Einzelkauffrau\nMannheim\n\nAls nicht eingetragen wird bekanntgemacht: Das Registergericht beabsichtigt, die Firma im Handelsregister von Amts wegen nach § 31 Abs. 2 HGB zu löschen. Die Frist zur Geltendmachung eines Widerspruchs gegen die beabsichtigte Löschung ist auf einen Monat ab Veröffentlichung bestimmt."
    },
    {
      "date": "2025-04-29",
      "id": "107627",
      "original_text": "Registerbekanntmachung nach dem Umwandlungsgesetz\nBaden-Württemberg Amtsgericht Mannheim HRB 743577\nKurz Gruppe Solutions GmbH – Friolzheim",
      "type": "Registerbekanntmachung nach dem Umwandlungsgesetz",
      "state": "Baden-Württemberg",
      "amtsgericht": "Amtsgericht Mannheim",
      "registernummer": "HRB 743577",
      "registerart": "HRB",
      "company_name": "Kurz Gruppe Solutions GmbH",
      "company_seat": "Friolzheim",
      "details": "29.04.2025 (Bekanntmachungsdatum)\n\nBaden-Württemberg Amtsgericht Mannheim HRB 743577\nRegisterbekanntmachung nach dem Umwandlungsgesetz 29.04.2025 (Eintragungsdatum)\n\nKurz Gruppe Solutions GmbH\nGesellschaft mit beschränkter Haftung\nFriolzheim\n\nDen Gläubigern der an der Verschmelzung beteiligten Rechtsträger ist, wenn sie binnen sechs Monaten nach dem Tag, an dem die Eintragung der Verschmelzung in das Register des Sitzes desjenigen Rechtsträgers, dessen Gläubiger sie sind, nach § 19 Abs. 3 UmwG als bekanntgemacht gilt, ihren Anspruch nach Grund und Höhe schriftlich anmelden, Sicherheit zu leisten, soweit sie nicht Befriedigung verlangen können. Dieses Recht steht den Gläubigern jedoch nur zu, wenn sie glaubhaft machen, dass durch die Verschmelzung die Erfüllung ihrer Forderung gefährdet wird."
    },
    {
      "date": "2025-04-29",
      "id": "107628",
      "original_text": "Löschungsankündigung\nBerlin Amtsgericht Berlin (Charlottenburg) HRB 244467\nh3o Fahrdienst GmbH – Berlin",
      "type": "Löschungsankündigung",
      "state": "Berlin",
      "amtsgericht": "Amtsgericht Berlin (Charlottenburg)",
      "registernummer": "HRB 244467",
      "registerart": "HRB",
      "company_name": "h3o Fahrdienst GmbH",
      "company_seat": "Berlin",
      "details": "29.04.2025 (Bekanntmachungsdatum)\n\nBerlin Amtsgericht Berlin (Charlottenburg) HRB 244467\nLöschungsankündigung\n\nh3o Fahrdienst GmbH\nGesellschaft mit beschränkter Haftung\nBerlin\n\nEs ist beabsichtigt, die Eintragung des Geschäftsführers Stanimir Simeonov nach § 395 FamFG wegen Fehlens einer wesentlichen Voraussetzung von Amts wegen zu löschen. Die Widerspruchsfrist beträgt 2 Wochen."
    },
    {
      "date": "2025-04-29",
      "id": "107629",
      "original_text": "Registerbekanntmachung nach dem Umwandlungsgesetz\nBaden-Württemberg Amtsgericht Mannheim HRB 720259\nAXXAIR GmbH – Rastatt",
      "type": "Registerbekanntmachung nach dem Umwandlungsgesetz",
      "state": "Baden-Württemberg",
      "amtsgericht": "Amtsgericht Mannheim",
      "registernummer": "HRB 720259",
      "registerart": "HRB",
      "company_name": "AXXAIR GmbH",
      "company_seat": "Rastatt",
      "details": "29.04.2025 (Bekanntmachungsdatum)\n\nBaden-Württemberg Amtsgericht Mannheim HRB 720259\nRegisterbekanntmachung nach dem Umwandlungsgesetz 29.04.2025 (Eintragungsdatum)\n\nAXXAIR GmbH\nGesellschaft mit beschränkter Haftung\nRastatt\n\nDen Gläubigern der an der Verschmelzung beteiligten Rechtsträger ist, wenn sie binnen sechs Monaten nach dem Tag, an dem die Eintragung der Verschmelzung in das Register des Sitzes desjenigen Rechtsträgers, dessen Gläubiger sie sind, nach § 19 Abs. 3 UmwG als bekanntgemacht gilt, ihren Anspruch nach Grund und Höhe schriftlich anmelden, Sicherheit zu leisten, soweit sie nicht Befriedigung verlangen können. Dieses Recht steht den Gläubigern jedoch nur zu, wenn sie glaubhaft machen, dass durch die Verschmelzung die Erfüllung ihrer Forderung gefährdet wird."
    },
    {
      "date": "2025-04-29",
      "id": "107630",
      "original_text": "Löschungsankündigung\nSchleswig-Holstein Amtsgericht Lübeck HRA 1087 OL\nv. Graevemeyer KG – Oldenburg in Holstein",
      "type": "Löschungsankündigung",
      "state": "Schleswig-Holstein",
      "amtsgericht": "Amtsgericht Lübeck",
      "registernummer": "HRA 1087 OL",
      "registerart": "HRA",
      "company_name": "v. Graevemeyer KG",
      "company_seat": "Oldenburg in Holstein",
      "details": "29.04.2025 (Bekanntmachungsdatum)\n\nSchleswig-Holstein Amtsgericht Lübeck HRA 1087 OL\nLöschungsankündigung\n\nv. Graevemeyer KG\nKommanditgesellschaft\nOldenburg in Holstein\n\nEs ist die Löschung der nachstehenden Gesellschaft wegen Vermögenslosigkeit gemäß § 394 FamFG beabsichtigt. Widerspruchsfrist: 1 Monat."
    },
    {
      "date": "2025-04-29",
      "id": "107631",
      "original_text": "Einreichung neuer Dokumente\nBaden-Württemberg Amtsgericht Stuttgart HRB 480012\nOBERNDORFER WOHNUNGSBAU, Gesellschaft mit beschränkter Haftung – Oberndorf am Neckar",
      "type": "Einreichung neuer Dokumente",
      "state": "Baden-Württemberg",
      "amtsgericht": "Amtsgericht Stuttgart",
      "registernummer": "HRB 480012",
      "registerart": "HRB",
      "company_name": "OBERNDORFER WOHNUNGSBAU, Gesellschaft mit beschränkter Haftung",
      "company_seat": "Oberndorf am Neckar",
      "details": "29.04.2025 (Bekanntmachungsdatum)\n\nBaden-Württemberg Amtsgericht Stuttgart HRB 480012\nEinreichung neuer Dokumente\n\nOBERNDORFER WOHNUNGSBAU, Gesellschaft mit beschränkter Haftung\nGesellschaft mit beschränkter Haftung\nOberndorf am Neckar\n\nDie Gesellschaft hat am 29.04.2025 die Liste über die Zusammensetzung des Aufsichtsrats zum Handelsregister eingereicht."
    },
    {
      "date": "2025-04-29",
      "id": "107632",
      "original_text": "Registerbekanntmachung nach dem Umwandlungsgesetz\nBaden-Württemberg Amtsgericht Mannheim HRB 737987\nKurz Gruppe Machinery GmbH – Friolzheim",
      "type": "Registerbekanntmachung nach dem Umwandlungsgesetz",
      "state": "Baden-Württemberg",
      "amtsgericht": "Amtsgericht Mannheim",
      "registernummer": "HRB 737987",
      "registerart": "HRB",
      "company_name": "Kurz Gruppe Machinery GmbH",
      "company_seat": "Friolzheim",
      "details": "29.04.2025 (Bekanntmachungsdatum)\n\nBaden-Württemberg Amtsgericht Mannheim HRB 737987\nRegisterbekanntmachung nach dem Umwandlungsgesetz 29.04.2025 (Eintragungsdatum)\n\nKurz Gruppe Machinery GmbH\nGesellschaft mit beschränkter Haftung\nFriolzheim\n\nDen Gläubigern der an der Verschmelzung beteiligten Rechtsträger ist, wenn sie binnen sechs Monaten nach dem Tag, an dem die Eintragung der Verschmelzung in das Register des Sitzes desjenigen Rechtsträgers, dessen Gläubiger sie sind, nach § 19 Abs. 3 UmwG als bekanntgemacht gilt, ihren Anspruch nach Grund und Höhe schriftlich anmelden, Sicherheit zu leisten, soweit sie nicht Befriedigung verlangen können. Dieses Recht steht den Gläubigern jedoch nur zu, wenn sie glaubhaft machen, dass durch die Verschmelzung die Erfüllung ihrer Forderung gefährdet wird."
    },
    {
      "date": "2025-04-29",
      "id": "107633",
      "original_text": "Registerbekanntmachung nach dem Umwandlungsgesetz\nBaden-Württemberg Amtsgericht Mannheim HRA 712298\nGeigenbauatelier Heidelberg Tobias Hoth e.K. – Heidelberg",
      "type": "Registerbekanntmachung nach dem Umwandlungsgesetz",
      "state": "Baden-Württemberg",
      "amtsgericht": "Amtsgericht Mannheim",
      "registernummer": "HRA 712298",
      "registerart": "HRA",
      "company_name": "Geigenbauatelier Heidelberg Tobias Hoth e.K.",
      "company_seat": "Heidelberg",
      "details": "29.04.2025 (Bekanntmachungsdatum)\n\nBaden-Württemberg Amtsgericht Mannheim HRA 712298\nRegisterbekanntmachung nach dem Umwandlungsgesetz 29.04.2025 (Eintragungsdatum)\n\nGeigenbauatelier Heidelberg Tobias Hoth e.K.\nEinzelkaufmann / Einzelkauffrau\nHeidelberg\n\nAls nicht eingetragen wird bekanntgemacht:\nDen Gläubigern der an der Ausgliederung beteiligten Rechtsträger ist, wenn sie binnen sechs Monaten nach dem Tag, an dem die Eintragung der Ausgliederung in das Register des Sitzes desjenigen Rechtsträgers, dessen Gläubiger sie sind, nach § 19 Abs. 3 UmwG als bekanntgemacht gilt, ihren Anspruch nach Grund und Höhe schriftlich anmelden, Sicherheit zu leisten, soweit sie nicht Befriedigung verlangen können. Dieses Recht steht den Gläubigern jedoch nur zu, wenn sie glaubhaft machen, dass durch die Ausgliederung die Erfüllung ihrer Forderung gefährdet wird."
    },
    {
      "date": "2025-04-29",
      "id": "107634",
      "original_text": "Einreichung neuer Dokumente\nBaden-Württemberg Amtsgericht Stuttgart HRB 12720\nU. I. Lapp GmbH – Stuttgart",
      "type": "Einreichung neuer Dokumente",
      "state": "Baden-Württemberg",
      "amtsgericht": "Amtsgericht Stuttgart",
      "registernummer": "HRB 12720",
      "registerart": "HRB",
      "company_name": "U. I. Lapp GmbH",
      "company_seat": "Stuttgart",
      "details": "29.04.2025 (Bekanntmachungsdatum)\n\nBaden-Württemberg Amtsgericht Stuttgart HRB 12720\nEinreichung neuer Dokumente 29.04.2025 (Eintragungsdatum)\n\nU. I. Lapp GmbH\nGesellschaft mit beschränkter Haftung\nStuttgart\n\nDie Gesellschaft hat am 29.04.2025 die Liste über die Zusammensetzung des Aufsichtsrats zum Handelsregister eingereicht."
    },
    {
      "date": "2025-04-29",
      "id": "107635",
      "original_text": "Registerbekanntmachung nach dem Umwandlungsgesetz\nBaden-Württemberg Amtsgericht Mannheim HRB 753120\nGeigenbau Hoth GmbH – Heidelberg",
      "type": "Registerbekanntmachung nach dem Umwandlungsgesetz",
      "state": "Baden-Württemberg",
      "amtsgericht": "Amtsgericht Mannheim",
      "registernummer": "HRB 753120",
      "registerart": "HRB",
      "company_name": "Geigenbau Hoth GmbH",
      "company_seat": "Heidelberg",
      "details": "29.04.2025 (Bekanntmachungsdatum)\n\nBaden-Württemberg Amtsgericht Mannheim HRB 753120\nRegisterbekanntmachung nach dem Umwandlungsgesetz 29.04.2025 (Eintragungsdatum)\n\nGeigenbau Hoth GmbH\nGesellschaft mit beschränkter Haftung\nHeidelberg\n\nDen Gläubigern der an der Ausgliederung beteiligten Rechtsträger ist, wenn sie binnen sechs Monaten nach dem Tag, an dem die Eintragung der Ausgliederung in das Register des Sitzes desjenigen Rechtsträgers, dessen Gläubiger sie sind, nach § 19 Abs. 3 UmwG als bekanntgemacht gilt, ihren Anspruch nach Grund und Höhe schriftlich anmelden, Sicherheit zu leisten, soweit sie nicht Befriedigung verlangen können. Dieses Recht steht den Gläubigern jedoch nur zu, wenn sie glaubhaft machen, dass durch die Ausgliederung die Erfüllung ihrer Forderung gefährdet wird."
    },
    {
      "date": "2025-04-29",
      "id": "107636",
      "original_text": "Löschungsankündigung\nSachsen Amtsgericht Dresden HRB 42594\nBlueStone Capital GmbH – Löbau",
      "type": "Löschungsankündigung",
      "state": "Sachsen",
      "amtsgericht": "Amtsgericht Dresden",
      "registernummer": "HRB 42594",
      "registerart": "HRB",
      "company_name": "BlueStone Capital GmbH",
      "company_seat": "Löbau",
      "details": "29.04.2025 (Bekanntmachungsdatum)\n\nSachsen Amtsgericht Dresden HRB 42594\nLöschungsankündigung\n\nBlueStone Capital GmbH\nGesellschaft mit beschränkter Haftung\nLöbau\n\nDas Registergericht beabsichtigt, die im Handelsregister eingetragene Gesellschaft von Amts wegen nach § 394 FamFG zu löschen. Die Frist zu Erhebung eines Widerspruchs gegen die beabsichtigte Löschung wird auf einen Monat festgesetzt."
    },
    {
      "date": "2025-04-29",
      "id": "107637",
      "original_text": "Löschungsankündigung\nSachsen Amtsgericht Chemnitz HRB 14227\nA. H. Theyson Aktiengesellschaft – Chemnitz",
      "type": "Löschungsankündigung",
      "state": "Sachsen",
      "amtsgericht": "Amtsgericht Chemnitz",
      "registernummer": "HRB 14227",
      "registerart": "HRB",
      "company_name": "A. H. Theyson Aktiengesellschaft",
      "company_seat": "Chemnitz",
      "details": "29.04.2025 (Bekanntmachungsdatum)\n\nSachsen Amtsgericht Chemnitz HRB 14227\nLöschungsankündigung\n\nA. H. Theyson Aktiengesellschaft\nAktiengesellschaft\nChemnitz\n\nDas Registergericht beabsichtigt, die im Handelsregister eingetragene Gesellschaft von Amts wegen nach § 394 FamFG zu löschen. Die Frist zu Erhebung eines Widerspruchs gegen die beabsichtigte Löschung wird auf einen Monat festgesetzt."
    },
    {
      "date": "2025-04-29",
      "id": "107638",
      "original_text": "Registerbekanntmachung nach dem Umwandlungsgesetz\nSachsen Amtsgericht Chemnitz HRA 10199\nFahrschule Frieder Schubert Inh. Sebastian Schubert e.K. – Glauchau",
      "type": "Registerbekanntmachung nach dem Umwandlungsgesetz",
      "state": "Sachsen",
      "amtsgericht": "Amtsgericht Chemnitz",
      "registernummer": "HRA 10199",
      "registerart": "HRA",
      "company_name": "Fahrschule Frieder Schubert Inh. Sebastian Schubert e.K.",
      "company_seat": "Glauchau",
      "details": "29.04.2025 (Bekanntmachungsdatum)\n\nSachsen Amtsgericht Chemnitz HRA 10199\nRegisterbekanntmachung nach dem Umwandlungsgesetz 29.04.2025 (Eintragungsdatum)\n\nFahrschule Frieder Schubert Inh. Sebastian Schubert e.K.\nEinzelkaufmann / Einzelkauffrau\nGlauchau\n\nDen Gläubigern der an der Ausgliederung beteiligten Rechtsträger ist, wenn sie binnen sechs Monaten nach dem Tag, an dem die Eintragung der Ausgliederung in das Register des Sitzes desjenigen Rechtsträgers, dessen Gläubiger sie sind, nach § 19 Abs. 3 UmwG als bekannt gemacht gilt, ihren Anspruch nach Grund und Höhe in Textform anmelden, Sicherheit zu leisten, soweit sie nicht Befriedigung verlangen können. Dieses Recht steht den Gläubigern jedoch nur zu, wenn sie glaubhaft machen, dass durch die Ausgliederung die Erfüllung der Forderung gefährdet wird."
    },
    {
      "date": "2025-04-29",
      "id": "107639",
      "original_text": "Registerbekanntmachung nach dem Umwandlungsgesetz\nSachsen Amtsgericht Dresden HRB 32420\nVSB Service GmbH – Dresden",
      "type": "Registerbekanntmachung nach dem Umwandlungsgesetz",
      "state": "Sachsen",
      "amtsgericht": "Amtsgericht Dresden",
      "registernummer": "HRB 32420",
      "registerart": "HRB",
      "company_name": "VSB Service GmbH",
      "company_seat": "Dresden",
      "details": "29.04.2025 (Bekanntmachungsdatum)\n\nSachsen Amtsgericht Dresden HRB 32420\nRegisterbekanntmachung nach dem Umwandlungsgesetz 29.04.2025 (Eintragungsdatum)\n\nVSB Service GmbH\nGesellschaft mit beschränkter Haftung\nDresden\n\nDen Gläubigern der an der Spaltung beteiligten Rechtsträger ist, wenn sie binnen sechs Monaten nach dem Tag, an dem die Eintragung der Spaltung in das Register des Sitzes desjenigen Rechtsträgers, dessen Gläubiger sie sind, nach § 19 Abs. 3 UmwG als bekannt gemacht gilt, ihren Anspruch nach Grund und Höhe in Textform anmelden, Sicherheit zu leisten, soweit sie nicht Befriedigung verlangen können. Dieses Recht steht den Gläubigern jedoch nur zu, wenn sie glaubhaft machen, dass durch die Spaltung die Erfüllung der Forderung gefährdet wird."
    },
    {
      "date": "2025-04-29",
      "id": "107640",
      "original_text": "Löschungsankündigung\nSachsen Amtsgericht Chemnitz HRB 10039\nWicklein Haustechnik & Bauleistung GmbH – Geyer",
      "type": "Löschungsankündigung",
      "state": "Sachsen",
      "amtsgericht": "Amtsgericht Chemnitz",
      "registernummer": "HRB 10039",
      "registerart": "HRB",
      "company_name": "Wicklein Haustechnik & Bauleistung GmbH",
      "company_seat": "Geyer",
      "details": "29.04.2025 (Bekanntmachungsdatum)\n\nSachsen Amtsgericht Chemnitz HRB 10039\nLöschungsankündigung\n\nWicklein Haustechnik & Bauleistung GmbH\nGesellschaft mit beschränkter Haftung\nGeyer\n\nDas Registergericht beabsichtigt, die im Handelsregister eingetragene Gesellschaft von Amts wegen nach § 394 FamFG zu löschen. Die Frist zu Erhebung eines Widerspruchs gegen die beabsichtigte Löschung wird auf einen Monat festgesetzt."
    },
    {
      "date": "2025-04-29",
      "id": "107641",
      "original_text": "Löschungsankündigung\nSachsen Amtsgericht Leipzig HRB 31023\nAK Estrichsysteme GmbH – Eilenburg",
      "type": "Löschungsankündigung",
      "state": "Sachsen",
      "amtsgericht": "Amtsgericht Leipzig",
      "registernummer": "HRB 31023",
      "registerart": "HRB",
      "company_name": "AK Estrichsysteme GmbH",
      "company_seat": "Eilenburg",
      "details": "29.04.2025 (Bekanntmachungsdatum)\n\nSachsen Amtsgericht Leipzig HRB 31023\nLöschungsankündigung 29.04.2025 (Eintragungsdatum)\n\nAK Estrichsysteme GmbH\nGesellschaft mit beschränkter Haftung\nEilenburg\n\nDas Registergericht beabsichtigt, die im Handelsregister eingetragene Gesellschaft von Amts wegen nach § 394 FamFG zu löschen. Die Frist zu Erhebung eines Widerspruchs gegen die beabsichtigte Löschung wird auf einen Monat festgesetzt."
    },
    {
      "date": "2025-04-29",
      "id": "107642",
      "original_text": "Löschungsankündigung\nSachsen Amtsgericht Chemnitz HRB 34812\nMerlin Consulting GmbH – Großschirma",
      "type": "Löschungsankündigung",
      "state": "Sachsen",
      "amtsgericht": "Amtsgericht Chemnitz",
      "registernummer": "HRB 34812",
      "registerart": "HRB",
      "company_name": "Merlin Consulting GmbH",
      "company_seat": "Großschirma",
      "details": "29.04.2025 (Bekanntmachungsdatum)\n\nSachsen Amtsgericht Chemnitz HRB 34812\nLöschungsankündigung\n\nMerlin Consulting GmbH\nGesellschaft mit beschränkter Haftung\nGroßschirma\n\nDas Registergericht beabsichtigt, die im Handelsregister eingetragene Gesellschaft von Amts wegen nach § 394 FamFG zu löschen. Die Frist zu Erhebung eines Widerspruchs gegen die beabsichtigte Löschung wird auf einen Monat festgesetzt."
    },
    {
      "date": "2025-04-29",
      "id": "107643",
      "original_text": "Löschungsankündigung\nSachsen Amtsgericht Chemnitz HRB 25636\nEnofloor UG (haftungsbeschränkt) – Hohenstein-Ernstthal",
      "type": "Löschungsankündigung",
      "state": "Sachsen",
      "amtsgericht": "Amtsgericht Chemnitz",
      "registernummer": "HRB 25636",
      "registerart": "HRB",
      "company_name": "Enofloor UG (haftungsbeschränkt)",
      "company_seat": "Hohenstein-Ernstthal",
      "details": "29.04.2025 (Bekanntmachungsdatum)\n\nSachsen Amtsgericht Chemnitz HRB 25636\nLöschungsankündigung\n\nEnofloor UG (haftungsbeschränkt)\nGesellschaft mit beschränkter Haftung\nHohenstein-Ernstthal\n\nDas Registergericht beabsichtigt, die im Handelsregister eingetragene Gesellschaft von Amts wegen nach § 394 FamFG zu löschen. Die Frist zu Erhebung eines Widerspruchs gegen die beabsichtigte Löschung wird auf einen Monat festgesetzt."
    },
    {
      "date": "2025-04-29",
      "id": "107644",
      "original_text": "Registerbekanntmachung nach dem Umwandlungsgesetz\nSachsen Amtsgericht Dresden HRB 45979\nVSB Mobility GmbH – Dresden",
      "type": "Registerbekanntmachung nach dem Umwandlungsgesetz",
      "state": "Sachsen",
      "amtsgericht": "Amtsgericht Dresden",
      "registernummer": "HRB 45979",
      "registerart": "HRB",
      "company_name": "VSB Mobility GmbH",
      "company_seat": "Dresden",
      "details": "29.04.2025 (Bekanntmachungsdatum)\n\nSachsen Amtsgericht Dresden HRB 45979\nRegisterbekanntmachung nach dem Umwandlungsgesetz 29.04.2025 (Eintragungsdatum)\n\nVSB Mobility GmbH\nGesellschaft mit beschränkter Haftung\nDresden\n\nDen Gläubigern der an der Spaltung beteiligten Rechtsträger ist, wenn sie binnen sechs Monaten nach dem Tag, an dem die Eintragung der Spaltung in das Register des Sitzes desjenigen Rechtsträgers, dessen Gläubiger sie sind, nach § 19 Abs. 3 UmwG als bekannt gemacht gilt, ihren Anspruch nach Grund und Höhe in Textform anmelden, Sicherheit zu leisten, soweit sie nicht Befriedigung verlangen können. Dieses Recht steht den Gläubigern jedoch nur zu, wenn sie glaubhaft machen, dass durch die Spaltung die Erfüllung der Forderung gefährdet wird."
    },
    {
      "date": "2025-04-29",
      "id": "107645",
      "original_text": "Löschungsankündigung\nNiedersachsen Amtsgericht Osnabrück HRB 217414\nTA International Trading UG (haftungsbeschränkt) – Neuenhaus",
      "type": "Löschungsankündigung",
      "state": "Niedersachsen",
      "amtsgericht": "Amtsgericht Osnabrück",
      "registernummer": "HRB 217414",
      "registerart": "HRB",
      "company_name": "TA International Trading UG (haftungsbeschränkt)",
      "company_seat": "Neuenhaus",
      "details": "29.04.2025 (Bekanntmachungsdatum)\n\nNiedersachsen Amtsgericht Osnabrück HRB 217414\nLöschungsankündigung\n\nTA International Trading UG (haftungsbeschränkt)\nGesellschaft mit beschränkter Haftung\nNeuenhaus\n\nDas Registergericht beabsichtigt, die Gesellschaft von Amts wegen nach § 394 FamFG wegen Vermögenslosigkeit zu löschen. Die Frist zur Erhebung eines Widerspruchs ist auf 1 Monat ab dieser Registerbekanntmachung festgesetzt."
    },
    {
      "date": "2025-04-29",
      "id": "107646",
      "original_text": "Registerbekanntmachung nach dem Umwandlungsgesetz\nNiedersachsen Amtsgericht Braunschweig HRB 208752\nVOLKSWAGEN CARIAD 42. Beteiligungs GmbH – Wolfsburg",
      "type": "Registerbekanntmachung nach dem Umwandlungsgesetz",
      "state": "Niedersachsen",
      "amtsgericht": "Amtsgericht Braunschweig",
      "registernummer": "HRB 208752",
      "registerart": "HRB",
      "company_name": "VOLKSWAGEN CARIAD 42. Beteiligungs GmbH",
      "company_seat": "Wolfsburg",
      "details": "29.04.2025 (Bekanntmachungsdatum)\n\nNiedersachsen Amtsgericht Braunschweig HRB 208752\nRegisterbekanntmachung nach dem Umwandlungsgesetz 29.04.2025 (Eintragungsdatum)\n\nVOLKSWAGEN CARIAD 42. Beteiligungs GmbH\nGesellschaft mit beschränkter Haftung\nWolfsburg\n\nDen Gläubigern der an der Verschmelzung beteiligten Rechtsträger ist, wenn sie binnen sechs Monaten nach dem Tag, an dem die Eintragung der Verschmelzung in das Register des Sitzes desjenigen Rechtsträgers, dessen Gläubiger sie sind, nach § 19  Abs.  3 UmwG als bekannt gemacht gilt, ihren Anspruch nach Grund und Höhe schriftlich anmelden, Sicherheit zu leisten, soweit sie nicht Befriedigung verlangen können. Dieses Recht steht den Gläubigern jedoch nur zu, wenn sie glaubhaft machen, dass durch die Verschmelzung die Erfüllung der Forderung gefährdet wird."
    },
    {
      "date": "2025-04-29",
      "id": "107647",
      "original_text": "Registerbekanntmachung nach dem Umwandlungsgesetz\nNiedersachsen Amtsgericht Walsrode HRB 204904\nDennis Eggers GmbH – Rotenburg (Wümme)",
      "type": "Registerbekanntmachung nach dem Umwandlungsgesetz",
      "state": "Niedersachsen",
      "amtsgericht": "Amtsgericht Walsrode",
      "registernummer": "HRB 204904",
      "registerart": "HRB",
      "company_name": "Dennis Eggers GmbH",
      "company_seat": "Rotenburg (Wümme)",
      "details": "29.04.2025 (Bekanntmachungsdatum)\n\nNiedersachsen Amtsgericht Walsrode HRB 204904\nRegisterbekanntmachung nach dem Umwandlungsgesetz 29.04.2025 (Eintragungsdatum)\n\nDennis Eggers GmbH\nGesellschaft mit beschränkter Haftung\nRotenburg (Wümme)\n\nDen Gläubigern der an der Ausgliederung beteiligten Rechtsträger ist, wenn sie binnen sechs Monaten nach dem Tag, an dem die Eintragung der Ausgliederung in das Register des Sitzes desjenigen Rechtsträgers, dessen Gläubiger sie sind, nach § 19 Abs. 3 UmwG als bekannt gemacht gilt, ihren Anspruch nach Grund und Höhe schriftlich anmelden, Sicherheit zu leisten, soweit sie nicht Befriedigung verlangen können. Dieses Recht steht den Gläubigern jedoch nur zu, wenn sie glaubhaft machen, dass durch die Ausgliederung die Erfüllung der Forderung gefährdet wird."
    },
    {
      "date": "2025-04-29",
      "id": "107648",
      "original_text": "Registerbekanntmachung nach dem Umwandlungsgesetz\nNiedersachsen Amtsgericht Braunschweig HRB 208203\nCARIAD SE – Wolfsburg",
      "type": "Registerbekanntmachung nach dem Umwandlungsgesetz",
      "state": "Niedersachsen",
      "amtsgericht": "Amtsgericht Braunschweig",
      "registernummer": "HRB 208203",
      "registerart": "HRB",
      "company_name": "CARIAD SE",
      "company_seat": "Wolfsburg",
      "details": "29.04.2025 (Bekanntmachungsdatum)\n\nNiedersachsen Amtsgericht Braunschweig HRB 208203\nRegisterbekanntmachung nach dem Umwandlungsgesetz 29.04.2025 (Eintragungsdatum)\n\nCARIAD SE\nEuropäische Aktiengesellschaft (SE)\nWolfsburg\n\nDen Gläubigern der an der Verschmelzung beteiligten Rechtsträger ist, wenn sie binnen sechs Monaten nach dem Tag, an dem die Eintragung der Verschmelzung in das Register des Sitzes desjenigen Rechtsträgers, dessen Gläubiger sie sind, nach § 19  Abs.  3 UmwG als bekannt gemacht gilt, ihren Anspruch nach Grund und Höhe schriftlich anmelden, Sicherheit zu leisten, soweit sie nicht Befriedigung verlangen können. Dieses Recht steht den Gläubigern jedoch nur zu, wenn sie glaubhaft machen, dass durch die Verschmelzung die Erfüllung der Forderung gefährdet wird."
    },
    {
      "date": "2025-04-29",
      "id": "107649",
      "original_text": "Löschungsankündigung\nNiedersachsen Amtsgericht Hildesheim HRB 207340\nPhotonkraft GmbH – Sarstedt",
      "type": "Löschungsankündigung",
      "state": "Niedersachsen",
      "amtsgericht": "Amtsgericht Hildesheim",
      "registernummer": "HRB 207340",
      "registerart": "HRB",
      "company_name": "Photonkraft GmbH",
      "company_seat": "Sarstedt",
      "details": "29.04.2025 (Bekanntmachungsdatum)\n\nNiedersachsen Amtsgericht Hildesheim HRB 207340\nLöschungsankündigung\n\nPhotonkraft GmbH\nGesellschaft mit beschränkter Haftung\nSarstedt\n\nDas Registergericht beabsichtigt, die Gesellschaft von Amts wegen nach § 394 FamFG zu löschen. Die Frist zur Erhebung eines Widerspruchs ist auf 1 Monat ab dieser Registerbekanntmachung festgesetzt."
    },
    {
      "date": "2025-04-29",
      "id": "107650",
      "original_text": "Registerbekanntmachung nach dem Umwandlungsgesetz\nNiedersachsen Amtsgericht Walsrode HRA 205610\nWSD Gebäudetrocknung GmbH & Co. KG – Rotenburg",
      "type": "Registerbekanntmachung nach dem Umwandlungsgesetz",
      "state": "Niedersachsen",
      "amtsgericht": "Amtsgericht Walsrode",
      "registernummer": "HRA 205610",
      "registerart": "HRA",
      "company_name": "WSD Gebäudetrocknung GmbH & Co. KG",
      "company_seat": "Rotenburg",
      "details": "29.04.2025 (Bekanntmachungsdatum)\n\nNiedersachsen Amtsgericht Walsrode HRA 205610\nRegisterbekanntmachung nach dem Umwandlungsgesetz 29.04.2025 (Eintragungsdatum)\n\nWSD Gebäudetrocknung GmbH & Co. KG\nKommanditgesellschaft\nRotenburg\n\nDen Gläubigern der an der Ausgliederung beteiligten Rechtsträger ist, wenn sie binnen sechs Monaten nach dem Tag, an dem die Eintragung der Ausgliederung in das Register des Sitzes desjenigen Rechtsträgers, dessen Gläubiger sie sind, nach § 19 Abs. 3 UmwG als bekannt gemacht gilt, ihren Anspruch nach Grund und Höhe schriftlich anmelden, Sicherheit zu leisten, soweit sie nicht Befriedigung verlangen können. Dieses Recht steht den Gläubigern jedoch nur zu, wenn sie glaubhaft machen, dass durch die Ausgliederung die Erfüllung der Forderung gefährdet wird."
    },
    {
      "date": "2025-04-29",
      "id": "107651",
      "original_text": "Löschungsankündigung\nNiedersachsen Amtsgericht Aurich HRA 1892\nPoly-Beek Kunststoffe GmbH & Co. KG – Großefehn",
      "type": "Löschungsankündigung",
      "state": "Niedersachsen",
      "amtsgericht": "Amtsgericht Aurich",
      "registernummer": "HRA 1892",
      "registerart": "HRA",
      "company_name": "Poly-Beek Kunststoffe GmbH & Co. KG",
      "company_seat": "Großefehn",
      "details": "29.04.2025 (Bekanntmachungsdatum)\n\nNiedersachsen Amtsgericht Aurich HRA 1892\nLöschungsankündigung\n\nPoly-Beek Kunststoffe GmbH & Co. KG\nKommanditgesellschaft\nGroßefehn\n\nDas Registergericht beabsichtigt, die Firma von Amts wegen nach § 394 FamFG zu löschen. Die Frist zur Erhebung eines Widerspruchs ist auf 1 Monat ab dieser Registerbekanntmachung festgesetzt."
    },
    {
      "date": "2025-04-29",
      "id": "107652",
      "original_text": "Löschungsankündigung\nNiedersachsen Amtsgericht Hildesheim HRB 206826\ntecodrive GmbH – Gronau",
      "type": "Löschungsankündigung",
      "state": "Niedersachsen",
      "amtsgericht": "Amtsgericht Hildesheim",
      "registernummer": "HRB 206826",
      "registerart": "HRB",
      "company_name": "tecodrive GmbH",
      "company_seat": "Gronau",
      "details": "29.04.2025 (Bekanntmachungsdatum)\n\nNiedersachsen Amtsgericht Hildesheim HRB 206826\nLöschungsankündigung 29.04.2025 (Eintragungsdatum)\n\ntecodrive GmbH\nGesellschaft mit beschränkter Haftung\nGronau\n\nDas Registergericht beabsichtigt, die Gesellschaft von Amts wegen nach § 394 FamFG zu löschen. Die Frist zur Erhebung eines Widerspruchs ist auf 1 Monat ab dieser Registerbekanntmachung festgesetzt."
    },
    {
      "date": "2025-04-29",
      "id": "107653",
      "original_text": "Löschungsankündigung\nNiedersachsen Amtsgericht Aurich HRB 205259\nNordhaus Holding Unternehmergesellschaft (haftungsbeschränkt) – Upgant-Schott",
      "type": "Löschungsankündigung",
      "state": "Niedersachsen",
      "amtsgericht": "Amtsgericht Aurich",
      "registernummer": "HRB 205259",
      "registerart": "HRB",
      "company_name": "Nordhaus Holding Unternehmergesellschaft (haftungsbeschränkt)",
      "company_seat": "Upgant-Schott",
      "details": "29.04.2025 (Bekanntmachungsdatum)\n\nNiedersachsen Amtsgericht Aurich HRB 205259\nLöschungsankündigung 29.04.2025 (Eintragungsdatum)\n\nNordhaus Holding Unternehmergesellschaft (haftungsbeschränkt)\nGesellschaft mit beschränkter Haftung\nUpgant-Schott\n\nDas Registergericht beabsichtigt, die Gesellschaft von Amts wegen nach § 394 FamFG zu löschen. Die Frist zur Erhebung eines Widerspruchs ist auf 1 Monat ab dieser Registerbekanntmachung festgesetzt."
    },
    {
      "date": "2025-04-29",
      "id": "107654",
      "original_text": "Registerbekanntmachung nach dem Umwandlungsgesetz\nNiedersachsen Amtsgericht Walsrode HRA 205608\nWSD Sanierungsservice GmbH & Co. KG – Rotenburg",
      "type": "Registerbekanntmachung nach dem Umwandlungsgesetz",
      "state": "Niedersachsen",
      "amtsgericht": "Amtsgericht Walsrode",
      "registernummer": "HRA 205608",
      "registerart": "HRA",
      "company_name": "WSD Sanierungsservice GmbH & Co. KG",
      "company_seat": "Rotenburg",
      "details": "29.04.2025 (Bekanntmachungsdatum)\n\nNiedersachsen Amtsgericht Walsrode HRA 205608\nRegisterbekanntmachung nach dem Umwandlungsgesetz 29.04.2025 (Eintragungsdatum)\n\nWSD Sanierungsservice GmbH & Co. KG\nKommanditgesellschaft\nRotenburg\n\nDen Gläubigern der an der Ausgliederung beteiligten Rechtsträger ist, wenn sie binnen sechs Monaten nach dem Tag, an dem die Eintragung der Ausgliederung in das Register des Sitzes desjenigen Rechtsträgers, dessen Gläubiger sie sind, nach § 19 Abs. 3 UmwG als bekannt gemacht gilt, ihren Anspruch nach Grund und Höhe schriftlich anmelden, Sicherheit zu leisten, soweit sie nicht Befriedigung verlangen können. Dieses Recht steht den Gläubigern jedoch nur zu, wenn sie glaubhaft machen, dass durch die Ausgliederung die Erfüllung der Forderung gefährdet wird."
    },
    {
      "date": "2025-04-29",
      "id": "107655",
      "original_text": "Registerbekanntmachung nach dem Umwandlungsgesetz\nNiedersachsen Amtsgericht Walsrode HRB 204904\nDennis Eggers GmbH – Rotenburg (Wümme)",
      "type": "Registerbekanntmachung nach dem Umwandlungsgesetz",
      "state": "Niedersachsen",
      "amtsgericht": "Amtsgericht Walsrode",
      "registernummer": "HRB 204904",
      "registerart": "HRB",
      "company_name": "Dennis Eggers GmbH",
      "company_seat": "Rotenburg (Wümme)",
      "details": "29.04.2025 (Bekanntmachungsdatum)\n\nNiedersachsen Amtsgericht Walsrode HRB 204904\nRegisterbekanntmachung nach dem Umwandlungsgesetz 29.04.2025 (Eintragungsdatum)\n\nDennis Eggers GmbH\nGesellschaft mit beschränkter Haftung\nRotenburg (Wümme)\n\nDen Gläubigern der an der Ausgliederung beteiligten Rechtsträger ist, wenn sie binnen sechs Monaten nach dem Tag, an dem die Eintragung der Ausgliederung in das Register des Sitzes desjenigen Rechtsträgers, dessen Gläubiger sie sind, nach § 19 Abs. 3 UmwG als bekannt gemacht gilt, ihren Anspruch nach Grund und Höhe schriftlich anmelden, Sicherheit zu leisten, soweit sie nicht Befriedigung verlangen können. Dieses Recht steht den Gläubigern jedoch nur zu, wenn sie glaubhaft machen, dass durch die Ausgliederung die Erfüllung der Forderung gefährdet wird."
    },
    {
      "date": "2025-04-29",
      "id": "107656",
      "original_text": "Registerbekanntmachung nach dem Umwandlungsgesetz\nBremen Amtsgericht Bremen HRB 12538\nGöken, Pollak und Partner Treuhandgesellschaft mbH Wirtschaftsprüfungsgesellschaft/Steuerberatungsgesellschaft – Bremen",
      "type": "Registerbekanntmachung nach dem Umwandlungsgesetz",
      "state": "Bremen",
      "amtsgericht": "Amtsgericht Bremen",
      "registernummer": "HRB 12538",
      "registerart": "HRB",
      "company_name": "Göken, Pollak und Partner Treuhandgesellschaft mbH Wirtschaftsprüfungsgesellschaft/Steuerberatungsgesellschaft",
      "company_seat": "Bremen",
      "details": "29.04.2025 (Bekanntmachungsdatum)\n\nBremen Amtsgericht Bremen HRB 12538\nRegisterbekanntmachung nach dem Umwandlungsgesetz 28.04.2025 (Eintragungsdatum)\n\nGöken, Pollak und Partner Treuhandgesellschaft mbH Wirtschaftsprüfungsgesellschaft/Steuerberatungsgesellschaft\nGesellschaft mit beschränkter Haftung\nBremen\n\nZu Eintragungsnummer 33 vom 28.04.2025 wird als nicht eingetragen veröffentlicht:  Den Gläubigern der an der Verschmelzung beteiligten Rechtsträger ist, wenn sie binnen sechs Monaten nach dem Tag, an dem die Eintragung der Verschmelzung in das Register des Sitzes desjenigen Rechtsträgers, dessen Gläubiger sie sind, als bekannt gemacht gilt, ihren Anspruch nach Grund und Höhe schriftlich anmelden, Sicherheit zu leisten, soweit sie nicht Befriedigung verlangen können. Dieses Recht steht den Gläubigern jedoch nur zu, wenn sie glaubhaft machen, dass durch die Verschmelzung die Erfüllung ihrer Forderung gefährdet wird. Das Recht, Sicherheitsleistung zu verlangen, steht Gläubigern nicht zu, die im Falle der Insolvenz ein Recht auf vorzugsweise Befriedigung aus einer Deckungsmasse haben, die nach gesetzlicher Vorschrift zu ihrem Schutz errichtet und staatlich überwacht ist."
    },
    {
      "date": "2025-04-29",
      "id": "107657",
      "original_text": "Registerbekanntmachung nach dem Umwandlungsgesetz\nBremen Amtsgericht Bremen HRB 40454\nZüblin Chimney and Refractory GmbH – Bremen",
      "type": "Registerbekanntmachung nach dem Umwandlungsgesetz",
      "state": "Bremen",
      "amtsgericht": "Amtsgericht Bremen",
      "registernummer": "HRB 40454",
      "registerart": "HRB",
      "company_name": "Züblin Chimney and Refractory GmbH",
      "company_seat": "Bremen",
      "details": "29.04.2025 (Bekanntmachungsdatum)\n\nBremen Amtsgericht Bremen HRB 40454\nRegisterbekanntmachung nach dem Umwandlungsgesetz 25.04.2025 (Eintragungsdatum)\n\nZüblin Chimney and Refractory GmbH\nGesellschaft mit beschränkter Haftung\nBremen\n\nZu Nummer 5 vom 25.04.2025 wird als nicht eingetragen veröffentlicht: Gläubigern, deren Forderungen begründet worden sind, bevor die Eintragung des Beschlusses als nach § 10 des Handelsgesetzbuches bekannt gemacht gilt, ist, wenn sie sich binnen sechs Monaten nach der Bekanntmachung zu diesem Zweck melden, Sicherheit zu leisten, soweit sie nicht Befriedigung verlangen können. Dieses Recht steht den Gläubigern nicht zu, die im Fall des Insolvenzverfahrens ein Recht auf vorzugsweise Befriedigung aus der Deckungsmasse haben, die nach gesetzlicher Vorschrift zu ihrem Schutz errichtet und staatlich überwacht ist."
    },
    {
      "date": "2025-04-29",
      "id": "107658",
      "original_text": "Einreichung neuer Dokumente\nRheinland-Pfalz Amtsgericht Mainz HRB 51099\nSCHOTT Pharma Management AG – Mainz",
      "type": "Einreichung neuer Dokumente",
      "state": "Rheinland-Pfalz",
      "amtsgericht": "Amtsgericht Mainz",
      "registernummer": "HRB 51099",
      "registerart": "HRB",
      "company_name": "SCHOTT Pharma Management AG",
      "company_seat": "Mainz",
      "details": "29.04.2025 (Bekanntmachungsdatum)\n\nRheinland-Pfalz Amtsgericht Mainz HRB 51099\nEinreichung neuer Dokumente\n\nSCHOTT Pharma Management AG\nAktiengesellschaft\nMainz\n\nDem Registergericht ist eine neue Liste der Mitglieder des Aufsichtsrates eingereicht worden."
    },
    {
      "date": "2025-04-29",
      "id": "107659",
      "original_text": "Löschungsankündigung\nRheinland-Pfalz Amtsgericht Ludwigshafen a.Rhein (Ludwigshafen) HRB 66696\nLa Coco meets Haarchitekt UG (haftungsbeschränkt) – Frankenthal (Pfalz)",
      "type": "Löschungsankündigung",
      "state": "Rheinland-Pfalz",
      "amtsgericht": "Amtsgericht Ludwigshafen a.Rhein (Ludwigshafen)",
      "registernummer": "HRB 66696",
      "registerart": "HRB",
      "company_name": "La Coco meets Haarchitekt UG (haftungsbeschränkt)",
      "company_seat": "Frankenthal (Pfalz)",
      "details": "29.04.2025 (Bekanntmachungsdatum)\n\nRheinland-Pfalz Amtsgericht Ludwigshafen a.Rhein (Ludwigshafen) HRB 66696\nLöschungsankündigung\n\nLa Coco meets Haarchitekt UG (haftungsbeschränkt)\nGesellschaft mit beschränkter Haftung\nFrankenthal (Pfalz)\n\nDas Registergericht beabsichtigt die Gesellschaft von Amts wegen nach § 394 FamFG zu löschen. Die Frist zur Erhebung eines Widerspruchs ist auf einen Monat festgesetzt."
    },
    {
      "date": "2025-04-29",
      "id": "107660",
      "original_text": "Registerbekanntmachung nach dem Umwandlungsgesetz\nRheinland-Pfalz Amtsgericht Mainz HRB 8555\nSCHOTT AG – Mainz;",
      "type": "Registerbekanntmachung nach dem Umwandlungsgesetz",
      "state": "Rheinland-Pfalz",
      "amtsgericht": "Amtsgericht Mainz",
      "registernummer": "HRB 8555",
      "registerart": "HRB",
      "company_name": "SCHOTT AG",
      "company_seat": "Mainz;",
      "details": "29.04.2025 (Bekanntmachungsdatum)\n\nRheinland-Pfalz Amtsgericht Mainz HRB 8555\nRegisterbekanntmachung nach dem Umwandlungsgesetz 29.04.2025 (Eintragungsdatum)\n\nSCHOTT AG\nAktiengesellschaft\nMainz;\n\nAls nicht eingetragen wird veröffentlicht: Den Gläubigern der an der Verschmelzung beteiligten Rechtsträger ist, wenn sie binnen sechs Monaten nach dem Tag, an dem die Eintragung der Verschmelzung in das Register des Sitzes desjenigen Rechtsträgers, dessen Gläubiger sie sind, nach § 19 Abs. 3 UmwG als bekannt gemacht gilt, ihren Anspruch nach Grund und Höhe schriftlich anmelden, Sicherheit zu leisten, soweit sie nicht Befriedigung verlangen können. Dieses Recht steht den Gläubigern jedoch nur zu, wenn sie glaubhaft machen, dass durch die Verschmelzung die Erfüllung der Forderung gefährdet wird."
    },
    {
      "date": "2025-04-29",
      "id": "107661",
      "original_text": "Registerbekanntmachung nach dem Umwandlungsgesetz\nRheinland-Pfalz Amtsgericht Mainz HRB 46339\nSCHOTT Finanzierungs- und Verwaltungs GmbH – Mainz",
      "type": "Registerbekanntmachung nach dem Umwandlungsgesetz",
      "state": "Rheinland-Pfalz",
      "amtsgericht": "Amtsgericht Mainz",
      "registernummer": "HRB 46339",
      "registerart": "HRB",
      "company_name": "SCHOTT Finanzierungs- und Verwaltungs GmbH",
      "company_seat": "Mainz",
      "details": "29.04.2025 (Bekanntmachungsdatum)\n\nRheinland-Pfalz Amtsgericht Mainz HRB 46339\nRegisterbekanntmachung nach dem Umwandlungsgesetz 29.04.2025 (Eintragungsdatum)\n\nSCHOTT Finanzierungs- und Verwaltungs GmbH\nGesellschaft mit beschränkter Haftung\nMainz\n\nAls nicht eingetragen wird veröffentlicht: Den Gläubigern der an der Verschmelzung beteiligten Rechtsträger ist, wenn sie binnen sechs Monaten nach dem Tag, an dem die Eintragung der Verschmelzung in das Register des Sitzes desjenigen Rechtsträgers, dessen Gläubiger sie sind, nach § 19 Abs. 3 UmwG als bekannt gemacht gilt, ihren Anspruch nach Grund und Höhe schriftlich anmelden, Sicherheit zu leisten, soweit sie nicht Befriedigung verlangen können. Dieses Recht steht den Gläubigern jedoch nur zu, wenn sie glaubhaft machen, dass durch die Verschmelzung die Erfüllung der Forderung gefährdet wird."
    },
    {
      "date": "2025-04-29",
      "id": "107662",
      "original_text": "Registerbekanntmachung nach dem Umwandlungsgesetz\nNordrhein-Westfalen Amtsgericht Düren HRB 2585\nSFE Group GmbH – Düren",
      "type": "Registerbekanntmachung nach dem Umwandlungsgesetz",
      "state": "Nordrhein-Westfalen",
      "amtsgericht": "Amtsgericht Düren",
      "registernummer": "HRB 2585",
      "registerart": "HRB",
      "company_name": "SFE Group GmbH",
      "company_seat": "Düren",
      "details": "29.04.2025 (Bekanntmachungsdatum)\n\nNordrhein-Westfalen Amtsgericht Düren HRB 2585\nRegisterbekanntmachung nach dem Umwandlungsgesetz 28.04.2025 (Eintragungsdatum)\n\nSFE Group GmbH\nGesellschaft mit beschränkter Haftung\nDüren\n\nDen Gläubigern der an der Verschmelzung beteiligten Rechtsträger ist, wenn sie binnen sechs Monaten nach dem Tag, an dem die Eintragung der Verschmelzung in das Register des Sitzes desjenigen Rechtsträgers, dessen Gläubiger sie sind, nach § 19 Absatz 3 UmwG als bekanntgemacht gilt, ihren Anspruch nach Grund und Höhe schriftlich anmelden, Sicherheit zu leisten, soweit sie nicht Befriedigung verlangen können. Dieses Recht steht den Gläubigern jedoch nur zu, wenn sie glaubhaft machen, dass durch die Verschmelzung die Erfüllung ihrer Forderung gefährdet wird."
    },
    {
      "date": "2025-04-29",
      "id": "107663",
      "original_text": "Löschungsankündigung\nNordrhein-Westfalen Amtsgericht Krefeld HRB 18726\nAutohaus Trienes GmbH – Nettetal",
      "type": "Löschungsankündigung",
      "state": "Nordrhein-Westfalen",
      "amtsgericht": "Amtsgericht Krefeld",
      "registernummer": "HRB 18726",
      "registerart": "HRB",
      "company_name": "Autohaus Trienes GmbH",
      "company_seat": "Nettetal",
      "details": "29.04.2025 (Bekanntmachungsdatum)\n\nNordrhein-Westfalen Amtsgericht Krefeld HRB 18726\nLöschungsankündigung\n\nAutohaus Trienes GmbH\nGesellschaft mit beschränkter Haftung\nNettetal\n\nDas Registergericht beabsichtigt die Gesellschaft von Amts wegen nach § 394 FamFG zu löschen. Die Frist zur Erhebung eines Widerspruchs ist auf einen Monat festgesetzt."
    },
    {
      "date": "2025-04-29",
      "id": "107664",
      "original_text": "Registerbekanntmachung nach dem Umwandlungsgesetz\nNordrhein-Westfalen Amtsgericht Duisburg HRA 13646\nWerbeartikel Yeni e.K. – Duisburg",
      "type": "Registerbekanntmachung nach dem Umwandlungsgesetz",
      "state": "Nordrhein-Westfalen",
      "amtsgericht": "Amtsgericht Duisburg",
      "registernummer": "HRA 13646",
      "registerart": "HRA",
      "company_name": "Werbeartikel Yeni e.K.",
      "company_seat": "Duisburg",
      "details": "29.04.2025 (Bekanntmachungsdatum)\n\nNordrhein-Westfalen Amtsgericht Duisburg HRA 13646\nRegisterbekanntmachung nach dem Umwandlungsgesetz 29.04.2025 (Eintragungsdatum)\n\nWerbeartikel Yeni e.K.\nEinzelkaufmann / Einzelkauffrau\nDuisburg\n\nDie Gesellschaft hat Gläubigern, deren Forderungen vor dieser Bekanntmachung begründet worden sind, Sicherheit zu leisten, soweit sie nicht Befriedigung verlangen können, wenn sie sich binnen sechs Monaten zu diesem Zweck melden."
    },
    {
      "date": "2025-04-29",
      "id": "107665",
      "original_text": "Löschungsankündigung\nNordrhein-Westfalen Amtsgericht Krefeld HRB 15744\nKR Passbild am Amt UG (haftungsbeschränkt) – Krefeld",
      "type": "Löschungsankündigung",
      "state": "Nordrhein-Westfalen",
      "amtsgericht": "Amtsgericht Krefeld",
      "registernummer": "HRB 15744",
      "registerart": "HRB",
      "company_name": "KR Passbild am Amt UG (haftungsbeschränkt)",
      "company_seat": "Krefeld",
      "details": "29.04.2025 (Bekanntmachungsdatum)\n\nNordrhein-Westfalen Amtsgericht Krefeld HRB 15744\nLöschungsankündigung\n\nKR Passbild am Amt UG (haftungsbeschränkt)\nGesellschaft mit beschränkter Haftung\nKrefeld\n\nDas Registergericht beabsichtigt die Gesellschaft von Amts wegen nach § 394 FamFG zu löschen. Die Frist zur Erhebung eines Widerspruchs ist auf einen Monat festgesetzt."
    },
    {
      "date": "2025-04-29",
      "id": "107666",
      "original_text": "Löschungsankündigung\nNordrhein-Westfalen Amtsgericht Krefeld HRB 17983\nHotel Brüggen Verwaltungs GmbH – Willich",
      "type": "Löschungsankündigung",
      "state": "Nordrhein-Westfalen",
      "amtsgericht": "Amtsgericht Krefeld",
      "registernummer": "HRB 17983",
      "registerart": "HRB",
      "company_name": "Hotel Brüggen Verwaltungs GmbH",
      "company_seat": "Willich",
      "details": "29.04.2025 (Bekanntmachungsdatum)\n\nNordrhein-Westfalen Amtsgericht Krefeld HRB 17983\nLöschungsankündigung\n\nHotel Brüggen Verwaltungs GmbH\nGesellschaft mit beschränkter Haftung\nWillich\n\nDas Registergericht beabsichtigt die Gesellschaft von Amts wegen nach § 394 FamFG zu löschen. Die Frist zur Erhebung eines Widerspruchs ist auf einen Monat festgesetzt."
    },
    {
      "date": "2025-04-29",
      "id": "107667",
      "original_text": "Registerbekanntmachung nach dem Umwandlungsgesetz\nNordrhein-Westfalen Amtsgericht Münster HRB 14441\nAloco MPC Verwaltungs GmbH – Ahlen",
      "type": "Registerbekanntmachung nach dem Umwandlungsgesetz",
      "state": "Nordrhein-Westfalen",
      "amtsgericht": "Amtsgericht Münster",
      "registernummer": "HRB 14441",
      "registerart": "HRB",
      "company_name": "Aloco MPC Verwaltungs GmbH",
      "company_seat": "Ahlen",
      "details": "29.04.2025 (Bekanntmachungsdatum)\n\nNordrhein-Westfalen Amtsgericht Münster HRB 14441\nRegisterbekanntmachung nach dem Umwandlungsgesetz 29.04.2025 (Eintragungsdatum)\n\nAloco MPC Verwaltungs GmbH\nGesellschaft mit beschränkter Haftung\nAhlen\n\nDen Gläubigern der an der Verschmelzung beteiligten Rechtsträger ist, wenn sie binnen sechs Monaten nach dem Tag, an dem die Eintragung der Verschmelzung in das Register des Sitzes desjenigen Rechtsträgers, dessen Gläubiger sie sind, nach § 19 Absatz 3 UmwG als bekanntgemacht gilt, ihren Anspruch nach Grund und Höhe schriftlich anmelden, Sicherheit zu leisten, soweit sie nicht Befriedigung verlangen können. Dieses Recht steht den Gläubigern jedoch nur zu, wenn sie glaubhaft machen, dass durch die Verschmelzung die Erfüllung ihrer Forderung gefährdet wird."
    },
    {
      "date": "2025-04-29",
      "id": "107668",
      "original_text": "Registerbekanntmachung nach dem Umwandlungsgesetz\nNordrhein-Westfalen Amtsgericht Duisburg HRB 31001\nAntares Gifts GmbH – Duisburg",
      "type": "Registerbekanntmachung nach dem Umwandlungsgesetz",
      "state": "Nordrhein-Westfalen",
      "amtsgericht": "Amtsgericht Duisburg",
      "registernummer": "HRB 31001",
      "registerart": "HRB",
      "company_name": "Antares Gifts GmbH",
      "company_seat": "Duisburg",
      "details": "29.04.2025 (Bekanntmachungsdatum)\n\nNordrhein-Westfalen Amtsgericht Duisburg HRB 31001\nRegisterbekanntmachung nach dem Umwandlungsgesetz 29.04.2025 (Eintragungsdatum)\n\nAntares Gifts GmbH\nGesellschaft mit beschränkter Haftung\nDuisburg\n\nDie Gesellschaft hat Gläubigern, deren Forderungen vor dieser Bekanntmachung begründet worden sind, Sicherheit zu leisten, soweit sie nicht Befriedigung verlangen können, wenn sie sich binnen sechs Monaten zu diesem Zweck melden."
    },
    {
      "date": "2025-04-29",
      "id": "107669",
      "original_text": "Löschungsankündigung\nNordrhein-Westfalen Amtsgericht Düsseldorf HRB 95071\nGS-Bau GmbH – Düsseldorf",
      "type": "Löschungsankündigung",
      "state": "Nordrhein-Westfalen",
      "amtsgericht": "Amtsgericht Düsseldorf",
      "registernummer": "HRB 95071",
      "registerart": "HRB",
      "company_name": "GS-Bau GmbH",
      "company_seat": "Düsseldorf",
      "details": "29.04.2025 (Bekanntmachungsdatum)\n\nNordrhein-Westfalen Amtsgericht Düsseldorf HRB 95071\nLöschungsankündigung\n\nGS-Bau GmbH\nGesellschaft mit beschränkter Haftung\nDüsseldorf\n\nDas Registergericht beabsichtigt die Gesellschaft von Amts wegen nach § 394 FamFG zu löschen. Die Frist zur Erhebung eines Widerspruchs ist auf 3 Wochen festgesetzt.\n\nRechtsbehelfsbelehrung:\nDas Widerspruchsrecht steht jedem zu, der an der Unterlassung der Löschung ein berechtigtes Interesse hat. Der Widerspruch ist bei dem Amtsgericht Düsseldorf -Registergericht-, Werdener Straße 1, 40227 Düsseldorf schriftlich in deutscher Sprache oder zur Niederschrift der Geschäftsstelle einzulegen. Der Widerspruch kann auch zur Niederschrift der Geschäftsstelle eines jeden Amtsgerichtes abgegeben werden. Die Einlegung ist auch durch Übertragung eines elektronischen Dokuments an die elektronische Poststelle des Gerichts möglich. Das elektronische Dokument muss für die Bearbeitung durch das Gericht geeignet und mit einer qualifizierten elektronischen Signatur der verantwortenden Person versehen sein oder von der verantwortenden Person signiert und auf einem sicheren Übermittlungsweg gemäß § 130a ZPO nach näherer Maßgabe der Verordnung über die technischen Rahmenbedingungen des elektronischen Rechtsverkehrs und über das besondere elektronische Behördenpostfach (BGBl. I, S.3803) eingereicht werden. Weitere Informationen erhalten Sie auf der Internetseite www.justiz.de.\nDer Widerspruch muss spätestens innerhalb der gesetzten Frist nach dem Datum der Bekanntmachung der Löschungsankündigung bei dem Amtsgericht - Registergericht - Düsseldorf eingegangen sein.  Dies gilt auch dann, wenn der Widerspruch zur Niederschrift der Geschäftsstelle eines anderen Amtsgerichtes abgegeben wurde. Die Frist beginnt mit dem Tage der Bekanntmachung der Löschungsankündigung in dem für die Bekanntmachung der Eintragungen in das Handelsregister bestimmten elektronischen Informations- und Kommunikationssystem nach § 10 des Handelsgesetzbuches. Fällt das Ende der Frist auf einen Sonntag, einen allgemeinen Feiertag oder Sonnabend, so endet die Frist mit Ablauf des nächsten Werktages.\nDer Widerspruch muss die Bezeichnung der angefochtenen Löschungsankündigung sowie die Erklärung enthalten, dass Widerspruch gegen diese Löschungsankündigung eingelegt wird. Er ist zu unterzeichnen und soll begründet werden."
    },
    {
      "date": "2025-04-29",
      "id": "107670",
      "original_text": "Einreichung neuer Dokumente\nNordrhein-Westfalen Amtsgericht Düsseldorf HRB 91139\nThe Platform Group AG – Düsseldorf",
      "type": "Einreichung neuer Dokumente",
      "state": "Nordrhein-Westfalen",
      "amtsgericht": "Amtsgericht Düsseldorf",
      "registernummer": "HRB 91139",
      "registerart": "HRB",
      "company_name": "The Platform Group AG",
      "company_seat": "Düsseldorf",
      "details": "29.04.2025 (Bekanntmachungsdatum)\n\nNordrhein-Westfalen Amtsgericht Düsseldorf HRB 91139\nEinreichung neuer Dokumente\n\nThe Platform Group AG\nAktiengesellschaft\nDüsseldorf\n\nDem Registergericht ist eine Liste der Mitglieder des Aufsichtsrates eingereicht worden."
    },
    {
      "date": "2025-04-29",
      "id": "107671",
      "original_text": "Löschungsankündigung\nNordrhein-Westfalen Amtsgericht Kleve HRB 17578\nMusclecar UG (haftungsbeschränkt) – Kleve",
      "type": "Löschungsankündigung",
      "state": "Nordrhein-Westfalen",
      "amtsgericht": "Amtsgericht Kleve",
      "registernummer": "HRB 17578",
      "registerart": "HRB",
      "company_name": "Musclecar UG (haftungsbeschränkt)",
      "company_seat": "Kleve",
      "details": "29.04.2025 (Bekanntmachungsdatum)\n\nNordrhein-Westfalen Amtsgericht Kleve HRB 17578\nLöschungsankündigung\n\nMusclecar UG (haftungsbeschränkt)\nGesellschaft mit beschränkter Haftung\nKleve\n\nDas Registergericht beabsichtigt die Gesellschaft von Amts wegen nach § 394 FamFG zu löschen. Die Frist zur Erhebung eines Widerspruchs ist auf einen Monat festgesetzt."
    },
    {
      "date": "2025-04-29",
      "id": "107672",
      "original_text": "Löschungsankündigung\nNordrhein-Westfalen Amtsgericht Köln HRB 101766\nBIS NUTS GmbH – Köln",
      "type": "Löschungsankündigung",
      "state": "Nordrhein-Westfalen",
      "amtsgericht": "Amtsgericht Köln",
      "registernummer": "HRB 101766",
      "registerart": "HRB",
      "company_name": "BIS NUTS GmbH",
      "company_seat": "Köln",
      "details": "29.04.2025 (Bekanntmachungsdatum)\n\nNordrhein-Westfalen Amtsgericht Köln HRB 101766\nLöschungsankündigung\n\nBIS NUTS GmbH\nGesellschaft mit beschränkter Haftung\nKöln\n\nDas Registergericht beabsichtigt die Gesellschaft von Amts wegen nach § 394 FamFG zu löschen. Die Frist zur Erhebung eines Widerspruchs ist auf einen Monat festgesetzt."
    },
    {
      "date": "2025-04-29",
      "id": "107673",
      "original_text": "Löschungsankündigung\nNordrhein-Westfalen Amtsgericht Krefeld HRB 8737\nCMS Green Energy GmbH – Nettetal",
      "type": "Löschungsankündigung",
      "state": "Nordrhein-Westfalen",
      "amtsgericht": "Amtsgericht Krefeld",
      "registernummer": "HRB 8737",
      "registerart": "HRB",
      "company_name": "CMS Green Energy GmbH",
      "company_seat": "Nettetal",
      "details": "29.04.2025 (Bekanntmachungsdatum)\n\nNordrhein-Westfalen Amtsgericht Krefeld HRB 8737\nLöschungsankündigung\n\nCMS Green Energy GmbH\nGesellschaft mit beschränkter Haftung\nNettetal\n\nDas Registergericht beabsichtigt die Gesellschaft von Amts wegen nach § 394 FamFG zu löschen. Die Frist zur Erhebung eines Widerspruchs ist auf einen Monat festgesetzt."
    },
    {
      "date": "2025-04-29",
      "id": "107674",
      "original_text": "Löschungsankündigung\nNordrhein-Westfalen Amtsgericht Krefeld HRB 2532\nTAG Schroers & Co. Verwaltungsgeseilschaf t mbH – Krefeld",
      "type": "Löschungsankündigung",
      "state": "Nordrhein-Westfalen",
      "amtsgericht": "Amtsgericht Krefeld",
      "registernummer": "HRB 2532",
      "registerart": "HRB",
      "company_name": "TAG Schroers & Co. Verwaltungsgeseilschaf t mbH",
      "company_seat": "Krefeld",
      "details": "29.04.2025 (Bekanntmachungsdatum)\n\nNordrhein-Westfalen Amtsgericht Krefeld HRB 2532\nLöschungsankündigung\n\nTAG Schroers & Co. Verwaltungsgeseilschaf t mbH\nGesellschaft mit beschränkter Haftung\nKrefeld\n\nDas Registergericht beabsichtigt die Gesellschaft von Amts wegen nach § 394 FamFG zu löschen. Die Frist zur Erhebung eines Widerspruchs ist auf einen Monat festgesetzt."
    },
    {
      "date": "2025-04-29",
      "id": "107675",
      "original_text": "Löschungsankündigung\nNordrhein-Westfalen Amtsgericht Bochum HRB 19904\nRuhrxpress Logistik GmbH – Herne",
      "type": "Löschungsankündigung",
      "state": "Nordrhein-Westfalen",
      "amtsgericht": "Amtsgericht Bochum",
      "registernummer": "HRB 19904",
      "registerart": "HRB",
      "company_name": "Ruhrxpress Logistik GmbH",
      "company_seat": "Herne",
      "details": "29.04.2025 (Bekanntmachungsdatum)\n\nNordrhein-Westfalen Amtsgericht Bochum HRB 19904\nLöschungsankündigung 30.04.2025 (Eintragungsdatum)\n\nRuhrxpress Logistik GmbH\nGesellschaft mit beschränkter Haftung\nHerne\n\nDas Registergericht beabsichtigt die Gesellschaft von Amts wegen nach § 394 FamFG zu löschen. Die Frist zur Erhebung eines Widerspruchs ist auf drei Monate festgesetzt."
    },
    {
      "date": "2025-04-29",
      "id": "107676",
      "original_text": "Registerbekanntmachung nach dem Umwandlungsgesetz\nNordrhein-Westfalen Amtsgericht Paderborn GsR 368\nGatzke Holding UG (haftungsbeschränkt) und Weber Holding UG (haftungsbeschränkt) eGbR – Paderborn",
      "type": "Registerbekanntmachung nach dem Umwandlungsgesetz",
      "state": "Nordrhein-Westfalen",
      "amtsgericht": "Amtsgericht Paderborn",
      "registernummer": "GsR 368",
      "registerart": "GsR",
      "company_name": "Gatzke Holding UG (haftungsbeschränkt) und Weber Holding UG (haftungsbeschränkt) eGbR",
      "company_seat": "Paderborn",
      "details": "29.04.2025 (Bekanntmachungsdatum)\n\nNordrhein-Westfalen Amtsgericht Paderborn GsR 368\nRegisterbekanntmachung nach dem Umwandlungsgesetz 29.04.2025 (Eintragungsdatum)\n\nGatzke Holding UG (haftungsbeschränkt) und Weber Holding UG (haftungsbeschränkt) eGbR\nGesellschaft bürgerlichen Rechts\nPaderborn\n\nDen Gläubigern der an der formwechselnden Umwandlung beteiligten Rechtsträger ist, wenn sie binnen sechs Monaten nach dem Tag, an dem die Eintragung der formwechselnden Umwandlung in das Register des Sitzes desjenigen Rechtsträgers, dessen Gläubiger sie sind, nach § 19 Absatz 3 UmwG als bekanntgemacht gilt, ihren Anspruch nach Grund und Höhe schriftlich anmelden, Sicherheit zu leisten, soweit sie nicht Befriedigung verlangen können. Dieses Recht steht den Gläubigern jedoch nur zu, wenn sie glaubhaft machen, dass durch die formwechselnden Umwandlung die Erfüllung ihrer Forderung gefährdet wird."
    },
    {
      "date": "2025-04-29",
      "id": "107677",
      "original_text": "Registerbekanntmachung nach dem Umwandlungsgesetz\nNordrhein-Westfalen Amtsgericht Duisburg HRB 32335\nTumia GmbH – Duisburg",
      "type": "Registerbekanntmachung nach dem Umwandlungsgesetz",
      "state": "Nordrhein-Westfalen",
      "amtsgericht": "Amtsgericht Duisburg",
      "registernummer": "HRB 32335",
      "registerart": "HRB",
      "company_name": "Tumia GmbH",
      "company_seat": "Duisburg",
      "details": "29.04.2025 (Bekanntmachungsdatum)\n\nNordrhein-Westfalen Amtsgericht Duisburg HRB 32335\nRegisterbekanntmachung nach dem Umwandlungsgesetz 29.04.2025 (Eintragungsdatum)\n\nTumia GmbH\nGesellschaft mit beschränkter Haftung\nDuisburg\n\nDie Gesellschaft hat Gläubigern, deren Forderungen vor dieser Bekanntmachung begründet worden sind, Sicherheit zu leisten, soweit sie nicht Befriedigung verlangen können, wenn sie sich binnen sechs Monaten zu diesem Zweck melden."
    },
    {
      "date": "2025-04-29",
      "id": "107678",
      "original_text": "Löschungsankündigung\nNordrhein-Westfalen Amtsgericht Recklinghausen HRB 8268\nAutohaus am Paulusanger GmbH – Recklinghausen",
      "type": "Löschungsankündigung",
      "state": "Nordrhein-Westfalen",
      "amtsgericht": "Amtsgericht Recklinghausen",
      "registernummer": "HRB 8268",
      "registerart": "HRB",
      "company_name": "Autohaus am Paulusanger GmbH",
      "company_seat": "Recklinghausen",
      "details": "29.04.2025 (Bekanntmachungsdatum)\n\nNordrhein-Westfalen Amtsgericht Recklinghausen HRB 8268\nLöschungsankündigung\n\nAutohaus am Paulusanger GmbH\nGesellschaft mit beschränkter Haftung\nRecklinghausen\n\nDas Registergericht beabsichtigt die Gesellschaft von Amts wegen nach § 394 FamFG zu löschen. Die Frist zur Erhebung eines Widerspruchs ist auf zwei Monate festgesetzt."
    },
    {
      "date": "2025-04-29",
      "id": "107679",
      "original_text": "Löschungsankündigung\nNordrhein-Westfalen Amtsgericht Köln HRB 79152\nTrovaCasa Verwaltungs GmbH – Engelskirchen",
      "type": "Löschungsankündigung",
      "state": "Nordrhein-Westfalen",
      "amtsgericht": "Amtsgericht Köln",
      "registernummer": "HRB 79152",
      "registerart": "HRB",
      "company_name": "TrovaCasa Verwaltungs GmbH",
      "company_seat": "Engelskirchen",
      "details": "29.04.2025 (Bekanntmachungsdatum)\n\nNordrhein-Westfalen Amtsgericht Köln HRB 79152\nLöschungsankündigung\n\nTrovaCasa Verwaltungs GmbH\nGesellschaft mit beschränkter Haftung\nEngelskirchen\n\nDas Registergericht beabsichtigt die Gesellschaft von Amts wegen nach § 394 FamFG zu löschen. Die Frist zur Erhebung eines Widerspruchs ist auf einen Monat festgesetzt."
    },
    {
      "date": "2025-04-29",
      "id": "107680",
      "original_text": "Löschungsankündigung\nNordrhein-Westfalen Amtsgericht Münster HRB 17941\nRH Verwaltungs GmbH – Münster",
      "type": "Löschungsankündigung",
      "state": "Nordrhein-Westfalen",
      "amtsgericht": "Amtsgericht Münster",
      "registernummer": "HRB 17941",
      "registerart": "HRB",
      "company_name": "RH Verwaltungs GmbH",
      "company_seat": "Münster",
      "details": "29.04.2025 (Bekanntmachungsdatum)\n\nNordrhein-Westfalen Amtsgericht Münster HRB 17941\nLöschungsankündigung\n\nRH Verwaltungs GmbH\nGesellschaft mit beschränkter Haftung\nMünster\n\nDas Registergericht beabsichtigt die Gesellschaft von Amts wegen nach § 394 FamFG zu löschen. Die Frist zur Erhebung eines Widerspruchs ist auf 3 Wochen festgesetzt.\n\nRechtsbehelfsbelehrung:\n\nGegen diese Verfügung können Sie Widerspruch einlegen.\nDer Widerspruch ist bei dem Amtsgericht Münster -Registergericht-, Gerichtsstraße2,48136 Münster, schriftlich in deutscher Sprache oder zur Niederschrift der Geschäftsstelle einzulegen.\nDer Widerspruch kann auch zur Niederschrift der Geschäftsstelle eines jeden Amtsgerichtes abgegeben werden.\nDer Widerspruch muss spätestens innerhalb der gesetzten Frist nach der schriftlichen Bekanntgabe der Verfügung bei dem Amtsgericht - Registergericht - Münster eingegangen sein.\nDies gilt auch dann, wenn der Widerspruch zur Niederschrift der Geschäftsstelle eines anderen Amtsgerichtes abgegeben wurde. Die Frist beginnt mit der schriftlichen Bekanntgabe der Verfügung.\nDie Bekanntgabe ist entweder durch Zustellung oder am dritten Tage nach Aufgabe zur Post bewirkt. Fällt das Ende der Frist auf einen Sonntag, einen allgemeinen Feiertag oder Sonnabend, so endet die Frist mit Ablauf des nächsten Werktages.\nDer Widerspruch muss die Bezeichnung der angefochtenen Verfügung sowie die Erklärung enthalten, dass Widerspruch gegen diese Verfügung eingelegt wird.\nEr ist zu unterzeichnen und soll begründet werden."
    },
    {
      "date": "2025-04-29",
      "id": "107681",
      "original_text": "Löschungsankündigung\nNordrhein-Westfalen Amtsgericht Krefeld HRB 17585\nTeTuH UG (haftungsbeschränkt) – Brüggen",
      "type": "Löschungsankündigung",
      "state": "Nordrhein-Westfalen",
      "amtsgericht": "Amtsgericht Krefeld",
      "registernummer": "HRB 17585",
      "registerart": "HRB",
      "company_name": "TeTuH UG (haftungsbeschränkt)",
      "company_seat": "Brüggen",
      "details": "29.04.2025 (Bekanntmachungsdatum)\n\nNordrhein-Westfalen Amtsgericht Krefeld HRB 17585\nLöschungsankündigung\n\nTeTuH UG (haftungsbeschränkt)\nGesellschaft mit beschränkter Haftung\nBrüggen\n\nDas Registergericht beabsichtigt die Gesellschaft von Amts wegen nach § 394 FamFG zu löschen. Die Frist zur Erhebung eines Widerspruchs ist auf einen Monat festgesetzt."
    },
    {
      "date": "2025-04-29",
      "id": "107682",
      "original_text": "Löschungsankündigung\nNordrhein-Westfalen Amtsgericht Münster HRB 17940\nRH Immo Holding GmbH – Münster",
      "type": "Löschungsankündigung",
      "state": "Nordrhein-Westfalen",
      "amtsgericht": "Amtsgericht Münster",
      "registernummer": "HRB 17940",
      "registerart": "HRB",
      "company_name": "RH Immo Holding GmbH",
      "company_seat": "Münster",
      "details": "29.04.2025 (Bekanntmachungsdatum)\n\nNordrhein-Westfalen Amtsgericht Münster HRB 17940\nLöschungsankündigung 27.04.2025 (Eintragungsdatum)\n\nRH Immo Holding GmbH\nGesellschaft mit beschränkter Haftung\nMünster\n\nDas Registergericht beabsichtigt die Gesellschaft von Amts wegen nach § 394 FamFG zu löschen. Die Frist zur Erhebung eines Widerspruchs ist auf 3 Wochen festgesetzt.\n\nRechtsbehelfsbelehrung:\n\nGegen diese Verfügung können Sie Widerspruch einlegen.\nDer Widerspruch ist bei dem Amtsgericht Münster -Registergericht-, Gerichtsstraße2,48136 Münster, schriftlich in deutscher Sprache oder zur Niederschrift der Geschäftsstelle einzulegen.\nDer Widerspruch kann auch zur Niederschrift der Geschäftsstelle eines jeden Amtsgerichtes abgegeben werden.\nDer Widerspruch muss spätestens innerhalb der gesetzten Frist nach der schriftlichen Bekanntgabe der Verfügung bei dem Amtsgericht - Registergericht - Münster eingegangen sein.\nDies gilt auch dann, wenn der Widerspruch zur Niederschrift der Geschäftsstelle eines anderen Amtsgerichtes abgegeben wurde. Die Frist beginnt mit der schriftlichen Bekanntgabe der Verfügung.\nDie Bekanntgabe ist entweder durch Zustellung oder am dritten Tage nach Aufgabe zur Post bewirkt. Fällt das Ende der Frist auf einen Sonntag, einen allgemeinen Feiertag oder Sonnabend, so endet die Frist mit Ablauf des nächsten Werktages.\nDer Widerspruch muss die Bezeichnung der angefochtenen Verfügung sowie die Erklärung enthalten, dass Widerspruch gegen diese Verfügung eingelegt wird.\nEr ist zu unterzeichnen und soll begründet werden."
    },
    {
      "date": "2025-04-29",
      "id": "107683",
      "original_text": "Registerbekanntmachung nach dem Umwandlungsgesetz\nNordrhein-Westfalen Amtsgericht Köln HRB 20755\nHergarten GmbH – Köln",
      "type": "Registerbekanntmachung nach dem Umwandlungsgesetz",
      "state": "Nordrhein-Westfalen",
      "amtsgericht": "Amtsgericht Köln",
      "registernummer": "HRB 20755",
      "registerart": "HRB",
      "company_name": "Hergarten GmbH",
      "company_seat": "Köln",
      "details": "29.04.2025 (Bekanntmachungsdatum)\n\nNordrhein-Westfalen Amtsgericht Köln HRB 20755\nRegisterbekanntmachung nach dem Umwandlungsgesetz 29.04.2025 (Eintragungsdatum)\n\nHergarten GmbH\nGesellschaft mit beschränkter Haftung\nKöln\n\nDen Gläubigern der an der Verschmelzung beteiligten Rechtsträger ist, wenn sie binnen sechs Monaten nach dem Tag, an dem die Eintragung der Verschmelzung in das Register des Sitzes desjenigen Rechtsträgers, dessen Gläubiger sie sind, nach § 19 Absatz 3 UmwG als bekanntgemacht gilt, ihren Anspruch nach Grund und Höhe schriftlich anmelden, Sicherheit zu leisten, soweit sie nicht Befriedigung verlangen können. Dieses Recht steht den Gläubigern jedoch nur zu, wenn sie glaubhaft machen, dass durch die Verschmelzung die Erfüllung ihrer Forderung gefährdet wird."
    },
    {
      "date": "2025-04-29",
      "id": "107684",
      "original_text": "Löschungsankündigung\nThüringen Amtsgericht Jena HRB 110890\nSG Elektronik GmbH – Suhl",
      "type": "Löschungsankündigung",
      "state": "Thüringen",
      "amtsgericht": "Amtsgericht Jena",
      "registernummer": "HRB 110890",
      "registerart": "HRB",
      "company_name": "SG Elektronik GmbH",
      "company_seat": "Suhl",
      "details": "29.04.2025 (Bekanntmachungsdatum)\n\nThüringen Amtsgericht Jena HRB 110890\nLöschungsankündigung\n\nSG Elektronik GmbH\nGesellschaft mit beschränkter Haftung\nSuhl\n\nDas Registergericht beabsichtigt, die im Handelsregister eingetragene Gesellschaft wegen Vermögenslosigkeit nach § 394 FamFG von Amts wegen zu löschen. Die Frist zur Erhebung eines Widerspruchs gegen die beabsichtigte Löschung wird auf 6 Wochen festgesetzt."
    },
    {
      "date": "2025-04-29",
      "id": "107685",
      "original_text": "Registerbekanntmachung nach dem Umwandlungsgesetz\nThüringen Amtsgericht Jena HRB 523218\nREHA Med Altenburg GmbH – Altenburg",
      "type": "Registerbekanntmachung nach dem Umwandlungsgesetz",
      "state": "Thüringen",
      "amtsgericht": "Amtsgericht Jena",
      "registernummer": "HRB 523218",
      "registerart": "HRB",
      "company_name": "REHA Med Altenburg GmbH",
      "company_seat": "Altenburg",
      "details": "29.04.2025 (Bekanntmachungsdatum)\n\nThüringen Amtsgericht Jena HRB 523218\nRegisterbekanntmachung nach dem Umwandlungsgesetz 29.04.2025 (Eintragungsdatum)\n\nREHA Med Altenburg GmbH\nGesellschaft mit beschränkter Haftung\nAltenburg\n\nNicht eingetragen: Den Gläubigern der an der Ausgliederung beteiligten Rechtsträger, ist wenn sie binnen sechs Monaten nach dem Tag, an dem die Eintragung der Ausgliederung in das Register des Sitzes desjenigen Rechtsträgers, dessen Gläubiger sie sind, nach §§125, 19 Abs. 3 UmwG als bekanntgemacht gilt, ihren Anspruch nach Grund und Höhe schriftlich anmelden, Sicherheit zu leisten, soweit sie nicht Befriedigung verlangen können. Dieses Recht steht ihnen jedoch nur zu, wenn sie glaubhaft machen, daß durch die Ausgliederung die Erfüllung ihrer Forderung gefährdet wird."
    },
    {
      "date": "2025-04-29",
      "id": "107686",
      "original_text": "Registerbekanntmachung nach dem Umwandlungsgesetz\nThüringen Amtsgericht Jena HRA 506799\nREHA Med Altenburg e.K. – Altenburg",
      "type": "Registerbekanntmachung nach dem Umwandlungsgesetz",
      "state": "Thüringen",
      "amtsgericht": "Amtsgericht Jena",
      "registernummer": "HRA 506799",
      "registerart": "HRA",
      "company_name": "REHA Med Altenburg e.K.",
      "company_seat": "Altenburg",
      "details": "29.04.2025 (Bekanntmachungsdatum)\n\nThüringen Amtsgericht Jena HRA 506799\nRegisterbekanntmachung nach dem Umwandlungsgesetz 29.04.2025 (Eintragungsdatum)\n\nREHA Med Altenburg e.K.\nEinzelkaufmann / Einzelkauffrau\nAltenburg\n\nNicht eingetragen: Den Gläubigern der an der Ausgliederung beteiligten Rechtsträger, ist wenn sie binnen sechs Monaten nach dem Tag, an dem die Eintragung der Ausgliederung in das Register des Sitzes desjenigen Rechtsträgers, dessen Gläubiger sie sind, nach §§125, 19 Abs. 3 UmwG als bekanntgemacht gilt, ihren Anspruch nach Grund und Höhe schriftlich anmelden, Sicherheit zu leisten, soweit sie nicht Befriedigung verlangen können. Dieses Recht steht ihnen jedoch nur zu, wenn sie glaubhaft machen, daß durch die Ausgliederung die Erfüllung ihrer Forderung gefährdet wird."
    },
    {
      "date": "2025-04-29",
      "id": "107687",
      "original_text": "Registerbekanntmachung nach dem Umwandlungsgesetz\nHessen Amtsgericht Frankfurt am Main HRB 121460\nLastmile Courier UG (haftungsbeschränkt) – Bad Vilbel",
      "type": "Registerbekanntmachung nach dem Umwandlungsgesetz",
      "state": "Hessen",
      "amtsgericht": "Amtsgericht Frankfurt am Main",
      "registernummer": "HRB 121460",
      "registerart": "HRB",
      "company_name": "Lastmile Courier UG (haftungsbeschränkt)",
      "company_seat": "Bad Vilbel",
      "details": "29.04.2025 (Bekanntmachungsdatum)\n\nHessen Amtsgericht Frankfurt am Main HRB 121460\nRegisterbekanntmachung nach dem Umwandlungsgesetz 29.04.2025 (Eintragungsdatum)\n\nLastmile Courier UG (haftungsbeschränkt)\nGesellschaft mit beschränkter Haftung\nBad Vilbel\n\nDen Gläubigern der an der Verschmelzung beteiligten Rechtsträger ist, wenn sie binnen sechs Monaten nach dem Tag, an dem die Eintragung der Verschmelzung in das Register des Sitzes desjenigen Rechtsträgers, dessen Gläubiger sie sind, nach § 19 Absatz 3 UmwG bekannt gemacht worden ist, ihren Anspruch nach Grund und Höhe schriftlich anmelden, Sicherheit zu leisten, soweit sie nicht Befriedigung verlangen können. Dieses Recht steht den Gläubigern jedoch nur zu, wenn sie glaubhaft machen, dass durch die Verschmelzung die Erfüllung ihrer Forderung gefährdet wird."
    },
    {
      "date": "2025-04-29",
      "id": "107688",
      "original_text": "Löschungsankündigung\nHessen Amtsgericht Frankfurt am Main HRB 122581\nDeuC International Handel UG (haftungsbeschränkt) – Frankfurt am Main",
      "type": "Löschungsankündigung",
      "state": "Hessen",
      "amtsgericht": "Amtsgericht Frankfurt am Main",
      "registernummer": "HRB 122581",
      "registerart": "HRB",
      "company_name": "DeuC International Handel UG (haftungsbeschränkt)",
      "company_seat": "Frankfurt am Main",
      "details": "29.04.2025 (Bekanntmachungsdatum)\n\nHessen Amtsgericht Frankfurt am Main HRB 122581\nLöschungsankündigung\n\nDeuC International Handel UG (haftungsbeschränkt)\nGesellschaft mit beschränkter Haftung\nFrankfurt am Main\n\nDas Registergericht beabsichtigt die im Handelsregister eingetragene Gesellschaft von Amts wegen nach § 394 FamFG zu löschen.Hiergegen kann innerhalb eines Zeitraums von 1 Monat nach dieser Veröffentlichung Widerspruch bei dem Amtsgericht Frankfurt am Main eingelegt werden."
    },
    {
      "date": "2025-04-29",
      "id": "107689",
      "original_text": "Löschungsankündigung\nHessen Amtsgericht Gießen HRB 8875\nJutta Schäfer Verwaltung GmbH – Gießen",
      "type": "Löschungsankündigung",
      "state": "Hessen",
      "amtsgericht": "Amtsgericht Gießen",
      "registernummer": "HRB 8875",
      "registerart": "HRB",
      "company_name": "Jutta Schäfer Verwaltung GmbH",
      "company_seat": "Gießen",
      "details": "29.04.2025 (Bekanntmachungsdatum)\n\nHessen Amtsgericht Gießen HRB 8875\nLöschungsankündigung\n\nJutta Schäfer Verwaltung GmbH\nGesellschaft mit beschränkter Haftung\nGießen\n\nAuf Antrag des Finanzamts ist beabsichtigt, die Gesellschaft wegen Vermögenslosigkeit gemäß § 394 FamFG von Amts wegen zu löschen. Hiergegen kann innerhalb von drei Monaten nach dieser Veröffentlichung Widerspruch beim Amtsgericht Gießen eingelegt werden. Sollte Widerspruch eingelegt werden, dürfte dies nur mit Begründung erfolgversprechend sein. Insbesondere sollte vorhandenes Vermögen der Gesellschaft innerhalb der genannten Frist nachgewiesen werden."
    },
    {
      "date": "2025-04-29",
      "id": "107690",
      "original_text": "Registerbekanntmachung nach dem Umwandlungsgesetz\nHessen Amtsgericht Gießen HRB 11889\nHeim Company UG (haftungsbeschränkt) – Gießen",
      "type": "Registerbekanntmachung nach dem Umwandlungsgesetz",
      "state": "Hessen",
      "amtsgericht": "Amtsgericht Gießen",
      "registernummer": "HRB 11889",
      "registerart": "HRB",
      "company_name": "Heim Company UG (haftungsbeschränkt)",
      "company_seat": "Gießen",
      "details": "29.04.2025 (Bekanntmachungsdatum)\n\nHessen Amtsgericht Gießen HRB 11889\nRegisterbekanntmachung nach dem Umwandlungsgesetz 29.04.2025 (Eintragungsdatum)\n\nHeim Company UG (haftungsbeschränkt)\nGesellschaft mit beschränkter Haftung\nGießen\n\nDen Gläubigern der an der Verschmelzung beteiligten Rechtsträger ist, wenn sie binnen sechs Monaten nach dem Tag, an dem die Eintragung der Verschmelzung in das Register des Sitzes desjenigen Rechtsträgers, dessen Gläubiger sie sind, nach § 19 Absatz 3 UmwG bekannt gemacht worden ist, ihren Anspruch nach Grund und Höhe schriftlich anmelden, Sicherheit zu leisten, soweit sie nicht Befriedigung verlangen können. Dieses Recht steht den Gläubigern jedoch nur zu, wenn sie glaubhaft machen, dass durch die Verschmelzung die Erfüllung ihrer Forderung gefährdet wird."
    },
    {
      "date": "2025-04-29",
      "id": "107691",
      "original_text": "Löschungsankündigung\nHessen Amtsgericht Frankfurt am Main HRB 121481\n¡Papi Chulo! Fashion GmbH – Frankfurt am Main",
      "type": "Löschungsankündigung",
      "state": "Hessen",
      "amtsgericht": "Amtsgericht Frankfurt am Main",
      "registernummer": "HRB 121481",
      "registerart": "HRB",
      "company_name": "¡Papi Chulo! Fashion GmbH",
      "company_seat": "Frankfurt am Main",
      "details": "29.04.2025 (Bekanntmachungsdatum)\n\nHessen Amtsgericht Frankfurt am Main HRB 121481\nLöschungsankündigung\n\n¡Papi Chulo! Fashion GmbH\nGesellschaft mit beschränkter Haftung\nFrankfurt am Main\n\nDas Registergericht beabsichtigt die im Handelsregister eingetragene Gesellschaft von Amts wegen nach § 394 FamFG zu löschen. Hiergegen kann innerhalb einer Frist von1  Monat nach dieser Veröffentlichung Widerspruch bei dem Amtsgericht Frankfurt am Main eingelegt werden."
    },
    {
      "date": "2025-04-29",
      "id": "107692",
      "original_text": "Einreichung neuer Dokumente\nHessen Amtsgericht Frankfurt am Main HRB 52240\nStädtische Bühnen Frankfurt am Main GmbH – Frankfurt am Main",
      "type": "Einreichung neuer Dokumente",
      "state": "Hessen",
      "amtsgericht": "Amtsgericht Frankfurt am Main",
      "registernummer": "HRB 52240",
      "registerart": "HRB",
      "company_name": "Städtische Bühnen Frankfurt am Main GmbH",
      "company_seat": "Frankfurt am Main",
      "details": "29.04.2025 (Bekanntmachungsdatum)\n\nHessen Amtsgericht Frankfurt am Main HRB 52240\nEinreichung neuer Dokumente\n\nStädtische Bühnen Frankfurt am Main GmbH\nGesellschaft mit beschränkter Haftung\nFrankfurt am Main\n\nDurch eine Änderung in den Personen der Aufsichtsratsmitglieder ist eine Liste der Mitglieder des Aufsichtsrates zum Handelsregister eingereicht worden."
    },
    {
      "date": "2025-04-29",
      "id": "107693",
      "original_text": "Löschungsankündigung\nHessen Amtsgericht Gießen HRB 8495\nWald & Wiese Marketing UG (haftungsbeschränkt) – Gießen",
      "type": "Löschungsankündigung",
      "state": "Hessen",
      "amtsgericht": "Amtsgericht Gießen",
      "registernummer": "HRB 8495",
      "registerart": "HRB",
      "company_name": "Wald & Wiese Marketing UG (haftungsbeschränkt)",
      "company_seat": "Gießen",
      "details": "29.04.2025 (Bekanntmachungsdatum)\n\nHessen Amtsgericht Gießen HRB 8495\nLöschungsankündigung\n\nWald & Wiese Marketing UG (haftungsbeschränkt)\nGesellschaft mit beschränkter Haftung\nGießen\n\nAuf Antrag des Finanzamts ist beabsichtigt, die Gesellschaft wegen Vermögenslosigkeit gemäß § 394 FamFG von Amts wegen zu löschen. Hiergegen kann innerhalb von drei Monaten nach dieser Veröffentlichung Widerspruch beim Amtsgericht Gießen eingelegt werden. Sollte Widerspruch eingelegt werden, dürfte dies nur mit Begründung erfolgversprechend sein. Insbesondere sollte vorhandenes Vermögen der Gesellschaft innerhalb der genannten Frist nachgewiesen werden."
    },
    {
      "date": "2025-04-29",
      "id": "107694",
      "original_text": "Registerbekanntmachung nach dem Umwandlungsgesetz\nHessen Amtsgericht Königstein HRB 11472\nCBKR Controlling & Beteiligungen Kronberg GmbH – Kronberg im Taunus",
      "type": "Registerbekanntmachung nach dem Umwandlungsgesetz",
      "state": "Hessen",
      "amtsgericht": "Amtsgericht Königstein",
      "registernummer": "HRB 11472",
      "registerart": "HRB",
      "company_name": "CBKR Controlling & Beteiligungen Kronberg GmbH",
      "company_seat": "Kronberg im Taunus",
      "details": "29.04.2025 (Bekanntmachungsdatum)\n\nHessen Amtsgericht Königstein HRB 11472\nRegisterbekanntmachung nach dem Umwandlungsgesetz 29.04.2025 (Eintragungsdatum)\n\nCBKR Controlling & Beteiligungen Kronberg GmbH\nGesellschaft mit beschränkter Haftung\nKronberg im Taunus\n\nDen Gläubigern der an der Verschmelzung beteiligten Rechtsträger ist, wenn sie binnen sechs Monaten nach dem Tag, an dem die Eintragung der Verschmelzung in das Register des Sitzes desjenigen Rechtsträgers, dessen Gläubiger sie sind, nach § 19 Absatz 3 UmwG bekannt gemacht worden ist, ihren Anspruch nach Grund und Höhe schriftlich anmelden, Sicherheit zu leisten, soweit sie nicht Befriedigung verlangen können. Dieses Recht steht den Gläubigern jedoch nur zu, wenn sie glaubhaft machen, dass durch die Verschmelzung die Erfüllung ihrer Forderung gefährdet wird."
    },
    {
      "date": "2025-04-29",
      "id": "107695",
      "original_text": "Sonstige Registerbekanntmachung\nHessen Amtsgericht Gießen HRB 7037\nGlückszwerge GmbH – Grünberg",
      "type": "Sonstige Registerbekanntmachung",
      "state": "Hessen",
      "amtsgericht": "Amtsgericht Gießen",
      "registernummer": "HRB 7037",
      "registerart": "HRB",
      "company_name": "Glückszwerge GmbH",
      "company_seat": "Grünberg",
      "details": "29.04.2025 (Bekanntmachungsdatum)\n\nHessen Amtsgericht Gießen HRB 7037\nSonstige Registerbekanntmachung 15.04.2025 (Eintragungsdatum)\n\nGlückszwerge GmbH\nGesellschaft mit beschränkter Haftung\nGrünberg\n\nDen Gläubigern der Gesellschaft, deren Forderungen begründet worden sind, bevor die Eintragung der Beendigung des Vertrags in das Handelsregister nach § 10 HGB bekannt gemacht worden ist, ist vom anderen Vertragsteil Sicherheit zu leisten, wenn sie sich binnen sechs Monaten nach dieser Bekanntmachung zu diesem Zweck bei ihm melden."
    },
    {
      "date": "2025-04-29",
      "id": "107696",
      "original_text": "Löschungsankündigung\nHessen Amtsgericht Hanau HRB 94931\nCR CarRepair Frankfurt GmbH – Rodenbach",
      "type": "Löschungsankündigung",
      "state": "Hessen",
      "amtsgericht": "Amtsgericht Hanau",
      "registernummer": "HRB 94931",
      "registerart": "HRB",
      "company_name": "CR CarRepair Frankfurt GmbH",
      "company_seat": "Rodenbach",
      "details": "29.04.2025 (Bekanntmachungsdatum)\n\nHessen Amtsgericht Hanau HRB 94931\nLöschungsankündigung\n\nCR CarRepair Frankfurt GmbH\nGesellschaft mit beschränkter Haftung\nRodenbach\n\nDas Registergericht beabsichtigt die im Handelsregister eingetragene Gesellschaft von Amts wegen nach § 394 FamFG zu löschen. Die Frist zur Erhebung eines Widerspruchs gegen die beabsichtigte Löschung wird auf 3 Monate festgesetzt."
    },
    {
      "date": "2025-04-29",
      "id": "107697",
      "original_text": "Löschungsankündigung\nHessen Amtsgericht Darmstadt HRB 89551\ncesIT consulting & services UG (haftungsbeschränkt) – Bensheim",
      "type": "Löschungsankündigung",
      "state": "Hessen",
      "amtsgericht": "Amtsgericht Darmstadt",
      "registernummer": "HRB 89551",
      "registerart": "HRB",
      "company_name": "cesIT consulting & services UG (haftungsbeschränkt)",
      "company_seat": "Bensheim",
      "details": "29.04.2025 (Bekanntmachungsdatum)\n\nHessen Amtsgericht Darmstadt HRB 89551\nLöschungsankündigung\n\ncesIT consulting & services UG (haftungsbeschränkt)\nGesellschaft mit beschränkter Haftung\nBensheim\n\nDas Registergericht beabsichtigt die im Handelsregister eingetragene Gesellschaft von Amts wegen nach § 394 FamFG zu löschen. Die Frist zur Erhebung eines Widerspruchs gegen die beabsichtigte Löschung wird auf 3 Monate festgesetzt."
    },
    {
      "date": "2025-04-29",
      "id": "107698",
      "original_text": "Registerbekanntmachung nach dem Umwandlungsgesetz\nHessen Amtsgericht Königstein HRB 9992\nPredac Immobilien Fonds GmbH – Kronberg im Taunus",
      "type": "Registerbekanntmachung nach dem Umwandlungsgesetz",
      "state": "Hessen",
      "amtsgericht": "Amtsgericht Königstein",
      "registernummer": "HRB 9992",
      "registerart": "HRB",
      "company_name": "Predac Immobilien Fonds GmbH",
      "company_seat": "Kronberg im Taunus",
      "details": "29.04.2025 (Bekanntmachungsdatum)\n\nHessen Amtsgericht Königstein HRB 9992\nRegisterbekanntmachung nach dem Umwandlungsgesetz 29.04.2025 (Eintragungsdatum)\n\nPredac Immobilien Fonds GmbH\nGesellschaft mit beschränkter Haftung\nKronberg im Taunus\n\nDen Gläubigern der an der Verschmelzung beteiligten Rechtsträger ist, wenn sie binnen sechs Monaten nach dem Tag, an dem die Eintragung der Verschmelzung in das Register des Sitzes desjenigen Rechtsträgers, dessen Gläubiger sie sind, nach § 19 Absatz 3 UmwG bekannt gemacht worden ist, ihren Anspruch nach Grund und Höhe schriftlich anmelden, Sicherheit zu leisten, soweit sie nicht Befriedigung verlangen können. Dieses Recht steht den Gläubigern jedoch nur zu, wenn sie glaubhaft machen, dass durch die Verschmelzung die Erfüllung ihrer Forderung gefährdet wird."
    },
    {
      "date": "2025-04-29",
      "id": "107699",
      "original_text": "Registerbekanntmachung nach dem Umwandlungsgesetz\nHessen Amtsgericht Gießen HRB 7091\nHeim Company GmbH – Gießen",
      "type": "Registerbekanntmachung nach dem Umwandlungsgesetz",
      "state": "Hessen",
      "amtsgericht": "Amtsgericht Gießen",
      "registernummer": "HRB 7091",
      "registerart": "HRB",
      "company_name": "Heim Company GmbH",
      "company_seat": "Gießen",
      "details": "29.04.2025 (Bekanntmachungsdatum)\n\nHessen Amtsgericht Gießen HRB 7091\nRegisterbekanntmachung nach dem Umwandlungsgesetz 29.04.2025 (Eintragungsdatum)\n\nHeim Company GmbH\nGesellschaft mit beschränkter Haftung\nGießen\n\nDen Gläubigern der an der Verschmelzung beteiligten Rechtsträger ist, wenn sie binnen sechs Monaten nach dem Tag, an dem die Eintragung der Verschmelzung in das Register des Sitzes desjenigen Rechtsträgers, dessen Gläubiger sie sind, nach § 19 Absatz 3 UmwG bekannt gemacht worden ist, ihren Anspruch nach Grund und Höhe schriftlich anmelden, Sicherheit zu leisten, soweit sie nicht Befriedigung verlangen können. Dieses Recht steht den Gläubigern jedoch nur zu, wenn sie glaubhaft machen, dass durch die Verschmelzung die Erfüllung ihrer Forderung gefährdet wird."
    },
    {
      "date": "2025-04-29",
      "id": "107700",
      "original_text": "Einreichung neuer Dokumente\nHessen Amtsgericht Offenbach am Main HRB 50793\nRigaku Europe SE – Neu-Isenburg",
      "type": "Einreichung neuer Dokumente",
      "state": "Hessen",
      "amtsgericht": "Amtsgericht Offenbach am Main",
      "registernummer": "HRB 50793",
      "registerart": "HRB",
      "company_name": "Rigaku Europe SE",
      "company_seat": "Neu-Isenburg",
      "details": "29.04.2025 (Bekanntmachungsdatum)\n\nHessen Amtsgericht Offenbach am Main HRB 50793\nEinreichung neuer Dokumente\n\nRigaku Europe SE\nEuropäische Aktiengesellschaft (SE)\nNeu-Isenburg\n\nDurch eine Änderung in den Personen der Aufsichtsratsmitglieder ist eine Liste der Mitglieder des Aufsichtsrates zum Handelsregister eingereicht worden."
    },
    {
      "date": "2025-04-29",
      "id": "107701",
      "original_text": "Registerbekanntmachung nach dem Umwandlungsgesetz\nHessen Amtsgericht Frankfurt am Main HRB 105976\nD&B HERCURE Travel Consulting UG (haftungsbeschränkt) – Frankfurt am Main",
      "type": "Registerbekanntmachung nach dem Umwandlungsgesetz",
      "state": "Hessen",
      "amtsgericht": "Amtsgericht Frankfurt am Main",
      "registernummer": "HRB 105976",
      "registerart": "HRB",
      "company_name": "D&B HERCURE Travel Consulting UG (haftungsbeschränkt)",
      "company_seat": "Frankfurt am Main",
      "details": "29.04.2025 (Bekanntmachungsdatum)\n\nHessen Amtsgericht Frankfurt am Main HRB 105976\nRegisterbekanntmachung nach dem Umwandlungsgesetz 29.04.2025 (Eintragungsdatum)\n\nD&B HERCURE Travel Consulting UG (haftungsbeschränkt)\nGesellschaft mit beschränkter Haftung\nFrankfurt am Main\n\nDen Gläubigern der an der Verschmelzung beteiligten Rechtsträger ist, wenn sie binnen sechs Monaten nach dem Tag, an dem die Eintragung der Verschmelzung in das Register des Sitzes derjenigen Rechtsträger deren Gläubiger sie sind, nach § 19 Absatz 3 UmwG bekannt gemacht worden ist, ihren Anspruch nach Grund und Höhe schriftlich anmelden, Sicherheit zu leisten, soweit sie nicht Befriedigung verlangen können. Dieses Recht steht den Gläubigern jedoch nur zu, wenn sie glaubhaft machen, dass durch die Verschmelzung die Erfüllung ihrer Forderung gefährdet wird."
    },
    {
      "date": "2025-04-29",
      "id": "107702",
      "original_text": "Löschungsankündigung\nHessen Amtsgericht Frankfurt am Main HRB 91848\nROTH GmbH – Frankfurt am Main",
      "type": "Löschungsankündigung",
      "state": "Hessen",
      "amtsgericht": "Amtsgericht Frankfurt am Main",
      "registernummer": "HRB 91848",
      "registerart": "HRB",
      "company_name": "ROTH GmbH",
      "company_seat": "Frankfurt am Main",
      "details": "29.04.2025 (Bekanntmachungsdatum)\n\nHessen Amtsgericht Frankfurt am Main HRB 91848\nLöschungsankündigung\n\nROTH GmbH\nGesellschaft mit beschränkter Haftung\nFrankfurt am Main\n\nDas Registergericht beabsichtigt die im Handelsregister eingetragene Gesellschaft von Amts wegen nach § 394 FamFG zu löschen. Hiergegen kann innerhalb eines Zeitraums von 1 Monat nach dieser Veröffentlichung Widerspruch bei dem Amtsgericht Frankfurt am Main eingelegt werden."
    },
    {
      "date": "2025-04-29",
      "id": "107703",
      "original_text": "Sonstige Registerbekanntmachung\nHessen Amtsgericht Offenbach am Main VR 5951\nFörderverein Tennisklub Langen – Langen (Hessen)",
      "type": "Sonstige Registerbekanntmachung",
      "state": "Hessen",
      "amtsgericht": "Amtsgericht Offenbach am Main",
      "registernummer": "VR 5951",
      "registerart": "VR",
      "company_name": "Förderverein Tennisklub Langen",
      "company_seat": "Langen (Hessen)",
      "details": "29.04.2025 (Bekanntmachungsdatum)\n\nHessen Amtsgericht Offenbach am Main VR 5951\nSonstige Registerbekanntmachung 29.04.2025 (Eintragungsdatum)\n\nFörderverein Tennisklub Langen\neingetragener Verein\nLangen (Hessen)\n\nDer Verein ist aufgelöst."
    }
  ]
}