{
  "date": "2025-04-10",
  "date_of_scrape": "2025-05-30T14:56:08.949Z",
  "tool_version": "0.2.0",
  "number_of_announcements": 129,
  "announcements": [
    {
      "date": "2025-04-10",
      "id": "106138",
      "original_text": "Löschungsankündigung\nBayern Amtsgericht München HRB 172489\nMünchner Putz GmbH – München",
      "type": "Löschungsankündigung",
      "state": "Bayern",
      "amtsgericht": "Amtsgericht München",
      "registernummer": "HRB 172489",
      "registerart": "HRB",
      "company_name": "Münchner Putz GmbH",
      "company_seat": "München",
      "details": "10.04.2025 (Bekanntmachungsdatum)\n\nBayern Amtsgericht München HRB 172489\nLöschungsankündigung\n\nMünchner Putz GmbH\nGesellschaft mit beschränkter Haftung\nMünchen\n\nDas Registergericht beabsichtigt, die im Handelsregister eingetragene Gesellschaft wegen Vermögenslosigkeit von Amts wegen nach § 394 FamFG zu löschen. Die Frist zur Erhebung eines Widerspruchs ist auf drei Monate festgesetzt."
    },
    {
      "date": "2025-04-10",
      "id": "106139",
      "original_text": "Löschungsankündigung\nBayern Amtsgericht Ansbach HRB 6370\nqartis media GmbH – Bruckberg",
      "type": "Löschungsankündigung",
      "state": "Bayern",
      "amtsgericht": "Amtsgericht Ansbach",
      "registernummer": "HRB 6370",
      "registerart": "HRB",
      "company_name": "qartis media GmbH",
      "company_seat": "Bruckberg",
      "details": "10.04.2025 (Bekanntmachungsdatum)\n\nBayern Amtsgericht Ansbach HRB 6370\nLöschungsankündigung\n\nqartis media GmbH\nGesellschaft mit beschränkter Haftung\nBruckberg\n\nDas Registergericht beabsichtigt, die im Handelsregister eingetragene Gesellschaft wegen Vermögenslosigkeit von Amts wegen nach § 394 FamFG zu löschen. Die Frist zur Erhebung eines Widerspruchs ist auf sechs Wochen festgesetzt."
    },
    {
      "date": "2025-04-10",
      "id": "106140",
      "original_text": "Löschungsankündigung\nBayern Amtsgericht Aschaffenburg HRB 12242\nDunlopillo GmbH – Alzenau",
      "type": "Löschungsankündigung",
      "state": "Bayern",
      "amtsgericht": "Amtsgericht Aschaffenburg",
      "registernummer": "HRB 12242",
      "registerart": "HRB",
      "company_name": "Dunlopillo GmbH",
      "company_seat": "Alzenau",
      "details": "10.04.2025 (Bekanntmachungsdatum)\n\nBayern Amtsgericht Aschaffenburg HRB 12242\nLöschungsankündigung\n\nDunlopillo GmbH\nGesellschaft mit beschränkter Haftung\nAlzenau\n\nDas Registergericht beabsichtigt, die im Handelsregister eingetragene Gesellschaft wegen Vermögenslosigkeit von Amts wegen nach § 394 FamFG zu löschen. Die Frist zur Erhebung eines Widerspruchs ist auf drei Monate festgesetzt."
    },
    {
      "date": "2025-04-10",
      "id": "106141",
      "original_text": "Registerbekanntmachung nach dem Umwandlungsgesetz\nBayern Amtsgericht Coburg VR 10057\nTurnerschaft Kronach 1861 e.V. – Kronach",
      "type": "Registerbekanntmachung nach dem Umwandlungsgesetz",
      "state": "Bayern",
      "amtsgericht": "Amtsgericht Coburg",
      "registernummer": "VR 10057",
      "registerart": "VR",
      "company_name": "Turnerschaft Kronach 1861 e.V.",
      "company_seat": "Kronach",
      "details": "10.04.2025 (Bekanntmachungsdatum)\n\nBayern Amtsgericht Coburg VR 10057\nRegisterbekanntmachung nach dem Umwandlungsgesetz 09.04.2025 (Eintragungsdatum)\n\nTurnerschaft Kronach 1861 e.V.\neingetragener Verein\nKronach\n\nDen Gläubigern der an der Verschmelzung beteiligten Rechtsträger ist, wenn sie binnen sechs Monaten nach dem Tag, an dem die Eintragung der Verschmelzung in das Register des Sitzes desjenigen Rechtsträgers, dessen Gläubiger sie sind, nach § 19 Abs. 3 UmwG als bekannt gemacht gilt, ihren Anspruch nach Grund und Höhe in Textform anmelden, Sicherheit zu leisten, soweit sie nicht Befriedigung verlangen können. Dieses Recht steht den Gläubigern jedoch nur zu, wenn sie glaubhaft machen, dass durch die Verschmelzung die Erfüllung ihrer Forderung gefährdet wird."
    },
    {
      "date": "2025-04-10",
      "id": "106142",
      "original_text": "Registerbekanntmachung nach dem Umwandlungsgesetz\nBayern Amtsgericht Fürth HRA 12450\nFahrzeugaufbereitung Jan Bauer e.K. – Burghaslach",
      "type": "Registerbekanntmachung nach dem Umwandlungsgesetz",
      "state": "Bayern",
      "amtsgericht": "Amtsgericht Fürth",
      "registernummer": "HRA 12450",
      "registerart": "HRA",
      "company_name": "Fahrzeugaufbereitung Jan Bauer e.K.",
      "company_seat": "Burghaslach",
      "details": "10.04.2025 (Bekanntmachungsdatum)\n\nBayern Amtsgericht Fürth HRA 12450\nRegisterbekanntmachung nach dem Umwandlungsgesetz 09.04.2025 (Eintragungsdatum)\n\nFahrzeugaufbereitung Jan Bauer e.K.\nEinzelkaufmann / Einzelkauffrau\nBurghaslach\n\nDen Gläubigern der an der Ausgliederung beteiligten Rechtsträger ist, wenn sie binnen sechs Monaten nach dem Tag, an dem die Eintragung der Ausgliederung in das Register des Sitzes desjenigen Rechtsträgers, dessen Gläubiger sie sind, nach §§ 125, 19 Abs. 3 UmwG als bekannt gemacht gilt, ihren Anspruch nach Grund und Höhe in Textform anmelden, Sicherheit zu leisten, soweit sie nicht Befriedigung verlangen können. Dieses Recht steht den Gläubigern jedoch nur zu, wenn sie glaubhaft machen, dass durch die Ausgliederung die Erfüllung ihrer Forderung gefährdet wird."
    },
    {
      "date": "2025-04-10",
      "id": "106143",
      "original_text": "Löschungsankündigung\nBayern Amtsgericht Passau HRB 8591\nVersicherungsmakler Passau UG (haftungsbeschränkt) – Passau",
      "type": "Löschungsankündigung",
      "state": "Bayern",
      "amtsgericht": "Amtsgericht Passau",
      "registernummer": "HRB 8591",
      "registerart": "HRB",
      "company_name": "Versicherungsmakler Passau UG (haftungsbeschränkt)",
      "company_seat": "Passau",
      "details": "10.04.2025 (Bekanntmachungsdatum)\n\nBayern Amtsgericht Passau HRB 8591\nLöschungsankündigung\n\nVersicherungsmakler Passau UG (haftungsbeschränkt)\nGesellschaft mit beschränkter Haftung\nPassau\n\nDas Registergericht beabsichtigt, die im Handelsregister eingetragene Gesellschaft wegen Vermögenslosigkeit von Amts wegen nach § 394 FamFG zu löschen. Die Frist zur Erhebung eines Widerspruchs ist auf einen Monat festgesetzt."
    },
    {
      "date": "2025-04-10",
      "id": "106144",
      "original_text": "Löschungsankündigung\nBayern Amtsgericht Aschaffenburg HRB 5036\nVäth GmbH – Hösbach",
      "type": "Löschungsankündigung",
      "state": "Bayern",
      "amtsgericht": "Amtsgericht Aschaffenburg",
      "registernummer": "HRB 5036",
      "registerart": "HRB",
      "company_name": "Väth GmbH",
      "company_seat": "Hösbach",
      "details": "10.04.2025 (Bekanntmachungsdatum)\n\nBayern Amtsgericht Aschaffenburg HRB 5036\nLöschungsankündigung\n\nVäth GmbH\nGesellschaft mit beschränkter Haftung\nHösbach\n\nDas Registergericht beabsichtigt, die im Handelsregister eingetragene Gesellschaft wegen Vermögenslosigkeit von Amts wegen nach § 394 FamFG zu löschen. Die Frist zur Erhebung eines Widerspruchs ist auf drei Monate festgesetzt."
    },
    {
      "date": "2025-04-10",
      "id": "106145",
      "original_text": "Registerbekanntmachung nach dem Umwandlungsgesetz\nBayern Amtsgericht München HRA 120404\nFacility Management Sebastian Ender e.K. – Germering",
      "type": "Registerbekanntmachung nach dem Umwandlungsgesetz",
      "state": "Bayern",
      "amtsgericht": "Amtsgericht München",
      "registernummer": "HRA 120404",
      "registerart": "HRA",
      "company_name": "Facility Management Sebastian Ender e.K.",
      "company_seat": "Germering",
      "details": "10.04.2025 (Bekanntmachungsdatum)\n\nBayern Amtsgericht München HRA 120404\nRegisterbekanntmachung nach dem Umwandlungsgesetz 09.04.2025 (Eintragungsdatum)\n\nFacility Management Sebastian Ender e.K.\nEinzelkaufmann / Einzelkauffrau\nGermering\n\nDen Gläubigern der an der Ausgliederung beteiligten Rechtsträger ist, wenn sie binnen sechs Monaten nach dem Tag, an dem die Eintragung der Ausgliederung in das Register des Sitzes desjenigen Rechtsträgers, dessen Gläubiger sie sind, nach §§ 125, 19 Abs. 3 UmwG als bekannt gemacht gilt, ihren Anspruch nach Grund und Höhe in Textform anmelden, Sicherheit zu leisten, soweit sie nicht Befriedigung verlangen können. Dieses Recht steht den Gläubigern jedoch nur zu, wenn sie glaubhaft machen, dass durch die Ausgliederung die Erfüllung ihrer Forderung gefährdet wird."
    },
    {
      "date": "2025-04-10",
      "id": "106146",
      "original_text": "Registerbekanntmachung nach dem Umwandlungsgesetz\nBayern Amtsgericht München HRA 97640\nAliens Bergsport - und Arbeitssicherheit e. K. – Otterfing",
      "type": "Registerbekanntmachung nach dem Umwandlungsgesetz",
      "state": "Bayern",
      "amtsgericht": "Amtsgericht München",
      "registernummer": "HRA 97640",
      "registerart": "HRA",
      "company_name": "Aliens Bergsport - und Arbeitssicherheit e. K.",
      "company_seat": "Otterfing",
      "details": "10.04.2025 (Bekanntmachungsdatum)\n\nBayern Amtsgericht München HRA 97640\nRegisterbekanntmachung nach dem Umwandlungsgesetz 09.04.2025 (Eintragungsdatum)\n\nAliens Bergsport - und Arbeitssicherheit e. K.\nEinzelkaufmann / Einzelkauffrau\nOtterfing\n\nDen Gläubigern der an der Ausgliederung beteiligten Rechtsträger ist, wenn sie binnen sechs Monaten nach dem Tag, an dem die Eintragung der Ausgliederung in das Register des Sitzes desjenigen Rechtsträgers, dessen Gläubiger sie sind, nach §§ 125, 19 Abs. 3 UmwG als bekannt gemacht gilt, ihren Anspruch nach Grund und Höhe in Textform anmelden, Sicherheit zu leisten, soweit sie nicht Befriedigung verlangen können. Dieses Recht steht den Gläubigern jedoch nur zu, wenn sie glaubhaft machen, dass durch die Ausgliederung die Erfüllung ihrer Forderung gefährdet wird."
    },
    {
      "date": "2025-04-10",
      "id": "106147",
      "original_text": "Sonstige Registerbekanntmachung\nBayern Amtsgericht Kempten (Allgäu) HRB 4153\nCooper Standard GmbH – Lindau (B)",
      "type": "Sonstige Registerbekanntmachung",
      "state": "Bayern",
      "amtsgericht": "Amtsgericht Kempten (Allgäu)",
      "registernummer": "HRB 4153",
      "registerart": "HRB",
      "company_name": "Cooper Standard GmbH",
      "company_seat": "Lindau (B)",
      "details": "10.04.2025 (Bekanntmachungsdatum)\n\nBayern Amtsgericht Kempten (Allgäu) HRB 4153\nSonstige Registerbekanntmachung 09.04.2025 (Eintragungsdatum)\n\nCooper Standard GmbH\nGesellschaft mit beschränkter Haftung\nLindau (B)\n\nDem Amtsgericht Kempten (Allgäu) -Registergericht- ist eine Liste der Mitglieder des Aufsichtsrats eingereicht worden, § 52 Abs. 3 S. 2 GmbHG."
    },
    {
      "date": "2025-04-10",
      "id": "106148",
      "original_text": "Löschungsankündigung\nBayern Amtsgericht München HRB 273095\nDÖ Bauunternehmen GmbH – München",
      "type": "Löschungsankündigung",
      "state": "Bayern",
      "amtsgericht": "Amtsgericht München",
      "registernummer": "HRB 273095",
      "registerart": "HRB",
      "company_name": "DÖ Bauunternehmen GmbH",
      "company_seat": "München",
      "details": "10.04.2025 (Bekanntmachungsdatum)\n\nBayern Amtsgericht München HRB 273095\nLöschungsankündigung\n\nDÖ Bauunternehmen GmbH\nGesellschaft mit beschränkter Haftung\nMünchen\n\nDas Registergericht beabsichtigt, die im Handelsregister eingetragene Gesellschaft wegen Vermögenslosigkeit von Amts wegen nach § 394 FamFG zu löschen. Die Frist zur Erhebung eines Widerspruchs ist auf drei Monate festgesetzt."
    },
    {
      "date": "2025-04-10",
      "id": "106149",
      "original_text": "Registerbekanntmachung nach dem Umwandlungsgesetz\nBayern Amtsgericht München HRB 209643\nHMG Hotel Management GmbH – München",
      "type": "Registerbekanntmachung nach dem Umwandlungsgesetz",
      "state": "Bayern",
      "amtsgericht": "Amtsgericht München",
      "registernummer": "HRB 209643",
      "registerart": "HRB",
      "company_name": "HMG Hotel Management GmbH",
      "company_seat": "München",
      "details": "10.04.2025 (Bekanntmachungsdatum)\n\nBayern Amtsgericht München HRB 209643\nRegisterbekanntmachung nach dem Umwandlungsgesetz 09.04.2025 (Eintragungsdatum)\n\nHMG Hotel Management GmbH\nGesellschaft mit beschränkter Haftung\nMünchen\n\nDen Gläubigern der an der Verschmelzung beteiligten Rechtsträger ist, wenn sie binnen sechs Monaten nach dem Tag, an dem die Eintragung der Verschmelzung in das Register des Sitzes desjenigen Rechtsträgers, dessen Gläubiger sie sind, nach § 19 Abs. 3 UmwG als bekannt gemacht gilt, ihren Anspruch nach Grund und Höhe in Textform anmelden, Sicherheit zu leisten, soweit sie nicht Befriedigung verlangen können. Dieses Recht steht den Gläubigern jedoch nur zu, wenn sie glaubhaft machen, dass durch die Verschmelzung die Erfüllung ihrer Forderung gefährdet wird."
    },
    {
      "date": "2025-04-10",
      "id": "106150",
      "original_text": "Löschungsankündigung\nBayern Amtsgericht Bayreuth HRA 4519\nlucky loop GmbH & Co. KG – Seybothenreuth",
      "type": "Löschungsankündigung",
      "state": "Bayern",
      "amtsgericht": "Amtsgericht Bayreuth",
      "registernummer": "HRA 4519",
      "registerart": "HRA",
      "company_name": "lucky loop GmbH & Co. KG",
      "company_seat": "Seybothenreuth",
      "details": "10.04.2025 (Bekanntmachungsdatum)\n\nBayern Amtsgericht Bayreuth HRA 4519\nLöschungsankündigung\n\nlucky loop GmbH & Co. KG\nKommanditgesellschaft\nSeybothenreuth\n\nDas Registergericht beabsichtigt, die im Handelsregister eingetragene Firma wegen Vermögenslosigkeit von Amts wegen nach § 394 FamFG zu löschen. Die Frist zur Erhebung eines Widerspruchs ist auf drei Monate festgesetzt."
    },
    {
      "date": "2025-04-10",
      "id": "106151",
      "original_text": "Löschungsankündigung\nBayern Amtsgericht Nürnberg HRB 31957\nS. O. Ausbau GmbH – Nürnberg",
      "type": "Löschungsankündigung",
      "state": "Bayern",
      "amtsgericht": "Amtsgericht Nürnberg",
      "registernummer": "HRB 31957",
      "registerart": "HRB",
      "company_name": "S. O. Ausbau GmbH",
      "company_seat": "Nürnberg",
      "details": "10.04.2025 (Bekanntmachungsdatum)\n\nBayern Amtsgericht Nürnberg HRB 31957\nLöschungsankündigung\n\nS. O. Ausbau GmbH\nGesellschaft mit beschränkter Haftung\nNürnberg\n\nDas Registergericht beabsichtigt, die im Handelsregister eingetragene Gesellschaft wegen Vermögenslosigkeit von Amts wegen nach § 394 FamFG zu löschen. Die Frist zur Erhebung eines Widerspruchs ist auf einen Monat festgesetzt."
    },
    {
      "date": "2025-04-10",
      "id": "106152",
      "original_text": "Sonstige Registerbekanntmachung\nBayern Amtsgericht München HRB 270940\nSolar Tüff DEK GmbH – München",
      "type": "Sonstige Registerbekanntmachung",
      "state": "Bayern",
      "amtsgericht": "Amtsgericht München",
      "registernummer": "HRB 270940",
      "registerart": "HRB",
      "company_name": "Solar Tüff DEK GmbH",
      "company_seat": "München",
      "details": "10.04.2025 (Bekanntmachungsdatum)\n\nBayern Amtsgericht München HRB 270940\nSonstige Registerbekanntmachung 09.04.2025 (Eintragungsdatum)\n\nSolar Tüff DEK GmbH\nGesellschaft mit beschränkter Haftung\nMünchen\n\nDen Gläubigern der Gesellschaft, deren Forderungen begründet worden sind, bevor die Eintragung der Beendigung des Beherrschungs- und Gewinnabführungsvertrages in das Handelsregister nach § 10 des Handelsgesetzbuches als bekanntgemacht gilt, hat der andere Vertragsteil Sicherheit zu leisten, wenn sie sich binnen sechs Monaten nach der Bekanntmachung der Eintragung zu diesem Zweck bei ihm melden."
    },
    {
      "date": "2025-04-10",
      "id": "106153",
      "original_text": "Registerbekanntmachung nach dem Umwandlungsgesetz\nBayern Amtsgericht München HRB 281677\nW3NG GmbH – Bad Tölz",
      "type": "Registerbekanntmachung nach dem Umwandlungsgesetz",
      "state": "Bayern",
      "amtsgericht": "Amtsgericht München",
      "registernummer": "HRB 281677",
      "registerart": "HRB",
      "company_name": "W3NG GmbH",
      "company_seat": "Bad Tölz",
      "details": "10.04.2025 (Bekanntmachungsdatum)\n\nBayern Amtsgericht München HRB 281677\nRegisterbekanntmachung nach dem Umwandlungsgesetz 09.04.2025 (Eintragungsdatum)\n\nW3NG GmbH\nGesellschaft mit beschränkter Haftung\nBad Tölz\n\nDen Gläubigern der an der Verschmelzung beteiligten Rechtsträger ist, wenn sie binnen sechs Monaten nach dem Tag, an dem die Eintragung der Verschmelzung in das Register des Sitzes desjenigen Rechtsträgers, dessen Gläubiger sie sind, nach § 19 Abs. 3 UmwG als bekannt gemacht gilt, ihren Anspruch nach Grund und Höhe in Textform anmelden, Sicherheit zu leisten, soweit sie nicht Befriedigung verlangen können. Dieses Recht steht den Gläubigern jedoch nur zu, wenn sie glaubhaft machen, dass durch die Verschmelzung die Erfüllung ihrer Forderung gefährdet wird."
    },
    {
      "date": "2025-04-10",
      "id": "106154",
      "original_text": "Registerbekanntmachung nach dem Umwandlungsgesetz\nBayern Amtsgericht Fürth HRB 21465\nKerubo GmbH – Burghaslach",
      "type": "Registerbekanntmachung nach dem Umwandlungsgesetz",
      "state": "Bayern",
      "amtsgericht": "Amtsgericht Fürth",
      "registernummer": "HRB 21465",
      "registerart": "HRB",
      "company_name": "Kerubo GmbH",
      "company_seat": "Burghaslach",
      "details": "10.04.2025 (Bekanntmachungsdatum)\n\nBayern Amtsgericht Fürth HRB 21465\nRegisterbekanntmachung nach dem Umwandlungsgesetz 09.04.2025 (Eintragungsdatum)\n\nKerubo GmbH\nGesellschaft mit beschränkter Haftung\nBurghaslach\n\nDen Gläubigern der an der Ausgliederung beteiligten Rechtsträger ist, wenn sie binnen sechs Monaten nach dem Tag, an dem die Eintragung der Ausgliederung in das Register des Sitzes desjenigen Rechtsträgers, dessen Gläubiger sie sind, nach §§ 125, 19 Abs. 3 UmwG als bekannt gemacht gilt, ihren Anspruch nach Grund und Höhe in Textform anmelden, Sicherheit zu leisten, soweit sie nicht Befriedigung verlangen können. Dieses Recht steht den Gläubigern jedoch nur zu, wenn sie glaubhaft machen, dass durch die Ausgliederung die Erfüllung ihrer Forderung gefährdet wird."
    },
    {
      "date": "2025-04-10",
      "id": "106155",
      "original_text": "Löschungsankündigung\nBayern Amtsgericht Aschaffenburg HRB 15074\nusmetals Verwaltungs GmbH – Aschaffenburg",
      "type": "Löschungsankündigung",
      "state": "Bayern",
      "amtsgericht": "Amtsgericht Aschaffenburg",
      "registernummer": "HRB 15074",
      "registerart": "HRB",
      "company_name": "usmetals Verwaltungs GmbH",
      "company_seat": "Aschaffenburg",
      "details": "10.04.2025 (Bekanntmachungsdatum)\n\nBayern Amtsgericht Aschaffenburg HRB 15074\nLöschungsankündigung\n\nusmetals Verwaltungs GmbH\nGesellschaft mit beschränkter Haftung\nAschaffenburg\n\nDas Registergericht beabsichtigt, die im Handelsregister eingetragene Gesellschaft wegen Vermögenslosigkeit von Amts wegen nach § 394 FamFG zu löschen. Die Frist zur Erhebung eines Widerspruchs ist auf drei Monate festgesetzt."
    },
    {
      "date": "2025-04-10",
      "id": "106156",
      "original_text": "Löschungsankündigung\nBayern Amtsgericht München HRB 239468\nUNIVERS8 GmbH – München",
      "type": "Löschungsankündigung",
      "state": "Bayern",
      "amtsgericht": "Amtsgericht München",
      "registernummer": "HRB 239468",
      "registerart": "HRB",
      "company_name": "UNIVERS8 GmbH",
      "company_seat": "München",
      "details": "10.04.2025 (Bekanntmachungsdatum)\n\nBayern Amtsgericht München HRB 239468\nLöschungsankündigung\n\nUNIVERS8 GmbH\nGesellschaft mit beschränkter Haftung\nMünchen\n\nDas Registergericht beabsichtigt, die im Handelsregister eingetragene Gesellschaft wegen Vermögenslosigkeit von Amts wegen nach § 394 FamFG zu löschen. Die Frist zur Erhebung eines Widerspruchs ist auf drei Monate festgesetzt."
    },
    {
      "date": "2025-04-10",
      "id": "106157",
      "original_text": "Registerbekanntmachung nach dem Umwandlungsgesetz\nBayern Amtsgericht München HRB 209493\nDaschner Manufaktur GmbH – Murnau a.Staffelsee",
      "type": "Registerbekanntmachung nach dem Umwandlungsgesetz",
      "state": "Bayern",
      "amtsgericht": "Amtsgericht München",
      "registernummer": "HRB 209493",
      "registerart": "HRB",
      "company_name": "Daschner Manufaktur GmbH",
      "company_seat": "Murnau a.Staffelsee",
      "details": "10.04.2025 (Bekanntmachungsdatum)\n\nBayern Amtsgericht München HRB 209493\nRegisterbekanntmachung nach dem Umwandlungsgesetz 09.04.2025 (Eintragungsdatum)\n\nDaschner Manufaktur GmbH\nGesellschaft mit beschränkter Haftung\nMurnau a.Staffelsee\n\nDen Gläubigern der an der Verschmelzung beteiligten Rechtsträger ist, wenn sie binnen sechs Monaten nach dem Tag, an dem die Eintragung der Verschmelzung in das Register des Sitzes desjenigen Rechtsträgers, dessen Gläubiger sie sind, nach § 19 Abs. 3 UmwG als bekannt gemacht gilt, ihren Anspruch nach Grund und Höhe in Textform anmelden, Sicherheit zu leisten, soweit sie nicht Befriedigung verlangen können. Dieses Recht steht den Gläubigern jedoch nur zu, wenn sie glaubhaft machen, dass durch die Verschmelzung die Erfüllung ihrer Forderung gefährdet wird."
    },
    {
      "date": "2025-04-10",
      "id": "106158",
      "original_text": "Registerbekanntmachung nach dem Umwandlungsgesetz\nBayern Amtsgericht Coburg VR 10187\nSchwimmverein Kronach e.V. – Kronach",
      "type": "Registerbekanntmachung nach dem Umwandlungsgesetz",
      "state": "Bayern",
      "amtsgericht": "Amtsgericht Coburg",
      "registernummer": "VR 10187",
      "registerart": "VR",
      "company_name": "Schwimmverein Kronach e.V.",
      "company_seat": "Kronach",
      "details": "10.04.2025 (Bekanntmachungsdatum)\n\nBayern Amtsgericht Coburg VR 10187\nRegisterbekanntmachung nach dem Umwandlungsgesetz 09.04.2025 (Eintragungsdatum)\n\nSchwimmverein Kronach e.V.\neingetragener Verein\nKronach\n\nDen Gläubigern der an der Verschmelzung beteiligten Rechtsträger ist, wenn sie binnen sechs Monaten nach dem Tag, an dem die Eintragung der Verschmelzung in das Register des Sitzes desjenigen Rechtsträgers, dessen Gläubiger sie sind, nach § 19 Abs. 3 UmwG als bekannt gemacht gilt, ihren Anspruch nach Grund und Höhe in Textform anmelden, Sicherheit zu leisten, soweit sie nicht Befriedigung verlangen können. Dieses Recht steht den Gläubigern jedoch nur zu, wenn sie glaubhaft machen, dass durch die Verschmelzung die Erfüllung ihrer Forderung gefährdet wird."
    },
    {
      "date": "2025-04-10",
      "id": "106159",
      "original_text": "Einreichung neuer Dokumente\nBayern Amtsgericht Würzburg HRB 9175\nFürstlich Castell'sche Bank, Credit-Casse Aktiengesellschaft – Castell",
      "type": "Einreichung neuer Dokumente",
      "state": "Bayern",
      "amtsgericht": "Amtsgericht Würzburg",
      "registernummer": "HRB 9175",
      "registerart": "HRB",
      "company_name": "Fürstlich Castell'sche Bank, Credit-Casse Aktiengesellschaft",
      "company_seat": "Castell",
      "details": "10.04.2025 (Bekanntmachungsdatum)\n\nBayern Amtsgericht Würzburg HRB 9175\nEinreichung neuer Dokumente 02.04.2025 (Eintragungsdatum)\n\nFürstlich Castell'sche Bank, Credit-Casse Aktiengesellschaft\nAktiengesellschaft\nCastell\n\nDem Amtsgericht Würzburg -Registergericht- ist eine Liste der Mitglieder des Aufsichtsrats eingereicht worden, § 106 AktG."
    },
    {
      "date": "2025-04-10",
      "id": "106160",
      "original_text": "Registerbekanntmachung nach dem Umwandlungsgesetz\nBayern Amtsgericht München HRB 289198\nAVB Holding GmbH – Zorneding",
      "type": "Registerbekanntmachung nach dem Umwandlungsgesetz",
      "state": "Bayern",
      "amtsgericht": "Amtsgericht München",
      "registernummer": "HRB 289198",
      "registerart": "HRB",
      "company_name": "AVB Holding GmbH",
      "company_seat": "Zorneding",
      "details": "10.04.2025 (Bekanntmachungsdatum)\n\nBayern Amtsgericht München HRB 289198\nRegisterbekanntmachung nach dem Umwandlungsgesetz 09.04.2025 (Eintragungsdatum)\n\nAVB Holding GmbH\nGesellschaft mit beschränkter Haftung\nZorneding\n\nDen Gläubigern der an der Verschmelzung beteiligten Rechtsträger ist, wenn sie binnen sechs Monaten nach dem Tag, an dem die Eintragung der Verschmelzung in das Register des Sitzes desjenigen Rechtsträgers, dessen Gläubiger sie sind, nach § 19 Abs. 3 UmwG als bekannt gemacht gilt, ihren Anspruch nach Grund und Höhe in Textform anmelden, Sicherheit zu leisten, soweit sie nicht Befriedigung verlangen können. Dieses Recht steht den Gläubigern jedoch nur zu, wenn sie glaubhaft machen, dass durch die Verschmelzung die Erfüllung ihrer Forderung gefährdet wird."
    },
    {
      "date": "2025-04-10",
      "id": "106161",
      "original_text": "Sonstige Registerbekanntmachung\nBerlin Amtsgericht Berlin (Charlottenburg) HRB 185964\nSocial Enterprise Holding Berlin AG – Berlin",
      "type": "Sonstige Registerbekanntmachung",
      "state": "Berlin",
      "amtsgericht": "Amtsgericht Berlin (Charlottenburg)",
      "registernummer": "HRB 185964",
      "registerart": "HRB",
      "company_name": "Social Enterprise Holding Berlin AG",
      "company_seat": "Berlin",
      "details": "10.04.2025 (Bekanntmachungsdatum)\n\nBerlin Amtsgericht Berlin (Charlottenburg) HRB 185964\nSonstige Registerbekanntmachung 09.04.2025 (Eintragungsdatum)\n\nSocial Enterprise Holding Berlin AG\nAktiengesellschaft\nBerlin\n\nAls nicht eingetragen wird veröffentlicht:\n\nDer andere Vertragsteil hat den Gläubigern dieses Rechtsträgers, deren Forderungen begründet worden sind, bevor die Eintragung der Beendigung dieses Vertrages in das Handelsregister nach § 10 des Handelsgesetzbuches als bekannt gemacht gilt, Sicherheit zu leisten, wenn sie sich binnen sechs Monaten nach der Bekanntmachung der Eintragung zu diesem Zweck bei ihm melden. Dieses Recht steht den Gläubigern nicht zu, die im Fall des Insolvenzverfahrens ein Recht auf vorzugsweise Befriedigung aus der Deckungsmasse haben, die nach gesetzlicher Vorschrift zu ihrem Schutz errichtet und staatlich überwacht ist."
    },
    {
      "date": "2025-04-10",
      "id": "106162",
      "original_text": "Registerbekanntmachung nach dem Umwandlungsgesetz\nBerlin Amtsgericht Berlin (Charlottenburg) HRB 185964\nSocial Enterprise Holding Berlin AG – Berlin",
      "type": "Registerbekanntmachung nach dem Umwandlungsgesetz",
      "state": "Berlin",
      "amtsgericht": "Amtsgericht Berlin (Charlottenburg)",
      "registernummer": "HRB 185964",
      "registerart": "HRB",
      "company_name": "Social Enterprise Holding Berlin AG",
      "company_seat": "Berlin",
      "details": "10.04.2025 (Bekanntmachungsdatum)\n\nBerlin Amtsgericht Berlin (Charlottenburg) HRB 185964\nRegisterbekanntmachung nach dem Umwandlungsgesetz 09.04.2025 (Eintragungsdatum)\n\nSocial Enterprise Holding Berlin AG\nAktiengesellschaft\nBerlin\n\nZu Eintragungsnummer 12 vom 09.04.2025 wird als nicht eingetragen veröffentlicht:\n\nDen Gläubigern ist, wenn sie binnen sechs Monaten nach dem Tag, an dem die Eintragung der Umwandlung als bekannt gemacht gilt, ihren Anspruch nach Grund und Höhe schriftlich anmelden, Sicherheit zu leisten, soweit sie nicht Befriedigung verlangen können. Dieses Recht steht den Gläubigern jedoch nur zu, wenn sie glaubhaft machen, dass durch die Umwandlung die Erfüllung ihrer Forderung gefährdet wird. Das Recht, Sicherheitsleistung zu verlangen, steht Gläubigern nicht zu, die im Falle der Insolvenz ein Recht auf vorzugsweise Befriedigung aus einer Deckungsmasse haben, die nach gesetzlicher Vorschrift zu ihrem Schutz errichtet und staatlich überwacht ist."
    },
    {
      "date": "2025-04-10",
      "id": "106163",
      "original_text": "Einreichung neuer Dokumente\nBaden-Württemberg Amtsgericht Stuttgart HRB 205323\nWüstenrot Bausparkasse Aktiengesellschaft – Kornwestheim",
      "type": "Einreichung neuer Dokumente",
      "state": "Baden-Württemberg",
      "amtsgericht": "Amtsgericht Stuttgart",
      "registernummer": "HRB 205323",
      "registerart": "HRB",
      "company_name": "Wüstenrot Bausparkasse Aktiengesellschaft",
      "company_seat": "Kornwestheim",
      "details": "10.04.2025 (Bekanntmachungsdatum)\n\nBaden-Württemberg Amtsgericht Stuttgart HRB 205323\nEinreichung neuer Dokumente 10.04.2025 (Eintragungsdatum)\n\nWüstenrot Bausparkasse Aktiengesellschaft\nAktiengesellschaft\nKornwestheim\n\nDie Gesellschaft hat am 08.04.2025 die Liste über die Zusammensetzung des Aufsichtsrats zum Handelsregister eingereicht."
    },
    {
      "date": "2025-04-10",
      "id": "106164",
      "original_text": "Einreichung neuer Dokumente\nBaden-Württemberg Amtsgericht Freiburg HRB 6021\nKern Aktiengesellschaft – Freiburg im Breisgau",
      "type": "Einreichung neuer Dokumente",
      "state": "Baden-Württemberg",
      "amtsgericht": "Amtsgericht Freiburg",
      "registernummer": "HRB 6021",
      "registerart": "HRB",
      "company_name": "Kern Aktiengesellschaft",
      "company_seat": "Freiburg im Breisgau",
      "details": "10.04.2025 (Bekanntmachungsdatum)\n\nBaden-Württemberg Amtsgericht Freiburg HRB 6021\nEinreichung neuer Dokumente\n\nKern Aktiengesellschaft\nAktiengesellschaft\nFreiburg im Breisgau\n\nDie Gesellschaft hat am 08.04.2025 die Liste über die Zusammensetzung des Aufsichtsrats zum Handelsregister eingereicht."
    },
    {
      "date": "2025-04-10",
      "id": "106165",
      "original_text": "Löschungsankündigung\nBerlin Amtsgericht Berlin (Charlottenburg) HRB 187329\nFEL Bau und Investment GmbH – Berlin",
      "type": "Löschungsankündigung",
      "state": "Berlin",
      "amtsgericht": "Amtsgericht Berlin (Charlottenburg)",
      "registernummer": "HRB 187329",
      "registerart": "HRB",
      "company_name": "FEL Bau und Investment GmbH",
      "company_seat": "Berlin",
      "details": "10.04.2025 (Bekanntmachungsdatum)\n\nBerlin Amtsgericht Berlin (Charlottenburg) HRB 187329\nLöschungsankündigung\n\nFEL Bau und Investment GmbH\nGesellschaft mit beschränkter Haftung\nBerlin\n\nBei der nachstehenden Gesellschaft wird das Amtslöschungsverfahren gemäß § 394 FamFG eingeleitet. Widerspruchsfrist 6 Wochen"
    },
    {
      "date": "2025-04-10",
      "id": "106166",
      "original_text": "Löschungsankündigung\nBaden-Württemberg Amtsgericht Freiburg HRB 722869\nRTD Services Unternehmergesellschaft (haftungsbeschränkt) – Bräunlingen",
      "type": "Löschungsankündigung",
      "state": "Baden-Württemberg",
      "amtsgericht": "Amtsgericht Freiburg",
      "registernummer": "HRB 722869",
      "registerart": "HRB",
      "company_name": "RTD Services Unternehmergesellschaft (haftungsbeschränkt)",
      "company_seat": "Bräunlingen",
      "details": "10.04.2025 (Bekanntmachungsdatum)\n\nBaden-Württemberg Amtsgericht Freiburg HRB 722869\nLöschungsankündigung\n\nRTD Services Unternehmergesellschaft (haftungsbeschränkt)\nGesellschaft mit beschränkter Haftung\nBräunlingen\n\nDas Gericht beabsichtigt, die Gesellschaft wegen Vermögenslosigkeit im Handelsregister von Amts wegen nach § 394 FamFG zu löschen. Die Frist zur Geltendmachung eines Widerspruchs gegen die beabsichtigte Löschung ist auf einen Monat ab Veröffentlichung bestimmt."
    },
    {
      "date": "2025-04-10",
      "id": "106167",
      "original_text": "Einreichung neuer Dokumente\nBerlin Amtsgericht Berlin (Charlottenburg) HRB 56530\nBerlin Hyp AG – Berlin",
      "type": "Einreichung neuer Dokumente",
      "state": "Berlin",
      "amtsgericht": "Amtsgericht Berlin (Charlottenburg)",
      "registernummer": "HRB 56530",
      "registerart": "HRB",
      "company_name": "Berlin Hyp AG",
      "company_seat": "Berlin",
      "details": "10.04.2025 (Bekanntmachungsdatum)\n\nBerlin Amtsgericht Berlin (Charlottenburg) HRB 56530\nEinreichung neuer Dokumente\n\nBerlin Hyp AG\nAktiengesellschaft\nBerlin\n\nAls nicht eingetragen wird veröffentlicht: Der Entwurf eines Abspaltungs- und Übernahmevertrages zwischen der Berlin Hyp AG als übertragendem Rechtsträger und der Landesbank Baden-Württemberg als übernehmendem Rechtsträger ist zum Handelsregister der Berlin Hyp AG beim Amtsgericht Charlottenburg, zur Akte HRB 56530 B, eingereicht worden."
    },
    {
      "date": "2025-04-10",
      "id": "106168",
      "original_text": "Registerbekanntmachung nach dem Umwandlungsgesetz\nBaden-Württemberg Amtsgericht Freiburg HRB 725071\nGesundheitsimmobilienverwaltung GIV 14 GmbH – Markdorf",
      "type": "Registerbekanntmachung nach dem Umwandlungsgesetz",
      "state": "Baden-Württemberg",
      "amtsgericht": "Amtsgericht Freiburg",
      "registernummer": "HRB 725071",
      "registerart": "HRB",
      "company_name": "Gesundheitsimmobilienverwaltung GIV 14 GmbH",
      "company_seat": "Markdorf",
      "details": "10.04.2025 (Bekanntmachungsdatum)\n\nBaden-Württemberg Amtsgericht Freiburg HRB 725071\nRegisterbekanntmachung nach dem Umwandlungsgesetz 10.04.2025 (Eintragungsdatum)\n\nGesundheitsimmobilienverwaltung GIV 14 GmbH\nGesellschaft mit beschränkter Haftung\nMarkdorf\n\nDen Gläubigern der an der Verschmelzung beteiligten Rechtsträger ist, wenn sie binnen sechs Monaten nach dem Tag, an dem die Eintragung der Verschmelzung in das Register des Sitzes desjenigen Rechtsträgers, dessen Gläubiger sie sind, nach § 19 Abs. 3 UmwG als bekanntgemacht gilt, ihren Anspruch nach Grund und Höhe schriftlich anmelden, Sicherheit zu leisten, soweit sie nicht Befriedigung verlangen können. Dieses Recht steht den Gläubigern jedoch nur zu, wenn sie glaubhaft machen, dass durch die Verschmelzung die Erfüllung ihrer Forderung gefährdet wird."
    },
    {
      "date": "2025-04-10",
      "id": "106169",
      "original_text": "Registerbekanntmachung nach dem Umwandlungsgesetz\nSchleswig-Holstein Amtsgericht Flensburg HRA 11483\nFriedrich Edinger Photovoltaik e.K. – Sylt",
      "type": "Registerbekanntmachung nach dem Umwandlungsgesetz",
      "state": "Schleswig-Holstein",
      "amtsgericht": "Amtsgericht Flensburg",
      "registernummer": "HRA 11483",
      "registerart": "HRA",
      "company_name": "Friedrich Edinger Photovoltaik e.K.",
      "company_seat": "Sylt",
      "details": "10.04.2025 (Bekanntmachungsdatum)\n\nSchleswig-Holstein Amtsgericht Flensburg HRA 11483\nRegisterbekanntmachung nach dem Umwandlungsgesetz 10.04.2025 (Eintragungsdatum)\n\nFriedrich Edinger Photovoltaik e.K.\nEinzelkaufmann / Einzelkauffrau\nSylt\n\nZu Eintragungsnummer 2 vom 10.04.2025 wird als nicht eingetragen veröffentlicht:\nDen Gläubigern der an der Spaltung beteiligten Rechtsträger ist, wenn sie binnen sechs Monaten nach dem Tag, an dem die Eintragung der Spaltung in das Register des Sitzes desjenigen Rechtsträgers, dessen Gläubiger sie sind, als bekannt gemacht gilt, ihren Anspruch nach Grund und Höhe in Textform anmelden, Sicherheit zu leisten, soweit sie nicht Befriedigung verlangen können. Dieses Recht steht den Gläubigern jedoch nur zu, wenn sie glaubhaft machen, dass durch die Spaltung die Erfüllung ihrer Forderung gefährdet wird."
    },
    {
      "date": "2025-04-10",
      "id": "106170",
      "original_text": "Registerbekanntmachung nach dem Umwandlungsgesetz\nBaden-Württemberg Amtsgericht Stuttgart HRA 480786\nKautzmann GmbH & Co. KG Energie- und Handelsgesellschaft – Schenkenzell",
      "type": "Registerbekanntmachung nach dem Umwandlungsgesetz",
      "state": "Baden-Württemberg",
      "amtsgericht": "Amtsgericht Stuttgart",
      "registernummer": "HRA 480786",
      "registerart": "HRA",
      "company_name": "Kautzmann GmbH & Co. KG Energie- und Handelsgesellschaft",
      "company_seat": "Schenkenzell",
      "details": "10.04.2025 (Bekanntmachungsdatum)\n\nBaden-Württemberg Amtsgericht Stuttgart HRA 480786\nRegisterbekanntmachung nach dem Umwandlungsgesetz 10.04.2025 (Eintragungsdatum)\n\nKautzmann GmbH & Co. KG Energie- und Handelsgesellschaft\nKommanditgesellschaft\nSchenkenzell\n\nAls nicht eingetragen wird bekanntgemacht:\nDen Gläubigern der an der Verschmelzung beteiligten Rechtsträger ist, wenn sie binnen sechs Monaten nach dem Tag, an dem die Eintragung der Verschmelzung in das Register des Sitzes desjenigen Rechtsträgers, dessen Gläubiger sie sind, nach § 19 Abs. 3 UmwG als bekanntgemacht gilt, ihren Anspruch nach Grund und Höhe schriftlich anmelden, Sicherheit zu leisten, soweit sie nicht Befriedigung verlangen können. Dieses Recht steht den Gläubigern jedoch nur zu, wenn sie glaubhaft machen, dass durch die Verschmelzung die Erfüllung ihrer Forderung gefährdet wird."
    },
    {
      "date": "2025-04-10",
      "id": "106171",
      "original_text": "Registerbekanntmachung nach dem Umwandlungsgesetz\nHamburg Amtsgericht Hamburg HRB 154928\nePrivacycert GmbH – Hamburg",
      "type": "Registerbekanntmachung nach dem Umwandlungsgesetz",
      "state": "Hamburg",
      "amtsgericht": "Amtsgericht Hamburg",
      "registernummer": "HRB 154928",
      "registerart": "HRB",
      "company_name": "ePrivacycert GmbH",
      "company_seat": "Hamburg",
      "details": "10.04.2025 (Bekanntmachungsdatum)\n\nHamburg Amtsgericht Hamburg HRB 154928\nRegisterbekanntmachung nach dem Umwandlungsgesetz 10.04.2025 (Eintragungsdatum)\n\nePrivacycert GmbH\nGesellschaft mit beschränkter Haftung\nHamburg\n\nAls nicht eingetragen wird bekannt gemacht:\nDen Gläubigern der an der Verschmelzung beteiligten Gesellschaften ist, wenn sie binnen sechs Monaten nach dem Tag, an dem die Eintragung der Verschmelzung in das Register des Sitzes desjenigen Rechtsträgers, dessen Gläubiger sie sind, nach § 19 Absatz 3 UmwG als bekannt gemacht gilt, ihren Anspruch nach Grund und Höhe schriftlich anmelden, Sicherheit zu leisten, soweit sie nicht Befriedigung verlangen können. Dieses Recht steht den Gläubigern jedoch nur zu, wenn sie glaubhaft machen, dass durch die Verschmelzung die Erfüllung ihrer Forderung gefährdet wird."
    },
    {
      "date": "2025-04-10",
      "id": "106172",
      "original_text": "Registerbekanntmachung nach dem Umwandlungsgesetz\nHamburg Amtsgericht Hamburg HRB 154824\nePrivacy Holding GmbH – Hamburg",
      "type": "Registerbekanntmachung nach dem Umwandlungsgesetz",
      "state": "Hamburg",
      "amtsgericht": "Amtsgericht Hamburg",
      "registernummer": "HRB 154824",
      "registerart": "HRB",
      "company_name": "ePrivacy Holding GmbH",
      "company_seat": "Hamburg",
      "details": "10.04.2025 (Bekanntmachungsdatum)\n\nHamburg Amtsgericht Hamburg HRB 154824\nRegisterbekanntmachung nach dem Umwandlungsgesetz 10.04.2025 (Eintragungsdatum)\n\nePrivacy Holding GmbH\nGesellschaft mit beschränkter Haftung\nHamburg\n\nAls nicht eingetragen wird bekannt gemacht:\nDen Gläubigern der an der Verschmelzung beteiligten Gesellschaften ist, wenn sie binnen sechs Monaten nach dem Tag, an dem die Eintragung der Verschmelzung in das Register des Sitzes desjenigen Rechtsträgers, dessen Gläubiger sie sind, nach § 19 Absatz 3 UmwG als bekannt gemacht gilt, ihren Anspruch nach Grund und Höhe schriftlich anmelden, Sicherheit zu leisten, soweit sie nicht Befriedigung verlangen können. Dieses Recht steht den Gläubigern jedoch nur zu, wenn sie glaubhaft machen, dass durch die Verschmelzung die Erfüllung ihrer Forderung gefährdet wird."
    },
    {
      "date": "2025-04-10",
      "id": "106173",
      "original_text": "Registerbekanntmachung nach dem Umwandlungsgesetz\nBaden-Württemberg Amtsgericht Stuttgart GsR 2074\nMüller & Seidenspinner eGbR – Stuttgart",
      "type": "Registerbekanntmachung nach dem Umwandlungsgesetz",
      "state": "Baden-Württemberg",
      "amtsgericht": "Amtsgericht Stuttgart",
      "registernummer": "GsR 2074",
      "registerart": "GsR",
      "company_name": "Müller & Seidenspinner eGbR",
      "company_seat": "Stuttgart",
      "details": "10.04.2025 (Bekanntmachungsdatum)\n\nBaden-Württemberg Amtsgericht Stuttgart GsR 2074\nRegisterbekanntmachung nach dem Umwandlungsgesetz 10.04.2025 (Eintragungsdatum)\n\nMüller & Seidenspinner eGbR\nGesellschaft bürgerlichen Rechts\nStuttgart\n\nDen Gläubigern des an dem Formwechsel beteiligten Rechtsträgers ist, wenn sie binnen sechs Monaten nach dem Tag, an dem die Eintragung des Formwechsels in das Register des Sitzes desjenigen Rechtsträgers, dessen Gläubiger sie sind, nach § 19 Abs. 3 UmwG als bekanntgemacht gilt, ihren Anspruch nach Grund und Höhe schriftlich anmelden, Sicherheit zu leisten, soweit sie nicht Befriedigung verlangen können. Dieses Recht steht den Gläubigern jedoch nur zu, wenn sie glaubhaft machen, dass durch den Formwechsel die Erfüllung ihrer Forderung gefährdet wird."
    },
    {
      "date": "2025-04-10",
      "id": "106174",
      "original_text": "Einreichung neuer Dokumente\nBaden-Württemberg Amtsgericht Mannheim HRB 103751\nDeutsche Bausparkasse Badenia Aktiengesellschaft – Karlsruhe",
      "type": "Einreichung neuer Dokumente",
      "state": "Baden-Württemberg",
      "amtsgericht": "Amtsgericht Mannheim",
      "registernummer": "HRB 103751",
      "registerart": "HRB",
      "company_name": "Deutsche Bausparkasse Badenia Aktiengesellschaft",
      "company_seat": "Karlsruhe",
      "details": "10.04.2025 (Bekanntmachungsdatum)\n\nBaden-Württemberg Amtsgericht Mannheim HRB 103751\nEinreichung neuer Dokumente\n\nDeutsche Bausparkasse Badenia Aktiengesellschaft\nAktiengesellschaft\nKarlsruhe\n\nDie Gesellschaft hat am 09.04.2025 die Liste über die Zusammensetzung des Aufsichtsrats zum Handelsregister eingereicht."
    },
    {
      "date": "2025-04-10",
      "id": "106175",
      "original_text": "Einreichung neuer Dokumente\nBerlin Amtsgericht Berlin (Charlottenburg) HRB 180167\nMähren AG – Berlin",
      "type": "Einreichung neuer Dokumente",
      "state": "Berlin",
      "amtsgericht": "Amtsgericht Berlin (Charlottenburg)",
      "registernummer": "HRB 180167",
      "registerart": "HRB",
      "company_name": "Mähren AG",
      "company_seat": "Berlin",
      "details": "10.04.2025 (Bekanntmachungsdatum)\n\nBerlin Amtsgericht Berlin (Charlottenburg) HRB 180167\nEinreichung neuer Dokumente\n\nMähren AG\nAktiengesellschaft\nBerlin\n\nAls nicht eingetragen wird veröffentlicht:Den Gläubigern ist, wenn sie binnen sechs Monaten nach dem Tag, an dem die Eintragung der Umwandlung als bekannt gemacht gilt, ihren Anspruch nach Grund und Höhe schriftlich anmelden, Sicherheit zu leisten, soweit sie nicht Befriedigung verlangen können. Dieses Recht steht den Gläubigern jedoch nur zu, wenn sie glaubhaft machen, dass durch die Umwandlung die Erfüllung ihrer Forderung gefährdet wird. Das Recht, Sicherheitsleistung zu verlangen, steht Gläubigern nicht zu, die im Falle der Insolvenz ein Recht auf vorzugsweise Befriedigung aus einer Deckungsmasse haben, die nach gesetzlicher Vorschrift zu ihrem Schutz errichtet und staatlich überwacht ist."
    },
    {
      "date": "2025-04-10",
      "id": "106176",
      "original_text": "Sonstige Registerbekanntmachung\nBerlin Amtsgericht Berlin (Charlottenburg) HRB 146528\nUmber Solandra Property GmbH – Berlin",
      "type": "Sonstige Registerbekanntmachung",
      "state": "Berlin",
      "amtsgericht": "Amtsgericht Berlin (Charlottenburg)",
      "registernummer": "HRB 146528",
      "registerart": "HRB",
      "company_name": "Umber Solandra Property GmbH",
      "company_seat": "Berlin",
      "details": "10.04.2025 (Bekanntmachungsdatum)\n\nBerlin Amtsgericht Berlin (Charlottenburg) HRB 146528\nSonstige Registerbekanntmachung\n\nUmber Solandra Property GmbH\nGesellschaft mit beschränkter Haftung\nBerlin\n\nAls nicht eingetragen wird veröffentlicht: Der andere Vertragsteil hat den Gläubigern dieses Rechtsträgers, deren Forderungen begründet worden sind, bevor die Eintragung der Beendigung dieses Vertrages in das Handelsregister nach § 10 des Handelsgesetzbuches als bekannt gemacht gilt, Sicherheit zu leisten, wenn sie sich binnen sechs Monaten nach der Bekanntmachung der Eintragung zu diesem Zweck bei ihm melden. Dieses Recht steht den Gläubigern nicht zu, die im Fall des Insolvenzverfahrens ein Recht auf vorzugsweise Befriedigung aus der Deckungsmasse haben, die nach gesetzlicher Vorschrift zu ihrem Schutz errichtet und staatlich überwacht ist."
    },
    {
      "date": "2025-04-10",
      "id": "106177",
      "original_text": "Registerbekanntmachung nach dem Umwandlungsgesetz\nBaden-Württemberg Amtsgericht Stuttgart HRB 778311\nW + P Gesellschaft für Projektrealisierung mbH – Stuttgart",
      "type": "Registerbekanntmachung nach dem Umwandlungsgesetz",
      "state": "Baden-Württemberg",
      "amtsgericht": "Amtsgericht Stuttgart",
      "registernummer": "HRB 778311",
      "registerart": "HRB",
      "company_name": "W + P Gesellschaft für Projektrealisierung mbH",
      "company_seat": "Stuttgart",
      "details": "10.04.2025 (Bekanntmachungsdatum)\n\nBaden-Württemberg Amtsgericht Stuttgart HRB 778311\nRegisterbekanntmachung nach dem Umwandlungsgesetz 10.04.2025 (Eintragungsdatum)\n\nW + P Gesellschaft für Projektrealisierung mbH\nGesellschaft mit beschränkter Haftung\nStuttgart\n\nAls nicht eingetragen wird bekanntgemacht:\nDen Gläubigern der an der Verschmelzung beteiligten Rechtsträger ist, wenn sie binnen sechs Monaten nach dem Tag, an dem die Eintragung der Verschmelzung in das Register des Sitzes desjenigen Rechtsträgers, dessen Gläubiger sie sind, nach § 19 Abs. 3 UmwG als bekanntgemacht gilt, ihren Anspruch nach Grund und Höhe schriftlich anmelden, Sicherheit zu leisten, soweit sie nicht Befriedigung verlangen können. Dieses Recht steht den Gläubigern jedoch nur zu, wenn sie glaubhaft machen, dass durch die Verschmelzung die Erfüllung ihrer Forderung gefährdet wird."
    },
    {
      "date": "2025-04-10",
      "id": "106178",
      "original_text": "Löschungsankündigung\nBerlin Amtsgericht Berlin (Charlottenburg) HRA 51519\nLouise-Henriette-Steg GmbH & Co. KG – Berlin",
      "type": "Löschungsankündigung",
      "state": "Berlin",
      "amtsgericht": "Amtsgericht Berlin (Charlottenburg)",
      "registernummer": "HRA 51519",
      "registerart": "HRA",
      "company_name": "Louise-Henriette-Steg GmbH & Co. KG",
      "company_seat": "Berlin",
      "details": "10.04.2025 (Bekanntmachungsdatum)\n\nBerlin Amtsgericht Berlin (Charlottenburg) HRA 51519\nLöschungsankündigung\n\nLouise-Henriette-Steg GmbH & Co. KG\nKommanditgesellschaft\nBerlin\n\nBei dem nachstehenden Unternehmen / der nachstehenden Gesellschaft wird das Amtslöschungsverfahren gemäß § 31 Abs. 2 HGB eingeleitet. Widerspruchsfrist 2 Monate"
    },
    {
      "date": "2025-04-10",
      "id": "106179",
      "original_text": "Löschungsankündigung\nBaden-Württemberg Amtsgericht Mannheim HRB 728257\nAutovermietung Yes UG (haftungsbeschränkt) – Karlsruhe",
      "type": "Löschungsankündigung",
      "state": "Baden-Württemberg",
      "amtsgericht": "Amtsgericht Mannheim",
      "registernummer": "HRB 728257",
      "registerart": "HRB",
      "company_name": "Autovermietung Yes UG (haftungsbeschränkt)",
      "company_seat": "Karlsruhe",
      "details": "10.04.2025 (Bekanntmachungsdatum)\n\nBaden-Württemberg Amtsgericht Mannheim HRB 728257\nLöschungsankündigung\n\nAutovermietung Yes UG (haftungsbeschränkt)\nGesellschaft mit beschränkter Haftung\nKarlsruhe\n\nDas Gericht beabsichtigt, die Gesellschaft wegen Vermögenslosigkeit im Handelsregister von Amts wegen nach § 394 FamFG zu löschen. Die Frist zur Geltendmachung eines Widerspruchs gegen die beabsichtigte Löschung ist auf einen Monat ab Veröffentlichung bestimmt."
    },
    {
      "date": "2025-04-10",
      "id": "106180",
      "original_text": "Registerbekanntmachung nach dem Umwandlungsgesetz\nBaden-Württemberg Amtsgericht Stuttgart HRB 795763\nDeep Blue Solar GmbH – Stuttgart",
      "type": "Registerbekanntmachung nach dem Umwandlungsgesetz",
      "state": "Baden-Württemberg",
      "amtsgericht": "Amtsgericht Stuttgart",
      "registernummer": "HRB 795763",
      "registerart": "HRB",
      "company_name": "Deep Blue Solar GmbH",
      "company_seat": "Stuttgart",
      "details": "10.04.2025 (Bekanntmachungsdatum)\n\nBaden-Württemberg Amtsgericht Stuttgart HRB 795763\nRegisterbekanntmachung nach dem Umwandlungsgesetz 10.04.2025 (Eintragungsdatum)\n\nDeep Blue Solar GmbH\nGesellschaft mit beschränkter Haftung\nStuttgart\n\nDen Gläubigern der an der Verschmelzung beteiligten Rechtsträger ist, wenn sie binnen sechs Monaten nach dem Tag, an dem die Eintragung der Verschmelzung in das Register des Sitzes desjenigen Rechtsträgers, dessen Gläubiger sie sind, nach § 19 Abs. 3 UmwG als bekanntgemacht gilt, ihren Anspruch nach Grund und Höhe schriftlich anmelden, Sicherheit zu leisten, soweit sie nicht Befriedigung verlangen können. Dieses Recht steht den Gläubigern jedoch nur zu, wenn sie glaubhaft machen, dass durch die Verschmelzung die Erfüllung ihrer Forderung gefährdet wird."
    },
    {
      "date": "2025-04-10",
      "id": "106181",
      "original_text": "Löschungsankündigung\nSaarland Amtsgericht Saarbrücken HRB 106552\nTourisfair UG (haftungsbeschränkt) – Saarbrücken",
      "type": "Löschungsankündigung",
      "state": "Saarland",
      "amtsgericht": "Amtsgericht Saarbrücken",
      "registernummer": "HRB 106552",
      "registerart": "HRB",
      "company_name": "Tourisfair UG (haftungsbeschränkt)",
      "company_seat": "Saarbrücken",
      "details": "10.04.2025 (Bekanntmachungsdatum)\n\nSaarland Amtsgericht Saarbrücken HRB 106552\nLöschungsankündigung\n\nTourisfair UG (haftungsbeschränkt)\nGesellschaft mit beschränkter Haftung\nSaarbrücken\n\nEs ist beabsichtigt, die Gesellschaft von Amts wegen gemäß § 394 FamFG wegen Vermögenslosigkeit zu löschen.\nGegen die Löschung von Amts wegen ist das Rechtsmittel des Widerspruchs statthaft. Der Widerspruch ist binnen einer Frist zwei Monaten beginnend mit dem Tag dieser Veröffentlichung durch Einreichen eines Widerspruchsschreibens -schriftlich oder zur Niederschrift der Geschäftsstelle beim Amtsgericht Saarbrücken, -zentrales Handelsregister-, Mainzerstr.178, 66121 Saarbrücken einzulegen.\nDer Widerspruch muss die Bezeichnung der angefochtenen Löschungsankündigung enthalten sowie die Erklärung, dass Widerspruch eingelegt wird. Er ist vom Widerspruchsführer oder seinem Bevollmächtigten zu unterzeichnen.\nDas Widerspruchsschreiben kann auch in der Form eines elektronischen Dokumentes eingereicht werden, das mit einer qualifizierten elektronischen Signatur nach dem Signaturgesetz versehen sein muss (§§ 14 Abs. 2 FamFG, 130a, 298 ZPO)."
    },
    {
      "date": "2025-04-10",
      "id": "106182",
      "original_text": "Einreichung neuer Dokumente\nSachsen-Anhalt Amtsgericht Stendal HRB 21824\nComTS Logistics GmbH – Magdeburg",
      "type": "Einreichung neuer Dokumente",
      "state": "Sachsen-Anhalt",
      "amtsgericht": "Amtsgericht Stendal",
      "registernummer": "HRB 21824",
      "registerart": "HRB",
      "company_name": "ComTS Logistics GmbH",
      "company_seat": "Magdeburg",
      "details": "10.04.2025 (Bekanntmachungsdatum)\n\nSachsen-Anhalt Amtsgericht Stendal HRB 21824\nEinreichung neuer Dokumente\n\nComTS Logistics GmbH\nGesellschaft mit beschränkter Haftung\nMagdeburg\n\nEine Liste der Mitglieder des Aufsichtsrates wurde zum Handelsregister eingereicht."
    },
    {
      "date": "2025-04-10",
      "id": "106183",
      "original_text": "Löschungsankündigung\nHamburg Amtsgericht Hamburg HRB 141937\nMedienvertrieb AN UG (haftungsbeschränkt) – Hamburg",
      "type": "Löschungsankündigung",
      "state": "Hamburg",
      "amtsgericht": "Amtsgericht Hamburg",
      "registernummer": "HRB 141937",
      "registerart": "HRB",
      "company_name": "Medienvertrieb AN UG (haftungsbeschränkt)",
      "company_seat": "Hamburg",
      "details": "10.04.2025 (Bekanntmachungsdatum)\n\nHamburg Amtsgericht Hamburg HRB 141937\nLöschungsankündigung\n\nMedienvertrieb AN UG (haftungsbeschränkt)\nGesellschaft mit beschränkter Haftung\nHamburg\n\nDas Registergericht beabsichtigt, die im Handelsregister eingetragene Gesellschaft von Amts wegen nach § 394 FamFG zu löschen. Die Frist zur Erhebung eines Widerspruchs gegen die beabsichtigte Löschung wird auf 3 Monate festgesetzt."
    },
    {
      "date": "2025-04-10",
      "id": "106184",
      "original_text": "Löschungsankündigung\nSaarland Amtsgericht Saarbrücken HRB 102248\nRed Arrow Global Solutions GmbH – Wadgassen",
      "type": "Löschungsankündigung",
      "state": "Saarland",
      "amtsgericht": "Amtsgericht Saarbrücken",
      "registernummer": "HRB 102248",
      "registerart": "HRB",
      "company_name": "Red Arrow Global Solutions GmbH",
      "company_seat": "Wadgassen",
      "details": "10.04.2025 (Bekanntmachungsdatum)\n\nSaarland Amtsgericht Saarbrücken HRB 102248\nLöschungsankündigung\n\nRed Arrow Global Solutions GmbH\nGesellschaft mit beschränkter Haftung\nWadgassen\n\nEs ist beabsichtigt, die Gesellschaft von Amts wegen gemäß § 394 FamFG wegen Vermögenslosigkeit zu löschen.\nGegen die Löschung von Amts wegen ist das Rechtsmittel des Widerspruchs statthaft. Der Widerspruch ist binnen einer Frist zwei Monaten beginnend mit dem Tag dieser Veröffentlichung durch Einreichen eines Widerspruchsschreibens -schriftlich oder zur Niederschrift der Geschäftsstelle beim Amtsgericht Saarbrücken, -zentrales Handelsregister-, Mainzerstr.178, 66121 Saarbrücken einzulegen.\nDer Widerspruch muss die Bezeichnung der angefochtenen Löschungsankündigung enthalten sowie die Erklärung, dass Widerspruch eingelegt wird. Er ist vom Widerspruchsführer oder seinem Bevollmächtigten zu unterzeichnen.\nDas Widerspruchsschreiben kann auch in der Form eines elektronischen Dokumentes eingereicht werden, das mit einer qualifizierten elektronischen Signatur nach dem Signaturgesetz versehen sein muss (§§ 14 Abs. 2 FamFG, 130a, 298 ZPO)."
    },
    {
      "date": "2025-04-10",
      "id": "106185",
      "original_text": "Einreichung neuer Dokumente\nHamburg Amtsgericht Hamburg HRB 95405\nSpairliners GmbH – Hamburg",
      "type": "Einreichung neuer Dokumente",
      "state": "Hamburg",
      "amtsgericht": "Amtsgericht Hamburg",
      "registernummer": "HRB 95405",
      "registerart": "HRB",
      "company_name": "Spairliners GmbH",
      "company_seat": "Hamburg",
      "details": "10.04.2025 (Bekanntmachungsdatum)\n\nHamburg Amtsgericht Hamburg HRB 95405\nEinreichung neuer Dokumente\n\nSpairliners GmbH\nGesellschaft mit beschränkter Haftung\nHamburg\n\nAls nicht eingetragen wird bekannt gemacht: Liste des Aufsichtsrats wurde eingereicht."
    },
    {
      "date": "2025-04-10",
      "id": "106186",
      "original_text": "Einreichung neuer Dokumente\nHamburg Amtsgericht Hamburg HRB 145818\n7ORCA Asset Management AG – Hamburg",
      "type": "Einreichung neuer Dokumente",
      "state": "Hamburg",
      "amtsgericht": "Amtsgericht Hamburg",
      "registernummer": "HRB 145818",
      "registerart": "HRB",
      "company_name": "7ORCA Asset Management AG",
      "company_seat": "Hamburg",
      "details": "10.04.2025 (Bekanntmachungsdatum)\n\nHamburg Amtsgericht Hamburg HRB 145818\nEinreichung neuer Dokumente\n\n7ORCA Asset Management AG\nAktiengesellschaft\nHamburg\n\nAls nicht eingetragen wird bekannt gemacht: Liste des Aufsichtsrats wurde eingereicht."
    },
    {
      "date": "2025-04-10",
      "id": "106187",
      "original_text": "Registerbekanntmachung nach dem Umwandlungsgesetz\nHamburg Amtsgericht Hamburg HRB 184425\nIt's magic Family Office GmbH – Hamburg",
      "type": "Registerbekanntmachung nach dem Umwandlungsgesetz",
      "state": "Hamburg",
      "amtsgericht": "Amtsgericht Hamburg",
      "registernummer": "HRB 184425",
      "registerart": "HRB",
      "company_name": "It's magic Family Office GmbH",
      "company_seat": "Hamburg",
      "details": "10.04.2025 (Bekanntmachungsdatum)\n\nHamburg Amtsgericht Hamburg HRB 184425\nRegisterbekanntmachung nach dem Umwandlungsgesetz 26.02.2025 (Eintragungsdatum)\n\nIt's magic Family Office GmbH\nGesellschaft mit beschränkter Haftung\nHamburg\n\nAls nicht eingetragen wird bekannt gemacht:\nDen Gläubigern der an der Abspaltung beteiligten Gesellschaften ist, wenn sie binnen sechs Monaten nach dem Tag, an dem die Eintragung der Abspaltung in das Register des Sitzes desjenigen Rechtsträgers, dessen Gläubiger sie sind, nach § 19 Absatz 3 UmwG als bekannt gemacht gilt, ihren Anspruch nach Grund und Höhe schriftlich anmelden, Sicherheit zu leisten, soweit sie nicht Befriedigung verlangen können. Dieses Recht steht den Gläubigern jedoch nur zu, wenn sie glaubhaft machen, dass durch die Abspaltung die Erfüllung ihrer Forderung gefährdet wird."
    },
    {
      "date": "2025-04-10",
      "id": "106188",
      "original_text": "Löschungsankündigung\nBrandenburg Amtsgericht Frankfurt/Oder HRB 14010\nMSN LOGISTIC GmbH – Fürstenwalde/Spree",
      "type": "Löschungsankündigung",
      "state": "Brandenburg",
      "amtsgericht": "Amtsgericht Frankfurt/Oder",
      "registernummer": "HRB 14010",
      "registerart": "HRB",
      "company_name": "MSN LOGISTIC GmbH",
      "company_seat": "Fürstenwalde/Spree",
      "details": "10.04.2025 (Bekanntmachungsdatum)\n\nBrandenburg Amtsgericht Frankfurt/Oder HRB 14010\nLöschungsankündigung\n\nMSN LOGISTIC GmbH\nGesellschaft mit beschränkter Haftung\nFürstenwalde/Spree\n\nBei der nachstehenden Gesellschaft wird das Amtslöschungsverfahren gemäß § 394 FamFG eingeleitet."
    },
    {
      "date": "2025-04-10",
      "id": "106189",
      "original_text": "Löschungsankündigung\nThüringen Amtsgericht Jena HRB 504796\nDas Genuss Kontor Bad Langensalza GmbH – Bad Langensalza",
      "type": "Löschungsankündigung",
      "state": "Thüringen",
      "amtsgericht": "Amtsgericht Jena",
      "registernummer": "HRB 504796",
      "registerart": "HRB",
      "company_name": "Das Genuss Kontor Bad Langensalza GmbH",
      "company_seat": "Bad Langensalza",
      "details": "10.04.2025 (Bekanntmachungsdatum)\n\nThüringen Amtsgericht Jena HRB 504796\nLöschungsankündigung\n\nDas Genuss Kontor Bad Langensalza GmbH\nGesellschaft mit beschränkter Haftung\nBad Langensalza\n\nDas Registergericht beabsichtigt, die im Handelsregister eingetragene Gesellschaft wegen Vermögenslosigkeit nach § 394 FamFG von Amts wegen zu löschen. Die Frist zur Erhebung eines Widerspruchs gegen die beabsichtigte Löschung wird auf 6 Wochen festgesetzt."
    },
    {
      "date": "2025-04-10",
      "id": "106190",
      "original_text": "Löschungsankündigung\nThüringen Amtsgericht Jena HRB 201672\nLanddienste-und Transport Hermsdorf GmbH – Hermsdorf",
      "type": "Löschungsankündigung",
      "state": "Thüringen",
      "amtsgericht": "Amtsgericht Jena",
      "registernummer": "HRB 201672",
      "registerart": "HRB",
      "company_name": "Landdienste-und Transport Hermsdorf GmbH",
      "company_seat": "Hermsdorf",
      "details": "10.04.2025 (Bekanntmachungsdatum)\n\nThüringen Amtsgericht Jena HRB 201672\nLöschungsankündigung\n\nLanddienste-und Transport Hermsdorf GmbH\nGesellschaft mit beschränkter Haftung\nHermsdorf\n\nDas Registergericht beabsichtigt, die im Handelsregister eingetragene Gesellschaft wegen Vermögenslosigkeit nach § 394 FamFG von Amts wegen zu löschen. Die Frist zur Erhebung eines Widerspruchs gegen die beabsichtigte Löschung wird auf 6 Wochen festgesetzt."
    },
    {
      "date": "2025-04-10",
      "id": "106191",
      "original_text": "Löschungsankündigung\nThüringen Amtsgericht Jena HRB 516221\nKIWA CARE GmbH – Heringen/Helme",
      "type": "Löschungsankündigung",
      "state": "Thüringen",
      "amtsgericht": "Amtsgericht Jena",
      "registernummer": "HRB 516221",
      "registerart": "HRB",
      "company_name": "KIWA CARE GmbH",
      "company_seat": "Heringen/Helme",
      "details": "10.04.2025 (Bekanntmachungsdatum)\n\nThüringen Amtsgericht Jena HRB 516221\nLöschungsankündigung\n\nKIWA CARE GmbH\nGesellschaft mit beschränkter Haftung\nHeringen/Helme\n\nDas Registergericht beabsichtigt, die im Handelsregister eingetragene Gesellschaft wegen Vermögenslosigkeit nach § 394 FamFG von Amts wegen zu löschen. Die Frist zur Erhebung eines Widerspruchs gegen die beabsichtigte Löschung wird auf 6 Wochen festgesetzt."
    },
    {
      "date": "2025-04-10",
      "id": "106192",
      "original_text": "Löschungsankündigung\nBrandenburg Amtsgericht Frankfurt/Oder HRB 14932\nTierheim Egerer gemeinnützige UG (haftungsbeschränkt) – Frankfurt (Oder)",
      "type": "Löschungsankündigung",
      "state": "Brandenburg",
      "amtsgericht": "Amtsgericht Frankfurt/Oder",
      "registernummer": "HRB 14932",
      "registerart": "HRB",
      "company_name": "Tierheim Egerer gemeinnützige UG (haftungsbeschränkt)",
      "company_seat": "Frankfurt (Oder)",
      "details": "10.04.2025 (Bekanntmachungsdatum)\n\nBrandenburg Amtsgericht Frankfurt/Oder HRB 14932\nLöschungsankündigung\n\nTierheim Egerer gemeinnützige UG (haftungsbeschränkt)\nGesellschaft mit beschränkter Haftung\nFrankfurt (Oder)\n\nBei der nachstehenden Gesellschaft wird das Amtslöschungsverfahren gemäß § 394 FamFG eingeleitet."
    },
    {
      "date": "2025-04-10",
      "id": "106193",
      "original_text": "Registerbekanntmachung nach dem Umwandlungsgesetz\nSchleswig-Holstein Amtsgericht Pinneberg HRB 17878\ndigitalchannel UG (haftungsbeschränkt) – Holm",
      "type": "Registerbekanntmachung nach dem Umwandlungsgesetz",
      "state": "Schleswig-Holstein",
      "amtsgericht": "Amtsgericht Pinneberg",
      "registernummer": "HRB 17878",
      "registerart": "HRB",
      "company_name": "digitalchannel UG (haftungsbeschränkt)",
      "company_seat": "Holm",
      "details": "10.04.2025 (Bekanntmachungsdatum)\n\nSchleswig-Holstein Amtsgericht Pinneberg HRB 17878\nRegisterbekanntmachung nach dem Umwandlungsgesetz 10.04.2025 (Eintragungsdatum)\n\ndigitalchannel UG (haftungsbeschränkt)\nGesellschaft mit beschränkter Haftung\nHolm\n\nZu Eintragungsnummer 2 vom 10.04.2025 wird als nicht eingetragen veröffentlicht: Als nicht eingetragen wird veröffentlicht: Den Gläubigern der an der Verschmelzung beteiligten Rechtsträger ist, wenn sie binnen sechs Monaten nach dem Tag, an dem die Eintragung der Verschmelzung in das Register des Sitzes desjenigen Rechtsträgers, dessen Gläubiger sie sind, als bekannt gemacht gilt, ihren Anspruch nach Grund und Höhe schriftlich anmelden, Sicherheit zu leisten, soweit sie nicht Befriedigung verlangen können. Dieses Recht steht den Gläubigern jedoch nur zu, wenn sie glaubhaft machen, dass durch die Verschmelzung die Erfüllung ihrer Forderung gefährdet wird. Das Recht, Sicherheitsleistung zu verlangen, steht Gläubigern nicht zu, die im Falle der Insolvenz ein Recht auf vorzugsweise Befriedigung aus einer Deckungsmasse haben, die nach gesetzlicher Vorschrift zu ihrem Schutz errichtet und staatlich überwacht ist."
    },
    {
      "date": "2025-04-10",
      "id": "106194",
      "original_text": "Einreichung neuer Dokumente\nRheinland-Pfalz Amtsgericht Koblenz HRB 1192\nMMV Leasing Gesellschaft mit beschränkter Haftung – Koblenz",
      "type": "Einreichung neuer Dokumente",
      "state": "Rheinland-Pfalz",
      "amtsgericht": "Amtsgericht Koblenz",
      "registernummer": "HRB 1192",
      "registerart": "HRB",
      "company_name": "MMV Leasing Gesellschaft mit beschränkter Haftung",
      "company_seat": "Koblenz",
      "details": "10.04.2025 (Bekanntmachungsdatum)\n\nRheinland-Pfalz Amtsgericht Koblenz HRB 1192\nEinreichung neuer Dokumente\n\nMMV Leasing Gesellschaft mit beschränkter Haftung\nGesellschaft mit beschränkter Haftung\nKoblenz\n\nDem Registergericht ist eine neue Liste der Mitglieder des Aufsichtsrates eingereicht worden."
    },
    {
      "date": "2025-04-10",
      "id": "106195",
      "original_text": "Löschungsankündigung\nRheinland-Pfalz Amtsgericht Ludwigshafen a.Rhein (Ludwigshafen) HRB 60106\nTrend Wohnbau GmbH – Rödersheim-Gronau",
      "type": "Löschungsankündigung",
      "state": "Rheinland-Pfalz",
      "amtsgericht": "Amtsgericht Ludwigshafen a.Rhein (Ludwigshafen)",
      "registernummer": "HRB 60106",
      "registerart": "HRB",
      "company_name": "Trend Wohnbau GmbH",
      "company_seat": "Rödersheim-Gronau",
      "details": "10.04.2025 (Bekanntmachungsdatum)\n\nRheinland-Pfalz Amtsgericht Ludwigshafen a.Rhein (Ludwigshafen) HRB 60106\nLöschungsankündigung\n\nTrend Wohnbau GmbH\nGesellschaft mit beschränkter Haftung\nRödersheim-Gronau\n\nDas Registergericht beabsichtigt die Gesellschaft von Amts wegen nach § 394 FamFG zu löschen. Die Frist zur Erhebung eines Widerspruchs ist auf einen Monat festgesetzt."
    },
    {
      "date": "2025-04-10",
      "id": "106196",
      "original_text": "Registerbekanntmachung nach dem Umwandlungsgesetz\nRheinland-Pfalz Amtsgericht Zweibrücken HRB 11403\nSPIE InfoGraph GISMobil GmbH – Ramstein-Miesenbach",
      "type": "Registerbekanntmachung nach dem Umwandlungsgesetz",
      "state": "Rheinland-Pfalz",
      "amtsgericht": "Amtsgericht Zweibrücken",
      "registernummer": "HRB 11403",
      "registerart": "HRB",
      "company_name": "SPIE InfoGraph GISMobil GmbH",
      "company_seat": "Ramstein-Miesenbach",
      "details": "10.04.2025 (Bekanntmachungsdatum)\n\nRheinland-Pfalz Amtsgericht Zweibrücken HRB 11403\nRegisterbekanntmachung nach dem Umwandlungsgesetz 10.04.2025 (Eintragungsdatum)\n\nSPIE InfoGraph GISMobil GmbH\nGesellschaft mit beschränkter Haftung\nRamstein-Miesenbach\n\nAls nicht eingetragen wird veröffentlicht: Den Gläubigern der an der Verschmelzung beteiligten Rechtsträger ist, wenn sie binnen sechs Monaten nach dem Tag, an dem die Eintragung der Verschmelzung in das Register des Sitzes desjenigen Rechtsträgers,dessen Gläubiger sie sind, nach § 19 Abs. 3 UmwG als bekannt gemacht gilt, ihren Anspruch nach Grund und Höhe schriftlich anmelden, Sicherheit zu leisten, soweit sie nicht Befriedigung verlangen können. Dieses Recht steht den Gläubigern jedoch nur zu, wenn sie glaubhaft machen, dass durch die Verschmelzung die Erfüllungd er Forderung gefährdet wird."
    },
    {
      "date": "2025-04-10",
      "id": "106197",
      "original_text": "Registerbekanntmachung nach dem Umwandlungsgesetz\nHamburg Amtsgericht Hamburg HRB 129045\nkampus GmbH – Hamburg",
      "type": "Registerbekanntmachung nach dem Umwandlungsgesetz",
      "state": "Hamburg",
      "amtsgericht": "Amtsgericht Hamburg",
      "registernummer": "HRB 129045",
      "registerart": "HRB",
      "company_name": "kampus GmbH",
      "company_seat": "Hamburg",
      "details": "10.04.2025 (Bekanntmachungsdatum)\n\nHamburg Amtsgericht Hamburg HRB 129045\nRegisterbekanntmachung nach dem Umwandlungsgesetz 25.03.2025 (Eintragungsdatum)\n\nkampus GmbH\nGesellschaft mit beschränkter Haftung\nHamburg\n\nAls nicht eingetragen wird bekannt gemacht:\nDen Gläubigern der an der Verschmelzung beteiligten Gesellschaften ist, wenn sie binnen sechs Monaten nach dem Tag, an dem die Eintragung der Verschmelzung in das Register des Sitzes desjenigen Rechtsträgers, dessen Gläubiger sie sind, nach § 19 Absatz 3 UmwG als bekannt gemacht gilt, ihren Anspruch nach Grund und Höhe schriftlich anmelden, Sicherheit zu leisten, soweit sie nicht Befriedigung verlangen können. Dieses Recht steht den Gläubigern jedoch nur zu, wenn sie glaubhaft machen, dass durch die Verschmelzung die Erfüllung ihrer Forderung gefährdet wird."
    },
    {
      "date": "2025-04-10",
      "id": "106198",
      "original_text": "Löschungsankündigung\nBrandenburg Amtsgericht Frankfurt/Oder HRB 18052\nEBO Hänsel Unternehmergesellschaft (haftungsbeschränkt) – Wriezen",
      "type": "Löschungsankündigung",
      "state": "Brandenburg",
      "amtsgericht": "Amtsgericht Frankfurt/Oder",
      "registernummer": "HRB 18052",
      "registerart": "HRB",
      "company_name": "EBO Hänsel Unternehmergesellschaft (haftungsbeschränkt)",
      "company_seat": "Wriezen",
      "details": "10.04.2025 (Bekanntmachungsdatum)\n\nBrandenburg Amtsgericht Frankfurt/Oder HRB 18052\nLöschungsankündigung\n\nEBO Hänsel Unternehmergesellschaft (haftungsbeschränkt)\nGesellschaft mit beschränkter Haftung\nWriezen\n\nBei der nachstehenden Gesellschaft wird das Amtslöschungsverfahren gemäß § 394 FamFG eingeleitet."
    },
    {
      "date": "2025-04-10",
      "id": "106199",
      "original_text": "Einreichung neuer Dokumente\nBerlin Amtsgericht Berlin (Charlottenburg) HRB 69284\nESCRIBA AG – Berlin",
      "type": "Einreichung neuer Dokumente",
      "state": "Berlin",
      "amtsgericht": "Amtsgericht Berlin (Charlottenburg)",
      "registernummer": "HRB 69284",
      "registerart": "HRB",
      "company_name": "ESCRIBA AG",
      "company_seat": "Berlin",
      "details": "10.04.2025 (Bekanntmachungsdatum)\n\nBerlin Amtsgericht Berlin (Charlottenburg) HRB 69284\nEinreichung neuer Dokumente\n\nESCRIBA AG\nAktiengesellschaft\nBerlin\n\nAls nicht eingetragen wird veröffentlicht: Es wurde eine neue Liste der Aufsichtsratsmitglieder eingereicht (§ 106 AktG)."
    },
    {
      "date": "2025-04-10",
      "id": "106200",
      "original_text": "Sonstige Registerbekanntmachung\nBerlin Amtsgericht Berlin (Charlottenburg) HRB 179468\nLightblue Privet Property GmbH – Berlin",
      "type": "Sonstige Registerbekanntmachung",
      "state": "Berlin",
      "amtsgericht": "Amtsgericht Berlin (Charlottenburg)",
      "registernummer": "HRB 179468",
      "registerart": "HRB",
      "company_name": "Lightblue Privet Property GmbH",
      "company_seat": "Berlin",
      "details": "10.04.2025 (Bekanntmachungsdatum)\n\nBerlin Amtsgericht Berlin (Charlottenburg) HRB 179468\nSonstige Registerbekanntmachung\n\nLightblue Privet Property GmbH\nGesellschaft mit beschränkter Haftung\nBerlin\n\nAls nicht eingetragen wird veröffentlicht: Der andere Vertragsteil hat den Gläubigern dieses Rechtsträgers, deren Forderungen begründet worden sind, bevor die Eintragung der Beendigung dieses Vertrages in das Handelsregister nach § 10 des Handelsgesetzbuches als bekannt gemacht gilt, Sicherheit zu leisten, wenn sie sich binnen sechs Monaten nach der Bekanntmachung der Eintragung zu diesem Zweck bei ihm melden. Dieses Recht steht den Gläubigern nicht zu, die im Fall des Insolvenzverfahrens ein Recht auf vorzugsweise Befriedigung aus der Deckungsmasse haben, die nach gesetzlicher Vorschrift zu ihrem Schutz errichtet und staatlich überwacht ist."
    },
    {
      "date": "2025-04-10",
      "id": "106201",
      "original_text": "Registerbekanntmachung nach dem Umwandlungsgesetz\nBaden-Württemberg Amtsgericht Stuttgart HRB 720454\nObjektgesellschaft L 21 Stuttgart mbH – Stuttgart",
      "type": "Registerbekanntmachung nach dem Umwandlungsgesetz",
      "state": "Baden-Württemberg",
      "amtsgericht": "Amtsgericht Stuttgart",
      "registernummer": "HRB 720454",
      "registerart": "HRB",
      "company_name": "Objektgesellschaft L 21 Stuttgart mbH",
      "company_seat": "Stuttgart",
      "details": "10.04.2025 (Bekanntmachungsdatum)\n\nBaden-Württemberg Amtsgericht Stuttgart HRB 720454\nRegisterbekanntmachung nach dem Umwandlungsgesetz 10.04.2025 (Eintragungsdatum)\n\nObjektgesellschaft L 21 Stuttgart mbH\nGesellschaft mit beschränkter Haftung\nStuttgart\n\nAls nicht eingetragen wird bekanntgemacht:\nDen Gläubigern der an der Verschmelzung beteiligten Rechtsträger ist, wenn sie binnen sechs Monaten nach dem Tag, an dem die Eintragung der Verschmelzung in das Register des Sitzes desjenigen Rechtsträgers, dessen Gläubiger sie sind, nach § 19 Abs. 3 UmwG als bekanntgemacht gilt, ihren Anspruch nach Grund und Höhe schriftlich anmelden, Sicherheit zu leisten, soweit sie nicht Befriedigung verlangen können. Dieses Recht steht den Gläubigern jedoch nur zu, wenn sie glaubhaft machen, dass durch die Verschmelzung die Erfüllung ihrer Forderung gefährdet wird."
    },
    {
      "date": "2025-04-10",
      "id": "106202",
      "original_text": "Registerbekanntmachung nach dem Umwandlungsgesetz\nBaden-Württemberg Amtsgericht Freiburg HRB 706578\nBE-terna Business Solutions GmbH – Überlingen",
      "type": "Registerbekanntmachung nach dem Umwandlungsgesetz",
      "state": "Baden-Württemberg",
      "amtsgericht": "Amtsgericht Freiburg",
      "registernummer": "HRB 706578",
      "registerart": "HRB",
      "company_name": "BE-terna Business Solutions GmbH",
      "company_seat": "Überlingen",
      "details": "10.04.2025 (Bekanntmachungsdatum)\n\nBaden-Württemberg Amtsgericht Freiburg HRB 706578\nRegisterbekanntmachung nach dem Umwandlungsgesetz 10.04.2025 (Eintragungsdatum)\n\nBE-terna Business Solutions GmbH\nGesellschaft mit beschränkter Haftung\nÜberlingen\n\nAls nicht eingetragen wird bekanntgemacht:\nDen Gläubigern der an der Verschmelzung beteiligten Rechtsträger ist, wenn sie binnen sechs Monaten nach dem Tag, an dem die Eintragung der Verschmelzung in das Register des Sitzes desjenigen Rechtsträgers, dessen Gläubiger sie sind, nach § 19 Abs. 3 UmwG als bekanntgemacht gilt, ihren Anspruch nach Grund und Höhe schriftlich anmelden, Sicherheit zu leisten, soweit sie nicht Befriedigung verlangen können. Dieses Recht steht den Gläubigern jedoch nur zu, wenn sie glaubhaft machen, dass durch die Verschmelzung die Erfüllung ihrer Forderung gefährdet wird."
    },
    {
      "date": "2025-04-10",
      "id": "106203",
      "original_text": "Löschungsankündigung\nBerlin Amtsgericht Berlin (Charlottenburg) HRB 180940\nWINDBUOYY AG – Berlin",
      "type": "Löschungsankündigung",
      "state": "Berlin",
      "amtsgericht": "Amtsgericht Berlin (Charlottenburg)",
      "registernummer": "HRB 180940",
      "registerart": "HRB",
      "company_name": "WINDBUOYY AG",
      "company_seat": "Berlin",
      "details": "10.04.2025 (Bekanntmachungsdatum)\n\nBerlin Amtsgericht Berlin (Charlottenburg) HRB 180940\nLöschungsankündigung\n\nWINDBUOYY AG\nAktiengesellschaft\nBerlin\n\nBei der nachstehenden Gesellschaft wird das Amtslöschungsverfahren gemäß § 394 FamFG eingeleitet. Widerspruchsfrist 6 Wochen"
    },
    {
      "date": "2025-04-10",
      "id": "106204",
      "original_text": "Registerbekanntmachung nach dem Umwandlungsgesetz\nBaden-Württemberg Amtsgericht Freiburg HRB 715713\nGlobal Treats GmbH – Wutöschingen",
      "type": "Registerbekanntmachung nach dem Umwandlungsgesetz",
      "state": "Baden-Württemberg",
      "amtsgericht": "Amtsgericht Freiburg",
      "registernummer": "HRB 715713",
      "registerart": "HRB",
      "company_name": "Global Treats GmbH",
      "company_seat": "Wutöschingen",
      "details": "10.04.2025 (Bekanntmachungsdatum)\n\nBaden-Württemberg Amtsgericht Freiburg HRB 715713\nRegisterbekanntmachung nach dem Umwandlungsgesetz 10.04.2025 (Eintragungsdatum)\n\nGlobal Treats GmbH\nGesellschaft mit beschränkter Haftung\nWutöschingen\n\nAls nicht eingetragen wird bekanntgemacht:\nDen Gläubigern der an der Verschmelzung beteiligten Rechtsträger ist, wenn sie binnen sechs Monaten nach dem Tag, an dem die Eintragung der Verschmelzung in das Register des Sitzes desjenigen Rechtsträgers, dessen Gläubiger sie sind, nach § 19 Abs. 3 UmwG als bekanntgemacht gilt, ihren Anspruch nach Grund und Höhe schriftlich anmelden, Sicherheit zu leisten, soweit sie nicht Befriedigung verlangen können. Dieses Recht steht den Gläubigern jedoch nur zu, wenn sie glaubhaft machen, dass durch die Verschmelzung die Erfüllung ihrer Forderung gefährdet wird."
    },
    {
      "date": "2025-04-10",
      "id": "106205",
      "original_text": "Löschungsankündigung\nBaden-Württemberg Amtsgericht Stuttgart HRB 754492\nMilat Bäckerei UG (haftungsbeschränkt) – Neckarsulm",
      "type": "Löschungsankündigung",
      "state": "Baden-Württemberg",
      "amtsgericht": "Amtsgericht Stuttgart",
      "registernummer": "HRB 754492",
      "registerart": "HRB",
      "company_name": "Milat Bäckerei UG (haftungsbeschränkt)",
      "company_seat": "Neckarsulm",
      "details": "10.04.2025 (Bekanntmachungsdatum)\n\nBaden-Württemberg Amtsgericht Stuttgart HRB 754492\nLöschungsankündigung\n\nMilat Bäckerei UG (haftungsbeschränkt)\nGesellschaft mit beschränkter Haftung\nNeckarsulm\n\nAls nicht eingetragen wird bekanntgemacht:\nDas Gericht beabsichtigt, die Gesellschaft wegen Vermögenslosigkeit im Handelsregister von Amts wegen nach § 394 FamFG zu löschen. Die Frist zur Geltendmachung eines Widerspruchs gegen die beabsichtigte Löschung ist auf zwei Monate ab Veröffentlichung bestimmt."
    },
    {
      "date": "2025-04-10",
      "id": "106206",
      "original_text": "Registerbekanntmachung nach dem Umwandlungsgesetz\nBaden-Württemberg Amtsgericht Freiburg HRB 725865\nDritte Sonderbox GmbH – Wutöschingen",
      "type": "Registerbekanntmachung nach dem Umwandlungsgesetz",
      "state": "Baden-Württemberg",
      "amtsgericht": "Amtsgericht Freiburg",
      "registernummer": "HRB 725865",
      "registerart": "HRB",
      "company_name": "Dritte Sonderbox GmbH",
      "company_seat": "Wutöschingen",
      "details": "10.04.2025 (Bekanntmachungsdatum)\n\nBaden-Württemberg Amtsgericht Freiburg HRB 725865\nRegisterbekanntmachung nach dem Umwandlungsgesetz 10.04.2025 (Eintragungsdatum)\n\nDritte Sonderbox GmbH\nGesellschaft mit beschränkter Haftung\nWutöschingen\n\nAls nicht eingetragen wird bekanntgemacht:\nDen Gläubigern der an der Verschmelzung beteiligten Rechtsträger ist, wenn sie binnen sechs Monaten nach dem Tag, an dem die Eintragung der Verschmelzung in das Register des Sitzes desjenigen Rechtsträgers, dessen Gläubiger sie sind, nach § 19 Abs. 3 UmwG als bekanntgemacht gilt, ihren Anspruch nach Grund und Höhe schriftlich anmelden, Sicherheit zu leisten, soweit sie nicht Befriedigung verlangen können. Dieses Recht steht den Gläubigern jedoch nur zu, wenn sie glaubhaft machen, dass durch die Verschmelzung die Erfüllung ihrer Forderung gefährdet wird."
    },
    {
      "date": "2025-04-10",
      "id": "106207",
      "original_text": "Löschungsankündigung\nMecklenburg-Vorpommern Amtsgericht Stralsund HRB 7225\nMecklenburger Tabakhandel GmbH – Ribnitz-Damgarten",
      "type": "Löschungsankündigung",
      "state": "Mecklenburg-Vorpommern",
      "amtsgericht": "Amtsgericht Stralsund",
      "registernummer": "HRB 7225",
      "registerart": "HRB",
      "company_name": "Mecklenburger Tabakhandel GmbH",
      "company_seat": "Ribnitz-Damgarten",
      "details": "10.04.2025 (Bekanntmachungsdatum)\n\nMecklenburg-Vorpommern Amtsgericht Stralsund HRB 7225\nLöschungsankündigung\n\nMecklenburger Tabakhandel GmbH\nGesellschaft mit beschränkter Haftung\nRibnitz-Damgarten\n\nDas Registergericht beabsichtigt, die Firma von Amts wegen nach § 394 FamFG zu löschen. Die Frist zur Erhebung eines Widerspruchs ist auf 1 Monat festgesetzt."
    },
    {
      "date": "2025-04-10",
      "id": "106208",
      "original_text": "Registerbekanntmachung nach dem Umwandlungsgesetz\nBaden-Württemberg Amtsgericht Stuttgart HRB 730452\nObjektgesellschaft Skyline Stuttgart mbH – Stuttgart",
      "type": "Registerbekanntmachung nach dem Umwandlungsgesetz",
      "state": "Baden-Württemberg",
      "amtsgericht": "Amtsgericht Stuttgart",
      "registernummer": "HRB 730452",
      "registerart": "HRB",
      "company_name": "Objektgesellschaft Skyline Stuttgart mbH",
      "company_seat": "Stuttgart",
      "details": "10.04.2025 (Bekanntmachungsdatum)\n\nBaden-Württemberg Amtsgericht Stuttgart HRB 730452\nRegisterbekanntmachung nach dem Umwandlungsgesetz 10.04.2025 (Eintragungsdatum)\n\nObjektgesellschaft Skyline Stuttgart mbH\nGesellschaft mit beschränkter Haftung\nStuttgart\n\nDen Gläubigern der an der Verschmelzung beteiligten Rechtsträger ist, wenn sie binnen sechs Monaten nach dem Tag, an dem die Eintragung der Verschmelzung in das Register des Sitzes desjenigen Rechtsträgers, dessen Gläubiger sie sind, nach § 19 Abs. 3 UmwG als bekanntgemacht gilt, ihren Anspruch nach Grund und Höhe schriftlich anmelden, Sicherheit zu leisten, soweit sie nicht Befriedigung verlangen können. Dieses Recht steht den Gläubigern jedoch nur zu, wenn sie glaubhaft machen, dass durch die Verschmelzung die Erfüllung ihrer Forderung gefährdet wird."
    },
    {
      "date": "2025-04-10",
      "id": "106209",
      "original_text": "Löschungsankündigung\nMecklenburg-Vorpommern Amtsgericht Stralsund HRA 1805\nTabakboersen Kay Mittelbach Schwerin GmbH & Co. KG – Ribnitz-Damgarten",
      "type": "Löschungsankündigung",
      "state": "Mecklenburg-Vorpommern",
      "amtsgericht": "Amtsgericht Stralsund",
      "registernummer": "HRA 1805",
      "registerart": "HRA",
      "company_name": "Tabakboersen Kay Mittelbach Schwerin GmbH & Co. KG",
      "company_seat": "Ribnitz-Damgarten",
      "details": "10.04.2025 (Bekanntmachungsdatum)\n\nMecklenburg-Vorpommern Amtsgericht Stralsund HRA 1805\nLöschungsankündigung\n\nTabakboersen Kay Mittelbach Schwerin GmbH & Co. KG\nKommanditgesellschaft\nRibnitz-Damgarten\n\nDas Registergericht beabsichtigt, die Firma von Amts wegen nach § 394 FamFG zu löschen. Die Frist zur Erhebung eines Widerspruchs ist auf 1 Monat festgesetzt."
    },
    {
      "date": "2025-04-10",
      "id": "106210",
      "original_text": "Löschungsankündigung\nMecklenburg-Vorpommern Amtsgericht Stralsund HRA 1810\nTabakboersen Kay Mittelbach Boddencenter GmbH & Co. KG – Ribnitz-Damgarten",
      "type": "Löschungsankündigung",
      "state": "Mecklenburg-Vorpommern",
      "amtsgericht": "Amtsgericht Stralsund",
      "registernummer": "HRA 1810",
      "registerart": "HRA",
      "company_name": "Tabakboersen Kay Mittelbach Boddencenter GmbH & Co. KG",
      "company_seat": "Ribnitz-Damgarten",
      "details": "10.04.2025 (Bekanntmachungsdatum)\n\nMecklenburg-Vorpommern Amtsgericht Stralsund HRA 1810\nLöschungsankündigung\n\nTabakboersen Kay Mittelbach Boddencenter GmbH & Co. KG\nKommanditgesellschaft\nRibnitz-Damgarten\n\nDas Registergericht beabsichtigt, die Firma von Amts wegen nach § 394 FamFG zu löschen. Die Frist zur Erhebung eines Widerspruchs ist auf 1 Monat festgesetzt."
    },
    {
      "date": "2025-04-10",
      "id": "106211",
      "original_text": "Löschungsankündigung\nMecklenburg-Vorpommern Amtsgericht Stralsund HRA 1809\nTabakboersen Kay Mittelbach Rostock GmbH & Co. KG – Ribnitz-Damgarten",
      "type": "Löschungsankündigung",
      "state": "Mecklenburg-Vorpommern",
      "amtsgericht": "Amtsgericht Stralsund",
      "registernummer": "HRA 1809",
      "registerart": "HRA",
      "company_name": "Tabakboersen Kay Mittelbach Rostock GmbH & Co. KG",
      "company_seat": "Ribnitz-Damgarten",
      "details": "10.04.2025 (Bekanntmachungsdatum)\n\nMecklenburg-Vorpommern Amtsgericht Stralsund HRA 1809\nLöschungsankündigung\n\nTabakboersen Kay Mittelbach Rostock GmbH & Co. KG\nKommanditgesellschaft\nRibnitz-Damgarten\n\nDas Registergericht beabsichtigt, die Firma von Amts wegen nach § 394 FamFG zu löschen. Die Frist zur Erhebung eines Widerspruchs ist auf 1 Monat festgesetzt."
    },
    {
      "date": "2025-04-10",
      "id": "106212",
      "original_text": "Löschungsankündigung\nMecklenburg-Vorpommern Amtsgericht Stralsund HRA 1800\nTabakboersen Kay Mittelbach Ribnitz GmbH & Co. KG – Ribnitz-Damgarten",
      "type": "Löschungsankündigung",
      "state": "Mecklenburg-Vorpommern",
      "amtsgericht": "Amtsgericht Stralsund",
      "registernummer": "HRA 1800",
      "registerart": "HRA",
      "company_name": "Tabakboersen Kay Mittelbach Ribnitz GmbH & Co. KG",
      "company_seat": "Ribnitz-Damgarten",
      "details": "10.04.2025 (Bekanntmachungsdatum)\n\nMecklenburg-Vorpommern Amtsgericht Stralsund HRA 1800\nLöschungsankündigung\n\nTabakboersen Kay Mittelbach Ribnitz GmbH & Co. KG\nKommanditgesellschaft\nRibnitz-Damgarten\n\nDas Registergericht beabsichtigt, die Firma von Amts wegen nach § 394 FamFG zu löschen. Die Frist zur Erhebung eines Widerspruchs ist auf 1 Monat festgesetzt."
    },
    {
      "date": "2025-04-10",
      "id": "106213",
      "original_text": "Registerbekanntmachung nach dem Umwandlungsgesetz\nBerlin Amtsgericht Berlin (Charlottenburg) HRB 135457\nSeacookie GmbH – Berlin",
      "type": "Registerbekanntmachung nach dem Umwandlungsgesetz",
      "state": "Berlin",
      "amtsgericht": "Amtsgericht Berlin (Charlottenburg)",
      "registernummer": "HRB 135457",
      "registerart": "HRB",
      "company_name": "Seacookie GmbH",
      "company_seat": "Berlin",
      "details": "10.04.2025 (Bekanntmachungsdatum)\n\nBerlin Amtsgericht Berlin (Charlottenburg) HRB 135457\nRegisterbekanntmachung nach dem Umwandlungsgesetz 09.04.2025 (Eintragungsdatum)\n\nSeacookie GmbH\nGesellschaft mit beschränkter Haftung\nBerlin\n\nZu Eintragungsnummer 2 vom 09.04.2025 wird als nicht eingetragen veröffentlicht:Den Gläubigern der an der Verschmelzung beteiligten Rechtsträger ist, wenn sie binnen sechs Monaten nach dem Tag, an dem die Eintragung der Verschmelzung in das Register des Sitzes desjenigen Rechtsträgers, dessen Gläubiger sie sind, als bekannt gemacht gilt, ihren Anspruch nach Grund und Höhe schriftlich anmelden, Sicherheit zu leisten, soweit sie nicht Befriedigung verlangen können. Dieses Recht steht den Gläubigern jedoch nur zu, wenn sie glaubhaft machen, dass durch die Verschmelzung die Erfüllung ihrer Forderung gefährdet wird. Das Recht, Sicherheitsleistung zu verlangen, steht Gläubigern nicht zu, die im Falle der Insolvenz ein Recht auf vorzugsweise Befriedigung aus einer Deckungsmasse haben, die nach gesetzlicher Vorschrift zu ihrem Schutz errichtet und staatlich überwacht ist."
    },
    {
      "date": "2025-04-10",
      "id": "106214",
      "original_text": "Sonstige Registerbekanntmachung\nBrandenburg Amtsgericht Potsdam HRB 36504\nZeitfracht Logistik Holding GmbH – Potsdam",
      "type": "Sonstige Registerbekanntmachung",
      "state": "Brandenburg",
      "amtsgericht": "Amtsgericht Potsdam",
      "registernummer": "HRB 36504",
      "registerart": "HRB",
      "company_name": "Zeitfracht Logistik Holding GmbH",
      "company_seat": "Potsdam",
      "details": "10.04.2025 (Bekanntmachungsdatum)\n\nBrandenburg Amtsgericht Potsdam HRB 36504\nSonstige Registerbekanntmachung\n\nZeitfracht Logistik Holding GmbH\nGesellschaft mit beschränkter Haftung\nPotsdam\n\nAls nicht eingetragen wird veröffentlicht: Den Gläubigern der an der Verschmelzung beteiligten Rechtsträger ist, wenn sie binnen sechs Monaten nach dem Tag, an dem die Eintragung der Verschmelzung in das Register des Sitzes desjenigen Rechtsträgers, dessen Gläubiger sie sind, als bekannt gemacht gilt, ihren Anspruch nach Grund und Höhe schriftlich anmelden, Sicherheit zu leisten, soweit sie nicht Befriedigung verlangen können. Dieses Recht steht den Gläubigern jedoch nur zu, wenn sie glaubhaft machen, dass durch die Verschmelzung die Erfüllung ihrer Forderung gefährdet wird."
    },
    {
      "date": "2025-04-10",
      "id": "106215",
      "original_text": "Sonstige Registerbekanntmachung\nBrandenburg Amtsgericht Potsdam HRB 39915\nKolibri Beteiligung GmbH – Potsdam",
      "type": "Sonstige Registerbekanntmachung",
      "state": "Brandenburg",
      "amtsgericht": "Amtsgericht Potsdam",
      "registernummer": "HRB 39915",
      "registerart": "HRB",
      "company_name": "Kolibri Beteiligung GmbH",
      "company_seat": "Potsdam",
      "details": "10.04.2025 (Bekanntmachungsdatum)\n\nBrandenburg Amtsgericht Potsdam HRB 39915\nSonstige Registerbekanntmachung\n\nKolibri Beteiligung GmbH\nGesellschaft mit beschränkter Haftung\nPotsdam\n\nAls nicht eingetragen wird veröffentlicht: Den Gläubigern der an der Verschmelzung beteiligten Rechtsträger ist, wenn sie binnen sechs Monaten nach dem Tag, an dem die Eintragung der Verschmelzung in das Register des Sitzes desjenigen Rechtsträgers, dessen Gläubiger sie sind, als bekannt gemacht gilt, ihren Anspruch nach Grund und Höhe schriftlich anmelden, Sicherheit zu leisten, soweit sie nicht Befriedigung verlangen können. Dieses Recht steht den Gläubigern jedoch nur zu, wenn sie glaubhaft machen, dass durch die Verschmelzung die Erfüllung ihrer Forderung gefährdet wirdAls nicht eingetragen wird veröffentlicht:"
    },
    {
      "date": "2025-04-10",
      "id": "106216",
      "original_text": "Einreichung neuer Dokumente\nSachsen Amtsgericht Chemnitz HRB 31287\nFDTech GmbH – Chemnitz",
      "type": "Einreichung neuer Dokumente",
      "state": "Sachsen",
      "amtsgericht": "Amtsgericht Chemnitz",
      "registernummer": "HRB 31287",
      "registerart": "HRB",
      "company_name": "FDTech GmbH",
      "company_seat": "Chemnitz",
      "details": "10.04.2025 (Bekanntmachungsdatum)\n\nSachsen Amtsgericht Chemnitz HRB 31287\nEinreichung neuer Dokumente\n\nFDTech GmbH\nGesellschaft mit beschränkter Haftung\nChemnitz\n\nAm 09.04.2025 wurde beim Handelsregister des Amtsgerichts Chemnitz die Liste der Mitglieder des Aufsichtsrats gemäß § 52 GmbHG eingereicht."
    },
    {
      "date": "2025-04-10",
      "id": "106217",
      "original_text": "Löschungsankündigung\nSachsen Amtsgericht Dresden HRB 27609\nModular Haus GmbH – Kottmar",
      "type": "Löschungsankündigung",
      "state": "Sachsen",
      "amtsgericht": "Amtsgericht Dresden",
      "registernummer": "HRB 27609",
      "registerart": "HRB",
      "company_name": "Modular Haus GmbH",
      "company_seat": "Kottmar",
      "details": "10.04.2025 (Bekanntmachungsdatum)\n\nSachsen Amtsgericht Dresden HRB 27609\nLöschungsankündigung\n\nModular Haus GmbH\nGesellschaft mit beschränkter Haftung\nKottmar\n\nDas Registergericht beabsichtigt, die im Handelsregister eingetragene Gesellschaft von Amts wegen nach § 394 FamFG zu löschen. Die Frist zu Erhebung eines Widerspruchs gegen die beabsichtigte Löschung wird auf einen Monat festgesetzt."
    },
    {
      "date": "2025-04-10",
      "id": "106218",
      "original_text": "Löschungsankündigung\nSachsen Amtsgericht Leipzig HRB 42362\nXWOOD Handels GmbH – Leipzig",
      "type": "Löschungsankündigung",
      "state": "Sachsen",
      "amtsgericht": "Amtsgericht Leipzig",
      "registernummer": "HRB 42362",
      "registerart": "HRB",
      "company_name": "XWOOD Handels GmbH",
      "company_seat": "Leipzig",
      "details": "10.04.2025 (Bekanntmachungsdatum)\n\nSachsen Amtsgericht Leipzig HRB 42362\nLöschungsankündigung\n\nXWOOD Handels GmbH\nGesellschaft mit beschränkter Haftung\nLeipzig\n\nDas Registergericht beabsichtigt, die im Handelsregister eingetragene Gesellschaft von Amts wegen nach § 394 FamFG zu löschen. Die Frist zu Erhebung eines Widerspruchs gegen die beabsichtigte Löschung wird auf einen Monat festgesetzt."
    },
    {
      "date": "2025-04-10",
      "id": "106219",
      "original_text": "Einreichung neuer Dokumente\nSachsen Amtsgericht Dresden HRB 4060\nMeißener Stadtwerke GmbH (MSW) – Meißen",
      "type": "Einreichung neuer Dokumente",
      "state": "Sachsen",
      "amtsgericht": "Amtsgericht Dresden",
      "registernummer": "HRB 4060",
      "registerart": "HRB",
      "company_name": "Meißener Stadtwerke GmbH (MSW)",
      "company_seat": "Meißen",
      "details": "10.04.2025 (Bekanntmachungsdatum)\n\nSachsen Amtsgericht Dresden HRB 4060\nEinreichung neuer Dokumente 10.04.2025 (Eintragungsdatum)\n\nMeißener Stadtwerke GmbH (MSW)\nGesellschaft mit beschränkter Haftung\nMeißen\n\nAm 08.04.2025 wurde beim Handelsregister des Amtsgerichts Dresden die Liste der Mitglieder des Aufsichtsrats gemäß § 52 GmbHG eingereicht."
    },
    {
      "date": "2025-04-10",
      "id": "106220",
      "original_text": "Registerbekanntmachung nach dem Umwandlungsgesetz\nHamburg Amtsgericht Hamburg HRA 131016\nENERPARC Solar Invest 230 TU 15 GmbH & Co. KG – Hamburg",
      "type": "Registerbekanntmachung nach dem Umwandlungsgesetz",
      "state": "Hamburg",
      "amtsgericht": "Amtsgericht Hamburg",
      "registernummer": "HRA 131016",
      "registerart": "HRA",
      "company_name": "ENERPARC Solar Invest 230 TU 15 GmbH & Co. KG",
      "company_seat": "Hamburg",
      "details": "10.04.2025 (Bekanntmachungsdatum)\n\nHamburg Amtsgericht Hamburg HRA 131016\nRegisterbekanntmachung nach dem Umwandlungsgesetz 10.04.2025 (Eintragungsdatum)\n\nENERPARC Solar Invest 230 TU 15 GmbH & Co. KG\nKommanditgesellschaft\nHamburg\n\nAls nicht eingetragen wird bekannt gemacht:\nDen Gläubigern der an der Verschmelzung beteiligten Gesellschaften ist, wenn sie binnen sechs Monaten nach dem Tag, an dem die Eintragung der Verschmelzung in das Register des Sitzes desjenigen Rechtsträgers, dessen Gläubiger sie sind, nach § 19 Absatz 3 UmwG als bekannt gemacht gilt, ihren Anspruch nach Grund und Höhe schriftlich anmelden, Sicherheit zu leisten, soweit sie nicht Befriedigung verlangen können. Dieses Recht steht den Gläubigern jedoch nur zu, wenn sie glaubhaft machen, dass durch die Verschmelzung die Erfüllung ihrer Forderung gefährdet wird."
    },
    {
      "date": "2025-04-10",
      "id": "106221",
      "original_text": "Registerbekanntmachung nach dem Umwandlungsgesetz\nHamburg Amtsgericht Hamburg HRB 177058\nSunnic Lighthouse Solar Invest 10 GmbH – Hamburg",
      "type": "Registerbekanntmachung nach dem Umwandlungsgesetz",
      "state": "Hamburg",
      "amtsgericht": "Amtsgericht Hamburg",
      "registernummer": "HRB 177058",
      "registerart": "HRB",
      "company_name": "Sunnic Lighthouse Solar Invest 10 GmbH",
      "company_seat": "Hamburg",
      "details": "10.04.2025 (Bekanntmachungsdatum)\n\nHamburg Amtsgericht Hamburg HRB 177058\nRegisterbekanntmachung nach dem Umwandlungsgesetz 10.04.2025 (Eintragungsdatum)\n\nSunnic Lighthouse Solar Invest 10 GmbH\nGesellschaft mit beschränkter Haftung\nHamburg\n\nAls nicht eingetragen wird bekannt gemacht:\nDen Gläubigern der an der Verschmelzung beteiligten Gesellschaften ist, wenn sie binnen sechs Monaten nach dem Tag, an dem die Eintragung der Verschmelzung in das Register des Sitzes desjenigen Rechtsträgers, dessen Gläubiger sie sind, nach § 19 Absatz 3 UmwG als bekannt gemacht gilt, ihren Anspruch nach Grund und Höhe schriftlich anmelden, Sicherheit zu leisten, soweit sie nicht Befriedigung verlangen können. Dieses Recht steht den Gläubigern jedoch nur zu, wenn sie glaubhaft machen, dass durch die Verschmelzung die Erfüllung ihrer Forderung gefährdet wird."
    },
    {
      "date": "2025-04-10",
      "id": "106222",
      "original_text": "Registerbekanntmachung nach dem Umwandlungsgesetz\nMecklenburg-Vorpommern Amtsgericht Neubrandenburg HRB 6394\nOrwat Bus Verwaltungs GmbH – Löcknitz",
      "type": "Registerbekanntmachung nach dem Umwandlungsgesetz",
      "state": "Mecklenburg-Vorpommern",
      "amtsgericht": "Amtsgericht Neubrandenburg",
      "registernummer": "HRB 6394",
      "registerart": "HRB",
      "company_name": "Orwat Bus Verwaltungs GmbH",
      "company_seat": "Löcknitz",
      "details": "10.04.2025 (Bekanntmachungsdatum)\n\nMecklenburg-Vorpommern Amtsgericht Neubrandenburg HRB 6394\nRegisterbekanntmachung nach dem Umwandlungsgesetz 10.04.2025 (Eintragungsdatum)\n\nOrwat Bus Verwaltungs GmbH\nGesellschaft mit beschränkter Haftung\nLöcknitz\n\nAls nicht eingetragen wird veröffentlicht: Den Gläubigern der an der Verschmelzung beteiligten Rechtsträger ist, wenn sie binnen sechs Monaten nach dem Tag, an dem die Eintragung der Verschmelzung in das Register des Sitzes desjenigen Rechtsträgers, dessen Gläubiger sie sind, nach § 19 Abs. 3 UmwG als bekannt gemacht gilt,\nihren Anspruch nach Grund und Höhe in Textform anmelden, Sicherheit zu leisten, soweit sie nicht Befriedigung verlangen können. Dieses Recht steht den Gläubigern jedoch nur zu, wenn sie glaubhaft machen, dass durch die Verschmelzung die Erfüllung der Forderung gefährdet wird."
    },
    {
      "date": "2025-04-10",
      "id": "106223",
      "original_text": "Registerbekanntmachung nach dem Umwandlungsgesetz\nMecklenburg-Vorpommern Amtsgericht Neubrandenburg HRB 20247\nOrwat Bus Service UG (haftungsbeschränkt) – Löcknitz",
      "type": "Registerbekanntmachung nach dem Umwandlungsgesetz",
      "state": "Mecklenburg-Vorpommern",
      "amtsgericht": "Amtsgericht Neubrandenburg",
      "registernummer": "HRB 20247",
      "registerart": "HRB",
      "company_name": "Orwat Bus Service UG (haftungsbeschränkt)",
      "company_seat": "Löcknitz",
      "details": "10.04.2025 (Bekanntmachungsdatum)\n\nMecklenburg-Vorpommern Amtsgericht Neubrandenburg HRB 20247\nRegisterbekanntmachung nach dem Umwandlungsgesetz 10.04.2025 (Eintragungsdatum)\n\nOrwat Bus Service UG (haftungsbeschränkt)\nGesellschaft mit beschränkter Haftung\nLöcknitz\n\nAls nicht eingetragen wird veröffentlicht: Den Gläubigern der an der Verschmelzung beteiligten Rechtsträger ist, wenn sie binnen sechs Monaten nach dem Tag, an dem die Eintragung der Verschmelzung in das Register des Sitzes desjenigen Rechtsträgers, dessen Gläubiger sie sind, nach § 19 Abs. 3 UmwG als bekannt gemacht gilt,\nihren Anspruch nach Grund und Höhe in Textform anmelden, Sicherheit zu leisten, soweit sie nicht Befriedigung verlangen können. Dieses Recht steht den Gläubigern jedoch nur zu, wenn sie glaubhaft machen, dass durch die Verschmelzung die Erfüllung der Forderung gefährdet wird."
    },
    {
      "date": "2025-04-10",
      "id": "106224",
      "original_text": "Löschungsankündigung\nNiedersachsen Amtsgericht Osnabrück HRB 208072\nPIE Verwaltungs-UG (haftungsbeschränkt) – Quakenbrück",
      "type": "Löschungsankündigung",
      "state": "Niedersachsen",
      "amtsgericht": "Amtsgericht Osnabrück",
      "registernummer": "HRB 208072",
      "registerart": "HRB",
      "company_name": "PIE Verwaltungs-UG (haftungsbeschränkt)",
      "company_seat": "Quakenbrück",
      "details": "10.04.2025 (Bekanntmachungsdatum)\n\nNiedersachsen Amtsgericht Osnabrück HRB 208072\nLöschungsankündigung\n\nPIE Verwaltungs-UG (haftungsbeschränkt)\nGesellschaft mit beschränkter Haftung\nQuakenbrück\n\nDas Registergericht beabsichtigt, die Gesellschaft von Amts wegen nach § 394 FamFG wegen Vermögenslosigkeit zu löschen. Die Frist zur Erhebung eines Widerspruchs ist auf 1 Monat ab dieser Registerbekanntmachung festgesetzt."
    },
    {
      "date": "2025-04-10",
      "id": "106225",
      "original_text": "Registerbekanntmachung nach dem Umwandlungsgesetz\nNiedersachsen Amtsgericht Tostedt HRB 205876\nECo Raw Materials GmbH – Cuxhaven",
      "type": "Registerbekanntmachung nach dem Umwandlungsgesetz",
      "state": "Niedersachsen",
      "amtsgericht": "Amtsgericht Tostedt",
      "registernummer": "HRB 205876",
      "registerart": "HRB",
      "company_name": "ECo Raw Materials GmbH",
      "company_seat": "Cuxhaven",
      "details": "10.04.2025 (Bekanntmachungsdatum)\n\nNiedersachsen Amtsgericht Tostedt HRB 205876\nRegisterbekanntmachung nach dem Umwandlungsgesetz 10.04.2025 (Eintragungsdatum)\n\nECo Raw Materials GmbH\nGesellschaft mit beschränkter Haftung\nCuxhaven\n\nDen Gläubigern der an der Verschmelzung beteiligten Rechtsträger ist, wenn sie binnen sechs Monaten nach dem Tag, an dem die Eintragung der Verschmelzung in das Register des Sitzes desjenigen Rechtsträgers, dessen Gläubiger sie sind, nach § 19  Abs.  3 UmwG als bekannt gemacht gilt, ihren Anspruch nach Grund und Höhe schriftlich anmelden, Sicherheit zu leisten, soweit sie nicht Befriedigung verlangen können. Dieses Recht steht den Gläubigern jedoch nur zu, wenn sie glaubhaft machen, dass durch die Verschmelzung die Erfüllung der Forderung gefährdet wird."
    },
    {
      "date": "2025-04-10",
      "id": "106226",
      "original_text": "Registerbekanntmachung nach dem Umwandlungsgesetz\nNiedersachsen Amtsgericht Tostedt HRB 110311 früher Amtsgericht Langen\nPlambeck Holding GmbH – Cuxhaven",
      "type": "Registerbekanntmachung nach dem Umwandlungsgesetz",
      "state": "Niedersachsen",
      "amtsgericht": "Amtsgericht Tostedt",
      "registernummer": "HRB 110311",
      "registerart": "HRB",
      "company_name": "Plambeck Holding GmbH",
      "company_seat": "Cuxhaven",
      "former_amtsgericht": "Langen",
      "details": "10.04.2025 (Bekanntmachungsdatum)\n\nNiedersachsen Amtsgericht Tostedt HRB 110311 früher Amtsgericht Langen\nRegisterbekanntmachung nach dem Umwandlungsgesetz 10.04.2025 (Eintragungsdatum)\n\nPlambeck Holding GmbH\nGesellschaft mit beschränkter Haftung\nCuxhaven\n\nDen Gläubigern der an der Verschmelzung beteiligten Rechtsträger ist, wenn sie binnen sechs Monaten nach dem Tag, an dem die Eintragung der Verschmelzung in das Register des Sitzes desjenigen Rechtsträgers, dessen Gläubiger sie sind, nach § 19  Abs.  3 UmwG als bekannt gemacht gilt, ihren Anspruch nach Grund und Höhe schriftlich anmelden, Sicherheit zu leisten, soweit sie nicht Befriedigung verlangen können. Dieses Recht steht den Gläubigern jedoch nur zu, wenn sie glaubhaft machen, dass durch die Verschmelzung die Erfüllung der Forderung gefährdet wird."
    },
    {
      "date": "2025-04-10",
      "id": "106227",
      "original_text": "Löschungsankündigung\nNiedersachsen Amtsgericht Oldenburg (Oldenburg) HRB 207597\nVerwaltung MS \"Rosa\" GmbH – Nordenham",
      "type": "Löschungsankündigung",
      "state": "Niedersachsen",
      "amtsgericht": "Amtsgericht Oldenburg (Oldenburg)",
      "registernummer": "HRB 207597",
      "registerart": "HRB",
      "company_name": "Verwaltung MS \"Rosa\" GmbH",
      "company_seat": "Nordenham",
      "details": "10.04.2025 (Bekanntmachungsdatum)\n\nNiedersachsen Amtsgericht Oldenburg (Oldenburg) HRB 207597\nLöschungsankündigung\n\nVerwaltung MS \"Rosa\" GmbH\nGesellschaft mit beschränkter Haftung\nNordenham\n\nDas Registergericht beabsichtigt, die Gesellschaft von Amts wegen nach § 394 FamFG zu löschen. Die Frist zur Erhebung eines Widerspruchs ist auf 1 Monat ab dieser Registerbekanntmachung festgesetzt."
    },
    {
      "date": "2025-04-10",
      "id": "106228",
      "original_text": "Löschungsankündigung\nNiedersachsen Amtsgericht Hannover HRB 206928\nPanelprofi GmbH – Hannover",
      "type": "Löschungsankündigung",
      "state": "Niedersachsen",
      "amtsgericht": "Amtsgericht Hannover",
      "registernummer": "HRB 206928",
      "registerart": "HRB",
      "company_name": "Panelprofi GmbH",
      "company_seat": "Hannover",
      "details": "10.04.2025 (Bekanntmachungsdatum)\n\nNiedersachsen Amtsgericht Hannover HRB 206928\nLöschungsankündigung 10.04.2025 (Eintragungsdatum)\n\nPanelprofi GmbH\nGesellschaft mit beschränkter Haftung\nHannover\n\nDas Registergericht beabsichtigt, die Gesellschaft von Amts wegen nach § 394 FamFG zu löschen. Die Frist zur Erhebung eines Widerspruchs ist auf 1 Monat ab dieser Registerbekanntmachung festgesetzt."
    },
    {
      "date": "2025-04-10",
      "id": "106229",
      "original_text": "Löschungsankündigung\nNiedersachsen Amtsgericht Aurich HRB 912\nWEK Kunststoffverwertung Verwaltungs-GmbH – Großefehn",
      "type": "Löschungsankündigung",
      "state": "Niedersachsen",
      "amtsgericht": "Amtsgericht Aurich",
      "registernummer": "HRB 912",
      "registerart": "HRB",
      "company_name": "WEK Kunststoffverwertung Verwaltungs-GmbH",
      "company_seat": "Großefehn",
      "details": "10.04.2025 (Bekanntmachungsdatum)\n\nNiedersachsen Amtsgericht Aurich HRB 912\nLöschungsankündigung 10.04.2025 (Eintragungsdatum)\n\nWEK Kunststoffverwertung Verwaltungs-GmbH\nGesellschaft mit beschränkter Haftung\nGroßefehn\n\nDas Registergericht beabsichtigt, die Gesellschaft von Amts wegen nach § 394 FamFG zu löschen. Die Frist zur Erhebung eines Widerspruchs ist auf 1 Monat ab dieser Registerbekanntmachung festgesetzt."
    },
    {
      "date": "2025-04-10",
      "id": "106230",
      "original_text": "Löschungsankündigung\nNiedersachsen Amtsgericht Aurich HRB 205603\nMetalhouse Edelstahl GmbH – Leer",
      "type": "Löschungsankündigung",
      "state": "Niedersachsen",
      "amtsgericht": "Amtsgericht Aurich",
      "registernummer": "HRB 205603",
      "registerart": "HRB",
      "company_name": "Metalhouse Edelstahl GmbH",
      "company_seat": "Leer",
      "details": "10.04.2025 (Bekanntmachungsdatum)\n\nNiedersachsen Amtsgericht Aurich HRB 205603\nLöschungsankündigung\n\nMetalhouse Edelstahl GmbH\nGesellschaft mit beschränkter Haftung\nLeer\n\nDas Registergericht beabsichtigt, die Gesellschaft von Amts wegen nach § 394 FamFG zu löschen. Die Frist zur Erhebung eines Widerspruchs ist auf 1 Monat ab dieser Registerbekanntmachung festgesetzt."
    },
    {
      "date": "2025-04-10",
      "id": "106231",
      "original_text": "Registerbekanntmachung nach dem Umwandlungsgesetz\nNiedersachsen Amtsgericht Osnabrück HRB 130640 früher Amtsgericht Nordhorn\nRosen Lichtwerbung GmbH – Bad Bentheim",
      "type": "Registerbekanntmachung nach dem Umwandlungsgesetz",
      "state": "Niedersachsen",
      "amtsgericht": "Amtsgericht Osnabrück",
      "registernummer": "HRB 130640",
      "registerart": "HRB",
      "company_name": "Rosen Lichtwerbung GmbH",
      "company_seat": "Bad Bentheim",
      "former_amtsgericht": "Nordhorn",
      "details": "10.04.2025 (Bekanntmachungsdatum)\n\nNiedersachsen Amtsgericht Osnabrück HRB 130640 früher Amtsgericht Nordhorn\nRegisterbekanntmachung nach dem Umwandlungsgesetz 10.04.2025 (Eintragungsdatum)\n\nRosen Lichtwerbung GmbH\nGesellschaft mit beschränkter Haftung\nBad Bentheim\n\nDen Gläubigern der an der Verschmelzung beteiligten Rechtsträger ist, wenn sie binnen sechs Monaten nach dem Tag, an dem die Eintragung der Verschmelzung in das Register des Sitzes desjenigen Rechtsträgers, dessen Gläubiger sie sind, nach § 19  Abs.  3 UmwG als bekannt gemacht gilt, ihren Anspruch nach Grund und Höhe schriftlich anmelden, Sicherheit zu leisten, soweit sie nicht Befriedigung verlangen können. Dieses Recht steht den Gläubigern jedoch nur zu, wenn sie glaubhaft machen, dass durch die Verschmelzung die Erfüllung der Forderung gefährdet wird."
    },
    {
      "date": "2025-04-10",
      "id": "106232",
      "original_text": "Löschungsankündigung\nBremen Amtsgericht Bremen HRB 36683\nBremer Sportwettengesellschaft mbH – Bremen",
      "type": "Löschungsankündigung",
      "state": "Bremen",
      "amtsgericht": "Amtsgericht Bremen",
      "registernummer": "HRB 36683",
      "registerart": "HRB",
      "company_name": "Bremer Sportwettengesellschaft mbH",
      "company_seat": "Bremen",
      "details": "10.04.2025 (Bekanntmachungsdatum)\n\nBremen Amtsgericht Bremen HRB 36683\nLöschungsankündigung\n\nBremer Sportwettengesellschaft mbH\nGesellschaft mit beschränkter Haftung\nBremen\n\nEs ist beabsichtigt die im Handelsregister eingetragene Gesellschaft von Amts wegen gemäß § 394 FamFG zu löschen. Gegen die Löschung kann beim AG Bremen schriftlich oder zu Protokoll der Geschäftsstelle Widerspruch eingelegt werden. Widerspruchsfrist 4 Wochen."
    },
    {
      "date": "2025-04-10",
      "id": "106233",
      "original_text": "Registerbekanntmachung nach dem Umwandlungsgesetz\nBremen Amtsgericht Bremen HRB 23479\nCELONA Bremen GASTRO GmbH – Bremen",
      "type": "Registerbekanntmachung nach dem Umwandlungsgesetz",
      "state": "Bremen",
      "amtsgericht": "Amtsgericht Bremen",
      "registernummer": "HRB 23479",
      "registerart": "HRB",
      "company_name": "CELONA Bremen GASTRO GmbH",
      "company_seat": "Bremen",
      "details": "10.04.2025 (Bekanntmachungsdatum)\n\nBremen Amtsgericht Bremen HRB 23479\nRegisterbekanntmachung nach dem Umwandlungsgesetz 08.04.2025 (Eintragungsdatum)\n\nCELONA Bremen GASTRO GmbH\nGesellschaft mit beschränkter Haftung\nBremen\n\nZu Eintragungsnummer 7 vom 08.04.2025 wird als nicht eingetragen veröffentlicht: Gläubigern, deren Forderungen begründet worden sind, bevor die Eintragung des Beschlusses als nach § 10 des Handelsgesetzbuches bekannt gemacht gilt, ist, wenn sie sich binnen sechs Monaten nach der Bekanntmachung zu diesem Zweck melden, Sicherheit zu leisten, soweit sie nicht Befriedigung verlangen können. Dieses Recht steht den Gläubigern nicht zu, die im Fall des Insolvenzverfahrens ein Recht auf vorzugsweise Befriedigung aus der Deckungsmasse haben, die nach gesetzlicher Vorschrift zu ihrem Schutz errichtet und staatlich überwacht ist."
    },
    {
      "date": "2025-04-10",
      "id": "106234",
      "original_text": "Registerbekanntmachung nach dem Umwandlungsgesetz\nRheinland-Pfalz Amtsgericht Ludwigshafen a.Rhein (Ludwigshafen) HRB 62058\nMedtek Medizintechnik GmbH – Grünstadt",
      "type": "Registerbekanntmachung nach dem Umwandlungsgesetz",
      "state": "Rheinland-Pfalz",
      "amtsgericht": "Amtsgericht Ludwigshafen a.Rhein (Ludwigshafen)",
      "registernummer": "HRB 62058",
      "registerart": "HRB",
      "company_name": "Medtek Medizintechnik GmbH",
      "company_seat": "Grünstadt",
      "details": "10.04.2025 (Bekanntmachungsdatum)\n\nRheinland-Pfalz Amtsgericht Ludwigshafen a.Rhein (Ludwigshafen) HRB 62058\nRegisterbekanntmachung nach dem Umwandlungsgesetz 10.04.2025 (Eintragungsdatum)\n\nMedtek Medizintechnik GmbH\nGesellschaft mit beschränkter Haftung\nGrünstadt\n\nAls nicht eingetragen wird veröffentlicht: Den Gläubigern der an der Verschmelzung beteiligten Rechtsträger ist, wenn sie binnen sechs Monaten nach dem Tag, an dem die Eintragung der Verschmelzung in das Register des Sitzes desjenigen Rechtsträgers, dessen Gläubiger sie sind, nach § 19 Abs. 3 UmwG als bekannt gemacht gilt, ihren Anspruch nach Grund und Höhe schriftlich anmelden, Sicherheit zu leisten, soweit sie nicht Befriedigung verlangen können. Dieses Recht steht den Gläubigern jedoch nur zu, wenn sie glaubhaft machen, dass durch die Verschmelzung die Erfüllung der Forderung gefährdet wird."
    },
    {
      "date": "2025-04-10",
      "id": "106235",
      "original_text": "Einreichung neuer Dokumente\nNordrhein-Westfalen Amtsgericht Steinfurt HRB 3009\nSchmitz Cargobull Aktiengesellschaft – Altenberge",
      "type": "Einreichung neuer Dokumente",
      "state": "Nordrhein-Westfalen",
      "amtsgericht": "Amtsgericht Steinfurt",
      "registernummer": "HRB 3009",
      "registerart": "HRB",
      "company_name": "Schmitz Cargobull Aktiengesellschaft",
      "company_seat": "Altenberge",
      "details": "10.04.2025 (Bekanntmachungsdatum)\n\nNordrhein-Westfalen Amtsgericht Steinfurt HRB 3009\nEinreichung neuer Dokumente 10.04.2025 (Eintragungsdatum)\n\nSchmitz Cargobull Aktiengesellschaft\nAktiengesellschaft\nAltenberge\n\nDem Registergericht ist eine neue Liste der Mitglieder des Aufsichtsrates eingereicht worden."
    },
    {
      "date": "2025-04-10",
      "id": "106236",
      "original_text": "Registerbekanntmachung nach dem Umwandlungsgesetz\nNordrhein-Westfalen Amtsgericht Arnsberg HRB 14313\nHST Asia GmbH – Meschede",
      "type": "Registerbekanntmachung nach dem Umwandlungsgesetz",
      "state": "Nordrhein-Westfalen",
      "amtsgericht": "Amtsgericht Arnsberg",
      "registernummer": "HRB 14313",
      "registerart": "HRB",
      "company_name": "HST Asia GmbH",
      "company_seat": "Meschede",
      "details": "10.04.2025 (Bekanntmachungsdatum)\n\nNordrhein-Westfalen Amtsgericht Arnsberg HRB 14313\nRegisterbekanntmachung nach dem Umwandlungsgesetz 10.04.2025 (Eintragungsdatum)\n\nHST Asia GmbH\nGesellschaft mit beschränkter Haftung\nMeschede\n\nDen Gläubigern der an der Verschmelzung beteiligten Rechtsträger ist, wenn sie binnen sechs Monaten nach dem Tag, an dem die Eintragung der Verschmelzung in das Register des Sitzes desjenigen Rechtsträgers, dessen Gläubiger sie sind, nach § 19 Absatz 3 UmwG als bekanntgemacht gilt, ihren Anspruch nach Grund und Höhe schriftlich anmelden, Sicherheit zu leisten, soweit sie nicht Befriedigung verlangen können. Dieses Recht steht den Gläubigern jedoch nur zu, wenn sie glaubhaft machen, dass durch die Verschmelzung die Erfüllung ihrer Forderung gefährdet wird."
    },
    {
      "date": "2025-04-10",
      "id": "106237",
      "original_text": "Registerbekanntmachung nach dem Umwandlungsgesetz\nNordrhein-Westfalen Amtsgericht Aachen HRA 4824\nWeiss-Verlag GmbH & Co. KG – Monschau",
      "type": "Registerbekanntmachung nach dem Umwandlungsgesetz",
      "state": "Nordrhein-Westfalen",
      "amtsgericht": "Amtsgericht Aachen",
      "registernummer": "HRA 4824",
      "registerart": "HRA",
      "company_name": "Weiss-Verlag GmbH & Co. KG",
      "company_seat": "Monschau",
      "details": "10.04.2025 (Bekanntmachungsdatum)\n\nNordrhein-Westfalen Amtsgericht Aachen HRA 4824\nRegisterbekanntmachung nach dem Umwandlungsgesetz 10.04.2025 (Eintragungsdatum)\n\nWeiss-Verlag GmbH & Co. KG\nKommanditgesellschaft\nMonschau\n\nDen Gläubigern der an der Verschmelzung beteiligten Rechtsträger ist, wenn sie binnen sechs Monaten nach dem Tag, an dem die Eintragung der Verschmelzung in das Register des Sitzes desjenigen Rechtsträgers, dessen Gläubiger sie sind, nach § 19 Absatz 3 UmwG als bekanntgemacht gilt, ihren Anspruch nach Grund und Höhe schriftlich anmelden, Sicherheit zu leisten, soweit sie nicht Befriedigung verlangen können. Dieses Recht steht den Gläubigern jedoch nur zu, wenn sie glaubhaft machen, dass durch die Verschmelzung die Erfüllung ihrer Forderung gefährdet wird."
    },
    {
      "date": "2025-04-10",
      "id": "106238",
      "original_text": "Einreichung neuer Dokumente\nNordrhein-Westfalen Amtsgericht Essen HRB 20227\nEvonik Operations GmbH – Essen",
      "type": "Einreichung neuer Dokumente",
      "state": "Nordrhein-Westfalen",
      "amtsgericht": "Amtsgericht Essen",
      "registernummer": "HRB 20227",
      "registerart": "HRB",
      "company_name": "Evonik Operations GmbH",
      "company_seat": "Essen",
      "details": "10.04.2025 (Bekanntmachungsdatum)\n\nNordrhein-Westfalen Amtsgericht Essen HRB 20227\nEinreichung neuer Dokumente\n\nEvonik Operations GmbH\nGesellschaft mit beschränkter Haftung\nEssen\n\nDem Registergericht ist eine neue Liste der Mitglieder des Aufsichtsrates eingereicht worden."
    },
    {
      "date": "2025-04-10",
      "id": "106239",
      "original_text": "Einreichung neuer Dokumente\nNordrhein-Westfalen Amtsgericht Bonn HRB 17517\nA X E K U R A N Z Schadenmanagement GmbH – Bonn",
      "type": "Einreichung neuer Dokumente",
      "state": "Nordrhein-Westfalen",
      "amtsgericht": "Amtsgericht Bonn",
      "registernummer": "HRB 17517",
      "registerart": "HRB",
      "company_name": "A X E K U R A N Z Schadenmanagement GmbH",
      "company_seat": "Bonn",
      "details": "10.04.2025 (Bekanntmachungsdatum)\n\nNordrhein-Westfalen Amtsgericht Bonn HRB 17517\nEinreichung neuer Dokumente 10.04.2025 (Eintragungsdatum)\n\nA X E K U R A N Z Schadenmanagement GmbH\nGesellschaft mit beschränkter Haftung\nBonn\n\nDem Registergericht ist eine neue Liste der Mitglieder des Aufsichtsrates eingereicht worden."
    },
    {
      "date": "2025-04-10",
      "id": "106240",
      "original_text": "Registerbekanntmachung nach dem Umwandlungsgesetz\nNordrhein-Westfalen Amtsgericht Arnsberg HRB 13229\nEnhance Yourself UG (haftungsbeschränkt) – Schmallenberg",
      "type": "Registerbekanntmachung nach dem Umwandlungsgesetz",
      "state": "Nordrhein-Westfalen",
      "amtsgericht": "Amtsgericht Arnsberg",
      "registernummer": "HRB 13229",
      "registerart": "HRB",
      "company_name": "Enhance Yourself UG (haftungsbeschränkt)",
      "company_seat": "Schmallenberg",
      "details": "10.04.2025 (Bekanntmachungsdatum)\n\nNordrhein-Westfalen Amtsgericht Arnsberg HRB 13229\nRegisterbekanntmachung nach dem Umwandlungsgesetz 10.04.2025 (Eintragungsdatum)\n\nEnhance Yourself UG (haftungsbeschränkt)\nGesellschaft mit beschränkter Haftung\nSchmallenberg\n\nDen Gläubigern der an der Vermögensübertragung beteiligten Rechtsträger ist, wenn sie binnen sechs Monaten nach dem Tag, an dem die Eintragung der Vermögensübertragung in das Register des Sitzes desjenigen Rechtsträgers, dessen Gläubiger sie sind, nach § 19 Absatz 3 UmwG als bekanntgemacht gilt, ihren Anspruch nach Grund und Höhe schriftlich anmelden, Sicherheit zu leisten, soweit sie nicht Befriedigung verlangen können. Dieses Recht steht den Gläubigern jedoch nur zu, wenn sie glaubhaft machen, dass durch die Vermögensübertragung die Erfüllung ihrer Forderung gefährdet wird."
    },
    {
      "date": "2025-04-10",
      "id": "106241",
      "original_text": "Löschungsankündigung\nNordrhein-Westfalen Amtsgericht Wuppertal HRB 22380\nWinbau GmbH – Wuppertal",
      "type": "Löschungsankündigung",
      "state": "Nordrhein-Westfalen",
      "amtsgericht": "Amtsgericht Wuppertal",
      "registernummer": "HRB 22380",
      "registerart": "HRB",
      "company_name": "Winbau GmbH",
      "company_seat": "Wuppertal",
      "details": "10.04.2025 (Bekanntmachungsdatum)\n\nNordrhein-Westfalen Amtsgericht Wuppertal HRB 22380\nLöschungsankündigung\n\nWinbau GmbH\nGesellschaft mit beschränkter Haftung\nWuppertal\n\nDas Registergericht beabsichtigt die Gesellschaft von Amts wegen nach § 394 FamFG zu löschen. Die Frist zur Erhebung eines Widerspruchs ist auf einen Monat festgesetzt."
    },
    {
      "date": "2025-04-10",
      "id": "106242",
      "original_text": "Einreichung neuer Dokumente\nNordrhein-Westfalen Amtsgericht Münster HRB 20587\nBisplinghoff AG – Sendenhorst",
      "type": "Einreichung neuer Dokumente",
      "state": "Nordrhein-Westfalen",
      "amtsgericht": "Amtsgericht Münster",
      "registernummer": "HRB 20587",
      "registerart": "HRB",
      "company_name": "Bisplinghoff AG",
      "company_seat": "Sendenhorst",
      "details": "10.04.2025 (Bekanntmachungsdatum)\n\nNordrhein-Westfalen Amtsgericht Münster HRB 20587\nEinreichung neuer Dokumente\n\nBisplinghoff AG\nAktiengesellschaft\nSendenhorst\n\nDem Registergericht ist eine neue Liste der Mitglieder des Aufsichtsrates eingereicht worden."
    },
    {
      "date": "2025-04-10",
      "id": "106243",
      "original_text": "Registerbekanntmachung nach dem Umwandlungsgesetz\nNordrhein-Westfalen Amtsgericht Arnsberg HRB 12621\nHST Asia GmbH – Meschede",
      "type": "Registerbekanntmachung nach dem Umwandlungsgesetz",
      "state": "Nordrhein-Westfalen",
      "amtsgericht": "Amtsgericht Arnsberg",
      "registernummer": "HRB 12621",
      "registerart": "HRB",
      "company_name": "HST Asia GmbH",
      "company_seat": "Meschede",
      "details": "10.04.2025 (Bekanntmachungsdatum)\n\nNordrhein-Westfalen Amtsgericht Arnsberg HRB 12621\nRegisterbekanntmachung nach dem Umwandlungsgesetz 10.04.2025 (Eintragungsdatum)\n\nHST Asia GmbH\nGesellschaft mit beschränkter Haftung\nMeschede\n\nDen Gläubigern der an der Verschmelzung beteiligten Rechtsträger ist, wenn sie binnen sechs Monaten nach dem Tag, an dem die Eintragung der Verschmelzung in das Register des Sitzes desjenigen Rechtsträgers, dessen Gläubiger sie sind, nach § 19 Absatz 3 UmwG als bekanntgemacht gilt, ihren Anspruch nach Grund und Höhe schriftlich anmelden, Sicherheit zu leisten, soweit sie nicht Befriedigung verlangen können. Dieses Recht steht den Gläubigern jedoch nur zu, wenn sie glaubhaft machen, dass durch die Verschmelzung die Erfüllung ihrer Forderung gefährdet wird."
    },
    {
      "date": "2025-04-10",
      "id": "106244",
      "original_text": "Löschungsankündigung\nNordrhein-Westfalen Amtsgericht Bochum HRB 18631\nTOLKA GmbH – Bochum",
      "type": "Löschungsankündigung",
      "state": "Nordrhein-Westfalen",
      "amtsgericht": "Amtsgericht Bochum",
      "registernummer": "HRB 18631",
      "registerart": "HRB",
      "company_name": "TOLKA GmbH",
      "company_seat": "Bochum",
      "details": "10.04.2025 (Bekanntmachungsdatum)\n\nNordrhein-Westfalen Amtsgericht Bochum HRB 18631\nLöschungsankündigung\n\nTOLKA GmbH\nGesellschaft mit beschränkter Haftung\nBochum\n\nDas Registergericht beabsichtigt die Gesellschaft von Amts wegen nach § 394 FamFG zu löschen. Die Frist zur Erhebung eines Widerspruchs ist auf drei Monate festgesetzt."
    },
    {
      "date": "2025-04-10",
      "id": "106245",
      "original_text": "Löschungsankündigung\nNordrhein-Westfalen Amtsgericht Gelsenkirchen HRB 17171\nA & M Transportservice GmbH – Gelsenkirchen",
      "type": "Löschungsankündigung",
      "state": "Nordrhein-Westfalen",
      "amtsgericht": "Amtsgericht Gelsenkirchen",
      "registernummer": "HRB 17171",
      "registerart": "HRB",
      "company_name": "A & M Transportservice GmbH",
      "company_seat": "Gelsenkirchen",
      "details": "10.04.2025 (Bekanntmachungsdatum)\n\nNordrhein-Westfalen Amtsgericht Gelsenkirchen HRB 17171\nLöschungsankündigung\n\nA & M Transportservice GmbH\nGesellschaft mit beschränkter Haftung\nGelsenkirchen\n\nDas Gericht beabsichtigt, die Gesellschaft A & M Transportservice GmbH mit Sitz in Gelsenkirchen, HRB 17171 Amtsgericht Gelsenkirchen, wegen Vermögenslosigkeit zu löschen.\n\nHiermit wird denjenigen, die an der Unterlassung der Löschung ein berechtigtes Interesse haben, gem. § 394 Abs. 2 FamFG Gelegenheit gegeben, gegen dieses Vorhaben binnen eines Monats nach dieser Bekanntmachung Widerspruch einzulegen. Der Widerspruch kann schriftlich oder zu Protokoll der Geschäftsstelle erhoben werden."
    },
    {
      "date": "2025-04-10",
      "id": "106246",
      "original_text": "Löschungsankündigung\nNordrhein-Westfalen Amtsgericht Düsseldorf HRB 100266\nHTMG UG (haftungsbeschränkt) – Düsseldorf",
      "type": "Löschungsankündigung",
      "state": "Nordrhein-Westfalen",
      "amtsgericht": "Amtsgericht Düsseldorf",
      "registernummer": "HRB 100266",
      "registerart": "HRB",
      "company_name": "HTMG UG (haftungsbeschränkt)",
      "company_seat": "Düsseldorf",
      "details": "10.04.2025 (Bekanntmachungsdatum)\n\nNordrhein-Westfalen Amtsgericht Düsseldorf HRB 100266\nLöschungsankündigung\n\nHTMG UG (haftungsbeschränkt)\nGesellschaft mit beschränkter Haftung\nDüsseldorf\n\nDas Registergericht beabsichtigt die Gesellschaft von Amts wegen nach § 394 Abs. 1 FamFG zu löschen. Die Frist zur Erhebung eines Widerspruchs ist auf einen Monat festgesetzt.\n\nRechtsbehelfsbelehrung:\nDas Widerspruchsrecht steht jedem zu, der an der Unterlassung der Löschung ein berechtigtes Interesse hat. Der Widerspruch ist bei dem Amtsgericht Düsseldorf -Registergericht-, Werdener Straße 1, 40227 Düsseldorf schriftlich in deutscher Sprache oder zur Niederschrift der Geschäftsstelle einzulegen. Der Widerspruch kann auch zur Niederschrift der Geschäftsstelle eines jeden Amtsgerichtes abgegeben werden. Die Einlegung ist auch durch Übertragung eines elektronischen Dokuments an die elektronische Poststelle des Gerichts möglich. Das elektronische Dokument muss für die Bearbeitung durch das Gericht geeignet und mit einer qualifizierten elektronischen Signatur der verantwortenden Person versehen sein oder von der verantwortenden Person signiert und auf einem sicheren Übermittlungsweg gemäß § 130a ZPO nach näherer Maßgabe der Verordnung über die technischen Rahmenbedingungen des elektronischen Rechtsverkehrs und über das besondere elektronische Behördenpostfach (BGBl. I, S.3803) eingereicht werden. Weitere Informationen erhalten Sie auf der Internetseite www.justiz.de.\nDer Widerspruch muss spätestens innerhalb der gesetzten Frist nach dem Datum der Bekanntmachung der Löschungsankündigung bei dem Amtsgericht - Registergericht - Düsseldorf eingegangen sein.  Dies gilt auch dann, wenn der Widerspruch zur Niederschrift der Geschäftsstelle eines anderen Amtsgerichtes abgegeben wurde. Die Frist beginnt mit dem Tage der Bekanntmachung der Löschungsankündigung in dem für die Bekanntmachung der Eintragungen in das Handelsregister bestimmten elektronischen Informations- und Kommunikationssystem nach § 10 des Handelsgesetzbuches. Fällt das Ende der Frist auf einen Sonntag, einen allgemeinen Feiertag oder Sonnabend, so endet die Frist mit Ablauf des nächsten Werktages.\nDer Widerspruch muss die Bezeichnung der angefochtenen Löschungsankündigung sowie die Erklärung enthalten, dass Widerspruch gegen diese Löschungsankündigung eingelegt wird. Er ist zu unterzeichnen und soll begründet werden."
    },
    {
      "date": "2025-04-10",
      "id": "106247",
      "original_text": "Registerbekanntmachung nach dem Umwandlungsgesetz\nNordrhein-Westfalen Amtsgericht Köln HRA 37957\nFrau Ute Schaetze - Besitzunternehmen e.K – Köln",
      "type": "Registerbekanntmachung nach dem Umwandlungsgesetz",
      "state": "Nordrhein-Westfalen",
      "amtsgericht": "Amtsgericht Köln",
      "registernummer": "HRA 37957",
      "registerart": "HRA",
      "company_name": "Frau Ute Schaetze - Besitzunternehmen e.K",
      "company_seat": "Köln",
      "details": "10.04.2025 (Bekanntmachungsdatum)\n\nNordrhein-Westfalen Amtsgericht Köln HRA 37957\nRegisterbekanntmachung nach dem Umwandlungsgesetz 10.04.2025 (Eintragungsdatum)\n\nFrau Ute Schaetze - Besitzunternehmen e.K\nEinzelkaufmann / Einzelkauffrau\nKöln\n\nDen Gläubigern der an der Ausgliederung beteiligten Rechtsträger ist, wenn sie binnen sechs Monaten nach dem Tag, an dem die Eintragung der Ausgliederung in das Register des Sitzes desjenigen Rechtsträgers, dessen Gläubiger sie sind, nach § 19 Absatz 3 UmwG als bekanntgemacht gilt, ihren Anspruch nach Grund und Höhe schriftlich anmelden, Sicherheit zu leisten, soweit sie nicht Befriedigung verlangen können. Dieses Recht steht den Gläubigern jedoch nur zu, wenn sie glaubhaft machen, dass durch die Ausgliederung die Erfüllung ihrer Forderung gefährdet wird."
    },
    {
      "date": "2025-04-10",
      "id": "106248",
      "original_text": "Löschungsankündigung\nNordrhein-Westfalen Amtsgericht Bad Oeynhausen HRB 13483\nPhönix Beteiligungsgesellschaft mbH – Bad Oeynhausen",
      "type": "Löschungsankündigung",
      "state": "Nordrhein-Westfalen",
      "amtsgericht": "Amtsgericht Bad Oeynhausen",
      "registernummer": "HRB 13483",
      "registerart": "HRB",
      "company_name": "Phönix Beteiligungsgesellschaft mbH",
      "company_seat": "Bad Oeynhausen",
      "details": "10.04.2025 (Bekanntmachungsdatum)\n\nNordrhein-Westfalen Amtsgericht Bad Oeynhausen HRB 13483\nLöschungsankündigung\n\nPhönix Beteiligungsgesellschaft mbH\nGesellschaft mit beschränkter Haftung\nBad Oeynhausen\n\nDas Registergericht beabsichtigt die Gesellschaft von Amts wegen nach § 394 FamFG zu löschen. Die Frist zur Erhebung eines Widerspruchs ist auf einen Monat festgesetzt."
    },
    {
      "date": "2025-04-10",
      "id": "106249",
      "original_text": "Löschungsankündigung\nNordrhein-Westfalen Amtsgericht Bochum HRB 10690\nIMT Immobilien Management Trust GmbH – Witten",
      "type": "Löschungsankündigung",
      "state": "Nordrhein-Westfalen",
      "amtsgericht": "Amtsgericht Bochum",
      "registernummer": "HRB 10690",
      "registerart": "HRB",
      "company_name": "IMT Immobilien Management Trust GmbH",
      "company_seat": "Witten",
      "details": "10.04.2025 (Bekanntmachungsdatum)\n\nNordrhein-Westfalen Amtsgericht Bochum HRB 10690\nLöschungsankündigung\n\nIMT Immobilien Management Trust GmbH\nGesellschaft mit beschränkter Haftung\nWitten\n\nDas Registergericht beabsichtigt die Gesellschaft von Amts wegen nach § 394 FamFG zu löschen. Die Frist zur Erhebung eines Widerspruchs ist auf drei Monate festgesetzt."
    },
    {
      "date": "2025-04-10",
      "id": "106250",
      "original_text": "Registerbekanntmachung nach dem Umwandlungsgesetz\nNordrhein-Westfalen Amtsgericht Lemgo HRB 6625\nHoffschmidt Lichtwerbung GmbH – Lage",
      "type": "Registerbekanntmachung nach dem Umwandlungsgesetz",
      "state": "Nordrhein-Westfalen",
      "amtsgericht": "Amtsgericht Lemgo",
      "registernummer": "HRB 6625",
      "registerart": "HRB",
      "company_name": "Hoffschmidt Lichtwerbung GmbH",
      "company_seat": "Lage",
      "details": "10.04.2025 (Bekanntmachungsdatum)\n\nNordrhein-Westfalen Amtsgericht Lemgo HRB 6625\nRegisterbekanntmachung nach dem Umwandlungsgesetz 10.04.2025 (Eintragungsdatum)\n\nHoffschmidt Lichtwerbung GmbH\nGesellschaft mit beschränkter Haftung\nLage"
    },
    {
      "date": "2025-04-10",
      "id": "106251",
      "original_text": "Registerbekanntmachung nach dem Umwandlungsgesetz\nNordrhein-Westfalen Amtsgericht Gelsenkirchen HRB 17509\nTDA Clair GmbH – Bottrop",
      "type": "Registerbekanntmachung nach dem Umwandlungsgesetz",
      "state": "Nordrhein-Westfalen",
      "amtsgericht": "Amtsgericht Gelsenkirchen",
      "registernummer": "HRB 17509",
      "registerart": "HRB",
      "company_name": "TDA Clair GmbH",
      "company_seat": "Bottrop",
      "details": "10.04.2025 (Bekanntmachungsdatum)\n\nNordrhein-Westfalen Amtsgericht Gelsenkirchen HRB 17509\nRegisterbekanntmachung nach dem Umwandlungsgesetz 10.04.2025 (Eintragungsdatum)\n\nTDA Clair GmbH\nGesellschaft mit beschränkter Haftung\nBottrop\n\nDen Gläubigern der an der Verschmelzung beteiligten Rechtsträger ist, wenn sie binnen sechs Monaten nach dem Tag, an dem die Eintragung der Verschmelzung in das Register des Sitzes desjenigen Rechtsträgers, dessen Gläubiger sie sind, nach § 19 Absatz 3 UmwG als bekanntgemacht gilt, ihren Anspruch nach Grund und Höhe schriftlich anmelden, Sicherheit zu leisten, soweit sie nicht Befriedigung verlangen können. Dieses Recht steht den Gläubigern jedoch nur zu, wenn sie glaubhaft machen, dass durch die Verschmelzung die Erfüllung ihrer Forderung gefährdet wird."
    },
    {
      "date": "2025-04-10",
      "id": "106252",
      "original_text": "Löschungsankündigung\nNordrhein-Westfalen Amtsgericht Kleve HRB 13464\nES Handels GmbH – Emmerich am Rhein",
      "type": "Löschungsankündigung",
      "state": "Nordrhein-Westfalen",
      "amtsgericht": "Amtsgericht Kleve",
      "registernummer": "HRB 13464",
      "registerart": "HRB",
      "company_name": "ES Handels GmbH",
      "company_seat": "Emmerich am Rhein",
      "details": "10.04.2025 (Bekanntmachungsdatum)\n\nNordrhein-Westfalen Amtsgericht Kleve HRB 13464\nLöschungsankündigung\n\nES Handels GmbH\nGesellschaft mit beschränkter Haftung\nEmmerich am Rhein\n\nDas Registergericht beabsichtigt die Gesellschaft von Amts wegen nach § 394 FamFG zu löschen. Die Frist zur Erhebung eines Widerspruchs ist auf einen Monat festgesetzt."
    },
    {
      "date": "2025-04-10",
      "id": "106253",
      "original_text": "Registerbekanntmachung nach dem Umwandlungsgesetz\nNordrhein-Westfalen Amtsgericht Aachen HRB 9117\nTW Wochenspiegel Verwaltungs-GmbH – Monschau",
      "type": "Registerbekanntmachung nach dem Umwandlungsgesetz",
      "state": "Nordrhein-Westfalen",
      "amtsgericht": "Amtsgericht Aachen",
      "registernummer": "HRB 9117",
      "registerart": "HRB",
      "company_name": "TW Wochenspiegel Verwaltungs-GmbH",
      "company_seat": "Monschau",
      "details": "10.04.2025 (Bekanntmachungsdatum)\n\nNordrhein-Westfalen Amtsgericht Aachen HRB 9117\nRegisterbekanntmachung nach dem Umwandlungsgesetz 10.04.2025 (Eintragungsdatum)\n\nTW Wochenspiegel Verwaltungs-GmbH\nGesellschaft mit beschränkter Haftung\nMonschau\n\nDen Gläubigern der an der Verschmelzung beteiligten Rechtsträger ist, wenn sie binnen sechs Monaten nach dem Tag, an dem die Eintragung der Verschmelzung in das Register des Sitzes desjenigen Rechtsträgers, dessen Gläubiger sie sind, nach § 19 Absatz 3 UmwG als bekanntgemacht gilt, ihren Anspruch nach Grund und Höhe schriftlich anmelden, Sicherheit zu leisten, soweit sie nicht Befriedigung verlangen können. Dieses Recht steht den Gläubigern jedoch nur zu, wenn sie glaubhaft machen, dass durch die Verschmelzung die Erfüllung ihrer Forderung gefährdet wird."
    },
    {
      "date": "2025-04-10",
      "id": "106254",
      "original_text": "Löschungsankündigung\nNordrhein-Westfalen Amtsgericht Siegburg HRA 5377\nFields and Wells, Software and Services KG – Sankt Augustin",
      "type": "Löschungsankündigung",
      "state": "Nordrhein-Westfalen",
      "amtsgericht": "Amtsgericht Siegburg",
      "registernummer": "HRA 5377",
      "registerart": "HRA",
      "company_name": "Fields and Wells, Software and Services KG",
      "company_seat": "Sankt Augustin",
      "details": "10.04.2025 (Bekanntmachungsdatum)\n\nNordrhein-Westfalen Amtsgericht Siegburg HRA 5377\nLöschungsankündigung\n\nFields and Wells, Software and Services KG\nKommanditgesellschaft\nSankt Augustin\n\nDie im hiesigen Handelsregister eingetragene Firma  Fields and Wells, Software and Services KG soll gemäß § 31 Absatz 2 HGB i.V.m. § 393 FamFG von Amts wegen gelöscht werden. Ein etwaiger Widerspruch gegen die beabsichtigte Löschung ist binnen einer Frist von drei Monaten bei dem Registergericht geltend zu machen, anderenfalls wird die Löschung der Firma erfolgen."
    },
    {
      "date": "2025-04-10",
      "id": "106255",
      "original_text": "Einreichung neuer Dokumente\nNordrhein-Westfalen Amtsgericht Wuppertal HRB 3865\nEvangelische Altenhilfe Ronsdorf gemeinnützige GmbH – Wuppertal",
      "type": "Einreichung neuer Dokumente",
      "state": "Nordrhein-Westfalen",
      "amtsgericht": "Amtsgericht Wuppertal",
      "registernummer": "HRB 3865",
      "registerart": "HRB",
      "company_name": "Evangelische Altenhilfe Ronsdorf gemeinnützige GmbH",
      "company_seat": "Wuppertal",
      "details": "10.04.2025 (Bekanntmachungsdatum)\n\nNordrhein-Westfalen Amtsgericht Wuppertal HRB 3865\nEinreichung neuer Dokumente 10.04.2025 (Eintragungsdatum)\n\nEvangelische Altenhilfe Ronsdorf gemeinnützige GmbH\nGesellschaft mit beschränkter Haftung\nWuppertal\n\nDem Registergericht ist eine neue Liste der Mitglieder des Aufsichtsrates eingereicht worden."
    },
    {
      "date": "2025-04-10",
      "id": "106256",
      "original_text": "Registerbekanntmachung nach dem Umwandlungsgesetz\nNordrhein-Westfalen Amtsgericht Bochum HRB 21276\n4Brain GmbH – Witten",
      "type": "Registerbekanntmachung nach dem Umwandlungsgesetz",
      "state": "Nordrhein-Westfalen",
      "amtsgericht": "Amtsgericht Bochum",
      "registernummer": "HRB 21276",
      "registerart": "HRB",
      "company_name": "4Brain GmbH",
      "company_seat": "Witten",
      "details": "10.04.2025 (Bekanntmachungsdatum)\n\nNordrhein-Westfalen Amtsgericht Bochum HRB 21276\nRegisterbekanntmachung nach dem Umwandlungsgesetz 09.04.2025 (Eintragungsdatum)\n\n4Brain GmbH\nGesellschaft mit beschränkter Haftung\nWitten\n\nDen Gläubigern der an der Verschmelzung beteiligten Rechtsträger ist, wenn sie binnen sechs Monaten nach dem Tag, an dem die Eintragung der Verschmelzung in das Register des Sitzes derjenigen Rechtsträger deren Gläubiger sie sind, nach § 19 Absatz 3 UmwG als bekanntgemacht gilt, ihren Anspruch nach Grund und Höhe schriftlich anmelden, Sicherheit zu leisten, soweit sie nicht Befriedigung verlangen können. Dieses Recht steht den Gläubigern jedoch nur zu, wenn sie glaubhaft machen, dass durch die Verschmelzung die Erfüllung ihrer Forderung gefährdet wird."
    },
    {
      "date": "2025-04-10",
      "id": "106257",
      "original_text": "Löschungsankündigung\nHessen Amtsgericht Offenbach am Main HRB 50338\nFinest Choice UG (haftungsbeschränkt) – Langen (Hessen)",
      "type": "Löschungsankündigung",
      "state": "Hessen",
      "amtsgericht": "Amtsgericht Offenbach am Main",
      "registernummer": "HRB 50338",
      "registerart": "HRB",
      "company_name": "Finest Choice UG (haftungsbeschränkt)",
      "company_seat": "Langen (Hessen)",
      "details": "10.04.2025 (Bekanntmachungsdatum)\n\nHessen Amtsgericht Offenbach am Main HRB 50338\nLöschungsankündigung\n\nFinest Choice UG (haftungsbeschränkt)\nGesellschaft mit beschränkter Haftung\nLangen (Hessen)\n\nDas Registergericht beabsichtigt die im Handelsregister eingetragene Gesellschaft von Amts wegen nach § 394 FamFG zu löschen. Die Frist zur Erhebung eines Widerspruchs gegen die beabsichtigte Löschung wird auf 3 Monate festgesetzt."
    },
    {
      "date": "2025-04-10",
      "id": "106258",
      "original_text": "Löschungsankündigung\nHessen Amtsgericht Frankfurt am Main HRB 54214\nEconomy zwölfte Verwaltungsgesellschaft mbH – Frankfurt am Main",
      "type": "Löschungsankündigung",
      "state": "Hessen",
      "amtsgericht": "Amtsgericht Frankfurt am Main",
      "registernummer": "HRB 54214",
      "registerart": "HRB",
      "company_name": "Economy zwölfte Verwaltungsgesellschaft mbH",
      "company_seat": "Frankfurt am Main",
      "details": "10.04.2025 (Bekanntmachungsdatum)\n\nHessen Amtsgericht Frankfurt am Main HRB 54214\nLöschungsankündigung 10.04.2025 (Eintragungsdatum)\n\nEconomy zwölfte Verwaltungsgesellschaft mbH\nGesellschaft mit beschränkter Haftung\nFrankfurt am Main\n\nDas Registergericht beabsichtigt die im Handelsregister eingetragene Gesellschaft von Amts wegen nach § 394 FamFG zu löschen. Die Frist zur Erhebung eines Widerspruchs gegen die beabsichtigte Löschung wird auf 1 Monat festgesetzt."
    },
    {
      "date": "2025-04-10",
      "id": "106259",
      "original_text": "Sonstige Registerbekanntmachung\nHessen Amtsgericht Kassel VR 5283\nJukano Junges Kammerorchester Nordhessen e.V. – Grebenstein",
      "type": "Sonstige Registerbekanntmachung",
      "state": "Hessen",
      "amtsgericht": "Amtsgericht Kassel",
      "registernummer": "VR 5283",
      "registerart": "VR",
      "company_name": "Jukano Junges Kammerorchester Nordhessen e.V.",
      "company_seat": "Grebenstein",
      "details": "10.04.2025 (Bekanntmachungsdatum)\n\nHessen Amtsgericht Kassel VR 5283\nSonstige Registerbekanntmachung 10.04.2025 (Eintragungsdatum)\n\nJukano Junges Kammerorchester Nordhessen e.V.\neingetragener Verein\nGrebenstein\n\nDer Verein ist aufgelöst."
    },
    {
      "date": "2025-04-10",
      "id": "106260",
      "original_text": "Registerbekanntmachung nach dem Umwandlungsgesetz\nHessen Amtsgericht Wiesbaden HRB 26681\nACO Passavant Detego GmbH – Aarbergen",
      "type": "Registerbekanntmachung nach dem Umwandlungsgesetz",
      "state": "Hessen",
      "amtsgericht": "Amtsgericht Wiesbaden",
      "registernummer": "HRB 26681",
      "registerart": "HRB",
      "company_name": "ACO Passavant Detego GmbH",
      "company_seat": "Aarbergen",
      "details": "10.04.2025 (Bekanntmachungsdatum)\n\nHessen Amtsgericht Wiesbaden HRB 26681\nRegisterbekanntmachung nach dem Umwandlungsgesetz 10.04.2025 (Eintragungsdatum)\n\nACO Passavant Detego GmbH\nGesellschaft mit beschränkter Haftung\nAarbergen\n\nDen Gläubigern der an der Verschmelzung beteiligten Rechtsträger ist, wenn sie binnen sechs Monaten nach dem Tag, an dem die Eintragung der Verschmelzung in das Register des Sitzes desjenigen Rechtsträgers, dessen Gläubiger sie sind, nach § 19 Absatz 3 UmwG bekannt gemacht worden ist, ihren Anspruch nach Grund und Höhe schriftlich anmelden, Sicherheit zu leisten, soweit sie nicht Befriedigung verlangen können. Dieses Recht steht den Gläubigern jedoch nur zu, wenn sie glaubhaft machen, dass durch die Verschmelzung die Erfüllung ihrer Forderung gefährdet wird."
    },
    {
      "date": "2025-04-10",
      "id": "106261",
      "original_text": "Einreichung neuer Dokumente\nHessen Amtsgericht Offenbach am Main HRB 40459\nGate Gourmet GmbH Holding Deutschland – Neu-Isenburg",
      "type": "Einreichung neuer Dokumente",
      "state": "Hessen",
      "amtsgericht": "Amtsgericht Offenbach am Main",
      "registernummer": "HRB 40459",
      "registerart": "HRB",
      "company_name": "Gate Gourmet GmbH Holding Deutschland",
      "company_seat": "Neu-Isenburg",
      "details": "10.04.2025 (Bekanntmachungsdatum)\n\nHessen Amtsgericht Offenbach am Main HRB 40459\nEinreichung neuer Dokumente 10.04.2025 (Eintragungsdatum)\n\nGate Gourmet GmbH Holding Deutschland\nGesellschaft mit beschränkter Haftung\nNeu-Isenburg\n\nDurch Änderungen in den Personen der Aufsichtsratsmitglieder sind zwei neue Listen der Mitglieder des Aufsichtsrates zum Handelsregister eingereicht worden."
    },
    {
      "date": "2025-04-10",
      "id": "106262",
      "original_text": "Einreichung neuer Dokumente\nHessen Amtsgericht Fritzlar HRB 2356\nStaatsbad Bad Wildungen GmbH – Bad Wildungen",
      "type": "Einreichung neuer Dokumente",
      "state": "Hessen",
      "amtsgericht": "Amtsgericht Fritzlar",
      "registernummer": "HRB 2356",
      "registerart": "HRB",
      "company_name": "Staatsbad Bad Wildungen GmbH",
      "company_seat": "Bad Wildungen",
      "details": "10.04.2025 (Bekanntmachungsdatum)\n\nHessen Amtsgericht Fritzlar HRB 2356\nEinreichung neuer Dokumente 10.04.2025 (Eintragungsdatum)\n\nStaatsbad Bad Wildungen GmbH\nGesellschaft mit beschränkter Haftung\nBad Wildungen\n\nDurch eine Änderung in den Personen der Aufsichtsratsmitglieder ist eine Liste der Mitglieder des Aufsichtsrates zum Handelsregister eingereicht worden."
    },
    {
      "date": "2025-04-10",
      "id": "106263",
      "original_text": "Löschungsankündigung\nHessen Amtsgericht Offenbach am Main HRB 47247\nPrevDent GmbH – Offenbach am Main",
      "type": "Löschungsankündigung",
      "state": "Hessen",
      "amtsgericht": "Amtsgericht Offenbach am Main",
      "registernummer": "HRB 47247",
      "registerart": "HRB",
      "company_name": "PrevDent GmbH",
      "company_seat": "Offenbach am Main",
      "details": "10.04.2025 (Bekanntmachungsdatum)\n\nHessen Amtsgericht Offenbach am Main HRB 47247\nLöschungsankündigung\n\nPrevDent GmbH\nGesellschaft mit beschränkter Haftung\nOffenbach am Main\n\nDas Registergericht beabsichtigt die im Handelsregister eingetragene Gesellschaft von Amts wegen nach § 394 FamFG zu löschen. Die Frist zur Erhebung eines Widerspruchs gegen die beabsichtigte Löschung wird auf 3 Monate festgesetzt."
    },
    {
      "date": "2025-04-10",
      "id": "106264",
      "original_text": "Löschungsankündigung\nHessen Amtsgericht Gießen HRB 10969\nLZ Projekt GmbH – Gießen",
      "type": "Löschungsankündigung",
      "state": "Hessen",
      "amtsgericht": "Amtsgericht Gießen",
      "registernummer": "HRB 10969",
      "registerart": "HRB",
      "company_name": "LZ Projekt GmbH",
      "company_seat": "Gießen",
      "details": "10.04.2025 (Bekanntmachungsdatum)\n\nHessen Amtsgericht Gießen HRB 10969\nLöschungsankündigung\n\nLZ Projekt GmbH\nGesellschaft mit beschränkter Haftung\nGießen\n\nEs ist beabsichtigt, die Gesellschaft wegen Vermögenslosigkeit gemäß § 394 FamFG von Amts wegen zu löschen. Hiergegen kann innerhalb von drei Monaten nach dieser Veröffentlichung Widerspruch beim Amtsgericht Gießen eingelegt werden. Sollte Widerspruch eingelegt werden, dürfte dies nur mit Begründung erfolgversprechend sein. Insbesondere sollte vorhandenes Vermögen der Gesellschaft innerhalb der genannten Frist nachgewiesen werden."
    },
    {
      "date": "2025-04-10",
      "id": "106265",
      "original_text": "Löschungsankündigung\nHessen Amtsgericht Darmstadt HRB 98355\nDTDC Express GmbH – Raunheim",
      "type": "Löschungsankündigung",
      "state": "Hessen",
      "amtsgericht": "Amtsgericht Darmstadt",
      "registernummer": "HRB 98355",
      "registerart": "HRB",
      "company_name": "DTDC Express GmbH",
      "company_seat": "Raunheim",
      "details": "10.04.2025 (Bekanntmachungsdatum)\n\nHessen Amtsgericht Darmstadt HRB 98355\nLöschungsankündigung\n\nDTDC Express GmbH\nGesellschaft mit beschränkter Haftung\nRaunheim\n\nDas Registergericht beabsichtigt die im Handelsregister eingetragene Gesellschaft von Amts wegen nach § 394 FamFG zu löschen. Die Frist zur Erhebung eines Widerspruchs gegen die beabsichtigte Löschung wird auf 3 Monate festgesetzt."
    },
    {
      "date": "2025-04-10",
      "id": "106266",
      "original_text": "Registerbekanntmachung nach dem Umwandlungsgesetz\nHessen Amtsgericht Frankfurt am Main HRB 134613\nESI Germany GmbH – Frankfurt am Main",
      "type": "Registerbekanntmachung nach dem Umwandlungsgesetz",
      "state": "Hessen",
      "amtsgericht": "Amtsgericht Frankfurt am Main",
      "registernummer": "HRB 134613",
      "registerart": "HRB",
      "company_name": "ESI Germany GmbH",
      "company_seat": "Frankfurt am Main",
      "details": "10.04.2025 (Bekanntmachungsdatum)\n\nHessen Amtsgericht Frankfurt am Main HRB 134613\nRegisterbekanntmachung nach dem Umwandlungsgesetz 10.04.2025 (Eintragungsdatum)\n\nESI Germany GmbH\nGesellschaft mit beschränkter Haftung\nFrankfurt am Main\n\nDen Gläubigern der an der Verschmelzung beteiligten Rechtsträger ist, wenn sie binnen sechs Monaten nach dem Tag, an dem die Eintragung der Verschmelzung in das Register des Sitzes desjenigen Rechtsträgers, dessen Gläubiger sie sind, nach § 19 Absatz 3 UmwG bekannt gemacht worden ist, ihren Anspruch nach Grund und Höhe schriftlich anmelden, Sicherheit zu leisten, soweit sie nicht Befriedigung verlangen können. Dieses Recht steht den Gläubigern jedoch nur zu, wenn sie glaubhaft machen, dass durch die Verschmelzung die Erfüllung ihrer Forderung gefährdet wird."
    }
  ]
}