{
  "date": "2025-04-08",
  "date_of_scrape": "2025-05-30T12:15:01.038Z",
  "tool_version": "0.2.0",
  "number_of_announcements": 125,
  "announcements": [
    {
      "date": "2025-04-08",
      "id": "105892",
      "original_text": "Registerbekanntmachung nach dem Umwandlungsgesetz\nBayern Amtsgericht Kempten (Allgäu) HRB 2893\nFüssener Kurbetriebe GmbH – Füssen",
      "type": "Registerbekanntmachung nach dem Umwandlungsgesetz",
      "state": "Bayern",
      "amtsgericht": "Amtsgericht Kempten (Allgäu)",
      "registernummer": "HRB 2893",
      "registerart": "HRB",
      "company_name": "Füssener Kurbetriebe GmbH",
      "company_seat": "Füssen",
      "details": "08.04.2025 (Bekanntmachungsdatum)\n\nBayern Amtsgericht Kempten (Allgäu) HRB 2893\nRegisterbekanntmachung nach dem Umwandlungsgesetz 05.04.2025 (Eintragungsdatum)\n\nFüssener Kurbetriebe GmbH\nGesellschaft mit beschränkter Haftung\nFüssen\n\nDen Gläubigern der an der Vermögensübertragung beteiligten Rechtsträger ist, wenn sie binnen sechs Monaten nach dem Tag, an dem die Eintragung der Vermögensübertraung in das Register des Sitzes desjenigen Rechtsträgers, dessen Gläubiger sie sind, nach § 19 Abs. 3 UmwG als bekannt gemacht gilt, ihren Anspruch nach Grund und Höhe in Textform anmelden, Sicherheit zu leisten, soweit sie nicht Befriedigung verlangen können. Dieses Recht steht den Gläubigern jedoch nur zu, wenn sie glaubhaft machen, dass durch die Vermögensübertragung die Erfüllung ihrer Forderung gefährdet wird."
    },
    {
      "date": "2025-04-08",
      "id": "105893",
      "original_text": "Löschungsankündigung\nBayern Amtsgericht München HRB 254910\nRamak Yapi GmbH – Garching b.München",
      "type": "Löschungsankündigung",
      "state": "Bayern",
      "amtsgericht": "Amtsgericht München",
      "registernummer": "HRB 254910",
      "registerart": "HRB",
      "company_name": "Ramak Yapi GmbH",
      "company_seat": "Garching b.München",
      "details": "08.04.2025 (Bekanntmachungsdatum)\n\nBayern Amtsgericht München HRB 254910\nLöschungsankündigung 07.04.2025 (Eintragungsdatum)\n\nRamak Yapi GmbH\nGesellschaft mit beschränkter Haftung\nGarching b.München\n\nDas Registergericht beabsichtigt, die im Handelsregister eingetragene Gesellschaft wegen Vermögenslosigkeit von Amts wegen nach § 394 FamFG zu löschen. Die Frist zur Erhebung eines Widerspruchs ist auf drei Monate festgesetzt."
    },
    {
      "date": "2025-04-08",
      "id": "105894",
      "original_text": "Einreichung neuer Dokumente\nBayern Amtsgericht München HRB 5331\nBavaria-Filmkunst Gesellschaft mit beschränkter Haftung – München",
      "type": "Einreichung neuer Dokumente",
      "state": "Bayern",
      "amtsgericht": "Amtsgericht München",
      "registernummer": "HRB 5331",
      "registerart": "HRB",
      "company_name": "Bavaria-Filmkunst Gesellschaft mit beschränkter Haftung",
      "company_seat": "München",
      "details": "08.04.2025 (Bekanntmachungsdatum)\n\nBayern Amtsgericht München HRB 5331\nEinreichung neuer Dokumente 07.04.2025 (Eintragungsdatum)\n\nBavaria-Filmkunst Gesellschaft mit beschränkter Haftung\nGesellschaft mit beschränkter Haftung\nMünchen\n\nDem Amtsgericht München -Registergericht- ist eine Liste der Mitglieder des Aufsichtsrats eingereicht worden, § 52 Abs. 3 S. 2 GmbHG."
    },
    {
      "date": "2025-04-08",
      "id": "105895",
      "original_text": "Löschungsankündigung\nBayern Amtsgericht Nürnberg HRB 27660\nLUTZ und Co. GmbH – Nürnberg",
      "type": "Löschungsankündigung",
      "state": "Bayern",
      "amtsgericht": "Amtsgericht Nürnberg",
      "registernummer": "HRB 27660",
      "registerart": "HRB",
      "company_name": "LUTZ und Co. GmbH",
      "company_seat": "Nürnberg",
      "details": "08.04.2025 (Bekanntmachungsdatum)\n\nBayern Amtsgericht Nürnberg HRB 27660\nLöschungsankündigung\n\nLUTZ und Co. GmbH\nGesellschaft mit beschränkter Haftung\nNürnberg\n\nDas Registergericht beabsichtigt, die im Handelsregister eingetragene Gesellschaft wegen Vermögenslosigkeit von Amts wegen nach § 394 FamFG zu löschen. Die Frist zur Erhebung eines Widerspruchs ist auf einen Monat festgesetzt."
    },
    {
      "date": "2025-04-08",
      "id": "105896",
      "original_text": "Registerbekanntmachung nach dem Umwandlungsgesetz\nBayern Amtsgericht Nürnberg HRB 28017\nXirra GmbH – Nürnberg",
      "type": "Registerbekanntmachung nach dem Umwandlungsgesetz",
      "state": "Bayern",
      "amtsgericht": "Amtsgericht Nürnberg",
      "registernummer": "HRB 28017",
      "registerart": "HRB",
      "company_name": "Xirra GmbH",
      "company_seat": "Nürnberg",
      "details": "08.04.2025 (Bekanntmachungsdatum)\n\nBayern Amtsgericht Nürnberg HRB 28017\nRegisterbekanntmachung nach dem Umwandlungsgesetz 07.04.2025 (Eintragungsdatum)\n\nXirra GmbH\nGesellschaft mit beschränkter Haftung\nNürnberg\n\nDen Gläubigern der an der Verschmelzung beteiligten Rechtsträger ist, wenn sie binnen sechs Monaten nach dem Tag, an dem die Eintragung der Verschmelzung in das Register des Sitzes desjenigen Rechtsträgers, dessen Gläubiger sie sind, nach § 19 Abs. 3 UmwG als bekannt gemacht gilt, ihren Anspruch nach Grund und Höhe in Textform anmelden, Sicherheit zu leisten, soweit sie nicht Befriedigung verlangen können. Dieses Recht steht den Gläubigern jedoch nur zu, wenn sie glaubhaft machen, dass durch die Verschmelzung die Erfüllung ihrer Forderung gefährdet wird."
    },
    {
      "date": "2025-04-08",
      "id": "105897",
      "original_text": "Einreichung neuer Dokumente\nBayern Amtsgericht München HRB 223275\nottonova Holding AG – München",
      "type": "Einreichung neuer Dokumente",
      "state": "Bayern",
      "amtsgericht": "Amtsgericht München",
      "registernummer": "HRB 223275",
      "registerart": "HRB",
      "company_name": "ottonova Holding AG",
      "company_seat": "München",
      "details": "08.04.2025 (Bekanntmachungsdatum)\n\nBayern Amtsgericht München HRB 223275\nEinreichung neuer Dokumente\n\nottonova Holding AG\nAktiengesellschaft\nMünchen\n\nDem Amtsgericht München -Registergericht- ist eine Liste der Mitglieder des Aufsichtsrats eingereicht worden, § 106 AktG."
    },
    {
      "date": "2025-04-08",
      "id": "105898",
      "original_text": "Registerbekanntmachung nach dem Umwandlungsgesetz\nBayern Amtsgericht München HRA 120327\nRausBau e.K. – Hallbergmoos",
      "type": "Registerbekanntmachung nach dem Umwandlungsgesetz",
      "state": "Bayern",
      "amtsgericht": "Amtsgericht München",
      "registernummer": "HRA 120327",
      "registerart": "HRA",
      "company_name": "RausBau e.K.",
      "company_seat": "Hallbergmoos",
      "details": "08.04.2025 (Bekanntmachungsdatum)\n\nBayern Amtsgericht München HRA 120327\nRegisterbekanntmachung nach dem Umwandlungsgesetz 07.04.2025 (Eintragungsdatum)\n\nRausBau e.K.\nEinzelkaufmann / Einzelkauffrau\nHallbergmoos\n\nDen Gläubigern der an der Ausgliederung beteiligten Rechtsträger ist, wenn sie binnen sechs Monaten nach dem Tag, an dem die Eintragung der Ausgliederung in das Register des Sitzes desjenigen Rechtsträgers, dessen Gläubiger sie sind, nach §§ 125, 19 Abs. 3 UmwG als bekannt gemacht gilt, ihren Anspruch nach Grund und Höhe in Textform anmelden, Sicherheit zu leisten, soweit sie nicht Befriedigung verlangen können. Dieses Recht steht den Gläubigern jedoch nur zu, wenn sie glaubhaft machen, dass durch die Ausgliederung die Erfüllung ihrer Forderung gefährdet wird."
    },
    {
      "date": "2025-04-08",
      "id": "105899",
      "original_text": "Löschungsankündigung\nBayern Amtsgericht Nürnberg HRB 17562\nRPR Autozentrum GmbH – Nürnberg",
      "type": "Löschungsankündigung",
      "state": "Bayern",
      "amtsgericht": "Amtsgericht Nürnberg",
      "registernummer": "HRB 17562",
      "registerart": "HRB",
      "company_name": "RPR Autozentrum GmbH",
      "company_seat": "Nürnberg",
      "details": "08.04.2025 (Bekanntmachungsdatum)\n\nBayern Amtsgericht Nürnberg HRB 17562\nLöschungsankündigung\n\nRPR Autozentrum GmbH\nGesellschaft mit beschränkter Haftung\nNürnberg\n\nDas Registergericht beabsichtigt, die im Handelsregister eingetragene Gesellschaft wegen Vermögenslosigkeit von Amts wegen nach § 394 FamFG zu löschen. Die Frist zur Erhebung eines Widerspruchs ist auf einen Monat festgesetzt."
    },
    {
      "date": "2025-04-08",
      "id": "105900",
      "original_text": "Registerbekanntmachung nach dem Umwandlungsgesetz\nBayern Amtsgericht Nürnberg HRB 42754\nCore-Backbone GmbH – Nürnberg",
      "type": "Registerbekanntmachung nach dem Umwandlungsgesetz",
      "state": "Bayern",
      "amtsgericht": "Amtsgericht Nürnberg",
      "registernummer": "HRB 42754",
      "registerart": "HRB",
      "company_name": "Core-Backbone GmbH",
      "company_seat": "Nürnberg",
      "details": "08.04.2025 (Bekanntmachungsdatum)\n\nBayern Amtsgericht Nürnberg HRB 42754\nRegisterbekanntmachung nach dem Umwandlungsgesetz 07.04.2025 (Eintragungsdatum)\n\nCore-Backbone GmbH\nGesellschaft mit beschränkter Haftung\nNürnberg\n\nDen Gläubigern der an der Verschmelzung beteiligten Rechtsträger ist, wenn sie binnen sechs Monaten nach dem Tag, an dem die Eintragung der Verschmelzung in das Register des Sitzes desjenigen Rechtsträgers, dessen Gläubiger sie sind, nach § 19 Abs. 3 UmwG als bekannt gemacht gilt, ihren Anspruch nach Grund und Höhe in Textform anmelden, Sicherheit zu leisten, soweit sie nicht Befriedigung verlangen können. Dieses Recht steht den Gläubigern jedoch nur zu, wenn sie glaubhaft machen, dass durch die Verschmelzung die Erfüllung ihrer Forderung gefährdet wird."
    },
    {
      "date": "2025-04-08",
      "id": "105901",
      "original_text": "Registerbekanntmachung nach dem Umwandlungsgesetz\nBayern Amtsgericht München HRB 294054\nEGYM AG – München",
      "type": "Registerbekanntmachung nach dem Umwandlungsgesetz",
      "state": "Bayern",
      "amtsgericht": "Amtsgericht München",
      "registernummer": "HRB 294054",
      "registerart": "HRB",
      "company_name": "EGYM AG",
      "company_seat": "München",
      "details": "08.04.2025 (Bekanntmachungsdatum)\n\nBayern Amtsgericht München HRB 294054\nRegisterbekanntmachung nach dem Umwandlungsgesetz\n\nEGYM AG\nAktiengesellschaft\nMünchen\n\nDem Amtsgericht München -Registergericht- ist am 07.03.2025 der Entwurf eines Verschmelzungsplanes (auch Verschmelzungsvertrag) über die geplante Verschmelzung der Gesellschaft als übernehmendem Rechtsträger mit der österreichischen Aktiengesellschaft nach österreichischem Recht unter Firma EGYM AG mit Sitz in Wien/Österreich (Firmenbuch des Handelsgerichts Wien unter FN 597959 b) zur Gründung einer Europäischen Aktiengesellschaft (Societas Europaea - SE) eingereicht worden.\nGemäß Art. 24 Abs. 1 SE-VO findet unter Berücksichtigung des grenzüberschreitenden Charakters der Verschmelzung das Recht des Mitgliedstaats, das jeweils für die sich verschmelzenden Gesellschaften gilt, zum Schutz der Interessen der Gläubiger der sich verschmelzenden Gesellschaften wie bei einer Verschmelzung von Aktiengesellschaften Anwendung.\nIm deutschen Recht ist der Gläubigerschutz in § 22 UmwG geregelt. Danach ist den Gläubigern der EGYM AG, München, Deutschland, Sicherheit zu leisten, soweit sie nicht Befriedigung verlangen können, wenn sie binnen sechs Monaten (Art. 24 Abs. 1 SE-VO i.V.m. § 22 UmwG) nach Bekanntmachung der Eintragung (Art. 15 Abs. 2 SE-VO bzw. Art. 28 SE-VO) ihren Anspruch nach Grund und Höhe in Textform anmelden.\nDieses Recht steht den Gläubigern der EGYM AG, München, Deutschland, allerdings nur zu, wenn sie glaubhaft machen, dass durch die Verschmelzung die Erfüllung ihrer Forderung gefährdet wird. Gemäß § 22 Abs. 2 UmwG steht das Recht, Sicherheitsleistung zu verlangen, Gläubigern nicht zu, die im Falle der Insolvenz ein Recht auf vorzugsweise Befriedigung aus einer Deckungsmasse haben, die nach gesetzlichen Vorschriften zu ihrem Schutz erreichtet und staatlich überwacht ist.\nDie speziellen Gläubigerschutzrechte nach §§ 8, 13 des Gesetzes zur Ausführung der SE-VO (SEAG) finden hier keine Anwendung, weil der künftige Sitz der AGYM SE in München, Deutschland, und damit aus deutscher Sicht im Inland sein wird.\nGemäß Art. 24 Abs. 2 SE-VO kann jeder Mitgliedsstaat in Bezug auf die sich verschmelzenden Gesellschaften, die seinem Recht unterliegen, Vorschriften erlassen, um einen angemessenen Schutz der Minderheitsaktionäre, die sich gegen die Verschmelzung ausgesprochen haben, zu gewährleisten.\nAktionäre der EGYM AG, München, Deutschland, können gegen den Beschluss der Hauptversammlung der EGYM AG, München, Deutschland, über die Zustimmung zum Verschmelzungsplan für die Verschmelzung durch Aufnahme der EGYM AG, Wien, Österreich, als übertragende Gesellschaft auf die EGYM AG, München, Deutschland, als übernehmende Gesellschaft und die Zusammenführung dieser sich verschmelzenden Gesellschaften in einer Europäischen Aktiengesellschaft Nichtigkeits- und Anfechtungsklage erheben.\nDie Nichtigkeitsklage muss gemäß § 14 Abs. 1 UmwG binnen eines Monats nach der Beschlussfassung erhoben werden. Sie kann nur auf im Gesetz genannte Nichtigkeitsgründe gestützt werden. Ausschließlich zuständig ist das Landgericht München I als das Landgericht, in dessen Bezirk die EGYM AG, München, Deutschland, ihren Sitz hat.\nDie Anfechtungsklage muss ebenso binnen eines Monats nach Beschlussfassung der Hauptversammlung der EGYM AG, München, Deutschland, erhoben werden. Sie kann grundsätzlich auf jede Verletzung des Gesetzes oder der Satzung gestützt werden. Anfechtungsbefugt ist jeder in der Hauptversammlung erschienene Aktionär der EGYM AG, München, Deutschland, wenn er gegen den Beschluss Widerspruch zur Niederschrift erklärt hat. Nicht erschienene Aktionäre sind nur dann anfechtungsbefugt, wenn sie zu der Hauptversammlung zu Unrecht nicht zugelassen worden sind, die Versammlung nicht ordnungsgemäß einberufen, der Gegenstand der Beschlussfassung nicht ordnungsgemäß bekannt gemacht worden ist, oder soweit die Anfechtungsklage auf das Erlangen von Sondervorteilen, § 243 Abs. 2 AktG, gestützt ist. Ausschließlich zuständig ist für die Anfechtungsklage das Landgericht München I als das Landgericht, in dessen Bezirk die EGYM AG, München, Deutschland, ihren Sitz hat.\nWird der Hauptversammlungsbeschluss aufgrund Nichtigkeits- oder Anfechtungsklage durch rechtskräftiges Urteil für nichtig erklärt, entfaltet das Urteil Wirkung gegenüber allen Aktionären sowie den Mitgliedern des Vorstands und des Aufsichtsrats, auch wenn sie nicht Partei sind. Eine Nichtigkeitserklärung des Beschlusses kommt nicht in Betracht, wenn der Beschluss zwischenzeitlich aufgrund eines Freigabeverfahrens nach § 16 Abs. 3 UmwG in das Handelsregister am Sitz der EGYM AG, München, Deutschland, eingetragen und die Verschmelzung dadurch wirksam geworden ist. In diesem Fall wäre die künftige EGYM SE nach § 16 Abs. 3 S. 10 UmwG verpflichtet, dem Antragsgegner des Freigabeverfahrens den Schaden zu ersetzen, der ihm aus der auf dem Freigabebeschluss beruhenden Eintragung der Verschmelzung entstanden ist. Die Beseitigung der Wirkungen der Eintragung der Verschmelzung im Handelsregister am Sitz der EGYM AG, München, Deutschland, bzw. EGYM SE kann nicht als Schadensersatz verlangt werden.\nAktionären der EGYM AG, München, Deutschland, steht kein Barabfindungsrecht nach § 7 SEAG zu. § 7 SEAG setzt voraus, dass die SE ihren Sitz aus deutscher Sicht im Ausland hat. Das ist nicht der Fall, da die EGYM AG, München, Deutschland, übernehmende Gesellschaft ist und der künftige Sitz der EGYM SE in München, Deutschland, sein wird.\nDie vollständigen Auskünfte über diese Modalitäten können kostenlos eingeholt werden bei EGYM AG, z.Hd. des Vorstands, Einsteinstraße 172, 81677 München, Deutschland.\nDie durch die Verschmelzung der EGYM AG, Wien, Österreich, auf die EGYM AG, München, Deutschland, entstehende SE wird unter \"EGYM SE\" firmieren und ihren Sitz in München, Deutschland, haben."
    },
    {
      "date": "2025-04-08",
      "id": "105902",
      "original_text": "Registerbekanntmachung nach dem Umwandlungsgesetz\nBayern Amtsgericht Würzburg HRB 8842\nInterface Komplementär-GmbH – Sulzfeld",
      "type": "Registerbekanntmachung nach dem Umwandlungsgesetz",
      "state": "Bayern",
      "amtsgericht": "Amtsgericht Würzburg",
      "registernummer": "HRB 8842",
      "registerart": "HRB",
      "company_name": "Interface Komplementär-GmbH",
      "company_seat": "Sulzfeld",
      "details": "08.04.2025 (Bekanntmachungsdatum)\n\nBayern Amtsgericht Würzburg HRB 8842\nRegisterbekanntmachung nach dem Umwandlungsgesetz 06.04.2025 (Eintragungsdatum)\n\nInterface Komplementär-GmbH\nGesellschaft mit beschränkter Haftung\nSulzfeld\n\nDen Gläubigern der an der Verschmelzung beteiligten Rechtsträger ist, wenn sie binnen sechs Monaten nach dem Tag, an dem die Eintragung der Verschmelzung in das Register des Sitzes desjenigen Rechtsträgers, dessen Gläubiger sie sind, nach § 19 Abs. 3 UmwG als bekannt gemacht gilt, ihren Anspruch nach Grund und Höhe in Textform anmelden, Sicherheit zu leisten, soweit sie nicht Befriedigung verlangen können. Dieses Recht steht den Gläubigern jedoch nur zu, wenn sie glaubhaft machen, dass durch die Verschmelzung die Erfüllung ihrer Forderung gefährdet wird."
    },
    {
      "date": "2025-04-08",
      "id": "105903",
      "original_text": "Registerbekanntmachung nach dem Umwandlungsgesetz\nBayern Amtsgericht München HRB 137368\nTOPTICA Photonics AG – Gräfelfing",
      "type": "Registerbekanntmachung nach dem Umwandlungsgesetz",
      "state": "Bayern",
      "amtsgericht": "Amtsgericht München",
      "registernummer": "HRB 137368",
      "registerart": "HRB",
      "company_name": "TOPTICA Photonics AG",
      "company_seat": "Gräfelfing",
      "details": "08.04.2025 (Bekanntmachungsdatum)\n\nBayern Amtsgericht München HRB 137368\nRegisterbekanntmachung nach dem Umwandlungsgesetz\n\nTOPTICA Photonics AG\nAktiengesellschaft\nGräfelfing\n\nDem Amtsgericht München -Registergericht- ist ein Umwandlungsplan über den Formwechsel in die Rechtsform einer Europäischen Aktiengesellschaft (Societas Europea SE) nebst Satzung (Firma dann: TOPTICA Photonics SE) zur Einsichtnahme eingereicht worden."
    },
    {
      "date": "2025-04-08",
      "id": "105904",
      "original_text": "Sonstige Registerbekanntmachung\nBayern Amtsgericht München HRB 280628\nMonte Pelle Handels AG – Tegernsee",
      "type": "Sonstige Registerbekanntmachung",
      "state": "Bayern",
      "amtsgericht": "Amtsgericht München",
      "registernummer": "HRB 280628",
      "registerart": "HRB",
      "company_name": "Monte Pelle Handels AG",
      "company_seat": "Tegernsee",
      "details": "08.04.2025 (Bekanntmachungsdatum)\n\nBayern Amtsgericht München HRB 280628\nSonstige Registerbekanntmachung 07.04.2025 (Eintragungsdatum)\n\nMonte Pelle Handels AG\nAktiengesellschaft\nTegernsee\n\nDem Amtsgericht München -Registergericht- ist eine Liste der Mitglieder des Aufsichtsrats eingereicht worden, § 106 AktG."
    },
    {
      "date": "2025-04-08",
      "id": "105905",
      "original_text": "Registerbekanntmachung nach dem Umwandlungsgesetz\nBayern Amtsgericht München HRB 301368\nASCHER Catering GmbH – Oberding",
      "type": "Registerbekanntmachung nach dem Umwandlungsgesetz",
      "state": "Bayern",
      "amtsgericht": "Amtsgericht München",
      "registernummer": "HRB 301368",
      "registerart": "HRB",
      "company_name": "ASCHER Catering GmbH",
      "company_seat": "Oberding",
      "details": "08.04.2025 (Bekanntmachungsdatum)\n\nBayern Amtsgericht München HRB 301368\nRegisterbekanntmachung nach dem Umwandlungsgesetz 07.04.2025 (Eintragungsdatum)\n\nASCHER Catering GmbH\nGesellschaft mit beschränkter Haftung\nOberding\n\nDen Gläubigern der an der Ausgliederung beteiligten Rechtsträger ist, wenn sie binnen sechs Monaten nach dem Tag, an dem die Eintragung der Ausgliederung in das Register des Sitzes desjenigen Rechtsträgers, dessen Gläubiger sie sind, nach §§ 125, 19 Abs. 3 UmwG als bekannt gemacht gilt, ihren Anspruch nach Grund und Höhe in Textform anmelden, Sicherheit zu leisten, soweit sie nicht Befriedigung verlangen können. Dieses Recht steht den Gläubigern jedoch nur zu, wenn sie glaubhaft machen, dass durch die Ausgliederung die Erfüllung ihrer Forderung gefährdet wird."
    },
    {
      "date": "2025-04-08",
      "id": "105906",
      "original_text": "Einreichung neuer Dokumente\nBayern Amtsgericht Ingolstadt HRB 9560\nALDI Verwaltungs-SE VIII – Geisenfeld",
      "type": "Einreichung neuer Dokumente",
      "state": "Bayern",
      "amtsgericht": "Amtsgericht Ingolstadt",
      "registernummer": "HRB 9560",
      "registerart": "HRB",
      "company_name": "ALDI Verwaltungs-SE VIII",
      "company_seat": "Geisenfeld",
      "details": "08.04.2025 (Bekanntmachungsdatum)\n\nBayern Amtsgericht Ingolstadt HRB 9560\nEinreichung neuer Dokumente\n\nALDI Verwaltungs-SE VIII\nEuropäische Aktiengesellschaft (SE)\nGeisenfeld\n\nDem Amtsgericht Ingolstadt -Registergericht- ist eine Liste der Mitglieder des Verwaltungsrats eingereicht worden."
    },
    {
      "date": "2025-04-08",
      "id": "105907",
      "original_text": "Registerbekanntmachung nach dem Umwandlungsgesetz\nBayern Amtsgericht Aschaffenburg VR 897\nZahnärztlicher Förderkreis - Aschaffenburg e.V. (ZÄF) – Aschaffenburg",
      "type": "Registerbekanntmachung nach dem Umwandlungsgesetz",
      "state": "Bayern",
      "amtsgericht": "Amtsgericht Aschaffenburg",
      "registernummer": "VR 897",
      "registerart": "VR",
      "company_name": "Zahnärztlicher Förderkreis - Aschaffenburg e.V. (ZÄF)",
      "company_seat": "Aschaffenburg",
      "details": "08.04.2025 (Bekanntmachungsdatum)\n\nBayern Amtsgericht Aschaffenburg VR 897\nRegisterbekanntmachung nach dem Umwandlungsgesetz 07.04.2025 (Eintragungsdatum)\n\nZahnärztlicher Förderkreis - Aschaffenburg e.V. (ZÄF)\neingetragener Verein\nAschaffenburg\n\nDen Gläubigern der an der Verschmelzung beteiligten Rechtsträger ist, wenn sie binnen sechs Monaten nach dem Tag, an dem die Eintragung der Verschmelzung in das Register des Sitzes desjenigen Rechtsträgers, dessen Gläubiger sie sind, nach § 19 Abs. 3 UmwG als bekannt gemacht gilt, ihren Anspruch nach Grund und Höhe in Textform anmelden, Sicherheit zu leisten, soweit sie nicht Befriedigung verlangen können. Dieses Recht steht den Gläubigern jedoch nur zu, wenn sie glaubhaft machen, dass durch die Verschmelzung die Erfüllung ihrer Forderung gefährdet wird."
    },
    {
      "date": "2025-04-08",
      "id": "105908",
      "original_text": "Löschungsankündigung\nBerlin Amtsgericht Berlin (Charlottenburg) HRB 202268\nTQ Objekt Kamp-Lintfort UG (haftungsbeschränkt) – Berlin",
      "type": "Löschungsankündigung",
      "state": "Berlin",
      "amtsgericht": "Amtsgericht Berlin (Charlottenburg)",
      "registernummer": "HRB 202268",
      "registerart": "HRB",
      "company_name": "TQ Objekt Kamp-Lintfort UG (haftungsbeschränkt)",
      "company_seat": "Berlin",
      "details": "08.04.2025 (Bekanntmachungsdatum)\n\nBerlin Amtsgericht Berlin (Charlottenburg) HRB 202268\nLöschungsankündigung\n\nTQ Objekt Kamp-Lintfort UG (haftungsbeschränkt)\nGesellschaft mit beschränkter Haftung\nBerlin\n\nBei der nachstehenden Gesellschaft wird das Amtslöschungsverfahren gemäß § 394 FamFG eingeleitet. Widerspruchsfrist\n6 Wochen."
    },
    {
      "date": "2025-04-08",
      "id": "105909",
      "original_text": "Registerbekanntmachung nach dem Umwandlungsgesetz\nMecklenburg-Vorpommern Amtsgericht Neubrandenburg HRB 5201\nPollmeier Malchow Verwaltungs GmbH – Malchow",
      "type": "Registerbekanntmachung nach dem Umwandlungsgesetz",
      "state": "Mecklenburg-Vorpommern",
      "amtsgericht": "Amtsgericht Neubrandenburg",
      "registernummer": "HRB 5201",
      "registerart": "HRB",
      "company_name": "Pollmeier Malchow Verwaltungs GmbH",
      "company_seat": "Malchow",
      "details": "08.04.2025 (Bekanntmachungsdatum)\n\nMecklenburg-Vorpommern Amtsgericht Neubrandenburg HRB 5201\nRegisterbekanntmachung nach dem Umwandlungsgesetz 08.04.2025 (Eintragungsdatum)\n\nPollmeier Malchow Verwaltungs GmbH\nGesellschaft mit beschränkter Haftung\nMalchow\n\nAls nicht eingetragen wird veröffentlicht: Den Gläubigern der an der Verschmelzung beteiligten Rechtsträger ist, wenn sie binnen sechs Monaten nach dem Tag, an dem die Eintragung der Verschmelzung in das Register des Sitzes desjenigen Rechtsträgers, dessen Gläubiger sie sind, nach § 19 Abs. 3 UmwG als bekannt gemacht gilt,\nihren Anspruch nach Grund und Höhe in Textform anmelden, Sicherheit zu leisten, soweit sie nicht Befriedigung verlangen können. Dieses Recht steht den Gläubigern jedoch nur zu, wenn sie glaubhaft machen, dass durch die Verschmelzung die Erfüllung der Forderung gefährdet wird."
    },
    {
      "date": "2025-04-08",
      "id": "105910",
      "original_text": "Registerbekanntmachung nach dem Umwandlungsgesetz\nBaden-Württemberg Amtsgericht Stuttgart HRB 763694\nElena Welsch-Donati Hausverwaltung & Immobilien GmbH – Renningen",
      "type": "Registerbekanntmachung nach dem Umwandlungsgesetz",
      "state": "Baden-Württemberg",
      "amtsgericht": "Amtsgericht Stuttgart",
      "registernummer": "HRB 763694",
      "registerart": "HRB",
      "company_name": "Elena Welsch-Donati Hausverwaltung & Immobilien GmbH",
      "company_seat": "Renningen",
      "details": "08.04.2025 (Bekanntmachungsdatum)\n\nBaden-Württemberg Amtsgericht Stuttgart HRB 763694\nRegisterbekanntmachung nach dem Umwandlungsgesetz 08.04.2025 (Eintragungsdatum)\n\nElena Welsch-Donati Hausverwaltung & Immobilien GmbH\nGesellschaft mit beschränkter Haftung\nRenningen\n\nDen Gläubigern der an der Verschmelzung beteiligten Rechtsträger ist, wenn sie binnen sechs Monaten nach dem Tag, an dem die Eintragung der Verschmelzung in das Register des Sitzes desjenigen Rechtsträgers, dessen Gläubiger sie sind, nach § 19 Abs. 3 UmwG als bekanntgemacht gilt, ihren Anspruch nach Grund und Höhe schriftlich anmelden, Sicherheit zu leisten, soweit sie nicht Befriedigung verlangen können. Dieses Recht steht den Gläubigern jedoch nur zu, wenn sie glaubhaft machen, dass durch die Verschmelzung die Erfüllung ihrer Forderung gefährdet wird."
    },
    {
      "date": "2025-04-08",
      "id": "105911",
      "original_text": "Registerbekanntmachung nach dem Umwandlungsgesetz\nBaden-Württemberg Amtsgericht Mannheim HRB 737847\nCast Two GmbH – St. Leon-Rot",
      "type": "Registerbekanntmachung nach dem Umwandlungsgesetz",
      "state": "Baden-Württemberg",
      "amtsgericht": "Amtsgericht Mannheim",
      "registernummer": "HRB 737847",
      "registerart": "HRB",
      "company_name": "Cast Two GmbH",
      "company_seat": "St. Leon-Rot",
      "details": "08.04.2025 (Bekanntmachungsdatum)\n\nBaden-Württemberg Amtsgericht Mannheim HRB 737847\nRegisterbekanntmachung nach dem Umwandlungsgesetz 08.04.2025 (Eintragungsdatum)\n\nCast Two GmbH\nGesellschaft mit beschränkter Haftung\nSt. Leon-Rot\n\nAls nicht eingetragen wird bekanntgemacht:\nDen Gläubigern der an der Verschmelzung beteiligten Rechtsträger ist, wenn sie binnen sechs Monaten nach dem Tag, an dem die Eintragung der Verschmelzung in das Register des Sitzes desjenigen Rechtsträgers, dessen Gläubiger sie sind, nach § 19 Abs. 3 UmwG als bekanntgemacht gilt, ihren Anspruch nach Grund und Höhe schriftlich anmelden, Sicherheit zu leisten, soweit sie nicht Befriedigung verlangen können. Dieses Recht steht den Gläubigern jedoch nur zu, wenn sie glaubhaft machen, dass durch die Verschmelzung die Erfüllung ihrer Forderung gefährdet wird."
    },
    {
      "date": "2025-04-08",
      "id": "105912",
      "original_text": "Löschungsankündigung\nBerlin Amtsgericht Berlin (Charlottenburg) HRB 104838\nGST Gehweg- und Straßenbau GmbH – Berlin",
      "type": "Löschungsankündigung",
      "state": "Berlin",
      "amtsgericht": "Amtsgericht Berlin (Charlottenburg)",
      "registernummer": "HRB 104838",
      "registerart": "HRB",
      "company_name": "GST Gehweg- und Straßenbau GmbH",
      "company_seat": "Berlin",
      "details": "08.04.2025 (Bekanntmachungsdatum)\n\nBerlin Amtsgericht Berlin (Charlottenburg) HRB 104838\nLöschungsankündigung\n\nGST Gehweg- und Straßenbau GmbH\nGesellschaft mit beschränkter Haftung\nBerlin\n\nBei der nachstehenden Gesellschaft wird das Amtslöschungsverfahren gemäß § 394 FamFG eingeleitet. Widerspruchsfrist 6 Wochen"
    },
    {
      "date": "2025-04-08",
      "id": "105913",
      "original_text": "Löschungsankündigung\nBaden-Württemberg Amtsgericht Stuttgart HRB 109288\nsend-it GmbH – Massenbachhausen",
      "type": "Löschungsankündigung",
      "state": "Baden-Württemberg",
      "amtsgericht": "Amtsgericht Stuttgart",
      "registernummer": "HRB 109288",
      "registerart": "HRB",
      "company_name": "send-it GmbH",
      "company_seat": "Massenbachhausen",
      "details": "08.04.2025 (Bekanntmachungsdatum)\n\nBaden-Württemberg Amtsgericht Stuttgart HRB 109288\nLöschungsankündigung\n\nsend-it GmbH\nGesellschaft mit beschränkter Haftung\nMassenbachhausen\n\nAls nicht eingetragen wird bekanntgemacht:\nDas Gericht beabsichtigt, die Gesellschaft wegen Vermögenslosigkeit im Handelsregister von Amts wegen nach § 394 FamFG zu löschen. Die Frist zur Geltendmachung eines Widerspruchs gegen die beabsichtigte Löschung ist auf zwei Monate ab Veröffentlichung bestimmt."
    },
    {
      "date": "2025-04-08",
      "id": "105914",
      "original_text": "Löschungsankündigung\nBaden-Württemberg Amtsgericht Freiburg HRB 719285\nAPOLED UG (haftungsbeschränkt) – Freiburg im Breisgau",
      "type": "Löschungsankündigung",
      "state": "Baden-Württemberg",
      "amtsgericht": "Amtsgericht Freiburg",
      "registernummer": "HRB 719285",
      "registerart": "HRB",
      "company_name": "APOLED UG (haftungsbeschränkt)",
      "company_seat": "Freiburg im Breisgau",
      "details": "08.04.2025 (Bekanntmachungsdatum)\n\nBaden-Württemberg Amtsgericht Freiburg HRB 719285\nLöschungsankündigung\n\nAPOLED UG (haftungsbeschränkt)\nGesellschaft mit beschränkter Haftung\nFreiburg im Breisgau\n\nAls nicht eingetragen wird bekanntgemacht:\nDas Gericht beabsichtigt, die Gesellschaft wegen Vermögenslosigkeit im Handelsregister von Amts wegen nach § 394 FamFG zu löschen. Die Frist zur Geltendmachung eines Widerspruchs gegen die beabsichtigte Löschung ist auf einen Monat ab Veröffentlichung bestimmt."
    },
    {
      "date": "2025-04-08",
      "id": "105915",
      "original_text": "Sonstige Registerbekanntmachung\nBaden-Württemberg Amtsgericht Mannheim HRB 739820\nSPARTA AG – Heidelberg",
      "type": "Sonstige Registerbekanntmachung",
      "state": "Baden-Württemberg",
      "amtsgericht": "Amtsgericht Mannheim",
      "registernummer": "HRB 739820",
      "registerart": "HRB",
      "company_name": "SPARTA AG",
      "company_seat": "Heidelberg",
      "details": "08.04.2025 (Bekanntmachungsdatum)\n\nBaden-Württemberg Amtsgericht Mannheim HRB 739820\nSonstige Registerbekanntmachung\n\nSPARTA AG\nAktiengesellschaft\nHeidelberg\n\nDie Gesellschaft hat am 04.04.2025 die Liste über die Zusammensetzung des Aufsichtsrats zum Handelsregister eingereicht."
    },
    {
      "date": "2025-04-08",
      "id": "105916",
      "original_text": "Löschungsankündigung\nBerlin Amtsgericht Berlin (Charlottenburg) HRB 100413\nProsperus Internet Limited – Berlin",
      "type": "Löschungsankündigung",
      "state": "Berlin",
      "amtsgericht": "Amtsgericht Berlin (Charlottenburg)",
      "registernummer": "HRB 100413",
      "registerart": "HRB",
      "company_name": "Prosperus Internet Limited",
      "company_seat": "Berlin",
      "details": "08.04.2025 (Bekanntmachungsdatum)\n\nBerlin Amtsgericht Berlin (Charlottenburg) HRB 100413\nLöschungsankündigung\n\nProsperus Internet Limited\nRechtsform ausländischen Rechts HRB\nBerlin\n\nEs ist beabsichtigt, die Eintragung wegen Mangels einer wesentlichen Voraussetzung gemäß § 395 FamFG (Erlöschen der Hauptniederlassung im Vereinigten Königreich) von Amts wegen zu löschen. Widerspruchsfrist: 6 Wochen."
    },
    {
      "date": "2025-04-08",
      "id": "105917",
      "original_text": "Löschungsankündigung\nBerlin Amtsgericht Berlin (Charlottenburg) HRB 228443\nWarike UG (haftungsbeschränkt) – Berlin",
      "type": "Löschungsankündigung",
      "state": "Berlin",
      "amtsgericht": "Amtsgericht Berlin (Charlottenburg)",
      "registernummer": "HRB 228443",
      "registerart": "HRB",
      "company_name": "Warike UG (haftungsbeschränkt)",
      "company_seat": "Berlin",
      "details": "08.04.2025 (Bekanntmachungsdatum)\n\nBerlin Amtsgericht Berlin (Charlottenburg) HRB 228443\nLöschungsankündigung\n\nWarike UG (haftungsbeschränkt)\nGesellschaft mit beschränkter Haftung\nBerlin\n\nBei der nachstehenden Gesellschaft wird das Amtslöschungsverfahren gemäß § 394 FamFG eingeleitet. Widerspruchsfrist: 6 Wochen."
    },
    {
      "date": "2025-04-08",
      "id": "105918",
      "original_text": "Einreichung neuer Dokumente\nBerlin Amtsgericht Berlin (Charlottenburg) HRB 14202\nterra est vita gGmbH – Berlin",
      "type": "Einreichung neuer Dokumente",
      "state": "Berlin",
      "amtsgericht": "Amtsgericht Berlin (Charlottenburg)",
      "registernummer": "HRB 14202",
      "registerart": "HRB",
      "company_name": "terra est vita gGmbH",
      "company_seat": "Berlin",
      "details": "08.04.2025 (Bekanntmachungsdatum)\n\nBerlin Amtsgericht Berlin (Charlottenburg) HRB 14202\nEinreichung neuer Dokumente\n\nterra est vita gGmbH\nGesellschaft mit beschränkter Haftung\nBerlin\n\nAls nicht eingetragen wird veröffentlicht:Es wurde eine neue Liste der Aufsichtsratsmitglieder eingereicht (§52 GmbHG)."
    },
    {
      "date": "2025-04-08",
      "id": "105919",
      "original_text": "Löschungsankündigung\nMecklenburg-Vorpommern Amtsgericht Rostock HRB 8135\nMetallbauverwaltungs GmbH, Güstrow – Güstrow",
      "type": "Löschungsankündigung",
      "state": "Mecklenburg-Vorpommern",
      "amtsgericht": "Amtsgericht Rostock",
      "registernummer": "HRB 8135",
      "registerart": "HRB",
      "company_name": "Metallbauverwaltungs GmbH, Güstrow",
      "company_seat": "Güstrow",
      "details": "08.04.2025 (Bekanntmachungsdatum)\n\nMecklenburg-Vorpommern Amtsgericht Rostock HRB 8135\nLöschungsankündigung\n\nMetallbauverwaltungs GmbH, Güstrow\nGesellschaft mit beschränkter Haftung\nGüstrow\n\nDas Registergericht beabsichtigt, die im Handelsregister eingetragene Gesellschaft von Amts wegen nach § 394 FamFG zu löschen. Die Frist zur Erhebung eines Widerspruchs gegen die beabsichtigte Löschung wird auf einen Monat festgesetzt."
    },
    {
      "date": "2025-04-08",
      "id": "105920",
      "original_text": "Löschungsankündigung\nMecklenburg-Vorpommern Amtsgericht Rostock HRB 13128\nExpert workers GmbH – Blankenhagen",
      "type": "Löschungsankündigung",
      "state": "Mecklenburg-Vorpommern",
      "amtsgericht": "Amtsgericht Rostock",
      "registernummer": "HRB 13128",
      "registerart": "HRB",
      "company_name": "Expert workers GmbH",
      "company_seat": "Blankenhagen",
      "details": "08.04.2025 (Bekanntmachungsdatum)\n\nMecklenburg-Vorpommern Amtsgericht Rostock HRB 13128\nLöschungsankündigung\n\nExpert workers GmbH\nGesellschaft mit beschränkter Haftung\nBlankenhagen\n\nDas Registergericht beabsichtigt, die im Handelsregister eingetragene Gesellschaft von Amts wegen nach § 394 FamFG zu löschen. Die Frist zur Erhebung eines Widerspruchs gegen die beabsichtigte Löschung wird auf einen Monat festgesetzt."
    },
    {
      "date": "2025-04-08",
      "id": "105921",
      "original_text": "Löschungsankündigung\nBaden-Württemberg Amtsgericht Mannheim HRB 737418\nCREATOR BAU Verwaltungs UG (haftungsbeschränkt) – Eisingen",
      "type": "Löschungsankündigung",
      "state": "Baden-Württemberg",
      "amtsgericht": "Amtsgericht Mannheim",
      "registernummer": "HRB 737418",
      "registerart": "HRB",
      "company_name": "CREATOR BAU Verwaltungs UG (haftungsbeschränkt)",
      "company_seat": "Eisingen",
      "details": "08.04.2025 (Bekanntmachungsdatum)\n\nBaden-Württemberg Amtsgericht Mannheim HRB 737418\nLöschungsankündigung\n\nCREATOR BAU Verwaltungs UG (haftungsbeschränkt)\nGesellschaft mit beschränkter Haftung\nEisingen\n\nDas Gericht beabsichtigt, die Gesellschaft wegen Vermögenslosigkeit im Handelsregister von Amts wegen nach § 394 FamFG zu löschen. Die Frist zur Geltendmachung eines Widerspruchs gegen die beabsichtigte Löschung ist auf einen Monat ab Veröffentlichung bestimmt."
    },
    {
      "date": "2025-04-08",
      "id": "105922",
      "original_text": "Registerbekanntmachung nach dem Umwandlungsgesetz\nBaden-Württemberg Amtsgericht Mannheim HRB 747925\nS&G Mobility GmbH – Karlsruhe",
      "type": "Registerbekanntmachung nach dem Umwandlungsgesetz",
      "state": "Baden-Württemberg",
      "amtsgericht": "Amtsgericht Mannheim",
      "registernummer": "HRB 747925",
      "registerart": "HRB",
      "company_name": "S&G Mobility GmbH",
      "company_seat": "Karlsruhe",
      "details": "08.04.2025 (Bekanntmachungsdatum)\n\nBaden-Württemberg Amtsgericht Mannheim HRB 747925\nRegisterbekanntmachung nach dem Umwandlungsgesetz 08.04.2025 (Eintragungsdatum)\n\nS&G Mobility GmbH\nGesellschaft mit beschränkter Haftung\nKarlsruhe\n\nDen Gläubigern der an der Verschmelzung beteiligten Rechtsträger ist, wenn sie binnen sechs Monaten nach dem Tag, an dem die Eintragung der Verschmelzung in das Register des Sitzes desjenigen Rechtsträgers, dessen Gläubiger sie sind, nach § 19 Abs. 3 UmwG als bekanntgemacht gilt, ihren Anspruch nach Grund und Höhe schriftlich anmelden, Sicherheit zu leisten, soweit sie nicht Befriedigung verlangen können. Dieses Recht steht den Gläubigern jedoch nur zu, wenn sie glaubhaft machen, dass durch die Verschmelzung die Erfüllung ihrer Forderung gefährdet wird."
    },
    {
      "date": "2025-04-08",
      "id": "105923",
      "original_text": "Registerbekanntmachung nach dem Umwandlungsgesetz\nBaden-Württemberg Amtsgericht Stuttgart HRA 739335\nMSW Heimsheim GmbH & Co. KG – Stuttgart",
      "type": "Registerbekanntmachung nach dem Umwandlungsgesetz",
      "state": "Baden-Württemberg",
      "amtsgericht": "Amtsgericht Stuttgart",
      "registernummer": "HRA 739335",
      "registerart": "HRA",
      "company_name": "MSW Heimsheim GmbH & Co. KG",
      "company_seat": "Stuttgart",
      "details": "08.04.2025 (Bekanntmachungsdatum)\n\nBaden-Württemberg Amtsgericht Stuttgart HRA 739335\nRegisterbekanntmachung nach dem Umwandlungsgesetz 08.04.2025 (Eintragungsdatum)\n\nMSW Heimsheim GmbH & Co. KG\nKommanditgesellschaft\nStuttgart\n\nAls nicht eingetragen wird bekanntgemacht:\nDen Gläubigern der an der Ausgliederung beteiligten Rechtsträger ist, wenn sie binnen sechs Monaten nach dem Tag, an dem die Eintragung der Ausgliederung in das Register des Sitzes desjenigen Rechtsträgers, dessen Gläubiger sie sind, nach § 19 Abs. 3 UmwG als bekanntgemacht gilt, ihren Anspruch nach Grund und Höhe schriftlich anmelden, Sicherheit zu leisten, soweit sie nicht Befriedigung verlangen können. Dieses Recht steht den Gläubigern jedoch nur zu, wenn sie glaubhaft machen, dass durch die Ausgliederung die Erfüllung ihrer Forderung gefährdet wird."
    },
    {
      "date": "2025-04-08",
      "id": "105924",
      "original_text": "Registerbekanntmachung nach dem Umwandlungsgesetz\nBaden-Württemberg Amtsgericht Stuttgart HRA 3021\nHeinrich Mertz Kies- u. Sandwerke GmbH & Co. KG – Stuttgart",
      "type": "Registerbekanntmachung nach dem Umwandlungsgesetz",
      "state": "Baden-Württemberg",
      "amtsgericht": "Amtsgericht Stuttgart",
      "registernummer": "HRA 3021",
      "registerart": "HRA",
      "company_name": "Heinrich Mertz Kies- u. Sandwerke GmbH & Co. KG",
      "company_seat": "Stuttgart",
      "details": "08.04.2025 (Bekanntmachungsdatum)\n\nBaden-Württemberg Amtsgericht Stuttgart HRA 3021\nRegisterbekanntmachung nach dem Umwandlungsgesetz 08.04.2025 (Eintragungsdatum)\n\nHeinrich Mertz Kies- u. Sandwerke GmbH & Co. KG\nKommanditgesellschaft\nStuttgart\n\nDen Gläubigern der an der Ausgliederung beteiligten Rechtsträger ist, wenn sie binnen sechs Monaten nach dem Tag, an dem die Eintragung der Ausgliederung in das Register des Sitzes desjenigen Rechtsträgers, dessen Gläubiger sie sind, nach § 19 Abs. 3 UmwG als bekanntgemacht gilt, ihren Anspruch nach Grund und Höhe schriftlich anmelden, Sicherheit zu leisten, soweit sie nicht Befriedigung verlangen können. Dieses Recht steht den Gläubigern jedoch nur zu, wenn sie glaubhaft machen, dass durch die Ausgliederung die Erfüllung ihrer Forderung gefährdet wird."
    },
    {
      "date": "2025-04-08",
      "id": "105925",
      "original_text": "Löschungsankündigung\nBerlin Amtsgericht Berlin (Charlottenburg) HRB 157983\nAdler Automaten GmbH – Berlin",
      "type": "Löschungsankündigung",
      "state": "Berlin",
      "amtsgericht": "Amtsgericht Berlin (Charlottenburg)",
      "registernummer": "HRB 157983",
      "registerart": "HRB",
      "company_name": "Adler Automaten GmbH",
      "company_seat": "Berlin",
      "details": "08.04.2025 (Bekanntmachungsdatum)\n\nBerlin Amtsgericht Berlin (Charlottenburg) HRB 157983\nLöschungsankündigung\n\nAdler Automaten GmbH\nGesellschaft mit beschränkter Haftung\nBerlin\n\nBei der nachstehenden Gesellschaft wird das Amtslöschungsverfahren gemäß § 394 FamFG eingeleitet. Widerspruchsfrist 6 Wochen"
    },
    {
      "date": "2025-04-08",
      "id": "105926",
      "original_text": "Löschungsankündigung\nBerlin Amtsgericht Berlin (Charlottenburg) HRB 205999\nKursus UG (haftungsbeschränkt) – Berlin",
      "type": "Löschungsankündigung",
      "state": "Berlin",
      "amtsgericht": "Amtsgericht Berlin (Charlottenburg)",
      "registernummer": "HRB 205999",
      "registerart": "HRB",
      "company_name": "Kursus UG (haftungsbeschränkt)",
      "company_seat": "Berlin",
      "details": "08.04.2025 (Bekanntmachungsdatum)\n\nBerlin Amtsgericht Berlin (Charlottenburg) HRB 205999\nLöschungsankündigung\n\nKursus UG (haftungsbeschränkt)\nGesellschaft mit beschränkter Haftung\nBerlin\n\nBei der nachstehenden Gesellschaft wird das Amtslöschungsverfahren gemäß § 394 FamFG eingeleitet. Widerspruchsfrist 6 Wochen"
    },
    {
      "date": "2025-04-08",
      "id": "105927",
      "original_text": "Löschungsankündigung\nBerlin Amtsgericht Berlin (Charlottenburg) HRB 230459\nMuchaneta UG (haftungsbeschränkt) – Berlin",
      "type": "Löschungsankündigung",
      "state": "Berlin",
      "amtsgericht": "Amtsgericht Berlin (Charlottenburg)",
      "registernummer": "HRB 230459",
      "registerart": "HRB",
      "company_name": "Muchaneta UG (haftungsbeschränkt)",
      "company_seat": "Berlin",
      "details": "08.04.2025 (Bekanntmachungsdatum)\n\nBerlin Amtsgericht Berlin (Charlottenburg) HRB 230459\nLöschungsankündigung\n\nMuchaneta UG (haftungsbeschränkt)\nGesellschaft mit beschränkter Haftung\nBerlin\n\nBei der nachstehenden Gesellschaft wird das Amtslöschungsverfahren gemäß § 394 FamFG eingeleitet. Widerspruchsfrist 6 Wochen"
    },
    {
      "date": "2025-04-08",
      "id": "105928",
      "original_text": "Löschungsankündigung\nBrandenburg Amtsgericht Neuruppin HRB 13108\nTostra Deutschland UG (haftungsbeschränkt) – Prenzlau",
      "type": "Löschungsankündigung",
      "state": "Brandenburg",
      "amtsgericht": "Amtsgericht Neuruppin",
      "registernummer": "HRB 13108",
      "registerart": "HRB",
      "company_name": "Tostra Deutschland UG (haftungsbeschränkt)",
      "company_seat": "Prenzlau",
      "details": "08.04.2025 (Bekanntmachungsdatum)\n\nBrandenburg Amtsgericht Neuruppin HRB 13108\nLöschungsankündigung\n\nTostra Deutschland UG (haftungsbeschränkt)\nGesellschaft mit beschränkter Haftung\nPrenzlau\n\nBei der nachstehenden Gesellschaft wird das Amtslöschungsverfahren gemäß § 394 FamFG eingeleitet.\nWiderspruchsfrist: 1 Monat"
    },
    {
      "date": "2025-04-08",
      "id": "105929",
      "original_text": "Löschungsankündigung\nMecklenburg-Vorpommern Amtsgericht Stralsund HRB 20451\nH & P Fahrzeugvertriebs GmbH – Greifswald",
      "type": "Löschungsankündigung",
      "state": "Mecklenburg-Vorpommern",
      "amtsgericht": "Amtsgericht Stralsund",
      "registernummer": "HRB 20451",
      "registerart": "HRB",
      "company_name": "H & P Fahrzeugvertriebs GmbH",
      "company_seat": "Greifswald",
      "details": "08.04.2025 (Bekanntmachungsdatum)\n\nMecklenburg-Vorpommern Amtsgericht Stralsund HRB 20451\nLöschungsankündigung\n\nH & P Fahrzeugvertriebs GmbH\nGesellschaft mit beschränkter Haftung\nGreifswald\n\nDas Registergericht beabsichtigt, die Firma von Amts wegen nach § 394 FamFG zu löschen. Die Frist zur Erhebung eines Widerspruchs ist auf 1 Monat festgesetzt."
    },
    {
      "date": "2025-04-08",
      "id": "105930",
      "original_text": "Sonstige Registerbekanntmachung\nBerlin Amtsgericht Berlin (Charlottenburg) HRB 192205\nSunotec Group GmbH – Berlin",
      "type": "Sonstige Registerbekanntmachung",
      "state": "Berlin",
      "amtsgericht": "Amtsgericht Berlin (Charlottenburg)",
      "registernummer": "HRB 192205",
      "registerart": "HRB",
      "company_name": "Sunotec Group GmbH",
      "company_seat": "Berlin",
      "details": "08.04.2025 (Bekanntmachungsdatum)\n\nBerlin Amtsgericht Berlin (Charlottenburg) HRB 192205\nSonstige Registerbekanntmachung 07.04.2025 (Eintragungsdatum)\n\nSunotec Group GmbH\nGesellschaft mit beschränkter Haftung\nBerlin\n\nAls nicht eingetragen wird veröffentlicht: Der andere Vertragsteil hat den Gläubigern dieses Rechtsträgers, deren Forderungen begründet worden sind, bevor die Eintragung der Beendigung dieses Vertrages in das Handelsregister nach § 10 des Handelsgesetzbuches als bekannt gemacht gilt, Sicherheit zu leisten, wenn sie sich binnen sechs Monaten nach der Bekanntmachung der Eintragung zu diesem Zweck bei ihm melden. Dieses Recht steht den Gläubigern nicht zu, die im Fall des Insolvenzverfahrens ein Recht auf vorzugsweise Befriedigung aus der Deckungsmasse haben, die nach gesetzlicher Vorschrift zu ihrem Schutz errichtet und staatlich überwacht ist."
    },
    {
      "date": "2025-04-08",
      "id": "105931",
      "original_text": "Löschungsankündigung\nSchleswig-Holstein Amtsgericht Flensburg HRB 13512\nLeas Held UG (haftungsbeschränkt) – Harrislee",
      "type": "Löschungsankündigung",
      "state": "Schleswig-Holstein",
      "amtsgericht": "Amtsgericht Flensburg",
      "registernummer": "HRB 13512",
      "registerart": "HRB",
      "company_name": "Leas Held UG (haftungsbeschränkt)",
      "company_seat": "Harrislee",
      "details": "08.04.2025 (Bekanntmachungsdatum)\n\nSchleswig-Holstein Amtsgericht Flensburg HRB 13512\nLöschungsankündigung\n\nLeas Held UG (haftungsbeschränkt)\nGesellschaft mit beschränkter Haftung\nHarrislee\n\nEs ist die Löschung der nachstehenden Gesellschaft wegen Vermögenslosigkeit gemäß § 394 FamFG beabsichtigt.\nWiderspruchsfrist: 2 Monate."
    },
    {
      "date": "2025-04-08",
      "id": "105932",
      "original_text": "Registerbekanntmachung nach dem Umwandlungsgesetz\nThüringen Amtsgericht Jena HRB 516926\n3Kabel Gebäudetechnik GmbH – Bad Salzungen",
      "type": "Registerbekanntmachung nach dem Umwandlungsgesetz",
      "state": "Thüringen",
      "amtsgericht": "Amtsgericht Jena",
      "registernummer": "HRB 516926",
      "registerart": "HRB",
      "company_name": "3Kabel Gebäudetechnik GmbH",
      "company_seat": "Bad Salzungen",
      "details": "08.04.2025 (Bekanntmachungsdatum)\n\nThüringen Amtsgericht Jena HRB 516926\nRegisterbekanntmachung nach dem Umwandlungsgesetz 08.04.2025 (Eintragungsdatum)\n\n3Kabel Gebäudetechnik GmbH\nGesellschaft mit beschränkter Haftung\nBad Salzungen\n\nNicht eingetragen: Den Gläubigern der an der Verschmelzung beteiligten Rechtsträger, ist wenn sie binnen sechs Monaten nach dem Tag, an dem die Eintragung der Verschmelzung in das Register des Sitzes desjenigen Rechtsträgers, dessen Gläubiger sie sind,  nach § 19 Abs. 3 UmwG als bekanntgemacht gilt, ihren Anspruch nach Grund und Höhe schriftlich anmelden, Sicherheit zu leisten, soweit sie nicht Befriedigung verlangen können. Dieses Recht steht ihnen jedoch nur zu, wenn sie glaubhaft machen, daß durch die Verschmelzung die Erfüllung ihrer Forderung gefährdet wird."
    },
    {
      "date": "2025-04-08",
      "id": "105933",
      "original_text": "Registerbekanntmachung nach dem Umwandlungsgesetz\nThüringen Amtsgericht Jena HRB 306403\nVARIA3 GmbH – Bad Salzungen",
      "type": "Registerbekanntmachung nach dem Umwandlungsgesetz",
      "state": "Thüringen",
      "amtsgericht": "Amtsgericht Jena",
      "registernummer": "HRB 306403",
      "registerart": "HRB",
      "company_name": "VARIA3 GmbH",
      "company_seat": "Bad Salzungen",
      "details": "08.04.2025 (Bekanntmachungsdatum)\n\nThüringen Amtsgericht Jena HRB 306403\nRegisterbekanntmachung nach dem Umwandlungsgesetz 08.04.2025 (Eintragungsdatum)\n\nVARIA3 GmbH\nGesellschaft mit beschränkter Haftung\nBad Salzungen\n\nNicht eingetragen: Den Gläubigern der an der Verschmelzung beteiligten Rechtsträger, ist wenn sie binnen sechs Monaten nach dem Tag, an dem die Eintragung der Verschmelzung in das Register des Sitzes desjenigen Rechtsträgers, dessen Gläubiger sie sind,  nach § 19 Abs. 3 UmwG als bekanntgemacht gilt, ihren Anspruch nach Grund und Höhe schriftlich anmelden, Sicherheit zu leisten, soweit sie nicht Befriedigung verlangen können. Dieses Recht steht ihnen jedoch nur zu, wenn sie glaubhaft machen, daß durch die Verschmelzung die Erfüllung ihrer Forderung gefährdet wird."
    },
    {
      "date": "2025-04-08",
      "id": "105934",
      "original_text": "Registerbekanntmachung nach dem Umwandlungsgesetz\nThüringen Amtsgericht Jena HRB 504503\nPollmeier Massiv - nach - Maß Verwaltungs GmbH – Amt Creuzburg",
      "type": "Registerbekanntmachung nach dem Umwandlungsgesetz",
      "state": "Thüringen",
      "amtsgericht": "Amtsgericht Jena",
      "registernummer": "HRB 504503",
      "registerart": "HRB",
      "company_name": "Pollmeier Massiv - nach - Maß Verwaltungs GmbH",
      "company_seat": "Amt Creuzburg",
      "details": "08.04.2025 (Bekanntmachungsdatum)\n\nThüringen Amtsgericht Jena HRB 504503\nRegisterbekanntmachung nach dem Umwandlungsgesetz 08.04.2025 (Eintragungsdatum)\n\nPollmeier Massiv - nach - Maß Verwaltungs GmbH\nGesellschaft mit beschränkter Haftung\nAmt Creuzburg\n\nNicht eingetragen: Den Gläubigern der an der Verschmelzung beteiligten Rechtsträger, ist wenn sie binnen sechs Monaten nach dem Tag, an dem die Eintragung der Verschmelzung in das Register des Sitzes desjenigen Rechtsträgers, dessen Gläubiger sie sind,  nach § 19 Abs. 3 UmwG als bekanntgemacht gilt, ihren Anspruch nach Grund und Höhe schriftlich anmelden, Sicherheit zu leisten, soweit sie nicht Befriedigung verlangen können. Dieses Recht steht ihnen jedoch nur zu, wenn sie glaubhaft machen, daß durch die Verschmelzung die Erfüllung ihrer Forderung gefährdet wird."
    },
    {
      "date": "2025-04-08",
      "id": "105935",
      "original_text": "Registerbekanntmachung nach dem Umwandlungsgesetz\nThüringen Amtsgericht Jena HRB 516920\n3 Kabel Service- und Verwaltungsgesellschaft mbH – Bad Salzungen",
      "type": "Registerbekanntmachung nach dem Umwandlungsgesetz",
      "state": "Thüringen",
      "amtsgericht": "Amtsgericht Jena",
      "registernummer": "HRB 516920",
      "registerart": "HRB",
      "company_name": "3 Kabel Service- und Verwaltungsgesellschaft mbH",
      "company_seat": "Bad Salzungen",
      "details": "08.04.2025 (Bekanntmachungsdatum)\n\nThüringen Amtsgericht Jena HRB 516920\nRegisterbekanntmachung nach dem Umwandlungsgesetz 08.04.2025 (Eintragungsdatum)\n\n3 Kabel Service- und Verwaltungsgesellschaft mbH\nGesellschaft mit beschränkter Haftung\nBad Salzungen\n\nNicht eingetragen: Den Gläubigern der an der Verschmelzung beteiligten Rechtsträger, ist wenn sie binnen sechs Monaten nach dem Tag, an dem die Eintragung der Verschmelzung in das Register des Sitzes desjenigen Rechtsträgers, dessen Gläubiger sie sind,  nach § 19 Abs. 3 UmwG als bekanntgemacht gilt, ihren Anspruch nach Grund und Höhe schriftlich anmelden, Sicherheit zu leisten, soweit sie nicht Befriedigung verlangen können. Dieses Recht steht ihnen jedoch nur zu, wenn sie glaubhaft machen, daß durch die Verschmelzung die Erfüllung ihrer Forderung gefährdet wird."
    },
    {
      "date": "2025-04-08",
      "id": "105936",
      "original_text": "Registerbekanntmachung nach dem Umwandlungsgesetz\nBaden-Württemberg Amtsgericht Freiburg HRB 708869\nPAWI Deutschland GmbH – Singen Hohentwiel",
      "type": "Registerbekanntmachung nach dem Umwandlungsgesetz",
      "state": "Baden-Württemberg",
      "amtsgericht": "Amtsgericht Freiburg",
      "registernummer": "HRB 708869",
      "registerart": "HRB",
      "company_name": "PAWI Deutschland GmbH",
      "company_seat": "Singen Hohentwiel",
      "details": "08.04.2025 (Bekanntmachungsdatum)\n\nBaden-Württemberg Amtsgericht Freiburg HRB 708869\nRegisterbekanntmachung nach dem Umwandlungsgesetz 08.04.2025 (Eintragungsdatum)\n\nPAWI Deutschland GmbH\nGesellschaft mit beschränkter Haftung\nSingen Hohentwiel\n\nDen Gläubigern der an der Verschmelzung beteiligten Rechtsträger ist, wenn sie binnen sechs Monaten nach dem Tag, an dem die Eintragung der Verschmelzung in das Register des Sitzes desjenigen Rechtsträgers, dessen Gläubiger sie sind, nach § 19 Abs. 3 UmwG als bekanntgemacht gilt, ihren Anspruch nach Grund und Höhe schriftlich anmelden, Sicherheit zu leisten, soweit sie nicht Befriedigung verlangen können. Dieses Recht steht den Gläubigern jedoch nur zu, wenn sie glaubhaft machen, dass durch die Verschmelzung die Erfüllung ihrer Forderung gefährdet wird."
    },
    {
      "date": "2025-04-08",
      "id": "105937",
      "original_text": "Registerbekanntmachung nach dem Umwandlungsgesetz\nSachsen-Anhalt Amtsgericht Stendal HRB 33946\nSPARTAN Constructions GmbH – Bernburg",
      "type": "Registerbekanntmachung nach dem Umwandlungsgesetz",
      "state": "Sachsen-Anhalt",
      "amtsgericht": "Amtsgericht Stendal",
      "registernummer": "HRB 33946",
      "registerart": "HRB",
      "company_name": "SPARTAN Constructions GmbH",
      "company_seat": "Bernburg",
      "details": "08.04.2025 (Bekanntmachungsdatum)\n\nSachsen-Anhalt Amtsgericht Stendal HRB 33946\nRegisterbekanntmachung nach dem Umwandlungsgesetz 08.04.2025 (Eintragungsdatum)\n\nSPARTAN Constructions GmbH\nGesellschaft mit beschränkter Haftung\nBernburg\n\nNicht eingetragen:\nDen Gläubigern des formwechselnden  Rechtsträgers, ist wenn sie binnen sechs Monaten nach dem Tag, an dem die Eintragung des Formwechsels nach § 201 UmwG als bekanntgemacht gilt, ihren Anspruch nach Grund und Höhe schriftlich anmelden, Sicherheit zu leisten, soweit sie nicht Befriedigung verlangen können. Dieses Recht steht ihnen jedoch nur zu, wenn sie glaubhaft machen, dass durch den Formwechsel die Erfüllung ihrer Forderung gefährdet wird."
    },
    {
      "date": "2025-04-08",
      "id": "105938",
      "original_text": "Registerbekanntmachung nach dem Umwandlungsgesetz\nSachsen-Anhalt Amtsgericht Stendal HRA 8177\nZASA Constructions OHG – Bernburg",
      "type": "Registerbekanntmachung nach dem Umwandlungsgesetz",
      "state": "Sachsen-Anhalt",
      "amtsgericht": "Amtsgericht Stendal",
      "registernummer": "HRA 8177",
      "registerart": "HRA",
      "company_name": "ZASA Constructions OHG",
      "company_seat": "Bernburg",
      "details": "08.04.2025 (Bekanntmachungsdatum)\n\nSachsen-Anhalt Amtsgericht Stendal HRA 8177\nRegisterbekanntmachung nach dem Umwandlungsgesetz 08.04.2025 (Eintragungsdatum)\n\nZASA Constructions OHG\nOffene Handelsgesellschaft\nBernburg\n\nNicht eingetragen:\nDen Gläubigern des formwechselnden  Rechtsträgers, ist wenn sie binnen sechs Monaten nach dem Tag, an dem die Eintragung des Formwechsels nach § 201 UmwG als bekanntgemacht gilt, ihren Anspruch nach Grund und Höhe schriftlich anmelden, Sicherheit zu leisten, soweit sie nicht Befriedigung verlangen können. Dieses Recht steht ihnen jedoch nur zu, wenn sie glaubhaft machen, dass durch den Formwechsel die Erfüllung ihrer Forderung gefährdet wird."
    },
    {
      "date": "2025-04-08",
      "id": "105939",
      "original_text": "Löschungsankündigung\nBaden-Württemberg Amtsgericht Stuttgart HRB 786115\nCS Fensterbau GmbH – Stuttgart",
      "type": "Löschungsankündigung",
      "state": "Baden-Württemberg",
      "amtsgericht": "Amtsgericht Stuttgart",
      "registernummer": "HRB 786115",
      "registerart": "HRB",
      "company_name": "CS Fensterbau GmbH",
      "company_seat": "Stuttgart",
      "details": "08.04.2025 (Bekanntmachungsdatum)\n\nBaden-Württemberg Amtsgericht Stuttgart HRB 786115\nLöschungsankündigung\n\nCS Fensterbau GmbH\nGesellschaft mit beschränkter Haftung\nStuttgart\n\nAls nicht eingetragen wird bekanntgemacht:\nDas Gericht beabsichtigt, die Gesellschaft wegen Vermögenslosigkeit im Handelsregister von Amts wegen nach § 394 FamFG zu löschen. Die Frist zur Geltendmachung eines Widerspruchs gegen die beabsichtigte Löschung ist auf zwei Monate ab Veröffentlichung bestimmt."
    },
    {
      "date": "2025-04-08",
      "id": "105940",
      "original_text": "Registerbekanntmachung nach dem Umwandlungsgesetz\nBerlin Amtsgericht Berlin (Charlottenburg) GsR 729\nSputnik Films eGbR – Berlin",
      "type": "Registerbekanntmachung nach dem Umwandlungsgesetz",
      "state": "Berlin",
      "amtsgericht": "Amtsgericht Berlin (Charlottenburg)",
      "registernummer": "GsR 729",
      "registerart": "GsR",
      "company_name": "Sputnik Films eGbR",
      "company_seat": "Berlin",
      "details": "08.04.2025 (Bekanntmachungsdatum)\n\nBerlin Amtsgericht Berlin (Charlottenburg) GsR 729\nRegisterbekanntmachung nach dem Umwandlungsgesetz 07.04.2025 (Eintragungsdatum)\n\nSputnik Films eGbR\nGesellschaft bürgerlichen Rechts\nBerlin\n\nDen Gläubigern der an der Verschmelzung beteiligten Rechtsträger ist, wenn sie binnen sechs Monaten nach dem Tag, an dem die Eintragung der Verschmelzung in das Register des Sitzes desjenigen Rechtsträgers, dessen Gläubiger sie sind, als bekannt gemacht gilt, ihren Anspruch nach Grund und Höhe schriftlich anmelden, Sicherheit zu leisten, soweit sie nicht Befriedigung verlangen können. Dieses Recht steht den Gläubigern jedoch nur zu, wenn sie glaubhaft machen, dass durch die Verschmelzung die Erfüllung ihrer Forderung gefährdet wird. Das Recht, Sicherheitsleistung zu verlangen, steht Gläubigern nicht zu, die im Falle der Insolvenz ein Recht auf vorzugsweise Befriedigung aus einer Deckungsmasse haben, die nach gesetzlicher Vorschrift zu ihrem Schutz errichtet und staatlich überwacht ist.Zu Eintragungsnummer 3 vom 07.04.2025 wird als nicht eingetragen veröffentlicht:"
    },
    {
      "date": "2025-04-08",
      "id": "105941",
      "original_text": "Registerbekanntmachung nach dem Umwandlungsgesetz\nBerlin Amtsgericht Berlin (Charlottenburg) HRB 272428\nMoonrocketfilms GmbH – Berlin",
      "type": "Registerbekanntmachung nach dem Umwandlungsgesetz",
      "state": "Berlin",
      "amtsgericht": "Amtsgericht Berlin (Charlottenburg)",
      "registernummer": "HRB 272428",
      "registerart": "HRB",
      "company_name": "Moonrocketfilms GmbH",
      "company_seat": "Berlin",
      "details": "08.04.2025 (Bekanntmachungsdatum)\n\nBerlin Amtsgericht Berlin (Charlottenburg) HRB 272428\nRegisterbekanntmachung nach dem Umwandlungsgesetz 07.04.2025 (Eintragungsdatum)\n\nMoonrocketfilms GmbH\nGesellschaft mit beschränkter Haftung\nBerlin\n\nZu Eintragungsnummer 3 vom 07.04.2025 wird als nicht eingetragen veröffentlicht: Den Gläubigern der an der Verschmelzung beteiligten Rechtsträger ist, wenn sie binnen sechs Monaten nach dem Tag, an dem die Eintragung der Verschmelzung in das Register des Sitzes desjenigen Rechtsträgers, dessen Gläubiger sie sind, als bekannt gemacht gilt, ihren Anspruch nach Grund und Höhe schriftlich anmelden, Sicherheit zu leisten, soweit sie nicht Befriedigung verlangen können. Dieses Recht steht den Gläubigern jedoch nur zu, wenn sie glaubhaft machen, dass durch die Verschmelzung die Erfüllung ihrer Forderung gefährdet wird. Das Recht, Sicherheitsleistung zu verlangen, steht Gläubigern nicht zu, die im Falle der Insolvenz ein Recht auf vorzugsweise Befriedigung aus einer Deckungsmasse haben, die nach gesetzlicher Vorschrift zu ihrem Schutz errichtet und staatlich überwacht ist."
    },
    {
      "date": "2025-04-08",
      "id": "105942",
      "original_text": "Registerbekanntmachung nach dem Umwandlungsgesetz\nBaden-Württemberg Amtsgericht Stuttgart HRB 12931\nBülow Aktiengesellschaft – Stuttgart",
      "type": "Registerbekanntmachung nach dem Umwandlungsgesetz",
      "state": "Baden-Württemberg",
      "amtsgericht": "Amtsgericht Stuttgart",
      "registernummer": "HRB 12931",
      "registerart": "HRB",
      "company_name": "Bülow Aktiengesellschaft",
      "company_seat": "Stuttgart",
      "details": "08.04.2025 (Bekanntmachungsdatum)\n\nBaden-Württemberg Amtsgericht Stuttgart HRB 12931\nRegisterbekanntmachung nach dem Umwandlungsgesetz 08.04.2025 (Eintragungsdatum)\n\nBülow Aktiengesellschaft\nAktiengesellschaft\nStuttgart\n\nDen Gläubigern der an der Verschmelzung beteiligten Rechtsträger ist, wenn sie binnen sechs Monaten nach dem Tag, an dem die Eintragung der Verschmelzung in das Register des Sitzes desjenigen Rechtsträgers, dessen Gläubiger sie sind, nach § 19 Abs. 3 UmwG als bekanntgemacht gilt, ihren Anspruch nach Grund und Höhe schriftlich anmelden, Sicherheit zu leisten, soweit sie nicht Befriedigung verlangen können. Dieses Recht steht den Gläubigern jedoch nur zu, wenn sie glaubhaft machen, dass durch die Verschmelzung die Erfüllung ihrer Forderung gefährdet wird."
    },
    {
      "date": "2025-04-08",
      "id": "105943",
      "original_text": "Registerbekanntmachung nach dem Umwandlungsgesetz\nBaden-Württemberg Amtsgericht Mannheim HRB 712475\nATASON Zweite Casino-Betriebs GmbH – Stutensee",
      "type": "Registerbekanntmachung nach dem Umwandlungsgesetz",
      "state": "Baden-Württemberg",
      "amtsgericht": "Amtsgericht Mannheim",
      "registernummer": "HRB 712475",
      "registerart": "HRB",
      "company_name": "ATASON Zweite Casino-Betriebs GmbH",
      "company_seat": "Stutensee",
      "details": "08.04.2025 (Bekanntmachungsdatum)\n\nBaden-Württemberg Amtsgericht Mannheim HRB 712475\nRegisterbekanntmachung nach dem Umwandlungsgesetz 08.04.2025 (Eintragungsdatum)\n\nATASON Zweite Casino-Betriebs GmbH\nGesellschaft mit beschränkter Haftung\nStutensee\n\nAls nicht eingetragen wird bekanntgemacht:\nDen Gläubigern der an der Verschmelzung beteiligten Rechtsträger ist, wenn sie binnen sechs Monaten nach dem Tag, an dem die Eintragung der Verschmelzung in das Register des Sitzes desjenigen Rechtsträgers, dessen Gläubiger sie sind, nach § 19 Abs. 3 UmwG als bekanntgemacht gilt, ihren Anspruch nach Grund und Höhe schriftlich anmelden, Sicherheit zu leisten, soweit sie nicht Befriedigung verlangen können. Dieses Recht steht den Gläubigern jedoch nur zu, wenn sie glaubhaft machen, dass durch die Verschmelzung die Erfüllung ihrer Forderung gefährdet wird."
    },
    {
      "date": "2025-04-08",
      "id": "105944",
      "original_text": "Löschungsankündigung\nBaden-Württemberg Amtsgericht Mannheim HRB 723351\nVertical.Net GmbH – Mannheim",
      "type": "Löschungsankündigung",
      "state": "Baden-Württemberg",
      "amtsgericht": "Amtsgericht Mannheim",
      "registernummer": "HRB 723351",
      "registerart": "HRB",
      "company_name": "Vertical.Net GmbH",
      "company_seat": "Mannheim",
      "details": "08.04.2025 (Bekanntmachungsdatum)\n\nBaden-Württemberg Amtsgericht Mannheim HRB 723351\nLöschungsankündigung\n\nVertical.Net GmbH\nGesellschaft mit beschränkter Haftung\nMannheim\n\nDas Gericht beabsichtigt, die Gesellschaft wegen Vermögenslosigkeit im Handelsregister von Amts wegen nach § 394 FamFG zu löschen. Die Frist zur Geltendmachung eines Widerspruchs gegen die beabsichtigte Löschung ist auf einen Monat ab Veröffentlichung bestimmt."
    },
    {
      "date": "2025-04-08",
      "id": "105945",
      "original_text": "Löschungsankündigung\nNordrhein-Westfalen Amtsgericht Coesfeld HRB 19360\nWGI Wachwitz Grundbesitz & Immobilien UG (haftungsbeschränkt) – Gronau",
      "type": "Löschungsankündigung",
      "state": "Nordrhein-Westfalen",
      "amtsgericht": "Amtsgericht Coesfeld",
      "registernummer": "HRB 19360",
      "registerart": "HRB",
      "company_name": "WGI Wachwitz Grundbesitz & Immobilien UG (haftungsbeschränkt)",
      "company_seat": "Gronau",
      "details": "08.04.2025 (Bekanntmachungsdatum)\n\nNordrhein-Westfalen Amtsgericht Coesfeld HRB 19360\nLöschungsankündigung\n\nWGI Wachwitz Grundbesitz & Immobilien UG (haftungsbeschränkt)\nGesellschaft mit beschränkter Haftung\nGronau\n\nDas Registergericht beabsichtigt, den Rechtsträger wegen Vermögenslosigkeit gemäß § 394 FamFG von Amts wegen zu löschen.\n\nGegen diese Verfügung kann Widerspruch eingelegt werden. Die Frist zur Erhebung eines Widerspruchs gegen die beabsichtigte Löschung ist auf zwei Monate ab Veröffentlichung festgesetzt."
    },
    {
      "date": "2025-04-08",
      "id": "105946",
      "original_text": "Registerbekanntmachung nach dem Umwandlungsgesetz\nHamburg Amtsgericht Hamburg HRB 101742\nG4S Immobilien-Verwaltungs GmbH – Hamburg",
      "type": "Registerbekanntmachung nach dem Umwandlungsgesetz",
      "state": "Hamburg",
      "amtsgericht": "Amtsgericht Hamburg",
      "registernummer": "HRB 101742",
      "registerart": "HRB",
      "company_name": "G4S Immobilien-Verwaltungs GmbH",
      "company_seat": "Hamburg",
      "details": "08.04.2025 (Bekanntmachungsdatum)\n\nHamburg Amtsgericht Hamburg HRB 101742\nRegisterbekanntmachung nach dem Umwandlungsgesetz 08.04.2025 (Eintragungsdatum)\n\nG4S Immobilien-Verwaltungs GmbH\nGesellschaft mit beschränkter Haftung\nHamburg\n\nAls nicht eingetragen wird bekannt gemacht:\nDen Gläubigern der an der Verschmelzung beteiligten Gesellschaften ist, wenn sie binnen sechs Monaten nach dem Tag, an dem die Eintragung der Verschmelzung in das Register des Sitzes desjenigen Rechtsträgers, dessen Gläubiger sie sind, nach § 19 Absatz 3 UmwG als bekannt gemacht gilt, ihren Anspruch nach Grund und Höhe schriftlich anmelden, Sicherheit zu leisten, soweit sie nicht Befriedigung verlangen können. Dieses Recht steht den Gläubigern jedoch nur zu, wenn sie glaubhaft machen, dass durch die Verschmelzung die Erfüllung ihrer Forderung gefährdet wird."
    },
    {
      "date": "2025-04-08",
      "id": "105947",
      "original_text": "Registerbekanntmachung nach dem Umwandlungsgesetz\nHamburg Amtsgericht Hamburg HRB 94051\nG4S Security Holdings DE GmbH – Hamburg",
      "type": "Registerbekanntmachung nach dem Umwandlungsgesetz",
      "state": "Hamburg",
      "amtsgericht": "Amtsgericht Hamburg",
      "registernummer": "HRB 94051",
      "registerart": "HRB",
      "company_name": "G4S Security Holdings DE GmbH",
      "company_seat": "Hamburg",
      "details": "08.04.2025 (Bekanntmachungsdatum)\n\nHamburg Amtsgericht Hamburg HRB 94051\nRegisterbekanntmachung nach dem Umwandlungsgesetz 08.04.2025 (Eintragungsdatum)\n\nG4S Security Holdings DE GmbH\nGesellschaft mit beschränkter Haftung\nHamburg\n\nAls nicht eingetragen wird bekannt gemacht:\nDen Gläubigern der an der Verschmelzung beteiligten Gesellschaften ist, wenn sie binnen sechs Monaten nach dem Tag, an dem die Eintragung der Verschmelzung in das Register des Sitzes desjenigen Rechtsträgers, dessen Gläubiger sie sind, nach § 19 Absatz 3 UmwG als bekannt gemacht gilt, ihren Anspruch nach Grund und Höhe schriftlich anmelden, Sicherheit zu leisten, soweit sie nicht Befriedigung verlangen können. Dieses Recht steht den Gläubigern jedoch nur zu, wenn sie glaubhaft machen, dass durch die Verschmelzung die Erfüllung ihrer Forderung gefährdet wird."
    },
    {
      "date": "2025-04-08",
      "id": "105948",
      "original_text": "Einreichung neuer Dokumente\nBaden-Württemberg Amtsgericht Ulm HRB 727435\nTectosolum AG – Schelklingen",
      "type": "Einreichung neuer Dokumente",
      "state": "Baden-Württemberg",
      "amtsgericht": "Amtsgericht Ulm",
      "registernummer": "HRB 727435",
      "registerart": "HRB",
      "company_name": "Tectosolum AG",
      "company_seat": "Schelklingen",
      "details": "08.04.2025 (Bekanntmachungsdatum)\n\nBaden-Württemberg Amtsgericht Ulm HRB 727435\nEinreichung neuer Dokumente 08.04.2025 (Eintragungsdatum)\n\nTectosolum AG\nAktiengesellschaft\nSchelklingen\n\nDie Gesellschaft hat am 08.04.2025 die Liste über die Zusammensetzung des Aufsichtsrats zum Handelsregister eingereicht."
    },
    {
      "date": "2025-04-08",
      "id": "105949",
      "original_text": "Registerbekanntmachung nach dem Umwandlungsgesetz\nMecklenburg-Vorpommern Amtsgericht Stralsund HRB 5598\nBIRNBAUM Real Estate Management GmbH – Greifswald",
      "type": "Registerbekanntmachung nach dem Umwandlungsgesetz",
      "state": "Mecklenburg-Vorpommern",
      "amtsgericht": "Amtsgericht Stralsund",
      "registernummer": "HRB 5598",
      "registerart": "HRB",
      "company_name": "BIRNBAUM Real Estate Management GmbH",
      "company_seat": "Greifswald",
      "details": "08.04.2025 (Bekanntmachungsdatum)\n\nMecklenburg-Vorpommern Amtsgericht Stralsund HRB 5598\nRegisterbekanntmachung nach dem Umwandlungsgesetz 08.04.2025 (Eintragungsdatum)\n\nBIRNBAUM Real Estate Management GmbH\nGesellschaft mit beschränkter Haftung\nGreifswald\n\nAls nicht eingetragen wird veröffentlicht: Den Gläubigern der an der Verschmelzung beteiligten Rechtsträger ist, wenn sie binnen sechs Monaten nach dem Tag, an dem die Eintragung der Verschmelzung in das Register des Sitzes desjenigen Rechtsträgers, dessen Gläubiger sie sind, nach § 19 Abs. 3 UmwG als bekannt gemacht gilt,\nihren Anspruch nach Grund und Höhe in Textform anmelden, Sicherheit zu leisten, soweit sie nicht Befriedigung verlangen können. Dieses Recht steht den Gläubigern jedoch nur zu, wenn sie glaubhaft machen, dass durch die Verschmelzung die Erfüllung der Forderung gefährdet wird."
    },
    {
      "date": "2025-04-08",
      "id": "105950",
      "original_text": "Registerbekanntmachung nach dem Umwandlungsgesetz\nMecklenburg-Vorpommern Amtsgericht Stralsund HRB 22721\nBIRNBAUM Immobilien GmbH – Greifswald",
      "type": "Registerbekanntmachung nach dem Umwandlungsgesetz",
      "state": "Mecklenburg-Vorpommern",
      "amtsgericht": "Amtsgericht Stralsund",
      "registernummer": "HRB 22721",
      "registerart": "HRB",
      "company_name": "BIRNBAUM Immobilien GmbH",
      "company_seat": "Greifswald",
      "details": "08.04.2025 (Bekanntmachungsdatum)\n\nMecklenburg-Vorpommern Amtsgericht Stralsund HRB 22721\nRegisterbekanntmachung nach dem Umwandlungsgesetz 08.04.2025 (Eintragungsdatum)\n\nBIRNBAUM Immobilien GmbH\nGesellschaft mit beschränkter Haftung\nGreifswald\n\nAls nicht eingetragen wird veröffentlicht: Den Gläubigern der an der Verschmelzung beteiligten Rechtsträger ist, wenn sie binnen sechs Monaten nach dem Tag, an dem die Eintragung der Verschmelzung in das Register des Sitzes desjenigen Rechtsträgers, dessen Gläubiger sie sind, nach § 19 Abs. 3 UmwG als bekannt gemacht gilt,\nihren Anspruch nach Grund und Höhe in Textform anmelden, Sicherheit zu leisten, soweit sie nicht Befriedigung verlangen können. Dieses Recht steht den Gläubigern jedoch nur zu, wenn sie glaubhaft machen, dass durch die Verschmelzung die Erfüllung der Forderung gefährdet wird."
    },
    {
      "date": "2025-04-08",
      "id": "105951",
      "original_text": "Registerbekanntmachung nach dem Umwandlungsgesetz\nSachsen Amtsgericht Dresden HRB 18848\nKommunalservice Brockwitz-Rödern GmbH – Coswig",
      "type": "Registerbekanntmachung nach dem Umwandlungsgesetz",
      "state": "Sachsen",
      "amtsgericht": "Amtsgericht Dresden",
      "registernummer": "HRB 18848",
      "registerart": "HRB",
      "company_name": "Kommunalservice Brockwitz-Rödern GmbH",
      "company_seat": "Coswig",
      "details": "08.04.2025 (Bekanntmachungsdatum)\n\nSachsen Amtsgericht Dresden HRB 18848\nRegisterbekanntmachung nach dem Umwandlungsgesetz 08.04.2025 (Eintragungsdatum)\n\nKommunalservice Brockwitz-Rödern GmbH\nGesellschaft mit beschränkter Haftung\nCoswig\n\nDen Gläubigern der an der Verschmelzung beteiligten Rechtsträger ist, wenn sie binnen sechs Monaten nach dem Tag, an dem die Eintragung der Verschmelzung in das Register des Sitzes desjenigen Rechtsträgers, dessen Gläubiger sie sind, nach § 19 Abs. 3 UmwG als bekannt gemacht gilt, ihren Anspruch nach Grund und Höhe in Textform anmelden, Sicherheit zu leisten, soweit sie nicht Befriedigung verlangen können. Dieses Recht steht den Gläubigern jedoch nur zu, wenn sie glaubhaft machen, dass durch die Verschmelzung die Erfüllung der Forderung gefährdet wird."
    },
    {
      "date": "2025-04-08",
      "id": "105952",
      "original_text": "Sonstige Registerbekanntmachung\nSachsen Amtsgericht Chemnitz HRB 28284\nDiLoG Dienstleistung und Logistik GmbH – Limbach-Oberfrohna",
      "type": "Sonstige Registerbekanntmachung",
      "state": "Sachsen",
      "amtsgericht": "Amtsgericht Chemnitz",
      "registernummer": "HRB 28284",
      "registerart": "HRB",
      "company_name": "DiLoG Dienstleistung und Logistik GmbH",
      "company_seat": "Limbach-Oberfrohna",
      "details": "08.04.2025 (Bekanntmachungsdatum)\n\nSachsen Amtsgericht Chemnitz HRB 28284\nSonstige Registerbekanntmachung 08.04.2025 (Eintragungsdatum)\n\nDiLoG Dienstleistung und Logistik GmbH\nGesellschaft mit beschränkter Haftung\nLimbach-Oberfrohna\n\nDen Gläubigern der Gesellschaft, deren Forderungen begründet worden sind bevor die Eintragung der Beendigung des Beherrschungs- und Gewinnabführungsvertrages in das Handelsregister nach § 10 des Handelsgesetzbuches als bekanntgemacht gilt, hat der andere Vertragsteil Sicherheit zu leisten, wenn sie sich binnen sechs Monaten nach der Bekanntmachung der Eintragung zu diesem Zweck bei ihm melden."
    },
    {
      "date": "2025-04-08",
      "id": "105953",
      "original_text": "Einreichung neuer Dokumente\nSachsen Amtsgericht Leipzig HRB 9556\nWohnungsbaugesellschaft Bad Düben mbH – Bad Düben",
      "type": "Einreichung neuer Dokumente",
      "state": "Sachsen",
      "amtsgericht": "Amtsgericht Leipzig",
      "registernummer": "HRB 9556",
      "registerart": "HRB",
      "company_name": "Wohnungsbaugesellschaft Bad Düben mbH",
      "company_seat": "Bad Düben",
      "details": "08.04.2025 (Bekanntmachungsdatum)\n\nSachsen Amtsgericht Leipzig HRB 9556\nEinreichung neuer Dokumente\n\nWohnungsbaugesellschaft Bad Düben mbH\nGesellschaft mit beschränkter Haftung\nBad Düben\n\nAm 03.04.2025 wurde beim Handelsregister des Amtsgerichts Leipzig die Liste der Mitglieder des Aufsichtsrats gemäß § 52 GmbHG eingereicht."
    },
    {
      "date": "2025-04-08",
      "id": "105954",
      "original_text": "Registerbekanntmachung nach dem Umwandlungsgesetz\nSachsen Amtsgericht Dresden HRB 19084\nWasserversorgung Brockwitz-Rödern GmbH – Coswig",
      "type": "Registerbekanntmachung nach dem Umwandlungsgesetz",
      "state": "Sachsen",
      "amtsgericht": "Amtsgericht Dresden",
      "registernummer": "HRB 19084",
      "registerart": "HRB",
      "company_name": "Wasserversorgung Brockwitz-Rödern GmbH",
      "company_seat": "Coswig",
      "details": "08.04.2025 (Bekanntmachungsdatum)\n\nSachsen Amtsgericht Dresden HRB 19084\nRegisterbekanntmachung nach dem Umwandlungsgesetz 08.04.2025 (Eintragungsdatum)\n\nWasserversorgung Brockwitz-Rödern GmbH\nGesellschaft mit beschränkter Haftung\nCoswig\n\nDen Gläubigern der an der Verschmelzung beteiligten Rechtsträger ist, wenn sie binnen sechs Monaten nach dem Tag, an dem die Eintragung der Verschmelzung in das Register des Sitzes desjenigen Rechtsträgers, dessen Gläubiger sie sind, nach § 19 Abs. 3 UmwG als bekannt gemacht gilt, ihren Anspruch nach Grund und Höhe in Textform anmelden, Sicherheit zu leisten, soweit sie nicht Befriedigung verlangen können. Dieses Recht steht den Gläubigern jedoch nur zu, wenn sie glaubhaft machen, dass durch die Verschmelzung die Erfüllung der Forderung gefährdet wird."
    },
    {
      "date": "2025-04-08",
      "id": "105955",
      "original_text": "Registerbekanntmachung nach dem Umwandlungsgesetz\nSachsen Amtsgericht Leipzig HRB 29773\nEnterprise Communications & Services GmbH – Leipzig",
      "type": "Registerbekanntmachung nach dem Umwandlungsgesetz",
      "state": "Sachsen",
      "amtsgericht": "Amtsgericht Leipzig",
      "registernummer": "HRB 29773",
      "registerart": "HRB",
      "company_name": "Enterprise Communications & Services GmbH",
      "company_seat": "Leipzig",
      "details": "08.04.2025 (Bekanntmachungsdatum)\n\nSachsen Amtsgericht Leipzig HRB 29773\nRegisterbekanntmachung nach dem Umwandlungsgesetz 08.04.2025 (Eintragungsdatum)\n\nEnterprise Communications & Services GmbH\nGesellschaft mit beschränkter Haftung\nLeipzig\n\nDen Gläubigern der an der Verschmelzung beteiligten Rechtsträger ist, wenn sie binnen sechs Monaten nach dem Tag, an dem die Eintragung der Verschmelzung in das Register des Sitzes desjenigen Rechtsträgers, dessen Gläubiger sie sind, nach § 19 Abs. 3 UmwG als bekannt gemacht gilt, ihren Anspruch nach Grund und Höhe in Textform anmelden, Sicherheit zu leisten, soweit sie nicht Befriedigung verlangen können. Dieses Recht steht den Gläubigern jedoch nur zu, wenn sie glaubhaft machen, dass durch die Verschmelzung die Erfüllung der Forderung gefährdet wird."
    },
    {
      "date": "2025-04-08",
      "id": "105956",
      "original_text": "Löschungsankündigung\nSachsen Amtsgericht Chemnitz HRB 8639\nICM Unger Beteiligungsgesellschaft mbH – Burgstädt",
      "type": "Löschungsankündigung",
      "state": "Sachsen",
      "amtsgericht": "Amtsgericht Chemnitz",
      "registernummer": "HRB 8639",
      "registerart": "HRB",
      "company_name": "ICM Unger Beteiligungsgesellschaft mbH",
      "company_seat": "Burgstädt",
      "details": "08.04.2025 (Bekanntmachungsdatum)\n\nSachsen Amtsgericht Chemnitz HRB 8639\nLöschungsankündigung\n\nICM Unger Beteiligungsgesellschaft mbH\nGesellschaft mit beschränkter Haftung\nBurgstädt\n\nDas Registergericht beabsichtigt, die im Handelsregister eingetragene Gesellschaft von Amts wegen nach § 394 FamFG zu löschen. Die Frist zu Erhebung eines Widerspruchs gegen die beabsichtigte Löschung wird auf einen Monat festgesetzt."
    },
    {
      "date": "2025-04-08",
      "id": "105957",
      "original_text": "Registerbekanntmachung nach dem Umwandlungsgesetz\nNiedersachsen Amtsgericht Osnabrück HRB 121632 früher Amtsgericht Meppen\nTRADER Schiffahrtsgesellschaft GmbH – Haren",
      "type": "Registerbekanntmachung nach dem Umwandlungsgesetz",
      "state": "Niedersachsen",
      "amtsgericht": "Amtsgericht Osnabrück",
      "registernummer": "HRB 121632",
      "registerart": "HRB",
      "company_name": "TRADER Schiffahrtsgesellschaft GmbH",
      "company_seat": "Haren",
      "former_amtsgericht": "Meppen",
      "details": "08.04.2025 (Bekanntmachungsdatum)\n\nNiedersachsen Amtsgericht Osnabrück HRB 121632 früher Amtsgericht Meppen\nRegisterbekanntmachung nach dem Umwandlungsgesetz 08.04.2025 (Eintragungsdatum)\n\nTRADER Schiffahrtsgesellschaft GmbH\nGesellschaft mit beschränkter Haftung\nHaren\n\nDen Gläubigern der an der Verschmelzung beteiligten Rechtsträger ist, wenn sie binnen sechs Monaten nach dem Tag, an dem die Eintragung der Verschmelzung in das Register des Sitzes desjenigen Rechtsträgers, dessen Gläubiger sie sind, nach § 19  Abs.  3 UmwG als bekannt gemacht gilt, ihren Anspruch nach Grund und Höhe schriftlich anmelden, Sicherheit zu leisten, soweit sie nicht Befriedigung verlangen können. Dieses Recht steht den Gläubigern jedoch nur zu, wenn sie glaubhaft machen, dass durch die Verschmelzung die Erfüllung der Forderung gefährdet wird."
    },
    {
      "date": "2025-04-08",
      "id": "105958",
      "original_text": "Registerbekanntmachung nach dem Umwandlungsgesetz\nNiedersachsen Amtsgericht Hildesheim HRB 110072 früher Amtsgericht Alfeld\n\"Hesse Stanzwerkzeuge GmbH\" – Alfeld (Leine)",
      "type": "Registerbekanntmachung nach dem Umwandlungsgesetz",
      "state": "Niedersachsen",
      "amtsgericht": "Amtsgericht Hildesheim",
      "registernummer": "HRB 110072",
      "registerart": "HRB",
      "company_name": "\"Hesse Stanzwerkzeuge GmbH\"",
      "company_seat": "Alfeld (Leine)",
      "former_amtsgericht": "Alfeld",
      "details": "08.04.2025 (Bekanntmachungsdatum)\n\nNiedersachsen Amtsgericht Hildesheim HRB 110072 früher Amtsgericht Alfeld\nRegisterbekanntmachung nach dem Umwandlungsgesetz 08.04.2025 (Eintragungsdatum)\n\n\"Hesse Stanzwerkzeuge GmbH\"\nGesellschaft mit beschränkter Haftung\nAlfeld (Leine)\n\nDen Gläubigern der an der Verschmelzung beteiligten Rechtsträger ist, wenn sie binnen sechs Monaten nach dem Tag, an dem die Eintragung der Verschmelzung in das Register des Sitzes desjenigen Rechtsträgers, dessen Gläubiger sie sind, nach § 19  Abs.  3 UmwG als bekannt gemacht gilt, ihren Anspruch nach Grund und Höhe schriftlich anmelden, Sicherheit zu leisten, soweit sie nicht Befriedigung verlangen können. Dieses Recht steht den Gläubigern jedoch nur zu, wenn sie glaubhaft machen, dass durch die Verschmelzung die Erfüllung der Forderung gefährdet wird."
    },
    {
      "date": "2025-04-08",
      "id": "105959",
      "original_text": "Registerbekanntmachung nach dem Umwandlungsgesetz\nNiedersachsen Amtsgericht Hildesheim HRB 207559\nDJC Holding GmbH – Alfeld (Leine)",
      "type": "Registerbekanntmachung nach dem Umwandlungsgesetz",
      "state": "Niedersachsen",
      "amtsgericht": "Amtsgericht Hildesheim",
      "registernummer": "HRB 207559",
      "registerart": "HRB",
      "company_name": "DJC Holding GmbH",
      "company_seat": "Alfeld (Leine)",
      "details": "08.04.2025 (Bekanntmachungsdatum)\n\nNiedersachsen Amtsgericht Hildesheim HRB 207559\nRegisterbekanntmachung nach dem Umwandlungsgesetz 08.04.2025 (Eintragungsdatum)\n\nDJC Holding GmbH\nGesellschaft mit beschränkter Haftung\nAlfeld (Leine)\n\nDen Gläubigern der an der Verschmelzung beteiligten Rechtsträger ist, wenn sie binnen sechs Monaten nach dem Tag, an dem die Eintragung der Verschmelzung in das Register des Sitzes desjenigen Rechtsträgers, dessen Gläubiger sie sind, nach § 19  Abs.  3 UmwG als bekannt gemacht gilt, ihren Anspruch nach Grund und Höhe schriftlich anmelden, Sicherheit zu leisten, soweit sie nicht Befriedigung verlangen können. Dieses Recht steht den Gläubigern jedoch nur zu, wenn sie glaubhaft machen, dass durch die Verschmelzung die Erfüllung der Forderung gefährdet wird."
    },
    {
      "date": "2025-04-08",
      "id": "105960",
      "original_text": "Löschungsankündigung\nNiedersachsen Amtsgericht Braunschweig HRA 110708 früher Amtsgericht Goslar\nRolf Bauerochse Hotel-Pension Im Tannengrud – Langelsheim-Wolfshagen",
      "type": "Löschungsankündigung",
      "state": "Niedersachsen",
      "amtsgericht": "Amtsgericht Braunschweig",
      "registernummer": "HRA 110708",
      "registerart": "HRA",
      "company_name": "Rolf Bauerochse Hotel-Pension Im Tannengrud",
      "company_seat": "Langelsheim-Wolfshagen",
      "former_amtsgericht": "Goslar",
      "details": "08.04.2025 (Bekanntmachungsdatum)\n\nNiedersachsen Amtsgericht Braunschweig HRA 110708 früher Amtsgericht Goslar\nLöschungsankündigung\n\nRolf Bauerochse Hotel-Pension Im Tannengrud\nEinzelkaufmann / Einzelkauffrau\nLangelsheim-Wolfshagen\n\nDas Registergericht beabsichtigt, die Firma von Amts wegen nach § 393 FamFG zu löschen. Die Frist zur Erhebung eines Widerspruchs ist auf 1 Monat ab dieser Registerbekanntmachung festgesetzt."
    },
    {
      "date": "2025-04-08",
      "id": "105961",
      "original_text": "Sonstige Registerbekanntmachung\nNiedersachsen Amtsgericht Göttingen HRB 1970\nSartorius Aktiengesellschaft – Göttingen",
      "type": "Sonstige Registerbekanntmachung",
      "state": "Niedersachsen",
      "amtsgericht": "Amtsgericht Göttingen",
      "registernummer": "HRB 1970",
      "registerart": "HRB",
      "company_name": "Sartorius Aktiengesellschaft",
      "company_seat": "Göttingen",
      "details": "08.04.2025 (Bekanntmachungsdatum)\n\nNiedersachsen Amtsgericht Göttingen HRB 1970\nSonstige Registerbekanntmachung\n\nSartorius Aktiengesellschaft\nAktiengesellschaft\nGöttingen\n\nDie Liste der Mitglieder des Aufsichtsrats wurde beim Registergericht eingereicht."
    },
    {
      "date": "2025-04-08",
      "id": "105962",
      "original_text": "Sonstige Registerbekanntmachung\nNiedersachsen Amtsgericht Hannover HRB 3791\nÜSTRA Hannoversche Verkehrsbetriebe Aktiengesellschaft – Hannover",
      "type": "Sonstige Registerbekanntmachung",
      "state": "Niedersachsen",
      "amtsgericht": "Amtsgericht Hannover",
      "registernummer": "HRB 3791",
      "registerart": "HRB",
      "company_name": "ÜSTRA Hannoversche Verkehrsbetriebe Aktiengesellschaft",
      "company_seat": "Hannover",
      "details": "08.04.2025 (Bekanntmachungsdatum)\n\nNiedersachsen Amtsgericht Hannover HRB 3791\nSonstige Registerbekanntmachung\n\nÜSTRA Hannoversche Verkehrsbetriebe Aktiengesellschaft\nAktiengesellschaft\nHannover\n\nDie Liste der Mitglieder des Aufsichtsrats wurde beim Registergericht eingereicht."
    },
    {
      "date": "2025-04-08",
      "id": "105963",
      "original_text": "Registerbekanntmachung nach dem Umwandlungsgesetz\nNiedersachsen Amtsgericht Lüneburg HRB 205826\nBRS Verwaltungs UG (haftungsbeschränkt) – Lüneburg",
      "type": "Registerbekanntmachung nach dem Umwandlungsgesetz",
      "state": "Niedersachsen",
      "amtsgericht": "Amtsgericht Lüneburg",
      "registernummer": "HRB 205826",
      "registerart": "HRB",
      "company_name": "BRS Verwaltungs UG (haftungsbeschränkt)",
      "company_seat": "Lüneburg",
      "details": "08.04.2025 (Bekanntmachungsdatum)\n\nNiedersachsen Amtsgericht Lüneburg HRB 205826\nRegisterbekanntmachung nach dem Umwandlungsgesetz 08.04.2025 (Eintragungsdatum)\n\nBRS Verwaltungs UG (haftungsbeschränkt)\nGesellschaft mit beschränkter Haftung\nLüneburg\n\nDen Gläubigern der an der Verschmelzung beteiligten Rechtsträger ist, wenn sie binnen sechs Monaten nach dem Tag, an dem die Eintragung der Verschmelzung in das Register des Sitzes desjenigen Rechtsträgers, dessen Gläubiger sie sind, nach § 19  Abs.  3 UmwG als bekannt gemacht gilt, ihren Anspruch nach Grund und Höhe schriftlich anmelden, Sicherheit zu leisten, soweit sie nicht Befriedigung verlangen können. Dieses Recht steht den Gläubigern jedoch nur zu, wenn sie glaubhaft machen, dass durch die Verschmelzung die Erfüllung der Forderung gefährdet wird."
    },
    {
      "date": "2025-04-08",
      "id": "105964",
      "original_text": "Registerbekanntmachung nach dem Umwandlungsgesetz\nRheinland-Pfalz Amtsgericht Koblenz PR 20290\nFaßbender Weber Ingenieure PartGmbB Dipl.-Ing. (FH) M. Faßbender, Beratender Ingenieur Dipl.-Ing A. Weber, Freie Stadtplanerin – Brohl-Lützing",
      "type": "Registerbekanntmachung nach dem Umwandlungsgesetz",
      "state": "Rheinland-Pfalz",
      "amtsgericht": "Amtsgericht Koblenz",
      "registernummer": "PR 20290",
      "registerart": "PR",
      "company_name": "Faßbender Weber Ingenieure PartGmbB Dipl.-Ing. (FH) M. Faßbender, Beratender Ingenieur Dipl.-Ing A. Weber, Freie Stadtplanerin",
      "company_seat": "Brohl-Lützing",
      "details": "08.04.2025 (Bekanntmachungsdatum)\n\nRheinland-Pfalz Amtsgericht Koblenz PR 20290\nRegisterbekanntmachung nach dem Umwandlungsgesetz 08.04.2025 (Eintragungsdatum)\n\nFaßbender Weber Ingenieure PartGmbB Dipl.-Ing. (FH) M. Faßbender, Beratender Ingenieur Dipl.-Ing A. Weber, Freie Stadtplanerin\nPartnerschaftsgesellschaft\nBrohl-Lützing\n\nAls nicht eingetragen wird veröffentlicht: Den Gläubigern der an der Umwandlung beteiligten Rechtsträger ist, wenn sie binnen sechs Monaten nach dem Tag, an dem die Eintragung der Umwandlung in das Register des Sitzes desjenigen Rechtsträgers, dessen Gläubiger sie sind, nach § 19 Abs. 3 UmwG als bekannt gemacht gilt, ihren Anspruch nach Grund und Höhe schriftlich anmelden, Sicherheit zu leisten, soweit sie nicht Befriedigung verlangen können. Dieses Recht steht den Gläubigern jedoch nur zu, wenn sie glaubhaft machen, dass durch die Umwandlung die Erfüllung der Forderung gefährdet wird."
    },
    {
      "date": "2025-04-08",
      "id": "105965",
      "original_text": "Registerbekanntmachung nach dem Umwandlungsgesetz\nRheinland-Pfalz Amtsgericht Mainz HRA 40687\nLandesbank Baden-Württemberg – Mainz",
      "type": "Registerbekanntmachung nach dem Umwandlungsgesetz",
      "state": "Rheinland-Pfalz",
      "amtsgericht": "Amtsgericht Mainz",
      "registernummer": "HRA 40687",
      "registerart": "HRA",
      "company_name": "Landesbank Baden-Württemberg",
      "company_seat": "Mainz",
      "details": "08.04.2025 (Bekanntmachungsdatum)\n\nRheinland-Pfalz Amtsgericht Mainz HRA 40687\nRegisterbekanntmachung nach dem Umwandlungsgesetz\n\nLandesbank Baden-Württemberg\nSonstige juristische Person\nMainz\n\nDem Registergericht ist ein Entwurf eines Abspaltungs- und Übernahmevertrages über die geplante Abspaltung der Berlin Hyp AG mit Sitz in Berlin (Amtsgericht Chralottenburg, HRB 56530 B) auf die Landesbank Baden-Württemberg eingereicht worden."
    },
    {
      "date": "2025-04-08",
      "id": "105966",
      "original_text": "Registerbekanntmachung nach dem Umwandlungsgesetz\nRheinland-Pfalz Amtsgericht Wittlich HRA 42168\nclean rex Hundehygiene e.K. – Kenn",
      "type": "Registerbekanntmachung nach dem Umwandlungsgesetz",
      "state": "Rheinland-Pfalz",
      "amtsgericht": "Amtsgericht Wittlich",
      "registernummer": "HRA 42168",
      "registerart": "HRA",
      "company_name": "clean rex Hundehygiene e.K.",
      "company_seat": "Kenn",
      "details": "08.04.2025 (Bekanntmachungsdatum)\n\nRheinland-Pfalz Amtsgericht Wittlich HRA 42168\nRegisterbekanntmachung nach dem Umwandlungsgesetz 08.04.2025 (Eintragungsdatum)\n\nclean rex Hundehygiene e.K.\nEinzelkaufmann / Einzelkauffrau\nKenn\n\nAls nicht eingetragen wird veröffentlicht: Den Gläubigern der an der Verschmelzung beteiligten Rechtsträger ist, wenn sie binnen sechs Monaten nach dem Tag, an dem die Eintragung der Verschmelzung in das Register des Sitzes desjenigen Rechtsträgers,dessen Gläubiger sie sind, nach § 19 Abs. 3 UmwG als bekannt gemacht gilt, ihren Anspruch nach Grund und Höhe schriftlich anmelden, Sicherheit zu leisten, soweit sie nicht Befriedigung verlangen können. Dieses Recht steht den Gläubigern jedoch nur zu, wenn sie glaubhaft machen, dass durch die Verschmelzung die Erfüllung der Forderung gefährdet wird."
    },
    {
      "date": "2025-04-08",
      "id": "105967",
      "original_text": "Löschungsankündigung\nRheinland-Pfalz Amtsgericht Ludwigshafen a.Rhein (Ludwigshafen) HRA 61223\nRE Akustik- und Trockenbau Ltd & Co. KG – Böhl-Iggelheim",
      "type": "Löschungsankündigung",
      "state": "Rheinland-Pfalz",
      "amtsgericht": "Amtsgericht Ludwigshafen a.Rhein (Ludwigshafen)",
      "registernummer": "HRA 61223",
      "registerart": "HRA",
      "company_name": "RE Akustik- und Trockenbau Ltd & Co. KG",
      "company_seat": "Böhl-Iggelheim",
      "details": "08.04.2025 (Bekanntmachungsdatum)\n\nRheinland-Pfalz Amtsgericht Ludwigshafen a.Rhein (Ludwigshafen) HRA 61223\nLöschungsankündigung\n\nRE Akustik- und Trockenbau Ltd & Co. KG\nKommanditgesellschaft\nBöhl-Iggelheim\n\nDas Registergericht beabsichtigt die Firma von Amts wegen nach § 31 Abs. 2 HGB, § 393 FamFG zu löschen. Die Frist zur Erhebung eines Widerspruchs ist auf  einen Monat festgesetzt."
    },
    {
      "date": "2025-04-08",
      "id": "105968",
      "original_text": "Registerbekanntmachung nach dem Umwandlungsgesetz\nRheinland-Pfalz Amtsgericht Ludwigshafen a.Rhein (Ludwigshafen) HRB 70124\nBrotzeit TopCo GmbH – Ludwigshafen am Rhein",
      "type": "Registerbekanntmachung nach dem Umwandlungsgesetz",
      "state": "Rheinland-Pfalz",
      "amtsgericht": "Amtsgericht Ludwigshafen a.Rhein (Ludwigshafen)",
      "registernummer": "HRB 70124",
      "registerart": "HRB",
      "company_name": "Brotzeit TopCo GmbH",
      "company_seat": "Ludwigshafen am Rhein",
      "details": "08.04.2025 (Bekanntmachungsdatum)\n\nRheinland-Pfalz Amtsgericht Ludwigshafen a.Rhein (Ludwigshafen) HRB 70124\nRegisterbekanntmachung nach dem Umwandlungsgesetz 04.04.2025 (Eintragungsdatum)\n\nBrotzeit TopCo GmbH\nGesellschaft mit beschränkter Haftung\nLudwigshafen am Rhein\n\nDen Gläubigern der an dem grenzüberschreitenden Formwechsel beteiligten übernehmenden Rechtsträger ist, wenn sie binnen sechs Monaten nach dem Tag, an dem die Eintragung der Spaltung in das Register des Sitzes desjenigen Rechtsträgers, dessen Gläubiger sie sind, nach § 19 Absatz 3 UmwG als bekanntgemacht gilt, ihren Anspruch nach Grund und Höhe schriftlich anmelden, Sicherheit zu leisten, soweit sie nicht Befriedigung verlangen können.\n\nDieses Recht steht den Gläubigern jedoch nur zu, wenn sie glaubhaft machen, dass durch den Formwechsel die Erfüllung ihrer Forderung gefährdet wird."
    },
    {
      "date": "2025-04-08",
      "id": "105969",
      "original_text": "Registerbekanntmachung nach dem Umwandlungsgesetz\nRheinland-Pfalz Amtsgericht Ludwigshafen a.Rhein (Ludwigshafen) VR 10615\nEvangelischer Krankenpflegeverein Bad Dürkheim e.V. (Förderverein der Christlichen Sozialstation Bad Dürkheim - VG Freinsheim e.V.) – Bad Dürkheim",
      "type": "Registerbekanntmachung nach dem Umwandlungsgesetz",
      "state": "Rheinland-Pfalz",
      "amtsgericht": "Amtsgericht Ludwigshafen a.Rhein (Ludwigshafen)",
      "registernummer": "VR 10615",
      "registerart": "VR",
      "company_name": "Evangelischer Krankenpflegeverein Bad Dürkheim e.V. (Förderverein der Christlichen Sozialstation Bad Dürkheim - VG Freinsheim e.V.)",
      "company_seat": "Bad Dürkheim",
      "details": "08.04.2025 (Bekanntmachungsdatum)\n\nRheinland-Pfalz Amtsgericht Ludwigshafen a.Rhein (Ludwigshafen) VR 10615\nRegisterbekanntmachung nach dem Umwandlungsgesetz 07.04.2025 (Eintragungsdatum)\n\nEvangelischer Krankenpflegeverein Bad Dürkheim e.V. (Förderverein der Christlichen Sozialstation Bad Dürkheim - VG Freinsheim e.V.)\neingetragener Verein\nBad Dürkheim\n\nAls nicht eingetragen wird veröffentlicht: Den Gläubigern der an der Verschmelzung beteiligten Rechtsträger ist, wenn sie binnen sechs Monaten nach dem Tag, an dem die Eintragung der Verschmelzung in das Register des Sitzes desjenigen Rechtsträgers,dessen Gläubiger sie sind, nach § 19 Abs. 3 UmwG als bekannt gemacht gilt, ihren Anspruch nach Grund und Höhe schriftlich anmelden, Sicherheit zu leisten, soweit sie nicht Befriedigung verlangen können. Dieses Recht steht den Gläubigern jedoch nur zu, wenn sie glaubhaft machen, dass durch die Verschmelzung die Erfüllungd er Forderung gefährdet wird."
    },
    {
      "date": "2025-04-08",
      "id": "105970",
      "original_text": "Registerbekanntmachung nach dem Umwandlungsgesetz\nRheinland-Pfalz Amtsgericht Ludwigshafen a.Rhein (Ludwigshafen) VR 10259\nElisabethenverein Grethen-Hardenburg, Christlicher Verein für ambulante Krankenpflege – Bad Dürkheim-Hardenburg",
      "type": "Registerbekanntmachung nach dem Umwandlungsgesetz",
      "state": "Rheinland-Pfalz",
      "amtsgericht": "Amtsgericht Ludwigshafen a.Rhein (Ludwigshafen)",
      "registernummer": "VR 10259",
      "registerart": "VR",
      "company_name": "Elisabethenverein Grethen-Hardenburg, Christlicher Verein für ambulante Krankenpflege",
      "company_seat": "Bad Dürkheim-Hardenburg",
      "details": "08.04.2025 (Bekanntmachungsdatum)\n\nRheinland-Pfalz Amtsgericht Ludwigshafen a.Rhein (Ludwigshafen) VR 10259\nRegisterbekanntmachung nach dem Umwandlungsgesetz 07.04.2025 (Eintragungsdatum)\n\nElisabethenverein Grethen-Hardenburg, Christlicher Verein für ambulante Krankenpflege\neingetragener Verein\nBad Dürkheim-Hardenburg\n\nAls nicht eingetragen wird veröffentlicht: Den Gläubigern der an der Verschmelzung beteiligten Rechtsträger ist, wenn sie binnen sechs Monaten nach dem Tag, an dem die Eintragung der Verschmelzung in das Register des Sitzes desjenigen Rechtsträgers,dessen Gläubiger sie sind, nach § 19 Abs. 3 UmwG als bekannt gemacht gilt, ihren Anspruch nach Grund und Höhe schriftlich anmelden, Sicherheit zu leisten, soweit sie nicht Befriedigung verlangen können. Dieses Recht steht den Gläubigern jedoch nur zu, wenn sie glaubhaft machen, dass durch die Verschmelzung die Erfüllungd er Forderung gefährdet wird."
    },
    {
      "date": "2025-04-08",
      "id": "105971",
      "original_text": "Löschungsankündigung\nNordrhein-Westfalen Amtsgericht Siegburg HRB 14942\nEbbert GmbH – Königswinter",
      "type": "Löschungsankündigung",
      "state": "Nordrhein-Westfalen",
      "amtsgericht": "Amtsgericht Siegburg",
      "registernummer": "HRB 14942",
      "registerart": "HRB",
      "company_name": "Ebbert GmbH",
      "company_seat": "Königswinter",
      "details": "08.04.2025 (Bekanntmachungsdatum)\n\nNordrhein-Westfalen Amtsgericht Siegburg HRB 14942\nLöschungsankündigung\n\nEbbert GmbH\nGesellschaft mit beschränkter Haftung\nKönigswinter\n\nDas Registergericht hat glaubhafte Kenntnis erlangt, dass die Gesellschaft vermögenslos geworden ist, da ein Insolvenzeröffnungsantrag mangels Masse nach § 26 InsO zurückgewiesen wurde.\n\nEs ist daher beabsichtigt, die Gesellschaft nach § 394 FamFG im Handelsregister wegen Vermögenslosigkeit zu löschen.\nEinwände gegen die Löschung sind durch Widerspruch binnen einer Frist von 3 Monaten geltend zu machen, andernfalls die Löschung erfolgen wird.\n\nEinzulegen ist der Widerspruch bei dem Amtsgericht Siegburg, Neue Poststraße 16, 53721 Siegburg, und zwar entweder schriftlich in deutscher Sprache oder mündlich zur Niederschrift der Geschäftsstelle. Der Widerspruch kann auch zur Niederschrift der Geschäftsstelle eines jeden Amtsgerichts abgegeben werden. Der Widerspruch ist binnen der in der Verfügung bestimmten Frist einzulegen. Die Frist ist nur gewahrt, wenn der Widerspruch rechtzeitig bei dem Amtsgericht Siegburg eingeht, auch wenn der Widerspruch zur Niederschrift der Geschäftsstelle eines anderen Amtsgerichts abgegeben wurde. Die Frist beginnt jeweils mit der schriftlichen Bekanntgabe der Verfügung an die Beteiligten. Kann die schriftliche Bekanntgabe an einen Beteiligten nicht bewirkt werden, beginnt die Frist spätestens mit Ablauf von fünf Monaten nach Erlass der Verfügung. Die Bekanntgabe ist entweder durch Zustellung oder am dritten Tage nach Aufgabe zur Post bewirkt. Sofern die Löschung noch nicht erfolgt ist, kann der Widerspruch auch noch nach Ablauf der Frist eingelegt werden. Fällt das Ende der Frist auf einen Sonnabend, einen Sonntag oder einen allgemeinen Feiertag, endet die Frist mit Ablauf des nächsten Werktages. Der Widerspruch ist zu unterzeichnen. Eine Begründung des Widerspruchs ist nicht vorgeschrieben."
    },
    {
      "date": "2025-04-08",
      "id": "105972",
      "original_text": "Registerbekanntmachung nach dem Umwandlungsgesetz\nNordrhein-Westfalen Amtsgericht Aachen HRB 19428\nUEP Hallenfußball GmbH – Übach-Palenberg",
      "type": "Registerbekanntmachung nach dem Umwandlungsgesetz",
      "state": "Nordrhein-Westfalen",
      "amtsgericht": "Amtsgericht Aachen",
      "registernummer": "HRB 19428",
      "registerart": "HRB",
      "company_name": "UEP Hallenfußball GmbH",
      "company_seat": "Übach-Palenberg",
      "details": "08.04.2025 (Bekanntmachungsdatum)\n\nNordrhein-Westfalen Amtsgericht Aachen HRB 19428\nRegisterbekanntmachung nach dem Umwandlungsgesetz 08.04.2025 (Eintragungsdatum)\n\nUEP Hallenfußball GmbH\nGesellschaft mit beschränkter Haftung\nÜbach-Palenberg\n\nDen Gläubigern der an der formwechselnden Umwandlung beteiligten Rechtsträger ist, wenn sie binnen sechs Monaten nach dem Tag, an dem die Eintragung der formwechselnden Umwandlung in das Register des Sitzes desjenigen Rechtsträgers, dessen Gläubiger sie sind, nach § 19 Absatz 3 UmwG als bekanntgemacht gilt, ihren Anspruch nach Grund und Höhe schriftlich anmelden, Sicherheit zu leisten, soweit sie nicht Befriedigung verlangen können. Dieses Recht steht den Gläubigern jedoch nur zu, wenn sie glaubhaft machen, dass durch die formwechselnden Umwandlung die Erfüllung ihrer Forderung gefährdet wird."
    },
    {
      "date": "2025-04-08",
      "id": "105973",
      "original_text": "Löschungsankündigung\nBremen Amtsgericht Bremen HRB 31910\nGFs Verwaltungs GmbH – Bremen",
      "type": "Löschungsankündigung",
      "state": "Bremen",
      "amtsgericht": "Amtsgericht Bremen",
      "registernummer": "HRB 31910",
      "registerart": "HRB",
      "company_name": "GFs Verwaltungs GmbH",
      "company_seat": "Bremen",
      "details": "08.04.2025 (Bekanntmachungsdatum)\n\nBremen Amtsgericht Bremen HRB 31910\nLöschungsankündigung\n\nGFs Verwaltungs GmbH\nGesellschaft mit beschränkter Haftung\nBremen\n\nEs ist beabsichtigt die im Handelsregister eingetragene Gesellschaft von Amts wegen gemäß § 394 FamFG zu löschen. Gegen die Löschung kann beim AG Bremen schriftlich oder zu Protokoll der Geschäftsstelle Widerspruch eingelegt werden. Widerspruchsfrist 4 Wochen."
    },
    {
      "date": "2025-04-08",
      "id": "105974",
      "original_text": "Löschungsankündigung\nBremen Amtsgericht Bremen HRA 28437\nSM Santorini Molbergen GmbH & Co. KG – Bremen",
      "type": "Löschungsankündigung",
      "state": "Bremen",
      "amtsgericht": "Amtsgericht Bremen",
      "registernummer": "HRA 28437",
      "registerart": "HRA",
      "company_name": "SM Santorini Molbergen GmbH & Co. KG",
      "company_seat": "Bremen",
      "details": "08.04.2025 (Bekanntmachungsdatum)\n\nBremen Amtsgericht Bremen HRA 28437\nLöschungsankündigung\n\nSM Santorini Molbergen GmbH & Co. KG\nKommanditgesellschaft\nBremen\n\nEs ist beabsichtigt die im Handelsregister eingetragene Gesellschaft von Amts wegen gemäß § 394 FamFG zu löschen. Gegen die Löschung kann beim AG Bremen schriftlich oder zu Protokoll der Geschäftsstelle Widerspruch eingelegt werden. Widerspruchsfrist 4 Wochen."
    },
    {
      "date": "2025-04-08",
      "id": "105975",
      "original_text": "Löschungsankündigung\nBremen Amtsgericht Bremen HRB 36769\nSARES GmbH – Bremen",
      "type": "Löschungsankündigung",
      "state": "Bremen",
      "amtsgericht": "Amtsgericht Bremen",
      "registernummer": "HRB 36769",
      "registerart": "HRB",
      "company_name": "SARES GmbH",
      "company_seat": "Bremen",
      "details": "08.04.2025 (Bekanntmachungsdatum)\n\nBremen Amtsgericht Bremen HRB 36769\nLöschungsankündigung\n\nSARES GmbH\nGesellschaft mit beschränkter Haftung\nBremen\n\nEs ist beabsichtigt die im Handelsregister eingetragene Gesellschaft von Amts wegen gemäß § 394 FamFG zu löschen. Gegen die Löschung kann beim AG Bremen schriftlich oder zu Protokoll der Geschäftsstelle Widerspruch eingelegt werden. Widerspruchsfrist 4 Wochen."
    },
    {
      "date": "2025-04-08",
      "id": "105976",
      "original_text": "Registerbekanntmachung nach dem Umwandlungsgesetz\nNordrhein-Westfalen Amtsgericht Lemgo HRB 8205\nDie Flohmarkt - Lippe GmbH – Barntrup",
      "type": "Registerbekanntmachung nach dem Umwandlungsgesetz",
      "state": "Nordrhein-Westfalen",
      "amtsgericht": "Amtsgericht Lemgo",
      "registernummer": "HRB 8205",
      "registerart": "HRB",
      "company_name": "Die Flohmarkt - Lippe GmbH",
      "company_seat": "Barntrup",
      "details": "08.04.2025 (Bekanntmachungsdatum)\n\nNordrhein-Westfalen Amtsgericht Lemgo HRB 8205\nRegisterbekanntmachung nach dem Umwandlungsgesetz 08.04.2025 (Eintragungsdatum)\n\nDie Flohmarkt - Lippe GmbH\nGesellschaft mit beschränkter Haftung\nBarntrup\n\nDen Gläubigern der an der Verschmelzung beteiligten Rechtsträger ist, wenn sie binnen sechs Monaten nach dem Tag, an dem die Eintragung der Verschmelzung in das Register des Sitzes desjenigen Rechtsträgers, dessen Gläubiger sie sind, nach § 19 Absatz 3 UmwG als bekanntgemacht gilt, ihren Anspruch nach Grund und Höhe schriftlich anmelden, Sicherheit zu leisten, soweit sie nicht Befriedigung verlangen können. Dieses Recht steht den Gläubigern jedoch nur zu, wenn sie glaubhaft machen, dass durch die Verschmelzung die Erfüllung ihrer Forderung gefährdet wird."
    },
    {
      "date": "2025-04-08",
      "id": "105977",
      "original_text": "Einreichung neuer Dokumente\nNordrhein-Westfalen Amtsgericht Iserlohn HRB 1622\nAMK - Abfallentsorgungsgesellschaft des Märkischen Kreises mbH – Iserlohn",
      "type": "Einreichung neuer Dokumente",
      "state": "Nordrhein-Westfalen",
      "amtsgericht": "Amtsgericht Iserlohn",
      "registernummer": "HRB 1622",
      "registerart": "HRB",
      "company_name": "AMK - Abfallentsorgungsgesellschaft des Märkischen Kreises mbH",
      "company_seat": "Iserlohn",
      "details": "08.04.2025 (Bekanntmachungsdatum)\n\nNordrhein-Westfalen Amtsgericht Iserlohn HRB 1622\nEinreichung neuer Dokumente 08.04.2025 (Eintragungsdatum)\n\nAMK - Abfallentsorgungsgesellschaft des Märkischen Kreises mbH\nGesellschaft mit beschränkter Haftung\nIserlohn\n\nDem Registergericht ist eine neue Liste der Mitglieder des Aufsichtsrates eingereicht worden."
    },
    {
      "date": "2025-04-08",
      "id": "105978",
      "original_text": "Registerbekanntmachung nach dem Umwandlungsgesetz\nNordrhein-Westfalen Amtsgericht Bad Oeynhausen HRB 19570\nSchäffer Präzisionswerkzeuge GmbH – Herford",
      "type": "Registerbekanntmachung nach dem Umwandlungsgesetz",
      "state": "Nordrhein-Westfalen",
      "amtsgericht": "Amtsgericht Bad Oeynhausen",
      "registernummer": "HRB 19570",
      "registerart": "HRB",
      "company_name": "Schäffer Präzisionswerkzeuge GmbH",
      "company_seat": "Herford",
      "details": "08.04.2025 (Bekanntmachungsdatum)\n\nNordrhein-Westfalen Amtsgericht Bad Oeynhausen HRB 19570\nRegisterbekanntmachung nach dem Umwandlungsgesetz 08.04.2025 (Eintragungsdatum)\n\nSchäffer Präzisionswerkzeuge GmbH\nGesellschaft mit beschränkter Haftung\nHerford\n\nDen Gläubigern der an der Verschmelzung beteiligten Rechtsträger ist, wenn sie binnen sechs Monaten nach dem Tag, an dem die Eintragung der Verschmelzung in das Register des Sitzes derjenigen Rechtsträger deren Gläubiger sie sind, nach § 19 Absatz 3 UmwG als bekanntgemacht gilt, ihren Anspruch nach Grund und Höhe schriftlich anmelden, Sicherheit zu leisten, soweit sie nicht Befriedigung verlangen können. Dieses Recht steht den Gläubigern jedoch nur zu, wenn sie glaubhaft machen, dass durch die Verschmelzung die Erfüllung ihrer Forderung gefährdet wird."
    },
    {
      "date": "2025-04-08",
      "id": "105979",
      "original_text": "Löschungsankündigung\nNordrhein-Westfalen Amtsgericht Gütersloh HRB 4925\nManca-Metallverarbeitung-GmbH – Steinhagen",
      "type": "Löschungsankündigung",
      "state": "Nordrhein-Westfalen",
      "amtsgericht": "Amtsgericht Gütersloh",
      "registernummer": "HRB 4925",
      "registerart": "HRB",
      "company_name": "Manca-Metallverarbeitung-GmbH",
      "company_seat": "Steinhagen",
      "details": "08.04.2025 (Bekanntmachungsdatum)\n\nNordrhein-Westfalen Amtsgericht Gütersloh HRB 4925\nLöschungsankündigung 08.04.2025 (Eintragungsdatum)\n\nManca-Metallverarbeitung-GmbH\nGesellschaft mit beschränkter Haftung\nSteinhagen\n\nDas Registergericht beabsichtigt die Gesellschaft von Amts wegen nach § 394 FamFG zu löschen. Die Frist zur Erhebung eines Widerspruchs ist auf einen Monat festgesetzt."
    },
    {
      "date": "2025-04-08",
      "id": "105980",
      "original_text": "Löschungsankündigung\nNordrhein-Westfalen Amtsgericht Düsseldorf HRB 31530\nI H B Immobilien, Handels & Besitz Gesellschaft mbH – Düsseldorf",
      "type": "Löschungsankündigung",
      "state": "Nordrhein-Westfalen",
      "amtsgericht": "Amtsgericht Düsseldorf",
      "registernummer": "HRB 31530",
      "registerart": "HRB",
      "company_name": "I H B Immobilien, Handels & Besitz Gesellschaft mbH",
      "company_seat": "Düsseldorf",
      "details": "08.04.2025 (Bekanntmachungsdatum)\n\nNordrhein-Westfalen Amtsgericht Düsseldorf HRB 31530\nLöschungsankündigung\n\nI H B Immobilien, Handels & Besitz Gesellschaft mbH\nGesellschaft mit beschränkter Haftung\nDüsseldorf\n\nDas Registergericht beabsichtigt die Gesellschaft von Amts wegen nach § 394 Abs. 1 FamFG zu löschen. Die Frist zur Erhebung eines Widerspruchs ist auf 3 Wochen festgesetzt.\n\nRechtsbehelfsbelehrung:\nDas Widerspruchsrecht steht jedem zu, der an der Unterlassung der Löschung ein berechtigtes Interesse hat. Der Widerspruch ist bei dem Amtsgericht Düsseldorf -Registergericht-, Werdener Straße 1, 40227 Düsseldorf schriftlich in deutscher Sprache oder zur Niederschrift der Geschäftsstelle einzulegen. Der Widerspruch kann auch zur Niederschrift der Geschäftsstelle eines jeden Amtsgerichtes abgegeben werden. Die Einlegung ist auch durch Übertragung eines elektronischen Dokuments an die elektronische Poststelle des Gerichts möglich. Das elektronische Dokument muss für die Bearbeitung durch das Gericht geeignet und mit einer qualifizierten elektronischen Signatur der verantwortenden Person versehen sein oder von der verantwortenden Person signiert und auf einem sicheren Übermittlungsweg gemäß § 130a ZPO nach näherer Maßgabe der Verordnung über die technischen Rahmenbedingungen des elektronischen Rechtsverkehrs und über das besondere elektronische Behördenpostfach (BGBl. I, S.3803) eingereicht werden. Weitere Informationen erhalten Sie auf der Internetseite www.justiz.de.\nDer Widerspruch muss spätestens innerhalb der gesetzten Frist nach dem Datum der Bekanntmachung der Löschungsankündigung bei dem Amtsgericht - Registergericht - Düsseldorf eingegangen sein.  Dies gilt auch dann, wenn der Widerspruch zur Niederschrift der Geschäftsstelle eines anderen Amtsgerichtes abgegeben wurde. Die Frist beginnt mit dem Tage der Bekanntmachung der Löschungsankündigung in dem für die Bekanntmachung der Eintragungen in das Handelsregister bestimmten elektronischen Informations- und Kommunikationssystem nach § 10 des Handelsgesetzbuches. Fällt das Ende der Frist auf einen Sonntag, einen allgemeinen Feiertag oder Sonnabend, so endet die Frist mit Ablauf des nächsten Werktages.\nDer Widerspruch muss die Bezeichnung der angefochtenen Löschungsankündigung sowie die Erklärung enthalten, dass Widerspruch gegen diese Löschungsankündigung eingelegt wird. Er ist zu unterzeichnen und soll begründet werden."
    },
    {
      "date": "2025-04-08",
      "id": "105981",
      "original_text": "Registerbekanntmachung nach dem Umwandlungsgesetz\nNordrhein-Westfalen Amtsgericht Lemgo HRA 4824\nDie Flohmarkt OHG – Dörentrup",
      "type": "Registerbekanntmachung nach dem Umwandlungsgesetz",
      "state": "Nordrhein-Westfalen",
      "amtsgericht": "Amtsgericht Lemgo",
      "registernummer": "HRA 4824",
      "registerart": "HRA",
      "company_name": "Die Flohmarkt OHG",
      "company_seat": "Dörentrup",
      "details": "08.04.2025 (Bekanntmachungsdatum)\n\nNordrhein-Westfalen Amtsgericht Lemgo HRA 4824\nRegisterbekanntmachung nach dem Umwandlungsgesetz 08.04.2025 (Eintragungsdatum)\n\nDie Flohmarkt OHG\nOffene Handelsgesellschaft\nDörentrup\n\nDen Gläubigern der an der Verschmelzung beteiligten Rechtsträger ist, wenn sie binnen sechs Monaten nach dem Tag, an dem die Eintragung der Verschmelzung in das Register des Sitzes desjenigen Rechtsträgers, dessen Gläubiger sie sind, nach § 19 Absatz 3 UmwG als bekanntgemacht gilt, ihren Anspruch nach Grund und Höhe schriftlich anmelden, Sicherheit zu leisten, soweit sie nicht Befriedigung verlangen können. Dieses Recht steht den Gläubigern jedoch nur zu, wenn sie glaubhaft machen, dass durch die Verschmelzung die Erfüllung ihrer Forderung gefährdet wird."
    },
    {
      "date": "2025-04-08",
      "id": "105982",
      "original_text": "Registerbekanntmachung nach dem Umwandlungsgesetz\nNordrhein-Westfalen Amtsgericht Mönchengladbach HRB 873\nGladbacher Spinnstoffindustrie Mühlen GmbH – Mönchengladbach",
      "type": "Registerbekanntmachung nach dem Umwandlungsgesetz",
      "state": "Nordrhein-Westfalen",
      "amtsgericht": "Amtsgericht Mönchengladbach",
      "registernummer": "HRB 873",
      "registerart": "HRB",
      "company_name": "Gladbacher Spinnstoffindustrie Mühlen GmbH",
      "company_seat": "Mönchengladbach",
      "details": "08.04.2025 (Bekanntmachungsdatum)\n\nNordrhein-Westfalen Amtsgericht Mönchengladbach HRB 873\nRegisterbekanntmachung nach dem Umwandlungsgesetz 08.04.2025 (Eintragungsdatum)\n\nGladbacher Spinnstoffindustrie Mühlen GmbH\nGesellschaft mit beschränkter Haftung\nMönchengladbach\n\nDen Gläubigern der an der Verschmelzung beteiligten Rechtsträger ist, wenn sie binnen sechs Monaten nach dem Tag, an dem die Eintragung der Verschmelzung in das Register des Sitzes desjenigen Rechtsträgers, dessen Gläubiger sie sind, nach § 19 Absatz 3 UmwG als bekanntgemacht gilt, ihren Anspruch nach Grund und Höhe schriftlich anmelden, Sicherheit zu leisten, soweit sie nicht Befriedigung verlangen können. Dieses Recht steht den Gläubigern jedoch nur zu, wenn sie glaubhaft machen, dass durch die Verschmelzung die Erfüllung ihrer Forderung gefährdet wird."
    },
    {
      "date": "2025-04-08",
      "id": "105983",
      "original_text": "Löschungsankündigung\nNordrhein-Westfalen Amtsgericht Duisburg HRB 31709\nElegancehome GmbH – Duisburg",
      "type": "Löschungsankündigung",
      "state": "Nordrhein-Westfalen",
      "amtsgericht": "Amtsgericht Duisburg",
      "registernummer": "HRB 31709",
      "registerart": "HRB",
      "company_name": "Elegancehome GmbH",
      "company_seat": "Duisburg",
      "details": "08.04.2025 (Bekanntmachungsdatum)\n\nNordrhein-Westfalen Amtsgericht Duisburg HRB 31709\nLöschungsankündigung 08.04.2025 (Eintragungsdatum)\n\nElegancehome GmbH\nGesellschaft mit beschränkter Haftung\nDuisburg\n\nHRB 31709:\nElegancehome GmbH, Duisburg\nKaiser-Friedrich-Str. 3, 47169 Duisburg.\nDas Registergericht beabsichtigt, die im Handelsregister eingetragene Gesellschaft gemäß § 394 FamFG wegen Vermögenslosigkeit von Amts wegen zu löschen. Gegen diese Verfügung kann Widerspruch eingelegt werden. Die Frist zur Erhebung eines Widerspruchs gegen die beabsichtigte Löschung von Amts wegen ist auf drei Monate festgesetzt. Rechtsbehelfsbelehrung Der Widerspruch ist bei dem Amtsgericht Duisburg, Kardinal-Galen-Str. 124-132, 47058 Duisburg schriftlich in deutscher Sprache oder zur Niederschrift der Geschäftsstelle einzulegen. Der Widerspruch kann auch zur Niederschrift der Geschäftsstelle eines jeden Amtsgerichtes abgegeben werden. Die Einlegung ist auch durch Übertragung eines elektronischen Dokuments an die elektronische Poststelle des Gerichts möglich. Das elektronische Dokument muss für die Bearbeitung durch das Gericht geeignet und mit einer qualifizierten elektronischen Signatur der verantwortenden Person versehen sein oder von der verantwortenden Person signiert und auf einem sicheren Übermittlungsweg gemäß § 130 a ZPO nach näherer Maßgabe der Verordnung über die technischen Rahmenbedingungen des elektronischen Rechtsverkehrs und über das besondere elektronische Behördenpostfach (BGBl. I, S. 3803) eingereicht werden. Weitere Informationen erhalten Sie auf der Internetseite www.justiz.de <http://www.justiz.de>. Der Widerspruch muss spätestens innerhalb der gesetzten Frist bei dem Amtsgericht Duisburg eingegangen sein. Dies gilt auch dann, wenn der Widerspruch zur Niederschrift der Geschäftsstelle eines anderen Amtsgerichtes abgegeben wurde. Die Frist beginnt mit der Veröffentlichung. Fällt das Ende der Frist auf einen Sonntag, einen allgemeinen Feiertag oder Sonnabend, so endet die Frist mit Ablauf des nächsten Werktages. Der Widerspruch muss die Bezeichnung der angefochtenen Verfügung sowie die Erklärung enthalten, dass Widerspruch gegen diese Verfügung eingelegt wird. Er ist zu unterzeichnen und soll begründet werden."
    },
    {
      "date": "2025-04-08",
      "id": "105984",
      "original_text": "Löschungsankündigung\nNordrhein-Westfalen Amtsgericht Düsseldorf HRB 98033\nINC Specialty Coffee GmbH – Düsseldorf",
      "type": "Löschungsankündigung",
      "state": "Nordrhein-Westfalen",
      "amtsgericht": "Amtsgericht Düsseldorf",
      "registernummer": "HRB 98033",
      "registerart": "HRB",
      "company_name": "INC Specialty Coffee GmbH",
      "company_seat": "Düsseldorf",
      "details": "08.04.2025 (Bekanntmachungsdatum)\n\nNordrhein-Westfalen Amtsgericht Düsseldorf HRB 98033\nLöschungsankündigung\n\nINC Specialty Coffee GmbH\nGesellschaft mit beschränkter Haftung\nDüsseldorf\n\nDas Registergericht beabsichtigt die Gesellschaft von Amts wegen nach § 394 FamFG zu löschen. Die Frist zur Erhebung eines Widerspruchs ist auf 3 Wochen festgesetzt.\n\nRechtsbehelfsbelehrung:\nDas Widerspruchsrecht steht jedem zu, der an der Unterlassung der Löschung ein berechtigtes Interesse hat. Der Widerspruch ist bei dem Amtsgericht Düsseldorf -Registergericht-, Werdener Straße 1, 40227 Düsseldorf schriftlich in deutscher Sprache oder zur Niederschrift der Geschäftsstelle einzulegen. Der Widerspruch kann auch zur Niederschrift der Geschäftsstelle eines jeden Amtsgerichtes abgegeben werden. Die Einlegung ist auch durch Übertragung eines elektronischen Dokuments an die elektronische Poststelle des Gerichts möglich. Das elektronische Dokument muss für die Bearbeitung durch das Gericht geeignet und mit einer qualifizierten elektronischen Signatur der verantwortenden Person versehen sein oder von der verantwortenden Person signiert und auf einem sicheren Übermittlungsweg gemäß § 130a ZPO nach näherer Maßgabe der Verordnung über die technischen Rahmenbedingungen des elektronischen Rechtsverkehrs und über das besondere elektronische Behördenpostfach (BGBl. I, S.3803) eingereicht werden. Weitere Informationen erhalten Sie auf der Internetseite www.justiz.de.\nDer Widerspruch muss spätestens innerhalb der gesetzten Frist nach dem Datum der Bekanntmachung der Löschungsankündigung bei dem Amtsgericht - Registergericht - Düsseldorf eingegangen sein.  Dies gilt auch dann, wenn der Widerspruch zur Niederschrift der Geschäftsstelle eines anderen Amtsgerichtes abgegeben wurde. Die Frist beginnt mit dem Tage der Bekanntmachung der Löschungsankündigung in dem für die Bekanntmachung der Eintragungen in das Handelsregister bestimmten elektronischen Informations- und Kommunikationssystem nach § 10 des Handelsgesetzbuches. Fällt das Ende der Frist auf einen Sonntag, einen allgemeinen Feiertag oder Sonnabend, so endet die Frist mit Ablauf des nächsten Werktages.\nDer Widerspruch muss die Bezeichnung der angefochtenen Löschungsankündigung sowie die Erklärung enthalten, dass Widerspruch gegen diese Löschungsankündigung eingelegt wird. Er ist zu unterzeichnen und soll begründet werden."
    },
    {
      "date": "2025-04-08",
      "id": "105985",
      "original_text": "Einreichung neuer Dokumente\nNordrhein-Westfalen Amtsgericht Paderborn HRB 4153\nBenteler Automobiltechnik GmbH – Paderborn",
      "type": "Einreichung neuer Dokumente",
      "state": "Nordrhein-Westfalen",
      "amtsgericht": "Amtsgericht Paderborn",
      "registernummer": "HRB 4153",
      "registerart": "HRB",
      "company_name": "Benteler Automobiltechnik GmbH",
      "company_seat": "Paderborn",
      "details": "08.04.2025 (Bekanntmachungsdatum)\n\nNordrhein-Westfalen Amtsgericht Paderborn HRB 4153\nEinreichung neuer Dokumente\n\nBenteler Automobiltechnik GmbH\nGesellschaft mit beschränkter Haftung\nPaderborn\n\nDem Registergericht ist eine neue Liste der Mitglieder des Aufsichtsrates eingereicht worden."
    },
    {
      "date": "2025-04-08",
      "id": "105986",
      "original_text": "Löschungsankündigung\nNordrhein-Westfalen Amtsgericht Wuppertal HRB 9227\nTMG GmbH – Wuppertal",
      "type": "Löschungsankündigung",
      "state": "Nordrhein-Westfalen",
      "amtsgericht": "Amtsgericht Wuppertal",
      "registernummer": "HRB 9227",
      "registerart": "HRB",
      "company_name": "TMG GmbH",
      "company_seat": "Wuppertal",
      "details": "08.04.2025 (Bekanntmachungsdatum)\n\nNordrhein-Westfalen Amtsgericht Wuppertal HRB 9227\nLöschungsankündigung\n\nTMG GmbH\nGesellschaft mit beschränkter Haftung\nWuppertal\n\nDas Registergericht beabsichtigt die Gesellschaft von Amts wegen nach § 394 FamFG zu löschen. Die Frist zur Erhebung eines Widerspruchs ist auf einen Monat festgesetzt."
    },
    {
      "date": "2025-04-08",
      "id": "105987",
      "original_text": "Löschungsankündigung\nNordrhein-Westfalen Amtsgericht Gütersloh HRB 3568\nhb Solar Handels GmbH – Rietberg",
      "type": "Löschungsankündigung",
      "state": "Nordrhein-Westfalen",
      "amtsgericht": "Amtsgericht Gütersloh",
      "registernummer": "HRB 3568",
      "registerart": "HRB",
      "company_name": "hb Solar Handels GmbH",
      "company_seat": "Rietberg",
      "details": "08.04.2025 (Bekanntmachungsdatum)\n\nNordrhein-Westfalen Amtsgericht Gütersloh HRB 3568\nLöschungsankündigung 08.04.2025 (Eintragungsdatum)\n\nhb Solar Handels GmbH\nGesellschaft mit beschränkter Haftung\nRietberg\n\nDas Registergericht beabsichtigt die Gesellschaft von Amts wegen nach § 394 FamFG zu löschen. Die Frist zur Erhebung eines Widerspruchs ist auf einen Monat festgesetzt."
    },
    {
      "date": "2025-04-08",
      "id": "105988",
      "original_text": "Löschungsankündigung\nNordrhein-Westfalen Amtsgericht Gütersloh HRB 8392\nSF Verwaltungs-GmbH – Borgholzhausen",
      "type": "Löschungsankündigung",
      "state": "Nordrhein-Westfalen",
      "amtsgericht": "Amtsgericht Gütersloh",
      "registernummer": "HRB 8392",
      "registerart": "HRB",
      "company_name": "SF Verwaltungs-GmbH",
      "company_seat": "Borgholzhausen",
      "details": "08.04.2025 (Bekanntmachungsdatum)\n\nNordrhein-Westfalen Amtsgericht Gütersloh HRB 8392\nLöschungsankündigung 08.04.2025 (Eintragungsdatum)\n\nSF Verwaltungs-GmbH\nGesellschaft mit beschränkter Haftung\nBorgholzhausen\n\nDas Registergericht beabsichtigt die Gesellschaft von Amts wegen nach § 394 FamFG zu löschen. Die Frist zur Erhebung eines Widerspruchs ist auf einen Monat festgesetzt."
    },
    {
      "date": "2025-04-08",
      "id": "105989",
      "original_text": "Registerbekanntmachung nach dem Umwandlungsgesetz\nNordrhein-Westfalen Amtsgericht Bad Oeynhausen HRB 6368\nSchäffer Präzisionswerkzeuge-Verwaltungs-GmbH – Herford",
      "type": "Registerbekanntmachung nach dem Umwandlungsgesetz",
      "state": "Nordrhein-Westfalen",
      "amtsgericht": "Amtsgericht Bad Oeynhausen",
      "registernummer": "HRB 6368",
      "registerart": "HRB",
      "company_name": "Schäffer Präzisionswerkzeuge-Verwaltungs-GmbH",
      "company_seat": "Herford",
      "details": "08.04.2025 (Bekanntmachungsdatum)\n\nNordrhein-Westfalen Amtsgericht Bad Oeynhausen HRB 6368\nRegisterbekanntmachung nach dem Umwandlungsgesetz 08.04.2025 (Eintragungsdatum)\n\nSchäffer Präzisionswerkzeuge-Verwaltungs-GmbH\nGesellschaft mit beschränkter Haftung\nHerford\n\nDen Gläubigern der an der Verschmelzung beteiligten Rechtsträger ist, wenn sie binnen sechs Monaten nach dem Tag, an dem die Eintragung der Verschmelzung in das Register des Sitzes derjenigen Rechtsträger deren Gläubiger sie sind, nach § 19 Absatz 3 UmwG als bekanntgemacht gilt, ihren Anspruch nach Grund und Höhe schriftlich anmelden, Sicherheit zu leisten, soweit sie nicht Befriedigung verlangen können. Dieses Recht steht den Gläubigern jedoch nur zu, wenn sie glaubhaft machen, dass durch die Verschmelzung die Erfüllung ihrer Forderung gefährdet wird."
    },
    {
      "date": "2025-04-08",
      "id": "105990",
      "original_text": "Registerbekanntmachung nach dem Umwandlungsgesetz\nNordrhein-Westfalen Amtsgericht Steinfurt HRB 7461\nTECE GmbH – Emsdetten",
      "type": "Registerbekanntmachung nach dem Umwandlungsgesetz",
      "state": "Nordrhein-Westfalen",
      "amtsgericht": "Amtsgericht Steinfurt",
      "registernummer": "HRB 7461",
      "registerart": "HRB",
      "company_name": "TECE GmbH",
      "company_seat": "Emsdetten",
      "details": "08.04.2025 (Bekanntmachungsdatum)\n\nNordrhein-Westfalen Amtsgericht Steinfurt HRB 7461\nRegisterbekanntmachung nach dem Umwandlungsgesetz\n\nTECE GmbH\nGesellschaft mit beschränkter Haftung\nEmsdetten\n\nDem Registergericht ist der Entwurf eines Formwechselplanes über den geplanten Kettenformwechsel der Gesellschaft mit beschränkter Haftung nach deutschem Recht unter der Firma TECE GmbH mit Sitz in Emsdetten (Amtsgericht Steinfurt HRB 7461) in eine Aktiengesellschaft nach deutschem Recht unter der Firma TECE AG mit Sitz in Emsdetten und dieser wiederum in eine Europäische Aktiengesellschaft nach europäischem Recht unter der Firma TECE SE mit Sitz in Emsdetten eingereicht worden.\nDie Anteilsinhaber, die Gläubiger sowie die zuständigen Betriebsräte des an dem Kettenformwechsel beteiligten Rechtsträgers oder, soweit es keinen Betriebsrat gibt, die Arbeitnehmer, können der Gesellschaft bis spätestens fünf Arbeitstage vor dem Tag der geplanten Gesellschaftsversammlung vom 21.05.2025 Bemerkungen zum Formwechselplan übermitteln. Die vollständigen Auskünfte über die Modalitäten können bei der Gesellschaft kostenlos eingeholt werden."
    },
    {
      "date": "2025-04-08",
      "id": "105991",
      "original_text": "Löschungsankündigung\nNordrhein-Westfalen Amtsgericht Krefeld HRB 13809\nATL Autotechnik Linden GmbH – Willich",
      "type": "Löschungsankündigung",
      "state": "Nordrhein-Westfalen",
      "amtsgericht": "Amtsgericht Krefeld",
      "registernummer": "HRB 13809",
      "registerart": "HRB",
      "company_name": "ATL Autotechnik Linden GmbH",
      "company_seat": "Willich",
      "details": "08.04.2025 (Bekanntmachungsdatum)\n\nNordrhein-Westfalen Amtsgericht Krefeld HRB 13809\nLöschungsankündigung\n\nATL Autotechnik Linden GmbH\nGesellschaft mit beschränkter Haftung\nWillich\n\nDas Registergericht beabsichtigt die Gesellschaft von Amts wegen nach § 394 FamFG zu löschen. Die Frist zur Erhebung eines Widerspruchs ist auf einen Monat festgesetzt."
    },
    {
      "date": "2025-04-08",
      "id": "105992",
      "original_text": "Registerbekanntmachung nach dem Umwandlungsgesetz\nNordrhein-Westfalen Amtsgericht Düsseldorf HRB 50579\nIDEENKAPITAL PRORENDITA EINS Treuhandgesellschaft mbH – Düsseldorf",
      "type": "Registerbekanntmachung nach dem Umwandlungsgesetz",
      "state": "Nordrhein-Westfalen",
      "amtsgericht": "Amtsgericht Düsseldorf",
      "registernummer": "HRB 50579",
      "registerart": "HRB",
      "company_name": "IDEENKAPITAL PRORENDITA EINS Treuhandgesellschaft mbH",
      "company_seat": "Düsseldorf",
      "details": "08.04.2025 (Bekanntmachungsdatum)\n\nNordrhein-Westfalen Amtsgericht Düsseldorf HRB 50579\nRegisterbekanntmachung nach dem Umwandlungsgesetz 08.04.2025 (Eintragungsdatum)\n\nIDEENKAPITAL PRORENDITA EINS Treuhandgesellschaft mbH\nGesellschaft mit beschränkter Haftung\nDüsseldorf\n\nDen Gläubigern der an der Verschmelzung beteiligten Rechtsträger ist, wenn sie binnen sechs Monaten nach dem Tag, an dem die Eintragung der Verschmelzung in das Register des Sitzes desjenigen Rechtsträgers, dessen Gläubiger sie sind, nach § 19 Absatz 3 UmwG als bekanntgemacht gilt, ihren Anspruch nach Grund und Höhe schriftlich anmelden, Sicherheit zu leisten, soweit sie nicht Befriedigung verlangen können. Dieses Recht steht den Gläubigern jedoch nur zu, wenn sie glaubhaft machen, dass durch die Verschmelzung die Erfüllung ihrer Forderung gefährdet wird."
    },
    {
      "date": "2025-04-08",
      "id": "105993",
      "original_text": "Löschungsankündigung\nNordrhein-Westfalen Amtsgericht Dortmund HRB 28879\nSparkassen-Erschließungs-Gesellschaft mbH -ein Unternehmen der Sparkasse an der Lippe- – Lünen",
      "type": "Löschungsankündigung",
      "state": "Nordrhein-Westfalen",
      "amtsgericht": "Amtsgericht Dortmund",
      "registernummer": "HRB 28879",
      "registerart": "HRB",
      "company_name": "Sparkassen-Erschließungs-Gesellschaft mbH -ein Unternehmen der Sparkasse an der Lippe-",
      "company_seat": "Lünen",
      "details": "08.04.2025 (Bekanntmachungsdatum)\n\nNordrhein-Westfalen Amtsgericht Dortmund HRB 28879\nLöschungsankündigung 08.04.2025 (Eintragungsdatum)\n\nSparkassen-Erschließungs-Gesellschaft mbH -ein Unternehmen der Sparkasse an der Lippe-\nGesellschaft mit beschränkter Haftung\nLünen\n\nDie am 11.03.2025 erfolgte Löschungsankündigung wird zurückgenommen, da diese irrig erfolgt ist."
    },
    {
      "date": "2025-04-08",
      "id": "105994",
      "original_text": "Registerbekanntmachung nach dem Umwandlungsgesetz\nNordrhein-Westfalen Amtsgericht Bochum HRB 22302\nDW GmbH – Bochum",
      "type": "Registerbekanntmachung nach dem Umwandlungsgesetz",
      "state": "Nordrhein-Westfalen",
      "amtsgericht": "Amtsgericht Bochum",
      "registernummer": "HRB 22302",
      "registerart": "HRB",
      "company_name": "DW GmbH",
      "company_seat": "Bochum",
      "details": "08.04.2025 (Bekanntmachungsdatum)\n\nNordrhein-Westfalen Amtsgericht Bochum HRB 22302\nRegisterbekanntmachung nach dem Umwandlungsgesetz 04.04.2025 (Eintragungsdatum)\n\nDW GmbH\nGesellschaft mit beschränkter Haftung\nBochum\n\nDen Gläubigern der an der Ausgliederung beteiligten Rechtsträger ist, wenn sie binnen sechs Monaten nach dem Tag, an dem die Eintragung der Ausgliederung in das Register des Sitzes derjenigen Rechtsträger deren Gläubiger sie sind, nach § 19 Absatz 3 UmwG als bekanntgemacht gilt, ihren Anspruch nach Grund und Höhe schriftlich anmelden, Sicherheit zu leisten, soweit sie nicht Befriedigung verlangen können. Dieses Recht steht den Gläubigern jedoch nur zu, wenn sie glaubhaft machen, dass durch die Ausgliederung die Erfüllung ihrer Forderung gefährdet wird."
    },
    {
      "date": "2025-04-08",
      "id": "105995",
      "original_text": "Registerbekanntmachung nach dem Umwandlungsgesetz\nNordrhein-Westfalen Amtsgericht Lemgo HRB 8201\nDie Flohmarkt - Hannover GmbH – Barntrup",
      "type": "Registerbekanntmachung nach dem Umwandlungsgesetz",
      "state": "Nordrhein-Westfalen",
      "amtsgericht": "Amtsgericht Lemgo",
      "registernummer": "HRB 8201",
      "registerart": "HRB",
      "company_name": "Die Flohmarkt - Hannover GmbH",
      "company_seat": "Barntrup",
      "details": "08.04.2025 (Bekanntmachungsdatum)\n\nNordrhein-Westfalen Amtsgericht Lemgo HRB 8201\nRegisterbekanntmachung nach dem Umwandlungsgesetz 08.04.2025 (Eintragungsdatum)\n\nDie Flohmarkt - Hannover GmbH\nGesellschaft mit beschränkter Haftung\nBarntrup\n\nDen Gläubigern der an der Verschmelzung beteiligten Rechtsträger ist, wenn sie binnen sechs Monaten nach dem Tag, an dem die Eintragung der Verschmelzung in das Register des Sitzes desjenigen Rechtsträgers, dessen Gläubiger sie sind, nach § 19 Absatz 3 UmwG als bekanntgemacht gilt, ihren Anspruch nach Grund und Höhe schriftlich anmelden, Sicherheit zu leisten, soweit sie nicht Befriedigung verlangen können. Dieses Recht steht den Gläubigern jedoch nur zu, wenn sie glaubhaft machen, dass durch die Verschmelzung die Erfüllung ihrer Forderung gefährdet wird."
    },
    {
      "date": "2025-04-08",
      "id": "105996",
      "original_text": "Registerbekanntmachung nach dem Umwandlungsgesetz\nNordrhein-Westfalen Amtsgericht Lemgo HRB 8219\nDie Flohmarkt - Osnabrück GmbH – Barntrup",
      "type": "Registerbekanntmachung nach dem Umwandlungsgesetz",
      "state": "Nordrhein-Westfalen",
      "amtsgericht": "Amtsgericht Lemgo",
      "registernummer": "HRB 8219",
      "registerart": "HRB",
      "company_name": "Die Flohmarkt - Osnabrück GmbH",
      "company_seat": "Barntrup",
      "details": "08.04.2025 (Bekanntmachungsdatum)\n\nNordrhein-Westfalen Amtsgericht Lemgo HRB 8219\nRegisterbekanntmachung nach dem Umwandlungsgesetz 08.04.2025 (Eintragungsdatum)\n\nDie Flohmarkt - Osnabrück GmbH\nGesellschaft mit beschränkter Haftung\nBarntrup\n\nDen Gläubigern der an der Verschmelzung beteiligten Rechtsträger ist, wenn sie binnen sechs Monaten nach dem Tag, an dem die Eintragung der Verschmelzung in das Register des Sitzes desjenigen Rechtsträgers, dessen Gläubiger sie sind, nach § 19 Absatz 3 UmwG als bekanntgemacht gilt, ihren Anspruch nach Grund und Höhe schriftlich anmelden, Sicherheit zu leisten, soweit sie nicht Befriedigung verlangen können. Dieses Recht steht den Gläubigern jedoch nur zu, wenn sie glaubhaft machen, dass durch die Verschmelzung die Erfüllung ihrer Forderung gefährdet wird."
    },
    {
      "date": "2025-04-08",
      "id": "105997",
      "original_text": "Registerbekanntmachung nach dem Umwandlungsgesetz\nNordrhein-Westfalen Amtsgericht Düsseldorf HRB 46483\nLPV Versicherung AG – Hilden",
      "type": "Registerbekanntmachung nach dem Umwandlungsgesetz",
      "state": "Nordrhein-Westfalen",
      "amtsgericht": "Amtsgericht Düsseldorf",
      "registernummer": "HRB 46483",
      "registerart": "HRB",
      "company_name": "LPV Versicherung AG",
      "company_seat": "Hilden",
      "details": "08.04.2025 (Bekanntmachungsdatum)\n\nNordrhein-Westfalen Amtsgericht Düsseldorf HRB 46483\nRegisterbekanntmachung nach dem Umwandlungsgesetz\n\nLPV Versicherung AG\nAktiengesellschaft\nHilden\n\nDem Registergericht ist der Entwurf eines Vertrages über die geplante Verschmelzung der LPV Versicherung AG mit Sitz in Hilden (AG Düsseldorf, HRB 46483)  mit der Lifestyle Protection AG mit Sitz in Hilden (AG Düsseldorf, HRB 63310) eingereicht worden."
    },
    {
      "date": "2025-04-08",
      "id": "105998",
      "original_text": "Einreichung neuer Dokumente\nNordrhein-Westfalen Amtsgericht Hagen HRB 5008\nHerdecker Gemeinnützige Wohnungsgesellschaft mit beschränkter Haftung – Herdecke",
      "type": "Einreichung neuer Dokumente",
      "state": "Nordrhein-Westfalen",
      "amtsgericht": "Amtsgericht Hagen",
      "registernummer": "HRB 5008",
      "registerart": "HRB",
      "company_name": "Herdecker Gemeinnützige Wohnungsgesellschaft mit beschränkter Haftung",
      "company_seat": "Herdecke",
      "details": "08.04.2025 (Bekanntmachungsdatum)\n\nNordrhein-Westfalen Amtsgericht Hagen HRB 5008\nEinreichung neuer Dokumente\n\nHerdecker Gemeinnützige Wohnungsgesellschaft mit beschränkter Haftung\nGesellschaft mit beschränkter Haftung\nHerdecke\n\nDem Registergericht ist eine neue Liste der Mitglieder des Aufsichtsrates eingereicht worden."
    },
    {
      "date": "2025-04-08",
      "id": "105999",
      "original_text": "Registerbekanntmachung nach dem Umwandlungsgesetz\nBaden-Württemberg Amtsgericht Freiburg HRB 542041\nPAWI Packaging Deutschland GmbH – Singen Hohentwiel",
      "type": "Registerbekanntmachung nach dem Umwandlungsgesetz",
      "state": "Baden-Württemberg",
      "amtsgericht": "Amtsgericht Freiburg",
      "registernummer": "HRB 542041",
      "registerart": "HRB",
      "company_name": "PAWI Packaging Deutschland GmbH",
      "company_seat": "Singen Hohentwiel",
      "details": "08.04.2025 (Bekanntmachungsdatum)\n\nBaden-Württemberg Amtsgericht Freiburg HRB 542041\nRegisterbekanntmachung nach dem Umwandlungsgesetz 08.04.2025 (Eintragungsdatum)\n\nPAWI Packaging Deutschland GmbH\nGesellschaft mit beschränkter Haftung\nSingen Hohentwiel\n\nAls nicht eingetragen wird bekanntgemacht:\nDen Gläubigern der an der Verschmelzung beteiligten Rechtsträger ist, wenn sie binnen sechs Monaten nach dem Tag, an dem die Eintragung der Verschmelzung in das Register des Sitzes desjenigen Rechtsträgers, dessen Gläubiger sie sind, nach § 19 Abs. 3 UmwG als bekanntgemacht gilt, ihren Anspruch nach Grund und Höhe schriftlich anmelden, Sicherheit zu leisten, soweit sie nicht Befriedigung verlangen können. Dieses Recht steht den Gläubigern jedoch nur zu, wenn sie glaubhaft machen, dass durch die Verschmelzung die Erfüllung ihrer Forderung gefährdet wird."
    },
    {
      "date": "2025-04-08",
      "id": "106000",
      "original_text": "Löschungsankündigung\nThüringen Amtsgericht Jena HRB 514384\nelements GmbH – Floh-Seligenthal",
      "type": "Löschungsankündigung",
      "state": "Thüringen",
      "amtsgericht": "Amtsgericht Jena",
      "registernummer": "HRB 514384",
      "registerart": "HRB",
      "company_name": "elements GmbH",
      "company_seat": "Floh-Seligenthal",
      "details": "08.04.2025 (Bekanntmachungsdatum)\n\nThüringen Amtsgericht Jena HRB 514384\nLöschungsankündigung\n\nelements GmbH\nGesellschaft mit beschränkter Haftung\nFloh-Seligenthal\n\nDas Registergericht beabsichtigt, die im Handelsregister eingetragene Gesellschaft wegen Vermögenslosigkeit nach § 394 FamFG von Amts wegen zu löschen. Die Frist zur Erhebung eines Widerspruchs gegen die beabsichtigte Löschung wird auf 6 Wochen festgesetzt."
    },
    {
      "date": "2025-04-08",
      "id": "106001",
      "original_text": "Löschungsankündigung\nThüringen Amtsgericht Jena HRB 510282\nY.O.L. GmbH – Erfurt",
      "type": "Löschungsankündigung",
      "state": "Thüringen",
      "amtsgericht": "Amtsgericht Jena",
      "registernummer": "HRB 510282",
      "registerart": "HRB",
      "company_name": "Y.O.L. GmbH",
      "company_seat": "Erfurt",
      "details": "08.04.2025 (Bekanntmachungsdatum)\n\nThüringen Amtsgericht Jena HRB 510282\nLöschungsankündigung\n\nY.O.L. GmbH\nGesellschaft mit beschränkter Haftung\nErfurt\n\nDas Registergericht beabsichtigt, die im Handelsregister eingetragene Gesellschaft wegen Vermögenslosigkeit nach § 394 FamFG von Amts wegen zu löschen. Die Frist zur Erhebung eines Widerspruchs gegen die beabsichtigte Löschung wird auf 6 Wochen festgesetzt."
    },
    {
      "date": "2025-04-08",
      "id": "106002",
      "original_text": "Löschungsankündigung\nHessen Amtsgericht Wiesbaden HRB 29662\nShikpushan UG (haftungsbeschränkt) – Wiesbaden",
      "type": "Löschungsankündigung",
      "state": "Hessen",
      "amtsgericht": "Amtsgericht Wiesbaden",
      "registernummer": "HRB 29662",
      "registerart": "HRB",
      "company_name": "Shikpushan UG (haftungsbeschränkt)",
      "company_seat": "Wiesbaden",
      "details": "08.04.2025 (Bekanntmachungsdatum)\n\nHessen Amtsgericht Wiesbaden HRB 29662\nLöschungsankündigung\n\nShikpushan UG (haftungsbeschränkt)\nGesellschaft mit beschränkter Haftung\nWiesbaden\n\nDas Registergericht beabsichtigt die im Handelsregister eingetragene Gesellschaft von Amts wegen nach § 394 FamFG zu löschen. Die Frist zur Erhebung eines Widerspruchs gegen die beabsichtigte Löschung wird auf 3 Monate festgesetzt."
    },
    {
      "date": "2025-04-08",
      "id": "106003",
      "original_text": "Einreichung neuer Dokumente\nHessen Amtsgericht Kassel HRB 14586\nDeutscher Wanderverband Service GmbH – Kassel",
      "type": "Einreichung neuer Dokumente",
      "state": "Hessen",
      "amtsgericht": "Amtsgericht Kassel",
      "registernummer": "HRB 14586",
      "registerart": "HRB",
      "company_name": "Deutscher Wanderverband Service GmbH",
      "company_seat": "Kassel",
      "details": "08.04.2025 (Bekanntmachungsdatum)\n\nHessen Amtsgericht Kassel HRB 14586\nEinreichung neuer Dokumente 08.04.2025 (Eintragungsdatum)\n\nDeutscher Wanderverband Service GmbH\nGesellschaft mit beschränkter Haftung\nKassel\n\nDurch eine Änderung in den Personen der Aufsichtsratsmitglieder ist eine Liste der Mitglieder des Aufsichtsrates zum Handelsregister eingereicht worden."
    },
    {
      "date": "2025-04-08",
      "id": "106004",
      "original_text": "Löschungsankündigung\nHessen Amtsgericht Offenbach am Main HRB 50885\nMDL Construction GmbH – Mühlheim am Main",
      "type": "Löschungsankündigung",
      "state": "Hessen",
      "amtsgericht": "Amtsgericht Offenbach am Main",
      "registernummer": "HRB 50885",
      "registerart": "HRB",
      "company_name": "MDL Construction GmbH",
      "company_seat": "Mühlheim am Main",
      "details": "08.04.2025 (Bekanntmachungsdatum)\n\nHessen Amtsgericht Offenbach am Main HRB 50885\nLöschungsankündigung\n\nMDL Construction GmbH\nGesellschaft mit beschränkter Haftung\nMühlheim am Main\n\nDas Registergericht beabsichtigt die im Handelsregister eingetragene Gesellschaft von Amts wegen nach § 394 FamFG zu löschen. Die Frist zur Erhebung eines Widerspruchs gegen die beabsichtigte Löschung wird auf 3 Monate festgesetzt."
    },
    {
      "date": "2025-04-08",
      "id": "106005",
      "original_text": "Registerbekanntmachung nach dem Umwandlungsgesetz\nHessen Amtsgericht Wiesbaden HRB 27212\nGMT Gerhard Müller Touristik UG (haftungsbeschränkt) – Idstein",
      "type": "Registerbekanntmachung nach dem Umwandlungsgesetz",
      "state": "Hessen",
      "amtsgericht": "Amtsgericht Wiesbaden",
      "registernummer": "HRB 27212",
      "registerart": "HRB",
      "company_name": "GMT Gerhard Müller Touristik UG (haftungsbeschränkt)",
      "company_seat": "Idstein",
      "details": "08.04.2025 (Bekanntmachungsdatum)\n\nHessen Amtsgericht Wiesbaden HRB 27212\nRegisterbekanntmachung nach dem Umwandlungsgesetz 08.04.2025 (Eintragungsdatum)\n\nGMT Gerhard Müller Touristik UG (haftungsbeschränkt)\nGesellschaft mit beschränkter Haftung\nIdstein\n\nDie Gesellschaft hat Gläubigern, deren Forderungen vor dieser Bekanntmachung begründet worden sind, Sicherheit zu leisten, soweit sie nicht Befriedigung verlangen können, wenn sie sich binnen sechs Monaten nach dieser Bekanntmachung zu diesem Zweck melden.\nDen Gläubigern der an der Verschmelzung beteiligten Rechtsträger ist, wenn sie binnen sechs Monaten nach dem Tag, an dem die Eintragung der Verschmelzung in das Register des Sitzes derjenigen Rechtsträger deren Gläubiger sie sind, nach § 19 Absatz 3 UmwG bekannt gemacht worden ist, ihren Anspruch nach Grund und Höhe schriftlich anmelden, Sicherheit zu leisten, soweit sie nicht Befriedigung verlangen können. Dieses Recht steht den Gläubigern jedoch nur zu, wenn sie glaubhaft machen, dass durch die Verschmelzung die Erfüllung ihrer Forderung gefährdet wird."
    },
    {
      "date": "2025-04-08",
      "id": "106006",
      "original_text": "Einreichung neuer Dokumente\nHessen Amtsgericht Frankfurt am Main HRB 15511\nDeutsche Vermögensberatung Aktiengesellschaft DVAG – Frankfurt am Main",
      "type": "Einreichung neuer Dokumente",
      "state": "Hessen",
      "amtsgericht": "Amtsgericht Frankfurt am Main",
      "registernummer": "HRB 15511",
      "registerart": "HRB",
      "company_name": "Deutsche Vermögensberatung Aktiengesellschaft DVAG",
      "company_seat": "Frankfurt am Main",
      "details": "08.04.2025 (Bekanntmachungsdatum)\n\nHessen Amtsgericht Frankfurt am Main HRB 15511\nEinreichung neuer Dokumente 08.04.2025 (Eintragungsdatum)\n\nDeutsche Vermögensberatung Aktiengesellschaft DVAG\nAktiengesellschaft\nFrankfurt am Main\n\nDurch eine Änderung in den Personen der Aufsichtsratsmitglieder ist eine Liste der Mitglieder des Aufsichtsrates zum Handelsregister eingereicht worden."
    },
    {
      "date": "2025-04-08",
      "id": "106007",
      "original_text": "Einreichung neuer Dokumente\nHessen Amtsgericht Hanau HRB 97610\nBlitz 17-665 SE – Maintal",
      "type": "Einreichung neuer Dokumente",
      "state": "Hessen",
      "amtsgericht": "Amtsgericht Hanau",
      "registernummer": "HRB 97610",
      "registerart": "HRB",
      "company_name": "Blitz 17-665 SE",
      "company_seat": "Maintal",
      "details": "08.04.2025 (Bekanntmachungsdatum)\n\nHessen Amtsgericht Hanau HRB 97610\nEinreichung neuer Dokumente\n\nBlitz 17-665 SE\nEuropäische Aktiengesellschaft (SE)\nMaintal\n\nDurch eine Änderung in den Personen der Aufsichtsratsmitglieder ist eine Liste der Mitglieder des Aufsichtsrates zum Handelsregister eingereicht worden."
    },
    {
      "date": "2025-04-08",
      "id": "106008",
      "original_text": "Sonstige Registerbekanntmachung\nHessen Amtsgericht Frankfurt am Main HRB 105687\nflatexDEGIRO Bank AG – Frankfurt am Main",
      "type": "Sonstige Registerbekanntmachung",
      "state": "Hessen",
      "amtsgericht": "Amtsgericht Frankfurt am Main",
      "registernummer": "HRB 105687",
      "registerart": "HRB",
      "company_name": "flatexDEGIRO Bank AG",
      "company_seat": "Frankfurt am Main",
      "details": "08.04.2025 (Bekanntmachungsdatum)\n\nHessen Amtsgericht Frankfurt am Main HRB 105687\nSonstige Registerbekanntmachung 08.04.2025 (Eintragungsdatum)\n\nflatexDEGIRO Bank AG\nAktiengesellschaft\nFrankfurt am Main\n\nDurch eine Änderung in den Personen der Aufsichtsratsmitglieder ist eine Liste der Mitglieder des Aufsichtsrates zum Handelsregister eingereicht worden."
    },
    {
      "date": "2025-04-08",
      "id": "106009",
      "original_text": "Löschungsankündigung\nHessen Amtsgericht Offenbach am Main HRB 42745\nSandy Import - Export GmbH – Dreieich",
      "type": "Löschungsankündigung",
      "state": "Hessen",
      "amtsgericht": "Amtsgericht Offenbach am Main",
      "registernummer": "HRB 42745",
      "registerart": "HRB",
      "company_name": "Sandy Import - Export GmbH",
      "company_seat": "Dreieich",
      "details": "08.04.2025 (Bekanntmachungsdatum)\n\nHessen Amtsgericht Offenbach am Main HRB 42745\nLöschungsankündigung\n\nSandy Import - Export GmbH\nGesellschaft mit beschränkter Haftung\nDreieich\n\nDas Registergericht beabsichtigt die im Handelsregister eingetragene Gesellschaft von Amts wegen nach § 394 FamFG zu löschen. Die Frist zur Erhebung eines Widerspruchs gegen die beabsichtigte Löschung wird auf 3 Monate festgesetzt."
    },
    {
      "date": "2025-04-08",
      "id": "106010",
      "original_text": "Sonstige Registerbekanntmachung\nHessen Amtsgericht Fritzlar VR 1162\nFreie Christengemeinde Homberg, Bez. Kassel – Homberg (Efze)",
      "type": "Sonstige Registerbekanntmachung",
      "state": "Hessen",
      "amtsgericht": "Amtsgericht Fritzlar",
      "registernummer": "VR 1162",
      "registerart": "VR",
      "company_name": "Freie Christengemeinde Homberg, Bez. Kassel",
      "company_seat": "Homberg (Efze)",
      "details": "08.04.2025 (Bekanntmachungsdatum)\n\nHessen Amtsgericht Fritzlar VR 1162\nSonstige Registerbekanntmachung 08.04.2025 (Eintragungsdatum)\n\nFreie Christengemeinde Homberg, Bez. Kassel\neingetragener Verein\nHomberg (Efze)\n\nDer Verein ist aufgelöst."
    },
    {
      "date": "2025-04-08",
      "id": "106011",
      "original_text": "Registerbekanntmachung nach dem Umwandlungsgesetz\nHessen Amtsgericht Offenbach am Main HRB 42439\nCECECLA GmbH – Seligenstadt",
      "type": "Registerbekanntmachung nach dem Umwandlungsgesetz",
      "state": "Hessen",
      "amtsgericht": "Amtsgericht Offenbach am Main",
      "registernummer": "HRB 42439",
      "registerart": "HRB",
      "company_name": "CECECLA GmbH",
      "company_seat": "Seligenstadt",
      "details": "08.04.2025 (Bekanntmachungsdatum)\n\nHessen Amtsgericht Offenbach am Main HRB 42439\nRegisterbekanntmachung nach dem Umwandlungsgesetz 08.04.2025 (Eintragungsdatum)\n\nCECECLA GmbH\nGesellschaft mit beschränkter Haftung\nSeligenstadt\n\nDen Gläubigern der an der Verschmelzung beteiligten Rechtsträger ist, wenn sie binnen sechs Monaten nach dem Tag, an dem die Eintragung der Verschmelzung in das Register des Sitzes desjenigen Rechtsträgers, dessen Gläubiger sie sind, nach § 19 Absatz 3 UmwG bekannt gemacht worden ist, ihren Anspruch nach Grund und Höhe schriftlich anmelden, Sicherheit zu leisten, soweit sie nicht Befriedigung verlangen können. Dieses Recht steht den Gläubigern jedoch nur zu, wenn sie glaubhaft machen, dass durch die Verschmelzung die Erfüllung ihrer Forderung gefährdet wird."
    },
    {
      "date": "2025-04-08",
      "id": "106012",
      "original_text": "Registerbekanntmachung nach dem Umwandlungsgesetz\nHessen Amtsgericht Wetzlar HRA 8183\nVital-Fit Massagesessel Silvia Georg e. K. – Breitscheid",
      "type": "Registerbekanntmachung nach dem Umwandlungsgesetz",
      "state": "Hessen",
      "amtsgericht": "Amtsgericht Wetzlar",
      "registernummer": "HRA 8183",
      "registerart": "HRA",
      "company_name": "Vital-Fit Massagesessel Silvia Georg e. K.",
      "company_seat": "Breitscheid",
      "details": "08.04.2025 (Bekanntmachungsdatum)\n\nHessen Amtsgericht Wetzlar HRA 8183\nRegisterbekanntmachung nach dem Umwandlungsgesetz 08.04.2025 (Eintragungsdatum)\n\nVital-Fit Massagesessel Silvia Georg e. K.\nEinzelkaufmann / Einzelkauffrau\nBreitscheid\n\nDen Gläubigern der an der Ausgliederung beteiligten Rechtsträger ist, wenn sie binnen sechs Monaten nach dem Tag, an dem die Eintragung der Ausgliederung in das Register des Sitzes desjenigen Rechtsträgers, dessen Gläubiger sie sind, nach §§ 125, 19 Absatz 3 UmwG bekannt gemacht worden ist, ihren Anspruch nach Grund und Höhe schriftlich anmelden, Sicherheit zu leisten, soweit sie nicht Befriedigung verlangen können. Dieses Recht steht den Gläubigern jedoch nur zu, wenn sie glaubhaft machen, dass durch die Ausgliederung die Erfüllung ihrer Forderung gefährdet wird."
    },
    {
      "date": "2025-04-08",
      "id": "106013",
      "original_text": "Einreichung neuer Dokumente\nHessen Amtsgericht Kassel HRB 5592\nVerkehrsverbund und Fördergesellschaft Nordhessen mbH – Kassel",
      "type": "Einreichung neuer Dokumente",
      "state": "Hessen",
      "amtsgericht": "Amtsgericht Kassel",
      "registernummer": "HRB 5592",
      "registerart": "HRB",
      "company_name": "Verkehrsverbund und Fördergesellschaft Nordhessen mbH",
      "company_seat": "Kassel",
      "details": "08.04.2025 (Bekanntmachungsdatum)\n\nHessen Amtsgericht Kassel HRB 5592\nEinreichung neuer Dokumente\n\nVerkehrsverbund und Fördergesellschaft Nordhessen mbH\nGesellschaft mit beschränkter Haftung\nKassel\n\nDurch eine Änderung in den Personen der Aufsichtsratsmitglieder ist eine Liste der Mitglieder des Aufsichtsrates zum Handelsregister eingereicht worden."
    },
    {
      "date": "2025-04-08",
      "id": "106014",
      "original_text": "Registerbekanntmachung nach dem Umwandlungsgesetz\nHessen Amtsgericht Wetzlar HRB 8764\nVital Fit Massagetechnik Theiß GmbH – Breitscheid",
      "type": "Registerbekanntmachung nach dem Umwandlungsgesetz",
      "state": "Hessen",
      "amtsgericht": "Amtsgericht Wetzlar",
      "registernummer": "HRB 8764",
      "registerart": "HRB",
      "company_name": "Vital Fit Massagetechnik Theiß GmbH",
      "company_seat": "Breitscheid",
      "details": "08.04.2025 (Bekanntmachungsdatum)\n\nHessen Amtsgericht Wetzlar HRB 8764\nRegisterbekanntmachung nach dem Umwandlungsgesetz 08.04.2025 (Eintragungsdatum)\n\nVital Fit Massagetechnik Theiß GmbH\nGesellschaft mit beschränkter Haftung\nBreitscheid\n\nDen Gläubigern der an der Ausgliederung beteiligten Rechtsträger ist, wenn sie binnen sechs Monaten nach dem Tag, an dem die Eintragung der Ausgliederung in das Register des Sitzes desjenigen Rechtsträgers, dessen Gläubiger sie sind, nach §§ 125, 19 Absatz 3 UmwG bekannt gemacht worden ist, ihren Anspruch nach Grund und Höhe schriftlich anmelden, Sicherheit zu leisten, soweit sie nicht Befriedigung verlangen können. Dieses Recht steht den Gläubigern jedoch nur zu, wenn sie glaubhaft machen, dass durch die Ausgliederung die Erfüllung ihrer Forderung gefährdet wird."
    },
    {
      "date": "2025-04-08",
      "id": "106015",
      "original_text": "Löschungsankündigung\nHessen Amtsgericht Hanau HRA 91255\nRhönblick-Klinik Wilhelm GmbH & Co. KG – Bad Soden-Salmünster",
      "type": "Löschungsankündigung",
      "state": "Hessen",
      "amtsgericht": "Amtsgericht Hanau",
      "registernummer": "HRA 91255",
      "registerart": "HRA",
      "company_name": "Rhönblick-Klinik Wilhelm GmbH & Co. KG",
      "company_seat": "Bad Soden-Salmünster",
      "details": "08.04.2025 (Bekanntmachungsdatum)\n\nHessen Amtsgericht Hanau HRA 91255\nLöschungsankündigung\n\nRhönblick-Klinik Wilhelm GmbH & Co. KG\nKommanditgesellschaft\nBad Soden-Salmünster\n\nDas Registergericht beabsichtigt die im Handelsregister eingetragene Firma von Amts wegen nach § 394 FamFG zu löschen. Die Frist zur Erhebung eines Widerspruchs gegen die beabsichtigte Löschung wird auf 3 Monate festgesetzt."
    },
    {
      "date": "2025-04-08",
      "id": "106016",
      "original_text": "Einreichung neuer Dokumente\nHessen Amtsgericht Frankfurt am Main HRB 75453\nDell GmbH – Frankfurt am Main",
      "type": "Einreichung neuer Dokumente",
      "state": "Hessen",
      "amtsgericht": "Amtsgericht Frankfurt am Main",
      "registernummer": "HRB 75453",
      "registerart": "HRB",
      "company_name": "Dell GmbH",
      "company_seat": "Frankfurt am Main",
      "details": "08.04.2025 (Bekanntmachungsdatum)\n\nHessen Amtsgericht Frankfurt am Main HRB 75453\nEinreichung neuer Dokumente 02.04.2012 (Eintragungsdatum)\n\nDell GmbH\nGesellschaft mit beschränkter Haftung\nFrankfurt am Main\n\nDurch eine Änderung in den Personen der Aufsichtsratsmitglieder ist eine Liste der Mitglieder des Aufsichtsrates zum Handelsregister eingereicht worden."
    }
  ]
}