{
  "date": "2025-04-14",
  "date_of_scrape": "2025-05-30T15:18:50.947Z",
  "tool_version": "0.2.0",
  "number_of_announcements": 108,
  "announcements": [
    {
      "date": "2025-04-14",
      "id": "106420",
      "original_text": "Löschungsankündigung\nSaarland Amtsgericht Saarbrücken HRB 103247\nAGH Line GmbH – Sulzbach",
      "type": "Löschungsankündigung",
      "state": "Saarland",
      "amtsgericht": "Amtsgericht Saarbrücken",
      "registernummer": "HRB 103247",
      "registerart": "HRB",
      "company_name": "AGH Line GmbH",
      "company_seat": "Sulzbach",
      "details": "14.04.2025 (Bekanntmachungsdatum)\n\nSaarland Amtsgericht Saarbrücken HRB 103247\nLöschungsankündigung\n\nAGH Line GmbH\nGesellschaft mit beschränkter Haftung\nSulzbach\n\nEs ist beabsichtigt, die Gesellschaft von Amts wegen gemäß § 394 FamFG wegen Vermögenslosigkeit zu löschen.\nGegen die Löschung von Amts wegen ist das Rechtsmittel des Widerspruchs statthaft. Der Widerspruch ist binnen einer Frist zwei Monaten beginnend mit dem Tag dieser Veröffentlichung durch Einreichen eines Widerspruchsschreibens -schriftlich oder zur Niederschrift der Geschäftsstelle beim Amtsgericht Saarbrücken, -zentrales Handelsregister-, Mainzerstr.178, 66121 Saarbrücken einzulegen.\nDer Widerspruch muss die Bezeichnung der angefochtenen Löschungsankündigung enthalten sowie die Erklärung, dass Widerspruch eingelegt wird. Er ist vom Widerspruchsführer oder seinem Bevollmächtigten zu unterzeichnen.\nDas Widerspruchsschreiben kann auch in der Form eines elektronischen Dokumentes eingereicht werden, das mit einer qualifizierten elektronischen Signatur nach dem Signaturgesetz versehen sein muss (§§ 14 Abs. 2 FamFG, 130a, 298 ZPO)."
    },
    {
      "date": "2025-04-14",
      "id": "106421",
      "original_text": "Einreichung neuer Dokumente\nSaarland Amtsgericht Saarbrücken HRB 13105\nBeteiligungsgesellschaft Ensdorf mit beschränkter Haftung – Ensdorf",
      "type": "Einreichung neuer Dokumente",
      "state": "Saarland",
      "amtsgericht": "Amtsgericht Saarbrücken",
      "registernummer": "HRB 13105",
      "registerart": "HRB",
      "company_name": "Beteiligungsgesellschaft Ensdorf mit beschränkter Haftung",
      "company_seat": "Ensdorf",
      "details": "14.04.2025 (Bekanntmachungsdatum)\n\nSaarland Amtsgericht Saarbrücken HRB 13105\nEinreichung neuer Dokumente\n\nBeteiligungsgesellschaft Ensdorf mit beschränkter Haftung\nGesellschaft mit beschränkter Haftung\nEnsdorf\n\nDie Geschäftsführung der Gesellschaft hat eine Liste der Mitglieder des Aufsichtsrats zum Handelsregister eingereicht (§ 52 Abs. 3 Satz 2 GmbHG)."
    },
    {
      "date": "2025-04-14",
      "id": "106422",
      "original_text": "Registerbekanntmachung nach dem Umwandlungsgesetz\nBaden-Württemberg Amtsgericht Mannheim HRB 722072\nAvient Deutschland GmbH – Gaggenau",
      "type": "Registerbekanntmachung nach dem Umwandlungsgesetz",
      "state": "Baden-Württemberg",
      "amtsgericht": "Amtsgericht Mannheim",
      "registernummer": "HRB 722072",
      "registerart": "HRB",
      "company_name": "Avient Deutschland GmbH",
      "company_seat": "Gaggenau",
      "details": "14.04.2025 (Bekanntmachungsdatum)\n\nBaden-Württemberg Amtsgericht Mannheim HRB 722072\nRegisterbekanntmachung nach dem Umwandlungsgesetz 14.04.2025 (Eintragungsdatum)\n\nAvient Deutschland GmbH\nGesellschaft mit beschränkter Haftung\nGaggenau\n\nAls nicht eingetragen wird bekanntgemacht:\nDen Gläubigern der an der Verschmelzung beteiligten Rechtsträger ist, wenn sie binnen sechs Monaten nach dem Tag, an dem die Eintragung der Verschmelzung in das Register des Sitzes desjenigen Rechtsträgers, dessen Gläubiger sie sind, nach § 19 Abs. 3 UmwG als bekanntgemacht gilt, ihren Anspruch nach Grund und Höhe schriftlich anmelden, Sicherheit zu leisten, soweit sie nicht Befriedigung verlangen können. Dieses Recht steht den Gläubigern jedoch nur zu, wenn sie glaubhaft machen, dass durch die Verschmelzung die Erfüllung ihrer Forderung gefährdet wird."
    },
    {
      "date": "2025-04-14",
      "id": "106423",
      "original_text": "Löschungsankündigung\nSaarland Amtsgericht Saarbrücken HRB 103928\nSchuster & Schwarz Geschäftsführungs-GmbH – Perl",
      "type": "Löschungsankündigung",
      "state": "Saarland",
      "amtsgericht": "Amtsgericht Saarbrücken",
      "registernummer": "HRB 103928",
      "registerart": "HRB",
      "company_name": "Schuster & Schwarz Geschäftsführungs-GmbH",
      "company_seat": "Perl",
      "details": "14.04.2025 (Bekanntmachungsdatum)\n\nSaarland Amtsgericht Saarbrücken HRB 103928\nLöschungsankündigung\n\nSchuster & Schwarz Geschäftsführungs-GmbH\nGesellschaft mit beschränkter Haftung\nPerl\n\nEs ist beabsichtigt, die Gesellschaft von Amts wegen gemäß § 394 FamFG wegen Vermögenslosigkeit zu löschen. Gegen die Löschung von Amts wegen ist das Rechtsmittel des Widerspruchs statthaft. Der Widerspruch ist binnen einer Frist von 1 Monat beginnend mit dem Tag dieser Veröffentlichung durch Einreichen eines Widerspruchsschreibens -schriftlich oder zur Niederschrift der Geschäftsstelle- beim Amtsgericht Saarbrücken, -zentrales Handelsregister-, Mainzerstr.178, 66121 Saarbrücken einzulegen. Der Widerspruch muss die Bezeichnung der angefochtenen Löschungsankündigung enthalten sowie die Erklärung, dass Widerspruch eingelegt wird. Er ist vom Widerspruchsführer oder seinem Bevollmächtigten zu unterzeichnen."
    },
    {
      "date": "2025-04-14",
      "id": "106424",
      "original_text": "Einreichung neuer Dokumente\nBaden-Württemberg Amtsgericht Stuttgart HRB 13988\nBWK GmbH Unternehmensbeteiligungsgesellschaft – Stuttgart",
      "type": "Einreichung neuer Dokumente",
      "state": "Baden-Württemberg",
      "amtsgericht": "Amtsgericht Stuttgart",
      "registernummer": "HRB 13988",
      "registerart": "HRB",
      "company_name": "BWK GmbH Unternehmensbeteiligungsgesellschaft",
      "company_seat": "Stuttgart",
      "details": "14.04.2025 (Bekanntmachungsdatum)\n\nBaden-Württemberg Amtsgericht Stuttgart HRB 13988\nEinreichung neuer Dokumente\n\nBWK GmbH Unternehmensbeteiligungsgesellschaft\nGesellschaft mit beschränkter Haftung\nStuttgart\n\nDie Gesellschaft hat am 11.04.2025 die Liste über die Zusammensetzung des Aufsichtsrats zum Handelsregister eingereicht."
    },
    {
      "date": "2025-04-14",
      "id": "106425",
      "original_text": "Registerbekanntmachung nach dem Umwandlungsgesetz\nBaden-Württemberg Amtsgericht Ulm HRB 661313\nGünther Roßmann Verwaltungs-GmbH – Dischingen",
      "type": "Registerbekanntmachung nach dem Umwandlungsgesetz",
      "state": "Baden-Württemberg",
      "amtsgericht": "Amtsgericht Ulm",
      "registernummer": "HRB 661313",
      "registerart": "HRB",
      "company_name": "Günther Roßmann Verwaltungs-GmbH",
      "company_seat": "Dischingen",
      "details": "14.04.2025 (Bekanntmachungsdatum)\n\nBaden-Württemberg Amtsgericht Ulm HRB 661313\nRegisterbekanntmachung nach dem Umwandlungsgesetz 14.04.2025 (Eintragungsdatum)\n\nGünther Roßmann Verwaltungs-GmbH\nGesellschaft mit beschränkter Haftung\nDischingen\n\nAls nicht eingetragen wird bekanntgemacht:\nDen Gläubigern der an der Verschmelzung beteiligten Rechtsträger ist, wenn sie binnen sechs Monaten nach dem Tag, an dem die Eintragung der Verschmelzung in das Register des Sitzes desjenigen Rechtsträgers, dessen Gläubiger sie sind, nach § 19 Abs. 3 UmwG als bekanntgemacht gilt, ihren Anspruch nach Grund und Höhe schriftlich anmelden, Sicherheit zu leisten, soweit sie nicht Befriedigung verlangen können. Dieses Recht steht den Gläubigern jedoch nur zu, wenn sie glaubhaft machen, dass durch die Verschmelzung die Erfüllung ihrer Forderung gefährdet wird."
    },
    {
      "date": "2025-04-14",
      "id": "106426",
      "original_text": "Registerbekanntmachung nach dem Umwandlungsgesetz\nBrandenburg Amtsgericht Potsdam HRA 8597\nAS Holding GmbH & Co. KG – Brück",
      "type": "Registerbekanntmachung nach dem Umwandlungsgesetz",
      "state": "Brandenburg",
      "amtsgericht": "Amtsgericht Potsdam",
      "registernummer": "HRA 8597",
      "registerart": "HRA",
      "company_name": "AS Holding GmbH & Co. KG",
      "company_seat": "Brück",
      "details": "14.04.2025 (Bekanntmachungsdatum)\n\nBrandenburg Amtsgericht Potsdam HRA 8597\nRegisterbekanntmachung nach dem Umwandlungsgesetz 12.04.2025 (Eintragungsdatum)\n\nAS Holding GmbH & Co. KG\nKommanditgesellschaft\nBrück\n\nZu Eintragungsnummer 2 vom 12.04.2025 wird als nicht eingetragen veröffentlicht: Den Gläubigern der an der Umwandlung beteiligten Rechtsträger ist, wenn sie binnen sechs Monaten nach dem Tag, an dem die Eintragung der Umwandlung in das Register des Sitzes desjenigen Rechtsträgers, dessen Gläubiger sie sind, als bekannt gemacht gilt, ihren Anspruch nach Grund und Höhe schriftlich anmelden, Sicherheit zu leisten, soweit sie nicht Befriedigung verlangen können. Dieses Recht steht den Gläubigern jedoch nur zu, wenn sie glaubhaft machen, dass durch die Umwandlung die Erfüllung ihrer Forderung gefährdet wird"
    },
    {
      "date": "2025-04-14",
      "id": "106427",
      "original_text": "Löschungsankündigung\nSchleswig-Holstein Amtsgericht Flensburg HRB 12223\nBfAW Bildungszentrum für Aus- und Weiterbildung GmbH – Wanderup",
      "type": "Löschungsankündigung",
      "state": "Schleswig-Holstein",
      "amtsgericht": "Amtsgericht Flensburg",
      "registernummer": "HRB 12223",
      "registerart": "HRB",
      "company_name": "BfAW Bildungszentrum für Aus- und Weiterbildung GmbH",
      "company_seat": "Wanderup",
      "details": "14.04.2025 (Bekanntmachungsdatum)\n\nSchleswig-Holstein Amtsgericht Flensburg HRB 12223\nLöschungsankündigung\n\nBfAW Bildungszentrum für Aus- und Weiterbildung GmbH\nGesellschaft mit beschränkter Haftung\nWanderup\n\nEs ist die Löschung der nachstehenden Gesellschaft wegen Vermögenslosigkeit gemäß § 394 FamFG beabsichtigt.\nWiderspruchsfrist: 2 Monate"
    },
    {
      "date": "2025-04-14",
      "id": "106428",
      "original_text": "Löschungsankündigung\nBrandenburg Amtsgericht Potsdam HRB 20909\nIHB Ingenieur Hoch Bau Potsdam GmbH – Potsdam",
      "type": "Löschungsankündigung",
      "state": "Brandenburg",
      "amtsgericht": "Amtsgericht Potsdam",
      "registernummer": "HRB 20909",
      "registerart": "HRB",
      "company_name": "IHB Ingenieur Hoch Bau Potsdam GmbH",
      "company_seat": "Potsdam",
      "details": "14.04.2025 (Bekanntmachungsdatum)\n\nBrandenburg Amtsgericht Potsdam HRB 20909\nLöschungsankündigung\n\nIHB Ingenieur Hoch Bau Potsdam GmbH\nGesellschaft mit beschränkter Haftung\nPotsdam\n\nBei der nachstehenden Gesellschaft wird das Amtslöschungsverfahren gemäß § 394 FamFG eingeleitet. Widerspruchsfrist 4 Wochen."
    },
    {
      "date": "2025-04-14",
      "id": "106429",
      "original_text": "Löschungsankündigung\nSchleswig-Holstein Amtsgericht Flensburg HRB 10836\nKundS Abwicklungsgesellschaft mbH – Flensburg",
      "type": "Löschungsankündigung",
      "state": "Schleswig-Holstein",
      "amtsgericht": "Amtsgericht Flensburg",
      "registernummer": "HRB 10836",
      "registerart": "HRB",
      "company_name": "KundS Abwicklungsgesellschaft mbH",
      "company_seat": "Flensburg",
      "details": "14.04.2025 (Bekanntmachungsdatum)\n\nSchleswig-Holstein Amtsgericht Flensburg HRB 10836\nLöschungsankündigung\n\nKundS Abwicklungsgesellschaft mbH\nGesellschaft mit beschränkter Haftung\nFlensburg\n\nEs ist die Löschung der nachstehenden Gesellschaft wegen Vermögenslosigkeit gemäß § 394 FamFG beabsichtigt.\nWiderspruchsfrist: 2 Monate"
    },
    {
      "date": "2025-04-14",
      "id": "106430",
      "original_text": "Registerbekanntmachung nach dem Umwandlungsgesetz\nBrandenburg Amtsgericht Frankfurt/Oder HRB 14533\nSeefelder Baustoffhandel und Recycling GmbH (SBH & Recycling) – Werneuchen",
      "type": "Registerbekanntmachung nach dem Umwandlungsgesetz",
      "state": "Brandenburg",
      "amtsgericht": "Amtsgericht Frankfurt/Oder",
      "registernummer": "HRB 14533",
      "registerart": "HRB",
      "company_name": "Seefelder Baustoffhandel und Recycling GmbH (SBH & Recycling)",
      "company_seat": "Werneuchen",
      "details": "14.04.2025 (Bekanntmachungsdatum)\n\nBrandenburg Amtsgericht Frankfurt/Oder HRB 14533\nRegisterbekanntmachung nach dem Umwandlungsgesetz 12.04.2025 (Eintragungsdatum)\n\nSeefelder Baustoffhandel und Recycling GmbH (SBH & Recycling)\nGesellschaft mit beschränkter Haftung\nWerneuchen\n\nZu Eintragungsnummer 4 vom 12.04.2025 wird als nicht eingetragen veröffentlicht: Als nicht eingetragen wird veröffentlicht:\nDen Gläubigern der an der Verschmelzung beteiligten Rechtsträger ist, wenn sie binnen sechs Monaten nach dem Tag, an dem die Eintragung der Verschmelzung in das Register des Sitzes desjenigen Rechtsträgers, dessen Gläubiger sie sind, als bekannt gemacht gilt, ihren Anspruch nach Grund und Höhe schriftlich anmelden, Sicherheit zu leisten, soweit sie nicht Befriedigung verlangen können. Dieses Recht steht den Gläubigern jedoch nur zu, wenn sie glaubhaft machen, dass durch die Verschmelzung die Erfüllung ihrer Forderung gefährdet wird"
    },
    {
      "date": "2025-04-14",
      "id": "106431",
      "original_text": "Löschungsankündigung\nBerlin Amtsgericht Berlin (Charlottenburg) HRA 14297\nBerolina Verwaltungs-Gesellschaft mit beschränkter Haftung & Co. Grundstücks KG – Berlin",
      "type": "Löschungsankündigung",
      "state": "Berlin",
      "amtsgericht": "Amtsgericht Berlin (Charlottenburg)",
      "registernummer": "HRA 14297",
      "registerart": "HRA",
      "company_name": "Berolina Verwaltungs-Gesellschaft mit beschränkter Haftung & Co. Grundstücks KG",
      "company_seat": "Berlin",
      "details": "14.04.2025 (Bekanntmachungsdatum)\n\nBerlin Amtsgericht Berlin (Charlottenburg) HRA 14297\nLöschungsankündigung\n\nBerolina Verwaltungs-Gesellschaft mit beschränkter Haftung & Co. Grundstücks KG\nKommanditgesellschaft\nBerlin\n\nBei dem nachstehenden Unternehmen / der nachstehenden Gesellschaft wird das Amtslöschungsverfahren gemäß § 31 Abs. 2 HGB eingeleitet. Widerspruchsfrist 1 Monat"
    },
    {
      "date": "2025-04-14",
      "id": "106432",
      "original_text": "Löschungsankündigung\nBaden-Württemberg Amtsgericht Freiburg HRB 705946\nAuthentic GmbH – Konstanz",
      "type": "Löschungsankündigung",
      "state": "Baden-Württemberg",
      "amtsgericht": "Amtsgericht Freiburg",
      "registernummer": "HRB 705946",
      "registerart": "HRB",
      "company_name": "Authentic GmbH",
      "company_seat": "Konstanz",
      "details": "14.04.2025 (Bekanntmachungsdatum)\n\nBaden-Württemberg Amtsgericht Freiburg HRB 705946\nLöschungsankündigung 14.04.2025 (Eintragungsdatum)\n\nAuthentic GmbH\nGesellschaft mit beschränkter Haftung\nKonstanz\n\nAls nicht eingetragen wird bekanntgemacht:\nDas Gericht beabsichtigt, die Gesellschaft wegen Vermögenslosigkeit im Handelsregister von Amts wegen nach § 394 FamFG zu löschen. Die Frist zur Geltendmachung eines Widerspruchs gegen die beabsichtigte Löschung ist auf einen Monat ab Veröffentlichung bestimmt."
    },
    {
      "date": "2025-04-14",
      "id": "106433",
      "original_text": "Registerbekanntmachung nach dem Umwandlungsgesetz\nBrandenburg Amtsgericht Cottbus HRB 17620\nCustomlytics Services GmbH – Schulzendorf",
      "type": "Registerbekanntmachung nach dem Umwandlungsgesetz",
      "state": "Brandenburg",
      "amtsgericht": "Amtsgericht Cottbus",
      "registernummer": "HRB 17620",
      "registerart": "HRB",
      "company_name": "Customlytics Services GmbH",
      "company_seat": "Schulzendorf",
      "details": "14.04.2025 (Bekanntmachungsdatum)\n\nBrandenburg Amtsgericht Cottbus HRB 17620\nRegisterbekanntmachung nach dem Umwandlungsgesetz 10.04.2025 (Eintragungsdatum)\n\nCustomlytics Services GmbH\nGesellschaft mit beschränkter Haftung\nSchulzendorf\n\nZu Eintragungsnummer 3 vom 10.04.2025 wird als nicht eingetragen veröffentlicht:\nDen Gläubigern der an der Verschmelzung beteiligten Rechtsträger ist, wenn sie binnen sechs Monaten nach dem Tag, an dem die Eintragung der Verschmelzung in das Register des Sitzes desjenigen Rechtsträgers, dessen Gläubiger sie sind, als bekannt gemacht gilt, ihren Anspruch nach Grund und Höhe schriftlich anmelden, Sicherheit zu leisten, soweit sie nicht Befriedigung verlangen können. Dieses Recht steht den Gläubigern jedoch nur zu, wenn sie glaubhaft machen, dass durch die Verschmelzung die Erfüllung ihrer Forderung gefährdet wird"
    },
    {
      "date": "2025-04-14",
      "id": "106434",
      "original_text": "Registerbekanntmachung nach dem Umwandlungsgesetz\nBrandenburg Amtsgericht Potsdam HRA 8599\nTS Holding GmbH & Co. KG – Bad Belzig",
      "type": "Registerbekanntmachung nach dem Umwandlungsgesetz",
      "state": "Brandenburg",
      "amtsgericht": "Amtsgericht Potsdam",
      "registernummer": "HRA 8599",
      "registerart": "HRA",
      "company_name": "TS Holding GmbH & Co. KG",
      "company_seat": "Bad Belzig",
      "details": "14.04.2025 (Bekanntmachungsdatum)\n\nBrandenburg Amtsgericht Potsdam HRA 8599\nRegisterbekanntmachung nach dem Umwandlungsgesetz 12.04.2025 (Eintragungsdatum)\n\nTS Holding GmbH & Co. KG\nKommanditgesellschaft\nBad Belzig\n\nZu Eintragungsnummer 2 vom 12.04.2025 wird als nicht eingetragen veröffentlicht: Den Gläubigern der am Formwechsel beteiligten Rechtsträger ist, wenn sie binnen sechs Monaten nach dem Tag, an dem die Eintragung des Formwechsels  nach § 201 UmwG als  bekannt gemacht gilt, ihren Anspruch nach Grund und Höhe schriftlich anmelden,  Sicherheit zu leisten, soweit sie nicht Befriedigung erlangen können. Das Recht steht den Gläubigern jedoch nur zu, wenn sie glaubhaft machen, dass durch den Formwechsel die Erfüllung ihrer Forderung gefährdet wird."
    },
    {
      "date": "2025-04-14",
      "id": "106435",
      "original_text": "Einreichung neuer Dokumente\nSachsen-Anhalt Amtsgericht Stendal HRB 213463\nLandesrettungsschule der DRK- und ASB-Landesverbände Sachsen-Anhalt gGmbH – Halle (Saale)",
      "type": "Einreichung neuer Dokumente",
      "state": "Sachsen-Anhalt",
      "amtsgericht": "Amtsgericht Stendal",
      "registernummer": "HRB 213463",
      "registerart": "HRB",
      "company_name": "Landesrettungsschule der DRK- und ASB-Landesverbände Sachsen-Anhalt gGmbH",
      "company_seat": "Halle (Saale)",
      "details": "14.04.2025 (Bekanntmachungsdatum)\n\nSachsen-Anhalt Amtsgericht Stendal HRB 213463\nEinreichung neuer Dokumente 14.04.2025 (Eintragungsdatum)\n\nLandesrettungsschule der DRK- und ASB-Landesverbände Sachsen-Anhalt gGmbH\nGesellschaft mit beschränkter Haftung\nHalle (Saale)\n\nEine Liste der Mitglieder des Aufsichtsrates wurde zum Handelsregister eingereicht."
    },
    {
      "date": "2025-04-14",
      "id": "106436",
      "original_text": "Einreichung neuer Dokumente\nSachsen-Anhalt Amtsgericht Stendal HRB 11952\nCIAG Capital und Immobilien AG – Halle (Saale)",
      "type": "Einreichung neuer Dokumente",
      "state": "Sachsen-Anhalt",
      "amtsgericht": "Amtsgericht Stendal",
      "registernummer": "HRB 11952",
      "registerart": "HRB",
      "company_name": "CIAG Capital und Immobilien AG",
      "company_seat": "Halle (Saale)",
      "details": "14.04.2025 (Bekanntmachungsdatum)\n\nSachsen-Anhalt Amtsgericht Stendal HRB 11952\nEinreichung neuer Dokumente 14.04.2025 (Eintragungsdatum)\n\nCIAG Capital und Immobilien AG\nAktiengesellschaft\nHalle (Saale)\n\nEine Liste der Mitglieder des Aufsichtsrates wurde zum Handelsregister eingereicht."
    },
    {
      "date": "2025-04-14",
      "id": "106437",
      "original_text": "Registerbekanntmachung nach dem Umwandlungsgesetz\nBerlin Amtsgericht Berlin (Charlottenburg) HRA 64164\nGelbart Legal Rechtsanwaltsgesellschaft mbH & Co. KG – Berlin",
      "type": "Registerbekanntmachung nach dem Umwandlungsgesetz",
      "state": "Berlin",
      "amtsgericht": "Amtsgericht Berlin (Charlottenburg)",
      "registernummer": "HRA 64164",
      "registerart": "HRA",
      "company_name": "Gelbart Legal Rechtsanwaltsgesellschaft mbH & Co. KG",
      "company_seat": "Berlin",
      "details": "14.04.2025 (Bekanntmachungsdatum)\n\nBerlin Amtsgericht Berlin (Charlottenburg) HRA 64164\nRegisterbekanntmachung nach dem Umwandlungsgesetz 11.04.2025 (Eintragungsdatum)\n\nGelbart Legal Rechtsanwaltsgesellschaft mbH & Co. KG\nKommanditgesellschaft\nBerlin\n\nZu Eintragungsnummer 1 vom 11.04.2025 wird als nicht eingetragen veröffentlicht: Den Gläubigern ist, wenn sie binnen sechs Monaten nach dem Tag, an dem die Eintragung der Umwandlung als bekannt gemacht gilt, ihren Anspruch nach Grund und Höhe schriftlich anmelden, Sicherheit zu leisten, soweit sie nicht Befriedigung verlangen können. Dieses Recht steht den Gläubigern jedoch nur zu, wenn sie glaubhaft machen, dass durch die Umwandlung die Erfüllung ihrer Forderung gefährdet wird. Das Recht, Sicherheitsleistung zu verlangen, steht Gläubigern nicht zu, die im Falle der Insolvenz ein Recht auf vorzugsweise Befriedigung aus einer Deckungsmasse haben, die nach gesetzlicher Vorschrift zu ihrem Schutz errichtet und staatlich überwacht ist."
    },
    {
      "date": "2025-04-14",
      "id": "106438",
      "original_text": "Registerbekanntmachung nach dem Umwandlungsgesetz\nHamburg Amtsgericht Hamburg HRB 170827\nAquila Real GmbH – Hamburg",
      "type": "Registerbekanntmachung nach dem Umwandlungsgesetz",
      "state": "Hamburg",
      "amtsgericht": "Amtsgericht Hamburg",
      "registernummer": "HRB 170827",
      "registerart": "HRB",
      "company_name": "Aquila Real GmbH",
      "company_seat": "Hamburg",
      "details": "14.04.2025 (Bekanntmachungsdatum)\n\nHamburg Amtsgericht Hamburg HRB 170827\nRegisterbekanntmachung nach dem Umwandlungsgesetz 14.04.2025 (Eintragungsdatum)\n\nAquila Real GmbH\nGesellschaft mit beschränkter Haftung\nHamburg\n\nAls nicht eingetragen wird bekannt gemacht:\nDen Gläubigern der an der Verschmelzung beteiligten Gesellschaften ist, wenn sie binnen sechs Monaten nach dem Tag, an dem die Eintragung der Verschmelzung in das Register des Sitzes derjenigen Rechtsträger deren Gläubiger sie sind, nach § 19 Absatz 3 UmwG als bekannt gemacht gilt, ihren Anspruch nach Grund und Höhe schriftlich anmelden, Sicherheit zu leisten, soweit sie nicht Befriedigung verlangen können. Dieses Recht steht den Gläubigern jedoch nur zu, wenn sie glaubhaft machen, dass durch die Verschmelzung die Erfüllung ihrer Forderung gefährdet wird."
    },
    {
      "date": "2025-04-14",
      "id": "106439",
      "original_text": "Registerbekanntmachung nach dem Umwandlungsgesetz\nHamburg Amtsgericht Hamburg HRB 186204\nAquila Real V GmbH – Hamburg",
      "type": "Registerbekanntmachung nach dem Umwandlungsgesetz",
      "state": "Hamburg",
      "amtsgericht": "Amtsgericht Hamburg",
      "registernummer": "HRB 186204",
      "registerart": "HRB",
      "company_name": "Aquila Real V GmbH",
      "company_seat": "Hamburg",
      "details": "14.04.2025 (Bekanntmachungsdatum)\n\nHamburg Amtsgericht Hamburg HRB 186204\nRegisterbekanntmachung nach dem Umwandlungsgesetz 14.04.2025 (Eintragungsdatum)\n\nAquila Real V GmbH\nGesellschaft mit beschränkter Haftung\nHamburg\n\nAls nicht eingetragen wird bekannt gemacht:\nDen Gläubigern der an der Verschmelzung beteiligten Gesellschaften ist, wenn sie binnen sechs Monaten nach dem Tag, an dem die Eintragung der Verschmelzung in das Register des Sitzes desjenigen Rechtsträgers, dessen Gläubiger sie sind, nach § 19 Absatz 3 UmwG als bekannt gemacht gilt, ihren Anspruch nach Grund und Höhe schriftlich anmelden, Sicherheit zu leisten, soweit sie nicht Befriedigung verlangen können. Dieses Recht steht den Gläubigern jedoch nur zu, wenn sie glaubhaft machen, dass durch die Verschmelzung die Erfüllung ihrer Forderung gefährdet wird."
    },
    {
      "date": "2025-04-14",
      "id": "106440",
      "original_text": "Registerbekanntmachung nach dem Umwandlungsgesetz\nHamburg Amtsgericht Hamburg HRB 170296\nAquila Real II GmbH – Hamburg",
      "type": "Registerbekanntmachung nach dem Umwandlungsgesetz",
      "state": "Hamburg",
      "amtsgericht": "Amtsgericht Hamburg",
      "registernummer": "HRB 170296",
      "registerart": "HRB",
      "company_name": "Aquila Real II GmbH",
      "company_seat": "Hamburg",
      "details": "14.04.2025 (Bekanntmachungsdatum)\n\nHamburg Amtsgericht Hamburg HRB 170296\nRegisterbekanntmachung nach dem Umwandlungsgesetz 14.04.2025 (Eintragungsdatum)\n\nAquila Real II GmbH\nGesellschaft mit beschränkter Haftung\nHamburg\n\nAls nicht eingetragen wird bekannt gemacht:\nDen Gläubigern der an der Verschmelzung beteiligten Gesellschaften ist, wenn sie binnen sechs Monaten nach dem Tag, an dem die Eintragung der Verschmelzung in das Register des Sitzes desjenigen Rechtsträgers, dessen Gläubiger sie sind, nach § 19 Absatz 3 UmwG als bekannt gemacht gilt, ihren Anspruch nach Grund und Höhe schriftlich anmelden, Sicherheit zu leisten, soweit sie nicht Befriedigung verlangen können. Dieses Recht steht den Gläubigern jedoch nur zu, wenn sie glaubhaft machen, dass durch die Verschmelzung die Erfüllung ihrer Forderung gefährdet wird."
    },
    {
      "date": "2025-04-14",
      "id": "106441",
      "original_text": "Einreichung neuer Dokumente\nBaden-Württemberg Amtsgericht Stuttgart HRB 108078\nHeilbronner Versorgungs GmbH – Heilbronn",
      "type": "Einreichung neuer Dokumente",
      "state": "Baden-Württemberg",
      "amtsgericht": "Amtsgericht Stuttgart",
      "registernummer": "HRB 108078",
      "registerart": "HRB",
      "company_name": "Heilbronner Versorgungs GmbH",
      "company_seat": "Heilbronn",
      "details": "14.04.2025 (Bekanntmachungsdatum)\n\nBaden-Württemberg Amtsgericht Stuttgart HRB 108078\nEinreichung neuer Dokumente\n\nHeilbronner Versorgungs GmbH\nGesellschaft mit beschränkter Haftung\nHeilbronn\n\nDie Gesellschaft hat am 11.04.2025 die Liste über die Zusammensetzung des Aufsichtsrats zum Handelsregister eingereicht."
    },
    {
      "date": "2025-04-14",
      "id": "106442",
      "original_text": "Registerbekanntmachung nach dem Umwandlungsgesetz\nBerlin Amtsgericht Berlin (Charlottenburg) HRB 219677\nGelbart Legal Rechtsanwaltsgesellschaft mbH – Berlin",
      "type": "Registerbekanntmachung nach dem Umwandlungsgesetz",
      "state": "Berlin",
      "amtsgericht": "Amtsgericht Berlin (Charlottenburg)",
      "registernummer": "HRB 219677",
      "registerart": "HRB",
      "company_name": "Gelbart Legal Rechtsanwaltsgesellschaft mbH",
      "company_seat": "Berlin",
      "details": "14.04.2025 (Bekanntmachungsdatum)\n\nBerlin Amtsgericht Berlin (Charlottenburg) HRB 219677\nRegisterbekanntmachung nach dem Umwandlungsgesetz 11.04.2025 (Eintragungsdatum)\n\nGelbart Legal Rechtsanwaltsgesellschaft mbH\nGesellschaft mit beschränkter Haftung\nBerlin\n\nZu Eintragungsnummer 3 vom 11.04.2025 wird als nicht eingetragen veröffentlicht: Den Gläubigern ist, wenn sie binnen sechs Monaten nach dem Tag, an dem die Eintragung der Umwandlung als bekannt gemacht gilt, ihren Anspruch nach Grund und Höhe schriftlich anmelden, Sicherheit zu leisten, soweit sie nicht Befriedigung verlangen können. Dieses Recht steht den Gläubigern jedoch nur zu, wenn sie glaubhaft machen, dass durch die Umwandlung die Erfüllung ihrer Forderung gefährdet wird. Das Recht, Sicherheitsleistung zu verlangen, steht Gläubigern nicht zu, die im Falle der Insolvenz ein Recht auf vorzugsweise Befriedigung aus einer Deckungsmasse haben, die nach gesetzlicher Vorschrift zu ihrem Schutz errichtet und staatlich überwacht ist."
    },
    {
      "date": "2025-04-14",
      "id": "106443",
      "original_text": "Löschungsankündigung\nBaden-Württemberg Amtsgericht Ulm HRB 747727\nHypeCommerce UG (haftungsbeschränkt) – Friedrichshafen",
      "type": "Löschungsankündigung",
      "state": "Baden-Württemberg",
      "amtsgericht": "Amtsgericht Ulm",
      "registernummer": "HRB 747727",
      "registerart": "HRB",
      "company_name": "HypeCommerce UG (haftungsbeschränkt)",
      "company_seat": "Friedrichshafen",
      "details": "14.04.2025 (Bekanntmachungsdatum)\n\nBaden-Württemberg Amtsgericht Ulm HRB 747727\nLöschungsankündigung\n\nHypeCommerce UG (haftungsbeschränkt)\nGesellschaft mit beschränkter Haftung\nFriedrichshafen\n\nAls nicht eingetragen wird bekanntgemacht:\nDas Gericht beabsichtigt, die Gesellschaft wegen Vermögenslosigkeit im Handelsregister von Amts wegen nach § 394 FamFG zu löschen. Die Frist zur Geltendmachung eines Widerspruchs gegen die beabsichtigte Löschung ist auf  einen Monat ab Veröffentlichung bestimmt."
    },
    {
      "date": "2025-04-14",
      "id": "106444",
      "original_text": "Löschungsankündigung\nBrandenburg Amtsgericht Potsdam HRB 38266\nPV Elektro & Service GmbH – Ludwigsfelde",
      "type": "Löschungsankündigung",
      "state": "Brandenburg",
      "amtsgericht": "Amtsgericht Potsdam",
      "registernummer": "HRB 38266",
      "registerart": "HRB",
      "company_name": "PV Elektro & Service GmbH",
      "company_seat": "Ludwigsfelde",
      "details": "14.04.2025 (Bekanntmachungsdatum)\n\nBrandenburg Amtsgericht Potsdam HRB 38266\nLöschungsankündigung\n\nPV Elektro & Service GmbH\nGesellschaft mit beschränkter Haftung\nLudwigsfelde\n\nBei der nachstehenden Gesellschaft wird das Amtslöschungsverfahren gemäß § 394 FamFG eingeleitet. Widerspruchsfrist 8 Wochen."
    },
    {
      "date": "2025-04-14",
      "id": "106445",
      "original_text": "Registerbekanntmachung nach dem Umwandlungsgesetz\nSchleswig-Holstein Amtsgericht Kiel HRB 11298\nConduent Service Center GmbH – Kiel",
      "type": "Registerbekanntmachung nach dem Umwandlungsgesetz",
      "state": "Schleswig-Holstein",
      "amtsgericht": "Amtsgericht Kiel",
      "registernummer": "HRB 11298",
      "registerart": "HRB",
      "company_name": "Conduent Service Center GmbH",
      "company_seat": "Kiel",
      "details": "14.04.2025 (Bekanntmachungsdatum)\n\nSchleswig-Holstein Amtsgericht Kiel HRB 11298\nRegisterbekanntmachung nach dem Umwandlungsgesetz 11.04.2025 (Eintragungsdatum)\n\nConduent Service Center GmbH\nGesellschaft mit beschränkter Haftung\nKiel\n\nZu Eintragungsnummer 14 vom 11.04.2025 wird als nicht eingetragen veröffentlicht: Den Gläubigern der an der Verschmelzung beteiligten Rechtsträger ist, wenn sie binnen sechs Monaten nach dem Tag, an dem die Eintragung der Verschmelzung in das Register des Sitzes desjenigen Rechtsträgers, dessen Gläubiger sie sind, nach § 19 Abs. 3 UmwG bekannt gemacht worden ist, ihren Anspruch nach Grund und Höhe schriftlich anmelden, Sicherheit zu leisten, soweit sie nicht Befriedigung verlangen können. Dieses Recht steht den Gläubigern jedoch nur zu, wenn sie glaubhaft machen, dass durch die Verschmelzung die Erfüllung ihrer Forderung gefährdet wird."
    },
    {
      "date": "2025-04-14",
      "id": "106446",
      "original_text": "Registerbekanntmachung nach dem Umwandlungsgesetz\nSachsen-Anhalt Amtsgericht Stendal HRB 2688\nPretz GmbH – Gardelegen",
      "type": "Registerbekanntmachung nach dem Umwandlungsgesetz",
      "state": "Sachsen-Anhalt",
      "amtsgericht": "Amtsgericht Stendal",
      "registernummer": "HRB 2688",
      "registerart": "HRB",
      "company_name": "Pretz GmbH",
      "company_seat": "Gardelegen",
      "details": "14.04.2025 (Bekanntmachungsdatum)\n\nSachsen-Anhalt Amtsgericht Stendal HRB 2688\nRegisterbekanntmachung nach dem Umwandlungsgesetz 14.04.2025 (Eintragungsdatum)\n\nPretz GmbH\nGesellschaft mit beschränkter Haftung\nGardelegen\n\nDie Gesellschaft ist auf Grund des Verschmelzungsvertrages vom 17.02.2025 sowie des Beschlusses der Gesellschafterversammlung vom selben Tag mit dem Vermögen des Alleingesellschafters Thomas Pretz, Oldenburg, *10.04.1962, verschmolzen. Nicht eingetragen:\nDen Gläubigern der an der Verschmelzung beteiligten Rechtsträger ist, wenn sie binnen sechs Monaten nach dem Tag, an dem die Eintragung der Verschmelzung nach § 19 Abs. 3 UmwG als bekanntgemacht gilt, ihren Anspruch nach Grund und Höhe schriftlich anmelden, Sicherheit zu leisten, soweit sie nicht Befriedigung verlangen können. Dieses Recht steht ihnen jedoch nur zu, wenn sie glaubhaft machen, dass durch die Verschmelzung die Erfüllung ihrer Forderung gefährdet wird."
    },
    {
      "date": "2025-04-14",
      "id": "106447",
      "original_text": "Registerbekanntmachung nach dem Umwandlungsgesetz\nBerlin Amtsgericht Berlin (Charlottenburg) HRB 96419\nDATA REAL Meßtechnik GmbH – Berlin",
      "type": "Registerbekanntmachung nach dem Umwandlungsgesetz",
      "state": "Berlin",
      "amtsgericht": "Amtsgericht Berlin (Charlottenburg)",
      "registernummer": "HRB 96419",
      "registerart": "HRB",
      "company_name": "DATA REAL Meßtechnik GmbH",
      "company_seat": "Berlin",
      "details": "14.04.2025 (Bekanntmachungsdatum)\n\nBerlin Amtsgericht Berlin (Charlottenburg) HRB 96419\nRegisterbekanntmachung nach dem Umwandlungsgesetz 11.04.2025 (Eintragungsdatum)\n\nDATA REAL Meßtechnik GmbH\nGesellschaft mit beschränkter Haftung\nBerlin\n\nZu Eintragungsnummer 10 vom 11.04.2025 wird als nicht eingetragen veröffentlicht:Den Gläubigern der an der Verschmelzung beteiligten Rechtsträger ist, wenn sie binnen sechs Monaten nach dem Tag, an dem die Eintragung der Verschmelzung in das Register des Sitzes desjenigen Rechtsträgers, dessen Gläubiger sie sind, als bekannt gemacht gilt, ihren Anspruch nach Grund und Höhe schriftlich anmelden, Sicherheit zu leisten, soweit sie nicht Befriedigung verlangen können. Dieses Recht steht den Gläubigern jedoch nur zu, wenn sie glaubhaft machen, dass durch die Verschmelzung die Erfüllung ihrer Forderung gefährdet wird. Das Recht, Sicherheitsleistung zu verlangen, steht Gläubigern nicht zu, die im Falle der Insolvenz ein Recht auf vorzugsweise Befriedigung aus einer Deckungsmasse haben, die nach gesetzlicher Vorschrift zu ihrem Schutz errichtet und staatlich überwacht ist."
    },
    {
      "date": "2025-04-14",
      "id": "106448",
      "original_text": "Registerbekanntmachung nach dem Umwandlungsgesetz\nBaden-Württemberg Amtsgericht Freiburg HRB 726458\nWesslein Holding GmbH – Stockach",
      "type": "Registerbekanntmachung nach dem Umwandlungsgesetz",
      "state": "Baden-Württemberg",
      "amtsgericht": "Amtsgericht Freiburg",
      "registernummer": "HRB 726458",
      "registerart": "HRB",
      "company_name": "Wesslein Holding GmbH",
      "company_seat": "Stockach",
      "details": "14.04.2025 (Bekanntmachungsdatum)\n\nBaden-Württemberg Amtsgericht Freiburg HRB 726458\nRegisterbekanntmachung nach dem Umwandlungsgesetz 14.04.2025 (Eintragungsdatum)\n\nWesslein Holding GmbH\nGesellschaft mit beschränkter Haftung\nStockach\n\nDie \"Wesslein Immobilien GmbH\", Stockach (Amtsgericht Freiburg, HRB 727162), ist gemäß Vertrag und Beschlüssen vom 08.04.2025 mit dieser Gesellschaft verschmolzen. Den Gläubigern der an der Verschmelzung beteiligten Rechtsträger ist, wenn sie binnen sechs Monaten nach dem Tag, an dem die Eintragung der Verschmelzung in das Register des Sitzes desjenigen Rechtsträgers, dessen Gläubiger sie sind, nach § 19 Abs. 3 UmwG als bekanntgemacht gilt, ihren Anspruch nach Grund und Höhe schriftlich anmelden, Sicherheit zu leisten, soweit sie nicht Befriedigung verlangen können. Dieses Recht steht den Gläubigern jedoch nur zu, wenn sie glaubhaft machen, dass durch die Verschmelzung die Erfüllung ihrer Forderung gefährdet wird."
    },
    {
      "date": "2025-04-14",
      "id": "106449",
      "original_text": "Registerbekanntmachung nach dem Umwandlungsgesetz\nBaden-Württemberg Amtsgericht Freiburg HRB 727162\nWesslein Immobilien GmbH – Stockach",
      "type": "Registerbekanntmachung nach dem Umwandlungsgesetz",
      "state": "Baden-Württemberg",
      "amtsgericht": "Amtsgericht Freiburg",
      "registernummer": "HRB 727162",
      "registerart": "HRB",
      "company_name": "Wesslein Immobilien GmbH",
      "company_seat": "Stockach",
      "details": "14.04.2025 (Bekanntmachungsdatum)\n\nBaden-Württemberg Amtsgericht Freiburg HRB 727162\nRegisterbekanntmachung nach dem Umwandlungsgesetz 14.04.2025 (Eintragungsdatum)\n\nWesslein Immobilien GmbH\nGesellschaft mit beschränkter Haftung\nStockach\n\nAls nicht eingetragen wird bekanntgemacht:\nDen Gläubigern der an der Verschmelzung beteiligten Rechtsträger ist, wenn sie binnen sechs Monaten nach dem Tag, an dem die Eintragung der Verschmelzung in das Register des Sitzes desjenigen Rechtsträgers, dessen Gläubiger sie sind, nach § 19 Abs. 3 UmwG als bekanntgemacht gilt, ihren Anspruch nach Grund und Höhe schriftlich anmelden, Sicherheit zu leisten, soweit sie nicht Befriedigung verlangen können. Dieses Recht steht den Gläubigern jedoch nur zu, wenn sie glaubhaft machen, dass durch die Verschmelzung die Erfüllung ihrer Forderung gefährdet wird."
    },
    {
      "date": "2025-04-14",
      "id": "106450",
      "original_text": "Registerbekanntmachung nach dem Umwandlungsgesetz\nBerlin Amtsgericht Berlin (Charlottenburg) HRB 86733\nares e-count GmbH – Berlin",
      "type": "Registerbekanntmachung nach dem Umwandlungsgesetz",
      "state": "Berlin",
      "amtsgericht": "Amtsgericht Berlin (Charlottenburg)",
      "registernummer": "HRB 86733",
      "registerart": "HRB",
      "company_name": "ares e-count GmbH",
      "company_seat": "Berlin",
      "details": "14.04.2025 (Bekanntmachungsdatum)\n\nBerlin Amtsgericht Berlin (Charlottenburg) HRB 86733\nRegisterbekanntmachung nach dem Umwandlungsgesetz 11.04.2025 (Eintragungsdatum)\n\nares e-count GmbH\nGesellschaft mit beschränkter Haftung\nBerlin\n\nZu Eintragungsnummer 9 vom 11.04.2025 wird als nicht eingetragen veröffentlicht:Den Gläubigern der an der Verschmelzung beteiligten Rechtsträger ist, wenn sie binnen sechs Monaten nach dem Tag, an dem die Eintragung der Verschmelzung in das Register des Sitzes desjenigen Rechtsträgers, dessen Gläubiger sie sind, als bekannt gemacht gilt, ihren Anspruch nach Grund und Höhe schriftlich anmelden, Sicherheit zu leisten, soweit sie nicht Befriedigung verlangen können. Dieses Recht steht den Gläubigern jedoch nur zu, wenn sie glaubhaft machen, dass durch die Verschmelzung die Erfüllung ihrer Forderung gefährdet wird. Das Recht, Sicherheitsleistung zu verlangen, steht Gläubigern nicht zu, die im Falle der Insolvenz ein Recht auf vorzugsweise Befriedigung aus einer Deckungsmasse haben, die nach gesetzlicher Vorschrift zu ihrem Schutz errichtet und staatlich überwacht ist."
    },
    {
      "date": "2025-04-14",
      "id": "106451",
      "original_text": "Sonstige Registerbekanntmachung\nBerlin Amtsgericht Berlin (Charlottenburg) HRB 86733\nares e-count GmbH – Berlin",
      "type": "Sonstige Registerbekanntmachung",
      "state": "Berlin",
      "amtsgericht": "Amtsgericht Berlin (Charlottenburg)",
      "registernummer": "HRB 86733",
      "registerart": "HRB",
      "company_name": "ares e-count GmbH",
      "company_seat": "Berlin",
      "details": "14.04.2025 (Bekanntmachungsdatum)\n\nBerlin Amtsgericht Berlin (Charlottenburg) HRB 86733\nSonstige Registerbekanntmachung\n\nares e-count GmbH\nGesellschaft mit beschränkter Haftung\nBerlin\n\nAls nicht eingetragen wird veröffentlicht: Der andere Vertragsteil hat den Gläubigern dieses Rechtsträgers, deren Forderungen begründet worden sind, bevor die Eintragung der Beendigung dieses Vertrages in das Handelsregister nach § 10 des Handelsgesetzbuches als bekannt gemacht gilt, Sicherheit zu leisten, wenn sie sich binnen sechs Monaten nach der Bekanntmachung der Eintragung zu diesem Zweck bei ihm melden. Dieses Recht steht den Gläubigern nicht zu, die im Fall des Insolvenzverfahrens ein Recht auf vorzugsweise Befriedigung aus der Deckungsmasse haben, die nach gesetzlicher Vorschrift zu ihrem Schutz errichtet und staatlich überwacht ist."
    },
    {
      "date": "2025-04-14",
      "id": "106452",
      "original_text": "Registerbekanntmachung nach dem Umwandlungsgesetz\nBerlin Amtsgericht Berlin (Charlottenburg) HRB 207558\nnuma group GmbH – Berlin",
      "type": "Registerbekanntmachung nach dem Umwandlungsgesetz",
      "state": "Berlin",
      "amtsgericht": "Amtsgericht Berlin (Charlottenburg)",
      "registernummer": "HRB 207558",
      "registerart": "HRB",
      "company_name": "numa group GmbH",
      "company_seat": "Berlin",
      "details": "14.04.2025 (Bekanntmachungsdatum)\n\nBerlin Amtsgericht Berlin (Charlottenburg) HRB 207558\nRegisterbekanntmachung nach dem Umwandlungsgesetz\n\nnuma group GmbH\nGesellschaft mit beschränkter Haftung\nBerlin\n\nAls nicht eingetragen wird veröffentlicht: Die Gesellschaft hat den Umwandlungsplan vom 10.04.2025 gemäß Art 2, 37 SE-VO betreffend den Kettenformwechsel in eine Aktiengesellschaft und anschließend die Umwandlung in eine Europäische Gesellschaft (SE) zur Offenlegung gemäß Art. 37 Absatz 5 SE-VO zum Handelsregister des Amtsgericht Charlottenburg eingereicht."
    },
    {
      "date": "2025-04-14",
      "id": "106453",
      "original_text": "Registerbekanntmachung nach dem Umwandlungsgesetz\nBaden-Württemberg Amtsgericht Stuttgart HRB 737222\nTÜV SÜD Auto Plus GmbH – Stuttgart",
      "type": "Registerbekanntmachung nach dem Umwandlungsgesetz",
      "state": "Baden-Württemberg",
      "amtsgericht": "Amtsgericht Stuttgart",
      "registernummer": "HRB 737222",
      "registerart": "HRB",
      "company_name": "TÜV SÜD Auto Plus GmbH",
      "company_seat": "Stuttgart",
      "details": "14.04.2025 (Bekanntmachungsdatum)\n\nBaden-Württemberg Amtsgericht Stuttgart HRB 737222\nRegisterbekanntmachung nach dem Umwandlungsgesetz 14.04.2025 (Eintragungsdatum)\n\nTÜV SÜD Auto Plus GmbH\nGesellschaft mit beschränkter Haftung\nStuttgart\n\nAls nicht eingetragen wird bekanntgemacht:\nDen Gläubigern der an der Verschmelzung beteiligten Rechtsträger ist, wenn sie binnen sechs Monaten nach dem Tag, an dem die Eintragung der Verschmelzung in das Register des Sitzes desjenigen Rechtsträgers, dessen Gläubiger sie sind, nach § 19 Abs. 3 UmwG als bekanntgemacht gilt, ihren Anspruch nach Grund und Höhe schriftlich anmelden, Sicherheit zu leisten, soweit sie nicht Befriedigung verlangen können. Dieses Recht steht den Gläubigern jedoch nur zu, wenn sie glaubhaft machen, dass durch die Verschmelzung die Erfüllung ihrer Forderung gefährdet wird."
    },
    {
      "date": "2025-04-14",
      "id": "106454",
      "original_text": "Löschungsankündigung\nBaden-Württemberg Amtsgericht Freiburg HRB 722987\ncheck1 GmbH – Freiburg im Breisgau",
      "type": "Löschungsankündigung",
      "state": "Baden-Württemberg",
      "amtsgericht": "Amtsgericht Freiburg",
      "registernummer": "HRB 722987",
      "registerart": "HRB",
      "company_name": "check1 GmbH",
      "company_seat": "Freiburg im Breisgau",
      "details": "14.04.2025 (Bekanntmachungsdatum)\n\nBaden-Württemberg Amtsgericht Freiburg HRB 722987\nLöschungsankündigung\n\ncheck1 GmbH\nGesellschaft mit beschränkter Haftung\nFreiburg im Breisgau\n\nDas Gericht beabsichtigt, die Gesellschaft wegen Vermögenslosigkeit im Handelsregister von Amts wegen nach § 394 FamFG zu löschen. Die Frist zur Geltendmachung eines Widerspruchs gegen die beabsichtigte Löschung ist auf einen Monat ab Veröffentlichung bestimmt."
    },
    {
      "date": "2025-04-14",
      "id": "106455",
      "original_text": "Registerbekanntmachung nach dem Umwandlungsgesetz\nBaden-Württemberg Amtsgericht Freiburg HRB 715092\nenvisia digital solutions GmbH – Freiburg im Breisgau",
      "type": "Registerbekanntmachung nach dem Umwandlungsgesetz",
      "state": "Baden-Württemberg",
      "amtsgericht": "Amtsgericht Freiburg",
      "registernummer": "HRB 715092",
      "registerart": "HRB",
      "company_name": "envisia digital solutions GmbH",
      "company_seat": "Freiburg im Breisgau",
      "details": "14.04.2025 (Bekanntmachungsdatum)\n\nBaden-Württemberg Amtsgericht Freiburg HRB 715092\nRegisterbekanntmachung nach dem Umwandlungsgesetz 14.04.2025 (Eintragungsdatum)\n\nenvisia digital solutions GmbH\nGesellschaft mit beschränkter Haftung\nFreiburg im Breisgau\n\nAls nicht eingetragen wird bekanntgemacht:\nDen Gläubigern der an der Verschmelzung beteiligten Rechtsträger ist, wenn sie binnen sechs Monaten nach dem Tag, an dem die Eintragung der Verschmelzung in das Register des Sitzes desjenigen Rechtsträgers, dessen Gläubiger sie sind, nach § 19 Abs. 3 UmwG als bekanntgemacht gilt, ihren Anspruch nach Grund und Höhe schriftlich anmelden, Sicherheit zu leisten, soweit sie nicht Befriedigung verlangen können. Dieses Recht steht den Gläubigern jedoch nur zu, wenn sie glaubhaft machen, dass durch die Verschmelzung die Erfüllung ihrer Forderung gefährdet wird."
    },
    {
      "date": "2025-04-14",
      "id": "106456",
      "original_text": "Löschungsankündigung\nBerlin Amtsgericht Berlin (Charlottenburg) HRB 210409\nQuality Green Deutschland GmbH – Berlin",
      "type": "Löschungsankündigung",
      "state": "Berlin",
      "amtsgericht": "Amtsgericht Berlin (Charlottenburg)",
      "registernummer": "HRB 210409",
      "registerart": "HRB",
      "company_name": "Quality Green Deutschland GmbH",
      "company_seat": "Berlin",
      "details": "14.04.2025 (Bekanntmachungsdatum)\n\nBerlin Amtsgericht Berlin (Charlottenburg) HRB 210409\nLöschungsankündigung\n\nQuality Green Deutschland GmbH\nGesellschaft mit beschränkter Haftung\nBerlin\n\nBei der nachstehenden Gesellschaft wird das Amtslöschungsverfahren gemäß § 394 FamFG eingeleitet. Widerspruchsfrist 6 Wochen"
    },
    {
      "date": "2025-04-14",
      "id": "106457",
      "original_text": "Registerbekanntmachung nach dem Umwandlungsgesetz\nBaden-Württemberg Amtsgericht Freiburg HRA 700242\nLapp GmbH & Co. KG – Freiburg im Breisgau",
      "type": "Registerbekanntmachung nach dem Umwandlungsgesetz",
      "state": "Baden-Württemberg",
      "amtsgericht": "Amtsgericht Freiburg",
      "registernummer": "HRA 700242",
      "registerart": "HRA",
      "company_name": "Lapp GmbH & Co. KG",
      "company_seat": "Freiburg im Breisgau",
      "details": "14.04.2025 (Bekanntmachungsdatum)\n\nBaden-Württemberg Amtsgericht Freiburg HRA 700242\nRegisterbekanntmachung nach dem Umwandlungsgesetz 14.04.2025 (Eintragungsdatum)\n\nLapp GmbH & Co. KG\nKommanditgesellschaft\nFreiburg im Breisgau\n\nAls nicht eingetragen wird bekanntgemacht:\nDen Gläubigern der an der Verschmelzung beteiligten Rechtsträger ist, wenn sie binnen sechs Monaten nach dem Tag, an dem die Eintragung der Verschmelzung in das Register des Sitzes desjenigen Rechtsträgers, dessen Gläubiger sie sind, nach § 19 Abs. 3 UmwG als bekanntgemacht gilt, ihren Anspruch nach Grund und Höhe schriftlich anmelden, Sicherheit zu leisten, soweit sie nicht Befriedigung verlangen können. Dieses Recht steht den Gläubigern jedoch nur zu, wenn sie glaubhaft machen, dass durch die Verschmelzung die Erfüllung ihrer Forderung gefährdet wird."
    },
    {
      "date": "2025-04-14",
      "id": "106458",
      "original_text": "Löschungsankündigung\nBerlin Amtsgericht Berlin (Charlottenburg) HRB 112307\nSolways - Reisen GmbH – Berlin",
      "type": "Löschungsankündigung",
      "state": "Berlin",
      "amtsgericht": "Amtsgericht Berlin (Charlottenburg)",
      "registernummer": "HRB 112307",
      "registerart": "HRB",
      "company_name": "Solways - Reisen GmbH",
      "company_seat": "Berlin",
      "details": "14.04.2025 (Bekanntmachungsdatum)\n\nBerlin Amtsgericht Berlin (Charlottenburg) HRB 112307\nLöschungsankündigung\n\nSolways - Reisen GmbH\nGesellschaft mit beschränkter Haftung\nBerlin\n\nBei der nachstehenden Gesellschaft wird das Amtslöschungsverfahren gemäß § 394 FamFG eingeleitet. Widerspruchsfrist 6 Wochen"
    },
    {
      "date": "2025-04-14",
      "id": "106459",
      "original_text": "Registerbekanntmachung nach dem Umwandlungsgesetz\nMecklenburg-Vorpommern Amtsgericht Rostock HRA 5032\nUGE Hombressen Eins GmbH & Co. KG Umweltgerechte Energie – Lohmen",
      "type": "Registerbekanntmachung nach dem Umwandlungsgesetz",
      "state": "Mecklenburg-Vorpommern",
      "amtsgericht": "Amtsgericht Rostock",
      "registernummer": "HRA 5032",
      "registerart": "HRA",
      "company_name": "UGE Hombressen Eins GmbH & Co. KG Umweltgerechte Energie",
      "company_seat": "Lohmen",
      "details": "14.04.2025 (Bekanntmachungsdatum)\n\nMecklenburg-Vorpommern Amtsgericht Rostock HRA 5032\nRegisterbekanntmachung nach dem Umwandlungsgesetz 14.04.2025 (Eintragungsdatum)\n\nUGE Hombressen Eins GmbH & Co. KG Umweltgerechte Energie\nKommanditgesellschaft\nLohmen\n\nDie Gesellschaft hat Gläubigern, deren Forderungen vor dieser Bekanntmachung begründet worden sind, Sicherheit zu leisten, soweit sie nicht Befriedigung verlangen können, wenn sie sich binnen sechs Monaten zu diesem Zweck melden."
    },
    {
      "date": "2025-04-14",
      "id": "106460",
      "original_text": "Registerbekanntmachung nach dem Umwandlungsgesetz\nMecklenburg-Vorpommern Amtsgericht Rostock HRA 5035\nUGE Hombressen Zwei GmbH & Co. KG Umweltgerechte Energie – Lohmen",
      "type": "Registerbekanntmachung nach dem Umwandlungsgesetz",
      "state": "Mecklenburg-Vorpommern",
      "amtsgericht": "Amtsgericht Rostock",
      "registernummer": "HRA 5035",
      "registerart": "HRA",
      "company_name": "UGE Hombressen Zwei GmbH & Co. KG Umweltgerechte Energie",
      "company_seat": "Lohmen",
      "details": "14.04.2025 (Bekanntmachungsdatum)\n\nMecklenburg-Vorpommern Amtsgericht Rostock HRA 5035\nRegisterbekanntmachung nach dem Umwandlungsgesetz 14.04.2025 (Eintragungsdatum)\n\nUGE Hombressen Zwei GmbH & Co. KG Umweltgerechte Energie\nKommanditgesellschaft\nLohmen\n\nDie Gesellschaft hat Gläubigern, deren Forderungen vor dieser Bekanntmachung begründet worden sind, Sicherheit zu leisten, soweit sie nicht Befriedigung verlangen können, wenn sie sich binnen sechs Monaten zu diesem Zweck melden."
    },
    {
      "date": "2025-04-14",
      "id": "106461",
      "original_text": "Registerbekanntmachung nach dem Umwandlungsgesetz\nMecklenburg-Vorpommern Amtsgericht Rostock HRA 4801\nUGE Boizenburg Zwei GmbH & Co. KG Umweltgerechte Energie – Lohmen",
      "type": "Registerbekanntmachung nach dem Umwandlungsgesetz",
      "state": "Mecklenburg-Vorpommern",
      "amtsgericht": "Amtsgericht Rostock",
      "registernummer": "HRA 4801",
      "registerart": "HRA",
      "company_name": "UGE Boizenburg Zwei GmbH & Co. KG Umweltgerechte Energie",
      "company_seat": "Lohmen",
      "details": "14.04.2025 (Bekanntmachungsdatum)\n\nMecklenburg-Vorpommern Amtsgericht Rostock HRA 4801\nRegisterbekanntmachung nach dem Umwandlungsgesetz 14.04.2025 (Eintragungsdatum)\n\nUGE Boizenburg Zwei GmbH & Co. KG Umweltgerechte Energie\nKommanditgesellschaft\nLohmen\n\nDie Gesellschaft hat Gläubigern, deren Forderungen vor dieser Bekanntmachung begründet worden sind, Sicherheit zu leisten, soweit sie nicht Befriedigung verlangen können, wenn sie sich binnen sechs Monaten zu diesem Zweck melden."
    },
    {
      "date": "2025-04-14",
      "id": "106462",
      "original_text": "Einreichung neuer Dokumente\nBaden-Württemberg Amtsgericht Ulm HRB 701828\nARADEX Aktiengesellschaft – Lorch",
      "type": "Einreichung neuer Dokumente",
      "state": "Baden-Württemberg",
      "amtsgericht": "Amtsgericht Ulm",
      "registernummer": "HRB 701828",
      "registerart": "HRB",
      "company_name": "ARADEX Aktiengesellschaft",
      "company_seat": "Lorch",
      "details": "14.04.2025 (Bekanntmachungsdatum)\n\nBaden-Württemberg Amtsgericht Ulm HRB 701828\nEinreichung neuer Dokumente 14.04.2025 (Eintragungsdatum)\n\nARADEX Aktiengesellschaft\nAktiengesellschaft\nLorch\n\nDie Gesellschaft hat am 01.04.2025 die Liste über die Zusammensetzung des Aufsichtsrats zum Handelsregister eingereicht."
    },
    {
      "date": "2025-04-14",
      "id": "106463",
      "original_text": "Registerbekanntmachung nach dem Umwandlungsgesetz\nMecklenburg-Vorpommern Amtsgericht Rostock HRA 4655\nUGE Boizenburg GmbH & Co. KG Umweltgerechte Energie – Lohmen",
      "type": "Registerbekanntmachung nach dem Umwandlungsgesetz",
      "state": "Mecklenburg-Vorpommern",
      "amtsgericht": "Amtsgericht Rostock",
      "registernummer": "HRA 4655",
      "registerart": "HRA",
      "company_name": "UGE Boizenburg GmbH & Co. KG Umweltgerechte Energie",
      "company_seat": "Lohmen",
      "details": "14.04.2025 (Bekanntmachungsdatum)\n\nMecklenburg-Vorpommern Amtsgericht Rostock HRA 4655\nRegisterbekanntmachung nach dem Umwandlungsgesetz 14.04.2025 (Eintragungsdatum)\n\nUGE Boizenburg GmbH & Co. KG Umweltgerechte Energie\nKommanditgesellschaft\nLohmen\n\nDie Gesellschaft hat Gläubigern, deren Forderungen vor dieser Bekanntmachung begründet worden sind, Sicherheit zu leisten, soweit sie nicht Befriedigung verlangen können, wenn sie sich binnen sechs Monaten zu diesem Zweck melden."
    },
    {
      "date": "2025-04-14",
      "id": "106464",
      "original_text": "Einreichung neuer Dokumente\nHamburg Amtsgericht Hamburg HRB 144213\nSDA SE Open Industry Solutions – Hamburg",
      "type": "Einreichung neuer Dokumente",
      "state": "Hamburg",
      "amtsgericht": "Amtsgericht Hamburg",
      "registernummer": "HRB 144213",
      "registerart": "HRB",
      "company_name": "SDA SE Open Industry Solutions",
      "company_seat": "Hamburg",
      "details": "14.04.2025 (Bekanntmachungsdatum)\n\nHamburg Amtsgericht Hamburg HRB 144213\nEinreichung neuer Dokumente\n\nSDA SE Open Industry Solutions\nEuropäische Aktiengesellschaft (SE)\nHamburg\n\nAls nicht eingetragen wird bekannt gemacht: Liste des Aufsichtsrats wurde eingereicht."
    },
    {
      "date": "2025-04-14",
      "id": "106465",
      "original_text": "Löschungsankündigung\nBerlin Amtsgericht Berlin (Charlottenburg) HRB 168291\nNorSale UG (haftungsbeschränkt) – Berlin",
      "type": "Löschungsankündigung",
      "state": "Berlin",
      "amtsgericht": "Amtsgericht Berlin (Charlottenburg)",
      "registernummer": "HRB 168291",
      "registerart": "HRB",
      "company_name": "NorSale UG (haftungsbeschränkt)",
      "company_seat": "Berlin",
      "details": "14.04.2025 (Bekanntmachungsdatum)\n\nBerlin Amtsgericht Berlin (Charlottenburg) HRB 168291\nLöschungsankündigung\n\nNorSale UG (haftungsbeschränkt)\nGesellschaft mit beschränkter Haftung\nBerlin\n\nBei der nachstehenden Gesellschaft wird das Amtslöschungsverfahren gemäß § 394 FamFG eingeleitet. Widerspruchsfrist 6 Wochen"
    },
    {
      "date": "2025-04-14",
      "id": "106466",
      "original_text": "Löschungsankündigung\nBrandenburg Amtsgericht Frankfurt/Oder HRB 3794\nPLASMACTOR Umwelttechnik GmbH – Britz",
      "type": "Löschungsankündigung",
      "state": "Brandenburg",
      "amtsgericht": "Amtsgericht Frankfurt/Oder",
      "registernummer": "HRB 3794",
      "registerart": "HRB",
      "company_name": "PLASMACTOR Umwelttechnik GmbH",
      "company_seat": "Britz",
      "details": "14.04.2025 (Bekanntmachungsdatum)\n\nBrandenburg Amtsgericht Frankfurt/Oder HRB 3794\nLöschungsankündigung\n\nPLASMACTOR Umwelttechnik GmbH\nGesellschaft mit beschränkter Haftung\nBritz\n\nBei der nachstehenden Gesellschaft/dem nachstehenden Verein wird das Amtslöschungsverfahren gemäß § 395 FamFG eingeleitet."
    },
    {
      "date": "2025-04-14",
      "id": "106467",
      "original_text": "Registerbekanntmachung nach dem Umwandlungsgesetz\nBaden-Württemberg Amtsgericht Mannheim HRB 337832\nPeter Bock Aktiengesellschaft – Heidelberg",
      "type": "Registerbekanntmachung nach dem Umwandlungsgesetz",
      "state": "Baden-Württemberg",
      "amtsgericht": "Amtsgericht Mannheim",
      "registernummer": "HRB 337832",
      "registerart": "HRB",
      "company_name": "Peter Bock Aktiengesellschaft",
      "company_seat": "Heidelberg",
      "details": "14.04.2025 (Bekanntmachungsdatum)\n\nBaden-Württemberg Amtsgericht Mannheim HRB 337832\nRegisterbekanntmachung nach dem Umwandlungsgesetz 14.04.2025 (Eintragungsdatum)\n\nPeter Bock Aktiengesellschaft\nAktiengesellschaft\nHeidelberg\n\nDen Gläubigern des an dem Formwechsel beteiligten Rechtsträgers ist, wenn sie binnen sechs Monaten nach dem Tag, an dem die Eintragung des Formwechsels in das Register des Sitzes desjenigen Rechtsträgers, dessen Gläubiger sie sind, nach § 19 Abs. 3 UmwG als bekanntgemacht gilt, ihren Anspruch nach Grund und Höhe schriftlich anmelden, Sicherheit zu leisten, soweit sie nicht Befriedigung verlangen können. Dieses Recht steht den Gläubigern jedoch nur zu, wenn sie glaubhaft machen, dass durch den Formwechsel die Erfüllung ihrer Forderung gefährdet wird."
    },
    {
      "date": "2025-04-14",
      "id": "106468",
      "original_text": "Registerbekanntmachung nach dem Umwandlungsgesetz\nBaden-Württemberg Amtsgericht Freiburg GnR 410009\nMarkgräfler Winzer eG – Efringen-Kirchen",
      "type": "Registerbekanntmachung nach dem Umwandlungsgesetz",
      "state": "Baden-Württemberg",
      "amtsgericht": "Amtsgericht Freiburg",
      "registernummer": "GnR 410009",
      "registerart": "GnR",
      "company_name": "Markgräfler Winzer eG",
      "company_seat": "Efringen-Kirchen",
      "details": "14.04.2025 (Bekanntmachungsdatum)\n\nBaden-Württemberg Amtsgericht Freiburg GnR 410009\nRegisterbekanntmachung nach dem Umwandlungsgesetz 14.04.2025 (Eintragungsdatum)\n\nMarkgräfler Winzer eG\neingetragene Genossenschaft\nEfringen-Kirchen\n\nAls nicht eingetragen wird bekanntgemacht:\nDen Gläubigern der an der Verschmelzung beteiligten Rechtsträger ist, wenn sie binnen sechs Monaten nach dem Tag, an dem die Eintragung der Verschmelzung in das Register des Sitzes desjenigen Rechtsträgers, dessen Gläubiger sie sind, nach § 19 Abs. 3 UmwG als bekanntgemacht gilt, ihren Anspruch nach Grund und Höhe schriftlich anmelden, Sicherheit zu leisten, soweit sie nicht Befriedigung verlangen können. Dieses Recht steht den Gläubigern jedoch nur zu, wenn sie glaubhaft machen, dass durch die Verschmelzung die Erfüllung ihrer Forderung gefährdet wird."
    },
    {
      "date": "2025-04-14",
      "id": "106469",
      "original_text": "Registerbekanntmachung nach dem Umwandlungsgesetz\nBaden-Württemberg Amtsgericht Freiburg GnR 410089\nErste Markgräfler Winzergenossenschaft Schliengen-Müllheim eG – Schliengen",
      "type": "Registerbekanntmachung nach dem Umwandlungsgesetz",
      "state": "Baden-Württemberg",
      "amtsgericht": "Amtsgericht Freiburg",
      "registernummer": "GnR 410089",
      "registerart": "GnR",
      "company_name": "Erste Markgräfler Winzergenossenschaft Schliengen-Müllheim eG",
      "company_seat": "Schliengen",
      "details": "14.04.2025 (Bekanntmachungsdatum)\n\nBaden-Württemberg Amtsgericht Freiburg GnR 410089\nRegisterbekanntmachung nach dem Umwandlungsgesetz 14.04.2025 (Eintragungsdatum)\n\nErste Markgräfler Winzergenossenschaft Schliengen-Müllheim eG\neingetragene Genossenschaft\nSchliengen\n\nAls nicht eingetragen wird bekanntgemacht:\nDen Gläubigern der an der Verschmelzung beteiligten Rechtsträger ist, wenn sie binnen sechs Monaten nach dem Tag, an dem die Eintragung der Verschmelzung in das Register des Sitzes desjenigen Rechtsträgers, dessen Gläubiger sie sind, nach § 19 Abs. 3 UmwG als bekanntgemacht gilt, ihren Anspruch nach Grund und Höhe schriftlich anmelden, Sicherheit zu leisten, soweit sie nicht Befriedigung verlangen können. Dieses Recht steht den Gläubigern jedoch nur zu, wenn sie glaubhaft machen, dass durch die Verschmelzung die Erfüllung ihrer Forderung gefährdet wird."
    },
    {
      "date": "2025-04-14",
      "id": "106470",
      "original_text": "Löschungsankündigung\nBerlin Amtsgericht Berlin (Charlottenburg) HRB 156982\nEcoNat Wirtschaft und Natur GmbH – Berlin",
      "type": "Löschungsankündigung",
      "state": "Berlin",
      "amtsgericht": "Amtsgericht Berlin (Charlottenburg)",
      "registernummer": "HRB 156982",
      "registerart": "HRB",
      "company_name": "EcoNat Wirtschaft und Natur GmbH",
      "company_seat": "Berlin",
      "details": "14.04.2025 (Bekanntmachungsdatum)\n\nBerlin Amtsgericht Berlin (Charlottenburg) HRB 156982\nLöschungsankündigung\n\nEcoNat Wirtschaft und Natur GmbH\nGesellschaft mit beschränkter Haftung\nBerlin\n\nBei der nachstehenden Gesellschaft wird das Amtslöschungsverfahren gemäß § 394 FamFG eingeleitet. Widerspruchsfrist 6 Wochen"
    },
    {
      "date": "2025-04-14",
      "id": "106471",
      "original_text": "Löschungsankündigung\nBaden-Württemberg Amtsgericht Freiburg HRB 730819\nMS Dach- und Holzbau UG (haftungsbeschränkt) – Stühlingen",
      "type": "Löschungsankündigung",
      "state": "Baden-Württemberg",
      "amtsgericht": "Amtsgericht Freiburg",
      "registernummer": "HRB 730819",
      "registerart": "HRB",
      "company_name": "MS Dach- und Holzbau UG (haftungsbeschränkt)",
      "company_seat": "Stühlingen",
      "details": "14.04.2025 (Bekanntmachungsdatum)\n\nBaden-Württemberg Amtsgericht Freiburg HRB 730819\nLöschungsankündigung\n\nMS Dach- und Holzbau UG (haftungsbeschränkt)\nGesellschaft mit beschränkter Haftung\nStühlingen\n\nAls nicht eingetragen wird bekanntgemacht:\nDas Gericht beabsichtigt, die Gesellschaft wegen Vermögenslosigkeit im Handelsregister von Amts wegen nach § 394 FamFG zu löschen. Die Frist zur Geltendmachung eines Widerspruchs gegen die beabsichtigte Löschung ist auf einen Monat ab Veröffentlichung bestimmt."
    },
    {
      "date": "2025-04-14",
      "id": "106472",
      "original_text": "Registerbekanntmachung nach dem Umwandlungsgesetz\nBaden-Württemberg Amtsgericht Ulm HRB 741701\nAkllawasi UG (haftungsbeschränkt) – Ravensburg",
      "type": "Registerbekanntmachung nach dem Umwandlungsgesetz",
      "state": "Baden-Württemberg",
      "amtsgericht": "Amtsgericht Ulm",
      "registernummer": "HRB 741701",
      "registerart": "HRB",
      "company_name": "Akllawasi UG (haftungsbeschränkt)",
      "company_seat": "Ravensburg",
      "details": "14.04.2025 (Bekanntmachungsdatum)\n\nBaden-Württemberg Amtsgericht Ulm HRB 741701\nRegisterbekanntmachung nach dem Umwandlungsgesetz 14.04.2025 (Eintragungsdatum)\n\nAkllawasi UG (haftungsbeschränkt)\nGesellschaft mit beschränkter Haftung\nRavensburg\n\nAls nicht eingetragen wird bekanntgemacht:\nDen Gläubigern der an der Verschmelzung beteiligten Rechtsträger ist, wenn sie binnen sechs Monaten nach dem Tag, an dem die Eintragung der Verschmelzung in das Register des Sitzes desjenigen Rechtsträgers, dessen Gläubiger sie sind, nach § 19 Abs. 3 UmwG als bekanntgemacht gilt, ihren Anspruch nach Grund und Höhe schriftlich anmelden, Sicherheit zu leisten, soweit sie nicht Befriedigung verlangen können. Dieses Recht steht den Gläubigern jedoch nur zu, wenn sie glaubhaft machen, dass durch die Verschmelzung die Erfüllung ihrer Forderung gefährdet wird."
    },
    {
      "date": "2025-04-14",
      "id": "106473",
      "original_text": "Löschungsankündigung\nBaden-Württemberg Amtsgericht Stuttgart HRB 750965\nStiefel Gastro & Event GmbH – Denkendorf",
      "type": "Löschungsankündigung",
      "state": "Baden-Württemberg",
      "amtsgericht": "Amtsgericht Stuttgart",
      "registernummer": "HRB 750965",
      "registerart": "HRB",
      "company_name": "Stiefel Gastro & Event GmbH",
      "company_seat": "Denkendorf",
      "details": "14.04.2025 (Bekanntmachungsdatum)\n\nBaden-Württemberg Amtsgericht Stuttgart HRB 750965\nLöschungsankündigung\n\nStiefel Gastro & Event GmbH\nGesellschaft mit beschränkter Haftung\nDenkendorf\n\nDas Gericht beabsichtigt, die Gesellschaft wegen Vermögenslosigkeit im Handelsregister von Amts wegen nach § 394 FamFG zu löschen. Die Frist zur Geltendmachung eines Widerspruchs gegen die beabsichtigte Löschung ist auf zwei Monate ab Veröffentlichung bestimmt."
    },
    {
      "date": "2025-04-14",
      "id": "106474",
      "original_text": "Einreichung neuer Dokumente\nSchleswig-Holstein Amtsgericht Lübeck HRB 5809\nBQL Berufsausbildungs- und Qualifizierungsagentur Lübeck GmbH – Lübeck",
      "type": "Einreichung neuer Dokumente",
      "state": "Schleswig-Holstein",
      "amtsgericht": "Amtsgericht Lübeck",
      "registernummer": "HRB 5809",
      "registerart": "HRB",
      "company_name": "BQL Berufsausbildungs- und Qualifizierungsagentur Lübeck GmbH",
      "company_seat": "Lübeck",
      "details": "14.04.2025 (Bekanntmachungsdatum)\n\nSchleswig-Holstein Amtsgericht Lübeck HRB 5809\nEinreichung neuer Dokumente\n\nBQL Berufsausbildungs- und Qualifizierungsagentur Lübeck GmbH\nGesellschaft mit beschränkter Haftung\nLübeck\n\nAls nicht eingetragen wird veröffentlicht: Die Gesellschaft hat eine aktuelle Liste der Aufsichtsratsmitglieder zum Handelsregister eingereicht."
    },
    {
      "date": "2025-04-14",
      "id": "106475",
      "original_text": "Löschungsankündigung\nSchleswig-Holstein Amtsgericht Flensburg HRB 10511\nPROTEC Systembau Peter Hollender GmbH – Osterhever",
      "type": "Löschungsankündigung",
      "state": "Schleswig-Holstein",
      "amtsgericht": "Amtsgericht Flensburg",
      "registernummer": "HRB 10511",
      "registerart": "HRB",
      "company_name": "PROTEC Systembau Peter Hollender GmbH",
      "company_seat": "Osterhever",
      "details": "14.04.2025 (Bekanntmachungsdatum)\n\nSchleswig-Holstein Amtsgericht Flensburg HRB 10511\nLöschungsankündigung\n\nPROTEC Systembau Peter Hollender GmbH\nGesellschaft mit beschränkter Haftung\nOsterhever\n\nEs ist die Löschung der nachstehenden Gesellschaft wegen Vermögenslosigkeit gemäß § 394 FamFG beabsichtigt.\nWiderspruchsfrist: 2 Monate."
    },
    {
      "date": "2025-04-14",
      "id": "106476",
      "original_text": "Löschungsankündigung\nBerlin Amtsgericht Berlin (Charlottenburg) HRB 167738\nKVN GmbH – Berlin",
      "type": "Löschungsankündigung",
      "state": "Berlin",
      "amtsgericht": "Amtsgericht Berlin (Charlottenburg)",
      "registernummer": "HRB 167738",
      "registerart": "HRB",
      "company_name": "KVN GmbH",
      "company_seat": "Berlin",
      "details": "14.04.2025 (Bekanntmachungsdatum)\n\nBerlin Amtsgericht Berlin (Charlottenburg) HRB 167738\nLöschungsankündigung\n\nKVN GmbH\nGesellschaft mit beschränkter Haftung\nBerlin\n\nBei der nachstehenden Gesellschaft wird das Amtslöschungsverfahren gemäß § 394 FamFG eingeleitet. Widerspruchsfrist 6 Wochen"
    },
    {
      "date": "2025-04-14",
      "id": "106477",
      "original_text": "Löschungsankündigung\nSachsen Amtsgericht Dresden HRB 14663\nSchober Stahl- und Treppenbau GmbH – Ketzerbachtal",
      "type": "Löschungsankündigung",
      "state": "Sachsen",
      "amtsgericht": "Amtsgericht Dresden",
      "registernummer": "HRB 14663",
      "registerart": "HRB",
      "company_name": "Schober Stahl- und Treppenbau GmbH",
      "company_seat": "Ketzerbachtal",
      "details": "14.04.2025 (Bekanntmachungsdatum)\n\nSachsen Amtsgericht Dresden HRB 14663\nLöschungsankündigung\n\nSchober Stahl- und Treppenbau GmbH\nGesellschaft mit beschränkter Haftung\nKetzerbachtal\n\nDas Registergericht beabsichtigt, die im Handelsregister eingetragene Gesellschaft von Amts wegen nach § 394 FamFG zu löschen. Die Frist zu Erhebung eines Widerspruchs gegen die beabsichtigte Löschung wird auf einen Monat festgesetzt."
    },
    {
      "date": "2025-04-14",
      "id": "106478",
      "original_text": "Sonstige Registerbekanntmachung\nSachsen Amtsgericht Chemnitz HRB 25896\neins energie Beteiligungsgesellschaft Chemnitz mbH – Chemnitz",
      "type": "Sonstige Registerbekanntmachung",
      "state": "Sachsen",
      "amtsgericht": "Amtsgericht Chemnitz",
      "registernummer": "HRB 25896",
      "registerart": "HRB",
      "company_name": "eins energie Beteiligungsgesellschaft Chemnitz mbH",
      "company_seat": "Chemnitz",
      "details": "14.04.2025 (Bekanntmachungsdatum)\n\nSachsen Amtsgericht Chemnitz HRB 25896\nSonstige Registerbekanntmachung 14.04.2025 (Eintragungsdatum)\n\neins energie Beteiligungsgesellschaft Chemnitz mbH\nGesellschaft mit beschränkter Haftung\nChemnitz\n\nDen Gläubigern der Gesellschaft, deren Forderungen begründet worden sind bevor die Eintragung der Beendigung des Beherrschungs- und Gewinnabführungsvertrages in das Handelsregister nach § 10 des Handelsgesetzbuches als bekanntgemacht gilt, hat der andere Vertragsteil Sicherheit zu leisten, wenn sie sich binnen sechs Monaten nach der Bekanntmachung der Eintragung zu diesem Zweck bei ihm melden."
    },
    {
      "date": "2025-04-14",
      "id": "106479",
      "original_text": "Registerbekanntmachung nach dem Umwandlungsgesetz\nSachsen Amtsgericht Leipzig HRA 19613\nAmbulanter Kranken- und Seniorenpflegedienst Rosner e.K. – Grimma OT Nerchau",
      "type": "Registerbekanntmachung nach dem Umwandlungsgesetz",
      "state": "Sachsen",
      "amtsgericht": "Amtsgericht Leipzig",
      "registernummer": "HRA 19613",
      "registerart": "HRA",
      "company_name": "Ambulanter Kranken- und Seniorenpflegedienst Rosner e.K.",
      "company_seat": "Grimma OT Nerchau",
      "details": "14.04.2025 (Bekanntmachungsdatum)\n\nSachsen Amtsgericht Leipzig HRA 19613\nRegisterbekanntmachung nach dem Umwandlungsgesetz 14.04.2025 (Eintragungsdatum)\n\nAmbulanter Kranken- und Seniorenpflegedienst Rosner e.K.\nEinzelkaufmann / Einzelkauffrau\nGrimma OT Nerchau\n\nDen Gläubigern der an der Ausgliederung beteiligten Rechtsträger ist, wenn sie binnen sechs Monaten nach dem Tag, an dem die Eintragung der Ausgliederung in das Register des Sitzes desjenigen Rechtsträgers, dessen Gläubiger sie sind, nach § 19 Abs. 3 UmwG als bekannt gemacht gilt, ihren Anspruch nach Grund und Höhe in Textform anmelden, Sicherheit zu leisten, soweit sie nicht Befriedigung verlangen können. Dieses Recht steht den Gläubigern jedoch nur zu, wenn sie glaubhaft machen, dass durch die Ausgliederung die Erfüllung der Forderung gefährdet wird."
    },
    {
      "date": "2025-04-14",
      "id": "106480",
      "original_text": "Sonstige Registerbekanntmachung\nNiedersachsen Amtsgericht Oldenburg (Oldenburg) HRB 219609\nSwisslog Augsburg GmbH – Westerstede",
      "type": "Sonstige Registerbekanntmachung",
      "state": "Niedersachsen",
      "amtsgericht": "Amtsgericht Oldenburg (Oldenburg)",
      "registernummer": "HRB 219609",
      "registerart": "HRB",
      "company_name": "Swisslog Augsburg GmbH",
      "company_seat": "Westerstede",
      "details": "14.04.2025 (Bekanntmachungsdatum)\n\nNiedersachsen Amtsgericht Oldenburg (Oldenburg) HRB 219609\nSonstige Registerbekanntmachung 14.04.2025 (Eintragungsdatum)\n\nSwisslog Augsburg GmbH\nGesellschaft mit beschränkter Haftung\nWesterstede\n\nDen Gläubigern der Gesellschaft, deren Forderungen begründet worden sind, bevor die Eintragung der Beendigung des Vertrages in das Handelsregister nach § 10 HGB als bekanntgemacht gilt, ist vom anderen Vertragsteil Sicherheit zu leisten, wenn sie sich binnen sechs Monaten nach der Bekanntmachung zu diesem Zweck bei ihm melden."
    },
    {
      "date": "2025-04-14",
      "id": "106481",
      "original_text": "Registerbekanntmachung nach dem Umwandlungsgesetz\nNiedersachsen Amtsgericht Aurich HRB 206672\nIllig Consulting UG (haftungsbeschränkt) – Emden",
      "type": "Registerbekanntmachung nach dem Umwandlungsgesetz",
      "state": "Niedersachsen",
      "amtsgericht": "Amtsgericht Aurich",
      "registernummer": "HRB 206672",
      "registerart": "HRB",
      "company_name": "Illig Consulting UG (haftungsbeschränkt)",
      "company_seat": "Emden",
      "details": "14.04.2025 (Bekanntmachungsdatum)\n\nNiedersachsen Amtsgericht Aurich HRB 206672\nRegisterbekanntmachung nach dem Umwandlungsgesetz 14.04.2025 (Eintragungsdatum)\n\nIllig Consulting UG (haftungsbeschränkt)\nGesellschaft mit beschränkter Haftung\nEmden\n\nDen Gläubigern der an der Verschmelzung beteiligten Rechtsträger ist, wenn sie binnen sechs Monaten nach dem Tag, an dem die Eintragung der Verschmelzung in das Register des Sitzes desjenigen Rechtsträgers, dessen Gläubiger sie sind, nach § 19  Abs.  3 UmwG als bekannt gemacht gilt, ihren Anspruch nach Grund und Höhe schriftlich anmelden, Sicherheit zu leisten, soweit sie nicht Befriedigung verlangen können. Dieses Recht steht den Gläubigern jedoch nur zu, wenn sie glaubhaft machen, dass durch die Verschmelzung die Erfüllung der Forderung gefährdet wird."
    },
    {
      "date": "2025-04-14",
      "id": "106482",
      "original_text": "Löschungsankündigung\nNiedersachsen Amtsgericht Aurich HRB 203395\nSanierungsprofi-Nord GmbH – Westoverledingen",
      "type": "Löschungsankündigung",
      "state": "Niedersachsen",
      "amtsgericht": "Amtsgericht Aurich",
      "registernummer": "HRB 203395",
      "registerart": "HRB",
      "company_name": "Sanierungsprofi-Nord GmbH",
      "company_seat": "Westoverledingen",
      "details": "14.04.2025 (Bekanntmachungsdatum)\n\nNiedersachsen Amtsgericht Aurich HRB 203395\nLöschungsankündigung 14.04.2025 (Eintragungsdatum)\n\nSanierungsprofi-Nord GmbH\nGesellschaft mit beschränkter Haftung\nWestoverledingen\n\nDas Registergericht beabsichtigt, die Gesellschaft von Amts wegen nach § 394 FamFG zu löschen. Die Frist zur Erhebung eines Widerspruchs ist auf 1 Monat ab dieser Registerbekanntmachung festgesetzt."
    },
    {
      "date": "2025-04-14",
      "id": "106483",
      "original_text": "Löschungsankündigung\nNiedersachsen Amtsgericht Braunschweig HRB 211000\nTS-Bau UG (haftungsbeschränkt) – Bad Harzburg",
      "type": "Löschungsankündigung",
      "state": "Niedersachsen",
      "amtsgericht": "Amtsgericht Braunschweig",
      "registernummer": "HRB 211000",
      "registerart": "HRB",
      "company_name": "TS-Bau UG (haftungsbeschränkt)",
      "company_seat": "Bad Harzburg",
      "details": "14.04.2025 (Bekanntmachungsdatum)\n\nNiedersachsen Amtsgericht Braunschweig HRB 211000\nLöschungsankündigung\n\nTS-Bau UG (haftungsbeschränkt)\nGesellschaft mit beschränkter Haftung\nBad Harzburg\n\nDas Registergericht beabsichtigt, die Gesellschaft von Amts wegen nach § 394 FamFG zu löschen. Die Frist zur Erhebung eines Widerspruchs ist auf 1 Monat ab dieser Registerbekanntmachung festgesetzt."
    },
    {
      "date": "2025-04-14",
      "id": "106484",
      "original_text": "Registerbekanntmachung nach dem Umwandlungsgesetz\nNiedersachsen Amtsgericht Göttingen HRB 206919\nGöttingen Marketing GmbH – Göttingen",
      "type": "Registerbekanntmachung nach dem Umwandlungsgesetz",
      "state": "Niedersachsen",
      "amtsgericht": "Amtsgericht Göttingen",
      "registernummer": "HRB 206919",
      "registerart": "HRB",
      "company_name": "Göttingen Marketing GmbH",
      "company_seat": "Göttingen",
      "details": "14.04.2025 (Bekanntmachungsdatum)\n\nNiedersachsen Amtsgericht Göttingen HRB 206919\nRegisterbekanntmachung nach dem Umwandlungsgesetz 14.04.2025 (Eintragungsdatum)\n\nGöttingen Marketing GmbH\nGesellschaft mit beschränkter Haftung\nGöttingen\n\nDen Gläubigern der an der Verschmelzung beteiligten Rechtsträger ist, wenn sie binnen sechs Monaten nach dem Tag, an dem die Eintragung der Verschmelzung in das Register des Sitzes desjenigen Rechtsträgers, dessen Gläubiger sie sind, nach § 19  Abs.  3 UmwG als bekannt gemacht gilt, ihren Anspruch nach Grund und Höhe schriftlich anmelden, Sicherheit zu leisten, soweit sie nicht Befriedigung verlangen können. Dieses Recht steht den Gläubigern jedoch nur zu, wenn sie glaubhaft machen, dass durch die Verschmelzung die Erfüllung der Forderung gefährdet wird."
    },
    {
      "date": "2025-04-14",
      "id": "106485",
      "original_text": "Löschungsankündigung\nNiedersachsen Amtsgericht Walsrode HRA 21007\nHermann Runge, Inhaber Peter Prausner – Hoya",
      "type": "Löschungsankündigung",
      "state": "Niedersachsen",
      "amtsgericht": "Amtsgericht Walsrode",
      "registernummer": "HRA 21007",
      "registerart": "HRA",
      "company_name": "Hermann Runge, Inhaber Peter Prausner",
      "company_seat": "Hoya",
      "details": "14.04.2025 (Bekanntmachungsdatum)\n\nNiedersachsen Amtsgericht Walsrode HRA 21007\nLöschungsankündigung\n\nHermann Runge, Inhaber Peter Prausner\nEinzelkaufmann / Einzelkauffrau\nHoya\n\nDas Registergericht beabsichtigt, die Firma von Amts wegen nach § 395 FamFG zu löschen. Die Frist zur Erhebung eines Widerspruchs ist auf 1 Monat ab dieser Registerbekanntmachung festgesetzt."
    },
    {
      "date": "2025-04-14",
      "id": "106486",
      "original_text": "Sonstige Registerbekanntmachung\nNiedersachsen Amtsgericht Hannover HRB 6766\nenercity Aktiengesellschaft – Hannover",
      "type": "Sonstige Registerbekanntmachung",
      "state": "Niedersachsen",
      "amtsgericht": "Amtsgericht Hannover",
      "registernummer": "HRB 6766",
      "registerart": "HRB",
      "company_name": "enercity Aktiengesellschaft",
      "company_seat": "Hannover",
      "details": "14.04.2025 (Bekanntmachungsdatum)\n\nNiedersachsen Amtsgericht Hannover HRB 6766\nSonstige Registerbekanntmachung\n\nenercity Aktiengesellschaft\nAktiengesellschaft\nHannover\n\nDie Liste der Mitglieder des Aufsichtsrats wurde beim Registergericht eingereicht."
    },
    {
      "date": "2025-04-14",
      "id": "106487",
      "original_text": "Registerbekanntmachung nach dem Umwandlungsgesetz\nNiedersachsen Amtsgericht Lüneburg HRB 211902\nWinsener Dentallabor Verwaltungs GmbH – Winsen (Luhe)",
      "type": "Registerbekanntmachung nach dem Umwandlungsgesetz",
      "state": "Niedersachsen",
      "amtsgericht": "Amtsgericht Lüneburg",
      "registernummer": "HRB 211902",
      "registerart": "HRB",
      "company_name": "Winsener Dentallabor Verwaltungs GmbH",
      "company_seat": "Winsen (Luhe)",
      "details": "14.04.2025 (Bekanntmachungsdatum)\n\nNiedersachsen Amtsgericht Lüneburg HRB 211902\nRegisterbekanntmachung nach dem Umwandlungsgesetz 14.04.2025 (Eintragungsdatum)\n\nWinsener Dentallabor Verwaltungs GmbH\nGesellschaft mit beschränkter Haftung\nWinsen (Luhe)\n\nDen Gläubigern der an der Verschmelzung beteiligten Rechtsträger ist, wenn sie binnen sechs Monaten nach dem Tag, an dem die Eintragung der Verschmelzung in das Register des Sitzes desjenigen Rechtsträgers, dessen Gläubiger sie sind, nach § 19  Abs.  3 UmwG als bekannt gemacht gilt, ihren Anspruch nach Grund und Höhe schriftlich anmelden, Sicherheit zu leisten, soweit sie nicht Befriedigung verlangen können. Dieses Recht steht den Gläubigern jedoch nur zu, wenn sie glaubhaft machen, dass durch die Verschmelzung die Erfüllung der Forderung gefährdet wird."
    },
    {
      "date": "2025-04-14",
      "id": "106488",
      "original_text": "Registerbekanntmachung nach dem Umwandlungsgesetz\nNiedersachsen Amtsgericht Lüneburg HRB 209454\nJK Vermögensverwaltungs GmbH – Seevetal",
      "type": "Registerbekanntmachung nach dem Umwandlungsgesetz",
      "state": "Niedersachsen",
      "amtsgericht": "Amtsgericht Lüneburg",
      "registernummer": "HRB 209454",
      "registerart": "HRB",
      "company_name": "JK Vermögensverwaltungs GmbH",
      "company_seat": "Seevetal",
      "details": "14.04.2025 (Bekanntmachungsdatum)\n\nNiedersachsen Amtsgericht Lüneburg HRB 209454\nRegisterbekanntmachung nach dem Umwandlungsgesetz 14.04.2025 (Eintragungsdatum)\n\nJK Vermögensverwaltungs GmbH\nGesellschaft mit beschränkter Haftung\nSeevetal\n\nDen Gläubigern der an der Verschmelzung beteiligten Rechtsträger ist, wenn sie binnen sechs Monaten nach dem Tag, an dem die Eintragung der Verschmelzung in das Register des Sitzes desjenigen Rechtsträgers, dessen Gläubiger sie sind, nach § 19  Abs.  3 UmwG als bekannt gemacht gilt, ihren Anspruch nach Grund und Höhe schriftlich anmelden, Sicherheit zu leisten, soweit sie nicht Befriedigung verlangen können. Dieses Recht steht den Gläubigern jedoch nur zu, wenn sie glaubhaft machen, dass durch die Verschmelzung die Erfüllung der Forderung gefährdet wird."
    },
    {
      "date": "2025-04-14",
      "id": "106489",
      "original_text": "Registerbekanntmachung nach dem Umwandlungsgesetz\nNiedersachsen Amtsgericht Lüneburg HRB 209498\nAutopark Sander GmbH – Seevetal",
      "type": "Registerbekanntmachung nach dem Umwandlungsgesetz",
      "state": "Niedersachsen",
      "amtsgericht": "Amtsgericht Lüneburg",
      "registernummer": "HRB 209498",
      "registerart": "HRB",
      "company_name": "Autopark Sander GmbH",
      "company_seat": "Seevetal",
      "details": "14.04.2025 (Bekanntmachungsdatum)\n\nNiedersachsen Amtsgericht Lüneburg HRB 209498\nRegisterbekanntmachung nach dem Umwandlungsgesetz 14.04.2025 (Eintragungsdatum)\n\nAutopark Sander GmbH\nGesellschaft mit beschränkter Haftung\nSeevetal\n\nDen Gläubigern der an der Verschmelzung beteiligten Rechtsträger ist, wenn sie binnen sechs Monaten nach dem Tag, an dem die Eintragung der Verschmelzung in das Register des Sitzes desjenigen Rechtsträgers, dessen Gläubiger sie sind, nach § 19  Abs.  3 UmwG als bekannt gemacht gilt, ihren Anspruch nach Grund und Höhe schriftlich anmelden, Sicherheit zu leisten, soweit sie nicht Befriedigung verlangen können. Dieses Recht steht den Gläubigern jedoch nur zu, wenn sie glaubhaft machen, dass durch die Verschmelzung die Erfüllung der Forderung gefährdet wird."
    },
    {
      "date": "2025-04-14",
      "id": "106490",
      "original_text": "Einreichung neuer Dokumente\nNiedersachsen Amtsgericht Hannover HRB 7610\nNORD/FM Norddeutsche Facility-Management GmbH – Hannover",
      "type": "Einreichung neuer Dokumente",
      "state": "Niedersachsen",
      "amtsgericht": "Amtsgericht Hannover",
      "registernummer": "HRB 7610",
      "registerart": "HRB",
      "company_name": "NORD/FM Norddeutsche Facility-Management GmbH",
      "company_seat": "Hannover",
      "details": "14.04.2025 (Bekanntmachungsdatum)\n\nNiedersachsen Amtsgericht Hannover HRB 7610\nEinreichung neuer Dokumente\n\nNORD/FM Norddeutsche Facility-Management GmbH\nGesellschaft mit beschränkter Haftung\nHannover\n\nDie Liste der Mitglieder des Aufsichtsrats wurde beim Registergericht eingereicht."
    },
    {
      "date": "2025-04-14",
      "id": "106491",
      "original_text": "Einreichung neuer Dokumente\nNiedersachsen Amtsgericht Braunschweig HRB 100484 früher Amtsgericht Wolfsburg\nVOLKSWAGEN AKTIENGESELLSCHAFT – Wolfsburg",
      "type": "Einreichung neuer Dokumente",
      "state": "Niedersachsen",
      "amtsgericht": "Amtsgericht Braunschweig",
      "registernummer": "HRB 100484",
      "registerart": "HRB",
      "company_name": "VOLKSWAGEN AKTIENGESELLSCHAFT",
      "company_seat": "Wolfsburg",
      "former_amtsgericht": "Wolfsburg",
      "details": "14.04.2025 (Bekanntmachungsdatum)\n\nNiedersachsen Amtsgericht Braunschweig HRB 100484 früher Amtsgericht Wolfsburg\nEinreichung neuer Dokumente\n\nVOLKSWAGEN AKTIENGESELLSCHAFT\nAktiengesellschaft\nWolfsburg\n\nDie Liste der Mitglieder des Aufsichtsrats wurde beim Registergericht eingereicht."
    },
    {
      "date": "2025-04-14",
      "id": "106492",
      "original_text": "Löschungsankündigung\nNiedersachsen Amtsgericht Tostedt HRB 207607\nMiro Molkerei Food Vertriebs UG (haftungsbeschränkt) – Jork",
      "type": "Löschungsankündigung",
      "state": "Niedersachsen",
      "amtsgericht": "Amtsgericht Tostedt",
      "registernummer": "HRB 207607",
      "registerart": "HRB",
      "company_name": "Miro Molkerei Food Vertriebs UG (haftungsbeschränkt)",
      "company_seat": "Jork",
      "details": "14.04.2025 (Bekanntmachungsdatum)\n\nNiedersachsen Amtsgericht Tostedt HRB 207607\nLöschungsankündigung\n\nMiro Molkerei Food Vertriebs UG (haftungsbeschränkt)\nGesellschaft mit beschränkter Haftung\nJork\n\nDas Registergericht beabsichtigt, die Gesellschaft von Amts wegen nach § 394 FamFG zu löschen. Die Frist zur Erhebung eines Widerspruchs ist auf 1 Monat ab dieser Registerbekanntmachung festgesetzt."
    },
    {
      "date": "2025-04-14",
      "id": "106493",
      "original_text": "Löschungsankündigung\nNiedersachsen Amtsgericht Osnabrück HRB 214981\nHireLabas Bau GmbH – Osnabrück",
      "type": "Löschungsankündigung",
      "state": "Niedersachsen",
      "amtsgericht": "Amtsgericht Osnabrück",
      "registernummer": "HRB 214981",
      "registerart": "HRB",
      "company_name": "HireLabas Bau GmbH",
      "company_seat": "Osnabrück",
      "details": "14.04.2025 (Bekanntmachungsdatum)\n\nNiedersachsen Amtsgericht Osnabrück HRB 214981\nLöschungsankündigung\n\nHireLabas Bau GmbH\nGesellschaft mit beschränkter Haftung\nOsnabrück\n\nDas Registergericht beabsichtigt, die Gesellschaft von Amts wegen nach § 394 FamFG wegen Vermögenslosigkeit zu löschen. Die Frist zur Erhebung eines Widerspruchs ist auf 1 Monat ab dieser Registerbekanntmachung festgesetzt."
    },
    {
      "date": "2025-04-14",
      "id": "106494",
      "original_text": "Löschungsankündigung\nBremen Amtsgericht Bremen HRB 31777\nbalkonsanierung24.com UG (haftungsbeschränkt) – Bremen",
      "type": "Löschungsankündigung",
      "state": "Bremen",
      "amtsgericht": "Amtsgericht Bremen",
      "registernummer": "HRB 31777",
      "registerart": "HRB",
      "company_name": "balkonsanierung24.com UG (haftungsbeschränkt)",
      "company_seat": "Bremen",
      "details": "14.04.2025 (Bekanntmachungsdatum)\n\nBremen Amtsgericht Bremen HRB 31777\nLöschungsankündigung\n\nbalkonsanierung24.com UG (haftungsbeschränkt)\nGesellschaft mit beschränkter Haftung\nBremen\n\nEs ist beabsichtigt die im Handelsregister eingetragene Gesellschaft von Amts wegen gemäß § 394 FamFG zu löschen. Gegen die Löschung kann beim AG Bremen schriftlich oder zu Protokoll der Geschäftsstelle Widerspruch eingelegt werden. Widerspruchsfrist 4 Wochen."
    },
    {
      "date": "2025-04-14",
      "id": "106495",
      "original_text": "Löschungsankündigung\nBremen Amtsgericht Bremen HRB 39829\nJakic Dienstleistungs GmbH – Bremen",
      "type": "Löschungsankündigung",
      "state": "Bremen",
      "amtsgericht": "Amtsgericht Bremen",
      "registernummer": "HRB 39829",
      "registerart": "HRB",
      "company_name": "Jakic Dienstleistungs GmbH",
      "company_seat": "Bremen",
      "details": "14.04.2025 (Bekanntmachungsdatum)\n\nBremen Amtsgericht Bremen HRB 39829\nLöschungsankündigung\n\nJakic Dienstleistungs GmbH\nGesellschaft mit beschränkter Haftung\nBremen\n\nEs ist beabsichtigt die im Handelsregister eingetragene Gesellschaft von Amts wegen gemäß § 394 FamFG zu löschen. Gegen die Löschung kann beim AG Bremen schriftlich oder zu Protokoll der Geschäftsstelle Widerspruch eingelegt werden. Widerspruchsfrist 4 Wochen."
    },
    {
      "date": "2025-04-14",
      "id": "106496",
      "original_text": "Löschungsankündigung\nNordrhein-Westfalen Amtsgericht Hamm HRB 5953\nXrentX AG – Hamm",
      "type": "Löschungsankündigung",
      "state": "Nordrhein-Westfalen",
      "amtsgericht": "Amtsgericht Hamm",
      "registernummer": "HRB 5953",
      "registerart": "HRB",
      "company_name": "XrentX AG",
      "company_seat": "Hamm",
      "details": "14.04.2025 (Bekanntmachungsdatum)\n\nNordrhein-Westfalen Amtsgericht Hamm HRB 5953\nLöschungsankündigung\n\nXrentX AG\nAktiengesellschaft\nHamm\n\nDas Registergericht beabsichtigt die Gesellschaft von Amts wegen nach § 394 FamFG zu löschen. Die Frist zur Erhebung eines Widerspruchs ist auf drei Monate festgesetzt."
    },
    {
      "date": "2025-04-14",
      "id": "106497",
      "original_text": "Löschungsankündigung\nNordrhein-Westfalen Amtsgericht Hamm HRB 10843\nMGM Service GmbH – Bergkamen",
      "type": "Löschungsankündigung",
      "state": "Nordrhein-Westfalen",
      "amtsgericht": "Amtsgericht Hamm",
      "registernummer": "HRB 10843",
      "registerart": "HRB",
      "company_name": "MGM Service GmbH",
      "company_seat": "Bergkamen",
      "details": "14.04.2025 (Bekanntmachungsdatum)\n\nNordrhein-Westfalen Amtsgericht Hamm HRB 10843\nLöschungsankündigung\n\nMGM Service GmbH\nGesellschaft mit beschränkter Haftung\nBergkamen\n\nDas Registergericht beabsichtigt die Gesellschaft von Amts wegen nach § 394 FamFG zu löschen. Die Frist zur Erhebung eines Widerspruchs ist auf drei Monate festgesetzt."
    },
    {
      "date": "2025-04-14",
      "id": "106498",
      "original_text": "Einreichung neuer Dokumente\nNordrhein-Westfalen Amtsgericht Bochum HRB 22324\nCPG Construction Power Group AG – Bochum",
      "type": "Einreichung neuer Dokumente",
      "state": "Nordrhein-Westfalen",
      "amtsgericht": "Amtsgericht Bochum",
      "registernummer": "HRB 22324",
      "registerart": "HRB",
      "company_name": "CPG Construction Power Group AG",
      "company_seat": "Bochum",
      "details": "14.04.2025 (Bekanntmachungsdatum)\n\nNordrhein-Westfalen Amtsgericht Bochum HRB 22324\nEinreichung neuer Dokumente 11.04.2025 (Eintragungsdatum)\n\nCPG Construction Power Group AG\nAktiengesellschaft\nBochum\n\nDem Registergericht ist eine neue Liste der Mitglieder des Aufsichtsrates eingereicht worden."
    },
    {
      "date": "2025-04-14",
      "id": "106499",
      "original_text": "Löschungsankündigung\nNordrhein-Westfalen Amtsgericht Köln HRB 57911\nMerrion Management GmbH – Köln",
      "type": "Löschungsankündigung",
      "state": "Nordrhein-Westfalen",
      "amtsgericht": "Amtsgericht Köln",
      "registernummer": "HRB 57911",
      "registerart": "HRB",
      "company_name": "Merrion Management GmbH",
      "company_seat": "Köln",
      "details": "14.04.2025 (Bekanntmachungsdatum)\n\nNordrhein-Westfalen Amtsgericht Köln HRB 57911\nLöschungsankündigung\n\nMerrion Management GmbH\nGesellschaft mit beschränkter Haftung\nKöln\n\nDas Registergericht beabsichtigt die Gesellschaft von Amts wegen nach § 394 FamFG zu löschen. Die Frist zur Erhebung eines Widerspruchs ist auf einen Monat festgesetzt."
    },
    {
      "date": "2025-04-14",
      "id": "106500",
      "original_text": "Löschungsankündigung\nNordrhein-Westfalen Amtsgericht Kleve HRB 12001\nWrona & Schulz Krafttraining GmbH – Goch",
      "type": "Löschungsankündigung",
      "state": "Nordrhein-Westfalen",
      "amtsgericht": "Amtsgericht Kleve",
      "registernummer": "HRB 12001",
      "registerart": "HRB",
      "company_name": "Wrona & Schulz Krafttraining GmbH",
      "company_seat": "Goch",
      "details": "14.04.2025 (Bekanntmachungsdatum)\n\nNordrhein-Westfalen Amtsgericht Kleve HRB 12001\nLöschungsankündigung\n\nWrona & Schulz Krafttraining GmbH\nGesellschaft mit beschränkter Haftung\nGoch\n\nDas Registergericht beabsichtigt die Gesellschaft von Amts wegen nach § 394 FamFG zu löschen. Die Frist zur Erhebung eines Widerspruchs ist auf einen Monat festgesetzt."
    },
    {
      "date": "2025-04-14",
      "id": "106501",
      "original_text": "Registerbekanntmachung nach dem Umwandlungsgesetz\nNordrhein-Westfalen Amtsgericht Dortmund HRB 26203\nGarant Versicherungsmakler GmbH – Dortmund",
      "type": "Registerbekanntmachung nach dem Umwandlungsgesetz",
      "state": "Nordrhein-Westfalen",
      "amtsgericht": "Amtsgericht Dortmund",
      "registernummer": "HRB 26203",
      "registerart": "HRB",
      "company_name": "Garant Versicherungsmakler GmbH",
      "company_seat": "Dortmund",
      "details": "14.04.2025 (Bekanntmachungsdatum)\n\nNordrhein-Westfalen Amtsgericht Dortmund HRB 26203\nRegisterbekanntmachung nach dem Umwandlungsgesetz 09.04.2025 (Eintragungsdatum)\n\nGarant Versicherungsmakler GmbH\nGesellschaft mit beschränkter Haftung\nDortmund\n\nDen Gläubigern der an der Verschmelzung beteiligten Rechtsträger ist, wenn sie binnen sechs Monaten nach dem Tag, an dem die Eintragung der Verschmelzung in das Register des Sitzes desjenigen Rechtsträgers, dessen Gläubiger sie sind, nach § 19 Absatz 3 UmwG als bekanntgemacht gilt, ihren Anspruch nach Grund und Höhe schriftlich anmelden, Sicherheit zu leisten, soweit sie nicht Befriedigung verlangen können. Dieses Recht steht den Gläubigern jedoch nur zu, wenn sie glaubhaft machen, dass durch die Verschmelzung die Erfüllung ihrer Forderung gefährdet wird."
    },
    {
      "date": "2025-04-14",
      "id": "106502",
      "original_text": "Löschungsankündigung\nNordrhein-Westfalen Amtsgericht Bochum HRB 14430\nHalley Home Textilien GmbH – Herne",
      "type": "Löschungsankündigung",
      "state": "Nordrhein-Westfalen",
      "amtsgericht": "Amtsgericht Bochum",
      "registernummer": "HRB 14430",
      "registerart": "HRB",
      "company_name": "Halley Home Textilien GmbH",
      "company_seat": "Herne",
      "details": "14.04.2025 (Bekanntmachungsdatum)\n\nNordrhein-Westfalen Amtsgericht Bochum HRB 14430\nLöschungsankündigung\n\nHalley Home Textilien GmbH\nGesellschaft mit beschränkter Haftung\nHerne\n\nDas Registergericht beabsichtigt die Gesellschaft von Amts wegen nach § 394 FamFG zu löschen. Die Frist zur Erhebung eines Widerspruchs ist auf drei Monate festgesetzt."
    },
    {
      "date": "2025-04-14",
      "id": "106503",
      "original_text": "Einreichung neuer Dokumente\nNordrhein-Westfalen Amtsgericht Köln HRB 52311\nOVB Vermögensberatung AG – Köln",
      "type": "Einreichung neuer Dokumente",
      "state": "Nordrhein-Westfalen",
      "amtsgericht": "Amtsgericht Köln",
      "registernummer": "HRB 52311",
      "registerart": "HRB",
      "company_name": "OVB Vermögensberatung AG",
      "company_seat": "Köln",
      "details": "14.04.2025 (Bekanntmachungsdatum)\n\nNordrhein-Westfalen Amtsgericht Köln HRB 52311\nEinreichung neuer Dokumente\n\nOVB Vermögensberatung AG\nAktiengesellschaft\nKöln\n\nDem Registergericht ist eine Liste der Mitglieder des Aufsichtsrates eingereicht worden."
    },
    {
      "date": "2025-04-14",
      "id": "106504",
      "original_text": "Löschungsankündigung\nNordrhein-Westfalen Amtsgericht Aachen HRB 20250\nBehl GmbH – Aachen",
      "type": "Löschungsankündigung",
      "state": "Nordrhein-Westfalen",
      "amtsgericht": "Amtsgericht Aachen",
      "registernummer": "HRB 20250",
      "registerart": "HRB",
      "company_name": "Behl GmbH",
      "company_seat": "Aachen",
      "details": "14.04.2025 (Bekanntmachungsdatum)\n\nNordrhein-Westfalen Amtsgericht Aachen HRB 20250\nLöschungsankündigung\n\nBehl GmbH\nGesellschaft mit beschränkter Haftung\nAachen\n\nDas Registergericht beabsichtigt, von Amts wegen die Gesellschaft wegen Vermögenslosigkeit nach § 394 FamFG zu löschen, weil das Insolvenzverfahren Amtsgericht Aachen (92 IN 243/17) beendet und Vermögen der Gesellschaft nicht mehr erkennbar ist.\n\nZur Geltendmachung des Widerspruchs gegen die beabsichtigte Löschung wird hiermit eine Frist von einem Monat ab Veröffentlichung dieser Ankündigung bestimmt.\n\nRechtsbehelfsbelehrung:\n\nGegen diese Verfügung kann Widerspruch eingelegt werden. Zum Widerspruch ist jeder berechtigt, der an der Unterlassung der Löschung ein berechtigtes Interesse hat.\n\nDer Widerspruch ist bei dem Amtsgericht Aachen, Adalbertsteinweg 92, 52070 Aachen schriftlich in deutscher Sprache oder zur Niederschrift der Geschäftsstelle einzulegen. Der Widerspruch kann auch zur Niederschrift der Geschäftsstelle eines jeden Amtsgerichtes abgegeben werden.\n\nDer Widerspruch muss spätestens innerhalb der gesetzten Frist nach der Bekanntgabe der Verfügung bei dem Amtsgericht Aachen eingegangen sein. Dies gilt auch dann, wenn der Widerspruch zur Niederschrift der Geschäftsstelle eines anderen Amtsgerichtes abgegeben wurde. Die Frist beginnt mit der Bekanntgabe der Verfügung durch Veröffentlichung. Fällt das Ende der Frist auf einen Sonntag, einen allgemeinen Feiertag oder Sonnabend, so endet die Frist mit Ablauf des nächsten Werktages.\n\nDer Widerspruch muss die Bezeichnung der angefochtenen Verfügung sowie die Erklärung enthalten, dass Widerspruch gegen diese Verfügung eingelegt wird. Er ist zu unterzeichnen und soll begründet werden.\n\nDie Einlegung ist auch durch Übertragung eines elektronischen Dokuments an die elektronische Poststelle des Gerichts möglich. Das elektronische Dokument muss für die Bearbeitung durch das Gericht geeignet und mit einer qualifizierten elektronischen Signatur der verantwortenden Person versehen sein oder von der verantwortenden Person signiert und auf einem sicheren Übermittlungsweg gemäß § 130 a ZPO nach näherer Maßgabe der Verordnung über die technischen Rahmenbedingungen des elektronischen Rechtsverkehrs und über das besondere elektronische Behördenpostfach (BGBl. I, S. 3803) eingereicht werden. Weitere Informationen erhalten Sie auf der Internetseite www.justiz.de."
    },
    {
      "date": "2025-04-14",
      "id": "106505",
      "original_text": "Löschungsankündigung\nNordrhein-Westfalen Amtsgericht Kleve HRB 16663\nHW Handelsgesellschaft mbH – Kleve",
      "type": "Löschungsankündigung",
      "state": "Nordrhein-Westfalen",
      "amtsgericht": "Amtsgericht Kleve",
      "registernummer": "HRB 16663",
      "registerart": "HRB",
      "company_name": "HW Handelsgesellschaft mbH",
      "company_seat": "Kleve",
      "details": "14.04.2025 (Bekanntmachungsdatum)\n\nNordrhein-Westfalen Amtsgericht Kleve HRB 16663\nLöschungsankündigung\n\nHW Handelsgesellschaft mbH\nGesellschaft mit beschränkter Haftung\nKleve\n\nDas Registergericht beabsichtigt die Gesellschaft von Amts wegen nach § 394 FamFG zu löschen. Die Frist zur Erhebung eines Widerspruchs ist auf einen Monat festgesetzt."
    },
    {
      "date": "2025-04-14",
      "id": "106506",
      "original_text": "Löschungsankündigung\nNordrhein-Westfalen Amtsgericht Wuppertal HRB 27751\nW & G Delikatessen GmbH – Wuppertal",
      "type": "Löschungsankündigung",
      "state": "Nordrhein-Westfalen",
      "amtsgericht": "Amtsgericht Wuppertal",
      "registernummer": "HRB 27751",
      "registerart": "HRB",
      "company_name": "W & G Delikatessen GmbH",
      "company_seat": "Wuppertal",
      "details": "14.04.2025 (Bekanntmachungsdatum)\n\nNordrhein-Westfalen Amtsgericht Wuppertal HRB 27751\nLöschungsankündigung 11.04.2025 (Eintragungsdatum)\n\nW & G Delikatessen GmbH\nGesellschaft mit beschränkter Haftung\nWuppertal\n\nDas Registergericht beabsichtigt die Gesellschaft von Amts wegen nach § 394 FamFG zu löschen. Die Frist zur Erhebung eines Widerspruchs ist auf einen Monat festgesetzt."
    },
    {
      "date": "2025-04-14",
      "id": "106507",
      "original_text": "Einreichung neuer Dokumente\nNordrhein-Westfalen Amtsgericht Recklinghausen HRB 6042\nKlinikum Vest GmbH – Recklinghausen",
      "type": "Einreichung neuer Dokumente",
      "state": "Nordrhein-Westfalen",
      "amtsgericht": "Amtsgericht Recklinghausen",
      "registernummer": "HRB 6042",
      "registerart": "HRB",
      "company_name": "Klinikum Vest GmbH",
      "company_seat": "Recklinghausen",
      "details": "14.04.2025 (Bekanntmachungsdatum)\n\nNordrhein-Westfalen Amtsgericht Recklinghausen HRB 6042\nEinreichung neuer Dokumente 14.04.2025 (Eintragungsdatum)\n\nKlinikum Vest GmbH\nGesellschaft mit beschränkter Haftung\nRecklinghausen\n\nDem Registergericht ist eine neue Liste der Mitglieder des Aufsichtsrates eingereicht worden."
    },
    {
      "date": "2025-04-14",
      "id": "106508",
      "original_text": "Löschungsankündigung\nNordrhein-Westfalen Amtsgericht Köln HRB 89749\nLaphil development UG (haftungsbeschränkt) – Köln",
      "type": "Löschungsankündigung",
      "state": "Nordrhein-Westfalen",
      "amtsgericht": "Amtsgericht Köln",
      "registernummer": "HRB 89749",
      "registerart": "HRB",
      "company_name": "Laphil development UG (haftungsbeschränkt)",
      "company_seat": "Köln",
      "details": "14.04.2025 (Bekanntmachungsdatum)\n\nNordrhein-Westfalen Amtsgericht Köln HRB 89749\nLöschungsankündigung\n\nLaphil development UG (haftungsbeschränkt)\nGesellschaft mit beschränkter Haftung\nKöln\n\nDas Registergericht beabsichtigt die Gesellschaft von Amts wegen nach § 394 FamFG zu löschen. Die Frist zur Erhebung eines Widerspruchs ist auf einen Monat festgesetzt."
    },
    {
      "date": "2025-04-14",
      "id": "106509",
      "original_text": "Registerbekanntmachung nach dem Umwandlungsgesetz\nNordrhein-Westfalen Amtsgericht Paderborn HRB 7754\nSt. Johannisstift Ev. Krankenhaus Paderborn gGmbH – Paderborn",
      "type": "Registerbekanntmachung nach dem Umwandlungsgesetz",
      "state": "Nordrhein-Westfalen",
      "amtsgericht": "Amtsgericht Paderborn",
      "registernummer": "HRB 7754",
      "registerart": "HRB",
      "company_name": "St. Johannisstift Ev. Krankenhaus Paderborn gGmbH",
      "company_seat": "Paderborn",
      "details": "14.04.2025 (Bekanntmachungsdatum)\n\nNordrhein-Westfalen Amtsgericht Paderborn HRB 7754\nRegisterbekanntmachung nach dem Umwandlungsgesetz 14.04.2025 (Eintragungsdatum)\n\nSt. Johannisstift Ev. Krankenhaus Paderborn gGmbH\nGesellschaft mit beschränkter Haftung\nPaderborn\n\nDen Gläubigern der an der Verschmelzung beteiligten Rechtsträger ist, wenn sie binnen sechs Monaten nach dem Tag, an dem die Eintragung der Verschmelzung in das Register des Sitzes desjenigen Rechtsträgers, dessen Gläubiger sie sind, nach § 19 Absatz 3 UmwG als bekanntgemacht gilt, ihren Anspruch nach Grund und Höhe schriftlich anmelden, Sicherheit zu leisten, soweit sie nicht Befriedigung verlangen können. Dieses Recht steht den Gläubigern jedoch nur zu, wenn sie glaubhaft machen, dass durch die Verschmelzung die Erfüllung ihrer Forderung gefährdet wird."
    },
    {
      "date": "2025-04-14",
      "id": "106510",
      "original_text": "Löschungsankündigung\nNordrhein-Westfalen Amtsgericht Krefeld HRB 17133\nIPADCO GmbH – Krefeld",
      "type": "Löschungsankündigung",
      "state": "Nordrhein-Westfalen",
      "amtsgericht": "Amtsgericht Krefeld",
      "registernummer": "HRB 17133",
      "registerart": "HRB",
      "company_name": "IPADCO GmbH",
      "company_seat": "Krefeld",
      "details": "14.04.2025 (Bekanntmachungsdatum)\n\nNordrhein-Westfalen Amtsgericht Krefeld HRB 17133\nLöschungsankündigung\n\nIPADCO GmbH\nGesellschaft mit beschränkter Haftung\nKrefeld\n\nDas Registergericht beabsichtigt die Gesellschaft von Amts wegen nach § 394 FamFG zu löschen. Die Frist zur Erhebung eines Widerspruchs ist auf einen Monat festgesetzt."
    },
    {
      "date": "2025-04-14",
      "id": "106511",
      "original_text": "Löschungsankündigung\nNordrhein-Westfalen Amtsgericht Wuppertal HRB 27529\nBAU BEL Beteiligungs UG (haftungsbeschränkt) – Velbert",
      "type": "Löschungsankündigung",
      "state": "Nordrhein-Westfalen",
      "amtsgericht": "Amtsgericht Wuppertal",
      "registernummer": "HRB 27529",
      "registerart": "HRB",
      "company_name": "BAU BEL Beteiligungs UG (haftungsbeschränkt)",
      "company_seat": "Velbert",
      "details": "14.04.2025 (Bekanntmachungsdatum)\n\nNordrhein-Westfalen Amtsgericht Wuppertal HRB 27529\nLöschungsankündigung\n\nBAU BEL Beteiligungs UG (haftungsbeschränkt)\nGesellschaft mit beschränkter Haftung\nVelbert\n\nDas Registergericht beabsichtigt die Gesellschaft von Amts wegen nach § 394 FamFG zu löschen. Die Frist zur Erhebung eines Widerspruchs ist auf einen Monat festgesetzt."
    },
    {
      "date": "2025-04-14",
      "id": "106512",
      "original_text": "Löschungsankündigung\nNordrhein-Westfalen Amtsgericht Mönchengladbach HRA 6592\nTiefBohr NRW GmbH & Co. KG – Hückelhoven",
      "type": "Löschungsankündigung",
      "state": "Nordrhein-Westfalen",
      "amtsgericht": "Amtsgericht Mönchengladbach",
      "registernummer": "HRA 6592",
      "registerart": "HRA",
      "company_name": "TiefBohr NRW GmbH & Co. KG",
      "company_seat": "Hückelhoven",
      "details": "14.04.2025 (Bekanntmachungsdatum)\n\nNordrhein-Westfalen Amtsgericht Mönchengladbach HRA 6592\nLöschungsankündigung\n\nTiefBohr NRW GmbH & Co. KG\nKommanditgesellschaft\nHückelhoven\n\nDas Registergericht beabsichtigt, die im Handelsregister eingetragene Gesellschaft gemäß § 394 Absatz 1 FamFG wegen Vermögenslosigkeit von Amts wegen zu lö-schen. Gegen diese Verfügung kann Widerspruch eingelegt werden. Die Frist zur Er-hebung eines Widerspruchs gegen die beabsichtigte Löschung von Amts wegen ist auf drei Monate festgesetzt."
    },
    {
      "date": "2025-04-14",
      "id": "106513",
      "original_text": "Löschungsankündigung\nRheinland-Pfalz Amtsgericht Zweibrücken HRB 11822\nS.E.L.V. GmbH – Landstuhl",
      "type": "Löschungsankündigung",
      "state": "Rheinland-Pfalz",
      "amtsgericht": "Amtsgericht Zweibrücken",
      "registernummer": "HRB 11822",
      "registerart": "HRB",
      "company_name": "S.E.L.V. GmbH",
      "company_seat": "Landstuhl",
      "details": "14.04.2025 (Bekanntmachungsdatum)\n\nRheinland-Pfalz Amtsgericht Zweibrücken HRB 11822\nLöschungsankündigung\n\nS.E.L.V. GmbH\nGesellschaft mit beschränkter Haftung\nLandstuhl\n\nDas Registergericht beabsichtigt die Gesellschaft von Amts wegen nach § 394 FamFG zu löschen. Die Frist zur Erhebung eines Widerspruchs ist auf einen Monat festgesetzt."
    },
    {
      "date": "2025-04-14",
      "id": "106514",
      "original_text": "Löschungsankündigung\nRheinland-Pfalz Amtsgericht Montabaur HRB 25666\nPiron Networks GmbH – Melsbach",
      "type": "Löschungsankündigung",
      "state": "Rheinland-Pfalz",
      "amtsgericht": "Amtsgericht Montabaur",
      "registernummer": "HRB 25666",
      "registerart": "HRB",
      "company_name": "Piron Networks GmbH",
      "company_seat": "Melsbach",
      "details": "14.04.2025 (Bekanntmachungsdatum)\n\nRheinland-Pfalz Amtsgericht Montabaur HRB 25666\nLöschungsankündigung\n\nPiron Networks GmbH\nGesellschaft mit beschränkter Haftung\nMelsbach\n\nDas Registergericht beabsichtigt die Gesellschaft von Amts wegen nach § 394 FamFG zu löschen. Die Frist zur Erhebung eines Widerspruchs ist auf 1 Monat festgesetzt."
    },
    {
      "date": "2025-04-14",
      "id": "106515",
      "original_text": "Löschungsankündigung\nRheinland-Pfalz Amtsgericht Landau HRB 31673\nS.I. SYSTEM-BAU GmbH – Kandel",
      "type": "Löschungsankündigung",
      "state": "Rheinland-Pfalz",
      "amtsgericht": "Amtsgericht Landau",
      "registernummer": "HRB 31673",
      "registerart": "HRB",
      "company_name": "S.I. SYSTEM-BAU GmbH",
      "company_seat": "Kandel",
      "details": "14.04.2025 (Bekanntmachungsdatum)\n\nRheinland-Pfalz Amtsgericht Landau HRB 31673\nLöschungsankündigung\n\nS.I. SYSTEM-BAU GmbH\nGesellschaft mit beschränkter Haftung\nKandel\n\nDas Registergericht beabsichtigt die Gesellschaft von Amts wegen nach § 394 FamFG zu löschen. Die Frist zur Erhebung eines Widerspruchs ist auf einen Monat festgesetzt."
    },
    {
      "date": "2025-04-14",
      "id": "106516",
      "original_text": "Löschungsankündigung\nRheinland-Pfalz Amtsgericht Koblenz HRB 22562\nSchrankplaner GmbH – Leimbach",
      "type": "Löschungsankündigung",
      "state": "Rheinland-Pfalz",
      "amtsgericht": "Amtsgericht Koblenz",
      "registernummer": "HRB 22562",
      "registerart": "HRB",
      "company_name": "Schrankplaner GmbH",
      "company_seat": "Leimbach",
      "details": "14.04.2025 (Bekanntmachungsdatum)\n\nRheinland-Pfalz Amtsgericht Koblenz HRB 22562\nLöschungsankündigung\n\nSchrankplaner GmbH\nGesellschaft mit beschränkter Haftung\nLeimbach\n\nDas Registergericht beabsichtigt den Geschäftsführer Herrn Großekathöfer von Amts wegen nach § 395 FamFG zu löschen. Die Frist zur Erhebung eines Widerspruchs ist auf einen Monat festgesetzt."
    },
    {
      "date": "2025-04-14",
      "id": "106517",
      "original_text": "Registerbekanntmachung nach dem Umwandlungsgesetz\nRheinland-Pfalz Amtsgericht Mainz HRB 8751\nLampe & Kollegen AG Wirtschaftsprüfungsgesellschaft – Mainz",
      "type": "Registerbekanntmachung nach dem Umwandlungsgesetz",
      "state": "Rheinland-Pfalz",
      "amtsgericht": "Amtsgericht Mainz",
      "registernummer": "HRB 8751",
      "registerart": "HRB",
      "company_name": "Lampe & Kollegen AG Wirtschaftsprüfungsgesellschaft",
      "company_seat": "Mainz",
      "details": "14.04.2025 (Bekanntmachungsdatum)\n\nRheinland-Pfalz Amtsgericht Mainz HRB 8751\nRegisterbekanntmachung nach dem Umwandlungsgesetz 14.04.2025 (Eintragungsdatum)\n\nLampe & Kollegen AG Wirtschaftsprüfungsgesellschaft\nAktiengesellschaft\nMainz\n\nAls nicht eingetragen wird veröffentlicht:\nDen Gläubigern des formwechselnden Rechtsträgers ist, wenn sie binnen sechs Monaten nach dem Tag, an dem die Eintragung des Formwechsels nach § 201 UmwG als bekannt gemacht gilt, ihren Anspruch nach Grund und Höhe schriftlich anmelden, Sicherheit zu leisten, soweit sie nicht Befriedigung verlangen können. Dieses Recht steht den Gläubigern jedoch nur zu, wenn sie glaubhaft machen, dass durch den Formwechsel die Erfüllung der Forderung gefährdet wird."
    },
    {
      "date": "2025-04-14",
      "id": "106518",
      "original_text": "Löschungsankündigung\nBrandenburg Amtsgericht Cottbus HRB 10180\nTS Technik & Service GmbH Wildau – Wildau",
      "type": "Löschungsankündigung",
      "state": "Brandenburg",
      "amtsgericht": "Amtsgericht Cottbus",
      "registernummer": "HRB 10180",
      "registerart": "HRB",
      "company_name": "TS Technik & Service GmbH Wildau",
      "company_seat": "Wildau",
      "details": "14.04.2025 (Bekanntmachungsdatum)\n\nBrandenburg Amtsgericht Cottbus HRB 10180\nLöschungsankündigung\n\nTS Technik & Service GmbH Wildau\nGesellschaft mit beschränkter Haftung\nWildau\n\nBei der nachstehenden Gesellschaft wird das Amtslöschungsverfahren gemäß § 394 FamFG eingeleitet."
    },
    {
      "date": "2025-04-14",
      "id": "106519",
      "original_text": "Löschungsankündigung\nHessen Amtsgericht Friedberg HRB 9667\nSanta Health & Beauty GmbH – Butzbach",
      "type": "Löschungsankündigung",
      "state": "Hessen",
      "amtsgericht": "Amtsgericht Friedberg",
      "registernummer": "HRB 9667",
      "registerart": "HRB",
      "company_name": "Santa Health & Beauty GmbH",
      "company_seat": "Butzbach",
      "details": "14.04.2025 (Bekanntmachungsdatum)\n\nHessen Amtsgericht Friedberg HRB 9667\nLöschungsankündigung 11.04.2025 (Eintragungsdatum)\n\nSanta Health & Beauty GmbH\nGesellschaft mit beschränkter Haftung\nButzbach\n\nDas Registergericht beabsichtigt die im Handelsregister eingetragene Gesellschaft von Amts wegen nach § 394 FamFG zu löschen. Die Frist zur Erhebung eines Widerspruchs gegen die beabsichtigte Löschung wird auf 3 Monate festgesetzt."
    },
    {
      "date": "2025-04-14",
      "id": "106520",
      "original_text": "Sonstige Registerbekanntmachung\nHessen Amtsgericht Frankfurt am Main HRB 82873\nYellow Automation GmbH – Frankfurt am Main",
      "type": "Sonstige Registerbekanntmachung",
      "state": "Hessen",
      "amtsgericht": "Amtsgericht Frankfurt am Main",
      "registernummer": "HRB 82873",
      "registerart": "HRB",
      "company_name": "Yellow Automation GmbH",
      "company_seat": "Frankfurt am Main",
      "details": "14.04.2025 (Bekanntmachungsdatum)\n\nHessen Amtsgericht Frankfurt am Main HRB 82873\nSonstige Registerbekanntmachung 14.04.2025 (Eintragungsdatum)\n\nYellow Automation GmbH\nGesellschaft mit beschränkter Haftung\nFrankfurt am Main\n\nDurch eine Änderung in den Personen der Beiratsratsmitglieder ist eine Liste der Mitglieder des Beirats zum Handelsregister eingereicht worden."
    },
    {
      "date": "2025-04-14",
      "id": "106521",
      "original_text": "Einreichung neuer Dokumente\nHessen Amtsgericht Frankfurt am Main HRB 87904\nFINGENIUM private finance AG – Frankfurt am Main",
      "type": "Einreichung neuer Dokumente",
      "state": "Hessen",
      "amtsgericht": "Amtsgericht Frankfurt am Main",
      "registernummer": "HRB 87904",
      "registerart": "HRB",
      "company_name": "FINGENIUM private finance AG",
      "company_seat": "Frankfurt am Main",
      "details": "14.04.2025 (Bekanntmachungsdatum)\n\nHessen Amtsgericht Frankfurt am Main HRB 87904\nEinreichung neuer Dokumente\n\nFINGENIUM private finance AG\nAktiengesellschaft\nFrankfurt am Main\n\nDurch eine Änderung in den Personen der Aufsichtsratsmitglieder ist eine Liste der Mitglieder des Aufsichtsrates zum Handelsregister eingereicht worden."
    },
    {
      "date": "2025-04-14",
      "id": "106522",
      "original_text": "Einreichung neuer Dokumente\nHessen Amtsgericht Frankfurt am Main HRB 109880\nMorgan Stanley Europe SE – Frankfurt am Main",
      "type": "Einreichung neuer Dokumente",
      "state": "Hessen",
      "amtsgericht": "Amtsgericht Frankfurt am Main",
      "registernummer": "HRB 109880",
      "registerart": "HRB",
      "company_name": "Morgan Stanley Europe SE",
      "company_seat": "Frankfurt am Main",
      "details": "14.04.2025 (Bekanntmachungsdatum)\n\nHessen Amtsgericht Frankfurt am Main HRB 109880\nEinreichung neuer Dokumente\n\nMorgan Stanley Europe SE\nEuropäische Aktiengesellschaft (SE)\nFrankfurt am Main\n\nDurch eine Änderung in den Personen der Aufsichtsratsmitglieder ist eine Liste der Mitglieder des Aufsichtsrates zum Handelsregister eingereicht worden."
    },
    {
      "date": "2025-04-14",
      "id": "106523",
      "original_text": "Löschungsankündigung\nHessen Amtsgericht Offenbach am Main HRB 51070\nTS Bau GmbH – Offenbach am Main",
      "type": "Löschungsankündigung",
      "state": "Hessen",
      "amtsgericht": "Amtsgericht Offenbach am Main",
      "registernummer": "HRB 51070",
      "registerart": "HRB",
      "company_name": "TS Bau GmbH",
      "company_seat": "Offenbach am Main",
      "details": "14.04.2025 (Bekanntmachungsdatum)\n\nHessen Amtsgericht Offenbach am Main HRB 51070\nLöschungsankündigung\n\nTS Bau GmbH\nGesellschaft mit beschränkter Haftung\nOffenbach am Main\n\nDas Registergericht beabsichtigt die im Handelsregister eingetragene Gesellschaft von Amts wegen nach § 394 FamFG zu löschen. Die Frist zur Erhebung eines Widerspruchs gegen die beabsichtigte Löschung wird auf 3 Monate festgesetzt."
    },
    {
      "date": "2025-04-14",
      "id": "106524",
      "original_text": "Registerbekanntmachung nach dem Umwandlungsgesetz\nHessen Amtsgericht Frankfurt am Main HRB 110010\nCloud Consulting Group GmbH – Frankfurt am Main",
      "type": "Registerbekanntmachung nach dem Umwandlungsgesetz",
      "state": "Hessen",
      "amtsgericht": "Amtsgericht Frankfurt am Main",
      "registernummer": "HRB 110010",
      "registerart": "HRB",
      "company_name": "Cloud Consulting Group GmbH",
      "company_seat": "Frankfurt am Main",
      "details": "14.04.2025 (Bekanntmachungsdatum)\n\nHessen Amtsgericht Frankfurt am Main HRB 110010\nRegisterbekanntmachung nach dem Umwandlungsgesetz 14.04.2025 (Eintragungsdatum)\n\nCloud Consulting Group GmbH\nGesellschaft mit beschränkter Haftung\nFrankfurt am Main\n\nDen Gläubigern der Gesellschaft, deren Forderungen begründet worden sind, bevor die Eintragung der Beendigung des Vertrags in das Handelsregister nach § 10 HGB bekannt gemacht worden ist, ist vom anderen Vertragsteil Sicherheit zu leisten, wenn sie sich binnen sechs Monaten nach dieser Bekanntmachung zu diesem Zweck bei ihm melden.Den Gläubigern der an der Verschmelzung beteiligten Rechtsträger ist, wenn sie binnen sechs Monaten nach dem Tag, an dem die Eintragung der Verschmelzung in das Register des Sitzes desjenigen Rechtsträgers, dessen Gläubiger sie sind, nach § 19 Absatz 3 UmwG bekannt gemacht worden ist, ihren Anspruch nach Grund und Höhe schriftlich anmelden, Sicherheit zu leisten, soweit sie nicht Befriedigung verlangen können. Dieses Recht steht den Gläubigern jedoch nur zu, wenn sie glaubhaft machen, dass durch die Verschmelzung die Erfüllung ihrer Forderung gefährdet wird."
    },
    {
      "date": "2025-04-14",
      "id": "106525",
      "original_text": "Löschungsankündigung\nHessen Amtsgericht Korbach HRB 2215\nGuCon UG (haftungsbeschränkt) – Korbach",
      "type": "Löschungsankündigung",
      "state": "Hessen",
      "amtsgericht": "Amtsgericht Korbach",
      "registernummer": "HRB 2215",
      "registerart": "HRB",
      "company_name": "GuCon UG (haftungsbeschränkt)",
      "company_seat": "Korbach",
      "details": "14.04.2025 (Bekanntmachungsdatum)\n\nHessen Amtsgericht Korbach HRB 2215\nLöschungsankündigung 14.04.2025 (Eintragungsdatum)\n\nGuCon UG (haftungsbeschränkt)\nGesellschaft mit beschränkter Haftung\nKorbach\n\nDas Registergericht beabsichtigt die im Handelsregister eingetragene Gesellschaft von Amts wegen nach § 395 FamFG zu löschen. Die Frist zur Erhebung eines Widerspruchs gegen die beabsichtigte Löschung wird auf 3 Monate festgesetzt."
    },
    {
      "date": "2025-04-14",
      "id": "106526",
      "original_text": "Einreichung neuer Dokumente\nHessen Amtsgericht Frankfurt am Main HRB 39346\nMorgan Stanley Bank Aktiengesellschaft – Frankfurt am Main",
      "type": "Einreichung neuer Dokumente",
      "state": "Hessen",
      "amtsgericht": "Amtsgericht Frankfurt am Main",
      "registernummer": "HRB 39346",
      "registerart": "HRB",
      "company_name": "Morgan Stanley Bank Aktiengesellschaft",
      "company_seat": "Frankfurt am Main",
      "details": "14.04.2025 (Bekanntmachungsdatum)\n\nHessen Amtsgericht Frankfurt am Main HRB 39346\nEinreichung neuer Dokumente\n\nMorgan Stanley Bank Aktiengesellschaft\nAktiengesellschaft\nFrankfurt am Main\n\nDurch eine Änderung in den Personen der Aufsichtsratsmitglieder ist eine Liste der Mitglieder des Aufsichtsrates zum Handelsregister eingereicht worden."
    },
    {
      "date": "2025-04-14",
      "id": "106527",
      "original_text": "Löschungsankündigung\nHessen Amtsgericht Wiesbaden HRB 32734\nCan Bau GmbH – Waldems",
      "type": "Löschungsankündigung",
      "state": "Hessen",
      "amtsgericht": "Amtsgericht Wiesbaden",
      "registernummer": "HRB 32734",
      "registerart": "HRB",
      "company_name": "Can Bau GmbH",
      "company_seat": "Waldems",
      "details": "14.04.2025 (Bekanntmachungsdatum)\n\nHessen Amtsgericht Wiesbaden HRB 32734\nLöschungsankündigung\n\nCan Bau GmbH\nGesellschaft mit beschränkter Haftung\nWaldems\n\nDas Registergericht beabsichtigt die im Handelsregister eingetragene Gesellschaft von Amts wegen nach § 394 FamFG zu löschen. Die Frist zur Erhebung eines Widerspruchs gegen die beabsichtigte Löschung wird auf 3 Monate festgesetzt."
    }
  ]
}