{
  "date": "2025-04-30",
  "date_of_scrape": "2025-05-31T07:25:11.709Z",
  "tool_version": "0.2.0",
  "number_of_announcements": 158,
  "announcements": [
    {
      "date": "2025-04-30",
      "id": "107704",
      "original_text": "Registerbekanntmachung nach dem Umwandlungsgesetz\nBayern Amtsgericht München HRB 264193\nUlrich 31 FIII Holding GmbH – München",
      "type": "Registerbekanntmachung nach dem Umwandlungsgesetz",
      "state": "Bayern",
      "amtsgericht": "Amtsgericht München",
      "registernummer": "HRB 264193",
      "registerart": "HRB",
      "company_name": "Ulrich 31 FIII Holding GmbH",
      "company_seat": "München",
      "details": "30.04.2025 (Bekanntmachungsdatum)\n\nBayern Amtsgericht München HRB 264193\nRegisterbekanntmachung nach dem Umwandlungsgesetz 29.04.2025 (Eintragungsdatum)\n\nUlrich 31 FIII Holding GmbH\nGesellschaft mit beschränkter Haftung\nMünchen\n\nDen Gläubigern der an der Verschmelzung beteiligten Rechtsträger ist, wenn sie binnen sechs Monaten nach dem Tag, an dem die Eintragung der Verschmelzung in das Register des Sitzes desjenigen Rechtsträgers, dessen Gläubiger sie sind, nach § 19 Abs. 3 UmwG als bekannt gemacht gilt, ihren Anspruch nach Grund und Höhe in Textform anmelden, Sicherheit zu leisten, soweit sie nicht Befriedigung verlangen können. Dieses Recht steht den Gläubigern jedoch nur zu, wenn sie glaubhaft machen, dass durch die Verschmelzung die Erfüllung ihrer Forderung gefährdet wird."
    },
    {
      "date": "2025-04-30",
      "id": "107705",
      "original_text": "Registerbekanntmachung nach dem Umwandlungsgesetz\nBayern Amtsgericht München HRB 288178\nHowden Deutschland AG – München",
      "type": "Registerbekanntmachung nach dem Umwandlungsgesetz",
      "state": "Bayern",
      "amtsgericht": "Amtsgericht München",
      "registernummer": "HRB 288178",
      "registerart": "HRB",
      "company_name": "Howden Deutschland AG",
      "company_seat": "München",
      "details": "30.04.2025 (Bekanntmachungsdatum)\n\nBayern Amtsgericht München HRB 288178\nRegisterbekanntmachung nach dem Umwandlungsgesetz\n\nHowden Deutschland AG\nAktiengesellschaft\nMünchen\n\nDem Amtsgericht München -Registergericht- ist der Entwurf eines Verschmelzungsvertrages zwischen der Gesellschaft als übernehmendem Rechtsträger und der Franz Goßler Versicherungsvermittlung GmbH, Oberhaching (Amtsgericht München HRB 125363) zur Einsichtnahme eingereicht worden."
    },
    {
      "date": "2025-04-30",
      "id": "107706",
      "original_text": "Löschungsankündigung\nBayern Amtsgericht München HRB 216138\nnoDNA GmbH – Ismaning",
      "type": "Löschungsankündigung",
      "state": "Bayern",
      "amtsgericht": "Amtsgericht München",
      "registernummer": "HRB 216138",
      "registerart": "HRB",
      "company_name": "noDNA GmbH",
      "company_seat": "Ismaning",
      "details": "30.04.2025 (Bekanntmachungsdatum)\n\nBayern Amtsgericht München HRB 216138\nLöschungsankündigung 28.04.2025 (Eintragungsdatum)\n\nnoDNA GmbH\nGesellschaft mit beschränkter Haftung\nIsmaning\n\nDas Registergericht beabsichtigt, die im Handelsregister eingetragene Gesellschaft wegen Vermögenslosigkeit von Amts wegen nach § 394 FamFG zu löschen. Die Frist zur Erhebung eines Widerspruchs ist auf drei Monate festgesetzt."
    },
    {
      "date": "2025-04-30",
      "id": "107707",
      "original_text": "Registerbekanntmachung nach dem Umwandlungsgesetz\nBayern Amtsgericht München HRB 151230\nopen your eyes GmbH – München",
      "type": "Registerbekanntmachung nach dem Umwandlungsgesetz",
      "state": "Bayern",
      "amtsgericht": "Amtsgericht München",
      "registernummer": "HRB 151230",
      "registerart": "HRB",
      "company_name": "open your eyes GmbH",
      "company_seat": "München",
      "details": "30.04.2025 (Bekanntmachungsdatum)\n\nBayern Amtsgericht München HRB 151230\nRegisterbekanntmachung nach dem Umwandlungsgesetz 29.04.2025 (Eintragungsdatum)\n\nopen your eyes GmbH\nGesellschaft mit beschränkter Haftung\nMünchen\n\nDen Gläubigern der an der Verschmelzung beteiligten Rechtsträger ist, wenn sie binnen sechs Monaten nach dem Tag, an dem die Eintragung der Verschmelzung in das Register des Sitzes desjenigen Rechtsträgers, dessen Gläubiger sie sind, nach § 19 Abs. 3 UmwG als bekannt gemacht gilt, ihren Anspruch nach Grund und Höhe in Textform anmelden, Sicherheit zu leisten, soweit sie nicht Befriedigung verlangen können. Dieses Recht steht den Gläubigern jedoch nur zu, wenn sie glaubhaft machen, dass durch die Verschmelzung die Erfüllung ihrer Forderung gefährdet wird."
    },
    {
      "date": "2025-04-30",
      "id": "107708",
      "original_text": "Registerbekanntmachung nach dem Umwandlungsgesetz\nBayern Amtsgericht München HRB 290920\nVALETO Invest GmbH – München",
      "type": "Registerbekanntmachung nach dem Umwandlungsgesetz",
      "state": "Bayern",
      "amtsgericht": "Amtsgericht München",
      "registernummer": "HRB 290920",
      "registerart": "HRB",
      "company_name": "VALETO Invest GmbH",
      "company_seat": "München",
      "details": "30.04.2025 (Bekanntmachungsdatum)\n\nBayern Amtsgericht München HRB 290920\nRegisterbekanntmachung nach dem Umwandlungsgesetz 29.04.2025 (Eintragungsdatum)\n\nVALETO Invest GmbH\nGesellschaft mit beschränkter Haftung\nMünchen\n\nDen Gläubigern der an der Verschmelzung beteiligten Rechtsträger ist, wenn sie binnen sechs Monaten nach dem Tag, an dem die Eintragung der Verschmelzung in das Register des Sitzes desjenigen Rechtsträgers, dessen Gläubiger sie sind, nach § 19 Abs. 3 UmwG als bekannt gemacht gilt, ihren Anspruch nach Grund und Höhe in Textform anmelden, Sicherheit zu leisten, soweit sie nicht Befriedigung verlangen können. Dieses Recht steht den Gläubigern jedoch nur zu, wenn sie glaubhaft machen, dass durch die Verschmelzung die Erfüllung ihrer Forderung gefährdet wird."
    },
    {
      "date": "2025-04-30",
      "id": "107709",
      "original_text": "Einreichung neuer Dokumente\nBayern Amtsgericht Bayreuth HRB 8041\nEIN Sesselmann AG – Stadtsteinach",
      "type": "Einreichung neuer Dokumente",
      "state": "Bayern",
      "amtsgericht": "Amtsgericht Bayreuth",
      "registernummer": "HRB 8041",
      "registerart": "HRB",
      "company_name": "EIN Sesselmann AG",
      "company_seat": "Stadtsteinach",
      "details": "30.04.2025 (Bekanntmachungsdatum)\n\nBayern Amtsgericht Bayreuth HRB 8041\nEinreichung neuer Dokumente\n\nEIN Sesselmann AG\nAktiengesellschaft\nStadtsteinach\n\nDem Amtsgericht Bayreuth -Registergericht- ist eine Liste der Mitglieder des Aufsichtsrats eingereicht worden, § 106 AktG."
    },
    {
      "date": "2025-04-30",
      "id": "107710",
      "original_text": "Löschungsankündigung\nBayern Amtsgericht Weiden i. d. OPf. HRB 5149\nDR Job GmbH – Neustadt a.d.Waldnaab",
      "type": "Löschungsankündigung",
      "state": "Bayern",
      "amtsgericht": "Amtsgericht Weiden i. d. OPf.",
      "registernummer": "HRB 5149",
      "registerart": "HRB",
      "company_name": "DR Job GmbH",
      "company_seat": "Neustadt a.d.Waldnaab",
      "details": "30.04.2025 (Bekanntmachungsdatum)\n\nBayern Amtsgericht Weiden i. d. OPf. HRB 5149\nLöschungsankündigung 29.04.2025 (Eintragungsdatum)\n\nDR Job GmbH\nGesellschaft mit beschränkter Haftung\nNeustadt a.d.Waldnaab\n\nDas Registergericht beabsichtigt, die im Handelsregister eingetragene Gesellschaft DR Job GmbH, gesetzlich vertreten durch den Geschäftsführer Martin Dimitrov, derzeit unbekannten Aufenthalts, wegen Vermögenslosigkeit von Amts wegen nach § 394 FamFG zu löschen. Die Frist zur Erhebung eines Widerspruchs ist auf sechs Wochen ab öffentlicher Bekanntmachung dieses Schreibens gem. § 393 Abs. 2 FamFG, § 10 HGB festgesetzt."
    },
    {
      "date": "2025-04-30",
      "id": "107711",
      "original_text": "Löschungsankündigung\nBayern Amtsgericht München HRB 248770\nMyHome Trading GmbH – München",
      "type": "Löschungsankündigung",
      "state": "Bayern",
      "amtsgericht": "Amtsgericht München",
      "registernummer": "HRB 248770",
      "registerart": "HRB",
      "company_name": "MyHome Trading GmbH",
      "company_seat": "München",
      "details": "30.04.2025 (Bekanntmachungsdatum)\n\nBayern Amtsgericht München HRB 248770\nLöschungsankündigung\n\nMyHome Trading GmbH\nGesellschaft mit beschränkter Haftung\nMünchen\n\nDas Registergericht beabsichtigt, die im Handelsregister eingetragene Gesellschaft wegen Vermögenslosigkeit von Amts wegen nach § 394 FamFG zu löschen. Die Frist zur Erhebung eines Widerspruchs ist auf drei Monate festgesetzt."
    },
    {
      "date": "2025-04-30",
      "id": "107712",
      "original_text": "Einreichung neuer Dokumente\nBayern Amtsgericht München HRB 232763\nMynaric AG – Gilching",
      "type": "Einreichung neuer Dokumente",
      "state": "Bayern",
      "amtsgericht": "Amtsgericht München",
      "registernummer": "HRB 232763",
      "registerart": "HRB",
      "company_name": "Mynaric AG",
      "company_seat": "Gilching",
      "details": "30.04.2025 (Bekanntmachungsdatum)\n\nBayern Amtsgericht München HRB 232763\nEinreichung neuer Dokumente 29.04.2025 (Eintragungsdatum)\n\nMynaric AG\nAktiengesellschaft\nGilching\n\nDem Amtsgericht München -Registergericht- ist eine Liste der Mitglieder des Aufsichtsrats eingereicht worden, § 106 AktG."
    },
    {
      "date": "2025-04-30",
      "id": "107713",
      "original_text": "Löschungsankündigung\nBayern Amtsgericht Nürnberg HRB 42220\neasydigi.me UG (haftungsbeschränkt) – Nürnberg",
      "type": "Löschungsankündigung",
      "state": "Bayern",
      "amtsgericht": "Amtsgericht Nürnberg",
      "registernummer": "HRB 42220",
      "registerart": "HRB",
      "company_name": "easydigi.me UG (haftungsbeschränkt)",
      "company_seat": "Nürnberg",
      "details": "30.04.2025 (Bekanntmachungsdatum)\n\nBayern Amtsgericht Nürnberg HRB 42220\nLöschungsankündigung\n\neasydigi.me UG (haftungsbeschränkt)\nGesellschaft mit beschränkter Haftung\nNürnberg\n\nDas Registergericht beabsichtigt, die im Handelsregister eingetragene Gesellschaft wegen Vermögenslosigkeit von Amts wegen nach § 394 FamFG zu löschen. Die Frist zur Erhebung eines Widerspruchs ist auf einen Monat festgesetzt."
    },
    {
      "date": "2025-04-30",
      "id": "107714",
      "original_text": "Löschungsankündigung\nBayern Amtsgericht München HRB 267996\nAY Bau UG (haftungsbeschränkt) – München",
      "type": "Löschungsankündigung",
      "state": "Bayern",
      "amtsgericht": "Amtsgericht München",
      "registernummer": "HRB 267996",
      "registerart": "HRB",
      "company_name": "AY Bau UG (haftungsbeschränkt)",
      "company_seat": "München",
      "details": "30.04.2025 (Bekanntmachungsdatum)\n\nBayern Amtsgericht München HRB 267996\nLöschungsankündigung\n\nAY Bau UG (haftungsbeschränkt)\nGesellschaft mit beschränkter Haftung\nMünchen\n\nDas Registergericht beabsichtigt, die im Handelsregister eingetragene Gesellschaft wegen Vermögenslosigkeit von Amts wegen nach § 394 FamFG zu löschen. Die Frist zur Erhebung eines Widerspruchs ist auf drei Monate festgesetzt."
    },
    {
      "date": "2025-04-30",
      "id": "107715",
      "original_text": "Registerbekanntmachung nach dem Umwandlungsgesetz\nBayern Amtsgericht Kempten (Allgäu) HRB 1590\nCONCRETE Rudolph GmbH – Ellhofen, Gemeinde Weiler-Simmerberg",
      "type": "Registerbekanntmachung nach dem Umwandlungsgesetz",
      "state": "Bayern",
      "amtsgericht": "Amtsgericht Kempten (Allgäu)",
      "registernummer": "HRB 1590",
      "registerart": "HRB",
      "company_name": "CONCRETE Rudolph GmbH",
      "company_seat": "Ellhofen, Gemeinde Weiler-Simmerberg",
      "details": "30.04.2025 (Bekanntmachungsdatum)\n\nBayern Amtsgericht Kempten (Allgäu) HRB 1590\nRegisterbekanntmachung nach dem Umwandlungsgesetz 29.04.2025 (Eintragungsdatum)\n\nCONCRETE Rudolph GmbH\nGesellschaft mit beschränkter Haftung\nEllhofen, Gemeinde Weiler-Simmerberg\n\nDen Gläubigern der an der Verschmelzung beteiligten Rechtsträger ist, wenn sie binnen sechs Monaten nach dem Tag, an dem die Eintragung der Verschmelzung in das Register des Sitzes desjenigen Rechtsträgers, dessen Gläubiger sie sind, nach § 19 Abs. 3 UmwG als bekannt gemacht gilt, ihren Anspruch nach Grund und Höhe in Textform anmelden, Sicherheit zu leisten, soweit sie nicht Befriedigung verlangen können. Dieses Recht steht den Gläubigern jedoch nur zu, wenn sie glaubhaft machen, dass durch die Verschmelzung die Erfüllung ihrer Forderung gefährdet wird."
    },
    {
      "date": "2025-04-30",
      "id": "107716",
      "original_text": "Sonstige Registerbekanntmachung\nBayern Amtsgericht Bayreuth HRB 8029\nAlpha Layer GTS GmbH – Bayreuth",
      "type": "Sonstige Registerbekanntmachung",
      "state": "Bayern",
      "amtsgericht": "Amtsgericht Bayreuth",
      "registernummer": "HRB 8029",
      "registerart": "HRB",
      "company_name": "Alpha Layer GTS GmbH",
      "company_seat": "Bayreuth",
      "details": "30.04.2025 (Bekanntmachungsdatum)\n\nBayern Amtsgericht Bayreuth HRB 8029\nSonstige Registerbekanntmachung 29.04.2025 (Eintragungsdatum)\n\nAlpha Layer GTS GmbH\nGesellschaft mit beschränkter Haftung\nBayreuth\n\nDen Gläubigern der an der Verschmelzung beteiligten Rechtsträger ist, wenn sie binnen sechs Monaten nach dem Tag, an dem die Eintragung der Verschmelzung in das Register des Sitzes desjenigen Rechtsträgers, dessen Gläubiger sie sind, nach § 19 Abs. 3 UmwG als bekannt gemacht gilt, ihren Anspruch nach Grund und Höhe in Textform anmelden, Sicherheit zu leisten, soweit sie nicht Befriedigung verlangen können. Dieses Recht steht den Gläubigern jedoch nur zu, wenn sie glaubhaft machen, dass durch die Verschmelzung die Erfüllung ihrer Forderung gefährdet wird."
    },
    {
      "date": "2025-04-30",
      "id": "107717",
      "original_text": "Löschungsankündigung\nBayern Amtsgericht Weiden i. d. OPf. HRB 2950\nSolvoltaik Verwaltungs GmbH – Weiden i. d. OPf.",
      "type": "Löschungsankündigung",
      "state": "Bayern",
      "amtsgericht": "Amtsgericht Weiden i. d. OPf.",
      "registernummer": "HRB 2950",
      "registerart": "HRB",
      "company_name": "Solvoltaik Verwaltungs GmbH",
      "company_seat": "Weiden i. d. OPf.",
      "details": "30.04.2025 (Bekanntmachungsdatum)\n\nBayern Amtsgericht Weiden i. d. OPf. HRB 2950\nLöschungsankündigung 29.04.2025 (Eintragungsdatum)\n\nSolvoltaik Verwaltungs GmbH\nGesellschaft mit beschränkter Haftung\nWeiden i. d. OPf.\n\nDas Registergericht beabsichtigt, die im Handelsregister eingetragene Gesellschaft Solvoltaik Verwaltungs GmbH, gesetzlich vertreten durch den Geschäftsführer Josef Joachim Gmeiner, derzeit unbekannten Aufenthalts, wegen Vermögenslosigkeit von Amts wegen nach § 394 FamFG zu löschen. Die Frist zur Erhebung eines Widerspruchs ist auf sechs Wochen ab öffentlicher Bekanntmachung dieses Schreibens gem. § 393 Abs. 2 FamFG, § 10 HGB festgesetzt."
    },
    {
      "date": "2025-04-30",
      "id": "107718",
      "original_text": "Registerbekanntmachung nach dem Umwandlungsgesetz\nBayern Amtsgericht München HRB 264194\nUlrich 31 SC FIII Holding GmbH – München",
      "type": "Registerbekanntmachung nach dem Umwandlungsgesetz",
      "state": "Bayern",
      "amtsgericht": "Amtsgericht München",
      "registernummer": "HRB 264194",
      "registerart": "HRB",
      "company_name": "Ulrich 31 SC FIII Holding GmbH",
      "company_seat": "München",
      "details": "30.04.2025 (Bekanntmachungsdatum)\n\nBayern Amtsgericht München HRB 264194\nRegisterbekanntmachung nach dem Umwandlungsgesetz 29.04.2025 (Eintragungsdatum)\n\nUlrich 31 SC FIII Holding GmbH\nGesellschaft mit beschränkter Haftung\nMünchen\n\nDen Gläubigern der an der Verschmelzung beteiligten Rechtsträger ist, wenn sie binnen sechs Monaten nach dem Tag, an dem die Eintragung der Verschmelzung in das Register des Sitzes desjenigen Rechtsträgers, dessen Gläubiger sie sind, nach § 19 Abs. 3 UmwG als bekannt gemacht gilt, ihren Anspruch nach Grund und Höhe in Textform anmelden, Sicherheit zu leisten, soweit sie nicht Befriedigung verlangen können. Dieses Recht steht den Gläubigern jedoch nur zu, wenn sie glaubhaft machen, dass durch die Verschmelzung die Erfüllung ihrer Forderung gefährdet wird."
    },
    {
      "date": "2025-04-30",
      "id": "107719",
      "original_text": "Einreichung neuer Dokumente\nBaden-Württemberg Amtsgericht Stuttgart HRB 20886\nKnow How! Aktiengesellschaft – Leinfelden-Echterdingen",
      "type": "Einreichung neuer Dokumente",
      "state": "Baden-Württemberg",
      "amtsgericht": "Amtsgericht Stuttgart",
      "registernummer": "HRB 20886",
      "registerart": "HRB",
      "company_name": "Know How! Aktiengesellschaft",
      "company_seat": "Leinfelden-Echterdingen",
      "details": "30.04.2025 (Bekanntmachungsdatum)\n\nBaden-Württemberg Amtsgericht Stuttgart HRB 20886\nEinreichung neuer Dokumente\n\nKnow How! Aktiengesellschaft\nAktiengesellschaft\nLeinfelden-Echterdingen\n\nAls nicht eingetragen wird bekanntgemacht:\nDie Gesellschaft hat am 29.04.2025 die Liste über die Zusammensetzung des Aufsichtsrats zum Handelsregister eingereicht."
    },
    {
      "date": "2025-04-30",
      "id": "107720",
      "original_text": "Löschungsankündigung\nSaarland Amtsgericht Saarbrücken HRB 19941\nStoral Überdachungstechnik GmbH – Kleinblittersdorf",
      "type": "Löschungsankündigung",
      "state": "Saarland",
      "amtsgericht": "Amtsgericht Saarbrücken",
      "registernummer": "HRB 19941",
      "registerart": "HRB",
      "company_name": "Storal Überdachungstechnik GmbH",
      "company_seat": "Kleinblittersdorf",
      "details": "30.04.2025 (Bekanntmachungsdatum)\n\nSaarland Amtsgericht Saarbrücken HRB 19941\nLöschungsankündigung\n\nStoral Überdachungstechnik GmbH\nGesellschaft mit beschränkter Haftung\nKleinblittersdorf\n\nEs ist beabsichtigt, die Gesellschaft von Amts wegen gemäß § 394 FamFG wegen Vermögenslosigkeit zu löschen.\nGegen die Löschung von Amts wegen ist das Rechtsmittel des Widerspruchs statthaft. Der Widerspruch ist binnen einer Frist zwei Monaten beginnend mit dem Tag dieser Veröffentlichung durch Einreichen eines Widerspruchsschreibens -schriftlich oder zur Niederschrift der Geschäftsstelle beim Amtsgericht Saarbrücken, -zentrales Handelsregister-, Mainzerstr.178, 66121 Saarbrücken einzulegen.\nDer Widerspruch muss die Bezeichnung der angefochtenen Löschungsankündigung enthalten sowie die Erklärung, dass Widerspruch eingelegt wird. Er ist vom Widerspruchsführer oder seinem Bevollmächtigten zu unterzeichnen.\nDas Widerspruchsschreiben kann auch in der Form eines elektronischen Dokumentes eingereicht werden, das mit einer qualifizierten elektronischen Signatur nach dem Signaturgesetz versehen sein muss (§§ 14 Abs. 2 FamFG, 130a, 298 ZPO)."
    },
    {
      "date": "2025-04-30",
      "id": "107721",
      "original_text": "Löschungsankündigung\nBerlin Amtsgericht Berlin (Charlottenburg) HRB 82764\nTulimex GmbH – Berlin",
      "type": "Löschungsankündigung",
      "state": "Berlin",
      "amtsgericht": "Amtsgericht Berlin (Charlottenburg)",
      "registernummer": "HRB 82764",
      "registerart": "HRB",
      "company_name": "Tulimex GmbH",
      "company_seat": "Berlin",
      "details": "30.04.2025 (Bekanntmachungsdatum)\n\nBerlin Amtsgericht Berlin (Charlottenburg) HRB 82764\nLöschungsankündigung\n\nTulimex GmbH\nGesellschaft mit beschränkter Haftung\nBerlin\n\nBei der nachstehenden Gesellschaft wird das Amtslöschungsverfahren gemäß § 394 FamFG eingeleitet. Widerspruchsfrist 6 Wochen"
    },
    {
      "date": "2025-04-30",
      "id": "107722",
      "original_text": "Löschungsankündigung\nSachsen-Anhalt Amtsgericht Stendal HRB 103606\nLichtenfeld & Richter Gebäudereinigung GmbH – Schönebeck/Elbe",
      "type": "Löschungsankündigung",
      "state": "Sachsen-Anhalt",
      "amtsgericht": "Amtsgericht Stendal",
      "registernummer": "HRB 103606",
      "registerart": "HRB",
      "company_name": "Lichtenfeld & Richter Gebäudereinigung GmbH",
      "company_seat": "Schönebeck/Elbe",
      "details": "30.04.2025 (Bekanntmachungsdatum)\n\nSachsen-Anhalt Amtsgericht Stendal HRB 103606\nLöschungsankündigung 17.03.2025 (Eintragungsdatum)\n\nLichtenfeld & Richter Gebäudereinigung GmbH\nGesellschaft mit beschränkter Haftung\nSchönebeck/Elbe\n\nDas Registergericht beabsichtigt, nachfolgende Gesellschaften wegen Vermögenslosigkeit von Amts wegen nach § 394 FamFG zu löschen. Die Frist zur Erhebung eines Widerspruchs gegen die beabsichtigte Löschung wird auf drei Monate festgesetzt."
    },
    {
      "date": "2025-04-30",
      "id": "107723",
      "original_text": "Registerbekanntmachung nach dem Umwandlungsgesetz\nBaden-Württemberg Amtsgericht Mannheim HRA 712532\nRobin Rettka e.K. – Karlsruhe",
      "type": "Registerbekanntmachung nach dem Umwandlungsgesetz",
      "state": "Baden-Württemberg",
      "amtsgericht": "Amtsgericht Mannheim",
      "registernummer": "HRA 712532",
      "registerart": "HRA",
      "company_name": "Robin Rettka e.K.",
      "company_seat": "Karlsruhe",
      "details": "30.04.2025 (Bekanntmachungsdatum)\n\nBaden-Württemberg Amtsgericht Mannheim HRA 712532\nRegisterbekanntmachung nach dem Umwandlungsgesetz 30.04.2025 (Eintragungsdatum)\n\nRobin Rettka e.K.\nEinzelkaufmann / Einzelkauffrau\nKarlsruhe\n\nDen Gläubigern der an der Ausgliederung beteiligten Rechtsträger ist, wenn sie binnen sechs Monaten nach dem Tag, an dem die Eintragung der Ausgliederung in das Register des Sitzes desjenigen Rechtsträgers, dessen Gläubiger sie sind, nach § 19 Abs. 3 UmwG als bekanntgemacht gilt, ihren Anspruch nach Grund und Höhe schriftlich anmelden, Sicherheit zu leisten, soweit sie nicht Befriedigung verlangen können. Dieses Recht steht den Gläubigern jedoch nur zu, wenn sie glaubhaft machen, dass durch die Ausgliederung die Erfüllung ihrer Forderung gefährdet wird."
    },
    {
      "date": "2025-04-30",
      "id": "107724",
      "original_text": "Registerbekanntmachung nach dem Umwandlungsgesetz\nBaden-Württemberg Amtsgericht Mannheim HRA 712476\nOle Neumann e.K. – Malsch",
      "type": "Registerbekanntmachung nach dem Umwandlungsgesetz",
      "state": "Baden-Württemberg",
      "amtsgericht": "Amtsgericht Mannheim",
      "registernummer": "HRA 712476",
      "registerart": "HRA",
      "company_name": "Ole Neumann e.K.",
      "company_seat": "Malsch",
      "details": "30.04.2025 (Bekanntmachungsdatum)\n\nBaden-Württemberg Amtsgericht Mannheim HRA 712476\nRegisterbekanntmachung nach dem Umwandlungsgesetz 30.04.2025 (Eintragungsdatum)\n\nOle Neumann e.K.\nEinzelkaufmann / Einzelkauffrau\nMalsch\n\nAls nicht eingetragen wird bekanntgemacht:\nDen Gläubigern der an der Ausgliederung beteiligten Rechtsträger ist, wenn sie binnen sechs Monaten nach dem Tag, an dem die Eintragung der Ausgliederung in das Register des Sitzes desjenigen Rechtsträgers, dessen Gläubiger sie sind, nach § 19 Abs. 3 UmwG als bekanntgemacht gilt, ihren Anspruch nach Grund und Höhe schriftlich anmelden, Sicherheit zu leisten, soweit sie nicht Befriedigung verlangen können. Dieses Recht steht den Gläubigern jedoch nur zu, wenn sie glaubhaft machen, dass durch die Ausgliederung die Erfüllung ihrer Forderung gefährdet wird."
    },
    {
      "date": "2025-04-30",
      "id": "107725",
      "original_text": "Registerbekanntmachung nach dem Umwandlungsgesetz\nBaden-Württemberg Amtsgericht Mannheim HRB 754369\natcetera GmbH – Malsch",
      "type": "Registerbekanntmachung nach dem Umwandlungsgesetz",
      "state": "Baden-Württemberg",
      "amtsgericht": "Amtsgericht Mannheim",
      "registernummer": "HRB 754369",
      "registerart": "HRB",
      "company_name": "atcetera GmbH",
      "company_seat": "Malsch",
      "details": "30.04.2025 (Bekanntmachungsdatum)\n\nBaden-Württemberg Amtsgericht Mannheim HRB 754369\nRegisterbekanntmachung nach dem Umwandlungsgesetz 30.04.2025 (Eintragungsdatum)\n\natcetera GmbH\nGesellschaft mit beschränkter Haftung\nMalsch\n\nDen Gläubigern der an der Ausgliederung beteiligten Rechtsträger ist, wenn sie binnen sechs Monaten nach dem Tag, an dem die Eintragung der Ausgliederung in das Register des Sitzes desjenigen Rechtsträgers, dessen Gläubiger sie sind, nach § 19 Abs. 3 UmwG als bekanntgemacht gilt, ihren Anspruch nach Grund und Höhe schriftlich anmelden, Sicherheit zu leisten, soweit sie nicht Befriedigung verlangen können. Dieses Recht steht den Gläubigern jedoch nur zu, wenn sie glaubhaft machen, dass durch die Ausgliederung die Erfüllung ihrer Forderung gefährdet wird."
    },
    {
      "date": "2025-04-30",
      "id": "107726",
      "original_text": "Registerbekanntmachung nach dem Umwandlungsgesetz\nBaden-Württemberg Amtsgericht Mannheim HRB 753122\nRR Digital GmbH – Karlsruhe",
      "type": "Registerbekanntmachung nach dem Umwandlungsgesetz",
      "state": "Baden-Württemberg",
      "amtsgericht": "Amtsgericht Mannheim",
      "registernummer": "HRB 753122",
      "registerart": "HRB",
      "company_name": "RR Digital GmbH",
      "company_seat": "Karlsruhe",
      "details": "30.04.2025 (Bekanntmachungsdatum)\n\nBaden-Württemberg Amtsgericht Mannheim HRB 753122\nRegisterbekanntmachung nach dem Umwandlungsgesetz 30.04.2025 (Eintragungsdatum)\n\nRR Digital GmbH\nGesellschaft mit beschränkter Haftung\nKarlsruhe\n\nDen Gläubigern der an der Ausgliederung beteiligten Rechtsträger ist, wenn sie binnen sechs Monaten nach dem Tag, an dem die Eintragung der Ausgliederung in das Register des Sitzes desjenigen Rechtsträgers, dessen Gläubiger sie sind, nach § 19 Abs. 3 UmwG als bekanntgemacht gilt, ihren Anspruch nach Grund und Höhe schriftlich anmelden, Sicherheit zu leisten, soweit sie nicht Befriedigung verlangen können. Dieses Recht steht den Gläubigern jedoch nur zu, wenn sie glaubhaft machen, dass durch die Ausgliederung die Erfüllung ihrer Forderung gefährdet wird."
    },
    {
      "date": "2025-04-30",
      "id": "107727",
      "original_text": "Löschungsankündigung\nBerlin Amtsgericht Berlin (Charlottenburg) HRB 150821\nequadr.at GmbH – Berlin",
      "type": "Löschungsankündigung",
      "state": "Berlin",
      "amtsgericht": "Amtsgericht Berlin (Charlottenburg)",
      "registernummer": "HRB 150821",
      "registerart": "HRB",
      "company_name": "equadr.at GmbH",
      "company_seat": "Berlin",
      "details": "30.04.2025 (Bekanntmachungsdatum)\n\nBerlin Amtsgericht Berlin (Charlottenburg) HRB 150821\nLöschungsankündigung\n\nequadr.at GmbH\nGesellschaft mit beschränkter Haftung\nBerlin\n\nBei der nachstehenden Gesellschaft wird das Amtslöschungsverfahren gemäß § 394 FamFG eingeleitet. Widerspruchsfrist 6 Wochen"
    },
    {
      "date": "2025-04-30",
      "id": "107728",
      "original_text": "Einreichung neuer Dokumente\nBaden-Württemberg Amtsgericht Stuttgart HRB 400596\nGottlieb Gühring Beteiligungsgesellschaft mbH – Albstadt",
      "type": "Einreichung neuer Dokumente",
      "state": "Baden-Württemberg",
      "amtsgericht": "Amtsgericht Stuttgart",
      "registernummer": "HRB 400596",
      "registerart": "HRB",
      "company_name": "Gottlieb Gühring Beteiligungsgesellschaft mbH",
      "company_seat": "Albstadt",
      "details": "30.04.2025 (Bekanntmachungsdatum)\n\nBaden-Württemberg Amtsgericht Stuttgart HRB 400596\nEinreichung neuer Dokumente\n\nGottlieb Gühring Beteiligungsgesellschaft mbH\nGesellschaft mit beschränkter Haftung\nAlbstadt\n\nDie Gesellschaft hat am 28.04.2025 die Liste über die Zusammensetzung des Aufsichtsrats zum Handelsregister eingereicht."
    },
    {
      "date": "2025-04-30",
      "id": "107729",
      "original_text": "Löschungsankündigung\nBerlin Amtsgericht Berlin (Charlottenburg) HRB 153832\nMKB Ingenieur Bau GmbH – Berlin",
      "type": "Löschungsankündigung",
      "state": "Berlin",
      "amtsgericht": "Amtsgericht Berlin (Charlottenburg)",
      "registernummer": "HRB 153832",
      "registerart": "HRB",
      "company_name": "MKB Ingenieur Bau GmbH",
      "company_seat": "Berlin",
      "details": "30.04.2025 (Bekanntmachungsdatum)\n\nBerlin Amtsgericht Berlin (Charlottenburg) HRB 153832\nLöschungsankündigung\n\nMKB Ingenieur Bau GmbH\nGesellschaft mit beschränkter Haftung\nBerlin\n\nBei der nachstehenden Gesellschaft wird das Amtslöschungsverfahren gemäß § 394 FamFG eingeleitet. Widerspruchsfrist 6 Wochen"
    },
    {
      "date": "2025-04-30",
      "id": "107730",
      "original_text": "Löschungsankündigung\nBerlin Amtsgericht Berlin (Charlottenburg) HRB 102037\nERBA Projektentwicklungs GmbH – Berlin",
      "type": "Löschungsankündigung",
      "state": "Berlin",
      "amtsgericht": "Amtsgericht Berlin (Charlottenburg)",
      "registernummer": "HRB 102037",
      "registerart": "HRB",
      "company_name": "ERBA Projektentwicklungs GmbH",
      "company_seat": "Berlin",
      "details": "30.04.2025 (Bekanntmachungsdatum)\n\nBerlin Amtsgericht Berlin (Charlottenburg) HRB 102037\nLöschungsankündigung\n\nERBA Projektentwicklungs GmbH\nGesellschaft mit beschränkter Haftung\nBerlin\n\nBei der nachstehenden Gesellschaft wird das Amtslöschungsverfahren gemäß § 394 FamFG eingeleitet. Widerspruchsfrist 6 Wochen"
    },
    {
      "date": "2025-04-30",
      "id": "107731",
      "original_text": "Einreichung neuer Dokumente\nBaden-Württemberg Amtsgericht Mannheim HRB 101879\nMICHELIN REIFENWERKE AG & Co. Kommanditgesellschaft auf Aktien – Karlsruhe",
      "type": "Einreichung neuer Dokumente",
      "state": "Baden-Württemberg",
      "amtsgericht": "Amtsgericht Mannheim",
      "registernummer": "HRB 101879",
      "registerart": "HRB",
      "company_name": "MICHELIN REIFENWERKE AG & Co. Kommanditgesellschaft auf Aktien",
      "company_seat": "Karlsruhe",
      "details": "30.04.2025 (Bekanntmachungsdatum)\n\nBaden-Württemberg Amtsgericht Mannheim HRB 101879\nEinreichung neuer Dokumente\n\nMICHELIN REIFENWERKE AG & Co. Kommanditgesellschaft auf Aktien\nKommanditgesellschaft auf Aktien\nKarlsruhe\n\nDie Gesellschaft hat am 28.04.2025 die Liste über die Zusammensetzung des Aufsichtsrats zum Handelsregister eingereicht."
    },
    {
      "date": "2025-04-30",
      "id": "107732",
      "original_text": "Einreichung neuer Dokumente\nBaden-Württemberg Amtsgericht Ulm HRB 721911\nUWS Service GmbH – Ulm",
      "type": "Einreichung neuer Dokumente",
      "state": "Baden-Württemberg",
      "amtsgericht": "Amtsgericht Ulm",
      "registernummer": "HRB 721911",
      "registerart": "HRB",
      "company_name": "UWS Service GmbH",
      "company_seat": "Ulm",
      "details": "30.04.2025 (Bekanntmachungsdatum)\n\nBaden-Württemberg Amtsgericht Ulm HRB 721911\nEinreichung neuer Dokumente\n\nUWS Service GmbH\nGesellschaft mit beschränkter Haftung\nUlm\n\nDie Gesellschaft hat am 29.04.2025 die Liste über die Zusammensetzung des Aufsichtsrats zum Handelsregister eingereicht."
    },
    {
      "date": "2025-04-30",
      "id": "107733",
      "original_text": "Einreichung neuer Dokumente\nBaden-Württemberg Amtsgericht Freiburg HRB 701883\nESONO AG – Freiburg im Breisgau",
      "type": "Einreichung neuer Dokumente",
      "state": "Baden-Württemberg",
      "amtsgericht": "Amtsgericht Freiburg",
      "registernummer": "HRB 701883",
      "registerart": "HRB",
      "company_name": "ESONO AG",
      "company_seat": "Freiburg im Breisgau",
      "details": "30.04.2025 (Bekanntmachungsdatum)\n\nBaden-Württemberg Amtsgericht Freiburg HRB 701883\nEinreichung neuer Dokumente\n\nESONO AG\nAktiengesellschaft\nFreiburg im Breisgau\n\nDie Gesellschaft hat am 09.04.2025 die Liste über die Zusammensetzung des Aufsichtsrats zum Handelsregister eingereicht."
    },
    {
      "date": "2025-04-30",
      "id": "107734",
      "original_text": "Registerbekanntmachung nach dem Umwandlungsgesetz\nBerlin Amtsgericht Berlin (Charlottenburg) HRB 191321\nTitan Bottrop Holding GmbH – Berlin",
      "type": "Registerbekanntmachung nach dem Umwandlungsgesetz",
      "state": "Berlin",
      "amtsgericht": "Amtsgericht Berlin (Charlottenburg)",
      "registernummer": "HRB 191321",
      "registerart": "HRB",
      "company_name": "Titan Bottrop Holding GmbH",
      "company_seat": "Berlin",
      "details": "30.04.2025 (Bekanntmachungsdatum)\n\nBerlin Amtsgericht Berlin (Charlottenburg) HRB 191321\nRegisterbekanntmachung nach dem Umwandlungsgesetz 29.04.2025 (Eintragungsdatum)\n\nTitan Bottrop Holding GmbH\nGesellschaft mit beschränkter Haftung\nBerlin\n\nZu Eintragungsnummer 3 vom 29.04.2025 wird als nicht eingetragen veröffentlicht:\n\nDen Gläubigern der an der Verschmelzung beteiligten Rechtsträger ist, wenn sie binnen sechs Monaten nach dem Tag, an dem die Eintragung der Verschmelzung in das Register des Sitzes desjenigen Rechtsträgers, dessen Gläubiger sie sind, als bekannt gemacht gilt, ihren Anspruch nach Grund und Höhe schriftlich anmelden, Sicherheit zu leisten, soweit sie nicht Befriedigung verlangen können. Dieses Recht steht den Gläubigern jedoch nur zu, wenn sie glaubhaft machen, dass durch die Verschmelzung die Erfüllung ihrer Forderung gefährdet wird. Das Recht, Sicherheitsleistung zu verlangen, steht Gläubigern nicht zu, die im Falle der Insolvenz ein Recht auf vorzugsweise Befriedigung aus einer Deckungsmasse haben, die nach gesetzlicher Vorschrift zu ihrem Schutz errichtet und staatlich überwacht ist."
    },
    {
      "date": "2025-04-30",
      "id": "107735",
      "original_text": "Registerbekanntmachung nach dem Umwandlungsgesetz\nBaden-Württemberg Amtsgericht Stuttgart HRB 784156\nampere charging GmbH – Affalterbach",
      "type": "Registerbekanntmachung nach dem Umwandlungsgesetz",
      "state": "Baden-Württemberg",
      "amtsgericht": "Amtsgericht Stuttgart",
      "registernummer": "HRB 784156",
      "registerart": "HRB",
      "company_name": "ampere charging GmbH",
      "company_seat": "Affalterbach",
      "details": "30.04.2025 (Bekanntmachungsdatum)\n\nBaden-Württemberg Amtsgericht Stuttgart HRB 784156\nRegisterbekanntmachung nach dem Umwandlungsgesetz 30.04.2025 (Eintragungsdatum)\n\nampere charging GmbH\nGesellschaft mit beschränkter Haftung\nAffalterbach\n\nAls nicht eingetragen wird bekanntgemacht:\nDen Gläubigern der an der Verschmelzung beteiligten Rechtsträger ist, wenn sie binnen sechs Monaten nach dem Tag, an dem die Eintragung der Verschmelzung in das Register des Sitzes desjenigen Rechtsträgers, dessen Gläubiger sie sind, nach § 19 Abs. 3 UmwG als bekanntgemacht gilt, ihren Anspruch nach Grund und Höhe schriftlich anmelden, Sicherheit zu leisten, soweit sie nicht Befriedigung verlangen können. Dieses Recht steht den Gläubigern jedoch nur zu, wenn sie glaubhaft machen, dass durch die Verschmelzung die Erfüllung ihrer Forderung gefährdet wird."
    },
    {
      "date": "2025-04-30",
      "id": "107736",
      "original_text": "Registerbekanntmachung nach dem Umwandlungsgesetz\nBerlin Amtsgericht Berlin (Charlottenburg) HRB 175968\naptus 1073. GmbH – Berlin",
      "type": "Registerbekanntmachung nach dem Umwandlungsgesetz",
      "state": "Berlin",
      "amtsgericht": "Amtsgericht Berlin (Charlottenburg)",
      "registernummer": "HRB 175968",
      "registerart": "HRB",
      "company_name": "aptus 1073. GmbH",
      "company_seat": "Berlin",
      "details": "30.04.2025 (Bekanntmachungsdatum)\n\nBerlin Amtsgericht Berlin (Charlottenburg) HRB 175968\nRegisterbekanntmachung nach dem Umwandlungsgesetz 29.04.2025 (Eintragungsdatum)\n\naptus 1073. GmbH\nGesellschaft mit beschränkter Haftung\nBerlin\n\nZu Eintragungsnummer 7 vom 29.04.2025 wird als nicht eingetragen veröffentlicht:\n\nDen Gläubigern der an der Verschmelzung beteiligten Rechtsträger ist, wenn sie binnen sechs Monaten nach dem Tag, an dem die Eintragung der Verschmelzung in das Register des Sitzes desjenigen Rechtsträgers, dessen Gläubiger sie sind, als bekannt gemacht gilt, ihren Anspruch nach Grund und Höhe schriftlich anmelden, Sicherheit zu leisten, soweit sie nicht Befriedigung verlangen können. Dieses Recht steht den Gläubigern jedoch nur zu, wenn sie glaubhaft machen, dass durch die Verschmelzung die Erfüllung ihrer Forderung gefährdet wird. Das Recht, Sicherheitsleistung zu verlangen, steht Gläubigern nicht zu, die im Falle der Insolvenz ein Recht auf vorzugsweise Befriedigung aus einer Deckungsmasse haben, die nach gesetzlicher Vorschrift zu ihrem Schutz errichtet und staatlich überwacht ist."
    },
    {
      "date": "2025-04-30",
      "id": "107737",
      "original_text": "Löschungsankündigung\nBaden-Württemberg Amtsgericht Freiburg HRB 723901\nSTAGES Cycling GmbH – Kirchzarten",
      "type": "Löschungsankündigung",
      "state": "Baden-Württemberg",
      "amtsgericht": "Amtsgericht Freiburg",
      "registernummer": "HRB 723901",
      "registerart": "HRB",
      "company_name": "STAGES Cycling GmbH",
      "company_seat": "Kirchzarten",
      "details": "30.04.2025 (Bekanntmachungsdatum)\n\nBaden-Württemberg Amtsgericht Freiburg HRB 723901\nLöschungsankündigung\n\nSTAGES Cycling GmbH\nGesellschaft mit beschränkter Haftung\nKirchzarten\n\nDas Gericht beabsichtigt, die Gesellschaft wegen Vermögenslosigkeit im Handelsregister von Amts wegen nach § 394 FamFG zu löschen. Die Frist zur Geltendmachung eines Widerspruchs gegen die beabsichtigte Löschung ist auf einen Monat ab Veröffentlichung bestimmt."
    },
    {
      "date": "2025-04-30",
      "id": "107738",
      "original_text": "Löschungsankündigung\nBrandenburg Amtsgericht Frankfurt/Oder HRB 20592\nWKK Dienstleistung GmbH – Wandlitz",
      "type": "Löschungsankündigung",
      "state": "Brandenburg",
      "amtsgericht": "Amtsgericht Frankfurt/Oder",
      "registernummer": "HRB 20592",
      "registerart": "HRB",
      "company_name": "WKK Dienstleistung GmbH",
      "company_seat": "Wandlitz",
      "details": "30.04.2025 (Bekanntmachungsdatum)\n\nBrandenburg Amtsgericht Frankfurt/Oder HRB 20592\nLöschungsankündigung\n\nWKK Dienstleistung GmbH\nGesellschaft mit beschränkter Haftung\nWandlitz\n\nBei der nachstehenden Gesellschaft wird das Amtslöschungsverfahren gemäß § 394 FamFG eingeleitet."
    },
    {
      "date": "2025-04-30",
      "id": "107739",
      "original_text": "Löschungsankündigung\nBerlin Amtsgericht Berlin (Charlottenburg) HRB 169757\nMonimos Wirtschaftsberatungsgesellschaft mbH – Berlin",
      "type": "Löschungsankündigung",
      "state": "Berlin",
      "amtsgericht": "Amtsgericht Berlin (Charlottenburg)",
      "registernummer": "HRB 169757",
      "registerart": "HRB",
      "company_name": "Monimos Wirtschaftsberatungsgesellschaft mbH",
      "company_seat": "Berlin",
      "details": "30.04.2025 (Bekanntmachungsdatum)\n\nBerlin Amtsgericht Berlin (Charlottenburg) HRB 169757\nLöschungsankündigung\n\nMonimos Wirtschaftsberatungsgesellschaft mbH\nGesellschaft mit beschränkter Haftung\nBerlin\n\nBei der nachstehenden Gesellschaft wird das Amtslöschungsverfahren gemäß § 394 FamFG eingeleitet. Widerspruchsfrist 6 Wochen"
    },
    {
      "date": "2025-04-30",
      "id": "107740",
      "original_text": "Registerbekanntmachung nach dem Umwandlungsgesetz\nBaden-Württemberg Amtsgericht Stuttgart HRB 206932\ngastro total Deutschland GmbH – Pleidelsheim",
      "type": "Registerbekanntmachung nach dem Umwandlungsgesetz",
      "state": "Baden-Württemberg",
      "amtsgericht": "Amtsgericht Stuttgart",
      "registernummer": "HRB 206932",
      "registerart": "HRB",
      "company_name": "gastro total Deutschland GmbH",
      "company_seat": "Pleidelsheim",
      "details": "30.04.2025 (Bekanntmachungsdatum)\n\nBaden-Württemberg Amtsgericht Stuttgart HRB 206932\nRegisterbekanntmachung nach dem Umwandlungsgesetz 30.04.2025 (Eintragungsdatum)\n\ngastro total Deutschland GmbH\nGesellschaft mit beschränkter Haftung\nPleidelsheim\n\nDen Gläubigern der an der Verschmelzung beteiligten Rechtsträger ist, wenn sie binnen sechs Monaten nach dem Tag, an dem die Eintragung der Verschmelzung in das Register des Sitzes desjenigen Rechtsträgers, dessen Gläubiger sie sind, nach § 19 Abs. 3 UmwG als bekanntgemacht gilt, ihren Anspruch nach Grund und Höhe schriftlich anmelden, Sicherheit zu leisten, soweit sie nicht Befriedigung verlangen können. Dieses Recht steht den Gläubigern jedoch nur zu, wenn sie glaubhaft machen, dass durch die Verschmelzung die Erfüllung ihrer Forderung gefährdet wird."
    },
    {
      "date": "2025-04-30",
      "id": "107741",
      "original_text": "Löschungsankündigung\nSchleswig-Holstein Amtsgericht Flensburg HRB 369 KA\nMP-Verwaltungs GmbH – Kronsgaard",
      "type": "Löschungsankündigung",
      "state": "Schleswig-Holstein",
      "amtsgericht": "Amtsgericht Flensburg",
      "registernummer": "HRB 369 KA",
      "registerart": "HRB",
      "company_name": "MP-Verwaltungs GmbH",
      "company_seat": "Kronsgaard",
      "details": "30.04.2025 (Bekanntmachungsdatum)\n\nSchleswig-Holstein Amtsgericht Flensburg HRB 369 KA\nLöschungsankündigung\n\nMP-Verwaltungs GmbH\nGesellschaft mit beschränkter Haftung\nKronsgaard\n\nEs ist die Löschung der nachstehenden Gesellschaft wegen Vermögenslosigkeit gemäß § 394 FamFG beabsichtigt.\nWiderspruchsfrist: 2 Monate."
    },
    {
      "date": "2025-04-30",
      "id": "107742",
      "original_text": "Löschungsankündigung\nBaden-Württemberg Amtsgericht Stuttgart HRB 776740\nSaidinger GmbH – Gerlingen",
      "type": "Löschungsankündigung",
      "state": "Baden-Württemberg",
      "amtsgericht": "Amtsgericht Stuttgart",
      "registernummer": "HRB 776740",
      "registerart": "HRB",
      "company_name": "Saidinger GmbH",
      "company_seat": "Gerlingen",
      "details": "30.04.2025 (Bekanntmachungsdatum)\n\nBaden-Württemberg Amtsgericht Stuttgart HRB 776740\nLöschungsankündigung\n\nSaidinger GmbH\nGesellschaft mit beschränkter Haftung\nGerlingen\n\nDas Gericht beabsichtigt, die Gesellschaft wegen Vermögenslosigkeit im Handelsregister von Amts wegen nach § 394 FamFG zu löschen. Die Frist zur Geltendmachung eines Widerspruchs gegen die beabsichtigte Löschung ist auf zwei Monate ab Veröffentlichung bestimmt."
    },
    {
      "date": "2025-04-30",
      "id": "107743",
      "original_text": "Registerbekanntmachung nach dem Umwandlungsgesetz\nHamburg Amtsgericht Hamburg HRB 159470\nBPI GmbH – Hamburg",
      "type": "Registerbekanntmachung nach dem Umwandlungsgesetz",
      "state": "Hamburg",
      "amtsgericht": "Amtsgericht Hamburg",
      "registernummer": "HRB 159470",
      "registerart": "HRB",
      "company_name": "BPI GmbH",
      "company_seat": "Hamburg",
      "details": "30.04.2025 (Bekanntmachungsdatum)\n\nHamburg Amtsgericht Hamburg HRB 159470\nRegisterbekanntmachung nach dem Umwandlungsgesetz 30.04.2025 (Eintragungsdatum)\n\nBPI GmbH\nGesellschaft mit beschränkter Haftung\nHamburg\n\nAls nicht eingetragen wird bekannt gemacht:\nDen Gläubigern der an der Verschmelzung beteiligten Gesellschaften ist, wenn sie binnen sechs Monaten nach dem Tag, an dem die Eintragung der Verschmelzung in das Register des Sitzes desjenigen Rechtsträgers, dessen Gläubiger sie sind, nach § 19 Absatz 3 UmwG als bekannt gemacht gilt, ihren Anspruch nach Grund und Höhe schriftlich anmelden, Sicherheit zu leisten, soweit sie nicht Befriedigung verlangen können. Dieses Recht steht den Gläubigern jedoch nur zu, wenn sie glaubhaft machen, dass durch die Verschmelzung die Erfüllung ihrer Forderung gefährdet wird."
    },
    {
      "date": "2025-04-30",
      "id": "107744",
      "original_text": "Registerbekanntmachung nach dem Umwandlungsgesetz\nBerlin Amtsgericht Berlin (Charlottenburg) HRA 41605\nGBI Wohnungsbau GmbH & Co. KG – Berlin",
      "type": "Registerbekanntmachung nach dem Umwandlungsgesetz",
      "state": "Berlin",
      "amtsgericht": "Amtsgericht Berlin (Charlottenburg)",
      "registernummer": "HRA 41605",
      "registerart": "HRA",
      "company_name": "GBI Wohnungsbau GmbH & Co. KG",
      "company_seat": "Berlin",
      "details": "30.04.2025 (Bekanntmachungsdatum)\n\nBerlin Amtsgericht Berlin (Charlottenburg) HRA 41605\nRegisterbekanntmachung nach dem Umwandlungsgesetz 29.04.2025 (Eintragungsdatum)\n\nGBI Wohnungsbau GmbH & Co. KG\nKommanditgesellschaft\nBerlin\n\nZu Eintragungsnummer 14 vom 29.04.2025 wird als nicht eingetragen veröffentlicht:Den Gläubigern der an der Verschmelzung beteiligten Rechtsträger ist, wenn sie binnen sechs Monaten nach dem Tag, an dem die Eintragung der Verschmelzung in das Register des Sitzes desjenigen Rechtsträgers, dessen Gläubiger sie sind, als bekannt gemacht gilt, ihren Anspruch nach Grund und Höhe schriftlich anmelden, Sicherheit zu leisten, soweit sie nicht Befriedigung verlangen können. Dieses Recht steht den Gläubigern jedoch nur zu, wenn sie glaubhaft machen, dass durch die Verschmelzung die Erfüllung ihrer Forderung gefährdet wird. Das Recht, Sicherheitsleistung zu verlangen, steht Gläubigern nicht zu, die im Falle der Insolvenz ein Recht auf vorzugsweise Befriedigung aus einer Deckungsmasse haben, die nach gesetzlicher Vorschrift zu ihrem Schutz errichtet und staatlich überwacht ist."
    },
    {
      "date": "2025-04-30",
      "id": "107745",
      "original_text": "Einreichung neuer Dokumente\nBaden-Württemberg Amtsgericht Ulm HRB 1268\nUlmer Wohnungs- und Siedlungs-Gesellschaft mit beschränkter Haftung. – Ulm",
      "type": "Einreichung neuer Dokumente",
      "state": "Baden-Württemberg",
      "amtsgericht": "Amtsgericht Ulm",
      "registernummer": "HRB 1268",
      "registerart": "HRB",
      "company_name": "Ulmer Wohnungs- und Siedlungs-Gesellschaft mit beschränkter Haftung.",
      "company_seat": "Ulm",
      "details": "30.04.2025 (Bekanntmachungsdatum)\n\nBaden-Württemberg Amtsgericht Ulm HRB 1268\nEinreichung neuer Dokumente\n\nUlmer Wohnungs- und Siedlungs-Gesellschaft mit beschränkter Haftung.\nGesellschaft mit beschränkter Haftung\nUlm\n\nDie Gesellschaft hat am 23.04.2025 die Liste über die Zusammensetzung des Aufsichtsrats zum Handelsregister eingereicht."
    },
    {
      "date": "2025-04-30",
      "id": "107746",
      "original_text": "Löschungsankündigung\nSchleswig-Holstein Amtsgericht Kiel HRB 9762\nVSG Lübeck GmbH – Rendsburg",
      "type": "Löschungsankündigung",
      "state": "Schleswig-Holstein",
      "amtsgericht": "Amtsgericht Kiel",
      "registernummer": "HRB 9762",
      "registerart": "HRB",
      "company_name": "VSG Lübeck GmbH",
      "company_seat": "Rendsburg",
      "details": "30.04.2025 (Bekanntmachungsdatum)\n\nSchleswig-Holstein Amtsgericht Kiel HRB 9762\nLöschungsankündigung\n\nVSG Lübeck GmbH\nGesellschaft mit beschränkter Haftung\nRendsburg\n\nEs ist die Löschung der nachstehenden Gesellschaft wegen Vermögenslosigkeit gemäß § 394 FamFG beabsichtigt. Widerspruchsfrist: 2 Monate."
    },
    {
      "date": "2025-04-30",
      "id": "107747",
      "original_text": "Sonstige Registerbekanntmachung\nHamburg Amtsgericht Hamburg HRB 157180\nCuramus Managementgesellschaft mbH – Hamburg",
      "type": "Sonstige Registerbekanntmachung",
      "state": "Hamburg",
      "amtsgericht": "Amtsgericht Hamburg",
      "registernummer": "HRB 157180",
      "registerart": "HRB",
      "company_name": "Curamus Managementgesellschaft mbH",
      "company_seat": "Hamburg",
      "details": "30.04.2025 (Bekanntmachungsdatum)\n\nHamburg Amtsgericht Hamburg HRB 157180\nSonstige Registerbekanntmachung 30.04.2025 (Eintragungsdatum)\n\nCuramus Managementgesellschaft mbH\nGesellschaft mit beschränkter Haftung\nHamburg\n\nAls nicht eingetragen wird bekannt gemacht:  Den Gläubigern der Gesellschaft, deren Forderungen begründet worden sind, bevor die Eintragung der Vertragsbeendigung in das Handelsregister nach § 10 HGB als bekannt gemacht gilt, ist vom anderen Vertragsteil Sicherheit zu leisten, wenn sie sich binnen 6 Monaten nach Bekanntmachung der Eintragung zu diesem Zweck bei ihm melden."
    },
    {
      "date": "2025-04-30",
      "id": "107748",
      "original_text": "Registerbekanntmachung nach dem Umwandlungsgesetz\nHamburg Amtsgericht Hamburg HRA 108211\nFirst Property One GmbH & Co. KG – Hamburg",
      "type": "Registerbekanntmachung nach dem Umwandlungsgesetz",
      "state": "Hamburg",
      "amtsgericht": "Amtsgericht Hamburg",
      "registernummer": "HRA 108211",
      "registerart": "HRA",
      "company_name": "First Property One GmbH & Co. KG",
      "company_seat": "Hamburg",
      "details": "30.04.2025 (Bekanntmachungsdatum)\n\nHamburg Amtsgericht Hamburg HRA 108211\nRegisterbekanntmachung nach dem Umwandlungsgesetz 30.04.2025 (Eintragungsdatum)\n\nFirst Property One GmbH & Co. KG\nKommanditgesellschaft\nHamburg\n\nAls nicht eingetragen wird bekannt gemacht:\nDen Gläubigern der an der Verschmelzung beteiligten Gesellschaften ist, wenn sie binnen sechs Monaten nach dem Tag, an dem die Eintragung der Verschmelzung in das Register des Sitzes desjenigen Rechtsträgers, dessen Gläubiger sie sind, nach § 19 Absatz 3 UmwG als bekannt gemacht gilt, ihren Anspruch nach Grund und Höhe schriftlich anmelden, Sicherheit zu leisten, soweit sie nicht Befriedigung verlangen können. Dieses Recht steht den Gläubigern jedoch nur zu, wenn sie glaubhaft machen, dass durch die Verschmelzung die Erfüllung ihrer Forderung gefährdet wird."
    },
    {
      "date": "2025-04-30",
      "id": "107749",
      "original_text": "Registerbekanntmachung nach dem Umwandlungsgesetz\nHamburg Amtsgericht Hamburg HRB 103869\nFirst Property Verwaltungsgesellschaft mbH – Hamburg",
      "type": "Registerbekanntmachung nach dem Umwandlungsgesetz",
      "state": "Hamburg",
      "amtsgericht": "Amtsgericht Hamburg",
      "registernummer": "HRB 103869",
      "registerart": "HRB",
      "company_name": "First Property Verwaltungsgesellschaft mbH",
      "company_seat": "Hamburg",
      "details": "30.04.2025 (Bekanntmachungsdatum)\n\nHamburg Amtsgericht Hamburg HRB 103869\nRegisterbekanntmachung nach dem Umwandlungsgesetz 30.04.2025 (Eintragungsdatum)\n\nFirst Property Verwaltungsgesellschaft mbH\nGesellschaft mit beschränkter Haftung\nHamburg\n\nAls nicht eingetragen wird bekannt gemacht:\nDen Gläubigern der an der Verschmelzung beteiligten Gesellschaften ist, wenn sie binnen sechs Monaten nach dem Tag, an dem die Eintragung der Verschmelzung in das Register des Sitzes desjenigen Rechtsträgers, dessen Gläubiger sie sind, nach § 19 Absatz 3 UmwG als bekannt gemacht gilt, ihren Anspruch nach Grund und Höhe schriftlich anmelden, Sicherheit zu leisten, soweit sie nicht Befriedigung verlangen können. Dieses Recht steht den Gläubigern jedoch nur zu, wenn sie glaubhaft machen, dass durch die Verschmelzung die Erfüllung ihrer Forderung gefährdet wird."
    },
    {
      "date": "2025-04-30",
      "id": "107750",
      "original_text": "Registerbekanntmachung nach dem Umwandlungsgesetz\nSchleswig-Holstein Amtsgericht Pinneberg HRB 12771\nDEUTSCHE AKTENVERNICHTUNG DAV GMBH – Quickborn/Krs. Pinneberg",
      "type": "Registerbekanntmachung nach dem Umwandlungsgesetz",
      "state": "Schleswig-Holstein",
      "amtsgericht": "Amtsgericht Pinneberg",
      "registernummer": "HRB 12771",
      "registerart": "HRB",
      "company_name": "DEUTSCHE AKTENVERNICHTUNG DAV GMBH",
      "company_seat": "Quickborn/Krs. Pinneberg",
      "details": "30.04.2025 (Bekanntmachungsdatum)\n\nSchleswig-Holstein Amtsgericht Pinneberg HRB 12771\nRegisterbekanntmachung nach dem Umwandlungsgesetz 30.04.2025 (Eintragungsdatum)\n\nDEUTSCHE AKTENVERNICHTUNG DAV GMBH\nGesellschaft mit beschränkter Haftung\nQuickborn/Krs. Pinneberg\n\nZu Eintragungsnummer 7 vom 30.04.2025 wird als nicht eingetragen veröffentlicht:  Als nicht eingetragen wird veröffentlicht: Den Gläubigern der an der Verschmelzung beteiligten Rechtsträger ist, wenn sie binnen sechs Monaten nach dem Tag, an dem die Eintragung der Verschmelzung in das Register des Sitzes desjenigen Rechtsträgers, dessen Gläubiger sie sind, als bekannt gemacht gilt, ihren Anspruch nach Grund und Höhe schriftlich anmelden, Sicherheit zu leisten, soweit sie nicht Befriedigung verlangen können. Dieses Recht steht den Gläubigern jedoch nur zu, wenn sie glaubhaft machen, dass durch die Verschmelzung die Erfüllung ihrer Forderung gefährdet wird. Das Recht, Sicherheitsleistung zu verlangen, steht Gläubigern nicht zu, die im Falle der Insolvenz ein Recht auf vorzugsweise Befriedigung aus einer Deckungsmasse haben, die nach gesetzlicher Vorschrift zu ihrem Schutz errichtet und staatlich überwacht ist."
    },
    {
      "date": "2025-04-30",
      "id": "107751",
      "original_text": "Löschungsankündigung\nBerlin Amtsgericht Berlin (Charlottenburg) HRB 138175\nDTORS Intrusion GmbH – Berlin",
      "type": "Löschungsankündigung",
      "state": "Berlin",
      "amtsgericht": "Amtsgericht Berlin (Charlottenburg)",
      "registernummer": "HRB 138175",
      "registerart": "HRB",
      "company_name": "DTORS Intrusion GmbH",
      "company_seat": "Berlin",
      "details": "30.04.2025 (Bekanntmachungsdatum)\n\nBerlin Amtsgericht Berlin (Charlottenburg) HRB 138175\nLöschungsankündigung\n\nDTORS Intrusion GmbH\nGesellschaft mit beschränkter Haftung\nBerlin\n\nBei der nachstehenden Gesellschaft wird das Amtslöschungsverfahren gemäß § 394 FamFG eingeleitet. Widerspruchsfrist 6 Wochen"
    },
    {
      "date": "2025-04-30",
      "id": "107752",
      "original_text": "Registerbekanntmachung nach dem Umwandlungsgesetz\nBaden-Württemberg Amtsgericht Stuttgart HRB 571052\nSchwäbisch Hall Transformation GmbH – Schwäbisch Hall",
      "type": "Registerbekanntmachung nach dem Umwandlungsgesetz",
      "state": "Baden-Württemberg",
      "amtsgericht": "Amtsgericht Stuttgart",
      "registernummer": "HRB 571052",
      "registerart": "HRB",
      "company_name": "Schwäbisch Hall Transformation GmbH",
      "company_seat": "Schwäbisch Hall",
      "details": "30.04.2025 (Bekanntmachungsdatum)\n\nBaden-Württemberg Amtsgericht Stuttgart HRB 571052\nRegisterbekanntmachung nach dem Umwandlungsgesetz 30.04.2025 (Eintragungsdatum)\n\nSchwäbisch Hall Transformation GmbH\nGesellschaft mit beschränkter Haftung\nSchwäbisch Hall\n\nDen Gläubigern der an der Verschmelzung beteiligten Rechtsträger ist, wenn sie binnen sechs Monaten nach dem Tag, an dem die Eintragung der Verschmelzung in das Register des Sitzes desjenigen Rechtsträgers, dessen Gläubiger sie sind, nach § 19 Abs. 3 UmwG als bekanntgemacht gilt, ihren Anspruch nach Grund und Höhe schriftlich anmelden, Sicherheit zu leisten, soweit sie nicht Befriedigung verlangen können. Dieses Recht steht den Gläubigern jedoch nur zu, wenn sie glaubhaft machen, dass durch die Verschmelzung die Erfüllung ihrer Forderung gefährdet wird."
    },
    {
      "date": "2025-04-30",
      "id": "107753",
      "original_text": "Löschungsankündigung\nBerlin Amtsgericht Berlin (Charlottenburg) HRA 29046\nQuadro Hausservice GmbH & Co. KG – Berlin",
      "type": "Löschungsankündigung",
      "state": "Berlin",
      "amtsgericht": "Amtsgericht Berlin (Charlottenburg)",
      "registernummer": "HRA 29046",
      "registerart": "HRA",
      "company_name": "Quadro Hausservice GmbH & Co. KG",
      "company_seat": "Berlin",
      "details": "30.04.2025 (Bekanntmachungsdatum)\n\nBerlin Amtsgericht Berlin (Charlottenburg) HRA 29046\nLöschungsankündigung\n\nQuadro Hausservice GmbH & Co. KG\nKommanditgesellschaft\nBerlin\n\nBei dem nachstehenden Unternehmen / der nachstehenden Gesellschaft wird das Amtslöschungsverfahren gemäß § 31 Abs. 2 HGB eingeleitet. Widerspruchsfrist 1 Monat"
    },
    {
      "date": "2025-04-30",
      "id": "107754",
      "original_text": "Registerbekanntmachung nach dem Umwandlungsgesetz\nBaden-Württemberg Amtsgericht Mannheim HRB 421498\nGramlich Touristik GmbH – Hockenheim",
      "type": "Registerbekanntmachung nach dem Umwandlungsgesetz",
      "state": "Baden-Württemberg",
      "amtsgericht": "Amtsgericht Mannheim",
      "registernummer": "HRB 421498",
      "registerart": "HRB",
      "company_name": "Gramlich Touristik GmbH",
      "company_seat": "Hockenheim",
      "details": "30.04.2025 (Bekanntmachungsdatum)\n\nBaden-Württemberg Amtsgericht Mannheim HRB 421498\nRegisterbekanntmachung nach dem Umwandlungsgesetz 30.04.2025 (Eintragungsdatum)\n\nGramlich Touristik GmbH\nGesellschaft mit beschränkter Haftung\nHockenheim\n\nAls nicht eingetragen wird bekanntgemacht:\nDen Gläubigern der an der Verschmelzung beteiligten Rechtsträger ist, wenn sie binnen sechs Monaten nach dem Tag, an dem die Eintragung der Verschmelzung in das Register des Sitzes desjenigen Rechtsträgers, dessen Gläubiger sie sind, nach § 19 Abs. 3 UmwG als bekanntgemacht gilt, ihren Anspruch nach Grund und Höhe schriftlich anmelden, Sicherheit zu leisten, soweit sie nicht Befriedigung verlangen können. Dieses Recht steht den Gläubigern jedoch nur zu, wenn sie glaubhaft machen, dass durch die Verschmelzung die Erfüllung ihrer Forderung gefährdet wird."
    },
    {
      "date": "2025-04-30",
      "id": "107755",
      "original_text": "Registerbekanntmachung nach dem Umwandlungsgesetz\nBaden-Württemberg Amtsgericht Mannheim HRA 712568\nThorsten Gramlich Touristik e.K. – Hockenheim",
      "type": "Registerbekanntmachung nach dem Umwandlungsgesetz",
      "state": "Baden-Württemberg",
      "amtsgericht": "Amtsgericht Mannheim",
      "registernummer": "HRA 712568",
      "registerart": "HRA",
      "company_name": "Thorsten Gramlich Touristik e.K.",
      "company_seat": "Hockenheim",
      "details": "30.04.2025 (Bekanntmachungsdatum)\n\nBaden-Württemberg Amtsgericht Mannheim HRA 712568\nRegisterbekanntmachung nach dem Umwandlungsgesetz 30.04.2025 (Eintragungsdatum)\n\nThorsten Gramlich Touristik e.K.\nEinzelkaufmann / Einzelkauffrau\nHockenheim\n\nDen Gläubigern der an der Verschmelzung beteiligten Rechtsträger ist, wenn sie binnen sechs Monaten nach dem Tag, an dem die Eintragung der Verschmelzung in das Register des Sitzes desjenigen Rechtsträgers, dessen Gläubiger sie sind, nach § 19 Abs. 3 UmwG als bekanntgemacht gilt, ihren Anspruch nach Grund und Höhe schriftlich anmelden, Sicherheit zu leisten, soweit sie nicht Befriedigung verlangen können. Dieses Recht steht den Gläubigern jedoch nur zu, wenn sie glaubhaft machen, dass durch die Verschmelzung die Erfüllung ihrer Forderung gefährdet wird."
    },
    {
      "date": "2025-04-30",
      "id": "107756",
      "original_text": "Registerbekanntmachung nach dem Umwandlungsgesetz\nBerlin Amtsgericht Berlin (Charlottenburg) HRA 64219\nPura Lana Handel e.K. – Berlin",
      "type": "Registerbekanntmachung nach dem Umwandlungsgesetz",
      "state": "Berlin",
      "amtsgericht": "Amtsgericht Berlin (Charlottenburg)",
      "registernummer": "HRA 64219",
      "registerart": "HRA",
      "company_name": "Pura Lana Handel e.K.",
      "company_seat": "Berlin",
      "details": "30.04.2025 (Bekanntmachungsdatum)\n\nBerlin Amtsgericht Berlin (Charlottenburg) HRA 64219\nRegisterbekanntmachung nach dem Umwandlungsgesetz 29.04.2025 (Eintragungsdatum)\n\nPura Lana Handel e.K.\nEinzelkaufmann / Einzelkauffrau\nBerlin\n\nZu Eintragungsnummer 1 vom 29.04.2025 wird als nicht eingetragen veröffentlicht: Den Gläubigern der an der Verschmelzung beteiligten Rechtsträger ist, wenn sie binnen sechs Monaten nach dem Tag, an dem die Eintragung der Verschmelzung in das Register des Sitzes desjenigen Rechtsträgers, dessen Gläubiger sie sind, als bekannt gemacht gilt, ihren Anspruch nach Grund und Höhe schriftlich anmelden, Sicherheit zu leisten, soweit sie nicht Befriedigung verlangen können. Dieses Recht steht den Gläubigern jedoch nur zu, wenn sie glaubhaft machen, dass durch die Verschmelzung die Erfüllung ihrer Forderung gefährdet wird. Das Recht, Sicherheitsleistung zu verlangen, steht Gläubigern nicht zu, die im Falle der Insolvenz ein Recht auf vorzugsweise Befriedigung aus einer Deckungsmasse haben, die nach gesetzlicher Vorschrift zu ihrem Schutz errichtet und staatlich überwacht ist."
    },
    {
      "date": "2025-04-30",
      "id": "107757",
      "original_text": "Registerbekanntmachung nach dem Umwandlungsgesetz\nBerlin Amtsgericht Berlin (Charlottenburg) HRB 56673\nPura Lana Handelsgesellschaft mbH – Berlin",
      "type": "Registerbekanntmachung nach dem Umwandlungsgesetz",
      "state": "Berlin",
      "amtsgericht": "Amtsgericht Berlin (Charlottenburg)",
      "registernummer": "HRB 56673",
      "registerart": "HRB",
      "company_name": "Pura Lana Handelsgesellschaft mbH",
      "company_seat": "Berlin",
      "details": "30.04.2025 (Bekanntmachungsdatum)\n\nBerlin Amtsgericht Berlin (Charlottenburg) HRB 56673\nRegisterbekanntmachung nach dem Umwandlungsgesetz 29.04.2025 (Eintragungsdatum)\n\nPura Lana Handelsgesellschaft mbH\nGesellschaft mit beschränkter Haftung\nBerlin\n\nZu Eintragungsnummer 4 vom 29.04.2025 wird als nicht eingetragen veröffentlicht:Den Gläubigern der an der Verschmelzung beteiligten Rechtsträger ist, wenn sie binnen sechs Monaten nach dem Tag, an dem die Eintragung der Verschmelzung in das Register des Sitzes desjenigen Rechtsträgers, dessen Gläubiger sie sind, als bekannt gemacht gilt, ihren Anspruch nach Grund und Höhe schriftlich anmelden, Sicherheit zu leisten, soweit sie nicht Befriedigung verlangen können. Dieses Recht steht den Gläubigern jedoch nur zu, wenn sie glaubhaft machen, dass durch die Verschmelzung die Erfüllung ihrer Forderung gefährdet wird. Das Recht, Sicherheitsleistung zu verlangen, steht Gläubigern nicht zu, die im Falle der Insolvenz ein Recht auf vorzugsweise Befriedigung aus einer Deckungsmasse haben, die nach gesetzlicher Vorschrift zu ihrem Schutz errichtet und staatlich überwacht ist."
    },
    {
      "date": "2025-04-30",
      "id": "107758",
      "original_text": "Löschungsankündigung\nBerlin Amtsgericht Berlin (Charlottenburg) HRB 183338\nFaunder Energy GmbH – Berlin",
      "type": "Löschungsankündigung",
      "state": "Berlin",
      "amtsgericht": "Amtsgericht Berlin (Charlottenburg)",
      "registernummer": "HRB 183338",
      "registerart": "HRB",
      "company_name": "Faunder Energy GmbH",
      "company_seat": "Berlin",
      "details": "30.04.2025 (Bekanntmachungsdatum)\n\nBerlin Amtsgericht Berlin (Charlottenburg) HRB 183338\nLöschungsankündigung\n\nFaunder Energy GmbH\nGesellschaft mit beschränkter Haftung\nBerlin\n\nBei der nachstehenden Gesellschaft wird das Amtslöschungsverfahren gemäß § 394 FamFG eingeleitet. Widerspruchsfrist 6 Wochen"
    },
    {
      "date": "2025-04-30",
      "id": "107759",
      "original_text": "Löschungsankündigung\nBerlin Amtsgericht Berlin (Charlottenburg) HRB 176385\nPircan Handels GmbH – Berlin",
      "type": "Löschungsankündigung",
      "state": "Berlin",
      "amtsgericht": "Amtsgericht Berlin (Charlottenburg)",
      "registernummer": "HRB 176385",
      "registerart": "HRB",
      "company_name": "Pircan Handels GmbH",
      "company_seat": "Berlin",
      "details": "30.04.2025 (Bekanntmachungsdatum)\n\nBerlin Amtsgericht Berlin (Charlottenburg) HRB 176385\nLöschungsankündigung\n\nPircan Handels GmbH\nGesellschaft mit beschränkter Haftung\nBerlin\n\nBei der nachstehenden Gesellschaft wird das Amtslöschungsverfahren gemäß § 394 FamFG eingeleitet. Widerspruchsfrist 6 Wochen"
    },
    {
      "date": "2025-04-30",
      "id": "107760",
      "original_text": "Registerbekanntmachung nach dem Umwandlungsgesetz\nSchleswig-Holstein Amtsgericht Flensburg GsR 542\nHausbetreuung Pozaroszczyk eGbR – Sylt/OT Westerland",
      "type": "Registerbekanntmachung nach dem Umwandlungsgesetz",
      "state": "Schleswig-Holstein",
      "amtsgericht": "Amtsgericht Flensburg",
      "registernummer": "GsR 542",
      "registerart": "GsR",
      "company_name": "Hausbetreuung Pozaroszczyk eGbR",
      "company_seat": "Sylt/OT Westerland",
      "details": "30.04.2025 (Bekanntmachungsdatum)\n\nSchleswig-Holstein Amtsgericht Flensburg GsR 542\nRegisterbekanntmachung nach dem Umwandlungsgesetz 30.04.2025 (Eintragungsdatum)\n\nHausbetreuung Pozaroszczyk eGbR\nGesellschaft bürgerlichen Rechts\nSylt/OT Westerland\n\nZu Eintragungsnummer 2 vom 30.04.2025 wird als nicht eingetragen veröffentlicht: Den Gläubigern der an der Spaltung beteiligten Rechtsträger ist, wenn sie binnen sechs Monaten nach dem Tag, an dem die Eintragung der Spaltung in das Register des Sitzes desjenigen Rechtsträgers, dessen Gläubiger sie sind, als bekannt gemacht gilt, ihren Anspruch nach Grund und Höhe in Textform anmelden, Sicherheit zu leisten, soweit sie nicht Befriedigung verlangen können. Dieses Recht steht den Gläubigern jedoch nur zu, wenn sie glaubhaft machen, dass durch die Spaltung die Erfüllung ihrer Forderung gefährdet wird."
    },
    {
      "date": "2025-04-30",
      "id": "107761",
      "original_text": "Registerbekanntmachung nach dem Umwandlungsgesetz\nSchleswig-Holstein Amtsgericht Lübeck HRB 6752\nKCM KinoCenterManagement GmbH – Reinbek",
      "type": "Registerbekanntmachung nach dem Umwandlungsgesetz",
      "state": "Schleswig-Holstein",
      "amtsgericht": "Amtsgericht Lübeck",
      "registernummer": "HRB 6752",
      "registerart": "HRB",
      "company_name": "KCM KinoCenterManagement GmbH",
      "company_seat": "Reinbek",
      "details": "30.04.2025 (Bekanntmachungsdatum)\n\nSchleswig-Holstein Amtsgericht Lübeck HRB 6752\nRegisterbekanntmachung nach dem Umwandlungsgesetz 29.04.2025 (Eintragungsdatum)\n\nKCM KinoCenterManagement GmbH\nGesellschaft mit beschränkter Haftung\nReinbek\n\nZu Eintragungsnummer 5 vom 29.04.2025 wird als nicht eingetragen veröffentlicht:\nAls nicht eingetragen wird veröffentlicht: Den Gläubigern der an der Verschmelzung beteiligten Rechtsträger ist, wenn sie binnen sechs Monaten nach dem Tag, an dem die Eintragung der Verschmelzung in das Register des Sitzes desjenigen Rechtsträgers, dessen Gläubiger sie sind, als bekannt gemacht gilt, ihren Anspruch nach Grund und Höhe schriftlich anmelden, Sicherheit zu leisten, soweit sie nicht Befriedigung verlangen können. Dieses Recht steht den Gläubigern jedoch nur zu, wenn sie glaubhaft machen, dass durch die Verschmelzung die Erfüllung ihrer Forderung gefährdet wird."
    },
    {
      "date": "2025-04-30",
      "id": "107762",
      "original_text": "Registerbekanntmachung nach dem Umwandlungsgesetz\nBaden-Württemberg Amtsgericht Mannheim HRB 732804\nAleph Alpha GmbH – Heidelberg",
      "type": "Registerbekanntmachung nach dem Umwandlungsgesetz",
      "state": "Baden-Württemberg",
      "amtsgericht": "Amtsgericht Mannheim",
      "registernummer": "HRB 732804",
      "registerart": "HRB",
      "company_name": "Aleph Alpha GmbH",
      "company_seat": "Heidelberg",
      "details": "30.04.2025 (Bekanntmachungsdatum)\n\nBaden-Württemberg Amtsgericht Mannheim HRB 732804\nRegisterbekanntmachung nach dem Umwandlungsgesetz 30.04.2025 (Eintragungsdatum)\n\nAleph Alpha GmbH\nGesellschaft mit beschränkter Haftung\nHeidelberg\n\nAls nicht eingetragen wird bekanntgemacht:\nDen Gläubigern der an der Verschmelzung beteiligten Rechtsträger ist, wenn sie binnen sechs Monaten nach dem Tag, an dem die Eintragung der Verschmelzung in das Register des Sitzes desjenigen Rechtsträgers, dessen Gläubiger sie sind, nach § 19 Abs. 3 UmwG als bekanntgemacht gilt, ihren Anspruch nach Grund und Höhe schriftlich anmelden, Sicherheit zu leisten, soweit sie nicht Befriedigung verlangen können. Dieses Recht steht den Gläubigern jedoch nur zu, wenn sie glaubhaft machen, dass durch die Verschmelzung die Erfüllung ihrer Forderung gefährdet wird."
    },
    {
      "date": "2025-04-30",
      "id": "107763",
      "original_text": "Löschungsankündigung\nBerlin Amtsgericht Berlin (Charlottenburg) HRB 183081\nChinCo GmbH – Berlin",
      "type": "Löschungsankündigung",
      "state": "Berlin",
      "amtsgericht": "Amtsgericht Berlin (Charlottenburg)",
      "registernummer": "HRB 183081",
      "registerart": "HRB",
      "company_name": "ChinCo GmbH",
      "company_seat": "Berlin",
      "details": "30.04.2025 (Bekanntmachungsdatum)\n\nBerlin Amtsgericht Berlin (Charlottenburg) HRB 183081\nLöschungsankündigung\n\nChinCo GmbH\nGesellschaft mit beschränkter Haftung\nBerlin\n\nBei der nachstehenden Gesellschaft wird das Amtslöschungsverfahren gemäß § 394 FamFG eingeleitet. Widerspruchsfrist 6 Wochen"
    },
    {
      "date": "2025-04-30",
      "id": "107764",
      "original_text": "Löschungsankündigung\nThüringen Amtsgericht Jena HRB 404574\nHoffleischerei Sundhausen GmbH – Nordhausen",
      "type": "Löschungsankündigung",
      "state": "Thüringen",
      "amtsgericht": "Amtsgericht Jena",
      "registernummer": "HRB 404574",
      "registerart": "HRB",
      "company_name": "Hoffleischerei Sundhausen GmbH",
      "company_seat": "Nordhausen",
      "details": "30.04.2025 (Bekanntmachungsdatum)\n\nThüringen Amtsgericht Jena HRB 404574\nLöschungsankündigung\n\nHoffleischerei Sundhausen GmbH\nGesellschaft mit beschränkter Haftung\nNordhausen\n\nDas Registergericht beabsichtigt, die im Handelsregister eingetragene Gesellschaft wegen Vermögenslosigkeit nach § 394 FamFG von Amts wegen zu löschen. Die Frist zur Erhebung eines Widerspruchs gegen die beabsichtigte Löschung wird auf 6 Wochen festgesetzt."
    },
    {
      "date": "2025-04-30",
      "id": "107765",
      "original_text": "Löschungsankündigung\nThüringen Amtsgericht Jena HRB 504905\nMikoleiczyk Event GmbH – Altenburg",
      "type": "Löschungsankündigung",
      "state": "Thüringen",
      "amtsgericht": "Amtsgericht Jena",
      "registernummer": "HRB 504905",
      "registerart": "HRB",
      "company_name": "Mikoleiczyk Event GmbH",
      "company_seat": "Altenburg",
      "details": "30.04.2025 (Bekanntmachungsdatum)\n\nThüringen Amtsgericht Jena HRB 504905\nLöschungsankündigung\n\nMikoleiczyk Event GmbH\nGesellschaft mit beschränkter Haftung\nAltenburg\n\nDas Registergericht beabsichtigt, die im Handelsregister eingetragene Gesellschaft wegen Vermögenslosigkeit nach § 394 FamFG von Amts wegen zu löschen. Die Frist zur Erhebung eines Widerspruchs gegen die beabsichtigte Löschung wird auf 6 Wochen festgesetzt."
    },
    {
      "date": "2025-04-30",
      "id": "107766",
      "original_text": "Löschungsankündigung\nBaden-Württemberg Amtsgericht Freiburg HRB 712284\nDQ Surgical GmbH – Emmendingen",
      "type": "Löschungsankündigung",
      "state": "Baden-Württemberg",
      "amtsgericht": "Amtsgericht Freiburg",
      "registernummer": "HRB 712284",
      "registerart": "HRB",
      "company_name": "DQ Surgical GmbH",
      "company_seat": "Emmendingen",
      "details": "30.04.2025 (Bekanntmachungsdatum)\n\nBaden-Württemberg Amtsgericht Freiburg HRB 712284\nLöschungsankündigung 30.04.2025 (Eintragungsdatum)\n\nDQ Surgical GmbH\nGesellschaft mit beschränkter Haftung\nEmmendingen\n\nAls nicht eingetragen wird bekanntgemacht:\nDas Gericht beabsichtigt, die Gesellschaft wegen Vermögenslosigkeit im Handelsregister von Amts wegen nach § 394 FamFG zu löschen. Die Frist zur Geltendmachung eines Widerspruchs gegen die beabsichtigte Löschung ist auf einen Monat ab Veröffentlichung bestimmt."
    },
    {
      "date": "2025-04-30",
      "id": "107767",
      "original_text": "Löschungsankündigung\nBaden-Württemberg Amtsgericht Freiburg HRB 713188\nStradinger Wohnbau GmbH – Lörrach",
      "type": "Löschungsankündigung",
      "state": "Baden-Württemberg",
      "amtsgericht": "Amtsgericht Freiburg",
      "registernummer": "HRB 713188",
      "registerart": "HRB",
      "company_name": "Stradinger Wohnbau GmbH",
      "company_seat": "Lörrach",
      "details": "30.04.2025 (Bekanntmachungsdatum)\n\nBaden-Württemberg Amtsgericht Freiburg HRB 713188\nLöschungsankündigung\n\nStradinger Wohnbau GmbH\nGesellschaft mit beschränkter Haftung\nLörrach\n\nAls nicht eingetragen wird bekanntgemacht:\nDas Gericht beabsichtigt, die Gesellschaft wegen Vermögenslosigkeit im Handelsregister von Amts wegen nach § 394 FamFG zu löschen. Die Frist zur Geltendmachung eines Widerspruchs gegen die beabsichtigte Löschung ist auf einen Monat ab Veröffentlichung bestimmt."
    },
    {
      "date": "2025-04-30",
      "id": "107768",
      "original_text": "Löschungsankündigung\nSchleswig-Holstein Amtsgericht Pinneberg HRB 17747\nSocialSpark GmbH – Pinneberg",
      "type": "Löschungsankündigung",
      "state": "Schleswig-Holstein",
      "amtsgericht": "Amtsgericht Pinneberg",
      "registernummer": "HRB 17747",
      "registerart": "HRB",
      "company_name": "SocialSpark GmbH",
      "company_seat": "Pinneberg",
      "details": "30.04.2025 (Bekanntmachungsdatum)\n\nSchleswig-Holstein Amtsgericht Pinneberg HRB 17747\nLöschungsankündigung\n\nSocialSpark GmbH\nGesellschaft mit beschränkter Haftung\nPinneberg\n\nEs ist die Löschung der nachstehenden Gesellschaft wegen Vermögenslosigkeit gemäß § 394 FamFG beabsichtigt. Widerspruchsfrist: 2 Monate."
    },
    {
      "date": "2025-04-30",
      "id": "107769",
      "original_text": "Löschungsankündigung\nBerlin Amtsgericht Berlin (Charlottenburg) HRA 41536\neSegment GmbH & Co. KG – Berlin",
      "type": "Löschungsankündigung",
      "state": "Berlin",
      "amtsgericht": "Amtsgericht Berlin (Charlottenburg)",
      "registernummer": "HRA 41536",
      "registerart": "HRA",
      "company_name": "eSegment GmbH & Co. KG",
      "company_seat": "Berlin",
      "details": "30.04.2025 (Bekanntmachungsdatum)\n\nBerlin Amtsgericht Berlin (Charlottenburg) HRA 41536\nLöschungsankündigung\n\neSegment GmbH & Co. KG\nKommanditgesellschaft\nBerlin\n\nBei dem nachstehenden Unternehmen / der nachstehenden Gesellschaft wird das Amtslöschungsverfahren gemäß § 31 Abs. 2 HGB eingeleitet. Widerspruchsfrist 1 Monat"
    },
    {
      "date": "2025-04-30",
      "id": "107770",
      "original_text": "Einreichung neuer Dokumente\nNordrhein-Westfalen Amtsgericht Coesfeld HRB 15608\nATG Holding AG – Ahaus",
      "type": "Einreichung neuer Dokumente",
      "state": "Nordrhein-Westfalen",
      "amtsgericht": "Amtsgericht Coesfeld",
      "registernummer": "HRB 15608",
      "registerart": "HRB",
      "company_name": "ATG Holding AG",
      "company_seat": "Ahaus",
      "details": "30.04.2025 (Bekanntmachungsdatum)\n\nNordrhein-Westfalen Amtsgericht Coesfeld HRB 15608\nEinreichung neuer Dokumente\n\nATG Holding AG\nAktiengesellschaft\nAhaus\n\nDie Liste der Mitglieder des Aufsichtsrates ist zum Handelsregister eingereicht worden."
    },
    {
      "date": "2025-04-30",
      "id": "107771",
      "original_text": "Einreichung neuer Dokumente\nBaden-Württemberg Amtsgericht Mannheim HRB 560453\nVerkehrsgesellschaft Main- Tauber mbH (VGMT) – Lauda-Königshofen",
      "type": "Einreichung neuer Dokumente",
      "state": "Baden-Württemberg",
      "amtsgericht": "Amtsgericht Mannheim",
      "registernummer": "HRB 560453",
      "registerart": "HRB",
      "company_name": "Verkehrsgesellschaft Main- Tauber mbH (VGMT)",
      "company_seat": "Lauda-Königshofen",
      "details": "30.04.2025 (Bekanntmachungsdatum)\n\nBaden-Württemberg Amtsgericht Mannheim HRB 560453\nEinreichung neuer Dokumente 30.04.2025 (Eintragungsdatum)\n\nVerkehrsgesellschaft Main- Tauber mbH (VGMT)\nGesellschaft mit beschränkter Haftung\nLauda-Königshofen\n\nDie Gesellschaft hat am 29.04.2025 die Liste über die Zusammensetzung des Aufsichtsrats zum Handelsregister eingereicht."
    },
    {
      "date": "2025-04-30",
      "id": "107772",
      "original_text": "Löschungsankündigung\nBerlin Amtsgericht Berlin (Charlottenburg) HRA 53236\nAVADA Pro GmbH & Co. KG – Berlin",
      "type": "Löschungsankündigung",
      "state": "Berlin",
      "amtsgericht": "Amtsgericht Berlin (Charlottenburg)",
      "registernummer": "HRA 53236",
      "registerart": "HRA",
      "company_name": "AVADA Pro GmbH & Co. KG",
      "company_seat": "Berlin",
      "details": "30.04.2025 (Bekanntmachungsdatum)\n\nBerlin Amtsgericht Berlin (Charlottenburg) HRA 53236\nLöschungsankündigung\n\nAVADA Pro GmbH & Co. KG\nKommanditgesellschaft\nBerlin\n\nBei dem nachstehenden Unternehmen / der nachstehenden Gesellschaft wird das Amtslöschungsverfahren gemäß § 31 Abs. 2 HGB eingeleitet. Widerspruchsfrist 1 Monat"
    },
    {
      "date": "2025-04-30",
      "id": "107773",
      "original_text": "Registerbekanntmachung nach dem Umwandlungsgesetz\nBaden-Württemberg Amtsgericht Stuttgart HRB 245756\nTechno-Step GmbH – Böblingen",
      "type": "Registerbekanntmachung nach dem Umwandlungsgesetz",
      "state": "Baden-Württemberg",
      "amtsgericht": "Amtsgericht Stuttgart",
      "registernummer": "HRB 245756",
      "registerart": "HRB",
      "company_name": "Techno-Step GmbH",
      "company_seat": "Böblingen",
      "details": "30.04.2025 (Bekanntmachungsdatum)\n\nBaden-Württemberg Amtsgericht Stuttgart HRB 245756\nRegisterbekanntmachung nach dem Umwandlungsgesetz 30.04.2025 (Eintragungsdatum)\n\nTechno-Step GmbH\nGesellschaft mit beschränkter Haftung\nBöblingen\n\nAls nicht eingetragen wird bekanntgemacht:\nDen Gläubigern der an der Verschmelzung beteiligten Rechtsträger ist, wenn sie binnen sechs Monaten nach dem Tag, an dem die Eintragung der Verschmelzung in das Register des Sitzes desjenigen Rechtsträgers, dessen Gläubiger sie sind, nach § 19 Abs. 3 UmwG als bekanntgemacht gilt, ihren Anspruch nach Grund und Höhe schriftlich anmelden, Sicherheit zu leisten, soweit sie nicht Befriedigung verlangen können. Dieses Recht steht den Gläubigern jedoch nur zu, wenn sie glaubhaft machen, dass durch die Verschmelzung die Erfüllung ihrer Forderung gefährdet wird."
    },
    {
      "date": "2025-04-30",
      "id": "107774",
      "original_text": "Einreichung neuer Dokumente\nSaarland Amtsgericht Saarbrücken HRB 16867\nStadtwerke Lebach Geschäftsführungsgesellschaft mbH – Lebach",
      "type": "Einreichung neuer Dokumente",
      "state": "Saarland",
      "amtsgericht": "Amtsgericht Saarbrücken",
      "registernummer": "HRB 16867",
      "registerart": "HRB",
      "company_name": "Stadtwerke Lebach Geschäftsführungsgesellschaft mbH",
      "company_seat": "Lebach",
      "details": "30.04.2025 (Bekanntmachungsdatum)\n\nSaarland Amtsgericht Saarbrücken HRB 16867\nEinreichung neuer Dokumente\n\nStadtwerke Lebach Geschäftsführungsgesellschaft mbH\nGesellschaft mit beschränkter Haftung\nLebach\n\nDie Geschäftsführung der Gesellschaft hat eine Liste der Mitglieder des Aufsichtsrats zum Handelsregister eingereicht (§ 52 Abs. 3 Satz 2 GmbHG)."
    },
    {
      "date": "2025-04-30",
      "id": "107775",
      "original_text": "Löschungsankündigung\nBaden-Württemberg Amtsgericht Freiburg HRB 708254\nLasumi GmbH – Offenburg",
      "type": "Löschungsankündigung",
      "state": "Baden-Württemberg",
      "amtsgericht": "Amtsgericht Freiburg",
      "registernummer": "HRB 708254",
      "registerart": "HRB",
      "company_name": "Lasumi GmbH",
      "company_seat": "Offenburg",
      "details": "30.04.2025 (Bekanntmachungsdatum)\n\nBaden-Württemberg Amtsgericht Freiburg HRB 708254\nLöschungsankündigung\n\nLasumi GmbH\nGesellschaft mit beschränkter Haftung\nOffenburg\n\nDas Gericht beabsichtigt, die Gesellschaft wegen Vermögenslosigkeit im Handelsregister von Amts wegen nach § 394 FamFG zu löschen. Die Frist zur Geltendmachung eines Widerspruchs gegen die beabsichtigte Löschung ist auf einen Monat ab Veröffentlichung bestimmt."
    },
    {
      "date": "2025-04-30",
      "id": "107776",
      "original_text": "Registerbekanntmachung nach dem Umwandlungsgesetz\nBaden-Württemberg Amtsgericht Mannheim HRB 731237\nUnilin GmbH – Bischweier",
      "type": "Registerbekanntmachung nach dem Umwandlungsgesetz",
      "state": "Baden-Württemberg",
      "amtsgericht": "Amtsgericht Mannheim",
      "registernummer": "HRB 731237",
      "registerart": "HRB",
      "company_name": "Unilin GmbH",
      "company_seat": "Bischweier",
      "details": "30.04.2025 (Bekanntmachungsdatum)\n\nBaden-Württemberg Amtsgericht Mannheim HRB 731237\nRegisterbekanntmachung nach dem Umwandlungsgesetz 30.04.2025 (Eintragungsdatum)\n\nUnilin GmbH\nGesellschaft mit beschränkter Haftung\nBischweier\n\nDen Gläubigern der an der Verschmelzung beteiligten Rechtsträger ist, wenn sie binnen sechs Monaten nach dem Tag, an dem die Eintragung der Verschmelzung in das Register des Sitzes desjenigen Rechtsträgers, dessen Gläubiger sie sind, nach § 19 Abs. 3 UmwG als bekanntgemacht gilt, ihren Anspruch nach Grund und Höhe schriftlich anmelden, Sicherheit zu leisten, soweit sie nicht Befriedigung verlangen können. Dieses Recht steht den Gläubigern jedoch nur zu, wenn sie glaubhaft machen, dass durch die Verschmelzung die Erfüllung ihrer Forderung gefährdet wird."
    },
    {
      "date": "2025-04-30",
      "id": "107777",
      "original_text": "Registerbekanntmachung nach dem Umwandlungsgesetz\nBaden-Württemberg Amtsgericht Stuttgart HRB 753606\nAngels GmbH – Nagold",
      "type": "Registerbekanntmachung nach dem Umwandlungsgesetz",
      "state": "Baden-Württemberg",
      "amtsgericht": "Amtsgericht Stuttgart",
      "registernummer": "HRB 753606",
      "registerart": "HRB",
      "company_name": "Angels GmbH",
      "company_seat": "Nagold",
      "details": "30.04.2025 (Bekanntmachungsdatum)\n\nBaden-Württemberg Amtsgericht Stuttgart HRB 753606\nRegisterbekanntmachung nach dem Umwandlungsgesetz 30.04.2025 (Eintragungsdatum)\n\nAngels GmbH\nGesellschaft mit beschränkter Haftung\nNagold\n\nDen Gläubigern der an der Verschmelzung beteiligten Rechtsträger ist, wenn sie binnen sechs Monaten nach dem Tag, an dem die Eintragung der Verschmelzung in das Register des Sitzes desjenigen Rechtsträgers, dessen Gläubiger sie sind, nach § 19 Abs. 3 UmwG als bekanntgemacht gilt, ihren Anspruch nach Grund und Höhe schriftlich anmelden, Sicherheit zu leisten, soweit sie nicht Befriedigung verlangen können. Dieses Recht steht den Gläubigern jedoch nur zu, wenn sie glaubhaft machen, dass durch die Verschmelzung die Erfüllung ihrer Forderung gefährdet wird."
    },
    {
      "date": "2025-04-30",
      "id": "107778",
      "original_text": "Registerbekanntmachung nach dem Umwandlungsgesetz\nBaden-Württemberg Amtsgericht Stuttgart HRB 797100\nAngels GmbH – Nagold",
      "type": "Registerbekanntmachung nach dem Umwandlungsgesetz",
      "state": "Baden-Württemberg",
      "amtsgericht": "Amtsgericht Stuttgart",
      "registernummer": "HRB 797100",
      "registerart": "HRB",
      "company_name": "Angels GmbH",
      "company_seat": "Nagold",
      "details": "30.04.2025 (Bekanntmachungsdatum)\n\nBaden-Württemberg Amtsgericht Stuttgart HRB 797100\nRegisterbekanntmachung nach dem Umwandlungsgesetz 30.04.2025 (Eintragungsdatum)\n\nAngels GmbH\nGesellschaft mit beschränkter Haftung\nNagold\n\nDen Gläubigern der an der Verschmelzung beteiligten Rechtsträger ist, wenn sie binnen sechs Monaten nach dem Tag, an dem die Eintragung der Verschmelzung in das Register des Sitzes desjenigen Rechtsträgers, dessen Gläubiger sie sind, nach § 19 Abs. 3 UmwG als bekanntgemacht gilt, ihren Anspruch nach Grund und Höhe schriftlich anmelden, Sicherheit zu leisten, soweit sie nicht Befriedigung verlangen können. Dieses Recht steht den Gläubigern jedoch nur zu, wenn sie glaubhaft machen, dass durch die Verschmelzung die Erfüllung ihrer Forderung gefährdet wird."
    },
    {
      "date": "2025-04-30",
      "id": "107779",
      "original_text": "Registerbekanntmachung nach dem Umwandlungsgesetz\nBerlin Amtsgericht Berlin (Charlottenburg) HRB 6249\nBoettger Immobilien GmbH – Berlin",
      "type": "Registerbekanntmachung nach dem Umwandlungsgesetz",
      "state": "Berlin",
      "amtsgericht": "Amtsgericht Berlin (Charlottenburg)",
      "registernummer": "HRB 6249",
      "registerart": "HRB",
      "company_name": "Boettger Immobilien GmbH",
      "company_seat": "Berlin",
      "details": "30.04.2025 (Bekanntmachungsdatum)\n\nBerlin Amtsgericht Berlin (Charlottenburg) HRB 6249\nRegisterbekanntmachung nach dem Umwandlungsgesetz 30.04.2025 (Eintragungsdatum)\n\nBoettger Immobilien GmbH\nGesellschaft mit beschränkter Haftung\nBerlin\n\nZu Eintragungsnummer 12 vom 30.04.2025 wird als nicht eingetragen veröffentlicht:Den Gläubigern der an der Spaltung beteiligten Rechtsträger ist, wenn sie binnen sechs Monaten nach dem Tag, an dem die Eintragung der Spaltung in das Register des Sitzes desjenigen Rechtsträgers, dessen Gläubiger sie sind, als bekannt gemacht gilt, ihren Anspruch nach Grund und Höhe schriftlich anmelden, Sicherheit zu leisten, soweit sie nicht Befriedigung verlangen können. Dieses Recht steht den Gläubigern jedoch nur zu, wenn sie glaubhaft machen, dass durch die Spaltung die Erfüllung ihrer Forderung gefährdet wird. Das Recht, Sicherheitsleistung zu verlangen, steht Gläubigern nicht zu, die im Falle der Insolvenz ein Recht auf vorzugsweise Befriedigung aus einer Deckungsmasse haben, die nach gesetzlicher Vorschrift zu ihrem Schutz errichtet und staatlich überwacht ist."
    },
    {
      "date": "2025-04-30",
      "id": "107780",
      "original_text": "Einreichung neuer Dokumente\nBerlin Amtsgericht Berlin (Charlottenburg) HRB 273478\nScipio Networks GmbH – Berlin",
      "type": "Einreichung neuer Dokumente",
      "state": "Berlin",
      "amtsgericht": "Amtsgericht Berlin (Charlottenburg)",
      "registernummer": "HRB 273478",
      "registerart": "HRB",
      "company_name": "Scipio Networks GmbH",
      "company_seat": "Berlin",
      "details": "30.04.2025 (Bekanntmachungsdatum)\n\nBerlin Amtsgericht Berlin (Charlottenburg) HRB 273478\nEinreichung neuer Dokumente\n\nScipio Networks GmbH\nGesellschaft mit beschränkter Haftung\nBerlin\n\nAls nicht eingetragen wird veröffentlicht: Es wurde eine neue Liste der Beiratsmitglieder eingereicht (§52 GmbHG)."
    },
    {
      "date": "2025-04-30",
      "id": "107781",
      "original_text": "Registerbekanntmachung nach dem Umwandlungsgesetz\nSachsen Amtsgericht Dresden HRB 43833\nWendt Hamburg GmbH – Schwepnitz",
      "type": "Registerbekanntmachung nach dem Umwandlungsgesetz",
      "state": "Sachsen",
      "amtsgericht": "Amtsgericht Dresden",
      "registernummer": "HRB 43833",
      "registerart": "HRB",
      "company_name": "Wendt Hamburg GmbH",
      "company_seat": "Schwepnitz",
      "details": "30.04.2025 (Bekanntmachungsdatum)\n\nSachsen Amtsgericht Dresden HRB 43833\nRegisterbekanntmachung nach dem Umwandlungsgesetz 30.04.2025 (Eintragungsdatum)\n\nWendt Hamburg GmbH\nGesellschaft mit beschränkter Haftung\nSchwepnitz\n\nDen Gläubigern der an der #DV.Auswahl(Text=\"Betreffende Alternative auswählen\",Eingabe=\"Verschmelzung beteiligten Rechtsträger ist, wenn sie binnen sechs Monaten nach dem Tag, an dem die Eintragung der Verschmelzung in das Register des Sitzes desjenigen Rechtsträgers, dessen Gläubiger sie sind, nach § 19 Abs. 3 UmwG als bekannt gemacht gilt, ihren Anspruch nach Grund und Höhe in Textform anmelden, Sicherheit zu leisten, soweit sie nicht Befriedigung verlangen können. Dieses Recht steht den Gläubigern jedoch nur zu, wenn sie glaubhaft machen, dass durch die Verschmelzung die Erfüllung der Forderung gefährdet wird.\"|\"Verschmelzung\",\"Spaltung beteiligten Rechtsträger ist, wenn sie binnen sechs Monaten nach dem Tag, an dem die Eintragung der Spaltung in das Register des Sitzes desjenigen Rechtsträgers, dessen Gläubiger sie sind, nach § 19 Abs. 3 UmwG als bekannt gemacht gilt, ihren Anspruch nach Grund und Höhe in Textform anmelden, Sicherheit zu leisten, soweit sie nicht Befriedigung verlangen können. Dieses Recht steht den Gläubigern jedoch nur zu, wenn sie glaubhaft machen, dass durch die Spaltung die Erfüllung der Forderung gefährdet wird.\"|\"Spaltung\",\"Umwandlung beteiligten Rechtsträger ist, wenn sie binnen sechs Monaten nach dem Tag, an dem die Eintragung der Umwandlung in das Register des Sitzes desjenigen Rechtsträgers, dessen Gläubiger sie sind, nach § 19 Abs. 3 UmwG als bekannt gemacht gilt, ihren Anspruch nach Grund und Höhe in Textform anmelden, Sicherheit zu leisten, soweit sie nicht Befriedigung verlangen können. Dieses Recht steht den Gläubigern jedoch nur zu, wenn sie glaubhaft machen, dass durch die Umwandlung die Erfüllung der Forderung gefährdet wird.\"|\"Umwandlung\",\"Ausgliederung beteiligten Rechtsträger ist, wenn sie binnen sechs Monaten nach dem Tag, an dem die Eintragung der Ausgliederung in das Register des Sitzes desjenigen Rechtsträgers, dessen Gläubiger sie sind, nach § 19 Abs. 3 UmwG als bekannt gemacht gilt, ihren Anspruch nach Grund und Höhe in Textform anmelden, Sicherheit zu leisten, soweit sie nicht Befriedigung verlangen können. Dieses Recht steht den Gläubigern jedoch nur zu, wenn sie glaubhaft machen, dass durch die Ausgliederung die Erfüllung der Forderung gefährdet wird.\"|\"Ausgliederung\")"
    },
    {
      "date": "2025-04-30",
      "id": "107782",
      "original_text": "Registerbekanntmachung nach dem Umwandlungsgesetz\nSachsen Amtsgericht Dresden HRA 12251\nWendt Hamburg e. K. – Schwepnitz",
      "type": "Registerbekanntmachung nach dem Umwandlungsgesetz",
      "state": "Sachsen",
      "amtsgericht": "Amtsgericht Dresden",
      "registernummer": "HRA 12251",
      "registerart": "HRA",
      "company_name": "Wendt Hamburg e. K.",
      "company_seat": "Schwepnitz",
      "details": "30.04.2025 (Bekanntmachungsdatum)\n\nSachsen Amtsgericht Dresden HRA 12251\nRegisterbekanntmachung nach dem Umwandlungsgesetz 30.04.2025 (Eintragungsdatum)\n\nWendt Hamburg e. K.\nEinzelkaufmann / Einzelkauffrau\nSchwepnitz\n\nDen Gläubigern der an der Verschmelzung beteiligten Rechtsträger ist, wenn sie binnen sechs Monaten nach dem Tag, an dem die Eintragung der Verschmelzung in das Register des Sitzes desjenigen Rechtsträgers, dessen Gläubiger sie sind, nach § 19 Abs. 3 UmwG als bekannt gemacht gilt, ihren Anspruch nach Grund und Höhe in Textform anmelden, Sicherheit zu leisten, soweit sie nicht Befriedigung verlangen können. Dieses Recht steht den Gläubigern jedoch nur zu, wenn sie glaubhaft machen, dass durch die Verschmelzung die Erfüllung der Forderung gefährdet wird."
    },
    {
      "date": "2025-04-30",
      "id": "107783",
      "original_text": "Registerbekanntmachung nach dem Umwandlungsgesetz\nSachsen Amtsgericht Chemnitz VR 70263\nDiakonisches Werk im Kirchenbezirk Zwickau - Stadtmission Zwickau e.V. – Zwickau",
      "type": "Registerbekanntmachung nach dem Umwandlungsgesetz",
      "state": "Sachsen",
      "amtsgericht": "Amtsgericht Chemnitz",
      "registernummer": "VR 70263",
      "registerart": "VR",
      "company_name": "Diakonisches Werk im Kirchenbezirk Zwickau - Stadtmission Zwickau e.V.",
      "company_seat": "Zwickau",
      "details": "30.04.2025 (Bekanntmachungsdatum)\n\nSachsen Amtsgericht Chemnitz VR 70263\nRegisterbekanntmachung nach dem Umwandlungsgesetz 30.04.2025 (Eintragungsdatum)\n\nDiakonisches Werk im Kirchenbezirk Zwickau - Stadtmission Zwickau e.V.\neingetragener Verein\nZwickau\n\nDen Gläubigern der an der Verschmelzung beteiligten Rechtsträger ist, wenn sie binnen sechs Monaten nach dem Tag, an dem die Eintragung der Verschmelzung in das Register des Sitzes desjenigen Rechtsträgers, dessen Gläubiger sie sind, nach § 19 Abs. 3 UmwG als bekannt gemacht gilt, ihren Anspruch nach Grund und Höhe in Textform anmelden, Sicherheit zu leisten, soweit sie nicht Befriedigung verlangen können. Dieses Recht steht den Gläubigern jedoch nur zu, wenn sie glaubhaft machen, dass durch die Verschmelzung die Erfüllung der Forderung gefährdet wird."
    },
    {
      "date": "2025-04-30",
      "id": "107784",
      "original_text": "Löschungsankündigung\nSachsen Amtsgericht Leipzig HRB 35173\nMagnal GmbH – Leipzig",
      "type": "Löschungsankündigung",
      "state": "Sachsen",
      "amtsgericht": "Amtsgericht Leipzig",
      "registernummer": "HRB 35173",
      "registerart": "HRB",
      "company_name": "Magnal GmbH",
      "company_seat": "Leipzig",
      "details": "30.04.2025 (Bekanntmachungsdatum)\n\nSachsen Amtsgericht Leipzig HRB 35173\nLöschungsankündigung\n\nMagnal GmbH\nGesellschaft mit beschränkter Haftung\nLeipzig\n\nDas Registergericht beabsichtigt, den im Handelsregister eingetragenen Geschäftsführer Gismad Shirinov von Amts wegen nach § 395 Absatz 1 FamFG zu löschen. Die Frist zu Erhebung eines Widerspruchs gegen die beabsichtigte Löschung wird auf einen Monat festgesetzt."
    },
    {
      "date": "2025-04-30",
      "id": "107785",
      "original_text": "Registerbekanntmachung nach dem Umwandlungsgesetz\nSachsen Amtsgericht Chemnitz VR 50588\nDiakonisches Werk Glauchau im Kirchenbezirk Glauchau - Rochlitz e.V. – Glauchau",
      "type": "Registerbekanntmachung nach dem Umwandlungsgesetz",
      "state": "Sachsen",
      "amtsgericht": "Amtsgericht Chemnitz",
      "registernummer": "VR 50588",
      "registerart": "VR",
      "company_name": "Diakonisches Werk Glauchau im Kirchenbezirk Glauchau - Rochlitz e.V.",
      "company_seat": "Glauchau",
      "details": "30.04.2025 (Bekanntmachungsdatum)\n\nSachsen Amtsgericht Chemnitz VR 50588\nRegisterbekanntmachung nach dem Umwandlungsgesetz 30.04.2025 (Eintragungsdatum)\n\nDiakonisches Werk Glauchau im Kirchenbezirk Glauchau - Rochlitz e.V.\neingetragener Verein\nGlauchau\n\nDen Gläubigern der an der Verschmelzung beteiligten Rechtsträger ist, wenn sie binnen sechs Monaten nach dem Tag, an dem die Eintragung der Verschmelzung in das Register des Sitzes desjenigen Rechtsträgers, dessen Gläubiger sie sind, nach § 19 Abs. 3 UmwG als bekannt gemacht gilt, ihren Anspruch nach Grund und Höhe in Textform anmelden, Sicherheit zu leisten, soweit sie nicht Befriedigung verlangen können. Dieses Recht steht den Gläubigern jedoch nur zu, wenn sie glaubhaft machen, dass durch die Verschmelzung die Erfüllung der Forderung gefährdet wird."
    },
    {
      "date": "2025-04-30",
      "id": "107786",
      "original_text": "Löschungsankündigung\nSachsen Amtsgericht Dresden HRA 10624\nRUDLOFF Akustik & Trockenbau GmbH & Co.KG – Radebeul",
      "type": "Löschungsankündigung",
      "state": "Sachsen",
      "amtsgericht": "Amtsgericht Dresden",
      "registernummer": "HRA 10624",
      "registerart": "HRA",
      "company_name": "RUDLOFF Akustik & Trockenbau GmbH & Co.KG",
      "company_seat": "Radebeul",
      "details": "30.04.2025 (Bekanntmachungsdatum)\n\nSachsen Amtsgericht Dresden HRA 10624\nLöschungsankündigung\n\nRUDLOFF Akustik & Trockenbau GmbH & Co.KG\nKommanditgesellschaft\nRadebeul\n\nDas Registergericht beabsichtigt, die im Handelsregister eingetragene Gesellschaft von Amts wegen nach § 394 FamFG zu löschen. Die Frist zu Erhebung eines Widerspruchs gegen die beabsichtigte Löschung wird auf einen Monat festgesetzt."
    },
    {
      "date": "2025-04-30",
      "id": "107787",
      "original_text": "Einreichung neuer Dokumente\nSachsen Amtsgericht Chemnitz HRB 18244\naetka AG – Hartmannsdorf",
      "type": "Einreichung neuer Dokumente",
      "state": "Sachsen",
      "amtsgericht": "Amtsgericht Chemnitz",
      "registernummer": "HRB 18244",
      "registerart": "HRB",
      "company_name": "aetka AG",
      "company_seat": "Hartmannsdorf",
      "details": "30.04.2025 (Bekanntmachungsdatum)\n\nSachsen Amtsgericht Chemnitz HRB 18244\nEinreichung neuer Dokumente\n\naetka AG\nAktiengesellschaft\nHartmannsdorf\n\nAm 14.04.2025 wurde beim Handelsregister des Amtsgerichts Chemnitz die Liste der Mitglieder des Aufsichtsrats gemäß § 106 AktG eingereicht."
    },
    {
      "date": "2025-04-30",
      "id": "107788",
      "original_text": "Löschungsankündigung\nNiedersachsen Amtsgericht Hannover HRB 222104\nAlragheb Trockenbau GmbH – Hannover",
      "type": "Löschungsankündigung",
      "state": "Niedersachsen",
      "amtsgericht": "Amtsgericht Hannover",
      "registernummer": "HRB 222104",
      "registerart": "HRB",
      "company_name": "Alragheb Trockenbau GmbH",
      "company_seat": "Hannover",
      "details": "30.04.2025 (Bekanntmachungsdatum)\n\nNiedersachsen Amtsgericht Hannover HRB 222104\nLöschungsankündigung 29.04.2025 (Eintragungsdatum)\n\nAlragheb Trockenbau GmbH\nGesellschaft mit beschränkter Haftung\nHannover\n\nDas Registergericht beabsichtigt, die Gesellschaft von Amts wegen nach § 394 FamFG zu löschen. Die Frist zur Erhebung eines Widerspruchs ist auf 1 Monat ab dieser Registerbekanntmachung festgesetzt."
    },
    {
      "date": "2025-04-30",
      "id": "107789",
      "original_text": "Registerbekanntmachung nach dem Umwandlungsgesetz\nNiedersachsen Amtsgericht Braunschweig HRB 203489\nAm Alten Bahnhof Verwaltungs GmbH – Braunschweig",
      "type": "Registerbekanntmachung nach dem Umwandlungsgesetz",
      "state": "Niedersachsen",
      "amtsgericht": "Amtsgericht Braunschweig",
      "registernummer": "HRB 203489",
      "registerart": "HRB",
      "company_name": "Am Alten Bahnhof Verwaltungs GmbH",
      "company_seat": "Braunschweig",
      "details": "30.04.2025 (Bekanntmachungsdatum)\n\nNiedersachsen Amtsgericht Braunschweig HRB 203489\nRegisterbekanntmachung nach dem Umwandlungsgesetz 30.04.2025 (Eintragungsdatum)\n\nAm Alten Bahnhof Verwaltungs GmbH\nGesellschaft mit beschränkter Haftung\nBraunschweig\n\nDen Gläubigern der an der Verschmelzung beteiligten Rechtsträger ist, wenn sie binnen sechs Monaten nach dem Tag, an dem die Eintragung der Verschmelzung in das Register des Sitzes desjenigen Rechtsträgers, dessen Gläubiger sie sind, nach § 19  Abs.  3 UmwG als bekannt gemacht gilt, ihren Anspruch nach Grund und Höhe schriftlich anmelden, Sicherheit zu leisten, soweit sie nicht Befriedigung verlangen können. Dieses Recht steht den Gläubigern jedoch nur zu, wenn sie glaubhaft machen, dass durch die Verschmelzung die Erfüllung der Forderung gefährdet wird."
    },
    {
      "date": "2025-04-30",
      "id": "107790",
      "original_text": "Einreichung neuer Dokumente\nNiedersachsen Amtsgericht Göttingen HRB 3943\nWRGN Wirtschaftsförderung Region Göttingen Northeim GmbH – Northeim",
      "type": "Einreichung neuer Dokumente",
      "state": "Niedersachsen",
      "amtsgericht": "Amtsgericht Göttingen",
      "registernummer": "HRB 3943",
      "registerart": "HRB",
      "company_name": "WRGN Wirtschaftsförderung Region Göttingen Northeim GmbH",
      "company_seat": "Northeim",
      "details": "30.04.2025 (Bekanntmachungsdatum)\n\nNiedersachsen Amtsgericht Göttingen HRB 3943\nEinreichung neuer Dokumente 30.04.2025 (Eintragungsdatum)\n\nWRGN Wirtschaftsförderung Region Göttingen Northeim GmbH\nGesellschaft mit beschränkter Haftung\nNortheim\n\nDie Liste der Mitglieder des Aufsichtsrats wurde beim Registergericht eingereicht."
    },
    {
      "date": "2025-04-30",
      "id": "107791",
      "original_text": "Einreichung neuer Dokumente\nNiedersachsen Amtsgericht Hildesheim HRB 3664\nVolkshochschule (VHS) Hildesheim gGmbH – Hildesheim",
      "type": "Einreichung neuer Dokumente",
      "state": "Niedersachsen",
      "amtsgericht": "Amtsgericht Hildesheim",
      "registernummer": "HRB 3664",
      "registerart": "HRB",
      "company_name": "Volkshochschule (VHS) Hildesheim gGmbH",
      "company_seat": "Hildesheim",
      "details": "30.04.2025 (Bekanntmachungsdatum)\n\nNiedersachsen Amtsgericht Hildesheim HRB 3664\nEinreichung neuer Dokumente\n\nVolkshochschule (VHS) Hildesheim gGmbH\nGesellschaft mit beschränkter Haftung\nHildesheim\n\nDie Liste der Mitglieder des Aufsichtsrats wurde beim Registergericht eingereicht."
    },
    {
      "date": "2025-04-30",
      "id": "107792",
      "original_text": "Registerbekanntmachung nach dem Umwandlungsgesetz\nNiedersachsen Amtsgericht Osnabrück HRB 221155\nSOLVE Papenburg GmbH – Papenburg",
      "type": "Registerbekanntmachung nach dem Umwandlungsgesetz",
      "state": "Niedersachsen",
      "amtsgericht": "Amtsgericht Osnabrück",
      "registernummer": "HRB 221155",
      "registerart": "HRB",
      "company_name": "SOLVE Papenburg GmbH",
      "company_seat": "Papenburg",
      "details": "30.04.2025 (Bekanntmachungsdatum)\n\nNiedersachsen Amtsgericht Osnabrück HRB 221155\nRegisterbekanntmachung nach dem Umwandlungsgesetz 29.04.2025 (Eintragungsdatum)\n\nSOLVE Papenburg GmbH\nGesellschaft mit beschränkter Haftung\nPapenburg\n\nDen Gläubigern der an der Verschmelzung beteiligten Rechtsträger ist, wenn sie binnen sechs Monaten nach dem Tag, an dem die Eintragung der Verschmelzung in das Register des Sitzes desjenigen Rechtsträgers, dessen Gläubiger sie sind, nach § 19  Abs.  3 UmwG als bekannt gemacht gilt, ihren Anspruch nach Grund und Höhe schriftlich anmelden, Sicherheit zu leisten, soweit sie nicht Befriedigung verlangen können. Dieses Recht steht den Gläubigern jedoch nur zu, wenn sie glaubhaft machen, dass durch die Verschmelzung die Erfüllung der Forderung gefährdet wird."
    },
    {
      "date": "2025-04-30",
      "id": "107793",
      "original_text": "Registerbekanntmachung nach dem Umwandlungsgesetz\nNiedersachsen Amtsgericht Hannover HRB 212572\nDolphin Bay GmbH – Hessisch Oldendorf",
      "type": "Registerbekanntmachung nach dem Umwandlungsgesetz",
      "state": "Niedersachsen",
      "amtsgericht": "Amtsgericht Hannover",
      "registernummer": "HRB 212572",
      "registerart": "HRB",
      "company_name": "Dolphin Bay GmbH",
      "company_seat": "Hessisch Oldendorf",
      "details": "30.04.2025 (Bekanntmachungsdatum)\n\nNiedersachsen Amtsgericht Hannover HRB 212572\nRegisterbekanntmachung nach dem Umwandlungsgesetz 30.04.2025 (Eintragungsdatum)\n\nDolphin Bay GmbH\nGesellschaft mit beschränkter Haftung\nHessisch Oldendorf\n\nDen Gläubigern der an der Verschmelzung beteiligten Rechtsträger ist, wenn sie binnen sechs Monaten nach dem Tag, an dem die Eintragung der Verschmelzung in das Register des Sitzes desjenigen Rechtsträgers, dessen Gläubiger sie sind, nach § 19  Abs.  3 UmwG als bekannt gemacht gilt, ihren Anspruch nach Grund und Höhe schriftlich anmelden, Sicherheit zu leisten, soweit sie nicht Befriedigung verlangen können. Dieses Recht steht den Gläubigern jedoch nur zu, wenn sie glaubhaft machen, dass durch die Verschmelzung die Erfüllung der Forderung gefährdet wird."
    },
    {
      "date": "2025-04-30",
      "id": "107794",
      "original_text": "Registerbekanntmachung nach dem Umwandlungsgesetz\nNiedersachsen Amtsgericht Göttingen VR 150180\nFC Sülbeck/Immensen e.V. – Einbeck",
      "type": "Registerbekanntmachung nach dem Umwandlungsgesetz",
      "state": "Niedersachsen",
      "amtsgericht": "Amtsgericht Göttingen",
      "registernummer": "VR 150180",
      "registerart": "VR",
      "company_name": "FC Sülbeck/Immensen e.V.",
      "company_seat": "Einbeck",
      "details": "30.04.2025 (Bekanntmachungsdatum)\n\nNiedersachsen Amtsgericht Göttingen VR 150180\nRegisterbekanntmachung nach dem Umwandlungsgesetz 30.04.2025 (Eintragungsdatum)\n\nFC Sülbeck/Immensen e.V.\neingetragener Verein\nEinbeck\n\nDen Gläubigern der an der Verschmelzung beteiligten Rechtsträger ist, wenn sie binnen sechs Monaten nach dem Tag, an dem die Eintragung der Verschmelzung in das Register des Sitzes desjenigen Rechtsträgers, dessen Gläubiger sie sind, nach § 19  Abs.  3 UmwG als bekannt gemacht gilt, ihren Anspruch nach Grund und Höhe schriftlich anmelden, Sicherheit zu leisten, soweit sie nicht Befriedigung verlangen können. Dieses Recht steht den Gläubigern jedoch nur zu, wenn sie glaubhaft machen, dass durch die Verschmelzung die Erfüllung der Forderung gefährdet wird."
    },
    {
      "date": "2025-04-30",
      "id": "107795",
      "original_text": "Registerbekanntmachung nach dem Umwandlungsgesetz\nNiedersachsen Amtsgericht Braunschweig HRB 208607\nLe Ba GmbH – Braunschweig",
      "type": "Registerbekanntmachung nach dem Umwandlungsgesetz",
      "state": "Niedersachsen",
      "amtsgericht": "Amtsgericht Braunschweig",
      "registernummer": "HRB 208607",
      "registerart": "HRB",
      "company_name": "Le Ba GmbH",
      "company_seat": "Braunschweig",
      "details": "30.04.2025 (Bekanntmachungsdatum)\n\nNiedersachsen Amtsgericht Braunschweig HRB 208607\nRegisterbekanntmachung nach dem Umwandlungsgesetz 22.04.2025 (Eintragungsdatum)\n\nLe Ba GmbH\nGesellschaft mit beschränkter Haftung\nBraunschweig\n\nDen Gläubigern der an der Verschmelzung beteiligten Rechtsträger ist, wenn sie binnen sechs Monaten nach dem Tag, an dem die Eintragung der Verschmelzung in das Register des Sitzes desjenigen Rechtsträgers, dessen Gläubiger sie sind, nach § 19  Abs.  3 UmwG als bekannt gemacht gilt, ihren Anspruch nach Grund und Höhe schriftlich anmelden, Sicherheit zu leisten, soweit sie nicht Befriedigung verlangen können. Dieses Recht steht den Gläubigern jedoch nur zu, wenn sie glaubhaft machen, dass durch die Verschmelzung die Erfüllung der Forderung gefährdet wird."
    },
    {
      "date": "2025-04-30",
      "id": "107796",
      "original_text": "Löschungsankündigung\nNiedersachsen Amtsgericht Braunschweig HRB 202959\nWang Braunschweig Verwaltungs GmbH – Braunschweig",
      "type": "Löschungsankündigung",
      "state": "Niedersachsen",
      "amtsgericht": "Amtsgericht Braunschweig",
      "registernummer": "HRB 202959",
      "registerart": "HRB",
      "company_name": "Wang Braunschweig Verwaltungs GmbH",
      "company_seat": "Braunschweig",
      "details": "30.04.2025 (Bekanntmachungsdatum)\n\nNiedersachsen Amtsgericht Braunschweig HRB 202959\nLöschungsankündigung 30.04.2025 (Eintragungsdatum)\n\nWang Braunschweig Verwaltungs GmbH\nGesellschaft mit beschränkter Haftung\nBraunschweig\n\nDas Registergericht beabsichtigt, die Gesellschaft von Amts wegen nach § 394 FamFG zu löschen. Die Frist zur Erhebung eines Widerspruchs ist auf 1 Monat ab dieser Registerbekanntmachung festgesetzt."
    },
    {
      "date": "2025-04-30",
      "id": "107797",
      "original_text": "Registerbekanntmachung nach dem Umwandlungsgesetz\nNiedersachsen Amtsgericht Braunschweig HRB 211343\nBMA Braunschweigische Maschinenbauanstalt GmbH – Braunschweig",
      "type": "Registerbekanntmachung nach dem Umwandlungsgesetz",
      "state": "Niedersachsen",
      "amtsgericht": "Amtsgericht Braunschweig",
      "registernummer": "HRB 211343",
      "registerart": "HRB",
      "company_name": "BMA Braunschweigische Maschinenbauanstalt GmbH",
      "company_seat": "Braunschweig",
      "details": "30.04.2025 (Bekanntmachungsdatum)\n\nNiedersachsen Amtsgericht Braunschweig HRB 211343\nRegisterbekanntmachung nach dem Umwandlungsgesetz 30.04.2025 (Eintragungsdatum)\n\nBMA Braunschweigische Maschinenbauanstalt GmbH\nGesellschaft mit beschränkter Haftung\nBraunschweig\n\nDen Gläubigern der an der Verschmelzung beteiligten Rechtsträger ist, wenn sie binnen sechs Monaten nach dem Tag, an dem die Eintragung der Verschmelzung in das Register des Sitzes desjenigen Rechtsträgers, dessen Gläubiger sie sind, nach § 19  Abs.  3 UmwG als bekannt gemacht gilt, ihren Anspruch nach Grund und Höhe schriftlich anmelden, Sicherheit zu leisten, soweit sie nicht Befriedigung verlangen können. Dieses Recht steht den Gläubigern jedoch nur zu, wenn sie glaubhaft machen, dass durch die Verschmelzung die Erfüllung der Forderung gefährdet wird."
    },
    {
      "date": "2025-04-30",
      "id": "107798",
      "original_text": "Registerbekanntmachung nach dem Umwandlungsgesetz\nNiedersachsen Amtsgericht Göttingen VR 150043\nTurn- und Sportverein Sülbeck e.V. – Sülbeck",
      "type": "Registerbekanntmachung nach dem Umwandlungsgesetz",
      "state": "Niedersachsen",
      "amtsgericht": "Amtsgericht Göttingen",
      "registernummer": "VR 150043",
      "registerart": "VR",
      "company_name": "Turn- und Sportverein Sülbeck e.V.",
      "company_seat": "Sülbeck",
      "details": "30.04.2025 (Bekanntmachungsdatum)\n\nNiedersachsen Amtsgericht Göttingen VR 150043\nRegisterbekanntmachung nach dem Umwandlungsgesetz 30.04.2025 (Eintragungsdatum)\n\nTurn- und Sportverein Sülbeck e.V.\neingetragener Verein\nSülbeck\n\nDen Gläubigern der an der Verschmelzung beteiligten Rechtsträger ist, wenn sie binnen sechs Monaten nach dem Tag, an dem die Eintragung der Verschmelzung in das Register des Sitzes desjenigen Rechtsträgers, dessen Gläubiger sie sind, nach § 19  Abs.  3 UmwG als bekannt gemacht gilt, ihren Anspruch nach Grund und Höhe schriftlich anmelden, Sicherheit zu leisten, soweit sie nicht Befriedigung verlangen können. Dieses Recht steht den Gläubigern jedoch nur zu, wenn sie glaubhaft machen, dass durch die Verschmelzung die Erfüllung der Forderung gefährdet wird."
    },
    {
      "date": "2025-04-30",
      "id": "107799",
      "original_text": "Registerbekanntmachung nach dem Umwandlungsgesetz\nNiedersachsen Amtsgericht Hannover HRB 215552\nNAP -North American Products- Grill & BBQ GmbH – Hessisch Oldendorf",
      "type": "Registerbekanntmachung nach dem Umwandlungsgesetz",
      "state": "Niedersachsen",
      "amtsgericht": "Amtsgericht Hannover",
      "registernummer": "HRB 215552",
      "registerart": "HRB",
      "company_name": "NAP -North American Products- Grill & BBQ GmbH",
      "company_seat": "Hessisch Oldendorf",
      "details": "30.04.2025 (Bekanntmachungsdatum)\n\nNiedersachsen Amtsgericht Hannover HRB 215552\nRegisterbekanntmachung nach dem Umwandlungsgesetz 30.04.2025 (Eintragungsdatum)\n\nNAP -North American Products- Grill & BBQ GmbH\nGesellschaft mit beschränkter Haftung\nHessisch Oldendorf\n\nDen Gläubigern der an der Verschmelzung beteiligten Rechtsträger ist, wenn sie binnen sechs Monaten nach dem Tag, an dem die Eintragung der Verschmelzung in das Register des Sitzes desjenigen Rechtsträgers, dessen Gläubiger sie sind, nach § 19  Abs.  3 UmwG als bekannt gemacht gilt, ihren Anspruch nach Grund und Höhe schriftlich anmelden, Sicherheit zu leisten, soweit sie nicht Befriedigung verlangen können. Dieses Recht steht den Gläubigern jedoch nur zu, wenn sie glaubhaft machen, dass durch die Verschmelzung die Erfüllung der Forderung gefährdet wird."
    },
    {
      "date": "2025-04-30",
      "id": "107800",
      "original_text": "Löschungsankündigung\nNiedersachsen Amtsgericht Oldenburg (Oldenburg) HRB 131311 früher Amtsgericht Wilhelmshaven\nSchuster Recycling- Beteiligungs GmbH – Sande",
      "type": "Löschungsankündigung",
      "state": "Niedersachsen",
      "amtsgericht": "Amtsgericht Oldenburg (Oldenburg)",
      "registernummer": "HRB 131311",
      "registerart": "HRB",
      "company_name": "Schuster Recycling- Beteiligungs GmbH",
      "company_seat": "Sande",
      "former_amtsgericht": "Wilhelmshaven",
      "details": "30.04.2025 (Bekanntmachungsdatum)\n\nNiedersachsen Amtsgericht Oldenburg (Oldenburg) HRB 131311 früher Amtsgericht Wilhelmshaven\nLöschungsankündigung\n\nSchuster Recycling- Beteiligungs GmbH\nGesellschaft mit beschränkter Haftung\nSande\n\nDas Registergericht beabsichtigt, die Gesellschaft von Amts wegen nach § 394 FamFG zu löschen. Die Frist zur Erhebung eines Widerspruchs ist auf 1 Monat ab dieser Registerbekanntmachung festgesetzt."
    },
    {
      "date": "2025-04-30",
      "id": "107801",
      "original_text": "Löschungsankündigung\nBremen Amtsgericht Bremen HRB 33125\nAM Gastro UG (haftungsbeschränkt) – Bremen",
      "type": "Löschungsankündigung",
      "state": "Bremen",
      "amtsgericht": "Amtsgericht Bremen",
      "registernummer": "HRB 33125",
      "registerart": "HRB",
      "company_name": "AM Gastro UG (haftungsbeschränkt)",
      "company_seat": "Bremen",
      "details": "30.04.2025 (Bekanntmachungsdatum)\n\nBremen Amtsgericht Bremen HRB 33125\nLöschungsankündigung\n\nAM Gastro UG (haftungsbeschränkt)\nGesellschaft mit beschränkter Haftung\nBremen\n\nEs ist beabsichtigt die im Handelsregister eingetragene Gesellschaft von Amts wegen gemäß § 394 FamFG zu löschen. Gegen die Löschung kann beim AG Bremen schriftlich oder zu Protokoll der Geschäftsstelle Widerspruch eingelegt werden. Widerspruchsfrist 4 Wochen."
    },
    {
      "date": "2025-04-30",
      "id": "107802",
      "original_text": "Löschungsankündigung\nBremen Amtsgericht Bremen HRB 36612\nRMB GmbH – Bremen",
      "type": "Löschungsankündigung",
      "state": "Bremen",
      "amtsgericht": "Amtsgericht Bremen",
      "registernummer": "HRB 36612",
      "registerart": "HRB",
      "company_name": "RMB GmbH",
      "company_seat": "Bremen",
      "details": "30.04.2025 (Bekanntmachungsdatum)\n\nBremen Amtsgericht Bremen HRB 36612\nLöschungsankündigung\n\nRMB GmbH\nGesellschaft mit beschränkter Haftung\nBremen\n\nEs ist beabsichtigt die im Handelsregister eingetragene Gesellschaft von Amts wegen gemäß § 394 FamFG zu löschen. Gegen die Löschung kann beim AG Bremen schriftlich oder zu Protokoll der Geschäftsstelle Widerspruch eingelegt werden. Widerspruchsfrist 4 Wochen."
    },
    {
      "date": "2025-04-30",
      "id": "107803",
      "original_text": "Registerbekanntmachung nach dem Umwandlungsgesetz\nRheinland-Pfalz Amtsgericht Mainz HRB 53127\nMartin Weber und Christian Schwarz GmbH – Mainz",
      "type": "Registerbekanntmachung nach dem Umwandlungsgesetz",
      "state": "Rheinland-Pfalz",
      "amtsgericht": "Amtsgericht Mainz",
      "registernummer": "HRB 53127",
      "registerart": "HRB",
      "company_name": "Martin Weber und Christian Schwarz GmbH",
      "company_seat": "Mainz",
      "details": "30.04.2025 (Bekanntmachungsdatum)\n\nRheinland-Pfalz Amtsgericht Mainz HRB 53127\nRegisterbekanntmachung nach dem Umwandlungsgesetz 30.04.2025 (Eintragungsdatum)\n\nMartin Weber und Christian Schwarz GmbH\nGesellschaft mit beschränkter Haftung\nMainz\n\nAls nicht eingetragen wird veröffentlicht: Den Gläubigern der an der Ausgliederung beteiligten Rechtsträger ist, wenn sie binnen sechs Monaten nac hdem Tag, an dem die Eintragung der Ausgliederung in das Register des Sitzes desjenigen Rechtsträgers,dessen Gläubiger sie sind, nach § 19 Abs. 3 UmwG als bekannt gemacht gilt, ihren Anspruch nach Grund und Höhe schriftlich anmelden, Sicherheit zu leisten, soweit sie nicht Befriedigung verlangen können. Dieses Recht steht den Gläubigern jedoch nur zu, wenn sie glaubhaft machen, dass durch die Ausgliederung die Erfüllung der Forderung gefährdet wird."
    },
    {
      "date": "2025-04-30",
      "id": "107804",
      "original_text": "Einreichung neuer Dokumente\nRheinland-Pfalz Amtsgericht Mainz HRB 4141\nStaatstheater Mainz Gesellschaft mit beschränkter Haftung – Mainz",
      "type": "Einreichung neuer Dokumente",
      "state": "Rheinland-Pfalz",
      "amtsgericht": "Amtsgericht Mainz",
      "registernummer": "HRB 4141",
      "registerart": "HRB",
      "company_name": "Staatstheater Mainz Gesellschaft mit beschränkter Haftung",
      "company_seat": "Mainz",
      "details": "30.04.2025 (Bekanntmachungsdatum)\n\nRheinland-Pfalz Amtsgericht Mainz HRB 4141\nEinreichung neuer Dokumente\n\nStaatstheater Mainz Gesellschaft mit beschränkter Haftung\nGesellschaft mit beschränkter Haftung\nMainz\n\nDem Registergericht ist eine neue Liste der Mitglieder des Aufsichtsrates eingereicht worden."
    },
    {
      "date": "2025-04-30",
      "id": "107805",
      "original_text": "Registerbekanntmachung nach dem Umwandlungsgesetz\nRheinland-Pfalz Amtsgericht Mainz HRB 51128\nSwistak Immobilien GmbH – Armsheim",
      "type": "Registerbekanntmachung nach dem Umwandlungsgesetz",
      "state": "Rheinland-Pfalz",
      "amtsgericht": "Amtsgericht Mainz",
      "registernummer": "HRB 51128",
      "registerart": "HRB",
      "company_name": "Swistak Immobilien GmbH",
      "company_seat": "Armsheim",
      "details": "30.04.2025 (Bekanntmachungsdatum)\n\nRheinland-Pfalz Amtsgericht Mainz HRB 51128\nRegisterbekanntmachung nach dem Umwandlungsgesetz 30.04.2025 (Eintragungsdatum)\n\nSwistak Immobilien GmbH\nGesellschaft mit beschränkter Haftung\nArmsheim\n\nAls nicht eingetragen wird veröffentlicht:\nDen Gläubigern des formwechselnden Rechtsträgers ist, wenn sie binnen sechs Monaten nach dem Tag, an dem die Eintragung des Formwechsels nach § 201 UmwG als bekannt gemacht gilt, ihren Anspruch nach Grund und Höhe schriftlich anmelden, Sicherheit zu leisten, soweit sie nicht Befriedigung verlangen können. Dieses Recht steht den Gläubigern jedoch nur zu, wenn sie glaubhaft machen, dass durch den Formwechsel die Erfüllung der Forderung gefährdet wird."
    },
    {
      "date": "2025-04-30",
      "id": "107806",
      "original_text": "Registerbekanntmachung nach dem Umwandlungsgesetz\nRheinland-Pfalz Amtsgericht Mainz HRB 53657\nA&G Finthen GmbH – Mainz",
      "type": "Registerbekanntmachung nach dem Umwandlungsgesetz",
      "state": "Rheinland-Pfalz",
      "amtsgericht": "Amtsgericht Mainz",
      "registernummer": "HRB 53657",
      "registerart": "HRB",
      "company_name": "A&G Finthen GmbH",
      "company_seat": "Mainz",
      "details": "30.04.2025 (Bekanntmachungsdatum)\n\nRheinland-Pfalz Amtsgericht Mainz HRB 53657\nRegisterbekanntmachung nach dem Umwandlungsgesetz 30.04.2025 (Eintragungsdatum)\n\nA&G Finthen GmbH\nGesellschaft mit beschränkter Haftung\nMainz\n\nAls nicht eingetragen wird veröffentlicht: Den Gläubigern der an der Ausgliederung beteiligten Rechtsträger ist, wenn sie binnen sechs Monaten nac hdem Tag, an dem die Eintragung der Ausgliederung in das Register des Sitzes desjenigen Rechtsträgers,dessen Gläubiger sie sind, nach § 19 Abs. 3 UmwG als bekannt gemacht gilt, ihren Anspruch nach Grund und Höhe schriftlich anmelden, Sicherheit zu leisten, soweit sie nicht Befriedigung verlangen können. Dieses Recht steht den Gläubigern jedoch nur zu, wenn sie glaubhaft machen, dass durch die Ausgliederung die Erfüllung der Forderung gefährdet wird."
    },
    {
      "date": "2025-04-30",
      "id": "107807",
      "original_text": "Einreichung neuer Dokumente\nRheinland-Pfalz Amtsgericht Mainz HRB 12006\nA 1 Planungsgesellschaft AG – Worms",
      "type": "Einreichung neuer Dokumente",
      "state": "Rheinland-Pfalz",
      "amtsgericht": "Amtsgericht Mainz",
      "registernummer": "HRB 12006",
      "registerart": "HRB",
      "company_name": "A 1 Planungsgesellschaft AG",
      "company_seat": "Worms",
      "details": "30.04.2025 (Bekanntmachungsdatum)\n\nRheinland-Pfalz Amtsgericht Mainz HRB 12006\nEinreichung neuer Dokumente\n\nA 1 Planungsgesellschaft AG\nAktiengesellschaft\nWorms\n\nDem Registergericht ist eine neue Liste der Mitglieder des Aufsichtsrates eingereicht worden."
    },
    {
      "date": "2025-04-30",
      "id": "107808",
      "original_text": "Löschungsankündigung\nRheinland-Pfalz Amtsgericht Koblenz HRB 24598\nNAVIGARE Schifffahrtsgesellschaft mbH – Koblenz",
      "type": "Löschungsankündigung",
      "state": "Rheinland-Pfalz",
      "amtsgericht": "Amtsgericht Koblenz",
      "registernummer": "HRB 24598",
      "registerart": "HRB",
      "company_name": "NAVIGARE Schifffahrtsgesellschaft mbH",
      "company_seat": "Koblenz",
      "details": "30.04.2025 (Bekanntmachungsdatum)\n\nRheinland-Pfalz Amtsgericht Koblenz HRB 24598\nLöschungsankündigung\n\nNAVIGARE Schifffahrtsgesellschaft mbH\nGesellschaft mit beschränkter Haftung\nKoblenz\n\nDas Registergericht beabsichtigt die Gesellschaft von Amts wegen nach § 394 FamFG zu löschen. Die Frist zur Erhebung eines Widerspruchs ist auf drei Monate festgesetzt."
    },
    {
      "date": "2025-04-30",
      "id": "107809",
      "original_text": "Registerbekanntmachung nach dem Umwandlungsgesetz\nRheinland-Pfalz Amtsgericht Mainz HRB 23136\nUB7/FvB Unterbeteiligungs GmbH – Ingelheim",
      "type": "Registerbekanntmachung nach dem Umwandlungsgesetz",
      "state": "Rheinland-Pfalz",
      "amtsgericht": "Amtsgericht Mainz",
      "registernummer": "HRB 23136",
      "registerart": "HRB",
      "company_name": "UB7/FvB Unterbeteiligungs GmbH",
      "company_seat": "Ingelheim",
      "details": "30.04.2025 (Bekanntmachungsdatum)\n\nRheinland-Pfalz Amtsgericht Mainz HRB 23136\nRegisterbekanntmachung nach dem Umwandlungsgesetz 30.04.2025 (Eintragungsdatum)\n\nUB7/FvB Unterbeteiligungs GmbH\nGesellschaft mit beschränkter Haftung\nIngelheim\n\nAls nicht eingetragen wird veröffentlicht: Den Gläubigern der an der Verschmelzung beteiligten Rechtsträger ist, wenn sie binnen sechs Monaten nach dem Tag, an dem die Eintragung der Verschmelzung in das Register des Sitzes desjenigen Rechtsträgers, dessen Gläubiger sie sind, nach § 19 Abs. 3 UmwG als bekannt gemacht gilt, ihren Anspruch nach Grund und Höhe schriftlich anmelden, Sicherheit zu leisten, soweit sie nicht Befriedigung verlangen können. Dieses Recht steht den Gläubigern jedoch nur zu, wenn sie glaubhaft machen, dass durch die Verschmelzung die Erfüllung der Forderung gefährdet wird."
    },
    {
      "date": "2025-04-30",
      "id": "107810",
      "original_text": "Löschungsankündigung\nNordrhein-Westfalen Amtsgericht Wuppertal HRB 26874\nB 7 Immobilien UG (haftungsbeschränkt) – Wuppertal",
      "type": "Löschungsankündigung",
      "state": "Nordrhein-Westfalen",
      "amtsgericht": "Amtsgericht Wuppertal",
      "registernummer": "HRB 26874",
      "registerart": "HRB",
      "company_name": "B 7 Immobilien UG (haftungsbeschränkt)",
      "company_seat": "Wuppertal",
      "details": "30.04.2025 (Bekanntmachungsdatum)\n\nNordrhein-Westfalen Amtsgericht Wuppertal HRB 26874\nLöschungsankündigung\n\nB 7 Immobilien UG (haftungsbeschränkt)\nGesellschaft mit beschränkter Haftung\nWuppertal\n\nDas Registergericht beabsichtigt die Gesellschaft von Amts wegen nach § 394 FamFG zu löschen. Die Frist zur Erhebung eines Widerspruchs ist auf einen Monat festgesetzt."
    },
    {
      "date": "2025-04-30",
      "id": "107811",
      "original_text": "Einreichung neuer Dokumente\nNordrhein-Westfalen Amtsgericht Bochum HRB 8613 früher Amtsgericht Witten\nVWW Verbund-Wasserwerk Witten Gesellschaft mit beschränkter Haftung – Witten",
      "type": "Einreichung neuer Dokumente",
      "state": "Nordrhein-Westfalen",
      "amtsgericht": "Amtsgericht Bochum",
      "registernummer": "HRB 8613",
      "registerart": "HRB",
      "company_name": "VWW Verbund-Wasserwerk Witten Gesellschaft mit beschränkter Haftung",
      "company_seat": "Witten",
      "former_amtsgericht": "Witten",
      "details": "30.04.2025 (Bekanntmachungsdatum)\n\nNordrhein-Westfalen Amtsgericht Bochum HRB 8613 früher Amtsgericht Witten\nEinreichung neuer Dokumente 30.04.2025 (Eintragungsdatum)\n\nVWW Verbund-Wasserwerk Witten Gesellschaft mit beschränkter Haftung\nGesellschaft mit beschränkter Haftung\nWitten\n\nDem Registergericht ist eine neue Liste der Mitglieder des Aufsichtsrates eingereicht worden."
    },
    {
      "date": "2025-04-30",
      "id": "107812",
      "original_text": "Registerbekanntmachung nach dem Umwandlungsgesetz\nNordrhein-Westfalen Amtsgericht Steinfurt HRB 12946\nJORA Holding AG – Greven",
      "type": "Registerbekanntmachung nach dem Umwandlungsgesetz",
      "state": "Nordrhein-Westfalen",
      "amtsgericht": "Amtsgericht Steinfurt",
      "registernummer": "HRB 12946",
      "registerart": "HRB",
      "company_name": "JORA Holding AG",
      "company_seat": "Greven",
      "details": "30.04.2025 (Bekanntmachungsdatum)\n\nNordrhein-Westfalen Amtsgericht Steinfurt HRB 12946\nRegisterbekanntmachung nach dem Umwandlungsgesetz 30.04.2025 (Eintragungsdatum)\n\nJORA Holding AG\nAktiengesellschaft\nGreven\n\nDen Gläubigern der an der formwechselnden Umwandlung beteiligten Rechtsträger ist, wenn sie binnen sechs Monaten nach dem Tag, an dem die Eintragung der formwechselnden Umwandlung in das Register des Sitzes desjenigen Rechtsträgers, dessen Gläubiger sie sind, nach § 19 Absatz 3 UmwG als bekanntgemacht gilt, ihren Anspruch nach Grund und Höhe schriftlich anmelden, Sicherheit zu leisten, soweit sie nicht Befriedigung verlangen können. Dieses Recht steht den Gläubigern jedoch nur zu, wenn sie glaubhaft machen, dass durch die formwechselnden Umwandlung die Erfüllung ihrer Forderung gefährdet wird."
    },
    {
      "date": "2025-04-30",
      "id": "107813",
      "original_text": "Registerbekanntmachung nach dem Umwandlungsgesetz\nNordrhein-Westfalen Amtsgericht Köln HRA 30964\nKürten Grundbesitz GmbH & Co. KG – Köln",
      "type": "Registerbekanntmachung nach dem Umwandlungsgesetz",
      "state": "Nordrhein-Westfalen",
      "amtsgericht": "Amtsgericht Köln",
      "registernummer": "HRA 30964",
      "registerart": "HRA",
      "company_name": "Kürten Grundbesitz GmbH & Co. KG",
      "company_seat": "Köln",
      "details": "30.04.2025 (Bekanntmachungsdatum)\n\nNordrhein-Westfalen Amtsgericht Köln HRA 30964\nRegisterbekanntmachung nach dem Umwandlungsgesetz 30.04.2025 (Eintragungsdatum)\n\nKürten Grundbesitz GmbH & Co. KG\nKommanditgesellschaft\nKöln\n\nDen Gläubigern der an der formwechselnden Umwandlung beteiligten Rechtsträger ist, wenn sie binnen sechs Monaten nach dem Tag, an dem die Eintragung der formwechselnden Umwandlung in das Register des Sitzes desjenigen Rechtsträgers, dessen Gläubiger sie sind, nach § 19 Absatz 3 UmwG als bekanntgemacht gilt, ihren Anspruch nach Grund und Höhe schriftlich anmelden, Sicherheit zu leisten, soweit sie nicht Befriedigung verlangen können. Dieses Recht steht den Gläubigern jedoch nur zu, wenn sie glaubhaft machen, dass durch die formwechselnden Umwandlung die Erfüllung ihrer Forderung gefährdet wird."
    },
    {
      "date": "2025-04-30",
      "id": "107814",
      "original_text": "Löschungsankündigung\nNordrhein-Westfalen Amtsgericht Bonn HRB 10977\nESB Edelstahl-Schornstein- Bau-GmbH – Bad Münstereifel",
      "type": "Löschungsankündigung",
      "state": "Nordrhein-Westfalen",
      "amtsgericht": "Amtsgericht Bonn",
      "registernummer": "HRB 10977",
      "registerart": "HRB",
      "company_name": "ESB Edelstahl-Schornstein- Bau-GmbH",
      "company_seat": "Bad Münstereifel",
      "details": "30.04.2025 (Bekanntmachungsdatum)\n\nNordrhein-Westfalen Amtsgericht Bonn HRB 10977\nLöschungsankündigung\n\nESB Edelstahl-Schornstein- Bau-GmbH\nGesellschaft mit beschränkter Haftung\nBad Münstereifel\n\nDas Registergericht beabsichtigt die Gesellschaft von Amts wegen nach § 394 FamFG zu löschen. Die Frist zur Erhebung eines Widerspruchs ist auf einen Monat festgesetzt."
    },
    {
      "date": "2025-04-30",
      "id": "107815",
      "original_text": "Löschungsankündigung\nNordrhein-Westfalen Amtsgericht Hamm HRB 9860\nDigitalprint-NRW UG (haftungsbeschränkt) – Unna",
      "type": "Löschungsankündigung",
      "state": "Nordrhein-Westfalen",
      "amtsgericht": "Amtsgericht Hamm",
      "registernummer": "HRB 9860",
      "registerart": "HRB",
      "company_name": "Digitalprint-NRW UG (haftungsbeschränkt)",
      "company_seat": "Unna",
      "details": "30.04.2025 (Bekanntmachungsdatum)\n\nNordrhein-Westfalen Amtsgericht Hamm HRB 9860\nLöschungsankündigung\n\nDigitalprint-NRW UG (haftungsbeschränkt)\nGesellschaft mit beschränkter Haftung\nUnna\n\nDas Registergericht beabsichtigt die Gesellschaft von Amts wegen nach § 394 FamFG zu löschen. Die Frist zur Erhebung eines Widerspruchs ist auf drei Monate festgesetzt."
    },
    {
      "date": "2025-04-30",
      "id": "107816",
      "original_text": "Registerbekanntmachung nach dem Umwandlungsgesetz\nNordrhein-Westfalen Amtsgericht Köln HRB 123085\nKürten Grundbesitz GmbH – Köln",
      "type": "Registerbekanntmachung nach dem Umwandlungsgesetz",
      "state": "Nordrhein-Westfalen",
      "amtsgericht": "Amtsgericht Köln",
      "registernummer": "HRB 123085",
      "registerart": "HRB",
      "company_name": "Kürten Grundbesitz GmbH",
      "company_seat": "Köln",
      "details": "30.04.2025 (Bekanntmachungsdatum)\n\nNordrhein-Westfalen Amtsgericht Köln HRB 123085\nRegisterbekanntmachung nach dem Umwandlungsgesetz 30.04.2025 (Eintragungsdatum)\n\nKürten Grundbesitz GmbH\nGesellschaft mit beschränkter Haftung\nKöln\n\nDen Gläubigern der an der formwechselnden Umwandlung beteiligten Rechtsträger ist, wenn sie binnen sechs Monaten nach dem Tag, an dem die Eintragung der formwechselnden Umwandlung in das Register des Sitzes desjenigen Rechtsträgers, dessen Gläubiger sie sind, nach § 19 Absatz 3 UmwG als bekanntgemacht gilt, ihren Anspruch nach Grund und Höhe schriftlich anmelden, Sicherheit zu leisten, soweit sie nicht Befriedigung verlangen können. Dieses Recht steht den Gläubigern jedoch nur zu, wenn sie glaubhaft machen, dass durch die formwechselnden Umwandlung die Erfüllung ihrer Forderung gefährdet wird."
    },
    {
      "date": "2025-04-30",
      "id": "107817",
      "original_text": "Löschungsankündigung\nNordrhein-Westfalen Amtsgericht Bonn HRB 28508\nRackh GmbH – Zülpich",
      "type": "Löschungsankündigung",
      "state": "Nordrhein-Westfalen",
      "amtsgericht": "Amtsgericht Bonn",
      "registernummer": "HRB 28508",
      "registerart": "HRB",
      "company_name": "Rackh GmbH",
      "company_seat": "Zülpich",
      "details": "30.04.2025 (Bekanntmachungsdatum)\n\nNordrhein-Westfalen Amtsgericht Bonn HRB 28508\nLöschungsankündigung\n\nRackh GmbH\nGesellschaft mit beschränkter Haftung\nZülpich\n\nDas Registergericht beabsichtigt die Gesellschaft von Amts wegen nach § 394 FamFG zu löschen. Die Frist zur Erhebung eines Widerspruchs ist auf einen Monat festgesetzt."
    },
    {
      "date": "2025-04-30",
      "id": "107818",
      "original_text": "Löschungsankündigung\nNordrhein-Westfalen Amtsgericht Mönchengladbach HRA 9516\nHGI Immobilien und Verwaltungs UG (haftungsbeschränkt) & Co. KG – Mönchengladbach",
      "type": "Löschungsankündigung",
      "state": "Nordrhein-Westfalen",
      "amtsgericht": "Amtsgericht Mönchengladbach",
      "registernummer": "HRA 9516",
      "registerart": "HRA",
      "company_name": "HGI Immobilien und Verwaltungs UG (haftungsbeschränkt) & Co. KG",
      "company_seat": "Mönchengladbach",
      "details": "30.04.2025 (Bekanntmachungsdatum)\n\nNordrhein-Westfalen Amtsgericht Mönchengladbach HRA 9516\nLöschungsankündigung\n\nHGI Immobilien und Verwaltungs UG (haftungsbeschränkt) & Co. KG\nKommanditgesellschaft\nMönchengladbach\n\nHGI Immobilien und Verwaltungs UG (haftungsbeschränkt), Mönchengladbach (Amtsgericht Mönchengladbach, HRA 9516)\nDas Registergericht beabsichtigt, die im Handelsregister eingetragene Gesellschaft gemäß § 394 Absatz 1 FamFG wegen Vermögenslosigkeit von Amts wegen zu löschen. Gegen diese Verfügung kann Widerspruch eingelegt werden. Die Frist zur Erhebung eines Widerspruchs gegen die beabsichtigte Löschung von Amts wegen ist auf drei Monate festgesetzt."
    },
    {
      "date": "2025-04-30",
      "id": "107819",
      "original_text": "Löschungsankündigung\nNordrhein-Westfalen Amtsgericht Wuppertal HRB 24570\nM T S Particle Technology GmbH – Haan",
      "type": "Löschungsankündigung",
      "state": "Nordrhein-Westfalen",
      "amtsgericht": "Amtsgericht Wuppertal",
      "registernummer": "HRB 24570",
      "registerart": "HRB",
      "company_name": "M T S Particle Technology GmbH",
      "company_seat": "Haan",
      "details": "30.04.2025 (Bekanntmachungsdatum)\n\nNordrhein-Westfalen Amtsgericht Wuppertal HRB 24570\nLöschungsankündigung\n\nM T S Particle Technology GmbH\nGesellschaft mit beschränkter Haftung\nHaan\n\nDas Registergericht beabsichtigt die Gesellschaft von Amts wegen nach § 394 FamFG zu löschen. Die Frist zur Erhebung eines Widerspruchs ist auf einen Monat festgesetzt."
    },
    {
      "date": "2025-04-30",
      "id": "107820",
      "original_text": "Löschungsankündigung\nNordrhein-Westfalen Amtsgericht Siegen HRB 8393\nKöhler Verwaltungsgesellschaft mbH – Sitz: Freudenberg",
      "type": "Löschungsankündigung",
      "state": "Nordrhein-Westfalen",
      "amtsgericht": "Amtsgericht Siegen",
      "registernummer": "HRB 8393",
      "registerart": "HRB",
      "company_name": "Köhler Verwaltungsgesellschaft mbH",
      "company_seat": "Sitz: Freudenberg",
      "details": "30.04.2025 (Bekanntmachungsdatum)\n\nNordrhein-Westfalen Amtsgericht Siegen HRB 8393\nLöschungsankündigung\n\nKöhler Verwaltungsgesellschaft mbH\nGesellschaft mit beschränkter Haftung\nSitz: Freudenberg\n\nDas Registergericht beabsichtigt die Gesellschaft von Amts wegen nach § 394 FamFG zu löschen. Die Frist zur Erhebung eines Widerspruchs ist auf drei Monate festgesetzt."
    },
    {
      "date": "2025-04-30",
      "id": "107821",
      "original_text": "Löschungsankündigung\nNordrhein-Westfalen Amtsgericht Düsseldorf HRB 77930\nUp & Far GmbH – Düsseldorf",
      "type": "Löschungsankündigung",
      "state": "Nordrhein-Westfalen",
      "amtsgericht": "Amtsgericht Düsseldorf",
      "registernummer": "HRB 77930",
      "registerart": "HRB",
      "company_name": "Up & Far GmbH",
      "company_seat": "Düsseldorf",
      "details": "30.04.2025 (Bekanntmachungsdatum)\n\nNordrhein-Westfalen Amtsgericht Düsseldorf HRB 77930\nLöschungsankündigung\n\nUp & Far GmbH\nGesellschaft mit beschränkter Haftung\nDüsseldorf\n\nDas Registergericht beabsichtigt die Gesellschaft von Amts wegen nach § 394 FamFG zu löschen. Die Frist zur Erhebung eines Widerspruchs ist auf 3 Wochen festgesetzt.\n\nRechtsbehelfsbelehrung:\nDas Widerspruchsrecht steht jedem zu, der an der Unterlassung der Löschung ein berechtigtes Interesse hat. Der Widerspruch ist bei dem Amtsgericht Düsseldorf -Registergericht-, Werdener Straße 1, 40227 Düsseldorf schriftlich in deutscher Sprache oder zur Niederschrift der Geschäftsstelle einzulegen. Der Widerspruch kann auch zur Niederschrift der Geschäftsstelle eines jeden Amtsgerichtes abgegeben werden. Die Einlegung ist auch durch Übertragung eines elektronischen Dokuments an die elektronische Poststelle des Gerichts möglich. Das elektronische Dokument muss für die Bearbeitung durch das Gericht geeignet und mit einer qualifizierten elektronischen Signatur der verantwortenden Person versehen sein oder von der verantwortenden Person signiert und auf einem sicheren Übermittlungsweg gemäß § 130a ZPO nach näherer Maßgabe der Verordnung über die technischen Rahmenbedingungen des elektronischen Rechtsverkehrs und über das besondere elektronische Behördenpostfach (BGBl. I, S.3803) eingereicht werden. Weitere Informationen erhalten Sie auf der Internetseite www.justiz.de.\nDer Widerspruch muss spätestens innerhalb der gesetzten Frist nach dem Datum der Bekanntmachung der Löschungsankündigung bei dem Amtsgericht - Registergericht - Düsseldorf eingegangen sein.  Dies gilt auch dann, wenn der Widerspruch zur Niederschrift der Geschäftsstelle eines anderen Amtsgerichtes abgegeben wurde. Die Frist beginnt mit dem Tage der Bekanntmachung der Löschungsankündigung in dem für die Bekanntmachung der Eintragungen in das Handelsregister bestimmten elektronischen Informations- und Kommunikationssystem nach § 10 des Handelsgesetzbuches. Fällt das Ende der Frist auf einen Sonntag, einen allgemeinen Feiertag oder Sonnabend, so endet die Frist mit Ablauf des nächsten Werktages.\nDer Widerspruch muss die Bezeichnung der angefochtenen Löschungsankündigung sowie die Erklärung enthalten, dass Widerspruch gegen diese Löschungsankündigung eingelegt wird. Er ist zu unterzeichnen und soll begründet werden."
    },
    {
      "date": "2025-04-30",
      "id": "107822",
      "original_text": "Registerbekanntmachung nach dem Umwandlungsgesetz\nNordrhein-Westfalen Amtsgericht Münster HRA 6036\nHeinrich Winkelmann Vermögen + Kapital KG – Ahlen",
      "type": "Registerbekanntmachung nach dem Umwandlungsgesetz",
      "state": "Nordrhein-Westfalen",
      "amtsgericht": "Amtsgericht Münster",
      "registernummer": "HRA 6036",
      "registerart": "HRA",
      "company_name": "Heinrich Winkelmann Vermögen + Kapital KG",
      "company_seat": "Ahlen",
      "details": "30.04.2025 (Bekanntmachungsdatum)\n\nNordrhein-Westfalen Amtsgericht Münster HRA 6036\nRegisterbekanntmachung nach dem Umwandlungsgesetz 30.04.2025 (Eintragungsdatum)\n\nHeinrich Winkelmann Vermögen + Kapital KG\nKommanditgesellschaft\nAhlen\n\nDen Gläubigern der an der Verschmelzung beteiligten Rechtsträger ist, wenn sie binnen sechs Monaten nach dem Tag, an dem die Eintragung der Verschmelzung in das Register des Sitzes desjenigen Rechtsträgers, dessen Gläubiger sie sind, nach § 19 Absatz 3 UmwG als bekanntgemacht gilt, ihren Anspruch nach Grund und Höhe schriftlich anmelden, Sicherheit zu leisten, soweit sie nicht Befriedigung verlangen können. Dieses Recht steht den Gläubigern jedoch nur zu, wenn sie glaubhaft machen, dass durch die Verschmelzung die Erfüllung ihrer Forderung gefährdet wird."
    },
    {
      "date": "2025-04-30",
      "id": "107823",
      "original_text": "Registerbekanntmachung nach dem Umwandlungsgesetz\nNordrhein-Westfalen Amtsgericht Duisburg HRA 13622\nPatrick Fischer e.K. – Schermbeck",
      "type": "Registerbekanntmachung nach dem Umwandlungsgesetz",
      "state": "Nordrhein-Westfalen",
      "amtsgericht": "Amtsgericht Duisburg",
      "registernummer": "HRA 13622",
      "registerart": "HRA",
      "company_name": "Patrick Fischer e.K.",
      "company_seat": "Schermbeck",
      "details": "30.04.2025 (Bekanntmachungsdatum)\n\nNordrhein-Westfalen Amtsgericht Duisburg HRA 13622\nRegisterbekanntmachung nach dem Umwandlungsgesetz 30.04.2025 (Eintragungsdatum)\n\nPatrick Fischer e.K.\nEinzelkaufmann / Einzelkauffrau\nSchermbeck\n\nDie Gesellschaft hat Gläubigern, deren Forderungen vor dieser Bekanntmachung begründet worden sind, Sicherheit zu leisten, soweit sie nicht Befriedigung verlangen können, wenn sie sich binnen sechs Monaten zu diesem Zweck melden."
    },
    {
      "date": "2025-04-30",
      "id": "107824",
      "original_text": "Löschungsankündigung\nNordrhein-Westfalen Amtsgericht Essen HRB 30091\nNPI Real Estate GmbH – Essen",
      "type": "Löschungsankündigung",
      "state": "Nordrhein-Westfalen",
      "amtsgericht": "Amtsgericht Essen",
      "registernummer": "HRB 30091",
      "registerart": "HRB",
      "company_name": "NPI Real Estate GmbH",
      "company_seat": "Essen",
      "details": "30.04.2025 (Bekanntmachungsdatum)\n\nNordrhein-Westfalen Amtsgericht Essen HRB 30091\nLöschungsankündigung\n\nNPI Real Estate GmbH\nGesellschaft mit beschränkter Haftung\nEssen\n\nDas Registergericht beabsichtigt die Gesellschaft von Amts wegen nach § 394 FamFG zu löschen. Die Frist zur Erhebung eines Widerspruchs ist auf einen Monat festgesetzt."
    },
    {
      "date": "2025-04-30",
      "id": "107825",
      "original_text": "Löschungsankündigung\nNordrhein-Westfalen Amtsgericht Steinfurt HRB 11041\nJohann Hassels, Internationale Spedition GmbH – Steinfurt",
      "type": "Löschungsankündigung",
      "state": "Nordrhein-Westfalen",
      "amtsgericht": "Amtsgericht Steinfurt",
      "registernummer": "HRB 11041",
      "registerart": "HRB",
      "company_name": "Johann Hassels, Internationale Spedition GmbH",
      "company_seat": "Steinfurt",
      "details": "30.04.2025 (Bekanntmachungsdatum)\n\nNordrhein-Westfalen Amtsgericht Steinfurt HRB 11041\nLöschungsankündigung 30.04.2025 (Eintragungsdatum)\n\nJohann Hassels, Internationale Spedition GmbH\nGesellschaft mit beschränkter Haftung\nSteinfurt\n\nDas Registergericht beabsichtigt, die im Handelsregister eingetragene Gesellschaft gemäß § 394 Absatz 1 FamFG wegen Vermögenslosigkeit von Amts wegen zu löschen.\n\nGegen diese Verfügung kann Widerspruch eingelegt werden. Die Frist zur Erhebung eines Widerspruchs gegen die beabsichtigte Löschung von Amts wegen ist auf einen Monat festgesetzt.\n\nRechtsbehelfsbelehrung:\n\nGegen diese Verfügung können Sie Widerspruch einlegen.\n\nDer Widerspruch ist bei dem Amtsgericht Steinfurt, Gerichtstraße 2, 48565 Steinfurt schriftlich in deutscher Sprache oder zur Niederschrift der Geschäftsstelle einzulegen. Der Widerspruch kann auch zur Niederschrift der Geschäftsstelle eines jeden Amtsgerichtes abgegeben werden.\nDie Einlegung ist auch durch Übertragung eines elektronischen Dokuments an die elektronische Poststelle des Gerichts möglich. Das elektronische Dokument muss für die Bearbeitung durch das Gericht geeignet und mit einer qualifizierten elektronischen Signatur der verantwortenden Person versehen sein oder von der verantwortenden Person signiert und auf einem sicheren Übermittlungsweg gemäß § 130 a ZPO nach näherer Maßgabe der Verordnung über die technischen Rahmenbedingungen des elektronischen Rechtsverkehrs und über das besondere elektronische Behördenpostfach (BGBl. I, S.3803) eingereicht werden. Weitere Informationen erhalten Sie auf der Internetseite www.justiz.de.\n\nDer Widerspruch muss spätestens innerhalb der gesetzten Frist bei dem Amtsgericht Steinfurt eingegangen sein. Dies gilt auch dann, wenn der Widerspruch zur Niederschrift der Geschäftsstelle eines anderen Amtsgerichtes abgegeben wurde. Die Frist beginnt mit der Veröffentlichung. Fällt das Ende der Frist auf einen Sonntag, einen allgemeinen Feiertag oder Sonnabend, so endet die Frist mit Ablauf des nächsten Werktages.\n\nDer Widerspruch muss die Bezeichnung der angefochtenen Verfügung sowie die Erklärung enthalten, dass Widerspruch gegen diese Verfügung eingelegt wird. Er ist zu unterzeichnen und soll begründet werden."
    },
    {
      "date": "2025-04-30",
      "id": "107826",
      "original_text": "Löschungsankündigung\nNordrhein-Westfalen Amtsgericht Düsseldorf HRB 81027\nStb-Consult GmbH – Düsseldorf",
      "type": "Löschungsankündigung",
      "state": "Nordrhein-Westfalen",
      "amtsgericht": "Amtsgericht Düsseldorf",
      "registernummer": "HRB 81027",
      "registerart": "HRB",
      "company_name": "Stb-Consult GmbH",
      "company_seat": "Düsseldorf",
      "details": "30.04.2025 (Bekanntmachungsdatum)\n\nNordrhein-Westfalen Amtsgericht Düsseldorf HRB 81027\nLöschungsankündigung\n\nStb-Consult GmbH\nGesellschaft mit beschränkter Haftung\nDüsseldorf\n\nDas Registergericht beabsichtigt die Gesellschaft von Amts wegen nach § 394 FamFG zu löschen. Die Frist zur Erhebung eines Widerspruchs ist auf 3 Wochen festgesetzt.\n\nRechtsbehelfsbelehrung:\nDas Widerspruchsrecht steht jedem zu, der an der Unterlassung der Löschung ein berechtigtes Interesse hat. Der Widerspruch ist bei dem Amtsgericht Düsseldorf -Registergericht-, Werdener Straße 1, 40227 Düsseldorf schriftlich in deutscher Sprache oder zur Niederschrift der Geschäftsstelle einzulegen. Der Widerspruch kann auch zur Niederschrift der Geschäftsstelle eines jeden Amtsgerichtes abgegeben werden. Die Einlegung ist auch durch Übertragung eines elektronischen Dokuments an die elektronische Poststelle des Gerichts möglich. Das elektronische Dokument muss für die Bearbeitung durch das Gericht geeignet und mit einer qualifizierten elektronischen Signatur der verantwortenden Person versehen sein oder von der verantwortenden Person signiert und auf einem sicheren Übermittlungsweg gemäß § 130a ZPO nach näherer Maßgabe der Verordnung über die technischen Rahmenbedingungen des elektronischen Rechtsverkehrs und über das besondere elektronische Behördenpostfach (BGBl. I, S.3803) eingereicht werden. Weitere Informationen erhalten Sie auf der Internetseite www.justiz.de.\nDer Widerspruch muss spätestens innerhalb der gesetzten Frist nach dem Datum der Bekanntmachung der Löschungsankündigung bei dem Amtsgericht - Registergericht - Düsseldorf eingegangen sein.  Dies gilt auch dann, wenn der Widerspruch zur Niederschrift der Geschäftsstelle eines anderen Amtsgerichtes abgegeben wurde. Die Frist beginnt mit dem Tage der Bekanntmachung der Löschungsankündigung in dem für die Bekanntmachung der Eintragungen in das Handelsregister bestimmten elektronischen Informations- und Kommunikationssystem nach § 10 des Handelsgesetzbuches. Fällt das Ende der Frist auf einen Sonntag, einen allgemeinen Feiertag oder Sonnabend, so endet die Frist mit Ablauf des nächsten Werktages.\nDer Widerspruch muss die Bezeichnung der angefochtenen Löschungsankündigung sowie die Erklärung enthalten, dass Widerspruch gegen diese Löschungsankündigung eingelegt wird. Er ist zu unterzeichnen und soll begründet werden."
    },
    {
      "date": "2025-04-30",
      "id": "107827",
      "original_text": "Einreichung neuer Dokumente\nNordrhein-Westfalen Amtsgericht Dortmund HRB 25925\nAmazon Logistik Werne GmbH – Werne",
      "type": "Einreichung neuer Dokumente",
      "state": "Nordrhein-Westfalen",
      "amtsgericht": "Amtsgericht Dortmund",
      "registernummer": "HRB 25925",
      "registerart": "HRB",
      "company_name": "Amazon Logistik Werne GmbH",
      "company_seat": "Werne",
      "details": "30.04.2025 (Bekanntmachungsdatum)\n\nNordrhein-Westfalen Amtsgericht Dortmund HRB 25925\nEinreichung neuer Dokumente\n\nAmazon Logistik Werne GmbH\nGesellschaft mit beschränkter Haftung\nWerne\n\nDem Registergericht ist eine neue Liste der Mitglieder des Aufsichtsrates eingereicht worden."
    },
    {
      "date": "2025-04-30",
      "id": "107828",
      "original_text": "Löschungsankündigung\nNordrhein-Westfalen Amtsgericht Essen HRB 33593\nAJads UG (haftungsbeschränkt) – Essen",
      "type": "Löschungsankündigung",
      "state": "Nordrhein-Westfalen",
      "amtsgericht": "Amtsgericht Essen",
      "registernummer": "HRB 33593",
      "registerart": "HRB",
      "company_name": "AJads UG (haftungsbeschränkt)",
      "company_seat": "Essen",
      "details": "30.04.2025 (Bekanntmachungsdatum)\n\nNordrhein-Westfalen Amtsgericht Essen HRB 33593\nLöschungsankündigung\n\nAJads UG (haftungsbeschränkt)\nGesellschaft mit beschränkter Haftung\nEssen\n\nDas Registergericht beabsichtigt die Gesellschaft von Amts wegen nach § 394 FamFG zu löschen. Die Frist zur Erhebung eines Widerspruchs ist auf einen Monat festgesetzt."
    },
    {
      "date": "2025-04-30",
      "id": "107829",
      "original_text": "Löschungsankündigung\nNordrhein-Westfalen Amtsgericht Dortmund HRB 34320\nWKDG GmbH – Dortmund",
      "type": "Löschungsankündigung",
      "state": "Nordrhein-Westfalen",
      "amtsgericht": "Amtsgericht Dortmund",
      "registernummer": "HRB 34320",
      "registerart": "HRB",
      "company_name": "WKDG GmbH",
      "company_seat": "Dortmund",
      "details": "30.04.2025 (Bekanntmachungsdatum)\n\nNordrhein-Westfalen Amtsgericht Dortmund HRB 34320\nLöschungsankündigung\n\nWKDG GmbH\nGesellschaft mit beschränkter Haftung\nDortmund\n\nDas Registergericht beabsichtigt die Gesellschaft von Amts wegen nach § 394 FamFG zu löschen. Die Frist zur Erhebung eines Widerspruchs ist auf zwei Monate festgesetzt."
    },
    {
      "date": "2025-04-30",
      "id": "107830",
      "original_text": "Registerbekanntmachung nach dem Umwandlungsgesetz\nNordrhein-Westfalen Amtsgericht Duisburg HRB 37893\nPatrick Fischer Projekt GmbH – Schermbeck",
      "type": "Registerbekanntmachung nach dem Umwandlungsgesetz",
      "state": "Nordrhein-Westfalen",
      "amtsgericht": "Amtsgericht Duisburg",
      "registernummer": "HRB 37893",
      "registerart": "HRB",
      "company_name": "Patrick Fischer Projekt GmbH",
      "company_seat": "Schermbeck",
      "details": "30.04.2025 (Bekanntmachungsdatum)\n\nNordrhein-Westfalen Amtsgericht Duisburg HRB 37893\nRegisterbekanntmachung nach dem Umwandlungsgesetz 30.04.2025 (Eintragungsdatum)\n\nPatrick Fischer Projekt GmbH\nGesellschaft mit beschränkter Haftung\nSchermbeck\n\nDie Gesellschaft hat Gläubigern, deren Forderungen vor dieser Bekanntmachung begründet worden sind, Sicherheit zu leisten, soweit sie nicht Befriedigung verlangen können, wenn sie sich binnen sechs Monaten zu diesem Zweck melden."
    },
    {
      "date": "2025-04-30",
      "id": "107831",
      "original_text": "Löschungsankündigung\nNordrhein-Westfalen Amtsgericht Hagen HRB 11869\nVidemor GmbH – Hagen",
      "type": "Löschungsankündigung",
      "state": "Nordrhein-Westfalen",
      "amtsgericht": "Amtsgericht Hagen",
      "registernummer": "HRB 11869",
      "registerart": "HRB",
      "company_name": "Videmor GmbH",
      "company_seat": "Hagen",
      "details": "30.04.2025 (Bekanntmachungsdatum)\n\nNordrhein-Westfalen Amtsgericht Hagen HRB 11869\nLöschungsankündigung\n\nVidemor GmbH\nGesellschaft mit beschränkter Haftung\nHagen\n\nDas Registergericht beabsichtigt, die im Handelsregister eingetragene Gesellschaft gemäß § 394 Absatz 1 FamFG wegen Vermögenslosigkeit von Amts wegen zu löschen.  Gegen diese Verfügung kann Widerspruch eingelegt werden. Die Frist zur Erhebung eines Widerspruchs gegen die beabsichtigte Löschung von Amts wegen ist auf drei Monate festgesetzt.\n\nRechtsbehelfsbelehrung:\nGegen diese Verfügung können Sie Widerspruch einlegen.\n\nDer Widerspruch ist bei dem Amtsgericht Hagen, Heinitzstraße 42, 58097 Hagen schriftlich in deutscher Sprache oder zur Niederschrift der Geschäftsstelle einzulegen. Der Widerspruch kann auch zur Niederschrift der Geschäftsstelle eines jeden Amtsgerichtes abgegeben werden.\n\nDer Widerspruch muss spätestens innerhalb der gesetzten Frist bei dem Amtsgericht Hagen eingegangen sein. Dies gilt auch dann, wenn der Widerspruch zur Niederschrift der Geschäftsstelle eines anderen Amtsgerichtes abgegeben wurde. Die Frist beginnt mit der Veröffentlichung. Fällt das Ende der Frist auf einen Sonntag, einen allgemeinen Feiertag oder Sonnabend, so endet die Frist mit Ablauf des nächsten Werktages.\n\nDer Widerspruch muss die Bezeichnung der angefochtenen Verfügung sowie die Erklärung enthalten, dass Widerspruch gegen diese Verfügung eingelegt wird. Er ist zu unterzeichnen und soll begründet werden."
    },
    {
      "date": "2025-04-30",
      "id": "107832",
      "original_text": "Einreichung neuer Dokumente\nNordrhein-Westfalen Amtsgericht Bonn HRB 19168\nDeutsche Telekom Geschäftskunden GmbH – Bonn",
      "type": "Einreichung neuer Dokumente",
      "state": "Nordrhein-Westfalen",
      "amtsgericht": "Amtsgericht Bonn",
      "registernummer": "HRB 19168",
      "registerart": "HRB",
      "company_name": "Deutsche Telekom Geschäftskunden GmbH",
      "company_seat": "Bonn",
      "details": "30.04.2025 (Bekanntmachungsdatum)\n\nNordrhein-Westfalen Amtsgericht Bonn HRB 19168\nEinreichung neuer Dokumente\n\nDeutsche Telekom Geschäftskunden GmbH\nGesellschaft mit beschränkter Haftung\nBonn\n\nDem Registergericht ist eine neue Liste der Mitglieder des Aufsichtsrates eingereicht worden."
    },
    {
      "date": "2025-04-30",
      "id": "107833",
      "original_text": "Löschungsankündigung\nNordrhein-Westfalen Amtsgericht Düsseldorf HRB 93503\nJL Service GmbH – Düsseldorf",
      "type": "Löschungsankündigung",
      "state": "Nordrhein-Westfalen",
      "amtsgericht": "Amtsgericht Düsseldorf",
      "registernummer": "HRB 93503",
      "registerart": "HRB",
      "company_name": "JL Service GmbH",
      "company_seat": "Düsseldorf",
      "details": "30.04.2025 (Bekanntmachungsdatum)\n\nNordrhein-Westfalen Amtsgericht Düsseldorf HRB 93503\nLöschungsankündigung\n\nJL Service GmbH\nGesellschaft mit beschränkter Haftung\nDüsseldorf\n\nDas Registergericht beabsichtigt die Gesellschaft von Amts wegen nach § 394 FamFG zu löschen. Die Frist zur Erhebung eines Widerspruchs ist auf 3 Wochen. festgesetzt.\n\nRechtsbehelfsbelehrung:\nDas Widerspruchsrecht steht jedem zu, der an der Unterlassung der Löschung ein berechtigtes Interesse hat. Der Widerspruch ist bei dem Amtsgericht Düsseldorf -Registergericht-, Werdener Straße 1, 40227 Düsseldorf schriftlich in deutscher Sprache oder zur Niederschrift der Geschäftsstelle einzulegen. Der Widerspruch kann auch zur Niederschrift der Geschäftsstelle eines jeden Amtsgerichtes abgegeben werden. Die Einlegung ist auch durch Übertragung eines elektronischen Dokuments an die elektronische Poststelle des Gerichts möglich. Das elektronische Dokument muss für die Bearbeitung durch das Gericht geeignet und mit einer qualifizierten elektronischen Signatur der verantwortenden Person versehen sein oder von der verantwortenden Person signiert und auf einem sicheren Übermittlungsweg gemäß § 130a ZPO nach näherer Maßgabe der Verordnung über die technischen Rahmenbedingungen des elektronischen Rechtsverkehrs und über das besondere elektronische Behördenpostfach (BGBl. I, S.3803) eingereicht werden. Weitere Informationen erhalten Sie auf der Internetseite www.justiz.de.\nDer Widerspruch muss spätestens innerhalb der gesetzten Frist nach dem Datum der Bekanntmachung der Löschungsankündigung bei dem Amtsgericht - Registergericht - Düsseldorf eingegangen sein.  Dies gilt auch dann, wenn der Widerspruch zur Niederschrift der Geschäftsstelle eines anderen Amtsgerichtes abgegeben wurde. Die Frist beginnt mit dem Tage der Bekanntmachung der Löschungsankündigung in dem für die Bekanntmachung der Eintragungen in das Handelsregister bestimmten elektronischen Informations- und Kommunikationssystem nach § 10 des Handelsgesetzbuches. Fällt das Ende der Frist auf einen Sonntag, einen allgemeinen Feiertag oder Sonnabend, so endet die Frist mit Ablauf des nächsten Werktages.\nDer Widerspruch muss die Bezeichnung der angefochtenen Löschungsankündigung sowie die Erklärung enthalten, dass Widerspruch gegen diese Löschungsankündigung eingelegt wird. Er ist zu unterzeichnen und soll begründet werden."
    },
    {
      "date": "2025-04-30",
      "id": "107834",
      "original_text": "Registerbekanntmachung nach dem Umwandlungsgesetz\nNordrhein-Westfalen Amtsgericht Köln HRB 64068\nmobilezone GmbH – Köln",
      "type": "Registerbekanntmachung nach dem Umwandlungsgesetz",
      "state": "Nordrhein-Westfalen",
      "amtsgericht": "Amtsgericht Köln",
      "registernummer": "HRB 64068",
      "registerart": "HRB",
      "company_name": "mobilezone GmbH",
      "company_seat": "Köln",
      "details": "30.04.2025 (Bekanntmachungsdatum)\n\nNordrhein-Westfalen Amtsgericht Köln HRB 64068\nRegisterbekanntmachung nach dem Umwandlungsgesetz 30.04.2025 (Eintragungsdatum)\n\nmobilezone GmbH\nGesellschaft mit beschränkter Haftung\nKöln\n\nDen Gläubigern der an der Verschmelzung beteiligten Rechtsträger ist, wenn sie binnen sechs Monaten nach dem Tag, an dem die Eintragung der Verschmelzung in das Register des Sitzes desjenigen Rechtsträgers, dessen Gläubiger sie sind, nach § 19 Absatz 3 UmwG als bekanntgemacht gilt, ihren Anspruch nach Grund und Höhe schriftlich anmelden, Sicherheit zu leisten, soweit sie nicht Befriedigung verlangen können. Dieses Recht steht den Gläubigern jedoch nur zu, wenn sie glaubhaft machen, dass durch die Verschmelzung die Erfüllung ihrer Forderung gefährdet wird."
    },
    {
      "date": "2025-04-30",
      "id": "107835",
      "original_text": "Löschungsankündigung\nNordrhein-Westfalen Amtsgericht Essen HRB 31894\ndmb-bati-bau GmbH – Essen",
      "type": "Löschungsankündigung",
      "state": "Nordrhein-Westfalen",
      "amtsgericht": "Amtsgericht Essen",
      "registernummer": "HRB 31894",
      "registerart": "HRB",
      "company_name": "dmb-bati-bau GmbH",
      "company_seat": "Essen",
      "details": "30.04.2025 (Bekanntmachungsdatum)\n\nNordrhein-Westfalen Amtsgericht Essen HRB 31894\nLöschungsankündigung\n\ndmb-bati-bau GmbH\nGesellschaft mit beschränkter Haftung\nEssen\n\nDas Registergericht beabsichtigt die Gesellschaft von Amts wegen nach § 394 FamFG zu löschen. Die Frist zur Erhebung eines Widerspruchs ist auf einen Monat festgesetzt."
    },
    {
      "date": "2025-04-30",
      "id": "107836",
      "original_text": "Registerbekanntmachung nach dem Umwandlungsgesetz\nNordrhein-Westfalen Amtsgericht Münster HRA 6036\nHeinrich Winkelmann Vermögen + Kapital KG – Ahlen",
      "type": "Registerbekanntmachung nach dem Umwandlungsgesetz",
      "state": "Nordrhein-Westfalen",
      "amtsgericht": "Amtsgericht Münster",
      "registernummer": "HRA 6036",
      "registerart": "HRA",
      "company_name": "Heinrich Winkelmann Vermögen + Kapital KG",
      "company_seat": "Ahlen",
      "details": "30.04.2025 (Bekanntmachungsdatum)\n\nNordrhein-Westfalen Amtsgericht Münster HRA 6036\nRegisterbekanntmachung nach dem Umwandlungsgesetz 30.04.2025 (Eintragungsdatum)\n\nHeinrich Winkelmann Vermögen + Kapital KG\nKommanditgesellschaft\nAhlen\n\nDen Gläubigern der an der Verschmelzung beteiligten Rechtsträger ist, wenn sie binnen sechs Monaten nach dem Tag, an dem die Eintragung der Verschmelzung in das Register des Sitzes desjenigen Rechtsträgers, dessen Gläubiger sie sind, nach § 19 Absatz 3 UmwG als bekanntgemacht gilt, ihren Anspruch nach Grund und Höhe schriftlich anmelden, Sicherheit zu leisten, soweit sie nicht Befriedigung verlangen können. Dieses Recht steht den Gläubigern jedoch nur zu, wenn sie glaubhaft machen, dass durch die Verschmelzung die Erfüllung ihrer Forderung gefährdet wird."
    },
    {
      "date": "2025-04-30",
      "id": "107837",
      "original_text": "Löschungsankündigung\nNordrhein-Westfalen Amtsgericht Düsseldorf HRB 57529\nLamaloli GmbH – Monheim am Rhein",
      "type": "Löschungsankündigung",
      "state": "Nordrhein-Westfalen",
      "amtsgericht": "Amtsgericht Düsseldorf",
      "registernummer": "HRB 57529",
      "registerart": "HRB",
      "company_name": "Lamaloli GmbH",
      "company_seat": "Monheim am Rhein",
      "details": "30.04.2025 (Bekanntmachungsdatum)\n\nNordrhein-Westfalen Amtsgericht Düsseldorf HRB 57529\nLöschungsankündigung\n\nLamaloli GmbH\nGesellschaft mit beschränkter Haftung\nMonheim am Rhein\n\nDas Registergericht beabsichtigt die Gesellschaft von Amts wegen nach § 394 FamFG zu löschen. Die Frist zur Erhebung eines Widerspruchs ist auf 3 Wochen festgesetzt.\n\nRechtsbehelfsbelehrung:\nDas Widerspruchsrecht steht jedem zu, der an der Unterlassung der Löschung ein berechtigtes Interesse hat. Der Widerspruch ist bei dem Amtsgericht Düsseldorf -Registergericht-, Werdener Straße 1, 40227 Düsseldorf schriftlich in deutscher Sprache oder zur Niederschrift der Geschäftsstelle einzulegen. Der Widerspruch kann auch zur Niederschrift der Geschäftsstelle eines jeden Amtsgerichtes abgegeben werden. Die Einlegung ist auch durch Übertragung eines elektronischen Dokuments an die elektronische Poststelle des Gerichts möglich. Das elektronische Dokument muss für die Bearbeitung durch das Gericht geeignet und mit einer qualifizierten elektronischen Signatur der verantwortenden Person versehen sein oder von der verantwortenden Person signiert und auf einem sicheren Übermittlungsweg gemäß § 130a ZPO nach näherer Maßgabe der Verordnung über die technischen Rahmenbedingungen des elektronischen Rechtsverkehrs und über das besondere elektronische Behördenpostfach (BGBl. I, S.3803) eingereicht werden. Weitere Informationen erhalten Sie auf der Internetseite www.justiz.de.\nDer Widerspruch muss spätestens innerhalb der gesetzten Frist nach dem Datum der Bekanntmachung der Löschungsankündigung bei dem Amtsgericht - Registergericht - Düsseldorf eingegangen sein.  Dies gilt auch dann, wenn der Widerspruch zur Niederschrift der Geschäftsstelle eines anderen Amtsgerichtes abgegeben wurde. Die Frist beginnt mit dem Tage der Bekanntmachung der Löschungsankündigung in dem für die Bekanntmachung der Eintragungen in das Handelsregister bestimmten elektronischen Informations- und Kommunikationssystem nach § 10 des Handelsgesetzbuches. Fällt das Ende der Frist auf einen Sonntag, einen allgemeinen Feiertag oder Sonnabend, so endet die Frist mit Ablauf des nächsten Werktages.\nDer Widerspruch muss die Bezeichnung der angefochtenen Löschungsankündigung sowie die Erklärung enthalten, dass Widerspruch gegen diese Löschungsankündigung eingelegt wird. Er ist zu unterzeichnen und soll begründet werden."
    },
    {
      "date": "2025-04-30",
      "id": "107838",
      "original_text": "Löschungsankündigung\nNordrhein-Westfalen Amtsgericht Mönchengladbach HRB 17121\nImcon Holding Besitz und Vermögen GmbH – Mönchengladbach",
      "type": "Löschungsankündigung",
      "state": "Nordrhein-Westfalen",
      "amtsgericht": "Amtsgericht Mönchengladbach",
      "registernummer": "HRB 17121",
      "registerart": "HRB",
      "company_name": "Imcon Holding Besitz und Vermögen GmbH",
      "company_seat": "Mönchengladbach",
      "details": "30.04.2025 (Bekanntmachungsdatum)\n\nNordrhein-Westfalen Amtsgericht Mönchengladbach HRB 17121\nLöschungsankündigung\n\nImcon Holding Besitz und Vermögen GmbH\nGesellschaft mit beschränkter Haftung\nMönchengladbach\n\nDas Registergericht beabsichtigt, die im Handelsregister eingetragene Gesellschaft gemäß § 394 Absatz 1 FamFG wegen Vermögenslosigkeit von Amts wegen zu löschen. Gegen diese Verfügung kann Widerspruch eingelegt werden. Die Frist zur Erhebung eines Widerspruchs gegen die beabsichtigte Löschung von Amts wegen ist auf drei Monate festgesetzt."
    },
    {
      "date": "2025-04-30",
      "id": "107839",
      "original_text": "Löschungsankündigung\nNordrhein-Westfalen Amtsgericht Siegen HRA 9458\nFORESIGHT Generationenberatung GmbH & Co. KG – Hilchenbach",
      "type": "Löschungsankündigung",
      "state": "Nordrhein-Westfalen",
      "amtsgericht": "Amtsgericht Siegen",
      "registernummer": "HRA 9458",
      "registerart": "HRA",
      "company_name": "FORESIGHT Generationenberatung GmbH & Co. KG",
      "company_seat": "Hilchenbach",
      "details": "30.04.2025 (Bekanntmachungsdatum)\n\nNordrhein-Westfalen Amtsgericht Siegen HRA 9458\nLöschungsankündigung\n\nFORESIGHT Generationenberatung GmbH & Co. KG\nKommanditgesellschaft\nHilchenbach\n\nDas Registergericht beabsichtigt die Firma von Amts wegen nach § 31 Abs. 2 HGB, § 393 FamFG zu löschen. Die Frist zur Erhebung eines Widerspruchs ist auf zwei Monate festgesetzt."
    },
    {
      "date": "2025-04-30",
      "id": "107840",
      "original_text": "Löschungsankündigung\nHessen Amtsgericht Frankfurt am Main HRB 111316\nbiss UG (haftungsbeschränkt) – Hattersheim",
      "type": "Löschungsankündigung",
      "state": "Hessen",
      "amtsgericht": "Amtsgericht Frankfurt am Main",
      "registernummer": "HRB 111316",
      "registerart": "HRB",
      "company_name": "biss UG (haftungsbeschränkt)",
      "company_seat": "Hattersheim",
      "details": "30.04.2025 (Bekanntmachungsdatum)\n\nHessen Amtsgericht Frankfurt am Main HRB 111316\nLöschungsankündigung 30.04.2025 (Eintragungsdatum)\n\nbiss UG (haftungsbeschränkt)\nGesellschaft mit beschränkter Haftung\nHattersheim\n\nDas Registergericht beabsichtigt die im Handelsregister eingetragene Gesellschaft von Amts wegen nach § 394 FamFG zu löschen. Die Frist zur Erhebung eines Widerspruchs gegen die beabsichtigte Löschung wird auf 1 Monat festgesetzt."
    },
    {
      "date": "2025-04-30",
      "id": "107841",
      "original_text": "Sonstige Registerbekanntmachung\nHessen Amtsgericht Offenbach am Main VR 934\nRadfahr-Club-Adler 1899 Mühlheim-Dietesheim – Mühlheim am Main",
      "type": "Sonstige Registerbekanntmachung",
      "state": "Hessen",
      "amtsgericht": "Amtsgericht Offenbach am Main",
      "registernummer": "VR 934",
      "registerart": "VR",
      "company_name": "Radfahr-Club-Adler 1899 Mühlheim-Dietesheim",
      "company_seat": "Mühlheim am Main",
      "details": "30.04.2025 (Bekanntmachungsdatum)\n\nHessen Amtsgericht Offenbach am Main VR 934\nSonstige Registerbekanntmachung 30.04.2025 (Eintragungsdatum)\n\nRadfahr-Club-Adler 1899 Mühlheim-Dietesheim\neingetragener Verein\nMühlheim am Main\n\nDer Verein ist aufgelöst."
    },
    {
      "date": "2025-04-30",
      "id": "107842",
      "original_text": "Löschungsankündigung\nHessen Amtsgericht Wiesbaden HRB 30741\nHumSo UG (haftungsbeschränkt) – Wiesbaden",
      "type": "Löschungsankündigung",
      "state": "Hessen",
      "amtsgericht": "Amtsgericht Wiesbaden",
      "registernummer": "HRB 30741",
      "registerart": "HRB",
      "company_name": "HumSo UG (haftungsbeschränkt)",
      "company_seat": "Wiesbaden",
      "details": "30.04.2025 (Bekanntmachungsdatum)\n\nHessen Amtsgericht Wiesbaden HRB 30741\nLöschungsankündigung\n\nHumSo UG (haftungsbeschränkt)\nGesellschaft mit beschränkter Haftung\nWiesbaden\n\nDas Registergericht beabsichtigt die im Handelsregister eingetragene Gesellschaft von Amts wegen nach § 394 FamFG zu löschen. Die Frist zur Erhebung eines Widerspruchs gegen die beabsichtigte Löschung wird auf 3 Monate festgesetzt."
    },
    {
      "date": "2025-04-30",
      "id": "107843",
      "original_text": "Löschungsankündigung\nHessen Amtsgericht Frankfurt am Main HRB 106692\nHokmA-GmbH – Frankfurt am Main",
      "type": "Löschungsankündigung",
      "state": "Hessen",
      "amtsgericht": "Amtsgericht Frankfurt am Main",
      "registernummer": "HRB 106692",
      "registerart": "HRB",
      "company_name": "HokmA-GmbH",
      "company_seat": "Frankfurt am Main",
      "details": "30.04.2025 (Bekanntmachungsdatum)\n\nHessen Amtsgericht Frankfurt am Main HRB 106692\nLöschungsankündigung 30.04.2025 (Eintragungsdatum)\n\nHokmA-GmbH\nGesellschaft mit beschränkter Haftung\nFrankfurt am Main\n\nDas Registergericht beabsichtigt die im Handelsregister eingetragene Gesellschaft von Amts wegen nach § 394 FamFG zu löschen. Die Frist zur Erhebung eines Widerspruchs gegen die beabsichtigte Löschung wird auf 3 Monate festgesetzt."
    },
    {
      "date": "2025-04-30",
      "id": "107844",
      "original_text": "Einreichung neuer Dokumente\nHessen Amtsgericht Frankfurt am Main HRB 41672\nReisebank AG – Frankfurt am Main",
      "type": "Einreichung neuer Dokumente",
      "state": "Hessen",
      "amtsgericht": "Amtsgericht Frankfurt am Main",
      "registernummer": "HRB 41672",
      "registerart": "HRB",
      "company_name": "Reisebank AG",
      "company_seat": "Frankfurt am Main",
      "details": "30.04.2025 (Bekanntmachungsdatum)\n\nHessen Amtsgericht Frankfurt am Main HRB 41672\nEinreichung neuer Dokumente 30.04.2025 (Eintragungsdatum)\n\nReisebank AG\nAktiengesellschaft\nFrankfurt am Main\n\nDurch eine Änderung in den Personen der Aufsichtsratsmitglieder ist eine Liste der Mitglieder des Aufsichtsrates zum Handelsregister eingereicht worden."
    },
    {
      "date": "2025-04-30",
      "id": "107845",
      "original_text": "Registerbekanntmachung nach dem Umwandlungsgesetz\nHessen Amtsgericht Frankfurt am Main HRB 103516\nflatexDEGIRO AG – Frankfurt am Main",
      "type": "Registerbekanntmachung nach dem Umwandlungsgesetz",
      "state": "Hessen",
      "amtsgericht": "Amtsgericht Frankfurt am Main",
      "registernummer": "HRB 103516",
      "registerart": "HRB",
      "company_name": "flatexDEGIRO AG",
      "company_seat": "Frankfurt am Main",
      "details": "30.04.2025 (Bekanntmachungsdatum)\n\nHessen Amtsgericht Frankfurt am Main HRB 103516\nRegisterbekanntmachung nach dem Umwandlungsgesetz 28.04.2025 (Eintragungsdatum)\n\nflatexDEGIRO AG\nAktiengesellschaft\nFrankfurt am Main\n\nIm Wege der Gründung einer Europäischen Aktiengesellschaft SE durch Verschmelzung zur Aufnahme ohne Liquidation gemäß Art. 17 Abs. 2 lit. a SE VO, soll die flatex Projektgesellschaft Alpha AG, Wien, Österreich, auf die flatexDEGIRO AG, Frankfurt am Main, Deutschland verschmolzen werden und die flatexDEGIRO AG die Rechtsform einer SE annehmen.\nDeshalb werden gemäß Art.21 lit. a bis e SE VO die folgenden Angaben bekannt gemacht\n1. flatex Projektgesellschaft Alpha AG\na. Rechtsform, Firma und Sitz Rechtsform, Aktiengesellschaft Firma, flatex Projektgesellschaft Alpha AG Sitz Wien, Österreich\nb. Register, bei dem die in Art. 16 Abs. 3 der Richtlinie EU 2017 1132, vormals Art. 3 Abs. 2 der Richtlinie 68 151 EWG, genannten Unterlagen hinterlegt worden sind, sowie die Nummer der Eintragung in das Register\nDie übertragende Gesellschaft ist eingetragen im Firmenbuch des Handelsgerichts Wien unter der Firmennummer FN 649976 y. Dort sind auch die in Art. 16 Abs. 3 der Richtlinie EU 2017 1132, vormals Art. 3 Abs. 2 der Richtlinie 68 151 EWG, genannten Urkunden hinterlegt.\n2. flatexDEGIRO AG a. Rechtsform, Firma und Sitz Rechtsform, Aktiengesellschaft Firma, flatexDEGIRO AG Sitz Frankfurt am Main, Deutschland\nb. Register, bei dem die in Art. 16 Abs.3 der Richtlinie EU 2017 1132, vormals Art.3 Abs.2 der Richtlinie 68 151 EWC, genannten Unterlagen hinterlegt worden sind, sowie die Nummer der Eintragung in das Register\nDie übernehmende Gesellschaft ist eingetragen im Handelsregister des Amtsgerichts Frankfurt am Main unter HRB 103516. Dort sind auch die in Art. 16 Abs. 3 der Richtlinie EU 2017 1132, vormals Art. 3 Abs. 2 der Richtlinie 68 151 EWC, genannten Urkunden hinterlegt.\nc. Hinweis auf die Modalitäten für die Ausübung der Rechte der Gläubiger der flatexDEGIRO AG gemäß Art.24 Abs. 1 SE VO sowie die Anschrift, unter der erschöpfende Auskünfte über diese Modalitäten kostenlos eingeholt werden können. Gemäß Art.24 Abs. 1 SE VO findet unter Berücksichtigung des grenzüberschreitenden Charakters der Verschmelzung das Recht des Mitgliedstaats, das jeweils für die sich verschmelzenden Gesellschaften gilt, zum Schutz der Interessen der Gläubiger der sich verschmelzenden Gesellschaften wie bei einer Verschmelzung von Aktiengesellschaften Anwendung.\nIm deutschen Recht ist der Gläubigerschutz in Paragraph 22 UmwG geregelt. Danach ist den Gläubigern der flatexDEGlRO AG Sicherheit zu leisten, soweit sie nicht Befriedigung verlangen können, wenn sie binnen sechs Monaten nach dem Tag, an dem die Eintragung der Verschmelzung in das Register des Sitzes der flatexDEGIRO AG nach Paragraph 19 Abs. 3 UmwG als bekannt gemacht gilt, ihren Anspruch nach Grund und Höhe in Textform anmelden. Die Eintragung der Verschmelzung gilt als bekannt gemacht mit Bekanntmachung der Eintragung der Verschmelzung mit ihrem ganzen Inhalt in dem von der Landesjustizverwaltung bestimmten elektronischen Informations und Kommunikationssystem. Die Bekanntmachung gilt in dem Zeitpunkt als erfolgt, in dem sie auf der elektronischen Seite für Bekanntmachungen für die Öffentlichkeit einsehbar eingestellt ist.\nDieses Recht steht den Gläubiger der flatexDEGIRO AG allerdings nur zu, wenn sie glaubhaft machen, dass durch die Verschmelzung die Erfüllung ihrer Forderung gefährdet wird. Die Gläubiger sind in der Bekanntmachung der jeweiligen Eintragung auf dieses Recht hinzuweisen.\nGemäß  Paragraph 22 Abs. 2 UmwG steht das Recht, Sicherheitsleistung zu verlangen, Gläubigern nicht zu, die im Falle der Insolvenz ein Recht auf vorzugsweise Befriedigung aus einer Deckungsmasse haben, die nach gesetzlichen Vorschriften zu ihrem Schutz errichtet und staatlich überwacht ist.\nFür Anleihegläubiger der flatexDEGIRO AG, insbesondere Gläubiger von Wandel, Options und Gewinnanleihen, sowie für Inhaber von mit Sonderrechten ausgestatteten Wertpapieren außer Aktien gemäß Art.24 Abs. 1 lit. b, c, SE VO gelten ebenfalls die vorstehend beschriebenen Gläubigerschutzrechte entsprechend.\nDie speziellen Gläubigerschutzrechte nach Paragraphen 8, 13 des Gesetzes zur Ausführung der SE VO SEAG finden hier keine Anwendung, weil der künftige Sitz der flatexDEGlRO SE in Frankfurt am Main, Deutschland, und damit aus deutscher Sicht im Inland sein wird.\nUnter folgender Anschrift können kostenlos erschöpfende Auskünfte über die Modalitäten für die Ausübung der Rechte der Gläubiger der flatexDEGIRO AC eingeholt werden,\nflatexDEGIRO AG z.Hd. des Vorstands Omniturm, Große Gallusstraße 16 bis 18, 60312 Frankfurt am Main Deutschland\nd. Hinweis auf die Modalitäten für die Ausübung der Rechte der Minderheitsaktionäre der flatexDEGIRO AG gemäß Art.24 Abs. 2 SE VO sowie die Anschrift, unter der erschöpfende Auskünfte über diese Modalitäten kostenlos eingeholt werden können,\nGemäß Art.24 Abs.2 SE VO kann jeder Mitgliedsstaat in Bezug auf die sich verschmelzenden Gesellschaften, die seinem Recht unterliegen. Vorschriften erlassen, um einen angemessenen Schutz der Minderheitsaktionäre, die sich gegen die Verschmelzung ausgesprochen haben, zu gewährleisten.\nAktionäre der flatexDEGIRO AG können gegen den Beschluss der ordentlichen Hauptversammlung der flatexDEGIRO AG vom 2. Juni 2025 über die Zustimmung zum Verschmelzungsplan für die Verschmelzung zur Aufnahme der flatex Projektgesellschaft Alpha AG als übertragende Gesellschaft auf die flatexDEGlRO AG als übernehmende Gesellschaft und die Zusammenführung dieser sich verschmelzenden Gesellschaften in einer Europäischen Aktiengesellschaft Nichtigkeits und Anfechtungsklage erheben.\nDie Nichtigkeitsklage muss gemäß Paragraph 14 Abs. 1 UmwG binnen eines Monats nach der Beschlussfassung erhoben werden. Sie kann nur auf im Gesetz genannte Nichtigkeitsgründe gestützt werden. Ausschließlich zuständig ist das Landgericht Frankfurt am Main als das Landgericht, in dessen Bezirk die flatexDEGIRO AG ihren Sitz hat.\nDie Anfechtungsklage muss ebenso binnen eines Monats nach Beschlussfassung der Hauptversammlung der flatexDEGIRO AG erhoben werden. Sie kann grundsätzlich auf jede Verletzung des Gesetzes oder der Satzung gestützt werden. Anfechtungsbefugt ist jeder in der Hauptversammlung erschienene Aktionär der flatexDEGIRO AG, wenn er die Aktien schon vor der Bekanntmachung der Tagesordnung erworben hat und gegen den Beschluss Widerspruch zur Niederschrift erklärt hat. Nicht erschienene Aktionäre sind nur dann anfechtungsbefugt. wenn sie zu der Hauptversammlung zu Unrecht nicht zugelassen worden sind, die Versammlung nicht ordnungsgemäß einberufen. der Gegenstand der Beschlussfassung nicht ordnungsgemäß bekannt gemacht worden ist oder soweit die Anfechtungsklage auf das Erlangen von Sondervorteilen, Paragraph 243 Abs.2 AktG, gestützt ist. Im letzten Fall muss der Aktionär die Aktien schon vor Bekanntmachung der Tagesordnung erworben haben. Ausschließlich zuständig ist für die Anfechtungsklage das Landgericht Frankfurt am Main als das Landgericht, in dessen Bezirk die flatexDEGlRO AG ihren Sitz hat.\nWird der Hauptversammlungsbeschluss aufgrund Nichtigkeits oder Anfechtungsklage durch rechtskräftiges Urteil für nichtig erklärt, entfaltet das Urteil Wirkung gegenüber allen Aktionären sowie den Mitgliedern des Vorstands und des Aufsichtsrats, auch wenn sie nicht Partei sind. Eine Nichtigkeitserklärung des Beschlusses kommt nicht in Betracht, wenn der Beschluss zwischenzeitlich aufgrund eines Freigabeverfahrens nach Paragraph 16 Abs. 3.\nUmwG in das Handelsregister am Sitz der flatexDEGIRO AG eingetragen und die Verschmelzung dadurch wirksam geworden ist. In diesem Fall wäre die künftige flatexDEGIRO SE nach Paragraph 16 Abs.3 S. 10 UmwG verpflichtet, dem Antragsgegner des Freigabeverfahrens den Schaden zu ersetzen, der ihm aus der auf dem Freigabebeschluss beruhenden Eintragung der Verschmelzung entstanden ist. Die Beseitigung der Wirkungen der Eintragung der Verschmelzung im Handelsregister am Sitz der flatexDEGIRO AG bzw. flatexDEGIRO SE kann nicht als Schadensersatz verlangt werden.\nDie Verfahrensbeendigung, gleich aus welchem Grund, ist von der flatexDEGIRO AG unverzüglich in den Gesellschaftsblättern bekannt zu machen, Paragraph 248a S. 1 AktG. Die Bekanntmachung der Verfahrensbeendigung hat nach Paragraphen 248a S. 2, 149 Abs. 2 und 3 AktG deren Art, alle mit ihr im Zusammenhang stehenden Vereinbarungen einschließlich Nebenabreden im vollständigen Wortlaut sowie die Namen der Beteiligten zu enthalten. Etwaige Leistungen der flatexDEGIRO AG und ihr zurechenbare Leistungen Dritter müssen gesondert beschrieben und hervorgehoben werden. Die vollständige Bekanntmachung ist Wirksamkeitsvoraussetzung für alle Leistungspflichten. Die Wirksamkeit von verfahrensbeendigenden Prozesshandlungen bleibt hiervon unberührt. Trotz Unwirksamkeit bewirkte Leistungen können zurückgefordert werden. Die vorstehenden Regelungen gelten entsprechend ftir Vereinbarungen, die zur Vermeidung eines Prozesses geschlossen werden.\nAktionären der flatexDEGlRO AG steht kein Barabfindungsrecht nach Paragraph 7 SEAG zu. Paragraph 7 SEAG setzt voraus. dass die SE ihren Siz aus deutscher Sicht im Ausland hat. Das ist nicht der Fall, da die flatexDEGIRO AG übernehmende Gesellschaft ist und der künftige Sitz der flatexDEGIRO SE in Frankfurt am Main, Deutschland, sein wird.\nUnter folgender Anschrift können kostenlos erschöpfende Auskünfte über die Modalitäten für die Ausübung der Rechte der Minderheitsaktionäre der flatexDEGIRO AG eingeholt werden, flatexDEGlRO AG z.Hd. des Vorstands Omniturm, Große Gallusstraße 16 bis 18, 60312 Frankfurt am Main Deutschland.\n3. Firma und Sitz der SE Die durch die Verschmelzung der flatex Projektgesellschaft Alpha AG auf die flatexDEGIRO AG entstehende SE wird unter flatexDEGlRO SE firmieren und ihren Sitz in Frankfurt am Main, Deutschland, haben."
    },
    {
      "date": "2025-04-30",
      "id": "107846",
      "original_text": "Sonstige Registerbekanntmachung\nHessen Amtsgericht Darmstadt HRB 24849\nspeedikon Facility Management Aktiengesellschaft – Bensheim",
      "type": "Sonstige Registerbekanntmachung",
      "state": "Hessen",
      "amtsgericht": "Amtsgericht Darmstadt",
      "registernummer": "HRB 24849",
      "registerart": "HRB",
      "company_name": "speedikon Facility Management Aktiengesellschaft",
      "company_seat": "Bensheim",
      "details": "30.04.2025 (Bekanntmachungsdatum)\n\nHessen Amtsgericht Darmstadt HRB 24849\nSonstige Registerbekanntmachung 30.04.2025 (Eintragungsdatum)\n\nspeedikon Facility Management Aktiengesellschaft\nAktiengesellschaft\nBensheim\n\nWegen Änderungen in den Personen der Aufsichtsratsmitglieder ist eine Liste der Mitglieder des Aufsichtsrates zum Handelsregister eingereicht worden."
    },
    {
      "date": "2025-04-30",
      "id": "107847",
      "original_text": "Registerbekanntmachung nach dem Umwandlungsgesetz\nHessen Amtsgericht Darmstadt HRB 96249\nMerck Surface Solutions GmbH – Gernsheim",
      "type": "Registerbekanntmachung nach dem Umwandlungsgesetz",
      "state": "Hessen",
      "amtsgericht": "Amtsgericht Darmstadt",
      "registernummer": "HRB 96249",
      "registerart": "HRB",
      "company_name": "Merck Surface Solutions GmbH",
      "company_seat": "Gernsheim",
      "details": "30.04.2025 (Bekanntmachungsdatum)\n\nHessen Amtsgericht Darmstadt HRB 96249\nRegisterbekanntmachung nach dem Umwandlungsgesetz 30.04.2025 (Eintragungsdatum)\n\nMerck Surface Solutions GmbH\nGesellschaft mit beschränkter Haftung\nGernsheim\n\nDen Gläubigern der an der Abspaltung beteiligten Rechtsträger ist, wenn sie binnen sechs Monaten nach dem Tag, an dem die Eintragung der Abspaltung in das Register des Sitzes derjenigen Rechtsträger deren Gläubiger sie sind, nach §§ 125, 19 Absatz 3 UmwG bekannt gemacht worden ist, ihren Anspruch nach Grund und Höhe schriftlich anmelden, Sicherheit zu leisten, soweit sie nicht Befriedigung verlangen können. Dieses Recht steht den Gläubigern jedoch nur zu, wenn sie glaubhaft machen, dass durch die Abspaltung die Erfüllung ihrer Forderung gefährdet wird."
    },
    {
      "date": "2025-04-30",
      "id": "107848",
      "original_text": "Registerbekanntmachung nach dem Umwandlungsgesetz\nHessen Amtsgericht Offenbach am Main HRB 57295\nMontessori Dietzenbach gGmbH – Dietzenbach",
      "type": "Registerbekanntmachung nach dem Umwandlungsgesetz",
      "state": "Hessen",
      "amtsgericht": "Amtsgericht Offenbach am Main",
      "registernummer": "HRB 57295",
      "registerart": "HRB",
      "company_name": "Montessori Dietzenbach gGmbH",
      "company_seat": "Dietzenbach",
      "details": "30.04.2025 (Bekanntmachungsdatum)\n\nHessen Amtsgericht Offenbach am Main HRB 57295\nRegisterbekanntmachung nach dem Umwandlungsgesetz 30.04.2025 (Eintragungsdatum)\n\nMontessori Dietzenbach gGmbH\nGesellschaft mit beschränkter Haftung\nDietzenbach\n\nDen Gläubigern der an der Ausgliederung beteiligten Rechtsträger ist, wenn sie binnen sechs Monaten nach dem Tag, an dem die Eintragung der Ausgliederung in das Register des Sitzes desjenigen Rechtsträgers, dessen Gläubiger sie sind, nach §§ 125, 19 Absatz 3 UmwG bekannt gemacht worden ist, ihren Anspruch nach Grund und Höhe schriftlich anmelden, Sicherheit zu leisten, soweit sie nicht Befriedigung verlangen können. Dieses Recht steht den Gläubigern jedoch nur zu, wenn sie glaubhaft machen, dass durch die Ausgliederung die Erfüllung ihrer Forderung gefährdet wird."
    },
    {
      "date": "2025-04-30",
      "id": "107849",
      "original_text": "Löschungsankündigung\nHessen Amtsgericht Friedberg HRB 1714\ngemeinnützige WAUS GmbH – Friedberg (Hessen)",
      "type": "Löschungsankündigung",
      "state": "Hessen",
      "amtsgericht": "Amtsgericht Friedberg",
      "registernummer": "HRB 1714",
      "registerart": "HRB",
      "company_name": "gemeinnützige WAUS GmbH",
      "company_seat": "Friedberg (Hessen)",
      "details": "30.04.2025 (Bekanntmachungsdatum)\n\nHessen Amtsgericht Friedberg HRB 1714\nLöschungsankündigung 29.04.2025 (Eintragungsdatum)\n\ngemeinnützige WAUS GmbH\nGesellschaft mit beschränkter Haftung\nFriedberg (Hessen)\n\nDas Registergericht beabsichtigt die im Handelsregister eingetragene Gesellschaft von Amts wegen nach § 394 FamFG zu löschen. Die Frist zur Erhebung eines Widerspruchs gegen die beabsichtigte Löschung wird auf 3 Monate festgesetzt."
    },
    {
      "date": "2025-04-30",
      "id": "107850",
      "original_text": "Registerbekanntmachung nach dem Umwandlungsgesetz\nHessen Amtsgericht Frankfurt am Main HRB 106590\nCascade International Investment GmbH – Frankfurt am Main",
      "type": "Registerbekanntmachung nach dem Umwandlungsgesetz",
      "state": "Hessen",
      "amtsgericht": "Amtsgericht Frankfurt am Main",
      "registernummer": "HRB 106590",
      "registerart": "HRB",
      "company_name": "Cascade International Investment GmbH",
      "company_seat": "Frankfurt am Main",
      "details": "30.04.2025 (Bekanntmachungsdatum)\n\nHessen Amtsgericht Frankfurt am Main HRB 106590\nRegisterbekanntmachung nach dem Umwandlungsgesetz 30.04.2025 (Eintragungsdatum)\n\nCascade International Investment GmbH\nGesellschaft mit beschränkter Haftung\nFrankfurt am Main\n\nDen Gläubigern der an der Verschmelzung beteiligten Rechtsträger ist, wenn sie binnen sechs Monaten nach dem Tag, an dem die Eintragung der Verschmelzung in das Register des Sitzes desjenigen Rechtsträgers, dessen Gläubiger sie sind, nach § 19 Absatz 3 UmwG bekannt gemacht worden ist, ihren Anspruch nach Grund und Höhe schriftlich anmelden, Sicherheit zu leisten, soweit sie nicht Befriedigung verlangen können. Dieses Recht steht den Gläubigern jedoch nur zu, wenn sie glaubhaft machen, dass durch die Verschmelzung die Erfüllung ihrer Forderung gefährdet wird."
    },
    {
      "date": "2025-04-30",
      "id": "107851",
      "original_text": "Registerbekanntmachung nach dem Umwandlungsgesetz\nHessen Amtsgericht Darmstadt HRB 97307\nMerck 38. Allgemeine Beteiligungs-GmbH – Darmstadt",
      "type": "Registerbekanntmachung nach dem Umwandlungsgesetz",
      "state": "Hessen",
      "amtsgericht": "Amtsgericht Darmstadt",
      "registernummer": "HRB 97307",
      "registerart": "HRB",
      "company_name": "Merck 38. Allgemeine Beteiligungs-GmbH",
      "company_seat": "Darmstadt",
      "details": "30.04.2025 (Bekanntmachungsdatum)\n\nHessen Amtsgericht Darmstadt HRB 97307\nRegisterbekanntmachung nach dem Umwandlungsgesetz 30.04.2025 (Eintragungsdatum)\n\nMerck 38. Allgemeine Beteiligungs-GmbH\nGesellschaft mit beschränkter Haftung\nDarmstadt\n\nDen Gläubigern der an der Abspaltung beteiligten Rechtsträger ist, wenn sie binnen sechs Monaten nach dem Tag, an dem die Eintragung der Abspaltung in das Register des Sitzes derjenigen Rechtsträger deren Gläubiger sie sind, nach §§ 125, 19 Absatz 3 UmwG bekannt gemacht worden ist, ihren Anspruch nach Grund und Höhe schriftlich anmelden, Sicherheit zu leisten, soweit sie nicht Befriedigung verlangen können. Dieses Recht steht den Gläubigern jedoch nur zu, wenn sie glaubhaft machen, dass durch die Abspaltung die Erfüllung ihrer Forderung gefährdet wird."
    },
    {
      "date": "2025-04-30",
      "id": "107852",
      "original_text": "Löschungsankündigung\nHessen Amtsgericht Wiesbaden HRB 28509\nUnited Logistic Agencies GmbH (U. L. A. GmbH) – Wiesbaden",
      "type": "Löschungsankündigung",
      "state": "Hessen",
      "amtsgericht": "Amtsgericht Wiesbaden",
      "registernummer": "HRB 28509",
      "registerart": "HRB",
      "company_name": "United Logistic Agencies GmbH (U. L. A. GmbH)",
      "company_seat": "Wiesbaden",
      "details": "30.04.2025 (Bekanntmachungsdatum)\n\nHessen Amtsgericht Wiesbaden HRB 28509\nLöschungsankündigung\n\nUnited Logistic Agencies GmbH (U. L. A. GmbH)\nGesellschaft mit beschränkter Haftung\nWiesbaden\n\nDas Registergericht beabsichtigt die im Handelsregister eingetragene Gesellschaft von Amts wegen nach § 394 FamFG zu löschen. Die Frist zur Erhebung eines Widerspruchs gegen die beabsichtigte Löschung wird auf 3 Monate festgesetzt."
    },
    {
      "date": "2025-04-30",
      "id": "107853",
      "original_text": "Sonstige Registerbekanntmachung\nHessen Amtsgericht Fritzlar VR 1140\nHeimat- u.Verkehrsverein Rengshausen – Knüllwald-Rengshausen",
      "type": "Sonstige Registerbekanntmachung",
      "state": "Hessen",
      "amtsgericht": "Amtsgericht Fritzlar",
      "registernummer": "VR 1140",
      "registerart": "VR",
      "company_name": "Heimat- u.Verkehrsverein Rengshausen",
      "company_seat": "Knüllwald-Rengshausen",
      "details": "30.04.2025 (Bekanntmachungsdatum)\n\nHessen Amtsgericht Fritzlar VR 1140\nSonstige Registerbekanntmachung 30.04.2025 (Eintragungsdatum)\n\nHeimat- u.Verkehrsverein Rengshausen\neingetragener Verein\nKnüllwald-Rengshausen\n\nDer Verein ist aufgelöst."
    },
    {
      "date": "2025-04-30",
      "id": "107854",
      "original_text": "Registerbekanntmachung nach dem Umwandlungsgesetz\nHessen Amtsgericht Darmstadt HRB 97307\nMerck 38. Allgemeine Beteiligungs-GmbH – Darmstadt",
      "type": "Registerbekanntmachung nach dem Umwandlungsgesetz",
      "state": "Hessen",
      "amtsgericht": "Amtsgericht Darmstadt",
      "registernummer": "HRB 97307",
      "registerart": "HRB",
      "company_name": "Merck 38. Allgemeine Beteiligungs-GmbH",
      "company_seat": "Darmstadt",
      "details": "30.04.2025 (Bekanntmachungsdatum)\n\nHessen Amtsgericht Darmstadt HRB 97307\nRegisterbekanntmachung nach dem Umwandlungsgesetz 30.04.2025 (Eintragungsdatum)\n\nMerck 38. Allgemeine Beteiligungs-GmbH\nGesellschaft mit beschränkter Haftung\nDarmstadt\n\nDen Gläubigern der an der Verschmelzung beteiligten Rechtsträger ist, wenn sie binnen sechs Monaten nach dem Tag, an dem die Eintragung der Verschmelzung in das Register des Sitzes derjenigen Rechtsträger deren Gläubiger sie sind, nach § 19 Absatz 3 UmwG bekannt gemacht worden ist, ihren Anspruch nach Grund und Höhe schriftlich anmelden, Sicherheit zu leisten, soweit sie nicht Befriedigung verlangen können. Dieses Recht steht den Gläubigern jedoch nur zu, wenn sie glaubhaft machen, dass durch die Verschmelzung die Erfüllung ihrer Forderung gefährdet wird."
    },
    {
      "date": "2025-04-30",
      "id": "107855",
      "original_text": "Registerbekanntmachung nach dem Umwandlungsgesetz\nHessen Amtsgericht Darmstadt HRB 104168\nMerck Life Science KGaA – Darmstadt",
      "type": "Registerbekanntmachung nach dem Umwandlungsgesetz",
      "state": "Hessen",
      "amtsgericht": "Amtsgericht Darmstadt",
      "registernummer": "HRB 104168",
      "registerart": "HRB",
      "company_name": "Merck Life Science KGaA",
      "company_seat": "Darmstadt",
      "details": "30.04.2025 (Bekanntmachungsdatum)\n\nHessen Amtsgericht Darmstadt HRB 104168\nRegisterbekanntmachung nach dem Umwandlungsgesetz 30.04.2025 (Eintragungsdatum)\n\nMerck Life Science KGaA\nKommanditgesellschaft auf Aktien\nDarmstadt\n\nDen Gläubigern der an der Verschmelzung beteiligten Rechtsträger ist, wenn sie binnen sechs Monaten nach dem Tag, an dem die Eintragung der Verschmelzung in das Register des Sitzes derjenigen Rechtsträger deren Gläubiger sie sind, nach § 19 Absatz 3 UmwG bekannt gemacht worden ist, ihren Anspruch nach Grund und Höhe schriftlich anmelden, Sicherheit zu leisten, soweit sie nicht Befriedigung verlangen können. Dieses Recht steht den Gläubigern jedoch nur zu, wenn sie glaubhaft machen, dass durch die Verschmelzung die Erfüllung ihrer Forderung gefährdet wird."
    },
    {
      "date": "2025-04-30",
      "id": "107856",
      "original_text": "Löschungsankündigung\nHessen Amtsgericht Frankfurt am Main HRB 88114\nAmbientlux UG (haftungsbeschränkt) – Frankfurt am Main",
      "type": "Löschungsankündigung",
      "state": "Hessen",
      "amtsgericht": "Amtsgericht Frankfurt am Main",
      "registernummer": "HRB 88114",
      "registerart": "HRB",
      "company_name": "Ambientlux UG (haftungsbeschränkt)",
      "company_seat": "Frankfurt am Main",
      "details": "30.04.2025 (Bekanntmachungsdatum)\n\nHessen Amtsgericht Frankfurt am Main HRB 88114\nLöschungsankündigung 30.04.2025 (Eintragungsdatum)\n\nAmbientlux UG (haftungsbeschränkt)\nGesellschaft mit beschränkter Haftung\nFrankfurt am Main\n\nDas Registergericht beabsichtigt die im Handelsregister eingetragene Gesellschaft von Amts wegen nach § 394 FamFG zu löschen. Die Frist zur Erhebung eines Widerspruchs gegen die beabsichtigte Löschung wird auf 1 Monat festgesetzt."
    },
    {
      "date": "2025-04-30",
      "id": "107857",
      "original_text": "Löschungsankündigung\nHessen Amtsgericht Korbach HRB 2193\ndas IK services UG (haftungsbeschränkt) – Twistetal",
      "type": "Löschungsankündigung",
      "state": "Hessen",
      "amtsgericht": "Amtsgericht Korbach",
      "registernummer": "HRB 2193",
      "registerart": "HRB",
      "company_name": "das IK services UG (haftungsbeschränkt)",
      "company_seat": "Twistetal",
      "details": "30.04.2025 (Bekanntmachungsdatum)\n\nHessen Amtsgericht Korbach HRB 2193\nLöschungsankündigung 30.04.2025 (Eintragungsdatum)\n\ndas IK services UG (haftungsbeschränkt)\nGesellschaft mit beschränkter Haftung\nTwistetal\n\nDas Registergericht beabsichtigt die im Handelsregister eingetragene Gesellschaft von Amts wegen nach § 394 FamFG zu löschen. Die Frist zur Erhebung eines Widerspruchs gegen die beabsichtigte Löschung wird auf 3 Monate festgesetzt."
    },
    {
      "date": "2025-04-30",
      "id": "107858",
      "original_text": "Registerbekanntmachung nach dem Umwandlungsgesetz\nHessen Amtsgericht Offenbach am Main HRA 43447\nFinanzprofi RheinMain GmbH & Co. KG – Heusenstamm",
      "type": "Registerbekanntmachung nach dem Umwandlungsgesetz",
      "state": "Hessen",
      "amtsgericht": "Amtsgericht Offenbach am Main",
      "registernummer": "HRA 43447",
      "registerart": "HRA",
      "company_name": "Finanzprofi RheinMain GmbH & Co. KG",
      "company_seat": "Heusenstamm",
      "details": "30.04.2025 (Bekanntmachungsdatum)\n\nHessen Amtsgericht Offenbach am Main HRA 43447\nRegisterbekanntmachung nach dem Umwandlungsgesetz 30.04.2025 (Eintragungsdatum)\n\nFinanzprofi RheinMain GmbH & Co. KG\nKommanditgesellschaft\nHeusenstamm\n\nDen Gläubigern der an der Ausgliederung beteiligten Rechtsträger ist, wenn sie binnen sechs Monaten nach dem Tag, an dem die Eintragung der Ausgliederung in das Register des Sitzes desjenigen Rechtsträgers, dessen Gläubiger sie sind, nach §§ 125, 19 Absatz 3 UmwG bekannt gemacht worden ist, ihren Anspruch nach Grund und Höhe schriftlich anmelden, Sicherheit zu leisten, soweit sie nicht Befriedigung verlangen können. Dieses Recht steht den Gläubigern jedoch nur zu, wenn sie glaubhaft machen, dass durch die Ausgliederung die Erfüllung ihrer Forderung gefährdet wird."
    },
    {
      "date": "2025-04-30",
      "id": "107859",
      "original_text": "Registerbekanntmachung nach dem Umwandlungsgesetz\nHessen Amtsgericht Frankfurt am Main HRB 97493\n2e Energieversorgung Mallersdorf GmbH – Frankfurt am Main",
      "type": "Registerbekanntmachung nach dem Umwandlungsgesetz",
      "state": "Hessen",
      "amtsgericht": "Amtsgericht Frankfurt am Main",
      "registernummer": "HRB 97493",
      "registerart": "HRB",
      "company_name": "2e Energieversorgung Mallersdorf GmbH",
      "company_seat": "Frankfurt am Main",
      "details": "30.04.2025 (Bekanntmachungsdatum)\n\nHessen Amtsgericht Frankfurt am Main HRB 97493\nRegisterbekanntmachung nach dem Umwandlungsgesetz 30.04.2025 (Eintragungsdatum)\n\n2e Energieversorgung Mallersdorf GmbH\nGesellschaft mit beschränkter Haftung\nFrankfurt am Main\n\nDen Gläubigern der an der Verschmelzung beteiligten Rechtsträger ist, wenn sie binnen sechs Monaten nach dem Tag, an dem die Eintragung der Verschmelzung in das Register des Sitzes derjenigen Rechtsträger deren Gläubiger sie sind, nach § 19 Absatz 3 UmwG bekannt gemacht worden ist, ihren Anspruch nach Grund und Höhe schriftlich anmelden, Sicherheit zu leisten, soweit sie nicht Befriedigung verlangen können. Dieses Recht steht den Gläubigern jedoch nur zu, wenn sie glaubhaft machen, dass durch die Verschmelzung die Erfüllung ihrer Forderung gefährdet wird."
    },
    {
      "date": "2025-04-30",
      "id": "107860",
      "original_text": "Löschungsankündigung\nHessen Amtsgericht Friedberg HRB 9335\nMA Hotels GmbH – Rosbach v. d. Höhe",
      "type": "Löschungsankündigung",
      "state": "Hessen",
      "amtsgericht": "Amtsgericht Friedberg",
      "registernummer": "HRB 9335",
      "registerart": "HRB",
      "company_name": "MA Hotels GmbH",
      "company_seat": "Rosbach v. d. Höhe",
      "details": "30.04.2025 (Bekanntmachungsdatum)\n\nHessen Amtsgericht Friedberg HRB 9335\nLöschungsankündigung\n\nMA Hotels GmbH\nGesellschaft mit beschränkter Haftung\nRosbach v. d. Höhe\n\nDas Registergericht beabsichtigt die im Handelsregister eingetragene Gesellschaft von Amts wegen nach § 394 FamFG zu löschen. Die Frist zur Erhebung eines Widerspruchs gegen die beabsichtigte Löschung wird auf 3 Monate festgesetzt."
    },
    {
      "date": "2025-04-30",
      "id": "107861",
      "original_text": "Löschungsankündigung\nHessen Amtsgericht Königstein HRB 9823\nWHITE DC GmbH – Schwalbach am Taunus",
      "type": "Löschungsankündigung",
      "state": "Hessen",
      "amtsgericht": "Amtsgericht Königstein",
      "registernummer": "HRB 9823",
      "registerart": "HRB",
      "company_name": "WHITE DC GmbH",
      "company_seat": "Schwalbach am Taunus",
      "details": "30.04.2025 (Bekanntmachungsdatum)\n\nHessen Amtsgericht Königstein HRB 9823\nLöschungsankündigung\n\nWHITE DC GmbH\nGesellschaft mit beschränkter Haftung\nSchwalbach am Taunus\n\nDas Registergericht beabsichtigt die im Handelsregister eingetragene Gesellschaft von Amts wegen nach § 394 FamFG zu löschen. Die Frist zur Erhebung eines Widerspruchs gegen die beabsichtigte Löschung wird auf 2 Monate festgesetzt."
    }
  ]
}