{
  "date": "2025-04-09",
  "date_of_scrape": "2025-05-30T12:21:55.544Z",
  "tool_version": "0.2.0",
  "number_of_announcements": 121,
  "announcements": [
    {
      "date": "2025-04-09",
      "id": "106017",
      "original_text": "Einreichung neuer Dokumente\nBayern Amtsgericht München HRB 120850\nBerwin & Wolff Aktiengesellschaft – Ebersberg",
      "type": "Einreichung neuer Dokumente",
      "state": "Bayern",
      "amtsgericht": "Amtsgericht München",
      "registernummer": "HRB 120850",
      "registerart": "HRB",
      "company_name": "Berwin & Wolff Aktiengesellschaft",
      "company_seat": "Ebersberg",
      "details": "09.04.2025 (Bekanntmachungsdatum)\n\nBayern Amtsgericht München HRB 120850\nEinreichung neuer Dokumente\n\nBerwin & Wolff Aktiengesellschaft\nAktiengesellschaft\nEbersberg\n\nDem Amtsgericht München -Registergericht- ist eine Liste der Mitglieder des Aufsichtsrats eingereicht worden, § 106 AktG."
    },
    {
      "date": "2025-04-09",
      "id": "106018",
      "original_text": "Löschungsankündigung\nBayern Amtsgericht Fürth HRA 7096\nTerestra e.K. – Veitsbronn",
      "type": "Löschungsankündigung",
      "state": "Bayern",
      "amtsgericht": "Amtsgericht Fürth",
      "registernummer": "HRA 7096",
      "registerart": "HRA",
      "company_name": "Terestra e.K.",
      "company_seat": "Veitsbronn",
      "details": "09.04.2025 (Bekanntmachungsdatum)\n\nBayern Amtsgericht Fürth HRA 7096\nLöschungsankündigung 08.04.2025 (Eintragungsdatum)\n\nTerestra e.K.\nEinzelkaufmann / Einzelkauffrau\nVeitsbronn\n\nDas Registergericht beabsichtigt, die im Handelsregister eingetragene Firma von Amts wegen nach § 31 Abs. 2 HGB zu löschen. Die Frist zur Erhebung eines Widerspruchs ist auf einen Monat festgesetzt."
    },
    {
      "date": "2025-04-09",
      "id": "106019",
      "original_text": "Registerbekanntmachung nach dem Umwandlungsgesetz\nBayern Amtsgericht München HRB 286130\nTEG Business Partners GmbH – Andechs",
      "type": "Registerbekanntmachung nach dem Umwandlungsgesetz",
      "state": "Bayern",
      "amtsgericht": "Amtsgericht München",
      "registernummer": "HRB 286130",
      "registerart": "HRB",
      "company_name": "TEG Business Partners GmbH",
      "company_seat": "Andechs",
      "details": "09.04.2025 (Bekanntmachungsdatum)\n\nBayern Amtsgericht München HRB 286130\nRegisterbekanntmachung nach dem Umwandlungsgesetz 08.04.2025 (Eintragungsdatum)\n\nTEG Business Partners GmbH\nGesellschaft mit beschränkter Haftung\nAndechs\n\nDen Gläubigern der an der Verschmelzung beteiligten Rechtsträger ist, wenn sie binnen sechs Monaten nach dem Tag, an dem die Eintragung der Verschmelzung in das Register des Sitzes desjenigen Rechtsträgers, dessen Gläubiger sie sind, nach § 19 Abs. 3 UmwG als bekannt gemacht gilt, ihren Anspruch nach Grund und Höhe in Textform anmelden, Sicherheit zu leisten, soweit sie nicht Befriedigung verlangen können. Dieses Recht steht den Gläubigern jedoch nur zu, wenn sie glaubhaft machen, dass durch die Verschmelzung die Erfüllung ihrer Forderung gefährdet wird."
    },
    {
      "date": "2025-04-09",
      "id": "106020",
      "original_text": "Einreichung neuer Dokumente\nBayern Amtsgericht München HRB 228251\nKraussMaffei Group GmbH – Vaterstetten, OT Parsdorf",
      "type": "Einreichung neuer Dokumente",
      "state": "Bayern",
      "amtsgericht": "Amtsgericht München",
      "registernummer": "HRB 228251",
      "registerart": "HRB",
      "company_name": "KraussMaffei Group GmbH",
      "company_seat": "Vaterstetten, OT Parsdorf",
      "details": "09.04.2025 (Bekanntmachungsdatum)\n\nBayern Amtsgericht München HRB 228251\nEinreichung neuer Dokumente\n\nKraussMaffei Group GmbH\nGesellschaft mit beschränkter Haftung\nVaterstetten, OT Parsdorf\n\nDem Amtsgericht München -Registergericht- ist eine Liste der Mitglieder des Aufsichtsrats eingereicht worden, § 52 Abs. 3 S. 2 GmbHG."
    },
    {
      "date": "2025-04-09",
      "id": "106021",
      "original_text": "Registerbekanntmachung nach dem Umwandlungsgesetz\nBayern Amtsgericht München HRB 296283\nAliens GmbH – Otterfing",
      "type": "Registerbekanntmachung nach dem Umwandlungsgesetz",
      "state": "Bayern",
      "amtsgericht": "Amtsgericht München",
      "registernummer": "HRB 296283",
      "registerart": "HRB",
      "company_name": "Aliens GmbH",
      "company_seat": "Otterfing",
      "details": "09.04.2025 (Bekanntmachungsdatum)\n\nBayern Amtsgericht München HRB 296283\nRegisterbekanntmachung nach dem Umwandlungsgesetz 08.04.2025 (Eintragungsdatum)\n\nAliens GmbH\nGesellschaft mit beschränkter Haftung\nOtterfing\n\nDen Gläubigern der an der Ausgliederung beteiligten Rechtsträger ist, wenn sie binnen sechs Monaten nach dem Tag, an dem die Eintragung der Ausgliederung in das Register des Sitzes desjenigen Rechtsträgers, dessen Gläubiger sie sind, nach §§ 125, 19 Abs. 3 UmwG als bekannt gemacht gilt, ihren Anspruch nach Grund und Höhe in Textform anmelden, Sicherheit zu leisten, soweit sie nicht Befriedigung verlangen können. Dieses Recht steht den Gläubigern jedoch nur zu, wenn sie glaubhaft machen, dass durch die Ausgliederung die Erfüllung ihrer Forderung gefährdet wird."
    },
    {
      "date": "2025-04-09",
      "id": "106022",
      "original_text": "Löschungsankündigung\nBayern Amtsgericht Kempten (Allgäu) HRB 14674\nGutachterbüro für Wasserwirtschaft Fischen im Allgäu UG (haftungsbeschränkt) – Fischen i. Allgäu",
      "type": "Löschungsankündigung",
      "state": "Bayern",
      "amtsgericht": "Amtsgericht Kempten (Allgäu)",
      "registernummer": "HRB 14674",
      "registerart": "HRB",
      "company_name": "Gutachterbüro für Wasserwirtschaft Fischen im Allgäu UG (haftungsbeschränkt)",
      "company_seat": "Fischen i. Allgäu",
      "details": "09.04.2025 (Bekanntmachungsdatum)\n\nBayern Amtsgericht Kempten (Allgäu) HRB 14674\nLöschungsankündigung\n\nGutachterbüro für Wasserwirtschaft Fischen im Allgäu UG (haftungsbeschränkt)\nGesellschaft mit beschränkter Haftung\nFischen i. Allgäu\n\nDas Registergericht beabsichtigt, die im Handelsregister eingetragene Gesellschaft wegen Vermögenslosigkeit von Amts wegen nach § 394 FamFG zu löschen. Die Frist zur Erhebung eines Widerspruchs ist auf einen Monat festgesetzt."
    },
    {
      "date": "2025-04-09",
      "id": "106023",
      "original_text": "Einreichung neuer Dokumente\nBayern Amtsgericht München HRB 102775\nKnorr-Bremse Systeme für Nutzfahrzeuge GmbH – München",
      "type": "Einreichung neuer Dokumente",
      "state": "Bayern",
      "amtsgericht": "Amtsgericht München",
      "registernummer": "HRB 102775",
      "registerart": "HRB",
      "company_name": "Knorr-Bremse Systeme für Nutzfahrzeuge GmbH",
      "company_seat": "München",
      "details": "09.04.2025 (Bekanntmachungsdatum)\n\nBayern Amtsgericht München HRB 102775\nEinreichung neuer Dokumente\n\nKnorr-Bremse Systeme für Nutzfahrzeuge GmbH\nGesellschaft mit beschränkter Haftung\nMünchen\n\nDem Amtsgericht München -Registergericht- ist eine Liste der Mitglieder des Aufsichtsrats eingereicht worden, § 52 Abs. 3 S. 2 GmbHG."
    },
    {
      "date": "2025-04-09",
      "id": "106024",
      "original_text": "Einreichung neuer Dokumente\nBayern Amtsgericht München HRB 219608\nOrcan Energy AG – München",
      "type": "Einreichung neuer Dokumente",
      "state": "Bayern",
      "amtsgericht": "Amtsgericht München",
      "registernummer": "HRB 219608",
      "registerart": "HRB",
      "company_name": "Orcan Energy AG",
      "company_seat": "München",
      "details": "09.04.2025 (Bekanntmachungsdatum)\n\nBayern Amtsgericht München HRB 219608\nEinreichung neuer Dokumente 08.04.2025 (Eintragungsdatum)\n\nOrcan Energy AG\nAktiengesellschaft\nMünchen\n\nDem Amtsgericht München -Registergericht- ist eine Liste der Mitglieder des Aufsichtsrats eingereicht worden, § 106 AktG."
    },
    {
      "date": "2025-04-09",
      "id": "106025",
      "original_text": "Registerbekanntmachung nach dem Umwandlungsgesetz\nBayern Amtsgericht München HRB 301444\nsweet spot kaffee GmbH – München",
      "type": "Registerbekanntmachung nach dem Umwandlungsgesetz",
      "state": "Bayern",
      "amtsgericht": "Amtsgericht München",
      "registernummer": "HRB 301444",
      "registerart": "HRB",
      "company_name": "sweet spot kaffee GmbH",
      "company_seat": "München",
      "details": "09.04.2025 (Bekanntmachungsdatum)\n\nBayern Amtsgericht München HRB 301444\nRegisterbekanntmachung nach dem Umwandlungsgesetz 08.04.2025 (Eintragungsdatum)\n\nsweet spot kaffee GmbH\nGesellschaft mit beschränkter Haftung\nMünchen\n\nDen Gläubigern der an der Ausgliederung beteiligten Rechtsträger ist, wenn sie binnen sechs Monaten nach dem Tag, an dem die Eintragung der Ausgliederung in das Register des Sitzes desjenigen Rechtsträgers, dessen Gläubiger sie sind, nach §§ 125, 19 Abs. 3 UmwG als bekannt gemacht gilt, ihren Anspruch nach Grund und Höhe in Textform anmelden, Sicherheit zu leisten, soweit sie nicht Befriedigung verlangen können. Dieses Recht steht den Gläubigern jedoch nur zu, wenn sie glaubhaft machen, dass durch die Ausgliederung die Erfüllung ihrer Forderung gefährdet wird."
    },
    {
      "date": "2025-04-09",
      "id": "106026",
      "original_text": "Registerbekanntmachung nach dem Umwandlungsgesetz\nBayern Amtsgericht München HRA 120940\nEHB Steuerberatung GmbH & Co. KG – München",
      "type": "Registerbekanntmachung nach dem Umwandlungsgesetz",
      "state": "Bayern",
      "amtsgericht": "Amtsgericht München",
      "registernummer": "HRA 120940",
      "registerart": "HRA",
      "company_name": "EHB Steuerberatung GmbH & Co. KG",
      "company_seat": "München",
      "details": "09.04.2025 (Bekanntmachungsdatum)\n\nBayern Amtsgericht München HRA 120940\nRegisterbekanntmachung nach dem Umwandlungsgesetz 08.04.2025 (Eintragungsdatum)\n\nEHB Steuerberatung GmbH & Co. KG\nKommanditgesellschaft\nMünchen\n\nDen Gläubigern des formwechselnden Rechtsträgers ist, wenn sie binnen sechs Monaten nach dem Tag, an dem die Eintragung des Formwechsels nach § 201 UmwG als bekannt gemacht gilt, ihren Anspruch nach Grund und Höhe in Textform anmelden, Sicherheit zu leisten, soweit sie nicht Befriedigung verlangen können. Dieses Recht steht den Gläubigern jedoch nur zu, wenn sie glaubhaft machen, dass durch den Formwechsel die Erfüllung ihrer Forderung gefährdet wird."
    },
    {
      "date": "2025-04-09",
      "id": "106027",
      "original_text": "Löschungsankündigung\nBayern Amtsgericht München HRA 92938\nRK Medien GmbH & Co. KG – Oberschleißheim",
      "type": "Löschungsankündigung",
      "state": "Bayern",
      "amtsgericht": "Amtsgericht München",
      "registernummer": "HRA 92938",
      "registerart": "HRA",
      "company_name": "RK Medien GmbH & Co. KG",
      "company_seat": "Oberschleißheim",
      "details": "09.04.2025 (Bekanntmachungsdatum)\n\nBayern Amtsgericht München HRA 92938\nLöschungsankündigung 28.03.2025 (Eintragungsdatum)\n\nRK Medien GmbH & Co. KG\nKommanditgesellschaft\nOberschleißheim\n\nDas Registergericht beabsichtigt, die im Handelsregister eingetragene Gesellschaft wegen Vermögenslosigkeit von Amts wegen nach § 394 FamFG zu löschen. Die Frist zur Erhebung eines Widerspruchs ist auf drei Monate festgesetzt."
    },
    {
      "date": "2025-04-09",
      "id": "106028",
      "original_text": "Einreichung neuer Dokumente\nBayern Amtsgericht Nürnberg HRB 24181\nLEONI Kabel GmbH – Roth",
      "type": "Einreichung neuer Dokumente",
      "state": "Bayern",
      "amtsgericht": "Amtsgericht Nürnberg",
      "registernummer": "HRB 24181",
      "registerart": "HRB",
      "company_name": "LEONI Kabel GmbH",
      "company_seat": "Roth",
      "details": "09.04.2025 (Bekanntmachungsdatum)\n\nBayern Amtsgericht Nürnberg HRB 24181\nEinreichung neuer Dokumente\n\nLEONI Kabel GmbH\nGesellschaft mit beschränkter Haftung\nRoth\n\nDem Amtsgericht Nürnberg -Registergericht- ist eine Liste der Mitglieder des Aufsichtsrats eingereicht worden, § 52 Abs. 3 S. 2 GmbHG."
    },
    {
      "date": "2025-04-09",
      "id": "106029",
      "original_text": "Registerbekanntmachung nach dem Umwandlungsgesetz\nBayern Amtsgericht Passau HRB 6798\nSCS - Supply Chain Services AG – Schönberg",
      "type": "Registerbekanntmachung nach dem Umwandlungsgesetz",
      "state": "Bayern",
      "amtsgericht": "Amtsgericht Passau",
      "registernummer": "HRB 6798",
      "registerart": "HRB",
      "company_name": "SCS - Supply Chain Services AG",
      "company_seat": "Schönberg",
      "details": "09.04.2025 (Bekanntmachungsdatum)\n\nBayern Amtsgericht Passau HRB 6798\nRegisterbekanntmachung nach dem Umwandlungsgesetz\n\nSCS - Supply Chain Services AG\nAktiengesellschaft\nSchönberg\n\nDen Gläubigern des formwechselnden Rechtsträgers ist, wenn sie binnen sechs Monaten nach dem Tag, an dem die Eintragung des Formwechsels nach § 201 UmwG als bekannt gemacht gilt, ihren Anspruch nach Grund und Höhe in Textform anmelden, Sicherheit zu leisten, soweit sie nicht Befriedigung verlangen können. Dieses Recht steht den Gläubigern jedoch nur zu, wenn sie glaubhaft machen, dass durch den Formwechsel die Erfüllung ihrer Forderung gefährdet wird."
    },
    {
      "date": "2025-04-09",
      "id": "106030",
      "original_text": "Löschungsankündigung\nBerlin Amtsgericht Berlin (Charlottenburg) HRB 186449\nBERCity Immobilien & Bau GmbH – Berlin",
      "type": "Löschungsankündigung",
      "state": "Berlin",
      "amtsgericht": "Amtsgericht Berlin (Charlottenburg)",
      "registernummer": "HRB 186449",
      "registerart": "HRB",
      "company_name": "BERCity Immobilien & Bau GmbH",
      "company_seat": "Berlin",
      "details": "09.04.2025 (Bekanntmachungsdatum)\n\nBerlin Amtsgericht Berlin (Charlottenburg) HRB 186449\nLöschungsankündigung\n\nBERCity Immobilien & Bau GmbH\nGesellschaft mit beschränkter Haftung\nBerlin\n\nBei der nachstehenden Gesellschaft wird das Amtslöschungsverfahren gemäß § 394 FamFG eingeleitet. Widerspruchsfrist: 6 Wochen."
    },
    {
      "date": "2025-04-09",
      "id": "106031",
      "original_text": "Löschungsankündigung\nBerlin Amtsgericht Berlin (Charlottenburg) HRB 159440\nSolarpark JVA Brandenburg GmbH – Berlin",
      "type": "Löschungsankündigung",
      "state": "Berlin",
      "amtsgericht": "Amtsgericht Berlin (Charlottenburg)",
      "registernummer": "HRB 159440",
      "registerart": "HRB",
      "company_name": "Solarpark JVA Brandenburg GmbH",
      "company_seat": "Berlin",
      "details": "09.04.2025 (Bekanntmachungsdatum)\n\nBerlin Amtsgericht Berlin (Charlottenburg) HRB 159440\nLöschungsankündigung\n\nSolarpark JVA Brandenburg GmbH\nGesellschaft mit beschränkter Haftung\nBerlin\n\nBei der nachstehenden Gesellschaft wird das Amtslöschungsverfahren gemäß § 394 FamFG eingeleitet. Widerspruchsfrist: 6 Wochen."
    },
    {
      "date": "2025-04-09",
      "id": "106032",
      "original_text": "Löschungsankündigung\nSchleswig-Holstein Amtsgericht Lübeck HRB 18272\n$unny matic GmbH – Barsbüttel",
      "type": "Löschungsankündigung",
      "state": "Schleswig-Holstein",
      "amtsgericht": "Amtsgericht Lübeck",
      "registernummer": "HRB 18272",
      "registerart": "HRB",
      "company_name": "$unny matic GmbH",
      "company_seat": "Barsbüttel",
      "details": "09.04.2025 (Bekanntmachungsdatum)\n\nSchleswig-Holstein Amtsgericht Lübeck HRB 18272\nLöschungsankündigung\n\n$unny matic GmbH\nGesellschaft mit beschränkter Haftung\nBarsbüttel\n\nAnliegendes Schreiben an die Liquidatorin wird veröffentlicht:\n\nAn\nFrau Nele Annika Scharphuis\n\nSehr geehrte Frau Scharphuis, Sehr geehrte Damen und Herren,\n\nin der Handelsregistersache der\n$unny matic GmbH\n\nergeben sich aus den mir vorliegenden Unterlagen, nämlich dem Schreiben des Finanzamtes Stormarn vom 17.02.2025, Anhaltspunkte dafür, dass die Gesellschaft, als deren Liquidator Sie noch eingetragen sind, vermögenslos ist.\n\nIch prüfe daher, ob die Gesellschaft wegen Vermögenslosigkeit gemäß § 394 FamFG zu löschen ist. Die Beendigung der Liquidation wurde bislang nicht von Ihnen angemeldet.\n\nIch gebe Ihnen Gelegenheit, dazu binnen einer Frist von   1 Monat   Stellung zu nehmen.\n\nWeiter bitte ich Sie, binnen derselben Frist folgende Auskünfte zu erteilen:\nHat die obige Gesellschaft noch Vermögen? Wenn ja, welche Vermögensgegenstände besitzt sie?\nIst die Gesellschaft Partei eines noch nicht rechtskräftig abgeschlossenen Rechtsstreits?\nFindet sonst noch eine Abwicklung statt?\n\nMit freundlichen Grüßen\n\nSteder\nDipl.-Rechtspflegerin (FH)"
    },
    {
      "date": "2025-04-09",
      "id": "106033",
      "original_text": "Löschungsankündigung\nHamburg Amtsgericht Hamburg HRA 108668\nSan Edward Shipping GmbH & Co. KG – Hamburg",
      "type": "Löschungsankündigung",
      "state": "Hamburg",
      "amtsgericht": "Amtsgericht Hamburg",
      "registernummer": "HRA 108668",
      "registerart": "HRA",
      "company_name": "San Edward Shipping GmbH & Co. KG",
      "company_seat": "Hamburg",
      "details": "09.04.2025 (Bekanntmachungsdatum)\n\nHamburg Amtsgericht Hamburg HRA 108668\nLöschungsankündigung\n\nSan Edward Shipping GmbH & Co. KG\nKommanditgesellschaft\nHamburg\n\nDas Registergericht beabsichtigt, die im Handelsregister eingetragene Firma von Amts wegen nach § 394 Abs. 4 FamFG zu löschen. Die Frist zur Erhebung eines Widerspruchs gegen die beabsichtigte Löschung wird auf 3 Monate festgesetzt."
    },
    {
      "date": "2025-04-09",
      "id": "106034",
      "original_text": "Registerbekanntmachung nach dem Umwandlungsgesetz\nBaden-Württemberg Amtsgericht Mannheim HRB 754176\nLeimi GmbH – Zaisenhausen",
      "type": "Registerbekanntmachung nach dem Umwandlungsgesetz",
      "state": "Baden-Württemberg",
      "amtsgericht": "Amtsgericht Mannheim",
      "registernummer": "HRB 754176",
      "registerart": "HRB",
      "company_name": "Leimi GmbH",
      "company_seat": "Zaisenhausen",
      "details": "09.04.2025 (Bekanntmachungsdatum)\n\nBaden-Württemberg Amtsgericht Mannheim HRB 754176\nRegisterbekanntmachung nach dem Umwandlungsgesetz 09.04.2025 (Eintragungsdatum)\n\nLeimi GmbH\nGesellschaft mit beschränkter Haftung\nZaisenhausen\n\nAls nicht eingetragen wird bekanntgemacht:\nDen Gläubigern der an der Ausgliederung beteiligten Rechtsträger ist, wenn sie binnen sechs Monaten nach dem Tag, an dem die Eintragung der Ausgliederung in das Register des Sitzes desjenigen Rechtsträgers, dessen Gläubiger sie sind, nach § 19 Abs. 3 UmwG als bekanntgemacht gilt, ihren Anspruch nach Grund und Höhe schriftlich anmelden, Sicherheit zu leisten, soweit sie nicht Befriedigung verlangen können. Dieses Recht steht den Gläubigern jedoch nur zu, wenn sie glaubhaft machen, dass durch die Ausgliederung die Erfüllung ihrer Forderung gefährdet wird."
    },
    {
      "date": "2025-04-09",
      "id": "106035",
      "original_text": "Registerbekanntmachung nach dem Umwandlungsgesetz\nBaden-Württemberg Amtsgericht Mannheim HRA 711970\nJean Renschler e.K. – Zaisenhausen",
      "type": "Registerbekanntmachung nach dem Umwandlungsgesetz",
      "state": "Baden-Württemberg",
      "amtsgericht": "Amtsgericht Mannheim",
      "registernummer": "HRA 711970",
      "registerart": "HRA",
      "company_name": "Jean Renschler e.K.",
      "company_seat": "Zaisenhausen",
      "details": "09.04.2025 (Bekanntmachungsdatum)\n\nBaden-Württemberg Amtsgericht Mannheim HRA 711970\nRegisterbekanntmachung nach dem Umwandlungsgesetz 09.04.2025 (Eintragungsdatum)\n\nJean Renschler e.K.\nEinzelkaufmann / Einzelkauffrau\nZaisenhausen\n\nDen Gläubigern der an der Ausgliederung beteiligten Rechtsträger ist, wenn sie binnen sechs Monaten nach dem Tag, an dem die Eintragung der Ausgliederung in das Register des Sitzes desjenigen Rechtsträgers, dessen Gläubiger sie sind, nach § 19 Abs. 3 UmwG als bekanntgemacht gilt, ihren Anspruch nach Grund und Höhe schriftlich anmelden, Sicherheit zu leisten, soweit sie nicht Befriedigung verlangen können. Dieses Recht steht den Gläubigern jedoch nur zu, wenn sie glaubhaft machen, dass durch die Ausgliederung die Erfüllung ihrer Forderung gefährdet wird."
    },
    {
      "date": "2025-04-09",
      "id": "106036",
      "original_text": "Löschungsankündigung\nBerlin Amtsgericht Berlin (Charlottenburg) HRB 154696\nSMP Solutions GmbH – Berlin",
      "type": "Löschungsankündigung",
      "state": "Berlin",
      "amtsgericht": "Amtsgericht Berlin (Charlottenburg)",
      "registernummer": "HRB 154696",
      "registerart": "HRB",
      "company_name": "SMP Solutions GmbH",
      "company_seat": "Berlin",
      "details": "09.04.2025 (Bekanntmachungsdatum)\n\nBerlin Amtsgericht Berlin (Charlottenburg) HRB 154696\nLöschungsankündigung\n\nSMP Solutions GmbH\nGesellschaft mit beschränkter Haftung\nBerlin\n\nBei der nachstehenden Gesellschaft wird das Amtslöschungsverfahren gemäß § 394 FamFG eingeleitet. Widerspruchsfrist 6 Wochen"
    },
    {
      "date": "2025-04-09",
      "id": "106037",
      "original_text": "Registerbekanntmachung nach dem Umwandlungsgesetz\nBaden-Württemberg Amtsgericht Mannheim HRB 718064\nMatrix International GmbH – Heidelberg",
      "type": "Registerbekanntmachung nach dem Umwandlungsgesetz",
      "state": "Baden-Württemberg",
      "amtsgericht": "Amtsgericht Mannheim",
      "registernummer": "HRB 718064",
      "registerart": "HRB",
      "company_name": "Matrix International GmbH",
      "company_seat": "Heidelberg",
      "details": "09.04.2025 (Bekanntmachungsdatum)\n\nBaden-Württemberg Amtsgericht Mannheim HRB 718064\nRegisterbekanntmachung nach dem Umwandlungsgesetz 09.04.2025 (Eintragungsdatum)\n\nMatrix International GmbH\nGesellschaft mit beschränkter Haftung\nHeidelberg\n\nDen Gläubigern der an der Verschmelzung beteiligten Rechtsträger ist, wenn sie binnen sechs Monaten nach dem Tag, an dem die Eintragung der Verschmelzung in das Register des Sitzes desjenigen Rechtsträgers, dessen Gläubiger sie sind, nach § 19 Abs. 3 UmwG als bekanntgemacht gilt, ihren Anspruch nach Grund und Höhe schriftlich anmelden, Sicherheit zu leisten, soweit sie nicht Befriedigung verlangen können. Dieses Recht steht den Gläubigern jedoch nur zu, wenn sie glaubhaft machen, dass durch die Verschmelzung die Erfüllung ihrer Forderung gefährdet wird."
    },
    {
      "date": "2025-04-09",
      "id": "106038",
      "original_text": "Registerbekanntmachung nach dem Umwandlungsgesetz\nBaden-Württemberg Amtsgericht Mannheim HRB 336586\nStieber GmbH – Heidelberg",
      "type": "Registerbekanntmachung nach dem Umwandlungsgesetz",
      "state": "Baden-Württemberg",
      "amtsgericht": "Amtsgericht Mannheim",
      "registernummer": "HRB 336586",
      "registerart": "HRB",
      "company_name": "Stieber GmbH",
      "company_seat": "Heidelberg",
      "details": "09.04.2025 (Bekanntmachungsdatum)\n\nBaden-Württemberg Amtsgericht Mannheim HRB 336586\nRegisterbekanntmachung nach dem Umwandlungsgesetz 09.04.2025 (Eintragungsdatum)\n\nStieber GmbH\nGesellschaft mit beschränkter Haftung\nHeidelberg\n\nAls nicht eingetragen wird bekanntgemacht:\nDen Gläubigern der an der Verschmelzung beteiligten Rechtsträger ist, wenn sie binnen sechs Monaten nach dem Tag, an dem die Eintragung der Verschmelzung in das Register des Sitzes desjenigen Rechtsträgers, dessen Gläubiger sie sind, nach § 19 Abs. 3 UmwG als bekanntgemacht gilt, ihren Anspruch nach Grund und Höhe schriftlich anmelden, Sicherheit zu leisten, soweit sie nicht Befriedigung verlangen können. Dieses Recht steht den Gläubigern jedoch nur zu, wenn sie glaubhaft machen, dass durch die Verschmelzung die Erfüllung ihrer Forderung gefährdet wird."
    },
    {
      "date": "2025-04-09",
      "id": "106039",
      "original_text": "Sonstige Registerbekanntmachung\nBrandenburg Amtsgericht Frankfurt/Oder HRB 8915\nLandgasthof zum Mühlenteich Betriebsgesellschaft mbH – Peterhagen/Eggersdorf",
      "type": "Sonstige Registerbekanntmachung",
      "state": "Brandenburg",
      "amtsgericht": "Amtsgericht Frankfurt/Oder",
      "registernummer": "HRB 8915",
      "registerart": "HRB",
      "company_name": "Landgasthof zum Mühlenteich Betriebsgesellschaft mbH",
      "company_seat": "Peterhagen/Eggersdorf",
      "details": "09.04.2025 (Bekanntmachungsdatum)\n\nBrandenburg Amtsgericht Frankfurt/Oder HRB 8915\nSonstige Registerbekanntmachung 08.04.2025 (Eintragungsdatum)\n\nLandgasthof zum Mühlenteich Betriebsgesellschaft mbH\nGesellschaft mit beschränkter Haftung\nPeterhagen/Eggersdorf\n\nAls nicht eingetragen wird veröffentlicht:\nDen Gläubigern der an der Verschmelzung beteiligten Rechtsträger ist, wenn sie binnen sechs Monaten nach dem Tag, an dem die Eintragung der Verschmelzung in das Register des Sitzes desjenigen Rechtsträgers, dessen Gläubiger sie sind, als bekannt gemacht gilt, ihren Anspruch nach Grund und Höhe schriftlich anmelden, Sicherheit zu leisten, soweit sie nicht Befriedigung verlangen können. Dieses Recht steht den Gläubigern jedoch nur zu, wenn sie glaubhaft machen, dass durch die Verschmelzung die Erfüllung ihrer Forderung gefährdet wird"
    },
    {
      "date": "2025-04-09",
      "id": "106040",
      "original_text": "Löschungsankündigung\nBrandenburg Amtsgericht Potsdam HRB 25665\nLM Bau-Handel GmbH – Ludwigsfelde",
      "type": "Löschungsankündigung",
      "state": "Brandenburg",
      "amtsgericht": "Amtsgericht Potsdam",
      "registernummer": "HRB 25665",
      "registerart": "HRB",
      "company_name": "LM Bau-Handel GmbH",
      "company_seat": "Ludwigsfelde",
      "details": "09.04.2025 (Bekanntmachungsdatum)\n\nBrandenburg Amtsgericht Potsdam HRB 25665\nLöschungsankündigung\n\nLM Bau-Handel GmbH\nGesellschaft mit beschränkter Haftung\nLudwigsfelde\n\nBei der nachstehenden Gesellschaft wird das Amtslöschungsverfahren gemäß § 394 FamFG eingeleitet. Widerspruchsfrist 8 Wochen."
    },
    {
      "date": "2025-04-09",
      "id": "106041",
      "original_text": "Registerbekanntmachung nach dem Umwandlungsgesetz\nHamburg Amtsgericht Hamburg HRA 105623\nNeitzel & Cie. Gesellschaft für Beteiligungen mbH & Co. KG – Hamburg",
      "type": "Registerbekanntmachung nach dem Umwandlungsgesetz",
      "state": "Hamburg",
      "amtsgericht": "Amtsgericht Hamburg",
      "registernummer": "HRA 105623",
      "registerart": "HRA",
      "company_name": "Neitzel & Cie. Gesellschaft für Beteiligungen mbH & Co. KG",
      "company_seat": "Hamburg",
      "details": "09.04.2025 (Bekanntmachungsdatum)\n\nHamburg Amtsgericht Hamburg HRA 105623\nRegisterbekanntmachung nach dem Umwandlungsgesetz 09.04.2025 (Eintragungsdatum)\n\nNeitzel & Cie. Gesellschaft für Beteiligungen mbH & Co. KG\nKommanditgesellschaft\nHamburg\n\nAls nicht eingetragen wird bekannt gemacht:\nDen Gläubigern der an der Verschmelzung beteiligten Gesellschaften ist, wenn sie binnen sechs Monaten nach dem Tag, an dem die Eintragung der Verschmelzung in das Register des Sitzes desjenigen Rechtsträgers, dessen Gläubiger sie sind, nach § 19 Absatz 3 UmwG als bekannt gemacht gilt, ihren Anspruch nach Grund und Höhe schriftlich anmelden, Sicherheit zu leisten, soweit sie nicht Befriedigung verlangen können. Dieses Recht steht den Gläubigern jedoch nur zu, wenn sie glaubhaft machen, dass durch die Verschmelzung die Erfüllung ihrer Forderung gefährdet wird."
    },
    {
      "date": "2025-04-09",
      "id": "106042",
      "original_text": "Registerbekanntmachung nach dem Umwandlungsgesetz\nHamburg Amtsgericht Hamburg HRA 117598\nNeitzel & Cie. Gesellschaft für Energiebeteiligungen mbH & Co. KG – Hamburg",
      "type": "Registerbekanntmachung nach dem Umwandlungsgesetz",
      "state": "Hamburg",
      "amtsgericht": "Amtsgericht Hamburg",
      "registernummer": "HRA 117598",
      "registerart": "HRA",
      "company_name": "Neitzel & Cie. Gesellschaft für Energiebeteiligungen mbH & Co. KG",
      "company_seat": "Hamburg",
      "details": "09.04.2025 (Bekanntmachungsdatum)\n\nHamburg Amtsgericht Hamburg HRA 117598\nRegisterbekanntmachung nach dem Umwandlungsgesetz 09.04.2025 (Eintragungsdatum)\n\nNeitzel & Cie. Gesellschaft für Energiebeteiligungen mbH & Co. KG\nKommanditgesellschaft\nHamburg\n\nAls nicht eingetragen wird bekannt gemacht:\nDen Gläubigern der an der Verschmelzung beteiligten Gesellschaften ist, wenn sie binnen sechs Monaten nach dem Tag, an dem die Eintragung der Verschmelzung in das Register des Sitzes desjenigen Rechtsträgers, dessen Gläubiger sie sind, nach § 19 Absatz 3 UmwG als bekannt gemacht gilt, ihren Anspruch nach Grund und Höhe schriftlich anmelden, Sicherheit zu leisten, soweit sie nicht Befriedigung verlangen können. Dieses Recht steht den Gläubigern jedoch nur zu, wenn sie glaubhaft machen, dass durch die Verschmelzung die Erfüllung ihrer Forderung gefährdet wird."
    },
    {
      "date": "2025-04-09",
      "id": "106043",
      "original_text": "Einreichung neuer Dokumente\nBaden-Württemberg Amtsgericht Freiburg HRB 726280\nQuantus Informatics AG – Stockach",
      "type": "Einreichung neuer Dokumente",
      "state": "Baden-Württemberg",
      "amtsgericht": "Amtsgericht Freiburg",
      "registernummer": "HRB 726280",
      "registerart": "HRB",
      "company_name": "Quantus Informatics AG",
      "company_seat": "Stockach",
      "details": "09.04.2025 (Bekanntmachungsdatum)\n\nBaden-Württemberg Amtsgericht Freiburg HRB 726280\nEinreichung neuer Dokumente 09.04.2025 (Eintragungsdatum)\n\nQuantus Informatics AG\nAktiengesellschaft\nStockach\n\nAls nicht eingetragen wird bekanntgemacht:\nDie Gesellschaft hat am 08.04.2025 die Liste der Mitglieder des Aufsichtsrats vom 15.01.2024 eingereicht. Die Freigabe der Liste ist heute erfolgt."
    },
    {
      "date": "2025-04-09",
      "id": "106044",
      "original_text": "Registerbekanntmachung nach dem Umwandlungsgesetz\nBaden-Württemberg Amtsgericht Freiburg HRB 680556\nKohmann Natursteinbau GmbH – Fischerbach",
      "type": "Registerbekanntmachung nach dem Umwandlungsgesetz",
      "state": "Baden-Württemberg",
      "amtsgericht": "Amtsgericht Freiburg",
      "registernummer": "HRB 680556",
      "registerart": "HRB",
      "company_name": "Kohmann Natursteinbau GmbH",
      "company_seat": "Fischerbach",
      "details": "09.04.2025 (Bekanntmachungsdatum)\n\nBaden-Württemberg Amtsgericht Freiburg HRB 680556\nRegisterbekanntmachung nach dem Umwandlungsgesetz 09.04.2025 (Eintragungsdatum)\n\nKohmann Natursteinbau GmbH\nGesellschaft mit beschränkter Haftung\nFischerbach\n\nDen Gläubigern der an der Verschmelzung beteiligten Rechtsträger ist, wenn sie binnen sechs Monaten nach dem Tag, an dem die Eintragung der Verschmelzung in das Register des Sitzes desjenigen Rechtsträgers, dessen Gläubiger sie sind, nach § 19 Abs. 3 UmwG als bekanntgemacht gilt, ihren Anspruch nach Grund und Höhe schriftlich anmelden, Sicherheit zu leisten, soweit sie nicht Befriedigung verlangen können. Dieses Recht steht den Gläubigern jedoch nur zu, wenn sie glaubhaft machen, dass durch die Verschmelzung die Erfüllung ihrer Forderung gefährdet wird."
    },
    {
      "date": "2025-04-09",
      "id": "106045",
      "original_text": "Löschungsankündigung\nBaden-Württemberg Amtsgericht Freiburg HRB 722627\nKauzana UG (haftungsbeschränkt) – Gaienhofen",
      "type": "Löschungsankündigung",
      "state": "Baden-Württemberg",
      "amtsgericht": "Amtsgericht Freiburg",
      "registernummer": "HRB 722627",
      "registerart": "HRB",
      "company_name": "Kauzana UG (haftungsbeschränkt)",
      "company_seat": "Gaienhofen",
      "details": "09.04.2025 (Bekanntmachungsdatum)\n\nBaden-Württemberg Amtsgericht Freiburg HRB 722627\nLöschungsankündigung\n\nKauzana UG (haftungsbeschränkt)\nGesellschaft mit beschränkter Haftung\nGaienhofen\n\nDas Gericht beabsichtigt, die Gesellschaft wegen Vermögenslosigkeit im Handelsregister von Amts wegen nach § 394 FamFG zu löschen. Die Frist zur Geltendmachung eines Widerspruchs gegen die beabsichtigte Löschung ist auf einen Monat ab Veröffentlichung bestimmt."
    },
    {
      "date": "2025-04-09",
      "id": "106046",
      "original_text": "Registerbekanntmachung nach dem Umwandlungsgesetz\nBaden-Württemberg Amtsgericht Stuttgart HRB 580734\nNewMedics Medizinelektronik GmbH – Öhringen",
      "type": "Registerbekanntmachung nach dem Umwandlungsgesetz",
      "state": "Baden-Württemberg",
      "amtsgericht": "Amtsgericht Stuttgart",
      "registernummer": "HRB 580734",
      "registerart": "HRB",
      "company_name": "NewMedics Medizinelektronik GmbH",
      "company_seat": "Öhringen",
      "details": "09.04.2025 (Bekanntmachungsdatum)\n\nBaden-Württemberg Amtsgericht Stuttgart HRB 580734\nRegisterbekanntmachung nach dem Umwandlungsgesetz 09.04.2025 (Eintragungsdatum)\n\nNewMedics Medizinelektronik GmbH\nGesellschaft mit beschränkter Haftung\nÖhringen\n\nAls nicht eingetragen wird bekanntgemacht:\nDen Gläubigern der an der Verschmelzung beteiligten Rechtsträger ist, wenn sie binnen sechs Monaten nach dem Tag, an dem die Eintragung der Verschmelzung in das Register des Sitzes desjenigen Rechtsträgers, dessen Gläubiger sie sind, nach § 19 Abs. 3 UmwG als bekanntgemacht gilt, ihren Anspruch nach Grund und Höhe schriftlich anmelden, Sicherheit zu leisten, soweit sie nicht Befriedigung verlangen können. Dieses Recht steht den Gläubigern jedoch nur zu, wenn sie glaubhaft machen, dass durch die Verschmelzung die Erfüllung ihrer Forderung gefährdet wird."
    },
    {
      "date": "2025-04-09",
      "id": "106047",
      "original_text": "Löschungsankündigung\nMecklenburg-Vorpommern Amtsgericht Schwerin HRB 14676\nSP Getränke-Liefer-Service UG (haftungsbeschränkt) – Schwerin",
      "type": "Löschungsankündigung",
      "state": "Mecklenburg-Vorpommern",
      "amtsgericht": "Amtsgericht Schwerin",
      "registernummer": "HRB 14676",
      "registerart": "HRB",
      "company_name": "SP Getränke-Liefer-Service UG (haftungsbeschränkt)",
      "company_seat": "Schwerin",
      "details": "09.04.2025 (Bekanntmachungsdatum)\n\nMecklenburg-Vorpommern Amtsgericht Schwerin HRB 14676\nLöschungsankündigung\n\nSP Getränke-Liefer-Service UG (haftungsbeschränkt)\nGesellschaft mit beschränkter Haftung\nSchwerin\n\nDas Registergericht beabsichtigt, die im Handelsregister eingetragene Gesellschaft von Amts wegen nach § 394 FamFG zu löschen. Die Frist zur Erhebung eines Widerspruchs gegen die beabsichtigte Löschung wird auf 1 Monat festgesetzt."
    },
    {
      "date": "2025-04-09",
      "id": "106048",
      "original_text": "Registerbekanntmachung nach dem Umwandlungsgesetz\nBaden-Württemberg Amtsgericht Stuttgart HRA 12704\nLandesbank Baden-Württemberg – Stuttgart",
      "type": "Registerbekanntmachung nach dem Umwandlungsgesetz",
      "state": "Baden-Württemberg",
      "amtsgericht": "Amtsgericht Stuttgart",
      "registernummer": "HRA 12704",
      "registerart": "HRA",
      "company_name": "Landesbank Baden-Württemberg",
      "company_seat": "Stuttgart",
      "details": "09.04.2025 (Bekanntmachungsdatum)\n\nBaden-Württemberg Amtsgericht Stuttgart HRA 12704\nRegisterbekanntmachung nach dem Umwandlungsgesetz\n\nLandesbank Baden-Württemberg\nSonstige juristische Person\nStuttgart\n\nGem. §§ 125 Absatz 1 Satz 1, 61 Satz 2 UmwG i.V.m. § 1 Absatz 5 und 6 Gesetz über die Landesbank Baden-Württemberg (LBWG) sowie höchstvorsorglich gem. §§ 125 Absatz 1 Satz 1, 62 Absatz 3 Satz 2 i.V.m. § 61 Satz 2 UmwG i.V.m. § 1 Absatz 5 und 6 LBWG wird bekanntgemacht:\nDie Gesellschaft hat am 07.04.2025 den Entwurf des Abspaltungs- und Übernahmevertrags zwischen der \"Berlin Hyp AG\", Berlin (Amtsgericht Charlottenburg HRB 56530 B) und der hiesigen Gesellschaft (übernehmender Rechtsträger) zum Handelsregister eingereicht."
    },
    {
      "date": "2025-04-09",
      "id": "106049",
      "original_text": "Löschungsankündigung\nBerlin Amtsgericht Berlin (Charlottenburg) HRB 217574\nPLATINUM Baugesellschaft mbH – Berlin",
      "type": "Löschungsankündigung",
      "state": "Berlin",
      "amtsgericht": "Amtsgericht Berlin (Charlottenburg)",
      "registernummer": "HRB 217574",
      "registerart": "HRB",
      "company_name": "PLATINUM Baugesellschaft mbH",
      "company_seat": "Berlin",
      "details": "09.04.2025 (Bekanntmachungsdatum)\n\nBerlin Amtsgericht Berlin (Charlottenburg) HRB 217574\nLöschungsankündigung\n\nPLATINUM Baugesellschaft mbH\nGesellschaft mit beschränkter Haftung\nBerlin\n\nBei der nachstehenden Gesellschaft wird das Amtslöschungsverfahren gemäß § 394 FamFG eingeleitet. Widerspruchsfrist 6 Wochen"
    },
    {
      "date": "2025-04-09",
      "id": "106050",
      "original_text": "Löschungsankündigung\nBrandenburg Amtsgericht Frankfurt/Oder HRB 15311\nNewhome Logistics GmbH – Frankfurt (Oder)",
      "type": "Löschungsankündigung",
      "state": "Brandenburg",
      "amtsgericht": "Amtsgericht Frankfurt/Oder",
      "registernummer": "HRB 15311",
      "registerart": "HRB",
      "company_name": "Newhome Logistics GmbH",
      "company_seat": "Frankfurt (Oder)",
      "details": "09.04.2025 (Bekanntmachungsdatum)\n\nBrandenburg Amtsgericht Frankfurt/Oder HRB 15311\nLöschungsankündigung\n\nNewhome Logistics GmbH\nGesellschaft mit beschränkter Haftung\nFrankfurt (Oder)\n\nBei der nachstehenden Gesellschaft wird das Amtslöschungsverfahren gemäß § 394 FamFG eingeleitet."
    },
    {
      "date": "2025-04-09",
      "id": "106051",
      "original_text": "Registerbekanntmachung nach dem Umwandlungsgesetz\nSchleswig-Holstein Amtsgericht Kiel HRB 20565\nOldenburg Holding GmbH – Kiel",
      "type": "Registerbekanntmachung nach dem Umwandlungsgesetz",
      "state": "Schleswig-Holstein",
      "amtsgericht": "Amtsgericht Kiel",
      "registernummer": "HRB 20565",
      "registerart": "HRB",
      "company_name": "Oldenburg Holding GmbH",
      "company_seat": "Kiel",
      "details": "09.04.2025 (Bekanntmachungsdatum)\n\nSchleswig-Holstein Amtsgericht Kiel HRB 20565\nRegisterbekanntmachung nach dem Umwandlungsgesetz 04.04.2025 (Eintragungsdatum)\n\nOldenburg Holding GmbH\nGesellschaft mit beschränkter Haftung\nKiel\n\nZu Eintragungsnummer 4 vom 04.04.2025 wird als nicht eingetragen veröffentlicht: Als nicht eingetragen wird veröffentlicht: Den Gläubigern der an der Verschmelzung beteiligten Rechtsträger ist, wenn sie binnen sechs Monaten nach dem Tag, an dem die Eintragung der Verschmelzung in das Register des Sitzes desjenigen Rechtsträgers, dessen Gläubiger sie sind, nach § 19 Abs. 3 UmwG bekannt gemacht worden ist, ihren Anspruch nach Grund und Höhe schriftlich anmelden, Sicherheit zu leisten, soweit sie nicht Befriedigung verlangen können. Dieses Recht steht den Gläubigern jedoch nur zu, wenn sie glaubhaft machen, dass durch die Verschmelzung die Erfüllung ihrer Forderung gefährdet wird."
    },
    {
      "date": "2025-04-09",
      "id": "106052",
      "original_text": "Einreichung neuer Dokumente\nBerlin Amtsgericht Berlin (Charlottenburg) HRB 154517\nAxel Springer SE – Berlin",
      "type": "Einreichung neuer Dokumente",
      "state": "Berlin",
      "amtsgericht": "Amtsgericht Berlin (Charlottenburg)",
      "registernummer": "HRB 154517",
      "registerart": "HRB",
      "company_name": "Axel Springer SE",
      "company_seat": "Berlin",
      "details": "09.04.2025 (Bekanntmachungsdatum)\n\nBerlin Amtsgericht Berlin (Charlottenburg) HRB 154517\nEinreichung neuer Dokumente\n\nAxel Springer SE\nEuropäische Aktiengesellschaft (SE)\nBerlin\n\nAls nicht eingetragen wird veröffentlicht: Es wurde eine neue Liste der Aufsichtsratsmitglieder eingereicht (§ 106 AktG)."
    },
    {
      "date": "2025-04-09",
      "id": "106053",
      "original_text": "Löschungsankündigung\nBrandenburg Amtsgericht Potsdam HRB 23515\nAQUILA Aviation Vertriebs GmbH – Trebbin",
      "type": "Löschungsankündigung",
      "state": "Brandenburg",
      "amtsgericht": "Amtsgericht Potsdam",
      "registernummer": "HRB 23515",
      "registerart": "HRB",
      "company_name": "AQUILA Aviation Vertriebs GmbH",
      "company_seat": "Trebbin",
      "details": "09.04.2025 (Bekanntmachungsdatum)\n\nBrandenburg Amtsgericht Potsdam HRB 23515\nLöschungsankündigung\n\nAQUILA Aviation Vertriebs GmbH\nGesellschaft mit beschränkter Haftung\nTrebbin\n\nBei der nachstehenden Gesellschaft wird das Amtslöschungsverfahren gemäß § 394 FamFG eingeleitet. Widerspruchsfrist 8 Wochen."
    },
    {
      "date": "2025-04-09",
      "id": "106054",
      "original_text": "Einreichung neuer Dokumente\nBerlin Amtsgericht Berlin (Charlottenburg) HRB 213510\nMySecondEar Audiology Group GmbH – Berlin",
      "type": "Einreichung neuer Dokumente",
      "state": "Berlin",
      "amtsgericht": "Amtsgericht Berlin (Charlottenburg)",
      "registernummer": "HRB 213510",
      "registerart": "HRB",
      "company_name": "MySecondEar Audiology Group GmbH",
      "company_seat": "Berlin",
      "details": "09.04.2025 (Bekanntmachungsdatum)\n\nBerlin Amtsgericht Berlin (Charlottenburg) HRB 213510\nEinreichung neuer Dokumente\n\nMySecondEar Audiology Group GmbH\nGesellschaft mit beschränkter Haftung\nBerlin\n\nAls nicht eingetragen wird veröffentlicht: Es wurde eine neue Liste der Beiratsmitglieder eingereicht (§52 GmbHG)."
    },
    {
      "date": "2025-04-09",
      "id": "106055",
      "original_text": "Löschungsankündigung\nThüringen Amtsgericht Jena HRB 106617\nTAB Anlagenbau GmbH – Ohrdruf",
      "type": "Löschungsankündigung",
      "state": "Thüringen",
      "amtsgericht": "Amtsgericht Jena",
      "registernummer": "HRB 106617",
      "registerart": "HRB",
      "company_name": "TAB Anlagenbau GmbH",
      "company_seat": "Ohrdruf",
      "details": "09.04.2025 (Bekanntmachungsdatum)\n\nThüringen Amtsgericht Jena HRB 106617\nLöschungsankündigung\n\nTAB Anlagenbau GmbH\nGesellschaft mit beschränkter Haftung\nOhrdruf\n\nDas Registergericht beabsichtigt, die im Handelsregister eingetragene Gesellschaft wegen Vermögenslosigkeit nach § 394 FamFG von Amts wegen zu löschen. Die Frist zur Erhebung eines Widerspruchs gegen die beabsichtigte Löschung wird auf 6 Wochen festgesetzt."
    },
    {
      "date": "2025-04-09",
      "id": "106056",
      "original_text": "Löschungsankündigung\nThüringen Amtsgericht Jena HRB 516207\nwepe concept UG (haftungsbeschränkt) – Gera",
      "type": "Löschungsankündigung",
      "state": "Thüringen",
      "amtsgericht": "Amtsgericht Jena",
      "registernummer": "HRB 516207",
      "registerart": "HRB",
      "company_name": "wepe concept UG (haftungsbeschränkt)",
      "company_seat": "Gera",
      "details": "09.04.2025 (Bekanntmachungsdatum)\n\nThüringen Amtsgericht Jena HRB 516207\nLöschungsankündigung\n\nwepe concept UG (haftungsbeschränkt)\nGesellschaft mit beschränkter Haftung\nGera\n\nDas Registergericht beabsichtigt, die im Handelsregister eingetragene Gesellschaft wegen Vermögenslosigkeit nach § 394 FamFG von Amts wegen zu löschen. Die Frist zur Erhebung eines Widerspruchs gegen die beabsichtigte Löschung wird auf 6 Wochen festgesetzt."
    },
    {
      "date": "2025-04-09",
      "id": "106057",
      "original_text": "Löschungsankündigung\nBerlin Amtsgericht Berlin (Charlottenburg) HRB 160132\nHiller Plus GmbH – Berlin",
      "type": "Löschungsankündigung",
      "state": "Berlin",
      "amtsgericht": "Amtsgericht Berlin (Charlottenburg)",
      "registernummer": "HRB 160132",
      "registerart": "HRB",
      "company_name": "Hiller Plus GmbH",
      "company_seat": "Berlin",
      "details": "09.04.2025 (Bekanntmachungsdatum)\n\nBerlin Amtsgericht Berlin (Charlottenburg) HRB 160132\nLöschungsankündigung\n\nHiller Plus GmbH\nGesellschaft mit beschränkter Haftung\nBerlin\n\nBei der nachstehenden Gesellschaft wird das Amtslöschungsverfahren gemäß § 394 FamFG eingeleitet. Widerspruchsfrist 6 Wochen"
    },
    {
      "date": "2025-04-09",
      "id": "106058",
      "original_text": "Registerbekanntmachung nach dem Umwandlungsgesetz\nHamburg Amtsgericht Hamburg HRB 79425\nCAPILLUS Hair Shop GmbH – Hamburg",
      "type": "Registerbekanntmachung nach dem Umwandlungsgesetz",
      "state": "Hamburg",
      "amtsgericht": "Amtsgericht Hamburg",
      "registernummer": "HRB 79425",
      "registerart": "HRB",
      "company_name": "CAPILLUS Hair Shop GmbH",
      "company_seat": "Hamburg",
      "details": "09.04.2025 (Bekanntmachungsdatum)\n\nHamburg Amtsgericht Hamburg HRB 79425\nRegisterbekanntmachung nach dem Umwandlungsgesetz 09.04.2025 (Eintragungsdatum)\n\nCAPILLUS Hair Shop GmbH\nGesellschaft mit beschränkter Haftung\nHamburg\n\nAls nicht eingetragen wird bekannt gemacht:\nDen Gläubigern der an der Verschmelzung beteiligten Gesellschaften ist, wenn sie binnen sechs Monaten nach dem Tag, an dem die Eintragung der Verschmelzung in das Register des Sitzes desjenigen Rechtsträgers, dessen Gläubiger sie sind, nach § 19 Absatz 3 UmwG als bekannt gemacht gilt, ihren Anspruch nach Grund und Höhe schriftlich anmelden, Sicherheit zu leisten, soweit sie nicht Befriedigung verlangen können. Dieses Recht steht den Gläubigern jedoch nur zu, wenn sie glaubhaft machen, dass durch die Verschmelzung die Erfüllung ihrer Forderung gefährdet wird."
    },
    {
      "date": "2025-04-09",
      "id": "106059",
      "original_text": "Löschungsankündigung\nBerlin Amtsgericht Berlin (Charlottenburg) HRA 57501\nFinTech Industry Acquisition Team AG & Co. KG – Berlin",
      "type": "Löschungsankündigung",
      "state": "Berlin",
      "amtsgericht": "Amtsgericht Berlin (Charlottenburg)",
      "registernummer": "HRA 57501",
      "registerart": "HRA",
      "company_name": "FinTech Industry Acquisition Team AG & Co. KG",
      "company_seat": "Berlin",
      "details": "09.04.2025 (Bekanntmachungsdatum)\n\nBerlin Amtsgericht Berlin (Charlottenburg) HRA 57501\nLöschungsankündigung\n\nFinTech Industry Acquisition Team AG & Co. KG\nKommanditgesellschaft\nBerlin\n\nBei dem nachstehenden Unternehmen / der nachstehenden Gesellschaft wird das Amtslöschungsverfahren gemäß § 31 Abs. 2 HGB eingeleitet. Widerspruchsfrist 1 Monat"
    },
    {
      "date": "2025-04-09",
      "id": "106060",
      "original_text": "Einreichung neuer Dokumente\nBerlin Amtsgericht Berlin (Charlottenburg) HRB 274019\nMähren Holding GmbH – Berlin",
      "type": "Einreichung neuer Dokumente",
      "state": "Berlin",
      "amtsgericht": "Amtsgericht Berlin (Charlottenburg)",
      "registernummer": "HRB 274019",
      "registerart": "HRB",
      "company_name": "Mähren Holding GmbH",
      "company_seat": "Berlin",
      "details": "09.04.2025 (Bekanntmachungsdatum)\n\nBerlin Amtsgericht Berlin (Charlottenburg) HRB 274019\nEinreichung neuer Dokumente\n\nMähren Holding GmbH\nGesellschaft mit beschränkter Haftung\nBerlin\n\nDen Gläubigern ist, wenn sie binnen sechs Monaten nach dem Tag, an dem die Eintragung der Umwandlung als bekannt gemacht gilt, ihren Anspruch nach Grund und Höhe schriftlich anmelden, Sicherheit zu leisten, soweit sie nicht Befriedigung verlangen können. Dieses Recht steht den Gläubigern jedoch nur zu, wenn sie glaubhaft machen, dass durch die Umwandlung die Erfüllung ihrer Forderung gefährdet wird. Das Recht, Sicherheitsleistung zu verlangen, steht Gläubigern nicht zu, die im Falle der Insolvenz ein Recht auf vorzugsweise Befriedigung aus einer Deckungsmasse haben, die nach gesetzlicher Vorschrift zu ihrem Schutz errichtet und staatlich überwacht ist."
    },
    {
      "date": "2025-04-09",
      "id": "106061",
      "original_text": "Löschungsankündigung\nBerlin Amtsgericht Berlin (Charlottenburg) HRB 203564\nKodama Technologies GmbH – Berlin",
      "type": "Löschungsankündigung",
      "state": "Berlin",
      "amtsgericht": "Amtsgericht Berlin (Charlottenburg)",
      "registernummer": "HRB 203564",
      "registerart": "HRB",
      "company_name": "Kodama Technologies GmbH",
      "company_seat": "Berlin",
      "details": "09.04.2025 (Bekanntmachungsdatum)\n\nBerlin Amtsgericht Berlin (Charlottenburg) HRB 203564\nLöschungsankündigung\n\nKodama Technologies GmbH\nGesellschaft mit beschränkter Haftung\nBerlin\n\nBei der nachstehenden Gesellschaft wird das Amtslöschungsverfahren gemäß § 394 FamFG eingeleitet. Widerspruchsfrist 6 Wochen"
    },
    {
      "date": "2025-04-09",
      "id": "106062",
      "original_text": "Löschungsankündigung\nBerlin Amtsgericht Berlin (Charlottenburg) HRB 219570\nEmre Bau UG (haftungsbeschränkt) – Berlin",
      "type": "Löschungsankündigung",
      "state": "Berlin",
      "amtsgericht": "Amtsgericht Berlin (Charlottenburg)",
      "registernummer": "HRB 219570",
      "registerart": "HRB",
      "company_name": "Emre Bau UG (haftungsbeschränkt)",
      "company_seat": "Berlin",
      "details": "09.04.2025 (Bekanntmachungsdatum)\n\nBerlin Amtsgericht Berlin (Charlottenburg) HRB 219570\nLöschungsankündigung\n\nEmre Bau UG (haftungsbeschränkt)\nGesellschaft mit beschränkter Haftung\nBerlin\n\nBei der nachstehenden Gesellschaft wird das Amtslöschungsverfahren gemäß § 394 FamFG eingeleitet. Widerspruchsfrist 6 Wochen"
    },
    {
      "date": "2025-04-09",
      "id": "106063",
      "original_text": "Löschungsankündigung\nBerlin Amtsgericht Berlin (Charlottenburg) HRB 224584\nLKW LOZE GmbH – Berlin",
      "type": "Löschungsankündigung",
      "state": "Berlin",
      "amtsgericht": "Amtsgericht Berlin (Charlottenburg)",
      "registernummer": "HRB 224584",
      "registerart": "HRB",
      "company_name": "LKW LOZE GmbH",
      "company_seat": "Berlin",
      "details": "09.04.2025 (Bekanntmachungsdatum)\n\nBerlin Amtsgericht Berlin (Charlottenburg) HRB 224584\nLöschungsankündigung\n\nLKW LOZE GmbH\nGesellschaft mit beschränkter Haftung\nBerlin\n\nBei der nachstehenden Gesellschaft wird das Amtslöschungsverfahren gemäß § 394 FamFG eingeleitet. Widerspruchsfrist 6 Wochen"
    },
    {
      "date": "2025-04-09",
      "id": "106064",
      "original_text": "Löschungsankündigung\nBerlin Amtsgericht Berlin (Charlottenburg) HRB 230579\nToms Ozols Service UG (haftungsbeschränkt) – Berlin",
      "type": "Löschungsankündigung",
      "state": "Berlin",
      "amtsgericht": "Amtsgericht Berlin (Charlottenburg)",
      "registernummer": "HRB 230579",
      "registerart": "HRB",
      "company_name": "Toms Ozols Service UG (haftungsbeschränkt)",
      "company_seat": "Berlin",
      "details": "09.04.2025 (Bekanntmachungsdatum)\n\nBerlin Amtsgericht Berlin (Charlottenburg) HRB 230579\nLöschungsankündigung\n\nToms Ozols Service UG (haftungsbeschränkt)\nGesellschaft mit beschränkter Haftung\nBerlin\n\nBei der nachstehenden Gesellschaft wird das Amtslöschungsverfahren gemäß § 394 FamFG eingeleitet. Widerspruchsfrist 6 Wochen"
    },
    {
      "date": "2025-04-09",
      "id": "106065",
      "original_text": "Löschungsankündigung\nBaden-Württemberg Amtsgericht Freiburg HRB 726372\nKabashi Baudienstleistungen UG (haftungsbeschränkt) – Kleines Wiesental",
      "type": "Löschungsankündigung",
      "state": "Baden-Württemberg",
      "amtsgericht": "Amtsgericht Freiburg",
      "registernummer": "HRB 726372",
      "registerart": "HRB",
      "company_name": "Kabashi Baudienstleistungen UG (haftungsbeschränkt)",
      "company_seat": "Kleines Wiesental",
      "details": "09.04.2025 (Bekanntmachungsdatum)\n\nBaden-Württemberg Amtsgericht Freiburg HRB 726372\nLöschungsankündigung\n\nKabashi Baudienstleistungen UG (haftungsbeschränkt)\nGesellschaft mit beschränkter Haftung\nKleines Wiesental\n\nDas Gericht beabsichtigt, die Gesellschaft wegen Vermögenslosigkeit im Handelsregister von Amts wegen nach § 394 FamFG zu löschen. Die Frist zur Geltendmachung eines Widerspruchs gegen die beabsichtigte Löschung ist auf einen Monat ab Veröffentlichung bestimmt."
    },
    {
      "date": "2025-04-09",
      "id": "106066",
      "original_text": "Registerbekanntmachung nach dem Umwandlungsgesetz\nNordrhein-Westfalen Amtsgericht Coesfeld HRB 15272\nSchlossgarage Dumpe GmbH – Nordkirchen",
      "type": "Registerbekanntmachung nach dem Umwandlungsgesetz",
      "state": "Nordrhein-Westfalen",
      "amtsgericht": "Amtsgericht Coesfeld",
      "registernummer": "HRB 15272",
      "registerart": "HRB",
      "company_name": "Schlossgarage Dumpe GmbH",
      "company_seat": "Nordkirchen",
      "details": "09.04.2025 (Bekanntmachungsdatum)\n\nNordrhein-Westfalen Amtsgericht Coesfeld HRB 15272\nRegisterbekanntmachung nach dem Umwandlungsgesetz 09.04.2025 (Eintragungsdatum)\n\nSchlossgarage Dumpe GmbH\nGesellschaft mit beschränkter Haftung\nNordkirchen\n\nDen Gläubigern der an der Verschmelzung beteiligten Rechtsträger ist, wenn sie binnen sechs Monaten nach dem Tag, an dem die Eintragung der Verschmelzung in das Register des Sitzes derjenigen Rechtsträger deren Gläubiger sie sind, nach § 19 Absatz 3 UmwG als bekanntgemacht gilt, ihren Anspruch nach Grund und Höhe schriftlich anmelden, Sicherheit zu leisten, soweit sie nicht Befriedigung verlangen können. Dieses Recht steht den Gläubigern jedoch nur zu, wenn sie glaubhaft machen, dass durch die Verschmelzung die Erfüllung ihrer Forderung gefährdet wird."
    },
    {
      "date": "2025-04-09",
      "id": "106067",
      "original_text": "Löschungsankündigung\nSaarland Amtsgericht Saarbrücken HRB 104459\nK + S Services GmbH – Saarbrücken",
      "type": "Löschungsankündigung",
      "state": "Saarland",
      "amtsgericht": "Amtsgericht Saarbrücken",
      "registernummer": "HRB 104459",
      "registerart": "HRB",
      "company_name": "K + S Services GmbH",
      "company_seat": "Saarbrücken",
      "details": "09.04.2025 (Bekanntmachungsdatum)\n\nSaarland Amtsgericht Saarbrücken HRB 104459\nLöschungsankündigung 07.04.2025 (Eintragungsdatum)\n\nK + S Services GmbH\nGesellschaft mit beschränkter Haftung\nSaarbrücken\n\nEs ist beabsichtigt, die Gesellschaft von Amts wegen gemäß § 394 FamFG wegen Vermögenslosigkeit zu löschen. Gegen die Löschung von Amts wegen ist das Rechtsmittel des Widerspruchs statthaft. Der Widerspruch ist binnen einer Frist von 2 Monaten beginnend mit dem Tag dieser Veröffentlichung durch Einreichen eines Widerspruchsschreibens -schriftlich oder zur Niederschrift der Geschäftsstelle- beim Amtsgericht Saarbrücken, -zentrales Handelsregister-, Mainzerstr.178, 66121 Saarbrücken einzulegen. Der Widerspruch muss die Bezeichnung der angefochtenen Löschungsankündigung enthalten sowie die Erklärung, dass Widerspruch eingelegt wird. Er ist vom Widerspruchsführer oder seinem Bevollmächtigten zu unterzeichnen."
    },
    {
      "date": "2025-04-09",
      "id": "106068",
      "original_text": "Einreichung neuer Dokumente\nSaarland Amtsgericht Saarbrücken HRB 5356\nSaarländische Kapitalbeteiligungsgesellschaft mit beschränkter Haftung – Saarbrücken",
      "type": "Einreichung neuer Dokumente",
      "state": "Saarland",
      "amtsgericht": "Amtsgericht Saarbrücken",
      "registernummer": "HRB 5356",
      "registerart": "HRB",
      "company_name": "Saarländische Kapitalbeteiligungsgesellschaft mit beschränkter Haftung",
      "company_seat": "Saarbrücken",
      "details": "09.04.2025 (Bekanntmachungsdatum)\n\nSaarland Amtsgericht Saarbrücken HRB 5356\nEinreichung neuer Dokumente\n\nSaarländische Kapitalbeteiligungsgesellschaft mit beschränkter Haftung\nGesellschaft mit beschränkter Haftung\nSaarbrücken\n\nDie Geschäftsführung der Gesellschaft hat eine Liste der Mitglieder des Aufsichtsrats zum Handelsregister eingereicht (§ 52 Abs. 3 Satz 2 GmbHG)."
    },
    {
      "date": "2025-04-09",
      "id": "106069",
      "original_text": "Einreichung neuer Dokumente\nSaarland Amtsgericht Saarbrücken HRB 5356\nSaarländische Kapitalbeteiligungsgesellschaft mit beschränkter Haftung – Saarbrücken",
      "type": "Einreichung neuer Dokumente",
      "state": "Saarland",
      "amtsgericht": "Amtsgericht Saarbrücken",
      "registernummer": "HRB 5356",
      "registerart": "HRB",
      "company_name": "Saarländische Kapitalbeteiligungsgesellschaft mit beschränkter Haftung",
      "company_seat": "Saarbrücken",
      "details": "09.04.2025 (Bekanntmachungsdatum)\n\nSaarland Amtsgericht Saarbrücken HRB 5356\nEinreichung neuer Dokumente 07.04.2025 (Eintragungsdatum)\n\nSaarländische Kapitalbeteiligungsgesellschaft mit beschränkter Haftung\nGesellschaft mit beschränkter Haftung\nSaarbrücken\n\nDie Geschäftsführung der Gesellschaft hat eine Liste der Mitglieder des Aufsichtsrats zum Handelsregister eingereicht (§ 52 Abs. 3 Satz 2 GmbHG)."
    },
    {
      "date": "2025-04-09",
      "id": "106070",
      "original_text": "Registerbekanntmachung nach dem Umwandlungsgesetz\nSaarland Amtsgericht Saarbrücken HRB 109161\nACIES Capital Germany GmbH – Saarbrücken",
      "type": "Registerbekanntmachung nach dem Umwandlungsgesetz",
      "state": "Saarland",
      "amtsgericht": "Amtsgericht Saarbrücken",
      "registernummer": "HRB 109161",
      "registerart": "HRB",
      "company_name": "ACIES Capital Germany GmbH",
      "company_seat": "Saarbrücken",
      "details": "09.04.2025 (Bekanntmachungsdatum)\n\nSaarland Amtsgericht Saarbrücken HRB 109161\nRegisterbekanntmachung nach dem Umwandlungsgesetz 09.04.2025 (Eintragungsdatum)\n\nACIES Capital Germany GmbH\nGesellschaft mit beschränkter Haftung\nSaarbrücken\n\nAls nicht eingetragen wird bekannt gemacht: Den Gläubigern der an der Verschmelzung beteiligten Gesellschaften ist, wenn sie binnen sechs Monaten nach dem Tag, an dem die Eintragung der Verschmelzung in das Register des Sitzes desjenigen Rechtsträgers, dessen Gläubiger sie sind, nach § 19 Absatz 3 UmwG bekannt gemacht worden ist, ihren Anspruch nach Grund und Höhe schriftlich anmelden, Sicherheit zu leisten, soweit sie nicht Befriedigung verlangen können. Dieses Recht steht den Gläubigern jedoch nur zu, wenn sie glaubhaft machen, dass durch die Verschmelzung die Erfüllung ihrer Forderung gefährdet wird."
    },
    {
      "date": "2025-04-09",
      "id": "106071",
      "original_text": "Registerbekanntmachung nach dem Umwandlungsgesetz\nSaarland Amtsgericht Saarbrücken HRB 109024\nACIES Capital International GmbH – Saarbrücken",
      "type": "Registerbekanntmachung nach dem Umwandlungsgesetz",
      "state": "Saarland",
      "amtsgericht": "Amtsgericht Saarbrücken",
      "registernummer": "HRB 109024",
      "registerart": "HRB",
      "company_name": "ACIES Capital International GmbH",
      "company_seat": "Saarbrücken",
      "details": "09.04.2025 (Bekanntmachungsdatum)\n\nSaarland Amtsgericht Saarbrücken HRB 109024\nRegisterbekanntmachung nach dem Umwandlungsgesetz 09.04.2025 (Eintragungsdatum)\n\nACIES Capital International GmbH\nGesellschaft mit beschränkter Haftung\nSaarbrücken\n\nAls nicht eingetragen wird bekannt gemacht: Den Gläubigern der an der Verschmelzung beteiligten Gesellschaften ist, wenn sie binnen sechs Monaten nach dem Tag, an dem die Eintragung der Verschmelzung in das Register des Sitzes desjenigen Rechtsträgers, dessen Gläubiger sie sind, nach § 19 Absatz 3 UmwG bekannt gemacht worden ist, ihren Anspruch nach Grund und Höhe schriftlich anmelden, Sicherheit zu leisten, soweit sie nicht Befriedigung verlangen können. Dieses Recht steht den Gläubigern jedoch nur zu, wenn sie glaubhaft machen, dass durch die Verschmelzung die Erfüllung ihrer Forderung gefährdet wird."
    },
    {
      "date": "2025-04-09",
      "id": "106072",
      "original_text": "Registerbekanntmachung nach dem Umwandlungsgesetz\nBaden-Württemberg Amtsgericht Mannheim HRA 104440\nLandesbank Baden-Württemberg – Karlsruhe",
      "type": "Registerbekanntmachung nach dem Umwandlungsgesetz",
      "state": "Baden-Württemberg",
      "amtsgericht": "Amtsgericht Mannheim",
      "registernummer": "HRA 104440",
      "registerart": "HRA",
      "company_name": "Landesbank Baden-Württemberg",
      "company_seat": "Karlsruhe",
      "details": "09.04.2025 (Bekanntmachungsdatum)\n\nBaden-Württemberg Amtsgericht Mannheim HRA 104440\nRegisterbekanntmachung nach dem Umwandlungsgesetz\n\nLandesbank Baden-Württemberg\nSonstige juristische Person\nKarlsruhe\n\nDie Gesellschaft hat am 07.04.2025 gemäß §§ 125 Absatz 1 Satz 1, 61 Satz 2 UmwG i.V.m. § 1 Absatz 5 und 6 Gesetz über die Landesbank Baden-Württemberg (LBWG) sowie höchstvorsorglich gemäß §§ 125 Absatz 1 Satz 1, 62 Absatz 3 Satz 2 i.V.m. § 61 Satz 2 UmwG i.V.m.§ 1 Absatz 5 und 6 LBWG den Entwurf eines Abspaltungs- und Übernahmevertrags zwischen der Berlin Hyp AG mit Sitz in Berlin (Amtsgericht Charlottenburg HRB 56530 B) und der hiesigen Gesellschaft (übernehmender Rechtsträger) zum Handelsregister eingereicht."
    },
    {
      "date": "2025-04-09",
      "id": "106073",
      "original_text": "Löschungsankündigung\nHessen Amtsgericht Gießen HRB 10623\nmon-us GmbH – Gießen",
      "type": "Löschungsankündigung",
      "state": "Hessen",
      "amtsgericht": "Amtsgericht Gießen",
      "registernummer": "HRB 10623",
      "registerart": "HRB",
      "company_name": "mon-us GmbH",
      "company_seat": "Gießen",
      "details": "09.04.2025 (Bekanntmachungsdatum)\n\nHessen Amtsgericht Gießen HRB 10623\nLöschungsankündigung\n\nmon-us GmbH\nGesellschaft mit beschränkter Haftung\nGießen\n\nAuf Antrag des zuständigen Finanzamts Gießen ist beabsichtigt, die Gesellschaft wegen Vermögenslosigkeit gemäß § 394 FamFG von Amts wegen zu löschen. Hiergegen kann innerhalb von drei Monaten nach dieser Veröffentlichung Widerspruch beim Amtsgericht Gießen eingelegt werden. Sollte Widerspruch eingelegt werden, dürfte dies nur mit Begründung erfolgversprechend sein. Insbesondere sollte vorhandenes Vermögen der Gesellschaft innerhalb der genannten Frist nachgewiesen werden."
    },
    {
      "date": "2025-04-09",
      "id": "106074",
      "original_text": "Registerbekanntmachung nach dem Umwandlungsgesetz\nHessen Amtsgericht Friedberg HRB 6095\nHAGEN Batterie GmbH – Büdingen",
      "type": "Registerbekanntmachung nach dem Umwandlungsgesetz",
      "state": "Hessen",
      "amtsgericht": "Amtsgericht Friedberg",
      "registernummer": "HRB 6095",
      "registerart": "HRB",
      "company_name": "HAGEN Batterie GmbH",
      "company_seat": "Büdingen",
      "details": "09.04.2025 (Bekanntmachungsdatum)\n\nHessen Amtsgericht Friedberg HRB 6095\nRegisterbekanntmachung nach dem Umwandlungsgesetz 09.04.2025 (Eintragungsdatum)\n\nHAGEN Batterie GmbH\nGesellschaft mit beschränkter Haftung\nBüdingen\n\nDen Gläubigern der an der formwechselnden Umwandlung beteiligten Rechtsträger ist, wenn sie binnen sechs Monaten nach dem Tag, an dem die Eintragung der formwechselnden Umwandlung in das Register des Sitzes desjenigen Rechtsträgers, dessen Gläubiger sie sind, nach § 201 UmwG bekannt gemacht worden ist, ihren Anspruch nach Grund und Höhe schriftlich anmelden, Sicherheit zu leisten, soweit sie nicht Befriedigung verlangen können. Dieses Recht steht den Gläubigern jedoch nur zu, wenn sie glaubhaft machen, dass durch die formwechselnden Umwandlung die Erfüllung ihrer Forderung gefährdet wird."
    },
    {
      "date": "2025-04-09",
      "id": "106075",
      "original_text": "Einreichung neuer Dokumente\nHessen Amtsgericht Frankfurt am Main HRB 103516\nflatexDEGIRO AG – Frankfurt am Main",
      "type": "Einreichung neuer Dokumente",
      "state": "Hessen",
      "amtsgericht": "Amtsgericht Frankfurt am Main",
      "registernummer": "HRB 103516",
      "registerart": "HRB",
      "company_name": "flatexDEGIRO AG",
      "company_seat": "Frankfurt am Main",
      "details": "09.04.2025 (Bekanntmachungsdatum)\n\nHessen Amtsgericht Frankfurt am Main HRB 103516\nEinreichung neuer Dokumente 09.04.2025 (Eintragungsdatum)\n\nflatexDEGIRO AG\nAktiengesellschaft\nFrankfurt am Main\n\nDurch eine Änderung in den Personen der Aufsichtsratsmitglieder ist eine Liste der Mitglieder des Aufsichtsrates zum Handelsregister eingereicht worden."
    },
    {
      "date": "2025-04-09",
      "id": "106076",
      "original_text": "Löschungsankündigung\nHessen Amtsgericht Friedberg HRB 9454\nFriseur Lounge Fönix UG (haftungsbeschränkt) – Bad Nauheim",
      "type": "Löschungsankündigung",
      "state": "Hessen",
      "amtsgericht": "Amtsgericht Friedberg",
      "registernummer": "HRB 9454",
      "registerart": "HRB",
      "company_name": "Friseur Lounge Fönix UG (haftungsbeschränkt)",
      "company_seat": "Bad Nauheim",
      "details": "09.04.2025 (Bekanntmachungsdatum)\n\nHessen Amtsgericht Friedberg HRB 9454\nLöschungsankündigung 09.04.2025 (Eintragungsdatum)\n\nFriseur Lounge Fönix UG (haftungsbeschränkt)\nGesellschaft mit beschränkter Haftung\nBad Nauheim\n\nDas Registergericht beabsichtigt die im Handelsregister eingetragene Gesellschaft von Amts wegen nach § 394 FamFG zu löschen. Die Frist zur Erhebung eines Widerspruchs gegen die beabsichtigte Löschung wird auf 3 Monate festgesetzt."
    },
    {
      "date": "2025-04-09",
      "id": "106077",
      "original_text": "Löschungsankündigung\nHessen Amtsgericht Offenbach am Main HRB 50393\nTUNA GmbH – Offenbach am Main",
      "type": "Löschungsankündigung",
      "state": "Hessen",
      "amtsgericht": "Amtsgericht Offenbach am Main",
      "registernummer": "HRB 50393",
      "registerart": "HRB",
      "company_name": "TUNA GmbH",
      "company_seat": "Offenbach am Main",
      "details": "09.04.2025 (Bekanntmachungsdatum)\n\nHessen Amtsgericht Offenbach am Main HRB 50393\nLöschungsankündigung\n\nTUNA GmbH\nGesellschaft mit beschränkter Haftung\nOffenbach am Main\n\nDas Registergericht beabsichtigt die im Handelsregister eingetragene Gesellschaft von Amts wegen nach § 394 FamFG zu löschen. Die Frist zur Erhebung eines Widerspruchs gegen die beabsichtigte Löschung wird auf 3 Monate festgesetzt."
    },
    {
      "date": "2025-04-09",
      "id": "106078",
      "original_text": "Löschungsankündigung\nHessen Amtsgericht Offenbach am Main HRB 54086\nEBS Team GmbH – Dreieich",
      "type": "Löschungsankündigung",
      "state": "Hessen",
      "amtsgericht": "Amtsgericht Offenbach am Main",
      "registernummer": "HRB 54086",
      "registerart": "HRB",
      "company_name": "EBS Team GmbH",
      "company_seat": "Dreieich",
      "details": "09.04.2025 (Bekanntmachungsdatum)\n\nHessen Amtsgericht Offenbach am Main HRB 54086\nLöschungsankündigung\n\nEBS Team GmbH\nGesellschaft mit beschränkter Haftung\nDreieich\n\nDas Registergericht beabsichtigt die im Handelsregister eingetragene Gesellschaft von Amts wegen nach § 394 FamFG zu löschen. Die Frist zur Erhebung eines Widerspruchs gegen die beabsichtigte Löschung wird auf 3 Monate festgesetzt."
    },
    {
      "date": "2025-04-09",
      "id": "106079",
      "original_text": "Löschungsankündigung\nHessen Amtsgericht Frankfurt am Main HRB 123791\nSBM Projekt eins Krefeld GmbH – Frankfurt am Main",
      "type": "Löschungsankündigung",
      "state": "Hessen",
      "amtsgericht": "Amtsgericht Frankfurt am Main",
      "registernummer": "HRB 123791",
      "registerart": "HRB",
      "company_name": "SBM Projekt eins Krefeld GmbH",
      "company_seat": "Frankfurt am Main",
      "details": "09.04.2025 (Bekanntmachungsdatum)\n\nHessen Amtsgericht Frankfurt am Main HRB 123791\nLöschungsankündigung\n\nSBM Projekt eins Krefeld GmbH\nGesellschaft mit beschränkter Haftung\nFrankfurt am Main\n\nDas Registergericht beabsichtigt die im Handelsregister eingetragene Gesellschaft von Amts wegen nach § 394 FamFG zu löschen. Die Frist zur Erhebung eines Widerspruchs gegen die beabsichtigte Löschung wird auf 1 Monat festgesetzt."
    },
    {
      "date": "2025-04-09",
      "id": "106080",
      "original_text": "Sonstige Registerbekanntmachung\nHessen Amtsgericht Bad Homburg v.d.H. VR 2095\nKorean German Business Society e.V. – Oberursel (Taunus)",
      "type": "Sonstige Registerbekanntmachung",
      "state": "Hessen",
      "amtsgericht": "Amtsgericht Bad Homburg v.d.H.",
      "registernummer": "VR 2095",
      "registerart": "VR",
      "company_name": "Korean German Business Society e.V.",
      "company_seat": "Oberursel (Taunus)",
      "details": "09.04.2025 (Bekanntmachungsdatum)\n\nHessen Amtsgericht Bad Homburg v.d.H. VR 2095\nSonstige Registerbekanntmachung 09.04.2025 (Eintragungsdatum)\n\nKorean German Business Society e.V.\neingetragener Verein\nOberursel (Taunus)\n\nDer Verein ist aufgelöst."
    },
    {
      "date": "2025-04-09",
      "id": "106081",
      "original_text": "Löschungsankündigung\nHessen Amtsgericht Frankfurt am Main HRB 75091\nPFI PRO FUTURA INVEST (Deutschland) AG – Frankfurt am Main",
      "type": "Löschungsankündigung",
      "state": "Hessen",
      "amtsgericht": "Amtsgericht Frankfurt am Main",
      "registernummer": "HRB 75091",
      "registerart": "HRB",
      "company_name": "PFI PRO FUTURA INVEST (Deutschland) AG",
      "company_seat": "Frankfurt am Main",
      "details": "09.04.2025 (Bekanntmachungsdatum)\n\nHessen Amtsgericht Frankfurt am Main HRB 75091\nLöschungsankündigung\n\nPFI PRO FUTURA INVEST (Deutschland) AG\nAktiengesellschaft\nFrankfurt am Main\n\nDas Registergericht beabsichtigt die im Handelsregister eingetragene Gesellschaft von Amts wegen nach § 394 FamFG zu löschen. Die Frist zur Erhebung eines Widerspruchs gegen die beabsichtigte Löschung wird auf 1 Monat festgesetzt."
    },
    {
      "date": "2025-04-09",
      "id": "106082",
      "original_text": "Registerbekanntmachung nach dem Umwandlungsgesetz\nHessen Amtsgericht Bad Homburg v.d.H. HRB 13017\nPharmaLex GmbH – Bad Homburg v. d. Höhe",
      "type": "Registerbekanntmachung nach dem Umwandlungsgesetz",
      "state": "Hessen",
      "amtsgericht": "Amtsgericht Bad Homburg v.d.H.",
      "registernummer": "HRB 13017",
      "registerart": "HRB",
      "company_name": "PharmaLex GmbH",
      "company_seat": "Bad Homburg v. d. Höhe",
      "details": "09.04.2025 (Bekanntmachungsdatum)\n\nHessen Amtsgericht Bad Homburg v.d.H. HRB 13017\nRegisterbekanntmachung nach dem Umwandlungsgesetz 09.04.2025 (Eintragungsdatum)\n\nPharmaLex GmbH\nGesellschaft mit beschränkter Haftung\nBad Homburg v. d. Höhe\n\nDen Gläubigern der an der Verschmelzung beteiligten Rechtsträger ist, wenn sie binnen sechs Monaten nach dem Tag, an dem die Eintragung der Verschmelzung in das Register des Sitzes desjenigen Rechtsträgers, dessen Gläubiger sie sind, nach § 19 Absatz 3 UmwG bekannt gemacht worden ist, ihren Anspruch nach Grund und Höhe schriftlich anmelden, Sicherheit zu leisten, soweit sie nicht Befriedigung verlangen können. Dieses Recht steht den Gläubigern jedoch nur zu, wenn sie glaubhaft machen, dass durch die Verschmelzung die Erfüllung ihrer Forderung gefährdet wird."
    },
    {
      "date": "2025-04-09",
      "id": "106083",
      "original_text": "Sonstige Registerbekanntmachung\nHessen Amtsgericht Marburg VR 5855\nSLG-Marburg – Cölbe",
      "type": "Sonstige Registerbekanntmachung",
      "state": "Hessen",
      "amtsgericht": "Amtsgericht Marburg",
      "registernummer": "VR 5855",
      "registerart": "VR",
      "company_name": "SLG-Marburg",
      "company_seat": "Cölbe",
      "details": "09.04.2025 (Bekanntmachungsdatum)\n\nHessen Amtsgericht Marburg VR 5855\nSonstige Registerbekanntmachung 04.04.2025 (Eintragungsdatum)\n\nSLG-Marburg\neingetragener Verein\nCölbe\n\nDer Verein ist aufgelöst."
    },
    {
      "date": "2025-04-09",
      "id": "106084",
      "original_text": "Registerbekanntmachung nach dem Umwandlungsgesetz\nBaden-Württemberg Amtsgericht Stuttgart HRA 741855\nFörch GmbH & Co. KG – Neuenstadt am Kocher",
      "type": "Registerbekanntmachung nach dem Umwandlungsgesetz",
      "state": "Baden-Württemberg",
      "amtsgericht": "Amtsgericht Stuttgart",
      "registernummer": "HRA 741855",
      "registerart": "HRA",
      "company_name": "Förch GmbH & Co. KG",
      "company_seat": "Neuenstadt am Kocher",
      "details": "09.04.2025 (Bekanntmachungsdatum)\n\nBaden-Württemberg Amtsgericht Stuttgart HRA 741855\nRegisterbekanntmachung nach dem Umwandlungsgesetz 09.04.2025 (Eintragungsdatum)\n\nFörch GmbH & Co. KG\nKommanditgesellschaft\nNeuenstadt am Kocher\n\nAls nicht eingetragen wird bekanntgemacht:\nDen Gläubigern der an der Abspaltung beteiligten Rechtsträger ist, wenn sie binnen sechs Monaten nach dem Tag, an dem die Eintragung der Abspaltung in das Register des Sitzes desjenigen Rechtsträgers, dessen Gläubiger sie sind, nach § 19 Abs. 3 UmwG als bekanntgemacht gilt, ihren Anspruch nach Grund und Höhe schriftlich anmelden, Sicherheit zu leisten, soweit sie nicht Befriedigung verlangen können. Dieses Recht steht den Gläubigern jedoch nur zu, wenn sie glaubhaft machen, dass durch die Abspaltung die Erfüllung ihrer Forderung gefährdet wird."
    },
    {
      "date": "2025-04-09",
      "id": "106085",
      "original_text": "Löschungsankündigung\nBrandenburg Amtsgericht Frankfurt/Oder HRB 20052\nCity Patrol Berlin UG (haftungsbeschränkt) – Hoppegarten",
      "type": "Löschungsankündigung",
      "state": "Brandenburg",
      "amtsgericht": "Amtsgericht Frankfurt/Oder",
      "registernummer": "HRB 20052",
      "registerart": "HRB",
      "company_name": "City Patrol Berlin UG (haftungsbeschränkt)",
      "company_seat": "Hoppegarten",
      "details": "09.04.2025 (Bekanntmachungsdatum)\n\nBrandenburg Amtsgericht Frankfurt/Oder HRB 20052\nLöschungsankündigung\n\nCity Patrol Berlin UG (haftungsbeschränkt)\nGesellschaft mit beschränkter Haftung\nHoppegarten\n\nBei der nachstehenden Gesellschaft wird das Amtslöschungsverfahren gemäß § 394 FamFG eingeleitet."
    },
    {
      "date": "2025-04-09",
      "id": "106086",
      "original_text": "Registerbekanntmachung nach dem Umwandlungsgesetz\nBaden-Württemberg Amtsgericht Freiburg HRB 711861\nD.S.T. GROUP GmbH – Kehl",
      "type": "Registerbekanntmachung nach dem Umwandlungsgesetz",
      "state": "Baden-Württemberg",
      "amtsgericht": "Amtsgericht Freiburg",
      "registernummer": "HRB 711861",
      "registerart": "HRB",
      "company_name": "D.S.T. GROUP GmbH",
      "company_seat": "Kehl",
      "details": "09.04.2025 (Bekanntmachungsdatum)\n\nBaden-Württemberg Amtsgericht Freiburg HRB 711861\nRegisterbekanntmachung nach dem Umwandlungsgesetz 09.04.2025 (Eintragungsdatum)\n\nD.S.T. GROUP GmbH\nGesellschaft mit beschränkter Haftung\nKehl\n\nAls nicht eingetragen wird bekanntgemacht:\nDen Gläubigern der an der Verschmelzung beteiligten Rechtsträger ist, wenn sie binnen sechs Monaten nach dem Tag, an dem die Eintragung der Verschmelzung in das Register des Sitzes desjenigen Rechtsträgers, dessen Gläubiger sie sind, nach § 19 Abs. 3 UmwG als bekanntgemacht gilt, ihren Anspruch nach Grund und Höhe schriftlich anmelden, Sicherheit zu leisten, soweit sie nicht Befriedigung verlangen können. Dieses Recht steht den Gläubigern jedoch nur zu, wenn sie glaubhaft machen, dass durch die Verschmelzung die Erfüllung ihrer Forderung gefährdet wird."
    },
    {
      "date": "2025-04-09",
      "id": "106087",
      "original_text": "Registerbekanntmachung nach dem Umwandlungsgesetz\nBaden-Württemberg Amtsgericht Freiburg HRB 371976\nDive Spirit & Travel GmbH – Kehl",
      "type": "Registerbekanntmachung nach dem Umwandlungsgesetz",
      "state": "Baden-Württemberg",
      "amtsgericht": "Amtsgericht Freiburg",
      "registernummer": "HRB 371976",
      "registerart": "HRB",
      "company_name": "Dive Spirit & Travel GmbH",
      "company_seat": "Kehl",
      "details": "09.04.2025 (Bekanntmachungsdatum)\n\nBaden-Württemberg Amtsgericht Freiburg HRB 371976\nRegisterbekanntmachung nach dem Umwandlungsgesetz 09.04.2025 (Eintragungsdatum)\n\nDive Spirit & Travel GmbH\nGesellschaft mit beschränkter Haftung\nKehl\n\nAls nicht eingetragen wird bekanntgemacht:\nDen Gläubigern der an der Verschmelzung beteiligten Rechtsträger ist, wenn sie binnen sechs Monaten nach dem Tag, an dem die Eintragung der Verschmelzung in das Register des Sitzes desjenigen Rechtsträgers, dessen Gläubiger sie sind, nach § 19 Abs. 3 UmwG als bekanntgemacht gilt, ihren Anspruch nach Grund und Höhe schriftlich anmelden, Sicherheit zu leisten, soweit sie nicht Befriedigung verlangen können. Dieses Recht steht den Gläubigern jedoch nur zu, wenn sie glaubhaft machen, dass durch die Verschmelzung die Erfüllung ihrer Forderung gefährdet wird."
    },
    {
      "date": "2025-04-09",
      "id": "106088",
      "original_text": "Löschungsankündigung\nBaden-Württemberg Amtsgericht Stuttgart HRB 776134\nClima4Future GmbH – Althütte",
      "type": "Löschungsankündigung",
      "state": "Baden-Württemberg",
      "amtsgericht": "Amtsgericht Stuttgart",
      "registernummer": "HRB 776134",
      "registerart": "HRB",
      "company_name": "Clima4Future GmbH",
      "company_seat": "Althütte",
      "details": "09.04.2025 (Bekanntmachungsdatum)\n\nBaden-Württemberg Amtsgericht Stuttgart HRB 776134\nLöschungsankündigung\n\nClima4Future GmbH\nGesellschaft mit beschränkter Haftung\nAlthütte\n\nAls nicht eingetragen wird bekanntgemacht:\nDas Gericht beabsichtigt, die Gesellschaft wegen Vermögenslosigkeit im Handelsregister von Amts wegen nach § 394 FamFG zu löschen. Die Frist zur Geltendmachung eines Widerspruchs gegen die beabsichtigte Löschung ist auf zwei Monate ab Veröffentlichung bestimmt."
    },
    {
      "date": "2025-04-09",
      "id": "106089",
      "original_text": "Sonstige Registerbekanntmachung\nSachsen Amtsgericht Dresden HRB 46129\nMeißener Stadtwerke Holding GmbH – Meißen",
      "type": "Sonstige Registerbekanntmachung",
      "state": "Sachsen",
      "amtsgericht": "Amtsgericht Dresden",
      "registernummer": "HRB 46129",
      "registerart": "HRB",
      "company_name": "Meißener Stadtwerke Holding GmbH",
      "company_seat": "Meißen",
      "details": "09.04.2025 (Bekanntmachungsdatum)\n\nSachsen Amtsgericht Dresden HRB 46129\nSonstige Registerbekanntmachung\n\nMeißener Stadtwerke Holding GmbH\nGesellschaft mit beschränkter Haftung\nMeißen\n\nAm 08.04.2025 wurde beim Handelsregister des Amtsgerichts Dresden die Liste der Mitglieder des Aufsichtsrats gemäß § 52 GmbHG eingereicht."
    },
    {
      "date": "2025-04-09",
      "id": "106090",
      "original_text": "Einreichung neuer Dokumente\nSachsen Amtsgericht Dresden HRB 6717\nGasversorgung Görlitz GmbH – Görlitz",
      "type": "Einreichung neuer Dokumente",
      "state": "Sachsen",
      "amtsgericht": "Amtsgericht Dresden",
      "registernummer": "HRB 6717",
      "registerart": "HRB",
      "company_name": "Gasversorgung Görlitz GmbH",
      "company_seat": "Görlitz",
      "details": "09.04.2025 (Bekanntmachungsdatum)\n\nSachsen Amtsgericht Dresden HRB 6717\nEinreichung neuer Dokumente\n\nGasversorgung Görlitz GmbH\nGesellschaft mit beschränkter Haftung\nGörlitz\n\nAm 08.04.2025 wurde beim Handelsregister des Amtsgerichts Dresden die Liste der Mitglieder des Aufsichtsrats gemäß § 52 GmbHG eingereicht."
    },
    {
      "date": "2025-04-09",
      "id": "106091",
      "original_text": "Löschungsankündigung\nSachsen Amtsgericht Dresden HRB 31320\nImbatec GmbH – Dresden",
      "type": "Löschungsankündigung",
      "state": "Sachsen",
      "amtsgericht": "Amtsgericht Dresden",
      "registernummer": "HRB 31320",
      "registerart": "HRB",
      "company_name": "Imbatec GmbH",
      "company_seat": "Dresden",
      "details": "09.04.2025 (Bekanntmachungsdatum)\n\nSachsen Amtsgericht Dresden HRB 31320\nLöschungsankündigung\n\nImbatec GmbH\nGesellschaft mit beschränkter Haftung\nDresden\n\nDas Registergericht beabsichtigt, die im Handelsregister eingetragene Gesellschaft von Amts wegen nach § 394 FamFG zu löschen. Die Frist zu Erhebung eines Widerspruchs gegen die beabsichtigte Löschung wird auf einen Monat festgesetzt."
    },
    {
      "date": "2025-04-09",
      "id": "106092",
      "original_text": "Löschungsankündigung\nNiedersachsen Amtsgericht Aurich HRB 203515\nBESTWORK UG (haftungsbeschränkt) – Leer-Loga",
      "type": "Löschungsankündigung",
      "state": "Niedersachsen",
      "amtsgericht": "Amtsgericht Aurich",
      "registernummer": "HRB 203515",
      "registerart": "HRB",
      "company_name": "BESTWORK UG (haftungsbeschränkt)",
      "company_seat": "Leer-Loga",
      "details": "09.04.2025 (Bekanntmachungsdatum)\n\nNiedersachsen Amtsgericht Aurich HRB 203515\nLöschungsankündigung 09.04.2025 (Eintragungsdatum)\n\nBESTWORK UG (haftungsbeschränkt)\nGesellschaft mit beschränkter Haftung\nLeer-Loga\n\nDas Registergericht beabsichtigt, die Gesellschaft von Amts wegen nach § 394 FamFG zu löschen. Die Frist zur Erhebung eines Widerspruchs ist auf 1 Monat ab dieser Registerbekanntmachung festgesetzt."
    },
    {
      "date": "2025-04-09",
      "id": "106093",
      "original_text": "Registerbekanntmachung nach dem Umwandlungsgesetz\nNiedersachsen Amtsgericht Lüneburg HRB 212807\nPopcorn gGmbH – Dannenberg (Elbe)",
      "type": "Registerbekanntmachung nach dem Umwandlungsgesetz",
      "state": "Niedersachsen",
      "amtsgericht": "Amtsgericht Lüneburg",
      "registernummer": "HRB 212807",
      "registerart": "HRB",
      "company_name": "Popcorn gGmbH",
      "company_seat": "Dannenberg (Elbe)",
      "details": "09.04.2025 (Bekanntmachungsdatum)\n\nNiedersachsen Amtsgericht Lüneburg HRB 212807\nRegisterbekanntmachung nach dem Umwandlungsgesetz 08.04.2025 (Eintragungsdatum)\n\nPopcorn gGmbH\nGesellschaft mit beschränkter Haftung\nDannenberg (Elbe)\n\nDen Gläubigern der an der formwechselnden Umwandlung beteiligten Rechtsträger ist, wenn sie binnen sechs Monaten nach dem Tag, an dem die Eintragung der Umwandlung in das Register des Sitzes desjenigen Rechtsträgers, dessen Gläubiger sie sind, nach § 19 Abs. 3 UmwG als bekannt gemacht gilt, ihren Anspruch nach Grund und Höhe schriftlich anmelden, Sicherheit zu leisten, soweit sie nicht Befriedigung verlangen können. Dieses Recht steht den Gläubigern jedoch nur zu, wenn sie glaubhaft machen, dass durch die formwechselnde Umwandlung die Erfüllung der Forderung gefährdet wird."
    },
    {
      "date": "2025-04-09",
      "id": "106094",
      "original_text": "Registerbekanntmachung nach dem Umwandlungsgesetz\nNiedersachsen Amtsgericht Osnabrück HRB 209407\nEuroplast Rohrwerk GmbH – Twist",
      "type": "Registerbekanntmachung nach dem Umwandlungsgesetz",
      "state": "Niedersachsen",
      "amtsgericht": "Amtsgericht Osnabrück",
      "registernummer": "HRB 209407",
      "registerart": "HRB",
      "company_name": "Europlast Rohrwerk GmbH",
      "company_seat": "Twist",
      "details": "09.04.2025 (Bekanntmachungsdatum)\n\nNiedersachsen Amtsgericht Osnabrück HRB 209407\nRegisterbekanntmachung nach dem Umwandlungsgesetz 09.04.2025 (Eintragungsdatum)\n\nEuroplast Rohrwerk GmbH\nGesellschaft mit beschränkter Haftung\nTwist\n\nDen Gläubigern der an der Verschmelzung beteiligten Rechtsträger ist, wenn sie binnen sechs Monaten nach dem Tag, an dem die Eintragung der Verschmelzung in das Register des Sitzes desjenigen Rechtsträgers, dessen Gläubiger sie sind, nach § 19  Abs.  3 UmwG als bekannt gemacht gilt, ihren Anspruch nach Grund und Höhe schriftlich anmelden, Sicherheit zu leisten, soweit sie nicht Befriedigung verlangen können. Dieses Recht steht den Gläubigern jedoch nur zu, wenn sie glaubhaft machen, dass durch die Verschmelzung die Erfüllung der Forderung gefährdet wird."
    },
    {
      "date": "2025-04-09",
      "id": "106095",
      "original_text": "Registerbekanntmachung nach dem Umwandlungsgesetz\nNiedersachsen Amtsgericht Hannover HRA 200787\nAnochin, Roters & Kollegen GmbH & Co. KG Wirtschaftsprüfungsgesellschaft Steuerberatungsgesellschaft – Hannover",
      "type": "Registerbekanntmachung nach dem Umwandlungsgesetz",
      "state": "Niedersachsen",
      "amtsgericht": "Amtsgericht Hannover",
      "registernummer": "HRA 200787",
      "registerart": "HRA",
      "company_name": "Anochin, Roters & Kollegen GmbH & Co. KG Wirtschaftsprüfungsgesellschaft Steuerberatungsgesellschaft",
      "company_seat": "Hannover",
      "details": "09.04.2025 (Bekanntmachungsdatum)\n\nNiedersachsen Amtsgericht Hannover HRA 200787\nRegisterbekanntmachung nach dem Umwandlungsgesetz 09.04.2025 (Eintragungsdatum)\n\nAnochin, Roters & Kollegen GmbH & Co. KG Wirtschaftsprüfungsgesellschaft Steuerberatungsgesellschaft\nKommanditgesellschaft\nHannover\n\nDen Gläubigern der an der formwechselnden Umwandlung beteiligten Rechtsträger ist, wenn sie binnen sechs Monaten nach dem Tag, an dem die Eintragung der Umwandlung in das Register des Sitzes desjenigen Rechtsträgers, dessen Gläubiger sie sind, nach § 19 Abs. 3 UmwG als bekannt gemacht gilt, ihren Anspruch nach Grund und Höhe schriftlich anmelden, Sicherheit zu leisten, soweit sie nicht Befriedigung verlangen können. Dieses Recht steht den Gläubigern jedoch nur zu, wenn sie glaubhaft machen, dass durch die formwechselnde Umwandlung die Erfüllung der Forderung gefährdet wird."
    },
    {
      "date": "2025-04-09",
      "id": "106096",
      "original_text": "Einreichung neuer Dokumente\nNiedersachsen Amtsgericht Hannover HRB 4061\nDeutsche Messe Aktiengesellschaft – Hannover",
      "type": "Einreichung neuer Dokumente",
      "state": "Niedersachsen",
      "amtsgericht": "Amtsgericht Hannover",
      "registernummer": "HRB 4061",
      "registerart": "HRB",
      "company_name": "Deutsche Messe Aktiengesellschaft",
      "company_seat": "Hannover",
      "details": "09.04.2025 (Bekanntmachungsdatum)\n\nNiedersachsen Amtsgericht Hannover HRB 4061\nEinreichung neuer Dokumente\n\nDeutsche Messe Aktiengesellschaft\nAktiengesellschaft\nHannover\n\nDie Liste der Mitglieder des Aufsichtsrats wurde beim Registergericht eingereicht."
    },
    {
      "date": "2025-04-09",
      "id": "106097",
      "original_text": "Löschungsankündigung\nNiedersachsen Amtsgericht Hannover HRB 58326\nBMS Beratung Messen Serviceleistungen GmbH – Hannover",
      "type": "Löschungsankündigung",
      "state": "Niedersachsen",
      "amtsgericht": "Amtsgericht Hannover",
      "registernummer": "HRB 58326",
      "registerart": "HRB",
      "company_name": "BMS Beratung Messen Serviceleistungen GmbH",
      "company_seat": "Hannover",
      "details": "09.04.2025 (Bekanntmachungsdatum)\n\nNiedersachsen Amtsgericht Hannover HRB 58326\nLöschungsankündigung\n\nBMS Beratung Messen Serviceleistungen GmbH\nGesellschaft mit beschränkter Haftung\nHannover\n\nDas Registergericht beabsichtigt, die Gesellschaft von Amts wegen nach § 394 FamFG zu löschen. Die Frist zur Erhebung eines Widerspruchs ist auf 1 Monat ab dieser Registerbekanntmachung festgesetzt."
    },
    {
      "date": "2025-04-09",
      "id": "106098",
      "original_text": "Registerbekanntmachung nach dem Umwandlungsgesetz\nNiedersachsen Amtsgericht Lüneburg VR 120345\nPopcorn e.V., Eigeninitiative zur außerschulischen Betreuung von Kindern im Schulalter – Dannenberg (Elbe)",
      "type": "Registerbekanntmachung nach dem Umwandlungsgesetz",
      "state": "Niedersachsen",
      "amtsgericht": "Amtsgericht Lüneburg",
      "registernummer": "VR 120345",
      "registerart": "VR",
      "company_name": "Popcorn e.V., Eigeninitiative zur außerschulischen Betreuung von Kindern im Schulalter",
      "company_seat": "Dannenberg (Elbe)",
      "details": "09.04.2025 (Bekanntmachungsdatum)\n\nNiedersachsen Amtsgericht Lüneburg VR 120345\nRegisterbekanntmachung nach dem Umwandlungsgesetz 08.04.2025 (Eintragungsdatum)\n\nPopcorn e.V., Eigeninitiative zur außerschulischen Betreuung von Kindern im Schulalter\neingetragener Verein\nDannenberg (Elbe)\n\nDen Gläubigern der an der formwechselnden Umwandlung beteiligten Rechtsträger ist, wenn sie binnen sechs Monaten nach dem Tag, an dem die Eintragung der Umwandlung in das Register des Sitzes desjenigen Rechtsträgers, dessen Gläubiger sie sind, nach § 19 Abs. 3 UmwG als bekannt gemacht gilt, ihren Anspruch nach Grund und Höhe schriftlich anmelden, Sicherheit zu leisten, soweit sie nicht Befriedigung verlangen können. Dieses Recht steht den Gläubigern jedoch nur zu, wenn sie glaubhaft machen, dass durch die formwechselnde Umwandlung die Erfüllung der Forderung gefährdet wird."
    },
    {
      "date": "2025-04-09",
      "id": "106099",
      "original_text": "Sonstige Registerbekanntmachung\nNiedersachsen Amtsgericht Göttingen HRB 1970\nSartorius Aktiengesellschaft – Göttingen",
      "type": "Sonstige Registerbekanntmachung",
      "state": "Niedersachsen",
      "amtsgericht": "Amtsgericht Göttingen",
      "registernummer": "HRB 1970",
      "registerart": "HRB",
      "company_name": "Sartorius Aktiengesellschaft",
      "company_seat": "Göttingen",
      "details": "09.04.2025 (Bekanntmachungsdatum)\n\nNiedersachsen Amtsgericht Göttingen HRB 1970\nSonstige Registerbekanntmachung\n\nSartorius Aktiengesellschaft\nAktiengesellschaft\nGöttingen\n\nDie Liste der Mitglieder des Aufsichtsrats wurde beim Registergericht eingereicht."
    },
    {
      "date": "2025-04-09",
      "id": "106100",
      "original_text": "Registerbekanntmachung nach dem Umwandlungsgesetz\nNiedersachsen Amtsgericht Hannover HRB 228759\nAnochin, Roters & Kollegen GmbH Wirtschaftsprüfungsgesellschaft, Steuerberatung – Hannover",
      "type": "Registerbekanntmachung nach dem Umwandlungsgesetz",
      "state": "Niedersachsen",
      "amtsgericht": "Amtsgericht Hannover",
      "registernummer": "HRB 228759",
      "registerart": "HRB",
      "company_name": "Anochin, Roters & Kollegen GmbH Wirtschaftsprüfungsgesellschaft, Steuerberatung",
      "company_seat": "Hannover",
      "details": "09.04.2025 (Bekanntmachungsdatum)\n\nNiedersachsen Amtsgericht Hannover HRB 228759\nRegisterbekanntmachung nach dem Umwandlungsgesetz 09.04.2025 (Eintragungsdatum)\n\nAnochin, Roters & Kollegen GmbH Wirtschaftsprüfungsgesellschaft, Steuerberatung\nGesellschaft mit beschränkter Haftung\nHannover\n\nDen Gläubigern der an der formwechselnden Umwandlung beteiligten Rechtsträger ist, wenn sie binnen sechs Monaten nach dem Tag, an dem die Eintragung der Umwandlung in das Register des Sitzes desjenigen Rechtsträgers, dessen Gläubiger sie sind, nach § 19 Abs. 3 UmwG als bekannt gemacht gilt, ihren Anspruch nach Grund und Höhe schriftlich anmelden, Sicherheit zu leisten, soweit sie nicht Befriedigung verlangen können. Dieses Recht steht den Gläubigern jedoch nur zu, wenn sie glaubhaft machen, dass durch die formwechselnde Umwandlung die Erfüllung der Forderung gefährdet wird."
    },
    {
      "date": "2025-04-09",
      "id": "106101",
      "original_text": "Sonstige Registerbekanntmachung\nNiedersachsen Amtsgericht Hannover HRB 217657\nWH Care Gnarrenburg GmbH – Garbsen",
      "type": "Sonstige Registerbekanntmachung",
      "state": "Niedersachsen",
      "amtsgericht": "Amtsgericht Hannover",
      "registernummer": "HRB 217657",
      "registerart": "HRB",
      "company_name": "WH Care Gnarrenburg GmbH",
      "company_seat": "Garbsen",
      "details": "09.04.2025 (Bekanntmachungsdatum)\n\nNiedersachsen Amtsgericht Hannover HRB 217657\nSonstige Registerbekanntmachung 09.04.2025 (Eintragungsdatum)\n\nWH Care Gnarrenburg GmbH\nGesellschaft mit beschränkter Haftung\nGarbsen\n\nDen Gläubigern der Gesellschaft, deren Forderungen begründet worden sind, bevor die Eintragung der Beendigung des Vertrages in das Handelsregister nach § 10 HGB als bekanntgemacht gilt, ist vom anderen Vertragsteil Sicherheit zu leisten, wenn sie sich binnen sechs Monaten nach der Bekanntmachung zu diesem Zweck bei ihm melden."
    },
    {
      "date": "2025-04-09",
      "id": "106102",
      "original_text": "Sonstige Registerbekanntmachung\nNiedersachsen Amtsgericht Osnabrück HRB 219848\nBohn Grundstücks GmbH – Osnabrück",
      "type": "Sonstige Registerbekanntmachung",
      "state": "Niedersachsen",
      "amtsgericht": "Amtsgericht Osnabrück",
      "registernummer": "HRB 219848",
      "registerart": "HRB",
      "company_name": "Bohn Grundstücks GmbH",
      "company_seat": "Osnabrück",
      "details": "09.04.2025 (Bekanntmachungsdatum)\n\nNiedersachsen Amtsgericht Osnabrück HRB 219848\nSonstige Registerbekanntmachung 09.04.2025 (Eintragungsdatum)\n\nBohn Grundstücks GmbH\nGesellschaft mit beschränkter Haftung\nOsnabrück\n\nDen Gläubigern der Gesellschaft, deren Forderungen begründet worden sind, bevor die Eintragung der Beendigung des Vertrages in das Handelsregister nach § 10 HGB als bekanntgemacht gilt, ist vom anderen Vertragsteil Sicherheit zu leisten, wenn sie sich binnen sechs Monaten nach der Bekanntmachung zu diesem Zweck bei ihm melden."
    },
    {
      "date": "2025-04-09",
      "id": "106103",
      "original_text": "Registerbekanntmachung nach dem Umwandlungsgesetz\nRheinland-Pfalz Amtsgericht Montabaur HRA 23276\nFries-Aufzüge GmbH & Co. KG – Hillscheid",
      "type": "Registerbekanntmachung nach dem Umwandlungsgesetz",
      "state": "Rheinland-Pfalz",
      "amtsgericht": "Amtsgericht Montabaur",
      "registernummer": "HRA 23276",
      "registerart": "HRA",
      "company_name": "Fries-Aufzüge GmbH & Co. KG",
      "company_seat": "Hillscheid",
      "details": "09.04.2025 (Bekanntmachungsdatum)\n\nRheinland-Pfalz Amtsgericht Montabaur HRA 23276\nRegisterbekanntmachung nach dem Umwandlungsgesetz 09.04.2025 (Eintragungsdatum)\n\nFries-Aufzüge GmbH & Co. KG\nKommanditgesellschaft\nHillscheid\n\nAls nicht eingetragen wird veröffentlicht: Den Gläubigern der an der Ausgliederung beteiligten Rechtsträger ist, wenn sie binnen sechs Monaten nach dem Tag, an dem die Eintragung der Ausgliederung in das Register des Sitzes desjenigen Rechtsträgers, dessen Gläubiger sie sind, nach § 19 Abs. 3 UmwG als bekannt gemacht gilt, ihren Anspruch nach Grund und Höhe schriftlich anmelden, Sicherheit zu leisten, soweit sie nicht Befriedigung verlangen können. Dieses Recht steht den Gläubigern jedoch nur zu, wenn sie glaubhaft machen, dass durch die Ausgliederung die Erfüllung der Forderung gefährdet wird."
    },
    {
      "date": "2025-04-09",
      "id": "106104",
      "original_text": "Löschungsankündigung\nRheinland-Pfalz Amtsgericht Ludwigshafen a.Rhein (Ludwigshafen) HRB 3011\nKonrad Wissel GmbH – Ludwigshafen-Oggersheim",
      "type": "Löschungsankündigung",
      "state": "Rheinland-Pfalz",
      "amtsgericht": "Amtsgericht Ludwigshafen a.Rhein (Ludwigshafen)",
      "registernummer": "HRB 3011",
      "registerart": "HRB",
      "company_name": "Konrad Wissel GmbH",
      "company_seat": "Ludwigshafen-Oggersheim",
      "details": "09.04.2025 (Bekanntmachungsdatum)\n\nRheinland-Pfalz Amtsgericht Ludwigshafen a.Rhein (Ludwigshafen) HRB 3011\nLöschungsankündigung\n\nKonrad Wissel GmbH\nGesellschaft mit beschränkter Haftung\nLudwigshafen-Oggersheim\n\nDas Registergericht beabsichtigt die Gesellschaft von Amts wegen nach § 394 FamFG zu löschen. Die Frist zur Erhebung eines Widerspruchs ist auf einen Monat festgesetzt."
    },
    {
      "date": "2025-04-09",
      "id": "106105",
      "original_text": "Registerbekanntmachung nach dem Umwandlungsgesetz\nRheinland-Pfalz Amtsgericht Montabaur HRA 4199\nFries-Aufzüge, Inh. Stefan Schmitz e.K. – Hillscheid",
      "type": "Registerbekanntmachung nach dem Umwandlungsgesetz",
      "state": "Rheinland-Pfalz",
      "amtsgericht": "Amtsgericht Montabaur",
      "registernummer": "HRA 4199",
      "registerart": "HRA",
      "company_name": "Fries-Aufzüge, Inh. Stefan Schmitz e.K.",
      "company_seat": "Hillscheid",
      "details": "09.04.2025 (Bekanntmachungsdatum)\n\nRheinland-Pfalz Amtsgericht Montabaur HRA 4199\nRegisterbekanntmachung nach dem Umwandlungsgesetz 09.04.2025 (Eintragungsdatum)\n\nFries-Aufzüge, Inh. Stefan Schmitz e.K.\nEinzelkaufmann / Einzelkauffrau\nHillscheid\n\nAls nicht eingetragen wird veröffentlicht: Den Gläubigern der an der Ausgliederung beteiligten Rechtsträger ist, wenn sie binnen sechs Monaten nach dem Tag, an dem die Eintragung der Ausgliederung in das Register des Sitzes desjenigen Rechtsträgers,dessen Gläubiger sie sind, nach § 19 Abs. 3 UmwG als bekannt gemacht gilt, ihren Anspruch nach Grund und Höhe schriftlich anmelden, Sicherheit zu leisten, soweit sie nicht Befriedigung verlangen können. Dieses Recht steht den Gläubigern jedoch nur zu, wenn sie glaubhaft machen, dass durch die Ausgliederung die Erfüllung der Forderung gefährdet wird."
    },
    {
      "date": "2025-04-09",
      "id": "106106",
      "original_text": "Löschungsankündigung\nNordrhein-Westfalen Amtsgericht Düsseldorf HRB 101396\nAlpes Bau GmbH – Düsseldorf",
      "type": "Löschungsankündigung",
      "state": "Nordrhein-Westfalen",
      "amtsgericht": "Amtsgericht Düsseldorf",
      "registernummer": "HRB 101396",
      "registerart": "HRB",
      "company_name": "Alpes Bau GmbH",
      "company_seat": "Düsseldorf",
      "details": "09.04.2025 (Bekanntmachungsdatum)\n\nNordrhein-Westfalen Amtsgericht Düsseldorf HRB 101396\nLöschungsankündigung\n\nAlpes Bau GmbH\nGesellschaft mit beschränkter Haftung\nDüsseldorf\n\nDas Registergericht beabsichtigt die Gesellschaft von Amts wegen nach § 394 FamFG zu löschen. Die Frist zur Erhebung eines Widerspruchs ist auf 3 Wochen festgesetzt.\n\nRechtsbehelfsbelehrung:\nDas Widerspruchsrecht steht jedem zu, der an der Unterlassung der Löschung ein berechtigtes Interesse hat. Der Widerspruch ist bei dem Amtsgericht Düsseldorf -Registergericht-, Werdener Straße 1, 40227 Düsseldorf schriftlich in deutscher Sprache oder zur Niederschrift der Geschäftsstelle einzulegen. Der Widerspruch kann auch zur Niederschrift der Geschäftsstelle eines jeden Amtsgerichtes abgegeben werden. Die Einlegung ist auch durch Übertragung eines elektronischen Dokuments an die elektronische Poststelle des Gerichts möglich. Das elektronische Dokument muss für die Bearbeitung durch das Gericht geeignet und mit einer qualifizierten elektronischen Signatur der verantwortenden Person versehen sein oder von der verantwortenden Person signiert und auf einem sicheren Übermittlungsweg gemäß § 130a ZPO nach näherer Maßgabe der Verordnung über die technischen Rahmenbedingungen des elektronischen Rechtsverkehrs und über das besondere elektronische Behördenpostfach (BGBl. I, S.3803) eingereicht werden. Weitere Informationen erhalten Sie auf der Internetseite www.justiz.de.\nDer Widerspruch muss spätestens innerhalb der gesetzten Frist nach dem Datum der Bekanntmachung der Löschungsankündigung bei dem Amtsgericht - Registergericht - Düsseldorf eingegangen sein.  Dies gilt auch dann, wenn der Widerspruch zur Niederschrift der Geschäftsstelle eines anderen Amtsgerichtes abgegeben wurde. Die Frist beginnt mit dem Tage der Bekanntmachung der Löschungsankündigung in dem für die Bekanntmachung der Eintragungen in das Handelsregister bestimmten elektronischen Informations- und Kommunikationssystem nach § 10 des Handelsgesetzbuches. Fällt das Ende der Frist auf einen Sonntag, einen allgemeinen Feiertag oder Sonnabend, so endet die Frist mit Ablauf des nächsten Werktages.\nDer Widerspruch muss die Bezeichnung der angefochtenen Löschungsankündigung sowie die Erklärung enthalten, dass Widerspruch gegen diese Löschungsankündigung eingelegt wird. Er ist zu unterzeichnen und soll begründet werden."
    },
    {
      "date": "2025-04-09",
      "id": "106107",
      "original_text": "Löschungsankündigung\nNordrhein-Westfalen Amtsgericht Recklinghausen HRB 8491\nMarkas Immobilien GmbH – Herten",
      "type": "Löschungsankündigung",
      "state": "Nordrhein-Westfalen",
      "amtsgericht": "Amtsgericht Recklinghausen",
      "registernummer": "HRB 8491",
      "registerart": "HRB",
      "company_name": "Markas Immobilien GmbH",
      "company_seat": "Herten",
      "details": "09.04.2025 (Bekanntmachungsdatum)\n\nNordrhein-Westfalen Amtsgericht Recklinghausen HRB 8491\nLöschungsankündigung 09.04.2025 (Eintragungsdatum)\n\nMarkas Immobilien GmbH\nGesellschaft mit beschränkter Haftung\nHerten\n\nDas Registergericht beabsichtigt die Gesellschaft von Amts wegen nach § 394 FamFG zu löschen. Die Frist zur Erhebung eines Widerspruchs ist auf drei Monate festgesetzt."
    },
    {
      "date": "2025-04-09",
      "id": "106108",
      "original_text": "Löschungsankündigung\nNordrhein-Westfalen Amtsgericht Gelsenkirchen HRB 14888\nmiracle of beauty GmbH – Gelsenkirchen",
      "type": "Löschungsankündigung",
      "state": "Nordrhein-Westfalen",
      "amtsgericht": "Amtsgericht Gelsenkirchen",
      "registernummer": "HRB 14888",
      "registerart": "HRB",
      "company_name": "miracle of beauty GmbH",
      "company_seat": "Gelsenkirchen",
      "details": "09.04.2025 (Bekanntmachungsdatum)\n\nNordrhein-Westfalen Amtsgericht Gelsenkirchen HRB 14888\nLöschungsankündigung\n\nmiracle of beauty GmbH\nGesellschaft mit beschränkter Haftung\nGelsenkirchen\n\nDas Gericht beabsichtigt, die eingetragene miracle of beauty GmbH mit Sitz in Gelsenkirchen, HRB 14888, Amtsgericht Gelsenkirchen, wegen Vermögenslosigkeit zu löschen.\nHiermit wird denjenigen, die an der Unterlassung der Löschung ein berechtigtes Interesse haben, gem. § 394 Abs. 2 FamFG Gelegenheit gegeben, gegen dieses Vorhaben binnen eines Monats nach dieser Bekanntmachung Widerspruch einzulegen. Der Widerspruch kann schriftlich oder zu Protokoll der Geschäftsstelle erhoben werden."
    },
    {
      "date": "2025-04-09",
      "id": "106109",
      "original_text": "Registerbekanntmachung nach dem Umwandlungsgesetz\nNordrhein-Westfalen Amtsgericht Köln HRA 37978\nmsk-ausbau Sawatzki e.K. – Köln",
      "type": "Registerbekanntmachung nach dem Umwandlungsgesetz",
      "state": "Nordrhein-Westfalen",
      "amtsgericht": "Amtsgericht Köln",
      "registernummer": "HRA 37978",
      "registerart": "HRA",
      "company_name": "msk-ausbau Sawatzki e.K.",
      "company_seat": "Köln",
      "details": "09.04.2025 (Bekanntmachungsdatum)\n\nNordrhein-Westfalen Amtsgericht Köln HRA 37978\nRegisterbekanntmachung nach dem Umwandlungsgesetz 09.04.2025 (Eintragungsdatum)\n\nmsk-ausbau Sawatzki e.K.\nEinzelkaufmann / Einzelkauffrau\nKöln\n\nDen Gläubigern der an der Ausgliederung beteiligten Rechtsträger ist, wenn sie binnen sechs Monaten nach dem Tag, an dem die Eintragung der Ausgliederung in das Register des Sitzes desjenigen Rechtsträgers, dessen Gläubiger sie sind, nach § 19 Absatz 3 UmwG als bekanntgemacht gilt, ihren Anspruch nach Grund und Höhe schriftlich anmelden, Sicherheit zu leisten, soweit sie nicht Befriedigung verlangen können. Dieses Recht steht den Gläubigern jedoch nur zu, wenn sie glaubhaft machen, dass durch die Ausgliederung die Erfüllung ihrer Forderung gefährdet wird."
    },
    {
      "date": "2025-04-09",
      "id": "106110",
      "original_text": "Löschungsankündigung\nNordrhein-Westfalen Amtsgericht Köln HRB 100719\nROMELA GmbH – Köln",
      "type": "Löschungsankündigung",
      "state": "Nordrhein-Westfalen",
      "amtsgericht": "Amtsgericht Köln",
      "registernummer": "HRB 100719",
      "registerart": "HRB",
      "company_name": "ROMELA GmbH",
      "company_seat": "Köln",
      "details": "09.04.2025 (Bekanntmachungsdatum)\n\nNordrhein-Westfalen Amtsgericht Köln HRB 100719\nLöschungsankündigung\n\nROMELA GmbH\nGesellschaft mit beschränkter Haftung\nKöln\n\nDas Registergericht beabsichtigt die Gesellschaft von Amts wegen nach § 394 FamFG zu löschen. Die Frist zur Erhebung eines Widerspruchs ist auf einen Monat festgesetzt."
    },
    {
      "date": "2025-04-09",
      "id": "106111",
      "original_text": "Registerbekanntmachung nach dem Umwandlungsgesetz\nNordrhein-Westfalen Amtsgericht Köln HRB 121863\nmsk-ausbau GmbH – Köln",
      "type": "Registerbekanntmachung nach dem Umwandlungsgesetz",
      "state": "Nordrhein-Westfalen",
      "amtsgericht": "Amtsgericht Köln",
      "registernummer": "HRB 121863",
      "registerart": "HRB",
      "company_name": "msk-ausbau GmbH",
      "company_seat": "Köln",
      "details": "09.04.2025 (Bekanntmachungsdatum)\n\nNordrhein-Westfalen Amtsgericht Köln HRB 121863\nRegisterbekanntmachung nach dem Umwandlungsgesetz 09.04.2025 (Eintragungsdatum)\n\nmsk-ausbau GmbH\nGesellschaft mit beschränkter Haftung\nKöln\n\nDen Gläubigern der an der Ausgliederung beteiligten Rechtsträger ist, wenn sie binnen sechs Monaten nach dem Tag, an dem die Eintragung der Ausgliederung in das Register des Sitzes desjenigen Rechtsträgers, dessen Gläubiger sie sind, nach § 19 Absatz 3 UmwG als bekanntgemacht gilt, ihren Anspruch nach Grund und Höhe schriftlich anmelden, Sicherheit zu leisten, soweit sie nicht Befriedigung verlangen können. Dieses Recht steht den Gläubigern jedoch nur zu, wenn sie glaubhaft machen, dass durch die Ausgliederung die Erfüllung ihrer Forderung gefährdet wird."
    },
    {
      "date": "2025-04-09",
      "id": "106112",
      "original_text": "Registerbekanntmachung nach dem Umwandlungsgesetz\nNordrhein-Westfalen Amtsgericht Recklinghausen HRA 6846\nMeister- und Mietwerkstatt Galla e. K. – Datteln",
      "type": "Registerbekanntmachung nach dem Umwandlungsgesetz",
      "state": "Nordrhein-Westfalen",
      "amtsgericht": "Amtsgericht Recklinghausen",
      "registernummer": "HRA 6846",
      "registerart": "HRA",
      "company_name": "Meister- und Mietwerkstatt Galla e. K.",
      "company_seat": "Datteln",
      "details": "09.04.2025 (Bekanntmachungsdatum)\n\nNordrhein-Westfalen Amtsgericht Recklinghausen HRA 6846\nRegisterbekanntmachung nach dem Umwandlungsgesetz 09.04.2025 (Eintragungsdatum)\n\nMeister- und Mietwerkstatt Galla e. K.\nEinzelkaufmann / Einzelkauffrau\nDatteln\n\nNach Maßgabe des Ausgliederungs- und Übernahmevertrages vom 13.03.2025 sowie des Zustimmungsbeschlusses des übernehmenden Rechtsträgers vom 13.03.2025 ist das Unternehmen aus dem Vermögendes des Inhabers im Wege der Umwandlung ausgegliedert und als Gesamtheit auf die Cargo GmbH Meister - und Mietwerkstatt mit Sitz in Datteln (Amtsgericht Recklinghausen, HRB 9706) übertragen worden. Die Firma ist erloschen.  Den Gläubigern der an der Ausgliederung beteiligten Rechtsträger ist, wenn sie binnen sechs Monaten nach dem Tag, an dem die Eintragung der Ausgliederung in das Register des Sitzes desjenigen Rechtsträgers, dessen Gläubiger sie sind, nach § 19 Absatz 3 UmwG als bekanntgemacht gilt, ihren Anspruch nach Grund und Höhe schriftlich anmelden, Sicherheit zu leisten, soweit sie nicht Befriedigung verlangen können. Dieses Recht steht den Gläubigern jedoch nur zu, wenn sie glaubhaft machen, dass durch die Ausgliederung die Erfüllung ihrer Forderung gefährdet wird."
    },
    {
      "date": "2025-04-09",
      "id": "106113",
      "original_text": "Registerbekanntmachung nach dem Umwandlungsgesetz\nNordrhein-Westfalen Amtsgericht Köln HRB 44379\nNOISY PICTURES GmbH – Köln",
      "type": "Registerbekanntmachung nach dem Umwandlungsgesetz",
      "state": "Nordrhein-Westfalen",
      "amtsgericht": "Amtsgericht Köln",
      "registernummer": "HRB 44379",
      "registerart": "HRB",
      "company_name": "NOISY PICTURES GmbH",
      "company_seat": "Köln",
      "details": "09.04.2025 (Bekanntmachungsdatum)\n\nNordrhein-Westfalen Amtsgericht Köln HRB 44379\nRegisterbekanntmachung nach dem Umwandlungsgesetz 09.04.2025 (Eintragungsdatum)\n\nNOISY PICTURES GmbH\nGesellschaft mit beschränkter Haftung\nKöln\n\nDen Gläubigern der an der Verschmelzung beteiligten Rechtsträger ist, wenn sie binnen sechs Monaten nach dem Tag, an dem die Eintragung der Verschmelzung in das Register des Sitzes derjenigen Rechtsträger deren Gläubiger sie sind, nach § 19 Absatz 3 UmwG als bekanntgemacht gilt, ihren Anspruch nach Grund und Höhe schriftlich anmelden, Sicherheit zu leisten, soweit sie nicht Befriedigung verlangen können. Dieses Recht steht den Gläubigern jedoch nur zu, wenn sie glaubhaft machen, dass durch die Verschmelzung die Erfüllung ihrer Forderung gefährdet wird."
    },
    {
      "date": "2025-04-09",
      "id": "106114",
      "original_text": "Registerbekanntmachung nach dem Umwandlungsgesetz\nNordrhein-Westfalen Amtsgericht Düsseldorf HRB 63310\nLifestyle Protection AG – Hilden",
      "type": "Registerbekanntmachung nach dem Umwandlungsgesetz",
      "state": "Nordrhein-Westfalen",
      "amtsgericht": "Amtsgericht Düsseldorf",
      "registernummer": "HRB 63310",
      "registerart": "HRB",
      "company_name": "Lifestyle Protection AG",
      "company_seat": "Hilden",
      "details": "09.04.2025 (Bekanntmachungsdatum)\n\nNordrhein-Westfalen Amtsgericht Düsseldorf HRB 63310\nRegisterbekanntmachung nach dem Umwandlungsgesetz\n\nLifestyle Protection AG\nAktiengesellschaft\nHilden\n\nDem Registergericht ist der Entwurf eines Vertrages über die geplante Verschmelzung der LPV Versicherung AG mit der Lifestyle Protection AG eingereicht worden."
    },
    {
      "date": "2025-04-09",
      "id": "106115",
      "original_text": "Einreichung neuer Dokumente\nNordrhein-Westfalen Amtsgericht Düsseldorf HRB 68270\n1&1 Versatel Deutschland GmbH – Düsseldorf",
      "type": "Einreichung neuer Dokumente",
      "state": "Nordrhein-Westfalen",
      "amtsgericht": "Amtsgericht Düsseldorf",
      "registernummer": "HRB 68270",
      "registerart": "HRB",
      "company_name": "1&1 Versatel Deutschland GmbH",
      "company_seat": "Düsseldorf",
      "details": "09.04.2025 (Bekanntmachungsdatum)\n\nNordrhein-Westfalen Amtsgericht Düsseldorf HRB 68270\nEinreichung neuer Dokumente\n\n1&1 Versatel Deutschland GmbH\nGesellschaft mit beschränkter Haftung\nDüsseldorf\n\nDem Registergericht ist eine neue Liste der Mitglieder des Aufsichtsrates eingereicht worden."
    },
    {
      "date": "2025-04-09",
      "id": "106116",
      "original_text": "Registerbekanntmachung nach dem Umwandlungsgesetz\nNordrhein-Westfalen Amtsgericht Bonn HRB 27428\nKoch Solar GmbH – Wachtberg",
      "type": "Registerbekanntmachung nach dem Umwandlungsgesetz",
      "state": "Nordrhein-Westfalen",
      "amtsgericht": "Amtsgericht Bonn",
      "registernummer": "HRB 27428",
      "registerart": "HRB",
      "company_name": "Koch Solar GmbH",
      "company_seat": "Wachtberg",
      "details": "09.04.2025 (Bekanntmachungsdatum)\n\nNordrhein-Westfalen Amtsgericht Bonn HRB 27428\nRegisterbekanntmachung nach dem Umwandlungsgesetz 09.04.2025 (Eintragungsdatum)\n\nKoch Solar GmbH\nGesellschaft mit beschränkter Haftung\nWachtberg\n\nDen Gläubigern der an der Verschmelzung beteiligten Rechtsträger ist, wenn sie binnen sechs Monaten nach dem Tag, an dem die Eintragung der Verschmelzung in das Register des Sitzes desjenigen Rechtsträgers, dessen Gläubiger sie sind, nach § 19 Absatz 3 UmwG als bekanntgemacht gilt, ihren Anspruch nach Grund und Höhe schriftlich anmelden, Sicherheit zu leisten, soweit sie nicht Befriedigung verlangen können. Dieses Recht steht den Gläubigern jedoch nur zu, wenn sie glaubhaft machen, dass durch die Verschmelzung die Erfüllung ihrer Forderung gefährdet wird."
    },
    {
      "date": "2025-04-09",
      "id": "106117",
      "original_text": "Löschungsankündigung\nNordrhein-Westfalen Amtsgericht Düren HRB 6175\nEDCOTEC GmbH – Aldenhoven",
      "type": "Löschungsankündigung",
      "state": "Nordrhein-Westfalen",
      "amtsgericht": "Amtsgericht Düren",
      "registernummer": "HRB 6175",
      "registerart": "HRB",
      "company_name": "EDCOTEC GmbH",
      "company_seat": "Aldenhoven",
      "details": "09.04.2025 (Bekanntmachungsdatum)\n\nNordrhein-Westfalen Amtsgericht Düren HRB 6175\nLöschungsankündigung\n\nEDCOTEC GmbH\nGesellschaft mit beschränkter Haftung\nAldenhoven\n\nDas Registergericht beabsichtigt die Gesellschaft von Amts wegen nach § 394 FamFG zu löschen. Die Frist zur Erhebung eines Widerspruchs ist auf drei Monate festgesetzt."
    },
    {
      "date": "2025-04-09",
      "id": "106118",
      "original_text": "Registerbekanntmachung nach dem Umwandlungsgesetz\nNordrhein-Westfalen Amtsgericht Dortmund HRB 14740\nDataciders QuinScape GmbH – Dortmund",
      "type": "Registerbekanntmachung nach dem Umwandlungsgesetz",
      "state": "Nordrhein-Westfalen",
      "amtsgericht": "Amtsgericht Dortmund",
      "registernummer": "HRB 14740",
      "registerart": "HRB",
      "company_name": "Dataciders QuinScape GmbH",
      "company_seat": "Dortmund",
      "details": "09.04.2025 (Bekanntmachungsdatum)\n\nNordrhein-Westfalen Amtsgericht Dortmund HRB 14740\nRegisterbekanntmachung nach dem Umwandlungsgesetz 09.04.2025 (Eintragungsdatum)\n\nDataciders QuinScape GmbH\nGesellschaft mit beschränkter Haftung\nDortmund\n\nDie Gesellschaft hat Gläubigern, deren Forderungen vor dieser Bekanntmachung begründet worden sind, Sicherheit zu leisten, soweit sie nicht Befriedigung verlangen können, wenn sie sich binnen sechs Monaten zu diesem Zweck melden."
    },
    {
      "date": "2025-04-09",
      "id": "106119",
      "original_text": "Löschungsankündigung\nNordrhein-Westfalen Amtsgericht Wuppertal HRA 21018\nAnnie Weber e. K. Inh. Renate Gabler – Velbert",
      "type": "Löschungsankündigung",
      "state": "Nordrhein-Westfalen",
      "amtsgericht": "Amtsgericht Wuppertal",
      "registernummer": "HRA 21018",
      "registerart": "HRA",
      "company_name": "Annie Weber e. K. Inh. Renate Gabler",
      "company_seat": "Velbert",
      "details": "09.04.2025 (Bekanntmachungsdatum)\n\nNordrhein-Westfalen Amtsgericht Wuppertal HRA 21018\nLöschungsankündigung\n\nAnnie Weber e. K. Inh. Renate Gabler\nEinzelkaufmann / Einzelkauffrau\nVelbert\n\nDas Registergericht beabsichtigt die Firma von Amts wegen nach § 31 Abs. 2 HGB, § 393 FamFG zu löschen. Die Frist zur Erhebung eines Widerspruchs ist auf einen Monat festgesetzt."
    },
    {
      "date": "2025-04-09",
      "id": "106120",
      "original_text": "Löschungsankündigung\nNordrhein-Westfalen Amtsgericht Düsseldorf HRB 76413\nF X - Bau GmbH – Düsseldorf",
      "type": "Löschungsankündigung",
      "state": "Nordrhein-Westfalen",
      "amtsgericht": "Amtsgericht Düsseldorf",
      "registernummer": "HRB 76413",
      "registerart": "HRB",
      "company_name": "F X - Bau GmbH",
      "company_seat": "Düsseldorf",
      "details": "09.04.2025 (Bekanntmachungsdatum)\n\nNordrhein-Westfalen Amtsgericht Düsseldorf HRB 76413\nLöschungsankündigung\n\nF X - Bau GmbH\nGesellschaft mit beschränkter Haftung\nDüsseldorf\n\nDas Registergericht beabsichtigt die Gesellschaft von Amts wegen nach § 394 FamFG zu löschen. Die Frist zur Erhebung eines Widerspruchs ist auf 3 Wochen festgesetzt.\n\nRechtsbehelfsbelehrung:\nDas Widerspruchsrecht steht jedem zu, der an der Unterlassung der Löschung ein berechtigtes Interesse hat. Der Widerspruch ist bei dem Amtsgericht Düsseldorf -Registergericht-, Werdener Straße 1, 40227 Düsseldorf schriftlich in deutscher Sprache oder zur Niederschrift der Geschäftsstelle einzulegen. Der Widerspruch kann auch zur Niederschrift der Geschäftsstelle eines jeden Amtsgerichtes abgegeben werden. Die Einlegung ist auch durch Übertragung eines elektronischen Dokuments an die elektronische Poststelle des Gerichts möglich. Das elektronische Dokument muss für die Bearbeitung durch das Gericht geeignet und mit einer qualifizierten elektronischen Signatur der verantwortenden Person versehen sein oder von der verantwortenden Person signiert und auf einem sicheren Übermittlungsweg gemäß § 130a ZPO nach näherer Maßgabe der Verordnung über die technischen Rahmenbedingungen des elektronischen Rechtsverkehrs und über das besondere elektronische Behördenpostfach (BGBl. I, S.3803) eingereicht werden. Weitere Informationen erhalten Sie auf der Internetseite www.justiz.de.\nDer Widerspruch muss spätestens innerhalb der gesetzten Frist nach dem Datum der Bekanntmachung der Löschungsankündigung bei dem Amtsgericht - Registergericht - Düsseldorf eingegangen sein.  Dies gilt auch dann, wenn der Widerspruch zur Niederschrift der Geschäftsstelle eines anderen Amtsgerichtes abgegeben wurde. Die Frist beginnt mit dem Tage der Bekanntmachung der Löschungsankündigung in dem für die Bekanntmachung der Eintragungen in das Handelsregister bestimmten elektronischen Informations- und Kommunikationssystem nach § 10 des Handelsgesetzbuches. Fällt das Ende der Frist auf einen Sonntag, einen allgemeinen Feiertag oder Sonnabend, so endet die Frist mit Ablauf des nächsten Werktages.\nDer Widerspruch muss die Bezeichnung der angefochtenen Löschungsankündigung sowie die Erklärung enthalten, dass Widerspruch gegen diese Löschungsankündigung eingelegt wird. Er ist zu unterzeichnen und soll begründet werden."
    },
    {
      "date": "2025-04-09",
      "id": "106121",
      "original_text": "Registerbekanntmachung nach dem Umwandlungsgesetz\nNordrhein-Westfalen Amtsgericht Köln HRB 95735\nBanijay Germany GmbH – Köln",
      "type": "Registerbekanntmachung nach dem Umwandlungsgesetz",
      "state": "Nordrhein-Westfalen",
      "amtsgericht": "Amtsgericht Köln",
      "registernummer": "HRB 95735",
      "registerart": "HRB",
      "company_name": "Banijay Germany GmbH",
      "company_seat": "Köln",
      "details": "09.04.2025 (Bekanntmachungsdatum)\n\nNordrhein-Westfalen Amtsgericht Köln HRB 95735\nRegisterbekanntmachung nach dem Umwandlungsgesetz 09.04.2025 (Eintragungsdatum)\n\nBanijay Germany GmbH\nGesellschaft mit beschränkter Haftung\nKöln\n\nDen Gläubigern der an der Verschmelzung beteiligten Rechtsträger ist, wenn sie binnen sechs Monaten nach dem Tag, an dem die Eintragung der Verschmelzung in das Register des Sitzes derjenigen Rechtsträger deren Gläubiger sie sind, nach § 19 Absatz 3 UmwG als bekanntgemacht gilt, ihren Anspruch nach Grund und Höhe schriftlich anmelden, Sicherheit zu leisten, soweit sie nicht Befriedigung verlangen können. Dieses Recht steht den Gläubigern jedoch nur zu, wenn sie glaubhaft machen, dass durch die Verschmelzung die Erfüllung ihrer Forderung gefährdet wird."
    },
    {
      "date": "2025-04-09",
      "id": "106122",
      "original_text": "Einreichung neuer Dokumente\nNordrhein-Westfalen Amtsgericht Essen HRB 36472\nMartin Franz Buck Investment SE – Essen",
      "type": "Einreichung neuer Dokumente",
      "state": "Nordrhein-Westfalen",
      "amtsgericht": "Amtsgericht Essen",
      "registernummer": "HRB 36472",
      "registerart": "HRB",
      "company_name": "Martin Franz Buck Investment SE",
      "company_seat": "Essen",
      "details": "09.04.2025 (Bekanntmachungsdatum)\n\nNordrhein-Westfalen Amtsgericht Essen HRB 36472\nEinreichung neuer Dokumente 09.04.2025 (Eintragungsdatum)\n\nMartin Franz Buck Investment SE\nEuropäische Aktiengesellschaft (SE)\nEssen\n\nDem Registergericht ist eine Liste der Mitglieder des Aufsichtsrates eingereicht worden."
    },
    {
      "date": "2025-04-09",
      "id": "106123",
      "original_text": "Registerbekanntmachung nach dem Umwandlungsgesetz\nNordrhein-Westfalen Amtsgericht Arnsberg HRB 8677\nKatholische Kindertageseinrichtungen Hochsauerland-Waldeck gem. GmbH – Meschede",
      "type": "Registerbekanntmachung nach dem Umwandlungsgesetz",
      "state": "Nordrhein-Westfalen",
      "amtsgericht": "Amtsgericht Arnsberg",
      "registernummer": "HRB 8677",
      "registerart": "HRB",
      "company_name": "Katholische Kindertageseinrichtungen Hochsauerland-Waldeck gem. GmbH",
      "company_seat": "Meschede",
      "details": "09.04.2025 (Bekanntmachungsdatum)\n\nNordrhein-Westfalen Amtsgericht Arnsberg HRB 8677\nRegisterbekanntmachung nach dem Umwandlungsgesetz 09.04.2025 (Eintragungsdatum)\n\nKatholische Kindertageseinrichtungen Hochsauerland-Waldeck gem. GmbH\nGesellschaft mit beschränkter Haftung\nMeschede\n\nDen Gläubigern der an der Verschmelzung beteiligten Rechtsträger ist, wenn sie binnen sechs Monaten nach dem Tag, an dem die Eintragung der Verschmelzung in das Register des Sitzes desjenigen Rechtsträgers, dessen Gläubiger sie sind, nach § 19 Absatz 3 UmwG als bekanntgemacht gilt, ihren Anspruch nach Grund und Höhe schriftlich anmelden, Sicherheit zu leisten, soweit sie nicht Befriedigung verlangen können. Dieses Recht steht den Gläubigern jedoch nur zu, wenn sie glaubhaft machen, dass durch die Verschmelzung die Erfüllung ihrer Forderung gefährdet wird."
    },
    {
      "date": "2025-04-09",
      "id": "106124",
      "original_text": "Sonstige Registerbekanntmachung\nNordrhein-Westfalen Amtsgericht Neuss HRB 21405\nOXYGEN GmbH – Neuss",
      "type": "Sonstige Registerbekanntmachung",
      "state": "Nordrhein-Westfalen",
      "amtsgericht": "Amtsgericht Neuss",
      "registernummer": "HRB 21405",
      "registerart": "HRB",
      "company_name": "OXYGEN GmbH",
      "company_seat": "Neuss",
      "details": "09.04.2025 (Bekanntmachungsdatum)\n\nNordrhein-Westfalen Amtsgericht Neuss HRB 21405\nSonstige Registerbekanntmachung 08.04.2025 (Eintragungsdatum)\n\nOXYGEN GmbH\nGesellschaft mit beschränkter Haftung\nNeuss\n\nDas  Löschungsverfahren wird im Hinblick auf die Nachricht des Finanzamtes Neuss, wonach bei der Europäischen Staatsanwaltschaft in Köln weiterhin eine Verfahren gegen die Gesellschaft anhängig ist, eingestellt und die Löschungsankündigung vom 19.07.2024 aufgehoben."
    },
    {
      "date": "2025-04-09",
      "id": "106125",
      "original_text": "Einreichung neuer Dokumente\nNordrhein-Westfalen Amtsgericht Köln HRB 118943\nTMD Friction Group GmbH – Leverkusen",
      "type": "Einreichung neuer Dokumente",
      "state": "Nordrhein-Westfalen",
      "amtsgericht": "Amtsgericht Köln",
      "registernummer": "HRB 118943",
      "registerart": "HRB",
      "company_name": "TMD Friction Group GmbH",
      "company_seat": "Leverkusen",
      "details": "09.04.2025 (Bekanntmachungsdatum)\n\nNordrhein-Westfalen Amtsgericht Köln HRB 118943\nEinreichung neuer Dokumente\n\nTMD Friction Group GmbH\nGesellschaft mit beschränkter Haftung\nLeverkusen\n\nDem Registergericht ist eine Liste der Mitglieder des Aufsichtsrates eingereicht worden."
    },
    {
      "date": "2025-04-09",
      "id": "106126",
      "original_text": "Registerbekanntmachung nach dem Umwandlungsgesetz\nNordrhein-Westfalen Amtsgericht Düsseldorf HRB 65202\nIDEENKAPITAL Financial Service GmbH – Düsseldorf",
      "type": "Registerbekanntmachung nach dem Umwandlungsgesetz",
      "state": "Nordrhein-Westfalen",
      "amtsgericht": "Amtsgericht Düsseldorf",
      "registernummer": "HRB 65202",
      "registerart": "HRB",
      "company_name": "IDEENKAPITAL Financial Service GmbH",
      "company_seat": "Düsseldorf",
      "details": "09.04.2025 (Bekanntmachungsdatum)\n\nNordrhein-Westfalen Amtsgericht Düsseldorf HRB 65202\nRegisterbekanntmachung nach dem Umwandlungsgesetz 09.04.2025 (Eintragungsdatum)\n\nIDEENKAPITAL Financial Service GmbH\nGesellschaft mit beschränkter Haftung\nDüsseldorf\n\nDen Gläubigern der an der Verschmelzung beteiligten Rechtsträger ist, wenn sie binnen sechs Monaten nach dem Tag, an dem die Eintragung der Verschmelzung in das Register des Sitzes desjenigen Rechtsträgers, dessen Gläubiger sie sind, nach § 19 Absatz 3 UmwG als bekanntgemacht gilt, ihren Anspruch nach Grund und Höhe schriftlich anmelden, Sicherheit zu leisten, soweit sie nicht Befriedigung verlangen können. Dieses Recht steht den Gläubigern jedoch nur zu, wenn sie glaubhaft machen, dass durch die Verschmelzung die Erfüllung ihrer Forderung gefährdet wird."
    },
    {
      "date": "2025-04-09",
      "id": "106127",
      "original_text": "Registerbekanntmachung nach dem Umwandlungsgesetz\nNordrhein-Westfalen Amtsgericht Münster HRB 14682\nMedia Oelde Gesellschaft mit beschränkter Haftung – Oelde",
      "type": "Registerbekanntmachung nach dem Umwandlungsgesetz",
      "state": "Nordrhein-Westfalen",
      "amtsgericht": "Amtsgericht Münster",
      "registernummer": "HRB 14682",
      "registerart": "HRB",
      "company_name": "Media Oelde Gesellschaft mit beschränkter Haftung",
      "company_seat": "Oelde",
      "details": "09.04.2025 (Bekanntmachungsdatum)\n\nNordrhein-Westfalen Amtsgericht Münster HRB 14682\nRegisterbekanntmachung nach dem Umwandlungsgesetz 09.04.2025 (Eintragungsdatum)\n\nMedia Oelde Gesellschaft mit beschränkter Haftung\nGesellschaft mit beschränkter Haftung\nOelde\n\nDen Gläubigern der an der Verschmelzung beteiligten Rechtsträger ist, wenn sie binnen sechs Monaten nach dem Tag, an dem die Eintragung der Verschmelzung in das Register des Sitzes desjenigen Rechtsträgers, dessen Gläubiger sie sind, nach § 19 Absatz 3 UmwG als bekanntgemacht gilt, ihren Anspruch nach Grund und Höhe schriftlich anmelden, Sicherheit zu leisten, soweit sie nicht Befriedigung verlangen können. Dieses Recht steht den Gläubigern jedoch nur zu, wenn sie glaubhaft machen, dass durch die Verschmelzung die Erfüllung ihrer Forderung gefährdet wird."
    },
    {
      "date": "2025-04-09",
      "id": "106128",
      "original_text": "Einreichung neuer Dokumente\nNordrhein-Westfalen Amtsgericht Bonn HRB 20077\nComfortcharge GmbH – Bonn",
      "type": "Einreichung neuer Dokumente",
      "state": "Nordrhein-Westfalen",
      "amtsgericht": "Amtsgericht Bonn",
      "registernummer": "HRB 20077",
      "registerart": "HRB",
      "company_name": "Comfortcharge GmbH",
      "company_seat": "Bonn",
      "details": "09.04.2025 (Bekanntmachungsdatum)\n\nNordrhein-Westfalen Amtsgericht Bonn HRB 20077\nEinreichung neuer Dokumente 09.04.2025 (Eintragungsdatum)\n\nComfortcharge GmbH\nGesellschaft mit beschränkter Haftung\nBonn\n\nDem Registergericht ist eine neue Liste der Mitglieder des Aufsichtsrates eingereicht worden."
    },
    {
      "date": "2025-04-09",
      "id": "106129",
      "original_text": "Löschungsankündigung\nNordrhein-Westfalen Amtsgericht Dortmund HRB 27562\nBH Verwaltungs GmbH – Dortmund",
      "type": "Löschungsankündigung",
      "state": "Nordrhein-Westfalen",
      "amtsgericht": "Amtsgericht Dortmund",
      "registernummer": "HRB 27562",
      "registerart": "HRB",
      "company_name": "BH Verwaltungs GmbH",
      "company_seat": "Dortmund",
      "details": "09.04.2025 (Bekanntmachungsdatum)\n\nNordrhein-Westfalen Amtsgericht Dortmund HRB 27562\nLöschungsankündigung 09.04.2025 (Eintragungsdatum)\n\nBH Verwaltungs GmbH\nGesellschaft mit beschränkter Haftung\nDortmund\n\nDas Registergericht beabsichtigt die Gesellschaft von Amts wegen nach § 394 FamFG zu löschen. Die Frist zur Erhebung eines Widerspruchs ist auf zwei Monate festgesetzt."
    },
    {
      "date": "2025-04-09",
      "id": "106130",
      "original_text": "Registerbekanntmachung nach dem Umwandlungsgesetz\nNordrhein-Westfalen Amtsgericht Arnsberg HRB 8920\nWIR-KITAs gem. GmbH – Meschede",
      "type": "Registerbekanntmachung nach dem Umwandlungsgesetz",
      "state": "Nordrhein-Westfalen",
      "amtsgericht": "Amtsgericht Arnsberg",
      "registernummer": "HRB 8920",
      "registerart": "HRB",
      "company_name": "WIR-KITAs gem. GmbH",
      "company_seat": "Meschede",
      "details": "09.04.2025 (Bekanntmachungsdatum)\n\nNordrhein-Westfalen Amtsgericht Arnsberg HRB 8920\nRegisterbekanntmachung nach dem Umwandlungsgesetz 09.04.2025 (Eintragungsdatum)\n\nWIR-KITAs gem. GmbH\nGesellschaft mit beschränkter Haftung\nMeschede\n\nDen Gläubigern der an der Verschmelzung beteiligten Rechtsträger ist, wenn sie binnen sechs Monaten nach dem Tag, an dem die Eintragung der Verschmelzung in das Register des Sitzes desjenigen Rechtsträgers, dessen Gläubiger sie sind, nach § 19 Absatz 3 UmwG als bekanntgemacht gilt, ihren Anspruch nach Grund und Höhe schriftlich anmelden, Sicherheit zu leisten, soweit sie nicht Befriedigung verlangen können. Dieses Recht steht den Gläubigern jedoch nur zu, wenn sie glaubhaft machen, dass durch die Verschmelzung die Erfüllung ihrer Forderung gefährdet wird."
    },
    {
      "date": "2025-04-09",
      "id": "106131",
      "original_text": "Registerbekanntmachung nach dem Umwandlungsgesetz\nNordrhein-Westfalen Amtsgericht Münster HRB 7687\nVentilatorenfabrik Oelde, Gesellschaft mit beschränkter Haftung – Oelde",
      "type": "Registerbekanntmachung nach dem Umwandlungsgesetz",
      "state": "Nordrhein-Westfalen",
      "amtsgericht": "Amtsgericht Münster",
      "registernummer": "HRB 7687",
      "registerart": "HRB",
      "company_name": "Ventilatorenfabrik Oelde, Gesellschaft mit beschränkter Haftung",
      "company_seat": "Oelde",
      "details": "09.04.2025 (Bekanntmachungsdatum)\n\nNordrhein-Westfalen Amtsgericht Münster HRB 7687\nRegisterbekanntmachung nach dem Umwandlungsgesetz 09.04.2025 (Eintragungsdatum)\n\nVentilatorenfabrik Oelde, Gesellschaft mit beschränkter Haftung\nGesellschaft mit beschränkter Haftung\nOelde\n\nDen Gläubigern der an der Verschmelzung beteiligten Rechtsträger ist, wenn sie binnen sechs Monaten nach dem Tag, an dem die Eintragung der Verschmelzung in das Register des Sitzes desjenigen Rechtsträgers, dessen Gläubiger sie sind, nach § 19 Absatz 3 UmwG als bekanntgemacht gilt, ihren Anspruch nach Grund und Höhe schriftlich anmelden, Sicherheit zu leisten, soweit sie nicht Befriedigung verlangen können. Dieses Recht steht den Gläubigern jedoch nur zu, wenn sie glaubhaft machen, dass durch die Verschmelzung die Erfüllung ihrer Forderung gefährdet wird."
    },
    {
      "date": "2025-04-09",
      "id": "106132",
      "original_text": "Löschungsankündigung\nNordrhein-Westfalen Amtsgericht Bad Oeynhausen HRB 14568\nExGB GmbH – Minden",
      "type": "Löschungsankündigung",
      "state": "Nordrhein-Westfalen",
      "amtsgericht": "Amtsgericht Bad Oeynhausen",
      "registernummer": "HRB 14568",
      "registerart": "HRB",
      "company_name": "ExGB GmbH",
      "company_seat": "Minden",
      "details": "09.04.2025 (Bekanntmachungsdatum)\n\nNordrhein-Westfalen Amtsgericht Bad Oeynhausen HRB 14568\nLöschungsankündigung\n\nExGB GmbH\nGesellschaft mit beschränkter Haftung\nMinden\n\nDas Registergericht beabsichtigt die Gesellschaft von Amts wegen nach § 394 FamFG zu löschen. Die Frist zur Erhebung eines Widerspruchs ist auf einen Monat festgesetzt."
    },
    {
      "date": "2025-04-09",
      "id": "106133",
      "original_text": "Löschungsankündigung\nNordrhein-Westfalen Amtsgericht Bonn HRB 20763\nDM Baugesellschaft mbH – Bonn",
      "type": "Löschungsankündigung",
      "state": "Nordrhein-Westfalen",
      "amtsgericht": "Amtsgericht Bonn",
      "registernummer": "HRB 20763",
      "registerart": "HRB",
      "company_name": "DM Baugesellschaft mbH",
      "company_seat": "Bonn",
      "details": "09.04.2025 (Bekanntmachungsdatum)\n\nNordrhein-Westfalen Amtsgericht Bonn HRB 20763\nLöschungsankündigung\n\nDM Baugesellschaft mbH\nGesellschaft mit beschränkter Haftung\nBonn\n\nDas Registergericht beabsichtigt die Gesellschaft von Amts wegen nach § 394 FamFG zu löschen. Die Frist zur Erhebung eines Widerspruchs ist auf einen Monat festgesetzt."
    },
    {
      "date": "2025-04-09",
      "id": "106134",
      "original_text": "Registerbekanntmachung nach dem Umwandlungsgesetz\nNordrhein-Westfalen Amtsgericht Bad Oeynhausen HRB 7818\nHellmeier Tief- und Rohrbau GmbH – Rödinghausen",
      "type": "Registerbekanntmachung nach dem Umwandlungsgesetz",
      "state": "Nordrhein-Westfalen",
      "amtsgericht": "Amtsgericht Bad Oeynhausen",
      "registernummer": "HRB 7818",
      "registerart": "HRB",
      "company_name": "Hellmeier Tief- und Rohrbau GmbH",
      "company_seat": "Rödinghausen",
      "details": "09.04.2025 (Bekanntmachungsdatum)\n\nNordrhein-Westfalen Amtsgericht Bad Oeynhausen HRB 7818\nRegisterbekanntmachung nach dem Umwandlungsgesetz 09.04.2025 (Eintragungsdatum)\n\nHellmeier Tief- und Rohrbau GmbH\nGesellschaft mit beschränkter Haftung\nRödinghausen\n\nDen Gläubigern der an der Ausgliederung beteiligten Rechtsträger ist, wenn sie binnen sechs Monaten nach dem Tag, an dem die Eintragung der Ausgliederung in das Register des Sitzes desjenigen Rechtsträgers, dessen Gläubiger sie sind, nach § 19 Absatz 3 UmwG als bekanntgemacht gilt, ihren Anspruch nach Grund und Höhe schriftlich anmelden, Sicherheit zu leisten, soweit sie nicht Befriedigung verlangen können. Dieses Recht steht den Gläubigern jedoch nur zu, wenn sie glaubhaft machen, dass durch die Ausgliederung die Erfüllung ihrer Forderung gefährdet wird."
    },
    {
      "date": "2025-04-09",
      "id": "106135",
      "original_text": "Einreichung neuer Dokumente\nHessen Amtsgericht Frankfurt am Main HRB 84508\nDeka Investors Spezialinvestmentaktiengesellschaft mit veränderlichem Kapital und Teilgesellschaftsvermögen – Frankfurt am Main",
      "type": "Einreichung neuer Dokumente",
      "state": "Hessen",
      "amtsgericht": "Amtsgericht Frankfurt am Main",
      "registernummer": "HRB 84508",
      "registerart": "HRB",
      "company_name": "Deka Investors Spezialinvestmentaktiengesellschaft mit veränderlichem Kapital und Teilgesellschaftsvermögen",
      "company_seat": "Frankfurt am Main",
      "details": "09.04.2025 (Bekanntmachungsdatum)\n\nHessen Amtsgericht Frankfurt am Main HRB 84508\nEinreichung neuer Dokumente 07.04.2025 (Eintragungsdatum)\n\nDeka Investors Spezialinvestmentaktiengesellschaft mit veränderlichem Kapital und Teilgesellschaftsvermögen\nAktiengesellschaft\nFrankfurt am Main\n\nDurch eine Änderung in den Personen der Aufsichtsratsmitglieder ist eine Liste der Mitglieder des Aufsichtsrates zum Handelsregister eingereicht worden."
    },
    {
      "date": "2025-04-09",
      "id": "106136",
      "original_text": "Einreichung neuer Dokumente\nHessen Amtsgericht Hanau HRB 7462\nBeteiligungsHolding Hanau GmbH – Hanau",
      "type": "Einreichung neuer Dokumente",
      "state": "Hessen",
      "amtsgericht": "Amtsgericht Hanau",
      "registernummer": "HRB 7462",
      "registerart": "HRB",
      "company_name": "BeteiligungsHolding Hanau GmbH",
      "company_seat": "Hanau",
      "details": "09.04.2025 (Bekanntmachungsdatum)\n\nHessen Amtsgericht Hanau HRB 7462\nEinreichung neuer Dokumente\n\nBeteiligungsHolding Hanau GmbH\nGesellschaft mit beschränkter Haftung\nHanau\n\nDurch eine Änderung in den Personen der Aufsichtsratsmitglieder ist eine Liste der Mitglieder des Aufsichtsrates zum Handelsregister eingereicht worden."
    },
    {
      "date": "2025-04-09",
      "id": "106137",
      "original_text": "Löschungsankündigung\nHessen Amtsgericht Frankfurt am Main HRB 107915\nHexpa Holding UG (haftungsbeschränkt) – Hofheim am Taunus",
      "type": "Löschungsankündigung",
      "state": "Hessen",
      "amtsgericht": "Amtsgericht Frankfurt am Main",
      "registernummer": "HRB 107915",
      "registerart": "HRB",
      "company_name": "Hexpa Holding UG (haftungsbeschränkt)",
      "company_seat": "Hofheim am Taunus",
      "details": "09.04.2025 (Bekanntmachungsdatum)\n\nHessen Amtsgericht Frankfurt am Main HRB 107915\nLöschungsankündigung 09.04.2025 (Eintragungsdatum)\n\nHexpa Holding UG (haftungsbeschränkt)\nGesellschaft mit beschränkter Haftung\nHofheim am Taunus\n\nDas Registergericht beabsichtigt die im Handelsregister eingetragene Gesellschaft von Amts wegen nach § 394 FamFG zu löschen. Die Frist zur Erhebung eines Widerspruchs gegen die beabsichtigte Löschung wird auf 1 Monat festgesetzt."
    }
  ]
}