{
  "date": "2025-04-18",
  "date_of_scrape": "2025-05-30T15:40:45.487Z",
  "tool_version": "0.2.0",
  "number_of_announcements": 44,
  "announcements": [
    {
      "date": "2025-04-18",
      "id": "106937",
      "original_text": "Löschungsankündigung\nBayern Amtsgericht Ingolstadt HRB 9472\nA.M.Dienstleistung UG (haftungsbeschränkt) – Ilmmünster",
      "type": "Löschungsankündigung",
      "state": "Bayern",
      "amtsgericht": "Amtsgericht Ingolstadt",
      "registernummer": "HRB 9472",
      "registerart": "HRB",
      "company_name": "A.M.Dienstleistung UG (haftungsbeschränkt)",
      "company_seat": "Ilmmünster",
      "details": "18.04.2025 (Bekanntmachungsdatum)\n\nBayern Amtsgericht Ingolstadt HRB 9472\nLöschungsankündigung\n\nA.M.Dienstleistung UG (haftungsbeschränkt)\nGesellschaft mit beschränkter Haftung\nIlmmünster\n\nDas Registergericht beabsichtigt, die im Handelsregister eingetragene Gesellschaft wegen Vermögenslosigkeit von Amts wegen nach § 394 FamFG zu löschen. Die Frist zur Erhebung eines Widerspruchs ist auf einen Monat festgesetzt."
    },
    {
      "date": "2025-04-18",
      "id": "106938",
      "original_text": "Registerbekanntmachung nach dem Umwandlungsgesetz\nBayern Amtsgericht München HRB 295075\nSilk Road TopCo GmbH – München",
      "type": "Registerbekanntmachung nach dem Umwandlungsgesetz",
      "state": "Bayern",
      "amtsgericht": "Amtsgericht München",
      "registernummer": "HRB 295075",
      "registerart": "HRB",
      "company_name": "Silk Road TopCo GmbH",
      "company_seat": "München",
      "details": "18.04.2025 (Bekanntmachungsdatum)\n\nBayern Amtsgericht München HRB 295075\nRegisterbekanntmachung nach dem Umwandlungsgesetz 17.04.2025 (Eintragungsdatum)\n\nSilk Road TopCo GmbH\nGesellschaft mit beschränkter Haftung\nMünchen\n\nDen Gläubigern der an der Verschmelzung beteiligten Rechtsträger ist, wenn sie binnen sechs Monaten nach dem Tag, an dem die Eintragung der Verschmelzung in das Register des Sitzes desjenigen Rechtsträgers, dessen Gläubiger sie sind, nach § 19 Abs. 3 UmwG als bekannt gemacht gilt, ihren Anspruch nach Grund und Höhe in Textform anmelden, Sicherheit zu leisten, soweit sie nicht Befriedigung verlangen können. Dieses Recht steht den Gläubigern jedoch nur zu, wenn sie glaubhaft machen, dass durch die Verschmelzung die Erfüllung ihrer Forderung gefährdet wird."
    },
    {
      "date": "2025-04-18",
      "id": "106939",
      "original_text": "Registerbekanntmachung nach dem Umwandlungsgesetz\nBayern Amtsgericht Ingolstadt HRB 12277\nAiglstorfer Unternehmensberatung GmbH – Gaimersheim",
      "type": "Registerbekanntmachung nach dem Umwandlungsgesetz",
      "state": "Bayern",
      "amtsgericht": "Amtsgericht Ingolstadt",
      "registernummer": "HRB 12277",
      "registerart": "HRB",
      "company_name": "Aiglstorfer Unternehmensberatung GmbH",
      "company_seat": "Gaimersheim",
      "details": "18.04.2025 (Bekanntmachungsdatum)\n\nBayern Amtsgericht Ingolstadt HRB 12277\nRegisterbekanntmachung nach dem Umwandlungsgesetz 17.04.2025 (Eintragungsdatum)\n\nAiglstorfer Unternehmensberatung GmbH\nGesellschaft mit beschränkter Haftung\nGaimersheim\n\nDen Gläubigern des formwechselnden Rechtsträgers ist, wenn sie binnen sechs Monaten nach dem Tag, an dem die Eintragung des Formwechsels nach § 201 UmwG als bekannt gemacht gilt, ihren Anspruch nach Grund und Höhe in Textform anmelden, Sicherheit zu leisten, soweit sie nicht Befriedigung verlangen können. Dieses Recht steht den Gläubigern jedoch nur zu, wenn sie glaubhaft machen, dass durch den Formwechsel die Erfüllung ihrer Forderung gefährdet wird."
    },
    {
      "date": "2025-04-18",
      "id": "106940",
      "original_text": "Löschungsankündigung\nBayern Amtsgericht München HRB 190840\nTM Security GmbH – Wolfratshausen",
      "type": "Löschungsankündigung",
      "state": "Bayern",
      "amtsgericht": "Amtsgericht München",
      "registernummer": "HRB 190840",
      "registerart": "HRB",
      "company_name": "TM Security GmbH",
      "company_seat": "Wolfratshausen",
      "details": "18.04.2025 (Bekanntmachungsdatum)\n\nBayern Amtsgericht München HRB 190840\nLöschungsankündigung 17.04.2025 (Eintragungsdatum)\n\nTM Security GmbH\nGesellschaft mit beschränkter Haftung\nWolfratshausen\n\nDas Registergericht beabsichtigt, die im Handelsregister eingetragene Gesellschaft wegen Vermögenslosigkeit von Amts wegen nach § 394 FamFG zu löschen. Die Frist zur Erhebung eines Widerspruchs ist auf drei Monate festgesetzt."
    },
    {
      "date": "2025-04-18",
      "id": "106941",
      "original_text": "Registerbekanntmachung nach dem Umwandlungsgesetz\nBayern Amtsgericht München HRB 177695\nAP Solutions GmbH – München",
      "type": "Registerbekanntmachung nach dem Umwandlungsgesetz",
      "state": "Bayern",
      "amtsgericht": "Amtsgericht München",
      "registernummer": "HRB 177695",
      "registerart": "HRB",
      "company_name": "AP Solutions GmbH",
      "company_seat": "München",
      "details": "18.04.2025 (Bekanntmachungsdatum)\n\nBayern Amtsgericht München HRB 177695\nRegisterbekanntmachung nach dem Umwandlungsgesetz\n\nAP Solutions GmbH\nGesellschaft mit beschränkter Haftung\nMünchen\n\nEs wird darauf hingewiesen, dass ein Verschmelzungsplan oder sein Entwurf über eine grenzüberschreitende Verschmelzung zur Aufnahme mit der AVS Automotive Versicherungsvermittlung GmbH mit Sitz in Wien/Österreich (Österreichisches Firmenbuch 164216 w) (Gesellschaft mit beschränkter Haftung nach österreichischem Recht) sowie mit der AWP Austria GmbH mit Sitz in Wien/Österreich (Österreichisches Firmenbuch 151080 b) (Gesellschaft mit beschränkter Haftung nach österreichischem Recht) beim Handelsregister eingereicht worden ist.\nDie Anteilsinhaber, die Gläubiger sowie die zuständigen Betriebsräte der an der grenzüberschreitenden Verschmelzung beteiligten Gesellschaften oder, soweit es keinen Betriebsrat gibt, die Arbeitnehmer der an der grenzüberschreitenden Verschmelzung beteiligten Gesellschaften, können der jeweiligen Gesellschaft spätestens fünf Arbeitstage vor dem Tag der Gesellschafterversammlung Bemerkungen zum Verschmelzungsplan übermitteln.\nEntsprechende Bemerkungen können an folgende Anschrift gerichtet werden: Heide Freynhofer, AP Solutions GmbH, Atelierstraße 14, 81671 München oder per E-Mail an azp-transformation-taskforce@allianz.com"
    },
    {
      "date": "2025-04-18",
      "id": "106942",
      "original_text": "Registerbekanntmachung nach dem Umwandlungsgesetz\nBayern Amtsgericht Aschaffenburg HRA 1713\nWalter Graumann GmbH & Co. KG – Mömlingen",
      "type": "Registerbekanntmachung nach dem Umwandlungsgesetz",
      "state": "Bayern",
      "amtsgericht": "Amtsgericht Aschaffenburg",
      "registernummer": "HRA 1713",
      "registerart": "HRA",
      "company_name": "Walter Graumann GmbH & Co. KG",
      "company_seat": "Mömlingen",
      "details": "18.04.2025 (Bekanntmachungsdatum)\n\nBayern Amtsgericht Aschaffenburg HRA 1713\nRegisterbekanntmachung nach dem Umwandlungsgesetz 17.04.2025 (Eintragungsdatum)\n\nWalter Graumann GmbH & Co. KG\nKommanditgesellschaft\nMömlingen\n\nDen Gläubigern der an der Spaltung beteiligten Rechtsträger ist, wenn sie binnen sechs Monaten nach dem Tag, an dem die Eintragung der Spaltung in das Register des Sitzes desjenigen Rechtsträgers, dessen Gläubiger sie sind, nach §§ 125, 19 Abs. 3 UmwG als bekannt gemacht gilt, ihren Anspruch nach Grund und Höhe in Textform anmelden, Sicherheit zu leisten, soweit sie nicht Befriedigung verlangen können. Dieses Recht steht den Gläubigern jedoch nur zu, wenn sie glaubhaft machen, dass durch die Spaltung die Erfüllung ihrer Forderung gefährdet wird."
    },
    {
      "date": "2025-04-18",
      "id": "106943",
      "original_text": "Einreichung neuer Dokumente\nBayern Amtsgericht Augsburg HRB 28263\nvon Marschall Liegenschaften AG – Mering",
      "type": "Einreichung neuer Dokumente",
      "state": "Bayern",
      "amtsgericht": "Amtsgericht Augsburg",
      "registernummer": "HRB 28263",
      "registerart": "HRB",
      "company_name": "von Marschall Liegenschaften AG",
      "company_seat": "Mering",
      "details": "18.04.2025 (Bekanntmachungsdatum)\n\nBayern Amtsgericht Augsburg HRB 28263\nEinreichung neuer Dokumente 24.03.2025 (Eintragungsdatum)\n\nvon Marschall Liegenschaften AG\nAktiengesellschaft\nMering\n\nDem Amtsgericht Augsburg -Registergericht- ist eine Liste der Mitglieder des Aufsichtsrats eingereicht worden, § 106 AktG."
    },
    {
      "date": "2025-04-18",
      "id": "106944",
      "original_text": "Registerbekanntmachung nach dem Umwandlungsgesetz\nBayern Amtsgericht Kempten (Allgäu) HRA 11611\nBHKW WiSchu GmbH & Co. KG – Pfronten",
      "type": "Registerbekanntmachung nach dem Umwandlungsgesetz",
      "state": "Bayern",
      "amtsgericht": "Amtsgericht Kempten (Allgäu)",
      "registernummer": "HRA 11611",
      "registerart": "HRA",
      "company_name": "BHKW WiSchu GmbH & Co. KG",
      "company_seat": "Pfronten",
      "details": "18.04.2025 (Bekanntmachungsdatum)\n\nBayern Amtsgericht Kempten (Allgäu) HRA 11611\nRegisterbekanntmachung nach dem Umwandlungsgesetz 17.04.2025 (Eintragungsdatum)\n\nBHKW WiSchu GmbH & Co. KG\nKommanditgesellschaft\nPfronten\n\nDas unter der HRA Nummer 11580 eingetragene Einzelunternehmen BHKW Heizung e.K. wurde durch Ausgliederung auf die unter der HRA Nummer 11611 eingetragene BHKW WiSchu GmbH & Co. KG übertragen.\nDen Gläubigern der an der Ausgliederung beteiligten Rechtsträger ist, wenn sie binnen sechs Monaten nach dem Tag, an dem die Eintragung der Ausgliederung in das Register des Sitzes desjenigen Rechtsträgers, dessen Gläubiger sie sind, nach §§ 125, 19 Abs. 3 UmwG als bekannt gemacht gilt, ihren Anspruch nach Grund und Höhe in Textform anmelden, Sicherheit zu leisten, soweit sie nicht Befriedigung verlangen können. Dieses Recht steht den Gläubigern jedoch nur zu, wenn sie glaubhaft machen, dass durch die Ausgliederung die Erfüllung ihrer Forderung gefährdet wird."
    },
    {
      "date": "2025-04-18",
      "id": "106945",
      "original_text": "Einreichung neuer Dokumente\nBayern Amtsgericht München HRB 211308\nAURELIUS Management SE – Grünwald",
      "type": "Einreichung neuer Dokumente",
      "state": "Bayern",
      "amtsgericht": "Amtsgericht München",
      "registernummer": "HRB 211308",
      "registerart": "HRB",
      "company_name": "AURELIUS Management SE",
      "company_seat": "Grünwald",
      "details": "18.04.2025 (Bekanntmachungsdatum)\n\nBayern Amtsgericht München HRB 211308\nEinreichung neuer Dokumente\n\nAURELIUS Management SE\nEuropäische Aktiengesellschaft (SE)\nGrünwald\n\nDem Amtsgericht München -Registergericht- ist eine Liste der Mitglieder des Aufsichtsrats eingereicht worden, Art. 9 Abs. 1 Buchst. c (ii) SE-VO i.V.m. § 106 AktG."
    },
    {
      "date": "2025-04-18",
      "id": "106946",
      "original_text": "Löschungsankündigung\nBayern Amtsgericht Nürnberg HRB 34506\nDRWS Clothing GmbH – Nürnberg",
      "type": "Löschungsankündigung",
      "state": "Bayern",
      "amtsgericht": "Amtsgericht Nürnberg",
      "registernummer": "HRB 34506",
      "registerart": "HRB",
      "company_name": "DRWS Clothing GmbH",
      "company_seat": "Nürnberg",
      "details": "18.04.2025 (Bekanntmachungsdatum)\n\nBayern Amtsgericht Nürnberg HRB 34506\nLöschungsankündigung\n\nDRWS Clothing GmbH\nGesellschaft mit beschränkter Haftung\nNürnberg\n\nDas Registergericht beabsichtigt, die im Handelsregister eingetragene Gesellschaft wegen Vermögenslosigkeit von Amts wegen nach § 394 FamFG zu löschen. Die Frist zur Erhebung eines Widerspruchs ist auf einen Monat festgesetzt."
    },
    {
      "date": "2025-04-18",
      "id": "106947",
      "original_text": "Registerbekanntmachung nach dem Umwandlungsgesetz\nBayern Amtsgericht Ingolstadt HRB 5351\nAiglstorfer Unternehmensberatung AG – Gaimersheim",
      "type": "Registerbekanntmachung nach dem Umwandlungsgesetz",
      "state": "Bayern",
      "amtsgericht": "Amtsgericht Ingolstadt",
      "registernummer": "HRB 5351",
      "registerart": "HRB",
      "company_name": "Aiglstorfer Unternehmensberatung AG",
      "company_seat": "Gaimersheim",
      "details": "18.04.2025 (Bekanntmachungsdatum)\n\nBayern Amtsgericht Ingolstadt HRB 5351\nRegisterbekanntmachung nach dem Umwandlungsgesetz 17.04.2025 (Eintragungsdatum)\n\nAiglstorfer Unternehmensberatung AG\nAktiengesellschaft\nGaimersheim\n\nDen Gläubigern des formwechselnden Rechtsträgers ist, wenn sie binnen sechs Monaten nach dem Tag, an dem die Eintragung des Formwechsels nach § 201 UmwG als bekannt gemacht gilt, ihren Anspruch nach Grund und Höhe in Textform anmelden, Sicherheit zu leisten, soweit sie nicht Befriedigung verlangen können. Dieses Recht steht den Gläubigern jedoch nur zu, wenn sie glaubhaft machen, dass durch den Formwechsel die Erfüllung ihrer Forderung gefährdet wird."
    },
    {
      "date": "2025-04-18",
      "id": "106948",
      "original_text": "Löschungsankündigung\nBayern Amtsgericht Nürnberg HRB 33910\nFeel your destiny UG (haftungsbeschränkt) – Nürnberg",
      "type": "Löschungsankündigung",
      "state": "Bayern",
      "amtsgericht": "Amtsgericht Nürnberg",
      "registernummer": "HRB 33910",
      "registerart": "HRB",
      "company_name": "Feel your destiny UG (haftungsbeschränkt)",
      "company_seat": "Nürnberg",
      "details": "18.04.2025 (Bekanntmachungsdatum)\n\nBayern Amtsgericht Nürnberg HRB 33910\nLöschungsankündigung\n\nFeel your destiny UG (haftungsbeschränkt)\nGesellschaft mit beschränkter Haftung\nNürnberg\n\nDas Registergericht beabsichtigt, die im Handelsregister eingetragene Gesellschaft wegen Vermögenslosigkeit von Amts wegen nach § 394 FamFG zu löschen. Die Frist zur Erhebung eines Widerspruchs ist auf einen Monat festgesetzt."
    },
    {
      "date": "2025-04-18",
      "id": "106949",
      "original_text": "Löschungsankündigung\nBayern Amtsgericht Traunstein HRB 21422\nWHN Technologies GmbH – Grabenstätt",
      "type": "Löschungsankündigung",
      "state": "Bayern",
      "amtsgericht": "Amtsgericht Traunstein",
      "registernummer": "HRB 21422",
      "registerart": "HRB",
      "company_name": "WHN Technologies GmbH",
      "company_seat": "Grabenstätt",
      "details": "18.04.2025 (Bekanntmachungsdatum)\n\nBayern Amtsgericht Traunstein HRB 21422\nLöschungsankündigung\n\nWHN Technologies GmbH\nGesellschaft mit beschränkter Haftung\nGrabenstätt\n\nDas Registergericht beabsichtigt, die im Handelsregister eingetragene Gesellschaft wegen Vermögenslosigkeit von Amts wegen nach § 394 FamFG zu löschen. Die Frist zur Erhebung eines Widerspruchs ist auf drei Monate festgesetzt."
    },
    {
      "date": "2025-04-18",
      "id": "106950",
      "original_text": "Registerbekanntmachung nach dem Umwandlungsgesetz\nBayern Amtsgericht München HRA 120600\nHeil Gerüstbau e.K. – Dorfen",
      "type": "Registerbekanntmachung nach dem Umwandlungsgesetz",
      "state": "Bayern",
      "amtsgericht": "Amtsgericht München",
      "registernummer": "HRA 120600",
      "registerart": "HRA",
      "company_name": "Heil Gerüstbau e.K.",
      "company_seat": "Dorfen",
      "details": "18.04.2025 (Bekanntmachungsdatum)\n\nBayern Amtsgericht München HRA 120600\nRegisterbekanntmachung nach dem Umwandlungsgesetz 17.04.2025 (Eintragungsdatum)\n\nHeil Gerüstbau e.K.\nEinzelkaufmann / Einzelkauffrau\nDorfen\n\nDen Gläubigern der an der Ausgliederung beteiligten Rechtsträger ist, wenn sie binnen sechs Monaten nach dem Tag, an dem die Eintragung der Ausgliederung in das Register des Sitzes desjenigen Rechtsträgers, dessen Gläubiger sie sind, nach §§ 125, 19 Abs. 3 UmwG als bekannt gemacht gilt, ihren Anspruch nach Grund und Höhe in Textform anmelden, Sicherheit zu leisten, soweit sie nicht Befriedigung verlangen können. Dieses Recht steht den Gläubigern jedoch nur zu, wenn sie glaubhaft machen, dass durch die Ausgliederung die Erfüllung ihrer Forderung gefährdet wird."
    },
    {
      "date": "2025-04-18",
      "id": "106951",
      "original_text": "Löschungsankündigung\nBayern Amtsgericht Memmingen HRB 18323\nMBS aitiservice UG (haftungsbeschränkt) – Neu-Ulm",
      "type": "Löschungsankündigung",
      "state": "Bayern",
      "amtsgericht": "Amtsgericht Memmingen",
      "registernummer": "HRB 18323",
      "registerart": "HRB",
      "company_name": "MBS aitiservice UG (haftungsbeschränkt)",
      "company_seat": "Neu-Ulm",
      "details": "18.04.2025 (Bekanntmachungsdatum)\n\nBayern Amtsgericht Memmingen HRB 18323\nLöschungsankündigung\n\nMBS aitiservice UG (haftungsbeschränkt)\nGesellschaft mit beschränkter Haftung\nNeu-Ulm\n\nDas Registergericht beabsichtigt, die im Handelsregister eingetragene Gesellschaft wegen Vermögenslosigkeit von Amts wegen nach § 394 FamFG zu löschen. Die Frist zur Erhebung eines Widerspruchs ist auf einen Monat festgesetzt."
    },
    {
      "date": "2025-04-18",
      "id": "106952",
      "original_text": "Registerbekanntmachung nach dem Umwandlungsgesetz\nBayern Amtsgericht München HRA 69180\nHerrhammer Transporte OHG – München",
      "type": "Registerbekanntmachung nach dem Umwandlungsgesetz",
      "state": "Bayern",
      "amtsgericht": "Amtsgericht München",
      "registernummer": "HRA 69180",
      "registerart": "HRA",
      "company_name": "Herrhammer Transporte OHG",
      "company_seat": "München",
      "details": "18.04.2025 (Bekanntmachungsdatum)\n\nBayern Amtsgericht München HRA 69180\nRegisterbekanntmachung nach dem Umwandlungsgesetz 17.04.2025 (Eintragungsdatum)\n\nHerrhammer Transporte OHG\nOffene Handelsgesellschaft\nMünchen\n\nDen Gläubigern des formwechselnden Rechtsträgers ist, wenn sie binnen sechs Monaten nach dem Tag, an dem die Eintragung des Formwechsels nach § 201 UmwG als bekannt gemacht gilt, ihren Anspruch nach Grund und Höhe in Textform anmelden, Sicherheit zu leisten, soweit sie nicht Befriedigung verlangen können. Dieses Recht steht den Gläubigern jedoch nur zu, wenn sie glaubhaft machen, dass durch den Formwechsel die Erfüllung ihrer Forderung gefährdet wird."
    },
    {
      "date": "2025-04-18",
      "id": "106953",
      "original_text": "Registerbekanntmachung nach dem Umwandlungsgesetz\nBayern Amtsgericht München HRB 177695\nAP Solutions GmbH – München",
      "type": "Registerbekanntmachung nach dem Umwandlungsgesetz",
      "state": "Bayern",
      "amtsgericht": "Amtsgericht München",
      "registernummer": "HRB 177695",
      "registerart": "HRB",
      "company_name": "AP Solutions GmbH",
      "company_seat": "München",
      "details": "18.04.2025 (Bekanntmachungsdatum)\n\nBayern Amtsgericht München HRB 177695\nRegisterbekanntmachung nach dem Umwandlungsgesetz\n\nAP Solutions GmbH\nGesellschaft mit beschränkter Haftung\nMünchen\n\nEs wird darauf hingewiesen, dass ein Verschmelzungsplan oder sein Entwurf über eine grenzüberschreitende Verschmelzung zur Aufnahme mit der AWP HELLAS ANONYMI ETAIREIA MESITES ASFALISEON, ODIKIS VOITHEIAS KAI PAROCHIS YPIRESION\n(mit der unterscheidungskräftigen Bezeichnung: AWP Brokers & Services Hellas S.A.),\nmit Sitz in Agios Dimitrios, Attika/Griechenland (eingetragen im\nAllgemeinen Griechischen Handelsregister/Geniko Emporiko Mitroo (G.E.MI.) unter der Registrierungsnummer 124192201000) (anonymi etaireia - Aktiengesellschaft nach griechischem Recht) beim Handelsregister eingereicht worden ist.\nDie Anteilsinhaber, die Gläubiger sowie die zuständigen Betriebsräte der an der grenzüberschreitenden Verschmelzung beteiligten Gesellschaften oder, soweit es keinen Betriebsrat gibt, die Arbeitnehmer der an der grenzüberschreitenden Verschmelzung beteiligten Gesellschaften, können der jeweiligen Gesellschaft spätestens fünf Arbeitstage vor dem Tag der Gesellschafterversammlung Bemerkungen zum Verschmelzungsplan übermitteln.\nEntsprechende Bemerkungen können an folgende Anschrift gerichtet werden: Heide Freynhofer, AP Solutions GmbH, Atelierstraße 14, 81671 München oder per E-Mail an azp-transformation-taskforce@allianz.com"
    },
    {
      "date": "2025-04-18",
      "id": "106954",
      "original_text": "Registerbekanntmachung nach dem Umwandlungsgesetz\nBayern Amtsgericht Kempten (Allgäu) HRA 11580\nBHKW Heizung e.K. – Pfronten",
      "type": "Registerbekanntmachung nach dem Umwandlungsgesetz",
      "state": "Bayern",
      "amtsgericht": "Amtsgericht Kempten (Allgäu)",
      "registernummer": "HRA 11580",
      "registerart": "HRA",
      "company_name": "BHKW Heizung e.K.",
      "company_seat": "Pfronten",
      "details": "18.04.2025 (Bekanntmachungsdatum)\n\nBayern Amtsgericht Kempten (Allgäu) HRA 11580\nRegisterbekanntmachung nach dem Umwandlungsgesetz 17.04.2025 (Eintragungsdatum)\n\nBHKW Heizung e.K.\nEinzelkaufmann / Einzelkauffrau\nPfronten\n\nDas unter der HRA Nr. 11580 eingetragene Einzelunternehmen BHKW Heizung e.K. wurde durch Ausgliederung auf die unter der HRA Nummer 11611 eingetragene BHKW WiSchu GmbH & Co. KR übertragen.\nDen Gläubigern der an der Ausgliederung beteiligten Rechtsträger ist, wenn sie binnen sechs Monaten nach dem Tag, an dem die Eintragung der Ausgliederung in das Register des Sitzes desjenigen Rechtsträgers, dessen Gläubiger sie sind, nach §§ 125, 19 Abs. 3 UmwG als bekannt gemacht gilt, ihren Anspruch nach Grund und Höhe in Textform anmelden, Sicherheit zu leisten, soweit sie nicht Befriedigung verlangen können. Dieses Recht steht den Gläubigern jedoch nur zu, wenn sie glaubhaft machen, dass durch die Ausgliederung die Erfüllung ihrer Forderung gefährdet wird."
    },
    {
      "date": "2025-04-18",
      "id": "106955",
      "original_text": "Registerbekanntmachung nach dem Umwandlungsgesetz\nBayern Amtsgericht München HRB 247166\nVT Transport GmbH – München",
      "type": "Registerbekanntmachung nach dem Umwandlungsgesetz",
      "state": "Bayern",
      "amtsgericht": "Amtsgericht München",
      "registernummer": "HRB 247166",
      "registerart": "HRB",
      "company_name": "VT Transport GmbH",
      "company_seat": "München",
      "details": "18.04.2025 (Bekanntmachungsdatum)\n\nBayern Amtsgericht München HRB 247166\nRegisterbekanntmachung nach dem Umwandlungsgesetz 17.04.2025 (Eintragungsdatum)\n\nVT Transport GmbH\nGesellschaft mit beschränkter Haftung\nMünchen\n\nDen Gläubigern der an der Verschmelzung beteiligten Rechtsträger ist, wenn sie binnen sechs Monaten nach dem Tag, an dem die Eintragung der Verschmelzung in das Register des Sitzes desjenigen Rechtsträgers, dessen Gläubiger sie sind, nach § 19 Abs. 3 UmwG als bekannt gemacht gilt, ihren Anspruch nach Grund und Höhe in Textform anmelden, Sicherheit zu leisten, soweit sie nicht Befriedigung verlangen können. Dieses Recht steht den Gläubigern jedoch nur zu, wenn sie glaubhaft machen, dass durch die Verschmelzung die Erfüllung ihrer Forderung gefährdet wird.Den Gläubigern der an der Verschmelzung beteiligten Rechtsträger ist, wenn sie binnen sechs Monaten nach dem Tag, an dem die Eintragung der Verschmelzung in das Register des Sitzes desjenigen Rechtsträgers, dessen Gläubiger sie sind, nach § 19 Abs. 3 UmwG als bekannt gemacht gilt, ihren Anspruch nach Grund und Höhe in Textform anmelden, Sicherheit zu leisten, soweit sie nicht Befriedigung verlangen können. Dieses Recht steht den Gläubigern jedoch nur zu, wenn sie glaubhaft machen, dass durch die Verschmelzung die Erfüllung ihrer Forderung gefährdet wird."
    },
    {
      "date": "2025-04-18",
      "id": "106956",
      "original_text": "Einreichung neuer Dokumente\nBayern Amtsgericht München HRB 110001\nBayerische Landesbrandversicherung Aktiengesellschaft – München",
      "type": "Einreichung neuer Dokumente",
      "state": "Bayern",
      "amtsgericht": "Amtsgericht München",
      "registernummer": "HRB 110001",
      "registerart": "HRB",
      "company_name": "Bayerische Landesbrandversicherung Aktiengesellschaft",
      "company_seat": "München",
      "details": "18.04.2025 (Bekanntmachungsdatum)\n\nBayern Amtsgericht München HRB 110001\nEinreichung neuer Dokumente 17.04.2025 (Eintragungsdatum)\n\nBayerische Landesbrandversicherung Aktiengesellschaft\nAktiengesellschaft\nMünchen\n\nDem Amtsgericht München -Registergericht- ist eine Liste der Mitglieder des Aufsichtsrats eingereicht worden, § 106 AktG."
    },
    {
      "date": "2025-04-18",
      "id": "106957",
      "original_text": "Einreichung neuer Dokumente\nBayern Amtsgericht München HRB 166907\nInstitut für Vermögensaufbau (IVA) Aktiengesellschaft – München",
      "type": "Einreichung neuer Dokumente",
      "state": "Bayern",
      "amtsgericht": "Amtsgericht München",
      "registernummer": "HRB 166907",
      "registerart": "HRB",
      "company_name": "Institut für Vermögensaufbau (IVA) Aktiengesellschaft",
      "company_seat": "München",
      "details": "18.04.2025 (Bekanntmachungsdatum)\n\nBayern Amtsgericht München HRB 166907\nEinreichung neuer Dokumente 17.04.2025 (Eintragungsdatum)\n\nInstitut für Vermögensaufbau (IVA) Aktiengesellschaft\nAktiengesellschaft\nMünchen\n\nDem Amtsgericht München -Registergericht- ist eine Liste der Mitglieder des Aufsichtsrats eingereicht worden, § 106 AktG."
    },
    {
      "date": "2025-04-18",
      "id": "106958",
      "original_text": "Registerbekanntmachung nach dem Umwandlungsgesetz\nBayern Amtsgericht Nürnberg HRA 19672\nGül Erhan e. K. – Nürnberg",
      "type": "Registerbekanntmachung nach dem Umwandlungsgesetz",
      "state": "Bayern",
      "amtsgericht": "Amtsgericht Nürnberg",
      "registernummer": "HRA 19672",
      "registerart": "HRA",
      "company_name": "Gül Erhan e. K.",
      "company_seat": "Nürnberg",
      "details": "18.04.2025 (Bekanntmachungsdatum)\n\nBayern Amtsgericht Nürnberg HRA 19672\nRegisterbekanntmachung nach dem Umwandlungsgesetz 17.04.2025 (Eintragungsdatum)\n\nGül Erhan e. K.\nEinzelkaufmann / Einzelkauffrau\nNürnberg\n\nDen Gläubigern der an der Ausgliederung beteiligten Rechtsträger ist, wenn sie binnen sechs Monaten nach dem Tag, an dem die Eintragung der Ausgliederung in das Register des Sitzes desjenigen Rechtsträgers, dessen Gläubiger sie sind, nach §§ 125, 19 Abs. 3 UmwG als bekannt gemacht gilt, ihren Anspruch nach Grund und Höhe in Textform anmelden, Sicherheit zu leisten, soweit sie nicht Befriedigung verlangen können. Dieses Recht steht den Gläubigern jedoch nur zu, wenn sie glaubhaft machen, dass durch die Ausgliederung die Erfüllung ihrer Forderung gefährdet wird."
    },
    {
      "date": "2025-04-18",
      "id": "106959",
      "original_text": "Registerbekanntmachung nach dem Umwandlungsgesetz\nBayern Amtsgericht München HRB 177695\nAP Solutions GmbH – München",
      "type": "Registerbekanntmachung nach dem Umwandlungsgesetz",
      "state": "Bayern",
      "amtsgericht": "Amtsgericht München",
      "registernummer": "HRB 177695",
      "registerart": "HRB",
      "company_name": "AP Solutions GmbH",
      "company_seat": "München",
      "details": "18.04.2025 (Bekanntmachungsdatum)\n\nBayern Amtsgericht München HRB 177695\nRegisterbekanntmachung nach dem Umwandlungsgesetz\n\nAP Solutions GmbH\nGesellschaft mit beschränkter Haftung\nMünchen\n\nEs wird darauf hingewiesen, dass ein Verschmelzungsplan oder sein Entwurf über eine grenzüberschreitende Verschmelzung zur Aufnahme mit der AWP Services Belgium NV/SA mit Sitz in Brüssel/Belgien (Kruispuntbank van Ondernemingen/Banque-Carrefour des Entreprises/Zentrale Unternehmensdatenbank 0417.019.925) (naamloze vennootschap/ société anonyme/  Aktiengesellschaft nach belgischem Recht) beim Handelsregister eingereicht worden ist.\nDie Anteilsinhaber, die Gläubiger sowie die zuständigen Betriebsräte der an der grenzüberschreitenden Verschmelzung beteiligten Gesellschaften oder, soweit es keinen Betriebsrat gibt, die Arbeitnehmer der an der grenzüberschreitenden Verschmelzung beteiligten Gesellschaften, können der jeweiligen Gesellschaft spätestens fünf Arbeitstage vor dem Tag der Gesellschafterversammlung Bemerkungen zum Verschmelzungsplan übermitteln.\nEntsprechende Bemerkungen können an folgende Anschrift gerichtet werden: Heide Freynhofer, AP Solutions GmbH, Atelierstraße 14, 81671 München oder per E-Mail an azp-transformation-taskforce@allianz.com"
    },
    {
      "date": "2025-04-18",
      "id": "106960",
      "original_text": "Registerbekanntmachung nach dem Umwandlungsgesetz\nBayern Amtsgericht Aschaffenburg HRA 6540\nWalter Graumann Grundstücks UG (haftungsbeschränkt) & Co.KG – Mömlingen",
      "type": "Registerbekanntmachung nach dem Umwandlungsgesetz",
      "state": "Bayern",
      "amtsgericht": "Amtsgericht Aschaffenburg",
      "registernummer": "HRA 6540",
      "registerart": "HRA",
      "company_name": "Walter Graumann Grundstücks UG (haftungsbeschränkt) & Co.KG",
      "company_seat": "Mömlingen",
      "details": "18.04.2025 (Bekanntmachungsdatum)\n\nBayern Amtsgericht Aschaffenburg HRA 6540\nRegisterbekanntmachung nach dem Umwandlungsgesetz 17.04.2025 (Eintragungsdatum)\n\nWalter Graumann Grundstücks UG (haftungsbeschränkt) & Co.KG\nKommanditgesellschaft\nMömlingen\n\nDen Gläubigern der an der Spaltung beteiligten Rechtsträger ist, wenn sie binnen sechs Monaten nach dem Tag, an dem die Eintragung der Spaltung in das Register des Sitzes desjenigen Rechtsträgers, dessen Gläubiger sie sind, nach §§ 125, 19 Abs. 3 UmwG als bekannt gemacht gilt, ihren Anspruch nach Grund und Höhe in Textform anmelden, Sicherheit zu leisten, soweit sie nicht Befriedigung verlangen können. Dieses Recht steht den Gläubigern jedoch nur zu, wenn sie glaubhaft machen, dass durch die Spaltung die Erfüllung ihrer Forderung gefährdet wird."
    },
    {
      "date": "2025-04-18",
      "id": "106961",
      "original_text": "Einreichung neuer Dokumente\nBayern Amtsgericht München HRB 117300\nVersicherungskammer Bayern Konzern-Rückversicherung Aktiengesellschaft – München",
      "type": "Einreichung neuer Dokumente",
      "state": "Bayern",
      "amtsgericht": "Amtsgericht München",
      "registernummer": "HRB 117300",
      "registerart": "HRB",
      "company_name": "Versicherungskammer Bayern Konzern-Rückversicherung Aktiengesellschaft",
      "company_seat": "München",
      "details": "18.04.2025 (Bekanntmachungsdatum)\n\nBayern Amtsgericht München HRB 117300\nEinreichung neuer Dokumente 17.04.2025 (Eintragungsdatum)\n\nVersicherungskammer Bayern Konzern-Rückversicherung Aktiengesellschaft\nAktiengesellschaft\nMünchen\n\nDem Amtsgericht München -Registergericht- ist eine Liste der Mitglieder des Aufsichtsrats eingereicht worden, § 106 AktG."
    },
    {
      "date": "2025-04-18",
      "id": "106962",
      "original_text": "Einreichung neuer Dokumente\nBayern Amtsgericht Fürth HRB 18056\nVII. ALDI Verwaltungs-SE – Adelsdorf",
      "type": "Einreichung neuer Dokumente",
      "state": "Bayern",
      "amtsgericht": "Amtsgericht Fürth",
      "registernummer": "HRB 18056",
      "registerart": "HRB",
      "company_name": "VII. ALDI Verwaltungs-SE",
      "company_seat": "Adelsdorf",
      "details": "18.04.2025 (Bekanntmachungsdatum)\n\nBayern Amtsgericht Fürth HRB 18056\nEinreichung neuer Dokumente\n\nVII. ALDI Verwaltungs-SE\nEuropäische Aktiengesellschaft (SE)\nAdelsdorf\n\nDem Amtsgericht Fürth -Registergericht- ist eine Liste der Mitglieder des Verwaltungsrats eingereicht worden, Art. 9 Abs. 1 Buchst. c (ii) SE-VO i.V.m. § 106 AktG."
    },
    {
      "date": "2025-04-18",
      "id": "106963",
      "original_text": "Registerbekanntmachung nach dem Umwandlungsgesetz\nBayern Amtsgericht Landshut HRB 13689\nStangl Rumänien GmbH – Simbach",
      "type": "Registerbekanntmachung nach dem Umwandlungsgesetz",
      "state": "Bayern",
      "amtsgericht": "Amtsgericht Landshut",
      "registernummer": "HRB 13689",
      "registerart": "HRB",
      "company_name": "Stangl Rumänien GmbH",
      "company_seat": "Simbach",
      "details": "18.04.2025 (Bekanntmachungsdatum)\n\nBayern Amtsgericht Landshut HRB 13689\nRegisterbekanntmachung nach dem Umwandlungsgesetz\n\nStangl Rumänien GmbH\nGesellschaft mit beschränkter Haftung\nSimbach\n\nEs wird darauf hingewiesen, dass ein Verschmelzungsplan oder sein Entwurf über eine grenzüberschreitende Verschmelzung zur Aufnahme der EUROPEAN Vegetable SRL mit Sitz in Husasau de Tinca/Rumänien (Handelsregister Rumänien J201600156055) (Gesellschaft mit beschränkter Haftung nach rumänischem Recht)  beim Handelsregister eingereicht worden ist.\nDie Rechte der Gläubiger der übernehmenden deutschen Stangl Rumänien GmbH ergeben sich aus § 305 Abs. 2 UmwG iVm § 22 UmwG. Danach ist den Gläubigern der an der Verschmelzung beteiligten Stangl Rumänien GmbH Sicherheit zu leisten, wenn sie binnen sechs Monaten nach dem Tag, an dem die Eintragung der Verschmelzung in das Register des Sitzes der Stangl Rumänien GmbH nach § 305 Abs. 2 iVm § 19 Abs. 3 UmwG als bekannt gemacht gilt, ihren Anspruch nach Grund und Höhe schriftlich anmelden. Dieses Recht steht den Gläubigem nur zu, wenn sie glaubhaft machen, dass durch die Verschmel zung die Erfüllung ihrer Forderungen gefährdet wird. Die Gläubiger sind in der Bekanntmachung der Eintragung der Verschmelzung bei der Stangl Rumänien GmbH gem. § 305 Abs. 2 iVm § 22 Abs. 1 Satz 3 UmwG auf dieses Recht hin zuweisen. Das Recht, Sicherheitsleistung zu verlangen, steht Gläubigern nicht zu, die im Falle der Insolvenz ein Recht auf vorzugsweise Befriedigung aus einer Deckungsmasse haben, die nach gesetzlicher Vorschrift zu ihrem Schutz errichtet und staatlich überwacht ist. Hinsichtlich des Anspruchs der Gläubiger ist unerheblich, ob dieser Anspruch auf Vertrag oder Gesetz beruht. Sicherheitsleistungen können aber nur Gläubi ger eines so genannten obligatorischen Anspruchs verlangen. § 22 UmwG er fasst keine dinglichen Ansprüche, da insoweit der Gegenstand des dinglichen Rechts die Sicherheit darstellt. Der Inhalt der Forderung ist nur insoweit von Bedeutung, als diese einen Vermögenswert darstellen muss. Der zu sichernde Anspruch muss deshalb nicht notwendig unmittelbar auf Geld gerichtet sein, vielmehr besteht auch bei einem Anspruch auf Lieferung von Sachen oder sonstigen Leistungen ein Sicherheitsbedürfnis hinsichtlich eines später eventuell daraus resultierenden Schadensersatzanspruches. Der Anspruch ist unmittelbar gegenüber der Stangl Rumänien GmbH unter deren Geschäftsanschrift 94436 Simbach, Gmeinbauer 56 geltend zu machen. Hierzu ist eine genaue Beschreibung der dem Anspruch zu Grunde liegenden Forderung erforderlich, so dass eine Individualisierung ohne weitere Nachforschungen möglich ist. Es wird darauf hingewiesen, dass die Sicherheitsleistung spätestens sechs Monate nach Bekanntmachung der Eintragung der Ver Schmelzung in das Handelsregister der Stangl Rumänien GmbH gefordert werden muss. Unter der vorgenannten Anschrift können im Übrigen vollständige Auskünfte über die Modalitäten für die Ausübung der Rechte der Gläubiger und der Minderheitsgesellschafter eingeholt werden. Ein Hinweis auf die Modalitäten für die Ausübung der Rechte von Minderheits gesellschaftern ist nicht bekannt zu machen, da Herr Stefan Alois Stangl, geboren am 02. 10. 1963 in Arnstorf, wohnhaft 94436 Simbach, Gmeinbauer56 alleiniger Gesellschafter der übertragenden und der aufnehmenden Gesellschaft ist. Außenstehende Minderheitsgesellschafter sind nicht vorhanden. Die Gesellschafter und Gläubiger der an der Verschmelzung beteiligten Gesellschaften können der Gesellschaft spätestens am 20.05.2025, fünf Arbeitstage vor dem Tag der Gesellschafterversammlung zur Annahme Bemerkungen zum Verschmelzungsplan übermitteln. Die Gesellschafterversammlung zur Annahme ist am 27. 05. 2025 vorgesehen. Ein Hinweis an Betriebsrat oder Arbeitnehmer ist entbehrlich, da keine der Beteiligten Gesellschaften Betriebsrat oder Arbeitnehmer hat."
    },
    {
      "date": "2025-04-18",
      "id": "106964",
      "original_text": "Registerbekanntmachung nach dem Umwandlungsgesetz\nBayern Amtsgericht München HRB 177695\nAP Solutions GmbH – München",
      "type": "Registerbekanntmachung nach dem Umwandlungsgesetz",
      "state": "Bayern",
      "amtsgericht": "Amtsgericht München",
      "registernummer": "HRB 177695",
      "registerart": "HRB",
      "company_name": "AP Solutions GmbH",
      "company_seat": "München",
      "details": "18.04.2025 (Bekanntmachungsdatum)\n\nBayern Amtsgericht München HRB 177695\nRegisterbekanntmachung nach dem Umwandlungsgesetz\n\nAP Solutions GmbH\nGesellschaft mit beschränkter Haftung\nMünchen\n\nEs wird darauf hingewiesen, dass ein Verschmelzungsplan oder sein Entwurf über eine grenzüberschreitende Verschmelzung zur Aufnahme mit der\nNeoasistencia Manoteras, S.L.U., einer Gesellschaft mit beschränkter Haftung nach spanischem Recht (sociedad de responsabilidad limitada) mit Sitz in  Madrid/ Spanien,\nder Servicios Compartidos Multiasistencia, S.L.U., einer Gesellschaft mit beschränkter Haftung nach spanischem Recht (sociedad de responsabilidad limitada)  mit Sitz in Madrid/Spanien,\nder Grupo Multiasistencia, S.A.U., einer Aktiengesellschaft nach spanischem Recht\n(sociedad anónima) mit Sitz in Madrid/Spanien\nund der Multiasistencia, S.A.U., einer Aktiengesellschaft nach spanischem Recht\n(sociedad anónima) mit Sitz in Madrid/Spanien,  beim Handelsregister eingereicht worden ist.\n\nDie Neoasistencia Manoteras S.L.U. ist im Handelsregister von Madrid unter Seite M-431407, Band 24019, Blatt 80, Registrierungskennnummer (IRUS) 1000279417881, und mit der spanischen Steuernummer (NIF) B85017903, eingetragen (EUID: ES28065.080641800); die Servicios Compartidos Multiasistencia S.L.U. ist im Handelsregister von Madrid unter Seite M-502522, Band 27882, Blatt 18, Registrierungskennnummer (IRUS) 1000285492786, und mit der spanischen Steuernummer (NIF) B85944577, eingetragen (EUID: ES28065.080998142); die Grupo Multiasistencia S.A.U. ist im Handelsregister von Madrid unter Seite M-341456, Band 19457, Blatt 201, Registrierungskennnummer (IRUS) 1000271857564, und mit der spanischen Steuernummer (NIF) A83830802 eingetragen (EUID: ES28065.080276970); die Multiasistencia S.A.U. ist im Handelsregister von Madrid unter Seite M-229242, Band 13985, Blatt 1, Registrierungskennnummer (IRUS) 1000262299368, und mit der spanischen Steuernummer (NIF) A82261553 eingetragen (EUID: ES28065.000645708).\nDie Anteilsinhaber, die Gläubiger sowie die zuständigen Betriebsräte der an der grenzüberschreitenden Verschmelzung beteiligten Gesellschaften oder, soweit es keinen Betriebsrat gibt, die Arbeitnehmer der an der grenzüberschreitenden Verschmelzung beteiligten Gesellschaften, können der jeweiligen Gesellschaft spätestens fünf Arbeitstage vor dem Tag der Gesellschafterversammlung Bemerkungen zum Verschmelzungsplan übermitteln.\nEntsprechende Bemerkungen können an folgende Anschrift gerichtet werden: Heide Freynhofer, AP Solutions GmbH, Atelierstraße 14, 81671 München oder per E-Mail an azp-transformation-taskforce@allianz.com"
    },
    {
      "date": "2025-04-18",
      "id": "106965",
      "original_text": "Registerbekanntmachung nach dem Umwandlungsgesetz\nBayern Amtsgericht München HRB 264695\nEitner Ventures UG (haftungsbeschränkt) – München",
      "type": "Registerbekanntmachung nach dem Umwandlungsgesetz",
      "state": "Bayern",
      "amtsgericht": "Amtsgericht München",
      "registernummer": "HRB 264695",
      "registerart": "HRB",
      "company_name": "Eitner Ventures UG (haftungsbeschränkt)",
      "company_seat": "München",
      "details": "18.04.2025 (Bekanntmachungsdatum)\n\nBayern Amtsgericht München HRB 264695\nRegisterbekanntmachung nach dem Umwandlungsgesetz 17.04.2025 (Eintragungsdatum)\n\nEitner Ventures UG (haftungsbeschränkt)\nGesellschaft mit beschränkter Haftung\nMünchen\n\nDen Gläubigern der an der Verschmelzung beteiligten Rechtsträger ist, wenn sie binnen sechs Monaten nach dem Tag, an dem die Eintragung der Verschmelzung in das Register des Sitzes desjenigen Rechtsträgers, dessen Gläubiger sie sind, nach § 19 Abs. 3 UmwG als bekannt gemacht gilt, ihren Anspruch nach Grund und Höhe in Textform anmelden, Sicherheit zu leisten, soweit sie nicht Befriedigung verlangen können. Dieses Recht steht den Gläubigern jedoch nur zu, wenn sie glaubhaft machen, dass durch die Verschmelzung die Erfüllung ihrer Forderung gefährdet wird."
    },
    {
      "date": "2025-04-18",
      "id": "106966",
      "original_text": "Registerbekanntmachung nach dem Umwandlungsgesetz\nBayern Amtsgericht München HRB 207388\nTan Swinies Property GmbH – München",
      "type": "Registerbekanntmachung nach dem Umwandlungsgesetz",
      "state": "Bayern",
      "amtsgericht": "Amtsgericht München",
      "registernummer": "HRB 207388",
      "registerart": "HRB",
      "company_name": "Tan Swinies Property GmbH",
      "company_seat": "München",
      "details": "18.04.2025 (Bekanntmachungsdatum)\n\nBayern Amtsgericht München HRB 207388\nRegisterbekanntmachung nach dem Umwandlungsgesetz 17.04.2025 (Eintragungsdatum)\n\nTan Swinies Property GmbH\nGesellschaft mit beschränkter Haftung\nMünchen\n\nEs wird darauf hingewiesen, dass ein Formwechselplan oder sein Entwurf über einen grenzüberschreitenden Formwechsel in die Tan Swinies Property S.à r.l. mit Sitz in Luxemburg/Luxemburg (société à responsabilité limitée - Gesellschaft mit beschränkter Haftung  nach luxemburgischem Recht) beim Handelsregister eingereicht worden ist. An dem grenzüberschreitenden Formwechsel ist die Tan Swinies Property GmbH beteiligt, eine nach dem Recht der Bundesrepublik Deutschland gegründete Gesellschaft mit beschränkter Haftung mit Sitz in München, Bundesrepublik Deutschland, und Geschäftsanschrift unter Wittestr. 30, Haus F, 13509 Berlin, Bundesrepublik Deutschland. Die Registerdaten der an dem Formwechsel beteiligten Gesellschaft lauten wie folgt: Die Tan Swinies Property GmbH ist im Handelsregister des Amtsgerichts München unter HRB 207388 eingetragen. Die Anteilsinhaber, die Gläubiger sowie die zuständigen Betriebsräte der an dem grenzüberschreitenden Formwechsel beteiligten Gesellschaft oder, soweit es keinen Betriebsrat gibt, die Arbeitnehmer der an dem grenzüberschreitenden Formwechsel beteiligten Gesellschaft, können der Gesellschaft (an Wittestr. 30, Haus F, 13509 Berlin, Bundesrepublik Deutschland) spätestens fünf Arbeitstage vor dem Tag der für den 27. Mai 2025 vorgesehenen Gesellschafterversammlung Bemerkungen zum Formwechselplan übermitteln. Bei der an dem grenzüberschreitenden Formwechsel beteiligten Gesellschaft bestehen keine Betriebsräte und keine Arbeitnehmer. Mangels Bestehens von Betriebsräten werden, rein vorsorglich für den Fall, dass Arbeitnehmer eingestellt werden, die Arbeitnehmer der an dem grenzüberschreitenden Formwechsel beteiligten Gesellschaft darauf hingewiesen, dass sie der Gesellschaft (an Wittestr. 30, Haus F, 13509 Berlin, Bundesrepublik Deutschland) spätestens fünf Arbeitstage vor dem Tag der für den 27. Mai 2025 vorgesehenen Gesellschafterversammlung Bemerkungen zum Formwechselplan übermitteln können."
    },
    {
      "date": "2025-04-18",
      "id": "106967",
      "original_text": "Registerbekanntmachung nach dem Umwandlungsgesetz\nBayern Amtsgericht Ansbach HRB 3870\najco solutions GmbH – Ansbach",
      "type": "Registerbekanntmachung nach dem Umwandlungsgesetz",
      "state": "Bayern",
      "amtsgericht": "Amtsgericht Ansbach",
      "registernummer": "HRB 3870",
      "registerart": "HRB",
      "company_name": "ajco solutions GmbH",
      "company_seat": "Ansbach",
      "details": "18.04.2025 (Bekanntmachungsdatum)\n\nBayern Amtsgericht Ansbach HRB 3870\nRegisterbekanntmachung nach dem Umwandlungsgesetz 17.04.2025 (Eintragungsdatum)\n\najco solutions GmbH\nGesellschaft mit beschränkter Haftung\nAnsbach\n\nDen Gläubigern der an der Verschmelzung beteiligten Rechtsträger ist, wenn sie binnen sechs Monaten nach dem Tag, an dem die Eintragung der Verschmelzung in das Register des Sitzes desjenigen Rechtsträgers, dessen Gläubiger sie sind, nach § 19 Abs. 3 UmwG als bekannt gemacht gilt, ihren Anspruch nach Grund und Höhe in Textform anmelden, Sicherheit zu leisten, soweit sie nicht Befriedigung verlangen können. Dieses Recht steht den Gläubigern jedoch nur zu, wenn sie glaubhaft machen, dass durch die Verschmelzung die Erfüllung ihrer Forderung gefährdet wird."
    },
    {
      "date": "2025-04-18",
      "id": "106968",
      "original_text": "Registerbekanntmachung nach dem Umwandlungsgesetz\nBayern Amtsgericht München HRB 281986\nANCRICON Beteiligungs GmbH – München",
      "type": "Registerbekanntmachung nach dem Umwandlungsgesetz",
      "state": "Bayern",
      "amtsgericht": "Amtsgericht München",
      "registernummer": "HRB 281986",
      "registerart": "HRB",
      "company_name": "ANCRICON Beteiligungs GmbH",
      "company_seat": "München",
      "details": "18.04.2025 (Bekanntmachungsdatum)\n\nBayern Amtsgericht München HRB 281986\nRegisterbekanntmachung nach dem Umwandlungsgesetz 17.04.2025 (Eintragungsdatum)\n\nANCRICON Beteiligungs GmbH\nGesellschaft mit beschränkter Haftung\nMünchen\n\nDen Gläubigern der an der Verschmelzung beteiligten Rechtsträger ist, wenn sie binnen sechs Monaten nach dem Tag, an dem die Eintragung der Verschmelzung in das Register des Sitzes desjenigen Rechtsträgers, dessen Gläubiger sie sind, nach § 19 Abs. 3 UmwG als bekannt gemacht gilt, ihren Anspruch nach Grund und Höhe in Textform anmelden, Sicherheit zu leisten, soweit sie nicht Befriedigung verlangen können. Dieses Recht steht den Gläubigern jedoch nur zu, wenn sie glaubhaft machen, dass durch die Verschmelzung die Erfüllung ihrer Forderung gefährdet wird."
    },
    {
      "date": "2025-04-18",
      "id": "106969",
      "original_text": "Löschungsankündigung\nBayern Amtsgericht München HRB 276879\nMunich Concept GmbH – München",
      "type": "Löschungsankündigung",
      "state": "Bayern",
      "amtsgericht": "Amtsgericht München",
      "registernummer": "HRB 276879",
      "registerart": "HRB",
      "company_name": "Munich Concept GmbH",
      "company_seat": "München",
      "details": "18.04.2025 (Bekanntmachungsdatum)\n\nBayern Amtsgericht München HRB 276879\nLöschungsankündigung\n\nMunich Concept GmbH\nGesellschaft mit beschränkter Haftung\nMünchen\n\nDas Registergericht beabsichtigt, die im Handelsregister eingetragene Gesellschaft wegen Vermögenslosigkeit von Amts wegen nach § 394 FamFG zu löschen. Die Frist zur Erhebung eines Widerspruchs ist auf drei Monate festgesetzt."
    },
    {
      "date": "2025-04-18",
      "id": "106970",
      "original_text": "Registerbekanntmachung nach dem Umwandlungsgesetz\nBayern Amtsgericht Nürnberg HRB 44399\nMeris GmbH – Nürnberg",
      "type": "Registerbekanntmachung nach dem Umwandlungsgesetz",
      "state": "Bayern",
      "amtsgericht": "Amtsgericht Nürnberg",
      "registernummer": "HRB 44399",
      "registerart": "HRB",
      "company_name": "Meris GmbH",
      "company_seat": "Nürnberg",
      "details": "18.04.2025 (Bekanntmachungsdatum)\n\nBayern Amtsgericht Nürnberg HRB 44399\nRegisterbekanntmachung nach dem Umwandlungsgesetz 17.04.2025 (Eintragungsdatum)\n\nMeris GmbH\nGesellschaft mit beschränkter Haftung\nNürnberg\n\nDen Gläubigern der an der Ausgliederung beteiligten Rechtsträger ist, wenn sie binnen sechs Monaten nach dem Tag, an dem die Eintragung der Ausgliederung in das Register des Sitzes desjenigen Rechtsträgers, dessen Gläubiger sie sind, nach §§ 125, 19 Abs. 3 UmwG als bekannt gemacht gilt, ihren Anspruch nach Grund und Höhe in Textform anmelden, Sicherheit zu leisten, soweit sie nicht Befriedigung verlangen können. Dieses Recht steht den Gläubigern jedoch nur zu, wenn sie glaubhaft machen, dass durch die Ausgliederung die Erfüllung ihrer Forderung gefährdet wird."
    },
    {
      "date": "2025-04-18",
      "id": "106971",
      "original_text": "Registerbekanntmachung nach dem Umwandlungsgesetz\nBayern Amtsgericht München HRB 177695\nAP Solutions GmbH – München",
      "type": "Registerbekanntmachung nach dem Umwandlungsgesetz",
      "state": "Bayern",
      "amtsgericht": "Amtsgericht München",
      "registernummer": "HRB 177695",
      "registerart": "HRB",
      "company_name": "AP Solutions GmbH",
      "company_seat": "München",
      "details": "18.04.2025 (Bekanntmachungsdatum)\n\nBayern Amtsgericht München HRB 177695\nRegisterbekanntmachung nach dem Umwandlungsgesetz\n\nAP Solutions GmbH\nGesellschaft mit beschränkter Haftung\nMünchen\n\nEs wird darauf hingewiesen, dass ein Verschmelzungsplan oder sein Entwurf über eine grenzüberschreitende Verschmelzung zur Aufnahme mit der AWP Health & Life Services Limited mit Sitz in Dublin/Irland (The Companies Registration Office - an Oifig um Chlarú Cuideachtaí 509216) (private company limited by shares - Gesellschaft mit beschränkter Haftung nach irischem Recht) beim Handelsregister eingereicht worden ist.\nDie Anteilsinhaber, die Gläubiger sowie die zuständigen Betriebsräte der an der grenzüberschreitenden Verschmelzung beteiligten Gesellschaften oder, soweit es keinen Betriebsrat gibt, die Arbeitnehmer der an der grenzüberschreitenden Verschmelzung beteiligten Gesellschaften, können der jeweiligen Gesellschaft spätestens fünf Arbeitstage vor dem Tag der Gesellschafterversammlung Bemerkungen zum Verschmelzungsplan übermitteln.\nEntsprechende Bemerkungen können an folgende Anschrift gerichtet werden: Heide Freynhofer, AP Solutions GmbH, Atelierstraße 14, 81671 München oder per E-Mail an azp-transformation-taskforce@allianz.com"
    },
    {
      "date": "2025-04-18",
      "id": "106972",
      "original_text": "Löschungsankündigung\nBayern Amtsgericht Nürnberg HRB 30613\nBethasada GmbH – Nürnberg",
      "type": "Löschungsankündigung",
      "state": "Bayern",
      "amtsgericht": "Amtsgericht Nürnberg",
      "registernummer": "HRB 30613",
      "registerart": "HRB",
      "company_name": "Bethasada GmbH",
      "company_seat": "Nürnberg",
      "details": "18.04.2025 (Bekanntmachungsdatum)\n\nBayern Amtsgericht Nürnberg HRB 30613\nLöschungsankündigung\n\nBethasada GmbH\nGesellschaft mit beschränkter Haftung\nNürnberg\n\nDas Registergericht beabsichtigt, die im Handelsregister eingetragene Gesellschaft wegen Vermögenslosigkeit von Amts wegen nach § 394 FamFG zu löschen. Die Frist zur Erhebung eines Widerspruchs ist auf einen Monat festgesetzt."
    },
    {
      "date": "2025-04-18",
      "id": "106973",
      "original_text": "Löschungsankündigung\nBayern Amtsgericht Landshut HRB 13928\nINO-BAU-KLOS GmbH (Austria) Zweigniederlassung – Geisenhausen",
      "type": "Löschungsankündigung",
      "state": "Bayern",
      "amtsgericht": "Amtsgericht Landshut",
      "registernummer": "HRB 13928",
      "registerart": "HRB",
      "company_name": "INO-BAU-KLOS GmbH (Austria) Zweigniederlassung",
      "company_seat": "Geisenhausen",
      "details": "18.04.2025 (Bekanntmachungsdatum)\n\nBayern Amtsgericht Landshut HRB 13928\nLöschungsankündigung\n\nINO-BAU-KLOS GmbH (Austria) Zweigniederlassung\nRechtsform ausländischen Rechts HRB\nGeisenhausen\n\nDas Registergericht beabsichtigt, die im Handelsregister eingetragene Gesellschaft von Amts wegen nach § 395 FamFG zu löschen. Die Frist zur Erhebung eines Widerspruchs ist auf einen Monat festgesetzt."
    },
    {
      "date": "2025-04-18",
      "id": "106974",
      "original_text": "Einreichung neuer Dokumente\nBayern Amtsgericht München HRB 110000\nBayerischer Versicherungsverband Versicherungsaktiengesellschaft – München",
      "type": "Einreichung neuer Dokumente",
      "state": "Bayern",
      "amtsgericht": "Amtsgericht München",
      "registernummer": "HRB 110000",
      "registerart": "HRB",
      "company_name": "Bayerischer Versicherungsverband Versicherungsaktiengesellschaft",
      "company_seat": "München",
      "details": "18.04.2025 (Bekanntmachungsdatum)\n\nBayern Amtsgericht München HRB 110000\nEinreichung neuer Dokumente 17.04.2025 (Eintragungsdatum)\n\nBayerischer Versicherungsverband Versicherungsaktiengesellschaft\nAktiengesellschaft\nMünchen\n\nDem Amtsgericht München -Registergericht- ist eine Liste der Mitglieder des Aufsichtsrats eingereicht worden, § 106 AktG."
    },
    {
      "date": "2025-04-18",
      "id": "106975",
      "original_text": "Registerbekanntmachung nach dem Umwandlungsgesetz\nBayern Amtsgericht Augsburg HRA 21827\nBalazs Remay e.K. – Kaufering",
      "type": "Registerbekanntmachung nach dem Umwandlungsgesetz",
      "state": "Bayern",
      "amtsgericht": "Amtsgericht Augsburg",
      "registernummer": "HRA 21827",
      "registerart": "HRA",
      "company_name": "Balazs Remay e.K.",
      "company_seat": "Kaufering",
      "details": "18.04.2025 (Bekanntmachungsdatum)\n\nBayern Amtsgericht Augsburg HRA 21827\nRegisterbekanntmachung nach dem Umwandlungsgesetz 17.04.2025 (Eintragungsdatum)\n\nBalazs Remay e.K.\nEinzelkaufmann / Einzelkauffrau\nKaufering\n\nDen Gläubigern der an der Ausgliederung beteiligten Rechtsträger ist, wenn sie binnen sechs Monaten nach dem Tag, an dem die Eintragung der Ausgliederung in das Register des Sitzes desjenigen Rechtsträgers, dessen Gläubiger sie sind, nach §§ 125, 19 Abs. 3 UmwG als bekannt gemacht gilt, ihren Anspruch nach Grund und Höhe in Textform anmelden, Sicherheit zu leisten, soweit sie nicht Befriedigung verlangen können. Dieses Recht steht den Gläubigern jedoch nur zu, wenn sie glaubhaft machen, dass durch die Ausgliederung die Erfüllung ihrer Forderung gefährdet wird."
    },
    {
      "date": "2025-04-18",
      "id": "106976",
      "original_text": "Einreichung neuer Dokumente\nBayern Amtsgericht München HRB 247494\nver.de Projektgesellschaft AG – München",
      "type": "Einreichung neuer Dokumente",
      "state": "Bayern",
      "amtsgericht": "Amtsgericht München",
      "registernummer": "HRB 247494",
      "registerart": "HRB",
      "company_name": "ver.de Projektgesellschaft AG",
      "company_seat": "München",
      "details": "18.04.2025 (Bekanntmachungsdatum)\n\nBayern Amtsgericht München HRB 247494\nEinreichung neuer Dokumente\n\nver.de Projektgesellschaft AG\nAktiengesellschaft\nMünchen\n\nDem #Re.Name ist eine Liste der Mitglieder des Aufsichtsrats eingereicht worden, § 106 AktG."
    },
    {
      "date": "2025-04-18",
      "id": "106977",
      "original_text": "Löschungsankündigung\nBayern Amtsgericht Nürnberg HRB 32806\nMB-Verwaltungs UG (haftungsbeschränkt) – Schnaittach",
      "type": "Löschungsankündigung",
      "state": "Bayern",
      "amtsgericht": "Amtsgericht Nürnberg",
      "registernummer": "HRB 32806",
      "registerart": "HRB",
      "company_name": "MB-Verwaltungs UG (haftungsbeschränkt)",
      "company_seat": "Schnaittach",
      "details": "18.04.2025 (Bekanntmachungsdatum)\n\nBayern Amtsgericht Nürnberg HRB 32806\nLöschungsankündigung\n\nMB-Verwaltungs UG (haftungsbeschränkt)\nGesellschaft mit beschränkter Haftung\nSchnaittach\n\nDas Registergericht beabsichtigt, die im Handelsregister eingetragene Gesellschaft wegen Vermögenslosigkeit von Amts wegen nach § 394 FamFG zu löschen. Die Frist zur Erhebung eines Widerspruchs ist auf einen Monat festgesetzt."
    },
    {
      "date": "2025-04-18",
      "id": "106978",
      "original_text": "Einreichung neuer Dokumente\nNordrhein-Westfalen Amtsgericht Münster HRB 22039\nWinkelmann Group Beteiligungs SE – Ahlen",
      "type": "Einreichung neuer Dokumente",
      "state": "Nordrhein-Westfalen",
      "amtsgericht": "Amtsgericht Münster",
      "registernummer": "HRB 22039",
      "registerart": "HRB",
      "company_name": "Winkelmann Group Beteiligungs SE",
      "company_seat": "Ahlen",
      "details": "18.04.2025 (Bekanntmachungsdatum)\n\nNordrhein-Westfalen Amtsgericht Münster HRB 22039\nEinreichung neuer Dokumente 18.04.2025 (Eintragungsdatum)\n\nWinkelmann Group Beteiligungs SE\nEuropäische Aktiengesellschaft (SE)\nAhlen\n\nDem Registergericht ist eine neue Liste der Mitglieder des Aufsichtsrates eingereicht worden."
    },
    {
      "date": "2025-04-18",
      "id": "106979",
      "original_text": "Registerbekanntmachung nach dem Umwandlungsgesetz\nNordrhein-Westfalen Amtsgericht Münster HRB 3489\nBKS Steuerberatungsgesellschaft mbH – Münster",
      "type": "Registerbekanntmachung nach dem Umwandlungsgesetz",
      "state": "Nordrhein-Westfalen",
      "amtsgericht": "Amtsgericht Münster",
      "registernummer": "HRB 3489",
      "registerart": "HRB",
      "company_name": "BKS Steuerberatungsgesellschaft mbH",
      "company_seat": "Münster",
      "details": "18.04.2025 (Bekanntmachungsdatum)\n\nNordrhein-Westfalen Amtsgericht Münster HRB 3489\nRegisterbekanntmachung nach dem Umwandlungsgesetz 18.04.2025 (Eintragungsdatum)\n\nBKS Steuerberatungsgesellschaft mbH\nGesellschaft mit beschränkter Haftung\nMünster\n\nDen Gläubigern der an der Abspaltung beteiligten Rechtsträger ist, wenn sie binnen sechs Monaten nach dem Tag, an dem die Eintragung der Abspaltung in das Register des Sitzes desjenigen Rechtsträgers, dessen Gläubiger sie sind, nach § 19 Absatz 3 UmwG als bekanntgemacht gilt, ihren Anspruch nach Grund und Höhe schriftlich anmelden, Sicherheit zu leisten, soweit sie nicht Befriedigung verlangen können. Dieses Recht steht den Gläubigern jedoch nur zu, wenn sie glaubhaft machen, dass durch die Abspaltung die Erfüllung ihrer Forderung gefährdet wird."
    },
    {
      "date": "2025-04-18",
      "id": "106980",
      "original_text": "Registerbekanntmachung nach dem Umwandlungsgesetz\nNordrhein-Westfalen Amtsgericht Münster HRB 20948\nHWVK Kapitalanlagen GmbH – Ahlen",
      "type": "Registerbekanntmachung nach dem Umwandlungsgesetz",
      "state": "Nordrhein-Westfalen",
      "amtsgericht": "Amtsgericht Münster",
      "registernummer": "HRB 20948",
      "registerart": "HRB",
      "company_name": "HWVK Kapitalanlagen GmbH",
      "company_seat": "Ahlen",
      "details": "18.04.2025 (Bekanntmachungsdatum)\n\nNordrhein-Westfalen Amtsgericht Münster HRB 20948\nRegisterbekanntmachung nach dem Umwandlungsgesetz 18.04.2025 (Eintragungsdatum)\n\nHWVK Kapitalanlagen GmbH\nGesellschaft mit beschränkter Haftung\nAhlen\n\nDen Gläubigern der an der Verschmelzung beteiligten Rechtsträger ist, wenn sie binnen sechs Monaten nach dem Tag, an dem die Eintragung der Verschmelzung in das Register des Sitzes derjenigen Rechtsträger deren Gläubiger sie sind, nach § 19 Absatz 3 UmwG als bekanntgemacht gilt, ihren Anspruch nach Grund und Höhe schriftlich anmelden, Sicherheit zu leisten, soweit sie nicht Befriedigung verlangen können. Dieses Recht steht den Gläubigern jedoch nur zu, wenn sie glaubhaft machen, dass durch die Verschmelzung die Erfüllung ihrer Forderung gefährdet wird."
    }
  ]
}