{
  "date": "2025-04-11",
  "date_of_scrape": "2025-05-30T15:12:50.852Z",
  "tool_version": "0.2.0",
  "number_of_announcements": 144,
  "announcements": [
    {
      "date": "2025-04-11",
      "id": "106267",
      "original_text": "Einreichung neuer Dokumente\nBayern Amtsgericht Deggendorf HRB 4218\nj. söllner AG – Deggendorf",
      "type": "Einreichung neuer Dokumente",
      "state": "Bayern",
      "amtsgericht": "Amtsgericht Deggendorf",
      "registernummer": "HRB 4218",
      "registerart": "HRB",
      "company_name": "j. söllner AG",
      "company_seat": "Deggendorf",
      "details": "11.04.2025 (Bekanntmachungsdatum)\n\nBayern Amtsgericht Deggendorf HRB 4218\nEinreichung neuer Dokumente\n\nj. söllner AG\nAktiengesellschaft\nDeggendorf\n\nDem Amtsgericht Deggendorf -Registergericht- ist eine Liste der Mitglieder des Aufsichtsrats eingereicht worden, § 106 AktG."
    },
    {
      "date": "2025-04-11",
      "id": "106268",
      "original_text": "Löschungsankündigung\nBayern Amtsgericht Kempten (Allgäu) HRB 12729\ngara energy systems GmbH – Kaufbeuren",
      "type": "Löschungsankündigung",
      "state": "Bayern",
      "amtsgericht": "Amtsgericht Kempten (Allgäu)",
      "registernummer": "HRB 12729",
      "registerart": "HRB",
      "company_name": "gara energy systems GmbH",
      "company_seat": "Kaufbeuren",
      "details": "11.04.2025 (Bekanntmachungsdatum)\n\nBayern Amtsgericht Kempten (Allgäu) HRB 12729\nLöschungsankündigung\n\ngara energy systems GmbH\nGesellschaft mit beschränkter Haftung\nKaufbeuren\n\nDas Registergericht beabsichtigt, die im Handelsregister eingetragene Gesellschaft wegen Vermögenslosigkeit von Amts wegen nach § 394 FamFG zu löschen. Die Frist zur Erhebung eines Widerspruchs ist auf einen Monat festgesetzt."
    },
    {
      "date": "2025-04-11",
      "id": "106269",
      "original_text": "Registerbekanntmachung nach dem Umwandlungsgesetz\nBayern Amtsgericht München HRB 269650\nTomorrow Education Group GmbH – Andechs",
      "type": "Registerbekanntmachung nach dem Umwandlungsgesetz",
      "state": "Bayern",
      "amtsgericht": "Amtsgericht München",
      "registernummer": "HRB 269650",
      "registerart": "HRB",
      "company_name": "Tomorrow Education Group GmbH",
      "company_seat": "Andechs",
      "details": "11.04.2025 (Bekanntmachungsdatum)\n\nBayern Amtsgericht München HRB 269650\nRegisterbekanntmachung nach dem Umwandlungsgesetz 10.04.2025 (Eintragungsdatum)\n\nTomorrow Education Group GmbH\nGesellschaft mit beschränkter Haftung\nAndechs\n\nDen Gläubigern der an der Verschmelzung beteiligten Rechtsträger ist, wenn sie binnen sechs Monaten nach dem Tag, an dem die Eintragung der Verschmelzung in das Register des Sitzes desjenigen Rechtsträgers, dessen Gläubiger sie sind, nach § 19 Abs. 3 UmwG als bekannt gemacht gilt, ihren Anspruch nach Grund und Höhe in Textform anmelden, Sicherheit zu leisten, soweit sie nicht Befriedigung verlangen können. Dieses Recht steht den Gläubigern jedoch nur zu, wenn sie glaubhaft machen, dass durch die Verschmelzung die Erfüllung ihrer Forderung gefährdet wird."
    },
    {
      "date": "2025-04-11",
      "id": "106270",
      "original_text": "Sonstige Registerbekanntmachung\nBayern Amtsgericht München HRB 281696\nEviden Germany GmbH – München",
      "type": "Sonstige Registerbekanntmachung",
      "state": "Bayern",
      "amtsgericht": "Amtsgericht München",
      "registernummer": "HRB 281696",
      "registerart": "HRB",
      "company_name": "Eviden Germany GmbH",
      "company_seat": "München",
      "details": "11.04.2025 (Bekanntmachungsdatum)\n\nBayern Amtsgericht München HRB 281696\nSonstige Registerbekanntmachung 10.04.2025 (Eintragungsdatum)\n\nEviden Germany GmbH\nGesellschaft mit beschränkter Haftung\nMünchen\n\nDem Amtsgericht München -Registergericht- ist eine Liste der Mitglieder des Aufsichtsrats eingereicht worden, § 52 Abs. 3 S. 2 GmbHG."
    },
    {
      "date": "2025-04-11",
      "id": "106271",
      "original_text": "Registerbekanntmachung nach dem Umwandlungsgesetz\nBayern Amtsgericht Passau HRB 6962\nPPP Planungsgruppe GmbH W.J. Pauli und C. Lankl Architektur-Städtebau-Ingenieurbau – Freyung",
      "type": "Registerbekanntmachung nach dem Umwandlungsgesetz",
      "state": "Bayern",
      "amtsgericht": "Amtsgericht Passau",
      "registernummer": "HRB 6962",
      "registerart": "HRB",
      "company_name": "PPP Planungsgruppe GmbH W.J. Pauli und C. Lankl Architektur-Städtebau-Ingenieurbau",
      "company_seat": "Freyung",
      "details": "11.04.2025 (Bekanntmachungsdatum)\n\nBayern Amtsgericht Passau HRB 6962\nRegisterbekanntmachung nach dem Umwandlungsgesetz 10.04.2025 (Eintragungsdatum)\n\nPPP Planungsgruppe GmbH W.J. Pauli und C. Lankl Architektur-Städtebau-Ingenieurbau\nGesellschaft mit beschränkter Haftung\nFreyung\n\nDen Gläubigern der an der Verschmelzung beteiligten Rechtsträger ist, wenn sie binnen sechs Monaten nach dem Tag, an dem die Eintragung der Verschmelzung in das Register des Sitzes desjenigen Rechtsträgers, dessen Gläubiger sie sind, nach § 19 Abs. 3 UmwG als bekannt gemacht gilt, ihren Anspruch nach Grund und Höhe in Textform anmelden, Sicherheit zu leisten, soweit sie nicht Befriedigung verlangen können. Dieses Recht steht den Gläubigern jedoch nur zu, wenn sie glaubhaft machen, dass durch die Verschmelzung die Erfüllung ihrer Forderung gefährdet wird."
    },
    {
      "date": "2025-04-11",
      "id": "106272",
      "original_text": "Registerbekanntmachung nach dem Umwandlungsgesetz\nBayern Amtsgericht München HRB 234379\nGAHM Swarm Beteiligungs UG (haftungsbeschränkt) – München",
      "type": "Registerbekanntmachung nach dem Umwandlungsgesetz",
      "state": "Bayern",
      "amtsgericht": "Amtsgericht München",
      "registernummer": "HRB 234379",
      "registerart": "HRB",
      "company_name": "GAHM Swarm Beteiligungs UG (haftungsbeschränkt)",
      "company_seat": "München",
      "details": "11.04.2025 (Bekanntmachungsdatum)\n\nBayern Amtsgericht München HRB 234379\nRegisterbekanntmachung nach dem Umwandlungsgesetz 10.04.2025 (Eintragungsdatum)\n\nGAHM Swarm Beteiligungs UG (haftungsbeschränkt)\nGesellschaft mit beschränkter Haftung\nMünchen\n\nDen Gläubigern der an der Verschmelzung beteiligten Rechtsträger ist, wenn sie binnen sechs Monaten nach dem Tag, an dem die Eintragung der Verschmelzung in das Register des Sitzes desjenigen Rechtsträgers, dessen Gläubiger sie sind, nach § 19 Abs. 3 UmwG als bekannt gemacht gilt, ihren Anspruch nach Grund und Höhe in Textform anmelden, Sicherheit zu leisten, soweit sie nicht Befriedigung verlangen können. Dieses Recht steht den Gläubigern jedoch nur zu, wenn sie glaubhaft machen, dass durch die Verschmelzung die Erfüllung ihrer Forderung gefährdet wird."
    },
    {
      "date": "2025-04-11",
      "id": "106273",
      "original_text": "Registerbekanntmachung nach dem Umwandlungsgesetz\nBayern Amtsgericht München HRB 295075\nSilk Road TopCo GmbH – München",
      "type": "Registerbekanntmachung nach dem Umwandlungsgesetz",
      "state": "Bayern",
      "amtsgericht": "Amtsgericht München",
      "registernummer": "HRB 295075",
      "registerart": "HRB",
      "company_name": "Silk Road TopCo GmbH",
      "company_seat": "München",
      "details": "11.04.2025 (Bekanntmachungsdatum)\n\nBayern Amtsgericht München HRB 295075\nRegisterbekanntmachung nach dem Umwandlungsgesetz 10.04.2025 (Eintragungsdatum)\n\nSilk Road TopCo GmbH\nGesellschaft mit beschränkter Haftung\nMünchen\n\nDen Gläubigern der an der Verschmelzung beteiligten Rechtsträger ist, wenn sie binnen sechs Monaten nach dem Tag, an dem die Eintragung der Verschmelzung in das Register des Sitzes desjenigen Rechtsträgers, dessen Gläubiger sie sind, nach § 19 Abs. 3 UmwG als bekannt gemacht gilt, ihren Anspruch nach Grund und Höhe in Textform anmelden, Sicherheit zu leisten, soweit sie nicht Befriedigung verlangen können. Dieses Recht steht den Gläubigern jedoch nur zu, wenn sie glaubhaft machen, dass durch die Verschmelzung die Erfüllung ihrer Forderung gefährdet wird."
    },
    {
      "date": "2025-04-11",
      "id": "106274",
      "original_text": "Löschungsankündigung\nBayern Amtsgericht Regensburg HRB 17991\nGlecso GmbH – Regensburg",
      "type": "Löschungsankündigung",
      "state": "Bayern",
      "amtsgericht": "Amtsgericht Regensburg",
      "registernummer": "HRB 17991",
      "registerart": "HRB",
      "company_name": "Glecso GmbH",
      "company_seat": "Regensburg",
      "details": "11.04.2025 (Bekanntmachungsdatum)\n\nBayern Amtsgericht Regensburg HRB 17991\nLöschungsankündigung 10.04.2025 (Eintragungsdatum)\n\nGlecso GmbH\nGesellschaft mit beschränkter Haftung\nRegensburg\n\nDas Registergericht beabsichtigt, die im Handelsregister eingetragene Gesellschaft wegen Vermögenslosigkeit von Amts wegen nach § 394 FamFG zu löschen. Die Frist zur Erhebung eines Widerspruchs ist auf einen Monat festgesetzt."
    },
    {
      "date": "2025-04-11",
      "id": "106275",
      "original_text": "Löschungsankündigung\nBayern Amtsgericht Weiden i. d. OPf. HRB 4947\nOPEX Personal GmbH – Weiden i.d.OPf.",
      "type": "Löschungsankündigung",
      "state": "Bayern",
      "amtsgericht": "Amtsgericht Weiden i. d. OPf.",
      "registernummer": "HRB 4947",
      "registerart": "HRB",
      "company_name": "OPEX Personal GmbH",
      "company_seat": "Weiden i.d.OPf.",
      "details": "11.04.2025 (Bekanntmachungsdatum)\n\nBayern Amtsgericht Weiden i. d. OPf. HRB 4947\nLöschungsankündigung 10.04.2025 (Eintragungsdatum)\n\nOPEX Personal GmbH\nGesellschaft mit beschränkter Haftung\nWeiden i.d.OPf.\n\nDas Registergericht beabsichtigt, die im Handelsregister eingetragene Gesellschaft OPEX Personal GmbH wegen Vermögenslosigkeit von Amts wegen nach § 394 FamFG zu löschen. Die Frist zur Erhebung eines Widerspruchs ist auf sechs Wochen ab öffentlicher Bekanntmachung dieses Schreibens gem. § 393 2 FamFG, § 10 HGB festgesetzt."
    },
    {
      "date": "2025-04-11",
      "id": "106276",
      "original_text": "Registerbekanntmachung nach dem Umwandlungsgesetz\nBayern Amtsgericht München HRB 77611\nASS Wein Vertriebs-GmbH – München",
      "type": "Registerbekanntmachung nach dem Umwandlungsgesetz",
      "state": "Bayern",
      "amtsgericht": "Amtsgericht München",
      "registernummer": "HRB 77611",
      "registerart": "HRB",
      "company_name": "ASS Wein Vertriebs-GmbH",
      "company_seat": "München",
      "details": "11.04.2025 (Bekanntmachungsdatum)\n\nBayern Amtsgericht München HRB 77611\nRegisterbekanntmachung nach dem Umwandlungsgesetz 10.04.2025 (Eintragungsdatum)\n\nASS Wein Vertriebs-GmbH\nGesellschaft mit beschränkter Haftung\nMünchen\n\nDen Gläubigern der an der Verschmelzung beteiligten Rechtsträger ist, wenn sie binnen sechs Monaten nach dem Tag, an dem die Eintragung der Verschmelzung in das Register des Sitzes desjenigen Rechtsträgers, dessen Gläubiger sie sind, nach § 19 Abs. 3 UmwG als bekannt gemacht gilt, ihren Anspruch nach Grund und Höhe in Textform anmelden, Sicherheit zu leisten, soweit sie nicht Befriedigung verlangen können. Dieses Recht steht den Gläubigern jedoch nur zu, wenn sie glaubhaft machen, dass durch die Verschmelzung die Erfüllung ihrer Forderung gefährdet wird."
    },
    {
      "date": "2025-04-11",
      "id": "106277",
      "original_text": "Löschungsankündigung\nBayern Amtsgericht München HRB 259451\nSDS DE Dreiundzwanzig Management GmbH – München",
      "type": "Löschungsankündigung",
      "state": "Bayern",
      "amtsgericht": "Amtsgericht München",
      "registernummer": "HRB 259451",
      "registerart": "HRB",
      "company_name": "SDS DE Dreiundzwanzig Management GmbH",
      "company_seat": "München",
      "details": "11.04.2025 (Bekanntmachungsdatum)\n\nBayern Amtsgericht München HRB 259451\nLöschungsankündigung 10.04.2025 (Eintragungsdatum)\n\nSDS DE Dreiundzwanzig Management GmbH\nGesellschaft mit beschränkter Haftung\nMünchen\n\nDas Registergericht beabsichtigt, die im Handelsregister eingetragene Gesellschaft wegen Vermögenslosigkeit von Amts wegen nach § 394 FamFG zu löschen. Die Frist zur Erhebung eines Widerspruchs ist auf drei Monate festgesetzt."
    },
    {
      "date": "2025-04-11",
      "id": "106278",
      "original_text": "Registerbekanntmachung nach dem Umwandlungsgesetz\nBayern Amtsgericht Nürnberg HRB 10283\nPeter Edenharder GmbH – Pilsach",
      "type": "Registerbekanntmachung nach dem Umwandlungsgesetz",
      "state": "Bayern",
      "amtsgericht": "Amtsgericht Nürnberg",
      "registernummer": "HRB 10283",
      "registerart": "HRB",
      "company_name": "Peter Edenharder GmbH",
      "company_seat": "Pilsach",
      "details": "11.04.2025 (Bekanntmachungsdatum)\n\nBayern Amtsgericht Nürnberg HRB 10283\nRegisterbekanntmachung nach dem Umwandlungsgesetz 10.04.2025 (Eintragungsdatum)\n\nPeter Edenharder GmbH\nGesellschaft mit beschränkter Haftung\nPilsach\n\nDen Gläubigern der an der Verschmelzung beteiligten Rechtsträger ist, wenn sie binnen sechs Monaten nach dem Tag, an dem die Eintragung der Verschmelzung in das Register des Sitzes desjenigen Rechtsträgers, dessen Gläubiger sie sind, nach § 19 Abs. 3 UmwG als bekannt gemacht gilt, ihren Anspruch nach Grund und Höhe in Textform anmelden, Sicherheit zu leisten, soweit sie nicht Befriedigung verlangen können. Dieses Recht steht den Gläubigern jedoch nur zu, wenn sie glaubhaft machen, dass durch die Verschmelzung die Erfüllung ihrer Forderung gefährdet wird."
    },
    {
      "date": "2025-04-11",
      "id": "106279",
      "original_text": "Registerbekanntmachung nach dem Umwandlungsgesetz\nBayern Amtsgericht Nürnberg HRB 32324\nESR GmbH – Pilsach",
      "type": "Registerbekanntmachung nach dem Umwandlungsgesetz",
      "state": "Bayern",
      "amtsgericht": "Amtsgericht Nürnberg",
      "registernummer": "HRB 32324",
      "registerart": "HRB",
      "company_name": "ESR GmbH",
      "company_seat": "Pilsach",
      "details": "11.04.2025 (Bekanntmachungsdatum)\n\nBayern Amtsgericht Nürnberg HRB 32324\nRegisterbekanntmachung nach dem Umwandlungsgesetz 10.04.2025 (Eintragungsdatum)\n\nESR GmbH\nGesellschaft mit beschränkter Haftung\nPilsach\n\nDen Gläubigern der an der Verschmelzung beteiligten Rechtsträger ist, wenn sie binnen sechs Monaten nach dem Tag, an dem die Eintragung der Verschmelzung in das Register des Sitzes desjenigen Rechtsträgers, dessen Gläubiger sie sind, nach § 19 Abs. 3 UmwG als bekannt gemacht gilt, ihren Anspruch nach Grund und Höhe in Textform anmelden, Sicherheit zu leisten, soweit sie nicht Befriedigung verlangen können. Dieses Recht steht den Gläubigern jedoch nur zu, wenn sie glaubhaft machen, dass durch die Verschmelzung die Erfüllung ihrer Forderung gefährdet wird."
    },
    {
      "date": "2025-04-11",
      "id": "106280",
      "original_text": "Einreichung neuer Dokumente\nBayern Amtsgericht München HRB 2212\nAllianz Private Krankenversicherungs-Aktiengesellschaft – München",
      "type": "Einreichung neuer Dokumente",
      "state": "Bayern",
      "amtsgericht": "Amtsgericht München",
      "registernummer": "HRB 2212",
      "registerart": "HRB",
      "company_name": "Allianz Private Krankenversicherungs-Aktiengesellschaft",
      "company_seat": "München",
      "details": "11.04.2025 (Bekanntmachungsdatum)\n\nBayern Amtsgericht München HRB 2212\nEinreichung neuer Dokumente\n\nAllianz Private Krankenversicherungs-Aktiengesellschaft\nAktiengesellschaft\nMünchen\n\nDem Amtsgericht München -Registergericht- ist eine Liste der Mitglieder des Aufsichtsrats eingereicht worden, § 106 AktG."
    },
    {
      "date": "2025-04-11",
      "id": "106281",
      "original_text": "Registerbekanntmachung nach dem Umwandlungsgesetz\nBayern Amtsgericht Passau HRB 10875\nAPA-Arbeitsgruppe Planung + Architektur GmbH – Grafenau",
      "type": "Registerbekanntmachung nach dem Umwandlungsgesetz",
      "state": "Bayern",
      "amtsgericht": "Amtsgericht Passau",
      "registernummer": "HRB 10875",
      "registerart": "HRB",
      "company_name": "APA-Arbeitsgruppe Planung + Architektur GmbH",
      "company_seat": "Grafenau",
      "details": "11.04.2025 (Bekanntmachungsdatum)\n\nBayern Amtsgericht Passau HRB 10875\nRegisterbekanntmachung nach dem Umwandlungsgesetz 10.04.2025 (Eintragungsdatum)\n\nAPA-Arbeitsgruppe Planung + Architektur GmbH\nGesellschaft mit beschränkter Haftung\nGrafenau\n\nDen Gläubigern der an der Verschmelzung beteiligten Rechtsträger ist, wenn sie binnen sechs Monaten nach dem Tag, an dem die Eintragung der Verschmelzung in das Register des Sitzes desjenigen Rechtsträgers, dessen Gläubiger sie sind, nach § 19 Abs. 3 UmwG als bekannt gemacht gilt, ihren Anspruch nach Grund und Höhe in Textform anmelden, Sicherheit zu leisten, soweit sie nicht Befriedigung verlangen können. Dieses Recht steht den Gläubigern jedoch nur zu, wenn sie glaubhaft machen, dass durch die Verschmelzung die Erfüllung ihrer Forderung gefährdet wird."
    },
    {
      "date": "2025-04-11",
      "id": "106282",
      "original_text": "Einreichung neuer Dokumente\nBayern Amtsgericht Memmingen HRB 10613\nHammer Sport AG – Neu-Ulm",
      "type": "Einreichung neuer Dokumente",
      "state": "Bayern",
      "amtsgericht": "Amtsgericht Memmingen",
      "registernummer": "HRB 10613",
      "registerart": "HRB",
      "company_name": "Hammer Sport AG",
      "company_seat": "Neu-Ulm",
      "details": "11.04.2025 (Bekanntmachungsdatum)\n\nBayern Amtsgericht Memmingen HRB 10613\nEinreichung neuer Dokumente\n\nHammer Sport AG\nAktiengesellschaft\nNeu-Ulm\n\nDem Amtsgericht Memmingen -Registergericht- ist eine Liste der Mitglieder des Aufsichtsrats eingereicht worden, § 106 AktG."
    },
    {
      "date": "2025-04-11",
      "id": "106283",
      "original_text": "Registerbekanntmachung nach dem Umwandlungsgesetz\nBayern Amtsgericht München HRB 227152\nIU Teaching Services 1 GmbH – München",
      "type": "Registerbekanntmachung nach dem Umwandlungsgesetz",
      "state": "Bayern",
      "amtsgericht": "Amtsgericht München",
      "registernummer": "HRB 227152",
      "registerart": "HRB",
      "company_name": "IU Teaching Services 1 GmbH",
      "company_seat": "München",
      "details": "11.04.2025 (Bekanntmachungsdatum)\n\nBayern Amtsgericht München HRB 227152\nRegisterbekanntmachung nach dem Umwandlungsgesetz 10.04.2025 (Eintragungsdatum)\n\nIU Teaching Services 1 GmbH\nGesellschaft mit beschränkter Haftung\nMünchen\n\nDen Gläubigern der an der Verschmelzung beteiligten Rechtsträger ist, wenn sie binnen sechs Monaten nach dem Tag, an dem die Eintragung der Verschmelzung in das Register des Sitzes desjenigen Rechtsträgers, dessen Gläubiger sie sind, nach § 19 Abs. 3 UmwG als bekannt gemacht gilt, ihren Anspruch nach Grund und Höhe in Textform anmelden, Sicherheit zu leisten, soweit sie nicht Befriedigung verlangen können. Dieses Recht steht den Gläubigern jedoch nur zu, wenn sie glaubhaft machen, dass durch die Verschmelzung die Erfüllung ihrer Forderung gefährdet wird."
    },
    {
      "date": "2025-04-11",
      "id": "106284",
      "original_text": "Löschungsankündigung\nSaarland Amtsgericht Saarbrücken HRB 109774\nXeLA-Go GmbH – Schmelz",
      "type": "Löschungsankündigung",
      "state": "Saarland",
      "amtsgericht": "Amtsgericht Saarbrücken",
      "registernummer": "HRB 109774",
      "registerart": "HRB",
      "company_name": "XeLA-Go GmbH",
      "company_seat": "Schmelz",
      "details": "11.04.2025 (Bekanntmachungsdatum)\n\nSaarland Amtsgericht Saarbrücken HRB 109774\nLöschungsankündigung\n\nXeLA-Go GmbH\nGesellschaft mit beschränkter Haftung\nSchmelz\n\nEs ist beabsichtigt, die Gesellschaft von Amts wegen gemäß § 394 FamFG wegen Vermögenslosigkeit zu löschen.\nGegen die Löschung von Amts wegen ist das Rechtsmittel des Widerspruchs statthaft. Der Widerspruch ist binnen einer Frist drei Monaten beginnend mit dem Tag dieser Veröffentlichung durch Einreichen eines Widerspruchsschreibens -schriftlich oder zur Niederschrift der Geschäftsstelle beim Amtsgericht Saarbrücken, -zentrales Handelsregister-, Mainzerstr.178, 66121 Saarbrücken einzulegen.\nDer Widerspruch muss die Bezeichnung der angefochtenen Löschungsankündigung enthalten sowie die Erklärung, dass Widerspruch eingelegt wird. Er ist vom Widerspruchsführer oder seinem Bevollmächtigten zu unterzeichnen.\nDas Widerspruchsschreiben kann auch in der Form eines elektronischen Dokumentes eingereicht werden, das mit einer qualifizierten elektronischen Signatur nach dem Signaturgesetz versehen sein muss (§§ 14 Abs. 2 FamFG, 130a, 298 ZPO)."
    },
    {
      "date": "2025-04-11",
      "id": "106285",
      "original_text": "Registerbekanntmachung nach dem Umwandlungsgesetz\nBaden-Württemberg Amtsgericht Mannheim HRB 740775\nHEDGEHOG Applications AG – Karlsruhe",
      "type": "Registerbekanntmachung nach dem Umwandlungsgesetz",
      "state": "Baden-Württemberg",
      "amtsgericht": "Amtsgericht Mannheim",
      "registernummer": "HRB 740775",
      "registerart": "HRB",
      "company_name": "HEDGEHOG Applications AG",
      "company_seat": "Karlsruhe",
      "details": "11.04.2025 (Bekanntmachungsdatum)\n\nBaden-Württemberg Amtsgericht Mannheim HRB 740775\nRegisterbekanntmachung nach dem Umwandlungsgesetz\n\nHEDGEHOG Applications AG\nAktiengesellschaft\nKarlsruhe\n\nDie Gesellschaft hat am 08.04.2025 den Entwurf des Verschmelzungsvertrages zwischen \"HEDGEHOG Software GmbH\", Karlsruhe (Amtsgericht Mannheim HRB 740905 )  und der hiesigen Gesellschaft (übernehmender Rechtsträger) zum Handelsregister eingereicht."
    },
    {
      "date": "2025-04-11",
      "id": "106286",
      "original_text": "Löschungsankündigung\nBaden-Württemberg Amtsgericht Ulm HRB 740106\nGiesler & Boll Fashion GmbH – Ostrach",
      "type": "Löschungsankündigung",
      "state": "Baden-Württemberg",
      "amtsgericht": "Amtsgericht Ulm",
      "registernummer": "HRB 740106",
      "registerart": "HRB",
      "company_name": "Giesler & Boll Fashion GmbH",
      "company_seat": "Ostrach",
      "details": "11.04.2025 (Bekanntmachungsdatum)\n\nBaden-Württemberg Amtsgericht Ulm HRB 740106\nLöschungsankündigung\n\nGiesler & Boll Fashion GmbH\nGesellschaft mit beschränkter Haftung\nOstrach\n\nDas Gericht beabsichtigt, die Gesellschaft wegen Vermögenslosigkeit im Handelsregister von Amts wegen nach § 394 FamFG zu löschen. Die Frist zur Geltendmachung eines Widerspruchs gegen die beabsichtigte Löschung ist auf  einen Monat ab Veröffentlichung bestimmt."
    },
    {
      "date": "2025-04-11",
      "id": "106287",
      "original_text": "Löschungsankündigung\nBaden-Württemberg Amtsgericht Ulm HRB 740106\nGiesler & Boll Fashion GmbH – Ostrach",
      "type": "Löschungsankündigung",
      "state": "Baden-Württemberg",
      "amtsgericht": "Amtsgericht Ulm",
      "registernummer": "HRB 740106",
      "registerart": "HRB",
      "company_name": "Giesler & Boll Fashion GmbH",
      "company_seat": "Ostrach",
      "details": "11.04.2025 (Bekanntmachungsdatum)\n\nBaden-Württemberg Amtsgericht Ulm HRB 740106\nLöschungsankündigung 11.04.2025 (Eintragungsdatum)\n\nGiesler & Boll Fashion GmbH\nGesellschaft mit beschränkter Haftung\nOstrach\n\nDas Gericht beabsichtigt, die Gesellschaft wegen Vermögenslosigkeit im Handelsregister von Amts wegen nach § 394 FamFG zu löschen. Die Frist zur Geltendmachung eines Widerspruchs gegen die beabsichtigte Löschung ist auf  einen Monat ab Veröffentlichung bestimmt."
    },
    {
      "date": "2025-04-11",
      "id": "106288",
      "original_text": "Löschungsankündigung\nHamburg Amtsgericht Hamburg HRA 99783\n\"Rio Ardeche\" Schifffahrtsgesellschaft mbH & Co. KG – Hamburg",
      "type": "Löschungsankündigung",
      "state": "Hamburg",
      "amtsgericht": "Amtsgericht Hamburg",
      "registernummer": "HRA 99783",
      "registerart": "HRA",
      "company_name": "\"Rio Ardeche\" Schifffahrtsgesellschaft mbH & Co. KG",
      "company_seat": "Hamburg",
      "details": "11.04.2025 (Bekanntmachungsdatum)\n\nHamburg Amtsgericht Hamburg HRA 99783\nLöschungsankündigung\n\n\"Rio Ardeche\" Schifffahrtsgesellschaft mbH & Co. KG\nKommanditgesellschaft\nHamburg\n\nDas Registergericht beabsichtigt, die im Handelsregister eingetragene Gesellschaft von Amts wegen nach § 394 Abs. 4 FamFG zu löschen. Die Frist zur Erhebung eines Widerspruchs gegen die beabsichtigte Löschung wird auf 3 Monate festgesetzt."
    },
    {
      "date": "2025-04-11",
      "id": "106289",
      "original_text": "Registerbekanntmachung nach dem Umwandlungsgesetz\nBaden-Württemberg Amtsgericht Stuttgart HRA 101809\nTheo Förch GmbH & Co. KG – Neuenstadt am Kocher",
      "type": "Registerbekanntmachung nach dem Umwandlungsgesetz",
      "state": "Baden-Württemberg",
      "amtsgericht": "Amtsgericht Stuttgart",
      "registernummer": "HRA 101809",
      "registerart": "HRA",
      "company_name": "Theo Förch GmbH & Co. KG",
      "company_seat": "Neuenstadt am Kocher",
      "details": "11.04.2025 (Bekanntmachungsdatum)\n\nBaden-Württemberg Amtsgericht Stuttgart HRA 101809\nRegisterbekanntmachung nach dem Umwandlungsgesetz 11.04.2025 (Eintragungsdatum)\n\nTheo Förch GmbH & Co. KG\nKommanditgesellschaft\nNeuenstadt am Kocher\n\nDen Gläubigern der an der Abspaltung beteiligten Rechtsträger ist, wenn sie binnen sechs Monaten nach dem Tag, an dem die Eintragung der Abspaltung in das Register des Sitzes desjenigen Rechtsträgers, dessen Gläubiger sie sind, nach § 19 Abs. 3 UmwG als bekanntgemacht gilt, ihren Anspruch nach Grund und Höhe schriftlich anmelden, Sicherheit zu leisten, soweit sie nicht Befriedigung verlangen können. Dieses Recht steht den Gläubigern jedoch nur zu, wenn sie glaubhaft machen, dass durch die Abspaltung die Erfüllung ihrer Forderung gefährdet wird."
    },
    {
      "date": "2025-04-11",
      "id": "106290",
      "original_text": "Einreichung neuer Dokumente\nBaden-Württemberg Amtsgericht Stuttgart HRB 20203\nWüstenrot & Württembergische AG – Kornwestheim",
      "type": "Einreichung neuer Dokumente",
      "state": "Baden-Württemberg",
      "amtsgericht": "Amtsgericht Stuttgart",
      "registernummer": "HRB 20203",
      "registerart": "HRB",
      "company_name": "Wüstenrot & Württembergische AG",
      "company_seat": "Kornwestheim",
      "details": "11.04.2025 (Bekanntmachungsdatum)\n\nBaden-Württemberg Amtsgericht Stuttgart HRB 20203\nEinreichung neuer Dokumente\n\nWüstenrot & Württembergische AG\nAktiengesellschaft\nKornwestheim\n\nDie Gesellschaft hat am 08.04.2025 die Liste über die Zusammensetzung des Aufsichtsrats zum Handelsregister eingereicht."
    },
    {
      "date": "2025-04-11",
      "id": "106291",
      "original_text": "Sonstige Registerbekanntmachung\nHamburg Amtsgericht Hamburg HRB 126114\nGHH - Grundbesitz und Projektentwicklung Hamburg GmbH – Hamburg",
      "type": "Sonstige Registerbekanntmachung",
      "state": "Hamburg",
      "amtsgericht": "Amtsgericht Hamburg",
      "registernummer": "HRB 126114",
      "registerart": "HRB",
      "company_name": "GHH - Grundbesitz und Projektentwicklung Hamburg GmbH",
      "company_seat": "Hamburg",
      "details": "11.04.2025 (Bekanntmachungsdatum)\n\nHamburg Amtsgericht Hamburg HRB 126114\nSonstige Registerbekanntmachung 08.04.2025 (Eintragungsdatum)\n\nGHH - Grundbesitz und Projektentwicklung Hamburg GmbH\nGesellschaft mit beschränkter Haftung\nHamburg\n\nAls nicht eingetragen wird bekannt gemacht:  Den Gläubigern der Gesellschaft, deren Forderungen begründet worden sind, bevor die Eintragung der Vertragsbeendigung in das Handelsregister nach § 10 HGB als bekannt gemacht gilt, ist vom anderen Vertragsteil Sicherheit zu leisten, wenn sie sich binnen 6 Monaten nach Bekanntmachung der Eintragung zu diesem Zweck bei ihm melden."
    },
    {
      "date": "2025-04-11",
      "id": "106292",
      "original_text": "Einreichung neuer Dokumente\nBaden-Württemberg Amtsgericht Mannheim HRB 702566\nEXXETA AG – Karlsruhe",
      "type": "Einreichung neuer Dokumente",
      "state": "Baden-Württemberg",
      "amtsgericht": "Amtsgericht Mannheim",
      "registernummer": "HRB 702566",
      "registerart": "HRB",
      "company_name": "EXXETA AG",
      "company_seat": "Karlsruhe",
      "details": "11.04.2025 (Bekanntmachungsdatum)\n\nBaden-Württemberg Amtsgericht Mannheim HRB 702566\nEinreichung neuer Dokumente 11.04.2025 (Eintragungsdatum)\n\nEXXETA AG\nAktiengesellschaft\nKarlsruhe\n\nDie Gesellschaft hat am 10.04.2025 die Liste über die Zusammensetzung des Aufsichtsrats zum Handelsregister eingereicht."
    },
    {
      "date": "2025-04-11",
      "id": "106293",
      "original_text": "Registerbekanntmachung nach dem Umwandlungsgesetz\nSchleswig-Holstein Amtsgericht Lübeck HRB 15192\nVerwaltung ECE Siebzehnte Generalübernehmer G.m.b.H. – Oststeinbek",
      "type": "Registerbekanntmachung nach dem Umwandlungsgesetz",
      "state": "Schleswig-Holstein",
      "amtsgericht": "Amtsgericht Lübeck",
      "registernummer": "HRB 15192",
      "registerart": "HRB",
      "company_name": "Verwaltung ECE Siebzehnte Generalübernehmer G.m.b.H.",
      "company_seat": "Oststeinbek",
      "details": "11.04.2025 (Bekanntmachungsdatum)\n\nSchleswig-Holstein Amtsgericht Lübeck HRB 15192\nRegisterbekanntmachung nach dem Umwandlungsgesetz 10.04.2025 (Eintragungsdatum)\n\nVerwaltung ECE Siebzehnte Generalübernehmer G.m.b.H.\nGesellschaft mit beschränkter Haftung\nOststeinbek\n\nZu Eintragungsnummer 9 vom 10.04.2025 wird als nicht eingetragen veröffentlicht: Den Gläubigern der an der Verschmelzung beteiligten Rechtsträger ist, wenn sie binnen sechs Monaten nach dem Tag, an dem die Eintragung der Verschmelzung in das Register des Sitzes desjenigen Rechtsträgers, dessen Gläubiger sie sind, als bekannt gemacht gilt, ihren Anspruch nach Grund und Höhe schriftlich anmelden, Sicherheit zu leisten, soweit sie nicht Befriedigung verlangen können. Dieses Recht steht den Gläubigern jedoch nur zu, wenn sie glaubhaft machen, dass durch die Verschmelzung die Erfüllung ihrer Forderung gefährdet wird."
    },
    {
      "date": "2025-04-11",
      "id": "106294",
      "original_text": "Einreichung neuer Dokumente\nBerlin Amtsgericht Berlin (Charlottenburg) HRB 191645\nJohannesstift Diakonie gAG – Berlin",
      "type": "Einreichung neuer Dokumente",
      "state": "Berlin",
      "amtsgericht": "Amtsgericht Berlin (Charlottenburg)",
      "registernummer": "HRB 191645",
      "registerart": "HRB",
      "company_name": "Johannesstift Diakonie gAG",
      "company_seat": "Berlin",
      "details": "11.04.2025 (Bekanntmachungsdatum)\n\nBerlin Amtsgericht Berlin (Charlottenburg) HRB 191645\nEinreichung neuer Dokumente\n\nJohannesstift Diakonie gAG\nAktiengesellschaft\nBerlin\n\nAls nicht eingetragen wird veröffentlicht: Es wurde eine neue Liste der Aufsichtsratsmitglieder eingereicht (§ 106 AktG)."
    },
    {
      "date": "2025-04-11",
      "id": "106295",
      "original_text": "Registerbekanntmachung nach dem Umwandlungsgesetz\nHamburg Amtsgericht Hamburg HRA 132039\nFlamingo Veranstaltungssaal OHG – Hamburg",
      "type": "Registerbekanntmachung nach dem Umwandlungsgesetz",
      "state": "Hamburg",
      "amtsgericht": "Amtsgericht Hamburg",
      "registernummer": "HRA 132039",
      "registerart": "HRA",
      "company_name": "Flamingo Veranstaltungssaal OHG",
      "company_seat": "Hamburg",
      "details": "11.04.2025 (Bekanntmachungsdatum)\n\nHamburg Amtsgericht Hamburg HRA 132039\nRegisterbekanntmachung nach dem Umwandlungsgesetz 11.04.2025 (Eintragungsdatum)\n\nFlamingo Veranstaltungssaal OHG\nOffene Handelsgesellschaft\nHamburg\n\nAls nicht eingetragen wird bekannt gemacht:\nDen Gläubigern der an der formwechselnden Umwandlung beteiligten Gesellschaften ist, wenn sie binnen sechs Monaten nach dem Tag, an dem die Eintragung der formwechselnden Umwandlung in das Register des Sitzes desjenigen Rechtsträgers, dessen Gläubiger sie sind, nach § 19 Absatz 3 UmwG als bekannt gemacht gilt, ihren Anspruch nach Grund und Höhe schriftlich anmelden, Sicherheit zu leisten, soweit sie nicht Befriedigung verlangen können. Dieses Recht steht den Gläubigern jedoch nur zu, wenn sie glaubhaft machen, dass durch die formwechselnde Umwandlung die Erfüllung ihrer Forderung gefährdet wird."
    },
    {
      "date": "2025-04-11",
      "id": "106296",
      "original_text": "Registerbekanntmachung nach dem Umwandlungsgesetz\nHamburg Amtsgericht Hamburg HRB 191887\nFlamingo Veranstaltungssaal GmbH – Hamburg",
      "type": "Registerbekanntmachung nach dem Umwandlungsgesetz",
      "state": "Hamburg",
      "amtsgericht": "Amtsgericht Hamburg",
      "registernummer": "HRB 191887",
      "registerart": "HRB",
      "company_name": "Flamingo Veranstaltungssaal GmbH",
      "company_seat": "Hamburg",
      "details": "11.04.2025 (Bekanntmachungsdatum)\n\nHamburg Amtsgericht Hamburg HRB 191887\nRegisterbekanntmachung nach dem Umwandlungsgesetz 11.04.2025 (Eintragungsdatum)\n\nFlamingo Veranstaltungssaal GmbH\nGesellschaft mit beschränkter Haftung\nHamburg\n\nAls nicht eingetragen wird bekannt gemacht:\nDen Gläubigern der an der formwechselnden Umwandlung beteiligten Gesellschaften ist, wenn sie binnen sechs Monaten nach dem Tag, an dem die Eintragung der formwechselnden Umwandlung in das Register des Sitzes desjenigen Rechtsträgers, dessen Gläubiger sie sind, nach § 19 Absatz 3 UmwG als bekannt gemacht gilt, ihren Anspruch nach Grund und Höhe schriftlich anmelden, Sicherheit zu leisten, soweit sie nicht Befriedigung verlangen können. Dieses Recht steht den Gläubigern jedoch nur zu, wenn sie glaubhaft machen, dass durch die formwechselnde Umwandlung die Erfüllung ihrer Forderung gefährdet wird."
    },
    {
      "date": "2025-04-11",
      "id": "106297",
      "original_text": "Registerbekanntmachung nach dem Umwandlungsgesetz\nHamburg Amtsgericht Hamburg HRB 62769\nbpx Grundstücks-Verwaltungsgesellschaft Wandsbeker Straße mbH – Hamburg",
      "type": "Registerbekanntmachung nach dem Umwandlungsgesetz",
      "state": "Hamburg",
      "amtsgericht": "Amtsgericht Hamburg",
      "registernummer": "HRB 62769",
      "registerart": "HRB",
      "company_name": "bpx Grundstücks-Verwaltungsgesellschaft Wandsbeker Straße mbH",
      "company_seat": "Hamburg",
      "details": "11.04.2025 (Bekanntmachungsdatum)\n\nHamburg Amtsgericht Hamburg HRB 62769\nRegisterbekanntmachung nach dem Umwandlungsgesetz 11.04.2025 (Eintragungsdatum)\n\nbpx Grundstücks-Verwaltungsgesellschaft Wandsbeker Straße mbH\nGesellschaft mit beschränkter Haftung\nHamburg\n\nAls nicht eingetragen wird bekannt gemacht:\nDen Gläubigern der an der Verschmelzung beteiligten Gesellschaften ist, wenn sie binnen sechs Monaten nach dem Tag, an dem die Eintragung der Verschmelzung in das Register des Sitzes desjenigen Rechtsträgers, dessen Gläubiger sie sind, nach § 19 Absatz 3 UmwG als bekannt gemacht gilt, ihren Anspruch nach Grund und Höhe schriftlich anmelden, Sicherheit zu leisten, soweit sie nicht Befriedigung verlangen können. Dieses Recht steht den Gläubigern jedoch nur zu, wenn sie glaubhaft machen, dass durch die Verschmelzung die Erfüllung ihrer Forderung gefährdet wird."
    },
    {
      "date": "2025-04-11",
      "id": "106298",
      "original_text": "Registerbekanntmachung nach dem Umwandlungsgesetz\nHamburg Amtsgericht Hamburg HRB 145066\nMMG Invest GmbH – Hamburg",
      "type": "Registerbekanntmachung nach dem Umwandlungsgesetz",
      "state": "Hamburg",
      "amtsgericht": "Amtsgericht Hamburg",
      "registernummer": "HRB 145066",
      "registerart": "HRB",
      "company_name": "MMG Invest GmbH",
      "company_seat": "Hamburg",
      "details": "11.04.2025 (Bekanntmachungsdatum)\n\nHamburg Amtsgericht Hamburg HRB 145066\nRegisterbekanntmachung nach dem Umwandlungsgesetz 11.04.2025 (Eintragungsdatum)\n\nMMG Invest GmbH\nGesellschaft mit beschränkter Haftung\nHamburg\n\nAls nicht eingetragen wird bekannt gemacht:\nDen Gläubigern der an der Verschmelzung beteiligten Gesellschaften ist, wenn sie binnen sechs Monaten nach dem Tag, an dem die Eintragung der Verschmelzung in das Register des Sitzes desjenigen Rechtsträgers, dessen Gläubiger sie sind, nach § 19 Absatz 3 UmwG als bekannt gemacht gilt, ihren Anspruch nach Grund und Höhe schriftlich anmelden, Sicherheit zu leisten, soweit sie nicht Befriedigung verlangen können. Dieses Recht steht den Gläubigern jedoch nur zu, wenn sie glaubhaft machen, dass durch die Verschmelzung die Erfüllung ihrer Forderung gefährdet wird."
    },
    {
      "date": "2025-04-11",
      "id": "106299",
      "original_text": "Löschungsankündigung\nBerlin Amtsgericht Berlin (Charlottenburg) HRB 5467\nPaul Willer Gesellschaft mit beschränkter Haftung – Berlin",
      "type": "Löschungsankündigung",
      "state": "Berlin",
      "amtsgericht": "Amtsgericht Berlin (Charlottenburg)",
      "registernummer": "HRB 5467",
      "registerart": "HRB",
      "company_name": "Paul Willer Gesellschaft mit beschränkter Haftung",
      "company_seat": "Berlin",
      "details": "11.04.2025 (Bekanntmachungsdatum)\n\nBerlin Amtsgericht Berlin (Charlottenburg) HRB 5467\nLöschungsankündigung\n\nPaul Willer Gesellschaft mit beschränkter Haftung\nGesellschaft mit beschränkter Haftung\nBerlin\n\nBei der nachstehenden Gesellschaft wird das Amtslöschungsverfahren gemäß § 394 FamFG eingeleitet. Widerspruchsfrist 6 Wochen"
    },
    {
      "date": "2025-04-11",
      "id": "106300",
      "original_text": "Registerbekanntmachung nach dem Umwandlungsgesetz\nHamburg Amtsgericht Hamburg HRB 11490\nFORUM Grundstücksgesellschaft m.b.H. – Hamburg",
      "type": "Registerbekanntmachung nach dem Umwandlungsgesetz",
      "state": "Hamburg",
      "amtsgericht": "Amtsgericht Hamburg",
      "registernummer": "HRB 11490",
      "registerart": "HRB",
      "company_name": "FORUM Grundstücksgesellschaft m.b.H.",
      "company_seat": "Hamburg",
      "details": "11.04.2025 (Bekanntmachungsdatum)\n\nHamburg Amtsgericht Hamburg HRB 11490\nRegisterbekanntmachung nach dem Umwandlungsgesetz 11.04.2025 (Eintragungsdatum)\n\nFORUM Grundstücksgesellschaft m.b.H.\nGesellschaft mit beschränkter Haftung\nHamburg\n\nAls nicht eingetragen wird bekannt gemacht:\nDen Gläubigern der an der Verschmelzung beteiligten Gesellschaften ist, wenn sie binnen sechs Monaten nach dem Tag, an dem die Eintragung der Verschmelzung in das Register des Sitzes desjenigen Rechtsträgers, dessen Gläubiger sie sind, nach § 19 Absatz 3 UmwG als bekannt gemacht gilt, ihren Anspruch nach Grund und Höhe schriftlich anmelden, Sicherheit zu leisten, soweit sie nicht Befriedigung verlangen können. Dieses Recht steht den Gläubigern jedoch nur zu, wenn sie glaubhaft machen, dass durch die Verschmelzung die Erfüllung ihrer Forderung gefährdet wird."
    },
    {
      "date": "2025-04-11",
      "id": "106301",
      "original_text": "Löschungsankündigung\nBrandenburg Amtsgericht Potsdam HRB 32837\nGSB ICT GmbH – Potsdam",
      "type": "Löschungsankündigung",
      "state": "Brandenburg",
      "amtsgericht": "Amtsgericht Potsdam",
      "registernummer": "HRB 32837",
      "registerart": "HRB",
      "company_name": "GSB ICT GmbH",
      "company_seat": "Potsdam",
      "details": "11.04.2025 (Bekanntmachungsdatum)\n\nBrandenburg Amtsgericht Potsdam HRB 32837\nLöschungsankündigung\n\nGSB ICT GmbH\nGesellschaft mit beschränkter Haftung\nPotsdam\n\nBei der nachstehenden Gesellschaft wird das Amtslöschungsverfahren gemäß § 394 FamFG eingeleitet. Widerspruchsfrist: 8 Wochen"
    },
    {
      "date": "2025-04-11",
      "id": "106302",
      "original_text": "Sonstige Registerbekanntmachung\nSachsen-Anhalt Amtsgericht Stendal VR 31216\nDEGP Deutsch-Europäischer Genossenschafts- und Prüfungsverband e.V. – Dessau-Roßlau",
      "type": "Sonstige Registerbekanntmachung",
      "state": "Sachsen-Anhalt",
      "amtsgericht": "Amtsgericht Stendal",
      "registernummer": "VR 31216",
      "registerart": "VR",
      "company_name": "DEGP Deutsch-Europäischer Genossenschafts- und Prüfungsverband e.V.",
      "company_seat": "Dessau-Roßlau",
      "details": "11.04.2025 (Bekanntmachungsdatum)\n\nSachsen-Anhalt Amtsgericht Stendal VR 31216\nSonstige Registerbekanntmachung\n\nDEGP Deutsch-Europäischer Genossenschafts- und Prüfungsverband e.V.\neingetragener Verein\nDessau-Roßlau\n\nHinsichtlich o.g. Vereins ist beabsichtigt, Rechtsanwalt Oliver Heising, Hamburg, zum Notvorstand zu bestellen. Die Frist zu Einreichung etwaiger Stellungnahmen bzw. Erhebung eines Widerspruchs beim Amtsgericht Stendal wird auf 2 Wochen festgesetzt."
    },
    {
      "date": "2025-04-11",
      "id": "106303",
      "original_text": "Registerbekanntmachung nach dem Umwandlungsgesetz\nSachsen-Anhalt Amtsgericht Stendal HRB 3687\nGmbH Milchproduktion Miltern – Tangermünde",
      "type": "Registerbekanntmachung nach dem Umwandlungsgesetz",
      "state": "Sachsen-Anhalt",
      "amtsgericht": "Amtsgericht Stendal",
      "registernummer": "HRB 3687",
      "registerart": "HRB",
      "company_name": "GmbH Milchproduktion Miltern",
      "company_seat": "Tangermünde",
      "details": "11.04.2025 (Bekanntmachungsdatum)\n\nSachsen-Anhalt Amtsgericht Stendal HRB 3687\nRegisterbekanntmachung nach dem Umwandlungsgesetz 11.04.2025 (Eintragungsdatum)\n\nGmbH Milchproduktion Miltern\nGesellschaft mit beschränkter Haftung\nTangermünde\n\nDie Gesellschaft ist auf Grund des Verschmelzungsvertrages vom 20.02.2025 sowie der Beschlüsse der Gesellschafterversammlungen vom selben Tag mit der Agrargenossenschaft Miltern eG mit dem Sitz in Tangermünde OT Miltern (Amtsgericht Stendal GnR 131) verschmolzen. Die Verschmelzung ist mit der Eintragung der Verschmelzung in das Handelsregister der übernehmenden Gesellschaft am 11.04.2025 wirksam geworden.Nicht eingetragen:Den Gläubigern der an der Verschmelzung beteiligten Rechtsträger ist, wenn sie binnen sechs Monaten nach dem Tag, an dem die Eintragung der Verschmelzung nach § 19 Abs. 3 UmwG als bekanntgemacht gilt, ihren Anspruch nach Grund und Höhe schriftlich anmelden, Sicherheit zu leisten, soweit sie nicht Befriedigung verlangen können. Dieses Recht steht ihnen jedoch nur zu, wenn sie glaubhaft machen, dass durch die Verschmelzung die Erfüllung ihrer Forderung gefährdet wird."
    },
    {
      "date": "2025-04-11",
      "id": "106304",
      "original_text": "Registerbekanntmachung nach dem Umwandlungsgesetz\nSachsen-Anhalt Amtsgericht Stendal GnR 131\nAgrargenossenschaft Miltern eG – Tangermünde OT Miltern",
      "type": "Registerbekanntmachung nach dem Umwandlungsgesetz",
      "state": "Sachsen-Anhalt",
      "amtsgericht": "Amtsgericht Stendal",
      "registernummer": "GnR 131",
      "registerart": "GnR",
      "company_name": "Agrargenossenschaft Miltern eG",
      "company_seat": "Tangermünde OT Miltern",
      "details": "11.04.2025 (Bekanntmachungsdatum)\n\nSachsen-Anhalt Amtsgericht Stendal GnR 131\nRegisterbekanntmachung nach dem Umwandlungsgesetz 11.04.2025 (Eintragungsdatum)\n\nAgrargenossenschaft Miltern eG\neingetragene Genossenschaft\nTangermünde OT Miltern\n\nNicht eingetragen:\nDen Gläubigern der an der Verschmelzung beteiligten Rechtsträger ist, wenn sie binnen sechs Monaten nach dem Tag, an dem die Eintragung der Verschmelzung nach § 19 Abs. 3 UmwG als bekanntgemacht gilt, ihren Anspruch nach Grund und Höhe schriftlich anmelden, Sicherheit zu leisten, soweit sie nicht Befriedigung verlangen können. Dieses Recht steht ihnen jedoch nur zu, wenn sie glaubhaft machen, dass durch die Verschmelzung die Erfüllung ihrer Forderung gefährdet wird."
    },
    {
      "date": "2025-04-11",
      "id": "106305",
      "original_text": "Registerbekanntmachung nach dem Umwandlungsgesetz\nBaden-Württemberg Amtsgericht Stuttgart HRB 22197\nObjektgesellschaft Dornacher Tor mbH – Stuttgart",
      "type": "Registerbekanntmachung nach dem Umwandlungsgesetz",
      "state": "Baden-Württemberg",
      "amtsgericht": "Amtsgericht Stuttgart",
      "registernummer": "HRB 22197",
      "registerart": "HRB",
      "company_name": "Objektgesellschaft Dornacher Tor mbH",
      "company_seat": "Stuttgart",
      "details": "11.04.2025 (Bekanntmachungsdatum)\n\nBaden-Württemberg Amtsgericht Stuttgart HRB 22197\nRegisterbekanntmachung nach dem Umwandlungsgesetz 11.04.2025 (Eintragungsdatum)\n\nObjektgesellschaft Dornacher Tor mbH\nGesellschaft mit beschränkter Haftung\nStuttgart\n\nDen Gläubigern der an der Verschmelzung beteiligten Rechtsträger ist, wenn sie binnen sechs Monaten nach dem Tag, an dem die Eintragung der Verschmelzung in das Register des Sitzes desjenigen Rechtsträgers, dessen Gläubiger sie sind, nach § 19 Abs. 3 UmwG als bekanntgemacht gilt, ihren Anspruch nach Grund und Höhe schriftlich anmelden, Sicherheit zu leisten, soweit sie nicht Befriedigung verlangen können. Dieses Recht steht den Gläubigern jedoch nur zu, wenn sie glaubhaft machen, dass durch die Verschmelzung die Erfüllung ihrer Forderung gefährdet wird."
    },
    {
      "date": "2025-04-11",
      "id": "106306",
      "original_text": "Einreichung neuer Dokumente\nBerlin Amtsgericht Berlin (Charlottenburg) HRB 76315\nAgentscape AG – Berlin",
      "type": "Einreichung neuer Dokumente",
      "state": "Berlin",
      "amtsgericht": "Amtsgericht Berlin (Charlottenburg)",
      "registernummer": "HRB 76315",
      "registerart": "HRB",
      "company_name": "Agentscape AG",
      "company_seat": "Berlin",
      "details": "11.04.2025 (Bekanntmachungsdatum)\n\nBerlin Amtsgericht Berlin (Charlottenburg) HRB 76315\nEinreichung neuer Dokumente\n\nAgentscape AG\nAktiengesellschaft\nBerlin\n\nAls nicht eingetragen wird veröffentlicht: Es wurde eine neue Liste der Aufsichtsratsmitglieder eingereicht (§ 106 AktG)."
    },
    {
      "date": "2025-04-11",
      "id": "106307",
      "original_text": "Löschungsankündigung\nBrandenburg Amtsgericht Potsdam HRB 22767\nKOCMO Service GmbH – Stahnsdorf",
      "type": "Löschungsankündigung",
      "state": "Brandenburg",
      "amtsgericht": "Amtsgericht Potsdam",
      "registernummer": "HRB 22767",
      "registerart": "HRB",
      "company_name": "KOCMO Service GmbH",
      "company_seat": "Stahnsdorf",
      "details": "11.04.2025 (Bekanntmachungsdatum)\n\nBrandenburg Amtsgericht Potsdam HRB 22767\nLöschungsankündigung\n\nKOCMO Service GmbH\nGesellschaft mit beschränkter Haftung\nStahnsdorf\n\nBei der nachstehenden Gesellschaft wird das Amtslöschungsverfahren gemäß § 394 FamFG eingeleitet. Widerspruchsfrist: 8 Wochen"
    },
    {
      "date": "2025-04-11",
      "id": "106308",
      "original_text": "Registerbekanntmachung nach dem Umwandlungsgesetz\nHamburg Amtsgericht Hamburg HRB 172012\nMICOL GmbH – Hamburg",
      "type": "Registerbekanntmachung nach dem Umwandlungsgesetz",
      "state": "Hamburg",
      "amtsgericht": "Amtsgericht Hamburg",
      "registernummer": "HRB 172012",
      "registerart": "HRB",
      "company_name": "MICOL GmbH",
      "company_seat": "Hamburg",
      "details": "11.04.2025 (Bekanntmachungsdatum)\n\nHamburg Amtsgericht Hamburg HRB 172012\nRegisterbekanntmachung nach dem Umwandlungsgesetz 11.04.2025 (Eintragungsdatum)\n\nMICOL GmbH\nGesellschaft mit beschränkter Haftung\nHamburg\n\nAls nicht eingetragen wird bekannt gemacht:\nDen Gläubigern der an der Verschmelzung beteiligten Gesellschaften ist, wenn sie binnen sechs Monaten nach dem Tag, an dem die Eintragung der Verschmelzung in das Register des Sitzes desjenigen Rechtsträgers, dessen Gläubiger sie sind, nach § 19 Absatz 3 UmwG als bekannt gemacht gilt, ihren Anspruch nach Grund und Höhe schriftlich anmelden, Sicherheit zu leisten, soweit sie nicht Befriedigung verlangen können. Dieses Recht steht den Gläubigern jedoch nur zu, wenn sie glaubhaft machen, dass durch die Verschmelzung die Erfüllung ihrer Forderung gefährdet wird."
    },
    {
      "date": "2025-04-11",
      "id": "106309",
      "original_text": "Registerbekanntmachung nach dem Umwandlungsgesetz\nHamburg Amtsgericht Hamburg HRB 173244\nVALF erste GmbH – Hamburg",
      "type": "Registerbekanntmachung nach dem Umwandlungsgesetz",
      "state": "Hamburg",
      "amtsgericht": "Amtsgericht Hamburg",
      "registernummer": "HRB 173244",
      "registerart": "HRB",
      "company_name": "VALF erste GmbH",
      "company_seat": "Hamburg",
      "details": "11.04.2025 (Bekanntmachungsdatum)\n\nHamburg Amtsgericht Hamburg HRB 173244\nRegisterbekanntmachung nach dem Umwandlungsgesetz 11.04.2025 (Eintragungsdatum)\n\nVALF erste GmbH\nGesellschaft mit beschränkter Haftung\nHamburg\n\nAls nicht eingetragen wird bekannt gemacht:\nDen Gläubigern der an der Verschmelzung beteiligten Gesellschaften ist, wenn sie binnen sechs Monaten nach dem Tag, an dem die Eintragung der Verschmelzung in das Register des Sitzes desjenigen Rechtsträgers, dessen Gläubiger sie sind, nach § 19 Absatz 3 UmwG als bekannt gemacht gilt, ihren Anspruch nach Grund und Höhe schriftlich anmelden, Sicherheit zu leisten, soweit sie nicht Befriedigung verlangen können. Dieses Recht steht den Gläubigern jedoch nur zu, wenn sie glaubhaft machen, dass durch die Verschmelzung die Erfüllung ihrer Forderung gefährdet wird."
    },
    {
      "date": "2025-04-11",
      "id": "106310",
      "original_text": "Löschungsankündigung\nBaden-Württemberg Amtsgericht Ulm HRB 747477\nBK Partner Bau UG (haftungsbeschränkt) – Geislingen an der Steige",
      "type": "Löschungsankündigung",
      "state": "Baden-Württemberg",
      "amtsgericht": "Amtsgericht Ulm",
      "registernummer": "HRB 747477",
      "registerart": "HRB",
      "company_name": "BK Partner Bau UG (haftungsbeschränkt)",
      "company_seat": "Geislingen an der Steige",
      "details": "11.04.2025 (Bekanntmachungsdatum)\n\nBaden-Württemberg Amtsgericht Ulm HRB 747477\nLöschungsankündigung\n\nBK Partner Bau UG (haftungsbeschränkt)\nGesellschaft mit beschränkter Haftung\nGeislingen an der Steige\n\nAls nicht eingetragen wird bekanntgemacht:\nDas Gericht beabsichtigt, die Gesellschaft wegen Vermögenslosigkeit im Handelsregister von Amts wegen nach § 394 FamFG zu löschen. Die Frist zur Geltendmachung eines Widerspruchs gegen die beabsichtigte Löschung ist auf  einen Monat ab Veröffentlichung bestimmt."
    },
    {
      "date": "2025-04-11",
      "id": "106311",
      "original_text": "Löschungsankündigung\nBerlin Amtsgericht Berlin (Charlottenburg) HRB 137698\nADT - tec Vertriebs GmbH – Berlin",
      "type": "Löschungsankündigung",
      "state": "Berlin",
      "amtsgericht": "Amtsgericht Berlin (Charlottenburg)",
      "registernummer": "HRB 137698",
      "registerart": "HRB",
      "company_name": "ADT - tec Vertriebs GmbH",
      "company_seat": "Berlin",
      "details": "11.04.2025 (Bekanntmachungsdatum)\n\nBerlin Amtsgericht Berlin (Charlottenburg) HRB 137698\nLöschungsankündigung\n\nADT - tec Vertriebs GmbH\nGesellschaft mit beschränkter Haftung\nBerlin\n\nBei der nachstehenden Gesellschaft wird das Amtslöschungsverfahren gemäß § 394 FamFG eingeleitet. Widerspruchsfrist 6 Wochen"
    },
    {
      "date": "2025-04-11",
      "id": "106312",
      "original_text": "Löschungsankündigung\nHamburg Amtsgericht Hamburg HRB 102710\nDEBESTDEALS GmbH – Hamburg",
      "type": "Löschungsankündigung",
      "state": "Hamburg",
      "amtsgericht": "Amtsgericht Hamburg",
      "registernummer": "HRB 102710",
      "registerart": "HRB",
      "company_name": "DEBESTDEALS GmbH",
      "company_seat": "Hamburg",
      "details": "11.04.2025 (Bekanntmachungsdatum)\n\nHamburg Amtsgericht Hamburg HRB 102710\nLöschungsankündigung\n\nDEBESTDEALS GmbH\nGesellschaft mit beschränkter Haftung\nHamburg\n\nDas Registergericht beabsichtigt, die im Handelsregister eingetragene Gesellschaft von Amts wegen nach § 394 FamFG zu löschen. Die Frist zur Erhebung eines Widerspruchs gegen die beabsichtigte Löschung wird auf 3 Monate festgesetzt."
    },
    {
      "date": "2025-04-11",
      "id": "106313",
      "original_text": "Löschungsankündigung\nBaden-Württemberg Amtsgericht Freiburg HRB 720954\nGamze UG (haftungsbeschränkt) – Singen Hohentwiel",
      "type": "Löschungsankündigung",
      "state": "Baden-Württemberg",
      "amtsgericht": "Amtsgericht Freiburg",
      "registernummer": "HRB 720954",
      "registerart": "HRB",
      "company_name": "Gamze UG (haftungsbeschränkt)",
      "company_seat": "Singen Hohentwiel",
      "details": "11.04.2025 (Bekanntmachungsdatum)\n\nBaden-Württemberg Amtsgericht Freiburg HRB 720954\nLöschungsankündigung\n\nGamze UG (haftungsbeschränkt)\nGesellschaft mit beschränkter Haftung\nSingen Hohentwiel\n\nDas Gericht beabsichtigt, die Gesellschaft wegen Vermögenslosigkeit im Handelsregister von Amts wegen nach § 394 FamFG zu löschen. Die Frist zur Geltendmachung eines Widerspruchs gegen die beabsichtigte Löschung ist auf einen Monat ab Veröffentlichung bestimmt."
    },
    {
      "date": "2025-04-11",
      "id": "106314",
      "original_text": "Löschungsankündigung\nBerlin Amtsgericht Berlin (Charlottenburg) HRB 124067\nKrankentransport Spandau UG (haftungsbeschränkt) – Berlin",
      "type": "Löschungsankündigung",
      "state": "Berlin",
      "amtsgericht": "Amtsgericht Berlin (Charlottenburg)",
      "registernummer": "HRB 124067",
      "registerart": "HRB",
      "company_name": "Krankentransport Spandau UG (haftungsbeschränkt)",
      "company_seat": "Berlin",
      "details": "11.04.2025 (Bekanntmachungsdatum)\n\nBerlin Amtsgericht Berlin (Charlottenburg) HRB 124067\nLöschungsankündigung\n\nKrankentransport Spandau UG (haftungsbeschränkt)\nGesellschaft mit beschränkter Haftung\nBerlin\n\nBei der nachstehenden Gesellschaft wird das Amtslöschungsverfahren gemäß § 394 FamFG eingeleitet. Widerspruchsfrist 6 Wochen"
    },
    {
      "date": "2025-04-11",
      "id": "106315",
      "original_text": "Löschungsankündigung\nHamburg Amtsgericht Hamburg HRB 148426\nAJBI GmbH – Hamburg",
      "type": "Löschungsankündigung",
      "state": "Hamburg",
      "amtsgericht": "Amtsgericht Hamburg",
      "registernummer": "HRB 148426",
      "registerart": "HRB",
      "company_name": "AJBI GmbH",
      "company_seat": "Hamburg",
      "details": "11.04.2025 (Bekanntmachungsdatum)\n\nHamburg Amtsgericht Hamburg HRB 148426\nLöschungsankündigung\n\nAJBI GmbH\nGesellschaft mit beschränkter Haftung\nHamburg\n\nDas Registergericht beabsichtigt, die im Handelsregister eingetragene Gesellschaft von Amts wegen nach § 394 FamFG zu löschen. Die Frist zur Erhebung eines Widerspruchs gegen die beabsichtigte Löschung wird auf 3 Monate festgesetzt."
    },
    {
      "date": "2025-04-11",
      "id": "106316",
      "original_text": "Löschungsankündigung\nHamburg Amtsgericht Hamburg HRB 178108\nBS Hochbau & Dienstleistungs GmbH – Hamburg",
      "type": "Löschungsankündigung",
      "state": "Hamburg",
      "amtsgericht": "Amtsgericht Hamburg",
      "registernummer": "HRB 178108",
      "registerart": "HRB",
      "company_name": "BS Hochbau & Dienstleistungs GmbH",
      "company_seat": "Hamburg",
      "details": "11.04.2025 (Bekanntmachungsdatum)\n\nHamburg Amtsgericht Hamburg HRB 178108\nLöschungsankündigung\n\nBS Hochbau & Dienstleistungs GmbH\nGesellschaft mit beschränkter Haftung\nHamburg\n\nDas Registergericht beabsichtigt, die im Handelsregister eingetragene Gesellschaft von Amts wegen nach § 394 FamFG zu löschen. Die Frist zur Erhebung eines Widerspruchs gegen die beabsichtigte Löschung wird auf 3 Monate festgesetzt."
    },
    {
      "date": "2025-04-11",
      "id": "106317",
      "original_text": "Löschungsankündigung\nHamburg Amtsgericht Hamburg HRA 80754\nGeorg Kammenhuber GmbH & Co. – Hamburg",
      "type": "Löschungsankündigung",
      "state": "Hamburg",
      "amtsgericht": "Amtsgericht Hamburg",
      "registernummer": "HRA 80754",
      "registerart": "HRA",
      "company_name": "Georg Kammenhuber GmbH & Co.",
      "company_seat": "Hamburg",
      "details": "11.04.2025 (Bekanntmachungsdatum)\n\nHamburg Amtsgericht Hamburg HRA 80754\nLöschungsankündigung\n\nGeorg Kammenhuber GmbH & Co.\nKommanditgesellschaft\nHamburg\n\nDas Registergericht beabsichtigt, die im Handelsregister eingetragene Gesellschaft von Amts wegen nach § 394 FamFG zu löschen. Die Frist zur Erhebung eines Widerspruchs gegen die beabsichtigte Löschung wird auf 3 Monate festgesetzt."
    },
    {
      "date": "2025-04-11",
      "id": "106318",
      "original_text": "Löschungsankündigung\nHamburg Amtsgericht Hamburg HRB 158708\nElektromechanik Trading & Export GmbH – Hamburg",
      "type": "Löschungsankündigung",
      "state": "Hamburg",
      "amtsgericht": "Amtsgericht Hamburg",
      "registernummer": "HRB 158708",
      "registerart": "HRB",
      "company_name": "Elektromechanik Trading & Export GmbH",
      "company_seat": "Hamburg",
      "details": "11.04.2025 (Bekanntmachungsdatum)\n\nHamburg Amtsgericht Hamburg HRB 158708\nLöschungsankündigung\n\nElektromechanik Trading & Export GmbH\nGesellschaft mit beschränkter Haftung\nHamburg\n\nDas Registergericht beabsichtigt, die im Handelsregister eingetragene Gesellschaft von Amts wegen nach § 394 FamFG zu löschen. Die Frist zur Erhebung eines Widerspruchs gegen die beabsichtigte Löschung wird auf 3 Monate festgesetzt."
    },
    {
      "date": "2025-04-11",
      "id": "106319",
      "original_text": "Löschungsankündigung\nHamburg Amtsgericht Hamburg HRB 161422\nKiyano GmbH – Hamburg",
      "type": "Löschungsankündigung",
      "state": "Hamburg",
      "amtsgericht": "Amtsgericht Hamburg",
      "registernummer": "HRB 161422",
      "registerart": "HRB",
      "company_name": "Kiyano GmbH",
      "company_seat": "Hamburg",
      "details": "11.04.2025 (Bekanntmachungsdatum)\n\nHamburg Amtsgericht Hamburg HRB 161422\nLöschungsankündigung\n\nKiyano GmbH\nGesellschaft mit beschränkter Haftung\nHamburg\n\nDas Registergericht beabsichtigt, die im Handelsregister eingetragene Gesellschaft von Amts wegen nach § 394 FamFG zu löschen. Die Frist zur Erhebung eines Widerspruchs gegen die beabsichtigte Löschung wird auf 3 Monate festgesetzt."
    },
    {
      "date": "2025-04-11",
      "id": "106320",
      "original_text": "Löschungsankündigung\nHamburg Amtsgericht Hamburg HRB 176331\nCityline Spedition GmbH – Hamburg",
      "type": "Löschungsankündigung",
      "state": "Hamburg",
      "amtsgericht": "Amtsgericht Hamburg",
      "registernummer": "HRB 176331",
      "registerart": "HRB",
      "company_name": "Cityline Spedition GmbH",
      "company_seat": "Hamburg",
      "details": "11.04.2025 (Bekanntmachungsdatum)\n\nHamburg Amtsgericht Hamburg HRB 176331\nLöschungsankündigung\n\nCityline Spedition GmbH\nGesellschaft mit beschränkter Haftung\nHamburg\n\nDas Registergericht beabsichtigt, die im Handelsregister eingetragene Gesellschaft von Amts wegen nach § 394 FamFG zu löschen. Die Frist zur Erhebung eines Widerspruchs gegen die beabsichtigte Löschung wird auf 3 Monate festgesetzt."
    },
    {
      "date": "2025-04-11",
      "id": "106321",
      "original_text": "Löschungsankündigung\nHamburg Amtsgericht Hamburg HRB 178534\nK + K Die Verputzer GmbH – Hamburg",
      "type": "Löschungsankündigung",
      "state": "Hamburg",
      "amtsgericht": "Amtsgericht Hamburg",
      "registernummer": "HRB 178534",
      "registerart": "HRB",
      "company_name": "K + K Die Verputzer GmbH",
      "company_seat": "Hamburg",
      "details": "11.04.2025 (Bekanntmachungsdatum)\n\nHamburg Amtsgericht Hamburg HRB 178534\nLöschungsankündigung\n\nK + K Die Verputzer GmbH\nGesellschaft mit beschränkter Haftung\nHamburg\n\nDas Registergericht beabsichtigt, die im Handelsregister eingetragene Gesellschaft von Amts wegen nach § 394 FamFG zu löschen. Die Frist zur Erhebung eines Widerspruchs gegen die beabsichtigte Löschung wird auf 3 Monate festgesetzt."
    },
    {
      "date": "2025-04-11",
      "id": "106322",
      "original_text": "Löschungsankündigung\nHamburg Amtsgericht Hamburg HRB 149103\nsoftbillig.de UG (haftungsbeschränkt) – Hamburg",
      "type": "Löschungsankündigung",
      "state": "Hamburg",
      "amtsgericht": "Amtsgericht Hamburg",
      "registernummer": "HRB 149103",
      "registerart": "HRB",
      "company_name": "softbillig.de UG (haftungsbeschränkt)",
      "company_seat": "Hamburg",
      "details": "11.04.2025 (Bekanntmachungsdatum)\n\nHamburg Amtsgericht Hamburg HRB 149103\nLöschungsankündigung\n\nsoftbillig.de UG (haftungsbeschränkt)\nGesellschaft mit beschränkter Haftung\nHamburg\n\nDas Registergericht beabsichtigt, die im Handelsregister eingetragene Gesellschaft von Amts wegen nach § 394 FamFG zu löschen. Die Frist zur Erhebung eines Widerspruchs gegen die beabsichtigte Löschung wird auf 3 Monate festgesetzt."
    },
    {
      "date": "2025-04-11",
      "id": "106323",
      "original_text": "Löschungsankündigung\nThüringen Amtsgericht Jena HRB 515472\nConstantin Security GmbH – Mühlhausen",
      "type": "Löschungsankündigung",
      "state": "Thüringen",
      "amtsgericht": "Amtsgericht Jena",
      "registernummer": "HRB 515472",
      "registerart": "HRB",
      "company_name": "Constantin Security GmbH",
      "company_seat": "Mühlhausen",
      "details": "11.04.2025 (Bekanntmachungsdatum)\n\nThüringen Amtsgericht Jena HRB 515472\nLöschungsankündigung\n\nConstantin Security GmbH\nGesellschaft mit beschränkter Haftung\nMühlhausen\n\nDas Registergericht beabsichtigt, die im Handelsregister eingetragene Gesellschaft wegen Vermögenslosigkeit nach § 394 FamFG von Amts wegen zu löschen. Die Frist zur Erhebung eines Widerspruchs gegen die beabsichtigte Löschung wird auf 6 Wochen festgesetzt."
    },
    {
      "date": "2025-04-11",
      "id": "106324",
      "original_text": "Löschungsankündigung\nThüringen Amtsgericht Jena HRB 516552\nHighclickers.com GmbH – Greiz",
      "type": "Löschungsankündigung",
      "state": "Thüringen",
      "amtsgericht": "Amtsgericht Jena",
      "registernummer": "HRB 516552",
      "registerart": "HRB",
      "company_name": "Highclickers.com GmbH",
      "company_seat": "Greiz",
      "details": "11.04.2025 (Bekanntmachungsdatum)\n\nThüringen Amtsgericht Jena HRB 516552\nLöschungsankündigung\n\nHighclickers.com GmbH\nGesellschaft mit beschränkter Haftung\nGreiz\n\nDas Registergericht beabsichtigt, die im Handelsregister eingetragene Gesellschaft wegen Vermögenslosigkeit nach § 394 FamFG von Amts wegen zu löschen. Die Frist zur Erhebung eines Widerspruchs gegen die beabsichtigte Löschung wird auf 6 Wochen festgesetzt."
    },
    {
      "date": "2025-04-11",
      "id": "106325",
      "original_text": "Einreichung neuer Dokumente\nThüringen Amtsgericht Jena HRB 501492\nComTS GmbH – Erfurt",
      "type": "Einreichung neuer Dokumente",
      "state": "Thüringen",
      "amtsgericht": "Amtsgericht Jena",
      "registernummer": "HRB 501492",
      "registerart": "HRB",
      "company_name": "ComTS GmbH",
      "company_seat": "Erfurt",
      "details": "11.04.2025 (Bekanntmachungsdatum)\n\nThüringen Amtsgericht Jena HRB 501492\nEinreichung neuer Dokumente\n\nComTS GmbH\nGesellschaft mit beschränkter Haftung\nErfurt\n\nBekanntmachung gem. § 52 Abs. 3 Satz 2 GmbHG: Aufgrund einer Veränderung in den Personen der Aufsichtsratsmitglieder ist durch die Geschäftsführer eine neue Liste zum Handelsregister eingereicht worden."
    },
    {
      "date": "2025-04-11",
      "id": "106326",
      "original_text": "Löschungsankündigung\nThüringen Amtsgericht Jena HRB 516183\nwepe gastro UG (haftungsbeschränkt) – Gera",
      "type": "Löschungsankündigung",
      "state": "Thüringen",
      "amtsgericht": "Amtsgericht Jena",
      "registernummer": "HRB 516183",
      "registerart": "HRB",
      "company_name": "wepe gastro UG (haftungsbeschränkt)",
      "company_seat": "Gera",
      "details": "11.04.2025 (Bekanntmachungsdatum)\n\nThüringen Amtsgericht Jena HRB 516183\nLöschungsankündigung\n\nwepe gastro UG (haftungsbeschränkt)\nGesellschaft mit beschränkter Haftung\nGera\n\nDas Registergericht beabsichtigt, die im Handelsregister eingetragene Gesellschaft wegen Vermögenslosigkeit nach § 394 FamFG von Amts wegen zu löschen. Die Frist zur Erhebung eines Widerspruchs gegen die beabsichtigte Löschung wird auf 6 Wochen festgesetzt."
    },
    {
      "date": "2025-04-11",
      "id": "106327",
      "original_text": "Löschungsankündigung\nThüringen Amtsgericht Jena HRB 513363\nBäckerei Rabe UG (haftungsbeschränkt) – Eisenach",
      "type": "Löschungsankündigung",
      "state": "Thüringen",
      "amtsgericht": "Amtsgericht Jena",
      "registernummer": "HRB 513363",
      "registerart": "HRB",
      "company_name": "Bäckerei Rabe UG (haftungsbeschränkt)",
      "company_seat": "Eisenach",
      "details": "11.04.2025 (Bekanntmachungsdatum)\n\nThüringen Amtsgericht Jena HRB 513363\nLöschungsankündigung\n\nBäckerei Rabe UG (haftungsbeschränkt)\nGesellschaft mit beschränkter Haftung\nEisenach\n\nDas Registergericht beabsichtigt, die im Handelsregister eingetragene Gesellschaft wegen Vermögenslosigkeit nach § 394 FamFG von Amts wegen zu löschen. Die Frist zur Erhebung eines Widerspruchs gegen die beabsichtigte Löschung wird auf 6 Wochen festgesetzt."
    },
    {
      "date": "2025-04-11",
      "id": "106328",
      "original_text": "Löschungsankündigung\nHamburg Amtsgericht Hamburg HRA 120755\nAdactus UG (haftungsbeschränkt) & Co. KG – Hamburg",
      "type": "Löschungsankündigung",
      "state": "Hamburg",
      "amtsgericht": "Amtsgericht Hamburg",
      "registernummer": "HRA 120755",
      "registerart": "HRA",
      "company_name": "Adactus UG (haftungsbeschränkt) & Co. KG",
      "company_seat": "Hamburg",
      "details": "11.04.2025 (Bekanntmachungsdatum)\n\nHamburg Amtsgericht Hamburg HRA 120755\nLöschungsankündigung\n\nAdactus UG (haftungsbeschränkt) & Co. KG\nKommanditgesellschaft\nHamburg\n\nDas Registergericht beabsichtigt, die im Handelsregister eingetragene Gesellschaft von Amts wegen nach § 394 FamFG zu löschen. Die Frist zur Erhebung eines Widerspruchs gegen die beabsichtigte Löschung wird auf 3 Monate festgesetzt."
    },
    {
      "date": "2025-04-11",
      "id": "106329",
      "original_text": "Löschungsankündigung\nHamburg Amtsgericht Hamburg VR 20454\nOlymp e.V. – Hamburg",
      "type": "Löschungsankündigung",
      "state": "Hamburg",
      "amtsgericht": "Amtsgericht Hamburg",
      "registernummer": "VR 20454",
      "registerart": "VR",
      "company_name": "Olymp e.V.",
      "company_seat": "Hamburg",
      "details": "11.04.2025 (Bekanntmachungsdatum)\n\nHamburg Amtsgericht Hamburg VR 20454\nLöschungsankündigung\n\nOlymp e.V.\neingetragener Verein\nHamburg\n\nDas Registergericht beabsichtigt, den im Vereinsregister eingetragenen Verein von Amts wegen nach § 395 FamFG zu löschen, da nach den angestellten Ermittlungen dieser Verein offenbar nicht mehr besteht. Die Frist zur Erhebung eines Widerspruchs gegen die beabsichtigte Löschung wird auf 3 Monate festgesetzt."
    },
    {
      "date": "2025-04-11",
      "id": "106330",
      "original_text": "Löschungsankündigung\nHamburg Amtsgericht Hamburg HRA 113901\nH&S Heizung Sanitär Installationsgesellschaft KG – Hamburg",
      "type": "Löschungsankündigung",
      "state": "Hamburg",
      "amtsgericht": "Amtsgericht Hamburg",
      "registernummer": "HRA 113901",
      "registerart": "HRA",
      "company_name": "H&S Heizung Sanitär Installationsgesellschaft KG",
      "company_seat": "Hamburg",
      "details": "11.04.2025 (Bekanntmachungsdatum)\n\nHamburg Amtsgericht Hamburg HRA 113901\nLöschungsankündigung\n\nH&S Heizung Sanitär Installationsgesellschaft KG\nKommanditgesellschaft\nHamburg\n\nDas Registergericht beabsichtigt, die im Handelsregister eingetragene Gesellschaft von Amts wegen nach § 394 FamFG zu löschen. Die Frist zur Erhebung eines Widerspruchs gegen die beabsichtigte Löschung wird auf 3 Monate festgesetzt."
    },
    {
      "date": "2025-04-11",
      "id": "106331",
      "original_text": "Löschungsankündigung\nHamburg Amtsgericht Hamburg HRA 110005\nM&M: Trading ! Hamburg GmbH & Co. KG – Hamburg",
      "type": "Löschungsankündigung",
      "state": "Hamburg",
      "amtsgericht": "Amtsgericht Hamburg",
      "registernummer": "HRA 110005",
      "registerart": "HRA",
      "company_name": "M&M: Trading ! Hamburg GmbH & Co. KG",
      "company_seat": "Hamburg",
      "details": "11.04.2025 (Bekanntmachungsdatum)\n\nHamburg Amtsgericht Hamburg HRA 110005\nLöschungsankündigung\n\nM&M: Trading ! Hamburg GmbH & Co. KG\nKommanditgesellschaft\nHamburg\n\nDas Registergericht beabsichtigt, die im Handelsregister eingetragene Gesellschaft von Amts wegen nach § 394 FamFG zu löschen. Die Frist zur Erhebung eines Widerspruchs gegen die beabsichtigte Löschung wird auf 3 Monate festgesetzt."
    },
    {
      "date": "2025-04-11",
      "id": "106332",
      "original_text": "Löschungsankündigung\nHamburg Amtsgericht Hamburg HRA 128622\nHLDP Limited & Co. KG – Hamburg",
      "type": "Löschungsankündigung",
      "state": "Hamburg",
      "amtsgericht": "Amtsgericht Hamburg",
      "registernummer": "HRA 128622",
      "registerart": "HRA",
      "company_name": "HLDP Limited & Co. KG",
      "company_seat": "Hamburg",
      "details": "11.04.2025 (Bekanntmachungsdatum)\n\nHamburg Amtsgericht Hamburg HRA 128622\nLöschungsankündigung\n\nHLDP Limited & Co. KG\nKommanditgesellschaft\nHamburg\n\nNach Mitteilung des Bezirksamtes Hamburg Altona vom 06.03.2025, wurde Frau Sema Cakar bezüglich Ihres unter der Firma HLDP Limited & Co. KG ausgeübten Gewerbes, durch Bescheid vom 23.01.2025, rechtskräftig seit dem 27.02.2025, die Ausübung des Gewerbes \"Logistik, Erbringung von Dienstleistungen, insbesondere Hausmeistertätigkeiten, Reinigung, Bauhelfer, Reinigungstätigkeiten, Onlinehandel, Vermittlung von Aufträgen, Bewachungsunternehmen gem. § 34a GewO\" sowie jedes Gewerbe, für das § 35 GewO gilt, gemäß § 35 Abs. 1 GewO untersagt.\n\nDie Untersagung erstreckt sich auch auf auf die Tätigkeit als Vertretungsberechtigter eines Gewerbebetriebes oder als mit der Leitung eines Gewerbebetriebes beauftragte Person.\n\nDie eingetragene Firma HLDP Limited & Co. KG ist damit wegen des Mangels einer wesentlichen Voraussetzung unzulässig geworden.\n\nDas Registergericht beabsichtigt daher, die Firma gemäß § 395 des Gesetzes über das Verfahren in Familiensachen und in Angelegenheiten der freiwilligen Gerichtsbarkeit (FamFG) von Amts wegen aus dem Handelsregister zu löschen.\n\nIhnen wird Gelegenheit gegeben, gegen die beabsichtigte Löschung innerhalb von drei Monaten seit ihrer schriftlichen Bekanntgabe Widerspruch beim\n\nAmtsgericht Hamburg - Registergericht -, Caffamacherreihe 20, 20355 Hamburg,\n\nschriftlich oder zur Niederschrift der Geschäftsstelle einzulegen. Der Widerspruch kann auch zu Protokoll der Geschäftsstelle eines anderen Amtsgerichtes erfolgen. In diesem Falle ist die Frist nur dann gewahrt, wenn das den Widerspruch enthaltende Protokoll innerhalb der Frist bei dem Registergericht eingeht.\n\nSofern hier binnen der genannten Frist kein Widerspruch eingeht, wird das Gericht die Firma von Amts wegen löschen."
    },
    {
      "date": "2025-04-11",
      "id": "106333",
      "original_text": "Löschungsankündigung\nHamburg Amtsgericht Hamburg VR 18495\nDeutsche Gesellschaft für klinisches Kodieren e.V. – Hamburg",
      "type": "Löschungsankündigung",
      "state": "Hamburg",
      "amtsgericht": "Amtsgericht Hamburg",
      "registernummer": "VR 18495",
      "registerart": "VR",
      "company_name": "Deutsche Gesellschaft für klinisches Kodieren e.V.",
      "company_seat": "Hamburg",
      "details": "11.04.2025 (Bekanntmachungsdatum)\n\nHamburg Amtsgericht Hamburg VR 18495\nLöschungsankündigung\n\nDeutsche Gesellschaft für klinisches Kodieren e.V.\neingetragener Verein\nHamburg\n\nDas Registergericht beabsichtigt, den im Vereinsregister eingetragenen Verein von Amts wegen nach § 395 FamFG zu löschen, da nach den angestellten Ermittlungen dieser Verein offenbar nicht mehr besteht. Die Frist zur Erhebung eines Widerspruchs gegen die beabsichtigte Löschung wird auf 3 Monate festgesetzt."
    },
    {
      "date": "2025-04-11",
      "id": "106334",
      "original_text": "Löschungsankündigung\nBrandenburg Amtsgericht Potsdam HRB 22756\nJapan Stent Technology Europe GmbH – Potsdam",
      "type": "Löschungsankündigung",
      "state": "Brandenburg",
      "amtsgericht": "Amtsgericht Potsdam",
      "registernummer": "HRB 22756",
      "registerart": "HRB",
      "company_name": "Japan Stent Technology Europe GmbH",
      "company_seat": "Potsdam",
      "details": "11.04.2025 (Bekanntmachungsdatum)\n\nBrandenburg Amtsgericht Potsdam HRB 22756\nLöschungsankündigung\n\nJapan Stent Technology Europe GmbH\nGesellschaft mit beschränkter Haftung\nPotsdam\n\nBei der nachstehenden Gesellschaft wird das Amtslöschungsverfahren gemäß § 394 FamFG eingeleitet. Widerspruchsfrist 8 Wochen."
    },
    {
      "date": "2025-04-11",
      "id": "106335",
      "original_text": "Löschungsankündigung\nHamburg Amtsgericht Hamburg VR 21856\nLebensanker e.V. – Hamburg",
      "type": "Löschungsankündigung",
      "state": "Hamburg",
      "amtsgericht": "Amtsgericht Hamburg",
      "registernummer": "VR 21856",
      "registerart": "VR",
      "company_name": "Lebensanker e.V.",
      "company_seat": "Hamburg",
      "details": "11.04.2025 (Bekanntmachungsdatum)\n\nHamburg Amtsgericht Hamburg VR 21856\nLöschungsankündigung\n\nLebensanker e.V.\neingetragener Verein\nHamburg\n\nDas Registergericht beabsichtigt, den im Vereinsregister eingetragenen Verein von Amts wegen nach § 395 FamFG zu löschen, da nach den angestellten Ermittlungen dieser Verein offenbar nicht mehr besteht. Die Frist zur Erhebung eines Widerspruchs gegen die beabsichtigte Löschung wird auf 3 Monate festgesetzt."
    },
    {
      "date": "2025-04-11",
      "id": "106336",
      "original_text": "Löschungsankündigung\nHamburg Amtsgericht Hamburg VR 23369\nRAI - Vision: Verein von Geflüchteten für Geflüchtete aus Eritrea e.V. – Hamburg",
      "type": "Löschungsankündigung",
      "state": "Hamburg",
      "amtsgericht": "Amtsgericht Hamburg",
      "registernummer": "VR 23369",
      "registerart": "VR",
      "company_name": "RAI - Vision: Verein von Geflüchteten für Geflüchtete aus Eritrea e.V.",
      "company_seat": "Hamburg",
      "details": "11.04.2025 (Bekanntmachungsdatum)\n\nHamburg Amtsgericht Hamburg VR 23369\nLöschungsankündigung\n\nRAI - Vision: Verein von Geflüchteten für Geflüchtete aus Eritrea e.V.\neingetragener Verein\nHamburg\n\nDas Registergericht beabsichtigt, den im Vereinsregister eingetragenen Verein von Amts wegen nach § 395 FamFG zu löschen, da nach den angestellten Ermittlungen dieser Verein offenbar nicht mehr besteht. Die Frist zur Erhebung eines Widerspruchs gegen die beabsichtigte Löschung wird auf 3 Monate festgesetzt."
    },
    {
      "date": "2025-04-11",
      "id": "106337",
      "original_text": "Löschungsankündigung\nBerlin Amtsgericht Berlin (Charlottenburg) HRB 182639\nHAL-SN BAU GmbH – Berlin",
      "type": "Löschungsankündigung",
      "state": "Berlin",
      "amtsgericht": "Amtsgericht Berlin (Charlottenburg)",
      "registernummer": "HRB 182639",
      "registerart": "HRB",
      "company_name": "HAL-SN BAU GmbH",
      "company_seat": "Berlin",
      "details": "11.04.2025 (Bekanntmachungsdatum)\n\nBerlin Amtsgericht Berlin (Charlottenburg) HRB 182639\nLöschungsankündigung\n\nHAL-SN BAU GmbH\nGesellschaft mit beschränkter Haftung\nBerlin\n\nBei der nachstehenden Gesellschaft wird das Amtslöschungsverfahren gemäß § 394 FamFG eingeleitet. Widerspruchsfrist 6 Wochen"
    },
    {
      "date": "2025-04-11",
      "id": "106338",
      "original_text": "Einreichung neuer Dokumente\nBerlin Amtsgericht Berlin (Charlottenburg) HRB 69108\nImmobilien Scout GmbH – Berlin",
      "type": "Einreichung neuer Dokumente",
      "state": "Berlin",
      "amtsgericht": "Amtsgericht Berlin (Charlottenburg)",
      "registernummer": "HRB 69108",
      "registerart": "HRB",
      "company_name": "Immobilien Scout GmbH",
      "company_seat": "Berlin",
      "details": "11.04.2025 (Bekanntmachungsdatum)\n\nBerlin Amtsgericht Berlin (Charlottenburg) HRB 69108\nEinreichung neuer Dokumente\n\nImmobilien Scout GmbH\nGesellschaft mit beschränkter Haftung\nBerlin\n\nAls nicht eingetragen wird veröffentlicht: Es wurde eine neue Liste der Aufsichtsratsmitglieder eingereicht (§52 GmbHG)."
    },
    {
      "date": "2025-04-11",
      "id": "106339",
      "original_text": "Einreichung neuer Dokumente\nBaden-Württemberg Amtsgericht Stuttgart HRB 23976\nCoperion GmbH – Stuttgart",
      "type": "Einreichung neuer Dokumente",
      "state": "Baden-Württemberg",
      "amtsgericht": "Amtsgericht Stuttgart",
      "registernummer": "HRB 23976",
      "registerart": "HRB",
      "company_name": "Coperion GmbH",
      "company_seat": "Stuttgart",
      "details": "11.04.2025 (Bekanntmachungsdatum)\n\nBaden-Württemberg Amtsgericht Stuttgart HRB 23976\nEinreichung neuer Dokumente 11.04.2025 (Eintragungsdatum)\n\nCoperion GmbH\nGesellschaft mit beschränkter Haftung\nStuttgart\n\nDie Gesellschaft hat am 08.04.2025 die Liste über die Zusammensetzung des Aufsichtsrats zum Handelsregister eingereicht."
    },
    {
      "date": "2025-04-11",
      "id": "106340",
      "original_text": "Registerbekanntmachung nach dem Umwandlungsgesetz\nHamburg Amtsgericht Hamburg HRB 140955\nFonds 2 AvR B Tempelhof Verwaltungs GmbH – Hamburg",
      "type": "Registerbekanntmachung nach dem Umwandlungsgesetz",
      "state": "Hamburg",
      "amtsgericht": "Amtsgericht Hamburg",
      "registernummer": "HRB 140955",
      "registerart": "HRB",
      "company_name": "Fonds 2 AvR B Tempelhof Verwaltungs GmbH",
      "company_seat": "Hamburg",
      "details": "11.04.2025 (Bekanntmachungsdatum)\n\nHamburg Amtsgericht Hamburg HRB 140955\nRegisterbekanntmachung nach dem Umwandlungsgesetz 11.04.2025 (Eintragungsdatum)\n\nFonds 2 AvR B Tempelhof Verwaltungs GmbH\nGesellschaft mit beschränkter Haftung\nHamburg\n\nAls nicht eingetragen wird bekannt gemacht:\nDen Gläubigern der an der Verschmelzung beteiligten Gesellschaften ist, wenn sie binnen sechs Monaten nach dem Tag, an dem die Eintragung der Verschmelzung in das Register des Sitzes desjenigen Rechtsträgers, dessen Gläubiger sie sind, nach § 19 Absatz 3 UmwG als bekannt gemacht gilt, ihren Anspruch nach Grund und Höhe schriftlich anmelden, Sicherheit zu leisten, soweit sie nicht Befriedigung verlangen können. Dieses Recht steht den Gläubigern jedoch nur zu, wenn sie glaubhaft machen, dass durch die Verschmelzung die Erfüllung ihrer Forderung gefährdet wird."
    },
    {
      "date": "2025-04-11",
      "id": "106341",
      "original_text": "Registerbekanntmachung nach dem Umwandlungsgesetz\nHamburg Amtsgericht Hamburg HRB 140330\nFonds 2 AvR HH Hohenfelde Verwaltungs GmbH – Hamburg",
      "type": "Registerbekanntmachung nach dem Umwandlungsgesetz",
      "state": "Hamburg",
      "amtsgericht": "Amtsgericht Hamburg",
      "registernummer": "HRB 140330",
      "registerart": "HRB",
      "company_name": "Fonds 2 AvR HH Hohenfelde Verwaltungs GmbH",
      "company_seat": "Hamburg",
      "details": "11.04.2025 (Bekanntmachungsdatum)\n\nHamburg Amtsgericht Hamburg HRB 140330\nRegisterbekanntmachung nach dem Umwandlungsgesetz 11.04.2025 (Eintragungsdatum)\n\nFonds 2 AvR HH Hohenfelde Verwaltungs GmbH\nGesellschaft mit beschränkter Haftung\nHamburg\n\nAls nicht eingetragen wird bekannt gemacht:\nDen Gläubigern der an der Verschmelzung beteiligten Gesellschaften ist, wenn sie binnen sechs Monaten nach dem Tag, an dem die Eintragung der Verschmelzung in das Register des Sitzes desjenigen Rechtsträgers, dessen Gläubiger sie sind, nach § 19 Absatz 3 UmwG als bekannt gemacht gilt, ihren Anspruch nach Grund und Höhe schriftlich anmelden, Sicherheit zu leisten, soweit sie nicht Befriedigung verlangen können. Dieses Recht steht den Gläubigern jedoch nur zu, wenn sie glaubhaft machen, dass durch die Verschmelzung die Erfüllung ihrer Forderung gefährdet wird."
    },
    {
      "date": "2025-04-11",
      "id": "106342",
      "original_text": "Registerbekanntmachung nach dem Umwandlungsgesetz\nHamburg Amtsgericht Hamburg HRB 140614\nFonds 2 AvR H Laatzen Verwaltungs GmbH – Hamburg",
      "type": "Registerbekanntmachung nach dem Umwandlungsgesetz",
      "state": "Hamburg",
      "amtsgericht": "Amtsgericht Hamburg",
      "registernummer": "HRB 140614",
      "registerart": "HRB",
      "company_name": "Fonds 2 AvR H Laatzen Verwaltungs GmbH",
      "company_seat": "Hamburg",
      "details": "11.04.2025 (Bekanntmachungsdatum)\n\nHamburg Amtsgericht Hamburg HRB 140614\nRegisterbekanntmachung nach dem Umwandlungsgesetz 11.04.2025 (Eintragungsdatum)\n\nFonds 2 AvR H Laatzen Verwaltungs GmbH\nGesellschaft mit beschränkter Haftung\nHamburg\n\nAls nicht eingetragen wird bekannt gemacht:\nDen Gläubigern der an der Verschmelzung beteiligten Gesellschaften ist, wenn sie binnen sechs Monaten nach dem Tag, an dem die Eintragung der Verschmelzung in das Register des Sitzes desjenigen Rechtsträgers, dessen Gläubiger sie sind, nach § 19 Absatz 3 UmwG als bekannt gemacht gilt, ihren Anspruch nach Grund und Höhe schriftlich anmelden, Sicherheit zu leisten, soweit sie nicht Befriedigung verlangen können. Dieses Recht steht den Gläubigern jedoch nur zu, wenn sie glaubhaft machen, dass durch die Verschmelzung die Erfüllung ihrer Forderung gefährdet wird."
    },
    {
      "date": "2025-04-11",
      "id": "106343",
      "original_text": "Registerbekanntmachung nach dem Umwandlungsgesetz\nHamburg Amtsgericht Hamburg HRB 140953\nFonds 2 AvR Köln-Deutz 2 Verwaltungs GmbH – Hamburg",
      "type": "Registerbekanntmachung nach dem Umwandlungsgesetz",
      "state": "Hamburg",
      "amtsgericht": "Amtsgericht Hamburg",
      "registernummer": "HRB 140953",
      "registerart": "HRB",
      "company_name": "Fonds 2 AvR Köln-Deutz 2 Verwaltungs GmbH",
      "company_seat": "Hamburg",
      "details": "11.04.2025 (Bekanntmachungsdatum)\n\nHamburg Amtsgericht Hamburg HRB 140953\nRegisterbekanntmachung nach dem Umwandlungsgesetz 11.04.2025 (Eintragungsdatum)\n\nFonds 2 AvR Köln-Deutz 2 Verwaltungs GmbH\nGesellschaft mit beschränkter Haftung\nHamburg\n\nAls nicht eingetragen wird bekannt gemacht:\nDen Gläubigern der an der Verschmelzung beteiligten Gesellschaften ist, wenn sie binnen sechs Monaten nach dem Tag, an dem die Eintragung der Verschmelzung in das Register des Sitzes desjenigen Rechtsträgers, dessen Gläubiger sie sind, nach § 19 Absatz 3 UmwG als bekannt gemacht gilt, ihren Anspruch nach Grund und Höhe schriftlich anmelden, Sicherheit zu leisten, soweit sie nicht Befriedigung verlangen können. Dieses Recht steht den Gläubigern jedoch nur zu, wenn sie glaubhaft machen, dass durch die Verschmelzung die Erfüllung ihrer Forderung gefährdet wird."
    },
    {
      "date": "2025-04-11",
      "id": "106344",
      "original_text": "Registerbekanntmachung nach dem Umwandlungsgesetz\nHamburg Amtsgericht Hamburg HRB 131910\nAviaRent MikroQuartier 1 GmbH – Hamburg",
      "type": "Registerbekanntmachung nach dem Umwandlungsgesetz",
      "state": "Hamburg",
      "amtsgericht": "Amtsgericht Hamburg",
      "registernummer": "HRB 131910",
      "registerart": "HRB",
      "company_name": "AviaRent MikroQuartier 1 GmbH",
      "company_seat": "Hamburg",
      "details": "11.04.2025 (Bekanntmachungsdatum)\n\nHamburg Amtsgericht Hamburg HRB 131910\nRegisterbekanntmachung nach dem Umwandlungsgesetz 11.04.2025 (Eintragungsdatum)\n\nAviaRent MikroQuartier 1 GmbH\nGesellschaft mit beschränkter Haftung\nHamburg\n\nAls nicht eingetragen wird bekannt gemacht:\nDen Gläubigern der an der Verschmelzung beteiligten Gesellschaften ist, wenn sie binnen sechs Monaten nach dem Tag, an dem die Eintragung der Verschmelzung in das Register des Sitzes derjenigen Rechtsträger deren Gläubiger sie sind, nach § 19 Absatz 3 UmwG als bekannt gemacht gilt, ihren Anspruch nach Grund und Höhe schriftlich anmelden, Sicherheit zu leisten, soweit sie nicht Befriedigung verlangen können. Dieses Recht steht den Gläubigern jedoch nur zu, wenn sie glaubhaft machen, dass durch die Verschmelzung die Erfüllung ihrer Forderung gefährdet wird."
    },
    {
      "date": "2025-04-11",
      "id": "106345",
      "original_text": "Registerbekanntmachung nach dem Umwandlungsgesetz\nHamburg Amtsgericht Hamburg HRB 149945\nFonds 2 AvR Mobilien Portfolio MQ I GmbH – Hamburg",
      "type": "Registerbekanntmachung nach dem Umwandlungsgesetz",
      "state": "Hamburg",
      "amtsgericht": "Amtsgericht Hamburg",
      "registernummer": "HRB 149945",
      "registerart": "HRB",
      "company_name": "Fonds 2 AvR Mobilien Portfolio MQ I GmbH",
      "company_seat": "Hamburg",
      "details": "11.04.2025 (Bekanntmachungsdatum)\n\nHamburg Amtsgericht Hamburg HRB 149945\nRegisterbekanntmachung nach dem Umwandlungsgesetz 11.04.2025 (Eintragungsdatum)\n\nFonds 2 AvR Mobilien Portfolio MQ I GmbH\nGesellschaft mit beschränkter Haftung\nHamburg\n\nAls nicht eingetragen wird bekannt gemacht:\nDen Gläubigern der an der Verschmelzung beteiligten Gesellschaften ist, wenn sie binnen sechs Monaten nach dem Tag, an dem die Eintragung der Verschmelzung in das Register des Sitzes desjenigen Rechtsträgers, dessen Gläubiger sie sind, nach § 19 Absatz 3 UmwG als bekannt gemacht gilt, ihren Anspruch nach Grund und Höhe schriftlich anmelden, Sicherheit zu leisten, soweit sie nicht Befriedigung verlangen können. Dieses Recht steht den Gläubigern jedoch nur zu, wenn sie glaubhaft machen, dass durch die Verschmelzung die Erfüllung ihrer Forderung gefährdet wird."
    },
    {
      "date": "2025-04-11",
      "id": "106346",
      "original_text": "Registerbekanntmachung nach dem Umwandlungsgesetz\nHamburg Amtsgericht Hamburg HRB 139794\nFonds 2 AvR Köln Deutz Castell Verwaltungs GmbH – Hamburg",
      "type": "Registerbekanntmachung nach dem Umwandlungsgesetz",
      "state": "Hamburg",
      "amtsgericht": "Amtsgericht Hamburg",
      "registernummer": "HRB 139794",
      "registerart": "HRB",
      "company_name": "Fonds 2 AvR Köln Deutz Castell Verwaltungs GmbH",
      "company_seat": "Hamburg",
      "details": "11.04.2025 (Bekanntmachungsdatum)\n\nHamburg Amtsgericht Hamburg HRB 139794\nRegisterbekanntmachung nach dem Umwandlungsgesetz 11.04.2025 (Eintragungsdatum)\n\nFonds 2 AvR Köln Deutz Castell Verwaltungs GmbH\nGesellschaft mit beschränkter Haftung\nHamburg\n\nAls nicht eingetragen wird bekannt gemacht:\nDen Gläubigern der an der Verschmelzung beteiligten Gesellschaften ist, wenn sie binnen sechs Monaten nach dem Tag, an dem die Eintragung der Verschmelzung in das Register des Sitzes desjenigen Rechtsträgers, dessen Gläubiger sie sind, nach § 19 Absatz 3 UmwG als bekannt gemacht gilt, ihren Anspruch nach Grund und Höhe schriftlich anmelden, Sicherheit zu leisten, soweit sie nicht Befriedigung verlangen können. Dieses Recht steht den Gläubigern jedoch nur zu, wenn sie glaubhaft machen, dass durch die Verschmelzung die Erfüllung ihrer Forderung gefährdet wird."
    },
    {
      "date": "2025-04-11",
      "id": "106347",
      "original_text": "Löschungsankündigung\nHamburg Amtsgericht Hamburg HRB 119865\nKDTorten GmbH – Hamburg",
      "type": "Löschungsankündigung",
      "state": "Hamburg",
      "amtsgericht": "Amtsgericht Hamburg",
      "registernummer": "HRB 119865",
      "registerart": "HRB",
      "company_name": "KDTorten GmbH",
      "company_seat": "Hamburg",
      "details": "11.04.2025 (Bekanntmachungsdatum)\n\nHamburg Amtsgericht Hamburg HRB 119865\nLöschungsankündigung\n\nKDTorten GmbH\nGesellschaft mit beschränkter Haftung\nHamburg\n\nDas Registergericht beabsichtigt, die im Handelsregister eingetragene Gesellschaft von Amts wegen nach § 394 FamFG zu löschen. Die Frist zur Erhebung eines Widerspruchs gegen die beabsichtigte Löschung wird auf 3 Monate festgesetzt."
    },
    {
      "date": "2025-04-11",
      "id": "106348",
      "original_text": "Löschungsankündigung\nHamburg Amtsgericht Hamburg HRB 160177\nCINTRO GmbH – Hamburg",
      "type": "Löschungsankündigung",
      "state": "Hamburg",
      "amtsgericht": "Amtsgericht Hamburg",
      "registernummer": "HRB 160177",
      "registerart": "HRB",
      "company_name": "CINTRO GmbH",
      "company_seat": "Hamburg",
      "details": "11.04.2025 (Bekanntmachungsdatum)\n\nHamburg Amtsgericht Hamburg HRB 160177\nLöschungsankündigung\n\nCINTRO GmbH\nGesellschaft mit beschränkter Haftung\nHamburg\n\nDas Registergericht beabsichtigt, die im Handelsregister eingetragene Gesellschaft von Amts wegen nach § 394 FamFG zu löschen. Die Frist zur Erhebung eines Widerspruchs gegen die beabsichtigte Löschung wird auf 3 Monate festgesetzt."
    },
    {
      "date": "2025-04-11",
      "id": "106349",
      "original_text": "Löschungsankündigung\nHamburg Amtsgericht Hamburg HRA 113727\nNEG New Energy Group GmbH & Co. KG – Hamburg",
      "type": "Löschungsankündigung",
      "state": "Hamburg",
      "amtsgericht": "Amtsgericht Hamburg",
      "registernummer": "HRA 113727",
      "registerart": "HRA",
      "company_name": "NEG New Energy Group GmbH & Co. KG",
      "company_seat": "Hamburg",
      "details": "11.04.2025 (Bekanntmachungsdatum)\n\nHamburg Amtsgericht Hamburg HRA 113727\nLöschungsankündigung\n\nNEG New Energy Group GmbH & Co. KG\nKommanditgesellschaft\nHamburg\n\nDas Registergericht beabsichtigt, die im Handelsregister eingetragene Gesellschaft von Amts wegen nach § 394 FamFG zu löschen. Die Frist zur Erhebung eines Widerspruchs gegen die beabsichtigte Löschung wird auf 3 Monate festgesetzt."
    },
    {
      "date": "2025-04-11",
      "id": "106350",
      "original_text": "Löschungsankündigung\nHamburg Amtsgericht Hamburg HRB 127241\nCODEMATTER GmbH – Hamburg",
      "type": "Löschungsankündigung",
      "state": "Hamburg",
      "amtsgericht": "Amtsgericht Hamburg",
      "registernummer": "HRB 127241",
      "registerart": "HRB",
      "company_name": "CODEMATTER GmbH",
      "company_seat": "Hamburg",
      "details": "11.04.2025 (Bekanntmachungsdatum)\n\nHamburg Amtsgericht Hamburg HRB 127241\nLöschungsankündigung\n\nCODEMATTER GmbH\nGesellschaft mit beschränkter Haftung\nHamburg\n\nDas Registergericht beabsichtigt, die im Handelsregister eingetragene Gesellschaft von Amts wegen nach § 394 FamFG zu löschen. Die Frist zur Erhebung eines Widerspruchs gegen die beabsichtigte Löschung wird auf 3 Monate festgesetzt."
    },
    {
      "date": "2025-04-11",
      "id": "106351",
      "original_text": "Löschungsankündigung\nHamburg Amtsgericht Hamburg HRB 165311\nIaaS UG (haftungsbeschränkt) – Hamburg",
      "type": "Löschungsankündigung",
      "state": "Hamburg",
      "amtsgericht": "Amtsgericht Hamburg",
      "registernummer": "HRB 165311",
      "registerart": "HRB",
      "company_name": "IaaS UG (haftungsbeschränkt)",
      "company_seat": "Hamburg",
      "details": "11.04.2025 (Bekanntmachungsdatum)\n\nHamburg Amtsgericht Hamburg HRB 165311\nLöschungsankündigung\n\nIaaS UG (haftungsbeschränkt)\nGesellschaft mit beschränkter Haftung\nHamburg\n\nDas Registergericht beabsichtigt, die im Handelsregister eingetragene Gesellschaft von Amts wegen nach § 394 FamFG zu löschen. Die Frist zur Erhebung eines Widerspruchs gegen die beabsichtigte Löschung wird auf 3 Monate festgesetzt."
    },
    {
      "date": "2025-04-11",
      "id": "106352",
      "original_text": "Löschungsankündigung\nHamburg Amtsgericht Hamburg HRA 107530\nOMNI-MEDIASOUND Musikverlag & Produktion Armin Wenzl e.K. – Hamburg",
      "type": "Löschungsankündigung",
      "state": "Hamburg",
      "amtsgericht": "Amtsgericht Hamburg",
      "registernummer": "HRA 107530",
      "registerart": "HRA",
      "company_name": "OMNI-MEDIASOUND Musikverlag & Produktion Armin Wenzl e.K.",
      "company_seat": "Hamburg",
      "details": "11.04.2025 (Bekanntmachungsdatum)\n\nHamburg Amtsgericht Hamburg HRA 107530\nLöschungsankündigung\n\nOMNI-MEDIASOUND Musikverlag & Produktion Armin Wenzl e.K.\nEinzelkaufmann\nHamburg\n\nDas Registergericht beabsichtigt, die im Handelsregister eingetragene Firma von Amts wegen nach § 31 Abs. 2 HGB zu löschen. Die Frist zur Erhebung eines Widerspruchs gegen die beabsichtigte Löschung wird auf 3 Monate festgesetzt."
    },
    {
      "date": "2025-04-11",
      "id": "106353",
      "original_text": "Löschungsankündigung\nSchleswig-Holstein Amtsgericht Flensburg HRB 7394\nAM \"THOR\" Verwaltungsgesellschaft mbH – Flensburg",
      "type": "Löschungsankündigung",
      "state": "Schleswig-Holstein",
      "amtsgericht": "Amtsgericht Flensburg",
      "registernummer": "HRB 7394",
      "registerart": "HRB",
      "company_name": "AM \"THOR\" Verwaltungsgesellschaft mbH",
      "company_seat": "Flensburg",
      "details": "11.04.2025 (Bekanntmachungsdatum)\n\nSchleswig-Holstein Amtsgericht Flensburg HRB 7394\nLöschungsankündigung\n\nAM \"THOR\" Verwaltungsgesellschaft mbH\nGesellschaft mit beschränkter Haftung\nFlensburg\n\nEs ist die Löschung der nachstehenden Gesellschaft wegen Vermögenslosigkeit gemäß § 394 FamFG beabsichtigt.\nWiderspruchsfrist: 2 Monate."
    },
    {
      "date": "2025-04-11",
      "id": "106354",
      "original_text": "Einreichung neuer Dokumente\nSaarland Amtsgericht Saarbrücken HRB 81124\nTNA Talsperren- und Grundwasser-Aufbereitungs- und Vertriebsgesellschaft mbH – Nonnweiler",
      "type": "Einreichung neuer Dokumente",
      "state": "Saarland",
      "amtsgericht": "Amtsgericht Saarbrücken",
      "registernummer": "HRB 81124",
      "registerart": "HRB",
      "company_name": "TNA Talsperren- und Grundwasser-Aufbereitungs- und Vertriebsgesellschaft mbH",
      "company_seat": "Nonnweiler",
      "details": "11.04.2025 (Bekanntmachungsdatum)\n\nSaarland Amtsgericht Saarbrücken HRB 81124\nEinreichung neuer Dokumente\n\nTNA Talsperren- und Grundwasser-Aufbereitungs- und Vertriebsgesellschaft mbH\nGesellschaft mit beschränkter Haftung\nNonnweiler\n\nDie Geschäftsführung der Gesellschaft hat eine Liste der Mitglieder des Aufsichtsrats zum Handelsregister eingereicht (§ 52 Abs. 3 Satz 2 GmbHG)."
    },
    {
      "date": "2025-04-11",
      "id": "106355",
      "original_text": "Einreichung neuer Dokumente\nBaden-Württemberg Amtsgericht Mannheim HRB 4664\nABB AG – Mannheim",
      "type": "Einreichung neuer Dokumente",
      "state": "Baden-Württemberg",
      "amtsgericht": "Amtsgericht Mannheim",
      "registernummer": "HRB 4664",
      "registerart": "HRB",
      "company_name": "ABB AG",
      "company_seat": "Mannheim",
      "details": "11.04.2025 (Bekanntmachungsdatum)\n\nBaden-Württemberg Amtsgericht Mannheim HRB 4664\nEinreichung neuer Dokumente\n\nABB AG\nAktiengesellschaft\nMannheim\n\nDie Gesellschaft hat am 10.04.2025 die Liste über die Zusammensetzung des Aufsichtsrats zum Handelsregister eingereicht."
    },
    {
      "date": "2025-04-11",
      "id": "106356",
      "original_text": "Registerbekanntmachung nach dem Umwandlungsgesetz\nBaden-Württemberg Amtsgericht Freiburg HRA 709052\nFranz Lang Personenbereitstellung e.K. – Radolfzell am Bodensee",
      "type": "Registerbekanntmachung nach dem Umwandlungsgesetz",
      "state": "Baden-Württemberg",
      "amtsgericht": "Amtsgericht Freiburg",
      "registernummer": "HRA 709052",
      "registerart": "HRA",
      "company_name": "Franz Lang Personenbereitstellung e.K.",
      "company_seat": "Radolfzell am Bodensee",
      "details": "11.04.2025 (Bekanntmachungsdatum)\n\nBaden-Württemberg Amtsgericht Freiburg HRA 709052\nRegisterbekanntmachung nach dem Umwandlungsgesetz 11.04.2025 (Eintragungsdatum)\n\nFranz Lang Personenbereitstellung e.K.\nEinzelkaufmann / Einzelkauffrau\nRadolfzell am Bodensee\n\nDen Gläubigern der an der Ausgliederung beteiligten Rechtsträger ist, wenn sie binnen sechs Monaten nach dem Tag, an dem die Eintragung der Ausgliederung in das Register des Sitzes desjenigen Rechtsträgers, dessen Gläubiger sie sind, nach § 19 Abs. 3 UmwG als bekanntgemacht gilt, ihren Anspruch nach Grund und Höhe schriftlich anmelden, Sicherheit zu leisten, soweit sie nicht Befriedigung verlangen können. Dieses Recht steht den Gläubigern jedoch nur zu, wenn sie glaubhaft machen, dass durch die Ausgliederung die Erfüllung ihrer Forderung gefährdet wird."
    },
    {
      "date": "2025-04-11",
      "id": "106357",
      "original_text": "Registerbekanntmachung nach dem Umwandlungsgesetz\nBaden-Württemberg Amtsgericht Freiburg HRB 702720\nFranz Lang Bau- und Industriemontage GmbH – Radolfzell am Bodensee",
      "type": "Registerbekanntmachung nach dem Umwandlungsgesetz",
      "state": "Baden-Württemberg",
      "amtsgericht": "Amtsgericht Freiburg",
      "registernummer": "HRB 702720",
      "registerart": "HRB",
      "company_name": "Franz Lang Bau- und Industriemontage GmbH",
      "company_seat": "Radolfzell am Bodensee",
      "details": "11.04.2025 (Bekanntmachungsdatum)\n\nBaden-Württemberg Amtsgericht Freiburg HRB 702720\nRegisterbekanntmachung nach dem Umwandlungsgesetz 11.04.2025 (Eintragungsdatum)\n\nFranz Lang Bau- und Industriemontage GmbH\nGesellschaft mit beschränkter Haftung\nRadolfzell am Bodensee\n\nAls nicht eingetragen wird bekanntgemacht:\nDen Gläubigern der an der Ausgliederung beteiligten Rechtsträger ist, wenn sie binnen sechs Monaten nach dem Tag, an dem die Eintragung der Ausgliederung in das Register des Sitzes desjenigen Rechtsträgers, dessen Gläubiger sie sind, nach § 19 Abs. 3 UmwG als bekanntgemacht gilt, ihren Anspruch nach Grund und Höhe schriftlich anmelden, Sicherheit zu leisten, soweit sie nicht Befriedigung verlangen können. Dieses Recht steht den Gläubigern jedoch nur zu, wenn sie glaubhaft machen, dass durch die Ausgliederung die Erfüllung ihrer Forderung gefährdet wird."
    },
    {
      "date": "2025-04-11",
      "id": "106358",
      "original_text": "Einreichung neuer Dokumente\nSchleswig-Holstein Amtsgericht Lübeck HRB 1019 RE\nFederal-Mogul Bremsbelag GmbH – Glinde",
      "type": "Einreichung neuer Dokumente",
      "state": "Schleswig-Holstein",
      "amtsgericht": "Amtsgericht Lübeck",
      "registernummer": "HRB 1019 RE",
      "registerart": "HRB",
      "company_name": "Federal-Mogul Bremsbelag GmbH",
      "company_seat": "Glinde",
      "details": "11.04.2025 (Bekanntmachungsdatum)\n\nSchleswig-Holstein Amtsgericht Lübeck HRB 1019 RE\nEinreichung neuer Dokumente\n\nFederal-Mogul Bremsbelag GmbH\nGesellschaft mit beschränkter Haftung\nGlinde\n\nAls nicht eingetragen wird veröffentlicht:\nDie Gesellschaft hat eine neue Liste der Aufsichtsratsmitglieder beim Handelsregister hinterlegt."
    },
    {
      "date": "2025-04-11",
      "id": "106359",
      "original_text": "Einreichung neuer Dokumente\nBerlin Amtsgericht Berlin (Charlottenburg) HRB 134899\nS-Kreditpartner GmbH – Berlin",
      "type": "Einreichung neuer Dokumente",
      "state": "Berlin",
      "amtsgericht": "Amtsgericht Berlin (Charlottenburg)",
      "registernummer": "HRB 134899",
      "registerart": "HRB",
      "company_name": "S-Kreditpartner GmbH",
      "company_seat": "Berlin",
      "details": "11.04.2025 (Bekanntmachungsdatum)\n\nBerlin Amtsgericht Berlin (Charlottenburg) HRB 134899\nEinreichung neuer Dokumente\n\nS-Kreditpartner GmbH\nGesellschaft mit beschränkter Haftung\nBerlin\n\nAls nicht eingetragen wird veröffentlicht:\n\nEs wurde eine neue Liste der Aufsichtsratsmitglieder eingereicht (§52 GmbHG)."
    },
    {
      "date": "2025-04-11",
      "id": "106360",
      "original_text": "Einreichung neuer Dokumente\nSachsen Amtsgericht Dresden HRB 14141\nNeustadthalle - Veranstaltungs GmbH – Neustadt/Sachsen",
      "type": "Einreichung neuer Dokumente",
      "state": "Sachsen",
      "amtsgericht": "Amtsgericht Dresden",
      "registernummer": "HRB 14141",
      "registerart": "HRB",
      "company_name": "Neustadthalle - Veranstaltungs GmbH",
      "company_seat": "Neustadt/Sachsen",
      "details": "11.04.2025 (Bekanntmachungsdatum)\n\nSachsen Amtsgericht Dresden HRB 14141\nEinreichung neuer Dokumente\n\nNeustadthalle - Veranstaltungs GmbH\nGesellschaft mit beschränkter Haftung\nNeustadt/Sachsen\n\nAm 10.04.2025 wurde beim Handelsregister des Amtsgerichts Dresden die Liste der Mitglieder des Aufsichtsrats gemäß § 52 GmbHG eingereicht."
    },
    {
      "date": "2025-04-11",
      "id": "106361",
      "original_text": "Einreichung neuer Dokumente\nSachsen Amtsgericht Dresden HRB 18145\nSächsische Grundstücksauktionen AG – Dresden",
      "type": "Einreichung neuer Dokumente",
      "state": "Sachsen",
      "amtsgericht": "Amtsgericht Dresden",
      "registernummer": "HRB 18145",
      "registerart": "HRB",
      "company_name": "Sächsische Grundstücksauktionen AG",
      "company_seat": "Dresden",
      "details": "11.04.2025 (Bekanntmachungsdatum)\n\nSachsen Amtsgericht Dresden HRB 18145\nEinreichung neuer Dokumente\n\nSächsische Grundstücksauktionen AG\nAktiengesellschaft\nDresden\n\nAm 10.04.2025 wurde beim Handelsregister des Amtsgerichts Dresden die Liste der Mitglieder des Aufsichtsrats gemäß § 106 AktG eingereicht."
    },
    {
      "date": "2025-04-11",
      "id": "106362",
      "original_text": "Löschungsankündigung\nSachsen Amtsgericht Dresden HRB 21418\nPROsys24 GmbH – Dresden",
      "type": "Löschungsankündigung",
      "state": "Sachsen",
      "amtsgericht": "Amtsgericht Dresden",
      "registernummer": "HRB 21418",
      "registerart": "HRB",
      "company_name": "PROsys24 GmbH",
      "company_seat": "Dresden",
      "details": "11.04.2025 (Bekanntmachungsdatum)\n\nSachsen Amtsgericht Dresden HRB 21418\nLöschungsankündigung\n\nPROsys24 GmbH\nGesellschaft mit beschränkter Haftung\nDresden\n\nDas Registergericht beabsichtigt, die im Handelsregister eingetragene Gesellschaft von Amts wegen nach § 394 FamFG zu löschen. Die Frist zu Erhebung eines Widerspruchs gegen die beabsichtigte Löschung wird auf einen Monat festgesetzt."
    },
    {
      "date": "2025-04-11",
      "id": "106363",
      "original_text": "Löschungsankündigung\nNiedersachsen Amtsgericht Walsrode HRB 209378\nPoldach GmbH – Stuhr",
      "type": "Löschungsankündigung",
      "state": "Niedersachsen",
      "amtsgericht": "Amtsgericht Walsrode",
      "registernummer": "HRB 209378",
      "registerart": "HRB",
      "company_name": "Poldach GmbH",
      "company_seat": "Stuhr",
      "details": "11.04.2025 (Bekanntmachungsdatum)\n\nNiedersachsen Amtsgericht Walsrode HRB 209378\nLöschungsankündigung\n\nPoldach GmbH\nGesellschaft mit beschränkter Haftung\nStuhr\n\nDas Registergericht beabsichtigt, die Gesellschaft von Amts wegen nach § 394 FamFG zu löschen. Die Frist zur Erhebung eines Widerspruchs ist auf 3 Monate ab dieser Registerbekanntmachung festgesetzt."
    },
    {
      "date": "2025-04-11",
      "id": "106364",
      "original_text": "Registerbekanntmachung nach dem Umwandlungsgesetz\nNiedersachsen Amtsgericht Hannover HRB 212493\ntecRacer Germany GmbH – Hannover",
      "type": "Registerbekanntmachung nach dem Umwandlungsgesetz",
      "state": "Niedersachsen",
      "amtsgericht": "Amtsgericht Hannover",
      "registernummer": "HRB 212493",
      "registerart": "HRB",
      "company_name": "tecRacer Germany GmbH",
      "company_seat": "Hannover",
      "details": "11.04.2025 (Bekanntmachungsdatum)\n\nNiedersachsen Amtsgericht Hannover HRB 212493\nRegisterbekanntmachung nach dem Umwandlungsgesetz 11.04.2025 (Eintragungsdatum)\n\ntecRacer Germany GmbH\nGesellschaft mit beschränkter Haftung\nHannover\n\nDen Gläubigern der an der Verschmelzung beteiligten Rechtsträger ist, wenn sie binnen sechs Monaten nach dem Tag, an dem die Eintragung der Verschmelzung in das Register des Sitzes desjenigen Rechtsträgers, dessen Gläubiger sie sind, nach § 19  Abs.  3 UmwG als bekannt gemacht gilt, ihren Anspruch nach Grund und Höhe schriftlich anmelden, Sicherheit zu leisten, soweit sie nicht Befriedigung verlangen können. Dieses Recht steht den Gläubigern jedoch nur zu, wenn sie glaubhaft machen, dass durch die Verschmelzung die Erfüllung der Forderung gefährdet wird."
    },
    {
      "date": "2025-04-11",
      "id": "106365",
      "original_text": "Registerbekanntmachung nach dem Umwandlungsgesetz\nNiedersachsen Amtsgericht Göttingen VR 893\nGöttingen Tourismus und Marketing e.V. – Göttingen",
      "type": "Registerbekanntmachung nach dem Umwandlungsgesetz",
      "state": "Niedersachsen",
      "amtsgericht": "Amtsgericht Göttingen",
      "registernummer": "VR 893",
      "registerart": "VR",
      "company_name": "Göttingen Tourismus und Marketing e.V.",
      "company_seat": "Göttingen",
      "details": "11.04.2025 (Bekanntmachungsdatum)\n\nNiedersachsen Amtsgericht Göttingen VR 893\nRegisterbekanntmachung nach dem Umwandlungsgesetz 11.04.2025 (Eintragungsdatum)\n\nGöttingen Tourismus und Marketing e.V.\neingetragener Verein\nGöttingen\n\nDen Gläubigern der an der Verschmelzung beteiligten Rechtsträger ist, wenn sie binnen sechs Monaten nach dem Tag, an dem die Eintragung der Verschmelzung in das Register des Sitzes desjenigen Rechtsträgers, dessen Gläubiger sie sind, nach § 19  Abs.  3 UmwG als bekannt gemacht gilt, ihren Anspruch nach Grund und Höhe schriftlich anmelden, Sicherheit zu leisten, soweit sie nicht Befriedigung verlangen können. Dieses Recht steht den Gläubigern jedoch nur zu, wenn sie glaubhaft machen, dass durch die Verschmelzung die Erfüllung der Forderung gefährdet wird."
    },
    {
      "date": "2025-04-11",
      "id": "106366",
      "original_text": "Sonstige Registerbekanntmachung\nNiedersachsen Amtsgericht Oldenburg (Oldenburg) HRB 200476\nWOYTON Oldenburg GASTRO GmbH – Oldenburg",
      "type": "Sonstige Registerbekanntmachung",
      "state": "Niedersachsen",
      "amtsgericht": "Amtsgericht Oldenburg (Oldenburg)",
      "registernummer": "HRB 200476",
      "registerart": "HRB",
      "company_name": "WOYTON Oldenburg GASTRO GmbH",
      "company_seat": "Oldenburg",
      "details": "11.04.2025 (Bekanntmachungsdatum)\n\nNiedersachsen Amtsgericht Oldenburg (Oldenburg) HRB 200476\nSonstige Registerbekanntmachung 11.04.2025 (Eintragungsdatum)\n\nWOYTON Oldenburg GASTRO GmbH\nGesellschaft mit beschränkter Haftung\nOldenburg\n\nDen Gläubigern der Gesellschaft, deren Forderungen begründet worden sind, bevor die Eintragung der Beendigung des Vertrages in das Handelsregister nach § 10 HGB als bekanntgemacht gilt, ist vom anderen Vertragsteil Sicherheit zu leisten, wenn sie sich binnen sechs Monaten nach der Bekanntmachung zu diesem Zweck bei ihm melden."
    },
    {
      "date": "2025-04-11",
      "id": "106367",
      "original_text": "Registerbekanntmachung nach dem Umwandlungsgesetz\nNiedersachsen Amtsgericht Oldenburg (Oldenburg) HRA 208722\nindigus Therapiezentrum e.K. – Löningen",
      "type": "Registerbekanntmachung nach dem Umwandlungsgesetz",
      "state": "Niedersachsen",
      "amtsgericht": "Amtsgericht Oldenburg (Oldenburg)",
      "registernummer": "HRA 208722",
      "registerart": "HRA",
      "company_name": "indigus Therapiezentrum e.K.",
      "company_seat": "Löningen",
      "details": "11.04.2025 (Bekanntmachungsdatum)\n\nNiedersachsen Amtsgericht Oldenburg (Oldenburg) HRA 208722\nRegisterbekanntmachung nach dem Umwandlungsgesetz 11.04.2025 (Eintragungsdatum)\n\nindigus Therapiezentrum e.K.\nEinzelkaufmann / Einzelkauffrau\nLöningen\n\nDen Gläubigern der an der Ausgliederung beteiligten Rechtsträger ist, wenn sie binnen sechs Monaten nach dem Tag, an dem die Eintragung der Ausgliederung in das Register des Sitzes desjenigen Rechtsträgers, dessen Gläubiger sie sind, nach § 19 Abs. 3 UmwG als bekannt gemacht gilt, ihren Anspruch nach Grund und Höhe schriftlich anmelden, Sicherheit zu leisten, soweit sie nicht Befriedigung verlangen können. Dieses Recht steht den Gläubigern jedoch nur zu, wenn sie glaubhaft machen, dass durch die Ausgliederung die Erfüllung der Forderung gefährdet wird."
    },
    {
      "date": "2025-04-11",
      "id": "106368",
      "original_text": "Löschungsankündigung\nNiedersachsen Amtsgericht Braunschweig HRB 208260\nKWN Reisen UG (haftungsbeschränkt) – Braunschweig",
      "type": "Löschungsankündigung",
      "state": "Niedersachsen",
      "amtsgericht": "Amtsgericht Braunschweig",
      "registernummer": "HRB 208260",
      "registerart": "HRB",
      "company_name": "KWN Reisen UG (haftungsbeschränkt)",
      "company_seat": "Braunschweig",
      "details": "11.04.2025 (Bekanntmachungsdatum)\n\nNiedersachsen Amtsgericht Braunschweig HRB 208260\nLöschungsankündigung\n\nKWN Reisen UG (haftungsbeschränkt)\nGesellschaft mit beschränkter Haftung\nBraunschweig\n\nDas Registergericht beabsichtigt, die Gesellschaft von Amts wegen nach § 394 FamFG zu löschen. Die Frist zur Erhebung eines Widerspruchs ist auf 1 Monat ab dieser Registerbekanntmachung festgesetzt."
    },
    {
      "date": "2025-04-11",
      "id": "106369",
      "original_text": "Registerbekanntmachung nach dem Umwandlungsgesetz\nNiedersachsen Amtsgericht Hannover HRB 200935\ntecRacer Verwaltungs GmbH – Hannover",
      "type": "Registerbekanntmachung nach dem Umwandlungsgesetz",
      "state": "Niedersachsen",
      "amtsgericht": "Amtsgericht Hannover",
      "registernummer": "HRB 200935",
      "registerart": "HRB",
      "company_name": "tecRacer Verwaltungs GmbH",
      "company_seat": "Hannover",
      "details": "11.04.2025 (Bekanntmachungsdatum)\n\nNiedersachsen Amtsgericht Hannover HRB 200935\nRegisterbekanntmachung nach dem Umwandlungsgesetz 11.04.2025 (Eintragungsdatum)\n\ntecRacer Verwaltungs GmbH\nGesellschaft mit beschränkter Haftung\nHannover\n\nDen Gläubigern der an der Verschmelzung beteiligten Rechtsträger ist, wenn sie binnen sechs Monaten nach dem Tag, an dem die Eintragung der Verschmelzung in das Register des Sitzes desjenigen Rechtsträgers, dessen Gläubiger sie sind, nach § 19  Abs.  3 UmwG als bekannt gemacht gilt, ihren Anspruch nach Grund und Höhe schriftlich anmelden, Sicherheit zu leisten, soweit sie nicht Befriedigung verlangen können. Dieses Recht steht den Gläubigern jedoch nur zu, wenn sie glaubhaft machen, dass durch die Verschmelzung die Erfüllung der Forderung gefährdet wird."
    },
    {
      "date": "2025-04-11",
      "id": "106370",
      "original_text": "Registerbekanntmachung nach dem Umwandlungsgesetz\nNiedersachsen Amtsgericht Hannover HRB 213510\nRosengarten Gastronomie- und Zimmervermietungsgesellschaft mbH – Hannover",
      "type": "Registerbekanntmachung nach dem Umwandlungsgesetz",
      "state": "Niedersachsen",
      "amtsgericht": "Amtsgericht Hannover",
      "registernummer": "HRB 213510",
      "registerart": "HRB",
      "company_name": "Rosengarten Gastronomie- und Zimmervermietungsgesellschaft mbH",
      "company_seat": "Hannover",
      "details": "11.04.2025 (Bekanntmachungsdatum)\n\nNiedersachsen Amtsgericht Hannover HRB 213510\nRegisterbekanntmachung nach dem Umwandlungsgesetz 11.04.2025 (Eintragungsdatum)\n\nRosengarten Gastronomie- und Zimmervermietungsgesellschaft mbH\nGesellschaft mit beschränkter Haftung\nHannover\n\nDen Gläubigern der an der Verschmelzung beteiligten Rechtsträger ist, wenn sie binnen sechs Monaten nach dem Tag, an dem die Eintragung der Verschmelzung in das Register des Sitzes desjenigen Rechtsträgers, dessen Gläubiger sie sind, nach § 19  Abs.  3 UmwG als bekannt gemacht gilt, ihren Anspruch nach Grund und Höhe schriftlich anmelden, Sicherheit zu leisten, soweit sie nicht Befriedigung verlangen können. Dieses Recht steht den Gläubigern jedoch nur zu, wenn sie glaubhaft machen, dass durch die Verschmelzung die Erfüllung der Forderung gefährdet wird."
    },
    {
      "date": "2025-04-11",
      "id": "106371",
      "original_text": "Registerbekanntmachung nach dem Umwandlungsgesetz\nNiedersachsen Amtsgericht Oldenburg (Oldenburg) HRB 221952\nindigus GmbH – Löningen",
      "type": "Registerbekanntmachung nach dem Umwandlungsgesetz",
      "state": "Niedersachsen",
      "amtsgericht": "Amtsgericht Oldenburg (Oldenburg)",
      "registernummer": "HRB 221952",
      "registerart": "HRB",
      "company_name": "indigus GmbH",
      "company_seat": "Löningen",
      "details": "11.04.2025 (Bekanntmachungsdatum)\n\nNiedersachsen Amtsgericht Oldenburg (Oldenburg) HRB 221952\nRegisterbekanntmachung nach dem Umwandlungsgesetz 11.04.2025 (Eintragungsdatum)\n\nindigus GmbH\nGesellschaft mit beschränkter Haftung\nLöningen\n\nDen Gläubigern der an der Ausgliederung beteiligten Rechtsträger ist, wenn sie binnen sechs Monaten nach dem Tag, an dem die Eintragung der Ausgliederung in das Register des Sitzes desjenigen Rechtsträgers, dessen Gläubiger sie sind, nach § 19 Abs. 3 UmwG als bekannt gemacht gilt, ihren Anspruch nach Grund und Höhe schriftlich anmelden, Sicherheit zu leisten, soweit sie nicht Befriedigung verlangen können. Dieses Recht steht den Gläubigern jedoch nur zu, wenn sie glaubhaft machen, dass durch die Ausgliederung die Erfüllung der Forderung gefährdet wird."
    },
    {
      "date": "2025-04-11",
      "id": "106372",
      "original_text": "Löschungsankündigung\nBremen Amtsgericht Bremen HRB 30337\nIntex-GmbH – Bremen",
      "type": "Löschungsankündigung",
      "state": "Bremen",
      "amtsgericht": "Amtsgericht Bremen",
      "registernummer": "HRB 30337",
      "registerart": "HRB",
      "company_name": "Intex-GmbH",
      "company_seat": "Bremen",
      "details": "11.04.2025 (Bekanntmachungsdatum)\n\nBremen Amtsgericht Bremen HRB 30337\nLöschungsankündigung\n\nIntex-GmbH\nGesellschaft mit beschränkter Haftung\nBremen\n\nEs ist beabsichtigt die im Handelsregister eingetragene Gesellschaft von Amts wegen gemäß § 394 FamFG zu löschen. Gegen die Löschung kann beim AG Bremen schriftlich oder zu Protokoll der Geschäftsstelle Widerspruch eingelegt werden. Widerspruchsfrist 4 Wochen."
    },
    {
      "date": "2025-04-11",
      "id": "106373",
      "original_text": "Registerbekanntmachung nach dem Umwandlungsgesetz\nRheinland-Pfalz Amtsgericht Montabaur GnR 20037\nIVM Software eG – Dierdorf",
      "type": "Registerbekanntmachung nach dem Umwandlungsgesetz",
      "state": "Rheinland-Pfalz",
      "amtsgericht": "Amtsgericht Montabaur",
      "registernummer": "GnR 20037",
      "registerart": "GnR",
      "company_name": "IVM Software eG",
      "company_seat": "Dierdorf",
      "details": "11.04.2025 (Bekanntmachungsdatum)\n\nRheinland-Pfalz Amtsgericht Montabaur GnR 20037\nRegisterbekanntmachung nach dem Umwandlungsgesetz 11.04.2025 (Eintragungsdatum)\n\nIVM Software eG\neingetragene Genossenschaft\nDierdorf\n\nAls nicht eingetragen wird veröffentlicht:\nDen Gläubigern des formwechselnden Rechtsträgers ist, wenn sie binnen sechs Monaten nach dem Tag, an dem die Eintragung des Formwechsels nach § 201 UmwG als bekannt gemacht gilt, ihren Anspruch nach Grund und Höhe schriftlich anmelden, Sicherheit zu leisten, soweit sie nicht Befriedigung verlangen können. Dieses Recht steht den Gläubigern jedoch nur zu, wenn sie glaubhaft machen, dass durch den Formwechsel die Erfüllung der Forderung gefährdet wird."
    },
    {
      "date": "2025-04-11",
      "id": "106374",
      "original_text": "Einreichung neuer Dokumente\nRheinland-Pfalz Amtsgericht Montabaur HRB 10868\nBasalt-Actien-Gesellschaft – Linz am Rhein",
      "type": "Einreichung neuer Dokumente",
      "state": "Rheinland-Pfalz",
      "amtsgericht": "Amtsgericht Montabaur",
      "registernummer": "HRB 10868",
      "registerart": "HRB",
      "company_name": "Basalt-Actien-Gesellschaft",
      "company_seat": "Linz am Rhein",
      "details": "11.04.2025 (Bekanntmachungsdatum)\n\nRheinland-Pfalz Amtsgericht Montabaur HRB 10868\nEinreichung neuer Dokumente\n\nBasalt-Actien-Gesellschaft\nAktiengesellschaft\nLinz am Rhein\n\nDem Registergericht ist eine neue Liste der Mitglieder des Aufsichtsrates eingereicht worden."
    },
    {
      "date": "2025-04-11",
      "id": "106375",
      "original_text": "Registerbekanntmachung nach dem Umwandlungsgesetz\nRheinland-Pfalz Amtsgericht Montabaur HRB 12884\nHoll & Partner, Software GmbH – Dierdorf",
      "type": "Registerbekanntmachung nach dem Umwandlungsgesetz",
      "state": "Rheinland-Pfalz",
      "amtsgericht": "Amtsgericht Montabaur",
      "registernummer": "HRB 12884",
      "registerart": "HRB",
      "company_name": "Holl & Partner, Software GmbH",
      "company_seat": "Dierdorf",
      "details": "11.04.2025 (Bekanntmachungsdatum)\n\nRheinland-Pfalz Amtsgericht Montabaur HRB 12884\nRegisterbekanntmachung nach dem Umwandlungsgesetz 11.04.2025 (Eintragungsdatum)\n\nHoll & Partner, Software GmbH\nGesellschaft mit beschränkter Haftung\nDierdorf\n\nAls nicht eingetragen wird veröffentlicht:\nDen Gläubigern des formwechselnden Rechtsträgers ist, wenn sie binnen sechs Monaten nach dem Tag, an dem die Eintragung des Formwechsels nach § 201 UmwG als bekannt gemacht gilt, ihren Anspruch nach Grund und Höhe schriftlich anmelden, Sicherheit zu leisten, soweit sie nicht Befriedigung verlangen können. Dieses Recht steht den Gläubigern jedoch nur zu, wenn sie glaubhaft machen, dass durch den Formwechsel die Erfüllung der Forderung gefährdet wird."
    },
    {
      "date": "2025-04-11",
      "id": "106376",
      "original_text": "Registerbekanntmachung nach dem Umwandlungsgesetz\nRheinland-Pfalz Amtsgericht Mainz HRB 50565\nBEKIM Holding GmbH – Nieder-Olm",
      "type": "Registerbekanntmachung nach dem Umwandlungsgesetz",
      "state": "Rheinland-Pfalz",
      "amtsgericht": "Amtsgericht Mainz",
      "registernummer": "HRB 50565",
      "registerart": "HRB",
      "company_name": "BEKIM Holding GmbH",
      "company_seat": "Nieder-Olm",
      "details": "11.04.2025 (Bekanntmachungsdatum)\n\nRheinland-Pfalz Amtsgericht Mainz HRB 50565\nRegisterbekanntmachung nach dem Umwandlungsgesetz\n\nBEKIM Holding GmbH\nGesellschaft mit beschränkter Haftung\nNieder-Olm\n\nAls nicht eingetragen wird veröffentlicht:\nDen Gläubigern des formwechselnden Rechtsträgers ist, wenn sie binnen sechs Monaten nach dem Tag, an dem die Eintragung des Formwechsels nach § 201 UmwG als bekannt gemacht gilt, ihren Anspruch nach Grund und Höhe schriftlich anmelden, Sicherheit zu leisten, soweit sie nicht Befriedigung verlangen können. Dieses Recht steht den Gläubigern jedoch nur zu, wenn sie glaubhaft machen, dass durch den Formwechsel die Erfüllung der Forderung gefährdet wird."
    },
    {
      "date": "2025-04-11",
      "id": "106377",
      "original_text": "Löschungsankündigung\nRheinland-Pfalz Amtsgericht Ludwigshafen a.Rhein (Ludwigshafen) HRB 67306\nEvent Hotel Charisma UG (haftungsbeschränkt) – Neuleiningen",
      "type": "Löschungsankündigung",
      "state": "Rheinland-Pfalz",
      "amtsgericht": "Amtsgericht Ludwigshafen a.Rhein (Ludwigshafen)",
      "registernummer": "HRB 67306",
      "registerart": "HRB",
      "company_name": "Event Hotel Charisma UG (haftungsbeschränkt)",
      "company_seat": "Neuleiningen",
      "details": "11.04.2025 (Bekanntmachungsdatum)\n\nRheinland-Pfalz Amtsgericht Ludwigshafen a.Rhein (Ludwigshafen) HRB 67306\nLöschungsankündigung\n\nEvent Hotel Charisma UG (haftungsbeschränkt)\nGesellschaft mit beschränkter Haftung\nNeuleiningen\n\nDas Registergericht beabsichtigt die Gesellschaft von Amts wegen nach § 394 FamFG zu löschen. Die Frist zur Erhebung eines Widerspruchs ist auf einen Monat festgesetzt."
    },
    {
      "date": "2025-04-11",
      "id": "106378",
      "original_text": "Einreichung neuer Dokumente\nRheinland-Pfalz Amtsgericht Montabaur HRB 26245\nFlohr AG – Neuwied",
      "type": "Einreichung neuer Dokumente",
      "state": "Rheinland-Pfalz",
      "amtsgericht": "Amtsgericht Montabaur",
      "registernummer": "HRB 26245",
      "registerart": "HRB",
      "company_name": "Flohr AG",
      "company_seat": "Neuwied",
      "details": "11.04.2025 (Bekanntmachungsdatum)\n\nRheinland-Pfalz Amtsgericht Montabaur HRB 26245\nEinreichung neuer Dokumente\n\nFlohr AG\nAktiengesellschaft\nNeuwied\n\nDem Registergericht ist eine neue Liste der Mitglieder des Aufsichtsrates eingereicht worden."
    },
    {
      "date": "2025-04-11",
      "id": "106379",
      "original_text": "Löschungsankündigung\nNordrhein-Westfalen Amtsgericht Düsseldorf HRB 73042\nSPM GmbH – Düsseldorf",
      "type": "Löschungsankündigung",
      "state": "Nordrhein-Westfalen",
      "amtsgericht": "Amtsgericht Düsseldorf",
      "registernummer": "HRB 73042",
      "registerart": "HRB",
      "company_name": "SPM GmbH",
      "company_seat": "Düsseldorf",
      "details": "11.04.2025 (Bekanntmachungsdatum)\n\nNordrhein-Westfalen Amtsgericht Düsseldorf HRB 73042\nLöschungsankündigung\n\nSPM GmbH\nGesellschaft mit beschränkter Haftung\nDüsseldorf\n\nDas Registergericht beabsichtigt die Gesellschaft von Amts wegen nach § 394 FamFG zu löschen. Die Frist zur Erhebung eines Widerspruchs ist auf 3 Wochen festgesetzt.\n\nRechtsbehelfsbelehrung:\nDas Widerspruchsrecht steht jedem zu, der an der Unterlassung der Löschung ein berechtigtes Interesse hat. Der Widerspruch ist bei dem Amtsgericht Düsseldorf -Registergericht-, Werdener Straße 1, 40227 Düsseldorf schriftlich in deutscher Sprache oder zur Niederschrift der Geschäftsstelle einzulegen. Der Widerspruch kann auch zur Niederschrift der Geschäftsstelle eines jeden Amtsgerichtes abgegeben werden. Die Einlegung ist auch durch Übertragung eines elektronischen Dokuments an die elektronische Poststelle des Gerichts möglich. Das elektronische Dokument muss für die Bearbeitung durch das Gericht geeignet und mit einer qualifizierten elektronischen Signatur der verantwortenden Person versehen sein oder von der verantwortenden Person signiert und auf einem sicheren Übermittlungsweg gemäß § 130a ZPO nach näherer Maßgabe der Verordnung über die technischen Rahmenbedingungen des elektronischen Rechtsverkehrs und über das besondere elektronische Behördenpostfach (BGBl. I, S.3803) eingereicht werden. Weitere Informationen erhalten Sie auf der Internetseite www.justiz.de.\nDer Widerspruch muss spätestens innerhalb der gesetzten Frist nach dem Datum der Bekanntmachung der Löschungsankündigung bei dem Amtsgericht - Registergericht - Düsseldorf eingegangen sein.  Dies gilt auch dann, wenn der Widerspruch zur Niederschrift der Geschäftsstelle eines anderen Amtsgerichtes abgegeben wurde. Die Frist beginnt mit dem Tage der Bekanntmachung der Löschungsankündigung in dem für die Bekanntmachung der Eintragungen in das Handelsregister bestimmten elektronischen Informations- und Kommunikationssystem nach § 10 des Handelsgesetzbuches. Fällt das Ende der Frist auf einen Sonntag, einen allgemeinen Feiertag oder Sonnabend, so endet die Frist mit Ablauf des nächsten Werktages.\nDer Widerspruch muss die Bezeichnung der angefochtenen Löschungsankündigung sowie die Erklärung enthalten, dass Widerspruch gegen diese Löschungsankündigung eingelegt wird. Er ist zu unterzeichnen und soll begründet werden."
    },
    {
      "date": "2025-04-11",
      "id": "106380",
      "original_text": "Löschungsankündigung\nNordrhein-Westfalen Amtsgericht Recklinghausen HRB 7665\nLedeco-con GmbH – Recklinghausen",
      "type": "Löschungsankündigung",
      "state": "Nordrhein-Westfalen",
      "amtsgericht": "Amtsgericht Recklinghausen",
      "registernummer": "HRB 7665",
      "registerart": "HRB",
      "company_name": "Ledeco-con GmbH",
      "company_seat": "Recklinghausen",
      "details": "11.04.2025 (Bekanntmachungsdatum)\n\nNordrhein-Westfalen Amtsgericht Recklinghausen HRB 7665\nLöschungsankündigung\n\nLedeco-con GmbH\nGesellschaft mit beschränkter Haftung\nRecklinghausen\n\nDas Registergericht beabsichtigt die Gesellschaft von Amts wegen nach § 394 FamFG zu löschen. Die Frist zur Erhebung eines Widerspruchs ist auf drei Monate festgesetzt."
    },
    {
      "date": "2025-04-11",
      "id": "106381",
      "original_text": "Löschungsankündigung\nNordrhein-Westfalen Amtsgericht Düsseldorf HRB 87973\nZMA GmbH – Düsseldorf",
      "type": "Löschungsankündigung",
      "state": "Nordrhein-Westfalen",
      "amtsgericht": "Amtsgericht Düsseldorf",
      "registernummer": "HRB 87973",
      "registerart": "HRB",
      "company_name": "ZMA GmbH",
      "company_seat": "Düsseldorf",
      "details": "11.04.2025 (Bekanntmachungsdatum)\n\nNordrhein-Westfalen Amtsgericht Düsseldorf HRB 87973\nLöschungsankündigung\n\nZMA GmbH\nGesellschaft mit beschränkter Haftung\nDüsseldorf\n\nDas Registergericht beabsichtigt die Gesellschaft von Amts wegen nach § 394 FamFG zu löschen. Die Frist zur Erhebung eines Widerspruchs ist auf 3 Wochen festgesetzt.\n\nRechtsbehelfsbelehrung:\nDas Widerspruchsrecht steht jedem zu, der an der Unterlassung der Löschung ein berechtigtes Interesse hat. Der Widerspruch ist bei dem Amtsgericht Düsseldorf -Registergericht-, Werdener Straße 1, 40227 Düsseldorf schriftlich in deutscher Sprache oder zur Niederschrift der Geschäftsstelle einzulegen. Der Widerspruch kann auch zur Niederschrift der Geschäftsstelle eines jeden Amtsgerichtes abgegeben werden. Die Einlegung ist auch durch Übertragung eines elektronischen Dokuments an die elektronische Poststelle des Gerichts möglich. Das elektronische Dokument muss für die Bearbeitung durch das Gericht geeignet und mit einer qualifizierten elektronischen Signatur der verantwortenden Person versehen sein oder von der verantwortenden Person signiert und auf einem sicheren Übermittlungsweg gemäß § 130a ZPO nach näherer Maßgabe der Verordnung über die technischen Rahmenbedingungen des elektronischen Rechtsverkehrs und über das besondere elektronische Behördenpostfach (BGBl. I, S.3803) eingereicht werden. Weitere Informationen erhalten Sie auf der Internetseite www.justiz.de.\nDer Widerspruch muss spätestens innerhalb der gesetzten Frist nach dem Datum der Bekanntmachung der Löschungsankündigung bei dem Amtsgericht - Registergericht - Düsseldorf eingegangen sein.  Dies gilt auch dann, wenn der Widerspruch zur Niederschrift der Geschäftsstelle eines anderen Amtsgerichtes abgegeben wurde. Die Frist beginnt mit dem Tage der Bekanntmachung der Löschungsankündigung in dem für die Bekanntmachung der Eintragungen in das Handelsregister bestimmten elektronischen Informations- und Kommunikationssystem nach § 10 des Handelsgesetzbuches. Fällt das Ende der Frist auf einen Sonntag, einen allgemeinen Feiertag oder Sonnabend, so endet die Frist mit Ablauf des nächsten Werktages.\nDer Widerspruch muss die Bezeichnung der angefochtenen Löschungsankündigung sowie die Erklärung enthalten, dass Widerspruch gegen diese Löschungsankündigung eingelegt wird. Er ist zu unterzeichnen und soll begründet werden."
    },
    {
      "date": "2025-04-11",
      "id": "106382",
      "original_text": "Löschungsankündigung\nNordrhein-Westfalen Amtsgericht Bonn HRB 22163\nCruse Beteiligungs GmbH – Wachtberg",
      "type": "Löschungsankündigung",
      "state": "Nordrhein-Westfalen",
      "amtsgericht": "Amtsgericht Bonn",
      "registernummer": "HRB 22163",
      "registerart": "HRB",
      "company_name": "Cruse Beteiligungs GmbH",
      "company_seat": "Wachtberg",
      "details": "11.04.2025 (Bekanntmachungsdatum)\n\nNordrhein-Westfalen Amtsgericht Bonn HRB 22163\nLöschungsankündigung\n\nCruse Beteiligungs GmbH\nGesellschaft mit beschränkter Haftung\nWachtberg\n\nDas Registergericht beabsichtigt die im Handelsregister beim Amtsgericht in Bonn unter HRB 22163 eingetragene Gesellschaft  Cruse Beteiligungs GmbH mit Sitz in Wachtberg von Amts wegen nach § 394 FamFG zu löschen. Die Frist zur Erhebung eines Widerspruchs ist auf einen Monat festgesetzt."
    },
    {
      "date": "2025-04-11",
      "id": "106383",
      "original_text": "Einreichung neuer Dokumente\nNordrhein-Westfalen Amtsgericht Bonn HRB 8500\nComma Soft AG – Bonn",
      "type": "Einreichung neuer Dokumente",
      "state": "Nordrhein-Westfalen",
      "amtsgericht": "Amtsgericht Bonn",
      "registernummer": "HRB 8500",
      "registerart": "HRB",
      "company_name": "Comma Soft AG",
      "company_seat": "Bonn",
      "details": "11.04.2025 (Bekanntmachungsdatum)\n\nNordrhein-Westfalen Amtsgericht Bonn HRB 8500\nEinreichung neuer Dokumente 11.04.2025 (Eintragungsdatum)\n\nComma Soft AG\nAktiengesellschaft\nBonn\n\nDem Registergericht ist eine neue Liste der Mitglieder des Aufsichtsrates eingereicht worden."
    },
    {
      "date": "2025-04-11",
      "id": "106384",
      "original_text": "Einreichung neuer Dokumente\nNordrhein-Westfalen Amtsgericht Steinfurt HRB 12946\nJORA Holding AG – Greven",
      "type": "Einreichung neuer Dokumente",
      "state": "Nordrhein-Westfalen",
      "amtsgericht": "Amtsgericht Steinfurt",
      "registernummer": "HRB 12946",
      "registerart": "HRB",
      "company_name": "JORA Holding AG",
      "company_seat": "Greven",
      "details": "11.04.2025 (Bekanntmachungsdatum)\n\nNordrhein-Westfalen Amtsgericht Steinfurt HRB 12946\nEinreichung neuer Dokumente 11.04.2025 (Eintragungsdatum)\n\nJORA Holding AG\nAktiengesellschaft\nGreven\n\nDem Registergericht ist eine Liste der Mitglieder des Aufsichtsrates eingereicht worden."
    },
    {
      "date": "2025-04-11",
      "id": "106385",
      "original_text": "Einreichung neuer Dokumente\nNordrhein-Westfalen Amtsgericht Köln HRB 119364\nDorint Hotels Betriebs GmbH – Köln",
      "type": "Einreichung neuer Dokumente",
      "state": "Nordrhein-Westfalen",
      "amtsgericht": "Amtsgericht Köln",
      "registernummer": "HRB 119364",
      "registerart": "HRB",
      "company_name": "Dorint Hotels Betriebs GmbH",
      "company_seat": "Köln",
      "details": "11.04.2025 (Bekanntmachungsdatum)\n\nNordrhein-Westfalen Amtsgericht Köln HRB 119364\nEinreichung neuer Dokumente\n\nDorint Hotels Betriebs GmbH\nGesellschaft mit beschränkter Haftung\nKöln\n\nDem Registergericht ist eine neue Liste der Mitglieder des Aufsichtsrates eingereicht worden."
    },
    {
      "date": "2025-04-11",
      "id": "106386",
      "original_text": "Löschungsankündigung\nNordrhein-Westfalen Amtsgericht Essen HRB 32965\nPro Food Trading GmbH – Essen",
      "type": "Löschungsankündigung",
      "state": "Nordrhein-Westfalen",
      "amtsgericht": "Amtsgericht Essen",
      "registernummer": "HRB 32965",
      "registerart": "HRB",
      "company_name": "Pro Food Trading GmbH",
      "company_seat": "Essen",
      "details": "11.04.2025 (Bekanntmachungsdatum)\n\nNordrhein-Westfalen Amtsgericht Essen HRB 32965\nLöschungsankündigung\n\nPro Food Trading GmbH\nGesellschaft mit beschränkter Haftung\nEssen\n\nDas Registergericht beabsichtigt die Gesellschaft von Amts wegen nach § 394 FamFG zu löschen. Die Frist zur Erhebung eines Widerspruchs ist auf einen Monat festgesetzt."
    },
    {
      "date": "2025-04-11",
      "id": "106387",
      "original_text": "Löschungsankündigung\nNordrhein-Westfalen Amtsgericht Köln HRB 114658\nEditBau GmbH – Pulheim",
      "type": "Löschungsankündigung",
      "state": "Nordrhein-Westfalen",
      "amtsgericht": "Amtsgericht Köln",
      "registernummer": "HRB 114658",
      "registerart": "HRB",
      "company_name": "EditBau GmbH",
      "company_seat": "Pulheim",
      "details": "11.04.2025 (Bekanntmachungsdatum)\n\nNordrhein-Westfalen Amtsgericht Köln HRB 114658\nLöschungsankündigung\n\nEditBau GmbH\nGesellschaft mit beschränkter Haftung\nPulheim\n\nDas Registergericht beabsichtigt, die im Handelsregister eingetragene Gesellschaft gemäß § 394 Absatz 1 FamFG wegen Vermögenslosigkeit von Amts wegen zu löschen. Gegen diese Verfügung kann Widerspruch eingelegt werden. Die Frist zur Erhebung eines Widerspruchs gegen die beabsichtigte Löschung von Amts wegen ist auf einen Monat festgesetzt. Rechtsbehelfsbelehrung: Gegen diese Verfügung können Sie Widerspruch einlegen. Der Widerspruch ist bei dem Amtsgericht Köln, Reichenspergerplatz 1, 50670 Köln schriftlich in deutscher Sprache oder zur Niederschrift der Geschäftsstelle einzulegen. Der Widerspruch kann auch zur Niederschrift der Geschäftsstelle eines jeden Amtsgerichtes abgegeben werden. Die Einlegung ist auch durch Übertragung eines elektronischen Dokuments an die elektronische Poststelle des Gerichts möglich. Das elektronische Dokument muss für die Bearbeitung durch das Gericht geeignet und mit einer qualifizierten elektronischen Signatur der verantwortenden Person versehen sein oder von der verantwortenden Person signiert und auf einem sicheren Übermittlungsweg gemäß § 130a ZPO nach näherer Maßgabe der Verordnung über die technischen Rahmenbedingungen des elektronischen Rechtsverkehrs und über das besondere elektronische Behördenpostfach (BGBl. I, S.3803) eingereicht werden. Weitere Informationen erhalten Sie auf der Internetseite www.justiz.de.Der Widerspruch muss spätestens innerhalb der gesetzten Frist bei dem Amtsgericht Köln eingegangen sein. Dies gilt auch dann, wenn der Widerspruch zur Niederschrift der Geschäftsstelle eines anderen Amtsgerichtes abgegeben wurde. Die Frist beginnt mit der Veröffentlichung. Fällt das Ende der Frist auf einen Sonntag, einen allgemeinen Feiertag oder Sonnabend, so endet die Frist mit Ablauf des nächsten Werktages.\n\nDer Widerspruch muss die Bezeichnung der angefochtenen Verfügung sowie die Erklärung enthalten, dass Widerspruch gegen diese Verfügung eingelegt wird. Er ist zu unterzeichnen und soll begründet werden."
    },
    {
      "date": "2025-04-11",
      "id": "106388",
      "original_text": "Löschungsankündigung\nNordrhein-Westfalen Amtsgericht Aachen HRB 21182\nAQAZIA GmbH – Aachen",
      "type": "Löschungsankündigung",
      "state": "Nordrhein-Westfalen",
      "amtsgericht": "Amtsgericht Aachen",
      "registernummer": "HRB 21182",
      "registerart": "HRB",
      "company_name": "AQAZIA GmbH",
      "company_seat": "Aachen",
      "details": "11.04.2025 (Bekanntmachungsdatum)\n\nNordrhein-Westfalen Amtsgericht Aachen HRB 21182\nLöschungsankündigung\n\nAQAZIA GmbH\nGesellschaft mit beschränkter Haftung\nAachen\n\nDas Registergericht beabsichtigt, von Amts wegen die Gesellschaft wegen Vermögenslosigkeit nach § 394 FamFG zu löschen, weil das Finanzamt Aachen-Stadt mit Schreiben vom 31.03.2025 Umstände mitgeteilt hat, aufgrund derer das Gericht davon überzeugt ist, dass die Gesellschaft vollständig vermögenslos ist.\n\nZur Geltendmachung des Widerspruchs gegen die beabsichtigte Löschung wird hiermit eine Frist von einem Monat ab Veröffentlichung dieser Ankündigung bestimmt.\n\nRechtsbehelfsbelehrung:\n\nGegen diese Verfügung kann Widerspruch eingelegt werden. Zum Widerspruch ist jeder berechtigt, der an der Unterlassung der Löschung ein berechtigtes Interesse hat.\n\nDer Widerspruch ist bei dem Amtsgericht Aachen, Adalbertsteinweg 92, 52070 Aachen schriftlich in deutscher Sprache oder zur Niederschrift der Geschäftsstelle einzulegen. Der Widerspruch kann auch zur Niederschrift der Geschäftsstelle eines jeden Amtsgerichtes abgegeben werden.\n\nDer Widerspruch muss spätestens innerhalb der gesetzten Frist nach der Bekanntgabe der Verfügung bei dem Amtsgericht Aachen eingegangen sein. Dies gilt auch dann, wenn der Widerspruch zur Niederschrift der Geschäftsstelle eines anderen Amtsgerichtes abgegeben wurde. Die Frist beginnt mit der Bekanntgabe der Verfügung durch Veröffentlichung. Fällt das Ende der Frist auf einen Sonntag, einen allgemeinen Feiertag oder Sonnabend, so endet die Frist mit Ablauf des nächsten Werktages.\n\nDer Widerspruch muss die Bezeichnung der angefochtenen Verfügung sowie die Erklärung enthalten, dass Widerspruch gegen diese Verfügung eingelegt wird. Er ist zu unterzeichnen und soll begründet werden.\n\nDie Einlegung ist auch durch Übertragung eines elektronischen Dokuments an die elektronische Poststelle des Gerichts möglich. Das elektronische Dokument muss für die Bearbeitung durch das Gericht geeignet und mit einer qualifizierten elektronischen Signatur der verantwortenden Person versehen sein oder von der verantwortenden Person signiert und auf einem sicheren Übermittlungsweg gemäß § 130 a ZPO nach näherer Maßgabe der Verordnung über die technischen Rahmenbedingungen des elektronischen Rechtsverkehrs und über das besondere elektronische Behördenpostfach (BGBl. I, S. 3803) eingereicht werden. Weitere Informationen erhalten Sie auf der Internetseite www.justiz.de."
    },
    {
      "date": "2025-04-11",
      "id": "106389",
      "original_text": "Löschungsankündigung\nNordrhein-Westfalen Amtsgericht Siegburg HRB 15953\nBauunternehmung IAZ Zimmermann GmbH – Windeck",
      "type": "Löschungsankündigung",
      "state": "Nordrhein-Westfalen",
      "amtsgericht": "Amtsgericht Siegburg",
      "registernummer": "HRB 15953",
      "registerart": "HRB",
      "company_name": "Bauunternehmung IAZ Zimmermann GmbH",
      "company_seat": "Windeck",
      "details": "11.04.2025 (Bekanntmachungsdatum)\n\nNordrhein-Westfalen Amtsgericht Siegburg HRB 15953\nLöschungsankündigung\n\nBauunternehmung IAZ Zimmermann GmbH\nGesellschaft mit beschränkter Haftung\nWindeck\n\nDas Registergericht hat glaubhafte Kenntnis erlangt, dass die Gesellschaft vermögenslos geworden ist, da ein Insolvenzeröffnungsantrag mangels Masse nach § 26 InsO zurückgewiesen wurde.\n\nEs ist daher beabsichtigt, die Gesellschaft nach § 394 FamFG im Handelsregister wegen Vermögenslosigkeit zu löschen.\n\nEinwände gegen die Löschung sind durch Widerspruch binnen einer Frist von 3 Monaten geltend zu machen, andernfalls die Löschung erfolgen wird.\n\nEinzulegen ist der Widerspruch bei dem Amtsgericht Siegburg, Neue Poststraße 16, 53721 Siegburg, und zwar entweder schriftlich in deutscher Sprache oder mündlich zur Niederschrift der Geschäftsstelle. Der Widerspruch kann auch zur Niederschrift der Geschäftsstelle eines jeden Amtsgerichts abgegeben werden. Der Widerspruch ist binnen der in der Verfügung bestimmten Frist einzulegen. Die Frist ist nur gewahrt, wenn der Widerspruch rechtzeitig bei dem Amtsgericht Siegburg eingeht, auch wenn der Widerspruch zur Niederschrift der Geschäftsstelle eines anderen Amtsgerichts abgegeben wurde. Die Frist beginnt jeweils mit der schriftlichen Bekanntgabe der Verfügung an die Beteiligten. Kann die schriftliche Bekanntgabe an einen Beteiligten nicht bewirkt werden, beginnt die Frist spätestens mit Ablauf von fünf Monaten nach Erlass der Verfügung. Die Bekanntgabe ist entweder durch Zustellung oder am dritten Tage nach Aufgabe zur Post bewirkt. Sofern die Löschung noch nicht erfolgt ist, kann der Widerspruch auch noch nach Ablauf der Frist eingelegt werden. Fällt das Ende der Frist auf einen Sonnabend, einen Sonntag oder einen allgemeinen Feiertag, endet die Frist mit Ablauf des nächsten Werktages. Der Widerspruch ist zu unterzeichnen. Eine Begründung des Widerspruchs ist nicht vorgeschrieben."
    },
    {
      "date": "2025-04-11",
      "id": "106390",
      "original_text": "Löschungsankündigung\nNordrhein-Westfalen Amtsgericht Bad Oeynhausen HRB 15752\nJHD Tech UG (haftungsbeschränkt) – Herford",
      "type": "Löschungsankündigung",
      "state": "Nordrhein-Westfalen",
      "amtsgericht": "Amtsgericht Bad Oeynhausen",
      "registernummer": "HRB 15752",
      "registerart": "HRB",
      "company_name": "JHD Tech UG (haftungsbeschränkt)",
      "company_seat": "Herford",
      "details": "11.04.2025 (Bekanntmachungsdatum)\n\nNordrhein-Westfalen Amtsgericht Bad Oeynhausen HRB 15752\nLöschungsankündigung\n\nJHD Tech UG (haftungsbeschränkt)\nGesellschaft mit beschränkter Haftung\nHerford\n\nDas Registergericht beabsichtigt die Gesellschaft von Amts wegen nach § 394 FamFG zu löschen. Die Frist zur Erhebung eines Widerspruchs ist auf einen Monat festgesetzt."
    },
    {
      "date": "2025-04-11",
      "id": "106391",
      "original_text": "Löschungsankündigung\nNordrhein-Westfalen Amtsgericht Hamm HRB 6234\nDIGAL Systeme GmbH – Holzwickede",
      "type": "Löschungsankündigung",
      "state": "Nordrhein-Westfalen",
      "amtsgericht": "Amtsgericht Hamm",
      "registernummer": "HRB 6234",
      "registerart": "HRB",
      "company_name": "DIGAL Systeme GmbH",
      "company_seat": "Holzwickede",
      "details": "11.04.2025 (Bekanntmachungsdatum)\n\nNordrhein-Westfalen Amtsgericht Hamm HRB 6234\nLöschungsankündigung\n\nDIGAL Systeme GmbH\nGesellschaft mit beschränkter Haftung\nHolzwickede\n\nDas Registergericht beabsichtigt die Gesellschaft von Amts wegen nach § 394 FamFG zu löschen. Die Frist zur Erhebung eines Widerspruchs ist auf drei Monate festgesetzt."
    },
    {
      "date": "2025-04-11",
      "id": "106392",
      "original_text": "Löschungsankündigung\nNordrhein-Westfalen Amtsgericht Krefeld HRB 17609\nAL-HAFHAF Oil, Logistic & Communication Services GmbH – Krefeld",
      "type": "Löschungsankündigung",
      "state": "Nordrhein-Westfalen",
      "amtsgericht": "Amtsgericht Krefeld",
      "registernummer": "HRB 17609",
      "registerart": "HRB",
      "company_name": "AL-HAFHAF Oil, Logistic & Communication Services GmbH",
      "company_seat": "Krefeld",
      "details": "11.04.2025 (Bekanntmachungsdatum)\n\nNordrhein-Westfalen Amtsgericht Krefeld HRB 17609\nLöschungsankündigung\n\nAL-HAFHAF Oil, Logistic & Communication Services GmbH\nGesellschaft mit beschränkter Haftung\nKrefeld\n\nDas Registergericht beabsichtigt die Gesellschaft von Amts wegen nach § 394 FamFG zu löschen. Die Frist zur Erhebung eines Widerspruchs ist auf einen Monat festgesetzt."
    },
    {
      "date": "2025-04-11",
      "id": "106393",
      "original_text": "Registerbekanntmachung nach dem Umwandlungsgesetz\nNordrhein-Westfalen Amtsgericht Essen HRB 35747\nKADO MESSOUH UG (haftungsbeschränkt) – Essen",
      "type": "Registerbekanntmachung nach dem Umwandlungsgesetz",
      "state": "Nordrhein-Westfalen",
      "amtsgericht": "Amtsgericht Essen",
      "registernummer": "HRB 35747",
      "registerart": "HRB",
      "company_name": "KADO MESSOUH UG (haftungsbeschränkt)",
      "company_seat": "Essen",
      "details": "11.04.2025 (Bekanntmachungsdatum)\n\nNordrhein-Westfalen Amtsgericht Essen HRB 35747\nRegisterbekanntmachung nach dem Umwandlungsgesetz 11.04.2025 (Eintragungsdatum)\n\nKADO MESSOUH UG (haftungsbeschränkt)\nGesellschaft mit beschränkter Haftung\nEssen\n\nDen Gläubigern der an der Verschmelzung beteiligten Rechtsträger ist, wenn sie binnen sechs Monaten nach dem Tag, an dem die Eintragung der Verschmelzung in das Register des Sitzes desjenigen Rechtsträgers, dessen Gläubiger sie sind, nach § 19 Absatz 3 UmwG als bekanntgemacht gilt, ihren Anspruch nach Grund und Höhe schriftlich anmelden, Sicherheit zu leisten, soweit sie nicht Befriedigung verlangen können. Dieses Recht steht den Gläubigern jedoch nur zu, wenn sie glaubhaft machen, dass durch die Verschmelzung die Erfüllung ihrer Forderung gefährdet wird."
    },
    {
      "date": "2025-04-11",
      "id": "106394",
      "original_text": "Registerbekanntmachung nach dem Umwandlungsgesetz\nNordrhein-Westfalen Amtsgericht Bochum HRA 8073\nC.T. Rental Dominik Weilandt e.K. – Bochum",
      "type": "Registerbekanntmachung nach dem Umwandlungsgesetz",
      "state": "Nordrhein-Westfalen",
      "amtsgericht": "Amtsgericht Bochum",
      "registernummer": "HRA 8073",
      "registerart": "HRA",
      "company_name": "C.T. Rental Dominik Weilandt e.K.",
      "company_seat": "Bochum",
      "details": "11.04.2025 (Bekanntmachungsdatum)\n\nNordrhein-Westfalen Amtsgericht Bochum HRA 8073\nRegisterbekanntmachung nach dem Umwandlungsgesetz 10.04.2025 (Eintragungsdatum)\n\nC.T. Rental Dominik Weilandt e.K.\nEinzelkaufmann / Einzelkauffrau\nBochum\n\nDen Gläubigern der an der Ausgliederung beteiligten Rechtsträger ist, wenn sie binnen sechs Monaten nach dem Tag, an dem die Eintragung der Ausgliederung in das Register des Sitzes derjenigen Rechtsträger deren Gläubiger sie sind, nach § 19 Absatz 3 UmwG als bekanntgemacht gilt, ihren Anspruch nach Grund und Höhe schriftlich anmelden, Sicherheit zu leisten, soweit sie nicht Befriedigung verlangen können. Dieses Recht steht den Gläubigern jedoch nur zu, wenn sie glaubhaft machen, dass durch die Ausgliederung die Erfüllung ihrer Forderung gefährdet wird."
    },
    {
      "date": "2025-04-11",
      "id": "106395",
      "original_text": "Einreichung neuer Dokumente\nNordrhein-Westfalen Amtsgericht Münster HRB 15618\nCOMPO EXPERT International GmbH – Münster",
      "type": "Einreichung neuer Dokumente",
      "state": "Nordrhein-Westfalen",
      "amtsgericht": "Amtsgericht Münster",
      "registernummer": "HRB 15618",
      "registerart": "HRB",
      "company_name": "COMPO EXPERT International GmbH",
      "company_seat": "Münster",
      "details": "11.04.2025 (Bekanntmachungsdatum)\n\nNordrhein-Westfalen Amtsgericht Münster HRB 15618\nEinreichung neuer Dokumente\n\nCOMPO EXPERT International GmbH\nGesellschaft mit beschränkter Haftung\nMünster\n\nDem Registergericht ist eine neue Liste der Mitglieder des Aufsichtsrates eingereicht worden."
    },
    {
      "date": "2025-04-11",
      "id": "106396",
      "original_text": "Löschungsankündigung\nNordrhein-Westfalen Amtsgericht Neuss HRB 19165\nVELLORA Fashion GmbH – Neuss",
      "type": "Löschungsankündigung",
      "state": "Nordrhein-Westfalen",
      "amtsgericht": "Amtsgericht Neuss",
      "registernummer": "HRB 19165",
      "registerart": "HRB",
      "company_name": "VELLORA Fashion GmbH",
      "company_seat": "Neuss",
      "details": "11.04.2025 (Bekanntmachungsdatum)\n\nNordrhein-Westfalen Amtsgericht Neuss HRB 19165\nLöschungsankündigung 10.04.2025 (Eintragungsdatum)\n\nVELLORA Fashion GmbH\nGesellschaft mit beschränkter Haftung\nNeuss\n\nDas Registergericht beabsichtigt die Gesellschaft von Amts wegen nach § 394 FamFG zu löschen. Die Frist zur Erhebung eines Widerspruchs ist auf einen Monat festgesetzt. Rechtsbehelfsbelehrung: Gegen diese Verfügung können Sie Widerspruch einlegen. Der Widerspruch ist bei dem Amtsgericht Neuss - Registergericht -, Breite Str. 48, 41460 Neuss schriftlich in deutscher Sprache oder zur Niederschrift der Geschäftsstelle einzulegen.Der Widerspruch kann auch zur Niederschrift der Geschäftsstelle eines jeden Amtsgerichtes abgegeben werden. Die Einlegung ist auch durch Übertragung eines elektronischen Dokuments an die elektronische Poststelle des Gerichts möglich. Das elektronische Dokument muss für die Bearbeitung durch das Gericht geeignet und mit einer qualifizierten elektronischen Signatur der verantwortenden Person versehen sein oder von der verantwortenden Person signiert und auf einem sicheren Übermittlungsweg gemäß § 130a ZPO nach näherer Maßgabe der Verordnung über die technischen Rahmenbedingungen des elektronischen Rechtsverkehrs und über das besondere elektronische Behördenpostfach (BGBl. I, S.3803) eingereicht werden. Weitere Informationen erhalten Sie auf der Internetseite www.justiz.de. Der Widerspruch muss spätestens innerhalb der gesetzten Frist nach der schriftlichen Bekanntgabe der Verfügung bei dem Amtsgericht - Registergericht - Neuss eingegangen sein. Dies gilt auch dann, wenn der Widerspruch zur Niederschrift der Geschäftsstelle eines anderen Amtsgerichtes abgegeben wurde. Die Frist beginnt mit der schriftlichen Bekanntgabe der Verfügung. Die Bekanntgabe ist entweder durch Zustellung oder am dritten Tage nach Aufgabe zur Post bewirkt. Fällt das Ende der Frist auf einen Sonntag, einen allgemeinen Feiertag oder Sonnabend, so endet die Frist mit Ablauf des nächsten Werktages. Der Widerspruch muss die Bezeichnung der angefochtenen Verfügung sowie die Erklärung enthalten, dass Widerspruch gegen diese Verfügung eingelegt wird. Er ist zu unterzeichnen und soll begründet werden."
    },
    {
      "date": "2025-04-11",
      "id": "106397",
      "original_text": "Registerbekanntmachung nach dem Umwandlungsgesetz\nNordrhein-Westfalen Amtsgericht Köln HRB 119358\nParkletix GmbH – Köln",
      "type": "Registerbekanntmachung nach dem Umwandlungsgesetz",
      "state": "Nordrhein-Westfalen",
      "amtsgericht": "Amtsgericht Köln",
      "registernummer": "HRB 119358",
      "registerart": "HRB",
      "company_name": "Parkletix GmbH",
      "company_seat": "Köln",
      "details": "11.04.2025 (Bekanntmachungsdatum)\n\nNordrhein-Westfalen Amtsgericht Köln HRB 119358\nRegisterbekanntmachung nach dem Umwandlungsgesetz 11.04.2025 (Eintragungsdatum)\n\nParkletix GmbH\nGesellschaft mit beschränkter Haftung\nKöln\n\nDen Gläubigern der an der Ausgliederung beteiligten Rechtsträger ist, wenn sie binnen sechs Monaten nach dem Tag, an dem die Eintragung der Ausgliederung in das Register des Sitzes desjenigen Rechtsträgers, dessen Gläubiger sie sind, nach § 19 Absatz 3 UmwG als bekanntgemacht gilt, ihren Anspruch nach Grund und Höhe schriftlich anmelden, Sicherheit zu leisten, soweit sie nicht Befriedigung verlangen können. Dieses Recht steht den Gläubigern jedoch nur zu, wenn sie glaubhaft machen, dass durch die Ausgliederung die Erfüllung ihrer Forderung gefährdet wird."
    },
    {
      "date": "2025-04-11",
      "id": "106398",
      "original_text": "Löschungsankündigung\nNordrhein-Westfalen Amtsgericht Mönchengladbach HRB 18942\nKüster Küchen- und Möbelmontagen UG (haftungsbeschränkt) – Rommerskirchen",
      "type": "Löschungsankündigung",
      "state": "Nordrhein-Westfalen",
      "amtsgericht": "Amtsgericht Mönchengladbach",
      "registernummer": "HRB 18942",
      "registerart": "HRB",
      "company_name": "Küster Küchen- und Möbelmontagen UG (haftungsbeschränkt)",
      "company_seat": "Rommerskirchen",
      "details": "11.04.2025 (Bekanntmachungsdatum)\n\nNordrhein-Westfalen Amtsgericht Mönchengladbach HRB 18942\nLöschungsankündigung\n\nKüster Küchen- und Möbelmontagen UG (haftungsbeschränkt)\nGesellschaft mit beschränkter Haftung\nRommerskirchen\n\nDas Registergericht beabsichtigt die Gesellschaft von Amts wegen nach § 394 FamFG zu löschen. Die Frist zur Erhebung eines Widerspruchs ist auf drei Monate festgesetzt."
    },
    {
      "date": "2025-04-11",
      "id": "106399",
      "original_text": "Löschungsankündigung\nNordrhein-Westfalen Amtsgericht Mönchengladbach HRB 18942\nKüster Küchen- und Möbelmontagen UG (haftungsbeschränkt) – Rommerskirchen",
      "type": "Löschungsankündigung",
      "state": "Nordrhein-Westfalen",
      "amtsgericht": "Amtsgericht Mönchengladbach",
      "registernummer": "HRB 18942",
      "registerart": "HRB",
      "company_name": "Küster Küchen- und Möbelmontagen UG (haftungsbeschränkt)",
      "company_seat": "Rommerskirchen",
      "details": "11.04.2025 (Bekanntmachungsdatum)\n\nNordrhein-Westfalen Amtsgericht Mönchengladbach HRB 18942\nLöschungsankündigung\n\nKüster Küchen- und Möbelmontagen UG (haftungsbeschränkt)\nGesellschaft mit beschränkter Haftung\nRommerskirchen\n\nDas Registergericht beabsichtigt die Gesellschaft von Amts wegen nach § 394 FamFG zu löschen. Die Frist zur Erhebung eines Widerspruchs ist auf drei Monate festgesetzt."
    },
    {
      "date": "2025-04-11",
      "id": "106400",
      "original_text": "Löschungsankündigung\nNordrhein-Westfalen Amtsgericht Essen HRB 28259\nAvci European Import & Export GmbH – Essen",
      "type": "Löschungsankündigung",
      "state": "Nordrhein-Westfalen",
      "amtsgericht": "Amtsgericht Essen",
      "registernummer": "HRB 28259",
      "registerart": "HRB",
      "company_name": "Avci European Import & Export GmbH",
      "company_seat": "Essen",
      "details": "11.04.2025 (Bekanntmachungsdatum)\n\nNordrhein-Westfalen Amtsgericht Essen HRB 28259\nLöschungsankündigung\n\nAvci European Import & Export GmbH\nGesellschaft mit beschränkter Haftung\nEssen\n\nDas Registergericht beabsichtigt die Gesellschaft von Amts wegen nach § 394 FamFG zu löschen. Die Frist zur Erhebung eines Widerspruchs ist auf einen Monat festgesetzt."
    },
    {
      "date": "2025-04-11",
      "id": "106401",
      "original_text": "Einreichung neuer Dokumente\nNordrhein-Westfalen Amtsgericht Bonn HRB 12670\nEvangelische Axenfeld Gesellschaft gGmbH – Bonn",
      "type": "Einreichung neuer Dokumente",
      "state": "Nordrhein-Westfalen",
      "amtsgericht": "Amtsgericht Bonn",
      "registernummer": "HRB 12670",
      "registerart": "HRB",
      "company_name": "Evangelische Axenfeld Gesellschaft gGmbH",
      "company_seat": "Bonn",
      "details": "11.04.2025 (Bekanntmachungsdatum)\n\nNordrhein-Westfalen Amtsgericht Bonn HRB 12670\nEinreichung neuer Dokumente\n\nEvangelische Axenfeld Gesellschaft gGmbH\nGesellschaft mit beschränkter Haftung\nBonn\n\nDem Registergericht ist eine neue Liste der Mitglieder des Aufsichtsrates eingereicht worden."
    },
    {
      "date": "2025-04-11",
      "id": "106402",
      "original_text": "Löschungsankündigung\nNordrhein-Westfalen Amtsgericht Münster HRA 11808\nJurijs Trans e.K. – Münster",
      "type": "Löschungsankündigung",
      "state": "Nordrhein-Westfalen",
      "amtsgericht": "Amtsgericht Münster",
      "registernummer": "HRA 11808",
      "registerart": "HRA",
      "company_name": "Jurijs Trans e.K.",
      "company_seat": "Münster",
      "details": "11.04.2025 (Bekanntmachungsdatum)\n\nNordrhein-Westfalen Amtsgericht Münster HRA 11808\nLöschungsankündigung\n\nJurijs Trans e.K.\nEinzelkaufmann / Einzelkauffrau\nMünster\n\nDas Registergericht beabsichtigt die Firma von Amts wegen nach § 31 Abs. 2 HGB, § 393 FamFG zu löschen. Die Frist zur Erhebung eines Widerspruchs ist auf einen Monat festgesetzt."
    },
    {
      "date": "2025-04-11",
      "id": "106403",
      "original_text": "Registerbekanntmachung nach dem Umwandlungsgesetz\nNordrhein-Westfalen Amtsgericht Köln HRB 43264\nAutohaus Möltgen GmbH – Hürth",
      "type": "Registerbekanntmachung nach dem Umwandlungsgesetz",
      "state": "Nordrhein-Westfalen",
      "amtsgericht": "Amtsgericht Köln",
      "registernummer": "HRB 43264",
      "registerart": "HRB",
      "company_name": "Autohaus Möltgen GmbH",
      "company_seat": "Hürth",
      "details": "11.04.2025 (Bekanntmachungsdatum)\n\nNordrhein-Westfalen Amtsgericht Köln HRB 43264\nRegisterbekanntmachung nach dem Umwandlungsgesetz 11.04.2025 (Eintragungsdatum)\n\nAutohaus Möltgen GmbH\nGesellschaft mit beschränkter Haftung\nHürth\n\nDen Gläubigern der an der Verschmelzung beteiligten Rechtsträger ist, wenn sie binnen sechs Monaten nach dem Tag, an dem die Eintragung der Verschmelzung in das Register des Sitzes desjenigen Rechtsträgers, dessen Gläubiger sie sind, nach § 19 Absatz 3 UmwG als bekanntgemacht gilt, ihren Anspruch nach Grund und Höhe schriftlich anmelden, Sicherheit zu leisten, soweit sie nicht Befriedigung verlangen können. Dieses Recht steht den Gläubigern jedoch nur zu, wenn sie glaubhaft machen, dass durch die Verschmelzung die Erfüllung ihrer Forderung gefährdet wird."
    },
    {
      "date": "2025-04-11",
      "id": "106404",
      "original_text": "Einreichung neuer Dokumente\nNordrhein-Westfalen Amtsgericht Wuppertal HRB 2367\nWSW Energie & Wasser AG – Wuppertal",
      "type": "Einreichung neuer Dokumente",
      "state": "Nordrhein-Westfalen",
      "amtsgericht": "Amtsgericht Wuppertal",
      "registernummer": "HRB 2367",
      "registerart": "HRB",
      "company_name": "WSW Energie & Wasser AG",
      "company_seat": "Wuppertal",
      "details": "11.04.2025 (Bekanntmachungsdatum)\n\nNordrhein-Westfalen Amtsgericht Wuppertal HRB 2367\nEinreichung neuer Dokumente 11.04.2025 (Eintragungsdatum)\n\nWSW Energie & Wasser AG\nAktiengesellschaft\nWuppertal\n\nDem Registergericht ist eine neue Liste der Mitglieder des Aufsichtsrates eingereicht worden."
    },
    {
      "date": "2025-04-11",
      "id": "106405",
      "original_text": "Einreichung neuer Dokumente\nHessen Amtsgericht Kassel HRB 20101\nVOLKSWAGEN GROUP Original Teile Logistik, Vertrieb & Services GmbH – Baunatal",
      "type": "Einreichung neuer Dokumente",
      "state": "Hessen",
      "amtsgericht": "Amtsgericht Kassel",
      "registernummer": "HRB 20101",
      "registerart": "HRB",
      "company_name": "VOLKSWAGEN GROUP Original Teile Logistik, Vertrieb & Services GmbH",
      "company_seat": "Baunatal",
      "details": "11.04.2025 (Bekanntmachungsdatum)\n\nHessen Amtsgericht Kassel HRB 20101\nEinreichung neuer Dokumente 11.04.2025 (Eintragungsdatum)\n\nVOLKSWAGEN GROUP Original Teile Logistik, Vertrieb & Services GmbH\nGesellschaft mit beschränkter Haftung\nBaunatal\n\nDurch eine Änderung in den Personen der Aufsichtsratsmitglieder ist eine Liste der Mitglieder des Aufsichtsrates zum Handelsregister eingereicht worden."
    },
    {
      "date": "2025-04-11",
      "id": "106406",
      "original_text": "Löschungsankündigung\nHessen Amtsgericht Frankfurt am Main HRB 112574\nEl Mercado GmbH – Frankfurt am Main",
      "type": "Löschungsankündigung",
      "state": "Hessen",
      "amtsgericht": "Amtsgericht Frankfurt am Main",
      "registernummer": "HRB 112574",
      "registerart": "HRB",
      "company_name": "El Mercado GmbH",
      "company_seat": "Frankfurt am Main",
      "details": "11.04.2025 (Bekanntmachungsdatum)\n\nHessen Amtsgericht Frankfurt am Main HRB 112574\nLöschungsankündigung\n\nEl Mercado GmbH\nGesellschaft mit beschränkter Haftung\nFrankfurt am Main\n\nDas Registergericht beabsichtigt die im Handelsregister eingetragene Gesellschaft von Amts wegen nach § 394 FamFG zu löschen. Die Frist zur Erhebung eines Widerspruchs gegen die beabsichtigte Löschung wird auf 1 Monat nahc dieser Veröffentlichung festgesetzt."
    },
    {
      "date": "2025-04-11",
      "id": "106407",
      "original_text": "Registerbekanntmachung nach dem Umwandlungsgesetz\nHessen Amtsgericht Gießen HRB 1987\nINGWIS Datentechnik GmbH – Lich",
      "type": "Registerbekanntmachung nach dem Umwandlungsgesetz",
      "state": "Hessen",
      "amtsgericht": "Amtsgericht Gießen",
      "registernummer": "HRB 1987",
      "registerart": "HRB",
      "company_name": "INGWIS Datentechnik GmbH",
      "company_seat": "Lich",
      "details": "11.04.2025 (Bekanntmachungsdatum)\n\nHessen Amtsgericht Gießen HRB 1987\nRegisterbekanntmachung nach dem Umwandlungsgesetz 11.04.2025 (Eintragungsdatum)\n\nINGWIS Datentechnik GmbH\nGesellschaft mit beschränkter Haftung\nLich\n\nDen Gläubigern der an der Verschmelzung beteiligten Rechtsträger ist, wenn sie binnen sechs Monaten nach dem Tag, an dem die Eintragung der Verschmelzung in das Register des Sitzes desjenigen Rechtsträgers, dessen Gläubiger sie sind, nach § 19 Absatz 3 UmwG bekannt gemacht worden ist, ihren Anspruch nach Grund und Höhe schriftlich anmelden, Sicherheit zu leisten, soweit sie nicht Befriedigung verlangen können. Dieses Recht steht den Gläubigern jedoch nur zu, wenn sie glaubhaft machen, dass durch die Verschmelzung die Erfüllung ihrer Forderung gefährdet wird."
    },
    {
      "date": "2025-04-11",
      "id": "106408",
      "original_text": "Löschungsankündigung\nHessen Amtsgericht Wiesbaden HRB 22026\nKloster Johannisberg Betriebsgesellschaft mbH – Geisenheim",
      "type": "Löschungsankündigung",
      "state": "Hessen",
      "amtsgericht": "Amtsgericht Wiesbaden",
      "registernummer": "HRB 22026",
      "registerart": "HRB",
      "company_name": "Kloster Johannisberg Betriebsgesellschaft mbH",
      "company_seat": "Geisenheim",
      "details": "11.04.2025 (Bekanntmachungsdatum)\n\nHessen Amtsgericht Wiesbaden HRB 22026\nLöschungsankündigung\n\nKloster Johannisberg Betriebsgesellschaft mbH\nGesellschaft mit beschränkter Haftung\nGeisenheim\n\nDas Registergericht beabsichtigt die im Handelsregister eingetragene Gesellschaft von Amts wegen nach § 394 FamFG zu löschen. Die Frist zur Erhebung eines Widerspruchs gegen die beabsichtigte Löschung wird auf 3 Monate festgesetzt."
    },
    {
      "date": "2025-04-11",
      "id": "106409",
      "original_text": "Löschungsankündigung\nHessen Amtsgericht Wiesbaden HRB 28367\necostein GmbH – Wiesbaden",
      "type": "Löschungsankündigung",
      "state": "Hessen",
      "amtsgericht": "Amtsgericht Wiesbaden",
      "registernummer": "HRB 28367",
      "registerart": "HRB",
      "company_name": "ecostein GmbH",
      "company_seat": "Wiesbaden",
      "details": "11.04.2025 (Bekanntmachungsdatum)\n\nHessen Amtsgericht Wiesbaden HRB 28367\nLöschungsankündigung\n\necostein GmbH\nGesellschaft mit beschränkter Haftung\nWiesbaden\n\nDas Registergericht beabsichtigt die im Handelsregister eingetragene Gesellschaft von Amts wegen nach § 394 FamFG zu löschen. Die Frist zur Erhebung eines Widerspruchs gegen die beabsichtigte Löschung wird auf 3 Monate festgesetzt."
    },
    {
      "date": "2025-04-11",
      "id": "106410",
      "original_text": "Registerbekanntmachung nach dem Umwandlungsgesetz\nHessen Amtsgericht Gießen GsR 181\nHeike u. Andreas Unger eGbR – Lich",
      "type": "Registerbekanntmachung nach dem Umwandlungsgesetz",
      "state": "Hessen",
      "amtsgericht": "Amtsgericht Gießen",
      "registernummer": "GsR 181",
      "registerart": "GsR",
      "company_name": "Heike u. Andreas Unger eGbR",
      "company_seat": "Lich",
      "details": "11.04.2025 (Bekanntmachungsdatum)\n\nHessen Amtsgericht Gießen GsR 181\nRegisterbekanntmachung nach dem Umwandlungsgesetz 11.04.2025 (Eintragungsdatum)\n\nHeike u. Andreas Unger eGbR\nGesellschaft bürgerlichen Rechts\nLich\n\nDen Gläubigern der an der Verschmelzung beteiligten Rechtsträger ist, wenn sie binnen sechs Monaten nach dem Tag, an dem die Eintragung der Verschmelzung in das Register des Sitzes desjenigen Rechtsträgers, dessen Gläubiger sie sind, nach § 19 Absatz 3 UmwG bekannt gemacht worden ist, ihren Anspruch nach Grund und Höhe schriftlich anmelden, Sicherheit zu leisten, soweit sie nicht Befriedigung verlangen können. Dieses Recht steht den Gläubigern jedoch nur zu, wenn sie glaubhaft machen, dass durch die Verschmelzung die Erfüllung ihrer Forderung gefährdet wird."
    }
  ]
}