{
  "date": "2025-04-16",
  "date_of_scrape": "2025-05-30T15:32:27.506Z",
  "tool_version": "0.2.0",
  "number_of_announcements": 102,
  "announcements": [
    {
      "date": "2025-04-16",
      "id": "106708",
      "original_text": "Löschungsankündigung\nBerlin Amtsgericht Berlin (Charlottenburg) HRB 119547\nRW Internet UG (haftungsbeschränkt) – Berlin",
      "type": "Löschungsankündigung",
      "state": "Berlin",
      "amtsgericht": "Amtsgericht Berlin (Charlottenburg)",
      "registernummer": "HRB 119547",
      "registerart": "HRB",
      "company_name": "RW Internet UG (haftungsbeschränkt)",
      "company_seat": "Berlin",
      "details": "16.04.2025 (Bekanntmachungsdatum)\n\nBerlin Amtsgericht Berlin (Charlottenburg) HRB 119547\nLöschungsankündigung\n\nRW Internet UG (haftungsbeschränkt)\nGesellschaft mit beschränkter Haftung\nBerlin\n\nBei der nachstehenden Gesellschaft wird das Amtslöschungsverfahren gemäß § 394 FamFG eingeleitet. Widerspruchsfrist 6 Wochen"
    },
    {
      "date": "2025-04-16",
      "id": "106709",
      "original_text": "Sonstige Registerbekanntmachung\nHamburg Amtsgericht Hamburg HRB 74560\nPhilips GmbH – Hamburg",
      "type": "Sonstige Registerbekanntmachung",
      "state": "Hamburg",
      "amtsgericht": "Amtsgericht Hamburg",
      "registernummer": "HRB 74560",
      "registerart": "HRB",
      "company_name": "Philips GmbH",
      "company_seat": "Hamburg",
      "details": "16.04.2025 (Bekanntmachungsdatum)\n\nHamburg Amtsgericht Hamburg HRB 74560\nSonstige Registerbekanntmachung\n\nPhilips GmbH\nGesellschaft mit beschränkter Haftung\nHamburg\n\nAls nicht eingetragen wird bekannt gemacht: Liste des Aufsichtsrats wurde eingereicht."
    },
    {
      "date": "2025-04-16",
      "id": "106710",
      "original_text": "Einreichung neuer Dokumente\nBaden-Württemberg Amtsgericht Stuttgart HRB 772644\nHepaRegeniX GmbH – Tübingen",
      "type": "Einreichung neuer Dokumente",
      "state": "Baden-Württemberg",
      "amtsgericht": "Amtsgericht Stuttgart",
      "registernummer": "HRB 772644",
      "registerart": "HRB",
      "company_name": "HepaRegeniX GmbH",
      "company_seat": "Tübingen",
      "details": "16.04.2025 (Bekanntmachungsdatum)\n\nBaden-Württemberg Amtsgericht Stuttgart HRB 772644\nEinreichung neuer Dokumente\n\nHepaRegeniX GmbH\nGesellschaft mit beschränkter Haftung\nTübingen\n\nDie Gesellschaft hat am 04.04.2025 die Liste über die Zusammensetzung des Aufsichtsrats zum Handelsregister eingereicht."
    },
    {
      "date": "2025-04-16",
      "id": "106711",
      "original_text": "Löschungsankündigung\nSaarland Amtsgericht Saarbrücken HRB 107092\nNetcrowd UG (haftungsbeschränkt) – Saarbrücken",
      "type": "Löschungsankündigung",
      "state": "Saarland",
      "amtsgericht": "Amtsgericht Saarbrücken",
      "registernummer": "HRB 107092",
      "registerart": "HRB",
      "company_name": "Netcrowd UG (haftungsbeschränkt)",
      "company_seat": "Saarbrücken",
      "details": "16.04.2025 (Bekanntmachungsdatum)\n\nSaarland Amtsgericht Saarbrücken HRB 107092\nLöschungsankündigung\n\nNetcrowd UG (haftungsbeschränkt)\nGesellschaft mit beschränkter Haftung\nSaarbrücken\n\nEs ist beabsichtigt, die Gesellschaft von Amts wegen gemäß § 394 FamFG wegen Vermögenslosigkeit zu löschen. Gegen die Löschung von Amts wegen ist das Rechtsmittel des Widerspruchs statthaft. Der Widerspruch ist binnen einer Frist von 1 Monat beginnend mit dem Tag dieser Veröffentlichung durch Einreichen eines Widerspruchsschreibens -schriftlich oder zur Niederschrift der Geschäftsstelle- beim Amtsgericht Saarbrücken, -zentrales Handelsregister-, Mainzerstr.178, 66121 Saarbrücken einzulegen. Der Widerspruch muss die Bezeichnung der angefochtenen Löschungsankündigung enthalten sowie die Erklärung, dass Widerspruch eingelegt wird. Er ist vom Widerspruchsführer oder seinem Bevollmächtigten zu unterzeichnen."
    },
    {
      "date": "2025-04-16",
      "id": "106712",
      "original_text": "Registerbekanntmachung nach dem Umwandlungsgesetz\nBerlin Amtsgericht Berlin (Charlottenburg) HRB 267826\nTS Elements GmbH – Berlin",
      "type": "Registerbekanntmachung nach dem Umwandlungsgesetz",
      "state": "Berlin",
      "amtsgericht": "Amtsgericht Berlin (Charlottenburg)",
      "registernummer": "HRB 267826",
      "registerart": "HRB",
      "company_name": "TS Elements GmbH",
      "company_seat": "Berlin",
      "details": "16.04.2025 (Bekanntmachungsdatum)\n\nBerlin Amtsgericht Berlin (Charlottenburg) HRB 267826\nRegisterbekanntmachung nach dem Umwandlungsgesetz 15.04.2025 (Eintragungsdatum)\n\nTS Elements GmbH\nGesellschaft mit beschränkter Haftung\nBerlin\n\nZu Eintragungsnummer 3 vom 15.04.2025 wird als nicht eingetragen veröffentlicht: Den Gläubigern der an der Spaltung beteiligten Rechtsträger ist, wenn sie binnen sechs Monaten nach dem Tag, an dem die Eintragung der Spaltung in das Register des Sitzes desjenigen Rechtsträgers, dessen Gläubiger sie sind, als bekannt gemacht gilt, ihren Anspruch nach Grund und Höhe schriftlich anmelden, Sicherheit zu leisten, soweit sie nicht Befriedigung verlangen können. Dieses Recht steht den Gläubigern jedoch nur zu, wenn sie glaubhaft machen, dass durch die Spaltung die Erfüllung ihrer Forderung gefährdet wird. Das Recht, Sicherheitsleistung zu verlangen, steht Gläubigern nicht zu, die im Falle der Insolvenz ein Recht auf vorzugsweise Befriedigung aus einer Deckungsmasse haben, die nach gesetzlicher Vorschrift zu ihrem Schutz errichtet und staatlich überwacht ist."
    },
    {
      "date": "2025-04-16",
      "id": "106713",
      "original_text": "Registerbekanntmachung nach dem Umwandlungsgesetz\nBaden-Württemberg Amtsgericht Stuttgart HRB 778311\nW + P Gesellschaft für Projektrealisierung mbH – Stuttgart",
      "type": "Registerbekanntmachung nach dem Umwandlungsgesetz",
      "state": "Baden-Württemberg",
      "amtsgericht": "Amtsgericht Stuttgart",
      "registernummer": "HRB 778311",
      "registerart": "HRB",
      "company_name": "W + P Gesellschaft für Projektrealisierung mbH",
      "company_seat": "Stuttgart",
      "details": "16.04.2025 (Bekanntmachungsdatum)\n\nBaden-Württemberg Amtsgericht Stuttgart HRB 778311\nRegisterbekanntmachung nach dem Umwandlungsgesetz 16.04.2025 (Eintragungsdatum)\n\nW + P Gesellschaft für Projektrealisierung mbH\nGesellschaft mit beschränkter Haftung\nStuttgart\n\nAls nicht eingetragen wird bekanntgemacht:\nDen Gläubigern der an der Verschmelzung beteiligten Rechtsträger ist, wenn sie binnen sechs Monaten nach dem Tag, an dem die Eintragung der Verschmelzung in das Register des Sitzes desjenigen Rechtsträgers, dessen Gläubiger sie sind, nach § 19 Abs. 3 UmwG als bekanntgemacht gilt, ihren Anspruch nach Grund und Höhe schriftlich anmelden, Sicherheit zu leisten, soweit sie nicht Befriedigung verlangen können. Dieses Recht steht den Gläubigern jedoch nur zu, wenn sie glaubhaft machen, dass durch die Verschmelzung die Erfüllung ihrer Forderung gefährdet wird."
    },
    {
      "date": "2025-04-16",
      "id": "106714",
      "original_text": "Registerbekanntmachung nach dem Umwandlungsgesetz\nMecklenburg-Vorpommern Amtsgericht Rostock HRB 3622\nBackhus GmbH – Güstrow",
      "type": "Registerbekanntmachung nach dem Umwandlungsgesetz",
      "state": "Mecklenburg-Vorpommern",
      "amtsgericht": "Amtsgericht Rostock",
      "registernummer": "HRB 3622",
      "registerart": "HRB",
      "company_name": "Backhus GmbH",
      "company_seat": "Güstrow",
      "details": "16.04.2025 (Bekanntmachungsdatum)\n\nMecklenburg-Vorpommern Amtsgericht Rostock HRB 3622\nRegisterbekanntmachung nach dem Umwandlungsgesetz 16.04.2025 (Eintragungsdatum)\n\nBackhus GmbH\nGesellschaft mit beschränkter Haftung\nGüstrow\n\nDen Gläubigern der am Formwechsel beteiligten Rechtsträger ist, wenn sie binnen sechs Monaten nach dem Tag, an dem die Eintragung des Formwechsels als bekannt gemacht gilt, ihren Anspruch nach Grund und Höhe in Textform anmelden, Sicherheit zu leisten, soweit sie nicht Befriedigung verlangen können. Dieses Recht steht den Gläubigern jedoch nur zu, wenn sie glaubhaft machen, dass durch den Formwechsel die Erfüllung der Forderung gefährdet wird."
    },
    {
      "date": "2025-04-16",
      "id": "106715",
      "original_text": "Sonstige Registerbekanntmachung\nHamburg Amtsgericht Hamburg HRB 12516\nADVOCARD Rechtsschutzversicherung AG – Hamburg",
      "type": "Sonstige Registerbekanntmachung",
      "state": "Hamburg",
      "amtsgericht": "Amtsgericht Hamburg",
      "registernummer": "HRB 12516",
      "registerart": "HRB",
      "company_name": "ADVOCARD Rechtsschutzversicherung AG",
      "company_seat": "Hamburg",
      "details": "16.04.2025 (Bekanntmachungsdatum)\n\nHamburg Amtsgericht Hamburg HRB 12516\nSonstige Registerbekanntmachung\n\nADVOCARD Rechtsschutzversicherung AG\nAktiengesellschaft\nHamburg\n\nAls nicht eingetragen wird bekannt gemacht: Liste des Aufsichtsrats wurde eingereicht."
    },
    {
      "date": "2025-04-16",
      "id": "106716",
      "original_text": "Löschungsankündigung\nBrandenburg Amtsgericht Frankfurt/Oder HRB 3438\nKube Abfuhr- und Containerdienst GmbH – Lebus",
      "type": "Löschungsankündigung",
      "state": "Brandenburg",
      "amtsgericht": "Amtsgericht Frankfurt/Oder",
      "registernummer": "HRB 3438",
      "registerart": "HRB",
      "company_name": "Kube Abfuhr- und Containerdienst GmbH",
      "company_seat": "Lebus",
      "details": "16.04.2025 (Bekanntmachungsdatum)\n\nBrandenburg Amtsgericht Frankfurt/Oder HRB 3438\nLöschungsankündigung\n\nKube Abfuhr- und Containerdienst GmbH\nGesellschaft mit beschränkter Haftung\nLebus\n\nBei der nachstehenden Gesellschaft wird das Amtslöschungsverfahren gemäß § 394 FamFG eingeleitet."
    },
    {
      "date": "2025-04-16",
      "id": "106717",
      "original_text": "Löschungsankündigung\nMecklenburg-Vorpommern Amtsgericht Neubrandenburg HRB 8046\nTEWSWOOS PV GmbH – Waren (Müritz)",
      "type": "Löschungsankündigung",
      "state": "Mecklenburg-Vorpommern",
      "amtsgericht": "Amtsgericht Neubrandenburg",
      "registernummer": "HRB 8046",
      "registerart": "HRB",
      "company_name": "TEWSWOOS PV GmbH",
      "company_seat": "Waren (Müritz)",
      "details": "16.04.2025 (Bekanntmachungsdatum)\n\nMecklenburg-Vorpommern Amtsgericht Neubrandenburg HRB 8046\nLöschungsankündigung 16.04.2025 (Eintragungsdatum)\n\nTEWSWOOS PV GmbH\nGesellschaft mit beschränkter Haftung\nWaren (Müritz)\n\nDas Registergericht beabsichtigt, die im Handelsregister eingetragene Gesellschaft von Amts wegen nach § 394 FamFG zu löschen. Die Frist zur Erhebung eines Widerspruchs gegen die beabsichtigte Löschung wird auf drei Monate festgesetzt."
    },
    {
      "date": "2025-04-16",
      "id": "106718",
      "original_text": "Registerbekanntmachung nach dem Umwandlungsgesetz\nBerlin Amtsgericht Berlin (Charlottenburg) HRB 272166\naptus 2438. GmbH – Berlin",
      "type": "Registerbekanntmachung nach dem Umwandlungsgesetz",
      "state": "Berlin",
      "amtsgericht": "Amtsgericht Berlin (Charlottenburg)",
      "registernummer": "HRB 272166",
      "registerart": "HRB",
      "company_name": "aptus 2438. GmbH",
      "company_seat": "Berlin",
      "details": "16.04.2025 (Bekanntmachungsdatum)\n\nBerlin Amtsgericht Berlin (Charlottenburg) HRB 272166\nRegisterbekanntmachung nach dem Umwandlungsgesetz 15.04.2025 (Eintragungsdatum)\n\naptus 2438. GmbH\nGesellschaft mit beschränkter Haftung\nBerlin\n\nZu Eintragungsnummer 4 vom 15.04.2025 wird als nicht eingetragen veröffentlicht: Den Gläubigern der an der Spaltung beteiligten Rechtsträger ist, wenn sie binnen sechs Monaten nach dem Tag, an dem die Eintragung der Spaltung in das Register des Sitzes desjenigen Rechtsträgers, dessen Gläubiger sie sind, als bekannt gemacht gilt, ihren Anspruch nach Grund und Höhe schriftlich anmelden, Sicherheit zu leisten, soweit sie nicht Befriedigung verlangen können. Dieses Recht steht den Gläubigern jedoch nur zu, wenn sie glaubhaft machen, dass durch die Spaltung die Erfüllung ihrer Forderung gefährdet wird. Das Recht, Sicherheitsleistung zu verlangen, steht Gläubigern nicht zu, die im Falle der Insolvenz ein Recht auf vorzugsweise Befriedigung aus einer Deckungsmasse haben, die nach gesetzlicher Vorschrift zu ihrem Schutz errichtet und staatlich überwacht ist."
    },
    {
      "date": "2025-04-16",
      "id": "106719",
      "original_text": "Löschungsankündigung\nBaden-Württemberg Amtsgericht Mannheim HRB 715084\nGrand Casino GmbH – Bad Schönborn",
      "type": "Löschungsankündigung",
      "state": "Baden-Württemberg",
      "amtsgericht": "Amtsgericht Mannheim",
      "registernummer": "HRB 715084",
      "registerart": "HRB",
      "company_name": "Grand Casino GmbH",
      "company_seat": "Bad Schönborn",
      "details": "16.04.2025 (Bekanntmachungsdatum)\n\nBaden-Württemberg Amtsgericht Mannheim HRB 715084\nLöschungsankündigung\n\nGrand Casino GmbH\nGesellschaft mit beschränkter Haftung\nBad Schönborn\n\nDas Gericht beabsichtigt, die Gesellschaft wegen Vermögenslosigkeit im Handelsregister von Amts wegen nach § 394 FamFG zu löschen. Die Frist zur Geltendmachung eines Widerspruchs gegen die beabsichtigte Löschung ist auf einen Monat ab Veröffentlichung bestimmt."
    },
    {
      "date": "2025-04-16",
      "id": "106720",
      "original_text": "Löschungsankündigung\nBrandenburg Amtsgericht Cottbus HRB 14121\nJiaxin Handels GmbH – Senftenberg",
      "type": "Löschungsankündigung",
      "state": "Brandenburg",
      "amtsgericht": "Amtsgericht Cottbus",
      "registernummer": "HRB 14121",
      "registerart": "HRB",
      "company_name": "Jiaxin Handels GmbH",
      "company_seat": "Senftenberg",
      "details": "16.04.2025 (Bekanntmachungsdatum)\n\nBrandenburg Amtsgericht Cottbus HRB 14121\nLöschungsankündigung\n\nJiaxin Handels GmbH\nGesellschaft mit beschränkter Haftung\nSenftenberg\n\nBei der nachstehenden Gesellschaft wird das Amtslöschungsverfahren gemäß § 394 FamFG eingeleitet."
    },
    {
      "date": "2025-04-16",
      "id": "106721",
      "original_text": "Registerbekanntmachung nach dem Umwandlungsgesetz\nBerlin Amtsgericht Berlin (Charlottenburg) HRA 31375\nJOTGE Fundus GmbH & Co Alte Schönhauser Straße 35 KG – Berlin",
      "type": "Registerbekanntmachung nach dem Umwandlungsgesetz",
      "state": "Berlin",
      "amtsgericht": "Amtsgericht Berlin (Charlottenburg)",
      "registernummer": "HRA 31375",
      "registerart": "HRA",
      "company_name": "JOTGE Fundus GmbH & Co Alte Schönhauser Straße 35 KG",
      "company_seat": "Berlin",
      "details": "16.04.2025 (Bekanntmachungsdatum)\n\nBerlin Amtsgericht Berlin (Charlottenburg) HRA 31375\nRegisterbekanntmachung nach dem Umwandlungsgesetz 15.04.2025 (Eintragungsdatum)\n\nJOTGE Fundus GmbH & Co Alte Schönhauser Straße 35 KG\nKommanditgesellschaft\nBerlin\n\nZu Eintragungsnummer 6 vom 15.04.2025 wird als nicht eingetragen veröffentlicht: Den Gläubigern ist, wenn sie binnen sechs Monaten nach dem Tag, an dem die Eintragung der Umwandlung als bekannt gemacht gilt, ihren Anspruch nach Grund und Höhe schriftlich anmelden, Sicherheit zu leisten, soweit sie nicht Befriedigung verlangen können. Dieses Recht steht den Gläubigern jedoch nur zu, wenn sie glaubhaft machen, dass durch die Umwandlung die Erfüllung ihrer Forderung gefährdet wird. Das Recht, Sicherheitsleistung zu verlangen, steht Gläubigern nicht zu, die im Falle der Insolvenz ein Recht auf vorzugsweise Befriedigung aus einer Deckungsmasse haben, die nach gesetzlicher Vorschrift zu ihrem Schutz errichtet und staatlich überwacht ist."
    },
    {
      "date": "2025-04-16",
      "id": "106722",
      "original_text": "Registerbekanntmachung nach dem Umwandlungsgesetz\nBerlin Amtsgericht Berlin (Charlottenburg) HRB 274311\nJOTGE Fundus AS GmbH – Berlin",
      "type": "Registerbekanntmachung nach dem Umwandlungsgesetz",
      "state": "Berlin",
      "amtsgericht": "Amtsgericht Berlin (Charlottenburg)",
      "registernummer": "HRB 274311",
      "registerart": "HRB",
      "company_name": "JOTGE Fundus AS GmbH",
      "company_seat": "Berlin",
      "details": "16.04.2025 (Bekanntmachungsdatum)\n\nBerlin Amtsgericht Berlin (Charlottenburg) HRB 274311\nRegisterbekanntmachung nach dem Umwandlungsgesetz 15.04.2025 (Eintragungsdatum)\n\nJOTGE Fundus AS GmbH\nGesellschaft mit beschränkter Haftung\nBerlin\n\nZu Eintragungsnummer 1 vom 15.04.2025 wird als nicht eingetragen veröffentlicht: Den Gläubigern ist, wenn sie binnen sechs Monaten nach dem Tag, an dem die Eintragung der Umwandlung als bekannt gemacht gilt, ihren Anspruch nach Grund und Höhe schriftlich anmelden, Sicherheit zu leisten, soweit sie nicht Befriedigung verlangen können. Dieses Recht steht den Gläubigern jedoch nur zu, wenn sie glaubhaft machen, dass durch die Umwandlung die Erfüllung ihrer Forderung gefährdet wird. Das Recht, Sicherheitsleistung zu verlangen, steht Gläubigern nicht zu, die im Falle der Insolvenz ein Recht auf vorzugsweise Befriedigung aus einer Deckungsmasse haben, die nach gesetzlicher Vorschrift zu ihrem Schutz errichtet und staatlich überwacht ist."
    },
    {
      "date": "2025-04-16",
      "id": "106723",
      "original_text": "Registerbekanntmachung nach dem Umwandlungsgesetz\nBaden-Württemberg Amtsgericht Freiburg HRB 730909\nRedwood UG (haftungsbeschränkt) – Oberkirch",
      "type": "Registerbekanntmachung nach dem Umwandlungsgesetz",
      "state": "Baden-Württemberg",
      "amtsgericht": "Amtsgericht Freiburg",
      "registernummer": "HRB 730909",
      "registerart": "HRB",
      "company_name": "Redwood UG (haftungsbeschränkt)",
      "company_seat": "Oberkirch",
      "details": "16.04.2025 (Bekanntmachungsdatum)\n\nBaden-Württemberg Amtsgericht Freiburg HRB 730909\nRegisterbekanntmachung nach dem Umwandlungsgesetz 16.04.2025 (Eintragungsdatum)\n\nRedwood UG (haftungsbeschränkt)\nGesellschaft mit beschränkter Haftung\nOberkirch\n\nAls nicht eingetragen wird bekanntgemacht:\nDen Gläubigern der an der Verschmelzung beteiligten Rechtsträger ist, wenn sie binnen sechs Monaten nach dem Tag, an dem die Eintragung der Verschmelzung in das Register des Sitzes desjenigen Rechtsträgers, dessen Gläubiger sie sind, nach § 19 Abs. 3 UmwG als bekanntgemacht gilt, ihren Anspruch nach Grund und Höhe schriftlich anmelden, Sicherheit zu leisten, soweit sie nicht Befriedigung verlangen können. Dieses Recht steht den Gläubigern jedoch nur zu, wenn sie glaubhaft machen, dass durch die Verschmelzung die Erfüllung ihrer Forderung gefährdet wird."
    },
    {
      "date": "2025-04-16",
      "id": "106724",
      "original_text": "Löschungsankündigung\nBrandenburg Amtsgericht Frankfurt/Oder VR 3049\nVerein für Brandenburgische Eisenbahngeschichte Storkow 98 eingetragener Verein – Storkow (Mark)",
      "type": "Löschungsankündigung",
      "state": "Brandenburg",
      "amtsgericht": "Amtsgericht Frankfurt/Oder",
      "registernummer": "VR 3049",
      "registerart": "VR",
      "company_name": "Verein für Brandenburgische Eisenbahngeschichte Storkow 98 eingetragener Verein",
      "company_seat": "Storkow (Mark)",
      "details": "16.04.2025 (Bekanntmachungsdatum)\n\nBrandenburg Amtsgericht Frankfurt/Oder VR 3049\nLöschungsankündigung\n\nVerein für Brandenburgische Eisenbahngeschichte Storkow 98 eingetragener Verein\neingetragener Verein\nStorkow (Mark)\n\nBei der nachstehenden Gesellschaft/dem nachstehenden Verein wird das Amtslöschungsverfahren gemäß § 395 FamFG eingeleitet."
    },
    {
      "date": "2025-04-16",
      "id": "106725",
      "original_text": "Registerbekanntmachung nach dem Umwandlungsgesetz\nBrandenburg Amtsgericht Frankfurt/Oder HRB 12658\nBaustoff und Baufertigteilhandels GmbH – Werneuchen",
      "type": "Registerbekanntmachung nach dem Umwandlungsgesetz",
      "state": "Brandenburg",
      "amtsgericht": "Amtsgericht Frankfurt/Oder",
      "registernummer": "HRB 12658",
      "registerart": "HRB",
      "company_name": "Baustoff und Baufertigteilhandels GmbH",
      "company_seat": "Werneuchen",
      "details": "16.04.2025 (Bekanntmachungsdatum)\n\nBrandenburg Amtsgericht Frankfurt/Oder HRB 12658\nRegisterbekanntmachung nach dem Umwandlungsgesetz 04.04.2025 (Eintragungsdatum)\n\nBaustoff und Baufertigteilhandels GmbH\nGesellschaft mit beschränkter Haftung\nWerneuchen\n\nZu Eintragungsnummer 6 vom 04.04.2025 wird als nicht eingetragen veröffentlicht: Als nicht eingetragen wird veröffentlicht:\nDen Gläubigern der an der Verschmelzung beteiligten Rechtsträger ist, wenn sie binnen sechs Monaten nach dem Tag, an dem die Eintragung der Verschmelzung in das Register des Sitzes desjenigen Rechtsträgers, dessen Gläubiger sie sind, als bekannt gemacht gilt, ihren Anspruch nach Grund und Höhe schriftlich anmelden, Sicherheit zu leisten, soweit sie nicht Befriedigung verlangen können. Dieses Recht steht den Gläubigern jedoch nur zu, wenn sie glaubhaft machen, dass durch die Verschmelzung die Erfüllung ihrer Forderung gefährdet wird"
    },
    {
      "date": "2025-04-16",
      "id": "106726",
      "original_text": "Registerbekanntmachung nach dem Umwandlungsgesetz\nBaden-Württemberg Amtsgericht Stuttgart HRA 742138\nJürgen Hönnige, Waldschenke Hörnle e.K. – Brackenheim",
      "type": "Registerbekanntmachung nach dem Umwandlungsgesetz",
      "state": "Baden-Württemberg",
      "amtsgericht": "Amtsgericht Stuttgart",
      "registernummer": "HRA 742138",
      "registerart": "HRA",
      "company_name": "Jürgen Hönnige, Waldschenke Hörnle e.K.",
      "company_seat": "Brackenheim",
      "details": "16.04.2025 (Bekanntmachungsdatum)\n\nBaden-Württemberg Amtsgericht Stuttgart HRA 742138\nRegisterbekanntmachung nach dem Umwandlungsgesetz 16.04.2025 (Eintragungsdatum)\n\nJürgen Hönnige, Waldschenke Hörnle e.K.\nEinzelkaufmann / Einzelkauffrau\nBrackenheim\n\nDen Gläubigern der an der Ausgliederung beteiligten Rechtsträger ist, wenn sie binnen sechs Monaten nach dem Tag, an dem die Eintragung der Ausgliederung in das Register des Sitzes desjenigen Rechtsträgers, dessen Gläubiger sie sind, nach § 19 Abs. 3 UmwG als bekanntgemacht gilt, ihren Anspruch nach Grund und Höhe schriftlich anmelden, Sicherheit zu leisten, soweit sie nicht Befriedigung verlangen können. Dieses Recht steht den Gläubigern jedoch nur zu, wenn sie glaubhaft machen, dass durch die Ausgliederung die Erfüllung ihrer Forderung gefährdet wird."
    },
    {
      "date": "2025-04-16",
      "id": "106727",
      "original_text": "Registerbekanntmachung nach dem Umwandlungsgesetz\nBaden-Württemberg Amtsgericht Stuttgart HRA 742186\nWaldschenke Hörnle GmbH & Co. KG – Brackenheim",
      "type": "Registerbekanntmachung nach dem Umwandlungsgesetz",
      "state": "Baden-Württemberg",
      "amtsgericht": "Amtsgericht Stuttgart",
      "registernummer": "HRA 742186",
      "registerart": "HRA",
      "company_name": "Waldschenke Hörnle GmbH & Co. KG",
      "company_seat": "Brackenheim",
      "details": "16.04.2025 (Bekanntmachungsdatum)\n\nBaden-Württemberg Amtsgericht Stuttgart HRA 742186\nRegisterbekanntmachung nach dem Umwandlungsgesetz 16.04.2025 (Eintragungsdatum)\n\nWaldschenke Hörnle GmbH & Co. KG\nKommanditgesellschaft\nBrackenheim\n\nAls nicht eingetragen wird bekanntgemacht:\nDen Gläubigern der an der Ausgliederung beteiligten Rechtsträger ist, wenn sie binnen sechs Monaten nach dem Tag, an dem die Eintragung der Ausgliederung in das Register des Sitzes desjenigen Rechtsträgers, dessen Gläubiger sie sind, nach § 19 Abs. 3 UmwG als bekanntgemacht gilt, ihren Anspruch nach Grund und Höhe schriftlich anmelden, Sicherheit zu leisten, soweit sie nicht Befriedigung verlangen können. Dieses Recht steht den Gläubigern jedoch nur zu, wenn sie glaubhaft machen, dass durch die Ausgliederung die Erfüllung ihrer Forderung gefährdet wird."
    },
    {
      "date": "2025-04-16",
      "id": "106728",
      "original_text": "Löschungsankündigung\nBaden-Württemberg Amtsgericht Stuttgart HRB 749554\nVergentrans GmbH – Stuttgart",
      "type": "Löschungsankündigung",
      "state": "Baden-Württemberg",
      "amtsgericht": "Amtsgericht Stuttgart",
      "registernummer": "HRB 749554",
      "registerart": "HRB",
      "company_name": "Vergentrans GmbH",
      "company_seat": "Stuttgart",
      "details": "16.04.2025 (Bekanntmachungsdatum)\n\nBaden-Württemberg Amtsgericht Stuttgart HRB 749554\nLöschungsankündigung\n\nVergentrans GmbH\nGesellschaft mit beschränkter Haftung\nStuttgart\n\nDas Gericht beabsichtigt, die Gesellschaft wegen Vermögenslosigkeit im Handelsregister von Amts wegen nach § 394 FamFG zu löschen. Die Frist zur Geltendmachung eines Widerspruchs gegen die beabsichtigte Löschung ist auf zwei Monate ab Veröffentlichung bestimmt."
    },
    {
      "date": "2025-04-16",
      "id": "106729",
      "original_text": "Löschungsankündigung\nBrandenburg Amtsgericht Frankfurt/Oder HRB 15539\nKeitsler GmbH – Altlandsberg",
      "type": "Löschungsankündigung",
      "state": "Brandenburg",
      "amtsgericht": "Amtsgericht Frankfurt/Oder",
      "registernummer": "HRB 15539",
      "registerart": "HRB",
      "company_name": "Keitsler GmbH",
      "company_seat": "Altlandsberg",
      "details": "16.04.2025 (Bekanntmachungsdatum)\n\nBrandenburg Amtsgericht Frankfurt/Oder HRB 15539\nLöschungsankündigung\n\nKeitsler GmbH\nGesellschaft mit beschränkter Haftung\nAltlandsberg\n\nBei der nachstehenden Gesellschaft wird das Amtslöschungsverfahren gemäß § 394 FamFG eingeleitet."
    },
    {
      "date": "2025-04-16",
      "id": "106730",
      "original_text": "Löschungsankündigung\nBerlin Amtsgericht Berlin (Charlottenburg) HRB 137189\nmosoft ware & system UG (haftungsbeschränkt) – Berlin",
      "type": "Löschungsankündigung",
      "state": "Berlin",
      "amtsgericht": "Amtsgericht Berlin (Charlottenburg)",
      "registernummer": "HRB 137189",
      "registerart": "HRB",
      "company_name": "mosoft ware & system UG (haftungsbeschränkt)",
      "company_seat": "Berlin",
      "details": "16.04.2025 (Bekanntmachungsdatum)\n\nBerlin Amtsgericht Berlin (Charlottenburg) HRB 137189\nLöschungsankündigung\n\nmosoft ware & system UG (haftungsbeschränkt)\nGesellschaft mit beschränkter Haftung\nBerlin\n\nBei der nachstehenden Gesellschaft wird das Amtslöschungsverfahren gemäß § 394 FamFG eingeleitet. Widerspruchsfrist 6 Wochen"
    },
    {
      "date": "2025-04-16",
      "id": "106731",
      "original_text": "Sonstige Registerbekanntmachung\nSchleswig-Holstein Amtsgericht Lübeck HRB 21758\nMW Enterprises GmbH – Timmendorfer Strand",
      "type": "Sonstige Registerbekanntmachung",
      "state": "Schleswig-Holstein",
      "amtsgericht": "Amtsgericht Lübeck",
      "registernummer": "HRB 21758",
      "registerart": "HRB",
      "company_name": "MW Enterprises GmbH",
      "company_seat": "Timmendorfer Strand",
      "details": "16.04.2025 (Bekanntmachungsdatum)\n\nSchleswig-Holstein Amtsgericht Lübeck HRB 21758\nSonstige Registerbekanntmachung\n\nMW Enterprises GmbH\nGesellschaft mit beschränkter Haftung\nTimmendorfer Strand\n\nAls nicht eingetragen wird folgendes Schreiben veröffentlicht:\n\nHerr\nn\nMaximilian Weigelt\n\nDubai Marina, The Torch APP. 5802\n\nDubai\nVereinigte Arabische Emirate\n\nSehr geehrter Herr Weigelt,\n\nin der Handelsregistersache der\n\nMW Enterprises GmbH\n\nergeben sich aus den mir vorliegenden Unterlagen Anhaltspunkte dafür, dass die Gesellschaft, als deren Geschäftsführer Sie noch eingetragen sind, vermögenslos ist:\n\nSchreiben des Finanzamts Lübeck vom 20.03.2025 und 09.04.2025\n\nIch beabsichtige daher, die Gesellschaft wegen Vermögenslosigkeit gemäß § 394 FamFG zu löschen.\n\nIch bestimme eine Frist von einem Monat zur Geltendmachung eines Widerspruchs gegen die Löschung, § 394 Abs. 2 S. 1 FamFG.\n\nWeiter bitte ich Sie, mir binnen derselben Frist mitzuteilen, ob die genannte Gesellschaft noch Vermögen hat, ggf. welche Vermögensgegenstände sie besitzt, ob die Gesellschaft noch Partei eines noch nicht rechtskräftig abgeschlossenen Rechtsstreits ist oder ob sonst noch eine Abwicklung stattfindet.\n\nNach Fristablauf ohne Widerspruch von Ihnen oder anderer Seite wird die Gesellschaft gelöscht.\n\nMit freundlichen Grüßen\nOstermann\nDipl.-Rechtspfleger (FH)"
    },
    {
      "date": "2025-04-16",
      "id": "106732",
      "original_text": "Löschungsankündigung\nSchleswig-Holstein Amtsgericht Lübeck HRB 21758\nMW Enterprises GmbH – Timmendorfer Strand",
      "type": "Löschungsankündigung",
      "state": "Schleswig-Holstein",
      "amtsgericht": "Amtsgericht Lübeck",
      "registernummer": "HRB 21758",
      "registerart": "HRB",
      "company_name": "MW Enterprises GmbH",
      "company_seat": "Timmendorfer Strand",
      "details": "16.04.2025 (Bekanntmachungsdatum)\n\nSchleswig-Holstein Amtsgericht Lübeck HRB 21758\nLöschungsankündigung\n\nMW Enterprises GmbH\nGesellschaft mit beschränkter Haftung\nTimmendorfer Strand\n\nEs ist die Löschung der nachstehenden Gesellschaft wegen Vermögenslosigkeit gemäß § 394 FamFG beabsichtigt.\nWiderspruchsfrist: 1 Monat."
    },
    {
      "date": "2025-04-16",
      "id": "106733",
      "original_text": "Löschungsankündigung\nBrandenburg Amtsgericht Frankfurt/Oder HRB 13128\nCT Cyclestores und Timing UG (haftungsbeschränkt) – Strausberg",
      "type": "Löschungsankündigung",
      "state": "Brandenburg",
      "amtsgericht": "Amtsgericht Frankfurt/Oder",
      "registernummer": "HRB 13128",
      "registerart": "HRB",
      "company_name": "CT Cyclestores und Timing UG (haftungsbeschränkt)",
      "company_seat": "Strausberg",
      "details": "16.04.2025 (Bekanntmachungsdatum)\n\nBrandenburg Amtsgericht Frankfurt/Oder HRB 13128\nLöschungsankündigung\n\nCT Cyclestores und Timing UG (haftungsbeschränkt)\nGesellschaft mit beschränkter Haftung\nStrausberg\n\nBei der nachstehenden Gesellschaft wird das Amtslöschungsverfahren gemäß § 394 FamFG eingeleitet."
    },
    {
      "date": "2025-04-16",
      "id": "106734",
      "original_text": "Löschungsankündigung\nSchleswig-Holstein Amtsgericht Flensburg HRB 12798\nKilian Clausen Kompetenzzentrum für Oberflächentechnik GmbH – Eggebek",
      "type": "Löschungsankündigung",
      "state": "Schleswig-Holstein",
      "amtsgericht": "Amtsgericht Flensburg",
      "registernummer": "HRB 12798",
      "registerart": "HRB",
      "company_name": "Kilian Clausen Kompetenzzentrum für Oberflächentechnik GmbH",
      "company_seat": "Eggebek",
      "details": "16.04.2025 (Bekanntmachungsdatum)\n\nSchleswig-Holstein Amtsgericht Flensburg HRB 12798\nLöschungsankündigung\n\nKilian Clausen Kompetenzzentrum für Oberflächentechnik GmbH\nGesellschaft mit beschränkter Haftung\nEggebek\n\nEs ist die Löschung der nachstehenden Gesellschaft wegen Vermögenslosigkeit gemäß § 394 FamFG beabsichtigt.\nWiderspruchsfrist: 2 Monate."
    },
    {
      "date": "2025-04-16",
      "id": "106735",
      "original_text": "Löschungsankündigung\nSchleswig-Holstein Amtsgericht Kiel HRB 17284\nRD Baumontage UG (haftungsbeschränkt) – Bredenbek",
      "type": "Löschungsankündigung",
      "state": "Schleswig-Holstein",
      "amtsgericht": "Amtsgericht Kiel",
      "registernummer": "HRB 17284",
      "registerart": "HRB",
      "company_name": "RD Baumontage UG (haftungsbeschränkt)",
      "company_seat": "Bredenbek",
      "details": "16.04.2025 (Bekanntmachungsdatum)\n\nSchleswig-Holstein Amtsgericht Kiel HRB 17284\nLöschungsankündigung\n\nRD Baumontage UG (haftungsbeschränkt)\nGesellschaft mit beschränkter Haftung\nBredenbek\n\nEs ist die Löschung der nachstehenden Gesellschaft wegen Vermögenslosigkeit gemäß § 394 FamFG beabsichtigt. Widerspruchsfrist: 2 Monate."
    },
    {
      "date": "2025-04-16",
      "id": "106736",
      "original_text": "Sonstige Registerbekanntmachung\nBrandenburg Amtsgericht Frankfurt/Oder HRB 14344\nTeGeCe Infrastruktur und Logistik GmbH – Frankfurt (Oder)",
      "type": "Sonstige Registerbekanntmachung",
      "state": "Brandenburg",
      "amtsgericht": "Amtsgericht Frankfurt/Oder",
      "registernummer": "HRB 14344",
      "registerart": "HRB",
      "company_name": "TeGeCe Infrastruktur und Logistik GmbH",
      "company_seat": "Frankfurt (Oder)",
      "details": "16.04.2025 (Bekanntmachungsdatum)\n\nBrandenburg Amtsgericht Frankfurt/Oder HRB 14344\nSonstige Registerbekanntmachung\n\nTeGeCe Infrastruktur und Logistik GmbH\nGesellschaft mit beschränkter Haftung\nFrankfurt (Oder)\n\nAls nicht eingetragen wird veröffentlicht: Eine Liste der Mitglieder des Aufsichtsrates wurde zum Handelsregister eingereicht."
    },
    {
      "date": "2025-04-16",
      "id": "106737",
      "original_text": "Registerbekanntmachung nach dem Umwandlungsgesetz\nBaden-Württemberg Amtsgericht Stuttgart HRB 763920\nHartmann Werkzeuge GmbH – Gemmrigheim",
      "type": "Registerbekanntmachung nach dem Umwandlungsgesetz",
      "state": "Baden-Württemberg",
      "amtsgericht": "Amtsgericht Stuttgart",
      "registernummer": "HRB 763920",
      "registerart": "HRB",
      "company_name": "Hartmann Werkzeuge GmbH",
      "company_seat": "Gemmrigheim",
      "details": "16.04.2025 (Bekanntmachungsdatum)\n\nBaden-Württemberg Amtsgericht Stuttgart HRB 763920\nRegisterbekanntmachung nach dem Umwandlungsgesetz 16.04.2025 (Eintragungsdatum)\n\nHartmann Werkzeuge GmbH\nGesellschaft mit beschränkter Haftung\nGemmrigheim\n\nDen Gläubigern der an der Verschmelzung beteiligten Rechtsträger ist, wenn sie binnen sechs Monaten nach dem Tag, an dem die Eintragung der Verschmelzung in das Register des Sitzes desjenigen Rechtsträgers, dessen Gläubiger sie sind, nach § 19 Abs. 3 UmwG als bekanntgemacht gilt, ihren Anspruch nach Grund und Höhe schriftlich anmelden, Sicherheit zu leisten, soweit sie nicht Befriedigung verlangen können. Dieses Recht steht den Gläubigern jedoch nur zu, wenn sie glaubhaft machen, dass durch die Verschmelzung die Erfüllung ihrer Forderung gefährdet wird."
    },
    {
      "date": "2025-04-16",
      "id": "106738",
      "original_text": "Registerbekanntmachung nach dem Umwandlungsgesetz\nBaden-Württemberg Amtsgericht Stuttgart HRA 742254\nHartmann Werkzeuge e.K. – Gemmrigheim",
      "type": "Registerbekanntmachung nach dem Umwandlungsgesetz",
      "state": "Baden-Württemberg",
      "amtsgericht": "Amtsgericht Stuttgart",
      "registernummer": "HRA 742254",
      "registerart": "HRA",
      "company_name": "Hartmann Werkzeuge e.K.",
      "company_seat": "Gemmrigheim",
      "details": "16.04.2025 (Bekanntmachungsdatum)\n\nBaden-Württemberg Amtsgericht Stuttgart HRA 742254\nRegisterbekanntmachung nach dem Umwandlungsgesetz 16.04.2025 (Eintragungsdatum)\n\nHartmann Werkzeuge e.K.\nEinzelkaufmann / Einzelkauffrau\nGemmrigheim\n\nDen Gläubigern der an der Verschmelzung beteiligten Rechtsträger ist, wenn sie binnen sechs Monaten nach dem Tag, an dem die Eintragung der Verschmelzung in das Register des Sitzes desjenigen Rechtsträgers, dessen Gläubiger sie sind, nach § 19 Abs. 3 UmwG als bekanntgemacht gilt, ihren Anspruch nach Grund und Höhe schriftlich anmelden, Sicherheit zu leisten, soweit sie nicht Befriedigung verlangen können. Dieses Recht steht den Gläubigern jedoch nur zu, wenn sie glaubhaft machen, dass durch die Verschmelzung die Erfüllung ihrer Forderung gefährdet wird."
    },
    {
      "date": "2025-04-16",
      "id": "106739",
      "original_text": "Sonstige Registerbekanntmachung\nHamburg Amtsgericht Hamburg HRB 173382\nWolf Concept Immobilien GmbH – Hamburg",
      "type": "Sonstige Registerbekanntmachung",
      "state": "Hamburg",
      "amtsgericht": "Amtsgericht Hamburg",
      "registernummer": "HRB 173382",
      "registerart": "HRB",
      "company_name": "Wolf Concept Immobilien GmbH",
      "company_seat": "Hamburg",
      "details": "16.04.2025 (Bekanntmachungsdatum)\n\nHamburg Amtsgericht Hamburg HRB 173382\nSonstige Registerbekanntmachung\n\nWolf Concept Immobilien GmbH\nGesellschaft mit beschränkter Haftung\nHamburg\n\nEs wurde beantragt einen Nachtragsliquidator zur gelöschten Gesellschaft \" Wolf Concept Immobilien GmbH \" vormals eingetragen beim Amtsgericht Hamburg, unter HRB 173382, zwecks Zustimmung der Gesellschaft, als Teileigentümer des Blattes 20478, wegen des Sondereigentums an einem Gartenteiles, zur Veräußerung eines anderen Teileigentumsanteils, hier Blatt 20477, zu bestellen. Den Beteiligten wird zur Wahrung des rechtlichen Gehörs Gelegenheit zur Stellungnahme, binnen einer Frist von 4 Wochen, ab Veröffentlichung gewährt."
    },
    {
      "date": "2025-04-16",
      "id": "106740",
      "original_text": "Registerbekanntmachung nach dem Umwandlungsgesetz\nBaden-Württemberg Amtsgericht Stuttgart HRB 740505\nISA GmbH – Stuttgart",
      "type": "Registerbekanntmachung nach dem Umwandlungsgesetz",
      "state": "Baden-Württemberg",
      "amtsgericht": "Amtsgericht Stuttgart",
      "registernummer": "HRB 740505",
      "registerart": "HRB",
      "company_name": "ISA GmbH",
      "company_seat": "Stuttgart",
      "details": "16.04.2025 (Bekanntmachungsdatum)\n\nBaden-Württemberg Amtsgericht Stuttgart HRB 740505\nRegisterbekanntmachung nach dem Umwandlungsgesetz 16.04.2025 (Eintragungsdatum)\n\nISA GmbH\nGesellschaft mit beschränkter Haftung\nStuttgart\n\nDen Gläubigern der an der Verschmelzung beteiligten Rechtsträger ist, wenn sie binnen sechs Monaten nach dem Tag, an dem die Eintragung der Verschmelzung in das Register des Sitzes desjenigen Rechtsträgers, dessen Gläubiger sie sind, nach § 19 Abs. 3 UmwG als bekanntgemacht gilt, ihren Anspruch nach Grund und Höhe schriftlich anmelden, Sicherheit zu leisten, soweit sie nicht Befriedigung verlangen können. Dieses Recht steht den Gläubigern jedoch nur zu, wenn sie glaubhaft machen, dass durch die Verschmelzung die Erfüllung ihrer Forderung gefährdet wird."
    },
    {
      "date": "2025-04-16",
      "id": "106741",
      "original_text": "Einreichung neuer Dokumente\nSchleswig-Holstein Amtsgericht Flensburg HRB 158 KA\nOstangler Brandgilde, Versicherungsverein auf Gegenseitigkeit (VVaG) – Kappeln",
      "type": "Einreichung neuer Dokumente",
      "state": "Schleswig-Holstein",
      "amtsgericht": "Amtsgericht Flensburg",
      "registernummer": "HRB 158 KA",
      "registerart": "HRB",
      "company_name": "Ostangler Brandgilde, Versicherungsverein auf Gegenseitigkeit (VVaG)",
      "company_seat": "Kappeln",
      "details": "16.04.2025 (Bekanntmachungsdatum)\n\nSchleswig-Holstein Amtsgericht Flensburg HRB 158 KA\nEinreichung neuer Dokumente\n\nOstangler Brandgilde, Versicherungsverein auf Gegenseitigkeit (VVaG)\nVersicherungsverein auf Gegenseitigkeit\nKappeln\n\nAls nicht eingetragen wird veröffentlicht: Der Entwurf des Verschmelzungsvertrages ist eingereicht am 14.04.2025."
    },
    {
      "date": "2025-04-16",
      "id": "106742",
      "original_text": "Löschungsankündigung\nBerlin Amtsgericht Berlin (Charlottenburg) HRB 250223\nHDRT Logistik GmbH – Berlin",
      "type": "Löschungsankündigung",
      "state": "Berlin",
      "amtsgericht": "Amtsgericht Berlin (Charlottenburg)",
      "registernummer": "HRB 250223",
      "registerart": "HRB",
      "company_name": "HDRT Logistik GmbH",
      "company_seat": "Berlin",
      "details": "16.04.2025 (Bekanntmachungsdatum)\n\nBerlin Amtsgericht Berlin (Charlottenburg) HRB 250223\nLöschungsankündigung\n\nHDRT Logistik GmbH\nGesellschaft mit beschränkter Haftung\nBerlin\n\nBei der nachstehenden Gesellschaft wird das Amtslöschungsverfahren gemäß § 394 FamFG eingeleitet. Widerspruchsfrist 6 Wochen"
    },
    {
      "date": "2025-04-16",
      "id": "106743",
      "original_text": "Registerbekanntmachung nach dem Umwandlungsgesetz\nSachsen Amtsgericht Dresden HRB 5361\nDRESKON Ingenieurbüro und Vertriebsgesellschaft mbH Maschinenbau / Anlagenbau / Hydraulik – Radebeul",
      "type": "Registerbekanntmachung nach dem Umwandlungsgesetz",
      "state": "Sachsen",
      "amtsgericht": "Amtsgericht Dresden",
      "registernummer": "HRB 5361",
      "registerart": "HRB",
      "company_name": "DRESKON Ingenieurbüro und Vertriebsgesellschaft mbH Maschinenbau / Anlagenbau / Hydraulik",
      "company_seat": "Radebeul",
      "details": "16.04.2025 (Bekanntmachungsdatum)\n\nSachsen Amtsgericht Dresden HRB 5361\nRegisterbekanntmachung nach dem Umwandlungsgesetz 16.04.2025 (Eintragungsdatum)\n\nDRESKON Ingenieurbüro und Vertriebsgesellschaft mbH Maschinenbau / Anlagenbau / Hydraulik\nGesellschaft mit beschränkter Haftung\nRadebeul\n\nDen Gläubigern der an der Verschmelzung beteiligten Rechtsträger ist, wenn sie binnen sechs Monaten nach dem Tag, an dem die Eintragung der Verschmelzung in das Register des Sitzes desjenigen Rechtsträgers, dessen Gläubiger sie sind, nach § 19 Abs. 3 UmwG als bekannt gemacht gilt, ihren Anspruch nach Grund und Höhe in Textform anmelden, Sicherheit zu leisten, soweit sie nicht Befriedigung verlangen können. Dieses Recht steht den Gläubigern jedoch nur zu, wenn sie glaubhaft machen, dass durch die Verschmelzung die Erfüllung der Forderung gefährdet wird."
    },
    {
      "date": "2025-04-16",
      "id": "106744",
      "original_text": "Registerbekanntmachung nach dem Umwandlungsgesetz\nSachsen Amtsgericht Leipzig HRB 35853\nDIGNITAS Verwaltungsgesellschaft mbH – Leipzig",
      "type": "Registerbekanntmachung nach dem Umwandlungsgesetz",
      "state": "Sachsen",
      "amtsgericht": "Amtsgericht Leipzig",
      "registernummer": "HRB 35853",
      "registerart": "HRB",
      "company_name": "DIGNITAS Verwaltungsgesellschaft mbH",
      "company_seat": "Leipzig",
      "details": "16.04.2025 (Bekanntmachungsdatum)\n\nSachsen Amtsgericht Leipzig HRB 35853\nRegisterbekanntmachung nach dem Umwandlungsgesetz 16.04.2025 (Eintragungsdatum)\n\nDIGNITAS Verwaltungsgesellschaft mbH\nGesellschaft mit beschränkter Haftung\nLeipzig\n\nDen Gläubigern der an der Verschmelzung beteiligten Rechtsträger ist, wenn sie binnen sechs Monaten nach dem Tag, an dem die Eintragung der Verschmelzung in das Register des Sitzes desjenigen Rechtsträgers, dessen Gläubiger sie sind, nach § 19 Abs. 3 UmwG als bekannt gemacht gilt, ihren Anspruch nach Grund und Höhe in Textform anmelden, Sicherheit zu leisten, soweit sie nicht Befriedigung verlangen können. Dieses Recht steht den Gläubigern jedoch nur zu, wenn sie glaubhaft machen, dass durch die Verschmelzung die Erfüllung der Forderung gefährdet wird."
    },
    {
      "date": "2025-04-16",
      "id": "106745",
      "original_text": "Registerbekanntmachung nach dem Umwandlungsgesetz\nSachsen Amtsgericht Chemnitz HRB 35465\nTimeProfessionals Verwaltung GmbH – Chemnitz",
      "type": "Registerbekanntmachung nach dem Umwandlungsgesetz",
      "state": "Sachsen",
      "amtsgericht": "Amtsgericht Chemnitz",
      "registernummer": "HRB 35465",
      "registerart": "HRB",
      "company_name": "TimeProfessionals Verwaltung GmbH",
      "company_seat": "Chemnitz",
      "details": "16.04.2025 (Bekanntmachungsdatum)\n\nSachsen Amtsgericht Chemnitz HRB 35465\nRegisterbekanntmachung nach dem Umwandlungsgesetz 16.04.2025 (Eintragungsdatum)\n\nTimeProfessionals Verwaltung GmbH\nGesellschaft mit beschränkter Haftung\nChemnitz\n\nDen Gläubigern der an der Verschmelzung beteiligten Rechtsträger ist, wenn sie binnen sechs Monaten nach dem Tag, an dem die Eintragung der Verschmelzung in das Register des Sitzes desjenigen Rechtsträgers, dessen Gläubiger sie sind, nach § 19 Abs. 3 UmwG als bekannt gemacht gilt, ihren Anspruch nach Grund und Höhe in Textform anmelden, Sicherheit zu leisten, soweit sie nicht Befriedigung verlangen können. Dieses Recht steht den Gläubigern jedoch nur zu, wenn sie glaubhaft machen, dass durch die Verschmelzung die Erfüllung der Forderung gefährdet wird."
    },
    {
      "date": "2025-04-16",
      "id": "106746",
      "original_text": "Registerbekanntmachung nach dem Umwandlungsgesetz\nHamburg Amtsgericht Hamburg HRB 154579\nUNITANK Beteiligungs GmbH – Hamburg",
      "type": "Registerbekanntmachung nach dem Umwandlungsgesetz",
      "state": "Hamburg",
      "amtsgericht": "Amtsgericht Hamburg",
      "registernummer": "HRB 154579",
      "registerart": "HRB",
      "company_name": "UNITANK Beteiligungs GmbH",
      "company_seat": "Hamburg",
      "details": "16.04.2025 (Bekanntmachungsdatum)\n\nHamburg Amtsgericht Hamburg HRB 154579\nRegisterbekanntmachung nach dem Umwandlungsgesetz 16.04.2025 (Eintragungsdatum)\n\nUNITANK Beteiligungs GmbH\nGesellschaft mit beschränkter Haftung\nHamburg\n\nAls nicht eingetragen wird bekanntgemacht:\nEs wird darauf hingewiesen, dass ein Verschmelzungsplan oder sein Entwurf über eine grenzüberschreitende Verschmelzung zur Aufnahme mit der UNITANK Logistics NV mit Sitz in Roeselare/Belgien (Kruispuntbank van Ondernemingen/Banque-Carrefour des Entreprises/Zentrale Unternehmensdatenbank 0456.745.779) (Naamloze vennootschap van publiek recht / Société anonyme de droit public / Öffentlich-rechtliche Aktiengesellschaft nach belgischem Recht) beim Handelsregister eingereicht worden ist.\nDie Anteilsinhaber, die Gläubiger sowie die zuständigen Betriebsräte der an der grenzüberschreitenden Verschmelzung beteiligten Gesellschaften oder, soweit es keinen Betriebsrat gibt, die Arbeitnehmer der an der grenzüberschreitenden Verschmelzung beteiligten Gesellschaften, können der jeweiligen Gesellschaft spätestens fünf Arbeitstage vor dem Tag der Gesellschafterversammlung Bemerkungen zum Verschmelzungsplan übermitteln."
    },
    {
      "date": "2025-04-16",
      "id": "106747",
      "original_text": "Registerbekanntmachung nach dem Umwandlungsgesetz\nNiedersachsen Amtsgericht Braunschweig HRB 110008 früher Amtsgericht Goslar\nChemische Fabriken Oker und Braunschweig Aktiengesellschaft – Goslar",
      "type": "Registerbekanntmachung nach dem Umwandlungsgesetz",
      "state": "Niedersachsen",
      "amtsgericht": "Amtsgericht Braunschweig",
      "registernummer": "HRB 110008",
      "registerart": "HRB",
      "company_name": "Chemische Fabriken Oker und Braunschweig Aktiengesellschaft",
      "company_seat": "Goslar",
      "former_amtsgericht": "Goslar",
      "details": "16.04.2025 (Bekanntmachungsdatum)\n\nNiedersachsen Amtsgericht Braunschweig HRB 110008 früher Amtsgericht Goslar\nRegisterbekanntmachung nach dem Umwandlungsgesetz 16.04.2025 (Eintragungsdatum)\n\nChemische Fabriken Oker und Braunschweig Aktiengesellschaft\nAktiengesellschaft\nGoslar\n\nDen Gläubigern der an der Verschmelzung beteiligten Rechtsträger ist, wenn sie binnen sechs Monaten nach dem Tag, an dem die Eintragung der Verschmelzung in das Register des Sitzes desjenigen Rechtsträgers, dessen Gläubiger sie sind, nach § 19  Abs.  3 UmwG als bekannt gemacht gilt, ihren Anspruch nach Grund und Höhe schriftlich anmelden, Sicherheit zu leisten, soweit sie nicht Befriedigung verlangen können. Dieses Recht steht den Gläubigern jedoch nur zu, wenn sie glaubhaft machen, dass durch die Verschmelzung die Erfüllung der Forderung gefährdet wird."
    },
    {
      "date": "2025-04-16",
      "id": "106748",
      "original_text": "Registerbekanntmachung nach dem Umwandlungsgesetz\nNiedersachsen Amtsgericht Braunschweig HRB 200743\nH.C. Starck GmbH – Goslar",
      "type": "Registerbekanntmachung nach dem Umwandlungsgesetz",
      "state": "Niedersachsen",
      "amtsgericht": "Amtsgericht Braunschweig",
      "registernummer": "HRB 200743",
      "registerart": "HRB",
      "company_name": "H.C. Starck GmbH",
      "company_seat": "Goslar",
      "details": "16.04.2025 (Bekanntmachungsdatum)\n\nNiedersachsen Amtsgericht Braunschweig HRB 200743\nRegisterbekanntmachung nach dem Umwandlungsgesetz 16.04.2025 (Eintragungsdatum)\n\nH.C. Starck GmbH\nGesellschaft mit beschränkter Haftung\nGoslar\n\nDen Gläubigern der an der Verschmelzung beteiligten Rechtsträger ist, wenn sie binnen sechs Monaten nach dem Tag, an dem die Eintragung der Verschmelzung in das Register des Sitzes desjenigen Rechtsträgers, dessen Gläubiger sie sind, nach § 19  Abs.  3 UmwG als bekannt gemacht gilt, ihren Anspruch nach Grund und Höhe schriftlich anmelden, Sicherheit zu leisten, soweit sie nicht Befriedigung verlangen können. Dieses Recht steht den Gläubigern jedoch nur zu, wenn sie glaubhaft machen, dass durch die Verschmelzung die Erfüllung der Forderung gefährdet wird."
    },
    {
      "date": "2025-04-16",
      "id": "106749",
      "original_text": "Registerbekanntmachung nach dem Umwandlungsgesetz\nNiedersachsen Amtsgericht Hildesheim HRB 205352\nBloch Sicherheit UG (haftungsbeschränkt) – Dielmissen",
      "type": "Registerbekanntmachung nach dem Umwandlungsgesetz",
      "state": "Niedersachsen",
      "amtsgericht": "Amtsgericht Hildesheim",
      "registernummer": "HRB 205352",
      "registerart": "HRB",
      "company_name": "Bloch Sicherheit UG (haftungsbeschränkt)",
      "company_seat": "Dielmissen",
      "details": "16.04.2025 (Bekanntmachungsdatum)\n\nNiedersachsen Amtsgericht Hildesheim HRB 205352\nRegisterbekanntmachung nach dem Umwandlungsgesetz 16.04.2025 (Eintragungsdatum)\n\nBloch Sicherheit UG (haftungsbeschränkt)\nGesellschaft mit beschränkter Haftung\nDielmissen\n\nDen Gläubigern der an der Verschmelzung beteiligten Rechtsträger ist, wenn sie binnen sechs Monaten nach dem Tag, an dem die Eintragung der Verschmelzung in das Register des Sitzes desjenigen Rechtsträgers, dessen Gläubiger sie sind, nach § 19  Abs.  3 UmwG als bekannt gemacht gilt, ihren Anspruch nach Grund und Höhe schriftlich anmelden, Sicherheit zu leisten, soweit sie nicht Befriedigung verlangen können. Dieses Recht steht den Gläubigern jedoch nur zu, wenn sie glaubhaft machen, dass durch die Verschmelzung die Erfüllung der Forderung gefährdet wird."
    },
    {
      "date": "2025-04-16",
      "id": "106750",
      "original_text": "Registerbekanntmachung nach dem Umwandlungsgesetz\nNiedersachsen Amtsgericht Aurich HRB 111121 früher Amtsgericht Leer (Ostfriesland) (Leer)\nHartmann AG – Leer",
      "type": "Registerbekanntmachung nach dem Umwandlungsgesetz",
      "state": "Niedersachsen",
      "amtsgericht": "Amtsgericht Aurich",
      "registernummer": "HRB 111121",
      "registerart": "HRB",
      "company_name": "Hartmann AG",
      "company_seat": "Leer",
      "former_amtsgericht": "Leer (Ostfriesland) (Leer)",
      "details": "16.04.2025 (Bekanntmachungsdatum)\n\nNiedersachsen Amtsgericht Aurich HRB 111121 früher Amtsgericht Leer (Ostfriesland) (Leer)\nRegisterbekanntmachung nach dem Umwandlungsgesetz 16.04.2025 (Eintragungsdatum)\n\nHartmann AG\nAktiengesellschaft\nLeer\n\nEs wird darauf hingewiesen, dass ein Spaltungsplan über eine grenzüberschreitende Spaltung zur Neugründung der in das Unternehmensregister Zypern unter der Firma \"Hartmann Holdings II Limited\" mit Sitz in Limassol, Zypern, einzutragenden Gesellschaft mit beschränkter Haftung beim Handelsregister eingereicht worden ist.\n\nDie Anteilsinhaber, die Gläubiger sowie die zuständigen Betriebsräte der an der grenzüberschreitenden Spaltung beteiligten Gesellschaft oder, soweit es keinen Betriebsrat gibt, die Arbeitnehmer der an der grenzüberschreitenden Spaltung beteiligten Gesellschaft, können der Gesellschaft spätestens fünf Arbeitstage vor dem Tag der Hauptversammlung Bemerkungen zum Spaltungsplan übermitteln. Die Hauptversammlung kann frühestens einen Monat nach dieser Bekanntmachung über die Zustimmung zum Spaltungsplan beschließen."
    },
    {
      "date": "2025-04-16",
      "id": "106751",
      "original_text": "Registerbekanntmachung nach dem Umwandlungsgesetz\nNiedersachsen Amtsgericht Hannover HRA 206659\nStylekonzept GmbH & Co. KG – Hannover",
      "type": "Registerbekanntmachung nach dem Umwandlungsgesetz",
      "state": "Niedersachsen",
      "amtsgericht": "Amtsgericht Hannover",
      "registernummer": "HRA 206659",
      "registerart": "HRA",
      "company_name": "Stylekonzept GmbH & Co. KG",
      "company_seat": "Hannover",
      "details": "16.04.2025 (Bekanntmachungsdatum)\n\nNiedersachsen Amtsgericht Hannover HRA 206659\nRegisterbekanntmachung nach dem Umwandlungsgesetz 16.04.2025 (Eintragungsdatum)\n\nStylekonzept GmbH & Co. KG\nKommanditgesellschaft\nHannover\n\nDen Gläubigern der an der Ausgliederung beteiligten Rechtsträger ist, wenn sie binnen sechs Monaten nach dem Tag, an dem die Eintragung der Ausgliederung in das Register des Sitzes desjenigen Rechtsträgers, dessen Gläubiger sie sind, nach § 19 Abs. 3 UmwG als bekannt gemacht gilt, ihren Anspruch nach Grund und Höhe schriftlich anmelden, Sicherheit zu leisten, soweit sie nicht Befriedigung verlangen können. Dieses Recht steht den Gläubigern jedoch nur zu, wenn sie glaubhaft machen, dass durch die Ausgliederung die Erfüllung der Forderung gefährdet wird."
    },
    {
      "date": "2025-04-16",
      "id": "106752",
      "original_text": "Löschungsankündigung\nNiedersachsen Amtsgericht Tostedt HRB 210018\nFLUENCER Kontor GmbH – Buxtehude",
      "type": "Löschungsankündigung",
      "state": "Niedersachsen",
      "amtsgericht": "Amtsgericht Tostedt",
      "registernummer": "HRB 210018",
      "registerart": "HRB",
      "company_name": "FLUENCER Kontor GmbH",
      "company_seat": "Buxtehude",
      "details": "16.04.2025 (Bekanntmachungsdatum)\n\nNiedersachsen Amtsgericht Tostedt HRB 210018\nLöschungsankündigung\n\nFLUENCER Kontor GmbH\nGesellschaft mit beschränkter Haftung\nBuxtehude\n\nDas Registergericht beabsichtigt, die Gesellschaft von Amts wegen nach § 394 FamFG zu löschen. Die Frist zur Erhebung eines Widerspruchs ist auf 1 Monat ab dieser Registerbekanntmachung festgesetzt."
    },
    {
      "date": "2025-04-16",
      "id": "106753",
      "original_text": "Registerbekanntmachung nach dem Umwandlungsgesetz\nNiedersachsen Amtsgericht Osnabrück HRB 100408 früher Amtsgericht Lingen (Ems)\nEntsorgungstechnik H. Stahs GmbH – Lingen/Ems",
      "type": "Registerbekanntmachung nach dem Umwandlungsgesetz",
      "state": "Niedersachsen",
      "amtsgericht": "Amtsgericht Osnabrück",
      "registernummer": "HRB 100408",
      "registerart": "HRB",
      "company_name": "Entsorgungstechnik H. Stahs GmbH",
      "company_seat": "Lingen/Ems",
      "former_amtsgericht": "Lingen (Ems)",
      "details": "16.04.2025 (Bekanntmachungsdatum)\n\nNiedersachsen Amtsgericht Osnabrück HRB 100408 früher Amtsgericht Lingen (Ems)\nRegisterbekanntmachung nach dem Umwandlungsgesetz 16.04.2025 (Eintragungsdatum)\n\nEntsorgungstechnik H. Stahs GmbH\nGesellschaft mit beschränkter Haftung\nLingen/Ems\n\nDen Gläubigern der an der Verschmelzung beteiligten Rechtsträger ist, wenn sie binnen sechs Monaten nach dem Tag, an dem die Eintragung der Verschmelzung in das Register des Sitzes desjenigen Rechtsträgers, dessen Gläubiger sie sind, nach § 19  Abs.  3 UmwG als bekannt gemacht gilt, ihren Anspruch nach Grund und Höhe schriftlich anmelden, Sicherheit zu leisten, soweit sie nicht Befriedigung verlangen können. Dieses Recht steht den Gläubigern jedoch nur zu, wenn sie glaubhaft machen, dass durch die Verschmelzung die Erfüllung der Forderung gefährdet wird."
    },
    {
      "date": "2025-04-16",
      "id": "106754",
      "original_text": "Registerbekanntmachung nach dem Umwandlungsgesetz\nNiedersachsen Amtsgericht Osnabrück HRB 122280 früher Amtsgericht Meppen\nJHL Pool-Management GmbH – Haren (Ems)",
      "type": "Registerbekanntmachung nach dem Umwandlungsgesetz",
      "state": "Niedersachsen",
      "amtsgericht": "Amtsgericht Osnabrück",
      "registernummer": "HRB 122280",
      "registerart": "HRB",
      "company_name": "JHL Pool-Management GmbH",
      "company_seat": "Haren (Ems)",
      "former_amtsgericht": "Meppen",
      "details": "16.04.2025 (Bekanntmachungsdatum)\n\nNiedersachsen Amtsgericht Osnabrück HRB 122280 früher Amtsgericht Meppen\nRegisterbekanntmachung nach dem Umwandlungsgesetz 16.04.2025 (Eintragungsdatum)\n\nJHL Pool-Management GmbH\nGesellschaft mit beschränkter Haftung\nHaren (Ems)\n\nDen Gläubigern der an der Verschmelzung beteiligten Rechtsträger ist, wenn sie binnen sechs Monaten nach dem Tag, an dem die Eintragung der Verschmelzung in das Register des Sitzes desjenigen Rechtsträgers, dessen Gläubiger sie sind, nach § 19  Abs.  3 UmwG als bekannt gemacht gilt, ihren Anspruch nach Grund und Höhe schriftlich anmelden, Sicherheit zu leisten, soweit sie nicht Befriedigung verlangen können. Dieses Recht steht den Gläubigern jedoch nur zu, wenn sie glaubhaft machen, dass durch die Verschmelzung die Erfüllung der Forderung gefährdet wird."
    },
    {
      "date": "2025-04-16",
      "id": "106755",
      "original_text": "Registerbekanntmachung nach dem Umwandlungsgesetz\nNiedersachsen Amtsgericht Hannover VR 100565\nDLRG - Ortsgruppe Beber - Rohrsen - Bad Münder e.V. – Bad Münder - Beber/Rohrsen",
      "type": "Registerbekanntmachung nach dem Umwandlungsgesetz",
      "state": "Niedersachsen",
      "amtsgericht": "Amtsgericht Hannover",
      "registernummer": "VR 100565",
      "registerart": "VR",
      "company_name": "DLRG - Ortsgruppe Beber - Rohrsen - Bad Münder e.V.",
      "company_seat": "Bad Münder - Beber/Rohrsen",
      "details": "16.04.2025 (Bekanntmachungsdatum)\n\nNiedersachsen Amtsgericht Hannover VR 100565\nRegisterbekanntmachung nach dem Umwandlungsgesetz 16.04.2025 (Eintragungsdatum)\n\nDLRG - Ortsgruppe Beber - Rohrsen - Bad Münder e.V.\neingetragener Verein\nBad Münder - Beber/Rohrsen\n\nDen Gläubigern der an der Verschmelzung beteiligten Rechtsträger ist, wenn sie binnen sechs Monaten nach dem Tag, an dem die Eintragung der Verschmelzung in das Register des Sitzes desjenigen Rechtsträgers, dessen Gläubiger sie sind, nach § 19  Abs.  3 UmwG als bekannt gemacht gilt, ihren Anspruch nach Grund und Höhe schriftlich anmelden, Sicherheit zu leisten, soweit sie nicht Befriedigung verlangen können. Dieses Recht steht den Gläubigern jedoch nur zu, wenn sie glaubhaft machen, dass durch die Verschmelzung die Erfüllung der Forderung gefährdet wird."
    },
    {
      "date": "2025-04-16",
      "id": "106756",
      "original_text": "Registerbekanntmachung nach dem Umwandlungsgesetz\nNiedersachsen Amtsgericht Hannover HRA 206590\nStylekonzept, Inh. R. Hamouri e.K. – Hannover",
      "type": "Registerbekanntmachung nach dem Umwandlungsgesetz",
      "state": "Niedersachsen",
      "amtsgericht": "Amtsgericht Hannover",
      "registernummer": "HRA 206590",
      "registerart": "HRA",
      "company_name": "Stylekonzept, Inh. R. Hamouri e.K.",
      "company_seat": "Hannover",
      "details": "16.04.2025 (Bekanntmachungsdatum)\n\nNiedersachsen Amtsgericht Hannover HRA 206590\nRegisterbekanntmachung nach dem Umwandlungsgesetz 16.04.2025 (Eintragungsdatum)\n\nStylekonzept, Inh. R. Hamouri e.K.\nEinzelkaufmann / Einzelkauffrau\nHannover\n\nDen Gläubigern der an der Ausgliederung beteiligten Rechtsträger ist, wenn sie binnen sechs Monaten nach dem Tag, an dem die Eintragung der Ausgliederung in das Register des Sitzes desjenigen Rechtsträgers, dessen Gläubiger sie sind, nach § 19 Abs. 3 UmwG als bekannt gemacht gilt, ihren Anspruch nach Grund und Höhe schriftlich anmelden, Sicherheit zu leisten, soweit sie nicht Befriedigung verlangen können. Dieses Recht steht den Gläubigern jedoch nur zu, wenn sie glaubhaft machen, dass durch die Ausgliederung die Erfüllung der Forderung gefährdet wird."
    },
    {
      "date": "2025-04-16",
      "id": "106757",
      "original_text": "Löschungsankündigung\nBremen Amtsgericht Bremen HRB 37253\nHOEFLICH Immobilien GmbH – Bremerhaven",
      "type": "Löschungsankündigung",
      "state": "Bremen",
      "amtsgericht": "Amtsgericht Bremen",
      "registernummer": "HRB 37253",
      "registerart": "HRB",
      "company_name": "HOEFLICH Immobilien GmbH",
      "company_seat": "Bremerhaven",
      "details": "16.04.2025 (Bekanntmachungsdatum)\n\nBremen Amtsgericht Bremen HRB 37253\nLöschungsankündigung\n\nHOEFLICH Immobilien GmbH\nGesellschaft mit beschränkter Haftung\nBremerhaven\n\nEs ist beabsichtigt die im Handelsregister eingetragene Gesellschaft von Amts wegen gemäß § 394 FamFG zu löschen. Gegen die Löschung kann beim AG Bremen schriftlich oder zu Protokoll der Geschäftsstelle Widerspruch eingelegt werden. Widerspruchsfrist 4 Wochen."
    },
    {
      "date": "2025-04-16",
      "id": "106758",
      "original_text": "Löschungsankündigung\nBremen Amtsgericht Bremen HRB 37833\nDKR Home Möbel GmbH – Bremen",
      "type": "Löschungsankündigung",
      "state": "Bremen",
      "amtsgericht": "Amtsgericht Bremen",
      "registernummer": "HRB 37833",
      "registerart": "HRB",
      "company_name": "DKR Home Möbel GmbH",
      "company_seat": "Bremen",
      "details": "16.04.2025 (Bekanntmachungsdatum)\n\nBremen Amtsgericht Bremen HRB 37833\nLöschungsankündigung\n\nDKR Home Möbel GmbH\nGesellschaft mit beschränkter Haftung\nBremen\n\nEs ist beabsichtigt die im Handelsregister eingetragene Gesellschaft von Amts wegen gemäß § 394 FamFG zu löschen. Gegen die Löschung kann beim AG Bremen schriftlich oder zu Protokoll der Geschäftsstelle Widerspruch eingelegt werden. Widerspruchsfrist 4 Wochen."
    },
    {
      "date": "2025-04-16",
      "id": "106759",
      "original_text": "Löschungsankündigung\nBremen Amtsgericht Bremen HRB 29664\nZoo 21 Concept GmbH – Bremen",
      "type": "Löschungsankündigung",
      "state": "Bremen",
      "amtsgericht": "Amtsgericht Bremen",
      "registernummer": "HRB 29664",
      "registerart": "HRB",
      "company_name": "Zoo 21 Concept GmbH",
      "company_seat": "Bremen",
      "details": "16.04.2025 (Bekanntmachungsdatum)\n\nBremen Amtsgericht Bremen HRB 29664\nLöschungsankündigung\n\nZoo 21 Concept GmbH\nGesellschaft mit beschränkter Haftung\nBremen\n\nEs ist beabsichtigt die im Handelsregister eingetragene Gesellschaft von Amts wegen gemäß § 394 FamFG zu löschen. Gegen die Löschung kann beim AG Bremen schriftlich oder zu Protokoll der Geschäftsstelle Widerspruch eingelegt werden. Widerspruchsfrist 4 Wochen."
    },
    {
      "date": "2025-04-16",
      "id": "106760",
      "original_text": "Sonstige Registerbekanntmachung\nRheinland-Pfalz Amtsgericht Landau HRB 11456\nWALTHER SYSTEMTECHNIK GMBH – Germersheim",
      "type": "Sonstige Registerbekanntmachung",
      "state": "Rheinland-Pfalz",
      "amtsgericht": "Amtsgericht Landau",
      "registernummer": "HRB 11456",
      "registerart": "HRB",
      "company_name": "WALTHER SYSTEMTECHNIK GMBH",
      "company_seat": "Germersheim",
      "details": "16.04.2025 (Bekanntmachungsdatum)\n\nRheinland-Pfalz Amtsgericht Landau HRB 11456\nSonstige Registerbekanntmachung 16.04.2025 (Eintragungsdatum)\n\nWALTHER SYSTEMTECHNIK GMBH\nGesellschaft mit beschränkter Haftung\nGermersheim\n\nAls nicht eingetragen wird veröffentlicht: Den Gläubigern der Gesellschaft, deren Forderungen begründet worden sind, bevor die Eintragung der Beendigung des Gewinnabführungsvertrages in das Handelsregister nach § 10 des Handelsgesetzbuches als bekanntgemacht gilt, hat der andere Vertragsteil Sicherheit zu leisten, wenn sie sich binnen sechs Monaten nach der Bekanntmachung der Eintragung zu diesem Zweck bei ihm melden."
    },
    {
      "date": "2025-04-16",
      "id": "106761",
      "original_text": "Registerbekanntmachung nach dem Umwandlungsgesetz\nRheinland-Pfalz Amtsgericht Mainz HRB 41423\nCONTEAM:GRUPPE GmbH – Stadecken-Elsheim",
      "type": "Registerbekanntmachung nach dem Umwandlungsgesetz",
      "state": "Rheinland-Pfalz",
      "amtsgericht": "Amtsgericht Mainz",
      "registernummer": "HRB 41423",
      "registerart": "HRB",
      "company_name": "CONTEAM:GRUPPE GmbH",
      "company_seat": "Stadecken-Elsheim",
      "details": "16.04.2025 (Bekanntmachungsdatum)\n\nRheinland-Pfalz Amtsgericht Mainz HRB 41423\nRegisterbekanntmachung nach dem Umwandlungsgesetz 16.04.2025 (Eintragungsdatum)\n\nCONTEAM:GRUPPE GmbH\nGesellschaft mit beschränkter Haftung\nStadecken-Elsheim\n\nAls nicht eingetragen wird veröffentlicht: Den Gläubigern der an der Verschmelzung beteiligten Rechtsträger ist, wenn sie binnen sechs Monaten nach dem Tag, an dem die Eintragung der Verschmelzung in das Register des Sitzes desjenigen Rechtsträgers, dessen Gläubiger sie sind, nach § 19 Abs. 3 UmwG als bekannt gemacht gilt, ihren Anspruch nach Grund und Höhe schriftlich anmelden, Sicherheit zu leisten, soweit sie nicht Befriedigung verlangen können. Dieses Recht steht den Gläubigern jedoch nur zu, wenn sie glaubhaft machen, dass durch die Verschmelzung die Erfüllung der Forderung gefährdet wird."
    },
    {
      "date": "2025-04-16",
      "id": "106762",
      "original_text": "Registerbekanntmachung nach dem Umwandlungsgesetz\nRheinland-Pfalz Amtsgericht Mainz HRB 52574\nCONTEAM INVEST GmbH – Stadecken-Elsheim",
      "type": "Registerbekanntmachung nach dem Umwandlungsgesetz",
      "state": "Rheinland-Pfalz",
      "amtsgericht": "Amtsgericht Mainz",
      "registernummer": "HRB 52574",
      "registerart": "HRB",
      "company_name": "CONTEAM INVEST GmbH",
      "company_seat": "Stadecken-Elsheim",
      "details": "16.04.2025 (Bekanntmachungsdatum)\n\nRheinland-Pfalz Amtsgericht Mainz HRB 52574\nRegisterbekanntmachung nach dem Umwandlungsgesetz 16.04.2025 (Eintragungsdatum)\n\nCONTEAM INVEST GmbH\nGesellschaft mit beschränkter Haftung\nStadecken-Elsheim\n\nAls nicht eingetragen wird veröffentlicht: Den Gläubigern der an der Verschmelzung beteiligten Rechtsträger ist, wenn sie binnen sechs Monaten nach dem Tag, an dem die Eintragung der Verschmelzung in das Register des Sitzes desjenigen Rechtsträgers, dessen Gläubiger sie sind, nach § 19 Abs. 3 UmwG als bekannt gemacht gilt, ihren Anspruch nach Grund und Höhe schriftlich anmelden, Sicherheit zu leisten, soweit sie nicht Befriedigung verlangen können. Dieses Recht steht den Gläubigern jedoch nur zu, wenn sie glaubhaft machen, dass durch die Verschmelzung die Erfüllung der Forderung gefährdet wird."
    },
    {
      "date": "2025-04-16",
      "id": "106763",
      "original_text": "Registerbekanntmachung nach dem Umwandlungsgesetz\nRheinland-Pfalz Amtsgericht Bad Kreuznach HRB 22787\nT.T.E. GmbH – Todenroth",
      "type": "Registerbekanntmachung nach dem Umwandlungsgesetz",
      "state": "Rheinland-Pfalz",
      "amtsgericht": "Amtsgericht Bad Kreuznach",
      "registernummer": "HRB 22787",
      "registerart": "HRB",
      "company_name": "T.T.E. GmbH",
      "company_seat": "Todenroth",
      "details": "16.04.2025 (Bekanntmachungsdatum)\n\nRheinland-Pfalz Amtsgericht Bad Kreuznach HRB 22787\nRegisterbekanntmachung nach dem Umwandlungsgesetz 16.04.2025 (Eintragungsdatum)\n\nT.T.E. GmbH\nGesellschaft mit beschränkter Haftung\nTodenroth\n\nAls nicht eingetragen wird veröffentlicht: Den Gläubigern der an der Verschmelzung beteiligten Rechtsträger ist, wenn sie binnen sechs Monaten nach dem Tag, an dem die Eintragung der Verschmelzung in das Register des Sitzes desjenigen Rechtsträgers, dessen Gläubiger sie sind, nach § 19 Abs. 3 UmwG als bekannt gemacht gilt, ihren Anspruch nach Grund und Höhe schriftlich anmelden, Sicherheit zu leisten, soweit sie nicht Befriedigung verlangen können. Dieses Recht steht den Gläubigern jedoch nur zu, wenn sie glaubhaft machen, dass durch die Verschmelzung die Erfüllung der Forderung gefährdet wird."
    },
    {
      "date": "2025-04-16",
      "id": "106764",
      "original_text": "Löschungsankündigung\nNordrhein-Westfalen Amtsgericht Gütersloh HRB 10778\nSchäfer Geschäftsführungs UG (haftungsbeschränkt) – Harsewinkel",
      "type": "Löschungsankündigung",
      "state": "Nordrhein-Westfalen",
      "amtsgericht": "Amtsgericht Gütersloh",
      "registernummer": "HRB 10778",
      "registerart": "HRB",
      "company_name": "Schäfer Geschäftsführungs UG (haftungsbeschränkt)",
      "company_seat": "Harsewinkel",
      "details": "16.04.2025 (Bekanntmachungsdatum)\n\nNordrhein-Westfalen Amtsgericht Gütersloh HRB 10778\nLöschungsankündigung 16.04.2025 (Eintragungsdatum)\n\nSchäfer Geschäftsführungs UG (haftungsbeschränkt)\nGesellschaft mit beschränkter Haftung\nHarsewinkel\n\nDas Registergericht beabsichtigt die Gesellschaft von Amts wegen nach § 394 FamFG zu löschen. Die Frist zur Erhebung eines Widerspruchs ist auf einen Monat festgesetzt."
    },
    {
      "date": "2025-04-16",
      "id": "106765",
      "original_text": "Registerbekanntmachung nach dem Umwandlungsgesetz\nNordrhein-Westfalen Amtsgericht Düsseldorf HRB 57803\nSEGRO Fünfundzwanzigste Grundbesitz GmbH – Düsseldorf",
      "type": "Registerbekanntmachung nach dem Umwandlungsgesetz",
      "state": "Nordrhein-Westfalen",
      "amtsgericht": "Amtsgericht Düsseldorf",
      "registernummer": "HRB 57803",
      "registerart": "HRB",
      "company_name": "SEGRO Fünfundzwanzigste Grundbesitz GmbH",
      "company_seat": "Düsseldorf",
      "details": "16.04.2025 (Bekanntmachungsdatum)\n\nNordrhein-Westfalen Amtsgericht Düsseldorf HRB 57803\nRegisterbekanntmachung nach dem Umwandlungsgesetz 16.04.2025 (Eintragungsdatum)\n\nSEGRO Fünfundzwanzigste Grundbesitz GmbH\nGesellschaft mit beschränkter Haftung\nDüsseldorf\n\nDen Gläubigern der an der Verschmelzung beteiligten Rechtsträger ist, wenn sie binnen sechs Monaten nach dem Tag, an dem die Eintragung der Verschmelzung in das Register des Sitzes desjenigen Rechtsträgers, dessen Gläubiger sie sind, nach § 19 Absatz 3 UmwG als bekanntgemacht gilt, ihren Anspruch nach Grund und Höhe schriftlich anmelden, Sicherheit zu leisten, soweit sie nicht Befriedigung verlangen können. Dieses Recht steht den Gläubigern jedoch nur zu, wenn sie glaubhaft machen, dass durch die Verschmelzung die Erfüllung ihrer Forderung gefährdet wird."
    },
    {
      "date": "2025-04-16",
      "id": "106766",
      "original_text": "Löschungsankündigung\nNordrhein-Westfalen Amtsgericht Duisburg HRB 35011\nBusiness Mobility GmbH – Duisburg",
      "type": "Löschungsankündigung",
      "state": "Nordrhein-Westfalen",
      "amtsgericht": "Amtsgericht Duisburg",
      "registernummer": "HRB 35011",
      "registerart": "HRB",
      "company_name": "Business Mobility GmbH",
      "company_seat": "Duisburg",
      "details": "16.04.2025 (Bekanntmachungsdatum)\n\nNordrhein-Westfalen Amtsgericht Duisburg HRB 35011\nLöschungsankündigung\n\nBusiness Mobility GmbH\nGesellschaft mit beschränkter Haftung\nDuisburg\n\nDas Registergericht beabsichtigt, die im Handelsregister unter HRB 35011 eingetragene Gesellschaft Buisness Mobility GmbH  gemäß § 394 FamFG wegen Vermögenslosigkeit von Amts wegen zu löschen. Gegen diese Verfügung kann Widerspruch eingelegt werden. Die Frist zur Erhebung eines Widerspruchs gegen die beabsichtigte Löschung von Amts wegen ist auf drei Monate festgesetzt. Rechtsbehelfsbelehrung Der Widerspruch ist bei dem Amtsgericht Duisburg, Kardinal-Galen-Str. 124-132, 47058 Duisburg schriftlich in deutscher Sprache oder zur Niederschrift der Geschäftsstelle einzulegen. Der Widerspruch kann auch zur Niederschrift der Geschäftsstelle eines jeden Amtsgerichtes abgegeben werden. Die Einlegung ist auch durch Übertragung eines elektronischen Dokuments an die elektronische Poststelle des Gerichts möglich. Das elektronische Dokument muss für die Bearbeitung durch das Gericht geeignet und mit einer qualifizierten elektronischen Signatur der verantwortenden Person versehen sein oder von der verantwortenden Person signiert und auf einem sicheren Übermittlungsweg gemäß § 130 a ZPO nach näherer Maßgabe der Verordnung über die technischen Rahmenbedingungen des elektronischen Rechtsverkehrs und über das besondere elektronische Behördenpostfach (BGBl. I, S. 3803) eingereicht werden. Weitere Informationen erhalten Sie auf der Internetseite www.justiz.de <http://www.justiz.de>. Der Widerspruch muss spätestens innerhalb der gesetzten Frist bei dem Amtsgericht Duisburg eingegangen sein. Dies gilt auch dann, wenn der Widerspruch zur Niederschrift der Geschäftsstelle eines anderen Amtsgerichtes abgegeben wurde. Die Frist beginnt mit der Veröffentlichung. Fällt das Ende der Frist auf einen Sonntag, einen allgemeinen Feiertag oder Sonnabend, so endet die Frist mit Ablauf des nächsten Werktages. Der Widerspruch muss die Bezeichnung der angefochtenen Verfügung sowie die Erklärung enthalten, dass Widerspruch gegen diese Verfügung eingelegt wird. Er ist zu unterzeichnen und soll begründet werden."
    },
    {
      "date": "2025-04-16",
      "id": "106767",
      "original_text": "Registerbekanntmachung nach dem Umwandlungsgesetz\nNordrhein-Westfalen Amtsgericht Köln HRB 93303\nVartech Beteiligungs GmbH – Bergisch Gladbach",
      "type": "Registerbekanntmachung nach dem Umwandlungsgesetz",
      "state": "Nordrhein-Westfalen",
      "amtsgericht": "Amtsgericht Köln",
      "registernummer": "HRB 93303",
      "registerart": "HRB",
      "company_name": "Vartech Beteiligungs GmbH",
      "company_seat": "Bergisch Gladbach",
      "details": "16.04.2025 (Bekanntmachungsdatum)\n\nNordrhein-Westfalen Amtsgericht Köln HRB 93303\nRegisterbekanntmachung nach dem Umwandlungsgesetz 16.04.2025 (Eintragungsdatum)\n\nVartech Beteiligungs GmbH\nGesellschaft mit beschränkter Haftung\nBergisch Gladbach\n\nDen Gläubigern der an der Verschmelzung beteiligten Rechtsträger ist, wenn sie binnen sechs Monaten nach dem Tag, an dem die Eintragung der Verschmelzung in das Register des Sitzes desjenigen Rechtsträgers, dessen Gläubiger sie sind, nach § 19 Absatz 3 UmwG als bekanntgemacht gilt, ihren Anspruch nach Grund und Höhe schriftlich anmelden, Sicherheit zu leisten, soweit sie nicht Befriedigung verlangen können. Dieses Recht steht den Gläubigern jedoch nur zu, wenn sie glaubhaft machen, dass durch die Verschmelzung die Erfüllung ihrer Forderung gefährdet wird."
    },
    {
      "date": "2025-04-16",
      "id": "106768",
      "original_text": "Löschungsankündigung\nNordrhein-Westfalen Amtsgericht Wuppertal HRB 31071\nJAN-ufaktur UG (haftungsbeschränkt) – Velbert",
      "type": "Löschungsankündigung",
      "state": "Nordrhein-Westfalen",
      "amtsgericht": "Amtsgericht Wuppertal",
      "registernummer": "HRB 31071",
      "registerart": "HRB",
      "company_name": "JAN-ufaktur UG (haftungsbeschränkt)",
      "company_seat": "Velbert",
      "details": "16.04.2025 (Bekanntmachungsdatum)\n\nNordrhein-Westfalen Amtsgericht Wuppertal HRB 31071\nLöschungsankündigung 15.04.2025 (Eintragungsdatum)\n\nJAN-ufaktur UG (haftungsbeschränkt)\nGesellschaft mit beschränkter Haftung\nVelbert\n\nDas Registergericht beabsichtigt die Gesellschaft von Amts wegen nach § 394 FamFG zu löschen. Die Frist zur Erhebung eines Widerspruchs ist auf einen Monat festgesetzt."
    },
    {
      "date": "2025-04-16",
      "id": "106769",
      "original_text": "Einreichung neuer Dokumente\nNordrhein-Westfalen Amtsgericht Essen HRB 227\nWohnungsgesellschaft Ruhr-Niederrhein mbH Essen. – Essen",
      "type": "Einreichung neuer Dokumente",
      "state": "Nordrhein-Westfalen",
      "amtsgericht": "Amtsgericht Essen",
      "registernummer": "HRB 227",
      "registerart": "HRB",
      "company_name": "Wohnungsgesellschaft Ruhr-Niederrhein mbH Essen.",
      "company_seat": "Essen",
      "details": "16.04.2025 (Bekanntmachungsdatum)\n\nNordrhein-Westfalen Amtsgericht Essen HRB 227\nEinreichung neuer Dokumente\n\nWohnungsgesellschaft Ruhr-Niederrhein mbH Essen.\nGesellschaft mit beschränkter Haftung\nEssen\n\nDem Registergericht ist eine neue Liste der Mitglieder des Aufsichtsrates eingereicht worden."
    },
    {
      "date": "2025-04-16",
      "id": "106770",
      "original_text": "Registerbekanntmachung nach dem Umwandlungsgesetz\nNordrhein-Westfalen Amtsgericht Dortmund HRB 33117\nFinanz Protect GmbH – Dortmund",
      "type": "Registerbekanntmachung nach dem Umwandlungsgesetz",
      "state": "Nordrhein-Westfalen",
      "amtsgericht": "Amtsgericht Dortmund",
      "registernummer": "HRB 33117",
      "registerart": "HRB",
      "company_name": "Finanz Protect GmbH",
      "company_seat": "Dortmund",
      "details": "16.04.2025 (Bekanntmachungsdatum)\n\nNordrhein-Westfalen Amtsgericht Dortmund HRB 33117\nRegisterbekanntmachung nach dem Umwandlungsgesetz 16.04.2025 (Eintragungsdatum)\n\nFinanz Protect GmbH\nGesellschaft mit beschränkter Haftung\nDortmund\n\nDie Gesellschaft hat Gläubigern, deren Forderungen vor dieser Bekanntmachung begründet worden sind, Sicherheit zu leisten, soweit sie nicht Befriedigung verlangen können, wenn sie sich binnen sechs Monaten zu diesem Zweck melden.Den Gläubigern der an der Verschmelzung beteiligten Rechtsträger ist, wenn sie binnen sechs Monaten nach dem Tag, an dem die Eintragung der Verschmelzung in das Register des Sitzes desjenigen Rechtsträgers, dessen Gläubiger sie sind, nach § 19 Absatz 3 UmwG als bekanntgemacht gilt, ihren Anspruch nach Grund und Höhe schriftlich anmelden, Sicherheit zu leisten, soweit sie nicht Befriedigung verlangen können. Dieses Recht steht den Gläubigern jedoch nur zu, wenn sie glaubhaft machen, dass durch die Verschmelzung die Erfüllung ihrer Forderung gefährdet wird."
    },
    {
      "date": "2025-04-16",
      "id": "106771",
      "original_text": "Registerbekanntmachung nach dem Umwandlungsgesetz\nNordrhein-Westfalen Amtsgericht Essen GsR 151\nBlitstein & Wiese Real Estate eGbR – Essen",
      "type": "Registerbekanntmachung nach dem Umwandlungsgesetz",
      "state": "Nordrhein-Westfalen",
      "amtsgericht": "Amtsgericht Essen",
      "registernummer": "GsR 151",
      "registerart": "GsR",
      "company_name": "Blitstein & Wiese Real Estate eGbR",
      "company_seat": "Essen",
      "details": "16.04.2025 (Bekanntmachungsdatum)\n\nNordrhein-Westfalen Amtsgericht Essen GsR 151\nRegisterbekanntmachung nach dem Umwandlungsgesetz 16.04.2025 (Eintragungsdatum)\n\nBlitstein & Wiese Real Estate eGbR\nGesellschaft bürgerlichen Rechts\nEssen\n\nDen Gläubigern der an der formwechselnden Umwandlung beteiligten Rechtsträger ist, wenn sie binnen sechs Monaten nach dem Tag, an dem die Eintragung der formwechselnden Umwandlung in das Register des Sitzes desjenigen Rechtsträgers, dessen Gläubiger sie sind, nach § 19 Absatz 3 UmwG als bekanntgemacht gilt, ihren Anspruch nach Grund und Höhe schriftlich anmelden, Sicherheit zu leisten, soweit sie nicht Befriedigung verlangen können. Dieses Recht steht den Gläubigern jedoch nur zu, wenn sie glaubhaft machen, dass durch die formwechselnden Umwandlung die Erfüllung ihrer Forderung gefährdet wird."
    },
    {
      "date": "2025-04-16",
      "id": "106772",
      "original_text": "Einreichung neuer Dokumente\nNordrhein-Westfalen Amtsgericht Wuppertal HRB 19431\nRegiobahn Fahrbetriebsgesellschaft mit beschränkter Haftung – Mettmann",
      "type": "Einreichung neuer Dokumente",
      "state": "Nordrhein-Westfalen",
      "amtsgericht": "Amtsgericht Wuppertal",
      "registernummer": "HRB 19431",
      "registerart": "HRB",
      "company_name": "Regiobahn Fahrbetriebsgesellschaft mit beschränkter Haftung",
      "company_seat": "Mettmann",
      "details": "16.04.2025 (Bekanntmachungsdatum)\n\nNordrhein-Westfalen Amtsgericht Wuppertal HRB 19431\nEinreichung neuer Dokumente 16.04.2025 (Eintragungsdatum)\n\nRegiobahn Fahrbetriebsgesellschaft mit beschränkter Haftung\nGesellschaft mit beschränkter Haftung\nMettmann\n\nDem Registergericht ist eine neue Liste der Mitglieder des Aufsichtsrates eingereicht worden."
    },
    {
      "date": "2025-04-16",
      "id": "106773",
      "original_text": "Registerbekanntmachung nach dem Umwandlungsgesetz\nNordrhein-Westfalen Amtsgericht Düsseldorf HRB 45001\nKilian Metallverarbeitungs-Gesellschaft mit beschränkter Haftung – Langenfeld",
      "type": "Registerbekanntmachung nach dem Umwandlungsgesetz",
      "state": "Nordrhein-Westfalen",
      "amtsgericht": "Amtsgericht Düsseldorf",
      "registernummer": "HRB 45001",
      "registerart": "HRB",
      "company_name": "Kilian Metallverarbeitungs-Gesellschaft mit beschränkter Haftung",
      "company_seat": "Langenfeld",
      "details": "16.04.2025 (Bekanntmachungsdatum)\n\nNordrhein-Westfalen Amtsgericht Düsseldorf HRB 45001\nRegisterbekanntmachung nach dem Umwandlungsgesetz 16.04.2025 (Eintragungsdatum)\n\nKilian Metallverarbeitungs-Gesellschaft mit beschränkter Haftung\nGesellschaft mit beschränkter Haftung\nLangenfeld\n\nDen Gläubigern der an der Verschmelzung beteiligten Rechtsträger ist, wenn sie binnen sechs Monaten nach dem Tag, an dem die Eintragung der Verschmelzung in das Register des Sitzes desjenigen Rechtsträgers, dessen Gläubiger sie sind, nach § 19 Absatz 3 UmwG als bekanntgemacht gilt, ihren Anspruch nach Grund und Höhe schriftlich anmelden, Sicherheit zu leisten, soweit sie nicht Befriedigung verlangen können. Dieses Recht steht den Gläubigern jedoch nur zu, wenn sie glaubhaft machen, dass durch die Verschmelzung die Erfüllung ihrer Forderung gefährdet wird."
    },
    {
      "date": "2025-04-16",
      "id": "106774",
      "original_text": "Sonstige Registerbekanntmachung\nNordrhein-Westfalen Amtsgericht Mönchengladbach HRB 14397\nInstitut für Gesundheitsökonomie und Gesundheitsförderung GmbH – Hückelhoven",
      "type": "Sonstige Registerbekanntmachung",
      "state": "Nordrhein-Westfalen",
      "amtsgericht": "Amtsgericht Mönchengladbach",
      "registernummer": "HRB 14397",
      "registerart": "HRB",
      "company_name": "Institut für Gesundheitsökonomie und Gesundheitsförderung GmbH",
      "company_seat": "Hückelhoven",
      "details": "16.04.2025 (Bekanntmachungsdatum)\n\nNordrhein-Westfalen Amtsgericht Mönchengladbach HRB 14397\nSonstige Registerbekanntmachung\n\nInstitut für Gesundheitsökonomie und Gesundheitsförderung GmbH\nGesellschaft mit beschränkter Haftung\nHückelhoven\n\nInstitut für Gesundheitsökonomie und Gesundheitsförderung GmbH, Hückelhoven (Amtsgericht Mönchengladbach, HRB 14397).\nDas Registergericht beabsichtigt, die im Handelsregister eingetragene Gesellschaft gemäß § 394 Absatz 1 FamFG wegen Vermögenslosigkeit von Amts wegen zu löschen. Gegen diese Verfügung kann Widerspruch eingelegt werden. Die Frist zur Erhebung eines Widerspruchs gegen die beabsichtigte Löschung von Amts wegen ist auf drei Monate festgesetzt."
    },
    {
      "date": "2025-04-16",
      "id": "106775",
      "original_text": "Löschungsankündigung\nNordrhein-Westfalen Amtsgericht Mönchengladbach HRB 14397\nInstitut für Gesundheitsökonomie und Gesundheitsförderung GmbH – Hückelhoven",
      "type": "Löschungsankündigung",
      "state": "Nordrhein-Westfalen",
      "amtsgericht": "Amtsgericht Mönchengladbach",
      "registernummer": "HRB 14397",
      "registerart": "HRB",
      "company_name": "Institut für Gesundheitsökonomie und Gesundheitsförderung GmbH",
      "company_seat": "Hückelhoven",
      "details": "16.04.2025 (Bekanntmachungsdatum)\n\nNordrhein-Westfalen Amtsgericht Mönchengladbach HRB 14397\nLöschungsankündigung\n\nInstitut für Gesundheitsökonomie und Gesundheitsförderung GmbH\nGesellschaft mit beschränkter Haftung\nHückelhoven\n\nInstitut für Gesundheitsökonomie und Gesundheitsförderung GmbH, Hückelhoven (Amtsgericht Mönchengladbach, HRB 14397).\nDas Registergericht beabsichtigt, die im Handelsregister eingetragene Gesellschaft gemäß § 394 Absatz 1 FamFG wegen Vermögenslosigkeit von Amts wegen zu löschen. Gegen diese Verfügung kann Widerspruch eingelegt werden. Die Frist zur Erhebung eines Widerspruchs gegen die beabsichtigte Löschung von Amts wegen ist auf drei Monate festgesetzt."
    },
    {
      "date": "2025-04-16",
      "id": "106776",
      "original_text": "Löschungsankündigung\nNordrhein-Westfalen Amtsgericht Aachen VR 6191\nDobermann-Rettung e.V. – Roetgen",
      "type": "Löschungsankündigung",
      "state": "Nordrhein-Westfalen",
      "amtsgericht": "Amtsgericht Aachen",
      "registernummer": "VR 6191",
      "registerart": "VR",
      "company_name": "Dobermann-Rettung e.V.",
      "company_seat": "Roetgen",
      "details": "16.04.2025 (Bekanntmachungsdatum)\n\nNordrhein-Westfalen Amtsgericht Aachen VR 6191\nLöschungsankündigung\n\nDobermann-Rettung e.V.\neingetragener Verein\nRoetgen\n\nDas Registergericht beabsichtigt, von Amts wegen folgende Eintragung wegen Unzulässigkeit nach § 395 FamFG zu löschen:\n\nEintragung der 1. Vorsitzenden May-Britt Busch\n\nZur Geltendmachung des Widerspruchs gegen die beabsichtigte Löschung wird hiermit eine Frist von einem Monat ab Veröffentlichung dieser Ankündigung bestimmt.\n\nRechtsbehelfsbelehrung:\n\nGegen diese Verfügung kann Widerspruch eingelegt werden. Zum Widerspruch ist jeder berechtigt, der an der Unterlassung der Löschung ein berechtigtes Interesse hat.\n\nDer Widerspruch ist bei dem Amtsgericht Aachen, Adalbertsteinweg 92, 52070 Aachen schriftlich in deutscher Sprache oder zur Niederschrift der Geschäftsstelle einzulegen. Der Widerspruch kann auch zur Niederschrift der Geschäftsstelle eines jeden Amtsgerichtes abgegeben werden.\n\nDer Widerspruch muss spätestens innerhalb der gesetzten Frist nach der Bekanntgabe der Verfügung bei dem Amtsgericht Aachen eingegangen sein. Dies gilt auch dann, wenn der Widerspruch zur Niederschrift der Geschäftsstelle eines anderen Amtsgerichtes abgegeben wurde. Die Frist beginnt mit der Bekanntgabe der Verfügung durch Veröffentlichung. Fällt das Ende der Frist auf einen Sonntag, einen allgemeinen Feiertag oder Sonnabend, so endet die Frist mit Ablauf des nächsten Werktages.\n\nDer Widerspruch muss die Bezeichnung der angefochtenen Verfügung sowie die Erklärung enthalten, dass Widerspruch gegen diese Verfügung eingelegt wird. Er ist zu unterzeichnen und soll begründet werden.\n\nDie Einlegung ist auch durch Übertragung eines elektronischen Dokuments an die elektronische Poststelle des Gerichts möglich. Das elektronische Dokument muss für die Bearbeitung durch das Gericht geeignet und mit einer qualifizierten elektronischen Signatur der verantwortenden Person versehen sein oder von der verantwortenden Person signiert und auf einem sicheren Übermittlungsweg gemäß § 130 a ZPO nach näherer Maßgabe der Verordnung über die technischen Rahmenbedingungen des elektronischen Rechtsverkehrs und über das besondere elektronische Behördenpostfach (BGBl. I, S. 3803) eingereicht werden. Weitere Informationen erhalten Sie auf der Internetseite www.justiz.de."
    },
    {
      "date": "2025-04-16",
      "id": "106777",
      "original_text": "Löschungsankündigung\nNordrhein-Westfalen Amtsgericht Gelsenkirchen HRB 15632\nAMS PLus GmbH – Bottrop",
      "type": "Löschungsankündigung",
      "state": "Nordrhein-Westfalen",
      "amtsgericht": "Amtsgericht Gelsenkirchen",
      "registernummer": "HRB 15632",
      "registerart": "HRB",
      "company_name": "AMS PLus GmbH",
      "company_seat": "Bottrop",
      "details": "16.04.2025 (Bekanntmachungsdatum)\n\nNordrhein-Westfalen Amtsgericht Gelsenkirchen HRB 15632\nLöschungsankündigung\n\nAMS PLus GmbH\nGesellschaft mit beschränkter Haftung\nBottrop\n\nDas Gericht beabsichtigt, die Gesellschaft AMS Plus GmbH mit Sitz in Bottrop, HRB 15632 Amtsgericht Gelsenkirchen, wegen Vermögenslosigkeit zu löschen.\nHiermit wird denjenigen, die an der Unterlassung der Löschung ein berechtigtes Interesse haben, gem. § 394 Abs. 2 FamFG Gelegenheit gegeben, gegen dieses Vorhaben binnen eines Monats nach dieser Bekanntmachung Widerspruch einzulegen. Der Widerspruch kann schriftlich oder zu Protokoll der Geschäftsstelle erhoben werden."
    },
    {
      "date": "2025-04-16",
      "id": "106778",
      "original_text": "Einreichung neuer Dokumente\nNordrhein-Westfalen Amtsgericht Essen HRB 24353\nRWE Generation SE – Essen",
      "type": "Einreichung neuer Dokumente",
      "state": "Nordrhein-Westfalen",
      "amtsgericht": "Amtsgericht Essen",
      "registernummer": "HRB 24353",
      "registerart": "HRB",
      "company_name": "RWE Generation SE",
      "company_seat": "Essen",
      "details": "16.04.2025 (Bekanntmachungsdatum)\n\nNordrhein-Westfalen Amtsgericht Essen HRB 24353\nEinreichung neuer Dokumente\n\nRWE Generation SE\nEuropäische Aktiengesellschaft (SE)\nEssen\n\nDem Registergericht ist eine neue Liste der Mitglieder des Aufsichtsrates eingereicht worden."
    },
    {
      "date": "2025-04-16",
      "id": "106779",
      "original_text": "Einreichung neuer Dokumente\nNordrhein-Westfalen Amtsgericht Essen HRB 28810\nRAG AKTIENGESELLSCHAFT – Essen",
      "type": "Einreichung neuer Dokumente",
      "state": "Nordrhein-Westfalen",
      "amtsgericht": "Amtsgericht Essen",
      "registernummer": "HRB 28810",
      "registerart": "HRB",
      "company_name": "RAG AKTIENGESELLSCHAFT",
      "company_seat": "Essen",
      "details": "16.04.2025 (Bekanntmachungsdatum)\n\nNordrhein-Westfalen Amtsgericht Essen HRB 28810\nEinreichung neuer Dokumente\n\nRAG AKTIENGESELLSCHAFT\nAktiengesellschaft\nEssen\n\nDem Registergericht ist eine neue Liste der Mitglieder des Aufsichtsrates eingereicht worden."
    },
    {
      "date": "2025-04-16",
      "id": "106780",
      "original_text": "Einreichung neuer Dokumente\nNordrhein-Westfalen Amtsgericht Köln HRB 32677\nDSGF Deutsche Servicegesellschaft für Finanzdienstleister mbH – Köln",
      "type": "Einreichung neuer Dokumente",
      "state": "Nordrhein-Westfalen",
      "amtsgericht": "Amtsgericht Köln",
      "registernummer": "HRB 32677",
      "registerart": "HRB",
      "company_name": "DSGF Deutsche Servicegesellschaft für Finanzdienstleister mbH",
      "company_seat": "Köln",
      "details": "16.04.2025 (Bekanntmachungsdatum)\n\nNordrhein-Westfalen Amtsgericht Köln HRB 32677\nEinreichung neuer Dokumente\n\nDSGF Deutsche Servicegesellschaft für Finanzdienstleister mbH\nGesellschaft mit beschränkter Haftung\nKöln\n\nDem Registergericht ist eine Liste der Mitglieder des Aufsichtsrates eingereicht worden."
    },
    {
      "date": "2025-04-16",
      "id": "106781",
      "original_text": "Löschungsankündigung\nNordrhein-Westfalen Amtsgericht Wuppertal HRA 25629\nKSL Service & Logistik GmbH & Co. KG – Wuppertal",
      "type": "Löschungsankündigung",
      "state": "Nordrhein-Westfalen",
      "amtsgericht": "Amtsgericht Wuppertal",
      "registernummer": "HRA 25629",
      "registerart": "HRA",
      "company_name": "KSL Service & Logistik GmbH & Co. KG",
      "company_seat": "Wuppertal",
      "details": "16.04.2025 (Bekanntmachungsdatum)\n\nNordrhein-Westfalen Amtsgericht Wuppertal HRA 25629\nLöschungsankündigung\n\nKSL Service & Logistik GmbH & Co. KG\nKommanditgesellschaft\nWuppertal\n\nDas Registergericht beabsichtigt die Firma von Amts wegen nach § 394 FamFG zu löschen. Die Frist zur Erhebung eines Widerspruchs ist auf zwei Monate festgesetzt."
    },
    {
      "date": "2025-04-16",
      "id": "106782",
      "original_text": "Löschungsankündigung\nNordrhein-Westfalen Amtsgericht Wuppertal HRA 25629\nKSL Service & Logistik GmbH & Co. KG – Wuppertal",
      "type": "Löschungsankündigung",
      "state": "Nordrhein-Westfalen",
      "amtsgericht": "Amtsgericht Wuppertal",
      "registernummer": "HRA 25629",
      "registerart": "HRA",
      "company_name": "KSL Service & Logistik GmbH & Co. KG",
      "company_seat": "Wuppertal",
      "details": "16.04.2025 (Bekanntmachungsdatum)\n\nNordrhein-Westfalen Amtsgericht Wuppertal HRA 25629\nLöschungsankündigung\n\nKSL Service & Logistik GmbH & Co. KG\nKommanditgesellschaft\nWuppertal\n\nDas Registergericht beabsichtigt die Firma von Amts wegen nach § 394 FamFG zu löschen. Die Frist zur Erhebung eines Widerspruchs ist auf zwei Monate festgesetzt."
    },
    {
      "date": "2025-04-16",
      "id": "106783",
      "original_text": "Löschungsankündigung\nNordrhein-Westfalen Amtsgericht Krefeld HRB 14949\nWilhelm Gruyters GmbH – Krefeld",
      "type": "Löschungsankündigung",
      "state": "Nordrhein-Westfalen",
      "amtsgericht": "Amtsgericht Krefeld",
      "registernummer": "HRB 14949",
      "registerart": "HRB",
      "company_name": "Wilhelm Gruyters GmbH",
      "company_seat": "Krefeld",
      "details": "16.04.2025 (Bekanntmachungsdatum)\n\nNordrhein-Westfalen Amtsgericht Krefeld HRB 14949\nLöschungsankündigung\n\nWilhelm Gruyters GmbH\nGesellschaft mit beschränkter Haftung\nKrefeld\n\nDas Registergericht beabsichtigt die Gesellschaft von Amts wegen nach § 394 FamFG zu löschen. Die Frist zur Erhebung eines Widerspruchs ist auf einen Monat festgesetzt."
    },
    {
      "date": "2025-04-16",
      "id": "106784",
      "original_text": "Registerbekanntmachung nach dem Umwandlungsgesetz\nNordrhein-Westfalen Amtsgericht Düsseldorf HRB 84405\nProjektentwicklung Michaelkirchstraße in Berlin GmbH – Düsseldorf",
      "type": "Registerbekanntmachung nach dem Umwandlungsgesetz",
      "state": "Nordrhein-Westfalen",
      "amtsgericht": "Amtsgericht Düsseldorf",
      "registernummer": "HRB 84405",
      "registerart": "HRB",
      "company_name": "Projektentwicklung Michaelkirchstraße in Berlin GmbH",
      "company_seat": "Düsseldorf",
      "details": "16.04.2025 (Bekanntmachungsdatum)\n\nNordrhein-Westfalen Amtsgericht Düsseldorf HRB 84405\nRegisterbekanntmachung nach dem Umwandlungsgesetz 16.04.2025 (Eintragungsdatum)\n\nProjektentwicklung Michaelkirchstraße in Berlin GmbH\nGesellschaft mit beschränkter Haftung\nDüsseldorf\n\nDen Gläubigern der an der Abspaltung beteiligten Rechtsträger ist, wenn sie binnen sechs Monaten nach dem Tag, an dem die Eintragung der Abspaltung in das Register des Sitzes desjenigen Rechtsträgers, dessen Gläubiger sie sind, nach § 19 Absatz 3 UmwG als bekanntgemacht gilt, ihren Anspruch nach Grund und Höhe schriftlich anmelden, Sicherheit zu leisten, soweit sie nicht Befriedigung verlangen können. Dieses Recht steht den Gläubigern jedoch nur zu, wenn sie glaubhaft machen, dass durch die Abspaltung die Erfüllung ihrer Forderung gefährdet wird."
    },
    {
      "date": "2025-04-16",
      "id": "106785",
      "original_text": "Einreichung neuer Dokumente\nNordrhein-Westfalen Amtsgericht Arnsberg HRB 2366\nburgbad Aktiengesellschaft – Schmallenberg",
      "type": "Einreichung neuer Dokumente",
      "state": "Nordrhein-Westfalen",
      "amtsgericht": "Amtsgericht Arnsberg",
      "registernummer": "HRB 2366",
      "registerart": "HRB",
      "company_name": "burgbad Aktiengesellschaft",
      "company_seat": "Schmallenberg",
      "details": "16.04.2025 (Bekanntmachungsdatum)\n\nNordrhein-Westfalen Amtsgericht Arnsberg HRB 2366\nEinreichung neuer Dokumente\n\nburgbad Aktiengesellschaft\nAktiengesellschaft\nSchmallenberg\n\nDem Registergericht ist eine Liste der Mitglieder des Aufsichtsrates eingereicht worden."
    },
    {
      "date": "2025-04-16",
      "id": "106786",
      "original_text": "Löschungsankündigung\nNordrhein-Westfalen Amtsgericht Krefeld HRB 13308\nOMG Entertainment GmbH – Nettetal",
      "type": "Löschungsankündigung",
      "state": "Nordrhein-Westfalen",
      "amtsgericht": "Amtsgericht Krefeld",
      "registernummer": "HRB 13308",
      "registerart": "HRB",
      "company_name": "OMG Entertainment GmbH",
      "company_seat": "Nettetal",
      "details": "16.04.2025 (Bekanntmachungsdatum)\n\nNordrhein-Westfalen Amtsgericht Krefeld HRB 13308\nLöschungsankündigung\n\nOMG Entertainment GmbH\nGesellschaft mit beschränkter Haftung\nNettetal\n\nDas Registergericht beabsichtigt die Gesellschaft von Amts wegen nach § 394 FamFG zu löschen. Die Frist zur Erhebung eines Widerspruchs ist auf einen Monat festgesetzt."
    },
    {
      "date": "2025-04-16",
      "id": "106787",
      "original_text": "Löschungsankündigung\nNordrhein-Westfalen Amtsgericht Bonn HRB 16418\nRaiKo GmbH – Meckenheim",
      "type": "Löschungsankündigung",
      "state": "Nordrhein-Westfalen",
      "amtsgericht": "Amtsgericht Bonn",
      "registernummer": "HRB 16418",
      "registerart": "HRB",
      "company_name": "RaiKo GmbH",
      "company_seat": "Meckenheim",
      "details": "16.04.2025 (Bekanntmachungsdatum)\n\nNordrhein-Westfalen Amtsgericht Bonn HRB 16418\nLöschungsankündigung\n\nRaiKo GmbH\nGesellschaft mit beschränkter Haftung\nMeckenheim\n\nDas Registergericht beabsichtigt die im Handelsregister beim Amtsgericht in Bonn in Abt. B unter Nr. 16418 eingetragene Gesellschaft Raiko GmbH mit Sitz in Meckenheim  von Amts wegen nach § 394 FamFG zu löschen. Die Frist zur Erhebung eines Widerspruchs ist auf einen Monat festgesetzt."
    },
    {
      "date": "2025-04-16",
      "id": "106788",
      "original_text": "Einreichung neuer Dokumente\nNordrhein-Westfalen Amtsgericht Düsseldorf HRB 562\nRheinbahn AG – Düsseldorf",
      "type": "Einreichung neuer Dokumente",
      "state": "Nordrhein-Westfalen",
      "amtsgericht": "Amtsgericht Düsseldorf",
      "registernummer": "HRB 562",
      "registerart": "HRB",
      "company_name": "Rheinbahn AG",
      "company_seat": "Düsseldorf",
      "details": "16.04.2025 (Bekanntmachungsdatum)\n\nNordrhein-Westfalen Amtsgericht Düsseldorf HRB 562\nEinreichung neuer Dokumente\n\nRheinbahn AG\nAktiengesellschaft\nDüsseldorf\n\nDem Registergericht ist eine Liste der Mitglieder des Aufsichtsrates eingereicht worden."
    },
    {
      "date": "2025-04-16",
      "id": "106789",
      "original_text": "Registerbekanntmachung nach dem Umwandlungsgesetz\nNordrhein-Westfalen Amtsgericht Düsseldorf HRB 74826\nAguettant Deutschland GmbH – Langenfeld",
      "type": "Registerbekanntmachung nach dem Umwandlungsgesetz",
      "state": "Nordrhein-Westfalen",
      "amtsgericht": "Amtsgericht Düsseldorf",
      "registernummer": "HRB 74826",
      "registerart": "HRB",
      "company_name": "Aguettant Deutschland GmbH",
      "company_seat": "Langenfeld",
      "details": "16.04.2025 (Bekanntmachungsdatum)\n\nNordrhein-Westfalen Amtsgericht Düsseldorf HRB 74826\nRegisterbekanntmachung nach dem Umwandlungsgesetz 16.04.2025 (Eintragungsdatum)\n\nAguettant Deutschland GmbH\nGesellschaft mit beschränkter Haftung\nLangenfeld\n\nDen Gläubigern der an der Verschmelzung beteiligten Rechtsträger ist, wenn sie binnen sechs Monaten nach dem Tag, an dem die Eintragung der Verschmelzung in das Register des Sitzes desjenigen Rechtsträgers, dessen Gläubiger sie sind, nach § 19 Absatz 3 UmwG als bekanntgemacht gilt, ihren Anspruch nach Grund und Höhe schriftlich anmelden, Sicherheit zu leisten, soweit sie nicht Befriedigung verlangen können. Dieses Recht steht den Gläubigern jedoch nur zu, wenn sie glaubhaft machen, dass durch die Verschmelzung die Erfüllung ihrer Forderung gefährdet wird."
    },
    {
      "date": "2025-04-16",
      "id": "106790",
      "original_text": "Löschungsankündigung\nNordrhein-Westfalen Amtsgericht Wuppertal HRB 24948\nRat-Getränke GmbH – Mettmann",
      "type": "Löschungsankündigung",
      "state": "Nordrhein-Westfalen",
      "amtsgericht": "Amtsgericht Wuppertal",
      "registernummer": "HRB 24948",
      "registerart": "HRB",
      "company_name": "Rat-Getränke GmbH",
      "company_seat": "Mettmann",
      "details": "16.04.2025 (Bekanntmachungsdatum)\n\nNordrhein-Westfalen Amtsgericht Wuppertal HRB 24948\nLöschungsankündigung 15.04.2025 (Eintragungsdatum)\n\nRat-Getränke GmbH\nGesellschaft mit beschränkter Haftung\nMettmann\n\nDas Registergericht beabsichtigt die Gesellschaft von Amts wegen nach § 394 FamFG zu löschen. Die Frist zur Erhebung eines Widerspruchs ist auf einen Monat festgesetzt."
    },
    {
      "date": "2025-04-16",
      "id": "106791",
      "original_text": "Registerbekanntmachung nach dem Umwandlungsgesetz\nNordrhein-Westfalen Amtsgericht Köln VR 20202\nJama Nyeta e.V. - Gemeinsam entwickeln - Unterstützen - Neues schaffen – Köln",
      "type": "Registerbekanntmachung nach dem Umwandlungsgesetz",
      "state": "Nordrhein-Westfalen",
      "amtsgericht": "Amtsgericht Köln",
      "registernummer": "VR 20202",
      "registerart": "VR",
      "company_name": "Jama Nyeta e.V. - Gemeinsam entwickeln - Unterstützen - Neues schaffen",
      "company_seat": "Köln",
      "details": "16.04.2025 (Bekanntmachungsdatum)\n\nNordrhein-Westfalen Amtsgericht Köln VR 20202\nRegisterbekanntmachung nach dem Umwandlungsgesetz 16.04.2025 (Eintragungsdatum)\n\nJama Nyeta e.V. - Gemeinsam entwickeln - Unterstützen - Neues schaffen\neingetragener Verein\nKöln\n\nDen Gläubigern der an der formwechselnden Umwandlung beteiligten Rechtsträger ist, wenn sie binnen sechs Monaten nach dem Tag, an dem die Eintragung der formwechselnden Umwandlung in das Register des Sitzes desjenigen Rechtsträgers, dessen Gläubiger sie sind, nach § 19 Absatz 3 UmwG als bekanntgemacht gilt, ihren Anspruch nach Grund und Höhe schriftlich anmelden, Sicherheit zu leisten, soweit sie nicht Befriedigung verlangen können. Dieses Recht steht den Gläubigern jedoch nur zu, wenn sie glaubhaft machen, dass durch die formwechselnden Umwandlung die Erfüllung ihrer Forderung gefährdet wird."
    },
    {
      "date": "2025-04-16",
      "id": "106792",
      "original_text": "Registerbekanntmachung nach dem Umwandlungsgesetz\nNordrhein-Westfalen Amtsgericht Köln HRB 47408\nFK Beteiligungs-GmbH – Bergisch Gladbach",
      "type": "Registerbekanntmachung nach dem Umwandlungsgesetz",
      "state": "Nordrhein-Westfalen",
      "amtsgericht": "Amtsgericht Köln",
      "registernummer": "HRB 47408",
      "registerart": "HRB",
      "company_name": "FK Beteiligungs-GmbH",
      "company_seat": "Bergisch Gladbach",
      "details": "16.04.2025 (Bekanntmachungsdatum)\n\nNordrhein-Westfalen Amtsgericht Köln HRB 47408\nRegisterbekanntmachung nach dem Umwandlungsgesetz 16.04.2025 (Eintragungsdatum)\n\nFK Beteiligungs-GmbH\nGesellschaft mit beschränkter Haftung\nBergisch Gladbach\n\nDen Gläubigern der an der Verschmelzung beteiligten Rechtsträger ist, wenn sie binnen sechs Monaten nach dem Tag, an dem die Eintragung der Verschmelzung in das Register des Sitzes desjenigen Rechtsträgers, dessen Gläubiger sie sind, nach § 19 Absatz 3 UmwG als bekanntgemacht gilt, ihren Anspruch nach Grund und Höhe schriftlich anmelden, Sicherheit zu leisten, soweit sie nicht Befriedigung verlangen können. Dieses Recht steht den Gläubigern jedoch nur zu, wenn sie glaubhaft machen, dass durch die Verschmelzung die Erfüllung ihrer Forderung gefährdet wird."
    },
    {
      "date": "2025-04-16",
      "id": "106793",
      "original_text": "Löschungsankündigung\nNordrhein-Westfalen Amtsgericht Krefeld HRB 11667\nREW Real Estate Willich Verwaltungs-GmbH – Willich",
      "type": "Löschungsankündigung",
      "state": "Nordrhein-Westfalen",
      "amtsgericht": "Amtsgericht Krefeld",
      "registernummer": "HRB 11667",
      "registerart": "HRB",
      "company_name": "REW Real Estate Willich Verwaltungs-GmbH",
      "company_seat": "Willich",
      "details": "16.04.2025 (Bekanntmachungsdatum)\n\nNordrhein-Westfalen Amtsgericht Krefeld HRB 11667\nLöschungsankündigung\n\nREW Real Estate Willich Verwaltungs-GmbH\nGesellschaft mit beschränkter Haftung\nWillich\n\nDas Registergericht beabsichtigt die Gesellschaft von Amts wegen nach § 394 FamFG zu löschen. Die Frist zur Erhebung eines Widerspruchs ist auf einen Monat festgesetzt."
    },
    {
      "date": "2025-04-16",
      "id": "106794",
      "original_text": "Löschungsankündigung\nNordrhein-Westfalen Amtsgericht Hamm HRB 7352\nB. R. Wenzel-Personal-Service-GmbH – Hamm",
      "type": "Löschungsankündigung",
      "state": "Nordrhein-Westfalen",
      "amtsgericht": "Amtsgericht Hamm",
      "registernummer": "HRB 7352",
      "registerart": "HRB",
      "company_name": "B. R. Wenzel-Personal-Service-GmbH",
      "company_seat": "Hamm",
      "details": "16.04.2025 (Bekanntmachungsdatum)\n\nNordrhein-Westfalen Amtsgericht Hamm HRB 7352\nLöschungsankündigung\n\nB. R. Wenzel-Personal-Service-GmbH\nGesellschaft mit beschränkter Haftung\nHamm\n\nDas Registergericht beabsichtigt die Gesellschaft von Amts wegen nach § 394 FamFG zu löschen. Die Frist zur Erhebung eines Widerspruchs ist auf drei Monate festgesetzt."
    },
    {
      "date": "2025-04-16",
      "id": "106795",
      "original_text": "Registerbekanntmachung nach dem Umwandlungsgesetz\nNordrhein-Westfalen Amtsgericht Dortmund HRB 27526\nbineos GmbH – Dortmund",
      "type": "Registerbekanntmachung nach dem Umwandlungsgesetz",
      "state": "Nordrhein-Westfalen",
      "amtsgericht": "Amtsgericht Dortmund",
      "registernummer": "HRB 27526",
      "registerart": "HRB",
      "company_name": "bineos GmbH",
      "company_seat": "Dortmund",
      "details": "16.04.2025 (Bekanntmachungsdatum)\n\nNordrhein-Westfalen Amtsgericht Dortmund HRB 27526\nRegisterbekanntmachung nach dem Umwandlungsgesetz 16.04.2025 (Eintragungsdatum)\n\nbineos GmbH\nGesellschaft mit beschränkter Haftung\nDortmund\n\nDen Gläubigern der an der Verschmelzung beteiligten Rechtsträger ist, wenn sie binnen sechs Monaten nach dem Tag, an dem die Eintragung der Verschmelzung in das Register des Sitzes desjenigen Rechtsträgers, dessen Gläubiger sie sind, nach § 19 Absatz 3 UmwG als bekanntgemacht gilt, ihren Anspruch nach Grund und Höhe schriftlich anmelden, Sicherheit zu leisten, soweit sie nicht Befriedigung verlangen können. Dieses Recht steht den Gläubigern jedoch nur zu, wenn sie glaubhaft machen, dass durch die Verschmelzung die Erfüllung ihrer Forderung gefährdet wird."
    },
    {
      "date": "2025-04-16",
      "id": "106796",
      "original_text": "Registerbekanntmachung nach dem Umwandlungsgesetz\nNordrhein-Westfalen Amtsgericht Bochum HRB 18643\nIT-Systemhaus Ruhrgebiet GmbH – Witten",
      "type": "Registerbekanntmachung nach dem Umwandlungsgesetz",
      "state": "Nordrhein-Westfalen",
      "amtsgericht": "Amtsgericht Bochum",
      "registernummer": "HRB 18643",
      "registerart": "HRB",
      "company_name": "IT-Systemhaus Ruhrgebiet GmbH",
      "company_seat": "Witten",
      "details": "16.04.2025 (Bekanntmachungsdatum)\n\nNordrhein-Westfalen Amtsgericht Bochum HRB 18643\nRegisterbekanntmachung nach dem Umwandlungsgesetz 15.04.2025 (Eintragungsdatum)\n\nIT-Systemhaus Ruhrgebiet GmbH\nGesellschaft mit beschränkter Haftung\nWitten\n\nDen Gläubigern der an der Verschmelzung beteiligten Rechtsträger ist, wenn sie binnen sechs Monaten nach dem Tag, an dem die Eintragung der Verschmelzung in das Register des Sitzes derjenigen Rechtsträger deren Gläubiger sie sind, nach § 19 Absatz 3 UmwG als bekanntgemacht gilt, ihren Anspruch nach Grund und Höhe schriftlich anmelden, Sicherheit zu leisten, soweit sie nicht Befriedigung verlangen können. Dieses Recht steht den Gläubigern jedoch nur zu, wenn sie glaubhaft machen, dass durch die Verschmelzung die Erfüllung ihrer Forderung gefährdet wird."
    },
    {
      "date": "2025-04-16",
      "id": "106797",
      "original_text": "Löschungsankündigung\nNordrhein-Westfalen Amtsgericht Bonn HRB 22943\nGodesberger Gebrauchtwagenhandel UG (haftungsbeschränkt) – Bonn",
      "type": "Löschungsankündigung",
      "state": "Nordrhein-Westfalen",
      "amtsgericht": "Amtsgericht Bonn",
      "registernummer": "HRB 22943",
      "registerart": "HRB",
      "company_name": "Godesberger Gebrauchtwagenhandel UG (haftungsbeschränkt)",
      "company_seat": "Bonn",
      "details": "16.04.2025 (Bekanntmachungsdatum)\n\nNordrhein-Westfalen Amtsgericht Bonn HRB 22943\nLöschungsankündigung\n\nGodesberger Gebrauchtwagenhandel UG (haftungsbeschränkt)\nGesellschaft mit beschränkter Haftung\nBonn\n\nDas Registergericht beabsichtigt die im Handelsregister beim Amtsgericht in Bonn unter HRB 22932 eingetragene Gesellschaft Godesberger Gebrauchtwagenhandel UG (haftungsbeschränkt) mit Sitz in Bonn von Amts wegen nach § 394 FamFG zu löschen. Die Frist zur Erhebung eines Widerspruchs ist auf einen Monat festgesetzt."
    },
    {
      "date": "2025-04-16",
      "id": "106798",
      "original_text": "Registerbekanntmachung nach dem Umwandlungsgesetz\nNordrhein-Westfalen Amtsgericht Bonn HRB 25448\nHarbour Litigation Funding GmbH – Bonn",
      "type": "Registerbekanntmachung nach dem Umwandlungsgesetz",
      "state": "Nordrhein-Westfalen",
      "amtsgericht": "Amtsgericht Bonn",
      "registernummer": "HRB 25448",
      "registerart": "HRB",
      "company_name": "Harbour Litigation Funding GmbH",
      "company_seat": "Bonn",
      "details": "16.04.2025 (Bekanntmachungsdatum)\n\nNordrhein-Westfalen Amtsgericht Bonn HRB 25448\nRegisterbekanntmachung nach dem Umwandlungsgesetz 16.04.2025 (Eintragungsdatum)\n\nHarbour Litigation Funding GmbH\nGesellschaft mit beschränkter Haftung\nBonn\n\nDen Gläubigern der an der Verschmelzung beteiligten Rechtsträger ist, wenn sie binnen sechs Monaten nach dem Tag, an dem die Eintragung der Verschmelzung in das Register des Sitzes desjenigen Rechtsträgers, dessen Gläubiger sie sind, nach § 19 Absatz 3 UmwG als bekanntgemacht gilt, ihren Anspruch nach Grund und Höhe schriftlich anmelden, Sicherheit zu leisten, soweit sie nicht Befriedigung verlangen können. Dieses Recht steht den Gläubigern jedoch nur zu, wenn sie glaubhaft machen, dass durch die Verschmelzung die Erfüllung ihrer Forderung gefährdet wird."
    },
    {
      "date": "2025-04-16",
      "id": "106799",
      "original_text": "Löschungsankündigung\nThüringen Amtsgericht Jena HRB 509664\nEuro-Montage-Company GmbH – Hildburghausen",
      "type": "Löschungsankündigung",
      "state": "Thüringen",
      "amtsgericht": "Amtsgericht Jena",
      "registernummer": "HRB 509664",
      "registerart": "HRB",
      "company_name": "Euro-Montage-Company GmbH",
      "company_seat": "Hildburghausen",
      "details": "16.04.2025 (Bekanntmachungsdatum)\n\nThüringen Amtsgericht Jena HRB 509664\nLöschungsankündigung\n\nEuro-Montage-Company GmbH\nGesellschaft mit beschränkter Haftung\nHildburghausen\n\nDas Registergericht beabsichtigt, die im Handelsregister eingetragene Gesellschaft wegen Vermögenslosigkeit nach § 394 FamFG von Amts wegen zu löschen. Die Frist zur Erhebung eines Widerspruchs gegen die beabsichtigte Löschung wird auf 6 Wochen festgesetzt."
    },
    {
      "date": "2025-04-16",
      "id": "106800",
      "original_text": "Sonstige Registerbekanntmachung\nHessen Amtsgericht Fulda HRB 2294\nKlinikum Fulda gAG – Fulda",
      "type": "Sonstige Registerbekanntmachung",
      "state": "Hessen",
      "amtsgericht": "Amtsgericht Fulda",
      "registernummer": "HRB 2294",
      "registerart": "HRB",
      "company_name": "Klinikum Fulda gAG",
      "company_seat": "Fulda",
      "details": "16.04.2025 (Bekanntmachungsdatum)\n\nHessen Amtsgericht Fulda HRB 2294\nSonstige Registerbekanntmachung\n\nKlinikum Fulda gAG\nAktiengesellschaft\nFulda\n\nDurch eine Änderung in den Personen der Aufsichtsratsmitglieder ist eine Liste der Mitglieder des Aufsichtsrates zum Handelsregister eingereicht worden."
    },
    {
      "date": "2025-04-16",
      "id": "106801",
      "original_text": "Sonstige Registerbekanntmachung\nHessen Amtsgericht Fritzlar VR 3749\nVaterhausgemeinschaft e.V. – Fritzlar",
      "type": "Sonstige Registerbekanntmachung",
      "state": "Hessen",
      "amtsgericht": "Amtsgericht Fritzlar",
      "registernummer": "VR 3749",
      "registerart": "VR",
      "company_name": "Vaterhausgemeinschaft e.V.",
      "company_seat": "Fritzlar",
      "details": "16.04.2025 (Bekanntmachungsdatum)\n\nHessen Amtsgericht Fritzlar VR 3749\nSonstige Registerbekanntmachung 16.04.2025 (Eintragungsdatum)\n\nVaterhausgemeinschaft e.V.\neingetragener Verein\nFritzlar\n\nDer Verein ist aufgelöst."
    },
    {
      "date": "2025-04-16",
      "id": "106802",
      "original_text": "Registerbekanntmachung nach dem Umwandlungsgesetz\nHessen Amtsgericht Marburg HRB 4345\nAutohaus Rasner GmbH – Schwalmstadt-Treysa",
      "type": "Registerbekanntmachung nach dem Umwandlungsgesetz",
      "state": "Hessen",
      "amtsgericht": "Amtsgericht Marburg",
      "registernummer": "HRB 4345",
      "registerart": "HRB",
      "company_name": "Autohaus Rasner GmbH",
      "company_seat": "Schwalmstadt-Treysa",
      "details": "16.04.2025 (Bekanntmachungsdatum)\n\nHessen Amtsgericht Marburg HRB 4345\nRegisterbekanntmachung nach dem Umwandlungsgesetz 16.04.2025 (Eintragungsdatum)\n\nAutohaus Rasner GmbH\nGesellschaft mit beschränkter Haftung\nSchwalmstadt-Treysa\n\nDen Gläubigern der an der Verschmelzung beteiligten Rechtsträger ist, wenn sie binnen sechs Monaten nach dem Tag, an dem die Eintragung der Verschmelzung in das Register des Sitzes desjenigen Rechtsträgers, dessen Gläubiger sie sind, nach § 19 Absatz 3 UmwG bekannt gemacht worden ist, ihren Anspruch nach Grund und Höhe schriftlich anmelden, Sicherheit zu leisten, soweit sie nicht Befriedigung verlangen können. Dieses Recht steht den Gläubigern jedoch nur zu, wenn sie glaubhaft machen, dass durch die Verschmelzung die Erfüllung ihrer Forderung gefährdet wird."
    },
    {
      "date": "2025-04-16",
      "id": "106803",
      "original_text": "Löschungsankündigung\nHessen Amtsgericht Frankfurt am Main HRB 107168\nCitic Dicastal GmbH – Frankfurt am Main",
      "type": "Löschungsankündigung",
      "state": "Hessen",
      "amtsgericht": "Amtsgericht Frankfurt am Main",
      "registernummer": "HRB 107168",
      "registerart": "HRB",
      "company_name": "Citic Dicastal GmbH",
      "company_seat": "Frankfurt am Main",
      "details": "16.04.2025 (Bekanntmachungsdatum)\n\nHessen Amtsgericht Frankfurt am Main HRB 107168\nLöschungsankündigung 16.04.2025 (Eintragungsdatum)\n\nCitic Dicastal GmbH\nGesellschaft mit beschränkter Haftung\nFrankfurt am Main\n\nDas Registergericht beabsichtigt die im Handelsregister eingetragene Gesellschaft von Amts wegen nach § 394 FamFG zu löschen. Die Frist zur Erhebung eines Widerspruchs gegen die beabsichtigte Löschung wird auf 1 Monat festgesetzt."
    },
    {
      "date": "2025-04-16",
      "id": "106804",
      "original_text": "Registerbekanntmachung nach dem Umwandlungsgesetz\nHessen Amtsgericht Offenbach am Main HRB 55307\nTimeProfessionals GmbH – Dietzenbach",
      "type": "Registerbekanntmachung nach dem Umwandlungsgesetz",
      "state": "Hessen",
      "amtsgericht": "Amtsgericht Offenbach am Main",
      "registernummer": "HRB 55307",
      "registerart": "HRB",
      "company_name": "TimeProfessionals GmbH",
      "company_seat": "Dietzenbach",
      "details": "16.04.2025 (Bekanntmachungsdatum)\n\nHessen Amtsgericht Offenbach am Main HRB 55307\nRegisterbekanntmachung nach dem Umwandlungsgesetz 16.04.2025 (Eintragungsdatum)\n\nTimeProfessionals GmbH\nGesellschaft mit beschränkter Haftung\nDietzenbach\n\nDen Gläubigern der an der Verschmelzung beteiligten Rechtsträger ist, wenn sie binnen sechs Monaten nach dem Tag, an dem die Eintragung der Verschmelzung in das Register des Sitzes desjenigen Rechtsträgers, dessen Gläubiger sie sind, nach § 19 Absatz 3 UmwG bekannt gemacht worden ist, ihren Anspruch nach Grund und Höhe schriftlich anmelden, Sicherheit zu leisten, soweit sie nicht Befriedigung verlangen können. Dieses Recht steht den Gläubigern jedoch nur zu, wenn sie glaubhaft machen, dass durch die Verschmelzung die Erfüllung ihrer Forderung gefährdet wird."
    },
    {
      "date": "2025-04-16",
      "id": "106805",
      "original_text": "Registerbekanntmachung nach dem Umwandlungsgesetz\nHessen Amtsgericht Offenbach am Main HRB 55307\nTimeProfessionals GmbH – Dietzenbach",
      "type": "Registerbekanntmachung nach dem Umwandlungsgesetz",
      "state": "Hessen",
      "amtsgericht": "Amtsgericht Offenbach am Main",
      "registernummer": "HRB 55307",
      "registerart": "HRB",
      "company_name": "TimeProfessionals GmbH",
      "company_seat": "Dietzenbach",
      "details": "16.04.2025 (Bekanntmachungsdatum)\n\nHessen Amtsgericht Offenbach am Main HRB 55307\nRegisterbekanntmachung nach dem Umwandlungsgesetz 14.04.2025 (Eintragungsdatum)\n\nTimeProfessionals GmbH\nGesellschaft mit beschränkter Haftung\nDietzenbach\n\nDen Gläubigern der an der Verschmelzung beteiligten Rechtsträger ist, wenn sie binnen sechs Monaten nach dem Tag, an dem die Eintragung der Verschmelzung in das Register des Sitzes desjenigen Rechtsträgers, dessen Gläubiger sie sind, nach § 19 Absatz 3 UmwG bekannt gemacht worden ist, ihren Anspruch nach Grund und Höhe schriftlich anmelden, Sicherheit zu leisten, soweit sie nicht Befriedigung verlangen können. Dieses Recht steht den Gläubigern jedoch nur zu, wenn sie glaubhaft machen, dass durch die Verschmelzung die Erfüllung ihrer Forderung gefährdet wird."
    },
    {
      "date": "2025-04-16",
      "id": "106806",
      "original_text": "Sonstige Registerbekanntmachung\nHessen Amtsgericht Wiesbaden HRB 30420\nCommerz Real AG – Wiesbaden",
      "type": "Sonstige Registerbekanntmachung",
      "state": "Hessen",
      "amtsgericht": "Amtsgericht Wiesbaden",
      "registernummer": "HRB 30420",
      "registerart": "HRB",
      "company_name": "Commerz Real AG",
      "company_seat": "Wiesbaden",
      "details": "16.04.2025 (Bekanntmachungsdatum)\n\nHessen Amtsgericht Wiesbaden HRB 30420\nSonstige Registerbekanntmachung 16.04.2025 (Eintragungsdatum)\n\nCommerz Real AG\nAktiengesellschaft\nWiesbaden\n\nDurch eine Änderung in den Personen der Aufsichtsratsmitglieder ist eine Liste der Mitglieder des Aufsichtsrates zum Handelsregister eingereicht worden."
    },
    {
      "date": "2025-04-16",
      "id": "106807",
      "original_text": "Löschungsankündigung\nHessen Amtsgericht Wiesbaden HRB 32820\npharmatac GmbH – Eltville am Rhein",
      "type": "Löschungsankündigung",
      "state": "Hessen",
      "amtsgericht": "Amtsgericht Wiesbaden",
      "registernummer": "HRB 32820",
      "registerart": "HRB",
      "company_name": "pharmatac GmbH",
      "company_seat": "Eltville am Rhein",
      "details": "16.04.2025 (Bekanntmachungsdatum)\n\nHessen Amtsgericht Wiesbaden HRB 32820\nLöschungsankündigung\n\npharmatac GmbH\nGesellschaft mit beschränkter Haftung\nEltville am Rhein\n\nDas Registergericht beabsichtigt die im Handelsregister eingetragene Gesellschaft von Amts wegen nach § 394 FamFG zu löschen. Die Frist zur Erhebung eines Widerspruchs gegen die beabsichtigte Löschung wird auf 3 Monate festgesetzt."
    },
    {
      "date": "2025-04-16",
      "id": "106808",
      "original_text": "Sonstige Registerbekanntmachung\nHessen Amtsgericht Wiesbaden HRB 8440\nCommerz Real Investmentgesellschaft mbH – Wiesbaden",
      "type": "Sonstige Registerbekanntmachung",
      "state": "Hessen",
      "amtsgericht": "Amtsgericht Wiesbaden",
      "registernummer": "HRB 8440",
      "registerart": "HRB",
      "company_name": "Commerz Real Investmentgesellschaft mbH",
      "company_seat": "Wiesbaden",
      "details": "16.04.2025 (Bekanntmachungsdatum)\n\nHessen Amtsgericht Wiesbaden HRB 8440\nSonstige Registerbekanntmachung 16.04.2025 (Eintragungsdatum)\n\nCommerz Real Investmentgesellschaft mbH\nGesellschaft mit beschränkter Haftung\nWiesbaden\n\nDurch eine Änderung in den Personen der Aufsichtsratsmitglieder ist eine Liste der Mitglieder des Aufsichtsrates zum Handelsregister eingereicht worden."
    },
    {
      "date": "2025-04-16",
      "id": "106809",
      "original_text": "Registerbekanntmachung nach dem Umwandlungsgesetz\nHessen Amtsgericht Offenbach am Main HRB 50341\nScholpp GmbH – Dietzenbach",
      "type": "Registerbekanntmachung nach dem Umwandlungsgesetz",
      "state": "Hessen",
      "amtsgericht": "Amtsgericht Offenbach am Main",
      "registernummer": "HRB 50341",
      "registerart": "HRB",
      "company_name": "Scholpp GmbH",
      "company_seat": "Dietzenbach",
      "details": "16.04.2025 (Bekanntmachungsdatum)\n\nHessen Amtsgericht Offenbach am Main HRB 50341\nRegisterbekanntmachung nach dem Umwandlungsgesetz 16.04.2025 (Eintragungsdatum)\n\nScholpp GmbH\nGesellschaft mit beschränkter Haftung\nDietzenbach\n\nDen Gläubigern der an der Verschmelzung beteiligten Rechtsträger ist, wenn sie binnen sechs Monaten nach dem Tag, an dem die Eintragung der Verschmelzung in das Register des Sitzes desjenigen Rechtsträgers, dessen Gläubiger sie sind, nach § 19 Absatz 3 UmwG bekannt gemacht worden ist, ihren Anspruch nach Grund und Höhe schriftlich anmelden, Sicherheit zu leisten, soweit sie nicht Befriedigung verlangen können. Dieses Recht steht den Gläubigern jedoch nur zu, wenn sie glaubhaft machen, dass durch die Verschmelzung die Erfüllung ihrer Forderung gefährdet wird."
    }
  ]
}