{
  "date": "2025-04-12",
  "date_of_scrape": "2025-05-30T15:13:35.121Z",
  "tool_version": "0.2.0",
  "number_of_announcements": 9,
  "announcements": [
    {
      "date": "2025-04-12",
      "id": "106411",
      "original_text": "Registerbekanntmachung nach dem Umwandlungsgesetz\nBayern Amtsgericht Fürth HRB 13085\nPUMA SE – Herzogenaurach",
      "type": "Registerbekanntmachung nach dem Umwandlungsgesetz",
      "state": "Bayern",
      "amtsgericht": "Amtsgericht Fürth",
      "registernummer": "HRB 13085",
      "registerart": "HRB",
      "company_name": "PUMA SE",
      "company_seat": "Herzogenaurach",
      "details": "12.04.2025 (Bekanntmachungsdatum)\n\nBayern Amtsgericht Fürth HRB 13085\nRegisterbekanntmachung nach dem Umwandlungsgesetz\n\nPUMA SE\nEuropäische Aktiengesellschaft (SE)\nHerzogenaurach\n\nDem Amtsgericht Fürth -Registergericht- ist der Entwurf eines Ausgliederungs- und Übernahmevertrages zwischen der PUMA Europe GmbH, Herzogenaurach (Amtsgericht Fürth HRB 14539) und der Gesellschaft als übertragendem Rechtsträger zur Einsichtnahme eingereicht worden."
    },
    {
      "date": "2025-04-12",
      "id": "106412",
      "original_text": "Einreichung neuer Dokumente\nBayern Amtsgericht München HRB 203845\nCANCOM SE – München",
      "type": "Einreichung neuer Dokumente",
      "state": "Bayern",
      "amtsgericht": "Amtsgericht München",
      "registernummer": "HRB 203845",
      "registerart": "HRB",
      "company_name": "CANCOM SE",
      "company_seat": "München",
      "details": "12.04.2025 (Bekanntmachungsdatum)\n\nBayern Amtsgericht München HRB 203845\nEinreichung neuer Dokumente\n\nCANCOM SE\nEuropäische Aktiengesellschaft (SE)\nMünchen\n\nDem Amtsgericht München -Registergericht- ist eine Liste der Mitglieder des Aufsichtsrats eingereicht worden, Art. 9 Abs. 1 Buchst. c (ii) SE-VO i.V.m. § 106 AktG."
    },
    {
      "date": "2025-04-12",
      "id": "106413",
      "original_text": "Registerbekanntmachung nach dem Umwandlungsgesetz\nBayern Amtsgericht Fürth HRB 9600\nGeorg Roth CZ Immobilien Verwaltungs-GmbH – Fürth",
      "type": "Registerbekanntmachung nach dem Umwandlungsgesetz",
      "state": "Bayern",
      "amtsgericht": "Amtsgericht Fürth",
      "registernummer": "HRB 9600",
      "registerart": "HRB",
      "company_name": "Georg Roth CZ Immobilien Verwaltungs-GmbH",
      "company_seat": "Fürth",
      "details": "12.04.2025 (Bekanntmachungsdatum)\n\nBayern Amtsgericht Fürth HRB 9600\nRegisterbekanntmachung nach dem Umwandlungsgesetz 11.04.2025 (Eintragungsdatum)\n\nGeorg Roth CZ Immobilien Verwaltungs-GmbH\nGesellschaft mit beschränkter Haftung\nFürth\n\nDen Gläubigern der an der Verschmelzung beteiligten Rechtsträger ist, wenn sie binnen sechs Monaten nach dem Tag, an dem die Eintragung der Verschmelzung in das Register des Sitzes desjenigen Rechtsträgers, dessen Gläubiger sie sind, nach § 19 Abs. 3 UmwG als bekannt gemacht gilt, ihren Anspruch nach Grund und Höhe in Textform anmelden, Sicherheit zu leisten, soweit sie nicht Befriedigung verlangen können. Dieses Recht steht den Gläubigern jedoch nur zu, wenn sie glaubhaft machen, dass durch die Verschmelzung die Erfüllung ihrer Forderung gefährdet wird."
    },
    {
      "date": "2025-04-12",
      "id": "106414",
      "original_text": "Registerbekanntmachung nach dem Umwandlungsgesetz\nBayern Amtsgericht Memmingen HRA 14016\nVöhringer Management und Events e.K. – Memmingen",
      "type": "Registerbekanntmachung nach dem Umwandlungsgesetz",
      "state": "Bayern",
      "amtsgericht": "Amtsgericht Memmingen",
      "registernummer": "HRA 14016",
      "registerart": "HRA",
      "company_name": "Vöhringer Management und Events e.K.",
      "company_seat": "Memmingen",
      "details": "12.04.2025 (Bekanntmachungsdatum)\n\nBayern Amtsgericht Memmingen HRA 14016\nRegisterbekanntmachung nach dem Umwandlungsgesetz 11.04.2025 (Eintragungsdatum)\n\nVöhringer Management und Events e.K.\nEinzelkaufmann / Einzelkauffrau\nMemmingen\n\nDen Gläubigern der an der Ausgliederung beteiligten Rechtsträger ist, wenn sie binnen sechs Monaten nach dem Tag, an dem die Eintragung der Ausgliederung in das Register des Sitzes desjenigen Rechtsträgers, dessen Gläubiger sie sind, nach §§ 125, 19 Abs. 3 UmwG als bekannt gemacht gilt, ihren Anspruch nach Grund und Höhe in Textform anmelden, Sicherheit zu leisten, soweit sie nicht Befriedigung verlangen können. Dieses Recht steht den Gläubigern jedoch nur zu, wenn sie glaubhaft machen, dass durch die Ausgliederung die Erfüllung ihrer Forderung gefährdet wird."
    },
    {
      "date": "2025-04-12",
      "id": "106415",
      "original_text": "Registerbekanntmachung nach dem Umwandlungsgesetz\nBayern Amtsgericht Fürth HRB 13085\nPUMA SE – Herzogenaurach",
      "type": "Registerbekanntmachung nach dem Umwandlungsgesetz",
      "state": "Bayern",
      "amtsgericht": "Amtsgericht Fürth",
      "registernummer": "HRB 13085",
      "registerart": "HRB",
      "company_name": "PUMA SE",
      "company_seat": "Herzogenaurach",
      "details": "12.04.2025 (Bekanntmachungsdatum)\n\nBayern Amtsgericht Fürth HRB 13085\nRegisterbekanntmachung nach dem Umwandlungsgesetz\n\nPUMA SE\nEuropäische Aktiengesellschaft (SE)\nHerzogenaurach\n\nDem Amtsgericht Fürth -Registergericht- ist der Entwurf eines Ausgliederungs- und Übernahmevertrages zwischen der PUMA Europe GmbH, Herzogenaurach (Amtsgericht Fürth HRB 14539) und der Gesellschaft als übertragendem Rechtsträger zur Einsichtnahme eingereicht worden."
    },
    {
      "date": "2025-04-12",
      "id": "106416",
      "original_text": "Registerbekanntmachung nach dem Umwandlungsgesetz\nBayern Amtsgericht Fürth GsR 367\nNexsun Fende & Lotter eGbR – Obermichelbach",
      "type": "Registerbekanntmachung nach dem Umwandlungsgesetz",
      "state": "Bayern",
      "amtsgericht": "Amtsgericht Fürth",
      "registernummer": "GsR 367",
      "registerart": "GsR",
      "company_name": "Nexsun Fende & Lotter eGbR",
      "company_seat": "Obermichelbach",
      "details": "12.04.2025 (Bekanntmachungsdatum)\n\nBayern Amtsgericht Fürth GsR 367\nRegisterbekanntmachung nach dem Umwandlungsgesetz 11.04.2025 (Eintragungsdatum)\n\nNexsun Fende & Lotter eGbR\nGesellschaft bürgerlichen Rechts\nObermichelbach\n\nDen Gläubigern des formwechselnden Rechtsträgers ist, wenn sie binnen sechs Monaten nach dem Tag, an dem die Eintragung des Formwechsels nach § 201 UmwG als bekannt gemacht gilt, ihren Anspruch nach Grund und Höhe in Textform anmelden, Sicherheit zu leisten, soweit sie nicht Befriedigung verlangen können. Dieses Recht steht den Gläubigern jedoch nur zu, wenn sie glaubhaft machen, dass durch den Formwechsel die Erfüllung ihrer Forderung gefährdet wird."
    },
    {
      "date": "2025-04-12",
      "id": "106417",
      "original_text": "Registerbekanntmachung nach dem Umwandlungsgesetz\nBayern Amtsgericht Fürth HRB 8028\nMGR Beteiligungs-GmbH – Fürth",
      "type": "Registerbekanntmachung nach dem Umwandlungsgesetz",
      "state": "Bayern",
      "amtsgericht": "Amtsgericht Fürth",
      "registernummer": "HRB 8028",
      "registerart": "HRB",
      "company_name": "MGR Beteiligungs-GmbH",
      "company_seat": "Fürth",
      "details": "12.04.2025 (Bekanntmachungsdatum)\n\nBayern Amtsgericht Fürth HRB 8028\nRegisterbekanntmachung nach dem Umwandlungsgesetz 11.04.2025 (Eintragungsdatum)\n\nMGR Beteiligungs-GmbH\nGesellschaft mit beschränkter Haftung\nFürth\n\nDen Gläubigern der an der Verschmelzung beteiligten Rechtsträger ist, wenn sie binnen sechs Monaten nach dem Tag, an dem die Eintragung der Verschmelzung in das Register des Sitzes desjenigen Rechtsträgers, dessen Gläubiger sie sind, nach § 19 Abs. 3 UmwG als bekannt gemacht gilt, ihren Anspruch nach Grund und Höhe in Textform anmelden, Sicherheit zu leisten, soweit sie nicht Befriedigung verlangen können. Dieses Recht steht den Gläubigern jedoch nur zu, wenn sie glaubhaft machen, dass durch die Verschmelzung die Erfüllung ihrer Forderung gefährdet wird."
    },
    {
      "date": "2025-04-12",
      "id": "106418",
      "original_text": "Registerbekanntmachung nach dem Umwandlungsgesetz\nBayern Amtsgericht München HRB 215727\nP2 Software GmbH – Berg",
      "type": "Registerbekanntmachung nach dem Umwandlungsgesetz",
      "state": "Bayern",
      "amtsgericht": "Amtsgericht München",
      "registernummer": "HRB 215727",
      "registerart": "HRB",
      "company_name": "P2 Software GmbH",
      "company_seat": "Berg",
      "details": "12.04.2025 (Bekanntmachungsdatum)\n\nBayern Amtsgericht München HRB 215727\nRegisterbekanntmachung nach dem Umwandlungsgesetz 11.04.2025 (Eintragungsdatum)\n\nP2 Software GmbH\nGesellschaft mit beschränkter Haftung\nBerg\n\nDen Gläubigern der an der Verschmelzung beteiligten Rechtsträger ist, wenn sie binnen sechs Monaten nach dem Tag, an dem die Eintragung der Verschmelzung in das Register des Sitzes desjenigen Rechtsträgers, dessen Gläubiger sie sind, nach § 19 Abs. 3 UmwG als bekannt gemacht gilt, ihren Anspruch nach Grund und Höhe in Textform anmelden, Sicherheit zu leisten, soweit sie nicht Befriedigung verlangen können. Dieses Recht steht den Gläubigern jedoch nur zu, wenn sie glaubhaft machen, dass durch die Verschmelzung die Erfüllung ihrer Forderung gefährdet wird."
    },
    {
      "date": "2025-04-12",
      "id": "106419",
      "original_text": "Registerbekanntmachung nach dem Umwandlungsgesetz\nBayern Amtsgericht Memmingen HRB 20714\nJS Management & Events GmbH – Memmingen",
      "type": "Registerbekanntmachung nach dem Umwandlungsgesetz",
      "state": "Bayern",
      "amtsgericht": "Amtsgericht Memmingen",
      "registernummer": "HRB 20714",
      "registerart": "HRB",
      "company_name": "JS Management & Events GmbH",
      "company_seat": "Memmingen",
      "details": "12.04.2025 (Bekanntmachungsdatum)\n\nBayern Amtsgericht Memmingen HRB 20714\nRegisterbekanntmachung nach dem Umwandlungsgesetz 11.04.2025 (Eintragungsdatum)\n\nJS Management & Events GmbH\nGesellschaft mit beschränkter Haftung\nMemmingen\n\nDen Gläubigern der an der Ausgliederung beteiligten Rechtsträger ist, wenn sie binnen sechs Monaten nach dem Tag, an dem die Eintragung der Ausgliederung in das Register des Sitzes desjenigen Rechtsträgers, dessen Gläubiger sie sind, nach §§ 125, 19 Abs. 3 UmwG als bekannt gemacht gilt, ihren Anspruch nach Grund und Höhe in Textform anmelden, Sicherheit zu leisten, soweit sie nicht Befriedigung verlangen können. Dieses Recht steht den Gläubigern jedoch nur zu, wenn sie glaubhaft machen, dass durch die Ausgliederung die Erfüllung ihrer Forderung gefährdet wird."
    }
  ]
}