{
  "date": "2025-04-15",
  "date_of_scrape": "2025-05-30T15:27:23.331Z",
  "tool_version": "0.2.0",
  "number_of_announcements": 180,
  "announcements": [
    {
      "date": "2025-04-15",
      "id": "106528",
      "original_text": "Löschungsankündigung\nBayern Amtsgericht Ingolstadt HRB 8450\nNEWERY UG (haftungsbeschränkt) – Ingolstadt",
      "type": "Löschungsankündigung",
      "state": "Bayern",
      "amtsgericht": "Amtsgericht Ingolstadt",
      "registernummer": "HRB 8450",
      "registerart": "HRB",
      "company_name": "NEWERY UG (haftungsbeschränkt)",
      "company_seat": "Ingolstadt",
      "details": "15.04.2025 (Bekanntmachungsdatum)\n\nBayern Amtsgericht Ingolstadt HRB 8450\nLöschungsankündigung\n\nNEWERY UG (haftungsbeschränkt)\nGesellschaft mit beschränkter Haftung\nIngolstadt\n\nDas Registergericht beabsichtigt, die im Handelsregister eingetragene Gesellschaft wegen Vermögenslosigkeit von Amts wegen nach § 394 FamFG zu löschen. #insert(Text=\"zztb_V_Widerspruchsfrist\")"
    },
    {
      "date": "2025-04-15",
      "id": "106529",
      "original_text": "Registerbekanntmachung nach dem Umwandlungsgesetz\nBayern Amtsgericht München HRB 194093\ncebesoft GmbH – München",
      "type": "Registerbekanntmachung nach dem Umwandlungsgesetz",
      "state": "Bayern",
      "amtsgericht": "Amtsgericht München",
      "registernummer": "HRB 194093",
      "registerart": "HRB",
      "company_name": "cebesoft GmbH",
      "company_seat": "München",
      "details": "15.04.2025 (Bekanntmachungsdatum)\n\nBayern Amtsgericht München HRB 194093\nRegisterbekanntmachung nach dem Umwandlungsgesetz 14.04.2025 (Eintragungsdatum)\n\ncebesoft GmbH\nGesellschaft mit beschränkter Haftung\nMünchen\n\nDen Gläubigern der an der Verschmelzung beteiligten Rechtsträger ist, wenn sie binnen sechs Monaten nach dem Tag, an dem die Eintragung der Verschmelzung in das Register des Sitzes desjenigen Rechtsträgers, dessen Gläubiger sie sind, nach § 19 Abs. 3 UmwG als bekannt gemacht gilt, ihren Anspruch nach Grund und Höhe in Textform anmelden, Sicherheit zu leisten, soweit sie nicht Befriedigung verlangen können. Dieses Recht steht den Gläubigern jedoch nur zu, wenn sie glaubhaft machen, dass durch die Verschmelzung die Erfüllung ihrer Forderung gefährdet wird."
    },
    {
      "date": "2025-04-15",
      "id": "106530",
      "original_text": "Registerbekanntmachung nach dem Umwandlungsgesetz\nBayern Amtsgericht München HRB 145551\nRM Komplementär GmbH – München",
      "type": "Registerbekanntmachung nach dem Umwandlungsgesetz",
      "state": "Bayern",
      "amtsgericht": "Amtsgericht München",
      "registernummer": "HRB 145551",
      "registerart": "HRB",
      "company_name": "RM Komplementär GmbH",
      "company_seat": "München",
      "details": "15.04.2025 (Bekanntmachungsdatum)\n\nBayern Amtsgericht München HRB 145551\nRegisterbekanntmachung nach dem Umwandlungsgesetz 14.04.2025 (Eintragungsdatum)\n\nRM Komplementär GmbH\nGesellschaft mit beschränkter Haftung\nMünchen\n\nDen Gläubigern der an der Verschmelzung beteiligten Rechtsträger ist, wenn sie binnen sechs Monaten nach dem Tag, an dem die Eintragung der Verschmelzung in das Register des Sitzes desjenigen Rechtsträgers, dessen Gläubiger sie sind, nach § 19 Abs. 3 UmwG als bekannt gemacht gilt, ihren Anspruch nach Grund und Höhe in Textform anmelden, Sicherheit zu leisten, soweit sie nicht Befriedigung verlangen können. Dieses Recht steht den Gläubigern jedoch nur zu, wenn sie glaubhaft machen, dass durch die Verschmelzung die Erfüllung ihrer Forderung gefährdet wird."
    },
    {
      "date": "2025-04-15",
      "id": "106531",
      "original_text": "Löschungsankündigung\nBayern Amtsgericht München HRB 260929\nTP Wish UG (haftungsbeschränkt) – München",
      "type": "Löschungsankündigung",
      "state": "Bayern",
      "amtsgericht": "Amtsgericht München",
      "registernummer": "HRB 260929",
      "registerart": "HRB",
      "company_name": "TP Wish UG (haftungsbeschränkt)",
      "company_seat": "München",
      "details": "15.04.2025 (Bekanntmachungsdatum)\n\nBayern Amtsgericht München HRB 260929\nLöschungsankündigung 14.04.2025 (Eintragungsdatum)\n\nTP Wish UG (haftungsbeschränkt)\nGesellschaft mit beschränkter Haftung\nMünchen\n\nDas Registergericht beabsichtigt, die im Handelsregister eingetragene Gesellschaft wegen Vermögenslosigkeit von Amts wegen nach § 394 FamFG zu löschen. Die Frist zur Erhebung eines Widerspruchs ist auf drei Monate festgesetzt."
    },
    {
      "date": "2025-04-15",
      "id": "106532",
      "original_text": "Registerbekanntmachung nach dem Umwandlungsgesetz\nBayern Amtsgericht Augsburg HRB 34086\nPrivabo Verwaltungs GmbH – Adelsried",
      "type": "Registerbekanntmachung nach dem Umwandlungsgesetz",
      "state": "Bayern",
      "amtsgericht": "Amtsgericht Augsburg",
      "registernummer": "HRB 34086",
      "registerart": "HRB",
      "company_name": "Privabo Verwaltungs GmbH",
      "company_seat": "Adelsried",
      "details": "15.04.2025 (Bekanntmachungsdatum)\n\nBayern Amtsgericht Augsburg HRB 34086\nRegisterbekanntmachung nach dem Umwandlungsgesetz 14.04.2025 (Eintragungsdatum)\n\nPrivabo Verwaltungs GmbH\nGesellschaft mit beschränkter Haftung\nAdelsried\n\nDen Gläubigern der an der Verschmelzung beteiligten Rechtsträger ist, wenn sie binnen sechs Monaten nach dem Tag, an dem die Eintragung der Verschmelzung in das Register des Sitzes desjenigen Rechtsträgers, dessen Gläubiger sie sind, nach § 19 Abs. 3 UmwG als bekannt gemacht gilt, ihren Anspruch nach Grund und Höhe in Textform anmelden, Sicherheit zu leisten, soweit sie nicht Befriedigung verlangen können. Dieses Recht steht den Gläubigern jedoch nur zu, wenn sie glaubhaft machen, dass durch die Verschmelzung die Erfüllung ihrer Forderung gefährdet wird."
    },
    {
      "date": "2025-04-15",
      "id": "106533",
      "original_text": "Einreichung neuer Dokumente\nBayern Amtsgericht Memmingen HRB 4017\nÜberlandwerk Krumbach Gesellschaft mit beschränkter Haftung – Krumbach",
      "type": "Einreichung neuer Dokumente",
      "state": "Bayern",
      "amtsgericht": "Amtsgericht Memmingen",
      "registernummer": "HRB 4017",
      "registerart": "HRB",
      "company_name": "Überlandwerk Krumbach Gesellschaft mit beschränkter Haftung",
      "company_seat": "Krumbach",
      "details": "15.04.2025 (Bekanntmachungsdatum)\n\nBayern Amtsgericht Memmingen HRB 4017\nEinreichung neuer Dokumente\n\nÜberlandwerk Krumbach Gesellschaft mit beschränkter Haftung\nGesellschaft mit beschränkter Haftung\nKrumbach\n\nDem Amtsgericht Memmingen -Registergericht- ist eine Liste der Mitglieder des Aufsichtsrats eingereicht worden, § 52 Abs. 3 S. 2 GmbHG."
    },
    {
      "date": "2025-04-15",
      "id": "106534",
      "original_text": "Sonstige Registerbekanntmachung\nBayern Amtsgericht Hof HRB 1895\nVishay Electronic GmbH – Selb",
      "type": "Sonstige Registerbekanntmachung",
      "state": "Bayern",
      "amtsgericht": "Amtsgericht Hof",
      "registernummer": "HRB 1895",
      "registerart": "HRB",
      "company_name": "Vishay Electronic GmbH",
      "company_seat": "Selb",
      "details": "15.04.2025 (Bekanntmachungsdatum)\n\nBayern Amtsgericht Hof HRB 1895\nSonstige Registerbekanntmachung\n\nVishay Electronic GmbH\nGesellschaft mit beschränkter Haftung\nSelb\n\nDem Amtsgericht Hof -Registergericht- ist eine Liste der Mitglieder des Aufsichtsrats eingereicht worden, § 52 Abs. 3 S. 2 GmbHG."
    },
    {
      "date": "2025-04-15",
      "id": "106535",
      "original_text": "Löschungsankündigung\nBayern Amtsgericht Weiden i. d. OPf. VR 200423\nBayerische Imker-Vereinigung - Kreisverband Weiden i.d.OPf. und Umgebung e.V. – Weiden i.d.OPf.",
      "type": "Löschungsankündigung",
      "state": "Bayern",
      "amtsgericht": "Amtsgericht Weiden i. d. OPf.",
      "registernummer": "VR 200423",
      "registerart": "VR",
      "company_name": "Bayerische Imker-Vereinigung - Kreisverband Weiden i.d.OPf. und Umgebung e.V.",
      "company_seat": "Weiden i.d.OPf.",
      "details": "15.04.2025 (Bekanntmachungsdatum)\n\nBayern Amtsgericht Weiden i. d. OPf. VR 200423\nLöschungsankündigung\n\nBayerische Imker-Vereinigung - Kreisverband Weiden i.d.OPf. und Umgebung e.V.\neingetragener Verein\nWeiden i.d.OPf.\n\nDas Registergericht beabsichtigt, den im Vereinsregister eingetragenen Verein von Amts wegen nach § 395 FamFG zu löschen. Die Frist zur Erhebung eines Widerspruchs ist auf einen Monat festgesetzt."
    },
    {
      "date": "2025-04-15",
      "id": "106536",
      "original_text": "Löschungsankündigung\nBayern Amtsgericht Ansbach HRB 6521\nGENERAL TRADING BAVARIA GmbH – Dinkelsbühl",
      "type": "Löschungsankündigung",
      "state": "Bayern",
      "amtsgericht": "Amtsgericht Ansbach",
      "registernummer": "HRB 6521",
      "registerart": "HRB",
      "company_name": "GENERAL TRADING BAVARIA GmbH",
      "company_seat": "Dinkelsbühl",
      "details": "15.04.2025 (Bekanntmachungsdatum)\n\nBayern Amtsgericht Ansbach HRB 6521\nLöschungsankündigung\n\nGENERAL TRADING BAVARIA GmbH\nGesellschaft mit beschränkter Haftung\nDinkelsbühl\n\nDas Registergericht beabsichtigt, die im Handelsregister eingetragene Gesellschaft wegen Vermögenslosigkeit von Amts wegen nach § 394 FamFG zu löschen. Die Frist zur Erhebung eines Widerspruchs ist auf einen Monat festgesetzt."
    },
    {
      "date": "2025-04-15",
      "id": "106537",
      "original_text": "Registerbekanntmachung nach dem Umwandlungsgesetz\nBayern Amtsgericht Fürth HRA 12382\nMiriam Specht Fotografie e.K. – Baiersdorf",
      "type": "Registerbekanntmachung nach dem Umwandlungsgesetz",
      "state": "Bayern",
      "amtsgericht": "Amtsgericht Fürth",
      "registernummer": "HRA 12382",
      "registerart": "HRA",
      "company_name": "Miriam Specht Fotografie e.K.",
      "company_seat": "Baiersdorf",
      "details": "15.04.2025 (Bekanntmachungsdatum)\n\nBayern Amtsgericht Fürth HRA 12382\nRegisterbekanntmachung nach dem Umwandlungsgesetz 14.04.2025 (Eintragungsdatum)\n\nMiriam Specht Fotografie e.K.\nEinzelkaufmann / Einzelkauffrau\nBaiersdorf\n\nDen Gläubigern der an der Ausgliederung beteiligten Rechtsträger ist, wenn sie binnen sechs Monaten nach dem Tag, an dem die Eintragung der Ausgliederung in das Register des Sitzes desjenigen Rechtsträgers, dessen Gläubiger sie sind, nach §§ 125, 19 Abs. 3 UmwG als bekannt gemacht gilt, ihren Anspruch nach Grund und Höhe in Textform anmelden, Sicherheit zu leisten, soweit sie nicht Befriedigung verlangen können. Dieses Recht steht den Gläubigern jedoch nur zu, wenn sie glaubhaft machen, dass durch die Ausgliederung die Erfüllung ihrer Forderung gefährdet wird."
    },
    {
      "date": "2025-04-15",
      "id": "106538",
      "original_text": "Registerbekanntmachung nach dem Umwandlungsgesetz\nBayern Amtsgericht München HRB 172274\nFamilie Porsche Beteiligung GmbH – Grünwald",
      "type": "Registerbekanntmachung nach dem Umwandlungsgesetz",
      "state": "Bayern",
      "amtsgericht": "Amtsgericht München",
      "registernummer": "HRB 172274",
      "registerart": "HRB",
      "company_name": "Familie Porsche Beteiligung GmbH",
      "company_seat": "Grünwald",
      "details": "15.04.2025 (Bekanntmachungsdatum)\n\nBayern Amtsgericht München HRB 172274\nRegisterbekanntmachung nach dem Umwandlungsgesetz 14.04.2025 (Eintragungsdatum)\n\nFamilie Porsche Beteiligung GmbH\nGesellschaft mit beschränkter Haftung\nGrünwald\n\nDen Gläubigern der an der Verschmelzung beteiligten Rechtsträger ist, wenn sie binnen sechs Monaten nach dem Tag, an dem die Eintragung der Verschmelzung in das Register des Sitzes desjenigen Rechtsträgers, dessen Gläubiger sie sind, nach § 19 Abs. 3 UmwG als bekannt gemacht gilt, ihren Anspruch nach Grund und Höhe in Textform anmelden, Sicherheit zu leisten, soweit sie nicht Befriedigung verlangen können. Dieses Recht steht den Gläubigern jedoch nur zu, wenn sie glaubhaft machen, dass durch die Verschmelzung die Erfüllung ihrer Forderung gefährdet wird."
    },
    {
      "date": "2025-04-15",
      "id": "106539",
      "original_text": "Einreichung neuer Dokumente\nBayern Amtsgericht Memmingen HRB 20259\nBlue Energy Group AG – Senden",
      "type": "Einreichung neuer Dokumente",
      "state": "Bayern",
      "amtsgericht": "Amtsgericht Memmingen",
      "registernummer": "HRB 20259",
      "registerart": "HRB",
      "company_name": "Blue Energy Group AG",
      "company_seat": "Senden",
      "details": "15.04.2025 (Bekanntmachungsdatum)\n\nBayern Amtsgericht Memmingen HRB 20259\nEinreichung neuer Dokumente\n\nBlue Energy Group AG\nAktiengesellschaft\nSenden\n\nDem Amtsgericht Memmingen -Registergericht- ist eine Liste der Mitglieder des Aufsichtsrats eingereicht worden, § 106 AktG."
    },
    {
      "date": "2025-04-15",
      "id": "106540",
      "original_text": "Registerbekanntmachung nach dem Umwandlungsgesetz\nBayern Amtsgericht München HRB 252785\nPhlexglobal GmbH – München",
      "type": "Registerbekanntmachung nach dem Umwandlungsgesetz",
      "state": "Bayern",
      "amtsgericht": "Amtsgericht München",
      "registernummer": "HRB 252785",
      "registerart": "HRB",
      "company_name": "Phlexglobal GmbH",
      "company_seat": "München",
      "details": "15.04.2025 (Bekanntmachungsdatum)\n\nBayern Amtsgericht München HRB 252785\nRegisterbekanntmachung nach dem Umwandlungsgesetz 14.04.2025 (Eintragungsdatum)\n\nPhlexglobal GmbH\nGesellschaft mit beschränkter Haftung\nMünchen\n\nDen Gläubigern der an der Verschmelzung beteiligten Rechtsträger ist, wenn sie binnen sechs Monaten nach dem Tag, an dem die Eintragung der Verschmelzung in das Register des Sitzes desjenigen Rechtsträgers, dessen Gläubiger sie sind, nach § 19 Abs. 3 UmwG als bekannt gemacht gilt, ihren Anspruch nach Grund und Höhe in Textform anmelden, Sicherheit zu leisten, soweit sie nicht Befriedigung verlangen können. Dieses Recht steht den Gläubigern jedoch nur zu, wenn sie glaubhaft machen, dass durch die Verschmelzung die Erfüllung ihrer Forderung gefährdet wird."
    },
    {
      "date": "2025-04-15",
      "id": "106541",
      "original_text": "Einreichung neuer Dokumente\nBayern Amtsgericht Nürnberg HRB 35108\nSandoz Deutschland GmbH – Nürnberg",
      "type": "Einreichung neuer Dokumente",
      "state": "Bayern",
      "amtsgericht": "Amtsgericht Nürnberg",
      "registernummer": "HRB 35108",
      "registerart": "HRB",
      "company_name": "Sandoz Deutschland GmbH",
      "company_seat": "Nürnberg",
      "details": "15.04.2025 (Bekanntmachungsdatum)\n\nBayern Amtsgericht Nürnberg HRB 35108\nEinreichung neuer Dokumente 14.04.2025 (Eintragungsdatum)\n\nSandoz Deutschland GmbH\nGesellschaft mit beschränkter Haftung\nNürnberg\n\nDem Amtsgericht Nürnberg -Registergericht- ist eine Liste der Mitglieder des Aufsichtsrats eingereicht worden, § 52 Abs. 3 S. 2 GmbHG."
    },
    {
      "date": "2025-04-15",
      "id": "106542",
      "original_text": "Registerbekanntmachung nach dem Umwandlungsgesetz\nBayern Amtsgericht Traunstein HRB 29241\nRöckl Flachdachbau GmbH – Raubling",
      "type": "Registerbekanntmachung nach dem Umwandlungsgesetz",
      "state": "Bayern",
      "amtsgericht": "Amtsgericht Traunstein",
      "registernummer": "HRB 29241",
      "registerart": "HRB",
      "company_name": "Röckl Flachdachbau GmbH",
      "company_seat": "Raubling",
      "details": "15.04.2025 (Bekanntmachungsdatum)\n\nBayern Amtsgericht Traunstein HRB 29241\nRegisterbekanntmachung nach dem Umwandlungsgesetz 14.04.2025 (Eintragungsdatum)\n\nRöckl Flachdachbau GmbH\nGesellschaft mit beschränkter Haftung\nRaubling\n\nDen Gläubigern der an der Verschmelzung beteiligten Rechtsträger ist, wenn sie binnen sechs Monaten nach dem Tag, an dem die Eintragung der Verschmelzung in das Register des Sitzes desjenigen Rechtsträgers, dessen Gläubiger sie sind, nach § 19 Abs. 3 UmwG als bekannt gemacht gilt, ihren Anspruch nach Grund und Höhe in Textform anmelden, Sicherheit zu leisten, soweit sie nicht Befriedigung verlangen können. Dieses Recht steht den Gläubigern jedoch nur zu, wenn sie glaubhaft machen, dass durch die Verschmelzung die Erfüllung ihrer Forderung gefährdet wird."
    },
    {
      "date": "2025-04-15",
      "id": "106543",
      "original_text": "Registerbekanntmachung nach dem Umwandlungsgesetz\nBayern Amtsgericht Landshut HRA 12804\nMatthias Wild e.K. – Zeilarn",
      "type": "Registerbekanntmachung nach dem Umwandlungsgesetz",
      "state": "Bayern",
      "amtsgericht": "Amtsgericht Landshut",
      "registernummer": "HRA 12804",
      "registerart": "HRA",
      "company_name": "Matthias Wild e.K.",
      "company_seat": "Zeilarn",
      "details": "15.04.2025 (Bekanntmachungsdatum)\n\nBayern Amtsgericht Landshut HRA 12804\nRegisterbekanntmachung nach dem Umwandlungsgesetz 14.04.2025 (Eintragungsdatum)\n\nMatthias Wild e.K.\nEinzelkaufmann / Einzelkauffrau\nZeilarn\n\nDen Gläubigern der an der Ausgliederung beteiligten Rechtsträger ist, wenn sie binnen sechs Monaten nach dem Tag, an dem die Eintragung der Ausgliederung in das Register des Sitzes desjenigen Rechtsträgers, dessen Gläubiger sie sind, nach §§ 125, 19 Abs. 3 UmwG als bekannt gemacht gilt, ihren Anspruch nach Grund und Höhe in Textform anmelden, Sicherheit zu leisten, soweit sie nicht Befriedigung verlangen können. Dieses Recht steht den Gläubigern jedoch nur zu, wenn sie glaubhaft machen, dass durch die Ausgliederung die Erfüllung ihrer Forderung gefährdet wird."
    },
    {
      "date": "2025-04-15",
      "id": "106544",
      "original_text": "Löschungsankündigung\nBayern Amtsgericht Fürth HRA 11400\nNeustädter Eisenbahnbewachung und Consulting e.K. – Neustadt a.d.Aisch",
      "type": "Löschungsankündigung",
      "state": "Bayern",
      "amtsgericht": "Amtsgericht Fürth",
      "registernummer": "HRA 11400",
      "registerart": "HRA",
      "company_name": "Neustädter Eisenbahnbewachung und Consulting e.K.",
      "company_seat": "Neustadt a.d.Aisch",
      "details": "15.04.2025 (Bekanntmachungsdatum)\n\nBayern Amtsgericht Fürth HRA 11400\nLöschungsankündigung\n\nNeustädter Eisenbahnbewachung und Consulting e.K.\nEinzelkaufmann / Einzelkauffrau\nNeustadt a.d.Aisch\n\nDas Registergericht beabsichtigt, die im Handelsregister eingetragene Firma von Amts wegen nach § 31 Abs. 2 HGB zu löschen. Die Frist zur Erhebung des Widerspruchs ist auf einen Monat festgesetzt."
    },
    {
      "date": "2025-04-15",
      "id": "106545",
      "original_text": "Sonstige Registerbekanntmachung\nBayern Amtsgericht München HRB 168887\nKraftwerk Plattling GmbH – München",
      "type": "Sonstige Registerbekanntmachung",
      "state": "Bayern",
      "amtsgericht": "Amtsgericht München",
      "registernummer": "HRB 168887",
      "registerart": "HRB",
      "company_name": "Kraftwerk Plattling GmbH",
      "company_seat": "München",
      "details": "15.04.2025 (Bekanntmachungsdatum)\n\nBayern Amtsgericht München HRB 168887\nSonstige Registerbekanntmachung 14.04.2025 (Eintragungsdatum)\n\nKraftwerk Plattling GmbH\nGesellschaft mit beschränkter Haftung\nMünchen\n\nDen Gläubigern der Gesellschaft, deren Forderungen begründet worden sind, bevor die Eintragung der Beendigung des Gewinnabführungsvertrages in das Handelsregister nach § 10 des Handelsgesetzbuches als bekanntgemacht gilt, hat der andere Vertragsteil Sicherheit zu leisten, wenn sie sich binnen sechs Monaten nach der Bekanntmachung der Eintragung zu diesem Zweck bei ihm melden."
    },
    {
      "date": "2025-04-15",
      "id": "106546",
      "original_text": "Registerbekanntmachung nach dem Umwandlungsgesetz\nBayern Amtsgericht Coburg HRB 5205\nSpektrosoft UG (haftungsbeschränkt) – Pressig",
      "type": "Registerbekanntmachung nach dem Umwandlungsgesetz",
      "state": "Bayern",
      "amtsgericht": "Amtsgericht Coburg",
      "registernummer": "HRB 5205",
      "registerart": "HRB",
      "company_name": "Spektrosoft UG (haftungsbeschränkt)",
      "company_seat": "Pressig",
      "details": "15.04.2025 (Bekanntmachungsdatum)\n\nBayern Amtsgericht Coburg HRB 5205\nRegisterbekanntmachung nach dem Umwandlungsgesetz 11.04.2025 (Eintragungsdatum)\n\nSpektrosoft UG (haftungsbeschränkt)\nGesellschaft mit beschränkter Haftung\nPressig\n\nDen Gläubigern der an der Verschmelzung beteiligten Rechtsträger ist, wenn sie binnen sechs Monaten nach dem Tag, an dem die Eintragung der Verschmelzung in das Register des Sitzes desjenigen Rechtsträgers, dessen Gläubiger sie sind, nach § 19 Abs. 3 UmwG als bekannt gemacht gilt, ihren Anspruch nach Grund und Höhe in Textform anmelden, Sicherheit zu leisten, soweit sie nicht Befriedigung verlangen können. Dieses Recht steht den Gläubigern jedoch nur zu, wenn sie glaubhaft machen, dass durch die Verschmelzung die Erfüllung ihrer Forderung gefährdet wird."
    },
    {
      "date": "2025-04-15",
      "id": "106547",
      "original_text": "Registerbekanntmachung nach dem Umwandlungsgesetz\nBayern Amtsgericht München HRB 122203\n4L Beteiligungs GmbH – Berg",
      "type": "Registerbekanntmachung nach dem Umwandlungsgesetz",
      "state": "Bayern",
      "amtsgericht": "Amtsgericht München",
      "registernummer": "HRB 122203",
      "registerart": "HRB",
      "company_name": "4L Beteiligungs GmbH",
      "company_seat": "Berg",
      "details": "15.04.2025 (Bekanntmachungsdatum)\n\nBayern Amtsgericht München HRB 122203\nRegisterbekanntmachung nach dem Umwandlungsgesetz 14.04.2025 (Eintragungsdatum)\n\n4L Beteiligungs GmbH\nGesellschaft mit beschränkter Haftung\nBerg\n\nDen Gläubigern der an der Verschmelzung beteiligten Rechtsträger ist, wenn sie binnen sechs Monaten nach dem Tag, an dem die Eintragung der Verschmelzung in das Register des Sitzes desjenigen Rechtsträgers, dessen Gläubiger sie sind, nach § 19 Abs. 3 UmwG als bekannt gemacht gilt, ihren Anspruch nach Grund und Höhe in Textform anmelden, Sicherheit zu leisten, soweit sie nicht Befriedigung verlangen können. Dieses Recht steht den Gläubigern jedoch nur zu, wenn sie glaubhaft machen, dass durch die Verschmelzung die Erfüllung ihrer Forderung gefährdet wird."
    },
    {
      "date": "2025-04-15",
      "id": "106548",
      "original_text": "Einreichung neuer Dokumente\nBayern Amtsgericht München HRB 228434\nPlastic Omnium Automotive Exteriors GmbH – München",
      "type": "Einreichung neuer Dokumente",
      "state": "Bayern",
      "amtsgericht": "Amtsgericht München",
      "registernummer": "HRB 228434",
      "registerart": "HRB",
      "company_name": "Plastic Omnium Automotive Exteriors GmbH",
      "company_seat": "München",
      "details": "15.04.2025 (Bekanntmachungsdatum)\n\nBayern Amtsgericht München HRB 228434\nEinreichung neuer Dokumente 14.04.2025 (Eintragungsdatum)\n\nPlastic Omnium Automotive Exteriors GmbH\nGesellschaft mit beschränkter Haftung\nMünchen\n\nDem Amtsgericht München -Registergericht- ist eine Liste der Mitglieder des Aufsichtsrats eingereicht worden, § 52 Abs. 3 S. 2 GmbHG."
    },
    {
      "date": "2025-04-15",
      "id": "106549",
      "original_text": "Registerbekanntmachung nach dem Umwandlungsgesetz\nBayern Amtsgericht München HRB 182726\nRCP Roehm Capital Partner AG – München",
      "type": "Registerbekanntmachung nach dem Umwandlungsgesetz",
      "state": "Bayern",
      "amtsgericht": "Amtsgericht München",
      "registernummer": "HRB 182726",
      "registerart": "HRB",
      "company_name": "RCP Roehm Capital Partner AG",
      "company_seat": "München",
      "details": "15.04.2025 (Bekanntmachungsdatum)\n\nBayern Amtsgericht München HRB 182726\nRegisterbekanntmachung nach dem Umwandlungsgesetz 14.04.2025 (Eintragungsdatum)\n\nRCP Roehm Capital Partner AG\nAktiengesellschaft\nMünchen\n\nDen Gläubigern des formwechselnden Rechtsträgers ist, wenn sie binnen sechs Monaten nach dem Tag, an dem die Eintragung des Formwechsels nach § 201 UmwG als bekannt gemacht gilt, ihren Anspruch nach Grund und Höhe in Textform anmelden, Sicherheit zu leisten, soweit sie nicht Befriedigung verlangen können. Dieses Recht steht den Gläubigern jedoch nur zu, wenn sie glaubhaft machen, dass durch den Formwechsel die Erfüllung ihrer Forderung gefährdet wird."
    },
    {
      "date": "2025-04-15",
      "id": "106550",
      "original_text": "Registerbekanntmachung nach dem Umwandlungsgesetz\nBayern Amtsgericht München HRB 234786\nCondecta Holding GmbH – München",
      "type": "Registerbekanntmachung nach dem Umwandlungsgesetz",
      "state": "Bayern",
      "amtsgericht": "Amtsgericht München",
      "registernummer": "HRB 234786",
      "registerart": "HRB",
      "company_name": "Condecta Holding GmbH",
      "company_seat": "München",
      "details": "15.04.2025 (Bekanntmachungsdatum)\n\nBayern Amtsgericht München HRB 234786\nRegisterbekanntmachung nach dem Umwandlungsgesetz 14.04.2025 (Eintragungsdatum)\n\nCondecta Holding GmbH\nGesellschaft mit beschränkter Haftung\nMünchen\n\nDen Gläubigern der an der Verschmelzung beteiligten Rechtsträger ist, wenn sie binnen sechs Monaten nach dem Tag, an dem die Eintragung der Verschmelzung in das Register des Sitzes desjenigen Rechtsträgers, dessen Gläubiger sie sind, nach § 19 Abs. 3 UmwG als bekannt gemacht gilt, ihren Anspruch nach Grund und Höhe in Textform anmelden, Sicherheit zu leisten, soweit sie nicht Befriedigung verlangen können. Dieses Recht steht den Gläubigern jedoch nur zu, wenn sie glaubhaft machen, dass durch die Verschmelzung die Erfüllung ihrer Forderung gefährdet wird."
    },
    {
      "date": "2025-04-15",
      "id": "106551",
      "original_text": "Registerbekanntmachung nach dem Umwandlungsgesetz\nBayern Amtsgericht München HRB 301623\nRCP Roehm Capital Partner GmbH – München",
      "type": "Registerbekanntmachung nach dem Umwandlungsgesetz",
      "state": "Bayern",
      "amtsgericht": "Amtsgericht München",
      "registernummer": "HRB 301623",
      "registerart": "HRB",
      "company_name": "RCP Roehm Capital Partner GmbH",
      "company_seat": "München",
      "details": "15.04.2025 (Bekanntmachungsdatum)\n\nBayern Amtsgericht München HRB 301623\nRegisterbekanntmachung nach dem Umwandlungsgesetz 14.04.2025 (Eintragungsdatum)\n\nRCP Roehm Capital Partner GmbH\nGesellschaft mit beschränkter Haftung\nMünchen\n\nDen Gläubigern des formwechselnden Rechtsträgers ist, wenn sie binnen sechs Monaten nach dem Tag, an dem die Eintragung des Formwechsels nach § 201 UmwG als bekannt gemacht gilt, ihren Anspruch nach Grund und Höhe in Textform anmelden, Sicherheit zu leisten, soweit sie nicht Befriedigung verlangen können. Dieses Recht steht den Gläubigern jedoch nur zu, wenn sie glaubhaft machen, dass durch den Formwechsel die Erfüllung ihrer Forderung gefährdet wird."
    },
    {
      "date": "2025-04-15",
      "id": "106552",
      "original_text": "Sonstige Registerbekanntmachung\nBayern Amtsgericht Hof HRB 1480\nVishay Europe GmbH – Selb",
      "type": "Sonstige Registerbekanntmachung",
      "state": "Bayern",
      "amtsgericht": "Amtsgericht Hof",
      "registernummer": "HRB 1480",
      "registerart": "HRB",
      "company_name": "Vishay Europe GmbH",
      "company_seat": "Selb",
      "details": "15.04.2025 (Bekanntmachungsdatum)\n\nBayern Amtsgericht Hof HRB 1480\nSonstige Registerbekanntmachung\n\nVishay Europe GmbH\nGesellschaft mit beschränkter Haftung\nSelb\n\nDem Amtsgericht Hof -Registergericht- ist eine Liste der Mitglieder des Aufsichtsrats eingereicht worden, § 52 Abs. 3 S. 2 GmbHG."
    },
    {
      "date": "2025-04-15",
      "id": "106553",
      "original_text": "Registerbekanntmachung nach dem Umwandlungsgesetz\nBayern Amtsgericht Augsburg HRB 38058\nSchmid GF GmbH – Augsburg",
      "type": "Registerbekanntmachung nach dem Umwandlungsgesetz",
      "state": "Bayern",
      "amtsgericht": "Amtsgericht Augsburg",
      "registernummer": "HRB 38058",
      "registerart": "HRB",
      "company_name": "Schmid GF GmbH",
      "company_seat": "Augsburg",
      "details": "15.04.2025 (Bekanntmachungsdatum)\n\nBayern Amtsgericht Augsburg HRB 38058\nRegisterbekanntmachung nach dem Umwandlungsgesetz 14.04.2025 (Eintragungsdatum)\n\nSchmid GF GmbH\nGesellschaft mit beschränkter Haftung\nAugsburg\n\nDen Gläubigern der an der Verschmelzung beteiligten Rechtsträger ist, wenn sie binnen sechs Monaten nach dem Tag, an dem die Eintragung der Verschmelzung in das Register des Sitzes desjenigen Rechtsträgers, dessen Gläubiger sie sind, nach § 19 Abs. 3 UmwG als bekannt gemacht gilt, ihren Anspruch nach Grund und Höhe in Textform anmelden, Sicherheit zu leisten, soweit sie nicht Befriedigung verlangen können. Dieses Recht steht den Gläubigern jedoch nur zu, wenn sie glaubhaft machen, dass durch die Verschmelzung die Erfüllung ihrer Forderung gefährdet wird."
    },
    {
      "date": "2025-04-15",
      "id": "106554",
      "original_text": "Registerbekanntmachung nach dem Umwandlungsgesetz\nBayern Amtsgericht Augsburg HRB 39558\nRetail Shoe & Fashion Holding GmbH – Augsburg",
      "type": "Registerbekanntmachung nach dem Umwandlungsgesetz",
      "state": "Bayern",
      "amtsgericht": "Amtsgericht Augsburg",
      "registernummer": "HRB 39558",
      "registerart": "HRB",
      "company_name": "Retail Shoe & Fashion Holding GmbH",
      "company_seat": "Augsburg",
      "details": "15.04.2025 (Bekanntmachungsdatum)\n\nBayern Amtsgericht Augsburg HRB 39558\nRegisterbekanntmachung nach dem Umwandlungsgesetz 14.04.2025 (Eintragungsdatum)\n\nRetail Shoe & Fashion Holding GmbH\nGesellschaft mit beschränkter Haftung\nAugsburg\n\nDen Gläubigern der an der Verschmelzung beteiligten Rechtsträger ist, wenn sie binnen sechs Monaten nach dem Tag, an dem die Eintragung der Verschmelzung in das Register des Sitzes desjenigen Rechtsträgers, dessen Gläubiger sie sind, nach § 19 Abs. 3 UmwG als bekannt gemacht gilt, ihren Anspruch nach Grund und Höhe in Textform anmelden, Sicherheit zu leisten, soweit sie nicht Befriedigung verlangen können. Dieses Recht steht den Gläubigern jedoch nur zu, wenn sie glaubhaft machen, dass durch die Verschmelzung die Erfüllung ihrer Forderung gefährdet wird."
    },
    {
      "date": "2025-04-15",
      "id": "106555",
      "original_text": "Registerbekanntmachung nach dem Umwandlungsgesetz\nBayern Amtsgericht Augsburg HRB 6164\nLechwerke AG – Augsburg",
      "type": "Registerbekanntmachung nach dem Umwandlungsgesetz",
      "state": "Bayern",
      "amtsgericht": "Amtsgericht Augsburg",
      "registernummer": "HRB 6164",
      "registerart": "HRB",
      "company_name": "Lechwerke AG",
      "company_seat": "Augsburg",
      "details": "15.04.2025 (Bekanntmachungsdatum)\n\nBayern Amtsgericht Augsburg HRB 6164\nRegisterbekanntmachung nach dem Umwandlungsgesetz\n\nLechwerke AG\nAktiengesellschaft\nAugsburg\n\nDem Amtsgericht Augsburg -Registergericht- ist der Entwurf eines Ausgliederungs- und Übernahmevertrag zwischen der Bayerische Elektrizitätswerke GmbH, Augsburg (Amtsgericht Augsburg HRB 33347) und der Gesellschaft als übertragendem Rechtsträger zur Einsichtnahme eingereicht worden."
    },
    {
      "date": "2025-04-15",
      "id": "106556",
      "original_text": "Einreichung neuer Dokumente\nBayern Amtsgericht München HRB 240362\nBavarian International School (BIS) gemeinnützige Aktiengesellschaft – München",
      "type": "Einreichung neuer Dokumente",
      "state": "Bayern",
      "amtsgericht": "Amtsgericht München",
      "registernummer": "HRB 240362",
      "registerart": "HRB",
      "company_name": "Bavarian International School (BIS) gemeinnützige Aktiengesellschaft",
      "company_seat": "München",
      "details": "15.04.2025 (Bekanntmachungsdatum)\n\nBayern Amtsgericht München HRB 240362\nEinreichung neuer Dokumente\n\nBavarian International School (BIS) gemeinnützige Aktiengesellschaft\nAktiengesellschaft\nMünchen\n\nDem Amtsgericht München -Registergericht- ist eine Liste der Mitglieder des Aufsichtsrats eingereicht worden, § 106 AktG."
    },
    {
      "date": "2025-04-15",
      "id": "106557",
      "original_text": "Registerbekanntmachung nach dem Umwandlungsgesetz\nBayern Amtsgericht München HRB 203587\nLIVIA Industrial Strategies GmbH – München",
      "type": "Registerbekanntmachung nach dem Umwandlungsgesetz",
      "state": "Bayern",
      "amtsgericht": "Amtsgericht München",
      "registernummer": "HRB 203587",
      "registerart": "HRB",
      "company_name": "LIVIA Industrial Strategies GmbH",
      "company_seat": "München",
      "details": "15.04.2025 (Bekanntmachungsdatum)\n\nBayern Amtsgericht München HRB 203587\nRegisterbekanntmachung nach dem Umwandlungsgesetz 14.04.2025 (Eintragungsdatum)\n\nLIVIA Industrial Strategies GmbH\nGesellschaft mit beschränkter Haftung\nMünchen\n\nDen Gläubigern des formwechselnden Rechtsträgers ist, wenn sie binnen sechs Monaten nach dem Tag, an dem die Eintragung des Formwechsels nach § 201 UmwG als bekannt gemacht gilt, ihren Anspruch nach Grund und Höhe in Textform anmelden, Sicherheit zu leisten, soweit sie nicht Befriedigung verlangen können. Dieses Recht steht den Gläubigern jedoch nur zu, wenn sie glaubhaft machen, dass durch den Formwechsel die Erfüllung ihrer Forderung gefährdet wird."
    },
    {
      "date": "2025-04-15",
      "id": "106558",
      "original_text": "Registerbekanntmachung nach dem Umwandlungsgesetz\nBayern Amtsgericht Augsburg HRA 20005\nPrivabo GmbH & Co. KG – Adelsried",
      "type": "Registerbekanntmachung nach dem Umwandlungsgesetz",
      "state": "Bayern",
      "amtsgericht": "Amtsgericht Augsburg",
      "registernummer": "HRA 20005",
      "registerart": "HRA",
      "company_name": "Privabo GmbH & Co. KG",
      "company_seat": "Adelsried",
      "details": "15.04.2025 (Bekanntmachungsdatum)\n\nBayern Amtsgericht Augsburg HRA 20005\nRegisterbekanntmachung nach dem Umwandlungsgesetz 14.04.2025 (Eintragungsdatum)\n\nPrivabo GmbH & Co. KG\nKommanditgesellschaft\nAdelsried\n\nDen Gläubigern der an der Verschmelzung beteiligten Rechtsträger ist, wenn sie binnen sechs Monaten nach dem Tag, an dem die Eintragung der Verschmelzung in das Register des Sitzes desjenigen Rechtsträgers, dessen Gläubiger sie sind, nach § 19 Abs. 3 UmwG als bekannt gemacht gilt, ihren Anspruch nach Grund und Höhe in Textform anmelden, Sicherheit zu leisten, soweit sie nicht Befriedigung verlangen können. Dieses Recht steht den Gläubigern jedoch nur zu, wenn sie glaubhaft machen, dass durch die Verschmelzung die Erfüllung ihrer Forderung gefährdet wird."
    },
    {
      "date": "2025-04-15",
      "id": "106559",
      "original_text": "Löschungsankündigung\nBayern Amtsgericht Ingolstadt HRA 1315\nMichaelis GmbH & Co. KG – Eichstätt",
      "type": "Löschungsankündigung",
      "state": "Bayern",
      "amtsgericht": "Amtsgericht Ingolstadt",
      "registernummer": "HRA 1315",
      "registerart": "HRA",
      "company_name": "Michaelis GmbH & Co. KG",
      "company_seat": "Eichstätt",
      "details": "15.04.2025 (Bekanntmachungsdatum)\n\nBayern Amtsgericht Ingolstadt HRA 1315\nLöschungsankündigung\n\nMichaelis GmbH & Co. KG\nKommanditgesellschaft\nEichstätt\n\nDas Registergericht beabsichtigt, die im Handelsregister eingetragene Firma wegen Vermögenslosigkeit von Amts wegen nach § 394 FamFG zu löschen. #insert(Text=\"zztb_V_Widerspruchsfrist\")"
    },
    {
      "date": "2025-04-15",
      "id": "106560",
      "original_text": "Registerbekanntmachung nach dem Umwandlungsgesetz\nBayern Amtsgericht Landshut HRA 12805\nMW Bau GmbH & Co. KG – Zeilarn",
      "type": "Registerbekanntmachung nach dem Umwandlungsgesetz",
      "state": "Bayern",
      "amtsgericht": "Amtsgericht Landshut",
      "registernummer": "HRA 12805",
      "registerart": "HRA",
      "company_name": "MW Bau GmbH & Co. KG",
      "company_seat": "Zeilarn",
      "details": "15.04.2025 (Bekanntmachungsdatum)\n\nBayern Amtsgericht Landshut HRA 12805\nRegisterbekanntmachung nach dem Umwandlungsgesetz 14.04.2025 (Eintragungsdatum)\n\nMW Bau GmbH & Co. KG\nKommanditgesellschaft\nZeilarn\n\nDen Gläubigern der an der Ausgliederung beteiligten Rechtsträger ist, wenn sie binnen sechs Monaten nach dem Tag, an dem die Eintragung der Ausgliederung in das Register des Sitzes desjenigen Rechtsträgers, dessen Gläubiger sie sind, nach §§ 125, 19 Abs. 3 UmwG als bekannt gemacht gilt, ihren Anspruch nach Grund und Höhe in Textform anmelden, Sicherheit zu leisten, soweit sie nicht Befriedigung verlangen können. Dieses Recht steht den Gläubigern jedoch nur zu, wenn sie glaubhaft machen, dass durch die Ausgliederung die Erfüllung ihrer Forderung gefährdet wird."
    },
    {
      "date": "2025-04-15",
      "id": "106561",
      "original_text": "Löschungsankündigung\nBaden-Württemberg Amtsgericht Mannheim HRB 739781\nwebmotion.network GmbH – Hambrücken",
      "type": "Löschungsankündigung",
      "state": "Baden-Württemberg",
      "amtsgericht": "Amtsgericht Mannheim",
      "registernummer": "HRB 739781",
      "registerart": "HRB",
      "company_name": "webmotion.network GmbH",
      "company_seat": "Hambrücken",
      "details": "15.04.2025 (Bekanntmachungsdatum)\n\nBaden-Württemberg Amtsgericht Mannheim HRB 739781\nLöschungsankündigung\n\nwebmotion.network GmbH\nGesellschaft mit beschränkter Haftung\nHambrücken\n\nAls nicht eingetragen wird bekanntgemacht:\nDas Gericht beabsichtigt, die Gesellschaft wegen Vermögenslosigkeit im Handelsregister von Amts wegen nach § 394 FamFG zu löschen. Die Frist zur Geltendmachung eines Widerspruchs gegen die beabsichtigte Löschung ist auf einen Monat ab Veröffentlichung bestimmt."
    },
    {
      "date": "2025-04-15",
      "id": "106562",
      "original_text": "Einreichung neuer Dokumente\nSaarland Amtsgericht Saarbrücken HRB 4751\nCOSMOS Lebensversicherungs-Aktiengesellschaft – Saarbrücken",
      "type": "Einreichung neuer Dokumente",
      "state": "Saarland",
      "amtsgericht": "Amtsgericht Saarbrücken",
      "registernummer": "HRB 4751",
      "registerart": "HRB",
      "company_name": "COSMOS Lebensversicherungs-Aktiengesellschaft",
      "company_seat": "Saarbrücken",
      "details": "15.04.2025 (Bekanntmachungsdatum)\n\nSaarland Amtsgericht Saarbrücken HRB 4751\nEinreichung neuer Dokumente\n\nCOSMOS Lebensversicherungs-Aktiengesellschaft\nAktiengesellschaft\nSaarbrücken\n\nDer Vorstand der Gesellschaft hat eine Liste der Mitglieder des Aufsichtsrats zum Handelsregister eingereicht (§ 106 AktG)."
    },
    {
      "date": "2025-04-15",
      "id": "106563",
      "original_text": "Löschungsankündigung\nBaden-Württemberg Amtsgericht Freiburg HRB 542030\nBollmann Systems GmbH – Gottmadingen",
      "type": "Löschungsankündigung",
      "state": "Baden-Württemberg",
      "amtsgericht": "Amtsgericht Freiburg",
      "registernummer": "HRB 542030",
      "registerart": "HRB",
      "company_name": "Bollmann Systems GmbH",
      "company_seat": "Gottmadingen",
      "details": "15.04.2025 (Bekanntmachungsdatum)\n\nBaden-Württemberg Amtsgericht Freiburg HRB 542030\nLöschungsankündigung\n\nBollmann Systems GmbH\nGesellschaft mit beschränkter Haftung\nGottmadingen\n\nAls nicht eingetragen wird bekanntgemacht:\nDas Gericht beabsichtigt, die Gesellschaft wegen Vermögenslosigkeit im Handelsregister von Amts wegen nach § 394 FamFG zu löschen. Die Frist zur Geltendmachung eines Widerspruchs gegen die beabsichtigte Löschung ist auf einen Monat ab Veröffentlichung bestimmt."
    },
    {
      "date": "2025-04-15",
      "id": "106564",
      "original_text": "Registerbekanntmachung nach dem Umwandlungsgesetz\nBrandenburg Amtsgericht Potsdam HRA 8578\nStusche GmbH & Co.OHG – Teltow",
      "type": "Registerbekanntmachung nach dem Umwandlungsgesetz",
      "state": "Brandenburg",
      "amtsgericht": "Amtsgericht Potsdam",
      "registernummer": "HRA 8578",
      "registerart": "HRA",
      "company_name": "Stusche GmbH & Co.OHG",
      "company_seat": "Teltow",
      "details": "15.04.2025 (Bekanntmachungsdatum)\n\nBrandenburg Amtsgericht Potsdam HRA 8578\nRegisterbekanntmachung nach dem Umwandlungsgesetz 14.04.2025 (Eintragungsdatum)\n\nStusche GmbH & Co.OHG\nOffene Handelsgesellschaft\nTeltow\n\nZu Eintragungsnummer 4 vom 14.04.2025 wird als nicht eingetragen veröffentlicht: Als nicht eingetragen wird veröffentlicht:\nDen Gläubigern der an der Umwandlung beteiligten Rechtsträger ist, wenn sie binnen sechs Monaten nach dem Tag, an dem die Eintragung der Umwandlung in das Register des Sitzes desjenigen Rechtsträgers, dessen Gläubiger sie sind, als bekannt gemacht gilt, ihren Anspruch nach Grund und Höhe schriftlich anmelden, Sicherheit zu leisten, soweit sie nicht Befriedigung verlangen können. Dieses Recht steht den Gläubigern jedoch nur zu, wenn sie glaubhaft machen, dass durch die Umwandlung die Erfüllung ihrer Forderung gefährdet wird."
    },
    {
      "date": "2025-04-15",
      "id": "106565",
      "original_text": "Löschungsankündigung\nMecklenburg-Vorpommern Amtsgericht Rostock HRB 15217\nEM AESTHETIC MED GmbH – Rostock",
      "type": "Löschungsankündigung",
      "state": "Mecklenburg-Vorpommern",
      "amtsgericht": "Amtsgericht Rostock",
      "registernummer": "HRB 15217",
      "registerart": "HRB",
      "company_name": "EM AESTHETIC MED GmbH",
      "company_seat": "Rostock",
      "details": "15.04.2025 (Bekanntmachungsdatum)\n\nMecklenburg-Vorpommern Amtsgericht Rostock HRB 15217\nLöschungsankündigung\n\nEM AESTHETIC MED GmbH\nGesellschaft mit beschränkter Haftung\nRostock\n\nDas Registergericht beabsichtigt, die im Handelsregister eingetragene Gesellschaft von Amts wegen nach § 394 FamFG zu löschen. Die Frist zur Erhebung eines Widerspruchs gegen die beabsichtigte Löschung wird auf einen Monate festgesetzt."
    },
    {
      "date": "2025-04-15",
      "id": "106566",
      "original_text": "Registerbekanntmachung nach dem Umwandlungsgesetz\nBerlin Amtsgericht Berlin (Charlottenburg) HRB 137060\neasybell GmbH – Berlin",
      "type": "Registerbekanntmachung nach dem Umwandlungsgesetz",
      "state": "Berlin",
      "amtsgericht": "Amtsgericht Berlin (Charlottenburg)",
      "registernummer": "HRB 137060",
      "registerart": "HRB",
      "company_name": "easybell GmbH",
      "company_seat": "Berlin",
      "details": "15.04.2025 (Bekanntmachungsdatum)\n\nBerlin Amtsgericht Berlin (Charlottenburg) HRB 137060\nRegisterbekanntmachung nach dem Umwandlungsgesetz 14.04.2025 (Eintragungsdatum)\n\neasybell GmbH\nGesellschaft mit beschränkter Haftung\nBerlin\n\nZu Eintragungsnummer 9 vom 14.04.2025 wird als nicht eingetragen veröffentlicht:Den Gläubigern der an der Verschmelzung beteiligten Rechtsträger ist, wenn sie binnen sechs Monaten nach dem Tag, an dem die Eintragung der Verschmelzung in das Register des Sitzes desjenigen Rechtsträgers, dessen Gläubiger sie sind, als bekannt gemacht gilt, ihren Anspruch nach Grund und Höhe schriftlich anmelden, Sicherheit zu leisten, soweit sie nicht Befriedigung verlangen können. Dieses Recht steht den Gläubigern jedoch nur zu, wenn sie glaubhaft machen, dass durch die Verschmelzung die Erfüllung ihrer Forderung gefährdet wird. Das Recht, Sicherheitsleistung zu verlangen, steht Gläubigern nicht zu, die im Falle der Insolvenz ein Recht auf vorzugsweise Befriedigung aus einer Deckungsmasse haben, die nach gesetzlicher Vorschrift zu ihrem Schutz errichtet und staatlich überwacht ist."
    },
    {
      "date": "2025-04-15",
      "id": "106567",
      "original_text": "Einreichung neuer Dokumente\nBaden-Württemberg Amtsgericht Ulm HRB 741884\nDiG[i]Komm - Dienstleistungsgesellschaft für kommunale Aufgaben mbH – Giengen an der Brenz",
      "type": "Einreichung neuer Dokumente",
      "state": "Baden-Württemberg",
      "amtsgericht": "Amtsgericht Ulm",
      "registernummer": "HRB 741884",
      "registerart": "HRB",
      "company_name": "DiG[i]Komm - Dienstleistungsgesellschaft für kommunale Aufgaben mbH",
      "company_seat": "Giengen an der Brenz",
      "details": "15.04.2025 (Bekanntmachungsdatum)\n\nBaden-Württemberg Amtsgericht Ulm HRB 741884\nEinreichung neuer Dokumente\n\nDiG[i]Komm - Dienstleistungsgesellschaft für kommunale Aufgaben mbH\nGesellschaft mit beschränkter Haftung\nGiengen an der Brenz\n\nDie Gesellschaft hat am 11.04.2025 die Liste über die Zusammensetzung des Aufsichtsrats zum Handelsregister eingereicht."
    },
    {
      "date": "2025-04-15",
      "id": "106568",
      "original_text": "Löschungsankündigung\nMecklenburg-Vorpommern Amtsgericht Rostock HRB 10433\nATL - Agrotranslogistik GmbH – Roggentin",
      "type": "Löschungsankündigung",
      "state": "Mecklenburg-Vorpommern",
      "amtsgericht": "Amtsgericht Rostock",
      "registernummer": "HRB 10433",
      "registerart": "HRB",
      "company_name": "ATL - Agrotranslogistik GmbH",
      "company_seat": "Roggentin",
      "details": "15.04.2025 (Bekanntmachungsdatum)\n\nMecklenburg-Vorpommern Amtsgericht Rostock HRB 10433\nLöschungsankündigung\n\nATL - Agrotranslogistik GmbH\nGesellschaft mit beschränkter Haftung\nRoggentin\n\nDas Registergericht beabsichtigt, die im Handelsregister eingetragene Gesellschaft von Amts wegen nach § 394 FamFG zu löschen. Die Frist zur Erhebung eines Widerspruchs gegen die beabsichtigte Löschung wird auf einen Monat festgesetzt."
    },
    {
      "date": "2025-04-15",
      "id": "106569",
      "original_text": "Löschungsankündigung\nBaden-Württemberg Amtsgericht Freiburg HRA 601625\nHubert Herr Uhrenfabrik u. Holzschnitzerei GmbH & Co. KG – Triberg im Schwarzwald",
      "type": "Löschungsankündigung",
      "state": "Baden-Württemberg",
      "amtsgericht": "Amtsgericht Freiburg",
      "registernummer": "HRA 601625",
      "registerart": "HRA",
      "company_name": "Hubert Herr Uhrenfabrik u. Holzschnitzerei GmbH & Co. KG",
      "company_seat": "Triberg im Schwarzwald",
      "details": "15.04.2025 (Bekanntmachungsdatum)\n\nBaden-Württemberg Amtsgericht Freiburg HRA 601625\nLöschungsankündigung\n\nHubert Herr Uhrenfabrik u. Holzschnitzerei GmbH & Co. KG\nKommanditgesellschaft\nTriberg im Schwarzwald\n\nAls nicht eingetragen wird bekanntgemacht:\nDas Gericht beabsichtigt, die Gesellschaft wegen Vermögenslosigkeit im Handelsregister von Amts wegen nach § 394 FamFG zu löschen. Die Frist zur Geltendmachung eines Widerspruchs gegen die beabsichtigte Löschung ist auf einen Monat ab Veröffentlichung bestimmt."
    },
    {
      "date": "2025-04-15",
      "id": "106570",
      "original_text": "Löschungsankündigung\nBerlin Amtsgericht Berlin (Charlottenburg) HRB 87955\nGrundstücksgesellschaft Spindlerbrunnen mbH – Berlin",
      "type": "Löschungsankündigung",
      "state": "Berlin",
      "amtsgericht": "Amtsgericht Berlin (Charlottenburg)",
      "registernummer": "HRB 87955",
      "registerart": "HRB",
      "company_name": "Grundstücksgesellschaft Spindlerbrunnen mbH",
      "company_seat": "Berlin",
      "details": "15.04.2025 (Bekanntmachungsdatum)\n\nBerlin Amtsgericht Berlin (Charlottenburg) HRB 87955\nLöschungsankündigung\n\nGrundstücksgesellschaft Spindlerbrunnen mbH\nGesellschaft mit beschränkter Haftung\nBerlin\n\nBei der nachstehenden Gesellschaft wird das Amtslöschungsverfahren gemäß § 394 FamFG eingeleitet. Widerspruchsfrist 6 Wochen"
    },
    {
      "date": "2025-04-15",
      "id": "106571",
      "original_text": "Registerbekanntmachung nach dem Umwandlungsgesetz\nBaden-Württemberg Amtsgericht Stuttgart HRB 790636\nF/M Facility Management GmbH – Stuttgart",
      "type": "Registerbekanntmachung nach dem Umwandlungsgesetz",
      "state": "Baden-Württemberg",
      "amtsgericht": "Amtsgericht Stuttgart",
      "registernummer": "HRB 790636",
      "registerart": "HRB",
      "company_name": "F/M Facility Management GmbH",
      "company_seat": "Stuttgart",
      "details": "15.04.2025 (Bekanntmachungsdatum)\n\nBaden-Württemberg Amtsgericht Stuttgart HRB 790636\nRegisterbekanntmachung nach dem Umwandlungsgesetz 15.04.2025 (Eintragungsdatum)\n\nF/M Facility Management GmbH\nGesellschaft mit beschränkter Haftung\nStuttgart\n\nAls nicht eingetragen wird bekanntgemacht:\nDen Gläubigern der an der Verschmelzung beteiligten Rechtsträger ist, wenn sie binnen sechs Monaten nach dem Tag, an dem die Eintragung der Verschmelzung in das Register des Sitzes desjenigen Rechtsträgers, dessen Gläubiger sie sind, nach § 19 Abs. 3 UmwG als bekanntgemacht gilt, ihren Anspruch nach Grund und Höhe schriftlich anmelden, Sicherheit zu leisten, soweit sie nicht Befriedigung verlangen können. Dieses Recht steht den Gläubigern jedoch nur zu, wenn sie glaubhaft machen, dass durch die Verschmelzung die Erfüllung ihrer Forderung gefährdet wird."
    },
    {
      "date": "2025-04-15",
      "id": "106572",
      "original_text": "Löschungsankündigung\nBaden-Württemberg Amtsgericht Stuttgart HRA 720209\nFerhat Albayrak e.K. – Sindelfingen",
      "type": "Löschungsankündigung",
      "state": "Baden-Württemberg",
      "amtsgericht": "Amtsgericht Stuttgart",
      "registernummer": "HRA 720209",
      "registerart": "HRA",
      "company_name": "Ferhat Albayrak e.K.",
      "company_seat": "Sindelfingen",
      "details": "15.04.2025 (Bekanntmachungsdatum)\n\nBaden-Württemberg Amtsgericht Stuttgart HRA 720209\nLöschungsankündigung\n\nFerhat Albayrak e.K.\nEinzelkaufmann / Einzelkauffrau\nSindelfingen\n\nDas Registergericht beabsichtigt, die Firma im Handelsregister von Amts wegen nach § 31 Abs. 2 HGB zu löschen. Die Frist zur Geltendmachung eines Widerspruchs gegen die beabsichtigte Löschung ist auf einen Monat ab Veröffentlichung bestimmt."
    },
    {
      "date": "2025-04-15",
      "id": "106573",
      "original_text": "Registerbekanntmachung nach dem Umwandlungsgesetz\nBaden-Württemberg Amtsgericht Stuttgart HRB 729247\nWolff Gruppe GmbH – Stuttgart",
      "type": "Registerbekanntmachung nach dem Umwandlungsgesetz",
      "state": "Baden-Württemberg",
      "amtsgericht": "Amtsgericht Stuttgart",
      "registernummer": "HRB 729247",
      "registerart": "HRB",
      "company_name": "Wolff Gruppe GmbH",
      "company_seat": "Stuttgart",
      "details": "15.04.2025 (Bekanntmachungsdatum)\n\nBaden-Württemberg Amtsgericht Stuttgart HRB 729247\nRegisterbekanntmachung nach dem Umwandlungsgesetz 15.04.2025 (Eintragungsdatum)\n\nWolff Gruppe GmbH\nGesellschaft mit beschränkter Haftung\nStuttgart\n\nAls nicht eingetragen wird bekanntgemacht:\nDen Gläubigern der an der Verschmelzung beteiligten Rechtsträger ist, wenn sie binnen sechs Monaten nach dem Tag, an dem die Eintragung der Verschmelzung in das Register des Sitzes desjenigen Rechtsträgers, dessen Gläubiger sie sind, nach § 19 Abs. 3 UmwG als bekanntgemacht gilt, ihren Anspruch nach Grund und Höhe schriftlich anmelden, Sicherheit zu leisten, soweit sie nicht Befriedigung verlangen können. Dieses Recht steht den Gläubigern jedoch nur zu, wenn sie glaubhaft machen, dass durch die Verschmelzung die Erfüllung ihrer Forderung gefährdet wird."
    },
    {
      "date": "2025-04-15",
      "id": "106574",
      "original_text": "Einreichung neuer Dokumente\nBerlin Amtsgericht Berlin (Charlottenburg) HRB 84666\nHertha BSC GmbH & Co. Kommanditgesellschaft auf Aktien (KGaA) – Berlin",
      "type": "Einreichung neuer Dokumente",
      "state": "Berlin",
      "amtsgericht": "Amtsgericht Berlin (Charlottenburg)",
      "registernummer": "HRB 84666",
      "registerart": "HRB",
      "company_name": "Hertha BSC GmbH & Co. Kommanditgesellschaft auf Aktien (KGaA)",
      "company_seat": "Berlin",
      "details": "15.04.2025 (Bekanntmachungsdatum)\n\nBerlin Amtsgericht Berlin (Charlottenburg) HRB 84666\nEinreichung neuer Dokumente\n\nHertha BSC GmbH & Co. Kommanditgesellschaft auf Aktien (KGaA)\nKommanditgesellschaft auf Aktien\nBerlin\n\nAls nicht eingetragen wird veröffentlicht: Es wurde eine neue Liste der Aufsichtsratsmitglieder eingereicht (§52 GmbHG)."
    },
    {
      "date": "2025-04-15",
      "id": "106575",
      "original_text": "Registerbekanntmachung nach dem Umwandlungsgesetz\nSchleswig-Holstein Amtsgericht Kiel HRB 7331\nLässig Industrietechnik GmbH – Preetz",
      "type": "Registerbekanntmachung nach dem Umwandlungsgesetz",
      "state": "Schleswig-Holstein",
      "amtsgericht": "Amtsgericht Kiel",
      "registernummer": "HRB 7331",
      "registerart": "HRB",
      "company_name": "Lässig Industrietechnik GmbH",
      "company_seat": "Preetz",
      "details": "15.04.2025 (Bekanntmachungsdatum)\n\nSchleswig-Holstein Amtsgericht Kiel HRB 7331\nRegisterbekanntmachung nach dem Umwandlungsgesetz 14.04.2025 (Eintragungsdatum)\n\nLässig Industrietechnik GmbH\nGesellschaft mit beschränkter Haftung\nPreetz\n\nZu Eintragungsnummer 6 vom 14.04.2025 wird als nicht eingetragen veröffentlicht: Als nicht eingetragen wird veröffentlicht: Den Gläubigern der an der Verschmelzung beteiligten Rechtsträger ist, wenn sie binnen sechs Monaten nach dem Tag, an dem die Eintragung der Verschmelzung in das Register des Sitzes desjenigen Rechtsträgers, dessen Gläubiger sie sind, nach § 19 Abs. 3 UmwG bekannt gemacht worden ist, ihren Anspruch nach Grund und Höhe schriftlich anmelden, Sicherheit zu leisten, soweit sie nicht Befriedigung verlangen können. Dieses Recht steht den Gläubigern jedoch nur zu, wenn sie glaubhaft machen, dass durch die Verschmelzung die Erfüllung ihrer Forderung gefährdet wird."
    },
    {
      "date": "2025-04-15",
      "id": "106576",
      "original_text": "Registerbekanntmachung nach dem Umwandlungsgesetz\nSchleswig-Holstein Amtsgericht Kiel HRA 12686\nThomas Martin Lässig e.K. – Preetz",
      "type": "Registerbekanntmachung nach dem Umwandlungsgesetz",
      "state": "Schleswig-Holstein",
      "amtsgericht": "Amtsgericht Kiel",
      "registernummer": "HRA 12686",
      "registerart": "HRA",
      "company_name": "Thomas Martin Lässig e.K.",
      "company_seat": "Preetz",
      "details": "15.04.2025 (Bekanntmachungsdatum)\n\nSchleswig-Holstein Amtsgericht Kiel HRA 12686\nRegisterbekanntmachung nach dem Umwandlungsgesetz 14.04.2025 (Eintragungsdatum)\n\nThomas Martin Lässig e.K.\nEinzelkaufmann / Einzelkauffrau\nPreetz\n\nZu Eintragungsnummer 1 vom 14.04.2025 wird als nicht eingetragen veröffentlicht: Den Gläubigern der an der Verschmelzung beteiligten Rechtsträger ist, wenn sie binnen sechs Monaten nach dem Tag, an dem die Eintragung der Verschmelzung in das Register des Sitzes desjenigen Rechtsträgers, dessen Gläubiger sie sind, nach § 19 Abs. 3 UmwG bekannt gemacht worden ist, ihren Anspruch nach Grund und Höhe schriftlich anmelden, Sicherheit zu leisten, soweit sie nicht Befriedigung verlangen können. Dieses Recht steht den Gläubigern jedoch nur zu, wenn sie glaubhaft machen, dass durch die Verschmelzung die Erfüllung ihrer Forderung gefährdet wird."
    },
    {
      "date": "2025-04-15",
      "id": "106577",
      "original_text": "Einreichung neuer Dokumente\nBaden-Württemberg Amtsgericht Stuttgart HRB 14000\nRobert Bosch Gesellschaft mit beschränkter Haftung – Stuttgart",
      "type": "Einreichung neuer Dokumente",
      "state": "Baden-Württemberg",
      "amtsgericht": "Amtsgericht Stuttgart",
      "registernummer": "HRB 14000",
      "registerart": "HRB",
      "company_name": "Robert Bosch Gesellschaft mit beschränkter Haftung",
      "company_seat": "Stuttgart",
      "details": "15.04.2025 (Bekanntmachungsdatum)\n\nBaden-Württemberg Amtsgericht Stuttgart HRB 14000\nEinreichung neuer Dokumente\n\nRobert Bosch Gesellschaft mit beschränkter Haftung\nGesellschaft mit beschränkter Haftung\nStuttgart\n\nDie Gesellschaft hat am 08.04.2025 die Liste über die Zusammensetzung des Aufsichtsrats zum Handelsregister eingereicht."
    },
    {
      "date": "2025-04-15",
      "id": "106578",
      "original_text": "Löschungsankündigung\nMecklenburg-Vorpommern Amtsgericht Rostock HRB 13054\nSchillerstraße Verwaltungs GmbH – Rostock",
      "type": "Löschungsankündigung",
      "state": "Mecklenburg-Vorpommern",
      "amtsgericht": "Amtsgericht Rostock",
      "registernummer": "HRB 13054",
      "registerart": "HRB",
      "company_name": "Schillerstraße Verwaltungs GmbH",
      "company_seat": "Rostock",
      "details": "15.04.2025 (Bekanntmachungsdatum)\n\nMecklenburg-Vorpommern Amtsgericht Rostock HRB 13054\nLöschungsankündigung\n\nSchillerstraße Verwaltungs GmbH\nGesellschaft mit beschränkter Haftung\nRostock\n\nDas Registergericht beabsichtigt, die im Handelsregister eingetragene Gesellschaft von Amts wegen nach § 394 FamFG zu löschen. Die Frist zur Erhebung eines Widerspruchs gegen die beabsichtigte Löschung wird auf einen Monat festgesetzt."
    },
    {
      "date": "2025-04-15",
      "id": "106579",
      "original_text": "Einreichung neuer Dokumente\nSaarland Amtsgericht Saarbrücken HRB 7461\nCOSMOS Versicherung Aktiengesellschaft – Saarbrücken",
      "type": "Einreichung neuer Dokumente",
      "state": "Saarland",
      "amtsgericht": "Amtsgericht Saarbrücken",
      "registernummer": "HRB 7461",
      "registerart": "HRB",
      "company_name": "COSMOS Versicherung Aktiengesellschaft",
      "company_seat": "Saarbrücken",
      "details": "15.04.2025 (Bekanntmachungsdatum)\n\nSaarland Amtsgericht Saarbrücken HRB 7461\nEinreichung neuer Dokumente 11.03.2025 (Eintragungsdatum)\n\nCOSMOS Versicherung Aktiengesellschaft\nAktiengesellschaft\nSaarbrücken\n\nDer Vorstand der Gesellschaft hat eine Liste der Mitglieder des Aufsichtsrats zum Handelsregister eingereicht (§ 106 AktG)."
    },
    {
      "date": "2025-04-15",
      "id": "106580",
      "original_text": "Registerbekanntmachung nach dem Umwandlungsgesetz\nBerlin Amtsgericht Berlin (Charlottenburg) HRB 190784\nKester M3 Capital UG (haftungsbeschränkt) – Berlin",
      "type": "Registerbekanntmachung nach dem Umwandlungsgesetz",
      "state": "Berlin",
      "amtsgericht": "Amtsgericht Berlin (Charlottenburg)",
      "registernummer": "HRB 190784",
      "registerart": "HRB",
      "company_name": "Kester M3 Capital UG (haftungsbeschränkt)",
      "company_seat": "Berlin",
      "details": "15.04.2025 (Bekanntmachungsdatum)\n\nBerlin Amtsgericht Berlin (Charlottenburg) HRB 190784\nRegisterbekanntmachung nach dem Umwandlungsgesetz 14.04.2025 (Eintragungsdatum)\n\nKester M3 Capital UG (haftungsbeschränkt)\nGesellschaft mit beschränkter Haftung\nBerlin\n\nZu Eintragungsnummer 3 vom 14.04.2025 wird als nicht eingetragen veröffentlicht:\n\nDen Gläubigern der an der Verschmelzung beteiligten Rechtsträger ist, wenn sie binnen sechs Monaten nach dem Tag, an dem die Eintragung der Verschmelzung in das Register des Sitzes desjenigen Rechtsträgers, dessen Gläubiger sie sind, als bekannt gemacht gilt, ihren Anspruch nach Grund und Höhe schriftlich anmelden, Sicherheit zu leisten, soweit sie nicht Befriedigung verlangen können. Dieses Recht steht den Gläubigern jedoch nur zu, wenn sie glaubhaft machen, dass durch die Verschmelzung die Erfüllung ihrer Forderung gefährdet wird. Das Recht, Sicherheitsleistung zu verlangen, steht Gläubigern nicht zu, die im Falle der Insolvenz ein Recht auf vorzugsweise Befriedigung aus einer Deckungsmasse haben, die nach gesetzlicher Vorschrift zu ihrem Schutz errichtet und staatlich überwacht ist."
    },
    {
      "date": "2025-04-15",
      "id": "106581",
      "original_text": "Löschungsankündigung\nBerlin Amtsgericht Berlin (Charlottenburg) HRB 205245\nKaram Delivery GmbH – Berlin",
      "type": "Löschungsankündigung",
      "state": "Berlin",
      "amtsgericht": "Amtsgericht Berlin (Charlottenburg)",
      "registernummer": "HRB 205245",
      "registerart": "HRB",
      "company_name": "Karam Delivery GmbH",
      "company_seat": "Berlin",
      "details": "15.04.2025 (Bekanntmachungsdatum)\n\nBerlin Amtsgericht Berlin (Charlottenburg) HRB 205245\nLöschungsankündigung\n\nKaram Delivery GmbH\nGesellschaft mit beschränkter Haftung\nBerlin\n\nBei der nachstehenden Gesellschaft wird das Amtslöschungsverfahren gemäß § 394 FamFG eingeleitet. Widerspruchsfrist 6 Wochen"
    },
    {
      "date": "2025-04-15",
      "id": "106582",
      "original_text": "Löschungsankündigung\nBerlin Amtsgericht Berlin (Charlottenburg) HRB 42216\nAHA Beteiligungen und Grundbesitz mbH – Berlin",
      "type": "Löschungsankündigung",
      "state": "Berlin",
      "amtsgericht": "Amtsgericht Berlin (Charlottenburg)",
      "registernummer": "HRB 42216",
      "registerart": "HRB",
      "company_name": "AHA Beteiligungen und Grundbesitz mbH",
      "company_seat": "Berlin",
      "details": "15.04.2025 (Bekanntmachungsdatum)\n\nBerlin Amtsgericht Berlin (Charlottenburg) HRB 42216\nLöschungsankündigung\n\nAHA Beteiligungen und Grundbesitz mbH\nGesellschaft mit beschränkter Haftung\nBerlin\n\nBei der nachstehenden Gesellschaft wird das Amtslöschungsverfahren gemäß § 394 FamFG eingeleitet. Widerspruchsfrist 6 Wochen"
    },
    {
      "date": "2025-04-15",
      "id": "106583",
      "original_text": "Registerbekanntmachung nach dem Umwandlungsgesetz\nBerlin Amtsgericht Berlin (Charlottenburg) HRA 63973\nSAG Sicherheitsagentur M. Genzmer e.K. – Berlin",
      "type": "Registerbekanntmachung nach dem Umwandlungsgesetz",
      "state": "Berlin",
      "amtsgericht": "Amtsgericht Berlin (Charlottenburg)",
      "registernummer": "HRA 63973",
      "registerart": "HRA",
      "company_name": "SAG Sicherheitsagentur M. Genzmer e.K.",
      "company_seat": "Berlin",
      "details": "15.04.2025 (Bekanntmachungsdatum)\n\nBerlin Amtsgericht Berlin (Charlottenburg) HRA 63973\nRegisterbekanntmachung nach dem Umwandlungsgesetz 14.04.2025 (Eintragungsdatum)\n\nSAG Sicherheitsagentur M. Genzmer e.K.\nEinzelkaufmann / Einzelkauffrau\nBerlin\n\nZu Eintragungsnummer 2 vom 14.04.2025 wird als nicht eingetragen veröffentlicht: Den Gläubigern der an der Spaltung beteiligten Rechtsträger ist, wenn sie binnen sechs Monaten nach dem Tag, an dem die Eintragung der Spaltung in das Register des Sitzes desjenigen Rechtsträgers, dessen Gläubiger sie sind, als bekannt gemacht gilt, ihren Anspruch nach Grund und Höhe schriftlich anmelden, Sicherheit zu leisten, soweit sie nicht Befriedigung verlangen können. Dieses Recht steht den Gläubigern jedoch nur zu, wenn sie glaubhaft machen, dass durch die Spaltung die Erfüllung ihrer Forderung gefährdet wird. Das Recht, Sicherheitsleistung zu verlangen, steht Gläubigern nicht zu, die im Falle der Insolvenz ein Recht auf vorzugsweise Befriedigung aus einer Deckungsmasse haben, die nach gesetzlicher Vorschrift zu ihrem Schutz errichtet und staatlich überwacht ist."
    },
    {
      "date": "2025-04-15",
      "id": "106584",
      "original_text": "Registerbekanntmachung nach dem Umwandlungsgesetz\nBaden-Württemberg Amtsgericht Freiburg HRB 280071\nbhv Bau-Hausverwaltung GmbH – Waldkirch",
      "type": "Registerbekanntmachung nach dem Umwandlungsgesetz",
      "state": "Baden-Württemberg",
      "amtsgericht": "Amtsgericht Freiburg",
      "registernummer": "HRB 280071",
      "registerart": "HRB",
      "company_name": "bhv Bau-Hausverwaltung GmbH",
      "company_seat": "Waldkirch",
      "details": "15.04.2025 (Bekanntmachungsdatum)\n\nBaden-Württemberg Amtsgericht Freiburg HRB 280071\nRegisterbekanntmachung nach dem Umwandlungsgesetz 15.04.2025 (Eintragungsdatum)\n\nbhv Bau-Hausverwaltung GmbH\nGesellschaft mit beschränkter Haftung\nWaldkirch\n\nDen Gläubigern der an der Verschmelzung beteiligten Rechtsträger ist, wenn sie binnen sechs Monaten nach dem Tag, an dem die Eintragung der Verschmelzung in das Register des Sitzes desjenigen Rechtsträgers, dessen Gläubiger sie sind, nach § 19 Abs. 3 UmwG als bekanntgemacht gilt, ihren Anspruch nach Grund und Höhe schriftlich anmelden, Sicherheit zu leisten, soweit sie nicht Befriedigung verlangen können. Dieses Recht steht den Gläubigern jedoch nur zu, wenn sie glaubhaft machen, dass durch die Verschmelzung die Erfüllung ihrer Forderung gefährdet wird."
    },
    {
      "date": "2025-04-15",
      "id": "106585",
      "original_text": "Registerbekanntmachung nach dem Umwandlungsgesetz\nBerlin Amtsgericht Berlin (Charlottenburg) HRB 272560\nSAG Sicherheitsagentur GmbH – Berlin",
      "type": "Registerbekanntmachung nach dem Umwandlungsgesetz",
      "state": "Berlin",
      "amtsgericht": "Amtsgericht Berlin (Charlottenburg)",
      "registernummer": "HRB 272560",
      "registerart": "HRB",
      "company_name": "SAG Sicherheitsagentur GmbH",
      "company_seat": "Berlin",
      "details": "15.04.2025 (Bekanntmachungsdatum)\n\nBerlin Amtsgericht Berlin (Charlottenburg) HRB 272560\nRegisterbekanntmachung nach dem Umwandlungsgesetz 14.04.2025 (Eintragungsdatum)\n\nSAG Sicherheitsagentur GmbH\nGesellschaft mit beschränkter Haftung\nBerlin\n\nZu Eintragungsnummer 2 vom 14.04.2025 wird als nicht eingetragen veröffentlicht: Den Gläubigern der an der Spaltung beteiligten Rechtsträger ist, wenn sie binnen sechs Monaten nach dem Tag, an dem die Eintragung der Spaltung in das Register des Sitzes desjenigen Rechtsträgers, dessen Gläubiger sie sind, als bekannt gemacht gilt, ihren Anspruch nach Grund und Höhe schriftlich anmelden, Sicherheit zu leisten, soweit sie nicht Befriedigung verlangen können. Dieses Recht steht den Gläubigern jedoch nur zu, wenn sie glaubhaft machen, dass durch die Spaltung die Erfüllung ihrer Forderung gefährdet wird. Das Recht, Sicherheitsleistung zu verlangen, steht Gläubigern nicht zu, die im Falle der Insolvenz ein Recht auf vorzugsweise Befriedigung aus einer Deckungsmasse haben, die nach gesetzlicher Vorschrift zu ihrem Schutz errichtet und staatlich überwacht ist."
    },
    {
      "date": "2025-04-15",
      "id": "106586",
      "original_text": "Löschungsankündigung\nBerlin Amtsgericht Berlin (Charlottenburg) HRB 59204\nMosoft Gesellschaft für Vertrieb und Entwicklung von Software und Softwaresystemanlagen mbH – Berlin",
      "type": "Löschungsankündigung",
      "state": "Berlin",
      "amtsgericht": "Amtsgericht Berlin (Charlottenburg)",
      "registernummer": "HRB 59204",
      "registerart": "HRB",
      "company_name": "Mosoft Gesellschaft für Vertrieb und Entwicklung von Software und Softwaresystemanlagen mbH",
      "company_seat": "Berlin",
      "details": "15.04.2025 (Bekanntmachungsdatum)\n\nBerlin Amtsgericht Berlin (Charlottenburg) HRB 59204\nLöschungsankündigung\n\nMosoft Gesellschaft für Vertrieb und Entwicklung von Software und Softwaresystemanlagen mbH\nGesellschaft mit beschränkter Haftung\nBerlin\n\nBei der nachstehenden Gesellschaft wird das Amtslöschungsverfahren gemäß § 394 FamFG eingeleitet. Widerspruchsfrist 6 Wochen"
    },
    {
      "date": "2025-04-15",
      "id": "106587",
      "original_text": "Registerbekanntmachung nach dem Umwandlungsgesetz\nBaden-Württemberg Amtsgericht Stuttgart GnR 720293\nTHRIVE 2039 eG – Stuttgart",
      "type": "Registerbekanntmachung nach dem Umwandlungsgesetz",
      "state": "Baden-Württemberg",
      "amtsgericht": "Amtsgericht Stuttgart",
      "registernummer": "GnR 720293",
      "registerart": "GnR",
      "company_name": "THRIVE 2039 eG",
      "company_seat": "Stuttgart",
      "details": "15.04.2025 (Bekanntmachungsdatum)\n\nBaden-Württemberg Amtsgericht Stuttgart GnR 720293\nRegisterbekanntmachung nach dem Umwandlungsgesetz 15.04.2025 (Eintragungsdatum)\n\nTHRIVE 2039 eG\neingetragene Genossenschaft\nStuttgart\n\nAls nicht eingetragen wird bekanntgemacht:\nDen Gläubigern des an dem Formwechsel beteiligten Rechtsträgers ist, wenn sie binnen sechs Monaten nach dem Tag, an dem die Eintragung des Formwechsels in das Register des Sitzes desjenigen Rechtsträgers, dessen Gläubiger sie sind, nach § 19 Abs. 3 UmwG als bekanntgemacht gilt, ihren Anspruch nach Grund und Höhe schriftlich anmelden, Sicherheit zu leisten, soweit sie nicht Befriedigung verlangen können. Dieses Recht steht den Gläubigern jedoch nur zu, wenn sie glaubhaft machen, dass durch den Formwechsel die Erfüllung ihrer Forderung gefährdet wird."
    },
    {
      "date": "2025-04-15",
      "id": "106588",
      "original_text": "Registerbekanntmachung nach dem Umwandlungsgesetz\nBaden-Württemberg Amtsgericht Freiburg HRB 701696\nNuverta Immobilienverwaltung GmbH – Kenzingen",
      "type": "Registerbekanntmachung nach dem Umwandlungsgesetz",
      "state": "Baden-Württemberg",
      "amtsgericht": "Amtsgericht Freiburg",
      "registernummer": "HRB 701696",
      "registerart": "HRB",
      "company_name": "Nuverta Immobilienverwaltung GmbH",
      "company_seat": "Kenzingen",
      "details": "15.04.2025 (Bekanntmachungsdatum)\n\nBaden-Württemberg Amtsgericht Freiburg HRB 701696\nRegisterbekanntmachung nach dem Umwandlungsgesetz 15.04.2025 (Eintragungsdatum)\n\nNuverta Immobilienverwaltung GmbH\nGesellschaft mit beschränkter Haftung\nKenzingen\n\nAls nicht eingetragen wird bekanntgemacht:\nDen Gläubigern der an der Verschmelzung beteiligten Rechtsträger ist, wenn sie binnen sechs Monaten nach dem Tag, an dem die Eintragung der Verschmelzung in das Register des Sitzes desjenigen Rechtsträgers, dessen Gläubiger sie sind, nach § 19 Abs. 3 UmwG als bekanntgemacht gilt, ihren Anspruch nach Grund und Höhe schriftlich anmelden, Sicherheit zu leisten, soweit sie nicht Befriedigung verlangen können. Dieses Recht steht den Gläubigern jedoch nur zu, wenn sie glaubhaft machen, dass durch die Verschmelzung die Erfüllung ihrer Forderung gefährdet wird."
    },
    {
      "date": "2025-04-15",
      "id": "106589",
      "original_text": "Registerbekanntmachung nach dem Umwandlungsgesetz\nBaden-Württemberg Amtsgericht Stuttgart HRB 782589\nTHRIVE 2039 GmbH – Stuttgart",
      "type": "Registerbekanntmachung nach dem Umwandlungsgesetz",
      "state": "Baden-Württemberg",
      "amtsgericht": "Amtsgericht Stuttgart",
      "registernummer": "HRB 782589",
      "registerart": "HRB",
      "company_name": "THRIVE 2039 GmbH",
      "company_seat": "Stuttgart",
      "details": "15.04.2025 (Bekanntmachungsdatum)\n\nBaden-Württemberg Amtsgericht Stuttgart HRB 782589\nRegisterbekanntmachung nach dem Umwandlungsgesetz 15.04.2025 (Eintragungsdatum)\n\nTHRIVE 2039 GmbH\nGesellschaft mit beschränkter Haftung\nStuttgart\n\nAls nicht eingetragen wird bekanntgemacht:\nDen Gläubigern des an dem Formwechsel beteiligten Rechtsträgers ist, wenn sie binnen sechs Monaten nach dem Tag, an dem die Eintragung des Formwechsels in das Register des Sitzes desjenigen Rechtsträgers, dessen Gläubiger sie sind, nach § 19 Abs. 3 UmwG als bekanntgemacht gilt, ihren Anspruch nach Grund und Höhe schriftlich anmelden, Sicherheit zu leisten, soweit sie nicht Befriedigung verlangen können. Dieses Recht steht den Gläubigern jedoch nur zu, wenn sie glaubhaft machen, dass durch den Formwechsel die Erfüllung ihrer Forderung gefährdet wird."
    },
    {
      "date": "2025-04-15",
      "id": "106590",
      "original_text": "Registerbekanntmachung nach dem Umwandlungsgesetz\nBerlin Amtsgericht Berlin (Charlottenburg) HRA 63195\nGebrüder Michels GmbH & Co. KG – Berlin",
      "type": "Registerbekanntmachung nach dem Umwandlungsgesetz",
      "state": "Berlin",
      "amtsgericht": "Amtsgericht Berlin (Charlottenburg)",
      "registernummer": "HRA 63195",
      "registerart": "HRA",
      "company_name": "Gebrüder Michels GmbH & Co. KG",
      "company_seat": "Berlin",
      "details": "15.04.2025 (Bekanntmachungsdatum)\n\nBerlin Amtsgericht Berlin (Charlottenburg) HRA 63195\nRegisterbekanntmachung nach dem Umwandlungsgesetz 14.04.2025 (Eintragungsdatum)\n\nGebrüder Michels GmbH & Co. KG\nKommanditgesellschaft\nBerlin\n\nZu Eintragungsnummer 7 vom 14.04.2025 wird als nicht eingetragen veröffentlicht:\nDen Gläubigern der an der Verschmelzung beteiligten Rechtsträger ist, wenn sie binnen sechs Monaten nach dem Tag, an dem die Eintragung der Verschmelzung in das Register des Sitzes desjenigen Rechtsträgers, dessen Gläubiger sie sind, als bekannt gemacht gilt, ihren Anspruch nach Grund und Höhe schriftlich anmelden, Sicherheit zu leisten, soweit sie nicht Befriedigung verlangen können. Dieses Recht steht den Gläubigern jedoch nur zu, wenn sie glaubhaft machen, dass durch die Verschmelzung die Erfüllung ihrer Forderung gefährdet wird. Das Recht, Sicherheitsleistung zu verlangen, steht Gläubigern nicht zu, die im Falle der Insolvenz ein Recht auf vorzugsweise Befriedigung aus einer Deckungsmasse haben, die nach gesetzlicher Vorschrift zu ihrem Schutz errichtet und staatlich überwacht ist."
    },
    {
      "date": "2025-04-15",
      "id": "106591",
      "original_text": "Einreichung neuer Dokumente\nBerlin Amtsgericht Berlin (Charlottenburg) HRB 34997\nBERLIN-CHEMIE Aktiengesellschaft – Berlin",
      "type": "Einreichung neuer Dokumente",
      "state": "Berlin",
      "amtsgericht": "Amtsgericht Berlin (Charlottenburg)",
      "registernummer": "HRB 34997",
      "registerart": "HRB",
      "company_name": "BERLIN-CHEMIE Aktiengesellschaft",
      "company_seat": "Berlin",
      "details": "15.04.2025 (Bekanntmachungsdatum)\n\nBerlin Amtsgericht Berlin (Charlottenburg) HRB 34997\nEinreichung neuer Dokumente\n\nBERLIN-CHEMIE Aktiengesellschaft\nAktiengesellschaft\nBerlin\n\nAls nicht eingetragen wird veröffentlicht:\n\nEs wurde eine neue Liste der Aufsichtsratsmitglieder eingereicht (§ 106 AktG)."
    },
    {
      "date": "2025-04-15",
      "id": "106592",
      "original_text": "Löschungsankündigung\nBrandenburg Amtsgericht Frankfurt/Oder HRB 37\nMärkische Bautreuhand GmbH – Fürstenwalde/Spree",
      "type": "Löschungsankündigung",
      "state": "Brandenburg",
      "amtsgericht": "Amtsgericht Frankfurt/Oder",
      "registernummer": "HRB 37",
      "registerart": "HRB",
      "company_name": "Märkische Bautreuhand GmbH",
      "company_seat": "Fürstenwalde/Spree",
      "details": "15.04.2025 (Bekanntmachungsdatum)\n\nBrandenburg Amtsgericht Frankfurt/Oder HRB 37\nLöschungsankündigung\n\nMärkische Bautreuhand GmbH\nGesellschaft mit beschränkter Haftung\nFürstenwalde/Spree\n\nBei der nachstehenden Gesellschaft wird das Amtslöschungsverfahren gemäß § 394 Abs. 1 FamFG eingeleitet."
    },
    {
      "date": "2025-04-15",
      "id": "106593",
      "original_text": "Löschungsankündigung\nBerlin Amtsgericht Berlin (Charlottenburg) HRB 99710\nRichfield Property Germany GmbH – Berlin",
      "type": "Löschungsankündigung",
      "state": "Berlin",
      "amtsgericht": "Amtsgericht Berlin (Charlottenburg)",
      "registernummer": "HRB 99710",
      "registerart": "HRB",
      "company_name": "Richfield Property Germany GmbH",
      "company_seat": "Berlin",
      "details": "15.04.2025 (Bekanntmachungsdatum)\n\nBerlin Amtsgericht Berlin (Charlottenburg) HRB 99710\nLöschungsankündigung\n\nRichfield Property Germany GmbH\nGesellschaft mit beschränkter Haftung\nBerlin\n\nBei der nachstehenden Gesellschaft wird das Amtslöschungsverfahren gemäß § 394 FamFG eingeleitet. Widerspruchsfrist 6 Wochen"
    },
    {
      "date": "2025-04-15",
      "id": "106594",
      "original_text": "Löschungsankündigung\nBaden-Württemberg Amtsgericht Mannheim HRB 714680\nSepron Service GmbH – Hügelsheim",
      "type": "Löschungsankündigung",
      "state": "Baden-Württemberg",
      "amtsgericht": "Amtsgericht Mannheim",
      "registernummer": "HRB 714680",
      "registerart": "HRB",
      "company_name": "Sepron Service GmbH",
      "company_seat": "Hügelsheim",
      "details": "15.04.2025 (Bekanntmachungsdatum)\n\nBaden-Württemberg Amtsgericht Mannheim HRB 714680\nLöschungsankündigung 15.04.2025 (Eintragungsdatum)\n\nSepron Service GmbH\nGesellschaft mit beschränkter Haftung\nHügelsheim\n\nDas Gericht beabsichtigt, die Gesellschaft wegen Vermögenslosigkeit im Handelsregister von Amts wegen nach § 394 FamFG zu löschen. Die Frist zur Geltendmachung eines Widerspruchs gegen die beabsichtigte Löschung ist auf einen Monat ab Veröffentlichung bestimmt."
    },
    {
      "date": "2025-04-15",
      "id": "106595",
      "original_text": "Sonstige Registerbekanntmachung\nHamburg Amtsgericht Hamburg HRB 89977\nVattenfall Europe Nuclear Energy GmbH – Hamburg",
      "type": "Sonstige Registerbekanntmachung",
      "state": "Hamburg",
      "amtsgericht": "Amtsgericht Hamburg",
      "registernummer": "HRB 89977",
      "registerart": "HRB",
      "company_name": "Vattenfall Europe Nuclear Energy GmbH",
      "company_seat": "Hamburg",
      "details": "15.04.2025 (Bekanntmachungsdatum)\n\nHamburg Amtsgericht Hamburg HRB 89977\nSonstige Registerbekanntmachung\n\nVattenfall Europe Nuclear Energy GmbH\nGesellschaft mit beschränkter Haftung\nHamburg\n\nAls nicht eingetragen wird bekannt gemacht: Liste des Aufsichtsrats wurde eingereicht."
    },
    {
      "date": "2025-04-15",
      "id": "106596",
      "original_text": "Löschungsankündigung\nMecklenburg-Vorpommern Amtsgericht Rostock HRB 14736\nGreen Competence Nord GmbH – Bützow",
      "type": "Löschungsankündigung",
      "state": "Mecklenburg-Vorpommern",
      "amtsgericht": "Amtsgericht Rostock",
      "registernummer": "HRB 14736",
      "registerart": "HRB",
      "company_name": "Green Competence Nord GmbH",
      "company_seat": "Bützow",
      "details": "15.04.2025 (Bekanntmachungsdatum)\n\nMecklenburg-Vorpommern Amtsgericht Rostock HRB 14736\nLöschungsankündigung\n\nGreen Competence Nord GmbH\nGesellschaft mit beschränkter Haftung\nBützow\n\nDas Registergericht beabsichtigt, die im Handelsregister eingetragene Gesellschaft von Amts wegen nach § 394 FamFG zu löschen. Die Frist zur Erhebung eines Widerspruchs gegen die beabsichtigte Löschung wird auf einen Monat festgesetzt."
    },
    {
      "date": "2025-04-15",
      "id": "106597",
      "original_text": "Registerbekanntmachung nach dem Umwandlungsgesetz\nSchleswig-Holstein Amtsgericht Pinneberg HRB 6784\nEUCON Technik & Service Ingenieurbüro GmbH – Heist",
      "type": "Registerbekanntmachung nach dem Umwandlungsgesetz",
      "state": "Schleswig-Holstein",
      "amtsgericht": "Amtsgericht Pinneberg",
      "registernummer": "HRB 6784",
      "registerart": "HRB",
      "company_name": "EUCON Technik & Service Ingenieurbüro GmbH",
      "company_seat": "Heist",
      "details": "15.04.2025 (Bekanntmachungsdatum)\n\nSchleswig-Holstein Amtsgericht Pinneberg HRB 6784\nRegisterbekanntmachung nach dem Umwandlungsgesetz 11.04.2025 (Eintragungsdatum)\n\nEUCON Technik & Service Ingenieurbüro GmbH\nGesellschaft mit beschränkter Haftung\nHeist\n\nZu Eintragungsnummer 10 vom 11.04.2025 wird als nicht eingetragen veröffentlicht:  Als nicht eingetragen wird veröffentlicht: Den Gläubigern der an der Verschmelzung beteiligten Rechtsträger ist, wenn sie binnen sechs Monaten nach dem Tag, an dem die Eintragung der Verschmelzung in das Register des Sitzes desjenigen Rechtsträgers, dessen Gläubiger sie sind, als bekannt gemacht gilt, ihren Anspruch nach Grund und Höhe schriftlich anmelden, Sicherheit zu leisten, soweit sie nicht Befriedigung verlangen können. Dieses Recht steht den Gläubigern jedoch nur zu, wenn sie glaubhaft machen, dass durch die Verschmelzung die Erfüllung ihrer Forderung gefährdet wird. Das Recht, Sicherheitsleistung zu verlangen, steht Gläubigern nicht zu, die im Falle der Insolvenz ein Recht auf vorzugsweise Befriedigung aus einer Deckungsmasse haben, die nach gesetzlicher Vorschrift zu ihrem Schutz errichtet und staatlich überwacht ist."
    },
    {
      "date": "2025-04-15",
      "id": "106598",
      "original_text": "Löschungsankündigung\nBaden-Württemberg Amtsgericht Mannheim HRA 704343\nSepron Service Providing Network GmbH & Co. KG – Hügelsheim",
      "type": "Löschungsankündigung",
      "state": "Baden-Württemberg",
      "amtsgericht": "Amtsgericht Mannheim",
      "registernummer": "HRA 704343",
      "registerart": "HRA",
      "company_name": "Sepron Service Providing Network GmbH & Co. KG",
      "company_seat": "Hügelsheim",
      "details": "15.04.2025 (Bekanntmachungsdatum)\n\nBaden-Württemberg Amtsgericht Mannheim HRA 704343\nLöschungsankündigung 15.04.2025 (Eintragungsdatum)\n\nSepron Service Providing Network GmbH & Co. KG\nKommanditgesellschaft\nHügelsheim\n\nDas Gericht beabsichtigt, die Gesellschaft wegen Vermögenslosigkeit im Handelsregister von Amts wegen nach § 394 FamFG zu löschen. Die Frist zur Geltendmachung eines Widerspruchs gegen die beabsichtigte Löschung ist auf einen Monat ab Veröffentlichung bestimmt."
    },
    {
      "date": "2025-04-15",
      "id": "106599",
      "original_text": "Einreichung neuer Dokumente\nThüringen Amtsgericht Jena HRB 112844\nDeutsches Nationaltheater und Staatskapelle Weimar Gesellschaft mit beschränkter Haftung - Staatstheater Thüringen - – Weimar",
      "type": "Einreichung neuer Dokumente",
      "state": "Thüringen",
      "amtsgericht": "Amtsgericht Jena",
      "registernummer": "HRB 112844",
      "registerart": "HRB",
      "company_name": "Deutsches Nationaltheater und Staatskapelle Weimar Gesellschaft mit beschränkter Haftung - Staatstheater Thüringen -",
      "company_seat": "Weimar",
      "details": "15.04.2025 (Bekanntmachungsdatum)\n\nThüringen Amtsgericht Jena HRB 112844\nEinreichung neuer Dokumente 03.04.2025 (Eintragungsdatum)\n\nDeutsches Nationaltheater und Staatskapelle Weimar Gesellschaft mit beschränkter Haftung - Staatstheater Thüringen -\nGesellschaft mit beschränkter Haftung\nWeimar\n\nBekanntmachung gem. § 52 Abs. 3 Satz 2 GmbHG: Aufgrund einer Veränderung in den Personen der Aufsichtsratsmitglieder ist durch die Geschäftsführer eine neue Liste zum Handelsregister eingereicht worden."
    },
    {
      "date": "2025-04-15",
      "id": "106600",
      "original_text": "Einreichung neuer Dokumente\nBaden-Württemberg Amtsgericht Stuttgart HRB 243294\nIBM Deutschland Research & Development GmbH – Böblingen",
      "type": "Einreichung neuer Dokumente",
      "state": "Baden-Württemberg",
      "amtsgericht": "Amtsgericht Stuttgart",
      "registernummer": "HRB 243294",
      "registerart": "HRB",
      "company_name": "IBM Deutschland Research & Development GmbH",
      "company_seat": "Böblingen",
      "details": "15.04.2025 (Bekanntmachungsdatum)\n\nBaden-Württemberg Amtsgericht Stuttgart HRB 243294\nEinreichung neuer Dokumente\n\nIBM Deutschland Research & Development GmbH\nGesellschaft mit beschränkter Haftung\nBöblingen\n\nDie Gesellschaft hat am 14.04.2025 die Liste über die Zusammensetzung des Aufsichtsrats zum Handelsregister eingereicht."
    },
    {
      "date": "2025-04-15",
      "id": "106601",
      "original_text": "Registerbekanntmachung nach dem Umwandlungsgesetz\nBerlin Amtsgericht Berlin (Charlottenburg) HRB 177365\nCustomlytics GmbH – Berlin",
      "type": "Registerbekanntmachung nach dem Umwandlungsgesetz",
      "state": "Berlin",
      "amtsgericht": "Amtsgericht Berlin (Charlottenburg)",
      "registernummer": "HRB 177365",
      "registerart": "HRB",
      "company_name": "Customlytics GmbH",
      "company_seat": "Berlin",
      "details": "15.04.2025 (Bekanntmachungsdatum)\n\nBerlin Amtsgericht Berlin (Charlottenburg) HRB 177365\nRegisterbekanntmachung nach dem Umwandlungsgesetz 14.04.2025 (Eintragungsdatum)\n\nCustomlytics GmbH\nGesellschaft mit beschränkter Haftung\nBerlin\n\nZu Eintragungsnummer 13 vom 14.04.2025 wird als nicht eingetragen veröffentlicht:Den Gläubigern der an der Verschmelzung beteiligten Rechtsträger ist, wenn sie binnen sechs Monaten nach dem Tag, an dem die Eintragung der Verschmelzung in das Register des Sitzes desjenigen Rechtsträgers, dessen Gläubiger sie sind, als bekannt gemacht gilt, ihren Anspruch nach Grund und Höhe schriftlich anmelden, Sicherheit zu leisten, soweit sie nicht Befriedigung verlangen können. Dieses Recht steht den Gläubigern jedoch nur zu, wenn sie glaubhaft machen, dass durch die Verschmelzung die Erfüllung ihrer Forderung gefährdet wird. Das Recht, Sicherheitsleistung zu verlangen, steht Gläubigern nicht zu, die im Falle der Insolvenz ein Recht auf vorzugsweise Befriedigung aus einer Deckungsmasse haben, die nach gesetzlicher Vorschrift zu ihrem Schutz errichtet und staatlich überwacht ist."
    },
    {
      "date": "2025-04-15",
      "id": "106602",
      "original_text": "Registerbekanntmachung nach dem Umwandlungsgesetz\nBerlin Amtsgericht Berlin (Charlottenburg) HRB 182850\nEL Projektentwicklung Mehringplatz GmbH – Berlin",
      "type": "Registerbekanntmachung nach dem Umwandlungsgesetz",
      "state": "Berlin",
      "amtsgericht": "Amtsgericht Berlin (Charlottenburg)",
      "registernummer": "HRB 182850",
      "registerart": "HRB",
      "company_name": "EL Projektentwicklung Mehringplatz GmbH",
      "company_seat": "Berlin",
      "details": "15.04.2025 (Bekanntmachungsdatum)\n\nBerlin Amtsgericht Berlin (Charlottenburg) HRB 182850\nRegisterbekanntmachung nach dem Umwandlungsgesetz\n\nEL Projektentwicklung Mehringplatz GmbH\nGesellschaft mit beschränkter Haftung\nBerlin\n\nAls nicht eingetragen wird veröffentlicht:\n\nDie Gesellschaft hat einen Formwechselplan vom 04.04.2025, UVZ-Nr. ME 261/2025 des Notars Dr. Thomas Meyer in Berlin, zum Handelsregister eingereicht.\n\nBeteiligt ist die EL Projektentwicklung Mehringplatz GmbH mit Sitz in Berlin (Amtsgericht Charlottenburg, HRB 182850 B), nach Vollzug des grenzüberschreitenden Formwechsels firmierend unter EL Projektentwicklung Mehringplatz S.á r.l., einzutragen im Registre de commerce et des sociétés (RCS) in Luxemburg, Nummer N.N.-\n\nDie Anteilsinhaber und Gläubiger der an der grenzüberschreitenden Verschmelzung beteiligten Gesellschaft sowie die zuständigen Betriebsräte der an der grenzüberschreitenden Verschmelzung beteiligten Gesellschaft oder, soweit es keinen Betriebsrat gibt, die Arbeitnehmer der an der grenzüberschreitenden Verschmelzung beteiligten Gesellschaft können der Gesellschaft spätestens fünf Arbeitstage vor dem Tag der Gesellschafterversammlung der EL Projektentwicklung Mehringplatz GmbH Bemerkungen zum Verschmelzungsplan übermitteln."
    },
    {
      "date": "2025-04-15",
      "id": "106603",
      "original_text": "Löschungsankündigung\nBaden-Württemberg Amtsgericht Stuttgart HRA 370511\nPeter Stoosss Entsorgungstechnik-GmbH & Co. KG – Engstingen",
      "type": "Löschungsankündigung",
      "state": "Baden-Württemberg",
      "amtsgericht": "Amtsgericht Stuttgart",
      "registernummer": "HRA 370511",
      "registerart": "HRA",
      "company_name": "Peter Stoosss Entsorgungstechnik-GmbH & Co. KG",
      "company_seat": "Engstingen",
      "details": "15.04.2025 (Bekanntmachungsdatum)\n\nBaden-Württemberg Amtsgericht Stuttgart HRA 370511\nLöschungsankündigung\n\nPeter Stoosss Entsorgungstechnik-GmbH & Co. KG\nKommanditgesellschaft\nEngstingen\n\nDas Gericht beabsichtigt, die Gesellschaft wegen Vermögenslosigkeit im Handelsregister von Amts wegen nach § 394 FamFG zu löschen. Die Frist zur Geltendmachung eines Widerspruchs gegen die beabsichtigte Löschung ist auf zwei Monate ab Veröffentlichung bestimmt."
    },
    {
      "date": "2025-04-15",
      "id": "106604",
      "original_text": "Registerbekanntmachung nach dem Umwandlungsgesetz\nBaden-Württemberg Amtsgericht Ulm GsR 1374\nX-ware Beteiligungs-eGbR – Amtzell",
      "type": "Registerbekanntmachung nach dem Umwandlungsgesetz",
      "state": "Baden-Württemberg",
      "amtsgericht": "Amtsgericht Ulm",
      "registernummer": "GsR 1374",
      "registerart": "GsR",
      "company_name": "X-ware Beteiligungs-eGbR",
      "company_seat": "Amtzell",
      "details": "15.04.2025 (Bekanntmachungsdatum)\n\nBaden-Württemberg Amtsgericht Ulm GsR 1374\nRegisterbekanntmachung nach dem Umwandlungsgesetz 15.04.2025 (Eintragungsdatum)\n\nX-ware Beteiligungs-eGbR\nGesellschaft bürgerlichen Rechts\nAmtzell\n\nAls nicht eingetragen wird bekanntgemacht:\nDen Gläubigern des an dem Formwechsel beteiligten Rechtsträgers ist, wenn sie binnen sechs Monaten nach dem Tag, an dem die Eintragung des Formwechsels in das Register des Sitzes desjenigen Rechtsträgers, dessen Gläubiger sie sind, nach § 19 Abs. 3 UmwG als bekanntgemacht gilt, ihren Anspruch nach Grund und Höhe schriftlich anmelden, Sicherheit zu leisten, soweit sie nicht Befriedigung verlangen können. Dieses Recht steht den Gläubigern jedoch nur zu, wenn sie glaubhaft machen, dass durch den Formwechsel die Erfüllung ihrer Forderung gefährdet wird."
    },
    {
      "date": "2025-04-15",
      "id": "106605",
      "original_text": "Registerbekanntmachung nach dem Umwandlungsgesetz\nBaden-Württemberg Amtsgericht Ulm HRB 620888\nX-ware Beteiligungs-GmbH – Amtzell",
      "type": "Registerbekanntmachung nach dem Umwandlungsgesetz",
      "state": "Baden-Württemberg",
      "amtsgericht": "Amtsgericht Ulm",
      "registernummer": "HRB 620888",
      "registerart": "HRB",
      "company_name": "X-ware Beteiligungs-GmbH",
      "company_seat": "Amtzell",
      "details": "15.04.2025 (Bekanntmachungsdatum)\n\nBaden-Württemberg Amtsgericht Ulm HRB 620888\nRegisterbekanntmachung nach dem Umwandlungsgesetz 15.04.2025 (Eintragungsdatum)\n\nX-ware Beteiligungs-GmbH\nGesellschaft mit beschränkter Haftung\nAmtzell\n\nAls nicht eingetragen wird bekanntgemacht:\nDen Gläubigern der an der Verschmelzung beteiligten Rechtsträger ist, wenn sie binnen sechs Monaten nach dem Tag, an dem die Eintragung der Verschmelzung in das Register des Sitzes desjenigen Rechtsträgers, dessen Gläubiger sie sind, nach § 19 Abs. 3 UmwG als bekanntgemacht gilt, ihren Anspruch nach Grund und Höhe schriftlich anmelden, Sicherheit zu leisten, soweit sie nicht Befriedigung verlangen können. Dieses Recht steht den Gläubigern jedoch nur zu, wenn sie glaubhaft machen, dass durch die Verschmelzung die Erfüllung ihrer Forderung gefährdet wird."
    },
    {
      "date": "2025-04-15",
      "id": "106606",
      "original_text": "Registerbekanntmachung nach dem Umwandlungsgesetz\nBaden-Württemberg Amtsgericht Stuttgart HRB 302366\nNÄGELE Automobile GmbH – Bietigheim-Bissingen",
      "type": "Registerbekanntmachung nach dem Umwandlungsgesetz",
      "state": "Baden-Württemberg",
      "amtsgericht": "Amtsgericht Stuttgart",
      "registernummer": "HRB 302366",
      "registerart": "HRB",
      "company_name": "NÄGELE Automobile GmbH",
      "company_seat": "Bietigheim-Bissingen",
      "details": "15.04.2025 (Bekanntmachungsdatum)\n\nBaden-Württemberg Amtsgericht Stuttgart HRB 302366\nRegisterbekanntmachung nach dem Umwandlungsgesetz 15.04.2025 (Eintragungsdatum)\n\nNÄGELE Automobile GmbH\nGesellschaft mit beschränkter Haftung\nBietigheim-Bissingen\n\nAls nicht eingetragen wird bekanntgemacht:\nDen Gläubigern der an der Verschmelzung beteiligten Rechtsträger ist, wenn sie binnen sechs Monaten nach dem Tag, an dem die Eintragung der Verschmelzung in das Register des Sitzes desjenigen Rechtsträgers, dessen Gläubiger sie sind, nach § 19 Abs. 3 UmwG als bekanntgemacht gilt, ihren Anspruch nach Grund und Höhe schriftlich anmelden, Sicherheit zu leisten, soweit sie nicht Befriedigung verlangen können. Dieses Recht steht den Gläubigern jedoch nur zu, wenn sie glaubhaft machen, dass durch die Verschmelzung die Erfüllung ihrer Forderung gefährdet wird."
    },
    {
      "date": "2025-04-15",
      "id": "106607",
      "original_text": "Löschungsankündigung\nBaden-Württemberg Amtsgericht Mannheim HRB 1358\nLindenhof Immobilien GmbH – Mannheim",
      "type": "Löschungsankündigung",
      "state": "Baden-Württemberg",
      "amtsgericht": "Amtsgericht Mannheim",
      "registernummer": "HRB 1358",
      "registerart": "HRB",
      "company_name": "Lindenhof Immobilien GmbH",
      "company_seat": "Mannheim",
      "details": "15.04.2025 (Bekanntmachungsdatum)\n\nBaden-Württemberg Amtsgericht Mannheim HRB 1358\nLöschungsankündigung\n\nLindenhof Immobilien GmbH\nGesellschaft mit beschränkter Haftung\nMannheim\n\nAls nicht eingetragen wird bekanntgemacht: Das Gericht beabsichtigt, die Gesellschaft wegen Vermögenslosigkeit im Handelsregister von Amts wegen nach § 394 FamFG zu löschen. Die Frist zur Geltendmachung eines Widerspruchs gegen die beabsichtigte Löschung ist auf einen Monat ab Veröffentlichung bestimmt."
    },
    {
      "date": "2025-04-15",
      "id": "106608",
      "original_text": "Löschungsankündigung\nBrandenburg Amtsgericht Potsdam HRB 14422\nHorst Hanschmann Baugesellschaft mbH – Werder (Havel)",
      "type": "Löschungsankündigung",
      "state": "Brandenburg",
      "amtsgericht": "Amtsgericht Potsdam",
      "registernummer": "HRB 14422",
      "registerart": "HRB",
      "company_name": "Horst Hanschmann Baugesellschaft mbH",
      "company_seat": "Werder (Havel)",
      "details": "15.04.2025 (Bekanntmachungsdatum)\n\nBrandenburg Amtsgericht Potsdam HRB 14422\nLöschungsankündigung\n\nHorst Hanschmann Baugesellschaft mbH\nGesellschaft mit beschränkter Haftung\nWerder (Havel)\n\nBei der nachstehenden Gesellschaft wird das Amtslöschungsverfahren gemäß § 394 FamFG eingeleitet. Widerspruchsfrist 8 Wochen"
    },
    {
      "date": "2025-04-15",
      "id": "106609",
      "original_text": "Sonstige Registerbekanntmachung\nSchleswig-Holstein Amtsgericht Lübeck HRA 9477\nEXITO EUROPE LTD & CO KG – Lübeck",
      "type": "Sonstige Registerbekanntmachung",
      "state": "Schleswig-Holstein",
      "amtsgericht": "Amtsgericht Lübeck",
      "registernummer": "HRA 9477",
      "registerart": "HRA",
      "company_name": "EXITO EUROPE LTD & CO KG",
      "company_seat": "Lübeck",
      "details": "15.04.2025 (Bekanntmachungsdatum)\n\nSchleswig-Holstein Amtsgericht Lübeck HRA 9477\nSonstige Registerbekanntmachung\n\nEXITO EUROPE LTD & CO KG\nKommanditgesellschaft\nLübeck\n\nAls nicht eingetragen wird veröffentlicht: In der Registersache EXITO EUROPE LTD & CO KG, Lübeck,\nwird um Mitteilung gebeten, ob sie noch aktiv handeln. Im deutschen Register ist die EXITO EUROPE LTD & CO KG eingetragen. Aufgrund Gesetzesänderung gibt es in Deutschland keine Limited mehr, es wäre somit die Löschung anzumelden. Dipl.-Rechtspflegerin (FH) Steder, Rechtspflegerin"
    },
    {
      "date": "2025-04-15",
      "id": "106610",
      "original_text": "Löschungsankündigung\nBerlin Amtsgericht Berlin (Charlottenburg) HRB 223156\nMego-Bistro GmbH – Berlin",
      "type": "Löschungsankündigung",
      "state": "Berlin",
      "amtsgericht": "Amtsgericht Berlin (Charlottenburg)",
      "registernummer": "HRB 223156",
      "registerart": "HRB",
      "company_name": "Mego-Bistro GmbH",
      "company_seat": "Berlin",
      "details": "15.04.2025 (Bekanntmachungsdatum)\n\nBerlin Amtsgericht Berlin (Charlottenburg) HRB 223156\nLöschungsankündigung\n\nMego-Bistro GmbH\nGesellschaft mit beschränkter Haftung\nBerlin\n\nBei der nachstehenden Gesellschaft wird das Amtslöschungsverfahren gemäß § 394 FamFG eingeleitet. Widerspruchsfrist 6 Wochen"
    },
    {
      "date": "2025-04-15",
      "id": "106611",
      "original_text": "Registerbekanntmachung nach dem Umwandlungsgesetz\nSachsen Amtsgericht Dresden HRB 46355\nPflegeTeam Bernstadt gGmbH – Bernstadt auf dem Eigen",
      "type": "Registerbekanntmachung nach dem Umwandlungsgesetz",
      "state": "Sachsen",
      "amtsgericht": "Amtsgericht Dresden",
      "registernummer": "HRB 46355",
      "registerart": "HRB",
      "company_name": "PflegeTeam Bernstadt gGmbH",
      "company_seat": "Bernstadt auf dem Eigen",
      "details": "15.04.2025 (Bekanntmachungsdatum)\n\nSachsen Amtsgericht Dresden HRB 46355\nRegisterbekanntmachung nach dem Umwandlungsgesetz 15.04.2025 (Eintragungsdatum)\n\nPflegeTeam Bernstadt gGmbH\nGesellschaft mit beschränkter Haftung\nBernstadt auf dem Eigen\n\nDen Gläubigern der an der Ausgliederung beteiligten Rechtsträger ist, wenn sie binnen sechs Monaten nach dem Tag, an dem die Eintragung der Ausgliederung in das Register des Sitzes desjenigen Rechtsträgers, dessen Gläubiger sie sind, nach § 19 Abs. 3 UmwG als bekannt gemacht gilt, ihren Anspruch nach Grund und Höhe in Textform anmelden, Sicherheit zu leisten, soweit sie nicht Befriedigung verlangen können. Dieses Recht steht den Gläubigern jedoch nur zu, wenn sie glaubhaft machen, dass durch die Ausgliederung die Erfüllung der Forderung gefährdet wird."
    },
    {
      "date": "2025-04-15",
      "id": "106612",
      "original_text": "Löschungsankündigung\nSachsen Amtsgericht Leipzig VR 5233\nFörderclub Chemie Sachsen Leipzig e.V. – Leipzig",
      "type": "Löschungsankündigung",
      "state": "Sachsen",
      "amtsgericht": "Amtsgericht Leipzig",
      "registernummer": "VR 5233",
      "registerart": "VR",
      "company_name": "Förderclub Chemie Sachsen Leipzig e.V.",
      "company_seat": "Leipzig",
      "details": "15.04.2025 (Bekanntmachungsdatum)\n\nSachsen Amtsgericht Leipzig VR 5233\nLöschungsankündigung\n\nFörderclub Chemie Sachsen Leipzig e.V.\neingetragener Verein\nLeipzig\n\nDas Gericht beabsichtigt, gemäß § 4 Absatz 2 Ziffer 1 der Verordnung über das Vereinsregister das Registerblatt  des Vereins zu schließen, da nach Mitteilung des bisherigen Vorstandes sämtliche Mitglieder aus dem Verein ausgeschieden sind. Zur Geltendmachung eines Widerspruchs gegen die beabsichtigte Schließung wird eine Frist von einem Monat nach der Veröffentlichung bestimmt."
    },
    {
      "date": "2025-04-15",
      "id": "106613",
      "original_text": "Registerbekanntmachung nach dem Umwandlungsgesetz\nSachsen Amtsgericht Leipzig HRB 40400\nNeuland medien GmbH – Leipzig",
      "type": "Registerbekanntmachung nach dem Umwandlungsgesetz",
      "state": "Sachsen",
      "amtsgericht": "Amtsgericht Leipzig",
      "registernummer": "HRB 40400",
      "registerart": "HRB",
      "company_name": "Neuland medien GmbH",
      "company_seat": "Leipzig",
      "details": "15.04.2025 (Bekanntmachungsdatum)\n\nSachsen Amtsgericht Leipzig HRB 40400\nRegisterbekanntmachung nach dem Umwandlungsgesetz 15.04.2025 (Eintragungsdatum)\n\nNeuland medien GmbH\nGesellschaft mit beschränkter Haftung\nLeipzig\n\nDen Gläubigern der an der Verschmelzung beteiligten Rechtsträger ist, wenn sie binnen sechs Monaten nach dem Tag, an dem die Eintragung der Verschmelzung in das Register des Sitzes desjenigen Rechtsträgers, dessen Gläubiger sie sind, nach § 19 Abs. 3 UmwG als bekannt gemacht gilt, ihren Anspruch nach Grund und Höhe in Textform anmelden, Sicherheit zu leisten, soweit sie nicht Befriedigung verlangen können. Dieses Recht steht den Gläubigern jedoch nur zu, wenn sie glaubhaft machen, dass durch die Verschmelzung die Erfüllung der Forderung gefährdet wird."
    },
    {
      "date": "2025-04-15",
      "id": "106614",
      "original_text": "Einreichung neuer Dokumente\nSachsen Amtsgericht Dresden HRB 15371\nBad Schandauer Kur- und Tourismus GmbH – Bad Schandau",
      "type": "Einreichung neuer Dokumente",
      "state": "Sachsen",
      "amtsgericht": "Amtsgericht Dresden",
      "registernummer": "HRB 15371",
      "registerart": "HRB",
      "company_name": "Bad Schandauer Kur- und Tourismus GmbH",
      "company_seat": "Bad Schandau",
      "details": "15.04.2025 (Bekanntmachungsdatum)\n\nSachsen Amtsgericht Dresden HRB 15371\nEinreichung neuer Dokumente\n\nBad Schandauer Kur- und Tourismus GmbH\nGesellschaft mit beschränkter Haftung\nBad Schandau\n\nAm 10.04.2025 wurde beim Handelsregister des Amtsgerichts Dresden die Liste der Mitglieder des Aufsichtsrats gemäß § 52 GmbHG eingereicht."
    },
    {
      "date": "2025-04-15",
      "id": "106615",
      "original_text": "Löschungsankündigung\nSachsen Amtsgericht Dresden HRB 20388\nSalus Bau GmbH – Dresden",
      "type": "Löschungsankündigung",
      "state": "Sachsen",
      "amtsgericht": "Amtsgericht Dresden",
      "registernummer": "HRB 20388",
      "registerart": "HRB",
      "company_name": "Salus Bau GmbH",
      "company_seat": "Dresden",
      "details": "15.04.2025 (Bekanntmachungsdatum)\n\nSachsen Amtsgericht Dresden HRB 20388\nLöschungsankündigung\n\nSalus Bau GmbH\nGesellschaft mit beschränkter Haftung\nDresden\n\nDas Registergericht beabsichtigt, die im Handelsregister eingetragene Gesellschaft von Amts wegen nach § 394 FamFG zu löschen. Die Frist zu Erhebung eines Widerspruchs gegen die beabsichtigte Löschung wird auf einen Monat festgesetzt."
    },
    {
      "date": "2025-04-15",
      "id": "106616",
      "original_text": "Löschungsankündigung\nSachsen Amtsgericht Chemnitz HRB 26602\nKlemm & Schmidt Bau-GmbH – Chemnitz",
      "type": "Löschungsankündigung",
      "state": "Sachsen",
      "amtsgericht": "Amtsgericht Chemnitz",
      "registernummer": "HRB 26602",
      "registerart": "HRB",
      "company_name": "Klemm & Schmidt Bau-GmbH",
      "company_seat": "Chemnitz",
      "details": "15.04.2025 (Bekanntmachungsdatum)\n\nSachsen Amtsgericht Chemnitz HRB 26602\nLöschungsankündigung\n\nKlemm & Schmidt Bau-GmbH\nGesellschaft mit beschränkter Haftung\nChemnitz\n\nDas Registergericht beabsichtigt, die im Handelsregister eingetragene Gesellschaft von Amts wegen nach § 394 FamFG zu löschen. Die Frist zu Erhebung eines Widerspruchs gegen die beabsichtigte Löschung wird auf einen Monat festgesetzt."
    },
    {
      "date": "2025-04-15",
      "id": "106617",
      "original_text": "Einreichung neuer Dokumente\nSachsen Amtsgericht Chemnitz HRB 7117\nWGO Wohnungsbaugesellschaft mbH Oelsnitz/Erzgeb. – Oelsnitz/Erzgeb.",
      "type": "Einreichung neuer Dokumente",
      "state": "Sachsen",
      "amtsgericht": "Amtsgericht Chemnitz",
      "registernummer": "HRB 7117",
      "registerart": "HRB",
      "company_name": "WGO Wohnungsbaugesellschaft mbH Oelsnitz/Erzgeb.",
      "company_seat": "Oelsnitz/Erzgeb.",
      "details": "15.04.2025 (Bekanntmachungsdatum)\n\nSachsen Amtsgericht Chemnitz HRB 7117\nEinreichung neuer Dokumente\n\nWGO Wohnungsbaugesellschaft mbH Oelsnitz/Erzgeb.\nGesellschaft mit beschränkter Haftung\nOelsnitz/Erzgeb.\n\nAm 15.04.2025 wurde beim Handelsregister des Amtsgerichts Chemnitz die Liste der Mitglieder des Aufsichtsrats gemäß § 52 GmbHG eingereicht."
    },
    {
      "date": "2025-04-15",
      "id": "106618",
      "original_text": "Registerbekanntmachung nach dem Umwandlungsgesetz\nSachsen Amtsgericht Leipzig HRB 37603\nLindenthaler Verwaltungsgesellschaft mbH – Leipzig",
      "type": "Registerbekanntmachung nach dem Umwandlungsgesetz",
      "state": "Sachsen",
      "amtsgericht": "Amtsgericht Leipzig",
      "registernummer": "HRB 37603",
      "registerart": "HRB",
      "company_name": "Lindenthaler Verwaltungsgesellschaft mbH",
      "company_seat": "Leipzig",
      "details": "15.04.2025 (Bekanntmachungsdatum)\n\nSachsen Amtsgericht Leipzig HRB 37603\nRegisterbekanntmachung nach dem Umwandlungsgesetz 15.04.2025 (Eintragungsdatum)\n\nLindenthaler Verwaltungsgesellschaft mbH\nGesellschaft mit beschränkter Haftung\nLeipzig\n\nDen Gläubigern der an der Verschmelzung beteiligten Rechtsträger ist, wenn sie binnen sechs Monaten nach dem Tag, an dem die Eintragung der Verschmelzung in das Register des Sitzes desjenigen Rechtsträgers, dessen Gläubiger sie sind, nach § 19 Abs. 3 UmwG als bekannt gemacht gilt, ihren Anspruch nach Grund und Höhe in Textform anmelden, Sicherheit zu leisten, soweit sie nicht Befriedigung verlangen können. Dieses Recht steht den Gläubigern jedoch nur zu, wenn sie glaubhaft machen, dass durch die Verschmelzung die Erfüllung der Forderung gefährdet wird."
    },
    {
      "date": "2025-04-15",
      "id": "106619",
      "original_text": "Registerbekanntmachung nach dem Umwandlungsgesetz\nSachsen Amtsgericht Dresden HRA 12113\nAnett Eilers e.K. – Bernstadt a. d. Eigen",
      "type": "Registerbekanntmachung nach dem Umwandlungsgesetz",
      "state": "Sachsen",
      "amtsgericht": "Amtsgericht Dresden",
      "registernummer": "HRA 12113",
      "registerart": "HRA",
      "company_name": "Anett Eilers e.K.",
      "company_seat": "Bernstadt a. d. Eigen",
      "details": "15.04.2025 (Bekanntmachungsdatum)\n\nSachsen Amtsgericht Dresden HRA 12113\nRegisterbekanntmachung nach dem Umwandlungsgesetz 15.04.2025 (Eintragungsdatum)\n\nAnett Eilers e.K.\nEinzelkaufmann / Einzelkauffrau\nBernstadt a. d. Eigen\n\nDen Gläubigern der an der Ausgliederung beteiligten Rechtsträger ist, wenn sie binnen sechs Monaten nach dem Tag, an dem die Eintragung der Ausgliederung in das Register des Sitzes desjenigen Rechtsträgers, dessen Gläubiger sie sind, nach § 19 Abs. 3 UmwG als bekannt gemacht gilt, ihren Anspruch nach Grund und Höhe in Textform anmelden, Sicherheit zu leisten, soweit sie nicht Befriedigung verlangen können. Dieses Recht steht den Gläubigern jedoch nur zu, wenn sie glaubhaft machen, dass durch die Ausgliederung die Erfüllung der Forderung gefährdet wird."
    },
    {
      "date": "2025-04-15",
      "id": "106620",
      "original_text": "Einreichung neuer Dokumente\nSachsen Amtsgericht Chemnitz HRB 15370\nSDG Sächsische Dampfeisenbahngesellschaft mbH – Annaberg-Buchholz",
      "type": "Einreichung neuer Dokumente",
      "state": "Sachsen",
      "amtsgericht": "Amtsgericht Chemnitz",
      "registernummer": "HRB 15370",
      "registerart": "HRB",
      "company_name": "SDG Sächsische Dampfeisenbahngesellschaft mbH",
      "company_seat": "Annaberg-Buchholz",
      "details": "15.04.2025 (Bekanntmachungsdatum)\n\nSachsen Amtsgericht Chemnitz HRB 15370\nEinreichung neuer Dokumente\n\nSDG Sächsische Dampfeisenbahngesellschaft mbH\nGesellschaft mit beschränkter Haftung\nAnnaberg-Buchholz\n\nAm 14.04.2025 wurde beim Handelsregister des Amtsgerichts Chemnitz die Liste der Mitglieder des Aufsichtsrats gemäß § 52 GmbHG eingereicht."
    },
    {
      "date": "2025-04-15",
      "id": "106621",
      "original_text": "Registerbekanntmachung nach dem Umwandlungsgesetz\nNiedersachsen Amtsgericht Göttingen HRB 200387\nDelitzsch Pflanzenzucht Gesellschaft mit beschränkter Haftung – Einbeck",
      "type": "Registerbekanntmachung nach dem Umwandlungsgesetz",
      "state": "Niedersachsen",
      "amtsgericht": "Amtsgericht Göttingen",
      "registernummer": "HRB 200387",
      "registerart": "HRB",
      "company_name": "Delitzsch Pflanzenzucht Gesellschaft mit beschränkter Haftung",
      "company_seat": "Einbeck",
      "details": "15.04.2025 (Bekanntmachungsdatum)\n\nNiedersachsen Amtsgericht Göttingen HRB 200387\nRegisterbekanntmachung nach dem Umwandlungsgesetz 15.04.2025 (Eintragungsdatum)\n\nDelitzsch Pflanzenzucht Gesellschaft mit beschränkter Haftung\nGesellschaft mit beschränkter Haftung\nEinbeck\n\nDen Gläubigern der an der Verschmelzung beteiligten Rechtsträger ist, wenn sie binnen sechs Monaten nach dem Tag, an dem die Eintragung der Verschmelzung in das Register des Sitzes desjenigen Rechtsträgers, dessen Gläubiger sie sind, nach § 19  Abs.  3 UmwG als bekannt gemacht gilt, ihren Anspruch nach Grund und Höhe schriftlich anmelden, Sicherheit zu leisten, soweit sie nicht Befriedigung verlangen können. Dieses Recht steht den Gläubigern jedoch nur zu, wenn sie glaubhaft machen, dass durch die Verschmelzung die Erfüllung der Forderung gefährdet wird."
    },
    {
      "date": "2025-04-15",
      "id": "106622",
      "original_text": "Registerbekanntmachung nach dem Umwandlungsgesetz\nNiedersachsen Amtsgericht Lüneburg HRB 206035\nBlack Pearl Verwaltungs GmbH – Seevetal",
      "type": "Registerbekanntmachung nach dem Umwandlungsgesetz",
      "state": "Niedersachsen",
      "amtsgericht": "Amtsgericht Lüneburg",
      "registernummer": "HRB 206035",
      "registerart": "HRB",
      "company_name": "Black Pearl Verwaltungs GmbH",
      "company_seat": "Seevetal",
      "details": "15.04.2025 (Bekanntmachungsdatum)\n\nNiedersachsen Amtsgericht Lüneburg HRB 206035\nRegisterbekanntmachung nach dem Umwandlungsgesetz 15.04.2025 (Eintragungsdatum)\n\nBlack Pearl Verwaltungs GmbH\nGesellschaft mit beschränkter Haftung\nSeevetal\n\nDen Gläubigern der an der Verschmelzung beteiligten Rechtsträger ist, wenn sie binnen sechs Monaten nach dem Tag, an dem die Eintragung der Verschmelzung in das Register des Sitzes desjenigen Rechtsträgers, dessen Gläubiger sie sind, nach § 19  Abs.  3 UmwG als bekannt gemacht gilt, ihren Anspruch nach Grund und Höhe schriftlich anmelden, Sicherheit zu leisten, soweit sie nicht Befriedigung verlangen können. Dieses Recht steht den Gläubigern jedoch nur zu, wenn sie glaubhaft machen, dass durch die Verschmelzung die Erfüllung der Forderung gefährdet wird."
    },
    {
      "date": "2025-04-15",
      "id": "106623",
      "original_text": "Registerbekanntmachung nach dem Umwandlungsgesetz\nNiedersachsen Amtsgericht Lüneburg HRB 204655\nTRIUS 24. Verwaltungsgesellschaft mbH – Seevetal",
      "type": "Registerbekanntmachung nach dem Umwandlungsgesetz",
      "state": "Niedersachsen",
      "amtsgericht": "Amtsgericht Lüneburg",
      "registernummer": "HRB 204655",
      "registerart": "HRB",
      "company_name": "TRIUS 24. Verwaltungsgesellschaft mbH",
      "company_seat": "Seevetal",
      "details": "15.04.2025 (Bekanntmachungsdatum)\n\nNiedersachsen Amtsgericht Lüneburg HRB 204655\nRegisterbekanntmachung nach dem Umwandlungsgesetz 15.04.2025 (Eintragungsdatum)\n\nTRIUS 24. Verwaltungsgesellschaft mbH\nGesellschaft mit beschränkter Haftung\nSeevetal\n\nDen Gläubigern der an der Verschmelzung beteiligten Rechtsträger ist, wenn sie binnen sechs Monaten nach dem Tag, an dem die Eintragung der Verschmelzung in das Register des Sitzes desjenigen Rechtsträgers, dessen Gläubiger sie sind, nach § 19  Abs.  3 UmwG als bekannt gemacht gilt, ihren Anspruch nach Grund und Höhe schriftlich anmelden, Sicherheit zu leisten, soweit sie nicht Befriedigung verlangen können. Dieses Recht steht den Gläubigern jedoch nur zu, wenn sie glaubhaft machen, dass durch die Verschmelzung die Erfüllung der Forderung gefährdet wird."
    },
    {
      "date": "2025-04-15",
      "id": "106624",
      "original_text": "Registerbekanntmachung nach dem Umwandlungsgesetz\nNiedersachsen Amtsgericht Braunschweig HRB 212192\nSchlüter & Freunde GmbH – Braunschweig",
      "type": "Registerbekanntmachung nach dem Umwandlungsgesetz",
      "state": "Niedersachsen",
      "amtsgericht": "Amtsgericht Braunschweig",
      "registernummer": "HRB 212192",
      "registerart": "HRB",
      "company_name": "Schlüter & Freunde GmbH",
      "company_seat": "Braunschweig",
      "details": "15.04.2025 (Bekanntmachungsdatum)\n\nNiedersachsen Amtsgericht Braunschweig HRB 212192\nRegisterbekanntmachung nach dem Umwandlungsgesetz 15.04.2025 (Eintragungsdatum)\n\nSchlüter & Freunde GmbH\nGesellschaft mit beschränkter Haftung\nBraunschweig\n\nDen Gläubigern der an der formwechselnden Umwandlung beteiligten Rechtsträger ist, wenn sie binnen sechs Monaten nach dem Tag, an dem die Eintragung der Umwandlung in das Register des Sitzes desjenigen Rechtsträgers, dessen Gläubiger sie sind, nach § 19 Abs. 3 UmwG als bekannt gemacht gilt, ihren Anspruch nach Grund und Höhe schriftlich anmelden, Sicherheit zu leisten, soweit sie nicht Befriedigung verlangen können. Dieses Recht steht den Gläubigern jedoch nur zu, wenn sie glaubhaft machen, dass durch die formwechselnde Umwandlung die Erfüllung der Forderung gefährdet wird."
    },
    {
      "date": "2025-04-15",
      "id": "106625",
      "original_text": "Einreichung neuer Dokumente\nNiedersachsen Amtsgericht Hannover HRB 3502\nWohnungsbau Niedersachsen Gesellschaft mit beschränkter Haftung – Hannover",
      "type": "Einreichung neuer Dokumente",
      "state": "Niedersachsen",
      "amtsgericht": "Amtsgericht Hannover",
      "registernummer": "HRB 3502",
      "registerart": "HRB",
      "company_name": "Wohnungsbau Niedersachsen Gesellschaft mit beschränkter Haftung",
      "company_seat": "Hannover",
      "details": "15.04.2025 (Bekanntmachungsdatum)\n\nNiedersachsen Amtsgericht Hannover HRB 3502\nEinreichung neuer Dokumente 15.04.2025 (Eintragungsdatum)\n\nWohnungsbau Niedersachsen Gesellschaft mit beschränkter Haftung\nGesellschaft mit beschränkter Haftung\nHannover\n\nDie Liste der Mitglieder des Aufsichtsrats wurde beim Registergericht eingereicht."
    },
    {
      "date": "2025-04-15",
      "id": "106626",
      "original_text": "Registerbekanntmachung nach dem Umwandlungsgesetz\nNiedersachsen Amtsgericht Hannover HRB 206456\nHDI Deutschland AG – Hannover",
      "type": "Registerbekanntmachung nach dem Umwandlungsgesetz",
      "state": "Niedersachsen",
      "amtsgericht": "Amtsgericht Hannover",
      "registernummer": "HRB 206456",
      "registerart": "HRB",
      "company_name": "HDI Deutschland AG",
      "company_seat": "Hannover",
      "details": "15.04.2025 (Bekanntmachungsdatum)\n\nNiedersachsen Amtsgericht Hannover HRB 206456\nRegisterbekanntmachung nach dem Umwandlungsgesetz\n\nHDI Deutschland AG\nAktiengesellschaft\nHannover\n\nBeim Handelsregister ist der Entwurf eines Ausgliederungs- und Übernahmevertrages vom 07.04.2025 eingereicht worden. Danach soll die HDI Deutschland AG mit Sitz in Hannover (Amtsgericht Hannover HRB 206456) - als übertragende Gesellschaft - einen Teil ihres Vermögens auf die HDI Deutschland Bancassurance GmbH mit Sitz in Hilden (Amtsgericht Düsseldorf HRB 66232) übertragen."
    },
    {
      "date": "2025-04-15",
      "id": "106627",
      "original_text": "Sonstige Registerbekanntmachung\nNiedersachsen Amtsgericht Braunschweig HRB 100028 früher Amtsgericht Wolfsburg\nWolfsburger Verkehrsgesellschaft mit beschränkter Haftung – Wolfsburg",
      "type": "Sonstige Registerbekanntmachung",
      "state": "Niedersachsen",
      "amtsgericht": "Amtsgericht Braunschweig",
      "registernummer": "HRB 100028",
      "registerart": "HRB",
      "company_name": "Wolfsburger Verkehrsgesellschaft mit beschränkter Haftung",
      "company_seat": "Wolfsburg",
      "former_amtsgericht": "Wolfsburg",
      "details": "15.04.2025 (Bekanntmachungsdatum)\n\nNiedersachsen Amtsgericht Braunschweig HRB 100028 früher Amtsgericht Wolfsburg\nSonstige Registerbekanntmachung 15.04.2025 (Eintragungsdatum)\n\nWolfsburger Verkehrsgesellschaft mit beschränkter Haftung\nGesellschaft mit beschränkter Haftung\nWolfsburg\n\nDen Gläubigern der Gesellschaft, deren Forderungen begründet worden sind, bevor die Eintragung der Beendigung des Vertrages in das Handelsregister nach § 10 HGB als bekanntgemacht gilt, ist vom anderen Vertragsteil Sicherheit zu leisten, wenn sie sich binnen sechs Monaten nach der Bekanntmachung zu diesem Zweck bei ihm melden."
    },
    {
      "date": "2025-04-15",
      "id": "106628",
      "original_text": "Registerbekanntmachung nach dem Umwandlungsgesetz\nNiedersachsen Amtsgericht Braunschweig GsR 281\nSchlüter & Freunde eGbR – Braunschweig",
      "type": "Registerbekanntmachung nach dem Umwandlungsgesetz",
      "state": "Niedersachsen",
      "amtsgericht": "Amtsgericht Braunschweig",
      "registernummer": "GsR 281",
      "registerart": "GsR",
      "company_name": "Schlüter & Freunde eGbR",
      "company_seat": "Braunschweig",
      "details": "15.04.2025 (Bekanntmachungsdatum)\n\nNiedersachsen Amtsgericht Braunschweig GsR 281\nRegisterbekanntmachung nach dem Umwandlungsgesetz 15.04.2025 (Eintragungsdatum)\n\nSchlüter & Freunde eGbR\nGesellschaft bürgerlichen Rechts\nBraunschweig\n\nDen Gläubigern der an der formwechselnden Umwandlung beteiligten Rechtsträger ist, wenn sie binnen sechs Monaten nach dem Tag, an dem die Eintragung der Umwandlung in das Register des Sitzes desjenigen Rechtsträgers, dessen Gläubiger sie sind, nach § 19 Abs. 3 UmwG als bekannt gemacht gilt, ihren Anspruch nach Grund und Höhe schriftlich anmelden, Sicherheit zu leisten, soweit sie nicht Befriedigung verlangen können. Dieses Recht steht den Gläubigern jedoch nur zu, wenn sie glaubhaft machen, dass durch die formwechselnde Umwandlung die Erfüllung der Forderung gefährdet wird."
    },
    {
      "date": "2025-04-15",
      "id": "106629",
      "original_text": "Löschungsankündigung\nNiedersachsen Amtsgericht Aurich HRA 110524 früher Amtsgericht Leer (Ostfriesland) (Leer)\nMS \"Fockeburg\" Schiffahrts GmbH & Co. KG – Leer",
      "type": "Löschungsankündigung",
      "state": "Niedersachsen",
      "amtsgericht": "Amtsgericht Aurich",
      "registernummer": "HRA 110524",
      "registerart": "HRA",
      "company_name": "MS \"Fockeburg\" Schiffahrts GmbH & Co. KG",
      "company_seat": "Leer",
      "former_amtsgericht": "Leer (Ostfriesland) (Leer)",
      "details": "15.04.2025 (Bekanntmachungsdatum)\n\nNiedersachsen Amtsgericht Aurich HRA 110524 früher Amtsgericht Leer (Ostfriesland) (Leer)\nLöschungsankündigung\n\nMS \"Fockeburg\" Schiffahrts GmbH & Co. KG\nKommanditgesellschaft\nLeer\n\nDas Registergericht beabsichtigt, die Firma von Amts wegen nach § 394 FamFG zu löschen. Die Frist zur Erhebung eines Widerspruchs ist auf 1 Monat ab dieser Registerbekanntmachung festgesetzt."
    },
    {
      "date": "2025-04-15",
      "id": "106630",
      "original_text": "Registerbekanntmachung nach dem Umwandlungsgesetz\nNiedersachsen Amtsgericht Oldenburg (Oldenburg) HRA 208717\nBarbara Moormann - Lohnunternehmen e.K. – Visbek",
      "type": "Registerbekanntmachung nach dem Umwandlungsgesetz",
      "state": "Niedersachsen",
      "amtsgericht": "Amtsgericht Oldenburg (Oldenburg)",
      "registernummer": "HRA 208717",
      "registerart": "HRA",
      "company_name": "Barbara Moormann - Lohnunternehmen e.K.",
      "company_seat": "Visbek",
      "details": "15.04.2025 (Bekanntmachungsdatum)\n\nNiedersachsen Amtsgericht Oldenburg (Oldenburg) HRA 208717\nRegisterbekanntmachung nach dem Umwandlungsgesetz 15.04.2025 (Eintragungsdatum)\n\nBarbara Moormann - Lohnunternehmen e.K.\nEinzelkaufmann / Einzelkauffrau\nVisbek\n\nDen Gläubigern der an der Ausgliederung beteiligten Rechtsträger ist, wenn sie binnen sechs Monaten nach dem Tag, an dem die Eintragung der Ausgliederung in das Register des Sitzes desjenigen Rechtsträgers, dessen Gläubiger sie sind, nach § 19 Abs. 3 UmwG als bekannt gemacht gilt, ihren Anspruch nach Grund und Höhe schriftlich anmelden, Sicherheit zu leisten, soweit sie nicht Befriedigung verlangen können. Dieses Recht steht den Gläubigern jedoch nur zu, wenn sie glaubhaft machen, dass durch die Ausgliederung die Erfüllung der Forderung gefährdet wird."
    },
    {
      "date": "2025-04-15",
      "id": "106631",
      "original_text": "Registerbekanntmachung nach dem Umwandlungsgesetz\nNiedersachsen Amtsgericht Oldenburg (Oldenburg) HRA 208712\nElimar Moormann sen - Tierhaltung e.K. – Visbek",
      "type": "Registerbekanntmachung nach dem Umwandlungsgesetz",
      "state": "Niedersachsen",
      "amtsgericht": "Amtsgericht Oldenburg (Oldenburg)",
      "registernummer": "HRA 208712",
      "registerart": "HRA",
      "company_name": "Elimar Moormann sen - Tierhaltung e.K.",
      "company_seat": "Visbek",
      "details": "15.04.2025 (Bekanntmachungsdatum)\n\nNiedersachsen Amtsgericht Oldenburg (Oldenburg) HRA 208712\nRegisterbekanntmachung nach dem Umwandlungsgesetz 15.04.2025 (Eintragungsdatum)\n\nElimar Moormann sen - Tierhaltung e.K.\nEinzelkaufmann / Einzelkauffrau\nVisbek\n\nDen Gläubigern der an der Ausgliederung beteiligten Rechtsträger ist, wenn sie binnen sechs Monaten nach dem Tag, an dem die Eintragung der Ausgliederung in das Register des Sitzes desjenigen Rechtsträgers, dessen Gläubiger sie sind, nach § 19 Abs. 3 UmwG als bekannt gemacht gilt, ihren Anspruch nach Grund und Höhe schriftlich anmelden, Sicherheit zu leisten, soweit sie nicht Befriedigung verlangen können. Dieses Recht steht den Gläubigern jedoch nur zu, wenn sie glaubhaft machen, dass durch die Ausgliederung die Erfüllung der Forderung gefährdet wird."
    },
    {
      "date": "2025-04-15",
      "id": "106632",
      "original_text": "Registerbekanntmachung nach dem Umwandlungsgesetz\nNiedersachsen Amtsgericht Walsrode HRB 38\nLandesschadenhilfe Versicherung VaG – Bad Fallingbostel",
      "type": "Registerbekanntmachung nach dem Umwandlungsgesetz",
      "state": "Niedersachsen",
      "amtsgericht": "Amtsgericht Walsrode",
      "registernummer": "HRB 38",
      "registerart": "HRB",
      "company_name": "Landesschadenhilfe Versicherung VaG",
      "company_seat": "Bad Fallingbostel",
      "details": "15.04.2025 (Bekanntmachungsdatum)\n\nNiedersachsen Amtsgericht Walsrode HRB 38\nRegisterbekanntmachung nach dem Umwandlungsgesetz\n\nLandesschadenhilfe Versicherung VaG\nVersicherungsverein auf Gegenseitigkeit\nBad Fallingbostel\n\nDer Entwurf eines Verschmelzungsvertrages wurde gemäß § 111 UmwG beim Registergericht eingereicht."
    },
    {
      "date": "2025-04-15",
      "id": "106633",
      "original_text": "Registerbekanntmachung nach dem Umwandlungsgesetz\nNiedersachsen Amtsgericht Oldenburg (Oldenburg) HRA 208719\nEBE Moormann OHG – Visbek",
      "type": "Registerbekanntmachung nach dem Umwandlungsgesetz",
      "state": "Niedersachsen",
      "amtsgericht": "Amtsgericht Oldenburg (Oldenburg)",
      "registernummer": "HRA 208719",
      "registerart": "HRA",
      "company_name": "EBE Moormann OHG",
      "company_seat": "Visbek",
      "details": "15.04.2025 (Bekanntmachungsdatum)\n\nNiedersachsen Amtsgericht Oldenburg (Oldenburg) HRA 208719\nRegisterbekanntmachung nach dem Umwandlungsgesetz 15.04.2025 (Eintragungsdatum)\n\nEBE Moormann OHG\nOffene Handelsgesellschaft\nVisbek\n\nDen Gläubigern der an der Ausgliederung beteiligten Rechtsträger ist, wenn sie binnen sechs Monaten nach dem Tag, an dem die Eintragung der Ausgliederung in das Register des Sitzes desjenigen Rechtsträgers, dessen Gläubiger sie sind, nach § 19 Abs. 3 UmwG als bekannt gemacht gilt, ihren Anspruch nach Grund und Höhe schriftlich anmelden, Sicherheit zu leisten, soweit sie nicht Befriedigung verlangen können. Dieses Recht steht den Gläubigern jedoch nur zu, wenn sie glaubhaft machen, dass durch die Ausgliederung die Erfüllung der Forderung gefährdet wird."
    },
    {
      "date": "2025-04-15",
      "id": "106634",
      "original_text": "Einreichung neuer Dokumente\nRheinland-Pfalz Amtsgericht Koblenz HRB 13990\nThyssenKrupp Rasselstein GmbH – Andernach",
      "type": "Einreichung neuer Dokumente",
      "state": "Rheinland-Pfalz",
      "amtsgericht": "Amtsgericht Koblenz",
      "registernummer": "HRB 13990",
      "registerart": "HRB",
      "company_name": "ThyssenKrupp Rasselstein GmbH",
      "company_seat": "Andernach",
      "details": "15.04.2025 (Bekanntmachungsdatum)\n\nRheinland-Pfalz Amtsgericht Koblenz HRB 13990\nEinreichung neuer Dokumente\n\nThyssenKrupp Rasselstein GmbH\nGesellschaft mit beschränkter Haftung\nAndernach\n\nDem Registergericht ist eine neue Liste der Mitglieder des Aufsichtsrates eingereicht worden."
    },
    {
      "date": "2025-04-15",
      "id": "106635",
      "original_text": "Registerbekanntmachung nach dem Umwandlungsgesetz\nRheinland-Pfalz Amtsgericht Ludwigshafen a.Rhein (Ludwigshafen) VR 40641\nHandball Verband Rheinhessen Pfalz e.V. (HVRP) – Haßloch",
      "type": "Registerbekanntmachung nach dem Umwandlungsgesetz",
      "state": "Rheinland-Pfalz",
      "amtsgericht": "Amtsgericht Ludwigshafen a.Rhein (Ludwigshafen)",
      "registernummer": "VR 40641",
      "registerart": "VR",
      "company_name": "Handball Verband Rheinhessen Pfalz e.V. (HVRP)",
      "company_seat": "Haßloch",
      "details": "15.04.2025 (Bekanntmachungsdatum)\n\nRheinland-Pfalz Amtsgericht Ludwigshafen a.Rhein (Ludwigshafen) VR 40641\nRegisterbekanntmachung nach dem Umwandlungsgesetz 15.04.2025 (Eintragungsdatum)\n\nHandball Verband Rheinhessen Pfalz e.V. (HVRP)\neingetragener Verein\nHaßloch\n\nAls nicht eingetragen wird veröffentlicht: Den Gläubigern der an der Verschmelzung beteiligten Rechtsträger ist, wenn sie binnen sechs Monaten nach dem Tag, an dem die Eintragung der Verschmelzung in das Register des Sitzes desjenigen Rechtsträgers,dessen Gläubiger sie sind, nach § 19 Abs. 3 UmwG als bekannt gemacht gilt, ihren Anspruch nach Grund und Höhe schriftlich anmelden, Sicherheit zu leisten, soweit sie nicht Befriedigung verlangen können. Dieses Recht steht den Gläubigern jedoch nur zu, wenn sie glaubhaft machen, dass durch die Verschmelzung die Erfüllung der Forderung gefährdet wird."
    },
    {
      "date": "2025-04-15",
      "id": "106636",
      "original_text": "Registerbekanntmachung nach dem Umwandlungsgesetz\nRheinland-Pfalz Amtsgericht Bad Kreuznach HRB 4767\nDFH Deutsche Fertighaus Holding AG – Simmern",
      "type": "Registerbekanntmachung nach dem Umwandlungsgesetz",
      "state": "Rheinland-Pfalz",
      "amtsgericht": "Amtsgericht Bad Kreuznach",
      "registernummer": "HRB 4767",
      "registerart": "HRB",
      "company_name": "DFH Deutsche Fertighaus Holding AG",
      "company_seat": "Simmern",
      "details": "15.04.2025 (Bekanntmachungsdatum)\n\nRheinland-Pfalz Amtsgericht Bad Kreuznach HRB 4767\nRegisterbekanntmachung nach dem Umwandlungsgesetz 15.04.2025 (Eintragungsdatum)\n\nDFH Deutsche Fertighaus Holding AG\nAktiengesellschaft\nSimmern\n\nAls nicht eingetragen wird veröffentlicht:\nDen Gläubigern des formwechselnden Rechtsträgers ist, wenn sie binnen sechs Monaten nach dem Tag, an dem die Eintragung des Formwechsels nach § 201 UmwG als bekannt gemacht gilt, ihren Anspruch nach Grund und Höhe schriftlich anmelden, Sicherheit zu leisten, soweit sie nicht Befriedigung verlangen können. Dieses Recht steht den Gläubigern jedoch nur zu, wenn sie glaubhaft machen, dass durch den Formwechsel die Erfüllung der Forderung gefährdet wird."
    },
    {
      "date": "2025-04-15",
      "id": "106637",
      "original_text": "Einreichung neuer Dokumente\nBremen Amtsgericht Bremen HRB 6751\nBLB Immobilien GmbH – Bremen",
      "type": "Einreichung neuer Dokumente",
      "state": "Bremen",
      "amtsgericht": "Amtsgericht Bremen",
      "registernummer": "HRB 6751",
      "registerart": "HRB",
      "company_name": "BLB Immobilien GmbH",
      "company_seat": "Bremen",
      "details": "15.04.2025 (Bekanntmachungsdatum)\n\nBremen Amtsgericht Bremen HRB 6751\nEinreichung neuer Dokumente\n\nBLB Immobilien GmbH\nGesellschaft mit beschränkter Haftung\nBremen\n\nAls nicht eingetragen wird bekannt gemacht: Liste des Aufsichtsrats wurde eingereicht."
    },
    {
      "date": "2025-04-15",
      "id": "106638",
      "original_text": "Löschungsankündigung\nBremen Amtsgericht Bremen HRB 38771\nR.S Bau GmbH – Bremen",
      "type": "Löschungsankündigung",
      "state": "Bremen",
      "amtsgericht": "Amtsgericht Bremen",
      "registernummer": "HRB 38771",
      "registerart": "HRB",
      "company_name": "R.S Bau GmbH",
      "company_seat": "Bremen",
      "details": "15.04.2025 (Bekanntmachungsdatum)\n\nBremen Amtsgericht Bremen HRB 38771\nLöschungsankündigung\n\nR.S Bau GmbH\nGesellschaft mit beschränkter Haftung\nBremen\n\nEs ist beabsichtigt die im Handelsregister eingetragene Gesellschaft von Amts wegen gemäß § 394 FamFG zu löschen. Gegen die Löschung kann beim AG Bremen schriftlich oder zu Protokoll der Geschäftsstelle Widerspruch eingelegt werden. Widerspruchsfrist 4 Wochen."
    },
    {
      "date": "2025-04-15",
      "id": "106639",
      "original_text": "Registerbekanntmachung nach dem Umwandlungsgesetz\nNordrhein-Westfalen Amtsgericht Düsseldorf HRB 26611\nHerzog GmbH – Düsseldorf",
      "type": "Registerbekanntmachung nach dem Umwandlungsgesetz",
      "state": "Nordrhein-Westfalen",
      "amtsgericht": "Amtsgericht Düsseldorf",
      "registernummer": "HRB 26611",
      "registerart": "HRB",
      "company_name": "Herzog GmbH",
      "company_seat": "Düsseldorf",
      "details": "15.04.2025 (Bekanntmachungsdatum)\n\nNordrhein-Westfalen Amtsgericht Düsseldorf HRB 26611\nRegisterbekanntmachung nach dem Umwandlungsgesetz 15.04.2025 (Eintragungsdatum)\n\nHerzog GmbH\nGesellschaft mit beschränkter Haftung\nDüsseldorf\n\nDen Gläubigern der an der Verschmelzung beteiligten Rechtsträger ist, wenn sie binnen sechs Monaten nach dem Tag, an dem die Eintragung der Verschmelzung in das Register des Sitzes desjenigen Rechtsträgers, dessen Gläubiger sie sind, nach § 19 Absatz 3 UmwG als bekanntgemacht gilt, ihren Anspruch nach Grund und Höhe schriftlich anmelden, Sicherheit zu leisten, soweit sie nicht Befriedigung verlangen können. Dieses Recht steht den Gläubigern jedoch nur zu, wenn sie glaubhaft machen, dass durch die Verschmelzung die Erfüllung ihrer Forderung gefährdet wird."
    },
    {
      "date": "2025-04-15",
      "id": "106640",
      "original_text": "Löschungsankündigung\nNordrhein-Westfalen Amtsgericht Kleve HRB 14554\nGKB Tiefbau GmbH – Kleve",
      "type": "Löschungsankündigung",
      "state": "Nordrhein-Westfalen",
      "amtsgericht": "Amtsgericht Kleve",
      "registernummer": "HRB 14554",
      "registerart": "HRB",
      "company_name": "GKB Tiefbau GmbH",
      "company_seat": "Kleve",
      "details": "15.04.2025 (Bekanntmachungsdatum)\n\nNordrhein-Westfalen Amtsgericht Kleve HRB 14554\nLöschungsankündigung\n\nGKB Tiefbau GmbH\nGesellschaft mit beschränkter Haftung\nKleve\n\nDas Registergericht beabsichtigt die Gesellschaft von Amts wegen nach § 394 FamFG zu löschen. Die Frist zur Erhebung eines Widerspruchs ist auf einen Monat festgesetzt."
    },
    {
      "date": "2025-04-15",
      "id": "106641",
      "original_text": "Registerbekanntmachung nach dem Umwandlungsgesetz\nNordrhein-Westfalen Amtsgericht Siegen HRA 9145\nFREIRAUM4 GmbH & Co. KG – Siegen",
      "type": "Registerbekanntmachung nach dem Umwandlungsgesetz",
      "state": "Nordrhein-Westfalen",
      "amtsgericht": "Amtsgericht Siegen",
      "registernummer": "HRA 9145",
      "registerart": "HRA",
      "company_name": "FREIRAUM4 GmbH & Co. KG",
      "company_seat": "Siegen",
      "details": "15.04.2025 (Bekanntmachungsdatum)\n\nNordrhein-Westfalen Amtsgericht Siegen HRA 9145\nRegisterbekanntmachung nach dem Umwandlungsgesetz 14.04.2025 (Eintragungsdatum)\n\nFREIRAUM4 GmbH & Co. KG\nKommanditgesellschaft\nSiegen\n\nDen Gläubigern der an der formwechselnden Umwandlung beteiligten Rechtsträger ist, wenn sie binnen sechs Monaten nach dem Tag, an dem die Eintragung der formwechselnden Umwandlung in das Register des Sitzes desjenigen Rechtsträgers, dessen Gläubiger sie sind, nach § 19 Absatz 3 UmwG als bekanntgemacht gilt, ihren Anspruch nach Grund und Höhe schriftlich anmelden, Sicherheit zu leisten, soweit sie nicht Befriedigung verlangen können. Dieses Recht steht den Gläubigern jedoch nur zu, wenn sie glaubhaft machen, dass durch die formwechselnden Umwandlung die Erfüllung ihrer Forderung gefährdet wird."
    },
    {
      "date": "2025-04-15",
      "id": "106642",
      "original_text": "Registerbekanntmachung nach dem Umwandlungsgesetz\nNordrhein-Westfalen Amtsgericht Düsseldorf HRB 44647\nIK Property Treuhand GmbH – Düsseldorf",
      "type": "Registerbekanntmachung nach dem Umwandlungsgesetz",
      "state": "Nordrhein-Westfalen",
      "amtsgericht": "Amtsgericht Düsseldorf",
      "registernummer": "HRB 44647",
      "registerart": "HRB",
      "company_name": "IK Property Treuhand GmbH",
      "company_seat": "Düsseldorf",
      "details": "15.04.2025 (Bekanntmachungsdatum)\n\nNordrhein-Westfalen Amtsgericht Düsseldorf HRB 44647\nRegisterbekanntmachung nach dem Umwandlungsgesetz 15.04.2025 (Eintragungsdatum)\n\nIK Property Treuhand GmbH\nGesellschaft mit beschränkter Haftung\nDüsseldorf\n\nDen Gläubigern der an der Verschmelzung beteiligten Rechtsträger ist, wenn sie binnen sechs Monaten nach dem Tag, an dem die Eintragung der Verschmelzung in das Register des Sitzes desjenigen Rechtsträgers, dessen Gläubiger sie sind, nach § 19 Absatz 3 UmwG als bekanntgemacht gilt, ihren Anspruch nach Grund und Höhe schriftlich anmelden, Sicherheit zu leisten, soweit sie nicht Befriedigung verlangen können. Dieses Recht steht den Gläubigern jedoch nur zu, wenn sie glaubhaft machen, dass durch die Verschmelzung die Erfüllung ihrer Forderung gefährdet wird."
    },
    {
      "date": "2025-04-15",
      "id": "106643",
      "original_text": "Löschungsankündigung\nNordrhein-Westfalen Amtsgericht Dortmund HRB 24126\nDWLo GmbH – Dortmund",
      "type": "Löschungsankündigung",
      "state": "Nordrhein-Westfalen",
      "amtsgericht": "Amtsgericht Dortmund",
      "registernummer": "HRB 24126",
      "registerart": "HRB",
      "company_name": "DWLo GmbH",
      "company_seat": "Dortmund",
      "details": "15.04.2025 (Bekanntmachungsdatum)\n\nNordrhein-Westfalen Amtsgericht Dortmund HRB 24126\nLöschungsankündigung\n\nDWLo GmbH\nGesellschaft mit beschränkter Haftung\nDortmund\n\nDas Registergericht beabsichtigt die Gesellschaft von Amts wegen nach § 394 FamFG zu löschen. Die Frist zur Erhebung eines Widerspruchs ist auf zwei Monate festgesetzt."
    },
    {
      "date": "2025-04-15",
      "id": "106644",
      "original_text": "Löschungsankündigung\nNordrhein-Westfalen Amtsgericht Gütersloh HRB 7472\nRoggenkamp Organics AG – Herzebrock-Clarholz",
      "type": "Löschungsankündigung",
      "state": "Nordrhein-Westfalen",
      "amtsgericht": "Amtsgericht Gütersloh",
      "registernummer": "HRB 7472",
      "registerart": "HRB",
      "company_name": "Roggenkamp Organics AG",
      "company_seat": "Herzebrock-Clarholz",
      "details": "15.04.2025 (Bekanntmachungsdatum)\n\nNordrhein-Westfalen Amtsgericht Gütersloh HRB 7472\nLöschungsankündigung 15.04.2025 (Eintragungsdatum)\n\nRoggenkamp Organics AG\nAktiengesellschaft\nHerzebrock-Clarholz\n\nDas Registergericht beabsichtigt die Gesellschaft von Amts wegen nach § 394 FamFG zu löschen. Die Frist zur Erhebung eines Widerspruchs ist auf einen Monat festgesetzt."
    },
    {
      "date": "2025-04-15",
      "id": "106645",
      "original_text": "Löschungsankündigung\nNordrhein-Westfalen Amtsgericht Düsseldorf HRB 46338\npcP Information und Kommunikation GmbH – Düsseldorf",
      "type": "Löschungsankündigung",
      "state": "Nordrhein-Westfalen",
      "amtsgericht": "Amtsgericht Düsseldorf",
      "registernummer": "HRB 46338",
      "registerart": "HRB",
      "company_name": "pcP Information und Kommunikation GmbH",
      "company_seat": "Düsseldorf",
      "details": "15.04.2025 (Bekanntmachungsdatum)\n\nNordrhein-Westfalen Amtsgericht Düsseldorf HRB 46338\nLöschungsankündigung\n\npcP Information und Kommunikation GmbH\nGesellschaft mit beschränkter Haftung\nDüsseldorf\n\nDas Registergericht beabsichtigt die Gesellschaft von Amts wegen nach § 394 FamFG zu löschen. Die Frist zur Erhebung eines Widerspruchs ist auf 3 Wochen festgesetzt.\n\nRechtsbehelfsbelehrung:\nDas Widerspruchsrecht steht jedem zu, der an der Unterlassung der Löschung ein berechtigtes Interesse hat. Der Widerspruch ist bei dem Amtsgericht Düsseldorf -Registergericht-, Werdener Straße 1, 40227 Düsseldorf schriftlich in deutscher Sprache oder zur Niederschrift der Geschäftsstelle einzulegen. Der Widerspruch kann auch zur Niederschrift der Geschäftsstelle eines jeden Amtsgerichtes abgegeben werden. Die Einlegung ist auch durch Übertragung eines elektronischen Dokuments an die elektronische Poststelle des Gerichts möglich. Das elektronische Dokument muss für die Bearbeitung durch das Gericht geeignet und mit einer qualifizierten elektronischen Signatur der verantwortenden Person versehen sein oder von der verantwortenden Person signiert und auf einem sicheren Übermittlungsweg gemäß § 130a ZPO nach näherer Maßgabe der Verordnung über die technischen Rahmenbedingungen des elektronischen Rechtsverkehrs und über das besondere elektronische Behördenpostfach (BGBl. I, S.3803) eingereicht werden. Weitere Informationen erhalten Sie auf der Internetseite www.justiz.de.\nDer Widerspruch muss spätestens innerhalb der gesetzten Frist nach dem Datum der Bekanntmachung der Löschungsankündigung bei dem Amtsgericht - Registergericht - Düsseldorf eingegangen sein.  Dies gilt auch dann, wenn der Widerspruch zur Niederschrift der Geschäftsstelle eines anderen Amtsgerichtes abgegeben wurde. Die Frist beginnt mit dem Tage der Bekanntmachung der Löschungsankündigung in dem für die Bekanntmachung der Eintragungen in das Handelsregister bestimmten elektronischen Informations- und Kommunikationssystem nach § 10 des Handelsgesetzbuches. Fällt das Ende der Frist auf einen Sonntag, einen allgemeinen Feiertag oder Sonnabend, so endet die Frist mit Ablauf des nächsten Werktages.\nDer Widerspruch muss die Bezeichnung der angefochtenen Löschungsankündigung sowie die Erklärung enthalten, dass Widerspruch gegen diese Löschungsankündigung eingelegt wird. Er ist zu unterzeichnen und soll begründet werden."
    },
    {
      "date": "2025-04-15",
      "id": "106646",
      "original_text": "Löschungsankündigung\nNordrhein-Westfalen Amtsgericht Duisburg HRB 33138\nSFG UG (haftungsbeschränkt) – Duisburg",
      "type": "Löschungsankündigung",
      "state": "Nordrhein-Westfalen",
      "amtsgericht": "Amtsgericht Duisburg",
      "registernummer": "HRB 33138",
      "registerart": "HRB",
      "company_name": "SFG UG (haftungsbeschränkt)",
      "company_seat": "Duisburg",
      "details": "15.04.2025 (Bekanntmachungsdatum)\n\nNordrhein-Westfalen Amtsgericht Duisburg HRB 33138\nLöschungsankündigung\n\nSFG UG (haftungsbeschränkt)\nGesellschaft mit beschränkter Haftung\nDuisburg\n\nHRB 33138:\nSFG UG (haftungsbeschränkt),\nDuisburg,\nRuhrorter Str. 85, 47059 Duisburg\nDas Registergericht beabsichtigt, die im Handelsregister eingetragene Gesellschaft gemäß § 394 Absatz 1 FamFG wegen Vermögenslosigkeit von Amts wegen zu löschen. Gegen diese Verfügung kann Widerspruch eingelegt werden. Die Frist zur Erhebung eines Widerspruchs gegen die beabsichtigte Löschung von Amts wegen ist auf drei Monate festgesetzt. Rechtsbehelfsbelehrung Der Widerspruch ist bei dem Amtsgericht Duisburg, Kardinal-Galen-Str. 124-132, 47058 Duisburg schriftlich in deutscher Sprache oder zur Niederschrift der Geschäftsstelle einzulegen. Der Widerspruch kann auch zur Niederschrift der Geschäftsstelle eines jeden Amtsgerichtes abgegeben werden. Die Einlegung ist auch durch Übertragung eines elektronischen Dokuments an die elektronische Poststelle des Gerichts möglich. Das elektronische Dokument muss für die Bearbeitung durch das Gericht geeignet und mit einer qualifizierten elektronischen Signatur der verantwortenden Person versehen sein oder von der verantwortenden Person signiert und auf einem sicheren Übermittlungsweg gemäß § 130 a ZPO nach näherer Maßgabe der Verordnung über die technischen Rahmenbedingungen des elektronischen Rechtsverkehrs und über das besondere elektronische Behördenpostfach (BGBl. I, S. 3803) eingereicht werden. Weitere Informationen erhalten Sie auf der Internetseite www.justiz.de <http://www.justiz.de>. Der Widerspruch muss spätestens innerhalb der gesetzten Frist bei dem Amtsgericht Duisburg eingegangen sein. Dies gilt auch dann, wenn der Widerspruch zur Niederschrift der Geschäftsstelle eines anderen Amtsgerichtes abgegeben wurde. Die Frist beginnt mit der Veröffentlichung. Fällt das Ende der Frist auf einen Sonntag, einen allgemeinen Feiertag oder Sonnabend, so endet die Frist mit Ablauf des nächsten Werktages. Der Widerspruch muss die Bezeichnung der angefochtenen Verfügung sowie die Erklärung enthalten, dass Widerspruch gegen diese Verfügung eingelegt wird. Er ist zu unterzeichnen und soll begründet werden."
    },
    {
      "date": "2025-04-15",
      "id": "106647",
      "original_text": "Löschungsankündigung\nNordrhein-Westfalen Amtsgericht Siegen HRB 12170\nCB Power-Transporte UG (haftungsbeschränkt) – Lennestadt",
      "type": "Löschungsankündigung",
      "state": "Nordrhein-Westfalen",
      "amtsgericht": "Amtsgericht Siegen",
      "registernummer": "HRB 12170",
      "registerart": "HRB",
      "company_name": "CB Power-Transporte UG (haftungsbeschränkt)",
      "company_seat": "Lennestadt",
      "details": "15.04.2025 (Bekanntmachungsdatum)\n\nNordrhein-Westfalen Amtsgericht Siegen HRB 12170\nLöschungsankündigung\n\nCB Power-Transporte UG (haftungsbeschränkt)\nGesellschaft mit beschränkter Haftung\nLennestadt\n\nDas Registergericht beabsichtigt die Gesellschaft von Amts wegen nach § 394 FamFG zu löschen. Die Frist zur Erhebung eines Widerspruchs ist auf drei Monate festgesetzt."
    },
    {
      "date": "2025-04-15",
      "id": "106648",
      "original_text": "Löschungsankündigung\nNordrhein-Westfalen Amtsgericht Duisburg HRB 5419\nCLS Pötter & Jenne GmbH – Duisburg",
      "type": "Löschungsankündigung",
      "state": "Nordrhein-Westfalen",
      "amtsgericht": "Amtsgericht Duisburg",
      "registernummer": "HRB 5419",
      "registerart": "HRB",
      "company_name": "CLS Pötter & Jenne GmbH",
      "company_seat": "Duisburg",
      "details": "15.04.2025 (Bekanntmachungsdatum)\n\nNordrhein-Westfalen Amtsgericht Duisburg HRB 5419\nLöschungsankündigung 15.04.2025 (Eintragungsdatum)\n\nCLS Pötter & Jenne GmbH\nGesellschaft mit beschränkter Haftung\nDuisburg\n\nHRB 5419:\nCLS Pötter & Jenne GmbH, Duisburg\nAm Schellberg 13, 47249 Duisburg.\nDas Registergericht beabsichtigt, die im Handelsregister eingetragene Gesellschaft gemäß § 394 FamFG wegen Vermögenslosigkeit von Amts wegen zu löschen. Gegen diese Verfügung kann Widerspruch eingelegt werden. Die Frist zur Erhebung eines Widerspruchs gegen die beabsichtigte Löschung von Amts wegen ist auf drei Monate festgesetzt. Rechtsbehelfsbelehrung Der Widerspruch ist bei dem Amtsgericht Duisburg, Kardinal-Galen-Str. 124-132, 47058 Duisburg schriftlich in deutscher Sprache oder zur Niederschrift der Geschäftsstelle einzulegen. Der Widerspruch kann auch zur Niederschrift der Geschäftsstelle eines jeden Amtsgerichtes abgegeben werden. Die Einlegung ist auch durch Übertragung eines elektronischen Dokuments an die elektronische Poststelle des Gerichts möglich. Das elektronische Dokument muss für die Bearbeitung durch das Gericht geeignet und mit einer qualifizierten elektronischen Signatur der verantwortenden Person versehen sein oder von der verantwortenden Person signiert und auf einem sicheren Übermittlungsweg gemäß § 130 a ZPO nach näherer Maßgabe der Verordnung über die technischen Rahmenbedingungen des elektronischen Rechtsverkehrs und über das besondere elektronische Behördenpostfach (BGBl. I, S. 3803) eingereicht werden. Weitere Informationen erhalten Sie auf der Internetseite www.justiz.de <http://www.justiz.de>. Der Widerspruch muss spätestens innerhalb der gesetzten Frist bei dem Amtsgericht Duisburg eingegangen sein. Dies gilt auch dann, wenn der Widerspruch zur Niederschrift der Geschäftsstelle eines anderen Amtsgerichtes abgegeben wurde. Die Frist beginnt mit der Veröffentlichung. Fällt das Ende der Frist auf einen Sonntag, einen allgemeinen Feiertag oder Sonnabend, so endet die Frist mit Ablauf des nächsten Werktages. Der Widerspruch muss die Bezeichnung der angefochtenen Verfügung sowie die Erklärung enthalten, dass Widerspruch gegen diese Verfügung eingelegt wird. Er ist zu unterzeichnen und soll begründet werden."
    },
    {
      "date": "2025-04-15",
      "id": "106649",
      "original_text": "Löschungsankündigung\nNordrhein-Westfalen Amtsgericht Düsseldorf HRB 91902\nmelior plus GmbH – Düsseldorf",
      "type": "Löschungsankündigung",
      "state": "Nordrhein-Westfalen",
      "amtsgericht": "Amtsgericht Düsseldorf",
      "registernummer": "HRB 91902",
      "registerart": "HRB",
      "company_name": "melior plus GmbH",
      "company_seat": "Düsseldorf",
      "details": "15.04.2025 (Bekanntmachungsdatum)\n\nNordrhein-Westfalen Amtsgericht Düsseldorf HRB 91902\nLöschungsankündigung\n\nmelior plus GmbH\nGesellschaft mit beschränkter Haftung\nDüsseldorf\n\nDas Registergericht beabsichtigt die Gesellschaft von Amts wegen nach § 394 Abs. 1 FamFG zu löschen. Die Frist zur Erhebung eines Widerspruchs ist auf 3 Wochen festgesetzt.\n\nRechtsbehelfsbelehrung:\nDas Widerspruchsrecht steht jedem zu, der an der Unterlassung der Löschung ein berechtigtes Interesse hat. Der Widerspruch ist bei dem Amtsgericht Düsseldorf -Registergericht-, Werdener Straße 1, 40227 Düsseldorf schriftlich in deutscher Sprache oder zur Niederschrift der Geschäftsstelle einzulegen. Der Widerspruch kann auch zur Niederschrift der Geschäftsstelle eines jeden Amtsgerichtes abgegeben werden. Die Einlegung ist auch durch Übertragung eines elektronischen Dokuments an die elektronische Poststelle des Gerichts möglich. Das elektronische Dokument muss für die Bearbeitung durch das Gericht geeignet und mit einer qualifizierten elektronischen Signatur der verantwortenden Person versehen sein oder von der verantwortenden Person signiert und auf einem sicheren Übermittlungsweg gemäß § 130a ZPO nach näherer Maßgabe der Verordnung über die technischen Rahmenbedingungen des elektronischen Rechtsverkehrs und über das besondere elektronische Behördenpostfach (BGBl. I, S.3803) eingereicht werden. Weitere Informationen erhalten Sie auf der Internetseite www.justiz.de.\nDer Widerspruch muss spätestens innerhalb der gesetzten Frist nach dem Datum der Bekanntmachung der Löschungsankündigung bei dem Amtsgericht - Registergericht - Düsseldorf eingegangen sein.  Dies gilt auch dann, wenn der Widerspruch zur Niederschrift der Geschäftsstelle eines anderen Amtsgerichtes abgegeben wurde. Die Frist beginnt mit dem Tage der Bekanntmachung der Löschungsankündigung in dem für die Bekanntmachung der Eintragungen in das Handelsregister bestimmten elektronischen Informations- und Kommunikationssystem nach § 10 des Handelsgesetzbuches. Fällt das Ende der Frist auf einen Sonntag, einen allgemeinen Feiertag oder Sonnabend, so endet die Frist mit Ablauf des nächsten Werktages.\nDer Widerspruch muss die Bezeichnung der angefochtenen Löschungsankündigung sowie die Erklärung enthalten, dass Widerspruch gegen diese Löschungsankündigung eingelegt wird. Er ist zu unterzeichnen und soll begründet werden."
    },
    {
      "date": "2025-04-15",
      "id": "106650",
      "original_text": "Löschungsankündigung\nNordrhein-Westfalen Amtsgericht Gelsenkirchen HRB 17014\nBaus Baudienstleistungen UG (haftungsbeschränkt) – Gelsenkirchen",
      "type": "Löschungsankündigung",
      "state": "Nordrhein-Westfalen",
      "amtsgericht": "Amtsgericht Gelsenkirchen",
      "registernummer": "HRB 17014",
      "registerart": "HRB",
      "company_name": "Baus Baudienstleistungen UG (haftungsbeschränkt)",
      "company_seat": "Gelsenkirchen",
      "details": "15.04.2025 (Bekanntmachungsdatum)\n\nNordrhein-Westfalen Amtsgericht Gelsenkirchen HRB 17014\nLöschungsankündigung\n\nBaus Baudienstleistungen UG (haftungsbeschränkt)\nGesellschaft mit beschränkter Haftung\nGelsenkirchen\n\nDas Gericht beabsichtigt, die Gesellschaft Baus Baudienstleistungen UG (haftungsbeschränkt) mit Sitz in Gelsenkirchen, HRB 17014 Amtsgericht Gelsenkirchen, wegen Vermögenslosigkeit zu löschen.\nHiermit wird denjenigen, die an der Unterlassung der Löschung ein berechtigtes Interesse haben, gem. § 394 Abs. 2 FamFG Gelegenheit gegeben, gegen dieses Vorhaben binnen eines Monats nach dieser Bekanntmachung Widerspruch einzulegen. Der Widerspruch kann schriftlich oder zu Protokoll der Geschäftsstelle erhoben werden."
    },
    {
      "date": "2025-04-15",
      "id": "106651",
      "original_text": "Löschungsankündigung\nNordrhein-Westfalen Amtsgericht Kleve HRB 16657\nHTZ Bau GmbH – Emmerich am Rhein",
      "type": "Löschungsankündigung",
      "state": "Nordrhein-Westfalen",
      "amtsgericht": "Amtsgericht Kleve",
      "registernummer": "HRB 16657",
      "registerart": "HRB",
      "company_name": "HTZ Bau GmbH",
      "company_seat": "Emmerich am Rhein",
      "details": "15.04.2025 (Bekanntmachungsdatum)\n\nNordrhein-Westfalen Amtsgericht Kleve HRB 16657\nLöschungsankündigung\n\nHTZ Bau GmbH\nGesellschaft mit beschränkter Haftung\nEmmerich am Rhein\n\nDas Registergericht beabsichtigt die Gesellschaft von Amts wegen nach § 394 FamFG zu löschen. Die Frist zur Erhebung eines Widerspruchs ist auf einen Monat festgesetzt."
    },
    {
      "date": "2025-04-15",
      "id": "106652",
      "original_text": "Registerbekanntmachung nach dem Umwandlungsgesetz\nNordrhein-Westfalen Amtsgericht Münster HRA 754\nJosef Michels GmbH & Co. KG – Münster",
      "type": "Registerbekanntmachung nach dem Umwandlungsgesetz",
      "state": "Nordrhein-Westfalen",
      "amtsgericht": "Amtsgericht Münster",
      "registernummer": "HRA 754",
      "registerart": "HRA",
      "company_name": "Josef Michels GmbH & Co. KG",
      "company_seat": "Münster",
      "details": "15.04.2025 (Bekanntmachungsdatum)\n\nNordrhein-Westfalen Amtsgericht Münster HRA 754\nRegisterbekanntmachung nach dem Umwandlungsgesetz 15.04.2025 (Eintragungsdatum)\n\nJosef Michels GmbH & Co. KG\nKommanditgesellschaft\nMünster\n\nDen Gläubigern der an der Verschmelzung beteiligten Rechtsträger ist, wenn sie binnen sechs Monaten nach dem Tag, an dem die Eintragung der Verschmelzung in das Register des Sitzes derjenigen Rechtsträger deren Gläubiger sie sind, nach § 19 Absatz 3 UmwG als bekanntgemacht gilt, ihren Anspruch nach Grund und Höhe schriftlich anmelden, Sicherheit zu leisten, soweit sie nicht Befriedigung verlangen können. Dieses Recht steht den Gläubigern jedoch nur zu, wenn sie glaubhaft machen, dass durch die Verschmelzung die Erfüllung ihrer Forderung gefährdet wird."
    },
    {
      "date": "2025-04-15",
      "id": "106653",
      "original_text": "Löschungsankündigung\nNordrhein-Westfalen Amtsgericht Siegen HRB 6892\nAttendorner Spezialarmaturen Gesellschaft mit beschränkter Haftung – Attendorn",
      "type": "Löschungsankündigung",
      "state": "Nordrhein-Westfalen",
      "amtsgericht": "Amtsgericht Siegen",
      "registernummer": "HRB 6892",
      "registerart": "HRB",
      "company_name": "Attendorner Spezialarmaturen Gesellschaft mit beschränkter Haftung",
      "company_seat": "Attendorn",
      "details": "15.04.2025 (Bekanntmachungsdatum)\n\nNordrhein-Westfalen Amtsgericht Siegen HRB 6892\nLöschungsankündigung\n\nAttendorner Spezialarmaturen Gesellschaft mit beschränkter Haftung\nGesellschaft mit beschränkter Haftung\nAttendorn\n\nDas Registergericht beabsichtigt die Gesellschaft von Amts wegen nach § 394 FamFG zu löschen. Die Frist zur Erhebung eines Widerspruchs ist auf drei Monate festgesetzt."
    },
    {
      "date": "2025-04-15",
      "id": "106654",
      "original_text": "Registerbekanntmachung nach dem Umwandlungsgesetz\nNordrhein-Westfalen Amtsgericht Essen HRB 22054\nMercator Research Center Ruhr (MERCUR) GmbH – Essen",
      "type": "Registerbekanntmachung nach dem Umwandlungsgesetz",
      "state": "Nordrhein-Westfalen",
      "amtsgericht": "Amtsgericht Essen",
      "registernummer": "HRB 22054",
      "registerart": "HRB",
      "company_name": "Mercator Research Center Ruhr (MERCUR) GmbH",
      "company_seat": "Essen",
      "details": "15.04.2025 (Bekanntmachungsdatum)\n\nNordrhein-Westfalen Amtsgericht Essen HRB 22054\nRegisterbekanntmachung nach dem Umwandlungsgesetz 15.04.2025 (Eintragungsdatum)\n\nMercator Research Center Ruhr (MERCUR) GmbH\nGesellschaft mit beschränkter Haftung\nEssen\n\nDen Gläubigern der an der Verschmelzung beteiligten Rechtsträger ist, wenn sie binnen sechs Monaten nach dem Tag, an dem die Eintragung der Verschmelzung in das Register des Sitzes desjenigen Rechtsträgers, dessen Gläubiger sie sind, nach § 19 Absatz 3 UmwG als bekanntgemacht gilt, ihren Anspruch nach Grund und Höhe schriftlich anmelden, Sicherheit zu leisten, soweit sie nicht Befriedigung verlangen können. Dieses Recht steht den Gläubigern jedoch nur zu, wenn sie glaubhaft machen, dass durch die Verschmelzung die Erfüllung ihrer Forderung gefährdet wird."
    },
    {
      "date": "2025-04-15",
      "id": "106655",
      "original_text": "Löschungsankündigung\nNordrhein-Westfalen Amtsgericht Düsseldorf HRB 87404\nASHP GmbH – Düsseldorf",
      "type": "Löschungsankündigung",
      "state": "Nordrhein-Westfalen",
      "amtsgericht": "Amtsgericht Düsseldorf",
      "registernummer": "HRB 87404",
      "registerart": "HRB",
      "company_name": "ASHP GmbH",
      "company_seat": "Düsseldorf",
      "details": "15.04.2025 (Bekanntmachungsdatum)\n\nNordrhein-Westfalen Amtsgericht Düsseldorf HRB 87404\nLöschungsankündigung\n\nASHP GmbH\nGesellschaft mit beschränkter Haftung\nDüsseldorf\n\nDas Registergericht beabsichtigt die Gesellschaft von Amts wegen nach § 394 FamFG zu löschen. Die Frist zur Erhebung eines Widerspruchs ist auf 3 Wochen festgesetzt.\n\nRechtsbehelfsbelehrung:\nDas Widerspruchsrecht steht jedem zu, der an der Unterlassung der Löschung ein berechtigtes Interesse hat. Der Widerspruch ist bei dem Amtsgericht Düsseldorf -Registergericht-, Werdener Straße 1, 40227 Düsseldorf schriftlich in deutscher Sprache oder zur Niederschrift der Geschäftsstelle einzulegen. Der Widerspruch kann auch zur Niederschrift der Geschäftsstelle eines jeden Amtsgerichtes abgegeben werden. Die Einlegung ist auch durch Übertragung eines elektronischen Dokuments an die elektronische Poststelle des Gerichts möglich. Das elektronische Dokument muss für die Bearbeitung durch das Gericht geeignet und mit einer qualifizierten elektronischen Signatur der verantwortenden Person versehen sein oder von der verantwortenden Person signiert und auf einem sicheren Übermittlungsweg gemäß § 130a ZPO nach näherer Maßgabe der Verordnung über die technischen Rahmenbedingungen des elektronischen Rechtsverkehrs und über das besondere elektronische Behördenpostfach (BGBl. I, S.3803) eingereicht werden. Weitere Informationen erhalten Sie auf der Internetseite www.justiz.de.\nDer Widerspruch muss spätestens innerhalb der gesetzten Frist nach dem Datum der Bekanntmachung der Löschungsankündigung bei dem Amtsgericht - Registergericht - Düsseldorf eingegangen sein.  Dies gilt auch dann, wenn der Widerspruch zur Niederschrift der Geschäftsstelle eines anderen Amtsgerichtes abgegeben wurde. Die Frist beginnt mit dem Tage der Bekanntmachung der Löschungsankündigung in dem für die Bekanntmachung der Eintragungen in das Handelsregister bestimmten elektronischen Informations- und Kommunikationssystem nach § 10 des Handelsgesetzbuches. Fällt das Ende der Frist auf einen Sonntag, einen allgemeinen Feiertag oder Sonnabend, so endet die Frist mit Ablauf des nächsten Werktages.\nDer Widerspruch muss die Bezeichnung der angefochtenen Löschungsankündigung sowie die Erklärung enthalten, dass Widerspruch gegen diese Löschungsankündigung eingelegt wird. Er ist zu unterzeichnen und soll begründet werden."
    },
    {
      "date": "2025-04-15",
      "id": "106656",
      "original_text": "Löschungsankündigung\nNordrhein-Westfalen Amtsgericht Düsseldorf HRB 82596\nTaxi Team TS GmbH – Düsseldorf",
      "type": "Löschungsankündigung",
      "state": "Nordrhein-Westfalen",
      "amtsgericht": "Amtsgericht Düsseldorf",
      "registernummer": "HRB 82596",
      "registerart": "HRB",
      "company_name": "Taxi Team TS GmbH",
      "company_seat": "Düsseldorf",
      "details": "15.04.2025 (Bekanntmachungsdatum)\n\nNordrhein-Westfalen Amtsgericht Düsseldorf HRB 82596\nLöschungsankündigung\n\nTaxi Team TS GmbH\nGesellschaft mit beschränkter Haftung\nDüsseldorf\n\nDas Registergericht beabsichtigt die Gesellschaft von Amts wegen nach § 394 Abs. 1 FamFG zu löschen. Die Frist zur Erhebung eines Widerspruchs ist auf 3 Wochen festgesetzt.\n\nRechtsbehelfsbelehrung:\nDas Widerspruchsrecht steht jedem zu, der an der Unterlassung der Löschung ein berechtigtes Interesse hat. Der Widerspruch ist bei dem Amtsgericht Düsseldorf -Registergericht-, Werdener Straße 1, 40227 Düsseldorf schriftlich in deutscher Sprache oder zur Niederschrift der Geschäftsstelle einzulegen. Der Widerspruch kann auch zur Niederschrift der Geschäftsstelle eines jeden Amtsgerichtes abgegeben werden. Die Einlegung ist auch durch Übertragung eines elektronischen Dokuments an die elektronische Poststelle des Gerichts möglich. Das elektronische Dokument muss für die Bearbeitung durch das Gericht geeignet und mit einer qualifizierten elektronischen Signatur der verantwortenden Person versehen sein oder von der verantwortenden Person signiert und auf einem sicheren Übermittlungsweg gemäß § 130a ZPO nach näherer Maßgabe der Verordnung über die technischen Rahmenbedingungen des elektronischen Rechtsverkehrs und über das besondere elektronische Behördenpostfach (BGBl. I, S.3803) eingereicht werden. Weitere Informationen erhalten Sie auf der Internetseite www.justiz.de.\nDer Widerspruch muss spätestens innerhalb der gesetzten Frist nach dem Datum der Bekanntmachung der Löschungsankündigung bei dem Amtsgericht - Registergericht - Düsseldorf eingegangen sein.  Dies gilt auch dann, wenn der Widerspruch zur Niederschrift der Geschäftsstelle eines anderen Amtsgerichtes abgegeben wurde. Die Frist beginnt mit dem Tage der Bekanntmachung der Löschungsankündigung in dem für die Bekanntmachung der Eintragungen in das Handelsregister bestimmten elektronischen Informations- und Kommunikationssystem nach § 10 des Handelsgesetzbuches. Fällt das Ende der Frist auf einen Sonntag, einen allgemeinen Feiertag oder Sonnabend, so endet die Frist mit Ablauf des nächsten Werktages.\nDer Widerspruch muss die Bezeichnung der angefochtenen Löschungsankündigung sowie die Erklärung enthalten, dass Widerspruch gegen diese Löschungsankündigung eingelegt wird. Er ist zu unterzeichnen und soll begründet werden."
    },
    {
      "date": "2025-04-15",
      "id": "106657",
      "original_text": "Registerbekanntmachung nach dem Umwandlungsgesetz\nNordrhein-Westfalen Amtsgericht Paderborn HRB 12595\nWOLLE RÖDEL Verwaltungs GmbH – Paderborn",
      "type": "Registerbekanntmachung nach dem Umwandlungsgesetz",
      "state": "Nordrhein-Westfalen",
      "amtsgericht": "Amtsgericht Paderborn",
      "registernummer": "HRB 12595",
      "registerart": "HRB",
      "company_name": "WOLLE RÖDEL Verwaltungs GmbH",
      "company_seat": "Paderborn",
      "details": "15.04.2025 (Bekanntmachungsdatum)\n\nNordrhein-Westfalen Amtsgericht Paderborn HRB 12595\nRegisterbekanntmachung nach dem Umwandlungsgesetz 15.04.2025 (Eintragungsdatum)\n\nWOLLE RÖDEL Verwaltungs GmbH\nGesellschaft mit beschränkter Haftung\nPaderborn\n\nDie Gesellschaft hat Gläubigern, deren Forderungen vor dieser Bekanntmachung begründet worden sind, Sicherheit zu leisten, soweit sie nicht Befriedigung verlangen können, wenn sie sich binnen sechs Monaten zu diesem Zweck melden."
    },
    {
      "date": "2025-04-15",
      "id": "106658",
      "original_text": "Einreichung neuer Dokumente\nNordrhein-Westfalen Amtsgericht Essen HRB 7550\nAtlas Copco Holding GmbH – Essen",
      "type": "Einreichung neuer Dokumente",
      "state": "Nordrhein-Westfalen",
      "amtsgericht": "Amtsgericht Essen",
      "registernummer": "HRB 7550",
      "registerart": "HRB",
      "company_name": "Atlas Copco Holding GmbH",
      "company_seat": "Essen",
      "details": "15.04.2025 (Bekanntmachungsdatum)\n\nNordrhein-Westfalen Amtsgericht Essen HRB 7550\nEinreichung neuer Dokumente\n\nAtlas Copco Holding GmbH\nGesellschaft mit beschränkter Haftung\nEssen\n\nDem Registergericht ist eine neue Liste der Mitglieder des Aufsichtsrates eingereicht worden."
    },
    {
      "date": "2025-04-15",
      "id": "106659",
      "original_text": "Sonstige Registerbekanntmachung\nNordrhein-Westfalen Amtsgericht Aachen HRB 9424\nEGG Entwicklungsgesellschaft Gangelt GmbH – Gangelt",
      "type": "Sonstige Registerbekanntmachung",
      "state": "Nordrhein-Westfalen",
      "amtsgericht": "Amtsgericht Aachen",
      "registernummer": "HRB 9424",
      "registerart": "HRB",
      "company_name": "EGG Entwicklungsgesellschaft Gangelt GmbH",
      "company_seat": "Gangelt",
      "details": "15.04.2025 (Bekanntmachungsdatum)\n\nNordrhein-Westfalen Amtsgericht Aachen HRB 9424\nSonstige Registerbekanntmachung\n\nEGG Entwicklungsgesellschaft Gangelt GmbH\nGesellschaft mit beschränkter Haftung\nGangelt\n\nDem Registergericht ist eine Liste der Mitglieder des Aufsichtsrates eingereicht worden."
    },
    {
      "date": "2025-04-15",
      "id": "106660",
      "original_text": "Sonstige Registerbekanntmachung\nNordrhein-Westfalen Amtsgericht Bonn HRB 8836\nEngler Transfer GmbH – Bonn",
      "type": "Sonstige Registerbekanntmachung",
      "state": "Nordrhein-Westfalen",
      "amtsgericht": "Amtsgericht Bonn",
      "registernummer": "HRB 8836",
      "registerart": "HRB",
      "company_name": "Engler Transfer GmbH",
      "company_seat": "Bonn",
      "details": "15.04.2025 (Bekanntmachungsdatum)\n\nNordrhein-Westfalen Amtsgericht Bonn HRB 8836\nSonstige Registerbekanntmachung 15.04.2025 (Eintragungsdatum)\n\nEngler Transfer GmbH\nGesellschaft mit beschränkter Haftung\nBonn\n\nAls nicht eingetragen wird veröffentlicht: Den Gläubigern der Gesellschaft, deren Forderungen begründet worden sind bevor die Eintragung der Beendigung des Beherrschungs- und Gewinnabführungsvertrages  in das Handelsregister nach § 10 des Handelsgesetzbuches als bekanntgemacht gilt, hat der andere Vertragsteil Sicherheit zu leisten, wenn sie sich binnen sechs Monaten nach der Bekanntmachung der Eintragung zu diesem Zweck bei ihm melden."
    },
    {
      "date": "2025-04-15",
      "id": "106661",
      "original_text": "Registerbekanntmachung nach dem Umwandlungsgesetz\nNordrhein-Westfalen Amtsgericht Siegen HRB 14208\nFREIRAUM4 GmbH – Siegen",
      "type": "Registerbekanntmachung nach dem Umwandlungsgesetz",
      "state": "Nordrhein-Westfalen",
      "amtsgericht": "Amtsgericht Siegen",
      "registernummer": "HRB 14208",
      "registerart": "HRB",
      "company_name": "FREIRAUM4 GmbH",
      "company_seat": "Siegen",
      "details": "15.04.2025 (Bekanntmachungsdatum)\n\nNordrhein-Westfalen Amtsgericht Siegen HRB 14208\nRegisterbekanntmachung nach dem Umwandlungsgesetz 14.04.2025 (Eintragungsdatum)\n\nFREIRAUM4 GmbH\nGesellschaft mit beschränkter Haftung\nSiegen\n\nDen Gläubigern der an der formwechselnden Umwandlung beteiligten Rechtsträger ist, wenn sie binnen sechs Monaten nach dem Tag, an dem die Eintragung der formwechselnden Umwandlung in das Register des Sitzes desjenigen Rechtsträgers, dessen Gläubiger sie sind, nach § 19 Absatz 3 UmwG als bekanntgemacht gilt, ihren Anspruch nach Grund und Höhe schriftlich anmelden, Sicherheit zu leisten, soweit sie nicht Befriedigung verlangen können. Dieses Recht steht den Gläubigern jedoch nur zu, wenn sie glaubhaft machen, dass durch die formwechselnden Umwandlung die Erfüllung ihrer Forderung gefährdet wird."
    },
    {
      "date": "2025-04-15",
      "id": "106662",
      "original_text": "Sonstige Registerbekanntmachung\nNordrhein-Westfalen Amtsgericht Düsseldorf HRB 101315\nACM Deutschland Non-Life AG – Düsseldorf",
      "type": "Sonstige Registerbekanntmachung",
      "state": "Nordrhein-Westfalen",
      "amtsgericht": "Amtsgericht Düsseldorf",
      "registernummer": "HRB 101315",
      "registerart": "HRB",
      "company_name": "ACM Deutschland Non-Life AG",
      "company_seat": "Düsseldorf",
      "details": "15.04.2025 (Bekanntmachungsdatum)\n\nNordrhein-Westfalen Amtsgericht Düsseldorf HRB 101315\nSonstige Registerbekanntmachung 15.04.2025 (Eintragungsdatum)\n\nACM Deutschland Non-Life AG\nAktiengesellschaft\nDüsseldorf\n\nDie Gesellschaft hat Gläubigern, deren Forderungen vor dieser Bekanntmachung begründet worden sind, Sicherheit zu leisten, soweit sie nicht Befriedigung verlangen können, wenn sie sich binnen sechs Monaten zu diesem Zweck melden."
    },
    {
      "date": "2025-04-15",
      "id": "106663",
      "original_text": "Löschungsankündigung\nNordrhein-Westfalen Amtsgericht Mönchengladbach HRA 5903\nAutohaus Hans und Friedhelm Coenen GmbH & Co. KG – Mönchengladbach",
      "type": "Löschungsankündigung",
      "state": "Nordrhein-Westfalen",
      "amtsgericht": "Amtsgericht Mönchengladbach",
      "registernummer": "HRA 5903",
      "registerart": "HRA",
      "company_name": "Autohaus Hans und Friedhelm Coenen GmbH & Co. KG",
      "company_seat": "Mönchengladbach",
      "details": "15.04.2025 (Bekanntmachungsdatum)\n\nNordrhein-Westfalen Amtsgericht Mönchengladbach HRA 5903\nLöschungsankündigung\n\nAutohaus Hans und Friedhelm Coenen GmbH & Co. KG\nKommanditgesellschaft\nMönchengladbach\n\nAutohaus Hans und Friedhelm Coenen GmbH & Co. KG, Mönchengladbach (Amtsgericht Mönchengladbach, HRA 5903)\nDas Registergericht beabsichtigt, die im Handelsregister eingetragene Gesellschaft gemäß § 394 Absatz 1 FamFG wegen Vermögenslosigkeit von Amts wegen zu löschen. Gegen diese Verfügung kann Widerspruch eingelegt werden. Die Frist zur Erhebung eines Widerspruchs gegen die beabsichtigte Löschung von Amts wegen ist auf drei Monate festgesetzt."
    },
    {
      "date": "2025-04-15",
      "id": "106664",
      "original_text": "Löschungsankündigung\nNordrhein-Westfalen Amtsgericht Duisburg HRB 34913\nEkio Industrieservice GmbH – Duisburg",
      "type": "Löschungsankündigung",
      "state": "Nordrhein-Westfalen",
      "amtsgericht": "Amtsgericht Duisburg",
      "registernummer": "HRB 34913",
      "registerart": "HRB",
      "company_name": "Ekio Industrieservice GmbH",
      "company_seat": "Duisburg",
      "details": "15.04.2025 (Bekanntmachungsdatum)\n\nNordrhein-Westfalen Amtsgericht Duisburg HRB 34913\nLöschungsankündigung\n\nEkio Industrieservice GmbH\nGesellschaft mit beschränkter Haftung\nDuisburg\n\nHRB 34913:\nEkio Industrieservice GmbH,\nDuisburg,\nBaldusstraße 13, 47138 Duisburg. Das Registergericht beabsichtigt, die im Handelsregister eingetragene Gesellschaft gemäß § 394 Absatz 1 FamFG wegen Vermögenslosigkeit von Amts wegen zu löschen. Gegen diese Verfügung kann Widerspruch eingelegt werden. Die Frist zur Erhebung eines Widerspruchs gegen die beabsichtigte Löschung von Amts wegen ist auf drei Monate festgesetzt. Rechtsbehelfsbelehrung Der Widerspruch ist bei dem Amtsgericht Duisburg, Kardinal-Galen-Str. 124-132, 47058 Duisburg schriftlich in deutscher Sprache oder zur Niederschrift der Geschäftsstelle einzulegen. Der Widerspruch kann auch zur Niederschrift der Geschäftsstelle eines jeden Amtsgerichtes abgegeben werden. Die Einlegung ist auch durch Übertragung eines elektronischen Dokuments an die elektronische Poststelle des Gerichts möglich. Das elektronische Dokument muss für die Bearbeitung durch das Gericht geeignet und mit einer qualifizierten elektronischen Signatur der verantwortenden Person versehen sein oder von der verantwortenden Person signiert und auf einem sicheren Übermittlungsweg gemäß § 130 a ZPO nach näherer Maßgabe der Verordnung über die technischen Rahmenbedingungen des elektronischen Rechtsverkehrs und über das besondere elektronische Behördenpostfach (BGBl. I, S. 3803) eingereicht werden. Weitere Informationen erhalten Sie auf der Internetseite www.justiz.de <http://www.justiz.de>. Der Widerspruch muss spätestens innerhalb der gesetzten Frist bei dem Amtsgericht Duisburg eingegangen sein. Dies gilt auch dann, wenn der Widerspruch zur Niederschrift der Geschäftsstelle eines anderen Amtsgerichtes abgegeben wurde. Die Frist beginnt mit der Veröffentlichung. Fällt das Ende der Frist auf einen Sonntag, einen allgemeinen Feiertag oder Sonnabend, so endet die Frist mit Ablauf des nächsten Werktages. Der Widerspruch muss die Bezeichnung der angefochtenen Verfügung sowie die Erklärung enthalten, dass Widerspruch gegen diese Verfügung eingelegt wird. Er ist zu unterzeichnen und soll begründet werden."
    },
    {
      "date": "2025-04-15",
      "id": "106665",
      "original_text": "Löschungsankündigung\nNordrhein-Westfalen Amtsgericht Köln HRB 88204\nall Connect GmbH – Köln",
      "type": "Löschungsankündigung",
      "state": "Nordrhein-Westfalen",
      "amtsgericht": "Amtsgericht Köln",
      "registernummer": "HRB 88204",
      "registerart": "HRB",
      "company_name": "all Connect GmbH",
      "company_seat": "Köln",
      "details": "15.04.2025 (Bekanntmachungsdatum)\n\nNordrhein-Westfalen Amtsgericht Köln HRB 88204\nLöschungsankündigung\n\nall Connect GmbH\nGesellschaft mit beschränkter Haftung\nKöln\n\nDas Registergericht beabsichtigt die Gesellschaft von Amts wegen nach § 394 FamFG zu löschen. Die Frist zur Erhebung eines Widerspruchs ist auf einen Monat festgesetzt."
    },
    {
      "date": "2025-04-15",
      "id": "106666",
      "original_text": "Registerbekanntmachung nach dem Umwandlungsgesetz\nNordrhein-Westfalen Amtsgericht Düsseldorf HRA 22016\nPaxos Köln Cä24 SARL & Co. KG – Düsseldorf",
      "type": "Registerbekanntmachung nach dem Umwandlungsgesetz",
      "state": "Nordrhein-Westfalen",
      "amtsgericht": "Amtsgericht Düsseldorf",
      "registernummer": "HRA 22016",
      "registerart": "HRA",
      "company_name": "Paxos Köln Cä24 SARL & Co. KG",
      "company_seat": "Düsseldorf",
      "details": "15.04.2025 (Bekanntmachungsdatum)\n\nNordrhein-Westfalen Amtsgericht Düsseldorf HRA 22016\nRegisterbekanntmachung nach dem Umwandlungsgesetz\n\nPaxos Köln Cä24 SARL & Co. KG\nKommanditgesellschaft\nDüsseldorf\n\nEs wird darauf hingewiesen, dass ein Entwurf des Formwechselplans vom 28.03.2025 über einen grenzüberschreitenden vollständigen Formwechsel der bisher binationalen Kommanditgesellschaft Paxos Köln Cä24 SARL & Co. KG mit Sitz in Düsseldorf (Amtsgericht Düsseldorf, HRA 22016)  in die Paxos Köln Cä24 SCS (société en commandite simple) mit Sitz in Luxemburg, Großherzogtum Luxemburg, (Registre de Commerce et des Sociétés de Luxembourg, B289944) beim Handelsregister eingereicht worden ist.\n\nDie Anteilsinhaber, die Gläubiger, sowie die zuständigen Betriebsräte der an dem grenzüberschreitenden Formwechsel beteiligten Gesellschaft oder, soweit es keinen Betriebsrat gibt, die Arbeitnehmer der an dem grenzüberschreitenden Formwechsel beteiligten Gesellschaft, können der Gesellschaft spätestens fünf Arbeitstage vor dem Tag der Gesellschafterversammlung Bemerkungen zum Formwechselplan übermitteln."
    },
    {
      "date": "2025-04-15",
      "id": "106667",
      "original_text": "Löschungsankündigung\nNordrhein-Westfalen Amtsgericht Gütersloh HRB 13435\nAS Group GmbH – Verl",
      "type": "Löschungsankündigung",
      "state": "Nordrhein-Westfalen",
      "amtsgericht": "Amtsgericht Gütersloh",
      "registernummer": "HRB 13435",
      "registerart": "HRB",
      "company_name": "AS Group GmbH",
      "company_seat": "Verl",
      "details": "15.04.2025 (Bekanntmachungsdatum)\n\nNordrhein-Westfalen Amtsgericht Gütersloh HRB 13435\nLöschungsankündigung 15.04.2025 (Eintragungsdatum)\n\nAS Group GmbH\nGesellschaft mit beschränkter Haftung\nVerl\n\nDas Registergericht beabsichtigt die Gesellschaft von Amts wegen nach § 394 FamFG zu löschen. Die Frist zur Erhebung eines Widerspruchs ist auf einen Monat festgesetzt."
    },
    {
      "date": "2025-04-15",
      "id": "106668",
      "original_text": "Löschungsankündigung\nNordrhein-Westfalen Amtsgericht Hamm HRA 4199\nBusiness Services Krahn e.K. – Hamm",
      "type": "Löschungsankündigung",
      "state": "Nordrhein-Westfalen",
      "amtsgericht": "Amtsgericht Hamm",
      "registernummer": "HRA 4199",
      "registerart": "HRA",
      "company_name": "Business Services Krahn e.K.",
      "company_seat": "Hamm",
      "details": "15.04.2025 (Bekanntmachungsdatum)\n\nNordrhein-Westfalen Amtsgericht Hamm HRA 4199\nLöschungsankündigung\n\nBusiness Services Krahn e.K.\nEinzelkaufmann / Einzelkauffrau\nHamm\n\nDas Registergericht beabsichtigt die Firma von Amts wegen nach § 31 Abs. 2 S. 2 HGB zu löschen. Die Frist zur Erhebung eines Widerspruchs ist auf einen Monat festgesetzt."
    },
    {
      "date": "2025-04-15",
      "id": "106669",
      "original_text": "Registerbekanntmachung nach dem Umwandlungsgesetz\nNordrhein-Westfalen Amtsgericht Düsseldorf HRB 52770\nSEGRO Achte Grundbesitz GmbH – Düsseldorf",
      "type": "Registerbekanntmachung nach dem Umwandlungsgesetz",
      "state": "Nordrhein-Westfalen",
      "amtsgericht": "Amtsgericht Düsseldorf",
      "registernummer": "HRB 52770",
      "registerart": "HRB",
      "company_name": "SEGRO Achte Grundbesitz GmbH",
      "company_seat": "Düsseldorf",
      "details": "15.04.2025 (Bekanntmachungsdatum)\n\nNordrhein-Westfalen Amtsgericht Düsseldorf HRB 52770\nRegisterbekanntmachung nach dem Umwandlungsgesetz 15.04.2025 (Eintragungsdatum)\n\nSEGRO Achte Grundbesitz GmbH\nGesellschaft mit beschränkter Haftung\nDüsseldorf\n\nDen Gläubigern der an der Verschmelzung beteiligten Rechtsträger ist, wenn sie binnen sechs Monaten nach dem Tag, an dem die Eintragung der Verschmelzung in das Register des Sitzes desjenigen Rechtsträgers, dessen Gläubiger sie sind, nach § 19 Absatz 3 UmwG als bekanntgemacht gilt, ihren Anspruch nach Grund und Höhe schriftlich anmelden, Sicherheit zu leisten, soweit sie nicht Befriedigung verlangen können. Dieses Recht steht den Gläubigern jedoch nur zu, wenn sie glaubhaft machen, dass durch die Verschmelzung die Erfüllung ihrer Forderung gefährdet wird."
    },
    {
      "date": "2025-04-15",
      "id": "106670",
      "original_text": "Registerbekanntmachung nach dem Umwandlungsgesetz\nNordrhein-Westfalen Amtsgericht Iserlohn HRB 4606\nmartin marketing GmbH – Lüdenscheid",
      "type": "Registerbekanntmachung nach dem Umwandlungsgesetz",
      "state": "Nordrhein-Westfalen",
      "amtsgericht": "Amtsgericht Iserlohn",
      "registernummer": "HRB 4606",
      "registerart": "HRB",
      "company_name": "martin marketing GmbH",
      "company_seat": "Lüdenscheid",
      "details": "15.04.2025 (Bekanntmachungsdatum)\n\nNordrhein-Westfalen Amtsgericht Iserlohn HRB 4606\nRegisterbekanntmachung nach dem Umwandlungsgesetz 09.04.2025 (Eintragungsdatum)\n\nmartin marketing GmbH\nGesellschaft mit beschränkter Haftung\nLüdenscheid\n\nDen Gläubigern der an der formwechselnden Umwandlung beteiligten Rechtsträger ist, wenn sie binnen sechs Monaten nach dem Tag, an dem die Eintragung der formwechselnden Umwandlung in das Register des Sitzes desjenigen Rechtsträgers, dessen Gläubiger sie sind, nach § 19 Absatz 3 UmwG als bekanntgemacht gilt, ihren Anspruch nach Grund und Höhe schriftlich anmelden, Sicherheit zu leisten, soweit sie nicht Befriedigung verlangen können. Dieses Recht steht den Gläubigern jedoch nur zu, wenn sie glaubhaft machen, dass durch die formwechselnden Umwandlung die Erfüllung ihrer Forderung gefährdet wird."
    },
    {
      "date": "2025-04-15",
      "id": "106671",
      "original_text": "Löschungsankündigung\nThüringen Amtsgericht Jena HRB 501359\nH-M Innenausbau GmbH – Erfurt",
      "type": "Löschungsankündigung",
      "state": "Thüringen",
      "amtsgericht": "Amtsgericht Jena",
      "registernummer": "HRB 501359",
      "registerart": "HRB",
      "company_name": "H-M Innenausbau GmbH",
      "company_seat": "Erfurt",
      "details": "15.04.2025 (Bekanntmachungsdatum)\n\nThüringen Amtsgericht Jena HRB 501359\nLöschungsankündigung\n\nH-M Innenausbau GmbH\nGesellschaft mit beschränkter Haftung\nErfurt\n\nDas Registergericht beabsichtigt, die im Handelsregister eingetragene Gesellschaft wegen Vermögenslosigkeit nach § 394 FamFG von Amts wegen zu löschen. Die Frist zur Erhebung eines Widerspruchs gegen die beabsichtigte Löschung wird auf 6 Wochen festgesetzt."
    },
    {
      "date": "2025-04-15",
      "id": "106672",
      "original_text": "Löschungsankündigung\nThüringen Amtsgericht Jena HRB 501665\nIndsys-Industriesysteme GmbH – Steinbach-Hallenberg",
      "type": "Löschungsankündigung",
      "state": "Thüringen",
      "amtsgericht": "Amtsgericht Jena",
      "registernummer": "HRB 501665",
      "registerart": "HRB",
      "company_name": "Indsys-Industriesysteme GmbH",
      "company_seat": "Steinbach-Hallenberg",
      "details": "15.04.2025 (Bekanntmachungsdatum)\n\nThüringen Amtsgericht Jena HRB 501665\nLöschungsankündigung\n\nIndsys-Industriesysteme GmbH\nGesellschaft mit beschränkter Haftung\nSteinbach-Hallenberg\n\nDas Registergericht beabsichtigt, die im Handelsregister eingetragene Gesellschaft wegen Vermögenslosigkeit nach § 394 FamFG von Amts wegen zu löschen. Die Frist zur Erhebung eines Widerspruchs gegen die beabsichtigte Löschung wird auf 6 Wochen festgesetzt."
    },
    {
      "date": "2025-04-15",
      "id": "106673",
      "original_text": "Sonstige Registerbekanntmachung\nHessen Amtsgericht Kassel VR 4558\nZeitbörse Kassel e.V. – Kassel",
      "type": "Sonstige Registerbekanntmachung",
      "state": "Hessen",
      "amtsgericht": "Amtsgericht Kassel",
      "registernummer": "VR 4558",
      "registerart": "VR",
      "company_name": "Zeitbörse Kassel e.V.",
      "company_seat": "Kassel",
      "details": "15.04.2025 (Bekanntmachungsdatum)\n\nHessen Amtsgericht Kassel VR 4558\nSonstige Registerbekanntmachung 15.04.2025 (Eintragungsdatum)\n\nZeitbörse Kassel e.V.\neingetragener Verein\nKassel\n\nDer Verein ist aufgelöst."
    },
    {
      "date": "2025-04-15",
      "id": "106674",
      "original_text": "Einreichung neuer Dokumente\nHessen Amtsgericht Frankfurt am Main HRB 136201\nAtrium 296. Europäische VV SE – Frankfurt am Main",
      "type": "Einreichung neuer Dokumente",
      "state": "Hessen",
      "amtsgericht": "Amtsgericht Frankfurt am Main",
      "registernummer": "HRB 136201",
      "registerart": "HRB",
      "company_name": "Atrium 296. Europäische VV SE",
      "company_seat": "Frankfurt am Main",
      "details": "15.04.2025 (Bekanntmachungsdatum)\n\nHessen Amtsgericht Frankfurt am Main HRB 136201\nEinreichung neuer Dokumente\n\nAtrium 296. Europäische VV SE\nEuropäische Aktiengesellschaft (SE)\nFrankfurt am Main\n\nDurch eine Änderung in den Personen der Aufsichtsratsmitglieder ist eine Liste der Mitglieder des Aufsichtsrates zum Handelsregister eingereicht worden."
    },
    {
      "date": "2025-04-15",
      "id": "106675",
      "original_text": "Registerbekanntmachung nach dem Umwandlungsgesetz\nHessen Amtsgericht Frankfurt am Main HRB 102488\nKJL Capital GmbH – Frankfurt am Main",
      "type": "Registerbekanntmachung nach dem Umwandlungsgesetz",
      "state": "Hessen",
      "amtsgericht": "Amtsgericht Frankfurt am Main",
      "registernummer": "HRB 102488",
      "registerart": "HRB",
      "company_name": "KJL Capital GmbH",
      "company_seat": "Frankfurt am Main",
      "details": "15.04.2025 (Bekanntmachungsdatum)\n\nHessen Amtsgericht Frankfurt am Main HRB 102488\nRegisterbekanntmachung nach dem Umwandlungsgesetz 15.04.2025 (Eintragungsdatum)\n\nKJL Capital GmbH\nGesellschaft mit beschränkter Haftung\nFrankfurt am Main\n\nDen Gläubigern der an der formwechselnden Umwandlung beteiligten Rechtsträger ist, wenn sie binnen sechs Monaten nach dem Tag, an dem die Eintragung der formwechselnden Umwandlung in das Register des Sitzes desjenigen Rechtsträgers, dessen Gläubiger sie sind, nach § 201 UmwG bekannt gemacht worden ist, ihren Anspruch nach Grund und Höhe schriftlich anmelden, Sicherheit zu leisten, soweit sie nicht Befriedigung verlangen können. Dieses Recht steht den Gläubigern jedoch nur zu, wenn sie glaubhaft machen, dass durch die formwechselnden Umwandlung die Erfüllung ihrer Forderung gefährdet wird."
    },
    {
      "date": "2025-04-15",
      "id": "106676",
      "original_text": "Einreichung neuer Dokumente\nHessen Amtsgericht Frankfurt am Main HRB 109678\nMorgan Stanley Europe Holding SE – Frankfurt am Main",
      "type": "Einreichung neuer Dokumente",
      "state": "Hessen",
      "amtsgericht": "Amtsgericht Frankfurt am Main",
      "registernummer": "HRB 109678",
      "registerart": "HRB",
      "company_name": "Morgan Stanley Europe Holding SE",
      "company_seat": "Frankfurt am Main",
      "details": "15.04.2025 (Bekanntmachungsdatum)\n\nHessen Amtsgericht Frankfurt am Main HRB 109678\nEinreichung neuer Dokumente\n\nMorgan Stanley Europe Holding SE\nEuropäische Aktiengesellschaft (SE)\nFrankfurt am Main\n\nDurch eine Änderung in den Personen der Aufsichtsratsmitglieder ist eine Liste der Mitglieder des Aufsichtsrates zum Handelsregister eingereicht worden."
    },
    {
      "date": "2025-04-15",
      "id": "106677",
      "original_text": "Löschungsankündigung\nHessen Amtsgericht Wiesbaden HRB 21174\nMontenegro Gaststätten-Betriebs GmbH – Wiesbaden",
      "type": "Löschungsankündigung",
      "state": "Hessen",
      "amtsgericht": "Amtsgericht Wiesbaden",
      "registernummer": "HRB 21174",
      "registerart": "HRB",
      "company_name": "Montenegro Gaststätten-Betriebs GmbH",
      "company_seat": "Wiesbaden",
      "details": "15.04.2025 (Bekanntmachungsdatum)\n\nHessen Amtsgericht Wiesbaden HRB 21174\nLöschungsankündigung\n\nMontenegro Gaststätten-Betriebs GmbH\nGesellschaft mit beschränkter Haftung\nWiesbaden\n\nDas Registergericht beabsichtigt die im Handelsregister eingetragene Gesellschaft von Amts wegen nach § 394 FamFG zu löschen. Die Frist zur Erhebung eines Widerspruchs gegen die beabsichtigte Löschung wird auf 3 Monate festgesetzt."
    },
    {
      "date": "2025-04-15",
      "id": "106678",
      "original_text": "Löschungsankündigung\nHessen Amtsgericht Frankfurt am Main HRB 113418\nHKS UG (haftungsbeschränkt) – Frankfurt am Main",
      "type": "Löschungsankündigung",
      "state": "Hessen",
      "amtsgericht": "Amtsgericht Frankfurt am Main",
      "registernummer": "HRB 113418",
      "registerart": "HRB",
      "company_name": "HKS UG (haftungsbeschränkt)",
      "company_seat": "Frankfurt am Main",
      "details": "15.04.2025 (Bekanntmachungsdatum)\n\nHessen Amtsgericht Frankfurt am Main HRB 113418\nLöschungsankündigung 15.04.2025 (Eintragungsdatum)\n\nHKS UG (haftungsbeschränkt)\nGesellschaft mit beschränkter Haftung\nFrankfurt am Main\n\nDas Registergericht beabsichtigt die im Handelsregister eingetragene Gesellschaft von Amts wegen nach § 394 FamFG zu löschen. Die Frist zur Erhebung eines Widerspruchs gegen die beabsichtigte Löschung wird auf 1 Monat festgesetzt."
    },
    {
      "date": "2025-04-15",
      "id": "106679",
      "original_text": "Registerbekanntmachung nach dem Umwandlungsgesetz\nHessen Amtsgericht Frankfurt am Main HRB 138421\nKJL Capital AG – Frankfurt am Main",
      "type": "Registerbekanntmachung nach dem Umwandlungsgesetz",
      "state": "Hessen",
      "amtsgericht": "Amtsgericht Frankfurt am Main",
      "registernummer": "HRB 138421",
      "registerart": "HRB",
      "company_name": "KJL Capital AG",
      "company_seat": "Frankfurt am Main",
      "details": "15.04.2025 (Bekanntmachungsdatum)\n\nHessen Amtsgericht Frankfurt am Main HRB 138421\nRegisterbekanntmachung nach dem Umwandlungsgesetz 15.04.2025 (Eintragungsdatum)\n\nKJL Capital AG\nAktiengesellschaft\nFrankfurt am Main\n\nDen Gläubigern der an der formwechselnden Umwandlung beteiligten Rechtsträger ist, wenn sie binnen sechs Monaten nach dem Tag, an dem die Eintragung der formwechselnden Umwandlung in das Register des Sitzes desjenigen Rechtsträgers, dessen Gläubiger sie sind, nach § 201 UmwG bekannt gemacht worden ist, ihren Anspruch nach Grund und Höhe schriftlich anmelden, Sicherheit zu leisten, soweit sie nicht Befriedigung verlangen können. Dieses Recht steht den Gläubigern jedoch nur zu, wenn sie glaubhaft machen, dass durch die formwechselnden Umwandlung die Erfüllung ihrer Forderung gefährdet wird."
    },
    {
      "date": "2025-04-15",
      "id": "106680",
      "original_text": "Löschungsankündigung\nHessen Amtsgericht Darmstadt HRB 90515\ne-zigi GmbH – Fürth",
      "type": "Löschungsankündigung",
      "state": "Hessen",
      "amtsgericht": "Amtsgericht Darmstadt",
      "registernummer": "HRB 90515",
      "registerart": "HRB",
      "company_name": "e-zigi GmbH",
      "company_seat": "Fürth",
      "details": "15.04.2025 (Bekanntmachungsdatum)\n\nHessen Amtsgericht Darmstadt HRB 90515\nLöschungsankündigung\n\ne-zigi GmbH\nGesellschaft mit beschränkter Haftung\nFürth\n\nDas Registergericht beabsichtigt die im Handelsregister eingetragene Gesellschaft von Amts wegen nach § 394 FamFG zu löschen. Die Frist zur Erhebung eines Widerspruchs gegen die beabsichtigte Löschung wird auf 3 Monate festgesetzt."
    },
    {
      "date": "2025-04-15",
      "id": "106681",
      "original_text": "Löschungsankündigung\nHessen Amtsgericht Frankfurt am Main HRB 98572\nA Taste of Mexico GmbH – Frankfurt am Main",
      "type": "Löschungsankündigung",
      "state": "Hessen",
      "amtsgericht": "Amtsgericht Frankfurt am Main",
      "registernummer": "HRB 98572",
      "registerart": "HRB",
      "company_name": "A Taste of Mexico GmbH",
      "company_seat": "Frankfurt am Main",
      "details": "15.04.2025 (Bekanntmachungsdatum)\n\nHessen Amtsgericht Frankfurt am Main HRB 98572\nLöschungsankündigung\n\nA Taste of Mexico GmbH\nGesellschaft mit beschränkter Haftung\nFrankfurt am Main\n\nEs ist beabsichtig, die Gesellschaft wegen Vermögenslosigkeit gemäß § 394 FamFG von Amts wegen im Handelsregister zu löschen. Hiergegen kann innerhalb eines Zeitraums von 1 Monat nach dieser Veröffentlichung Widerspruch bei dem Amtsgericht Frankfurt am Main eingelegt werden."
    },
    {
      "date": "2025-04-15",
      "id": "106682",
      "original_text": "Löschungsankündigung\nHessen Amtsgericht Frankfurt am Main HRB 88136\nQuotenhaus Development Verwaltungs GmbH – Eschborn",
      "type": "Löschungsankündigung",
      "state": "Hessen",
      "amtsgericht": "Amtsgericht Frankfurt am Main",
      "registernummer": "HRB 88136",
      "registerart": "HRB",
      "company_name": "Quotenhaus Development Verwaltungs GmbH",
      "company_seat": "Eschborn",
      "details": "15.04.2025 (Bekanntmachungsdatum)\n\nHessen Amtsgericht Frankfurt am Main HRB 88136\nLöschungsankündigung 15.04.2025 (Eintragungsdatum)\n\nQuotenhaus Development Verwaltungs GmbH\nGesellschaft mit beschränkter Haftung\nEschborn\n\nDas Registergericht beabsichtigt die im Handelsregister eingetragene Gesellschaft von Amts wegen nach § 394 FamFG zu löschen. Die Frist zur Erhebung eines Widerspruchs gegen die beabsichtigte Löschung wird auf 1 Monat festgesetzt."
    },
    {
      "date": "2025-04-15",
      "id": "106683",
      "original_text": "Registerbekanntmachung nach dem Umwandlungsgesetz\nHessen Amtsgericht Gießen HRB 8076\nHolzland Gießen GmbH – Gießen",
      "type": "Registerbekanntmachung nach dem Umwandlungsgesetz",
      "state": "Hessen",
      "amtsgericht": "Amtsgericht Gießen",
      "registernummer": "HRB 8076",
      "registerart": "HRB",
      "company_name": "Holzland Gießen GmbH",
      "company_seat": "Gießen",
      "details": "15.04.2025 (Bekanntmachungsdatum)\n\nHessen Amtsgericht Gießen HRB 8076\nRegisterbekanntmachung nach dem Umwandlungsgesetz 15.04.2025 (Eintragungsdatum)\n\nHolzland Gießen GmbH\nGesellschaft mit beschränkter Haftung\nGießen\n\nDen Gläubigern der an der Verschmelzung beteiligten Rechtsträger ist, wenn sie binnen sechs Monaten nach dem Tag, an dem die Eintragung der Verschmelzung in das Register des Sitzes desjenigen Rechtsträgers, dessen Gläubiger sie sind, nach § 19 Absatz 3 UmwG bekannt gemacht worden ist, ihren Anspruch nach Grund und Höhe schriftlich anmelden, Sicherheit zu leisten, soweit sie nicht Befriedigung verlangen können. Dieses Recht steht den Gläubigern jedoch nur zu, wenn sie glaubhaft machen, dass durch die Verschmelzung die Erfüllung ihrer Forderung gefährdet wird."
    },
    {
      "date": "2025-04-15",
      "id": "106684",
      "original_text": "Einreichung neuer Dokumente\nHessen Amtsgericht Wiesbaden HRB 2174\nR+V Pensionsversicherung a.G. – Wiesbaden",
      "type": "Einreichung neuer Dokumente",
      "state": "Hessen",
      "amtsgericht": "Amtsgericht Wiesbaden",
      "registernummer": "HRB 2174",
      "registerart": "HRB",
      "company_name": "R+V Pensionsversicherung a.G.",
      "company_seat": "Wiesbaden",
      "details": "15.04.2025 (Bekanntmachungsdatum)\n\nHessen Amtsgericht Wiesbaden HRB 2174\nEinreichung neuer Dokumente 15.04.2025 (Eintragungsdatum)\n\nR+V Pensionsversicherung a.G.\nVersicherungsverein auf Gegenseitigkeit\nWiesbaden\n\nDurch eine Änderung in den Personen der Aufsichtsratsmitglieder ist eine Liste der Mitglieder des Aufsichtsrates zum Handelsregister eingereicht worden."
    },
    {
      "date": "2025-04-15",
      "id": "106685",
      "original_text": "Einreichung neuer Dokumente\nHessen Amtsgericht Frankfurt am Main HRB 54220\nDeutsche Immobilien Chancen AG & Co. Kommanditgesellschaft auf Aktien – Frankfurt am Main",
      "type": "Einreichung neuer Dokumente",
      "state": "Hessen",
      "amtsgericht": "Amtsgericht Frankfurt am Main",
      "registernummer": "HRB 54220",
      "registerart": "HRB",
      "company_name": "Deutsche Immobilien Chancen AG & Co. Kommanditgesellschaft auf Aktien",
      "company_seat": "Frankfurt am Main",
      "details": "15.04.2025 (Bekanntmachungsdatum)\n\nHessen Amtsgericht Frankfurt am Main HRB 54220\nEinreichung neuer Dokumente\n\nDeutsche Immobilien Chancen AG & Co. Kommanditgesellschaft auf Aktien\nKommanditgesellschaft auf Aktien\nFrankfurt am Main\n\nDurch eine Änderung in den Personen der Aufsichtsratsmitglieder ist eine Liste der Mitglieder des Aufsichtsrates zum Handelsregister eingereicht worden."
    },
    {
      "date": "2025-04-15",
      "id": "106686",
      "original_text": "Registerbekanntmachung nach dem Umwandlungsgesetz\nBayern Amtsgericht München HRB 197398\nH.G. Perseus GmbH Steuerberatungsgesellschaft – München",
      "type": "Registerbekanntmachung nach dem Umwandlungsgesetz",
      "state": "Bayern",
      "amtsgericht": "Amtsgericht München",
      "registernummer": "HRB 197398",
      "registerart": "HRB",
      "company_name": "H.G. Perseus GmbH Steuerberatungsgesellschaft",
      "company_seat": "München",
      "details": "15.04.2025 (Bekanntmachungsdatum)\n\nBayern Amtsgericht München HRB 197398\nRegisterbekanntmachung nach dem Umwandlungsgesetz 15.04.2025 (Eintragungsdatum)\n\nH.G. Perseus GmbH Steuerberatungsgesellschaft\nGesellschaft mit beschränkter Haftung\nMünchen\n\nDen Gläubigern der an der Verschmelzung beteiligten Rechtsträger ist, wenn sie binnen sechs Monaten nach dem Tag, an dem die Eintragung der Verschmelzung in das Register des Sitzes desjenigen Rechtsträgers, dessen Gläubiger sie sind, nach § 19 Abs. 3 UmwG als bekannt gemacht gilt, ihren Anspruch nach Grund und Höhe in Textform anmelden, Sicherheit zu leisten, soweit sie nicht Befriedigung verlangen können. Dieses Recht steht den Gläubigern jedoch nur zu, wenn sie glaubhaft machen, dass durch die Verschmelzung die Erfüllung ihrer Forderung gefährdet wird."
    },
    {
      "date": "2025-04-15",
      "id": "106687",
      "original_text": "Löschungsankündigung\nBayern Amtsgericht Regensburg HRB 19239\nGeorg Metall UG (haftungsbeschränkt) – Neutraubling",
      "type": "Löschungsankündigung",
      "state": "Bayern",
      "amtsgericht": "Amtsgericht Regensburg",
      "registernummer": "HRB 19239",
      "registerart": "HRB",
      "company_name": "Georg Metall UG (haftungsbeschränkt)",
      "company_seat": "Neutraubling",
      "details": "15.04.2025 (Bekanntmachungsdatum)\n\nBayern Amtsgericht Regensburg HRB 19239\nLöschungsankündigung 15.04.2025 (Eintragungsdatum)\n\nGeorg Metall UG (haftungsbeschränkt)\nGesellschaft mit beschränkter Haftung\nNeutraubling\n\nDas Registergericht beabsichtigt, die im Handelsregister eingetragene Gesellschaft wegen Vermögenslosigkeit von Amts wegen nach § 394 FamFG zu löschen. Die Frist zur Erhebung eines Widerspruchs ist auf einen Monat festgesetzt."
    },
    {
      "date": "2025-04-15",
      "id": "106688",
      "original_text": "Löschungsankündigung\nBayern Amtsgericht München HRB 239378\nPCG_Holdco GmbH – München",
      "type": "Löschungsankündigung",
      "state": "Bayern",
      "amtsgericht": "Amtsgericht München",
      "registernummer": "HRB 239378",
      "registerart": "HRB",
      "company_name": "PCG_Holdco GmbH",
      "company_seat": "München",
      "details": "15.04.2025 (Bekanntmachungsdatum)\n\nBayern Amtsgericht München HRB 239378\nLöschungsankündigung\n\nPCG_Holdco GmbH\nGesellschaft mit beschränkter Haftung\nMünchen\n\nDas Registergericht beabsichtigt, die im Handelsregister eingetragene Gesellschaft wegen Vermögenslosigkeit von Amts wegen nach § 394 FamFG zu löschen. Die Frist zur Erhebung eines Widerspruchs ist auf drei Monate festgesetzt."
    },
    {
      "date": "2025-04-15",
      "id": "106689",
      "original_text": "Löschungsankündigung\nBayern Amtsgericht München HRB 205035\nGDO München GmbH – Fürstenfeldbruck",
      "type": "Löschungsankündigung",
      "state": "Bayern",
      "amtsgericht": "Amtsgericht München",
      "registernummer": "HRB 205035",
      "registerart": "HRB",
      "company_name": "GDO München GmbH",
      "company_seat": "Fürstenfeldbruck",
      "details": "15.04.2025 (Bekanntmachungsdatum)\n\nBayern Amtsgericht München HRB 205035\nLöschungsankündigung 15.04.2025 (Eintragungsdatum)\n\nGDO München GmbH\nGesellschaft mit beschränkter Haftung\nFürstenfeldbruck\n\nDas Registergericht beabsichtigt, die im Handelsregister eingetragene Gesellschaft wegen Vermögenslosigkeit von Amts wegen nach § 394 FamFG zu löschen. Die Frist zur Erhebung eines Widerspruchs ist auf drei Monate festgesetzt."
    },
    {
      "date": "2025-04-15",
      "id": "106690",
      "original_text": "Löschungsankündigung\nBayern Amtsgericht Regensburg HRB 17953\nLucy's Online Shop GmbH – Regensburg",
      "type": "Löschungsankündigung",
      "state": "Bayern",
      "amtsgericht": "Amtsgericht Regensburg",
      "registernummer": "HRB 17953",
      "registerart": "HRB",
      "company_name": "Lucy's Online Shop GmbH",
      "company_seat": "Regensburg",
      "details": "15.04.2025 (Bekanntmachungsdatum)\n\nBayern Amtsgericht Regensburg HRB 17953\nLöschungsankündigung 15.04.2025 (Eintragungsdatum)\n\nLucy's Online Shop GmbH\nGesellschaft mit beschränkter Haftung\nRegensburg\n\nDas Registergericht beabsichtigt, die im Handelsregister eingetragene Gesellschaft wegen Vermögenslosigkeit von Amts wegen nach § 394 FamFG zu löschen. Die Frist zur Erhebung eines Widerspruchs ist auf einen Monat festgesetzt."
    },
    {
      "date": "2025-04-15",
      "id": "106691",
      "original_text": "Registerbekanntmachung nach dem Umwandlungsgesetz\nBayern Amtsgericht Nürnberg HRB 35430\nB. B. Jupita Reinigungsservice GmbH – Nürnberg",
      "type": "Registerbekanntmachung nach dem Umwandlungsgesetz",
      "state": "Bayern",
      "amtsgericht": "Amtsgericht Nürnberg",
      "registernummer": "HRB 35430",
      "registerart": "HRB",
      "company_name": "B. B. Jupita Reinigungsservice GmbH",
      "company_seat": "Nürnberg",
      "details": "15.04.2025 (Bekanntmachungsdatum)\n\nBayern Amtsgericht Nürnberg HRB 35430\nRegisterbekanntmachung nach dem Umwandlungsgesetz 15.04.2025 (Eintragungsdatum)\n\nB. B. Jupita Reinigungsservice GmbH\nGesellschaft mit beschränkter Haftung\nNürnberg\n\nDen Gläubigern der an der Verschmelzung beteiligten Rechtsträger ist, wenn sie binnen sechs Monaten nach dem Tag, an dem die Eintragung der Verschmelzung in das Register des Sitzes desjenigen Rechtsträgers, dessen Gläubiger sie sind, nach § 19 Abs. 3 UmwG als bekannt gemacht gilt, ihren Anspruch nach Grund und Höhe in Textform anmelden, Sicherheit zu leisten, soweit sie nicht Befriedigung verlangen können. Dieses Recht steht den Gläubigern jedoch nur zu, wenn sie glaubhaft machen, dass durch die Verschmelzung die Erfüllung ihrer Forderung gefährdet wird."
    },
    {
      "date": "2025-04-15",
      "id": "106692",
      "original_text": "Registerbekanntmachung nach dem Umwandlungsgesetz\nBayern Amtsgericht München HRB 119338\nMacrotron GmbH – Dornach, Gemeinde Aschheim",
      "type": "Registerbekanntmachung nach dem Umwandlungsgesetz",
      "state": "Bayern",
      "amtsgericht": "Amtsgericht München",
      "registernummer": "HRB 119338",
      "registerart": "HRB",
      "company_name": "Macrotron GmbH",
      "company_seat": "Dornach, Gemeinde Aschheim",
      "details": "15.04.2025 (Bekanntmachungsdatum)\n\nBayern Amtsgericht München HRB 119338\nRegisterbekanntmachung nach dem Umwandlungsgesetz 15.04.2025 (Eintragungsdatum)\n\nMacrotron GmbH\nGesellschaft mit beschränkter Haftung\nDornach, Gemeinde Aschheim\n\nDen Gläubigern der an der Verschmelzung beteiligten Rechtsträger ist, wenn sie binnen sechs Monaten nach dem Tag, an dem die Eintragung der Verschmelzung in das Register des Sitzes desjenigen Rechtsträgers, dessen Gläubiger sie sind, nach § 19 Abs. 3 UmwG als bekannt gemacht gilt, ihren Anspruch nach Grund und Höhe in Textform anmelden, Sicherheit zu leisten, soweit sie nicht Befriedigung verlangen können. Dieses Recht steht den Gläubigern jedoch nur zu, wenn sie glaubhaft machen, dass durch die Verschmelzung die Erfüllung ihrer Forderung gefährdet wird."
    },
    {
      "date": "2025-04-15",
      "id": "106693",
      "original_text": "Einreichung neuer Dokumente\nBayern Amtsgericht München HRB 152160\nResidia Asset Management AG – Oberhaching",
      "type": "Einreichung neuer Dokumente",
      "state": "Bayern",
      "amtsgericht": "Amtsgericht München",
      "registernummer": "HRB 152160",
      "registerart": "HRB",
      "company_name": "Residia Asset Management AG",
      "company_seat": "Oberhaching",
      "details": "15.04.2025 (Bekanntmachungsdatum)\n\nBayern Amtsgericht München HRB 152160\nEinreichung neuer Dokumente\n\nResidia Asset Management AG\nAktiengesellschaft\nOberhaching\n\nDem Amtsgericht München -Registergericht- ist eine Liste der Mitglieder des Aufsichtsrats eingereicht worden, § 106 AktG."
    },
    {
      "date": "2025-04-15",
      "id": "106694",
      "original_text": "Einreichung neuer Dokumente\nBayern Amtsgericht Fürth HRB 16410\ndevelop group Holding AG – Erlangen",
      "type": "Einreichung neuer Dokumente",
      "state": "Bayern",
      "amtsgericht": "Amtsgericht Fürth",
      "registernummer": "HRB 16410",
      "registerart": "HRB",
      "company_name": "develop group Holding AG",
      "company_seat": "Erlangen",
      "details": "15.04.2025 (Bekanntmachungsdatum)\n\nBayern Amtsgericht Fürth HRB 16410\nEinreichung neuer Dokumente\n\ndevelop group Holding AG\nAktiengesellschaft\nErlangen\n\nDem Amtsgericht Fürth -Registergericht- ist eine Liste der Mitglieder des Aufsichtsrats eingereicht worden, § 106 AktG."
    },
    {
      "date": "2025-04-15",
      "id": "106695",
      "original_text": "Registerbekanntmachung nach dem Umwandlungsgesetz\nBayern Amtsgericht München HRB 222881\nPLS GmbH – Gröbenzell",
      "type": "Registerbekanntmachung nach dem Umwandlungsgesetz",
      "state": "Bayern",
      "amtsgericht": "Amtsgericht München",
      "registernummer": "HRB 222881",
      "registerart": "HRB",
      "company_name": "PLS GmbH",
      "company_seat": "Gröbenzell",
      "details": "15.04.2025 (Bekanntmachungsdatum)\n\nBayern Amtsgericht München HRB 222881\nRegisterbekanntmachung nach dem Umwandlungsgesetz 15.04.2025 (Eintragungsdatum)\n\nPLS GmbH\nGesellschaft mit beschränkter Haftung\nGröbenzell\n\nDen Gläubigern des formwechselnden Rechtsträgers ist, wenn sie binnen sechs Monaten nach dem Tag, an dem die Eintragung des Formwechsels nach § 201 UmwG als bekannt gemacht gilt, ihren Anspruch nach Grund und Höhe in Textform anmelden, Sicherheit zu leisten, soweit sie nicht Befriedigung verlangen können. Dieses Recht steht den Gläubigern jedoch nur zu, wenn sie glaubhaft machen, dass durch den Formwechsel die Erfüllung ihrer Forderung gefährdet wird."
    },
    {
      "date": "2025-04-15",
      "id": "106696",
      "original_text": "Registerbekanntmachung nach dem Umwandlungsgesetz\nBayern Amtsgericht Nürnberg HRB 35416\nBehme Verwaltungs GmbH – Nürnberg",
      "type": "Registerbekanntmachung nach dem Umwandlungsgesetz",
      "state": "Bayern",
      "amtsgericht": "Amtsgericht Nürnberg",
      "registernummer": "HRB 35416",
      "registerart": "HRB",
      "company_name": "Behme Verwaltungs GmbH",
      "company_seat": "Nürnberg",
      "details": "15.04.2025 (Bekanntmachungsdatum)\n\nBayern Amtsgericht Nürnberg HRB 35416\nRegisterbekanntmachung nach dem Umwandlungsgesetz 15.04.2025 (Eintragungsdatum)\n\nBehme Verwaltungs GmbH\nGesellschaft mit beschränkter Haftung\nNürnberg\n\nDen Gläubigern der an der Verschmelzung beteiligten Rechtsträger ist, wenn sie binnen sechs Monaten nach dem Tag, an dem die Eintragung der Verschmelzung in das Register des Sitzes desjenigen Rechtsträgers, dessen Gläubiger sie sind, nach § 19 Abs. 3 UmwG als bekannt gemacht gilt, ihren Anspruch nach Grund und Höhe in Textform anmelden, Sicherheit zu leisten, soweit sie nicht Befriedigung verlangen können. Dieses Recht steht den Gläubigern jedoch nur zu, wenn sie glaubhaft machen, dass durch die Verschmelzung die Erfüllung ihrer Forderung gefährdet wird."
    },
    {
      "date": "2025-04-15",
      "id": "106697",
      "original_text": "Registerbekanntmachung nach dem Umwandlungsgesetz\nBayern Amtsgericht Landshut HRB 6748\nANIMA.42 GmbH – Niederaichbach",
      "type": "Registerbekanntmachung nach dem Umwandlungsgesetz",
      "state": "Bayern",
      "amtsgericht": "Amtsgericht Landshut",
      "registernummer": "HRB 6748",
      "registerart": "HRB",
      "company_name": "ANIMA.42 GmbH",
      "company_seat": "Niederaichbach",
      "details": "15.04.2025 (Bekanntmachungsdatum)\n\nBayern Amtsgericht Landshut HRB 6748\nRegisterbekanntmachung nach dem Umwandlungsgesetz 15.04.2025 (Eintragungsdatum)\n\nANIMA.42 GmbH\nGesellschaft mit beschränkter Haftung\nNiederaichbach\n\nDen Gläubigern der an der Verschmelzung beteiligten Rechtsträger ist, wenn sie binnen sechs Monaten nach dem Tag, an dem die Eintragung der Verschmelzung in das Register des Sitzes desjenigen Rechtsträgers, dessen Gläubiger sie sind, nach § 19 Abs. 3 UmwG als bekannt gemacht gilt, ihren Anspruch nach Grund und Höhe in Textform anmelden, Sicherheit zu leisten, soweit sie nicht Befriedigung verlangen können. Dieses Recht steht den Gläubigern jedoch nur zu, wenn sie glaubhaft machen, dass durch die Verschmelzung die Erfüllung ihrer Forderung gefährdet wird."
    },
    {
      "date": "2025-04-15",
      "id": "106698",
      "original_text": "Einreichung neuer Dokumente\nBayern Amtsgericht München HRB 297907\nSnke Holding SE – München",
      "type": "Einreichung neuer Dokumente",
      "state": "Bayern",
      "amtsgericht": "Amtsgericht München",
      "registernummer": "HRB 297907",
      "registerart": "HRB",
      "company_name": "Snke Holding SE",
      "company_seat": "München",
      "details": "15.04.2025 (Bekanntmachungsdatum)\n\nBayern Amtsgericht München HRB 297907\nEinreichung neuer Dokumente 15.04.2025 (Eintragungsdatum)\n\nSnke Holding SE\nEuropäische Aktiengesellschaft (SE)\nMünchen\n\nDem Amtsgericht München -Registergericht- ist eine Liste der Mitglieder des Aufsichtsrats eingereicht worden, Art. 9 Abs. 1 Buchst. c (ii) SE-VO i.V.m. § 106 AktG."
    },
    {
      "date": "2025-04-15",
      "id": "106699",
      "original_text": "Registerbekanntmachung nach dem Umwandlungsgesetz\nBayern Amtsgericht München HRB 149039\nMössbauer Lucky Start GmbH – München",
      "type": "Registerbekanntmachung nach dem Umwandlungsgesetz",
      "state": "Bayern",
      "amtsgericht": "Amtsgericht München",
      "registernummer": "HRB 149039",
      "registerart": "HRB",
      "company_name": "Mössbauer Lucky Start GmbH",
      "company_seat": "München",
      "details": "15.04.2025 (Bekanntmachungsdatum)\n\nBayern Amtsgericht München HRB 149039\nRegisterbekanntmachung nach dem Umwandlungsgesetz 15.04.2025 (Eintragungsdatum)\n\nMössbauer Lucky Start GmbH\nGesellschaft mit beschränkter Haftung\nMünchen\n\nDen Gläubigern der an der Verschmelzung beteiligten Rechtsträger ist, wenn sie binnen sechs Monaten nach dem Tag, an dem die Eintragung der Verschmelzung in das Register des Sitzes desjenigen Rechtsträgers, dessen Gläubiger sie sind, nach § 19 Abs. 3 UmwG als bekannt gemacht gilt, ihren Anspruch nach Grund und Höhe in Textform anmelden, Sicherheit zu leisten, soweit sie nicht Befriedigung verlangen können. Dieses Recht steht den Gläubigern jedoch nur zu, wenn sie glaubhaft machen, dass durch die Verschmelzung die Erfüllung ihrer Forderung gefährdet wird."
    },
    {
      "date": "2025-04-15",
      "id": "106700",
      "original_text": "Registerbekanntmachung nach dem Umwandlungsgesetz\nBayern Amtsgericht Aschaffenburg HRB 9459\nPollmeier Aschaffenburg Verwaltungs GmbH – Aschaffenburg",
      "type": "Registerbekanntmachung nach dem Umwandlungsgesetz",
      "state": "Bayern",
      "amtsgericht": "Amtsgericht Aschaffenburg",
      "registernummer": "HRB 9459",
      "registerart": "HRB",
      "company_name": "Pollmeier Aschaffenburg Verwaltungs GmbH",
      "company_seat": "Aschaffenburg",
      "details": "15.04.2025 (Bekanntmachungsdatum)\n\nBayern Amtsgericht Aschaffenburg HRB 9459\nRegisterbekanntmachung nach dem Umwandlungsgesetz 15.04.2025 (Eintragungsdatum)\n\nPollmeier Aschaffenburg Verwaltungs GmbH\nGesellschaft mit beschränkter Haftung\nAschaffenburg\n\nDen Gläubigern der an der Verschmelzung beteiligten Rechtsträger ist, wenn sie binnen sechs Monaten nach dem Tag, an dem die Eintragung der Verschmelzung in das Register des Sitzes desjenigen Rechtsträgers, dessen Gläubiger sie sind, nach § 19 Abs. 3 UmwG als bekannt gemacht gilt, ihren Anspruch nach Grund und Höhe in Textform anmelden, Sicherheit zu leisten, soweit sie nicht Befriedigung verlangen können. Dieses Recht steht den Gläubigern jedoch nur zu, wenn sie glaubhaft machen, dass durch die Verschmelzung die Erfüllung ihrer Forderung gefährdet wird."
    },
    {
      "date": "2025-04-15",
      "id": "106701",
      "original_text": "Einreichung neuer Dokumente\nBayern Amtsgericht München HRB 234855\nDialog Versicherung Aktiengesellschaft – München",
      "type": "Einreichung neuer Dokumente",
      "state": "Bayern",
      "amtsgericht": "Amtsgericht München",
      "registernummer": "HRB 234855",
      "registerart": "HRB",
      "company_name": "Dialog Versicherung Aktiengesellschaft",
      "company_seat": "München",
      "details": "15.04.2025 (Bekanntmachungsdatum)\n\nBayern Amtsgericht München HRB 234855\nEinreichung neuer Dokumente 15.04.2025 (Eintragungsdatum)\n\nDialog Versicherung Aktiengesellschaft\nAktiengesellschaft\nMünchen\n\nDem Amtsgericht München -Registergericht- ist eine Liste der Mitglieder des Aufsichtsrats eingereicht worden, § 106 AktG."
    },
    {
      "date": "2025-04-15",
      "id": "106702",
      "original_text": "Registerbekanntmachung nach dem Umwandlungsgesetz\nBayern Amtsgericht München HRB 161462\nIngram Micro Holding GmbH – Aschheim",
      "type": "Registerbekanntmachung nach dem Umwandlungsgesetz",
      "state": "Bayern",
      "amtsgericht": "Amtsgericht München",
      "registernummer": "HRB 161462",
      "registerart": "HRB",
      "company_name": "Ingram Micro Holding GmbH",
      "company_seat": "Aschheim",
      "details": "15.04.2025 (Bekanntmachungsdatum)\n\nBayern Amtsgericht München HRB 161462\nRegisterbekanntmachung nach dem Umwandlungsgesetz 15.04.2025 (Eintragungsdatum)\n\nIngram Micro Holding GmbH\nGesellschaft mit beschränkter Haftung\nAschheim\n\nDen Gläubigern der an der Verschmelzung beteiligten Rechtsträger ist, wenn sie binnen sechs Monaten nach dem Tag, an dem die Eintragung der Verschmelzung in das Register des Sitzes desjenigen Rechtsträgers, dessen Gläubiger sie sind, nach § 19 Abs. 3 UmwG als bekannt gemacht gilt, ihren Anspruch nach Grund und Höhe in Textform anmelden, Sicherheit zu leisten, soweit sie nicht Befriedigung verlangen können. Dieses Recht steht den Gläubigern jedoch nur zu, wenn sie glaubhaft machen, dass durch die Verschmelzung die Erfüllung ihrer Forderung gefährdet wird."
    },
    {
      "date": "2025-04-15",
      "id": "106703",
      "original_text": "Registerbekanntmachung nach dem Umwandlungsgesetz\nBayern Amtsgericht Landshut HRB 13189\nFERR-I-NOX GmbH – Essenbach",
      "type": "Registerbekanntmachung nach dem Umwandlungsgesetz",
      "state": "Bayern",
      "amtsgericht": "Amtsgericht Landshut",
      "registernummer": "HRB 13189",
      "registerart": "HRB",
      "company_name": "FERR-I-NOX GmbH",
      "company_seat": "Essenbach",
      "details": "15.04.2025 (Bekanntmachungsdatum)\n\nBayern Amtsgericht Landshut HRB 13189\nRegisterbekanntmachung nach dem Umwandlungsgesetz 15.04.2025 (Eintragungsdatum)\n\nFERR-I-NOX GmbH\nGesellschaft mit beschränkter Haftung\nEssenbach\n\nDen Gläubigern der an der Verschmelzung beteiligten Rechtsträger ist, wenn sie binnen sechs Monaten nach dem Tag, an dem die Eintragung der Verschmelzung in das Register des Sitzes desjenigen Rechtsträgers, dessen Gläubiger sie sind, nach § 19 Abs. 3 UmwG als bekannt gemacht gilt, ihren Anspruch nach Grund und Höhe in Textform anmelden, Sicherheit zu leisten, soweit sie nicht Befriedigung verlangen können. Dieses Recht steht den Gläubigern jedoch nur zu, wenn sie glaubhaft machen, dass durch die Verschmelzung die Erfüllung ihrer Forderung gefährdet wird."
    },
    {
      "date": "2025-04-15",
      "id": "106704",
      "original_text": "Einreichung neuer Dokumente\nBayern Amtsgericht München HRB 231657\nRay Sono AG – München",
      "type": "Einreichung neuer Dokumente",
      "state": "Bayern",
      "amtsgericht": "Amtsgericht München",
      "registernummer": "HRB 231657",
      "registerart": "HRB",
      "company_name": "Ray Sono AG",
      "company_seat": "München",
      "details": "15.04.2025 (Bekanntmachungsdatum)\n\nBayern Amtsgericht München HRB 231657\nEinreichung neuer Dokumente\n\nRay Sono AG\nAktiengesellschaft\nMünchen\n\nDem Amtsgericht München -Registergericht- ist eine Liste der Mitglieder des Aufsichtsrats eingereicht worden, § 106 AktG."
    },
    {
      "date": "2025-04-15",
      "id": "106705",
      "original_text": "Löschungsankündigung\nBayern Amtsgericht Regensburg HRB 18548\nFZF Fleet Management GmbH – Neutraubling",
      "type": "Löschungsankündigung",
      "state": "Bayern",
      "amtsgericht": "Amtsgericht Regensburg",
      "registernummer": "HRB 18548",
      "registerart": "HRB",
      "company_name": "FZF Fleet Management GmbH",
      "company_seat": "Neutraubling",
      "details": "15.04.2025 (Bekanntmachungsdatum)\n\nBayern Amtsgericht Regensburg HRB 18548\nLöschungsankündigung 15.04.2025 (Eintragungsdatum)\n\nFZF Fleet Management GmbH\nGesellschaft mit beschränkter Haftung\nNeutraubling\n\nDas Registergericht beabsichtigt, die im Handelsregister eingetragene Gesellschaft wegen Vermögenslosigkeit von Amts wegen nach § 394 FamFG zu löschen. Die Frist zur Erhebung eines Widerspruchs ist auf einen Monat festgesetzt."
    },
    {
      "date": "2025-04-15",
      "id": "106706",
      "original_text": "Registerbekanntmachung nach dem Umwandlungsgesetz\nBayern Amtsgericht Aschaffenburg HRB 9459\nPollmeier Aschaffenburg Verwaltungs GmbH – Aschaffenburg",
      "type": "Registerbekanntmachung nach dem Umwandlungsgesetz",
      "state": "Bayern",
      "amtsgericht": "Amtsgericht Aschaffenburg",
      "registernummer": "HRB 9459",
      "registerart": "HRB",
      "company_name": "Pollmeier Aschaffenburg Verwaltungs GmbH",
      "company_seat": "Aschaffenburg",
      "details": "15.04.2025 (Bekanntmachungsdatum)\n\nBayern Amtsgericht Aschaffenburg HRB 9459\nRegisterbekanntmachung nach dem Umwandlungsgesetz 15.04.2025 (Eintragungsdatum)\n\nPollmeier Aschaffenburg Verwaltungs GmbH\nGesellschaft mit beschränkter Haftung\nAschaffenburg\n\nDen Gläubigern der an der Verschmelzung beteiligten Rechtsträger ist, wenn sie binnen sechs Monaten nach dem Tag, an dem die Eintragung der Verschmelzung in das Register des Sitzes desjenigen Rechtsträgers, dessen Gläubiger sie sind, nach § 19 Abs. 3 UmwG als bekannt gemacht gilt, ihren Anspruch nach Grund und Höhe in Textform anmelden, Sicherheit zu leisten, soweit sie nicht Befriedigung verlangen können. Dieses Recht steht den Gläubigern jedoch nur zu, wenn sie glaubhaft machen, dass durch die Verschmelzung die Erfüllung ihrer Forderung gefährdet wird."
    },
    {
      "date": "2025-04-15",
      "id": "106707",
      "original_text": "Einreichung neuer Dokumente\nBayern Amtsgericht München HRB 234919\nSyncier GmbH – München",
      "type": "Einreichung neuer Dokumente",
      "state": "Bayern",
      "amtsgericht": "Amtsgericht München",
      "registernummer": "HRB 234919",
      "registerart": "HRB",
      "company_name": "Syncier GmbH",
      "company_seat": "München",
      "details": "15.04.2025 (Bekanntmachungsdatum)\n\nBayern Amtsgericht München HRB 234919\nEinreichung neuer Dokumente 15.04.2025 (Eintragungsdatum)\n\nSyncier GmbH\nGesellschaft mit beschränkter Haftung\nMünchen\n\nDem Amtsgericht München -Registergericht- ist eine Liste der Mitglieder des Aufsichtsrats eingereicht worden, § 52 Abs. 3 S. 2 GmbHG."
    }
  ]
}