{
  "date": "2025-04-07",
  "date_of_scrape": "2025-05-30T11:55:53.835Z",
  "tool_version": "0.2.0",
  "number_of_announcements": 112,
  "announcements": [
    {
      "date": "2025-04-07",
      "id": "105780",
      "original_text": "Registerbekanntmachung nach dem Umwandlungsgesetz\nBerlin Amtsgericht Berlin (Charlottenburg) HRB 171599\nAsisi F & E GmbH – Berlin",
      "type": "Registerbekanntmachung nach dem Umwandlungsgesetz",
      "state": "Berlin",
      "amtsgericht": "Amtsgericht Berlin (Charlottenburg)",
      "registernummer": "HRB 171599",
      "registerart": "HRB",
      "company_name": "Asisi F & E GmbH",
      "company_seat": "Berlin",
      "details": "07.04.2025 (Bekanntmachungsdatum)\n\nBerlin Amtsgericht Berlin (Charlottenburg) HRB 171599\nRegisterbekanntmachung nach dem Umwandlungsgesetz 04.04.2025 (Eintragungsdatum)\n\nAsisi F & E GmbH\nGesellschaft mit beschränkter Haftung\nBerlin\n\nZu Eintragungsnummer 4 vom 04.04.2025 wird als nicht eingetragen veröffentlicht: Den Gläubigern der an der Verschmelzung beteiligten Rechtsträger ist, wenn sie binnen sechs Monaten nach dem Tag, an dem die Eintragung der Verschmelzung in das Register des Sitzes desjenigen Rechtsträgers, dessen Gläubiger sie sind, als bekannt gemacht gilt, ihren Anspruch nach Grund und Höhe schriftlich anmelden, Sicherheit zu leisten, soweit sie nicht Befriedigung verlangen können. Dieses Recht steht den Gläubigern jedoch nur zu, wenn sie glaubhaft machen, dass durch die Verschmelzung die Erfüllung ihrer Forderung gefährdet wird. Das Recht, Sicherheitsleistung zu verlangen, steht Gläubigern nicht zu, die im Falle der Insolvenz ein Recht auf vorzugsweise Befriedigung aus einer Deckungsmasse haben, die nach gesetzlicher Vorschrift zu ihrem Schutz errichtet und staatlich überwacht ist."
    },
    {
      "date": "2025-04-07",
      "id": "105781",
      "original_text": "Registerbekanntmachung nach dem Umwandlungsgesetz\nBerlin Amtsgericht Berlin (Charlottenburg) HRB 143136\nAsisi Panorama International GmbH – Berlin",
      "type": "Registerbekanntmachung nach dem Umwandlungsgesetz",
      "state": "Berlin",
      "amtsgericht": "Amtsgericht Berlin (Charlottenburg)",
      "registernummer": "HRB 143136",
      "registerart": "HRB",
      "company_name": "Asisi Panorama International GmbH",
      "company_seat": "Berlin",
      "details": "07.04.2025 (Bekanntmachungsdatum)\n\nBerlin Amtsgericht Berlin (Charlottenburg) HRB 143136\nRegisterbekanntmachung nach dem Umwandlungsgesetz 04.04.2025 (Eintragungsdatum)\n\nAsisi Panorama International GmbH\nGesellschaft mit beschränkter Haftung\nBerlin\n\nZu Eintragungsnummer 7 vom 04.04.2025 wird als nicht eingetragen veröffentlicht: Den Gläubigern der an der Verschmelzung beteiligten Rechtsträger ist, wenn sie binnen sechs Monaten nach dem Tag, an dem die Eintragung der Verschmelzung in das Register des Sitzes desjenigen Rechtsträgers, dessen Gläubiger sie sind, als bekannt gemacht gilt, ihren Anspruch nach Grund und Höhe schriftlich anmelden, Sicherheit zu leisten, soweit sie nicht Befriedigung verlangen können. Dieses Recht steht den Gläubigern jedoch nur zu, wenn sie glaubhaft machen, dass durch die Verschmelzung die Erfüllung ihrer Forderung gefährdet wird. Das Recht, Sicherheitsleistung zu verlangen, steht Gläubigern nicht zu, die im Falle der Insolvenz ein Recht auf vorzugsweise Befriedigung aus einer Deckungsmasse haben, die nach gesetzlicher Vorschrift zu ihrem Schutz errichtet und staatlich überwacht ist."
    },
    {
      "date": "2025-04-07",
      "id": "105782",
      "original_text": "Registerbekanntmachung nach dem Umwandlungsgesetz\nBaden-Württemberg Amtsgericht Stuttgart HRB 795763\nDeep Blue Solar GmbH – Stuttgart",
      "type": "Registerbekanntmachung nach dem Umwandlungsgesetz",
      "state": "Baden-Württemberg",
      "amtsgericht": "Amtsgericht Stuttgart",
      "registernummer": "HRB 795763",
      "registerart": "HRB",
      "company_name": "Deep Blue Solar GmbH",
      "company_seat": "Stuttgart",
      "details": "07.04.2025 (Bekanntmachungsdatum)\n\nBaden-Württemberg Amtsgericht Stuttgart HRB 795763\nRegisterbekanntmachung nach dem Umwandlungsgesetz 07.04.2025 (Eintragungsdatum)\n\nDeep Blue Solar GmbH\nGesellschaft mit beschränkter Haftung\nStuttgart\n\nDen Gläubigern der an der Verschmelzung beteiligten Rechtsträger ist, wenn sie binnen sechs Monaten nach dem Tag, an dem die Eintragung der Verschmelzung in das Register des Sitzes desjenigen Rechtsträgers, dessen Gläubiger sie sind, nach § 19 Abs. 3 UmwG als bekanntgemacht gilt, ihren Anspruch nach Grund und Höhe schriftlich anmelden, Sicherheit zu leisten, soweit sie nicht Befriedigung verlangen können. Dieses Recht steht den Gläubigern jedoch nur zu, wenn sie glaubhaft machen, dass durch die Verschmelzung die Erfüllung ihrer Forderung gefährdet wird."
    },
    {
      "date": "2025-04-07",
      "id": "105783",
      "original_text": "Einreichung neuer Dokumente\nBaden-Württemberg Amtsgericht Ulm HRB 737231\nJ.M. Voith Management SE – Heidenheim an der Brenz",
      "type": "Einreichung neuer Dokumente",
      "state": "Baden-Württemberg",
      "amtsgericht": "Amtsgericht Ulm",
      "registernummer": "HRB 737231",
      "registerart": "HRB",
      "company_name": "J.M. Voith Management SE",
      "company_seat": "Heidenheim an der Brenz",
      "details": "07.04.2025 (Bekanntmachungsdatum)\n\nBaden-Württemberg Amtsgericht Ulm HRB 737231\nEinreichung neuer Dokumente\n\nJ.M. Voith Management SE\nEuropäische Aktiengesellschaft (SE)\nHeidenheim an der Brenz\n\nDie Gesellschaft hat am 03.04.2025 die Liste über die Zusammensetzung des Aufsichtsrats zum Handelsregister eingereicht."
    },
    {
      "date": "2025-04-07",
      "id": "105784",
      "original_text": "Sonstige Registerbekanntmachung\nSachsen-Anhalt Amtsgericht Stendal HRB 200416\nHAMESTA Hallesche Metall- und Stahlbau Gesellschaft mit beschränkter Haftung – Halle",
      "type": "Sonstige Registerbekanntmachung",
      "state": "Sachsen-Anhalt",
      "amtsgericht": "Amtsgericht Stendal",
      "registernummer": "HRB 200416",
      "registerart": "HRB",
      "company_name": "HAMESTA Hallesche Metall- und Stahlbau Gesellschaft mit beschränkter Haftung",
      "company_seat": "Halle",
      "details": "07.04.2025 (Bekanntmachungsdatum)\n\nSachsen-Anhalt Amtsgericht Stendal HRB 200416\nSonstige Registerbekanntmachung\n\nHAMESTA Hallesche Metall- und Stahlbau Gesellschaft mit beschränkter Haftung\nGesellschaft mit beschränkter Haftung\nHalle\n\nHinsichtlich o.g. Gesellschaft ist beabsichtigt, Rechtsanwalt Lars Rühmland, Magdeburg, zum Nachtragsliquidator zu bestellen. Die Frist zu Einreichung etwaiger Stellungnahmen bzw. Erhebung eines Widerspruchs beim Amtsgericht Stendal wird auf 1 Monat festgesetzt."
    },
    {
      "date": "2025-04-07",
      "id": "105785",
      "original_text": "Registerbekanntmachung nach dem Umwandlungsgesetz\nBerlin Amtsgericht Berlin (Charlottenburg) HRB 206166\nThe DO GmbH – Berlin",
      "type": "Registerbekanntmachung nach dem Umwandlungsgesetz",
      "state": "Berlin",
      "amtsgericht": "Amtsgericht Berlin (Charlottenburg)",
      "registernummer": "HRB 206166",
      "registerart": "HRB",
      "company_name": "The DO GmbH",
      "company_seat": "Berlin",
      "details": "07.04.2025 (Bekanntmachungsdatum)\n\nBerlin Amtsgericht Berlin (Charlottenburg) HRB 206166\nRegisterbekanntmachung nach dem Umwandlungsgesetz 03.04.2025 (Eintragungsdatum)\n\nThe DO GmbH\nGesellschaft mit beschränkter Haftung\nBerlin\n\nZu Eintragungsnummer 3 vom 03.04.2025 wird als nicht eingetragen veröffentlicht: Den Gläubigern der an der Verschmelzung beteiligten Rechtsträger ist, wenn sie binnen sechs Monaten nach dem Tag, an dem die Eintragung der Verschmelzung in das Register des Sitzes desjenigen Rechtsträgers, dessen Gläubiger sie sind, als bekannt gemacht gilt, ihren Anspruch nach Grund und Höhe schriftlich anmelden, Sicherheit zu leisten, soweit sie nicht Befriedigung verlangen können. Dieses Recht steht den Gläubigern jedoch nur zu, wenn sie glaubhaft machen, dass durch die Verschmelzung die Erfüllung ihrer Forderung gefährdet wird. Das Recht, Sicherheitsleistung zu verlangen, steht Gläubigern nicht zu, die im Falle der Insolvenz ein Recht auf vorzugsweise Befriedigung aus einer Deckungsmasse haben, die nach gesetzlicher Vorschrift zu ihrem Schutz errichtet und staatlich überwacht ist."
    },
    {
      "date": "2025-04-07",
      "id": "105786",
      "original_text": "Registerbekanntmachung nach dem Umwandlungsgesetz\nBerlin Amtsgericht Berlin (Charlottenburg) HRB 245924\nDream Local GmbH – Berlin",
      "type": "Registerbekanntmachung nach dem Umwandlungsgesetz",
      "state": "Berlin",
      "amtsgericht": "Amtsgericht Berlin (Charlottenburg)",
      "registernummer": "HRB 245924",
      "registerart": "HRB",
      "company_name": "Dream Local GmbH",
      "company_seat": "Berlin",
      "details": "07.04.2025 (Bekanntmachungsdatum)\n\nBerlin Amtsgericht Berlin (Charlottenburg) HRB 245924\nRegisterbekanntmachung nach dem Umwandlungsgesetz 03.04.2025 (Eintragungsdatum)\n\nDream Local GmbH\nGesellschaft mit beschränkter Haftung\nBerlin\n\nZu Eintragungsnummer 2 vom 03.04.2025 wird als nicht eingetragen veröffentlicht: Den Gläubigern der an der Verschmelzung beteiligten Rechtsträger ist, wenn sie binnen sechs Monaten nach dem Tag, an dem die Eintragung der Verschmelzung in das Register des Sitzes desjenigen Rechtsträgers, dessen Gläubiger sie sind, als bekannt gemacht gilt, ihren Anspruch nach Grund und Höhe schriftlich anmelden, Sicherheit zu leisten, soweit sie nicht Befriedigung verlangen können. Dieses Recht steht den Gläubigern jedoch nur zu, wenn sie glaubhaft machen, dass durch die Verschmelzung die Erfüllung ihrer Forderung gefährdet wird. Das Recht, Sicherheitsleistung zu verlangen, steht Gläubigern nicht zu, die im Falle der Insolvenz ein Recht auf vorzugsweise Befriedigung aus einer Deckungsmasse haben, die nach gesetzlicher Vorschrift zu ihrem Schutz errichtet und staatlich überwacht ist."
    },
    {
      "date": "2025-04-07",
      "id": "105787",
      "original_text": "Registerbekanntmachung nach dem Umwandlungsgesetz\nBaden-Württemberg Amtsgericht Stuttgart HRB 730216\nW+P Consulting GmbH – Stuttgart",
      "type": "Registerbekanntmachung nach dem Umwandlungsgesetz",
      "state": "Baden-Württemberg",
      "amtsgericht": "Amtsgericht Stuttgart",
      "registernummer": "HRB 730216",
      "registerart": "HRB",
      "company_name": "W+P Consulting GmbH",
      "company_seat": "Stuttgart",
      "details": "07.04.2025 (Bekanntmachungsdatum)\n\nBaden-Württemberg Amtsgericht Stuttgart HRB 730216\nRegisterbekanntmachung nach dem Umwandlungsgesetz 07.04.2025 (Eintragungsdatum)\n\nW+P Consulting GmbH\nGesellschaft mit beschränkter Haftung\nStuttgart\n\nAls nicht eingetragen wird bekanntgemacht:\nDen Gläubigern der an der Verschmelzung beteiligten Rechtsträger ist, wenn sie binnen sechs Monaten nach dem Tag, an dem die Eintragung der Verschmelzung in das Register des Sitzes desjenigen Rechtsträgers, dessen Gläubiger sie sind, nach § 19 Abs. 3 UmwG als bekanntgemacht gilt, ihren Anspruch nach Grund und Höhe schriftlich anmelden, Sicherheit zu leisten, soweit sie nicht Befriedigung verlangen können. Dieses Recht steht den Gläubigern jedoch nur zu, wenn sie glaubhaft machen, dass durch die Verschmelzung die Erfüllung ihrer Forderung gefährdet wird."
    },
    {
      "date": "2025-04-07",
      "id": "105788",
      "original_text": "Löschungsankündigung\nSchleswig-Holstein Amtsgericht Lübeck HRB 5651\nK.B. Hanseatic Export GmbH – Lübeck",
      "type": "Löschungsankündigung",
      "state": "Schleswig-Holstein",
      "amtsgericht": "Amtsgericht Lübeck",
      "registernummer": "HRB 5651",
      "registerart": "HRB",
      "company_name": "K.B. Hanseatic Export GmbH",
      "company_seat": "Lübeck",
      "details": "07.04.2025 (Bekanntmachungsdatum)\n\nSchleswig-Holstein Amtsgericht Lübeck HRB 5651\nLöschungsankündigung\n\nK.B. Hanseatic Export GmbH\nGesellschaft mit beschränkter Haftung\nLübeck\n\nEs ist die Löschung der nachstehenden Gesellschaft wegen Vermögenslosigkeit gemäß § 394 FamFG beabsichtigt. Widerspruchsfrist: 1 Monat"
    },
    {
      "date": "2025-04-07",
      "id": "105789",
      "original_text": "Löschungsankündigung\nBaden-Württemberg Amtsgericht Freiburg HRA 703987\nOmniservice Solutions GmbH & Co. KG – Lörrach",
      "type": "Löschungsankündigung",
      "state": "Baden-Württemberg",
      "amtsgericht": "Amtsgericht Freiburg",
      "registernummer": "HRA 703987",
      "registerart": "HRA",
      "company_name": "Omniservice Solutions GmbH & Co. KG",
      "company_seat": "Lörrach",
      "details": "07.04.2025 (Bekanntmachungsdatum)\n\nBaden-Württemberg Amtsgericht Freiburg HRA 703987\nLöschungsankündigung\n\nOmniservice Solutions GmbH & Co. KG\nKommanditgesellschaft\nLörrach\n\nAls nicht eingetragen wird bekanntgemacht:\nDas Gericht beabsichtigt, die Gesellschaft wegen Vermögenslosigkeit im Handelsregister von Amts wegen nach § 394 FamFG zu löschen. Die Frist zur Geltendmachung eines Widerspruchs gegen die beabsichtigte Löschung ist auf einen Monat ab Veröffentlichung bestimmt."
    },
    {
      "date": "2025-04-07",
      "id": "105790",
      "original_text": "Sonstige Registerbekanntmachung\nHamburg Amtsgericht Hamburg HRB 154214\nPortal Systems AG – Hamburg",
      "type": "Sonstige Registerbekanntmachung",
      "state": "Hamburg",
      "amtsgericht": "Amtsgericht Hamburg",
      "registernummer": "HRB 154214",
      "registerart": "HRB",
      "company_name": "Portal Systems AG",
      "company_seat": "Hamburg",
      "details": "07.04.2025 (Bekanntmachungsdatum)\n\nHamburg Amtsgericht Hamburg HRB 154214\nSonstige Registerbekanntmachung 01.04.2025 (Eintragungsdatum)\n\nPortal Systems AG\nAktiengesellschaft\nHamburg\n\nAls nicht eingetragen wird bekannt gemacht: Liste des Aufsichtsrats wurde eingereicht."
    },
    {
      "date": "2025-04-07",
      "id": "105791",
      "original_text": "Sonstige Registerbekanntmachung\nHamburg Amtsgericht Hamburg HRB 36936\nOtto M. Schröder Bank Aktiengesellschaft – Hamburg",
      "type": "Sonstige Registerbekanntmachung",
      "state": "Hamburg",
      "amtsgericht": "Amtsgericht Hamburg",
      "registernummer": "HRB 36936",
      "registerart": "HRB",
      "company_name": "Otto M. Schröder Bank Aktiengesellschaft",
      "company_seat": "Hamburg",
      "details": "07.04.2025 (Bekanntmachungsdatum)\n\nHamburg Amtsgericht Hamburg HRB 36936\nSonstige Registerbekanntmachung\n\nOtto M. Schröder Bank Aktiengesellschaft\nAktiengesellschaft\nHamburg\n\nAls nicht eingetragen wird bekannt gemacht: Liste des Aufsichtsrats wurde eingereicht."
    },
    {
      "date": "2025-04-07",
      "id": "105792",
      "original_text": "Registerbekanntmachung nach dem Umwandlungsgesetz\nBaden-Württemberg Amtsgericht Freiburg HRB 705009\nRaum Concept Immobilien GmbH – Freiburg im Breisgau",
      "type": "Registerbekanntmachung nach dem Umwandlungsgesetz",
      "state": "Baden-Württemberg",
      "amtsgericht": "Amtsgericht Freiburg",
      "registernummer": "HRB 705009",
      "registerart": "HRB",
      "company_name": "Raum Concept Immobilien GmbH",
      "company_seat": "Freiburg im Breisgau",
      "details": "07.04.2025 (Bekanntmachungsdatum)\n\nBaden-Württemberg Amtsgericht Freiburg HRB 705009\nRegisterbekanntmachung nach dem Umwandlungsgesetz 07.04.2025 (Eintragungsdatum)\n\nRaum Concept Immobilien GmbH\nGesellschaft mit beschränkter Haftung\nFreiburg im Breisgau\n\nDen Gläubigern der an der Verschmelzung beteiligten Rechtsträger ist, wenn sie binnen sechs Monaten nach dem Tag, an dem die Eintragung der Verschmelzung in das Register des Sitzes desjenigen Rechtsträgers, dessen Gläubiger sie sind, nach § 19 Abs. 3 UmwG als bekanntgemacht gilt, ihren Anspruch nach Grund und Höhe schriftlich anmelden, Sicherheit zu leisten, soweit sie nicht Befriedigung verlangen können. Dieses Recht steht den Gläubigern jedoch nur zu, wenn sie glaubhaft machen, dass durch die Verschmelzung die Erfüllung ihrer Forderung gefährdet wird."
    },
    {
      "date": "2025-04-07",
      "id": "105793",
      "original_text": "Registerbekanntmachung nach dem Umwandlungsgesetz\nBaden-Württemberg Amtsgericht Mannheim HRB 739644\nBohlini invest GmbH – Heidelberg",
      "type": "Registerbekanntmachung nach dem Umwandlungsgesetz",
      "state": "Baden-Württemberg",
      "amtsgericht": "Amtsgericht Mannheim",
      "registernummer": "HRB 739644",
      "registerart": "HRB",
      "company_name": "Bohlini invest GmbH",
      "company_seat": "Heidelberg",
      "details": "07.04.2025 (Bekanntmachungsdatum)\n\nBaden-Württemberg Amtsgericht Mannheim HRB 739644\nRegisterbekanntmachung nach dem Umwandlungsgesetz 07.04.2025 (Eintragungsdatum)\n\nBohlini invest GmbH\nGesellschaft mit beschränkter Haftung\nHeidelberg\n\nDen Gläubigern der an der Verschmelzung beteiligten Rechtsträger ist, wenn sie binnen sechs Monaten nach dem Tag, an dem die Eintragung der Verschmelzung in das Register des Sitzes desjenigen Rechtsträgers, dessen Gläubiger sie sind, nach § 19 Abs. 3 UmwG als bekanntgemacht gilt, ihren Anspruch nach Grund und Höhe schriftlich anmelden, Sicherheit zu leisten, soweit sie nicht Befriedigung verlangen können. Dieses Recht steht den Gläubigern jedoch nur zu, wenn sie glaubhaft machen, dass durch die Verschmelzung die Erfüllung ihrer Forderung gefährdet wird."
    },
    {
      "date": "2025-04-07",
      "id": "105794",
      "original_text": "Registerbekanntmachung nach dem Umwandlungsgesetz\nBaden-Württemberg Amtsgericht Mannheim HRA 333266\nBohlini GmbH & Co. KG – Heidelberg",
      "type": "Registerbekanntmachung nach dem Umwandlungsgesetz",
      "state": "Baden-Württemberg",
      "amtsgericht": "Amtsgericht Mannheim",
      "registernummer": "HRA 333266",
      "registerart": "HRA",
      "company_name": "Bohlini GmbH & Co. KG",
      "company_seat": "Heidelberg",
      "details": "07.04.2025 (Bekanntmachungsdatum)\n\nBaden-Württemberg Amtsgericht Mannheim HRA 333266\nRegisterbekanntmachung nach dem Umwandlungsgesetz 07.04.2025 (Eintragungsdatum)\n\nBohlini GmbH & Co. KG\nKommanditgesellschaft\nHeidelberg\n\nAls nicht eingetragen wird bekanntgemacht:\nDen Gläubigern der an der Verschmelzung beteiligten Rechtsträger ist, wenn sie binnen sechs Monaten nach dem Tag, an dem die Eintragung der Verschmelzung in das Register des Sitzes desjenigen Rechtsträgers, dessen Gläubiger sie sind, nach § 19 Abs. 3 UmwG als bekanntgemacht gilt, ihren Anspruch nach Grund und Höhe schriftlich anmelden, Sicherheit zu leisten, soweit sie nicht Befriedigung verlangen können. Dieses Recht steht den Gläubigern jedoch nur zu, wenn sie glaubhaft machen, dass durch die Verschmelzung die Erfüllung ihrer Forderung gefährdet wird."
    },
    {
      "date": "2025-04-07",
      "id": "105795",
      "original_text": "Registerbekanntmachung nach dem Umwandlungsgesetz\nHamburg Amtsgericht Hamburg HRA 131361\nFahrschule Ralf Baumgarten e.K. – Hamburg",
      "type": "Registerbekanntmachung nach dem Umwandlungsgesetz",
      "state": "Hamburg",
      "amtsgericht": "Amtsgericht Hamburg",
      "registernummer": "HRA 131361",
      "registerart": "HRA",
      "company_name": "Fahrschule Ralf Baumgarten e.K.",
      "company_seat": "Hamburg",
      "details": "07.04.2025 (Bekanntmachungsdatum)\n\nHamburg Amtsgericht Hamburg HRA 131361\nRegisterbekanntmachung nach dem Umwandlungsgesetz 07.04.2025 (Eintragungsdatum)\n\nFahrschule Ralf Baumgarten e.K.\nEinzelkaufmann\nHamburg\n\nAls nicht eingetragen wird bekannt gemacht:\nDen Gläubigern der an der Ausgliederung beteiligten Gesellschaften ist, wenn sie binnen sechs Monaten nach dem Tag, an dem die Eintragung der Ausgliederung in das Register des Sitzes desjenigen Rechtsträgers, dessen Gläubiger sie sind, nach § 19 Absatz 3 UmwG als bekannt gemacht gilt, ihren Anspruch nach Grund und Höhe schriftlich anmelden, Sicherheit zu leisten, soweit sie nicht Befriedigung verlangen können. Dieses Recht steht den Gläubigern jedoch nur zu, wenn sie glaubhaft machen, dass durch die Ausgliederung die Erfüllung ihrer Forderung gefährdet wird."
    },
    {
      "date": "2025-04-07",
      "id": "105796",
      "original_text": "Einreichung neuer Dokumente\nBaden-Württemberg Amtsgericht Mannheim HRB 232403\nGrundstücksgesellschaft der Sparkasse Kraichgau mbH – Bruchsal",
      "type": "Einreichung neuer Dokumente",
      "state": "Baden-Württemberg",
      "amtsgericht": "Amtsgericht Mannheim",
      "registernummer": "HRB 232403",
      "registerart": "HRB",
      "company_name": "Grundstücksgesellschaft der Sparkasse Kraichgau mbH",
      "company_seat": "Bruchsal",
      "details": "07.04.2025 (Bekanntmachungsdatum)\n\nBaden-Württemberg Amtsgericht Mannheim HRB 232403\nEinreichung neuer Dokumente 07.04.2025 (Eintragungsdatum)\n\nGrundstücksgesellschaft der Sparkasse Kraichgau mbH\nGesellschaft mit beschränkter Haftung\nBruchsal\n\nDie Gesellschaft hat am 02.04.2025 die Liste über die Zusammensetzung des Aufsichtsrats zum Handelsregister eingereicht."
    },
    {
      "date": "2025-04-07",
      "id": "105797",
      "original_text": "Registerbekanntmachung nach dem Umwandlungsgesetz\nHamburg Amtsgericht Hamburg HRA 131540\nFahrschule Baumgarten GmbH & Co. KG – Hamburg",
      "type": "Registerbekanntmachung nach dem Umwandlungsgesetz",
      "state": "Hamburg",
      "amtsgericht": "Amtsgericht Hamburg",
      "registernummer": "HRA 131540",
      "registerart": "HRA",
      "company_name": "Fahrschule Baumgarten GmbH & Co. KG",
      "company_seat": "Hamburg",
      "details": "07.04.2025 (Bekanntmachungsdatum)\n\nHamburg Amtsgericht Hamburg HRA 131540\nRegisterbekanntmachung nach dem Umwandlungsgesetz 07.04.2025 (Eintragungsdatum)\n\nFahrschule Baumgarten GmbH & Co. KG\nKommanditgesellschaft\nHamburg\n\nAls nicht eingetragen wird bekannt gemacht:\nDen Gläubigern der an der Ausgliederung beteiligten Gesellschaften ist, wenn sie binnen sechs Monaten nach dem Tag, an dem die Eintragung der Ausgliederung in das Register des Sitzes desjenigen Rechtsträgers, dessen Gläubiger sie sind, nach § 19 Absatz 3 UmwG als bekannt gemacht gilt, ihren Anspruch nach Grund und Höhe schriftlich anmelden, Sicherheit zu leisten, soweit sie nicht Befriedigung verlangen können. Dieses Recht steht den Gläubigern jedoch nur zu, wenn sie glaubhaft machen, dass durch die Ausgliederung die Erfüllung ihrer Forderung gefährdet wird."
    },
    {
      "date": "2025-04-07",
      "id": "105798",
      "original_text": "Registerbekanntmachung nach dem Umwandlungsgesetz\nHamburg Amtsgericht Hamburg HRB 184573\nKharvest UG (haftungsbeschränkt) – Hamburg",
      "type": "Registerbekanntmachung nach dem Umwandlungsgesetz",
      "state": "Hamburg",
      "amtsgericht": "Amtsgericht Hamburg",
      "registernummer": "HRB 184573",
      "registerart": "HRB",
      "company_name": "Kharvest UG (haftungsbeschränkt)",
      "company_seat": "Hamburg",
      "details": "07.04.2025 (Bekanntmachungsdatum)\n\nHamburg Amtsgericht Hamburg HRB 184573\nRegisterbekanntmachung nach dem Umwandlungsgesetz 07.04.2025 (Eintragungsdatum)\n\nKharvest UG (haftungsbeschränkt)\nGesellschaft mit beschränkter Haftung\nHamburg\n\nAls nicht eingetragen wird bekannt gemacht:\nDen Gläubigern der an der Verschmelzung beteiligten Gesellschaften ist, wenn sie binnen sechs Monaten nach dem Tag, an dem die Eintragung der Verschmelzung in das Register des Sitzes desjenigen Rechtsträgers, dessen Gläubiger sie sind, nach § 19 Absatz 3 UmwG als bekannt gemacht gilt, ihren Anspruch nach Grund und Höhe schriftlich anmelden, Sicherheit zu leisten, soweit sie nicht Befriedigung verlangen können. Dieses Recht steht den Gläubigern jedoch nur zu, wenn sie glaubhaft machen, dass durch die Verschmelzung die Erfüllung ihrer Forderung gefährdet wird."
    },
    {
      "date": "2025-04-07",
      "id": "105799",
      "original_text": "Registerbekanntmachung nach dem Umwandlungsgesetz\nHamburg Amtsgericht Hamburg HRB 136951\nFinTech Studio GmbH – Hamburg",
      "type": "Registerbekanntmachung nach dem Umwandlungsgesetz",
      "state": "Hamburg",
      "amtsgericht": "Amtsgericht Hamburg",
      "registernummer": "HRB 136951",
      "registerart": "HRB",
      "company_name": "FinTech Studio GmbH",
      "company_seat": "Hamburg",
      "details": "07.04.2025 (Bekanntmachungsdatum)\n\nHamburg Amtsgericht Hamburg HRB 136951\nRegisterbekanntmachung nach dem Umwandlungsgesetz 07.04.2025 (Eintragungsdatum)\n\nFinTech Studio GmbH\nGesellschaft mit beschränkter Haftung\nHamburg\n\nAls nicht eingetragen wird bekannt gemacht:\nDen Gläubigern der an der Verschmelzung beteiligten Gesellschaften ist, wenn sie binnen sechs Monaten nach dem Tag, an dem die Eintragung der Verschmelzung in das Register des Sitzes desjenigen Rechtsträgers, dessen Gläubiger sie sind, nach § 19 Absatz 3 UmwG als bekannt gemacht gilt, ihren Anspruch nach Grund und Höhe schriftlich anmelden, Sicherheit zu leisten, soweit sie nicht Befriedigung verlangen können. Dieses Recht steht den Gläubigern jedoch nur zu, wenn sie glaubhaft machen, dass durch die Verschmelzung die Erfüllung ihrer Forderung gefährdet wird."
    },
    {
      "date": "2025-04-07",
      "id": "105800",
      "original_text": "Löschungsankündigung\nBerlin Amtsgericht Berlin (Charlottenburg) HRB 240862\nGründerbaum B22-PA290 UG (haftungsbeschränkt) – Berlin",
      "type": "Löschungsankündigung",
      "state": "Berlin",
      "amtsgericht": "Amtsgericht Berlin (Charlottenburg)",
      "registernummer": "HRB 240862",
      "registerart": "HRB",
      "company_name": "Gründerbaum B22-PA290 UG (haftungsbeschränkt)",
      "company_seat": "Berlin",
      "details": "07.04.2025 (Bekanntmachungsdatum)\n\nBerlin Amtsgericht Berlin (Charlottenburg) HRB 240862\nLöschungsankündigung\n\nGründerbaum B22-PA290 UG (haftungsbeschränkt)\nGesellschaft mit beschränkter Haftung\nBerlin\n\nBei der nachstehenden Gesellschaft wird das Amtslöschungsverfahren gemäß § 394 FamFG eingeleitet. Widerspruchsfrist 6 Wochen"
    },
    {
      "date": "2025-04-07",
      "id": "105801",
      "original_text": "Registerbekanntmachung nach dem Umwandlungsgesetz\nBaden-Württemberg Amtsgericht Stuttgart HRA 390322\nLetzgus OHG – Rottenburg am Neckar",
      "type": "Registerbekanntmachung nach dem Umwandlungsgesetz",
      "state": "Baden-Württemberg",
      "amtsgericht": "Amtsgericht Stuttgart",
      "registernummer": "HRA 390322",
      "registerart": "HRA",
      "company_name": "Letzgus OHG",
      "company_seat": "Rottenburg am Neckar",
      "details": "07.04.2025 (Bekanntmachungsdatum)\n\nBaden-Württemberg Amtsgericht Stuttgart HRA 390322\nRegisterbekanntmachung nach dem Umwandlungsgesetz 07.04.2025 (Eintragungsdatum)\n\nLetzgus OHG\nOffene Handelsgesellschaft\nRottenburg am Neckar\n\nDen Gläubigern der an der Verschmelzung beteiligten Rechtsträger ist, wenn sie binnen sechs Monaten nach dem Tag, an dem die Eintragung der Verschmelzung in das Register des Sitzes desjenigen Rechtsträgers, dessen Gläubiger sie sind, nach § 19 Abs. 3 UmwG als bekanntgemacht gilt, ihren Anspruch nach Grund und Höhe schriftlich anmelden, Sicherheit zu leisten, soweit sie nicht Befriedigung verlangen können. Dieses Recht steht den Gläubigern jedoch nur zu, wenn sie glaubhaft machen, dass durch die Verschmelzung die Erfüllung ihrer Forderung gefährdet wird."
    },
    {
      "date": "2025-04-07",
      "id": "105802",
      "original_text": "Einreichung neuer Dokumente\nBaden-Württemberg Amtsgericht Freiburg HRB 703073\nJobRad GmbH – Freiburg im Breisgau",
      "type": "Einreichung neuer Dokumente",
      "state": "Baden-Württemberg",
      "amtsgericht": "Amtsgericht Freiburg",
      "registernummer": "HRB 703073",
      "registerart": "HRB",
      "company_name": "JobRad GmbH",
      "company_seat": "Freiburg im Breisgau",
      "details": "07.04.2025 (Bekanntmachungsdatum)\n\nBaden-Württemberg Amtsgericht Freiburg HRB 703073\nEinreichung neuer Dokumente\n\nJobRad GmbH\nGesellschaft mit beschränkter Haftung\nFreiburg im Breisgau\n\nDie Gesellschaft hat am 02.04.2025 die Liste über die Zusammensetzung des Aufsichtsrats zum Handelsregister eingereicht."
    },
    {
      "date": "2025-04-07",
      "id": "105803",
      "original_text": "Registerbekanntmachung nach dem Umwandlungsgesetz\nHamburg Amtsgericht Hamburg HRB 188632\nZEABORN Shipping Verwaltungs GmbH – Hamburg",
      "type": "Registerbekanntmachung nach dem Umwandlungsgesetz",
      "state": "Hamburg",
      "amtsgericht": "Amtsgericht Hamburg",
      "registernummer": "HRB 188632",
      "registerart": "HRB",
      "company_name": "ZEABORN Shipping Verwaltungs GmbH",
      "company_seat": "Hamburg",
      "details": "07.04.2025 (Bekanntmachungsdatum)\n\nHamburg Amtsgericht Hamburg HRB 188632\nRegisterbekanntmachung nach dem Umwandlungsgesetz 07.04.2025 (Eintragungsdatum)\n\nZEABORN Shipping Verwaltungs GmbH\nGesellschaft mit beschränkter Haftung\nHamburg\n\nAls nicht eingetragen wird bekannt gemacht:\nDen Gläubigern der an der Verschmelzung beteiligten Gesellschaften ist, wenn sie binnen sechs Monaten nach dem Tag, an dem die Eintragung der Verschmelzung in das Register des Sitzes desjenigen Rechtsträgers, dessen Gläubiger sie sind, nach § 19 Absatz 3 UmwG als bekannt gemacht gilt, ihren Anspruch nach Grund und Höhe schriftlich anmelden, Sicherheit zu leisten, soweit sie nicht Befriedigung verlangen können. Dieses Recht steht den Gläubigern jedoch nur zu, wenn sie glaubhaft machen, dass durch die Verschmelzung die Erfüllung ihrer Forderung gefährdet wird."
    },
    {
      "date": "2025-04-07",
      "id": "105804",
      "original_text": "Registerbekanntmachung nach dem Umwandlungsgesetz\nHamburg Amtsgericht Hamburg HRB 82510\nVerwaltung ZEABORN Ship Management (Hamburg) GmbH – Hamburg",
      "type": "Registerbekanntmachung nach dem Umwandlungsgesetz",
      "state": "Hamburg",
      "amtsgericht": "Amtsgericht Hamburg",
      "registernummer": "HRB 82510",
      "registerart": "HRB",
      "company_name": "Verwaltung ZEABORN Ship Management (Hamburg) GmbH",
      "company_seat": "Hamburg",
      "details": "07.04.2025 (Bekanntmachungsdatum)\n\nHamburg Amtsgericht Hamburg HRB 82510\nRegisterbekanntmachung nach dem Umwandlungsgesetz 07.04.2025 (Eintragungsdatum)\n\nVerwaltung ZEABORN Ship Management (Hamburg) GmbH\nGesellschaft mit beschränkter Haftung\nHamburg\n\nAls nicht eingetragen wird bekannt gemacht:\nDen Gläubigern der an der Verschmelzung beteiligten Gesellschaften ist, wenn sie binnen sechs Monaten nach dem Tag, an dem die Eintragung der Verschmelzung in das Register des Sitzes desjenigen Rechtsträgers, dessen Gläubiger sie sind, nach § 19 Absatz 3 UmwG als bekannt gemacht gilt, ihren Anspruch nach Grund und Höhe schriftlich anmelden, Sicherheit zu leisten, soweit sie nicht Befriedigung verlangen können. Dieses Recht steht den Gläubigern jedoch nur zu, wenn sie glaubhaft machen, dass durch die Verschmelzung die Erfüllung ihrer Forderung gefährdet wird."
    },
    {
      "date": "2025-04-07",
      "id": "105805",
      "original_text": "Registerbekanntmachung nach dem Umwandlungsgesetz\nBaden-Württemberg Amtsgericht Freiburg HRB 732509\nDie Eismanufaktur GmbH – Kirchzarten",
      "type": "Registerbekanntmachung nach dem Umwandlungsgesetz",
      "state": "Baden-Württemberg",
      "amtsgericht": "Amtsgericht Freiburg",
      "registernummer": "HRB 732509",
      "registerart": "HRB",
      "company_name": "Die Eismanufaktur GmbH",
      "company_seat": "Kirchzarten",
      "details": "07.04.2025 (Bekanntmachungsdatum)\n\nBaden-Württemberg Amtsgericht Freiburg HRB 732509\nRegisterbekanntmachung nach dem Umwandlungsgesetz 07.04.2025 (Eintragungsdatum)\n\nDie Eismanufaktur GmbH\nGesellschaft mit beschränkter Haftung\nKirchzarten\n\nAls nicht eingetragen wird bekanntgemacht:\nDen Gläubigern der an der Ausgliederung beteiligten Rechtsträger ist, wenn sie binnen sechs Monaten nach dem Tag, an dem die Eintragung der Ausgliederung in das Register des Sitzes desjenigen Rechtsträgers, dessen Gläubiger sie sind, nach § 19 Abs. 3 UmwG als bekanntgemacht gilt, ihren Anspruch nach Grund und Höhe schriftlich anmelden, Sicherheit zu leisten, soweit sie nicht Befriedigung verlangen können. Dieses Recht steht den Gläubigern jedoch nur zu, wenn sie glaubhaft machen, dass durch die Ausgliederung die Erfüllung ihrer Forderung gefährdet wird."
    },
    {
      "date": "2025-04-07",
      "id": "105806",
      "original_text": "Löschungsankündigung\nBaden-Württemberg Amtsgericht Mannheim HRB 742922\nSEHA Montage GmbH – Mannheim",
      "type": "Löschungsankündigung",
      "state": "Baden-Württemberg",
      "amtsgericht": "Amtsgericht Mannheim",
      "registernummer": "HRB 742922",
      "registerart": "HRB",
      "company_name": "SEHA Montage GmbH",
      "company_seat": "Mannheim",
      "details": "07.04.2025 (Bekanntmachungsdatum)\n\nBaden-Württemberg Amtsgericht Mannheim HRB 742922\nLöschungsankündigung 07.04.2025 (Eintragungsdatum)\n\nSEHA Montage GmbH\nGesellschaft mit beschränkter Haftung\nMannheim\n\nDas Gericht beabsichtigt, die Gesellschaft wegen Vermögenslosigkeit im Handelsregister von Amts wegen nach § 394 FamFG zu löschen. Die Frist zur Geltendmachung eines Widerspruchs gegen die beabsichtigte Löschung ist auf einen Monat ab Veröffentlichung bestimmt."
    },
    {
      "date": "2025-04-07",
      "id": "105807",
      "original_text": "Registerbekanntmachung nach dem Umwandlungsgesetz\nSachsen-Anhalt Amtsgericht Stendal GnR 154\nLandwirtschaftliche Produktivgenossenschaft \"Mastrind\" Staffelde eG – Stendal",
      "type": "Registerbekanntmachung nach dem Umwandlungsgesetz",
      "state": "Sachsen-Anhalt",
      "amtsgericht": "Amtsgericht Stendal",
      "registernummer": "GnR 154",
      "registerart": "GnR",
      "company_name": "Landwirtschaftliche Produktivgenossenschaft \"Mastrind\" Staffelde eG",
      "company_seat": "Stendal",
      "details": "07.04.2025 (Bekanntmachungsdatum)\n\nSachsen-Anhalt Amtsgericht Stendal GnR 154\nRegisterbekanntmachung nach dem Umwandlungsgesetz 07.04.2025 (Eintragungsdatum)\n\nLandwirtschaftliche Produktivgenossenschaft \"Mastrind\" Staffelde eG\neingetragene Genossenschaft\nStendal\n\nNicht eingetragen:\nDen Gläubigern der an der Verschmelzung beteiligten Rechtsträger ist, wenn sie binnen sechs Monaten nach dem Tag, an dem die Eintragung der Verschmelzung nach § 19 Abs. 3 UmwG als bekanntgemacht gilt, ihren Anspruch nach Grund und Höhe schriftlich anmelden, Sicherheit zu leisten, soweit sie nicht Befriedigung verlangen können. Dieses Recht steht ihnen jedoch nur zu, wenn sie glaubhaft machen, dass durch die Verschmelzung die Erfüllung ihrer Forderung gefährdet wird."
    },
    {
      "date": "2025-04-07",
      "id": "105808",
      "original_text": "Registerbekanntmachung nach dem Umwandlungsgesetz\nSchleswig-Holstein Amtsgericht Kiel HRB 14188\nSieben Sinne Strandkiosk 31 GmbH – Laboe",
      "type": "Registerbekanntmachung nach dem Umwandlungsgesetz",
      "state": "Schleswig-Holstein",
      "amtsgericht": "Amtsgericht Kiel",
      "registernummer": "HRB 14188",
      "registerart": "HRB",
      "company_name": "Sieben Sinne Strandkiosk 31 GmbH",
      "company_seat": "Laboe",
      "details": "07.04.2025 (Bekanntmachungsdatum)\n\nSchleswig-Holstein Amtsgericht Kiel HRB 14188\nRegisterbekanntmachung nach dem Umwandlungsgesetz 04.04.2025 (Eintragungsdatum)\n\nSieben Sinne Strandkiosk 31 GmbH\nGesellschaft mit beschränkter Haftung\nLaboe\n\nZu Eintragungsnummer 3 vom 04.04.2025 wird als nicht eingetragen veröffentlicht: Als nicht eingetragen wird veröffentlicht: Den Gläubigern der an der Ausgliederung beteiligten Rechtsträger ist, wenn sie binnen sechs Monaten nach dem Tag, an dem die Eintragung der Ausgliederung in das Register des Sitzes desjenigen Rechtsträgers, dessen Gläubiger sie sind,  bekannt gemacht worden ist, ihren Anspruch nach Grund und Höhe schriftlich anmelden, Sicherheit zu leisten, soweit sie nicht Befriedigung verlangen können. Dieses Recht steht den Gläubigern jedoch nur zu, wenn sie glaubhaft machen, dass durch die Ausgliederung die Erfüllung ihrer Forderung gefährdet wird."
    },
    {
      "date": "2025-04-07",
      "id": "105809",
      "original_text": "Registerbekanntmachung nach dem Umwandlungsgesetz\nSachsen-Anhalt Amtsgericht Stendal GnR 131\nAgrargenossenschaft Miltern eG – Tangermünde OT Miltern",
      "type": "Registerbekanntmachung nach dem Umwandlungsgesetz",
      "state": "Sachsen-Anhalt",
      "amtsgericht": "Amtsgericht Stendal",
      "registernummer": "GnR 131",
      "registerart": "GnR",
      "company_name": "Agrargenossenschaft Miltern eG",
      "company_seat": "Tangermünde OT Miltern",
      "details": "07.04.2025 (Bekanntmachungsdatum)\n\nSachsen-Anhalt Amtsgericht Stendal GnR 131\nRegisterbekanntmachung nach dem Umwandlungsgesetz 07.04.2025 (Eintragungsdatum)\n\nAgrargenossenschaft Miltern eG\neingetragene Genossenschaft\nTangermünde OT Miltern\n\nNicht eingetragen:\nDen Gläubigern der an der Verschmelzung beteiligten Rechtsträger ist, wenn sie binnen sechs Monaten nach dem Tag, an dem die Eintragung der Verschmelzung nach § 19 Abs. 3 UmwG als bekanntgemacht gilt, ihren Anspruch nach Grund und Höhe schriftlich anmelden, Sicherheit zu leisten, soweit sie nicht Befriedigung verlangen können. Dieses Recht steht ihnen jedoch nur zu, wenn sie glaubhaft machen, dass durch die Verschmelzung die Erfüllung ihrer Forderung gefährdet wird."
    },
    {
      "date": "2025-04-07",
      "id": "105810",
      "original_text": "Registerbekanntmachung nach dem Umwandlungsgesetz\nBaden-Württemberg Amtsgericht Freiburg HRA 708952\nEisherstellung in der Sandstraße e.K. – Freiburg im Breisgau",
      "type": "Registerbekanntmachung nach dem Umwandlungsgesetz",
      "state": "Baden-Württemberg",
      "amtsgericht": "Amtsgericht Freiburg",
      "registernummer": "HRA 708952",
      "registerart": "HRA",
      "company_name": "Eisherstellung in der Sandstraße e.K.",
      "company_seat": "Freiburg im Breisgau",
      "details": "07.04.2025 (Bekanntmachungsdatum)\n\nBaden-Württemberg Amtsgericht Freiburg HRA 708952\nRegisterbekanntmachung nach dem Umwandlungsgesetz 07.04.2025 (Eintragungsdatum)\n\nEisherstellung in der Sandstraße e.K.\nEinzelkaufmann / Einzelkauffrau\nFreiburg im Breisgau\n\nDen Gläubigern der an der Ausgliederung beteiligten Rechtsträger ist, wenn sie binnen sechs Monaten nach dem Tag, an dem die Eintragung der Ausgliederung in das Register des Sitzes desjenigen Rechtsträgers, dessen Gläubiger sie sind, nach § 19 Abs. 3 UmwG als bekanntgemacht gilt, ihren Anspruch nach Grund und Höhe schriftlich anmelden, Sicherheit zu leisten, soweit sie nicht Befriedigung verlangen können. Dieses Recht steht den Gläubigern jedoch nur zu, wenn sie glaubhaft machen, dass durch die Ausgliederung die Erfüllung ihrer Forderung gefährdet wird."
    },
    {
      "date": "2025-04-07",
      "id": "105811",
      "original_text": "Löschungsankündigung\nBerlin Amtsgericht Berlin (Charlottenburg) HRB 257567\nNBC-Vermittlungs-Management UG (haftungsbeschränkt) – Berlin",
      "type": "Löschungsankündigung",
      "state": "Berlin",
      "amtsgericht": "Amtsgericht Berlin (Charlottenburg)",
      "registernummer": "HRB 257567",
      "registerart": "HRB",
      "company_name": "NBC-Vermittlungs-Management UG (haftungsbeschränkt)",
      "company_seat": "Berlin",
      "details": "07.04.2025 (Bekanntmachungsdatum)\n\nBerlin Amtsgericht Berlin (Charlottenburg) HRB 257567\nLöschungsankündigung\n\nNBC-Vermittlungs-Management UG (haftungsbeschränkt)\nGesellschaft mit beschränkter Haftung\nBerlin\n\nBei der nachstehenden Gesellschaft wird das Amtslöschungsverfahren gemäß § 394 FamFG eingeleitet. Widerspruchsfrist 6 Wochen"
    },
    {
      "date": "2025-04-07",
      "id": "105812",
      "original_text": "Registerbekanntmachung nach dem Umwandlungsgesetz\nSachsen-Anhalt Amtsgericht Stendal GnR 131\nAgrargenossenschaft Miltern eG – Tangermünde OT Miltern",
      "type": "Registerbekanntmachung nach dem Umwandlungsgesetz",
      "state": "Sachsen-Anhalt",
      "amtsgericht": "Amtsgericht Stendal",
      "registernummer": "GnR 131",
      "registerart": "GnR",
      "company_name": "Agrargenossenschaft Miltern eG",
      "company_seat": "Tangermünde OT Miltern",
      "details": "07.04.2025 (Bekanntmachungsdatum)\n\nSachsen-Anhalt Amtsgericht Stendal GnR 131\nRegisterbekanntmachung nach dem Umwandlungsgesetz 03.04.2025 (Eintragungsdatum)\n\nAgrargenossenschaft Miltern eG\neingetragene Genossenschaft\nTangermünde OT Miltern\n\nNicht eingetragen:\nDen Gläubigern der an der Verschmelzung beteiligten Rechtsträger ist, wenn sie binnen sechs Monaten nach dem Tag, an dem die Eintragung der Verschmelzung nach § 19 Abs. 3 UmwG als bekanntgemacht gilt, ihren Anspruch nach Grund und Höhe schriftlich anmelden, Sicherheit zu leisten, soweit sie nicht Befriedigung verlangen können. Dieses Recht steht ihnen jedoch nur zu, wenn sie glaubhaft machen, dass durch die Verschmelzung die Erfüllung ihrer Forderung gefährdet wird."
    },
    {
      "date": "2025-04-07",
      "id": "105813",
      "original_text": "Registerbekanntmachung nach dem Umwandlungsgesetz\nBrandenburg Amtsgericht Cottbus HRB 13460\nTop Eventing GmbH – Krausnick-Groß Wasserburg",
      "type": "Registerbekanntmachung nach dem Umwandlungsgesetz",
      "state": "Brandenburg",
      "amtsgericht": "Amtsgericht Cottbus",
      "registernummer": "HRB 13460",
      "registerart": "HRB",
      "company_name": "Top Eventing GmbH",
      "company_seat": "Krausnick-Groß Wasserburg",
      "details": "07.04.2025 (Bekanntmachungsdatum)\n\nBrandenburg Amtsgericht Cottbus HRB 13460\nRegisterbekanntmachung nach dem Umwandlungsgesetz 04.04.2025 (Eintragungsdatum)\n\nTop Eventing GmbH\nGesellschaft mit beschränkter Haftung\nKrausnick-Groß Wasserburg\n\nZu Eintragungsnummer 2 vom 04.04.2025 wird als nicht eingetragen veröffentlicht:\nDen Gläubigern der an der Verschmelzung beteiligten Rechtsträger ist, wenn sie binnen sechs Monaten nach dem Tag, an dem die Eintragung der Verschmelzung in das Register des Sitzes desjenigen Rechtsträgers, dessen Gläubiger sie sind, als bekannt gemacht gilt, ihren Anspruch nach Grund und Höhe schriftlich anmelden, Sicherheit zu leisten, soweit sie nicht Befriedigung verlangen können. Dieses Recht steht den Gläubigern jedoch nur zu, wenn sie glaubhaft machen, dass durch die Verschmelzung die Erfüllung ihrer Forderung gefährdet wird"
    },
    {
      "date": "2025-04-07",
      "id": "105814",
      "original_text": "Registerbekanntmachung nach dem Umwandlungsgesetz\nSchleswig-Holstein Amtsgericht Kiel HRA 12657\nOtto Strandkiosk e.K. – Laboe",
      "type": "Registerbekanntmachung nach dem Umwandlungsgesetz",
      "state": "Schleswig-Holstein",
      "amtsgericht": "Amtsgericht Kiel",
      "registernummer": "HRA 12657",
      "registerart": "HRA",
      "company_name": "Otto Strandkiosk e.K.",
      "company_seat": "Laboe",
      "details": "07.04.2025 (Bekanntmachungsdatum)\n\nSchleswig-Holstein Amtsgericht Kiel HRA 12657\nRegisterbekanntmachung nach dem Umwandlungsgesetz 04.04.2025 (Eintragungsdatum)\n\nOtto Strandkiosk e.K.\nEinzelkaufmann / Einzelkauffrau\nLaboe\n\nZu Eintragungsnummer 2 vom 04.04.2025 wird als nicht eingetragen veröffentlicht: Den Gläubigern der an der Spaltung beteiligten Rechtsträger ist, wenn sie binnen sechs Monaten nach dem Tag, an dem die Eintragung der Spaltung in das Register des Sitzes desjenigen Rechtsträgers, dessen Gläubiger sie sind,  bekannt gemacht worden ist, ihren Anspruch nach Grund und Höhe schriftlich anmelden, Sicherheit zu leisten, soweit sie nicht Befriedigung verlangen können. Dieses Recht steht den Gläubigern jedoch nur zu, wenn sie glaubhaft machen, dass durch die Spaltung die Erfüllung ihrer Forderung gefährdet wird."
    },
    {
      "date": "2025-04-07",
      "id": "105815",
      "original_text": "Löschungsankündigung\nBrandenburg Amtsgericht Frankfurt/Oder HRB 17067\nB & L Bau UG (haftungsbeschränkt) – Erkner",
      "type": "Löschungsankündigung",
      "state": "Brandenburg",
      "amtsgericht": "Amtsgericht Frankfurt/Oder",
      "registernummer": "HRB 17067",
      "registerart": "HRB",
      "company_name": "B & L Bau UG (haftungsbeschränkt)",
      "company_seat": "Erkner",
      "details": "07.04.2025 (Bekanntmachungsdatum)\n\nBrandenburg Amtsgericht Frankfurt/Oder HRB 17067\nLöschungsankündigung\n\nB & L Bau UG (haftungsbeschränkt)\nGesellschaft mit beschränkter Haftung\nErkner\n\nBei der nachstehenden Gesellschaft wird das Amtslöschungsverfahren gemäß § 394 Abs. 1 FamFG eingeleitet."
    },
    {
      "date": "2025-04-07",
      "id": "105816",
      "original_text": "Registerbekanntmachung nach dem Umwandlungsgesetz\nSachsen-Anhalt Amtsgericht Stendal GnR 50\nLandwirtschaftsgenossenschaft \"Elbufer\" Neuermark-Lübars eG – Klietz OT Neuermark-Lübars",
      "type": "Registerbekanntmachung nach dem Umwandlungsgesetz",
      "state": "Sachsen-Anhalt",
      "amtsgericht": "Amtsgericht Stendal",
      "registernummer": "GnR 50",
      "registerart": "GnR",
      "company_name": "Landwirtschaftsgenossenschaft \"Elbufer\" Neuermark-Lübars eG",
      "company_seat": "Klietz OT Neuermark-Lübars",
      "details": "07.04.2025 (Bekanntmachungsdatum)\n\nSachsen-Anhalt Amtsgericht Stendal GnR 50\nRegisterbekanntmachung nach dem Umwandlungsgesetz 07.04.2025 (Eintragungsdatum)\n\nLandwirtschaftsgenossenschaft \"Elbufer\" Neuermark-Lübars eG\neingetragene Genossenschaft\nKlietz OT Neuermark-Lübars\n\nAls nicht eingetragen wird veröffentlicht:\n\nDen Gläubigern der Genossenschaft ist, wenn sie sich binnen 6 Monaten nach der Bekanntmachung bei der Genossenschaft zu diesem Zweck melden, Sicherheit zu leisten, soweit sie nicht Befriedigung verlangen können (§ 22 Abs. 1 bis 3 GenG)."
    },
    {
      "date": "2025-04-07",
      "id": "105817",
      "original_text": "Registerbekanntmachung nach dem Umwandlungsgesetz\nSachsen-Anhalt Amtsgericht Stendal GnR 131\nAgrargenossenschaft Miltern eG – Tangermünde OT Miltern",
      "type": "Registerbekanntmachung nach dem Umwandlungsgesetz",
      "state": "Sachsen-Anhalt",
      "amtsgericht": "Amtsgericht Stendal",
      "registernummer": "GnR 131",
      "registerart": "GnR",
      "company_name": "Agrargenossenschaft Miltern eG",
      "company_seat": "Tangermünde OT Miltern",
      "details": "07.04.2025 (Bekanntmachungsdatum)\n\nSachsen-Anhalt Amtsgericht Stendal GnR 131\nRegisterbekanntmachung nach dem Umwandlungsgesetz 07.04.2025 (Eintragungsdatum)\n\nAgrargenossenschaft Miltern eG\neingetragene Genossenschaft\nTangermünde OT Miltern\n\nNicht eingetragen:\nDen Gläubigern der an der Verschmelzung beteiligten Rechtsträger ist, wenn sie binnen sechs Monaten nach dem Tag, an dem die Eintragung der Verschmelzung nach § 19 Abs. 3 UmwG als bekanntgemacht gilt, ihren Anspruch nach Grund und Höhe schriftlich anmelden, Sicherheit zu leisten, soweit sie nicht Befriedigung verlangen können. Dieses Recht steht ihnen jedoch nur zu, wenn sie glaubhaft machen, dass durch die Verschmelzung die Erfüllung ihrer Forderung gefährdet wird."
    },
    {
      "date": "2025-04-07",
      "id": "105818",
      "original_text": "Registerbekanntmachung nach dem Umwandlungsgesetz\nMecklenburg-Vorpommern Amtsgericht Neubrandenburg HRB 22374\n\"das andere Gymnasium\" gGmbH – Neubrandenburg",
      "type": "Registerbekanntmachung nach dem Umwandlungsgesetz",
      "state": "Mecklenburg-Vorpommern",
      "amtsgericht": "Amtsgericht Neubrandenburg",
      "registernummer": "HRB 22374",
      "registerart": "HRB",
      "company_name": "\"das andere Gymnasium\" gGmbH",
      "company_seat": "Neubrandenburg",
      "details": "07.04.2025 (Bekanntmachungsdatum)\n\nMecklenburg-Vorpommern Amtsgericht Neubrandenburg HRB 22374\nRegisterbekanntmachung nach dem Umwandlungsgesetz 07.04.2025 (Eintragungsdatum)\n\n\"das andere Gymnasium\" gGmbH\nGesellschaft mit beschränkter Haftung\nNeubrandenburg\n\nAls nicht eingetragen wird veröffentlicht: Den Gläubigern der an der Umwandlung beteiligten Rechtsträger ist, wenn sie binnen sechs\nMonaten nach dem Tag, an dem die Eintragung der Umwandlung in das Register des Sitzes desjenigen Rechtsträgers, dessen Gläubiger sie sind, nach § 19 Abs. 3 UmwG als bekannt gemacht gilt, ihren Anspruch nach Grund und Höhe in Textform anmelden, Sicherheit zu leisten, soweit sie nicht Befriedigung verlangen können. Dieses Recht steht den Gläubigern jedoch nur zu, wenn sie glaubhaft machen, dass durch die Umwandlung die Erfüllung der Forderung gefährdet wird."
    },
    {
      "date": "2025-04-07",
      "id": "105819",
      "original_text": "Löschungsankündigung\nBerlin Amtsgericht Berlin (Charlottenburg) HRB 65916\nTOPMED Handelsgesellschaft mbH – Berlin",
      "type": "Löschungsankündigung",
      "state": "Berlin",
      "amtsgericht": "Amtsgericht Berlin (Charlottenburg)",
      "registernummer": "HRB 65916",
      "registerart": "HRB",
      "company_name": "TOPMED Handelsgesellschaft mbH",
      "company_seat": "Berlin",
      "details": "07.04.2025 (Bekanntmachungsdatum)\n\nBerlin Amtsgericht Berlin (Charlottenburg) HRB 65916\nLöschungsankündigung\n\nTOPMED Handelsgesellschaft mbH\nGesellschaft mit beschränkter Haftung\nBerlin\n\nBei der nachstehenden Gesellschaft wird das Amtslöschungsverfahren gemäß § 394 FamFG eingeleitet. Widerspruchsfrist 6 Wochen"
    },
    {
      "date": "2025-04-07",
      "id": "105820",
      "original_text": "Löschungsankündigung\nBaden-Württemberg Amtsgericht Mannheim HRB 750415\nDSD Solar Service GmbH – Heidelberg",
      "type": "Löschungsankündigung",
      "state": "Baden-Württemberg",
      "amtsgericht": "Amtsgericht Mannheim",
      "registernummer": "HRB 750415",
      "registerart": "HRB",
      "company_name": "DSD Solar Service GmbH",
      "company_seat": "Heidelberg",
      "details": "07.04.2025 (Bekanntmachungsdatum)\n\nBaden-Württemberg Amtsgericht Mannheim HRB 750415\nLöschungsankündigung\n\nDSD Solar Service GmbH\nGesellschaft mit beschränkter Haftung\nHeidelberg\n\nAls nicht eingetragen wird bekanntgemacht:\nDas Gericht beabsichtigt, die Gesellschaft wegen Vermögenslosigkeit im Handelsregister von Amts wegen nach § 394 FamFG zu löschen. Die Frist zur Geltendmachung eines Widerspruchs gegen die beabsichtigte Löschung ist auf einen Monat ab Veröffentlichung bestimmt."
    },
    {
      "date": "2025-04-07",
      "id": "105821",
      "original_text": "Löschungsankündigung\nBerlin Amtsgericht Berlin (Charlottenburg) HRB 252769\nH & E Hoch- und Tiefbau GmbH – Berlin",
      "type": "Löschungsankündigung",
      "state": "Berlin",
      "amtsgericht": "Amtsgericht Berlin (Charlottenburg)",
      "registernummer": "HRB 252769",
      "registerart": "HRB",
      "company_name": "H & E Hoch- und Tiefbau GmbH",
      "company_seat": "Berlin",
      "details": "07.04.2025 (Bekanntmachungsdatum)\n\nBerlin Amtsgericht Berlin (Charlottenburg) HRB 252769\nLöschungsankündigung\n\nH & E Hoch- und Tiefbau GmbH\nGesellschaft mit beschränkter Haftung\nBerlin\n\nBei der nachstehenden Gesellschaft wird das Amtslöschungsverfahren gemäß § 394 FamFG eingeleitet. Widerspruchsfrist 6 Wochen"
    },
    {
      "date": "2025-04-07",
      "id": "105822",
      "original_text": "Registerbekanntmachung nach dem Umwandlungsgesetz\nBaden-Württemberg Amtsgericht Stuttgart HRB 784537\nAV Capital Holding GmbH – Stuttgart",
      "type": "Registerbekanntmachung nach dem Umwandlungsgesetz",
      "state": "Baden-Württemberg",
      "amtsgericht": "Amtsgericht Stuttgart",
      "registernummer": "HRB 784537",
      "registerart": "HRB",
      "company_name": "AV Capital Holding GmbH",
      "company_seat": "Stuttgart",
      "details": "07.04.2025 (Bekanntmachungsdatum)\n\nBaden-Württemberg Amtsgericht Stuttgart HRB 784537\nRegisterbekanntmachung nach dem Umwandlungsgesetz 07.04.2025 (Eintragungsdatum)\n\nAV Capital Holding GmbH\nGesellschaft mit beschränkter Haftung\nStuttgart\n\nDen Gläubigern der an der Verschmelzung beteiligten Rechtsträger ist, wenn sie binnen sechs Monaten nach dem Tag, an dem die Eintragung der Verschmelzung in das Register des Sitzes desjenigen Rechtsträgers, dessen Gläubiger sie sind, nach § 19 Abs. 3 UmwG als bekanntgemacht gilt, ihren Anspruch nach Grund und Höhe schriftlich anmelden, Sicherheit zu leisten, soweit sie nicht Befriedigung verlangen können. Dieses Recht steht den Gläubigern jedoch nur zu, wenn sie glaubhaft machen, dass durch die Verschmelzung die Erfüllung ihrer Forderung gefährdet wird."
    },
    {
      "date": "2025-04-07",
      "id": "105823",
      "original_text": "Registerbekanntmachung nach dem Umwandlungsgesetz\nBaden-Württemberg Amtsgericht Ulm HRB 742034\nThoKnoVest GmbH – Ravensburg",
      "type": "Registerbekanntmachung nach dem Umwandlungsgesetz",
      "state": "Baden-Württemberg",
      "amtsgericht": "Amtsgericht Ulm",
      "registernummer": "HRB 742034",
      "registerart": "HRB",
      "company_name": "ThoKnoVest GmbH",
      "company_seat": "Ravensburg",
      "details": "07.04.2025 (Bekanntmachungsdatum)\n\nBaden-Württemberg Amtsgericht Ulm HRB 742034\nRegisterbekanntmachung nach dem Umwandlungsgesetz 07.04.2025 (Eintragungsdatum)\n\nThoKnoVest GmbH\nGesellschaft mit beschränkter Haftung\nRavensburg\n\nAls nicht eingetragen wird bekanntgemacht:\nDen Gläubigern der an der Verschmelzung beteiligten Rechtsträger ist, wenn sie binnen sechs Monaten nach dem Tag, an dem die Eintragung der Verschmelzung in das Register des Sitzes desjenigen Rechtsträgers, dessen Gläubiger sie sind, nach § 19 Abs. 3 UmwG als bekanntgemacht gilt, ihren Anspruch nach Grund und Höhe schriftlich anmelden, Sicherheit zu leisten, soweit sie nicht Befriedigung verlangen können. Dieses Recht steht den Gläubigern jedoch nur zu, wenn sie glaubhaft machen, dass durch die Verschmelzung die Erfüllung ihrer Forderung gefährdet wird."
    },
    {
      "date": "2025-04-07",
      "id": "105824",
      "original_text": "Registerbekanntmachung nach dem Umwandlungsgesetz\nBaden-Württemberg Amtsgericht Ulm HRB 748943\nThoKno Holding GmbH – Ravensburg",
      "type": "Registerbekanntmachung nach dem Umwandlungsgesetz",
      "state": "Baden-Württemberg",
      "amtsgericht": "Amtsgericht Ulm",
      "registernummer": "HRB 748943",
      "registerart": "HRB",
      "company_name": "ThoKno Holding GmbH",
      "company_seat": "Ravensburg",
      "details": "07.04.2025 (Bekanntmachungsdatum)\n\nBaden-Württemberg Amtsgericht Ulm HRB 748943\nRegisterbekanntmachung nach dem Umwandlungsgesetz 07.04.2025 (Eintragungsdatum)\n\nThoKno Holding GmbH\nGesellschaft mit beschränkter Haftung\nRavensburg\n\nAls nicht eingetragen wird bekanntgemacht:\nDen Gläubigern der an der Verschmelzung beteiligten Rechtsträger ist, wenn sie binnen sechs Monaten nach dem Tag, an dem die Eintragung der Verschmelzung in das Register des Sitzes desjenigen Rechtsträgers, dessen Gläubiger sie sind, nach § 19 Abs. 3 UmwG als bekanntgemacht gilt, ihren Anspruch nach Grund und Höhe schriftlich anmelden, Sicherheit zu leisten, soweit sie nicht Befriedigung verlangen können. Dieses Recht steht den Gläubigern jedoch nur zu, wenn sie glaubhaft machen, dass durch die Verschmelzung die Erfüllung ihrer Forderung gefährdet wird."
    },
    {
      "date": "2025-04-07",
      "id": "105825",
      "original_text": "Einreichung neuer Dokumente\nBaden-Württemberg Amtsgericht Ulm HRB 501555\nCarl Zeiss AG – Oberkochen",
      "type": "Einreichung neuer Dokumente",
      "state": "Baden-Württemberg",
      "amtsgericht": "Amtsgericht Ulm",
      "registernummer": "HRB 501555",
      "registerart": "HRB",
      "company_name": "Carl Zeiss AG",
      "company_seat": "Oberkochen",
      "details": "07.04.2025 (Bekanntmachungsdatum)\n\nBaden-Württemberg Amtsgericht Ulm HRB 501555\nEinreichung neuer Dokumente\n\nCarl Zeiss AG\nAktiengesellschaft\nOberkochen\n\nDie Gesellschaft hat am 03.04.2025 die Liste über die Zusammensetzung des Aufsichtsrats zum Handelsregister eingereicht."
    },
    {
      "date": "2025-04-07",
      "id": "105826",
      "original_text": "Löschungsankündigung\nBrandenburg Amtsgericht Frankfurt/Oder HRB 15405\nKesBit Business IT UG (haftungsbeschränkt) – Rüdersdorf bei Berlin",
      "type": "Löschungsankündigung",
      "state": "Brandenburg",
      "amtsgericht": "Amtsgericht Frankfurt/Oder",
      "registernummer": "HRB 15405",
      "registerart": "HRB",
      "company_name": "KesBit Business IT UG (haftungsbeschränkt)",
      "company_seat": "Rüdersdorf bei Berlin",
      "details": "07.04.2025 (Bekanntmachungsdatum)\n\nBrandenburg Amtsgericht Frankfurt/Oder HRB 15405\nLöschungsankündigung\n\nKesBit Business IT UG (haftungsbeschränkt)\nGesellschaft mit beschränkter Haftung\nRüdersdorf bei Berlin\n\nBei der nachstehenden Gesellschaft wird das Amtslöschungsverfahren gemäß § 394 Abs. 1 FamFG eingeleitet."
    },
    {
      "date": "2025-04-07",
      "id": "105827",
      "original_text": "Löschungsankündigung\nBrandenburg Amtsgericht Frankfurt/Oder HRB 19525\nCOLMAR TRADE GMBH – Frankfurt (Oder)",
      "type": "Löschungsankündigung",
      "state": "Brandenburg",
      "amtsgericht": "Amtsgericht Frankfurt/Oder",
      "registernummer": "HRB 19525",
      "registerart": "HRB",
      "company_name": "COLMAR TRADE GMBH",
      "company_seat": "Frankfurt (Oder)",
      "details": "07.04.2025 (Bekanntmachungsdatum)\n\nBrandenburg Amtsgericht Frankfurt/Oder HRB 19525\nLöschungsankündigung\n\nCOLMAR TRADE GMBH\nGesellschaft mit beschränkter Haftung\nFrankfurt (Oder)\n\nBei der nachstehenden Gesellschaft wird das Amtslöschungsverfahren gemäß § 394 Abs. 1 FamFG eingeleitet."
    },
    {
      "date": "2025-04-07",
      "id": "105828",
      "original_text": "Löschungsankündigung\nNordrhein-Westfalen Amtsgericht Coesfeld HRB 20075\nAli Akcesme Holding GmbH – Gronau",
      "type": "Löschungsankündigung",
      "state": "Nordrhein-Westfalen",
      "amtsgericht": "Amtsgericht Coesfeld",
      "registernummer": "HRB 20075",
      "registerart": "HRB",
      "company_name": "Ali Akcesme Holding GmbH",
      "company_seat": "Gronau",
      "details": "07.04.2025 (Bekanntmachungsdatum)\n\nNordrhein-Westfalen Amtsgericht Coesfeld HRB 20075\nLöschungsankündigung\n\nAli Akcesme Holding GmbH\nGesellschaft mit beschränkter Haftung\nGronau\n\nDas Registergericht beabsichtigt, den Rechtsträger wegen Vermögenslosigkeit gemäß § 394 FamFG von Amts wegen zu löschen.\n\nGegen diese Verfügung kann Widerspruch eingelegt werden. Die Frist zur Erhebung eines Widerspruchs gegen die beabsichtigte Löschung ist auf zwei Monate ab Veröffentlichung festgesetzt."
    },
    {
      "date": "2025-04-07",
      "id": "105829",
      "original_text": "Löschungsankündigung\nNordrhein-Westfalen Amtsgericht Coesfeld HRB 21351\nOS-PA GmbH – Gronau",
      "type": "Löschungsankündigung",
      "state": "Nordrhein-Westfalen",
      "amtsgericht": "Amtsgericht Coesfeld",
      "registernummer": "HRB 21351",
      "registerart": "HRB",
      "company_name": "OS-PA GmbH",
      "company_seat": "Gronau",
      "details": "07.04.2025 (Bekanntmachungsdatum)\n\nNordrhein-Westfalen Amtsgericht Coesfeld HRB 21351\nLöschungsankündigung\n\nOS-PA GmbH\nGesellschaft mit beschränkter Haftung\nGronau\n\nDas Registergericht beabsichtigt, den Rechtsträger wegen Vermögenslosigkeit gemäß § 394 FamFG von Amts wegen zu löschen.\n\nGegen diese Verfügung kann Widerspruch eingelegt werden. Die Frist zur Erhebung eines Widerspruchs gegen die beabsichtigte Löschung ist auf zwei Monate ab Veröffentlichung festgesetzt."
    },
    {
      "date": "2025-04-07",
      "id": "105830",
      "original_text": "Registerbekanntmachung nach dem Umwandlungsgesetz\nBaden-Württemberg Amtsgericht Mannheim HRA 4356\nLandesbank Baden-Württemberg – Mannheim",
      "type": "Registerbekanntmachung nach dem Umwandlungsgesetz",
      "state": "Baden-Württemberg",
      "amtsgericht": "Amtsgericht Mannheim",
      "registernummer": "HRA 4356",
      "registerart": "HRA",
      "company_name": "Landesbank Baden-Württemberg",
      "company_seat": "Mannheim",
      "details": "07.04.2025 (Bekanntmachungsdatum)\n\nBaden-Württemberg Amtsgericht Mannheim HRA 4356\nRegisterbekanntmachung nach dem Umwandlungsgesetz\n\nLandesbank Baden-Württemberg\nSonstige juristische Person\nMannheim\n\nDie Gesellschaft hat am 07.04.2025 gem. §§ 125 Absatz 1 Satz 1, 61 Satz 2 UmwG i.V.m. § 1 Absatz 5 und 6 Gesetz über die Landesbank Baden-Württemberg (LBWG) sowie höchstvorsorglich gem. §§ 125 Absatz 1\nSatz 1, 62 Absatz 3 Satz 2 i.V.m. § 61 Satz 2 UmwG i.V.m. § 1 Absatz 5 und 6 LBWG den Entwurf eines Abspaltungs- und Übernahmevertrags zwischen der Berlin Hyp AG mit Sitz in Berlin (Amtsgericht Charlottenburg HRB 56530 B) als\nübertragendem Rechtsträger und der Landesbank Baden-Württemberg als übernehmendem Rechtsträgern  zum Handelsregister der Landesbank Baden-Württemberg beim Amtsgericht Mannheim zur Akte HRA 4356 und HRA 104440 eingereicht."
    },
    {
      "date": "2025-04-07",
      "id": "105831",
      "original_text": "Registerbekanntmachung nach dem Umwandlungsgesetz\nBaden-Württemberg Amtsgericht Freiburg HRB 711306\nRC 2 Vermögensverwaltung- und Beteiligungs-GmbH – Freiburg im Breisgau",
      "type": "Registerbekanntmachung nach dem Umwandlungsgesetz",
      "state": "Baden-Württemberg",
      "amtsgericht": "Amtsgericht Freiburg",
      "registernummer": "HRB 711306",
      "registerart": "HRB",
      "company_name": "RC 2 Vermögensverwaltung- und Beteiligungs-GmbH",
      "company_seat": "Freiburg im Breisgau",
      "details": "07.04.2025 (Bekanntmachungsdatum)\n\nBaden-Württemberg Amtsgericht Freiburg HRB 711306\nRegisterbekanntmachung nach dem Umwandlungsgesetz 07.04.2025 (Eintragungsdatum)\n\nRC 2 Vermögensverwaltung- und Beteiligungs-GmbH\nGesellschaft mit beschränkter Haftung\nFreiburg im Breisgau\n\nAls nicht eingetragen wird bekanntgemacht:\nDen Gläubigern der an der Verschmelzung beteiligten Rechtsträger ist, wenn sie binnen sechs Monaten nach dem Tag, an dem die Eintragung der Verschmelzung in das Register des Sitzes desjenigen Rechtsträgers, dessen Gläubiger sie sind, nach § 19 Abs. 3 UmwG als bekanntgemacht gilt, ihren Anspruch nach Grund und Höhe schriftlich anmelden, Sicherheit zu leisten, soweit sie nicht Befriedigung verlangen können. Dieses Recht steht den Gläubigern jedoch nur zu, wenn sie glaubhaft machen, dass durch die Verschmelzung die Erfüllung ihrer Forderung gefährdet wird."
    },
    {
      "date": "2025-04-07",
      "id": "105832",
      "original_text": "Einreichung neuer Dokumente\nSchleswig-Holstein Amtsgericht Lübeck HRB 8877\nSport- und Gesundheitszentrum Dahme GmbH – Dahme",
      "type": "Einreichung neuer Dokumente",
      "state": "Schleswig-Holstein",
      "amtsgericht": "Amtsgericht Lübeck",
      "registernummer": "HRB 8877",
      "registerart": "HRB",
      "company_name": "Sport- und Gesundheitszentrum Dahme GmbH",
      "company_seat": "Dahme",
      "details": "07.04.2025 (Bekanntmachungsdatum)\n\nSchleswig-Holstein Amtsgericht Lübeck HRB 8877\nEinreichung neuer Dokumente\n\nSport- und Gesundheitszentrum Dahme GmbH\nGesellschaft mit beschränkter Haftung\nDahme\n\nAls nicht eingetragen wird veröffentlicht:\nEs wurde eine neue Liste der Aufsichtsratsmitglieder zum Handelsregister eingereicht."
    },
    {
      "date": "2025-04-07",
      "id": "105833",
      "original_text": "Einreichung neuer Dokumente\nNiedersachsen Amtsgericht Hannover HRB 219010\nversifair AG – Hannover",
      "type": "Einreichung neuer Dokumente",
      "state": "Niedersachsen",
      "amtsgericht": "Amtsgericht Hannover",
      "registernummer": "HRB 219010",
      "registerart": "HRB",
      "company_name": "versifair AG",
      "company_seat": "Hannover",
      "details": "07.04.2025 (Bekanntmachungsdatum)\n\nNiedersachsen Amtsgericht Hannover HRB 219010\nEinreichung neuer Dokumente\n\nversifair AG\nAktiengesellschaft\nHannover\n\nDie Liste der Mitglieder des Aufsichtsrats wurde beim Registergericht eingereicht."
    },
    {
      "date": "2025-04-07",
      "id": "105834",
      "original_text": "Löschungsankündigung\nNiedersachsen Amtsgericht Osnabrück HRB 214483\nGabano UG (haftungsbeschränkt) – Melle",
      "type": "Löschungsankündigung",
      "state": "Niedersachsen",
      "amtsgericht": "Amtsgericht Osnabrück",
      "registernummer": "HRB 214483",
      "registerart": "HRB",
      "company_name": "Gabano UG (haftungsbeschränkt)",
      "company_seat": "Melle",
      "details": "07.04.2025 (Bekanntmachungsdatum)\n\nNiedersachsen Amtsgericht Osnabrück HRB 214483\nLöschungsankündigung\n\nGabano UG (haftungsbeschränkt)\nGesellschaft mit beschränkter Haftung\nMelle\n\nDas Registergericht beabsichtigt, die Gesellschaft von Amts wegen nach § 394 FamFG wegen Vermögenslosigkeit zu löschen. Die Frist zur Erhebung eines Widerspruchs ist auf 1 Monat ab dieser Registerbekanntmachung festgesetzt."
    },
    {
      "date": "2025-04-07",
      "id": "105835",
      "original_text": "Einreichung neuer Dokumente\nNiedersachsen Amtsgericht Lüneburg HRB 101369 früher Amtsgericht Celle\nAnsiedlungs- und Wohnungsbaugesellschaft mbH Soltau – Soltau",
      "type": "Einreichung neuer Dokumente",
      "state": "Niedersachsen",
      "amtsgericht": "Amtsgericht Lüneburg",
      "registernummer": "HRB 101369",
      "registerart": "HRB",
      "company_name": "Ansiedlungs- und Wohnungsbaugesellschaft mbH Soltau",
      "company_seat": "Soltau",
      "former_amtsgericht": "Celle",
      "details": "07.04.2025 (Bekanntmachungsdatum)\n\nNiedersachsen Amtsgericht Lüneburg HRB 101369 früher Amtsgericht Celle\nEinreichung neuer Dokumente\n\nAnsiedlungs- und Wohnungsbaugesellschaft mbH Soltau\nGesellschaft mit beschränkter Haftung\nSoltau\n\nEine aktuelle Liste der Mitglieder des Aufsichtsrats wurde beim Registergericht eingereicht."
    },
    {
      "date": "2025-04-07",
      "id": "105836",
      "original_text": "Registerbekanntmachung nach dem Umwandlungsgesetz\nNiedersachsen Amtsgericht Oldenburg (Oldenburg) HRB 212356\nFrisona Agrar Handels GmbH – Elsfleth",
      "type": "Registerbekanntmachung nach dem Umwandlungsgesetz",
      "state": "Niedersachsen",
      "amtsgericht": "Amtsgericht Oldenburg (Oldenburg)",
      "registernummer": "HRB 212356",
      "registerart": "HRB",
      "company_name": "Frisona Agrar Handels GmbH",
      "company_seat": "Elsfleth",
      "details": "07.04.2025 (Bekanntmachungsdatum)\n\nNiedersachsen Amtsgericht Oldenburg (Oldenburg) HRB 212356\nRegisterbekanntmachung nach dem Umwandlungsgesetz 07.04.2025 (Eintragungsdatum)\n\nFrisona Agrar Handels GmbH\nGesellschaft mit beschränkter Haftung\nElsfleth\n\nDen Gläubigern der an der Verschmelzung beteiligten Rechtsträger ist, wenn sie binnen sechs Monaten nach dem Tag, an dem die Eintragung der Verschmelzung in das Register des Sitzes desjenigen Rechtsträgers, dessen Gläubiger sie sind, nach § 19  Abs.  3 UmwG als bekannt gemacht gilt, ihren Anspruch nach Grund und Höhe schriftlich anmelden, Sicherheit zu leisten, soweit sie nicht Befriedigung verlangen können. Dieses Recht steht den Gläubigern jedoch nur zu, wenn sie glaubhaft machen, dass durch die Verschmelzung die Erfüllung der Forderung gefährdet wird."
    },
    {
      "date": "2025-04-07",
      "id": "105837",
      "original_text": "Löschungsankündigung\nNiedersachsen Amtsgericht Aurich HRB 206243\nTEF Cleaning System UG (haftungsbeschränkt) – Esens",
      "type": "Löschungsankündigung",
      "state": "Niedersachsen",
      "amtsgericht": "Amtsgericht Aurich",
      "registernummer": "HRB 206243",
      "registerart": "HRB",
      "company_name": "TEF Cleaning System UG (haftungsbeschränkt)",
      "company_seat": "Esens",
      "details": "07.04.2025 (Bekanntmachungsdatum)\n\nNiedersachsen Amtsgericht Aurich HRB 206243\nLöschungsankündigung\n\nTEF Cleaning System UG (haftungsbeschränkt)\nGesellschaft mit beschränkter Haftung\nEsens\n\nDas Registergericht beabsichtigt, die Gesellschaft von Amts wegen nach § 394 FamFG zu löschen. Die Frist zur Erhebung eines Widerspruchs ist auf 1 Monat ab dieser Registerbekanntmachung festgesetzt."
    },
    {
      "date": "2025-04-07",
      "id": "105838",
      "original_text": "Löschungsankündigung\nNiedersachsen Amtsgericht Hildesheim HRB 203437\nwede haus Verwaltungs GmbH – Sehnde",
      "type": "Löschungsankündigung",
      "state": "Niedersachsen",
      "amtsgericht": "Amtsgericht Hildesheim",
      "registernummer": "HRB 203437",
      "registerart": "HRB",
      "company_name": "wede haus Verwaltungs GmbH",
      "company_seat": "Sehnde",
      "details": "07.04.2025 (Bekanntmachungsdatum)\n\nNiedersachsen Amtsgericht Hildesheim HRB 203437\nLöschungsankündigung 07.04.2025 (Eintragungsdatum)\n\nwede haus Verwaltungs GmbH\nGesellschaft mit beschränkter Haftung\nSehnde\n\nDas Registergericht beabsichtigt, die Gesellschaft von Amts wegen nach § 394 FamFG zu löschen. Die Frist zur Erhebung eines Widerspruchs ist auf 1 Monat ab dieser Registerbekanntmachung festgesetzt."
    },
    {
      "date": "2025-04-07",
      "id": "105839",
      "original_text": "Registerbekanntmachung nach dem Umwandlungsgesetz\nNiedersachsen Amtsgericht Osnabrück HRA 205930\nXHoch3 Versicherungsvertrieb und Beratung GmbH & Co. KG – Osnabrück",
      "type": "Registerbekanntmachung nach dem Umwandlungsgesetz",
      "state": "Niedersachsen",
      "amtsgericht": "Amtsgericht Osnabrück",
      "registernummer": "HRA 205930",
      "registerart": "HRA",
      "company_name": "XHoch3 Versicherungsvertrieb und Beratung GmbH & Co. KG",
      "company_seat": "Osnabrück",
      "details": "07.04.2025 (Bekanntmachungsdatum)\n\nNiedersachsen Amtsgericht Osnabrück HRA 205930\nRegisterbekanntmachung nach dem Umwandlungsgesetz 07.04.2025 (Eintragungsdatum)\n\nXHoch3 Versicherungsvertrieb und Beratung GmbH & Co. KG\nKommanditgesellschaft\nOsnabrück\n\nDen Gläubigern der an der Ausgliederung beteiligten Rechtsträger ist, wenn sie binnen sechs Monaten nach dem Tag, an dem die Eintragung der Ausgliederung in das Register des Sitzes desjenigen Rechtsträgers, dessen Gläubiger sie sind, nach § 19 Abs. 3 UmwG als bekannt gemacht gilt, ihren Anspruch nach Grund und Höhe schriftlich anmelden, Sicherheit zu leisten, soweit sie nicht Befriedigung verlangen können. Dieses Recht steht den Gläubigern jedoch nur zu, wenn sie glaubhaft machen, dass durch die Ausgliederung die Erfüllung der Forderung gefährdet wird."
    },
    {
      "date": "2025-04-07",
      "id": "105840",
      "original_text": "Einreichung neuer Dokumente\nRheinland-Pfalz Amtsgericht Landau HRB 30645\nHornbach Immobilien Aktiengesellschaft – Bornheim bei Landau/Pfalz",
      "type": "Einreichung neuer Dokumente",
      "state": "Rheinland-Pfalz",
      "amtsgericht": "Amtsgericht Landau",
      "registernummer": "HRB 30645",
      "registerart": "HRB",
      "company_name": "Hornbach Immobilien Aktiengesellschaft",
      "company_seat": "Bornheim bei Landau/Pfalz",
      "details": "07.04.2025 (Bekanntmachungsdatum)\n\nRheinland-Pfalz Amtsgericht Landau HRB 30645\nEinreichung neuer Dokumente 07.04.2025 (Eintragungsdatum)\n\nHornbach Immobilien Aktiengesellschaft\nAktiengesellschaft\nBornheim bei Landau/Pfalz\n\nDem Registergericht ist am 04.04.2025 eine neue Liste der Mitglieder des Aufsichtsrates eingereicht worden."
    },
    {
      "date": "2025-04-07",
      "id": "105841",
      "original_text": "Löschungsankündigung\nRheinland-Pfalz Amtsgericht Montabaur HRB 26370\nCVT Continental Visionary Trading GmbH – Mündersbach",
      "type": "Löschungsankündigung",
      "state": "Rheinland-Pfalz",
      "amtsgericht": "Amtsgericht Montabaur",
      "registernummer": "HRB 26370",
      "registerart": "HRB",
      "company_name": "CVT Continental Visionary Trading GmbH",
      "company_seat": "Mündersbach",
      "details": "07.04.2025 (Bekanntmachungsdatum)\n\nRheinland-Pfalz Amtsgericht Montabaur HRB 26370\nLöschungsankündigung\n\nCVT Continental Visionary Trading GmbH\nGesellschaft mit beschränkter Haftung\nMündersbach\n\nDas Registergericht beabsichtigt die Gesellschaft von Amts wegen nach § 394 FamFG zu löschen. Die Frist zur Erhebung eines Widerspruchs ist auf 1 Monat festgesetzt."
    },
    {
      "date": "2025-04-07",
      "id": "105842",
      "original_text": "Registerbekanntmachung nach dem Umwandlungsgesetz\nRheinland-Pfalz Amtsgericht Koblenz HRB 29694\nTruck Connection GmbH – Miehlen",
      "type": "Registerbekanntmachung nach dem Umwandlungsgesetz",
      "state": "Rheinland-Pfalz",
      "amtsgericht": "Amtsgericht Koblenz",
      "registernummer": "HRB 29694",
      "registerart": "HRB",
      "company_name": "Truck Connection GmbH",
      "company_seat": "Miehlen",
      "details": "07.04.2025 (Bekanntmachungsdatum)\n\nRheinland-Pfalz Amtsgericht Koblenz HRB 29694\nRegisterbekanntmachung nach dem Umwandlungsgesetz 07.04.2025 (Eintragungsdatum)\n\nTruck Connection GmbH\nGesellschaft mit beschränkter Haftung\nMiehlen\n\nAls nicht eingetragen wird veröffentlicht: Den Gläubigern der an der Verschmelzung beteiligten Rechtsträger ist, wenn sie binnen sechs Monaten nach dem Tag, an dem die Eintragung der Verschmelzung in das Register des Sitzes desjenigen Rechtsträgers,dessen Gläubiger sie sind, nach § 19 Abs. 3 UmwG als bekannt gemacht gilt, ihren Anspruch nach Grund und Höhe schriftlich anmelden, Sicherheit zu leisten, soweit sie nicht Befriedigung verlangen können. Dieses Recht steht den Gläubigern jedoch nur zu, wenn sie glaubhaft machen, dass durch die Verschmelzung die Erfüllungd er Forderung gefährdet wird."
    },
    {
      "date": "2025-04-07",
      "id": "105843",
      "original_text": "Registerbekanntmachung nach dem Umwandlungsgesetz\nRheinland-Pfalz Amtsgericht Koblenz HRA 22243\nCullmann Media e.K. – Niederwallmenach",
      "type": "Registerbekanntmachung nach dem Umwandlungsgesetz",
      "state": "Rheinland-Pfalz",
      "amtsgericht": "Amtsgericht Koblenz",
      "registernummer": "HRA 22243",
      "registerart": "HRA",
      "company_name": "Cullmann Media e.K.",
      "company_seat": "Niederwallmenach",
      "details": "07.04.2025 (Bekanntmachungsdatum)\n\nRheinland-Pfalz Amtsgericht Koblenz HRA 22243\nRegisterbekanntmachung nach dem Umwandlungsgesetz 07.04.2025 (Eintragungsdatum)\n\nCullmann Media e.K.\nEinzelkaufmann / Einzelkauffrau\nNiederwallmenach\n\nAls nicht eingetragen wird veröffentlicht: Den Gläubigern der an der Verschmelzung beteiligten Rechtsträger ist, wenn sie binnen sechs Monaten nach dem Tag, an dem die Eintragung der Verschmelzung in das Register des Sitzes desjenigen Rechtsträgers,dessen Gläubiger sie sind, nach § 19 Abs. 3 UmwG als bekannt gemacht gilt, ihren Anspruch nach Grund und Höhe schriftlich anmelden, Sicherheit zu leisten, soweit sie nicht Befriedigung verlangen können. Dieses Recht steht den Gläubigern jedoch nur zu, wenn sie glaubhaft machen, dass durch die Verschmelzung die Erfüllungd er Forderung gefährdet wird."
    },
    {
      "date": "2025-04-07",
      "id": "105844",
      "original_text": "Registerbekanntmachung nach dem Umwandlungsgesetz\nRheinland-Pfalz Amtsgericht Wittlich HRB 4861\nttt-it AG – Trier",
      "type": "Registerbekanntmachung nach dem Umwandlungsgesetz",
      "state": "Rheinland-Pfalz",
      "amtsgericht": "Amtsgericht Wittlich",
      "registernummer": "HRB 4861",
      "registerart": "HRB",
      "company_name": "ttt-it AG",
      "company_seat": "Trier",
      "details": "07.04.2025 (Bekanntmachungsdatum)\n\nRheinland-Pfalz Amtsgericht Wittlich HRB 4861\nRegisterbekanntmachung nach dem Umwandlungsgesetz 07.04.2025 (Eintragungsdatum)\n\nttt-it AG\nAktiengesellschaft\nTrier\n\nDem Registergericht ist ein Entwurf eines Vertrages über die geplante Verschmelzung der ttt-it Ag (HRB 4861) mit der IT Fabrik Systemhaus GmbH & Co. KG (HRA 41006) eingereicht worden."
    },
    {
      "date": "2025-04-07",
      "id": "105845",
      "original_text": "Löschungsankündigung\nBremen Amtsgericht Bremen HRB 37554\nATM Beton Steel UG (haftungsbeschränkt) – Bremen",
      "type": "Löschungsankündigung",
      "state": "Bremen",
      "amtsgericht": "Amtsgericht Bremen",
      "registernummer": "HRB 37554",
      "registerart": "HRB",
      "company_name": "ATM Beton Steel UG (haftungsbeschränkt)",
      "company_seat": "Bremen",
      "details": "07.04.2025 (Bekanntmachungsdatum)\n\nBremen Amtsgericht Bremen HRB 37554\nLöschungsankündigung\n\nATM Beton Steel UG (haftungsbeschränkt)\nGesellschaft mit beschränkter Haftung\nBremen\n\nEs ist beabsichtigt die im Handelsregister eingetragene Gesellschaft von Amts wegen gemäß § 394 FamFG zu löschen. Gegen die Löschung kann beim AG Bremen schriftlich oder zu Protokoll der Geschäftsstelle Widerspruch eingelegt werden. Widerspruchsfrist 4 Wochen."
    },
    {
      "date": "2025-04-07",
      "id": "105846",
      "original_text": "Löschungsankündigung\nNordrhein-Westfalen Amtsgericht Neuss HRB 10878\nARTI Planungs und Bauträger GmbH – Dormagen",
      "type": "Löschungsankündigung",
      "state": "Nordrhein-Westfalen",
      "amtsgericht": "Amtsgericht Neuss",
      "registernummer": "HRB 10878",
      "registerart": "HRB",
      "company_name": "ARTI Planungs und Bauträger GmbH",
      "company_seat": "Dormagen",
      "details": "07.04.2025 (Bekanntmachungsdatum)\n\nNordrhein-Westfalen Amtsgericht Neuss HRB 10878\nLöschungsankündigung\n\nARTI Planungs und Bauträger GmbH\nGesellschaft mit beschränkter Haftung\nDormagen\n\nDas Registergericht beabsichtigt die Gesellschaft von Amts wegen nach § 394 FamFG zu löschen. Die Frist zur Erhebung eines Widerspruchs ist auf einen Monat festgesetzt.\n\nRechtsbehelfsbelehrung:\nGegen diese Verfügung können Sie Widerspruch einlegen. Der Widerspruch ist bei dem Amtsgericht Neuss, Breite Straße 48, 41460 Neuss schriftlich in deutscher Sprache oder zur Niederschrift der Geschäftsstelle einzulegen. Der Widerspruch kann auch zur Niederschrift der Geschäftsstelle eines jeden Amtsgerichtes abgegeben werden. Die Einlegung ist auch durch Übertragung eines elektronischen Dokuments an die elektronische Poststelle des Gerichts möglich. Das elektronische Dokument muss für die Bearbeitung durch das Gericht geeignet und mit einer qualifizierten elektronischen Signatur der verantwortenden Person versehen sein oder von der verantwortenden Person signiert und auf einem sicheren Übermittlungsweg gemäß § 130a ZPO nach näherer Maßgabe der Verordnung über die technischen Rahmenbedingungen des elektronischen Rechtsverkehrs und über das besondere elektronische Behördenpostfach (BGBl. I, S.3803) eingereicht werden. Weitere Informationen erhalten Sie auf der Internetseite www.justiz.de.\nDer Widerspruch muss spätestens innerhalb der gesetzten Frist bei dem Amtsgericht Neuss eingegangen sein. Dies gilt auch dann, wenn der Widerspruch zur Niederschrift der Geschäftsstelle eines anderen Amtsgerichtes abgegeben wurde. Die Frist beginnt mit der Veröffentlichung. Fällt das Ende der Frist auf einen Sonntag, einen allgemeinen Feiertag oder Sonnabend, so endet die Frist mit Ablauf des nächsten Werktages. Der Widerspruch muss die Bezeichnung der angefochtenen Verfügung sowie die Erklärung enthalten, dass Widerspruch gegen diese Verfügung eingelegt wird. Er ist zu unterzeichnen und soll begründet werden."
    },
    {
      "date": "2025-04-07",
      "id": "105847",
      "original_text": "Registerbekanntmachung nach dem Umwandlungsgesetz\nNordrhein-Westfalen Amtsgericht Bonn HRB 10271\nAuto-Centrum-Rheinbach GmbH – Rheinbach",
      "type": "Registerbekanntmachung nach dem Umwandlungsgesetz",
      "state": "Nordrhein-Westfalen",
      "amtsgericht": "Amtsgericht Bonn",
      "registernummer": "HRB 10271",
      "registerart": "HRB",
      "company_name": "Auto-Centrum-Rheinbach GmbH",
      "company_seat": "Rheinbach",
      "details": "07.04.2025 (Bekanntmachungsdatum)\n\nNordrhein-Westfalen Amtsgericht Bonn HRB 10271\nRegisterbekanntmachung nach dem Umwandlungsgesetz 07.04.2025 (Eintragungsdatum)\n\nAuto-Centrum-Rheinbach GmbH\nGesellschaft mit beschränkter Haftung\nRheinbach\n\nDen Gläubigern der an der Verschmelzung beteiligten Rechtsträger ist, wenn sie binnen sechs Monaten nach dem Tag, an dem die Eintragung der Verschmelzung in das Register des Sitzes desjenigen Rechtsträgers, dessen Gläubiger sie sind, nach § 19 Absatz 3 UmwG als bekanntgemacht gilt, ihren Anspruch nach Grund und Höhe schriftlich anmelden, Sicherheit zu leisten, soweit sie nicht Befriedigung verlangen können. Dieses Recht steht den Gläubigern jedoch nur zu, wenn sie glaubhaft machen, dass durch die Verschmelzung die Erfüllung ihrer Forderung gefährdet wird."
    },
    {
      "date": "2025-04-07",
      "id": "105848",
      "original_text": "Einreichung neuer Dokumente\nNordrhein-Westfalen Amtsgericht Münster HRB 14637\nDeutsches Rotes Kreuz Münster Sozialwerk gemeinnützige GmbH – Münster",
      "type": "Einreichung neuer Dokumente",
      "state": "Nordrhein-Westfalen",
      "amtsgericht": "Amtsgericht Münster",
      "registernummer": "HRB 14637",
      "registerart": "HRB",
      "company_name": "Deutsches Rotes Kreuz Münster Sozialwerk gemeinnützige GmbH",
      "company_seat": "Münster",
      "details": "07.04.2025 (Bekanntmachungsdatum)\n\nNordrhein-Westfalen Amtsgericht Münster HRB 14637\nEinreichung neuer Dokumente\n\nDeutsches Rotes Kreuz Münster Sozialwerk gemeinnützige GmbH\nGesellschaft mit beschränkter Haftung\nMünster\n\nDem Registergericht ist eine neue Liste der Mitglieder des Aufsichtsrates eingereicht worden."
    },
    {
      "date": "2025-04-07",
      "id": "105849",
      "original_text": "Einreichung neuer Dokumente\nNordrhein-Westfalen Amtsgericht Münster HRB 343\nStadtwerke Münster GmbH – Münster",
      "type": "Einreichung neuer Dokumente",
      "state": "Nordrhein-Westfalen",
      "amtsgericht": "Amtsgericht Münster",
      "registernummer": "HRB 343",
      "registerart": "HRB",
      "company_name": "Stadtwerke Münster GmbH",
      "company_seat": "Münster",
      "details": "07.04.2025 (Bekanntmachungsdatum)\n\nNordrhein-Westfalen Amtsgericht Münster HRB 343\nEinreichung neuer Dokumente\n\nStadtwerke Münster GmbH\nGesellschaft mit beschränkter Haftung\nMünster\n\nDem Registergericht ist eine neue Liste der Mitglieder des Aufsichtsrates eingereicht worden."
    },
    {
      "date": "2025-04-07",
      "id": "105850",
      "original_text": "Löschungsankündigung\nNordrhein-Westfalen Amtsgericht Siegburg HRB 14701\nTNKB Verwaltungs-GmbH – Königswinter",
      "type": "Löschungsankündigung",
      "state": "Nordrhein-Westfalen",
      "amtsgericht": "Amtsgericht Siegburg",
      "registernummer": "HRB 14701",
      "registerart": "HRB",
      "company_name": "TNKB Verwaltungs-GmbH",
      "company_seat": "Königswinter",
      "details": "07.04.2025 (Bekanntmachungsdatum)\n\nNordrhein-Westfalen Amtsgericht Siegburg HRB 14701\nLöschungsankündigung\n\nTNKB Verwaltungs-GmbH\nGesellschaft mit beschränkter Haftung\nKönigswinter\n\nDas Registergericht hat glaubhafte Kenntnis erlangt, dass die Gesellschaft vermögenslos geworden ist, da ein Insolvenzverfahren durchgeführt und nach § 200 InsO aufgehoben wurde.\n\nEs ist daher beabsichtigt, die Gesellschaft nach § 394 FamFG im Handelsregister wegen Vermögenslosigkeit zu löschen.\n\nEinwände gegen die Löschung sind durch Widerspruch binnen einer Frist von 3 Monaten geltend zu machen, andernfalls die Löschung erfolgen wird.\n\nEinzulegen ist der Widerspruch bei dem Amtsgericht Siegburg, Neue Poststraße 16, 53721 Siegburg, und zwar entweder schriftlich in deutscher Sprache oder mündlich zur Niederschrift der Geschäftsstelle. Der Widerspruch kann auch zur Niederschrift der Geschäftsstelle eines jeden Amtsgerichts abgegeben werden. Der Widerspruch ist binnen der in der Verfügung bestimmten Frist einzulegen. Die Frist ist nur gewahrt, wenn der Widerspruch rechtzeitig bei dem Amtsgericht Siegburg eingeht, auch wenn der Widerspruch zur Niederschrift der Geschäftsstelle eines anderen Amtsgerichts abgegeben wurde. Die Frist beginnt jeweils mit der schriftlichen Bekanntgabe der Verfügung an die Beteiligten. Kann die schriftliche Bekanntgabe an einen Beteiligten nicht bewirkt werden, beginnt die Frist spätestens mit Ablauf von fünf Monaten nach Erlass der Verfügung. Die Bekanntgabe ist entweder durch Zustellung oder am dritten Tage nach Aufgabe zur Post bewirkt. Sofern die Löschung noch nicht erfolgt ist, kann der Widerspruch auch noch nach Ablauf der Frist eingelegt werden. Fällt das Ende der Frist auf einen Sonnabend, einen Sonntag oder einen allgemeinen Feiertag, endet die Frist mit Ablauf des nächsten Werktages. Der Widerspruch ist zu unterzeichnen. Eine Begründung des Widerspruchs ist nicht vorgeschrieben."
    },
    {
      "date": "2025-04-07",
      "id": "105851",
      "original_text": "Registerbekanntmachung nach dem Umwandlungsgesetz\nNordrhein-Westfalen Amtsgericht Neuss HRB 19715\nPraxi Partners GP GmbH – Meerbusch",
      "type": "Registerbekanntmachung nach dem Umwandlungsgesetz",
      "state": "Nordrhein-Westfalen",
      "amtsgericht": "Amtsgericht Neuss",
      "registernummer": "HRB 19715",
      "registerart": "HRB",
      "company_name": "Praxi Partners GP GmbH",
      "company_seat": "Meerbusch",
      "details": "07.04.2025 (Bekanntmachungsdatum)\n\nNordrhein-Westfalen Amtsgericht Neuss HRB 19715\nRegisterbekanntmachung nach dem Umwandlungsgesetz 07.04.2025 (Eintragungsdatum)\n\nPraxi Partners GP GmbH\nGesellschaft mit beschränkter Haftung\nMeerbusch\n\nDen Gläubigern der an der Verschmelzung beteiligten Rechtsträger ist, wenn sie binnen sechs Monaten nach dem Tag, an dem die Eintragung der Verschmelzung in das Register des Sitzes desjenigen Rechtsträgers, dessen Gläubiger sie sind, nach § 19 Absatz 3 UmwG als bekanntgemacht gilt, ihren Anspruch nach Grund und Höhe schriftlich anmelden, Sicherheit zu leisten, soweit sie nicht Befriedigung verlangen können. Dieses Recht steht den Gläubigern jedoch nur zu, wenn sie glaubhaft machen, dass durch die Verschmelzung die Erfüllung ihrer Forderung gefährdet wird."
    },
    {
      "date": "2025-04-07",
      "id": "105852",
      "original_text": "Löschungsankündigung\nNordrhein-Westfalen Amtsgericht Dortmund HRB 28878\nJumbo Sauna UG (haftungsbeschränkt) – Dortmund",
      "type": "Löschungsankündigung",
      "state": "Nordrhein-Westfalen",
      "amtsgericht": "Amtsgericht Dortmund",
      "registernummer": "HRB 28878",
      "registerart": "HRB",
      "company_name": "Jumbo Sauna UG (haftungsbeschränkt)",
      "company_seat": "Dortmund",
      "details": "07.04.2025 (Bekanntmachungsdatum)\n\nNordrhein-Westfalen Amtsgericht Dortmund HRB 28878\nLöschungsankündigung\n\nJumbo Sauna UG (haftungsbeschränkt)\nGesellschaft mit beschränkter Haftung\nDortmund\n\nDas Registergericht beabsichtigt die Gesellschaft von Amts wegen nach § 394 FamFG zu löschen. Die Frist zur Erhebung eines Widerspruchs ist auf zwei Monate festgesetzt."
    },
    {
      "date": "2025-04-07",
      "id": "105853",
      "original_text": "Einreichung neuer Dokumente\nNordrhein-Westfalen Amtsgericht Münster HRB 13857\nDeutsches Rotes Kreuz Münster gemeinnützige Pflege und Service GmbH – Münster",
      "type": "Einreichung neuer Dokumente",
      "state": "Nordrhein-Westfalen",
      "amtsgericht": "Amtsgericht Münster",
      "registernummer": "HRB 13857",
      "registerart": "HRB",
      "company_name": "Deutsches Rotes Kreuz Münster gemeinnützige Pflege und Service GmbH",
      "company_seat": "Münster",
      "details": "07.04.2025 (Bekanntmachungsdatum)\n\nNordrhein-Westfalen Amtsgericht Münster HRB 13857\nEinreichung neuer Dokumente\n\nDeutsches Rotes Kreuz Münster gemeinnützige Pflege und Service GmbH\nGesellschaft mit beschränkter Haftung\nMünster\n\nDem Registergericht ist eine neue Liste der Mitglieder des Aufsichtsrates eingereicht worden."
    },
    {
      "date": "2025-04-07",
      "id": "105854",
      "original_text": "Löschungsankündigung\nNordrhein-Westfalen Amtsgericht Hamm VR 1182\nAudi Sport Club Lippe e.V. – Hamm",
      "type": "Löschungsankündigung",
      "state": "Nordrhein-Westfalen",
      "amtsgericht": "Amtsgericht Hamm",
      "registernummer": "VR 1182",
      "registerart": "VR",
      "company_name": "Audi Sport Club Lippe e.V.",
      "company_seat": "Hamm",
      "details": "07.04.2025 (Bekanntmachungsdatum)\n\nNordrhein-Westfalen Amtsgericht Hamm VR 1182\nLöschungsankündigung\n\nAudi Sport Club Lippe e.V.\neingetragener Verein\nHamm\n\nDas Registergericht beabsichtigt, den im Vereinsregister eingetragenen Verein von Amts wegen zu löschen, da der Verein keine Mitglieder mehr hat und der Vereinszweck seit Jahren nicht mehr verfolgt wird.\nGegen diese Verfügung kann Widerspruch eingelegt werden. Die Frist zur Erhebung eines Widerspruchs gegen die beabsichtigte Löschung von Amts wegen ist auf einen Monat festgesetzt."
    },
    {
      "date": "2025-04-07",
      "id": "105855",
      "original_text": "Registerbekanntmachung nach dem Umwandlungsgesetz\nNordrhein-Westfalen Amtsgericht Köln HRB 26718\nHEISOFT Publishing Aktiengesellschaft – Köln",
      "type": "Registerbekanntmachung nach dem Umwandlungsgesetz",
      "state": "Nordrhein-Westfalen",
      "amtsgericht": "Amtsgericht Köln",
      "registernummer": "HRB 26718",
      "registerart": "HRB",
      "company_name": "HEISOFT Publishing Aktiengesellschaft",
      "company_seat": "Köln",
      "details": "07.04.2025 (Bekanntmachungsdatum)\n\nNordrhein-Westfalen Amtsgericht Köln HRB 26718\nRegisterbekanntmachung nach dem Umwandlungsgesetz 07.04.2025 (Eintragungsdatum)\n\nHEISOFT Publishing Aktiengesellschaft\nAktiengesellschaft\nKöln\n\nDen Gläubigern der an der Verschmelzung beteiligten Rechtsträger ist, wenn sie binnen sechs Monaten nach dem Tag, an dem die Eintragung der Verschmelzung in das Register des Sitzes desjenigen Rechtsträgers, dessen Gläubiger sie sind, nach § 19 Absatz 3 UmwG als bekanntgemacht gilt, ihren Anspruch nach Grund und Höhe schriftlich anmelden, Sicherheit zu leisten, soweit sie nicht Befriedigung verlangen können. Dieses Recht steht den Gläubigern jedoch nur zu, wenn sie glaubhaft machen, dass durch die Verschmelzung die Erfüllung ihrer Forderung gefährdet wird."
    },
    {
      "date": "2025-04-07",
      "id": "105856",
      "original_text": "Registerbekanntmachung nach dem Umwandlungsgesetz\nNordrhein-Westfalen Amtsgericht Köln HRB 30583\ndotcomCapital GmbH – Köln",
      "type": "Registerbekanntmachung nach dem Umwandlungsgesetz",
      "state": "Nordrhein-Westfalen",
      "amtsgericht": "Amtsgericht Köln",
      "registernummer": "HRB 30583",
      "registerart": "HRB",
      "company_name": "dotcomCapital GmbH",
      "company_seat": "Köln",
      "details": "07.04.2025 (Bekanntmachungsdatum)\n\nNordrhein-Westfalen Amtsgericht Köln HRB 30583\nRegisterbekanntmachung nach dem Umwandlungsgesetz 07.04.2025 (Eintragungsdatum)\n\ndotcomCapital GmbH\nGesellschaft mit beschränkter Haftung\nKöln\n\nDen Gläubigern der an der Verschmelzung beteiligten Rechtsträger ist, wenn sie binnen sechs Monaten nach dem Tag, an dem die Eintragung der Verschmelzung in das Register des Sitzes desjenigen Rechtsträgers, dessen Gläubiger sie sind, nach § 19 Absatz 3 UmwG als bekanntgemacht gilt, ihren Anspruch nach Grund und Höhe schriftlich anmelden, Sicherheit zu leisten, soweit sie nicht Befriedigung verlangen können. Dieses Recht steht den Gläubigern jedoch nur zu, wenn sie glaubhaft machen, dass durch die Verschmelzung die Erfüllung ihrer Forderung gefährdet wird."
    },
    {
      "date": "2025-04-07",
      "id": "105857",
      "original_text": "Löschungsankündigung\nNordrhein-Westfalen Amtsgericht Köln HRB 88507\nB & D Vermögensverwaltung GmbH – Köln",
      "type": "Löschungsankündigung",
      "state": "Nordrhein-Westfalen",
      "amtsgericht": "Amtsgericht Köln",
      "registernummer": "HRB 88507",
      "registerart": "HRB",
      "company_name": "B & D Vermögensverwaltung GmbH",
      "company_seat": "Köln",
      "details": "07.04.2025 (Bekanntmachungsdatum)\n\nNordrhein-Westfalen Amtsgericht Köln HRB 88507\nLöschungsankündigung\n\nB & D Vermögensverwaltung GmbH\nGesellschaft mit beschränkter Haftung\nKöln\n\nDas Registergericht beabsichtigt die Gesellschaft von Amts wegen nach § 394 FamFG zu löschen. Die Frist zur Erhebung eines Widerspruchs ist auf einen Monat festgesetzt."
    },
    {
      "date": "2025-04-07",
      "id": "105858",
      "original_text": "Einreichung neuer Dokumente\nNordrhein-Westfalen Amtsgericht Bonn HRB 15251\nBWI GmbH – Meckenheim",
      "type": "Einreichung neuer Dokumente",
      "state": "Nordrhein-Westfalen",
      "amtsgericht": "Amtsgericht Bonn",
      "registernummer": "HRB 15251",
      "registerart": "HRB",
      "company_name": "BWI GmbH",
      "company_seat": "Meckenheim",
      "details": "07.04.2025 (Bekanntmachungsdatum)\n\nNordrhein-Westfalen Amtsgericht Bonn HRB 15251\nEinreichung neuer Dokumente 07.04.2025 (Eintragungsdatum)\n\nBWI GmbH\nGesellschaft mit beschränkter Haftung\nMeckenheim\n\nDem Registergericht ist eine neue Liste der Mitglieder des Aufsichtsrates eingereicht worden."
    },
    {
      "date": "2025-04-07",
      "id": "105859",
      "original_text": "Einreichung neuer Dokumente\nNordrhein-Westfalen Amtsgericht Köln HRB 71218\nZESAR - Zentrale Stelle zur Abrechnung von Arzneimittelrabatten GmbH – Köln",
      "type": "Einreichung neuer Dokumente",
      "state": "Nordrhein-Westfalen",
      "amtsgericht": "Amtsgericht Köln",
      "registernummer": "HRB 71218",
      "registerart": "HRB",
      "company_name": "ZESAR - Zentrale Stelle zur Abrechnung von Arzneimittelrabatten GmbH",
      "company_seat": "Köln",
      "details": "07.04.2025 (Bekanntmachungsdatum)\n\nNordrhein-Westfalen Amtsgericht Köln HRB 71218\nEinreichung neuer Dokumente\n\nZESAR - Zentrale Stelle zur Abrechnung von Arzneimittelrabatten GmbH\nGesellschaft mit beschränkter Haftung\nKöln\n\nDem Registergericht ist eine Liste der Mitglieder des Aufsichtsrates eingereicht worden."
    },
    {
      "date": "2025-04-07",
      "id": "105860",
      "original_text": "Einreichung neuer Dokumente\nNordrhein-Westfalen Amtsgericht Düren HRB 6501\nOBSESSION AG – Düren",
      "type": "Einreichung neuer Dokumente",
      "state": "Nordrhein-Westfalen",
      "amtsgericht": "Amtsgericht Düren",
      "registernummer": "HRB 6501",
      "registerart": "HRB",
      "company_name": "OBSESSION AG",
      "company_seat": "Düren",
      "details": "07.04.2025 (Bekanntmachungsdatum)\n\nNordrhein-Westfalen Amtsgericht Düren HRB 6501\nEinreichung neuer Dokumente 07.04.2025 (Eintragungsdatum)\n\nOBSESSION AG\nAktiengesellschaft\nDüren\n\nDem Registergericht ist eine neue Liste der Mitglieder des Aufsichtsrates eingereicht worden."
    },
    {
      "date": "2025-04-07",
      "id": "105861",
      "original_text": "Löschungsankündigung\nNordrhein-Westfalen Amtsgericht Recklinghausen VR 2719\nRettungshundestaffel Westfälische Bucht e.V. – Recklinghausen",
      "type": "Löschungsankündigung",
      "state": "Nordrhein-Westfalen",
      "amtsgericht": "Amtsgericht Recklinghausen",
      "registernummer": "VR 2719",
      "registerart": "VR",
      "company_name": "Rettungshundestaffel Westfälische Bucht e.V.",
      "company_seat": "Recklinghausen",
      "details": "07.04.2025 (Bekanntmachungsdatum)\n\nNordrhein-Westfalen Amtsgericht Recklinghausen VR 2719\nLöschungsankündigung\n\nRettungshundestaffel Westfälische Bucht e.V.\neingetragener Verein\nRecklinghausen\n\nDas Registergericht beabsichtigt, den im Vereinsregister eingetragenen Verein gemäß § 4 Abs. 2 VRV von Amts wegen zu löschen.\n\nGegen diese Verfügung kann Widerspruch eingelegt werden. Die Frist zur Erhebung eines Widerspruchs gegen die beabsichtigte Löschung von Amts wegen ist auf einen Monat festgesetzt."
    },
    {
      "date": "2025-04-07",
      "id": "105862",
      "original_text": "Löschungsankündigung\nNordrhein-Westfalen Amtsgericht Dortmund HRB 24895\nD. M. Trans UG (haftungsbeschränkt) – Dortmund",
      "type": "Löschungsankündigung",
      "state": "Nordrhein-Westfalen",
      "amtsgericht": "Amtsgericht Dortmund",
      "registernummer": "HRB 24895",
      "registerart": "HRB",
      "company_name": "D. M. Trans UG (haftungsbeschränkt)",
      "company_seat": "Dortmund",
      "details": "07.04.2025 (Bekanntmachungsdatum)\n\nNordrhein-Westfalen Amtsgericht Dortmund HRB 24895\nLöschungsankündigung\n\nD. M. Trans UG (haftungsbeschränkt)\nGesellschaft mit beschränkter Haftung\nDortmund\n\nDas Registergericht beabsichtigt die Gesellschaft von Amts wegen nach § 394 FamFG zu löschen. Die Frist zur Erhebung eines Widerspruchs ist auf zwei Monate festgesetzt."
    },
    {
      "date": "2025-04-07",
      "id": "105863",
      "original_text": "Löschungsankündigung\nNordrhein-Westfalen Amtsgericht Bielefeld HRB 42621\nMHK Bau Dienstleistungen GmbH – Bielefeld",
      "type": "Löschungsankündigung",
      "state": "Nordrhein-Westfalen",
      "amtsgericht": "Amtsgericht Bielefeld",
      "registernummer": "HRB 42621",
      "registerart": "HRB",
      "company_name": "MHK Bau Dienstleistungen GmbH",
      "company_seat": "Bielefeld",
      "details": "07.04.2025 (Bekanntmachungsdatum)\n\nNordrhein-Westfalen Amtsgericht Bielefeld HRB 42621\nLöschungsankündigung 02.04.2025 (Eintragungsdatum)\n\nMHK Bau Dienstleistungen GmbH\nGesellschaft mit beschränkter Haftung\nBielefeld\n\nDas Registergericht beabsichtigt die Gesellschaft von Amts wegen nach § 394 Abs. 1 FamFG zu löschen. Die Frist zur Erhebung eines Widerspruchs ist auf 6 Wochen festgesetzt."
    },
    {
      "date": "2025-04-07",
      "id": "105864",
      "original_text": "Einreichung neuer Dokumente\nThüringen Amtsgericht Jena HRB 519308\nEVA AG – Jena",
      "type": "Einreichung neuer Dokumente",
      "state": "Thüringen",
      "amtsgericht": "Amtsgericht Jena",
      "registernummer": "HRB 519308",
      "registerart": "HRB",
      "company_name": "EVA AG",
      "company_seat": "Jena",
      "details": "07.04.2025 (Bekanntmachungsdatum)\n\nThüringen Amtsgericht Jena HRB 519308\nEinreichung neuer Dokumente 07.04.2025 (Eintragungsdatum)\n\nEVA AG\nAktiengesellschaft\nJena\n\nBekanntmachung gem. § 106 AktG: Aufgrund einer Veränderung in den Personen der Aufsichtsratsmitglieder ist durch den Vorstand eine neue Liste zum Handelsregister eingereicht worden."
    },
    {
      "date": "2025-04-07",
      "id": "105865",
      "original_text": "Einreichung neuer Dokumente\nThüringen Amtsgericht Jena HRB 512513\nGVB Verkehrs- und Betriebsgesellschaft Gera mbH – Gera",
      "type": "Einreichung neuer Dokumente",
      "state": "Thüringen",
      "amtsgericht": "Amtsgericht Jena",
      "registernummer": "HRB 512513",
      "registerart": "HRB",
      "company_name": "GVB Verkehrs- und Betriebsgesellschaft Gera mbH",
      "company_seat": "Gera",
      "details": "07.04.2025 (Bekanntmachungsdatum)\n\nThüringen Amtsgericht Jena HRB 512513\nEinreichung neuer Dokumente 07.04.2025 (Eintragungsdatum)\n\nGVB Verkehrs- und Betriebsgesellschaft Gera mbH\nGesellschaft mit beschränkter Haftung\nGera\n\nBekanntmachung gem. § 52 Abs. 3 Satz 2 GmbHG: Aufgrund einer Veränderung in den Personen der Aufsichtsratsmitglieder ist durch die Geschäftsführer eine neue Liste zum Handelsregister eingereicht worden."
    },
    {
      "date": "2025-04-07",
      "id": "105866",
      "original_text": "Einreichung neuer Dokumente\nThüringen Amtsgericht Jena HRB 203449\nErnst-Abbe-Siedlung GmbH – Jena",
      "type": "Einreichung neuer Dokumente",
      "state": "Thüringen",
      "amtsgericht": "Amtsgericht Jena",
      "registernummer": "HRB 203449",
      "registerart": "HRB",
      "company_name": "Ernst-Abbe-Siedlung GmbH",
      "company_seat": "Jena",
      "details": "07.04.2025 (Bekanntmachungsdatum)\n\nThüringen Amtsgericht Jena HRB 203449\nEinreichung neuer Dokumente 02.01.2025 (Eintragungsdatum)\n\nErnst-Abbe-Siedlung GmbH\nGesellschaft mit beschränkter Haftung\nJena\n\nBekanntmachung gem. § 52 Abs. 3 Satz 2 GmbHG: Aufgrund einer Veränderung in den Personen der Aufsichtsratsmitglieder ist durch die Geschäftsführer eine neue Liste zum Handelsregister eingereicht worden."
    },
    {
      "date": "2025-04-07",
      "id": "105867",
      "original_text": "Registerbekanntmachung nach dem Umwandlungsgesetz\nThüringen Amtsgericht Jena HRB 111564\nBVT - Betonpumpen-Vermietung- und Verwaltungs-GmbH – Drei Gleichen",
      "type": "Registerbekanntmachung nach dem Umwandlungsgesetz",
      "state": "Thüringen",
      "amtsgericht": "Amtsgericht Jena",
      "registernummer": "HRB 111564",
      "registerart": "HRB",
      "company_name": "BVT - Betonpumpen-Vermietung- und Verwaltungs-GmbH",
      "company_seat": "Drei Gleichen",
      "details": "07.04.2025 (Bekanntmachungsdatum)\n\nThüringen Amtsgericht Jena HRB 111564\nRegisterbekanntmachung nach dem Umwandlungsgesetz 07.04.2025 (Eintragungsdatum)\n\nBVT - Betonpumpen-Vermietung- und Verwaltungs-GmbH\nGesellschaft mit beschränkter Haftung\nDrei Gleichen\n\nNicht eingetragen: Den Gläubigern der an der Verschmelzung beteiligten Rechtsträger, ist wenn sie binnen sechs Monaten nach dem Tag, an dem die Eintragung der Verschmelzung in das Register des Sitzes desjenigen Rechtsträgers, dessen Gläubiger sie sind,  nach § 19 Abs. 3 UmwG als bekanntgemacht gilt, ihren Anspruch nach Grund und Höhe schriftlich anmelden, Sicherheit zu leisten, soweit sie nicht Befriedigung verlangen können. Dieses Recht steht ihnen jedoch nur zu, wenn sie glaubhaft machen, daß durch die Verschmelzung die Erfüllung ihrer Forderung gefährdet wird."
    },
    {
      "date": "2025-04-07",
      "id": "105868",
      "original_text": "Registerbekanntmachung nach dem Umwandlungsgesetz\nBrandenburg Amtsgericht Frankfurt/Oder HRB 12670\nBüroservice Splinter GmbH – Strausberg",
      "type": "Registerbekanntmachung nach dem Umwandlungsgesetz",
      "state": "Brandenburg",
      "amtsgericht": "Amtsgericht Frankfurt/Oder",
      "registernummer": "HRB 12670",
      "registerart": "HRB",
      "company_name": "Büroservice Splinter GmbH",
      "company_seat": "Strausberg",
      "details": "07.04.2025 (Bekanntmachungsdatum)\n\nBrandenburg Amtsgericht Frankfurt/Oder HRB 12670\nRegisterbekanntmachung nach dem Umwandlungsgesetz 04.04.2025 (Eintragungsdatum)\n\nBüroservice Splinter GmbH\nGesellschaft mit beschränkter Haftung\nStrausberg\n\nZu Eintragungsnummer 6 vom 04.04.2025 wird als nicht eingetragen veröffentlicht: Den Gläubigern der an der Verschmelzung beteiligten Rechtsträger ist, wenn sie binnen sechs Monaten nach dem Tag, an dem die Eintragung der Verschmelzung in das Register des Sitzes desjenigen Rechtsträgers, dessen Gläubiger sie sind, als bekannt gemacht gilt, ihren Anspruch nach Grund und Höhe schriftlich anmelden, Sicherheit zu leisten, soweit sie nicht Befriedigung verlangen können. Dieses Recht steht den Gläubigern jedoch nur zu, wenn sie glaubhaft machen, dass durch die Verschmelzung die Erfüllung ihrer Forderung gefährdet wird"
    },
    {
      "date": "2025-04-07",
      "id": "105869",
      "original_text": "Registerbekanntmachung nach dem Umwandlungsgesetz\nSachsen Amtsgericht Dresden VR 14260\nSoziale Projekte Zittau e.V. – Zittau",
      "type": "Registerbekanntmachung nach dem Umwandlungsgesetz",
      "state": "Sachsen",
      "amtsgericht": "Amtsgericht Dresden",
      "registernummer": "VR 14260",
      "registerart": "VR",
      "company_name": "Soziale Projekte Zittau e.V.",
      "company_seat": "Zittau",
      "details": "07.04.2025 (Bekanntmachungsdatum)\n\nSachsen Amtsgericht Dresden VR 14260\nRegisterbekanntmachung nach dem Umwandlungsgesetz 07.04.2025 (Eintragungsdatum)\n\nSoziale Projekte Zittau e.V.\neingetragener Verein\nZittau\n\nDen Gläubigern der an der Verschmelzung beteiligten Rechtsträger ist, wenn sie binnen sechs Monaten nach dem Tag, an dem die Eintragung der Verschmelzung in das Register des Sitzes desjenigen Rechtsträgers, dessen Gläubiger sie sind, nach § 19 Abs. 3 UmwG als bekannt gemacht gilt, ihren Anspruch nach Grund und Höhe in Textform anmelden, Sicherheit zu leisten, soweit sie nicht Befriedigung verlangen können. Dieses Recht steht den Gläubigern jedoch nur zu, wenn sie glaubhaft machen, dass durch die Verschmelzung die Erfüllung der Forderung gefährdet wird. #Ad.AdressartBezeichung"
    },
    {
      "date": "2025-04-07",
      "id": "105870",
      "original_text": "Sonstige Registerbekanntmachung\nSachsen Amtsgericht Leipzig HRB 15106\nSaxonia Media Filmproduktionsgesellschaft mbH – Leipzig",
      "type": "Sonstige Registerbekanntmachung",
      "state": "Sachsen",
      "amtsgericht": "Amtsgericht Leipzig",
      "registernummer": "HRB 15106",
      "registerart": "HRB",
      "company_name": "Saxonia Media Filmproduktionsgesellschaft mbH",
      "company_seat": "Leipzig",
      "details": "07.04.2025 (Bekanntmachungsdatum)\n\nSachsen Amtsgericht Leipzig HRB 15106\nSonstige Registerbekanntmachung\n\nSaxonia Media Filmproduktionsgesellschaft mbH\nGesellschaft mit beschränkter Haftung\nLeipzig\n\nAm 03.04.2025 wurde beim Handelsregister des Amtsgerichts Leipzig die Liste der Mitglieder des Aufsichtsrats gemäß § 52 GmbHG eingereicht."
    },
    {
      "date": "2025-04-07",
      "id": "105871",
      "original_text": "Registerbekanntmachung nach dem Umwandlungsgesetz\nSachsen Amtsgericht Leipzig HRB 29235\nJTS Job-Travel-Solution GmbH – Leipzig",
      "type": "Registerbekanntmachung nach dem Umwandlungsgesetz",
      "state": "Sachsen",
      "amtsgericht": "Amtsgericht Leipzig",
      "registernummer": "HRB 29235",
      "registerart": "HRB",
      "company_name": "JTS Job-Travel-Solution GmbH",
      "company_seat": "Leipzig",
      "details": "07.04.2025 (Bekanntmachungsdatum)\n\nSachsen Amtsgericht Leipzig HRB 29235\nRegisterbekanntmachung nach dem Umwandlungsgesetz 07.04.2025 (Eintragungsdatum)\n\nJTS Job-Travel-Solution GmbH\nGesellschaft mit beschränkter Haftung\nLeipzig\n\nDen Gläubigern der an der Verschmelzung beteiligten Rechtsträger ist, wenn sie binnen sechs Monaten nach dem Tag, an dem die Eintragung der Verschmelzung in das Register des Sitzes desjenigen Rechtsträgers, dessen Gläubiger sie sind, nach § 19 Abs. 3 UmwG als bekannt gemacht gilt, ihren Anspruch nach Grund und Höhe in Textform anmelden, Sicherheit zu leisten, soweit sie nicht Befriedigung verlangen können. Dieses Recht steht den Gläubigern jedoch nur zu, wenn sie glaubhaft machen, dass durch die Verschmelzung die Erfüllung der Forderung gefährdet wird."
    },
    {
      "date": "2025-04-07",
      "id": "105872",
      "original_text": "Registerbekanntmachung nach dem Umwandlungsgesetz\nBrandenburg Amtsgericht Frankfurt/Oder HRA 4470\nyounited e.K. – Woltersdorf",
      "type": "Registerbekanntmachung nach dem Umwandlungsgesetz",
      "state": "Brandenburg",
      "amtsgericht": "Amtsgericht Frankfurt/Oder",
      "registernummer": "HRA 4470",
      "registerart": "HRA",
      "company_name": "younited e.K.",
      "company_seat": "Woltersdorf",
      "details": "07.04.2025 (Bekanntmachungsdatum)\n\nBrandenburg Amtsgericht Frankfurt/Oder HRA 4470\nRegisterbekanntmachung nach dem Umwandlungsgesetz 04.04.2025 (Eintragungsdatum)\n\nyounited e.K.\nEinzelkaufmann / Einzelkauffrau\nWoltersdorf\n\nAls nicht eingetragen wird veröffentlicht:\nDen Gläubigern der an der Umwandlung (Ausgliederung) beteiligten Rechtsträger ist, wenn sie binnen sechs Monaten nach dem Tag, an dem die Eintragung der Umwandlung (Ausgliederung) in das Register des Sitzes desjenigen Rechtsträgers, dessen Gläubiger sie sind, als bekannt gemacht gilt, ihren Anspruch nach Grund und Höhe schriftlich anmelden, Sicherheit zu leisten, soweit sie nicht Befriedigung verlangen können. Dieses Recht steht den Gläubigern jedoch nur zu, wenn sie glaubhaft machen, dass durch die Umwandlung (Ausgliederung) die Erfüllung ihrer Forderung gefährdet wird"
    },
    {
      "date": "2025-04-07",
      "id": "105873",
      "original_text": "Löschungsankündigung\nHessen Amtsgericht Wiesbaden HRB 27149\nconlux GmbH – Wiesbaden",
      "type": "Löschungsankündigung",
      "state": "Hessen",
      "amtsgericht": "Amtsgericht Wiesbaden",
      "registernummer": "HRB 27149",
      "registerart": "HRB",
      "company_name": "conlux GmbH",
      "company_seat": "Wiesbaden",
      "details": "07.04.2025 (Bekanntmachungsdatum)\n\nHessen Amtsgericht Wiesbaden HRB 27149\nLöschungsankündigung\n\nconlux GmbH\nGesellschaft mit beschränkter Haftung\nWiesbaden\n\nDas Registergericht beabsichtigt die im Handelsregister eingetragene Gesellschaft von Amts wegen nach § 394 FamFG zu löschen. Die Frist zur Erhebung eines Widerspruchs gegen die beabsichtigte Löschung wird auf 3 Monate festgesetzt."
    },
    {
      "date": "2025-04-07",
      "id": "105874",
      "original_text": "Sonstige Registerbekanntmachung\nHessen Amtsgericht Limburg VR 1804\nFreunde historischer Feuerwehr-Fahrzeuge Gaudernbach – Weilburg-Gaudernbach",
      "type": "Sonstige Registerbekanntmachung",
      "state": "Hessen",
      "amtsgericht": "Amtsgericht Limburg",
      "registernummer": "VR 1804",
      "registerart": "VR",
      "company_name": "Freunde historischer Feuerwehr-Fahrzeuge Gaudernbach",
      "company_seat": "Weilburg-Gaudernbach",
      "details": "07.04.2025 (Bekanntmachungsdatum)\n\nHessen Amtsgericht Limburg VR 1804\nSonstige Registerbekanntmachung 07.04.2025 (Eintragungsdatum)\n\nFreunde historischer Feuerwehr-Fahrzeuge Gaudernbach\neingetragener Verein\nWeilburg-Gaudernbach\n\nDer Verein ist aufgelöst."
    },
    {
      "date": "2025-04-07",
      "id": "105875",
      "original_text": "Löschungsankündigung\nHessen Amtsgericht Offenbach am Main HRB 53248\nNIZA Schaden & Sanierung GmbH – Offenbach am Main",
      "type": "Löschungsankündigung",
      "state": "Hessen",
      "amtsgericht": "Amtsgericht Offenbach am Main",
      "registernummer": "HRB 53248",
      "registerart": "HRB",
      "company_name": "NIZA Schaden & Sanierung GmbH",
      "company_seat": "Offenbach am Main",
      "details": "07.04.2025 (Bekanntmachungsdatum)\n\nHessen Amtsgericht Offenbach am Main HRB 53248\nLöschungsankündigung\n\nNIZA Schaden & Sanierung GmbH\nGesellschaft mit beschränkter Haftung\nOffenbach am Main\n\nDas Registergericht beabsichtigt die im Handelsregister eingetragene Gesellschaft von Amts wegen nach § 394 FamFG zu löschen. Die Frist zur Erhebung eines Widerspruchs gegen die beabsichtigte Löschung wird auf 3 Monate festgesetzt."
    },
    {
      "date": "2025-04-07",
      "id": "105876",
      "original_text": "Einreichung neuer Dokumente\nHessen Amtsgericht Offenbach am Main HRB 4593\nEnergieversorgung Offenbach Aktiengesellschaft – Offenbach am Main",
      "type": "Einreichung neuer Dokumente",
      "state": "Hessen",
      "amtsgericht": "Amtsgericht Offenbach am Main",
      "registernummer": "HRB 4593",
      "registerart": "HRB",
      "company_name": "Energieversorgung Offenbach Aktiengesellschaft",
      "company_seat": "Offenbach am Main",
      "details": "07.04.2025 (Bekanntmachungsdatum)\n\nHessen Amtsgericht Offenbach am Main HRB 4593\nEinreichung neuer Dokumente\n\nEnergieversorgung Offenbach Aktiengesellschaft\nAktiengesellschaft\nOffenbach am Main\n\nDurch eine Änderung in den Personen der Aufsichtsratsmitglieder ist eine Liste der Mitglieder des Aufsichtsrates zum Handelsregister eingereicht worden."
    },
    {
      "date": "2025-04-07",
      "id": "105877",
      "original_text": "Löschungsankündigung\nHessen Amtsgericht Offenbach am Main HRB 7888\nTechnik Consult GmbH Ingenieurbüro – Offenbach am Main",
      "type": "Löschungsankündigung",
      "state": "Hessen",
      "amtsgericht": "Amtsgericht Offenbach am Main",
      "registernummer": "HRB 7888",
      "registerart": "HRB",
      "company_name": "Technik Consult GmbH Ingenieurbüro",
      "company_seat": "Offenbach am Main",
      "details": "07.04.2025 (Bekanntmachungsdatum)\n\nHessen Amtsgericht Offenbach am Main HRB 7888\nLöschungsankündigung\n\nTechnik Consult GmbH Ingenieurbüro\nGesellschaft mit beschränkter Haftung\nOffenbach am Main\n\nDas Registergericht beabsichtigt die im Handelsregister eingetragene Gesellschaft von Amts wegen nach § 394 FamFG zu löschen. Die Frist zur Erhebung eines Widerspruchs gegen die beabsichtigte Löschung wird auf 3 Monate festgesetzt."
    },
    {
      "date": "2025-04-07",
      "id": "105878",
      "original_text": "Löschungsankündigung\nHessen Amtsgericht Frankfurt am Main HRB 98176\nAyaz GmbH – Frankfurt am Main",
      "type": "Löschungsankündigung",
      "state": "Hessen",
      "amtsgericht": "Amtsgericht Frankfurt am Main",
      "registernummer": "HRB 98176",
      "registerart": "HRB",
      "company_name": "Ayaz GmbH",
      "company_seat": "Frankfurt am Main",
      "details": "07.04.2025 (Bekanntmachungsdatum)\n\nHessen Amtsgericht Frankfurt am Main HRB 98176\nLöschungsankündigung\n\nAyaz GmbH\nGesellschaft mit beschränkter Haftung\nFrankfurt am Main\n\nDas Registergericht beabsichtigt die im Handelsregister eingetragene Gesellschaft von Amts wegen nach § 394 FamFG zu löschen. Hiergegen kann innerhalb eines Zeitraums von einem Monat nach dieser Veröffentlichung Widerspruch bei dem Amtsgericht Frankfurt am Main eingelegt werden."
    },
    {
      "date": "2025-04-07",
      "id": "105879",
      "original_text": "Einreichung neuer Dokumente\nHessen Amtsgericht Frankfurt am Main HRB 8427\nINDUSTRIA Immobilien GmbH – Frankfurt am Main",
      "type": "Einreichung neuer Dokumente",
      "state": "Hessen",
      "amtsgericht": "Amtsgericht Frankfurt am Main",
      "registernummer": "HRB 8427",
      "registerart": "HRB",
      "company_name": "INDUSTRIA Immobilien GmbH",
      "company_seat": "Frankfurt am Main",
      "details": "07.04.2025 (Bekanntmachungsdatum)\n\nHessen Amtsgericht Frankfurt am Main HRB 8427\nEinreichung neuer Dokumente\n\nINDUSTRIA Immobilien GmbH\nGesellschaft mit beschränkter Haftung\nFrankfurt am Main\n\nDurch eine Änderung in den Personen der Aufsichtsratsmitglieder ist eine Liste der Mitglieder des Aufsichtsrates zum Handelsregister eingereicht worden."
    },
    {
      "date": "2025-04-07",
      "id": "105880",
      "original_text": "Einreichung neuer Dokumente\nHessen Amtsgericht Frankfurt am Main HRB 88301\nCitigroup Global Markets Europe AG – Frankfurt am Main",
      "type": "Einreichung neuer Dokumente",
      "state": "Hessen",
      "amtsgericht": "Amtsgericht Frankfurt am Main",
      "registernummer": "HRB 88301",
      "registerart": "HRB",
      "company_name": "Citigroup Global Markets Europe AG",
      "company_seat": "Frankfurt am Main",
      "details": "07.04.2025 (Bekanntmachungsdatum)\n\nHessen Amtsgericht Frankfurt am Main HRB 88301\nEinreichung neuer Dokumente 02.04.2025 (Eintragungsdatum)\n\nCitigroup Global Markets Europe AG\nAktiengesellschaft\nFrankfurt am Main\n\nDurch eine Änderung in den Personen der Aufsichtsratsmitglieder ist eine Liste der Mitglieder des Aufsichtsrates zum Handelsregister eingereicht worden."
    },
    {
      "date": "2025-04-07",
      "id": "105881",
      "original_text": "Einreichung neuer Dokumente\nHessen Amtsgericht Frankfurt am Main HRB 85331\nDeutsche Bildung AG – Frankfurt am Main",
      "type": "Einreichung neuer Dokumente",
      "state": "Hessen",
      "amtsgericht": "Amtsgericht Frankfurt am Main",
      "registernummer": "HRB 85331",
      "registerart": "HRB",
      "company_name": "Deutsche Bildung AG",
      "company_seat": "Frankfurt am Main",
      "details": "07.04.2025 (Bekanntmachungsdatum)\n\nHessen Amtsgericht Frankfurt am Main HRB 85331\nEinreichung neuer Dokumente\n\nDeutsche Bildung AG\nAktiengesellschaft\nFrankfurt am Main\n\nDurch eine Änderung in den Personen der Aufsichtsratsmitglieder ist eine Liste der Mitglieder des Aufsichtsrates zum Handelsregister eingereicht worden."
    },
    {
      "date": "2025-04-07",
      "id": "105882",
      "original_text": "Löschungsankündigung\nHessen Amtsgericht Frankfurt am Main HRB 121578\nAll Elite Service GmbH – Frankfurt am Main",
      "type": "Löschungsankündigung",
      "state": "Hessen",
      "amtsgericht": "Amtsgericht Frankfurt am Main",
      "registernummer": "HRB 121578",
      "registerart": "HRB",
      "company_name": "All Elite Service GmbH",
      "company_seat": "Frankfurt am Main",
      "details": "07.04.2025 (Bekanntmachungsdatum)\n\nHessen Amtsgericht Frankfurt am Main HRB 121578\nLöschungsankündigung\n\nAll Elite Service GmbH\nGesellschaft mit beschränkter Haftung\nFrankfurt am Main\n\nDas Registergericht beabsichtigt die im Handelsregister eingetragene Gesellschaft von Amts wegen nach § 394 FamFG zu löschen. Die Frist zur Erhebung eines Widerspruchs gegen die beabsichtigte Löschung wird auf 1 Monat festgesetzt."
    },
    {
      "date": "2025-04-07",
      "id": "105883",
      "original_text": "Löschungsankündigung\nHessen Amtsgericht Frankfurt am Main HRB 75215\nedv2001 ltd – Frankfurt am Main",
      "type": "Löschungsankündigung",
      "state": "Hessen",
      "amtsgericht": "Amtsgericht Frankfurt am Main",
      "registernummer": "HRB 75215",
      "registerart": "HRB",
      "company_name": "edv2001 ltd",
      "company_seat": "Frankfurt am Main",
      "details": "07.04.2025 (Bekanntmachungsdatum)\n\nHessen Amtsgericht Frankfurt am Main HRB 75215\nLöschungsankündigung 07.04.2025 (Eintragungsdatum)\n\nedv2001 ltd\nRechtsform ausländischen Rechts HRB\nFrankfurt am Main\n\nDas Registergericht beabsichtigt die im Handelsregister eingetragene Zweigniederlassung von Amts wegen nach § 395 FamFG zu löschen. Die Frist zur Erhebung eines Widerspruchs gegen die beabsichtigte Löschung wird auf 1 Monat festgesetzt."
    },
    {
      "date": "2025-04-07",
      "id": "105884",
      "original_text": "Löschungsankündigung\nHessen Amtsgericht Frankfurt am Main HRB 107933\nGCG United Trading GmbH – Frankfurt am Main",
      "type": "Löschungsankündigung",
      "state": "Hessen",
      "amtsgericht": "Amtsgericht Frankfurt am Main",
      "registernummer": "HRB 107933",
      "registerart": "HRB",
      "company_name": "GCG United Trading GmbH",
      "company_seat": "Frankfurt am Main",
      "details": "07.04.2025 (Bekanntmachungsdatum)\n\nHessen Amtsgericht Frankfurt am Main HRB 107933\nLöschungsankündigung\n\nGCG United Trading GmbH\nGesellschaft mit beschränkter Haftung\nFrankfurt am Main\n\nDas Registergericht beabsichtigt die im Handelsregister eingetragene Gesellschaft von Amts wegen nach § 394 FamFG zu löschen. Die Frist zur Erhebung eines Widerspruchs gegen die beabsichtigte Löschung wird auf 1 Monate festgesetzt."
    },
    {
      "date": "2025-04-07",
      "id": "105885",
      "original_text": "Registerbekanntmachung nach dem Umwandlungsgesetz\nHessen Amtsgericht Marburg VR 4422\nMännergesangverein WALDLUST Mellnau 1886 – Wetter-Mellnau",
      "type": "Registerbekanntmachung nach dem Umwandlungsgesetz",
      "state": "Hessen",
      "amtsgericht": "Amtsgericht Marburg",
      "registernummer": "VR 4422",
      "registerart": "VR",
      "company_name": "Männergesangverein WALDLUST Mellnau 1886",
      "company_seat": "Wetter-Mellnau",
      "details": "07.04.2025 (Bekanntmachungsdatum)\n\nHessen Amtsgericht Marburg VR 4422\nRegisterbekanntmachung nach dem Umwandlungsgesetz 07.04.2025 (Eintragungsdatum)\n\nMännergesangverein WALDLUST Mellnau 1886\neingetragener Verein\nWetter-Mellnau\n\nDen Gläubigern der an der Verschmelzung beteiligten Rechtsträger ist, wenn sie binnen sechs Monaten nach dem Tag, an dem die Eintragung der Verschmelzung in das Register des Sitzes desjenigen Rechtsträgers, dessen Gläubiger sie sind, nach § 19 Absatz 3 UmwG bekannt gemacht worden ist, ihren Anspruch nach Grund und Höhe schriftlich anmelden, Sicherheit zu leisten, soweit sie nicht Befriedigung verlangen können. Dieses Recht steht den Gläubigern jedoch nur zu, wenn sie glaubhaft machen, dass durch die Verschmelzung die Erfüllung ihrer Forderung gefährdet wird."
    },
    {
      "date": "2025-04-07",
      "id": "105886",
      "original_text": "Registerbekanntmachung nach dem Umwandlungsgesetz\nHessen Amtsgericht Marburg VR 1962\nMännergesangverein MGV 1872 Oberrosphe – Oberrosphe",
      "type": "Registerbekanntmachung nach dem Umwandlungsgesetz",
      "state": "Hessen",
      "amtsgericht": "Amtsgericht Marburg",
      "registernummer": "VR 1962",
      "registerart": "VR",
      "company_name": "Männergesangverein MGV 1872 Oberrosphe",
      "company_seat": "Oberrosphe",
      "details": "07.04.2025 (Bekanntmachungsdatum)\n\nHessen Amtsgericht Marburg VR 1962\nRegisterbekanntmachung nach dem Umwandlungsgesetz 07.04.2025 (Eintragungsdatum)\n\nMännergesangverein MGV 1872 Oberrosphe\neingetragener Verein\nOberrosphe\n\nDen Gläubigern der an der Verschmelzung beteiligten Rechtsträger ist, wenn sie binnen sechs Monaten nach dem Tag, an dem die Eintragung der Verschmelzung in das Register des Sitzes desjenigen Rechtsträgers, dessen Gläubiger sie sind, nach § 19 Absatz 3 UmwG bekannt gemacht worden ist, ihren Anspruch nach Grund und Höhe schriftlich anmelden, Sicherheit zu leisten, soweit sie nicht Befriedigung verlangen können. Dieses Recht steht den Gläubigern jedoch nur zu, wenn sie glaubhaft machen, dass durch die Verschmelzung die Erfüllung ihrer Forderung gefährdet wird."
    },
    {
      "date": "2025-04-07",
      "id": "105887",
      "original_text": "Registerbekanntmachung nach dem Umwandlungsgesetz\nHessen Amtsgericht Eschwege HRB 3613\nAndanza GmbH – Meinhard",
      "type": "Registerbekanntmachung nach dem Umwandlungsgesetz",
      "state": "Hessen",
      "amtsgericht": "Amtsgericht Eschwege",
      "registernummer": "HRB 3613",
      "registerart": "HRB",
      "company_name": "Andanza GmbH",
      "company_seat": "Meinhard",
      "details": "07.04.2025 (Bekanntmachungsdatum)\n\nHessen Amtsgericht Eschwege HRB 3613\nRegisterbekanntmachung nach dem Umwandlungsgesetz 07.04.2025 (Eintragungsdatum)\n\nAndanza GmbH\nGesellschaft mit beschränkter Haftung\nMeinhard\n\nDen Gläubigern der an der Ausgliederung beteiligten Rechtsträger ist, wenn sie binnen sechs Monaten nach dem Tag, an dem die Eintragung der Ausgliederung in das Register des Sitzes desjenigen Rechtsträgers, dessen Gläubiger sie sind, nach §§ 125, 19 Absatz 3 UmwG bekannt gemacht worden ist, ihren Anspruch nach Grund und Höhe schriftlich anmelden, Sicherheit zu leisten, soweit sie nicht Befriedigung verlangen können. Dieses Recht steht den Gläubigern jedoch nur zu, wenn sie glaubhaft machen, dass durch die Ausgliederung die Erfüllung ihrer Forderung gefährdet wird."
    },
    {
      "date": "2025-04-07",
      "id": "105888",
      "original_text": "Löschungsankündigung\nHessen Amtsgericht Frankfurt am Main HRB 97216\naquanaut24 GmbH – Frankfurt am Main",
      "type": "Löschungsankündigung",
      "state": "Hessen",
      "amtsgericht": "Amtsgericht Frankfurt am Main",
      "registernummer": "HRB 97216",
      "registerart": "HRB",
      "company_name": "aquanaut24 GmbH",
      "company_seat": "Frankfurt am Main",
      "details": "07.04.2025 (Bekanntmachungsdatum)\n\nHessen Amtsgericht Frankfurt am Main HRB 97216\nLöschungsankündigung 07.04.2025 (Eintragungsdatum)\n\naquanaut24 GmbH\nGesellschaft mit beschränkter Haftung\nFrankfurt am Main\n\nDas Registergericht beabsichtigt die im Handelsregister eingetragene Gesellschaft von Amts wegen nach § 394 FamFG zu löschen. Die Frist zur Erhebung eines Widerspruchs gegen die beabsichtigte Löschung wird auf 1 Monat festgesetzt."
    },
    {
      "date": "2025-04-07",
      "id": "105889",
      "original_text": "Löschungsankündigung\nHessen Amtsgericht Hanau HRB 97611\nHashtag Gastro UG (haftungsbeschränkt) – Hanau",
      "type": "Löschungsankündigung",
      "state": "Hessen",
      "amtsgericht": "Amtsgericht Hanau",
      "registernummer": "HRB 97611",
      "registerart": "HRB",
      "company_name": "Hashtag Gastro UG (haftungsbeschränkt)",
      "company_seat": "Hanau",
      "details": "07.04.2025 (Bekanntmachungsdatum)\n\nHessen Amtsgericht Hanau HRB 97611\nLöschungsankündigung\n\nHashtag Gastro UG (haftungsbeschränkt)\nGesellschaft mit beschränkter Haftung\nHanau\n\nDas Registergericht beabsichtigt die im Handelsregister eingetragene Gesellschaft von Amts wegen nach § 394 FamFG zu löschen. Die Frist zur Erhebung eines Widerspruchs gegen die beabsichtigte Löschung wird auf 3 Monate festgesetzt."
    },
    {
      "date": "2025-04-07",
      "id": "105890",
      "original_text": "Löschungsankündigung\nHessen Amtsgericht Wetzlar HRB 6049\nSphära Bau GmbH – Leun",
      "type": "Löschungsankündigung",
      "state": "Hessen",
      "amtsgericht": "Amtsgericht Wetzlar",
      "registernummer": "HRB 6049",
      "registerart": "HRB",
      "company_name": "Sphära Bau GmbH",
      "company_seat": "Leun",
      "details": "07.04.2025 (Bekanntmachungsdatum)\n\nHessen Amtsgericht Wetzlar HRB 6049\nLöschungsankündigung\n\nSphära Bau GmbH\nGesellschaft mit beschränkter Haftung\nLeun\n\nDas Registergericht beabsichtigt die im Handelsregister eingetragene Gesellschaft von Amts wegen nach § 394 FamFG zu löschen. Die Frist zur Erhebung eines Widerspruchs gegen die beabsichtigte Löschung wird auf 3 Monate festgesetzt."
    },
    {
      "date": "2025-04-07",
      "id": "105891",
      "original_text": "Löschungsankündigung\nHessen Amtsgericht Offenbach am Main HRB 51358\nA & Y Baudekoration GmbH – Offenbach am Main",
      "type": "Löschungsankündigung",
      "state": "Hessen",
      "amtsgericht": "Amtsgericht Offenbach am Main",
      "registernummer": "HRB 51358",
      "registerart": "HRB",
      "company_name": "A & Y Baudekoration GmbH",
      "company_seat": "Offenbach am Main",
      "details": "07.04.2025 (Bekanntmachungsdatum)\n\nHessen Amtsgericht Offenbach am Main HRB 51358\nLöschungsankündigung\n\nA & Y Baudekoration GmbH\nGesellschaft mit beschränkter Haftung\nOffenbach am Main\n\nDas Registergericht beabsichtigt die im Handelsregister eingetragene Gesellschaft von Amts wegen nach § 394 FamFG zu löschen. Die Frist zur Erhebung eines Widerspruchs gegen die beabsichtigte Löschung wird auf 3 Monate festgesetzt."
    }
  ]
}