{
  "date": "2025-04-26",
  "date_of_scrape": "2025-05-31T07:03:13.409Z",
  "tool_version": "0.2.0",
  "number_of_announcements": 15,
  "announcements": [
    {
      "date": "2025-04-26",
      "id": "107438",
      "original_text": "Registerbekanntmachung nach dem Umwandlungsgesetz\nBayern Amtsgericht Aschaffenburg HRB 8138\nNMP Neuwirth Medical Products GmbH – Großwallstadt",
      "type": "Registerbekanntmachung nach dem Umwandlungsgesetz",
      "state": "Bayern",
      "amtsgericht": "Amtsgericht Aschaffenburg",
      "registernummer": "HRB 8138",
      "registerart": "HRB",
      "company_name": "NMP Neuwirth Medical Products GmbH",
      "company_seat": "Großwallstadt",
      "details": "26.04.2025 (Bekanntmachungsdatum)\n\nBayern Amtsgericht Aschaffenburg HRB 8138\nRegisterbekanntmachung nach dem Umwandlungsgesetz 25.04.2025 (Eintragungsdatum)\n\nNMP Neuwirth Medical Products GmbH\nGesellschaft mit beschränkter Haftung\nGroßwallstadt\n\nDen Gläubigern der an der Verschmelzung beteiligten Rechtsträger ist, wenn sie binnen sechs Monaten nach dem Tag, an dem die Eintragung der Verschmelzung in das Register des Sitzes desjenigen Rechtsträgers, dessen Gläubiger sie sind, nach § 19 Abs. 3 UmwG als bekannt gemacht gilt, ihren Anspruch nach Grund und Höhe in Textform anmelden, Sicherheit zu leisten, soweit sie nicht Befriedigung verlangen können. Dieses Recht steht den Gläubigern jedoch nur zu, wenn sie glaubhaft machen, dass durch die Verschmelzung die Erfüllung ihrer Forderung gefährdet wird."
    },
    {
      "date": "2025-04-26",
      "id": "107439",
      "original_text": "Registerbekanntmachung nach dem Umwandlungsgesetz\nBayern Amtsgericht München HRB 234379\nGAHM Swarm Beteiligungs UG (haftungsbeschränkt) – München",
      "type": "Registerbekanntmachung nach dem Umwandlungsgesetz",
      "state": "Bayern",
      "amtsgericht": "Amtsgericht München",
      "registernummer": "HRB 234379",
      "registerart": "HRB",
      "company_name": "GAHM Swarm Beteiligungs UG (haftungsbeschränkt)",
      "company_seat": "München",
      "details": "26.04.2025 (Bekanntmachungsdatum)\n\nBayern Amtsgericht München HRB 234379\nRegisterbekanntmachung nach dem Umwandlungsgesetz 25.04.2025 (Eintragungsdatum)\n\nGAHM Swarm Beteiligungs UG (haftungsbeschränkt)\nGesellschaft mit beschränkter Haftung\nMünchen\n\nDen Gläubigern der an der Verschmelzung beteiligten Rechtsträger ist, wenn sie binnen sechs Monaten nach dem Tag, an dem die Eintragung der Verschmelzung in das Register des Sitzes desjenigen Rechtsträgers, dessen Gläubiger sie sind, nach § 19 Abs. 3 UmwG als bekannt gemacht gilt, ihren Anspruch nach Grund und Höhe in Textform anmelden, Sicherheit zu leisten, soweit sie nicht Befriedigung verlangen können. Dieses Recht steht den Gläubigern jedoch nur zu, wenn sie glaubhaft machen, dass durch die Verschmelzung die Erfüllung ihrer Forderung gefährdet wird."
    },
    {
      "date": "2025-04-26",
      "id": "107440",
      "original_text": "Registerbekanntmachung nach dem Umwandlungsgesetz\nBayern Amtsgericht München HRB 169185\nNEUERTITZ Verlag GmbH – Gröbenzell",
      "type": "Registerbekanntmachung nach dem Umwandlungsgesetz",
      "state": "Bayern",
      "amtsgericht": "Amtsgericht München",
      "registernummer": "HRB 169185",
      "registerart": "HRB",
      "company_name": "NEUERTITZ Verlag GmbH",
      "company_seat": "Gröbenzell",
      "details": "26.04.2025 (Bekanntmachungsdatum)\n\nBayern Amtsgericht München HRB 169185\nRegisterbekanntmachung nach dem Umwandlungsgesetz 25.04.2025 (Eintragungsdatum)\n\nNEUERTITZ Verlag GmbH\nGesellschaft mit beschränkter Haftung\nGröbenzell\n\nDen Gläubigern der an der Verschmelzung beteiligten Rechtsträger ist, wenn sie binnen sechs Monaten nach dem Tag, an dem die Eintragung der Verschmelzung in das Register des Sitzes desjenigen Rechtsträgers, dessen Gläubiger sie sind, nach § 19 Abs. 3 UmwG als bekannt gemacht gilt, ihren Anspruch nach Grund und Höhe in Textform anmelden, Sicherheit zu leisten, soweit sie nicht Befriedigung verlangen können. Dieses Recht steht den Gläubigern jedoch nur zu, wenn sie glaubhaft machen, dass durch die Verschmelzung die Erfüllung ihrer Forderung gefährdet wird."
    },
    {
      "date": "2025-04-26",
      "id": "107441",
      "original_text": "Registerbekanntmachung nach dem Umwandlungsgesetz\nBayern Amtsgericht München HRB 297095\nPflege Oberland GmbH – Hausham",
      "type": "Registerbekanntmachung nach dem Umwandlungsgesetz",
      "state": "Bayern",
      "amtsgericht": "Amtsgericht München",
      "registernummer": "HRB 297095",
      "registerart": "HRB",
      "company_name": "Pflege Oberland GmbH",
      "company_seat": "Hausham",
      "details": "26.04.2025 (Bekanntmachungsdatum)\n\nBayern Amtsgericht München HRB 297095\nRegisterbekanntmachung nach dem Umwandlungsgesetz 25.04.2025 (Eintragungsdatum)\n\nPflege Oberland GmbH\nGesellschaft mit beschränkter Haftung\nHausham\n\nDen Gläubigern der an der Ausgliederung beteiligten Rechtsträger ist, wenn sie binnen sechs Monaten nach dem Tag, an dem die Eintragung der Ausgliederung in das Register des Sitzes desjenigen Rechtsträgers, dessen Gläubiger sie sind, nach §§ 125, 19 Abs. 3 UmwG als bekannt gemacht gilt, ihren Anspruch nach Grund und Höhe in Textform anmelden, Sicherheit zu leisten, soweit sie nicht Befriedigung verlangen können. Dieses Recht steht den Gläubigern jedoch nur zu, wenn sie glaubhaft machen, dass durch die Ausgliederung die Erfüllung ihrer Forderung gefährdet wird."
    },
    {
      "date": "2025-04-26",
      "id": "107442",
      "original_text": "Registerbekanntmachung nach dem Umwandlungsgesetz\nBayern Amtsgericht Nürnberg HRB 18320\nProact Deutschland GmbH – Nürnberg",
      "type": "Registerbekanntmachung nach dem Umwandlungsgesetz",
      "state": "Bayern",
      "amtsgericht": "Amtsgericht Nürnberg",
      "registernummer": "HRB 18320",
      "registerart": "HRB",
      "company_name": "Proact Deutschland GmbH",
      "company_seat": "Nürnberg",
      "details": "26.04.2025 (Bekanntmachungsdatum)\n\nBayern Amtsgericht Nürnberg HRB 18320\nRegisterbekanntmachung nach dem Umwandlungsgesetz 25.04.2025 (Eintragungsdatum)\n\nProact Deutschland GmbH\nGesellschaft mit beschränkter Haftung\nNürnberg\n\nDen Gläubigern der an der Verschmelzung beteiligten Rechtsträger ist, wenn sie binnen sechs Monaten nach dem Tag, an dem die Eintragung der Verschmelzung in das Register des Sitzes desjenigen Rechtsträgers, dessen Gläubiger sie sind, nach § 19 Abs. 3 UmwG als bekannt gemacht gilt, ihren Anspruch nach Grund und Höhe in Textform anmelden, Sicherheit zu leisten, soweit sie nicht Befriedigung verlangen können. Dieses Recht steht den Gläubigern jedoch nur zu, wenn sie glaubhaft machen, dass durch die Verschmelzung die Erfüllung ihrer Forderung gefährdet wird."
    },
    {
      "date": "2025-04-26",
      "id": "107443",
      "original_text": "Registerbekanntmachung nach dem Umwandlungsgesetz\nBayern Amtsgericht Aschaffenburg HRB 17493\nNumedex GmbH – Kahl a.Main",
      "type": "Registerbekanntmachung nach dem Umwandlungsgesetz",
      "state": "Bayern",
      "amtsgericht": "Amtsgericht Aschaffenburg",
      "registernummer": "HRB 17493",
      "registerart": "HRB",
      "company_name": "Numedex GmbH",
      "company_seat": "Kahl a.Main",
      "details": "26.04.2025 (Bekanntmachungsdatum)\n\nBayern Amtsgericht Aschaffenburg HRB 17493\nRegisterbekanntmachung nach dem Umwandlungsgesetz 25.04.2025 (Eintragungsdatum)\n\nNumedex GmbH\nGesellschaft mit beschränkter Haftung\nKahl a.Main\n\nDen Gläubigern der an der Verschmelzung beteiligten Rechtsträger ist, wenn sie binnen sechs Monaten nach dem Tag, an dem die Eintragung der Verschmelzung in das Register des Sitzes desjenigen Rechtsträgers, dessen Gläubiger sie sind, nach § 19 Abs. 3 UmwG als bekannt gemacht gilt, ihren Anspruch nach Grund und Höhe in Textform anmelden, Sicherheit zu leisten, soweit sie nicht Befriedigung verlangen können. Dieses Recht steht den Gläubigern jedoch nur zu, wenn sie glaubhaft machen, dass durch die Verschmelzung die Erfüllung ihrer Forderung gefährdet wird."
    },
    {
      "date": "2025-04-26",
      "id": "107444",
      "original_text": "Löschungsankündigung\nBayern Amtsgericht Ingolstadt HRB 11036\n333Invest UG (haftungsbeschränkt) – Ingolstadt",
      "type": "Löschungsankündigung",
      "state": "Bayern",
      "amtsgericht": "Amtsgericht Ingolstadt",
      "registernummer": "HRB 11036",
      "registerart": "HRB",
      "company_name": "333Invest UG (haftungsbeschränkt)",
      "company_seat": "Ingolstadt",
      "details": "26.04.2025 (Bekanntmachungsdatum)\n\nBayern Amtsgericht Ingolstadt HRB 11036\nLöschungsankündigung\n\n333Invest UG (haftungsbeschränkt)\nGesellschaft mit beschränkter Haftung\nIngolstadt\n\nDas Registergericht beabsichtigt, die im Handelsregister eingetragene Gesellschaft wegen Vermögenslosigkeit von Amts wegen nach § 394 FamFG zu löschen. #insert(Text=\"zztb_V_Widerspruchsfrist\")"
    },
    {
      "date": "2025-04-26",
      "id": "107445",
      "original_text": "Registerbekanntmachung nach dem Umwandlungsgesetz\nBayern Amtsgericht Aschaffenburg HRB 16368\nSMT Holding GmbH – Mömbris",
      "type": "Registerbekanntmachung nach dem Umwandlungsgesetz",
      "state": "Bayern",
      "amtsgericht": "Amtsgericht Aschaffenburg",
      "registernummer": "HRB 16368",
      "registerart": "HRB",
      "company_name": "SMT Holding GmbH",
      "company_seat": "Mömbris",
      "details": "26.04.2025 (Bekanntmachungsdatum)\n\nBayern Amtsgericht Aschaffenburg HRB 16368\nRegisterbekanntmachung nach dem Umwandlungsgesetz 25.04.2025 (Eintragungsdatum)\n\nSMT Holding GmbH\nGesellschaft mit beschränkter Haftung\nMömbris\n\nDen Gläubigern der an der Verschmelzung beteiligten Rechtsträger ist, wenn sie binnen sechs Monaten nach dem Tag, an dem die Eintragung der Verschmelzung in das Register des Sitzes desjenigen Rechtsträgers, dessen Gläubiger sie sind, nach § 19 Abs. 3 UmwG als bekannt gemacht gilt, ihren Anspruch nach Grund und Höhe in Textform anmelden, Sicherheit zu leisten, soweit sie nicht Befriedigung verlangen können. Dieses Recht steht den Gläubigern jedoch nur zu, wenn sie glaubhaft machen, dass durch die Verschmelzung die Erfüllung ihrer Forderung gefährdet wird."
    },
    {
      "date": "2025-04-26",
      "id": "107446",
      "original_text": "Löschungsankündigung\nBayern Amtsgericht München HRB 241925\nAuto-Schwaiger-UG (haftungsbeschränkt) – Oberammergau",
      "type": "Löschungsankündigung",
      "state": "Bayern",
      "amtsgericht": "Amtsgericht München",
      "registernummer": "HRB 241925",
      "registerart": "HRB",
      "company_name": "Auto-Schwaiger-UG (haftungsbeschränkt)",
      "company_seat": "Oberammergau",
      "details": "26.04.2025 (Bekanntmachungsdatum)\n\nBayern Amtsgericht München HRB 241925\nLöschungsankündigung 25.04.2025 (Eintragungsdatum)\n\nAuto-Schwaiger-UG (haftungsbeschränkt)\nGesellschaft mit beschränkter Haftung\nOberammergau\n\nDas Registergericht beabsichtigt, die im Handelsregister eingetragene Gesellschaft wegen Vermögenslosigkeit von Amts wegen nach § 394 FamFG zu löschen. Die Frist zur Erhebung eines Widerspruchs ist auf drei Monate festgesetzt."
    },
    {
      "date": "2025-04-26",
      "id": "107447",
      "original_text": "Löschungsankündigung\nBayern Amtsgericht Nürnberg HRB 36610\neGourmery GmbH – Nürnberg",
      "type": "Löschungsankündigung",
      "state": "Bayern",
      "amtsgericht": "Amtsgericht Nürnberg",
      "registernummer": "HRB 36610",
      "registerart": "HRB",
      "company_name": "eGourmery GmbH",
      "company_seat": "Nürnberg",
      "details": "26.04.2025 (Bekanntmachungsdatum)\n\nBayern Amtsgericht Nürnberg HRB 36610\nLöschungsankündigung\n\neGourmery GmbH\nGesellschaft mit beschränkter Haftung\nNürnberg\n\nDas Registergericht beabsichtigt, die im Handelsregister eingetragene Gesellschaft wegen Vermögenslosigkeit von Amts wegen nach § 394 FamFG zu löschen. Die Frist zur Erhebung eines Widerspruchs ist auf einen Monat festgesetzt."
    },
    {
      "date": "2025-04-26",
      "id": "107448",
      "original_text": "Registerbekanntmachung nach dem Umwandlungsgesetz\nBayern Amtsgericht München HRB 301915\nHerrhammer Transporte GmbH – München",
      "type": "Registerbekanntmachung nach dem Umwandlungsgesetz",
      "state": "Bayern",
      "amtsgericht": "Amtsgericht München",
      "registernummer": "HRB 301915",
      "registerart": "HRB",
      "company_name": "Herrhammer Transporte GmbH",
      "company_seat": "München",
      "details": "26.04.2025 (Bekanntmachungsdatum)\n\nBayern Amtsgericht München HRB 301915\nRegisterbekanntmachung nach dem Umwandlungsgesetz 25.04.2025 (Eintragungsdatum)\n\nHerrhammer Transporte GmbH\nGesellschaft mit beschränkter Haftung\nMünchen\n\nDen Gläubigern des formwechselnden Rechtsträgers ist, wenn sie binnen sechs Monaten nach dem Tag, an dem die Eintragung des Formwechsels nach § 201 UmwG als bekannt gemacht gilt, ihren Anspruch nach Grund und Höhe in Textform anmelden, Sicherheit zu leisten, soweit sie nicht Befriedigung verlangen können. Dieses Recht steht den Gläubigern jedoch nur zu, wenn sie glaubhaft machen, dass durch den Formwechsel die Erfüllung ihrer Forderung gefährdet wird."
    },
    {
      "date": "2025-04-26",
      "id": "107449",
      "original_text": "Registerbekanntmachung nach dem Umwandlungsgesetz\nBayern Amtsgericht Aschaffenburg HRB 14832\nScherer Metalltechnik GmbH – Mömbris",
      "type": "Registerbekanntmachung nach dem Umwandlungsgesetz",
      "state": "Bayern",
      "amtsgericht": "Amtsgericht Aschaffenburg",
      "registernummer": "HRB 14832",
      "registerart": "HRB",
      "company_name": "Scherer Metalltechnik GmbH",
      "company_seat": "Mömbris",
      "details": "26.04.2025 (Bekanntmachungsdatum)\n\nBayern Amtsgericht Aschaffenburg HRB 14832\nRegisterbekanntmachung nach dem Umwandlungsgesetz 25.04.2025 (Eintragungsdatum)\n\nScherer Metalltechnik GmbH\nGesellschaft mit beschränkter Haftung\nMömbris\n\nDen Gläubigern der an der Verschmelzung beteiligten Rechtsträger ist, wenn sie binnen sechs Monaten nach dem Tag, an dem die Eintragung der Verschmelzung in das Register des Sitzes desjenigen Rechtsträgers, dessen Gläubiger sie sind, nach § 19 Abs. 3 UmwG als bekannt gemacht gilt, ihren Anspruch nach Grund und Höhe in Textform anmelden, Sicherheit zu leisten, soweit sie nicht Befriedigung verlangen können. Dieses Recht steht den Gläubigern jedoch nur zu, wenn sie glaubhaft machen, dass durch die Verschmelzung die Erfüllung ihrer Forderung gefährdet wird."
    },
    {
      "date": "2025-04-26",
      "id": "107450",
      "original_text": "Einreichung neuer Dokumente\nBayern Amtsgericht München HRB 237219\nSiemens Mobility GmbH – München",
      "type": "Einreichung neuer Dokumente",
      "state": "Bayern",
      "amtsgericht": "Amtsgericht München",
      "registernummer": "HRB 237219",
      "registerart": "HRB",
      "company_name": "Siemens Mobility GmbH",
      "company_seat": "München",
      "details": "26.04.2025 (Bekanntmachungsdatum)\n\nBayern Amtsgericht München HRB 237219\nEinreichung neuer Dokumente 25.04.2025 (Eintragungsdatum)\n\nSiemens Mobility GmbH\nGesellschaft mit beschränkter Haftung\nMünchen\n\nDem Amtsgericht München -Registergericht- ist eine Liste der Mitglieder des Aufsichtsrats eingereicht worden, § 52 Abs. 3 S. 2 GmbHG."
    },
    {
      "date": "2025-04-26",
      "id": "107451",
      "original_text": "Löschungsankündigung\nBayern Amtsgericht Landshut HRB 7457\nGTR² - Global Technology Remarketing and Recycling GmbH – Rottenburg a. d. Laaber",
      "type": "Löschungsankündigung",
      "state": "Bayern",
      "amtsgericht": "Amtsgericht Landshut",
      "registernummer": "HRB 7457",
      "registerart": "HRB",
      "company_name": "GTR² - Global Technology Remarketing and Recycling GmbH",
      "company_seat": "Rottenburg a. d. Laaber",
      "details": "26.04.2025 (Bekanntmachungsdatum)\n\nBayern Amtsgericht Landshut HRB 7457\nLöschungsankündigung\n\nGTR² - Global Technology Remarketing and Recycling GmbH\nGesellschaft mit beschränkter Haftung\nRottenburg a. d. Laaber\n\nDas Registergericht beabsichtigt, die im Handelsregister eingetragene Gesellschaft wegen Vermögenslosigkeit von Amts wegen nach § 394 FamFG zu löschen. Die Frist zur Erhebung eines Widerspruchs ist auf einen Monat festgesetzt."
    },
    {
      "date": "2025-04-26",
      "id": "107452",
      "original_text": "Löschungsankündigung\nBayern Amtsgericht München HRA 114061\nSPS Vierzig Immobilien GmbH & Co. KG – München",
      "type": "Löschungsankündigung",
      "state": "Bayern",
      "amtsgericht": "Amtsgericht München",
      "registernummer": "HRA 114061",
      "registerart": "HRA",
      "company_name": "SPS Vierzig Immobilien GmbH & Co. KG",
      "company_seat": "München",
      "details": "26.04.2025 (Bekanntmachungsdatum)\n\nBayern Amtsgericht München HRA 114061\nLöschungsankündigung 25.04.2025 (Eintragungsdatum)\n\nSPS Vierzig Immobilien GmbH & Co. KG\nKommanditgesellschaft\nMünchen\n\nDas Registergericht beabsichtigt, die im Handelsregister eingetragene Firma wegen Vermögenslosigkeit von Amts wegen nach § 394 FamFG zu löschen. Die Frist zur Erhebung eines Widerspruchs ist auf drei Monate festgesetzt."
    }
  ]
}