{
  "date": "2025-04-04",
  "date_of_scrape": "2025-05-30T10:28:20.045Z",
  "tool_version": "0.2.0",
  "number_of_announcements": 104,
  "announcements": [
    {
      "date": "2025-04-04",
      "id": "105655",
      "original_text": "Einreichung neuer Dokumente\nBayern Amtsgericht München HRB 168973\nLeaseForce AG – München",
      "type": "Einreichung neuer Dokumente",
      "state": "Bayern",
      "amtsgericht": "Amtsgericht München",
      "registernummer": "HRB 168973",
      "registerart": "HRB",
      "company_name": "LeaseForce AG",
      "company_seat": "München",
      "details": "04.04.2025 (Bekanntmachungsdatum)\n\nBayern Amtsgericht München HRB 168973\nEinreichung neuer Dokumente\n\nLeaseForce AG\nAktiengesellschaft\nMünchen\n\nDem Amtsgericht München -Registergericht- ist eine Liste der Mitglieder des Aufsichtsrats eingereicht worden, § 106 AktG."
    },
    {
      "date": "2025-04-04",
      "id": "105656",
      "original_text": "Einreichung neuer Dokumente\nBayern Amtsgericht München HRB 264823\nBayWa r.e. AG – München",
      "type": "Einreichung neuer Dokumente",
      "state": "Bayern",
      "amtsgericht": "Amtsgericht München",
      "registernummer": "HRB 264823",
      "registerart": "HRB",
      "company_name": "BayWa r.e. AG",
      "company_seat": "München",
      "details": "04.04.2025 (Bekanntmachungsdatum)\n\nBayern Amtsgericht München HRB 264823\nEinreichung neuer Dokumente 03.04.2025 (Eintragungsdatum)\n\nBayWa r.e. AG\nAktiengesellschaft\nMünchen\n\nDem Amtsgericht München -Registergericht- ist eine Liste der Mitglieder des Aufsichtsrats eingereicht worden, § 106 AktG."
    },
    {
      "date": "2025-04-04",
      "id": "105657",
      "original_text": "Sonstige Registerbekanntmachung\nBayern Amtsgericht München HRB 175266\nKET Karosserie Entwicklung Thurner GmbH – München",
      "type": "Sonstige Registerbekanntmachung",
      "state": "Bayern",
      "amtsgericht": "Amtsgericht München",
      "registernummer": "HRB 175266",
      "registerart": "HRB",
      "company_name": "KET Karosserie Entwicklung Thurner GmbH",
      "company_seat": "München",
      "details": "04.04.2025 (Bekanntmachungsdatum)\n\nBayern Amtsgericht München HRB 175266\nSonstige Registerbekanntmachung 03.04.2025 (Eintragungsdatum)\n\nKET Karosserie Entwicklung Thurner GmbH\nGesellschaft mit beschränkter Haftung\nMünchen\n\nDen Gläubigern der Gesellschaft, deren Forderungen begründet worden sind, bevor die Eintragung der Beendigung des Gewinnabführungsvertrages in das Handelsregister nach § 10 des Handelsgesetzbuches als bekanntgemacht gilt, hat der andere Vertragsteil Sicherheit zu leisten, wenn sie sich binnen sechs Monaten nach der Bekanntmachung der Eintragung zu diesem Zweck bei ihm melden."
    },
    {
      "date": "2025-04-04",
      "id": "105658",
      "original_text": "Registerbekanntmachung nach dem Umwandlungsgesetz\nBayern Amtsgericht München HRB 6684\nSiemens Aktiengesellschaft – Berlin und München",
      "type": "Registerbekanntmachung nach dem Umwandlungsgesetz",
      "state": "Bayern",
      "amtsgericht": "Amtsgericht München",
      "registernummer": "HRB 6684",
      "registerart": "HRB",
      "company_name": "Siemens Aktiengesellschaft",
      "company_seat": "Berlin und München",
      "details": "04.04.2025 (Bekanntmachungsdatum)\n\nBayern Amtsgericht München HRB 6684\nRegisterbekanntmachung nach dem Umwandlungsgesetz\n\nSiemens Aktiengesellschaft\nAktiengesellschaft\nBerlin und München\n\nDem Amtsgericht München -Registergericht- ist ein Verschmelzungsvertrag zwischen der Siemens Aktiengesellschaft mit Sitz in Berlin und München (HRB 6684 bei dem Amtsgericht München und HRB 12300 bei dem Amtsgericht Berlin (Charlottenburg)) als übernehmendem Rechtsträger und der Siemens Treasury GmbH , München (Amtsgericht München HRB 187326) zur Einsichtnahme eingereicht worden.\n\nDesweiteren ist dem Amtsgericht München -Registergericht-  ein Verschmelzungsvertrag zwischen der Siemens Aktiengesellschaft mit Sitz in Berlin und München (HRB 6684 bei dem Amtsgericht München und HRB 12300 bei dem Amtsgericht Berlin (Charlottenburg)) als übernehmendem Rechtsträger und der MTS Mathematisch Technische Software-Entwicklung GmbH , Berlin (Amtsgericht Berlin (Charlottenburg) HRB 16521B) zur Einsichtnahme eingereicht worden."
    },
    {
      "date": "2025-04-04",
      "id": "105659",
      "original_text": "Registerbekanntmachung nach dem Umwandlungsgesetz\nBayern Amtsgericht München HRB 50571\nEHB Steuerberatung GmbH – München",
      "type": "Registerbekanntmachung nach dem Umwandlungsgesetz",
      "state": "Bayern",
      "amtsgericht": "Amtsgericht München",
      "registernummer": "HRB 50571",
      "registerart": "HRB",
      "company_name": "EHB Steuerberatung GmbH",
      "company_seat": "München",
      "details": "04.04.2025 (Bekanntmachungsdatum)\n\nBayern Amtsgericht München HRB 50571\nRegisterbekanntmachung nach dem Umwandlungsgesetz 03.04.2025 (Eintragungsdatum)\n\nEHB Steuerberatung GmbH\nGesellschaft mit beschränkter Haftung\nMünchen\n\nDen Gläubigern des formwechselnden Rechtsträgers ist, wenn sie binnen sechs Monaten nach dem Tag, an dem die Eintragung des Formwechsels nach § 201 UmwG als bekannt gemacht gilt, ihren Anspruch nach Grund und Höhe in Textform anmelden, Sicherheit zu leisten, soweit sie nicht Befriedigung verlangen können. Dieses Recht steht den Gläubigern jedoch nur zu, wenn sie glaubhaft machen, dass durch den Formwechsel die Erfüllung ihrer Forderung gefährdet wird."
    },
    {
      "date": "2025-04-04",
      "id": "105660",
      "original_text": "Registerbekanntmachung nach dem Umwandlungsgesetz\nBayern Amtsgericht Nürnberg HRB 26703\nBechtle GmbH – Nürnberg",
      "type": "Registerbekanntmachung nach dem Umwandlungsgesetz",
      "state": "Bayern",
      "amtsgericht": "Amtsgericht Nürnberg",
      "registernummer": "HRB 26703",
      "registerart": "HRB",
      "company_name": "Bechtle GmbH",
      "company_seat": "Nürnberg",
      "details": "04.04.2025 (Bekanntmachungsdatum)\n\nBayern Amtsgericht Nürnberg HRB 26703\nRegisterbekanntmachung nach dem Umwandlungsgesetz 03.04.2025 (Eintragungsdatum)\n\nBechtle GmbH\nGesellschaft mit beschränkter Haftung\nNürnberg\n\nDen Gläubigern der an der Verschmelzung beteiligten Rechtsträger ist, wenn sie binnen sechs Monaten nach dem Tag, an dem die Eintragung der Verschmelzung in das Register des Sitzes desjenigen Rechtsträgers, dessen Gläubiger sie sind, nach § 19 Abs. 3 UmwG als bekannt gemacht gilt, ihren Anspruch nach Grund und Höhe in Textform anmelden, Sicherheit zu leisten, soweit sie nicht Befriedigung verlangen können. Dieses Recht steht den Gläubigern jedoch nur zu, wenn sie glaubhaft machen, dass durch die Verschmelzung die Erfüllung ihrer Forderung gefährdet wird."
    },
    {
      "date": "2025-04-04",
      "id": "105661",
      "original_text": "Registerbekanntmachung nach dem Umwandlungsgesetz\nBayern Amtsgericht München HRB 138561\nW. Steininger GmbH – München",
      "type": "Registerbekanntmachung nach dem Umwandlungsgesetz",
      "state": "Bayern",
      "amtsgericht": "Amtsgericht München",
      "registernummer": "HRB 138561",
      "registerart": "HRB",
      "company_name": "W. Steininger GmbH",
      "company_seat": "München",
      "details": "04.04.2025 (Bekanntmachungsdatum)\n\nBayern Amtsgericht München HRB 138561\nRegisterbekanntmachung nach dem Umwandlungsgesetz 03.04.2025 (Eintragungsdatum)\n\nW. Steininger GmbH\nGesellschaft mit beschränkter Haftung\nMünchen\n\nDen Gläubigern der an der Verschmelzung beteiligten Rechtsträger ist, wenn sie binnen sechs Monaten nach dem Tag, an dem die Eintragung der Verschmelzung in das Register des Sitzes desjenigen Rechtsträgers, dessen Gläubiger sie sind, nach § 19 Abs. 3 UmwG als bekannt gemacht gilt, ihren Anspruch nach Grund und Höhe in Textform anmelden, Sicherheit zu leisten, soweit sie nicht Befriedigung verlangen können. Dieses Recht steht den Gläubigern jedoch nur zu, wenn sie glaubhaft machen, dass durch die Verschmelzung die Erfüllung ihrer Forderung gefährdet wird."
    },
    {
      "date": "2025-04-04",
      "id": "105662",
      "original_text": "Registerbekanntmachung nach dem Umwandlungsgesetz\nBayern Amtsgericht Nürnberg HRB 25390\nThe Great Branding Company GmbH – Altdorf",
      "type": "Registerbekanntmachung nach dem Umwandlungsgesetz",
      "state": "Bayern",
      "amtsgericht": "Amtsgericht Nürnberg",
      "registernummer": "HRB 25390",
      "registerart": "HRB",
      "company_name": "The Great Branding Company GmbH",
      "company_seat": "Altdorf",
      "details": "04.04.2025 (Bekanntmachungsdatum)\n\nBayern Amtsgericht Nürnberg HRB 25390\nRegisterbekanntmachung nach dem Umwandlungsgesetz 03.04.2025 (Eintragungsdatum)\n\nThe Great Branding Company GmbH\nGesellschaft mit beschränkter Haftung\nAltdorf\n\nDen Gläubigern der an der Verschmelzung beteiligten Rechtsträger ist, wenn sie binnen sechs Monaten nach dem Tag, an dem die Eintragung der Verschmelzung in das Register des Sitzes desjenigen Rechtsträgers, dessen Gläubiger sie sind, nach § 19 Abs. 3 UmwG als bekannt gemacht gilt, ihren Anspruch nach Grund und Höhe in Textform anmelden, Sicherheit zu leisten, soweit sie nicht Befriedigung verlangen können. Dieses Recht steht den Gläubigern jedoch nur zu, wenn sie glaubhaft machen, dass durch die Verschmelzung die Erfüllung ihrer Forderung gefährdet wird."
    },
    {
      "date": "2025-04-04",
      "id": "105663",
      "original_text": "Registerbekanntmachung nach dem Umwandlungsgesetz\nBayern Amtsgericht Landshut HRB 11929\nProjecTIGA UG (haftungsbeschränkt) – Niederaichbach",
      "type": "Registerbekanntmachung nach dem Umwandlungsgesetz",
      "state": "Bayern",
      "amtsgericht": "Amtsgericht Landshut",
      "registernummer": "HRB 11929",
      "registerart": "HRB",
      "company_name": "ProjecTIGA UG (haftungsbeschränkt)",
      "company_seat": "Niederaichbach",
      "details": "04.04.2025 (Bekanntmachungsdatum)\n\nBayern Amtsgericht Landshut HRB 11929\nRegisterbekanntmachung nach dem Umwandlungsgesetz 03.04.2025 (Eintragungsdatum)\n\nProjecTIGA UG (haftungsbeschränkt)\nGesellschaft mit beschränkter Haftung\nNiederaichbach\n\nDen Gläubigern der an der Verschmelzung beteiligten Rechtsträger ist, wenn sie binnen sechs Monaten nach dem Tag, an dem die Eintragung der Verschmelzung in das Register des Sitzes desjenigen Rechtsträgers, dessen Gläubiger sie sind, nach § 19 Abs. 3 UmwG als bekannt gemacht gilt, ihren Anspruch nach Grund und Höhe in Textform anmelden, Sicherheit zu leisten, soweit sie nicht Befriedigung verlangen können. Dieses Recht steht den Gläubigern jedoch nur zu, wenn sie glaubhaft machen, dass durch die Verschmelzung die Erfüllung ihrer Forderung gefährdet wird."
    },
    {
      "date": "2025-04-04",
      "id": "105664",
      "original_text": "Einreichung neuer Dokumente\nBayern Amtsgericht München HRB 95802\nAllianz Direct Versicherungs-AG – München",
      "type": "Einreichung neuer Dokumente",
      "state": "Bayern",
      "amtsgericht": "Amtsgericht München",
      "registernummer": "HRB 95802",
      "registerart": "HRB",
      "company_name": "Allianz Direct Versicherungs-AG",
      "company_seat": "München",
      "details": "04.04.2025 (Bekanntmachungsdatum)\n\nBayern Amtsgericht München HRB 95802\nEinreichung neuer Dokumente\n\nAllianz Direct Versicherungs-AG\nAktiengesellschaft\nMünchen\n\nDem Amtsgericht München -Registergericht- ist eine Liste der Mitglieder des Aufsichtsrats eingereicht worden, § 106 AktG."
    },
    {
      "date": "2025-04-04",
      "id": "105665",
      "original_text": "Löschungsankündigung\nBayern Amtsgericht München HRB 266784\nDHG UG (haftungsbeschränkt) – München",
      "type": "Löschungsankündigung",
      "state": "Bayern",
      "amtsgericht": "Amtsgericht München",
      "registernummer": "HRB 266784",
      "registerart": "HRB",
      "company_name": "DHG UG (haftungsbeschränkt)",
      "company_seat": "München",
      "details": "04.04.2025 (Bekanntmachungsdatum)\n\nBayern Amtsgericht München HRB 266784\nLöschungsankündigung\n\nDHG UG (haftungsbeschränkt)\nGesellschaft mit beschränkter Haftung\nMünchen\n\nDas Registergericht beabsichtigt, die im Handelsregister eingetragene Gesellschaft wegen Vermögenslosigkeit von Amts wegen nach § 394 FamFG zu löschen. Die Frist zur Erhebung eines Widerspruchs ist auf drei Monate festgesetzt."
    },
    {
      "date": "2025-04-04",
      "id": "105666",
      "original_text": "Löschungsankündigung\nBayern Amtsgericht Ansbach HRB 5494\nCCF GmbH – Ansbach",
      "type": "Löschungsankündigung",
      "state": "Bayern",
      "amtsgericht": "Amtsgericht Ansbach",
      "registernummer": "HRB 5494",
      "registerart": "HRB",
      "company_name": "CCF GmbH",
      "company_seat": "Ansbach",
      "details": "04.04.2025 (Bekanntmachungsdatum)\n\nBayern Amtsgericht Ansbach HRB 5494\nLöschungsankündigung\n\nCCF GmbH\nGesellschaft mit beschränkter Haftung\nAnsbach\n\nDas Registergericht beabsichtigt, die im Handelsregister eingetragene Gesellschaft wegen Vermögenslosigkeit von Amts wegen nach § 394 FamFG zu löschen. Die Frist zur Erhebung eines Widerspruchs ist auf sechs Wochen festgesetzt."
    },
    {
      "date": "2025-04-04",
      "id": "105667",
      "original_text": "Löschungsankündigung\nBayern Amtsgericht München HRB 164501\nIWS-ConsultingPartners Limited – Oberhaching",
      "type": "Löschungsankündigung",
      "state": "Bayern",
      "amtsgericht": "Amtsgericht München",
      "registernummer": "HRB 164501",
      "registerart": "HRB",
      "company_name": "IWS-ConsultingPartners Limited",
      "company_seat": "Oberhaching",
      "details": "04.04.2025 (Bekanntmachungsdatum)\n\nBayern Amtsgericht München HRB 164501\nLöschungsankündigung 03.04.2025 (Eintragungsdatum)\n\nIWS-ConsultingPartners Limited\nRechtsform ausländischen Rechts HRB\nOberhaching\n\nDas Registergericht beabsichtigt, die im Handelsregister B eingetragene Zweigniederlassung von Amts wegen nach § 395 FamFG zu löschen. Die Frist zur Erhebung eines Widerspruchs ist auf drei Monate festgesetzt.Das Registergericht beabsichtigt, die im Handelsregister eingetragene Gesellschaft von Amts wegen nach § 395 FamFG zu löschen. Die Frist zur Erhebung eines Widerspruchs ist auf drei Monate festgesetzt."
    },
    {
      "date": "2025-04-04",
      "id": "105668",
      "original_text": "Sonstige Registerbekanntmachung\nBayern Amtsgericht München HRB 245919\nmaxmatch Personalberatung GmbH – München",
      "type": "Sonstige Registerbekanntmachung",
      "state": "Bayern",
      "amtsgericht": "Amtsgericht München",
      "registernummer": "HRB 245919",
      "registerart": "HRB",
      "company_name": "maxmatch Personalberatung GmbH",
      "company_seat": "München",
      "details": "04.04.2025 (Bekanntmachungsdatum)\n\nBayern Amtsgericht München HRB 245919\nSonstige Registerbekanntmachung 03.04.2025 (Eintragungsdatum)\n\nmaxmatch Personalberatung GmbH\nGesellschaft mit beschränkter Haftung\nMünchen\n\nDen Gläubigern der Gesellschaft, deren Forderungen begründet worden sind, bevor die Eintragung der Beendigung des Beherrschungs- und Gewinnabführungsvertrages in das Handelsregister nach § 10 des Handelsgesetzbuches als bekanntgemacht gilt, hat der andere Vertragsteil Sicherheit zu leisten, wenn sie sich binnen sechs Monaten nach der Bekanntmachung der Eintragung zu diesem Zweck bei ihm melden."
    },
    {
      "date": "2025-04-04",
      "id": "105669",
      "original_text": "Registerbekanntmachung nach dem Umwandlungsgesetz\nBayern Amtsgericht Nürnberg HRB 22786\nAurum Project AG – Reichenschwand",
      "type": "Registerbekanntmachung nach dem Umwandlungsgesetz",
      "state": "Bayern",
      "amtsgericht": "Amtsgericht Nürnberg",
      "registernummer": "HRB 22786",
      "registerart": "HRB",
      "company_name": "Aurum Project AG",
      "company_seat": "Reichenschwand",
      "details": "04.04.2025 (Bekanntmachungsdatum)\n\nBayern Amtsgericht Nürnberg HRB 22786\nRegisterbekanntmachung nach dem Umwandlungsgesetz 03.04.2025 (Eintragungsdatum)\n\nAurum Project AG\nAktiengesellschaft\nReichenschwand\n\nDen Gläubigern des formwechselnden Rechtsträgers ist, wenn sie binnen sechs Monaten nach dem Tag, an dem die Eintragung des Formwechsels nach § 201 UmwG als bekannt gemacht gilt, ihren Anspruch nach Grund und Höhe in Textform anmelden, Sicherheit zu leisten, soweit sie nicht Befriedigung verlangen können. Dieses Recht steht den Gläubigern jedoch nur zu, wenn sie glaubhaft machen, dass durch den Formwechsel die Erfüllung ihrer Forderung gefährdet wird."
    },
    {
      "date": "2025-04-04",
      "id": "105670",
      "original_text": "Registerbekanntmachung nach dem Umwandlungsgesetz\nBayern Amtsgericht München HRB 294773\nSilk Road HoldCo GmbH – München",
      "type": "Registerbekanntmachung nach dem Umwandlungsgesetz",
      "state": "Bayern",
      "amtsgericht": "Amtsgericht München",
      "registernummer": "HRB 294773",
      "registerart": "HRB",
      "company_name": "Silk Road HoldCo GmbH",
      "company_seat": "München",
      "details": "04.04.2025 (Bekanntmachungsdatum)\n\nBayern Amtsgericht München HRB 294773\nRegisterbekanntmachung nach dem Umwandlungsgesetz 03.04.2025 (Eintragungsdatum)\n\nSilk Road HoldCo GmbH\nGesellschaft mit beschränkter Haftung\nMünchen\n\nDen Gläubigern der an der Verschmelzung beteiligten Rechtsträger ist, wenn sie binnen sechs Monaten nach dem Tag, an dem die Eintragung der Verschmelzung in das Register des Sitzes desjenigen Rechtsträgers, dessen Gläubiger sie sind, nach § 19 Abs. 3 UmwG als bekannt gemacht gilt, ihren Anspruch nach Grund und Höhe in Textform anmelden, Sicherheit zu leisten, soweit sie nicht Befriedigung verlangen können. Dieses Recht steht den Gläubigern jedoch nur zu, wenn sie glaubhaft machen, dass durch die Verschmelzung die Erfüllung ihrer Forderung gefährdet wird."
    },
    {
      "date": "2025-04-04",
      "id": "105671",
      "original_text": "Registerbekanntmachung nach dem Umwandlungsgesetz\nBayern Amtsgericht Landshut HRB 11219\nMA Consulting UG (haftungsbeschränkt) – Niederaichbach",
      "type": "Registerbekanntmachung nach dem Umwandlungsgesetz",
      "state": "Bayern",
      "amtsgericht": "Amtsgericht Landshut",
      "registernummer": "HRB 11219",
      "registerart": "HRB",
      "company_name": "MA Consulting UG (haftungsbeschränkt)",
      "company_seat": "Niederaichbach",
      "details": "04.04.2025 (Bekanntmachungsdatum)\n\nBayern Amtsgericht Landshut HRB 11219\nRegisterbekanntmachung nach dem Umwandlungsgesetz 03.04.2025 (Eintragungsdatum)\n\nMA Consulting UG (haftungsbeschränkt)\nGesellschaft mit beschränkter Haftung\nNiederaichbach\n\nDen Gläubigern der an der Verschmelzung beteiligten Rechtsträger ist, wenn sie binnen sechs Monaten nach dem Tag, an dem die Eintragung der Verschmelzung in das Register des Sitzes desjenigen Rechtsträgers, dessen Gläubiger sie sind, nach § 19 Abs. 3 UmwG als bekannt gemacht gilt, ihren Anspruch nach Grund und Höhe in Textform anmelden, Sicherheit zu leisten, soweit sie nicht Befriedigung verlangen können. Dieses Recht steht den Gläubigern jedoch nur zu, wenn sie glaubhaft machen, dass durch die Verschmelzung die Erfüllung ihrer Forderung gefährdet wird."
    },
    {
      "date": "2025-04-04",
      "id": "105672",
      "original_text": "Sonstige Registerbekanntmachung\nHamburg Amtsgericht Hamburg HRB 44885\nJungheinrich Aktiengesellschaft – Hamburg",
      "type": "Sonstige Registerbekanntmachung",
      "state": "Hamburg",
      "amtsgericht": "Amtsgericht Hamburg",
      "registernummer": "HRB 44885",
      "registerart": "HRB",
      "company_name": "Jungheinrich Aktiengesellschaft",
      "company_seat": "Hamburg",
      "details": "04.04.2025 (Bekanntmachungsdatum)\n\nHamburg Amtsgericht Hamburg HRB 44885\nSonstige Registerbekanntmachung\n\nJungheinrich Aktiengesellschaft\nAktiengesellschaft\nHamburg\n\nAls nicht eingetragen wird bekannt gemacht: Liste des Aufsichtsrats wurde eingereicht."
    },
    {
      "date": "2025-04-04",
      "id": "105673",
      "original_text": "Registerbekanntmachung nach dem Umwandlungsgesetz\nSaarland Amtsgericht Saarbrücken HRA 13115\nJürgen Brust Versicherungsservice e. K. – Saarbrücken",
      "type": "Registerbekanntmachung nach dem Umwandlungsgesetz",
      "state": "Saarland",
      "amtsgericht": "Amtsgericht Saarbrücken",
      "registernummer": "HRA 13115",
      "registerart": "HRA",
      "company_name": "Jürgen Brust Versicherungsservice e. K.",
      "company_seat": "Saarbrücken",
      "details": "04.04.2025 (Bekanntmachungsdatum)\n\nSaarland Amtsgericht Saarbrücken HRA 13115\nRegisterbekanntmachung nach dem Umwandlungsgesetz 04.04.2025 (Eintragungsdatum)\n\nJürgen Brust Versicherungsservice e. K.\nEinzelkaufmann / Einzelkauffrau\nSaarbrücken\n\nAls nicht eingetragen wird bekannt gemacht: Den Gläubigern der an der Verschmelzung beteiligten Gesellschaften ist, wenn sie binnen sechs Monaten nach dem Tag, an dem die Eintragung der Verschmelzung in das Register des Sitzes desjenigen Rechtsträgers, dessen Gläubiger sie sind, nach § 19 Absatz 3 UmwG bekannt gemacht worden ist, ihren Anspruch nach Grund und Höhe schriftlich anmelden, Sicherheit zu leisten, soweit sie nicht Befriedigung verlangen können. Dieses Recht steht den Gläubigern jedoch nur zu, wenn sie glaubhaft machen, dass durch die Verschmelzung die Erfüllung ihrer Forderung gefährdet wird."
    },
    {
      "date": "2025-04-04",
      "id": "105674",
      "original_text": "Registerbekanntmachung nach dem Umwandlungsgesetz\nSaarland Amtsgericht Saarbrücken HRA 13605\nBrust & Michalke OHG – Saarbrücken",
      "type": "Registerbekanntmachung nach dem Umwandlungsgesetz",
      "state": "Saarland",
      "amtsgericht": "Amtsgericht Saarbrücken",
      "registernummer": "HRA 13605",
      "registerart": "HRA",
      "company_name": "Brust & Michalke OHG",
      "company_seat": "Saarbrücken",
      "details": "04.04.2025 (Bekanntmachungsdatum)\n\nSaarland Amtsgericht Saarbrücken HRA 13605\nRegisterbekanntmachung nach dem Umwandlungsgesetz 04.04.2025 (Eintragungsdatum)\n\nBrust & Michalke OHG\nOffene Handelsgesellschaft\nSaarbrücken\n\nAls nicht eingetragen wird bekannt gemacht: Den Gläubigern der an der Verschmelzung beteiligten Gesellschaften ist, wenn sie binnen sechs Monaten nach dem Tag, an dem die Eintragung der Verschmelzung in das Register des Sitzes desjenigen Rechtsträgers, dessen Gläubiger sie sind, nach § 19 Absatz 3 UmwG bekannt gemacht worden ist, ihren Anspruch nach Grund und Höhe schriftlich anmelden, Sicherheit zu leisten, soweit sie nicht Befriedigung verlangen können. Dieses Recht steht den Gläubigern jedoch nur zu, wenn sie glaubhaft machen, dass durch die Verschmelzung die Erfüllung ihrer Forderung gefährdet wird."
    },
    {
      "date": "2025-04-04",
      "id": "105675",
      "original_text": "Registerbekanntmachung nach dem Umwandlungsgesetz\nBerlin Amtsgericht Berlin (Charlottenburg) HRB 114246\nHönower Wiesenweg GmbH – Berlin",
      "type": "Registerbekanntmachung nach dem Umwandlungsgesetz",
      "state": "Berlin",
      "amtsgericht": "Amtsgericht Berlin (Charlottenburg)",
      "registernummer": "HRB 114246",
      "registerart": "HRB",
      "company_name": "Hönower Wiesenweg GmbH",
      "company_seat": "Berlin",
      "details": "04.04.2025 (Bekanntmachungsdatum)\n\nBerlin Amtsgericht Berlin (Charlottenburg) HRB 114246\nRegisterbekanntmachung nach dem Umwandlungsgesetz 03.04.2025 (Eintragungsdatum)\n\nHönower Wiesenweg GmbH\nGesellschaft mit beschränkter Haftung\nBerlin\n\nZu Eintragungsnummer 10 vom 03.04.2025 wird als nicht eingetragen veröffentlicht: Den Gläubigern der an der Verschmelzung beteiligten Rechtsträger ist, wenn sie binnen sechs Monaten nach dem Tag, an dem die Eintragung der Verschmelzung in das Register des Sitzes desjenigen Rechtsträgers, dessen Gläubiger sie sind, als bekannt gemacht gilt, ihren Anspruch nach Grund und Höhe schriftlich anmelden, Sicherheit zu leisten, soweit sie nicht Befriedigung verlangen können. Dieses Recht steht den Gläubigern jedoch nur zu, wenn sie glaubhaft machen, dass durch die Verschmelzung die Erfüllung ihrer Forderung gefährdet wird. Das Recht, Sicherheitsleistung zu verlangen, steht Gläubigern nicht zu, die im Falle der Insolvenz ein Recht auf vorzugsweise Befriedigung aus einer Deckungsmasse haben, die nach gesetzlicher Vorschrift zu ihrem Schutz errichtet und staatlich überwacht ist."
    },
    {
      "date": "2025-04-04",
      "id": "105676",
      "original_text": "Sonstige Registerbekanntmachung\nBrandenburg Amtsgericht Potsdam HRB 14297\ncommsult- Aktiengesellschaft – Potsdam",
      "type": "Sonstige Registerbekanntmachung",
      "state": "Brandenburg",
      "amtsgericht": "Amtsgericht Potsdam",
      "registernummer": "HRB 14297",
      "registerart": "HRB",
      "company_name": "commsult- Aktiengesellschaft",
      "company_seat": "Potsdam",
      "details": "04.04.2025 (Bekanntmachungsdatum)\n\nBrandenburg Amtsgericht Potsdam HRB 14297\nSonstige Registerbekanntmachung\n\ncommsult- Aktiengesellschaft\nAktiengesellschaft\nPotsdam\n\nAls nicht eingetragen wird veröffentlicht: Eine Liste der Mitglieder des Aufsichtsrates wurde zum Handelsregister eingereicht"
    },
    {
      "date": "2025-04-04",
      "id": "105677",
      "original_text": "Sonstige Registerbekanntmachung\nBrandenburg Amtsgericht Potsdam HRB 14297\ncommsult- Aktiengesellschaft – Potsdam",
      "type": "Sonstige Registerbekanntmachung",
      "state": "Brandenburg",
      "amtsgericht": "Amtsgericht Potsdam",
      "registernummer": "HRB 14297",
      "registerart": "HRB",
      "company_name": "commsult- Aktiengesellschaft",
      "company_seat": "Potsdam",
      "details": "04.04.2025 (Bekanntmachungsdatum)\n\nBrandenburg Amtsgericht Potsdam HRB 14297\nSonstige Registerbekanntmachung\n\ncommsult- Aktiengesellschaft\nAktiengesellschaft\nPotsdam\n\nAls nicht eingetragen wird veröffentlicht: Eine weitere Liste der Mitglieder des Aufsichtsrates wurde zum Handelsregister eingereicht"
    },
    {
      "date": "2025-04-04",
      "id": "105678",
      "original_text": "Registerbekanntmachung nach dem Umwandlungsgesetz\nSchleswig-Holstein Amtsgericht Flensburg HRA 10422\nvon Plieningen Nfl. KG – Flensburg",
      "type": "Registerbekanntmachung nach dem Umwandlungsgesetz",
      "state": "Schleswig-Holstein",
      "amtsgericht": "Amtsgericht Flensburg",
      "registernummer": "HRA 10422",
      "registerart": "HRA",
      "company_name": "von Plieningen Nfl. KG",
      "company_seat": "Flensburg",
      "details": "04.04.2025 (Bekanntmachungsdatum)\n\nSchleswig-Holstein Amtsgericht Flensburg HRA 10422\nRegisterbekanntmachung nach dem Umwandlungsgesetz 03.04.2025 (Eintragungsdatum)\n\nvon Plieningen Nfl. KG\nKommanditgesellschaft\nFlensburg\n\nAls nicht eingetragen wird veröffentlicht:\nDen Gläubigern der an der Verschmelzung beteiligten Rechtsträger ist, wenn sie binnen sechs Monaten nach dem Tag, an dem die Eintragung der Verschmelzung in das Register des Sitzes desjenigen Rechtsträgers, dessen Gläubiger sie sind, als bekannt gemacht gilt, ihren Anspruch nach Grund und Höhe in Textform anmelden, Sicherheit zu leisten, soweit sie nicht Befriedigung verlangen können. Dieses Recht steht den Gläubigern jedoch nur zu, wenn sie glaubhaft machen, dass durch die Verschmelzung die Erfüllung ihrer Forderung gefährdet wird."
    },
    {
      "date": "2025-04-04",
      "id": "105679",
      "original_text": "Registerbekanntmachung nach dem Umwandlungsgesetz\nBrandenburg Amtsgericht Potsdam HRB 16788\nSkyballooning GmbH – Treuenbrietzen",
      "type": "Registerbekanntmachung nach dem Umwandlungsgesetz",
      "state": "Brandenburg",
      "amtsgericht": "Amtsgericht Potsdam",
      "registernummer": "HRB 16788",
      "registerart": "HRB",
      "company_name": "Skyballooning GmbH",
      "company_seat": "Treuenbrietzen",
      "details": "04.04.2025 (Bekanntmachungsdatum)\n\nBrandenburg Amtsgericht Potsdam HRB 16788\nRegisterbekanntmachung nach dem Umwandlungsgesetz 03.04.2025 (Eintragungsdatum)\n\nSkyballooning GmbH\nGesellschaft mit beschränkter Haftung\nTreuenbrietzen\n\nZu Eintragungsnummer 4 vom 03.04.2025 wird als nicht eingetragen veröffentlicht: Den Gläubigern der an der Verschmelzung beteiligten Rechtsträger ist, wenn sie binnen sechs Monaten nach dem Tag, an dem die Eintragung der Verschmelzung in das Register des Sitzes desjenigen Rechtsträgers, dessen Gläubiger sie sind, als bekannt gemacht gilt, ihren Anspruch nach Grund und Höhe schriftlich anmelden, Sicherheit zu leisten, soweit sie nicht Befriedigung verlangen können. Dieses Recht steht den Gläubigern jedoch nur zu, wenn sie glaubhaft machen, dass durch die Verschmelzung die Erfüllung ihrer Forderung gefährdet wird"
    },
    {
      "date": "2025-04-04",
      "id": "105680",
      "original_text": "Löschungsankündigung\nBerlin Amtsgericht Berlin (Charlottenburg) HRB 147512\nZenith Hospitality Solutions GmbH – Berlin",
      "type": "Löschungsankündigung",
      "state": "Berlin",
      "amtsgericht": "Amtsgericht Berlin (Charlottenburg)",
      "registernummer": "HRB 147512",
      "registerart": "HRB",
      "company_name": "Zenith Hospitality Solutions GmbH",
      "company_seat": "Berlin",
      "details": "04.04.2025 (Bekanntmachungsdatum)\n\nBerlin Amtsgericht Berlin (Charlottenburg) HRB 147512\nLöschungsankündigung\n\nZenith Hospitality Solutions GmbH\nGesellschaft mit beschränkter Haftung\nBerlin\n\nBei der nachstehenden Gesellschaft wird das Amtslöschungsverfahren gemäß § 394 FamFG eingeleitet. Widerspruchsfrist 6 Wochen"
    },
    {
      "date": "2025-04-04",
      "id": "105681",
      "original_text": "Sonstige Registerbekanntmachung\nHamburg Amtsgericht Hamburg HRB 79456\nRegent Berlin GmbH – Hamburg",
      "type": "Sonstige Registerbekanntmachung",
      "state": "Hamburg",
      "amtsgericht": "Amtsgericht Hamburg",
      "registernummer": "HRB 79456",
      "registerart": "HRB",
      "company_name": "Regent Berlin GmbH",
      "company_seat": "Hamburg",
      "details": "04.04.2025 (Bekanntmachungsdatum)\n\nHamburg Amtsgericht Hamburg HRB 79456\nSonstige Registerbekanntmachung 04.04.2025 (Eintragungsdatum)\n\nRegent Berlin GmbH\nGesellschaft mit beschränkter Haftung\nHamburg\n\nAls nicht eingetragen wird bekannt gemacht:  Den Gläubigern der Gesellschaft, deren Forderungen begründet worden sind, bevor die Eintragung der Vertragsbeendigung in das Handelsregister nach § 10 HGB als bekannt gemacht gilt, ist vom anderen Vertragsteil Sicherheit zu leisten, wenn sie sich binnen 6 Monaten nach Bekanntmachung der Eintragung zu diesem Zweck bei ihm melden."
    },
    {
      "date": "2025-04-04",
      "id": "105682",
      "original_text": "Löschungsankündigung\nBrandenburg Amtsgericht Neuruppin HRB 12257\nKRAUF GmbH – Heiligengrabe",
      "type": "Löschungsankündigung",
      "state": "Brandenburg",
      "amtsgericht": "Amtsgericht Neuruppin",
      "registernummer": "HRB 12257",
      "registerart": "HRB",
      "company_name": "KRAUF GmbH",
      "company_seat": "Heiligengrabe",
      "details": "04.04.2025 (Bekanntmachungsdatum)\n\nBrandenburg Amtsgericht Neuruppin HRB 12257\nLöschungsankündigung\n\nKRAUF GmbH\nGesellschaft mit beschränkter Haftung\nHeiligengrabe\n\nBei der nachstehenden Gesellschaft wird das Amtslöschungsverfahren gemäß § 394 FamFG eingeleitet.\nWiderspruchsfrist: 1 Monat"
    },
    {
      "date": "2025-04-04",
      "id": "105683",
      "original_text": "Löschungsankündigung\nBrandenburg Amtsgericht Neuruppin HRB 13887\nHamlet Gastro Consulting UG (haftungsbeschränkt) – Neuruppin",
      "type": "Löschungsankündigung",
      "state": "Brandenburg",
      "amtsgericht": "Amtsgericht Neuruppin",
      "registernummer": "HRB 13887",
      "registerart": "HRB",
      "company_name": "Hamlet Gastro Consulting UG (haftungsbeschränkt)",
      "company_seat": "Neuruppin",
      "details": "04.04.2025 (Bekanntmachungsdatum)\n\nBrandenburg Amtsgericht Neuruppin HRB 13887\nLöschungsankündigung\n\nHamlet Gastro Consulting UG (haftungsbeschränkt)\nGesellschaft mit beschränkter Haftung\nNeuruppin\n\nBei der nachstehenden Gesellschaft wird das Amtslöschungsverfahren gemäß § 394 FamFG eingeleitet.\nWiderspruchsfrist: 1 Monat"
    },
    {
      "date": "2025-04-04",
      "id": "105684",
      "original_text": "Einreichung neuer Dokumente\nBerlin Amtsgericht Berlin (Charlottenburg) HRB 256346\nSmart InsurTech AG – Berlin",
      "type": "Einreichung neuer Dokumente",
      "state": "Berlin",
      "amtsgericht": "Amtsgericht Berlin (Charlottenburg)",
      "registernummer": "HRB 256346",
      "registerart": "HRB",
      "company_name": "Smart InsurTech AG",
      "company_seat": "Berlin",
      "details": "04.04.2025 (Bekanntmachungsdatum)\n\nBerlin Amtsgericht Berlin (Charlottenburg) HRB 256346\nEinreichung neuer Dokumente\n\nSmart InsurTech AG\nAktiengesellschaft\nBerlin\n\nAls nicht eingetragen wird veröffentlicht:Es wurde eine neue Liste der Aufsichtsratsmitglieder eingereicht (§ 106 AktG)."
    },
    {
      "date": "2025-04-04",
      "id": "105685",
      "original_text": "Registerbekanntmachung nach dem Umwandlungsgesetz\nBaden-Württemberg Amtsgericht Stuttgart HRB 797390\nRadius Dynamics GmbH – Tübingen",
      "type": "Registerbekanntmachung nach dem Umwandlungsgesetz",
      "state": "Baden-Württemberg",
      "amtsgericht": "Amtsgericht Stuttgart",
      "registernummer": "HRB 797390",
      "registerart": "HRB",
      "company_name": "Radius Dynamics GmbH",
      "company_seat": "Tübingen",
      "details": "04.04.2025 (Bekanntmachungsdatum)\n\nBaden-Württemberg Amtsgericht Stuttgart HRB 797390\nRegisterbekanntmachung nach dem Umwandlungsgesetz 04.04.2025 (Eintragungsdatum)\n\nRadius Dynamics GmbH\nGesellschaft mit beschränkter Haftung\nTübingen\n\nAls nicht eingetragen wird bekanntgemacht:\nDen Gläubigern der an der Verschmelzung beteiligten Rechtsträger ist, wenn sie binnen sechs Monaten nach dem Tag, an dem die Eintragung der Verschmelzung in das Register des Sitzes desjenigen Rechtsträgers, dessen Gläubiger sie sind, nach § 19 Abs. 3 UmwG als bekanntgemacht gilt, ihren Anspruch nach Grund und Höhe schriftlich anmelden, Sicherheit zu leisten, soweit sie nicht Befriedigung verlangen können. Dieses Recht steht den Gläubigern jedoch nur zu, wenn sie glaubhaft machen, dass durch die Verschmelzung die Erfüllung ihrer Forderung gefährdet wird."
    },
    {
      "date": "2025-04-04",
      "id": "105686",
      "original_text": "Registerbekanntmachung nach dem Umwandlungsgesetz\nHamburg Amtsgericht Hamburg HRB 115918\nREAFINA AG – Hamburg",
      "type": "Registerbekanntmachung nach dem Umwandlungsgesetz",
      "state": "Hamburg",
      "amtsgericht": "Amtsgericht Hamburg",
      "registernummer": "HRB 115918",
      "registerart": "HRB",
      "company_name": "REAFINA AG",
      "company_seat": "Hamburg",
      "details": "04.04.2025 (Bekanntmachungsdatum)\n\nHamburg Amtsgericht Hamburg HRB 115918\nRegisterbekanntmachung nach dem Umwandlungsgesetz 04.04.2025 (Eintragungsdatum)\n\nREAFINA AG\nAktiengesellschaft\nHamburg\n\nAls nicht eingetragen wird bekannt gemacht:\nDen Gläubigern der an der formwechselnden Umwandlung beteiligten Gesellschaften ist, wenn sie binnen sechs Monaten nach dem Tag, an dem die Eintragung der formwechselnden Umwandlung in das Register des Sitzes desjenigen Rechtsträgers, dessen Gläubiger sie sind, nach § 19 Absatz 3 UmwG als bekannt gemacht gilt, ihren Anspruch nach Grund und Höhe schriftlich anmelden, Sicherheit zu leisten, soweit sie nicht Befriedigung verlangen können. Dieses Recht steht den Gläubigern jedoch nur zu, wenn sie glaubhaft machen, dass durch die formwechselnde Umwandlung die Erfüllung ihrer Forderung gefährdet wird."
    },
    {
      "date": "2025-04-04",
      "id": "105687",
      "original_text": "Registerbekanntmachung nach dem Umwandlungsgesetz\nBaden-Württemberg Amtsgericht Ulm HRB 749711\nA. Bortolazzi GmbH – Bopfingen",
      "type": "Registerbekanntmachung nach dem Umwandlungsgesetz",
      "state": "Baden-Württemberg",
      "amtsgericht": "Amtsgericht Ulm",
      "registernummer": "HRB 749711",
      "registerart": "HRB",
      "company_name": "A. Bortolazzi GmbH",
      "company_seat": "Bopfingen",
      "details": "04.04.2025 (Bekanntmachungsdatum)\n\nBaden-Württemberg Amtsgericht Ulm HRB 749711\nRegisterbekanntmachung nach dem Umwandlungsgesetz 04.04.2025 (Eintragungsdatum)\n\nA. Bortolazzi GmbH\nGesellschaft mit beschränkter Haftung\nBopfingen\n\nAls nicht eingetragen wird bekanntgemacht:\nDen Gläubigern des an dem Formwechsel beteiligten Rechtsträgers ist, wenn sie binnen sechs Monaten nach dem Tag, an dem die Eintragung des Formwechsels in das Register des Sitzes desjenigen Rechtsträgers, dessen Gläubiger sie sind, nach § 19 Abs. 3 UmwG als bekanntgemacht gilt, ihren Anspruch nach Grund und Höhe schriftlich anmelden, Sicherheit zu leisten, soweit sie nicht Befriedigung verlangen können. Dieses Recht steht den Gläubigern jedoch nur zu, wenn sie glaubhaft machen, dass durch den Formwechsel die Erfüllung ihrer Forderung gefährdet wird."
    },
    {
      "date": "2025-04-04",
      "id": "105688",
      "original_text": "Registerbekanntmachung nach dem Umwandlungsgesetz\nBaden-Württemberg Amtsgericht Mannheim HRB 505849\nMensaMax GmbH – Pforzheim",
      "type": "Registerbekanntmachung nach dem Umwandlungsgesetz",
      "state": "Baden-Württemberg",
      "amtsgericht": "Amtsgericht Mannheim",
      "registernummer": "HRB 505849",
      "registerart": "HRB",
      "company_name": "MensaMax GmbH",
      "company_seat": "Pforzheim",
      "details": "04.04.2025 (Bekanntmachungsdatum)\n\nBaden-Württemberg Amtsgericht Mannheim HRB 505849\nRegisterbekanntmachung nach dem Umwandlungsgesetz 04.04.2025 (Eintragungsdatum)\n\nMensaMax GmbH\nGesellschaft mit beschränkter Haftung\nPforzheim\n\nDen Gläubigern der an der Verschmelzung beteiligten Rechtsträger ist, wenn sie binnen sechs Monaten nach dem Tag, an dem die Eintragung der Verschmelzung in das Register des Sitzes desjenigen Rechtsträgers, dessen Gläubiger sie sind, nach § 19 Abs. 3 UmwG als bekanntgemacht gilt, ihren Anspruch nach Grund und Höhe schriftlich anmelden, Sicherheit zu leisten, soweit sie nicht Befriedigung verlangen können. Dieses Recht steht den Gläubigern jedoch nur zu, wenn sie glaubhaft machen, dass durch die Verschmelzung die Erfüllung ihrer Forderung gefährdet wird."
    },
    {
      "date": "2025-04-04",
      "id": "105689",
      "original_text": "Registerbekanntmachung nach dem Umwandlungsgesetz\nBerlin Amtsgericht Berlin (Charlottenburg) HRB 141335\nColmar GmbH – Berlin",
      "type": "Registerbekanntmachung nach dem Umwandlungsgesetz",
      "state": "Berlin",
      "amtsgericht": "Amtsgericht Berlin (Charlottenburg)",
      "registernummer": "HRB 141335",
      "registerart": "HRB",
      "company_name": "Colmar GmbH",
      "company_seat": "Berlin",
      "details": "04.04.2025 (Bekanntmachungsdatum)\n\nBerlin Amtsgericht Berlin (Charlottenburg) HRB 141335\nRegisterbekanntmachung nach dem Umwandlungsgesetz 03.04.2025 (Eintragungsdatum)\n\nColmar GmbH\nGesellschaft mit beschränkter Haftung\nBerlin\n\nZu Eintragungsnummer 6 vom 03.04.2025 wird als nicht eingetragen veröffentlicht: Den Gläubigern der an der Verschmelzung beteiligten Rechtsträger ist, wenn sie binnen sechs Monaten nach dem Tag, an dem die Eintragung der Verschmelzung in das Register des Sitzes desjenigen Rechtsträgers, dessen Gläubiger sie sind, als bekannt gemacht gilt, ihren Anspruch nach Grund und Höhe schriftlich anmelden, Sicherheit zu leisten, soweit sie nicht Befriedigung verlangen können. Dieses Recht steht den Gläubigern jedoch nur zu, wenn sie glaubhaft machen, dass durch die Verschmelzung die Erfüllung ihrer Forderung gefährdet wird. Das Recht, Sicherheitsleistung zu verlangen, steht Gläubigern nicht zu, die im Falle der Insolvenz ein Recht auf vorzugsweise Befriedigung aus einer Deckungsmasse haben, die nach gesetzlicher Vorschrift zu ihrem Schutz errichtet und staatlich überwacht ist."
    },
    {
      "date": "2025-04-04",
      "id": "105690",
      "original_text": "Registerbekanntmachung nach dem Umwandlungsgesetz\nBrandenburg Amtsgericht Neuruppin HRA 2656\nErdbau, Transporte und Mineralölhandel Hustan e.K. – Germendorf",
      "type": "Registerbekanntmachung nach dem Umwandlungsgesetz",
      "state": "Brandenburg",
      "amtsgericht": "Amtsgericht Neuruppin",
      "registernummer": "HRA 2656",
      "registerart": "HRA",
      "company_name": "Erdbau, Transporte und Mineralölhandel Hustan e.K.",
      "company_seat": "Germendorf",
      "details": "04.04.2025 (Bekanntmachungsdatum)\n\nBrandenburg Amtsgericht Neuruppin HRA 2656\nRegisterbekanntmachung nach dem Umwandlungsgesetz 28.03.2025 (Eintragungsdatum)\n\nErdbau, Transporte und Mineralölhandel Hustan e.K.\nEinzelkaufmann / Einzelkauffrau\nGermendorf\n\nZu Eintragungsnummer 7 vom 28.03.2025 wird als nicht eingetragen veröffentlicht:\nDen Gläubigern der an der Umwandlung beteiligten Rechtsträger ist, wenn sie binnen sechs Monaten nach dem Tag, an dem die Eintragung der Umwandlung in das Register des Sitzes desjenigen Rechtsträgers, dessen Gläubiger sie sind, als bekannt gemacht gilt, ihren Anspruch nach Grund und Höhe schriftlich anmelden, Sicherheit zu leisten, soweit sie nicht Befriedigung verlangen können. Dieses Recht steht den Gläubigern jedoch nur zu, wenn sie glaubhaft machen, dass durch die Umwandlung die Erfüllung ihrer Forderung gefährdet wird"
    },
    {
      "date": "2025-04-04",
      "id": "105691",
      "original_text": "Sonstige Registerbekanntmachung\nBaden-Württemberg Amtsgericht Stuttgart HRB 746339\nStauch Projektbau GmbH – Kupferzell",
      "type": "Sonstige Registerbekanntmachung",
      "state": "Baden-Württemberg",
      "amtsgericht": "Amtsgericht Stuttgart",
      "registernummer": "HRB 746339",
      "registerart": "HRB",
      "company_name": "Stauch Projektbau GmbH",
      "company_seat": "Kupferzell",
      "details": "04.04.2025 (Bekanntmachungsdatum)\n\nBaden-Württemberg Amtsgericht Stuttgart HRB 746339\nSonstige Registerbekanntmachung 04.04.2025 (Eintragungsdatum)\n\nStauch Projektbau GmbH\nGesellschaft mit beschränkter Haftung\nKupferzell\n\nAls nicht eingetragen wird bekanntgemacht:\nDen Gläubigern der Gesellschaft, deren Forderungen begründet worden sind, bevor die Eintragung der Beendigung des Vertrages in das Handelsregister nach § 10 HGB als bekanntgemacht gilt, ist vom anderen Vertragsteil Sicherheit zu leisten, wenn sie sich binnen sechs Monaten nach der Bekanntmachung zu diesem Zweck bei ihm melden."
    },
    {
      "date": "2025-04-04",
      "id": "105692",
      "original_text": "Registerbekanntmachung nach dem Umwandlungsgesetz\nBaden-Württemberg Amtsgericht Freiburg HRB 732150\nKNF Vertriebs GmbH – Eschbach",
      "type": "Registerbekanntmachung nach dem Umwandlungsgesetz",
      "state": "Baden-Württemberg",
      "amtsgericht": "Amtsgericht Freiburg",
      "registernummer": "HRB 732150",
      "registerart": "HRB",
      "company_name": "KNF Vertriebs GmbH",
      "company_seat": "Eschbach",
      "details": "04.04.2025 (Bekanntmachungsdatum)\n\nBaden-Württemberg Amtsgericht Freiburg HRB 732150\nRegisterbekanntmachung nach dem Umwandlungsgesetz 04.04.2025 (Eintragungsdatum)\n\nKNF Vertriebs GmbH\nGesellschaft mit beschränkter Haftung\nEschbach\n\nAls nicht eingetragen wird bekanntgemacht:\nDen Gläubigern der an der Abspaltung beteiligten Rechtsträger ist, wenn sie binnen sechs Monaten nach dem Tag, an dem die Eintragung der Abspaltung in das Register des Sitzes desjenigen Rechtsträgers, dessen Gläubiger sie sind, nach § 19 Abs. 3 UmwG als bekanntgemacht gilt, ihren Anspruch nach Grund und Höhe schriftlich anmelden, Sicherheit zu leisten, soweit sie nicht Befriedigung verlangen können. Dieses Recht steht den Gläubigern jedoch nur zu, wenn sie glaubhaft machen, dass durch die Abspaltung die Erfüllung ihrer Forderung gefährdet wird."
    },
    {
      "date": "2025-04-04",
      "id": "105693",
      "original_text": "Registerbekanntmachung nach dem Umwandlungsgesetz\nBaden-Württemberg Amtsgericht Freiburg HRB 2190\nKNF Neuberger GmbH – Freiburg im Breisgau",
      "type": "Registerbekanntmachung nach dem Umwandlungsgesetz",
      "state": "Baden-Württemberg",
      "amtsgericht": "Amtsgericht Freiburg",
      "registernummer": "HRB 2190",
      "registerart": "HRB",
      "company_name": "KNF Neuberger GmbH",
      "company_seat": "Freiburg im Breisgau",
      "details": "04.04.2025 (Bekanntmachungsdatum)\n\nBaden-Württemberg Amtsgericht Freiburg HRB 2190\nRegisterbekanntmachung nach dem Umwandlungsgesetz 04.04.2025 (Eintragungsdatum)\n\nKNF Neuberger GmbH\nGesellschaft mit beschränkter Haftung\nFreiburg im Breisgau\n\nAls nicht eingetragen wird bekanntgemacht:\nDen Gläubigern der an der Abspaltung beteiligten Rechtsträger ist, wenn sie binnen sechs Monaten nach dem Tag, an dem die Eintragung der Abspaltung in das Register des Sitzes desjenigen Rechtsträgers, dessen Gläubiger sie sind, nach § 19 Abs. 3 UmwG als bekanntgemacht gilt, ihren Anspruch nach Grund und Höhe schriftlich anmelden, Sicherheit zu leisten, soweit sie nicht Befriedigung verlangen können. Dieses Recht steht den Gläubigern jedoch nur zu, wenn sie glaubhaft machen, dass durch die Abspaltung die Erfüllung ihrer Forderung gefährdet wird."
    },
    {
      "date": "2025-04-04",
      "id": "105694",
      "original_text": "Einreichung neuer Dokumente\nBaden-Württemberg Amtsgericht Mannheim HRB 737678\nY1 Digital AG – Karlsruhe",
      "type": "Einreichung neuer Dokumente",
      "state": "Baden-Württemberg",
      "amtsgericht": "Amtsgericht Mannheim",
      "registernummer": "HRB 737678",
      "registerart": "HRB",
      "company_name": "Y1 Digital AG",
      "company_seat": "Karlsruhe",
      "details": "04.04.2025 (Bekanntmachungsdatum)\n\nBaden-Württemberg Amtsgericht Mannheim HRB 737678\nEinreichung neuer Dokumente 04.04.2025 (Eintragungsdatum)\n\nY1 Digital AG\nAktiengesellschaft\nKarlsruhe\n\nDie Gesellschaft hat am 03.04.2025 die Liste über die Zusammensetzung des Aufsichtsrats zum Handelsregister eingereicht."
    },
    {
      "date": "2025-04-04",
      "id": "105695",
      "original_text": "Löschungsankündigung\nSchleswig-Holstein Amtsgericht Kiel HRA 915 NM\nReinhold Pilzecker Maschinenbau e. Kfm. – Boostedt",
      "type": "Löschungsankündigung",
      "state": "Schleswig-Holstein",
      "amtsgericht": "Amtsgericht Kiel",
      "registernummer": "HRA 915 NM",
      "registerart": "HRA",
      "company_name": "Reinhold Pilzecker Maschinenbau e. Kfm.",
      "company_seat": "Boostedt",
      "details": "04.04.2025 (Bekanntmachungsdatum)\n\nSchleswig-Holstein Amtsgericht Kiel HRA 915 NM\nLöschungsankündigung\n\nReinhold Pilzecker Maschinenbau e. Kfm.\nEinzelkaufmann / Einzelkauffrau\nBoostedt\n\nDie im hiesigen Register unter HRA 915 NM eingetragene Firma Reinhold Pilzecker Maschinenbau e. Kfm. mit Sitz in Boostedt\nsoll gemäß § 31 Abs. 2 HGB und § 393 FamFG von Amts wegen gelöscht werden, weil unter der oben angeführten Firma weder ein vollkaufmännisches Gewerbe noch ein Geschäftslokal unterhalten wird.\n\nEs werden deshalb der Erbe/die Erben des eingetragenen Inhabers hierdurch aufgefordert, einen etwaigen Widerspruch gegen die beabsichtigte Löschung binnen zwei Monaten bei dem unterzeichnenden Gericht geltend zu machen, da andernfalls die Löschung erfolgen wird."
    },
    {
      "date": "2025-04-04",
      "id": "105696",
      "original_text": "Registerbekanntmachung nach dem Umwandlungsgesetz\nThüringen Amtsgericht Jena HRB 203033\nWSH Heizungsbau GmbH – Pößneck",
      "type": "Registerbekanntmachung nach dem Umwandlungsgesetz",
      "state": "Thüringen",
      "amtsgericht": "Amtsgericht Jena",
      "registernummer": "HRB 203033",
      "registerart": "HRB",
      "company_name": "WSH Heizungsbau GmbH",
      "company_seat": "Pößneck",
      "details": "04.04.2025 (Bekanntmachungsdatum)\n\nThüringen Amtsgericht Jena HRB 203033\nRegisterbekanntmachung nach dem Umwandlungsgesetz 04.04.2025 (Eintragungsdatum)\n\nWSH Heizungsbau GmbH\nGesellschaft mit beschränkter Haftung\nPößneck\n\nNicht eingetragen: Den Gläubigern der an der Verschmelzung beteiligten Rechtsträger, ist wenn sie binnen sechs Monaten nach dem Tag, an dem die Eintragung der Verschmelzung in das Register des Sitzes desjenigen Rechtsträgers, dessen Gläubiger sie sind,  nach § 19 Abs. 3 UmwG als bekanntgemacht gilt, ihren Anspruch nach Grund und Höhe schriftlich anmelden, Sicherheit zu leisten, soweit sie nicht Befriedigung verlangen können. Dieses Recht steht ihnen jedoch nur zu, wenn sie glaubhaft machen, daß durch die Verschmelzung die Erfüllung ihrer Forderung gefährdet wird."
    },
    {
      "date": "2025-04-04",
      "id": "105697",
      "original_text": "Löschungsankündigung\nThüringen Amtsgericht Jena HRB 501881\nMontagebau Hoffmann GmbH – Schimberg",
      "type": "Löschungsankündigung",
      "state": "Thüringen",
      "amtsgericht": "Amtsgericht Jena",
      "registernummer": "HRB 501881",
      "registerart": "HRB",
      "company_name": "Montagebau Hoffmann GmbH",
      "company_seat": "Schimberg",
      "details": "04.04.2025 (Bekanntmachungsdatum)\n\nThüringen Amtsgericht Jena HRB 501881\nLöschungsankündigung\n\nMontagebau Hoffmann GmbH\nGesellschaft mit beschränkter Haftung\nSchimberg\n\nDas Registergericht beabsichtigt, die im Handelsregister eingetragene Gesellschaft wegen Vermögenslosigkeit nach § 394 FamFG von Amts wegen zu löschen. Die Frist zur Erhebung eines Widerspruchs gegen die beabsichtigte Löschung wird auf 6 Wochen festgesetzt."
    },
    {
      "date": "2025-04-04",
      "id": "105698",
      "original_text": "Registerbekanntmachung nach dem Umwandlungsgesetz\nMecklenburg-Vorpommern Amtsgericht Schwerin HRB 11450\nBLL Agrar GmbH – Glasin",
      "type": "Registerbekanntmachung nach dem Umwandlungsgesetz",
      "state": "Mecklenburg-Vorpommern",
      "amtsgericht": "Amtsgericht Schwerin",
      "registernummer": "HRB 11450",
      "registerart": "HRB",
      "company_name": "BLL Agrar GmbH",
      "company_seat": "Glasin",
      "details": "04.04.2025 (Bekanntmachungsdatum)\n\nMecklenburg-Vorpommern Amtsgericht Schwerin HRB 11450\nRegisterbekanntmachung nach dem Umwandlungsgesetz 04.04.2025 (Eintragungsdatum)\n\nBLL Agrar GmbH\nGesellschaft mit beschränkter Haftung\nGlasin\n\nDen Gläubigern der an der Verschmelzung beteiligten Gesellschaften ist, wenn sie binnen sechs Monaten nach dem Tag, an dem die Eintragung der Verschmelzungen in das Register des Sitzes desjenigen Rechtsträgers, dessen Gläubiger sie sind, nach § 19 Absatz 3 UmwG als bekanntgemacht gilt, ihren Anspruch nach Grund und Höhe schriftlich anmelden, Sicherheit zu leisten, soweit sie nicht Befriedigung verlangen können. Dieses Recht steht den Gläubigern jedoch nur zu, wenn sie glaubhaft machen, dass durch die Verschmelzung die Erfüllung ihrer Forderung gefährdet wird."
    },
    {
      "date": "2025-04-04",
      "id": "105699",
      "original_text": "Registerbekanntmachung nach dem Umwandlungsgesetz\nMecklenburg-Vorpommern Amtsgericht Schwerin HRB 10729\nBLL Ferkel GmbH – Glasin",
      "type": "Registerbekanntmachung nach dem Umwandlungsgesetz",
      "state": "Mecklenburg-Vorpommern",
      "amtsgericht": "Amtsgericht Schwerin",
      "registernummer": "HRB 10729",
      "registerart": "HRB",
      "company_name": "BLL Ferkel GmbH",
      "company_seat": "Glasin",
      "details": "04.04.2025 (Bekanntmachungsdatum)\n\nMecklenburg-Vorpommern Amtsgericht Schwerin HRB 10729\nRegisterbekanntmachung nach dem Umwandlungsgesetz 04.04.2025 (Eintragungsdatum)\n\nBLL Ferkel GmbH\nGesellschaft mit beschränkter Haftung\nGlasin\n\nDen Gläubigern der an der Verschmelzung beteiligten Gesellschaften ist, wenn sie binnen sechs Monaten nach dem Tag, an dem die Eintragung der Verschmelzungen in das Register des Sitzes desjenigen Rechtsträgers, dessen Gläubiger sie sind, nach § 19 Absatz 3 UmwG als bekanntgemacht gilt, ihren Anspruch nach Grund und Höhe schriftlich anmelden, Sicherheit zu leisten, soweit sie nicht Befriedigung verlangen können. Dieses Recht steht den Gläubigern jedoch nur zu, wenn sie glaubhaft machen, dass durch die Verschmelzung die Erfüllung ihrer Forderung gefährdet wird."
    },
    {
      "date": "2025-04-04",
      "id": "105700",
      "original_text": "Einreichung neuer Dokumente\nBaden-Württemberg Amtsgericht Ulm HRB 743255\nANDRITZ Schuler GmbH – Göppingen",
      "type": "Einreichung neuer Dokumente",
      "state": "Baden-Württemberg",
      "amtsgericht": "Amtsgericht Ulm",
      "registernummer": "HRB 743255",
      "registerart": "HRB",
      "company_name": "ANDRITZ Schuler GmbH",
      "company_seat": "Göppingen",
      "details": "04.04.2025 (Bekanntmachungsdatum)\n\nBaden-Württemberg Amtsgericht Ulm HRB 743255\nEinreichung neuer Dokumente\n\nANDRITZ Schuler GmbH\nGesellschaft mit beschränkter Haftung\nGöppingen\n\nDie Gesellschaft hat am 02.04.2025 die Liste über die Zusammensetzung des Aufsichtsrats zum Handelsregister eingereicht."
    },
    {
      "date": "2025-04-04",
      "id": "105701",
      "original_text": "Löschungsankündigung\nBerlin Amtsgericht Berlin (Charlottenburg) HRB 237224\nNobel7Car GmbH – Berlin",
      "type": "Löschungsankündigung",
      "state": "Berlin",
      "amtsgericht": "Amtsgericht Berlin (Charlottenburg)",
      "registernummer": "HRB 237224",
      "registerart": "HRB",
      "company_name": "Nobel7Car GmbH",
      "company_seat": "Berlin",
      "details": "04.04.2025 (Bekanntmachungsdatum)\n\nBerlin Amtsgericht Berlin (Charlottenburg) HRB 237224\nLöschungsankündigung\n\nNobel7Car GmbH\nGesellschaft mit beschränkter Haftung\nBerlin\n\nBei der nachstehenden Gesellschaft wird das Amtslöschungsverfahren gemäß § 394 FamFG eingeleitet. Widerspruchsfrist 6 Wochen"
    },
    {
      "date": "2025-04-04",
      "id": "105702",
      "original_text": "Registerbekanntmachung nach dem Umwandlungsgesetz\nSchleswig-Holstein Amtsgericht Lübeck HRB 13707\nPlakos GmbH – Lübeck",
      "type": "Registerbekanntmachung nach dem Umwandlungsgesetz",
      "state": "Schleswig-Holstein",
      "amtsgericht": "Amtsgericht Lübeck",
      "registernummer": "HRB 13707",
      "registerart": "HRB",
      "company_name": "Plakos GmbH",
      "company_seat": "Lübeck",
      "details": "04.04.2025 (Bekanntmachungsdatum)\n\nSchleswig-Holstein Amtsgericht Lübeck HRB 13707\nRegisterbekanntmachung nach dem Umwandlungsgesetz 03.04.2025 (Eintragungsdatum)\n\nPlakos GmbH\nGesellschaft mit beschränkter Haftung\nLübeck\n\nZu Eintragungsnummer 7 vom 03.04.2025 wird als nicht eingetragen veröffentlicht: Den Gläubigern der an der Verschmelzung beteiligten Rechtsträger ist, wenn sie binnen sechs Monaten nach dem Tag, an dem die Eintragung der Verschmelzung in das Register des Sitzes desjenigen Rechtsträgers, dessen Gläubiger sie sind, als bekannt gemacht gilt, ihren Anspruch nach Grund und Höhe schriftlich anmelden, Sicherheit zu leisten, soweit sie nicht Befriedigung verlangen können. Dieses Recht steht den Gläubigern jedoch nur zu, wenn sie glaubhaft machen, dass durch die Verschmelzung die Erfüllung ihrer Forderung gefährdet wird."
    },
    {
      "date": "2025-04-04",
      "id": "105703",
      "original_text": "Registerbekanntmachung nach dem Umwandlungsgesetz\nBerlin Amtsgericht Berlin (Charlottenburg) HRB 243624\nStadtbad Verwaltungs GmbH – Berlin",
      "type": "Registerbekanntmachung nach dem Umwandlungsgesetz",
      "state": "Berlin",
      "amtsgericht": "Amtsgericht Berlin (Charlottenburg)",
      "registernummer": "HRB 243624",
      "registerart": "HRB",
      "company_name": "Stadtbad Verwaltungs GmbH",
      "company_seat": "Berlin",
      "details": "04.04.2025 (Bekanntmachungsdatum)\n\nBerlin Amtsgericht Berlin (Charlottenburg) HRB 243624\nRegisterbekanntmachung nach dem Umwandlungsgesetz 03.04.2025 (Eintragungsdatum)\n\nStadtbad Verwaltungs GmbH\nGesellschaft mit beschränkter Haftung\nBerlin\n\nZu Eintragungsnummer 3 vom 03.04.2025 wird als nicht eingetragen veröffentlicht: Den Gläubigern der an der Verschmelzung beteiligten Rechtsträger ist, wenn sie binnen sechs Monaten nach dem Tag, an dem die Eintragung der Verschmelzung in das Register des Sitzes desjenigen Rechtsträgers, dessen Gläubiger sie sind, als bekannt gemacht gilt, ihren Anspruch nach Grund und Höhe schriftlich anmelden, Sicherheit zu leisten, soweit sie nicht Befriedigung verlangen können. Dieses Recht steht den Gläubigern jedoch nur zu, wenn sie glaubhaft machen, dass durch die Verschmelzung die Erfüllung ihrer Forderung gefährdet wird. Das Recht, Sicherheitsleistung zu verlangen, steht Gläubigern nicht zu, die im Falle der Insolvenz ein Recht auf vorzugsweise Befriedigung aus einer Deckungsmasse haben, die nach gesetzlicher Vorschrift zu ihrem Schutz errichtet und staatlich überwacht ist."
    },
    {
      "date": "2025-04-04",
      "id": "105704",
      "original_text": "Löschungsankündigung\nBerlin Amtsgericht Berlin (Charlottenburg) HRB 236305\nWF Heusenstamm 11 GmbH – Berlin",
      "type": "Löschungsankündigung",
      "state": "Berlin",
      "amtsgericht": "Amtsgericht Berlin (Charlottenburg)",
      "registernummer": "HRB 236305",
      "registerart": "HRB",
      "company_name": "WF Heusenstamm 11 GmbH",
      "company_seat": "Berlin",
      "details": "04.04.2025 (Bekanntmachungsdatum)\n\nBerlin Amtsgericht Berlin (Charlottenburg) HRB 236305\nLöschungsankündigung\n\nWF Heusenstamm 11 GmbH\nGesellschaft mit beschränkter Haftung\nBerlin\n\nEs ist beabsichtigt, den Geschäftsführer Robert-Darie Barbu wegen Mangels einer wesentlichen Voraussetzung  gemäß § 395 FamFG von Amts wegen zu löschen; Widerspruchsfrist: 2 Wochen"
    },
    {
      "date": "2025-04-04",
      "id": "105705",
      "original_text": "Einreichung neuer Dokumente\nHamburg Amtsgericht Hamburg HRB 144712\nHTZ Immobilien AG – Hamburg",
      "type": "Einreichung neuer Dokumente",
      "state": "Hamburg",
      "amtsgericht": "Amtsgericht Hamburg",
      "registernummer": "HRB 144712",
      "registerart": "HRB",
      "company_name": "HTZ Immobilien AG",
      "company_seat": "Hamburg",
      "details": "04.04.2025 (Bekanntmachungsdatum)\n\nHamburg Amtsgericht Hamburg HRB 144712\nEinreichung neuer Dokumente 04.04.2025 (Eintragungsdatum)\n\nHTZ Immobilien AG\nAktiengesellschaft\nHamburg\n\nAls nicht eingetragen wird bekannt gemacht: Liste des Aufsichtsrats wurde eingereicht."
    },
    {
      "date": "2025-04-04",
      "id": "105706",
      "original_text": "Löschungsankündigung\nBerlin Amtsgericht Berlin (Charlottenburg) HRB 147201\nGrill Profi GmbH – Berlin",
      "type": "Löschungsankündigung",
      "state": "Berlin",
      "amtsgericht": "Amtsgericht Berlin (Charlottenburg)",
      "registernummer": "HRB 147201",
      "registerart": "HRB",
      "company_name": "Grill Profi GmbH",
      "company_seat": "Berlin",
      "details": "04.04.2025 (Bekanntmachungsdatum)\n\nBerlin Amtsgericht Berlin (Charlottenburg) HRB 147201\nLöschungsankündigung\n\nGrill Profi GmbH\nGesellschaft mit beschränkter Haftung\nBerlin\n\nBei der nachstehenden Gesellschaft wird das Amtslöschungsverfahren gemäß § 394 FamFG eingeleitet. Widerspruchsfrist 6 Wochen"
    },
    {
      "date": "2025-04-04",
      "id": "105707",
      "original_text": "Einreichung neuer Dokumente\nBaden-Württemberg Amtsgericht Stuttgart HRB 23470\nBioPro Baden-Württemberg GmbH – Stuttgart",
      "type": "Einreichung neuer Dokumente",
      "state": "Baden-Württemberg",
      "amtsgericht": "Amtsgericht Stuttgart",
      "registernummer": "HRB 23470",
      "registerart": "HRB",
      "company_name": "BioPro Baden-Württemberg GmbH",
      "company_seat": "Stuttgart",
      "details": "04.04.2025 (Bekanntmachungsdatum)\n\nBaden-Württemberg Amtsgericht Stuttgart HRB 23470\nEinreichung neuer Dokumente\n\nBioPro Baden-Württemberg GmbH\nGesellschaft mit beschränkter Haftung\nStuttgart\n\nDie Gesellschaft hat am 03.04.2025 die Liste über die Zusammensetzung des Aufsichtsrats zum Handelsregister eingereicht."
    },
    {
      "date": "2025-04-04",
      "id": "105708",
      "original_text": "Registerbekanntmachung nach dem Umwandlungsgesetz\nMecklenburg-Vorpommern Amtsgericht Stralsund HRB 22471\nSolycon UG (haftungsbeschränkt) – Lüssow",
      "type": "Registerbekanntmachung nach dem Umwandlungsgesetz",
      "state": "Mecklenburg-Vorpommern",
      "amtsgericht": "Amtsgericht Stralsund",
      "registernummer": "HRB 22471",
      "registerart": "HRB",
      "company_name": "Solycon UG (haftungsbeschränkt)",
      "company_seat": "Lüssow",
      "details": "04.04.2025 (Bekanntmachungsdatum)\n\nMecklenburg-Vorpommern Amtsgericht Stralsund HRB 22471\nRegisterbekanntmachung nach dem Umwandlungsgesetz 04.04.2025 (Eintragungsdatum)\n\nSolycon UG (haftungsbeschränkt)\nGesellschaft mit beschränkter Haftung\nLüssow\n\nAls nicht eingetragen wird veröffentlicht: Den Gläubigern der an der Umwandlung beteiligten Rechtsträger ist, wenn sie binnen sechs\nMonaten nach dem Tag, an dem die Eintragung der Umwandlung in das Register des Sitzes desjenigen Rechtsträgers, dessen Gläubiger sie sind, nach § 19 Abs. 3 UmwG als bekannt gemacht gilt, ihren Anspruch nach Grund und Höhe in Textform anmelden, Sicherheit zu leisten, soweit sie nicht Befriedigung verlangen können. Dieses Recht steht den Gläubigern jedoch nur zu, wenn sie glaubhaft machen, dass durch die Umwandlung die Erfüllung der Forderung gefährdet wird."
    },
    {
      "date": "2025-04-04",
      "id": "105709",
      "original_text": "Registerbekanntmachung nach dem Umwandlungsgesetz\nNordrhein-Westfalen Amtsgericht Coesfeld HRA 7723\nSchlossgarage Dumpe GmbH & Co. KG – Nordkirchen",
      "type": "Registerbekanntmachung nach dem Umwandlungsgesetz",
      "state": "Nordrhein-Westfalen",
      "amtsgericht": "Amtsgericht Coesfeld",
      "registernummer": "HRA 7723",
      "registerart": "HRA",
      "company_name": "Schlossgarage Dumpe GmbH & Co. KG",
      "company_seat": "Nordkirchen",
      "details": "04.04.2025 (Bekanntmachungsdatum)\n\nNordrhein-Westfalen Amtsgericht Coesfeld HRA 7723\nRegisterbekanntmachung nach dem Umwandlungsgesetz 04.04.2025 (Eintragungsdatum)\n\nSchlossgarage Dumpe GmbH & Co. KG\nKommanditgesellschaft\nNordkirchen\n\nDen Gläubigern der an der Verschmelzung beteiligten Rechtsträger ist, wenn sie binnen sechs Monaten nach dem Tag, an dem die Eintragung der Verschmelzung in das Register des Sitzes desjenigen Rechtsträgers, dessen Gläubiger sie sind, nach § 19 Absatz 3 UmwG als bekanntgemacht gilt, ihren Anspruch nach Grund und Höhe schriftlich anmelden, Sicherheit zu leisten, soweit sie nicht Befriedigung verlangen können. Dieses Recht steht den Gläubigern jedoch nur zu, wenn sie glaubhaft machen, dass durch die Verschmelzung die Erfüllung ihrer Forderung gefährdet wird."
    },
    {
      "date": "2025-04-04",
      "id": "105710",
      "original_text": "Registerbekanntmachung nach dem Umwandlungsgesetz\nBerlin Amtsgericht Berlin (Charlottenburg) HRB 97214\nLucaNet Aktiengesellschaft – Berlin",
      "type": "Registerbekanntmachung nach dem Umwandlungsgesetz",
      "state": "Berlin",
      "amtsgericht": "Amtsgericht Berlin (Charlottenburg)",
      "registernummer": "HRB 97214",
      "registerart": "HRB",
      "company_name": "LucaNet Aktiengesellschaft",
      "company_seat": "Berlin",
      "details": "04.04.2025 (Bekanntmachungsdatum)\n\nBerlin Amtsgericht Berlin (Charlottenburg) HRB 97214\nRegisterbekanntmachung nach dem Umwandlungsgesetz 03.04.2025 (Eintragungsdatum)\n\nLucaNet Aktiengesellschaft\nAktiengesellschaft\nBerlin\n\nZu Eintragungsnummer 27 vom 03.04.2025 wird als nicht eingetragen veröffentlicht: Den Gläubigern der an der Verschmelzung beteiligten Rechtsträger ist, wenn sie binnen sechs Monaten nach dem Tag, an dem die Eintragung der Verschmelzung in das Register des Sitzes desjenigen Rechtsträgers, dessen Gläubiger sie sind, als bekannt gemacht gilt, ihren Anspruch nach Grund und Höhe schriftlich anmelden, Sicherheit zu leisten, soweit sie nicht Befriedigung verlangen können. Dieses Recht steht den Gläubigern jedoch nur zu, wenn sie glaubhaft machen, dass durch die Verschmelzung die Erfüllung ihrer Forderung gefährdet wird. Das Recht, Sicherheitsleistung zu verlangen, steht Gläubigern nicht zu, die im Falle der Insolvenz ein Recht auf vorzugsweise Befriedigung aus einer Deckungsmasse haben, die nach gesetzlicher Vorschrift zu ihrem Schutz errichtet und staatlich überwacht ist."
    },
    {
      "date": "2025-04-04",
      "id": "105711",
      "original_text": "Löschungsankündigung\nBrandenburg Amtsgericht Cottbus HRA 3060\nMela Media Marketing UG (haftungsbeschränkt) & Co. KG – Schönefeld",
      "type": "Löschungsankündigung",
      "state": "Brandenburg",
      "amtsgericht": "Amtsgericht Cottbus",
      "registernummer": "HRA 3060",
      "registerart": "HRA",
      "company_name": "Mela Media Marketing UG (haftungsbeschränkt) & Co. KG",
      "company_seat": "Schönefeld",
      "details": "04.04.2025 (Bekanntmachungsdatum)\n\nBrandenburg Amtsgericht Cottbus HRA 3060\nLöschungsankündigung\n\nMela Media Marketing UG (haftungsbeschränkt) & Co. KG\nKommanditgesellschaft\nSchönefeld\n\nBei der nachstehenden Gesellschaft wird das Amtslöschungsverfahren gemäß § 394 FamFG eingeleitet."
    },
    {
      "date": "2025-04-04",
      "id": "105712",
      "original_text": "Einreichung neuer Dokumente\nHamburg Amtsgericht Hamburg HRB 130275\nEugen Block Holding GmbH – Hamburg",
      "type": "Einreichung neuer Dokumente",
      "state": "Hamburg",
      "amtsgericht": "Amtsgericht Hamburg",
      "registernummer": "HRB 130275",
      "registerart": "HRB",
      "company_name": "Eugen Block Holding GmbH",
      "company_seat": "Hamburg",
      "details": "04.04.2025 (Bekanntmachungsdatum)\n\nHamburg Amtsgericht Hamburg HRB 130275\nEinreichung neuer Dokumente\n\nEugen Block Holding GmbH\nGesellschaft mit beschränkter Haftung\nHamburg\n\nAls nicht eingetragen wird bekannt gemacht: Liste des Aufsichtsrats wurde eingereicht."
    },
    {
      "date": "2025-04-04",
      "id": "105713",
      "original_text": "Einreichung neuer Dokumente\nBrandenburg Amtsgericht Potsdam HRB 1725\nTechnologie- und Gründerzentrum Potsdam-Mittelmark GmbH – Teltow",
      "type": "Einreichung neuer Dokumente",
      "state": "Brandenburg",
      "amtsgericht": "Amtsgericht Potsdam",
      "registernummer": "HRB 1725",
      "registerart": "HRB",
      "company_name": "Technologie- und Gründerzentrum Potsdam-Mittelmark GmbH",
      "company_seat": "Teltow",
      "details": "04.04.2025 (Bekanntmachungsdatum)\n\nBrandenburg Amtsgericht Potsdam HRB 1725\nEinreichung neuer Dokumente\n\nTechnologie- und Gründerzentrum Potsdam-Mittelmark GmbH\nGesellschaft mit beschränkter Haftung\nTeltow\n\nAls nicht eingetragen wird veröffentlicht: Eine Liste der Mitglieder des Aufsichtsrates wurde zum Handelsregister eingereicht."
    },
    {
      "date": "2025-04-04",
      "id": "105714",
      "original_text": "Registerbekanntmachung nach dem Umwandlungsgesetz\nBaden-Württemberg Amtsgericht Stuttgart HRB 251566\nVolksbank Haus- und Mietverwaltungen Leonberg-Strohgäu GmbH – Leonberg",
      "type": "Registerbekanntmachung nach dem Umwandlungsgesetz",
      "state": "Baden-Württemberg",
      "amtsgericht": "Amtsgericht Stuttgart",
      "registernummer": "HRB 251566",
      "registerart": "HRB",
      "company_name": "Volksbank Haus- und Mietverwaltungen Leonberg-Strohgäu GmbH",
      "company_seat": "Leonberg",
      "details": "04.04.2025 (Bekanntmachungsdatum)\n\nBaden-Württemberg Amtsgericht Stuttgart HRB 251566\nRegisterbekanntmachung nach dem Umwandlungsgesetz 04.04.2025 (Eintragungsdatum)\n\nVolksbank Haus- und Mietverwaltungen Leonberg-Strohgäu GmbH\nGesellschaft mit beschränkter Haftung\nLeonberg\n\nAls nicht eingetragen wird bekanntgemacht:\nDen Gläubigern der an der Verschmelzung beteiligten Rechtsträger ist, wenn sie binnen sechs Monaten nach dem Tag, an dem die Eintragung der Verschmelzung in das Register des Sitzes desjenigen Rechtsträgers, dessen Gläubiger sie sind, nach § 19 Abs. 3 UmwG als bekanntgemacht gilt, ihren Anspruch nach Grund und Höhe schriftlich anmelden, Sicherheit zu leisten, soweit sie nicht Befriedigung verlangen können. Dieses Recht steht den Gläubigern jedoch nur zu, wenn sie glaubhaft machen, dass durch die Verschmelzung die Erfüllung ihrer Forderung gefährdet wird."
    },
    {
      "date": "2025-04-04",
      "id": "105715",
      "original_text": "Einreichung neuer Dokumente\nSachsen Amtsgericht Chemnitz HRB 36635\nGedenkstätte Hoheneck gGmbH – Stollberg/Erzgeb.",
      "type": "Einreichung neuer Dokumente",
      "state": "Sachsen",
      "amtsgericht": "Amtsgericht Chemnitz",
      "registernummer": "HRB 36635",
      "registerart": "HRB",
      "company_name": "Gedenkstätte Hoheneck gGmbH",
      "company_seat": "Stollberg/Erzgeb.",
      "details": "04.04.2025 (Bekanntmachungsdatum)\n\nSachsen Amtsgericht Chemnitz HRB 36635\nEinreichung neuer Dokumente\n\nGedenkstätte Hoheneck gGmbH\nGesellschaft mit beschränkter Haftung\nStollberg/Erzgeb.\n\nAm 02.04.2025 wurde beim Handelsregister des Amtsgerichts Chemnitz die Liste der Mitglieder des Aufsichtsrats gemäß § 52 GmbHG eingereicht."
    },
    {
      "date": "2025-04-04",
      "id": "105716",
      "original_text": "Sonstige Registerbekanntmachung\nNiedersachsen Amtsgericht Oldenburg (Oldenburg) HRB 212339\nfm Büromöbel GmbH – Bösel",
      "type": "Sonstige Registerbekanntmachung",
      "state": "Niedersachsen",
      "amtsgericht": "Amtsgericht Oldenburg (Oldenburg)",
      "registernummer": "HRB 212339",
      "registerart": "HRB",
      "company_name": "fm Büromöbel GmbH",
      "company_seat": "Bösel",
      "details": "04.04.2025 (Bekanntmachungsdatum)\n\nNiedersachsen Amtsgericht Oldenburg (Oldenburg) HRB 212339\nSonstige Registerbekanntmachung 04.04.2025 (Eintragungsdatum)\n\nfm Büromöbel GmbH\nGesellschaft mit beschränkter Haftung\nBösel\n\nDen Gläubigern der Gesellschaft, deren Forderungen begründet worden sind, bevor die Eintragung der Beendigung des Vertrages in das Handelsregister nach § 10 HGB als bekanntgemacht gilt, ist vom anderen Vertragsteil Sicherheit zu leisten, wenn sie sich binnen sechs Monaten nach der Bekanntmachung zu diesem Zweck bei ihm melden."
    },
    {
      "date": "2025-04-04",
      "id": "105717",
      "original_text": "Einreichung neuer Dokumente\nNiedersachsen Amtsgericht Hannover HRB 226673\nConsultingschmiede AG – Hannover",
      "type": "Einreichung neuer Dokumente",
      "state": "Niedersachsen",
      "amtsgericht": "Amtsgericht Hannover",
      "registernummer": "HRB 226673",
      "registerart": "HRB",
      "company_name": "Consultingschmiede AG",
      "company_seat": "Hannover",
      "details": "04.04.2025 (Bekanntmachungsdatum)\n\nNiedersachsen Amtsgericht Hannover HRB 226673\nEinreichung neuer Dokumente\n\nConsultingschmiede AG\nAktiengesellschaft\nHannover\n\nDie Liste der Mitglieder des Aufsichtsrats wurde beim Registergericht eingereicht."
    },
    {
      "date": "2025-04-04",
      "id": "105718",
      "original_text": "Einreichung neuer Dokumente\nBremen Amtsgericht Bremen HRB 3025\nBremer Toto und Lotto Gesellschaft mit beschränkter Haftung – Bremen",
      "type": "Einreichung neuer Dokumente",
      "state": "Bremen",
      "amtsgericht": "Amtsgericht Bremen",
      "registernummer": "HRB 3025",
      "registerart": "HRB",
      "company_name": "Bremer Toto und Lotto Gesellschaft mit beschränkter Haftung",
      "company_seat": "Bremen",
      "details": "04.04.2025 (Bekanntmachungsdatum)\n\nBremen Amtsgericht Bremen HRB 3025\nEinreichung neuer Dokumente\n\nBremer Toto und Lotto Gesellschaft mit beschränkter Haftung\nGesellschaft mit beschränkter Haftung\nBremen\n\nAls nicht eingetragen wird veröffentlicht:  Liste des Aufsichtsrats wurde eingereicht."
    },
    {
      "date": "2025-04-04",
      "id": "105719",
      "original_text": "Löschungsankündigung\nBremen Amtsgericht Bremen HRB 36351\nMy Afro Card UG (haftungsbeschränkt) – Bremen",
      "type": "Löschungsankündigung",
      "state": "Bremen",
      "amtsgericht": "Amtsgericht Bremen",
      "registernummer": "HRB 36351",
      "registerart": "HRB",
      "company_name": "My Afro Card UG (haftungsbeschränkt)",
      "company_seat": "Bremen",
      "details": "04.04.2025 (Bekanntmachungsdatum)\n\nBremen Amtsgericht Bremen HRB 36351\nLöschungsankündigung\n\nMy Afro Card UG (haftungsbeschränkt)\nGesellschaft mit beschränkter Haftung\nBremen\n\nEs ist beabsichtigt die im Handelsregister eingetragene Gesellschaft von Amts wegen gemäß § 394 FamFG zu löschen. Gegen die Löschung kann beim AG Bremen schriftlich oder zu Protokoll der Geschäftsstelle Widerspruch eingelegt werden. Widerspruchsfrist 4 Wochen."
    },
    {
      "date": "2025-04-04",
      "id": "105720",
      "original_text": "Einreichung neuer Dokumente\nBremen Amtsgericht Bremen HRB 33169\nsyniotec GmbH – Bremen",
      "type": "Einreichung neuer Dokumente",
      "state": "Bremen",
      "amtsgericht": "Amtsgericht Bremen",
      "registernummer": "HRB 33169",
      "registerart": "HRB",
      "company_name": "syniotec GmbH",
      "company_seat": "Bremen",
      "details": "04.04.2025 (Bekanntmachungsdatum)\n\nBremen Amtsgericht Bremen HRB 33169\nEinreichung neuer Dokumente\n\nsyniotec GmbH\nGesellschaft mit beschränkter Haftung\nBremen\n\nAls nicht eingetragen wird veröffentlicht:  Liste des Aufsichtsrats (Beiratsmitglieder) wurde eingereicht."
    },
    {
      "date": "2025-04-04",
      "id": "105721",
      "original_text": "Registerbekanntmachung nach dem Umwandlungsgesetz\nRheinland-Pfalz Amtsgericht Montabaur HRB 30456\nVeritas Kinder- und Jugendhilfe GmbH – Niederhofen",
      "type": "Registerbekanntmachung nach dem Umwandlungsgesetz",
      "state": "Rheinland-Pfalz",
      "amtsgericht": "Amtsgericht Montabaur",
      "registernummer": "HRB 30456",
      "registerart": "HRB",
      "company_name": "Veritas Kinder- und Jugendhilfe GmbH",
      "company_seat": "Niederhofen",
      "details": "04.04.2025 (Bekanntmachungsdatum)\n\nRheinland-Pfalz Amtsgericht Montabaur HRB 30456\nRegisterbekanntmachung nach dem Umwandlungsgesetz 04.04.2025 (Eintragungsdatum)\n\nVeritas Kinder- und Jugendhilfe GmbH\nGesellschaft mit beschränkter Haftung\nNiederhofen\n\nAls nicht eingetragen wird veröffentlicht:\nDen Gläubigern des formwechselnden Rechtsträgers ist, wenn sie binnen sechs Monaten nach dem Tag, an dem die Eintragung des Formwechsels nach § 201 UmwG als bekannt gemacht gilt, ihren Anspruch nach Grund und Höhe schriftlich anmelden, Sicherheit zu leisten, soweit sie nicht Befriedigung verlangen können. Dieses Recht steht den Gläubigern jedoch nur zu, wenn sie glaubhaft machen, dass durch den Formwechsel die Erfüllung der Forderung gefährdet wird."
    },
    {
      "date": "2025-04-04",
      "id": "105722",
      "original_text": "Löschungsankündigung\nRheinland-Pfalz Amtsgericht Montabaur HRB 28600\nERDM Solar und Hydroponik Vertriebs GmbH – Pottum",
      "type": "Löschungsankündigung",
      "state": "Rheinland-Pfalz",
      "amtsgericht": "Amtsgericht Montabaur",
      "registernummer": "HRB 28600",
      "registerart": "HRB",
      "company_name": "ERDM Solar und Hydroponik Vertriebs GmbH",
      "company_seat": "Pottum",
      "details": "04.04.2025 (Bekanntmachungsdatum)\n\nRheinland-Pfalz Amtsgericht Montabaur HRB 28600\nLöschungsankündigung\n\nERDM Solar und Hydroponik Vertriebs GmbH\nGesellschaft mit beschränkter Haftung\nPottum\n\nDas Registergericht beabsichtigt die Gesellschaft von Amts wegen nach § 394 FamFG zu löschen. Die Frist zur Erhebung eines Widerspruchs ist auf einen Monat festgesetzt."
    },
    {
      "date": "2025-04-04",
      "id": "105723",
      "original_text": "Einreichung neuer Dokumente\nRheinland-Pfalz Amtsgericht Zweibrücken HRB 1015\nGeWoBau GmbH Zweibrücken, Gesellschaft für Wohnen und Bauen – Zweibrücken",
      "type": "Einreichung neuer Dokumente",
      "state": "Rheinland-Pfalz",
      "amtsgericht": "Amtsgericht Zweibrücken",
      "registernummer": "HRB 1015",
      "registerart": "HRB",
      "company_name": "GeWoBau GmbH Zweibrücken, Gesellschaft für Wohnen und Bauen",
      "company_seat": "Zweibrücken",
      "details": "04.04.2025 (Bekanntmachungsdatum)\n\nRheinland-Pfalz Amtsgericht Zweibrücken HRB 1015\nEinreichung neuer Dokumente\n\nGeWoBau GmbH Zweibrücken, Gesellschaft für Wohnen und Bauen\nGesellschaft mit beschränkter Haftung\nZweibrücken\n\nDem Registergericht ist eine Liste der Mitglieder des Aufsichtsrates eingereicht worden."
    },
    {
      "date": "2025-04-04",
      "id": "105724",
      "original_text": "Registerbekanntmachung nach dem Umwandlungsgesetz\nRheinland-Pfalz Amtsgericht Montabaur GsR 322\nVeritas Ambulante Kinder- und Jugendhilfe eGbR – Niederhofen",
      "type": "Registerbekanntmachung nach dem Umwandlungsgesetz",
      "state": "Rheinland-Pfalz",
      "amtsgericht": "Amtsgericht Montabaur",
      "registernummer": "GsR 322",
      "registerart": "GsR",
      "company_name": "Veritas Ambulante Kinder- und Jugendhilfe eGbR",
      "company_seat": "Niederhofen",
      "details": "04.04.2025 (Bekanntmachungsdatum)\n\nRheinland-Pfalz Amtsgericht Montabaur GsR 322\nRegisterbekanntmachung nach dem Umwandlungsgesetz 04.04.2025 (Eintragungsdatum)\n\nVeritas Ambulante Kinder- und Jugendhilfe eGbR\nGesellschaft bürgerlichen Rechts\nNiederhofen\n\nAls nicht eingetragen wird veröffentlicht:\nDen Gläubigern des formwechselnden Rechtsträgers ist, wenn sie binnen sechs Monaten nach dem Tag, an dem die Eintragung des Formwechsels nach § 201 UmwG als bekannt gemacht gilt, ihren Anspruch nach Grund und Höhe schriftlich anmelden, Sicherheit zu leisten, soweit sie nicht Befriedigung verlangen können. Dieses Recht steht den Gläubigern jedoch nur zu, wenn sie glaubhaft machen, dass durch den Formwechsel die Erfüllung der Forderung gefährdet wird."
    },
    {
      "date": "2025-04-04",
      "id": "105725",
      "original_text": "Löschungsankündigung\nNordrhein-Westfalen Amtsgericht Neuss HRB 16940\nBERITAN BAU GmbH – Neuss",
      "type": "Löschungsankündigung",
      "state": "Nordrhein-Westfalen",
      "amtsgericht": "Amtsgericht Neuss",
      "registernummer": "HRB 16940",
      "registerart": "HRB",
      "company_name": "BERITAN BAU GmbH",
      "company_seat": "Neuss",
      "details": "04.04.2025 (Bekanntmachungsdatum)\n\nNordrhein-Westfalen Amtsgericht Neuss HRB 16940\nLöschungsankündigung 03.04.2025 (Eintragungsdatum)\n\nBERITAN BAU GmbH\nGesellschaft mit beschränkter Haftung\nNeuss\n\nDas Registergericht beabsichtigt die Gesellschaft wegen Vermögenslosigkeit aufgrund des § 394 Abs. 1 FamFG zu löschen. Frist zur Geltendmachung eines Widerspruchs: 1 Monat.\nRechtsbehelfsbelehrung:\nGegen diese Verfügung können Sie Widerspruch einlegen.\nDer Widerspruch ist bei dem Amtsgericht Neuss - Registergericht -, Breite Str. 48, 41460 Neuss schriftlich in deutscher Sprache oder zur Niederschrift der Geschäftsstelle einzulegen.\nDer Widerspruch kann auch zur Niederschrift der Geschäftsstelle eines jeden Amtsgerichtes abgegeben werden.\nDie Einlegung ist auch durch Übertragung eines elektronischen Dokuments an die elektronische Poststelle des Gerichts möglich. Das elektronische Dokument muss für die Bearbeitung durch das Gericht geeignet und mit einer qualifizierten elektronischen Signatur der verantwortenden Person versehen sein oder von der verantwortenden Person signiert und auf einem sicheren Übermittlungsweg gemäß § 130a ZPO nach näherer Maßgabe der Verordnung über die technischen Rahmenbedingungen des elektronischen Rechtsverkehrs und über das besondere elektronische Behördenpostfach (BGBl. I, S.3803) eingereicht werden. Weitere Informationen erhalten Sie auf der Internetseite www.justiz.de.\nDer Widerspruch muss spätestens innerhalb der gesetzten Frist nach der schriftlichen Bekanntgabe der Verfügung bei dem Amtsgericht - Registergericht - Neuss eingegangen sein. Dies gilt auch dann, wenn der Widerspruch zur Niederschrift der Geschäftsstelle eines anderen Amtsgerichtes abgegeben wurde. Die Frist beginnt mit der schriftlichen Bekanntgabe der Verfügung. Die Bekanntgabe ist entweder durch Zustellung oder am dritten Tage nach Aufgabe zur Post bewirkt. Fällt das Ende der Frist auf einen Sonntag, einen allgemeinen Feiertag oder Sonnabend, so endet die Frist mit Ablauf des nächsten Werktages.\nDer Widerspruch muss die Bezeichnung der angefochtenen Verfügung sowie die Erklärung enthalten, dass Widerspruch gegen diese Verfügung eingelegt wird. Er ist zu unterzeichnen und soll begründet werden."
    },
    {
      "date": "2025-04-04",
      "id": "105726",
      "original_text": "Registerbekanntmachung nach dem Umwandlungsgesetz\nNordrhein-Westfalen Amtsgericht Köln HRA 38088\n1.88 UG (haftungsbeschränkt) & Co. KG – Köln",
      "type": "Registerbekanntmachung nach dem Umwandlungsgesetz",
      "state": "Nordrhein-Westfalen",
      "amtsgericht": "Amtsgericht Köln",
      "registernummer": "HRA 38088",
      "registerart": "HRA",
      "company_name": "1.88 UG (haftungsbeschränkt) & Co. KG",
      "company_seat": "Köln",
      "details": "04.04.2025 (Bekanntmachungsdatum)\n\nNordrhein-Westfalen Amtsgericht Köln HRA 38088\nRegisterbekanntmachung nach dem Umwandlungsgesetz 04.04.2025 (Eintragungsdatum)\n\n1.88 UG (haftungsbeschränkt) & Co. KG\nKommanditgesellschaft\nKöln\n\nDen Gläubigern der an der formwechselnden Umwandlung beteiligten Rechtsträger ist, wenn sie binnen sechs Monaten nach dem Tag, an dem die Eintragung der formwechselnden Umwandlung in das Register des Sitzes desjenigen Rechtsträgers, dessen Gläubiger sie sind, nach § 19 Absatz 3 UmwG als bekanntgemacht gilt, ihren Anspruch nach Grund und Höhe schriftlich anmelden, Sicherheit zu leisten, soweit sie nicht Befriedigung verlangen können. Dieses Recht steht den Gläubigern jedoch nur zu, wenn sie glaubhaft machen, dass durch die formwechselnden Umwandlung die Erfüllung ihrer Forderung gefährdet wird."
    },
    {
      "date": "2025-04-04",
      "id": "105727",
      "original_text": "Löschungsankündigung\nNordrhein-Westfalen Amtsgericht Dortmund HRB 29769\nM & C GmbH – Dortmund",
      "type": "Löschungsankündigung",
      "state": "Nordrhein-Westfalen",
      "amtsgericht": "Amtsgericht Dortmund",
      "registernummer": "HRB 29769",
      "registerart": "HRB",
      "company_name": "M & C GmbH",
      "company_seat": "Dortmund",
      "details": "04.04.2025 (Bekanntmachungsdatum)\n\nNordrhein-Westfalen Amtsgericht Dortmund HRB 29769\nLöschungsankündigung\n\nM & C GmbH\nGesellschaft mit beschränkter Haftung\nDortmund\n\nDas Registergericht beabsichtigt die Gesellschaft von Amts wegen nach § 394 FamFG zu löschen. Die Frist zur Erhebung eines Widerspruchs ist auf zwei Monate festgesetzt."
    },
    {
      "date": "2025-04-04",
      "id": "105728",
      "original_text": "Löschungsankündigung\nNordrhein-Westfalen Amtsgericht Hamm HRB 9428\nPremium-Commerce UG (haftungsbeschränkt) – Hamm",
      "type": "Löschungsankündigung",
      "state": "Nordrhein-Westfalen",
      "amtsgericht": "Amtsgericht Hamm",
      "registernummer": "HRB 9428",
      "registerart": "HRB",
      "company_name": "Premium-Commerce UG (haftungsbeschränkt)",
      "company_seat": "Hamm",
      "details": "04.04.2025 (Bekanntmachungsdatum)\n\nNordrhein-Westfalen Amtsgericht Hamm HRB 9428\nLöschungsankündigung\n\nPremium-Commerce UG (haftungsbeschränkt)\nGesellschaft mit beschränkter Haftung\nHamm\n\nDas Registergericht beabsichtigt die Gesellschaft von Amts wegen nach § 394 FamFG zu löschen. Die Frist zur Erhebung eines Widerspruchs ist auf drei Monate festgesetzt."
    },
    {
      "date": "2025-04-04",
      "id": "105729",
      "original_text": "Einreichung neuer Dokumente\nNordrhein-Westfalen Amtsgericht Gelsenkirchen HRB 16386\nKnappschaft Kliniken MVZ Nord GmbH – Bottrop",
      "type": "Einreichung neuer Dokumente",
      "state": "Nordrhein-Westfalen",
      "amtsgericht": "Amtsgericht Gelsenkirchen",
      "registernummer": "HRB 16386",
      "registerart": "HRB",
      "company_name": "Knappschaft Kliniken MVZ Nord GmbH",
      "company_seat": "Bottrop",
      "details": "04.04.2025 (Bekanntmachungsdatum)\n\nNordrhein-Westfalen Amtsgericht Gelsenkirchen HRB 16386\nEinreichung neuer Dokumente\n\nKnappschaft Kliniken MVZ Nord GmbH\nGesellschaft mit beschränkter Haftung\nBottrop\n\nDem Registergericht ist eine Liste der Mitglieder des Aufsichtsrates eingereicht worden."
    },
    {
      "date": "2025-04-04",
      "id": "105730",
      "original_text": "Löschungsankündigung\nNordrhein-Westfalen Amtsgericht Wuppertal HRB 23060\nMPS CONST-BAU GmbH – Solingen",
      "type": "Löschungsankündigung",
      "state": "Nordrhein-Westfalen",
      "amtsgericht": "Amtsgericht Wuppertal",
      "registernummer": "HRB 23060",
      "registerart": "HRB",
      "company_name": "MPS CONST-BAU GmbH",
      "company_seat": "Solingen",
      "details": "04.04.2025 (Bekanntmachungsdatum)\n\nNordrhein-Westfalen Amtsgericht Wuppertal HRB 23060\nLöschungsankündigung\n\nMPS CONST-BAU GmbH\nGesellschaft mit beschränkter Haftung\nSolingen\n\nDas Registergericht beabsichtigt die Gesellschaft von Amts wegen nach § 394 FamFG zu löschen. Die Frist zur Erhebung eines Widerspruchs ist auf einen Monat festgesetzt."
    },
    {
      "date": "2025-04-04",
      "id": "105731",
      "original_text": "Löschungsankündigung\nNordrhein-Westfalen Amtsgericht Düsseldorf HRB 86550\nC - M Premium Modevertrieb GmbH – Düsseldorf",
      "type": "Löschungsankündigung",
      "state": "Nordrhein-Westfalen",
      "amtsgericht": "Amtsgericht Düsseldorf",
      "registernummer": "HRB 86550",
      "registerart": "HRB",
      "company_name": "C - M Premium Modevertrieb GmbH",
      "company_seat": "Düsseldorf",
      "details": "04.04.2025 (Bekanntmachungsdatum)\n\nNordrhein-Westfalen Amtsgericht Düsseldorf HRB 86550\nLöschungsankündigung\n\nC - M Premium Modevertrieb GmbH\nGesellschaft mit beschränkter Haftung\nDüsseldorf\n\nDas Registergericht beabsichtigt die Gesellschaft von Amts wegen nach § 394 Abs. 1 FamFG zu löschen. Die Frist zur Erhebung eines Widerspruchs ist auf 3 Wochen festgesetzt.\n\nRechtsbehelfsbelehrung:\nDas Widerspruchsrecht steht jedem zu, der an der Unterlassung der Löschung ein berechtigtes Interesse hat. Der Widerspruch ist bei dem Amtsgericht Düsseldorf -Registergericht-, Werdener Straße 1, 40227 Düsseldorf schriftlich in deutscher Sprache oder zur Niederschrift der Geschäftsstelle einzulegen. Der Widerspruch kann auch zur Niederschrift der Geschäftsstelle eines jeden Amtsgerichtes abgegeben werden. Die Einlegung ist auch durch Übertragung eines elektronischen Dokuments an die elektronische Poststelle des Gerichts möglich. Das elektronische Dokument muss für die Bearbeitung durch das Gericht geeignet und mit einer qualifizierten elektronischen Signatur der verantwortenden Person versehen sein oder von der verantwortenden Person signiert und auf einem sicheren Übermittlungsweg gemäß § 130a ZPO nach näherer Maßgabe der Verordnung über die technischen Rahmenbedingungen des elektronischen Rechtsverkehrs und über das besondere elektronische Behördenpostfach (BGBl. I, S.3803) eingereicht werden. Weitere Informationen erhalten Sie auf der Internetseite www.justiz.de.\nDer Widerspruch muss spätestens innerhalb der gesetzten Frist nach dem Datum der Bekanntmachung der Löschungsankündigung bei dem Amtsgericht - Registergericht - Düsseldorf eingegangen sein.  Dies gilt auch dann, wenn der Widerspruch zur Niederschrift der Geschäftsstelle eines anderen Amtsgerichtes abgegeben wurde. Die Frist beginnt mit dem Tage der Bekanntmachung der Löschungsankündigung in dem für die Bekanntmachung der Eintragungen in das Handelsregister bestimmten elektronischen Informations- und Kommunikationssystem nach § 10 des Handelsgesetzbuches. Fällt das Ende der Frist auf einen Sonntag, einen allgemeinen Feiertag oder Sonnabend, so endet die Frist mit Ablauf des nächsten Werktages.\nDer Widerspruch muss die Bezeichnung der angefochtenen Löschungsankündigung sowie die Erklärung enthalten, dass Widerspruch gegen diese Löschungsankündigung eingelegt wird. Er ist zu unterzeichnen und soll begründet werden."
    },
    {
      "date": "2025-04-04",
      "id": "105732",
      "original_text": "Löschungsankündigung\nNordrhein-Westfalen Amtsgericht Neuss HRB 19931\nRefluxkinder Gesellschaft für Aufklärung und Fortbildung mbH – Neuss",
      "type": "Löschungsankündigung",
      "state": "Nordrhein-Westfalen",
      "amtsgericht": "Amtsgericht Neuss",
      "registernummer": "HRB 19931",
      "registerart": "HRB",
      "company_name": "Refluxkinder Gesellschaft für Aufklärung und Fortbildung mbH",
      "company_seat": "Neuss",
      "details": "04.04.2025 (Bekanntmachungsdatum)\n\nNordrhein-Westfalen Amtsgericht Neuss HRB 19931\nLöschungsankündigung 03.04.2025 (Eintragungsdatum)\n\nRefluxkinder Gesellschaft für Aufklärung und Fortbildung mbH\nGesellschaft mit beschränkter Haftung\nNeuss\n\nDas Registergericht beabsichtigt die Gesellschaft wegen Vermögenslosigkeit aufgrund des § 394 Abs. 1 FamFG zu löschen. Frist zur Geltendmachung eines Widerspruchs: 1 Monat.\nRechtsbehelfsbelehrung:\nGegen diese Verfügung können Sie Widerspruch einlegen.\nDer Widerspruch ist bei dem Amtsgericht Neuss - Registergericht -, Breite Str. 48, 41460 Neuss schriftlich in deutscher Sprache oder zur Niederschrift der Geschäftsstelle einzulegen.\nDer Widerspruch kann auch zur Niederschrift der Geschäftsstelle eines jeden Amtsgerichtes abgegeben werden.\nDie Einlegung ist auch durch Übertragung eines elektronischen Dokuments an die elektronische Poststelle des Gerichts möglich. Das elektronische Dokument muss für die Bearbeitung durch das Gericht geeignet und mit einer qualifizierten elektronischen Signatur der verantwortenden Person versehen sein oder von der verantwortenden Person signiert und auf einem sicheren Übermittlungsweg gemäß § 130a ZPO nach näherer Maßgabe der Verordnung über die technischen Rahmenbedingungen des elektronischen Rechtsverkehrs und über das besondere elektronische Behördenpostfach (BGBl. I, S.3803) eingereicht werden. Weitere Informationen erhalten Sie auf der Internetseite www.justiz.de.\nDer Widerspruch muss spätestens innerhalb der gesetzten Frist nach der schriftlichen Bekanntgabe der Verfügung bei dem Amtsgericht - Registergericht - Neuss eingegangen sein. Dies gilt auch dann, wenn der Widerspruch zur Niederschrift der Geschäftsstelle eines anderen Amtsgerichtes abgegeben wurde. Die Frist beginnt mit der schriftlichen Bekanntgabe der Verfügung. Die Bekanntgabe ist entweder durch Zustellung oder am dritten Tage nach Aufgabe zur Post bewirkt. Fällt das Ende der Frist auf einen Sonntag, einen allgemeinen Feiertag oder Sonnabend, so endet die Frist mit Ablauf des nächsten Werktages.\nDer Widerspruch muss die Bezeichnung der angefochtenen Verfügung sowie die Erklärung enthalten, dass Widerspruch gegen diese Verfügung eingelegt wird. Er ist zu unterzeichnen und soll begründet werden."
    },
    {
      "date": "2025-04-04",
      "id": "105733",
      "original_text": "Löschungsankündigung\nNordrhein-Westfalen Amtsgericht Düsseldorf HRA 25642\nIGS Entertainment 2. Beteiligungsgesellschaft mbH & Co. KG – Düsseldorf",
      "type": "Löschungsankündigung",
      "state": "Nordrhein-Westfalen",
      "amtsgericht": "Amtsgericht Düsseldorf",
      "registernummer": "HRA 25642",
      "registerart": "HRA",
      "company_name": "IGS Entertainment 2. Beteiligungsgesellschaft mbH & Co. KG",
      "company_seat": "Düsseldorf",
      "details": "04.04.2025 (Bekanntmachungsdatum)\n\nNordrhein-Westfalen Amtsgericht Düsseldorf HRA 25642\nLöschungsankündigung\n\nIGS Entertainment 2. Beteiligungsgesellschaft mbH & Co. KG\nKommanditgesellschaft\nDüsseldorf\n\nDas Registergericht beabsichtigt die Firma von Amts wegen nach §§ 393 FamFG, 31 Abs. 2 HGB zu löschen. Die Frist zur Erhebung eines Widerspruchs ist auf drei Monate festgesetzt.\n\nRechtsbehelfsbelehrung:\nDas Widerspruchsrecht steht jedem zu, der an der Unterlassung der Löschung ein berechtigtes Interesse hat. Der Widerspruch ist bei dem Amtsgericht Düsseldorf -Registergericht-, Werdener Straße 1, 40227 Düsseldorf schriftlich in deutscher Sprache oder zur Niederschrift der Geschäftsstelle einzulegen. Der Widerspruch kann auch zur Niederschrift der Geschäftsstelle eines jeden Amtsgerichtes abgegeben werden. Die Einlegung ist auch durch Übertragung eines elektronischen Dokuments an die elektronische Poststelle des Gerichts möglich. Das elektronische Dokument muss für die Bearbeitung durch das Gericht geeignet und mit einer qualifizierten elektronischen Signatur der verantwortenden Person versehen sein oder von der verantwortenden Person signiert und auf einem sicheren Übermittlungsweg gemäß § 130a ZPO nach näherer Maßgabe der Verordnung über die technischen Rahmenbedingungen des elektronischen Rechtsverkehrs und über das besondere elektronische Behördenpostfach (BGBl. I, S.3803) eingereicht werden. Weitere Informationen erhalten Sie auf der Internetseite www.justiz.de.\nDer Widerspruch muss spätestens innerhalb der gesetzten Frist nach dem Datum der Bekanntmachung der Löschungsankündigung bei dem Amtsgericht - Registergericht - Düsseldorf eingegangen sein.  Dies gilt auch dann, wenn der Widerspruch zur Niederschrift der Geschäftsstelle eines anderen Amtsgerichtes abgegeben wurde. Die Frist beginnt mit dem Tage der Bekanntmachung der Löschungsankündigung in dem für die Bekanntmachung der Eintragungen in das Handelsregister bestimmten elektronischen Informations- und Kommunikationssystem nach § 10 des Handelsgesetzbuches. Fällt das Ende der Frist auf einen Sonntag, einen allgemeinen Feiertag oder Sonnabend, so endet die Frist mit Ablauf des nächsten Werktages.\nDer Widerspruch muss die Bezeichnung der angefochtenen Löschungsankündigung sowie die Erklärung enthalten, dass Widerspruch gegen diese Löschungsankündigung eingelegt wird. Er ist zu unterzeichnen und soll begründet werden."
    },
    {
      "date": "2025-04-04",
      "id": "105734",
      "original_text": "Registerbekanntmachung nach dem Umwandlungsgesetz\nNordrhein-Westfalen Amtsgericht Köln HRB 90409\n1.88 Invest GmbH – Köln",
      "type": "Registerbekanntmachung nach dem Umwandlungsgesetz",
      "state": "Nordrhein-Westfalen",
      "amtsgericht": "Amtsgericht Köln",
      "registernummer": "HRB 90409",
      "registerart": "HRB",
      "company_name": "1.88 Invest GmbH",
      "company_seat": "Köln",
      "details": "04.04.2025 (Bekanntmachungsdatum)\n\nNordrhein-Westfalen Amtsgericht Köln HRB 90409\nRegisterbekanntmachung nach dem Umwandlungsgesetz 04.04.2025 (Eintragungsdatum)\n\n1.88 Invest GmbH\nGesellschaft mit beschränkter Haftung\nKöln\n\nDen Gläubigern der an der formwechselnden Umwandlung beteiligten Rechtsträger ist, wenn sie binnen sechs Monaten nach dem Tag, an dem die Eintragung der formwechselnden Umwandlung in das Register des Sitzes derjenigen Rechtsträger deren Gläubiger sie sind, nach § 19 Absatz 3 UmwG als bekanntgemacht gilt, ihren Anspruch nach Grund und Höhe schriftlich anmelden, Sicherheit zu leisten, soweit sie nicht Befriedigung verlangen können. Dieses Recht steht den Gläubigern jedoch nur zu, wenn sie glaubhaft machen, dass durch die formwechselnden Umwandlung die Erfüllung ihrer Forderung gefährdet wird."
    },
    {
      "date": "2025-04-04",
      "id": "105735",
      "original_text": "Registerbekanntmachung nach dem Umwandlungsgesetz\nNordrhein-Westfalen Amtsgericht Gütersloh HRA 8545\nKlaus Erl Wärmetechnik e.K. – Gütersloh",
      "type": "Registerbekanntmachung nach dem Umwandlungsgesetz",
      "state": "Nordrhein-Westfalen",
      "amtsgericht": "Amtsgericht Gütersloh",
      "registernummer": "HRA 8545",
      "registerart": "HRA",
      "company_name": "Klaus Erl Wärmetechnik e.K.",
      "company_seat": "Gütersloh",
      "details": "04.04.2025 (Bekanntmachungsdatum)\n\nNordrhein-Westfalen Amtsgericht Gütersloh HRA 8545\nRegisterbekanntmachung nach dem Umwandlungsgesetz 31.03.2025 (Eintragungsdatum)\n\nKlaus Erl Wärmetechnik e.K.\nEinzelkaufmann / Einzelkauffrau\nGütersloh\n\nDen Gläubigern der an der Ausgliederung beteiligten Rechtsträger ist, wenn sie binnen sechs Monaten nach dem Tag, an dem die Eintragung der Ausgliederung in das Register des Sitzes desjenigen Rechtsträgers, dessen Gläubiger sie sind, nach § 19 Absatz 3 UmwG als bekanntgemacht gilt, ihren Anspruch nach Grund und Höhe schriftlich anmelden, Sicherheit zu leisten, soweit sie nicht Befriedigung verlangen können. Dieses Recht steht den Gläubigern jedoch nur zu, wenn sie glaubhaft machen, dass durch die Ausgliederung die Erfüllung ihrer Forderung gefährdet wird."
    },
    {
      "date": "2025-04-04",
      "id": "105736",
      "original_text": "Löschungsankündigung\nNordrhein-Westfalen Amtsgericht Paderborn HRB 12861\nHaus Tec GmbH – Paderborn",
      "type": "Löschungsankündigung",
      "state": "Nordrhein-Westfalen",
      "amtsgericht": "Amtsgericht Paderborn",
      "registernummer": "HRB 12861",
      "registerart": "HRB",
      "company_name": "Haus Tec GmbH",
      "company_seat": "Paderborn",
      "details": "04.04.2025 (Bekanntmachungsdatum)\n\nNordrhein-Westfalen Amtsgericht Paderborn HRB 12861\nLöschungsankündigung\n\nHaus Tec GmbH\nGesellschaft mit beschränkter Haftung\nPaderborn\n\nDas Registergericht beabsichtigt die Gesellschaft von Amts wegen nach § 394 FamFG aufgrund von Vermögenslosigkeit zu löschen. Die Frist zur Erhebung eines Widerspruchs beim Amtsgericht Paderborn ist auf einen Monat festgesetzt."
    },
    {
      "date": "2025-04-04",
      "id": "105737",
      "original_text": "Registerbekanntmachung nach dem Umwandlungsgesetz\nNordrhein-Westfalen Amtsgericht Köln HRB 59934\nBrainpool Beteiligungsgesellschaft mbH – Köln",
      "type": "Registerbekanntmachung nach dem Umwandlungsgesetz",
      "state": "Nordrhein-Westfalen",
      "amtsgericht": "Amtsgericht Köln",
      "registernummer": "HRB 59934",
      "registerart": "HRB",
      "company_name": "Brainpool Beteiligungsgesellschaft mbH",
      "company_seat": "Köln",
      "details": "04.04.2025 (Bekanntmachungsdatum)\n\nNordrhein-Westfalen Amtsgericht Köln HRB 59934\nRegisterbekanntmachung nach dem Umwandlungsgesetz 04.04.2025 (Eintragungsdatum)\n\nBrainpool Beteiligungsgesellschaft mbH\nGesellschaft mit beschränkter Haftung\nKöln\n\nDen Gläubigern der an der Verschmelzung beteiligten Rechtsträger ist, wenn sie binnen sechs Monaten nach dem Tag, an dem die Eintragung der Verschmelzung in das Register des Sitzes desjenigen Rechtsträgers, dessen Gläubiger sie sind, nach § 19 Absatz 3 UmwG als bekanntgemacht gilt, ihren Anspruch nach Grund und Höhe schriftlich anmelden, Sicherheit zu leisten, soweit sie nicht Befriedigung verlangen können. Dieses Recht steht den Gläubigern jedoch nur zu, wenn sie glaubhaft machen, dass durch die Verschmelzung die Erfüllung ihrer Forderung gefährdet wird."
    },
    {
      "date": "2025-04-04",
      "id": "105738",
      "original_text": "Einreichung neuer Dokumente\nNordrhein-Westfalen Amtsgericht Bonn HRB 23407\nVÖB-ZVD Processing GmbH – Bonn",
      "type": "Einreichung neuer Dokumente",
      "state": "Nordrhein-Westfalen",
      "amtsgericht": "Amtsgericht Bonn",
      "registernummer": "HRB 23407",
      "registerart": "HRB",
      "company_name": "VÖB-ZVD Processing GmbH",
      "company_seat": "Bonn",
      "details": "04.04.2025 (Bekanntmachungsdatum)\n\nNordrhein-Westfalen Amtsgericht Bonn HRB 23407\nEinreichung neuer Dokumente\n\nVÖB-ZVD Processing GmbH\nGesellschaft mit beschränkter Haftung\nBonn\n\nDem Registergericht ist eine neue Liste der Mitglieder des Aufsichtsrates eingereicht worden."
    },
    {
      "date": "2025-04-04",
      "id": "105739",
      "original_text": "Löschungsankündigung\nNordrhein-Westfalen Amtsgericht Köln HRB 117728\nWSM Sport Digital UG (haftungsbeschränkt) – Köln",
      "type": "Löschungsankündigung",
      "state": "Nordrhein-Westfalen",
      "amtsgericht": "Amtsgericht Köln",
      "registernummer": "HRB 117728",
      "registerart": "HRB",
      "company_name": "WSM Sport Digital UG (haftungsbeschränkt)",
      "company_seat": "Köln",
      "details": "04.04.2025 (Bekanntmachungsdatum)\n\nNordrhein-Westfalen Amtsgericht Köln HRB 117728\nLöschungsankündigung\n\nWSM Sport Digital UG (haftungsbeschränkt)\nGesellschaft mit beschränkter Haftung\nKöln\n\nDas Registergericht beabsichtigt, die im Handelsregister eingetragene Gesellschaft gemäß § 394 Absatz 1 FamFG wegen Vermögenslosigkeit von Amts wegen zu löschen. Gegen diese Verfügung kann Widerspruch eingelegt werden. Die Frist zur Erhebung eines Widerspruchs gegen die beabsichtigte Löschung von Amts wegen ist auf einen Monat festgesetzt. Rechtsbehelfsbelehrung: Gegen diese Verfügung können Sie Widerspruch einlegen. Der Widerspruch ist bei dem Amtsgericht Köln, Reichenspergerplatz 1, 50670 Köln schriftlich in deutscher Sprache oder zur Niederschrift der Geschäftsstelle einzulegen. Der Widerspruch kann auch zur Niederschrift der Geschäftsstelle eines jeden Amtsgerichtes abgegeben werden. Die Einlegung ist auch durch Übertragung eines elektronischen Dokuments an die elektronische Poststelle des Gerichts möglich. Das elektronische Dokument muss für die Bearbeitung durch das Gericht geeignet und mit einer qualifizierten elektronischen Signatur der verantwortenden Person versehen sein oder von der verantwortenden Person signiert und auf einem sicheren Übermittlungsweg gemäß § 130a ZPO nach näherer Maßgabe der Verordnung über die technischen Rahmenbedingungen des elektronischen Rechtsverkehrs und über das besondere elektronische Behördenpostfach (BGBl. I, S.3803) eingereicht werden. Weitere Informationen erhalten Sie auf der Internetseite www.justiz.de.Der Widerspruch muss spätestens innerhalb der gesetzten Frist bei dem Amtsgericht Köln eingegangen sein. Dies gilt auch dann, wenn der Widerspruch zur Niederschrift der Geschäftsstelle eines anderen Amtsgerichtes abgegeben wurde. Die Frist beginnt mit der Veröffentlichung. Fällt das Ende der Frist auf einen Sonntag, einen allgemeinen Feiertag oder Sonnabend, so endet die Frist mit Ablauf des nächsten Werktages.\n\nDer Widerspruch muss die Bezeichnung der angefochtenen Verfügung sowie die Erklärung enthalten, dass Widerspruch gegen diese Verfügung eingelegt wird. Er ist zu unterzeichnen und soll begründet werden."
    },
    {
      "date": "2025-04-04",
      "id": "105740",
      "original_text": "Registerbekanntmachung nach dem Umwandlungsgesetz\nNordrhein-Westfalen Amtsgericht Münster HRB 2212\nGrimm und Partner Unternehmens- und Wirtschaftsberatung GmbH – Münster",
      "type": "Registerbekanntmachung nach dem Umwandlungsgesetz",
      "state": "Nordrhein-Westfalen",
      "amtsgericht": "Amtsgericht Münster",
      "registernummer": "HRB 2212",
      "registerart": "HRB",
      "company_name": "Grimm und Partner Unternehmens- und Wirtschaftsberatung GmbH",
      "company_seat": "Münster",
      "details": "04.04.2025 (Bekanntmachungsdatum)\n\nNordrhein-Westfalen Amtsgericht Münster HRB 2212\nRegisterbekanntmachung nach dem Umwandlungsgesetz 04.04.2025 (Eintragungsdatum)\n\nGrimm und Partner Unternehmens- und Wirtschaftsberatung GmbH\nGesellschaft mit beschränkter Haftung\nMünster\n\nDen Gläubigern der an der Ausgliederung beteiligten Rechtsträger ist, wenn sie binnen sechs Monaten nach dem Tag, an dem die Eintragung der Ausgliederung in das Register des Sitzes desjenigen Rechtsträgers, dessen Gläubiger sie sind, nach § 19 Absatz 3 UmwG als bekanntgemacht gilt, ihren Anspruch nach Grund und Höhe schriftlich anmelden, Sicherheit zu leisten, soweit sie nicht Befriedigung verlangen können. Dieses Recht steht den Gläubigern jedoch nur zu, wenn sie glaubhaft machen, dass durch die Ausgliederung die Erfüllung ihrer Forderung gefährdet wird."
    },
    {
      "date": "2025-04-04",
      "id": "105741",
      "original_text": "Einreichung neuer Dokumente\nNordrhein-Westfalen Amtsgericht Duisburg HRB 14235\nRWW Rheinisch- Westfälische Wasserwerksgesellschaft mbH – Mülheim an der Ruhr",
      "type": "Einreichung neuer Dokumente",
      "state": "Nordrhein-Westfalen",
      "amtsgericht": "Amtsgericht Duisburg",
      "registernummer": "HRB 14235",
      "registerart": "HRB",
      "company_name": "RWW Rheinisch- Westfälische Wasserwerksgesellschaft mbH",
      "company_seat": "Mülheim an der Ruhr",
      "details": "04.04.2025 (Bekanntmachungsdatum)\n\nNordrhein-Westfalen Amtsgericht Duisburg HRB 14235\nEinreichung neuer Dokumente\n\nRWW Rheinisch- Westfälische Wasserwerksgesellschaft mbH\nGesellschaft mit beschränkter Haftung\nMülheim an der Ruhr\n\nDem Registergericht ist eine neue Liste der Mitglieder des Aufsichtsrates eingereicht worden."
    },
    {
      "date": "2025-04-04",
      "id": "105742",
      "original_text": "Löschungsankündigung\nNordrhein-Westfalen Amtsgericht Bochum HRB 20722\nMikac GmbH – Witten",
      "type": "Löschungsankündigung",
      "state": "Nordrhein-Westfalen",
      "amtsgericht": "Amtsgericht Bochum",
      "registernummer": "HRB 20722",
      "registerart": "HRB",
      "company_name": "Mikac GmbH",
      "company_seat": "Witten",
      "details": "04.04.2025 (Bekanntmachungsdatum)\n\nNordrhein-Westfalen Amtsgericht Bochum HRB 20722\nLöschungsankündigung\n\nMikac GmbH\nGesellschaft mit beschränkter Haftung\nWitten\n\nDas Registergericht beabsichtigt die Gesellschaft von Amts wegen nach § 394 FamFG zu löschen. Die Frist zur Erhebung eines Widerspruchs ist auf drei Monate festgesetzt."
    },
    {
      "date": "2025-04-04",
      "id": "105743",
      "original_text": "Registerbekanntmachung nach dem Umwandlungsgesetz\nNordrhein-Westfalen Amtsgericht Köln HRB 36978\nGood Times Fernsehproduktions-GmbH – Köln",
      "type": "Registerbekanntmachung nach dem Umwandlungsgesetz",
      "state": "Nordrhein-Westfalen",
      "amtsgericht": "Amtsgericht Köln",
      "registernummer": "HRB 36978",
      "registerart": "HRB",
      "company_name": "Good Times Fernsehproduktions-GmbH",
      "company_seat": "Köln",
      "details": "04.04.2025 (Bekanntmachungsdatum)\n\nNordrhein-Westfalen Amtsgericht Köln HRB 36978\nRegisterbekanntmachung nach dem Umwandlungsgesetz 04.04.2025 (Eintragungsdatum)\n\nGood Times Fernsehproduktions-GmbH\nGesellschaft mit beschränkter Haftung\nKöln\n\nDen Gläubigern der an der Verschmelzung beteiligten Rechtsträger ist, wenn sie binnen sechs Monaten nach dem Tag, an dem die Eintragung der Verschmelzung in das Register des Sitzes desjenigen Rechtsträgers, dessen Gläubiger sie sind, nach § 19 Absatz 3 UmwG als bekanntgemacht gilt, ihren Anspruch nach Grund und Höhe schriftlich anmelden, Sicherheit zu leisten, soweit sie nicht Befriedigung verlangen können. Dieses Recht steht den Gläubigern jedoch nur zu, wenn sie glaubhaft machen, dass durch die Verschmelzung die Erfüllung ihrer Forderung gefährdet wird."
    },
    {
      "date": "2025-04-04",
      "id": "105744",
      "original_text": "Registerbekanntmachung nach dem Umwandlungsgesetz\nNordrhein-Westfalen Amtsgericht Dortmund HRB 27545\nIHZ Holding GmbH – Dortmund",
      "type": "Registerbekanntmachung nach dem Umwandlungsgesetz",
      "state": "Nordrhein-Westfalen",
      "amtsgericht": "Amtsgericht Dortmund",
      "registernummer": "HRB 27545",
      "registerart": "HRB",
      "company_name": "IHZ Holding GmbH",
      "company_seat": "Dortmund",
      "details": "04.04.2025 (Bekanntmachungsdatum)\n\nNordrhein-Westfalen Amtsgericht Dortmund HRB 27545\nRegisterbekanntmachung nach dem Umwandlungsgesetz 04.04.2025 (Eintragungsdatum)\n\nIHZ Holding GmbH\nGesellschaft mit beschränkter Haftung\nDortmund\n\nDen Gläubigern der an der Verschmelzung beteiligten Rechtsträger ist, wenn sie binnen sechs Monaten nach dem Tag, an dem die Eintragung der Verschmelzung in das Register des Sitzes desjenigen Rechtsträgers, dessen Gläubiger sie sind, nach § 19 Absatz 3 UmwG als bekanntgemacht gilt, ihren Anspruch nach Grund und Höhe schriftlich anmelden, Sicherheit zu leisten, soweit sie nicht Befriedigung verlangen können. Dieses Recht steht den Gläubigern jedoch nur zu, wenn sie glaubhaft machen, dass durch die Verschmelzung die Erfüllung ihrer Forderung gefährdet wird."
    },
    {
      "date": "2025-04-04",
      "id": "105745",
      "original_text": "Registerbekanntmachung nach dem Umwandlungsgesetz\nNordrhein-Westfalen Amtsgericht Köln HRB 58780\nBRAINPOOL TV GmbH – Köln",
      "type": "Registerbekanntmachung nach dem Umwandlungsgesetz",
      "state": "Nordrhein-Westfalen",
      "amtsgericht": "Amtsgericht Köln",
      "registernummer": "HRB 58780",
      "registerart": "HRB",
      "company_name": "BRAINPOOL TV GmbH",
      "company_seat": "Köln",
      "details": "04.04.2025 (Bekanntmachungsdatum)\n\nNordrhein-Westfalen Amtsgericht Köln HRB 58780\nRegisterbekanntmachung nach dem Umwandlungsgesetz 04.04.2025 (Eintragungsdatum)\n\nBRAINPOOL TV GmbH\nGesellschaft mit beschränkter Haftung\nKöln\n\nDen Gläubigern der an der Verschmelzung beteiligten Rechtsträger ist, wenn sie binnen sechs Monaten nach dem Tag, an dem die Eintragung der Verschmelzung in das Register des Sitzes desjenigen Rechtsträgers, dessen Gläubiger sie sind, nach § 19 Absatz 3 UmwG als bekanntgemacht gilt, ihren Anspruch nach Grund und Höhe schriftlich anmelden, Sicherheit zu leisten, soweit sie nicht Befriedigung verlangen können. Dieses Recht steht den Gläubigern jedoch nur zu, wenn sie glaubhaft machen, dass durch die Verschmelzung die Erfüllung ihrer Forderung gefährdet wird. Als nicht eingetragen wird veröffentlicht: Den Gläubigern der Gesellschaft, deren Forderungen begründet worden sind bevor die Eintragung der Beendigung des Gewinnabführungsvertrages  in das Handelsregister nach § 10 des Handelsgesetzbuches als bekanntgemacht gilt, hat der andere Vertragsteil Sicherheit zu leisten, wenn sie sich binnen sechs Monaten nach der Bekanntmachung der Eintragung zu diesem Zweck bei ihm melden."
    },
    {
      "date": "2025-04-04",
      "id": "105746",
      "original_text": "Registerbekanntmachung nach dem Umwandlungsgesetz\nNordrhein-Westfalen Amtsgericht Köln HRB 122765\nTHESAURI GmbH – Köln",
      "type": "Registerbekanntmachung nach dem Umwandlungsgesetz",
      "state": "Nordrhein-Westfalen",
      "amtsgericht": "Amtsgericht Köln",
      "registernummer": "HRB 122765",
      "registerart": "HRB",
      "company_name": "THESAURI GmbH",
      "company_seat": "Köln",
      "details": "04.04.2025 (Bekanntmachungsdatum)\n\nNordrhein-Westfalen Amtsgericht Köln HRB 122765\nRegisterbekanntmachung nach dem Umwandlungsgesetz 04.04.2025 (Eintragungsdatum)\n\nTHESAURI GmbH\nGesellschaft mit beschränkter Haftung\nKöln\n\nDen Gläubigern der an der Ausgliederung beteiligten Rechtsträger ist, wenn sie binnen sechs Monaten nach dem Tag, an dem die Eintragung der Ausgliederung in das Register des Sitzes desjenigen Rechtsträgers, dessen Gläubiger sie sind, nach § 19 Absatz 3 UmwG als bekanntgemacht gilt, ihren Anspruch nach Grund und Höhe schriftlich anmelden, Sicherheit zu leisten, soweit sie nicht Befriedigung verlangen können. Dieses Recht steht den Gläubigern jedoch nur zu, wenn sie glaubhaft machen, dass durch die Ausgliederung die Erfüllung ihrer Forderung gefährdet wird."
    },
    {
      "date": "2025-04-04",
      "id": "105747",
      "original_text": "Registerbekanntmachung nach dem Umwandlungsgesetz\nNordrhein-Westfalen Amtsgericht Düsseldorf HRB 107812\nKonecranes Port Services GmbH – Düsseldorf",
      "type": "Registerbekanntmachung nach dem Umwandlungsgesetz",
      "state": "Nordrhein-Westfalen",
      "amtsgericht": "Amtsgericht Düsseldorf",
      "registernummer": "HRB 107812",
      "registerart": "HRB",
      "company_name": "Konecranes Port Services GmbH",
      "company_seat": "Düsseldorf",
      "details": "04.04.2025 (Bekanntmachungsdatum)\n\nNordrhein-Westfalen Amtsgericht Düsseldorf HRB 107812\nRegisterbekanntmachung nach dem Umwandlungsgesetz 04.04.2025 (Eintragungsdatum)\n\nKonecranes Port Services GmbH\nGesellschaft mit beschränkter Haftung\nDüsseldorf\n\nDen Gläubigern der an der Verschmelzung beteiligten Rechtsträger ist, wenn sie binnen sechs Monaten nach dem Tag, an dem die Eintragung der Verschmelzung in das Register des Sitzes desjenigen Rechtsträgers, dessen Gläubiger sie sind, nach § 19 Absatz 3 UmwG als bekanntgemacht gilt, ihren Anspruch nach Grund und Höhe schriftlich anmelden, Sicherheit zu leisten, soweit sie nicht Befriedigung verlangen können. Dieses Recht steht den Gläubigern jedoch nur zu, wenn sie glaubhaft machen, dass durch die Verschmelzung die Erfüllung ihrer Forderung gefährdet wird."
    },
    {
      "date": "2025-04-04",
      "id": "105748",
      "original_text": "Registerbekanntmachung nach dem Umwandlungsgesetz\nNordrhein-Westfalen Amtsgericht Köln HRB 68024\nOSMAB Verwaltungs GmbH – Rösrath",
      "type": "Registerbekanntmachung nach dem Umwandlungsgesetz",
      "state": "Nordrhein-Westfalen",
      "amtsgericht": "Amtsgericht Köln",
      "registernummer": "HRB 68024",
      "registerart": "HRB",
      "company_name": "OSMAB Verwaltungs GmbH",
      "company_seat": "Rösrath",
      "details": "04.04.2025 (Bekanntmachungsdatum)\n\nNordrhein-Westfalen Amtsgericht Köln HRB 68024\nRegisterbekanntmachung nach dem Umwandlungsgesetz 04.04.2025 (Eintragungsdatum)\n\nOSMAB Verwaltungs GmbH\nGesellschaft mit beschränkter Haftung\nRösrath\n\nDen Gläubigern der an der Verschmelzung beteiligten Rechtsträger ist, wenn sie binnen sechs Monaten nach dem Tag, an dem die Eintragung der Verschmelzung in das Register des Sitzes desjenigen Rechtsträgers, dessen Gläubiger sie sind, nach § 19 Absatz 3 UmwG als bekanntgemacht gilt, ihren Anspruch nach Grund und Höhe schriftlich anmelden, Sicherheit zu leisten, soweit sie nicht Befriedigung verlangen können. Dieses Recht steht den Gläubigern jedoch nur zu, wenn sie glaubhaft machen, dass durch die Verschmelzung die Erfüllung ihrer Forderung gefährdet wird."
    },
    {
      "date": "2025-04-04",
      "id": "105749",
      "original_text": "Registerbekanntmachung nach dem Umwandlungsgesetz\nNordrhein-Westfalen Amtsgericht Köln HRB 95735\nBanijay Germany GmbH – Köln",
      "type": "Registerbekanntmachung nach dem Umwandlungsgesetz",
      "state": "Nordrhein-Westfalen",
      "amtsgericht": "Amtsgericht Köln",
      "registernummer": "HRB 95735",
      "registerart": "HRB",
      "company_name": "Banijay Germany GmbH",
      "company_seat": "Köln",
      "details": "04.04.2025 (Bekanntmachungsdatum)\n\nNordrhein-Westfalen Amtsgericht Köln HRB 95735\nRegisterbekanntmachung nach dem Umwandlungsgesetz 04.04.2025 (Eintragungsdatum)\n\nBanijay Germany GmbH\nGesellschaft mit beschränkter Haftung\nKöln\n\nDen Gläubigern der an der Verschmelzung beteiligten Rechtsträger ist, wenn sie binnen sechs Monaten nach dem Tag, an dem die Eintragung der Verschmelzung in das Register des Sitzes desjenigen Rechtsträgers, dessen Gläubiger sie sind, nach § 19 Absatz 3 UmwG als bekanntgemacht gilt, ihren Anspruch nach Grund und Höhe schriftlich anmelden, Sicherheit zu leisten, soweit sie nicht Befriedigung verlangen können. Dieses Recht steht den Gläubigern jedoch nur zu, wenn sie glaubhaft machen, dass durch die Verschmelzung die Erfüllung ihrer Forderung gefährdet wird."
    },
    {
      "date": "2025-04-04",
      "id": "105750",
      "original_text": "Löschungsankündigung\nNordrhein-Westfalen Amtsgericht Köln HRB 108958\nChan Tam GmbH – Köln",
      "type": "Löschungsankündigung",
      "state": "Nordrhein-Westfalen",
      "amtsgericht": "Amtsgericht Köln",
      "registernummer": "HRB 108958",
      "registerart": "HRB",
      "company_name": "Chan Tam GmbH",
      "company_seat": "Köln",
      "details": "04.04.2025 (Bekanntmachungsdatum)\n\nNordrhein-Westfalen Amtsgericht Köln HRB 108958\nLöschungsankündigung\n\nChan Tam GmbH\nGesellschaft mit beschränkter Haftung\nKöln\n\nDas Registergericht beabsichtigt, die im Handelsregister eingetragene Gesellschaft gemäß § 394 Absatz 1 FamFG wegen Vermögenslosigkeit von Amts wegen zu löschen. Gegen diese Verfügung kann Widerspruch eingelegt werden. Die Frist zur Erhebung eines Widerspruchs gegen die beabsichtigte Löschung von Amts wegen ist auf einen Monat festgesetzt. Rechtsbehelfsbelehrung: Gegen diese Verfügung können Sie Widerspruch einlegen. Der Widerspruch ist bei dem Amtsgericht Köln, Reichenspergerplatz 1, 50670 Köln schriftlich in deutscher Sprache oder zur Niederschrift der Geschäftsstelle einzulegen. Der Widerspruch kann auch zur Niederschrift der Geschäftsstelle eines jeden Amtsgerichtes abgegeben werden. Die Einlegung ist auch durch Übertragung eines elektronischen Dokuments an die elektronische Poststelle des Gerichts möglich. Das elektronische Dokument muss für die Bearbeitung durch das Gericht geeignet und mit einer qualifizierten elektronischen Signatur der verantwortenden Person versehen sein oder von der verantwortenden Person signiert und auf einem sicheren Übermittlungsweg gemäß § 130a ZPO nach näherer Maßgabe der Verordnung über die technischen Rahmenbedingungen des elektronischen Rechtsverkehrs und über das besondere elektronische Behördenpostfach (BGBl. I, S.3803) eingereicht werden. Weitere Informationen erhalten Sie auf der Internetseite www.justiz.de.Der Widerspruch muss spätestens innerhalb der gesetzten Frist bei dem Amtsgericht Köln eingegangen sein. Dies gilt auch dann, wenn der Widerspruch zur Niederschrift der Geschäftsstelle eines anderen Amtsgerichtes abgegeben wurde. Die Frist beginnt mit der Veröffentlichung. Fällt das Ende der Frist auf einen Sonntag, einen allgemeinen Feiertag oder Sonnabend, so endet die Frist mit Ablauf des nächsten Werktages.\n\nDer Widerspruch muss die Bezeichnung der angefochtenen Verfügung sowie die Erklärung enthalten, dass Widerspruch gegen diese Verfügung eingelegt wird. Er ist zu unterzeichnen und soll begründet werden."
    },
    {
      "date": "2025-04-04",
      "id": "105751",
      "original_text": "Löschungsankündigung\nHessen Amtsgericht Offenbach am Main HRB 52727\nAras Dienstleistungen GmbH – Offenbach am Main",
      "type": "Löschungsankündigung",
      "state": "Hessen",
      "amtsgericht": "Amtsgericht Offenbach am Main",
      "registernummer": "HRB 52727",
      "registerart": "HRB",
      "company_name": "Aras Dienstleistungen GmbH",
      "company_seat": "Offenbach am Main",
      "details": "04.04.2025 (Bekanntmachungsdatum)\n\nHessen Amtsgericht Offenbach am Main HRB 52727\nLöschungsankündigung\n\nAras Dienstleistungen GmbH\nGesellschaft mit beschränkter Haftung\nOffenbach am Main\n\nDas Registergericht beabsichtigt die im Handelsregister eingetragene Gesellschaft von Amts wegen nach § 394 FamFG zu löschen. Die Frist zur Erhebung eines Widerspruchs gegen die beabsichtigte Löschung wird auf 3 Monate festgesetzt"
    },
    {
      "date": "2025-04-04",
      "id": "105752",
      "original_text": "Löschungsankündigung\nHessen Amtsgericht Gießen GnR 525\nBau- und Energiegenossenschaft Deckenbach eG – Homberg (Ohm)",
      "type": "Löschungsankündigung",
      "state": "Hessen",
      "amtsgericht": "Amtsgericht Gießen",
      "registernummer": "GnR 525",
      "registerart": "GnR",
      "company_name": "Bau- und Energiegenossenschaft Deckenbach eG",
      "company_seat": "Homberg (Ohm)",
      "details": "04.04.2025 (Bekanntmachungsdatum)\n\nHessen Amtsgericht Gießen GnR 525\nLöschungsankündigung\n\nBau- und Energiegenossenschaft Deckenbach eG\neingetragene Genossenschaft\nHomberg (Ohm)\n\nAuf Antrag des Finanzamts ist beabsichtigt, die Gesellschaft wegen Vermögenslosigkeit gemäß § 394 FamFG von Amts wegen zu löschen. Hiergegen kann innerhalb von drei Monaten nach dieser Veröffentlichung Widerspruch beim Amtsgericht Gießen eingelegt werden. Sollte Widerspruch eingelegt werden, dürfte dies nur mit Begründung erfolgversprechend sein. Insbesondere sollte vorhandenes Vermögen der Gesellschaft innerhalb der genannten Frist nachgewiesen werden."
    },
    {
      "date": "2025-04-04",
      "id": "105753",
      "original_text": "Löschungsankündigung\nHessen Amtsgericht Darmstadt HRB 103251\nAK-Bau GmbH – Viernheim",
      "type": "Löschungsankündigung",
      "state": "Hessen",
      "amtsgericht": "Amtsgericht Darmstadt",
      "registernummer": "HRB 103251",
      "registerart": "HRB",
      "company_name": "AK-Bau GmbH",
      "company_seat": "Viernheim",
      "details": "04.04.2025 (Bekanntmachungsdatum)\n\nHessen Amtsgericht Darmstadt HRB 103251\nLöschungsankündigung\n\nAK-Bau GmbH\nGesellschaft mit beschränkter Haftung\nViernheim\n\nDas Registergericht beabsichtigt die im Handelsregister eingetragene Gesellschaft von Amts wegen nach § 394 FamFG zu löschen. Die Frist zur Erhebung eines Widerspruchs gegen die beabsichtigte Löschung wird auf 3 Monate festgesetzt."
    },
    {
      "date": "2025-04-04",
      "id": "105754",
      "original_text": "Löschungsankündigung\nHessen Amtsgericht Frankfurt am Main HRA 46522\nCapreg EKZ Tönisvorst Ltd. & Co. KG – Frankfurt am Main",
      "type": "Löschungsankündigung",
      "state": "Hessen",
      "amtsgericht": "Amtsgericht Frankfurt am Main",
      "registernummer": "HRA 46522",
      "registerart": "HRA",
      "company_name": "Capreg EKZ Tönisvorst Ltd. & Co. KG",
      "company_seat": "Frankfurt am Main",
      "details": "04.04.2025 (Bekanntmachungsdatum)\n\nHessen Amtsgericht Frankfurt am Main HRA 46522\nLöschungsankündigung\n\nCapreg EKZ Tönisvorst Ltd. & Co. KG\nKommanditgesellschaft\nFrankfurt am Main\n\nDas Registergericht beabsichtigt die im Handelsregister eingetragene Firma von Amts wegen nach § 394 FamFG zu löschen. Die Frist zur Erhebung eines Widerspruchs gegen die beabsichtigte Löschung wird auf 1 Monat festgesetzt."
    },
    {
      "date": "2025-04-04",
      "id": "105755",
      "original_text": "Registerbekanntmachung nach dem Umwandlungsgesetz\nHessen Amtsgericht Bad Homburg v.d.H. HRB 16867\nHBC GmbH Heike Blum Consulting – Oberursel (Taunus)",
      "type": "Registerbekanntmachung nach dem Umwandlungsgesetz",
      "state": "Hessen",
      "amtsgericht": "Amtsgericht Bad Homburg v.d.H.",
      "registernummer": "HRB 16867",
      "registerart": "HRB",
      "company_name": "HBC GmbH Heike Blum Consulting",
      "company_seat": "Oberursel (Taunus)",
      "details": "04.04.2025 (Bekanntmachungsdatum)\n\nHessen Amtsgericht Bad Homburg v.d.H. HRB 16867\nRegisterbekanntmachung nach dem Umwandlungsgesetz 04.04.2025 (Eintragungsdatum)\n\nHBC GmbH Heike Blum Consulting\nGesellschaft mit beschränkter Haftung\nOberursel (Taunus)\n\nDen Gläubigern der an der Verschmelzung beteiligten Rechtsträger ist, wenn sie binnen sechs Monaten nach dem Tag, an dem die Eintragung der Verschmelzung in das Register des Sitzes desjenigen Rechtsträgers, dessen Gläubiger sie sind, nach § 19 Absatz 3 UmwG bekannt gemacht worden ist, ihren Anspruch nach Grund und Höhe schriftlich anmelden, Sicherheit zu leisten, soweit sie nicht Befriedigung verlangen können. Dieses Recht steht den Gläubigern jedoch nur zu, wenn sie glaubhaft machen, dass durch die Verschmelzung die Erfüllung ihrer Forderung gefährdet wird."
    },
    {
      "date": "2025-04-04",
      "id": "105756",
      "original_text": "Einreichung neuer Dokumente\nHessen Amtsgericht Frankfurt am Main HRB 123975\nBaker McKenzie Rechtsanwaltsgesellschaft mbH von Rechtsanwälten und Steuerberatern – Frankfurt am Main",
      "type": "Einreichung neuer Dokumente",
      "state": "Hessen",
      "amtsgericht": "Amtsgericht Frankfurt am Main",
      "registernummer": "HRB 123975",
      "registerart": "HRB",
      "company_name": "Baker McKenzie Rechtsanwaltsgesellschaft mbH von Rechtsanwälten und Steuerberatern",
      "company_seat": "Frankfurt am Main",
      "details": "04.04.2025 (Bekanntmachungsdatum)\n\nHessen Amtsgericht Frankfurt am Main HRB 123975\nEinreichung neuer Dokumente 04.04.2025 (Eintragungsdatum)\n\nBaker McKenzie Rechtsanwaltsgesellschaft mbH von Rechtsanwälten und Steuerberatern\nGesellschaft mit beschränkter Haftung\nFrankfurt am Main\n\nDurch eine Änderung in den Personen der Aufsichtsratsmitglieder ist eine Liste der Mitglieder des Aufsichtsrates zum Handelsregister eingereicht worden."
    },
    {
      "date": "2025-04-04",
      "id": "105757",
      "original_text": "Registerbekanntmachung nach dem Umwandlungsgesetz\nHessen Amtsgericht Bad Homburg v.d.H. HRA 6427\nHeike Blum e.K. – Oberursel (Taunus)",
      "type": "Registerbekanntmachung nach dem Umwandlungsgesetz",
      "state": "Hessen",
      "amtsgericht": "Amtsgericht Bad Homburg v.d.H.",
      "registernummer": "HRA 6427",
      "registerart": "HRA",
      "company_name": "Heike Blum e.K.",
      "company_seat": "Oberursel (Taunus)",
      "details": "04.04.2025 (Bekanntmachungsdatum)\n\nHessen Amtsgericht Bad Homburg v.d.H. HRA 6427\nRegisterbekanntmachung nach dem Umwandlungsgesetz 04.04.2025 (Eintragungsdatum)\n\nHeike Blum e.K.\nEinzelkaufmann / Einzelkauffrau\nOberursel (Taunus)\n\nDen Gläubigern der an der Verschmelzung beteiligten Rechtsträger ist, wenn sie binnen sechs Monaten nach dem Tag, an dem die Eintragung der Verschmelzung in das Register des Sitzes desjenigen Rechtsträgers, dessen Gläubiger sie sind, nach § 19 Absatz 3 UmwG bekannt gemacht worden ist, ihren Anspruch nach Grund und Höhe schriftlich anmelden, Sicherheit zu leisten, soweit sie nicht Befriedigung verlangen können. Dieses Recht steht den Gläubigern jedoch nur zu, wenn sie glaubhaft machen, dass durch die Verschmelzung die Erfüllung ihrer Forderung gefährdet wird."
    },
    {
      "date": "2025-04-04",
      "id": "105758",
      "original_text": "Löschungsankündigung\nHessen Amtsgericht Darmstadt HRB 104275\nGökdelen Saglik Hizmetleri Medikal Turizm Is Sagligi ve is Güvenligi Temizlik Gida Insaat Sanayi Ticaret Limited Sirketi Almanya Subesi – Darmstadt",
      "type": "Löschungsankündigung",
      "state": "Hessen",
      "amtsgericht": "Amtsgericht Darmstadt",
      "registernummer": "HRB 104275",
      "registerart": "HRB",
      "company_name": "Gökdelen Saglik Hizmetleri Medikal Turizm Is Sagligi ve is Güvenligi Temizlik Gida Insaat Sanayi Ticaret Limited Sirketi Almanya Subesi",
      "company_seat": "Darmstadt",
      "details": "04.04.2025 (Bekanntmachungsdatum)\n\nHessen Amtsgericht Darmstadt HRB 104275\nLöschungsankündigung\n\nGökdelen Saglik Hizmetleri Medikal Turizm Is Sagligi ve is Güvenligi Temizlik Gida Insaat Sanayi Ticaret Limited Sirketi Almanya Subesi\nRechtsform ausländischen Rechts HRB\nDarmstadt\n\nGem. § 31 Abs. 2 S. 2 HGB soll das Erlöschen der Firma von Amts wegen in das Handelsregister eingetragen werden.\nVon diesem Vorhaben werden die bisherigen Gesellschafter oder deren Rechtsnachfolger auf diesem Wege unterrichtet.\nZugleich wird ihnen zur etwaigen Geltendmachung eines Widerspruchs eine Frist von 3 Monaten bestimmt."
    }
  ]
}