{
  "date": "2025-03-05",
  "date_of_scrape": "2025-03-06T04:08:17.843Z",
  "tool_version": "0.2.0",
  "number_of_announcements": 130,
  "announcements": [
    {
      "date": "2025-03-05",
      "id": "102878",
      "original_text": "Registerbekanntmachung nach dem Umwandlungsgesetz\nBayern Amtsgericht München HRB 263750\nheptus 387. GmbH – München",
      "type": "Registerbekanntmachung nach dem Umwandlungsgesetz",
      "state": "Bayern",
      "amtsgericht": "Amtsgericht München",
      "registernummer": "HRB 263750",
      "registerart": "HRB",
      "company_name": "heptus 387. GmbH",
      "company_seat": "München",
      "details": "05.03.2025 (Bekanntmachungsdatum)\n\nBayern Amtsgericht München HRB 263750\nRegisterbekanntmachung nach dem Umwandlungsgesetz 04.03.2025 (Eintragungsdatum)\n\nheptus 387. GmbH\nGesellschaft mit beschränkter Haftung\nMünchen\n\nDen Gläubigern der an der Verschmelzung beteiligten Rechtsträger ist, wenn sie binnen sechs Monaten nach dem Tag, an dem die Eintragung der Verschmelzung in das Register des Sitzes desjenigen Rechtsträgers, dessen Gläubiger sie sind, nach § 19 Abs. 3 UmwG als bekannt gemacht gilt, ihren Anspruch nach Grund und Höhe in Textform anmelden, Sicherheit zu leisten, soweit sie nicht Befriedigung verlangen können. Dieses Recht steht den Gläubigern jedoch nur zu, wenn sie glaubhaft machen, dass durch die Verschmelzung die Erfüllung ihrer Forderung gefährdet wird."
    },
    {
      "date": "2025-03-05",
      "id": "102879",
      "original_text": "Löschungsankündigung\nBayern Amtsgericht Kempten (Allgäu) HRB 9466\nMera Burger GmbH – Kempten (Allgäu)",
      "type": "Löschungsankündigung",
      "state": "Bayern",
      "amtsgericht": "Amtsgericht Kempten (Allgäu)",
      "registernummer": "HRB 9466",
      "registerart": "HRB",
      "company_name": "Mera Burger GmbH",
      "company_seat": "Kempten (Allgäu)",
      "details": "05.03.2025 (Bekanntmachungsdatum)\n\nBayern Amtsgericht Kempten (Allgäu) HRB 9466\nLöschungsankündigung\n\nMera Burger GmbH\nGesellschaft mit beschränkter Haftung\nKempten (Allgäu)\n\nDas Registergericht beabsichtigt, die im Handelsregister eingetragene Gesellschaft wegen Vermögenslosigkeit von Amts wegen nach § 394 FamFG zu löschen. Die Frist zur Erhebung eines Widerspruchs ist auf einen Monat festgesetzt."
    },
    {
      "date": "2025-03-05",
      "id": "102880",
      "original_text": "Löschungsankündigung\nBayern Amtsgericht Würzburg HRB 17312\nPAL Import Export UG (haftungsbeschränkt) – Kürnach",
      "type": "Löschungsankündigung",
      "state": "Bayern",
      "amtsgericht": "Amtsgericht Würzburg",
      "registernummer": "HRB 17312",
      "registerart": "HRB",
      "company_name": "PAL Import Export UG (haftungsbeschränkt)",
      "company_seat": "Kürnach",
      "details": "05.03.2025 (Bekanntmachungsdatum)\n\nBayern Amtsgericht Würzburg HRB 17312\nLöschungsankündigung\n\nPAL Import Export UG (haftungsbeschränkt)\nGesellschaft mit beschränkter Haftung\nKürnach\n\nDas Registergericht beabsichtigt, die im Handelsregister eingetragene Gesellschaft wegen Vermögenslosigkeit von Amts wegen nach § 394 FamFG zu löschen. Die Frist zur Geltendmachung eines Widerspruchs gegen die beabsichtigte Löschung wird auf 3 Monate ab Veröffentlichung dieses Schreibens festgesetzt."
    },
    {
      "date": "2025-03-05",
      "id": "102881",
      "original_text": "Löschungsankündigung\nBayern Amtsgericht Nürnberg HRB 30927\nLehmann Bau und Stuck Verwaltungs- GmbH – Nürnberg",
      "type": "Löschungsankündigung",
      "state": "Bayern",
      "amtsgericht": "Amtsgericht Nürnberg",
      "registernummer": "HRB 30927",
      "registerart": "HRB",
      "company_name": "Lehmann Bau und Stuck Verwaltungs- GmbH",
      "company_seat": "Nürnberg",
      "details": "05.03.2025 (Bekanntmachungsdatum)\n\nBayern Amtsgericht Nürnberg HRB 30927\nLöschungsankündigung\n\nLehmann Bau und Stuck Verwaltungs- GmbH\nGesellschaft mit beschränkter Haftung\nNürnberg\n\nDas Registergericht beabsichtigt, die im Handelsregister eingetragene Gesellschaft wegen Vermögenslosigkeit von Amts wegen nach § 394 FamFG zu löschen. Die Frist zur Erhebung eines Widerspruchs ist auf einen Monat festgesetzt."
    },
    {
      "date": "2025-03-05",
      "id": "102882",
      "original_text": "Löschungsankündigung\nBayern Amtsgericht Schweinfurt HRB 562\nREGENA Verwaltungsgesellschaft mbH – Bad Brückenau",
      "type": "Löschungsankündigung",
      "state": "Bayern",
      "amtsgericht": "Amtsgericht Schweinfurt",
      "registernummer": "HRB 562",
      "registerart": "HRB",
      "company_name": "REGENA Verwaltungsgesellschaft mbH",
      "company_seat": "Bad Brückenau",
      "details": "05.03.2025 (Bekanntmachungsdatum)\n\nBayern Amtsgericht Schweinfurt HRB 562\nLöschungsankündigung 04.03.2025 (Eintragungsdatum)\n\nREGENA Verwaltungsgesellschaft mbH\nGesellschaft mit beschränkter Haftung\nBad Brückenau\n\nDas Registergericht beabsichtigt, die im Handelsregister eingetragene Gesellschaft wegen Vermögenslosigkeit von Amts wegen nach § 394 FamFG zu löschen. Die Frist zur Erhebung eines Widerspruchs ist auf einen Monat festgesetzt."
    },
    {
      "date": "2025-03-05",
      "id": "102883",
      "original_text": "Löschungsankündigung\nBayern Amtsgericht Coburg HRA 1131\nAutozentrum Luther GmbH & Co. KG – Niederfüllbach",
      "type": "Löschungsankündigung",
      "state": "Bayern",
      "amtsgericht": "Amtsgericht Coburg",
      "registernummer": "HRA 1131",
      "registerart": "HRA",
      "company_name": "Autozentrum Luther GmbH & Co. KG",
      "company_seat": "Niederfüllbach",
      "details": "05.03.2025 (Bekanntmachungsdatum)\n\nBayern Amtsgericht Coburg HRA 1131\nLöschungsankündigung 04.03.2025 (Eintragungsdatum)\n\nAutozentrum Luther GmbH & Co. KG\nKommanditgesellschaft\nNiederfüllbach\n\nDas Registergericht beabsichtigt, die im Handelsregister eingetragene Firma wegen Vermögenslosigkeit von Amts wegen nach § 394 FamFG zu löschen. Die Frist zur Erhebung eines Widerspruchs ist auf sechs Wochen festgesetzt."
    },
    {
      "date": "2025-03-05",
      "id": "102884",
      "original_text": "Registerbekanntmachung nach dem Umwandlungsgesetz\nBayern Amtsgericht Bayreuth HRA 4840\nFinanz- und Versicherungsmakler Klaus Krauß e.K. – Hummeltal",
      "type": "Registerbekanntmachung nach dem Umwandlungsgesetz",
      "state": "Bayern",
      "amtsgericht": "Amtsgericht Bayreuth",
      "registernummer": "HRA 4840",
      "registerart": "HRA",
      "company_name": "Finanz- und Versicherungsmakler Klaus Krauß e.K.",
      "company_seat": "Hummeltal",
      "details": "05.03.2025 (Bekanntmachungsdatum)\n\nBayern Amtsgericht Bayreuth HRA 4840\nRegisterbekanntmachung nach dem Umwandlungsgesetz 03.03.2025 (Eintragungsdatum)\n\nFinanz- und Versicherungsmakler Klaus Krauß e.K.\nEinzelkaufmann / Einzelkauffrau\nHummeltal\n\nDen Gläubigern der an der Ausgliederung beteiligten Rechtsträger ist, wenn sie binnen sechs Monaten nach dem Tag, an dem die Eintragung der Ausgliederung in das Register des Sitzes desjenigen Rechtsträgers, dessen Gläubiger sie sind, nach §§ 125, 19 Abs. 3 UmwG als bekannt gemacht gilt, ihren Anspruch nach Grund und Höhe in Textform anmelden, Sicherheit zu leisten, soweit sie nicht Befriedigung verlangen können. Dieses Recht steht den Gläubigern jedoch nur zu, wenn sie glaubhaft machen, dass durch die Ausgliederung die Erfüllung ihrer Forderung gefährdet wird."
    },
    {
      "date": "2025-03-05",
      "id": "102885",
      "original_text": "Einreichung neuer Dokumente\nBayern Amtsgericht München HRB 4921\nBayWa Aktiengesellschaft – München",
      "type": "Einreichung neuer Dokumente",
      "state": "Bayern",
      "amtsgericht": "Amtsgericht München",
      "registernummer": "HRB 4921",
      "registerart": "HRB",
      "company_name": "BayWa Aktiengesellschaft",
      "company_seat": "München",
      "details": "05.03.2025 (Bekanntmachungsdatum)\n\nBayern Amtsgericht München HRB 4921\nEinreichung neuer Dokumente 04.03.2025 (Eintragungsdatum)\n\nBayWa Aktiengesellschaft\nAktiengesellschaft\nMünchen\n\nDem Amtsgericht München -Registergericht- ist eine Liste der Mitglieder des Aufsichtsrats eingereicht worden, § 106 AktG."
    },
    {
      "date": "2025-03-05",
      "id": "102886",
      "original_text": "Löschungsankündigung\nBaden-Württemberg Amtsgericht Stuttgart HRB 794589\npeak sales GmbH – Leinfelden-Echterdingen",
      "type": "Löschungsankündigung",
      "state": "Baden-Württemberg",
      "amtsgericht": "Amtsgericht Stuttgart",
      "registernummer": "HRB 794589",
      "registerart": "HRB",
      "company_name": "peak sales GmbH",
      "company_seat": "Leinfelden-Echterdingen",
      "details": "05.03.2025 (Bekanntmachungsdatum)\n\nBaden-Württemberg Amtsgericht Stuttgart HRB 794589\nLöschungsankündigung\n\npeak sales GmbH\nGesellschaft mit beschränkter Haftung\nLeinfelden-Echterdingen\n\nAls nicht eingetragen wird bekanntgemacht:\nDas Gericht beabsichtigt, die Gesellschaft wegen Vermögenslosigkeit im Handelsregister von Amts wegen nach § 394 FamFG zu löschen. Die Frist zur Geltendmachung eines Widerspruchs gegen die beabsichtigte Löschung ist auf zwei Monate ab Veröffentlichung bestimmt."
    },
    {
      "date": "2025-03-05",
      "id": "102887",
      "original_text": "Löschungsankündigung\nBerlin Amtsgericht Berlin (Charlottenburg) HRB 108061\nTWP Wiedemann Projektentwicklungsgesellschaft mbH – Berlin",
      "type": "Löschungsankündigung",
      "state": "Berlin",
      "amtsgericht": "Amtsgericht Berlin (Charlottenburg)",
      "registernummer": "HRB 108061",
      "registerart": "HRB",
      "company_name": "TWP Wiedemann Projektentwicklungsgesellschaft mbH",
      "company_seat": "Berlin",
      "details": "05.03.2025 (Bekanntmachungsdatum)\n\nBerlin Amtsgericht Berlin (Charlottenburg) HRB 108061\nLöschungsankündigung\n\nTWP Wiedemann Projektentwicklungsgesellschaft mbH\nGesellschaft mit beschränkter Haftung\nBerlin\n\nBei der nachstehenden Gesellschaft wird das Amtslöschungsverfahren gemäß § 394 FamFG eingeleitet. Widerspruchsfrist 6 Wochen"
    },
    {
      "date": "2025-03-05",
      "id": "102888",
      "original_text": "Einreichung neuer Dokumente\nBerlin Amtsgericht Berlin (Charlottenburg) HRB 154517\nAxel Springer SE – Berlin",
      "type": "Einreichung neuer Dokumente",
      "state": "Berlin",
      "amtsgericht": "Amtsgericht Berlin (Charlottenburg)",
      "registernummer": "HRB 154517",
      "registerart": "HRB",
      "company_name": "Axel Springer SE",
      "company_seat": "Berlin",
      "details": "05.03.2025 (Bekanntmachungsdatum)\n\nBerlin Amtsgericht Berlin (Charlottenburg) HRB 154517\nEinreichung neuer Dokumente\n\nAxel Springer SE\nEuropäische Aktiengesellschaft (SE)\nBerlin\n\nAls nicht eingetragen wird veröffentlicht:\nDie Gesellschaft hat am 23.01.2025 den Entwurf eines Verschmelzungsvertrages gemäß §§ 62 Abs. 3 Satz 2, 61 Satz 2 UmwG mit der Axel Springer Digital Classifieds GmbH (HRB 141922 B) zum Handelsregister eingereicht.\nAußerdem:\nDie Gesellschaft hat am 23.01.2025 den Entwurf eines Verschmelzungsvertrages gemäß §§ 62 Abs. 3 Satz 2, 61 Satz 2 UmwG mit der Axel Springer Digital GmbH (HRB 87210 B) zum Handelsregister eingereicht."
    },
    {
      "date": "2025-03-05",
      "id": "102889",
      "original_text": "Löschungsankündigung\nBaden-Württemberg Amtsgericht Stuttgart HRB 746783\nWetzel Montagebau und Energiesysteme GmbH – Dettingen an der Erms",
      "type": "Löschungsankündigung",
      "state": "Baden-Württemberg",
      "amtsgericht": "Amtsgericht Stuttgart",
      "registernummer": "HRB 746783",
      "registerart": "HRB",
      "company_name": "Wetzel Montagebau und Energiesysteme GmbH",
      "company_seat": "Dettingen an der Erms",
      "details": "05.03.2025 (Bekanntmachungsdatum)\n\nBaden-Württemberg Amtsgericht Stuttgart HRB 746783\nLöschungsankündigung\n\nWetzel Montagebau und Energiesysteme GmbH\nGesellschaft mit beschränkter Haftung\nDettingen an der Erms\n\nAls nicht eingetragen wird bekanntgemacht:\nDas Gericht beabsichtigt, die Gesellschaft wegen Vermögenslosigkeit im Handelsregister von Amts wegen nach § 394 FamFG zu löschen. Die Frist zur Geltendmachung eines Widerspruchs gegen die beabsichtigte Löschung ist auf zwei Monate ab Veröffentlichung bestimmt."
    },
    {
      "date": "2025-03-05",
      "id": "102890",
      "original_text": "Einreichung neuer Dokumente\nBrandenburg Amtsgericht Cottbus HRB 7127\nIMPULSA AG – Elsterwerda",
      "type": "Einreichung neuer Dokumente",
      "state": "Brandenburg",
      "amtsgericht": "Amtsgericht Cottbus",
      "registernummer": "HRB 7127",
      "registerart": "HRB",
      "company_name": "IMPULSA AG",
      "company_seat": "Elsterwerda",
      "details": "05.03.2025 (Bekanntmachungsdatum)\n\nBrandenburg Amtsgericht Cottbus HRB 7127\nEinreichung neuer Dokumente\n\nIMPULSA AG\nAktiengesellschaft\nElsterwerda\n\nDer Vorstand hat eine Liste der Aufsichtsratsmitglieder gem. § 106 AktG zum Handelsregister eingereicht."
    },
    {
      "date": "2025-03-05",
      "id": "102891",
      "original_text": "Löschungsankündigung\nBaden-Württemberg Amtsgericht Stuttgart HRB 738414\nW+S Projektbau GmbH – Altenriet",
      "type": "Löschungsankündigung",
      "state": "Baden-Württemberg",
      "amtsgericht": "Amtsgericht Stuttgart",
      "registernummer": "HRB 738414",
      "registerart": "HRB",
      "company_name": "W+S Projektbau GmbH",
      "company_seat": "Altenriet",
      "details": "05.03.2025 (Bekanntmachungsdatum)\n\nBaden-Württemberg Amtsgericht Stuttgart HRB 738414\nLöschungsankündigung\n\nW+S Projektbau GmbH\nGesellschaft mit beschränkter Haftung\nAltenriet\n\nAls nicht eingetragen wird bekanntgemacht:\nDas Gericht beabsichtigt, die Gesellschaft wegen Vermögenslosigkeit im Handelsregister von Amts wegen nach § 394 FamFG zu löschen. Die Frist zur Geltendmachung eines Widerspruchs gegen die beabsichtigte Löschung ist auf zwei Monate ab Veröffentlichung bestimmt."
    },
    {
      "date": "2025-03-05",
      "id": "102892",
      "original_text": "Löschungsankündigung\nBaden-Württemberg Amtsgericht Ulm HRB 727727\nJ&R Bodenseeimmobilien GmbH – Friedrichshafen",
      "type": "Löschungsankündigung",
      "state": "Baden-Württemberg",
      "amtsgericht": "Amtsgericht Ulm",
      "registernummer": "HRB 727727",
      "registerart": "HRB",
      "company_name": "J&R Bodenseeimmobilien GmbH",
      "company_seat": "Friedrichshafen",
      "details": "05.03.2025 (Bekanntmachungsdatum)\n\nBaden-Württemberg Amtsgericht Ulm HRB 727727\nLöschungsankündigung\n\nJ&R Bodenseeimmobilien GmbH\nGesellschaft mit beschränkter Haftung\nFriedrichshafen\n\nAls nicht eingetragen wird bekanntgemacht:\nDas Gericht beabsichtigt, die Gesellschaft wegen Vermögenslosigkeit im Handelsregister von Amts wegen nach § 394 FamFG zu löschen. Die Frist zur Geltendmachung eines Widerspruchs gegen die beabsichtigte Löschung ist auf  einen Monat ab Veröffentlichung bestimmt."
    },
    {
      "date": "2025-03-05",
      "id": "102893",
      "original_text": "Löschungsankündigung\nSachsen-Anhalt Amtsgericht Stendal HRB 21537\nTHEA GmbH – Weißenfels",
      "type": "Löschungsankündigung",
      "state": "Sachsen-Anhalt",
      "amtsgericht": "Amtsgericht Stendal",
      "registernummer": "HRB 21537",
      "registerart": "HRB",
      "company_name": "THEA GmbH",
      "company_seat": "Weißenfels",
      "details": "05.03.2025 (Bekanntmachungsdatum)\n\nSachsen-Anhalt Amtsgericht Stendal HRB 21537\nLöschungsankündigung\n\nTHEA GmbH\nGesellschaft mit beschränkter Haftung\nWeißenfels\n\nDas Registergericht beabsichtigt, nachfolgende im Handelregister eingetragenen Firmen von Amts wegen nach § 394 FamFG zu löschen. Die Frist zu Erhebung eines Widerspruchs wird auf drei Monate festgesetzt."
    },
    {
      "date": "2025-03-05",
      "id": "102894",
      "original_text": "Registerbekanntmachung nach dem Umwandlungsgesetz\nBaden-Württemberg Amtsgericht Ulm VR 720282\nWest-Ost-Gesellschaft Schwäbische Alb e.V. – Laichingen",
      "type": "Registerbekanntmachung nach dem Umwandlungsgesetz",
      "state": "Baden-Württemberg",
      "amtsgericht": "Amtsgericht Ulm",
      "registernummer": "VR 720282",
      "registerart": "VR",
      "company_name": "West-Ost-Gesellschaft Schwäbische Alb e.V.",
      "company_seat": "Laichingen",
      "details": "05.03.2025 (Bekanntmachungsdatum)\n\nBaden-Württemberg Amtsgericht Ulm VR 720282\nRegisterbekanntmachung nach dem Umwandlungsgesetz 05.03.2025 (Eintragungsdatum)\n\nWest-Ost-Gesellschaft Schwäbische Alb e.V.\neingetragener Verein\nLaichingen\n\nAls nicht eingetragen wird bekanntgemacht:\nDen Gläubigern der an der Verschmelzung beteiligten Rechtsträger ist, wenn sie binnen sechs Monaten nach dem Tag, an dem die Eintragung der Verschmelzung in das Register des Sitzes desjenigen Rechtsträgers, dessen Gläubiger sie sind, nach § 19 Abs. 3 UmwG als bekanntgemacht gilt, ihren Anspruch nach Grund und Höhe schriftlich anmelden, Sicherheit zu leisten, soweit sie nicht Befriedigung verlangen können. Dieses Recht steht den Gläubigern jedoch nur zu, wenn sie glaubhaft machen, dass durch die Verschmelzung die Erfüllung ihrer Forderung gefährdet wird."
    },
    {
      "date": "2025-03-05",
      "id": "102895",
      "original_text": "Löschungsankündigung\nBrandenburg Amtsgericht Potsdam HRB 35709\nOtto Lilienthal Projekt gGmbH – Trebbin",
      "type": "Löschungsankündigung",
      "state": "Brandenburg",
      "amtsgericht": "Amtsgericht Potsdam",
      "registernummer": "HRB 35709",
      "registerart": "HRB",
      "company_name": "Otto Lilienthal Projekt gGmbH",
      "company_seat": "Trebbin",
      "details": "05.03.2025 (Bekanntmachungsdatum)\n\nBrandenburg Amtsgericht Potsdam HRB 35709\nLöschungsankündigung\n\nOtto Lilienthal Projekt gGmbH\nGesellschaft mit beschränkter Haftung\nTrebbin\n\nBei der nachstehenden Gesellschaft wird das Amtslöschungsverfahren gemäß § 394 FamFG eingeleitet. Widerspruchsfrist 8 Wochen."
    },
    {
      "date": "2025-03-05",
      "id": "102896",
      "original_text": "Registerbekanntmachung nach dem Umwandlungsgesetz\nBaden-Württemberg Amtsgericht Stuttgart HRB 789149\ngotec Document Services & Audit GmbH – Altbach",
      "type": "Registerbekanntmachung nach dem Umwandlungsgesetz",
      "state": "Baden-Württemberg",
      "amtsgericht": "Amtsgericht Stuttgart",
      "registernummer": "HRB 789149",
      "registerart": "HRB",
      "company_name": "gotec Document Services & Audit GmbH",
      "company_seat": "Altbach",
      "details": "05.03.2025 (Bekanntmachungsdatum)\n\nBaden-Württemberg Amtsgericht Stuttgart HRB 789149\nRegisterbekanntmachung nach dem Umwandlungsgesetz 05.03.2025 (Eintragungsdatum)\n\ngotec Document Services & Audit GmbH\nGesellschaft mit beschränkter Haftung\nAltbach\n\nAls nicht eingetragen wird bekanntgemacht:\nDen Gläubigern der an der Verschmelzung beteiligten Rechtsträger ist, wenn sie binnen sechs Monaten nach dem Tag, an dem die Eintragung der Verschmelzung in das Register des Sitzes desjenigen Rechtsträgers, dessen Gläubiger sie sind, nach § 19 Abs. 3 UmwG als bekanntgemacht gilt, ihren Anspruch nach Grund und Höhe schriftlich anmelden, Sicherheit zu leisten, soweit sie nicht Befriedigung verlangen können. Dieses Recht steht den Gläubigern jedoch nur zu, wenn sie glaubhaft machen, dass durch die Verschmelzung die Erfüllung ihrer Forderung gefährdet wird."
    },
    {
      "date": "2025-03-05",
      "id": "102897",
      "original_text": "Registerbekanntmachung nach dem Umwandlungsgesetz\nSchleswig-Holstein Amtsgericht Kiel HRA 12510\nDentalästhetik Schiwek e.K. – Osterrönfeld",
      "type": "Registerbekanntmachung nach dem Umwandlungsgesetz",
      "state": "Schleswig-Holstein",
      "amtsgericht": "Amtsgericht Kiel",
      "registernummer": "HRA 12510",
      "registerart": "HRA",
      "company_name": "Dentalästhetik Schiwek e.K.",
      "company_seat": "Osterrönfeld",
      "details": "05.03.2025 (Bekanntmachungsdatum)\n\nSchleswig-Holstein Amtsgericht Kiel HRA 12510\nRegisterbekanntmachung nach dem Umwandlungsgesetz 04.03.2025 (Eintragungsdatum)\n\nDentalästhetik Schiwek e.K.\nEinzelkaufmann / Einzelkauffrau\nOsterrönfeld\n\nZu Eintragungsnummer 2 vom 04.03.2025 wird als nicht eingetragen veröffentlicht:  Den Gläubigern der an der Spaltung beteiligten Rechtsträger ist, wenn sie binnen sechs Monaten nach dem Tag, an dem die Eintragung der Spaltung in das Register des Sitzes desjenigen Rechtsträgers, dessen Gläubiger sie sind,  bekannt gemacht worden ist, ihren Anspruch nach Grund und Höhe schriftlich anmelden, Sicherheit zu leisten, soweit sie nicht Befriedigung verlangen können. Dieses Recht steht den Gläubigern jedoch nur zu, wenn sie glaubhaft machen, dass durch die Spaltung die Erfüllung ihrer Forderung gefährdet wird."
    },
    {
      "date": "2025-03-05",
      "id": "102898",
      "original_text": "Registerbekanntmachung nach dem Umwandlungsgesetz\nSchleswig-Holstein Amtsgericht Flensburg HRB 16958\nBlue Beteiligungsgesellschaft mbH – Flensburg",
      "type": "Registerbekanntmachung nach dem Umwandlungsgesetz",
      "state": "Schleswig-Holstein",
      "amtsgericht": "Amtsgericht Flensburg",
      "registernummer": "HRB 16958",
      "registerart": "HRB",
      "company_name": "Blue Beteiligungsgesellschaft mbH",
      "company_seat": "Flensburg",
      "details": "05.03.2025 (Bekanntmachungsdatum)\n\nSchleswig-Holstein Amtsgericht Flensburg HRB 16958\nRegisterbekanntmachung nach dem Umwandlungsgesetz 04.03.2025 (Eintragungsdatum)\n\nBlue Beteiligungsgesellschaft mbH\nGesellschaft mit beschränkter Haftung\nFlensburg\n\nZu Eintragungsnummer 2 vom 04.03.2025 wird als nicht eingetragen veröffentlicht: Den Gläubigern der an der Verschmelzung beteiligten Rechtsträger ist, wenn sie binnen sechs Monaten nach dem Tag, an dem die Eintragung der Verschmelzung in das Register des Sitzes desjenigen Rechtsträgers, dessen Gläubiger sie sind, als bekannt gemacht gilt, ihren Anspruch nach Grund und Höhe schriftlich anmelden, Sicherheit zu leisten, soweit sie nicht Befriedigung verlangen können. Dieses Recht steht den Gläubigern jedoch nur zu, wenn sie glaubhaft machen, dass durch die Verschmelzung die Erfüllung ihrer Forderung gefährdet wird."
    },
    {
      "date": "2025-03-05",
      "id": "102899",
      "original_text": "Registerbekanntmachung nach dem Umwandlungsgesetz\nBaden-Württemberg Amtsgericht Stuttgart HRB 754202\nDATAGROUP Service Desk GmbH – Pliezhausen",
      "type": "Registerbekanntmachung nach dem Umwandlungsgesetz",
      "state": "Baden-Württemberg",
      "amtsgericht": "Amtsgericht Stuttgart",
      "registernummer": "HRB 754202",
      "registerart": "HRB",
      "company_name": "DATAGROUP Service Desk GmbH",
      "company_seat": "Pliezhausen",
      "details": "05.03.2025 (Bekanntmachungsdatum)\n\nBaden-Württemberg Amtsgericht Stuttgart HRB 754202\nRegisterbekanntmachung nach dem Umwandlungsgesetz 05.03.2025 (Eintragungsdatum)\n\nDATAGROUP Service Desk GmbH\nGesellschaft mit beschränkter Haftung\nPliezhausen\n\nDen Gläubigern der an der Verschmelzung beteiligten Rechtsträger ist, wenn sie binnen sechs Monaten nach dem Tag, an dem die Eintragung der Verschmelzung in das Register des Sitzes desjenigen Rechtsträgers, dessen Gläubiger sie sind, nach § 19 Abs. 3 UmwG als bekanntgemacht gilt, ihren Anspruch nach Grund und Höhe schriftlich anmelden, Sicherheit zu leisten, soweit sie nicht Befriedigung verlangen können. Dieses Recht steht den Gläubigern jedoch nur zu, wenn sie glaubhaft machen, dass durch die Verschmelzung die Erfüllung ihrer Forderung gefährdet wird."
    },
    {
      "date": "2025-03-05",
      "id": "102900",
      "original_text": "Registerbekanntmachung nach dem Umwandlungsgesetz\nBrandenburg Amtsgericht Potsdam HRB 19607\nProjektmanagement Trebbin GmbH – Trebbin",
      "type": "Registerbekanntmachung nach dem Umwandlungsgesetz",
      "state": "Brandenburg",
      "amtsgericht": "Amtsgericht Potsdam",
      "registernummer": "HRB 19607",
      "registerart": "HRB",
      "company_name": "Projektmanagement Trebbin GmbH",
      "company_seat": "Trebbin",
      "details": "05.03.2025 (Bekanntmachungsdatum)\n\nBrandenburg Amtsgericht Potsdam HRB 19607\nRegisterbekanntmachung nach dem Umwandlungsgesetz 28.02.2025 (Eintragungsdatum)\n\nProjektmanagement Trebbin GmbH\nGesellschaft mit beschränkter Haftung\nTrebbin\n\nZu Eintragungsnummer 4 vom 28.02.2025 wird als nicht eingetragen veröffentlicht:\nDen Gläubigern der an der Verschmelzung beteiligten Rechtsträger ist, wenn sie binnen sechs Monaten nach dem Tag, an dem die Eintragung der Verschmelzung in das Register des Sitzes desjenigen Rechtsträgers, dessen Gläubiger sie sind, als bekannt gemacht gilt, ihren Anspruch nach Grund und Höhe schriftlich anmelden, Sicherheit zu leisten, soweit sie nicht Befriedigung verlangen können. Dieses Recht steht den Gläubigern jedoch nur zu, wenn sie glaubhaft machen, dass durch die Verschmelzung die Erfüllung ihrer Forderung gefährdet wird."
    },
    {
      "date": "2025-03-05",
      "id": "102901",
      "original_text": "Löschungsankündigung\nBerlin Amtsgericht Berlin (Charlottenburg) HRB 157895\nSchuhtempel24 Verwaltungs GmbH – Berlin",
      "type": "Löschungsankündigung",
      "state": "Berlin",
      "amtsgericht": "Amtsgericht Berlin (Charlottenburg)",
      "registernummer": "HRB 157895",
      "registerart": "HRB",
      "company_name": "Schuhtempel24 Verwaltungs GmbH",
      "company_seat": "Berlin",
      "details": "05.03.2025 (Bekanntmachungsdatum)\n\nBerlin Amtsgericht Berlin (Charlottenburg) HRB 157895\nLöschungsankündigung\n\nSchuhtempel24 Verwaltungs GmbH\nGesellschaft mit beschränkter Haftung\nBerlin\n\nBei der nachstehenden Gesellschaft wird das Amtslöschungsverfahren gemäß § 394 FamFG eingeleitet. Widerspruchsfrist 6 Wochen"
    },
    {
      "date": "2025-03-05",
      "id": "102902",
      "original_text": "Löschungsankündigung\nBerlin Amtsgericht Berlin (Charlottenburg) HRB 201925\nDer Baudienstleister TK GmbH – Berlin",
      "type": "Löschungsankündigung",
      "state": "Berlin",
      "amtsgericht": "Amtsgericht Berlin (Charlottenburg)",
      "registernummer": "HRB 201925",
      "registerart": "HRB",
      "company_name": "Der Baudienstleister TK GmbH",
      "company_seat": "Berlin",
      "details": "05.03.2025 (Bekanntmachungsdatum)\n\nBerlin Amtsgericht Berlin (Charlottenburg) HRB 201925\nLöschungsankündigung\n\nDer Baudienstleister TK GmbH\nGesellschaft mit beschränkter Haftung\nBerlin\n\nBei der nachstehenden Gesellschaft wird das Amtslöschungsverfahren gemäß § 394 FamFG eingeleitet. Widerspruchsfrist 6 Wochen"
    },
    {
      "date": "2025-03-05",
      "id": "102903",
      "original_text": "Löschungsankündigung\nBerlin Amtsgericht Berlin (Charlottenburg) HRB 213921\nUni-Rohbau GmbH – Berlin",
      "type": "Löschungsankündigung",
      "state": "Berlin",
      "amtsgericht": "Amtsgericht Berlin (Charlottenburg)",
      "registernummer": "HRB 213921",
      "registerart": "HRB",
      "company_name": "Uni-Rohbau GmbH",
      "company_seat": "Berlin",
      "details": "05.03.2025 (Bekanntmachungsdatum)\n\nBerlin Amtsgericht Berlin (Charlottenburg) HRB 213921\nLöschungsankündigung\n\nUni-Rohbau GmbH\nGesellschaft mit beschränkter Haftung\nBerlin\n\nBei der nachstehenden Gesellschaft wird das Amtslöschungsverfahren gemäß § 394 FamFG eingeleitet. Widerspruchsfrist 6 Wochen"
    },
    {
      "date": "2025-03-05",
      "id": "102904",
      "original_text": "Registerbekanntmachung nach dem Umwandlungsgesetz\nSchleswig-Holstein Amtsgericht Flensburg HRB 16965\nBJC Consult GmbH – Flensburg",
      "type": "Registerbekanntmachung nach dem Umwandlungsgesetz",
      "state": "Schleswig-Holstein",
      "amtsgericht": "Amtsgericht Flensburg",
      "registernummer": "HRB 16965",
      "registerart": "HRB",
      "company_name": "BJC Consult GmbH",
      "company_seat": "Flensburg",
      "details": "05.03.2025 (Bekanntmachungsdatum)\n\nSchleswig-Holstein Amtsgericht Flensburg HRB 16965\nRegisterbekanntmachung nach dem Umwandlungsgesetz 04.03.2025 (Eintragungsdatum)\n\nBJC Consult GmbH\nGesellschaft mit beschränkter Haftung\nFlensburg\n\nZu Eintragungsnummer 2 vom 04.03.2025 wird als nicht eingetragen veröffentlicht: Den Gläubigern der an der Verschmelzung beteiligten Rechtsträger ist, wenn sie binnen sechs Monaten nach dem Tag, an dem die Eintragung der Verschmelzung in das Register des Sitzes desjenigen Rechtsträgers, dessen Gläubiger sie sind, als bekannt gemacht gilt, ihren Anspruch nach Grund und Höhe schriftlich anmelden, Sicherheit zu leisten, soweit sie nicht Befriedigung verlangen können. Dieses Recht steht den Gläubigern jedoch nur zu, wenn sie glaubhaft machen, dass durch die Verschmelzung die Erfüllung ihrer Forderung gefährdet wird."
    },
    {
      "date": "2025-03-05",
      "id": "102905",
      "original_text": "Registerbekanntmachung nach dem Umwandlungsgesetz\nBrandenburg Amtsgericht Potsdam HRA 8566\nUwe Plüschke e.K. – Trebbin",
      "type": "Registerbekanntmachung nach dem Umwandlungsgesetz",
      "state": "Brandenburg",
      "amtsgericht": "Amtsgericht Potsdam",
      "registernummer": "HRA 8566",
      "registerart": "HRA",
      "company_name": "Uwe Plüschke e.K.",
      "company_seat": "Trebbin",
      "details": "05.03.2025 (Bekanntmachungsdatum)\n\nBrandenburg Amtsgericht Potsdam HRA 8566\nRegisterbekanntmachung nach dem Umwandlungsgesetz 28.02.2025 (Eintragungsdatum)\n\nUwe Plüschke e.K.\nEinzelkaufmann / Einzelkauffrau\nTrebbin\n\nZu Eintragungsnummer 2 vom 28.02.2025 wird als nicht eingetragen veröffentlicht:\nDen Gläubigern der an der Verschmelzung beteiligten Rechtsträger ist, wenn sie binnen sechs Monaten nach dem Tag, an dem die Eintragung der Verschmelzung in das Register des Sitzes desjenigen Rechtsträgers, dessen Gläubiger sie sind, als bekannt gemacht gilt, ihren Anspruch nach Grund und Höhe schriftlich anmelden, Sicherheit zu leisten, soweit sie nicht Befriedigung verlangen können. Dieses Recht steht den Gläubigern jedoch nur zu, wenn sie glaubhaft machen, dass durch die Verschmelzung die Erfüllung ihrer Forderung gefährdet wird."
    },
    {
      "date": "2025-03-05",
      "id": "102906",
      "original_text": "Löschungsankündigung\nBerlin Amtsgericht Berlin (Charlottenburg) HRB 116523\nLange GmbH Hoch-& Ingenieurbau – Berlin",
      "type": "Löschungsankündigung",
      "state": "Berlin",
      "amtsgericht": "Amtsgericht Berlin (Charlottenburg)",
      "registernummer": "HRB 116523",
      "registerart": "HRB",
      "company_name": "Lange GmbH Hoch-& Ingenieurbau",
      "company_seat": "Berlin",
      "details": "05.03.2025 (Bekanntmachungsdatum)\n\nBerlin Amtsgericht Berlin (Charlottenburg) HRB 116523\nLöschungsankündigung\n\nLange GmbH Hoch-& Ingenieurbau\nGesellschaft mit beschränkter Haftung\nBerlin\n\nBei der nachstehenden Gesellschaft wird das Amtslöschungsverfahren gemäß § 394 FamFG eingeleitet. Widerspruchsfrist 6 Wochen"
    },
    {
      "date": "2025-03-05",
      "id": "102907",
      "original_text": "Registerbekanntmachung nach dem Umwandlungsgesetz\nBerlin Amtsgericht Berlin (Charlottenburg) HRB 242606\nQuamdomi GmbH – Berlin",
      "type": "Registerbekanntmachung nach dem Umwandlungsgesetz",
      "state": "Berlin",
      "amtsgericht": "Amtsgericht Berlin (Charlottenburg)",
      "registernummer": "HRB 242606",
      "registerart": "HRB",
      "company_name": "Quamdomi GmbH",
      "company_seat": "Berlin",
      "details": "05.03.2025 (Bekanntmachungsdatum)\n\nBerlin Amtsgericht Berlin (Charlottenburg) HRB 242606\nRegisterbekanntmachung nach dem Umwandlungsgesetz 05.03.2025 (Eintragungsdatum)\n\nQuamdomi GmbH\nGesellschaft mit beschränkter Haftung\nBerlin\n\nZu Eintragungsnummer 2 vom 05.03.2025 wird als nicht eingetragen veröffentlicht: Den Gläubigern der an der Verschmelzung beteiligten Rechtsträger ist, wenn sie binnen sechs Monaten nach dem Tag, an dem die Eintragung der Verschmelzung in das Register des Sitzes desjenigen Rechtsträgers, dessen Gläubiger sie sind, als bekannt gemacht gilt, ihren Anspruch nach Grund und Höhe schriftlich anmelden, Sicherheit zu leisten, soweit sie nicht Befriedigung verlangen können. Dieses Recht steht den Gläubigern jedoch nur zu, wenn sie glaubhaft machen, dass durch die Verschmelzung die Erfüllung ihrer Forderung gefährdet wird. Das Recht, Sicherheitsleistung zu verlangen, steht Gläubigern nicht zu, die im Falle der Insolvenz ein Recht auf vorzugsweise Befriedigung aus einer Deckungsmasse haben, die nach gesetzlicher Vorschrift zu ihrem Schutz errichtet und staatlich überwacht ist."
    },
    {
      "date": "2025-03-05",
      "id": "102908",
      "original_text": "Löschungsankündigung\nBerlin Amtsgericht Berlin (Charlottenburg) HRB 204393\nVictoria Uniclean GmbH – Berlin",
      "type": "Löschungsankündigung",
      "state": "Berlin",
      "amtsgericht": "Amtsgericht Berlin (Charlottenburg)",
      "registernummer": "HRB 204393",
      "registerart": "HRB",
      "company_name": "Victoria Uniclean GmbH",
      "company_seat": "Berlin",
      "details": "05.03.2025 (Bekanntmachungsdatum)\n\nBerlin Amtsgericht Berlin (Charlottenburg) HRB 204393\nLöschungsankündigung\n\nVictoria Uniclean GmbH\nGesellschaft mit beschränkter Haftung\nBerlin\n\nBei der nachstehenden Gesellschaft wird das Amtslöschungsverfahren gemäß § 394 FamFG eingeleitet. Widerspruchsfrist 6 Wochen"
    },
    {
      "date": "2025-03-05",
      "id": "102909",
      "original_text": "Registerbekanntmachung nach dem Umwandlungsgesetz\nHamburg Amtsgericht Hamburg HRB 93592\nHANSA TREUHAND Holding AG – Hamburg",
      "type": "Registerbekanntmachung nach dem Umwandlungsgesetz",
      "state": "Hamburg",
      "amtsgericht": "Amtsgericht Hamburg",
      "registernummer": "HRB 93592",
      "registerart": "HRB",
      "company_name": "HANSA TREUHAND Holding AG",
      "company_seat": "Hamburg",
      "details": "05.03.2025 (Bekanntmachungsdatum)\n\nHamburg Amtsgericht Hamburg HRB 93592\nRegisterbekanntmachung nach dem Umwandlungsgesetz 05.03.2025 (Eintragungsdatum)\n\nHANSA TREUHAND Holding AG\nAktiengesellschaft\nHamburg\n\nAls nicht eingetragen wird bekannt gemacht:\nDen Gläubigern der an dem Formwechsel beteiligten Gesellschaft ist, wenn sie binnen sechs Monaten nach dem Tag, an dem die Eintragung des Formwechsels in das Register des Sitzes desjenigen Rechtsträgers, dessen Gläubiger sie sind, nach § 201 UmwG als bekannt gemacht gilt, ihren Anspruch nach Grund und Höhe schriftlich anmelden, Sicherheit zu leisten, soweit sie nicht Befriedigung verlangen können. Dieses Recht steht den Gläubigern jedoch nur zu, wenn sie glaubhaft machen, dass durch den Formwechsel die Erfüllung ihrer Forderung gefährdet wird."
    },
    {
      "date": "2025-03-05",
      "id": "102910",
      "original_text": "Registerbekanntmachung nach dem Umwandlungsgesetz\nSachsen-Anhalt Amtsgericht Stendal HRB 34669\nSudenburger Grillhaus GmbH – Magdeburg",
      "type": "Registerbekanntmachung nach dem Umwandlungsgesetz",
      "state": "Sachsen-Anhalt",
      "amtsgericht": "Amtsgericht Stendal",
      "registernummer": "HRB 34669",
      "registerart": "HRB",
      "company_name": "Sudenburger Grillhaus GmbH",
      "company_seat": "Magdeburg",
      "details": "05.03.2025 (Bekanntmachungsdatum)\n\nSachsen-Anhalt Amtsgericht Stendal HRB 34669\nRegisterbekanntmachung nach dem Umwandlungsgesetz 05.03.2025 (Eintragungsdatum)\n\nSudenburger Grillhaus GmbH\nGesellschaft mit beschränkter Haftung\nMagdeburg\n\nNicht eingetragen:\nDen Gläubigern der an der Ausgliederung beteiligten Rechtsträger, ist wenn sie binnen sechs Monaten nach dem Tag, an dem die Eintragung der Ausgliederung nach §§125, 19 Abs. 3 UmwG als bekanntgemacht gilt, ihren Anspruch nach Grund und Höhe schriftlich anmelden, Sicherheit zu leisten, soweit sie nicht Befriedigung verlangen können. Diese Recht steht ihnen jedoch nur zu, wenn sie glaubhaft machen, dass durch die Ausgliederung die Erfüllung ihrer Forderung gefährdet wird."
    },
    {
      "date": "2025-03-05",
      "id": "102911",
      "original_text": "Registerbekanntmachung nach dem Umwandlungsgesetz\nSachsen-Anhalt Amtsgericht Stendal HRA 8005\nSudenburger Grillhaus e.K. – Magdeburg",
      "type": "Registerbekanntmachung nach dem Umwandlungsgesetz",
      "state": "Sachsen-Anhalt",
      "amtsgericht": "Amtsgericht Stendal",
      "registernummer": "HRA 8005",
      "registerart": "HRA",
      "company_name": "Sudenburger Grillhaus e.K.",
      "company_seat": "Magdeburg",
      "details": "05.03.2025 (Bekanntmachungsdatum)\n\nSachsen-Anhalt Amtsgericht Stendal HRA 8005\nRegisterbekanntmachung nach dem Umwandlungsgesetz 05.03.2025 (Eintragungsdatum)\n\nSudenburger Grillhaus e.K.\nEinzelkaufmann / Einzelkauffrau\nMagdeburg\n\nNicht eingetragen:\nDen Gläubigern der an der Ausgliederung beteiligten Rechtsträger, ist wenn sie binnen sechs Monaten nach dem Tag, an dem die Eintragung der Ausgliederung nach §§125, 19 Abs. 3 UmwG als bekanntgemacht gilt, ihren Anspruch nach Grund und Höhe schriftlich anmelden, Sicherheit zu leisten, soweit sie nicht Befriedigung verlangen können. Diese Recht steht ihnen jedoch nur zu, wenn sie glaubhaft machen, dass durch die Ausgliederung die Erfüllung ihrer Forderung gefährdet wird."
    },
    {
      "date": "2025-03-05",
      "id": "102912",
      "original_text": "Registerbekanntmachung nach dem Umwandlungsgesetz\nSchleswig-Holstein Amtsgericht Kiel HRB 14468\nVitalAire GmbH – Norderstedt",
      "type": "Registerbekanntmachung nach dem Umwandlungsgesetz",
      "state": "Schleswig-Holstein",
      "amtsgericht": "Amtsgericht Kiel",
      "registernummer": "HRB 14468",
      "registerart": "HRB",
      "company_name": "VitalAire GmbH",
      "company_seat": "Norderstedt",
      "details": "05.03.2025 (Bekanntmachungsdatum)\n\nSchleswig-Holstein Amtsgericht Kiel HRB 14468\nRegisterbekanntmachung nach dem Umwandlungsgesetz 03.03.2025 (Eintragungsdatum)\n\nVitalAire GmbH\nGesellschaft mit beschränkter Haftung\nNorderstedt\n\nZu Eintragungsnummer 20 vom 03.03.2025 wird als nicht eingetragen veröffentlicht: Den Gläubigern der an der Verschmelzung beteiligten Rechtsträger ist, wenn sie binnen sechs Monaten nach dem Tag, an dem die Eintragung der Verschmelzung in das Register des Sitzes desjenigen Rechtsträgers, dessen Gläubiger sie sind, nach § 19 Abs. 3 UmwG bekannt gemacht worden ist, ihren Anspruch nach Grund und Höhe schriftlich anmelden, Sicherheit zu leisten, soweit sie nicht Befriedigung verlangen können. Dieses Recht steht den Gläubigern jedoch nur zu, wenn sie glaubhaft machen, dass durch die Verschmelzung die Erfüllung ihrer Forderung gefährdet wird."
    },
    {
      "date": "2025-03-05",
      "id": "102913",
      "original_text": "Einreichung neuer Dokumente\nSaarland Amtsgericht Saarbrücken HRB 4145\nVSE Aktiengesellschaft – Saarbrücken",
      "type": "Einreichung neuer Dokumente",
      "state": "Saarland",
      "amtsgericht": "Amtsgericht Saarbrücken",
      "registernummer": "HRB 4145",
      "registerart": "HRB",
      "company_name": "VSE Aktiengesellschaft",
      "company_seat": "Saarbrücken",
      "details": "05.03.2025 (Bekanntmachungsdatum)\n\nSaarland Amtsgericht Saarbrücken HRB 4145\nEinreichung neuer Dokumente\n\nVSE Aktiengesellschaft\nAktiengesellschaft\nSaarbrücken\n\nDer Vorstand der Gesellschaft hat eine Liste der Mitglieder des Aufsichtsrats zum Handelsregister eingereicht (§ 106 AktG)."
    },
    {
      "date": "2025-03-05",
      "id": "102914",
      "original_text": "Sonstige Registerbekanntmachung\nBerlin Amtsgericht Berlin (Charlottenburg) HRB 164095\n123makler GmbH – Berlin",
      "type": "Sonstige Registerbekanntmachung",
      "state": "Berlin",
      "amtsgericht": "Amtsgericht Berlin (Charlottenburg)",
      "registernummer": "HRB 164095",
      "registerart": "HRB",
      "company_name": "123makler GmbH",
      "company_seat": "Berlin",
      "details": "05.03.2025 (Bekanntmachungsdatum)\n\nBerlin Amtsgericht Berlin (Charlottenburg) HRB 164095\nSonstige Registerbekanntmachung\n\n123makler GmbH\nGesellschaft mit beschränkter Haftung\nBerlin\n\nAls nicht eingetragen wird veröffentlicht: Der andere Vertragsteil hat den Gläubigern dieses Rechtsträgers, deren Forderungen begründet worden sind, bevor die Eintragung der Beendigung dieses Vertrages in das Handelsregister nach § 10 des Handelsgesetzbuches als bekannt gemacht gilt, Sicherheit zu leisten, wenn sie sich binnen sechs Monaten nach der Bekanntmachung der Eintragung zu diesem Zweck bei ihm melden. Dieses Recht steht den Gläubigern nicht zu, die im Fall des Insolvenzverfahrens ein Recht auf vorzugsweise Befriedigung aus der Deckungsmasse haben, die nach gesetzlicher Vorschrift zu ihrem Schutz errichtet und staatlich überwacht ist."
    },
    {
      "date": "2025-03-05",
      "id": "102915",
      "original_text": "Einreichung neuer Dokumente\nBaden-Württemberg Amtsgericht Stuttgart HRB 108581\nBechtle Aktiengesellschaft – Neckarsulm",
      "type": "Einreichung neuer Dokumente",
      "state": "Baden-Württemberg",
      "amtsgericht": "Amtsgericht Stuttgart",
      "registernummer": "HRB 108581",
      "registerart": "HRB",
      "company_name": "Bechtle Aktiengesellschaft",
      "company_seat": "Neckarsulm",
      "details": "05.03.2025 (Bekanntmachungsdatum)\n\nBaden-Württemberg Amtsgericht Stuttgart HRB 108581\nEinreichung neuer Dokumente\n\nBechtle Aktiengesellschaft\nAktiengesellschaft\nNeckarsulm\n\nAls nicht eingetragen wird bekanntgemacht:\nDie Gesellschaft hat am 04.03.2025 die Liste über die Zusammensetzung des Aufsichtsrats zum Handelsregister eingereicht."
    },
    {
      "date": "2025-03-05",
      "id": "102916",
      "original_text": "Löschungsankündigung\nBaden-Württemberg Amtsgericht Freiburg HRB 725862\nMoosservice24 GmbH – Teningen",
      "type": "Löschungsankündigung",
      "state": "Baden-Württemberg",
      "amtsgericht": "Amtsgericht Freiburg",
      "registernummer": "HRB 725862",
      "registerart": "HRB",
      "company_name": "Moosservice24 GmbH",
      "company_seat": "Teningen",
      "details": "05.03.2025 (Bekanntmachungsdatum)\n\nBaden-Württemberg Amtsgericht Freiburg HRB 725862\nLöschungsankündigung\n\nMoosservice24 GmbH\nGesellschaft mit beschränkter Haftung\nTeningen\n\nDas Gericht beabsichtigt, die Gesellschaft wegen Vermögenslosigkeit im Handelsregister von Amts wegen nach § 394 FamFG zu löschen. Die Frist zur Geltendmachung eines Widerspruchs gegen die beabsichtigte Löschung ist auf einen Monat ab Veröffentlichung bestimmt."
    },
    {
      "date": "2025-03-05",
      "id": "102917",
      "original_text": "Registerbekanntmachung nach dem Umwandlungsgesetz\nSchleswig-Holstein Amtsgericht Kiel HRB 8185\nNord Service Projects GmbH – Norderstedt",
      "type": "Registerbekanntmachung nach dem Umwandlungsgesetz",
      "state": "Schleswig-Holstein",
      "amtsgericht": "Amtsgericht Kiel",
      "registernummer": "HRB 8185",
      "registerart": "HRB",
      "company_name": "Nord Service Projects GmbH",
      "company_seat": "Norderstedt",
      "details": "05.03.2025 (Bekanntmachungsdatum)\n\nSchleswig-Holstein Amtsgericht Kiel HRB 8185\nRegisterbekanntmachung nach dem Umwandlungsgesetz 03.03.2025 (Eintragungsdatum)\n\nNord Service Projects GmbH\nGesellschaft mit beschränkter Haftung\nNorderstedt\n\nZu Eintragungsnummer 15 vom 03.03.2025 wird als nicht eingetragen veröffentlicht:  Als nicht eingetragen wird veröffentlicht: Den Gläubigern der an der Verschmelzung beteiligten Rechtsträger ist, wenn sie binnen sechs Monaten nach dem Tag, an dem die Eintragung der Verschmelzung in das Register des Sitzes desjenigen Rechtsträgers, dessen Gläubiger sie sind, nach § 19 Abs. 3 UmwG bekannt gemacht worden ist, ihren Anspruch nach Grund und Höhe schriftlich anmelden, Sicherheit zu leisten, soweit sie nicht Befriedigung verlangen können. Dieses Recht steht den Gläubigern jedoch nur zu, wenn sie glaubhaft machen, dass durch die Verschmelzung die Erfüllung ihrer Forderung gefährdet wird."
    },
    {
      "date": "2025-03-05",
      "id": "102918",
      "original_text": "Löschungsankündigung\nBaden-Württemberg Amtsgericht Mannheim HRB 719349\nLaViña Verwaltungs UG (haftungsbeschränkt) – Mannheim",
      "type": "Löschungsankündigung",
      "state": "Baden-Württemberg",
      "amtsgericht": "Amtsgericht Mannheim",
      "registernummer": "HRB 719349",
      "registerart": "HRB",
      "company_name": "LaViña Verwaltungs UG (haftungsbeschränkt)",
      "company_seat": "Mannheim",
      "details": "05.03.2025 (Bekanntmachungsdatum)\n\nBaden-Württemberg Amtsgericht Mannheim HRB 719349\nLöschungsankündigung\n\nLaViña Verwaltungs UG (haftungsbeschränkt)\nGesellschaft mit beschränkter Haftung\nMannheim\n\nDas Gericht beabsichtigt, die Gesellschaft wegen Vermögenslosigkeit im Handelsregister von Amts wegen nach § 394 FamFG zu löschen. Die Frist zur Geltendmachung eines Widerspruchs gegen die beabsichtigte Löschung ist auf einen Monat ab Veröffentlichung bestimmt."
    },
    {
      "date": "2025-03-05",
      "id": "102919",
      "original_text": "Registerbekanntmachung nach dem Umwandlungsgesetz\nSchleswig-Holstein Amtsgericht Kiel HRB 16 EC\nSiemsen Transportbeton Gesellschaft mit beschränkter Haftung – Eckernförde",
      "type": "Registerbekanntmachung nach dem Umwandlungsgesetz",
      "state": "Schleswig-Holstein",
      "amtsgericht": "Amtsgericht Kiel",
      "registernummer": "HRB 16 EC",
      "registerart": "HRB",
      "company_name": "Siemsen Transportbeton Gesellschaft mit beschränkter Haftung",
      "company_seat": "Eckernförde",
      "details": "05.03.2025 (Bekanntmachungsdatum)\n\nSchleswig-Holstein Amtsgericht Kiel HRB 16 EC\nRegisterbekanntmachung nach dem Umwandlungsgesetz 04.03.2025 (Eintragungsdatum)\n\nSiemsen Transportbeton Gesellschaft mit beschränkter Haftung\nGesellschaft mit beschränkter Haftung\nEckernförde\n\nZu Eintragungsnummer 9 vom 04.03.2025 wird als nicht eingetragen veröffentlicht: Den Gläubigern der an der Verschmelzung beteiligten Rechtsträger ist, wenn sie binnen sechs Monaten nach dem Tag, an dem die Eintragung der Verschmelzung in das Register des Sitzes desjenigen Rechtsträgers, dessen Gläubiger sie sind, nach § 19 Abs. 3 UmwG bekannt gemacht worden ist, ihren Anspruch nach Grund und Höhe schriftlich anmelden, Sicherheit zu leisten, soweit sie nicht Befriedigung verlangen können. Dieses Recht steht den Gläubigern jedoch nur zu, wenn sie glaubhaft machen, dass durch die Verschmelzung die Erfüllung ihrer Forderung gefährdet wird."
    },
    {
      "date": "2025-03-05",
      "id": "102920",
      "original_text": "Sonstige Registerbekanntmachung\nThüringen Amtsgericht Eisenach VR 310100\nEisenbahnersportverein Lokomotive Eisenach e. V. – Eisenach",
      "type": "Sonstige Registerbekanntmachung",
      "state": "Thüringen",
      "amtsgericht": "Amtsgericht Eisenach",
      "registernummer": "VR 310100",
      "registerart": "VR",
      "company_name": "Eisenbahnersportverein Lokomotive Eisenach e. V.",
      "company_seat": "Eisenach",
      "details": "05.03.2025 (Bekanntmachungsdatum)\n\nThüringen Amtsgericht Eisenach VR 310100\nSonstige Registerbekanntmachung 05.03.2025 (Eintragungsdatum)\n\nEisenbahnersportverein Lokomotive Eisenach e. V.\neingetragener Verein\nEisenach\n\nDer Verein Nord-Stern 90 e.V. VR 310054, ist dem Eisenbahner Sportverein Lokomotive Eisenach e.V. VR 310100,  durch Verschmelzungsvertrag vom 14.10.24 beigetreten."
    },
    {
      "date": "2025-03-05",
      "id": "102921",
      "original_text": "Registerbekanntmachung nach dem Umwandlungsgesetz\nBerlin Amtsgericht Berlin (Charlottenburg) HRB 108910\nThird Raglan GmbH – Berlin",
      "type": "Registerbekanntmachung nach dem Umwandlungsgesetz",
      "state": "Berlin",
      "amtsgericht": "Amtsgericht Berlin (Charlottenburg)",
      "registernummer": "HRB 108910",
      "registerart": "HRB",
      "company_name": "Third Raglan GmbH",
      "company_seat": "Berlin",
      "details": "05.03.2025 (Bekanntmachungsdatum)\n\nBerlin Amtsgericht Berlin (Charlottenburg) HRB 108910\nRegisterbekanntmachung nach dem Umwandlungsgesetz\n\nThird Raglan GmbH\nGesellschaft mit beschränkter Haftung\nBerlin\n\nAls nicht eingetragen wird veröffentlicht:\n\n1. Es wird gebeten, einen Hinweis gemäß § 10 HGB bekannt zu machen, wonach der Entwurf des Verschmelzungsplans beim Handelsregister eingereicht worden ist.\n\n2. An der Verschmelzung sind\na) als übertragende Gesellschaft die RAGLAN German Property S.A., eine nach luxemburgischen Recht gegründete und bestehende Aktiengesellschaft mit Sitz in Luxemburg, Großherzogtum Luxemburg (eingetragene Geschäftsanschrift: 28 Boulevard F.W. Raiffeisen, L-2411 Luxemburg, Großherzogtum Luxemburg) und\nb) als übernehmende Gesellschaft die Third Raglan GmbH mit Sitz in Berlin, Deutschland, beteiligt.\n\n3. Die an der grenzüberschreitenden Verschmelzung beteiligten Gesellschaften sind in den folgenden Registern eingetragen:\na) Die übertragende Gesellschaft RAGLAN German Property S.A. ist eingetragen im luxemburgischen Handelsregister (Registre de commerce et des sociétés Luxembourg) unter Nummer B120521.\nb) Die übernehmende Gesellschaft Third Raglan GmbH ist eingetragen im Handelsregister des Amtsgerichts Charlottenburg unter HRB 108910 B.\n\n4. Es wird gebeten, einen Hinweis gemäß § 10 HGB bekannt zu machen, wonach die Anteilsinhaber und die Gläubiger der Third Raglan GmbH sowie der RAGLAN German Property S.A. als die an der Verschmelzung beteiligten Gesellschaften spätestens fünf Arbeitstage vor dem Tag der Gesellschafterversammlung Bemerkungen zum Verschmelzungsplan übermitteln können.\n\nDie Bemerkungen der Anteilsinhaber und der Gläubiger im vorstehenden Sinne können - die Bekanntmachung durch das Handelsregister im vorstehenden Sinne bis zum 4. März 2025 vorausgesetzt, was eine Beschlussfassung über die Zustimmung zu dem Verschmelzungsplan gemäß § 13 UmwG am 7. April 2025 ermöglichen würde - bis zum 2. April 2025, 24:00 Uhr an folgende Adresse übersandt werden:\n\nLuther Rechtsanwaltsgesellschaft mbH\nHeidestraße 40, 10557 Berlin.\n\nWeder bei der RAGLAN German Property S.A. noch bei der Third Raglan GmbH bestehen Betriebsräte. Weder die RAGLAN German Property S.A. noch die Third Raglan GmbH beschäftigen Arbeitnehmer. Insofern ist der Hinweis im Sinne des § 308 Abs. 1 Nr. 4 lit. b) UmwG entbehrlich."
    },
    {
      "date": "2025-03-05",
      "id": "102922",
      "original_text": "Löschungsankündigung\nBaden-Württemberg Amtsgericht Stuttgart HRB 786285\nAfrica's Best UG (haftungsbeschränkt} – Herrenberg",
      "type": "Löschungsankündigung",
      "state": "Baden-Württemberg",
      "amtsgericht": "Amtsgericht Stuttgart",
      "registernummer": "HRB 786285",
      "registerart": "HRB",
      "company_name": "Africa's Best UG (haftungsbeschränkt}",
      "company_seat": "Herrenberg",
      "details": "05.03.2025 (Bekanntmachungsdatum)\n\nBaden-Württemberg Amtsgericht Stuttgart HRB 786285\nLöschungsankündigung\n\nAfrica's Best UG (haftungsbeschränkt}\nGesellschaft mit beschränkter Haftung\nHerrenberg\n\nAls nicht eingetragen wird bekanntgemacht:\nDas Gericht beabsichtigt, die Gesellschaft wegen Vermögenslosigkeit im Handelsregister von Amts wegen nach § 394 FamFG zu löschen. Die Frist zur Geltendmachung eines Widerspruchs gegen die beabsichtigte Löschung ist auf zwei Monate ab Veröffentlichung bestimmt."
    },
    {
      "date": "2025-03-05",
      "id": "102923",
      "original_text": "Sonstige Registerbekanntmachung\nBerlin Amtsgericht Berlin (Charlottenburg) HRB 241525\nJolau GmbH – Berlin",
      "type": "Sonstige Registerbekanntmachung",
      "state": "Berlin",
      "amtsgericht": "Amtsgericht Berlin (Charlottenburg)",
      "registernummer": "HRB 241525",
      "registerart": "HRB",
      "company_name": "Jolau GmbH",
      "company_seat": "Berlin",
      "details": "05.03.2025 (Bekanntmachungsdatum)\n\nBerlin Amtsgericht Berlin (Charlottenburg) HRB 241525\nSonstige Registerbekanntmachung\n\nJolau GmbH\nGesellschaft mit beschränkter Haftung\nBerlin\n\nAls nicht eingetragen wird veröffentlicht:\nDie Gesellschaft hat am 03.03.2025 den Entwurf eines Formwechselplans betreffend die grenzüberschreitende Verlegung des Satzungssitzes der Gesellschaft nach Luxemburg gemäß §§ 333 ff. UmwG zum Handelsregister des Amtsgerichts Charlottenburg eingereicht.\nFormwechselnde Gesellschaft ist die Jolau Gmbhl mit Sitz in Berlin, eine Gesellschaft mit beschränkter Haftung nach deutschem Recht. Die Gesellschaft wird in eine luxemburgische Gesellschaft mit beschränkter Haftung (société à responsabilité limitée) im Wege des grenzüberschreitenden Formwechsels umgewandelt. Nach dem grenzüberschreitenden Formwechsel wird die Firma der Gesellschaft \"Jolau S.à.r.l.\" lauten. Der satzungsmäßige Sitz wird sich in Luxemburg, Großherzogtum Luxemburg, befinden.\nDie Jolau GmbH ist unter HRB 241525 B beim Handelsregister des Amtsgerichts Charlottenburg eingetragen.\nEs wird darauf hingewiesen, dass der Anteilsinhaber und die Gläubiger der an dem grenzüberschreitenden Formwechsel beteiligten Gesellschaft, der Jolau GmbH, der Gesellschaft bis spätestens fünf Arbeitstage vor dem Tag der Gesellschafterversammlung - d. h. spätestens bis zum 1. April 2025 Bemerkungen zum Formwechselplan übermitteln können (§§ 336, 308 Abs. 1 Satz 2 Nr. 4 Buchst. a) UmwG).\nEin zuständiger Betriebsrat im Sinne der §§ 336, 308 Abs. 1 Satz 2 Nr. 4 Buchst. b) UmwG besteht nicht und die Gesellschaft beschäftigt keine Arbeitnehmer."
    },
    {
      "date": "2025-03-05",
      "id": "102924",
      "original_text": "Registerbekanntmachung nach dem Umwandlungsgesetz\nBaden-Württemberg Amtsgericht Ulm HRB 661097\nDr. Zwissler Holding AG – Gerstetten",
      "type": "Registerbekanntmachung nach dem Umwandlungsgesetz",
      "state": "Baden-Württemberg",
      "amtsgericht": "Amtsgericht Ulm",
      "registernummer": "HRB 661097",
      "registerart": "HRB",
      "company_name": "Dr. Zwissler Holding AG",
      "company_seat": "Gerstetten",
      "details": "05.03.2025 (Bekanntmachungsdatum)\n\nBaden-Württemberg Amtsgericht Ulm HRB 661097\nRegisterbekanntmachung nach dem Umwandlungsgesetz\n\nDr. Zwissler Holding AG\nAktiengesellschaft\nGerstetten\n\nDie Gesellschaft hat am 03.03.2025 den Verschmelzungsvertrag vom 27.02.2025 zwischen \"zwissSUN GmbH\", Gerstetten (Amtsgericht Ulm HRB 744577)\nund der hiesigen Gesellschaft (übernehmender Rechtsträger) zum Handelsregister eingereicht."
    },
    {
      "date": "2025-03-05",
      "id": "102925",
      "original_text": "Löschungsankündigung\nBaden-Württemberg Amtsgericht Stuttgart HRB 19194\nR & P Wohn- und Gewerbeimmobilien GmbH – Stuttgart",
      "type": "Löschungsankündigung",
      "state": "Baden-Württemberg",
      "amtsgericht": "Amtsgericht Stuttgart",
      "registernummer": "HRB 19194",
      "registerart": "HRB",
      "company_name": "R & P Wohn- und Gewerbeimmobilien GmbH",
      "company_seat": "Stuttgart",
      "details": "05.03.2025 (Bekanntmachungsdatum)\n\nBaden-Württemberg Amtsgericht Stuttgart HRB 19194\nLöschungsankündigung\n\nR & P Wohn- und Gewerbeimmobilien GmbH\nGesellschaft mit beschränkter Haftung\nStuttgart\n\nAls nicht eingetragen wird bekanntgemacht:\nDas Gericht beabsichtigt, die Gesellschaft wegen Vermögenslosigkeit im Handelsregister von Amts wegen nach § 394 FamFG zu löschen. Die Frist zur Geltendmachung eines Widerspruchs gegen die beabsichtigte Löschung ist auf zwei Monate ab Veröffentlichung bestimmt."
    },
    {
      "date": "2025-03-05",
      "id": "102926",
      "original_text": "Registerbekanntmachung nach dem Umwandlungsgesetz\nMecklenburg-Vorpommern Amtsgericht Stralsund HRB 7815\nB&B Beteiligungs-GmbH – Liepen",
      "type": "Registerbekanntmachung nach dem Umwandlungsgesetz",
      "state": "Mecklenburg-Vorpommern",
      "amtsgericht": "Amtsgericht Stralsund",
      "registernummer": "HRB 7815",
      "registerart": "HRB",
      "company_name": "B&B Beteiligungs-GmbH",
      "company_seat": "Liepen",
      "details": "05.03.2025 (Bekanntmachungsdatum)\n\nMecklenburg-Vorpommern Amtsgericht Stralsund HRB 7815\nRegisterbekanntmachung nach dem Umwandlungsgesetz 05.03.2025 (Eintragungsdatum)\n\nB&B Beteiligungs-GmbH\nGesellschaft mit beschränkter Haftung\nLiepen\n\nAls nicht eingetragen wird veröffentlicht: Den Gläubigern der an der Verschmelzung beteiligten Rechtsträger ist, wenn sie binnen sechs Monaten nach dem Tag, an dem die Eintragung der Verschmelzung in das Register des Sitzes desjenigen Rechtsträgers, dessen Gläubiger sie sind, nach § 19 Abs. 3 UmwG als bekannt gemacht gilt,\nihren Anspruch nach Grund und Höhe in Textform anmelden, Sicherheit zu leisten, soweit sie nicht Befriedigung verlangen können. Dieses Recht steht den Gläubigern jedoch nur zu, wenn sie glaubhaft machen, dass durch die Verschmelzung die Erfüllung der Forderung gefährdet wird."
    },
    {
      "date": "2025-03-05",
      "id": "102927",
      "original_text": "Löschungsankündigung\nSchleswig-Holstein Amtsgericht Flensburg HRB 9673\nFreundlich UG (haftungsbeschränkt) – Schafflund",
      "type": "Löschungsankündigung",
      "state": "Schleswig-Holstein",
      "amtsgericht": "Amtsgericht Flensburg",
      "registernummer": "HRB 9673",
      "registerart": "HRB",
      "company_name": "Freundlich UG (haftungsbeschränkt)",
      "company_seat": "Schafflund",
      "details": "05.03.2025 (Bekanntmachungsdatum)\n\nSchleswig-Holstein Amtsgericht Flensburg HRB 9673\nLöschungsankündigung\n\nFreundlich UG (haftungsbeschränkt)\nGesellschaft mit beschränkter Haftung\nSchafflund\n\nEs ist die Löschung der nachstehenden Gesellschaft wegen Vermögenslosigkeit gemäß § 394 FamFG beabsichtigt.\nWiderspruchsfrist: 2 Monate."
    },
    {
      "date": "2025-03-05",
      "id": "102928",
      "original_text": "Registerbekanntmachung nach dem Umwandlungsgesetz\nMecklenburg-Vorpommern Amtsgericht Stralsund HRB 7205\nGrand Hotel Binz GmbH – Binz",
      "type": "Registerbekanntmachung nach dem Umwandlungsgesetz",
      "state": "Mecklenburg-Vorpommern",
      "amtsgericht": "Amtsgericht Stralsund",
      "registernummer": "HRB 7205",
      "registerart": "HRB",
      "company_name": "Grand Hotel Binz GmbH",
      "company_seat": "Binz",
      "details": "05.03.2025 (Bekanntmachungsdatum)\n\nMecklenburg-Vorpommern Amtsgericht Stralsund HRB 7205\nRegisterbekanntmachung nach dem Umwandlungsgesetz 05.03.2025 (Eintragungsdatum)\n\nGrand Hotel Binz GmbH\nGesellschaft mit beschränkter Haftung\nBinz\n\nAls nicht eingetragen wird veröffentlicht: Den Gläubigern der an der Verschmelzung beteiligten Rechtsträger ist, wenn sie binnen sechs Monaten nach dem Tag, an dem die Eintragung der Verschmelzung in das Register des Sitzes desjenigen Rechtsträgers, dessen Gläubiger sie sind, nach § 19 Abs. 3 UmwG als bekannt gemacht gilt,\nihren Anspruch nach Grund und Höhe in Textform anmelden, Sicherheit zu leisten, soweit sie nicht Befriedigung verlangen können. Dieses Recht steht den Gläubigern jedoch nur zu, wenn sie glaubhaft machen, dass durch die Verschmelzung die Erfüllung der Forderung gefährdet wird."
    },
    {
      "date": "2025-03-05",
      "id": "102929",
      "original_text": "Registerbekanntmachung nach dem Umwandlungsgesetz\nHamburg Amtsgericht Hamburg HRB 164091\nPLIXXENT Holding GmbH – Hamburg",
      "type": "Registerbekanntmachung nach dem Umwandlungsgesetz",
      "state": "Hamburg",
      "amtsgericht": "Amtsgericht Hamburg",
      "registernummer": "HRB 164091",
      "registerart": "HRB",
      "company_name": "PLIXXENT Holding GmbH",
      "company_seat": "Hamburg",
      "details": "05.03.2025 (Bekanntmachungsdatum)\n\nHamburg Amtsgericht Hamburg HRB 164091\nRegisterbekanntmachung nach dem Umwandlungsgesetz 05.03.2025 (Eintragungsdatum)\n\nPLIXXENT Holding GmbH\nGesellschaft mit beschränkter Haftung\nHamburg\n\nAls nicht eingetragen wird bekannt gemacht:\nDen Gläubigern der an der grenzüberschreitenden Verschmelzung beteiligten übernehmenden Rechtsträger ist, wenn sie binnen sechs Monaten nach dem Tag, an dem die Eintragung der Verschmelzung in das Register des Sitzes desjenigen Rechtsträgers, dessen Gläubiger sie sind, nach § 19 Absatz 3 UmwG als bekanntgemacht gilt, ihren Anspruch nach Grund und Höhe schriftlich anmelden, Sicherheit zu leisten, soweit sie nicht Befriedigung verlangen können.\nDieses Recht steht den Gläubigern jedoch nur zu, wenn sie glaubhaft machen, dass durch die Verschmelzung die Erfüllung ihrer Forderung gefährdet wird."
    },
    {
      "date": "2025-03-05",
      "id": "102930",
      "original_text": "Registerbekanntmachung nach dem Umwandlungsgesetz\nBaden-Württemberg Amtsgericht Stuttgart HRB 207174\nNAGEL Technik GmbH – Korntal-Münchingen",
      "type": "Registerbekanntmachung nach dem Umwandlungsgesetz",
      "state": "Baden-Württemberg",
      "amtsgericht": "Amtsgericht Stuttgart",
      "registernummer": "HRB 207174",
      "registerart": "HRB",
      "company_name": "NAGEL Technik GmbH",
      "company_seat": "Korntal-Münchingen",
      "details": "05.03.2025 (Bekanntmachungsdatum)\n\nBaden-Württemberg Amtsgericht Stuttgart HRB 207174\nRegisterbekanntmachung nach dem Umwandlungsgesetz 05.03.2025 (Eintragungsdatum)\n\nNAGEL Technik GmbH\nGesellschaft mit beschränkter Haftung\nKorntal-Münchingen\n\nDen Gläubigern der an der Verschmelzung beteiligten Rechtsträger ist, wenn sie binnen sechs Monaten nach dem Tag, an dem die Eintragung der Verschmelzung in das Register des Sitzes desjenigen Rechtsträgers, dessen Gläubiger sie sind, nach § 19 Abs. 3 UmwG als bekanntgemacht gilt, ihren Anspruch nach Grund und Höhe schriftlich anmelden, Sicherheit zu leisten, soweit sie nicht Befriedigung verlangen können. Dieses Recht steht den Gläubigern jedoch nur zu, wenn sie glaubhaft machen, dass durch die Verschmelzung die Erfüllung ihrer Forderung gefährdet wird."
    },
    {
      "date": "2025-03-05",
      "id": "102931",
      "original_text": "Registerbekanntmachung nach dem Umwandlungsgesetz\nBerlin Amtsgericht Berlin (Charlottenburg) HRB 36500\nEUROVIA Verkehrsbau GmbH – Berlin",
      "type": "Registerbekanntmachung nach dem Umwandlungsgesetz",
      "state": "Berlin",
      "amtsgericht": "Amtsgericht Berlin (Charlottenburg)",
      "registernummer": "HRB 36500",
      "registerart": "HRB",
      "company_name": "EUROVIA Verkehrsbau GmbH",
      "company_seat": "Berlin",
      "details": "05.03.2025 (Bekanntmachungsdatum)\n\nBerlin Amtsgericht Berlin (Charlottenburg) HRB 36500\nRegisterbekanntmachung nach dem Umwandlungsgesetz 04.03.2025 (Eintragungsdatum)\n\nEUROVIA Verkehrsbau GmbH\nGesellschaft mit beschränkter Haftung\nBerlin\n\nZu Eintragungsnummer 53 vom 04.03.2025 wird als nicht eingetragen veröffentlicht: Den Gläubigern der an der Verschmelzung beteiligten Rechtsträger ist, wenn sie binnen sechs Monaten nach dem Tag, an dem die Eintragung der Verschmelzung in das Register des Sitzes desjenigen Rechtsträgers, dessen Gläubiger sie sind, als bekannt gemacht gilt, ihren Anspruch nach Grund und Höhe schriftlich anmelden, Sicherheit zu leisten, soweit sie nicht Befriedigung verlangen können. Dieses Recht steht den Gläubigern jedoch nur zu, wenn sie glaubhaft machen, dass durch die Verschmelzung die Erfüllung ihrer Forderung gefährdet wird. Das Recht, Sicherheitsleistung zu verlangen, steht Gläubigern nicht zu, die im Falle der Insolvenz ein Recht auf vorzugsweise Befriedigung aus einer Deckungsmasse haben, die nach gesetzlicher Vorschrift zu ihrem Schutz errichtet und staatlich überwacht ist."
    },
    {
      "date": "2025-03-05",
      "id": "102932",
      "original_text": "Registerbekanntmachung nach dem Umwandlungsgesetz\nBerlin Amtsgericht Berlin (Charlottenburg) HRB 252904\nGleisbau Schmidt-Scheffler Verwaltungs GmbH – Berlin",
      "type": "Registerbekanntmachung nach dem Umwandlungsgesetz",
      "state": "Berlin",
      "amtsgericht": "Amtsgericht Berlin (Charlottenburg)",
      "registernummer": "HRB 252904",
      "registerart": "HRB",
      "company_name": "Gleisbau Schmidt-Scheffler Verwaltungs GmbH",
      "company_seat": "Berlin",
      "details": "05.03.2025 (Bekanntmachungsdatum)\n\nBerlin Amtsgericht Berlin (Charlottenburg) HRB 252904\nRegisterbekanntmachung nach dem Umwandlungsgesetz 04.03.2025 (Eintragungsdatum)\n\nGleisbau Schmidt-Scheffler Verwaltungs GmbH\nGesellschaft mit beschränkter Haftung\nBerlin\n\nZu Eintragungsnummer 2 vom 04.03.2025 wird als nicht eingetragen veröffentlicht: Den Gläubigern der an der Verschmelzung beteiligten Rechtsträger ist, wenn sie binnen sechs Monaten nach dem Tag, an dem die Eintragung der Verschmelzung in das Register des Sitzes desjenigen Rechtsträgers, dessen Gläubiger sie sind, als bekannt gemacht gilt, ihren Anspruch nach Grund und Höhe schriftlich anmelden, Sicherheit zu leisten, soweit sie nicht Befriedigung verlangen können. Dieses Recht steht den Gläubigern jedoch nur zu, wenn sie glaubhaft machen, dass durch die Verschmelzung die Erfüllung ihrer Forderung gefährdet wird. Das Recht, Sicherheitsleistung zu verlangen, steht Gläubigern nicht zu, die im Falle der Insolvenz ein Recht auf vorzugsweise Befriedigung aus einer Deckungsmasse haben, die nach gesetzlicher Vorschrift zu ihrem Schutz errichtet und staatlich überwacht ist."
    },
    {
      "date": "2025-03-05",
      "id": "102933",
      "original_text": "Registerbekanntmachung nach dem Umwandlungsgesetz\nSchleswig-Holstein Amtsgericht Kiel HRA 29 EC\nWilhelm Siemsen GmbH u. Co KG – Eckernförde",
      "type": "Registerbekanntmachung nach dem Umwandlungsgesetz",
      "state": "Schleswig-Holstein",
      "amtsgericht": "Amtsgericht Kiel",
      "registernummer": "HRA 29 EC",
      "registerart": "HRA",
      "company_name": "Wilhelm Siemsen GmbH u. Co KG",
      "company_seat": "Eckernförde",
      "details": "05.03.2025 (Bekanntmachungsdatum)\n\nSchleswig-Holstein Amtsgericht Kiel HRA 29 EC\nRegisterbekanntmachung nach dem Umwandlungsgesetz 04.03.2025 (Eintragungsdatum)\n\nWilhelm Siemsen GmbH u. Co KG\nKommanditgesellschaft\nEckernförde\n\nZu Eintragungsnummer 10 vom 04.03.2025 wird als nicht eingetragen veröffentlicht: Den Gläubigern der an der Verschmelzung beteiligten Rechtsträger ist, wenn sie binnen sechs Monaten nach dem Tag, an dem die Eintragung der Verschmelzung in das Register des Sitzes desjenigen Rechtsträgers, dessen Gläubiger sie sind, nach § 19 Abs. 3 UmwG bekannt gemacht worden ist, ihren Anspruch nach Grund und Höhe schriftlich anmelden, Sicherheit zu leisten, soweit sie nicht Befriedigung verlangen können. Dieses Recht steht den Gläubigern jedoch nur zu, wenn sie glaubhaft machen, dass durch die Verschmelzung die Erfüllung ihrer Forderung gefährdet wird."
    },
    {
      "date": "2025-03-05",
      "id": "102934",
      "original_text": "Registerbekanntmachung nach dem Umwandlungsgesetz\nBaden-Württemberg Amtsgericht Stuttgart HRA 734162\nMetallbau Nagel GmbH & Co. KG – Korntal-Münchingen",
      "type": "Registerbekanntmachung nach dem Umwandlungsgesetz",
      "state": "Baden-Württemberg",
      "amtsgericht": "Amtsgericht Stuttgart",
      "registernummer": "HRA 734162",
      "registerart": "HRA",
      "company_name": "Metallbau Nagel GmbH & Co. KG",
      "company_seat": "Korntal-Münchingen",
      "details": "05.03.2025 (Bekanntmachungsdatum)\n\nBaden-Württemberg Amtsgericht Stuttgart HRA 734162\nRegisterbekanntmachung nach dem Umwandlungsgesetz 05.03.2025 (Eintragungsdatum)\n\nMetallbau Nagel GmbH & Co. KG\nKommanditgesellschaft\nKorntal-Münchingen\n\nAls nicht eingetragen wird bekanntgemacht:\nDen Gläubigern der an der Verschmelzung beteiligten Rechtsträger ist, wenn sie binnen sechs Monaten nach dem Tag, an dem die Eintragung der Verschmelzung in das Register des Sitzes desjenigen Rechtsträgers, dessen Gläubiger sie sind, nach § 19 Abs. 3 UmwG als bekanntgemacht gilt, ihren Anspruch nach Grund und Höhe schriftlich anmelden, Sicherheit zu leisten, soweit sie nicht Befriedigung verlangen können. Dieses Recht steht den Gläubigern jedoch nur zu, wenn sie glaubhaft machen, dass durch die Verschmelzung die Erfüllung ihrer Forderung gefährdet wird."
    },
    {
      "date": "2025-03-05",
      "id": "102935",
      "original_text": "Löschungsankündigung\nBerlin Amtsgericht Berlin (Charlottenburg) HRB 109787\nHOAG siebente Verwaltungs GmbH – Berlin",
      "type": "Löschungsankündigung",
      "state": "Berlin",
      "amtsgericht": "Amtsgericht Berlin (Charlottenburg)",
      "registernummer": "HRB 109787",
      "registerart": "HRB",
      "company_name": "HOAG siebente Verwaltungs GmbH",
      "company_seat": "Berlin",
      "details": "05.03.2025 (Bekanntmachungsdatum)\n\nBerlin Amtsgericht Berlin (Charlottenburg) HRB 109787\nLöschungsankündigung\n\nHOAG siebente Verwaltungs GmbH\nGesellschaft mit beschränkter Haftung\nBerlin\n\nBei der nachstehenden Gesellschaft wird das Amtslöschungsverfahren gemäß § 394 FamFG eingeleitet. Widerspruchsfrist 6 Wochen"
    },
    {
      "date": "2025-03-05",
      "id": "102936",
      "original_text": "Einreichung neuer Dokumente\nBerlin Amtsgericht Berlin (Charlottenburg) HRB 191556\nThe Grounds Real Estate Development AG – Berlin",
      "type": "Einreichung neuer Dokumente",
      "state": "Berlin",
      "amtsgericht": "Amtsgericht Berlin (Charlottenburg)",
      "registernummer": "HRB 191556",
      "registerart": "HRB",
      "company_name": "The Grounds Real Estate Development AG",
      "company_seat": "Berlin",
      "details": "05.03.2025 (Bekanntmachungsdatum)\n\nBerlin Amtsgericht Berlin (Charlottenburg) HRB 191556\nEinreichung neuer Dokumente\n\nThe Grounds Real Estate Development AG\nAktiengesellschaft\nBerlin\n\nAls nicht eingetragen wird veröffentlicht: Es wurde eine neue Liste der Aufsichtsratsmitglieder eingereicht (§ 106 AktG)."
    },
    {
      "date": "2025-03-05",
      "id": "102937",
      "original_text": "Registerbekanntmachung nach dem Umwandlungsgesetz\nSchleswig-Holstein Amtsgericht Lübeck HRA 11311\nRoyal Sun Schwencke OHG – Ahrensburg",
      "type": "Registerbekanntmachung nach dem Umwandlungsgesetz",
      "state": "Schleswig-Holstein",
      "amtsgericht": "Amtsgericht Lübeck",
      "registernummer": "HRA 11311",
      "registerart": "HRA",
      "company_name": "Royal Sun Schwencke OHG",
      "company_seat": "Ahrensburg",
      "details": "05.03.2025 (Bekanntmachungsdatum)\n\nSchleswig-Holstein Amtsgericht Lübeck HRA 11311\nRegisterbekanntmachung nach dem Umwandlungsgesetz 04.03.2025 (Eintragungsdatum)\n\nRoyal Sun Schwencke OHG\nOffene Handelsgesellschaft\nAhrensburg\n\nZu Eintragungsnummer 2 vom 04.03.2025 wird als nicht eingetragen veröffentlicht: Den Gläubigern der an der Spaltung beteiligten Rechtsträger ist, wenn sie binnen sechs Monaten nach dem Tag, an dem die Eintragung der Spaltung in das Register des Sitzes desjenigen Rechtsträgers, dessen Gläubiger sie sind, als bekannt gemacht gilt, ihren Anspruch nach Grund und Höhe schriftlich anmelden, Sicherheit zu leisten, soweit sie nicht Befriedigung verlangen können. Dieses Recht steht den Gläubigern jedoch nur zu, wenn sie glaubhaft machen, dass durch die Spaltung die Erfüllung ihrer Forderung gefährdet wird."
    },
    {
      "date": "2025-03-05",
      "id": "102938",
      "original_text": "Löschungsankündigung\nBaden-Württemberg Amtsgericht Stuttgart HRA 104887\npurpurfilm KG – Heilbronn",
      "type": "Löschungsankündigung",
      "state": "Baden-Württemberg",
      "amtsgericht": "Amtsgericht Stuttgart",
      "registernummer": "HRA 104887",
      "registerart": "HRA",
      "company_name": "purpurfilm KG",
      "company_seat": "Heilbronn",
      "details": "05.03.2025 (Bekanntmachungsdatum)\n\nBaden-Württemberg Amtsgericht Stuttgart HRA 104887\nLöschungsankündigung\n\npurpurfilm KG\nKommanditgesellschaft\nHeilbronn\n\nAls nicht eingetragen wird bekanntgemacht:\nDas Gericht beabsichtigt, die Gesellschaft wegen Vermögenslosigkeit im Handelsregister von Amts wegen nach § 394 FamFG zu löschen. Die Frist zur Geltendmachung eines Widerspruchs gegen die beabsichtigte Löschung ist auf zwei Monate ab Veröffentlichung bestimmt."
    },
    {
      "date": "2025-03-05",
      "id": "102939",
      "original_text": "Registerbekanntmachung nach dem Umwandlungsgesetz\nSachsen Amtsgericht Leipzig HRA 19634\nLEAN LLC & Co. KG – Leipzig",
      "type": "Registerbekanntmachung nach dem Umwandlungsgesetz",
      "state": "Sachsen",
      "amtsgericht": "Amtsgericht Leipzig",
      "registernummer": "HRA 19634",
      "registerart": "HRA",
      "company_name": "LEAN LLC & Co. KG",
      "company_seat": "Leipzig",
      "details": "05.03.2025 (Bekanntmachungsdatum)\n\nSachsen Amtsgericht Leipzig HRA 19634\nRegisterbekanntmachung nach dem Umwandlungsgesetz 05.03.2025 (Eintragungsdatum)\n\nLEAN LLC & Co. KG\nKommanditgesellschaft\nLeipzig\n\nDen Gläubigern der an der Verschmelzung beteiligten Rechtsträger ist, wenn sie binnen sechs Monaten nach dem Tag, an dem die Eintragung der Verschmelzung in das Register des Sitzes desjenigen Rechtsträgers, dessen Gläubiger sie sind, nach § 19 Abs. 3 UmwG als bekannt gemacht gilt, ihren Anspruch nach Grund und Höhe in Textform anmelden, Sicherheit zu leisten, soweit sie nicht Befriedigung verlangen können. Dieses Recht steht den Gläubigern jedoch nur zu, wenn sie glaubhaft machen, dass durch die Verschmelzung die Erfüllung der Forderung gefährdet wird."
    },
    {
      "date": "2025-03-05",
      "id": "102940",
      "original_text": "Einreichung neuer Dokumente\nSachsen Amtsgericht Chemnitz HRB 19751\nenvia Mitteldeutsche Energie AG – Chemnitz",
      "type": "Einreichung neuer Dokumente",
      "state": "Sachsen",
      "amtsgericht": "Amtsgericht Chemnitz",
      "registernummer": "HRB 19751",
      "registerart": "HRB",
      "company_name": "envia Mitteldeutsche Energie AG",
      "company_seat": "Chemnitz",
      "details": "05.03.2025 (Bekanntmachungsdatum)\n\nSachsen Amtsgericht Chemnitz HRB 19751\nEinreichung neuer Dokumente\n\nenvia Mitteldeutsche Energie AG\nAktiengesellschaft\nChemnitz\n\nAm 25.02.2025 wurde beim Handelsregister des Amtsgerichts Chemnitz die Liste der Mitglieder des Aufsichtsrats gemäß § 106 AktG eingereicht."
    },
    {
      "date": "2025-03-05",
      "id": "102941",
      "original_text": "Registerbekanntmachung nach dem Umwandlungsgesetz\nSachsen Amtsgericht Leipzig HRB 43061\nInvestitions- und Treuhandgesellschaft für Liegenschaften mbH Kling – Leipzig",
      "type": "Registerbekanntmachung nach dem Umwandlungsgesetz",
      "state": "Sachsen",
      "amtsgericht": "Amtsgericht Leipzig",
      "registernummer": "HRB 43061",
      "registerart": "HRB",
      "company_name": "Investitions- und Treuhandgesellschaft für Liegenschaften mbH Kling",
      "company_seat": "Leipzig",
      "details": "05.03.2025 (Bekanntmachungsdatum)\n\nSachsen Amtsgericht Leipzig HRB 43061\nRegisterbekanntmachung nach dem Umwandlungsgesetz 05.03.2025 (Eintragungsdatum)\n\nInvestitions- und Treuhandgesellschaft für Liegenschaften mbH Kling\nGesellschaft mit beschränkter Haftung\nLeipzig\n\nDen Gläubigern der an der Verschmelzung beteiligten Rechtsträger ist, wenn sie binnen sechs Monaten nach dem Tag, an dem die Eintragung der Verschmelzung in das Register des Sitzes desjenigen Rechtsträgers, dessen Gläubiger sie sind, nach § 19 Abs. 3 UmwG als bekannt gemacht gilt, ihren Anspruch nach Grund und Höhe in Textform anmelden, Sicherheit zu leisten, soweit sie nicht Befriedigung verlangen können. Dieses Recht steht den Gläubigern jedoch nur zu, wenn sie glaubhaft machen, dass durch die Verschmelzung die Erfüllung der Forderung gefährdet wird."
    },
    {
      "date": "2025-03-05",
      "id": "102942",
      "original_text": "Einreichung neuer Dokumente\nSachsen Amtsgericht Chemnitz HRB 17200\nErzgebirgsklinikum gGmbH – Annaberg-Buchholz",
      "type": "Einreichung neuer Dokumente",
      "state": "Sachsen",
      "amtsgericht": "Amtsgericht Chemnitz",
      "registernummer": "HRB 17200",
      "registerart": "HRB",
      "company_name": "Erzgebirgsklinikum gGmbH",
      "company_seat": "Annaberg-Buchholz",
      "details": "05.03.2025 (Bekanntmachungsdatum)\n\nSachsen Amtsgericht Chemnitz HRB 17200\nEinreichung neuer Dokumente\n\nErzgebirgsklinikum gGmbH\nGesellschaft mit beschränkter Haftung\nAnnaberg-Buchholz\n\nAm 03.03.2025 wurde beim Handelsregister des Amtsgerichts Chemnitz die Liste der Mitglieder des Aufsichtsrats gemäß § 52 GmbHG eingereicht."
    },
    {
      "date": "2025-03-05",
      "id": "102943",
      "original_text": "Registerbekanntmachung nach dem Umwandlungsgesetz\nSachsen Amtsgericht Dresden HRB 27798\nQoniac GmbH – Dresden",
      "type": "Registerbekanntmachung nach dem Umwandlungsgesetz",
      "state": "Sachsen",
      "amtsgericht": "Amtsgericht Dresden",
      "registernummer": "HRB 27798",
      "registerart": "HRB",
      "company_name": "Qoniac GmbH",
      "company_seat": "Dresden",
      "details": "05.03.2025 (Bekanntmachungsdatum)\n\nSachsen Amtsgericht Dresden HRB 27798\nRegisterbekanntmachung nach dem Umwandlungsgesetz 05.03.2025 (Eintragungsdatum)\n\nQoniac GmbH\nGesellschaft mit beschränkter Haftung\nDresden\n\nDen Gläubigern der an der Verschmelzung beteiligten Rechtsträger ist, wenn sie binnen sechs Monaten nach dem Tag, an dem die Eintragung der Verschmelzung in das Register des Sitzes desjenigen Rechtsträgers, dessen Gläubiger sie sind, nach § 19 Abs. 3 UmwG als bekannt gemacht gilt, ihren Anspruch nach Grund und Höhe in Textform anmelden, Sicherheit zu leisten, soweit sie nicht Befriedigung verlangen können. Dieses Recht steht den Gläubigern jedoch nur zu, wenn sie glaubhaft machen, dass durch die Verschmelzung die Erfüllung der Forderung gefährdet wird."
    },
    {
      "date": "2025-03-05",
      "id": "102944",
      "original_text": "Einreichung neuer Dokumente\nSachsen Amtsgericht Chemnitz HRB 36812\nErtl Holding AG – Kriebstein",
      "type": "Einreichung neuer Dokumente",
      "state": "Sachsen",
      "amtsgericht": "Amtsgericht Chemnitz",
      "registernummer": "HRB 36812",
      "registerart": "HRB",
      "company_name": "Ertl Holding AG",
      "company_seat": "Kriebstein",
      "details": "05.03.2025 (Bekanntmachungsdatum)\n\nSachsen Amtsgericht Chemnitz HRB 36812\nEinreichung neuer Dokumente\n\nErtl Holding AG\nAktiengesellschaft\nKriebstein\n\nAm 05.03.2025 wurde beim Handelsregister des Amtsgerichts Chemnitz die Liste der Mitglieder des Aufsichtsrats gemäß § 106 AktG eingereicht."
    },
    {
      "date": "2025-03-05",
      "id": "102945",
      "original_text": "Registerbekanntmachung nach dem Umwandlungsgesetz\nMecklenburg-Vorpommern Amtsgericht Rostock HRB 2181\nLandwirtschaftsgesellschaft Prisannewitz mbH – Prisannewitz",
      "type": "Registerbekanntmachung nach dem Umwandlungsgesetz",
      "state": "Mecklenburg-Vorpommern",
      "amtsgericht": "Amtsgericht Rostock",
      "registernummer": "HRB 2181",
      "registerart": "HRB",
      "company_name": "Landwirtschaftsgesellschaft Prisannewitz mbH",
      "company_seat": "Prisannewitz",
      "details": "05.03.2025 (Bekanntmachungsdatum)\n\nMecklenburg-Vorpommern Amtsgericht Rostock HRB 2181\nRegisterbekanntmachung nach dem Umwandlungsgesetz 05.03.2025 (Eintragungsdatum)\n\nLandwirtschaftsgesellschaft Prisannewitz mbH\nGesellschaft mit beschränkter Haftung\nPrisannewitz\n\nAls nicht eingetragen wird veröffentlicht: Den Gläubigern der an der Umwandlung beteiligten Rechtsträger ist, wenn sie binnen sechs\nMonaten nach dem Tag, an dem die Eintragung der Umwandlung in das Register des Sitzes desjenigen Rechtsträgers, dessen Gläubiger sie sind, nach § 19 Abs. 3 UmwG als bekannt gemacht gilt, ihren Anspruch nach Grund und Höhe in Textform anmelden, Sicherheit zu leisten, soweit sie nicht Befriedigung verlangen können. Dieses Recht steht den Gläubigern jedoch nur zu, wenn sie glaubhaft machen, dass durch die Umwandlung die Erfüllung der Forderung gefährdet wird."
    },
    {
      "date": "2025-03-05",
      "id": "102946",
      "original_text": "Sonstige Registerbekanntmachung\nNiedersachsen Amtsgericht Hannover HRB 214832\nPluis Group International AG – Hannover",
      "type": "Sonstige Registerbekanntmachung",
      "state": "Niedersachsen",
      "amtsgericht": "Amtsgericht Hannover",
      "registernummer": "HRB 214832",
      "registerart": "HRB",
      "company_name": "Pluis Group International AG",
      "company_seat": "Hannover",
      "details": "05.03.2025 (Bekanntmachungsdatum)\n\nNiedersachsen Amtsgericht Hannover HRB 214832\nSonstige Registerbekanntmachung\n\nPluis Group International AG\nAktiengesellschaft\nHannover\n\nDie Liste der Mitglieder des Aufsichtsrats wurde beim Registergericht eingereicht."
    },
    {
      "date": "2025-03-05",
      "id": "102947",
      "original_text": "Registerbekanntmachung nach dem Umwandlungsgesetz\nNiedersachsen Amtsgericht Osnabrück VR 1280\nOsnabrücker City-Marketing e.V. Osnabrück – Osnabrück",
      "type": "Registerbekanntmachung nach dem Umwandlungsgesetz",
      "state": "Niedersachsen",
      "amtsgericht": "Amtsgericht Osnabrück",
      "registernummer": "VR 1280",
      "registerart": "VR",
      "company_name": "Osnabrücker City-Marketing e.V. Osnabrück",
      "company_seat": "Osnabrück",
      "details": "05.03.2025 (Bekanntmachungsdatum)\n\nNiedersachsen Amtsgericht Osnabrück VR 1280\nRegisterbekanntmachung nach dem Umwandlungsgesetz 05.03.2025 (Eintragungsdatum)\n\nOsnabrücker City-Marketing e.V. Osnabrück\neingetragener Verein\nOsnabrück\n\nDen Gläubigern der an der Verschmelzung beteiligten Rechtsträger ist, wenn sie binnen sechs Monaten nach dem Tag, an dem die Eintragung der Verschmelzung in das Register des Sitzes desjenigen Rechtsträgers, dessen Gläubiger sie sind, nach § 19  Abs.  3 UmwG als bekannt gemacht gilt, ihren Anspruch nach Grund und Höhe schriftlich anmelden, Sicherheit zu leisten, soweit sie nicht Befriedigung verlangen können. Dieses Recht steht den Gläubigern jedoch nur zu, wenn sie glaubhaft machen, dass durch die Verschmelzung die Erfüllung der Forderung gefährdet wird."
    },
    {
      "date": "2025-03-05",
      "id": "102948",
      "original_text": "Einreichung neuer Dokumente\nNiedersachsen Amtsgericht Hannover HRB 57958\nFlughafen-Taxen GmbH – Langenhagen",
      "type": "Einreichung neuer Dokumente",
      "state": "Niedersachsen",
      "amtsgericht": "Amtsgericht Hannover",
      "registernummer": "HRB 57958",
      "registerart": "HRB",
      "company_name": "Flughafen-Taxen GmbH",
      "company_seat": "Langenhagen",
      "details": "05.03.2025 (Bekanntmachungsdatum)\n\nNiedersachsen Amtsgericht Hannover HRB 57958\nEinreichung neuer Dokumente\n\nFlughafen-Taxen GmbH\nGesellschaft mit beschränkter Haftung\nLangenhagen\n\nDie Liste der Mitglieder des Aufsichtsrats wurde beim Registergericht eingereicht."
    },
    {
      "date": "2025-03-05",
      "id": "102949",
      "original_text": "Registerbekanntmachung nach dem Umwandlungsgesetz\nNiedersachsen Amtsgericht Hannover HRB 208532\nHAPEP II Holding GmbH – Hannover",
      "type": "Registerbekanntmachung nach dem Umwandlungsgesetz",
      "state": "Niedersachsen",
      "amtsgericht": "Amtsgericht Hannover",
      "registernummer": "HRB 208532",
      "registerart": "HRB",
      "company_name": "HAPEP II Holding GmbH",
      "company_seat": "Hannover",
      "details": "05.03.2025 (Bekanntmachungsdatum)\n\nNiedersachsen Amtsgericht Hannover HRB 208532\nRegisterbekanntmachung nach dem Umwandlungsgesetz 05.03.2025 (Eintragungsdatum)\n\nHAPEP II Holding GmbH\nGesellschaft mit beschränkter Haftung\nHannover\n\nDen Gläubigern der an der Verschmelzung beteiligten Rechtsträger ist, wenn sie binnen sechs Monaten nach dem Tag, an dem die Eintragung der Verschmelzung in das Register des Sitzes desjenigen Rechtsträgers, dessen Gläubiger sie sind, nach § 19  Abs.  3 UmwG als bekannt gemacht gilt, ihren Anspruch nach Grund und Höhe schriftlich anmelden, Sicherheit zu leisten, soweit sie nicht Befriedigung verlangen können. Dieses Recht steht den Gläubigern jedoch nur zu, wenn sie glaubhaft machen, dass durch die Verschmelzung die Erfüllung der Forderung gefährdet wird."
    },
    {
      "date": "2025-03-05",
      "id": "102950",
      "original_text": "Registerbekanntmachung nach dem Umwandlungsgesetz\nNiedersachsen Amtsgericht Lüneburg HRA 204460\nHMF Agri-Service OHG – Suhlendorf",
      "type": "Registerbekanntmachung nach dem Umwandlungsgesetz",
      "state": "Niedersachsen",
      "amtsgericht": "Amtsgericht Lüneburg",
      "registernummer": "HRA 204460",
      "registerart": "HRA",
      "company_name": "HMF Agri-Service OHG",
      "company_seat": "Suhlendorf",
      "details": "05.03.2025 (Bekanntmachungsdatum)\n\nNiedersachsen Amtsgericht Lüneburg HRA 204460\nRegisterbekanntmachung nach dem Umwandlungsgesetz 05.03.2025 (Eintragungsdatum)\n\nHMF Agri-Service OHG\nOffene Handelsgesellschaft\nSuhlendorf\n\nDen Gläubigern der an der formwechselnden Umwandlung beteiligten Rechtsträger ist, wenn sie binnen sechs Monaten nach dem Tag, an dem die Eintragung der Umwandlung in das Register des Sitzes desjenigen Rechtsträgers, dessen Gläubiger sie sind, nach § 19 Abs. 3 UmwG als bekannt gemacht gilt, ihren Anspruch nach Grund und Höhe schriftlich anmelden, Sicherheit zu leisten, soweit sie nicht Befriedigung verlangen können. Dieses Recht steht den Gläubigern jedoch nur zu, wenn sie glaubhaft machen, dass durch die formwechselnde Umwandlung die Erfüllung der Forderung gefährdet wird."
    },
    {
      "date": "2025-03-05",
      "id": "102951",
      "original_text": "Sonstige Registerbekanntmachung\nNiedersachsen Amtsgericht Braunschweig HRA 13238\nFroböse Landtechnik - Inhaber Nils Nowak – Flöthe",
      "type": "Sonstige Registerbekanntmachung",
      "state": "Niedersachsen",
      "amtsgericht": "Amtsgericht Braunschweig",
      "registernummer": "HRA 13238",
      "registerart": "HRA",
      "company_name": "Froböse Landtechnik - Inhaber Nils Nowak",
      "company_seat": "Flöthe",
      "details": "05.03.2025 (Bekanntmachungsdatum)\n\nNiedersachsen Amtsgericht Braunschweig HRA 13238\nSonstige Registerbekanntmachung 05.03.2025 (Eintragungsdatum)\n\nFroböse Landtechnik - Inhaber Nils Nowak\nEinzelkaufmann / Einzelkauffrau\nFlöthe\n\nFirma Froböse Landtechnik - Inhaber Nils Nowak: Der Übergang der in dem Betriebe des Geschäfts entstandenen Verbindlichkeiten und Forderungen ist bei dem Erwerb des Geschäfts durch den neuen Inhaber ausgeschlossen."
    },
    {
      "date": "2025-03-05",
      "id": "102952",
      "original_text": "Registerbekanntmachung nach dem Umwandlungsgesetz\nNiedersachsen Amtsgericht Hannover HRB 224711\nHannover Re Global Holding GmbH – Hannover",
      "type": "Registerbekanntmachung nach dem Umwandlungsgesetz",
      "state": "Niedersachsen",
      "amtsgericht": "Amtsgericht Hannover",
      "registernummer": "HRB 224711",
      "registerart": "HRB",
      "company_name": "Hannover Re Global Holding GmbH",
      "company_seat": "Hannover",
      "details": "05.03.2025 (Bekanntmachungsdatum)\n\nNiedersachsen Amtsgericht Hannover HRB 224711\nRegisterbekanntmachung nach dem Umwandlungsgesetz 05.03.2025 (Eintragungsdatum)\n\nHannover Re Global Holding GmbH\nGesellschaft mit beschränkter Haftung\nHannover\n\nDen Gläubigern der an der Verschmelzung beteiligten Rechtsträger ist, wenn sie binnen sechs Monaten nach dem Tag, an dem die Eintragung der Verschmelzung in das Register des Sitzes desjenigen Rechtsträgers, dessen Gläubiger sie sind, nach § 19  Abs.  3 UmwG als bekannt gemacht gilt, ihren Anspruch nach Grund und Höhe schriftlich anmelden, Sicherheit zu leisten, soweit sie nicht Befriedigung verlangen können. Dieses Recht steht den Gläubigern jedoch nur zu, wenn sie glaubhaft machen, dass durch die Verschmelzung die Erfüllung der Forderung gefährdet wird."
    },
    {
      "date": "2025-03-05",
      "id": "102953",
      "original_text": "Registerbekanntmachung nach dem Umwandlungsgesetz\nNiedersachsen Amtsgericht Lüneburg HRB 120981 früher Amtsgericht Dannenberg (Elbe)\nHMF Agri-Service GmbH – Suhlendorf",
      "type": "Registerbekanntmachung nach dem Umwandlungsgesetz",
      "state": "Niedersachsen",
      "amtsgericht": "Amtsgericht Lüneburg",
      "registernummer": "HRB 120981",
      "registerart": "HRB",
      "company_name": "HMF Agri-Service GmbH",
      "company_seat": "Suhlendorf",
      "former_amtsgericht": "Dannenberg (Elbe)",
      "details": "05.03.2025 (Bekanntmachungsdatum)\n\nNiedersachsen Amtsgericht Lüneburg HRB 120981 früher Amtsgericht Dannenberg (Elbe)\nRegisterbekanntmachung nach dem Umwandlungsgesetz 05.03.2025 (Eintragungsdatum)\n\nHMF Agri-Service GmbH\nGesellschaft mit beschränkter Haftung\nSuhlendorf\n\nDen Gläubigern der an der formwechselnden Umwandlung beteiligten Rechtsträger ist, wenn sie binnen sechs Monaten nach dem Tag, an dem die Eintragung der Umwandlung in das Register des Sitzes desjenigen Rechtsträgers, dessen Gläubiger sie sind, nach § 19 Abs. 3 UmwG als bekannt gemacht gilt, ihren Anspruch nach Grund und Höhe schriftlich anmelden, Sicherheit zu leisten, soweit sie nicht Befriedigung verlangen können. Dieses Recht steht den Gläubigern jedoch nur zu, wenn sie glaubhaft machen, dass durch die formwechselnde Umwandlung die Erfüllung der Forderung gefährdet wird."
    },
    {
      "date": "2025-03-05",
      "id": "102954",
      "original_text": "Löschungsankündigung\nNiedersachsen Amtsgericht Braunschweig HRA 6539\nJ. Eckhardt Nachf. – Braunschweig",
      "type": "Löschungsankündigung",
      "state": "Niedersachsen",
      "amtsgericht": "Amtsgericht Braunschweig",
      "registernummer": "HRA 6539",
      "registerart": "HRA",
      "company_name": "J. Eckhardt Nachf.",
      "company_seat": "Braunschweig",
      "details": "05.03.2025 (Bekanntmachungsdatum)\n\nNiedersachsen Amtsgericht Braunschweig HRA 6539\nLöschungsankündigung\n\nJ. Eckhardt Nachf.\nKommanditgesellschaft\nBraunschweig\n\nDas Registergericht beabsichtigt, die Firma von Amts wegen nach § 31 Absatz 2 HGB i.V.m § 393 FamFG zu löschen. Die Frist zur Erhebung eines Widerspruchs ist auf 1 Monat ab dieser Registerbekanntmachung festgesetzt."
    },
    {
      "date": "2025-03-05",
      "id": "102955",
      "original_text": "Löschungsankündigung\nNiedersachsen Amtsgericht Tostedt HRB 209436\nCraft Solar GmbH – Cuxhaven",
      "type": "Löschungsankündigung",
      "state": "Niedersachsen",
      "amtsgericht": "Amtsgericht Tostedt",
      "registernummer": "HRB 209436",
      "registerart": "HRB",
      "company_name": "Craft Solar GmbH",
      "company_seat": "Cuxhaven",
      "details": "05.03.2025 (Bekanntmachungsdatum)\n\nNiedersachsen Amtsgericht Tostedt HRB 209436\nLöschungsankündigung\n\nCraft Solar GmbH\nGesellschaft mit beschränkter Haftung\nCuxhaven\n\nDas Registergericht beabsichtigt, die Gesellschaft von Amts wegen nach § 394 FamFG zu löschen. Die Frist zur Erhebung eines Widerspruchs ist auf 1 Monat ab dieser Registerbekanntmachung festgesetzt."
    },
    {
      "date": "2025-03-05",
      "id": "102956",
      "original_text": "Löschungsankündigung\nRheinland-Pfalz Amtsgericht Ludwigshafen a.Rhein (Ludwigshafen) HRB 68194\nAHA! Connection UG (haftungsbeschränkt) – Ludwigshafen am Rhein",
      "type": "Löschungsankündigung",
      "state": "Rheinland-Pfalz",
      "amtsgericht": "Amtsgericht Ludwigshafen a.Rhein (Ludwigshafen)",
      "registernummer": "HRB 68194",
      "registerart": "HRB",
      "company_name": "AHA! Connection UG (haftungsbeschränkt)",
      "company_seat": "Ludwigshafen am Rhein",
      "details": "05.03.2025 (Bekanntmachungsdatum)\n\nRheinland-Pfalz Amtsgericht Ludwigshafen a.Rhein (Ludwigshafen) HRB 68194\nLöschungsankündigung\n\nAHA! Connection UG (haftungsbeschränkt)\nGesellschaft mit beschränkter Haftung\nLudwigshafen am Rhein\n\nDas Registergericht beabsichtigt die Gesellschaft von Amts wegen nach § 394 FamFG zu löschen. Die Frist zur Erhebung eines Widerspruchs ist auf drei Monate festgesetzt."
    },
    {
      "date": "2025-03-05",
      "id": "102957",
      "original_text": "Sonstige Registerbekanntmachung\nRheinland-Pfalz Amtsgericht Landau HRB 31996\nöko-domo Haus GmbH – Landau in der Pfalz",
      "type": "Sonstige Registerbekanntmachung",
      "state": "Rheinland-Pfalz",
      "amtsgericht": "Amtsgericht Landau",
      "registernummer": "HRB 31996",
      "registerart": "HRB",
      "company_name": "öko-domo Haus GmbH",
      "company_seat": "Landau in der Pfalz",
      "details": "05.03.2025 (Bekanntmachungsdatum)\n\nRheinland-Pfalz Amtsgericht Landau HRB 31996\nSonstige Registerbekanntmachung\n\nöko-domo Haus GmbH\nGesellschaft mit beschränkter Haftung\nLandau in der Pfalz\n\nDas Registergericht beabsichtigt den Geschäftsführer von Amts wegen nach § 395 FamFG zu löschen. Die Frist zur Erhebung eines Widerspruchs ist auf einen Monat festgesetzt."
    },
    {
      "date": "2025-03-05",
      "id": "102958",
      "original_text": "Sonstige Registerbekanntmachung\nRheinland-Pfalz Amtsgericht Landau HRB 2206\nöko-domo Haus- und Bausysteme Baubetreuungs-GmbH – Landau in der Pfalz",
      "type": "Sonstige Registerbekanntmachung",
      "state": "Rheinland-Pfalz",
      "amtsgericht": "Amtsgericht Landau",
      "registernummer": "HRB 2206",
      "registerart": "HRB",
      "company_name": "öko-domo Haus- und Bausysteme Baubetreuungs-GmbH",
      "company_seat": "Landau in der Pfalz",
      "details": "05.03.2025 (Bekanntmachungsdatum)\n\nRheinland-Pfalz Amtsgericht Landau HRB 2206\nSonstige Registerbekanntmachung\n\nöko-domo Haus- und Bausysteme Baubetreuungs-GmbH\nGesellschaft mit beschränkter Haftung\nLandau in der Pfalz\n\nDas Registergericht beabsichtigt den Geschäftsführer von Amts wegen nach § 395 FamFG zu löschen. Die Frist zur Erhebung eines Widerspruchs ist auf einen Monat festgesetzt."
    },
    {
      "date": "2025-03-05",
      "id": "102959",
      "original_text": "Registerbekanntmachung nach dem Umwandlungsgesetz\nRheinland-Pfalz Amtsgericht Koblenz HRA 23163\nManagement- & Prozessberatung Dr.-Ing. Thomas Höfner e.K. – Koblenz",
      "type": "Registerbekanntmachung nach dem Umwandlungsgesetz",
      "state": "Rheinland-Pfalz",
      "amtsgericht": "Amtsgericht Koblenz",
      "registernummer": "HRA 23163",
      "registerart": "HRA",
      "company_name": "Management- & Prozessberatung Dr.-Ing. Thomas Höfner e.K.",
      "company_seat": "Koblenz",
      "details": "05.03.2025 (Bekanntmachungsdatum)\n\nRheinland-Pfalz Amtsgericht Koblenz HRA 23163\nRegisterbekanntmachung nach dem Umwandlungsgesetz 05.03.2025 (Eintragungsdatum)\n\nManagement- & Prozessberatung Dr.-Ing. Thomas Höfner e.K.\nEinzelkaufmann / Einzelkauffrau\nKoblenz\n\nAls nicht eingetragen wird veröffentlicht: Den Gläubigern der an der Ausgliederung beteiligten Rechtsträger ist, wenn sie binnen sechs Monaten nac hdem Tag, an dem die Eintragung der Ausgliederung in das Register des Sitzes desjenigen Rechtsträgers,dessen Gläubiger sie sind, nach § 19 Abs. 3 UmwG als bekannt gemacht gilt, ihren Anspruch nach Grund und Höhe schriftlich anmelden, Sicherheit zu leisten, soweit sie nicht Befriedigung verlangen können. Dieses Recht steht den Gläubigern jedoch nur zu, wenn sie glaubhaft machen, dass durch die Ausgliederung die Erfüllung der Forderung gefährdet wird."
    },
    {
      "date": "2025-03-05",
      "id": "102960",
      "original_text": "Einreichung neuer Dokumente\nRheinland-Pfalz Amtsgericht Mainz HRB 44261\nDB Cargo Vermögensverwaltungs-Aktiengesellschaft – Mainz",
      "type": "Einreichung neuer Dokumente",
      "state": "Rheinland-Pfalz",
      "amtsgericht": "Amtsgericht Mainz",
      "registernummer": "HRB 44261",
      "registerart": "HRB",
      "company_name": "DB Cargo Vermögensverwaltungs-Aktiengesellschaft",
      "company_seat": "Mainz",
      "details": "05.03.2025 (Bekanntmachungsdatum)\n\nRheinland-Pfalz Amtsgericht Mainz HRB 44261\nEinreichung neuer Dokumente\n\nDB Cargo Vermögensverwaltungs-Aktiengesellschaft\nAktiengesellschaft\nMainz\n\nDem Registergericht ist eine neue Liste der Mitglieder des Aufsichtsrates eingereicht worden."
    },
    {
      "date": "2025-03-05",
      "id": "102961",
      "original_text": "Registerbekanntmachung nach dem Umwandlungsgesetz\nRheinland-Pfalz Amtsgericht Landau HRB 31587\nsteuer.mann steuerberatungsgesellschaft mbH – Klingenmünster",
      "type": "Registerbekanntmachung nach dem Umwandlungsgesetz",
      "state": "Rheinland-Pfalz",
      "amtsgericht": "Amtsgericht Landau",
      "registernummer": "HRB 31587",
      "registerart": "HRB",
      "company_name": "steuer.mann steuerberatungsgesellschaft mbH",
      "company_seat": "Klingenmünster",
      "details": "05.03.2025 (Bekanntmachungsdatum)\n\nRheinland-Pfalz Amtsgericht Landau HRB 31587\nRegisterbekanntmachung nach dem Umwandlungsgesetz 17.02.2025 (Eintragungsdatum)\n\nsteuer.mann steuerberatungsgesellschaft mbH\nGesellschaft mit beschränkter Haftung\nKlingenmünster\n\nAls nicht eingetragen wird veröffentlicht: Den Gläubigern der an der Verschmelzung beteiligten Rechtsträger ist, wenn sie binnen sechs Monaten nach dem Tag, an dem die Eintragung der Verschmelzung in das Register des Sitzes desjenigen Rechtsträgers,dessen Gläubiger sie sind, nach § 19 Abs. 3 UmwG als bekannt gemacht gilt, ihren Anspruch nach Grund und Höhe schriftlich anmelden, Sicherheit zu leisten, soweit sie nicht Befriedigung verlangen können. Dieses Recht steht den Gläubigern jedoch nur zu, wenn sie glaubhaft machen, dass durch die Verschmelzung die Erfüllung der Forderung gefährdet wird."
    },
    {
      "date": "2025-03-05",
      "id": "102962",
      "original_text": "Löschungsankündigung\nRheinland-Pfalz Amtsgericht Mainz HRA 1854\nOliver's Shop Petersohn KG – Mainz",
      "type": "Löschungsankündigung",
      "state": "Rheinland-Pfalz",
      "amtsgericht": "Amtsgericht Mainz",
      "registernummer": "HRA 1854",
      "registerart": "HRA",
      "company_name": "Oliver's Shop Petersohn KG",
      "company_seat": "Mainz",
      "details": "05.03.2025 (Bekanntmachungsdatum)\n\nRheinland-Pfalz Amtsgericht Mainz HRA 1854\nLöschungsankündigung\n\nOliver's Shop Petersohn KG\nKommanditgesellschaft\nMainz\n\nDas Registergericht beabsichtigt die Firma von Amts wegen nach § 31 Abs. 2 HGB, § 393 FamFG zu löschen. Die Frist zur Erhebung eines Widerspruchs ist auf einen Monat festgesetzt."
    },
    {
      "date": "2025-03-05",
      "id": "102963",
      "original_text": "Registerbekanntmachung nach dem Umwandlungsgesetz\nRheinland-Pfalz Amtsgericht Mainz HRB 46752\nKISTENPFENNIG GmbH – Mainz",
      "type": "Registerbekanntmachung nach dem Umwandlungsgesetz",
      "state": "Rheinland-Pfalz",
      "amtsgericht": "Amtsgericht Mainz",
      "registernummer": "HRB 46752",
      "registerart": "HRB",
      "company_name": "KISTENPFENNIG GmbH",
      "company_seat": "Mainz",
      "details": "05.03.2025 (Bekanntmachungsdatum)\n\nRheinland-Pfalz Amtsgericht Mainz HRB 46752\nRegisterbekanntmachung nach dem Umwandlungsgesetz 05.03.2025 (Eintragungsdatum)\n\nKISTENPFENNIG GmbH\nGesellschaft mit beschränkter Haftung\nMainz\n\nAls nicht eingetragen wird veröffentlicht: Den Gläubigern der an der Verschmelzung beteiligten Rechtsträger ist, wenn sie binnen sechs Monaten nach dem Tag, an dem die Eintragung der Verschmelzung in das Register des Sitzes desjenigen Rechtsträgers, dessen Gläubiger sie sind, nach § 19 Abs. 3 UmwG als bekannt gemacht gilt, ihren Anspruch nach Grund und Höhe schriftlich anmelden, Sicherheit zu leisten, soweit sie nicht Befriedigung verlangen können. Dieses Recht steht den Gläubigern jedoch nur zu, wenn sie glaubhaft machen, dass durch die Verschmelzung die Erfüllung der Forderung gefährdet wird."
    },
    {
      "date": "2025-03-05",
      "id": "102964",
      "original_text": "Sonstige Registerbekanntmachung\nRheinland-Pfalz Amtsgericht Koblenz HRB 14626\nshapefruit AG – Bad Neuenahr-Ahrweiler",
      "type": "Sonstige Registerbekanntmachung",
      "state": "Rheinland-Pfalz",
      "amtsgericht": "Amtsgericht Koblenz",
      "registernummer": "HRB 14626",
      "registerart": "HRB",
      "company_name": "shapefruit AG",
      "company_seat": "Bad Neuenahr-Ahrweiler",
      "details": "05.03.2025 (Bekanntmachungsdatum)\n\nRheinland-Pfalz Amtsgericht Koblenz HRB 14626\nSonstige Registerbekanntmachung\n\nshapefruit AG\nAktiengesellschaft\nBad Neuenahr-Ahrweiler\n\nDem Registergericht ist eine neue Liste der Mitglieder des Aufsichtsrates eingereicht worden."
    },
    {
      "date": "2025-03-05",
      "id": "102965",
      "original_text": "Registerbekanntmachung nach dem Umwandlungsgesetz\nRheinland-Pfalz Amtsgericht Mainz HRB 529\nMainzer Hofkellerei Gesellschaft mit beschränkter Haftung – Mainz",
      "type": "Registerbekanntmachung nach dem Umwandlungsgesetz",
      "state": "Rheinland-Pfalz",
      "amtsgericht": "Amtsgericht Mainz",
      "registernummer": "HRB 529",
      "registerart": "HRB",
      "company_name": "Mainzer Hofkellerei Gesellschaft mit beschränkter Haftung",
      "company_seat": "Mainz",
      "details": "05.03.2025 (Bekanntmachungsdatum)\n\nRheinland-Pfalz Amtsgericht Mainz HRB 529\nRegisterbekanntmachung nach dem Umwandlungsgesetz 05.03.2025 (Eintragungsdatum)\n\nMainzer Hofkellerei Gesellschaft mit beschränkter Haftung\nGesellschaft mit beschränkter Haftung\nMainz\n\nAls nicht eingetragen wird veröffentlicht: Den Gläubigern der an der Verschmelzung beteiligten Rechtsträger ist, wenn sie binnen sechs Monaten nach dem Tag, an dem die Eintragung der Verschmelzung in das Register des Sitzes desjenigen Rechtsträgers, dessen Gläubiger sie sind, nach § 19 Abs. 3 UmwG als bekannt gemacht gilt, ihren Anspruch nach Grund und Höhe schriftlich anmelden, Sicherheit zu leisten, soweit sie nicht Befriedigung verlangen können. Dieses Recht steht den Gläubigern jedoch nur zu, wenn sie glaubhaft machen, dass durch die Verschmelzung die Erfüllung der Forderung gefährdet wird."
    },
    {
      "date": "2025-03-05",
      "id": "102966",
      "original_text": "Löschungsankündigung\nBremen Amtsgericht Bremen HRB 37892\n1A Service GmbH – Bremerhaven",
      "type": "Löschungsankündigung",
      "state": "Bremen",
      "amtsgericht": "Amtsgericht Bremen",
      "registernummer": "HRB 37892",
      "registerart": "HRB",
      "company_name": "1A Service GmbH",
      "company_seat": "Bremerhaven",
      "details": "05.03.2025 (Bekanntmachungsdatum)\n\nBremen Amtsgericht Bremen HRB 37892\nLöschungsankündigung\n\n1A Service GmbH\nGesellschaft mit beschränkter Haftung\nBremerhaven\n\nEs ist beabsichtigt die im Handelsregister eingetragene Gesellschaft von Amts wegen gemäß § 394 FamFG zu löschen. Gegen die Löschung kann beim AG Bremen schriftlich oder zu Protokoll der Geschäftsstelle Widerspruch eingelegt werden. Widerspruchsfrist 4 Wochen."
    },
    {
      "date": "2025-03-05",
      "id": "102967",
      "original_text": "Einreichung neuer Dokumente\nBremen Amtsgericht Bremen HRB 18878\nEUROGATE Geschäftsführungs-GmbH & Co. KGaA – Bremen",
      "type": "Einreichung neuer Dokumente",
      "state": "Bremen",
      "amtsgericht": "Amtsgericht Bremen",
      "registernummer": "HRB 18878",
      "registerart": "HRB",
      "company_name": "EUROGATE Geschäftsführungs-GmbH & Co. KGaA",
      "company_seat": "Bremen",
      "details": "05.03.2025 (Bekanntmachungsdatum)\n\nBremen Amtsgericht Bremen HRB 18878\nEinreichung neuer Dokumente\n\nEUROGATE Geschäftsführungs-GmbH & Co. KGaA\nKommanditgesellschaft auf Aktien\nBremen\n\nAls nicht eingetragen wird bekannt gemacht: Liste des Aufsichtsrats wurde eingereicht."
    },
    {
      "date": "2025-03-05",
      "id": "102968",
      "original_text": "Löschungsankündigung\nNordrhein-Westfalen Amtsgericht Dortmund HRB 30970\nBack Oase Dortmund UG (haftungsbeschränkt) – Dortmund",
      "type": "Löschungsankündigung",
      "state": "Nordrhein-Westfalen",
      "amtsgericht": "Amtsgericht Dortmund",
      "registernummer": "HRB 30970",
      "registerart": "HRB",
      "company_name": "Back Oase Dortmund UG (haftungsbeschränkt)",
      "company_seat": "Dortmund",
      "details": "05.03.2025 (Bekanntmachungsdatum)\n\nNordrhein-Westfalen Amtsgericht Dortmund HRB 30970\nLöschungsankündigung\n\nBack Oase Dortmund UG (haftungsbeschränkt)\nGesellschaft mit beschränkter Haftung\nDortmund\n\nDas Registergericht beabsichtigt die Gesellschaft von Amts wegen nach § 394 FamFG zu löschen. Die Frist zur Erhebung eines Widerspruchs ist auf zwei Monate festgesetzt."
    },
    {
      "date": "2025-03-05",
      "id": "102969",
      "original_text": "Registerbekanntmachung nach dem Umwandlungsgesetz\nNordrhein-Westfalen Amtsgericht Düsseldorf HRB 46319\nBIOGARTEN Verwaltungs GmbH – Hilden",
      "type": "Registerbekanntmachung nach dem Umwandlungsgesetz",
      "state": "Nordrhein-Westfalen",
      "amtsgericht": "Amtsgericht Düsseldorf",
      "registernummer": "HRB 46319",
      "registerart": "HRB",
      "company_name": "BIOGARTEN Verwaltungs GmbH",
      "company_seat": "Hilden",
      "details": "05.03.2025 (Bekanntmachungsdatum)\n\nNordrhein-Westfalen Amtsgericht Düsseldorf HRB 46319\nRegisterbekanntmachung nach dem Umwandlungsgesetz 05.03.2025 (Eintragungsdatum)\n\nBIOGARTEN Verwaltungs GmbH\nGesellschaft mit beschränkter Haftung\nHilden\n\nDen Gläubigern der an der Verschmelzung beteiligten Rechtsträger ist, wenn sie binnen sechs Monaten nach dem Tag, an dem die Eintragung der Verschmelzung in das Register des Sitzes desjenigen Rechtsträgers, dessen Gläubiger sie sind, nach § 19 Absatz 3 UmwG als bekanntgemacht gilt, ihren Anspruch nach Grund und Höhe schriftlich anmelden, Sicherheit zu leisten, soweit sie nicht Befriedigung verlangen können. Dieses Recht steht den Gläubigern jedoch nur zu, wenn sie glaubhaft machen, dass durch die Verschmelzung die Erfüllung ihrer Forderung gefährdet wird."
    },
    {
      "date": "2025-03-05",
      "id": "102970",
      "original_text": "Löschungsankündigung\nNordrhein-Westfalen Amtsgericht Bochum HRB 16077\nOmari Trockenbau GmbH – Bochum",
      "type": "Löschungsankündigung",
      "state": "Nordrhein-Westfalen",
      "amtsgericht": "Amtsgericht Bochum",
      "registernummer": "HRB 16077",
      "registerart": "HRB",
      "company_name": "Omari Trockenbau GmbH",
      "company_seat": "Bochum",
      "details": "05.03.2025 (Bekanntmachungsdatum)\n\nNordrhein-Westfalen Amtsgericht Bochum HRB 16077\nLöschungsankündigung\n\nOmari Trockenbau GmbH\nGesellschaft mit beschränkter Haftung\nBochum\n\nDas Registergericht beabsichtigt die Gesellschaft von Amts wegen nach § 394 FamFG zu löschen. Die Frist zur Erhebung eines Widerspruchs ist auf drei Monate festgesetzt."
    },
    {
      "date": "2025-03-05",
      "id": "102971",
      "original_text": "Löschungsankündigung\nNordrhein-Westfalen Amtsgericht Duisburg HRB 36051\nMeta Trading GmbH – Duisburg",
      "type": "Löschungsankündigung",
      "state": "Nordrhein-Westfalen",
      "amtsgericht": "Amtsgericht Duisburg",
      "registernummer": "HRB 36051",
      "registerart": "HRB",
      "company_name": "Meta Trading GmbH",
      "company_seat": "Duisburg",
      "details": "05.03.2025 (Bekanntmachungsdatum)\n\nNordrhein-Westfalen Amtsgericht Duisburg HRB 36051\nLöschungsankündigung\n\nMeta Trading GmbH\nGesellschaft mit beschränkter Haftung\nDuisburg\n\nDas Registergericht beabsichtigt, die im Handelsregister unter HRB 36051 eingetragene Gesellschaft Meta Trading GmbH gemäß § 394 FamFG wegen Vermögenslosigkeit von Amts wegen zu löschen. Gegen diese Verfügung kann Widerspruch eingelegt werden. Die Frist zur Erhebung eines Widerspruchs gegen die beabsichtigte Löschung von Amts wegen ist auf drei Monate festgesetzt. Rechtsbehelfsbelehrung Der Widerspruch ist bei dem Amtsgericht Duisburg, Kardinal-Galen-Str. 124-132, 47058 Duisburg schriftlich in deutscher Sprache oder zur Niederschrift der Geschäftsstelle einzulegen. Der Widerspruch kann auch zur Niederschrift der Geschäftsstelle eines jeden Amtsgerichtes abgegeben werden. Die Einlegung ist auch durch Übertragung eines elektronischen Dokuments an die elektronische Poststelle des Gerichts möglich. Das elektronische Dokument muss für die Bearbeitung durch das Gericht geeignet und mit einer qualifizierten elektronischen Signatur der verantwortenden Person versehen sein oder von der verantwortenden Person signiert und auf einem sicheren Übermittlungsweg gemäß § 130 a ZPO nach näherer Maßgabe der Verordnung über die technischen Rahmenbedingungen des elektronischen Rechtsverkehrs und über das besondere elektronische Behördenpostfach (BGBl. I, S. 3803) eingereicht werden. Weitere Informationen erhalten Sie auf der Internetseite www.justiz.de <http://www.justiz.de>. Der Widerspruch muss spätestens innerhalb der gesetzten Frist bei dem Amtsgericht Duisburg eingegangen sein. Dies gilt auch dann, wenn der Widerspruch zur Niederschrift der Geschäftsstelle eines anderen Amtsgerichtes abgegeben wurde. Die Frist beginnt mit der Veröffentlichung. Fällt das Ende der Frist auf einen Sonntag, einen allgemeinen Feiertag oder Sonnabend, so endet die Frist mit Ablauf des nächsten Werktages. Der Widerspruch muss die Bezeichnung der angefochtenen Verfügung sowie die Erklärung enthalten, dass Widerspruch gegen diese Verfügung eingelegt wird. Er ist zu unterzeichnen und soll begründet werden."
    },
    {
      "date": "2025-03-05",
      "id": "102972",
      "original_text": "Registerbekanntmachung nach dem Umwandlungsgesetz\nNordrhein-Westfalen Amtsgericht Bad Oeynhausen HRA 10539\nAndre Hilker e.K. – Rahden",
      "type": "Registerbekanntmachung nach dem Umwandlungsgesetz",
      "state": "Nordrhein-Westfalen",
      "amtsgericht": "Amtsgericht Bad Oeynhausen",
      "registernummer": "HRA 10539",
      "registerart": "HRA",
      "company_name": "Andre Hilker e.K.",
      "company_seat": "Rahden",
      "details": "05.03.2025 (Bekanntmachungsdatum)\n\nNordrhein-Westfalen Amtsgericht Bad Oeynhausen HRA 10539\nRegisterbekanntmachung nach dem Umwandlungsgesetz 05.03.2025 (Eintragungsdatum)\n\nAndre Hilker e.K.\nEinzelkaufmann / Einzelkauffrau\nRahden\n\nDen Gläubigern der an der formwechselnden Umwandlung beteiligten Rechtsträger ist, wenn sie binnen sechs Monaten nach dem Tag, an dem die Eintragung der formwechselnden Umwandlung in das Register des Sitzes desjenigen Rechtsträgers, dessen Gläubiger sie sind, nach § 19 Absatz 3 UmwG als bekanntgemacht gilt, ihren Anspruch nach Grund und Höhe schriftlich anmelden, Sicherheit zu leisten, soweit sie nicht Befriedigung verlangen können. Dieses Recht steht den Gläubigern jedoch nur zu, wenn sie glaubhaft machen, dass durch die formwechselnden Umwandlung die Erfüllung ihrer Forderung gefährdet wird."
    },
    {
      "date": "2025-03-05",
      "id": "102973",
      "original_text": "Sonstige Registerbekanntmachung\nNordrhein-Westfalen Amtsgericht Lemgo HRB 9974\nLippische Landesbrandversicherung Aktiengesellschaft – Detmold",
      "type": "Sonstige Registerbekanntmachung",
      "state": "Nordrhein-Westfalen",
      "amtsgericht": "Amtsgericht Lemgo",
      "registernummer": "HRB 9974",
      "registerart": "HRB",
      "company_name": "Lippische Landesbrandversicherung Aktiengesellschaft",
      "company_seat": "Detmold",
      "details": "05.03.2025 (Bekanntmachungsdatum)\n\nNordrhein-Westfalen Amtsgericht Lemgo HRB 9974\nSonstige Registerbekanntmachung\n\nLippische Landesbrandversicherung Aktiengesellschaft\nAktiengesellschaft\nDetmold\n\nDem Registergericht ist eine Liste der Mitglieder des Aufsichtsrates eingereicht worden."
    },
    {
      "date": "2025-03-05",
      "id": "102974",
      "original_text": "Löschungsankündigung\nNordrhein-Westfalen Amtsgericht Siegburg HRB 14718\nFive Star Gastronomie UG (haftungsbeschränkt) – Hennef",
      "type": "Löschungsankündigung",
      "state": "Nordrhein-Westfalen",
      "amtsgericht": "Amtsgericht Siegburg",
      "registernummer": "HRB 14718",
      "registerart": "HRB",
      "company_name": "Five Star Gastronomie UG (haftungsbeschränkt)",
      "company_seat": "Hennef",
      "details": "05.03.2025 (Bekanntmachungsdatum)\n\nNordrhein-Westfalen Amtsgericht Siegburg HRB 14718\nLöschungsankündigung\n\nFive Star Gastronomie UG (haftungsbeschränkt)\nGesellschaft mit beschränkter Haftung\nHennef\n\nDas Registergericht hat glaubhafte Kenntnis erlangt, dass die Gesellschaft vermögenslos geworden ist, da\nein Insolvenzverfahren wegen Masselosigkeit nach § 207 InsO eingestellt wurde.\n\nEs ist daher beabsichtigt, die Gesellschaft nach § 394 FamFG im Handelsregister wegen Vermögenslosigkeit zu löschen.\nEinwände gegen die Löschung sind durch Widerspruch binnen einer Frist von 3 Monaten geltend zu machen, andernfalls die Löschung erfolgen wird.\n\nEinzulegen ist der Widerspruch bei dem Amtsgericht Siegburg, Neue Poststraße 16, 53721 Siegburg, und zwar entweder schriftlich in deutscher Sprache oder mündlich zur Niederschrift der Geschäftsstelle. Der Widerspruch kann auch zur Niederschrift der Geschäftsstelle eines jeden Amtsgerichts abgegeben werden. Der Widerspruch ist binnen der in der Verfügung bestimmten Frist einzulegen. Die Frist ist nur gewahrt, wenn der Widerspruch rechtzeitig bei dem Amtsgericht Siegburg eingeht, auch wenn der Widerspruch zur Niederschrift der Geschäftsstelle eines anderen Amtsgerichts abgegeben wurde. Die Frist beginnt jeweils mit der schriftlichen Bekanntgabe der Verfügung an die Beteiligten. Kann die schriftliche Bekanntgabe an einen Beteiligten nicht bewirkt werden, beginnt die Frist spätestens mit Ablauf von fünf Monaten nach Erlass der Verfügung. Die Bekanntgabe ist entweder durch Zustellung oder am dritten Tage nach Aufgabe zur Post bewirkt. Sofern die Löschung noch nicht erfolgt ist, kann der Widerspruch auch noch nach Ablauf der Frist eingelegt werden. Fällt das Ende der Frist auf einen Sonnabend, einen Sonntag oder einen allgemeinen Feiertag, endet die Frist mit Ablauf des nächsten Werktages. Der Widerspruch ist zu unterzeichnen. Eine Begründung des Widerspruchs ist nicht vorgeschrieben."
    },
    {
      "date": "2025-03-05",
      "id": "102975",
      "original_text": "Registerbekanntmachung nach dem Umwandlungsgesetz\nNordrhein-Westfalen Amtsgericht Bad Oeynhausen HRB 17220\nAktiva Steuerberatungsgesellschaft mbH – Herford",
      "type": "Registerbekanntmachung nach dem Umwandlungsgesetz",
      "state": "Nordrhein-Westfalen",
      "amtsgericht": "Amtsgericht Bad Oeynhausen",
      "registernummer": "HRB 17220",
      "registerart": "HRB",
      "company_name": "Aktiva Steuerberatungsgesellschaft mbH",
      "company_seat": "Herford",
      "details": "05.03.2025 (Bekanntmachungsdatum)\n\nNordrhein-Westfalen Amtsgericht Bad Oeynhausen HRB 17220\nRegisterbekanntmachung nach dem Umwandlungsgesetz 05.03.2025 (Eintragungsdatum)\n\nAktiva Steuerberatungsgesellschaft mbH\nGesellschaft mit beschränkter Haftung\nHerford\n\nDen Gläubigern der an der Verschmelzung beteiligten Rechtsträger ist, wenn sie binnen sechs Monaten nach dem Tag, an dem die Eintragung der Verschmelzung in das Register des Sitzes desjenigen Rechtsträgers, dessen Gläubiger sie sind, nach § 19 Absatz 3 UmwG als bekanntgemacht gilt, ihren Anspruch nach Grund und Höhe schriftlich anmelden, Sicherheit zu leisten, soweit sie nicht Befriedigung verlangen können. Dieses Recht steht den Gläubigern jedoch nur zu, wenn sie glaubhaft machen, dass durch die Verschmelzung die Erfüllung ihrer Forderung gefährdet wird."
    },
    {
      "date": "2025-03-05",
      "id": "102976",
      "original_text": "Registerbekanntmachung nach dem Umwandlungsgesetz\nNordrhein-Westfalen Amtsgericht Hagen HRA 6591\nmarkom werbeagentur GmbH & Co. KG – Wetter",
      "type": "Registerbekanntmachung nach dem Umwandlungsgesetz",
      "state": "Nordrhein-Westfalen",
      "amtsgericht": "Amtsgericht Hagen",
      "registernummer": "HRA 6591",
      "registerart": "HRA",
      "company_name": "markom werbeagentur GmbH & Co. KG",
      "company_seat": "Wetter",
      "details": "05.03.2025 (Bekanntmachungsdatum)\n\nNordrhein-Westfalen Amtsgericht Hagen HRA 6591\nRegisterbekanntmachung nach dem Umwandlungsgesetz 05.03.2025 (Eintragungsdatum)\n\nmarkom werbeagentur GmbH & Co. KG\nKommanditgesellschaft\nWetter\n\nDen Gläubigern der an der Ausgliederung beteiligten Rechtsträger ist, wenn sie binnen sechs Monaten nach dem Tag, an dem die Eintragung der Ausgliederung in das Register des Sitzes derjenigen Rechtsträger deren Gläubiger sie sind, nach § 19 Absatz 3 UmwG als bekanntgemacht gilt, ihren Anspruch nach Grund und Höhe schriftlich anmelden, Sicherheit zu leisten, soweit sie nicht Befriedigung verlangen können. Dieses Recht steht den Gläubigern jedoch nur zu, wenn sie glaubhaft machen, dass durch die Ausgliederung die Erfüllung ihrer Forderung gefährdet wird."
    },
    {
      "date": "2025-03-05",
      "id": "102977",
      "original_text": "Löschungsankündigung\nNordrhein-Westfalen Amtsgericht Bonn HRB 21751\nGermaniaCare GmbH – Bonn",
      "type": "Löschungsankündigung",
      "state": "Nordrhein-Westfalen",
      "amtsgericht": "Amtsgericht Bonn",
      "registernummer": "HRB 21751",
      "registerart": "HRB",
      "company_name": "GermaniaCare GmbH",
      "company_seat": "Bonn",
      "details": "05.03.2025 (Bekanntmachungsdatum)\n\nNordrhein-Westfalen Amtsgericht Bonn HRB 21751\nLöschungsankündigung\n\nGermaniaCare GmbH\nGesellschaft mit beschränkter Haftung\nBonn\n\nDas Registergericht beabsichtigt die Gesellschaft von Amts wegen nach § 394 FamFG zu löschen. Die Frist zur Erhebung eines Widerspruchs ist auf einen Monat festgesetzt."
    },
    {
      "date": "2025-03-05",
      "id": "102978",
      "original_text": "Registerbekanntmachung nach dem Umwandlungsgesetz\nNordrhein-Westfalen Amtsgericht Köln HRB 20755\nHergarten GmbH – Köln",
      "type": "Registerbekanntmachung nach dem Umwandlungsgesetz",
      "state": "Nordrhein-Westfalen",
      "amtsgericht": "Amtsgericht Köln",
      "registernummer": "HRB 20755",
      "registerart": "HRB",
      "company_name": "Hergarten GmbH",
      "company_seat": "Köln",
      "details": "05.03.2025 (Bekanntmachungsdatum)\n\nNordrhein-Westfalen Amtsgericht Köln HRB 20755\nRegisterbekanntmachung nach dem Umwandlungsgesetz 05.03.2025 (Eintragungsdatum)\n\nHergarten GmbH\nGesellschaft mit beschränkter Haftung\nKöln\n\nDen Gläubigern der an der Verschmelzung beteiligten Rechtsträger ist, wenn sie binnen sechs Monaten nach dem Tag, an dem die Eintragung der Verschmelzung in das Register des Sitzes desjenigen Rechtsträgers, dessen Gläubiger sie sind, nach § 19 Absatz 3 UmwG als bekanntgemacht gilt, ihren Anspruch nach Grund und Höhe schriftlich anmelden, Sicherheit zu leisten, soweit sie nicht Befriedigung verlangen können. Dieses Recht steht den Gläubigern jedoch nur zu, wenn sie glaubhaft machen, dass durch die Verschmelzung die Erfüllung ihrer Forderung gefährdet wird."
    },
    {
      "date": "2025-03-05",
      "id": "102979",
      "original_text": "Löschungsankündigung\nNordrhein-Westfalen Amtsgericht Wuppertal HRB 7757\nHellmuth + Rohr GmbH Industrieelektronik – Wuppertal",
      "type": "Löschungsankündigung",
      "state": "Nordrhein-Westfalen",
      "amtsgericht": "Amtsgericht Wuppertal",
      "registernummer": "HRB 7757",
      "registerart": "HRB",
      "company_name": "Hellmuth + Rohr GmbH Industrieelektronik",
      "company_seat": "Wuppertal",
      "details": "05.03.2025 (Bekanntmachungsdatum)\n\nNordrhein-Westfalen Amtsgericht Wuppertal HRB 7757\nLöschungsankündigung\n\nHellmuth + Rohr GmbH Industrieelektronik\nGesellschaft mit beschränkter Haftung\nWuppertal\n\nDas Registergericht beabsichtigt die Gesellschaft von Amts wegen nach § 394 FamFG zu löschen. Die Frist zur Erhebung eines Widerspruchs ist auf einen Monat festgesetzt."
    },
    {
      "date": "2025-03-05",
      "id": "102980",
      "original_text": "Löschungsankündigung\nNordrhein-Westfalen Amtsgericht Düsseldorf HRB 102285\nIFA Rhein Ruhr Services UG (haftungsbeschränkt) – Monheim am Rhein",
      "type": "Löschungsankündigung",
      "state": "Nordrhein-Westfalen",
      "amtsgericht": "Amtsgericht Düsseldorf",
      "registernummer": "HRB 102285",
      "registerart": "HRB",
      "company_name": "IFA Rhein Ruhr Services UG (haftungsbeschränkt)",
      "company_seat": "Monheim am Rhein",
      "details": "05.03.2025 (Bekanntmachungsdatum)\n\nNordrhein-Westfalen Amtsgericht Düsseldorf HRB 102285\nLöschungsankündigung\n\nIFA Rhein Ruhr Services UG (haftungsbeschränkt)\nGesellschaft mit beschränkter Haftung\nMonheim am Rhein\n\nDas Registergericht beabsichtigt die Gesellschaft von Amts wegen nach § 394 FamFG zu löschen. Die Frist zur Erhebung eines Widerspruchs ist auf 3 Wochen festgesetzt.\n\nRechtsbehelfsbelehrung:\nDas Widerspruchsrecht steht jedem zu, der an der Unterlassung der Löschung ein berechtigtes Interesse hat. Der Widerspruch ist bei dem Amtsgericht Düsseldorf -Registergericht-, Werdener Straße 1, 40227 Düsseldorf schriftlich in deutscher Sprache oder zur Niederschrift der Geschäftsstelle einzulegen. Der Widerspruch kann auch zur Niederschrift der Geschäftsstelle eines jeden Amtsgerichtes abgegeben werden. Die Einlegung ist auch durch Übertragung eines elektronischen Dokuments an die elektronische Poststelle des Gerichts möglich. Das elektronische Dokument muss für die Bearbeitung durch das Gericht geeignet und mit einer qualifizierten elektronischen Signatur der verantwortenden Person versehen sein oder von der verantwortenden Person signiert und auf einem sicheren Übermittlungsweg gemäß § 130a ZPO nach näherer Maßgabe der Verordnung über die technischen Rahmenbedingungen des elektronischen Rechtsverkehrs und über das besondere elektronische Behördenpostfach (BGBl. I, S.3803) eingereicht werden. Weitere Informationen erhalten Sie auf der Internetseite www.justiz.de.\nDer Widerspruch muss spätestens innerhalb der gesetzten Frist nach dem Datum der Bekanntmachung der Löschungsankündigung bei dem Amtsgericht - Registergericht - Düsseldorf eingegangen sein.  Dies gilt auch dann, wenn der Widerspruch zur Niederschrift der Geschäftsstelle eines anderen Amtsgerichtes abgegeben wurde. Die Frist beginnt mit dem Tage der Bekanntmachung der Löschungsankündigung in dem für die Bekanntmachung der Eintragungen in das Handelsregister bestimmten elektronischen Informations- und Kommunikationssystem nach § 10 des Handelsgesetzbuches. Fällt das Ende der Frist auf einen Sonntag, einen allgemeinen Feiertag oder Sonnabend, so endet die Frist mit Ablauf des nächsten Werktages.\nDer Widerspruch muss die Bezeichnung der angefochtenen Löschungsankündigung sowie die Erklärung enthalten, dass Widerspruch gegen diese Löschungsankündigung eingelegt wird. Er ist zu unterzeichnen und soll begründet werden."
    },
    {
      "date": "2025-03-05",
      "id": "102981",
      "original_text": "Löschungsankündigung\nNordrhein-Westfalen Amtsgericht Düsseldorf HRB 80168\nThe Allen Groupe GmbH – Düsseldorf",
      "type": "Löschungsankündigung",
      "state": "Nordrhein-Westfalen",
      "amtsgericht": "Amtsgericht Düsseldorf",
      "registernummer": "HRB 80168",
      "registerart": "HRB",
      "company_name": "The Allen Groupe GmbH",
      "company_seat": "Düsseldorf",
      "details": "05.03.2025 (Bekanntmachungsdatum)\n\nNordrhein-Westfalen Amtsgericht Düsseldorf HRB 80168\nLöschungsankündigung\n\nThe Allen Groupe GmbH\nGesellschaft mit beschränkter Haftung\nDüsseldorf\n\nDas Registergericht beabsichtigt die Gesellschaft von Amts wegen nach § 394 FamFG zu löschen. Die Frist zur Erhebung eines Widerspruchs ist auf 3 Wochen festgesetzt.\n\nRechtsbehelfsbelehrung:\nDas Widerspruchsrecht steht jedem zu, der an der Unterlassung der Löschung ein berechtigtes Interesse hat. Der Widerspruch ist bei dem Amtsgericht Düsseldorf -Registergericht-, Werdener Straße 1, 40227 Düsseldorf schriftlich in deutscher Sprache oder zur Niederschrift der Geschäftsstelle einzulegen. Der Widerspruch kann auch zur Niederschrift der Geschäftsstelle eines jeden Amtsgerichtes abgegeben werden. Die Einlegung ist auch durch Übertragung eines elektronischen Dokuments an die elektronische Poststelle des Gerichts möglich. Das elektronische Dokument muss für die Bearbeitung durch das Gericht geeignet und mit einer qualifizierten elektronischen Signatur der verantwortenden Person versehen sein oder von der verantwortenden Person signiert und auf einem sicheren Übermittlungsweg gemäß § 130a ZPO nach näherer Maßgabe der Verordnung über die technischen Rahmenbedingungen des elektronischen Rechtsverkehrs und über das besondere elektronische Behördenpostfach (BGBl. I, S.3803) eingereicht werden. Weitere Informationen erhalten Sie auf der Internetseite www.justiz.de.\nDer Widerspruch muss spätestens innerhalb der gesetzten Frist nach dem Datum der Bekanntmachung der Löschungsankündigung bei dem Amtsgericht - Registergericht - Düsseldorf eingegangen sein.  Dies gilt auch dann, wenn der Widerspruch zur Niederschrift der Geschäftsstelle eines anderen Amtsgerichtes abgegeben wurde. Die Frist beginnt mit dem Tage der Bekanntmachung der Löschungsankündigung in dem für die Bekanntmachung der Eintragungen in das Handelsregister bestimmten elektronischen Informations- und Kommunikationssystem nach § 10 des Handelsgesetzbuches. Fällt das Ende der Frist auf einen Sonntag, einen allgemeinen Feiertag oder Sonnabend, so endet die Frist mit Ablauf des nächsten Werktages.\nDer Widerspruch muss die Bezeichnung der angefochtenen Löschungsankündigung sowie die Erklärung enthalten, dass Widerspruch gegen diese Löschungsankündigung eingelegt wird. Er ist zu unterzeichnen und soll begründet werden."
    },
    {
      "date": "2025-03-05",
      "id": "102982",
      "original_text": "Registerbekanntmachung nach dem Umwandlungsgesetz\nNordrhein-Westfalen Amtsgericht Düsseldorf HRB 59639\nbeauty & nature Erlangen GmbH – Hilden",
      "type": "Registerbekanntmachung nach dem Umwandlungsgesetz",
      "state": "Nordrhein-Westfalen",
      "amtsgericht": "Amtsgericht Düsseldorf",
      "registernummer": "HRB 59639",
      "registerart": "HRB",
      "company_name": "beauty & nature Erlangen GmbH",
      "company_seat": "Hilden",
      "details": "05.03.2025 (Bekanntmachungsdatum)\n\nNordrhein-Westfalen Amtsgericht Düsseldorf HRB 59639\nRegisterbekanntmachung nach dem Umwandlungsgesetz 05.03.2025 (Eintragungsdatum)\n\nbeauty & nature Erlangen GmbH\nGesellschaft mit beschränkter Haftung\nHilden\n\nDen Gläubigern der an der Verschmelzung beteiligten Rechtsträger ist, wenn sie binnen sechs Monaten nach dem Tag, an dem die Eintragung der Verschmelzung in das Register des Sitzes desjenigen Rechtsträgers, dessen Gläubiger sie sind, nach § 19 Absatz 3 UmwG als bekanntgemacht gilt, ihren Anspruch nach Grund und Höhe schriftlich anmelden, Sicherheit zu leisten, soweit sie nicht Befriedigung verlangen können. Dieses Recht steht den Gläubigern jedoch nur zu, wenn sie glaubhaft machen, dass durch die Verschmelzung die Erfüllung ihrer Forderung gefährdet wird."
    },
    {
      "date": "2025-03-05",
      "id": "102983",
      "original_text": "Einreichung neuer Dokumente\nNordrhein-Westfalen Amtsgericht Bad Oeynhausen HRB 15322\nDR. WOELKE AG Wirtschaftsprüfungsgesellschaft – Herford",
      "type": "Einreichung neuer Dokumente",
      "state": "Nordrhein-Westfalen",
      "amtsgericht": "Amtsgericht Bad Oeynhausen",
      "registernummer": "HRB 15322",
      "registerart": "HRB",
      "company_name": "DR. WOELKE AG Wirtschaftsprüfungsgesellschaft",
      "company_seat": "Herford",
      "details": "05.03.2025 (Bekanntmachungsdatum)\n\nNordrhein-Westfalen Amtsgericht Bad Oeynhausen HRB 15322\nEinreichung neuer Dokumente\n\nDR. WOELKE AG Wirtschaftsprüfungsgesellschaft\nAktiengesellschaft\nHerford\n\nDem Registergericht ist eine neue Liste der Mitglieder des Aufsichtsrates eingereicht worden."
    },
    {
      "date": "2025-03-05",
      "id": "102984",
      "original_text": "Sonstige Registerbekanntmachung\nNordrhein-Westfalen Amtsgericht Köln HRB 35879\nHayuno AG – Köln",
      "type": "Sonstige Registerbekanntmachung",
      "state": "Nordrhein-Westfalen",
      "amtsgericht": "Amtsgericht Köln",
      "registernummer": "HRB 35879",
      "registerart": "HRB",
      "company_name": "Hayuno AG",
      "company_seat": "Köln",
      "details": "05.03.2025 (Bekanntmachungsdatum)\n\nNordrhein-Westfalen Amtsgericht Köln HRB 35879\nSonstige Registerbekanntmachung\n\nHayuno AG\nAktiengesellschaft\nKöln\n\nDem Registergericht ist eine Liste der Mitglieder des Aufsichtsrates eingereicht worden."
    },
    {
      "date": "2025-03-05",
      "id": "102985",
      "original_text": "Registerbekanntmachung nach dem Umwandlungsgesetz\nNordrhein-Westfalen Amtsgericht Siegen VR 1276\nReit- und Fahrverein Kindelsberg e.V. – Kreuztal",
      "type": "Registerbekanntmachung nach dem Umwandlungsgesetz",
      "state": "Nordrhein-Westfalen",
      "amtsgericht": "Amtsgericht Siegen",
      "registernummer": "VR 1276",
      "registerart": "VR",
      "company_name": "Reit- und Fahrverein Kindelsberg e.V.",
      "company_seat": "Kreuztal",
      "details": "05.03.2025 (Bekanntmachungsdatum)\n\nNordrhein-Westfalen Amtsgericht Siegen VR 1276\nRegisterbekanntmachung nach dem Umwandlungsgesetz 05.03.2025 (Eintragungsdatum)\n\nReit- und Fahrverein Kindelsberg  e.V.\neingetragener Verein\nKreuztal\n\nDen Gläubigern der an der Ausgliederung beteiligten Rechtsträger ist, wenn sie binnen sechs Monaten nach dem Tag, an dem die Eintragung der Ausgliederung in das Register des Sitzes desjenigen Rechtsträgers, dessen Gläubiger sie sind, nach § 19 Absatz 3 UmwG als bekanntgemacht gilt, ihren Anspruch nach Grund und Höhe schriftlich anmelden, Sicherheit zu leisten, soweit sie nicht Befriedigung verlangen können. Dieses Recht steht den Gläubigern jedoch nur zu, wenn sie glaubhaft machen, dass durch die Ausgliederung die Erfüllung ihrer Forderung gefährdet wird."
    },
    {
      "date": "2025-03-05",
      "id": "102986",
      "original_text": "Registerbekanntmachung nach dem Umwandlungsgesetz\nNordrhein-Westfalen Amtsgericht Köln HRB 46046\nAVS Verkehrssicherung GmbH – Leverkusen",
      "type": "Registerbekanntmachung nach dem Umwandlungsgesetz",
      "state": "Nordrhein-Westfalen",
      "amtsgericht": "Amtsgericht Köln",
      "registernummer": "HRB 46046",
      "registerart": "HRB",
      "company_name": "AVS Verkehrssicherung GmbH",
      "company_seat": "Leverkusen",
      "details": "05.03.2025 (Bekanntmachungsdatum)\n\nNordrhein-Westfalen Amtsgericht Köln HRB 46046\nRegisterbekanntmachung nach dem Umwandlungsgesetz 05.03.2025 (Eintragungsdatum)\n\nAVS Verkehrssicherung GmbH\nGesellschaft mit beschränkter Haftung\nLeverkusen\n\nDen Gläubigern der an der Verschmelzung beteiligten Rechtsträger ist, wenn sie binnen sechs Monaten nach dem Tag, an dem die Eintragung der Verschmelzung in das Register des Sitzes derjenigen Rechtsträger deren Gläubiger sie sind, nach § 19 Absatz 3 UmwG als bekanntgemacht gilt, ihren Anspruch nach Grund und Höhe schriftlich anmelden, Sicherheit zu leisten, soweit sie nicht Befriedigung verlangen können. Dieses Recht steht den Gläubigern jedoch nur zu, wenn sie glaubhaft machen, dass durch die Verschmelzung die Erfüllung ihrer Forderung gefährdet wird."
    },
    {
      "date": "2025-03-05",
      "id": "102987",
      "original_text": "Sonstige Registerbekanntmachung\nNordrhein-Westfalen Amtsgericht Düsseldorf HRB 33527\nS DirektVersicherung Aktiengesellschaft – Düsseldorf",
      "type": "Sonstige Registerbekanntmachung",
      "state": "Nordrhein-Westfalen",
      "amtsgericht": "Amtsgericht Düsseldorf",
      "registernummer": "HRB 33527",
      "registerart": "HRB",
      "company_name": "S DirektVersicherung Aktiengesellschaft",
      "company_seat": "Düsseldorf",
      "details": "05.03.2025 (Bekanntmachungsdatum)\n\nNordrhein-Westfalen Amtsgericht Düsseldorf HRB 33527\nSonstige Registerbekanntmachung\n\nS DirektVersicherung Aktiengesellschaft\nAktiengesellschaft\nDüsseldorf\n\nDem Registergericht ist eine Liste der Mitglieder des Aufsichtsrates eingereicht worden."
    },
    {
      "date": "2025-03-05",
      "id": "102988",
      "original_text": "Löschungsankündigung\nNordrhein-Westfalen Amtsgericht Köln HRB 115096\nSmart Facility & Solutions GmbH – Köln",
      "type": "Löschungsankündigung",
      "state": "Nordrhein-Westfalen",
      "amtsgericht": "Amtsgericht Köln",
      "registernummer": "HRB 115096",
      "registerart": "HRB",
      "company_name": "Smart Facility & Solutions GmbH",
      "company_seat": "Köln",
      "details": "05.03.2025 (Bekanntmachungsdatum)\n\nNordrhein-Westfalen Amtsgericht Köln HRB 115096\nLöschungsankündigung\n\nSmart Facility & Solutions GmbH\nGesellschaft mit beschränkter Haftung\nKöln\n\nDas Registergericht beabsichtigt die Gesellschaft von Amts wegen nach § 394 FamFG zu löschen. Die Frist zur Erhebung eines Widerspruchs ist auf einen Monat festgesetzt."
    },
    {
      "date": "2025-03-05",
      "id": "102989",
      "original_text": "Registerbekanntmachung nach dem Umwandlungsgesetz\nNordrhein-Westfalen Amtsgericht Bad Oeynhausen HRB 20140\nHilker R+W Energiepark GmbH – Rahden",
      "type": "Registerbekanntmachung nach dem Umwandlungsgesetz",
      "state": "Nordrhein-Westfalen",
      "amtsgericht": "Amtsgericht Bad Oeynhausen",
      "registernummer": "HRB 20140",
      "registerart": "HRB",
      "company_name": "Hilker R+W Energiepark GmbH",
      "company_seat": "Rahden",
      "details": "05.03.2025 (Bekanntmachungsdatum)\n\nNordrhein-Westfalen Amtsgericht Bad Oeynhausen HRB 20140\nRegisterbekanntmachung nach dem Umwandlungsgesetz 05.03.2025 (Eintragungsdatum)\n\nHilker R+W Energiepark GmbH\nGesellschaft mit beschränkter Haftung\nRahden\n\nDen Gläubigern der an der formwechselnden Umwandlung beteiligten Rechtsträger ist, wenn sie binnen sechs Monaten nach dem Tag, an dem die Eintragung der formwechselnden Umwandlung in das Register des Sitzes desjenigen Rechtsträgers, dessen Gläubiger sie sind, nach § 19 Absatz 3 UmwG als bekanntgemacht gilt, ihren Anspruch nach Grund und Höhe schriftlich anmelden, Sicherheit zu leisten, soweit sie nicht Befriedigung verlangen können. Dieses Recht steht den Gläubigern jedoch nur zu, wenn sie glaubhaft machen, dass durch die formwechselnden Umwandlung die Erfüllung ihrer Forderung gefährdet wird."
    },
    {
      "date": "2025-03-05",
      "id": "102990",
      "original_text": "Registerbekanntmachung nach dem Umwandlungsgesetz\nNordrhein-Westfalen Amtsgericht Siegen VR 5682 früher Amtsgericht Olpe\nVoltigierfreunde \"Süd-Sauerland\" e.V. – Wenden-Elben",
      "type": "Registerbekanntmachung nach dem Umwandlungsgesetz",
      "state": "Nordrhein-Westfalen",
      "amtsgericht": "Amtsgericht Siegen",
      "registernummer": "VR 5682",
      "registerart": "VR",
      "company_name": "Voltigierfreunde \"Süd-Sauerland\" e.V.",
      "company_seat": "Wenden-Elben",
      "former_amtsgericht": "Olpe",
      "details": "05.03.2025 (Bekanntmachungsdatum)\n\nNordrhein-Westfalen Amtsgericht Siegen VR 5682 früher Amtsgericht Olpe\nRegisterbekanntmachung nach dem Umwandlungsgesetz 05.03.2025 (Eintragungsdatum)\n\nVoltigierfreunde \"Süd-Sauerland\" e.V.\neingetragener Verein\nWenden-Elben\n\nDen Gläubigern der an der Ausgliederung beteiligten Rechtsträger ist, wenn sie binnen sechs Monaten nach dem Tag, an dem die Eintragung der Ausgliederung in das Register des Sitzes desjenigen Rechtsträgers, dessen Gläubiger sie sind, nach § 19 Absatz 3 UmwG als bekanntgemacht gilt, ihren Anspruch nach Grund und Höhe schriftlich anmelden, Sicherheit zu leisten, soweit sie nicht Befriedigung verlangen können. Dieses Recht steht den Gläubigern jedoch nur zu, wenn sie glaubhaft machen, dass durch die Ausgliederung die Erfüllung ihrer Forderung gefährdet wird."
    },
    {
      "date": "2025-03-05",
      "id": "102991",
      "original_text": "Löschungsankündigung\nNordrhein-Westfalen Amtsgericht Duisburg VR 41579\nASV-Kampffisch 03 – Oberhausen",
      "type": "Löschungsankündigung",
      "state": "Nordrhein-Westfalen",
      "amtsgericht": "Amtsgericht Duisburg",
      "registernummer": "VR 41579",
      "registerart": "VR",
      "company_name": "ASV-Kampffisch 03",
      "company_seat": "Oberhausen",
      "details": "05.03.2025 (Bekanntmachungsdatum)\n\nNordrhein-Westfalen Amtsgericht Duisburg VR 41579\nLöschungsankündigung\n\nASV-Kampffisch 03\neingetragener Verein\nOberhausen\n\nDas Registergericht beabsichtigt, den Verein wegen Fortfalls sämtlicher Mitglieder zu löschen (§ 4 VRV). Es besteht Gelegenheit binnen einer Frist von einem Monat gegen die Löschung des Vereins Einwendungen zu erheben. Nach Ablauf der Frist erfolgt die Löschung des Vereins von Amts wegen."
    },
    {
      "date": "2025-03-05",
      "id": "102992",
      "original_text": "Löschungsankündigung\nNordrhein-Westfalen Amtsgericht Düsseldorf HRB 94158\nM.E.N. Real Estate GmbH – Ratingen",
      "type": "Löschungsankündigung",
      "state": "Nordrhein-Westfalen",
      "amtsgericht": "Amtsgericht Düsseldorf",
      "registernummer": "HRB 94158",
      "registerart": "HRB",
      "company_name": "M.E.N. Real Estate GmbH",
      "company_seat": "Ratingen",
      "details": "05.03.2025 (Bekanntmachungsdatum)\n\nNordrhein-Westfalen Amtsgericht Düsseldorf HRB 94158\nLöschungsankündigung\n\nM.E.N. Real Estate GmbH\nGesellschaft mit beschränkter Haftung\nRatingen\n\nDas Registergericht beabsichtigt die Gesellschaft von Amts wegen nach § 394 FamFG zu löschen. Die Frist zur Erhebung eines Widerspruchs ist auf 3 Wochen festgesetzt.\n\nRechtsbehelfsbelehrung:\nDas Widerspruchsrecht steht jedem zu, der an der Unterlassung der Löschung ein berechtigtes Interesse hat. Der Widerspruch ist bei dem Amtsgericht Düsseldorf -Registergericht-, Werdener Straße 1, 40227 Düsseldorf schriftlich in deutscher Sprache oder zur Niederschrift der Geschäftsstelle einzulegen. Der Widerspruch kann auch zur Niederschrift der Geschäftsstelle eines jeden Amtsgerichtes abgegeben werden. Die Einlegung ist auch durch Übertragung eines elektronischen Dokuments an die elektronische Poststelle des Gerichts möglich. Das elektronische Dokument muss für die Bearbeitung durch das Gericht geeignet und mit einer qualifizierten elektronischen Signatur der verantwortenden Person versehen sein oder von der verantwortenden Person signiert und auf einem sicheren Übermittlungsweg gemäß § 130a ZPO nach näherer Maßgabe der Verordnung über die technischen Rahmenbedingungen des elektronischen Rechtsverkehrs und über das besondere elektronische Behördenpostfach (BGBl. I, S.3803) eingereicht werden. Weitere Informationen erhalten Sie auf der Internetseite www.justiz.de.\nDer Widerspruch muss spätestens innerhalb der gesetzten Frist nach dem Datum der Bekanntmachung der Löschungsankündigung bei dem Amtsgericht - Registergericht - Düsseldorf eingegangen sein.  Dies gilt auch dann, wenn der Widerspruch zur Niederschrift der Geschäftsstelle eines anderen Amtsgerichtes abgegeben wurde. Die Frist beginnt mit dem Tage der Bekanntmachung der Löschungsankündigung in dem für die Bekanntmachung der Eintragungen in das Handelsregister bestimmten elektronischen Informations- und Kommunikationssystem nach § 10 des Handelsgesetzbuches. Fällt das Ende der Frist auf einen Sonntag, einen allgemeinen Feiertag oder Sonnabend, so endet die Frist mit Ablauf des nächsten Werktages.\nDer Widerspruch muss die Bezeichnung der angefochtenen Löschungsankündigung sowie die Erklärung enthalten, dass Widerspruch gegen diese Löschungsankündigung eingelegt wird. Er ist zu unterzeichnen und soll begründet werden."
    },
    {
      "date": "2025-03-05",
      "id": "102993",
      "original_text": "Registerbekanntmachung nach dem Umwandlungsgesetz\nNordrhein-Westfalen Amtsgericht Hagen HRA 5470\nMarkom Digitalagentur e.K. – Wetter",
      "type": "Registerbekanntmachung nach dem Umwandlungsgesetz",
      "state": "Nordrhein-Westfalen",
      "amtsgericht": "Amtsgericht Hagen",
      "registernummer": "HRA 5470",
      "registerart": "HRA",
      "company_name": "Markom Digitalagentur e.K.",
      "company_seat": "Wetter",
      "details": "05.03.2025 (Bekanntmachungsdatum)\n\nNordrhein-Westfalen Amtsgericht Hagen HRA 5470\nRegisterbekanntmachung nach dem Umwandlungsgesetz 05.03.2025 (Eintragungsdatum)\n\nMarkom Digitalagentur e.K.\nEinzelkaufmann / Einzelkauffrau\nWetter\n\nDen Gläubigern der an der Ausgliederung beteiligten Rechtsträger ist, wenn sie binnen sechs Monaten nach dem Tag, an dem die Eintragung der Ausgliederung in das Register des Sitzes derjenigen Rechtsträger deren Gläubiger sie sind, nach § 19 Absatz 3 UmwG als bekanntgemacht gilt, ihren Anspruch nach Grund und Höhe schriftlich anmelden, Sicherheit zu leisten, soweit sie nicht Befriedigung verlangen können. Dieses Recht steht den Gläubigern jedoch nur zu, wenn sie glaubhaft machen, dass durch die Ausgliederung die Erfüllung ihrer Forderung gefährdet wird."
    },
    {
      "date": "2025-03-05",
      "id": "102994",
      "original_text": "Registerbekanntmachung nach dem Umwandlungsgesetz\nBaden-Württemberg Amtsgericht Stuttgart HRB 210181\nSchrott- und Metallhandel M. Kaatsch GmbH – Plochingen",
      "type": "Registerbekanntmachung nach dem Umwandlungsgesetz",
      "state": "Baden-Württemberg",
      "amtsgericht": "Amtsgericht Stuttgart",
      "registernummer": "HRB 210181",
      "registerart": "HRB",
      "company_name": "Schrott- und Metallhandel M. Kaatsch GmbH",
      "company_seat": "Plochingen",
      "details": "05.03.2025 (Bekanntmachungsdatum)\n\nBaden-Württemberg Amtsgericht Stuttgart HRB 210181\nRegisterbekanntmachung nach dem Umwandlungsgesetz 05.03.2025 (Eintragungsdatum)\n\nSchrott- und Metallhandel M. Kaatsch GmbH\nGesellschaft mit beschränkter Haftung\nPlochingen\n\nAls nicht eingetragen wird bekanntgemacht:\nDen Gläubigern der an der Verschmelzung beteiligten Rechtsträger ist, wenn sie binnen sechs Monaten nach dem Tag, an dem die Eintragung der Verschmelzung in das Register des Sitzes desjenigen Rechtsträgers, dessen Gläubiger sie sind, nach § 19 Abs. 3 UmwG als bekanntgemacht gilt, ihren Anspruch nach Grund und Höhe schriftlich anmelden, Sicherheit zu leisten, soweit sie nicht Befriedigung verlangen können. Dieses Recht steht den Gläubigern jedoch nur zu, wenn sie glaubhaft machen, dass durch die Verschmelzung die Erfüllung ihrer Forderung gefährdet wird."
    },
    {
      "date": "2025-03-05",
      "id": "102995",
      "original_text": "Löschungsankündigung\nHessen Amtsgericht Offenbach am Main HRB 55537\nT.G. Werbungen. Verwaltung. Marketing UG (haftungsbeschränkt) – Offenbach am Main",
      "type": "Löschungsankündigung",
      "state": "Hessen",
      "amtsgericht": "Amtsgericht Offenbach am Main",
      "registernummer": "HRB 55537",
      "registerart": "HRB",
      "company_name": "T.G. Werbungen. Verwaltung. Marketing UG (haftungsbeschränkt)",
      "company_seat": "Offenbach am Main",
      "details": "05.03.2025 (Bekanntmachungsdatum)\n\nHessen Amtsgericht Offenbach am Main HRB 55537\nLöschungsankündigung\n\nT.G. Werbungen. Verwaltung. Marketing UG (haftungsbeschränkt)\nGesellschaft mit beschränkter Haftung\nOffenbach am Main\n\nDas Registergericht beabsichtigt die im Handelsregister eingetragene Gesellschaft von Amts wegen nach § 394 FamFG zu löschen. Die Frist zur Erhebung eines Widerspruchs gegen die beabsichtigte Löschung wird auf 3 Monate festgesetzt"
    },
    {
      "date": "2025-03-05",
      "id": "102996",
      "original_text": "Registerbekanntmachung nach dem Umwandlungsgesetz\nHessen Amtsgericht Frankfurt am Main HRB 103081\nTEK TO NIK Architekten Realisierungsmanagement GmbH – Frankfurt am Main",
      "type": "Registerbekanntmachung nach dem Umwandlungsgesetz",
      "state": "Hessen",
      "amtsgericht": "Amtsgericht Frankfurt am Main",
      "registernummer": "HRB 103081",
      "registerart": "HRB",
      "company_name": "TEK TO NIK Architekten Realisierungsmanagement GmbH",
      "company_seat": "Frankfurt am Main",
      "details": "05.03.2025 (Bekanntmachungsdatum)\n\nHessen Amtsgericht Frankfurt am Main HRB 103081\nRegisterbekanntmachung nach dem Umwandlungsgesetz 05.03.2025 (Eintragungsdatum)\n\nTEK TO NIK Architekten Realisierungsmanagement GmbH\nGesellschaft mit beschränkter Haftung\nFrankfurt am Main\n\nDem Registergericht ist ein Verschmelzungsplan über die geplante grenzüberschreitende Verschmelzung der TEK TO NIK Architekten Realisierungsmanagement GmbH mit Sitz in Frankfurt am Main (Gesellschaft mit beschränkter Haftung, eingetragen beim Amtsgericht Frankfurt am Main unter der HRB  103081) als übertragender Rechtsträger mit der TEK TO NIK Architekten und Generalplaner GmbH mit Sitz in Frankfurt am Main (GmbH, eingetragen beim HRB 103081) als übernehmender Rechtsträger eingereicht worden.\nDen Gläubigern der übertragenden Gesellschaft ist Sicherheit zu leisten, wenn sie innerhalb einer Frist von zwei Monaten nach Bekanntmachung des Verschmelzungsplans glaubhaft machen, dass durch die Verschmelzung die Erfüllung ihrer Forderung gefährdet wird. Die Anteilseigner der übertragenden Gesellschaft haben bei grenzüberschreitenden Verschmelzungen einen Anspruch auf angemessene Abfindung, sofern sie der Verschmelzung widersprochen haben; gegebenenfalls steht ihnen auch ein Anspruch auf bare Zuzahlung zu."
    },
    {
      "date": "2025-03-05",
      "id": "102997",
      "original_text": "Sonstige Registerbekanntmachung\nHessen Amtsgericht Limburg VR 2389\nClub kreativer Hände – Runkel",
      "type": "Sonstige Registerbekanntmachung",
      "state": "Hessen",
      "amtsgericht": "Amtsgericht Limburg",
      "registernummer": "VR 2389",
      "registerart": "VR",
      "company_name": "Club kreativer Hände",
      "company_seat": "Runkel",
      "details": "05.03.2025 (Bekanntmachungsdatum)\n\nHessen Amtsgericht Limburg VR 2389\nSonstige Registerbekanntmachung 05.03.2025 (Eintragungsdatum)\n\nClub kreativer Hände\neingetragener Verein\nRunkel\n\nDer Verein ist aufgelöst."
    },
    {
      "date": "2025-03-05",
      "id": "102998",
      "original_text": "Einreichung neuer Dokumente\nHessen Amtsgericht Offenbach am Main HRB 8610\nOffenbacher Verkehrs-Betriebe GmbH – Offenbach am Main",
      "type": "Einreichung neuer Dokumente",
      "state": "Hessen",
      "amtsgericht": "Amtsgericht Offenbach am Main",
      "registernummer": "HRB 8610",
      "registerart": "HRB",
      "company_name": "Offenbacher Verkehrs-Betriebe GmbH",
      "company_seat": "Offenbach am Main",
      "details": "05.03.2025 (Bekanntmachungsdatum)\n\nHessen Amtsgericht Offenbach am Main HRB 8610\nEinreichung neuer Dokumente 05.03.2025 (Eintragungsdatum)\n\nOffenbacher Verkehrs-Betriebe GmbH\nGesellschaft mit beschränkter Haftung\nOffenbach am Main\n\nDurch eine Änderung in den Personen der Aufsichtsratsmitglieder ist eine Liste der Mitglieder des Aufsichtsrates zum Handelsregister eingereicht worden."
    },
    {
      "date": "2025-03-05",
      "id": "102999",
      "original_text": "Sonstige Registerbekanntmachung\nHessen Amtsgericht Wiesbaden VR 5759\nGesangverein \"Frohsinn\" Rauenthal 1908 e. V. – Eltville am Rhein-Rauenthal",
      "type": "Sonstige Registerbekanntmachung",
      "state": "Hessen",
      "amtsgericht": "Amtsgericht Wiesbaden",
      "registernummer": "VR 5759",
      "registerart": "VR",
      "company_name": "Gesangverein \"Frohsinn\" Rauenthal 1908 e. V.",
      "company_seat": "Eltville am Rhein-Rauenthal",
      "details": "05.03.2025 (Bekanntmachungsdatum)\n\nHessen Amtsgericht Wiesbaden VR 5759\nSonstige Registerbekanntmachung 05.03.2025 (Eintragungsdatum)\n\nGesangverein \"Frohsinn\" Rauenthal 1908 e. V.\neingetragener Verein\nEltville am Rhein-Rauenthal\n\nDer Verein ist aufgelöst."
    },
    {
      "date": "2025-03-05",
      "id": "103000",
      "original_text": "Registerbekanntmachung nach dem Umwandlungsgesetz\nHessen Amtsgericht Frankfurt am Main HRB 28469\nInvesco Asset Management Deutschland GmbH – Frankfurt am Main",
      "type": "Registerbekanntmachung nach dem Umwandlungsgesetz",
      "state": "Hessen",
      "amtsgericht": "Amtsgericht Frankfurt am Main",
      "registernummer": "HRB 28469",
      "registerart": "HRB",
      "company_name": "Invesco Asset Management Deutschland GmbH",
      "company_seat": "Frankfurt am Main",
      "details": "05.03.2025 (Bekanntmachungsdatum)\n\nHessen Amtsgericht Frankfurt am Main HRB 28469\nRegisterbekanntmachung nach dem Umwandlungsgesetz\n\nInvesco Asset Management Deutschland GmbH\nGesellschaft mit beschränkter Haftung\nFrankfurt am Main\n\nDem Registergericht ist der Entwurf eines Verschmelzungsplans über die geplante grenzüberschreitende Verschmelzung eingereicht worden.\n\nDie Invesco Asset Management Deutschland GmbH mit Sitz in Frankfurt am Main, Deutschland, eingetragen im Handelsregister des Amtsgerichts Frankfurt am Main unter HRB 28469, soll als übertragender Rechtsträger im Wege einer grenzüberschreitenden Verschmelzung durch Aufnahme auf die INVESCO Asset Management S.A., einer nach dem Recht des Großherzogtums Luxemburg gegründeten und bestehenden Aktiengesellschaft (société anonyme) mit Sitz in Luxemburg, eingetragen im luxemburgischen Handels- und Gesellschaftsregister (Registre de commerce\net des sociétés Luxembourg - RCS) unter der Nummer B38049, als übernehmendem Rechtsträger im Wege der Verschmelzung durch Aufnahme (ohne Liquidation) gemäß §§ 305 ff. UmwG und gemäß Artikel 1020-1 ff., und insbesondere gemäß Artikel 1025-1 ff. des luxemburgischen Gesetzes vom 10. August 1915 über Handelsgesellschaften verschmolzen werden.\nGemäß § 308 UmwG wird hiermit der gemeinsame Verschmelzungsplan für die grenzüberschreitende Verschmelzung der Invesco Asset Management Deutschland GmbH auf die INVESCO Asset Management S.A. vom 3. März 2025, UVZ-Nr. 245/2025 F der Notarin Dr. Sabine Funke mit dem Amtssitz in Frankfurt am Main, zum Handelsregister eingereicht mit der Bitte um unverzügliche Bekanntmachung nach § 308 Abs. 1 Satz 2 UmwG in Verbindung mit § 10 Handelsgesetzbuch (HGB).\nDen Gläubigern der übertragenden Gesellschaft ist Sicherheit zu leisten, wenn sie innerhalb einer Frist von drei Monaten nach Bekanntmachung des Verschmelzungsplans glaubhaft machen, dass durch die Verschmelzung die Erfüllung ihrer Forderung gefährdet wird. Die Anteilseigner der übertragenden Gesellschaft haben bei grenzüberschreitenden Verschmelzungen einen Anspruch auf angemessene Abfindung, sofern sie der Verschmelzung widersprochen haben; gegebenenfalls steht ihnen auch ein Anspruch auf bare Zuzahlung zu.\nHiermit wird gemäß § 308 Abs. 1 Satz 3 UmwG der folgende lnhalt der gemäß § 308 Abs. 1 Satz 2 UmwG bekannt zu machenden Angaben mitgeteilt:\na) Zu § 308 Abs. 1 Satz 2 Nr. 1 UmwG: Der gemeinsame Verschmelzungsplan vom 3. März 2025 einschließlich der Satzung der übernehmenden Gesellschaft wurde mit diesem Schreiben beim Handelsregister Frankfurt am Main eingereicht.\nb) Zu § 308 Abs. 1 Satz 2 Nr. 2 UmwG: An der Verschmelzung sind folgende Rechtsträger beteiligt:\naa) lnvesco Asset Management Deutschland GmbH mit Sitz in Frankfurt am Main, Deutschland, eingetragen im Handelsregister des Amtsgerichts Frankfurt am Main unter HRB 28469 als übertragende Rechtsträgerin;\nbb) INVESCO Asset Management S.A., eine nach dem Recht des Großherzogtums Luxemburg gegründeten und bestehenden Aktiengesellschaft (société anonyme), mit Sitz in Luxemburg, eingetragen im luxemburgischen Handels- und Gesellschaftsregister (RCS) unter der Nummer B38049 als übernehmende Rechtsträgerin.\nc) Zu § 308 Abs. 1 Satz 2 Nr. 3 UmwG: Die Registerangaben zu den beteiligten Gesellschaften lauten wie folgt:\naa) Invesco Asset Management Deutschland GmbH, die übertragende Rechtsträgerin, ist im Handelsregister des Amtsgerichts Frankfurt am Main unter Nummer HRB 28469 eingetragen.\nbb) INVESCO Asset Management S.A., die übernehmende Rechtsträgerin, ist im Luxemburger Handel- und Gesellschaftsregister (Registre de commerce et des sociétés Luxembourg - RCS) unter Nummer B38049 eingetragen.\nd) Zu § 308 Abs. 1 Satz 2 Nr. 4 UmwG: Die Anteilsinhaber und Gläubiger der an der Verschmelzung beteiligten Gesellschaften sowie die zuständigen Betriebsräte (bzw. soweit es keinen Betriebsrat gibt, die Arbeitnehmer der an der Verschmelzung beteiligten Gesellschaften), können etwaige Bemerkungen und Stellungnahmen zum Verschmelzungsplan bis spätestens fünf Arbeitstage vor dem Tag der Gesellschafterversammlung bzw. Hauptversammlung der an der Verschmelzung beteiligten\nGesellschaften, die über die grenzüberschreitende Verschmelzung beschließen, übermitteln.\nDie Gesellschafterversammlung der lnvesco Asset Management Deutschland GmbH, in der über die Zustimmung zum Verschmelzungsplan Beschluss gefasst werden soil, soli am 16. April 2025 stattfinden.\nDie Hauptversammlung der INVESCO Asset Management S.A., in der über die Zustimmung zum Verschmelzungsplan Beschluss gefasst werden soli, wird gemäß Artikel 1025-5 Abs. 1 N° 1 des luxemburgischen Gesetzes vom 10. August 1915 über Handelsgesellschaften frühestens einen Monat nach der Veröffentlichung des Verschmelzungsplans im Recueil Electronique des Soci&és et Associations von Luxemburg stattfinden.\nDie Stellungnahmen von Anteilsinhabern, Gläubigern und des Betriebsrats der Invesco Asset Management Deutschland GmbH sind wie folgt zu adressieren:\nInvesco Asset Management Deutschland GmbH\nAn der Welle 5\n60322 Frankfurt am Main\nGermany\nuksecretariat@invesco.com"
    },
    {
      "date": "2025-03-05",
      "id": "103001",
      "original_text": "Löschungsankündigung\nHessen Amtsgericht Frankfurt am Main HRB 124096\nAMM Support Solution Service GmbH – Frankfurt am Main",
      "type": "Löschungsankündigung",
      "state": "Hessen",
      "amtsgericht": "Amtsgericht Frankfurt am Main",
      "registernummer": "HRB 124096",
      "registerart": "HRB",
      "company_name": "AMM Support Solution Service GmbH",
      "company_seat": "Frankfurt am Main",
      "details": "05.03.2025 (Bekanntmachungsdatum)\n\nHessen Amtsgericht Frankfurt am Main HRB 124096\nLöschungsankündigung\n\nAMM Support Solution Service GmbH\nGesellschaft mit beschränkter Haftung\nFrankfurt am Main\n\nDas Registergericht beabsichtigt die im Handelsregister eingetragene Gesellschaft von Amts wegen nach § 394 FamFG zu löschen. Die Frist zur Erhebung eines Widerspruchs gegen die beabsichtigte Löschung wird auf 1 Monate festgesetzt."
    },
    {
      "date": "2025-03-05",
      "id": "103002",
      "original_text": "Löschungsankündigung\nHessen Amtsgericht Darmstadt VR 84807\nThe High Society e.V. – Darmstadt",
      "type": "Löschungsankündigung",
      "state": "Hessen",
      "amtsgericht": "Amtsgericht Darmstadt",
      "registernummer": "VR 84807",
      "registerart": "VR",
      "company_name": "The High Society e.V.",
      "company_seat": "Darmstadt",
      "details": "05.03.2025 (Bekanntmachungsdatum)\n\nHessen Amtsgericht Darmstadt VR 84807\nLöschungsankündigung 05.03.2025 (Eintragungsdatum)\n\nThe High Society e.V.\neingetragener Verein\nDarmstadt\n\nDer Verein ist aufgelöst."
    },
    {
      "date": "2025-03-05",
      "id": "103003",
      "original_text": "Registerbekanntmachung nach dem Umwandlungsgesetz\nHessen Amtsgericht Offenbach am Main HRA 40393\nWilhelm Ulrich KG – Neu-Isenburg",
      "type": "Registerbekanntmachung nach dem Umwandlungsgesetz",
      "state": "Hessen",
      "amtsgericht": "Amtsgericht Offenbach am Main",
      "registernummer": "HRA 40393",
      "registerart": "HRA",
      "company_name": "Wilhelm Ulrich KG",
      "company_seat": "Neu-Isenburg",
      "details": "05.03.2025 (Bekanntmachungsdatum)\n\nHessen Amtsgericht Offenbach am Main HRA 40393\nRegisterbekanntmachung nach dem Umwandlungsgesetz 05.03.2025 (Eintragungsdatum)\n\nWilhelm Ulrich KG\nKommanditgesellschaft\nNeu-Isenburg\n\nDen Gläubigern der an der Verschmelzung beteiligten Rechtsträger ist, wenn sie binnen sechs Monaten nach dem Tag, an dem die Eintragung der Verschmelzung in das Register des Sitzes desjenigen Rechtsträgers, dessen Gläubiger sie sind, nach § 19 Absatz 3 UmwG bekannt gemacht worden ist, ihren Anspruch nach Grund und Höhe schriftlich anmelden, Sicherheit zu leisten, soweit sie nicht Befriedigung verlangen können. Dieses Recht steht den Gläubigern jedoch nur zu, wenn sie glaubhaft machen, dass durch die Verschmelzung die Erfüllung ihrer Forderung gefährdet wird."
    },
    {
      "date": "2025-03-05",
      "id": "103004",
      "original_text": "Registerbekanntmachung nach dem Umwandlungsgesetz\nHessen Amtsgericht Frankfurt am Main HRB 102358\nTEK TO NIK Architekten und Generalplaner GmbH – Frankfurt am Main",
      "type": "Registerbekanntmachung nach dem Umwandlungsgesetz",
      "state": "Hessen",
      "amtsgericht": "Amtsgericht Frankfurt am Main",
      "registernummer": "HRB 102358",
      "registerart": "HRB",
      "company_name": "TEK TO NIK Architekten und Generalplaner GmbH",
      "company_seat": "Frankfurt am Main",
      "details": "05.03.2025 (Bekanntmachungsdatum)\n\nHessen Amtsgericht Frankfurt am Main HRB 102358\nRegisterbekanntmachung nach dem Umwandlungsgesetz 05.03.2025 (Eintragungsdatum)\n\nTEK TO NIK Architekten und Generalplaner GmbH\nGesellschaft mit beschränkter Haftung\nFrankfurt am Main\n\nDem Registergericht ist ein Verschmelzungsplan über die geplante grenzüberschreitende Verschmelzung der TEK TO NIK Architekten und Generalplaner GmbH mit Sitz in Frankfurt am Main (Gesellschaft mit beschränkter Haftung, eingetragen beim Amtsgericht Frankfurt am Main unter der HRB  102358) als übernehmender Rechtsträger mit der TEK TO NIK Architekten Realisierungsmanagement GmbH mit Sitz in Frankfurt am Main (GmbH, eingetragen beim Amtsgericht Frankfurt am Main) als übertragender Rechtsträger eingereicht worden.\nDen Gläubigern der übertragenden Gesellschaft ist Sicherheit zu leisten, wenn sie innerhalb einer Frist von zwei Monaten nach Bekanntmachung des Verschmelzungsplans glaubhaft machen, dass durch die Verschmelzung die Erfüllung ihrer Forderung gefährdet wird. Die Anteilseigner der übertragenden Gesellschaft haben bei grenzüberschreitenden Verschmelzungen einen Anspruch auf angemessene Abfindung, sofern sie der Verschmelzung widersprochen haben; gegebenenfalls steht ihnen auch ein Anspruch auf bare Zuzahlung zu."
    },
    {
      "date": "2025-03-05",
      "id": "103005",
      "original_text": "Registerbekanntmachung nach dem Umwandlungsgesetz\nHessen Amtsgericht Darmstadt HRA 87119\nBackwerk Hans-Peter Rauen e.K. – Heppenheim",
      "type": "Registerbekanntmachung nach dem Umwandlungsgesetz",
      "state": "Hessen",
      "amtsgericht": "Amtsgericht Darmstadt",
      "registernummer": "HRA 87119",
      "registerart": "HRA",
      "company_name": "Backwerk Hans-Peter Rauen e.K.",
      "company_seat": "Heppenheim",
      "details": "05.03.2025 (Bekanntmachungsdatum)\n\nHessen Amtsgericht Darmstadt HRA 87119\nRegisterbekanntmachung nach dem Umwandlungsgesetz 05.03.2025 (Eintragungsdatum)\n\nBackwerk Hans-Peter Rauen e.K.\nEinzelkaufmann / Einzelkauffrau\nHeppenheim\n\nDen Gläubigern der an der Ausgliederung beteiligten Rechtsträger ist, wenn sie binnen sechs Monaten nach dem Tag, an dem die Eintragung der Ausgliederung in das Register des Sitzes derjenigen Rechtsträger deren Gläubiger sie sind, nach §§ 125, 19 Absatz 3 UmwG bekannt gemacht worden ist, ihren Anspruch nach Grund und Höhe schriftlich anmelden, Sicherheit zu leisten, soweit sie nicht Befriedigung verlangen können. Dieses Recht steht den Gläubigern jedoch nur zu, wenn sie glaubhaft machen, dass durch die Ausgliederung die Erfüllung ihrer Forderung gefährdet wird."
    },
    {
      "date": "2025-03-05",
      "id": "103006",
      "original_text": "Sonstige Registerbekanntmachung\nHessen Amtsgericht Limburg VR 1678\nFrauenchor 1925 Weinbach e.V. – Weinbach",
      "type": "Sonstige Registerbekanntmachung",
      "state": "Hessen",
      "amtsgericht": "Amtsgericht Limburg",
      "registernummer": "VR 1678",
      "registerart": "VR",
      "company_name": "Frauenchor 1925 Weinbach e.V.",
      "company_seat": "Weinbach",
      "details": "05.03.2025 (Bekanntmachungsdatum)\n\nHessen Amtsgericht Limburg VR 1678\nSonstige Registerbekanntmachung 05.03.2025 (Eintragungsdatum)\n\nFrauenchor 1925 Weinbach e.V.\neingetragener Verein\nWeinbach\n\nDer Verein ist aufgelöst."
    },
    {
      "date": "2025-03-05",
      "id": "103007",
      "original_text": "Registerbekanntmachung nach dem Umwandlungsgesetz\nHessen Amtsgericht Offenbach am Main HRB 57223\nCharge Solutions UG (haftungsbeschränkt) – Neu-Isenburg",
      "type": "Registerbekanntmachung nach dem Umwandlungsgesetz",
      "state": "Hessen",
      "amtsgericht": "Amtsgericht Offenbach am Main",
      "registernummer": "HRB 57223",
      "registerart": "HRB",
      "company_name": "Charge Solutions UG (haftungsbeschränkt)",
      "company_seat": "Neu-Isenburg",
      "details": "05.03.2025 (Bekanntmachungsdatum)\n\nHessen Amtsgericht Offenbach am Main HRB 57223\nRegisterbekanntmachung nach dem Umwandlungsgesetz 05.03.2025 (Eintragungsdatum)\n\nCharge Solutions UG (haftungsbeschränkt)\nGesellschaft mit beschränkter Haftung\nNeu-Isenburg\n\nDen Gläubigern der an der Verschmelzung beteiligten Rechtsträger ist, wenn sie binnen sechs Monaten nach dem Tag, an dem die Eintragung der Verschmelzung in das Register des Sitzes desjenigen Rechtsträgers, dessen Gläubiger sie sind, nach § 19 Absatz 3 UmwG bekannt gemacht worden ist, ihren Anspruch nach Grund und Höhe schriftlich anmelden, Sicherheit zu leisten, soweit sie nicht Befriedigung verlangen können. Dieses Recht steht den Gläubigern jedoch nur zu, wenn sie glaubhaft machen, dass durch die Verschmelzung die Erfüllung ihrer Forderung gefährdet wird."
    }
  ]
}