{
  "date": "2025-03-14",
  "date_of_scrape": "2025-03-31T10:43:03.260Z",
  "tool_version": "0.2.0",
  "number_of_announcements": 128,
  "announcements": [
    {
      "date": "2025-03-14",
      "id": "103760",
      "original_text": "Einreichung neuer Dokumente\nBayern Amtsgericht Traunstein HRB 4271\nGRWS - Wohnungsbau- und Sanierungsgesellschaft der Stadt Rosenheim Gesellschaft mit beschränkter Haftung – Rosenheim",
      "type": "Einreichung neuer Dokumente",
      "state": "Bayern",
      "amtsgericht": "Amtsgericht Traunstein",
      "registernummer": "HRB 4271",
      "registerart": "HRB",
      "company_name": "GRWS - Wohnungsbau- und Sanierungsgesellschaft der Stadt Rosenheim Gesellschaft mit beschränkter Haftung",
      "company_seat": "Rosenheim",
      "details": "14.03.2025 (Bekanntmachungsdatum)\n\nBayern Amtsgericht Traunstein HRB 4271\nEinreichung neuer Dokumente\n\nGRWS - Wohnungsbau- und Sanierungsgesellschaft der Stadt Rosenheim Gesellschaft mit beschränkter Haftung\nGesellschaft mit beschränkter Haftung\nRosenheim\n\nDem Amtsgericht Traunstein -Registergericht- ist eine Liste der Mitglieder des Aufsichtsrats eingereicht worden, § 52 Abs. 3 S. 2 GmbHG."
    },
    {
      "date": "2025-03-14",
      "id": "103761",
      "original_text": "Löschungsankündigung\nBayern Amtsgericht München HRB 242071\nGiltico GmbH – Geretsried",
      "type": "Löschungsankündigung",
      "state": "Bayern",
      "amtsgericht": "Amtsgericht München",
      "registernummer": "HRB 242071",
      "registerart": "HRB",
      "company_name": "Giltico GmbH",
      "company_seat": "Geretsried",
      "details": "14.03.2025 (Bekanntmachungsdatum)\n\nBayern Amtsgericht München HRB 242071\nLöschungsankündigung\n\nGiltico GmbH\nGesellschaft mit beschränkter Haftung\nGeretsried\n\nDas Registergericht beabsichtigt, die im Handelsregister eingetragene Gesellschaft wegen Vermögenslosigkeit von Amts wegen nach § 394 FamFG zu löschen. Die Frist zur Erhebung eines Widerspruchs ist auf drei Monate festgesetzt."
    },
    {
      "date": "2025-03-14",
      "id": "103762",
      "original_text": "Registerbekanntmachung nach dem Umwandlungsgesetz\nBayern Amtsgericht München HRB 279580\nHighwind Verwaltungs GmbH – Grünwald",
      "type": "Registerbekanntmachung nach dem Umwandlungsgesetz",
      "state": "Bayern",
      "amtsgericht": "Amtsgericht München",
      "registernummer": "HRB 279580",
      "registerart": "HRB",
      "company_name": "Highwind Verwaltungs GmbH",
      "company_seat": "Grünwald",
      "details": "14.03.2025 (Bekanntmachungsdatum)\n\nBayern Amtsgericht München HRB 279580\nRegisterbekanntmachung nach dem Umwandlungsgesetz 13.03.2025 (Eintragungsdatum)\n\nHighwind Verwaltungs GmbH\nGesellschaft mit beschränkter Haftung\nGrünwald\n\nDen Gläubigern der an der Verschmelzung beteiligten Rechtsträger ist, wenn sie binnen sechs Monaten nach dem Tag, an dem die Eintragung der Verschmelzung in das Register des Sitzes desjenigen Rechtsträgers, dessen Gläubiger sie sind, nach § 19 Abs. 3 UmwG als bekannt gemacht gilt, ihren Anspruch nach Grund und Höhe in Textform anmelden, Sicherheit zu leisten, soweit sie nicht Befriedigung verlangen können. Dieses Recht steht den Gläubigern jedoch nur zu, wenn sie glaubhaft machen, dass durch die Verschmelzung die Erfüllung ihrer Forderung gefährdet wird."
    },
    {
      "date": "2025-03-14",
      "id": "103763",
      "original_text": "Löschungsankündigung\nBayern Amtsgericht München HRB 293689\nDakota - Immobilien- Management GmbH – Germering",
      "type": "Löschungsankündigung",
      "state": "Bayern",
      "amtsgericht": "Amtsgericht München",
      "registernummer": "HRB 293689",
      "registerart": "HRB",
      "company_name": "Dakota - Immobilien- Management GmbH",
      "company_seat": "Germering",
      "details": "14.03.2025 (Bekanntmachungsdatum)\n\nBayern Amtsgericht München HRB 293689\nLöschungsankündigung\n\nDakota - Immobilien- Management GmbH\nGesellschaft mit beschränkter Haftung\nGermering\n\nDas Registergericht beabsichtigt, die im Handelsregister eingetragene Gesellschaft wegen Vermögenslosigkeit von Amts wegen nach § 394 FamFG zu löschen. Die Frist zur Erhebung eines Widerspruchs ist auf drei Monate festgesetzt."
    },
    {
      "date": "2025-03-14",
      "id": "103764",
      "original_text": "Löschungsankündigung\nBayern Amtsgericht München HRB 207867\nEUSTRA Service GmbH – München",
      "type": "Löschungsankündigung",
      "state": "Bayern",
      "amtsgericht": "Amtsgericht München",
      "registernummer": "HRB 207867",
      "registerart": "HRB",
      "company_name": "EUSTRA Service GmbH",
      "company_seat": "München",
      "details": "14.03.2025 (Bekanntmachungsdatum)\n\nBayern Amtsgericht München HRB 207867\nLöschungsankündigung\n\nEUSTRA Service GmbH\nGesellschaft mit beschränkter Haftung\nMünchen\n\nDas Registergericht beabsichtigt, die im Handelsregister eingetragene Gesellschaft wegen Vermögenslosigkeit von Amts wegen nach § 394 FamFG zu löschen. Die Frist zur Erhebung eines Widerspruchs ist auf drei Monate festgesetzt."
    },
    {
      "date": "2025-03-14",
      "id": "103765",
      "original_text": "Einreichung neuer Dokumente\nBayern Amtsgericht München HRB 187404\nSparkassen-Immobilien-Vermittlungs-GmbH – München",
      "type": "Einreichung neuer Dokumente",
      "state": "Bayern",
      "amtsgericht": "Amtsgericht München",
      "registernummer": "HRB 187404",
      "registerart": "HRB",
      "company_name": "Sparkassen-Immobilien-Vermittlungs-GmbH",
      "company_seat": "München",
      "details": "14.03.2025 (Bekanntmachungsdatum)\n\nBayern Amtsgericht München HRB 187404\nEinreichung neuer Dokumente\n\nSparkassen-Immobilien-Vermittlungs-GmbH\nGesellschaft mit beschränkter Haftung\nMünchen\n\nDem Amtsgericht München -Registergericht- ist eine Liste der Mitglieder des Aufsichtsrats eingereicht worden, § 52 Abs. 3 S. 2 GmbHG."
    },
    {
      "date": "2025-03-14",
      "id": "103766",
      "original_text": "Sonstige Registerbekanntmachung\nBayern Amtsgericht Nürnberg HRB 43992\nInnomotics GmbH – Nürnberg",
      "type": "Sonstige Registerbekanntmachung",
      "state": "Bayern",
      "amtsgericht": "Amtsgericht Nürnberg",
      "registernummer": "HRB 43992",
      "registerart": "HRB",
      "company_name": "Innomotics GmbH",
      "company_seat": "Nürnberg",
      "details": "14.03.2025 (Bekanntmachungsdatum)\n\nBayern Amtsgericht Nürnberg HRB 43992\nSonstige Registerbekanntmachung\n\nInnomotics GmbH\nGesellschaft mit beschränkter Haftung\nNürnberg\n\nDem Amtsgericht Nürnberg -Registergericht- ist eine Liste der Mitglieder des Aufsichtsrats eingereicht worden, § 52 Abs. 3 S. 2 GmbHG."
    },
    {
      "date": "2025-03-14",
      "id": "103767",
      "original_text": "Einreichung neuer Dokumente\nBayern Amtsgericht Memmingen HRB 6008\nWohnungsgesellschaft Weißenhorn mbH – Weißenhorn",
      "type": "Einreichung neuer Dokumente",
      "state": "Bayern",
      "amtsgericht": "Amtsgericht Memmingen",
      "registernummer": "HRB 6008",
      "registerart": "HRB",
      "company_name": "Wohnungsgesellschaft Weißenhorn mbH",
      "company_seat": "Weißenhorn",
      "details": "14.03.2025 (Bekanntmachungsdatum)\n\nBayern Amtsgericht Memmingen HRB 6008\nEinreichung neuer Dokumente 13.03.2025 (Eintragungsdatum)\n\nWohnungsgesellschaft Weißenhorn mbH\nGesellschaft mit beschränkter Haftung\nWeißenhorn\n\nDem Amtsgericht Memmingen -Registergericht- ist eine Liste der Mitglieder des Aufsichtsrats eingereicht worden, § 52 Abs. 3 S. 2 GmbHG."
    },
    {
      "date": "2025-03-14",
      "id": "103768",
      "original_text": "Registerbekanntmachung nach dem Umwandlungsgesetz\nBayern Amtsgericht Nürnberg HRB 30448\nBAUSTOFF UNION GmbH – Nürnberg",
      "type": "Registerbekanntmachung nach dem Umwandlungsgesetz",
      "state": "Bayern",
      "amtsgericht": "Amtsgericht Nürnberg",
      "registernummer": "HRB 30448",
      "registerart": "HRB",
      "company_name": "BAUSTOFF UNION GmbH",
      "company_seat": "Nürnberg",
      "details": "14.03.2025 (Bekanntmachungsdatum)\n\nBayern Amtsgericht Nürnberg HRB 30448\nRegisterbekanntmachung nach dem Umwandlungsgesetz 13.03.2025 (Eintragungsdatum)\n\nBAUSTOFF UNION GmbH\nGesellschaft mit beschränkter Haftung\nNürnberg\n\nDen Gläubigern der an der Verschmelzung beteiligten Rechtsträger ist, wenn sie binnen sechs Monaten nach dem Tag, an dem die Eintragung der Verschmelzung in das Register des Sitzes desjenigen Rechtsträgers, dessen Gläubiger sie sind, nach § 19 Abs. 3 UmwG als bekannt gemacht gilt, ihren Anspruch nach Grund und Höhe in Textform anmelden, Sicherheit zu leisten, soweit sie nicht Befriedigung verlangen können. Dieses Recht steht den Gläubigern jedoch nur zu, wenn sie glaubhaft machen, dass durch die Verschmelzung die Erfüllung ihrer Forderung gefährdet wird."
    },
    {
      "date": "2025-03-14",
      "id": "103769",
      "original_text": "Registerbekanntmachung nach dem Umwandlungsgesetz\nBayern Amtsgericht München HRB 293667\nWorking Group Two GmbH – Garching b.München",
      "type": "Registerbekanntmachung nach dem Umwandlungsgesetz",
      "state": "Bayern",
      "amtsgericht": "Amtsgericht München",
      "registernummer": "HRB 293667",
      "registerart": "HRB",
      "company_name": "Working Group Two GmbH",
      "company_seat": "Garching b.München",
      "details": "14.03.2025 (Bekanntmachungsdatum)\n\nBayern Amtsgericht München HRB 293667\nRegisterbekanntmachung nach dem Umwandlungsgesetz 13.03.2025 (Eintragungsdatum)\n\nWorking Group Two GmbH\nGesellschaft mit beschränkter Haftung\nGarching b.München\n\nDen Gläubigern der an der Verschmelzung beteiligten Rechtsträger ist, wenn sie binnen sechs Monaten nach dem Tag, an dem die Eintragung der Verschmelzung in das Register des Sitzes desjenigen Rechtsträgers, dessen Gläubiger sie sind, nach § 19 Abs. 3 UmwG als bekannt gemacht gilt, ihren Anspruch nach Grund und Höhe in Textform anmelden, Sicherheit zu leisten, soweit sie nicht Befriedigung verlangen können. Dieses Recht steht den Gläubigern jedoch nur zu, wenn sie glaubhaft machen, dass durch die Verschmelzung die Erfüllung ihrer Forderung gefährdet wird."
    },
    {
      "date": "2025-03-14",
      "id": "103770",
      "original_text": "Einreichung neuer Dokumente\nBayern Amtsgericht München HRB 297588\nBlitz 24-898 SE – München",
      "type": "Einreichung neuer Dokumente",
      "state": "Bayern",
      "amtsgericht": "Amtsgericht München",
      "registernummer": "HRB 297588",
      "registerart": "HRB",
      "company_name": "Blitz 24-898 SE",
      "company_seat": "München",
      "details": "14.03.2025 (Bekanntmachungsdatum)\n\nBayern Amtsgericht München HRB 297588\nEinreichung neuer Dokumente\n\nBlitz 24-898 SE\nEuropäische Aktiengesellschaft (SE)\nMünchen\n\nDem Amtsgericht München -Registergericht- ist eine Liste der Mitglieder des Aufsichtsrats eingereicht worden, Art. 9 Abs. 1 Buchst. c (ii) SE-VO i.V.m. § 106 AktG."
    },
    {
      "date": "2025-03-14",
      "id": "103771",
      "original_text": "Registerbekanntmachung nach dem Umwandlungsgesetz\nBayern Amtsgericht München HRB 270553\nRENNER Gebäudetechnik GmbH – München",
      "type": "Registerbekanntmachung nach dem Umwandlungsgesetz",
      "state": "Bayern",
      "amtsgericht": "Amtsgericht München",
      "registernummer": "HRB 270553",
      "registerart": "HRB",
      "company_name": "RENNER Gebäudetechnik GmbH",
      "company_seat": "München",
      "details": "14.03.2025 (Bekanntmachungsdatum)\n\nBayern Amtsgericht München HRB 270553\nRegisterbekanntmachung nach dem Umwandlungsgesetz 13.03.2025 (Eintragungsdatum)\n\nRENNER Gebäudetechnik GmbH\nGesellschaft mit beschränkter Haftung\nMünchen\n\nDen Gläubigern der an der Verschmelzung beteiligten Rechtsträger ist, wenn sie binnen sechs Monaten nach dem Tag, an dem die Eintragung der Verschmelzung in das Register des Sitzes desjenigen Rechtsträgers, dessen Gläubiger sie sind, nach § 19 Abs. 3 UmwG als bekannt gemacht gilt, ihren Anspruch nach Grund und Höhe in Textform anmelden, Sicherheit zu leisten, soweit sie nicht Befriedigung verlangen können. Dieses Recht steht den Gläubigern jedoch nur zu, wenn sie glaubhaft machen, dass durch die Verschmelzung die Erfüllung ihrer Forderung gefährdet wird."
    },
    {
      "date": "2025-03-14",
      "id": "103772",
      "original_text": "Löschungsankündigung\nBayern Amtsgericht München HRB 258894\nKraft Solutions GmbH – Unterföhring",
      "type": "Löschungsankündigung",
      "state": "Bayern",
      "amtsgericht": "Amtsgericht München",
      "registernummer": "HRB 258894",
      "registerart": "HRB",
      "company_name": "Kraft Solutions GmbH",
      "company_seat": "Unterföhring",
      "details": "14.03.2025 (Bekanntmachungsdatum)\n\nBayern Amtsgericht München HRB 258894\nLöschungsankündigung\n\nKraft Solutions GmbH\nGesellschaft mit beschränkter Haftung\nUnterföhring\n\nDas Registergericht beabsichtigt, den im Handelsregister eingetragenen Geschäftsführer, Maximilian Kraft, geb. 24.06.1992, wegen fehlender Eignung nach § 395 FamFG zu löschen. Die Frist zur Erhebung eines Widerspruchs ist auf drei Monate festgesetzt."
    },
    {
      "date": "2025-03-14",
      "id": "103773",
      "original_text": "Löschungsankündigung\nBayern Amtsgericht München HRB 261392\nRKA Bau GmbH – München",
      "type": "Löschungsankündigung",
      "state": "Bayern",
      "amtsgericht": "Amtsgericht München",
      "registernummer": "HRB 261392",
      "registerart": "HRB",
      "company_name": "RKA Bau GmbH",
      "company_seat": "München",
      "details": "14.03.2025 (Bekanntmachungsdatum)\n\nBayern Amtsgericht München HRB 261392\nLöschungsankündigung\n\nRKA Bau GmbH\nGesellschaft mit beschränkter Haftung\nMünchen\n\nDas Registergericht beabsichtigt, die im Handelsregister eingetragene Gesellschaft wegen Vermögenslosigkeit von Amts wegen nach § 394 FamFG zu löschen. Die Frist zur Erhebung eines Widerspruchs ist auf drei Monate festgesetzt."
    },
    {
      "date": "2025-03-14",
      "id": "103774",
      "original_text": "Einreichung neuer Dokumente\nBayern Amtsgericht Traunstein HRB 8389\nGRWS-Gesellschaft für städtebauliche Planung, bau- und wohnungswirtschaftliche Betreuung mbH – Rosenheim",
      "type": "Einreichung neuer Dokumente",
      "state": "Bayern",
      "amtsgericht": "Amtsgericht Traunstein",
      "registernummer": "HRB 8389",
      "registerart": "HRB",
      "company_name": "GRWS-Gesellschaft für städtebauliche Planung, bau- und wohnungswirtschaftliche Betreuung mbH",
      "company_seat": "Rosenheim",
      "details": "14.03.2025 (Bekanntmachungsdatum)\n\nBayern Amtsgericht Traunstein HRB 8389\nEinreichung neuer Dokumente\n\nGRWS-Gesellschaft für städtebauliche Planung, bau- und wohnungswirtschaftliche Betreuung mbH\nGesellschaft mit beschränkter Haftung\nRosenheim\n\nDem Amtsgericht Traunstein -Registergericht- ist eine Liste der Mitglieder des Aufsichtsrats eingereicht worden, § 52 Abs. 3 S. 2 GmbHG."
    },
    {
      "date": "2025-03-14",
      "id": "103775",
      "original_text": "Registerbekanntmachung nach dem Umwandlungsgesetz\nBayern Amtsgericht München HRB 275807\nGASQ GmbH – Oberhaching",
      "type": "Registerbekanntmachung nach dem Umwandlungsgesetz",
      "state": "Bayern",
      "amtsgericht": "Amtsgericht München",
      "registernummer": "HRB 275807",
      "registerart": "HRB",
      "company_name": "GASQ GmbH",
      "company_seat": "Oberhaching",
      "details": "14.03.2025 (Bekanntmachungsdatum)\n\nBayern Amtsgericht München HRB 275807\nRegisterbekanntmachung nach dem Umwandlungsgesetz 13.03.2025 (Eintragungsdatum)\n\nGASQ GmbH\nGesellschaft mit beschränkter Haftung\nOberhaching\n\nDen Gläubigern der an der Verschmelzung beteiligten Rechtsträger ist, wenn sie binnen sechs Monaten nach dem Tag, an dem die Eintragung der Verschmelzung in das Register des Sitzes desjenigen Rechtsträgers, dessen Gläubiger sie sind, nach § 19 Abs. 3 UmwG als bekannt gemacht gilt, ihren Anspruch nach Grund und Höhe in Textform anmelden, Sicherheit zu leisten, soweit sie nicht Befriedigung verlangen können. Dieses Recht steht den Gläubigern jedoch nur zu, wenn sie glaubhaft machen, dass durch die Verschmelzung die Erfüllung ihrer Forderung gefährdet wird."
    },
    {
      "date": "2025-03-14",
      "id": "103776",
      "original_text": "Einreichung neuer Dokumente\nBayern Amtsgericht Traunstein HRB 8388\nGRWS-Gesellschaft für Städtebau und Stadtentwicklung mit beschränkter Haftung – Rosenheim",
      "type": "Einreichung neuer Dokumente",
      "state": "Bayern",
      "amtsgericht": "Amtsgericht Traunstein",
      "registernummer": "HRB 8388",
      "registerart": "HRB",
      "company_name": "GRWS-Gesellschaft für Städtebau und Stadtentwicklung mit beschränkter Haftung",
      "company_seat": "Rosenheim",
      "details": "14.03.2025 (Bekanntmachungsdatum)\n\nBayern Amtsgericht Traunstein HRB 8388\nEinreichung neuer Dokumente\n\nGRWS-Gesellschaft für Städtebau und Stadtentwicklung mit beschränkter Haftung\nGesellschaft mit beschränkter Haftung\nRosenheim\n\nDem Amtsgericht Traunstein -Registergericht- ist eine Liste der Mitglieder des Aufsichtsrats eingereicht worden, § 52 Abs. 3 S. 2 GmbHG."
    },
    {
      "date": "2025-03-14",
      "id": "103777",
      "original_text": "Löschungsankündigung\nBayern Amtsgericht Straubing HRA 7164\nCannaDeluxe KG – Straubing",
      "type": "Löschungsankündigung",
      "state": "Bayern",
      "amtsgericht": "Amtsgericht Straubing",
      "registernummer": "HRA 7164",
      "registerart": "HRA",
      "company_name": "CannaDeluxe KG",
      "company_seat": "Straubing",
      "details": "14.03.2025 (Bekanntmachungsdatum)\n\nBayern Amtsgericht Straubing HRA 7164\nLöschungsankündigung\n\nCannaDeluxe KG\nKommanditgesellschaft\nStraubing\n\nDas Registergericht beabsichtigt, die im Handelsregister eingetragene Firma von Amts wegen nach § 31 Abs. 2 HGB zu löschen. Die Frist zur Erhebung eines Widerspruchs ist auf drei Monate festgesetzt."
    },
    {
      "date": "2025-03-14",
      "id": "103778",
      "original_text": "Registerbekanntmachung nach dem Umwandlungsgesetz\nBayern Amtsgericht München HRB 263913\nheptus 389. GmbH – München",
      "type": "Registerbekanntmachung nach dem Umwandlungsgesetz",
      "state": "Bayern",
      "amtsgericht": "Amtsgericht München",
      "registernummer": "HRB 263913",
      "registerart": "HRB",
      "company_name": "heptus 389. GmbH",
      "company_seat": "München",
      "details": "14.03.2025 (Bekanntmachungsdatum)\n\nBayern Amtsgericht München HRB 263913\nRegisterbekanntmachung nach dem Umwandlungsgesetz 13.03.2025 (Eintragungsdatum)\n\nheptus 389. GmbH\nGesellschaft mit beschränkter Haftung\nMünchen\n\nDen Gläubigern der an der Verschmelzung beteiligten Rechtsträger ist, wenn sie binnen sechs Monaten nach dem Tag, an dem die Eintragung der Verschmelzung in das Register des Sitzes desjenigen Rechtsträgers, dessen Gläubiger sie sind, nach § 19 Abs. 3 UmwG als bekannt gemacht gilt, ihren Anspruch nach Grund und Höhe in Textform anmelden, Sicherheit zu leisten, soweit sie nicht Befriedigung verlangen können. Dieses Recht steht den Gläubigern jedoch nur zu, wenn sie glaubhaft machen, dass durch die Verschmelzung die Erfüllung ihrer Forderung gefährdet wird."
    },
    {
      "date": "2025-03-14",
      "id": "103779",
      "original_text": "Einreichung neuer Dokumente\nBayern Amtsgericht München HRB 296297\nSoftware GmbH – München",
      "type": "Einreichung neuer Dokumente",
      "state": "Bayern",
      "amtsgericht": "Amtsgericht München",
      "registernummer": "HRB 296297",
      "registerart": "HRB",
      "company_name": "Software GmbH",
      "company_seat": "München",
      "details": "14.03.2025 (Bekanntmachungsdatum)\n\nBayern Amtsgericht München HRB 296297\nEinreichung neuer Dokumente\n\nSoftware GmbH\nGesellschaft mit beschränkter Haftung\nMünchen\n\nDem Amtsgericht München -Registergericht- ist eine Liste der Mitglieder des Aufsichtsrats eingereicht worden, § 52 Abs. 3 S. 2 GmbHG."
    },
    {
      "date": "2025-03-14",
      "id": "103780",
      "original_text": "Löschungsankündigung\nBayern Amtsgericht Nürnberg HRB 32712\nEckhart Weber Verwaltungs UG (haftungsbeschränkt) – Pyrbaum",
      "type": "Löschungsankündigung",
      "state": "Bayern",
      "amtsgericht": "Amtsgericht Nürnberg",
      "registernummer": "HRB 32712",
      "registerart": "HRB",
      "company_name": "Eckhart Weber Verwaltungs UG (haftungsbeschränkt)",
      "company_seat": "Pyrbaum",
      "details": "14.03.2025 (Bekanntmachungsdatum)\n\nBayern Amtsgericht Nürnberg HRB 32712\nLöschungsankündigung\n\nEckhart Weber Verwaltungs UG (haftungsbeschränkt)\nGesellschaft mit beschränkter Haftung\nPyrbaum\n\nDas Registergericht beabsichtigt, die im Handelsregister eingetragene Gesellschaft wegen Vermögenslosigkeit von Amts wegen nach § 394 FamFG zu löschen. Die Frist zur Erhebung eines Widerspruchs ist auf einen Monat festgesetzt."
    },
    {
      "date": "2025-03-14",
      "id": "103781",
      "original_text": "Einreichung neuer Dokumente\nBayern Amtsgericht München HRB 297819\nTekkMinds AG – München",
      "type": "Einreichung neuer Dokumente",
      "state": "Bayern",
      "amtsgericht": "Amtsgericht München",
      "registernummer": "HRB 297819",
      "registerart": "HRB",
      "company_name": "TekkMinds AG",
      "company_seat": "München",
      "details": "14.03.2025 (Bekanntmachungsdatum)\n\nBayern Amtsgericht München HRB 297819\nEinreichung neuer Dokumente 13.03.2025 (Eintragungsdatum)\n\nTekkMinds AG\nAktiengesellschaft\nMünchen\n\nDem Amtsgericht München -Registergericht- ist eine Liste der Mitglieder des Aufsichtsrats eingereicht worden, § 106 AktG."
    },
    {
      "date": "2025-03-14",
      "id": "103782",
      "original_text": "Löschungsankündigung\nBayern Amtsgericht München HRB 88372\nKasturia Hotel GmbH – München",
      "type": "Löschungsankündigung",
      "state": "Bayern",
      "amtsgericht": "Amtsgericht München",
      "registernummer": "HRB 88372",
      "registerart": "HRB",
      "company_name": "Kasturia Hotel GmbH",
      "company_seat": "München",
      "details": "14.03.2025 (Bekanntmachungsdatum)\n\nBayern Amtsgericht München HRB 88372\nLöschungsankündigung\n\nKasturia Hotel GmbH\nGesellschaft mit beschränkter Haftung\nMünchen\n\nDas Registergericht beabsichtigt, die im Handelsregister eingetragene Gesellschaft wegen Vermögenslosigkeit von Amts wegen nach § 394 FamFG zu löschen. Die Frist zur Erhebung eines Widerspruchs ist auf drei Monate festgesetzt."
    },
    {
      "date": "2025-03-14",
      "id": "103783",
      "original_text": "Löschungsankündigung\nBayern Amtsgericht Straubing HRB 10410\nSüdklinik Beteiligungs GmbH – Straubing",
      "type": "Löschungsankündigung",
      "state": "Bayern",
      "amtsgericht": "Amtsgericht Straubing",
      "registernummer": "HRB 10410",
      "registerart": "HRB",
      "company_name": "Südklinik Beteiligungs GmbH",
      "company_seat": "Straubing",
      "details": "14.03.2025 (Bekanntmachungsdatum)\n\nBayern Amtsgericht Straubing HRB 10410\nLöschungsankündigung\n\nSüdklinik Beteiligungs GmbH\nGesellschaft mit beschränkter Haftung\nStraubing\n\nDas Registergericht beabsichtigt, die im Handelsregister eingetragene Gesellschaft wegen Vermögenslosigkeit von Amts wegen nach § 394 FamFG zu löschen. Die Frist zur Erhebung eines Widerspruchs ist auf drei Monate festgesetzt."
    },
    {
      "date": "2025-03-14",
      "id": "103784",
      "original_text": "Einreichung neuer Dokumente\nBayern Amtsgericht München HRB 175770\nPacelli SE – München",
      "type": "Einreichung neuer Dokumente",
      "state": "Bayern",
      "amtsgericht": "Amtsgericht München",
      "registernummer": "HRB 175770",
      "registerart": "HRB",
      "company_name": "Pacelli SE",
      "company_seat": "München",
      "details": "14.03.2025 (Bekanntmachungsdatum)\n\nBayern Amtsgericht München HRB 175770\nEinreichung neuer Dokumente 11.03.2025 (Eintragungsdatum)\n\nPacelli SE\nEuropäische Aktiengesellschaft (SE)\nMünchen\n\nDem Amtsgericht München -Registergericht- ist eine Liste der Mitglieder des Aufsichtsrats eingereicht worden, Art. 9 Abs. 1 Buchst. c (ii) SE-VO i.V.m. § 106 AktG."
    },
    {
      "date": "2025-03-14",
      "id": "103785",
      "original_text": "Sonstige Registerbekanntmachung\nBayern Amtsgericht München HRB 237247\nSTEMMER IMAGING AG – Puchheim",
      "type": "Sonstige Registerbekanntmachung",
      "state": "Bayern",
      "amtsgericht": "Amtsgericht München",
      "registernummer": "HRB 237247",
      "registerart": "HRB",
      "company_name": "STEMMER IMAGING AG",
      "company_seat": "Puchheim",
      "details": "14.03.2025 (Bekanntmachungsdatum)\n\nBayern Amtsgericht München HRB 237247\nSonstige Registerbekanntmachung 13.03.2025 (Eintragungsdatum)\n\nSTEMMER IMAGING AG\nAktiengesellschaft\nPuchheim\n\nDem Amtsgericht München -Registergericht- ist eine Liste der Mitglieder des Aufsichtsrats eingereicht worden, § 106 AktG."
    },
    {
      "date": "2025-03-14",
      "id": "103786",
      "original_text": "Löschungsankündigung\nBerlin Amtsgericht Berlin (Charlottenburg) HRB 102302\nLottmann Grundbesitz GmbH – Berlin",
      "type": "Löschungsankündigung",
      "state": "Berlin",
      "amtsgericht": "Amtsgericht Berlin (Charlottenburg)",
      "registernummer": "HRB 102302",
      "registerart": "HRB",
      "company_name": "Lottmann Grundbesitz GmbH",
      "company_seat": "Berlin",
      "details": "14.03.2025 (Bekanntmachungsdatum)\n\nBerlin Amtsgericht Berlin (Charlottenburg) HRB 102302\nLöschungsankündigung\n\nLottmann Grundbesitz GmbH\nGesellschaft mit beschränkter Haftung\nBerlin\n\nBei der nachstehenden Gesellschaft wird das Amtslöschungsverfahren gemäß § 394 FamFG eingeleitet. Widerspruchsfrist 6 Wochen"
    },
    {
      "date": "2025-03-14",
      "id": "103787",
      "original_text": "Registerbekanntmachung nach dem Umwandlungsgesetz\nBaden-Württemberg Amtsgericht Stuttgart VR 261392\nWest-Ost-Gesellschaft in Baden-Württemberg e.V. – Waiblingen",
      "type": "Registerbekanntmachung nach dem Umwandlungsgesetz",
      "state": "Baden-Württemberg",
      "amtsgericht": "Amtsgericht Stuttgart",
      "registernummer": "VR 261392",
      "registerart": "VR",
      "company_name": "West-Ost-Gesellschaft in Baden-Württemberg e.V.",
      "company_seat": "Waiblingen",
      "details": "14.03.2025 (Bekanntmachungsdatum)\n\nBaden-Württemberg Amtsgericht Stuttgart VR 261392\nRegisterbekanntmachung nach dem Umwandlungsgesetz 14.03.2025 (Eintragungsdatum)\n\nWest-Ost-Gesellschaft in Baden-Württemberg e.V.\neingetragener Verein\nWaiblingen\n\nAls nicht eingetragen wird bekanntgemacht:\nDen Gläubigern der an der Verschmelzung beteiligten Rechtsträger ist, wenn sie binnen sechs Monaten nach dem Tag, an dem die Eintragung der Verschmelzung in das Register des Sitzes desjenigen Rechtsträgers, dessen Gläubiger sie sind, nach § 19 Abs. 3 UmwG als bekanntgemacht gilt, ihren Anspruch nach Grund und Höhe schriftlich anmelden, Sicherheit zu leisten, soweit sie nicht Befriedigung verlangen können. Dieses Recht steht den Gläubigern jedoch nur zu, wenn sie glaubhaft machen, dass durch die Verschmelzung die Erfüllung ihrer Forderung gefährdet wird."
    },
    {
      "date": "2025-03-14",
      "id": "103788",
      "original_text": "Registerbekanntmachung nach dem Umwandlungsgesetz\nBaden-Württemberg Amtsgericht Mannheim HRB 738555\nSLR Holding GmbH – St. Leon-Rot",
      "type": "Registerbekanntmachung nach dem Umwandlungsgesetz",
      "state": "Baden-Württemberg",
      "amtsgericht": "Amtsgericht Mannheim",
      "registernummer": "HRB 738555",
      "registerart": "HRB",
      "company_name": "SLR Holding GmbH",
      "company_seat": "St. Leon-Rot",
      "details": "14.03.2025 (Bekanntmachungsdatum)\n\nBaden-Württemberg Amtsgericht Mannheim HRB 738555\nRegisterbekanntmachung nach dem Umwandlungsgesetz 14.03.2025 (Eintragungsdatum)\n\nSLR Holding GmbH\nGesellschaft mit beschränkter Haftung\nSt. Leon-Rot\n\nDen Gläubigern der an der Verschmelzung beteiligten Rechtsträger ist, wenn sie binnen sechs Monaten nach dem Tag, an dem die Eintragung der Verschmelzung in das Register des Sitzes desjenigen Rechtsträgers, dessen Gläubiger sie sind, nach § 19 Abs. 3 UmwG als bekanntgemacht gilt, ihren Anspruch nach Grund und Höhe schriftlich anmelden, Sicherheit zu leisten, soweit sie nicht Befriedigung verlangen können. Dieses Recht steht den Gläubigern jedoch nur zu, wenn sie glaubhaft machen, dass durch die Verschmelzung die Erfüllung ihrer Forderung gefährdet wird."
    },
    {
      "date": "2025-03-14",
      "id": "103789",
      "original_text": "Löschungsankündigung\nBaden-Württemberg Amtsgericht Stuttgart HRB 205455\nAGM - Rühle GmbH – Möglingen",
      "type": "Löschungsankündigung",
      "state": "Baden-Württemberg",
      "amtsgericht": "Amtsgericht Stuttgart",
      "registernummer": "HRB 205455",
      "registerart": "HRB",
      "company_name": "AGM - Rühle GmbH",
      "company_seat": "Möglingen",
      "details": "14.03.2025 (Bekanntmachungsdatum)\n\nBaden-Württemberg Amtsgericht Stuttgart HRB 205455\nLöschungsankündigung\n\nAGM - Rühle GmbH\nGesellschaft mit beschränkter Haftung\nMöglingen\n\nAls nicht eingetragen wird bekanntgemacht:\nDas Gericht beabsichtigt, die Gesellschaft wegen Vermögenslosigkeit im Handelsregister von Amts wegen nach § 394 FamFG zu löschen. Die Frist zur Geltendmachung eines Widerspruchs gegen die beabsichtigte Löschung ist auf zwei Monate ab Veröffentlichung bestimmt."
    },
    {
      "date": "2025-03-14",
      "id": "103790",
      "original_text": "Löschungsankündigung\nBaden-Württemberg Amtsgericht Mannheim HRA 705571\nLaViña UG (haftungsebschränkt) & Co. KG – Mannheim",
      "type": "Löschungsankündigung",
      "state": "Baden-Württemberg",
      "amtsgericht": "Amtsgericht Mannheim",
      "registernummer": "HRA 705571",
      "registerart": "HRA",
      "company_name": "LaViña UG (haftungsebschränkt) & Co. KG",
      "company_seat": "Mannheim",
      "details": "14.03.2025 (Bekanntmachungsdatum)\n\nBaden-Württemberg Amtsgericht Mannheim HRA 705571\nLöschungsankündigung\n\nLaViña UG (haftungsebschränkt) & Co. KG\nKommanditgesellschaft\nMannheim\n\nAls nicht eingetragen wird bekanntgemacht: Das Gericht beabsichtigt, die Gesellschaft wegen Vermögenslosigkeit im Handelsregister von Amts wegen nach § 394 FamFG zu löschen. Die Frist zur Geltendmachung eines Widerspruchs gegen die beabsichtigte Löschung ist auf einen Monat ab Veröffentlichung bestimmt."
    },
    {
      "date": "2025-03-14",
      "id": "103791",
      "original_text": "Registerbekanntmachung nach dem Umwandlungsgesetz\nBaden-Württemberg Amtsgericht Mannheim HRA 703724\nWildenauer Granit GmbH & Co KG – Bad Schönborn",
      "type": "Registerbekanntmachung nach dem Umwandlungsgesetz",
      "state": "Baden-Württemberg",
      "amtsgericht": "Amtsgericht Mannheim",
      "registernummer": "HRA 703724",
      "registerart": "HRA",
      "company_name": "Wildenauer Granit GmbH & Co KG",
      "company_seat": "Bad Schönborn",
      "details": "14.03.2025 (Bekanntmachungsdatum)\n\nBaden-Württemberg Amtsgericht Mannheim HRA 703724\nRegisterbekanntmachung nach dem Umwandlungsgesetz 14.03.2025 (Eintragungsdatum)\n\nWildenauer Granit GmbH & Co KG\nKommanditgesellschaft\nBad Schönborn\n\nAls nicht eingetragen wird bekanntgemacht:\nDen Gläubigern der an der Verschmelzung beteiligten Rechtsträger ist, wenn sie binnen sechs Monaten nach dem Tag, an dem die Eintragung der Verschmelzung in das Register des Sitzes desjenigen Rechtsträgers, dessen Gläubiger sie sind, nach § 19 Abs. 3 UmwG als bekanntgemacht gilt, ihren Anspruch nach Grund und Höhe schriftlich anmelden, Sicherheit zu leisten, soweit sie nicht Befriedigung verlangen können. Dieses Recht steht den Gläubigern jedoch nur zu, wenn sie glaubhaft machen, dass durch die Verschmelzung die Erfüllung ihrer Forderung gefährdet wird."
    },
    {
      "date": "2025-03-14",
      "id": "103792",
      "original_text": "Registerbekanntmachung nach dem Umwandlungsgesetz\nBaden-Württemberg Amtsgericht Mannheim HRB 714137\nBAW GmbH – Bad Schönborn",
      "type": "Registerbekanntmachung nach dem Umwandlungsgesetz",
      "state": "Baden-Württemberg",
      "amtsgericht": "Amtsgericht Mannheim",
      "registernummer": "HRB 714137",
      "registerart": "HRB",
      "company_name": "BAW GmbH",
      "company_seat": "Bad Schönborn",
      "details": "14.03.2025 (Bekanntmachungsdatum)\n\nBaden-Württemberg Amtsgericht Mannheim HRB 714137\nRegisterbekanntmachung nach dem Umwandlungsgesetz 14.03.2025 (Eintragungsdatum)\n\nBAW GmbH\nGesellschaft mit beschränkter Haftung\nBad Schönborn\n\nDen Gläubigern der an der Verschmelzung beteiligten Rechtsträger ist, wenn sie binnen sechs Monaten nach dem Tag, an dem die Eintragung der Verschmelzung in das Register des Sitzes desjenigen Rechtsträgers, dessen Gläubiger sie sind, nach § 19 Abs. 3 UmwG als bekanntgemacht gilt, ihren Anspruch nach Grund und Höhe schriftlich anmelden, Sicherheit zu leisten, soweit sie nicht Befriedigung verlangen können. Dieses Recht steht den Gläubigern jedoch nur zu, wenn sie glaubhaft machen, dass durch die Verschmelzung die Erfüllung ihrer Forderung gefährdet wird."
    },
    {
      "date": "2025-03-14",
      "id": "103793",
      "original_text": "Registerbekanntmachung nach dem Umwandlungsgesetz\nHamburg Amtsgericht Hamburg HRB 81872\nPort International Bananas GmbH – Hamburg",
      "type": "Registerbekanntmachung nach dem Umwandlungsgesetz",
      "state": "Hamburg",
      "amtsgericht": "Amtsgericht Hamburg",
      "registernummer": "HRB 81872",
      "registerart": "HRB",
      "company_name": "Port International Bananas GmbH",
      "company_seat": "Hamburg",
      "details": "14.03.2025 (Bekanntmachungsdatum)\n\nHamburg Amtsgericht Hamburg HRB 81872\nRegisterbekanntmachung nach dem Umwandlungsgesetz 14.03.2025 (Eintragungsdatum)\n\nPort International Bananas GmbH\nGesellschaft mit beschränkter Haftung\nHamburg\n\nAls nicht eingetragen wird bekannt gemacht:\nDen Gläubigern der an der Verschmelzung beteiligten Gesellschaften ist, wenn sie binnen sechs Monaten nach dem Tag, an dem die Eintragung der Verschmelzung in das Register des Sitzes desjenigen Rechtsträgers, dessen Gläubiger sie sind, nach § 19 Absatz 3 UmwG als bekannt gemacht gilt, ihren Anspruch nach Grund und Höhe schriftlich anmelden, Sicherheit zu leisten, soweit sie nicht Befriedigung verlangen können. Dieses Recht steht den Gläubigern jedoch nur zu, wenn sie glaubhaft machen, dass durch die Verschmelzung die Erfüllung ihrer Forderung gefährdet wird."
    },
    {
      "date": "2025-03-14",
      "id": "103794",
      "original_text": "Registerbekanntmachung nach dem Umwandlungsgesetz\nHamburg Amtsgericht Hamburg HRB 75131\nPort International Bananas GmbH – Hamburg",
      "type": "Registerbekanntmachung nach dem Umwandlungsgesetz",
      "state": "Hamburg",
      "amtsgericht": "Amtsgericht Hamburg",
      "registernummer": "HRB 75131",
      "registerart": "HRB",
      "company_name": "Port International Bananas GmbH",
      "company_seat": "Hamburg",
      "details": "14.03.2025 (Bekanntmachungsdatum)\n\nHamburg Amtsgericht Hamburg HRB 75131\nRegisterbekanntmachung nach dem Umwandlungsgesetz 14.03.2025 (Eintragungsdatum)\n\nPort International Bananas GmbH\nGesellschaft mit beschränkter Haftung\nHamburg\n\nAls nicht eingetragen wird bekannt gemacht:\nDen Gläubigern der an der Verschmelzung beteiligten Gesellschaften ist, wenn sie binnen sechs Monaten nach dem Tag, an dem die Eintragung der Verschmelzung in das Register des Sitzes desjenigen Rechtsträgers, dessen Gläubiger sie sind, nach § 19 Absatz 3 UmwG als bekannt gemacht gilt, ihren Anspruch nach Grund und Höhe schriftlich anmelden, Sicherheit zu leisten, soweit sie nicht Befriedigung verlangen können. Dieses Recht steht den Gläubigern jedoch nur zu, wenn sie glaubhaft machen, dass durch die Verschmelzung die Erfüllung ihrer Forderung gefährdet wird."
    },
    {
      "date": "2025-03-14",
      "id": "103795",
      "original_text": "Einreichung neuer Dokumente\nBaden-Württemberg Amtsgericht Freiburg HRB 260115\nWEHRLE-WERK Aktiengesellschaft – Emmendingen",
      "type": "Einreichung neuer Dokumente",
      "state": "Baden-Württemberg",
      "amtsgericht": "Amtsgericht Freiburg",
      "registernummer": "HRB 260115",
      "registerart": "HRB",
      "company_name": "WEHRLE-WERK Aktiengesellschaft",
      "company_seat": "Emmendingen",
      "details": "14.03.2025 (Bekanntmachungsdatum)\n\nBaden-Württemberg Amtsgericht Freiburg HRB 260115\nEinreichung neuer Dokumente 14.03.2025 (Eintragungsdatum)\n\nWEHRLE-WERK Aktiengesellschaft\nAktiengesellschaft\nEmmendingen\n\nAls nicht eingetragen wird bekanntgemacht:\nDie Gesellschaft hat am 12.03.2025 die Liste über die Zusammensetzung des Aufsichtsrats zum Handelsregister eingereicht."
    },
    {
      "date": "2025-03-14",
      "id": "103796",
      "original_text": "Löschungsankündigung\nBerlin Amtsgericht Berlin (Charlottenburg) HRB 171079\nPartoff UG (haftungsbeschränkt) – Berlin",
      "type": "Löschungsankündigung",
      "state": "Berlin",
      "amtsgericht": "Amtsgericht Berlin (Charlottenburg)",
      "registernummer": "HRB 171079",
      "registerart": "HRB",
      "company_name": "Partoff UG (haftungsbeschränkt)",
      "company_seat": "Berlin",
      "details": "14.03.2025 (Bekanntmachungsdatum)\n\nBerlin Amtsgericht Berlin (Charlottenburg) HRB 171079\nLöschungsankündigung\n\nPartoff UG (haftungsbeschränkt)\nGesellschaft mit beschränkter Haftung\nBerlin\n\nBei der nachstehenden Gesellschaft wird das Amtslöschungsverfahren gemäß § 394 FamFG eingeleitet. Widerspruchsfrist 6 Wochen"
    },
    {
      "date": "2025-03-14",
      "id": "103797",
      "original_text": "Registerbekanntmachung nach dem Umwandlungsgesetz\nBaden-Württemberg Amtsgericht Stuttgart HRB 795711\nVorauer Consulting GmbH – Nürtingen",
      "type": "Registerbekanntmachung nach dem Umwandlungsgesetz",
      "state": "Baden-Württemberg",
      "amtsgericht": "Amtsgericht Stuttgart",
      "registernummer": "HRB 795711",
      "registerart": "HRB",
      "company_name": "Vorauer Consulting GmbH",
      "company_seat": "Nürtingen",
      "details": "14.03.2025 (Bekanntmachungsdatum)\n\nBaden-Württemberg Amtsgericht Stuttgart HRB 795711\nRegisterbekanntmachung nach dem Umwandlungsgesetz 14.03.2025 (Eintragungsdatum)\n\nVorauer Consulting GmbH\nGesellschaft mit beschränkter Haftung\nNürtingen\n\nAls nicht eingetragen wird bekanntgemacht:\nDen Gläubigern der an der Ausgliederung beteiligten Rechtsträger ist, wenn sie binnen sechs Monaten nach dem Tag, an dem die Eintragung der Ausgliederung in das Register des Sitzes desjenigen Rechtsträgers, dessen Gläubiger sie sind, nach § 19 Abs. 3 UmwG als bekanntgemacht gilt, ihren Anspruch nach Grund und Höhe schriftlich anmelden, Sicherheit zu leisten, soweit sie nicht Befriedigung verlangen können. Dieses Recht steht den Gläubigern jedoch nur zu, wenn sie glaubhaft machen, dass durch die Ausgliederung die Erfüllung ihrer Forderung gefährdet wird."
    },
    {
      "date": "2025-03-14",
      "id": "103798",
      "original_text": "Registerbekanntmachung nach dem Umwandlungsgesetz\nBaden-Württemberg Amtsgericht Stuttgart HRA 741538\nJan Vorauer e.K. – Nürtingen",
      "type": "Registerbekanntmachung nach dem Umwandlungsgesetz",
      "state": "Baden-Württemberg",
      "amtsgericht": "Amtsgericht Stuttgart",
      "registernummer": "HRA 741538",
      "registerart": "HRA",
      "company_name": "Jan Vorauer e.K.",
      "company_seat": "Nürtingen",
      "details": "14.03.2025 (Bekanntmachungsdatum)\n\nBaden-Württemberg Amtsgericht Stuttgart HRA 741538\nRegisterbekanntmachung nach dem Umwandlungsgesetz 14.03.2025 (Eintragungsdatum)\n\nJan Vorauer e.K.\nEinzelkaufmann / Einzelkauffrau\nNürtingen\n\nDen Gläubigern der an der Ausgliederung beteiligten Rechtsträger ist, wenn sie binnen sechs Monaten nach dem Tag, an dem die Eintragung der Ausgliederung in das Register des Sitzes desjenigen Rechtsträgers, dessen Gläubiger sie sind, nach § 19 Abs. 3 UmwG als bekanntgemacht gilt, ihren Anspruch nach Grund und Höhe schriftlich anmelden, Sicherheit zu leisten, soweit sie nicht Befriedigung verlangen können. Dieses Recht steht den Gläubigern jedoch nur zu, wenn sie glaubhaft machen, dass durch die Ausgliederung die Erfüllung ihrer Forderung gefährdet wird."
    },
    {
      "date": "2025-03-14",
      "id": "103799",
      "original_text": "Sonstige Registerbekanntmachung\nBaden-Württemberg Amtsgericht Mannheim HRB 109937\nIntelligent Media Systems AG – Karlsruhe",
      "type": "Sonstige Registerbekanntmachung",
      "state": "Baden-Württemberg",
      "amtsgericht": "Amtsgericht Mannheim",
      "registernummer": "HRB 109937",
      "registerart": "HRB",
      "company_name": "Intelligent Media Systems AG",
      "company_seat": "Karlsruhe",
      "details": "14.03.2025 (Bekanntmachungsdatum)\n\nBaden-Württemberg Amtsgericht Mannheim HRB 109937\nSonstige Registerbekanntmachung 14.03.2025 (Eintragungsdatum)\n\nIntelligent Media Systems AG\nAktiengesellschaft\nKarlsruhe\n\nDie Gesellschaft hat am 10.01.2025 die Liste über die Zusammensetzung des Aufsichtsrats zum Handelsregister eingereicht."
    },
    {
      "date": "2025-03-14",
      "id": "103800",
      "original_text": "Sonstige Registerbekanntmachung\nBaden-Württemberg Amtsgericht Mannheim HRB 711246\nPro Concept Holding AG – Mannheim",
      "type": "Sonstige Registerbekanntmachung",
      "state": "Baden-Württemberg",
      "amtsgericht": "Amtsgericht Mannheim",
      "registernummer": "HRB 711246",
      "registerart": "HRB",
      "company_name": "Pro Concept Holding AG",
      "company_seat": "Mannheim",
      "details": "14.03.2025 (Bekanntmachungsdatum)\n\nBaden-Württemberg Amtsgericht Mannheim HRB 711246\nSonstige Registerbekanntmachung\n\nPro Concept Holding AG\nAktiengesellschaft\nMannheim\n\nDie Gesellschaft hat am 20.02.2025 die Liste über die Zusammensetzung des Aufsichtsrats zum Handelsregister eingereicht."
    },
    {
      "date": "2025-03-14",
      "id": "103801",
      "original_text": "Löschungsankündigung\nBerlin Amtsgericht Berlin (Charlottenburg) HRB 110759\nY.A.S. BAU GmbH – Berlin",
      "type": "Löschungsankündigung",
      "state": "Berlin",
      "amtsgericht": "Amtsgericht Berlin (Charlottenburg)",
      "registernummer": "HRB 110759",
      "registerart": "HRB",
      "company_name": "Y.A.S. BAU GmbH",
      "company_seat": "Berlin",
      "details": "14.03.2025 (Bekanntmachungsdatum)\n\nBerlin Amtsgericht Berlin (Charlottenburg) HRB 110759\nLöschungsankündigung\n\nY.A.S. BAU GmbH\nGesellschaft mit beschränkter Haftung\nBerlin\n\nBei der nachstehenden Gesellschaft wird das Amtslöschungsverfahren gemäß § 394 FamFG eingeleitet. Widerspruchsfrist 6 Wochen"
    },
    {
      "date": "2025-03-14",
      "id": "103802",
      "original_text": "Registerbekanntmachung nach dem Umwandlungsgesetz\nBaden-Württemberg Amtsgericht Freiburg HRB 724317\nVSI 344 Verwaltung von Schwimmbadimmobilien GmbH – Markdorf",
      "type": "Registerbekanntmachung nach dem Umwandlungsgesetz",
      "state": "Baden-Württemberg",
      "amtsgericht": "Amtsgericht Freiburg",
      "registernummer": "HRB 724317",
      "registerart": "HRB",
      "company_name": "VSI 344 Verwaltung von Schwimmbadimmobilien GmbH",
      "company_seat": "Markdorf",
      "details": "14.03.2025 (Bekanntmachungsdatum)\n\nBaden-Württemberg Amtsgericht Freiburg HRB 724317\nRegisterbekanntmachung nach dem Umwandlungsgesetz 14.03.2025 (Eintragungsdatum)\n\nVSI 344 Verwaltung von Schwimmbadimmobilien GmbH\nGesellschaft mit beschränkter Haftung\nMarkdorf\n\nAls nicht eingetragen wird bekanntgemacht:\nDen Gläubigern der an der Verschmelzung beteiligten Rechtsträger ist, wenn sie binnen sechs Monaten nach dem Tag, an dem die Eintragung der Verschmelzung in das Register des Sitzes desjenigen Rechtsträgers, dessen Gläubiger sie sind, nach § 19 Abs. 3 UmwG als bekanntgemacht gilt, ihren Anspruch nach Grund und Höhe schriftlich anmelden, Sicherheit zu leisten, soweit sie nicht Befriedigung verlangen können. Dieses Recht steht den Gläubigern jedoch nur zu, wenn sie glaubhaft machen, dass durch die Verschmelzung die Erfüllung ihrer Forderung gefährdet wird."
    },
    {
      "date": "2025-03-14",
      "id": "103803",
      "original_text": "Registerbekanntmachung nach dem Umwandlungsgesetz\nBaden-Württemberg Amtsgericht Ulm VR 720282\nWest-Ost-Gesellschaft Schwäbische Alb e.V. – Laichingen",
      "type": "Registerbekanntmachung nach dem Umwandlungsgesetz",
      "state": "Baden-Württemberg",
      "amtsgericht": "Amtsgericht Ulm",
      "registernummer": "VR 720282",
      "registerart": "VR",
      "company_name": "West-Ost-Gesellschaft Schwäbische Alb e.V.",
      "company_seat": "Laichingen",
      "details": "14.03.2025 (Bekanntmachungsdatum)\n\nBaden-Württemberg Amtsgericht Ulm VR 720282\nRegisterbekanntmachung nach dem Umwandlungsgesetz 14.03.2025 (Eintragungsdatum)\n\nWest-Ost-Gesellschaft Schwäbische Alb e.V.\neingetragener Verein\nLaichingen\n\nAls nicht eingetragen wird bekanntgemacht:\nDen Gläubigern der an der Verschmelzung beteiligten Rechtsträger ist, wenn sie binnen sechs Monaten nach dem Tag, an dem die Eintragung der Verschmelzung in das Register des Sitzes desjenigen Rechtsträgers, dessen Gläubiger sie sind, nach § 19 Abs. 3 UmwG als bekanntgemacht gilt, ihren Anspruch nach Grund und Höhe schriftlich anmelden, Sicherheit zu leisten, soweit sie nicht Befriedigung verlangen können. Dieses Recht steht den Gläubigern jedoch nur zu, wenn sie glaubhaft machen, dass durch die Verschmelzung die Erfüllung ihrer Forderung gefährdet wird."
    },
    {
      "date": "2025-03-14",
      "id": "103804",
      "original_text": "Löschungsankündigung\nBerlin Amtsgericht Berlin (Charlottenburg) HRB 223118\nBadfish Barbers UG (haftungsbeschränkt) – Berlin",
      "type": "Löschungsankündigung",
      "state": "Berlin",
      "amtsgericht": "Amtsgericht Berlin (Charlottenburg)",
      "registernummer": "HRB 223118",
      "registerart": "HRB",
      "company_name": "Badfish Barbers UG (haftungsbeschränkt)",
      "company_seat": "Berlin",
      "details": "14.03.2025 (Bekanntmachungsdatum)\n\nBerlin Amtsgericht Berlin (Charlottenburg) HRB 223118\nLöschungsankündigung\n\nBadfish Barbers UG (haftungsbeschränkt)\nGesellschaft mit beschränkter Haftung\nBerlin\n\nBei der nachstehenden Gesellschaft wird das Amtslöschungsverfahren gemäß § 394 FamFG eingeleitet. Widerspruchsfrist 6 Wochen"
    },
    {
      "date": "2025-03-14",
      "id": "103805",
      "original_text": "Löschungsankündigung\nBerlin Amtsgericht Berlin (Charlottenburg) HRA 50099\nMiethner GmbH & Co. Grundbesitz KG – Berlin",
      "type": "Löschungsankündigung",
      "state": "Berlin",
      "amtsgericht": "Amtsgericht Berlin (Charlottenburg)",
      "registernummer": "HRA 50099",
      "registerart": "HRA",
      "company_name": "Miethner GmbH & Co. Grundbesitz KG",
      "company_seat": "Berlin",
      "details": "14.03.2025 (Bekanntmachungsdatum)\n\nBerlin Amtsgericht Berlin (Charlottenburg) HRA 50099\nLöschungsankündigung\n\nMiethner GmbH & Co. Grundbesitz KG\nKommanditgesellschaft\nBerlin\n\nBei dem nachstehenden Unternehmen / der nachstehenden Gesellschaft wird das Amtslöschungsverfahren gemäß § 31 Abs. 2 HGB eingeleitet. Widerspruchsfrist 2 Monate"
    },
    {
      "date": "2025-03-14",
      "id": "103806",
      "original_text": "Löschungsankündigung\nBerlin Amtsgericht Berlin (Charlottenburg) HRB 193200\nSicherungstechnik für Automobilservice und Rallyesport SAR Berlin UG (haftungsbeschränkt) – Berlin",
      "type": "Löschungsankündigung",
      "state": "Berlin",
      "amtsgericht": "Amtsgericht Berlin (Charlottenburg)",
      "registernummer": "HRB 193200",
      "registerart": "HRB",
      "company_name": "Sicherungstechnik für Automobilservice und Rallyesport SAR Berlin UG (haftungsbeschränkt)",
      "company_seat": "Berlin",
      "details": "14.03.2025 (Bekanntmachungsdatum)\n\nBerlin Amtsgericht Berlin (Charlottenburg) HRB 193200\nLöschungsankündigung\n\nSicherungstechnik für Automobilservice und Rallyesport SAR Berlin UG (haftungsbeschränkt)\nGesellschaft mit beschränkter Haftung\nBerlin\n\nBei der nachstehenden Gesellschaft wird das Amtslöschungsverfahren gemäß § 394 FamFG eingeleitet. Widerspruchsfrist 6 Wochen"
    },
    {
      "date": "2025-03-14",
      "id": "103807",
      "original_text": "Löschungsankündigung\nThüringen Amtsgericht Jena HRB 206642\nISS Innovative Schweiß- und Schneidtechnik GmbH – Laasdorf",
      "type": "Löschungsankündigung",
      "state": "Thüringen",
      "amtsgericht": "Amtsgericht Jena",
      "registernummer": "HRB 206642",
      "registerart": "HRB",
      "company_name": "ISS Innovative Schweiß- und Schneidtechnik GmbH",
      "company_seat": "Laasdorf",
      "details": "14.03.2025 (Bekanntmachungsdatum)\n\nThüringen Amtsgericht Jena HRB 206642\nLöschungsankündigung\n\nISS Innovative Schweiß- und Schneidtechnik GmbH\nGesellschaft mit beschränkter Haftung\nLaasdorf\n\nDas Registergericht beabsichtigt, die im Handelsregister eingetragene Gesellschaft wegen Vermögenslosigkeit nach § 394 FamFG von Amts wegen zu löschen. Die Frist zur Erhebung eines Widerspruchs gegen die beabsichtigte Löschung wird auf 6 Wochen festgesetzt."
    },
    {
      "date": "2025-03-14",
      "id": "103808",
      "original_text": "Registerbekanntmachung nach dem Umwandlungsgesetz\nBrandenburg Amtsgericht Potsdam HRB 29076\nXin Lue Investment GmbH – Teltow",
      "type": "Registerbekanntmachung nach dem Umwandlungsgesetz",
      "state": "Brandenburg",
      "amtsgericht": "Amtsgericht Potsdam",
      "registernummer": "HRB 29076",
      "registerart": "HRB",
      "company_name": "Xin Lue Investment GmbH",
      "company_seat": "Teltow",
      "details": "14.03.2025 (Bekanntmachungsdatum)\n\nBrandenburg Amtsgericht Potsdam HRB 29076\nRegisterbekanntmachung nach dem Umwandlungsgesetz 14.03.2025 (Eintragungsdatum)\n\nXin Lue Investment GmbH\nGesellschaft mit beschränkter Haftung\nTeltow\n\nZu Eintragungsnummer 3 vom 14.03.2025 wird als nicht eingetragen veröffentlicht: Den Gläubigern der am Formwechsel beteiligten Rechtsträger ist, wenn sie binnen sechs Monaten nach dem Tag, an dem die Eintragung des Formwechsels nach § 201 UmwG  als bekannt gemacht gilt, ihren Anspruch nach Grund und Höhe schriftlich anmelden, Sicherheit zu leisten, soweit sie nicht Befriedigung erlangen können. Dieses Recht steht den Gläubigern jedoch nur zu, wenn sie glaubhaft machen, dass durch den Formwechsel die Erfüllung ihrer Forderung gefährdet wird."
    },
    {
      "date": "2025-03-14",
      "id": "103809",
      "original_text": "Sonstige Registerbekanntmachung\nHamburg Amtsgericht Hamburg HRB 90627\nZINDEL AG - Technische Dokumentation und Multimedia – Hamburg",
      "type": "Sonstige Registerbekanntmachung",
      "state": "Hamburg",
      "amtsgericht": "Amtsgericht Hamburg",
      "registernummer": "HRB 90627",
      "registerart": "HRB",
      "company_name": "ZINDEL AG - Technische Dokumentation und Multimedia",
      "company_seat": "Hamburg",
      "details": "14.03.2025 (Bekanntmachungsdatum)\n\nHamburg Amtsgericht Hamburg HRB 90627\nSonstige Registerbekanntmachung\n\nZINDEL AG - Technische Dokumentation und Multimedia\nAktiengesellschaft\nHamburg\n\nAls nicht eingetragen wird bekannt gemacht: Liste des Aufsichtsrats wurde eingereicht."
    },
    {
      "date": "2025-03-14",
      "id": "103810",
      "original_text": "Registerbekanntmachung nach dem Umwandlungsgesetz\nHamburg Amtsgericht Hamburg HRB 114680\nLabor Hamburg-Lübeck MVZ GmbH – Hamburg",
      "type": "Registerbekanntmachung nach dem Umwandlungsgesetz",
      "state": "Hamburg",
      "amtsgericht": "Amtsgericht Hamburg",
      "registernummer": "HRB 114680",
      "registerart": "HRB",
      "company_name": "Labor Hamburg-Lübeck MVZ GmbH",
      "company_seat": "Hamburg",
      "details": "14.03.2025 (Bekanntmachungsdatum)\n\nHamburg Amtsgericht Hamburg HRB 114680\nRegisterbekanntmachung nach dem Umwandlungsgesetz 14.03.2025 (Eintragungsdatum)\n\nLabor Hamburg-Lübeck MVZ GmbH\nGesellschaft mit beschränkter Haftung\nHamburg\n\nAls nicht eingetragen wird bekannt gemacht:\nDen Gläubigern der an der Verschmelzung beteiligten Gesellschaften ist, wenn sie binnen sechs Monaten nach dem Tag, an dem die Eintragung der Verschmelzung in das Register des Sitzes desjenigen Rechtsträgers, dessen Gläubiger sie sind, nach § 19 Absatz 3 UmwG als bekannt gemacht gilt, ihren Anspruch nach Grund und Höhe schriftlich anmelden, Sicherheit zu leisten, soweit sie nicht Befriedigung verlangen können. Dieses Recht steht den Gläubigern jedoch nur zu, wenn sie glaubhaft machen, dass durch die Verschmelzung die Erfüllung ihrer Forderung gefährdet wird."
    },
    {
      "date": "2025-03-14",
      "id": "103811",
      "original_text": "Registerbekanntmachung nach dem Umwandlungsgesetz\nHamburg Amtsgericht Hamburg HRB 108320\nMVZ Medizinisches Labor Nord MLN GmbH – Hamburg",
      "type": "Registerbekanntmachung nach dem Umwandlungsgesetz",
      "state": "Hamburg",
      "amtsgericht": "Amtsgericht Hamburg",
      "registernummer": "HRB 108320",
      "registerart": "HRB",
      "company_name": "MVZ Medizinisches Labor Nord MLN GmbH",
      "company_seat": "Hamburg",
      "details": "14.03.2025 (Bekanntmachungsdatum)\n\nHamburg Amtsgericht Hamburg HRB 108320\nRegisterbekanntmachung nach dem Umwandlungsgesetz 14.03.2025 (Eintragungsdatum)\n\nMVZ Medizinisches Labor Nord MLN GmbH\nGesellschaft mit beschränkter Haftung\nHamburg\n\nAls nicht eingetragen wird bekannt gemacht:\nDen Gläubigern der an der Verschmelzung beteiligten Gesellschaften ist, wenn sie binnen sechs Monaten nach dem Tag, an dem die Eintragung der Verschmelzung in das Register des Sitzes desjenigen Rechtsträgers, dessen Gläubiger sie sind, nach § 19 Absatz 3 UmwG als bekannt gemacht gilt, ihren Anspruch nach Grund und Höhe schriftlich anmelden, Sicherheit zu leisten, soweit sie nicht Befriedigung verlangen können. Dieses Recht steht den Gläubigern jedoch nur zu, wenn sie glaubhaft machen, dass durch die Verschmelzung die Erfüllung ihrer Forderung gefährdet wird."
    },
    {
      "date": "2025-03-14",
      "id": "103812",
      "original_text": "Registerbekanntmachung nach dem Umwandlungsgesetz\nSchleswig-Holstein Amtsgericht Kiel HRB 26609\nErgasia GmbH – Neumünster",
      "type": "Registerbekanntmachung nach dem Umwandlungsgesetz",
      "state": "Schleswig-Holstein",
      "amtsgericht": "Amtsgericht Kiel",
      "registernummer": "HRB 26609",
      "registerart": "HRB",
      "company_name": "Ergasia GmbH",
      "company_seat": "Neumünster",
      "details": "14.03.2025 (Bekanntmachungsdatum)\n\nSchleswig-Holstein Amtsgericht Kiel HRB 26609\nRegisterbekanntmachung nach dem Umwandlungsgesetz 14.03.2025 (Eintragungsdatum)\n\nErgasia GmbH\nGesellschaft mit beschränkter Haftung\nNeumünster\n\nZu Eintragungsnummer 3 vom 14.03.2025 wird als nicht eingetragen veröffentlicht: Den Gläubigern der an der Verschmelzung beteiligten Rechtsträger ist, wenn sie binnen sechs Monaten nach dem Tag, an dem die Eintragung der Verschmelzung in das Register des Sitzes desjenigen Rechtsträgers, dessen Gläubiger sie sind, nach § 19 Abs. 3 UmwG bekannt gemacht worden ist, ihren Anspruch nach Grund und Höhe schriftlich anmelden, Sicherheit zu leisten, soweit sie nicht Befriedigung verlangen können. Dieses Recht steht den Gläubigern jedoch nur zu, wenn sie glaubhaft machen, dass durch die Verschmelzung die Erfüllung ihrer Forderung gefährdet wird."
    },
    {
      "date": "2025-03-14",
      "id": "103813",
      "original_text": "Registerbekanntmachung nach dem Umwandlungsgesetz\nBerlin Amtsgericht Berlin (Charlottenburg) HRB 168861\nAZH Holding GmbH – Berlin",
      "type": "Registerbekanntmachung nach dem Umwandlungsgesetz",
      "state": "Berlin",
      "amtsgericht": "Amtsgericht Berlin (Charlottenburg)",
      "registernummer": "HRB 168861",
      "registerart": "HRB",
      "company_name": "AZH Holding GmbH",
      "company_seat": "Berlin",
      "details": "14.03.2025 (Bekanntmachungsdatum)\n\nBerlin Amtsgericht Berlin (Charlottenburg) HRB 168861\nRegisterbekanntmachung nach dem Umwandlungsgesetz 14.03.2025 (Eintragungsdatum)\n\nAZH Holding GmbH\nGesellschaft mit beschränkter Haftung\nBerlin\n\nZu Eintragungsnummer 7 vom 14.03.2025 wird als nicht eingetragen veröffentlicht: Den Gläubigern der an der Verschmelzung beteiligten Rechtsträger ist, wenn sie binnen sechs Monaten nach dem Tag, an dem die Eintragung der Verschmelzung in das Register des Sitzes desjenigen Rechtsträgers, dessen Gläubiger sie sind, als bekannt gemacht gilt, ihren Anspruch nach Grund und Höhe schriftlich anmelden, Sicherheit zu leisten, soweit sie nicht Befriedigung verlangen können. Dieses Recht steht den Gläubigern jedoch nur zu, wenn sie glaubhaft machen, dass durch die Verschmelzung die Erfüllung ihrer Forderung gefährdet wird. Das Recht, Sicherheitsleistung zu verlangen, steht Gläubigern nicht zu, die im Falle der Insolvenz ein Recht auf vorzugsweise Befriedigung aus einer Deckungsmasse haben, die nach gesetzlicher Vorschrift zu ihrem Schutz errichtet und staatlich überwacht ist."
    },
    {
      "date": "2025-03-14",
      "id": "103814",
      "original_text": "Registerbekanntmachung nach dem Umwandlungsgesetz\nBerlin Amtsgericht Berlin (Charlottenburg) HRB 172627\nAZH Lindenplatz 2 GmbH – Berlin",
      "type": "Registerbekanntmachung nach dem Umwandlungsgesetz",
      "state": "Berlin",
      "amtsgericht": "Amtsgericht Berlin (Charlottenburg)",
      "registernummer": "HRB 172627",
      "registerart": "HRB",
      "company_name": "AZH Lindenplatz 2 GmbH",
      "company_seat": "Berlin",
      "details": "14.03.2025 (Bekanntmachungsdatum)\n\nBerlin Amtsgericht Berlin (Charlottenburg) HRB 172627\nRegisterbekanntmachung nach dem Umwandlungsgesetz 14.03.2025 (Eintragungsdatum)\n\nAZH Lindenplatz 2 GmbH\nGesellschaft mit beschränkter Haftung\nBerlin\n\nZu Eintragungsnummer 5 vom 14.03.2025 wird als nicht eingetragen veröffentlicht: Den Gläubigern der an der Verschmelzung beteiligten Rechtsträger ist, wenn sie binnen sechs Monaten nach dem Tag, an dem die Eintragung der Verschmelzung in das Register des Sitzes desjenigen Rechtsträgers, dessen Gläubiger sie sind, als bekannt gemacht gilt, ihren Anspruch nach Grund und Höhe schriftlich anmelden, Sicherheit zu leisten, soweit sie nicht Befriedigung verlangen können. Dieses Recht steht den Gläubigern jedoch nur zu, wenn sie glaubhaft machen, dass durch die Verschmelzung die Erfüllung ihrer Forderung gefährdet wird. Das Recht, Sicherheitsleistung zu verlangen, steht Gläubigern nicht zu, die im Falle der Insolvenz ein Recht auf vorzugsweise Befriedigung aus einer Deckungsmasse haben, die nach gesetzlicher Vorschrift zu ihrem Schutz errichtet und staatlich überwacht ist."
    },
    {
      "date": "2025-03-14",
      "id": "103815",
      "original_text": "Löschungsankündigung\nHamburg Amtsgericht Hamburg HRB 49523\nSauna & Solarien Vertrieb K.H. Kiehn GmbH – Hamburg",
      "type": "Löschungsankündigung",
      "state": "Hamburg",
      "amtsgericht": "Amtsgericht Hamburg",
      "registernummer": "HRB 49523",
      "registerart": "HRB",
      "company_name": "Sauna & Solarien Vertrieb K.H. Kiehn GmbH",
      "company_seat": "Hamburg",
      "details": "14.03.2025 (Bekanntmachungsdatum)\n\nHamburg Amtsgericht Hamburg HRB 49523\nLöschungsankündigung\n\nSauna & Solarien Vertrieb K.H. Kiehn GmbH\nGesellschaft mit beschränkter Haftung\nHamburg\n\nDas Registergericht beabsichtigt, die im Handelsregister eingetragene Gesellschaft von Amts wegen nach § 394 FamFG zu löschen. Die Frist zur Erhebung eines Widerspruchs gegen die beabsichtigte Löschung wird auf 3 Monate festgesetzt."
    },
    {
      "date": "2025-03-14",
      "id": "103816",
      "original_text": "Löschungsankündigung\nHamburg Amtsgericht Hamburg HRB 150906\nAlles ist Eins GmbH – Hamburg",
      "type": "Löschungsankündigung",
      "state": "Hamburg",
      "amtsgericht": "Amtsgericht Hamburg",
      "registernummer": "HRB 150906",
      "registerart": "HRB",
      "company_name": "Alles ist Eins GmbH",
      "company_seat": "Hamburg",
      "details": "14.03.2025 (Bekanntmachungsdatum)\n\nHamburg Amtsgericht Hamburg HRB 150906\nLöschungsankündigung\n\nAlles ist Eins GmbH\nGesellschaft mit beschränkter Haftung\nHamburg\n\nDas Registergericht beabsichtigt, die im Handelsregister eingetragene Gesellschaft von Amts wegen nach § 394 FamFG zu löschen. Die Frist zur Erhebung eines Widerspruchs gegen die beabsichtigte Löschung wird auf 3 Monate festgesetzt."
    },
    {
      "date": "2025-03-14",
      "id": "103817",
      "original_text": "Löschungsankündigung\nHamburg Amtsgericht Hamburg HRB 163404\nOptimum-PlanBau GmbH – Hamburg",
      "type": "Löschungsankündigung",
      "state": "Hamburg",
      "amtsgericht": "Amtsgericht Hamburg",
      "registernummer": "HRB 163404",
      "registerart": "HRB",
      "company_name": "Optimum-PlanBau GmbH",
      "company_seat": "Hamburg",
      "details": "14.03.2025 (Bekanntmachungsdatum)\n\nHamburg Amtsgericht Hamburg HRB 163404\nLöschungsankündigung\n\nOptimum-PlanBau GmbH\nGesellschaft mit beschränkter Haftung\nHamburg\n\nDas Registergericht beabsichtigt, die im Handelsregister eingetragene Gesellschaft von Amts wegen nach § 394 FamFG zu löschen. Die Frist zur Erhebung eines Widerspruchs gegen die beabsichtigte Löschung wird auf 3 Monate festgesetzt."
    },
    {
      "date": "2025-03-14",
      "id": "103818",
      "original_text": "Löschungsankündigung\nHamburg Amtsgericht Hamburg HRB 166576\nCalitè Logistik GmbH – Hamburg",
      "type": "Löschungsankündigung",
      "state": "Hamburg",
      "amtsgericht": "Amtsgericht Hamburg",
      "registernummer": "HRB 166576",
      "registerart": "HRB",
      "company_name": "Calitè Logistik GmbH",
      "company_seat": "Hamburg",
      "details": "14.03.2025 (Bekanntmachungsdatum)\n\nHamburg Amtsgericht Hamburg HRB 166576\nLöschungsankündigung\n\nCalitè Logistik GmbH\nGesellschaft mit beschränkter Haftung\nHamburg\n\nDas Registergericht beabsichtigt, die im Handelsregister eingetragene Gesellschaft von Amts wegen nach § 394 FamFG zu löschen. Die Frist zur Erhebung eines Widerspruchs gegen die beabsichtigte Löschung wird auf 3 Monate festgesetzt."
    },
    {
      "date": "2025-03-14",
      "id": "103819",
      "original_text": "Löschungsankündigung\nHamburg Amtsgericht Hamburg HRB 172326\nML Bauservice GmbH – Hamburg",
      "type": "Löschungsankündigung",
      "state": "Hamburg",
      "amtsgericht": "Amtsgericht Hamburg",
      "registernummer": "HRB 172326",
      "registerart": "HRB",
      "company_name": "ML Bauservice GmbH",
      "company_seat": "Hamburg",
      "details": "14.03.2025 (Bekanntmachungsdatum)\n\nHamburg Amtsgericht Hamburg HRB 172326\nLöschungsankündigung\n\nML Bauservice GmbH\nGesellschaft mit beschränkter Haftung\nHamburg\n\nDas Registergericht beabsichtigt, die im Handelsregister eingetragene Gesellschaft von Amts wegen nach § 394 FamFG zu löschen. Die Frist zur Erhebung eines Widerspruchs gegen die beabsichtigte Löschung wird auf 3 Monate festgesetzt."
    },
    {
      "date": "2025-03-14",
      "id": "103820",
      "original_text": "Löschungsankündigung\nHamburg Amtsgericht Hamburg HRB 36361\nMEDIACOMM Gesellschaft für Verkaufsförderung und Medien-Kommunikation mbH – Hamburg",
      "type": "Löschungsankündigung",
      "state": "Hamburg",
      "amtsgericht": "Amtsgericht Hamburg",
      "registernummer": "HRB 36361",
      "registerart": "HRB",
      "company_name": "MEDIACOMM Gesellschaft für Verkaufsförderung und Medien-Kommunikation mbH",
      "company_seat": "Hamburg",
      "details": "14.03.2025 (Bekanntmachungsdatum)\n\nHamburg Amtsgericht Hamburg HRB 36361\nLöschungsankündigung\n\nMEDIACOMM Gesellschaft für Verkaufsförderung und Medien-Kommunikation mbH\nGesellschaft mit beschränkter Haftung\nHamburg\n\nDas Registergericht beabsichtigt, die im Handelsregister eingetragene Gesellschaft von Amts wegen nach § 394 FamFG zu löschen. Die Frist zur Erhebung eines Widerspruchs gegen die beabsichtigte Löschung wird auf 3 Monate festgesetzt."
    },
    {
      "date": "2025-03-14",
      "id": "103821",
      "original_text": "Löschungsankündigung\nHamburg Amtsgericht Hamburg HRB 125746\nTheseus Digital Verwaltungs-Gesellschaft mbH – Hamburg",
      "type": "Löschungsankündigung",
      "state": "Hamburg",
      "amtsgericht": "Amtsgericht Hamburg",
      "registernummer": "HRB 125746",
      "registerart": "HRB",
      "company_name": "Theseus Digital Verwaltungs-Gesellschaft mbH",
      "company_seat": "Hamburg",
      "details": "14.03.2025 (Bekanntmachungsdatum)\n\nHamburg Amtsgericht Hamburg HRB 125746\nLöschungsankündigung\n\nTheseus Digital Verwaltungs-Gesellschaft mbH\nGesellschaft mit beschränkter Haftung\nHamburg\n\nDas Registergericht beabsichtigt, die im Handelsregister eingetragene Gesellschaft von Amts wegen nach § 394 FamFG zu löschen. Die Frist zur Erhebung eines Widerspruchs gegen die beabsichtigte Löschung wird auf 3 Monate festgesetzt."
    },
    {
      "date": "2025-03-14",
      "id": "103822",
      "original_text": "Löschungsankündigung\nHamburg Amtsgericht Hamburg HRB 151104\nMED BAU GmbH – Hamburg",
      "type": "Löschungsankündigung",
      "state": "Hamburg",
      "amtsgericht": "Amtsgericht Hamburg",
      "registernummer": "HRB 151104",
      "registerart": "HRB",
      "company_name": "MED BAU GmbH",
      "company_seat": "Hamburg",
      "details": "14.03.2025 (Bekanntmachungsdatum)\n\nHamburg Amtsgericht Hamburg HRB 151104\nLöschungsankündigung\n\nMED BAU GmbH\nGesellschaft mit beschränkter Haftung\nHamburg\n\nDas Registergericht beabsichtigt, die im Handelsregister eingetragene Gesellschaft von Amts wegen nach § 394 FamFG zu löschen. Die Frist zur Erhebung eines Widerspruchs gegen die beabsichtigte Löschung wird auf 3 Monate festgesetzt."
    },
    {
      "date": "2025-03-14",
      "id": "103823",
      "original_text": "Löschungsankündigung\nHamburg Amtsgericht Hamburg HRB 164086\nNWCrew GmbH – Hamburg",
      "type": "Löschungsankündigung",
      "state": "Hamburg",
      "amtsgericht": "Amtsgericht Hamburg",
      "registernummer": "HRB 164086",
      "registerart": "HRB",
      "company_name": "NWCrew GmbH",
      "company_seat": "Hamburg",
      "details": "14.03.2025 (Bekanntmachungsdatum)\n\nHamburg Amtsgericht Hamburg HRB 164086\nLöschungsankündigung\n\nNWCrew GmbH\nGesellschaft mit beschränkter Haftung\nHamburg\n\nDas Registergericht beabsichtigt, die im Handelsregister eingetragene Gesellschaft von Amts wegen nach § 394 FamFG zu löschen. Die Frist zur Erhebung eines Widerspruchs gegen die beabsichtigte Löschung wird auf 3 Monate festgesetzt."
    },
    {
      "date": "2025-03-14",
      "id": "103824",
      "original_text": "Löschungsankündigung\nHamburg Amtsgericht Hamburg HRB 167634\nRF Dienstleistungen GmbH – Hamburg",
      "type": "Löschungsankündigung",
      "state": "Hamburg",
      "amtsgericht": "Amtsgericht Hamburg",
      "registernummer": "HRB 167634",
      "registerart": "HRB",
      "company_name": "RF Dienstleistungen GmbH",
      "company_seat": "Hamburg",
      "details": "14.03.2025 (Bekanntmachungsdatum)\n\nHamburg Amtsgericht Hamburg HRB 167634\nLöschungsankündigung\n\nRF Dienstleistungen GmbH\nGesellschaft mit beschränkter Haftung\nHamburg\n\nDas Registergericht beabsichtigt, die im Handelsregister eingetragene Gesellschaft von Amts wegen nach § 394 FamFG zu löschen. Die Frist zur Erhebung eines Widerspruchs gegen die beabsichtigte Löschung wird auf 3 Monate festgesetzt."
    },
    {
      "date": "2025-03-14",
      "id": "103825",
      "original_text": "Löschungsankündigung\nHamburg Amtsgericht Hamburg HRB 172915\nLU & NO Hamburg GmbH – Hamburg",
      "type": "Löschungsankündigung",
      "state": "Hamburg",
      "amtsgericht": "Amtsgericht Hamburg",
      "registernummer": "HRB 172915",
      "registerart": "HRB",
      "company_name": "LU & NO Hamburg GmbH",
      "company_seat": "Hamburg",
      "details": "14.03.2025 (Bekanntmachungsdatum)\n\nHamburg Amtsgericht Hamburg HRB 172915\nLöschungsankündigung\n\nLU & NO Hamburg GmbH\nGesellschaft mit beschränkter Haftung\nHamburg\n\nDas Registergericht beabsichtigt, die im Handelsregister eingetragene Gesellschaft von Amts wegen nach § 394 FamFG zu löschen. Die Frist zur Erhebung eines Widerspruchs gegen die beabsichtigte Löschung wird auf 3 Monate festgesetzt."
    },
    {
      "date": "2025-03-14",
      "id": "103826",
      "original_text": "Löschungsankündigung\nHamburg Amtsgericht Hamburg HRB 176551\nSP-Dachtechnik GmbH – Hamburg",
      "type": "Löschungsankündigung",
      "state": "Hamburg",
      "amtsgericht": "Amtsgericht Hamburg",
      "registernummer": "HRB 176551",
      "registerart": "HRB",
      "company_name": "SP-Dachtechnik GmbH",
      "company_seat": "Hamburg",
      "details": "14.03.2025 (Bekanntmachungsdatum)\n\nHamburg Amtsgericht Hamburg HRB 176551\nLöschungsankündigung\n\nSP-Dachtechnik GmbH\nGesellschaft mit beschränkter Haftung\nHamburg\n\nDas Registergericht beabsichtigt, die im Handelsregister eingetragene Gesellschaft von Amts wegen nach § 394 FamFG zu löschen. Die Frist zur Erhebung eines Widerspruchs gegen die beabsichtigte Löschung wird auf 3 Monate festgesetzt."
    },
    {
      "date": "2025-03-14",
      "id": "103827",
      "original_text": "Löschungsankündigung\nHamburg Amtsgericht Hamburg HRB 179618\nTE Bauleistungen UG (haftungsbeschränkt) – Hamburg",
      "type": "Löschungsankündigung",
      "state": "Hamburg",
      "amtsgericht": "Amtsgericht Hamburg",
      "registernummer": "HRB 179618",
      "registerart": "HRB",
      "company_name": "TE Bauleistungen UG (haftungsbeschränkt)",
      "company_seat": "Hamburg",
      "details": "14.03.2025 (Bekanntmachungsdatum)\n\nHamburg Amtsgericht Hamburg HRB 179618\nLöschungsankündigung\n\nTE Bauleistungen UG (haftungsbeschränkt)\nGesellschaft mit beschränkter Haftung\nHamburg\n\nDas Registergericht beabsichtigt, die im Handelsregister eingetragene Gesellschaft von Amts wegen nach § 394 FamFG zu löschen. Die Frist zur Erhebung eines Widerspruchs gegen die beabsichtigte Löschung wird auf 3 Monate festgesetzt."
    },
    {
      "date": "2025-03-14",
      "id": "103828",
      "original_text": "Löschungsankündigung\nHamburg Amtsgericht Hamburg HRA 92306\nfootprint e.K. – Hamburg",
      "type": "Löschungsankündigung",
      "state": "Hamburg",
      "amtsgericht": "Amtsgericht Hamburg",
      "registernummer": "HRA 92306",
      "registerart": "HRA",
      "company_name": "footprint e.K.",
      "company_seat": "Hamburg",
      "details": "14.03.2025 (Bekanntmachungsdatum)\n\nHamburg Amtsgericht Hamburg HRA 92306\nLöschungsankündigung\n\nfootprint e.K.\nEinzelkaufmann\nHamburg\n\nDas Registergericht beabsichtigt, die im Handelsregister eingetragene Firma von Amts wegen nach § 31 Abs. 2 HGB zu löschen. Die Frist zur Erhebung eines Widerspruchs gegen die beabsichtigte Löschung wird auf 3 Monate festgesetzt."
    },
    {
      "date": "2025-03-14",
      "id": "103829",
      "original_text": "Löschungsankündigung\nHamburg Amtsgericht Hamburg HRB 177310\nRSG Network GMBH – Hamburg",
      "type": "Löschungsankündigung",
      "state": "Hamburg",
      "amtsgericht": "Amtsgericht Hamburg",
      "registernummer": "HRB 177310",
      "registerart": "HRB",
      "company_name": "RSG Network GMBH",
      "company_seat": "Hamburg",
      "details": "14.03.2025 (Bekanntmachungsdatum)\n\nHamburg Amtsgericht Hamburg HRB 177310\nLöschungsankündigung\n\nRSG Network GMBH\nGesellschaft mit beschränkter Haftung\nHamburg\n\nDas Registergericht beabsichtigt, die im Handelsregister eingetragene Gesellschaft von Amts wegen nach § 394 FamFG zu löschen. Die Frist zur Erhebung eines Widerspruchs gegen die beabsichtigte Löschung wird auf 3 Monate festgesetzt."
    },
    {
      "date": "2025-03-14",
      "id": "103830",
      "original_text": "Löschungsankündigung\nHamburg Amtsgericht Hamburg HRB 182590\nNord Global GmbH – Hamburg",
      "type": "Löschungsankündigung",
      "state": "Hamburg",
      "amtsgericht": "Amtsgericht Hamburg",
      "registernummer": "HRB 182590",
      "registerart": "HRB",
      "company_name": "Nord Global GmbH",
      "company_seat": "Hamburg",
      "details": "14.03.2025 (Bekanntmachungsdatum)\n\nHamburg Amtsgericht Hamburg HRB 182590\nLöschungsankündigung\n\nNord Global GmbH\nGesellschaft mit beschränkter Haftung\nHamburg\n\nDas Registergericht beabsichtigt, die im Handelsregister eingetragene Gesellschaft von Amts wegen nach § 394 FamFG zu löschen. Die Frist zur Erhebung eines Widerspruchs gegen die beabsichtigte Löschung wird auf 3 Monate festgesetzt."
    },
    {
      "date": "2025-03-14",
      "id": "103831",
      "original_text": "Löschungsankündigung\nHamburg Amtsgericht Hamburg HRA 93547\nBATO Europa GmbH & Co. KG – Hamburg",
      "type": "Löschungsankündigung",
      "state": "Hamburg",
      "amtsgericht": "Amtsgericht Hamburg",
      "registernummer": "HRA 93547",
      "registerart": "HRA",
      "company_name": "BATO Europa GmbH & Co. KG",
      "company_seat": "Hamburg",
      "details": "14.03.2025 (Bekanntmachungsdatum)\n\nHamburg Amtsgericht Hamburg HRA 93547\nLöschungsankündigung\n\nBATO Europa GmbH & Co. KG\nKommanditgesellschaft\nHamburg\n\nDas Registergericht beabsichtigt, die im Handelsregister eingetragene Firma von Amts wegen nach § 31 Abs. 2 HGB zu löschen. Die Frist zur Erhebung eines Widerspruchs gegen die beabsichtigte Löschung wird auf 3 Monate festgesetzt."
    },
    {
      "date": "2025-03-14",
      "id": "103832",
      "original_text": "Löschungsankündigung\nHamburg Amtsgericht Hamburg HRA 120712\nMS \"AMAVISTI\" GmbH & Co. KG – Hamburg",
      "type": "Löschungsankündigung",
      "state": "Hamburg",
      "amtsgericht": "Amtsgericht Hamburg",
      "registernummer": "HRA 120712",
      "registerart": "HRA",
      "company_name": "MS \"AMAVISTI\" GmbH & Co. KG",
      "company_seat": "Hamburg",
      "details": "14.03.2025 (Bekanntmachungsdatum)\n\nHamburg Amtsgericht Hamburg HRA 120712\nLöschungsankündigung\n\nMS \"AMAVISTI\" GmbH & Co. KG\nKommanditgesellschaft\nHamburg\n\nDas Registergericht beabsichtigt, die im Handelsregister eingetragene Firma von Amts wegen nach § 31 Abs. 2 HGB zu löschen. Die Frist zur Erhebung eines Widerspruchs gegen die beabsichtigte Löschung wird auf 3 Monate festgesetzt."
    },
    {
      "date": "2025-03-14",
      "id": "103833",
      "original_text": "Löschungsankündigung\nHamburg Amtsgericht Hamburg VR 24359\nFrauen aufs Podium e.V. – Hamburg",
      "type": "Löschungsankündigung",
      "state": "Hamburg",
      "amtsgericht": "Amtsgericht Hamburg",
      "registernummer": "VR 24359",
      "registerart": "VR",
      "company_name": "Frauen aufs Podium e.V.",
      "company_seat": "Hamburg",
      "details": "14.03.2025 (Bekanntmachungsdatum)\n\nHamburg Amtsgericht Hamburg VR 24359\nLöschungsankündigung\n\nFrauen aufs Podium e.V.\neingetragener Verein\nHamburg\n\nDas Registergericht beabsichtigt, den im Vereinsregister eingetragenen Verein von Amts wegen nach § 395 FamFG zu löschen, da nach den angestellten Ermittlungen dieser Verein offenbar nicht mehr besteht. Die Frist zur Erhebung eines Widerspruchs gegen die beabsichtigte Löschung wird auf 3 Monate festgesetzt."
    },
    {
      "date": "2025-03-14",
      "id": "103834",
      "original_text": "Löschungsankündigung\nHamburg Amtsgericht Hamburg HRA 102350\nMT \"KING EDWIN\" Tankschiffahrts GmbH & Co. KG – Hamburg",
      "type": "Löschungsankündigung",
      "state": "Hamburg",
      "amtsgericht": "Amtsgericht Hamburg",
      "registernummer": "HRA 102350",
      "registerart": "HRA",
      "company_name": "MT \"KING EDWIN\" Tankschiffahrts GmbH & Co. KG",
      "company_seat": "Hamburg",
      "details": "14.03.2025 (Bekanntmachungsdatum)\n\nHamburg Amtsgericht Hamburg HRA 102350\nLöschungsankündigung\n\nMT \"KING EDWIN\" Tankschiffahrts GmbH & Co. KG\nKommanditgesellschaft\nHamburg\n\nDas Registergericht beabsichtigt, die im Handelsregister eingetragene Firma von Amts wegen nach § 31 Abs. 2 HGB zu löschen. Die Frist zur Erhebung eines Widerspruchs gegen die beabsichtigte Löschung wird auf 3 Monate festgesetzt."
    },
    {
      "date": "2025-03-14",
      "id": "103835",
      "original_text": "Löschungsankündigung\nHamburg Amtsgericht Hamburg VR 24154\nFörderverein von Global Animal Law GAL e.V. – Hamburg",
      "type": "Löschungsankündigung",
      "state": "Hamburg",
      "amtsgericht": "Amtsgericht Hamburg",
      "registernummer": "VR 24154",
      "registerart": "VR",
      "company_name": "Förderverein von Global Animal Law GAL e.V.",
      "company_seat": "Hamburg",
      "details": "14.03.2025 (Bekanntmachungsdatum)\n\nHamburg Amtsgericht Hamburg VR 24154\nLöschungsankündigung\n\nFörderverein von Global Animal Law GAL e.V.\neingetragener Verein\nHamburg\n\nDas Registergericht beabsichtigt, den im Vereinsregister eingetragenen Verein von Amts wegen nach § 395 FamFG zu löschen, da nach den angestellten Ermittlungen dieser Verein offenbar nicht mehr besteht. Die Frist zur Erhebung eines Widerspruchs gegen die beabsichtigte Löschung wird auf 3 Monate festgesetzt."
    },
    {
      "date": "2025-03-14",
      "id": "103836",
      "original_text": "Einreichung neuer Dokumente\nBrandenburg Amtsgericht Frankfurt/Oder HRB 16136\nKreiswerke Barnim GmbH (KWB) – Eberswalde",
      "type": "Einreichung neuer Dokumente",
      "state": "Brandenburg",
      "amtsgericht": "Amtsgericht Frankfurt/Oder",
      "registernummer": "HRB 16136",
      "registerart": "HRB",
      "company_name": "Kreiswerke Barnim GmbH (KWB)",
      "company_seat": "Eberswalde",
      "details": "14.03.2025 (Bekanntmachungsdatum)\n\nBrandenburg Amtsgericht Frankfurt/Oder HRB 16136\nEinreichung neuer Dokumente\n\nKreiswerke Barnim GmbH (KWB)\nGesellschaft mit beschränkter Haftung\nEberswalde\n\nAls nicht eingetragen wird veröffentlicht:\n\nEs wurde eine Liste der Aufsichtsratsmitglieder zur Akte gereicht, gem § 106 AktG."
    },
    {
      "date": "2025-03-14",
      "id": "103837",
      "original_text": "Löschungsankündigung\nBaden-Württemberg Amtsgericht Freiburg HRB 720711\nGood Dad GmbH – Lahr",
      "type": "Löschungsankündigung",
      "state": "Baden-Württemberg",
      "amtsgericht": "Amtsgericht Freiburg",
      "registernummer": "HRB 720711",
      "registerart": "HRB",
      "company_name": "Good Dad GmbH",
      "company_seat": "Lahr",
      "details": "14.03.2025 (Bekanntmachungsdatum)\n\nBaden-Württemberg Amtsgericht Freiburg HRB 720711\nLöschungsankündigung 14.03.2025 (Eintragungsdatum)\n\nGood Dad GmbH\nGesellschaft mit beschränkter Haftung\nLahr\n\nAls nicht eingetragen wird bekanntgemacht:\nDas Gericht beabsichtigt, die Gesellschaft wegen Vermögenslosigkeit im Handelsregister von Amts wegen nach § 394 FamFG zu löschen. Die Frist zur Geltendmachung eines Widerspruchs gegen die beabsichtigte Löschung ist auf einen Monat ab Veröffentlichung bestimmt."
    },
    {
      "date": "2025-03-14",
      "id": "103838",
      "original_text": "Sonstige Registerbekanntmachung\nBaden-Württemberg Amtsgericht Stuttgart HRB 790882\npronavio GmbH – Stuttgart",
      "type": "Sonstige Registerbekanntmachung",
      "state": "Baden-Württemberg",
      "amtsgericht": "Amtsgericht Stuttgart",
      "registernummer": "HRB 790882",
      "registerart": "HRB",
      "company_name": "pronavio GmbH",
      "company_seat": "Stuttgart",
      "details": "14.03.2025 (Bekanntmachungsdatum)\n\nBaden-Württemberg Amtsgericht Stuttgart HRB 790882\nSonstige Registerbekanntmachung 14.03.2025 (Eintragungsdatum)\n\npronavio GmbH\nGesellschaft mit beschränkter Haftung\nStuttgart\n\nAls nicht eingetragen wird bekanntgemacht:\nDen Gläubigern der Gesellschaft, deren Forderungen begründet worden sind, bevor die Eintragung der Beendigung des Vertrages in das Handelsregister nach § 10 HGB als bekanntgemacht gilt, ist vom anderen Vertragsteil Sicherheit zu leisten, wenn sie sich binnen sechs Monaten nach der Bekanntmachung zu diesem Zweck bei ihm melden."
    },
    {
      "date": "2025-03-14",
      "id": "103839",
      "original_text": "Einreichung neuer Dokumente\nSachsen Amtsgericht Dresden HRB 17696\nWohnungsbau- und Verwaltungsgesellschaft Altenberg mbH – Altenberg",
      "type": "Einreichung neuer Dokumente",
      "state": "Sachsen",
      "amtsgericht": "Amtsgericht Dresden",
      "registernummer": "HRB 17696",
      "registerart": "HRB",
      "company_name": "Wohnungsbau- und Verwaltungsgesellschaft Altenberg mbH",
      "company_seat": "Altenberg",
      "details": "14.03.2025 (Bekanntmachungsdatum)\n\nSachsen Amtsgericht Dresden HRB 17696\nEinreichung neuer Dokumente\n\nWohnungsbau- und Verwaltungsgesellschaft Altenberg mbH\nGesellschaft mit beschränkter Haftung\nAltenberg\n\nAm 13.03.2025 wurde beim Handelsregister des Amtsgerichts Dresden die Liste der Mitglieder des Aufsichtsrats gemäß § 52 GmbHG eingereicht."
    },
    {
      "date": "2025-03-14",
      "id": "103840",
      "original_text": "Registerbekanntmachung nach dem Umwandlungsgesetz\nSachsen Amtsgericht Leipzig HRB 26775\nAURISO Dienstleistungsprofi GmbH – Leipzig",
      "type": "Registerbekanntmachung nach dem Umwandlungsgesetz",
      "state": "Sachsen",
      "amtsgericht": "Amtsgericht Leipzig",
      "registernummer": "HRB 26775",
      "registerart": "HRB",
      "company_name": "AURISO Dienstleistungsprofi GmbH",
      "company_seat": "Leipzig",
      "details": "14.03.2025 (Bekanntmachungsdatum)\n\nSachsen Amtsgericht Leipzig HRB 26775\nRegisterbekanntmachung nach dem Umwandlungsgesetz 14.03.2025 (Eintragungsdatum)\n\nAURISO Dienstleistungsprofi GmbH\nGesellschaft mit beschränkter Haftung\nLeipzig\n\nDen Gläubigern der an der Ausgliederung beteiligten Rechtsträger ist, wenn sie binnen sechs Monaten nach dem Tag, an dem die Eintragung der Ausgliederung in das Register des Sitzes desjenigen Rechtsträgers, dessen Gläubiger sie sind, nach § 19 Abs. 3 UmwG als bekannt gemacht gilt, ihren Anspruch nach Grund und Höhe in Textform anmelden, Sicherheit zu leisten, soweit sie nicht Befriedigung verlangen können. Dieses Recht steht den Gläubigern jedoch nur zu, wenn sie glaubhaft machen, dass durch die Ausgliederung die Erfüllung der Forderung gefährdet wird."
    },
    {
      "date": "2025-03-14",
      "id": "103841",
      "original_text": "Registerbekanntmachung nach dem Umwandlungsgesetz\nSachsen Amtsgericht Leipzig HRA 19616\nHausmeisterservice Sven Aurich e.K. – Borna",
      "type": "Registerbekanntmachung nach dem Umwandlungsgesetz",
      "state": "Sachsen",
      "amtsgericht": "Amtsgericht Leipzig",
      "registernummer": "HRA 19616",
      "registerart": "HRA",
      "company_name": "Hausmeisterservice Sven Aurich e.K.",
      "company_seat": "Borna",
      "details": "14.03.2025 (Bekanntmachungsdatum)\n\nSachsen Amtsgericht Leipzig HRA 19616\nRegisterbekanntmachung nach dem Umwandlungsgesetz 14.03.2025 (Eintragungsdatum)\n\nHausmeisterservice Sven Aurich e.K.\nEinzelkaufmann / Einzelkauffrau\nBorna\n\nDen Gläubigern der an der Ausgliederung beteiligten Rechtsträger ist, wenn sie binnen sechs Monaten nach dem Tag, an dem die Eintragung der Ausgliederung in das Register des Sitzes desjenigen Rechtsträgers, dessen Gläubiger sie sind, nach § 19 Abs. 3 UmwG als bekannt gemacht gilt, ihren Anspruch nach Grund und Höhe in Textform anmelden, Sicherheit zu leisten, soweit sie nicht Befriedigung verlangen können. Dieses Recht steht den Gläubigern jedoch nur zu, wenn sie glaubhaft machen, dass durch die Ausgliederung die Erfüllung der Forderung gefährdet wird."
    },
    {
      "date": "2025-03-14",
      "id": "103842",
      "original_text": "Registerbekanntmachung nach dem Umwandlungsgesetz\nNiedersachsen Amtsgericht Hannover HRB 207788\nConcordia Stiftung \"Mensch - Natur - Gemeinschaft\" GmbH – Hannover",
      "type": "Registerbekanntmachung nach dem Umwandlungsgesetz",
      "state": "Niedersachsen",
      "amtsgericht": "Amtsgericht Hannover",
      "registernummer": "HRB 207788",
      "registerart": "HRB",
      "company_name": "Concordia Stiftung \"Mensch - Natur - Gemeinschaft\" GmbH",
      "company_seat": "Hannover",
      "details": "14.03.2025 (Bekanntmachungsdatum)\n\nNiedersachsen Amtsgericht Hannover HRB 207788\nRegisterbekanntmachung nach dem Umwandlungsgesetz 14.03.2025 (Eintragungsdatum)\n\nConcordia Stiftung \"Mensch - Natur - Gemeinschaft\" GmbH\nGesellschaft mit beschränkter Haftung\nHannover\n\nDen Gläubigern der an der Verschmelzung beteiligten Rechtsträger ist, wenn sie binnen sechs Monaten nach dem Tag, an dem die Eintragung der Verschmelzung in das Register des Sitzes desjenigen Rechtsträgers, dessen Gläubiger sie sind, nach § 19  Abs.  3 UmwG als bekannt gemacht gilt, ihren Anspruch nach Grund und Höhe schriftlich anmelden, Sicherheit zu leisten, soweit sie nicht Befriedigung verlangen können. Dieses Recht steht den Gläubigern jedoch nur zu, wenn sie glaubhaft machen, dass durch die Verschmelzung die Erfüllung der Forderung gefährdet wird."
    },
    {
      "date": "2025-03-14",
      "id": "103843",
      "original_text": "Einreichung neuer Dokumente\nNiedersachsen Amtsgericht Oldenburg (Oldenburg) HRB 3390\nRehabilitationszentrum Oldenburg GmbH – Oldenburg",
      "type": "Einreichung neuer Dokumente",
      "state": "Niedersachsen",
      "amtsgericht": "Amtsgericht Oldenburg (Oldenburg)",
      "registernummer": "HRB 3390",
      "registerart": "HRB",
      "company_name": "Rehabilitationszentrum Oldenburg GmbH",
      "company_seat": "Oldenburg",
      "details": "14.03.2025 (Bekanntmachungsdatum)\n\nNiedersachsen Amtsgericht Oldenburg (Oldenburg) HRB 3390\nEinreichung neuer Dokumente\n\nRehabilitationszentrum Oldenburg GmbH\nGesellschaft mit beschränkter Haftung\nOldenburg\n\nDie Liste der Mitglieder des Aufsichtsrats wurde beim Registergericht eingereicht."
    },
    {
      "date": "2025-03-14",
      "id": "103844",
      "original_text": "Löschungsankündigung\nNiedersachsen Amtsgericht Hildesheim HRB 3070\nWeinreich GmbH – Holle",
      "type": "Löschungsankündigung",
      "state": "Niedersachsen",
      "amtsgericht": "Amtsgericht Hildesheim",
      "registernummer": "HRB 3070",
      "registerart": "HRB",
      "company_name": "Weinreich GmbH",
      "company_seat": "Holle",
      "details": "14.03.2025 (Bekanntmachungsdatum)\n\nNiedersachsen Amtsgericht Hildesheim HRB 3070\nLöschungsankündigung\n\nWeinreich GmbH\nGesellschaft mit beschränkter Haftung\nHolle\n\nDas Registergericht beabsichtigt, die Gesellschaft von Amts wegen nach § 394 FamFG zu löschen. Die Frist zur Erhebung eines Widerspruchs ist auf 1 Monat ab dieser Registerbekanntmachung festgesetzt."
    },
    {
      "date": "2025-03-14",
      "id": "103845",
      "original_text": "Registerbekanntmachung nach dem Umwandlungsgesetz\nNiedersachsen Amtsgericht Walsrode HRA 1051\nLT Kunststofftechnik GmbH & Co. KG – Schwarmstedt",
      "type": "Registerbekanntmachung nach dem Umwandlungsgesetz",
      "state": "Niedersachsen",
      "amtsgericht": "Amtsgericht Walsrode",
      "registernummer": "HRA 1051",
      "registerart": "HRA",
      "company_name": "LT Kunststofftechnik GmbH & Co. KG",
      "company_seat": "Schwarmstedt",
      "details": "14.03.2025 (Bekanntmachungsdatum)\n\nNiedersachsen Amtsgericht Walsrode HRA 1051\nRegisterbekanntmachung nach dem Umwandlungsgesetz 14.03.2025 (Eintragungsdatum)\n\nLT Kunststofftechnik GmbH & Co. KG\nKommanditgesellschaft\nSchwarmstedt\n\nDen Gläubigern der an der Verschmelzung beteiligten Rechtsträger ist, wenn sie binnen sechs Monaten nach dem Tag, an dem die Eintragung der Verschmelzung in das Register des Sitzes desjenigen Rechtsträgers, dessen Gläubiger sie sind, nach § 19  Abs.  3 UmwG als bekannt gemacht gilt, ihren Anspruch nach Grund und Höhe schriftlich anmelden, Sicherheit zu leisten, soweit sie nicht Befriedigung verlangen können. Dieses Recht steht den Gläubigern jedoch nur zu, wenn sie glaubhaft machen, dass durch die Verschmelzung die Erfüllung der Forderung gefährdet wird."
    },
    {
      "date": "2025-03-14",
      "id": "103846",
      "original_text": "Registerbekanntmachung nach dem Umwandlungsgesetz\nNiedersachsen Amtsgericht Hannover HRB 55306\nCordial Grundstücks-GmbH – Hannover",
      "type": "Registerbekanntmachung nach dem Umwandlungsgesetz",
      "state": "Niedersachsen",
      "amtsgericht": "Amtsgericht Hannover",
      "registernummer": "HRB 55306",
      "registerart": "HRB",
      "company_name": "Cordial Grundstücks-GmbH",
      "company_seat": "Hannover",
      "details": "14.03.2025 (Bekanntmachungsdatum)\n\nNiedersachsen Amtsgericht Hannover HRB 55306\nRegisterbekanntmachung nach dem Umwandlungsgesetz 14.03.2025 (Eintragungsdatum)\n\nCordial Grundstücks-GmbH\nGesellschaft mit beschränkter Haftung\nHannover\n\nDen Gläubigern der an der Verschmelzung beteiligten Rechtsträger ist, wenn sie binnen sechs Monaten nach dem Tag, an dem die Eintragung der Verschmelzung in das Register des Sitzes desjenigen Rechtsträgers, dessen Gläubiger sie sind, nach § 19  Abs.  3 UmwG als bekannt gemacht gilt, ihren Anspruch nach Grund und Höhe schriftlich anmelden, Sicherheit zu leisten, soweit sie nicht Befriedigung verlangen können. Dieses Recht steht den Gläubigern jedoch nur zu, wenn sie glaubhaft machen, dass durch die Verschmelzung die Erfüllung der Forderung gefährdet wird."
    },
    {
      "date": "2025-03-14",
      "id": "103847",
      "original_text": "Registerbekanntmachung nach dem Umwandlungsgesetz\nNiedersachsen Amtsgericht Walsrode HRA 203198\nVS-Chadrysiak GmbH & Co. KG – Schwarmstedt",
      "type": "Registerbekanntmachung nach dem Umwandlungsgesetz",
      "state": "Niedersachsen",
      "amtsgericht": "Amtsgericht Walsrode",
      "registernummer": "HRA 203198",
      "registerart": "HRA",
      "company_name": "VS-Chadrysiak GmbH & Co. KG",
      "company_seat": "Schwarmstedt",
      "details": "14.03.2025 (Bekanntmachungsdatum)\n\nNiedersachsen Amtsgericht Walsrode HRA 203198\nRegisterbekanntmachung nach dem Umwandlungsgesetz 14.03.2025 (Eintragungsdatum)\n\nVS-Chadrysiak GmbH & Co. KG\nKommanditgesellschaft\nSchwarmstedt\n\nDen Gläubigern der an der Verschmelzung beteiligten Rechtsträger ist, wenn sie binnen sechs Monaten nach dem Tag, an dem die Eintragung der Verschmelzung in das Register des Sitzes desjenigen Rechtsträgers, dessen Gläubiger sie sind, nach § 19  Abs.  3 UmwG als bekannt gemacht gilt, ihren Anspruch nach Grund und Höhe schriftlich anmelden, Sicherheit zu leisten, soweit sie nicht Befriedigung verlangen können. Dieses Recht steht den Gläubigern jedoch nur zu, wenn sie glaubhaft machen, dass durch die Verschmelzung die Erfüllung der Forderung gefährdet wird."
    },
    {
      "date": "2025-03-14",
      "id": "103848",
      "original_text": "Registerbekanntmachung nach dem Umwandlungsgesetz\nNiedersachsen Amtsgericht Hannover HRB 203645\nXcenda GmbH – Hannover",
      "type": "Registerbekanntmachung nach dem Umwandlungsgesetz",
      "state": "Niedersachsen",
      "amtsgericht": "Amtsgericht Hannover",
      "registernummer": "HRB 203645",
      "registerart": "HRB",
      "company_name": "Xcenda GmbH",
      "company_seat": "Hannover",
      "details": "14.03.2025 (Bekanntmachungsdatum)\n\nNiedersachsen Amtsgericht Hannover HRB 203645\nRegisterbekanntmachung nach dem Umwandlungsgesetz 14.03.2025 (Eintragungsdatum)\n\nXcenda GmbH\nGesellschaft mit beschränkter Haftung\nHannover\n\nDen Gläubigern der an der Verschmelzung beteiligten Rechtsträger ist, wenn sie binnen sechs Monaten nach dem Tag, an dem die Eintragung der Verschmelzung in das Register des Sitzes desjenigen Rechtsträgers, dessen Gläubiger sie sind, nach § 19  Abs.  3 UmwG als bekannt gemacht gilt, ihren Anspruch nach Grund und Höhe schriftlich anmelden, Sicherheit zu leisten, soweit sie nicht Befriedigung verlangen können. Dieses Recht steht den Gläubigern jedoch nur zu, wenn sie glaubhaft machen, dass durch die Verschmelzung die Erfüllung der Forderung gefährdet wird."
    },
    {
      "date": "2025-03-14",
      "id": "103849",
      "original_text": "Einreichung neuer Dokumente\nNiedersachsen Amtsgericht Hannover HRB 201429\nIntegral Aktiengesellschaft – Hannover",
      "type": "Einreichung neuer Dokumente",
      "state": "Niedersachsen",
      "amtsgericht": "Amtsgericht Hannover",
      "registernummer": "HRB 201429",
      "registerart": "HRB",
      "company_name": "Integral Aktiengesellschaft",
      "company_seat": "Hannover",
      "details": "14.03.2025 (Bekanntmachungsdatum)\n\nNiedersachsen Amtsgericht Hannover HRB 201429\nEinreichung neuer Dokumente 14.03.2025 (Eintragungsdatum)\n\nIntegral Aktiengesellschaft\nAktiengesellschaft\nHannover\n\nDie Liste der Mitglieder des Aufsichtsrats wurde beim Registergericht eingereicht."
    },
    {
      "date": "2025-03-14",
      "id": "103850",
      "original_text": "Einreichung neuer Dokumente\nNiedersachsen Amtsgericht Braunschweig HRB 206873\nSchnellecke Logistics SE – Wolfsburg",
      "type": "Einreichung neuer Dokumente",
      "state": "Niedersachsen",
      "amtsgericht": "Amtsgericht Braunschweig",
      "registernummer": "HRB 206873",
      "registerart": "HRB",
      "company_name": "Schnellecke Logistics SE",
      "company_seat": "Wolfsburg",
      "details": "14.03.2025 (Bekanntmachungsdatum)\n\nNiedersachsen Amtsgericht Braunschweig HRB 206873\nEinreichung neuer Dokumente 14.03.2025 (Eintragungsdatum)\n\nSchnellecke Logistics SE\nEuropäische Aktiengesellschaft (SE)\nWolfsburg\n\nEine aktuelle Liste der Mitglieder des Aufsichtsrats wurde beim Registergericht eingereicht."
    },
    {
      "date": "2025-03-14",
      "id": "103851",
      "original_text": "Einreichung neuer Dokumente\nNiedersachsen Amtsgericht Hannover HRB 5339\nTreuhand Hannover Steuerberatung und Wirtschaftsberatung für Heilberufe GmbH – Hannover",
      "type": "Einreichung neuer Dokumente",
      "state": "Niedersachsen",
      "amtsgericht": "Amtsgericht Hannover",
      "registernummer": "HRB 5339",
      "registerart": "HRB",
      "company_name": "Treuhand Hannover Steuerberatung und Wirtschaftsberatung für Heilberufe GmbH",
      "company_seat": "Hannover",
      "details": "14.03.2025 (Bekanntmachungsdatum)\n\nNiedersachsen Amtsgericht Hannover HRB 5339\nEinreichung neuer Dokumente\n\nTreuhand Hannover Steuerberatung und Wirtschaftsberatung für Heilberufe GmbH\nGesellschaft mit beschränkter Haftung\nHannover\n\nDie Liste der Mitglieder des Aufsichtsrats wurde beim Registergericht eingereicht."
    },
    {
      "date": "2025-03-14",
      "id": "103852",
      "original_text": "Registerbekanntmachung nach dem Umwandlungsgesetz\nRheinland-Pfalz Amtsgericht Montabaur HRB 6591\n2bits GmbH – Langenbach b.K.",
      "type": "Registerbekanntmachung nach dem Umwandlungsgesetz",
      "state": "Rheinland-Pfalz",
      "amtsgericht": "Amtsgericht Montabaur",
      "registernummer": "HRB 6591",
      "registerart": "HRB",
      "company_name": "2bits GmbH",
      "company_seat": "Langenbach b.K.",
      "details": "14.03.2025 (Bekanntmachungsdatum)\n\nRheinland-Pfalz Amtsgericht Montabaur HRB 6591\nRegisterbekanntmachung nach dem Umwandlungsgesetz 14.03.2025 (Eintragungsdatum)\n\n2bits GmbH\nGesellschaft mit beschränkter Haftung\nLangenbach b.K.\n\nAls nicht eingetragen wird veröffentlicht: Den Gläubigern der an der Verschmelzung beteiligten Rechtsträger ist, wenn sie binnen sechs Monaten nach dem Tag, an dem die Eintragung der Verschmelzung in das Register des Sitzes desjenigen Rechtsträgers,dessen Gläubiger sie sind, nach § 19 Abs. 3 UmwG als bekannt gemacht gilt, ihren Anspruch nach Grund und Höhe schriftlich anmelden, Sicherheit zu leisten, soweit sie nicht Befriedigung verlangen können. Dieses Recht steht den Gläubigern jedoch nur zu, wenn sie glaubhaft machen, dass durch die Verschmelzung die Erfüllungd er Forderung gefährdet wird."
    },
    {
      "date": "2025-03-14",
      "id": "103853",
      "original_text": "Registerbekanntmachung nach dem Umwandlungsgesetz\nRheinland-Pfalz Amtsgericht Mainz HRB 53024\nImmo Software AG – Mainz",
      "type": "Registerbekanntmachung nach dem Umwandlungsgesetz",
      "state": "Rheinland-Pfalz",
      "amtsgericht": "Amtsgericht Mainz",
      "registernummer": "HRB 53024",
      "registerart": "HRB",
      "company_name": "Immo Software AG",
      "company_seat": "Mainz",
      "details": "14.03.2025 (Bekanntmachungsdatum)\n\nRheinland-Pfalz Amtsgericht Mainz HRB 53024\nRegisterbekanntmachung nach dem Umwandlungsgesetz 14.03.2025 (Eintragungsdatum)\n\nImmo Software AG\nAktiengesellschaft\nMainz\n\nAls nicht eingetragen wird veröffentlicht:\nDen Gläubigern des formwechselnden Rechtsträgers ist, wenn sie binnen sechs Monaten nach dem Tag, an dem die Eintragung des Formwechsels nach § 201 UmwG als bekannt gemacht gilt, ihren Anspruch nach Grund und Höhe schriftlich anmelden, Sicherheit zu leisten, soweit sie nicht Befriedigung verlangen können. Dieses Recht steht den Gläubigern jedoch nur zu, wenn sie glaubhaft machen, dass durch den Formwechsel die Erfüllung der Forderung gefährdet wird."
    },
    {
      "date": "2025-03-14",
      "id": "103854",
      "original_text": "Registerbekanntmachung nach dem Umwandlungsgesetz\nRheinland-Pfalz Amtsgericht Mainz HRB 7713\nAareon AG – Mainz",
      "type": "Registerbekanntmachung nach dem Umwandlungsgesetz",
      "state": "Rheinland-Pfalz",
      "amtsgericht": "Amtsgericht Mainz",
      "registernummer": "HRB 7713",
      "registerart": "HRB",
      "company_name": "Aareon AG",
      "company_seat": "Mainz",
      "details": "14.03.2025 (Bekanntmachungsdatum)\n\nRheinland-Pfalz Amtsgericht Mainz HRB 7713\nRegisterbekanntmachung nach dem Umwandlungsgesetz 14.03.2025 (Eintragungsdatum)\n\nAareon AG\nAktiengesellschaft\nMainz\n\nAls nicht eingetragen wird veröffentlicht:\nDen Gläubigern des formwechselnden Rechtsträgers ist, wenn sie binnen sechs Monaten nach dem Tag, an dem die Eintragung des Formwechsels nach § 201 UmwG als bekannt gemacht gilt, ihren Anspruch nach Grund und Höhe schriftlich anmelden, Sicherheit zu leisten, soweit sie nicht Befriedigung verlangen können. Dieses Recht steht den Gläubigern jedoch nur zu, wenn sie glaubhaft machen, dass durch den Formwechsel die Erfüllung der Forderung gefährdet wird."
    },
    {
      "date": "2025-03-14",
      "id": "103855",
      "original_text": "Einreichung neuer Dokumente\nRheinland-Pfalz Amtsgericht Koblenz HRB 2870\nCanyon Bicycles GmbH – Koblenz",
      "type": "Einreichung neuer Dokumente",
      "state": "Rheinland-Pfalz",
      "amtsgericht": "Amtsgericht Koblenz",
      "registernummer": "HRB 2870",
      "registerart": "HRB",
      "company_name": "Canyon Bicycles GmbH",
      "company_seat": "Koblenz",
      "details": "14.03.2025 (Bekanntmachungsdatum)\n\nRheinland-Pfalz Amtsgericht Koblenz HRB 2870\nEinreichung neuer Dokumente\n\nCanyon Bicycles GmbH\nGesellschaft mit beschränkter Haftung\nKoblenz\n\nDem Registergericht ist eine neue Liste der Mitglieder des Aufsichtsrates eingereicht worden."
    },
    {
      "date": "2025-03-14",
      "id": "103856",
      "original_text": "Löschungsankündigung\nRheinland-Pfalz Amtsgericht Mainz HRB 46149\nMD-Dienstleistungen UG (haftungsbeschränkt) – Nieder-Olm",
      "type": "Löschungsankündigung",
      "state": "Rheinland-Pfalz",
      "amtsgericht": "Amtsgericht Mainz",
      "registernummer": "HRB 46149",
      "registerart": "HRB",
      "company_name": "MD-Dienstleistungen UG (haftungsbeschränkt)",
      "company_seat": "Nieder-Olm",
      "details": "14.03.2025 (Bekanntmachungsdatum)\n\nRheinland-Pfalz Amtsgericht Mainz HRB 46149\nLöschungsankündigung\n\nMD-Dienstleistungen UG (haftungsbeschränkt)\nGesellschaft mit beschränkter Haftung\nNieder-Olm\n\nDas Registergericht beabsichtigt die Gesellschaft von Amts wegen nach § 394 FamFG zu löschen. Die Frist zur Erhebung eines Widerspruchs ist auf einen Monat festgesetzt."
    },
    {
      "date": "2025-03-14",
      "id": "103857",
      "original_text": "Registerbekanntmachung nach dem Umwandlungsgesetz\nRheinland-Pfalz Amtsgericht Koblenz HRB 30587\nPinkbrain Advisory GmbH – Koblenz",
      "type": "Registerbekanntmachung nach dem Umwandlungsgesetz",
      "state": "Rheinland-Pfalz",
      "amtsgericht": "Amtsgericht Koblenz",
      "registernummer": "HRB 30587",
      "registerart": "HRB",
      "company_name": "Pinkbrain Advisory GmbH",
      "company_seat": "Koblenz",
      "details": "14.03.2025 (Bekanntmachungsdatum)\n\nRheinland-Pfalz Amtsgericht Koblenz HRB 30587\nRegisterbekanntmachung nach dem Umwandlungsgesetz 14.03.2025 (Eintragungsdatum)\n\nPinkbrain Advisory GmbH\nGesellschaft mit beschränkter Haftung\nKoblenz\n\nAls nicht eingetragen wird veröffentlicht: Den Gläubigern der an der Ausgliederung beteiligten Rechtsträger ist, wenn sie binnen sechs Monaten nach dem Tag, an dem die Eintragung der Ausgliederung in das Register des Sitzes desjenigen Rechtsträgers,dessen Gläubiger sie sind, nach § 19 Abs. 3 UmwG als bekannt gemacht gilt, ihren Anspruch nach Grund und Höhe schriftlich anmelden, Sicherheit zu leisten, soweit sie nicht Befriedigung verlangen können. Dieses Recht steht den Gläubigern jedoch nur zu, wenn sie glaubhaft machen, dass durch die Ausgliederung die Erfüllung der Forderung gefährdet wird."
    },
    {
      "date": "2025-03-14",
      "id": "103858",
      "original_text": "Löschungsankündigung\nNordrhein-Westfalen Amtsgericht Kleve HRB 14614\nCar Autoservice Xanten UG (haftungsbeschränkt) – Xanten",
      "type": "Löschungsankündigung",
      "state": "Nordrhein-Westfalen",
      "amtsgericht": "Amtsgericht Kleve",
      "registernummer": "HRB 14614",
      "registerart": "HRB",
      "company_name": "Car Autoservice Xanten UG (haftungsbeschränkt)",
      "company_seat": "Xanten",
      "details": "14.03.2025 (Bekanntmachungsdatum)\n\nNordrhein-Westfalen Amtsgericht Kleve HRB 14614\nLöschungsankündigung\n\nCar Autoservice Xanten UG (haftungsbeschränkt)\nGesellschaft mit beschränkter Haftung\nXanten\n\nDas Registergericht beabsichtigt die Gesellschaft von Amts wegen nach § 394 FamFG zu löschen. Die Frist zur Erhebung eines Widerspruchs ist auf einen Monat festgesetzt."
    },
    {
      "date": "2025-03-14",
      "id": "103859",
      "original_text": "Registerbekanntmachung nach dem Umwandlungsgesetz\nNordrhein-Westfalen Amtsgericht Bad Oeynhausen HRB 4531\nWKA Service GmbH – Minden",
      "type": "Registerbekanntmachung nach dem Umwandlungsgesetz",
      "state": "Nordrhein-Westfalen",
      "amtsgericht": "Amtsgericht Bad Oeynhausen",
      "registernummer": "HRB 4531",
      "registerart": "HRB",
      "company_name": "WKA Service GmbH",
      "company_seat": "Minden",
      "details": "14.03.2025 (Bekanntmachungsdatum)\n\nNordrhein-Westfalen Amtsgericht Bad Oeynhausen HRB 4531\nRegisterbekanntmachung nach dem Umwandlungsgesetz 14.03.2025 (Eintragungsdatum)\n\nWKA Service GmbH\nGesellschaft mit beschränkter Haftung\nMinden\n\nDen Gläubigern der an der Verschmelzung beteiligten Rechtsträger ist, wenn sie binnen sechs Monaten nach dem Tag, an dem die Eintragung der Verschmelzung in das Register des Sitzes derjenigen Rechtsträger deren Gläubiger sie sind, nach § 19 Absatz 3 UmwG als bekanntgemacht gilt, ihren Anspruch nach Grund und Höhe schriftlich anmelden, Sicherheit zu leisten, soweit sie nicht Befriedigung verlangen können. Dieses Recht steht den Gläubigern jedoch nur zu, wenn sie glaubhaft machen, dass durch die Verschmelzung die Erfüllung ihrer Forderung gefährdet wird."
    },
    {
      "date": "2025-03-14",
      "id": "103860",
      "original_text": "Löschungsankündigung\nNordrhein-Westfalen Amtsgericht Köln HRB 96469\nA. T. M. GmbH – Bedburg",
      "type": "Löschungsankündigung",
      "state": "Nordrhein-Westfalen",
      "amtsgericht": "Amtsgericht Köln",
      "registernummer": "HRB 96469",
      "registerart": "HRB",
      "company_name": "A. T. M. GmbH",
      "company_seat": "Bedburg",
      "details": "14.03.2025 (Bekanntmachungsdatum)\n\nNordrhein-Westfalen Amtsgericht Köln HRB 96469\nLöschungsankündigung\n\nA. T. M. GmbH\nGesellschaft mit beschränkter Haftung\nBedburg\n\nDas Registergericht beabsichtigt die Gesellschaft von Amts wegen nach § 394 FamFG zu löschen. Die Frist zur Erhebung eines Widerspruchs ist auf einen Monat festgesetzt."
    },
    {
      "date": "2025-03-14",
      "id": "103861",
      "original_text": "Löschungsankündigung\nNordrhein-Westfalen Amtsgericht Hagen HRB 11860\nAuto Centro GmbH – Hagen",
      "type": "Löschungsankündigung",
      "state": "Nordrhein-Westfalen",
      "amtsgericht": "Amtsgericht Hagen",
      "registernummer": "HRB 11860",
      "registerart": "HRB",
      "company_name": "Auto Centro GmbH",
      "company_seat": "Hagen",
      "details": "14.03.2025 (Bekanntmachungsdatum)\n\nNordrhein-Westfalen Amtsgericht Hagen HRB 11860\nLöschungsankündigung\n\nAuto Centro GmbH\nGesellschaft mit beschränkter Haftung\nHagen\n\nDas Registergericht beabsichtigt, die im Handelsregister eingetragene Gesellschaft gemäß § 394 Absatz 1 FamFG wegen Vermögenslosigkeit von Amts wegen zu löschen.  Gegen diese Verfügung kann Widerspruch eingelegt werden. Die Frist zur Erhebung eines Widerspruchs gegen die beabsichtigte Löschung von Amts wegen ist auf drei Monate festgesetzt.\n\nRechtsbehelfsbelehrung:\nGegen diese Verfügung können Sie Widerspruch einlegen.\n\nDer Widerspruch ist bei dem Amtsgericht Hagen, Heinitzstraße 42, 58097 Hagen schriftlich in deutscher Sprache oder zur Niederschrift der Geschäftsstelle einzulegen. Der Widerspruch kann auch zur Niederschrift der Geschäftsstelle eines jeden Amtsgerichtes abgegeben werden.\n\nDer Widerspruch muss spätestens innerhalb der gesetzten Frist bei dem Amtsgericht Hagen eingegangen sein. Dies gilt auch dann, wenn der Widerspruch zur Niederschrift der Geschäftsstelle eines anderen Amtsgerichtes abgegeben wurde. Die Frist beginnt mit der Veröffentlichung. Fällt das Ende der Frist auf einen Sonntag, einen allgemeinen Feiertag oder Sonnabend, so endet die Frist mit Ablauf des nächsten Werktages.\n\nDer Widerspruch muss die Bezeichnung der angefochtenen Verfügung sowie die Erklärung enthalten, dass Widerspruch gegen diese Verfügung eingelegt wird. Er ist zu unterzeichnen und soll begründet werden."
    },
    {
      "date": "2025-03-14",
      "id": "103862",
      "original_text": "Registerbekanntmachung nach dem Umwandlungsgesetz\nNordrhein-Westfalen Amtsgericht Köln HRB 88685\napp4business GmbH – Köln",
      "type": "Registerbekanntmachung nach dem Umwandlungsgesetz",
      "state": "Nordrhein-Westfalen",
      "amtsgericht": "Amtsgericht Köln",
      "registernummer": "HRB 88685",
      "registerart": "HRB",
      "company_name": "app4business GmbH",
      "company_seat": "Köln",
      "details": "14.03.2025 (Bekanntmachungsdatum)\n\nNordrhein-Westfalen Amtsgericht Köln HRB 88685\nRegisterbekanntmachung nach dem Umwandlungsgesetz 14.03.2025 (Eintragungsdatum)\n\napp4business GmbH\nGesellschaft mit beschränkter Haftung\nKöln\n\nDen Gläubigern der an der Verschmelzung beteiligten Rechtsträger ist, wenn sie binnen sechs Monaten nach dem Tag, an dem die Eintragung der Verschmelzung in das Register des Sitzes desjenigen Rechtsträgers, dessen Gläubiger sie sind, nach § 19 Absatz 3 UmwG als bekanntgemacht gilt, ihren Anspruch nach Grund und Höhe schriftlich anmelden, Sicherheit zu leisten, soweit sie nicht Befriedigung verlangen können. Dieses Recht steht den Gläubigern jedoch nur zu, wenn sie glaubhaft machen, dass durch die Verschmelzung die Erfüllung ihrer Forderung gefährdet wird."
    },
    {
      "date": "2025-03-14",
      "id": "103863",
      "original_text": "Löschungsankündigung\nNordrhein-Westfalen Amtsgericht Hagen HRB 12052\nMaster-Security UG (haftungsbeschränkt) – Hagen",
      "type": "Löschungsankündigung",
      "state": "Nordrhein-Westfalen",
      "amtsgericht": "Amtsgericht Hagen",
      "registernummer": "HRB 12052",
      "registerart": "HRB",
      "company_name": "Master-Security UG (haftungsbeschränkt)",
      "company_seat": "Hagen",
      "details": "14.03.2025 (Bekanntmachungsdatum)\n\nNordrhein-Westfalen Amtsgericht Hagen HRB 12052\nLöschungsankündigung\n\nMaster-Security UG (haftungsbeschränkt)\nGesellschaft mit beschränkter Haftung\nHagen\n\nDas Registergericht beabsichtigt, die im Handelsregister eingetragene Gesellschaft gemäß § 394 Absatz 1 FamFG wegen Vermögenslosigkeit von Amts wegen zu löschen.  Gegen diese Verfügung kann Widerspruch eingelegt werden. Die Frist zur Erhebung eines Widerspruchs gegen die beabsichtigte Löschung von Amts wegen ist auf drei Monate festgesetzt.\n\nRechtsbehelfsbelehrung:\nGegen diese Verfügung können Sie Widerspruch einlegen.\n\nDer Widerspruch ist bei dem Amtsgericht Hagen, Heinitzstraße 42, 58097 Hagen schriftlich in deutscher Sprache oder zur Niederschrift der Geschäftsstelle einzulegen. Der Widerspruch kann auch zur Niederschrift der Geschäftsstelle eines jeden Amtsgerichtes abgegeben werden.\n\nDer Widerspruch muss spätestens innerhalb der gesetzten Frist bei dem Amtsgericht Hagen eingegangen sein. Dies gilt auch dann, wenn der Widerspruch zur Niederschrift der Geschäftsstelle eines anderen Amtsgerichtes abgegeben wurde. Die Frist beginnt mit der Veröffentlichung. Fällt das Ende der Frist auf einen Sonntag, einen allgemeinen Feiertag oder Sonnabend, so endet die Frist mit Ablauf des nächsten Werktages.\n\nDer Widerspruch muss die Bezeichnung der angefochtenen Verfügung sowie die Erklärung enthalten, dass Widerspruch gegen diese Verfügung eingelegt wird. Er ist zu unterzeichnen und soll begründet werden."
    },
    {
      "date": "2025-03-14",
      "id": "103864",
      "original_text": "Löschungsankündigung\nNordrhein-Westfalen Amtsgericht Krefeld HRB 20136\nEco2vation UG (haftungsbeschränkt) – Krefeld",
      "type": "Löschungsankündigung",
      "state": "Nordrhein-Westfalen",
      "amtsgericht": "Amtsgericht Krefeld",
      "registernummer": "HRB 20136",
      "registerart": "HRB",
      "company_name": "Eco2vation UG (haftungsbeschränkt)",
      "company_seat": "Krefeld",
      "details": "14.03.2025 (Bekanntmachungsdatum)\n\nNordrhein-Westfalen Amtsgericht Krefeld HRB 20136\nLöschungsankündigung\n\nEco2vation UG (haftungsbeschränkt)\nGesellschaft mit beschränkter Haftung\nKrefeld\n\nDas Registergericht beabsichtigt die Gesellschaft von Amts wegen nach § 394 FamFG zu löschen. Die Frist zur Erhebung eines Widerspruchs ist auf einen Monat festgesetzt."
    },
    {
      "date": "2025-03-14",
      "id": "103865",
      "original_text": "Registerbekanntmachung nach dem Umwandlungsgesetz\nNordrhein-Westfalen Amtsgericht Gütersloh HRB 13793\nJ. Niederschulte Lebensmittel GmbH – Verl",
      "type": "Registerbekanntmachung nach dem Umwandlungsgesetz",
      "state": "Nordrhein-Westfalen",
      "amtsgericht": "Amtsgericht Gütersloh",
      "registernummer": "HRB 13793",
      "registerart": "HRB",
      "company_name": "J. Niederschulte Lebensmittel GmbH",
      "company_seat": "Verl",
      "details": "14.03.2025 (Bekanntmachungsdatum)\n\nNordrhein-Westfalen Amtsgericht Gütersloh HRB 13793\nRegisterbekanntmachung nach dem Umwandlungsgesetz 14.03.2025 (Eintragungsdatum)\n\nJ. Niederschulte Lebensmittel GmbH\nGesellschaft mit beschränkter Haftung\nVerl\n\nDen Gläubigern der an der Ausgliederung beteiligten Rechtsträger ist, wenn sie binnen sechs Monaten nach dem Tag, an dem die Eintragung der Ausgliederung in das Register des Sitzes desjenigen Rechtsträgers, dessen Gläubiger sie sind, nach § 19 Absatz 3 UmwG als bekanntgemacht gilt, ihren Anspruch nach Grund und Höhe schriftlich anmelden, Sicherheit zu leisten, soweit sie nicht Befriedigung verlangen können. Dieses Recht steht den Gläubigern jedoch nur zu, wenn sie glaubhaft machen, dass durch die Ausgliederung die Erfüllung ihrer Forderung gefährdet wird."
    },
    {
      "date": "2025-03-14",
      "id": "103866",
      "original_text": "Registerbekanntmachung nach dem Umwandlungsgesetz\nNordrhein-Westfalen Amtsgericht Düsseldorf HRB 81679\nAGPAK UG (haftungsbeschränkt) – Hilden",
      "type": "Registerbekanntmachung nach dem Umwandlungsgesetz",
      "state": "Nordrhein-Westfalen",
      "amtsgericht": "Amtsgericht Düsseldorf",
      "registernummer": "HRB 81679",
      "registerart": "HRB",
      "company_name": "AGPAK UG (haftungsbeschränkt)",
      "company_seat": "Hilden",
      "details": "14.03.2025 (Bekanntmachungsdatum)\n\nNordrhein-Westfalen Amtsgericht Düsseldorf HRB 81679\nRegisterbekanntmachung nach dem Umwandlungsgesetz 14.03.2025 (Eintragungsdatum)\n\nAGPAK UG (haftungsbeschränkt)\nGesellschaft mit beschränkter Haftung\nHilden\n\nDen Gläubigern der an der Verschmelzung beteiligten Rechtsträger ist, wenn sie binnen sechs Monaten nach dem Tag, an dem die Eintragung der Verschmelzung in das Register des Sitzes desjenigen Rechtsträgers, dessen Gläubiger sie sind, nach § 19 Absatz 3 UmwG als bekanntgemacht gilt, ihren Anspruch nach Grund und Höhe schriftlich anmelden, Sicherheit zu leisten, soweit sie nicht Befriedigung verlangen können. Dieses Recht steht den Gläubigern jedoch nur zu, wenn sie glaubhaft machen, dass durch die Verschmelzung die Erfüllung ihrer Forderung gefährdet wird."
    },
    {
      "date": "2025-03-14",
      "id": "103867",
      "original_text": "Löschungsankündigung\nNordrhein-Westfalen Amtsgericht Köln HRB 83184\nBAKU GmbH – Köln",
      "type": "Löschungsankündigung",
      "state": "Nordrhein-Westfalen",
      "amtsgericht": "Amtsgericht Köln",
      "registernummer": "HRB 83184",
      "registerart": "HRB",
      "company_name": "BAKU GmbH",
      "company_seat": "Köln",
      "details": "14.03.2025 (Bekanntmachungsdatum)\n\nNordrhein-Westfalen Amtsgericht Köln HRB 83184\nLöschungsankündigung\n\nBAKU GmbH\nGesellschaft mit beschränkter Haftung\nKöln\n\nDas Registergericht beabsichtigt die Gesellschaft von Amts wegen nach § 394 FamFG zu löschen. Die Frist zur Erhebung eines Widerspruchs ist auf einen Monat festgesetzt."
    },
    {
      "date": "2025-03-14",
      "id": "103868",
      "original_text": "Löschungsankündigung\nNordrhein-Westfalen Amtsgericht Dortmund HRB 35421\nINFRA LEAM GmbH – Dortmund",
      "type": "Löschungsankündigung",
      "state": "Nordrhein-Westfalen",
      "amtsgericht": "Amtsgericht Dortmund",
      "registernummer": "HRB 35421",
      "registerart": "HRB",
      "company_name": "INFRA LEAM GmbH",
      "company_seat": "Dortmund",
      "details": "14.03.2025 (Bekanntmachungsdatum)\n\nNordrhein-Westfalen Amtsgericht Dortmund HRB 35421\nLöschungsankündigung\n\nINFRA LEAM GmbH\nGesellschaft mit beschränkter Haftung\nDortmund\n\nDas Registergericht beabsichtigt die Gesellschaft von Amts wegen nach § 394 FamFG zu löschen. Die Frist zur Erhebung eines Widerspruchs ist auf zwei Monate festgesetzt."
    },
    {
      "date": "2025-03-14",
      "id": "103869",
      "original_text": "Registerbekanntmachung nach dem Umwandlungsgesetz\nNordrhein-Westfalen Amtsgericht Köln HRB 96099\naqua cloud GmbH – Köln",
      "type": "Registerbekanntmachung nach dem Umwandlungsgesetz",
      "state": "Nordrhein-Westfalen",
      "amtsgericht": "Amtsgericht Köln",
      "registernummer": "HRB 96099",
      "registerart": "HRB",
      "company_name": "aqua cloud GmbH",
      "company_seat": "Köln",
      "details": "14.03.2025 (Bekanntmachungsdatum)\n\nNordrhein-Westfalen Amtsgericht Köln HRB 96099\nRegisterbekanntmachung nach dem Umwandlungsgesetz\n\naqua cloud GmbH\nGesellschaft mit beschränkter Haftung\nKöln\n\nDen Gläubigern der an der Verschmelzung beteiligten Rechtsträger ist, wenn sie binnen sechs Monaten nach dem Tag, an dem die Eintragung der Verschmelzung in das Register des Sitzes desjenigen Rechtsträgers, dessen Gläubiger sie sind, nach § 19 Absatz 3 UmwG als bekanntgemacht gilt, ihren Anspruch nach Grund und Höhe schriftlich anmelden, Sicherheit zu leisten, soweit sie nicht Befriedigung verlangen können. Dieses Recht steht den Gläubigern jedoch nur zu, wenn sie glaubhaft machen, dass durch die Verschmelzung die Erfüllung ihrer Forderung gefährdet wird."
    },
    {
      "date": "2025-03-14",
      "id": "103870",
      "original_text": "Registerbekanntmachung nach dem Umwandlungsgesetz\nNordrhein-Westfalen Amtsgericht Dortmund HRB 36802\nRethmann Unternehmensbeteiligungs AG – Selm",
      "type": "Registerbekanntmachung nach dem Umwandlungsgesetz",
      "state": "Nordrhein-Westfalen",
      "amtsgericht": "Amtsgericht Dortmund",
      "registernummer": "HRB 36802",
      "registerart": "HRB",
      "company_name": "Rethmann Unternehmensbeteiligungs AG",
      "company_seat": "Selm",
      "details": "14.03.2025 (Bekanntmachungsdatum)\n\nNordrhein-Westfalen Amtsgericht Dortmund HRB 36802\nRegisterbekanntmachung nach dem Umwandlungsgesetz\n\nRethmann Unternehmensbeteiligungs AG\nAktiengesellschaft\nSelm\n\nVeröffentlichungstext HRB 36802:\n\nDie Rethmann Unternehmensbeteiligungs AG mit Sitz in Selm beabsichtigt, gemäß Art. 2 Abs. 4 i.V.m. Art. 37 der Verordnung (EG) Nr. 2157/2001 des Rates vom 8. Oktober 2001 über das Statut der Europäischen Gesellschaft (SE) (SE-VO) eine Umwandlung in die Rechtsform der Europäischen Gesellschaft (Societas Europaea, SE).\nDie Mitglieder des Vorstands der vorbezeichneten Gesellschaft haben bei dem Registergericht Dortmund den Entwurf eines Umwandlungsplans zur formwechselnden Umwandlung der Gesellschaft in die Rechtsform einer Europäischen Gesellschaft (Societas Europaea, SE) eingereicht und bitten um Offenlegung gemäß Art. 37 Abs. 5 SE-VO i.V.m. Art. 21 SE-VO, § 5 SEAG, § 61 S. 2 UmwG.\nDie örtliche und sachliche Zuständigkeit des Amtsgerichts Dortmund für die Offenlegung des Entwurfs des Umwandlungsplans nach Art. 37 Abs. 5 SE-VO ergibt sich aus § 23 a Abs. 1 S. 1 Nr. 2 Abs. 2 Nr. 3 GVG i.V.m. §§ 374 Nr. 1, 377, 376 Abs. 2 FamFG i.V.m. Anlage zur Registerverordnung Amtsgerichte NRW vom 8. Mai 2013.\n\nDie Mitglieder des Vorstands der vorbezeichneten Gesellschaft erklären:\n1.\nDie Gesellschaft unter der Firma Rethmann Unternehmensbeteiligungs AG mit Sitz in Selm (Deutschland) wird in eine Europäische Gesellschaft (Societas Europaea, SE) umgewandelt.\n2.\nDie Gesellschaft ist im Handelsregister des Amtsgerichts Dortmund unter HRB 36802 eingetragen.\n3.\nDie Gesellschaft hält seit mehr als zwei Jahren eine Beteiligung an der französischen RETHMANN FRANCE SAS mit Sitz in 24 Rue Martre 92110 Clichy, RCS No. 844 743 674, R.C.S. Nanterre, eine Gesellschaft französischen Rechts, die mithin dem Recht eines Mitgliedstaates der Europäischen Union (EU) unterliegt.\n4.\nDie formwechselnd umgewandelte Europäische Gesellschaft wird unter der Firma Rethmann Unternehmensbeteiligungs SE im Rechtsverkehr auftreten. Sitz der künftigen Rethmann Unternehmensbeteiligungs SE bleibt unverändert Selm (Deutschland)."
    },
    {
      "date": "2025-03-14",
      "id": "103871",
      "original_text": "Registerbekanntmachung nach dem Umwandlungsgesetz\nNordrhein-Westfalen Amtsgericht Bad Oeynhausen HRB 9621\nEmscher Verwaltungs GmbH – Minden",
      "type": "Registerbekanntmachung nach dem Umwandlungsgesetz",
      "state": "Nordrhein-Westfalen",
      "amtsgericht": "Amtsgericht Bad Oeynhausen",
      "registernummer": "HRB 9621",
      "registerart": "HRB",
      "company_name": "Emscher Verwaltungs GmbH",
      "company_seat": "Minden",
      "details": "14.03.2025 (Bekanntmachungsdatum)\n\nNordrhein-Westfalen Amtsgericht Bad Oeynhausen HRB 9621\nRegisterbekanntmachung nach dem Umwandlungsgesetz 14.03.2025 (Eintragungsdatum)\n\nEmscher Verwaltungs GmbH\nGesellschaft mit beschränkter Haftung\nMinden\n\nDen Gläubigern der an der Verschmelzung beteiligten Rechtsträger ist, wenn sie binnen sechs Monaten nach dem Tag, an dem die Eintragung der Verschmelzung in das Register des Sitzes derjenigen Rechtsträger deren Gläubiger sie sind, nach § 19 Absatz 3 UmwG als bekanntgemacht gilt, ihren Anspruch nach Grund und Höhe schriftlich anmelden, Sicherheit zu leisten, soweit sie nicht Befriedigung verlangen können. Dieses Recht steht den Gläubigern jedoch nur zu, wenn sie glaubhaft machen, dass durch die Verschmelzung die Erfüllung ihrer Forderung gefährdet wird."
    },
    {
      "date": "2025-03-14",
      "id": "103872",
      "original_text": "Löschungsankündigung\nNordrhein-Westfalen Amtsgericht Dortmund HRB 30707\nGrüner Baum GmbH – Dortmund",
      "type": "Löschungsankündigung",
      "state": "Nordrhein-Westfalen",
      "amtsgericht": "Amtsgericht Dortmund",
      "registernummer": "HRB 30707",
      "registerart": "HRB",
      "company_name": "Grüner Baum GmbH",
      "company_seat": "Dortmund",
      "details": "14.03.2025 (Bekanntmachungsdatum)\n\nNordrhein-Westfalen Amtsgericht Dortmund HRB 30707\nLöschungsankündigung 14.03.2025 (Eintragungsdatum)\n\nGrüner Baum GmbH\nGesellschaft mit beschränkter Haftung\nDortmund\n\nDas Registergericht beabsichtigt die Gesellschaft von Amts wegen nach § 394 FamFG zu löschen. Die Frist zur Erhebung eines Widerspruchs ist auf zwei Monate festgesetzt."
    },
    {
      "date": "2025-03-14",
      "id": "103873",
      "original_text": "Löschungsankündigung\nNordrhein-Westfalen Amtsgericht Krefeld HRB 12486\nA.B.T.-Bau GmbH – Brüggen",
      "type": "Löschungsankündigung",
      "state": "Nordrhein-Westfalen",
      "amtsgericht": "Amtsgericht Krefeld",
      "registernummer": "HRB 12486",
      "registerart": "HRB",
      "company_name": "A.B.T.-Bau GmbH",
      "company_seat": "Brüggen",
      "details": "14.03.2025 (Bekanntmachungsdatum)\n\nNordrhein-Westfalen Amtsgericht Krefeld HRB 12486\nLöschungsankündigung\n\nA.B.T.-Bau GmbH\nGesellschaft mit beschränkter Haftung\nBrüggen\n\nDas Registergericht beabsichtigt die Gesellschaft von Amts wegen nach § 394 FamFG zu löschen. Die Frist zur Erhebung eines Widerspruchs ist auf einen Monat festgesetzt."
    },
    {
      "date": "2025-03-14",
      "id": "103874",
      "original_text": "Registerbekanntmachung nach dem Umwandlungsgesetz\nNordrhein-Westfalen Amtsgericht Münster HRA 12063\nJungic GmbH & Co. KG – Münster",
      "type": "Registerbekanntmachung nach dem Umwandlungsgesetz",
      "state": "Nordrhein-Westfalen",
      "amtsgericht": "Amtsgericht Münster",
      "registernummer": "HRA 12063",
      "registerart": "HRA",
      "company_name": "Jungic GmbH & Co. KG",
      "company_seat": "Münster",
      "details": "14.03.2025 (Bekanntmachungsdatum)\n\nNordrhein-Westfalen Amtsgericht Münster HRA 12063\nRegisterbekanntmachung nach dem Umwandlungsgesetz 14.03.2025 (Eintragungsdatum)\n\nJungic GmbH & Co. KG\nKommanditgesellschaft\nMünster\n\nDen Gläubigern der an der formwechselnden Umwandlung beteiligten Rechtsträger ist, wenn sie binnen sechs Monaten nach dem Tag, an dem die Eintragung der formwechselnden Umwandlung in das Register des Sitzes desjenigen Rechtsträgers, dessen Gläubiger sie sind, nach § 19 Absatz 3 UmwG als bekanntgemacht gilt, ihren Anspruch nach Grund und Höhe schriftlich anmelden, Sicherheit zu leisten, soweit sie nicht Befriedigung verlangen können. Dieses Recht steht den Gläubigern jedoch nur zu, wenn sie glaubhaft machen, dass durch die formwechselnden Umwandlung die Erfüllung ihrer Forderung gefährdet wird."
    },
    {
      "date": "2025-03-14",
      "id": "103875",
      "original_text": "Registerbekanntmachung nach dem Umwandlungsgesetz\nHessen Amtsgericht Wetzlar HRB 9357\nUNIKAT TRAVEL GmbH – Solms",
      "type": "Registerbekanntmachung nach dem Umwandlungsgesetz",
      "state": "Hessen",
      "amtsgericht": "Amtsgericht Wetzlar",
      "registernummer": "HRB 9357",
      "registerart": "HRB",
      "company_name": "UNIKAT TRAVEL GmbH",
      "company_seat": "Solms",
      "details": "14.03.2025 (Bekanntmachungsdatum)\n\nHessen Amtsgericht Wetzlar HRB 9357\nRegisterbekanntmachung nach dem Umwandlungsgesetz 14.03.2025 (Eintragungsdatum)\n\nUNIKAT TRAVEL GmbH\nGesellschaft mit beschränkter Haftung\nSolms\n\nDen Gläubigern der an der Ausgliederung beteiligten Rechtsträger ist, wenn sie binnen sechs Monaten nach dem Tag, an dem die Eintragung der Ausgliederung in das Register des Sitzes desjenigen Rechtsträgers, dessen Gläubiger sie sind, nach §§ 125, 19 Absatz 3 UmwG bekannt gemacht worden ist, ihren Anspruch nach Grund und Höhe schriftlich anmelden, Sicherheit zu leisten, soweit sie nicht Befriedigung verlangen können. Dieses Recht steht den Gläubigern jedoch nur zu, wenn sie glaubhaft machen, dass durch die Ausgliederung die Erfüllung ihrer Forderung gefährdet wird."
    },
    {
      "date": "2025-03-14",
      "id": "103876",
      "original_text": "Einreichung neuer Dokumente\nHessen Amtsgericht Wiesbaden HRB 2191\nLOTTO Hessen GmbH – Wiesbaden",
      "type": "Einreichung neuer Dokumente",
      "state": "Hessen",
      "amtsgericht": "Amtsgericht Wiesbaden",
      "registernummer": "HRB 2191",
      "registerart": "HRB",
      "company_name": "LOTTO Hessen GmbH",
      "company_seat": "Wiesbaden",
      "details": "14.03.2025 (Bekanntmachungsdatum)\n\nHessen Amtsgericht Wiesbaden HRB 2191\nEinreichung neuer Dokumente 14.03.2025 (Eintragungsdatum)\n\nLOTTO Hessen GmbH\nGesellschaft mit beschränkter Haftung\nWiesbaden\n\nDurch eine Änderung in den Personen der Aufsichtsratsmitglieder ist eine Liste der Mitglieder des Aufsichtsrates zum Handelsregister eingereicht worden."
    },
    {
      "date": "2025-03-14",
      "id": "103877",
      "original_text": "Löschungsankündigung\nHessen Amtsgericht Frankfurt am Main HRB 106097\nArasch Handels GmbH – Frankfurt am Main",
      "type": "Löschungsankündigung",
      "state": "Hessen",
      "amtsgericht": "Amtsgericht Frankfurt am Main",
      "registernummer": "HRB 106097",
      "registerart": "HRB",
      "company_name": "Arasch Handels GmbH",
      "company_seat": "Frankfurt am Main",
      "details": "14.03.2025 (Bekanntmachungsdatum)\n\nHessen Amtsgericht Frankfurt am Main HRB 106097\nLöschungsankündigung\n\nArasch Handels GmbH\nGesellschaft mit beschränkter Haftung\nFrankfurt am Main\n\nDas Registergericht beabsichtigt die im Handelsregister eingetragene Gesellschaft von Amts wegen nach § 394 FamFG zu löschen. Die Frist zur Erhebung eines Widerspruchs gegen die beabsichtigte Löschung wird auf 1 Monat festgesetzt."
    },
    {
      "date": "2025-03-14",
      "id": "103878",
      "original_text": "Registerbekanntmachung nach dem Umwandlungsgesetz\nHessen Amtsgericht Wetzlar HRA 8106\nMarius Tomaszczyk e. K. – Solms",
      "type": "Registerbekanntmachung nach dem Umwandlungsgesetz",
      "state": "Hessen",
      "amtsgericht": "Amtsgericht Wetzlar",
      "registernummer": "HRA 8106",
      "registerart": "HRA",
      "company_name": "Marius Tomaszczyk e. K.",
      "company_seat": "Solms",
      "details": "14.03.2025 (Bekanntmachungsdatum)\n\nHessen Amtsgericht Wetzlar HRA 8106\nRegisterbekanntmachung nach dem Umwandlungsgesetz 14.03.2025 (Eintragungsdatum)\n\nMarius Tomaszczyk e. K.\nEinzelkaufmann / Einzelkauffrau\nSolms\n\nDen Gläubigern der an der Ausgliederung beteiligten Rechtsträger ist, wenn sie binnen sechs Monaten nach dem Tag, an dem die Eintragung der Ausgliederung in das Register des Sitzes desjenigen Rechtsträgers, dessen Gläubiger sie sind, nach §§ 125, 19 Absatz 3 UmwG bekannt gemacht worden ist, ihren Anspruch nach Grund und Höhe schriftlich anmelden, Sicherheit zu leisten, soweit sie nicht Befriedigung verlangen können. Dieses Recht steht den Gläubigern jedoch nur zu, wenn sie glaubhaft machen, dass durch die Ausgliederung die Erfüllung ihrer Forderung gefährdet wird."
    },
    {
      "date": "2025-03-14",
      "id": "103879",
      "original_text": "Löschungsankündigung\nHessen Amtsgericht Darmstadt HRB 87392\nFacility-Management GmbH des Kreises Groß-Gerau (FMGG) – Groß-Gerau",
      "type": "Löschungsankündigung",
      "state": "Hessen",
      "amtsgericht": "Amtsgericht Darmstadt",
      "registernummer": "HRB 87392",
      "registerart": "HRB",
      "company_name": "Facility-Management GmbH des Kreises Groß-Gerau (FMGG)",
      "company_seat": "Groß-Gerau",
      "details": "14.03.2025 (Bekanntmachungsdatum)\n\nHessen Amtsgericht Darmstadt HRB 87392\nLöschungsankündigung 14.03.2025 (Eintragungsdatum)\n\nFacility-Management GmbH des Kreises Groß-Gerau (FMGG)\nGesellschaft mit beschränkter Haftung\nGroß-Gerau\n\nDas Registergericht beabsichtigt die im Handelsregister eingetragene Gesellschaft von Amts wegen nach § 394 FamFG zu löschen. Die Frist zur Erhebung eines Widerspruchs gegen die beabsichtigte Löschung wird auf 3 Monate festgesetzt."
    },
    {
      "date": "2025-03-14",
      "id": "103880",
      "original_text": "Löschungsankündigung\nHessen Amtsgericht Darmstadt HRB 101614\nP & S GmbH – Schaafheim",
      "type": "Löschungsankündigung",
      "state": "Hessen",
      "amtsgericht": "Amtsgericht Darmstadt",
      "registernummer": "HRB 101614",
      "registerart": "HRB",
      "company_name": "P & S GmbH",
      "company_seat": "Schaafheim",
      "details": "14.03.2025 (Bekanntmachungsdatum)\n\nHessen Amtsgericht Darmstadt HRB 101614\nLöschungsankündigung 14.03.2025 (Eintragungsdatum)\n\nP & S GmbH\nGesellschaft mit beschränkter Haftung\nSchaafheim\n\nDas Registergericht beabsichtigt die im Handelsregister eingetragene Gesellschaft von Amts wegen nach § 394 FamFG zu löschen. Die Frist zur Erhebung eines Widerspruchs gegen die beabsichtigte Löschung wird auf 3 Monate festgesetzt."
    },
    {
      "date": "2025-03-14",
      "id": "103881",
      "original_text": "Löschungsankündigung\nHessen Amtsgericht Darmstadt VR 60595\nTürkischer CB-Funkverein Biblis Kanal 24 FM Anadolu – Biblis",
      "type": "Löschungsankündigung",
      "state": "Hessen",
      "amtsgericht": "Amtsgericht Darmstadt",
      "registernummer": "VR 60595",
      "registerart": "VR",
      "company_name": "Türkischer CB-Funkverein Biblis Kanal 24 FM Anadolu",
      "company_seat": "Biblis",
      "details": "14.03.2025 (Bekanntmachungsdatum)\n\nHessen Amtsgericht Darmstadt VR 60595\nLöschungsankündigung\n\nTürkischer CB-Funkverein Biblis Kanal 24 FM Anadolu\neingetragener Verein\nBiblis\n\nDas Registergericht beabsichtigt den im Vereinsregister eingetragenen Verein von Amts wegen nach § 395 FamFG zu löschen. Die Frist zur Erhebung eines Widerspruchs gegen die beabsichtigte Löschung wird auf 3 Monate festgesetzt."
    },
    {
      "date": "2025-03-14",
      "id": "103882",
      "original_text": "Löschungsankündigung\nHessen Amtsgericht Darmstadt HRB 101975\nCleanweave GmbH – Darmstadt",
      "type": "Löschungsankündigung",
      "state": "Hessen",
      "amtsgericht": "Amtsgericht Darmstadt",
      "registernummer": "HRB 101975",
      "registerart": "HRB",
      "company_name": "Cleanweave GmbH",
      "company_seat": "Darmstadt",
      "details": "14.03.2025 (Bekanntmachungsdatum)\n\nHessen Amtsgericht Darmstadt HRB 101975\nLöschungsankündigung\n\nCleanweave GmbH\nGesellschaft mit beschränkter Haftung\nDarmstadt\n\nDas Registergericht beabsichtigt die im Handelsregister eingetragene Gesellschaft von Amts wegen nach § 394 FamFG zu löschen. Die Frist zur Erhebung eines Widerspruchs gegen die beabsichtigte Löschung wird auf 3 Monate festgesetzt."
    },
    {
      "date": "2025-03-14",
      "id": "103883",
      "original_text": "Registerbekanntmachung nach dem Umwandlungsgesetz\nHessen Amtsgericht Wetzlar HRB 9217\nAir Colleg GmbH – Braunfels",
      "type": "Registerbekanntmachung nach dem Umwandlungsgesetz",
      "state": "Hessen",
      "amtsgericht": "Amtsgericht Wetzlar",
      "registernummer": "HRB 9217",
      "registerart": "HRB",
      "company_name": "Air Colleg GmbH",
      "company_seat": "Braunfels",
      "details": "14.03.2025 (Bekanntmachungsdatum)\n\nHessen Amtsgericht Wetzlar HRB 9217\nRegisterbekanntmachung nach dem Umwandlungsgesetz 14.03.2025 (Eintragungsdatum)\n\nAir Colleg GmbH\nGesellschaft mit beschränkter Haftung\nBraunfels\n\nDen Gläubigern der an der formwechselnden Umwandlung beteiligten Rechtsträger ist, wenn sie binnen sechs Monaten nach dem Tag, an dem die Eintragung der formwechselnden Umwandlung in das Register des Sitzes desjenigen Rechtsträgers, dessen Gläubiger sie sind, nach § 201 UmwG bekannt gemacht worden ist, ihren Anspruch nach Grund und Höhe schriftlich anmelden, Sicherheit zu leisten, soweit sie nicht Befriedigung verlangen können. Dieses Recht steht den Gläubigern jedoch nur zu, wenn sie glaubhaft machen, dass durch die formwechselnden Umwandlung die Erfüllung ihrer Forderung gefährdet wird."
    },
    {
      "date": "2025-03-14",
      "id": "103884",
      "original_text": "Registerbekanntmachung nach dem Umwandlungsgesetz\nHessen Amtsgericht Wetzlar GsR 156\nAirColleg Göbel eGbR – Braunfels",
      "type": "Registerbekanntmachung nach dem Umwandlungsgesetz",
      "state": "Hessen",
      "amtsgericht": "Amtsgericht Wetzlar",
      "registernummer": "GsR 156",
      "registerart": "GsR",
      "company_name": "AirColleg Göbel eGbR",
      "company_seat": "Braunfels",
      "details": "14.03.2025 (Bekanntmachungsdatum)\n\nHessen Amtsgericht Wetzlar GsR 156\nRegisterbekanntmachung nach dem Umwandlungsgesetz 14.03.2025 (Eintragungsdatum)\n\nAirColleg Göbel eGbR\nGesellschaft bürgerlichen Rechts\nBraunfels\n\nDen Gläubigern der an der formwechselnden Umwandlung beteiligten Rechtsträger ist, wenn sie binnen sechs Monaten nach dem Tag, an dem die Eintragung der formwechselnden Umwandlung in das Register des Sitzes desjenigen Rechtsträgers, dessen Gläubiger sie sind, nach § 201 UmwG bekannt gemacht worden ist, ihren Anspruch nach Grund und Höhe schriftlich anmelden, Sicherheit zu leisten, soweit sie nicht Befriedigung verlangen können. Dieses Recht steht den Gläubigern jedoch nur zu, wenn sie glaubhaft machen, dass durch die formwechselnden Umwandlung die Erfüllung ihrer Forderung gefährdet wird."
    },
    {
      "date": "2025-03-14",
      "id": "103885",
      "original_text": "Einreichung neuer Dokumente\nHessen Amtsgericht Frankfurt am Main HRB 112163\nKION GROUP AG – Frankfurt am Main",
      "type": "Einreichung neuer Dokumente",
      "state": "Hessen",
      "amtsgericht": "Amtsgericht Frankfurt am Main",
      "registernummer": "HRB 112163",
      "registerart": "HRB",
      "company_name": "KION GROUP AG",
      "company_seat": "Frankfurt am Main",
      "details": "14.03.2025 (Bekanntmachungsdatum)\n\nHessen Amtsgericht Frankfurt am Main HRB 112163\nEinreichung neuer Dokumente\n\nKION GROUP AG\nAktiengesellschaft\nFrankfurt am Main\n\nDurch eine Änderung in den Personen der Aufsichtsratsmitglieder ist eine Liste der Mitglieder des Aufsichtsrates zum Handelsregister eingereicht worden."
    },
    {
      "date": "2025-03-14",
      "id": "103886",
      "original_text": "Einreichung neuer Dokumente\nHessen Amtsgericht Frankfurt am Main HRB 103643\nChina Europe International Exchange AG – Frankfurt am Main",
      "type": "Einreichung neuer Dokumente",
      "state": "Hessen",
      "amtsgericht": "Amtsgericht Frankfurt am Main",
      "registernummer": "HRB 103643",
      "registerart": "HRB",
      "company_name": "China Europe International Exchange AG",
      "company_seat": "Frankfurt am Main",
      "details": "14.03.2025 (Bekanntmachungsdatum)\n\nHessen Amtsgericht Frankfurt am Main HRB 103643\nEinreichung neuer Dokumente 14.03.2025 (Eintragungsdatum)\n\nChina Europe International Exchange AG\nAktiengesellschaft\nFrankfurt am Main\n\nDurch eine Änderung in den Personen der Aufsichtsratsmitglieder ist eine Liste der Mitglieder des Aufsichtsrates zum Handelsregister eingereicht worden."
    },
    {
      "date": "2025-03-14",
      "id": "103887",
      "original_text": "Einreichung neuer Dokumente\nHessen Amtsgericht Frankfurt am Main HRB 103643\nChina Europe International Exchange AG – Frankfurt am Main",
      "type": "Einreichung neuer Dokumente",
      "state": "Hessen",
      "amtsgericht": "Amtsgericht Frankfurt am Main",
      "registernummer": "HRB 103643",
      "registerart": "HRB",
      "company_name": "China Europe International Exchange AG",
      "company_seat": "Frankfurt am Main",
      "details": "14.03.2025 (Bekanntmachungsdatum)\n\nHessen Amtsgericht Frankfurt am Main HRB 103643\nEinreichung neuer Dokumente 14.03.2025 (Eintragungsdatum)\n\nChina Europe International Exchange AG\nAktiengesellschaft\nFrankfurt am Main\n\nDurch eine Änderung in den Personen der Aufsichtsratsmitglieder ist eine Liste der Mitglieder des Aufsichtsrates zum Handelsregister eingereicht worden."
    }
  ]
}