{
  "date": "2025-03-03",
  "date_of_scrape": "2025-03-04T04:07:44.399Z",
  "tool_version": "0.2.0",
  "number_of_announcements": 108,
  "announcements": [
    {
      "date": "2025-03-03",
      "id": "102651",
      "original_text": "Registerbekanntmachung nach dem Umwandlungsgesetz\nHamburg Amtsgericht Hamburg HRB 109922\nNexion GmbH – Hamburg",
      "type": "Registerbekanntmachung nach dem Umwandlungsgesetz",
      "state": "Hamburg",
      "amtsgericht": "Amtsgericht Hamburg",
      "registernummer": "HRB 109922",
      "registerart": "HRB",
      "company_name": "Nexion GmbH",
      "company_seat": "Hamburg",
      "details": "03.03.2025 (Bekanntmachungsdatum)\n\nHamburg Amtsgericht Hamburg HRB 109922\nRegisterbekanntmachung nach dem Umwandlungsgesetz 24.02.2025 (Eintragungsdatum)\n\nNexion GmbH\nGesellschaft mit beschränkter Haftung\nHamburg\n\nAls nicht eingetragen wird bekannt gemacht:\nDen Gläubigern der an der Verschmelzung beteiligten Gesellschaften ist, wenn sie binnen sechs Monaten nach dem Tag, an dem die Eintragung der Verschmelzung in das Register des Sitzes desjenigen Rechtsträgers, dessen Gläubiger sie sind, nach § 19 Absatz 3 UmwG als bekannt gemacht gilt, ihren Anspruch nach Grund und Höhe schriftlich anmelden, Sicherheit zu leisten, soweit sie nicht Befriedigung verlangen können. Dieses Recht steht den Gläubigern jedoch nur zu, wenn sie glaubhaft machen, dass durch die Verschmelzung die Erfüllung ihrer Forderung gefährdet wird."
    },
    {
      "date": "2025-03-03",
      "id": "102652",
      "original_text": "Einreichung neuer Dokumente\nHamburg Amtsgericht Hamburg HRB 10199\nTEREG Gebäudedienste GmbH – Hamburg",
      "type": "Einreichung neuer Dokumente",
      "state": "Hamburg",
      "amtsgericht": "Amtsgericht Hamburg",
      "registernummer": "HRB 10199",
      "registerart": "HRB",
      "company_name": "TEREG Gebäudedienste GmbH",
      "company_seat": "Hamburg",
      "details": "03.03.2025 (Bekanntmachungsdatum)\n\nHamburg Amtsgericht Hamburg HRB 10199\nEinreichung neuer Dokumente\n\nTEREG Gebäudedienste GmbH\nGesellschaft mit beschränkter Haftung\nHamburg\n\nAls nicht eingetragen wird bekannt gemacht: Liste des Aufsichtsrats wurde eingereicht."
    },
    {
      "date": "2025-03-03",
      "id": "102653",
      "original_text": "Einreichung neuer Dokumente\nHamburg Amtsgericht Hamburg HRB 14604\nEuropäisch-Iranische Handelsbank Aktiengesellschaft – Hamburg",
      "type": "Einreichung neuer Dokumente",
      "state": "Hamburg",
      "amtsgericht": "Amtsgericht Hamburg",
      "registernummer": "HRB 14604",
      "registerart": "HRB",
      "company_name": "Europäisch-Iranische Handelsbank Aktiengesellschaft",
      "company_seat": "Hamburg",
      "details": "03.03.2025 (Bekanntmachungsdatum)\n\nHamburg Amtsgericht Hamburg HRB 14604\nEinreichung neuer Dokumente\n\nEuropäisch-Iranische Handelsbank Aktiengesellschaft\nAktiengesellschaft\nHamburg\n\nAls nicht eingetragen wird bekannt gemacht: Liste des Aufsichtsrats wurde eingereicht."
    },
    {
      "date": "2025-03-03",
      "id": "102654",
      "original_text": "Löschungsankündigung\nHamburg Amtsgericht Hamburg HRA 119417\nOishii Schanze UG (haftungsbeschränkt) & Co. KG – Hamburg",
      "type": "Löschungsankündigung",
      "state": "Hamburg",
      "amtsgericht": "Amtsgericht Hamburg",
      "registernummer": "HRA 119417",
      "registerart": "HRA",
      "company_name": "Oishii Schanze UG (haftungsbeschränkt) & Co. KG",
      "company_seat": "Hamburg",
      "details": "03.03.2025 (Bekanntmachungsdatum)\n\nHamburg Amtsgericht Hamburg HRA 119417\nLöschungsankündigung\n\nOishii Schanze UG (haftungsbeschränkt) & Co. KG\nKommanditgesellschaft\nHamburg\n\nDas Registergericht beabsichtigt, die im Handelsregister eingetragene Gesellschaft von Amts wegen nach § 394 Abs. 4 FamFG zu löschen. Die Frist zur Erhebung eines Widerspruchs gegen die beabsichtigte Löschung wird auf 3 Monate festgesetzt."
    },
    {
      "date": "2025-03-03",
      "id": "102655",
      "original_text": "Registerbekanntmachung nach dem Umwandlungsgesetz\nHamburg Amtsgericht Hamburg HRB 187234\nmvn.energy GmbH – Hamburg",
      "type": "Registerbekanntmachung nach dem Umwandlungsgesetz",
      "state": "Hamburg",
      "amtsgericht": "Amtsgericht Hamburg",
      "registernummer": "HRB 187234",
      "registerart": "HRB",
      "company_name": "mvn.energy GmbH",
      "company_seat": "Hamburg",
      "details": "03.03.2025 (Bekanntmachungsdatum)\n\nHamburg Amtsgericht Hamburg HRB 187234\nRegisterbekanntmachung nach dem Umwandlungsgesetz 27.02.2025 (Eintragungsdatum)\n\nmvn.energy GmbH\nGesellschaft mit beschränkter Haftung\nHamburg\n\nAls nicht eingetragen wird bekannt gemacht:\nDen Gläubigern der an der Ausgliederung beteiligten Gesellschaften ist, wenn sie binnen sechs Monaten nach dem Tag, an dem die Eintragung der Ausgliederung in das Register des Sitzes desjenigen Rechtsträgers, dessen Gläubiger sie sind, nach § 19 Absatz 3 UmwG als bekannt gemacht gilt, ihren Anspruch nach Grund und Höhe schriftlich anmelden, Sicherheit zu leisten, soweit sie nicht Befriedigung verlangen können. Dieses Recht steht den Gläubigern jedoch nur zu, wenn sie glaubhaft machen, dass durch die Ausgliederung die Erfüllung ihrer Forderung gefährdet wird."
    },
    {
      "date": "2025-03-03",
      "id": "102656",
      "original_text": "Registerbekanntmachung nach dem Umwandlungsgesetz\nHamburg Amtsgericht Hamburg HRB 171711\nLedana Verwaltungs GmbH – Hamburg",
      "type": "Registerbekanntmachung nach dem Umwandlungsgesetz",
      "state": "Hamburg",
      "amtsgericht": "Amtsgericht Hamburg",
      "registernummer": "HRB 171711",
      "registerart": "HRB",
      "company_name": "Ledana Verwaltungs GmbH",
      "company_seat": "Hamburg",
      "details": "03.03.2025 (Bekanntmachungsdatum)\n\nHamburg Amtsgericht Hamburg HRB 171711\nRegisterbekanntmachung nach dem Umwandlungsgesetz 28.02.2025 (Eintragungsdatum)\n\nLedana Verwaltungs GmbH\nGesellschaft mit beschränkter Haftung\nHamburg\n\nAls nicht eingetragen wird bekannt gemacht:\nDen Gläubigern der an der Verschmelzung beteiligten Gesellschaften ist, wenn sie binnen sechs Monaten nach dem Tag, an dem die Eintragung der Verschmelzung in das Register des Sitzes desjenigen Rechtsträgers, dessen Gläubiger sie sind, nach § 19 Absatz 3 UmwG als bekannt gemacht gilt, ihren Anspruch nach Grund und Höhe schriftlich anmelden, Sicherheit zu leisten, soweit sie nicht Befriedigung verlangen können. Dieses Recht steht den Gläubigern jedoch nur zu, wenn sie glaubhaft machen, dass durch die Verschmelzung die Erfüllung ihrer Forderung gefährdet wird."
    },
    {
      "date": "2025-03-03",
      "id": "102657",
      "original_text": "Registerbekanntmachung nach dem Umwandlungsgesetz\nHamburg Amtsgericht Hamburg HRB 156367\nCARISTO Beteiligungen GmbH – Hamburg",
      "type": "Registerbekanntmachung nach dem Umwandlungsgesetz",
      "state": "Hamburg",
      "amtsgericht": "Amtsgericht Hamburg",
      "registernummer": "HRB 156367",
      "registerart": "HRB",
      "company_name": "CARISTO Beteiligungen GmbH",
      "company_seat": "Hamburg",
      "details": "03.03.2025 (Bekanntmachungsdatum)\n\nHamburg Amtsgericht Hamburg HRB 156367\nRegisterbekanntmachung nach dem Umwandlungsgesetz 28.02.2025 (Eintragungsdatum)\n\nCARISTO Beteiligungen GmbH\nGesellschaft mit beschränkter Haftung\nHamburg\n\nAls nicht eingetragen wird bekannt gemacht:\nDen Gläubigern der an der Verschmelzung beteiligten Gesellschaften ist, wenn sie binnen sechs Monaten nach dem Tag, an dem die Eintragung der Verschmelzung in das Register des Sitzes desjenigen Rechtsträgers, dessen Gläubiger sie sind, nach § 19 Absatz 3 UmwG als bekannt gemacht gilt, ihren Anspruch nach Grund und Höhe schriftlich anmelden, Sicherheit zu leisten, soweit sie nicht Befriedigung verlangen können. Dieses Recht steht den Gläubigern jedoch nur zu, wenn sie glaubhaft machen, dass durch die Verschmelzung die Erfüllung ihrer Forderung gefährdet wird."
    },
    {
      "date": "2025-03-03",
      "id": "102658",
      "original_text": "Registerbekanntmachung nach dem Umwandlungsgesetz\nHamburg Amtsgericht Hamburg HRB 53459\nNORDEG Norddeutsche Elektronikverwertungsgesellschaft mbH – Hamburg",
      "type": "Registerbekanntmachung nach dem Umwandlungsgesetz",
      "state": "Hamburg",
      "amtsgericht": "Amtsgericht Hamburg",
      "registernummer": "HRB 53459",
      "registerart": "HRB",
      "company_name": "NORDEG Norddeutsche Elektronikverwertungsgesellschaft mbH",
      "company_seat": "Hamburg",
      "details": "03.03.2025 (Bekanntmachungsdatum)\n\nHamburg Amtsgericht Hamburg HRB 53459\nRegisterbekanntmachung nach dem Umwandlungsgesetz 28.02.2025 (Eintragungsdatum)\n\nNORDEG Norddeutsche Elektronikverwertungsgesellschaft mbH\nGesellschaft mit beschränkter Haftung\nHamburg\n\nAls nicht eingetragen wird bekannt gemacht:\nDen Gläubigern der an der Verschmelzung beteiligten Gesellschaften ist, wenn sie binnen sechs Monaten nach dem Tag, an dem die Eintragung der Verschmelzung in das Register des Sitzes desjenigen Rechtsträgers, dessen Gläubiger sie sind, nach § 19 Absatz 3 UmwG als bekannt gemacht gilt, ihren Anspruch nach Grund und Höhe schriftlich anmelden, Sicherheit zu leisten, soweit sie nicht Befriedigung verlangen können. Dieses Recht steht den Gläubigern jedoch nur zu, wenn sie glaubhaft machen, dass durch die Verschmelzung die Erfüllung ihrer Forderung gefährdet wird."
    },
    {
      "date": "2025-03-03",
      "id": "102659",
      "original_text": "Einreichung neuer Dokumente\nHamburg Amtsgericht Hamburg HRB 157670\nStena Glovis SE – Hamburg",
      "type": "Einreichung neuer Dokumente",
      "state": "Hamburg",
      "amtsgericht": "Amtsgericht Hamburg",
      "registernummer": "HRB 157670",
      "registerart": "HRB",
      "company_name": "Stena Glovis SE",
      "company_seat": "Hamburg",
      "details": "03.03.2025 (Bekanntmachungsdatum)\n\nHamburg Amtsgericht Hamburg HRB 157670\nEinreichung neuer Dokumente\n\nStena Glovis SE\nEuropäische Aktiengesellschaft (SE)\nHamburg\n\nAls nicht eingetragen wird bekannt gemacht: Liste der Verwaltungsratsmitglieder wurde eingereicht."
    },
    {
      "date": "2025-03-03",
      "id": "102660",
      "original_text": "Registerbekanntmachung nach dem Umwandlungsgesetz\nHamburg Amtsgericht Hamburg HRB 157441\nDVP Audit GmbH Wirtschaftsprüfungsgesellschaft – Hamburg",
      "type": "Registerbekanntmachung nach dem Umwandlungsgesetz",
      "state": "Hamburg",
      "amtsgericht": "Amtsgericht Hamburg",
      "registernummer": "HRB 157441",
      "registerart": "HRB",
      "company_name": "DVP Audit GmbH Wirtschaftsprüfungsgesellschaft",
      "company_seat": "Hamburg",
      "details": "03.03.2025 (Bekanntmachungsdatum)\n\nHamburg Amtsgericht Hamburg HRB 157441\nRegisterbekanntmachung nach dem Umwandlungsgesetz 27.02.2025 (Eintragungsdatum)\n\nDVP Audit GmbH Wirtschaftsprüfungsgesellschaft\nGesellschaft mit beschränkter Haftung\nHamburg\n\nAls nicht eingetragen wird bekannt gemacht:\nDen Gläubigern der an der Verschmelzung beteiligten Gesellschaften ist, wenn sie binnen sechs Monaten nach dem Tag, an dem die Eintragung der Verschmelzung in das Register des Sitzes desjenigen Rechtsträgers, dessen Gläubiger sie sind, nach § 19 Absatz 3 UmwG als bekannt gemacht gilt, ihren Anspruch nach Grund und Höhe schriftlich anmelden, Sicherheit zu leisten, soweit sie nicht Befriedigung verlangen können. Dieses Recht steht den Gläubigern jedoch nur zu, wenn sie glaubhaft machen, dass durch die Verschmelzung die Erfüllung ihrer Forderung gefährdet wird."
    },
    {
      "date": "2025-03-03",
      "id": "102661",
      "original_text": "Registerbekanntmachung nach dem Umwandlungsgesetz\nHamburg Amtsgericht Hamburg HRB 136082\nmoovin Immobilien GmbH – Hamburg",
      "type": "Registerbekanntmachung nach dem Umwandlungsgesetz",
      "state": "Hamburg",
      "amtsgericht": "Amtsgericht Hamburg",
      "registernummer": "HRB 136082",
      "registerart": "HRB",
      "company_name": "moovin Immobilien GmbH",
      "company_seat": "Hamburg",
      "details": "03.03.2025 (Bekanntmachungsdatum)\n\nHamburg Amtsgericht Hamburg HRB 136082\nRegisterbekanntmachung nach dem Umwandlungsgesetz 27.02.2025 (Eintragungsdatum)\n\nmoovin Immobilien GmbH\nGesellschaft mit beschränkter Haftung\nHamburg\n\nAls nicht eingetragen wird bekannt gemacht:\nDen Gläubigern der an der Ausgliederung beteiligten Gesellschaften ist, wenn sie binnen sechs Monaten nach dem Tag, an dem die Eintragung der Ausgliederung in das Register des Sitzes desjenigen Rechtsträgers, dessen Gläubiger sie sind, nach § 19 Absatz 3 UmwG als bekannt gemacht gilt, ihren Anspruch nach Grund und Höhe schriftlich anmelden, Sicherheit zu leisten, soweit sie nicht Befriedigung verlangen können. Dieses Recht steht den Gläubigern jedoch nur zu, wenn sie glaubhaft machen, dass durch die Ausgliederung die Erfüllung ihrer Forderung gefährdet wird."
    },
    {
      "date": "2025-03-03",
      "id": "102662",
      "original_text": "Einreichung neuer Dokumente\nHamburg Amtsgericht Hamburg HRB 58302\n\"WICHERN\" Betreuungsgesellschaft mbH – Hamburg",
      "type": "Einreichung neuer Dokumente",
      "state": "Hamburg",
      "amtsgericht": "Amtsgericht Hamburg",
      "registernummer": "HRB 58302",
      "registerart": "HRB",
      "company_name": "\"WICHERN\" Betreuungsgesellschaft mbH",
      "company_seat": "Hamburg",
      "details": "03.03.2025 (Bekanntmachungsdatum)\n\nHamburg Amtsgericht Hamburg HRB 58302\nEinreichung neuer Dokumente\n\n\"WICHERN\" Betreuungsgesellschaft mbH\nGesellschaft mit beschränkter Haftung\nHamburg\n\nAls nicht eingetragen wird bekannt gemacht: Liste des Aufsichtsrats wurde eingereicht."
    },
    {
      "date": "2025-03-03",
      "id": "102663",
      "original_text": "Registerbekanntmachung nach dem Umwandlungsgesetz\nHamburg Amtsgericht Hamburg HRB 125196\nHGA Real Estate GmbH – Hamburg",
      "type": "Registerbekanntmachung nach dem Umwandlungsgesetz",
      "state": "Hamburg",
      "amtsgericht": "Amtsgericht Hamburg",
      "registernummer": "HRB 125196",
      "registerart": "HRB",
      "company_name": "HGA Real Estate GmbH",
      "company_seat": "Hamburg",
      "details": "03.03.2025 (Bekanntmachungsdatum)\n\nHamburg Amtsgericht Hamburg HRB 125196\nRegisterbekanntmachung nach dem Umwandlungsgesetz 27.02.2025 (Eintragungsdatum)\n\nHGA Real Estate GmbH\nGesellschaft mit beschränkter Haftung\nHamburg\n\nAls nicht eingetragen wird bekannt gemacht:\nDen Gläubigern der an der Verschmelzung beteiligten Gesellschaften ist, wenn sie binnen sechs Monaten nach dem Tag, an dem die Eintragung der Verschmelzung in das Register des Sitzes desjenigen Rechtsträgers, dessen Gläubiger sie sind, nach § 19 Absatz 3 UmwG als bekannt gemacht gilt, ihren Anspruch nach Grund und Höhe schriftlich anmelden, Sicherheit zu leisten, soweit sie nicht Befriedigung verlangen können. Dieses Recht steht den Gläubigern jedoch nur zu, wenn sie glaubhaft machen, dass durch die Verschmelzung die Erfüllung ihrer Forderung gefährdet wird."
    },
    {
      "date": "2025-03-03",
      "id": "102664",
      "original_text": "Einreichung neuer Dokumente\nHamburg Amtsgericht Hamburg HRB 1902\nHamburger Hafen und Logistik Aktiengesellschaft – Hamburg",
      "type": "Einreichung neuer Dokumente",
      "state": "Hamburg",
      "amtsgericht": "Amtsgericht Hamburg",
      "registernummer": "HRB 1902",
      "registerart": "HRB",
      "company_name": "Hamburger Hafen und Logistik Aktiengesellschaft",
      "company_seat": "Hamburg",
      "details": "03.03.2025 (Bekanntmachungsdatum)\n\nHamburg Amtsgericht Hamburg HRB 1902\nEinreichung neuer Dokumente\n\nHamburger Hafen und Logistik Aktiengesellschaft\nAktiengesellschaft\nHamburg\n\nAls nicht eingetragen wird bekannt gemacht: Liste des Aufsichtsrats wurde eingereicht."
    },
    {
      "date": "2025-03-03",
      "id": "102665",
      "original_text": "Registerbekanntmachung nach dem Umwandlungsgesetz\nHamburg Amtsgericht Hamburg HRB 32257\npluss Personalmanagement GmbH – Hamburg",
      "type": "Registerbekanntmachung nach dem Umwandlungsgesetz",
      "state": "Hamburg",
      "amtsgericht": "Amtsgericht Hamburg",
      "registernummer": "HRB 32257",
      "registerart": "HRB",
      "company_name": "pluss Personalmanagement GmbH",
      "company_seat": "Hamburg",
      "details": "03.03.2025 (Bekanntmachungsdatum)\n\nHamburg Amtsgericht Hamburg HRB 32257\nRegisterbekanntmachung nach dem Umwandlungsgesetz 19.02.2025 (Eintragungsdatum)\n\npluss Personalmanagement GmbH\nGesellschaft mit beschränkter Haftung\nHamburg\n\nAls nicht eingetragen wird bekannt gemacht:\nDen Gläubigern der an der Verschmelzung beteiligten Gesellschaften ist, wenn sie binnen sechs Monaten nach dem Tag, an dem die Eintragung der Verschmelzung in das Register des Sitzes desjenigen Rechtsträgers, dessen Gläubiger sie sind, nach § 19 Absatz 3 UmwG als bekannt gemacht gilt, ihren Anspruch nach Grund und Höhe schriftlich anmelden, Sicherheit zu leisten, soweit sie nicht Befriedigung verlangen können. Dieses Recht steht den Gläubigern jedoch nur zu, wenn sie glaubhaft machen, dass durch die Verschmelzung die Erfüllung ihrer Forderung gefährdet wird."
    },
    {
      "date": "2025-03-03",
      "id": "102666",
      "original_text": "Registerbekanntmachung nach dem Umwandlungsgesetz\nHamburg Amtsgericht Hamburg HRA 131533\nKartoffelhaus papas im Ratskeller e.K. – Hamburg",
      "type": "Registerbekanntmachung nach dem Umwandlungsgesetz",
      "state": "Hamburg",
      "amtsgericht": "Amtsgericht Hamburg",
      "registernummer": "HRA 131533",
      "registerart": "HRA",
      "company_name": "Kartoffelhaus papas im Ratskeller e.K.",
      "company_seat": "Hamburg",
      "details": "03.03.2025 (Bekanntmachungsdatum)\n\nHamburg Amtsgericht Hamburg HRA 131533\nRegisterbekanntmachung nach dem Umwandlungsgesetz 28.01.2025 (Eintragungsdatum)\n\nKartoffelhaus papas im Ratskeller e.K.\nEinzelkaufmann\nHamburg\n\nAls nicht eingetragen wird bekannt gemacht:\nDen Gläubigern der an der Ausgliederung beteiligten Gesellschaften ist, wenn sie binnen sechs Monaten nach dem Tag, an dem die Eintragung der Ausgliederung in das Register des Sitzes desjenigen Rechtsträgers, dessen Gläubiger sie sind, nach § 19 Absatz 3 UmwG als bekannt gemacht gilt, ihren Anspruch nach Grund und Höhe schriftlich anmelden, Sicherheit zu leisten, soweit sie nicht Befriedigung verlangen können. Dieses Recht steht den Gläubigern jedoch nur zu, wenn sie glaubhaft machen, dass durch die Ausgliederung die Erfüllung ihrer Forderung gefährdet wird."
    },
    {
      "date": "2025-03-03",
      "id": "102667",
      "original_text": "Registerbekanntmachung nach dem Umwandlungsgesetz\nHamburg Amtsgericht Hamburg HRA 37876\nBock & Schulte GmbH & Co. KG – Hamburg",
      "type": "Registerbekanntmachung nach dem Umwandlungsgesetz",
      "state": "Hamburg",
      "amtsgericht": "Amtsgericht Hamburg",
      "registernummer": "HRA 37876",
      "registerart": "HRA",
      "company_name": "Bock & Schulte GmbH & Co. KG",
      "company_seat": "Hamburg",
      "details": "03.03.2025 (Bekanntmachungsdatum)\n\nHamburg Amtsgericht Hamburg HRA 37876\nRegisterbekanntmachung nach dem Umwandlungsgesetz 28.02.2025 (Eintragungsdatum)\n\nBock & Schulte GmbH & Co. KG\nKommanditgesellschaft\nHamburg\n\nAls nicht eingetragen wird bekannt gemacht:\nDen Gläubigern der an der Verschmelzung beteiligten Gesellschaften ist, wenn sie binnen sechs Monaten nach dem Tag, an dem die Eintragung der Verschmelzung in das Register des Sitzes desjenigen Rechtsträgers, dessen Gläubiger sie sind, nach § 19 Absatz 3 UmwG als bekannt gemacht gilt, ihren Anspruch nach Grund und Höhe schriftlich anmelden, Sicherheit zu leisten, soweit sie nicht Befriedigung verlangen können. Dieses Recht steht den Gläubigern jedoch nur zu, wenn sie glaubhaft machen, dass durch die Verschmelzung die Erfüllung ihrer Forderung gefährdet wird."
    },
    {
      "date": "2025-03-03",
      "id": "102668",
      "original_text": "Registerbekanntmachung nach dem Umwandlungsgesetz\nHamburg Amtsgericht Hamburg HRB 124848\nMoveFwd Ventures GmbH – Hamburg",
      "type": "Registerbekanntmachung nach dem Umwandlungsgesetz",
      "state": "Hamburg",
      "amtsgericht": "Amtsgericht Hamburg",
      "registernummer": "HRB 124848",
      "registerart": "HRB",
      "company_name": "MoveFwd Ventures GmbH",
      "company_seat": "Hamburg",
      "details": "03.03.2025 (Bekanntmachungsdatum)\n\nHamburg Amtsgericht Hamburg HRB 124848\nRegisterbekanntmachung nach dem Umwandlungsgesetz 24.02.2025 (Eintragungsdatum)\n\nMoveFwd Ventures GmbH\nGesellschaft mit beschränkter Haftung\nHamburg\n\nAls nicht eingetragen wird bekannt gemacht:\nDen Gläubigern der an der Verschmelzung beteiligten Gesellschaften ist, wenn sie binnen sechs Monaten nach dem Tag, an dem die Eintragung der Verschmelzung in das Register des Sitzes desjenigen Rechtsträgers, dessen Gläubiger sie sind, nach § 19 Absatz 3 UmwG als bekannt gemacht gilt, ihren Anspruch nach Grund und Höhe schriftlich anmelden, Sicherheit zu leisten, soweit sie nicht Befriedigung verlangen können. Dieses Recht steht den Gläubigern jedoch nur zu, wenn sie glaubhaft machen, dass durch die Verschmelzung die Erfüllung ihrer Forderung gefährdet wird."
    },
    {
      "date": "2025-03-03",
      "id": "102669",
      "original_text": "Sonstige Registerbekanntmachung\nHamburg Amtsgericht Hamburg HRB 151739\nNovum Hospitality GmbH – Hamburg",
      "type": "Sonstige Registerbekanntmachung",
      "state": "Hamburg",
      "amtsgericht": "Amtsgericht Hamburg",
      "registernummer": "HRB 151739",
      "registerart": "HRB",
      "company_name": "Novum Hospitality GmbH",
      "company_seat": "Hamburg",
      "details": "03.03.2025 (Bekanntmachungsdatum)\n\nHamburg Amtsgericht Hamburg HRB 151739\nSonstige Registerbekanntmachung\n\nNovum Hospitality GmbH\nGesellschaft mit beschränkter Haftung\nHamburg\n\nAls nicht eingetragen wird bekannt gemacht: Liste des Aufsichtsrats wurde eingereicht."
    },
    {
      "date": "2025-03-03",
      "id": "102670",
      "original_text": "Sonstige Registerbekanntmachung\nHamburg Amtsgericht Hamburg HRB 173078\nAescudata GmbH – Hamburg",
      "type": "Sonstige Registerbekanntmachung",
      "state": "Hamburg",
      "amtsgericht": "Amtsgericht Hamburg",
      "registernummer": "HRB 173078",
      "registerart": "HRB",
      "company_name": "Aescudata GmbH",
      "company_seat": "Hamburg",
      "details": "03.03.2025 (Bekanntmachungsdatum)\n\nHamburg Amtsgericht Hamburg HRB 173078\nSonstige Registerbekanntmachung 20.02.2025 (Eintragungsdatum)\n\nAescudata GmbH\nGesellschaft mit beschränkter Haftung\nHamburg\n\nAls nicht eingetragen wird bekannt gemacht:  Den Gläubigern der Gesellschaft, deren Forderungen begründet worden sind, bevor die Eintragung der Vertragsbeendigung in das Handelsregister nach § 10 HGB als bekannt gemacht gilt, ist vom anderen Vertragsteil Sicherheit zu leisten, wenn sie sich binnen 6 Monaten nach Bekanntmachung der Eintragung zu diesem Zweck bei ihm melden."
    },
    {
      "date": "2025-03-03",
      "id": "102671",
      "original_text": "Sonstige Registerbekanntmachung\nHamburg Amtsgericht Hamburg HRB 144584\nNEAG Norddeutsche Energie AG – Hamburg",
      "type": "Sonstige Registerbekanntmachung",
      "state": "Hamburg",
      "amtsgericht": "Amtsgericht Hamburg",
      "registernummer": "HRB 144584",
      "registerart": "HRB",
      "company_name": "NEAG Norddeutsche Energie AG",
      "company_seat": "Hamburg",
      "details": "03.03.2025 (Bekanntmachungsdatum)\n\nHamburg Amtsgericht Hamburg HRB 144584\nSonstige Registerbekanntmachung 26.02.2025 (Eintragungsdatum)\n\nNEAG Norddeutsche Energie AG\nAktiengesellschaft\nHamburg\n\nAls nicht eingetragen wird bekannt gemacht: Liste des Aufsichtsrats wurde eingereicht."
    },
    {
      "date": "2025-03-03",
      "id": "102672",
      "original_text": "Registerbekanntmachung nach dem Umwandlungsgesetz\nHamburg Amtsgericht Hamburg HRB 164248\nVerwaltung AVUS Immobilien-Treuhand GmbH – Hamburg",
      "type": "Registerbekanntmachung nach dem Umwandlungsgesetz",
      "state": "Hamburg",
      "amtsgericht": "Amtsgericht Hamburg",
      "registernummer": "HRB 164248",
      "registerart": "HRB",
      "company_name": "Verwaltung AVUS Immobilien-Treuhand GmbH",
      "company_seat": "Hamburg",
      "details": "03.03.2025 (Bekanntmachungsdatum)\n\nHamburg Amtsgericht Hamburg HRB 164248\nRegisterbekanntmachung nach dem Umwandlungsgesetz 27.02.2025 (Eintragungsdatum)\n\nVerwaltung AVUS Immobilien-Treuhand GmbH\nGesellschaft mit beschränkter Haftung\nHamburg\n\nAls nicht eingetragen wird bekannt gemacht:\nDen Gläubigern der an der Verschmelzung beteiligten Gesellschaften ist, wenn sie binnen sechs Monaten nach dem Tag, an dem die Eintragung der Verschmelzung in das Register des Sitzes desjenigen Rechtsträgers, dessen Gläubiger sie sind, nach § 19 Absatz 3 UmwG als bekannt gemacht gilt, ihren Anspruch nach Grund und Höhe schriftlich anmelden, Sicherheit zu leisten, soweit sie nicht Befriedigung verlangen können. Dieses Recht steht den Gläubigern jedoch nur zu, wenn sie glaubhaft machen, dass durch die Verschmelzung die Erfüllung ihrer Forderung gefährdet wird."
    },
    {
      "date": "2025-03-03",
      "id": "102673",
      "original_text": "Registerbekanntmachung nach dem Umwandlungsgesetz\nHamburg Amtsgericht Hamburg HRB 158326\nAugustin Revision GmbH Wirtschaftsprüfungsgesellschaft – Hamburg",
      "type": "Registerbekanntmachung nach dem Umwandlungsgesetz",
      "state": "Hamburg",
      "amtsgericht": "Amtsgericht Hamburg",
      "registernummer": "HRB 158326",
      "registerart": "HRB",
      "company_name": "Augustin Revision GmbH Wirtschaftsprüfungsgesellschaft",
      "company_seat": "Hamburg",
      "details": "03.03.2025 (Bekanntmachungsdatum)\n\nHamburg Amtsgericht Hamburg HRB 158326\nRegisterbekanntmachung nach dem Umwandlungsgesetz 27.02.2025 (Eintragungsdatum)\n\nAugustin Revision GmbH Wirtschaftsprüfungsgesellschaft\nGesellschaft mit beschränkter Haftung\nHamburg\n\nAls nicht eingetragen wird bekannt gemacht:\nDen Gläubigern der an der Verschmelzung beteiligten Gesellschaften ist, wenn sie binnen sechs Monaten nach dem Tag, an dem die Eintragung der Verschmelzung in das Register des Sitzes desjenigen Rechtsträgers, dessen Gläubiger sie sind, nach § 19 Absatz 3 UmwG als bekannt gemacht gilt, ihren Anspruch nach Grund und Höhe schriftlich anmelden, Sicherheit zu leisten, soweit sie nicht Befriedigung verlangen können. Dieses Recht steht den Gläubigern jedoch nur zu, wenn sie glaubhaft machen, dass durch die Verschmelzung die Erfüllung ihrer Forderung gefährdet wird."
    },
    {
      "date": "2025-03-03",
      "id": "102674",
      "original_text": "Einreichung neuer Dokumente\nHamburg Amtsgericht Hamburg HRB 102468\nBaloise Vertriebsservice AG – Hamburg",
      "type": "Einreichung neuer Dokumente",
      "state": "Hamburg",
      "amtsgericht": "Amtsgericht Hamburg",
      "registernummer": "HRB 102468",
      "registerart": "HRB",
      "company_name": "Baloise Vertriebsservice AG",
      "company_seat": "Hamburg",
      "details": "03.03.2025 (Bekanntmachungsdatum)\n\nHamburg Amtsgericht Hamburg HRB 102468\nEinreichung neuer Dokumente\n\nBaloise Vertriebsservice AG\nAktiengesellschaft\nHamburg\n\nAls nicht eingetragen wird bekannt gemacht: Liste des Aufsichtsrats wurde eingereicht."
    },
    {
      "date": "2025-03-03",
      "id": "102675",
      "original_text": "Registerbekanntmachung nach dem Umwandlungsgesetz\nHamburg Amtsgericht Hamburg HRA 131902\nGebäudedienst Wiezorrek e.K. – Hamburg",
      "type": "Registerbekanntmachung nach dem Umwandlungsgesetz",
      "state": "Hamburg",
      "amtsgericht": "Amtsgericht Hamburg",
      "registernummer": "HRA 131902",
      "registerart": "HRA",
      "company_name": "Gebäudedienst Wiezorrek e.K.",
      "company_seat": "Hamburg",
      "details": "03.03.2025 (Bekanntmachungsdatum)\n\nHamburg Amtsgericht Hamburg HRA 131902\nRegisterbekanntmachung nach dem Umwandlungsgesetz 27.02.2025 (Eintragungsdatum)\n\nGebäudedienst Wiezorrek e.K.\nEinzelkaufmann\nHamburg\n\nAls nicht eingetragen wird bekannt gemacht:\nDen Gläubigern der an der Ausgliederung beteiligten Gesellschaften ist, wenn sie binnen sechs Monaten nach dem Tag, an dem die Eintragung der Ausgliederung in das Register des Sitzes desjenigen Rechtsträgers, dessen Gläubiger sie sind, nach § 19 Absatz 3 UmwG als bekannt gemacht gilt, ihren Anspruch nach Grund und Höhe schriftlich anmelden, Sicherheit zu leisten, soweit sie nicht Befriedigung verlangen können. Dieses Recht steht den Gläubigern jedoch nur zu, wenn sie glaubhaft machen, dass durch die Ausgliederung die Erfüllung ihrer Forderung gefährdet wird."
    },
    {
      "date": "2025-03-03",
      "id": "102676",
      "original_text": "Registerbekanntmachung nach dem Umwandlungsgesetz\nHamburg Amtsgericht Hamburg HRB 40951\nRoyal Sports Fitness-Center Schwencke GmbH – Hamburg",
      "type": "Registerbekanntmachung nach dem Umwandlungsgesetz",
      "state": "Hamburg",
      "amtsgericht": "Amtsgericht Hamburg",
      "registernummer": "HRB 40951",
      "registerart": "HRB",
      "company_name": "Royal Sports Fitness-Center Schwencke GmbH",
      "company_seat": "Hamburg",
      "details": "03.03.2025 (Bekanntmachungsdatum)\n\nHamburg Amtsgericht Hamburg HRB 40951\nRegisterbekanntmachung nach dem Umwandlungsgesetz 27.02.2025 (Eintragungsdatum)\n\nRoyal Sports Fitness-Center Schwencke GmbH\nGesellschaft mit beschränkter Haftung\nHamburg\n\nAls nicht eingetragen wird bekannt gemacht:\nDen Gläubigern der an der Abspaltung beteiligten Gesellschaften ist, wenn sie binnen sechs Monaten nach dem Tag, an dem die Eintragung der Abspaltung in das Register des Sitzes desjenigen Rechtsträgers, dessen Gläubiger sie sind, nach § 19 Absatz 3 UmwG als bekannt gemacht gilt, ihren Anspruch nach Grund und Höhe schriftlich anmelden, Sicherheit zu leisten, soweit sie nicht Befriedigung verlangen können. Dieses Recht steht den Gläubigern jedoch nur zu, wenn sie glaubhaft machen, dass durch die Abspaltung die Erfüllung ihrer Forderung gefährdet wird."
    },
    {
      "date": "2025-03-03",
      "id": "102677",
      "original_text": "Einreichung neuer Dokumente\nHamburg Amtsgericht Hamburg HRB 2412\n\"Wichern\" Baugesellschaft m.b.H. Gemeinnütziges Wohnungsunternehmen – Hamburg",
      "type": "Einreichung neuer Dokumente",
      "state": "Hamburg",
      "amtsgericht": "Amtsgericht Hamburg",
      "registernummer": "HRB 2412",
      "registerart": "HRB",
      "company_name": "\"Wichern\" Baugesellschaft m.b.H. Gemeinnütziges Wohnungsunternehmen",
      "company_seat": "Hamburg",
      "details": "03.03.2025 (Bekanntmachungsdatum)\n\nHamburg Amtsgericht Hamburg HRB 2412\nEinreichung neuer Dokumente\n\n\"Wichern\" Baugesellschaft m.b.H. Gemeinnütziges Wohnungsunternehmen\nGesellschaft mit beschränkter Haftung\nHamburg\n\nAls nicht eingetragen wird bekannt gemacht: Liste des Aufsichtsrats wurde eingereicht."
    },
    {
      "date": "2025-03-03",
      "id": "102678",
      "original_text": "Sonstige Registerbekanntmachung\nHamburg Amtsgericht Hamburg HRB 188101\nOtto Group GmbH & Co. KGaA – Hamburg",
      "type": "Sonstige Registerbekanntmachung",
      "state": "Hamburg",
      "amtsgericht": "Amtsgericht Hamburg",
      "registernummer": "HRB 188101",
      "registerart": "HRB",
      "company_name": "Otto Group GmbH & Co. KGaA",
      "company_seat": "Hamburg",
      "details": "03.03.2025 (Bekanntmachungsdatum)\n\nHamburg Amtsgericht Hamburg HRB 188101\nSonstige Registerbekanntmachung\n\nOtto Group GmbH & Co. KGaA\nKommanditgesellschaft auf Aktien\nHamburg\n\nAls nicht eingetragen wird bekannt gemacht: Liste des Aufsichtsrats wurde eingereicht."
    },
    {
      "date": "2025-03-03",
      "id": "102679",
      "original_text": "Einreichung neuer Dokumente\nHamburg Amtsgericht Hamburg HRB 142613\nIMMAC HOLDING AKTIENGESELLSCHAFT – Hamburg",
      "type": "Einreichung neuer Dokumente",
      "state": "Hamburg",
      "amtsgericht": "Amtsgericht Hamburg",
      "registernummer": "HRB 142613",
      "registerart": "HRB",
      "company_name": "IMMAC HOLDING AKTIENGESELLSCHAFT",
      "company_seat": "Hamburg",
      "details": "03.03.2025 (Bekanntmachungsdatum)\n\nHamburg Amtsgericht Hamburg HRB 142613\nEinreichung neuer Dokumente 27.02.2025 (Eintragungsdatum)\n\nIMMAC HOLDING AKTIENGESELLSCHAFT\nAktiengesellschaft\nHamburg\n\nAls nicht eingetragen wird bekannt gemacht: Liste des Aufsichtsrats wurde eingereicht."
    },
    {
      "date": "2025-03-03",
      "id": "102680",
      "original_text": "Sonstige Registerbekanntmachung\nHamburg Amtsgericht Hamburg HRB 91614\nTractebel Overdick GmbH – Hamburg",
      "type": "Sonstige Registerbekanntmachung",
      "state": "Hamburg",
      "amtsgericht": "Amtsgericht Hamburg",
      "registernummer": "HRB 91614",
      "registerart": "HRB",
      "company_name": "Tractebel Overdick GmbH",
      "company_seat": "Hamburg",
      "details": "03.03.2025 (Bekanntmachungsdatum)\n\nHamburg Amtsgericht Hamburg HRB 91614\nSonstige Registerbekanntmachung 26.02.2025 (Eintragungsdatum)\n\nTractebel Overdick GmbH\nGesellschaft mit beschränkter Haftung\nHamburg\n\nAls nicht eingetragen wird bekannt gemacht:  Den Gläubigern der Gesellschaft, deren Forderungen begründet worden sind, bevor die Eintragung der Vertragsbeendigung in das Handelsregister nach § 10 HGB als bekannt gemacht gilt, ist vom anderen Vertragsteil Sicherheit zu leisten, wenn sie sich binnen 6 Monaten nach Bekanntmachung der Eintragung zu diesem Zweck bei ihm melden."
    },
    {
      "date": "2025-03-03",
      "id": "102681",
      "original_text": "Einreichung neuer Dokumente\nBaden-Württemberg Amtsgericht Stuttgart HRB 262723\nStädtische Beteiligungsgesellschaft Waiblingen GmbH – Waiblingen",
      "type": "Einreichung neuer Dokumente",
      "state": "Baden-Württemberg",
      "amtsgericht": "Amtsgericht Stuttgart",
      "registernummer": "HRB 262723",
      "registerart": "HRB",
      "company_name": "Städtische Beteiligungsgesellschaft Waiblingen GmbH",
      "company_seat": "Waiblingen",
      "details": "03.03.2025 (Bekanntmachungsdatum)\n\nBaden-Württemberg Amtsgericht Stuttgart HRB 262723\nEinreichung neuer Dokumente 03.03.2025 (Eintragungsdatum)\n\nStädtische Beteiligungsgesellschaft Waiblingen GmbH\nGesellschaft mit beschränkter Haftung\nWaiblingen\n\nDie Gesellschaft hat am 25.02.2025 die Liste über die Zusammensetzung des Aufsichtsrats zum Handelsregister eingereicht."
    },
    {
      "date": "2025-03-03",
      "id": "102682",
      "original_text": "Löschungsankündigung\nBaden-Württemberg Amtsgericht Ulm HRB 640901\nRobert Straub GmbH – Biberach an der Riß",
      "type": "Löschungsankündigung",
      "state": "Baden-Württemberg",
      "amtsgericht": "Amtsgericht Ulm",
      "registernummer": "HRB 640901",
      "registerart": "HRB",
      "company_name": "Robert Straub GmbH",
      "company_seat": "Biberach an der Riß",
      "details": "03.03.2025 (Bekanntmachungsdatum)\n\nBaden-Württemberg Amtsgericht Ulm HRB 640901\nLöschungsankündigung\n\nRobert Straub GmbH\nGesellschaft mit beschränkter Haftung\nBiberach an der Riß\n\nDas Gericht beabsichtigt, die Gesellschaft wegen Vermögenslosigkeit im Handelsregister von Amts wegen nach § 394 FamFG zu löschen. Die Frist zur Geltendmachung eines Widerspruchs gegen die beabsichtigte Löschung ist auf  einen Monat ab Veröffentlichung bestimmt."
    },
    {
      "date": "2025-03-03",
      "id": "102683",
      "original_text": "Einreichung neuer Dokumente\nBaden-Württemberg Amtsgericht Mannheim HRB 100565\nKerntechnische Entsorgung Karlsruhe GmbH – Eggenstein-Leopoldshafen",
      "type": "Einreichung neuer Dokumente",
      "state": "Baden-Württemberg",
      "amtsgericht": "Amtsgericht Mannheim",
      "registernummer": "HRB 100565",
      "registerart": "HRB",
      "company_name": "Kerntechnische Entsorgung Karlsruhe GmbH",
      "company_seat": "Eggenstein-Leopoldshafen",
      "details": "03.03.2025 (Bekanntmachungsdatum)\n\nBaden-Württemberg Amtsgericht Mannheim HRB 100565\nEinreichung neuer Dokumente\n\nKerntechnische Entsorgung Karlsruhe GmbH\nGesellschaft mit beschränkter Haftung\nEggenstein-Leopoldshafen\n\nDie Gesellschaft hat am 27.02.2025 die Liste über die Zusammensetzung des Aufsichtsrats zum Handelsregister eingereicht."
    },
    {
      "date": "2025-03-03",
      "id": "102684",
      "original_text": "Registerbekanntmachung nach dem Umwandlungsgesetz\nBaden-Württemberg Amtsgericht Stuttgart HRB 798052\nBui Systemgastronomie GmbH – Rottweil",
      "type": "Registerbekanntmachung nach dem Umwandlungsgesetz",
      "state": "Baden-Württemberg",
      "amtsgericht": "Amtsgericht Stuttgart",
      "registernummer": "HRB 798052",
      "registerart": "HRB",
      "company_name": "Bui Systemgastronomie GmbH",
      "company_seat": "Rottweil",
      "details": "03.03.2025 (Bekanntmachungsdatum)\n\nBaden-Württemberg Amtsgericht Stuttgart HRB 798052\nRegisterbekanntmachung nach dem Umwandlungsgesetz 03.03.2025 (Eintragungsdatum)\n\nBui Systemgastronomie GmbH\nGesellschaft mit beschränkter Haftung\nRottweil\n\nDen Gläubigern der an der Verschmelzung beteiligten Rechtsträger ist, wenn sie binnen sechs Monaten nach dem Tag, an dem die Eintragung der Verschmelzung in das Register des Sitzes desjenigen Rechtsträgers, dessen Gläubiger sie sind, nach § 19 Abs. 3 UmwG als bekanntgemacht gilt, ihren Anspruch nach Grund und Höhe schriftlich anmelden, Sicherheit zu leisten, soweit sie nicht Befriedigung verlangen können. Dieses Recht steht den Gläubigern jedoch nur zu, wenn sie glaubhaft machen, dass durch die Verschmelzung die Erfüllung ihrer Forderung gefährdet wird."
    },
    {
      "date": "2025-03-03",
      "id": "102685",
      "original_text": "Löschungsankündigung\nBerlin Amtsgericht Berlin (Charlottenburg) HRB 158924\nTeam Baugesellschaft mbH – Berlin",
      "type": "Löschungsankündigung",
      "state": "Berlin",
      "amtsgericht": "Amtsgericht Berlin (Charlottenburg)",
      "registernummer": "HRB 158924",
      "registerart": "HRB",
      "company_name": "Team Baugesellschaft mbH",
      "company_seat": "Berlin",
      "details": "03.03.2025 (Bekanntmachungsdatum)\n\nBerlin Amtsgericht Berlin (Charlottenburg) HRB 158924\nLöschungsankündigung\n\nTeam Baugesellschaft mbH\nGesellschaft mit beschränkter Haftung\nBerlin\n\nBei der nachstehenden Gesellschaft wird das Amtslöschungsverfahren gemäß § 394 FamFG eingeleitet. Widerspruchsfrist 6 Wochen"
    },
    {
      "date": "2025-03-03",
      "id": "102686",
      "original_text": "Löschungsankündigung\nBerlin Amtsgericht Berlin (Charlottenburg) HRB 167911\nMy Bakery Müllerstraße GmbH – Berlin",
      "type": "Löschungsankündigung",
      "state": "Berlin",
      "amtsgericht": "Amtsgericht Berlin (Charlottenburg)",
      "registernummer": "HRB 167911",
      "registerart": "HRB",
      "company_name": "My Bakery Müllerstraße GmbH",
      "company_seat": "Berlin",
      "details": "03.03.2025 (Bekanntmachungsdatum)\n\nBerlin Amtsgericht Berlin (Charlottenburg) HRB 167911\nLöschungsankündigung\n\nMy Bakery Müllerstraße GmbH\nGesellschaft mit beschränkter Haftung\nBerlin\n\nBei der nachstehenden Gesellschaft wird das Amtslöschungsverfahren gemäß § 394 FamFG eingeleitet. Widerspruchsfrist 6 Wochen"
    },
    {
      "date": "2025-03-03",
      "id": "102687",
      "original_text": "Löschungsankündigung\nBerlin Amtsgericht Berlin (Charlottenburg) HRB 106894\nRegnitzinsel Properties GmbH – Berlin",
      "type": "Löschungsankündigung",
      "state": "Berlin",
      "amtsgericht": "Amtsgericht Berlin (Charlottenburg)",
      "registernummer": "HRB 106894",
      "registerart": "HRB",
      "company_name": "Regnitzinsel Properties GmbH",
      "company_seat": "Berlin",
      "details": "03.03.2025 (Bekanntmachungsdatum)\n\nBerlin Amtsgericht Berlin (Charlottenburg) HRB 106894\nLöschungsankündigung\n\nRegnitzinsel Properties GmbH\nGesellschaft mit beschränkter Haftung\nBerlin\n\nBei der nachstehenden Gesellschaft wird das Amtslöschungsverfahren gemäß § 394 FamFG eingeleitet. Widerspruchsfrist 6 Wochen"
    },
    {
      "date": "2025-03-03",
      "id": "102688",
      "original_text": "Löschungsankündigung\nBerlin Amtsgericht Berlin (Charlottenburg) HRB 262954\nMirko Bau GmbH – Berlin",
      "type": "Löschungsankündigung",
      "state": "Berlin",
      "amtsgericht": "Amtsgericht Berlin (Charlottenburg)",
      "registernummer": "HRB 262954",
      "registerart": "HRB",
      "company_name": "Mirko Bau GmbH",
      "company_seat": "Berlin",
      "details": "03.03.2025 (Bekanntmachungsdatum)\n\nBerlin Amtsgericht Berlin (Charlottenburg) HRB 262954\nLöschungsankündigung\n\nMirko Bau GmbH\nGesellschaft mit beschränkter Haftung\nBerlin\n\nBei der nachstehenden Gesellschaft wird das Amtslöschungsverfahren gemäß § 394 FamFG eingeleitet. Widerspruchsfrist 6 Wochen"
    },
    {
      "date": "2025-03-03",
      "id": "102689",
      "original_text": "Löschungsankündigung\nBerlin Amtsgericht Berlin (Charlottenburg) HRB 126879\nDie FirmenVorsorge Versicherungsmakler DFVM GmbH – Berlin",
      "type": "Löschungsankündigung",
      "state": "Berlin",
      "amtsgericht": "Amtsgericht Berlin (Charlottenburg)",
      "registernummer": "HRB 126879",
      "registerart": "HRB",
      "company_name": "Die FirmenVorsorge Versicherungsmakler DFVM GmbH",
      "company_seat": "Berlin",
      "details": "03.03.2025 (Bekanntmachungsdatum)\n\nBerlin Amtsgericht Berlin (Charlottenburg) HRB 126879\nLöschungsankündigung\n\nDie FirmenVorsorge Versicherungsmakler DFVM GmbH\nGesellschaft mit beschränkter Haftung\nBerlin\n\nBei der nachstehenden Gesellschaft wird das Amtslöschungsverfahren gemäß § 394 FamFG eingeleitet. Widerspruchsfrist 6 Wochen"
    },
    {
      "date": "2025-03-03",
      "id": "102690",
      "original_text": "Sonstige Registerbekanntmachung\nBaden-Württemberg Amtsgericht Ulm HRB 726267\nEGS Erdwärmegesellschaft Schussental mbH – Weingarten",
      "type": "Sonstige Registerbekanntmachung",
      "state": "Baden-Württemberg",
      "amtsgericht": "Amtsgericht Ulm",
      "registernummer": "HRB 726267",
      "registerart": "HRB",
      "company_name": "EGS Erdwärmegesellschaft Schussental mbH",
      "company_seat": "Weingarten",
      "details": "03.03.2025 (Bekanntmachungsdatum)\n\nBaden-Württemberg Amtsgericht Ulm HRB 726267\nSonstige Registerbekanntmachung\n\nEGS Erdwärmegesellschaft Schussental mbH\nGesellschaft mit beschränkter Haftung\nWeingarten\n\nDie Gesellschaft hat am 28.02.2025 die Liste über die Zusammensetzung des Aufsichtsrats zum Handelsregister eingereicht."
    },
    {
      "date": "2025-03-03",
      "id": "102691",
      "original_text": "Löschungsankündigung\nSachsen-Anhalt Amtsgericht Stendal VR 46521\n\"Lohnsteuerhilfeverein Reipisch e.V.\" – Merseburg",
      "type": "Löschungsankündigung",
      "state": "Sachsen-Anhalt",
      "amtsgericht": "Amtsgericht Stendal",
      "registernummer": "VR 46521",
      "registerart": "VR",
      "company_name": "\"Lohnsteuerhilfeverein Reipisch e.V.\"",
      "company_seat": "Merseburg",
      "details": "03.03.2025 (Bekanntmachungsdatum)\n\nSachsen-Anhalt Amtsgericht Stendal VR 46521\nLöschungsankündigung\n\n\"Lohnsteuerhilfeverein Reipisch e.V.\"\neingetragener Verein\nMerseburg\n\nDas Registergericht beabsichtigt, den nachfolgenden Verein wegen des Wegfalls sämtlicher Mitglieder von Amts wegen zu löschen. Die Frist zur Erhebung eines Widerspruchs gegen die beabsichtigte Löschung wird auf 1 Monat festgesetzt."
    },
    {
      "date": "2025-03-03",
      "id": "102692",
      "original_text": "Registerbekanntmachung nach dem Umwandlungsgesetz\nSchleswig-Holstein Amtsgericht Kiel HRB 18557\nBHATTI.LSH GROUP Steuerberatungsgesellschaft mbH – Kiel",
      "type": "Registerbekanntmachung nach dem Umwandlungsgesetz",
      "state": "Schleswig-Holstein",
      "amtsgericht": "Amtsgericht Kiel",
      "registernummer": "HRB 18557",
      "registerart": "HRB",
      "company_name": "BHATTI.LSH GROUP Steuerberatungsgesellschaft mbH",
      "company_seat": "Kiel",
      "details": "03.03.2025 (Bekanntmachungsdatum)\n\nSchleswig-Holstein Amtsgericht Kiel HRB 18557\nRegisterbekanntmachung nach dem Umwandlungsgesetz 28.02.2025 (Eintragungsdatum)\n\nBHATTI.LSH GROUP Steuerberatungsgesellschaft mbH\nGesellschaft mit beschränkter Haftung\nKiel\n\nZu Eintragungsnummer 11 vom 28.02.2025 wird als nicht eingetragen veröffentlicht: Den Gläubigern der an der Spaltung beteiligten Rechtsträger ist, wenn sie binnen sechs Monaten nach dem Tag, an dem die Eintragung der Spaltung in das Register des Sitzes desjenigen Rechtsträgers, dessen Gläubiger sie sind,  bekannt gemacht worden ist, ihren Anspruch nach Grund und Höhe schriftlich anmelden, Sicherheit zu leisten, soweit sie nicht Befriedigung verlangen können. Dieses Recht steht den Gläubigern jedoch nur zu, wenn sie glaubhaft machen, dass durch die Spaltung die Erfüllung ihrer Forderung gefährdet wird."
    },
    {
      "date": "2025-03-03",
      "id": "102693",
      "original_text": "Registerbekanntmachung nach dem Umwandlungsgesetz\nHamburg Amtsgericht Hamburg HRB 189573\nDössel und Rademacher GmbH – Hamburg",
      "type": "Registerbekanntmachung nach dem Umwandlungsgesetz",
      "state": "Hamburg",
      "amtsgericht": "Amtsgericht Hamburg",
      "registernummer": "HRB 189573",
      "registerart": "HRB",
      "company_name": "Dössel und Rademacher GmbH",
      "company_seat": "Hamburg",
      "details": "03.03.2025 (Bekanntmachungsdatum)\n\nHamburg Amtsgericht Hamburg HRB 189573\nRegisterbekanntmachung nach dem Umwandlungsgesetz 03.03.2025 (Eintragungsdatum)\n\nDössel und Rademacher GmbH\nGesellschaft mit beschränkter Haftung\nHamburg\n\nAls nicht eingetragen wird bekannt gemacht:\nDen Gläubigern der an der Ausgliederung beteiligten Gesellschaften ist, wenn sie binnen sechs Monaten nach dem Tag, an dem die Eintragung der Ausgliederung in das Register des Sitzes desjenigen Rechtsträgers, dessen Gläubiger sie sind, nach § 19 Absatz 3 UmwG als bekannt gemacht gilt, ihren Anspruch nach Grund und Höhe schriftlich anmelden, Sicherheit zu leisten, soweit sie nicht Befriedigung verlangen können. Dieses Recht steht den Gläubigern jedoch nur zu, wenn sie glaubhaft machen, dass durch die Ausgliederung die Erfüllung ihrer Forderung gefährdet wird."
    },
    {
      "date": "2025-03-03",
      "id": "102694",
      "original_text": "Registerbekanntmachung nach dem Umwandlungsgesetz\nHamburg Amtsgericht Hamburg HRA 17989\nDössel & Rademacher Inh. Denise Rathgeber e. Kfr. – Hamburg",
      "type": "Registerbekanntmachung nach dem Umwandlungsgesetz",
      "state": "Hamburg",
      "amtsgericht": "Amtsgericht Hamburg",
      "registernummer": "HRA 17989",
      "registerart": "HRA",
      "company_name": "Dössel & Rademacher Inh. Denise Rathgeber e. Kfr.",
      "company_seat": "Hamburg",
      "details": "03.03.2025 (Bekanntmachungsdatum)\n\nHamburg Amtsgericht Hamburg HRA 17989\nRegisterbekanntmachung nach dem Umwandlungsgesetz 03.03.2025 (Eintragungsdatum)\n\nDössel & Rademacher Inh. Denise Rathgeber e. Kfr.\nEinzelkaufmann\nHamburg\n\nAls nicht eingetragen wird bekannt gemacht:\nDen Gläubigern der an der Ausgliederung beteiligten Gesellschaften ist, wenn sie binnen sechs Monaten nach dem Tag, an dem die Eintragung der Ausgliederung in das Register des Sitzes desjenigen Rechtsträgers, dessen Gläubiger sie sind, nach § 19 Absatz 3 UmwG als bekannt gemacht gilt, ihren Anspruch nach Grund und Höhe schriftlich anmelden, Sicherheit zu leisten, soweit sie nicht Befriedigung verlangen können. Dieses Recht steht den Gläubigern jedoch nur zu, wenn sie glaubhaft machen, dass durch die Ausgliederung die Erfüllung ihrer Forderung gefährdet wird."
    },
    {
      "date": "2025-03-03",
      "id": "102695",
      "original_text": "Registerbekanntmachung nach dem Umwandlungsgesetz\nBerlin Amtsgericht Berlin (Charlottenburg) HRA 63630\nChrist & Company GmbH & Co. KG – Berlin",
      "type": "Registerbekanntmachung nach dem Umwandlungsgesetz",
      "state": "Berlin",
      "amtsgericht": "Amtsgericht Berlin (Charlottenburg)",
      "registernummer": "HRA 63630",
      "registerart": "HRA",
      "company_name": "Christ & Company GmbH & Co. KG",
      "company_seat": "Berlin",
      "details": "03.03.2025 (Bekanntmachungsdatum)\n\nBerlin Amtsgericht Berlin (Charlottenburg) HRA 63630\nRegisterbekanntmachung nach dem Umwandlungsgesetz 28.02.2025 (Eintragungsdatum)\n\nChrist & Company GmbH & Co. KG\nKommanditgesellschaft\nBerlin\n\nZu Eintragungsnummer 3 vom 28.02.2025 wird als nicht eingetragen veröffentlicht: Den Gläubigern der an der Spaltung beteiligten Rechtsträger ist, wenn sie binnen sechs Monaten nach dem Tag, an dem die Eintragung der Spaltung in das Register des Sitzes desjenigen Rechtsträgers, dessen Gläubiger sie sind, als bekannt gemacht gilt, ihren Anspruch nach Grund und Höhe schriftlich anmelden, Sicherheit zu leisten, soweit sie nicht Befriedigung verlangen können. Dieses Recht steht den Gläubigern jedoch nur zu, wenn sie glaubhaft machen, dass durch die Spaltung die Erfüllung ihrer Forderung gefährdet wird. Das Recht, Sicherheitsleistung zu verlangen, steht Gläubigern nicht zu, die im Falle der Insolvenz ein Recht auf vorzugsweise Befriedigung aus einer Deckungsmasse haben, die nach gesetzlicher Vorschrift zu ihrem Schutz errichtet und staatlich überwacht ist."
    },
    {
      "date": "2025-03-03",
      "id": "102696",
      "original_text": "Registerbekanntmachung nach dem Umwandlungsgesetz\nBerlin Amtsgericht Berlin (Charlottenburg) HRB 136762\nChrist Capital GmbH – Berlin",
      "type": "Registerbekanntmachung nach dem Umwandlungsgesetz",
      "state": "Berlin",
      "amtsgericht": "Amtsgericht Berlin (Charlottenburg)",
      "registernummer": "HRB 136762",
      "registerart": "HRB",
      "company_name": "Christ Capital GmbH",
      "company_seat": "Berlin",
      "details": "03.03.2025 (Bekanntmachungsdatum)\n\nBerlin Amtsgericht Berlin (Charlottenburg) HRB 136762\nRegisterbekanntmachung nach dem Umwandlungsgesetz 28.02.2025 (Eintragungsdatum)\n\nChrist Capital GmbH\nGesellschaft mit beschränkter Haftung\nBerlin\n\nZu Eintragungsnummer 20 vom 28.02.2025 wird als nicht eingetragen veröffentlicht: Den Gläubigern der an der Spaltung beteiligten Rechtsträger ist, wenn sie binnen sechs Monaten nach dem Tag, an dem die Eintragung der Spaltung in das Register des Sitzes desjenigen Rechtsträgers, dessen Gläubiger sie sind, als bekannt gemacht gilt, ihren Anspruch nach Grund und Höhe schriftlich anmelden, Sicherheit zu leisten, soweit sie nicht Befriedigung verlangen können. Dieses Recht steht den Gläubigern jedoch nur zu, wenn sie glaubhaft machen, dass durch die Spaltung die Erfüllung ihrer Forderung gefährdet wird. Das Recht, Sicherheitsleistung zu verlangen, steht Gläubigern nicht zu, die im Falle der Insolvenz ein Recht auf vorzugsweise Befriedigung aus einer Deckungsmasse haben, die nach gesetzlicher Vorschrift zu ihrem Schutz errichtet und staatlich überwacht ist."
    },
    {
      "date": "2025-03-03",
      "id": "102697",
      "original_text": "Registerbekanntmachung nach dem Umwandlungsgesetz\nHamburg Amtsgericht Hamburg HRB 44127\nHanseMerkur Holding AG – Hamburg",
      "type": "Registerbekanntmachung nach dem Umwandlungsgesetz",
      "state": "Hamburg",
      "amtsgericht": "Amtsgericht Hamburg",
      "registernummer": "HRB 44127",
      "registerart": "HRB",
      "company_name": "HanseMerkur Holding AG",
      "company_seat": "Hamburg",
      "details": "03.03.2025 (Bekanntmachungsdatum)\n\nHamburg Amtsgericht Hamburg HRB 44127\nRegisterbekanntmachung nach dem Umwandlungsgesetz 03.03.2025 (Eintragungsdatum)\n\nHanseMerkur Holding AG\nAktiengesellschaft\nHamburg\n\nAls nicht eingetragen wird bekannt gemacht:\nEs wird darauf hingewiesen, dass ein Formwechselplan oder sein Entwurf über einen grenzüberschreitenden Formwechsel in die HanseMerkur Holding SE mit Sitz in Hamburg/Bundesrepublik Deutschland  (Europäische Aktiengesellschaft (SE)) beim Handelsregister eingereicht worden ist.\nDie Anteilsinhaber, die Gläubiger sowie die zuständigen Betriebsräte der an dem grenzüberschreitenden Formwechsel beteiligten Gesellschaft oder, soweit es keinen Betriebsrat gibt, die Arbeitnehmer der an dem grenzüberschreitenden Formwechsel beteiligten Gesellschaft, können der Gesellschaft spätestens fünf Arbeitstage vor dem Tag der Hauptversammlung Bemerkungen zum Formwechselplan übermitteln."
    },
    {
      "date": "2025-03-03",
      "id": "102698",
      "original_text": "Registerbekanntmachung nach dem Umwandlungsgesetz\nBaden-Württemberg Amtsgericht Mannheim HRB 748043\nDaulto GmbH – Heidelberg",
      "type": "Registerbekanntmachung nach dem Umwandlungsgesetz",
      "state": "Baden-Württemberg",
      "amtsgericht": "Amtsgericht Mannheim",
      "registernummer": "HRB 748043",
      "registerart": "HRB",
      "company_name": "Daulto GmbH",
      "company_seat": "Heidelberg",
      "details": "03.03.2025 (Bekanntmachungsdatum)\n\nBaden-Württemberg Amtsgericht Mannheim HRB 748043\nRegisterbekanntmachung nach dem Umwandlungsgesetz 03.03.2025 (Eintragungsdatum)\n\nDaulto GmbH\nGesellschaft mit beschränkter Haftung\nHeidelberg\n\nDen Gläubigern der an der Verschmelzung beteiligten Rechtsträger ist, wenn sie binnen sechs Monaten nach dem Tag, an dem die Eintragung der Verschmelzung in das Register des Sitzes desjenigen Rechtsträgers, dessen Gläubiger sie sind, nach § 19 Abs. 3 UmwG als bekanntgemacht gilt, ihren Anspruch nach Grund und Höhe schriftlich anmelden, Sicherheit zu leisten, soweit sie nicht Befriedigung verlangen können. Dieses Recht steht den Gläubigern jedoch nur zu, wenn sie glaubhaft machen, dass durch die Verschmelzung die Erfüllung ihrer Forderung gefährdet wird."
    },
    {
      "date": "2025-03-03",
      "id": "102699",
      "original_text": "Einreichung neuer Dokumente\nBerlin Amtsgericht Berlin (Charlottenburg) HRB 81121\nMercedes-Benz Bank Service Center GmbH – Berlin",
      "type": "Einreichung neuer Dokumente",
      "state": "Berlin",
      "amtsgericht": "Amtsgericht Berlin (Charlottenburg)",
      "registernummer": "HRB 81121",
      "registerart": "HRB",
      "company_name": "Mercedes-Benz Bank Service Center GmbH",
      "company_seat": "Berlin",
      "details": "03.03.2025 (Bekanntmachungsdatum)\n\nBerlin Amtsgericht Berlin (Charlottenburg) HRB 81121\nEinreichung neuer Dokumente\n\nMercedes-Benz Bank Service Center GmbH\nGesellschaft mit beschränkter Haftung\nBerlin\n\nAls nicht eingetragen wird veröffentlicht: Es wurde eine neue Liste der Aufsichtsratsmitglieder eingereicht (§52 GmbHG)."
    },
    {
      "date": "2025-03-03",
      "id": "102700",
      "original_text": "Einreichung neuer Dokumente\nBerlin Amtsgericht Berlin (Charlottenburg) HRB 259261\nZenJob SE – Berlin",
      "type": "Einreichung neuer Dokumente",
      "state": "Berlin",
      "amtsgericht": "Amtsgericht Berlin (Charlottenburg)",
      "registernummer": "HRB 259261",
      "registerart": "HRB",
      "company_name": "ZenJob SE",
      "company_seat": "Berlin",
      "details": "03.03.2025 (Bekanntmachungsdatum)\n\nBerlin Amtsgericht Berlin (Charlottenburg) HRB 259261\nEinreichung neuer Dokumente\n\nZenJob SE\nEuropäische Aktiengesellschaft (SE)\nBerlin\n\nAls nicht eingetragen wird veröffentlicht: Es wurde eine neue Liste der Aufsichtsratsmitglieder eingereicht (§ 106 AktG analog)."
    },
    {
      "date": "2025-03-03",
      "id": "102701",
      "original_text": "Löschungsankündigung\nBerlin Amtsgericht Berlin (Charlottenburg) HRB 175929\n2. Eureka Immobilien- und Projektmanagement Beteiligungsgesellschaft mbH – Berlin",
      "type": "Löschungsankündigung",
      "state": "Berlin",
      "amtsgericht": "Amtsgericht Berlin (Charlottenburg)",
      "registernummer": "HRB 175929",
      "registerart": "HRB",
      "company_name": "2. Eureka Immobilien- und Projektmanagement Beteiligungsgesellschaft mbH",
      "company_seat": "Berlin",
      "details": "03.03.2025 (Bekanntmachungsdatum)\n\nBerlin Amtsgericht Berlin (Charlottenburg) HRB 175929\nLöschungsankündigung\n\n2. Eureka Immobilien- und Projektmanagement Beteiligungsgesellschaft mbH\nGesellschaft mit beschränkter Haftung\nBerlin\n\nBei der nachstehenden Gesellschaft wird das Amtslöschungsverfahren gemäß § 394 FamFG eingeleitet. Widerspruchsfrist 6 Wochen"
    },
    {
      "date": "2025-03-03",
      "id": "102702",
      "original_text": "Registerbekanntmachung nach dem Umwandlungsgesetz\nSachsen-Anhalt Amtsgericht Stendal HRB 1031\nZucht- und Nutzviehhaltungs-GmbH Staffelde – Staffelde",
      "type": "Registerbekanntmachung nach dem Umwandlungsgesetz",
      "state": "Sachsen-Anhalt",
      "amtsgericht": "Amtsgericht Stendal",
      "registernummer": "HRB 1031",
      "registerart": "HRB",
      "company_name": "Zucht- und Nutzviehhaltungs-GmbH Staffelde",
      "company_seat": "Staffelde",
      "details": "03.03.2025 (Bekanntmachungsdatum)\n\nSachsen-Anhalt Amtsgericht Stendal HRB 1031\nRegisterbekanntmachung nach dem Umwandlungsgesetz 03.03.2025 (Eintragungsdatum)\n\nZucht- und Nutzviehhaltungs-GmbH Staffelde\nGesellschaft mit beschränkter Haftung\nStaffelde\n\nNicht eingetragen:\nDen Gläubigern der an der Verschmelzung beteiligten Rechtsträger ist, wenn sie binnen sechs Monaten nach dem Tag, an dem die Eintragung der Verschmelzung nach § 19 Abs. 3 UmwG als bekanntgemacht gilt, ihren Anspruch nach Grund und Höhe schriftlich anmelden, Sicherheit zu leisten, soweit sie nicht Befriedigung verlangen können. Dieses Recht steht ihnen jedoch nur zu, wenn sie glaubhaft machen, dass durch die Verschmelzung die Erfüllung ihrer Forderung gefährdet wird."
    },
    {
      "date": "2025-03-03",
      "id": "102703",
      "original_text": "Registerbekanntmachung nach dem Umwandlungsgesetz\nSachsen-Anhalt Amtsgericht Stendal GnR 154\nLandwirtschaftliche Produktivgenossenschaft \"Mastrind\" Staffelde eG – Stendal",
      "type": "Registerbekanntmachung nach dem Umwandlungsgesetz",
      "state": "Sachsen-Anhalt",
      "amtsgericht": "Amtsgericht Stendal",
      "registernummer": "GnR 154",
      "registerart": "GnR",
      "company_name": "Landwirtschaftliche Produktivgenossenschaft \"Mastrind\" Staffelde eG",
      "company_seat": "Stendal",
      "details": "03.03.2025 (Bekanntmachungsdatum)\n\nSachsen-Anhalt Amtsgericht Stendal GnR 154\nRegisterbekanntmachung nach dem Umwandlungsgesetz 03.03.2025 (Eintragungsdatum)\n\nLandwirtschaftliche Produktivgenossenschaft \"Mastrind\" Staffelde eG\neingetragene Genossenschaft\nStendal\n\nNicht eingetragen:\nDen Gläubigern der an der Verschmelzung beteiligten Rechtsträger ist, wenn sie binnen sechs Monaten nach dem Tag, an dem die Eintragung der Verschmelzung nach § 19 Abs. 3 UmwG als bekanntgemacht gilt, ihren Anspruch nach Grund und Höhe schriftlich anmelden, Sicherheit zu leisten, soweit sie nicht Befriedigung verlangen können. Dieses Recht steht ihnen jedoch nur zu, wenn sie glaubhaft machen, dass durch die Verschmelzung die Erfüllung ihrer Forderung gefährdet wird."
    },
    {
      "date": "2025-03-03",
      "id": "102704",
      "original_text": "Sonstige Registerbekanntmachung\nSchleswig-Holstein Amtsgericht Pinneberg HRB 9438\naccaris Holding AG – Appen",
      "type": "Sonstige Registerbekanntmachung",
      "state": "Schleswig-Holstein",
      "amtsgericht": "Amtsgericht Pinneberg",
      "registernummer": "HRB 9438",
      "registerart": "HRB",
      "company_name": "accaris Holding AG",
      "company_seat": "Appen",
      "details": "03.03.2025 (Bekanntmachungsdatum)\n\nSchleswig-Holstein Amtsgericht Pinneberg HRB 9438\nSonstige Registerbekanntmachung\n\naccaris Holding AG\nAktiengesellschaft\nAppen\n\nAls nicht eingetragen wird veröffentlicht: Gläubigern, deren Forderungen begründet worden sind, bevor die Eintragung des Beschlusses als nach § 10 des Handelsgesetzbuches bekannt gemacht gilt, ist, wenn sie sich binnen sechs Monaten nach der Bekanntmachung zu diesem Zweck melden, Sicherheit zu leisten, soweit sie nicht Befriedigung verlangen können. Dieses Recht steht den Gläubigern nicht zu, die im Fall des Insolvenzverfahrens ein Recht auf vorzugsweise Befriedigung aus der Deckungsmasse haben, die nach gesetzlicher Vorschrift zu ihrem Schutz errichtet und staatlich überwacht ist."
    },
    {
      "date": "2025-03-03",
      "id": "102705",
      "original_text": "Einreichung neuer Dokumente\nBerlin Amtsgericht Berlin (Charlottenburg) HRB 83923\nToll Collect GmbH – Berlin",
      "type": "Einreichung neuer Dokumente",
      "state": "Berlin",
      "amtsgericht": "Amtsgericht Berlin (Charlottenburg)",
      "registernummer": "HRB 83923",
      "registerart": "HRB",
      "company_name": "Toll Collect GmbH",
      "company_seat": "Berlin",
      "details": "03.03.2025 (Bekanntmachungsdatum)\n\nBerlin Amtsgericht Berlin (Charlottenburg) HRB 83923\nEinreichung neuer Dokumente\n\nToll Collect GmbH\nGesellschaft mit beschränkter Haftung\nBerlin\n\nAls nicht eingetragen wird veröffentlicht:\n\nEs wurde eine neue Liste der Aufsichtsratsmitglieder eingereicht (§52 GmbHG)."
    },
    {
      "date": "2025-03-03",
      "id": "102706",
      "original_text": "Löschungsankündigung\nBaden-Württemberg Amtsgericht Freiburg HRA 703559\nsilodom Immobilien GmbH & Co. KG – Haslach im Kinzigtal",
      "type": "Löschungsankündigung",
      "state": "Baden-Württemberg",
      "amtsgericht": "Amtsgericht Freiburg",
      "registernummer": "HRA 703559",
      "registerart": "HRA",
      "company_name": "silodom Immobilien GmbH & Co. KG",
      "company_seat": "Haslach im Kinzigtal",
      "details": "03.03.2025 (Bekanntmachungsdatum)\n\nBaden-Württemberg Amtsgericht Freiburg HRA 703559\nLöschungsankündigung\n\nsilodom Immobilien GmbH & Co. KG\nKommanditgesellschaft\nHaslach im Kinzigtal\n\nDas Gericht beabsichtigt, die Gesellschaft wegen Vermögenslosigkeit im Handelsregister von Amts wegen nach § 394 FamFG zu löschen. Die Frist zur Geltendmachung eines Widerspruchs gegen die beabsichtigte Löschung ist auf einen Monat ab Veröffentlichung bestimmt."
    },
    {
      "date": "2025-03-03",
      "id": "102707",
      "original_text": "Einreichung neuer Dokumente\nBaden-Württemberg Amtsgericht Freiburg HRB 732712\nQrauts AG – Freiburg im Breisgau",
      "type": "Einreichung neuer Dokumente",
      "state": "Baden-Württemberg",
      "amtsgericht": "Amtsgericht Freiburg",
      "registernummer": "HRB 732712",
      "registerart": "HRB",
      "company_name": "Qrauts AG",
      "company_seat": "Freiburg im Breisgau",
      "details": "03.03.2025 (Bekanntmachungsdatum)\n\nBaden-Württemberg Amtsgericht Freiburg HRB 732712\nEinreichung neuer Dokumente 03.03.2025 (Eintragungsdatum)\n\nQrauts AG\nAktiengesellschaft\nFreiburg im Breisgau\n\nAls nicht eingetragen wird bekanntgemacht:\n\nAm 10.01.2025 wurde eine Liste der Aufsichtsratsmitglieder - erstellt am 08.01.2025 - beim Registergericht eingereicht, welche am 03.03.2025 in den Registerordner eingestellt wurde."
    },
    {
      "date": "2025-03-03",
      "id": "102708",
      "original_text": "Einreichung neuer Dokumente\nSchleswig-Holstein Amtsgericht Kiel HRA 8901\nEntwicklungs- und Grundstücksgesellschaft Norderstedt mbH & Co. KG – Norderstedt",
      "type": "Einreichung neuer Dokumente",
      "state": "Schleswig-Holstein",
      "amtsgericht": "Amtsgericht Kiel",
      "registernummer": "HRA 8901",
      "registerart": "HRA",
      "company_name": "Entwicklungs- und Grundstücksgesellschaft Norderstedt mbH & Co. KG",
      "company_seat": "Norderstedt",
      "details": "03.03.2025 (Bekanntmachungsdatum)\n\nSchleswig-Holstein Amtsgericht Kiel HRA 8901\nEinreichung neuer Dokumente\n\nEntwicklungs- und Grundstücksgesellschaft Norderstedt mbH & Co. KG\nKommanditgesellschaft\nNorderstedt\n\nAls nicht eingetragen wird veröffentlicht: Eine neue Liste der Aufsichtsratsmitglieder ist eingereicht worden."
    },
    {
      "date": "2025-03-03",
      "id": "102709",
      "original_text": "Registerbekanntmachung nach dem Umwandlungsgesetz\nSchleswig-Holstein Amtsgericht Kiel HRB 27786\nJBWP Steuerberatungsgesellschaft mbH – Kiel",
      "type": "Registerbekanntmachung nach dem Umwandlungsgesetz",
      "state": "Schleswig-Holstein",
      "amtsgericht": "Amtsgericht Kiel",
      "registernummer": "HRB 27786",
      "registerart": "HRB",
      "company_name": "JBWP Steuerberatungsgesellschaft mbH",
      "company_seat": "Kiel",
      "details": "03.03.2025 (Bekanntmachungsdatum)\n\nSchleswig-Holstein Amtsgericht Kiel HRB 27786\nRegisterbekanntmachung nach dem Umwandlungsgesetz 28.02.2025 (Eintragungsdatum)\n\nJBWP Steuerberatungsgesellschaft mbH\nGesellschaft mit beschränkter Haftung\nKiel\n\nZu Eintragungsnummer 2 vom 28.02.2025 wird als nicht eingetragen veröffentlicht: Den Gläubigern der an der Spaltung beteiligten Rechtsträger ist, wenn sie binnen sechs Monaten nach dem Tag, an dem die Eintragung der Spaltung in das Register des Sitzes desjenigen Rechtsträgers, dessen Gläubiger sie sind,  bekannt gemacht worden ist, ihren Anspruch nach Grund und Höhe schriftlich anmelden, Sicherheit zu leisten, soweit sie nicht Befriedigung verlangen können. Dieses Recht steht den Gläubigern jedoch nur zu, wenn sie glaubhaft machen, dass durch die Spaltung die Erfüllung ihrer Forderung gefährdet wird."
    },
    {
      "date": "2025-03-03",
      "id": "102710",
      "original_text": "Löschungsankündigung\nBerlin Amtsgericht Berlin (Charlottenburg) HRB 72055\nKABEX Carree Beteiligungs- und Verwaltungsgesellschaft mbH – Berlin",
      "type": "Löschungsankündigung",
      "state": "Berlin",
      "amtsgericht": "Amtsgericht Berlin (Charlottenburg)",
      "registernummer": "HRB 72055",
      "registerart": "HRB",
      "company_name": "KABEX Carree Beteiligungs- und Verwaltungsgesellschaft mbH",
      "company_seat": "Berlin",
      "details": "03.03.2025 (Bekanntmachungsdatum)\n\nBerlin Amtsgericht Berlin (Charlottenburg) HRB 72055\nLöschungsankündigung\n\nKABEX Carree Beteiligungs- und Verwaltungsgesellschaft mbH\nGesellschaft mit beschränkter Haftung\nBerlin\n\nBei der nachstehenden Gesellschaft wird das Amtslöschungsverfahren gemäß § 394 FamFG eingeleitet. Widerspruchsfrist 6 Wochen"
    },
    {
      "date": "2025-03-03",
      "id": "102711",
      "original_text": "Registerbekanntmachung nach dem Umwandlungsgesetz\nSchleswig-Holstein Amtsgericht Flensburg HRA 5245\nteam baucenter GmbH & Co. KG – Flensburg",
      "type": "Registerbekanntmachung nach dem Umwandlungsgesetz",
      "state": "Schleswig-Holstein",
      "amtsgericht": "Amtsgericht Flensburg",
      "registernummer": "HRA 5245",
      "registerart": "HRA",
      "company_name": "team baucenter GmbH & Co. KG",
      "company_seat": "Flensburg",
      "details": "03.03.2025 (Bekanntmachungsdatum)\n\nSchleswig-Holstein Amtsgericht Flensburg HRA 5245\nRegisterbekanntmachung nach dem Umwandlungsgesetz 03.03.2025 (Eintragungsdatum)\n\nteam baucenter GmbH & Co. KG\nKommanditgesellschaft\nFlensburg\n\nZu Eintragungsnummer 27 vom 03.03.2025 wird als nicht eingetragen veröffentlicht: Den Gläubigern der an der Verschmelzung beteiligten Rechtsträger ist, wenn sie binnen sechs Monaten nach dem Tag, an dem die Eintragung der Verschmelzung in das Register des Sitzes desjenigen Rechtsträgers, dessen Gläubiger sie sind, als bekannt gemacht gilt, ihren Anspruch nach Grund und Höhe in Textform anmelden, Sicherheit zu leisten, soweit sie nicht Befriedigung verlangen können. Dieses Recht steht den Gläubigern jedoch nur zu, wenn sie glaubhaft machen, dass durch die Verschmelzung die Erfüllung ihrer Forderung gefährdet wird."
    },
    {
      "date": "2025-03-03",
      "id": "102712",
      "original_text": "Einreichung neuer Dokumente\nBaden-Württemberg Amtsgericht Ulm HRB 552240\nTechnische Werke Schussental Verwaltungs-GmbH – Ravensburg",
      "type": "Einreichung neuer Dokumente",
      "state": "Baden-Württemberg",
      "amtsgericht": "Amtsgericht Ulm",
      "registernummer": "HRB 552240",
      "registerart": "HRB",
      "company_name": "Technische Werke Schussental Verwaltungs-GmbH",
      "company_seat": "Ravensburg",
      "details": "03.03.2025 (Bekanntmachungsdatum)\n\nBaden-Württemberg Amtsgericht Ulm HRB 552240\nEinreichung neuer Dokumente\n\nTechnische Werke Schussental Verwaltungs-GmbH\nGesellschaft mit beschränkter Haftung\nRavensburg\n\nDie Gesellschaft hat am 28.02.2025 die Liste über die Zusammensetzung des Aufsichtsrats zum Handelsregister eingereicht."
    },
    {
      "date": "2025-03-03",
      "id": "102713",
      "original_text": "Registerbekanntmachung nach dem Umwandlungsgesetz\nBerlin Amtsgericht Berlin (Charlottenburg) HRB 1461\nBastfaserkontor Aktiengesellschaft – Berlin",
      "type": "Registerbekanntmachung nach dem Umwandlungsgesetz",
      "state": "Berlin",
      "amtsgericht": "Amtsgericht Berlin (Charlottenburg)",
      "registernummer": "HRB 1461",
      "registerart": "HRB",
      "company_name": "Bastfaserkontor Aktiengesellschaft",
      "company_seat": "Berlin",
      "details": "03.03.2025 (Bekanntmachungsdatum)\n\nBerlin Amtsgericht Berlin (Charlottenburg) HRB 1461\nRegisterbekanntmachung nach dem Umwandlungsgesetz 14.02.2025 (Eintragungsdatum)\n\nBastfaserkontor Aktiengesellschaft\nAktiengesellschaft\nBerlin\n\nDen Gläubigern ist, wenn sie binnen sechs Monaten nach dem Tag, an dem die Eintragung der Umwandlung als bekannt gemacht gilt, ihren Anspruch nach Grund und Höhe schriftlich anmelden, Sicherheit zu leisten, soweit sie nicht Befriedigung verlangen können. Dieses Recht steht den Gläubigern jedoch nur zu, wenn sie glaubhaft machen, dass durch die Umwandlung die Erfüllung ihrer Forderung gefährdet wird. Das Recht, Sicherheitsleistung zu verlangen, steht Gläubigern nicht zu, die im Falle der Insolvenz ein Recht auf vorzugsweise Befriedigung aus einer Deckungsmasse haben, die nach gesetzlicher Vorschrift zu ihrem Schutz errichtet und staatlich überwacht ist.Zu Eintragungsnummer 12 vom 14.02.2025 wird als nicht eingetragen veröffentlicht:"
    },
    {
      "date": "2025-03-03",
      "id": "102714",
      "original_text": "Löschungsankündigung\nBerlin Amtsgericht Berlin (Charlottenburg) HRB 194921\nProficar Meisterbetrieb UG (haftungsbeschränkt) – Berlin",
      "type": "Löschungsankündigung",
      "state": "Berlin",
      "amtsgericht": "Amtsgericht Berlin (Charlottenburg)",
      "registernummer": "HRB 194921",
      "registerart": "HRB",
      "company_name": "Proficar Meisterbetrieb UG (haftungsbeschränkt)",
      "company_seat": "Berlin",
      "details": "03.03.2025 (Bekanntmachungsdatum)\n\nBerlin Amtsgericht Berlin (Charlottenburg) HRB 194921\nLöschungsankündigung\n\nProficar Meisterbetrieb UG (haftungsbeschränkt)\nGesellschaft mit beschränkter Haftung\nBerlin\n\nBei der nachstehenden Gesellschaft wird das Amtslöschungsverfahren gemäß § 394 FamFG eingeleitet. Widerspruchsfrist 6 Wochen"
    },
    {
      "date": "2025-03-03",
      "id": "102715",
      "original_text": "Löschungsankündigung\nBerlin Amtsgericht Berlin (Charlottenburg) HRB 218930\nNOVASTRAHL-GmbH – Berlin",
      "type": "Löschungsankündigung",
      "state": "Berlin",
      "amtsgericht": "Amtsgericht Berlin (Charlottenburg)",
      "registernummer": "HRB 218930",
      "registerart": "HRB",
      "company_name": "NOVASTRAHL-GmbH",
      "company_seat": "Berlin",
      "details": "03.03.2025 (Bekanntmachungsdatum)\n\nBerlin Amtsgericht Berlin (Charlottenburg) HRB 218930\nLöschungsankündigung\n\nNOVASTRAHL-GmbH\nGesellschaft mit beschränkter Haftung\nBerlin\n\nBei der nachstehenden Gesellschaft wird das Amtslöschungsverfahren gemäß § 394 FamFG eingeleitet. Widerspruchsfrist 6 Wochen"
    },
    {
      "date": "2025-03-03",
      "id": "102716",
      "original_text": "Registerbekanntmachung nach dem Umwandlungsgesetz\nBrandenburg Amtsgericht Cottbus HRB 8320\nTeichgut Peitz GmbH – Peitz",
      "type": "Registerbekanntmachung nach dem Umwandlungsgesetz",
      "state": "Brandenburg",
      "amtsgericht": "Amtsgericht Cottbus",
      "registernummer": "HRB 8320",
      "registerart": "HRB",
      "company_name": "Teichgut Peitz GmbH",
      "company_seat": "Peitz",
      "details": "03.03.2025 (Bekanntmachungsdatum)\n\nBrandenburg Amtsgericht Cottbus HRB 8320\nRegisterbekanntmachung nach dem Umwandlungsgesetz 28.02.2025 (Eintragungsdatum)\n\nTeichgut Peitz GmbH\nGesellschaft mit beschränkter Haftung\nPeitz\n\nZu Eintragungsnummer 3 vom 28.02.2025 wird als nicht eingetragen veröffentlicht:\nDen Gläubigern der an der Verschmelzung beteiligten Rechtsträger ist, wenn sie binnen sechs Monaten nach dem Tag, an dem die Eintragung der Verschmelzung in das Register des Sitzes desjenigen Rechtsträgers, dessen Gläubiger sie sind, als bekannt gemacht gilt, ihren Anspruch nach Grund und Höhe schriftlich anmelden, Sicherheit zu leisten, soweit sie nicht Befriedigung verlangen können. Dieses Recht steht den Gläubigern jedoch nur zu, wenn sie glaubhaft machen, dass durch die Verschmelzung die Erfüllung ihrer Forderung gefährdet wird"
    },
    {
      "date": "2025-03-03",
      "id": "102717",
      "original_text": "Registerbekanntmachung nach dem Umwandlungsgesetz\nMecklenburg-Vorpommern Amtsgericht Stralsund HRB 22797\nAgrar Süd-Rügen Gustow GmbH – Gustow",
      "type": "Registerbekanntmachung nach dem Umwandlungsgesetz",
      "state": "Mecklenburg-Vorpommern",
      "amtsgericht": "Amtsgericht Stralsund",
      "registernummer": "HRB 22797",
      "registerart": "HRB",
      "company_name": "Agrar Süd-Rügen Gustow GmbH",
      "company_seat": "Gustow",
      "details": "03.03.2025 (Bekanntmachungsdatum)\n\nMecklenburg-Vorpommern Amtsgericht Stralsund HRB 22797\nRegisterbekanntmachung nach dem Umwandlungsgesetz 03.03.2025 (Eintragungsdatum)\n\nAgrar Süd-Rügen Gustow GmbH\nGesellschaft mit beschränkter Haftung\nGustow\n\nAls nicht eingetragen wird veröffentlicht: Den Gläubigern der an der Ausgliederung beteiligten Rechtsträger ist, wenn sie binnen sechs Monaten nach dem Tag, an dem die Eintragung der Ausgliederung in das Register des Sitzes desjenigen Rechtsträgers, dessen Gläubiger sie sind, nach § 19 Abs. 3 UmwG als bekannt gemacht gilt, ihren Anspruch nach Grund und Höhe in Textform anmelden,\nSicherheit zu leisten, soweit sie nicht Befriedigung verlangen können. Dieses Recht steht den Gläubigern jedoch nur zu, wenn sie glaubhaft machen, dass durch die Ausgliederung die Erfüllung der Forderung gefährdet wird."
    },
    {
      "date": "2025-03-03",
      "id": "102718",
      "original_text": "Registerbekanntmachung nach dem Umwandlungsgesetz\nMecklenburg-Vorpommern Amtsgericht Stralsund HRB 958 früher Amtsgericht Rostock\nAgrar Süd-Rügen GmbH – Gustow",
      "type": "Registerbekanntmachung nach dem Umwandlungsgesetz",
      "state": "Mecklenburg-Vorpommern",
      "amtsgericht": "Amtsgericht Stralsund",
      "registernummer": "HRB 958",
      "registerart": "HRB",
      "company_name": "Agrar Süd-Rügen GmbH",
      "company_seat": "Gustow",
      "former_amtsgericht": "Rostock",
      "details": "03.03.2025 (Bekanntmachungsdatum)\n\nMecklenburg-Vorpommern Amtsgericht Stralsund HRB 958 früher Amtsgericht Rostock\nRegisterbekanntmachung nach dem Umwandlungsgesetz 03.03.2025 (Eintragungsdatum)\n\nAgrar Süd-Rügen GmbH\nGesellschaft mit beschränkter Haftung\nGustow\n\nAls nicht eingetragen wird veröffentlicht: Den Gläubigern der an der Ausgliederung beteiligten Rechtsträger ist, wenn sie binnen sechs Monaten nach dem Tag, an dem die Eintragung der Ausgliederung in das Register des Sitzes desjenigen Rechtsträgers, dessen Gläubiger sie sind, nach § 19 Abs. 3 UmwG als bekannt gemacht gilt, ihren Anspruch nach Grund und Höhe in Textform anmelden,\nSicherheit zu leisten, soweit sie nicht Befriedigung verlangen können. Dieses Recht steht den Gläubigern jedoch nur zu, wenn sie glaubhaft machen, dass durch die Ausgliederung die Erfüllung der Forderung gefährdet wird."
    },
    {
      "date": "2025-03-03",
      "id": "102719",
      "original_text": "Löschungsankündigung\nSchleswig-Holstein Amtsgericht Pinneberg HRB 16139\nTural GmbH – Elmshorn",
      "type": "Löschungsankündigung",
      "state": "Schleswig-Holstein",
      "amtsgericht": "Amtsgericht Pinneberg",
      "registernummer": "HRB 16139",
      "registerart": "HRB",
      "company_name": "Tural GmbH",
      "company_seat": "Elmshorn",
      "details": "03.03.2025 (Bekanntmachungsdatum)\n\nSchleswig-Holstein Amtsgericht Pinneberg HRB 16139\nLöschungsankündigung\n\nTural GmbH\nGesellschaft mit beschränkter Haftung\nElmshorn\n\nEs ist die Löschung der nachstehenden Gesellschaft wegen Vermögenslosigkeit gemäß § 394 FamFG beabsichtigt. Widerspruchsfrist: 2 Monate."
    },
    {
      "date": "2025-03-03",
      "id": "102720",
      "original_text": "Einreichung neuer Dokumente\nBaden-Württemberg Amtsgericht Ulm HRB 701678\nRobert Bosch Automotive Steering GmbH – Schwäbisch Gmünd",
      "type": "Einreichung neuer Dokumente",
      "state": "Baden-Württemberg",
      "amtsgericht": "Amtsgericht Ulm",
      "registernummer": "HRB 701678",
      "registerart": "HRB",
      "company_name": "Robert Bosch Automotive Steering GmbH",
      "company_seat": "Schwäbisch Gmünd",
      "details": "03.03.2025 (Bekanntmachungsdatum)\n\nBaden-Württemberg Amtsgericht Ulm HRB 701678\nEinreichung neuer Dokumente\n\nRobert Bosch Automotive Steering GmbH\nGesellschaft mit beschränkter Haftung\nSchwäbisch Gmünd\n\nDie Gesellschaft hat am 28.02.2025 die Liste über die Zusammensetzung des Aufsichtsrats zum Handelsregister eingereicht."
    },
    {
      "date": "2025-03-03",
      "id": "102721",
      "original_text": "Einreichung neuer Dokumente\nBaden-Württemberg Amtsgericht Stuttgart HRB 780522\nERCHINGER AG – Tuttlingen",
      "type": "Einreichung neuer Dokumente",
      "state": "Baden-Württemberg",
      "amtsgericht": "Amtsgericht Stuttgart",
      "registernummer": "HRB 780522",
      "registerart": "HRB",
      "company_name": "ERCHINGER AG",
      "company_seat": "Tuttlingen",
      "details": "03.03.2025 (Bekanntmachungsdatum)\n\nBaden-Württemberg Amtsgericht Stuttgart HRB 780522\nEinreichung neuer Dokumente\n\nERCHINGER AG\nAktiengesellschaft\nTuttlingen\n\nDie Gesellschaft hat am 26.02.2025 die Liste über die Zusammensetzung des Aufsichtsrats zum Handelsregister eingereicht."
    },
    {
      "date": "2025-03-03",
      "id": "102722",
      "original_text": "Registerbekanntmachung nach dem Umwandlungsgesetz\nSchleswig-Holstein Amtsgericht Kiel HRA 12633\nSchütze Montagen e.K. – Bordesholm",
      "type": "Registerbekanntmachung nach dem Umwandlungsgesetz",
      "state": "Schleswig-Holstein",
      "amtsgericht": "Amtsgericht Kiel",
      "registernummer": "HRA 12633",
      "registerart": "HRA",
      "company_name": "Schütze Montagen e.K.",
      "company_seat": "Bordesholm",
      "details": "03.03.2025 (Bekanntmachungsdatum)\n\nSchleswig-Holstein Amtsgericht Kiel HRA 12633\nRegisterbekanntmachung nach dem Umwandlungsgesetz 03.03.2025 (Eintragungsdatum)\n\nSchütze Montagen e.K.\nEinzelkaufmann / Einzelkauffrau\nBordesholm\n\nZu Eintragungsnummer 1 vom 03.03.2025 wird als nicht eingetragen veröffentlicht: Als nicht eingetragen wird veröffentlicht: Den Gläubigern der an der Verschmelzung beteiligten Rechtsträger ist, wenn sie binnen sechs Monaten nach dem Tag, an dem die Eintragung der Verschmelzung in das Register des Sitzes desjenigen Rechtsträgers, dessen Gläubiger sie sind, nach § 19 Abs. 3 UmwG bekannt gemacht worden ist, ihren Anspruch nach Grund und Höhe schriftlich anmelden, Sicherheit zu leisten, soweit sie nicht Befriedigung verlangen können. Dieses Recht steht den Gläubigern jedoch nur zu, wenn sie glaubhaft machen, dass durch die Verschmelzung die Erfüllung ihrer Forderung gefährdet wird."
    },
    {
      "date": "2025-03-03",
      "id": "102723",
      "original_text": "Löschungsankündigung\nSchleswig-Holstein Amtsgericht Pinneberg HRB 12830\nMobilePoint GmbH – Tornesch",
      "type": "Löschungsankündigung",
      "state": "Schleswig-Holstein",
      "amtsgericht": "Amtsgericht Pinneberg",
      "registernummer": "HRB 12830",
      "registerart": "HRB",
      "company_name": "MobilePoint GmbH",
      "company_seat": "Tornesch",
      "details": "03.03.2025 (Bekanntmachungsdatum)\n\nSchleswig-Holstein Amtsgericht Pinneberg HRB 12830\nLöschungsankündigung\n\nMobilePoint GmbH\nGesellschaft mit beschränkter Haftung\nTornesch\n\nEs ist die Löschung der nachstehenden Gesellschaft wegen Vermögenslosigkeit gemäß § 394 FamFG beabsichtigt. Widerspruchsfrist: 2 Monate."
    },
    {
      "date": "2025-03-03",
      "id": "102724",
      "original_text": "Löschungsankündigung\nSchleswig-Holstein Amtsgericht Flensburg HRB 10493\nTNT247.com UG (haftungsbeschränkt) – Flensburg",
      "type": "Löschungsankündigung",
      "state": "Schleswig-Holstein",
      "amtsgericht": "Amtsgericht Flensburg",
      "registernummer": "HRB 10493",
      "registerart": "HRB",
      "company_name": "TNT247.com UG (haftungsbeschränkt)",
      "company_seat": "Flensburg",
      "details": "03.03.2025 (Bekanntmachungsdatum)\n\nSchleswig-Holstein Amtsgericht Flensburg HRB 10493\nLöschungsankündigung\n\nTNT247.com UG (haftungsbeschränkt)\nGesellschaft mit beschränkter Haftung\nFlensburg\n\nEs ist die Löschung der nachstehenden Gesellschaft wegen Vermögenslosigkeit gemäß § 394 FamFG beabsichtigt.\nWiderspruchsfrist: 2 Monate."
    },
    {
      "date": "2025-03-03",
      "id": "102725",
      "original_text": "Sonstige Registerbekanntmachung\nSachsen Amtsgericht Chemnitz HRB 14864\nZwickauer Backmeister Aktiengesellschaft – Zwickau",
      "type": "Sonstige Registerbekanntmachung",
      "state": "Sachsen",
      "amtsgericht": "Amtsgericht Chemnitz",
      "registernummer": "HRB 14864",
      "registerart": "HRB",
      "company_name": "Zwickauer Backmeister Aktiengesellschaft",
      "company_seat": "Zwickau",
      "details": "03.03.2025 (Bekanntmachungsdatum)\n\nSachsen Amtsgericht Chemnitz HRB 14864\nSonstige Registerbekanntmachung\n\nZwickauer Backmeister Aktiengesellschaft\nAktiengesellschaft\nZwickau\n\nFür die Zwickauer Backmeister Aktiengesellschaft, ehemaliger  Sitz Zwickau, liegt beim Amtsgericht Chemnitz -Registergericht- ein Antrag auf Bestellung des Rechtsanwalt Lutz Martschink zum Nachtragsabwickler  vor.\nDie Anträge können beim AG Chemnitz -Registergericht- zu den Öffnungszeiten eingesehen werden.\nFür die Beteiligten steht Gelegenheit zur Stellungnahme binnen 4 Wochen."
    },
    {
      "date": "2025-03-03",
      "id": "102726",
      "original_text": "Löschungsankündigung\nSachsen Amtsgericht Dresden HRB 35137\nDespa Bau und Service UG (haftungsbeschränkt) – Dresden",
      "type": "Löschungsankündigung",
      "state": "Sachsen",
      "amtsgericht": "Amtsgericht Dresden",
      "registernummer": "HRB 35137",
      "registerart": "HRB",
      "company_name": "Despa Bau und Service UG (haftungsbeschränkt)",
      "company_seat": "Dresden",
      "details": "03.03.2025 (Bekanntmachungsdatum)\n\nSachsen Amtsgericht Dresden HRB 35137\nLöschungsankündigung\n\nDespa Bau und Service UG (haftungsbeschränkt)\nGesellschaft mit beschränkter Haftung\nDresden\n\nDas Registergericht beabsichtigt, die im Handelsregister eingetragene Gesellschaft von Amts wegen nach § 394 FamFG zu löschen. Die Frist zu Erhebung eines Widerspruchs gegen die beabsichtigte Löschung wird auf einen Monat festgesetzt."
    },
    {
      "date": "2025-03-03",
      "id": "102727",
      "original_text": "Sonstige Registerbekanntmachung\nSachsen Amtsgericht Leipzig VR 5643\nSelbstlernen e.V. – Leipzig",
      "type": "Sonstige Registerbekanntmachung",
      "state": "Sachsen",
      "amtsgericht": "Amtsgericht Leipzig",
      "registernummer": "VR 5643",
      "registerart": "VR",
      "company_name": "Selbstlernen e.V.",
      "company_seat": "Leipzig",
      "details": "03.03.2025 (Bekanntmachungsdatum)\n\nSachsen Amtsgericht Leipzig VR 5643\nSonstige Registerbekanntmachung\n\nSelbstlernen e.V.\neingetragener Verein\nLeipzig\n\nDas Gericht beabsichtigt, gemäß § 4 Absatz 2 Ziffer 1 der Verordnung über das Vereinsregister das Registerblatt  des Vereins zu schließen, da nach den Ermittlungen des Gerichts sämtliche Mitglieder aus dem Verein ausgeschieden sind. Zur Geltendmachung eines Widerspruchs gegen die beabsichtigte Schließung wird eine Frist von einem Monat nach der Veröffentlichung bestimmt."
    },
    {
      "date": "2025-03-03",
      "id": "102728",
      "original_text": "Einreichung neuer Dokumente\nSachsen Amtsgericht Dresden HRB 18821\nRBB Management AG – Bautzen",
      "type": "Einreichung neuer Dokumente",
      "state": "Sachsen",
      "amtsgericht": "Amtsgericht Dresden",
      "registernummer": "HRB 18821",
      "registerart": "HRB",
      "company_name": "RBB Management AG",
      "company_seat": "Bautzen",
      "details": "03.03.2025 (Bekanntmachungsdatum)\n\nSachsen Amtsgericht Dresden HRB 18821\nEinreichung neuer Dokumente\n\nRBB Management AG\nAktiengesellschaft\nBautzen\n\nAm 27.02.2025 wurde beim Handelsregister des Amtsgerichts Dresden die Liste der Mitglieder des Aufsichtsrats gemäß § 106 AktG eingereicht."
    },
    {
      "date": "2025-03-03",
      "id": "102729",
      "original_text": "Registerbekanntmachung nach dem Umwandlungsgesetz\nBaden-Württemberg Amtsgericht Freiburg HRB 732718\nReich Haustechnik GmbH – Bad Krozingen",
      "type": "Registerbekanntmachung nach dem Umwandlungsgesetz",
      "state": "Baden-Württemberg",
      "amtsgericht": "Amtsgericht Freiburg",
      "registernummer": "HRB 732718",
      "registerart": "HRB",
      "company_name": "Reich Haustechnik GmbH",
      "company_seat": "Bad Krozingen",
      "details": "03.03.2025 (Bekanntmachungsdatum)\n\nBaden-Württemberg Amtsgericht Freiburg HRB 732718\nRegisterbekanntmachung nach dem Umwandlungsgesetz 03.03.2025 (Eintragungsdatum)\n\nReich Haustechnik GmbH\nGesellschaft mit beschränkter Haftung\nBad Krozingen\n\nAls nicht eingetragen wird bekanntgemacht:\nDen Gläubigern der an der Ausgliederung beteiligten Rechtsträger ist, wenn sie binnen sechs Monaten nach dem Tag, an dem die Eintragung der Ausgliederung in das Register des Sitzes desjenigen Rechtsträgers, dessen Gläubiger sie sind, nach § 19 Abs. 3 UmwG als bekanntgemacht gilt, ihren Anspruch nach Grund und Höhe schriftlich anmelden, Sicherheit zu leisten, soweit sie nicht Befriedigung verlangen können. Dieses Recht steht den Gläubigern jedoch nur zu, wenn sie glaubhaft machen, dass durch die Ausgliederung die Erfüllung ihrer Forderung gefährdet wird."
    },
    {
      "date": "2025-03-03",
      "id": "102730",
      "original_text": "Registerbekanntmachung nach dem Umwandlungsgesetz\nBaden-Württemberg Amtsgericht Freiburg HRA 708998\nReich Haustechnik e.K. – Bad Krozingen",
      "type": "Registerbekanntmachung nach dem Umwandlungsgesetz",
      "state": "Baden-Württemberg",
      "amtsgericht": "Amtsgericht Freiburg",
      "registernummer": "HRA 708998",
      "registerart": "HRA",
      "company_name": "Reich Haustechnik e.K.",
      "company_seat": "Bad Krozingen",
      "details": "03.03.2025 (Bekanntmachungsdatum)\n\nBaden-Württemberg Amtsgericht Freiburg HRA 708998\nRegisterbekanntmachung nach dem Umwandlungsgesetz 03.03.2025 (Eintragungsdatum)\n\nReich Haustechnik e.K.\nEinzelkaufmann / Einzelkauffrau\nBad Krozingen\n\nAls nicht eingetragen wird bekanntgemacht:\nDen Gläubigern der an der Ausgliederung beteiligten Rechtsträger ist, wenn sie binnen sechs Monaten nach dem Tag, an dem die Eintragung der Ausgliederung in das Register des Sitzes desjenigen Rechtsträgers, dessen Gläubiger sie sind, nach § 19 Abs. 3 UmwG als bekanntgemacht gilt, ihren Anspruch nach Grund und Höhe schriftlich anmelden, Sicherheit zu leisten, soweit sie nicht Befriedigung verlangen können. Dieses Recht steht den Gläubigern jedoch nur zu, wenn sie glaubhaft machen, dass durch die Ausgliederung die Erfüllung ihrer Forderung gefährdet wird."
    },
    {
      "date": "2025-03-03",
      "id": "102731",
      "original_text": "Einreichung neuer Dokumente\nNiedersachsen Amtsgericht Hannover HRB 200158\nTÜV NORD AG – Hannover",
      "type": "Einreichung neuer Dokumente",
      "state": "Niedersachsen",
      "amtsgericht": "Amtsgericht Hannover",
      "registernummer": "HRB 200158",
      "registerart": "HRB",
      "company_name": "TÜV NORD AG",
      "company_seat": "Hannover",
      "details": "03.03.2025 (Bekanntmachungsdatum)\n\nNiedersachsen Amtsgericht Hannover HRB 200158\nEinreichung neuer Dokumente\n\nTÜV NORD AG\nAktiengesellschaft\nHannover\n\nDie Liste der Mitglieder des Aufsichtsrats wurde beim Registergericht eingereicht."
    },
    {
      "date": "2025-03-03",
      "id": "102732",
      "original_text": "Löschungsankündigung\nNiedersachsen Amtsgericht Braunschweig HRB 207291\nTL-Bau GmbH – Salzgitter",
      "type": "Löschungsankündigung",
      "state": "Niedersachsen",
      "amtsgericht": "Amtsgericht Braunschweig",
      "registernummer": "HRB 207291",
      "registerart": "HRB",
      "company_name": "TL-Bau GmbH",
      "company_seat": "Salzgitter",
      "details": "03.03.2025 (Bekanntmachungsdatum)\n\nNiedersachsen Amtsgericht Braunschweig HRB 207291\nLöschungsankündigung\n\nTL-Bau GmbH\nGesellschaft mit beschränkter Haftung\nSalzgitter\n\nDas Registergericht beabsichtigt, die Gesellschaft von Amts wegen nach § 394 FamFG zu löschen. Die Frist zur Erhebung eines Widerspruchs ist auf 1 Monat ab dieser Registerbekanntmachung festgesetzt."
    },
    {
      "date": "2025-03-03",
      "id": "102733",
      "original_text": "Einreichung neuer Dokumente\nNiedersachsen Amtsgericht Braunschweig HRB 204252\nVolkswagen Autoversicherung AG – Braunschweig",
      "type": "Einreichung neuer Dokumente",
      "state": "Niedersachsen",
      "amtsgericht": "Amtsgericht Braunschweig",
      "registernummer": "HRB 204252",
      "registerart": "HRB",
      "company_name": "Volkswagen Autoversicherung AG",
      "company_seat": "Braunschweig",
      "details": "03.03.2025 (Bekanntmachungsdatum)\n\nNiedersachsen Amtsgericht Braunschweig HRB 204252\nEinreichung neuer Dokumente\n\nVolkswagen Autoversicherung AG\nAktiengesellschaft\nBraunschweig\n\nDie Liste der Mitglieder des Aufsichtsrats wurde beim Registergericht eingereicht."
    },
    {
      "date": "2025-03-03",
      "id": "102734",
      "original_text": "Löschungsankündigung\nNiedersachsen Amtsgericht Braunschweig HRB 209939\nMsolli Bau Experten UG (haftungsbeschränkt) – Wolfsburg",
      "type": "Löschungsankündigung",
      "state": "Niedersachsen",
      "amtsgericht": "Amtsgericht Braunschweig",
      "registernummer": "HRB 209939",
      "registerart": "HRB",
      "company_name": "Msolli Bau Experten UG (haftungsbeschränkt)",
      "company_seat": "Wolfsburg",
      "details": "03.03.2025 (Bekanntmachungsdatum)\n\nNiedersachsen Amtsgericht Braunschweig HRB 209939\nLöschungsankündigung 03.03.2025 (Eintragungsdatum)\n\nMsolli Bau Experten UG (haftungsbeschränkt)\nGesellschaft mit beschränkter Haftung\nWolfsburg\n\nDas Registergericht beabsichtigt, die Gesellschaft von Amts wegen nach § 394 FamFG zu löschen. Die Frist zur Erhebung eines Widerspruchs ist auf 1 Monat ab dieser Registerbekanntmachung festgesetzt."
    },
    {
      "date": "2025-03-03",
      "id": "102735",
      "original_text": "Löschungsankündigung\nNiedersachsen Amtsgericht Osnabrück HRB 203314\nMCR GmbH – Osnabrück",
      "type": "Löschungsankündigung",
      "state": "Niedersachsen",
      "amtsgericht": "Amtsgericht Osnabrück",
      "registernummer": "HRB 203314",
      "registerart": "HRB",
      "company_name": "MCR GmbH",
      "company_seat": "Osnabrück",
      "details": "03.03.2025 (Bekanntmachungsdatum)\n\nNiedersachsen Amtsgericht Osnabrück HRB 203314\nLöschungsankündigung\n\nMCR GmbH\nGesellschaft mit beschränkter Haftung\nOsnabrück\n\nDas Registergericht beabsichtigt, die Gesellschaft von Amts wegen nach § 394 FamFG wegen Vermögenslosigkeit zu löschen. Die Frist zur Erhebung eines Widerspruchs ist auf 1 Monat ab dieser Registerbekanntmachung festgesetzt."
    },
    {
      "date": "2025-03-03",
      "id": "102736",
      "original_text": "Löschungsankündigung\nNiedersachsen Amtsgericht Tostedt HRB 207809\nViwon Trading GmbH – Zeven",
      "type": "Löschungsankündigung",
      "state": "Niedersachsen",
      "amtsgericht": "Amtsgericht Tostedt",
      "registernummer": "HRB 207809",
      "registerart": "HRB",
      "company_name": "Viwon Trading GmbH",
      "company_seat": "Zeven",
      "details": "03.03.2025 (Bekanntmachungsdatum)\n\nNiedersachsen Amtsgericht Tostedt HRB 207809\nLöschungsankündigung 03.03.2025 (Eintragungsdatum)\n\nViwon Trading GmbH\nGesellschaft mit beschränkter Haftung\nZeven\n\nDas Registergericht beabsichtigt, die Gesellschaft von Amts wegen nach § 394 FamFG zu löschen. Die Frist zur Erhebung eines Widerspruchs ist auf 1 Monat ab dieser Registerbekanntmachung festgesetzt."
    },
    {
      "date": "2025-03-03",
      "id": "102737",
      "original_text": "Einreichung neuer Dokumente\nNiedersachsen Amtsgericht Hannover HRB 120627 früher Amtsgericht Burgwedel\nEnergiewerke Isernhagen GmbH – Isernhagen",
      "type": "Einreichung neuer Dokumente",
      "state": "Niedersachsen",
      "amtsgericht": "Amtsgericht Hannover",
      "registernummer": "HRB 120627",
      "registerart": "HRB",
      "company_name": "Energiewerke Isernhagen GmbH",
      "company_seat": "Isernhagen",
      "former_amtsgericht": "Burgwedel",
      "details": "03.03.2025 (Bekanntmachungsdatum)\n\nNiedersachsen Amtsgericht Hannover HRB 120627 früher Amtsgericht Burgwedel\nEinreichung neuer Dokumente\n\nEnergiewerke Isernhagen GmbH\nGesellschaft mit beschränkter Haftung\nIsernhagen\n\nDie Liste der Mitglieder des Aufsichtsrats wurde beim Registergericht eingereicht."
    },
    {
      "date": "2025-03-03",
      "id": "102738",
      "original_text": "Registerbekanntmachung nach dem Umwandlungsgesetz\nNordrhein-Westfalen Amtsgericht Köln HRB 45305\nHaVeTimm Hausmanagement GmbH – Kerpen",
      "type": "Registerbekanntmachung nach dem Umwandlungsgesetz",
      "state": "Nordrhein-Westfalen",
      "amtsgericht": "Amtsgericht Köln",
      "registernummer": "HRB 45305",
      "registerart": "HRB",
      "company_name": "HaVeTimm Hausmanagement GmbH",
      "company_seat": "Kerpen",
      "details": "03.03.2025 (Bekanntmachungsdatum)\n\nNordrhein-Westfalen Amtsgericht Köln HRB 45305\nRegisterbekanntmachung nach dem Umwandlungsgesetz 03.03.2025 (Eintragungsdatum)\n\nHaVeTimm Hausmanagement GmbH\nGesellschaft mit beschränkter Haftung\nKerpen\n\nDen Gläubigern der an der Verschmelzung beteiligten Rechtsträger ist, wenn sie binnen sechs Monaten nach dem Tag, an dem die Eintragung der Verschmelzung in das Register des Sitzes derjenigen Rechtsträger deren Gläubiger sie sind, nach § 19 Absatz 3 UmwG als bekanntgemacht gilt, ihren Anspruch nach Grund und Höhe schriftlich anmelden, Sicherheit zu leisten, soweit sie nicht Befriedigung verlangen können. Dieses Recht steht den Gläubigern jedoch nur zu, wenn sie glaubhaft machen, dass durch die Verschmelzung die Erfüllung ihrer Forderung gefährdet wird."
    },
    {
      "date": "2025-03-03",
      "id": "102739",
      "original_text": "Registerbekanntmachung nach dem Umwandlungsgesetz\nNordrhein-Westfalen Amtsgericht Köln HRB 41899\nMERKUR Immobilienverwaltungsgesellschaft mit beschränkter Haftung – Kerpen",
      "type": "Registerbekanntmachung nach dem Umwandlungsgesetz",
      "state": "Nordrhein-Westfalen",
      "amtsgericht": "Amtsgericht Köln",
      "registernummer": "HRB 41899",
      "registerart": "HRB",
      "company_name": "MERKUR Immobilienverwaltungsgesellschaft mit beschränkter Haftung",
      "company_seat": "Kerpen",
      "details": "03.03.2025 (Bekanntmachungsdatum)\n\nNordrhein-Westfalen Amtsgericht Köln HRB 41899\nRegisterbekanntmachung nach dem Umwandlungsgesetz 03.03.2025 (Eintragungsdatum)\n\nMERKUR Immobilienverwaltungsgesellschaft mit beschränkter Haftung\nGesellschaft mit beschränkter Haftung\nKerpen\n\nDen Gläubigern der an der Verschmelzung beteiligten Rechtsträger ist, wenn sie binnen sechs Monaten nach dem Tag, an dem die Eintragung der Verschmelzung in das Register des Sitzes derjenigen Rechtsträger deren Gläubiger sie sind, nach § 19 Absatz 3 UmwG als bekanntgemacht gilt, ihren Anspruch nach Grund und Höhe schriftlich anmelden, Sicherheit zu leisten, soweit sie nicht Befriedigung verlangen können. Dieses Recht steht den Gläubigern jedoch nur zu, wenn sie glaubhaft machen, dass durch die Verschmelzung die Erfüllung ihrer Forderung gefährdet wird."
    },
    {
      "date": "2025-03-03",
      "id": "102740",
      "original_text": "Löschungsankündigung\nRheinland-Pfalz Amtsgericht Montabaur HRB 22608\nProducts for People GmbH – Eitelborn",
      "type": "Löschungsankündigung",
      "state": "Rheinland-Pfalz",
      "amtsgericht": "Amtsgericht Montabaur",
      "registernummer": "HRB 22608",
      "registerart": "HRB",
      "company_name": "Products for People GmbH",
      "company_seat": "Eitelborn",
      "details": "03.03.2025 (Bekanntmachungsdatum)\n\nRheinland-Pfalz Amtsgericht Montabaur HRB 22608\nLöschungsankündigung\n\nProducts for People GmbH\nGesellschaft mit beschränkter Haftung\nEitelborn\n\nDas Registergericht beabsichtigt die Gesellschaft von Amts wegen nach § 394 FamFG zu löschen. Die Frist zur Erhebung eines Widerspruchs ist auf zwei Monate festgesetzt."
    },
    {
      "date": "2025-03-03",
      "id": "102741",
      "original_text": "Löschungsankündigung\nRheinland-Pfalz Amtsgericht Kaiserslautern HRB 32593\nPflänzchen Veganhandel GmbH – Imsweiler",
      "type": "Löschungsankündigung",
      "state": "Rheinland-Pfalz",
      "amtsgericht": "Amtsgericht Kaiserslautern",
      "registernummer": "HRB 32593",
      "registerart": "HRB",
      "company_name": "Pflänzchen Veganhandel GmbH",
      "company_seat": "Imsweiler",
      "details": "03.03.2025 (Bekanntmachungsdatum)\n\nRheinland-Pfalz Amtsgericht Kaiserslautern HRB 32593\nLöschungsankündigung 28.02.2025 (Eintragungsdatum)\n\nPflänzchen Veganhandel GmbH\nGesellschaft mit beschränkter Haftung\nImsweiler\n\nDas Registergericht beabsichtigt die vorgenannte Firma gemäß § 394 FamFG wegen Vermögenslosigkeit zu löschen. Widerspruch gegen die Löschung kann nur binnen 3 Monaten ab Veröffentlichung dieser Verfügung eingelegt werden."
    },
    {
      "date": "2025-03-03",
      "id": "102742",
      "original_text": "Registerbekanntmachung nach dem Umwandlungsgesetz\nBremen Amtsgericht Bremen HRA 28243\nDualkonzept OHG – Bremen",
      "type": "Registerbekanntmachung nach dem Umwandlungsgesetz",
      "state": "Bremen",
      "amtsgericht": "Amtsgericht Bremen",
      "registernummer": "HRA 28243",
      "registerart": "HRA",
      "company_name": "Dualkonzept OHG",
      "company_seat": "Bremen",
      "details": "03.03.2025 (Bekanntmachungsdatum)\n\nBremen Amtsgericht Bremen HRA 28243\nRegisterbekanntmachung nach dem Umwandlungsgesetz 28.02.2025 (Eintragungsdatum)\n\nDualkonzept OHG\nOffene Handelsgesellschaft\nBremen\n\nZu Eintragungsnummer 2 vom 28.02.2025 wird als nicht eingetragen veröffentlicht:\nDen Gläubigern ist, wenn sie binnen sechs Monaten nach dem Tag, an dem die Eintragung der Umwandlung als bekannt gemacht gilt, ihren Anspruch nach Grund und Höhe schriftlich anmelden, Sicherheit zu leisten, soweit sie nicht Befriedigung verlangen können. Dieses Recht steht den Gläubigern jedoch nur zu, wenn sie glaubhaft machen, dass durch die Umwandlung die Erfüllung ihrer Forderung gefährdet wird. Das Recht, Sicherheitsleistung zu verlangen, steht Gläubigern nicht zu, die im Falle der Insolvenz ein Recht auf vorzugsweise Befriedigung aus einer Deckungsmasse haben, die nach gesetzlicher Vorschrift zu ihrem Schutz errichtet und staatlich überwacht ist."
    },
    {
      "date": "2025-03-03",
      "id": "102743",
      "original_text": "Registerbekanntmachung nach dem Umwandlungsgesetz\nBremen Amtsgericht Bremen HRB 41235\nDualkonzept GmbH – Bremen",
      "type": "Registerbekanntmachung nach dem Umwandlungsgesetz",
      "state": "Bremen",
      "amtsgericht": "Amtsgericht Bremen",
      "registernummer": "HRB 41235",
      "registerart": "HRB",
      "company_name": "Dualkonzept GmbH",
      "company_seat": "Bremen",
      "details": "03.03.2025 (Bekanntmachungsdatum)\n\nBremen Amtsgericht Bremen HRB 41235\nRegisterbekanntmachung nach dem Umwandlungsgesetz 28.02.2025 (Eintragungsdatum)\n\nDualkonzept GmbH\nGesellschaft mit beschränkter Haftung\nBremen\n\nZu Eintragungsnummer 1 vom 28.02.2025 wird als nicht eingetragen veröffentlicht:\nDen Gläubigern ist, wenn sie binnen sechs Monaten nach dem Tag, an dem die Eintragung der Umwandlung als bekannt gemacht gilt, ihren Anspruch nach Grund und Höhe schriftlich anmelden, Sicherheit zu leisten, soweit sie nicht Befriedigung verlangen können. Dieses Recht steht den Gläubigern jedoch nur zu, wenn sie glaubhaft machen, dass durch die Umwandlung die Erfüllung ihrer Forderung gefährdet wird. Das Recht, Sicherheitsleistung zu verlangen, steht Gläubigern nicht zu, die im Falle der Insolvenz ein Recht auf vorzugsweise Befriedigung aus einer Deckungsmasse haben, die nach gesetzlicher Vorschrift zu ihrem Schutz errichtet und staatlich überwacht ist."
    },
    {
      "date": "2025-03-03",
      "id": "102744",
      "original_text": "Löschungsankündigung\nBremen Amtsgericht Bremen HRB 21830\nArtur-Vermögensverwaltung Aktiengesellschaft – Bremen",
      "type": "Löschungsankündigung",
      "state": "Bremen",
      "amtsgericht": "Amtsgericht Bremen",
      "registernummer": "HRB 21830",
      "registerart": "HRB",
      "company_name": "Artur-Vermögensverwaltung Aktiengesellschaft",
      "company_seat": "Bremen",
      "details": "03.03.2025 (Bekanntmachungsdatum)\n\nBremen Amtsgericht Bremen HRB 21830\nLöschungsankündigung\n\nArtur-Vermögensverwaltung Aktiengesellschaft\nAktiengesellschaft\nBremen\n\nEs ist beabsichtigt die im Handelsregister eingetragene Gesellschaft von Amts wegen gemäß § 394 FamFG zu löschen. Gegen die Löschung kann beim AG Bremen schriftlich oder zu Protokoll der Geschäftsstelle Widerspruch eingelegt werden. Widerspruchsfrist 4 Wochen."
    },
    {
      "date": "2025-03-03",
      "id": "102745",
      "original_text": "Löschungsankündigung\nBremen Amtsgericht Bremen HRB 16755\nTANG HANDEL GMBH – Bremen",
      "type": "Löschungsankündigung",
      "state": "Bremen",
      "amtsgericht": "Amtsgericht Bremen",
      "registernummer": "HRB 16755",
      "registerart": "HRB",
      "company_name": "TANG HANDEL GMBH",
      "company_seat": "Bremen",
      "details": "03.03.2025 (Bekanntmachungsdatum)\n\nBremen Amtsgericht Bremen HRB 16755\nLöschungsankündigung\n\nTANG HANDEL GMBH\nGesellschaft mit beschränkter Haftung\nBremen\n\nEs ist beabsichtigt die im Handelsregister eingetragene Gesellschaft von Amts wegen gemäß § 394 FamFG zu löschen. Gegen die Löschung kann beim AG Bremen schriftlich oder zu Protokoll der Geschäftsstelle Widerspruch eingelegt werden. Widerspruchsfrist 4 Wochen."
    },
    {
      "date": "2025-03-03",
      "id": "102746",
      "original_text": "Registerbekanntmachung nach dem Umwandlungsgesetz\nHessen Amtsgericht Frankfurt am Main HRB 137916\nLONG-TERM INVESTING Research GmbH – Frankfurt am Main",
      "type": "Registerbekanntmachung nach dem Umwandlungsgesetz",
      "state": "Hessen",
      "amtsgericht": "Amtsgericht Frankfurt am Main",
      "registernummer": "HRB 137916",
      "registerart": "HRB",
      "company_name": "LONG-TERM INVESTING Research GmbH",
      "company_seat": "Frankfurt am Main",
      "details": "03.03.2025 (Bekanntmachungsdatum)\n\nHessen Amtsgericht Frankfurt am Main HRB 137916\nRegisterbekanntmachung nach dem Umwandlungsgesetz 03.03.2025 (Eintragungsdatum)\n\nLONG-TERM INVESTING Research GmbH\nGesellschaft mit beschränkter Haftung\nFrankfurt am Main\n\nDen Gläubigern der an der formwechselnden Umwandlung beteiligten Rechtsträger ist, wenn sie binnen sechs Monaten nach dem Tag, an dem die Eintragung der formwechselnden Umwandlung in das Register des Sitzes derjenigen Rechtsträger deren Gläubiger sie sind, nach § 201 UmwG bekannt gemacht worden ist, ihren Anspruch nach Grund und Höhe schriftlich anmelden, Sicherheit zu leisten, soweit sie nicht Befriedigung verlangen können. Dieses Recht steht den Gläubigern jedoch nur zu, wenn sie glaubhaft machen, dass durch die formwechselnden Umwandlung die Erfüllung ihrer Forderung gefährdet wird."
    },
    {
      "date": "2025-03-03",
      "id": "102747",
      "original_text": "Sonstige Registerbekanntmachung\nHessen Amtsgericht Limburg VR 1151\nVerein der Sportfischer Oberweyer – Hadamar-Oberweyer",
      "type": "Sonstige Registerbekanntmachung",
      "state": "Hessen",
      "amtsgericht": "Amtsgericht Limburg",
      "registernummer": "VR 1151",
      "registerart": "VR",
      "company_name": "Verein der Sportfischer Oberweyer",
      "company_seat": "Hadamar-Oberweyer",
      "details": "03.03.2025 (Bekanntmachungsdatum)\n\nHessen Amtsgericht Limburg VR 1151\nSonstige Registerbekanntmachung 03.03.2025 (Eintragungsdatum)\n\nVerein der Sportfischer Oberweyer\neingetragener Verein\nHadamar-Oberweyer\n\nDer Verein ist aufgelöst."
    },
    {
      "date": "2025-03-03",
      "id": "102748",
      "original_text": "Einreichung neuer Dokumente\nHessen Amtsgericht Frankfurt am Main HRB 95297\nKarben Energie GmbH – Karben",
      "type": "Einreichung neuer Dokumente",
      "state": "Hessen",
      "amtsgericht": "Amtsgericht Frankfurt am Main",
      "registernummer": "HRB 95297",
      "registerart": "HRB",
      "company_name": "Karben Energie GmbH",
      "company_seat": "Karben",
      "details": "03.03.2025 (Bekanntmachungsdatum)\n\nHessen Amtsgericht Frankfurt am Main HRB 95297\nEinreichung neuer Dokumente 03.03.2025 (Eintragungsdatum)\n\nKarben Energie GmbH\nGesellschaft mit beschränkter Haftung\nKarben\n\nDurch eine Änderung in den Personen der Aufsichtsratsmitglieder ist eine Liste der Mitglieder des Aufsichtsrates zum Handelsregister eingereicht worden."
    },
    {
      "date": "2025-03-03",
      "id": "102749",
      "original_text": "Registerbekanntmachung nach dem Umwandlungsgesetz\nHessen Amtsgericht Frankfurt am Main HRB 135466\nKSL Joining Technology GmbH – Frankfurt am Main",
      "type": "Registerbekanntmachung nach dem Umwandlungsgesetz",
      "state": "Hessen",
      "amtsgericht": "Amtsgericht Frankfurt am Main",
      "registernummer": "HRB 135466",
      "registerart": "HRB",
      "company_name": "KSL Joining Technology GmbH",
      "company_seat": "Frankfurt am Main",
      "details": "03.03.2025 (Bekanntmachungsdatum)\n\nHessen Amtsgericht Frankfurt am Main HRB 135466\nRegisterbekanntmachung nach dem Umwandlungsgesetz 03.03.2025 (Eintragungsdatum)\n\nKSL Joining Technology GmbH\nGesellschaft mit beschränkter Haftung\nFrankfurt am Main\n\nDen Gläubigern der an der Abspaltung beteiligten Rechtsträger ist, wenn sie binnen sechs Monaten nach dem Tag, an dem die Eintragung der Abspaltung in das Register des Sitzes derjenigen Rechtsträger deren Gläubiger sie sind, nach §§ 125, 19 Absatz 3 UmwG bekannt gemacht worden ist, ihren Anspruch nach Grund und Höhe schriftlich anmelden, Sicherheit zu leisten, soweit sie nicht Befriedigung verlangen können. Dieses Recht steht den Gläubigern jedoch nur zu, wenn sie glaubhaft machen, dass durch die Abspaltung die Erfüllung ihrer Forderung gefährdet wird."
    },
    {
      "date": "2025-03-03",
      "id": "102750",
      "original_text": "Löschungsankündigung\nHessen Amtsgericht Darmstadt HRB 92197\nSIGNUM-PiB Aktiengesellschaft, Projektmanagement im Bauwesen – Zwingenberg",
      "type": "Löschungsankündigung",
      "state": "Hessen",
      "amtsgericht": "Amtsgericht Darmstadt",
      "registernummer": "HRB 92197",
      "registerart": "HRB",
      "company_name": "SIGNUM-PiB Aktiengesellschaft, Projektmanagement im Bauwesen",
      "company_seat": "Zwingenberg",
      "details": "03.03.2025 (Bekanntmachungsdatum)\n\nHessen Amtsgericht Darmstadt HRB 92197\nLöschungsankündigung\n\nSIGNUM-PiB Aktiengesellschaft, Projektmanagement im Bauwesen\nAktiengesellschaft\nZwingenberg\n\nDas Registergericht beabsichtigt die im Handelsregister eingetragene Gesellschaft von Amts wegen nach § 394 FamFG zu löschen. Die Frist zur Erhebung eines Widerspruchs gegen die beabsichtigte Löschung wird auf 3 Monate festgesetzt."
    },
    {
      "date": "2025-03-03",
      "id": "102751",
      "original_text": "Löschungsankündigung\nHessen Amtsgericht Darmstadt HRB 54572\nCIR Relations GmbH – Büttelborn",
      "type": "Löschungsankündigung",
      "state": "Hessen",
      "amtsgericht": "Amtsgericht Darmstadt",
      "registernummer": "HRB 54572",
      "registerart": "HRB",
      "company_name": "CIR Relations GmbH",
      "company_seat": "Büttelborn",
      "details": "03.03.2025 (Bekanntmachungsdatum)\n\nHessen Amtsgericht Darmstadt HRB 54572\nLöschungsankündigung\n\nCIR Relations GmbH\nGesellschaft mit beschränkter Haftung\nBüttelborn\n\nDas Registergericht beabsichtigt die im Handelsregister eingetragene Gesellschaft von Amts wegen nach § 394 FamFG zu löschen. Die Frist zur Erhebung eines Widerspruchs gegen die beabsichtigte Löschung wird auf 3 Monate festgesetzt."
    },
    {
      "date": "2025-03-03",
      "id": "102752",
      "original_text": "Löschungsankündigung\nHessen Amtsgericht Frankfurt am Main HRB 117918\nKraft Sicherheit & Service Dienstleistungen GmbH – Sulzbach (Taunus)",
      "type": "Löschungsankündigung",
      "state": "Hessen",
      "amtsgericht": "Amtsgericht Frankfurt am Main",
      "registernummer": "HRB 117918",
      "registerart": "HRB",
      "company_name": "Kraft Sicherheit & Service Dienstleistungen GmbH",
      "company_seat": "Sulzbach (Taunus)",
      "details": "03.03.2025 (Bekanntmachungsdatum)\n\nHessen Amtsgericht Frankfurt am Main HRB 117918\nLöschungsankündigung 03.03.2025 (Eintragungsdatum)\n\nKraft Sicherheit & Service Dienstleistungen GmbH\nGesellschaft mit beschränkter Haftung\nSulzbach (Taunus)\n\nDas Registergericht beabsichtigt die im Handelsregister eingetragene Gesellschaft von Amts wegen nach § 394 FamFG zu löschen. Die Frist zur Erhebung eines Widerspruchs gegen die beabsichtigte Löschung wird auf 3 Monate festgesetzt."
    },
    {
      "date": "2025-03-03",
      "id": "102753",
      "original_text": "Löschungsankündigung\nHessen Amtsgericht Frankfurt am Main HRB 119042\nFBH Frankfurt GmbH – Frankfurt am Main",
      "type": "Löschungsankündigung",
      "state": "Hessen",
      "amtsgericht": "Amtsgericht Frankfurt am Main",
      "registernummer": "HRB 119042",
      "registerart": "HRB",
      "company_name": "FBH Frankfurt GmbH",
      "company_seat": "Frankfurt am Main",
      "details": "03.03.2025 (Bekanntmachungsdatum)\n\nHessen Amtsgericht Frankfurt am Main HRB 119042\nLöschungsankündigung\n\nFBH Frankfurt GmbH\nGesellschaft mit beschränkter Haftung\nFrankfurt am Main\n\nDas Registergericht beabsichtigt die im Handelsregister eingetragene Gesellschaft von Amts wegen nach § 394 FamFG zu löschen. Die Frist zur Erhebung eines Widerspruchs gegen die beabsichtigte Löschung wird auf 1 Monat festgesetzt."
    },
    {
      "date": "2025-03-03",
      "id": "102754",
      "original_text": "Löschungsankündigung\nHessen Amtsgericht Frankfurt am Main HRB 115498\nFabutec - Frankfurter Abwasser und Umwelttechnik GmbH – Frankfurt am Main",
      "type": "Löschungsankündigung",
      "state": "Hessen",
      "amtsgericht": "Amtsgericht Frankfurt am Main",
      "registernummer": "HRB 115498",
      "registerart": "HRB",
      "company_name": "Fabutec - Frankfurter Abwasser und Umwelttechnik GmbH",
      "company_seat": "Frankfurt am Main",
      "details": "03.03.2025 (Bekanntmachungsdatum)\n\nHessen Amtsgericht Frankfurt am Main HRB 115498\nLöschungsankündigung\n\nFabutec - Frankfurter Abwasser und Umwelttechnik GmbH\nGesellschaft mit beschränkter Haftung\nFrankfurt am Main\n\nDas Registergericht beabsichtigt die im Handelsregister eingetragene Gesellschaft von Amts wegen nach § 394 FamFG zu löschen. Die Frist zur Erhebung eines Widerspruchs gegen die beabsichtigte Löschung wird auf 1 Monat festgesetzt."
    },
    {
      "date": "2025-03-03",
      "id": "102755",
      "original_text": "Einreichung neuer Dokumente\nHessen Amtsgericht Hanau HRB 6147\nThermo Electron LED GmbH – Langenselbold",
      "type": "Einreichung neuer Dokumente",
      "state": "Hessen",
      "amtsgericht": "Amtsgericht Hanau",
      "registernummer": "HRB 6147",
      "registerart": "HRB",
      "company_name": "Thermo Electron LED GmbH",
      "company_seat": "Langenselbold",
      "details": "03.03.2025 (Bekanntmachungsdatum)\n\nHessen Amtsgericht Hanau HRB 6147\nEinreichung neuer Dokumente\n\nThermo Electron LED GmbH\nGesellschaft mit beschränkter Haftung\nLangenselbold\n\nDurch eine Änderung in den Personen der Aufsichtsratsmitglieder ist eine Liste der Mitglieder des Aufsichtsrates zum Handelsregister eingereicht worden."
    },
    {
      "date": "2025-03-03",
      "id": "102756",
      "original_text": "Löschungsankündigung\nHessen Amtsgericht Hanau HRB 96471\nAnton Dienstleistung Bau GmbH – Hasselroth",
      "type": "Löschungsankündigung",
      "state": "Hessen",
      "amtsgericht": "Amtsgericht Hanau",
      "registernummer": "HRB 96471",
      "registerart": "HRB",
      "company_name": "Anton Dienstleistung Bau GmbH",
      "company_seat": "Hasselroth",
      "details": "03.03.2025 (Bekanntmachungsdatum)\n\nHessen Amtsgericht Hanau HRB 96471\nLöschungsankündigung\n\nAnton Dienstleistung Bau GmbH\nGesellschaft mit beschränkter Haftung\nHasselroth\n\nDas Registergericht beabsichtigt die im Handelsregister eingetragene Gesellschaft von Amts wegen nach § 394 FamFG zu löschen. Die Frist zur Erhebung eines Widerspruchs gegen die beabsichtigte Löschung wird auf 3 Monate festgesetzt."
    },
    {
      "date": "2025-03-03",
      "id": "102757",
      "original_text": "Registerbekanntmachung nach dem Umwandlungsgesetz\nHessen Amtsgericht Frankfurt am Main HRB 137582\nTCS&S GmbH – Frankfurt am Main",
      "type": "Registerbekanntmachung nach dem Umwandlungsgesetz",
      "state": "Hessen",
      "amtsgericht": "Amtsgericht Frankfurt am Main",
      "registernummer": "HRB 137582",
      "registerart": "HRB",
      "company_name": "TCS&S GmbH",
      "company_seat": "Frankfurt am Main",
      "details": "03.03.2025 (Bekanntmachungsdatum)\n\nHessen Amtsgericht Frankfurt am Main HRB 137582\nRegisterbekanntmachung nach dem Umwandlungsgesetz 07.02.2025 (Eintragungsdatum)\n\nTCS&S GmbH\nGesellschaft mit beschränkter Haftung\nFrankfurt am Main\n\nDen Gläubigern der an der formwechselnden Umwandlung beteiligten Rechtsträger ist, wenn sie binnen sechs Monaten nach dem Tag, an dem die Eintragung der formwechselnden Umwandlung in das Register des Sitzes desjenigen Rechtsträgers, dessen Gläubiger sie sind, nach § 201 UmwG bekannt gemacht worden ist, ihren Anspruch nach Grund und Höhe schriftlich anmelden, Sicherheit zu leisten, soweit sie nicht Befriedigung verlangen können. Dieses Recht steht den Gläubigern jedoch nur zu, wenn sie glaubhaft machen, dass durch die formwechselnden Umwandlung die Erfüllung ihrer Forderung gefährdet wird."
    },
    {
      "date": "2025-03-03",
      "id": "102758",
      "original_text": "Registerbekanntmachung nach dem Umwandlungsgesetz\nHessen Amtsgericht Frankfurt am Main HRB 88369\nYASKAWA Europe GmbH – Hattersheim am Main",
      "type": "Registerbekanntmachung nach dem Umwandlungsgesetz",
      "state": "Hessen",
      "amtsgericht": "Amtsgericht Frankfurt am Main",
      "registernummer": "HRB 88369",
      "registerart": "HRB",
      "company_name": "YASKAWA Europe GmbH",
      "company_seat": "Hattersheim am Main",
      "details": "03.03.2025 (Bekanntmachungsdatum)\n\nHessen Amtsgericht Frankfurt am Main HRB 88369\nRegisterbekanntmachung nach dem Umwandlungsgesetz 01.03.2025 (Eintragungsdatum)\n\nYASKAWA Europe GmbH\nGesellschaft mit beschränkter Haftung\nHattersheim am Main\n\nDen Gläubigern der an der Verschmelzung beteiligten Rechtsträger ist, wenn sie binnen sechs Monaten nach dem Tag, an dem die Eintragung der Verschmelzung in das Register des Sitzes desjenigen Rechtsträgers, dessen Gläubiger sie sind, nach §§ 122a Absatz 2, 19 Absatz 3 UmwG bekannt gemacht worden ist, ihren Anspruch nach Grund und Höhe schriftlich anmelden, Sicherheit zu leisten, soweit sie nicht Befriedigung verlangen können. Dieses Recht steht den Gläubigern jedoch nur zu, wenn sie glaubhaft machen, dass durch die Verschmelzung die Erfüllung ihrer Forderung gefährdet wird."
    }
  ]
}