{
  "date": "2025-03-12",
  "date_of_scrape": "2025-03-13T04:08:10.373Z",
  "tool_version": "0.2.0",
  "number_of_announcements": 130,
  "announcements": [
    {
      "date": "2025-03-12",
      "id": "103495",
      "original_text": "Registerbekanntmachung nach dem Umwandlungsgesetz\nBayern Amtsgericht München HRB 181797\nUniscon universal identity control GmbH – München",
      "type": "Registerbekanntmachung nach dem Umwandlungsgesetz",
      "state": "Bayern",
      "amtsgericht": "Amtsgericht München",
      "registernummer": "HRB 181797",
      "registerart": "HRB",
      "company_name": "Uniscon universal identity control GmbH",
      "company_seat": "München",
      "details": "12.03.2025 (Bekanntmachungsdatum)\n\nBayern Amtsgericht München HRB 181797\nRegisterbekanntmachung nach dem Umwandlungsgesetz 11.03.2025 (Eintragungsdatum)\n\nUniscon universal identity control GmbH\nGesellschaft mit beschränkter Haftung\nMünchen\n\nDen Gläubigern der an der Ausgliederung beteiligten Rechtsträger ist, wenn sie binnen sechs Monaten nach dem Tag, an dem die Eintragung der Ausgliederung in das Register des Sitzes desjenigen Rechtsträgers, dessen Gläubiger sie sind, nach §§ 125, 19 Abs. 3 UmwG als bekannt gemacht gilt, ihren Anspruch nach Grund und Höhe in Textform anmelden, Sicherheit zu leisten, soweit sie nicht Befriedigung verlangen können. Dieses Recht steht den Gläubigern jedoch nur zu, wenn sie glaubhaft machen, dass durch die Ausgliederung die Erfüllung ihrer Forderung gefährdet wird."
    },
    {
      "date": "2025-03-12",
      "id": "103496",
      "original_text": "Löschungsankündigung\nBayern Amtsgericht München HRB 215686\nGUF Bau GmbH – Zorneding",
      "type": "Löschungsankündigung",
      "state": "Bayern",
      "amtsgericht": "Amtsgericht München",
      "registernummer": "HRB 215686",
      "registerart": "HRB",
      "company_name": "GUF Bau GmbH",
      "company_seat": "Zorneding",
      "details": "12.03.2025 (Bekanntmachungsdatum)\n\nBayern Amtsgericht München HRB 215686\nLöschungsankündigung\n\nGUF Bau GmbH\nGesellschaft mit beschränkter Haftung\nZorneding\n\nDas Registergericht beabsichtigt, die im Handelsregister eingetragene Gesellschaft wegen Vermögenslosigkeit von Amts wegen nach § 394 FamFG zu löschen. Die Frist zur Erhebung eines Widerspruchs ist auf drei Monate festgesetzt."
    },
    {
      "date": "2025-03-12",
      "id": "103497",
      "original_text": "Registerbekanntmachung nach dem Umwandlungsgesetz\nBayern Amtsgericht Landshut HRA 2049\nMichael Moser e.K. – Massing",
      "type": "Registerbekanntmachung nach dem Umwandlungsgesetz",
      "state": "Bayern",
      "amtsgericht": "Amtsgericht Landshut",
      "registernummer": "HRA 2049",
      "registerart": "HRA",
      "company_name": "Michael Moser e.K.",
      "company_seat": "Massing",
      "details": "12.03.2025 (Bekanntmachungsdatum)\n\nBayern Amtsgericht Landshut HRA 2049\nRegisterbekanntmachung nach dem Umwandlungsgesetz 10.03.2025 (Eintragungsdatum)\n\nMichael Moser e.K.\nEinzelkaufmann / Einzelkauffrau\nMassing\n\nDen Gläubigern der an der Ausgliederung beteiligten Rechtsträger ist, wenn sie binnen sechs Monaten nach dem Tag, an dem die Eintragung der Ausgliederung in das Register des Sitzes desjenigen Rechtsträgers, dessen Gläubiger sie sind, nach §§ 125, 19 Abs. 3 UmwG als bekannt gemacht gilt, ihren Anspruch nach Grund und Höhe in Textform anmelden, Sicherheit zu leisten, soweit sie nicht Befriedigung verlangen können. Dieses Recht steht den Gläubigern jedoch nur zu, wenn sie glaubhaft machen, dass durch die Ausgliederung die Erfüllung ihrer Forderung gefährdet wird."
    },
    {
      "date": "2025-03-12",
      "id": "103498",
      "original_text": "Löschungsankündigung\nBayern Amtsgericht München HRB 80098\nFranz Springinsfeld Vertrieb und Reparaturen von Parksystemen GmbH – Unterhaching",
      "type": "Löschungsankündigung",
      "state": "Bayern",
      "amtsgericht": "Amtsgericht München",
      "registernummer": "HRB 80098",
      "registerart": "HRB",
      "company_name": "Franz Springinsfeld Vertrieb und Reparaturen von Parksystemen GmbH",
      "company_seat": "Unterhaching",
      "details": "12.03.2025 (Bekanntmachungsdatum)\n\nBayern Amtsgericht München HRB 80098\nLöschungsankündigung\n\nFranz Springinsfeld Vertrieb und Reparaturen von Parksystemen GmbH\nGesellschaft mit beschränkter Haftung\nUnterhaching\n\nDas Registergericht beabsichtigt, die im Handelsregister eingetragene Gesellschaft wegen Vermögenslosigkeit von Amts wegen nach § 394 FamFG zu löschen. Die Frist zur Erhebung eines Widerspruchs ist auf drei Monate festgesetzt."
    },
    {
      "date": "2025-03-12",
      "id": "103499",
      "original_text": "Registerbekanntmachung nach dem Umwandlungsgesetz\nBayern Amtsgericht Memmingen HRB 11493\nBIOMIN Pharma GmbH – Kirchheim/Schwaben",
      "type": "Registerbekanntmachung nach dem Umwandlungsgesetz",
      "state": "Bayern",
      "amtsgericht": "Amtsgericht Memmingen",
      "registernummer": "HRB 11493",
      "registerart": "HRB",
      "company_name": "BIOMIN Pharma GmbH",
      "company_seat": "Kirchheim/Schwaben",
      "details": "12.03.2025 (Bekanntmachungsdatum)\n\nBayern Amtsgericht Memmingen HRB 11493\nRegisterbekanntmachung nach dem Umwandlungsgesetz 11.03.2025 (Eintragungsdatum)\n\nBIOMIN Pharma GmbH\nGesellschaft mit beschränkter Haftung\nKirchheim/Schwaben\n\nDen Gläubigern der an der Verschmelzung beteiligten Rechtsträger ist, wenn sie binnen sechs Monaten nach dem Tag, an dem die Eintragung der Verschmelzung in das Register des Sitzes desjenigen Rechtsträgers, dessen Gläubiger sie sind, nach § 19 Abs. 3 UmwG als bekannt gemacht gilt, ihren Anspruch nach Grund und Höhe in Textform anmelden, Sicherheit zu leisten, soweit sie nicht Befriedigung verlangen können. Dieses Recht steht den Gläubigern jedoch nur zu, wenn sie glaubhaft machen, dass durch die Verschmelzung die Erfüllung ihrer Forderung gefährdet wird."
    },
    {
      "date": "2025-03-12",
      "id": "103500",
      "original_text": "Registerbekanntmachung nach dem Umwandlungsgesetz\nBayern Amtsgericht Coburg HRA 1916\nFred Walther Metallwaren e.K. – Lichtenfels",
      "type": "Registerbekanntmachung nach dem Umwandlungsgesetz",
      "state": "Bayern",
      "amtsgericht": "Amtsgericht Coburg",
      "registernummer": "HRA 1916",
      "registerart": "HRA",
      "company_name": "Fred Walther Metallwaren e.K.",
      "company_seat": "Lichtenfels",
      "details": "12.03.2025 (Bekanntmachungsdatum)\n\nBayern Amtsgericht Coburg HRA 1916\nRegisterbekanntmachung nach dem Umwandlungsgesetz 11.03.2025 (Eintragungsdatum)\n\nFred Walther Metallwaren e.K.\nEinzelkaufmann / Einzelkauffrau\nLichtenfels\n\nDen Gläubigern der an der Ausgliederung beteiligten Rechtsträger ist, wenn sie binnen sechs Monaten nach dem Tag, an dem die Eintragung der Ausgliederung in das Register des Sitzes desjenigen Rechtsträgers, dessen Gläubiger sie sind, nach §§ 125, 19 Abs. 3 UmwG als bekannt gemacht gilt, ihren Anspruch nach Grund und Höhe in Textform anmelden, Sicherheit zu leisten, soweit sie nicht Befriedigung verlangen können. Dieses Recht steht den Gläubigern jedoch nur zu, wenn sie glaubhaft machen, dass durch die Ausgliederung die Erfüllung ihrer Forderung gefährdet wird."
    },
    {
      "date": "2025-03-12",
      "id": "103501",
      "original_text": "Registerbekanntmachung nach dem Umwandlungsgesetz\nBayern Amtsgericht Regensburg HRA 11085\nWeiß GmbH & Co. KG – Furth im Wald",
      "type": "Registerbekanntmachung nach dem Umwandlungsgesetz",
      "state": "Bayern",
      "amtsgericht": "Amtsgericht Regensburg",
      "registernummer": "HRA 11085",
      "registerart": "HRA",
      "company_name": "Weiß GmbH & Co. KG",
      "company_seat": "Furth im Wald",
      "details": "12.03.2025 (Bekanntmachungsdatum)\n\nBayern Amtsgericht Regensburg HRA 11085\nRegisterbekanntmachung nach dem Umwandlungsgesetz 11.03.2025 (Eintragungsdatum)\n\nWeiß GmbH & Co. KG\nKommanditgesellschaft\nFurth im Wald\n\nDen Gläubigern der an der Ausgliederung beteiligten Rechtsträger ist, wenn sie binnen sechs Monaten nach dem Tag, an dem die Eintragung der Ausgliederung in das Register des Sitzes desjenigen Rechtsträgers, dessen Gläubiger sie sind, nach §§ 125, 19 Abs. 3 UmwG als bekannt gemacht gilt, ihren Anspruch nach Grund und Höhe in Textform anmelden, Sicherheit zu leisten, soweit sie nicht Befriedigung verlangen können. Dieses Recht steht den Gläubigern jedoch nur zu, wenn sie glaubhaft machen, dass durch die Ausgliederung die Erfüllung ihrer Forderung gefährdet wird."
    },
    {
      "date": "2025-03-12",
      "id": "103502",
      "original_text": "Registerbekanntmachung nach dem Umwandlungsgesetz\nBayern Amtsgericht Augsburg HRA 21742\nIngenieurbüro Melanie Mayr e.K. – Egling a.d. Paar",
      "type": "Registerbekanntmachung nach dem Umwandlungsgesetz",
      "state": "Bayern",
      "amtsgericht": "Amtsgericht Augsburg",
      "registernummer": "HRA 21742",
      "registerart": "HRA",
      "company_name": "Ingenieurbüro Melanie Mayr e.K.",
      "company_seat": "Egling a.d. Paar",
      "details": "12.03.2025 (Bekanntmachungsdatum)\n\nBayern Amtsgericht Augsburg HRA 21742\nRegisterbekanntmachung nach dem Umwandlungsgesetz 11.03.2025 (Eintragungsdatum)\n\nIngenieurbüro Melanie Mayr e.K.\nEinzelkaufmann / Einzelkauffrau\nEgling a.d. Paar\n\nDen Gläubigern der an der Ausgliederung beteiligten Rechtsträger ist, wenn sie binnen sechs Monaten nach dem Tag, an dem die Eintragung der Ausgliederung in das Register des Sitzes desjenigen Rechtsträgers, dessen Gläubiger sie sind, nach §§ 125, 19 Abs. 3 UmwG als bekannt gemacht gilt, ihren Anspruch nach Grund und Höhe in Textform anmelden, Sicherheit zu leisten, soweit sie nicht Befriedigung verlangen können. Dieses Recht steht den Gläubigern jedoch nur zu, wenn sie glaubhaft machen, dass durch die Ausgliederung die Erfüllung ihrer Forderung gefährdet wird."
    },
    {
      "date": "2025-03-12",
      "id": "103503",
      "original_text": "Sonstige Registerbekanntmachung\nBayern Amtsgericht München HRB 241947\nmsg nexinsure AG – Ismaning",
      "type": "Sonstige Registerbekanntmachung",
      "state": "Bayern",
      "amtsgericht": "Amtsgericht München",
      "registernummer": "HRB 241947",
      "registerart": "HRB",
      "company_name": "msg nexinsure AG",
      "company_seat": "Ismaning",
      "details": "12.03.2025 (Bekanntmachungsdatum)\n\nBayern Amtsgericht München HRB 241947\nSonstige Registerbekanntmachung 11.03.2025 (Eintragungsdatum)\n\nmsg nexinsure AG\nAktiengesellschaft\nIsmaning\n\nDem Amtsgericht München -Registergericht- ist eine Liste der Mitglieder des Aufsichtsrats eingereicht worden, § 106 AktG."
    },
    {
      "date": "2025-03-12",
      "id": "103504",
      "original_text": "Registerbekanntmachung nach dem Umwandlungsgesetz\nBayern Amtsgericht Landshut HRA 12841\nM. Moser GmbH & Co. KG – Massing",
      "type": "Registerbekanntmachung nach dem Umwandlungsgesetz",
      "state": "Bayern",
      "amtsgericht": "Amtsgericht Landshut",
      "registernummer": "HRA 12841",
      "registerart": "HRA",
      "company_name": "M. Moser GmbH & Co. KG",
      "company_seat": "Massing",
      "details": "12.03.2025 (Bekanntmachungsdatum)\n\nBayern Amtsgericht Landshut HRA 12841\nRegisterbekanntmachung nach dem Umwandlungsgesetz 10.03.2025 (Eintragungsdatum)\n\nM. Moser GmbH & Co. KG\nKommanditgesellschaft\nMassing\n\nDen Gläubigern der an der Ausgliederung beteiligten Rechtsträger ist, wenn sie binnen sechs Monaten nach dem Tag, an dem die Eintragung der Ausgliederung in das Register des Sitzes desjenigen Rechtsträgers, dessen Gläubiger sie sind, nach §§ 125, 19 Abs. 3 UmwG als bekannt gemacht gilt, ihren Anspruch nach Grund und Höhe in Textform anmelden, Sicherheit zu leisten, soweit sie nicht Befriedigung verlangen können. Dieses Recht steht den Gläubigern jedoch nur zu, wenn sie glaubhaft machen, dass durch die Ausgliederung die Erfüllung ihrer Forderung gefährdet wird."
    },
    {
      "date": "2025-03-12",
      "id": "103505",
      "original_text": "Registerbekanntmachung nach dem Umwandlungsgesetz\nBayern Amtsgericht Augsburg HRA 21797\nIngenieurbüro Mayr GmbH & Co. KG – Egling a.d.Paar",
      "type": "Registerbekanntmachung nach dem Umwandlungsgesetz",
      "state": "Bayern",
      "amtsgericht": "Amtsgericht Augsburg",
      "registernummer": "HRA 21797",
      "registerart": "HRA",
      "company_name": "Ingenieurbüro Mayr GmbH & Co. KG",
      "company_seat": "Egling a.d.Paar",
      "details": "12.03.2025 (Bekanntmachungsdatum)\n\nBayern Amtsgericht Augsburg HRA 21797\nRegisterbekanntmachung nach dem Umwandlungsgesetz 11.03.2025 (Eintragungsdatum)\n\nIngenieurbüro Mayr GmbH & Co. KG\nKommanditgesellschaft\nEgling a.d.Paar\n\nDen Gläubigern der an der Ausgliederung beteiligten Rechtsträger ist, wenn sie binnen sechs Monaten nach dem Tag, an dem die Eintragung der Ausgliederung in das Register des Sitzes desjenigen Rechtsträgers, dessen Gläubiger sie sind, nach §§ 125, 19 Abs. 3 UmwG als bekannt gemacht gilt, ihren Anspruch nach Grund und Höhe in Textform anmelden, Sicherheit zu leisten, soweit sie nicht Befriedigung verlangen können. Dieses Recht steht den Gläubigern jedoch nur zu, wenn sie glaubhaft machen, dass durch die Ausgliederung die Erfüllung ihrer Forderung gefährdet wird."
    },
    {
      "date": "2025-03-12",
      "id": "103506",
      "original_text": "Löschungsankündigung\nBayern Amtsgericht Nürnberg HRB 25668\nBierschneider Bauunternehmen GmbH – Berching",
      "type": "Löschungsankündigung",
      "state": "Bayern",
      "amtsgericht": "Amtsgericht Nürnberg",
      "registernummer": "HRB 25668",
      "registerart": "HRB",
      "company_name": "Bierschneider Bauunternehmen GmbH",
      "company_seat": "Berching",
      "details": "12.03.2025 (Bekanntmachungsdatum)\n\nBayern Amtsgericht Nürnberg HRB 25668\nLöschungsankündigung\n\nBierschneider Bauunternehmen GmbH\nGesellschaft mit beschränkter Haftung\nBerching\n\nDas Registergericht beabsichtigt, die im Handelsregister eingetragene Gesellschaft wegen Vermögenslosigkeit von Amts wegen nach § 394 FamFG zu löschen. Die Frist zur Erhebung eines Widerspruchs ist auf einen Monat festgesetzt."
    },
    {
      "date": "2025-03-12",
      "id": "103507",
      "original_text": "Registerbekanntmachung nach dem Umwandlungsgesetz\nBayern Amtsgericht München HRB 149656\nFIDOR Bank AG – München",
      "type": "Registerbekanntmachung nach dem Umwandlungsgesetz",
      "state": "Bayern",
      "amtsgericht": "Amtsgericht München",
      "registernummer": "HRB 149656",
      "registerart": "HRB",
      "company_name": "FIDOR Bank AG",
      "company_seat": "München",
      "details": "12.03.2025 (Bekanntmachungsdatum)\n\nBayern Amtsgericht München HRB 149656\nRegisterbekanntmachung nach dem Umwandlungsgesetz 11.03.2025 (Eintragungsdatum)\n\nFIDOR Bank AG\nAktiengesellschaft\nMünchen\n\nDen Gläubigern des formwechselnden Rechtsträgers ist, wenn sie binnen sechs Monaten nach dem Tag, an dem die Eintragung des Formwechsels nach § 201 UmwG als bekannt gemacht gilt, ihren Anspruch nach Grund und Höhe in Textform anmelden, Sicherheit zu leisten, soweit sie nicht Befriedigung verlangen können. Dieses Recht steht den Gläubigern jedoch nur zu, wenn sie glaubhaft machen, dass durch den Formwechsel die Erfüllung ihrer Forderung gefährdet wird."
    },
    {
      "date": "2025-03-12",
      "id": "103508",
      "original_text": "Einreichung neuer Dokumente\nBayern Amtsgericht München HRB 215844\nAirbus Bank GmbH – München",
      "type": "Einreichung neuer Dokumente",
      "state": "Bayern",
      "amtsgericht": "Amtsgericht München",
      "registernummer": "HRB 215844",
      "registerart": "HRB",
      "company_name": "Airbus Bank GmbH",
      "company_seat": "München",
      "details": "12.03.2025 (Bekanntmachungsdatum)\n\nBayern Amtsgericht München HRB 215844\nEinreichung neuer Dokumente\n\nAirbus Bank GmbH\nGesellschaft mit beschränkter Haftung\nMünchen\n\nDem Amtsgericht München -Registergericht- ist eine Liste der Mitglieder des Aufsichtsrats eingereicht worden, § 52 Abs. 3 S. 2 GmbHG."
    },
    {
      "date": "2025-03-12",
      "id": "103509",
      "original_text": "Registerbekanntmachung nach dem Umwandlungsgesetz\nBayern Amtsgericht München HRB 200511\nTheo Grundstücksverwaltungsgesellschaft mbH – Pullach i. Isartal",
      "type": "Registerbekanntmachung nach dem Umwandlungsgesetz",
      "state": "Bayern",
      "amtsgericht": "Amtsgericht München",
      "registernummer": "HRB 200511",
      "registerart": "HRB",
      "company_name": "Theo Grundstücksverwaltungsgesellschaft mbH",
      "company_seat": "Pullach i. Isartal",
      "details": "12.03.2025 (Bekanntmachungsdatum)\n\nBayern Amtsgericht München HRB 200511\nRegisterbekanntmachung nach dem Umwandlungsgesetz 11.03.2025 (Eintragungsdatum)\n\nTheo Grundstücksverwaltungsgesellschaft mbH\nGesellschaft mit beschränkter Haftung\nPullach i. Isartal\n\nDen Gläubigern der an der Verschmelzung beteiligten Rechtsträger ist, wenn sie binnen sechs Monaten nach dem Tag, an dem die Eintragung der Verschmelzung in das Register des Sitzes desjenigen Rechtsträgers, dessen Gläubiger sie sind, nach § 19 Abs. 3 UmwG als bekannt gemacht gilt, ihren Anspruch nach Grund und Höhe in Textform anmelden, Sicherheit zu leisten, soweit sie nicht Befriedigung verlangen können. Dieses Recht steht den Gläubigern jedoch nur zu, wenn sie glaubhaft machen, dass durch die Verschmelzung die Erfüllung ihrer Forderung gefährdet wird."
    },
    {
      "date": "2025-03-12",
      "id": "103510",
      "original_text": "Registerbekanntmachung nach dem Umwandlungsgesetz\nBayern Amtsgericht Coburg HRA 5599\nFred Walther GmbH & Co. KG – Lichtenfels",
      "type": "Registerbekanntmachung nach dem Umwandlungsgesetz",
      "state": "Bayern",
      "amtsgericht": "Amtsgericht Coburg",
      "registernummer": "HRA 5599",
      "registerart": "HRA",
      "company_name": "Fred Walther GmbH & Co. KG",
      "company_seat": "Lichtenfels",
      "details": "12.03.2025 (Bekanntmachungsdatum)\n\nBayern Amtsgericht Coburg HRA 5599\nRegisterbekanntmachung nach dem Umwandlungsgesetz 11.03.2025 (Eintragungsdatum)\n\nFred Walther GmbH & Co. KG\nKommanditgesellschaft\nLichtenfels\n\nDen Gläubigern der an der Ausgliederung beteiligten Rechtsträger ist, wenn sie binnen sechs Monaten nach dem Tag, an dem die Eintragung der Ausgliederung in das Register des Sitzes desjenigen Rechtsträgers, dessen Gläubiger sie sind, nach §§ 125, 19 Abs. 3 UmwG als bekannt gemacht gilt, ihren Anspruch nach Grund und Höhe in Textform anmelden, Sicherheit zu leisten, soweit sie nicht Befriedigung verlangen können. Dieses Recht steht den Gläubigern jedoch nur zu, wenn sie glaubhaft machen, dass durch die Ausgliederung die Erfüllung ihrer Forderung gefährdet wird."
    },
    {
      "date": "2025-03-12",
      "id": "103511",
      "original_text": "Registerbekanntmachung nach dem Umwandlungsgesetz\nBayern Amtsgericht Memmingen HRB 5147\nXaver Scheule GmbH – Kirchheim/Schwaben",
      "type": "Registerbekanntmachung nach dem Umwandlungsgesetz",
      "state": "Bayern",
      "amtsgericht": "Amtsgericht Memmingen",
      "registernummer": "HRB 5147",
      "registerart": "HRB",
      "company_name": "Xaver Scheule GmbH",
      "company_seat": "Kirchheim/Schwaben",
      "details": "12.03.2025 (Bekanntmachungsdatum)\n\nBayern Amtsgericht Memmingen HRB 5147\nRegisterbekanntmachung nach dem Umwandlungsgesetz 11.03.2025 (Eintragungsdatum)\n\nXaver Scheule GmbH\nGesellschaft mit beschränkter Haftung\nKirchheim/Schwaben\n\nDen Gläubigern der an der Verschmelzung beteiligten Rechtsträger ist, wenn sie binnen sechs Monaten nach dem Tag, an dem die Eintragung der Verschmelzung in das Register des Sitzes desjenigen Rechtsträgers, dessen Gläubiger sie sind, nach § 19 Abs. 3 UmwG als bekannt gemacht gilt, ihren Anspruch nach Grund und Höhe in Textform anmelden, Sicherheit zu leisten, soweit sie nicht Befriedigung verlangen können. Dieses Recht steht den Gläubigern jedoch nur zu, wenn sie glaubhaft machen, dass durch die Verschmelzung die Erfüllung ihrer Forderung gefährdet wird."
    },
    {
      "date": "2025-03-12",
      "id": "103512",
      "original_text": "Registerbekanntmachung nach dem Umwandlungsgesetz\nBayern Amtsgericht München HRA 120358\nRichard Madl e.K. – Inning a.Ammersee",
      "type": "Registerbekanntmachung nach dem Umwandlungsgesetz",
      "state": "Bayern",
      "amtsgericht": "Amtsgericht München",
      "registernummer": "HRA 120358",
      "registerart": "HRA",
      "company_name": "Richard Madl e.K.",
      "company_seat": "Inning a.Ammersee",
      "details": "12.03.2025 (Bekanntmachungsdatum)\n\nBayern Amtsgericht München HRA 120358\nRegisterbekanntmachung nach dem Umwandlungsgesetz 11.03.2025 (Eintragungsdatum)\n\nRichard Madl e.K.\nEinzelkaufmann / Einzelkauffrau\nInning a.Ammersee\n\nDen Gläubigern der an der Ausgliederung beteiligten Rechtsträger ist, wenn sie binnen sechs Monaten nach dem Tag, an dem die Eintragung der Ausgliederung in das Register des Sitzes desjenigen Rechtsträgers, dessen Gläubiger sie sind, nach §§ 125, 19 Abs. 3 UmwG als bekannt gemacht gilt, ihren Anspruch nach Grund und Höhe in Textform anmelden, Sicherheit zu leisten, soweit sie nicht Befriedigung verlangen können. Dieses Recht steht den Gläubigern jedoch nur zu, wenn sie glaubhaft machen, dass durch die Ausgliederung die Erfüllung ihrer Forderung gefährdet wird."
    },
    {
      "date": "2025-03-12",
      "id": "103513",
      "original_text": "Registerbekanntmachung nach dem Umwandlungsgesetz\nBayern Amtsgericht Regensburg HRA 5463\nImport - Export - Vertrieb Erwin Weiß – Furth im Wald",
      "type": "Registerbekanntmachung nach dem Umwandlungsgesetz",
      "state": "Bayern",
      "amtsgericht": "Amtsgericht Regensburg",
      "registernummer": "HRA 5463",
      "registerart": "HRA",
      "company_name": "Import - Export - Vertrieb Erwin Weiß",
      "company_seat": "Furth im Wald",
      "details": "12.03.2025 (Bekanntmachungsdatum)\n\nBayern Amtsgericht Regensburg HRA 5463\nRegisterbekanntmachung nach dem Umwandlungsgesetz 11.03.2025 (Eintragungsdatum)\n\nImport - Export - Vertrieb Erwin Weiß\nEinzelkaufmann / Einzelkauffrau\nFurth im Wald\n\nDen Gläubigern der an der Ausgliederung beteiligten Rechtsträger ist, wenn sie binnen sechs Monaten nach dem Tag, an dem die Eintragung der Ausgliederung in das Register des Sitzes desjenigen Rechtsträgers, dessen Gläubiger sie sind, nach §§ 125, 19 Abs. 3 UmwG als bekannt gemacht gilt, ihren Anspruch nach Grund und Höhe in Textform anmelden, Sicherheit zu leisten, soweit sie nicht Befriedigung verlangen können. Dieses Recht steht den Gläubigern jedoch nur zu, wenn sie glaubhaft machen, dass durch die Ausgliederung die Erfüllung ihrer Forderung gefährdet wird."
    },
    {
      "date": "2025-03-12",
      "id": "103514",
      "original_text": "Löschungsankündigung\nBaden-Württemberg Amtsgericht Mannheim HRB 737619\nAST Autohandel GmbH – Wiesloch",
      "type": "Löschungsankündigung",
      "state": "Baden-Württemberg",
      "amtsgericht": "Amtsgericht Mannheim",
      "registernummer": "HRB 737619",
      "registerart": "HRB",
      "company_name": "AST Autohandel GmbH",
      "company_seat": "Wiesloch",
      "details": "12.03.2025 (Bekanntmachungsdatum)\n\nBaden-Württemberg Amtsgericht Mannheim HRB 737619\nLöschungsankündigung\n\nAST Autohandel GmbH\nGesellschaft mit beschränkter Haftung\nWiesloch\n\nDas Gericht beabsichtigt, die Gesellschaft wegen Vermögenslosigkeit im Handelsregister von Amts wegen nach § 394 FamFG zu löschen. Die Frist zur Geltendmachung eines Widerspruchs gegen die beabsichtigte Löschung ist auf einen Monat ab Veröffentlichung bestimmt."
    },
    {
      "date": "2025-03-12",
      "id": "103515",
      "original_text": "Registerbekanntmachung nach dem Umwandlungsgesetz\nBaden-Württemberg Amtsgericht Stuttgart HRB 744909\nBäderbetriebsgesellschaft Albstadt mbH – Albstadt",
      "type": "Registerbekanntmachung nach dem Umwandlungsgesetz",
      "state": "Baden-Württemberg",
      "amtsgericht": "Amtsgericht Stuttgart",
      "registernummer": "HRB 744909",
      "registerart": "HRB",
      "company_name": "Bäderbetriebsgesellschaft Albstadt mbH",
      "company_seat": "Albstadt",
      "details": "12.03.2025 (Bekanntmachungsdatum)\n\nBaden-Württemberg Amtsgericht Stuttgart HRB 744909\nRegisterbekanntmachung nach dem Umwandlungsgesetz 12.03.2025 (Eintragungsdatum)\n\nBäderbetriebsgesellschaft Albstadt mbH\nGesellschaft mit beschränkter Haftung\nAlbstadt\n\nAls nicht eingetragen wird bekanntgemacht:\nDen Gläubigern der an der Verschmelzung beteiligten Rechtsträger ist, wenn sie binnen sechs Monaten nach dem Tag, an dem die Eintragung der Verschmelzung in das Register des Sitzes desjenigen Rechtsträgers, dessen Gläubiger sie sind, nach § 19 Abs. 3 UmwG als bekanntgemacht gilt, ihren Anspruch nach Grund und Höhe schriftlich anmelden, Sicherheit zu leisten, soweit sie nicht Befriedigung verlangen können. Dieses Recht steht den Gläubigern jedoch nur zu, wenn sie glaubhaft machen, dass durch die Verschmelzung die Erfüllung ihrer Forderung gefährdet wird."
    },
    {
      "date": "2025-03-12",
      "id": "103516",
      "original_text": "Registerbekanntmachung nach dem Umwandlungsgesetz\nBrandenburg Amtsgericht Cottbus HRB 9307\nAdams Industriemontagengesellschaft mbH – Cottbus",
      "type": "Registerbekanntmachung nach dem Umwandlungsgesetz",
      "state": "Brandenburg",
      "amtsgericht": "Amtsgericht Cottbus",
      "registernummer": "HRB 9307",
      "registerart": "HRB",
      "company_name": "Adams Industriemontagengesellschaft mbH",
      "company_seat": "Cottbus",
      "details": "12.03.2025 (Bekanntmachungsdatum)\n\nBrandenburg Amtsgericht Cottbus HRB 9307\nRegisterbekanntmachung nach dem Umwandlungsgesetz 11.03.2025 (Eintragungsdatum)\n\nAdams Industriemontagengesellschaft mbH\nGesellschaft mit beschränkter Haftung\nCottbus\n\nDen Gläubigern der an der Verschmelzung beteiligten Rechtsträger ist, wenn sie binnen sechs Monaten nach dem Tag, an dem die Eintragung der Verschmelzung in das Register des Sitzes desjenigen Rechtsträgers, dessen Gläubiger sie sind, als bekannt gemacht gilt, ihren Anspruch nach Grund und Höhe schriftlich anmelden, Sicherheit zu leisten, soweit sie nicht Befriedigung verlangen können. Dieses Recht steht den Gläubigern jedoch nur zu, wenn sie glaubhaft machen, dass durch die Verschmelzung die Erfüllung ihrer Forderung gefährdet wird"
    },
    {
      "date": "2025-03-12",
      "id": "103517",
      "original_text": "Registerbekanntmachung nach dem Umwandlungsgesetz\nBaden-Württemberg Amtsgericht Stuttgart HRB 796778\nYVAL Idiosynkratische Investments SE – Stuttgart",
      "type": "Registerbekanntmachung nach dem Umwandlungsgesetz",
      "state": "Baden-Württemberg",
      "amtsgericht": "Amtsgericht Stuttgart",
      "registernummer": "HRB 796778",
      "registerart": "HRB",
      "company_name": "YVAL Idiosynkratische Investments SE",
      "company_seat": "Stuttgart",
      "details": "12.03.2025 (Bekanntmachungsdatum)\n\nBaden-Württemberg Amtsgericht Stuttgart HRB 796778\nRegisterbekanntmachung nach dem Umwandlungsgesetz 12.03.2025 (Eintragungsdatum)\n\nYVAL Idiosynkratische Investments SE\nEuropäische Aktiengesellschaft (SE)\nStuttgart\n\nAls nicht eingetragen wird bekanntgemacht:\nDen Gläubigern der an der Verschmelzung beteiligten Rechtsträger ist, wenn sie binnen sechs Monaten nach dem Tag, an dem die Eintragung der Verschmelzung in das Register des Sitzes desjenigen Rechtsträgers, dessen Gläubiger sie sind, nach § 19 Abs. 3 UmwG als bekanntgemacht gilt, ihren Anspruch nach Grund und Höhe schriftlich anmelden, Sicherheit zu leisten, soweit sie nicht Befriedigung verlangen können. Dieses Recht steht den Gläubigern jedoch nur zu, wenn sie glaubhaft machen, dass durch die Verschmelzung die Erfüllung ihrer Forderung gefährdet wird."
    },
    {
      "date": "2025-03-12",
      "id": "103518",
      "original_text": "Registerbekanntmachung nach dem Umwandlungsgesetz\nBaden-Württemberg Amtsgericht Stuttgart HRB 796728\nDELPHI Unternehmensberatung Aktiengesellschaft – Stuttgart",
      "type": "Registerbekanntmachung nach dem Umwandlungsgesetz",
      "state": "Baden-Württemberg",
      "amtsgericht": "Amtsgericht Stuttgart",
      "registernummer": "HRB 796728",
      "registerart": "HRB",
      "company_name": "DELPHI Unternehmensberatung Aktiengesellschaft",
      "company_seat": "Stuttgart",
      "details": "12.03.2025 (Bekanntmachungsdatum)\n\nBaden-Württemberg Amtsgericht Stuttgart HRB 796728\nRegisterbekanntmachung nach dem Umwandlungsgesetz 12.03.2025 (Eintragungsdatum)\n\nDELPHI Unternehmensberatung Aktiengesellschaft\nAktiengesellschaft\nStuttgart\n\nDen Gläubigern der an der Verschmelzung beteiligten Rechtsträger ist, wenn sie binnen sechs Monaten nach dem Tag, an dem die Eintragung der Verschmelzung in das Register des Sitzes desjenigen Rechtsträgers, dessen Gläubiger sie sind, nach § 19 Abs. 3 UmwG als bekanntgemacht gilt, ihren Anspruch nach Grund und Höhe schriftlich anmelden, Sicherheit zu leisten, soweit sie nicht Befriedigung verlangen können. Dieses Recht steht den Gläubigern jedoch nur zu, wenn sie glaubhaft machen, dass durch die Verschmelzung die Erfüllung ihrer Forderung gefährdet wird."
    },
    {
      "date": "2025-03-12",
      "id": "103519",
      "original_text": "Löschungsankündigung\nMecklenburg-Vorpommern Amtsgericht Rostock HRB 12186\nOstsee Erlebnistag UG (haftungsbeschränkt) – Bastorf",
      "type": "Löschungsankündigung",
      "state": "Mecklenburg-Vorpommern",
      "amtsgericht": "Amtsgericht Rostock",
      "registernummer": "HRB 12186",
      "registerart": "HRB",
      "company_name": "Ostsee Erlebnistag UG (haftungsbeschränkt)",
      "company_seat": "Bastorf",
      "details": "12.03.2025 (Bekanntmachungsdatum)\n\nMecklenburg-Vorpommern Amtsgericht Rostock HRB 12186\nLöschungsankündigung\n\nOstsee Erlebnistag UG (haftungsbeschränkt)\nGesellschaft mit beschränkter Haftung\nBastorf\n\nDas Registergericht beabsichtigt, die im Handelsregister eingetragene Gesellschaft von Amts wegen nach § 394 FamFG zu löschen. Die Frist zur Erhebung eines Widerspruchs gegen die beabsichtigte Löschung wird auf 1 Monat festgesetzt."
    },
    {
      "date": "2025-03-12",
      "id": "103520",
      "original_text": "Registerbekanntmachung nach dem Umwandlungsgesetz\nBrandenburg Amtsgericht Cottbus HRB 17911\nLEAG Finance GmbH – Cottbus",
      "type": "Registerbekanntmachung nach dem Umwandlungsgesetz",
      "state": "Brandenburg",
      "amtsgericht": "Amtsgericht Cottbus",
      "registernummer": "HRB 17911",
      "registerart": "HRB",
      "company_name": "LEAG Finance GmbH",
      "company_seat": "Cottbus",
      "details": "12.03.2025 (Bekanntmachungsdatum)\n\nBrandenburg Amtsgericht Cottbus HRB 17911\nRegisterbekanntmachung nach dem Umwandlungsgesetz 12.03.2025 (Eintragungsdatum)\n\nLEAG Finance GmbH\nGesellschaft mit beschränkter Haftung\nCottbus\n\nZu Eintragungsnummer 4 vom 12.03.2025 wird als nicht eingetragen veröffentlicht:\nDen Gläubigern der an der Spaltung beteiligten Rechtsträger ist, wenn sie binnen sechs Monaten nach dem Tag, an dem die Eintragung der Spaltung in das Register des Sitzes desjenigen Rechtsträgers, dessen Gläubiger sie sind, als bekannt gemacht gilt, ihren Anspruch nach Grund und Höhe schriftlich anmelden, Sicherheit zu leisten, soweit sie nicht Befriedigung verlangen können. Dieses Recht steht den Gläubigern jedoch nur zu, wenn sie glaubhaft machen, dass durch die Spaltung die Erfüllung ihrer Forderung gefährdet wird"
    },
    {
      "date": "2025-03-12",
      "id": "103521",
      "original_text": "Einreichung neuer Dokumente\nBrandenburg Amtsgericht Cottbus HRB 1314\nWBD - Wohnungsbau- und - verwaltungsgesellschaft Drebkau m.b.H. – Drebkau",
      "type": "Einreichung neuer Dokumente",
      "state": "Brandenburg",
      "amtsgericht": "Amtsgericht Cottbus",
      "registernummer": "HRB 1314",
      "registerart": "HRB",
      "company_name": "WBD - Wohnungsbau- und - verwaltungsgesellschaft Drebkau m.b.H.",
      "company_seat": "Drebkau",
      "details": "12.03.2025 (Bekanntmachungsdatum)\n\nBrandenburg Amtsgericht Cottbus HRB 1314\nEinreichung neuer Dokumente\n\nWBD - Wohnungsbau- und -  verwaltungsgesellschaft Drebkau m.b.H.\nGesellschaft mit beschränkter Haftung\nDrebkau\n\nDer Geschäftsführer hat eine Liste der Aufsichtsratsmitglieder gem. § 52 Abs. 3 Satz 2 GmbHG zum Handelsregister eingereicht"
    },
    {
      "date": "2025-03-12",
      "id": "103522",
      "original_text": "Löschungsankündigung\nMecklenburg-Vorpommern Amtsgericht Rostock HRB 13624\nStaffService GmbH – Rostock",
      "type": "Löschungsankündigung",
      "state": "Mecklenburg-Vorpommern",
      "amtsgericht": "Amtsgericht Rostock",
      "registernummer": "HRB 13624",
      "registerart": "HRB",
      "company_name": "StaffService GmbH",
      "company_seat": "Rostock",
      "details": "12.03.2025 (Bekanntmachungsdatum)\n\nMecklenburg-Vorpommern Amtsgericht Rostock HRB 13624\nLöschungsankündigung\n\nStaffService GmbH\nGesellschaft mit beschränkter Haftung\nRostock\n\nDas Registergericht beabsichtigt, die im Handelsregister eingetragene Gesellschaft von Amts wegen nach § 394 FamFG zu löschen. Die Frist zur Erhebung eines Widerspruchs gegen die beabsichtigte Löschung wird auf 1 Monat festgesetzt."
    },
    {
      "date": "2025-03-12",
      "id": "103523",
      "original_text": "Löschungsankündigung\nHamburg Amtsgericht Hamburg HRA 114482\nREVITALIS ERSTE Grundstücksgesellschaft mbH & Co. KG – Hamburg",
      "type": "Löschungsankündigung",
      "state": "Hamburg",
      "amtsgericht": "Amtsgericht Hamburg",
      "registernummer": "HRA 114482",
      "registerart": "HRA",
      "company_name": "REVITALIS ERSTE Grundstücksgesellschaft mbH & Co. KG",
      "company_seat": "Hamburg",
      "details": "12.03.2025 (Bekanntmachungsdatum)\n\nHamburg Amtsgericht Hamburg HRA 114482\nLöschungsankündigung\n\nREVITALIS ERSTE Grundstücksgesellschaft mbH & Co. KG\nKommanditgesellschaft\nHamburg\n\nDas Registergericht beabsichtigt, die im Handelsregister eingetragene Gesellschaft von Amts wegen nach § 394 Abs. 4 FamFG zu löschen. Die Frist zur Erhebung eines Widerspruchs gegen die beabsichtigte Löschung wird auf 3 Monate festgesetzt."
    },
    {
      "date": "2025-03-12",
      "id": "103524",
      "original_text": "Sonstige Registerbekanntmachung\nHamburg Amtsgericht Hamburg HRB 56097\nHamburger Feuerkasse Versicherungs-Aktiengesellschaft – Hamburg",
      "type": "Sonstige Registerbekanntmachung",
      "state": "Hamburg",
      "amtsgericht": "Amtsgericht Hamburg",
      "registernummer": "HRB 56097",
      "registerart": "HRB",
      "company_name": "Hamburger Feuerkasse Versicherungs-Aktiengesellschaft",
      "company_seat": "Hamburg",
      "details": "12.03.2025 (Bekanntmachungsdatum)\n\nHamburg Amtsgericht Hamburg HRB 56097\nSonstige Registerbekanntmachung\n\nHamburger Feuerkasse Versicherungs-Aktiengesellschaft\nAktiengesellschaft\nHamburg\n\nAls nicht eingetragen wird bekannt gemacht: Liste des Aufsichtsrats wurde eingereicht."
    },
    {
      "date": "2025-03-12",
      "id": "103525",
      "original_text": "Löschungsankündigung\nSchleswig-Holstein Amtsgericht Flensburg HRB 13875\nBidderplace GmbH – Kappeln",
      "type": "Löschungsankündigung",
      "state": "Schleswig-Holstein",
      "amtsgericht": "Amtsgericht Flensburg",
      "registernummer": "HRB 13875",
      "registerart": "HRB",
      "company_name": "Bidderplace GmbH",
      "company_seat": "Kappeln",
      "details": "12.03.2025 (Bekanntmachungsdatum)\n\nSchleswig-Holstein Amtsgericht Flensburg HRB 13875\nLöschungsankündigung\n\nBidderplace GmbH\nGesellschaft mit beschränkter Haftung\nKappeln\n\nEs ist die Löschung der nachstehenden Gesellschaft wegen Vermögenslosigkeit gemäß § 394 FamFG beabsichtigt.\nWiderspruchsfrist: 2 Monate."
    },
    {
      "date": "2025-03-12",
      "id": "103526",
      "original_text": "Registerbekanntmachung nach dem Umwandlungsgesetz\nSchleswig-Holstein Amtsgericht Kiel VR 4530\nSportverein für Gesundheit und Rehabilitation Segeberg e.V. – Bad Segeberg",
      "type": "Registerbekanntmachung nach dem Umwandlungsgesetz",
      "state": "Schleswig-Holstein",
      "amtsgericht": "Amtsgericht Kiel",
      "registernummer": "VR 4530",
      "registerart": "VR",
      "company_name": "Sportverein für Gesundheit und Rehabilitation Segeberg e.V.",
      "company_seat": "Bad Segeberg",
      "details": "12.03.2025 (Bekanntmachungsdatum)\n\nSchleswig-Holstein Amtsgericht Kiel VR 4530\nRegisterbekanntmachung nach dem Umwandlungsgesetz 11.03.2025 (Eintragungsdatum)\n\nSportverein für Gesundheit und Rehabilitation Segeberg e.V.\neingetragener Verein\nBad Segeberg\n\nZu Eintragungsnummer 11 vom 11.03.2025 wird als nicht eingetragen veröffentlicht: Den Gläubigern der an der Verschmelzung beteiligten Rechtsträger ist, wenn sie binnen sechs Monaten nach dem Tag, an dem die Eintragung der Verschmelzung in das Register des Sitzes desjenigen Rechtsträgers, dessen Gläubiger sie sind, nach § 19 Abs. 3 UmwG bekannt gemacht worden ist, ihren Anspruch nach Grund und Höhe schriftlich anmelden, Sicherheit zu leisten, soweit sie nicht Befriedigung verlangen können. Dieses Recht steht den Gläubigern jedoch nur zu, wenn sie glaubhaft machen, dass durch die Verschmelzung die Erfüllung ihrer Forderung gefährdet wird."
    },
    {
      "date": "2025-03-12",
      "id": "103527",
      "original_text": "Registerbekanntmachung nach dem Umwandlungsgesetz\nBerlin Amtsgericht Berlin (Charlottenburg) HRA 63244\nGebrüder Michels Ostmarkstraße GmbH & Co. KG – Berlin",
      "type": "Registerbekanntmachung nach dem Umwandlungsgesetz",
      "state": "Berlin",
      "amtsgericht": "Amtsgericht Berlin (Charlottenburg)",
      "registernummer": "HRA 63244",
      "registerart": "HRA",
      "company_name": "Gebrüder Michels Ostmarkstraße GmbH & Co. KG",
      "company_seat": "Berlin",
      "details": "12.03.2025 (Bekanntmachungsdatum)\n\nBerlin Amtsgericht Berlin (Charlottenburg) HRA 63244\nRegisterbekanntmachung nach dem Umwandlungsgesetz 11.03.2025 (Eintragungsdatum)\n\nGebrüder Michels Ostmarkstraße GmbH & Co. KG\nKommanditgesellschaft\nBerlin\n\nZu Eintragungsnummer 2 vom 11.03.2025 wird als nicht eingetragen veröffentlicht:\nDen Gläubigern der an der Verschmelzung beteiligten Rechtsträger ist, wenn sie binnen sechs Monaten nach dem Tag, an dem die Eintragung der Verschmelzung in das Register des Sitzes desjenigen Rechtsträgers, dessen Gläubiger sie sind, als bekannt gemacht gilt, ihren Anspruch nach Grund und Höhe schriftlich anmelden, Sicherheit zu leisten, soweit sie nicht Befriedigung verlangen können. Dieses Recht steht den Gläubigern jedoch nur zu, wenn sie glaubhaft machen, dass durch die Verschmelzung die Erfüllung ihrer Forderung gefährdet wird. Das Recht, Sicherheitsleistung zu verlangen, steht Gläubigern nicht zu, die im Falle der Insolvenz ein Recht auf vorzugsweise Befriedigung aus einer Deckungsmasse haben, die nach gesetzlicher Vorschrift zu ihrem Schutz errichtet und staatlich überwacht ist."
    },
    {
      "date": "2025-03-12",
      "id": "103528",
      "original_text": "Registerbekanntmachung nach dem Umwandlungsgesetz\nBerlin Amtsgericht Berlin (Charlottenburg) HRA 63195\nGebrüder Michels GmbH & Co. KG – Berlin",
      "type": "Registerbekanntmachung nach dem Umwandlungsgesetz",
      "state": "Berlin",
      "amtsgericht": "Amtsgericht Berlin (Charlottenburg)",
      "registernummer": "HRA 63195",
      "registerart": "HRA",
      "company_name": "Gebrüder Michels GmbH & Co. KG",
      "company_seat": "Berlin",
      "details": "12.03.2025 (Bekanntmachungsdatum)\n\nBerlin Amtsgericht Berlin (Charlottenburg) HRA 63195\nRegisterbekanntmachung nach dem Umwandlungsgesetz 11.03.2025 (Eintragungsdatum)\n\nGebrüder Michels GmbH & Co. KG\nKommanditgesellschaft\nBerlin\n\nZu Eintragungsnummer 5 vom 11.03.2025 wird als nicht eingetragen veröffentlicht:\nDen Gläubigern der an der Verschmelzung beteiligten Rechtsträger ist, wenn sie binnen sechs Monaten nach dem Tag, an dem die Eintragung der Verschmelzung in das Register des Sitzes desjenigen Rechtsträgers, dessen Gläubiger sie sind, als bekannt gemacht gilt, ihren Anspruch nach Grund und Höhe schriftlich anmelden, Sicherheit zu leisten, soweit sie nicht Befriedigung verlangen können. Dieses Recht steht den Gläubigern jedoch nur zu, wenn sie glaubhaft machen, dass durch die Verschmelzung die Erfüllung ihrer Forderung gefährdet wird. Das Recht, Sicherheitsleistung zu verlangen, steht Gläubigern nicht zu, die im Falle der Insolvenz ein Recht auf vorzugsweise Befriedigung aus einer Deckungsmasse haben, die nach gesetzlicher Vorschrift zu ihrem Schutz errichtet und staatlich überwacht ist."
    },
    {
      "date": "2025-03-12",
      "id": "103529",
      "original_text": "Sonstige Registerbekanntmachung\nBerlin Amtsgericht Berlin (Charlottenburg) HRB 13072\nBerlin Partner für Wirtschaft und Technologie GmbH – Berlin",
      "type": "Sonstige Registerbekanntmachung",
      "state": "Berlin",
      "amtsgericht": "Amtsgericht Berlin (Charlottenburg)",
      "registernummer": "HRB 13072",
      "registerart": "HRB",
      "company_name": "Berlin Partner für Wirtschaft und Technologie GmbH",
      "company_seat": "Berlin",
      "details": "12.03.2025 (Bekanntmachungsdatum)\n\nBerlin Amtsgericht Berlin (Charlottenburg) HRB 13072\nSonstige Registerbekanntmachung\n\nBerlin Partner für Wirtschaft und Technologie GmbH\nGesellschaft mit beschränkter Haftung\nBerlin\n\nAls nicht eingetragen wird veröffentlicht: Es wurde eine neue Liste der Aufsichtsratsmitglieder eingereicht (§52 GmbHG)."
    },
    {
      "date": "2025-03-12",
      "id": "103530",
      "original_text": "Sonstige Registerbekanntmachung\nSchleswig-Holstein Amtsgericht Kiel PR 853\nHenkel & Rühaak Steuerberatungsgesellschaft PartmbB – Ahrensburg",
      "type": "Sonstige Registerbekanntmachung",
      "state": "Schleswig-Holstein",
      "amtsgericht": "Amtsgericht Kiel",
      "registernummer": "PR 853",
      "registerart": "PR",
      "company_name": "Henkel & Rühaak Steuerberatungsgesellschaft PartmbB",
      "company_seat": "Ahrensburg",
      "details": "12.03.2025 (Bekanntmachungsdatum)\n\nSchleswig-Holstein Amtsgericht Kiel PR 853\nSonstige Registerbekanntmachung\n\nHenkel & Rühaak Steuerberatungsgesellschaft PartmbB\nPartnerschaftsgesellschaft\nAhrensburg\n\nAls nicht eingetragen wird veröffentlicht: Den Gläubigern der an der Spaltung beteiligten Rechtsträger ist, wenn sie binnen sechs Monaten nach dem Tag, an dem die Eintragung der Spaltung in das Register des Sitzes desjenigen Rechtsträgers, dessen Gläubiger sie sind,  bekannt gemacht worden ist, ihren Anspruch nach Grund und Höhe schriftlich anmelden, Sicherheit zu leisten, soweit sie nicht Befriedigung verlangen können. Dieses Recht steht den Gläubigern jedoch nur zu, wenn sie glaubhaft machen, dass durch die Spaltung die Erfüllung ihrer Forderung gefährdet wird."
    },
    {
      "date": "2025-03-12",
      "id": "103531",
      "original_text": "Registerbekanntmachung nach dem Umwandlungsgesetz\nBerlin Amtsgericht Berlin (Charlottenburg) HRA 63237\nGebrüder Michels Berliner Straße 129 A GmbH & Co. KG – Berlin",
      "type": "Registerbekanntmachung nach dem Umwandlungsgesetz",
      "state": "Berlin",
      "amtsgericht": "Amtsgericht Berlin (Charlottenburg)",
      "registernummer": "HRA 63237",
      "registerart": "HRA",
      "company_name": "Gebrüder Michels Berliner Straße 129 A GmbH & Co. KG",
      "company_seat": "Berlin",
      "details": "12.03.2025 (Bekanntmachungsdatum)\n\nBerlin Amtsgericht Berlin (Charlottenburg) HRA 63237\nRegisterbekanntmachung nach dem Umwandlungsgesetz 11.03.2025 (Eintragungsdatum)\n\nGebrüder Michels Berliner Straße 129 A GmbH & Co. KG\nKommanditgesellschaft\nBerlin\n\nZu Eintragungsnummer 2 vom 11.03.2025 wird als nicht eingetragen veröffentlicht:\nDen Gläubigern der an der Verschmelzung beteiligten Rechtsträger ist, wenn sie binnen sechs Monaten nach dem Tag, an dem die Eintragung der Verschmelzung in das Register des Sitzes desjenigen Rechtsträgers, dessen Gläubiger sie sind, als bekannt gemacht gilt, ihren Anspruch nach Grund und Höhe schriftlich anmelden, Sicherheit zu leisten, soweit sie nicht Befriedigung verlangen können. Dieses Recht steht den Gläubigern jedoch nur zu, wenn sie glaubhaft machen, dass durch die Verschmelzung die Erfüllung ihrer Forderung gefährdet wird. Das Recht, Sicherheitsleistung zu verlangen, steht Gläubigern nicht zu, die im Falle der Insolvenz ein Recht auf vorzugsweise Befriedigung aus einer Deckungsmasse haben, die nach gesetzlicher Vorschrift zu ihrem Schutz errichtet und staatlich überwacht ist."
    },
    {
      "date": "2025-03-12",
      "id": "103532",
      "original_text": "Registerbekanntmachung nach dem Umwandlungsgesetz\nBerlin Amtsgericht Berlin (Charlottenburg) HRA 63195\nGebrüder Michels GmbH & Co. KG – Berlin",
      "type": "Registerbekanntmachung nach dem Umwandlungsgesetz",
      "state": "Berlin",
      "amtsgericht": "Amtsgericht Berlin (Charlottenburg)",
      "registernummer": "HRA 63195",
      "registerart": "HRA",
      "company_name": "Gebrüder Michels GmbH & Co. KG",
      "company_seat": "Berlin",
      "details": "12.03.2025 (Bekanntmachungsdatum)\n\nBerlin Amtsgericht Berlin (Charlottenburg) HRA 63195\nRegisterbekanntmachung nach dem Umwandlungsgesetz 11.03.2025 (Eintragungsdatum)\n\nGebrüder Michels GmbH & Co. KG\nKommanditgesellschaft\nBerlin\n\nZu Eintragungsnummer 6 vom 11.03.2025 wird als nicht eingetragen veröffentlicht:\nDen Gläubigern der an der Verschmelzung beteiligten Rechtsträger ist, wenn sie binnen sechs Monaten nach dem Tag, an dem die Eintragung der Verschmelzung in das Register des Sitzes desjenigen Rechtsträgers, dessen Gläubiger sie sind, als bekannt gemacht gilt, ihren Anspruch nach Grund und Höhe schriftlich anmelden, Sicherheit zu leisten, soweit sie nicht Befriedigung verlangen können. Dieses Recht steht den Gläubigern jedoch nur zu, wenn sie glaubhaft machen, dass durch die Verschmelzung die Erfüllung ihrer Forderung gefährdet wird. Das Recht, Sicherheitsleistung zu verlangen, steht Gläubigern nicht zu, die im Falle der Insolvenz ein Recht auf vorzugsweise Befriedigung aus einer Deckungsmasse haben, die nach gesetzlicher Vorschrift zu ihrem Schutz errichtet und staatlich überwacht ist."
    },
    {
      "date": "2025-03-12",
      "id": "103533",
      "original_text": "Registerbekanntmachung nach dem Umwandlungsgesetz\nBaden-Württemberg Amtsgericht Stuttgart HRB 746125\nBühr Verwaltung GmbH – Gerlingen",
      "type": "Registerbekanntmachung nach dem Umwandlungsgesetz",
      "state": "Baden-Württemberg",
      "amtsgericht": "Amtsgericht Stuttgart",
      "registernummer": "HRB 746125",
      "registerart": "HRB",
      "company_name": "Bühr Verwaltung GmbH",
      "company_seat": "Gerlingen",
      "details": "12.03.2025 (Bekanntmachungsdatum)\n\nBaden-Württemberg Amtsgericht Stuttgart HRB 746125\nRegisterbekanntmachung nach dem Umwandlungsgesetz 12.03.2025 (Eintragungsdatum)\n\nBühr Verwaltung GmbH\nGesellschaft mit beschränkter Haftung\nGerlingen\n\nAls nicht eingetragen wird bekanntgemacht:\nDen Gläubigern der an der Verschmelzung beteiligten Rechtsträger ist, wenn sie binnen sechs Monaten nach dem Tag, an dem die Eintragung der Verschmelzung in das Register des Sitzes desjenigen Rechtsträgers, dessen Gläubiger sie sind, nach § 19 Abs. 3 UmwG als bekanntgemacht gilt, ihren Anspruch nach Grund und Höhe schriftlich anmelden, Sicherheit zu leisten, soweit sie nicht Befriedigung verlangen können. Dieses Recht steht den Gläubigern jedoch nur zu, wenn sie glaubhaft machen, dass durch die Verschmelzung die Erfüllung ihrer Forderung gefährdet wird."
    },
    {
      "date": "2025-03-12",
      "id": "103534",
      "original_text": "Löschungsankündigung\nBerlin Amtsgericht Berlin (Charlottenburg) HRB 162575\nSalmed GmbH – Berlin",
      "type": "Löschungsankündigung",
      "state": "Berlin",
      "amtsgericht": "Amtsgericht Berlin (Charlottenburg)",
      "registernummer": "HRB 162575",
      "registerart": "HRB",
      "company_name": "Salmed GmbH",
      "company_seat": "Berlin",
      "details": "12.03.2025 (Bekanntmachungsdatum)\n\nBerlin Amtsgericht Berlin (Charlottenburg) HRB 162575\nLöschungsankündigung\n\nSalmed GmbH\nGesellschaft mit beschränkter Haftung\nBerlin\n\nBei der nachstehenden Gesellschaft wird das Amtslöschungsverfahren gemäß § 394 FamFG eingeleitet. Widerspruchsfrist 6 Wochen"
    },
    {
      "date": "2025-03-12",
      "id": "103535",
      "original_text": "Löschungsankündigung\nBerlin Amtsgericht Berlin (Charlottenburg) HRB 223445\nAskinCakici Holding GmbH – Berlin",
      "type": "Löschungsankündigung",
      "state": "Berlin",
      "amtsgericht": "Amtsgericht Berlin (Charlottenburg)",
      "registernummer": "HRB 223445",
      "registerart": "HRB",
      "company_name": "AskinCakici Holding GmbH",
      "company_seat": "Berlin",
      "details": "12.03.2025 (Bekanntmachungsdatum)\n\nBerlin Amtsgericht Berlin (Charlottenburg) HRB 223445\nLöschungsankündigung\n\nAskinCakici Holding GmbH\nGesellschaft mit beschränkter Haftung\nBerlin\n\nEs ist beabsichtigt, die Eintragung des Geschäftsführers Oktay Askin wegen Mangels einer wesentlichen Voraussetzung (d.h. der Amtsfähigkeit) gemäß § 395 FamFG von Amts wegen zu löschen. Widerspruchsfrist 6 Wochen"
    },
    {
      "date": "2025-03-12",
      "id": "103536",
      "original_text": "Einreichung neuer Dokumente\nBrandenburg Amtsgericht Neuruppin HRB 12160\nKunsthaus Dosse Park AG – Wittstock",
      "type": "Einreichung neuer Dokumente",
      "state": "Brandenburg",
      "amtsgericht": "Amtsgericht Neuruppin",
      "registernummer": "HRB 12160",
      "registerart": "HRB",
      "company_name": "Kunsthaus Dosse Park AG",
      "company_seat": "Wittstock",
      "details": "12.03.2025 (Bekanntmachungsdatum)\n\nBrandenburg Amtsgericht Neuruppin HRB 12160\nEinreichung neuer Dokumente\n\nKunsthaus Dosse Park AG\nAktiengesellschaft\nWittstock\n\nAls nicht eingetragen wird veröffentlicht: Eine Liste der Mitglieder des Aufsichtsrates wurde zum Handelsregister eingereicht."
    },
    {
      "date": "2025-03-12",
      "id": "103537",
      "original_text": "Registerbekanntmachung nach dem Umwandlungsgesetz\nHamburg Amtsgericht Hamburg HRB 98971\nCEE Holding S.à r.l. & Co. KGaA – Hamburg",
      "type": "Registerbekanntmachung nach dem Umwandlungsgesetz",
      "state": "Hamburg",
      "amtsgericht": "Amtsgericht Hamburg",
      "registernummer": "HRB 98971",
      "registerart": "HRB",
      "company_name": "CEE Holding S.à r.l. & Co. KGaA",
      "company_seat": "Hamburg",
      "details": "12.03.2025 (Bekanntmachungsdatum)\n\nHamburg Amtsgericht Hamburg HRB 98971\nRegisterbekanntmachung nach dem Umwandlungsgesetz 12.03.2025 (Eintragungsdatum)\n\nCEE Holding S.à r.l. & Co. KGaA\nKommanditgesellschaft auf Aktien\nHamburg\n\nGemäß § 308 Abs. 1 UmwG werden folgenden Angaben für die grenzüberschreitende Verschmelzung der CEE Holding S.à r.l. & Co. KGaA mit Sitz in Hamburg, Deutschland, auf die CEE RF9 Holding S.à r.l., mit Sitz in 17, Am Scheerleck, L-6868 Wecker, Großherzogtum Luxemburg, bekanntgemacht:\n\n1. Der Entwurf des gemeinsamen Verschmelzungsplans mit den Verschmelzungsbedingungen für eine grenzüberschreitende Verschmelzung zwischen der CEE Holding S.à r.l. & Co. KGaA (als übertragende Gesellschaft) und der CEE RF9 Holding S.à r.l. (als übernehmende Gesellschaft) ist beim Handelsregister der übertragenden Gesellschaft eingereicht worden.\n\n2. An der grenzüberschreitenden Verschmelzung sind die folgenden Gesellschaften\nbeteiligt:\n\na) als übertragende Gesellschaft:\nDie CEE Holding S.à r.l. & Co. KGaA, eine Kommanditgesellschaft auf Aktien\nnach deutschem Recht mit Sitz in Hamburg, Deutschland;\n\nb) als übernehmende Gesellschaft:\nCEE RF9 Holding S.à r.l., eine Gesellschaft mit beschränkter Haftung (société à responsabilité limitée) nach dem Recht des Großherzogtum Luxemburg mit\nSitz in 17, Am Scheerleck, L-6868 Wecker, Großherzogtum Luxemburg.\n\n3. Die an der grenzüberschreitenden Verschmelzung beteiligten Gesellschaften sind in den folgenden Registern eingetragen:\n\na) Die übertragende Gesellschaft CEE Holding S.à r.l. & Co. KGaA ist eingetragen\nim Handelsregister des Amtsgerichts Hamburg unter HRB 98971;\n\nb) Die übernehmende Gesellschaft CEE RF9 Holding S.à r.l. ist eingetragen im\nHandels- und Gesellschaftsregister Luxemburg Registre de Commerce et des Sociétés Luxembourg) unter der Nummer B286281.\n\n4. Hinweis zur Möglichkeit der Übermittlung von Bemerkungen zum Verschmelzungsplan.\n\nGläubiger und Anteilsinhaber sowie Betriebsräte oder - soweit es keine Betriebsräte\ngibt - Arbeitnehmer der an der grenzüberschreitenden Verschmelzung beteiligten Gesellschaften haben im Rahmen der grenzüberschreitenden Verschmelzung ein Anhörungsrecht.\n\nWeder bei der übertragenden noch bei der übernehmenden Gesellschaft sind Arbeitnehmer beschäftigt. Demzufolge gibt es weder Arbeitnehmer noch zuständige\nArbeitnehmervertretungen (insbes. Betriebsräte), die im Rahmen der Verschmelzung\nRechte geltend machen können, insbesondere Bemerkungen zum Verschmelzungsplan oder dessen Entwurf übermitteln können.\n\nDie Gläubiger und Anteilsinhaber der an der Verschmelzung beteiligten Gesellschaften können im Grundsatz bis spätestens fünf Arbeitstage vor dem Tag der Versammlung der Anteilsinhaber, die über die Zustimmung zu dem Verschmelzungsplan beschließen, Bemerkungen zum Verschmelzungsplan bzw. dessen Entwurf übermitteln. Ist eine Versammlung der Anteilsinhaber aufgrund einer Konzernkonstellation nicht erforderlich, können die Bemerkungen von Gläubigern und Anteilsinhabern entsprechend bis spätestens fünf Arbeitstage vor dem Tag, an dem der Verschmelzungsplan beurkundet wird, übermittelt werden (vgl. § 308 Abs. 2 UmwG).\n\nDa eine Versammlung der Anteilsinhaber bei der übertragenden Gesellschaft\ngemäß § 312 Abs. 2 in Verbindung mit § 307 Abs. 3 Nr. 1 UmwG nicht erforderlich\nist, können Gläubiger und Anteilsinhaber der übertragenden Gesellschaft bis spätestens fünf Arbeitstage vor dem Tag, an dem der Verschmelzungsplan beurkundet wird, ihre Bemerkungen zum Verschmelzungsplan übermitteln. Die Beurkundung des Verschmelzungsplans in Deutschland wird voraussichtlich am 6. Mai 2025, jedoch in keinem Fall vor diesem Tag erfolgen.\n\nGläubiger und Anteilsinhaber der übernehmenden Gesellschaft können bis spätestens fünf Arbeitstage vor dem Tag der Gesellschafterversammlung der übernehmenden Gesellschaft über die Zustimmung zum Verschmelzungsplan Bemerkungen zum Verschmelzungsplan übermitteln. Die Gesellschafterversammlung wird voraussichtlich am 7. Mai 2025, jedoch in keinem Fall vor diesem Tag erfolgen.\n\nVollständige Auskünfte über die Modalitäten der Ausübung der Rechte der Anteilsinhaber, Gläubiger sowie der Arbeitnehmervertreter und Arbeitnehmer der beteiligten Gesellschaften können unter den folgenden Adressen kostenlos angefordert werden. Dies sind zugleich die Zielanschriften für Bemerkungen zum Verschmelzungsplan:\n\nCEE Holding S.à r.l. & Co. KGaA\nSpeersort 10\n20095 Hamburg\nDeutschland\n\nCEE RF9 Holding S.à r.l.,\n17, Am Scheerleck\nL-6868 Wecker\nGroßherzogtum Luxemburg"
    },
    {
      "date": "2025-03-12",
      "id": "103538",
      "original_text": "Registerbekanntmachung nach dem Umwandlungsgesetz\nBerlin Amtsgericht Berlin (Charlottenburg) HRB 153446\nInvisible Advisory GmbH – Berlin",
      "type": "Registerbekanntmachung nach dem Umwandlungsgesetz",
      "state": "Berlin",
      "amtsgericht": "Amtsgericht Berlin (Charlottenburg)",
      "registernummer": "HRB 153446",
      "registerart": "HRB",
      "company_name": "Invisible Advisory GmbH",
      "company_seat": "Berlin",
      "details": "12.03.2025 (Bekanntmachungsdatum)\n\nBerlin Amtsgericht Berlin (Charlottenburg) HRB 153446\nRegisterbekanntmachung nach dem Umwandlungsgesetz 11.03.2025 (Eintragungsdatum)\n\nInvisible Advisory GmbH\nGesellschaft mit beschränkter Haftung\nBerlin\n\nZu Eintragungsnummer 5 vom 11.03.2025 wird als nicht eingetragen veröffentlicht:Den Gläubigern der an der Verschmelzung beteiligten Rechtsträger ist, wenn sie binnen sechs Monaten nach dem Tag, an dem die Eintragung der Verschmelzung in das Register des Sitzes desjenigen Rechtsträgers, dessen Gläubiger sie sind, als bekannt gemacht gilt, ihren Anspruch nach Grund und Höhe schriftlich anmelden, Sicherheit zu leisten, soweit sie nicht Befriedigung verlangen können. Dieses Recht steht den Gläubigern jedoch nur zu, wenn sie glaubhaft machen, dass durch die Verschmelzung die Erfüllung ihrer Forderung gefährdet wird. Das Recht, Sicherheitsleistung zu verlangen, steht Gläubigern nicht zu, die im Falle der Insolvenz ein Recht auf vorzugsweise Befriedigung aus einer Deckungsmasse haben, die nach gesetzlicher Vorschrift zu ihrem Schutz errichtet und staatlich überwacht ist."
    },
    {
      "date": "2025-03-12",
      "id": "103539",
      "original_text": "Einreichung neuer Dokumente\nBaden-Württemberg Amtsgericht Freiburg HRB 731413\nAiconic AG – Konstanz",
      "type": "Einreichung neuer Dokumente",
      "state": "Baden-Württemberg",
      "amtsgericht": "Amtsgericht Freiburg",
      "registernummer": "HRB 731413",
      "registerart": "HRB",
      "company_name": "Aiconic AG",
      "company_seat": "Konstanz",
      "details": "12.03.2025 (Bekanntmachungsdatum)\n\nBaden-Württemberg Amtsgericht Freiburg HRB 731413\nEinreichung neuer Dokumente 12.03.2025 (Eintragungsdatum)\n\nAiconic AG\nAktiengesellschaft\nKonstanz\n\nAls nicht eingetragen wird bekanntgemacht:\nDie Gesellschaft hat am 07.03.2025 die Liste über die Zusammensetzung des Aufsichtsrats zum Handelsregister eingereicht."
    },
    {
      "date": "2025-03-12",
      "id": "103540",
      "original_text": "Registerbekanntmachung nach dem Umwandlungsgesetz\nBrandenburg Amtsgericht Cottbus HRB 8327\nLausitz Energie Kraftwerke AG – Cottbus",
      "type": "Registerbekanntmachung nach dem Umwandlungsgesetz",
      "state": "Brandenburg",
      "amtsgericht": "Amtsgericht Cottbus",
      "registernummer": "HRB 8327",
      "registerart": "HRB",
      "company_name": "Lausitz Energie Kraftwerke AG",
      "company_seat": "Cottbus",
      "details": "12.03.2025 (Bekanntmachungsdatum)\n\nBrandenburg Amtsgericht Cottbus HRB 8327\nRegisterbekanntmachung nach dem Umwandlungsgesetz 12.03.2025 (Eintragungsdatum)\n\nLausitz Energie Kraftwerke AG\nAktiengesellschaft\nCottbus\n\nDen Gläubigern der an der Spaltung beteiligten Rechtsträger ist, wenn sie binnen sechs Monaten nach dem Tag, an dem die Eintragung der Spaltung in das Register des Sitzes desjenigen Rechtsträgers, dessen Gläubiger sie sind, als bekannt gemacht gilt, ihren Anspruch nach Grund und Höhe schriftlich anmelden, Sicherheit zu leisten, soweit sie nicht Befriedigung verlangen können. Dieses Recht steht den Gläubigern jedoch nur zu, wenn sie glaubhaft machen, dass durch die Spaltung die Erfüllung ihrer Forderung gefährdet wird"
    },
    {
      "date": "2025-03-12",
      "id": "103541",
      "original_text": "Registerbekanntmachung nach dem Umwandlungsgesetz\nSachsen-Anhalt Amtsgericht Stendal HRB 24925\nAltmärkische Plast Geschäftsführungs-UG (haftungsbeschränkt) – Gardelegen",
      "type": "Registerbekanntmachung nach dem Umwandlungsgesetz",
      "state": "Sachsen-Anhalt",
      "amtsgericht": "Amtsgericht Stendal",
      "registernummer": "HRB 24925",
      "registerart": "HRB",
      "company_name": "Altmärkische Plast Geschäftsführungs-UG (haftungsbeschränkt)",
      "company_seat": "Gardelegen",
      "details": "12.03.2025 (Bekanntmachungsdatum)\n\nSachsen-Anhalt Amtsgericht Stendal HRB 24925\nRegisterbekanntmachung nach dem Umwandlungsgesetz 12.03.2025 (Eintragungsdatum)\n\nAltmärkische Plast Geschäftsführungs-UG (haftungsbeschränkt)\nGesellschaft mit beschränkter Haftung\nGardelegen\n\nNicht eingetragen:\nDen Gläubigern der an der Verschmelzung beteiligten Rechtsträger ist, wenn sie binnen sechs Monaten nach dem Tag, an dem die Eintragung der Verschmelzung nach § 19 Abs. 3 UmwG als bekanntgemacht gilt, ihren Anspruch nach Grund und Höhe schriftlich anmelden, Sicherheit zu leisten, soweit sie nicht Befriedigung verlangen können. Dieses Recht steht ihnen jedoch nur zu, wenn sie glaubhaft machen, dass durch die Verschmelzung die Erfüllung ihrer Forderung gefährdet wird."
    },
    {
      "date": "2025-03-12",
      "id": "103542",
      "original_text": "Registerbekanntmachung nach dem Umwandlungsgesetz\nBerlin Amtsgericht Berlin (Charlottenburg) HRB 237755\nRIDE Stars GmbH – Berlin",
      "type": "Registerbekanntmachung nach dem Umwandlungsgesetz",
      "state": "Berlin",
      "amtsgericht": "Amtsgericht Berlin (Charlottenburg)",
      "registernummer": "HRB 237755",
      "registerart": "HRB",
      "company_name": "RIDE Stars GmbH",
      "company_seat": "Berlin",
      "details": "12.03.2025 (Bekanntmachungsdatum)\n\nBerlin Amtsgericht Berlin (Charlottenburg) HRB 237755\nRegisterbekanntmachung nach dem Umwandlungsgesetz 11.03.2025 (Eintragungsdatum)\n\nRIDE Stars GmbH\nGesellschaft mit beschränkter Haftung\nBerlin\n\nZu Eintragungsnummer 3 vom 11.03.2025 wird als nicht eingetragen veröffentlicht:Den Gläubigern der an der Verschmelzung beteiligten Rechtsträger ist, wenn sie binnen sechs Monaten nach dem Tag, an dem die Eintragung der Verschmelzung in das Register des Sitzes desjenigen Rechtsträgers, dessen Gläubiger sie sind, als bekannt gemacht gilt, ihren Anspruch nach Grund und Höhe schriftlich anmelden, Sicherheit zu leisten, soweit sie nicht Befriedigung verlangen können. Dieses Recht steht den Gläubigern jedoch nur zu, wenn sie glaubhaft machen, dass durch die Verschmelzung die Erfüllung ihrer Forderung gefährdet wird. Das Recht, Sicherheitsleistung zu verlangen, steht Gläubigern nicht zu, die im Falle der Insolvenz ein Recht auf vorzugsweise Befriedigung aus einer Deckungsmasse haben, die nach gesetzlicher Vorschrift zu ihrem Schutz errichtet und staatlich überwacht ist."
    },
    {
      "date": "2025-03-12",
      "id": "103543",
      "original_text": "Löschungsankündigung\nSchleswig-Holstein Amtsgericht Pinneberg HRB 16153\nOSTAR GMBH – Halstenbek",
      "type": "Löschungsankündigung",
      "state": "Schleswig-Holstein",
      "amtsgericht": "Amtsgericht Pinneberg",
      "registernummer": "HRB 16153",
      "registerart": "HRB",
      "company_name": "OSTAR GMBH",
      "company_seat": "Halstenbek",
      "details": "12.03.2025 (Bekanntmachungsdatum)\n\nSchleswig-Holstein Amtsgericht Pinneberg HRB 16153\nLöschungsankündigung\n\nOSTAR GMBH\nGesellschaft mit beschränkter Haftung\nHalstenbek\n\nEs ist die Löschung der nachstehenden Gesellschaft wegen Vermögenslosigkeit gemäß § 394 FamFG beabsichtigt. Widerspruchsfrist: 2 Monate."
    },
    {
      "date": "2025-03-12",
      "id": "103544",
      "original_text": "Löschungsankündigung\nBerlin Amtsgericht Berlin (Charlottenburg) HRB 185012\nPartshoff GmbH – Berlin",
      "type": "Löschungsankündigung",
      "state": "Berlin",
      "amtsgericht": "Amtsgericht Berlin (Charlottenburg)",
      "registernummer": "HRB 185012",
      "registerart": "HRB",
      "company_name": "Partshoff GmbH",
      "company_seat": "Berlin",
      "details": "12.03.2025 (Bekanntmachungsdatum)\n\nBerlin Amtsgericht Berlin (Charlottenburg) HRB 185012\nLöschungsankündigung\n\nPartshoff GmbH\nGesellschaft mit beschränkter Haftung\nBerlin\n\nBei der nachstehenden Gesellschaft wird das Amtslöschungsverfahren gemäß § 394 FamFG eingeleitet. Widerspruchsfrist 6 Wochen"
    },
    {
      "date": "2025-03-12",
      "id": "103545",
      "original_text": "Löschungsankündigung\nBrandenburg Amtsgericht Potsdam HRB 34427\ngreenGuard services GmbH – Brandenburg an der Havel",
      "type": "Löschungsankündigung",
      "state": "Brandenburg",
      "amtsgericht": "Amtsgericht Potsdam",
      "registernummer": "HRB 34427",
      "registerart": "HRB",
      "company_name": "greenGuard services GmbH",
      "company_seat": "Brandenburg an der Havel",
      "details": "12.03.2025 (Bekanntmachungsdatum)\n\nBrandenburg Amtsgericht Potsdam HRB 34427\nLöschungsankündigung\n\ngreenGuard services GmbH\nGesellschaft mit beschränkter Haftung\nBrandenburg an der Havel\n\nBei der nachstehenden Gesellschaft wird das Amtslöschungsverfahren gemäß § 394 FamFG eingeleitet. Widerspruchsfrist: 8 Wochen"
    },
    {
      "date": "2025-03-12",
      "id": "103546",
      "original_text": "Löschungsankündigung\nBrandenburg Amtsgericht Potsdam HRB 36787\nBaba GmbH – Potsdam",
      "type": "Löschungsankündigung",
      "state": "Brandenburg",
      "amtsgericht": "Amtsgericht Potsdam",
      "registernummer": "HRB 36787",
      "registerart": "HRB",
      "company_name": "Baba GmbH",
      "company_seat": "Potsdam",
      "details": "12.03.2025 (Bekanntmachungsdatum)\n\nBrandenburg Amtsgericht Potsdam HRB 36787\nLöschungsankündigung\n\nBaba GmbH\nGesellschaft mit beschränkter Haftung\nPotsdam\n\nBei der nachstehenden Gesellschaft wird das Amtslöschungsverfahren gemäß § 394 FamFG eingeleitet. Widerspruchsfrist: 8 Wochen"
    },
    {
      "date": "2025-03-12",
      "id": "103547",
      "original_text": "Sonstige Registerbekanntmachung\nBerlin Amtsgericht Berlin (Charlottenburg) HRB 87210\nAxel Springer Digital GmbH – Berlin",
      "type": "Sonstige Registerbekanntmachung",
      "state": "Berlin",
      "amtsgericht": "Amtsgericht Berlin (Charlottenburg)",
      "registernummer": "HRB 87210",
      "registerart": "HRB",
      "company_name": "Axel Springer Digital GmbH",
      "company_seat": "Berlin",
      "details": "12.03.2025 (Bekanntmachungsdatum)\n\nBerlin Amtsgericht Berlin (Charlottenburg) HRB 87210\nSonstige Registerbekanntmachung\n\nAxel Springer Digital GmbH\nGesellschaft mit beschränkter Haftung\nBerlin\n\nAls nicht eingetragen wird in Ergänzung zur Bekanntmachung vom 11.03.2025 veröffentlicht:\nDer andere Vertragsteil hat den Gläubigern dieses Rechtsträgers, deren Forderungen begründet worden sind, bevor die Eintragung der Beendigung dieses Vertrages in das Handelsregister nach § 10 des Handelsgesetzbuches als bekannt gemacht gilt, Sicherheit zu leisten, wenn sie sich binnen sechs Monaten nach der Bekanntmachung der Eintragung zu diesem Zweck bei ihm melden. Dieses Recht steht den Gläubigern nicht zu, die im Fall des Insolvenzverfahrens ein Recht auf vorzugsweise Befriedigung aus der Deckungsmasse haben, die nach gesetzlicher Vorschrift zu ihrem Schutz errichtet und staatlich überwacht ist."
    },
    {
      "date": "2025-03-12",
      "id": "103548",
      "original_text": "Löschungsankündigung\nMecklenburg-Vorpommern Amtsgericht Schwerin HRA 2491\nKienzle KG – Zarrentin",
      "type": "Löschungsankündigung",
      "state": "Mecklenburg-Vorpommern",
      "amtsgericht": "Amtsgericht Schwerin",
      "registernummer": "HRA 2491",
      "registerart": "HRA",
      "company_name": "Kienzle KG",
      "company_seat": "Zarrentin",
      "details": "12.03.2025 (Bekanntmachungsdatum)\n\nMecklenburg-Vorpommern Amtsgericht Schwerin HRA 2491\nLöschungsankündigung\n\nKienzle KG\nKommanditgesellschaft\nZarrentin\n\nDas Amtsgericht Schwerin, Handelsregisterabteilung, beabsichtigt, die o.g. Gesellschaft gemäß § 394 FamFG zu löschen, wenn nicht binnen zwei Monaten nach dieser Bekanntmachung hiergegen Widerspruch erhoben wird."
    },
    {
      "date": "2025-03-12",
      "id": "103549",
      "original_text": "Sonstige Registerbekanntmachung\nSchleswig-Holstein Amtsgericht Kiel HRB 14716\nKieler Bau Verwaltungs UG (haftungsbeschränkt) – Lehmkuhlen",
      "type": "Sonstige Registerbekanntmachung",
      "state": "Schleswig-Holstein",
      "amtsgericht": "Amtsgericht Kiel",
      "registernummer": "HRB 14716",
      "registerart": "HRB",
      "company_name": "Kieler Bau Verwaltungs UG (haftungsbeschränkt)",
      "company_seat": "Lehmkuhlen",
      "details": "12.03.2025 (Bekanntmachungsdatum)\n\nSchleswig-Holstein Amtsgericht Kiel HRB 14716\nSonstige Registerbekanntmachung 26.02.2025 (Eintragungsdatum)\n\nKieler Bau Verwaltungs UG (haftungsbeschränkt)\nGesellschaft mit beschränkter Haftung\nLehmkuhlen\n\nGeschäftsführer:\nWyczawski, Artur\nist mangels einer wesentlichen Voraussetzung gemäß § 395 FamFG von Amts wegen gelöscht."
    },
    {
      "date": "2025-03-12",
      "id": "103550",
      "original_text": "Einreichung neuer Dokumente\nBaden-Württemberg Amtsgericht Stuttgart HRB 7357\nVerkehrs- und Tarifverbund Stuttgart, Gesellschaft mit beschränkter Haftung (VVS) – Stuttgart",
      "type": "Einreichung neuer Dokumente",
      "state": "Baden-Württemberg",
      "amtsgericht": "Amtsgericht Stuttgart",
      "registernummer": "HRB 7357",
      "registerart": "HRB",
      "company_name": "Verkehrs- und Tarifverbund Stuttgart, Gesellschaft mit beschränkter Haftung (VVS)",
      "company_seat": "Stuttgart",
      "details": "12.03.2025 (Bekanntmachungsdatum)\n\nBaden-Württemberg Amtsgericht Stuttgart HRB 7357\nEinreichung neuer Dokumente\n\nVerkehrs- und Tarifverbund Stuttgart, Gesellschaft mit beschränkter Haftung (VVS)\nGesellschaft mit beschränkter Haftung\nStuttgart\n\nDie Gesellschaft hat am 12.03.2025 die Liste über die Zusammensetzung des Aufsichtsrats zum Handelsregister eingereicht."
    },
    {
      "date": "2025-03-12",
      "id": "103551",
      "original_text": "Löschungsankündigung\nBerlin Amtsgericht Berlin (Charlottenburg) HRB 197573\nDehango UG (haftungsbeschränkt) – Berlin",
      "type": "Löschungsankündigung",
      "state": "Berlin",
      "amtsgericht": "Amtsgericht Berlin (Charlottenburg)",
      "registernummer": "HRB 197573",
      "registerart": "HRB",
      "company_name": "Dehango UG (haftungsbeschränkt)",
      "company_seat": "Berlin",
      "details": "12.03.2025 (Bekanntmachungsdatum)\n\nBerlin Amtsgericht Berlin (Charlottenburg) HRB 197573\nLöschungsankündigung\n\nDehango UG (haftungsbeschränkt)\nGesellschaft mit beschränkter Haftung\nBerlin\n\nBei der nachstehenden Gesellschaft wird das Amtslöschungsverfahren gemäß § 394 FamFG eingeleitet. Widerspruchsfrist 6 Wochen"
    },
    {
      "date": "2025-03-12",
      "id": "103552",
      "original_text": "Registerbekanntmachung nach dem Umwandlungsgesetz\nBaden-Württemberg Amtsgericht Stuttgart HRB 460604\nHengstler GmbH – Aldingen",
      "type": "Registerbekanntmachung nach dem Umwandlungsgesetz",
      "state": "Baden-Württemberg",
      "amtsgericht": "Amtsgericht Stuttgart",
      "registernummer": "HRB 460604",
      "registerart": "HRB",
      "company_name": "Hengstler GmbH",
      "company_seat": "Aldingen",
      "details": "12.03.2025 (Bekanntmachungsdatum)\n\nBaden-Württemberg Amtsgericht Stuttgart HRB 460604\nRegisterbekanntmachung nach dem Umwandlungsgesetz 12.03.2025 (Eintragungsdatum)\n\nHengstler GmbH\nGesellschaft mit beschränkter Haftung\nAldingen\n\nAls nicht eingetragen wird bekanntgemacht:\nDen Gläubigern der an der Verschmelzung beteiligten Rechtsträger ist, wenn sie binnen sechs Monaten nach dem Tag, an dem die Eintragung der Verschmelzung in das Register des Sitzes desjenigen Rechtsträgers, dessen Gläubiger sie sind, nach § 19 Abs. 3 UmwG als bekanntgemacht gilt, ihren Anspruch nach Grund und Höhe schriftlich anmelden, Sicherheit zu leisten, soweit sie nicht Befriedigung verlangen können. Dieses Recht steht den Gläubigern jedoch nur zu, wenn sie glaubhaft machen, dass durch die Verschmelzung die Erfüllung ihrer Forderung gefährdet wird."
    },
    {
      "date": "2025-03-12",
      "id": "103553",
      "original_text": "Einreichung neuer Dokumente\nBaden-Württemberg Amtsgericht Stuttgart HRB 21442\nAlmato AG – Stuttgart",
      "type": "Einreichung neuer Dokumente",
      "state": "Baden-Württemberg",
      "amtsgericht": "Amtsgericht Stuttgart",
      "registernummer": "HRB 21442",
      "registerart": "HRB",
      "company_name": "Almato AG",
      "company_seat": "Stuttgart",
      "details": "12.03.2025 (Bekanntmachungsdatum)\n\nBaden-Württemberg Amtsgericht Stuttgart HRB 21442\nEinreichung neuer Dokumente\n\nAlmato AG\nAktiengesellschaft\nStuttgart\n\nDie Gesellschaft hat am 11.03.2025 die Liste über die Zusammensetzung des Aufsichtsrats zum Handelsregister eingereicht."
    },
    {
      "date": "2025-03-12",
      "id": "103554",
      "original_text": "Löschungsankündigung\nBaden-Württemberg Amtsgericht Ulm HRB 729242\nSPORT WIN 24 GmbH – Schwäbisch Gmünd",
      "type": "Löschungsankündigung",
      "state": "Baden-Württemberg",
      "amtsgericht": "Amtsgericht Ulm",
      "registernummer": "HRB 729242",
      "registerart": "HRB",
      "company_name": "SPORT WIN 24 GmbH",
      "company_seat": "Schwäbisch Gmünd",
      "details": "12.03.2025 (Bekanntmachungsdatum)\n\nBaden-Württemberg Amtsgericht Ulm HRB 729242\nLöschungsankündigung\n\nSPORT WIN 24 GmbH\nGesellschaft mit beschränkter Haftung\nSchwäbisch Gmünd\n\nDas Gericht beabsichtigt, die Gesellschaft wegen Vermögenslosigkeit im Handelsregister von Amts wegen nach § 394 FamFG zu löschen. Die Frist zur Geltendmachung eines Widerspruchs gegen die beabsichtigte Löschung ist auf  einen Monat ab Veröffentlichung bestimmt."
    },
    {
      "date": "2025-03-12",
      "id": "103555",
      "original_text": "Registerbekanntmachung nach dem Umwandlungsgesetz\nBaden-Württemberg Amtsgericht Stuttgart HRB 724260\nHüfftlein Immobilien GmbH – Stuttgart",
      "type": "Registerbekanntmachung nach dem Umwandlungsgesetz",
      "state": "Baden-Württemberg",
      "amtsgericht": "Amtsgericht Stuttgart",
      "registernummer": "HRB 724260",
      "registerart": "HRB",
      "company_name": "Hüfftlein Immobilien GmbH",
      "company_seat": "Stuttgart",
      "details": "12.03.2025 (Bekanntmachungsdatum)\n\nBaden-Württemberg Amtsgericht Stuttgart HRB 724260\nRegisterbekanntmachung nach dem Umwandlungsgesetz 12.03.2025 (Eintragungsdatum)\n\nHüfftlein Immobilien GmbH\nGesellschaft mit beschränkter Haftung\nStuttgart\n\nAls nicht eingetragen wird bekanntgemacht:\nDen Gläubigern der an der Verschmelzung beteiligten Rechtsträger ist, wenn sie binnen sechs Monaten nach dem Tag, an dem die Eintragung der Verschmelzung in das Register des Sitzes desjenigen Rechtsträgers, dessen Gläubiger sie sind, nach § 19 Abs. 3 UmwG als bekanntgemacht gilt, ihren Anspruch nach Grund und Höhe schriftlich anmelden, Sicherheit zu leisten, soweit sie nicht Befriedigung verlangen können. Dieses Recht steht den Gläubigern jedoch nur zu, wenn sie glaubhaft machen, dass durch die Verschmelzung die Erfüllung ihrer Forderung gefährdet wird."
    },
    {
      "date": "2025-03-12",
      "id": "103556",
      "original_text": "Sonstige Registerbekanntmachung\nBerlin Amtsgericht Berlin (Charlottenburg) HRB 97514\nEckert & Ziegler Radiopharma GmbH – Berlin",
      "type": "Sonstige Registerbekanntmachung",
      "state": "Berlin",
      "amtsgericht": "Amtsgericht Berlin (Charlottenburg)",
      "registernummer": "HRB 97514",
      "registerart": "HRB",
      "company_name": "Eckert & Ziegler Radiopharma GmbH",
      "company_seat": "Berlin",
      "details": "12.03.2025 (Bekanntmachungsdatum)\n\nBerlin Amtsgericht Berlin (Charlottenburg) HRB 97514\nSonstige Registerbekanntmachung\n\nEckert & Ziegler Radiopharma GmbH\nGesellschaft mit beschränkter Haftung\nBerlin\n\nAls nicht eingetragen wird veröffentlicht: Der andere Vertragsteil hat den Gläubigern dieses Rechtsträgers, deren Forderungen begründet worden sind, bevor die Eintragung der Beendigung dieses Vertrages in das Handelsregister nach § 10 des Handelsgesetzbuches als bekannt gemacht gilt, Sicherheit zu leisten, wenn sie sich binnen sechs Monaten nach der Bekanntmachung der Eintragung zu diesem Zweck bei ihm melden. Dieses Recht steht den Gläubigern nicht zu, die im Fall des Insolvenzverfahrens ein Recht auf vorzugsweise Befriedigung aus der Deckungsmasse haben, die nach gesetzlicher Vorschrift zu ihrem Schutz errichtet und staatlich überwacht ist."
    },
    {
      "date": "2025-03-12",
      "id": "103557",
      "original_text": "Löschungsankündigung\nSachsen Amtsgericht Chemnitz HRB 32581\nIo Vermögensverwaltungsgesellschaft mbH – Chemnitz",
      "type": "Löschungsankündigung",
      "state": "Sachsen",
      "amtsgericht": "Amtsgericht Chemnitz",
      "registernummer": "HRB 32581",
      "registerart": "HRB",
      "company_name": "Io Vermögensverwaltungsgesellschaft mbH",
      "company_seat": "Chemnitz",
      "details": "12.03.2025 (Bekanntmachungsdatum)\n\nSachsen Amtsgericht Chemnitz HRB 32581\nLöschungsankündigung 12.03.2025 (Eintragungsdatum)\n\nIo Vermögensverwaltungsgesellschaft mbH\nGesellschaft mit beschränkter Haftung\nChemnitz\n\nDas Registergericht beabsichtigt, die im Handelsregister eingetragene Gesellschaft von Amts wegen nach § 394 FamFG zu löschen. Die Frist zu Erhebung eines Widerspruchs gegen die beabsichtigte Löschung wird auf einen Monat festgesetzt."
    },
    {
      "date": "2025-03-12",
      "id": "103558",
      "original_text": "Sonstige Registerbekanntmachung\nSachsen Amtsgericht Chemnitz HRB 37243\nPOS International GmbH – Chemnitz",
      "type": "Sonstige Registerbekanntmachung",
      "state": "Sachsen",
      "amtsgericht": "Amtsgericht Chemnitz",
      "registernummer": "HRB 37243",
      "registerart": "HRB",
      "company_name": "POS International GmbH",
      "company_seat": "Chemnitz",
      "details": "12.03.2025 (Bekanntmachungsdatum)\n\nSachsen Amtsgericht Chemnitz HRB 37243\nSonstige Registerbekanntmachung 12.03.2025 (Eintragungsdatum)\n\nPOS International GmbH\nGesellschaft mit beschränkter Haftung\nChemnitz\n\nAm 12.03.2025  wurde beim Handelsregister des Amtsgerichts Chemnitz die Liste der Mitglieder des Aufsichtsrats gemäß § 52 GmbHG eingereicht."
    },
    {
      "date": "2025-03-12",
      "id": "103559",
      "original_text": "Löschungsankündigung\nSachsen Amtsgericht Leipzig VR 1748\nForum zur Aufklärung und Erneuerung e.V. – Leipzig",
      "type": "Löschungsankündigung",
      "state": "Sachsen",
      "amtsgericht": "Amtsgericht Leipzig",
      "registernummer": "VR 1748",
      "registerart": "VR",
      "company_name": "Forum zur Aufklärung und Erneuerung e.V.",
      "company_seat": "Leipzig",
      "details": "12.03.2025 (Bekanntmachungsdatum)\n\nSachsen Amtsgericht Leipzig VR 1748\nLöschungsankündigung\n\nForum zur Aufklärung und Erneuerung e.V.\neingetragener Verein\nLeipzig\n\nDas Gericht beabsichtigt, gemäß § 4 Absatz 2 Ziffer 1 der Verordnung über das Vereinsregister das Registerblatt  des Vereins zu schließen, da nach den Ermittlungen des Gerichts sämtliche Mitglieder aus dem Verein ausgeschieden sind. Zur Geltendmachung eines Widerspruchs gegen die beabsichtigte Schließung wird eine Frist von einem Monat nach der Veröffentlichung bestimmt."
    },
    {
      "date": "2025-03-12",
      "id": "103560",
      "original_text": "Einreichung neuer Dokumente\nSachsen Amtsgericht Dresden HRB 21307\nBürgerhaus Niesky GmbH – Niesky",
      "type": "Einreichung neuer Dokumente",
      "state": "Sachsen",
      "amtsgericht": "Amtsgericht Dresden",
      "registernummer": "HRB 21307",
      "registerart": "HRB",
      "company_name": "Bürgerhaus Niesky GmbH",
      "company_seat": "Niesky",
      "details": "12.03.2025 (Bekanntmachungsdatum)\n\nSachsen Amtsgericht Dresden HRB 21307\nEinreichung neuer Dokumente\n\nBürgerhaus Niesky GmbH\nGesellschaft mit beschränkter Haftung\nNiesky\n\nAm 10.03.2025 wurde beim Handelsregister des Amtsgerichts Dresden die Liste der Mitglieder des Aufsichtsrats gemäß § 52 GmbHG eingereicht."
    },
    {
      "date": "2025-03-12",
      "id": "103561",
      "original_text": "Löschungsankündigung\nSachsen Amtsgericht Chemnitz HRB 27669\nDETAC GmbH – Marienberg",
      "type": "Löschungsankündigung",
      "state": "Sachsen",
      "amtsgericht": "Amtsgericht Chemnitz",
      "registernummer": "HRB 27669",
      "registerart": "HRB",
      "company_name": "DETAC GmbH",
      "company_seat": "Marienberg",
      "details": "12.03.2025 (Bekanntmachungsdatum)\n\nSachsen Amtsgericht Chemnitz HRB 27669\nLöschungsankündigung 12.03.2025 (Eintragungsdatum)\n\nDETAC GmbH\nGesellschaft mit beschränkter Haftung\nMarienberg\n\nDas Registergericht beabsichtigt, die im Handelsregister eingetragene Gesellschaft von Amts wegen nach § 394 FamFG zu löschen. Die Frist zu Erhebung eines Widerspruchs gegen die beabsichtigte Löschung wird auf einen Monat festgesetzt."
    },
    {
      "date": "2025-03-12",
      "id": "103562",
      "original_text": "Registerbekanntmachung nach dem Umwandlungsgesetz\nNiedersachsen Amtsgericht Hannover HRA 206587\nskando energie e.K. – Hannover",
      "type": "Registerbekanntmachung nach dem Umwandlungsgesetz",
      "state": "Niedersachsen",
      "amtsgericht": "Amtsgericht Hannover",
      "registernummer": "HRA 206587",
      "registerart": "HRA",
      "company_name": "skando energie e.K.",
      "company_seat": "Hannover",
      "details": "12.03.2025 (Bekanntmachungsdatum)\n\nNiedersachsen Amtsgericht Hannover HRA 206587\nRegisterbekanntmachung nach dem Umwandlungsgesetz 12.03.2025 (Eintragungsdatum)\n\nskando energie e.K.\nEinzelkaufmann / Einzelkauffrau\nHannover\n\nDen Gläubigern der an der Ausgliederung beteiligten Rechtsträger ist, wenn sie binnen sechs Monaten nach dem Tag, an dem die Eintragung der Ausgliederung in das Register des Sitzes desjenigen Rechtsträgers, dessen Gläubiger sie sind, nach § 19 Abs. 3 UmwG als bekannt gemacht gilt, ihren Anspruch nach Grund und Höhe schriftlich anmelden, Sicherheit zu leisten, soweit sie nicht Befriedigung verlangen können. Dieses Recht steht den Gläubigern jedoch nur zu, wenn sie glaubhaft machen, dass durch die Ausgliederung die Erfüllung der Forderung gefährdet wird."
    },
    {
      "date": "2025-03-12",
      "id": "103563",
      "original_text": "Löschungsankündigung\nNiedersachsen Amtsgericht Hannover HRB 222536\nD.M.S Hoch- und Tiefbau GmbH – Langenhagen",
      "type": "Löschungsankündigung",
      "state": "Niedersachsen",
      "amtsgericht": "Amtsgericht Hannover",
      "registernummer": "HRB 222536",
      "registerart": "HRB",
      "company_name": "D.M.S Hoch- und Tiefbau GmbH",
      "company_seat": "Langenhagen",
      "details": "12.03.2025 (Bekanntmachungsdatum)\n\nNiedersachsen Amtsgericht Hannover HRB 222536\nLöschungsankündigung\n\nD.M.S Hoch- und Tiefbau GmbH\nGesellschaft mit beschränkter Haftung\nLangenhagen\n\nDas Registergericht beabsichtigt, die Gesellschaft von Amts wegen nach § 394 FamFG zu löschen. Die Frist zur Erhebung eines Widerspruchs ist auf 1 Monat ab dieser Registerbekanntmachung festgesetzt."
    },
    {
      "date": "2025-03-12",
      "id": "103564",
      "original_text": "Löschungsankündigung\nNiedersachsen Amtsgericht Hannover HRB 203981\nKnölke Gartenbau UG (haftungsbeschränkt) – Gehrden OT Everloh",
      "type": "Löschungsankündigung",
      "state": "Niedersachsen",
      "amtsgericht": "Amtsgericht Hannover",
      "registernummer": "HRB 203981",
      "registerart": "HRB",
      "company_name": "Knölke Gartenbau UG (haftungsbeschränkt)",
      "company_seat": "Gehrden OT Everloh",
      "details": "12.03.2025 (Bekanntmachungsdatum)\n\nNiedersachsen Amtsgericht Hannover HRB 203981\nLöschungsankündigung\n\nKnölke Gartenbau UG (haftungsbeschränkt)\nGesellschaft mit beschränkter Haftung\nGehrden OT Everloh\n\nDas Registergericht beabsichtigt, die Gesellschaft von Amts wegen nach § 394 FamFG zu löschen. Die Frist zur Erhebung eines Widerspruchs ist auf 1 Monat ab dieser Registerbekanntmachung festgesetzt."
    },
    {
      "date": "2025-03-12",
      "id": "103565",
      "original_text": "Registerbekanntmachung nach dem Umwandlungsgesetz\nNiedersachsen Amtsgericht Aurich HRB 200566\nFritzen & Co. Baustoffe GmbH – Emden",
      "type": "Registerbekanntmachung nach dem Umwandlungsgesetz",
      "state": "Niedersachsen",
      "amtsgericht": "Amtsgericht Aurich",
      "registernummer": "HRB 200566",
      "registerart": "HRB",
      "company_name": "Fritzen & Co. Baustoffe GmbH",
      "company_seat": "Emden",
      "details": "12.03.2025 (Bekanntmachungsdatum)\n\nNiedersachsen Amtsgericht Aurich HRB 200566\nRegisterbekanntmachung nach dem Umwandlungsgesetz 12.03.2025 (Eintragungsdatum)\n\nFritzen & Co. Baustoffe GmbH\nGesellschaft mit beschränkter Haftung\nEmden\n\nDen Gläubigern der an der Verschmelzung beteiligten Rechtsträger ist, wenn sie binnen sechs Monaten nach dem Tag, an dem die Eintragung der Verschmelzung in das Register des Sitzes desjenigen Rechtsträgers, dessen Gläubiger sie sind, nach § 19  Abs.  3 UmwG als bekannt gemacht gilt, ihren Anspruch nach Grund und Höhe schriftlich anmelden, Sicherheit zu leisten, soweit sie nicht Befriedigung verlangen können. Dieses Recht steht den Gläubigern jedoch nur zu, wenn sie glaubhaft machen, dass durch die Verschmelzung die Erfüllung der Forderung gefährdet wird."
    },
    {
      "date": "2025-03-12",
      "id": "103566",
      "original_text": "Registerbekanntmachung nach dem Umwandlungsgesetz\nNiedersachsen Amtsgericht Hannover HRB 226226\nSkando Service GmbH – Hannover",
      "type": "Registerbekanntmachung nach dem Umwandlungsgesetz",
      "state": "Niedersachsen",
      "amtsgericht": "Amtsgericht Hannover",
      "registernummer": "HRB 226226",
      "registerart": "HRB",
      "company_name": "Skando Service GmbH",
      "company_seat": "Hannover",
      "details": "12.03.2025 (Bekanntmachungsdatum)\n\nNiedersachsen Amtsgericht Hannover HRB 226226\nRegisterbekanntmachung nach dem Umwandlungsgesetz 12.03.2025 (Eintragungsdatum)\n\nSkando Service GmbH\nGesellschaft mit beschränkter Haftung\nHannover\n\nDen Gläubigern der an der Ausgliederung beteiligten Rechtsträger ist, wenn sie binnen sechs Monaten nach dem Tag, an dem die Eintragung der Ausgliederung in das Register des Sitzes desjenigen Rechtsträgers, dessen Gläubiger sie sind, nach § 19 Abs. 3 UmwG als bekannt gemacht gilt, ihren Anspruch nach Grund und Höhe schriftlich anmelden, Sicherheit zu leisten, soweit sie nicht Befriedigung verlangen können. Dieses Recht steht den Gläubigern jedoch nur zu, wenn sie glaubhaft machen, dass durch die Ausgliederung die Erfüllung der Forderung gefährdet wird."
    },
    {
      "date": "2025-03-12",
      "id": "103567",
      "original_text": "Löschungsankündigung\nNiedersachsen Amtsgericht Lüneburg HRB 202206\nZack Service GmbH – Stelle",
      "type": "Löschungsankündigung",
      "state": "Niedersachsen",
      "amtsgericht": "Amtsgericht Lüneburg",
      "registernummer": "HRB 202206",
      "registerart": "HRB",
      "company_name": "Zack Service GmbH",
      "company_seat": "Stelle",
      "details": "12.03.2025 (Bekanntmachungsdatum)\n\nNiedersachsen Amtsgericht Lüneburg HRB 202206\nLöschungsankündigung\n\nZack Service GmbH\nGesellschaft mit beschränkter Haftung\nStelle\n\nDas Registergericht beabsichtigt, die Gesellschaft von Amts wegen nach § 394 FamFG zu löschen. Die Frist zur Erhebung eines Widerspruchs ist auf 1 Monat ab dieser Registerbekanntmachung festgesetzt."
    },
    {
      "date": "2025-03-12",
      "id": "103568",
      "original_text": "Registerbekanntmachung nach dem Umwandlungsgesetz\nNiedersachsen Amtsgericht Walsrode HRB 100074\nIEA GmbH – Mariendrebber",
      "type": "Registerbekanntmachung nach dem Umwandlungsgesetz",
      "state": "Niedersachsen",
      "amtsgericht": "Amtsgericht Walsrode",
      "registernummer": "HRB 100074",
      "registerart": "HRB",
      "company_name": "IEA GmbH",
      "company_seat": "Mariendrebber",
      "details": "12.03.2025 (Bekanntmachungsdatum)\n\nNiedersachsen Amtsgericht Walsrode HRB 100074\nRegisterbekanntmachung nach dem Umwandlungsgesetz 12.03.2025 (Eintragungsdatum)\n\nIEA GmbH\nGesellschaft mit beschränkter Haftung\nMariendrebber\n\nDen Gläubigern der an der Verschmelzung beteiligten Rechtsträger ist, wenn sie binnen sechs Monaten nach dem Tag, an dem die Eintragung der Verschmelzung in das Register des Sitzes desjenigen Rechtsträgers, dessen Gläubiger sie sind, nach § 19  Abs.  3 UmwG als bekannt gemacht gilt, ihren Anspruch nach Grund und Höhe schriftlich anmelden, Sicherheit zu leisten, soweit sie nicht Befriedigung verlangen können. Dieses Recht steht den Gläubigern jedoch nur zu, wenn sie glaubhaft machen, dass durch die Verschmelzung die Erfüllung der Forderung gefährdet wird."
    },
    {
      "date": "2025-03-12",
      "id": "103569",
      "original_text": "Einreichung neuer Dokumente\nBremen Amtsgericht Bremen HRB 34685\nDAMING IT-Consulting AG – Bremen",
      "type": "Einreichung neuer Dokumente",
      "state": "Bremen",
      "amtsgericht": "Amtsgericht Bremen",
      "registernummer": "HRB 34685",
      "registerart": "HRB",
      "company_name": "DAMING IT-Consulting AG",
      "company_seat": "Bremen",
      "details": "12.03.2025 (Bekanntmachungsdatum)\n\nBremen Amtsgericht Bremen HRB 34685\nEinreichung neuer Dokumente\n\nDAMING IT-Consulting AG\nAktiengesellschaft\nBremen\n\nAls nicht eingetragen wird bekannt gemacht: Liste des Aufsichtsrats wurde eingereicht."
    },
    {
      "date": "2025-03-12",
      "id": "103570",
      "original_text": "Löschungsankündigung\nBremen Amtsgericht Bremen HRB 3737 BHV\nAC Magellan GmbH – Bremerhaven",
      "type": "Löschungsankündigung",
      "state": "Bremen",
      "amtsgericht": "Amtsgericht Bremen",
      "registernummer": "HRB 3737 BHV",
      "registerart": "HRB",
      "company_name": "AC Magellan GmbH",
      "company_seat": "Bremerhaven",
      "details": "12.03.2025 (Bekanntmachungsdatum)\n\nBremen Amtsgericht Bremen HRB 3737 BHV\nLöschungsankündigung\n\nAC Magellan GmbH\nGesellschaft mit beschränkter Haftung\nBremerhaven\n\nEs ist beabsichtigt die im Handelsregister eingetragene Gesellschaft von Amts wegen gemäß § 394 FamFG zu löschen. Gegen die Löschung kann beim AG Bremen schriftlich oder zu Protokoll der Geschäftsstelle Widerspruch eingelegt werden. Widerspruchsfrist 4 Wochen."
    },
    {
      "date": "2025-03-12",
      "id": "103571",
      "original_text": "Löschungsankündigung\nRheinland-Pfalz Amtsgericht Mainz HRB 48761\nGela Bau GmbH – Mainz",
      "type": "Löschungsankündigung",
      "state": "Rheinland-Pfalz",
      "amtsgericht": "Amtsgericht Mainz",
      "registernummer": "HRB 48761",
      "registerart": "HRB",
      "company_name": "Gela Bau GmbH",
      "company_seat": "Mainz",
      "details": "12.03.2025 (Bekanntmachungsdatum)\n\nRheinland-Pfalz Amtsgericht Mainz HRB 48761\nLöschungsankündigung\n\nGela Bau GmbH\nGesellschaft mit beschränkter Haftung\nMainz\n\nDas Registergericht beabsichtigt die Gesellschaft von Amts wegen nach § 394 FamFG zu löschen. Die Frist zur Erhebung eines Widerspruchs ist auf zwei Monate festgesetzt."
    },
    {
      "date": "2025-03-12",
      "id": "103572",
      "original_text": "Registerbekanntmachung nach dem Umwandlungsgesetz\nRheinland-Pfalz Amtsgericht Koblenz HRB 638\nTiho, Tiedemann & Homanner Verwaltungsgesellschaft mbH – Koblenz",
      "type": "Registerbekanntmachung nach dem Umwandlungsgesetz",
      "state": "Rheinland-Pfalz",
      "amtsgericht": "Amtsgericht Koblenz",
      "registernummer": "HRB 638",
      "registerart": "HRB",
      "company_name": "Tiho, Tiedemann & Homanner Verwaltungsgesellschaft mbH",
      "company_seat": "Koblenz",
      "details": "12.03.2025 (Bekanntmachungsdatum)\n\nRheinland-Pfalz Amtsgericht Koblenz HRB 638\nRegisterbekanntmachung nach dem Umwandlungsgesetz 12.03.2025 (Eintragungsdatum)\n\nTiho, Tiedemann & Homanner Verwaltungsgesellschaft mbH\nGesellschaft mit beschränkter Haftung\nKoblenz\n\nAls nicht eingetragen wird veröffentlicht: Den Gläubigern der an der Verschmelzung beteiligten Rechtsträger ist, wenn sie binnen sechs Monaten nach dem Tag, an dem die Eintragung der Verschmelzung in das Register des Sitzes desjenigen Rechtsträgers,dessen Gläubiger sie sind, nach § 19 Abs. 3 UmwG als bekannt gemacht gilt, ihren Anspruch nach Grund und Höhe schriftlich anmelden, Sicherheit zu leisten, soweit sie nicht Befriedigung verlangen können. Dieses Recht steht den Gläubigern jedoch nur zu, wenn sie glaubhaft machen, dass durch die Verschmelzung die Erfüllungd er Forderung gefährdet wird."
    },
    {
      "date": "2025-03-12",
      "id": "103573",
      "original_text": "Registerbekanntmachung nach dem Umwandlungsgesetz\nRheinland-Pfalz Amtsgericht Koblenz HRB 30252\nTiho Wolf GmbH – Koblenz",
      "type": "Registerbekanntmachung nach dem Umwandlungsgesetz",
      "state": "Rheinland-Pfalz",
      "amtsgericht": "Amtsgericht Koblenz",
      "registernummer": "HRB 30252",
      "registerart": "HRB",
      "company_name": "Tiho Wolf GmbH",
      "company_seat": "Koblenz",
      "details": "12.03.2025 (Bekanntmachungsdatum)\n\nRheinland-Pfalz Amtsgericht Koblenz HRB 30252\nRegisterbekanntmachung nach dem Umwandlungsgesetz 12.03.2025 (Eintragungsdatum)\n\nTiho Wolf GmbH\nGesellschaft mit beschränkter Haftung\nKoblenz\n\nAls nicht eingetragen wird veröffentlicht: Den Gläubigern der an der Verschmelzung beteiligten Rechtsträger ist, wenn sie binnen sechs Monaten nach dem Tag, an dem die Eintragung der Verschmelzung in das Register des Sitzes desjenigen Rechtsträgers,dessen Gläubiger sie sind, nach § 19 Abs. 3 UmwG als bekannt gemacht gilt, ihren Anspruch nach Grund und Höhe schriftlich anmelden, Sicherheit zu leisten, soweit sie nicht Befriedigung verlangen können. Dieses Recht steht den Gläubigern jedoch nur zu, wenn sie glaubhaft machen, dass durch die Verschmelzung die Erfüllungd er Forderung gefährdet wird."
    },
    {
      "date": "2025-03-12",
      "id": "103574",
      "original_text": "Sonstige Registerbekanntmachung\nRheinland-Pfalz Amtsgericht Ludwigshafen a.Rhein (Ludwigshafen) HRB 66075\nProjektgesellschaft Wohnen an der Weinstraße mbH – Speyer",
      "type": "Sonstige Registerbekanntmachung",
      "state": "Rheinland-Pfalz",
      "amtsgericht": "Amtsgericht Ludwigshafen a.Rhein (Ludwigshafen)",
      "registernummer": "HRB 66075",
      "registerart": "HRB",
      "company_name": "Projektgesellschaft Wohnen an der Weinstraße mbH",
      "company_seat": "Speyer",
      "details": "12.03.2025 (Bekanntmachungsdatum)\n\nRheinland-Pfalz Amtsgericht Ludwigshafen a.Rhein (Ludwigshafen) HRB 66075\nSonstige Registerbekanntmachung 11.03.2025 (Eintragungsdatum)\n\nProjektgesellschaft Wohnen an der Weinstraße mbH\nGesellschaft mit beschränkter Haftung\nSpeyer\n\nAls nicht eingetragen wird veröffentlicht: Den Gläubigern der Gesellschaft, deren Forderungen begründet worden sind, bevor die Eintragung der Beendigung des#DV.Art(Text=\"Art des Vertragesauswählen\",Eingabe=\"Beherrschungs- undGewinnabführungsvertrages\",\"Beherrschungsvertrages\",\n\"Gewinnabführungsvertrages\",\n\"Teilgewinnabführungsvertrages\") in das Handelsregister nach § 10 des Handelsgesetzbuches als bekanntgemacht gilt, hat der andere Vertragsteil Sicherheit zu leisten, wenn sie sich binnen sechs Monaten nach der Bekanntmachung der Eintragung zu diesem Zweck bei ihm melden."
    },
    {
      "date": "2025-03-12",
      "id": "103575",
      "original_text": "Löschungsankündigung\nNordrhein-Westfalen Amtsgericht Gütersloh HRB 12670\nKarimtech UG (haftungsbeschränkt) – Versmold",
      "type": "Löschungsankündigung",
      "state": "Nordrhein-Westfalen",
      "amtsgericht": "Amtsgericht Gütersloh",
      "registernummer": "HRB 12670",
      "registerart": "HRB",
      "company_name": "Karimtech UG (haftungsbeschränkt)",
      "company_seat": "Versmold",
      "details": "12.03.2025 (Bekanntmachungsdatum)\n\nNordrhein-Westfalen Amtsgericht Gütersloh HRB 12670\nLöschungsankündigung 12.03.2025 (Eintragungsdatum)\n\nKarimtech UG (haftungsbeschränkt)\nGesellschaft mit beschränkter Haftung\nVersmold\n\nDas Registergericht beabsichtigt die Gesellschaft von Amts wegen nach § 394 FamFG zu löschen. Die Frist zur Erhebung eines Widerspruchs ist auf einen Monat festgesetzt."
    },
    {
      "date": "2025-03-12",
      "id": "103576",
      "original_text": "Löschungsankündigung\nNordrhein-Westfalen Amtsgericht Gütersloh HRB 11540\nPluto UG (haftungsbeschränkt) – Werther",
      "type": "Löschungsankündigung",
      "state": "Nordrhein-Westfalen",
      "amtsgericht": "Amtsgericht Gütersloh",
      "registernummer": "HRB 11540",
      "registerart": "HRB",
      "company_name": "Pluto UG (haftungsbeschränkt)",
      "company_seat": "Werther",
      "details": "12.03.2025 (Bekanntmachungsdatum)\n\nNordrhein-Westfalen Amtsgericht Gütersloh HRB 11540\nLöschungsankündigung 12.03.2025 (Eintragungsdatum)\n\nPluto UG (haftungsbeschränkt)\nGesellschaft mit beschränkter Haftung\nWerther\n\nDas Registergericht beabsichtigt die Gesellschaft von Amts wegen nach § 394 FamFG zu löschen. Die Frist zur Erhebung eines Widerspruchs ist auf einen Monat festgesetzt."
    },
    {
      "date": "2025-03-12",
      "id": "103577",
      "original_text": "Löschungsankündigung\nNordrhein-Westfalen Amtsgericht Duisburg HRA 8068\nConcordia Bau und Boden AG & Co. Gewerbepark KG – Oberhausen",
      "type": "Löschungsankündigung",
      "state": "Nordrhein-Westfalen",
      "amtsgericht": "Amtsgericht Duisburg",
      "registernummer": "HRA 8068",
      "registerart": "HRA",
      "company_name": "Concordia Bau und Boden AG & Co. Gewerbepark KG",
      "company_seat": "Oberhausen",
      "details": "12.03.2025 (Bekanntmachungsdatum)\n\nNordrhein-Westfalen Amtsgericht Duisburg HRA 8068\nLöschungsankündigung\n\nConcordia Bau und Boden AG & Co. Gewerbepark KG\nKommanditgesellschaft\nOberhausen\n\nAmtsgericht Duisburg\nHRA 8068\nConcordia Bau und Boden AG & Co. Gewerbepark KG, Oberhausen\nDas Registergericht beabsichtigt, die im Handelsregister Duisburg eingetragene Gesellschaft gemäß §§ 31 Absatz 2, 6 HGB, 393 FamFG von Amts wegen zu löschen.\nWiderspruchsfrist: 3 Monate\nRechtsbehelfsbelehrung\nGegen diese Verfügung  können Sie Widerspruch einlegen.\nDer Widerspruch ist bei dem Amtsgericht - Registergericht - Duisburg, Kardinal-Galen-Straße 124-132, 47058 Duisburg, schriftlich in deutscher Sprache oder zur Niederschrift der Geschäftsstelle einzulegen. Der Widerspruch kann auch zur Niederschrift der Geschäftsstelle eines jeden Amtsgerichtes abgegeben werden.\nDer Widerspruch muss spätestens innerhalb der gesetzten Frist nach der schriftlichen Bekanntgabe der Verfügung bei dem Amtsgericht Duisburg eingegangen sein. Dies gilt auch dann, wenn der Widerspruch zur Niederschrift der Geschäftsstelle eines anderen Amtsgerichtes abgegeben wurde. Die Frist beginnt mit der schriftlichen Bekanntgabe der Verfügung.\nDer Widerspruch muss die Bezeichnung der angefochtenen Verfügung sowie die Erklärung enthalten, dass Widerspruch gegen diese Verfügung eingelegt wird. Er ist zu unterzeichnen und soll begründet werden.\nDie Einlegung ist auch durch Übertragung eines elektronischen Dokuments an die elektronische Poststelle des Gerichts möglich. Das elektronische Dokument muss für die Bearbeitung durch das Gericht geeignet und mit einer qualifizierten elektronischen Signatur der verantwortenden Person versehen sein oder von der verantwortenden Person signiert und auf einem sicheren Übermittlungsweg gemäß § 130 a ZPO nach näherer Maßgabe der Verordnung über die technischen Rahmenbedingungen des elektronischen Rechtsverkehrs und über das besondere elektronische Behördenpostfach (BGBl. I, S. 3803) eingereicht werden. Weitere Informationen erhalten Sie auf der Internetseite www.justiz.de <http://www.justiz.de>."
    },
    {
      "date": "2025-03-12",
      "id": "103578",
      "original_text": "Löschungsankündigung\nNordrhein-Westfalen Amtsgericht Gelsenkirchen HRB 16003\nTWS-Montage UG (haftungsbeschränkt) – Bottrop",
      "type": "Löschungsankündigung",
      "state": "Nordrhein-Westfalen",
      "amtsgericht": "Amtsgericht Gelsenkirchen",
      "registernummer": "HRB 16003",
      "registerart": "HRB",
      "company_name": "TWS-Montage UG (haftungsbeschränkt)",
      "company_seat": "Bottrop",
      "details": "12.03.2025 (Bekanntmachungsdatum)\n\nNordrhein-Westfalen Amtsgericht Gelsenkirchen HRB 16003\nLöschungsankündigung 04.03.2025 (Eintragungsdatum)\n\nTWS-Montage UG (haftungsbeschränkt)\nGesellschaft mit beschränkter Haftung\nBottrop\n\nDas Gericht beabsichtigt, die Gesellschaft TWS-Montage UG (haftungsbeschränkt) i. L. mit Sitz in Bottrop, HRB 16003 Amtsgericht Gelsenkirchen, wegen Vermögenslosigkeit zu löschen.\nHiermit wird denjenigen, die an der Unterlassung der Löschung ein berechtigtes Interesse haben, gem. § 394 Abs. 2 FamFG Gelegenheit gegeben, gegen dieses Vorhaben binnen eines Monats nach dieser Bekanntmachung Widerspruch einzulegen. Der Widerspruch kann schriftlich oder zu Protokoll der Geschäftsstelle erhoben werden."
    },
    {
      "date": "2025-03-12",
      "id": "103579",
      "original_text": "Löschungsankündigung\nNordrhein-Westfalen Amtsgericht Neuss HRA 6899\nRIA Opportunity Invest Limited & Co. KG – Neuss",
      "type": "Löschungsankündigung",
      "state": "Nordrhein-Westfalen",
      "amtsgericht": "Amtsgericht Neuss",
      "registernummer": "HRA 6899",
      "registerart": "HRA",
      "company_name": "RIA Opportunity Invest Limited & Co. KG",
      "company_seat": "Neuss",
      "details": "12.03.2025 (Bekanntmachungsdatum)\n\nNordrhein-Westfalen Amtsgericht Neuss HRA 6899\nLöschungsankündigung\n\nRIA Opportunity Invest Limited & Co. KG\nRechtsform ausländischen Rechts HRA\nNeuss\n\nAmtslöschung:\nDas Gericht Das Registergericht beabsichtigt, die Gesellschaft gemäß § 31 Absatz II i.V.m. § 394 Absatz IV FamFG im Handelsregister zu löschen.\nGegen die Löschung kann binnen eines Monats jeder Widerspruch erheben, der an der Unterlassung der Löschung ein berechtigtes Interesse hat."
    },
    {
      "date": "2025-03-12",
      "id": "103580",
      "original_text": "Löschungsankündigung\nNordrhein-Westfalen Amtsgericht Dortmund HRB 30346\nMichalek-Tokar GmbH – Castrop-Rauxel",
      "type": "Löschungsankündigung",
      "state": "Nordrhein-Westfalen",
      "amtsgericht": "Amtsgericht Dortmund",
      "registernummer": "HRB 30346",
      "registerart": "HRB",
      "company_name": "Michalek-Tokar GmbH",
      "company_seat": "Castrop-Rauxel",
      "details": "12.03.2025 (Bekanntmachungsdatum)\n\nNordrhein-Westfalen Amtsgericht Dortmund HRB 30346\nLöschungsankündigung 11.03.2025 (Eintragungsdatum)\n\nMichalek-Tokar GmbH\nGesellschaft mit beschränkter Haftung\nCastrop-Rauxel\n\nDas Registergericht beabsichtigt die Gesellschaft von Amts wegen nach § 394 FamFG zu löschen. Die Frist zur Erhebung eines Widerspruchs ist auf zwei Monate festgesetzt."
    },
    {
      "date": "2025-03-12",
      "id": "103581",
      "original_text": "Löschungsankündigung\nNordrhein-Westfalen Amtsgericht Düsseldorf HRB 90692\nVario BauConcept UG (haftungsbeschränkt) – Düsseldorf",
      "type": "Löschungsankündigung",
      "state": "Nordrhein-Westfalen",
      "amtsgericht": "Amtsgericht Düsseldorf",
      "registernummer": "HRB 90692",
      "registerart": "HRB",
      "company_name": "Vario BauConcept UG (haftungsbeschränkt)",
      "company_seat": "Düsseldorf",
      "details": "12.03.2025 (Bekanntmachungsdatum)\n\nNordrhein-Westfalen Amtsgericht Düsseldorf HRB 90692\nLöschungsankündigung\n\nVario BauConcept UG (haftungsbeschränkt)\nGesellschaft mit beschränkter Haftung\nDüsseldorf\n\nDas Registergericht beabsichtigt die Gesellschaft von Amts wegen nach § 394 FamFG zu löschen. Die Frist zur Erhebung eines Widerspruchs ist auf 3 Wochen festgesetzt.\n\nRechtsbehelfsbelehrung:\nDas Widerspruchsrecht steht jedem zu, der an der Unterlassung der Löschung ein berechtigtes Interesse hat. Der Widerspruch ist bei dem Amtsgericht Düsseldorf -Registergericht-, Werdener Straße 1, 40227 Düsseldorf schriftlich in deutscher Sprache oder zur Niederschrift der Geschäftsstelle einzulegen. Der Widerspruch kann auch zur Niederschrift der Geschäftsstelle eines jeden Amtsgerichtes abgegeben werden. Die Einlegung ist auch durch Übertragung eines elektronischen Dokuments an die elektronische Poststelle des Gerichts möglich. Das elektronische Dokument muss für die Bearbeitung durch das Gericht geeignet und mit einer qualifizierten elektronischen Signatur der verantwortenden Person versehen sein oder von der verantwortenden Person signiert und auf einem sicheren Übermittlungsweg gemäß § 130a ZPO nach näherer Maßgabe der Verordnung über die technischen Rahmenbedingungen des elektronischen Rechtsverkehrs und über das besondere elektronische Behördenpostfach (BGBl. I, S.3803) eingereicht werden. Weitere Informationen erhalten Sie auf der Internetseite www.justiz.de.\nDer Widerspruch muss spätestens innerhalb der gesetzten Frist nach dem Datum der Bekanntmachung der Löschungsankündigung bei dem Amtsgericht - Registergericht - Düsseldorf eingegangen sein.  Dies gilt auch dann, wenn der Widerspruch zur Niederschrift der Geschäftsstelle eines anderen Amtsgerichtes abgegeben wurde. Die Frist beginnt mit dem Tage der Bekanntmachung der Löschungsankündigung in dem für die Bekanntmachung der Eintragungen in das Handelsregister bestimmten elektronischen Informations- und Kommunikationssystem nach § 10 des Handelsgesetzbuches. Fällt das Ende der Frist auf einen Sonntag, einen allgemeinen Feiertag oder Sonnabend, so endet die Frist mit Ablauf des nächsten Werktages.\nDer Widerspruch muss die Bezeichnung der angefochtenen Löschungsankündigung sowie die Erklärung enthalten, dass Widerspruch gegen diese Löschungsankündigung eingelegt wird. Er ist zu unterzeichnen und soll begründet werden."
    },
    {
      "date": "2025-03-12",
      "id": "103582",
      "original_text": "Löschungsankündigung\nNordrhein-Westfalen Amtsgericht Düsseldorf HRB 86162\nNew Work Capital GmbH – Düsseldorf",
      "type": "Löschungsankündigung",
      "state": "Nordrhein-Westfalen",
      "amtsgericht": "Amtsgericht Düsseldorf",
      "registernummer": "HRB 86162",
      "registerart": "HRB",
      "company_name": "New Work Capital GmbH",
      "company_seat": "Düsseldorf",
      "details": "12.03.2025 (Bekanntmachungsdatum)\n\nNordrhein-Westfalen Amtsgericht Düsseldorf HRB 86162\nLöschungsankündigung\n\nNew Work Capital GmbH\nGesellschaft mit beschränkter Haftung\nDüsseldorf\n\nDas Registergericht beabsichtigt die Gesellschaft von Amts wegen nach § 394 FamFG zu löschen. Die Frist zur Erhebung eines Widerspruchs ist auf 3 Wochen festgesetzt.\n\nRechtsbehelfsbelehrung:\nDas Widerspruchsrecht steht jedem zu, der an der Unterlassung der Löschung ein berechtigtes Interesse hat. Der Widerspruch ist bei dem Amtsgericht Düsseldorf -Registergericht-, Werdener Straße 1, 40227 Düsseldorf schriftlich in deutscher Sprache oder zur Niederschrift der Geschäftsstelle einzulegen. Der Widerspruch kann auch zur Niederschrift der Geschäftsstelle eines jeden Amtsgerichtes abgegeben werden. Die Einlegung ist auch durch Übertragung eines elektronischen Dokuments an die elektronische Poststelle des Gerichts möglich. Das elektronische Dokument muss für die Bearbeitung durch das Gericht geeignet und mit einer qualifizierten elektronischen Signatur der verantwortenden Person versehen sein oder von der verantwortenden Person signiert und auf einem sicheren Übermittlungsweg gemäß § 130a ZPO nach näherer Maßgabe der Verordnung über die technischen Rahmenbedingungen des elektronischen Rechtsverkehrs und über das besondere elektronische Behördenpostfach (BGBl. I, S.3803) eingereicht werden. Weitere Informationen erhalten Sie auf der Internetseite www.justiz.de.\nDer Widerspruch muss spätestens innerhalb der gesetzten Frist nach dem Datum der Bekanntmachung der Löschungsankündigung bei dem Amtsgericht - Registergericht - Düsseldorf eingegangen sein.  Dies gilt auch dann, wenn der Widerspruch zur Niederschrift der Geschäftsstelle eines anderen Amtsgerichtes abgegeben wurde. Die Frist beginnt mit dem Tage der Bekanntmachung der Löschungsankündigung in dem für die Bekanntmachung der Eintragungen in das Handelsregister bestimmten elektronischen Informations- und Kommunikationssystem nach § 10 des Handelsgesetzbuches. Fällt das Ende der Frist auf einen Sonntag, einen allgemeinen Feiertag oder Sonnabend, so endet die Frist mit Ablauf des nächsten Werktages.\nDer Widerspruch muss die Bezeichnung der angefochtenen Löschungsankündigung sowie die Erklärung enthalten, dass Widerspruch gegen diese Löschungsankündigung eingelegt wird. Er ist zu unterzeichnen und soll begründet werden."
    },
    {
      "date": "2025-03-12",
      "id": "103583",
      "original_text": "Löschungsankündigung\nNordrhein-Westfalen Amtsgericht Neuss HRB 18243\nAJK Abriss & Tiefbau GmbH – Kaarst",
      "type": "Löschungsankündigung",
      "state": "Nordrhein-Westfalen",
      "amtsgericht": "Amtsgericht Neuss",
      "registernummer": "HRB 18243",
      "registerart": "HRB",
      "company_name": "AJK Abriss & Tiefbau GmbH",
      "company_seat": "Kaarst",
      "details": "12.03.2025 (Bekanntmachungsdatum)\n\nNordrhein-Westfalen Amtsgericht Neuss HRB 18243\nLöschungsankündigung\n\nAJK Abriss & Tiefbau GmbH\nGesellschaft mit beschränkter Haftung\nKaarst\n\nEs ist beabsichtigt, die Gesellschaft wegen Vermögenslosigkeit aufgrund des § 394 Abs. 1 FamFG zu löschen. Frist zur Geltendmachung eines Widerspruchs: 1 Monat.\n\nRechtsbehelfsbelehrung:\nGegen diese Verfügung können Sie Widerspruch einlegen.\nDer Widerspruch ist bei dem Amtsgericht Neuss - Registergericht -, Breite Str. 48, 41460 Neuss schriftlich in deutscher Sprache oder zur Niederschrift der Geschäftsstelle einzulegen.\nDer Widerspruch kann auch zur Niederschrift der Geschäftsstelle eines jeden Amtsgerichtes abgegeben werden.\nDie Einlegung ist auch durch Übertragung eines elektronischen Dokuments an die elektronische Poststelle des Gerichts möglich. Das elektronische Dokument muss für die Bearbeitung durch das Gericht geeignet und mit einer qualifizierten elektronischen Signatur der verantwortenden Person versehen sein oder von der verantwortenden Person signiert und auf einem sicheren Übermittlungsweg gemäß § 130a ZPO nach näherer Maßgabe der Verordnung über die technischen Rahmenbedingungen des elektronischen Rechtsverkehrs und über das besondere elektronische Behördenpostfach (BGBl. I, S.3803) eingereicht werden. Weitere Informationen erhalten Sie auf der Internetseite www.justiz.de.\nDer Widerspruch muss spätestens innerhalb der gesetzten Frist nach der schriftlichen Bekanntgabe der Verfügung bei dem Amtsgericht - Registergericht - Neuss eingegangen sein. Dies gilt auch dann, wenn der Widerspruch zur Niederschrift der Geschäftsstelle eines anderen Amtsgerichtes abgegeben wurde. Die Frist beginnt mit der schriftlichen Bekanntgabe der Verfügung. Die Bekanntgabe ist entweder durch Zustellung oder am dritten Tage nach Aufgabe zur Post bewirkt. Fällt das Ende der Frist auf einen Sonntag, einen allgemeinen Feiertag oder Sonnabend, so endet die Frist mit Ablauf des nächsten Werktages.\n\nDer Widerspruch muss die Bezeichnung der angefochtenen Verfügung sowie die Erklärung enthalten, dass Widerspruch gegen diese Verfügung eingelegt wird. Er ist zu unterzeichnen und soll begründet werden."
    },
    {
      "date": "2025-03-12",
      "id": "103584",
      "original_text": "Registerbekanntmachung nach dem Umwandlungsgesetz\nNordrhein-Westfalen Amtsgericht Dortmund HRA 9216\nProgas Gesellschaft mit beschränkter Haftung & Co. Kommanditgesellschaft – Dortmund",
      "type": "Registerbekanntmachung nach dem Umwandlungsgesetz",
      "state": "Nordrhein-Westfalen",
      "amtsgericht": "Amtsgericht Dortmund",
      "registernummer": "HRA 9216",
      "registerart": "HRA",
      "company_name": "Progas Gesellschaft mit beschränkter Haftung & Co. Kommanditgesellschaft",
      "company_seat": "Dortmund",
      "details": "12.03.2025 (Bekanntmachungsdatum)\n\nNordrhein-Westfalen Amtsgericht Dortmund HRA 9216\nRegisterbekanntmachung nach dem Umwandlungsgesetz 11.03.2025 (Eintragungsdatum)\n\nProgas Gesellschaft mit beschränkter Haftung & Co. Kommanditgesellschaft\nKommanditgesellschaft\nDortmund\n\nDen Gläubigern der an der Verschmelzung beteiligten Rechtsträger ist, wenn sie binnen sechs Monaten nach dem Tag, an dem die Eintragung der Verschmelzung in das Register des Sitzes desjenigen Rechtsträgers, dessen Gläubiger sie sind, nach § 19 Absatz 3 UmwG als bekanntgemacht gilt, ihren Anspruch nach Grund und Höhe schriftlich anmelden, Sicherheit zu leisten, soweit sie nicht Befriedigung verlangen können. Dieses Recht steht den Gläubigern jedoch nur zu, wenn sie glaubhaft machen, dass durch die Verschmelzung die Erfüllung ihrer Forderung gefährdet wird."
    },
    {
      "date": "2025-03-12",
      "id": "103585",
      "original_text": "Löschungsankündigung\nNordrhein-Westfalen Amtsgericht Paderborn HRB 12637\nDeinSuperheld UG (haftungsbeschränkt) – Paderborn",
      "type": "Löschungsankündigung",
      "state": "Nordrhein-Westfalen",
      "amtsgericht": "Amtsgericht Paderborn",
      "registernummer": "HRB 12637",
      "registerart": "HRB",
      "company_name": "DeinSuperheld UG (haftungsbeschränkt)",
      "company_seat": "Paderborn",
      "details": "12.03.2025 (Bekanntmachungsdatum)\n\nNordrhein-Westfalen Amtsgericht Paderborn HRB 12637\nLöschungsankündigung 12.03.2025 (Eintragungsdatum)\n\nDeinSuperheld UG (haftungsbeschränkt)\nGesellschaft mit beschränkter Haftung\nPaderborn\n\nDas Registergericht beabsichtigt die Gesellschaft von Amts wegen nach § 394 FamFG zu löschen. Die Frist zur Erhebung eines Widerspruchs ist auf einen Monat festgesetzt."
    },
    {
      "date": "2025-03-12",
      "id": "103586",
      "original_text": "Löschungsankündigung\nNordrhein-Westfalen Amtsgericht Mönchengladbach HRB 19807\nJakobs Printgroup GmbH – Erkelenz",
      "type": "Löschungsankündigung",
      "state": "Nordrhein-Westfalen",
      "amtsgericht": "Amtsgericht Mönchengladbach",
      "registernummer": "HRB 19807",
      "registerart": "HRB",
      "company_name": "Jakobs Printgroup GmbH",
      "company_seat": "Erkelenz",
      "details": "12.03.2025 (Bekanntmachungsdatum)\n\nNordrhein-Westfalen Amtsgericht Mönchengladbach HRB 19807\nLöschungsankündigung\n\nJakobs Printgroup GmbH\nGesellschaft mit beschränkter Haftung\nErkelenz\n\nJakobs Printgroup GmbH, Erkelenz (Amtsgericht Mönchengladbach, HRB 19807).\nDas Registergericht beabsichtigt, die im Handelsregister eingetragene Gesellschaft gemäß § 394 Absatz 1 FamFG wegen Vermögenslosigkeit von Amts wegen zu löschen. Gegen diese Verfügung kann Widerspruch eingelegt werden. Die Frist zur Erhebung eines Widerspruchs gegen die beabsichtigte Löschung von Amts wegen ist auf drei Monate festgesetzt."
    },
    {
      "date": "2025-03-12",
      "id": "103587",
      "original_text": "Registerbekanntmachung nach dem Umwandlungsgesetz\nNordrhein-Westfalen Amtsgericht Paderborn HRB 13770\nSonnenspa GmbH – Paderborn",
      "type": "Registerbekanntmachung nach dem Umwandlungsgesetz",
      "state": "Nordrhein-Westfalen",
      "amtsgericht": "Amtsgericht Paderborn",
      "registernummer": "HRB 13770",
      "registerart": "HRB",
      "company_name": "Sonnenspa GmbH",
      "company_seat": "Paderborn",
      "details": "12.03.2025 (Bekanntmachungsdatum)\n\nNordrhein-Westfalen Amtsgericht Paderborn HRB 13770\nRegisterbekanntmachung nach dem Umwandlungsgesetz 12.03.2025 (Eintragungsdatum)\n\nSonnenspa GmbH\nGesellschaft mit beschränkter Haftung\nPaderborn\n\nDen Gläubigern der an der formwechselnden Umwandlung beteiligten Rechtsträger ist, wenn sie binnen sechs Monaten nach dem Tag, an dem die Eintragung der formwechselnden Umwandlung in das Register des Sitzes desjenigen Rechtsträgers, dessen Gläubiger sie sind, nach § 19 Absatz 3 UmwG als bekanntgemacht gilt, ihren Anspruch nach Grund und Höhe schriftlich anmelden, Sicherheit zu leisten, soweit sie nicht Befriedigung verlangen können. Dieses Recht steht den Gläubigern jedoch nur zu, wenn sie glaubhaft machen, dass durch die formwechselnden Umwandlung die Erfüllung ihrer Forderung gefährdet wird."
    },
    {
      "date": "2025-03-12",
      "id": "103588",
      "original_text": "Löschungsankündigung\nNordrhein-Westfalen Amtsgericht Essen HRB 35036\nRK Entrümpelungen UG (haftungsbeschränkt) – Essen",
      "type": "Löschungsankündigung",
      "state": "Nordrhein-Westfalen",
      "amtsgericht": "Amtsgericht Essen",
      "registernummer": "HRB 35036",
      "registerart": "HRB",
      "company_name": "RK Entrümpelungen UG (haftungsbeschränkt)",
      "company_seat": "Essen",
      "details": "12.03.2025 (Bekanntmachungsdatum)\n\nNordrhein-Westfalen Amtsgericht Essen HRB 35036\nLöschungsankündigung\n\nRK Entrümpelungen UG (haftungsbeschränkt)\nGesellschaft mit beschränkter Haftung\nEssen\n\nDas Registergericht beabsichtigt die Gesellschaft von Amts wegen nach § 394 FamFG zu löschen. Die Frist zur Erhebung eines Widerspruchs ist auf einen Monat festgesetzt."
    },
    {
      "date": "2025-03-12",
      "id": "103589",
      "original_text": "Löschungsankündigung\nNordrhein-Westfalen Amtsgericht Düsseldorf HRB 82479\nPWR Solutions GmbH – Düsseldorf",
      "type": "Löschungsankündigung",
      "state": "Nordrhein-Westfalen",
      "amtsgericht": "Amtsgericht Düsseldorf",
      "registernummer": "HRB 82479",
      "registerart": "HRB",
      "company_name": "PWR Solutions GmbH",
      "company_seat": "Düsseldorf",
      "details": "12.03.2025 (Bekanntmachungsdatum)\n\nNordrhein-Westfalen Amtsgericht Düsseldorf HRB 82479\nLöschungsankündigung\n\nPWR Solutions GmbH\nGesellschaft mit beschränkter Haftung\nDüsseldorf\n\nDas Registergericht beabsichtigt die Gesellschaft von Amts wegen nach § 394 FamFG zu löschen. Die Frist zur Erhebung eines Widerspruchs ist auf 3 Wochen festgesetzt.\n\nRechtsbehelfsbelehrung:\nDas Widerspruchsrecht steht jedem zu, der an der Unterlassung der Löschung ein berechtigtes Interesse hat. Der Widerspruch ist bei dem Amtsgericht Düsseldorf -Registergericht-, Werdener Straße 1, 40227 Düsseldorf schriftlich in deutscher Sprache oder zur Niederschrift der Geschäftsstelle einzulegen. Der Widerspruch kann auch zur Niederschrift der Geschäftsstelle eines jeden Amtsgerichtes abgegeben werden. Die Einlegung ist auch durch Übertragung eines elektronischen Dokuments an die elektronische Poststelle des Gerichts möglich. Das elektronische Dokument muss für die Bearbeitung durch das Gericht geeignet und mit einer qualifizierten elektronischen Signatur der verantwortenden Person versehen sein oder von der verantwortenden Person signiert und auf einem sicheren Übermittlungsweg gemäß § 130a ZPO nach näherer Maßgabe der Verordnung über die technischen Rahmenbedingungen des elektronischen Rechtsverkehrs und über das besondere elektronische Behördenpostfach (BGBl. I, S.3803) eingereicht werden. Weitere Informationen erhalten Sie auf der Internetseite www.justiz.de.\nDer Widerspruch muss spätestens innerhalb der gesetzten Frist nach dem Datum der Bekanntmachung der Löschungsankündigung bei dem Amtsgericht - Registergericht - Düsseldorf eingegangen sein.  Dies gilt auch dann, wenn der Widerspruch zur Niederschrift der Geschäftsstelle eines anderen Amtsgerichtes abgegeben wurde. Die Frist beginnt mit dem Tage der Bekanntmachung der Löschungsankündigung in dem für die Bekanntmachung der Eintragungen in das Handelsregister bestimmten elektronischen Informations- und Kommunikationssystem nach § 10 des Handelsgesetzbuches. Fällt das Ende der Frist auf einen Sonntag, einen allgemeinen Feiertag oder Sonnabend, so endet die Frist mit Ablauf des nächsten Werktages.\nDer Widerspruch muss die Bezeichnung der angefochtenen Löschungsankündigung sowie die Erklärung enthalten, dass Widerspruch gegen diese Löschungsankündigung eingelegt wird. Er ist zu unterzeichnen und soll begründet werden."
    },
    {
      "date": "2025-03-12",
      "id": "103590",
      "original_text": "Löschungsankündigung\nNordrhein-Westfalen Amtsgericht Wuppertal HRB 27656\nGrabar GmbH – Wuppertal",
      "type": "Löschungsankündigung",
      "state": "Nordrhein-Westfalen",
      "amtsgericht": "Amtsgericht Wuppertal",
      "registernummer": "HRB 27656",
      "registerart": "HRB",
      "company_name": "Grabar GmbH",
      "company_seat": "Wuppertal",
      "details": "12.03.2025 (Bekanntmachungsdatum)\n\nNordrhein-Westfalen Amtsgericht Wuppertal HRB 27656\nLöschungsankündigung\n\nGrabar GmbH\nGesellschaft mit beschränkter Haftung\nWuppertal\n\nDas Registergericht beabsichtigt die Gesellschaft von Amts wegen nach § 394 FamFG zu löschen. Die Frist zur Erhebung eines Widerspruchs ist auf einen Monat festgesetzt."
    },
    {
      "date": "2025-03-12",
      "id": "103591",
      "original_text": "Registerbekanntmachung nach dem Umwandlungsgesetz\nNordrhein-Westfalen Amtsgericht Lemgo HRB 8577\nUlrich Schlotthauer Ingenieur- und Beratungsgesellschaft mbH – Lemgo",
      "type": "Registerbekanntmachung nach dem Umwandlungsgesetz",
      "state": "Nordrhein-Westfalen",
      "amtsgericht": "Amtsgericht Lemgo",
      "registernummer": "HRB 8577",
      "registerart": "HRB",
      "company_name": "Ulrich Schlotthauer Ingenieur- und Beratungsgesellschaft mbH",
      "company_seat": "Lemgo",
      "details": "12.03.2025 (Bekanntmachungsdatum)\n\nNordrhein-Westfalen Amtsgericht Lemgo HRB 8577\nRegisterbekanntmachung nach dem Umwandlungsgesetz 12.03.2025 (Eintragungsdatum)\n\nUlrich Schlotthauer Ingenieur- und Beratungsgesellschaft mbH\nGesellschaft mit beschränkter Haftung\nLemgo\n\nDen Gläubigern der an der Verschmelzung beteiligten Rechtsträger ist, wenn sie binnen sechs Monaten nach dem Tag, an dem die Eintragung der Verschmelzung in das Register des Sitzes desjenigen Rechtsträgers, dessen Gläubiger sie sind, nach § 19 Absatz 3 UmwG als bekanntgemacht gilt, ihren Anspruch nach Grund und Höhe schriftlich anmelden, Sicherheit zu leisten, soweit sie nicht Befriedigung verlangen können. Dieses Recht steht den Gläubigern jedoch nur zu, wenn sie glaubhaft machen, dass durch die Verschmelzung die Erfüllung ihrer Forderung gefährdet wird."
    },
    {
      "date": "2025-03-12",
      "id": "103592",
      "original_text": "Registerbekanntmachung nach dem Umwandlungsgesetz\nNordrhein-Westfalen Amtsgericht Düsseldorf HRB 86486\nShow MEP Beteiligungs GmbH – Düsseldorf",
      "type": "Registerbekanntmachung nach dem Umwandlungsgesetz",
      "state": "Nordrhein-Westfalen",
      "amtsgericht": "Amtsgericht Düsseldorf",
      "registernummer": "HRB 86486",
      "registerart": "HRB",
      "company_name": "Show MEP Beteiligungs GmbH",
      "company_seat": "Düsseldorf",
      "details": "12.03.2025 (Bekanntmachungsdatum)\n\nNordrhein-Westfalen Amtsgericht Düsseldorf HRB 86486\nRegisterbekanntmachung nach dem Umwandlungsgesetz\n\nShow MEP Beteiligungs GmbH\nGesellschaft mit beschränkter Haftung\nDüsseldorf\n\nDer Entwurf des grenzüberschreitenden Verschmelzungsplans ist beim Handelsregister eingereicht worden. An der grenzüberschreitenden Verschmelzung sind beteiligt als übertragende Gesellschaft die Show MEP Beteiligungs GmbH, eine Gesellschaft mit beschränkter Haftung, mit Sitz in Düsseldorf, Deutschland, als übernehmende Gesellschaft die SHOW TopCo S.C.A., eine Kommanditgesellschaft auf Aktien nach luxemburgischem Recht, mit Sitz in Luxemburg, Großherzogtum Luxemburg. Die an der grenzüberschreitenden Verschmelzung beteiligten Gesellschaften sind bei folgenden Registern eingetragen: Die Show MEP Beteiligungs GmbH ist in Deutschland im Handelsregister beim Amtsgericht Düsseldorf unter der Registernummer HRB 86486 eingetragen, die SHOW TopCo S.C.A. ist im luxemburgischen Handelsregister (Registre de Commerce et de Sociétés) unter der Nummer B232080 eingetragen (EUID: LURCSL.B232080). Die Verschmelzung bedarf nach § 312 Abs. 2 UmwG i.V.m. § 307 Abs. 3 Nr. 1 UmwG nicht der Zustimmung der Gesellschafterversammlung der Show MEP Beteiligungs GmbH, so dass die alleinige Anteilsinhaberin der Show MEP Beteiligungs GmbH Bemerkungen zum Verschmelzungsplan nicht gemäß § 312 Abs. 3 UmwG vor einem Zustimmungsbeschluss der Gesellschafterversammlung der Show MEP Beteiligungs GmbH zur Kenntnis nehmen kann. Stattdessen trifft die alleinige Anteilsinhaberin der Show MEP Beteiligungs GmbH die Entscheidung über den Abschluss des Verschmelzungsplans mit der Beurkundung des Verschmelzungsplans, die aktuell für den 27. Mai 2025 geplant ist. Anteilsinhaber, Gläubiger und Arbeitnehmer der Show MEP Beteiligungs GmbH, die Bemerkungen zum Entwurf des Verschmelzungsplans abgeben möchten, können daher Bemerkungen bis zum Tag vor dem geplanten Beurkundungstermin übermitteln. In Luxemburg können die Anteilsinhaber, Gläubiger und Arbeitnehmer der SHOW TopCo S.C.A. spätestens fünf Arbeitstage vor dem Tag der außerordentlichen Hauptversammlung der SHOW TopCo S.C.A., die über die grenzüberschreitende Verschmelzung beschließt, Bemerkungen zum Verschmelzungsplan übermitteln. Die außerordentliche Hauptversammlung der SHOW TopCo S.C.A. wird nach der Planung zum Zeitpunkt der Einreichung des Entwurfs des Verschmelzungsplans voraussichtlich am 1. August 2025 stattfinden.  Entsprechende Bemerkungen können an folgende Anschrift gerichtet werden: Show MEP Beteiligungs GmbH, c/o HSMV - Hansen Schotenroehr Müller Voets Partnerschaftsgesellschaft mbB Wirtschaftsprüfungsgesellschaft Steuerberatungsgesellschaft, Grafenberger Allee 337b, 40235 Düsseldorf. Sämtliche eingehenden Bemerkungen werden den jeweiligen Anteilsinhabern der jeweiligen Gesellschaft zur Kenntnis gebracht. Sollte der geplante Termin der Beurkundung des Verschmelzungsplans oder der außerordentlichen Hauptversammlung der Show TopCo S.C.A. beispielsweise wegen Verzögerungen dieser Bekanntmachung nicht möglich sein, wird der betreffende Termin so bald wie praktisch möglich danach, jedenfalls aber unter Einhaltung der Monatsfrist gemäß § 308 Abs. 2 UmwG seit der Einreichung des Entwurfs des Verschmelzungsplans beim Registergericht, stattfinden."
    },
    {
      "date": "2025-03-12",
      "id": "103593",
      "original_text": "Löschungsankündigung\nNordrhein-Westfalen Amtsgericht Duisburg HRB 33764\nSpeed Taxi GmbH – Duisburg",
      "type": "Löschungsankündigung",
      "state": "Nordrhein-Westfalen",
      "amtsgericht": "Amtsgericht Duisburg",
      "registernummer": "HRB 33764",
      "registerart": "HRB",
      "company_name": "Speed Taxi GmbH",
      "company_seat": "Duisburg",
      "details": "12.03.2025 (Bekanntmachungsdatum)\n\nNordrhein-Westfalen Amtsgericht Duisburg HRB 33764\nLöschungsankündigung\n\nSpeed Taxi GmbH\nGesellschaft mit beschränkter Haftung\nDuisburg\n\nDas Registergericht beabsichtigt, die im Handelsregister eingetragene Gesellschaft Speed Taxi GmbH gemäß § 394 Absatz 1 FamFG wegen Vermögenslosigkeit von Amts wegen zu löschen. Gegen diese Verfügung kann Widerspruch eingelegt werden. Die Frist zur Erhebung eines Widerspruchs gegen die beabsichtigte Löschung von Amts wegen ist auf drei Monate festgesetzt. Rechtsbehelfsbelehrung Der Widerspruch ist bei dem Amtsgericht Duisburg, Kardinal-Galen-Str. 124-132, 47058 Duisburg schriftlich in deutscher Sprache oder zur Niederschrift der Geschäftsstelle einzulegen. Der Widerspruch kann auch zur Niederschrift der Geschäftsstelle eines jeden Amtsgerichtes abgegeben werden. Die Einlegung ist auch durch Übertragung eines elektronischen Dokuments an die elektronische Poststelle des Gerichts möglich. Das elektronische Dokument muss für die Bearbeitung durch das Gericht geeignet und mit einer qualifizierten elektronischen Signatur der verantwortenden Person versehen sein oder von der verantwortenden Person signiert und auf einem sicheren Übermittlungsweg gemäß § 130 a ZPO nach näherer Maßgabe der Verordnung über die technischen Rahmenbedingungen des elektronischen Rechtsverkehrs und über das besondere elektronische Behördenpostfach (BGBl. I, S. 3803) eingereicht werden. Weitere Informationen erhalten Sie auf der Internetseite www.justiz.de <http://www.justiz.de>. Der Widerspruch muss spätestens innerhalb der gesetzten Frist bei dem Amtsgericht Duisburg eingegangen sein. Dies gilt auch dann, wenn der Widerspruch zur Niederschrift der Geschäftsstelle eines anderen Amtsgerichtes abgegeben wurde. Die Frist beginnt mit der Veröffentlichung. Fällt das Ende der Frist auf einen Sonntag, einen allgemeinen Feiertag oder Sonnabend, so endet die Frist mit Ablauf des nächsten Werktages. Der Widerspruch muss die Bezeichnung der angefochtenen Verfügung sowie die Erklärung enthalten, dass Widerspruch gegen diese Verfügung eingelegt wird. Er ist zu unterzeichnen und soll begründet werden."
    },
    {
      "date": "2025-03-12",
      "id": "103594",
      "original_text": "Registerbekanntmachung nach dem Umwandlungsgesetz\nNordrhein-Westfalen Amtsgericht Gütersloh HRA 6984\nJens Niederschulte e.K. – Verl",
      "type": "Registerbekanntmachung nach dem Umwandlungsgesetz",
      "state": "Nordrhein-Westfalen",
      "amtsgericht": "Amtsgericht Gütersloh",
      "registernummer": "HRA 6984",
      "registerart": "HRA",
      "company_name": "Jens Niederschulte e.K.",
      "company_seat": "Verl",
      "details": "12.03.2025 (Bekanntmachungsdatum)\n\nNordrhein-Westfalen Amtsgericht Gütersloh HRA 6984\nRegisterbekanntmachung nach dem Umwandlungsgesetz 12.03.2025 (Eintragungsdatum)\n\nJens Niederschulte e.K.\nEinzelkaufmann / Einzelkauffrau\nVerl\n\nDen Gläubigern der an der Ausgliederung beteiligten Rechtsträger ist, wenn sie binnen sechs Monaten nach dem Tag, an dem die Eintragung der Ausgliederung in das Register des Sitzes desjenigen Rechtsträgers, dessen Gläubiger sie sind, nach § 19 Absatz 3 UmwG als bekanntgemacht gilt, ihren Anspruch nach Grund und Höhe schriftlich anmelden, Sicherheit zu leisten, soweit sie nicht Befriedigung verlangen können. Dieses Recht steht den Gläubigern jedoch nur zu, wenn sie glaubhaft machen, dass durch die Ausgliederung die Erfüllung ihrer Forderung gefährdet wird."
    },
    {
      "date": "2025-03-12",
      "id": "103595",
      "original_text": "Registerbekanntmachung nach dem Umwandlungsgesetz\nNordrhein-Westfalen Amtsgericht Gütersloh HRB 9650\nH. + L. Verwaltungs-GmbH – Halle (Westf.)",
      "type": "Registerbekanntmachung nach dem Umwandlungsgesetz",
      "state": "Nordrhein-Westfalen",
      "amtsgericht": "Amtsgericht Gütersloh",
      "registernummer": "HRB 9650",
      "registerart": "HRB",
      "company_name": "H. + L. Verwaltungs-GmbH",
      "company_seat": "Halle (Westf.)",
      "details": "12.03.2025 (Bekanntmachungsdatum)\n\nNordrhein-Westfalen Amtsgericht Gütersloh HRB 9650\nRegisterbekanntmachung nach dem Umwandlungsgesetz 12.03.2025 (Eintragungsdatum)\n\nH. + L. Verwaltungs-GmbH\nGesellschaft mit beschränkter Haftung\nHalle (Westf.)\n\nDen Gläubigern der an der Verschmelzung beteiligten Rechtsträger ist, wenn sie binnen sechs Monaten nach dem Tag, an dem die Eintragung der Verschmelzung in das Register des Sitzes desjenigen Rechtsträgers, dessen Gläubiger sie sind, nach § 19 Absatz 3 UmwG als bekanntgemacht gilt, ihren Anspruch nach Grund und Höhe schriftlich anmelden, Sicherheit zu leisten, soweit sie nicht Befriedigung verlangen können. Dieses Recht steht den Gläubigern jedoch nur zu, wenn sie glaubhaft machen, dass durch die Verschmelzung die Erfüllung ihrer Forderung gefährdet wird."
    },
    {
      "date": "2025-03-12",
      "id": "103596",
      "original_text": "Registerbekanntmachung nach dem Umwandlungsgesetz\nNordrhein-Westfalen Amtsgericht Gütersloh HRB 5294\nHaymann GmbH Erodiertechnik – Halle (Westf.)",
      "type": "Registerbekanntmachung nach dem Umwandlungsgesetz",
      "state": "Nordrhein-Westfalen",
      "amtsgericht": "Amtsgericht Gütersloh",
      "registernummer": "HRB 5294",
      "registerart": "HRB",
      "company_name": "Haymann GmbH Erodiertechnik",
      "company_seat": "Halle (Westf.)",
      "details": "12.03.2025 (Bekanntmachungsdatum)\n\nNordrhein-Westfalen Amtsgericht Gütersloh HRB 5294\nRegisterbekanntmachung nach dem Umwandlungsgesetz 12.03.2025 (Eintragungsdatum)\n\nHaymann GmbH Erodiertechnik\nGesellschaft mit beschränkter Haftung\nHalle (Westf.)\n\nDen Gläubigern der an der Verschmelzung beteiligten Rechtsträger ist, wenn sie binnen sechs Monaten nach dem Tag, an dem die Eintragung der Verschmelzung in das Register des Sitzes desjenigen Rechtsträgers, dessen Gläubiger sie sind, nach § 19 Absatz 3 UmwG als bekanntgemacht gilt, ihren Anspruch nach Grund und Höhe schriftlich anmelden, Sicherheit zu leisten, soweit sie nicht Befriedigung verlangen können. Dieses Recht steht den Gläubigern jedoch nur zu, wenn sie glaubhaft machen, dass durch die Verschmelzung die Erfüllung ihrer Forderung gefährdet wird."
    },
    {
      "date": "2025-03-12",
      "id": "103597",
      "original_text": "Sonstige Registerbekanntmachung\nNordrhein-Westfalen Amtsgericht Lemgo HRB 3393\nEcclesia Holding GmbH – Detmold",
      "type": "Sonstige Registerbekanntmachung",
      "state": "Nordrhein-Westfalen",
      "amtsgericht": "Amtsgericht Lemgo",
      "registernummer": "HRB 3393",
      "registerart": "HRB",
      "company_name": "Ecclesia Holding GmbH",
      "company_seat": "Detmold",
      "details": "12.03.2025 (Bekanntmachungsdatum)\n\nNordrhein-Westfalen Amtsgericht Lemgo HRB 3393\nSonstige Registerbekanntmachung\n\nEcclesia Holding GmbH\nGesellschaft mit beschränkter Haftung\nDetmold\n\nDem Registergericht ist eine Liste der Mitglieder des Aufsichtsrates eingereicht worden."
    },
    {
      "date": "2025-03-12",
      "id": "103598",
      "original_text": "Löschungsankündigung\nNordrhein-Westfalen Amtsgericht Essen HRB 28757\nOFFI GmbH – Essen",
      "type": "Löschungsankündigung",
      "state": "Nordrhein-Westfalen",
      "amtsgericht": "Amtsgericht Essen",
      "registernummer": "HRB 28757",
      "registerart": "HRB",
      "company_name": "OFFI GmbH",
      "company_seat": "Essen",
      "details": "12.03.2025 (Bekanntmachungsdatum)\n\nNordrhein-Westfalen Amtsgericht Essen HRB 28757\nLöschungsankündigung\n\nOFFI GmbH\nGesellschaft mit beschränkter Haftung\nEssen\n\nDas Registergericht beabsichtigt die Gesellschaft von Amts wegen nach § 394 FamFG zu löschen. Die Frist zur Erhebung eines Widerspruchs ist auf einen Monat festgesetzt."
    },
    {
      "date": "2025-03-12",
      "id": "103599",
      "original_text": "Einreichung neuer Dokumente\nNordrhein-Westfalen Amtsgericht Gütersloh HRB 13022\nDeutsches Rotes Kreuz Leben und Wohnen Gütersloh GmbH – Gütersloh",
      "type": "Einreichung neuer Dokumente",
      "state": "Nordrhein-Westfalen",
      "amtsgericht": "Amtsgericht Gütersloh",
      "registernummer": "HRB 13022",
      "registerart": "HRB",
      "company_name": "Deutsches Rotes Kreuz Leben und Wohnen Gütersloh GmbH",
      "company_seat": "Gütersloh",
      "details": "12.03.2025 (Bekanntmachungsdatum)\n\nNordrhein-Westfalen Amtsgericht Gütersloh HRB 13022\nEinreichung neuer Dokumente\n\nDeutsches Rotes Kreuz Leben und Wohnen Gütersloh GmbH\nGesellschaft mit beschränkter Haftung\nGütersloh\n\nDem Registergericht ist eine Liste der Mitglieder des Aufsichtsrates eingereicht worden."
    },
    {
      "date": "2025-03-12",
      "id": "103600",
      "original_text": "Registerbekanntmachung nach dem Umwandlungsgesetz\nThüringen Amtsgericht Jena HRB 405181\nBessmann Verwaltungs-GmbH – Breitenworbis",
      "type": "Registerbekanntmachung nach dem Umwandlungsgesetz",
      "state": "Thüringen",
      "amtsgericht": "Amtsgericht Jena",
      "registernummer": "HRB 405181",
      "registerart": "HRB",
      "company_name": "Bessmann Verwaltungs-GmbH",
      "company_seat": "Breitenworbis",
      "details": "12.03.2025 (Bekanntmachungsdatum)\n\nThüringen Amtsgericht Jena HRB 405181\nRegisterbekanntmachung nach dem Umwandlungsgesetz 12.03.2025 (Eintragungsdatum)\n\nBessmann Verwaltungs-GmbH\nGesellschaft mit beschränkter Haftung\nBreitenworbis\n\nNicht eingetragen: Den Gläubigern der an der Verschmelzung beteiligten Rechtsträger, ist wenn sie binnen sechs Monaten nach dem Tag, an dem die Eintragung der Verschmelzung in das Register des Sitzes desjenigen Rechtsträgers, dessen Gläubiger sie sind,  nach § 19 Abs. 3 UmwG als bekanntgemacht gilt, ihren Anspruch nach Grund und Höhe schriftlich anmelden, Sicherheit zu leisten, soweit sie nicht Befriedigung verlangen können. Dieses Recht steht ihnen jedoch nur zu, wenn sie glaubhaft machen, daß durch die Verschmelzung die Erfüllung ihrer Forderung gefährdet wird."
    },
    {
      "date": "2025-03-12",
      "id": "103601",
      "original_text": "Registerbekanntmachung nach dem Umwandlungsgesetz\nThüringen Amtsgericht Jena HRA 500979\nTaxi- und Kurierbetrieb Amborn e.K. – Hörselberg-Hainich",
      "type": "Registerbekanntmachung nach dem Umwandlungsgesetz",
      "state": "Thüringen",
      "amtsgericht": "Amtsgericht Jena",
      "registernummer": "HRA 500979",
      "registerart": "HRA",
      "company_name": "Taxi- und Kurierbetrieb Amborn e.K.",
      "company_seat": "Hörselberg-Hainich",
      "details": "12.03.2025 (Bekanntmachungsdatum)\n\nThüringen Amtsgericht Jena HRA 500979\nRegisterbekanntmachung nach dem Umwandlungsgesetz 12.03.2025 (Eintragungsdatum)\n\nTaxi- und Kurierbetrieb Amborn e.K.\nEinzelkaufmann / Einzelkauffrau\nHörselberg-Hainich\n\nDas von der Erbengemeinschaft bestehend aus: Morgenweck, Robin, Gerstungen, *22.01.2001; Morgenweck, Luisa, Gerstungen, *19.06.2004; und Schumann, Mandy, Hörselberg-Hainich, *07.01.1986  unter der Firma Taxi- und Kurierbetrieb Amborn e.K. mit dem Sitz in Hörselberg-Hainich betriebene Unternehmen ist aus dem Vermögen gemäß Ausgliederungsvertrag vom 27.01.2025 auf die Taxi- und Kurierbetrieb Amborn GmbH mit dem Sitz in Eisenach (Amtsgericht Jena HRB 522015) ausgegliedert. Die Firma ist erloschen. Von Amts wegen eingetragen aufgrund § 155 UmwG; Tag der Eintragung:\n12.03.2025\nNicht eingetragen: Den Gläubigern der an der Ausgliederung beteiligten Rechtsträger, ist wenn sie binnen sechs Monaten nach dem Tag, an dem die Eintragung der Ausgliederung in das Register des Sitzes desjenigen Rechtsträgers, dessen Gläubiger sie sind, nach §§125, 19 Abs. 3 UmwG als bekanntgemacht gilt, ihren Anspruch nach Grund und Höhe schriftlich anmelden, Sicherheit zu leisten, soweit sie nicht Befriedigung verlangen können. Dieses Recht steht ihnen jedoch nur zu, wenn sie glaubhaft machen, daß durch die Ausgliederung die Erfüllung ihrer Forderung gefährdet wird."
    },
    {
      "date": "2025-03-12",
      "id": "103602",
      "original_text": "Registerbekanntmachung nach dem Umwandlungsgesetz\nThüringen Amtsgericht Jena HRB 522015\nTaxi- und Kurierbetrieb Amborn GmbH – Eisenach",
      "type": "Registerbekanntmachung nach dem Umwandlungsgesetz",
      "state": "Thüringen",
      "amtsgericht": "Amtsgericht Jena",
      "registernummer": "HRB 522015",
      "registerart": "HRB",
      "company_name": "Taxi- und Kurierbetrieb Amborn GmbH",
      "company_seat": "Eisenach",
      "details": "12.03.2025 (Bekanntmachungsdatum)\n\nThüringen Amtsgericht Jena HRB 522015\nRegisterbekanntmachung nach dem Umwandlungsgesetz 12.03.2025 (Eintragungsdatum)\n\nTaxi- und Kurierbetrieb Amborn GmbH\nGesellschaft mit beschränkter Haftung\nEisenach\n\nDie Gesellschaft hat im Wege der Ausgliederung gemäß Ausgliederungsvertrag vom 27.01.2025 sowie Beschluss ihrer Gesellschafterversammlung vom 27.01.2025 das Vermögen der Taxi- und Kurierbetrieb Amborn e.K. mit dem Sitz in Hörselberg-Hainich (Amtsgericht Jena HRA 500979) übernommen. Die Ausgliederung ist mit der zeitgleichen Eintragung im Register des Sitzes des übertragenden Rechtsträgers wirksam geworden; Tag der Eintragung: 12.03.2025\nNicht eingetragen: Den Gläubigern der an der Ausgliederung beteiligten Rechtsträger, ist wenn sie binnen sechs Monaten nach dem Tag, an dem die Eintragung der Ausgliederung in das Register des Sitzes desjenigen Rechtsträgers, dessen Gläubiger sie sind, nach §§125, 19 Abs. 3 UmwG als bekanntgemacht gilt, ihren Anspruch nach Grund und Höhe schriftlich anmelden, Sicherheit zu leisten, soweit sie nicht Befriedigung verlangen können. Dieses Recht steht ihnen jedoch nur zu, wenn sie glaubhaft machen, daß durch die Ausgliederung die Erfüllung ihrer Forderung gefährdet wird."
    },
    {
      "date": "2025-03-12",
      "id": "103603",
      "original_text": "Registerbekanntmachung nach dem Umwandlungsgesetz\nThüringen Amtsgericht Jena HRA 506915\nChris Heinemann e.K. – Gernrode",
      "type": "Registerbekanntmachung nach dem Umwandlungsgesetz",
      "state": "Thüringen",
      "amtsgericht": "Amtsgericht Jena",
      "registernummer": "HRA 506915",
      "registerart": "HRA",
      "company_name": "Chris Heinemann e.K.",
      "company_seat": "Gernrode",
      "details": "12.03.2025 (Bekanntmachungsdatum)\n\nThüringen Amtsgericht Jena HRA 506915\nRegisterbekanntmachung nach dem Umwandlungsgesetz 12.03.2025 (Eintragungsdatum)\n\nChris Heinemann e.K.\nEinzelkaufmann / Einzelkauffrau\nGernrode\n\nDas von dem Einzelkaufmann Heinemann, Chris, Gernrode, *28.07.1977 unter der Firma Chris Heinemann e.K. mit dem Sitz in Gernrode betriebene Unternehmen ist aus dem Vermögen gemäß Ausgliederungserklärung und Ausgliederungsplan vom 15.11.2024, mit Nachtrag vom 04.02.2025 auf die neu gegründete  Heinemann Reinigungsdienst GmbH mit dem Sitz in Gernrode (Amtsgericht Jena HRB 523008) ausgegliedert. Die Firma ist erloschen. Von Amts wegen eingetragen aufgrund § 155 UmwG; Tag der Eintragung:\n12.03.2025\nNicht eingetragen: Den Gläubigern der an der Ausgliederung beteiligten Rechtsträger, ist wenn sie binnen sechs Monaten nach dem Tag, an dem die Eintragung der Ausgliederung in das Register des Sitzes desjenigen Rechtsträgers, dessen Gläubiger sie sind, nach §§125, 19 Abs. 3 UmwG als bekanntgemacht gilt, ihren Anspruch nach Grund und Höhe schriftlich anmelden, Sicherheit zu leisten, soweit sie nicht Befriedigung verlangen können. Dieses Recht steht ihnen jedoch nur zu, wenn sie glaubhaft machen, daß durch die Ausgliederung die Erfüllung ihrer Forderung gefährdet wird."
    },
    {
      "date": "2025-03-12",
      "id": "103604",
      "original_text": "Löschungsankündigung\nHessen Amtsgericht Offenbach am Main HRB 52012\nRoyal Facility Management GmbH – Offenbach am Main",
      "type": "Löschungsankündigung",
      "state": "Hessen",
      "amtsgericht": "Amtsgericht Offenbach am Main",
      "registernummer": "HRB 52012",
      "registerart": "HRB",
      "company_name": "Royal Facility Management GmbH",
      "company_seat": "Offenbach am Main",
      "details": "12.03.2025 (Bekanntmachungsdatum)\n\nHessen Amtsgericht Offenbach am Main HRB 52012\nLöschungsankündigung 12.03.2025 (Eintragungsdatum)\n\nRoyal Facility Management GmbH\nGesellschaft mit beschränkter Haftung\nOffenbach am Main\n\nDas Registergericht beabsichtigt die im Handelsregister eingetragene Gesellschaft von Amts wegen nach § 394 FamFG zu löschen. Die Frist zur Erhebung eines Widerspruchs gegen die beabsichtigte Löschung wird auf 3 Monate festgesetzt."
    },
    {
      "date": "2025-03-12",
      "id": "103605",
      "original_text": "Registerbekanntmachung nach dem Umwandlungsgesetz\nHessen Amtsgericht Königstein HRB 8050\nI.I.S.E. Europe GmbH – Eppstein",
      "type": "Registerbekanntmachung nach dem Umwandlungsgesetz",
      "state": "Hessen",
      "amtsgericht": "Amtsgericht Königstein",
      "registernummer": "HRB 8050",
      "registerart": "HRB",
      "company_name": "I.I.S.E. Europe GmbH",
      "company_seat": "Eppstein",
      "details": "12.03.2025 (Bekanntmachungsdatum)\n\nHessen Amtsgericht Königstein HRB 8050\nRegisterbekanntmachung nach dem Umwandlungsgesetz 12.03.2025 (Eintragungsdatum)\n\nI.I.S.E. Europe GmbH\nGesellschaft mit beschränkter Haftung\nEppstein\n\nDen Gläubigern der an der Verschmelzung beteiligten Rechtsträger ist, wenn sie binnen sechs Monaten nach dem Tag, an dem die Eintragung der Verschmelzung in das Register des Sitzes desjenigen Rechtsträgers, dessen Gläubiger sie sind, nach § 19 Absatz 3 UmwG bekannt gemacht worden ist, ihren Anspruch nach Grund und Höhe schriftlich anmelden, Sicherheit zu leisten, soweit sie nicht Befriedigung verlangen können. Dieses Recht steht den Gläubigern jedoch nur zu, wenn sie glaubhaft machen, dass durch die Verschmelzung die Erfüllung ihrer Forderung gefährdet wird."
    },
    {
      "date": "2025-03-12",
      "id": "103606",
      "original_text": "Sonstige Registerbekanntmachung\nHessen Amtsgericht Wiesbaden VR 6404\nCanada Meets Germany Network e. V. – Wiesbaden",
      "type": "Sonstige Registerbekanntmachung",
      "state": "Hessen",
      "amtsgericht": "Amtsgericht Wiesbaden",
      "registernummer": "VR 6404",
      "registerart": "VR",
      "company_name": "Canada Meets Germany Network e. V.",
      "company_seat": "Wiesbaden",
      "details": "12.03.2025 (Bekanntmachungsdatum)\n\nHessen Amtsgericht Wiesbaden VR 6404\nSonstige Registerbekanntmachung 12.03.2025 (Eintragungsdatum)\n\nCanada Meets Germany Network e. V.\neingetragener Verein\nWiesbaden\n\nDer Verein ist aufgelöst."
    },
    {
      "date": "2025-03-12",
      "id": "103607",
      "original_text": "Löschungsankündigung\nHessen Amtsgericht Offenbach am Main HRB 52510\nPZ-Invest UG (haftungsbeschränkt) – Neu-Isenburg",
      "type": "Löschungsankündigung",
      "state": "Hessen",
      "amtsgericht": "Amtsgericht Offenbach am Main",
      "registernummer": "HRB 52510",
      "registerart": "HRB",
      "company_name": "PZ-Invest UG (haftungsbeschränkt)",
      "company_seat": "Neu-Isenburg",
      "details": "12.03.2025 (Bekanntmachungsdatum)\n\nHessen Amtsgericht Offenbach am Main HRB 52510\nLöschungsankündigung 12.03.2025 (Eintragungsdatum)\n\nPZ-Invest UG (haftungsbeschränkt)\nGesellschaft mit beschränkter Haftung\nNeu-Isenburg\n\nDas Registergericht beabsichtigt die im Handelsregister eingetragene Gesellschaft von Amts wegen nach § 394 FamFG zu löschen. Die Frist zur Erhebung eines Widerspruchs gegen die beabsichtigte Löschung wird auf 3 Monate festgesetzt."
    },
    {
      "date": "2025-03-12",
      "id": "103608",
      "original_text": "Einreichung neuer Dokumente\nHessen Amtsgericht Darmstadt HRB 101099\nI-SEC Verwaltungs SE – Kelsterbach",
      "type": "Einreichung neuer Dokumente",
      "state": "Hessen",
      "amtsgericht": "Amtsgericht Darmstadt",
      "registernummer": "HRB 101099",
      "registerart": "HRB",
      "company_name": "I-SEC Verwaltungs SE",
      "company_seat": "Kelsterbach",
      "details": "12.03.2025 (Bekanntmachungsdatum)\n\nHessen Amtsgericht Darmstadt HRB 101099\nEinreichung neuer Dokumente\n\nI-SEC Verwaltungs SE\nEuropäische Aktiengesellschaft (SE)\nKelsterbach\n\nDurch eine Änderung in den Personen der Aufsichtsratsmitglieder ist eine Liste der Mitglieder des Aufsichtsrates zum Handelsregister eingereicht worden."
    },
    {
      "date": "2025-03-12",
      "id": "103609",
      "original_text": "Löschungsankündigung\nHessen Amtsgericht Darmstadt HRB 106095\nFREX Air Cargo GmbH – Kelsterbach",
      "type": "Löschungsankündigung",
      "state": "Hessen",
      "amtsgericht": "Amtsgericht Darmstadt",
      "registernummer": "HRB 106095",
      "registerart": "HRB",
      "company_name": "FREX Air Cargo GmbH",
      "company_seat": "Kelsterbach",
      "details": "12.03.2025 (Bekanntmachungsdatum)\n\nHessen Amtsgericht Darmstadt HRB 106095\nLöschungsankündigung\n\nFREX Air Cargo GmbH\nGesellschaft mit beschränkter Haftung\nKelsterbach\n\nDas Registergericht beabsichtigt die im Handelsregister eingetragene Gesellschaft von Amts wegen nach § 394 FamFG zu löschen. Die Frist zur Erhebung eines Widerspruchs gegen die beabsichtigte Löschung wird auf 3 Monate festgesetzt."
    },
    {
      "date": "2025-03-12",
      "id": "103610",
      "original_text": "Löschungsankündigung\nHessen Amtsgericht Offenbach am Main HRB 49922\nTimeworks Dienstleistungen GmbH – Langen (Hessen)",
      "type": "Löschungsankündigung",
      "state": "Hessen",
      "amtsgericht": "Amtsgericht Offenbach am Main",
      "registernummer": "HRB 49922",
      "registerart": "HRB",
      "company_name": "Timeworks Dienstleistungen GmbH",
      "company_seat": "Langen (Hessen)",
      "details": "12.03.2025 (Bekanntmachungsdatum)\n\nHessen Amtsgericht Offenbach am Main HRB 49922\nLöschungsankündigung 12.03.2025 (Eintragungsdatum)\n\nTimeworks Dienstleistungen GmbH\nGesellschaft mit beschränkter Haftung\nLangen (Hessen)\n\nDas Registergericht beabsichtigt die im Handelsregister eingetragene Gesellschaft von Amts wegen nach § 395 FamFG zu löschen. Die Frist zur Erhebung eines Widerspruchs gegen die beabsichtigte Löschung wird auf 3 Monate festgesetzt."
    },
    {
      "date": "2025-03-12",
      "id": "103611",
      "original_text": "Registerbekanntmachung nach dem Umwandlungsgesetz\nHessen Amtsgericht Frankfurt am Main HRA 52134\nNaGa Solar Infrastruktur GmbH & Co. KG – Frankfurt am Main",
      "type": "Registerbekanntmachung nach dem Umwandlungsgesetz",
      "state": "Hessen",
      "amtsgericht": "Amtsgericht Frankfurt am Main",
      "registernummer": "HRA 52134",
      "registerart": "HRA",
      "company_name": "NaGa Solar Infrastruktur GmbH & Co. KG",
      "company_seat": "Frankfurt am Main",
      "details": "12.03.2025 (Bekanntmachungsdatum)\n\nHessen Amtsgericht Frankfurt am Main HRA 52134\nRegisterbekanntmachung nach dem Umwandlungsgesetz 12.03.2025 (Eintragungsdatum)\n\nNaGa Solar Infrastruktur GmbH & Co. KG\nKommanditgesellschaft\nFrankfurt am Main\n\nDen Gläubigern der an der formwechselnden Umwandlung beteiligten Rechtsträger ist, wenn sie binnen sechs Monaten nach dem Tag, an dem die Eintragung der formwechselnden Umwandlung in das Register des Sitzes desjenigen Rechtsträgers, dessen Gläubiger sie sind, nach § 201 UmwG bekannt gemacht worden ist, ihren Anspruch nach Grund und Höhe schriftlich anmelden, Sicherheit zu leisten, soweit sie nicht Befriedigung verlangen können. Dieses Recht steht den Gläubigern jedoch nur zu, wenn sie glaubhaft machen, dass durch die formwechselnden Umwandlung die Erfüllung ihrer Forderung gefährdet wird."
    },
    {
      "date": "2025-03-12",
      "id": "103612",
      "original_text": "Einreichung neuer Dokumente\nHessen Amtsgericht Frankfurt am Main HRB 32877\nFirst Private Investment Management KAG mbH – Frankfurt am Main",
      "type": "Einreichung neuer Dokumente",
      "state": "Hessen",
      "amtsgericht": "Amtsgericht Frankfurt am Main",
      "registernummer": "HRB 32877",
      "registerart": "HRB",
      "company_name": "First Private Investment Management KAG mbH",
      "company_seat": "Frankfurt am Main",
      "details": "12.03.2025 (Bekanntmachungsdatum)\n\nHessen Amtsgericht Frankfurt am Main HRB 32877\nEinreichung neuer Dokumente\n\nFirst Private Investment Management KAG mbH\nGesellschaft mit beschränkter Haftung\nFrankfurt am Main\n\nDurch eine Änderung in den Personen der Aufsichtsratsmitglieder ist eine Liste der Mitglieder des Aufsichtsrates zum Handelsregister eingereicht worden."
    },
    {
      "date": "2025-03-12",
      "id": "103613",
      "original_text": "Löschungsankündigung\nHessen Amtsgericht Offenbach am Main HRB 52142\nLS Marketing GmbH – Heusenstamm",
      "type": "Löschungsankündigung",
      "state": "Hessen",
      "amtsgericht": "Amtsgericht Offenbach am Main",
      "registernummer": "HRB 52142",
      "registerart": "HRB",
      "company_name": "LS Marketing GmbH",
      "company_seat": "Heusenstamm",
      "details": "12.03.2025 (Bekanntmachungsdatum)\n\nHessen Amtsgericht Offenbach am Main HRB 52142\nLöschungsankündigung 12.03.2025 (Eintragungsdatum)\n\nLS Marketing GmbH\nGesellschaft mit beschränkter Haftung\nHeusenstamm\n\nDas Registergericht beabsichtigt die im Handelsregister eingetragene Gesellschaft von Amts wegen nach § 394 FamFG zu löschen. Die Frist zur Erhebung eines Widerspruchs gegen die beabsichtigte Löschung wird auf 3 Monate festgesetzt."
    },
    {
      "date": "2025-03-12",
      "id": "103614",
      "original_text": "Registerbekanntmachung nach dem Umwandlungsgesetz\nHessen Amtsgericht Friedberg HRB 10005\nPNBK Transport GmbH – Bad Nauheim",
      "type": "Registerbekanntmachung nach dem Umwandlungsgesetz",
      "state": "Hessen",
      "amtsgericht": "Amtsgericht Friedberg",
      "registernummer": "HRB 10005",
      "registerart": "HRB",
      "company_name": "PNBK Transport GmbH",
      "company_seat": "Bad Nauheim",
      "details": "12.03.2025 (Bekanntmachungsdatum)\n\nHessen Amtsgericht Friedberg HRB 10005\nRegisterbekanntmachung nach dem Umwandlungsgesetz 12.03.2025 (Eintragungsdatum)\n\nPNBK Transport GmbH\nGesellschaft mit beschränkter Haftung\nBad Nauheim\n\nDen Gläubigern der an der Verschmelzung beteiligten Rechtsträger ist, wenn sie binnen sechs Monaten nach dem Tag, an dem die Eintragung der Verschmelzung in das Register des Sitzes desjenigen Rechtsträgers, dessen Gläubiger sie sind, nach § 19 Absatz 3 UmwG bekannt gemacht worden ist, ihren Anspruch nach Grund und Höhe schriftlich anmelden, Sicherheit zu leisten, soweit sie nicht Befriedigung verlangen können. Dieses Recht steht den Gläubigern jedoch nur zu, wenn sie glaubhaft machen, dass durch die Verschmelzung die Erfüllung ihrer Forderung gefährdet wird."
    },
    {
      "date": "2025-03-12",
      "id": "103615",
      "original_text": "Löschungsankündigung\nHessen Amtsgericht Darmstadt HRB 99533\nSAMA Cosmetics GmbH – Darmstadt",
      "type": "Löschungsankündigung",
      "state": "Hessen",
      "amtsgericht": "Amtsgericht Darmstadt",
      "registernummer": "HRB 99533",
      "registerart": "HRB",
      "company_name": "SAMA Cosmetics GmbH",
      "company_seat": "Darmstadt",
      "details": "12.03.2025 (Bekanntmachungsdatum)\n\nHessen Amtsgericht Darmstadt HRB 99533\nLöschungsankündigung\n\nSAMA Cosmetics GmbH\nGesellschaft mit beschränkter Haftung\nDarmstadt\n\nDas Registergericht beabsichtigt die im Handelsregister eingetragene Gesellschaft von Amts wegen nach § 394 FamFG zu löschen. Die Frist zur Erhebung eines Widerspruchs gegen die beabsichtigte Löschung wird auf 3 Monate festgesetzt."
    },
    {
      "date": "2025-03-12",
      "id": "103616",
      "original_text": "Löschungsankündigung\nHessen Amtsgericht Offenbach am Main HRB 46062\nTOPKAPI GmbH – Dietzenbach",
      "type": "Löschungsankündigung",
      "state": "Hessen",
      "amtsgericht": "Amtsgericht Offenbach am Main",
      "registernummer": "HRB 46062",
      "registerart": "HRB",
      "company_name": "TOPKAPI GmbH",
      "company_seat": "Dietzenbach",
      "details": "12.03.2025 (Bekanntmachungsdatum)\n\nHessen Amtsgericht Offenbach am Main HRB 46062\nLöschungsankündigung 12.03.2025 (Eintragungsdatum)\n\nTOPKAPI GmbH\nGesellschaft mit beschränkter Haftung\nDietzenbach\n\nDas Registergericht beabsichtigt die im Handelsregister eingetragene Gesellschaft von Amts wegen nach § 394 FamFG zu löschen. Die Frist zur Erhebung eines Widerspruchs gegen die beabsichtigte Löschung wird auf 3 Monate festgesetzt."
    },
    {
      "date": "2025-03-12",
      "id": "103617",
      "original_text": "Einreichung neuer Dokumente\nHessen Amtsgericht Offenbach am Main HRB 56382\nKARL MAYER Verwaltungsgesellschaft SE – Obertshausen",
      "type": "Einreichung neuer Dokumente",
      "state": "Hessen",
      "amtsgericht": "Amtsgericht Offenbach am Main",
      "registernummer": "HRB 56382",
      "registerart": "HRB",
      "company_name": "KARL MAYER Verwaltungsgesellschaft SE",
      "company_seat": "Obertshausen",
      "details": "12.03.2025 (Bekanntmachungsdatum)\n\nHessen Amtsgericht Offenbach am Main HRB 56382\nEinreichung neuer Dokumente 12.03.2025 (Eintragungsdatum)\n\nKARL MAYER Verwaltungsgesellschaft SE\nEuropäische Aktiengesellschaft (SE)\nObertshausen\n\nDurch eine Änderung in den Personen der Aufsichtsratsmitglieder ist eine Liste der Mitglieder des Aufsichtsrates zum Handelsregister eingereicht worden."
    },
    {
      "date": "2025-03-12",
      "id": "103618",
      "original_text": "Registerbekanntmachung nach dem Umwandlungsgesetz\nHessen Amtsgericht Gießen HRA 5542\nVDGreenTec e.K. – Biebertal",
      "type": "Registerbekanntmachung nach dem Umwandlungsgesetz",
      "state": "Hessen",
      "amtsgericht": "Amtsgericht Gießen",
      "registernummer": "HRA 5542",
      "registerart": "HRA",
      "company_name": "VDGreenTec e.K.",
      "company_seat": "Biebertal",
      "details": "12.03.2025 (Bekanntmachungsdatum)\n\nHessen Amtsgericht Gießen HRA 5542\nRegisterbekanntmachung nach dem Umwandlungsgesetz 12.03.2025 (Eintragungsdatum)\n\nVDGreenTec e.K.\nEinzelkaufmann / Einzelkauffrau\nBiebertal\n\nDen Gläubigern der an der Ausgliederung beteiligten Rechtsträger ist, wenn sie binnen sechs Monaten nach dem Tag, an dem die Eintragung der Ausgliederung in das Register des Sitzes desjenigen Rechtsträgers, dessen Gläubiger sie sind, nach §§ 125, 19 Absatz 3 UmwG bekannt gemacht worden ist, ihren Anspruch nach Grund und Höhe schriftlich anmelden, Sicherheit zu leisten, soweit sie nicht Befriedigung verlangen können. Dieses Recht steht den Gläubigern jedoch nur zu, wenn sie glaubhaft machen, dass durch die Ausgliederung die Erfüllung ihrer Forderung gefährdet wird."
    },
    {
      "date": "2025-03-12",
      "id": "103619",
      "original_text": "Registerbekanntmachung nach dem Umwandlungsgesetz\nHessen Amtsgericht Königstein HRA 4288\nImproved Reading International, Wolfgang Schmitz e.K. – Eppstein",
      "type": "Registerbekanntmachung nach dem Umwandlungsgesetz",
      "state": "Hessen",
      "amtsgericht": "Amtsgericht Königstein",
      "registernummer": "HRA 4288",
      "registerart": "HRA",
      "company_name": "Improved Reading International, Wolfgang Schmitz e.K.",
      "company_seat": "Eppstein",
      "details": "12.03.2025 (Bekanntmachungsdatum)\n\nHessen Amtsgericht Königstein HRA 4288\nRegisterbekanntmachung nach dem Umwandlungsgesetz 12.03.2025 (Eintragungsdatum)\n\nImproved Reading International, Wolfgang Schmitz e.K.\nEinzelkaufmann / Einzelkauffrau\nEppstein\n\nDen Gläubigern der an der Verschmelzung beteiligten Rechtsträger ist, wenn sie binnen sechs Monaten nach dem Tag, an dem die Eintragung der Verschmelzung in das Register des Sitzes desjenigen Rechtsträgers, dessen Gläubiger sie sind, nach § 19 Absatz 3 UmwG bekannt gemacht worden ist, ihren Anspruch nach Grund und Höhe schriftlich anmelden, Sicherheit zu leisten, soweit sie nicht Befriedigung verlangen können. Dieses Recht steht den Gläubigern jedoch nur zu, wenn sie glaubhaft machen, dass durch die Verschmelzung die Erfüllung ihrer Forderung gefährdet wird."
    },
    {
      "date": "2025-03-12",
      "id": "103620",
      "original_text": "Sonstige Registerbekanntmachung\nHessen Amtsgericht Darmstadt HRB 102744\nacoris AG – Darmstadt",
      "type": "Sonstige Registerbekanntmachung",
      "state": "Hessen",
      "amtsgericht": "Amtsgericht Darmstadt",
      "registernummer": "HRB 102744",
      "registerart": "HRB",
      "company_name": "acoris AG",
      "company_seat": "Darmstadt",
      "details": "12.03.2025 (Bekanntmachungsdatum)\n\nHessen Amtsgericht Darmstadt HRB 102744\nSonstige Registerbekanntmachung 12.03.2025 (Eintragungsdatum)\n\nacoris AG\nAktiengesellschaft\nDarmstadt\n\nDurch eine Änderung in den Personen der Aufsichtsratsmitglieder ist eine Liste der Mitglieder des Aufsichtsrates zum Handelsregister eingereicht worden."
    },
    {
      "date": "2025-03-12",
      "id": "103621",
      "original_text": "Löschungsankündigung\nHessen Amtsgericht Offenbach am Main HRB 20512\nE l i t e Lederwaren Gesellschaft mit beschränkter Haftung – Mainhausen",
      "type": "Löschungsankündigung",
      "state": "Hessen",
      "amtsgericht": "Amtsgericht Offenbach am Main",
      "registernummer": "HRB 20512",
      "registerart": "HRB",
      "company_name": "E l i t e Lederwaren Gesellschaft mit beschränkter Haftung",
      "company_seat": "Mainhausen",
      "details": "12.03.2025 (Bekanntmachungsdatum)\n\nHessen Amtsgericht Offenbach am Main HRB 20512\nLöschungsankündigung 12.03.2025 (Eintragungsdatum)\n\nE l i t e Lederwaren Gesellschaft mit beschränkter Haftung\nGesellschaft mit beschränkter Haftung\nMainhausen\n\nDas Registergericht beabsichtigt die im Handelsregister eingetragene Gesellschaft von Amts wegen nach § 394 FamFG zu löschen. Die Frist zur Erhebung eines Widerspruchs gegen die beabsichtigte Löschung wird auf 3 Monate festgesetzt."
    },
    {
      "date": "2025-03-12",
      "id": "103622",
      "original_text": "Löschungsankündigung\nHessen Amtsgericht Darmstadt HRB 101545\nSplanix GmbH – Darmstadt",
      "type": "Löschungsankündigung",
      "state": "Hessen",
      "amtsgericht": "Amtsgericht Darmstadt",
      "registernummer": "HRB 101545",
      "registerart": "HRB",
      "company_name": "Splanix GmbH",
      "company_seat": "Darmstadt",
      "details": "12.03.2025 (Bekanntmachungsdatum)\n\nHessen Amtsgericht Darmstadt HRB 101545\nLöschungsankündigung\n\nSplanix GmbH\nGesellschaft mit beschränkter Haftung\nDarmstadt\n\nDas Registergericht beabsichtigt die im Handelsregister eingetragene Gesellschaft von Amts wegen nach § 394 FamFG zu löschen. Die Frist zur Erhebung eines Widerspruchs gegen die beabsichtigte Löschung wird auf 3 Monate festgesetzt."
    },
    {
      "date": "2025-03-12",
      "id": "103623",
      "original_text": "Löschungsankündigung\nHessen Amtsgericht Offenbach am Main HRB 52812\nGreenSmile UG (haftungsbeschränkt) – Neu-Isenburg",
      "type": "Löschungsankündigung",
      "state": "Hessen",
      "amtsgericht": "Amtsgericht Offenbach am Main",
      "registernummer": "HRB 52812",
      "registerart": "HRB",
      "company_name": "GreenSmile UG (haftungsbeschränkt)",
      "company_seat": "Neu-Isenburg",
      "details": "12.03.2025 (Bekanntmachungsdatum)\n\nHessen Amtsgericht Offenbach am Main HRB 52812\nLöschungsankündigung 12.03.2025 (Eintragungsdatum)\n\nGreenSmile UG (haftungsbeschränkt)\nGesellschaft mit beschränkter Haftung\nNeu-Isenburg\n\nDas Registergericht beabsichtigt die im Handelsregister eingetragene Gesellschaft von Amts wegen nach § 394 FamFG zu löschen. Die Frist zur Erhebung eines Widerspruchs gegen die beabsichtigte Löschung wird auf 3 Monate festgesetzt."
    },
    {
      "date": "2025-03-12",
      "id": "103624",
      "original_text": "Registerbekanntmachung nach dem Umwandlungsgesetz\nHessen Amtsgericht Frankfurt am Main HRB 138022\nNaGa Solar Infrastruktur GmbH – Frankfurt am Main",
      "type": "Registerbekanntmachung nach dem Umwandlungsgesetz",
      "state": "Hessen",
      "amtsgericht": "Amtsgericht Frankfurt am Main",
      "registernummer": "HRB 138022",
      "registerart": "HRB",
      "company_name": "NaGa Solar Infrastruktur GmbH",
      "company_seat": "Frankfurt am Main",
      "details": "12.03.2025 (Bekanntmachungsdatum)\n\nHessen Amtsgericht Frankfurt am Main HRB 138022\nRegisterbekanntmachung nach dem Umwandlungsgesetz 12.03.2025 (Eintragungsdatum)\n\nNaGa Solar Infrastruktur GmbH\nGesellschaft mit beschränkter Haftung\nFrankfurt am Main\n\nDen Gläubigern der an der formwechselnden Umwandlung beteiligten Rechtsträger ist, wenn sie binnen sechs Monaten nach dem Tag, an dem die Eintragung der formwechselnden Umwandlung in das Register des Sitzes desjenigen Rechtsträgers, dessen Gläubiger sie sind, nach § 201 UmwG bekannt gemacht worden ist, ihren Anspruch nach Grund und Höhe schriftlich anmelden, Sicherheit zu leisten, soweit sie nicht Befriedigung verlangen können. Dieses Recht steht den Gläubigern jedoch nur zu, wenn sie glaubhaft machen, dass durch die formwechselnden Umwandlung die Erfüllung ihrer Forderung gefährdet wird."
    }
  ]
}