{
  "date": "2025-03-13",
  "date_of_scrape": "2025-03-14T04:08:35.259Z",
  "tool_version": "0.2.0",
  "number_of_announcements": 135,
  "announcements": [
    {
      "date": "2025-03-13",
      "id": "103625",
      "original_text": "Löschungsankündigung\nBayern Amtsgericht Kempten (Allgäu) HRA 10309\nBürgerwind Apfeltrang GmbH & Co. KG – Marktoberdorf",
      "type": "Löschungsankündigung",
      "state": "Bayern",
      "amtsgericht": "Amtsgericht Kempten (Allgäu)",
      "registernummer": "HRA 10309",
      "registerart": "HRA",
      "company_name": "Bürgerwind Apfeltrang GmbH & Co. KG",
      "company_seat": "Marktoberdorf",
      "details": "13.03.2025 (Bekanntmachungsdatum)\n\nBayern Amtsgericht Kempten (Allgäu) HRA 10309\nLöschungsankündigung\n\nBürgerwind Apfeltrang GmbH & Co. KG\nKommanditgesellschaft\nMarktoberdorf\n\nDas Registergericht beabsichtigt, die im Handelsregister eingetragene Firma wegen Vermögenslosigkeit von Amts wegen nach § 394 FamFG zu löschen. Die Frist zur Erhebung eines Widerspruchs ist auf einen Monat festgesetzt."
    },
    {
      "date": "2025-03-13",
      "id": "103626",
      "original_text": "Registerbekanntmachung nach dem Umwandlungsgesetz\nBayern Amtsgericht Fürth HRB 14314\nGBI Wohnungsbau GmbH – Erlangen",
      "type": "Registerbekanntmachung nach dem Umwandlungsgesetz",
      "state": "Bayern",
      "amtsgericht": "Amtsgericht Fürth",
      "registernummer": "HRB 14314",
      "registerart": "HRB",
      "company_name": "GBI Wohnungsbau GmbH",
      "company_seat": "Erlangen",
      "details": "13.03.2025 (Bekanntmachungsdatum)\n\nBayern Amtsgericht Fürth HRB 14314\nRegisterbekanntmachung nach dem Umwandlungsgesetz 12.03.2025 (Eintragungsdatum)\n\nGBI Wohnungsbau GmbH\nGesellschaft mit beschränkter Haftung\nErlangen\n\nDen Gläubigern der an der Verschmelzung beteiligten Rechtsträger ist, wenn sie binnen sechs Monaten nach dem Tag, an dem die Eintragung der Verschmelzung in das Register des Sitzes desjenigen Rechtsträgers, dessen Gläubiger sie sind, nach § 19 Abs. 3 UmwG als bekannt gemacht gilt, ihren Anspruch nach Grund und Höhe in Textform anmelden, Sicherheit zu leisten, soweit sie nicht Befriedigung verlangen können. Dieses Recht steht den Gläubigern jedoch nur zu, wenn sie glaubhaft machen, dass durch die Verschmelzung die Erfüllung ihrer Forderung gefährdet wird."
    },
    {
      "date": "2025-03-13",
      "id": "103627",
      "original_text": "Registerbekanntmachung nach dem Umwandlungsgesetz\nBayern Amtsgericht Fürth HRB 17586\nGBI Wohnbau 10 GmbH – Erlangen",
      "type": "Registerbekanntmachung nach dem Umwandlungsgesetz",
      "state": "Bayern",
      "amtsgericht": "Amtsgericht Fürth",
      "registernummer": "HRB 17586",
      "registerart": "HRB",
      "company_name": "GBI Wohnbau 10 GmbH",
      "company_seat": "Erlangen",
      "details": "13.03.2025 (Bekanntmachungsdatum)\n\nBayern Amtsgericht Fürth HRB 17586\nRegisterbekanntmachung nach dem Umwandlungsgesetz 12.03.2025 (Eintragungsdatum)\n\nGBI Wohnbau 10 GmbH\nGesellschaft mit beschränkter Haftung\nErlangen\n\nDen Gläubigern der an der Verschmelzung beteiligten Rechtsträger ist, wenn sie binnen sechs Monaten nach dem Tag, an dem die Eintragung der Verschmelzung in das Register des Sitzes desjenigen Rechtsträgers, dessen Gläubiger sie sind, nach § 19 Abs. 3 UmwG als bekannt gemacht gilt, ihren Anspruch nach Grund und Höhe in Textform anmelden, Sicherheit zu leisten, soweit sie nicht Befriedigung verlangen können. Dieses Recht steht den Gläubigern jedoch nur zu, wenn sie glaubhaft machen, dass durch die Verschmelzung die Erfüllung ihrer Forderung gefährdet wird."
    },
    {
      "date": "2025-03-13",
      "id": "103628",
      "original_text": "Registerbekanntmachung nach dem Umwandlungsgesetz\nBayern Amtsgericht Fürth HRB 17139\nGBI Wohnbau 4 GmbH – Erlangen",
      "type": "Registerbekanntmachung nach dem Umwandlungsgesetz",
      "state": "Bayern",
      "amtsgericht": "Amtsgericht Fürth",
      "registernummer": "HRB 17139",
      "registerart": "HRB",
      "company_name": "GBI Wohnbau 4 GmbH",
      "company_seat": "Erlangen",
      "details": "13.03.2025 (Bekanntmachungsdatum)\n\nBayern Amtsgericht Fürth HRB 17139\nRegisterbekanntmachung nach dem Umwandlungsgesetz 12.03.2025 (Eintragungsdatum)\n\nGBI Wohnbau 4 GmbH\nGesellschaft mit beschränkter Haftung\nErlangen\n\nDen Gläubigern der an der Verschmelzung beteiligten Rechtsträger ist, wenn sie binnen sechs Monaten nach dem Tag, an dem die Eintragung der Verschmelzung in das Register des Sitzes desjenigen Rechtsträgers, dessen Gläubiger sie sind, nach § 19 Abs. 3 UmwG als bekannt gemacht gilt, ihren Anspruch nach Grund und Höhe in Textform anmelden, Sicherheit zu leisten, soweit sie nicht Befriedigung verlangen können. Dieses Recht steht den Gläubigern jedoch nur zu, wenn sie glaubhaft machen, dass durch die Verschmelzung die Erfüllung ihrer Forderung gefährdet wird."
    },
    {
      "date": "2025-03-13",
      "id": "103629",
      "original_text": "Registerbekanntmachung nach dem Umwandlungsgesetz\nBayern Amtsgericht Augsburg HRB 8670\nLabKom Biochemische Dienstleistungen GmbH – Augsburg",
      "type": "Registerbekanntmachung nach dem Umwandlungsgesetz",
      "state": "Bayern",
      "amtsgericht": "Amtsgericht Augsburg",
      "registernummer": "HRB 8670",
      "registerart": "HRB",
      "company_name": "LabKom Biochemische Dienstleistungen GmbH",
      "company_seat": "Augsburg",
      "details": "13.03.2025 (Bekanntmachungsdatum)\n\nBayern Amtsgericht Augsburg HRB 8670\nRegisterbekanntmachung nach dem Umwandlungsgesetz 12.03.2025 (Eintragungsdatum)\n\nLabKom Biochemische Dienstleistungen GmbH\nGesellschaft mit beschränkter Haftung\nAugsburg\n\nDen Gläubigern der an der Verschmelzung beteiligten Rechtsträger ist, wenn sie binnen sechs Monaten nach dem Tag, an dem die Eintragung der Verschmelzung in das Register des Sitzes desjenigen Rechtsträgers, dessen Gläubiger sie sind, nach § 19 Abs. 3 UmwG als bekannt gemacht gilt, ihren Anspruch nach Grund und Höhe in Textform anmelden, Sicherheit zu leisten, soweit sie nicht Befriedigung verlangen können. Dieses Recht steht den Gläubigern jedoch nur zu, wenn sie glaubhaft machen, dass durch die Verschmelzung die Erfüllung ihrer Forderung gefährdet wird."
    },
    {
      "date": "2025-03-13",
      "id": "103630",
      "original_text": "Registerbekanntmachung nach dem Umwandlungsgesetz\nBayern Amtsgericht München HRB 284101\nHSA Group Holding AG – München",
      "type": "Registerbekanntmachung nach dem Umwandlungsgesetz",
      "state": "Bayern",
      "amtsgericht": "Amtsgericht München",
      "registernummer": "HRB 284101",
      "registerart": "HRB",
      "company_name": "HSA Group Holding AG",
      "company_seat": "München",
      "details": "13.03.2025 (Bekanntmachungsdatum)\n\nBayern Amtsgericht München HRB 284101\nRegisterbekanntmachung nach dem Umwandlungsgesetz 12.03.2025 (Eintragungsdatum)\n\nHSA Group Holding AG\nAktiengesellschaft\nMünchen\n\nDen Gläubigern des formwechselnden Rechtsträgers ist, wenn sie binnen sechs Monaten nach dem Tag, an dem die Eintragung des Formwechsels nach § 201 UmwG als bekannt gemacht gilt, ihren Anspruch nach Grund und Höhe in Textform anmelden, Sicherheit zu leisten, soweit sie nicht Befriedigung verlangen können. Dieses Recht steht den Gläubigern jedoch nur zu, wenn sie glaubhaft machen, dass durch den Formwechsel die Erfüllung ihrer Forderung gefährdet wird."
    },
    {
      "date": "2025-03-13",
      "id": "103631",
      "original_text": "Einreichung neuer Dokumente\nBayern Amtsgericht München HRB 199675\nOSRAM Licht AG – München",
      "type": "Einreichung neuer Dokumente",
      "state": "Bayern",
      "amtsgericht": "Amtsgericht München",
      "registernummer": "HRB 199675",
      "registerart": "HRB",
      "company_name": "OSRAM Licht AG",
      "company_seat": "München",
      "details": "13.03.2025 (Bekanntmachungsdatum)\n\nBayern Amtsgericht München HRB 199675\nEinreichung neuer Dokumente\n\nOSRAM Licht AG\nAktiengesellschaft\nMünchen\n\nDem Amtsgericht München -Registergericht- ist eine Liste der Mitglieder des Aufsichtsrats eingereicht worden, § 106 AktG."
    },
    {
      "date": "2025-03-13",
      "id": "103632",
      "original_text": "Registerbekanntmachung nach dem Umwandlungsgesetz\nBayern Amtsgericht Kempten (Allgäu) HRB 12794\nE.V.A. GmbH – Oberreute",
      "type": "Registerbekanntmachung nach dem Umwandlungsgesetz",
      "state": "Bayern",
      "amtsgericht": "Amtsgericht Kempten (Allgäu)",
      "registernummer": "HRB 12794",
      "registerart": "HRB",
      "company_name": "E.V.A. GmbH",
      "company_seat": "Oberreute",
      "details": "13.03.2025 (Bekanntmachungsdatum)\n\nBayern Amtsgericht Kempten (Allgäu) HRB 12794\nRegisterbekanntmachung nach dem Umwandlungsgesetz 12.03.2025 (Eintragungsdatum)\n\nE.V.A. GmbH\nGesellschaft mit beschränkter Haftung\nOberreute\n\nDen Gläubigern der an der Verschmelzung beteiligten Rechtsträger ist, wenn sie binnen sechs Monaten nach dem Tag, an dem die Eintragung der Verschmelzung in das Register des Sitzes desjenigen Rechtsträgers, dessen Gläubiger sie sind, nach § 19 Abs. 3 UmwG als bekannt gemacht gilt, ihren Anspruch nach Grund und Höhe in Textform anmelden, Sicherheit zu leisten, soweit sie nicht Befriedigung verlangen können. Dieses Recht steht den Gläubigern jedoch nur zu, wenn sie glaubhaft machen, dass durch die Verschmelzung die Erfüllung ihrer Forderung gefährdet wird."
    },
    {
      "date": "2025-03-13",
      "id": "103633",
      "original_text": "Registerbekanntmachung nach dem Umwandlungsgesetz\nBayern Amtsgericht Augsburg HRB 40701\nZimmerei Holzbau Reisach GmbH – Landsberg am Lech",
      "type": "Registerbekanntmachung nach dem Umwandlungsgesetz",
      "state": "Bayern",
      "amtsgericht": "Amtsgericht Augsburg",
      "registernummer": "HRB 40701",
      "registerart": "HRB",
      "company_name": "Zimmerei Holzbau Reisach GmbH",
      "company_seat": "Landsberg am Lech",
      "details": "13.03.2025 (Bekanntmachungsdatum)\n\nBayern Amtsgericht Augsburg HRB 40701\nRegisterbekanntmachung nach dem Umwandlungsgesetz 12.03.2025 (Eintragungsdatum)\n\nZimmerei Holzbau Reisach GmbH\nGesellschaft mit beschränkter Haftung\nLandsberg am Lech\n\nDen Gläubigern der an der Ausgliederung beteiligten Rechtsträger ist, wenn sie binnen sechs Monaten nach dem Tag, an dem die Eintragung der Ausgliederung in das Register des Sitzes desjenigen Rechtsträgers, dessen Gläubiger sie sind, nach §§ 125, 19 Abs. 3 UmwG als bekannt gemacht gilt, ihren Anspruch nach Grund und Höhe in Textform anmelden, Sicherheit zu leisten, soweit sie nicht Befriedigung verlangen können. Dieses Recht steht den Gläubigern jedoch nur zu, wenn sie glaubhaft machen, dass durch die Ausgliederung die Erfüllung ihrer Forderung gefährdet wird."
    },
    {
      "date": "2025-03-13",
      "id": "103634",
      "original_text": "Löschungsankündigung\nBayern Amtsgericht München HRA 117769\nKEA334 LLC & Co. KG – München",
      "type": "Löschungsankündigung",
      "state": "Bayern",
      "amtsgericht": "Amtsgericht München",
      "registernummer": "HRA 117769",
      "registerart": "HRA",
      "company_name": "KEA334 LLC & Co. KG",
      "company_seat": "München",
      "details": "13.03.2025 (Bekanntmachungsdatum)\n\nBayern Amtsgericht München HRA 117769\nLöschungsankündigung\n\nKEA334 LLC & Co. KG\nKommanditgesellschaft\nMünchen\n\nDas Registergericht beabsichtigt, die im Handelsregister eingetragene Firma von Amts wegen nach § 31 Abs. 2 HGB zu löschen. Die Frist zur Erhebung eines Widerspruchs ist auf drei Monate festgesetzt."
    },
    {
      "date": "2025-03-13",
      "id": "103635",
      "original_text": "Löschungsankündigung\nBayern Amtsgericht Nürnberg HRB 40748\nWietratec UG (haftungsbeschränkt) – Nürnberg",
      "type": "Löschungsankündigung",
      "state": "Bayern",
      "amtsgericht": "Amtsgericht Nürnberg",
      "registernummer": "HRB 40748",
      "registerart": "HRB",
      "company_name": "Wietratec UG (haftungsbeschränkt)",
      "company_seat": "Nürnberg",
      "details": "13.03.2025 (Bekanntmachungsdatum)\n\nBayern Amtsgericht Nürnberg HRB 40748\nLöschungsankündigung\n\nWietratec UG (haftungsbeschränkt)\nGesellschaft mit beschränkter Haftung\nNürnberg\n\nDas Registergericht beabsichtigt, die im Handelsregister eingetragene Gesellschaft wegen Vermögenslosigkeit von Amts wegen nach § 394 FamFG zu löschen. Die Frist zur Erhebung eines Widerspruchs ist auf einen Monat festgesetzt."
    },
    {
      "date": "2025-03-13",
      "id": "103636",
      "original_text": "Löschungsankündigung\nBayern Amtsgericht München HRB 227929\nNeonArt WP UG (haftungsbeschränkt) – München",
      "type": "Löschungsankündigung",
      "state": "Bayern",
      "amtsgericht": "Amtsgericht München",
      "registernummer": "HRB 227929",
      "registerart": "HRB",
      "company_name": "NeonArt WP UG (haftungsbeschränkt)",
      "company_seat": "München",
      "details": "13.03.2025 (Bekanntmachungsdatum)\n\nBayern Amtsgericht München HRB 227929\nLöschungsankündigung 12.03.2025 (Eintragungsdatum)\n\nNeonArt WP UG (haftungsbeschränkt)\nGesellschaft mit beschränkter Haftung\nMünchen\n\nDas Registergericht beabsichtigt, die im Handelsregister eingetragene Firma von Amts wegen nach § 31 Abs. 2 HGB, § 393 FamFG zu löschen. Die Frist zur Erhebung eines Widerspruchs ist auf drei Monate festgesetzt."
    },
    {
      "date": "2025-03-13",
      "id": "103637",
      "original_text": "Einreichung neuer Dokumente\nBayern Amtsgericht Traunstein HRB 10689\nKOMRO Gesellschaft für Telekommunikation mit beschränkter Haftung – Rosenheim",
      "type": "Einreichung neuer Dokumente",
      "state": "Bayern",
      "amtsgericht": "Amtsgericht Traunstein",
      "registernummer": "HRB 10689",
      "registerart": "HRB",
      "company_name": "KOMRO Gesellschaft für Telekommunikation mit beschränkter Haftung",
      "company_seat": "Rosenheim",
      "details": "13.03.2025 (Bekanntmachungsdatum)\n\nBayern Amtsgericht Traunstein HRB 10689\nEinreichung neuer Dokumente\n\nKOMRO Gesellschaft für Telekommunikation mit beschränkter Haftung\nGesellschaft mit beschränkter Haftung\nRosenheim\n\nDem Amtsgericht Traunstein -Registergericht- ist eine Liste der Mitglieder des Aufsichtsrats eingereicht worden, § 52 Abs. 3 S. 2 GmbHG."
    },
    {
      "date": "2025-03-13",
      "id": "103638",
      "original_text": "Einreichung neuer Dokumente\nBayern Amtsgericht München HRB 274912\nFlix SE – München",
      "type": "Einreichung neuer Dokumente",
      "state": "Bayern",
      "amtsgericht": "Amtsgericht München",
      "registernummer": "HRB 274912",
      "registerart": "HRB",
      "company_name": "Flix SE",
      "company_seat": "München",
      "details": "13.03.2025 (Bekanntmachungsdatum)\n\nBayern Amtsgericht München HRB 274912\nEinreichung neuer Dokumente\n\nFlix SE\nEuropäische Aktiengesellschaft (SE)\nMünchen\n\nDem Amtsgericht München -Registergericht- ist eine Liste der Mitglieder des Aufsichtsrats eingereicht worden, Art. 9 Abs. 1 Buchst. c (ii) SE-VO i.V.m. § 106 AktG."
    },
    {
      "date": "2025-03-13",
      "id": "103639",
      "original_text": "Sonstige Registerbekanntmachung\nBayern Amtsgericht Kempten (Allgäu) GnR 213\nEVOK Energie-Versorgung Oy- Kressen eG. – Oy",
      "type": "Sonstige Registerbekanntmachung",
      "state": "Bayern",
      "amtsgericht": "Amtsgericht Kempten (Allgäu)",
      "registernummer": "GnR 213",
      "registerart": "GnR",
      "company_name": "EVOK Energie-Versorgung Oy- Kressen eG.",
      "company_seat": "Oy",
      "details": "13.03.2025 (Bekanntmachungsdatum)\n\nBayern Amtsgericht Kempten (Allgäu) GnR 213\nSonstige Registerbekanntmachung 12.03.2025 (Eintragungsdatum)\n\nEVOK Energie-Versorgung Oy- Kressen eG.\neingetragene Genossenschaft\nOy\n\nDen Gläubigern der Genossenschaft ist gemäß §§ 22a i.V.m. 22 GenG, wenn sie sich binnen sechs Monaten nach der Bekanntmachung bei der Genossenschaft zu diesem Zweck melden, Sicherheit zu leisten, soweit sie nicht Befriedigung verlangen können.\n\nDie Generalversammlung vom 24.05.2024 hat die Änderung der Satzung beschlossen. Geändert wurde u.a. § 40 (Nachschusspflicht). Wortlaut neu: Eine Nachschusspflicht der Mitglieder besteht nicht."
    },
    {
      "date": "2025-03-13",
      "id": "103640",
      "original_text": "Löschungsankündigung\nBayern Amtsgericht München HRB 210857\nSA Transport GmbH – München",
      "type": "Löschungsankündigung",
      "state": "Bayern",
      "amtsgericht": "Amtsgericht München",
      "registernummer": "HRB 210857",
      "registerart": "HRB",
      "company_name": "SA Transport GmbH",
      "company_seat": "München",
      "details": "13.03.2025 (Bekanntmachungsdatum)\n\nBayern Amtsgericht München HRB 210857\nLöschungsankündigung 12.03.2025 (Eintragungsdatum)\n\nSA Transport GmbH\nGesellschaft mit beschränkter Haftung\nMünchen\n\nDas Registergericht beabsichtigt, die im Handelsregister eingetragene Gesellschaft wegen Vermögenslosigkeit von Amts wegen nach § 394 FamFG zu löschen. Die Frist zur Erhebung eines Widerspruchs ist auf drei Monate festgesetzt."
    },
    {
      "date": "2025-03-13",
      "id": "103641",
      "original_text": "Registerbekanntmachung nach dem Umwandlungsgesetz\nBayern Amtsgericht München HRB 183585\nCleo Verwaltung GmbH – Pullach i. Isartal",
      "type": "Registerbekanntmachung nach dem Umwandlungsgesetz",
      "state": "Bayern",
      "amtsgericht": "Amtsgericht München",
      "registernummer": "HRB 183585",
      "registerart": "HRB",
      "company_name": "Cleo Verwaltung GmbH",
      "company_seat": "Pullach i. Isartal",
      "details": "13.03.2025 (Bekanntmachungsdatum)\n\nBayern Amtsgericht München HRB 183585\nRegisterbekanntmachung nach dem Umwandlungsgesetz 12.03.2025 (Eintragungsdatum)\n\nCleo Verwaltung GmbH\nGesellschaft mit beschränkter Haftung\nPullach i. Isartal\n\nDen Gläubigern der an der Verschmelzung beteiligten Rechtsträger ist, wenn sie binnen sechs Monaten nach dem Tag, an dem die Eintragung der Verschmelzung in das Register des Sitzes desjenigen Rechtsträgers, dessen Gläubiger sie sind, nach § 19 Abs. 3 UmwG als bekannt gemacht gilt, ihren Anspruch nach Grund und Höhe in Textform anmelden, Sicherheit zu leisten, soweit sie nicht Befriedigung verlangen können. Dieses Recht steht den Gläubigern jedoch nur zu, wenn sie glaubhaft machen, dass durch die Verschmelzung die Erfüllung ihrer Forderung gefährdet wird."
    },
    {
      "date": "2025-03-13",
      "id": "103642",
      "original_text": "Registerbekanntmachung nach dem Umwandlungsgesetz\nBayern Amtsgericht Traunstein HRA 14908\nAlexander Wurst e.K. – Flintsbach a.Inn",
      "type": "Registerbekanntmachung nach dem Umwandlungsgesetz",
      "state": "Bayern",
      "amtsgericht": "Amtsgericht Traunstein",
      "registernummer": "HRA 14908",
      "registerart": "HRA",
      "company_name": "Alexander Wurst e.K.",
      "company_seat": "Flintsbach a.Inn",
      "details": "13.03.2025 (Bekanntmachungsdatum)\n\nBayern Amtsgericht Traunstein HRA 14908\nRegisterbekanntmachung nach dem Umwandlungsgesetz 12.03.2025 (Eintragungsdatum)\n\nAlexander Wurst e.K.\nEinzelkaufmann / Einzelkauffrau\nFlintsbach a.Inn\n\nDen Gläubigern der an der Ausgliederung beteiligten Rechtsträger ist, wenn sie binnen sechs Monaten nach dem Tag, an dem die Eintragung der Ausgliederung in das Register des Sitzes desjenigen Rechtsträgers, dessen Gläubiger sie sind, nach §§ 125, 19 Abs. 3 UmwG als bekannt gemacht gilt, ihren Anspruch nach Grund und Höhe in Textform anmelden, Sicherheit zu leisten, soweit sie nicht Befriedigung verlangen können. Dieses Recht steht den Gläubigern jedoch nur zu, wenn sie glaubhaft machen, dass durch die Ausgliederung die Erfüllung ihrer Forderung gefährdet wird."
    },
    {
      "date": "2025-03-13",
      "id": "103643",
      "original_text": "Registerbekanntmachung nach dem Umwandlungsgesetz\nBayern Amtsgericht Augsburg HRB 8672\nLUT Fahrzeughandel GmbH – Augsburg",
      "type": "Registerbekanntmachung nach dem Umwandlungsgesetz",
      "state": "Bayern",
      "amtsgericht": "Amtsgericht Augsburg",
      "registernummer": "HRB 8672",
      "registerart": "HRB",
      "company_name": "LUT Fahrzeughandel GmbH",
      "company_seat": "Augsburg",
      "details": "13.03.2025 (Bekanntmachungsdatum)\n\nBayern Amtsgericht Augsburg HRB 8672\nRegisterbekanntmachung nach dem Umwandlungsgesetz 12.03.2025 (Eintragungsdatum)\n\nLUT Fahrzeughandel GmbH\nGesellschaft mit beschränkter Haftung\nAugsburg\n\nDen Gläubigern der an der Verschmelzung beteiligten Rechtsträger ist, wenn sie binnen sechs Monaten nach dem Tag, an dem die Eintragung der Verschmelzung in das Register des Sitzes desjenigen Rechtsträgers, dessen Gläubiger sie sind, nach § 19 Abs. 3 UmwG als bekannt gemacht gilt, ihren Anspruch nach Grund und Höhe in Textform anmelden, Sicherheit zu leisten, soweit sie nicht Befriedigung verlangen können. Dieses Recht steht den Gläubigern jedoch nur zu, wenn sie glaubhaft machen, dass durch die Verschmelzung die Erfüllung ihrer Forderung gefährdet wird."
    },
    {
      "date": "2025-03-13",
      "id": "103644",
      "original_text": "Registerbekanntmachung nach dem Umwandlungsgesetz\nBayern Amtsgericht München HRB 262890\nOPTIMAL Automotive GmbH – Langenbach",
      "type": "Registerbekanntmachung nach dem Umwandlungsgesetz",
      "state": "Bayern",
      "amtsgericht": "Amtsgericht München",
      "registernummer": "HRB 262890",
      "registerart": "HRB",
      "company_name": "OPTIMAL Automotive GmbH",
      "company_seat": "Langenbach",
      "details": "13.03.2025 (Bekanntmachungsdatum)\n\nBayern Amtsgericht München HRB 262890\nRegisterbekanntmachung nach dem Umwandlungsgesetz 12.03.2025 (Eintragungsdatum)\n\nOPTIMAL Automotive GmbH\nGesellschaft mit beschränkter Haftung\nLangenbach\n\nDen Gläubigern der an der Verschmelzung beteiligten Rechtsträger ist, wenn sie binnen sechs Monaten nach dem Tag, an dem die Eintragung der Verschmelzung in das Register des Sitzes desjenigen Rechtsträgers, dessen Gläubiger sie sind, nach § 19 Abs. 3 UmwG als bekannt gemacht gilt, ihren Anspruch nach Grund und Höhe in Textform anmelden, Sicherheit zu leisten, soweit sie nicht Befriedigung verlangen können. Dieses Recht steht den Gläubigern jedoch nur zu, wenn sie glaubhaft machen, dass durch die Verschmelzung die Erfüllung ihrer Forderung gefährdet wird."
    },
    {
      "date": "2025-03-13",
      "id": "103645",
      "original_text": "Löschungsankündigung\nBayern Amtsgericht Weiden i. d. OPf. HRA 1939\nPPT Grundstücksverwaltungs GmbH & Co. KG – Waldershof-Poppenreuth",
      "type": "Löschungsankündigung",
      "state": "Bayern",
      "amtsgericht": "Amtsgericht Weiden i. d. OPf.",
      "registernummer": "HRA 1939",
      "registerart": "HRA",
      "company_name": "PPT Grundstücksverwaltungs GmbH & Co. KG",
      "company_seat": "Waldershof-Poppenreuth",
      "details": "13.03.2025 (Bekanntmachungsdatum)\n\nBayern Amtsgericht Weiden i. d. OPf. HRA 1939\nLöschungsankündigung\n\nPPT Grundstücksverwaltungs GmbH & Co. KG\nKommanditgesellschaft\nWaldershof-Poppenreuth\n\nDas Amtsgericht - Registergericht - beabsichtigt die Firma von Amts wegen zu löschen.\nEtwaige Einwendungen sind binnen 1 Monats zu erheben."
    },
    {
      "date": "2025-03-13",
      "id": "103646",
      "original_text": "Registerbekanntmachung nach dem Umwandlungsgesetz\nBayern Amtsgericht Traunstein HRB 33556\nlineAex GmbH – Flintsbach a.Inn",
      "type": "Registerbekanntmachung nach dem Umwandlungsgesetz",
      "state": "Bayern",
      "amtsgericht": "Amtsgericht Traunstein",
      "registernummer": "HRB 33556",
      "registerart": "HRB",
      "company_name": "lineAex GmbH",
      "company_seat": "Flintsbach a.Inn",
      "details": "13.03.2025 (Bekanntmachungsdatum)\n\nBayern Amtsgericht Traunstein HRB 33556\nRegisterbekanntmachung nach dem Umwandlungsgesetz 12.03.2025 (Eintragungsdatum)\n\nlineAex GmbH\nGesellschaft mit beschränkter Haftung\nFlintsbach a.Inn\n\nDen Gläubigern der an der Ausgliederung beteiligten Rechtsträger ist, wenn sie binnen sechs Monaten nach dem Tag, an dem die Eintragung der Ausgliederung in das Register des Sitzes desjenigen Rechtsträgers, dessen Gläubiger sie sind, nach §§ 125, 19 Abs. 3 UmwG als bekannt gemacht gilt, ihren Anspruch nach Grund und Höhe in Textform anmelden, Sicherheit zu leisten, soweit sie nicht Befriedigung verlangen können. Dieses Recht steht den Gläubigern jedoch nur zu, wenn sie glaubhaft machen, dass durch die Ausgliederung die Erfüllung ihrer Forderung gefährdet wird."
    },
    {
      "date": "2025-03-13",
      "id": "103647",
      "original_text": "Löschungsankündigung\nBayern Amtsgericht Nürnberg HRB 30468\nR 3 Immobilien- & Beteiligungsgesellschaft mbH – Schwabach",
      "type": "Löschungsankündigung",
      "state": "Bayern",
      "amtsgericht": "Amtsgericht Nürnberg",
      "registernummer": "HRB 30468",
      "registerart": "HRB",
      "company_name": "R 3 Immobilien- & Beteiligungsgesellschaft mbH",
      "company_seat": "Schwabach",
      "details": "13.03.2025 (Bekanntmachungsdatum)\n\nBayern Amtsgericht Nürnberg HRB 30468\nLöschungsankündigung\n\nR 3 Immobilien- & Beteiligungsgesellschaft mbH\nGesellschaft mit beschränkter Haftung\nSchwabach\n\nDas Registergericht beabsichtigt, die im Handelsregister eingetragene Gesellschaft wegen Vermögenslosigkeit von Amts wegen nach § 394 FamFG zu löschen. Die Frist zur Erhebung eines Widerspruchs ist auf einen Monat festgesetzt."
    },
    {
      "date": "2025-03-13",
      "id": "103648",
      "original_text": "Löschungsankündigung\nBayern Amtsgericht Nürnberg HRB 15684\nHartmann Fleisch- und Wurstwaren GmbH – Hersbruck",
      "type": "Löschungsankündigung",
      "state": "Bayern",
      "amtsgericht": "Amtsgericht Nürnberg",
      "registernummer": "HRB 15684",
      "registerart": "HRB",
      "company_name": "Hartmann Fleisch- und Wurstwaren GmbH",
      "company_seat": "Hersbruck",
      "details": "13.03.2025 (Bekanntmachungsdatum)\n\nBayern Amtsgericht Nürnberg HRB 15684\nLöschungsankündigung\n\nHartmann Fleisch- und Wurstwaren GmbH\nGesellschaft mit beschränkter Haftung\nHersbruck\n\nDas Registergericht beabsichtigt, die im Handelsregister eingetragene Gesellschaft wegen Vermögenslosigkeit von Amts wegen nach § 394 FamFG zu löschen. Die Frist zur Erhebung eines Widerspruchs ist auf einen Monat festgesetzt."
    },
    {
      "date": "2025-03-13",
      "id": "103649",
      "original_text": "Registerbekanntmachung nach dem Umwandlungsgesetz\nBayern Amtsgericht München HRB 300724\nbrainymotion GmbH – München",
      "type": "Registerbekanntmachung nach dem Umwandlungsgesetz",
      "state": "Bayern",
      "amtsgericht": "Amtsgericht München",
      "registernummer": "HRB 300724",
      "registerart": "HRB",
      "company_name": "brainymotion GmbH",
      "company_seat": "München",
      "details": "13.03.2025 (Bekanntmachungsdatum)\n\nBayern Amtsgericht München HRB 300724\nRegisterbekanntmachung nach dem Umwandlungsgesetz 12.03.2025 (Eintragungsdatum)\n\nbrainymotion GmbH\nGesellschaft mit beschränkter Haftung\nMünchen\n\nDen Gläubigern des formwechselnden Rechtsträgers ist, wenn sie binnen sechs Monaten nach dem Tag, an dem die Eintragung des Formwechsels nach § 201 UmwG als bekannt gemacht gilt, ihren Anspruch nach Grund und Höhe in Textform anmelden, Sicherheit zu leisten, soweit sie nicht Befriedigung verlangen können. Dieses Recht steht den Gläubigern jedoch nur zu, wenn sie glaubhaft machen, dass durch den Formwechsel die Erfüllung ihrer Forderung gefährdet wird."
    },
    {
      "date": "2025-03-13",
      "id": "103650",
      "original_text": "Registerbekanntmachung nach dem Umwandlungsgesetz\nBayern Amtsgericht München HRB 289040\nAccelerate Bidco GmbH – München",
      "type": "Registerbekanntmachung nach dem Umwandlungsgesetz",
      "state": "Bayern",
      "amtsgericht": "Amtsgericht München",
      "registernummer": "HRB 289040",
      "registerart": "HRB",
      "company_name": "Accelerate Bidco GmbH",
      "company_seat": "München",
      "details": "13.03.2025 (Bekanntmachungsdatum)\n\nBayern Amtsgericht München HRB 289040\nRegisterbekanntmachung nach dem Umwandlungsgesetz 12.03.2025 (Eintragungsdatum)\n\nAccelerate Bidco GmbH\nGesellschaft mit beschränkter Haftung\nMünchen\n\nDen Gläubigern der an der Verschmelzung beteiligten Rechtsträger ist, wenn sie binnen sechs Monaten nach dem Tag, an dem die Eintragung der Verschmelzung in das Register des Sitzes desjenigen Rechtsträgers, dessen Gläubiger sie sind, nach § 19 Abs. 3 UmwG als bekannt gemacht gilt, ihren Anspruch nach Grund und Höhe in Textform anmelden, Sicherheit zu leisten, soweit sie nicht Befriedigung verlangen können. Dieses Recht steht den Gläubigern jedoch nur zu, wenn sie glaubhaft machen, dass durch die Verschmelzung die Erfüllung ihrer Forderung gefährdet wird."
    },
    {
      "date": "2025-03-13",
      "id": "103651",
      "original_text": "Registerbekanntmachung nach dem Umwandlungsgesetz\nBayern Amtsgericht Kempten (Allgäu) HRB 1795\nHochland Deutschland GmbH – Heimenkirch i. Allgäu",
      "type": "Registerbekanntmachung nach dem Umwandlungsgesetz",
      "state": "Bayern",
      "amtsgericht": "Amtsgericht Kempten (Allgäu)",
      "registernummer": "HRB 1795",
      "registerart": "HRB",
      "company_name": "Hochland Deutschland GmbH",
      "company_seat": "Heimenkirch i. Allgäu",
      "details": "13.03.2025 (Bekanntmachungsdatum)\n\nBayern Amtsgericht Kempten (Allgäu) HRB 1795\nRegisterbekanntmachung nach dem Umwandlungsgesetz 12.03.2025 (Eintragungsdatum)\n\nHochland Deutschland GmbH\nGesellschaft mit beschränkter Haftung\nHeimenkirch i. Allgäu\n\nDen Gläubigern der an der Verschmelzung beteiligten Rechtsträger ist, wenn sie binnen sechs Monaten nach dem Tag, an dem die Eintragung der Verschmelzung in das Register des Sitzes desjenigen Rechtsträgers, dessen Gläubiger sie sind, nach § 19 Abs. 3 UmwG als bekannt gemacht gilt, ihren Anspruch nach Grund und Höhe in Textform anmelden, Sicherheit zu leisten, soweit sie nicht Befriedigung verlangen können. Dieses Recht steht den Gläubigern jedoch nur zu, wenn sie glaubhaft machen, dass durch die Verschmelzung die Erfüllung ihrer Forderung gefährdet wird."
    },
    {
      "date": "2025-03-13",
      "id": "103652",
      "original_text": "Registerbekanntmachung nach dem Umwandlungsgesetz\nMecklenburg-Vorpommern Amtsgericht Neubrandenburg HRB 6894\nNordkurier Druck Verwaltungs GmbH – Neubrandenburg",
      "type": "Registerbekanntmachung nach dem Umwandlungsgesetz",
      "state": "Mecklenburg-Vorpommern",
      "amtsgericht": "Amtsgericht Neubrandenburg",
      "registernummer": "HRB 6894",
      "registerart": "HRB",
      "company_name": "Nordkurier Druck Verwaltungs GmbH",
      "company_seat": "Neubrandenburg",
      "details": "13.03.2025 (Bekanntmachungsdatum)\n\nMecklenburg-Vorpommern Amtsgericht Neubrandenburg HRB 6894\nRegisterbekanntmachung nach dem Umwandlungsgesetz 13.03.2025 (Eintragungsdatum)\n\nNordkurier Druck Verwaltungs GmbH\nGesellschaft mit beschränkter Haftung\nNeubrandenburg\n\nAls nicht eingetragen wird veröffentlicht: Den Gläubigern der an der Verschmelzung beteiligten Rechtsträger ist, wenn sie binnen sechs Monaten nach dem Tag, an dem die Eintragung der Verschmelzung in das Register des Sitzes desjenigen Rechtsträgers, dessen Gläubiger sie sind, nach § 19 Abs. 3 UmwG als bekannt gemacht gilt,\nihren Anspruch nach Grund und Höhe in Textform anmelden, Sicherheit zu leisten, soweit sie nicht Befriedigung verlangen können. Dieses Recht steht den Gläubigern jedoch nur zu, wenn sie glaubhaft machen, dass durch die Verschmelzung die Erfüllung der Forderung gefährdet wird."
    },
    {
      "date": "2025-03-13",
      "id": "103653",
      "original_text": "Registerbekanntmachung nach dem Umwandlungsgesetz\nMecklenburg-Vorpommern Amtsgericht Neubrandenburg HRB 7406\nNordkurier Honorar Verwaltungs GmbH – Neubrandenburg",
      "type": "Registerbekanntmachung nach dem Umwandlungsgesetz",
      "state": "Mecklenburg-Vorpommern",
      "amtsgericht": "Amtsgericht Neubrandenburg",
      "registernummer": "HRB 7406",
      "registerart": "HRB",
      "company_name": "Nordkurier Honorar Verwaltungs GmbH",
      "company_seat": "Neubrandenburg",
      "details": "13.03.2025 (Bekanntmachungsdatum)\n\nMecklenburg-Vorpommern Amtsgericht Neubrandenburg HRB 7406\nRegisterbekanntmachung nach dem Umwandlungsgesetz 13.03.2025 (Eintragungsdatum)\n\nNordkurier Honorar Verwaltungs GmbH\nGesellschaft mit beschränkter Haftung\nNeubrandenburg\n\nAls nicht eingetragen wird veröffentlicht: Den Gläubigern der an der Verschmelzung beteiligten Rechtsträger ist, wenn sie binnen sechs Monaten nach dem Tag, an dem die Eintragung der Verschmelzung in das Register des Sitzes desjenigen Rechtsträgers, dessen Gläubiger sie sind, nach § 19 Abs. 3 UmwG als bekannt gemacht gilt,\nihren Anspruch nach Grund und Höhe in Textform anmelden, Sicherheit zu leisten, soweit sie nicht Befriedigung verlangen können. Dieses Recht steht den Gläubigern jedoch nur zu, wenn sie glaubhaft machen, dass durch die Verschmelzung die Erfüllung der Forderung gefährdet wird."
    },
    {
      "date": "2025-03-13",
      "id": "103654",
      "original_text": "Registerbekanntmachung nach dem Umwandlungsgesetz\nMecklenburg-Vorpommern Amtsgericht Neubrandenburg HRB 322\nNordkurier Mediengruppe Verwaltungs GmbH – Neubrandenburg",
      "type": "Registerbekanntmachung nach dem Umwandlungsgesetz",
      "state": "Mecklenburg-Vorpommern",
      "amtsgericht": "Amtsgericht Neubrandenburg",
      "registernummer": "HRB 322",
      "registerart": "HRB",
      "company_name": "Nordkurier Mediengruppe Verwaltungs GmbH",
      "company_seat": "Neubrandenburg",
      "details": "13.03.2025 (Bekanntmachungsdatum)\n\nMecklenburg-Vorpommern Amtsgericht Neubrandenburg HRB 322\nRegisterbekanntmachung nach dem Umwandlungsgesetz 13.03.2025 (Eintragungsdatum)\n\nNordkurier Mediengruppe Verwaltungs GmbH\nGesellschaft mit beschränkter Haftung\nNeubrandenburg\n\nAls nicht eingetragen wird veröffentlicht: Den Gläubigern der an der Verschmelzung beteiligten Rechtsträger ist, wenn sie binnen sechs Monaten nach dem Tag, an dem die Eintragung der Verschmelzung in das Register des Sitzes desjenigen Rechtsträgers, dessen Gläubiger sie sind, nach § 19 Abs. 3 UmwG als bekannt gemacht gilt,\nihren Anspruch nach Grund und Höhe in Textform anmelden, Sicherheit zu leisten, soweit sie nicht Befriedigung verlangen können. Dieses Recht steht den Gläubigern jedoch nur zu, wenn sie glaubhaft machen, dass durch die Verschmelzung die Erfüllung der Forderung gefährdet wird."
    },
    {
      "date": "2025-03-13",
      "id": "103655",
      "original_text": "Registerbekanntmachung nach dem Umwandlungsgesetz\nMecklenburg-Vorpommern Amtsgericht Neubrandenburg HRB 322\nNordkurier Mediengruppe Verwaltungs GmbH – Neubrandenburg",
      "type": "Registerbekanntmachung nach dem Umwandlungsgesetz",
      "state": "Mecklenburg-Vorpommern",
      "amtsgericht": "Amtsgericht Neubrandenburg",
      "registernummer": "HRB 322",
      "registerart": "HRB",
      "company_name": "Nordkurier Mediengruppe Verwaltungs GmbH",
      "company_seat": "Neubrandenburg",
      "details": "13.03.2025 (Bekanntmachungsdatum)\n\nMecklenburg-Vorpommern Amtsgericht Neubrandenburg HRB 322\nRegisterbekanntmachung nach dem Umwandlungsgesetz 13.03.2025 (Eintragungsdatum)\n\nNordkurier Mediengruppe Verwaltungs GmbH\nGesellschaft mit beschränkter Haftung\nNeubrandenburg\n\nAls nicht eingetragen wird veröffentlicht: Den Gläubigern der an der Verschmelzung beteiligten Rechtsträger ist, wenn sie binnen sechs Monaten nach dem Tag, an dem die Eintragung der Verschmelzung in das Register des Sitzes desjenigen Rechtsträgers, dessen Gläubiger sie sind, nach § 19 Abs. 3 UmwG als bekannt gemacht gilt,\nihren Anspruch nach Grund und Höhe in Textform anmelden, Sicherheit zu leisten, soweit sie nicht Befriedigung verlangen können. Dieses Recht steht den Gläubigern jedoch nur zu, wenn sie glaubhaft machen, dass durch die Verschmelzung die Erfüllung der Forderung gefährdet wird."
    },
    {
      "date": "2025-03-13",
      "id": "103656",
      "original_text": "Registerbekanntmachung nach dem Umwandlungsgesetz\nBaden-Württemberg Amtsgericht Stuttgart HRB 460757\nKACO ELEKTROTECHNIK GmbH – Aldingen",
      "type": "Registerbekanntmachung nach dem Umwandlungsgesetz",
      "state": "Baden-Württemberg",
      "amtsgericht": "Amtsgericht Stuttgart",
      "registernummer": "HRB 460757",
      "registerart": "HRB",
      "company_name": "KACO ELEKTROTECHNIK GmbH",
      "company_seat": "Aldingen",
      "details": "13.03.2025 (Bekanntmachungsdatum)\n\nBaden-Württemberg Amtsgericht Stuttgart HRB 460757\nRegisterbekanntmachung nach dem Umwandlungsgesetz 13.03.2025 (Eintragungsdatum)\n\nKACO ELEKTROTECHNIK GmbH\nGesellschaft mit beschränkter Haftung\nAldingen\n\nAls nicht eingetragen wird bekanntgemacht:\nDen Gläubigern der an der Verschmelzung beteiligten Rechtsträger ist, wenn sie binnen sechs Monaten nach dem Tag, an dem die Eintragung der Verschmelzung in das Register des Sitzes desjenigen Rechtsträgers, dessen Gläubiger sie sind, nach § 19 Abs. 3 UmwG als bekanntgemacht gilt, ihren Anspruch nach Grund und Höhe schriftlich anmelden, Sicherheit zu leisten, soweit sie nicht Befriedigung verlangen können. Dieses Recht steht den Gläubigern jedoch nur zu, wenn sie glaubhaft machen, dass durch die Verschmelzung die Erfüllung ihrer Forderung gefährdet wird."
    },
    {
      "date": "2025-03-13",
      "id": "103657",
      "original_text": "Löschungsankündigung\nBerlin Amtsgericht Berlin (Charlottenburg) HRA 53258\nVeneo Handelshaus Nr. 1 GmbH & Co. KG – Berlin",
      "type": "Löschungsankündigung",
      "state": "Berlin",
      "amtsgericht": "Amtsgericht Berlin (Charlottenburg)",
      "registernummer": "HRA 53258",
      "registerart": "HRA",
      "company_name": "Veneo Handelshaus Nr. 1 GmbH & Co. KG",
      "company_seat": "Berlin",
      "details": "13.03.2025 (Bekanntmachungsdatum)\n\nBerlin Amtsgericht Berlin (Charlottenburg) HRA 53258\nLöschungsankündigung\n\nVeneo Handelshaus Nr. 1 GmbH & Co. KG\nKommanditgesellschaft\nBerlin\n\nBei dem nachstehenden Unternehmen / der nachstehenden Gesellschaft wird das Amtslöschungsverfahren gemäß § 31 Abs. 2 HGB eingeleitet. Widerspruchsfrist 6 Wochen"
    },
    {
      "date": "2025-03-13",
      "id": "103658",
      "original_text": "Registerbekanntmachung nach dem Umwandlungsgesetz\nNordrhein-Westfalen Amtsgericht Coesfeld HRB 18540\nIGP Hetkamp GmbH – Borken",
      "type": "Registerbekanntmachung nach dem Umwandlungsgesetz",
      "state": "Nordrhein-Westfalen",
      "amtsgericht": "Amtsgericht Coesfeld",
      "registernummer": "HRB 18540",
      "registerart": "HRB",
      "company_name": "IGP Hetkamp GmbH",
      "company_seat": "Borken",
      "details": "13.03.2025 (Bekanntmachungsdatum)\n\nNordrhein-Westfalen Amtsgericht Coesfeld HRB 18540\nRegisterbekanntmachung nach dem Umwandlungsgesetz 13.03.2025 (Eintragungsdatum)\n\nIGP Hetkamp GmbH\nGesellschaft mit beschränkter Haftung\nBorken\n\nDen Gläubigern der an der Verschmelzung beteiligten Rechtsträger ist, wenn sie binnen sechs Monaten nach dem Tag, an dem die Eintragung der Verschmelzung in das Register des Sitzes derjenigen Rechtsträger deren Gläubiger sie sind, nach § 19 Absatz 3 UmwG als bekanntgemacht gilt, ihren Anspruch nach Grund und Höhe schriftlich anmelden, Sicherheit zu leisten, soweit sie nicht Befriedigung verlangen können. Dieses Recht steht den Gläubigern jedoch nur zu, wenn sie glaubhaft machen, dass durch die Verschmelzung die Erfüllung ihrer Forderung gefährdet wird."
    },
    {
      "date": "2025-03-13",
      "id": "103659",
      "original_text": "Einreichung neuer Dokumente\nMecklenburg-Vorpommern Amtsgericht Stralsund HRB 457 früher Amtsgericht Rostock\nGemeinnützige Wohnungsbaugesellschaft mbH Grimmen – Grimmen",
      "type": "Einreichung neuer Dokumente",
      "state": "Mecklenburg-Vorpommern",
      "amtsgericht": "Amtsgericht Stralsund",
      "registernummer": "HRB 457",
      "registerart": "HRB",
      "company_name": "Gemeinnützige Wohnungsbaugesellschaft mbH Grimmen",
      "company_seat": "Grimmen",
      "former_amtsgericht": "Rostock",
      "details": "13.03.2025 (Bekanntmachungsdatum)\n\nMecklenburg-Vorpommern Amtsgericht Stralsund HRB 457 früher Amtsgericht Rostock\nEinreichung neuer Dokumente\n\nGemeinnützige Wohnungsbaugesellschaft mbH Grimmen\nGesellschaft mit beschränkter Haftung\nGrimmen\n\nEine Liste der Mitglieder des Aufsichtsrats ist zum Handelsregister eingereicht worden."
    },
    {
      "date": "2025-03-13",
      "id": "103660",
      "original_text": "Einreichung neuer Dokumente\nMecklenburg-Vorpommern Amtsgericht Stralsund HRB 207 früher Amtsgericht Rostock\nStadtwirtschaft GmbH Grimmen – Grimmen",
      "type": "Einreichung neuer Dokumente",
      "state": "Mecklenburg-Vorpommern",
      "amtsgericht": "Amtsgericht Stralsund",
      "registernummer": "HRB 207",
      "registerart": "HRB",
      "company_name": "Stadtwirtschaft GmbH Grimmen",
      "company_seat": "Grimmen",
      "former_amtsgericht": "Rostock",
      "details": "13.03.2025 (Bekanntmachungsdatum)\n\nMecklenburg-Vorpommern Amtsgericht Stralsund HRB 207 früher Amtsgericht Rostock\nEinreichung neuer Dokumente\n\nStadtwirtschaft GmbH Grimmen\nGesellschaft mit beschränkter Haftung\nGrimmen\n\nEine Liste der Mitglieder des Aufsichtsrats ist zum Handelsregister eingereicht worden."
    },
    {
      "date": "2025-03-13",
      "id": "103661",
      "original_text": "Löschungsankündigung\nBaden-Württemberg Amtsgericht Mannheim HRB 704144\nMetallbau Schilling - Friedrich GmbH – Sinsheim",
      "type": "Löschungsankündigung",
      "state": "Baden-Württemberg",
      "amtsgericht": "Amtsgericht Mannheim",
      "registernummer": "HRB 704144",
      "registerart": "HRB",
      "company_name": "Metallbau Schilling - Friedrich GmbH",
      "company_seat": "Sinsheim",
      "details": "13.03.2025 (Bekanntmachungsdatum)\n\nBaden-Württemberg Amtsgericht Mannheim HRB 704144\nLöschungsankündigung\n\nMetallbau Schilling - Friedrich GmbH\nGesellschaft mit beschränkter Haftung\nSinsheim\n\nDas Gericht beabsichtigt, die Gesellschaft wegen Vermögenslosigkeit im Handelsregister von Amts wegen nach § 394 FamFG zu löschen. Die Frist zur Geltendmachung eines Widerspruchs gegen die beabsichtigte Löschung ist auf einen Monat ab Veröffentlichung bestimmt."
    },
    {
      "date": "2025-03-13",
      "id": "103662",
      "original_text": "Löschungsankündigung\nSaarland Amtsgericht Saarbrücken HRB 14452\nomnisystem GmbH – Saarlouis",
      "type": "Löschungsankündigung",
      "state": "Saarland",
      "amtsgericht": "Amtsgericht Saarbrücken",
      "registernummer": "HRB 14452",
      "registerart": "HRB",
      "company_name": "omnisystem GmbH",
      "company_seat": "Saarlouis",
      "details": "13.03.2025 (Bekanntmachungsdatum)\n\nSaarland Amtsgericht Saarbrücken HRB 14452\nLöschungsankündigung\n\nomnisystem GmbH\nGesellschaft mit beschränkter Haftung\nSaarlouis\n\nEs ist beabsichtigt, die Gesellschaft von Amts wegen gemäß § 394 FamFG wegen Vermögenslosigkeit zu löschen.\nGegen die Löschung von Amts wegen ist das Rechtsmittel des Widerspruchs statthaft. Der Widerspruch ist binnen einer Frist zwei Monaten beginnend mit dem Tag dieser Veröffentlichung durch Einreichen eines Widerspruchsschreibens -schriftlich oder zur Niederschrift der Geschäftsstelle beim Amtsgericht Saarbrücken, -zentrales Handelsregister-, Mainzerstr.178, 66121 Saarbrücken einzulegen.\nDer Widerspruch muss die Bezeichnung der angefochtenen Löschungsankündigung enthalten sowie die Erklärung, dass Widerspruch eingelegt wird. Er ist vom Widerspruchsführer oder seinem Bevollmächtigten zu unterzeichnen.\nDas Widerspruchsschreiben kann auch in der Form eines elektronischen Dokumentes eingereicht werden, das mit einer qualifizierten elektronischen Signatur nach dem Signaturgesetz versehen sein muss (§§ 14 Abs. 2 FamFG, 130a, 298 ZPO)."
    },
    {
      "date": "2025-03-13",
      "id": "103663",
      "original_text": "Einreichung neuer Dokumente\nBaden-Württemberg Amtsgericht Stuttgart HRB 745973\nLuxoft GmbH – Stuttgart",
      "type": "Einreichung neuer Dokumente",
      "state": "Baden-Württemberg",
      "amtsgericht": "Amtsgericht Stuttgart",
      "registernummer": "HRB 745973",
      "registerart": "HRB",
      "company_name": "Luxoft GmbH",
      "company_seat": "Stuttgart",
      "details": "13.03.2025 (Bekanntmachungsdatum)\n\nBaden-Württemberg Amtsgericht Stuttgart HRB 745973\nEinreichung neuer Dokumente\n\nLuxoft GmbH\nGesellschaft mit beschränkter Haftung\nStuttgart\n\nDie Gesellschaft hat am 12.03.2025 die Liste über die Zusammensetzung des Aufsichtsrats zum Handelsregister eingereicht."
    },
    {
      "date": "2025-03-13",
      "id": "103664",
      "original_text": "Registerbekanntmachung nach dem Umwandlungsgesetz\nBaden-Württemberg Amtsgericht Ulm HRA 728500\nMarkus Zwick e. K. – Ellwangen Jagst",
      "type": "Registerbekanntmachung nach dem Umwandlungsgesetz",
      "state": "Baden-Württemberg",
      "amtsgericht": "Amtsgericht Ulm",
      "registernummer": "HRA 728500",
      "registerart": "HRA",
      "company_name": "Markus Zwick e. K.",
      "company_seat": "Ellwangen Jagst",
      "details": "13.03.2025 (Bekanntmachungsdatum)\n\nBaden-Württemberg Amtsgericht Ulm HRA 728500\nRegisterbekanntmachung nach dem Umwandlungsgesetz 13.03.2025 (Eintragungsdatum)\n\nMarkus Zwick e. K.\nEinzelkaufmann / Einzelkauffrau\nEllwangen Jagst\n\nAls nicht eingetragen wird bekanntgemacht:\nDen Gläubigern der an der Ausgliederung beteiligten Rechtsträger ist, wenn sie binnen sechs Monaten nach dem Tag, an dem die Eintragung der Ausgliederung in das Register des Sitzes desjenigen Rechtsträgers, dessen Gläubiger sie sind, nach § 19 Abs. 3 UmwG als bekanntgemacht gilt, ihren Anspruch nach Grund und Höhe schriftlich anmelden, Sicherheit zu leisten, soweit sie nicht Befriedigung verlangen können. Dieses Recht steht den Gläubigern jedoch nur zu, wenn sie glaubhaft machen, dass durch die Ausgliederung die Erfüllung ihrer Forderung gefährdet wird."
    },
    {
      "date": "2025-03-13",
      "id": "103665",
      "original_text": "Löschungsankündigung\nSchleswig-Holstein Amtsgericht Kiel HRA 9372\nMS Automobilehandel LTD & Co. KG – Kisdorf",
      "type": "Löschungsankündigung",
      "state": "Schleswig-Holstein",
      "amtsgericht": "Amtsgericht Kiel",
      "registernummer": "HRA 9372",
      "registerart": "HRA",
      "company_name": "MS Automobilehandel LTD & Co. KG",
      "company_seat": "Kisdorf",
      "details": "13.03.2025 (Bekanntmachungsdatum)\n\nSchleswig-Holstein Amtsgericht Kiel HRA 9372\nLöschungsankündigung\n\nMS Automobilehandel LTD & Co. KG\nKommanditgesellschaft\nKisdorf\n\nBei der nachstehenden Firma wird das Amtslöschungsverfahren gemäß § 31 Abs. 2 HGB eingeleitet. Widerspruchsfrist: 2 Monate."
    },
    {
      "date": "2025-03-13",
      "id": "103666",
      "original_text": "Einreichung neuer Dokumente\nBaden-Württemberg Amtsgericht Stuttgart HRB 723593\nhofer Aktiengesellschaft – Nürtingen",
      "type": "Einreichung neuer Dokumente",
      "state": "Baden-Württemberg",
      "amtsgericht": "Amtsgericht Stuttgart",
      "registernummer": "HRB 723593",
      "registerart": "HRB",
      "company_name": "hofer Aktiengesellschaft",
      "company_seat": "Nürtingen",
      "details": "13.03.2025 (Bekanntmachungsdatum)\n\nBaden-Württemberg Amtsgericht Stuttgart HRB 723593\nEinreichung neuer Dokumente\n\nhofer Aktiengesellschaft\nAktiengesellschaft\nNürtingen\n\nDie Gesellschaft hat am 12.03.2025 die Liste über die Zusammensetzung des Aufsichtsrats zum Handelsregister eingereicht."
    },
    {
      "date": "2025-03-13",
      "id": "103667",
      "original_text": "Registerbekanntmachung nach dem Umwandlungsgesetz\nBaden-Württemberg Amtsgericht Ulm HRB 744622\nZwick Energie GmbH – Ellwangen Jagst",
      "type": "Registerbekanntmachung nach dem Umwandlungsgesetz",
      "state": "Baden-Württemberg",
      "amtsgericht": "Amtsgericht Ulm",
      "registernummer": "HRB 744622",
      "registerart": "HRB",
      "company_name": "Zwick Energie GmbH",
      "company_seat": "Ellwangen Jagst",
      "details": "13.03.2025 (Bekanntmachungsdatum)\n\nBaden-Württemberg Amtsgericht Ulm HRB 744622\nRegisterbekanntmachung nach dem Umwandlungsgesetz 13.03.2025 (Eintragungsdatum)\n\nZwick Energie GmbH\nGesellschaft mit beschränkter Haftung\nEllwangen Jagst\n\nAls nicht eingetragen wird bekanntgemacht:\nDen Gläubigern der an der Ausgliederung beteiligten Rechtsträger ist, wenn sie binnen sechs Monaten nach dem Tag, an dem die Eintragung der Ausgliederung in das Register des Sitzes desjenigen Rechtsträgers, dessen Gläubiger sie sind, nach § 19 Abs. 3 UmwG als bekanntgemacht gilt, ihren Anspruch nach Grund und Höhe schriftlich anmelden, Sicherheit zu leisten, soweit sie nicht Befriedigung verlangen können. Dieses Recht steht den Gläubigern jedoch nur zu, wenn sie glaubhaft machen, dass durch die Ausgliederung die Erfüllung ihrer Forderung gefährdet wird."
    },
    {
      "date": "2025-03-13",
      "id": "103668",
      "original_text": "Löschungsankündigung\nMecklenburg-Vorpommern Amtsgericht Stralsund HRB 20777\nACoN Rügen GmbH – Sassnitz",
      "type": "Löschungsankündigung",
      "state": "Mecklenburg-Vorpommern",
      "amtsgericht": "Amtsgericht Stralsund",
      "registernummer": "HRB 20777",
      "registerart": "HRB",
      "company_name": "ACoN Rügen GmbH",
      "company_seat": "Sassnitz",
      "details": "13.03.2025 (Bekanntmachungsdatum)\n\nMecklenburg-Vorpommern Amtsgericht Stralsund HRB 20777\nLöschungsankündigung\n\nACoN Rügen GmbH\nGesellschaft mit beschränkter Haftung\nSassnitz\n\nDas Registergericht beabsichtigt, die im Handelsregister eingetragene Gesellschaft von Amts wegen nach § 394 FamFG zu löschen. Die Frist zur Erhebung eines Widerspruchs gegen die beabsichtigte Löschung ist auf 1 Monat festgesetzt."
    },
    {
      "date": "2025-03-13",
      "id": "103669",
      "original_text": "Einreichung neuer Dokumente\nBrandenburg Amtsgericht Cottbus HRB 2920\nGeWAP Gesellschaft für Wasserver- und Abwasserentsorgung - Hammerstrom/Malxe - Peitz mbH – Peitz",
      "type": "Einreichung neuer Dokumente",
      "state": "Brandenburg",
      "amtsgericht": "Amtsgericht Cottbus",
      "registernummer": "HRB 2920",
      "registerart": "HRB",
      "company_name": "GeWAP Gesellschaft für Wasserver- und Abwasserentsorgung - Hammerstrom/Malxe - Peitz mbH",
      "company_seat": "Peitz",
      "details": "13.03.2025 (Bekanntmachungsdatum)\n\nBrandenburg Amtsgericht Cottbus HRB 2920\nEinreichung neuer Dokumente\n\nGeWAP Gesellschaft für Wasserver- und Abwasserentsorgung - Hammerstrom/Malxe - Peitz mbH\nGesellschaft mit beschränkter Haftung\nPeitz\n\nAls nicht eingetragen wird veröffentlicht: Der Geschäftsführer hat eine Liste der Aufsichtsratsmitglieder gem. § 52 Abs. 2 Satz 2 GmbHG zum Handelsregister eingereicht"
    },
    {
      "date": "2025-03-13",
      "id": "103670",
      "original_text": "Einreichung neuer Dokumente\nBerlin Amtsgericht Berlin (Charlottenburg) HRB 125252\nDRV Service GmbH – Berlin",
      "type": "Einreichung neuer Dokumente",
      "state": "Berlin",
      "amtsgericht": "Amtsgericht Berlin (Charlottenburg)",
      "registernummer": "HRB 125252",
      "registerart": "HRB",
      "company_name": "DRV Service GmbH",
      "company_seat": "Berlin",
      "details": "13.03.2025 (Bekanntmachungsdatum)\n\nBerlin Amtsgericht Berlin (Charlottenburg) HRB 125252\nEinreichung neuer Dokumente\n\nDRV Service GmbH\nGesellschaft mit beschränkter Haftung\nBerlin\n\nAls nicht eingetragen wird veröffentlicht:Es wurde eine neue Liste der Aufsichtsratsmitglieder eingereicht (§52 GmbHG)."
    },
    {
      "date": "2025-03-13",
      "id": "103671",
      "original_text": "Löschungsankündigung\nBerlin Amtsgericht Berlin (Charlottenburg) HRB 170130\nMSM UG (haftungsbeschränkt) – Berlin",
      "type": "Löschungsankündigung",
      "state": "Berlin",
      "amtsgericht": "Amtsgericht Berlin (Charlottenburg)",
      "registernummer": "HRB 170130",
      "registerart": "HRB",
      "company_name": "MSM UG (haftungsbeschränkt)",
      "company_seat": "Berlin",
      "details": "13.03.2025 (Bekanntmachungsdatum)\n\nBerlin Amtsgericht Berlin (Charlottenburg) HRB 170130\nLöschungsankündigung\n\nMSM UG (haftungsbeschränkt)\nGesellschaft mit beschränkter Haftung\nBerlin\n\nBei der nachstehenden Gesellschaft wird das Amtslöschungsverfahren gemäß § 394 FamFG eingeleitet. Widerspruchsfrist 6 Wochen"
    },
    {
      "date": "2025-03-13",
      "id": "103672",
      "original_text": "Löschungsankündigung\nBaden-Württemberg Amtsgericht Stuttgart HRB 773541\nHWG SECURITY GmbH – Fellbach",
      "type": "Löschungsankündigung",
      "state": "Baden-Württemberg",
      "amtsgericht": "Amtsgericht Stuttgart",
      "registernummer": "HRB 773541",
      "registerart": "HRB",
      "company_name": "HWG SECURITY GmbH",
      "company_seat": "Fellbach",
      "details": "13.03.2025 (Bekanntmachungsdatum)\n\nBaden-Württemberg Amtsgericht Stuttgart HRB 773541\nLöschungsankündigung\n\nHWG SECURITY GmbH\nGesellschaft mit beschränkter Haftung\nFellbach\n\nDas Gericht beabsichtigt, die Gesellschaft wegen Vermögenslosigkeit im Handelsregister von Amts wegen nach § 394 FamFG zu löschen. Die Frist zur Geltendmachung eines Widerspruchs gegen die beabsichtigte Löschung ist auf zwei Monate ab Veröffentlichung bestimmt."
    },
    {
      "date": "2025-03-13",
      "id": "103673",
      "original_text": "Einreichung neuer Dokumente\nBrandenburg Amtsgericht Cottbus HRB 172\nGubener Wohnungsgesellschaft mbH – Guben",
      "type": "Einreichung neuer Dokumente",
      "state": "Brandenburg",
      "amtsgericht": "Amtsgericht Cottbus",
      "registernummer": "HRB 172",
      "registerart": "HRB",
      "company_name": "Gubener Wohnungsgesellschaft mbH",
      "company_seat": "Guben",
      "details": "13.03.2025 (Bekanntmachungsdatum)\n\nBrandenburg Amtsgericht Cottbus HRB 172\nEinreichung neuer Dokumente\n\nGubener Wohnungsgesellschaft mbH\nGesellschaft mit beschränkter Haftung\nGuben\n\nAls nicht eingetragen wird veröffentlicht:\nDer Geschäftsführer hat eine Liste der Aufsichtsratsmitglieder gem. § 52 Abs. 2 Satz 2 GmbHG zum Handelsregister eingereicht"
    },
    {
      "date": "2025-03-13",
      "id": "103674",
      "original_text": "Einreichung neuer Dokumente\nMecklenburg-Vorpommern Amtsgericht Stralsund HRB 2819 früher Amtsgericht Rostock\nWasser und Abwasser GmbH Boddenland – Ribnitz-Damgarten",
      "type": "Einreichung neuer Dokumente",
      "state": "Mecklenburg-Vorpommern",
      "amtsgericht": "Amtsgericht Stralsund",
      "registernummer": "HRB 2819",
      "registerart": "HRB",
      "company_name": "Wasser und Abwasser GmbH Boddenland",
      "company_seat": "Ribnitz-Damgarten",
      "former_amtsgericht": "Rostock",
      "details": "13.03.2025 (Bekanntmachungsdatum)\n\nMecklenburg-Vorpommern Amtsgericht Stralsund HRB 2819 früher Amtsgericht Rostock\nEinreichung neuer Dokumente\n\nWasser und Abwasser GmbH Boddenland\nGesellschaft mit beschränkter Haftung\nRibnitz-Damgarten\n\nEine Liste der Mitglieder des Aufsichtsrats ist zum Handelsregister eingereicht worden."
    },
    {
      "date": "2025-03-13",
      "id": "103675",
      "original_text": "Registerbekanntmachung nach dem Umwandlungsgesetz\nNordrhein-Westfalen Amtsgericht Coesfeld GsR 428\nHorst & Jost eGbR – Ahaus",
      "type": "Registerbekanntmachung nach dem Umwandlungsgesetz",
      "state": "Nordrhein-Westfalen",
      "amtsgericht": "Amtsgericht Coesfeld",
      "registernummer": "GsR 428",
      "registerart": "GsR",
      "company_name": "Horst & Jost eGbR",
      "company_seat": "Ahaus",
      "details": "13.03.2025 (Bekanntmachungsdatum)\n\nNordrhein-Westfalen Amtsgericht Coesfeld GsR 428\nRegisterbekanntmachung nach dem Umwandlungsgesetz 13.03.2025 (Eintragungsdatum)\n\nHorst & Jost eGbR\nGesellschaft bürgerlichen Rechts\nAhaus\n\nDen Gläubigern des an dem Formwechsel beteiligten Rechtsträgers ist, wenn sie binnen sechs Monaten nach dem Tag, an dem die Eintragung des Formwechsels in das Register des Sitzes desjenigen Rechtsträgers, dessen Gläubiger sie sind, nach § 19 Absatz 3 UmwG als bekanntgemacht gilt, ihren Anspruch nach Grund und Höhe schriftlich anmelden, Sicherheit zu leisten, soweit sie nicht Befriedigung verlangen können. Dieses Recht steht den Gläubigern jedoch nur zu, wenn sie glaubhaft machen, dass durch den Formwechsel die Erfüllung ihrer Forderung gefährdet wird."
    },
    {
      "date": "2025-03-13",
      "id": "103676",
      "original_text": "Sonstige Registerbekanntmachung\nBrandenburg Amtsgericht Cottbus HRB 2066\nLWG Lausitzer Wasser Verwaltungs-GmbH – Cottbus",
      "type": "Sonstige Registerbekanntmachung",
      "state": "Brandenburg",
      "amtsgericht": "Amtsgericht Cottbus",
      "registernummer": "HRB 2066",
      "registerart": "HRB",
      "company_name": "LWG Lausitzer Wasser Verwaltungs-GmbH",
      "company_seat": "Cottbus",
      "details": "13.03.2025 (Bekanntmachungsdatum)\n\nBrandenburg Amtsgericht Cottbus HRB 2066\nSonstige Registerbekanntmachung\n\nLWG Lausitzer Wasser Verwaltungs-GmbH\nGesellschaft mit beschränkter Haftung\nCottbus\n\nDie Geschäftsführer haben eine Liste der Aufsichtsratsmitglieder gem. § 52 Abs. 3 Satz 2 GmbHG zum Handelsregister eingereicht"
    },
    {
      "date": "2025-03-13",
      "id": "103677",
      "original_text": "Einreichung neuer Dokumente\nBaden-Württemberg Amtsgericht Stuttgart HRB 773941\nConcular GmbH – Stuttgart",
      "type": "Einreichung neuer Dokumente",
      "state": "Baden-Württemberg",
      "amtsgericht": "Amtsgericht Stuttgart",
      "registernummer": "HRB 773941",
      "registerart": "HRB",
      "company_name": "Concular GmbH",
      "company_seat": "Stuttgart",
      "details": "13.03.2025 (Bekanntmachungsdatum)\n\nBaden-Württemberg Amtsgericht Stuttgart HRB 773941\nEinreichung neuer Dokumente\n\nConcular GmbH\nGesellschaft mit beschränkter Haftung\nStuttgart\n\nDie Gesellschaft hat am 12.03.2025 die Liste über die Zusammensetzung des Beirats zum Handelsregister eingereicht."
    },
    {
      "date": "2025-03-13",
      "id": "103678",
      "original_text": "Registerbekanntmachung nach dem Umwandlungsgesetz\nThüringen Amtsgericht Jena HRB 519320\nJAS Vermögensverwaltungs UG (haftungsbeschränkt) – Nesse-Apfelstädt",
      "type": "Registerbekanntmachung nach dem Umwandlungsgesetz",
      "state": "Thüringen",
      "amtsgericht": "Amtsgericht Jena",
      "registernummer": "HRB 519320",
      "registerart": "HRB",
      "company_name": "JAS Vermögensverwaltungs UG (haftungsbeschränkt)",
      "company_seat": "Nesse-Apfelstädt",
      "details": "13.03.2025 (Bekanntmachungsdatum)\n\nThüringen Amtsgericht Jena HRB 519320\nRegisterbekanntmachung nach dem Umwandlungsgesetz 13.03.2025 (Eintragungsdatum)\n\nJAS Vermögensverwaltungs UG (haftungsbeschränkt)\nGesellschaft mit beschränkter Haftung\nNesse-Apfelstädt\n\nNicht eingetragen: Den Gläubigern der an der Verschmelzung beteiligten Rechtsträger, ist wenn sie binnen sechs Monaten nach dem Tag, an dem die Eintragung der Verschmelzung in das Register des Sitzes desjenigen Rechtsträgers, dessen Gläubiger sie sind,  nach § 19 Abs. 3 UmwG als bekanntgemacht gilt, ihren Anspruch nach Grund und Höhe schriftlich anmelden, Sicherheit zu leisten, soweit sie nicht Befriedigung verlangen können. Dieses Recht steht ihnen jedoch nur zu, wenn sie glaubhaft machen, daß durch die Verschmelzung die Erfüllung ihrer Forderung gefährdet wird."
    },
    {
      "date": "2025-03-13",
      "id": "103679",
      "original_text": "Registerbekanntmachung nach dem Umwandlungsgesetz\nMecklenburg-Vorpommern Amtsgericht Schwerin HRB 13493\nMIG Beteiligungs GmbH – Schwerin",
      "type": "Registerbekanntmachung nach dem Umwandlungsgesetz",
      "state": "Mecklenburg-Vorpommern",
      "amtsgericht": "Amtsgericht Schwerin",
      "registernummer": "HRB 13493",
      "registerart": "HRB",
      "company_name": "MIG Beteiligungs GmbH",
      "company_seat": "Schwerin",
      "details": "13.03.2025 (Bekanntmachungsdatum)\n\nMecklenburg-Vorpommern Amtsgericht Schwerin HRB 13493\nRegisterbekanntmachung nach dem Umwandlungsgesetz 13.03.2025 (Eintragungsdatum)\n\nMIG Beteiligungs GmbH\nGesellschaft mit beschränkter Haftung\nSchwerin\n\nAls nicht eingetragen wird veröffentlicht: Den Gläubigern der an der Verschmelzung beteiligten Rechtsträger ist, wenn sie binnen sechs Monaten nach dem Tag, an dem die Eintragung der Verschmelzung in das Register des Sitzes desjenigen Rechtsträgers, dessen Gläubiger sie sind, nach § 19 Abs. 3 UmwG als bekannt gemacht gilt,\nihren Anspruch nach Grund und Höhe in Textform anmelden, Sicherheit zu leisten, soweit sie nicht Befriedigung verlangen können. Dieses Recht steht den Gläubigern jedoch nur zu, wenn sie glaubhaft machen, dass durch die Verschmelzung die Erfüllung der Forderung gefährdet wird.Die Gesellschaft hat Gläubigern, deren Forderungen vor dieser Bekanntmachung begründet worden sind, Sicherheit zu leisten, soweit sie nicht Befriedigung verlangen können, wenn sie sich binnen sechs Monaten zu diesem Zweck melden."
    },
    {
      "date": "2025-03-13",
      "id": "103680",
      "original_text": "Einreichung neuer Dokumente\nBerlin Amtsgericht Berlin (Charlottenburg) HRB 200154\nBeratungsgesellschaft für Arbeits- und Gesundheitsschutz Berlin mbH – Berlin",
      "type": "Einreichung neuer Dokumente",
      "state": "Berlin",
      "amtsgericht": "Amtsgericht Berlin (Charlottenburg)",
      "registernummer": "HRB 200154",
      "registerart": "HRB",
      "company_name": "Beratungsgesellschaft für Arbeits- und Gesundheitsschutz Berlin mbH",
      "company_seat": "Berlin",
      "details": "13.03.2025 (Bekanntmachungsdatum)\n\nBerlin Amtsgericht Berlin (Charlottenburg) HRB 200154\nEinreichung neuer Dokumente\n\nBeratungsgesellschaft für Arbeits- und Gesundheitsschutz Berlin mbH\nGesellschaft mit beschränkter Haftung\nBerlin\n\nAls nicht eingetragen wird veröffentlicht: Es wurde eine neue Liste der Beiratsmitglieder eingereicht (§52 GmbHG)."
    },
    {
      "date": "2025-03-13",
      "id": "103681",
      "original_text": "Löschungsankündigung\nSchleswig-Holstein Amtsgericht Lübeck HRB 3929\nDeWind GmbH – Lübeck",
      "type": "Löschungsankündigung",
      "state": "Schleswig-Holstein",
      "amtsgericht": "Amtsgericht Lübeck",
      "registernummer": "HRB 3929",
      "registerart": "HRB",
      "company_name": "DeWind GmbH",
      "company_seat": "Lübeck",
      "details": "13.03.2025 (Bekanntmachungsdatum)\n\nSchleswig-Holstein Amtsgericht Lübeck HRB 3929\nLöschungsankündigung\n\nDeWind GmbH\nGesellschaft mit beschränkter Haftung\nLübeck\n\nEs ist die Löschung der nachstehenden Gesellschaft wegen Vermögenslosigkeit gemäß § 394 FamFG beabsichtigt.\nWiderspruchsfrist: 1 Monat."
    },
    {
      "date": "2025-03-13",
      "id": "103682",
      "original_text": "Sonstige Registerbekanntmachung\nSachsen-Anhalt Amtsgericht Stendal HRB 18855\nBäder- und Servicegesellschaft Bitterfeld-Wolfen mbH (BSG) – Bitterfeld-Wolfen",
      "type": "Sonstige Registerbekanntmachung",
      "state": "Sachsen-Anhalt",
      "amtsgericht": "Amtsgericht Stendal",
      "registernummer": "HRB 18855",
      "registerart": "HRB",
      "company_name": "Bäder- und Servicegesellschaft Bitterfeld-Wolfen mbH (BSG)",
      "company_seat": "Bitterfeld-Wolfen",
      "details": "13.03.2025 (Bekanntmachungsdatum)\n\nSachsen-Anhalt Amtsgericht Stendal HRB 18855\nSonstige Registerbekanntmachung\n\nBäder- und Servicegesellschaft Bitterfeld-Wolfen mbH (BSG)\nGesellschaft mit beschränkter Haftung\nBitterfeld-Wolfen\n\nEine Liste der Mitglieder des Aufsichtsrates wurde zum Handelsregister eingereicht."
    },
    {
      "date": "2025-03-13",
      "id": "103683",
      "original_text": "Einreichung neuer Dokumente\nBaden-Württemberg Amtsgericht Freiburg HRB 4340\nWeinland Baden GmbH, Vertrieb badischer Weine – Freiburg im Breisgau",
      "type": "Einreichung neuer Dokumente",
      "state": "Baden-Württemberg",
      "amtsgericht": "Amtsgericht Freiburg",
      "registernummer": "HRB 4340",
      "registerart": "HRB",
      "company_name": "Weinland Baden GmbH, Vertrieb badischer Weine",
      "company_seat": "Freiburg im Breisgau",
      "details": "13.03.2025 (Bekanntmachungsdatum)\n\nBaden-Württemberg Amtsgericht Freiburg HRB 4340\nEinreichung neuer Dokumente\n\nWeinland Baden GmbH, Vertrieb badischer Weine\nGesellschaft mit beschränkter Haftung\nFreiburg im Breisgau\n\nDie Gesellschaft hat am 13.03.2025 die Liste über die Zusammensetzung des Aufsichtsrats zum Handelsregister eingereicht."
    },
    {
      "date": "2025-03-13",
      "id": "103684",
      "original_text": "Einreichung neuer Dokumente\nSaarland Amtsgericht Saarbrücken HRB 17011\nW+ST Wirtschaftsprüfung Geschäftsführungs AG Wirtschaftsprüfungsgesellschaft – Dillingen",
      "type": "Einreichung neuer Dokumente",
      "state": "Saarland",
      "amtsgericht": "Amtsgericht Saarbrücken",
      "registernummer": "HRB 17011",
      "registerart": "HRB",
      "company_name": "W+ST Wirtschaftsprüfung Geschäftsführungs AG Wirtschaftsprüfungsgesellschaft",
      "company_seat": "Dillingen",
      "details": "13.03.2025 (Bekanntmachungsdatum)\n\nSaarland Amtsgericht Saarbrücken HRB 17011\nEinreichung neuer Dokumente 13.03.2025 (Eintragungsdatum)\n\nW+ST Wirtschaftsprüfung Geschäftsführungs AG Wirtschaftsprüfungsgesellschaft\nAktiengesellschaft\nDillingen\n\nDer Vorstand der Gesellschaft hat eine Liste der Mitglieder des Aufsichtsrats zum Handelsregister eingereicht (§ 106 AktG)."
    },
    {
      "date": "2025-03-13",
      "id": "103685",
      "original_text": "Löschungsankündigung\nBerlin Amtsgericht Berlin (Charlottenburg) HRB 178748\nPoly SAT GmbH – Berlin",
      "type": "Löschungsankündigung",
      "state": "Berlin",
      "amtsgericht": "Amtsgericht Berlin (Charlottenburg)",
      "registernummer": "HRB 178748",
      "registerart": "HRB",
      "company_name": "Poly SAT GmbH",
      "company_seat": "Berlin",
      "details": "13.03.2025 (Bekanntmachungsdatum)\n\nBerlin Amtsgericht Berlin (Charlottenburg) HRB 178748\nLöschungsankündigung\n\nPoly SAT GmbH\nGesellschaft mit beschränkter Haftung\nBerlin\n\nBei der nachstehenden Gesellschaft wird das Amtslöschungsverfahren gemäß § 394 FamFG eingeleitet. Widerspruchsfrist 6 Wochen"
    },
    {
      "date": "2025-03-13",
      "id": "103686",
      "original_text": "Registerbekanntmachung nach dem Umwandlungsgesetz\nBaden-Württemberg Amtsgericht Freiburg HRB 728247\nMax Möckel Verwaltungs-UG (haftungsbeschränkt) – Villingen-Schwenningen",
      "type": "Registerbekanntmachung nach dem Umwandlungsgesetz",
      "state": "Baden-Württemberg",
      "amtsgericht": "Amtsgericht Freiburg",
      "registernummer": "HRB 728247",
      "registerart": "HRB",
      "company_name": "Max Möckel Verwaltungs-UG (haftungsbeschränkt)",
      "company_seat": "Villingen-Schwenningen",
      "details": "13.03.2025 (Bekanntmachungsdatum)\n\nBaden-Württemberg Amtsgericht Freiburg HRB 728247\nRegisterbekanntmachung nach dem Umwandlungsgesetz 13.03.2025 (Eintragungsdatum)\n\nMax Möckel Verwaltungs-UG (haftungsbeschränkt)\nGesellschaft mit beschränkter Haftung\nVillingen-Schwenningen\n\nAls nicht eingetragen wird bekanntgemacht:\nDen Gläubigern der an der Verschmelzung beteiligten Rechtsträger ist, wenn sie binnen sechs Monaten nach dem Tag, an dem die Eintragung der Verschmelzung in das Register des Sitzes desjenigen Rechtsträgers, dessen Gläubiger sie sind, nach § 19 Abs. 3 UmwG als bekanntgemacht gilt, ihren Anspruch nach Grund und Höhe schriftlich anmelden, Sicherheit zu leisten, soweit sie nicht Befriedigung verlangen können. Dieses Recht steht den Gläubigern jedoch nur zu, wenn sie glaubhaft machen, dass durch die Verschmelzung die Erfüllung ihrer Forderung gefährdet wird."
    },
    {
      "date": "2025-03-13",
      "id": "103687",
      "original_text": "Sonstige Registerbekanntmachung\nBaden-Württemberg Amtsgericht Mannheim HRB 753896\niperdi KAM GmbH – Weinheim",
      "type": "Sonstige Registerbekanntmachung",
      "state": "Baden-Württemberg",
      "amtsgericht": "Amtsgericht Mannheim",
      "registernummer": "HRB 753896",
      "registerart": "HRB",
      "company_name": "iperdi KAM GmbH",
      "company_seat": "Weinheim",
      "details": "13.03.2025 (Bekanntmachungsdatum)\n\nBaden-Württemberg Amtsgericht Mannheim HRB 753896\nSonstige Registerbekanntmachung 13.03.2025 (Eintragungsdatum)\n\niperdi KAM GmbH\nGesellschaft mit beschränkter Haftung\nWeinheim\n\nAls nicht eingetragen wird bekanntgemacht:\nDen Gläubigern der Gesellschaft, deren Forderungen begründet worden sind, bevor die Eintragung der Beendigung des Vertrages in das Handelsregister nach § 10 HGB als bekanntgemacht gilt, ist vom anderen Vertragsteil Sicherheit zu leisten, wenn sie sich binnen sechs Monaten nach der Bekanntmachung zu diesem Zweck bei ihm melden."
    },
    {
      "date": "2025-03-13",
      "id": "103688",
      "original_text": "Löschungsankündigung\nBaden-Württemberg Amtsgericht Mannheim HRB 504780\nSPA Sonderprojekte und-Anlagen GmbH – Keltern",
      "type": "Löschungsankündigung",
      "state": "Baden-Württemberg",
      "amtsgericht": "Amtsgericht Mannheim",
      "registernummer": "HRB 504780",
      "registerart": "HRB",
      "company_name": "SPA Sonderprojekte und-Anlagen GmbH",
      "company_seat": "Keltern",
      "details": "13.03.2025 (Bekanntmachungsdatum)\n\nBaden-Württemberg Amtsgericht Mannheim HRB 504780\nLöschungsankündigung\n\nSPA Sonderprojekte und-Anlagen GmbH\nGesellschaft mit beschränkter Haftung\nKeltern\n\nDas Gericht beabsichtigt, die Gesellschaft wegen Vermögenslosigkeit im Handelsregister von Amts wegen nach § 394 FamFG zu löschen. Die Frist zur Geltendmachung eines Widerspruchs gegen die beabsichtigte Löschung ist auf einen Monat ab Veröffentlichung bestimmt."
    },
    {
      "date": "2025-03-13",
      "id": "103689",
      "original_text": "Löschungsankündigung\nBaden-Württemberg Amtsgericht Mannheim HRA 1780\nLudwig Wieland GmbH & Co.KG – Mannheim",
      "type": "Löschungsankündigung",
      "state": "Baden-Württemberg",
      "amtsgericht": "Amtsgericht Mannheim",
      "registernummer": "HRA 1780",
      "registerart": "HRA",
      "company_name": "Ludwig Wieland GmbH & Co.KG",
      "company_seat": "Mannheim",
      "details": "13.03.2025 (Bekanntmachungsdatum)\n\nBaden-Württemberg Amtsgericht Mannheim HRA 1780\nLöschungsankündigung\n\nLudwig Wieland GmbH & Co.KG\nKommanditgesellschaft\nMannheim\n\nDas Gericht beabsichtigt, die Gesellschaft wegen Vermögenslosigkeit im Handelsregister von Amts wegen nach § 394 FamFG zu löschen. Die Frist zur Geltendmachung eines Widerspruchs gegen die beabsichtigte Löschung ist auf einen Monat ab Veröffentlichung bestimmt."
    },
    {
      "date": "2025-03-13",
      "id": "103690",
      "original_text": "Sonstige Registerbekanntmachung\nSchleswig-Holstein Amtsgericht Kiel HRB 1198 NM\nDallmeyers Backhus GmbH – Neumünster",
      "type": "Sonstige Registerbekanntmachung",
      "state": "Schleswig-Holstein",
      "amtsgericht": "Amtsgericht Kiel",
      "registernummer": "HRB 1198 NM",
      "registerart": "HRB",
      "company_name": "Dallmeyers Backhus GmbH",
      "company_seat": "Neumünster",
      "details": "13.03.2025 (Bekanntmachungsdatum)\n\nSchleswig-Holstein Amtsgericht Kiel HRB 1198 NM\nSonstige Registerbekanntmachung\n\nDallmeyers Backhus GmbH\nGesellschaft mit beschränkter Haftung\nNeumünster\n\nAls nicht eingetragen wird veröffentlicht: Den Gläubigern der Gesellschaft, deren Forderungen begründet worden sind, bevor die Eintragung der Beendigung des Vertrages in das Handelsregister nach § 10 HGB bekannt gemacht worden ist, ist vom anderen Vertragspartner Sicherheit zu leisten, wenn sie sich binnen sechs Monaten nach Bekanntmachung der Eintragung zu diesem Zweck bei ihm melden."
    },
    {
      "date": "2025-03-13",
      "id": "103691",
      "original_text": "Löschungsankündigung\nBrandenburg Amtsgericht Potsdam VR 8775\nRefugee integration and human rights centre (RIHR e.V.) – Rathenow",
      "type": "Löschungsankündigung",
      "state": "Brandenburg",
      "amtsgericht": "Amtsgericht Potsdam",
      "registernummer": "VR 8775",
      "registerart": "VR",
      "company_name": "Refugee integration and human rights centre (RIHR e.V.)",
      "company_seat": "Rathenow",
      "details": "13.03.2025 (Bekanntmachungsdatum)\n\nBrandenburg Amtsgericht Potsdam VR 8775\nLöschungsankündigung\n\nRefugee integration and human rights centre (RIHR e.V.)\neingetragener Verein\nRathenow\n\nBei dem nachstehenden Verein wird das Amtslöschungsverfahren gemäß § 395 FamFG eingeleitet:\nDie Löschung des Vereins ist von Amts wegen beabsichtigt, da dieser offensichtlich nicht mehr existiert, § 395 FamFG analog.\nSeit Gründung des Vereins am 24.12.2026 und Eintragung am 27.04.2017 sind keine Aktivitäten ersichtlich geworden, auf wiederholte Anfragen an den Verein zur Besetzung des Vorstands sind keine Informationen eingegangen. Aktuelle Anschriften der bei Gründung gewählten Vorstandsmitglieder konnten nicht ermittelt werden.\nEs besteht Gelegenheit, gegen die beabsichtigte Löschung Widerspruch einzulegen und glaubhaft zu machen, dass der Verein noch existiert und aktiv ist. In diesem Fall sind bitte auch die aktuellen Vorstandsmitglieder mitzuteilen und sofern möglich, Kopie des letzten Wahlprotokolls für den Vorstand einzureichen.\nSollte binnen 2 Monaten ab Veröffentlichung gem. § 395 Abs. 2, 394 Abs. 2 S. 2 FamFG kein Widerspruch eingehen, erfolgt die Löschung des Vereins im Register."
    },
    {
      "date": "2025-03-13",
      "id": "103692",
      "original_text": "Sonstige Registerbekanntmachung\nSachsen Amtsgericht Leipzig HRB 15106\nSaxonia Media Filmproduktionsgesellschaft mbH – Leipzig",
      "type": "Sonstige Registerbekanntmachung",
      "state": "Sachsen",
      "amtsgericht": "Amtsgericht Leipzig",
      "registernummer": "HRB 15106",
      "registerart": "HRB",
      "company_name": "Saxonia Media Filmproduktionsgesellschaft mbH",
      "company_seat": "Leipzig",
      "details": "13.03.2025 (Bekanntmachungsdatum)\n\nSachsen Amtsgericht Leipzig HRB 15106\nSonstige Registerbekanntmachung\n\nSaxonia Media Filmproduktionsgesellschaft mbH\nGesellschaft mit beschränkter Haftung\nLeipzig\n\nAm 12.03.2025 wurde beim Handelsregister des Amtsgerichts Leipzig die Liste der Mitglieder des Aufsichtsrats gemäß § 52 GmbHG eingereicht."
    },
    {
      "date": "2025-03-13",
      "id": "103693",
      "original_text": "Löschungsankündigung\nSachsen Amtsgericht Dresden VR 10181\nKleingartenverein Clausmühle e.V. – Meißen",
      "type": "Löschungsankündigung",
      "state": "Sachsen",
      "amtsgericht": "Amtsgericht Dresden",
      "registernummer": "VR 10181",
      "registerart": "VR",
      "company_name": "Kleingartenverein Clausmühle e.V.",
      "company_seat": "Meißen",
      "details": "13.03.2025 (Bekanntmachungsdatum)\n\nSachsen Amtsgericht Dresden VR 10181\nLöschungsankündigung\n\nKleingartenverein Clausmühle e.V.\neingetragener Verein\nMeißen\n\nDas Registergericht beabsichtigt, den im Vereinsregister eingetragenen Vorstand Norbert John von Amts wegen nach § 395 FamFG wegen Unzulässigkeit zu löschen. Die Frist zu Erhebung eines Widerspruchs gegen die beabsichtigte Löschung wird auf zwei Wochen festgesetzt."
    },
    {
      "date": "2025-03-13",
      "id": "103694",
      "original_text": "Löschungsankündigung\nSachsen Amtsgericht Dresden HRB 39797\nZum Heißen Stein GmbH – Nossen",
      "type": "Löschungsankündigung",
      "state": "Sachsen",
      "amtsgericht": "Amtsgericht Dresden",
      "registernummer": "HRB 39797",
      "registerart": "HRB",
      "company_name": "Zum Heißen Stein GmbH",
      "company_seat": "Nossen",
      "details": "13.03.2025 (Bekanntmachungsdatum)\n\nSachsen Amtsgericht Dresden HRB 39797\nLöschungsankündigung\n\nZum Heißen Stein GmbH\nGesellschaft mit beschränkter Haftung\nNossen\n\nDas Registergericht beabsichtigt, die im Handelsregister eingetragene Gesellschaft von Amts wegen nach § 394 FamFG zu löschen. Die Frist zu Erhebung eines Widerspruchs gegen die beabsichtigte Löschung wird auf einen Monat festgesetzt."
    },
    {
      "date": "2025-03-13",
      "id": "103695",
      "original_text": "Einreichung neuer Dokumente\nSachsen Amtsgericht Chemnitz HRB 26755\nSaxony Minerals & Exploration - SME AG – Halsbrücke",
      "type": "Einreichung neuer Dokumente",
      "state": "Sachsen",
      "amtsgericht": "Amtsgericht Chemnitz",
      "registernummer": "HRB 26755",
      "registerart": "HRB",
      "company_name": "Saxony Minerals & Exploration - SME AG",
      "company_seat": "Halsbrücke",
      "details": "13.03.2025 (Bekanntmachungsdatum)\n\nSachsen Amtsgericht Chemnitz HRB 26755\nEinreichung neuer Dokumente\n\nSaxony Minerals & Exploration - SME AG\nAktiengesellschaft\nHalsbrücke\n\nAm 11.03.2025 wurde beim Handelsregister des Amtsgerichts Chemnitz die Liste der Mitglieder des Aufsichtsrats gemäß § 106 AktG eingereicht."
    },
    {
      "date": "2025-03-13",
      "id": "103696",
      "original_text": "Löschungsankündigung\nNiedersachsen Amtsgericht Osnabrück HRB 212463\nStahlhut International GmbH – Meppen",
      "type": "Löschungsankündigung",
      "state": "Niedersachsen",
      "amtsgericht": "Amtsgericht Osnabrück",
      "registernummer": "HRB 212463",
      "registerart": "HRB",
      "company_name": "Stahlhut International GmbH",
      "company_seat": "Meppen",
      "details": "13.03.2025 (Bekanntmachungsdatum)\n\nNiedersachsen Amtsgericht Osnabrück HRB 212463\nLöschungsankündigung\n\nStahlhut International GmbH\nGesellschaft mit beschränkter Haftung\nMeppen\n\nDas Registergericht beabsichtigt, die Gesellschaft von Amts wegen nach § 394 FamFG wegen Vermögenslosigkeit zu löschen. Die Frist zur Erhebung eines Widerspruchs ist auf 1 Monat ab dieser Registerbekanntmachung festgesetzt."
    },
    {
      "date": "2025-03-13",
      "id": "103697",
      "original_text": "Registerbekanntmachung nach dem Umwandlungsgesetz\nNiedersachsen Amtsgericht Braunschweig HRB 1819\nVolkswagen Bank Gesellschaft mit beschränkter Haftung – Braunschweig",
      "type": "Registerbekanntmachung nach dem Umwandlungsgesetz",
      "state": "Niedersachsen",
      "amtsgericht": "Amtsgericht Braunschweig",
      "registernummer": "HRB 1819",
      "registerart": "HRB",
      "company_name": "Volkswagen Bank Gesellschaft mit beschränkter Haftung",
      "company_seat": "Braunschweig",
      "details": "13.03.2025 (Bekanntmachungsdatum)\n\nNiedersachsen Amtsgericht Braunschweig HRB 1819\nRegisterbekanntmachung nach dem Umwandlungsgesetz 13.03.2025 (Eintragungsdatum)\n\nVolkswagen Bank Gesellschaft mit beschränkter Haftung\nGesellschaft mit beschränkter Haftung\nBraunschweig\n\nBeim Handelsregister ist der Entwurf des Verschmelzungsplans über die grenzüberschreitende Verschmelzung der Volkswagen Financial Services S.p.A. mit Sitz in Mailand, Italien, als dem übertragenden Rechtsträger mit der Volkswagen Bank Gesellschaft mit beschränkter Haftung mit Sitz in Braunschweig als übernehmendem Rechtsträger eingereicht worden. An der grenzüberschreitenden Verschmelzung sind die folgenden Gesellschaften beteiligt:\nAls übertragende Gesellschaft die Volkswagen Financial Services S.p.A., eine Aktiengesellschaft italienischen Rechts (società per azioni) mit Sitz in Mailand, Italien. Als übernehmende Gesellschaft die Volkswagen Bank Gesellschaft mit beschränkter Haftung, eine Gesellschaft mit beschränkter Haftung nach deutschem Recht mit Sitz in Braunschweig. Die an der grenzüberschreitenden Verschmelzung beteiligten Gesellschaften sind wie folgt im jeweiligen nationalen Register eingetragen: Die Volkswagen Financial Services S.p.A. als übertragender Rechtsträger ist eingetragen im Handelsregister der Handelskammer von Mailand, Monza-Brianza und Lodi unter der Nummer 10554340967. Die Volkswagen Bank Gesellschaft mit beschränkter Haftung als übernehmender Rechtsträger ist eingetragen im Handelsregister des Amtsgerichts Braunschweig unter der Nummer HRB 1819. Der bei der Volkswagen Bank Gesellschaft mit beschränkter Haftung zuständige Betriebsrat ist der Gemeinsame Betriebsrat der Volkswagen Financial Services AG, Volkswagen Financial Services Overseas AG, Volkswagen Bank Gesellschaft mit beschränkter Haftung, Volkswagen Leasing Gesellschaft mit beschränkter Haftung, Volkswagen Insurance Brokers GmbH, Volkswagen Versicherung Aktiengesellschaft, Volkswagen-Versicherungsdienst Gesellschaft mit beschränkter Haftung, Vehicle Trading International (VTI) GmbH (Gemeinsamer Betriebsrat). Der bei der Volkswagen Financial Services S.p.A. zuständige Betriebsrat ist die Gewerkschaftsvertretung (Rappresentanze Sindacali Unitarie) der Volkswagen Financial Services S.p.A. (Gewerkschaftsvertretung). Die Anteilsinhaber und Gläubiger der an der grenzüberschreitenden Verschmelzung beteiligten Gesellschaften sowie der Gemeinsame Betriebsrat und die Gewerkschaftsvertretung (Rappresentanza Sindacale Unitaria) der Volkswagen Financial Services S.p.A. können an die jeweilige Gesellschaft spätestens fünf Arbeitstage vor dem Tag der Gesellschafterversammlung, also bis spätestens 23.05.2025, Bemerkungen zum Verschmelzungsplan übermitteln."
    },
    {
      "date": "2025-03-13",
      "id": "103698",
      "original_text": "Registerbekanntmachung nach dem Umwandlungsgesetz\nNiedersachsen Amtsgericht Osnabrück HRB 217076\n3N Tortechnik GmbH – Uelsen",
      "type": "Registerbekanntmachung nach dem Umwandlungsgesetz",
      "state": "Niedersachsen",
      "amtsgericht": "Amtsgericht Osnabrück",
      "registernummer": "HRB 217076",
      "registerart": "HRB",
      "company_name": "3N Tortechnik GmbH",
      "company_seat": "Uelsen",
      "details": "13.03.2025 (Bekanntmachungsdatum)\n\nNiedersachsen Amtsgericht Osnabrück HRB 217076\nRegisterbekanntmachung nach dem Umwandlungsgesetz 13.03.2025 (Eintragungsdatum)\n\n3N Tortechnik GmbH\nGesellschaft mit beschränkter Haftung\nUelsen\n\nDen Gläubigern der an der Verschmelzung beteiligten Rechtsträger ist, wenn sie binnen sechs Monaten nach dem Tag, an dem die Eintragung der Verschmelzung in das Register des Sitzes desjenigen Rechtsträgers, dessen Gläubiger sie sind, nach § 19  Abs.  3 UmwG als bekannt gemacht gilt, ihren Anspruch nach Grund und Höhe schriftlich anmelden, Sicherheit zu leisten, soweit sie nicht Befriedigung verlangen können. Dieses Recht steht den Gläubigern jedoch nur zu, wenn sie glaubhaft machen, dass durch die Verschmelzung die Erfüllung der Forderung gefährdet wird."
    },
    {
      "date": "2025-03-13",
      "id": "103699",
      "original_text": "Einreichung neuer Dokumente\nNiedersachsen Amtsgericht Osnabrück HRB 204114\nHermes Service und Investment AG – Lingen",
      "type": "Einreichung neuer Dokumente",
      "state": "Niedersachsen",
      "amtsgericht": "Amtsgericht Osnabrück",
      "registernummer": "HRB 204114",
      "registerart": "HRB",
      "company_name": "Hermes Service und Investment AG",
      "company_seat": "Lingen",
      "details": "13.03.2025 (Bekanntmachungsdatum)\n\nNiedersachsen Amtsgericht Osnabrück HRB 204114\nEinreichung neuer Dokumente\n\nHermes Service und Investment AG\nAktiengesellschaft\nLingen\n\nDie Liste der Mitglieder des Aufsichtsrats wurde beim Registergericht eingereicht."
    },
    {
      "date": "2025-03-13",
      "id": "103700",
      "original_text": "Registerbekanntmachung nach dem Umwandlungsgesetz\nNiedersachsen Amtsgericht Tostedt VR 110118\nLandberatung Cuxland e.V. – Geestland",
      "type": "Registerbekanntmachung nach dem Umwandlungsgesetz",
      "state": "Niedersachsen",
      "amtsgericht": "Amtsgericht Tostedt",
      "registernummer": "VR 110118",
      "registerart": "VR",
      "company_name": "Landberatung Cuxland e.V.",
      "company_seat": "Geestland",
      "details": "13.03.2025 (Bekanntmachungsdatum)\n\nNiedersachsen Amtsgericht Tostedt VR 110118\nRegisterbekanntmachung nach dem Umwandlungsgesetz 13.03.2025 (Eintragungsdatum)\n\nLandberatung Cuxland e.V.\neingetragener Verein\nGeestland\n\nDen Gläubigern der an der Verschmelzung beteiligten Rechtsträger ist, wenn sie binnen sechs Monaten nach dem Tag, an dem die Eintragung der Verschmelzung in das Register des Sitzes desjenigen Rechtsträgers, dessen Gläubiger sie sind, nach § 19  Abs.  3 UmwG als bekannt gemacht gilt, ihren Anspruch nach Grund und Höhe schriftlich anmelden, Sicherheit zu leisten, soweit sie nicht Befriedigung verlangen können. Dieses Recht steht den Gläubigern jedoch nur zu, wenn sie glaubhaft machen, dass durch die Verschmelzung die Erfüllung der Forderung gefährdet wird."
    },
    {
      "date": "2025-03-13",
      "id": "103701",
      "original_text": "Löschungsankündigung\nNiedersachsen Amtsgericht Aurich HRB 205063\nJORICO Trading LTD – Großefehn",
      "type": "Löschungsankündigung",
      "state": "Niedersachsen",
      "amtsgericht": "Amtsgericht Aurich",
      "registernummer": "HRB 205063",
      "registerart": "HRB",
      "company_name": "JORICO Trading LTD",
      "company_seat": "Großefehn",
      "details": "13.03.2025 (Bekanntmachungsdatum)\n\nNiedersachsen Amtsgericht Aurich HRB 205063\nLöschungsankündigung 12.03.2025 (Eintragungsdatum)\n\nJORICO Trading LTD\nRechtsform ausländischen Rechts HRB\nGroßefehn\n\nDas Registergericht beabsichtigt, die Zweigniederlassung von Amts wegen nach § 395 FamFG zu löschen. Die Frist zur Erhebung eines Widerspruchs ist auf 1 Monat ab dieser Registerbekanntmachung festgesetzt."
    },
    {
      "date": "2025-03-13",
      "id": "103702",
      "original_text": "Löschungsankündigung\nNiedersachsen Amtsgericht Osnabrück HRB 121062 früher Amtsgericht Meppen\nVO Beton Grundbau GmbH – Meppen",
      "type": "Löschungsankündigung",
      "state": "Niedersachsen",
      "amtsgericht": "Amtsgericht Osnabrück",
      "registernummer": "HRB 121062",
      "registerart": "HRB",
      "company_name": "VO Beton Grundbau GmbH",
      "company_seat": "Meppen",
      "former_amtsgericht": "Meppen",
      "details": "13.03.2025 (Bekanntmachungsdatum)\n\nNiedersachsen Amtsgericht Osnabrück HRB 121062 früher Amtsgericht Meppen\nLöschungsankündigung\n\nVO Beton Grundbau GmbH\nGesellschaft mit beschränkter Haftung\nMeppen\n\nDas Registergericht beabsichtigt, die Gesellschaft von Amts wegen nach § 394 FamFG wegen Vermögenslosigkeit zu löschen. Die Frist zur Erhebung eines Widerspruchs ist auf 1 Monat ab dieser Registerbekanntmachung festgesetzt."
    },
    {
      "date": "2025-03-13",
      "id": "103703",
      "original_text": "Löschungsankündigung\nNiedersachsen Amtsgericht Aurich HRA 111478 früher Amtsgericht Leer (Ostfriesland) (Leer)\nAtlas Trampship Reederei GmbH & Co. MS \"DESSAU\" KG – Leer",
      "type": "Löschungsankündigung",
      "state": "Niedersachsen",
      "amtsgericht": "Amtsgericht Aurich",
      "registernummer": "HRA 111478",
      "registerart": "HRA",
      "company_name": "Atlas Trampship Reederei GmbH & Co. MS \"DESSAU\" KG",
      "company_seat": "Leer",
      "former_amtsgericht": "Leer (Ostfriesland) (Leer)",
      "details": "13.03.2025 (Bekanntmachungsdatum)\n\nNiedersachsen Amtsgericht Aurich HRA 111478 früher Amtsgericht Leer (Ostfriesland) (Leer)\nLöschungsankündigung\n\nAtlas Trampship Reederei GmbH & Co. MS \"DESSAU\" KG\nKommanditgesellschaft\nLeer\n\nDas Registergericht beabsichtigt, die Firma von Amts wegen nach § 395 FamFG zu löschen. Die Frist zur Erhebung eines Widerspruchs ist auf 1 Monat ab dieser Registerbekanntmachung festgesetzt."
    },
    {
      "date": "2025-03-13",
      "id": "103704",
      "original_text": "Registerbekanntmachung nach dem Umwandlungsgesetz\nBremen Amtsgericht Bremen HRB 25138\nHarren Financial Services GmbH – Bremen",
      "type": "Registerbekanntmachung nach dem Umwandlungsgesetz",
      "state": "Bremen",
      "amtsgericht": "Amtsgericht Bremen",
      "registernummer": "HRB 25138",
      "registerart": "HRB",
      "company_name": "Harren Financial Services GmbH",
      "company_seat": "Bremen",
      "details": "13.03.2025 (Bekanntmachungsdatum)\n\nBremen Amtsgericht Bremen HRB 25138\nRegisterbekanntmachung nach dem Umwandlungsgesetz 12.03.2025 (Eintragungsdatum)\n\nHarren Financial Services GmbH\nGesellschaft mit beschränkter Haftung\nBremen\n\nZu Eintragungsnummer 6 vom 12.03.2025 wird als nicht eingetragen veröffentlicht:\nDen Gläubigern der an der Verschmelzung beteiligten Rechtsträger ist, wenn sie binnen sechs Monaten nach dem Tag, an dem die Eintragung der Verschmelzung in das Register des Sitzes desjenigen Rechtsträgers, dessen Gläubiger sie sind, als bekannt gemacht gilt, ihren Anspruch nach Grund und Höhe schriftlich anmelden, Sicherheit zu leisten, soweit sie nicht Befriedigung verlangen können. Dieses Recht steht den Gläubigern jedoch nur zu, wenn sie glaubhaft machen, dass durch die Verschmelzung die Erfüllung ihrer Forderung gefährdet wird. Das Recht, Sicherheitsleistung zu verlangen, steht Gläubigern nicht zu, die im Falle der Insolvenz ein Recht auf vorzugsweise Befriedigung aus einer Deckungsmasse haben, die nach gesetzlicher Vorschrift zu ihrem Schutz errichtet und staatlich überwacht ist."
    },
    {
      "date": "2025-03-13",
      "id": "103705",
      "original_text": "Löschungsankündigung\nBremen Amtsgericht Bremen HRB 41158\nBalkan impex GmbH – Bremen",
      "type": "Löschungsankündigung",
      "state": "Bremen",
      "amtsgericht": "Amtsgericht Bremen",
      "registernummer": "HRB 41158",
      "registerart": "HRB",
      "company_name": "Balkan impex GmbH",
      "company_seat": "Bremen",
      "details": "13.03.2025 (Bekanntmachungsdatum)\n\nBremen Amtsgericht Bremen HRB 41158\nLöschungsankündigung\n\nBalkan impex GmbH\nGesellschaft mit beschränkter Haftung\nBremen\n\nEs ist beabsichtigt die im Handelsregister eingetragene Gesellschaft von Amts wegen gemäß § 394 FamFG zu löschen. Gegen die Löschung kann beim AG Bremen schriftlich oder zu Protokoll der Geschäftsstelle Widerspruch eingelegt werden. Widerspruchsfrist 4 Wochen."
    },
    {
      "date": "2025-03-13",
      "id": "103706",
      "original_text": "Registerbekanntmachung nach dem Umwandlungsgesetz\nBremen Amtsgericht Bremen HRB 31435\nPoseidon Trust UG (haftungsbeschränkt) – Bremen",
      "type": "Registerbekanntmachung nach dem Umwandlungsgesetz",
      "state": "Bremen",
      "amtsgericht": "Amtsgericht Bremen",
      "registernummer": "HRB 31435",
      "registerart": "HRB",
      "company_name": "Poseidon Trust UG (haftungsbeschränkt)",
      "company_seat": "Bremen",
      "details": "13.03.2025 (Bekanntmachungsdatum)\n\nBremen Amtsgericht Bremen HRB 31435\nRegisterbekanntmachung nach dem Umwandlungsgesetz 12.03.2025 (Eintragungsdatum)\n\nPoseidon Trust UG (haftungsbeschränkt)\nGesellschaft mit beschränkter Haftung\nBremen\n\nZu Eintragungsnummer 4 vom 12.03.2025 wird als nicht eingetragen veröffentlicht: Den Gläubigern der an der Verschmelzung beteiligten Rechtsträger ist, wenn sie binnen sechs Monaten nach dem Tag, an dem die Eintragung der Verschmelzung in das Register des Sitzes desjenigen Rechtsträgers, dessen Gläubiger sie sind, als bekannt gemacht gilt, ihren Anspruch nach Grund und Höhe schriftlich anmelden, Sicherheit zu leisten, soweit sie nicht Befriedigung verlangen können. Dieses Recht steht den Gläubigern jedoch nur zu, wenn sie glaubhaft machen, dass durch die Verschmelzung die Erfüllung ihrer Forderung gefährdet wird. Das Recht, Sicherheitsleistung zu verlangen, steht Gläubigern nicht zu, die im Falle der Insolvenz ein Recht auf vorzugsweise Befriedigung aus einer Deckungsmasse haben, die nach gesetzlicher Vorschrift zu ihrem Schutz errichtet und staatlich überwacht ist."
    },
    {
      "date": "2025-03-13",
      "id": "103707",
      "original_text": "Löschungsankündigung\nBremen Amtsgericht Bremen HRB 17062\nNiebank GmbH – Bremen",
      "type": "Löschungsankündigung",
      "state": "Bremen",
      "amtsgericht": "Amtsgericht Bremen",
      "registernummer": "HRB 17062",
      "registerart": "HRB",
      "company_name": "Niebank GmbH",
      "company_seat": "Bremen",
      "details": "13.03.2025 (Bekanntmachungsdatum)\n\nBremen Amtsgericht Bremen HRB 17062\nLöschungsankündigung\n\nNiebank GmbH\nGesellschaft mit beschränkter Haftung\nBremen\n\nEs ist beabsichtigt die im Handelsregister eingetragene Gesellschaft von Amts wegen gemäß § 394 FamFG zu löschen. Gegen die Löschung kann beim AG Bremen schriftlich oder zu Protokoll der Geschäftsstelle Widerspruch eingelegt werden. Widerspruchsfrist 4 Wochen."
    },
    {
      "date": "2025-03-13",
      "id": "103708",
      "original_text": "Löschungsankündigung\nRheinland-Pfalz Amtsgericht Ludwigshafen a.Rhein (Ludwigshafen) HRB 1923\nStolz & Post Gesellschaft mit beschränkter Haftung – Frankenthal",
      "type": "Löschungsankündigung",
      "state": "Rheinland-Pfalz",
      "amtsgericht": "Amtsgericht Ludwigshafen a.Rhein (Ludwigshafen)",
      "registernummer": "HRB 1923",
      "registerart": "HRB",
      "company_name": "Stolz & Post Gesellschaft mit beschränkter Haftung",
      "company_seat": "Frankenthal",
      "details": "13.03.2025 (Bekanntmachungsdatum)\n\nRheinland-Pfalz Amtsgericht Ludwigshafen a.Rhein (Ludwigshafen) HRB 1923\nLöschungsankündigung\n\nStolz & Post Gesellschaft mit beschränkter Haftung\nGesellschaft mit beschränkter Haftung\nFrankenthal\n\nDas Registergericht beabsichtigt die Gesellschaft von Amts wegen nach § 394 FamFG zu löschen. Die Frist zur Erhebung eines Widerspruchs ist auf einen Monat festgesetzt."
    },
    {
      "date": "2025-03-13",
      "id": "103709",
      "original_text": "Registerbekanntmachung nach dem Umwandlungsgesetz\nRheinland-Pfalz Amtsgericht Landau HRB 33811\nPALATAX Holding GmbH Wirtschaftsprüfungsgesellschaft – Landau in der Pfalz",
      "type": "Registerbekanntmachung nach dem Umwandlungsgesetz",
      "state": "Rheinland-Pfalz",
      "amtsgericht": "Amtsgericht Landau",
      "registernummer": "HRB 33811",
      "registerart": "HRB",
      "company_name": "PALATAX Holding GmbH Wirtschaftsprüfungsgesellschaft",
      "company_seat": "Landau in der Pfalz",
      "details": "13.03.2025 (Bekanntmachungsdatum)\n\nRheinland-Pfalz Amtsgericht Landau HRB 33811\nRegisterbekanntmachung nach dem Umwandlungsgesetz 13.03.2025 (Eintragungsdatum)\n\nPALATAX Holding GmbH Wirtschaftsprüfungsgesellschaft\nGesellschaft mit beschränkter Haftung\nLandau in der Pfalz\n\nAls nicht eingetragen wird veröffentlicht: Den Gläubigern der an der Verschmelzung beteiligten Rechtsträger ist, wenn sie binnen sechs Monaten nach dem Tag, an dem die Eintragung der Verschmelzung in das Register des Sitzes desjenigen Rechtsträgers,dessen Gläubiger sie sind, nach § 19 Abs. 3 UmwG als bekannt gemacht gilt, ihren Anspruch nach Grund und Höhe schriftlich anmelden, Sicherheit zu leisten, soweit sie nicht Befriedigung verlangen können. Dieses Recht steht den Gläubigern jedoch nur zu, wenn sie glaubhaft machen, dass durch die Verschmelzung die Erfüllung der Forderung gefährdet wird."
    },
    {
      "date": "2025-03-13",
      "id": "103710",
      "original_text": "Einreichung neuer Dokumente\nRheinland-Pfalz Amtsgericht Montabaur HRB 24401\n1&1 Mail & Media Applications SE – Montabaur",
      "type": "Einreichung neuer Dokumente",
      "state": "Rheinland-Pfalz",
      "amtsgericht": "Amtsgericht Montabaur",
      "registernummer": "HRB 24401",
      "registerart": "HRB",
      "company_name": "1&1 Mail & Media Applications SE",
      "company_seat": "Montabaur",
      "details": "13.03.2025 (Bekanntmachungsdatum)\n\nRheinland-Pfalz Amtsgericht Montabaur HRB 24401\nEinreichung neuer Dokumente\n\n1&1 Mail & Media Applications SE\nEuropäische Aktiengesellschaft (SE)\nMontabaur\n\nDem Registergericht ist eine neue Liste der Mitglieder des Aufsichtsrates eingereicht worden."
    },
    {
      "date": "2025-03-13",
      "id": "103711",
      "original_text": "Registerbekanntmachung nach dem Umwandlungsgesetz\nRheinland-Pfalz Amtsgericht Landau HRB 33821\nPALATAX GmbH Wirtschaftsprüfungsgesellschaft – Landau in der Pfalz",
      "type": "Registerbekanntmachung nach dem Umwandlungsgesetz",
      "state": "Rheinland-Pfalz",
      "amtsgericht": "Amtsgericht Landau",
      "registernummer": "HRB 33821",
      "registerart": "HRB",
      "company_name": "PALATAX GmbH Wirtschaftsprüfungsgesellschaft",
      "company_seat": "Landau in der Pfalz",
      "details": "13.03.2025 (Bekanntmachungsdatum)\n\nRheinland-Pfalz Amtsgericht Landau HRB 33821\nRegisterbekanntmachung nach dem Umwandlungsgesetz 13.03.2025 (Eintragungsdatum)\n\nPALATAX GmbH Wirtschaftsprüfungsgesellschaft\nGesellschaft mit beschränkter Haftung\nLandau in der Pfalz\n\nAls nicht eingetragen wird veröffentlicht: Den Gläubigern der an der Verschmelzung beteiligten Rechtsträger ist, wenn sie binnen sechs Monaten nach dem Tag, an dem die Eintragung der Verschmelzung in das Register des Sitzes desjenigen Rechtsträgers,dessen Gläubiger sie sind, nach § 19 Abs. 3 UmwG als bekannt gemacht gilt, ihren Anspruch nach Grund und Höhe schriftlich anmelden, Sicherheit zu leisten, soweit sie nicht Befriedigung verlangen können. Dieses Recht steht den Gläubigern jedoch nur zu, wenn sie glaubhaft machen, dass durch die Verschmelzung die Erfüllung der Forderung gefährdet wird."
    },
    {
      "date": "2025-03-13",
      "id": "103712",
      "original_text": "Löschungsankündigung\nRheinland-Pfalz Amtsgericht Zweibrücken HRB 30322\nWASA Verwaltungs GmbH – Waldfischbach-Burgalben",
      "type": "Löschungsankündigung",
      "state": "Rheinland-Pfalz",
      "amtsgericht": "Amtsgericht Zweibrücken",
      "registernummer": "HRB 30322",
      "registerart": "HRB",
      "company_name": "WASA Verwaltungs GmbH",
      "company_seat": "Waldfischbach-Burgalben",
      "details": "13.03.2025 (Bekanntmachungsdatum)\n\nRheinland-Pfalz Amtsgericht Zweibrücken HRB 30322\nLöschungsankündigung\n\nWASA Verwaltungs GmbH\nGesellschaft mit beschränkter Haftung\nWaldfischbach-Burgalben\n\nDas Registergericht beabsichtigt die Gesellschaft von Amts wegen nach § 394 FamFG zu löschen. Die Frist zur Erhebung eines Widerspruchs ist auf einen Monat festgesetzt."
    },
    {
      "date": "2025-03-13",
      "id": "103713",
      "original_text": "Löschungsankündigung\nNordrhein-Westfalen Amtsgericht Dortmund HRB 36511\nSOGUT Logistik GmbH – Dortmund",
      "type": "Löschungsankündigung",
      "state": "Nordrhein-Westfalen",
      "amtsgericht": "Amtsgericht Dortmund",
      "registernummer": "HRB 36511",
      "registerart": "HRB",
      "company_name": "SOGUT Logistik GmbH",
      "company_seat": "Dortmund",
      "details": "13.03.2025 (Bekanntmachungsdatum)\n\nNordrhein-Westfalen Amtsgericht Dortmund HRB 36511\nLöschungsankündigung\n\nSOGUT Logistik GmbH\nGesellschaft mit beschränkter Haftung\nDortmund\n\nDas Registergericht beabsichtigt die Gesellschaft von Amts wegen nach § 394 FamFG zu löschen. Die Frist zur Erhebung eines Widerspruchs ist auf zwei Monate festgesetzt."
    },
    {
      "date": "2025-03-13",
      "id": "103714",
      "original_text": "Einreichung neuer Dokumente\nNordrhein-Westfalen Amtsgericht Düsseldorf HRB 79055\nMETRO AG – Düsseldorf",
      "type": "Einreichung neuer Dokumente",
      "state": "Nordrhein-Westfalen",
      "amtsgericht": "Amtsgericht Düsseldorf",
      "registernummer": "HRB 79055",
      "registerart": "HRB",
      "company_name": "METRO AG",
      "company_seat": "Düsseldorf",
      "details": "13.03.2025 (Bekanntmachungsdatum)\n\nNordrhein-Westfalen Amtsgericht Düsseldorf HRB 79055\nEinreichung neuer Dokumente\n\nMETRO AG\nAktiengesellschaft\nDüsseldorf\n\nDem Registergericht ist eine Liste der Mitglieder des Aufsichtsrates eingereicht worden."
    },
    {
      "date": "2025-03-13",
      "id": "103715",
      "original_text": "Registerbekanntmachung nach dem Umwandlungsgesetz\nNordrhein-Westfalen Amtsgericht Arnsberg HRB 9939\nSeelenheimat UG (haftungsbeschränkt) – Marsberg",
      "type": "Registerbekanntmachung nach dem Umwandlungsgesetz",
      "state": "Nordrhein-Westfalen",
      "amtsgericht": "Amtsgericht Arnsberg",
      "registernummer": "HRB 9939",
      "registerart": "HRB",
      "company_name": "Seelenheimat UG (haftungsbeschränkt)",
      "company_seat": "Marsberg",
      "details": "13.03.2025 (Bekanntmachungsdatum)\n\nNordrhein-Westfalen Amtsgericht Arnsberg HRB 9939\nRegisterbekanntmachung nach dem Umwandlungsgesetz 13.03.2025 (Eintragungsdatum)\n\nSeelenheimat UG (haftungsbeschränkt)\nGesellschaft mit beschränkter Haftung\nMarsberg\n\nDen Gläubigern der an der Verschmelzung beteiligten Rechtsträger ist, wenn sie binnen sechs Monaten nach dem Tag, an dem die Eintragung der Verschmelzung in das Register des Sitzes desjenigen Rechtsträgers, dessen Gläubiger sie sind, nach § 19 Absatz 3 UmwG als bekanntgemacht gilt, ihren Anspruch nach Grund und Höhe schriftlich anmelden, Sicherheit zu leisten, soweit sie nicht Befriedigung verlangen können. Dieses Recht steht den Gläubigern jedoch nur zu, wenn sie glaubhaft machen, dass durch die Verschmelzung die Erfüllung ihrer Forderung gefährdet wird."
    },
    {
      "date": "2025-03-13",
      "id": "103716",
      "original_text": "Registerbekanntmachung nach dem Umwandlungsgesetz\nNordrhein-Westfalen Amtsgericht Essen GnR 374\nHomebase Vacation eG – Essen",
      "type": "Registerbekanntmachung nach dem Umwandlungsgesetz",
      "state": "Nordrhein-Westfalen",
      "amtsgericht": "Amtsgericht Essen",
      "registernummer": "GnR 374",
      "registerart": "GnR",
      "company_name": "Homebase Vacation eG",
      "company_seat": "Essen",
      "details": "13.03.2025 (Bekanntmachungsdatum)\n\nNordrhein-Westfalen Amtsgericht Essen GnR 374\nRegisterbekanntmachung nach dem Umwandlungsgesetz 13.03.2025 (Eintragungsdatum)\n\nHomebase Vacation eG\neingetragene Genossenschaft\nEssen\n\nDen Gläubigern der an der formwechselnden Umwandlung beteiligten Rechtsträger ist, wenn sie binnen sechs Monaten nach dem Tag, an dem die Eintragung der formwechselnden Umwandlung in das Register des Sitzes desjenigen Rechtsträgers, dessen Gläubiger sie sind, nach § 19 Absatz 3 UmwG als bekanntgemacht gilt, ihren Anspruch nach Grund und Höhe schriftlich anmelden, Sicherheit zu leisten, soweit sie nicht Befriedigung verlangen können. Dieses Recht steht den Gläubigern jedoch nur zu, wenn sie glaubhaft machen, dass durch die formwechselnden Umwandlung die Erfüllung ihrer Forderung gefährdet wird."
    },
    {
      "date": "2025-03-13",
      "id": "103717",
      "original_text": "Registerbekanntmachung nach dem Umwandlungsgesetz\nNordrhein-Westfalen Amtsgericht Bochum HRB 2072\nJosef Koch Tief- und Straßenbau-Gesellschaft mbH – Bochum",
      "type": "Registerbekanntmachung nach dem Umwandlungsgesetz",
      "state": "Nordrhein-Westfalen",
      "amtsgericht": "Amtsgericht Bochum",
      "registernummer": "HRB 2072",
      "registerart": "HRB",
      "company_name": "Josef Koch Tief- und Straßenbau-Gesellschaft mbH",
      "company_seat": "Bochum",
      "details": "13.03.2025 (Bekanntmachungsdatum)\n\nNordrhein-Westfalen Amtsgericht Bochum HRB 2072\nRegisterbekanntmachung nach dem Umwandlungsgesetz 10.03.2025 (Eintragungsdatum)\n\nJosef Koch Tief- und Straßenbau-Gesellschaft mbH\nGesellschaft mit beschränkter Haftung\nBochum\n\nDen Gläubigern der an der Abspaltung beteiligten Rechtsträger ist, wenn sie binnen sechs Monaten nach dem Tag, an dem die Eintragung der Abspaltung in das Register des Sitzes desjenigen Rechtsträgers, dessen Gläubiger sie sind, nach § 19 Absatz 3 UmwG als bekanntgemacht gilt, ihren Anspruch nach Grund und Höhe schriftlich anmelden, Sicherheit zu leisten, soweit sie nicht Befriedigung verlangen können. Dieses Recht steht den Gläubigern jedoch nur zu, wenn sie glaubhaft machen, dass durch die Abspaltung die Erfüllung ihrer Forderung gefährdet wird."
    },
    {
      "date": "2025-03-13",
      "id": "103718",
      "original_text": "Registerbekanntmachung nach dem Umwandlungsgesetz\nNordrhein-Westfalen Amtsgericht Wuppertal HRB 31107\ns2k digital GmbH – Wuppertal",
      "type": "Registerbekanntmachung nach dem Umwandlungsgesetz",
      "state": "Nordrhein-Westfalen",
      "amtsgericht": "Amtsgericht Wuppertal",
      "registernummer": "HRB 31107",
      "registerart": "HRB",
      "company_name": "s2k digital GmbH",
      "company_seat": "Wuppertal",
      "details": "13.03.2025 (Bekanntmachungsdatum)\n\nNordrhein-Westfalen Amtsgericht Wuppertal HRB 31107\nRegisterbekanntmachung nach dem Umwandlungsgesetz 13.03.2025 (Eintragungsdatum)\n\ns2k digital GmbH\nGesellschaft mit beschränkter Haftung\nWuppertal\n\nDen Gläubigern der an der Verschmelzung beteiligten Rechtsträger ist, wenn sie binnen sechs Monaten nach dem Tag, an dem die Eintragung der Verschmelzung in das Register des Sitzes desjenigen Rechtsträgers, dessen Gläubiger sie sind, nach § 19 Absatz 3 UmwG als bekanntgemacht gilt, ihren Anspruch nach Grund und Höhe schriftlich anmelden, Sicherheit zu leisten, soweit sie nicht Befriedigung verlangen können. Dieses Recht steht den Gläubigern jedoch nur zu, wenn sie glaubhaft machen, dass durch die Verschmelzung die Erfüllung ihrer Forderung gefährdet wird."
    },
    {
      "date": "2025-03-13",
      "id": "103719",
      "original_text": "Registerbekanntmachung nach dem Umwandlungsgesetz\nNordrhein-Westfalen Amtsgericht Dortmund HRB 2781\nProgas Verwaltungs-GmbH – Dortmund",
      "type": "Registerbekanntmachung nach dem Umwandlungsgesetz",
      "state": "Nordrhein-Westfalen",
      "amtsgericht": "Amtsgericht Dortmund",
      "registernummer": "HRB 2781",
      "registerart": "HRB",
      "company_name": "Progas Verwaltungs-GmbH",
      "company_seat": "Dortmund",
      "details": "13.03.2025 (Bekanntmachungsdatum)\n\nNordrhein-Westfalen Amtsgericht Dortmund HRB 2781\nRegisterbekanntmachung nach dem Umwandlungsgesetz 13.03.2025 (Eintragungsdatum)\n\nProgas Verwaltungs-GmbH\nGesellschaft mit beschränkter Haftung\nDortmund\n\nDen Gläubigern der an der Verschmelzung beteiligten Rechtsträger ist, wenn sie binnen sechs Monaten nach dem Tag, an dem die Eintragung der Verschmelzung in das Register des Sitzes desjenigen Rechtsträgers, dessen Gläubiger sie sind, nach § 19 Absatz 3 UmwG als bekanntgemacht gilt, ihren Anspruch nach Grund und Höhe schriftlich anmelden, Sicherheit zu leisten, soweit sie nicht Befriedigung verlangen können. Dieses Recht steht den Gläubigern jedoch nur zu, wenn sie glaubhaft machen, dass durch die Verschmelzung die Erfüllung ihrer Forderung gefährdet wird."
    },
    {
      "date": "2025-03-13",
      "id": "103720",
      "original_text": "Löschungsankündigung\nNordrhein-Westfalen Amtsgericht Mönchengladbach HRB 21162\nApex GmbH – Mönchengladbach",
      "type": "Löschungsankündigung",
      "state": "Nordrhein-Westfalen",
      "amtsgericht": "Amtsgericht Mönchengladbach",
      "registernummer": "HRB 21162",
      "registerart": "HRB",
      "company_name": "Apex GmbH",
      "company_seat": "Mönchengladbach",
      "details": "13.03.2025 (Bekanntmachungsdatum)\n\nNordrhein-Westfalen Amtsgericht Mönchengladbach HRB 21162\nLöschungsankündigung 13.03.2025 (Eintragungsdatum)\n\nApex GmbH\nGesellschaft mit beschränkter Haftung\nMönchengladbach\n\nDas Registergericht beabsichtigt die Gesellschaft von Amts wegen nach § 394 FamFG zu löschen. Die Frist zur Erhebung eines Widerspruchs ist auf drei Monate festgesetzt."
    },
    {
      "date": "2025-03-13",
      "id": "103721",
      "original_text": "Löschungsankündigung\nNordrhein-Westfalen Amtsgericht Krefeld HRB 16418\nBSZ Handel GmbH – Krefeld",
      "type": "Löschungsankündigung",
      "state": "Nordrhein-Westfalen",
      "amtsgericht": "Amtsgericht Krefeld",
      "registernummer": "HRB 16418",
      "registerart": "HRB",
      "company_name": "BSZ Handel GmbH",
      "company_seat": "Krefeld",
      "details": "13.03.2025 (Bekanntmachungsdatum)\n\nNordrhein-Westfalen Amtsgericht Krefeld HRB 16418\nLöschungsankündigung\n\nBSZ Handel GmbH\nGesellschaft mit beschränkter Haftung\nKrefeld\n\nDas Registergericht beabsichtigt die Gesellschaft von Amts wegen nach § 394 FamFG zu löschen. Die Frist zur Erhebung eines Widerspruchs ist auf einen Monat festgesetzt."
    },
    {
      "date": "2025-03-13",
      "id": "103722",
      "original_text": "Löschungsankündigung\nNordrhein-Westfalen Amtsgericht Krefeld HRB 15669\nTMW Technische Manufaktur Willich GmbH – Willich",
      "type": "Löschungsankündigung",
      "state": "Nordrhein-Westfalen",
      "amtsgericht": "Amtsgericht Krefeld",
      "registernummer": "HRB 15669",
      "registerart": "HRB",
      "company_name": "TMW Technische Manufaktur Willich GmbH",
      "company_seat": "Willich",
      "details": "13.03.2025 (Bekanntmachungsdatum)\n\nNordrhein-Westfalen Amtsgericht Krefeld HRB 15669\nLöschungsankündigung\n\nTMW Technische Manufaktur Willich GmbH\nGesellschaft mit beschränkter Haftung\nWillich\n\nDas Registergericht beabsichtigt die Gesellschaft von Amts wegen nach § 394 FamFG zu löschen. Die Frist zur Erhebung eines Widerspruchs ist auf einen Monat festgesetzt."
    },
    {
      "date": "2025-03-13",
      "id": "103723",
      "original_text": "Sonstige Registerbekanntmachung\nNordrhein-Westfalen Amtsgericht Aachen HRB 560\nSTAWAG - Stadt- und Städteregionswerke Aachen AG – Aachen",
      "type": "Sonstige Registerbekanntmachung",
      "state": "Nordrhein-Westfalen",
      "amtsgericht": "Amtsgericht Aachen",
      "registernummer": "HRB 560",
      "registerart": "HRB",
      "company_name": "STAWAG - Stadt- und Städteregionswerke Aachen AG",
      "company_seat": "Aachen",
      "details": "13.03.2025 (Bekanntmachungsdatum)\n\nNordrhein-Westfalen Amtsgericht Aachen HRB 560\nSonstige Registerbekanntmachung\n\nSTAWAG - Stadt- und Städteregionswerke Aachen AG\nAktiengesellschaft\nAachen\n\nDem Registergericht ist eine Liste der Mitglieder des Aufsichtsrates eingereicht worden."
    },
    {
      "date": "2025-03-13",
      "id": "103724",
      "original_text": "Löschungsankündigung\nNordrhein-Westfalen Amtsgericht Essen HRB 26076\nTruck Team Logistik GmbH – Sprockhövel",
      "type": "Löschungsankündigung",
      "state": "Nordrhein-Westfalen",
      "amtsgericht": "Amtsgericht Essen",
      "registernummer": "HRB 26076",
      "registerart": "HRB",
      "company_name": "Truck Team Logistik GmbH",
      "company_seat": "Sprockhövel",
      "details": "13.03.2025 (Bekanntmachungsdatum)\n\nNordrhein-Westfalen Amtsgericht Essen HRB 26076\nLöschungsankündigung\n\nTruck Team Logistik GmbH\nGesellschaft mit beschränkter Haftung\nSprockhövel\n\nDas Registergericht beabsichtigt die Gesellschaft von Amts wegen nach § 394 FamFG zu löschen. Die Frist zur Erhebung eines Widerspruchs ist auf einen Monat festgesetzt."
    },
    {
      "date": "2025-03-13",
      "id": "103725",
      "original_text": "Löschungsankündigung\nNordrhein-Westfalen Amtsgericht Wuppertal HRB 24151\nAtlacon Unternehmergesellschaft (haftungsbeschränkt) – Wuppertal",
      "type": "Löschungsankündigung",
      "state": "Nordrhein-Westfalen",
      "amtsgericht": "Amtsgericht Wuppertal",
      "registernummer": "HRB 24151",
      "registerart": "HRB",
      "company_name": "Atlacon Unternehmergesellschaft (haftungsbeschränkt)",
      "company_seat": "Wuppertal",
      "details": "13.03.2025 (Bekanntmachungsdatum)\n\nNordrhein-Westfalen Amtsgericht Wuppertal HRB 24151\nLöschungsankündigung 12.03.2025 (Eintragungsdatum)\n\nAtlacon Unternehmergesellschaft (haftungsbeschränkt)\nGesellschaft mit beschränkter Haftung\nWuppertal\n\nDas Registergericht beabsichtigt die Gesellschaft von Amts wegen nach § 394 FamFG zu löschen. Die Frist zur Erhebung eines Widerspruchs ist auf einen Monat festgesetzt."
    },
    {
      "date": "2025-03-13",
      "id": "103726",
      "original_text": "Sonstige Registerbekanntmachung\nNordrhein-Westfalen Amtsgericht Düsseldorf HRB 89583\nDK Sicures UG (haftungsbeschränkt) – Hilden",
      "type": "Sonstige Registerbekanntmachung",
      "state": "Nordrhein-Westfalen",
      "amtsgericht": "Amtsgericht Düsseldorf",
      "registernummer": "HRB 89583",
      "registerart": "HRB",
      "company_name": "DK Sicures UG (haftungsbeschränkt)",
      "company_seat": "Hilden",
      "details": "13.03.2025 (Bekanntmachungsdatum)\n\nNordrhein-Westfalen Amtsgericht Düsseldorf HRB 89583\nSonstige Registerbekanntmachung 13.03.2025 (Eintragungsdatum)\n\nDK Sicures UG (haftungsbeschränkt)\nGesellschaft mit beschränkter Haftung\nHilden\n\nDie Gesellschaft ist aufgelöst. Von Amts wegen eingetragen."
    },
    {
      "date": "2025-03-13",
      "id": "103727",
      "original_text": "Löschungsankündigung\nNordrhein-Westfalen Amtsgericht Gelsenkirchen HRB 17378\nMARNUS GmbH – Gladbeck",
      "type": "Löschungsankündigung",
      "state": "Nordrhein-Westfalen",
      "amtsgericht": "Amtsgericht Gelsenkirchen",
      "registernummer": "HRB 17378",
      "registerart": "HRB",
      "company_name": "MARNUS GmbH",
      "company_seat": "Gladbeck",
      "details": "13.03.2025 (Bekanntmachungsdatum)\n\nNordrhein-Westfalen Amtsgericht Gelsenkirchen HRB 17378\nLöschungsankündigung\n\nMARNUS GmbH\nGesellschaft mit beschränkter Haftung\nGladbeck\n\nDas Gericht beabsichtigt, die eingetragene MARNUS GmbH mit Sitz in Gladbeck, HRB 17378, Amtsgericht Gelsenkirchen, wegen Vermögenslosigkeit zu löschen.\nHiermit wird denjenigen, die an der Unterlassung der Löschung ein berechtigtes Interesse haben, gem. § 394 Abs. 2 FamFG Gelegenheit gegeben, gegen dieses Vorhaben binnen eines Monats nach dieser Bekanntmachung Widerspruch einzulegen. Der Widerspruch kann schriftlich oder zu Protokoll der Geschäftsstelle erhoben werden."
    },
    {
      "date": "2025-03-13",
      "id": "103728",
      "original_text": "Einreichung neuer Dokumente\nNordrhein-Westfalen Amtsgericht Köln HRB 101097\nDeutscher Pensionsfonds Aktiengesellschaft – Köln",
      "type": "Einreichung neuer Dokumente",
      "state": "Nordrhein-Westfalen",
      "amtsgericht": "Amtsgericht Köln",
      "registernummer": "HRB 101097",
      "registerart": "HRB",
      "company_name": "Deutscher Pensionsfonds Aktiengesellschaft",
      "company_seat": "Köln",
      "details": "13.03.2025 (Bekanntmachungsdatum)\n\nNordrhein-Westfalen Amtsgericht Köln HRB 101097\nEinreichung neuer Dokumente\n\nDeutscher Pensionsfonds Aktiengesellschaft\nAktiengesellschaft\nKöln\n\nDem Registergericht ist eine Liste der Mitglieder des Aufsichtsrates eingereicht worden."
    },
    {
      "date": "2025-03-13",
      "id": "103729",
      "original_text": "Löschungsankündigung\nNordrhein-Westfalen Amtsgericht Essen HRA 7143\nTROMPETER GmbH & Co. KG – Essen",
      "type": "Löschungsankündigung",
      "state": "Nordrhein-Westfalen",
      "amtsgericht": "Amtsgericht Essen",
      "registernummer": "HRA 7143",
      "registerart": "HRA",
      "company_name": "TROMPETER GmbH & Co. KG",
      "company_seat": "Essen",
      "details": "13.03.2025 (Bekanntmachungsdatum)\n\nNordrhein-Westfalen Amtsgericht Essen HRA 7143\nLöschungsankündigung\n\nTROMPETER GmbH & Co. KG\nKommanditgesellschaft\nEssen\n\nDas Registergericht beabsichtigt die Firma von Amts wegen nach § 394 Abs.4 FamFG zu löschen. Die Frist zur Erhebung eines Widerspruchs ist auf 3 Monate festgesetzt."
    },
    {
      "date": "2025-03-13",
      "id": "103730",
      "original_text": "Löschungsankündigung\nNordrhein-Westfalen Amtsgericht Mönchengladbach HRB 20567\nInvictus Event & Sicherheit GmbH – Mönchengladbach",
      "type": "Löschungsankündigung",
      "state": "Nordrhein-Westfalen",
      "amtsgericht": "Amtsgericht Mönchengladbach",
      "registernummer": "HRB 20567",
      "registerart": "HRB",
      "company_name": "Invictus Event & Sicherheit GmbH",
      "company_seat": "Mönchengladbach",
      "details": "13.03.2025 (Bekanntmachungsdatum)\n\nNordrhein-Westfalen Amtsgericht Mönchengladbach HRB 20567\nLöschungsankündigung\n\nInvictus Event & Sicherheit GmbH\nGesellschaft mit beschränkter Haftung\nMönchengladbach\n\nInvictus Event & Sicherheit GmbH, Mönchengladbach (Amtsgericht Mönchengladbach, HRB 20567).\nDas Registergericht beabsichtigt, die im Handelsregister eingetragene Gesellschaft gemäß § 394 Absatz 1 FamFG wegen Vermögenslosigkeit von Amts wegen zu löschen. Gegen diese Verfügung kann Widerspruch eingelegt werden. Die Frist zur Erhebung eines Widerspruchs gegen die beabsichtigte Löschung von Amts wegen ist auf drei Monate festgesetzt."
    },
    {
      "date": "2025-03-13",
      "id": "103731",
      "original_text": "Löschungsankündigung\nNordrhein-Westfalen Amtsgericht Wuppertal HRA 25578\nHWZ GmbH & Co. KG – Remscheid",
      "type": "Löschungsankündigung",
      "state": "Nordrhein-Westfalen",
      "amtsgericht": "Amtsgericht Wuppertal",
      "registernummer": "HRA 25578",
      "registerart": "HRA",
      "company_name": "HWZ GmbH & Co. KG",
      "company_seat": "Remscheid",
      "details": "13.03.2025 (Bekanntmachungsdatum)\n\nNordrhein-Westfalen Amtsgericht Wuppertal HRA 25578\nLöschungsankündigung\n\nHWZ GmbH & Co. KG\nKommanditgesellschaft\nRemscheid\n\nDas Registergericht beabsichtigt die Firma von Amts wegen nach § 394 FamFG zu löschen. Die Frist zur Erhebung eines Widerspruchs ist auf drei Monate festgesetzt."
    },
    {
      "date": "2025-03-13",
      "id": "103732",
      "original_text": "Einreichung neuer Dokumente\nThüringen Amtsgericht Jena HRB 202956\nBurdo-Bäuerliche Aktiengesellschaft – Tanna",
      "type": "Einreichung neuer Dokumente",
      "state": "Thüringen",
      "amtsgericht": "Amtsgericht Jena",
      "registernummer": "HRB 202956",
      "registerart": "HRB",
      "company_name": "Burdo-Bäuerliche Aktiengesellschaft",
      "company_seat": "Tanna",
      "details": "13.03.2025 (Bekanntmachungsdatum)\n\nThüringen Amtsgericht Jena HRB 202956\nEinreichung neuer Dokumente\n\nBurdo-Bäuerliche Aktiengesellschaft\nAktiengesellschaft\nTanna\n\nBekanntmachung gem. § 106 AktG: Aufgrund einer Veränderung in den Personen der Aufsichtsratsmitglieder ist durch den Vorstand eine neue Liste zum Handelsregister eingereicht worden."
    },
    {
      "date": "2025-03-13",
      "id": "103733",
      "original_text": "Löschungsankündigung\nHessen Amtsgericht Frankfurt am Main HRB 99572\nTaunusberger GmbH – Frankfurt am Main",
      "type": "Löschungsankündigung",
      "state": "Hessen",
      "amtsgericht": "Amtsgericht Frankfurt am Main",
      "registernummer": "HRB 99572",
      "registerart": "HRB",
      "company_name": "Taunusberger GmbH",
      "company_seat": "Frankfurt am Main",
      "details": "13.03.2025 (Bekanntmachungsdatum)\n\nHessen Amtsgericht Frankfurt am Main HRB 99572\nLöschungsankündigung\n\nTaunusberger GmbH\nGesellschaft mit beschränkter Haftung\nFrankfurt am Main\n\nDas Registergericht beabsichtigt die im Handelsregister eingetragene Gesellschaft von Amts wegen nach § 394 FamFG zu löschen. Hiergegen kann innerhalb eines Monats nach dieser Veröffentlichung Widerspruch beim Amtsgericht Frankfurt am Main eingelegt werden."
    },
    {
      "date": "2025-03-13",
      "id": "103734",
      "original_text": "Löschungsankündigung\nHessen Amtsgericht Friedberg HRB 9938\nRalf Auto GmbH – Ranstadt",
      "type": "Löschungsankündigung",
      "state": "Hessen",
      "amtsgericht": "Amtsgericht Friedberg",
      "registernummer": "HRB 9938",
      "registerart": "HRB",
      "company_name": "Ralf Auto GmbH",
      "company_seat": "Ranstadt",
      "details": "13.03.2025 (Bekanntmachungsdatum)\n\nHessen Amtsgericht Friedberg HRB 9938\nLöschungsankündigung\n\nRalf Auto GmbH\nGesellschaft mit beschränkter Haftung\nRanstadt\n\nDas Registergericht beabsichtigt die im Handelsregister eingetragene Gesellschaft von Amts wegen nach § 394 FamFG zu löschen. Die Frist zur Erhebung eines Widerspruchs gegen die beabsichtigte Löschung wird auf 3 Monate festgesetzt."
    },
    {
      "date": "2025-03-13",
      "id": "103735",
      "original_text": "Sonstige Registerbekanntmachung\nHessen Amtsgericht Frankfurt am Main HRB 12394\nDeutsche Gesellschaft für Internationale Zusammenarbeit (GIZ) GmbH – Eschborn und Bonn",
      "type": "Sonstige Registerbekanntmachung",
      "state": "Hessen",
      "amtsgericht": "Amtsgericht Frankfurt am Main",
      "registernummer": "HRB 12394",
      "registerart": "HRB",
      "company_name": "Deutsche Gesellschaft für Internationale Zusammenarbeit (GIZ) GmbH",
      "company_seat": "Eschborn und Bonn",
      "details": "13.03.2025 (Bekanntmachungsdatum)\n\nHessen Amtsgericht Frankfurt am Main HRB 12394\nSonstige Registerbekanntmachung\n\nDeutsche Gesellschaft für Internationale Zusammenarbeit (GIZ) GmbH\nGesellschaft mit beschränkter Haftung\nEschborn und Bonn\n\nDurch eine Änderung in den Personen der Aufsichtsratsmitglieder ist eine Liste der Mitglieder des Aufsichtsrates zum Handelsregister eingereicht worden."
    },
    {
      "date": "2025-03-13",
      "id": "103736",
      "original_text": "Sonstige Registerbekanntmachung\nHessen Amtsgericht Frankfurt am Main HRB 42397\nABG FRANKFURT HOLDING Wohnungsbau- und Beteiligungsgesellschaft mit beschränkter Haftung – Frankfurt am Main",
      "type": "Sonstige Registerbekanntmachung",
      "state": "Hessen",
      "amtsgericht": "Amtsgericht Frankfurt am Main",
      "registernummer": "HRB 42397",
      "registerart": "HRB",
      "company_name": "ABG FRANKFURT HOLDING Wohnungsbau- und Beteiligungsgesellschaft mit beschränkter Haftung",
      "company_seat": "Frankfurt am Main",
      "details": "13.03.2025 (Bekanntmachungsdatum)\n\nHessen Amtsgericht Frankfurt am Main HRB 42397\nSonstige Registerbekanntmachung\n\nABG FRANKFURT HOLDING Wohnungsbau- und Beteiligungsgesellschaft mit beschränkter Haftung\nGesellschaft mit beschränkter Haftung\nFrankfurt am Main\n\nDurch eine Änderung in den Personen der Aufsichtsratsmitglieder ist eine Liste der Mitglieder des Aufsichtsrates zum Handelsregister eingereicht worden."
    },
    {
      "date": "2025-03-13",
      "id": "103737",
      "original_text": "Löschungsankündigung\nHessen Amtsgericht Offenbach am Main HRB 50652\nAKY-BAU UG (haftungsbeschränkt) – Offenbach am Main",
      "type": "Löschungsankündigung",
      "state": "Hessen",
      "amtsgericht": "Amtsgericht Offenbach am Main",
      "registernummer": "HRB 50652",
      "registerart": "HRB",
      "company_name": "AKY-BAU UG (haftungsbeschränkt)",
      "company_seat": "Offenbach am Main",
      "details": "13.03.2025 (Bekanntmachungsdatum)\n\nHessen Amtsgericht Offenbach am Main HRB 50652\nLöschungsankündigung 12.03.2025 (Eintragungsdatum)\n\nAKY-BAU UG (haftungsbeschränkt)\nGesellschaft mit beschränkter Haftung\nOffenbach am Main\n\nDas Registergericht beabsichtigt die im Handelsregister eingetragene Gesellschaft von Amts wegen nach § 394 FamFG zu löschen. Die Frist zur Erhebung eines Widerspruchs gegen die beabsichtigte Löschung wird auf 3 Monate festgesetzt."
    },
    {
      "date": "2025-03-13",
      "id": "103738",
      "original_text": "Registerbekanntmachung nach dem Umwandlungsgesetz\nHessen Amtsgericht Frankfurt am Main HRB 128846\nEnergiegesellschaft Garthe mbH – Frankfurt am Main",
      "type": "Registerbekanntmachung nach dem Umwandlungsgesetz",
      "state": "Hessen",
      "amtsgericht": "Amtsgericht Frankfurt am Main",
      "registernummer": "HRB 128846",
      "registerart": "HRB",
      "company_name": "Energiegesellschaft Garthe mbH",
      "company_seat": "Frankfurt am Main",
      "details": "13.03.2025 (Bekanntmachungsdatum)\n\nHessen Amtsgericht Frankfurt am Main HRB 128846\nRegisterbekanntmachung nach dem Umwandlungsgesetz 13.03.2025 (Eintragungsdatum)\n\nEnergiegesellschaft Garthe mbH\nGesellschaft mit beschränkter Haftung\nFrankfurt am Main\n\nDen Gläubigern der an der Verschmelzung beteiligten Rechtsträger ist, wenn sie binnen sechs Monaten nach dem Tag, an dem die Eintragung der Verschmelzung in das Register des Sitzes derjenigen Rechtsträger deren Gläubiger sie sind, nach § 19 Absatz 3 UmwG bekannt gemacht worden ist, ihren Anspruch nach Grund und Höhe schriftlich anmelden, Sicherheit zu leisten, soweit sie nicht Befriedigung verlangen können. Dieses Recht steht den Gläubigern jedoch nur zu, wenn sie glaubhaft machen, dass durch die Verschmelzung die Erfüllung ihrer Forderung gefährdet wird."
    },
    {
      "date": "2025-03-13",
      "id": "103739",
      "original_text": "Löschungsankündigung\nHessen Amtsgericht Frankfurt am Main HRB 118786\nSofort Main 120 VV UG (haftungsbeschränkt) – Frankfurt am Main",
      "type": "Löschungsankündigung",
      "state": "Hessen",
      "amtsgericht": "Amtsgericht Frankfurt am Main",
      "registernummer": "HRB 118786",
      "registerart": "HRB",
      "company_name": "Sofort Main 120 VV UG (haftungsbeschränkt)",
      "company_seat": "Frankfurt am Main",
      "details": "13.03.2025 (Bekanntmachungsdatum)\n\nHessen Amtsgericht Frankfurt am Main HRB 118786\nLöschungsankündigung\n\nSofort Main 120 VV UG (haftungsbeschränkt)\nGesellschaft mit beschränkter Haftung\nFrankfurt am Main\n\nes ist beabsichtigt, den Geschäftsführer Zenk gemäß § 395 FamFG von Amts wegen aus dem Handelsregister zu löschen. Hiergegen kann innerhalb eines Zeitraums von einem Monat nach Zustellung dieser Verfügung Widerspruch bei dem Amtsgericht Frankfurt am Main eingelegt werden."
    },
    {
      "date": "2025-03-13",
      "id": "103740",
      "original_text": "Einreichung neuer Dokumente\nHessen Amtsgericht Frankfurt am Main HRB 31190\nZürich Beteiligungs-Aktiengesellschaft (Deutschland) – Frankfurt am Main",
      "type": "Einreichung neuer Dokumente",
      "state": "Hessen",
      "amtsgericht": "Amtsgericht Frankfurt am Main",
      "registernummer": "HRB 31190",
      "registerart": "HRB",
      "company_name": "Zürich Beteiligungs-Aktiengesellschaft (Deutschland)",
      "company_seat": "Frankfurt am Main",
      "details": "13.03.2025 (Bekanntmachungsdatum)\n\nHessen Amtsgericht Frankfurt am Main HRB 31190\nEinreichung neuer Dokumente\n\nZürich Beteiligungs-Aktiengesellschaft (Deutschland)\nAktiengesellschaft\nFrankfurt am Main\n\nDurch eine Änderung in den Personen der Aufsichtsratsmitglieder ist eine Liste der Mitglieder des Aufsichtsrates zum Handelsregister eingereicht worden."
    },
    {
      "date": "2025-03-13",
      "id": "103741",
      "original_text": "Löschungsankündigung\nHessen Amtsgericht Darmstadt HRB 98104\nPredisoft Deutschland UG (haftungsbeschränkt) – Darmstadt",
      "type": "Löschungsankündigung",
      "state": "Hessen",
      "amtsgericht": "Amtsgericht Darmstadt",
      "registernummer": "HRB 98104",
      "registerart": "HRB",
      "company_name": "Predisoft Deutschland UG (haftungsbeschränkt)",
      "company_seat": "Darmstadt",
      "details": "13.03.2025 (Bekanntmachungsdatum)\n\nHessen Amtsgericht Darmstadt HRB 98104\nLöschungsankündigung 13.03.2025 (Eintragungsdatum)\n\nPredisoft Deutschland UG (haftungsbeschränkt)\nGesellschaft mit beschränkter Haftung\nDarmstadt\n\nDas Registergericht beabsichtigt die im Handelsregister eingetragene Gesellschaft von Amts wegen nach § 394 FamFG zu löschen. Die Frist zur Erhebung eines Widerspruchs gegen die beabsichtigte Löschung wird auf 3 Monate festgesetzt."
    },
    {
      "date": "2025-03-13",
      "id": "103742",
      "original_text": "Löschungsankündigung\nHessen Amtsgericht Wiesbaden HRB 34029\nOlis Deutschland UG (haftungsbeschränkt) – Wiesbaden",
      "type": "Löschungsankündigung",
      "state": "Hessen",
      "amtsgericht": "Amtsgericht Wiesbaden",
      "registernummer": "HRB 34029",
      "registerart": "HRB",
      "company_name": "Olis Deutschland UG (haftungsbeschränkt)",
      "company_seat": "Wiesbaden",
      "details": "13.03.2025 (Bekanntmachungsdatum)\n\nHessen Amtsgericht Wiesbaden HRB 34029\nLöschungsankündigung\n\nOlis Deutschland UG (haftungsbeschränkt)\nGesellschaft mit beschränkter Haftung\nWiesbaden\n\nDas Registergericht beabsichtigt die im Handelsregister eingetragene Gesellschaft von Amts wegen nach § 394 FamFG zu löschen. Die Frist zur Erhebung eines Widerspruchs gegen die beabsichtigte Löschung wird auf 3 Monate festgesetzt."
    },
    {
      "date": "2025-03-13",
      "id": "103743",
      "original_text": "Registerbekanntmachung nach dem Umwandlungsgesetz\nHessen Amtsgericht Bad Homburg v.d.H. HRB 10579\nK-Secundus GmbH – Bad Homburg v. d. Höhe",
      "type": "Registerbekanntmachung nach dem Umwandlungsgesetz",
      "state": "Hessen",
      "amtsgericht": "Amtsgericht Bad Homburg v.d.H.",
      "registernummer": "HRB 10579",
      "registerart": "HRB",
      "company_name": "K-Secundus GmbH",
      "company_seat": "Bad Homburg v. d. Höhe",
      "details": "13.03.2025 (Bekanntmachungsdatum)\n\nHessen Amtsgericht Bad Homburg v.d.H. HRB 10579\nRegisterbekanntmachung nach dem Umwandlungsgesetz 13.03.2025 (Eintragungsdatum)\n\nK-Secundus GmbH\nGesellschaft mit beschränkter Haftung\nBad Homburg v. d. Höhe\n\nDen Gläubigern der an der Verschmelzung beteiligten Rechtsträger ist, wenn sie binnen sechs Monaten nach dem Tag, an dem die Eintragung der Verschmelzung in das Register des Sitzes desjenigen Rechtsträgers, dessen Gläubiger sie sind, nach § 19 Absatz 3 UmwG bekannt gemacht worden ist, ihren Anspruch nach Grund und Höhe schriftlich anmelden, Sicherheit zu leisten, soweit sie nicht Befriedigung verlangen können. Dieses Recht steht den Gläubigern jedoch nur zu, wenn sie glaubhaft machen, dass durch die Verschmelzung die Erfüllung ihrer Forderung gefährdet wird."
    },
    {
      "date": "2025-03-13",
      "id": "103744",
      "original_text": "Löschungsankündigung\nHessen Amtsgericht Wiesbaden HRB 25349\nHaage & Partner Computer GmbH – Wiesbaden",
      "type": "Löschungsankündigung",
      "state": "Hessen",
      "amtsgericht": "Amtsgericht Wiesbaden",
      "registernummer": "HRB 25349",
      "registerart": "HRB",
      "company_name": "Haage & Partner Computer GmbH",
      "company_seat": "Wiesbaden",
      "details": "13.03.2025 (Bekanntmachungsdatum)\n\nHessen Amtsgericht Wiesbaden HRB 25349\nLöschungsankündigung\n\nHaage & Partner Computer GmbH\nGesellschaft mit beschränkter Haftung\nWiesbaden\n\nDas Registergericht beabsichtigt die im Handelsregister eingetragene Gesellschaft von Amts wegen nach § 394 FamFG zu löschen. Die Frist zur Erhebung eines Widerspruchs gegen die beabsichtigte Löschung wird auf 3 Monate festgesetzt."
    },
    {
      "date": "2025-03-13",
      "id": "103745",
      "original_text": "Einreichung neuer Dokumente\nHessen Amtsgericht Offenbach am Main HRB 57170\nProxalto Lebensversicherung Aktiengesellschaft – Neu-Isenburg",
      "type": "Einreichung neuer Dokumente",
      "state": "Hessen",
      "amtsgericht": "Amtsgericht Offenbach am Main",
      "registernummer": "HRB 57170",
      "registerart": "HRB",
      "company_name": "Proxalto Lebensversicherung Aktiengesellschaft",
      "company_seat": "Neu-Isenburg",
      "details": "13.03.2025 (Bekanntmachungsdatum)\n\nHessen Amtsgericht Offenbach am Main HRB 57170\nEinreichung neuer Dokumente 13.03.2025 (Eintragungsdatum)\n\nProxalto Lebensversicherung Aktiengesellschaft\nAktiengesellschaft\nNeu-Isenburg\n\nDurch eine Änderung in den Personen der Aufsichtsratsmitglieder ist eine Liste der Mitglieder des Aufsichtsrates zum Handelsregister eingereicht worden."
    },
    {
      "date": "2025-03-13",
      "id": "103746",
      "original_text": "Löschungsankündigung\nHessen Amtsgericht Wiesbaden HRB 29484\nR+H Consulting GmbH – Wiesbaden",
      "type": "Löschungsankündigung",
      "state": "Hessen",
      "amtsgericht": "Amtsgericht Wiesbaden",
      "registernummer": "HRB 29484",
      "registerart": "HRB",
      "company_name": "R+H Consulting GmbH",
      "company_seat": "Wiesbaden",
      "details": "13.03.2025 (Bekanntmachungsdatum)\n\nHessen Amtsgericht Wiesbaden HRB 29484\nLöschungsankündigung\n\nR+H Consulting GmbH\nGesellschaft mit beschränkter Haftung\nWiesbaden\n\nDas Registergericht beabsichtigt die im Handelsregister eingetragene Gesellschaft von Amts wegen nach § 394 FamFG zu löschen. Die Frist zur Erhebung eines Widerspruchs gegen die beabsichtigte Löschung wird auf 3 Monate festgesetzt."
    },
    {
      "date": "2025-03-13",
      "id": "103747",
      "original_text": "Löschungsankündigung\nHessen Amtsgericht Darmstadt VR 84085\nPlatinengarten e.V. – Darmstadt",
      "type": "Löschungsankündigung",
      "state": "Hessen",
      "amtsgericht": "Amtsgericht Darmstadt",
      "registernummer": "VR 84085",
      "registerart": "VR",
      "company_name": "Platinengarten e.V.",
      "company_seat": "Darmstadt",
      "details": "13.03.2025 (Bekanntmachungsdatum)\n\nHessen Amtsgericht Darmstadt VR 84085\nLöschungsankündigung 13.03.2025 (Eintragungsdatum)\n\nPlatinengarten e.V.\neingetragener Verein\nDarmstadt\n\nDer Verein ist aufgelöst."
    },
    {
      "date": "2025-03-13",
      "id": "103748",
      "original_text": "Registerbekanntmachung nach dem Umwandlungsgesetz\nHessen Amtsgericht Bad Homburg v.d.H. HRB 10578\nK-Primus GmbH – Bad Homburg v. d. Höhe",
      "type": "Registerbekanntmachung nach dem Umwandlungsgesetz",
      "state": "Hessen",
      "amtsgericht": "Amtsgericht Bad Homburg v.d.H.",
      "registernummer": "HRB 10578",
      "registerart": "HRB",
      "company_name": "K-Primus GmbH",
      "company_seat": "Bad Homburg v. d. Höhe",
      "details": "13.03.2025 (Bekanntmachungsdatum)\n\nHessen Amtsgericht Bad Homburg v.d.H. HRB 10578\nRegisterbekanntmachung nach dem Umwandlungsgesetz 13.03.2025 (Eintragungsdatum)\n\nK-Primus GmbH\nGesellschaft mit beschränkter Haftung\nBad Homburg v. d. Höhe\n\nDen Gläubigern der an der Verschmelzung beteiligten Rechtsträger ist, wenn sie binnen sechs Monaten nach dem Tag, an dem die Eintragung der Verschmelzung in das Register des Sitzes desjenigen Rechtsträgers, dessen Gläubiger sie sind, nach § 19 Absatz 3 UmwG bekannt gemacht worden ist, ihren Anspruch nach Grund und Höhe schriftlich anmelden, Sicherheit zu leisten, soweit sie nicht Befriedigung verlangen können. Dieses Recht steht den Gläubigern jedoch nur zu, wenn sie glaubhaft machen, dass durch die Verschmelzung die Erfüllung ihrer Forderung gefährdet wird."
    },
    {
      "date": "2025-03-13",
      "id": "103749",
      "original_text": "Löschungsankündigung\nHessen Amtsgericht Frankfurt am Main HRB 89407\nALM Gebäudeservice GmbH – Hattersheim am Main",
      "type": "Löschungsankündigung",
      "state": "Hessen",
      "amtsgericht": "Amtsgericht Frankfurt am Main",
      "registernummer": "HRB 89407",
      "registerart": "HRB",
      "company_name": "ALM Gebäudeservice GmbH",
      "company_seat": "Hattersheim am Main",
      "details": "13.03.2025 (Bekanntmachungsdatum)\n\nHessen Amtsgericht Frankfurt am Main HRB 89407\nLöschungsankündigung\n\nALM Gebäudeservice GmbH\nGesellschaft mit beschränkter Haftung\nHattersheim am Main\n\nEs ist beabsichtigt die Gesellschaft wegen Vermögenslosigkeit gemäß § 394 FamFG von Amts wegen zu löschen. Hiergegen kann innerhalb eines Monats nach dieser Veröffentlichung Widerspruch bei dem Amtsgericht Frankfurt am Main eingelegt werden."
    },
    {
      "date": "2025-03-13",
      "id": "103750",
      "original_text": "Löschungsankündigung\nHessen Amtsgericht Gießen HRB 3065\nHöBa Wohn- und Gewerbebau GmbH – Wettenberg",
      "type": "Löschungsankündigung",
      "state": "Hessen",
      "amtsgericht": "Amtsgericht Gießen",
      "registernummer": "HRB 3065",
      "registerart": "HRB",
      "company_name": "HöBa Wohn- und Gewerbebau GmbH",
      "company_seat": "Wettenberg",
      "details": "13.03.2025 (Bekanntmachungsdatum)\n\nHessen Amtsgericht Gießen HRB 3065\nLöschungsankündigung\n\nHöBa Wohn- und Gewerbebau GmbH\nGesellschaft mit beschränkter Haftung\nWettenberg\n\nEs ist beabsichtigt, die Gesellschaft wegen Vermögenslosigkeit gemäß § 394 FamFG von Amts wegen zu löschen. Hiergegen kann innerhalb von drei Monaten nach dieser Veröffentlichung Widerspruch beim Amtsgericht Gießen eingelegt werden. Sollte Widerspruch eingelegt werden, dürfte dies nur mit Begründung erfolgversprechend sein. Insbesondere sollte vorhandenes Vermögen der Gesellschaft innerhalb der genannten Frist nachgewiesen werden."
    },
    {
      "date": "2025-03-13",
      "id": "103751",
      "original_text": "Löschungsankündigung\nHessen Amtsgericht Frankfurt am Main HRB 108379\nDelectus GmbH – Frankfurt am Main",
      "type": "Löschungsankündigung",
      "state": "Hessen",
      "amtsgericht": "Amtsgericht Frankfurt am Main",
      "registernummer": "HRB 108379",
      "registerart": "HRB",
      "company_name": "Delectus GmbH",
      "company_seat": "Frankfurt am Main",
      "details": "13.03.2025 (Bekanntmachungsdatum)\n\nHessen Amtsgericht Frankfurt am Main HRB 108379\nLöschungsankündigung\n\nDelectus GmbH\nGesellschaft mit beschränkter Haftung\nFrankfurt am Main\n\nDas Registergericht beabsichtigt die im Handelsregister eingetragene Gesellschaft von Amts wegen nach § 394 FamFG zu löschen. Die Frist zur Erhebung eines Widerspruchs gegen die beabsichtigte Löschung wird auf 1 Monat festgesetzt."
    },
    {
      "date": "2025-03-13",
      "id": "103752",
      "original_text": "Registerbekanntmachung nach dem Umwandlungsgesetz\nHessen Amtsgericht Bad Homburg v.d.H. HRB 10580\nK-Tertia GmbH – Bad Homburg v. d. Höhe",
      "type": "Registerbekanntmachung nach dem Umwandlungsgesetz",
      "state": "Hessen",
      "amtsgericht": "Amtsgericht Bad Homburg v.d.H.",
      "registernummer": "HRB 10580",
      "registerart": "HRB",
      "company_name": "K-Tertia GmbH",
      "company_seat": "Bad Homburg v. d. Höhe",
      "details": "13.03.2025 (Bekanntmachungsdatum)\n\nHessen Amtsgericht Bad Homburg v.d.H. HRB 10580\nRegisterbekanntmachung nach dem Umwandlungsgesetz 13.03.2025 (Eintragungsdatum)\n\nK-Tertia GmbH\nGesellschaft mit beschränkter Haftung\nBad Homburg v. d. Höhe\n\nDen Gläubigern der an der Verschmelzung beteiligten Rechtsträger ist, wenn sie binnen sechs Monaten nach dem Tag, an dem die Eintragung der Verschmelzung in das Register des Sitzes desjenigen Rechtsträgers, dessen Gläubiger sie sind, nach § 19 Absatz 3 UmwG bekannt gemacht worden ist, ihren Anspruch nach Grund und Höhe schriftlich anmelden, Sicherheit zu leisten, soweit sie nicht Befriedigung verlangen können. Dieses Recht steht den Gläubigern jedoch nur zu, wenn sie glaubhaft machen, dass durch die Verschmelzung die Erfüllung ihrer Forderung gefährdet wird."
    },
    {
      "date": "2025-03-13",
      "id": "103753",
      "original_text": "Registerbekanntmachung nach dem Umwandlungsgesetz\nHessen Amtsgericht Bad Homburg v.d.H. HRB 10072\nSusanne Klatten Beteiligungs GmbH – Bad Homburg v. d. Höhe",
      "type": "Registerbekanntmachung nach dem Umwandlungsgesetz",
      "state": "Hessen",
      "amtsgericht": "Amtsgericht Bad Homburg v.d.H.",
      "registernummer": "HRB 10072",
      "registerart": "HRB",
      "company_name": "Susanne Klatten Beteiligungs GmbH",
      "company_seat": "Bad Homburg v. d. Höhe",
      "details": "13.03.2025 (Bekanntmachungsdatum)\n\nHessen Amtsgericht Bad Homburg v.d.H. HRB 10072\nRegisterbekanntmachung nach dem Umwandlungsgesetz 13.03.2025 (Eintragungsdatum)\n\nSusanne Klatten Beteiligungs GmbH\nGesellschaft mit beschränkter Haftung\nBad Homburg v. d. Höhe\n\nDen Gläubigern der an der Verschmelzung beteiligten Rechtsträger ist, wenn sie binnen sechs Monaten nach dem Tag, an dem die Eintragung der Verschmelzung in das Register des Sitzes derjenigen Rechtsträger deren Gläubiger sie sind, nach § 19 Absatz 3 UmwG bekannt gemacht worden ist, ihren Anspruch nach Grund und Höhe schriftlich anmelden, Sicherheit zu leisten, soweit sie nicht Befriedigung verlangen können. Dieses Recht steht den Gläubigern jedoch nur zu, wenn sie glaubhaft machen, dass durch die Verschmelzung die Erfüllung ihrer Forderung gefährdet wird."
    },
    {
      "date": "2025-03-13",
      "id": "103754",
      "original_text": "Sonstige Registerbekanntmachung\nHessen Amtsgericht Bad Hersfeld VR 373\nAquarienverein ROTER NEON Bad Hersfeld e.V. – Bad Hersfeld",
      "type": "Sonstige Registerbekanntmachung",
      "state": "Hessen",
      "amtsgericht": "Amtsgericht Bad Hersfeld",
      "registernummer": "VR 373",
      "registerart": "VR",
      "company_name": "Aquarienverein ROTER NEON Bad Hersfeld e.V.",
      "company_seat": "Bad Hersfeld",
      "details": "13.03.2025 (Bekanntmachungsdatum)\n\nHessen Amtsgericht Bad Hersfeld VR 373\nSonstige Registerbekanntmachung 12.03.2025 (Eintragungsdatum)\n\nAquarienverein ROTER NEON Bad Hersfeld e.V.\neingetragener Verein\nBad Hersfeld\n\nDer Verein ist aufgelöst."
    },
    {
      "date": "2025-03-13",
      "id": "103755",
      "original_text": "Sonstige Registerbekanntmachung\nHessen Amtsgericht Kassel VR 3463\nDeutsche GemeindeGründungsMission – Kassel",
      "type": "Sonstige Registerbekanntmachung",
      "state": "Hessen",
      "amtsgericht": "Amtsgericht Kassel",
      "registernummer": "VR 3463",
      "registerart": "VR",
      "company_name": "Deutsche GemeindeGründungsMission",
      "company_seat": "Kassel",
      "details": "13.03.2025 (Bekanntmachungsdatum)\n\nHessen Amtsgericht Kassel VR 3463\nSonstige Registerbekanntmachung\n\nDeutsche GemeindeGründungsMission\neingetragener Verein\nKassel\n\nDer Verein ist aufgelöst."
    },
    {
      "date": "2025-03-13",
      "id": "103756",
      "original_text": "Registerbekanntmachung nach dem Umwandlungsgesetz\nHessen Amtsgericht Frankfurt am Main HRB 128542\nGarthe Holding GmbH – Frankfurt am Main",
      "type": "Registerbekanntmachung nach dem Umwandlungsgesetz",
      "state": "Hessen",
      "amtsgericht": "Amtsgericht Frankfurt am Main",
      "registernummer": "HRB 128542",
      "registerart": "HRB",
      "company_name": "Garthe Holding GmbH",
      "company_seat": "Frankfurt am Main",
      "details": "13.03.2025 (Bekanntmachungsdatum)\n\nHessen Amtsgericht Frankfurt am Main HRB 128542\nRegisterbekanntmachung nach dem Umwandlungsgesetz 13.03.2025 (Eintragungsdatum)\n\nGarthe Holding GmbH\nGesellschaft mit beschränkter Haftung\nFrankfurt am Main\n\nDen Gläubigern der an der Verschmelzung beteiligten Rechtsträger ist, wenn sie binnen sechs Monaten nach dem Tag, an dem die Eintragung der Verschmelzung in das Register des Sitzes derjenigen Rechtsträger deren Gläubiger sie sind, nach § 19 Absatz 3 UmwG bekannt gemacht worden ist, ihren Anspruch nach Grund und Höhe schriftlich anmelden, Sicherheit zu leisten, soweit sie nicht Befriedigung verlangen können. Dieses Recht steht den Gläubigern jedoch nur zu, wenn sie glaubhaft machen, dass durch die Verschmelzung die Erfüllung ihrer Forderung gefährdet wird."
    },
    {
      "date": "2025-03-13",
      "id": "103757",
      "original_text": "Löschungsankündigung\nHessen Amtsgericht Darmstadt HRB 102825\nPizza 5 UG (haftungsbeschränkt) – Darmstadt",
      "type": "Löschungsankündigung",
      "state": "Hessen",
      "amtsgericht": "Amtsgericht Darmstadt",
      "registernummer": "HRB 102825",
      "registerart": "HRB",
      "company_name": "Pizza 5 UG (haftungsbeschränkt)",
      "company_seat": "Darmstadt",
      "details": "13.03.2025 (Bekanntmachungsdatum)\n\nHessen Amtsgericht Darmstadt HRB 102825\nLöschungsankündigung\n\nPizza 5 UG (haftungsbeschränkt)\nGesellschaft mit beschränkter Haftung\nDarmstadt\n\nDas Registergericht beabsichtigt die im Handelsregister eingetragene Gesellschaft von Amts wegen nach § 394 FamFG zu löschen. Die Frist zur Erhebung eines Widerspruchs gegen die beabsichtigte Löschung wird auf 3 Monate festgesetzt."
    },
    {
      "date": "2025-03-13",
      "id": "103758",
      "original_text": "Löschungsankündigung\nHessen Amtsgericht Offenbach am Main HRB 51442\nFendrych Hausbau GmbH – Offenbach am Main",
      "type": "Löschungsankündigung",
      "state": "Hessen",
      "amtsgericht": "Amtsgericht Offenbach am Main",
      "registernummer": "HRB 51442",
      "registerart": "HRB",
      "company_name": "Fendrych Hausbau GmbH",
      "company_seat": "Offenbach am Main",
      "details": "13.03.2025 (Bekanntmachungsdatum)\n\nHessen Amtsgericht Offenbach am Main HRB 51442\nLöschungsankündigung 13.03.2025 (Eintragungsdatum)\n\nFendrych Hausbau GmbH\nGesellschaft mit beschränkter Haftung\nOffenbach am Main\n\nDas Registergericht beabsichtigt die im Handelsregister eingetragene Gesellschaft von Amts wegen nach § 395 FamFG zu löschen. Die Frist zur Erhebung eines Widerspruchs gegen die beabsichtigte Löschung wird auf 3 Monate festgesetzt."
    },
    {
      "date": "2025-03-13",
      "id": "103759",
      "original_text": "Sonstige Registerbekanntmachung\nHessen Amtsgericht Darmstadt VR 2709\nFörderverein für Kirchenmusik in Mühltal – Mühltal",
      "type": "Sonstige Registerbekanntmachung",
      "state": "Hessen",
      "amtsgericht": "Amtsgericht Darmstadt",
      "registernummer": "VR 2709",
      "registerart": "VR",
      "company_name": "Förderverein für Kirchenmusik in Mühltal",
      "company_seat": "Mühltal",
      "details": "13.03.2025 (Bekanntmachungsdatum)\n\nHessen Amtsgericht Darmstadt VR 2709\nSonstige Registerbekanntmachung 13.03.2025 (Eintragungsdatum)\n\nFörderverein für Kirchenmusik in Mühltal\neingetragener Verein\nMühltal\n\nDer Verein ist aufgelöst."
    }
  ]
}